STDOUT:
Results will be saved in /home/philip/projects/ltspice_examples_code_repo/Circuit-Completion-Using-GNNs/component_classification_with_link_prediction_head/evaluation/FEGIN/results/model_FEGIN_dataset_ltspice_examples
Command line input: python main.py --data ltspice_examples --representation component_net --model FEGIN --layers 2 --hiddens 16 --batch_size 256 --lr 0.001 --emb_size 250 --epochs 100 --save_appendix component_net_L2_H16_BS256_LR0.001_E250 --no_val
 is saved.
-----
ltspice_examples - FEGIN
Using 2 layers, 16 hidden units, h = 2
Loading component_net representation dataset
ENTERED
Training FEGIN on component_net representation
Train: 3558, Test: 846
##################ITERATION #0 ****************************************
 epoch: 0, train_loss: 1.4087, test_loss: 1.3918, test_f1: 0.1004
 epoch: 1, train_loss: 1.3876, test_loss: 1.3821, test_f1: 0.1004
 epoch: 2, train_loss: 1.3740, test_loss: 1.3699, test_f1: 0.1004
 epoch: 3, train_loss: 1.3585, test_loss: 1.3522, test_f1: 0.1703
 epoch: 4, train_loss: 1.3376, test_loss: 1.3266, test_f1: 0.3331
 epoch: 5, train_loss: 1.3141, test_loss: 1.2949, test_f1: 0.2373
 epoch: 6, train_loss: 1.2866, test_loss: 1.2683, test_f1: 0.2285
 epoch: 7, train_loss: 1.2665, test_loss: 1.2492, test_f1: 0.2289
 epoch: 8, train_loss: 1.2531, test_loss: 1.2319, test_f1: 0.2368
 epoch: 9, train_loss: 1.2419, test_loss: 1.2168, test_f1: 0.2439
 epoch: 10, train_loss: 1.2282, test_loss: 1.2013, test_f1: 0.2809
 epoch: 11, train_loss: 1.2103, test_loss: 1.1870, test_f1: 0.2951
 epoch: 12, train_loss: 1.1923, test_loss: 1.1672, test_f1: 0.3666
 epoch: 13, train_loss: 1.1843, test_loss: 1.1479, test_f1: 0.3812
 epoch: 14, train_loss: 1.1663, test_loss: 1.1283, test_f1: 0.3989
 epoch: 15, train_loss: 1.1469, test_loss: 1.1060, test_f1: 0.3982
 epoch: 16, train_loss: 1.1298, test_loss: 1.0980, test_f1: 0.4017
 epoch: 17, train_loss: 1.1122, test_loss: 1.0834, test_f1: 0.3993
 epoch: 18, train_loss: 1.1105, test_loss: 1.0925, test_f1: 0.3831
 epoch: 19, train_loss: 1.0899, test_loss: 1.0504, test_f1: 0.4244
 epoch: 20, train_loss: 1.0841, test_loss: 1.0530, test_f1: 0.4028
 epoch: 21, train_loss: 1.0717, test_loss: 1.0413, test_f1: 0.4266
 epoch: 22, train_loss: 1.0578, test_loss: 1.0321, test_f1: 0.4107
 epoch: 23, train_loss: 1.0483, test_loss: 1.0225, test_f1: 0.4242
 epoch: 24, train_loss: 1.0518, test_loss: 1.0238, test_f1: 0.4735
 epoch: 25, train_loss: 1.0325, test_loss: 1.0232, test_f1: 0.4539
 epoch: 26, train_loss: 1.0288, test_loss: 1.0157, test_f1: 0.4622
 epoch: 27, train_loss: 1.0191, test_loss: 1.0009, test_f1: 0.4565
 epoch: 28, train_loss: 1.0206, test_loss: 1.0052, test_f1: 0.4589
 epoch: 29, train_loss: 1.0118, test_loss: 0.9962, test_f1: 0.4469
 epoch: 30, train_loss: 1.0007, test_loss: 0.9860, test_f1: 0.4860
 epoch: 31, train_loss: 1.0058, test_loss: 1.0109, test_f1: 0.4741
 epoch: 32, train_loss: 0.9989, test_loss: 0.9819, test_f1: 0.4808
 epoch: 33, train_loss: 0.9933, test_loss: 0.9919, test_f1: 0.4878
 epoch: 34, train_loss: 0.9869, test_loss: 0.9655, test_f1: 0.4950
 epoch: 35, train_loss: 0.9753, test_loss: 0.9758, test_f1: 0.4951
 epoch: 36, train_loss: 0.9762, test_loss: 0.9684, test_f1: 0.4811
 epoch: 37, train_loss: 0.9769, test_loss: 1.0026, test_f1: 0.5067
 epoch: 38, train_loss: 0.9797, test_loss: 0.9754, test_f1: 0.4790
 epoch: 39, train_loss: 0.9704, test_loss: 0.9605, test_f1: 0.4854
 epoch: 40, train_loss: 0.9625, test_loss: 0.9566, test_f1: 0.4950
 epoch: 41, train_loss: 0.9679, test_loss: 0.9931, test_f1: 0.5004
 epoch: 42, train_loss: 0.9696, test_loss: 0.9656, test_f1: 0.4952
 epoch: 43, train_loss: 0.9573, test_loss: 0.9548, test_f1: 0.4965
 epoch: 44, train_loss: 0.9544, test_loss: 0.9545, test_f1: 0.5204
 epoch: 45, train_loss: 0.9547, test_loss: 0.9599, test_f1: 0.5100
 epoch: 46, train_loss: 0.9423, test_loss: 0.9375, test_f1: 0.5070
 epoch: 47, train_loss: 0.9323, test_loss: 0.9493, test_f1: 0.5245
 epoch: 48, train_loss: 0.9415, test_loss: 0.9254, test_f1: 0.5138
 epoch: 49, train_loss: 0.9307, test_loss: 0.9599, test_f1: 0.5162
 epoch: 50, train_loss: 0.9408, test_loss: 0.9323, test_f1: 0.5323
 epoch: 51, train_loss: 0.9307, test_loss: 0.9682, test_f1: 0.5262
 epoch: 52, train_loss: 0.9303, test_loss: 0.9305, test_f1: 0.5200
 epoch: 53, train_loss: 0.9235, test_loss: 0.9392, test_f1: 0.5208
 epoch: 54, train_loss: 0.9227, test_loss: 0.9312, test_f1: 0.5216
 epoch: 55, train_loss: 0.9254, test_loss: 0.9623, test_f1: 0.5273
 epoch: 56, train_loss: 0.9216, test_loss: 0.9288, test_f1: 0.5237
 epoch: 57, train_loss: 0.9276, test_loss: 0.9217, test_f1: 0.5284
 epoch: 58, train_loss: 0.9246, test_loss: 0.9525, test_f1: 0.5289
 epoch: 59, train_loss: 0.9258, test_loss: 0.9199, test_f1: 0.5217
 epoch: 60, train_loss: 0.9204, test_loss: 0.9535, test_f1: 0.5257
 epoch: 61, train_loss: 0.9238, test_loss: 0.9306, test_f1: 0.5361
 epoch: 62, train_loss: 0.9205, test_loss: 0.9498, test_f1: 0.5336
 epoch: 63, train_loss: 0.9147, test_loss: 0.9517, test_f1: 0.5323
 epoch: 64, train_loss: 0.9124, test_loss: 0.9284, test_f1: 0.5308
 epoch: 65, train_loss: 0.9170, test_loss: 0.9408, test_f1: 0.5353
 epoch: 66, train_loss: 0.9183, test_loss: 0.9360, test_f1: 0.5302
 epoch: 67, train_loss: 0.9060, test_loss: 0.9333, test_f1: 0.5239
 epoch: 68, train_loss: 0.9094, test_loss: 0.9316, test_f1: 0.5245
 epoch: 69, train_loss: 0.9069, test_loss: 0.9446, test_f1: 0.5378
 epoch: 70, train_loss: 0.9131, test_loss: 0.9266, test_f1: 0.5265
 epoch: 71, train_loss: 0.9104, test_loss: 0.9305, test_f1: 0.5307
 epoch: 72, train_loss: 0.9096, test_loss: 0.9488, test_f1: 0.5399
 epoch: 73, train_loss: 0.9017, test_loss: 0.9423, test_f1: 0.5283
 epoch: 74, train_loss: 0.9063, test_loss: 0.9265, test_f1: 0.5319
 epoch: 75, train_loss: 0.9029, test_loss: 0.9458, test_f1: 0.5379
 epoch: 76, train_loss: 0.9026, test_loss: 0.9379, test_f1: 0.5285
 epoch: 77, train_loss: 0.8990, test_loss: 0.9435, test_f1: 0.5392
 epoch: 78, train_loss: 0.9068, test_loss: 0.9276, test_f1: 0.5201
 epoch: 79, train_loss: 0.9012, test_loss: 0.9624, test_f1: 0.5367
 epoch: 80, train_loss: 0.9047, test_loss: 0.9142, test_f1: 0.5343
 epoch: 81, train_loss: 0.9007, test_loss: 0.9540, test_f1: 0.5300
 epoch: 82, train_loss: 0.8936, test_loss: 0.9381, test_f1: 0.5224
 epoch: 83, train_loss: 0.8949, test_loss: 0.9275, test_f1: 0.5369
 epoch: 84, train_loss: 0.8953, test_loss: 0.9257, test_f1: 0.5363
 epoch: 85, train_loss: 0.8911, test_loss: 0.9389, test_f1: 0.5367
 epoch: 86, train_loss: 0.8947, test_loss: 0.9404, test_f1: 0.5350
 epoch: 87, train_loss: 0.8835, test_loss: 0.9401, test_f1: 0.5268
 epoch: 88, train_loss: 0.8945, test_loss: 0.9305, test_f1: 0.5379
 epoch: 89, train_loss: 0.9053, test_loss: 0.9384, test_f1: 0.5308
 epoch: 90, train_loss: 0.8953, test_loss: 0.9212, test_f1: 0.5301
 epoch: 91, train_loss: 0.8950, test_loss: 0.9259, test_f1: 0.5378
 epoch: 92, train_loss: 0.8904, test_loss: 0.9546, test_f1: 0.5350
 epoch: 93, train_loss: 0.8928, test_loss: 0.9355, test_f1: 0.5345
 epoch: 94, train_loss: 0.8858, test_loss: 0.9308, test_f1: 0.5351
 epoch: 95, train_loss: 0.8867, test_loss: 0.9333, test_f1: 0.5266
 epoch: 96, train_loss: 0.8833, test_loss: 0.9426, test_f1: 0.5327
 epoch: 97, train_loss: 0.8853, test_loss: 0.9521, test_f1: 0.5365
 epoch: 98, train_loss: 0.8845, test_loss: 0.9387, test_f1: 0.5139
 epoch: 99, train_loss: 0.8934, test_loss: 0.9658, test_f1: 0.5335
##################ITERATION #1 ****************************************
 epoch: 0, train_loss: 1.3277, test_loss: 1.3348, test_f1: 0.1004
 epoch: 1, train_loss: 1.2863, test_loss: 1.3138, test_f1: 0.2270
 epoch: 2, train_loss: 1.2608, test_loss: 1.2706, test_f1: 0.2270
 epoch: 3, train_loss: 1.2380, test_loss: 1.2240, test_f1: 0.2506
 epoch: 4, train_loss: 1.2183, test_loss: 1.1869, test_f1: 0.3203
 epoch: 5, train_loss: 1.1946, test_loss: 1.1521, test_f1: 0.3251
 epoch: 6, train_loss: 1.1687, test_loss: 1.1219, test_f1: 0.3360
 epoch: 7, train_loss: 1.1454, test_loss: 1.1033, test_f1: 0.3438
 epoch: 8, train_loss: 1.1253, test_loss: 1.0878, test_f1: 0.3523
 epoch: 9, train_loss: 1.1114, test_loss: 1.0747, test_f1: 0.3794
 epoch: 10, train_loss: 1.0997, test_loss: 1.0582, test_f1: 0.3788
 epoch: 11, train_loss: 1.0904, test_loss: 1.0522, test_f1: 0.3947
 epoch: 12, train_loss: 1.0748, test_loss: 1.0437, test_f1: 0.4015
 epoch: 13, train_loss: 1.0683, test_loss: 1.0352, test_f1: 0.4036
 epoch: 14, train_loss: 1.0654, test_loss: 1.0308, test_f1: 0.4191
 epoch: 15, train_loss: 1.0517, test_loss: 1.0245, test_f1: 0.4183
 epoch: 16, train_loss: 1.0473, test_loss: 1.0242, test_f1: 0.4300
 epoch: 17, train_loss: 1.0309, test_loss: 1.0132, test_f1: 0.4345
 epoch: 18, train_loss: 1.0324, test_loss: 1.0129, test_f1: 0.4289
 epoch: 19, train_loss: 1.0237, test_loss: 1.0189, test_f1: 0.4488
 epoch: 20, train_loss: 1.0085, test_loss: 1.0032, test_f1: 0.4386
 epoch: 21, train_loss: 1.0073, test_loss: 1.0014, test_f1: 0.4436
 epoch: 22, train_loss: 1.0031, test_loss: 1.0079, test_f1: 0.4468
 epoch: 23, train_loss: 0.9953, test_loss: 0.9965, test_f1: 0.4493
 epoch: 24, train_loss: 0.9879, test_loss: 0.9921, test_f1: 0.4470
 epoch: 25, train_loss: 0.9915, test_loss: 0.9935, test_f1: 0.4616
 epoch: 26, train_loss: 0.9803, test_loss: 1.0016, test_f1: 0.4793
 epoch: 27, train_loss: 0.9746, test_loss: 0.9965, test_f1: 0.4546
 epoch: 28, train_loss: 0.9705, test_loss: 0.9872, test_f1: 0.4578
 epoch: 29, train_loss: 0.9721, test_loss: 0.9890, test_f1: 0.4739
 epoch: 30, train_loss: 0.9677, test_loss: 0.9730, test_f1: 0.4839
 epoch: 31, train_loss: 0.9611, test_loss: 0.9792, test_f1: 0.4865
 epoch: 32, train_loss: 0.9530, test_loss: 0.9702, test_f1: 0.4896
 epoch: 33, train_loss: 0.9560, test_loss: 0.9731, test_f1: 0.4926
 epoch: 34, train_loss: 0.9491, test_loss: 0.9758, test_f1: 0.4942
 epoch: 35, train_loss: 0.9471, test_loss: 0.9820, test_f1: 0.4998
 epoch: 36, train_loss: 0.9437, test_loss: 0.9819, test_f1: 0.4960
 epoch: 37, train_loss: 0.9435, test_loss: 0.9683, test_f1: 0.4986
 epoch: 38, train_loss: 0.9394, test_loss: 0.9879, test_f1: 0.4848
 epoch: 39, train_loss: 0.9302, test_loss: 0.9778, test_f1: 0.4855
 epoch: 40, train_loss: 0.9308, test_loss: 0.9846, test_f1: 0.4909
 epoch: 41, train_loss: 0.9284, test_loss: 0.9669, test_f1: 0.5041
 epoch: 42, train_loss: 0.9186, test_loss: 0.9927, test_f1: 0.4859
 epoch: 43, train_loss: 0.9318, test_loss: 0.9687, test_f1: 0.5021
 epoch: 44, train_loss: 0.9183, test_loss: 0.9676, test_f1: 0.5008
 epoch: 45, train_loss: 0.9143, test_loss: 0.9698, test_f1: 0.5125
 epoch: 46, train_loss: 0.9144, test_loss: 0.9836, test_f1: 0.5015
 epoch: 47, train_loss: 0.9120, test_loss: 0.9757, test_f1: 0.5131
 epoch: 48, train_loss: 0.9142, test_loss: 0.9231, test_f1: 0.5117
 epoch: 49, train_loss: 0.9003, test_loss: 0.9913, test_f1: 0.5080
 epoch: 50, train_loss: 0.9058, test_loss: 0.9627, test_f1: 0.5125
 epoch: 51, train_loss: 0.9098, test_loss: 0.9655, test_f1: 0.5085
 epoch: 52, train_loss: 0.8969, test_loss: 0.9677, test_f1: 0.5124
 epoch: 53, train_loss: 0.8891, test_loss: 0.9612, test_f1: 0.5134
 epoch: 54, train_loss: 0.8947, test_loss: 0.9800, test_f1: 0.5142
 epoch: 55, train_loss: 0.8965, test_loss: 0.9704, test_f1: 0.5087
 epoch: 56, train_loss: 0.8895, test_loss: 0.9665, test_f1: 0.5082
 epoch: 57, train_loss: 0.8944, test_loss: 0.9698, test_f1: 0.5109
 epoch: 58, train_loss: 0.8858, test_loss: 0.9859, test_f1: 0.5116
 epoch: 59, train_loss: 0.8863, test_loss: 0.9711, test_f1: 0.5098
 epoch: 60, train_loss: 0.8928, test_loss: 0.9809, test_f1: 0.5166
 epoch: 61, train_loss: 0.8818, test_loss: 0.9736, test_f1: 0.5150
 epoch: 62, train_loss: 0.8832, test_loss: 0.9864, test_f1: 0.5146
 epoch: 63, train_loss: 0.8822, test_loss: 0.9872, test_f1: 0.5119
 epoch: 64, train_loss: 0.8846, test_loss: 0.9879, test_f1: 0.5097
 epoch: 65, train_loss: 0.8889, test_loss: 0.9729, test_f1: 0.5145
 epoch: 66, train_loss: 0.8838, test_loss: 0.9804, test_f1: 0.5134
 epoch: 67, train_loss: 0.8797, test_loss: 0.9791, test_f1: 0.5070
 epoch: 68, train_loss: 0.8759, test_loss: 0.9917, test_f1: 0.5135
 epoch: 69, train_loss: 0.8708, test_loss: 0.9973, test_f1: 0.5126
 epoch: 70, train_loss: 0.8762, test_loss: 0.9856, test_f1: 0.5108
 epoch: 71, train_loss: 0.8721, test_loss: 0.9978, test_f1: 0.5131
 epoch: 72, train_loss: 0.8785, test_loss: 0.9744, test_f1: 0.5236
 epoch: 73, train_loss: 0.8770, test_loss: 1.0059, test_f1: 0.5047
 epoch: 74, train_loss: 0.8718, test_loss: 0.9950, test_f1: 0.5061
 epoch: 75, train_loss: 0.8778, test_loss: 0.9794, test_f1: 0.5204
 epoch: 76, train_loss: 0.8731, test_loss: 0.9946, test_f1: 0.5204
 epoch: 77, train_loss: 0.8643, test_loss: 0.9877, test_f1: 0.5125
 epoch: 78, train_loss: 0.8669, test_loss: 0.9896, test_f1: 0.5025
 epoch: 79, train_loss: 0.8716, test_loss: 0.9908, test_f1: 0.5052
 epoch: 80, train_loss: 0.8742, test_loss: 1.0082, test_f1: 0.5063
 epoch: 81, train_loss: 0.8603, test_loss: 0.9803, test_f1: 0.5049
 epoch: 82, train_loss: 0.8623, test_loss: 0.9989, test_f1: 0.5123
 epoch: 83, train_loss: 0.8606, test_loss: 1.0012, test_f1: 0.5281
 epoch: 84, train_loss: 0.8681, test_loss: 1.0211, test_f1: 0.5069
 epoch: 85, train_loss: 0.8683, test_loss: 1.0014, test_f1: 0.5035
 epoch: 86, train_loss: 0.8633, test_loss: 1.0035, test_f1: 0.5062
 epoch: 87, train_loss: 0.8661, test_loss: 0.9948, test_f1: 0.5140
 epoch: 88, train_loss: 0.8513, test_loss: 1.0012, test_f1: 0.5213
 epoch: 89, train_loss: 0.8570, test_loss: 1.0231, test_f1: 0.5186
 epoch: 90, train_loss: 0.8669, test_loss: 1.0105, test_f1: 0.5239
 epoch: 91, train_loss: 0.8482, test_loss: 0.9844, test_f1: 0.5161
 epoch: 92, train_loss: 0.8600, test_loss: 1.0010, test_f1: 0.5097
 epoch: 93, train_loss: 0.8571, test_loss: 1.0013, test_f1: 0.5330
 epoch: 94, train_loss: 0.8586, test_loss: 1.0279, test_f1: 0.5136
 epoch: 95, train_loss: 0.8577, test_loss: 1.0225, test_f1: 0.5049
 epoch: 96, train_loss: 0.8514, test_loss: 0.9981, test_f1: 0.5145
 epoch: 97, train_loss: 0.8501, test_loss: 1.0175, test_f1: 0.5192
 epoch: 98, train_loss: 0.8555, test_loss: 1.0073, test_f1: 0.5341
 epoch: 99, train_loss: 0.8574, test_loss: 1.0222, test_f1: 0.5177
##################ITERATION #2 ****************************************
 epoch: 0, train_loss: 1.2952, test_loss: 1.3142, test_f1: 0.2270
 epoch: 1, train_loss: 1.2400, test_loss: 1.3001, test_f1: 0.2270
 epoch: 2, train_loss: 1.2194, test_loss: 1.2556, test_f1: 0.2270
 epoch: 3, train_loss: 1.1942, test_loss: 1.2048, test_f1: 0.2283
 epoch: 4, train_loss: 1.1762, test_loss: 1.1545, test_f1: 0.3070
 epoch: 5, train_loss: 1.1472, test_loss: 1.1127, test_f1: 0.3836
 epoch: 6, train_loss: 1.1284, test_loss: 1.0889, test_f1: 0.4008
 epoch: 7, train_loss: 1.1125, test_loss: 1.0661, test_f1: 0.4160
 epoch: 8, train_loss: 1.0886, test_loss: 1.0523, test_f1: 0.4011
 epoch: 9, train_loss: 1.0767, test_loss: 1.0282, test_f1: 0.3948
 epoch: 10, train_loss: 1.0590, test_loss: 1.0150, test_f1: 0.4245
 epoch: 11, train_loss: 1.0474, test_loss: 1.0044, test_f1: 0.4278
 epoch: 12, train_loss: 1.0367, test_loss: 1.0095, test_f1: 0.4339
 epoch: 13, train_loss: 1.0158, test_loss: 0.9835, test_f1: 0.4541
 epoch: 14, train_loss: 1.0138, test_loss: 1.0093, test_f1: 0.4406
 epoch: 15, train_loss: 1.0122, test_loss: 0.9899, test_f1: 0.4520
 epoch: 16, train_loss: 1.0040, test_loss: 0.9684, test_f1: 0.4730
 epoch: 17, train_loss: 0.9942, test_loss: 0.9708, test_f1: 0.4746
 epoch: 18, train_loss: 0.9901, test_loss: 0.9684, test_f1: 0.4882
 epoch: 19, train_loss: 0.9950, test_loss: 0.9559, test_f1: 0.4895
 epoch: 20, train_loss: 0.9791, test_loss: 0.9847, test_f1: 0.4707
 epoch: 21, train_loss: 0.9623, test_loss: 0.9577, test_f1: 0.4914
 epoch: 22, train_loss: 0.9597, test_loss: 0.9577, test_f1: 0.4871
 epoch: 23, train_loss: 0.9612, test_loss: 0.9699, test_f1: 0.4623
 epoch: 24, train_loss: 0.9579, test_loss: 0.9736, test_f1: 0.4700
 epoch: 25, train_loss: 0.9506, test_loss: 0.9498, test_f1: 0.4788
 epoch: 26, train_loss: 0.9552, test_loss: 0.9669, test_f1: 0.4714
 epoch: 27, train_loss: 0.9503, test_loss: 0.9490, test_f1: 0.4932
 epoch: 28, train_loss: 0.9559, test_loss: 0.9825, test_f1: 0.4802
 epoch: 29, train_loss: 0.9489, test_loss: 0.9354, test_f1: 0.5074
 epoch: 30, train_loss: 0.9350, test_loss: 0.9405, test_f1: 0.5048
 epoch: 31, train_loss: 0.9329, test_loss: 0.9513, test_f1: 0.4757
 epoch: 32, train_loss: 0.9352, test_loss: 0.9579, test_f1: 0.5029
 epoch: 33, train_loss: 0.9348, test_loss: 0.9373, test_f1: 0.4998
 epoch: 34, train_loss: 0.9316, test_loss: 0.9325, test_f1: 0.5137
 epoch: 35, train_loss: 0.9163, test_loss: 0.9194, test_f1: 0.5192
 epoch: 36, train_loss: 0.9144, test_loss: 0.9603, test_f1: 0.5131
 epoch: 37, train_loss: 0.9136, test_loss: 0.9317, test_f1: 0.5105
 epoch: 38, train_loss: 0.9140, test_loss: 0.9246, test_f1: 0.5147
 epoch: 39, train_loss: 0.9224, test_loss: 0.9868, test_f1: 0.4554
 epoch: 40, train_loss: 0.9206, test_loss: 0.9334, test_f1: 0.5039
 epoch: 41, train_loss: 0.9118, test_loss: 0.9198, test_f1: 0.5100
 epoch: 42, train_loss: 0.9063, test_loss: 0.9257, test_f1: 0.4977
 epoch: 43, train_loss: 0.9113, test_loss: 0.9346, test_f1: 0.5131
 epoch: 44, train_loss: 0.9065, test_loss: 0.9312, test_f1: 0.5139
 epoch: 45, train_loss: 0.9007, test_loss: 0.9272, test_f1: 0.5119
 epoch: 46, train_loss: 0.9182, test_loss: 0.9267, test_f1: 0.5092
 epoch: 47, train_loss: 0.8979, test_loss: 0.9236, test_f1: 0.5156
 epoch: 48, train_loss: 0.8974, test_loss: 0.9355, test_f1: 0.5219
 epoch: 49, train_loss: 0.8995, test_loss: 0.9199, test_f1: 0.5125
 epoch: 50, train_loss: 0.8920, test_loss: 0.9108, test_f1: 0.5206
 epoch: 51, train_loss: 0.8963, test_loss: 0.9182, test_f1: 0.5133
 epoch: 52, train_loss: 0.8833, test_loss: 0.9193, test_f1: 0.5231
 epoch: 53, train_loss: 0.8921, test_loss: 0.9237, test_f1: 0.5215
 epoch: 54, train_loss: 0.8925, test_loss: 0.9320, test_f1: 0.5231
 epoch: 55, train_loss: 0.8877, test_loss: 0.9417, test_f1: 0.5189
 epoch: 56, train_loss: 0.8891, test_loss: 0.9409, test_f1: 0.5196
 epoch: 57, train_loss: 0.9006, test_loss: 0.9372, test_f1: 0.5160
 epoch: 58, train_loss: 0.8848, test_loss: 0.9276, test_f1: 0.5180
 epoch: 59, train_loss: 0.8765, test_loss: 0.9380, test_f1: 0.5198
 epoch: 60, train_loss: 0.8826, test_loss: 0.9265, test_f1: 0.5111
 epoch: 61, train_loss: 0.8834, test_loss: 0.9336, test_f1: 0.5183
 epoch: 62, train_loss: 0.8850, test_loss: 0.9407, test_f1: 0.5240
 epoch: 63, train_loss: 0.8755, test_loss: 0.9259, test_f1: 0.5217
 epoch: 64, train_loss: 0.8741, test_loss: 0.9322, test_f1: 0.5246
 epoch: 65, train_loss: 0.8801, test_loss: 0.9395, test_f1: 0.5173
 epoch: 66, train_loss: 0.8799, test_loss: 0.9477, test_f1: 0.5219
 epoch: 67, train_loss: 0.8782, test_loss: 0.9327, test_f1: 0.5173
 epoch: 68, train_loss: 0.8769, test_loss: 0.9537, test_f1: 0.5253
 epoch: 69, train_loss: 0.8748, test_loss: 0.9410, test_f1: 0.5227
 epoch: 70, train_loss: 0.8780, test_loss: 0.9433, test_f1: 0.5176
 epoch: 71, train_loss: 0.8743, test_loss: 0.9439, test_f1: 0.5277
 epoch: 72, train_loss: 0.8598, test_loss: 0.9494, test_f1: 0.5158
 epoch: 73, train_loss: 0.8693, test_loss: 0.9480, test_f1: 0.5295
 epoch: 74, train_loss: 0.8652, test_loss: 0.9416, test_f1: 0.5232
 epoch: 75, train_loss: 0.8732, test_loss: 0.9464, test_f1: 0.5250
 epoch: 76, train_loss: 0.8666, test_loss: 0.9423, test_f1: 0.5270
 epoch: 77, train_loss: 0.8712, test_loss: 0.9460, test_f1: 0.5237
 epoch: 78, train_loss: 0.8678, test_loss: 0.9526, test_f1: 0.5235
 epoch: 79, train_loss: 0.8689, test_loss: 0.9395, test_f1: 0.5245
 epoch: 80, train_loss: 0.8721, test_loss: 0.9397, test_f1: 0.5183
 epoch: 81, train_loss: 0.8749, test_loss: 0.9467, test_f1: 0.5294
 epoch: 82, train_loss: 0.8755, test_loss: 0.9484, test_f1: 0.5193
 epoch: 83, train_loss: 0.8682, test_loss: 0.9508, test_f1: 0.5259
 epoch: 84, train_loss: 0.8657, test_loss: 0.9448, test_f1: 0.5293
 epoch: 85, train_loss: 0.8605, test_loss: 0.9622, test_f1: 0.5265
 epoch: 86, train_loss: 0.8656, test_loss: 0.9455, test_f1: 0.5236
 epoch: 87, train_loss: 0.8617, test_loss: 0.9493, test_f1: 0.5246
 epoch: 88, train_loss: 0.8669, test_loss: 0.9513, test_f1: 0.5316
 epoch: 89, train_loss: 0.8661, test_loss: 0.9447, test_f1: 0.5254
 epoch: 90, train_loss: 0.8578, test_loss: 0.9524, test_f1: 0.5269
 epoch: 91, train_loss: 0.8631, test_loss: 0.9437, test_f1: 0.5243
 epoch: 92, train_loss: 0.8577, test_loss: 0.9601, test_f1: 0.5275
 epoch: 93, train_loss: 0.8592, test_loss: 0.9550, test_f1: 0.5280
 epoch: 94, train_loss: 0.8569, test_loss: 0.9644, test_f1: 0.5282
 epoch: 95, train_loss: 0.8643, test_loss: 0.9550, test_f1: 0.5259
 epoch: 96, train_loss: 0.8654, test_loss: 0.9498, test_f1: 0.5281
 epoch: 97, train_loss: 0.8597, test_loss: 0.9544, test_f1: 0.5295
 epoch: 98, train_loss: 0.8497, test_loss: 0.9717, test_f1: 0.5272
 epoch: 99, train_loss: 0.8486, test_loss: 0.9624, test_f1: 0.5203
##################ITERATION #3 ****************************************
 epoch: 0, train_loss: 1.2934, test_loss: 1.3165, test_f1: 0.2270
 epoch: 1, train_loss: 1.2365, test_loss: 1.2911, test_f1: 0.2270
 epoch: 2, train_loss: 1.2071, test_loss: 1.2616, test_f1: 0.2270
 epoch: 3, train_loss: 1.1911, test_loss: 1.2248, test_f1: 0.2295
 epoch: 4, train_loss: 1.1745, test_loss: 1.1880, test_f1: 0.2561
 epoch: 5, train_loss: 1.1604, test_loss: 1.1382, test_f1: 0.3402
 epoch: 6, train_loss: 1.1521, test_loss: 1.1093, test_f1: 0.3498
 epoch: 7, train_loss: 1.1377, test_loss: 1.0901, test_f1: 0.3752
 epoch: 8, train_loss: 1.1233, test_loss: 1.0732, test_f1: 0.3767
 epoch: 9, train_loss: 1.1210, test_loss: 1.0726, test_f1: 0.3935
 epoch: 10, train_loss: 1.1085, test_loss: 1.0516, test_f1: 0.4010
 epoch: 11, train_loss: 1.1013, test_loss: 1.0457, test_f1: 0.4038
 epoch: 12, train_loss: 1.0925, test_loss: 1.0383, test_f1: 0.3980
 epoch: 13, train_loss: 1.0755, test_loss: 1.0245, test_f1: 0.4065
 epoch: 14, train_loss: 1.0708, test_loss: 1.0177, test_f1: 0.4232
 epoch: 15, train_loss: 1.0715, test_loss: 1.0224, test_f1: 0.4008
 epoch: 16, train_loss: 1.0595, test_loss: 1.0114, test_f1: 0.4218
 epoch: 17, train_loss: 1.0630, test_loss: 1.0075, test_f1: 0.4323
 epoch: 18, train_loss: 1.0474, test_loss: 1.0210, test_f1: 0.4195
 epoch: 19, train_loss: 1.0494, test_loss: 1.0049, test_f1: 0.4276
 epoch: 20, train_loss: 1.0425, test_loss: 1.0048, test_f1: 0.4296
 epoch: 21, train_loss: 1.0278, test_loss: 0.9957, test_f1: 0.4423
 epoch: 22, train_loss: 1.0277, test_loss: 1.0039, test_f1: 0.4454
 epoch: 23, train_loss: 1.0192, test_loss: 1.0081, test_f1: 0.4572
 epoch: 24, train_loss: 1.0135, test_loss: 1.0051, test_f1: 0.4466
 epoch: 25, train_loss: 1.0099, test_loss: 1.0021, test_f1: 0.4555
 epoch: 26, train_loss: 1.0050, test_loss: 0.9941, test_f1: 0.4510
 epoch: 27, train_loss: 1.0004, test_loss: 1.0003, test_f1: 0.4638
 epoch: 28, train_loss: 0.9969, test_loss: 1.0010, test_f1: 0.4723
 epoch: 29, train_loss: 0.9878, test_loss: 0.9990, test_f1: 0.4708
 epoch: 30, train_loss: 0.9841, test_loss: 0.9961, test_f1: 0.4790
 epoch: 31, train_loss: 0.9806, test_loss: 0.9893, test_f1: 0.4729
 epoch: 32, train_loss: 0.9846, test_loss: 1.0008, test_f1: 0.4662
 epoch: 33, train_loss: 0.9810, test_loss: 0.9941, test_f1: 0.4751
 epoch: 34, train_loss: 0.9792, test_loss: 0.9930, test_f1: 0.4806
 epoch: 35, train_loss: 0.9708, test_loss: 0.9941, test_f1: 0.4624
 epoch: 36, train_loss: 0.9762, test_loss: 0.9843, test_f1: 0.4779
 epoch: 37, train_loss: 0.9641, test_loss: 0.9953, test_f1: 0.4735
 epoch: 38, train_loss: 0.9639, test_loss: 0.9860, test_f1: 0.4790
 epoch: 39, train_loss: 0.9611, test_loss: 0.9951, test_f1: 0.4821
 epoch: 40, train_loss: 0.9650, test_loss: 0.9945, test_f1: 0.4830
 epoch: 41, train_loss: 0.9566, test_loss: 1.0027, test_f1: 0.4775
 epoch: 42, train_loss: 0.9532, test_loss: 0.9975, test_f1: 0.4682
 epoch: 43, train_loss: 0.9541, test_loss: 0.9931, test_f1: 0.4849
 epoch: 44, train_loss: 0.9647, test_loss: 0.9985, test_f1: 0.4826
 epoch: 45, train_loss: 0.9539, test_loss: 0.9812, test_f1: 0.4810
 epoch: 46, train_loss: 0.9465, test_loss: 0.9789, test_f1: 0.4805
 epoch: 47, train_loss: 0.9490, test_loss: 0.9835, test_f1: 0.4948
 epoch: 48, train_loss: 0.9487, test_loss: 0.9738, test_f1: 0.4931
 epoch: 49, train_loss: 0.9468, test_loss: 0.9906, test_f1: 0.4891
 epoch: 50, train_loss: 0.9530, test_loss: 0.9775, test_f1: 0.4907
 epoch: 51, train_loss: 0.9423, test_loss: 0.9762, test_f1: 0.4976
 epoch: 52, train_loss: 0.9402, test_loss: 0.9789, test_f1: 0.4859
 epoch: 53, train_loss: 0.9413, test_loss: 0.9674, test_f1: 0.4903
 epoch: 54, train_loss: 0.9349, test_loss: 0.9685, test_f1: 0.4942
 epoch: 55, train_loss: 0.9412, test_loss: 0.9626, test_f1: 0.4890
 epoch: 56, train_loss: 0.9346, test_loss: 0.9649, test_f1: 0.4968
 epoch: 57, train_loss: 0.9250, test_loss: 0.9813, test_f1: 0.4923
 epoch: 58, train_loss: 0.9334, test_loss: 0.9651, test_f1: 0.4848
 epoch: 59, train_loss: 0.9313, test_loss: 0.9908, test_f1: 0.4936
 epoch: 60, train_loss: 0.9281, test_loss: 0.9582, test_f1: 0.4959
 epoch: 61, train_loss: 0.9283, test_loss: 0.9665, test_f1: 0.4905
 epoch: 62, train_loss: 0.9226, test_loss: 0.9637, test_f1: 0.4934
 epoch: 63, train_loss: 0.9334, test_loss: 0.9632, test_f1: 0.4946
 epoch: 64, train_loss: 0.9282, test_loss: 0.9722, test_f1: 0.5021
 epoch: 65, train_loss: 0.9210, test_loss: 0.9723, test_f1: 0.4973
 epoch: 66, train_loss: 0.9220, test_loss: 0.9639, test_f1: 0.4982
 epoch: 67, train_loss: 0.9256, test_loss: 0.9766, test_f1: 0.4978
 epoch: 68, train_loss: 0.9236, test_loss: 0.9705, test_f1: 0.4953
 epoch: 69, train_loss: 0.9177, test_loss: 0.9648, test_f1: 0.4994
 epoch: 70, train_loss: 0.9173, test_loss: 0.9696, test_f1: 0.5021
 epoch: 71, train_loss: 0.9143, test_loss: 0.9622, test_f1: 0.4994
 epoch: 72, train_loss: 0.9145, test_loss: 0.9697, test_f1: 0.4962
 epoch: 73, train_loss: 0.9043, test_loss: 0.9621, test_f1: 0.4985
 epoch: 74, train_loss: 0.9090, test_loss: 0.9708, test_f1: 0.5008
 epoch: 75, train_loss: 0.9147, test_loss: 0.9665, test_f1: 0.5035
 epoch: 76, train_loss: 0.9293, test_loss: 0.9623, test_f1: 0.4962
 epoch: 77, train_loss: 0.9063, test_loss: 0.9607, test_f1: 0.5056
 epoch: 78, train_loss: 0.9135, test_loss: 0.9604, test_f1: 0.4992
 epoch: 79, train_loss: 0.9143, test_loss: 0.9632, test_f1: 0.4976
 epoch: 80, train_loss: 0.9088, test_loss: 0.9590, test_f1: 0.4987
 epoch: 81, train_loss: 0.9022, test_loss: 0.9592, test_f1: 0.5023
 epoch: 82, train_loss: 0.9147, test_loss: 0.9607, test_f1: 0.5081
 epoch: 83, train_loss: 0.9079, test_loss: 0.9566, test_f1: 0.4957
 epoch: 84, train_loss: 0.9064, test_loss: 0.9862, test_f1: 0.5041
 epoch: 85, train_loss: 0.9088, test_loss: 0.9605, test_f1: 0.5039
 epoch: 86, train_loss: 0.9069, test_loss: 0.9494, test_f1: 0.5096
 epoch: 87, train_loss: 0.9097, test_loss: 0.9573, test_f1: 0.5062
 epoch: 88, train_loss: 0.9077, test_loss: 0.9586, test_f1: 0.5018
 epoch: 89, train_loss: 0.9063, test_loss: 0.9571, test_f1: 0.5048
 epoch: 90, train_loss: 0.8999, test_loss: 0.9757, test_f1: 0.5095
 epoch: 91, train_loss: 0.9001, test_loss: 0.9593, test_f1: 0.5074
 epoch: 92, train_loss: 0.9046, test_loss: 0.9553, test_f1: 0.5106
 epoch: 93, train_loss: 0.9006, test_loss: 0.9533, test_f1: 0.5058
 epoch: 94, train_loss: 0.8929, test_loss: 0.9495, test_f1: 0.5116
 epoch: 95, train_loss: 0.8906, test_loss: 0.9428, test_f1: 0.5037
 epoch: 96, train_loss: 0.8979, test_loss: 0.9519, test_f1: 0.5078
 epoch: 97, train_loss: 0.9038, test_loss: 0.9882, test_f1: 0.4991
 epoch: 98, train_loss: 0.8978, test_loss: 0.9529, test_f1: 0.5041
 epoch: 99, train_loss: 0.9054, test_loss: 0.9511, test_f1: 0.5088
##################ITERATION #4 ****************************************
 epoch: 0, train_loss: 1.3072, test_loss: 1.3440, test_f1: 0.2270
 epoch: 1, train_loss: 1.2298, test_loss: 1.2878, test_f1: 0.2270
 epoch: 2, train_loss: 1.2016, test_loss: 1.2398, test_f1: 0.2368
 epoch: 3, train_loss: 1.1679, test_loss: 1.1896, test_f1: 0.2825
 epoch: 4, train_loss: 1.1582, test_loss: 1.1418, test_f1: 0.3221
 epoch: 5, train_loss: 1.1377, test_loss: 1.0979, test_f1: 0.3517
 epoch: 6, train_loss: 1.1240, test_loss: 1.0816, test_f1: 0.3562
 epoch: 7, train_loss: 1.1013, test_loss: 1.0546, test_f1: 0.3596
 epoch: 8, train_loss: 1.0852, test_loss: 1.0342, test_f1: 0.3663
 epoch: 9, train_loss: 1.0739, test_loss: 1.0305, test_f1: 0.3804
 epoch: 10, train_loss: 1.0657, test_loss: 1.0231, test_f1: 0.3849
 epoch: 11, train_loss: 1.0621, test_loss: 1.0151, test_f1: 0.4005
 epoch: 12, train_loss: 1.0429, test_loss: 1.0067, test_f1: 0.4318
 epoch: 13, train_loss: 1.0359, test_loss: 1.0011, test_f1: 0.4525
 epoch: 14, train_loss: 1.0275, test_loss: 0.9982, test_f1: 0.4456
 epoch: 15, train_loss: 1.0156, test_loss: 0.9912, test_f1: 0.4662
 epoch: 16, train_loss: 1.0185, test_loss: 0.9959, test_f1: 0.4488
 epoch: 17, train_loss: 1.0053, test_loss: 0.9864, test_f1: 0.4496
 epoch: 18, train_loss: 1.0086, test_loss: 1.0049, test_f1: 0.4389
 epoch: 19, train_loss: 1.0111, test_loss: 0.9850, test_f1: 0.4781
 epoch: 20, train_loss: 1.0045, test_loss: 0.9811, test_f1: 0.4835
 epoch: 21, train_loss: 0.9949, test_loss: 0.9844, test_f1: 0.4840
 epoch: 22, train_loss: 0.9895, test_loss: 0.9684, test_f1: 0.4813
 epoch: 23, train_loss: 0.9938, test_loss: 0.9791, test_f1: 0.4829
 epoch: 24, train_loss: 0.9734, test_loss: 0.9771, test_f1: 0.4812
 epoch: 25, train_loss: 0.9797, test_loss: 0.9731, test_f1: 0.4944
 epoch: 26, train_loss: 0.9747, test_loss: 0.9754, test_f1: 0.4887
 epoch: 27, train_loss: 0.9714, test_loss: 0.9735, test_f1: 0.4918
 epoch: 28, train_loss: 0.9640, test_loss: 0.9620, test_f1: 0.4996
 epoch: 29, train_loss: 0.9588, test_loss: 0.9675, test_f1: 0.4979
 epoch: 30, train_loss: 0.9554, test_loss: 0.9807, test_f1: 0.4870
 epoch: 31, train_loss: 0.9545, test_loss: 0.9695, test_f1: 0.4949
 epoch: 32, train_loss: 0.9412, test_loss: 0.9689, test_f1: 0.4827
 epoch: 33, train_loss: 0.9514, test_loss: 0.9746, test_f1: 0.4977
 epoch: 34, train_loss: 0.9513, test_loss: 0.9786, test_f1: 0.4705
 epoch: 35, train_loss: 0.9373, test_loss: 0.9650, test_f1: 0.4930
 epoch: 36, train_loss: 0.9465, test_loss: 0.9777, test_f1: 0.4982
 epoch: 37, train_loss: 0.9399, test_loss: 0.9595, test_f1: 0.4971
 epoch: 38, train_loss: 0.9284, test_loss: 0.9680, test_f1: 0.4990
 epoch: 39, train_loss: 0.9325, test_loss: 0.9500, test_f1: 0.5028
 epoch: 40, train_loss: 0.9359, test_loss: 0.9546, test_f1: 0.5037
 epoch: 41, train_loss: 0.9416, test_loss: 0.9612, test_f1: 0.4924
 epoch: 42, train_loss: 0.9397, test_loss: 0.9690, test_f1: 0.4978
 epoch: 43, train_loss: 0.9164, test_loss: 0.9692, test_f1: 0.5119
 epoch: 44, train_loss: 0.9249, test_loss: 0.9641, test_f1: 0.4976
 epoch: 45, train_loss: 0.9234, test_loss: 0.9738, test_f1: 0.5048
 epoch: 46, train_loss: 0.9101, test_loss: 0.9754, test_f1: 0.5021
 epoch: 47, train_loss: 0.9228, test_loss: 0.9646, test_f1: 0.5138
 epoch: 48, train_loss: 0.9126, test_loss: 0.9598, test_f1: 0.5044
 epoch: 49, train_loss: 0.9221, test_loss: 0.9607, test_f1: 0.5045
 epoch: 50, train_loss: 0.9111, test_loss: 0.9986, test_f1: 0.4847
 epoch: 51, train_loss: 0.9048, test_loss: 0.9746, test_f1: 0.4981
 epoch: 52, train_loss: 0.8984, test_loss: 0.9597, test_f1: 0.5086
 epoch: 53, train_loss: 0.9102, test_loss: 0.9647, test_f1: 0.5066
 epoch: 54, train_loss: 0.8987, test_loss: 0.9649, test_f1: 0.5083
 epoch: 55, train_loss: 0.9051, test_loss: 0.9701, test_f1: 0.5069
 epoch: 56, train_loss: 0.8946, test_loss: 0.9718, test_f1: 0.5112
 epoch: 57, train_loss: 0.9009, test_loss: 0.9736, test_f1: 0.5014
 epoch: 58, train_loss: 0.9010, test_loss: 0.9775, test_f1: 0.5004
 epoch: 59, train_loss: 0.8962, test_loss: 0.9698, test_f1: 0.5029
 epoch: 60, train_loss: 0.9053, test_loss: 0.9647, test_f1: 0.5061
 epoch: 61, train_loss: 0.8924, test_loss: 0.9618, test_f1: 0.5085
 epoch: 62, train_loss: 0.9036, test_loss: 0.9588, test_f1: 0.5058
 epoch: 63, train_loss: 0.8950, test_loss: 0.9726, test_f1: 0.5027
 epoch: 64, train_loss: 0.8898, test_loss: 0.9692, test_f1: 0.5064
 epoch: 65, train_loss: 0.8965, test_loss: 0.9428, test_f1: 0.5110
 epoch: 66, train_loss: 0.8938, test_loss: 0.9528, test_f1: 0.5052
 epoch: 67, train_loss: 0.8922, test_loss: 0.9587, test_f1: 0.5134
 epoch: 68, train_loss: 0.8828, test_loss: 0.9592, test_f1: 0.5203
 epoch: 69, train_loss: 0.8909, test_loss: 0.9561, test_f1: 0.5149
 epoch: 70, train_loss: 0.8827, test_loss: 0.9694, test_f1: 0.5129
 epoch: 71, train_loss: 0.8815, test_loss: 0.9708, test_f1: 0.5114
 epoch: 72, train_loss: 0.8781, test_loss: 0.9587, test_f1: 0.5148
 epoch: 73, train_loss: 0.8810, test_loss: 0.9742, test_f1: 0.5072
 epoch: 74, train_loss: 0.8840, test_loss: 0.9635, test_f1: 0.5159
 epoch: 75, train_loss: 0.8855, test_loss: 0.9467, test_f1: 0.5126
 epoch: 76, train_loss: 0.8873, test_loss: 0.9427, test_f1: 0.5119
 epoch: 77, train_loss: 0.8844, test_loss: 0.9614, test_f1: 0.5085
 epoch: 78, train_loss: 0.8834, test_loss: 0.9658, test_f1: 0.5199
 epoch: 79, train_loss: 0.8761, test_loss: 0.9550, test_f1: 0.5137
 epoch: 80, train_loss: 0.8789, test_loss: 0.9798, test_f1: 0.5036
 epoch: 81, train_loss: 0.8880, test_loss: 0.9557, test_f1: 0.5119
 epoch: 82, train_loss: 0.8759, test_loss: 0.9602, test_f1: 0.5094
 epoch: 83, train_loss: 0.8750, test_loss: 0.9483, test_f1: 0.5092
 epoch: 84, train_loss: 0.8687, test_loss: 0.9805, test_f1: 0.5074
 epoch: 85, train_loss: 0.8733, test_loss: 0.9861, test_f1: 0.5156
 epoch: 86, train_loss: 0.8763, test_loss: 0.9570, test_f1: 0.5068
 epoch: 87, train_loss: 0.8714, test_loss: 0.9654, test_f1: 0.5155
 epoch: 88, train_loss: 0.8754, test_loss: 0.9673, test_f1: 0.5139
 epoch: 89, train_loss: 0.8781, test_loss: 0.9691, test_f1: 0.5069
 epoch: 90, train_loss: 0.8763, test_loss: 0.9580, test_f1: 0.5153
 epoch: 91, train_loss: 0.8711, test_loss: 0.9603, test_f1: 0.5147
 epoch: 92, train_loss: 0.8756, test_loss: 0.9595, test_f1: 0.5176
 epoch: 93, train_loss: 0.8754, test_loss: 1.0045, test_f1: 0.5018
 epoch: 94, train_loss: 0.8717, test_loss: 0.9498, test_f1: 0.5105
 epoch: 95, train_loss: 0.8787, test_loss: 0.9591, test_f1: 0.5202
 epoch: 96, train_loss: 0.8750, test_loss: 0.9666, test_f1: 0.5113
 epoch: 97, train_loss: 0.8668, test_loss: 0.9545, test_f1: 0.5171
 epoch: 98, train_loss: 0.8669, test_loss: 0.9657, test_f1: 0.5101
 epoch: 99, train_loss: 0.8683, test_loss: 0.9570, test_f1: 0.5163
##################ITERATION #5 ****************************************
 epoch: 0, train_loss: 1.3548, test_loss: 1.3621, test_f1: 0.2270
 epoch: 1, train_loss: 1.2479, test_loss: 1.3088, test_f1: 0.2270
 epoch: 2, train_loss: 1.2179, test_loss: 1.2419, test_f1: 0.2270
 epoch: 3, train_loss: 1.1989, test_loss: 1.1784, test_f1: 0.2952
 epoch: 4, train_loss: 1.1875, test_loss: 1.1528, test_f1: 0.3088
 epoch: 5, train_loss: 1.1720, test_loss: 1.1265, test_f1: 0.3376
 epoch: 6, train_loss: 1.1546, test_loss: 1.1133, test_f1: 0.3382
 epoch: 7, train_loss: 1.1397, test_loss: 1.0989, test_f1: 0.3419
 epoch: 8, train_loss: 1.1280, test_loss: 1.0861, test_f1: 0.3467
 epoch: 9, train_loss: 1.1113, test_loss: 1.0794, test_f1: 0.3538
 epoch: 10, train_loss: 1.0963, test_loss: 1.0752, test_f1: 0.3572
 epoch: 11, train_loss: 1.0851, test_loss: 1.0676, test_f1: 0.3687
 epoch: 12, train_loss: 1.0754, test_loss: 1.0603, test_f1: 0.3743
 epoch: 13, train_loss: 1.0692, test_loss: 1.0210, test_f1: 0.3839
 epoch: 14, train_loss: 1.0577, test_loss: 1.0283, test_f1: 0.3849
 epoch: 15, train_loss: 1.0490, test_loss: 1.0339, test_f1: 0.4044
 epoch: 16, train_loss: 1.0374, test_loss: 1.0030, test_f1: 0.4068
 epoch: 17, train_loss: 1.0331, test_loss: 1.0368, test_f1: 0.4114
 epoch: 18, train_loss: 1.0199, test_loss: 1.0305, test_f1: 0.4136
 epoch: 19, train_loss: 1.0227, test_loss: 0.9975, test_f1: 0.4446
 epoch: 20, train_loss: 1.0168, test_loss: 1.0508, test_f1: 0.4309
 epoch: 21, train_loss: 1.0072, test_loss: 0.9733, test_f1: 0.4466
 epoch: 22, train_loss: 1.0036, test_loss: 0.9989, test_f1: 0.4567
 epoch: 23, train_loss: 0.9917, test_loss: 1.0251, test_f1: 0.4241
 epoch: 24, train_loss: 0.9903, test_loss: 0.9628, test_f1: 0.4526
 epoch: 25, train_loss: 0.9837, test_loss: 0.9622, test_f1: 0.4480
 epoch: 26, train_loss: 0.9711, test_loss: 0.9556, test_f1: 0.4785
 epoch: 27, train_loss: 0.9800, test_loss: 0.9649, test_f1: 0.4752
 epoch: 28, train_loss: 0.9750, test_loss: 0.9739, test_f1: 0.4834
 epoch: 29, train_loss: 0.9622, test_loss: 0.9430, test_f1: 0.4862
 epoch: 30, train_loss: 0.9662, test_loss: 0.9495, test_f1: 0.4697
 epoch: 31, train_loss: 0.9621, test_loss: 0.9499, test_f1: 0.4669
 epoch: 32, train_loss: 0.9609, test_loss: 0.9397, test_f1: 0.4796
 epoch: 33, train_loss: 0.9525, test_loss: 0.9504, test_f1: 0.4807
 epoch: 34, train_loss: 0.9505, test_loss: 0.9374, test_f1: 0.4942
 epoch: 35, train_loss: 0.9532, test_loss: 0.9352, test_f1: 0.4967
 epoch: 36, train_loss: 0.9473, test_loss: 0.9574, test_f1: 0.4991
 epoch: 37, train_loss: 0.9467, test_loss: 0.9348, test_f1: 0.5013
 epoch: 38, train_loss: 0.9493, test_loss: 0.9786, test_f1: 0.4772
 epoch: 39, train_loss: 0.9514, test_loss: 0.9603, test_f1: 0.5021
 epoch: 40, train_loss: 0.9462, test_loss: 0.9926, test_f1: 0.4680
 epoch: 41, train_loss: 0.9380, test_loss: 0.9223, test_f1: 0.5216
 epoch: 42, train_loss: 0.9373, test_loss: 0.9232, test_f1: 0.5004
 epoch: 43, train_loss: 0.9411, test_loss: 0.9302, test_f1: 0.5060
 epoch: 44, train_loss: 0.9321, test_loss: 0.9757, test_f1: 0.4841
 epoch: 45, train_loss: 0.9319, test_loss: 0.9276, test_f1: 0.5084
 epoch: 46, train_loss: 0.9296, test_loss: 0.9487, test_f1: 0.4807
 epoch: 47, train_loss: 0.9310, test_loss: 0.9337, test_f1: 0.5095
 epoch: 48, train_loss: 0.9231, test_loss: 0.9981, test_f1: 0.4999
 epoch: 49, train_loss: 0.9237, test_loss: 0.9336, test_f1: 0.4877
 epoch: 50, train_loss: 0.9322, test_loss: 0.9415, test_f1: 0.5046
 epoch: 51, train_loss: 0.9227, test_loss: 0.9936, test_f1: 0.4912
 epoch: 52, train_loss: 0.9215, test_loss: 0.9374, test_f1: 0.4945
 epoch: 53, train_loss: 0.9182, test_loss: 0.9721, test_f1: 0.4912
 epoch: 54, train_loss: 0.9189, test_loss: 0.9257, test_f1: 0.5125
 epoch: 55, train_loss: 0.9092, test_loss: 0.9075, test_f1: 0.5192
 epoch: 56, train_loss: 0.9135, test_loss: 0.9773, test_f1: 0.4826
 epoch: 57, train_loss: 0.9136, test_loss: 0.9296, test_f1: 0.5013
 epoch: 58, train_loss: 0.9044, test_loss: 0.9563, test_f1: 0.4997
 epoch: 59, train_loss: 0.9141, test_loss: 0.9350, test_f1: 0.5034
 epoch: 60, train_loss: 0.9186, test_loss: 0.9921, test_f1: 0.5039
 epoch: 61, train_loss: 0.9113, test_loss: 0.9193, test_f1: 0.5011
 epoch: 62, train_loss: 0.9111, test_loss: 0.9879, test_f1: 0.4927
 epoch: 63, train_loss: 0.9047, test_loss: 0.9245, test_f1: 0.4886
 epoch: 64, train_loss: 0.9066, test_loss: 0.9198, test_f1: 0.5182
 epoch: 65, train_loss: 0.9083, test_loss: 0.9169, test_f1: 0.5107
 epoch: 66, train_loss: 0.9116, test_loss: 0.9287, test_f1: 0.5094
 epoch: 67, train_loss: 0.9034, test_loss: 0.9462, test_f1: 0.5062
 epoch: 68, train_loss: 0.9021, test_loss: 0.9253, test_f1: 0.5075
 epoch: 69, train_loss: 0.9066, test_loss: 0.9388, test_f1: 0.5137
 epoch: 70, train_loss: 0.9120, test_loss: 0.9893, test_f1: 0.5018
 epoch: 71, train_loss: 0.9042, test_loss: 0.9123, test_f1: 0.5089
 epoch: 72, train_loss: 0.9101, test_loss: 0.9670, test_f1: 0.4971
 epoch: 73, train_loss: 0.9041, test_loss: 0.9784, test_f1: 0.4870
 epoch: 74, train_loss: 0.8948, test_loss: 0.9234, test_f1: 0.4930
 epoch: 75, train_loss: 0.9027, test_loss: 0.9432, test_f1: 0.5079
 epoch: 76, train_loss: 0.9011, test_loss: 0.9382, test_f1: 0.5176
 epoch: 77, train_loss: 0.9035, test_loss: 0.9047, test_f1: 0.5129
 epoch: 78, train_loss: 0.8927, test_loss: 0.9221, test_f1: 0.5025
 epoch: 79, train_loss: 0.9016, test_loss: 0.9105, test_f1: 0.5032
 epoch: 80, train_loss: 0.9000, test_loss: 0.9820, test_f1: 0.5075
 epoch: 81, train_loss: 0.8980, test_loss: 0.9597, test_f1: 0.4973
 epoch: 82, train_loss: 0.8991, test_loss: 0.9102, test_f1: 0.5220
 epoch: 83, train_loss: 0.8931, test_loss: 0.9132, test_f1: 0.5176
 epoch: 84, train_loss: 0.9059, test_loss: 0.9766, test_f1: 0.5060
 epoch: 85, train_loss: 0.9028, test_loss: 0.9279, test_f1: 0.5163
 epoch: 86, train_loss: 0.8970, test_loss: 0.9675, test_f1: 0.5013
 epoch: 87, train_loss: 0.8924, test_loss: 0.9221, test_f1: 0.5187
 epoch: 88, train_loss: 0.8902, test_loss: 0.9957, test_f1: 0.5067
 epoch: 89, train_loss: 0.8981, test_loss: 0.9103, test_f1: 0.5161
 epoch: 90, train_loss: 0.8849, test_loss: 0.9319, test_f1: 0.5191
 epoch: 91, train_loss: 0.8881, test_loss: 1.0005, test_f1: 0.4934
 epoch: 92, train_loss: 0.8904, test_loss: 0.9127, test_f1: 0.5177
 epoch: 93, train_loss: 0.8881, test_loss: 0.9168, test_f1: 0.5066
 epoch: 94, train_loss: 0.8938, test_loss: 0.9366, test_f1: 0.5118
 epoch: 95, train_loss: 0.8870, test_loss: 0.9488, test_f1: 0.4943
 epoch: 96, train_loss: 0.8930, test_loss: 0.8929, test_f1: 0.5357
 epoch: 97, train_loss: 0.8805, test_loss: 0.9902, test_f1: 0.4998
 epoch: 98, train_loss: 0.8870, test_loss: 0.9230, test_f1: 0.5165
 epoch: 99, train_loss: 0.8906, test_loss: 0.9268, test_f1: 0.5145
##################ITERATION #6 ****************************************
 epoch: 0, train_loss: 1.3680, test_loss: 1.3202, test_f1: 0.2270
 epoch: 1, train_loss: 1.2545, test_loss: 1.2609, test_f1: 0.2270
 epoch: 2, train_loss: 1.2156, test_loss: 1.2069, test_f1: 0.2652
 epoch: 3, train_loss: 1.1763, test_loss: 1.1654, test_f1: 0.3191
 epoch: 4, train_loss: 1.1517, test_loss: 1.1335, test_f1: 0.3622
 epoch: 5, train_loss: 1.1384, test_loss: 1.1041, test_f1: 0.3675
 epoch: 6, train_loss: 1.1306, test_loss: 1.0760, test_f1: 0.3918
 epoch: 7, train_loss: 1.1189, test_loss: 1.0789, test_f1: 0.3954
 epoch: 8, train_loss: 1.1107, test_loss: 1.0696, test_f1: 0.3844
 epoch: 9, train_loss: 1.0989, test_loss: 1.0606, test_f1: 0.4053
 epoch: 10, train_loss: 1.0961, test_loss: 1.0659, test_f1: 0.4061
 epoch: 11, train_loss: 1.0812, test_loss: 1.0607, test_f1: 0.4178
 epoch: 12, train_loss: 1.0695, test_loss: 1.0553, test_f1: 0.4152
 epoch: 13, train_loss: 1.0633, test_loss: 1.0449, test_f1: 0.4206
 epoch: 14, train_loss: 1.0468, test_loss: 1.0548, test_f1: 0.4220
 epoch: 15, train_loss: 1.0446, test_loss: 1.0510, test_f1: 0.4143
 epoch: 16, train_loss: 1.0324, test_loss: 1.0389, test_f1: 0.4229
 epoch: 17, train_loss: 1.0367, test_loss: 1.0217, test_f1: 0.4475
 epoch: 18, train_loss: 1.0271, test_loss: 1.0265, test_f1: 0.4444
 epoch: 19, train_loss: 1.0195, test_loss: 1.0345, test_f1: 0.4346
 epoch: 20, train_loss: 1.0185, test_loss: 1.0201, test_f1: 0.4441
 epoch: 21, train_loss: 1.0149, test_loss: 1.0126, test_f1: 0.4475
 epoch: 22, train_loss: 1.0071, test_loss: 1.0236, test_f1: 0.4500
 epoch: 23, train_loss: 1.0059, test_loss: 1.0294, test_f1: 0.4425
 epoch: 24, train_loss: 1.0003, test_loss: 1.0042, test_f1: 0.4626
 epoch: 25, train_loss: 1.0035, test_loss: 1.0100, test_f1: 0.4431
 epoch: 26, train_loss: 0.9964, test_loss: 1.0148, test_f1: 0.4528
 epoch: 27, train_loss: 0.9875, test_loss: 1.0078, test_f1: 0.4558
 epoch: 28, train_loss: 0.9786, test_loss: 1.0096, test_f1: 0.4479
 epoch: 29, train_loss: 0.9840, test_loss: 1.0024, test_f1: 0.4684
 epoch: 30, train_loss: 0.9778, test_loss: 0.9935, test_f1: 0.4713
 epoch: 31, train_loss: 0.9863, test_loss: 0.9878, test_f1: 0.4556
 epoch: 32, train_loss: 0.9761, test_loss: 1.0025, test_f1: 0.4653
 epoch: 33, train_loss: 0.9685, test_loss: 0.9943, test_f1: 0.4671
 epoch: 34, train_loss: 0.9653, test_loss: 0.9932, test_f1: 0.4696
 epoch: 35, train_loss: 0.9622, test_loss: 0.9929, test_f1: 0.4773
 epoch: 36, train_loss: 0.9589, test_loss: 0.9918, test_f1: 0.4713
 epoch: 37, train_loss: 0.9650, test_loss: 0.9935, test_f1: 0.4909
 epoch: 38, train_loss: 0.9506, test_loss: 0.9820, test_f1: 0.4636
 epoch: 39, train_loss: 0.9503, test_loss: 0.9792, test_f1: 0.4686
 epoch: 40, train_loss: 0.9490, test_loss: 0.9689, test_f1: 0.4796
 epoch: 41, train_loss: 0.9505, test_loss: 0.9647, test_f1: 0.4923
 epoch: 42, train_loss: 0.9422, test_loss: 0.9831, test_f1: 0.4867
 epoch: 43, train_loss: 0.9377, test_loss: 0.9702, test_f1: 0.4964
 epoch: 44, train_loss: 0.9356, test_loss: 0.9702, test_f1: 0.4843
 epoch: 45, train_loss: 0.9365, test_loss: 0.9725, test_f1: 0.4998
 epoch: 46, train_loss: 0.9321, test_loss: 0.9691, test_f1: 0.4914
 epoch: 47, train_loss: 0.9376, test_loss: 0.9823, test_f1: 0.4942
 epoch: 48, train_loss: 0.9283, test_loss: 0.9795, test_f1: 0.4979
 epoch: 49, train_loss: 0.9234, test_loss: 0.9823, test_f1: 0.4960
 epoch: 50, train_loss: 0.9221, test_loss: 0.9798, test_f1: 0.5047
 epoch: 51, train_loss: 0.9301, test_loss: 0.9825, test_f1: 0.4998
 epoch: 52, train_loss: 0.9160, test_loss: 0.9779, test_f1: 0.4978
 epoch: 53, train_loss: 0.9268, test_loss: 0.9724, test_f1: 0.4892
 epoch: 54, train_loss: 0.9219, test_loss: 0.9711, test_f1: 0.4977
 epoch: 55, train_loss: 0.9167, test_loss: 0.9656, test_f1: 0.5014
 epoch: 56, train_loss: 0.9124, test_loss: 0.9763, test_f1: 0.5010
 epoch: 57, train_loss: 0.9249, test_loss: 0.9719, test_f1: 0.5093
 epoch: 58, train_loss: 0.9127, test_loss: 0.9680, test_f1: 0.5077
 epoch: 59, train_loss: 0.9156, test_loss: 0.9659, test_f1: 0.5005
 epoch: 60, train_loss: 0.9108, test_loss: 0.9750, test_f1: 0.5056
 epoch: 61, train_loss: 0.9180, test_loss: 0.9701, test_f1: 0.5014
 epoch: 62, train_loss: 0.9032, test_loss: 0.9710, test_f1: 0.5144
 epoch: 63, train_loss: 0.9072, test_loss: 0.9736, test_f1: 0.5096
 epoch: 64, train_loss: 0.9103, test_loss: 0.9749, test_f1: 0.5026
 epoch: 65, train_loss: 0.9101, test_loss: 0.9745, test_f1: 0.5069
 epoch: 66, train_loss: 0.9083, test_loss: 0.9758, test_f1: 0.5115
 epoch: 67, train_loss: 0.9095, test_loss: 0.9749, test_f1: 0.5114
 epoch: 68, train_loss: 0.9094, test_loss: 0.9753, test_f1: 0.5098
 epoch: 69, train_loss: 0.9017, test_loss: 0.9632, test_f1: 0.5072
 epoch: 70, train_loss: 0.8979, test_loss: 0.9718, test_f1: 0.5167
 epoch: 71, train_loss: 0.9040, test_loss: 0.9693, test_f1: 0.5176
 epoch: 72, train_loss: 0.9060, test_loss: 0.9702, test_f1: 0.5077
 epoch: 73, train_loss: 0.9029, test_loss: 0.9757, test_f1: 0.5003
 epoch: 74, train_loss: 0.8958, test_loss: 0.9713, test_f1: 0.5296
 epoch: 75, train_loss: 0.9052, test_loss: 0.9761, test_f1: 0.5044
 epoch: 76, train_loss: 0.9018, test_loss: 0.9730, test_f1: 0.5210
 epoch: 77, train_loss: 0.8986, test_loss: 0.9713, test_f1: 0.5087
 epoch: 78, train_loss: 0.9018, test_loss: 0.9708, test_f1: 0.5165
 epoch: 79, train_loss: 0.9018, test_loss: 0.9761, test_f1: 0.5140
 epoch: 80, train_loss: 0.8952, test_loss: 0.9722, test_f1: 0.5167
 epoch: 81, train_loss: 0.9019, test_loss: 0.9649, test_f1: 0.5178
 epoch: 82, train_loss: 0.8935, test_loss: 0.9672, test_f1: 0.5260
 epoch: 83, train_loss: 0.8930, test_loss: 0.9689, test_f1: 0.5196
 epoch: 84, train_loss: 0.8936, test_loss: 0.9708, test_f1: 0.5152
 epoch: 85, train_loss: 0.8982, test_loss: 0.9723, test_f1: 0.5114
 epoch: 86, train_loss: 0.8891, test_loss: 0.9825, test_f1: 0.5249
 epoch: 87, train_loss: 0.8905, test_loss: 0.9788, test_f1: 0.5098
 epoch: 88, train_loss: 0.8845, test_loss: 0.9731, test_f1: 0.5237
 epoch: 89, train_loss: 0.8928, test_loss: 0.9707, test_f1: 0.5184
 epoch: 90, train_loss: 0.8932, test_loss: 0.9757, test_f1: 0.5114
 epoch: 91, train_loss: 0.8924, test_loss: 0.9750, test_f1: 0.5208
 epoch: 92, train_loss: 0.8996, test_loss: 0.9849, test_f1: 0.5117
 epoch: 93, train_loss: 0.8934, test_loss: 0.9799, test_f1: 0.5241
 epoch: 94, train_loss: 0.8912, test_loss: 0.9849, test_f1: 0.5083
 epoch: 95, train_loss: 0.8889, test_loss: 0.9775, test_f1: 0.5156
 epoch: 96, train_loss: 0.8908, test_loss: 0.9718, test_f1: 0.5246
 epoch: 97, train_loss: 0.8844, test_loss: 0.9730, test_f1: 0.5239
 epoch: 98, train_loss: 0.8908, test_loss: 0.9729, test_f1: 0.5267
 epoch: 99, train_loss: 0.8853, test_loss: 0.9825, test_f1: 0.5259
##################ITERATION #7 ****************************************
 epoch: 0, train_loss: 1.3964, test_loss: 1.3186, test_f1: 0.2270
 epoch: 1, train_loss: 1.2706, test_loss: 1.3255, test_f1: 0.2270
 epoch: 2, train_loss: 1.2389, test_loss: 1.2927, test_f1: 0.2270
 epoch: 3, train_loss: 1.2224, test_loss: 1.2329, test_f1: 0.2295
 epoch: 4, train_loss: 1.2047, test_loss: 1.1858, test_f1: 0.3102
 epoch: 5, train_loss: 1.1929, test_loss: 1.1583, test_f1: 0.3353
 epoch: 6, train_loss: 1.1746, test_loss: 1.1347, test_f1: 0.3593
 epoch: 7, train_loss: 1.1666, test_loss: 1.1167, test_f1: 0.3666
 epoch: 8, train_loss: 1.1447, test_loss: 1.1015, test_f1: 0.3711
 epoch: 9, train_loss: 1.1301, test_loss: 1.0884, test_f1: 0.3539
 epoch: 10, train_loss: 1.1152, test_loss: 1.0729, test_f1: 0.3497
 epoch: 11, train_loss: 1.1049, test_loss: 1.0594, test_f1: 0.3683
 epoch: 12, train_loss: 1.0950, test_loss: 1.0466, test_f1: 0.3801
 epoch: 13, train_loss: 1.0831, test_loss: 1.0327, test_f1: 0.4040
 epoch: 14, train_loss: 1.0767, test_loss: 1.0260, test_f1: 0.4253
 epoch: 15, train_loss: 1.0569, test_loss: 1.0194, test_f1: 0.4349
 epoch: 16, train_loss: 1.0572, test_loss: 1.0179, test_f1: 0.4345
 epoch: 17, train_loss: 1.0482, test_loss: 1.0126, test_f1: 0.4342
 epoch: 18, train_loss: 1.0402, test_loss: 1.0085, test_f1: 0.4385
 epoch: 19, train_loss: 1.0318, test_loss: 0.9975, test_f1: 0.4386
 epoch: 20, train_loss: 1.0297, test_loss: 0.9999, test_f1: 0.4489
 epoch: 21, train_loss: 1.0198, test_loss: 0.9914, test_f1: 0.4351
 epoch: 22, train_loss: 1.0104, test_loss: 0.9853, test_f1: 0.4421
 epoch: 23, train_loss: 1.0067, test_loss: 0.9837, test_f1: 0.4558
 epoch: 24, train_loss: 1.0095, test_loss: 0.9625, test_f1: 0.4616
 epoch: 25, train_loss: 0.9992, test_loss: 0.9640, test_f1: 0.4507
 epoch: 26, train_loss: 0.9918, test_loss: 0.9699, test_f1: 0.4590
 epoch: 27, train_loss: 0.9856, test_loss: 0.9569, test_f1: 0.4552
 epoch: 28, train_loss: 0.9840, test_loss: 0.9583, test_f1: 0.4505
 epoch: 29, train_loss: 0.9872, test_loss: 1.0105, test_f1: 0.4366
 epoch: 30, train_loss: 0.9766, test_loss: 0.9646, test_f1: 0.4674
 epoch: 31, train_loss: 0.9731, test_loss: 1.0036, test_f1: 0.4631
 epoch: 32, train_loss: 0.9727, test_loss: 0.9623, test_f1: 0.4706
 epoch: 33, train_loss: 0.9584, test_loss: 0.9418, test_f1: 0.4911
 epoch: 34, train_loss: 0.9681, test_loss: 0.9886, test_f1: 0.4784
 epoch: 35, train_loss: 0.9577, test_loss: 1.0177, test_f1: 0.4529
 epoch: 36, train_loss: 0.9673, test_loss: 0.9789, test_f1: 0.4781
 epoch: 37, train_loss: 0.9631, test_loss: 0.9562, test_f1: 0.4812
 epoch: 38, train_loss: 0.9520, test_loss: 0.9565, test_f1: 0.4772
 epoch: 39, train_loss: 0.9535, test_loss: 0.9420, test_f1: 0.4781
 epoch: 40, train_loss: 0.9486, test_loss: 0.9337, test_f1: 0.4992
 epoch: 41, train_loss: 0.9442, test_loss: 0.9441, test_f1: 0.4879
 epoch: 42, train_loss: 0.9461, test_loss: 0.9483, test_f1: 0.4793
 epoch: 43, train_loss: 0.9441, test_loss: 0.9329, test_f1: 0.4924
 epoch: 44, train_loss: 0.9425, test_loss: 0.9271, test_f1: 0.5088
 epoch: 45, train_loss: 0.9453, test_loss: 0.9707, test_f1: 0.4804
 epoch: 46, train_loss: 0.9337, test_loss: 0.9253, test_f1: 0.4968
 epoch: 47, train_loss: 0.9339, test_loss: 0.9477, test_f1: 0.4908
 epoch: 48, train_loss: 0.9372, test_loss: 0.9292, test_f1: 0.5072
 epoch: 49, train_loss: 0.9267, test_loss: 0.9269, test_f1: 0.5147
 epoch: 50, train_loss: 0.9256, test_loss: 0.9371, test_f1: 0.4967
 epoch: 51, train_loss: 0.9238, test_loss: 0.9436, test_f1: 0.4895
 epoch: 52, train_loss: 0.9264, test_loss: 0.9319, test_f1: 0.4946
 epoch: 53, train_loss: 0.9280, test_loss: 0.9741, test_f1: 0.4834
 epoch: 54, train_loss: 0.9153, test_loss: 0.9426, test_f1: 0.4913
 epoch: 55, train_loss: 0.9148, test_loss: 0.9628, test_f1: 0.4854
 epoch: 56, train_loss: 0.9280, test_loss: 0.9314, test_f1: 0.4957
 epoch: 57, train_loss: 0.9206, test_loss: 0.9515, test_f1: 0.4914
 epoch: 58, train_loss: 0.9172, test_loss: 0.9485, test_f1: 0.4901
 epoch: 59, train_loss: 0.9154, test_loss: 0.9179, test_f1: 0.5080
 epoch: 60, train_loss: 0.9103, test_loss: 0.9596, test_f1: 0.4979
 epoch: 61, train_loss: 0.9161, test_loss: 0.9698, test_f1: 0.4806
 epoch: 62, train_loss: 0.9110, test_loss: 0.9213, test_f1: 0.5011
 epoch: 63, train_loss: 0.9115, test_loss: 0.9555, test_f1: 0.4941
 epoch: 64, train_loss: 0.9199, test_loss: 0.9237, test_f1: 0.5084
 epoch: 65, train_loss: 0.9132, test_loss: 0.9435, test_f1: 0.4975
 epoch: 66, train_loss: 0.9068, test_loss: 0.9427, test_f1: 0.4919
 epoch: 67, train_loss: 0.9069, test_loss: 0.9279, test_f1: 0.5014
 epoch: 68, train_loss: 0.9045, test_loss: 0.9820, test_f1: 0.4864
 epoch: 69, train_loss: 0.9107, test_loss: 0.9327, test_f1: 0.4969
 epoch: 70, train_loss: 0.9011, test_loss: 0.9346, test_f1: 0.4998
 epoch: 71, train_loss: 0.9039, test_loss: 0.9480, test_f1: 0.4970
 epoch: 72, train_loss: 0.8992, test_loss: 0.9678, test_f1: 0.4988
 epoch: 73, train_loss: 0.9063, test_loss: 0.9375, test_f1: 0.4981
 epoch: 74, train_loss: 0.9056, test_loss: 0.9636, test_f1: 0.4991
 epoch: 75, train_loss: 0.8940, test_loss: 0.9703, test_f1: 0.4975
 epoch: 76, train_loss: 0.8946, test_loss: 0.9392, test_f1: 0.4976
 epoch: 77, train_loss: 0.8941, test_loss: 0.9526, test_f1: 0.4891
 epoch: 78, train_loss: 0.8957, test_loss: 0.9238, test_f1: 0.5051
 epoch: 79, train_loss: 0.9006, test_loss: 0.9420, test_f1: 0.5009
 epoch: 80, train_loss: 0.8972, test_loss: 0.9882, test_f1: 0.4838
 epoch: 81, train_loss: 0.8953, test_loss: 0.9346, test_f1: 0.5002
 epoch: 82, train_loss: 0.9066, test_loss: 0.9880, test_f1: 0.4992
 epoch: 83, train_loss: 0.8954, test_loss: 0.9907, test_f1: 0.4988
 epoch: 84, train_loss: 0.8860, test_loss: 0.9502, test_f1: 0.5026
 epoch: 85, train_loss: 0.8968, test_loss: 0.9432, test_f1: 0.5003
 epoch: 86, train_loss: 0.9001, test_loss: 0.9814, test_f1: 0.4991
 epoch: 87, train_loss: 0.9050, test_loss: 0.9132, test_f1: 0.5173
 epoch: 88, train_loss: 0.8885, test_loss: 0.9574, test_f1: 0.4993
 epoch: 89, train_loss: 0.8883, test_loss: 0.9401, test_f1: 0.5003
 epoch: 90, train_loss: 0.8930, test_loss: 0.9424, test_f1: 0.5020
 epoch: 91, train_loss: 0.8893, test_loss: 0.9853, test_f1: 0.4911
 epoch: 92, train_loss: 0.8880, test_loss: 0.9302, test_f1: 0.5081
 epoch: 93, train_loss: 0.8939, test_loss: 0.9549, test_f1: 0.5039
 epoch: 94, train_loss: 0.8837, test_loss: 0.9567, test_f1: 0.4960
 epoch: 95, train_loss: 0.8871, test_loss: 0.9818, test_f1: 0.4913
 epoch: 96, train_loss: 0.8926, test_loss: 0.9615, test_f1: 0.4989
 epoch: 97, train_loss: 0.8856, test_loss: 0.9190, test_f1: 0.5102
 epoch: 98, train_loss: 0.8834, test_loss: 0.9631, test_f1: 0.5120
 epoch: 99, train_loss: 0.8826, test_loss: 0.9895, test_f1: 0.4979
##################ITERATION #8 ****************************************
 epoch: 0, train_loss: 1.3417, test_loss: 1.3487, test_f1: 0.2270
 epoch: 1, train_loss: 1.2220, test_loss: 1.3260, test_f1: 0.2270
 epoch: 2, train_loss: 1.2061, test_loss: 1.2586, test_f1: 0.2416
 epoch: 3, train_loss: 1.1786, test_loss: 1.1798, test_f1: 0.3175
 epoch: 4, train_loss: 1.1469, test_loss: 1.1146, test_f1: 0.3475
 epoch: 5, train_loss: 1.1304, test_loss: 1.0850, test_f1: 0.3553
 epoch: 6, train_loss: 1.0980, test_loss: 1.0642, test_f1: 0.3586
 epoch: 7, train_loss: 1.0893, test_loss: 1.0523, test_f1: 0.3634
 epoch: 8, train_loss: 1.0824, test_loss: 1.0434, test_f1: 0.3702
 epoch: 9, train_loss: 1.0814, test_loss: 1.0359, test_f1: 0.3808
 epoch: 10, train_loss: 1.0625, test_loss: 1.0332, test_f1: 0.3895
 epoch: 11, train_loss: 1.0622, test_loss: 1.0277, test_f1: 0.3887
 epoch: 12, train_loss: 1.0506, test_loss: 1.0238, test_f1: 0.4068
 epoch: 13, train_loss: 1.0389, test_loss: 1.0180, test_f1: 0.4244
 epoch: 14, train_loss: 1.0333, test_loss: 1.0114, test_f1: 0.4276
 epoch: 15, train_loss: 1.0264, test_loss: 1.0019, test_f1: 0.4415
 epoch: 16, train_loss: 1.0184, test_loss: 1.0036, test_f1: 0.4387
 epoch: 17, train_loss: 1.0086, test_loss: 0.9915, test_f1: 0.4418
 epoch: 18, train_loss: 0.9996, test_loss: 0.9906, test_f1: 0.4551
 epoch: 19, train_loss: 0.9999, test_loss: 0.9865, test_f1: 0.4617
 epoch: 20, train_loss: 1.0018, test_loss: 0.9778, test_f1: 0.4554
 epoch: 21, train_loss: 0.9915, test_loss: 0.9802, test_f1: 0.4541
 epoch: 22, train_loss: 0.9923, test_loss: 0.9794, test_f1: 0.4627
 epoch: 23, train_loss: 0.9860, test_loss: 0.9767, test_f1: 0.4643
 epoch: 24, train_loss: 0.9831, test_loss: 0.9784, test_f1: 0.4580
 epoch: 25, train_loss: 0.9802, test_loss: 0.9668, test_f1: 0.4707
 epoch: 26, train_loss: 0.9767, test_loss: 0.9699, test_f1: 0.4661
 epoch: 27, train_loss: 0.9656, test_loss: 0.9692, test_f1: 0.4760
 epoch: 28, train_loss: 0.9628, test_loss: 0.9491, test_f1: 0.4785
 epoch: 29, train_loss: 0.9584, test_loss: 0.9534, test_f1: 0.4761
 epoch: 30, train_loss: 0.9540, test_loss: 0.9492, test_f1: 0.4694
 epoch: 31, train_loss: 0.9569, test_loss: 0.9398, test_f1: 0.4748
 epoch: 32, train_loss: 0.9495, test_loss: 0.9307, test_f1: 0.4827
 epoch: 33, train_loss: 0.9551, test_loss: 0.9383, test_f1: 0.4872
 epoch: 34, train_loss: 0.9357, test_loss: 0.9435, test_f1: 0.4893
 epoch: 35, train_loss: 0.9478, test_loss: 0.9356, test_f1: 0.4827
 epoch: 36, train_loss: 0.9500, test_loss: 0.9320, test_f1: 0.4837
 epoch: 37, train_loss: 0.9336, test_loss: 0.9275, test_f1: 0.4908
 epoch: 38, train_loss: 0.9420, test_loss: 0.9259, test_f1: 0.4977
 epoch: 39, train_loss: 0.9277, test_loss: 0.9313, test_f1: 0.4973
 epoch: 40, train_loss: 0.9425, test_loss: 0.9148, test_f1: 0.5003
 epoch: 41, train_loss: 0.9256, test_loss: 0.9265, test_f1: 0.4970
 epoch: 42, train_loss: 0.9234, test_loss: 0.9239, test_f1: 0.4882
 epoch: 43, train_loss: 0.9307, test_loss: 0.9242, test_f1: 0.4925
 epoch: 44, train_loss: 0.9249, test_loss: 0.9216, test_f1: 0.4918
 epoch: 45, train_loss: 0.9238, test_loss: 0.9258, test_f1: 0.4957
 epoch: 46, train_loss: 0.9228, test_loss: 0.9186, test_f1: 0.5051
 epoch: 47, train_loss: 0.9218, test_loss: 0.9391, test_f1: 0.4973
 epoch: 48, train_loss: 0.9082, test_loss: 0.9233, test_f1: 0.4936
 epoch: 49, train_loss: 0.9155, test_loss: 0.9213, test_f1: 0.5022
 epoch: 50, train_loss: 0.9025, test_loss: 0.9340, test_f1: 0.4889
 epoch: 51, train_loss: 0.9041, test_loss: 0.9231, test_f1: 0.4998
 epoch: 52, train_loss: 0.8988, test_loss: 0.9240, test_f1: 0.4996
 epoch: 53, train_loss: 0.9030, test_loss: 0.9267, test_f1: 0.5019
 epoch: 54, train_loss: 0.9014, test_loss: 0.9243, test_f1: 0.4960
 epoch: 55, train_loss: 0.9033, test_loss: 0.9184, test_f1: 0.4983
 epoch: 56, train_loss: 0.9050, test_loss: 0.9207, test_f1: 0.4998
 epoch: 57, train_loss: 0.9024, test_loss: 0.9260, test_f1: 0.5046
 epoch: 58, train_loss: 0.9049, test_loss: 0.9195, test_f1: 0.5003
 epoch: 59, train_loss: 0.9026, test_loss: 0.9233, test_f1: 0.5004
 epoch: 60, train_loss: 0.9043, test_loss: 0.9251, test_f1: 0.4952
 epoch: 61, train_loss: 0.8980, test_loss: 0.9161, test_f1: 0.4998
 epoch: 62, train_loss: 0.8992, test_loss: 0.9143, test_f1: 0.5003
 epoch: 63, train_loss: 0.8908, test_loss: 0.9242, test_f1: 0.4970
 epoch: 64, train_loss: 0.8935, test_loss: 0.9221, test_f1: 0.4952
 epoch: 65, train_loss: 0.8954, test_loss: 0.9242, test_f1: 0.4987
 epoch: 66, train_loss: 0.8935, test_loss: 0.9176, test_f1: 0.5068
 epoch: 67, train_loss: 0.8978, test_loss: 0.9185, test_f1: 0.4934
 epoch: 68, train_loss: 0.9028, test_loss: 0.9150, test_f1: 0.4992
 epoch: 69, train_loss: 0.8939, test_loss: 0.9134, test_f1: 0.4998
 epoch: 70, train_loss: 0.8936, test_loss: 0.9176, test_f1: 0.5037
 epoch: 71, train_loss: 0.8833, test_loss: 0.9170, test_f1: 0.5056
 epoch: 72, train_loss: 0.8860, test_loss: 0.9129, test_f1: 0.4990
 epoch: 73, train_loss: 0.8826, test_loss: 0.9049, test_f1: 0.4972
 epoch: 74, train_loss: 0.8809, test_loss: 0.9131, test_f1: 0.5011
 epoch: 75, train_loss: 0.8816, test_loss: 0.9162, test_f1: 0.4966
 epoch: 76, train_loss: 0.8856, test_loss: 0.9036, test_f1: 0.5052
 epoch: 77, train_loss: 0.8892, test_loss: 0.9221, test_f1: 0.5017
 epoch: 78, train_loss: 0.8762, test_loss: 0.9260, test_f1: 0.4984
 epoch: 79, train_loss: 0.8802, test_loss: 0.9079, test_f1: 0.5028
 epoch: 80, train_loss: 0.8794, test_loss: 0.9021, test_f1: 0.5019
 epoch: 81, train_loss: 0.8739, test_loss: 0.9008, test_f1: 0.4955
 epoch: 82, train_loss: 0.8820, test_loss: 0.9134, test_f1: 0.5004
 epoch: 83, train_loss: 0.8787, test_loss: 0.9114, test_f1: 0.5063
 epoch: 84, train_loss: 0.8753, test_loss: 0.9113, test_f1: 0.4981
 epoch: 85, train_loss: 0.8740, test_loss: 0.9119, test_f1: 0.5042
 epoch: 86, train_loss: 0.8797, test_loss: 0.8997, test_f1: 0.5092
 epoch: 87, train_loss: 0.8759, test_loss: 0.9053, test_f1: 0.5068
 epoch: 88, train_loss: 0.8685, test_loss: 0.9104, test_f1: 0.4971
 epoch: 89, train_loss: 0.8706, test_loss: 0.9024, test_f1: 0.5075
 epoch: 90, train_loss: 0.8826, test_loss: 0.9187, test_f1: 0.5007
 epoch: 91, train_loss: 0.8768, test_loss: 0.9084, test_f1: 0.5006
 epoch: 92, train_loss: 0.8670, test_loss: 0.9227, test_f1: 0.4968
 epoch: 93, train_loss: 0.8587, test_loss: 0.9188, test_f1: 0.5001
 epoch: 94, train_loss: 0.8716, test_loss: 0.9174, test_f1: 0.5013
 epoch: 95, train_loss: 0.8668, test_loss: 0.9184, test_f1: 0.4965
 epoch: 96, train_loss: 0.8670, test_loss: 0.9103, test_f1: 0.5123
 epoch: 97, train_loss: 0.8650, test_loss: 0.9139, test_f1: 0.5057
 epoch: 98, train_loss: 0.8673, test_loss: 0.9192, test_f1: 0.5009
 epoch: 99, train_loss: 0.8726, test_loss: 0.9174, test_f1: 0.4978
##################ITERATION #9 ****************************************
 epoch: 0, train_loss: 1.4515, test_loss: 1.3383, test_f1: 0.2270
 epoch: 1, train_loss: 1.2668, test_loss: 1.2911, test_f1: 0.2494
 epoch: 2, train_loss: 1.2311, test_loss: 1.2319, test_f1: 0.2751
 epoch: 3, train_loss: 1.1873, test_loss: 1.1608, test_f1: 0.3456
 epoch: 4, train_loss: 1.1602, test_loss: 1.1117, test_f1: 0.3598
 epoch: 5, train_loss: 1.1427, test_loss: 1.0781, test_f1: 0.3460
 epoch: 6, train_loss: 1.1249, test_loss: 1.0618, test_f1: 0.3467
 epoch: 7, train_loss: 1.0980, test_loss: 1.0555, test_f1: 0.3458
 epoch: 8, train_loss: 1.0904, test_loss: 1.0387, test_f1: 0.3537
 epoch: 9, train_loss: 1.0772, test_loss: 1.0364, test_f1: 0.3502
 epoch: 10, train_loss: 1.0850, test_loss: 1.0303, test_f1: 0.3479
 epoch: 11, train_loss: 1.0737, test_loss: 1.0278, test_f1: 0.3468
 epoch: 12, train_loss: 1.0637, test_loss: 1.0220, test_f1: 0.3521
 epoch: 13, train_loss: 1.0567, test_loss: 1.0221, test_f1: 0.3555
 epoch: 14, train_loss: 1.0494, test_loss: 1.0185, test_f1: 0.3690
 epoch: 15, train_loss: 1.0360, test_loss: 1.0088, test_f1: 0.3789
 epoch: 16, train_loss: 1.0336, test_loss: 1.0165, test_f1: 0.3775
 epoch: 17, train_loss: 1.0319, test_loss: 1.0081, test_f1: 0.4013
 epoch: 18, train_loss: 1.0243, test_loss: 1.0146, test_f1: 0.3898
 epoch: 19, train_loss: 1.0116, test_loss: 1.0007, test_f1: 0.4012
 epoch: 20, train_loss: 1.0137, test_loss: 0.9998, test_f1: 0.4134
 epoch: 21, train_loss: 1.0162, test_loss: 0.9985, test_f1: 0.4036
 epoch: 22, train_loss: 1.0069, test_loss: 0.9892, test_f1: 0.4131
 epoch: 23, train_loss: 0.9992, test_loss: 0.9981, test_f1: 0.4255
 epoch: 24, train_loss: 0.9964, test_loss: 0.9864, test_f1: 0.4253
 epoch: 25, train_loss: 1.0053, test_loss: 0.9796, test_f1: 0.4236
 epoch: 26, train_loss: 0.9928, test_loss: 0.9874, test_f1: 0.4308
 epoch: 27, train_loss: 0.9846, test_loss: 0.9802, test_f1: 0.4472
 epoch: 28, train_loss: 0.9799, test_loss: 0.9775, test_f1: 0.4426
 epoch: 29, train_loss: 0.9848, test_loss: 0.9751, test_f1: 0.4582
 epoch: 30, train_loss: 0.9747, test_loss: 0.9702, test_f1: 0.4682
 epoch: 31, train_loss: 0.9753, test_loss: 0.9677, test_f1: 0.4795
 epoch: 32, train_loss: 0.9765, test_loss: 0.9631, test_f1: 0.4779
 epoch: 33, train_loss: 0.9679, test_loss: 0.9650, test_f1: 0.4805
 epoch: 34, train_loss: 0.9704, test_loss: 0.9611, test_f1: 0.4776
 epoch: 35, train_loss: 0.9666, test_loss: 0.9544, test_f1: 0.4824
 epoch: 36, train_loss: 0.9639, test_loss: 0.9617, test_f1: 0.4904
 epoch: 37, train_loss: 0.9595, test_loss: 0.9490, test_f1: 0.4894
 epoch: 38, train_loss: 0.9537, test_loss: 0.9495, test_f1: 0.4966
 epoch: 39, train_loss: 0.9567, test_loss: 0.9519, test_f1: 0.4913
 epoch: 40, train_loss: 0.9611, test_loss: 0.9356, test_f1: 0.4932
 epoch: 41, train_loss: 0.9503, test_loss: 0.9589, test_f1: 0.4782
 epoch: 42, train_loss: 0.9434, test_loss: 0.9330, test_f1: 0.5043
 epoch: 43, train_loss: 0.9451, test_loss: 0.9766, test_f1: 0.4844
 epoch: 44, train_loss: 0.9451, test_loss: 0.9327, test_f1: 0.4980
 epoch: 45, train_loss: 0.9467, test_loss: 0.9387, test_f1: 0.4971
 epoch: 46, train_loss: 0.9475, test_loss: 0.9233, test_f1: 0.4987
 epoch: 47, train_loss: 0.9426, test_loss: 0.9288, test_f1: 0.4963
 epoch: 48, train_loss: 0.9462, test_loss: 0.9412, test_f1: 0.5006
 epoch: 49, train_loss: 0.9476, test_loss: 0.9413, test_f1: 0.4933
 epoch: 50, train_loss: 0.9296, test_loss: 0.9314, test_f1: 0.4969
 epoch: 51, train_loss: 0.9315, test_loss: 0.9404, test_f1: 0.5078
 epoch: 52, train_loss: 0.9236, test_loss: 0.9311, test_f1: 0.5088
 epoch: 53, train_loss: 0.9257, test_loss: 0.9250, test_f1: 0.5147
 epoch: 54, train_loss: 0.9219, test_loss: 0.9297, test_f1: 0.5161
 epoch: 55, train_loss: 0.9172, test_loss: 0.9257, test_f1: 0.5221
 epoch: 56, train_loss: 0.9290, test_loss: 0.9268, test_f1: 0.5164
 epoch: 57, train_loss: 0.9357, test_loss: 0.9301, test_f1: 0.5124
 epoch: 58, train_loss: 0.9251, test_loss: 0.9184, test_f1: 0.5213
 epoch: 59, train_loss: 0.9248, test_loss: 0.9196, test_f1: 0.5174
 epoch: 60, train_loss: 0.9203, test_loss: 0.9163, test_f1: 0.5187
 epoch: 61, train_loss: 0.9219, test_loss: 0.9151, test_f1: 0.5170
 epoch: 62, train_loss: 0.9170, test_loss: 0.9148, test_f1: 0.5190
 epoch: 63, train_loss: 0.9203, test_loss: 0.9163, test_f1: 0.5111
 epoch: 64, train_loss: 0.9217, test_loss: 0.9126, test_f1: 0.5188
 epoch: 65, train_loss: 0.9239, test_loss: 0.9084, test_f1: 0.5157
 epoch: 66, train_loss: 0.9179, test_loss: 0.9063, test_f1: 0.5237
 epoch: 67, train_loss: 0.9110, test_loss: 0.9191, test_f1: 0.5121
 epoch: 68, train_loss: 0.9123, test_loss: 0.9185, test_f1: 0.5155
 epoch: 69, train_loss: 0.9105, test_loss: 0.9125, test_f1: 0.5188
 epoch: 70, train_loss: 0.9160, test_loss: 0.9100, test_f1: 0.5141
 epoch: 71, train_loss: 0.9212, test_loss: 0.9140, test_f1: 0.5161
 epoch: 72, train_loss: 0.9219, test_loss: 0.9300, test_f1: 0.5088
 epoch: 73, train_loss: 0.9155, test_loss: 0.9115, test_f1: 0.5119
 epoch: 74, train_loss: 0.9100, test_loss: 0.9192, test_f1: 0.5154
 epoch: 75, train_loss: 0.9097, test_loss: 0.9215, test_f1: 0.5157
 epoch: 76, train_loss: 0.9065, test_loss: 0.9129, test_f1: 0.5198
 epoch: 77, train_loss: 0.9100, test_loss: 0.9129, test_f1: 0.5217
 epoch: 78, train_loss: 0.9013, test_loss: 0.9032, test_f1: 0.5148
 epoch: 79, train_loss: 0.9071, test_loss: 0.9135, test_f1: 0.5166
 epoch: 80, train_loss: 0.9058, test_loss: 0.9236, test_f1: 0.5142
 epoch: 81, train_loss: 0.9039, test_loss: 0.9016, test_f1: 0.5170
 epoch: 82, train_loss: 0.8996, test_loss: 0.9010, test_f1: 0.5182
 epoch: 83, train_loss: 0.8998, test_loss: 0.9075, test_f1: 0.5176
 epoch: 84, train_loss: 0.8976, test_loss: 0.9160, test_f1: 0.5212
 epoch: 85, train_loss: 0.9030, test_loss: 0.9158, test_f1: 0.5154
 epoch: 86, train_loss: 0.9042, test_loss: 0.9053, test_f1: 0.5215
 epoch: 87, train_loss: 0.9035, test_loss: 0.9150, test_f1: 0.5150
 epoch: 88, train_loss: 0.8955, test_loss: 0.8994, test_f1: 0.5221
 epoch: 89, train_loss: 0.8964, test_loss: 0.9085, test_f1: 0.5305
 epoch: 90, train_loss: 0.8985, test_loss: 0.9156, test_f1: 0.5109
 epoch: 91, train_loss: 0.8963, test_loss: 0.8975, test_f1: 0.5099
 epoch: 92, train_loss: 0.8920, test_loss: 0.9090, test_f1: 0.5193
 epoch: 93, train_loss: 0.8893, test_loss: 0.9041, test_f1: 0.5200
 epoch: 94, train_loss: 0.8909, test_loss: 0.9051, test_f1: 0.5232
 epoch: 95, train_loss: 0.8887, test_loss: 0.9017, test_f1: 0.5164
 epoch: 96, train_loss: 0.8861, test_loss: 0.9028, test_f1: 0.5107
 epoch: 97, train_loss: 0.9020, test_loss: 0.8962, test_f1: 0.5117
 epoch: 98, train_loss: 0.8939, test_loss: 0.9022, test_f1: 0.5136
 epoch: 99, train_loss: 0.8940, test_loss: 0.9228, test_f1: 0.5114

Training completed in 369.46 seconds
Best F1: 0.5399 at epoch 72
Mean F1 across iterations: 0.5263  0.0096
========================FINAL RESULTS================================
FEGIN weighted F1: 0.5399  0.0096
python main.py --data ltspice_examples --representation component_net --model FEGIN --layers 2 --hiddens 16 --batch_size 256 --lr 0.001 --emb_size 250 --epochs 100 --save_appendix component_net_L2_H16_BS256_LR0.001_E250 --no_val
-----



STDERR:
  File "main.py", line 370, in <module>
    main()
  File "main.py", line 254, in main
    dataset = dataset_class(
  File "/home/philip/projects/ltspice_examples_code_repo/Circuit-Completion-Using-GNNs/component_classification_with_link_prediction_head/evaluation/FEGIN/kernel/circuit_datasets.py", line 15, in __init__
    self.data, self.slices = torch.load(self.processed_paths[0])
  File "/home/philip/.local/lib/python3.8/site-packages/torch/serialization.py", line 1040, in load
    warnings.warn(
  File "/usr/lib/python3.8/warnings.py", line 109, in _showwarnmsg
    sw(msg.message, msg.category, msg.filename, msg.lineno,
  File "main.py", line 47, in warn_with_traceback
    traceback.print_stack(file=log)
/home/philip/projects/ltspice_examples_code_repo/Circuit-Completion-Using-GNNs/component_classification_with_link_prediction_head/evaluation/FEGIN/kernel/circuit_datasets.py:15: FutureWarning: You are using `torch.load` with `weights_only=False` (the current default value), which uses the default pickle module implicitly. It is possible to construct malicious pickle data which will execute arbitrary code during unpickling (See https://github.com/pytorch/pytorch/blob/main/SECURITY.md#untrusted-models for more details). In a future release, the default value for `weights_only` will be flipped to `True`. This limits the functions that could be executed during unpickling. Arbitrary objects will no longer be allowed to be loaded via this mode unless they are explicitly allowlisted by the user via `torch.serialization.add_safe_globals`. We recommend you start setting `weights_only=True` for any use case where you don't have full control of the loaded file. Please open an issue on GitHub for any issues related to this experimental feature.
  self.data, self.slices = torch.load(self.processed_paths[0])
