STDOUT:
Results will be saved in /home/philip/projects/llm_inference_code_repo/Circuit-Completion-Using-GNNs/component_classification_with_link_prediction_head/evaluation/FEGIN/results/model_FEGIN_dataset_ltspice_examples
Command line input: python main.py --data ltspice_examples --representation component_pin --model FEGIN --layers 3 --hiddens 64 --batch_size 256 --lr 0.01 --emb_size 250 --epochs 100 --save_appendix component_pin_L3_H64_BS256_LR0.01_E250 --no_val
 is saved.
-----
ltspice_examples - FEGIN
Using 3 layers, 64 hidden units, h = 2
Loading component_pin representation dataset
ENTERED
Training FEGIN on component_pin representation
Train: 3560, Test: 848
##################ITERATION #0 ****************************************
 epoch: 0, train_loss: 1.2532, test_loss: 1.2288, test_f1: 0.2260
 epoch: 1, train_loss: 1.0865, test_loss: 1.0731, test_f1: 0.3371
 epoch: 2, train_loss: 1.0165, test_loss: 1.1316, test_f1: 0.3522
 epoch: 3, train_loss: 0.9766, test_loss: 0.9845, test_f1: 0.4021
 epoch: 4, train_loss: 0.9245, test_loss: 1.0009, test_f1: 0.4757
 epoch: 5, train_loss: 0.9001, test_loss: 0.9616, test_f1: 0.5119
 epoch: 6, train_loss: 0.8651, test_loss: 0.9256, test_f1: 0.5198
 epoch: 7, train_loss: 0.8431, test_loss: 0.9599, test_f1: 0.5169
 epoch: 8, train_loss: 0.8107, test_loss: 0.9618, test_f1: 0.5339
 epoch: 9, train_loss: 0.8038, test_loss: 0.8640, test_f1: 0.5679
 epoch: 10, train_loss: 0.7805, test_loss: 0.9432, test_f1: 0.5272
 epoch: 11, train_loss: 0.7933, test_loss: 1.0227, test_f1: 0.4996
 epoch: 12, train_loss: 0.7732, test_loss: 0.7995, test_f1: 0.5896
 epoch: 13, train_loss: 0.7577, test_loss: 0.8267, test_f1: 0.5531
 epoch: 14, train_loss: 0.7550, test_loss: 0.8763, test_f1: 0.5547
 epoch: 15, train_loss: 0.7472, test_loss: 0.9547, test_f1: 0.5215
 epoch: 16, train_loss: 0.7338, test_loss: 0.9135, test_f1: 0.5422
 epoch: 17, train_loss: 0.7215, test_loss: 0.8222, test_f1: 0.6008
 epoch: 18, train_loss: 0.7202, test_loss: 0.9305, test_f1: 0.5541
 epoch: 19, train_loss: 0.7285, test_loss: 0.8514, test_f1: 0.5820
 epoch: 20, train_loss: 0.7048, test_loss: 0.7917, test_f1: 0.6058
 epoch: 21, train_loss: 0.7187, test_loss: 1.1825, test_f1: 0.4662
 epoch: 22, train_loss: 0.6891, test_loss: 0.8307, test_f1: 0.6292
 epoch: 23, train_loss: 0.6526, test_loss: 0.7890, test_f1: 0.6488
 epoch: 24, train_loss: 0.6272, test_loss: 0.9017, test_f1: 0.5637
 epoch: 25, train_loss: 0.6348, test_loss: 0.8230, test_f1: 0.6201
 epoch: 26, train_loss: 0.6361, test_loss: 0.9715, test_f1: 0.6177
 epoch: 27, train_loss: 0.6465, test_loss: 1.1387, test_f1: 0.5165
 epoch: 28, train_loss: 0.6320, test_loss: 0.8258, test_f1: 0.6295
 epoch: 29, train_loss: 0.6239, test_loss: 0.8091, test_f1: 0.6122
 epoch: 30, train_loss: 0.6171, test_loss: 0.8881, test_f1: 0.6387
 epoch: 31, train_loss: 0.6023, test_loss: 0.9096, test_f1: 0.6015
 epoch: 32, train_loss: 0.5862, test_loss: 0.9084, test_f1: 0.6444
 epoch: 33, train_loss: 0.5684, test_loss: 1.4528, test_f1: 0.5190
 epoch: 34, train_loss: 0.5746, test_loss: 0.9523, test_f1: 0.6057
 epoch: 35, train_loss: 0.5528, test_loss: 1.1475, test_f1: 0.5985
 epoch: 36, train_loss: 0.5631, test_loss: 1.0910, test_f1: 0.5777
 epoch: 37, train_loss: 0.5377, test_loss: 0.9457, test_f1: 0.6050
 epoch: 38, train_loss: 0.5483, test_loss: 1.8913, test_f1: 0.4860
 epoch: 39, train_loss: 0.5516, test_loss: 0.8866, test_f1: 0.6341
 epoch: 40, train_loss: 0.5208, test_loss: 0.9780, test_f1: 0.6096
 epoch: 41, train_loss: 0.5338, test_loss: 0.9387, test_f1: 0.6077
 epoch: 42, train_loss: 0.4889, test_loss: 0.9138, test_f1: 0.6286
 epoch: 43, train_loss: 0.5193, test_loss: 1.0066, test_f1: 0.5712
 epoch: 44, train_loss: 0.5057, test_loss: 0.9971, test_f1: 0.6144
 epoch: 45, train_loss: 0.4966, test_loss: 0.9831, test_f1: 0.6351
 epoch: 46, train_loss: 0.4772, test_loss: 0.9990, test_f1: 0.5778
 epoch: 47, train_loss: 0.4682, test_loss: 1.5099, test_f1: 0.5733
 epoch: 48, train_loss: 0.4877, test_loss: 0.9436, test_f1: 0.6166
 epoch: 49, train_loss: 0.4708, test_loss: 0.9948, test_f1: 0.6240
 epoch: 50, train_loss: 0.4657, test_loss: 1.0457, test_f1: 0.5875
 epoch: 51, train_loss: 0.4535, test_loss: 0.9936, test_f1: 0.6305
 epoch: 52, train_loss: 0.3951, test_loss: 1.1037, test_f1: 0.6055
 epoch: 53, train_loss: 0.3872, test_loss: 1.1936, test_f1: 0.6305
 epoch: 54, train_loss: 0.3927, test_loss: 1.0625, test_f1: 0.6334
 epoch: 55, train_loss: 0.3592, test_loss: 1.0608, test_f1: 0.6340
 epoch: 56, train_loss: 0.3813, test_loss: 1.2350, test_f1: 0.6131
 epoch: 57, train_loss: 0.4086, test_loss: 1.1223, test_f1: 0.6249
 epoch: 58, train_loss: 0.4007, test_loss: 1.1693, test_f1: 0.6243
 epoch: 59, train_loss: 0.3662, test_loss: 1.3104, test_f1: 0.5992
 epoch: 60, train_loss: 0.3825, test_loss: 1.1146, test_f1: 0.6330
 epoch: 61, train_loss: 0.3637, test_loss: 1.3069, test_f1: 0.5914
 epoch: 62, train_loss: 0.3596, test_loss: 1.2518, test_f1: 0.6225
 epoch: 63, train_loss: 0.3230, test_loss: 1.2215, test_f1: 0.6273
 epoch: 64, train_loss: 0.3595, test_loss: 1.3364, test_f1: 0.6199
 epoch: 65, train_loss: 0.3336, test_loss: 1.2433, test_f1: 0.6391
 epoch: 66, train_loss: 0.3404, test_loss: 1.2208, test_f1: 0.6394
 epoch: 67, train_loss: 0.3286, test_loss: 1.2780, test_f1: 0.6440
 epoch: 68, train_loss: 0.3318, test_loss: 1.2768, test_f1: 0.6354
 epoch: 69, train_loss: 0.3082, test_loss: 1.3039, test_f1: 0.6288
 epoch: 70, train_loss: 0.3175, test_loss: 1.3228, test_f1: 0.6404
 epoch: 71, train_loss: 0.3112, test_loss: 1.4157, test_f1: 0.6271
 epoch: 72, train_loss: 0.3027, test_loss: 1.2409, test_f1: 0.6429
 epoch: 73, train_loss: 0.3180, test_loss: 1.7397, test_f1: 0.6089
 epoch: 74, train_loss: 0.3250, test_loss: 1.5488, test_f1: 0.6383
 epoch: 75, train_loss: 0.3248, test_loss: 1.2550, test_f1: 0.6215
 epoch: 76, train_loss: 0.3111, test_loss: 1.3721, test_f1: 0.6397
 epoch: 77, train_loss: 0.3103, test_loss: 1.2506, test_f1: 0.6334
 epoch: 78, train_loss: 0.3201, test_loss: 1.4801, test_f1: 0.5713
 epoch: 79, train_loss: 0.3146, test_loss: 1.0580, test_f1: 0.6469
 epoch: 80, train_loss: 0.3073, test_loss: 1.7331, test_f1: 0.6404
 epoch: 81, train_loss: 0.3052, test_loss: 1.2589, test_f1: 0.6302
 epoch: 82, train_loss: 0.3194, test_loss: 1.5943, test_f1: 0.6438
 epoch: 83, train_loss: 0.2991, test_loss: 1.1830, test_f1: 0.6309
 epoch: 84, train_loss: 0.2787, test_loss: 1.4539, test_f1: 0.6365
 epoch: 85, train_loss: 0.3094, test_loss: 1.4225, test_f1: 0.6309
 epoch: 86, train_loss: 0.3043, test_loss: 1.4022, test_f1: 0.5959
 epoch: 87, train_loss: 0.2913, test_loss: 1.1753, test_f1: 0.6562
 epoch: 88, train_loss: 0.2832, test_loss: 1.5049, test_f1: 0.6361
 epoch: 89, train_loss: 0.2768, test_loss: 1.2882, test_f1: 0.6611
 epoch: 90, train_loss: 0.2654, test_loss: 1.4244, test_f1: 0.6468
 epoch: 91, train_loss: 0.3101, test_loss: 1.3364, test_f1: 0.6419
 epoch: 92, train_loss: 0.2839, test_loss: 1.3496, test_f1: 0.6436
 epoch: 93, train_loss: 0.2674, test_loss: 1.3319, test_f1: 0.6442
 epoch: 94, train_loss: 0.2543, test_loss: 1.2951, test_f1: 0.6440
 epoch: 95, train_loss: 0.2833, test_loss: 1.6584, test_f1: 0.6010
 epoch: 96, train_loss: 0.2921, test_loss: 1.3649, test_f1: 0.6409
 epoch: 97, train_loss: 0.2698, test_loss: 1.3046, test_f1: 0.6613
 epoch: 98, train_loss: 0.2724, test_loss: 1.2130, test_f1: 0.6607
 epoch: 99, train_loss: 0.2614, test_loss: 1.2824, test_f1: 0.6321
##################ITERATION #1 ****************************************
 epoch: 0, train_loss: 1.2239, test_loss: 1.3341, test_f1: 0.2483
 epoch: 1, train_loss: 1.0041, test_loss: 1.0331, test_f1: 0.4031
 epoch: 2, train_loss: 0.9625, test_loss: 1.0277, test_f1: 0.4076
 epoch: 3, train_loss: 0.9183, test_loss: 0.9695, test_f1: 0.4776
 epoch: 4, train_loss: 0.8911, test_loss: 1.0992, test_f1: 0.4660
 epoch: 5, train_loss: 0.9020, test_loss: 0.9380, test_f1: 0.4954
 epoch: 6, train_loss: 0.8730, test_loss: 0.9099, test_f1: 0.5146
 epoch: 7, train_loss: 0.8626, test_loss: 1.2251, test_f1: 0.4257
 epoch: 8, train_loss: 0.8329, test_loss: 1.0311, test_f1: 0.4643
 epoch: 9, train_loss: 0.8170, test_loss: 0.8851, test_f1: 0.5449
 epoch: 10, train_loss: 0.7798, test_loss: 0.9850, test_f1: 0.5125
 epoch: 11, train_loss: 0.7761, test_loss: 0.9706, test_f1: 0.5291
 epoch: 12, train_loss: 0.7703, test_loss: 0.9298, test_f1: 0.4984
 epoch: 13, train_loss: 0.7567, test_loss: 0.9585, test_f1: 0.5219
 epoch: 14, train_loss: 0.7611, test_loss: 0.8637, test_f1: 0.5500
 epoch: 15, train_loss: 0.7347, test_loss: 0.9904, test_f1: 0.5474
 epoch: 16, train_loss: 0.7290, test_loss: 0.8734, test_f1: 0.5145
 epoch: 17, train_loss: 0.7400, test_loss: 1.1985, test_f1: 0.4548
 epoch: 18, train_loss: 0.7292, test_loss: 0.9044, test_f1: 0.5269
 epoch: 19, train_loss: 0.7131, test_loss: 0.9047, test_f1: 0.5121
 epoch: 20, train_loss: 0.7125, test_loss: 0.8531, test_f1: 0.5653
 epoch: 21, train_loss: 0.6994, test_loss: 0.8751, test_f1: 0.5611
 epoch: 22, train_loss: 0.6826, test_loss: 0.8107, test_f1: 0.5968
 epoch: 23, train_loss: 0.6840, test_loss: 1.0336, test_f1: 0.5458
 epoch: 24, train_loss: 0.6666, test_loss: 0.8259, test_f1: 0.5665
 epoch: 25, train_loss: 0.6642, test_loss: 1.6213, test_f1: 0.5110
 epoch: 26, train_loss: 0.7170, test_loss: 0.8009, test_f1: 0.5608
 epoch: 27, train_loss: 0.6620, test_loss: 0.8075, test_f1: 0.5838
 epoch: 28, train_loss: 0.6745, test_loss: 0.9171, test_f1: 0.5829
 epoch: 29, train_loss: 0.6619, test_loss: 0.8415, test_f1: 0.6376
 epoch: 30, train_loss: 0.6528, test_loss: 0.9774, test_f1: 0.5487
 epoch: 31, train_loss: 0.6235, test_loss: 0.8735, test_f1: 0.5712
 epoch: 32, train_loss: 0.6169, test_loss: 0.9276, test_f1: 0.5762
 epoch: 33, train_loss: 0.6013, test_loss: 0.7887, test_f1: 0.6287
 epoch: 34, train_loss: 0.6025, test_loss: 0.9764, test_f1: 0.5750
 epoch: 35, train_loss: 0.6063, test_loss: 1.0180, test_f1: 0.6054
 epoch: 36, train_loss: 0.5847, test_loss: 0.9298, test_f1: 0.6176
 epoch: 37, train_loss: 0.5634, test_loss: 0.9276, test_f1: 0.6124
 epoch: 38, train_loss: 0.5634, test_loss: 1.1385, test_f1: 0.5967
 epoch: 39, train_loss: 0.5856, test_loss: 1.2712, test_f1: 0.5587
 epoch: 40, train_loss: 0.5996, test_loss: 0.9305, test_f1: 0.6103
 epoch: 41, train_loss: 0.5770, test_loss: 1.2965, test_f1: 0.5264
 epoch: 42, train_loss: 0.5639, test_loss: 0.8974, test_f1: 0.6430
 epoch: 43, train_loss: 0.5469, test_loss: 1.2931, test_f1: 0.5903
 epoch: 44, train_loss: 0.5836, test_loss: 0.8493, test_f1: 0.6266
 epoch: 45, train_loss: 0.5410, test_loss: 0.9318, test_f1: 0.6246
 epoch: 46, train_loss: 0.5235, test_loss: 0.8939, test_f1: 0.6137
 epoch: 47, train_loss: 0.5214, test_loss: 2.0383, test_f1: 0.4984
 epoch: 48, train_loss: 0.5354, test_loss: 0.9029, test_f1: 0.6498
 epoch: 49, train_loss: 0.5175, test_loss: 0.9721, test_f1: 0.6353
 epoch: 50, train_loss: 0.5088, test_loss: 0.9537, test_f1: 0.6326
 epoch: 51, train_loss: 0.4898, test_loss: 0.9419, test_f1: 0.6644
 epoch: 52, train_loss: 0.4592, test_loss: 1.0734, test_f1: 0.6479
 epoch: 53, train_loss: 0.4376, test_loss: 1.1193, test_f1: 0.6489
 epoch: 54, train_loss: 0.4250, test_loss: 1.0894, test_f1: 0.6489
 epoch: 55, train_loss: 0.4293, test_loss: 1.0795, test_f1: 0.6332
 epoch: 56, train_loss: 0.4234, test_loss: 1.0233, test_f1: 0.6544
 epoch: 57, train_loss: 0.4173, test_loss: 0.9781, test_f1: 0.6439
 epoch: 58, train_loss: 0.3999, test_loss: 1.0784, test_f1: 0.6538
 epoch: 59, train_loss: 0.4033, test_loss: 1.2111, test_f1: 0.6488
 epoch: 60, train_loss: 0.3961, test_loss: 1.0256, test_f1: 0.6391
 epoch: 61, train_loss: 0.4230, test_loss: 1.1263, test_f1: 0.6607
 epoch: 62, train_loss: 0.4293, test_loss: 0.9540, test_f1: 0.6683
 epoch: 63, train_loss: 0.4123, test_loss: 1.0114, test_f1: 0.6626
 epoch: 64, train_loss: 0.3990, test_loss: 1.0921, test_f1: 0.6527
 epoch: 65, train_loss: 0.3764, test_loss: 1.0025, test_f1: 0.6457
 epoch: 66, train_loss: 0.3757, test_loss: 1.0951, test_f1: 0.6207
 epoch: 67, train_loss: 0.3835, test_loss: 1.2368, test_f1: 0.6720
 epoch: 68, train_loss: 0.3811, test_loss: 1.1468, test_f1: 0.6657
 epoch: 69, train_loss: 0.3994, test_loss: 1.1322, test_f1: 0.6441
 epoch: 70, train_loss: 0.3603, test_loss: 1.1058, test_f1: 0.6619
 epoch: 71, train_loss: 0.3888, test_loss: 1.2063, test_f1: 0.6304
 epoch: 72, train_loss: 0.3762, test_loss: 1.0764, test_f1: 0.6573
 epoch: 73, train_loss: 0.3608, test_loss: 1.0070, test_f1: 0.6466
 epoch: 74, train_loss: 0.3545, test_loss: 1.1310, test_f1: 0.6485
 epoch: 75, train_loss: 0.3547, test_loss: 1.0830, test_f1: 0.6313
 epoch: 76, train_loss: 0.3580, test_loss: 1.1506, test_f1: 0.6365
 epoch: 77, train_loss: 0.3599, test_loss: 1.1774, test_f1: 0.6600
 epoch: 78, train_loss: 0.3512, test_loss: 1.2623, test_f1: 0.6503
 epoch: 79, train_loss: 0.3635, test_loss: 1.2092, test_f1: 0.6871
 epoch: 80, train_loss: 0.3477, test_loss: 1.3890, test_f1: 0.6008
 epoch: 81, train_loss: 0.3399, test_loss: 1.4175, test_f1: 0.6310
 epoch: 82, train_loss: 0.3602, test_loss: 1.4832, test_f1: 0.6524
 epoch: 83, train_loss: 0.3746, test_loss: 1.3860, test_f1: 0.6150
 epoch: 84, train_loss: 0.3554, test_loss: 2.1059, test_f1: 0.5182
 epoch: 85, train_loss: 0.3489, test_loss: 1.3345, test_f1: 0.6452
 epoch: 86, train_loss: 0.3406, test_loss: 1.3773, test_f1: 0.6534
 epoch: 87, train_loss: 0.3355, test_loss: 1.2638, test_f1: 0.6780
 epoch: 88, train_loss: 0.3579, test_loss: 1.3204, test_f1: 0.6584
 epoch: 89, train_loss: 0.3329, test_loss: 1.2001, test_f1: 0.6852
 epoch: 90, train_loss: 0.3480, test_loss: 1.3258, test_f1: 0.6069
 epoch: 91, train_loss: 0.3346, test_loss: 1.6104, test_f1: 0.6535
 epoch: 92, train_loss: 0.3380, test_loss: 1.2092, test_f1: 0.6633
 epoch: 93, train_loss: 0.3394, test_loss: 1.1165, test_f1: 0.6505
 epoch: 94, train_loss: 0.2951, test_loss: 1.4501, test_f1: 0.6192
 epoch: 95, train_loss: 0.2970, test_loss: 1.3978, test_f1: 0.6689
 epoch: 96, train_loss: 0.3138, test_loss: 1.1832, test_f1: 0.6587
 epoch: 97, train_loss: 0.3073, test_loss: 1.4039, test_f1: 0.6517
 epoch: 98, train_loss: 0.3148, test_loss: 1.3089, test_f1: 0.6263
 epoch: 99, train_loss: 0.3010, test_loss: 1.3458, test_f1: 0.6434
##################ITERATION #2 ****************************************
 epoch: 0, train_loss: 1.4874, test_loss: 1.4434, test_f1: 0.2260
 epoch: 1, train_loss: 1.0531, test_loss: 1.1514, test_f1: 0.3651
 epoch: 2, train_loss: 1.0137, test_loss: 1.0489, test_f1: 0.3928
 epoch: 3, train_loss: 0.9630, test_loss: 1.0831, test_f1: 0.4092
 epoch: 4, train_loss: 0.9333, test_loss: 0.9742, test_f1: 0.5098
 epoch: 5, train_loss: 0.9121, test_loss: 1.0370, test_f1: 0.4486
 epoch: 6, train_loss: 0.8991, test_loss: 0.9243, test_f1: 0.4761
 epoch: 7, train_loss: 0.8490, test_loss: 0.9679, test_f1: 0.5056
 epoch: 8, train_loss: 0.8509, test_loss: 0.9900, test_f1: 0.4504
 epoch: 9, train_loss: 0.8178, test_loss: 1.0103, test_f1: 0.4704
 epoch: 10, train_loss: 0.8029, test_loss: 1.0023, test_f1: 0.4647
 epoch: 11, train_loss: 0.7880, test_loss: 0.8527, test_f1: 0.5426
 epoch: 12, train_loss: 0.7607, test_loss: 0.9029, test_f1: 0.5132
 epoch: 13, train_loss: 0.7495, test_loss: 0.9376, test_f1: 0.5333
 epoch: 14, train_loss: 0.7460, test_loss: 0.9107, test_f1: 0.5694
 epoch: 15, train_loss: 0.7407, test_loss: 0.9820, test_f1: 0.5109
 epoch: 16, train_loss: 0.7301, test_loss: 0.9057, test_f1: 0.5599
 epoch: 17, train_loss: 0.7178, test_loss: 0.8517, test_f1: 0.6015
 epoch: 18, train_loss: 0.7190, test_loss: 0.8851, test_f1: 0.6096
 epoch: 19, train_loss: 0.7139, test_loss: 0.8959, test_f1: 0.5406
 epoch: 20, train_loss: 0.7257, test_loss: 0.8397, test_f1: 0.6232
 epoch: 21, train_loss: 0.6888, test_loss: 0.8658, test_f1: 0.6124
 epoch: 22, train_loss: 0.6735, test_loss: 0.9339, test_f1: 0.5617
 epoch: 23, train_loss: 0.6624, test_loss: 0.9112, test_f1: 0.5776
 epoch: 24, train_loss: 0.6676, test_loss: 0.9324, test_f1: 0.5508
 epoch: 25, train_loss: 0.6511, test_loss: 0.9227, test_f1: 0.6042
 epoch: 26, train_loss: 0.6473, test_loss: 0.8937, test_f1: 0.6072
 epoch: 27, train_loss: 0.6405, test_loss: 1.0842, test_f1: 0.5477
 epoch: 28, train_loss: 0.6566, test_loss: 0.8548, test_f1: 0.6405
 epoch: 29, train_loss: 0.6314, test_loss: 0.8200, test_f1: 0.6213
 epoch: 30, train_loss: 0.6059, test_loss: 0.8241, test_f1: 0.6542
 epoch: 31, train_loss: 0.6363, test_loss: 0.8151, test_f1: 0.6161
 epoch: 32, train_loss: 0.6110, test_loss: 0.8490, test_f1: 0.6353
 epoch: 33, train_loss: 0.5886, test_loss: 1.0083, test_f1: 0.6290
 epoch: 34, train_loss: 0.5884, test_loss: 0.8801, test_f1: 0.6267
 epoch: 35, train_loss: 0.5678, test_loss: 0.8184, test_f1: 0.6380
 epoch: 36, train_loss: 0.5914, test_loss: 0.9928, test_f1: 0.5753
 epoch: 37, train_loss: 0.5820, test_loss: 1.3760, test_f1: 0.5286
 epoch: 38, train_loss: 0.5677, test_loss: 0.9530, test_f1: 0.6231
 epoch: 39, train_loss: 0.5481, test_loss: 0.8252, test_f1: 0.6500
 epoch: 40, train_loss: 0.5433, test_loss: 0.9158, test_f1: 0.6447
 epoch: 41, train_loss: 0.5305, test_loss: 0.8274, test_f1: 0.6413
 epoch: 42, train_loss: 0.5429, test_loss: 0.8730, test_f1: 0.6742
 epoch: 43, train_loss: 0.5330, test_loss: 0.8650, test_f1: 0.6566
 epoch: 44, train_loss: 0.5354, test_loss: 0.8978, test_f1: 0.5942
 epoch: 45, train_loss: 0.5031, test_loss: 1.0773, test_f1: 0.5922
 epoch: 46, train_loss: 0.5075, test_loss: 1.0882, test_f1: 0.6160
 epoch: 47, train_loss: 0.5014, test_loss: 0.7891, test_f1: 0.6991
 epoch: 48, train_loss: 0.5062, test_loss: 1.2206, test_f1: 0.5649
 epoch: 49, train_loss: 0.4753, test_loss: 1.2002, test_f1: 0.5717
 epoch: 50, train_loss: 0.4873, test_loss: 1.0433, test_f1: 0.6249
 epoch: 51, train_loss: 0.4751, test_loss: 0.8269, test_f1: 0.6808
 epoch: 52, train_loss: 0.4383, test_loss: 0.8511, test_f1: 0.7003
 epoch: 53, train_loss: 0.4091, test_loss: 0.9310, test_f1: 0.6580
 epoch: 54, train_loss: 0.3994, test_loss: 1.0443, test_f1: 0.6427
 epoch: 55, train_loss: 0.3901, test_loss: 0.9705, test_f1: 0.6874
 epoch: 56, train_loss: 0.3879, test_loss: 0.9277, test_f1: 0.6965
 epoch: 57, train_loss: 0.3781, test_loss: 0.9404, test_f1: 0.6576
 epoch: 58, train_loss: 0.3727, test_loss: 0.8846, test_f1: 0.6846
 epoch: 59, train_loss: 0.3967, test_loss: 0.9920, test_f1: 0.6596
 epoch: 60, train_loss: 0.3823, test_loss: 1.0809, test_f1: 0.6650
 epoch: 61, train_loss: 0.3689, test_loss: 0.9559, test_f1: 0.6807
 epoch: 62, train_loss: 0.3631, test_loss: 1.1286, test_f1: 0.6629
 epoch: 63, train_loss: 0.3758, test_loss: 0.9383, test_f1: 0.6992
 epoch: 64, train_loss: 0.3591, test_loss: 1.2657, test_f1: 0.6291
 epoch: 65, train_loss: 0.3740, test_loss: 0.9983, test_f1: 0.6959
 epoch: 66, train_loss: 0.3478, test_loss: 1.1235, test_f1: 0.6702
 epoch: 67, train_loss: 0.3416, test_loss: 1.0240, test_f1: 0.6722
 epoch: 68, train_loss: 0.3488, test_loss: 1.0023, test_f1: 0.6960
 epoch: 69, train_loss: 0.3536, test_loss: 1.0489, test_f1: 0.6647
 epoch: 70, train_loss: 0.3140, test_loss: 0.9406, test_f1: 0.6884
 epoch: 71, train_loss: 0.3292, test_loss: 1.1497, test_f1: 0.6779
 epoch: 72, train_loss: 0.3567, test_loss: 1.0108, test_f1: 0.6563
 epoch: 73, train_loss: 0.3474, test_loss: 1.1932, test_f1: 0.6369
 epoch: 74, train_loss: 0.3213, test_loss: 1.0363, test_f1: 0.6596
 epoch: 75, train_loss: 0.3163, test_loss: 0.9601, test_f1: 0.6871
 epoch: 76, train_loss: 0.3093, test_loss: 0.9650, test_f1: 0.6869
 epoch: 77, train_loss: 0.3179, test_loss: 0.9370, test_f1: 0.6679
 epoch: 78, train_loss: 0.3054, test_loss: 1.2403, test_f1: 0.6457
 epoch: 79, train_loss: 0.3034, test_loss: 1.0870, test_f1: 0.6646
 epoch: 80, train_loss: 0.2982, test_loss: 1.2229, test_f1: 0.6618
 epoch: 81, train_loss: 0.3266, test_loss: 1.0537, test_f1: 0.6536
 epoch: 82, train_loss: 0.3368, test_loss: 1.1516, test_f1: 0.6360
 epoch: 83, train_loss: 0.3048, test_loss: 1.1660, test_f1: 0.6780
 epoch: 84, train_loss: 0.3073, test_loss: 1.1673, test_f1: 0.6718
 epoch: 85, train_loss: 0.3128, test_loss: 1.1564, test_f1: 0.6671
 epoch: 86, train_loss: 0.2772, test_loss: 1.1477, test_f1: 0.6776
 epoch: 87, train_loss: 0.2850, test_loss: 1.3380, test_f1: 0.6566
 epoch: 88, train_loss: 0.2758, test_loss: 1.1361, test_f1: 0.6790
 epoch: 89, train_loss: 0.2792, test_loss: 1.4433, test_f1: 0.6396
 epoch: 90, train_loss: 0.2867, test_loss: 1.0783, test_f1: 0.6902
 epoch: 91, train_loss: 0.3062, test_loss: 1.1674, test_f1: 0.6838
 epoch: 92, train_loss: 0.2898, test_loss: 1.3763, test_f1: 0.6471
 epoch: 93, train_loss: 0.2891, test_loss: 1.1532, test_f1: 0.6738
 epoch: 94, train_loss: 0.2709, test_loss: 1.5067, test_f1: 0.6510
 epoch: 95, train_loss: 0.2658, test_loss: 1.2291, test_f1: 0.6897
 epoch: 96, train_loss: 0.2652, test_loss: 1.3502, test_f1: 0.6651
 epoch: 97, train_loss: 0.2782, test_loss: 1.2790, test_f1: 0.6809
 epoch: 98, train_loss: 0.2803, test_loss: 1.4021, test_f1: 0.6196
 epoch: 99, train_loss: 0.2624, test_loss: 1.2975, test_f1: 0.6679
##################ITERATION #3 ****************************************
 epoch: 0, train_loss: 1.5534, test_loss: 1.3444, test_f1: 0.2681
 epoch: 1, train_loss: 1.0384, test_loss: 1.1070, test_f1: 0.3978
 epoch: 2, train_loss: 0.9986, test_loss: 1.1085, test_f1: 0.3816
 epoch: 3, train_loss: 0.9674, test_loss: 0.9500, test_f1: 0.4913
 epoch: 4, train_loss: 0.9359, test_loss: 0.9492, test_f1: 0.4906
 epoch: 5, train_loss: 0.9015, test_loss: 0.9431, test_f1: 0.5125
 epoch: 6, train_loss: 0.8781, test_loss: 0.9775, test_f1: 0.4784
 epoch: 7, train_loss: 0.8557, test_loss: 0.9047, test_f1: 0.5090
 epoch: 8, train_loss: 0.8403, test_loss: 0.9490, test_f1: 0.4982
 epoch: 9, train_loss: 0.8257, test_loss: 0.9350, test_f1: 0.5410
 epoch: 10, train_loss: 0.8118, test_loss: 0.8747, test_f1: 0.4953
 epoch: 11, train_loss: 0.7819, test_loss: 0.8903, test_f1: 0.5305
 epoch: 12, train_loss: 0.7883, test_loss: 0.8569, test_f1: 0.5271
 epoch: 13, train_loss: 0.7736, test_loss: 0.9268, test_f1: 0.5324
 epoch: 14, train_loss: 0.7559, test_loss: 0.7877, test_f1: 0.6167
 epoch: 15, train_loss: 0.7627, test_loss: 1.0899, test_f1: 0.4411
 epoch: 16, train_loss: 0.7232, test_loss: 0.8271, test_f1: 0.5525
 epoch: 17, train_loss: 0.7290, test_loss: 0.8746, test_f1: 0.5834
 epoch: 18, train_loss: 0.7105, test_loss: 0.8319, test_f1: 0.5684
 epoch: 19, train_loss: 0.6974, test_loss: 0.9048, test_f1: 0.5518
 epoch: 20, train_loss: 0.7015, test_loss: 0.8961, test_f1: 0.4924
 epoch: 21, train_loss: 0.6736, test_loss: 0.7740, test_f1: 0.6077
 epoch: 22, train_loss: 0.6694, test_loss: 0.8422, test_f1: 0.6084
 epoch: 23, train_loss: 0.6448, test_loss: 0.8211, test_f1: 0.6052
 epoch: 24, train_loss: 0.6671, test_loss: 0.9757, test_f1: 0.5215
 epoch: 25, train_loss: 0.6807, test_loss: 0.7783, test_f1: 0.6281
 epoch: 26, train_loss: 0.6411, test_loss: 0.9018, test_f1: 0.5832
 epoch: 27, train_loss: 0.6398, test_loss: 0.8384, test_f1: 0.5909
 epoch: 28, train_loss: 0.6323, test_loss: 0.8877, test_f1: 0.5789
 epoch: 29, train_loss: 0.6241, test_loss: 0.8431, test_f1: 0.6220
 epoch: 30, train_loss: 0.5969, test_loss: 0.9986, test_f1: 0.5505
 epoch: 31, train_loss: 0.6276, test_loss: 0.9601, test_f1: 0.5589
 epoch: 32, train_loss: 0.5989, test_loss: 1.0514, test_f1: 0.5841
 epoch: 33, train_loss: 0.6051, test_loss: 0.8012, test_f1: 0.6381
 epoch: 34, train_loss: 0.5969, test_loss: 0.8082, test_f1: 0.6219
 epoch: 35, train_loss: 0.5847, test_loss: 0.8675, test_f1: 0.5864
 epoch: 36, train_loss: 0.5713, test_loss: 0.8776, test_f1: 0.6395
 epoch: 37, train_loss: 0.5784, test_loss: 0.9491, test_f1: 0.6107
 epoch: 38, train_loss: 0.5684, test_loss: 0.9516, test_f1: 0.6228
 epoch: 39, train_loss: 0.5550, test_loss: 0.8553, test_f1: 0.6084
 epoch: 40, train_loss: 0.5378, test_loss: 0.8103, test_f1: 0.6291
 epoch: 41, train_loss: 0.5165, test_loss: 0.8194, test_f1: 0.6340
 epoch: 42, train_loss: 0.5497, test_loss: 0.8290, test_f1: 0.6291
 epoch: 43, train_loss: 0.5151, test_loss: 1.0063, test_f1: 0.5847
 epoch: 44, train_loss: 0.5251, test_loss: 0.9149, test_f1: 0.5860
 epoch: 45, train_loss: 0.5292, test_loss: 1.2877, test_f1: 0.5441
 epoch: 46, train_loss: 0.5012, test_loss: 0.9068, test_f1: 0.6367
 epoch: 47, train_loss: 0.5053, test_loss: 0.8143, test_f1: 0.6679
 epoch: 48, train_loss: 0.4975, test_loss: 0.8511, test_f1: 0.6141
 epoch: 49, train_loss: 0.4900, test_loss: 0.9008, test_f1: 0.6164
 epoch: 50, train_loss: 0.5005, test_loss: 0.8609, test_f1: 0.6241
 epoch: 51, train_loss: 0.4727, test_loss: 0.9792, test_f1: 0.6049
 epoch: 52, train_loss: 0.4370, test_loss: 0.9218, test_f1: 0.6570
 epoch: 53, train_loss: 0.4124, test_loss: 0.8641, test_f1: 0.6501
 epoch: 54, train_loss: 0.3950, test_loss: 0.8472, test_f1: 0.6694
 epoch: 55, train_loss: 0.3879, test_loss: 0.8980, test_f1: 0.6666
 epoch: 56, train_loss: 0.3973, test_loss: 0.8900, test_f1: 0.6768
 epoch: 57, train_loss: 0.4045, test_loss: 0.9264, test_f1: 0.6480
 epoch: 58, train_loss: 0.3892, test_loss: 0.9783, test_f1: 0.6349
 epoch: 59, train_loss: 0.3756, test_loss: 0.8645, test_f1: 0.6821
 epoch: 60, train_loss: 0.3713, test_loss: 0.9348, test_f1: 0.6523
 epoch: 61, train_loss: 0.3744, test_loss: 0.8505, test_f1: 0.6751
 epoch: 62, train_loss: 0.3729, test_loss: 0.9093, test_f1: 0.6480
 epoch: 63, train_loss: 0.3688, test_loss: 1.0559, test_f1: 0.6589
 epoch: 64, train_loss: 0.3685, test_loss: 0.9945, test_f1: 0.6725
 epoch: 65, train_loss: 0.3693, test_loss: 1.1670, test_f1: 0.6410
 epoch: 66, train_loss: 0.3555, test_loss: 1.0377, test_f1: 0.6576
 epoch: 67, train_loss: 0.3690, test_loss: 0.9549, test_f1: 0.6619
 epoch: 68, train_loss: 0.3465, test_loss: 1.1515, test_f1: 0.6293
 epoch: 69, train_loss: 0.3495, test_loss: 1.2212, test_f1: 0.5856
 epoch: 70, train_loss: 0.3479, test_loss: 1.0111, test_f1: 0.6521
 epoch: 71, train_loss: 0.3336, test_loss: 1.1708, test_f1: 0.6283
 epoch: 72, train_loss: 0.3196, test_loss: 0.9674, test_f1: 0.6676
 epoch: 73, train_loss: 0.3374, test_loss: 1.0121, test_f1: 0.6699
 epoch: 74, train_loss: 0.3270, test_loss: 1.1153, test_f1: 0.6589
 epoch: 75, train_loss: 0.3199, test_loss: 1.1328, test_f1: 0.6580
 epoch: 76, train_loss: 0.3240, test_loss: 0.9993, test_f1: 0.6678
 epoch: 77, train_loss: 0.3502, test_loss: 1.2495, test_f1: 0.6259
 epoch: 78, train_loss: 0.3360, test_loss: 1.1880, test_f1: 0.6495
 epoch: 79, train_loss: 0.3366, test_loss: 1.1087, test_f1: 0.6195
 epoch: 80, train_loss: 0.3256, test_loss: 1.1000, test_f1: 0.6762
 epoch: 81, train_loss: 0.3407, test_loss: 1.5324, test_f1: 0.5985
 epoch: 82, train_loss: 0.3178, test_loss: 1.0602, test_f1: 0.6484
 epoch: 83, train_loss: 0.3246, test_loss: 1.3666, test_f1: 0.5985
 epoch: 84, train_loss: 0.3058, test_loss: 0.9818, test_f1: 0.6969
 epoch: 85, train_loss: 0.3223, test_loss: 1.0320, test_f1: 0.6973
 epoch: 86, train_loss: 0.3146, test_loss: 1.3280, test_f1: 0.6028
 epoch: 87, train_loss: 0.2763, test_loss: 1.2502, test_f1: 0.6556
 epoch: 88, train_loss: 0.3037, test_loss: 1.4783, test_f1: 0.5990
 epoch: 89, train_loss: 0.2917, test_loss: 1.1759, test_f1: 0.6349
 epoch: 90, train_loss: 0.2965, test_loss: 1.1228, test_f1: 0.6483
 epoch: 91, train_loss: 0.2859, test_loss: 1.3281, test_f1: 0.6444
 epoch: 92, train_loss: 0.3084, test_loss: 1.4451, test_f1: 0.5747
 epoch: 93, train_loss: 0.3151, test_loss: 1.4033, test_f1: 0.6090
 epoch: 94, train_loss: 0.2933, test_loss: 1.0445, test_f1: 0.6498
 epoch: 95, train_loss: 0.2761, test_loss: 1.0334, test_f1: 0.6885
 epoch: 96, train_loss: 0.2743, test_loss: 1.1458, test_f1: 0.6539
 epoch: 97, train_loss: 0.2779, test_loss: 1.1634, test_f1: 0.6680
 epoch: 98, train_loss: 0.2646, test_loss: 1.2561, test_f1: 0.6302
 epoch: 99, train_loss: 0.2899, test_loss: 1.3126, test_f1: 0.6289
##################ITERATION #4 ****************************************
 epoch: 0, train_loss: 1.5611, test_loss: 1.4340, test_f1: 0.3614
 epoch: 1, train_loss: 1.0320, test_loss: 1.2341, test_f1: 0.2956
 epoch: 2, train_loss: 0.9897, test_loss: 1.1055, test_f1: 0.3970
 epoch: 3, train_loss: 0.9531, test_loss: 1.0481, test_f1: 0.5095
 epoch: 4, train_loss: 0.9134, test_loss: 1.0377, test_f1: 0.4383
 epoch: 5, train_loss: 0.8926, test_loss: 0.9840, test_f1: 0.5506
 epoch: 6, train_loss: 0.8922, test_loss: 1.0611, test_f1: 0.4781
 epoch: 7, train_loss: 0.8842, test_loss: 0.9041, test_f1: 0.5731
 epoch: 8, train_loss: 0.8537, test_loss: 0.8998, test_f1: 0.5034
 epoch: 9, train_loss: 0.8639, test_loss: 0.9836, test_f1: 0.4615
 epoch: 10, train_loss: 0.8441, test_loss: 1.0683, test_f1: 0.4737
 epoch: 11, train_loss: 0.8244, test_loss: 0.8729, test_f1: 0.5848
 epoch: 12, train_loss: 0.7914, test_loss: 0.8556, test_f1: 0.5720
 epoch: 13, train_loss: 0.7709, test_loss: 0.9266, test_f1: 0.5238
 epoch: 14, train_loss: 0.7778, test_loss: 0.9079, test_f1: 0.5657
 epoch: 15, train_loss: 0.7535, test_loss: 0.8553, test_f1: 0.5498
 epoch: 16, train_loss: 0.7328, test_loss: 1.0450, test_f1: 0.5407
 epoch: 17, train_loss: 0.7209, test_loss: 0.8151, test_f1: 0.6242
 epoch: 18, train_loss: 0.7372, test_loss: 1.1360, test_f1: 0.4994
 epoch: 19, train_loss: 0.7205, test_loss: 0.8876, test_f1: 0.5875
 epoch: 20, train_loss: 0.6995, test_loss: 0.7938, test_f1: 0.6119
 epoch: 21, train_loss: 0.6930, test_loss: 0.8583, test_f1: 0.5885
 epoch: 22, train_loss: 0.6868, test_loss: 1.1914, test_f1: 0.5246
 epoch: 23, train_loss: 0.6790, test_loss: 0.8291, test_f1: 0.6202
 epoch: 24, train_loss: 0.6702, test_loss: 1.3139, test_f1: 0.5463
 epoch: 25, train_loss: 0.6804, test_loss: 0.8697, test_f1: 0.6218
 epoch: 26, train_loss: 0.6769, test_loss: 0.9343, test_f1: 0.5748
 epoch: 27, train_loss: 0.6659, test_loss: 0.8126, test_f1: 0.6236
 epoch: 28, train_loss: 0.6437, test_loss: 1.1222, test_f1: 0.5565
 epoch: 29, train_loss: 0.6491, test_loss: 0.9199, test_f1: 0.5898
 epoch: 30, train_loss: 0.6150, test_loss: 0.8609, test_f1: 0.6059
 epoch: 31, train_loss: 0.6129, test_loss: 0.8251, test_f1: 0.6401
 epoch: 32, train_loss: 0.5900, test_loss: 0.9261, test_f1: 0.6027
 epoch: 33, train_loss: 0.6098, test_loss: 1.0490, test_f1: 0.5267
 epoch: 34, train_loss: 0.5811, test_loss: 0.8446, test_f1: 0.6236
 epoch: 35, train_loss: 0.6274, test_loss: 0.9378, test_f1: 0.5955
 epoch: 36, train_loss: 0.6292, test_loss: 1.1321, test_f1: 0.5680
 epoch: 37, train_loss: 0.5833, test_loss: 0.8534, test_f1: 0.6310
 epoch: 38, train_loss: 0.5768, test_loss: 0.8172, test_f1: 0.6544
 epoch: 39, train_loss: 0.5775, test_loss: 0.9054, test_f1: 0.6171
 epoch: 40, train_loss: 0.5665, test_loss: 0.9200, test_f1: 0.6432
 epoch: 41, train_loss: 0.5698, test_loss: 0.8379, test_f1: 0.6454
 epoch: 42, train_loss: 0.5420, test_loss: 0.9338, test_f1: 0.6135
 epoch: 43, train_loss: 0.5475, test_loss: 0.9304, test_f1: 0.6450
 epoch: 44, train_loss: 0.5710, test_loss: 1.0387, test_f1: 0.5614
 epoch: 45, train_loss: 0.5512, test_loss: 0.9496, test_f1: 0.6346
 epoch: 46, train_loss: 0.5434, test_loss: 1.0240, test_f1: 0.6135
 epoch: 47, train_loss: 0.5299, test_loss: 0.8334, test_f1: 0.6821
 epoch: 48, train_loss: 0.5008, test_loss: 0.9487, test_f1: 0.6650
 epoch: 49, train_loss: 0.4996, test_loss: 0.8826, test_f1: 0.6758
 epoch: 50, train_loss: 0.5124, test_loss: 0.9834, test_f1: 0.6071
 epoch: 51, train_loss: 0.4864, test_loss: 0.9973, test_f1: 0.6548
 epoch: 52, train_loss: 0.4774, test_loss: 0.8843, test_f1: 0.6499
 epoch: 53, train_loss: 0.4385, test_loss: 0.9399, test_f1: 0.6666
 epoch: 54, train_loss: 0.4440, test_loss: 0.9284, test_f1: 0.6530
 epoch: 55, train_loss: 0.4164, test_loss: 0.9005, test_f1: 0.6686
 epoch: 56, train_loss: 0.4169, test_loss: 0.9796, test_f1: 0.6533
 epoch: 57, train_loss: 0.4149, test_loss: 0.9288, test_f1: 0.6644
 epoch: 58, train_loss: 0.4030, test_loss: 0.9335, test_f1: 0.6742
 epoch: 59, train_loss: 0.4080, test_loss: 0.9306, test_f1: 0.6724
 epoch: 60, train_loss: 0.4127, test_loss: 0.9323, test_f1: 0.6599
 epoch: 61, train_loss: 0.3819, test_loss: 1.1046, test_f1: 0.6433
 epoch: 62, train_loss: 0.3907, test_loss: 0.9523, test_f1: 0.7121
 epoch: 63, train_loss: 0.3630, test_loss: 0.8882, test_f1: 0.6950
 epoch: 64, train_loss: 0.3766, test_loss: 1.1777, test_f1: 0.6236
 epoch: 65, train_loss: 0.3947, test_loss: 1.0819, test_f1: 0.6664
 epoch: 66, train_loss: 0.4235, test_loss: 1.0810, test_f1: 0.6237
 epoch: 67, train_loss: 0.3789, test_loss: 0.9583, test_f1: 0.6894
 epoch: 68, train_loss: 0.3819, test_loss: 1.0527, test_f1: 0.6672
 epoch: 69, train_loss: 0.3704, test_loss: 1.0822, test_f1: 0.6355
 epoch: 70, train_loss: 0.3502, test_loss: 1.0289, test_f1: 0.6758
 epoch: 71, train_loss: 0.3509, test_loss: 1.0733, test_f1: 0.6593
 epoch: 72, train_loss: 0.3568, test_loss: 1.0390, test_f1: 0.6797
 epoch: 73, train_loss: 0.3622, test_loss: 1.1705, test_f1: 0.6694
 epoch: 74, train_loss: 0.3594, test_loss: 1.0082, test_f1: 0.6569
 epoch: 75, train_loss: 0.3605, test_loss: 1.1045, test_f1: 0.6555
 epoch: 76, train_loss: 0.3451, test_loss: 1.1182, test_f1: 0.6855
 epoch: 77, train_loss: 0.3410, test_loss: 1.2463, test_f1: 0.6434
 epoch: 78, train_loss: 0.3547, test_loss: 1.0402, test_f1: 0.6725
 epoch: 79, train_loss: 0.3363, test_loss: 1.1682, test_f1: 0.6742
 epoch: 80, train_loss: 0.3436, test_loss: 1.1663, test_f1: 0.6469
 epoch: 81, train_loss: 0.3532, test_loss: 1.1128, test_f1: 0.6673
 epoch: 82, train_loss: 0.3383, test_loss: 1.2071, test_f1: 0.6738
 epoch: 83, train_loss: 0.3206, test_loss: 1.2704, test_f1: 0.6443
 epoch: 84, train_loss: 0.3393, test_loss: 1.3071, test_f1: 0.6529
 epoch: 85, train_loss: 0.3350, test_loss: 1.1175, test_f1: 0.6486
 epoch: 86, train_loss: 0.3304, test_loss: 1.1098, test_f1: 0.6399
 epoch: 87, train_loss: 0.3181, test_loss: 1.1548, test_f1: 0.6552
 epoch: 88, train_loss: 0.3002, test_loss: 1.2015, test_f1: 0.6746
 epoch: 89, train_loss: 0.2983, test_loss: 1.1884, test_f1: 0.6540
 epoch: 90, train_loss: 0.3349, test_loss: 1.2346, test_f1: 0.6494
 epoch: 91, train_loss: 0.3213, test_loss: 1.2342, test_f1: 0.6461
 epoch: 92, train_loss: 0.3230, test_loss: 1.1551, test_f1: 0.6712
 epoch: 93, train_loss: 0.3102, test_loss: 1.2503, test_f1: 0.6596
 epoch: 94, train_loss: 0.2852, test_loss: 1.3394, test_f1: 0.6536
 epoch: 95, train_loss: 0.2730, test_loss: 1.1694, test_f1: 0.6768
 epoch: 96, train_loss: 0.2983, test_loss: 1.2985, test_f1: 0.6669
 epoch: 97, train_loss: 0.2908, test_loss: 1.2949, test_f1: 0.6624
 epoch: 98, train_loss: 0.3152, test_loss: 1.3819, test_f1: 0.6585
 epoch: 99, train_loss: 0.3208, test_loss: 1.2260, test_f1: 0.6558
##################ITERATION #5 ****************************************
 epoch: 0, train_loss: 1.8313, test_loss: 1.6076, test_f1: 0.2666
 epoch: 1, train_loss: 1.0817, test_loss: 1.2561, test_f1: 0.3343
 epoch: 2, train_loss: 1.0077, test_loss: 1.0749, test_f1: 0.4629
 epoch: 3, train_loss: 0.9609, test_loss: 1.0587, test_f1: 0.4389
 epoch: 4, train_loss: 0.9334, test_loss: 1.0034, test_f1: 0.5188
 epoch: 5, train_loss: 0.9077, test_loss: 0.9783, test_f1: 0.4991
 epoch: 6, train_loss: 0.8876, test_loss: 1.0709, test_f1: 0.5084
 epoch: 7, train_loss: 0.8628, test_loss: 1.0534, test_f1: 0.4894
 epoch: 8, train_loss: 0.8442, test_loss: 0.9006, test_f1: 0.5407
 epoch: 9, train_loss: 0.8185, test_loss: 1.0433, test_f1: 0.5082
 epoch: 10, train_loss: 0.7950, test_loss: 1.0276, test_f1: 0.4913
 epoch: 11, train_loss: 0.8073, test_loss: 0.8763, test_f1: 0.5198
 epoch: 12, train_loss: 0.7834, test_loss: 1.0390, test_f1: 0.4880
 epoch: 13, train_loss: 0.7623, test_loss: 0.7845, test_f1: 0.6037
 epoch: 14, train_loss: 0.7512, test_loss: 1.0050, test_f1: 0.5240
 epoch: 15, train_loss: 0.7417, test_loss: 1.4272, test_f1: 0.4321
 epoch: 16, train_loss: 0.7570, test_loss: 1.0014, test_f1: 0.5013
 epoch: 17, train_loss: 0.7288, test_loss: 0.9588, test_f1: 0.5830
 epoch: 18, train_loss: 0.7286, test_loss: 1.0114, test_f1: 0.5512
 epoch: 19, train_loss: 0.7055, test_loss: 0.8981, test_f1: 0.5857
 epoch: 20, train_loss: 0.6812, test_loss: 1.0140, test_f1: 0.5594
 epoch: 21, train_loss: 0.6678, test_loss: 0.9202, test_f1: 0.5423
 epoch: 22, train_loss: 0.6688, test_loss: 1.0455, test_f1: 0.5482
 epoch: 23, train_loss: 0.6600, test_loss: 1.2274, test_f1: 0.5040
 epoch: 24, train_loss: 0.6679, test_loss: 0.9558, test_f1: 0.5751
 epoch: 25, train_loss: 0.6450, test_loss: 1.1258, test_f1: 0.5361
 epoch: 26, train_loss: 0.6534, test_loss: 0.9869, test_f1: 0.5938
 epoch: 27, train_loss: 0.6405, test_loss: 0.9482, test_f1: 0.5901
 epoch: 28, train_loss: 0.6441, test_loss: 0.9406, test_f1: 0.6007
 epoch: 29, train_loss: 0.6265, test_loss: 0.9219, test_f1: 0.6294
 epoch: 30, train_loss: 0.6324, test_loss: 1.0263, test_f1: 0.5925
 epoch: 31, train_loss: 0.6010, test_loss: 0.9167, test_f1: 0.6323
 epoch: 32, train_loss: 0.6013, test_loss: 1.0286, test_f1: 0.6055
 epoch: 33, train_loss: 0.6043, test_loss: 0.8894, test_f1: 0.6646
 epoch: 34, train_loss: 0.5820, test_loss: 0.9531, test_f1: 0.6465
 epoch: 35, train_loss: 0.5824, test_loss: 1.0156, test_f1: 0.5983
 epoch: 36, train_loss: 0.5811, test_loss: 0.9133, test_f1: 0.6159
 epoch: 37, train_loss: 0.5815, test_loss: 0.9891, test_f1: 0.5806
 epoch: 38, train_loss: 0.5687, test_loss: 0.9644, test_f1: 0.6125
 epoch: 39, train_loss: 0.5571, test_loss: 0.9908, test_f1: 0.5789
 epoch: 40, train_loss: 0.5488, test_loss: 1.0032, test_f1: 0.6147
 epoch: 41, train_loss: 0.5478, test_loss: 1.1851, test_f1: 0.5391
 epoch: 42, train_loss: 0.5453, test_loss: 0.9605, test_f1: 0.6437
 epoch: 43, train_loss: 0.5300, test_loss: 1.0978, test_f1: 0.5810
 epoch: 44, train_loss: 0.5722, test_loss: 1.2267, test_f1: 0.5068
 epoch: 45, train_loss: 0.5365, test_loss: 1.2283, test_f1: 0.5972
 epoch: 46, train_loss: 0.5173, test_loss: 0.9828, test_f1: 0.6511
 epoch: 47, train_loss: 0.5318, test_loss: 0.8777, test_f1: 0.6368
 epoch: 48, train_loss: 0.5332, test_loss: 0.9982, test_f1: 0.6073
 epoch: 49, train_loss: 0.5289, test_loss: 0.9190, test_f1: 0.6415
 epoch: 50, train_loss: 0.4916, test_loss: 0.9598, test_f1: 0.6237
 epoch: 51, train_loss: 0.4743, test_loss: 0.9242, test_f1: 0.6557
 epoch: 52, train_loss: 0.4459, test_loss: 1.0654, test_f1: 0.6463
 epoch: 53, train_loss: 0.4370, test_loss: 1.0105, test_f1: 0.6400
 epoch: 54, train_loss: 0.4413, test_loss: 1.0826, test_f1: 0.6232
 epoch: 55, train_loss: 0.4164, test_loss: 1.0718, test_f1: 0.6564
 epoch: 56, train_loss: 0.4243, test_loss: 1.0618, test_f1: 0.6447
 epoch: 57, train_loss: 0.4207, test_loss: 1.0275, test_f1: 0.6382
 epoch: 58, train_loss: 0.4097, test_loss: 1.1446, test_f1: 0.6119
 epoch: 59, train_loss: 0.4268, test_loss: 1.0550, test_f1: 0.6353
 epoch: 60, train_loss: 0.4024, test_loss: 1.0159, test_f1: 0.6717
 epoch: 61, train_loss: 0.4137, test_loss: 1.0943, test_f1: 0.6351
 epoch: 62, train_loss: 0.4070, test_loss: 1.0656, test_f1: 0.6295
 epoch: 63, train_loss: 0.3932, test_loss: 1.1826, test_f1: 0.5726
 epoch: 64, train_loss: 0.3888, test_loss: 1.0972, test_f1: 0.6289
 epoch: 65, train_loss: 0.3948, test_loss: 1.0387, test_f1: 0.6578
 epoch: 66, train_loss: 0.3859, test_loss: 1.1374, test_f1: 0.6566
 epoch: 67, train_loss: 0.3828, test_loss: 1.1047, test_f1: 0.6299
 epoch: 68, train_loss: 0.3610, test_loss: 1.0762, test_f1: 0.6391
 epoch: 69, train_loss: 0.3705, test_loss: 1.1567, test_f1: 0.6388
 epoch: 70, train_loss: 0.3883, test_loss: 1.0398, test_f1: 0.6727
 epoch: 71, train_loss: 0.3551, test_loss: 1.0947, test_f1: 0.6342
 epoch: 72, train_loss: 0.3688, test_loss: 1.2370, test_f1: 0.6204
 epoch: 73, train_loss: 0.3944, test_loss: 1.0636, test_f1: 0.6302
 epoch: 74, train_loss: 0.3553, test_loss: 1.1446, test_f1: 0.6279
 epoch: 75, train_loss: 0.3567, test_loss: 1.1275, test_f1: 0.6329
 epoch: 76, train_loss: 0.3557, test_loss: 1.0380, test_f1: 0.6264
 epoch: 77, train_loss: 0.3627, test_loss: 1.0678, test_f1: 0.6549
 epoch: 78, train_loss: 0.3475, test_loss: 1.2153, test_f1: 0.6318
 epoch: 79, train_loss: 0.3446, test_loss: 1.1717, test_f1: 0.6339
 epoch: 80, train_loss: 0.3423, test_loss: 1.1698, test_f1: 0.6287
 epoch: 81, train_loss: 0.3398, test_loss: 1.1410, test_f1: 0.6371
 epoch: 82, train_loss: 0.3358, test_loss: 1.1107, test_f1: 0.6436
 epoch: 83, train_loss: 0.3511, test_loss: 1.2446, test_f1: 0.6062
 epoch: 84, train_loss: 0.3167, test_loss: 1.1121, test_f1: 0.6499
 epoch: 85, train_loss: 0.3289, test_loss: 1.0959, test_f1: 0.6697
 epoch: 86, train_loss: 0.3398, test_loss: 1.1627, test_f1: 0.6161
 epoch: 87, train_loss: 0.3308, test_loss: 1.0816, test_f1: 0.6481
 epoch: 88, train_loss: 0.3493, test_loss: 1.1269, test_f1: 0.6538
 epoch: 89, train_loss: 0.3367, test_loss: 1.2903, test_f1: 0.6239
 epoch: 90, train_loss: 0.3323, test_loss: 1.1621, test_f1: 0.6287
 epoch: 91, train_loss: 0.3232, test_loss: 1.1866, test_f1: 0.6551
 epoch: 92, train_loss: 0.3075, test_loss: 1.3120, test_f1: 0.6374
 epoch: 93, train_loss: 0.3304, test_loss: 1.4032, test_f1: 0.6462
 epoch: 94, train_loss: 0.3031, test_loss: 1.2025, test_f1: 0.6466
 epoch: 95, train_loss: 0.3100, test_loss: 1.2420, test_f1: 0.6393
 epoch: 96, train_loss: 0.3020, test_loss: 1.1704, test_f1: 0.6418
 epoch: 97, train_loss: 0.3089, test_loss: 1.1179, test_f1: 0.6580
 epoch: 98, train_loss: 0.3043, test_loss: 1.4035, test_f1: 0.5947
 epoch: 99, train_loss: 0.3313, test_loss: 1.2550, test_f1: 0.6433
##################ITERATION #6 ****************************************
 epoch: 0, train_loss: 1.5515, test_loss: 1.3512, test_f1: 0.2385
 epoch: 1, train_loss: 1.0297, test_loss: 1.2050, test_f1: 0.2981
 epoch: 2, train_loss: 0.9822, test_loss: 1.0988, test_f1: 0.4788
 epoch: 3, train_loss: 0.9465, test_loss: 0.9895, test_f1: 0.4927
 epoch: 4, train_loss: 0.9192, test_loss: 0.9911, test_f1: 0.4721
 epoch: 5, train_loss: 0.8832, test_loss: 0.9417, test_f1: 0.4846
 epoch: 6, train_loss: 0.8847, test_loss: 0.9095, test_f1: 0.4992
 epoch: 7, train_loss: 0.8499, test_loss: 0.9704, test_f1: 0.4124
 epoch: 8, train_loss: 0.8229, test_loss: 1.0921, test_f1: 0.4852
 epoch: 9, train_loss: 0.8184, test_loss: 0.8935, test_f1: 0.5315
 epoch: 10, train_loss: 0.8155, test_loss: 0.9363, test_f1: 0.5241
 epoch: 11, train_loss: 0.7917, test_loss: 1.0028, test_f1: 0.5241
 epoch: 12, train_loss: 0.7768, test_loss: 0.9325, test_f1: 0.5184
 epoch: 13, train_loss: 0.7528, test_loss: 0.9032, test_f1: 0.5801
 epoch: 14, train_loss: 0.7514, test_loss: 1.1599, test_f1: 0.4931
 epoch: 15, train_loss: 0.7555, test_loss: 1.6300, test_f1: 0.4281
 epoch: 16, train_loss: 0.7480, test_loss: 0.9791, test_f1: 0.5300
 epoch: 17, train_loss: 0.7426, test_loss: 0.9795, test_f1: 0.5921
 epoch: 18, train_loss: 0.7319, test_loss: 0.8896, test_f1: 0.5753
 epoch: 19, train_loss: 0.7223, test_loss: 0.8841, test_f1: 0.5674
 epoch: 20, train_loss: 0.6962, test_loss: 0.8941, test_f1: 0.6298
 epoch: 21, train_loss: 0.6764, test_loss: 0.8922, test_f1: 0.5744
 epoch: 22, train_loss: 0.6750, test_loss: 1.0061, test_f1: 0.5823
 epoch: 23, train_loss: 0.6849, test_loss: 0.8639, test_f1: 0.6084
 epoch: 24, train_loss: 0.6703, test_loss: 1.0383, test_f1: 0.5738
 epoch: 25, train_loss: 0.6638, test_loss: 0.9113, test_f1: 0.5926
 epoch: 26, train_loss: 0.6451, test_loss: 0.9463, test_f1: 0.5781
 epoch: 27, train_loss: 0.6413, test_loss: 0.9144, test_f1: 0.6443
 epoch: 28, train_loss: 0.6294, test_loss: 0.9096, test_f1: 0.6000
 epoch: 29, train_loss: 0.6323, test_loss: 0.9173, test_f1: 0.6218
 epoch: 30, train_loss: 0.6299, test_loss: 1.0422, test_f1: 0.5697
 epoch: 31, train_loss: 0.6116, test_loss: 1.0083, test_f1: 0.5745
 epoch: 32, train_loss: 0.6218, test_loss: 0.8872, test_f1: 0.6441
 epoch: 33, train_loss: 0.6088, test_loss: 0.8966, test_f1: 0.6101
 epoch: 34, train_loss: 0.5978, test_loss: 1.1709, test_f1: 0.5402
 epoch: 35, train_loss: 0.5987, test_loss: 1.0971, test_f1: 0.5898
 epoch: 36, train_loss: 0.5962, test_loss: 0.9678, test_f1: 0.5967
 epoch: 37, train_loss: 0.5955, test_loss: 0.9649, test_f1: 0.5647
 epoch: 38, train_loss: 0.5914, test_loss: 0.9027, test_f1: 0.6364
 epoch: 39, train_loss: 0.5722, test_loss: 0.9140, test_f1: 0.6333
 epoch: 40, train_loss: 0.5596, test_loss: 1.1616, test_f1: 0.5819
 epoch: 41, train_loss: 0.5578, test_loss: 0.9062, test_f1: 0.6691
 epoch: 42, train_loss: 0.5549, test_loss: 1.0456, test_f1: 0.6062
 epoch: 43, train_loss: 0.5524, test_loss: 1.0762, test_f1: 0.5872
 epoch: 44, train_loss: 0.5434, test_loss: 1.2173, test_f1: 0.5549
 epoch: 45, train_loss: 0.5426, test_loss: 0.9399, test_f1: 0.6073
 epoch: 46, train_loss: 0.5501, test_loss: 1.0145, test_f1: 0.6285
 epoch: 47, train_loss: 0.5157, test_loss: 0.9821, test_f1: 0.6131
 epoch: 48, train_loss: 0.5242, test_loss: 1.3197, test_f1: 0.5939
 epoch: 49, train_loss: 0.5267, test_loss: 0.9027, test_f1: 0.6176
 epoch: 50, train_loss: 0.5289, test_loss: 1.0018, test_f1: 0.5913
 epoch: 51, train_loss: 0.4948, test_loss: 0.9839, test_f1: 0.6415
 epoch: 52, train_loss: 0.4732, test_loss: 1.0717, test_f1: 0.6326
 epoch: 53, train_loss: 0.4677, test_loss: 1.0978, test_f1: 0.6275
 epoch: 54, train_loss: 0.4357, test_loss: 1.0668, test_f1: 0.6510
 epoch: 55, train_loss: 0.4322, test_loss: 1.0489, test_f1: 0.6525
 epoch: 56, train_loss: 0.4329, test_loss: 1.0575, test_f1: 0.6309
 epoch: 57, train_loss: 0.4154, test_loss: 1.0076, test_f1: 0.6568
 epoch: 58, train_loss: 0.3931, test_loss: 1.0386, test_f1: 0.6469
 epoch: 59, train_loss: 0.4056, test_loss: 1.0218, test_f1: 0.6473
 epoch: 60, train_loss: 0.3940, test_loss: 0.9832, test_f1: 0.6458
 epoch: 61, train_loss: 0.4118, test_loss: 1.0436, test_f1: 0.6454
 epoch: 62, train_loss: 0.4111, test_loss: 1.2917, test_f1: 0.6124
 epoch: 63, train_loss: 0.4054, test_loss: 1.0379, test_f1: 0.6799
 epoch: 64, train_loss: 0.3803, test_loss: 1.1039, test_f1: 0.6485
 epoch: 65, train_loss: 0.3812, test_loss: 1.0989, test_f1: 0.6723
 epoch: 66, train_loss: 0.3775, test_loss: 1.1842, test_f1: 0.6288
 epoch: 67, train_loss: 0.3787, test_loss: 1.1205, test_f1: 0.6708
 epoch: 68, train_loss: 0.3912, test_loss: 1.1399, test_f1: 0.6446
 epoch: 69, train_loss: 0.4168, test_loss: 1.0686, test_f1: 0.6692
 epoch: 70, train_loss: 0.4009, test_loss: 1.1235, test_f1: 0.6506
 epoch: 71, train_loss: 0.3797, test_loss: 0.9785, test_f1: 0.6670
 epoch: 72, train_loss: 0.3630, test_loss: 1.0482, test_f1: 0.6508
 epoch: 73, train_loss: 0.3863, test_loss: 1.1530, test_f1: 0.6192
 epoch: 74, train_loss: 0.3583, test_loss: 1.1391, test_f1: 0.6533
 epoch: 75, train_loss: 0.3576, test_loss: 1.3162, test_f1: 0.6210
 epoch: 76, train_loss: 0.3674, test_loss: 1.2726, test_f1: 0.6447
 epoch: 77, train_loss: 0.3758, test_loss: 1.2944, test_f1: 0.6428
 epoch: 78, train_loss: 0.3541, test_loss: 1.1125, test_f1: 0.6715
 epoch: 79, train_loss: 0.3382, test_loss: 1.1850, test_f1: 0.6552
 epoch: 80, train_loss: 0.3361, test_loss: 1.3402, test_f1: 0.6330
 epoch: 81, train_loss: 0.3323, test_loss: 1.1944, test_f1: 0.6729
 epoch: 82, train_loss: 0.3404, test_loss: 1.3798, test_f1: 0.6408
 epoch: 83, train_loss: 0.3458, test_loss: 1.3415, test_f1: 0.6259
 epoch: 84, train_loss: 0.3412, test_loss: 1.2656, test_f1: 0.6517
 epoch: 85, train_loss: 0.3606, test_loss: 1.2694, test_f1: 0.6759
 epoch: 86, train_loss: 0.3535, test_loss: 1.5191, test_f1: 0.6144
 epoch: 87, train_loss: 0.3418, test_loss: 1.3640, test_f1: 0.6487
 epoch: 88, train_loss: 0.3261, test_loss: 1.4335, test_f1: 0.6176
 epoch: 89, train_loss: 0.3400, test_loss: 1.3477, test_f1: 0.6423
 epoch: 90, train_loss: 0.3367, test_loss: 1.3292, test_f1: 0.6519
 epoch: 91, train_loss: 0.3306, test_loss: 1.2265, test_f1: 0.6600
 epoch: 92, train_loss: 0.3357, test_loss: 1.3161, test_f1: 0.6440
 epoch: 93, train_loss: 0.3338, test_loss: 1.3929, test_f1: 0.6405
 epoch: 94, train_loss: 0.3439, test_loss: 1.4346, test_f1: 0.6430
 epoch: 95, train_loss: 0.3135, test_loss: 1.3145, test_f1: 0.6645
 epoch: 96, train_loss: 0.3153, test_loss: 1.3125, test_f1: 0.6466
 epoch: 97, train_loss: 0.2966, test_loss: 1.4051, test_f1: 0.6578
 epoch: 98, train_loss: 0.3272, test_loss: 1.2535, test_f1: 0.6754
 epoch: 99, train_loss: 0.3089, test_loss: 1.6708, test_f1: 0.6147
##################ITERATION #7 ****************************************
 epoch: 0, train_loss: 1.4585, test_loss: 1.3713, test_f1: 0.2764
 epoch: 1, train_loss: 1.0660, test_loss: 1.1365, test_f1: 0.3465
 epoch: 2, train_loss: 1.0298, test_loss: 1.1557, test_f1: 0.3676
 epoch: 3, train_loss: 1.0004, test_loss: 1.0393, test_f1: 0.4026
 epoch: 4, train_loss: 0.9834, test_loss: 1.0346, test_f1: 0.4339
 epoch: 5, train_loss: 0.9394, test_loss: 0.9832, test_f1: 0.4561
 epoch: 6, train_loss: 0.9284, test_loss: 0.9828, test_f1: 0.4644
 epoch: 7, train_loss: 0.8932, test_loss: 0.9706, test_f1: 0.5083
 epoch: 8, train_loss: 0.8551, test_loss: 1.2616, test_f1: 0.4562
 epoch: 9, train_loss: 0.8436, test_loss: 0.9788, test_f1: 0.5192
 epoch: 10, train_loss: 0.8217, test_loss: 1.0983, test_f1: 0.4887
 epoch: 11, train_loss: 0.8049, test_loss: 0.9482, test_f1: 0.5522
 epoch: 12, train_loss: 0.7896, test_loss: 0.8973, test_f1: 0.5622
 epoch: 13, train_loss: 0.7710, test_loss: 0.8978, test_f1: 0.5424
 epoch: 14, train_loss: 0.7741, test_loss: 0.9562, test_f1: 0.5186
 epoch: 15, train_loss: 0.7634, test_loss: 0.9243, test_f1: 0.5635
 epoch: 16, train_loss: 0.7513, test_loss: 0.9009, test_f1: 0.5405
 epoch: 17, train_loss: 0.7420, test_loss: 0.8854, test_f1: 0.5779
 epoch: 18, train_loss: 0.7371, test_loss: 0.9548, test_f1: 0.5360
 epoch: 19, train_loss: 0.7147, test_loss: 0.9588, test_f1: 0.5140
 epoch: 20, train_loss: 0.7239, test_loss: 0.8685, test_f1: 0.5907
 epoch: 21, train_loss: 0.7193, test_loss: 1.1227, test_f1: 0.4698
 epoch: 22, train_loss: 0.7201, test_loss: 0.8785, test_f1: 0.5850
 epoch: 23, train_loss: 0.6900, test_loss: 0.8816, test_f1: 0.6030
 epoch: 24, train_loss: 0.7053, test_loss: 0.8644, test_f1: 0.5866
 epoch: 25, train_loss: 0.6645, test_loss: 1.0029, test_f1: 0.5679
 epoch: 26, train_loss: 0.6483, test_loss: 0.9404, test_f1: 0.5653
 epoch: 27, train_loss: 0.6453, test_loss: 0.8859, test_f1: 0.5823
 epoch: 28, train_loss: 0.6432, test_loss: 0.8837, test_f1: 0.5711
 epoch: 29, train_loss: 0.6484, test_loss: 0.7956, test_f1: 0.6038
 epoch: 30, train_loss: 0.6271, test_loss: 0.8330, test_f1: 0.6119
 epoch: 31, train_loss: 0.6047, test_loss: 1.0005, test_f1: 0.5737
 epoch: 32, train_loss: 0.6059, test_loss: 1.0503, test_f1: 0.5602
 epoch: 33, train_loss: 0.6124, test_loss: 0.9471, test_f1: 0.6356
 epoch: 34, train_loss: 0.6082, test_loss: 0.7904, test_f1: 0.6391
 epoch: 35, train_loss: 0.5991, test_loss: 1.0710, test_f1: 0.5976
 epoch: 36, train_loss: 0.5814, test_loss: 0.9024, test_f1: 0.5842
 epoch: 37, train_loss: 0.5696, test_loss: 0.8891, test_f1: 0.6276
 epoch: 38, train_loss: 0.5848, test_loss: 0.8452, test_f1: 0.6218
 epoch: 39, train_loss: 0.5775, test_loss: 1.0321, test_f1: 0.6012
 epoch: 40, train_loss: 0.5632, test_loss: 0.9945, test_f1: 0.5944
 epoch: 41, train_loss: 0.5367, test_loss: 1.0880, test_f1: 0.6278
 epoch: 42, train_loss: 0.5422, test_loss: 1.0180, test_f1: 0.5941
 epoch: 43, train_loss: 0.5470, test_loss: 0.9358, test_f1: 0.6328
 epoch: 44, train_loss: 0.5322, test_loss: 0.9077, test_f1: 0.6005
 epoch: 45, train_loss: 0.5299, test_loss: 1.2282, test_f1: 0.5794
 epoch: 46, train_loss: 0.5234, test_loss: 0.9598, test_f1: 0.6279
 epoch: 47, train_loss: 0.5371, test_loss: 1.0876, test_f1: 0.5869
 epoch: 48, train_loss: 0.5502, test_loss: 1.0578, test_f1: 0.6229
 epoch: 49, train_loss: 0.5416, test_loss: 0.9459, test_f1: 0.6223
 epoch: 50, train_loss: 0.5435, test_loss: 1.0232, test_f1: 0.6114
 epoch: 51, train_loss: 0.5180, test_loss: 0.8851, test_f1: 0.6226
 epoch: 52, train_loss: 0.4585, test_loss: 0.8865, test_f1: 0.6351
 epoch: 53, train_loss: 0.4331, test_loss: 1.0046, test_f1: 0.6262
 epoch: 54, train_loss: 0.4532, test_loss: 0.9228, test_f1: 0.6489
 epoch: 55, train_loss: 0.4199, test_loss: 0.8746, test_f1: 0.6571
 epoch: 56, train_loss: 0.4057, test_loss: 1.0435, test_f1: 0.6292
 epoch: 57, train_loss: 0.4047, test_loss: 0.9209, test_f1: 0.6399
 epoch: 58, train_loss: 0.4028, test_loss: 0.9947, test_f1: 0.6320
 epoch: 59, train_loss: 0.4228, test_loss: 0.8946, test_f1: 0.6609
 epoch: 60, train_loss: 0.4054, test_loss: 1.0592, test_f1: 0.6319
 epoch: 61, train_loss: 0.3890, test_loss: 1.0668, test_f1: 0.6293
 epoch: 62, train_loss: 0.4094, test_loss: 1.0428, test_f1: 0.6321
 epoch: 63, train_loss: 0.4023, test_loss: 1.1198, test_f1: 0.6196
 epoch: 64, train_loss: 0.3927, test_loss: 0.9514, test_f1: 0.6458
 epoch: 65, train_loss: 0.3732, test_loss: 1.0170, test_f1: 0.6491
 epoch: 66, train_loss: 0.4121, test_loss: 0.8791, test_f1: 0.6547
 epoch: 67, train_loss: 0.3634, test_loss: 0.9149, test_f1: 0.6673
 epoch: 68, train_loss: 0.3817, test_loss: 0.9712, test_f1: 0.6548
 epoch: 69, train_loss: 0.3545, test_loss: 0.9321, test_f1: 0.6546
 epoch: 70, train_loss: 0.3682, test_loss: 0.9095, test_f1: 0.6394
 epoch: 71, train_loss: 0.3601, test_loss: 1.0137, test_f1: 0.6662
 epoch: 72, train_loss: 0.3691, test_loss: 1.2197, test_f1: 0.5885
 epoch: 73, train_loss: 0.3452, test_loss: 1.0524, test_f1: 0.6667
 epoch: 74, train_loss: 0.3628, test_loss: 1.1136, test_f1: 0.6344
 epoch: 75, train_loss: 0.3471, test_loss: 0.9858, test_f1: 0.6578
 epoch: 76, train_loss: 0.3710, test_loss: 0.9394, test_f1: 0.6612
 epoch: 77, train_loss: 0.3350, test_loss: 1.0776, test_f1: 0.6350
 epoch: 78, train_loss: 0.3468, test_loss: 1.0825, test_f1: 0.6242
 epoch: 79, train_loss: 0.3522, test_loss: 1.1867, test_f1: 0.6422
 epoch: 80, train_loss: 0.3645, test_loss: 1.0695, test_f1: 0.6305
 epoch: 81, train_loss: 0.3501, test_loss: 0.9757, test_f1: 0.6518
 epoch: 82, train_loss: 0.3416, test_loss: 1.0472, test_f1: 0.6292
 epoch: 83, train_loss: 0.3373, test_loss: 1.1503, test_f1: 0.6421
 epoch: 84, train_loss: 0.3363, test_loss: 1.1612, test_f1: 0.6595
 epoch: 85, train_loss: 0.3446, test_loss: 1.1661, test_f1: 0.6215
 epoch: 86, train_loss: 0.3352, test_loss: 1.0731, test_f1: 0.6656
 epoch: 87, train_loss: 0.3302, test_loss: 1.1997, test_f1: 0.6225
 epoch: 88, train_loss: 0.3330, test_loss: 1.0945, test_f1: 0.6508
 epoch: 89, train_loss: 0.3039, test_loss: 1.1986, test_f1: 0.6206
 epoch: 90, train_loss: 0.3019, test_loss: 1.0594, test_f1: 0.6759
 epoch: 91, train_loss: 0.3176, test_loss: 1.1752, test_f1: 0.6438
 epoch: 92, train_loss: 0.3172, test_loss: 1.2066, test_f1: 0.6234
 epoch: 93, train_loss: 0.3133, test_loss: 1.1790, test_f1: 0.6439
 epoch: 94, train_loss: 0.3148, test_loss: 1.1193, test_f1: 0.6790
 epoch: 95, train_loss: 0.3112, test_loss: 1.2254, test_f1: 0.6530
 epoch: 96, train_loss: 0.3286, test_loss: 1.2972, test_f1: 0.6556
 epoch: 97, train_loss: 0.3154, test_loss: 1.2642, test_f1: 0.6367
 epoch: 98, train_loss: 0.2991, test_loss: 1.3700, test_f1: 0.6310
 epoch: 99, train_loss: 0.2987, test_loss: 1.2223, test_f1: 0.6564
##################ITERATION #8 ****************************************
 epoch: 0, train_loss: 1.5009, test_loss: 1.4181, test_f1: 0.2592
 epoch: 1, train_loss: 1.0308, test_loss: 1.1375, test_f1: 0.3727
 epoch: 2, train_loss: 0.9684, test_loss: 1.0226, test_f1: 0.4477
 epoch: 3, train_loss: 0.9412, test_loss: 0.9970, test_f1: 0.4933
 epoch: 4, train_loss: 0.9138, test_loss: 0.9956, test_f1: 0.4876
 epoch: 5, train_loss: 0.8937, test_loss: 1.0462, test_f1: 0.5021
 epoch: 6, train_loss: 0.8759, test_loss: 1.0205, test_f1: 0.5430
 epoch: 7, train_loss: 0.8470, test_loss: 0.9985, test_f1: 0.5441
 epoch: 8, train_loss: 0.8521, test_loss: 0.9623, test_f1: 0.5438
 epoch: 9, train_loss: 0.8301, test_loss: 1.1267, test_f1: 0.5035
 epoch: 10, train_loss: 0.8117, test_loss: 0.9466, test_f1: 0.5212
 epoch: 11, train_loss: 0.8073, test_loss: 1.0577, test_f1: 0.5203
 epoch: 12, train_loss: 0.7749, test_loss: 0.9028, test_f1: 0.6037
 epoch: 13, train_loss: 0.7681, test_loss: 1.2032, test_f1: 0.4872
 epoch: 14, train_loss: 0.7694, test_loss: 1.0604, test_f1: 0.5116
 epoch: 15, train_loss: 0.7670, test_loss: 0.9595, test_f1: 0.5444
 epoch: 16, train_loss: 0.7370, test_loss: 0.8875, test_f1: 0.6085
 epoch: 17, train_loss: 0.7433, test_loss: 0.8902, test_f1: 0.6140
 epoch: 18, train_loss: 0.7368, test_loss: 1.2631, test_f1: 0.4977
 epoch: 19, train_loss: 0.7456, test_loss: 0.9153, test_f1: 0.5682
 epoch: 20, train_loss: 0.7279, test_loss: 0.9895, test_f1: 0.5537
 epoch: 21, train_loss: 0.7280, test_loss: 1.0659, test_f1: 0.5603
 epoch: 22, train_loss: 0.7019, test_loss: 1.0148, test_f1: 0.5528
 epoch: 23, train_loss: 0.6978, test_loss: 0.9492, test_f1: 0.5824
 epoch: 24, train_loss: 0.6742, test_loss: 0.9778, test_f1: 0.5881
 epoch: 25, train_loss: 0.6915, test_loss: 1.0857, test_f1: 0.4958
 epoch: 26, train_loss: 0.6874, test_loss: 1.0138, test_f1: 0.5357
 epoch: 27, train_loss: 0.6604, test_loss: 1.0541, test_f1: 0.5317
 epoch: 28, train_loss: 0.6369, test_loss: 0.7879, test_f1: 0.6367
 epoch: 29, train_loss: 0.6380, test_loss: 1.1311, test_f1: 0.5500
 epoch: 30, train_loss: 0.6401, test_loss: 0.8307, test_f1: 0.6054
 epoch: 31, train_loss: 0.6636, test_loss: 0.9523, test_f1: 0.6082
 epoch: 32, train_loss: 0.6390, test_loss: 0.9902, test_f1: 0.5430
 epoch: 33, train_loss: 0.6280, test_loss: 1.0624, test_f1: 0.5186
 epoch: 34, train_loss: 0.6200, test_loss: 0.9464, test_f1: 0.6327
 epoch: 35, train_loss: 0.5916, test_loss: 1.0522, test_f1: 0.5751
 epoch: 36, train_loss: 0.5948, test_loss: 0.9283, test_f1: 0.5771
 epoch: 37, train_loss: 0.6158, test_loss: 0.9934, test_f1: 0.5463
 epoch: 38, train_loss: 0.5873, test_loss: 1.0033, test_f1: 0.6134
 epoch: 39, train_loss: 0.5674, test_loss: 0.9766, test_f1: 0.5436
 epoch: 40, train_loss: 0.5793, test_loss: 1.1004, test_f1: 0.5531
 epoch: 41, train_loss: 0.5973, test_loss: 1.0475, test_f1: 0.5957
 epoch: 42, train_loss: 0.5768, test_loss: 0.9427, test_f1: 0.6528
 epoch: 43, train_loss: 0.5422, test_loss: 1.0144, test_f1: 0.6140
 epoch: 44, train_loss: 0.5438, test_loss: 1.0241, test_f1: 0.6411
 epoch: 45, train_loss: 0.5420, test_loss: 1.1777, test_f1: 0.5999
 epoch: 46, train_loss: 0.5638, test_loss: 0.9995, test_f1: 0.6029
 epoch: 47, train_loss: 0.5464, test_loss: 1.1024, test_f1: 0.5892
 epoch: 48, train_loss: 0.5497, test_loss: 1.2213, test_f1: 0.5442
 epoch: 49, train_loss: 0.5510, test_loss: 1.0096, test_f1: 0.6054
 epoch: 50, train_loss: 0.5279, test_loss: 0.9967, test_f1: 0.5955
 epoch: 51, train_loss: 0.4989, test_loss: 0.9950, test_f1: 0.6263
 epoch: 52, train_loss: 0.4949, test_loss: 1.0432, test_f1: 0.6202
 epoch: 53, train_loss: 0.4591, test_loss: 1.0501, test_f1: 0.6362
 epoch: 54, train_loss: 0.4537, test_loss: 1.0739, test_f1: 0.6366
 epoch: 55, train_loss: 0.4366, test_loss: 1.0416, test_f1: 0.6196
 epoch: 56, train_loss: 0.4375, test_loss: 1.0313, test_f1: 0.6608
 epoch: 57, train_loss: 0.4257, test_loss: 1.0211, test_f1: 0.6674
 epoch: 58, train_loss: 0.4200, test_loss: 1.0809, test_f1: 0.6233
 epoch: 59, train_loss: 0.4180, test_loss: 1.0246, test_f1: 0.6497
 epoch: 60, train_loss: 0.4286, test_loss: 1.1316, test_f1: 0.6041
 epoch: 61, train_loss: 0.4195, test_loss: 0.9841, test_f1: 0.6356
 epoch: 62, train_loss: 0.4319, test_loss: 1.0554, test_f1: 0.6175
 epoch: 63, train_loss: 0.3858, test_loss: 1.0569, test_f1: 0.6421
 epoch: 64, train_loss: 0.4018, test_loss: 1.0392, test_f1: 0.6211
 epoch: 65, train_loss: 0.4064, test_loss: 1.0466, test_f1: 0.6629
 epoch: 66, train_loss: 0.3918, test_loss: 1.0819, test_f1: 0.6230
 epoch: 67, train_loss: 0.3879, test_loss: 1.0779, test_f1: 0.6263
 epoch: 68, train_loss: 0.3879, test_loss: 1.1460, test_f1: 0.6001
 epoch: 69, train_loss: 0.3723, test_loss: 1.1763, test_f1: 0.6413
 epoch: 70, train_loss: 0.3787, test_loss: 1.2814, test_f1: 0.5945
 epoch: 71, train_loss: 0.4076, test_loss: 1.0356, test_f1: 0.6141
 epoch: 72, train_loss: 0.3825, test_loss: 1.0170, test_f1: 0.6362
 epoch: 73, train_loss: 0.3813, test_loss: 1.1523, test_f1: 0.6156
 epoch: 74, train_loss: 0.3971, test_loss: 1.2121, test_f1: 0.6123
 epoch: 75, train_loss: 0.3810, test_loss: 1.1240, test_f1: 0.6315
 epoch: 76, train_loss: 0.3633, test_loss: 1.1375, test_f1: 0.6300
 epoch: 77, train_loss: 0.3698, test_loss: 1.2732, test_f1: 0.6013
 epoch: 78, train_loss: 0.3463, test_loss: 1.0911, test_f1: 0.6428
 epoch: 79, train_loss: 0.3664, test_loss: 1.1056, test_f1: 0.6294
 epoch: 80, train_loss: 0.3598, test_loss: 1.3030, test_f1: 0.5987
 epoch: 81, train_loss: 0.3573, test_loss: 1.1814, test_f1: 0.6083
 epoch: 82, train_loss: 0.3847, test_loss: 2.4948, test_f1: 0.4259
 epoch: 83, train_loss: 0.4275, test_loss: 1.2952, test_f1: 0.5826
 epoch: 84, train_loss: 0.3989, test_loss: 1.1448, test_f1: 0.6394
 epoch: 85, train_loss: 0.3697, test_loss: 1.1826, test_f1: 0.6182
 epoch: 86, train_loss: 0.3821, test_loss: 1.2478, test_f1: 0.6117
 epoch: 87, train_loss: 0.3477, test_loss: 1.1839, test_f1: 0.6448
 epoch: 88, train_loss: 0.3541, test_loss: 1.2935, test_f1: 0.6097
 epoch: 89, train_loss: 0.3310, test_loss: 1.2761, test_f1: 0.6352
 epoch: 90, train_loss: 0.3298, test_loss: 1.2344, test_f1: 0.6365
 epoch: 91, train_loss: 0.3130, test_loss: 1.3790, test_f1: 0.6183
 epoch: 92, train_loss: 0.3421, test_loss: 1.4239, test_f1: 0.6457
 epoch: 93, train_loss: 0.3560, test_loss: 1.2388, test_f1: 0.6719
 epoch: 94, train_loss: 0.3603, test_loss: 1.2438, test_f1: 0.6458
 epoch: 95, train_loss: 0.3582, test_loss: 1.3302, test_f1: 0.6103
 epoch: 96, train_loss: 0.3550, test_loss: 1.3042, test_f1: 0.6202
 epoch: 97, train_loss: 0.3367, test_loss: 1.4353, test_f1: 0.6310
 epoch: 98, train_loss: 0.3247, test_loss: 1.1904, test_f1: 0.6528
 epoch: 99, train_loss: 0.3113, test_loss: 1.3439, test_f1: 0.6511
##################ITERATION #9 ****************************************
 epoch: 0, train_loss: 1.5219, test_loss: 1.3791, test_f1: 0.2739
 epoch: 1, train_loss: 1.0333, test_loss: 1.1458, test_f1: 0.4165
 epoch: 2, train_loss: 0.9742, test_loss: 1.0567, test_f1: 0.4658
 epoch: 3, train_loss: 0.9334, test_loss: 0.9946, test_f1: 0.4924
 epoch: 4, train_loss: 0.9217, test_loss: 1.0026, test_f1: 0.5282
 epoch: 5, train_loss: 0.9023, test_loss: 1.0860, test_f1: 0.4457
 epoch: 6, train_loss: 0.8871, test_loss: 1.0546, test_f1: 0.4945
 epoch: 7, train_loss: 0.8731, test_loss: 0.9944, test_f1: 0.5086
 epoch: 8, train_loss: 0.8549, test_loss: 1.2085, test_f1: 0.4360
 epoch: 9, train_loss: 0.8623, test_loss: 0.9394, test_f1: 0.5213
 epoch: 10, train_loss: 0.8272, test_loss: 0.8893, test_f1: 0.5621
 epoch: 11, train_loss: 0.8093, test_loss: 0.7914, test_f1: 0.5854
 epoch: 12, train_loss: 0.7877, test_loss: 0.8858, test_f1: 0.5333
 epoch: 13, train_loss: 0.8122, test_loss: 0.9649, test_f1: 0.5348
 epoch: 14, train_loss: 0.7968, test_loss: 0.9099, test_f1: 0.5266
 epoch: 15, train_loss: 0.7617, test_loss: 0.9023, test_f1: 0.6139
 epoch: 16, train_loss: 0.7484, test_loss: 0.9111, test_f1: 0.5697
 epoch: 17, train_loss: 0.7413, test_loss: 0.9132, test_f1: 0.5431
 epoch: 18, train_loss: 0.7314, test_loss: 0.9132, test_f1: 0.5643
 epoch: 19, train_loss: 0.7205, test_loss: 0.8192, test_f1: 0.5837
 epoch: 20, train_loss: 0.7222, test_loss: 0.9974, test_f1: 0.5351
 epoch: 21, train_loss: 0.7416, test_loss: 0.8645, test_f1: 0.6076
 epoch: 22, train_loss: 0.7276, test_loss: 0.8834, test_f1: 0.6083
 epoch: 23, train_loss: 0.7180, test_loss: 1.0026, test_f1: 0.5601
 epoch: 24, train_loss: 0.7115, test_loss: 0.7628, test_f1: 0.6445
 epoch: 25, train_loss: 0.6802, test_loss: 0.9553, test_f1: 0.5635
 epoch: 26, train_loss: 0.6785, test_loss: 0.8908, test_f1: 0.5774
 epoch: 27, train_loss: 0.6666, test_loss: 0.9778, test_f1: 0.5711
 epoch: 28, train_loss: 0.6851, test_loss: 1.2510, test_f1: 0.4702
 epoch: 29, train_loss: 0.6692, test_loss: 1.2261, test_f1: 0.5743
 epoch: 30, train_loss: 0.6678, test_loss: 1.0500, test_f1: 0.4883
 epoch: 31, train_loss: 0.6797, test_loss: 1.0239, test_f1: 0.5536
 epoch: 32, train_loss: 0.6582, test_loss: 0.7656, test_f1: 0.5948
 epoch: 33, train_loss: 0.6486, test_loss: 0.7944, test_f1: 0.6430
 epoch: 34, train_loss: 0.6347, test_loss: 0.8759, test_f1: 0.6104
 epoch: 35, train_loss: 0.6356, test_loss: 0.9206, test_f1: 0.5603
 epoch: 36, train_loss: 0.6308, test_loss: 1.0147, test_f1: 0.5315
 epoch: 37, train_loss: 0.6393, test_loss: 0.8871, test_f1: 0.5907
 epoch: 38, train_loss: 0.6431, test_loss: 0.8622, test_f1: 0.6110
 epoch: 39, train_loss: 0.6272, test_loss: 1.0603, test_f1: 0.5719
 epoch: 40, train_loss: 0.5860, test_loss: 0.8050, test_f1: 0.6135
 epoch: 41, train_loss: 0.5862, test_loss: 1.0319, test_f1: 0.5827
 epoch: 42, train_loss: 0.5890, test_loss: 1.0000, test_f1: 0.5905
 epoch: 43, train_loss: 0.5755, test_loss: 0.9113, test_f1: 0.5796
 epoch: 44, train_loss: 0.5685, test_loss: 0.9089, test_f1: 0.6195
 epoch: 45, train_loss: 0.5549, test_loss: 1.0121, test_f1: 0.5568
 epoch: 46, train_loss: 0.5467, test_loss: 0.9162, test_f1: 0.5847
 epoch: 47, train_loss: 0.5508, test_loss: 0.9652, test_f1: 0.6003
 epoch: 48, train_loss: 0.5340, test_loss: 0.9569, test_f1: 0.5957
 epoch: 49, train_loss: 0.5248, test_loss: 0.8867, test_f1: 0.6009
 epoch: 50, train_loss: 0.5589, test_loss: 0.9859, test_f1: 0.6027
 epoch: 51, train_loss: 0.5295, test_loss: 0.8069, test_f1: 0.6208
 epoch: 52, train_loss: 0.4868, test_loss: 0.9816, test_f1: 0.6108
 epoch: 53, train_loss: 0.4786, test_loss: 0.9918, test_f1: 0.5970
 epoch: 54, train_loss: 0.4640, test_loss: 1.0185, test_f1: 0.5870
 epoch: 55, train_loss: 0.4647, test_loss: 0.9510, test_f1: 0.6241
 epoch: 56, train_loss: 0.4556, test_loss: 0.9648, test_f1: 0.6366
 epoch: 57, train_loss: 0.4376, test_loss: 1.0198, test_f1: 0.6020
 epoch: 58, train_loss: 0.4722, test_loss: 0.9455, test_f1: 0.5795
 epoch: 59, train_loss: 0.4521, test_loss: 0.9469, test_f1: 0.6207
 epoch: 60, train_loss: 0.4283, test_loss: 1.0436, test_f1: 0.5766
 epoch: 61, train_loss: 0.4332, test_loss: 1.1247, test_f1: 0.5884
 epoch: 62, train_loss: 0.4300, test_loss: 0.9628, test_f1: 0.6178
 epoch: 63, train_loss: 0.4269, test_loss: 1.0087, test_f1: 0.6238
 epoch: 64, train_loss: 0.4224, test_loss: 1.0860, test_f1: 0.6095
 epoch: 65, train_loss: 0.4130, test_loss: 0.9595, test_f1: 0.6328
 epoch: 66, train_loss: 0.4293, test_loss: 1.0605, test_f1: 0.6049
 epoch: 67, train_loss: 0.4213, test_loss: 1.0344, test_f1: 0.6037
 epoch: 68, train_loss: 0.4169, test_loss: 0.9967, test_f1: 0.6168
 epoch: 69, train_loss: 0.4056, test_loss: 1.0204, test_f1: 0.6316
 epoch: 70, train_loss: 0.3895, test_loss: 1.2234, test_f1: 0.5856
 epoch: 71, train_loss: 0.4081, test_loss: 0.9671, test_f1: 0.6281
 epoch: 72, train_loss: 0.3876, test_loss: 1.0412, test_f1: 0.6387
 epoch: 73, train_loss: 0.3956, test_loss: 1.0677, test_f1: 0.6059
 epoch: 74, train_loss: 0.4123, test_loss: 1.1438, test_f1: 0.5810
 epoch: 75, train_loss: 0.3824, test_loss: 0.9657, test_f1: 0.6269
 epoch: 76, train_loss: 0.3928, test_loss: 1.0764, test_f1: 0.6188
 epoch: 77, train_loss: 0.3968, test_loss: 1.1954, test_f1: 0.5846
 epoch: 78, train_loss: 0.3787, test_loss: 1.1479, test_f1: 0.5884
 epoch: 79, train_loss: 0.3773, test_loss: 1.1975, test_f1: 0.6132
 epoch: 80, train_loss: 0.3807, test_loss: 1.0451, test_f1: 0.6118
 epoch: 81, train_loss: 0.3685, test_loss: 1.0235, test_f1: 0.6170
 epoch: 82, train_loss: 0.3650, test_loss: 1.1216, test_f1: 0.6013
 epoch: 83, train_loss: 0.3752, test_loss: 1.0441, test_f1: 0.5982
 epoch: 84, train_loss: 0.3981, test_loss: 1.1050, test_f1: 0.5907
 epoch: 85, train_loss: 0.3661, test_loss: 1.1490, test_f1: 0.6018
 epoch: 86, train_loss: 0.3608, test_loss: 1.0593, test_f1: 0.6080
 epoch: 87, train_loss: 0.3563, test_loss: 1.0580, test_f1: 0.6298
 epoch: 88, train_loss: 0.3727, test_loss: 1.1464, test_f1: 0.6168
 epoch: 89, train_loss: 0.3459, test_loss: 1.2086, test_f1: 0.6283
 epoch: 90, train_loss: 0.3651, test_loss: 1.1209, test_f1: 0.6315
 epoch: 91, train_loss: 0.3429, test_loss: 1.1248, test_f1: 0.6163
 epoch: 92, train_loss: 0.3637, test_loss: 1.1145, test_f1: 0.6341
 epoch: 93, train_loss: 0.3602, test_loss: 1.3118, test_f1: 0.5831
 epoch: 94, train_loss: 0.3589, test_loss: 1.2557, test_f1: 0.6073
 epoch: 95, train_loss: 0.3387, test_loss: 1.2340, test_f1: 0.6184
 epoch: 96, train_loss: 0.3279, test_loss: 1.3030, test_f1: 0.6146
 epoch: 97, train_loss: 0.3357, test_loss: 1.2049, test_f1: 0.6192
 epoch: 98, train_loss: 0.3323, test_loss: 1.3221, test_f1: 0.6160
 epoch: 99, train_loss: 0.3370, test_loss: 1.2958, test_f1: 0.5983

Training completed in 744.63 seconds
Best F1: 0.7121 at epoch 62
Mean F1 across iterations: 0.6806  0.0188
========================FINAL RESULTS================================
FEGIN weighted F1: 0.7121  0.0188
python main.py --data ltspice_examples --representation component_pin --model FEGIN --layers 3 --hiddens 64 --batch_size 256 --lr 0.01 --emb_size 250 --epochs 100 --save_appendix component_pin_L3_H64_BS256_LR0.01_E250 --no_val
-----



STDERR:
  File "main.py", line 370, in <module>
    main()
  File "main.py", line 254, in main
    dataset = dataset_class(
  File "/home/philip/projects/llm_inference_code_repo/Circuit-Completion-Using-GNNs/component_classification_with_link_prediction_head/evaluation/FEGIN/kernel/circuit_datasets.py", line 15, in __init__
    self.data, self.slices = torch.load(self.processed_paths[0])
  File "/home/philip/.local/lib/python3.8/site-packages/torch/serialization.py", line 1040, in load
    warnings.warn(
  File "/usr/lib/python3.8/warnings.py", line 109, in _showwarnmsg
    sw(msg.message, msg.category, msg.filename, msg.lineno,
  File "main.py", line 47, in warn_with_traceback
    traceback.print_stack(file=log)
/home/philip/projects/llm_inference_code_repo/Circuit-Completion-Using-GNNs/component_classification_with_link_prediction_head/evaluation/FEGIN/kernel/circuit_datasets.py:15: FutureWarning: You are using `torch.load` with `weights_only=False` (the current default value), which uses the default pickle module implicitly. It is possible to construct malicious pickle data which will execute arbitrary code during unpickling (See https://github.com/pytorch/pytorch/blob/main/SECURITY.md#untrusted-models for more details). In a future release, the default value for `weights_only` will be flipped to `True`. This limits the functions that could be executed during unpickling. Arbitrary objects will no longer be allowed to be loaded via this mode unless they are explicitly allowlisted by the user via `torch.serialization.add_safe_globals`. We recommend you start setting `weights_only=True` for any use case where you don't have full control of the loaded file. Please open an issue on GitHub for any issues related to this experimental feature.
  self.data, self.slices = torch.load(self.processed_paths[0])
