STDOUT:
Results will be saved in /home/philip/projects/ltspice_examples_code_repo/Circuit-Completion-Using-GNNs/component_classification_with_link_prediction_head/evaluation/FEGIN/results/model_FEGIN_dataset_ltspice_demos
Command line input: python main.py --data ltspice_demos --representation component_net --model FEGIN --layers 3 --hiddens 32 --batch_size 64 --lr 0.001 --emb_size 128 --epochs 100 --save_appendix component_net_L3_H32_BS64_LR0.001_E128 --no_val
 is saved.
-----
ltspice_demos - FEGIN
Using 3 layers, 32 hidden units, h = 2
Loading component_net representation dataset
ENTERED
Training FEGIN on component_net representation
Train: 1565, Test: 383
##################ITERATION #0 ****************************************
 epoch: 0, train_loss: 1.3523, test_loss: 1.3470, test_f1: 0.1368
 epoch: 1, train_loss: 1.2347, test_loss: 1.2735, test_f1: 0.3534
 epoch: 2, train_loss: 1.1516, test_loss: 1.1970, test_f1: 0.3256
 epoch: 3, train_loss: 1.1184, test_loss: 1.1746, test_f1: 0.4112
 epoch: 4, train_loss: 1.0862, test_loss: 1.1504, test_f1: 0.4172
 epoch: 5, train_loss: 1.0591, test_loss: 1.1485, test_f1: 0.4349
 epoch: 6, train_loss: 1.0428, test_loss: 1.1154, test_f1: 0.4404
 epoch: 7, train_loss: 1.0089, test_loss: 1.1251, test_f1: 0.4618
 epoch: 8, train_loss: 0.9981, test_loss: 1.1052, test_f1: 0.4482
 epoch: 9, train_loss: 0.9923, test_loss: 1.0973, test_f1: 0.4425
 epoch: 10, train_loss: 0.9710, test_loss: 1.1335, test_f1: 0.4483
 epoch: 11, train_loss: 0.9480, test_loss: 1.1049, test_f1: 0.4856
 epoch: 12, train_loss: 0.9454, test_loss: 1.0789, test_f1: 0.4935
 epoch: 13, train_loss: 0.9254, test_loss: 1.0842, test_f1: 0.5259
 epoch: 14, train_loss: 0.9194, test_loss: 1.0810, test_f1: 0.5433
 epoch: 15, train_loss: 0.8953, test_loss: 1.0860, test_f1: 0.5168
 epoch: 16, train_loss: 0.9004, test_loss: 1.0466, test_f1: 0.5168
 epoch: 17, train_loss: 0.8869, test_loss: 1.0593, test_f1: 0.5147
 epoch: 18, train_loss: 0.8804, test_loss: 1.0818, test_f1: 0.5632
 epoch: 19, train_loss: 0.8734, test_loss: 1.0813, test_f1: 0.5646
 epoch: 20, train_loss: 0.8636, test_loss: 1.1058, test_f1: 0.5606
 epoch: 21, train_loss: 0.8505, test_loss: 1.1016, test_f1: 0.5604
 epoch: 22, train_loss: 0.8755, test_loss: 1.2630, test_f1: 0.5305
 epoch: 23, train_loss: 0.8551, test_loss: 1.0707, test_f1: 0.5801
 epoch: 24, train_loss: 0.8411, test_loss: 1.1104, test_f1: 0.5805
 epoch: 25, train_loss: 0.8378, test_loss: 1.1882, test_f1: 0.5583
 epoch: 26, train_loss: 0.8252, test_loss: 1.1587, test_f1: 0.5502
 epoch: 27, train_loss: 0.8271, test_loss: 1.1262, test_f1: 0.6010
 epoch: 28, train_loss: 0.8476, test_loss: 1.0995, test_f1: 0.6040
 epoch: 29, train_loss: 0.8244, test_loss: 1.1416, test_f1: 0.5415
 epoch: 30, train_loss: 0.8295, test_loss: 1.1493, test_f1: 0.5062
 epoch: 31, train_loss: 0.8133, test_loss: 1.1470, test_f1: 0.5737
 epoch: 32, train_loss: 0.8083, test_loss: 1.1217, test_f1: 0.5963
 epoch: 33, train_loss: 0.8291, test_loss: 1.1230, test_f1: 0.5362
 epoch: 34, train_loss: 0.7969, test_loss: 1.1227, test_f1: 0.6282
 epoch: 35, train_loss: 0.7833, test_loss: 1.1382, test_f1: 0.6195
 epoch: 36, train_loss: 0.7822, test_loss: 1.1705, test_f1: 0.5675
 epoch: 37, train_loss: 0.7965, test_loss: 1.1413, test_f1: 0.6166
 epoch: 38, train_loss: 0.7752, test_loss: 1.2148, test_f1: 0.6077
 epoch: 39, train_loss: 0.7713, test_loss: 1.1710, test_f1: 0.6015
 epoch: 40, train_loss: 0.7681, test_loss: 1.2039, test_f1: 0.6143
 epoch: 41, train_loss: 0.7645, test_loss: 1.2015, test_f1: 0.5987
 epoch: 42, train_loss: 0.7728, test_loss: 1.2797, test_f1: 0.5650
 epoch: 43, train_loss: 0.7599, test_loss: 1.1095, test_f1: 0.6023
 epoch: 44, train_loss: 0.7468, test_loss: 1.2896, test_f1: 0.5585
 epoch: 45, train_loss: 0.7804, test_loss: 1.1569, test_f1: 0.5823
 epoch: 46, train_loss: 0.7483, test_loss: 1.2674, test_f1: 0.5725
 epoch: 47, train_loss: 0.7593, test_loss: 1.2846, test_f1: 0.5861
 epoch: 48, train_loss: 0.7451, test_loss: 1.2493, test_f1: 0.5766
 epoch: 49, train_loss: 0.7220, test_loss: 1.1655, test_f1: 0.6263
 epoch: 50, train_loss: 0.7378, test_loss: 1.1565, test_f1: 0.6196
 epoch: 51, train_loss: 0.7052, test_loss: 1.2110, test_f1: 0.6186
 epoch: 52, train_loss: 0.6905, test_loss: 1.2276, test_f1: 0.6164
 epoch: 53, train_loss: 0.6858, test_loss: 1.2677, test_f1: 0.6339
 epoch: 54, train_loss: 0.6843, test_loss: 1.2198, test_f1: 0.6118
 epoch: 55, train_loss: 0.6843, test_loss: 1.2834, test_f1: 0.6315
 epoch: 56, train_loss: 0.6705, test_loss: 1.2333, test_f1: 0.6466
 epoch: 57, train_loss: 0.6775, test_loss: 1.2350, test_f1: 0.6165
 epoch: 58, train_loss: 0.6565, test_loss: 1.2738, test_f1: 0.5857
 epoch: 59, train_loss: 0.6709, test_loss: 1.2499, test_f1: 0.6243
 epoch: 60, train_loss: 0.6582, test_loss: 1.2281, test_f1: 0.6245
 epoch: 61, train_loss: 0.6606, test_loss: 1.3782, test_f1: 0.5912
 epoch: 62, train_loss: 0.6602, test_loss: 1.3099, test_f1: 0.6066
 epoch: 63, train_loss: 0.6574, test_loss: 1.2603, test_f1: 0.6219
 epoch: 64, train_loss: 0.6572, test_loss: 1.2186, test_f1: 0.5968
 epoch: 65, train_loss: 0.6665, test_loss: 1.2796, test_f1: 0.6246
 epoch: 66, train_loss: 0.6484, test_loss: 1.2326, test_f1: 0.6016
 epoch: 67, train_loss: 0.6853, test_loss: 1.2872, test_f1: 0.6157
 epoch: 68, train_loss: 0.6313, test_loss: 1.2814, test_f1: 0.6158
 epoch: 69, train_loss: 0.6337, test_loss: 1.2957, test_f1: 0.6066
 epoch: 70, train_loss: 0.6284, test_loss: 1.3248, test_f1: 0.6333
 epoch: 71, train_loss: 0.6503, test_loss: 1.3686, test_f1: 0.6071
 epoch: 72, train_loss: 0.6413, test_loss: 1.2839, test_f1: 0.5788
 epoch: 73, train_loss: 0.6164, test_loss: 1.2583, test_f1: 0.6289
 epoch: 74, train_loss: 0.6331, test_loss: 1.2738, test_f1: 0.6002
 epoch: 75, train_loss: 0.6357, test_loss: 1.2672, test_f1: 0.6221
 epoch: 76, train_loss: 0.6087, test_loss: 1.2914, test_f1: 0.6132
 epoch: 77, train_loss: 0.5907, test_loss: 1.2804, test_f1: 0.6304
 epoch: 78, train_loss: 0.5905, test_loss: 1.2662, test_f1: 0.6029
 epoch: 79, train_loss: 0.6023, test_loss: 1.2502, test_f1: 0.6030
 epoch: 80, train_loss: 0.5873, test_loss: 1.4519, test_f1: 0.5895
 epoch: 81, train_loss: 0.5958, test_loss: 1.3519, test_f1: 0.5734
 epoch: 82, train_loss: 0.5775, test_loss: 1.3077, test_f1: 0.6148
 epoch: 83, train_loss: 0.5938, test_loss: 1.3794, test_f1: 0.6278
 epoch: 84, train_loss: 0.5745, test_loss: 1.3487, test_f1: 0.6193
 epoch: 85, train_loss: 0.5989, test_loss: 1.3061, test_f1: 0.6219
 epoch: 86, train_loss: 0.5825, test_loss: 1.4045, test_f1: 0.6173
 epoch: 87, train_loss: 0.5840, test_loss: 1.5176, test_f1: 0.5503
 epoch: 88, train_loss: 0.5864, test_loss: 1.3243, test_f1: 0.6278
 epoch: 89, train_loss: 0.5692, test_loss: 1.3612, test_f1: 0.6154
 epoch: 90, train_loss: 0.5525, test_loss: 1.3937, test_f1: 0.5922
 epoch: 91, train_loss: 0.5657, test_loss: 1.3396, test_f1: 0.6204
 epoch: 92, train_loss: 0.5814, test_loss: 1.3995, test_f1: 0.6015
 epoch: 93, train_loss: 0.5568, test_loss: 1.4016, test_f1: 0.6099
 epoch: 94, train_loss: 0.5799, test_loss: 1.4735, test_f1: 0.6152
 epoch: 95, train_loss: 0.5547, test_loss: 1.3873, test_f1: 0.5935
 epoch: 96, train_loss: 0.5355, test_loss: 1.3829, test_f1: 0.6069
 epoch: 97, train_loss: 0.5398, test_loss: 1.3487, test_f1: 0.6050
 epoch: 98, train_loss: 0.5490, test_loss: 1.4131, test_f1: 0.5972
 epoch: 99, train_loss: 0.5132, test_loss: 1.5849, test_f1: 0.5940
##################ITERATION #1 ****************************************
 epoch: 0, train_loss: 1.2333, test_loss: 1.3046, test_f1: 0.2281
 epoch: 1, train_loss: 1.1177, test_loss: 1.2451, test_f1: 0.3245
 epoch: 2, train_loss: 1.0827, test_loss: 1.1448, test_f1: 0.4151
 epoch: 3, train_loss: 1.0412, test_loss: 1.1197, test_f1: 0.4468
 epoch: 4, train_loss: 1.0189, test_loss: 1.1096, test_f1: 0.4669
 epoch: 5, train_loss: 1.0038, test_loss: 1.1145, test_f1: 0.4720
 epoch: 6, train_loss: 0.9852, test_loss: 1.0560, test_f1: 0.5041
 epoch: 7, train_loss: 0.9745, test_loss: 1.1058, test_f1: 0.5115
 epoch: 8, train_loss: 0.9507, test_loss: 1.0793, test_f1: 0.5226
 epoch: 9, train_loss: 0.9429, test_loss: 1.0902, test_f1: 0.5309
 epoch: 10, train_loss: 0.9253, test_loss: 1.1087, test_f1: 0.5553
 epoch: 11, train_loss: 0.9158, test_loss: 1.0929, test_f1: 0.5322
 epoch: 12, train_loss: 0.8927, test_loss: 1.0548, test_f1: 0.5702
 epoch: 13, train_loss: 0.8744, test_loss: 1.0987, test_f1: 0.5870
 epoch: 14, train_loss: 0.8857, test_loss: 1.1096, test_f1: 0.5762
 epoch: 15, train_loss: 0.8678, test_loss: 1.1238, test_f1: 0.5794
 epoch: 16, train_loss: 0.8496, test_loss: 1.0763, test_f1: 0.5964
 epoch: 17, train_loss: 0.8659, test_loss: 1.1869, test_f1: 0.5489
 epoch: 18, train_loss: 0.8499, test_loss: 1.1231, test_f1: 0.5495
 epoch: 19, train_loss: 0.8290, test_loss: 1.0876, test_f1: 0.5626
 epoch: 20, train_loss: 0.8277, test_loss: 1.0810, test_f1: 0.5765
 epoch: 21, train_loss: 0.8327, test_loss: 1.0329, test_f1: 0.6210
 epoch: 22, train_loss: 0.8116, test_loss: 1.1224, test_f1: 0.5957
 epoch: 23, train_loss: 0.7951, test_loss: 1.1561, test_f1: 0.5685
 epoch: 24, train_loss: 0.8020, test_loss: 1.1895, test_f1: 0.5601
 epoch: 25, train_loss: 0.7869, test_loss: 1.1635, test_f1: 0.5772
 epoch: 26, train_loss: 0.7960, test_loss: 1.1458, test_f1: 0.5745
 epoch: 27, train_loss: 0.7888, test_loss: 1.1798, test_f1: 0.5685
 epoch: 28, train_loss: 0.7811, test_loss: 1.0991, test_f1: 0.5999
 epoch: 29, train_loss: 0.7563, test_loss: 1.1440, test_f1: 0.5865
 epoch: 30, train_loss: 0.7426, test_loss: 1.1378, test_f1: 0.6069
 epoch: 31, train_loss: 0.7279, test_loss: 1.1587, test_f1: 0.5892
 epoch: 32, train_loss: 0.7324, test_loss: 1.2126, test_f1: 0.5785
 epoch: 33, train_loss: 0.7129, test_loss: 1.1487, test_f1: 0.5935
 epoch: 34, train_loss: 0.7367, test_loss: 1.1192, test_f1: 0.6043
 epoch: 35, train_loss: 0.7366, test_loss: 1.3105, test_f1: 0.5832
 epoch: 36, train_loss: 0.7288, test_loss: 1.1078, test_f1: 0.6259
 epoch: 37, train_loss: 0.7088, test_loss: 1.2030, test_f1: 0.5946
 epoch: 38, train_loss: 0.7223, test_loss: 1.3057, test_f1: 0.5638
 epoch: 39, train_loss: 0.6885, test_loss: 1.2216, test_f1: 0.6027
 epoch: 40, train_loss: 0.6937, test_loss: 1.1942, test_f1: 0.5399
 epoch: 41, train_loss: 0.6952, test_loss: 1.2452, test_f1: 0.5798
 epoch: 42, train_loss: 0.6738, test_loss: 1.2868, test_f1: 0.6196
 epoch: 43, train_loss: 0.6549, test_loss: 1.1390, test_f1: 0.5986
 epoch: 44, train_loss: 0.6532, test_loss: 1.3759, test_f1: 0.5637
 epoch: 45, train_loss: 0.6604, test_loss: 1.3316, test_f1: 0.5980
 epoch: 46, train_loss: 0.6475, test_loss: 1.3694, test_f1: 0.5743
 epoch: 47, train_loss: 0.6205, test_loss: 1.3596, test_f1: 0.6017
 epoch: 48, train_loss: 0.6318, test_loss: 1.3715, test_f1: 0.6042
 epoch: 49, train_loss: 0.5953, test_loss: 1.3529, test_f1: 0.6109
 epoch: 50, train_loss: 0.6170, test_loss: 1.2657, test_f1: 0.6010
 epoch: 51, train_loss: 0.6118, test_loss: 1.3744, test_f1: 0.6227
 epoch: 52, train_loss: 0.5758, test_loss: 1.4235, test_f1: 0.6269
 epoch: 53, train_loss: 0.5962, test_loss: 1.3900, test_f1: 0.6185
 epoch: 54, train_loss: 0.5603, test_loss: 1.3759, test_f1: 0.6115
 epoch: 55, train_loss: 0.5564, test_loss: 1.3725, test_f1: 0.6081
 epoch: 56, train_loss: 0.5746, test_loss: 1.3969, test_f1: 0.6132
 epoch: 57, train_loss: 0.5756, test_loss: 1.4423, test_f1: 0.5855
 epoch: 58, train_loss: 0.5605, test_loss: 1.3857, test_f1: 0.6067
 epoch: 59, train_loss: 0.5568, test_loss: 1.5349, test_f1: 0.6048
 epoch: 60, train_loss: 0.5552, test_loss: 1.4942, test_f1: 0.5807
 epoch: 61, train_loss: 0.5468, test_loss: 1.4898, test_f1: 0.6308
 epoch: 62, train_loss: 0.5432, test_loss: 1.4487, test_f1: 0.6166
 epoch: 63, train_loss: 0.5383, test_loss: 1.5596, test_f1: 0.5829
 epoch: 64, train_loss: 0.5577, test_loss: 1.4878, test_f1: 0.5913
 epoch: 65, train_loss: 0.5545, test_loss: 1.4950, test_f1: 0.5922
 epoch: 66, train_loss: 0.5276, test_loss: 1.5249, test_f1: 0.6270
 epoch: 67, train_loss: 0.5348, test_loss: 1.5532, test_f1: 0.5764
 epoch: 68, train_loss: 0.5290, test_loss: 1.5662, test_f1: 0.5576
 epoch: 69, train_loss: 0.5512, test_loss: 1.6262, test_f1: 0.5609
 epoch: 70, train_loss: 0.5272, test_loss: 1.5158, test_f1: 0.5770
 epoch: 71, train_loss: 0.5053, test_loss: 1.5397, test_f1: 0.5949
 epoch: 72, train_loss: 0.5112, test_loss: 1.6216, test_f1: 0.5771
 epoch: 73, train_loss: 0.4920, test_loss: 1.4805, test_f1: 0.5977
 epoch: 74, train_loss: 0.4985, test_loss: 1.6442, test_f1: 0.5948
 epoch: 75, train_loss: 0.5137, test_loss: 1.5750, test_f1: 0.5924
 epoch: 76, train_loss: 0.4858, test_loss: 1.5486, test_f1: 0.5949
 epoch: 77, train_loss: 0.4903, test_loss: 1.6606, test_f1: 0.6029
 epoch: 78, train_loss: 0.4760, test_loss: 1.7348, test_f1: 0.5882
 epoch: 79, train_loss: 0.4865, test_loss: 1.6314, test_f1: 0.5988
 epoch: 80, train_loss: 0.4681, test_loss: 1.5276, test_f1: 0.6093
 epoch: 81, train_loss: 0.4774, test_loss: 1.8381, test_f1: 0.5696
 epoch: 82, train_loss: 0.4884, test_loss: 1.6375, test_f1: 0.5591
 epoch: 83, train_loss: 0.4780, test_loss: 1.8185, test_f1: 0.5981
 epoch: 84, train_loss: 0.4898, test_loss: 1.6380, test_f1: 0.5724
 epoch: 85, train_loss: 0.4871, test_loss: 1.6958, test_f1: 0.5489
 epoch: 86, train_loss: 0.4709, test_loss: 1.5973, test_f1: 0.6006
 epoch: 87, train_loss: 0.4908, test_loss: 1.8192, test_f1: 0.5934
 epoch: 88, train_loss: 0.4695, test_loss: 1.5964, test_f1: 0.5792
 epoch: 89, train_loss: 0.4715, test_loss: 1.7313, test_f1: 0.5639
 epoch: 90, train_loss: 0.4575, test_loss: 1.7330, test_f1: 0.5859
 epoch: 91, train_loss: 0.4613, test_loss: 1.7010, test_f1: 0.5942
 epoch: 92, train_loss: 0.4235, test_loss: 1.7949, test_f1: 0.5986
 epoch: 93, train_loss: 0.4540, test_loss: 1.9206, test_f1: 0.5985
 epoch: 94, train_loss: 0.4467, test_loss: 1.7441, test_f1: 0.6058
 epoch: 95, train_loss: 0.4431, test_loss: 1.8945, test_f1: 0.5789
 epoch: 96, train_loss: 0.4112, test_loss: 1.8032, test_f1: 0.5986
 epoch: 97, train_loss: 0.4328, test_loss: 1.8097, test_f1: 0.5874
 epoch: 98, train_loss: 0.4256, test_loss: 1.7984, test_f1: 0.5799
 epoch: 99, train_loss: 0.4248, test_loss: 1.8160, test_f1: 0.5860
##################ITERATION #2 ****************************************
 epoch: 0, train_loss: 1.2086, test_loss: 1.2965, test_f1: 0.2664
 epoch: 1, train_loss: 1.1104, test_loss: 1.2767, test_f1: 0.2548
 epoch: 2, train_loss: 1.0725, test_loss: 1.1956, test_f1: 0.3868
 epoch: 3, train_loss: 1.0474, test_loss: 1.1176, test_f1: 0.4949
 epoch: 4, train_loss: 1.0275, test_loss: 1.1364, test_f1: 0.5111
 epoch: 5, train_loss: 1.0045, test_loss: 1.1047, test_f1: 0.5351
 epoch: 6, train_loss: 0.9700, test_loss: 1.1085, test_f1: 0.5348
 epoch: 7, train_loss: 0.9535, test_loss: 1.1642, test_f1: 0.5288
 epoch: 8, train_loss: 0.9383, test_loss: 1.1227, test_f1: 0.5446
 epoch: 9, train_loss: 0.9319, test_loss: 1.0564, test_f1: 0.5206
 epoch: 10, train_loss: 0.9257, test_loss: 1.0865, test_f1: 0.5269
 epoch: 11, train_loss: 0.9069, test_loss: 1.0461, test_f1: 0.5450
 epoch: 12, train_loss: 0.9014, test_loss: 1.0493, test_f1: 0.5649
 epoch: 13, train_loss: 0.8789, test_loss: 1.1016, test_f1: 0.5852
 epoch: 14, train_loss: 0.8832, test_loss: 1.0845, test_f1: 0.5778
 epoch: 15, train_loss: 0.8790, test_loss: 1.1040, test_f1: 0.5655
 epoch: 16, train_loss: 0.8701, test_loss: 1.0687, test_f1: 0.5801
 epoch: 17, train_loss: 0.8677, test_loss: 1.0367, test_f1: 0.5539
 epoch: 18, train_loss: 0.8539, test_loss: 1.0840, test_f1: 0.5821
 epoch: 19, train_loss: 0.8440, test_loss: 1.0209, test_f1: 0.5827
 epoch: 20, train_loss: 0.8385, test_loss: 1.0354, test_f1: 0.5997
 epoch: 21, train_loss: 0.8370, test_loss: 1.1985, test_f1: 0.5786
 epoch: 22, train_loss: 0.8262, test_loss: 1.0597, test_f1: 0.6162
 epoch: 23, train_loss: 0.8376, test_loss: 1.0663, test_f1: 0.5945
 epoch: 24, train_loss: 0.8268, test_loss: 1.1151, test_f1: 0.5681
 epoch: 25, train_loss: 0.8156, test_loss: 1.0067, test_f1: 0.5966
 epoch: 26, train_loss: 0.8201, test_loss: 1.0827, test_f1: 0.5872
 epoch: 27, train_loss: 0.8058, test_loss: 1.0175, test_f1: 0.5847
 epoch: 28, train_loss: 0.8126, test_loss: 1.0094, test_f1: 0.5806
 epoch: 29, train_loss: 0.7868, test_loss: 1.0183, test_f1: 0.6179
 epoch: 30, train_loss: 0.7803, test_loss: 1.1020, test_f1: 0.5816
 epoch: 31, train_loss: 0.7900, test_loss: 0.9768, test_f1: 0.6214
 epoch: 32, train_loss: 0.7759, test_loss: 1.0981, test_f1: 0.5743
 epoch: 33, train_loss: 0.7582, test_loss: 1.1823, test_f1: 0.5836
 epoch: 34, train_loss: 0.7780, test_loss: 1.0899, test_f1: 0.5734
 epoch: 35, train_loss: 0.7720, test_loss: 1.1482, test_f1: 0.5952
 epoch: 36, train_loss: 0.7552, test_loss: 0.9761, test_f1: 0.6313
 epoch: 37, train_loss: 0.7571, test_loss: 1.1894, test_f1: 0.5815
 epoch: 38, train_loss: 0.7552, test_loss: 1.0226, test_f1: 0.6095
 epoch: 39, train_loss: 0.7421, test_loss: 1.1358, test_f1: 0.5847
 epoch: 40, train_loss: 0.7352, test_loss: 1.1279, test_f1: 0.5685
 epoch: 41, train_loss: 0.7423, test_loss: 1.0996, test_f1: 0.5633
 epoch: 42, train_loss: 0.7478, test_loss: 1.0331, test_f1: 0.6211
 epoch: 43, train_loss: 0.7432, test_loss: 1.0632, test_f1: 0.5885
 epoch: 44, train_loss: 0.7280, test_loss: 1.2713, test_f1: 0.5613
 epoch: 45, train_loss: 0.7297, test_loss: 0.9412, test_f1: 0.6149
 epoch: 46, train_loss: 0.7449, test_loss: 1.1091, test_f1: 0.6114
 epoch: 47, train_loss: 0.7311, test_loss: 1.0849, test_f1: 0.6087
 epoch: 48, train_loss: 0.6809, test_loss: 1.1587, test_f1: 0.5802
 epoch: 49, train_loss: 0.7027, test_loss: 1.0281, test_f1: 0.6011
 epoch: 50, train_loss: 0.7147, test_loss: 1.2587, test_f1: 0.5774
 epoch: 51, train_loss: 0.6863, test_loss: 1.0863, test_f1: 0.6142
 epoch: 52, train_loss: 0.6758, test_loss: 1.0807, test_f1: 0.6295
 epoch: 53, train_loss: 0.6674, test_loss: 1.1649, test_f1: 0.5816
 epoch: 54, train_loss: 0.6584, test_loss: 1.1014, test_f1: 0.5904
 epoch: 55, train_loss: 0.6646, test_loss: 1.1527, test_f1: 0.5750
 epoch: 56, train_loss: 0.6629, test_loss: 1.2627, test_f1: 0.5754
 epoch: 57, train_loss: 0.6454, test_loss: 1.1237, test_f1: 0.5939
 epoch: 58, train_loss: 0.6524, test_loss: 1.1841, test_f1: 0.5709
 epoch: 59, train_loss: 0.6277, test_loss: 1.0994, test_f1: 0.5971
 epoch: 60, train_loss: 0.6297, test_loss: 1.2314, test_f1: 0.5596
 epoch: 61, train_loss: 0.6451, test_loss: 1.1944, test_f1: 0.5740
 epoch: 62, train_loss: 0.6276, test_loss: 1.2851, test_f1: 0.5668
 epoch: 63, train_loss: 0.6418, test_loss: 1.1186, test_f1: 0.5896
 epoch: 64, train_loss: 0.6225, test_loss: 1.2354, test_f1: 0.5830
 epoch: 65, train_loss: 0.6345, test_loss: 1.2432, test_f1: 0.5784
 epoch: 66, train_loss: 0.6348, test_loss: 1.2068, test_f1: 0.6062
 epoch: 67, train_loss: 0.6044, test_loss: 1.2054, test_f1: 0.6037
 epoch: 68, train_loss: 0.6069, test_loss: 1.3256, test_f1: 0.5840
 epoch: 69, train_loss: 0.6136, test_loss: 1.3005, test_f1: 0.5902
 epoch: 70, train_loss: 0.6125, test_loss: 1.4472, test_f1: 0.5798
 epoch: 71, train_loss: 0.6057, test_loss: 1.2553, test_f1: 0.5840
 epoch: 72, train_loss: 0.6053, test_loss: 1.2789, test_f1: 0.5717
 epoch: 73, train_loss: 0.6069, test_loss: 1.2898, test_f1: 0.5598
 epoch: 74, train_loss: 0.5932, test_loss: 1.3937, test_f1: 0.5648
 epoch: 75, train_loss: 0.5952, test_loss: 1.2909, test_f1: 0.5830
 epoch: 76, train_loss: 0.5923, test_loss: 1.2884, test_f1: 0.5858
 epoch: 77, train_loss: 0.5915, test_loss: 1.3700, test_f1: 0.5867
 epoch: 78, train_loss: 0.5720, test_loss: 1.2873, test_f1: 0.5761
 epoch: 79, train_loss: 0.5908, test_loss: 1.4854, test_f1: 0.5792
 epoch: 80, train_loss: 0.5720, test_loss: 1.3355, test_f1: 0.5748
 epoch: 81, train_loss: 0.5701, test_loss: 1.3444, test_f1: 0.5934
 epoch: 82, train_loss: 0.5712, test_loss: 1.4583, test_f1: 0.5813
 epoch: 83, train_loss: 0.5615, test_loss: 1.4499, test_f1: 0.5712
 epoch: 84, train_loss: 0.5802, test_loss: 1.3768, test_f1: 0.5979
 epoch: 85, train_loss: 0.5645, test_loss: 1.5038, test_f1: 0.5748
 epoch: 86, train_loss: 0.5464, test_loss: 1.3748, test_f1: 0.5907
 epoch: 87, train_loss: 0.5508, test_loss: 1.3919, test_f1: 0.5823
 epoch: 88, train_loss: 0.5593, test_loss: 1.3880, test_f1: 0.5705
 epoch: 89, train_loss: 0.5385, test_loss: 1.3741, test_f1: 0.5780
 epoch: 90, train_loss: 0.5168, test_loss: 1.3679, test_f1: 0.5764
 epoch: 91, train_loss: 0.5571, test_loss: 1.5569, test_f1: 0.5708
 epoch: 92, train_loss: 0.5242, test_loss: 1.4952, test_f1: 0.5775
 epoch: 93, train_loss: 0.5608, test_loss: 1.5106, test_f1: 0.5833
 epoch: 94, train_loss: 0.5433, test_loss: 1.5305, test_f1: 0.5730
 epoch: 95, train_loss: 0.5230, test_loss: 1.5493, test_f1: 0.5811
 epoch: 96, train_loss: 0.5202, test_loss: 1.4611, test_f1: 0.5701
 epoch: 97, train_loss: 0.4894, test_loss: 1.4833, test_f1: 0.5635
 epoch: 98, train_loss: 0.5152, test_loss: 1.6250, test_f1: 0.5670
 epoch: 99, train_loss: 0.5331, test_loss: 1.5537, test_f1: 0.5667
##################ITERATION #3 ****************************************
 epoch: 0, train_loss: 1.3138, test_loss: 1.2969, test_f1: 0.1763
 epoch: 1, train_loss: 1.1155, test_loss: 1.2103, test_f1: 0.4545
 epoch: 2, train_loss: 1.0590, test_loss: 1.1357, test_f1: 0.4763
 epoch: 3, train_loss: 1.0341, test_loss: 1.1032, test_f1: 0.4902
 epoch: 4, train_loss: 1.0089, test_loss: 1.1092, test_f1: 0.5041
 epoch: 5, train_loss: 0.9804, test_loss: 1.0870, test_f1: 0.5185
 epoch: 6, train_loss: 0.9384, test_loss: 1.0743, test_f1: 0.5415
 epoch: 7, train_loss: 0.9470, test_loss: 1.1011, test_f1: 0.5659
 epoch: 8, train_loss: 0.9322, test_loss: 1.0627, test_f1: 0.5454
 epoch: 9, train_loss: 0.9175, test_loss: 1.0965, test_f1: 0.5436
 epoch: 10, train_loss: 0.9181, test_loss: 1.1029, test_f1: 0.5590
 epoch: 11, train_loss: 0.8933, test_loss: 1.0496, test_f1: 0.5729
 epoch: 12, train_loss: 0.8746, test_loss: 1.0602, test_f1: 0.5614
 epoch: 13, train_loss: 0.8833, test_loss: 1.0646, test_f1: 0.5837
 epoch: 14, train_loss: 0.8745, test_loss: 1.0369, test_f1: 0.5902
 epoch: 15, train_loss: 0.8531, test_loss: 1.0631, test_f1: 0.5856
 epoch: 16, train_loss: 0.8595, test_loss: 1.0219, test_f1: 0.5862
 epoch: 17, train_loss: 0.8537, test_loss: 1.0882, test_f1: 0.6091
 epoch: 18, train_loss: 0.8335, test_loss: 1.0640, test_f1: 0.5865
 epoch: 19, train_loss: 0.8156, test_loss: 1.0392, test_f1: 0.6225
 epoch: 20, train_loss: 0.8165, test_loss: 1.0708, test_f1: 0.5620
 epoch: 21, train_loss: 0.8157, test_loss: 1.0292, test_f1: 0.5977
 epoch: 22, train_loss: 0.7987, test_loss: 1.0850, test_f1: 0.5687
 epoch: 23, train_loss: 0.8043, test_loss: 1.0020, test_f1: 0.5806
 epoch: 24, train_loss: 0.7826, test_loss: 1.0646, test_f1: 0.5872
 epoch: 25, train_loss: 0.7973, test_loss: 1.0152, test_f1: 0.5911
 epoch: 26, train_loss: 0.7660, test_loss: 1.1025, test_f1: 0.5883
 epoch: 27, train_loss: 0.7635, test_loss: 1.0947, test_f1: 0.6078
 epoch: 28, train_loss: 0.7634, test_loss: 1.0410, test_f1: 0.5740
 epoch: 29, train_loss: 0.7543, test_loss: 1.0068, test_f1: 0.5729
 epoch: 30, train_loss: 0.7536, test_loss: 1.0408, test_f1: 0.6130
 epoch: 31, train_loss: 0.7355, test_loss: 1.0334, test_f1: 0.5636
 epoch: 32, train_loss: 0.7416, test_loss: 1.0836, test_f1: 0.5928
 epoch: 33, train_loss: 0.7234, test_loss: 1.1816, test_f1: 0.5916
 epoch: 34, train_loss: 0.7299, test_loss: 1.0291, test_f1: 0.6038
 epoch: 35, train_loss: 0.6876, test_loss: 1.1033, test_f1: 0.5727
 epoch: 36, train_loss: 0.6958, test_loss: 1.0320, test_f1: 0.6308
 epoch: 37, train_loss: 0.6866, test_loss: 1.0912, test_f1: 0.5924
 epoch: 38, train_loss: 0.6679, test_loss: 1.0863, test_f1: 0.5960
 epoch: 39, train_loss: 0.6976, test_loss: 1.1394, test_f1: 0.5879
 epoch: 40, train_loss: 0.6866, test_loss: 1.0019, test_f1: 0.6296
 epoch: 41, train_loss: 0.6627, test_loss: 1.1017, test_f1: 0.5984
 epoch: 42, train_loss: 0.6715, test_loss: 1.0519, test_f1: 0.6259
 epoch: 43, train_loss: 0.6611, test_loss: 1.0784, test_f1: 0.5932
 epoch: 44, train_loss: 0.6607, test_loss: 1.1459, test_f1: 0.5523
 epoch: 45, train_loss: 0.6624, test_loss: 1.0860, test_f1: 0.6167
 epoch: 46, train_loss: 0.6480, test_loss: 1.3169, test_f1: 0.5699
 epoch: 47, train_loss: 0.6307, test_loss: 1.0422, test_f1: 0.6441
 epoch: 48, train_loss: 0.6422, test_loss: 1.1308, test_f1: 0.6402
 epoch: 49, train_loss: 0.6121, test_loss: 1.1984, test_f1: 0.6039
 epoch: 50, train_loss: 0.5987, test_loss: 1.0261, test_f1: 0.6260
 epoch: 51, train_loss: 0.5839, test_loss: 1.1167, test_f1: 0.6062
 epoch: 52, train_loss: 0.5749, test_loss: 1.0771, test_f1: 0.6464
 epoch: 53, train_loss: 0.5913, test_loss: 1.1579, test_f1: 0.6171
 epoch: 54, train_loss: 0.5634, test_loss: 1.0795, test_f1: 0.6431
 epoch: 55, train_loss: 0.5828, test_loss: 1.1174, test_f1: 0.6261
 epoch: 56, train_loss: 0.5519, test_loss: 1.1563, test_f1: 0.6175
 epoch: 57, train_loss: 0.5309, test_loss: 1.1003, test_f1: 0.6077
 epoch: 58, train_loss: 0.5384, test_loss: 1.1872, test_f1: 0.6339
 epoch: 59, train_loss: 0.5340, test_loss: 1.0683, test_f1: 0.6380
 epoch: 60, train_loss: 0.5423, test_loss: 1.1976, test_f1: 0.6003
 epoch: 61, train_loss: 0.5336, test_loss: 1.1902, test_f1: 0.5996
 epoch: 62, train_loss: 0.5327, test_loss: 1.1350, test_f1: 0.6257
 epoch: 63, train_loss: 0.5520, test_loss: 1.1566, test_f1: 0.6204
 epoch: 64, train_loss: 0.5610, test_loss: 1.1909, test_f1: 0.5853
 epoch: 65, train_loss: 0.5309, test_loss: 1.1327, test_f1: 0.6311
 epoch: 66, train_loss: 0.5163, test_loss: 1.2080, test_f1: 0.5902
 epoch: 67, train_loss: 0.5015, test_loss: 1.2394, test_f1: 0.6174
 epoch: 68, train_loss: 0.5186, test_loss: 1.1639, test_f1: 0.6167
 epoch: 69, train_loss: 0.5132, test_loss: 1.2413, test_f1: 0.6281
 epoch: 70, train_loss: 0.5348, test_loss: 1.2295, test_f1: 0.6387
 epoch: 71, train_loss: 0.4851, test_loss: 1.2143, test_f1: 0.6259
 epoch: 72, train_loss: 0.4967, test_loss: 1.1997, test_f1: 0.6096
 epoch: 73, train_loss: 0.5071, test_loss: 1.1028, test_f1: 0.6244
 epoch: 74, train_loss: 0.5049, test_loss: 1.2928, test_f1: 0.6276
 epoch: 75, train_loss: 0.5031, test_loss: 1.2787, test_f1: 0.6002
 epoch: 76, train_loss: 0.4953, test_loss: 1.2412, test_f1: 0.6410
 epoch: 77, train_loss: 0.4945, test_loss: 1.2872, test_f1: 0.6202
 epoch: 78, train_loss: 0.4773, test_loss: 1.2658, test_f1: 0.6062
 epoch: 79, train_loss: 0.4965, test_loss: 1.3575, test_f1: 0.6117
 epoch: 80, train_loss: 0.4885, test_loss: 1.3683, test_f1: 0.6184
 epoch: 81, train_loss: 0.4801, test_loss: 1.2872, test_f1: 0.6210
 epoch: 82, train_loss: 0.5146, test_loss: 1.2994, test_f1: 0.6286
 epoch: 83, train_loss: 0.4811, test_loss: 1.3468, test_f1: 0.6099
 epoch: 84, train_loss: 0.4656, test_loss: 1.3193, test_f1: 0.6356
 epoch: 85, train_loss: 0.4647, test_loss: 1.3190, test_f1: 0.6227
 epoch: 86, train_loss: 0.4989, test_loss: 1.4257, test_f1: 0.6292
 epoch: 87, train_loss: 0.4740, test_loss: 1.2642, test_f1: 0.6375
 epoch: 88, train_loss: 0.4760, test_loss: 1.3252, test_f1: 0.6149
 epoch: 89, train_loss: 0.4679, test_loss: 1.2941, test_f1: 0.6069
 epoch: 90, train_loss: 0.4532, test_loss: 1.3333, test_f1: 0.6037
 epoch: 91, train_loss: 0.4690, test_loss: 1.3852, test_f1: 0.6207
 epoch: 92, train_loss: 0.4619, test_loss: 1.3965, test_f1: 0.6153
 epoch: 93, train_loss: 0.4497, test_loss: 1.3152, test_f1: 0.6217
 epoch: 94, train_loss: 0.4363, test_loss: 1.3556, test_f1: 0.6391
 epoch: 95, train_loss: 0.4523, test_loss: 1.3316, test_f1: 0.6494
 epoch: 96, train_loss: 0.4352, test_loss: 1.2807, test_f1: 0.6247
 epoch: 97, train_loss: 0.4238, test_loss: 1.3993, test_f1: 0.6224
 epoch: 98, train_loss: 0.4243, test_loss: 1.4320, test_f1: 0.6164
 epoch: 99, train_loss: 0.4442, test_loss: 1.4195, test_f1: 0.6001
##################ITERATION #4 ****************************************
 epoch: 0, train_loss: 1.2093, test_loss: 1.2594, test_f1: 0.3187
 epoch: 1, train_loss: 1.1222, test_loss: 1.2199, test_f1: 0.3706
 epoch: 2, train_loss: 1.0545, test_loss: 1.0971, test_f1: 0.4787
 epoch: 3, train_loss: 1.0165, test_loss: 1.0562, test_f1: 0.5007
 epoch: 4, train_loss: 0.9934, test_loss: 1.0550, test_f1: 0.5080
 epoch: 5, train_loss: 0.9963, test_loss: 1.0310, test_f1: 0.5298
 epoch: 6, train_loss: 0.9742, test_loss: 1.0167, test_f1: 0.5531
 epoch: 7, train_loss: 0.9568, test_loss: 1.0631, test_f1: 0.5259
 epoch: 8, train_loss: 0.9469, test_loss: 1.0510, test_f1: 0.5177
 epoch: 9, train_loss: 0.9301, test_loss: 1.0078, test_f1: 0.5241
 epoch: 10, train_loss: 0.8982, test_loss: 1.0188, test_f1: 0.5492
 epoch: 11, train_loss: 0.9199, test_loss: 1.0979, test_f1: 0.4973
 epoch: 12, train_loss: 0.9075, test_loss: 1.0039, test_f1: 0.5564
 epoch: 13, train_loss: 0.8808, test_loss: 1.0432, test_f1: 0.5386
 epoch: 14, train_loss: 0.8681, test_loss: 1.0498, test_f1: 0.5587
 epoch: 15, train_loss: 0.8511, test_loss: 1.0159, test_f1: 0.5396
 epoch: 16, train_loss: 0.8634, test_loss: 1.0559, test_f1: 0.5756
 epoch: 17, train_loss: 0.8522, test_loss: 1.0087, test_f1: 0.5303
 epoch: 18, train_loss: 0.8688, test_loss: 1.0407, test_f1: 0.5870
 epoch: 19, train_loss: 0.8526, test_loss: 1.0529, test_f1: 0.5425
 epoch: 20, train_loss: 0.8366, test_loss: 1.0726, test_f1: 0.5789
 epoch: 21, train_loss: 0.8295, test_loss: 1.0594, test_f1: 0.5561
 epoch: 22, train_loss: 0.8342, test_loss: 1.0116, test_f1: 0.5222
 epoch: 23, train_loss: 0.8134, test_loss: 1.0243, test_f1: 0.5892
 epoch: 24, train_loss: 0.8071, test_loss: 1.0954, test_f1: 0.5619
 epoch: 25, train_loss: 0.8162, test_loss: 1.0343, test_f1: 0.5712
 epoch: 26, train_loss: 0.8085, test_loss: 1.0548, test_f1: 0.5546
 epoch: 27, train_loss: 0.7752, test_loss: 1.1071, test_f1: 0.5593
 epoch: 28, train_loss: 0.7815, test_loss: 1.1092, test_f1: 0.5750
 epoch: 29, train_loss: 0.7788, test_loss: 1.0797, test_f1: 0.5792
 epoch: 30, train_loss: 0.7754, test_loss: 1.0766, test_f1: 0.5521
 epoch: 31, train_loss: 0.7528, test_loss: 1.1099, test_f1: 0.5583
 epoch: 32, train_loss: 0.7615, test_loss: 1.0855, test_f1: 0.5651
 epoch: 33, train_loss: 0.7629, test_loss: 1.0705, test_f1: 0.5574
 epoch: 34, train_loss: 0.7534, test_loss: 1.0911, test_f1: 0.5858
 epoch: 35, train_loss: 0.7464, test_loss: 1.1508, test_f1: 0.5543
 epoch: 36, train_loss: 0.7246, test_loss: 1.1108, test_f1: 0.5882
 epoch: 37, train_loss: 0.7248, test_loss: 1.1479, test_f1: 0.5846
 epoch: 38, train_loss: 0.7104, test_loss: 1.1214, test_f1: 0.5829
 epoch: 39, train_loss: 0.7333, test_loss: 1.2569, test_f1: 0.5749
 epoch: 40, train_loss: 0.7079, test_loss: 1.1863, test_f1: 0.5580
 epoch: 41, train_loss: 0.7066, test_loss: 1.1793, test_f1: 0.5816
 epoch: 42, train_loss: 0.7095, test_loss: 1.1163, test_f1: 0.6111
 epoch: 43, train_loss: 0.6921, test_loss: 1.1390, test_f1: 0.5605
 epoch: 44, train_loss: 0.6913, test_loss: 1.1568, test_f1: 0.5751
 epoch: 45, train_loss: 0.6637, test_loss: 1.2155, test_f1: 0.5624
 epoch: 46, train_loss: 0.6683, test_loss: 1.1166, test_f1: 0.6162
 epoch: 47, train_loss: 0.6851, test_loss: 1.2306, test_f1: 0.5527
 epoch: 48, train_loss: 0.6659, test_loss: 1.2008, test_f1: 0.5973
 epoch: 49, train_loss: 0.6361, test_loss: 1.2214, test_f1: 0.5437
 epoch: 50, train_loss: 0.6244, test_loss: 1.2406, test_f1: 0.5965
 epoch: 51, train_loss: 0.6149, test_loss: 1.2194, test_f1: 0.5700
 epoch: 52, train_loss: 0.5894, test_loss: 1.2303, test_f1: 0.6086
 epoch: 53, train_loss: 0.6041, test_loss: 1.1869, test_f1: 0.6268
 epoch: 54, train_loss: 0.6040, test_loss: 1.2557, test_f1: 0.6095
 epoch: 55, train_loss: 0.5966, test_loss: 1.1746, test_f1: 0.6190
 epoch: 56, train_loss: 0.5875, test_loss: 1.2396, test_f1: 0.6348
 epoch: 57, train_loss: 0.5884, test_loss: 1.2677, test_f1: 0.5712
 epoch: 58, train_loss: 0.5901, test_loss: 1.3174, test_f1: 0.5764
 epoch: 59, train_loss: 0.5737, test_loss: 1.3173, test_f1: 0.5627
 epoch: 60, train_loss: 0.5707, test_loss: 1.2177, test_f1: 0.6019
 epoch: 61, train_loss: 0.5803, test_loss: 1.3048, test_f1: 0.5715
 epoch: 62, train_loss: 0.5669, test_loss: 1.2706, test_f1: 0.6327
 epoch: 63, train_loss: 0.5688, test_loss: 1.3580, test_f1: 0.5692
 epoch: 64, train_loss: 0.5599, test_loss: 1.2977, test_f1: 0.6200
 epoch: 65, train_loss: 0.5446, test_loss: 1.3871, test_f1: 0.5786
 epoch: 66, train_loss: 0.5648, test_loss: 1.4340, test_f1: 0.5782
 epoch: 67, train_loss: 0.5477, test_loss: 1.4250, test_f1: 0.5766
 epoch: 68, train_loss: 0.5525, test_loss: 1.4326, test_f1: 0.5734
 epoch: 69, train_loss: 0.5414, test_loss: 1.4059, test_f1: 0.5829
 epoch: 70, train_loss: 0.5534, test_loss: 1.4116, test_f1: 0.5920
 epoch: 71, train_loss: 0.5446, test_loss: 1.4065, test_f1: 0.5875
 epoch: 72, train_loss: 0.5221, test_loss: 1.4193, test_f1: 0.5848
 epoch: 73, train_loss: 0.5595, test_loss: 1.4870, test_f1: 0.5677
 epoch: 74, train_loss: 0.5285, test_loss: 1.5479, test_f1: 0.5600
 epoch: 75, train_loss: 0.5201, test_loss: 1.4778, test_f1: 0.5654
 epoch: 76, train_loss: 0.5180, test_loss: 1.4212, test_f1: 0.5965
 epoch: 77, train_loss: 0.5117, test_loss: 1.4731, test_f1: 0.5683
 epoch: 78, train_loss: 0.5207, test_loss: 1.5233, test_f1: 0.5545
 epoch: 79, train_loss: 0.5115, test_loss: 1.4783, test_f1: 0.5878
 epoch: 80, train_loss: 0.5178, test_loss: 1.6171, test_f1: 0.5297
 epoch: 81, train_loss: 0.5233, test_loss: 1.5897, test_f1: 0.5673
 epoch: 82, train_loss: 0.5206, test_loss: 1.5516, test_f1: 0.5468
 epoch: 83, train_loss: 0.4947, test_loss: 1.4702, test_f1: 0.5828
 epoch: 84, train_loss: 0.5020, test_loss: 1.5957, test_f1: 0.5685
 epoch: 85, train_loss: 0.5068, test_loss: 1.4933, test_f1: 0.6261
 epoch: 86, train_loss: 0.4811, test_loss: 1.5672, test_f1: 0.5619
 epoch: 87, train_loss: 0.4860, test_loss: 1.4992, test_f1: 0.5708
 epoch: 88, train_loss: 0.4827, test_loss: 1.4868, test_f1: 0.5946
 epoch: 89, train_loss: 0.4790, test_loss: 1.5244, test_f1: 0.5783
 epoch: 90, train_loss: 0.5003, test_loss: 1.7060, test_f1: 0.5157
 epoch: 91, train_loss: 0.4872, test_loss: 1.5322, test_f1: 0.6024
 epoch: 92, train_loss: 0.4651, test_loss: 1.6763, test_f1: 0.5592
 epoch: 93, train_loss: 0.4883, test_loss: 1.6487, test_f1: 0.5778
 epoch: 94, train_loss: 0.4730, test_loss: 1.5840, test_f1: 0.5851
 epoch: 95, train_loss: 0.4668, test_loss: 1.6073, test_f1: 0.5499
 epoch: 96, train_loss: 0.4563, test_loss: 1.7122, test_f1: 0.5531
 epoch: 97, train_loss: 0.4626, test_loss: 1.5192, test_f1: 0.6134
 epoch: 98, train_loss: 0.4746, test_loss: 1.5855, test_f1: 0.5986
 epoch: 99, train_loss: 0.4639, test_loss: 1.7640, test_f1: 0.5507
##################ITERATION #5 ****************************************
 epoch: 0, train_loss: 1.3064, test_loss: 1.2698, test_f1: 0.2851
 epoch: 1, train_loss: 1.1425, test_loss: 1.2175, test_f1: 0.3659
 epoch: 2, train_loss: 1.0942, test_loss: 1.1777, test_f1: 0.4142
 epoch: 3, train_loss: 1.0600, test_loss: 1.1335, test_f1: 0.4467
 epoch: 4, train_loss: 1.0291, test_loss: 1.1472, test_f1: 0.4846
 epoch: 5, train_loss: 1.0150, test_loss: 1.0874, test_f1: 0.4766
 epoch: 6, train_loss: 1.0063, test_loss: 1.1069, test_f1: 0.4977
 epoch: 7, train_loss: 0.9708, test_loss: 1.0878, test_f1: 0.4966
 epoch: 8, train_loss: 0.9603, test_loss: 1.1020, test_f1: 0.5089
 epoch: 9, train_loss: 0.9525, test_loss: 1.0946, test_f1: 0.4975
 epoch: 10, train_loss: 0.9367, test_loss: 1.0779, test_f1: 0.5460
 epoch: 11, train_loss: 0.9318, test_loss: 1.0882, test_f1: 0.5265
 epoch: 12, train_loss: 0.9069, test_loss: 1.0389, test_f1: 0.5361
 epoch: 13, train_loss: 0.9138, test_loss: 1.0390, test_f1: 0.5417
 epoch: 14, train_loss: 0.9079, test_loss: 1.0633, test_f1: 0.5310
 epoch: 15, train_loss: 0.8752, test_loss: 1.0705, test_f1: 0.5347
 epoch: 16, train_loss: 0.8912, test_loss: 1.0689, test_f1: 0.5181
 epoch: 17, train_loss: 0.8850, test_loss: 1.0692, test_f1: 0.5055
 epoch: 18, train_loss: 0.8662, test_loss: 1.0271, test_f1: 0.5348
 epoch: 19, train_loss: 0.8596, test_loss: 1.0628, test_f1: 0.5408
 epoch: 20, train_loss: 0.8433, test_loss: 1.0410, test_f1: 0.5295
 epoch: 21, train_loss: 0.8371, test_loss: 1.0323, test_f1: 0.5436
 epoch: 22, train_loss: 0.8330, test_loss: 1.0527, test_f1: 0.5227
 epoch: 23, train_loss: 0.8279, test_loss: 1.0658, test_f1: 0.5354
 epoch: 24, train_loss: 0.8201, test_loss: 0.9958, test_f1: 0.5276
 epoch: 25, train_loss: 0.8173, test_loss: 1.0249, test_f1: 0.5324
 epoch: 26, train_loss: 0.8148, test_loss: 1.0551, test_f1: 0.5380
 epoch: 27, train_loss: 0.8355, test_loss: 1.0280, test_f1: 0.5664
 epoch: 28, train_loss: 0.8243, test_loss: 1.0480, test_f1: 0.5720
 epoch: 29, train_loss: 0.7916, test_loss: 1.0538, test_f1: 0.5648
 epoch: 30, train_loss: 0.7733, test_loss: 1.0522, test_f1: 0.5518
 epoch: 31, train_loss: 0.7778, test_loss: 1.0808, test_f1: 0.5331
 epoch: 32, train_loss: 0.7731, test_loss: 0.9853, test_f1: 0.6042
 epoch: 33, train_loss: 0.7529, test_loss: 1.0473, test_f1: 0.5349
 epoch: 34, train_loss: 0.7554, test_loss: 0.9621, test_f1: 0.5958
 epoch: 35, train_loss: 0.7516, test_loss: 1.0878, test_f1: 0.5565
 epoch: 36, train_loss: 0.7361, test_loss: 1.0879, test_f1: 0.5875
 epoch: 37, train_loss: 0.7303, test_loss: 1.0064, test_f1: 0.5662
 epoch: 38, train_loss: 0.7242, test_loss: 1.0279, test_f1: 0.6116
 epoch: 39, train_loss: 0.7054, test_loss: 1.0560, test_f1: 0.5753
 epoch: 40, train_loss: 0.7160, test_loss: 0.9770, test_f1: 0.5955
 epoch: 41, train_loss: 0.7172, test_loss: 1.0487, test_f1: 0.5816
 epoch: 42, train_loss: 0.6908, test_loss: 1.0829, test_f1: 0.5867
 epoch: 43, train_loss: 0.6984, test_loss: 1.0772, test_f1: 0.5726
 epoch: 44, train_loss: 0.6971, test_loss: 1.0496, test_f1: 0.5770
 epoch: 45, train_loss: 0.6819, test_loss: 1.0818, test_f1: 0.5428
 epoch: 46, train_loss: 0.6601, test_loss: 1.0691, test_f1: 0.6037
 epoch: 47, train_loss: 0.6733, test_loss: 1.2569, test_f1: 0.5164
 epoch: 48, train_loss: 0.6822, test_loss: 1.1331, test_f1: 0.5643
 epoch: 49, train_loss: 0.6565, test_loss: 1.0356, test_f1: 0.5999
 epoch: 50, train_loss: 0.6489, test_loss: 1.0678, test_f1: 0.5793
 epoch: 51, train_loss: 0.6208, test_loss: 1.0832, test_f1: 0.5577
 epoch: 52, train_loss: 0.6281, test_loss: 1.0912, test_f1: 0.6238
 epoch: 53, train_loss: 0.6240, test_loss: 1.0683, test_f1: 0.5888
 epoch: 54, train_loss: 0.6288, test_loss: 1.0810, test_f1: 0.6151
 epoch: 55, train_loss: 0.6027, test_loss: 1.0929, test_f1: 0.5660
 epoch: 56, train_loss: 0.5894, test_loss: 1.1142, test_f1: 0.5742
 epoch: 57, train_loss: 0.5950, test_loss: 1.0703, test_f1: 0.6070
 epoch: 58, train_loss: 0.5986, test_loss: 1.1296, test_f1: 0.5766
 epoch: 59, train_loss: 0.5760, test_loss: 1.0640, test_f1: 0.5861
 epoch: 60, train_loss: 0.5860, test_loss: 1.0739, test_f1: 0.5649
 epoch: 61, train_loss: 0.5954, test_loss: 1.0846, test_f1: 0.6043
 epoch: 62, train_loss: 0.5789, test_loss: 1.1414, test_f1: 0.5894
 epoch: 63, train_loss: 0.5873, test_loss: 1.1354, test_f1: 0.6010
 epoch: 64, train_loss: 0.5608, test_loss: 1.1990, test_f1: 0.5274
 epoch: 65, train_loss: 0.5860, test_loss: 1.2213, test_f1: 0.5613
 epoch: 66, train_loss: 0.6150, test_loss: 1.1534, test_f1: 0.5429
 epoch: 67, train_loss: 0.5739, test_loss: 1.1188, test_f1: 0.5414
 epoch: 68, train_loss: 0.5629, test_loss: 1.0934, test_f1: 0.5478
 epoch: 69, train_loss: 0.5501, test_loss: 1.1068, test_f1: 0.5921
 epoch: 70, train_loss: 0.5612, test_loss: 1.2059, test_f1: 0.5786
 epoch: 71, train_loss: 0.5453, test_loss: 1.2270, test_f1: 0.5650
 epoch: 72, train_loss: 0.5357, test_loss: 1.2604, test_f1: 0.5767
 epoch: 73, train_loss: 0.5379, test_loss: 1.2221, test_f1: 0.5842
 epoch: 74, train_loss: 0.5310, test_loss: 1.2145, test_f1: 0.5864
 epoch: 75, train_loss: 0.5256, test_loss: 1.2157, test_f1: 0.5516
 epoch: 76, train_loss: 0.5224, test_loss: 1.3060, test_f1: 0.5518
 epoch: 77, train_loss: 0.5596, test_loss: 1.2399, test_f1: 0.5465
 epoch: 78, train_loss: 0.5609, test_loss: 1.2090, test_f1: 0.5365
 epoch: 79, train_loss: 0.5435, test_loss: 1.2502, test_f1: 0.5649
 epoch: 80, train_loss: 0.5129, test_loss: 1.2333, test_f1: 0.5431
 epoch: 81, train_loss: 0.5209, test_loss: 1.2585, test_f1: 0.5962
 epoch: 82, train_loss: 0.5259, test_loss: 1.2506, test_f1: 0.5398
 epoch: 83, train_loss: 0.5114, test_loss: 1.3270, test_f1: 0.5836
 epoch: 84, train_loss: 0.5061, test_loss: 1.3127, test_f1: 0.5893
 epoch: 85, train_loss: 0.5188, test_loss: 1.3718, test_f1: 0.5657
 epoch: 86, train_loss: 0.5198, test_loss: 1.3957, test_f1: 0.5761
 epoch: 87, train_loss: 0.4973, test_loss: 1.2097, test_f1: 0.5555
 epoch: 88, train_loss: 0.5210, test_loss: 1.2853, test_f1: 0.5802
 epoch: 89, train_loss: 0.5002, test_loss: 1.4299, test_f1: 0.5408
 epoch: 90, train_loss: 0.5029, test_loss: 1.2464, test_f1: 0.5952
 epoch: 91, train_loss: 0.4738, test_loss: 1.3404, test_f1: 0.5765
 epoch: 92, train_loss: 0.4968, test_loss: 1.3789, test_f1: 0.5701
 epoch: 93, train_loss: 0.4998, test_loss: 1.3619, test_f1: 0.5741
 epoch: 94, train_loss: 0.4725, test_loss: 1.3636, test_f1: 0.5773
 epoch: 95, train_loss: 0.4837, test_loss: 1.5087, test_f1: 0.5118
 epoch: 96, train_loss: 0.4928, test_loss: 1.3889, test_f1: 0.5449
 epoch: 97, train_loss: 0.4752, test_loss: 1.5110, test_f1: 0.5700
 epoch: 98, train_loss: 0.4732, test_loss: 1.5419, test_f1: 0.5428
 epoch: 99, train_loss: 0.4877, test_loss: 1.3643, test_f1: 0.5913
##################ITERATION #6 ****************************************
 epoch: 0, train_loss: 1.4101, test_loss: 1.3379, test_f1: 0.2502
 epoch: 1, train_loss: 1.1870, test_loss: 1.2485, test_f1: 0.3136
 epoch: 2, train_loss: 1.1045, test_loss: 1.1975, test_f1: 0.3961
 epoch: 3, train_loss: 1.0717, test_loss: 1.1234, test_f1: 0.4655
 epoch: 4, train_loss: 1.0523, test_loss: 1.1077, test_f1: 0.5144
 epoch: 5, train_loss: 1.0079, test_loss: 1.0733, test_f1: 0.5140
 epoch: 6, train_loss: 1.0147, test_loss: 1.0650, test_f1: 0.4829
 epoch: 7, train_loss: 1.0063, test_loss: 1.0730, test_f1: 0.5286
 epoch: 8, train_loss: 0.9611, test_loss: 1.0583, test_f1: 0.5321
 epoch: 9, train_loss: 0.9515, test_loss: 1.0180, test_f1: 0.5109
 epoch: 10, train_loss: 0.9460, test_loss: 1.0350, test_f1: 0.5494
 epoch: 11, train_loss: 0.9407, test_loss: 1.0151, test_f1: 0.5212
 epoch: 12, train_loss: 0.9377, test_loss: 1.0355, test_f1: 0.5491
 epoch: 13, train_loss: 0.9069, test_loss: 1.0019, test_f1: 0.5767
 epoch: 14, train_loss: 0.9044, test_loss: 1.0330, test_f1: 0.5375
 epoch: 15, train_loss: 0.8835, test_loss: 1.0050, test_f1: 0.5725
 epoch: 16, train_loss: 0.8620, test_loss: 0.9873, test_f1: 0.5765
 epoch: 17, train_loss: 0.8557, test_loss: 1.0149, test_f1: 0.5605
 epoch: 18, train_loss: 0.8692, test_loss: 1.0010, test_f1: 0.5715
 epoch: 19, train_loss: 0.8580, test_loss: 1.0245, test_f1: 0.5986
 epoch: 20, train_loss: 0.8468, test_loss: 1.0019, test_f1: 0.5969
 epoch: 21, train_loss: 0.8370, test_loss: 1.0544, test_f1: 0.5980
 epoch: 22, train_loss: 0.8576, test_loss: 1.1384, test_f1: 0.5631
 epoch: 23, train_loss: 0.8646, test_loss: 1.0185, test_f1: 0.5797
 epoch: 24, train_loss: 0.8451, test_loss: 1.1607, test_f1: 0.5753
 epoch: 25, train_loss: 0.8294, test_loss: 0.9758, test_f1: 0.6353
 epoch: 26, train_loss: 0.8151, test_loss: 1.0281, test_f1: 0.6071
 epoch: 27, train_loss: 0.8207, test_loss: 0.9866, test_f1: 0.6030
 epoch: 28, train_loss: 0.8028, test_loss: 1.0019, test_f1: 0.6087
 epoch: 29, train_loss: 0.7966, test_loss: 1.0213, test_f1: 0.5916
 epoch: 30, train_loss: 0.7727, test_loss: 0.9815, test_f1: 0.6198
 epoch: 31, train_loss: 0.7697, test_loss: 1.1346, test_f1: 0.5740
 epoch: 32, train_loss: 0.7748, test_loss: 1.0932, test_f1: 0.5701
 epoch: 33, train_loss: 0.7708, test_loss: 1.0324, test_f1: 0.6009
 epoch: 34, train_loss: 0.7620, test_loss: 0.9774, test_f1: 0.6261
 epoch: 35, train_loss: 0.7669, test_loss: 1.0923, test_f1: 0.5929
 epoch: 36, train_loss: 0.7467, test_loss: 1.0088, test_f1: 0.6337
 epoch: 37, train_loss: 0.7479, test_loss: 1.0680, test_f1: 0.6176
 epoch: 38, train_loss: 0.7274, test_loss: 0.9946, test_f1: 0.6410
 epoch: 39, train_loss: 0.7175, test_loss: 1.0175, test_f1: 0.6072
 epoch: 40, train_loss: 0.7251, test_loss: 1.0621, test_f1: 0.6108
 epoch: 41, train_loss: 0.7007, test_loss: 1.0273, test_f1: 0.6455
 epoch: 42, train_loss: 0.7005, test_loss: 1.0623, test_f1: 0.6135
 epoch: 43, train_loss: 0.7003, test_loss: 0.9914, test_f1: 0.6405
 epoch: 44, train_loss: 0.6806, test_loss: 1.0564, test_f1: 0.6244
 epoch: 45, train_loss: 0.7016, test_loss: 1.0341, test_f1: 0.6319
 epoch: 46, train_loss: 0.6857, test_loss: 1.0129, test_f1: 0.6081
 epoch: 47, train_loss: 0.6612, test_loss: 1.0374, test_f1: 0.6102
 epoch: 48, train_loss: 0.6668, test_loss: 1.0392, test_f1: 0.6152
 epoch: 49, train_loss: 0.6570, test_loss: 1.0254, test_f1: 0.6070
 epoch: 50, train_loss: 0.6716, test_loss: 1.0502, test_f1: 0.6028
 epoch: 51, train_loss: 0.6383, test_loss: 1.0403, test_f1: 0.6124
 epoch: 52, train_loss: 0.6326, test_loss: 1.0643, test_f1: 0.6163
 epoch: 53, train_loss: 0.6330, test_loss: 1.0424, test_f1: 0.6185
 epoch: 54, train_loss: 0.6148, test_loss: 1.0733, test_f1: 0.5988
 epoch: 55, train_loss: 0.6368, test_loss: 1.0498, test_f1: 0.6243
 epoch: 56, train_loss: 0.6371, test_loss: 1.0269, test_f1: 0.6561
 epoch: 57, train_loss: 0.6139, test_loss: 1.1178, test_f1: 0.6093
 epoch: 58, train_loss: 0.6081, test_loss: 1.0425, test_f1: 0.6146
 epoch: 59, train_loss: 0.6337, test_loss: 1.0529, test_f1: 0.6192
 epoch: 60, train_loss: 0.6103, test_loss: 1.0936, test_f1: 0.6262
 epoch: 61, train_loss: 0.6159, test_loss: 1.0770, test_f1: 0.6231
 epoch: 62, train_loss: 0.6100, test_loss: 1.0677, test_f1: 0.6377
 epoch: 63, train_loss: 0.5952, test_loss: 1.0625, test_f1: 0.6266
 epoch: 64, train_loss: 0.5941, test_loss: 1.0598, test_f1: 0.6185
 epoch: 65, train_loss: 0.5924, test_loss: 1.0560, test_f1: 0.6259
 epoch: 66, train_loss: 0.5794, test_loss: 1.1643, test_f1: 0.6204
 epoch: 67, train_loss: 0.5971, test_loss: 1.0454, test_f1: 0.6487
 epoch: 68, train_loss: 0.5874, test_loss: 1.1383, test_f1: 0.6354
 epoch: 69, train_loss: 0.5950, test_loss: 1.1444, test_f1: 0.6435
 epoch: 70, train_loss: 0.6070, test_loss: 1.1430, test_f1: 0.6196
 epoch: 71, train_loss: 0.5826, test_loss: 1.0983, test_f1: 0.6274
 epoch: 72, train_loss: 0.5698, test_loss: 1.1194, test_f1: 0.6301
 epoch: 73, train_loss: 0.5740, test_loss: 1.1607, test_f1: 0.5885
 epoch: 74, train_loss: 0.5680, test_loss: 1.1065, test_f1: 0.6450
 epoch: 75, train_loss: 0.5682, test_loss: 1.0953, test_f1: 0.6286
 epoch: 76, train_loss: 0.5676, test_loss: 1.1523, test_f1: 0.6301
 epoch: 77, train_loss: 0.5580, test_loss: 1.1763, test_f1: 0.6163
 epoch: 78, train_loss: 0.5384, test_loss: 1.1335, test_f1: 0.6372
 epoch: 79, train_loss: 0.5523, test_loss: 1.1385, test_f1: 0.6138
 epoch: 80, train_loss: 0.5428, test_loss: 1.2650, test_f1: 0.6277
 epoch: 81, train_loss: 0.5632, test_loss: 1.1654, test_f1: 0.6237
 epoch: 82, train_loss: 0.5402, test_loss: 1.1984, test_f1: 0.6185
 epoch: 83, train_loss: 0.5450, test_loss: 1.2209, test_f1: 0.6226
 epoch: 84, train_loss: 0.5545, test_loss: 1.2255, test_f1: 0.6144
 epoch: 85, train_loss: 0.5370, test_loss: 1.1815, test_f1: 0.6315
 epoch: 86, train_loss: 0.5325, test_loss: 1.2643, test_f1: 0.6249
 epoch: 87, train_loss: 0.5529, test_loss: 1.1220, test_f1: 0.6236
 epoch: 88, train_loss: 0.5292, test_loss: 1.2215, test_f1: 0.6306
 epoch: 89, train_loss: 0.5478, test_loss: 1.2055, test_f1: 0.6332
 epoch: 90, train_loss: 0.5451, test_loss: 1.2259, test_f1: 0.6331
 epoch: 91, train_loss: 0.5312, test_loss: 1.2073, test_f1: 0.6306
 epoch: 92, train_loss: 0.5359, test_loss: 1.2028, test_f1: 0.6345
 epoch: 93, train_loss: 0.5301, test_loss: 1.1884, test_f1: 0.6245
 epoch: 94, train_loss: 0.5084, test_loss: 1.1486, test_f1: 0.6288
 epoch: 95, train_loss: 0.5155, test_loss: 1.2130, test_f1: 0.6176
 epoch: 96, train_loss: 0.5115, test_loss: 1.2139, test_f1: 0.6217
 epoch: 97, train_loss: 0.5313, test_loss: 1.3031, test_f1: 0.6363
 epoch: 98, train_loss: 0.5139, test_loss: 1.1871, test_f1: 0.6464
 epoch: 99, train_loss: 0.5077, test_loss: 1.2010, test_f1: 0.6294
##################ITERATION #7 ****************************************
 epoch: 0, train_loss: 1.4772, test_loss: 1.2781, test_f1: 0.2087
 epoch: 1, train_loss: 1.1889, test_loss: 1.2020, test_f1: 0.4088
 epoch: 2, train_loss: 1.1049, test_loss: 1.1593, test_f1: 0.4903
 epoch: 3, train_loss: 1.0745, test_loss: 1.1050, test_f1: 0.4939
 epoch: 4, train_loss: 1.0393, test_loss: 1.1284, test_f1: 0.5025
 epoch: 5, train_loss: 1.0290, test_loss: 1.0913, test_f1: 0.5503
 epoch: 6, train_loss: 1.0039, test_loss: 1.0818, test_f1: 0.5184
 epoch: 7, train_loss: 0.9704, test_loss: 1.0649, test_f1: 0.5208
 epoch: 8, train_loss: 0.9673, test_loss: 1.0790, test_f1: 0.5166
 epoch: 9, train_loss: 0.9464, test_loss: 1.0588, test_f1: 0.5449
 epoch: 10, train_loss: 0.9252, test_loss: 1.0786, test_f1: 0.5417
 epoch: 11, train_loss: 0.9267, test_loss: 1.0468, test_f1: 0.5400
 epoch: 12, train_loss: 0.9036, test_loss: 1.0588, test_f1: 0.5611
 epoch: 13, train_loss: 0.8839, test_loss: 1.0471, test_f1: 0.5468
 epoch: 14, train_loss: 0.8714, test_loss: 1.0799, test_f1: 0.5774
 epoch: 15, train_loss: 0.8895, test_loss: 1.0826, test_f1: 0.5589
 epoch: 16, train_loss: 0.8672, test_loss: 1.0446, test_f1: 0.5676
 epoch: 17, train_loss: 0.8506, test_loss: 1.0746, test_f1: 0.5477
 epoch: 18, train_loss: 0.8449, test_loss: 1.0646, test_f1: 0.5649
 epoch: 19, train_loss: 0.8290, test_loss: 1.0721, test_f1: 0.5896
 epoch: 20, train_loss: 0.8270, test_loss: 1.0443, test_f1: 0.5897
 epoch: 21, train_loss: 0.7977, test_loss: 1.0955, test_f1: 0.5733
 epoch: 22, train_loss: 0.8243, test_loss: 1.0458, test_f1: 0.5666
 epoch: 23, train_loss: 0.7950, test_loss: 1.0620, test_f1: 0.5949
 epoch: 24, train_loss: 0.7968, test_loss: 1.1053, test_f1: 0.5822
 epoch: 25, train_loss: 0.7796, test_loss: 1.0679, test_f1: 0.5710
 epoch: 26, train_loss: 0.7761, test_loss: 1.1666, test_f1: 0.5728
 epoch: 27, train_loss: 0.7658, test_loss: 1.0878, test_f1: 0.6049
 epoch: 28, train_loss: 0.7729, test_loss: 1.1215, test_f1: 0.6010
 epoch: 29, train_loss: 0.7499, test_loss: 1.0732, test_f1: 0.6158
 epoch: 30, train_loss: 0.7468, test_loss: 1.0699, test_f1: 0.5538
 epoch: 31, train_loss: 0.7553, test_loss: 1.1802, test_f1: 0.5900
 epoch: 32, train_loss: 0.7391, test_loss: 1.4294, test_f1: 0.5645
 epoch: 33, train_loss: 0.7217, test_loss: 1.1601, test_f1: 0.5887
 epoch: 34, train_loss: 0.7258, test_loss: 1.1253, test_f1: 0.5977
 epoch: 35, train_loss: 0.7448, test_loss: 1.1688, test_f1: 0.6127
 epoch: 36, train_loss: 0.7202, test_loss: 1.1039, test_f1: 0.6101
 epoch: 37, train_loss: 0.6777, test_loss: 1.1111, test_f1: 0.6258
 epoch: 38, train_loss: 0.6978, test_loss: 1.1648, test_f1: 0.6314
 epoch: 39, train_loss: 0.6933, test_loss: 1.2828, test_f1: 0.5914
 epoch: 40, train_loss: 0.6999, test_loss: 1.1526, test_f1: 0.6005
 epoch: 41, train_loss: 0.7004, test_loss: 1.2658, test_f1: 0.5525
 epoch: 42, train_loss: 0.7091, test_loss: 1.2858, test_f1: 0.6220
 epoch: 43, train_loss: 0.6880, test_loss: 1.2717, test_f1: 0.5700
 epoch: 44, train_loss: 0.6714, test_loss: 1.1200, test_f1: 0.5926
 epoch: 45, train_loss: 0.6838, test_loss: 1.1910, test_f1: 0.6225
 epoch: 46, train_loss: 0.6521, test_loss: 1.1127, test_f1: 0.6204
 epoch: 47, train_loss: 0.6458, test_loss: 1.2782, test_f1: 0.6194
 epoch: 48, train_loss: 0.6424, test_loss: 1.1573, test_f1: 0.5637
 epoch: 49, train_loss: 0.6406, test_loss: 1.2019, test_f1: 0.6287
 epoch: 50, train_loss: 0.6376, test_loss: 1.2429, test_f1: 0.5975
 epoch: 51, train_loss: 0.6372, test_loss: 1.1552, test_f1: 0.6334
 epoch: 52, train_loss: 0.5969, test_loss: 1.1517, test_f1: 0.6392
 epoch: 53, train_loss: 0.5939, test_loss: 1.1650, test_f1: 0.6400
 epoch: 54, train_loss: 0.6140, test_loss: 1.1743, test_f1: 0.6376
 epoch: 55, train_loss: 0.5963, test_loss: 1.2620, test_f1: 0.6397
 epoch: 56, train_loss: 0.5973, test_loss: 1.2411, test_f1: 0.6428
 epoch: 57, train_loss: 0.6114, test_loss: 1.2770, test_f1: 0.6244
 epoch: 58, train_loss: 0.6164, test_loss: 1.2476, test_f1: 0.6056
 epoch: 59, train_loss: 0.5857, test_loss: 1.2651, test_f1: 0.6238
 epoch: 60, train_loss: 0.5780, test_loss: 1.3538, test_f1: 0.6169
 epoch: 61, train_loss: 0.5847, test_loss: 1.3010, test_f1: 0.6365
 epoch: 62, train_loss: 0.5679, test_loss: 1.3686, test_f1: 0.6196
 epoch: 63, train_loss: 0.5709, test_loss: 1.3644, test_f1: 0.6352
 epoch: 64, train_loss: 0.5754, test_loss: 1.3886, test_f1: 0.6169
 epoch: 65, train_loss: 0.5559, test_loss: 1.3616, test_f1: 0.6116
 epoch: 66, train_loss: 0.5654, test_loss: 1.3133, test_f1: 0.6157
 epoch: 67, train_loss: 0.5820, test_loss: 1.3487, test_f1: 0.6300
 epoch: 68, train_loss: 0.5617, test_loss: 1.3389, test_f1: 0.6034
 epoch: 69, train_loss: 0.5465, test_loss: 1.3703, test_f1: 0.6239
 epoch: 70, train_loss: 0.5505, test_loss: 1.3753, test_f1: 0.6283
 epoch: 71, train_loss: 0.5447, test_loss: 1.4541, test_f1: 0.6122
 epoch: 72, train_loss: 0.5333, test_loss: 1.4180, test_f1: 0.6058
 epoch: 73, train_loss: 0.5466, test_loss: 1.4182, test_f1: 0.6188
 epoch: 74, train_loss: 0.5302, test_loss: 1.3950, test_f1: 0.6262
 epoch: 75, train_loss: 0.5417, test_loss: 1.5331, test_f1: 0.6028
 epoch: 76, train_loss: 0.5396, test_loss: 1.4347, test_f1: 0.6026
 epoch: 77, train_loss: 0.5344, test_loss: 1.4482, test_f1: 0.6238
 epoch: 78, train_loss: 0.5438, test_loss: 1.5070, test_f1: 0.6350
 epoch: 79, train_loss: 0.5202, test_loss: 1.5313, test_f1: 0.6136
 epoch: 80, train_loss: 0.5335, test_loss: 1.4325, test_f1: 0.6212
 epoch: 81, train_loss: 0.5095, test_loss: 1.4262, test_f1: 0.6042
 epoch: 82, train_loss: 0.5657, test_loss: 1.4636, test_f1: 0.6201
 epoch: 83, train_loss: 0.5195, test_loss: 1.5082, test_f1: 0.6223
 epoch: 84, train_loss: 0.5378, test_loss: 1.4688, test_f1: 0.6150
 epoch: 85, train_loss: 0.5107, test_loss: 1.4562, test_f1: 0.6217
 epoch: 86, train_loss: 0.5066, test_loss: 1.4595, test_f1: 0.5995
 epoch: 87, train_loss: 0.5114, test_loss: 1.4563, test_f1: 0.6361
 epoch: 88, train_loss: 0.5193, test_loss: 1.5656, test_f1: 0.6005
 epoch: 89, train_loss: 0.5224, test_loss: 1.4251, test_f1: 0.6174
 epoch: 90, train_loss: 0.5058, test_loss: 1.4228, test_f1: 0.6253
 epoch: 91, train_loss: 0.5074, test_loss: 1.5203, test_f1: 0.6155
 epoch: 92, train_loss: 0.5112, test_loss: 1.5667, test_f1: 0.5801
 epoch: 93, train_loss: 0.4942, test_loss: 1.5378, test_f1: 0.6434
 epoch: 94, train_loss: 0.5076, test_loss: 1.5612, test_f1: 0.6017
 epoch: 95, train_loss: 0.4986, test_loss: 1.4531, test_f1: 0.6245
 epoch: 96, train_loss: 0.5030, test_loss: 1.5570, test_f1: 0.6240
 epoch: 97, train_loss: 0.4901, test_loss: 1.4721, test_f1: 0.6203
 epoch: 98, train_loss: 0.4844, test_loss: 1.5750, test_f1: 0.5945
 epoch: 99, train_loss: 0.4959, test_loss: 1.6561, test_f1: 0.6028
##################ITERATION #8 ****************************************
 epoch: 0, train_loss: 1.5011, test_loss: 1.3981, test_f1: 0.1365
 epoch: 1, train_loss: 1.1840, test_loss: 1.1702, test_f1: 0.4595
 epoch: 2, train_loss: 1.1104, test_loss: 1.1202, test_f1: 0.5060
 epoch: 3, train_loss: 1.0777, test_loss: 1.0871, test_f1: 0.4999
 epoch: 4, train_loss: 1.0187, test_loss: 1.0655, test_f1: 0.5131
 epoch: 5, train_loss: 1.0002, test_loss: 1.0631, test_f1: 0.5286
 epoch: 6, train_loss: 1.0078, test_loss: 1.0699, test_f1: 0.5374
 epoch: 7, train_loss: 0.9608, test_loss: 1.0701, test_f1: 0.5617
 epoch: 8, train_loss: 0.9505, test_loss: 1.0579, test_f1: 0.5234
 epoch: 9, train_loss: 0.9337, test_loss: 1.0824, test_f1: 0.5243
 epoch: 10, train_loss: 0.9345, test_loss: 1.0670, test_f1: 0.5352
 epoch: 11, train_loss: 0.9141, test_loss: 1.0444, test_f1: 0.5459
 epoch: 12, train_loss: 0.9035, test_loss: 1.0247, test_f1: 0.5373
 epoch: 13, train_loss: 0.8944, test_loss: 1.0264, test_f1: 0.5587
 epoch: 14, train_loss: 0.8878, test_loss: 1.0156, test_f1: 0.5801
 epoch: 15, train_loss: 0.8697, test_loss: 1.0505, test_f1: 0.5291
 epoch: 16, train_loss: 0.8697, test_loss: 1.0509, test_f1: 0.5860
 epoch: 17, train_loss: 0.8476, test_loss: 1.0459, test_f1: 0.5470
 epoch: 18, train_loss: 0.8620, test_loss: 1.0563, test_f1: 0.5591
 epoch: 19, train_loss: 0.8359, test_loss: 1.0791, test_f1: 0.5644
 epoch: 20, train_loss: 0.8486, test_loss: 1.0439, test_f1: 0.5551
 epoch: 21, train_loss: 0.8476, test_loss: 1.0268, test_f1: 0.5904
 epoch: 22, train_loss: 0.8192, test_loss: 1.0911, test_f1: 0.5697
 epoch: 23, train_loss: 0.8103, test_loss: 1.0778, test_f1: 0.5967
 epoch: 24, train_loss: 0.7874, test_loss: 1.0739, test_f1: 0.5670
 epoch: 25, train_loss: 0.7988, test_loss: 1.1452, test_f1: 0.5572
 epoch: 26, train_loss: 0.7799, test_loss: 1.0986, test_f1: 0.6104
 epoch: 27, train_loss: 0.7977, test_loss: 1.0962, test_f1: 0.5827
 epoch: 28, train_loss: 0.7774, test_loss: 1.1220, test_f1: 0.5769
 epoch: 29, train_loss: 0.7635, test_loss: 1.1288, test_f1: 0.6227
 epoch: 30, train_loss: 0.7619, test_loss: 1.0664, test_f1: 0.6133
 epoch: 31, train_loss: 0.7469, test_loss: 1.1107, test_f1: 0.5733
 epoch: 32, train_loss: 0.7303, test_loss: 1.1551, test_f1: 0.5949
 epoch: 33, train_loss: 0.7359, test_loss: 1.2062, test_f1: 0.5803
 epoch: 34, train_loss: 0.7162, test_loss: 1.0488, test_f1: 0.5868
 epoch: 35, train_loss: 0.7042, test_loss: 1.0945, test_f1: 0.6059
 epoch: 36, train_loss: 0.7070, test_loss: 1.1535, test_f1: 0.5895
 epoch: 37, train_loss: 0.6869, test_loss: 1.0519, test_f1: 0.6094
 epoch: 38, train_loss: 0.7139, test_loss: 1.0741, test_f1: 0.6541
 epoch: 39, train_loss: 0.7196, test_loss: 1.1214, test_f1: 0.5922
 epoch: 40, train_loss: 0.6917, test_loss: 1.1300, test_f1: 0.6201
 epoch: 41, train_loss: 0.6946, test_loss: 1.0296, test_f1: 0.6269
 epoch: 42, train_loss: 0.6787, test_loss: 1.1462, test_f1: 0.6315
 epoch: 43, train_loss: 0.6528, test_loss: 1.1424, test_f1: 0.5976
 epoch: 44, train_loss: 0.6573, test_loss: 1.0714, test_f1: 0.6180
 epoch: 45, train_loss: 0.6608, test_loss: 1.1242, test_f1: 0.6251
 epoch: 46, train_loss: 0.6314, test_loss: 1.1965, test_f1: 0.6130
 epoch: 47, train_loss: 0.6329, test_loss: 1.1552, test_f1: 0.6015
 epoch: 48, train_loss: 0.6470, test_loss: 1.2699, test_f1: 0.5807
 epoch: 49, train_loss: 0.6287, test_loss: 1.1750, test_f1: 0.6250
 epoch: 50, train_loss: 0.6248, test_loss: 1.2665, test_f1: 0.6247
 epoch: 51, train_loss: 0.6049, test_loss: 1.1420, test_f1: 0.6252
 epoch: 52, train_loss: 0.5793, test_loss: 1.1577, test_f1: 0.6116
 epoch: 53, train_loss: 0.5958, test_loss: 1.1517, test_f1: 0.6400
 epoch: 54, train_loss: 0.5718, test_loss: 1.1711, test_f1: 0.6392
 epoch: 55, train_loss: 0.5820, test_loss: 1.1563, test_f1: 0.6263
 epoch: 56, train_loss: 0.5694, test_loss: 1.1668, test_f1: 0.6103
 epoch: 57, train_loss: 0.5680, test_loss: 1.2080, test_f1: 0.6122
 epoch: 58, train_loss: 0.5607, test_loss: 1.2599, test_f1: 0.6126
 epoch: 59, train_loss: 0.5503, test_loss: 1.2507, test_f1: 0.6451
 epoch: 60, train_loss: 0.5657, test_loss: 1.2661, test_f1: 0.6198
 epoch: 61, train_loss: 0.5651, test_loss: 1.3492, test_f1: 0.6236
 epoch: 62, train_loss: 0.5506, test_loss: 1.2171, test_f1: 0.6446
 epoch: 63, train_loss: 0.5189, test_loss: 1.3045, test_f1: 0.6027
 epoch: 64, train_loss: 0.5415, test_loss: 1.2306, test_f1: 0.6112
 epoch: 65, train_loss: 0.5469, test_loss: 1.3233, test_f1: 0.6170
 epoch: 66, train_loss: 0.5199, test_loss: 1.2817, test_f1: 0.6243
 epoch: 67, train_loss: 0.5361, test_loss: 1.2561, test_f1: 0.6249
 epoch: 68, train_loss: 0.5157, test_loss: 1.2761, test_f1: 0.6364
 epoch: 69, train_loss: 0.5130, test_loss: 1.3880, test_f1: 0.6015
 epoch: 70, train_loss: 0.5029, test_loss: 1.3099, test_f1: 0.6284
 epoch: 71, train_loss: 0.5149, test_loss: 1.3436, test_f1: 0.6277
 epoch: 72, train_loss: 0.5217, test_loss: 1.2345, test_f1: 0.6282
 epoch: 73, train_loss: 0.5167, test_loss: 1.3657, test_f1: 0.6237
 epoch: 74, train_loss: 0.5130, test_loss: 1.3922, test_f1: 0.5910
 epoch: 75, train_loss: 0.4793, test_loss: 1.2992, test_f1: 0.6105
 epoch: 76, train_loss: 0.5147, test_loss: 1.2884, test_f1: 0.6302
 epoch: 77, train_loss: 0.4755, test_loss: 1.3988, test_f1: 0.6487
 epoch: 78, train_loss: 0.4837, test_loss: 1.4068, test_f1: 0.6278
 epoch: 79, train_loss: 0.4844, test_loss: 1.4487, test_f1: 0.5943
 epoch: 80, train_loss: 0.4910, test_loss: 1.4113, test_f1: 0.5992
 epoch: 81, train_loss: 0.4851, test_loss: 1.2899, test_f1: 0.6123
 epoch: 82, train_loss: 0.4678, test_loss: 1.5216, test_f1: 0.6120
 epoch: 83, train_loss: 0.4706, test_loss: 1.4036, test_f1: 0.6021
 epoch: 84, train_loss: 0.4798, test_loss: 1.4634, test_f1: 0.6057
 epoch: 85, train_loss: 0.4531, test_loss: 1.4671, test_f1: 0.6195
 epoch: 86, train_loss: 0.4534, test_loss: 1.5048, test_f1: 0.6097
 epoch: 87, train_loss: 0.4523, test_loss: 1.5482, test_f1: 0.6334
 epoch: 88, train_loss: 0.4687, test_loss: 1.4699, test_f1: 0.6354
 epoch: 89, train_loss: 0.4517, test_loss: 1.5016, test_f1: 0.6482
 epoch: 90, train_loss: 0.4682, test_loss: 1.4782, test_f1: 0.6403
 epoch: 91, train_loss: 0.4770, test_loss: 1.6530, test_f1: 0.5694
 epoch: 92, train_loss: 0.4548, test_loss: 1.6651, test_f1: 0.6157
 epoch: 93, train_loss: 0.4562, test_loss: 1.5506, test_f1: 0.6038
 epoch: 94, train_loss: 0.4582, test_loss: 1.5781, test_f1: 0.6091
 epoch: 95, train_loss: 0.4525, test_loss: 1.5991, test_f1: 0.6045
 epoch: 96, train_loss: 0.4500, test_loss: 1.6045, test_f1: 0.6197
 epoch: 97, train_loss: 0.4290, test_loss: 1.5370, test_f1: 0.6098
 epoch: 98, train_loss: 0.4145, test_loss: 1.6520, test_f1: 0.6102
 epoch: 99, train_loss: 0.4253, test_loss: 1.5819, test_f1: 0.6082
##################ITERATION #9 ****************************************
 epoch: 0, train_loss: 1.4929, test_loss: 1.4014, test_f1: 0.2046
 epoch: 1, train_loss: 1.1476, test_loss: 1.2270, test_f1: 0.3926
 epoch: 2, train_loss: 1.1387, test_loss: 1.1004, test_f1: 0.4990
 epoch: 3, train_loss: 1.0864, test_loss: 1.0701, test_f1: 0.5008
 epoch: 4, train_loss: 1.0634, test_loss: 1.0788, test_f1: 0.5354
 epoch: 5, train_loss: 1.0171, test_loss: 1.0585, test_f1: 0.5666
 epoch: 6, train_loss: 1.0232, test_loss: 1.0301, test_f1: 0.5897
 epoch: 7, train_loss: 0.9783, test_loss: 1.0468, test_f1: 0.5545
 epoch: 8, train_loss: 0.9663, test_loss: 1.0811, test_f1: 0.5747
 epoch: 9, train_loss: 0.9263, test_loss: 1.0407, test_f1: 0.5809
 epoch: 10, train_loss: 0.9489, test_loss: 1.0418, test_f1: 0.5810
 epoch: 11, train_loss: 0.9342, test_loss: 1.0035, test_f1: 0.5818
 epoch: 12, train_loss: 0.9168, test_loss: 1.0409, test_f1: 0.6015
 epoch: 13, train_loss: 0.9148, test_loss: 0.9937, test_f1: 0.5824
 epoch: 14, train_loss: 0.8899, test_loss: 1.0291, test_f1: 0.6051
 epoch: 15, train_loss: 0.8828, test_loss: 1.0363, test_f1: 0.5331
 epoch: 16, train_loss: 0.8904, test_loss: 1.0534, test_f1: 0.5846
 epoch: 17, train_loss: 0.8774, test_loss: 1.0464, test_f1: 0.5939
 epoch: 18, train_loss: 0.8629, test_loss: 0.9954, test_f1: 0.5944
 epoch: 19, train_loss: 0.8544, test_loss: 1.0596, test_f1: 0.5861
 epoch: 20, train_loss: 0.8537, test_loss: 1.0242, test_f1: 0.5812
 epoch: 21, train_loss: 0.8453, test_loss: 1.0756, test_f1: 0.6121
 epoch: 22, train_loss: 0.8295, test_loss: 1.0448, test_f1: 0.5629
 epoch: 23, train_loss: 0.8293, test_loss: 1.0455, test_f1: 0.5700
 epoch: 24, train_loss: 0.8225, test_loss: 1.0230, test_f1: 0.6043
 epoch: 25, train_loss: 0.8195, test_loss: 1.0027, test_f1: 0.6252
 epoch: 26, train_loss: 0.8110, test_loss: 1.0025, test_f1: 0.6112
 epoch: 27, train_loss: 0.8038, test_loss: 1.0570, test_f1: 0.6237
 epoch: 28, train_loss: 0.8108, test_loss: 1.0090, test_f1: 0.6201
 epoch: 29, train_loss: 0.8090, test_loss: 1.0251, test_f1: 0.5679
 epoch: 30, train_loss: 0.8041, test_loss: 1.0099, test_f1: 0.6166
 epoch: 31, train_loss: 0.8005, test_loss: 1.0237, test_f1: 0.5905
 epoch: 32, train_loss: 0.7776, test_loss: 0.9566, test_f1: 0.6167
 epoch: 33, train_loss: 0.7764, test_loss: 0.9735, test_f1: 0.6281
 epoch: 34, train_loss: 0.7746, test_loss: 1.0432, test_f1: 0.6072
 epoch: 35, train_loss: 0.7808, test_loss: 0.9809, test_f1: 0.6206
 epoch: 36, train_loss: 0.7740, test_loss: 1.0054, test_f1: 0.6178
 epoch: 37, train_loss: 0.7435, test_loss: 1.0347, test_f1: 0.5760
 epoch: 38, train_loss: 0.7514, test_loss: 1.0039, test_f1: 0.5957
 epoch: 39, train_loss: 0.7684, test_loss: 1.0415, test_f1: 0.6118
 epoch: 40, train_loss: 0.7422, test_loss: 1.0924, test_f1: 0.6102
 epoch: 41, train_loss: 0.7483, test_loss: 1.0484, test_f1: 0.5920
 epoch: 42, train_loss: 0.7454, test_loss: 1.0211, test_f1: 0.5741
 epoch: 43, train_loss: 0.7404, test_loss: 1.0233, test_f1: 0.6187
 epoch: 44, train_loss: 0.7261, test_loss: 1.0381, test_f1: 0.6178
 epoch: 45, train_loss: 0.7264, test_loss: 1.0784, test_f1: 0.6331
 epoch: 46, train_loss: 0.7021, test_loss: 1.1265, test_f1: 0.6048
 epoch: 47, train_loss: 0.6974, test_loss: 1.1097, test_f1: 0.6016
 epoch: 48, train_loss: 0.7078, test_loss: 1.0172, test_f1: 0.6414
 epoch: 49, train_loss: 0.7160, test_loss: 1.0718, test_f1: 0.6311
 epoch: 50, train_loss: 0.6956, test_loss: 1.0500, test_f1: 0.6221
 epoch: 51, train_loss: 0.6736, test_loss: 1.0256, test_f1: 0.6426
 epoch: 52, train_loss: 0.6663, test_loss: 1.0354, test_f1: 0.6172
 epoch: 53, train_loss: 0.6596, test_loss: 1.0359, test_f1: 0.6505
 epoch: 54, train_loss: 0.6577, test_loss: 1.0703, test_f1: 0.6380
 epoch: 55, train_loss: 0.6344, test_loss: 1.0576, test_f1: 0.6076
 epoch: 56, train_loss: 0.6468, test_loss: 1.0347, test_f1: 0.6061
 epoch: 57, train_loss: 0.6294, test_loss: 1.0458, test_f1: 0.5981
 epoch: 58, train_loss: 0.6428, test_loss: 1.0494, test_f1: 0.6052
 epoch: 59, train_loss: 0.6309, test_loss: 1.0452, test_f1: 0.6437
 epoch: 60, train_loss: 0.6091, test_loss: 1.0284, test_f1: 0.6581
 epoch: 61, train_loss: 0.6297, test_loss: 1.0031, test_f1: 0.6701
 epoch: 62, train_loss: 0.6042, test_loss: 1.0102, test_f1: 0.6512
 epoch: 63, train_loss: 0.6124, test_loss: 1.0758, test_f1: 0.6361
 epoch: 64, train_loss: 0.6142, test_loss: 1.0523, test_f1: 0.6348
 epoch: 65, train_loss: 0.5945, test_loss: 1.0810, test_f1: 0.6291
 epoch: 66, train_loss: 0.5779, test_loss: 1.0787, test_f1: 0.6246
 epoch: 67, train_loss: 0.5938, test_loss: 1.0312, test_f1: 0.6368
 epoch: 68, train_loss: 0.6066, test_loss: 1.0430, test_f1: 0.6335
 epoch: 69, train_loss: 0.5859, test_loss: 1.1263, test_f1: 0.6090
 epoch: 70, train_loss: 0.5766, test_loss: 1.0633, test_f1: 0.6425
 epoch: 71, train_loss: 0.5831, test_loss: 1.1027, test_f1: 0.6070
 epoch: 72, train_loss: 0.5878, test_loss: 1.1291, test_f1: 0.5998
 epoch: 73, train_loss: 0.5924, test_loss: 1.1026, test_f1: 0.6125
 epoch: 74, train_loss: 0.5653, test_loss: 1.0874, test_f1: 0.6223
 epoch: 75, train_loss: 0.5773, test_loss: 1.0911, test_f1: 0.6048
 epoch: 76, train_loss: 0.5745, test_loss: 1.1518, test_f1: 0.6125
 epoch: 77, train_loss: 0.5630, test_loss: 1.1134, test_f1: 0.6169
 epoch: 78, train_loss: 0.5670, test_loss: 1.1505, test_f1: 0.6327
 epoch: 79, train_loss: 0.5635, test_loss: 1.1157, test_f1: 0.6367
 epoch: 80, train_loss: 0.5627, test_loss: 1.1180, test_f1: 0.6154
 epoch: 81, train_loss: 0.5612, test_loss: 1.1078, test_f1: 0.6361
 epoch: 82, train_loss: 0.5922, test_loss: 1.1373, test_f1: 0.6524
 epoch: 83, train_loss: 0.5644, test_loss: 1.1574, test_f1: 0.5975
 epoch: 84, train_loss: 0.5544, test_loss: 1.1977, test_f1: 0.6337
 epoch: 85, train_loss: 0.5540, test_loss: 1.1703, test_f1: 0.6139
 epoch: 86, train_loss: 0.5500, test_loss: 1.2060, test_f1: 0.6029
 epoch: 87, train_loss: 0.5180, test_loss: 1.1511, test_f1: 0.6273
 epoch: 88, train_loss: 0.5202, test_loss: 1.1662, test_f1: 0.6051
 epoch: 89, train_loss: 0.5308, test_loss: 1.1367, test_f1: 0.6248
 epoch: 90, train_loss: 0.5320, test_loss: 1.2462, test_f1: 0.6211
 epoch: 91, train_loss: 0.5303, test_loss: 1.1406, test_f1: 0.6206
 epoch: 92, train_loss: 0.5182, test_loss: 1.2536, test_f1: 0.6124
 epoch: 93, train_loss: 0.5268, test_loss: 1.2128, test_f1: 0.6226
 epoch: 94, train_loss: 0.5089, test_loss: 1.2647, test_f1: 0.6098
 epoch: 95, train_loss: 0.5073, test_loss: 1.2158, test_f1: 0.6417
 epoch: 96, train_loss: 0.4980, test_loss: 1.2748, test_f1: 0.5953
 epoch: 97, train_loss: 0.5070, test_loss: 1.3024, test_f1: 0.6200
 epoch: 98, train_loss: 0.4862, test_loss: 1.3057, test_f1: 0.6146
 epoch: 99, train_loss: 0.5077, test_loss: 1.2439, test_f1: 0.6171

Training completed in 406.50 seconds
Best F1: 0.6701 at epoch 61
Mean F1 across iterations: 0.6440  0.0134
========================FINAL RESULTS================================
FEGIN weighted F1: 0.6701  0.0134
python main.py --data ltspice_demos --representation component_net --model FEGIN --layers 3 --hiddens 32 --batch_size 64 --lr 0.001 --emb_size 128 --epochs 100 --save_appendix component_net_L3_H32_BS64_LR0.001_E128 --no_val
-----



STDERR:
  File "main.py", line 370, in <module>
    main()
  File "main.py", line 254, in main
    dataset = dataset_class(
  File "/home/philip/projects/ltspice_examples_code_repo/Circuit-Completion-Using-GNNs/component_classification_with_link_prediction_head/evaluation/FEGIN/kernel/circuit_datasets.py", line 15, in __init__
    self.data, self.slices = torch.load(self.processed_paths[0])
  File "/home/philip/.local/lib/python3.8/site-packages/torch/serialization.py", line 1040, in load
    warnings.warn(
  File "/usr/lib/python3.8/warnings.py", line 109, in _showwarnmsg
    sw(msg.message, msg.category, msg.filename, msg.lineno,
  File "main.py", line 47, in warn_with_traceback
    traceback.print_stack(file=log)
/home/philip/projects/ltspice_examples_code_repo/Circuit-Completion-Using-GNNs/component_classification_with_link_prediction_head/evaluation/FEGIN/kernel/circuit_datasets.py:15: FutureWarning: You are using `torch.load` with `weights_only=False` (the current default value), which uses the default pickle module implicitly. It is possible to construct malicious pickle data which will execute arbitrary code during unpickling (See https://github.com/pytorch/pytorch/blob/main/SECURITY.md#untrusted-models for more details). In a future release, the default value for `weights_only` will be flipped to `True`. This limits the functions that could be executed during unpickling. Arbitrary objects will no longer be allowed to be loaded via this mode unless they are explicitly allowlisted by the user via `torch.serialization.add_safe_globals`. We recommend you start setting `weights_only=True` for any use case where you don't have full control of the loaded file. Please open an issue on GitHub for any issues related to this experimental feature.
  self.data, self.slices = torch.load(self.processed_paths[0])
