STDOUT:
Results will be saved in /home/philip/projects/llm_inference_code_repo/Circuit-Completion-Using-GNNs/component_classification_with_link_prediction_head/evaluation/FEGIN/results/model_FEGIN_dataset_ltspice_examples
Command line input: python main.py --data ltspice_examples --representation component_component --model FEGIN --layers 4 --hiddens 16 --batch_size 256 --lr 0.001 --emb_size 512 --epochs 100 --save_appendix component_component_L4_H16_BS256_LR0.001_E512 --no_val
 is saved.
-----
ltspice_examples - FEGIN
Using 4 layers, 16 hidden units, h = 2
Loading component_component representation dataset
ENTERED
Training FEGIN on component_component representation
Train: 3556, Test: 845
##################ITERATION #0 ****************************************
 epoch: 0, train_loss: 1.3592, test_loss: 1.3598, test_f1: 0.2274
 epoch: 1, train_loss: 1.3416, test_loss: 1.3511, test_f1: 0.2274
 epoch: 2, train_loss: 1.3311, test_loss: 1.3422, test_f1: 0.2274
 epoch: 3, train_loss: 1.3200, test_loss: 1.3308, test_f1: 0.2274
 epoch: 4, train_loss: 1.3071, test_loss: 1.3138, test_f1: 0.2274
 epoch: 5, train_loss: 1.2932, test_loss: 1.2942, test_f1: 0.2274
 epoch: 6, train_loss: 1.2797, test_loss: 1.2771, test_f1: 0.2276
 epoch: 7, train_loss: 1.2628, test_loss: 1.2565, test_f1: 0.2555
 epoch: 8, train_loss: 1.2488, test_loss: 1.2417, test_f1: 0.2449
 epoch: 9, train_loss: 1.2350, test_loss: 1.2196, test_f1: 0.2606
 epoch: 10, train_loss: 1.2276, test_loss: 1.2071, test_f1: 0.2589
 epoch: 11, train_loss: 1.2143, test_loss: 1.2075, test_f1: 0.2457
 epoch: 12, train_loss: 1.2079, test_loss: 1.1917, test_f1: 0.2844
 epoch: 13, train_loss: 1.1998, test_loss: 1.1860, test_f1: 0.2858
 epoch: 14, train_loss: 1.2024, test_loss: 1.1831, test_f1: 0.3196
 epoch: 15, train_loss: 1.1914, test_loss: 1.1834, test_f1: 0.3251
 epoch: 16, train_loss: 1.1880, test_loss: 1.1901, test_f1: 0.3191
 epoch: 17, train_loss: 1.1749, test_loss: 1.1850, test_f1: 0.3441
 epoch: 18, train_loss: 1.1778, test_loss: 1.1805, test_f1: 0.3430
 epoch: 19, train_loss: 1.1697, test_loss: 1.1639, test_f1: 0.3567
 epoch: 20, train_loss: 1.1587, test_loss: 1.1631, test_f1: 0.3687
 epoch: 21, train_loss: 1.1617, test_loss: 1.1709, test_f1: 0.4061
 epoch: 22, train_loss: 1.1516, test_loss: 1.1640, test_f1: 0.4149
 epoch: 23, train_loss: 1.1471, test_loss: 1.1505, test_f1: 0.4160
 epoch: 24, train_loss: 1.1436, test_loss: 1.1508, test_f1: 0.4267
 epoch: 25, train_loss: 1.1363, test_loss: 1.1530, test_f1: 0.4397
 epoch: 26, train_loss: 1.1351, test_loss: 1.1337, test_f1: 0.4371
 epoch: 27, train_loss: 1.1308, test_loss: 1.1505, test_f1: 0.4331
 epoch: 28, train_loss: 1.1237, test_loss: 1.1398, test_f1: 0.4389
 epoch: 29, train_loss: 1.1199, test_loss: 1.1369, test_f1: 0.4436
 epoch: 30, train_loss: 1.1217, test_loss: 1.1332, test_f1: 0.4515
 epoch: 31, train_loss: 1.1099, test_loss: 1.1431, test_f1: 0.4351
 epoch: 32, train_loss: 1.1065, test_loss: 1.1312, test_f1: 0.4416
 epoch: 33, train_loss: 1.1047, test_loss: 1.1260, test_f1: 0.4413
 epoch: 34, train_loss: 1.0981, test_loss: 1.1227, test_f1: 0.4403
 epoch: 35, train_loss: 1.0945, test_loss: 1.1224, test_f1: 0.4513
 epoch: 36, train_loss: 1.0930, test_loss: 1.1093, test_f1: 0.4601
 epoch: 37, train_loss: 1.0963, test_loss: 1.1088, test_f1: 0.4449
 epoch: 38, train_loss: 1.0794, test_loss: 1.1075, test_f1: 0.4574
 epoch: 39, train_loss: 1.0737, test_loss: 1.1028, test_f1: 0.4535
 epoch: 40, train_loss: 1.0714, test_loss: 1.1255, test_f1: 0.4352
 epoch: 41, train_loss: 1.0716, test_loss: 1.0936, test_f1: 0.4581
 epoch: 42, train_loss: 1.0707, test_loss: 1.1120, test_f1: 0.4533
 epoch: 43, train_loss: 1.0602, test_loss: 1.0954, test_f1: 0.4546
 epoch: 44, train_loss: 1.0505, test_loss: 1.1032, test_f1: 0.4632
 epoch: 45, train_loss: 1.0549, test_loss: 1.1136, test_f1: 0.4540
 epoch: 46, train_loss: 1.0484, test_loss: 1.0962, test_f1: 0.4699
 epoch: 47, train_loss: 1.0457, test_loss: 1.1001, test_f1: 0.4565
 epoch: 48, train_loss: 1.0533, test_loss: 1.0879, test_f1: 0.4592
 epoch: 49, train_loss: 1.0338, test_loss: 1.0872, test_f1: 0.4675
 epoch: 50, train_loss: 1.0379, test_loss: 1.0825, test_f1: 0.4565
 epoch: 51, train_loss: 1.0247, test_loss: 1.0927, test_f1: 0.4564
 epoch: 52, train_loss: 1.0082, test_loss: 1.0777, test_f1: 0.4630
 epoch: 53, train_loss: 1.0202, test_loss: 1.0956, test_f1: 0.4732
 epoch: 54, train_loss: 1.0146, test_loss: 1.0910, test_f1: 0.4676
 epoch: 55, train_loss: 1.0151, test_loss: 1.0947, test_f1: 0.4654
 epoch: 56, train_loss: 1.0013, test_loss: 1.0889, test_f1: 0.4699
 epoch: 57, train_loss: 1.0139, test_loss: 1.0830, test_f1: 0.4735
 epoch: 58, train_loss: 1.0019, test_loss: 1.0973, test_f1: 0.4773
 epoch: 59, train_loss: 1.0019, test_loss: 1.1066, test_f1: 0.4719
 epoch: 60, train_loss: 1.0051, test_loss: 1.0948, test_f1: 0.4752
 epoch: 61, train_loss: 0.9962, test_loss: 1.0878, test_f1: 0.4823
 epoch: 62, train_loss: 0.9933, test_loss: 1.0996, test_f1: 0.4637
 epoch: 63, train_loss: 0.9962, test_loss: 1.0920, test_f1: 0.4787
 epoch: 64, train_loss: 0.9878, test_loss: 1.1028, test_f1: 0.4676
 epoch: 65, train_loss: 0.9857, test_loss: 1.0831, test_f1: 0.4811
 epoch: 66, train_loss: 1.0016, test_loss: 1.0996, test_f1: 0.4941
 epoch: 67, train_loss: 0.9869, test_loss: 1.0940, test_f1: 0.4883
 epoch: 68, train_loss: 0.9879, test_loss: 1.1032, test_f1: 0.4795
 epoch: 69, train_loss: 0.9895, test_loss: 1.0752, test_f1: 0.4775
 epoch: 70, train_loss: 0.9891, test_loss: 1.1107, test_f1: 0.4651
 epoch: 71, train_loss: 0.9812, test_loss: 1.1011, test_f1: 0.4903
 epoch: 72, train_loss: 0.9609, test_loss: 1.0961, test_f1: 0.4934
 epoch: 73, train_loss: 0.9752, test_loss: 1.1017, test_f1: 0.4766
 epoch: 74, train_loss: 0.9796, test_loss: 1.1038, test_f1: 0.4732
 epoch: 75, train_loss: 0.9729, test_loss: 1.0945, test_f1: 0.4800
 epoch: 76, train_loss: 0.9614, test_loss: 1.0909, test_f1: 0.4869
 epoch: 77, train_loss: 0.9609, test_loss: 1.1041, test_f1: 0.4747
 epoch: 78, train_loss: 0.9671, test_loss: 1.1028, test_f1: 0.4831
 epoch: 79, train_loss: 0.9559, test_loss: 1.1007, test_f1: 0.4890
 epoch: 80, train_loss: 0.9511, test_loss: 1.1071, test_f1: 0.4946
 epoch: 81, train_loss: 0.9532, test_loss: 1.1128, test_f1: 0.4907
 epoch: 82, train_loss: 0.9663, test_loss: 1.1059, test_f1: 0.4933
 epoch: 83, train_loss: 0.9464, test_loss: 1.1094, test_f1: 0.4885
 epoch: 84, train_loss: 0.9565, test_loss: 1.0903, test_f1: 0.4981
 epoch: 85, train_loss: 0.9414, test_loss: 1.1033, test_f1: 0.4776
 epoch: 86, train_loss: 0.9451, test_loss: 1.1105, test_f1: 0.4959
 epoch: 87, train_loss: 0.9507, test_loss: 1.1254, test_f1: 0.4862
 epoch: 88, train_loss: 0.9425, test_loss: 1.1119, test_f1: 0.4942
 epoch: 89, train_loss: 0.9381, test_loss: 1.1106, test_f1: 0.4723
 epoch: 90, train_loss: 0.9488, test_loss: 1.1069, test_f1: 0.4733
 epoch: 91, train_loss: 0.9403, test_loss: 1.1091, test_f1: 0.4895
 epoch: 92, train_loss: 0.9441, test_loss: 1.1223, test_f1: 0.4816
 epoch: 93, train_loss: 0.9422, test_loss: 1.0954, test_f1: 0.4825
 epoch: 94, train_loss: 0.9378, test_loss: 1.1186, test_f1: 0.4787
 epoch: 95, train_loss: 0.9393, test_loss: 1.1185, test_f1: 0.4805
 epoch: 96, train_loss: 0.9468, test_loss: 1.1005, test_f1: 0.4880
 epoch: 97, train_loss: 0.9418, test_loss: 1.1345, test_f1: 0.4836
 epoch: 98, train_loss: 0.9367, test_loss: 1.0760, test_f1: 0.4811
 epoch: 99, train_loss: 0.9404, test_loss: 1.1228, test_f1: 0.4832
##################ITERATION #1 ****************************************
 epoch: 0, train_loss: 1.3270, test_loss: 1.3318, test_f1: 0.2274
 epoch: 1, train_loss: 1.2854, test_loss: 1.3094, test_f1: 0.2274
 epoch: 2, train_loss: 1.2592, test_loss: 1.2727, test_f1: 0.2274
 epoch: 3, train_loss: 1.2406, test_loss: 1.2315, test_f1: 0.2555
 epoch: 4, train_loss: 1.2240, test_loss: 1.1963, test_f1: 0.3164
 epoch: 5, train_loss: 1.2056, test_loss: 1.1682, test_f1: 0.3504
 epoch: 6, train_loss: 1.1847, test_loss: 1.1468, test_f1: 0.3670
 epoch: 7, train_loss: 1.1665, test_loss: 1.1243, test_f1: 0.3713
 epoch: 8, train_loss: 1.1543, test_loss: 1.1151, test_f1: 0.3610
 epoch: 9, train_loss: 1.1402, test_loss: 1.1024, test_f1: 0.3755
 epoch: 10, train_loss: 1.1437, test_loss: 1.0898, test_f1: 0.4149
 epoch: 11, train_loss: 1.1301, test_loss: 1.0786, test_f1: 0.4328
 epoch: 12, train_loss: 1.1100, test_loss: 1.0623, test_f1: 0.4489
 epoch: 13, train_loss: 1.1131, test_loss: 1.0610, test_f1: 0.4506
 epoch: 14, train_loss: 1.1011, test_loss: 1.0466, test_f1: 0.4765
 epoch: 15, train_loss: 1.0920, test_loss: 1.0611, test_f1: 0.4464
 epoch: 16, train_loss: 1.0834, test_loss: 1.0438, test_f1: 0.4689
 epoch: 17, train_loss: 1.0749, test_loss: 1.0404, test_f1: 0.4666
 epoch: 18, train_loss: 1.0672, test_loss: 1.0545, test_f1: 0.4477
 epoch: 19, train_loss: 1.0556, test_loss: 1.0334, test_f1: 0.4731
 epoch: 20, train_loss: 1.0515, test_loss: 1.0247, test_f1: 0.4656
 epoch: 21, train_loss: 1.0404, test_loss: 1.0227, test_f1: 0.4502
 epoch: 22, train_loss: 1.0315, test_loss: 1.0302, test_f1: 0.4708
 epoch: 23, train_loss: 1.0267, test_loss: 1.0235, test_f1: 0.4619
 epoch: 24, train_loss: 1.0218, test_loss: 1.0088, test_f1: 0.4575
 epoch: 25, train_loss: 1.0191, test_loss: 1.0106, test_f1: 0.4716
 epoch: 26, train_loss: 1.0139, test_loss: 0.9854, test_f1: 0.4655
 epoch: 27, train_loss: 1.0092, test_loss: 1.0015, test_f1: 0.4546
 epoch: 28, train_loss: 1.0024, test_loss: 0.9991, test_f1: 0.4674
 epoch: 29, train_loss: 0.9909, test_loss: 0.9994, test_f1: 0.4628
 epoch: 30, train_loss: 0.9833, test_loss: 0.9666, test_f1: 0.5097
 epoch: 31, train_loss: 0.9871, test_loss: 0.9937, test_f1: 0.4966
 epoch: 32, train_loss: 0.9826, test_loss: 0.9855, test_f1: 0.4711
 epoch: 33, train_loss: 0.9717, test_loss: 0.9817, test_f1: 0.4700
 epoch: 34, train_loss: 0.9738, test_loss: 0.9609, test_f1: 0.4946
 epoch: 35, train_loss: 0.9614, test_loss: 0.9764, test_f1: 0.4809
 epoch: 36, train_loss: 0.9561, test_loss: 0.9906, test_f1: 0.4839
 epoch: 37, train_loss: 0.9578, test_loss: 0.9797, test_f1: 0.4873
 epoch: 38, train_loss: 0.9458, test_loss: 0.9646, test_f1: 0.4925
 epoch: 39, train_loss: 0.9497, test_loss: 1.0427, test_f1: 0.4528
 epoch: 40, train_loss: 0.9387, test_loss: 0.9873, test_f1: 0.4819
 epoch: 41, train_loss: 0.9343, test_loss: 0.9594, test_f1: 0.5038
 epoch: 42, train_loss: 0.9311, test_loss: 0.9846, test_f1: 0.4707
 epoch: 43, train_loss: 0.9286, test_loss: 0.9644, test_f1: 0.4825
 epoch: 44, train_loss: 0.9145, test_loss: 0.9697, test_f1: 0.4859
 epoch: 45, train_loss: 0.9247, test_loss: 0.9750, test_f1: 0.4780
 epoch: 46, train_loss: 0.9138, test_loss: 0.9967, test_f1: 0.4835
 epoch: 47, train_loss: 0.9104, test_loss: 0.9689, test_f1: 0.4789
 epoch: 48, train_loss: 0.9153, test_loss: 1.0012, test_f1: 0.4624
 epoch: 49, train_loss: 0.9005, test_loss: 0.9505, test_f1: 0.4862
 epoch: 50, train_loss: 0.8873, test_loss: 1.0040, test_f1: 0.4599
 epoch: 51, train_loss: 0.8813, test_loss: 1.0088, test_f1: 0.4643
 epoch: 52, train_loss: 0.8947, test_loss: 1.0127, test_f1: 0.4917
 epoch: 53, train_loss: 0.8928, test_loss: 1.0090, test_f1: 0.4745
 epoch: 54, train_loss: 0.8734, test_loss: 0.9747, test_f1: 0.4873
 epoch: 55, train_loss: 0.8844, test_loss: 0.9875, test_f1: 0.4762
 epoch: 56, train_loss: 0.8738, test_loss: 1.0006, test_f1: 0.4768
 epoch: 57, train_loss: 0.8739, test_loss: 0.9843, test_f1: 0.4869
 epoch: 58, train_loss: 0.8752, test_loss: 0.9998, test_f1: 0.4714
 epoch: 59, train_loss: 0.8795, test_loss: 1.0389, test_f1: 0.4713
 epoch: 60, train_loss: 0.8732, test_loss: 0.9985, test_f1: 0.4748
 epoch: 61, train_loss: 0.8686, test_loss: 1.0114, test_f1: 0.4595
 epoch: 62, train_loss: 0.8760, test_loss: 1.0222, test_f1: 0.4711
 epoch: 63, train_loss: 0.8709, test_loss: 1.0457, test_f1: 0.4610
 epoch: 64, train_loss: 0.8654, test_loss: 1.0022, test_f1: 0.4664
 epoch: 65, train_loss: 0.8616, test_loss: 1.0351, test_f1: 0.4607
 epoch: 66, train_loss: 0.8579, test_loss: 1.0331, test_f1: 0.4665
 epoch: 67, train_loss: 0.8647, test_loss: 1.0062, test_f1: 0.4810
 epoch: 68, train_loss: 0.8548, test_loss: 1.0654, test_f1: 0.4564
 epoch: 69, train_loss: 0.8556, test_loss: 1.0339, test_f1: 0.4724
 epoch: 70, train_loss: 0.8590, test_loss: 1.0475, test_f1: 0.4574
 epoch: 71, train_loss: 0.8578, test_loss: 1.0546, test_f1: 0.4800
 epoch: 72, train_loss: 0.8565, test_loss: 1.0560, test_f1: 0.4802
 epoch: 73, train_loss: 0.8578, test_loss: 1.0601, test_f1: 0.4683
 epoch: 74, train_loss: 0.8507, test_loss: 1.0372, test_f1: 0.4778
 epoch: 75, train_loss: 0.8590, test_loss: 1.0430, test_f1: 0.4806
 epoch: 76, train_loss: 0.8517, test_loss: 1.0432, test_f1: 0.4827
 epoch: 77, train_loss: 0.8365, test_loss: 1.0692, test_f1: 0.4763
 epoch: 78, train_loss: 0.8346, test_loss: 1.0613, test_f1: 0.4791
 epoch: 79, train_loss: 0.8440, test_loss: 1.0354, test_f1: 0.4786
 epoch: 80, train_loss: 0.8371, test_loss: 1.0697, test_f1: 0.4811
 epoch: 81, train_loss: 0.8348, test_loss: 1.0857, test_f1: 0.4783
 epoch: 82, train_loss: 0.8402, test_loss: 1.0674, test_f1: 0.4860
 epoch: 83, train_loss: 0.8328, test_loss: 1.1011, test_f1: 0.4720
 epoch: 84, train_loss: 0.8319, test_loss: 1.0927, test_f1: 0.4700
 epoch: 85, train_loss: 0.8237, test_loss: 1.0757, test_f1: 0.4771
 epoch: 86, train_loss: 0.8406, test_loss: 1.0945, test_f1: 0.4872
 epoch: 87, train_loss: 0.8365, test_loss: 1.1274, test_f1: 0.4635
 epoch: 88, train_loss: 0.8403, test_loss: 1.0627, test_f1: 0.4784
 epoch: 89, train_loss: 0.8245, test_loss: 1.1076, test_f1: 0.4822
 epoch: 90, train_loss: 0.8213, test_loss: 1.1050, test_f1: 0.4765
 epoch: 91, train_loss: 0.8276, test_loss: 1.1350, test_f1: 0.4610
 epoch: 92, train_loss: 0.8265, test_loss: 1.1143, test_f1: 0.4669
 epoch: 93, train_loss: 0.8452, test_loss: 1.1033, test_f1: 0.4828
 epoch: 94, train_loss: 0.8217, test_loss: 1.1194, test_f1: 0.4733
 epoch: 95, train_loss: 0.8147, test_loss: 1.0839, test_f1: 0.4684
 epoch: 96, train_loss: 0.8250, test_loss: 1.0718, test_f1: 0.4834
 epoch: 97, train_loss: 0.8175, test_loss: 1.1027, test_f1: 0.4719
 epoch: 98, train_loss: 0.8135, test_loss: 1.0703, test_f1: 0.4834
 epoch: 99, train_loss: 0.8183, test_loss: 1.1125, test_f1: 0.4821
##################ITERATION #2 ****************************************
 epoch: 0, train_loss: 1.3039, test_loss: 1.3073, test_f1: 0.2274
 epoch: 1, train_loss: 1.2622, test_loss: 1.2860, test_f1: 0.2274
 epoch: 2, train_loss: 1.2445, test_loss: 1.2601, test_f1: 0.2555
 epoch: 3, train_loss: 1.2362, test_loss: 1.2343, test_f1: 0.2623
 epoch: 4, train_loss: 1.2263, test_loss: 1.2130, test_f1: 0.3230
 epoch: 5, train_loss: 1.2166, test_loss: 1.2011, test_f1: 0.3310
 epoch: 6, train_loss: 1.2177, test_loss: 1.1920, test_f1: 0.3496
 epoch: 7, train_loss: 1.2052, test_loss: 1.1812, test_f1: 0.3624
 epoch: 8, train_loss: 1.1904, test_loss: 1.1731, test_f1: 0.3809
 epoch: 9, train_loss: 1.1917, test_loss: 1.1698, test_f1: 0.3774
 epoch: 10, train_loss: 1.1783, test_loss: 1.1531, test_f1: 0.3866
 epoch: 11, train_loss: 1.1779, test_loss: 1.1457, test_f1: 0.3891
 epoch: 12, train_loss: 1.1667, test_loss: 1.1441, test_f1: 0.3872
 epoch: 13, train_loss: 1.1603, test_loss: 1.1405, test_f1: 0.3966
 epoch: 14, train_loss: 1.1477, test_loss: 1.1310, test_f1: 0.3960
 epoch: 15, train_loss: 1.1384, test_loss: 1.1297, test_f1: 0.4083
 epoch: 16, train_loss: 1.1461, test_loss: 1.1250, test_f1: 0.3997
 epoch: 17, train_loss: 1.1331, test_loss: 1.1248, test_f1: 0.3943
 epoch: 18, train_loss: 1.1332, test_loss: 1.1139, test_f1: 0.4000
 epoch: 19, train_loss: 1.1246, test_loss: 1.1127, test_f1: 0.4131
 epoch: 20, train_loss: 1.1109, test_loss: 1.1061, test_f1: 0.4046
 epoch: 21, train_loss: 1.1142, test_loss: 1.1030, test_f1: 0.4034
 epoch: 22, train_loss: 1.1103, test_loss: 1.1072, test_f1: 0.4133
 epoch: 23, train_loss: 1.1073, test_loss: 1.1066, test_f1: 0.4140
 epoch: 24, train_loss: 1.0954, test_loss: 1.0894, test_f1: 0.4298
 epoch: 25, train_loss: 1.0960, test_loss: 1.0889, test_f1: 0.4252
 epoch: 26, train_loss: 1.0937, test_loss: 1.0772, test_f1: 0.4232
 epoch: 27, train_loss: 1.0840, test_loss: 1.0798, test_f1: 0.4216
 epoch: 28, train_loss: 1.0708, test_loss: 1.0779, test_f1: 0.4394
 epoch: 29, train_loss: 1.0660, test_loss: 1.0661, test_f1: 0.4315
 epoch: 30, train_loss: 1.0708, test_loss: 1.0652, test_f1: 0.4410
 epoch: 31, train_loss: 1.0648, test_loss: 1.0651, test_f1: 0.4335
 epoch: 32, train_loss: 1.0602, test_loss: 1.0523, test_f1: 0.4321
 epoch: 33, train_loss: 1.0428, test_loss: 1.0417, test_f1: 0.4498
 epoch: 34, train_loss: 1.0451, test_loss: 1.0518, test_f1: 0.4360
 epoch: 35, train_loss: 1.0405, test_loss: 1.0435, test_f1: 0.4457
 epoch: 36, train_loss: 1.0370, test_loss: 1.0322, test_f1: 0.4533
 epoch: 37, train_loss: 1.0321, test_loss: 1.0437, test_f1: 0.4520
 epoch: 38, train_loss: 1.0251, test_loss: 1.0235, test_f1: 0.4621
 epoch: 39, train_loss: 1.0203, test_loss: 1.0449, test_f1: 0.4430
 epoch: 40, train_loss: 1.0180, test_loss: 1.0133, test_f1: 0.4634
 epoch: 41, train_loss: 1.0150, test_loss: 1.0395, test_f1: 0.4417
 epoch: 42, train_loss: 1.0037, test_loss: 1.0036, test_f1: 0.4691
 epoch: 43, train_loss: 0.9976, test_loss: 1.0359, test_f1: 0.4562
 epoch: 44, train_loss: 1.0008, test_loss: 1.0359, test_f1: 0.4423
 epoch: 45, train_loss: 0.9982, test_loss: 0.9977, test_f1: 0.4772
 epoch: 46, train_loss: 0.9977, test_loss: 1.0009, test_f1: 0.4698
 epoch: 47, train_loss: 0.9805, test_loss: 1.0015, test_f1: 0.4636
 epoch: 48, train_loss: 0.9747, test_loss: 1.0068, test_f1: 0.4533
 epoch: 49, train_loss: 0.9691, test_loss: 1.0019, test_f1: 0.4633
 epoch: 50, train_loss: 0.9610, test_loss: 1.0048, test_f1: 0.4643
 epoch: 51, train_loss: 0.9728, test_loss: 0.9995, test_f1: 0.4640
 epoch: 52, train_loss: 0.9599, test_loss: 1.0162, test_f1: 0.4613
 epoch: 53, train_loss: 0.9527, test_loss: 1.0060, test_f1: 0.4691
 epoch: 54, train_loss: 0.9587, test_loss: 1.0000, test_f1: 0.4704
 epoch: 55, train_loss: 0.9581, test_loss: 1.0178, test_f1: 0.4677
 epoch: 56, train_loss: 0.9551, test_loss: 1.0076, test_f1: 0.4658
 epoch: 57, train_loss: 0.9527, test_loss: 1.0026, test_f1: 0.4780
 epoch: 58, train_loss: 0.9441, test_loss: 1.0052, test_f1: 0.4683
 epoch: 59, train_loss: 0.9342, test_loss: 1.0090, test_f1: 0.4657
 epoch: 60, train_loss: 0.9283, test_loss: 1.0051, test_f1: 0.4711
 epoch: 61, train_loss: 0.9298, test_loss: 1.0158, test_f1: 0.4689
 epoch: 62, train_loss: 0.9302, test_loss: 1.0235, test_f1: 0.4668
 epoch: 63, train_loss: 0.9394, test_loss: 1.0180, test_f1: 0.4705
 epoch: 64, train_loss: 0.9334, test_loss: 1.0243, test_f1: 0.4671
 epoch: 65, train_loss: 0.9181, test_loss: 1.0196, test_f1: 0.4639
 epoch: 66, train_loss: 0.9201, test_loss: 1.0281, test_f1: 0.4705
 epoch: 67, train_loss: 0.9327, test_loss: 1.0081, test_f1: 0.4647
 epoch: 68, train_loss: 0.9289, test_loss: 0.9968, test_f1: 0.4626
 epoch: 69, train_loss: 0.9332, test_loss: 1.0144, test_f1: 0.4664
 epoch: 70, train_loss: 0.9172, test_loss: 1.0005, test_f1: 0.4577
 epoch: 71, train_loss: 0.9240, test_loss: 1.0243, test_f1: 0.4571
 epoch: 72, train_loss: 0.9254, test_loss: 1.0242, test_f1: 0.4587
 epoch: 73, train_loss: 0.9156, test_loss: 1.0026, test_f1: 0.4661
 epoch: 74, train_loss: 0.9244, test_loss: 1.0259, test_f1: 0.4582
 epoch: 75, train_loss: 0.9202, test_loss: 1.0149, test_f1: 0.4738
 epoch: 76, train_loss: 0.9082, test_loss: 1.0208, test_f1: 0.4638
 epoch: 77, train_loss: 0.9123, test_loss: 1.0264, test_f1: 0.4590
 epoch: 78, train_loss: 0.9085, test_loss: 1.0173, test_f1: 0.4679
 epoch: 79, train_loss: 0.9067, test_loss: 1.0353, test_f1: 0.4608
 epoch: 80, train_loss: 0.8937, test_loss: 1.0191, test_f1: 0.4576
 epoch: 81, train_loss: 0.9057, test_loss: 1.0205, test_f1: 0.4669
 epoch: 82, train_loss: 0.9110, test_loss: 1.0413, test_f1: 0.4614
 epoch: 83, train_loss: 0.8916, test_loss: 1.0376, test_f1: 0.4522
 epoch: 84, train_loss: 0.8996, test_loss: 1.0159, test_f1: 0.4756
 epoch: 85, train_loss: 0.8908, test_loss: 1.0430, test_f1: 0.4614
 epoch: 86, train_loss: 0.8856, test_loss: 1.0338, test_f1: 0.4593
 epoch: 87, train_loss: 0.8927, test_loss: 1.0344, test_f1: 0.4654
 epoch: 88, train_loss: 0.8993, test_loss: 1.0478, test_f1: 0.4518
 epoch: 89, train_loss: 0.8842, test_loss: 1.0449, test_f1: 0.4669
 epoch: 90, train_loss: 0.8968, test_loss: 1.0454, test_f1: 0.4634
 epoch: 91, train_loss: 0.8783, test_loss: 1.0416, test_f1: 0.4575
 epoch: 92, train_loss: 0.8835, test_loss: 1.0765, test_f1: 0.4475
 epoch: 93, train_loss: 0.8856, test_loss: 1.0627, test_f1: 0.4472
 epoch: 94, train_loss: 0.8771, test_loss: 1.0565, test_f1: 0.4565
 epoch: 95, train_loss: 0.8850, test_loss: 1.0527, test_f1: 0.4501
 epoch: 96, train_loss: 0.8730, test_loss: 1.0627, test_f1: 0.4513
 epoch: 97, train_loss: 0.8867, test_loss: 1.0632, test_f1: 0.4415
 epoch: 98, train_loss: 0.8747, test_loss: 1.0547, test_f1: 0.4611
 epoch: 99, train_loss: 0.8758, test_loss: 1.0733, test_f1: 0.4649
##################ITERATION #3 ****************************************
 epoch: 0, train_loss: 1.3734, test_loss: 1.3386, test_f1: 0.2274
 epoch: 1, train_loss: 1.2723, test_loss: 1.2886, test_f1: 0.2274
 epoch: 2, train_loss: 1.2529, test_loss: 1.2550, test_f1: 0.2555
 epoch: 3, train_loss: 1.2366, test_loss: 1.2211, test_f1: 0.2923
 epoch: 4, train_loss: 1.2192, test_loss: 1.1947, test_f1: 0.3171
 epoch: 5, train_loss: 1.2089, test_loss: 1.1753, test_f1: 0.3516
 epoch: 6, train_loss: 1.1967, test_loss: 1.1572, test_f1: 0.3731
 epoch: 7, train_loss: 1.1909, test_loss: 1.1432, test_f1: 0.3824
 epoch: 8, train_loss: 1.1752, test_loss: 1.1434, test_f1: 0.3881
 epoch: 9, train_loss: 1.1696, test_loss: 1.1307, test_f1: 0.3962
 epoch: 10, train_loss: 1.1614, test_loss: 1.1188, test_f1: 0.4073
 epoch: 11, train_loss: 1.1587, test_loss: 1.1165, test_f1: 0.4228
 epoch: 12, train_loss: 1.1404, test_loss: 1.0992, test_f1: 0.4195
 epoch: 13, train_loss: 1.1439, test_loss: 1.1068, test_f1: 0.4214
 epoch: 14, train_loss: 1.1318, test_loss: 1.0984, test_f1: 0.4208
 epoch: 15, train_loss: 1.1197, test_loss: 1.0841, test_f1: 0.4197
 epoch: 16, train_loss: 1.1158, test_loss: 1.0759, test_f1: 0.4366
 epoch: 17, train_loss: 1.1134, test_loss: 1.0782, test_f1: 0.4362
 epoch: 18, train_loss: 1.1086, test_loss: 1.0767, test_f1: 0.4442
 epoch: 19, train_loss: 1.0928, test_loss: 1.0725, test_f1: 0.4323
 epoch: 20, train_loss: 1.0862, test_loss: 1.0524, test_f1: 0.4363
 epoch: 21, train_loss: 1.0836, test_loss: 1.0738, test_f1: 0.4260
 epoch: 22, train_loss: 1.0693, test_loss: 1.0572, test_f1: 0.4287
 epoch: 23, train_loss: 1.0697, test_loss: 1.0382, test_f1: 0.4486
 epoch: 24, train_loss: 1.0648, test_loss: 1.0521, test_f1: 0.4418
 epoch: 25, train_loss: 1.0564, test_loss: 1.0449, test_f1: 0.4445
 epoch: 26, train_loss: 1.0576, test_loss: 1.0297, test_f1: 0.4423
 epoch: 27, train_loss: 1.0488, test_loss: 1.0355, test_f1: 0.4609
 epoch: 28, train_loss: 1.0458, test_loss: 1.0286, test_f1: 0.4550
 epoch: 29, train_loss: 1.0310, test_loss: 1.0304, test_f1: 0.4469
 epoch: 30, train_loss: 1.0173, test_loss: 1.0236, test_f1: 0.4691
 epoch: 31, train_loss: 1.0191, test_loss: 1.0239, test_f1: 0.4554
 epoch: 32, train_loss: 1.0193, test_loss: 1.0087, test_f1: 0.4649
 epoch: 33, train_loss: 1.0180, test_loss: 1.0491, test_f1: 0.4471
 epoch: 34, train_loss: 1.0027, test_loss: 1.0160, test_f1: 0.4559
 epoch: 35, train_loss: 0.9932, test_loss: 1.0113, test_f1: 0.4330
 epoch: 36, train_loss: 0.9875, test_loss: 1.0076, test_f1: 0.4607
 epoch: 37, train_loss: 0.9941, test_loss: 1.0222, test_f1: 0.4612
 epoch: 38, train_loss: 0.9854, test_loss: 1.0221, test_f1: 0.4649
 epoch: 39, train_loss: 0.9993, test_loss: 1.0437, test_f1: 0.4491
 epoch: 40, train_loss: 0.9953, test_loss: 1.0350, test_f1: 0.4545
 epoch: 41, train_loss: 0.9882, test_loss: 1.0278, test_f1: 0.4556
 epoch: 42, train_loss: 0.9772, test_loss: 1.0279, test_f1: 0.4538
 epoch: 43, train_loss: 0.9642, test_loss: 1.0305, test_f1: 0.4606
 epoch: 44, train_loss: 0.9619, test_loss: 1.0183, test_f1: 0.4668
 epoch: 45, train_loss: 0.9496, test_loss: 1.0174, test_f1: 0.4635
 epoch: 46, train_loss: 0.9486, test_loss: 1.0184, test_f1: 0.4539
 epoch: 47, train_loss: 0.9516, test_loss: 1.0059, test_f1: 0.4685
 epoch: 48, train_loss: 0.9426, test_loss: 1.0089, test_f1: 0.4684
 epoch: 49, train_loss: 0.9589, test_loss: 1.0235, test_f1: 0.4621
 epoch: 50, train_loss: 0.9498, test_loss: 1.0248, test_f1: 0.4540
 epoch: 51, train_loss: 0.9313, test_loss: 1.0258, test_f1: 0.4613
 epoch: 52, train_loss: 0.9357, test_loss: 1.0257, test_f1: 0.4652
 epoch: 53, train_loss: 0.9419, test_loss: 1.0218, test_f1: 0.4612
 epoch: 54, train_loss: 0.9322, test_loss: 1.0346, test_f1: 0.4536
 epoch: 55, train_loss: 0.9308, test_loss: 1.0200, test_f1: 0.4565
 epoch: 56, train_loss: 0.9288, test_loss: 1.0331, test_f1: 0.4620
 epoch: 57, train_loss: 0.9276, test_loss: 1.0166, test_f1: 0.4556
 epoch: 58, train_loss: 0.9209, test_loss: 1.0255, test_f1: 0.4625
 epoch: 59, train_loss: 0.9211, test_loss: 1.0309, test_f1: 0.4658
 epoch: 60, train_loss: 0.9301, test_loss: 1.0246, test_f1: 0.4641
 epoch: 61, train_loss: 0.9271, test_loss: 1.0210, test_f1: 0.4531
 epoch: 62, train_loss: 0.9179, test_loss: 1.0516, test_f1: 0.4617
 epoch: 63, train_loss: 0.9313, test_loss: 1.0349, test_f1: 0.4596
 epoch: 64, train_loss: 0.9167, test_loss: 1.0482, test_f1: 0.4569
 epoch: 65, train_loss: 0.9261, test_loss: 1.0338, test_f1: 0.4608
 epoch: 66, train_loss: 0.9079, test_loss: 1.0392, test_f1: 0.4672
 epoch: 67, train_loss: 0.9163, test_loss: 1.0361, test_f1: 0.4722
 epoch: 68, train_loss: 0.9123, test_loss: 1.0196, test_f1: 0.4573
 epoch: 69, train_loss: 0.9104, test_loss: 1.0329, test_f1: 0.4586
 epoch: 70, train_loss: 0.9134, test_loss: 1.0426, test_f1: 0.4530
 epoch: 71, train_loss: 0.8991, test_loss: 1.0589, test_f1: 0.4585
 epoch: 72, train_loss: 0.9082, test_loss: 1.0324, test_f1: 0.4674
 epoch: 73, train_loss: 0.9135, test_loss: 1.0350, test_f1: 0.4557
 epoch: 74, train_loss: 0.8959, test_loss: 1.0286, test_f1: 0.4666
 epoch: 75, train_loss: 0.8970, test_loss: 1.0366, test_f1: 0.4621
 epoch: 76, train_loss: 0.9020, test_loss: 1.0412, test_f1: 0.4548
 epoch: 77, train_loss: 0.9124, test_loss: 1.0310, test_f1: 0.4682
 epoch: 78, train_loss: 0.8936, test_loss: 1.0190, test_f1: 0.4731
 epoch: 79, train_loss: 0.8978, test_loss: 1.0402, test_f1: 0.4681
 epoch: 80, train_loss: 0.9066, test_loss: 1.0385, test_f1: 0.4527
 epoch: 81, train_loss: 0.8912, test_loss: 1.0465, test_f1: 0.4673
 epoch: 82, train_loss: 0.9034, test_loss: 1.0448, test_f1: 0.4663
 epoch: 83, train_loss: 0.9011, test_loss: 1.0522, test_f1: 0.4604
 epoch: 84, train_loss: 0.9010, test_loss: 1.0471, test_f1: 0.4495
 epoch: 85, train_loss: 0.8903, test_loss: 1.0482, test_f1: 0.4623
 epoch: 86, train_loss: 0.8871, test_loss: 1.0575, test_f1: 0.4591
 epoch: 87, train_loss: 0.8879, test_loss: 1.0525, test_f1: 0.4656
 epoch: 88, train_loss: 0.8966, test_loss: 1.0565, test_f1: 0.4482
 epoch: 89, train_loss: 0.8843, test_loss: 1.0586, test_f1: 0.4504
 epoch: 90, train_loss: 0.8791, test_loss: 1.0691, test_f1: 0.4519
 epoch: 91, train_loss: 0.8834, test_loss: 1.0732, test_f1: 0.4475
 epoch: 92, train_loss: 0.8826, test_loss: 1.0485, test_f1: 0.4650
 epoch: 93, train_loss: 0.8850, test_loss: 1.0288, test_f1: 0.4662
 epoch: 94, train_loss: 0.8785, test_loss: 1.0556, test_f1: 0.4605
 epoch: 95, train_loss: 0.8837, test_loss: 1.0541, test_f1: 0.4587
 epoch: 96, train_loss: 0.8779, test_loss: 1.0381, test_f1: 0.4691
 epoch: 97, train_loss: 0.8780, test_loss: 1.0619, test_f1: 0.4561
 epoch: 98, train_loss: 0.8848, test_loss: 1.0702, test_f1: 0.4538
 epoch: 99, train_loss: 0.8658, test_loss: 1.0544, test_f1: 0.4600
##################ITERATION #4 ****************************************
 epoch: 0, train_loss: 1.3398, test_loss: 1.3524, test_f1: 0.2274
 epoch: 1, train_loss: 1.2709, test_loss: 1.3006, test_f1: 0.2274
 epoch: 2, train_loss: 1.2379, test_loss: 1.2617, test_f1: 0.2555
 epoch: 3, train_loss: 1.2276, test_loss: 1.2326, test_f1: 0.2698
 epoch: 4, train_loss: 1.2156, test_loss: 1.1906, test_f1: 0.3200
 epoch: 5, train_loss: 1.2083, test_loss: 1.1725, test_f1: 0.3495
 epoch: 6, train_loss: 1.1936, test_loss: 1.1679, test_f1: 0.3527
 epoch: 7, train_loss: 1.1813, test_loss: 1.1459, test_f1: 0.3979
 epoch: 8, train_loss: 1.1751, test_loss: 1.1402, test_f1: 0.4019
 epoch: 9, train_loss: 1.1694, test_loss: 1.1330, test_f1: 0.4127
 epoch: 10, train_loss: 1.1491, test_loss: 1.1220, test_f1: 0.4104
 epoch: 11, train_loss: 1.1561, test_loss: 1.1061, test_f1: 0.4242
 epoch: 12, train_loss: 1.1444, test_loss: 1.1180, test_f1: 0.4187
 epoch: 13, train_loss: 1.1432, test_loss: 1.1031, test_f1: 0.4295
 epoch: 14, train_loss: 1.1289, test_loss: 1.0874, test_f1: 0.4339
 epoch: 15, train_loss: 1.1254, test_loss: 1.0799, test_f1: 0.4426
 epoch: 16, train_loss: 1.1100, test_loss: 1.0895, test_f1: 0.4370
 epoch: 17, train_loss: 1.1053, test_loss: 1.0791, test_f1: 0.4436
 epoch: 18, train_loss: 1.1013, test_loss: 1.0773, test_f1: 0.4420
 epoch: 19, train_loss: 1.0999, test_loss: 1.0789, test_f1: 0.4477
 epoch: 20, train_loss: 1.0917, test_loss: 1.0562, test_f1: 0.4457
 epoch: 21, train_loss: 1.0807, test_loss: 1.0561, test_f1: 0.4501
 epoch: 22, train_loss: 1.0724, test_loss: 1.0665, test_f1: 0.4427
 epoch: 23, train_loss: 1.0794, test_loss: 1.0650, test_f1: 0.4443
 epoch: 24, train_loss: 1.0702, test_loss: 1.0567, test_f1: 0.4368
 epoch: 25, train_loss: 1.0629, test_loss: 1.0618, test_f1: 0.4361
 epoch: 26, train_loss: 1.0574, test_loss: 1.0451, test_f1: 0.4425
 epoch: 27, train_loss: 1.0476, test_loss: 1.0598, test_f1: 0.4391
 epoch: 28, train_loss: 1.0554, test_loss: 1.0508, test_f1: 0.4286
 epoch: 29, train_loss: 1.0403, test_loss: 1.0476, test_f1: 0.4426
 epoch: 30, train_loss: 1.0428, test_loss: 1.0701, test_f1: 0.4281
 epoch: 31, train_loss: 1.0413, test_loss: 1.0624, test_f1: 0.4284
 epoch: 32, train_loss: 1.0312, test_loss: 1.0542, test_f1: 0.4354
 epoch: 33, train_loss: 1.0291, test_loss: 1.0437, test_f1: 0.4381
 epoch: 34, train_loss: 1.0312, test_loss: 1.0798, test_f1: 0.4217
 epoch: 35, train_loss: 1.0173, test_loss: 1.0499, test_f1: 0.4407
 epoch: 36, train_loss: 1.0154, test_loss: 1.0543, test_f1: 0.4437
 epoch: 37, train_loss: 1.0203, test_loss: 1.0366, test_f1: 0.4589
 epoch: 38, train_loss: 1.0067, test_loss: 1.0594, test_f1: 0.4439
 epoch: 39, train_loss: 1.0145, test_loss: 1.0589, test_f1: 0.4475
 epoch: 40, train_loss: 1.0022, test_loss: 1.0634, test_f1: 0.4614
 epoch: 41, train_loss: 0.9939, test_loss: 1.0656, test_f1: 0.4459
 epoch: 42, train_loss: 1.0008, test_loss: 1.0488, test_f1: 0.4649
 epoch: 43, train_loss: 0.9948, test_loss: 1.0443, test_f1: 0.4544
 epoch: 44, train_loss: 0.9854, test_loss: 1.0429, test_f1: 0.4473
 epoch: 45, train_loss: 0.9909, test_loss: 1.0539, test_f1: 0.4502
 epoch: 46, train_loss: 0.9757, test_loss: 1.0471, test_f1: 0.4631
 epoch: 47, train_loss: 0.9699, test_loss: 1.0484, test_f1: 0.4584
 epoch: 48, train_loss: 0.9914, test_loss: 1.0600, test_f1: 0.4644
 epoch: 49, train_loss: 0.9692, test_loss: 1.0348, test_f1: 0.4743
 epoch: 50, train_loss: 0.9591, test_loss: 1.0519, test_f1: 0.4574
 epoch: 51, train_loss: 0.9671, test_loss: 1.0233, test_f1: 0.4684
 epoch: 52, train_loss: 0.9579, test_loss: 1.0341, test_f1: 0.4622
 epoch: 53, train_loss: 0.9538, test_loss: 1.0711, test_f1: 0.4654
 epoch: 54, train_loss: 0.9508, test_loss: 1.0408, test_f1: 0.4696
 epoch: 55, train_loss: 0.9409, test_loss: 1.0460, test_f1: 0.4588
 epoch: 56, train_loss: 0.9523, test_loss: 1.0333, test_f1: 0.4638
 epoch: 57, train_loss: 0.9426, test_loss: 1.0439, test_f1: 0.4772
 epoch: 58, train_loss: 0.9372, test_loss: 1.0315, test_f1: 0.4860
 epoch: 59, train_loss: 0.9535, test_loss: 1.0593, test_f1: 0.4656
 epoch: 60, train_loss: 0.9323, test_loss: 1.0980, test_f1: 0.4602
 epoch: 61, train_loss: 0.9444, test_loss: 1.0951, test_f1: 0.4739
 epoch: 62, train_loss: 0.9380, test_loss: 1.0516, test_f1: 0.4749
 epoch: 63, train_loss: 0.9365, test_loss: 1.0617, test_f1: 0.4678
 epoch: 64, train_loss: 0.9316, test_loss: 1.0368, test_f1: 0.4890
 epoch: 65, train_loss: 0.9423, test_loss: 1.0590, test_f1: 0.4717
 epoch: 66, train_loss: 0.9301, test_loss: 1.0538, test_f1: 0.4853
 epoch: 67, train_loss: 0.9217, test_loss: 1.0564, test_f1: 0.4729
 epoch: 68, train_loss: 0.9327, test_loss: 1.0709, test_f1: 0.4731
 epoch: 69, train_loss: 0.9251, test_loss: 1.0740, test_f1: 0.4778
 epoch: 70, train_loss: 0.9336, test_loss: 1.0819, test_f1: 0.4692
 epoch: 71, train_loss: 0.9224, test_loss: 1.0756, test_f1: 0.4557
 epoch: 72, train_loss: 0.9370, test_loss: 1.0626, test_f1: 0.4775
 epoch: 73, train_loss: 0.9228, test_loss: 1.0800, test_f1: 0.4546
 epoch: 74, train_loss: 0.9215, test_loss: 1.1436, test_f1: 0.4675
 epoch: 75, train_loss: 0.9275, test_loss: 1.1505, test_f1: 0.4632
 epoch: 76, train_loss: 0.9193, test_loss: 1.1209, test_f1: 0.4689
 epoch: 77, train_loss: 0.9191, test_loss: 1.1165, test_f1: 0.4673
 epoch: 78, train_loss: 0.9182, test_loss: 1.0362, test_f1: 0.4729
 epoch: 79, train_loss: 0.9106, test_loss: 1.0914, test_f1: 0.4719
 epoch: 80, train_loss: 0.9245, test_loss: 1.0984, test_f1: 0.4713
 epoch: 81, train_loss: 0.9215, test_loss: 1.0699, test_f1: 0.4847
 epoch: 82, train_loss: 0.9032, test_loss: 1.0648, test_f1: 0.4816
 epoch: 83, train_loss: 0.9149, test_loss: 1.0654, test_f1: 0.4851
 epoch: 84, train_loss: 0.8983, test_loss: 1.0713, test_f1: 0.4710
 epoch: 85, train_loss: 0.9049, test_loss: 1.0729, test_f1: 0.4804
 epoch: 86, train_loss: 0.8982, test_loss: 1.0521, test_f1: 0.4930
 epoch: 87, train_loss: 0.9089, test_loss: 1.0566, test_f1: 0.4797
 epoch: 88, train_loss: 0.9003, test_loss: 1.0601, test_f1: 0.4880
 epoch: 89, train_loss: 0.9090, test_loss: 1.0848, test_f1: 0.4796
 epoch: 90, train_loss: 0.9074, test_loss: 1.0799, test_f1: 0.4844
 epoch: 91, train_loss: 0.9014, test_loss: 1.0701, test_f1: 0.4890
 epoch: 92, train_loss: 0.8982, test_loss: 1.0596, test_f1: 0.4858
 epoch: 93, train_loss: 0.8938, test_loss: 1.0729, test_f1: 0.4818
 epoch: 94, train_loss: 0.8932, test_loss: 1.0833, test_f1: 0.4919
 epoch: 95, train_loss: 0.8852, test_loss: 1.0855, test_f1: 0.4807
 epoch: 96, train_loss: 0.8882, test_loss: 1.0730, test_f1: 0.4834
 epoch: 97, train_loss: 0.8947, test_loss: 1.0880, test_f1: 0.4804
 epoch: 98, train_loss: 0.8868, test_loss: 1.1145, test_f1: 0.4825
 epoch: 99, train_loss: 0.8843, test_loss: 1.1236, test_f1: 0.4849
##################ITERATION #5 ****************************************
 epoch: 0, train_loss: 1.3856, test_loss: 1.3121, test_f1: 0.2555
 epoch: 1, train_loss: 1.2798, test_loss: 1.2710, test_f1: 0.2549
 epoch: 2, train_loss: 1.2509, test_loss: 1.2392, test_f1: 0.2566
 epoch: 3, train_loss: 1.2454, test_loss: 1.2069, test_f1: 0.3099
 epoch: 4, train_loss: 1.2318, test_loss: 1.1796, test_f1: 0.3473
 epoch: 5, train_loss: 1.2197, test_loss: 1.1691, test_f1: 0.3593
 epoch: 6, train_loss: 1.2048, test_loss: 1.1575, test_f1: 0.3599
 epoch: 7, train_loss: 1.2056, test_loss: 1.1464, test_f1: 0.3757
 epoch: 8, train_loss: 1.1983, test_loss: 1.1416, test_f1: 0.3702
 epoch: 9, train_loss: 1.1880, test_loss: 1.1298, test_f1: 0.3912
 epoch: 10, train_loss: 1.1820, test_loss: 1.1208, test_f1: 0.4141
 epoch: 11, train_loss: 1.1747, test_loss: 1.1166, test_f1: 0.3912
 epoch: 12, train_loss: 1.1713, test_loss: 1.1080, test_f1: 0.4221
 epoch: 13, train_loss: 1.1588, test_loss: 1.1007, test_f1: 0.4261
 epoch: 14, train_loss: 1.1538, test_loss: 1.0931, test_f1: 0.4258
 epoch: 15, train_loss: 1.1584, test_loss: 1.0843, test_f1: 0.4295
 epoch: 16, train_loss: 1.1378, test_loss: 1.0899, test_f1: 0.4336
 epoch: 17, train_loss: 1.1376, test_loss: 1.0761, test_f1: 0.4251
 epoch: 18, train_loss: 1.1372, test_loss: 1.0824, test_f1: 0.4298
 epoch: 19, train_loss: 1.1318, test_loss: 1.0645, test_f1: 0.4301
 epoch: 20, train_loss: 1.1306, test_loss: 1.0706, test_f1: 0.4391
 epoch: 21, train_loss: 1.1148, test_loss: 1.0566, test_f1: 0.4434
 epoch: 22, train_loss: 1.1155, test_loss: 1.0614, test_f1: 0.4312
 epoch: 23, train_loss: 1.0979, test_loss: 1.0497, test_f1: 0.4477
 epoch: 24, train_loss: 1.0966, test_loss: 1.0387, test_f1: 0.4730
 epoch: 25, train_loss: 1.1005, test_loss: 1.0367, test_f1: 0.4667
 epoch: 26, train_loss: 1.0947, test_loss: 1.0397, test_f1: 0.4709
 epoch: 27, train_loss: 1.0844, test_loss: 1.0248, test_f1: 0.4826
 epoch: 28, train_loss: 1.0858, test_loss: 1.0215, test_f1: 0.4728
 epoch: 29, train_loss: 1.0747, test_loss: 1.0177, test_f1: 0.4739
 epoch: 30, train_loss: 1.0728, test_loss: 1.0004, test_f1: 0.4581
 epoch: 31, train_loss: 1.0740, test_loss: 1.0062, test_f1: 0.4813
 epoch: 32, train_loss: 1.0625, test_loss: 1.0145, test_f1: 0.4468
 epoch: 33, train_loss: 1.0702, test_loss: 0.9944, test_f1: 0.4744
 epoch: 34, train_loss: 1.0575, test_loss: 1.0002, test_f1: 0.4709
 epoch: 35, train_loss: 1.0594, test_loss: 0.9842, test_f1: 0.4617
 epoch: 36, train_loss: 1.0525, test_loss: 1.0010, test_f1: 0.4672
 epoch: 37, train_loss: 1.0550, test_loss: 0.9813, test_f1: 0.4537
 epoch: 38, train_loss: 1.0493, test_loss: 0.9792, test_f1: 0.4578
 epoch: 39, train_loss: 1.0385, test_loss: 0.9883, test_f1: 0.4745
 epoch: 40, train_loss: 1.0278, test_loss: 0.9747, test_f1: 0.4730
 epoch: 41, train_loss: 1.0308, test_loss: 0.9742, test_f1: 0.4903
 epoch: 42, train_loss: 1.0365, test_loss: 0.9705, test_f1: 0.4817
 epoch: 43, train_loss: 1.0352, test_loss: 0.9711, test_f1: 0.5007
 epoch: 44, train_loss: 1.0229, test_loss: 0.9613, test_f1: 0.4630
 epoch: 45, train_loss: 1.0287, test_loss: 0.9634, test_f1: 0.4617
 epoch: 46, train_loss: 1.0099, test_loss: 0.9564, test_f1: 0.5065
 epoch: 47, train_loss: 1.0128, test_loss: 0.9580, test_f1: 0.4629
 epoch: 48, train_loss: 1.0159, test_loss: 0.9486, test_f1: 0.4995
 epoch: 49, train_loss: 1.0078, test_loss: 0.9601, test_f1: 0.4597
 epoch: 50, train_loss: 0.9990, test_loss: 0.9615, test_f1: 0.4991
 epoch: 51, train_loss: 0.9961, test_loss: 0.9500, test_f1: 0.4949
 epoch: 52, train_loss: 0.9965, test_loss: 0.9407, test_f1: 0.5101
 epoch: 53, train_loss: 0.9930, test_loss: 0.9411, test_f1: 0.4764
 epoch: 54, train_loss: 1.0060, test_loss: 0.9438, test_f1: 0.4658
 epoch: 55, train_loss: 0.9836, test_loss: 0.9427, test_f1: 0.4739
 epoch: 56, train_loss: 0.9813, test_loss: 0.9453, test_f1: 0.4901
 epoch: 57, train_loss: 0.9825, test_loss: 0.9430, test_f1: 0.4822
 epoch: 58, train_loss: 0.9867, test_loss: 0.9537, test_f1: 0.4690
 epoch: 59, train_loss: 0.9884, test_loss: 0.9402, test_f1: 0.4806
 epoch: 60, train_loss: 0.9840, test_loss: 0.9432, test_f1: 0.4738
 epoch: 61, train_loss: 0.9805, test_loss: 0.9408, test_f1: 0.4719
 epoch: 62, train_loss: 0.9818, test_loss: 0.9409, test_f1: 0.4796
 epoch: 63, train_loss: 0.9845, test_loss: 0.9507, test_f1: 0.4752
 epoch: 64, train_loss: 0.9720, test_loss: 0.9437, test_f1: 0.4928
 epoch: 65, train_loss: 0.9767, test_loss: 0.9425, test_f1: 0.5085
 epoch: 66, train_loss: 0.9677, test_loss: 0.9444, test_f1: 0.4949
 epoch: 67, train_loss: 0.9649, test_loss: 0.9402, test_f1: 0.5052
 epoch: 68, train_loss: 0.9677, test_loss: 0.9431, test_f1: 0.4869
 epoch: 69, train_loss: 0.9666, test_loss: 0.9413, test_f1: 0.4924
 epoch: 70, train_loss: 0.9689, test_loss: 0.9454, test_f1: 0.4858
 epoch: 71, train_loss: 0.9629, test_loss: 0.9389, test_f1: 0.4849
 epoch: 72, train_loss: 0.9629, test_loss: 0.9435, test_f1: 0.4792
 epoch: 73, train_loss: 0.9556, test_loss: 0.9525, test_f1: 0.4799
 epoch: 74, train_loss: 0.9682, test_loss: 0.9426, test_f1: 0.4708
 epoch: 75, train_loss: 0.9576, test_loss: 0.9417, test_f1: 0.4968
 epoch: 76, train_loss: 0.9643, test_loss: 0.9346, test_f1: 0.4906
 epoch: 77, train_loss: 0.9471, test_loss: 0.9365, test_f1: 0.4825
 epoch: 78, train_loss: 0.9524, test_loss: 0.9482, test_f1: 0.4779
 epoch: 79, train_loss: 0.9520, test_loss: 0.9459, test_f1: 0.4879
 epoch: 80, train_loss: 0.9518, test_loss: 0.9447, test_f1: 0.4924
 epoch: 81, train_loss: 0.9450, test_loss: 0.9416, test_f1: 0.4912
 epoch: 82, train_loss: 0.9616, test_loss: 0.9382, test_f1: 0.4964
 epoch: 83, train_loss: 0.9466, test_loss: 0.9362, test_f1: 0.4924
 epoch: 84, train_loss: 0.9506, test_loss: 0.9414, test_f1: 0.4951
 epoch: 85, train_loss: 0.9547, test_loss: 0.9515, test_f1: 0.4964
 epoch: 86, train_loss: 0.9475, test_loss: 0.9374, test_f1: 0.4790
 epoch: 87, train_loss: 0.9489, test_loss: 0.9433, test_f1: 0.4731
 epoch: 88, train_loss: 0.9425, test_loss: 0.9450, test_f1: 0.4952
 epoch: 89, train_loss: 0.9455, test_loss: 0.9414, test_f1: 0.4842
 epoch: 90, train_loss: 0.9461, test_loss: 0.9379, test_f1: 0.4903
 epoch: 91, train_loss: 0.9338, test_loss: 0.9434, test_f1: 0.5004
 epoch: 92, train_loss: 0.9436, test_loss: 0.9300, test_f1: 0.4908
 epoch: 93, train_loss: 0.9463, test_loss: 0.9419, test_f1: 0.4891
 epoch: 94, train_loss: 0.9361, test_loss: 0.9481, test_f1: 0.4908
 epoch: 95, train_loss: 0.9363, test_loss: 0.9399, test_f1: 0.4973
 epoch: 96, train_loss: 0.9537, test_loss: 0.9389, test_f1: 0.4972
 epoch: 97, train_loss: 0.9422, test_loss: 0.9495, test_f1: 0.4945
 epoch: 98, train_loss: 0.9375, test_loss: 0.9332, test_f1: 0.4886
 epoch: 99, train_loss: 0.9387, test_loss: 0.9402, test_f1: 0.4984
##################ITERATION #6 ****************************************
 epoch: 0, train_loss: 1.3582, test_loss: 1.3444, test_f1: 0.2274
 epoch: 1, train_loss: 1.2973, test_loss: 1.3287, test_f1: 0.2274
 epoch: 2, train_loss: 1.2753, test_loss: 1.3074, test_f1: 0.2274
 epoch: 3, train_loss: 1.2604, test_loss: 1.2948, test_f1: 0.2274
 epoch: 4, train_loss: 1.2550, test_loss: 1.2856, test_f1: 0.2325
 epoch: 5, train_loss: 1.2450, test_loss: 1.2755, test_f1: 0.2438
 epoch: 6, train_loss: 1.2422, test_loss: 1.2435, test_f1: 0.2746
 epoch: 7, train_loss: 1.2263, test_loss: 1.2374, test_f1: 0.3262
 epoch: 8, train_loss: 1.2326, test_loss: 1.2338, test_f1: 0.2980
 epoch: 9, train_loss: 1.2227, test_loss: 1.2219, test_f1: 0.3456
 epoch: 10, train_loss: 1.2140, test_loss: 1.2176, test_f1: 0.3162
 epoch: 11, train_loss: 1.2083, test_loss: 1.2131, test_f1: 0.3593
 epoch: 12, train_loss: 1.2099, test_loss: 1.2117, test_f1: 0.3742
 epoch: 13, train_loss: 1.2053, test_loss: 1.2138, test_f1: 0.3490
 epoch: 14, train_loss: 1.1972, test_loss: 1.2055, test_f1: 0.3415
 epoch: 15, train_loss: 1.1990, test_loss: 1.2017, test_f1: 0.3396
 epoch: 16, train_loss: 1.1885, test_loss: 1.1984, test_f1: 0.3698
 epoch: 17, train_loss: 1.1812, test_loss: 1.2065, test_f1: 0.3690
 epoch: 18, train_loss: 1.1852, test_loss: 1.1869, test_f1: 0.3492
 epoch: 19, train_loss: 1.1859, test_loss: 1.1811, test_f1: 0.3497
 epoch: 20, train_loss: 1.1708, test_loss: 1.1771, test_f1: 0.3674
 epoch: 21, train_loss: 1.1645, test_loss: 1.1775, test_f1: 0.3521
 epoch: 22, train_loss: 1.1530, test_loss: 1.1536, test_f1: 0.3988
 epoch: 23, train_loss: 1.1571, test_loss: 1.1583, test_f1: 0.4030
 epoch: 24, train_loss: 1.1433, test_loss: 1.1706, test_f1: 0.3933
 epoch: 25, train_loss: 1.1405, test_loss: 1.1241, test_f1: 0.4268
 epoch: 26, train_loss: 1.1362, test_loss: 1.1404, test_f1: 0.4005
 epoch: 27, train_loss: 1.1366, test_loss: 1.1230, test_f1: 0.4099
 epoch: 28, train_loss: 1.1224, test_loss: 1.1151, test_f1: 0.4230
 epoch: 29, train_loss: 1.1094, test_loss: 1.1139, test_f1: 0.4236
 epoch: 30, train_loss: 1.1113, test_loss: 1.0901, test_f1: 0.4419
 epoch: 31, train_loss: 1.1045, test_loss: 1.0974, test_f1: 0.4129
 epoch: 32, train_loss: 1.0965, test_loss: 1.0874, test_f1: 0.4518
 epoch: 33, train_loss: 1.0960, test_loss: 1.0934, test_f1: 0.4258
 epoch: 34, train_loss: 1.0809, test_loss: 1.0866, test_f1: 0.4428
 epoch: 35, train_loss: 1.0751, test_loss: 1.0804, test_f1: 0.4443
 epoch: 36, train_loss: 1.0885, test_loss: 1.0805, test_f1: 0.4475
 epoch: 37, train_loss: 1.0783, test_loss: 1.0934, test_f1: 0.4456
 epoch: 38, train_loss: 1.0708, test_loss: 1.0844, test_f1: 0.4292
 epoch: 39, train_loss: 1.0774, test_loss: 1.0645, test_f1: 0.4316
 epoch: 40, train_loss: 1.0678, test_loss: 1.0660, test_f1: 0.4563
 epoch: 41, train_loss: 1.0666, test_loss: 1.0647, test_f1: 0.4431
 epoch: 42, train_loss: 1.0603, test_loss: 1.0682, test_f1: 0.4431
 epoch: 43, train_loss: 1.0614, test_loss: 1.0623, test_f1: 0.4470
 epoch: 44, train_loss: 1.0529, test_loss: 1.0526, test_f1: 0.4622
 epoch: 45, train_loss: 1.0612, test_loss: 1.0361, test_f1: 0.4569
 epoch: 46, train_loss: 1.0607, test_loss: 1.0584, test_f1: 0.4438
 epoch: 47, train_loss: 1.0518, test_loss: 1.0627, test_f1: 0.4486
 epoch: 48, train_loss: 1.0495, test_loss: 1.0596, test_f1: 0.4621
 epoch: 49, train_loss: 1.0409, test_loss: 1.0512, test_f1: 0.4409
 epoch: 50, train_loss: 1.0389, test_loss: 1.0407, test_f1: 0.4416
 epoch: 51, train_loss: 1.0425, test_loss: 1.0336, test_f1: 0.4536
 epoch: 52, train_loss: 1.0371, test_loss: 1.0357, test_f1: 0.4537
 epoch: 53, train_loss: 1.0346, test_loss: 1.0396, test_f1: 0.4468
 epoch: 54, train_loss: 1.0376, test_loss: 1.0499, test_f1: 0.4439
 epoch: 55, train_loss: 1.0314, test_loss: 1.0462, test_f1: 0.4439
 epoch: 56, train_loss: 1.0203, test_loss: 1.0327, test_f1: 0.4486
 epoch: 57, train_loss: 1.0237, test_loss: 1.0362, test_f1: 0.4425
 epoch: 58, train_loss: 1.0256, test_loss: 1.0317, test_f1: 0.4516
 epoch: 59, train_loss: 1.0291, test_loss: 1.0340, test_f1: 0.4388
 epoch: 60, train_loss: 1.0068, test_loss: 1.0222, test_f1: 0.4487
 epoch: 61, train_loss: 1.0076, test_loss: 1.0342, test_f1: 0.4437
 epoch: 62, train_loss: 1.0209, test_loss: 1.0249, test_f1: 0.4525
 epoch: 63, train_loss: 1.0088, test_loss: 1.0367, test_f1: 0.4432
 epoch: 64, train_loss: 1.0076, test_loss: 1.0335, test_f1: 0.4387
 epoch: 65, train_loss: 1.0060, test_loss: 1.0183, test_f1: 0.4558
 epoch: 66, train_loss: 1.0118, test_loss: 1.0379, test_f1: 0.4444
 epoch: 67, train_loss: 1.0108, test_loss: 1.0374, test_f1: 0.4390
 epoch: 68, train_loss: 1.0009, test_loss: 1.0275, test_f1: 0.4457
 epoch: 69, train_loss: 0.9969, test_loss: 1.0198, test_f1: 0.4566
 epoch: 70, train_loss: 0.9957, test_loss: 1.0355, test_f1: 0.4414
 epoch: 71, train_loss: 0.9950, test_loss: 1.0222, test_f1: 0.4518
 epoch: 72, train_loss: 1.0096, test_loss: 1.0228, test_f1: 0.4611
 epoch: 73, train_loss: 1.0072, test_loss: 1.0292, test_f1: 0.4516
 epoch: 74, train_loss: 1.0118, test_loss: 1.0380, test_f1: 0.4552
 epoch: 75, train_loss: 1.0027, test_loss: 1.0218, test_f1: 0.4457
 epoch: 76, train_loss: 1.0020, test_loss: 1.0103, test_f1: 0.4583
 epoch: 77, train_loss: 0.9965, test_loss: 1.0195, test_f1: 0.4558
 epoch: 78, train_loss: 0.9976, test_loss: 1.0258, test_f1: 0.4473
 epoch: 79, train_loss: 1.0030, test_loss: 1.0238, test_f1: 0.4697
 epoch: 80, train_loss: 0.9914, test_loss: 1.0188, test_f1: 0.4644
 epoch: 81, train_loss: 0.9933, test_loss: 1.0195, test_f1: 0.4511
 epoch: 82, train_loss: 0.9867, test_loss: 1.0156, test_f1: 0.4561
 epoch: 83, train_loss: 0.9922, test_loss: 1.0167, test_f1: 0.4510
 epoch: 84, train_loss: 0.9793, test_loss: 1.0127, test_f1: 0.4498
 epoch: 85, train_loss: 0.9856, test_loss: 1.0194, test_f1: 0.4545
 epoch: 86, train_loss: 0.9875, test_loss: 1.0280, test_f1: 0.4811
 epoch: 87, train_loss: 0.9814, test_loss: 1.0207, test_f1: 0.4645
 epoch: 88, train_loss: 0.9761, test_loss: 1.0329, test_f1: 0.4408
 epoch: 89, train_loss: 0.9820, test_loss: 1.0276, test_f1: 0.4483
 epoch: 90, train_loss: 0.9860, test_loss: 1.0166, test_f1: 0.4588
 epoch: 91, train_loss: 0.9733, test_loss: 1.0090, test_f1: 0.4656
 epoch: 92, train_loss: 0.9718, test_loss: 1.0099, test_f1: 0.4692
 epoch: 93, train_loss: 0.9805, test_loss: 1.0245, test_f1: 0.4636
 epoch: 94, train_loss: 0.9772, test_loss: 1.0149, test_f1: 0.4694
 epoch: 95, train_loss: 0.9850, test_loss: 1.0110, test_f1: 0.4698
 epoch: 96, train_loss: 0.9771, test_loss: 1.0202, test_f1: 0.4746
 epoch: 97, train_loss: 0.9735, test_loss: 1.0224, test_f1: 0.4566
 epoch: 98, train_loss: 0.9806, test_loss: 1.0166, test_f1: 0.4712
 epoch: 99, train_loss: 0.9745, test_loss: 1.0224, test_f1: 0.4771
##################ITERATION #7 ****************************************
 epoch: 0, train_loss: 1.3915, test_loss: 1.3044, test_f1: 0.2274
 epoch: 1, train_loss: 1.2869, test_loss: 1.2724, test_f1: 0.2301
 epoch: 2, train_loss: 1.2667, test_loss: 1.2412, test_f1: 0.3053
 epoch: 3, train_loss: 1.2629, test_loss: 1.2116, test_f1: 0.3175
 epoch: 4, train_loss: 1.2480, test_loss: 1.1961, test_f1: 0.3526
 epoch: 5, train_loss: 1.2441, test_loss: 1.1873, test_f1: 0.3566
 epoch: 6, train_loss: 1.2275, test_loss: 1.1805, test_f1: 0.3806
 epoch: 7, train_loss: 1.2179, test_loss: 1.1626, test_f1: 0.3736
 epoch: 8, train_loss: 1.2085, test_loss: 1.1547, test_f1: 0.3948
 epoch: 9, train_loss: 1.1979, test_loss: 1.1505, test_f1: 0.4093
 epoch: 10, train_loss: 1.2009, test_loss: 1.1351, test_f1: 0.4156
 epoch: 11, train_loss: 1.1937, test_loss: 1.1296, test_f1: 0.4236
 epoch: 12, train_loss: 1.1854, test_loss: 1.1240, test_f1: 0.4410
 epoch: 13, train_loss: 1.1730, test_loss: 1.1205, test_f1: 0.4321
 epoch: 14, train_loss: 1.1646, test_loss: 1.1080, test_f1: 0.4328
 epoch: 15, train_loss: 1.1638, test_loss: 1.1017, test_f1: 0.4374
 epoch: 16, train_loss: 1.1575, test_loss: 1.0876, test_f1: 0.4473
 epoch: 17, train_loss: 1.1432, test_loss: 1.1008, test_f1: 0.4372
 epoch: 18, train_loss: 1.1409, test_loss: 1.0829, test_f1: 0.4452
 epoch: 19, train_loss: 1.1298, test_loss: 1.0785, test_f1: 0.4476
 epoch: 20, train_loss: 1.1279, test_loss: 1.0649, test_f1: 0.4456
 epoch: 21, train_loss: 1.1303, test_loss: 1.0657, test_f1: 0.4424
 epoch: 22, train_loss: 1.1164, test_loss: 1.0710, test_f1: 0.4485
 epoch: 23, train_loss: 1.1087, test_loss: 1.0549, test_f1: 0.4653
 epoch: 24, train_loss: 1.1076, test_loss: 1.0633, test_f1: 0.4539
 epoch: 25, train_loss: 1.0975, test_loss: 1.0520, test_f1: 0.4463
 epoch: 26, train_loss: 1.0936, test_loss: 1.0427, test_f1: 0.4621
 epoch: 27, train_loss: 1.0918, test_loss: 1.0673, test_f1: 0.4537
 epoch: 28, train_loss: 1.0799, test_loss: 1.0384, test_f1: 0.4633
 epoch: 29, train_loss: 1.0826, test_loss: 1.0833, test_f1: 0.4370
 epoch: 30, train_loss: 1.0839, test_loss: 1.0419, test_f1: 0.4549
 epoch: 31, train_loss: 1.0651, test_loss: 1.0280, test_f1: 0.4744
 epoch: 32, train_loss: 1.0642, test_loss: 1.0167, test_f1: 0.4738
 epoch: 33, train_loss: 1.0669, test_loss: 1.0545, test_f1: 0.4466
 epoch: 34, train_loss: 1.0576, test_loss: 1.0276, test_f1: 0.4665
 epoch: 35, train_loss: 1.0575, test_loss: 1.0589, test_f1: 0.4385
 epoch: 36, train_loss: 1.0610, test_loss: 1.0463, test_f1: 0.4432
 epoch: 37, train_loss: 1.0471, test_loss: 1.0223, test_f1: 0.4611
 epoch: 38, train_loss: 1.0427, test_loss: 1.0106, test_f1: 0.4655
 epoch: 39, train_loss: 1.0382, test_loss: 1.0122, test_f1: 0.4774
 epoch: 40, train_loss: 1.0370, test_loss: 1.0047, test_f1: 0.4608
 epoch: 41, train_loss: 1.0340, test_loss: 1.0046, test_f1: 0.4643
 epoch: 42, train_loss: 1.0265, test_loss: 1.0242, test_f1: 0.4563
 epoch: 43, train_loss: 1.0247, test_loss: 0.9899, test_f1: 0.4734
 epoch: 44, train_loss: 1.0221, test_loss: 1.0480, test_f1: 0.4406
 epoch: 45, train_loss: 1.0328, test_loss: 1.0061, test_f1: 0.4784
 epoch: 46, train_loss: 1.0140, test_loss: 1.0074, test_f1: 0.4551
 epoch: 47, train_loss: 1.0100, test_loss: 0.9997, test_f1: 0.4477
 epoch: 48, train_loss: 1.0181, test_loss: 0.9760, test_f1: 0.4693
 epoch: 49, train_loss: 1.0142, test_loss: 1.0758, test_f1: 0.4576
 epoch: 50, train_loss: 1.0187, test_loss: 1.0607, test_f1: 0.4667
 epoch: 51, train_loss: 0.9922, test_loss: 1.0237, test_f1: 0.4720
 epoch: 52, train_loss: 0.9905, test_loss: 0.9954, test_f1: 0.4671
 epoch: 53, train_loss: 0.9976, test_loss: 1.0815, test_f1: 0.4569
 epoch: 54, train_loss: 0.9947, test_loss: 1.0107, test_f1: 0.4573
 epoch: 55, train_loss: 0.9920, test_loss: 1.0352, test_f1: 0.4569
 epoch: 56, train_loss: 0.9793, test_loss: 1.0301, test_f1: 0.4633
 epoch: 57, train_loss: 0.9827, test_loss: 1.0752, test_f1: 0.4496
 epoch: 58, train_loss: 0.9716, test_loss: 1.0098, test_f1: 0.4615
 epoch: 59, train_loss: 0.9712, test_loss: 1.0228, test_f1: 0.4489
 epoch: 60, train_loss: 0.9861, test_loss: 1.0731, test_f1: 0.4539
 epoch: 61, train_loss: 0.9713, test_loss: 0.9960, test_f1: 0.4626
 epoch: 62, train_loss: 0.9731, test_loss: 1.0641, test_f1: 0.4492
 epoch: 63, train_loss: 0.9714, test_loss: 1.0858, test_f1: 0.4560
 epoch: 64, train_loss: 0.9780, test_loss: 1.0702, test_f1: 0.4481
 epoch: 65, train_loss: 0.9663, test_loss: 1.0219, test_f1: 0.4597
 epoch: 66, train_loss: 0.9640, test_loss: 1.0132, test_f1: 0.4446
 epoch: 67, train_loss: 0.9587, test_loss: 1.0490, test_f1: 0.4527
 epoch: 68, train_loss: 0.9666, test_loss: 1.0334, test_f1: 0.4471
 epoch: 69, train_loss: 0.9652, test_loss: 1.0707, test_f1: 0.4551
 epoch: 70, train_loss: 0.9612, test_loss: 1.0285, test_f1: 0.4551
 epoch: 71, train_loss: 0.9578, test_loss: 1.0359, test_f1: 0.4495
 epoch: 72, train_loss: 0.9627, test_loss: 1.0316, test_f1: 0.4581
 epoch: 73, train_loss: 0.9755, test_loss: 1.0123, test_f1: 0.4498
 epoch: 74, train_loss: 0.9466, test_loss: 1.0356, test_f1: 0.4530
 epoch: 75, train_loss: 0.9581, test_loss: 1.0113, test_f1: 0.4663
 epoch: 76, train_loss: 0.9748, test_loss: 1.0483, test_f1: 0.4555
 epoch: 77, train_loss: 0.9496, test_loss: 1.0274, test_f1: 0.4530
 epoch: 78, train_loss: 0.9544, test_loss: 1.0010, test_f1: 0.4679
 epoch: 79, train_loss: 0.9508, test_loss: 0.9942, test_f1: 0.4710
 epoch: 80, train_loss: 0.9583, test_loss: 1.0604, test_f1: 0.4592
 epoch: 81, train_loss: 0.9427, test_loss: 1.0224, test_f1: 0.4524
 epoch: 82, train_loss: 0.9409, test_loss: 1.0927, test_f1: 0.4602
 epoch: 83, train_loss: 0.9386, test_loss: 1.0421, test_f1: 0.4628
 epoch: 84, train_loss: 0.9256, test_loss: 1.0617, test_f1: 0.4675
 epoch: 85, train_loss: 0.9366, test_loss: 1.0545, test_f1: 0.4640
 epoch: 86, train_loss: 0.9376, test_loss: 1.0579, test_f1: 0.4699
 epoch: 87, train_loss: 0.9395, test_loss: 1.0408, test_f1: 0.4677
 epoch: 88, train_loss: 0.9313, test_loss: 1.0107, test_f1: 0.4665
 epoch: 89, train_loss: 0.9294, test_loss: 0.9913, test_f1: 0.4713
 epoch: 90, train_loss: 0.9312, test_loss: 1.0474, test_f1: 0.4606
 epoch: 91, train_loss: 0.9299, test_loss: 1.0545, test_f1: 0.4699
 epoch: 92, train_loss: 0.9169, test_loss: 0.9987, test_f1: 0.4819
 epoch: 93, train_loss: 0.9216, test_loss: 1.0527, test_f1: 0.4619
 epoch: 94, train_loss: 0.9278, test_loss: 1.0472, test_f1: 0.4757
 epoch: 95, train_loss: 0.9235, test_loss: 0.9742, test_f1: 0.4918
 epoch: 96, train_loss: 0.9295, test_loss: 1.0715, test_f1: 0.4706
 epoch: 97, train_loss: 0.9205, test_loss: 1.0842, test_f1: 0.4636
 epoch: 98, train_loss: 0.9129, test_loss: 1.0054, test_f1: 0.4729
 epoch: 99, train_loss: 0.9128, test_loss: 1.0121, test_f1: 0.4762
##################ITERATION #8 ****************************************
 epoch: 0, train_loss: 1.4150, test_loss: 1.3241, test_f1: 0.2274
 epoch: 1, train_loss: 1.2855, test_loss: 1.2743, test_f1: 0.2269
 epoch: 2, train_loss: 1.2778, test_loss: 1.2470, test_f1: 0.2274
 epoch: 3, train_loss: 1.2576, test_loss: 1.2286, test_f1: 0.2861
 epoch: 4, train_loss: 1.2468, test_loss: 1.2129, test_f1: 0.3052
 epoch: 5, train_loss: 1.2333, test_loss: 1.2038, test_f1: 0.3291
 epoch: 6, train_loss: 1.2266, test_loss: 1.1954, test_f1: 0.3430
 epoch: 7, train_loss: 1.2232, test_loss: 1.1881, test_f1: 0.3505
 epoch: 8, train_loss: 1.2138, test_loss: 1.1763, test_f1: 0.3663
 epoch: 9, train_loss: 1.2061, test_loss: 1.1783, test_f1: 0.3621
 epoch: 10, train_loss: 1.2035, test_loss: 1.1626, test_f1: 0.3769
 epoch: 11, train_loss: 1.1903, test_loss: 1.1568, test_f1: 0.3769
 epoch: 12, train_loss: 1.1956, test_loss: 1.1436, test_f1: 0.3833
 epoch: 13, train_loss: 1.1888, test_loss: 1.1396, test_f1: 0.3904
 epoch: 14, train_loss: 1.1801, test_loss: 1.1372, test_f1: 0.3908
 epoch: 15, train_loss: 1.1733, test_loss: 1.1262, test_f1: 0.4059
 epoch: 16, train_loss: 1.1624, test_loss: 1.1264, test_f1: 0.4104
 epoch: 17, train_loss: 1.1568, test_loss: 1.1163, test_f1: 0.4027
 epoch: 18, train_loss: 1.1528, test_loss: 1.1075, test_f1: 0.4039
 epoch: 19, train_loss: 1.1408, test_loss: 1.0962, test_f1: 0.4353
 epoch: 20, train_loss: 1.1517, test_loss: 1.0921, test_f1: 0.4358
 epoch: 21, train_loss: 1.1349, test_loss: 1.0932, test_f1: 0.4294
 epoch: 22, train_loss: 1.1372, test_loss: 1.0896, test_f1: 0.4456
 epoch: 23, train_loss: 1.1327, test_loss: 1.0765, test_f1: 0.4470
 epoch: 24, train_loss: 1.1344, test_loss: 1.0744, test_f1: 0.4441
 epoch: 25, train_loss: 1.1195, test_loss: 1.0701, test_f1: 0.4444
 epoch: 26, train_loss: 1.1200, test_loss: 1.0677, test_f1: 0.4527
 epoch: 27, train_loss: 1.1181, test_loss: 1.0628, test_f1: 0.4610
 epoch: 28, train_loss: 1.1116, test_loss: 1.0554, test_f1: 0.4480
 epoch: 29, train_loss: 1.1060, test_loss: 1.0488, test_f1: 0.4459
 epoch: 30, train_loss: 1.1000, test_loss: 1.0335, test_f1: 0.4866
 epoch: 31, train_loss: 1.0956, test_loss: 1.0421, test_f1: 0.4561
 epoch: 32, train_loss: 1.0938, test_loss: 1.0418, test_f1: 0.4647
 epoch: 33, train_loss: 1.0857, test_loss: 1.0470, test_f1: 0.4729
 epoch: 34, train_loss: 1.0863, test_loss: 1.0266, test_f1: 0.4938
 epoch: 35, train_loss: 1.0809, test_loss: 1.0843, test_f1: 0.4441
 epoch: 36, train_loss: 1.0868, test_loss: 1.0321, test_f1: 0.4985
 epoch: 37, train_loss: 1.0795, test_loss: 1.0137, test_f1: 0.4711
 epoch: 38, train_loss: 1.0636, test_loss: 1.0127, test_f1: 0.4833
 epoch: 39, train_loss: 1.0634, test_loss: 1.0196, test_f1: 0.4837
 epoch: 40, train_loss: 1.0508, test_loss: 1.0279, test_f1: 0.4714
 epoch: 41, train_loss: 1.0656, test_loss: 1.0115, test_f1: 0.4773
 epoch: 42, train_loss: 1.0521, test_loss: 1.0033, test_f1: 0.4786
 epoch: 43, train_loss: 1.0547, test_loss: 0.9981, test_f1: 0.5001
 epoch: 44, train_loss: 1.0461, test_loss: 1.0084, test_f1: 0.4914
 epoch: 45, train_loss: 1.0561, test_loss: 1.0496, test_f1: 0.4590
 epoch: 46, train_loss: 1.0500, test_loss: 1.0083, test_f1: 0.4619
 epoch: 47, train_loss: 1.0485, test_loss: 1.0051, test_f1: 0.4927
 epoch: 48, train_loss: 1.0398, test_loss: 1.0071, test_f1: 0.4716
 epoch: 49, train_loss: 1.0408, test_loss: 1.0807, test_f1: 0.4275
 epoch: 50, train_loss: 1.0399, test_loss: 1.0041, test_f1: 0.4752
 epoch: 51, train_loss: 1.0318, test_loss: 1.0266, test_f1: 0.4604
 epoch: 52, train_loss: 1.0253, test_loss: 1.0040, test_f1: 0.4755
 epoch: 53, train_loss: 1.0174, test_loss: 1.0337, test_f1: 0.4489
 epoch: 54, train_loss: 1.0298, test_loss: 0.9901, test_f1: 0.4768
 epoch: 55, train_loss: 1.0116, test_loss: 1.0266, test_f1: 0.4658
 epoch: 56, train_loss: 1.0171, test_loss: 0.9952, test_f1: 0.4830
 epoch: 57, train_loss: 1.0176, test_loss: 1.0245, test_f1: 0.4632
 epoch: 58, train_loss: 1.0148, test_loss: 0.9895, test_f1: 0.4861
 epoch: 59, train_loss: 1.0146, test_loss: 1.0256, test_f1: 0.4594
 epoch: 60, train_loss: 1.0092, test_loss: 0.9920, test_f1: 0.4848
 epoch: 61, train_loss: 1.0191, test_loss: 0.9844, test_f1: 0.4862
 epoch: 62, train_loss: 1.0127, test_loss: 1.0735, test_f1: 0.4541
 epoch: 63, train_loss: 1.0075, test_loss: 1.0663, test_f1: 0.4581
 epoch: 64, train_loss: 1.0088, test_loss: 1.0153, test_f1: 0.4643
 epoch: 65, train_loss: 1.0097, test_loss: 1.0482, test_f1: 0.4539
 epoch: 66, train_loss: 1.0130, test_loss: 1.0179, test_f1: 0.4758
 epoch: 67, train_loss: 1.0025, test_loss: 1.0071, test_f1: 0.4689
 epoch: 68, train_loss: 1.0050, test_loss: 1.0277, test_f1: 0.4647
 epoch: 69, train_loss: 0.9946, test_loss: 1.0334, test_f1: 0.4587
 epoch: 70, train_loss: 0.9982, test_loss: 0.9807, test_f1: 0.4758
 epoch: 71, train_loss: 0.9973, test_loss: 1.0901, test_f1: 0.4526
 epoch: 72, train_loss: 0.9972, test_loss: 0.9886, test_f1: 0.4797
 epoch: 73, train_loss: 0.9939, test_loss: 1.0233, test_f1: 0.4513
 epoch: 74, train_loss: 0.9973, test_loss: 1.0482, test_f1: 0.4519
 epoch: 75, train_loss: 1.0030, test_loss: 0.9852, test_f1: 0.4974
 epoch: 76, train_loss: 1.0009, test_loss: 1.0754, test_f1: 0.4777
 epoch: 77, train_loss: 0.9945, test_loss: 0.9954, test_f1: 0.4630
 epoch: 78, train_loss: 0.9875, test_loss: 0.9844, test_f1: 0.4745
 epoch: 79, train_loss: 0.9858, test_loss: 1.0966, test_f1: 0.4561
 epoch: 80, train_loss: 0.9985, test_loss: 0.9756, test_f1: 0.4942
 epoch: 81, train_loss: 1.0001, test_loss: 0.9789, test_f1: 0.4780
 epoch: 82, train_loss: 0.9943, test_loss: 1.1120, test_f1: 0.4656
 epoch: 83, train_loss: 0.9896, test_loss: 0.9918, test_f1: 0.4616
 epoch: 84, train_loss: 0.9813, test_loss: 0.9666, test_f1: 0.5000
 epoch: 85, train_loss: 0.9875, test_loss: 1.1014, test_f1: 0.4682
 epoch: 86, train_loss: 0.9851, test_loss: 1.0640, test_f1: 0.4728
 epoch: 87, train_loss: 0.9797, test_loss: 1.0626, test_f1: 0.4690
 epoch: 88, train_loss: 0.9929, test_loss: 0.9665, test_f1: 0.5027
 epoch: 89, train_loss: 0.9872, test_loss: 1.0908, test_f1: 0.4632
 epoch: 90, train_loss: 0.9846, test_loss: 0.9719, test_f1: 0.4912
 epoch: 91, train_loss: 0.9836, test_loss: 1.1436, test_f1: 0.4674
 epoch: 92, train_loss: 0.9735, test_loss: 1.0602, test_f1: 0.4725
 epoch: 93, train_loss: 0.9813, test_loss: 0.9952, test_f1: 0.4817
 epoch: 94, train_loss: 0.9912, test_loss: 1.0547, test_f1: 0.4715
 epoch: 95, train_loss: 0.9711, test_loss: 1.0207, test_f1: 0.4780
 epoch: 96, train_loss: 0.9773, test_loss: 1.0188, test_f1: 0.4761
 epoch: 97, train_loss: 0.9777, test_loss: 0.9657, test_f1: 0.4979
 epoch: 98, train_loss: 0.9670, test_loss: 1.1028, test_f1: 0.4765
 epoch: 99, train_loss: 0.9702, test_loss: 1.0191, test_f1: 0.4767
##################ITERATION #9 ****************************************
 epoch: 0, train_loss: 1.4021, test_loss: 1.3234, test_f1: 0.2274
 epoch: 1, train_loss: 1.2962, test_loss: 1.2964, test_f1: 0.2274
 epoch: 2, train_loss: 1.2708, test_loss: 1.2692, test_f1: 0.2367
 epoch: 3, train_loss: 1.2479, test_loss: 1.2323, test_f1: 0.2530
 epoch: 4, train_loss: 1.2310, test_loss: 1.2032, test_f1: 0.2935
 epoch: 5, train_loss: 1.2273, test_loss: 1.1901, test_f1: 0.3207
 epoch: 6, train_loss: 1.2158, test_loss: 1.1872, test_f1: 0.3253
 epoch: 7, train_loss: 1.2125, test_loss: 1.1795, test_f1: 0.3742
 epoch: 8, train_loss: 1.1980, test_loss: 1.1699, test_f1: 0.3599
 epoch: 9, train_loss: 1.1907, test_loss: 1.1591, test_f1: 0.3644
 epoch: 10, train_loss: 1.1906, test_loss: 1.1600, test_f1: 0.3671
 epoch: 11, train_loss: 1.1940, test_loss: 1.1482, test_f1: 0.3883
 epoch: 12, train_loss: 1.1675, test_loss: 1.1426, test_f1: 0.3787
 epoch: 13, train_loss: 1.1656, test_loss: 1.1274, test_f1: 0.4104
 epoch: 14, train_loss: 1.1767, test_loss: 1.1205, test_f1: 0.4052
 epoch: 15, train_loss: 1.1620, test_loss: 1.1158, test_f1: 0.4071
 epoch: 16, train_loss: 1.1531, test_loss: 1.1119, test_f1: 0.4307
 epoch: 17, train_loss: 1.1470, test_loss: 1.1226, test_f1: 0.4158
 epoch: 18, train_loss: 1.1451, test_loss: 1.1218, test_f1: 0.4342
 epoch: 19, train_loss: 1.1436, test_loss: 1.0924, test_f1: 0.4398
 epoch: 20, train_loss: 1.1260, test_loss: 1.1051, test_f1: 0.4204
 epoch: 21, train_loss: 1.1278, test_loss: 1.0925, test_f1: 0.4558
 epoch: 22, train_loss: 1.1225, test_loss: 1.0921, test_f1: 0.4320
 epoch: 23, train_loss: 1.1124, test_loss: 1.0837, test_f1: 0.4399
 epoch: 24, train_loss: 1.1140, test_loss: 1.0668, test_f1: 0.4393
 epoch: 25, train_loss: 1.0990, test_loss: 1.0578, test_f1: 0.4574
 epoch: 26, train_loss: 1.0884, test_loss: 1.0552, test_f1: 0.4653
 epoch: 27, train_loss: 1.0863, test_loss: 1.0617, test_f1: 0.4734
 epoch: 28, train_loss: 1.0958, test_loss: 1.0607, test_f1: 0.4316
 epoch: 29, train_loss: 1.0787, test_loss: 1.0440, test_f1: 0.4643
 epoch: 30, train_loss: 1.0729, test_loss: 1.0517, test_f1: 0.4630
 epoch: 31, train_loss: 1.0506, test_loss: 1.0458, test_f1: 0.4416
 epoch: 32, train_loss: 1.0472, test_loss: 1.0644, test_f1: 0.4583
 epoch: 33, train_loss: 1.0476, test_loss: 1.0510, test_f1: 0.4549
 epoch: 34, train_loss: 1.0421, test_loss: 1.0470, test_f1: 0.4571
 epoch: 35, train_loss: 1.0355, test_loss: 1.0481, test_f1: 0.4549
 epoch: 36, train_loss: 1.0306, test_loss: 1.0388, test_f1: 0.4597
 epoch: 37, train_loss: 1.0382, test_loss: 1.0696, test_f1: 0.4660
 epoch: 38, train_loss: 1.0172, test_loss: 1.0631, test_f1: 0.4493
 epoch: 39, train_loss: 1.0125, test_loss: 1.0311, test_f1: 0.4612
 epoch: 40, train_loss: 1.0191, test_loss: 1.0564, test_f1: 0.4562
 epoch: 41, train_loss: 1.0065, test_loss: 1.0491, test_f1: 0.4672
 epoch: 42, train_loss: 1.0076, test_loss: 1.0654, test_f1: 0.4608
 epoch: 43, train_loss: 1.0132, test_loss: 1.0608, test_f1: 0.4626
 epoch: 44, train_loss: 1.0000, test_loss: 1.0625, test_f1: 0.4686
 epoch: 45, train_loss: 0.9923, test_loss: 1.0811, test_f1: 0.4447
 epoch: 46, train_loss: 0.9974, test_loss: 1.0465, test_f1: 0.4602
 epoch: 47, train_loss: 0.9953, test_loss: 1.0695, test_f1: 0.4584
 epoch: 48, train_loss: 0.9863, test_loss: 1.0679, test_f1: 0.4696
 epoch: 49, train_loss: 0.9764, test_loss: 1.0496, test_f1: 0.4811
 epoch: 50, train_loss: 0.9816, test_loss: 1.0665, test_f1: 0.4640
 epoch: 51, train_loss: 0.9667, test_loss: 1.0519, test_f1: 0.4618
 epoch: 52, train_loss: 0.9698, test_loss: 1.0762, test_f1: 0.4578
 epoch: 53, train_loss: 0.9703, test_loss: 1.0645, test_f1: 0.4629
 epoch: 54, train_loss: 0.9612, test_loss: 1.0590, test_f1: 0.4598
 epoch: 55, train_loss: 0.9634, test_loss: 1.0706, test_f1: 0.4654
 epoch: 56, train_loss: 0.9495, test_loss: 1.0780, test_f1: 0.4609
 epoch: 57, train_loss: 0.9515, test_loss: 1.0845, test_f1: 0.4553
 epoch: 58, train_loss: 0.9578, test_loss: 1.0680, test_f1: 0.4645
 epoch: 59, train_loss: 0.9503, test_loss: 1.0788, test_f1: 0.4748
 epoch: 60, train_loss: 0.9538, test_loss: 1.0690, test_f1: 0.4543
 epoch: 61, train_loss: 0.9565, test_loss: 1.0739, test_f1: 0.4653
 epoch: 62, train_loss: 0.9530, test_loss: 1.0720, test_f1: 0.4644
 epoch: 63, train_loss: 0.9533, test_loss: 1.0816, test_f1: 0.4579
 epoch: 64, train_loss: 0.9480, test_loss: 1.0741, test_f1: 0.4686
 epoch: 65, train_loss: 0.9497, test_loss: 1.0823, test_f1: 0.4626
 epoch: 66, train_loss: 0.9471, test_loss: 1.0977, test_f1: 0.4665
 epoch: 67, train_loss: 0.9447, test_loss: 1.0955, test_f1: 0.4649
 epoch: 68, train_loss: 0.9472, test_loss: 1.0899, test_f1: 0.4641
 epoch: 69, train_loss: 0.9454, test_loss: 1.1132, test_f1: 0.4699
 epoch: 70, train_loss: 0.9341, test_loss: 1.0912, test_f1: 0.4711
 epoch: 71, train_loss: 0.9375, test_loss: 1.0871, test_f1: 0.4563
 epoch: 72, train_loss: 0.9492, test_loss: 1.0995, test_f1: 0.4772
 epoch: 73, train_loss: 0.9278, test_loss: 1.0955, test_f1: 0.4695
 epoch: 74, train_loss: 0.9424, test_loss: 1.0847, test_f1: 0.4836
 epoch: 75, train_loss: 0.9339, test_loss: 1.0952, test_f1: 0.4657
 epoch: 76, train_loss: 0.9294, test_loss: 1.0931, test_f1: 0.4753
 epoch: 77, train_loss: 0.9373, test_loss: 1.1131, test_f1: 0.4786
 epoch: 78, train_loss: 0.9338, test_loss: 1.1022, test_f1: 0.4690
 epoch: 79, train_loss: 0.9315, test_loss: 1.0947, test_f1: 0.4697
 epoch: 80, train_loss: 0.9257, test_loss: 1.1090, test_f1: 0.4776
 epoch: 81, train_loss: 0.9210, test_loss: 1.1122, test_f1: 0.4565
 epoch: 82, train_loss: 0.9251, test_loss: 1.1263, test_f1: 0.4681
 epoch: 83, train_loss: 0.9277, test_loss: 1.1004, test_f1: 0.4716
 epoch: 84, train_loss: 0.9217, test_loss: 1.1214, test_f1: 0.4712
 epoch: 85, train_loss: 0.9136, test_loss: 1.1239, test_f1: 0.4773
 epoch: 86, train_loss: 0.9186, test_loss: 1.0813, test_f1: 0.4705
 epoch: 87, train_loss: 0.9123, test_loss: 1.0986, test_f1: 0.4795
 epoch: 88, train_loss: 0.9136, test_loss: 1.1256, test_f1: 0.4766
 epoch: 89, train_loss: 0.9160, test_loss: 1.1270, test_f1: 0.4618
 epoch: 90, train_loss: 0.9216, test_loss: 1.1126, test_f1: 0.4574
 epoch: 91, train_loss: 0.9172, test_loss: 1.0957, test_f1: 0.4669
 epoch: 92, train_loss: 0.9052, test_loss: 1.1365, test_f1: 0.4762
 epoch: 93, train_loss: 0.9149, test_loss: 1.1410, test_f1: 0.4570
 epoch: 94, train_loss: 0.9041, test_loss: 1.1357, test_f1: 0.4703
 epoch: 95, train_loss: 0.9098, test_loss: 1.1182, test_f1: 0.4757
 epoch: 96, train_loss: 0.9019, test_loss: 1.1128, test_f1: 0.4658
 epoch: 97, train_loss: 0.9024, test_loss: 1.1256, test_f1: 0.4828
 epoch: 98, train_loss: 0.9044, test_loss: 1.1495, test_f1: 0.4555
 epoch: 99, train_loss: 0.9056, test_loss: 1.1372, test_f1: 0.4603

Training completed in 491.64 seconds
Best F1: 0.5101 at epoch 52
Mean F1 across iterations: 0.4921  0.0124
========================FINAL RESULTS================================
FEGIN weighted F1: 0.5101  0.0124
python main.py --data ltspice_examples --representation component_component --model FEGIN --layers 4 --hiddens 16 --batch_size 256 --lr 0.001 --emb_size 512 --epochs 100 --save_appendix component_component_L4_H16_BS256_LR0.001_E512 --no_val
-----



STDERR:
  File "main.py", line 370, in <module>
    main()
  File "main.py", line 254, in main
    dataset = dataset_class(
  File "/home/philip/projects/llm_inference_code_repo/Circuit-Completion-Using-GNNs/component_classification_with_link_prediction_head/evaluation/FEGIN/kernel/circuit_datasets.py", line 15, in __init__
    self.data, self.slices = torch.load(self.processed_paths[0])
  File "/home/philip/.local/lib/python3.8/site-packages/torch/serialization.py", line 1040, in load
    warnings.warn(
  File "/usr/lib/python3.8/warnings.py", line 109, in _showwarnmsg
    sw(msg.message, msg.category, msg.filename, msg.lineno,
  File "main.py", line 47, in warn_with_traceback
    traceback.print_stack(file=log)
/home/philip/projects/llm_inference_code_repo/Circuit-Completion-Using-GNNs/component_classification_with_link_prediction_head/evaluation/FEGIN/kernel/circuit_datasets.py:15: FutureWarning: You are using `torch.load` with `weights_only=False` (the current default value), which uses the default pickle module implicitly. It is possible to construct malicious pickle data which will execute arbitrary code during unpickling (See https://github.com/pytorch/pytorch/blob/main/SECURITY.md#untrusted-models for more details). In a future release, the default value for `weights_only` will be flipped to `True`. This limits the functions that could be executed during unpickling. Arbitrary objects will no longer be allowed to be loaded via this mode unless they are explicitly allowlisted by the user via `torch.serialization.add_safe_globals`. We recommend you start setting `weights_only=True` for any use case where you don't have full control of the loaded file. Please open an issue on GitHub for any issues related to this experimental feature.
  self.data, self.slices = torch.load(self.processed_paths[0])
