STDOUT:
Results will be saved in /home/philip/projects/ltspice_examples_code_repo/Circuit-Completion-Using-GNNs/component_classification_with_link_prediction_head/evaluation/FEGIN/results/model_FEGIN_dataset_ltspice_demos
Command line input: python main.py --data ltspice_demos --representation component_pin_net --model FEGIN --layers 6 --hiddens 32 --batch_size 128 --lr 0.0001 --emb_size 128 --epochs 100 --save_appendix component_pin_net_L6_H32_BS128_LR0.0001_E128 --no_val
 is saved.
-----
ltspice_demos - FEGIN
Using 6 layers, 32 hidden units, h = 2
Loading component_pin_net representation dataset
ENTERED
Training FEGIN on component_pin_net representation
Train: 1565, Test: 383
##################ITERATION #0 ****************************************
 epoch: 0, train_loss: 1.4095, test_loss: 1.4019, test_f1: 0.0301
 epoch: 1, train_loss: 1.4042, test_loss: 1.3985, test_f1: 0.0301
 epoch: 2, train_loss: 1.4011, test_loss: 1.3947, test_f1: 0.0301
 epoch: 3, train_loss: 1.3979, test_loss: 1.3938, test_f1: 0.0301
 epoch: 4, train_loss: 1.3952, test_loss: 1.3926, test_f1: 0.1001
 epoch: 5, train_loss: 1.3921, test_loss: 1.3906, test_f1: 0.1613
 epoch: 6, train_loss: 1.3897, test_loss: 1.3869, test_f1: 0.1913
 epoch: 7, train_loss: 1.3862, test_loss: 1.3824, test_f1: 0.3195
 epoch: 8, train_loss: 1.3834, test_loss: 1.3795, test_f1: 0.3453
 epoch: 9, train_loss: 1.3785, test_loss: 1.3754, test_f1: 0.3223
 epoch: 10, train_loss: 1.3739, test_loss: 1.3715, test_f1: 0.3198
 epoch: 11, train_loss: 1.3686, test_loss: 1.3663, test_f1: 0.3223
 epoch: 12, train_loss: 1.3629, test_loss: 1.3603, test_f1: 0.3036
 epoch: 13, train_loss: 1.3559, test_loss: 1.3528, test_f1: 0.3165
 epoch: 14, train_loss: 1.3475, test_loss: 1.3456, test_f1: 0.2984
 epoch: 15, train_loss: 1.3400, test_loss: 1.3385, test_f1: 0.2756
 epoch: 16, train_loss: 1.3316, test_loss: 1.3303, test_f1: 0.2716
 epoch: 17, train_loss: 1.3233, test_loss: 1.3224, test_f1: 0.2630
 epoch: 18, train_loss: 1.3150, test_loss: 1.3097, test_f1: 0.2586
 epoch: 19, train_loss: 1.3057, test_loss: 1.3011, test_f1: 0.2586
 epoch: 20, train_loss: 1.2939, test_loss: 1.2959, test_f1: 0.2630
 epoch: 21, train_loss: 1.2874, test_loss: 1.2892, test_f1: 0.2540
 epoch: 22, train_loss: 1.2780, test_loss: 1.2810, test_f1: 0.2586
 epoch: 23, train_loss: 1.2672, test_loss: 1.2755, test_f1: 0.2718
 epoch: 24, train_loss: 1.2614, test_loss: 1.2688, test_f1: 0.2759
 epoch: 25, train_loss: 1.2551, test_loss: 1.2597, test_f1: 0.2759
 epoch: 26, train_loss: 1.2462, test_loss: 1.2547, test_f1: 0.2828
 epoch: 27, train_loss: 1.2345, test_loss: 1.2473, test_f1: 0.2799
 epoch: 28, train_loss: 1.2220, test_loss: 1.2429, test_f1: 0.2793
 epoch: 29, train_loss: 1.2210, test_loss: 1.2353, test_f1: 0.2901
 epoch: 30, train_loss: 1.2075, test_loss: 1.2316, test_f1: 0.3187
 epoch: 31, train_loss: 1.2065, test_loss: 1.2251, test_f1: 0.3158
 epoch: 32, train_loss: 1.1954, test_loss: 1.2202, test_f1: 0.3215
 epoch: 33, train_loss: 1.1868, test_loss: 1.2159, test_f1: 0.3243
 epoch: 34, train_loss: 1.1881, test_loss: 1.2155, test_f1: 0.3249
 epoch: 35, train_loss: 1.1747, test_loss: 1.2041, test_f1: 0.3215
 epoch: 36, train_loss: 1.1633, test_loss: 1.2005, test_f1: 0.3249
 epoch: 37, train_loss: 1.1590, test_loss: 1.1959, test_f1: 0.3253
 epoch: 38, train_loss: 1.1532, test_loss: 1.1933, test_f1: 0.3693
 epoch: 39, train_loss: 1.1491, test_loss: 1.1881, test_f1: 0.3968
 epoch: 40, train_loss: 1.1350, test_loss: 1.1811, test_f1: 0.4211
 epoch: 41, train_loss: 1.1418, test_loss: 1.1773, test_f1: 0.4163
 epoch: 42, train_loss: 1.1294, test_loss: 1.1710, test_f1: 0.4197
 epoch: 43, train_loss: 1.1153, test_loss: 1.1670, test_f1: 0.4189
 epoch: 44, train_loss: 1.1145, test_loss: 1.1594, test_f1: 0.4184
 epoch: 45, train_loss: 1.1036, test_loss: 1.1569, test_f1: 0.4210
 epoch: 46, train_loss: 1.1022, test_loss: 1.1516, test_f1: 0.4165
 epoch: 47, train_loss: 1.0946, test_loss: 1.1467, test_f1: 0.4240
 epoch: 48, train_loss: 1.0859, test_loss: 1.1418, test_f1: 0.4189
 epoch: 49, train_loss: 1.0806, test_loss: 1.1401, test_f1: 0.4240
 epoch: 50, train_loss: 1.0751, test_loss: 1.1346, test_f1: 0.4221
 epoch: 51, train_loss: 1.0666, test_loss: 1.1320, test_f1: 0.4314
 epoch: 52, train_loss: 1.0627, test_loss: 1.1312, test_f1: 0.4314
 epoch: 53, train_loss: 1.0617, test_loss: 1.1281, test_f1: 0.4256
 epoch: 54, train_loss: 1.0600, test_loss: 1.1253, test_f1: 0.4337
 epoch: 55, train_loss: 1.0613, test_loss: 1.1222, test_f1: 0.4229
 epoch: 56, train_loss: 1.0633, test_loss: 1.1194, test_f1: 0.4283
 epoch: 57, train_loss: 1.0585, test_loss: 1.1198, test_f1: 0.4337
 epoch: 58, train_loss: 1.0547, test_loss: 1.1179, test_f1: 0.4356
 epoch: 59, train_loss: 1.0446, test_loss: 1.1135, test_f1: 0.4286
 epoch: 60, train_loss: 1.0481, test_loss: 1.1139, test_f1: 0.4352
 epoch: 61, train_loss: 1.0402, test_loss: 1.1123, test_f1: 0.4339
 epoch: 62, train_loss: 1.0541, test_loss: 1.1093, test_f1: 0.4325
 epoch: 63, train_loss: 1.0385, test_loss: 1.1106, test_f1: 0.4420
 epoch: 64, train_loss: 1.0445, test_loss: 1.1054, test_f1: 0.4345
 epoch: 65, train_loss: 1.0359, test_loss: 1.1017, test_f1: 0.4345
 epoch: 66, train_loss: 1.0463, test_loss: 1.1038, test_f1: 0.4344
 epoch: 67, train_loss: 1.0330, test_loss: 1.1008, test_f1: 0.4311
 epoch: 68, train_loss: 1.0337, test_loss: 1.0982, test_f1: 0.4351
 epoch: 69, train_loss: 1.0349, test_loss: 1.0998, test_f1: 0.4434
 epoch: 70, train_loss: 1.0243, test_loss: 1.0973, test_f1: 0.4540
 epoch: 71, train_loss: 1.0311, test_loss: 1.0961, test_f1: 0.4457
 epoch: 72, train_loss: 1.0181, test_loss: 1.0957, test_f1: 0.4434
 epoch: 73, train_loss: 1.0249, test_loss: 1.0956, test_f1: 0.4424
 epoch: 74, train_loss: 1.0259, test_loss: 1.0960, test_f1: 0.4384
 epoch: 75, train_loss: 1.0232, test_loss: 1.0944, test_f1: 0.4625
 epoch: 76, train_loss: 1.0157, test_loss: 1.0927, test_f1: 0.4608
 epoch: 77, train_loss: 1.0160, test_loss: 1.0900, test_f1: 0.4578
 epoch: 78, train_loss: 1.0210, test_loss: 1.0912, test_f1: 0.4596
 epoch: 79, train_loss: 1.0155, test_loss: 1.0897, test_f1: 0.4720
 epoch: 80, train_loss: 1.0117, test_loss: 1.0892, test_f1: 0.4596
 epoch: 81, train_loss: 1.0023, test_loss: 1.0889, test_f1: 0.4667
 epoch: 82, train_loss: 1.0053, test_loss: 1.0867, test_f1: 0.4667
 epoch: 83, train_loss: 1.0098, test_loss: 1.0854, test_f1: 0.4667
 epoch: 84, train_loss: 1.0045, test_loss: 1.0799, test_f1: 0.4614
 epoch: 85, train_loss: 1.0052, test_loss: 1.0847, test_f1: 0.4720
 epoch: 86, train_loss: 1.0016, test_loss: 1.0821, test_f1: 0.4720
 epoch: 87, train_loss: 0.9932, test_loss: 1.0871, test_f1: 0.4619
 epoch: 88, train_loss: 0.9983, test_loss: 1.0829, test_f1: 0.4667
 epoch: 89, train_loss: 0.9863, test_loss: 1.0786, test_f1: 0.4722
 epoch: 90, train_loss: 0.9912, test_loss: 1.0753, test_f1: 0.4701
 epoch: 91, train_loss: 0.9924, test_loss: 1.0728, test_f1: 0.4673
 epoch: 92, train_loss: 0.9906, test_loss: 1.0740, test_f1: 0.4619
 epoch: 93, train_loss: 0.9842, test_loss: 1.0742, test_f1: 0.4726
 epoch: 94, train_loss: 0.9803, test_loss: 1.0739, test_f1: 0.4645
 epoch: 95, train_loss: 0.9838, test_loss: 1.0704, test_f1: 0.4645
 epoch: 96, train_loss: 0.9807, test_loss: 1.0690, test_f1: 0.4802
 epoch: 97, train_loss: 0.9753, test_loss: 1.0723, test_f1: 0.4751
 epoch: 98, train_loss: 0.9838, test_loss: 1.0705, test_f1: 0.4619
 epoch: 99, train_loss: 0.9764, test_loss: 1.0685, test_f1: 0.4698
##################ITERATION #1 ****************************************
 epoch: 0, train_loss: 1.3795, test_loss: 1.3826, test_f1: 0.2281
 epoch: 1, train_loss: 1.3682, test_loss: 1.3802, test_f1: 0.2281
 epoch: 2, train_loss: 1.3610, test_loss: 1.3741, test_f1: 0.2281
 epoch: 3, train_loss: 1.3551, test_loss: 1.3683, test_f1: 0.2281
 epoch: 4, train_loss: 1.3483, test_loss: 1.3685, test_f1: 0.2281
 epoch: 5, train_loss: 1.3398, test_loss: 1.3606, test_f1: 0.2583
 epoch: 6, train_loss: 1.3328, test_loss: 1.3510, test_f1: 0.2882
 epoch: 7, train_loss: 1.3241, test_loss: 1.3438, test_f1: 0.3447
 epoch: 8, train_loss: 1.3161, test_loss: 1.3378, test_f1: 0.3515
 epoch: 9, train_loss: 1.3070, test_loss: 1.3305, test_f1: 0.3444
 epoch: 10, train_loss: 1.2992, test_loss: 1.3230, test_f1: 0.3512
 epoch: 11, train_loss: 1.2881, test_loss: 1.3148, test_f1: 0.3546
 epoch: 12, train_loss: 1.2783, test_loss: 1.3065, test_f1: 0.3594
 epoch: 13, train_loss: 1.2671, test_loss: 1.2997, test_f1: 0.3715
 epoch: 14, train_loss: 1.2506, test_loss: 1.2905, test_f1: 0.3651
 epoch: 15, train_loss: 1.2403, test_loss: 1.2820, test_f1: 0.3777
 epoch: 16, train_loss: 1.2270, test_loss: 1.2738, test_f1: 0.3850
 epoch: 17, train_loss: 1.2224, test_loss: 1.2650, test_f1: 0.3820
 epoch: 18, train_loss: 1.2029, test_loss: 1.2582, test_f1: 0.3858
 epoch: 19, train_loss: 1.2014, test_loss: 1.2505, test_f1: 0.3976
 epoch: 20, train_loss: 1.1859, test_loss: 1.2423, test_f1: 0.4014
 epoch: 21, train_loss: 1.1757, test_loss: 1.2367, test_f1: 0.4220
 epoch: 22, train_loss: 1.1667, test_loss: 1.2327, test_f1: 0.4312
 epoch: 23, train_loss: 1.1627, test_loss: 1.2261, test_f1: 0.4294
 epoch: 24, train_loss: 1.1542, test_loss: 1.2218, test_f1: 0.4289
 epoch: 25, train_loss: 1.1466, test_loss: 1.2154, test_f1: 0.4342
 epoch: 26, train_loss: 1.1403, test_loss: 1.2100, test_f1: 0.4314
 epoch: 27, train_loss: 1.1342, test_loss: 1.2032, test_f1: 0.4393
 epoch: 28, train_loss: 1.1206, test_loss: 1.1989, test_f1: 0.4398
 epoch: 29, train_loss: 1.1153, test_loss: 1.1956, test_f1: 0.4389
 epoch: 30, train_loss: 1.1063, test_loss: 1.1897, test_f1: 0.4393
 epoch: 31, train_loss: 1.1068, test_loss: 1.1851, test_f1: 0.4393
 epoch: 32, train_loss: 1.1069, test_loss: 1.1800, test_f1: 0.4393
 epoch: 33, train_loss: 1.0945, test_loss: 1.1777, test_f1: 0.4393
 epoch: 34, train_loss: 1.0939, test_loss: 1.1721, test_f1: 0.4349
 epoch: 35, train_loss: 1.0819, test_loss: 1.1685, test_f1: 0.4349
 epoch: 36, train_loss: 1.0769, test_loss: 1.1646, test_f1: 0.4349
 epoch: 37, train_loss: 1.0731, test_loss: 1.1637, test_f1: 0.4349
 epoch: 38, train_loss: 1.0646, test_loss: 1.1591, test_f1: 0.4396
 epoch: 39, train_loss: 1.0601, test_loss: 1.1560, test_f1: 0.4345
 epoch: 40, train_loss: 1.0486, test_loss: 1.1525, test_f1: 0.4400
 epoch: 41, train_loss: 1.0491, test_loss: 1.1458, test_f1: 0.4418
 epoch: 42, train_loss: 1.0538, test_loss: 1.1423, test_f1: 0.4413
 epoch: 43, train_loss: 1.0449, test_loss: 1.1409, test_f1: 0.4417
 epoch: 44, train_loss: 1.0429, test_loss: 1.1426, test_f1: 0.4397
 epoch: 45, train_loss: 1.0344, test_loss: 1.1432, test_f1: 0.4446
 epoch: 46, train_loss: 1.0362, test_loss: 1.1331, test_f1: 0.4395
 epoch: 47, train_loss: 1.0258, test_loss: 1.1296, test_f1: 0.4469
 epoch: 48, train_loss: 1.0238, test_loss: 1.1266, test_f1: 0.4493
 epoch: 49, train_loss: 1.0226, test_loss: 1.1229, test_f1: 0.4459
 epoch: 50, train_loss: 1.0208, test_loss: 1.1200, test_f1: 0.4448
 epoch: 51, train_loss: 1.0187, test_loss: 1.1213, test_f1: 0.4466
 epoch: 52, train_loss: 1.0186, test_loss: 1.1196, test_f1: 0.4417
 epoch: 53, train_loss: 1.0123, test_loss: 1.1223, test_f1: 0.4446
 epoch: 54, train_loss: 1.0161, test_loss: 1.1210, test_f1: 0.4471
 epoch: 55, train_loss: 1.0096, test_loss: 1.1194, test_f1: 0.4471
 epoch: 56, train_loss: 1.0076, test_loss: 1.1227, test_f1: 0.4420
 epoch: 57, train_loss: 1.0057, test_loss: 1.1188, test_f1: 0.4493
 epoch: 58, train_loss: 0.9987, test_loss: 1.1140, test_f1: 0.4438
 epoch: 59, train_loss: 1.0089, test_loss: 1.1158, test_f1: 0.4441
 epoch: 60, train_loss: 1.0024, test_loss: 1.1183, test_f1: 0.4446
 epoch: 61, train_loss: 1.0034, test_loss: 1.1201, test_f1: 0.4441
 epoch: 62, train_loss: 1.0031, test_loss: 1.1168, test_f1: 0.4471
 epoch: 63, train_loss: 0.9887, test_loss: 1.1123, test_f1: 0.4466
 epoch: 64, train_loss: 0.9961, test_loss: 1.1102, test_f1: 0.4466
 epoch: 65, train_loss: 0.9919, test_loss: 1.1096, test_f1: 0.4443
 epoch: 66, train_loss: 0.9864, test_loss: 1.1109, test_f1: 0.4471
 epoch: 67, train_loss: 0.9871, test_loss: 1.1111, test_f1: 0.4471
 epoch: 68, train_loss: 0.9931, test_loss: 1.1108, test_f1: 0.4518
 epoch: 69, train_loss: 0.9857, test_loss: 1.1107, test_f1: 0.4456
 epoch: 70, train_loss: 0.9859, test_loss: 1.1131, test_f1: 0.4456
 epoch: 71, train_loss: 0.9850, test_loss: 1.1110, test_f1: 0.4466
 epoch: 72, train_loss: 0.9863, test_loss: 1.1093, test_f1: 0.4471
 epoch: 73, train_loss: 0.9786, test_loss: 1.1103, test_f1: 0.4471
 epoch: 74, train_loss: 0.9777, test_loss: 1.1125, test_f1: 0.4473
 epoch: 75, train_loss: 0.9804, test_loss: 1.1144, test_f1: 0.4478
 epoch: 76, train_loss: 0.9797, test_loss: 1.1133, test_f1: 0.4471
 epoch: 77, train_loss: 0.9743, test_loss: 1.1100, test_f1: 0.4523
 epoch: 78, train_loss: 0.9758, test_loss: 1.1068, test_f1: 0.4466
 epoch: 79, train_loss: 0.9783, test_loss: 1.1086, test_f1: 0.4477
 epoch: 80, train_loss: 0.9727, test_loss: 1.1076, test_f1: 0.4523
 epoch: 81, train_loss: 0.9738, test_loss: 1.1076, test_f1: 0.4523
 epoch: 82, train_loss: 0.9714, test_loss: 1.1077, test_f1: 0.4471
 epoch: 83, train_loss: 0.9710, test_loss: 1.1112, test_f1: 0.4529
 epoch: 84, train_loss: 0.9704, test_loss: 1.1080, test_f1: 0.4524
 epoch: 85, train_loss: 0.9663, test_loss: 1.1130, test_f1: 0.4523
 epoch: 86, train_loss: 0.9739, test_loss: 1.1074, test_f1: 0.4523
 epoch: 87, train_loss: 0.9673, test_loss: 1.1057, test_f1: 0.4529
 epoch: 88, train_loss: 0.9605, test_loss: 1.1052, test_f1: 0.4590
 epoch: 89, train_loss: 0.9554, test_loss: 1.1095, test_f1: 0.4529
 epoch: 90, train_loss: 0.9657, test_loss: 1.1113, test_f1: 0.4524
 epoch: 91, train_loss: 0.9686, test_loss: 1.1051, test_f1: 0.4535
 epoch: 92, train_loss: 0.9592, test_loss: 1.1061, test_f1: 0.4529
 epoch: 93, train_loss: 0.9600, test_loss: 1.1052, test_f1: 0.4529
 epoch: 94, train_loss: 0.9590, test_loss: 1.1062, test_f1: 0.4529
 epoch: 95, train_loss: 0.9620, test_loss: 1.1067, test_f1: 0.4478
 epoch: 96, train_loss: 0.9620, test_loss: 1.1060, test_f1: 0.4535
 epoch: 97, train_loss: 0.9469, test_loss: 1.1042, test_f1: 0.4556
 epoch: 98, train_loss: 0.9614, test_loss: 1.1070, test_f1: 0.4535
 epoch: 99, train_loss: 0.9554, test_loss: 1.1069, test_f1: 0.4580
##################ITERATION #2 ****************************************
 epoch: 0, train_loss: 1.3571, test_loss: 1.3677, test_f1: 0.2281
 epoch: 1, train_loss: 1.3392, test_loss: 1.3717, test_f1: 0.2281
 epoch: 2, train_loss: 1.3296, test_loss: 1.3722, test_f1: 0.2281
 epoch: 3, train_loss: 1.3171, test_loss: 1.3636, test_f1: 0.2289
 epoch: 4, train_loss: 1.3063, test_loss: 1.3486, test_f1: 0.2587
 epoch: 5, train_loss: 1.2938, test_loss: 1.3339, test_f1: 0.3073
 epoch: 6, train_loss: 1.2808, test_loss: 1.3125, test_f1: 0.3075
 epoch: 7, train_loss: 1.2707, test_loss: 1.2960, test_f1: 0.3315
 epoch: 8, train_loss: 1.2546, test_loss: 1.2836, test_f1: 0.3715
 epoch: 9, train_loss: 1.2415, test_loss: 1.2723, test_f1: 0.3673
 epoch: 10, train_loss: 1.2269, test_loss: 1.2641, test_f1: 0.3630
 epoch: 11, train_loss: 1.2170, test_loss: 1.2533, test_f1: 0.3630
 epoch: 12, train_loss: 1.1948, test_loss: 1.2442, test_f1: 0.3673
 epoch: 13, train_loss: 1.1866, test_loss: 1.2351, test_f1: 0.3833
 epoch: 14, train_loss: 1.1781, test_loss: 1.2267, test_f1: 0.3976
 epoch: 15, train_loss: 1.1670, test_loss: 1.2201, test_f1: 0.4083
 epoch: 16, train_loss: 1.1515, test_loss: 1.2134, test_f1: 0.4132
 epoch: 17, train_loss: 1.1461, test_loss: 1.2058, test_f1: 0.4132
 epoch: 18, train_loss: 1.1370, test_loss: 1.2015, test_f1: 0.4217
 epoch: 19, train_loss: 1.1300, test_loss: 1.1940, test_f1: 0.4238
 epoch: 20, train_loss: 1.1241, test_loss: 1.1897, test_f1: 0.4228
 epoch: 21, train_loss: 1.1173, test_loss: 1.1826, test_f1: 0.4228
 epoch: 22, train_loss: 1.1115, test_loss: 1.1753, test_f1: 0.4183
 epoch: 23, train_loss: 1.1003, test_loss: 1.1749, test_f1: 0.4245
 epoch: 24, train_loss: 1.0943, test_loss: 1.1702, test_f1: 0.4223
 epoch: 25, train_loss: 1.0910, test_loss: 1.1649, test_f1: 0.4253
 epoch: 26, train_loss: 1.0888, test_loss: 1.1623, test_f1: 0.4270
 epoch: 27, train_loss: 1.0780, test_loss: 1.1608, test_f1: 0.4225
 epoch: 28, train_loss: 1.0724, test_loss: 1.1535, test_f1: 0.4269
 epoch: 29, train_loss: 1.0649, test_loss: 1.1499, test_f1: 0.4270
 epoch: 30, train_loss: 1.0686, test_loss: 1.1488, test_f1: 0.4251
 epoch: 31, train_loss: 1.0620, test_loss: 1.1466, test_f1: 0.4280
 epoch: 32, train_loss: 1.0617, test_loss: 1.1450, test_f1: 0.4275
 epoch: 33, train_loss: 1.0562, test_loss: 1.1377, test_f1: 0.4257
 epoch: 34, train_loss: 1.0492, test_loss: 1.1375, test_f1: 0.4280
 epoch: 35, train_loss: 1.0505, test_loss: 1.1356, test_f1: 0.4275
 epoch: 36, train_loss: 1.0419, test_loss: 1.1352, test_f1: 0.4280
 epoch: 37, train_loss: 1.0456, test_loss: 1.1326, test_f1: 0.4230
 epoch: 38, train_loss: 1.0325, test_loss: 1.1364, test_f1: 0.4235
 epoch: 39, train_loss: 1.0423, test_loss: 1.1251, test_f1: 0.4196
 epoch: 40, train_loss: 1.0318, test_loss: 1.1289, test_f1: 0.4217
 epoch: 41, train_loss: 1.0258, test_loss: 1.1143, test_f1: 0.4225
 epoch: 42, train_loss: 1.0268, test_loss: 1.1168, test_f1: 0.4243
 epoch: 43, train_loss: 1.0296, test_loss: 1.1200, test_f1: 0.4221
 epoch: 44, train_loss: 1.0153, test_loss: 1.1234, test_f1: 0.4305
 epoch: 45, train_loss: 1.0215, test_loss: 1.1189, test_f1: 0.4225
 epoch: 46, train_loss: 1.0168, test_loss: 1.1173, test_f1: 0.4208
 epoch: 47, train_loss: 1.0112, test_loss: 1.1121, test_f1: 0.4233
 epoch: 48, train_loss: 1.0092, test_loss: 1.1101, test_f1: 0.4225
 epoch: 49, train_loss: 1.0084, test_loss: 1.1083, test_f1: 0.4233
 epoch: 50, train_loss: 1.0065, test_loss: 1.1132, test_f1: 0.4199
 epoch: 51, train_loss: 1.0061, test_loss: 1.1144, test_f1: 0.4233
 epoch: 52, train_loss: 1.0066, test_loss: 1.1175, test_f1: 0.4233
 epoch: 53, train_loss: 1.0023, test_loss: 1.1134, test_f1: 0.4230
 epoch: 54, train_loss: 0.9986, test_loss: 1.1137, test_f1: 0.4212
 epoch: 55, train_loss: 0.9995, test_loss: 1.1160, test_f1: 0.4235
 epoch: 56, train_loss: 0.9965, test_loss: 1.1174, test_f1: 0.4262
 epoch: 57, train_loss: 0.9947, test_loss: 1.1144, test_f1: 0.4237
 epoch: 58, train_loss: 1.0003, test_loss: 1.1046, test_f1: 0.4229
 epoch: 59, train_loss: 0.9953, test_loss: 1.1097, test_f1: 0.4233
 epoch: 60, train_loss: 0.9956, test_loss: 1.1138, test_f1: 0.4230
 epoch: 61, train_loss: 0.9960, test_loss: 1.1156, test_f1: 0.4233
 epoch: 62, train_loss: 0.9892, test_loss: 1.1123, test_f1: 0.4255
 epoch: 63, train_loss: 0.9868, test_loss: 1.1103, test_f1: 0.4240
 epoch: 64, train_loss: 0.9844, test_loss: 1.1090, test_f1: 0.4262
 epoch: 65, train_loss: 0.9890, test_loss: 1.1056, test_f1: 0.4257
 epoch: 66, train_loss: 0.9854, test_loss: 1.1038, test_f1: 0.4291
 epoch: 67, train_loss: 0.9865, test_loss: 1.1091, test_f1: 0.4262
 epoch: 68, train_loss: 0.9841, test_loss: 1.1051, test_f1: 0.4285
 epoch: 69, train_loss: 0.9850, test_loss: 1.1076, test_f1: 0.4262
 epoch: 70, train_loss: 0.9889, test_loss: 1.1161, test_f1: 0.4265
 epoch: 71, train_loss: 0.9822, test_loss: 1.1106, test_f1: 0.4291
 epoch: 72, train_loss: 0.9812, test_loss: 1.1078, test_f1: 0.4245
 epoch: 73, train_loss: 0.9827, test_loss: 1.1045, test_f1: 0.4237
 epoch: 74, train_loss: 0.9860, test_loss: 1.1019, test_f1: 0.4262
 epoch: 75, train_loss: 0.9838, test_loss: 1.0981, test_f1: 0.4260
 epoch: 76, train_loss: 0.9770, test_loss: 1.1020, test_f1: 0.4260
 epoch: 77, train_loss: 0.9791, test_loss: 1.1078, test_f1: 0.4270
 epoch: 78, train_loss: 0.9772, test_loss: 1.1039, test_f1: 0.4265
 epoch: 79, train_loss: 0.9805, test_loss: 1.1011, test_f1: 0.4285
 epoch: 80, train_loss: 0.9796, test_loss: 1.0994, test_f1: 0.4265
 epoch: 81, train_loss: 0.9695, test_loss: 1.0982, test_f1: 0.4299
 epoch: 82, train_loss: 0.9778, test_loss: 1.0998, test_f1: 0.4245
 epoch: 83, train_loss: 0.9731, test_loss: 1.0998, test_f1: 0.4240
 epoch: 84, train_loss: 0.9707, test_loss: 1.1032, test_f1: 0.4305
 epoch: 85, train_loss: 0.9727, test_loss: 1.0956, test_f1: 0.4265
 epoch: 86, train_loss: 0.9659, test_loss: 1.1019, test_f1: 0.4260
 epoch: 87, train_loss: 0.9661, test_loss: 1.0975, test_f1: 0.4295
 epoch: 88, train_loss: 0.9663, test_loss: 1.1071, test_f1: 0.4256
 epoch: 89, train_loss: 0.9610, test_loss: 1.1116, test_f1: 0.4245
 epoch: 90, train_loss: 0.9652, test_loss: 1.1016, test_f1: 0.4275
 epoch: 91, train_loss: 0.9627, test_loss: 1.1012, test_f1: 0.4299
 epoch: 92, train_loss: 0.9764, test_loss: 1.1038, test_f1: 0.4290
 epoch: 93, train_loss: 0.9678, test_loss: 1.0999, test_f1: 0.4290
 epoch: 94, train_loss: 0.9626, test_loss: 1.1035, test_f1: 0.4290
 epoch: 95, train_loss: 0.9640, test_loss: 1.1046, test_f1: 0.4295
 epoch: 96, train_loss: 0.9606, test_loss: 1.1095, test_f1: 0.4322
 epoch: 97, train_loss: 0.9645, test_loss: 1.1045, test_f1: 0.4285
 epoch: 98, train_loss: 0.9632, test_loss: 1.0953, test_f1: 0.4322
 epoch: 99, train_loss: 0.9564, test_loss: 1.0970, test_f1: 0.4290
##################ITERATION #3 ****************************************
 epoch: 0, train_loss: 1.3476, test_loss: 1.3712, test_f1: 0.2281
 epoch: 1, train_loss: 1.3186, test_loss: 1.3697, test_f1: 0.2281
 epoch: 2, train_loss: 1.3000, test_loss: 1.3573, test_f1: 0.2281
 epoch: 3, train_loss: 1.2845, test_loss: 1.3421, test_f1: 0.2281
 epoch: 4, train_loss: 1.2639, test_loss: 1.3149, test_f1: 0.2692
 epoch: 5, train_loss: 1.2476, test_loss: 1.2919, test_f1: 0.3074
 epoch: 6, train_loss: 1.2349, test_loss: 1.2727, test_f1: 0.3073
 epoch: 7, train_loss: 1.2225, test_loss: 1.2588, test_f1: 0.3425
 epoch: 8, train_loss: 1.2078, test_loss: 1.2469, test_f1: 0.3525
 epoch: 9, train_loss: 1.1912, test_loss: 1.2352, test_f1: 0.3556
 epoch: 10, train_loss: 1.1822, test_loss: 1.2267, test_f1: 0.3648
 epoch: 11, train_loss: 1.1762, test_loss: 1.2188, test_f1: 0.3735
 epoch: 12, train_loss: 1.1637, test_loss: 1.2088, test_f1: 0.3736
 epoch: 13, train_loss: 1.1579, test_loss: 1.2034, test_f1: 0.3735
 epoch: 14, train_loss: 1.1445, test_loss: 1.1937, test_f1: 0.3789
 epoch: 15, train_loss: 1.1290, test_loss: 1.1846, test_f1: 0.3738
 epoch: 16, train_loss: 1.1315, test_loss: 1.1786, test_f1: 0.3847
 epoch: 17, train_loss: 1.1215, test_loss: 1.1721, test_f1: 0.4031
 epoch: 18, train_loss: 1.1153, test_loss: 1.1654, test_f1: 0.4296
 epoch: 19, train_loss: 1.1017, test_loss: 1.1588, test_f1: 0.4327
 epoch: 20, train_loss: 1.1039, test_loss: 1.1545, test_f1: 0.4314
 epoch: 21, train_loss: 1.1027, test_loss: 1.1497, test_f1: 0.4321
 epoch: 22, train_loss: 1.0841, test_loss: 1.1454, test_f1: 0.4321
 epoch: 23, train_loss: 1.0786, test_loss: 1.1399, test_f1: 0.4314
 epoch: 24, train_loss: 1.0741, test_loss: 1.1367, test_f1: 0.4314
 epoch: 25, train_loss: 1.0745, test_loss: 1.1320, test_f1: 0.4280
 epoch: 26, train_loss: 1.0680, test_loss: 1.1297, test_f1: 0.4275
 epoch: 27, train_loss: 1.0640, test_loss: 1.1250, test_f1: 0.4346
 epoch: 28, train_loss: 1.0582, test_loss: 1.1201, test_f1: 0.4346
 epoch: 29, train_loss: 1.0470, test_loss: 1.1178, test_f1: 0.4303
 epoch: 30, train_loss: 1.0474, test_loss: 1.1151, test_f1: 0.4325
 epoch: 31, train_loss: 1.0477, test_loss: 1.1110, test_f1: 0.4325
 epoch: 32, train_loss: 1.0345, test_loss: 1.1044, test_f1: 0.4330
 epoch: 33, train_loss: 1.0354, test_loss: 1.1046, test_f1: 0.4300
 epoch: 34, train_loss: 1.0369, test_loss: 1.1024, test_f1: 0.4302
 epoch: 35, train_loss: 1.0338, test_loss: 1.1034, test_f1: 0.4300
 epoch: 36, train_loss: 1.0220, test_loss: 1.0960, test_f1: 0.4302
 epoch: 37, train_loss: 1.0209, test_loss: 1.0994, test_f1: 0.4329
 epoch: 38, train_loss: 1.0162, test_loss: 1.0924, test_f1: 0.4302
 epoch: 39, train_loss: 1.0212, test_loss: 1.0947, test_f1: 0.4307
 epoch: 40, train_loss: 1.0130, test_loss: 1.0913, test_f1: 0.4311
 epoch: 41, train_loss: 1.0084, test_loss: 1.0929, test_f1: 0.4305
 epoch: 42, train_loss: 1.0111, test_loss: 1.0850, test_f1: 0.4305
 epoch: 43, train_loss: 1.0025, test_loss: 1.0827, test_f1: 0.4305
 epoch: 44, train_loss: 0.9989, test_loss: 1.0865, test_f1: 0.4311
 epoch: 45, train_loss: 1.0009, test_loss: 1.0846, test_f1: 0.4316
 epoch: 46, train_loss: 1.0005, test_loss: 1.0841, test_f1: 0.4316
 epoch: 47, train_loss: 1.0024, test_loss: 1.0829, test_f1: 0.4313
 epoch: 48, train_loss: 0.9868, test_loss: 1.0825, test_f1: 0.4290
 epoch: 49, train_loss: 0.9963, test_loss: 1.0789, test_f1: 0.4313
 epoch: 50, train_loss: 0.9895, test_loss: 1.0787, test_f1: 0.4342
 epoch: 51, train_loss: 0.9826, test_loss: 1.0831, test_f1: 0.4322
 epoch: 52, train_loss: 0.9915, test_loss: 1.0899, test_f1: 0.4329
 epoch: 53, train_loss: 0.9802, test_loss: 1.0826, test_f1: 0.4318
 epoch: 54, train_loss: 0.9888, test_loss: 1.0848, test_f1: 0.4318
 epoch: 55, train_loss: 0.9881, test_loss: 1.0800, test_f1: 0.4295
 epoch: 56, train_loss: 0.9896, test_loss: 1.0781, test_f1: 0.4348
 epoch: 57, train_loss: 0.9841, test_loss: 1.0790, test_f1: 0.4318
 epoch: 58, train_loss: 0.9831, test_loss: 1.0811, test_f1: 0.4348
 epoch: 59, train_loss: 0.9813, test_loss: 1.0790, test_f1: 0.4318
 epoch: 60, train_loss: 0.9783, test_loss: 1.0764, test_f1: 0.4313
 epoch: 61, train_loss: 0.9790, test_loss: 1.0775, test_f1: 0.4342
 epoch: 62, train_loss: 0.9757, test_loss: 1.0813, test_f1: 0.4322
 epoch: 63, train_loss: 0.9703, test_loss: 1.0792, test_f1: 0.4342
 epoch: 64, train_loss: 0.9803, test_loss: 1.0769, test_f1: 0.4318
 epoch: 65, train_loss: 0.9705, test_loss: 1.0716, test_f1: 0.4295
 epoch: 66, train_loss: 0.9749, test_loss: 1.0809, test_f1: 0.4293
 epoch: 67, train_loss: 0.9738, test_loss: 1.0801, test_f1: 0.4293
 epoch: 68, train_loss: 0.9746, test_loss: 1.0796, test_f1: 0.4288
 epoch: 69, train_loss: 0.9637, test_loss: 1.0801, test_f1: 0.4316
 epoch: 70, train_loss: 0.9674, test_loss: 1.0758, test_f1: 0.4322
 epoch: 71, train_loss: 0.9665, test_loss: 1.0777, test_f1: 0.4322
 epoch: 72, train_loss: 0.9677, test_loss: 1.0742, test_f1: 0.4322
 epoch: 73, train_loss: 0.9656, test_loss: 1.0755, test_f1: 0.4293
 epoch: 74, train_loss: 0.9686, test_loss: 1.0729, test_f1: 0.4295
 epoch: 75, train_loss: 0.9662, test_loss: 1.0715, test_f1: 0.4323
 epoch: 76, train_loss: 0.9681, test_loss: 1.0781, test_f1: 0.4329
 epoch: 77, train_loss: 0.9722, test_loss: 1.0749, test_f1: 0.4336
 epoch: 78, train_loss: 0.9588, test_loss: 1.0738, test_f1: 0.4290
 epoch: 79, train_loss: 0.9566, test_loss: 1.0724, test_f1: 0.4319
 epoch: 80, train_loss: 0.9588, test_loss: 1.0735, test_f1: 0.4322
 epoch: 81, train_loss: 0.9656, test_loss: 1.0741, test_f1: 0.4299
 epoch: 82, train_loss: 0.9566, test_loss: 1.0739, test_f1: 0.4329
 epoch: 83, train_loss: 0.9595, test_loss: 1.0736, test_f1: 0.4329
 epoch: 84, train_loss: 0.9634, test_loss: 1.0760, test_f1: 0.4329
 epoch: 85, train_loss: 0.9691, test_loss: 1.0718, test_f1: 0.4318
 epoch: 86, train_loss: 0.9644, test_loss: 1.0782, test_f1: 0.4336
 epoch: 87, train_loss: 0.9539, test_loss: 1.0704, test_f1: 0.4323
 epoch: 88, train_loss: 0.9591, test_loss: 1.0669, test_f1: 0.4317
 epoch: 89, train_loss: 0.9612, test_loss: 1.0705, test_f1: 0.4323
 epoch: 90, train_loss: 0.9509, test_loss: 1.0708, test_f1: 0.4335
 epoch: 91, train_loss: 0.9601, test_loss: 1.0673, test_f1: 0.4306
 epoch: 92, train_loss: 0.9581, test_loss: 1.0707, test_f1: 0.4329
 epoch: 93, train_loss: 0.9532, test_loss: 1.0740, test_f1: 0.4323
 epoch: 94, train_loss: 0.9477, test_loss: 1.0703, test_f1: 0.4323
 epoch: 95, train_loss: 0.9595, test_loss: 1.0690, test_f1: 0.4329
 epoch: 96, train_loss: 0.9518, test_loss: 1.0688, test_f1: 0.4329
 epoch: 97, train_loss: 0.9502, test_loss: 1.0647, test_f1: 0.4306
 epoch: 98, train_loss: 0.9584, test_loss: 1.0696, test_f1: 0.4306
 epoch: 99, train_loss: 0.9501, test_loss: 1.0702, test_f1: 0.4330
##################ITERATION #4 ****************************************
 epoch: 0, train_loss: 1.2922, test_loss: 1.3277, test_f1: 0.2281
 epoch: 1, train_loss: 1.2631, test_loss: 1.3224, test_f1: 0.2281
 epoch: 2, train_loss: 1.2525, test_loss: 1.3152, test_f1: 0.2281
 epoch: 3, train_loss: 1.2357, test_loss: 1.3052, test_f1: 0.2281
 epoch: 4, train_loss: 1.2288, test_loss: 1.3022, test_f1: 0.2281
 epoch: 5, train_loss: 1.2112, test_loss: 1.2852, test_f1: 0.2281
 epoch: 6, train_loss: 1.2048, test_loss: 1.2664, test_f1: 0.2281
 epoch: 7, train_loss: 1.1963, test_loss: 1.2517, test_f1: 0.2281
 epoch: 8, train_loss: 1.1852, test_loss: 1.2388, test_f1: 0.2820
 epoch: 9, train_loss: 1.1785, test_loss: 1.2317, test_f1: 0.2829
 epoch: 10, train_loss: 1.1724, test_loss: 1.2281, test_f1: 0.2933
 epoch: 11, train_loss: 1.1582, test_loss: 1.2208, test_f1: 0.3027
 epoch: 12, train_loss: 1.1549, test_loss: 1.2181, test_f1: 0.3628
 epoch: 13, train_loss: 1.1541, test_loss: 1.2140, test_f1: 0.4024
 epoch: 14, train_loss: 1.1367, test_loss: 1.2071, test_f1: 0.4074
 epoch: 15, train_loss: 1.1311, test_loss: 1.2061, test_f1: 0.4183
 epoch: 16, train_loss: 1.1258, test_loss: 1.2018, test_f1: 0.4227
 epoch: 17, train_loss: 1.1215, test_loss: 1.1979, test_f1: 0.4179
 epoch: 18, train_loss: 1.1152, test_loss: 1.1905, test_f1: 0.4147
 epoch: 19, train_loss: 1.1095, test_loss: 1.1875, test_f1: 0.4123
 epoch: 20, train_loss: 1.1067, test_loss: 1.1843, test_f1: 0.4088
 epoch: 21, train_loss: 1.0955, test_loss: 1.1774, test_f1: 0.4102
 epoch: 22, train_loss: 1.0853, test_loss: 1.1765, test_f1: 0.4103
 epoch: 23, train_loss: 1.0841, test_loss: 1.1687, test_f1: 0.4193
 epoch: 24, train_loss: 1.0894, test_loss: 1.1722, test_f1: 0.4102
 epoch: 25, train_loss: 1.0732, test_loss: 1.1663, test_f1: 0.4148
 epoch: 26, train_loss: 1.0631, test_loss: 1.1584, test_f1: 0.4148
 epoch: 27, train_loss: 1.0656, test_loss: 1.1538, test_f1: 0.4193
 epoch: 28, train_loss: 1.0577, test_loss: 1.1516, test_f1: 0.4200
 epoch: 29, train_loss: 1.0518, test_loss: 1.1539, test_f1: 0.4146
 epoch: 30, train_loss: 1.0532, test_loss: 1.1530, test_f1: 0.4204
 epoch: 31, train_loss: 1.0417, test_loss: 1.1442, test_f1: 0.4226
 epoch: 32, train_loss: 1.0391, test_loss: 1.1459, test_f1: 0.4127
 epoch: 33, train_loss: 1.0424, test_loss: 1.1465, test_f1: 0.4151
 epoch: 34, train_loss: 1.0380, test_loss: 1.1478, test_f1: 0.4230
 epoch: 35, train_loss: 1.0323, test_loss: 1.1418, test_f1: 0.4111
 epoch: 36, train_loss: 1.0262, test_loss: 1.1454, test_f1: 0.4160
 epoch: 37, train_loss: 1.0230, test_loss: 1.1457, test_f1: 0.4182
 epoch: 38, train_loss: 1.0284, test_loss: 1.1428, test_f1: 0.4230
 epoch: 39, train_loss: 1.0238, test_loss: 1.1445, test_f1: 0.4257
 epoch: 40, train_loss: 1.0183, test_loss: 1.1371, test_f1: 0.4211
 epoch: 41, train_loss: 1.0163, test_loss: 1.1330, test_f1: 0.4265
 epoch: 42, train_loss: 1.0193, test_loss: 1.1205, test_f1: 0.4215
 epoch: 43, train_loss: 1.0095, test_loss: 1.1335, test_f1: 0.4211
 epoch: 44, train_loss: 1.0130, test_loss: 1.1347, test_f1: 0.4305
 epoch: 45, train_loss: 1.0014, test_loss: 1.1351, test_f1: 0.4202
 epoch: 46, train_loss: 1.0137, test_loss: 1.1351, test_f1: 0.4062
 epoch: 47, train_loss: 0.9964, test_loss: 1.1235, test_f1: 0.4211
 epoch: 48, train_loss: 0.9989, test_loss: 1.1254, test_f1: 0.4265
 epoch: 49, train_loss: 0.9952, test_loss: 1.1280, test_f1: 0.4260
 epoch: 50, train_loss: 0.9981, test_loss: 1.1238, test_f1: 0.4265
 epoch: 51, train_loss: 0.9928, test_loss: 1.1259, test_f1: 0.4288
 epoch: 52, train_loss: 0.9857, test_loss: 1.1301, test_f1: 0.4288
 epoch: 53, train_loss: 0.9799, test_loss: 1.1237, test_f1: 0.4293
 epoch: 54, train_loss: 0.9940, test_loss: 1.1243, test_f1: 0.4242
 epoch: 55, train_loss: 0.9892, test_loss: 1.1293, test_f1: 0.4265
 epoch: 56, train_loss: 0.9879, test_loss: 1.1233, test_f1: 0.4265
 epoch: 57, train_loss: 0.9888, test_loss: 1.1222, test_f1: 0.4265
 epoch: 58, train_loss: 0.9790, test_loss: 1.1198, test_f1: 0.4270
 epoch: 59, train_loss: 0.9830, test_loss: 1.1276, test_f1: 0.4316
 epoch: 60, train_loss: 0.9848, test_loss: 1.1187, test_f1: 0.4265
 epoch: 61, train_loss: 0.9757, test_loss: 1.1209, test_f1: 0.4238
 epoch: 62, train_loss: 0.9872, test_loss: 1.1177, test_f1: 0.4260
 epoch: 63, train_loss: 0.9785, test_loss: 1.1181, test_f1: 0.4260
 epoch: 64, train_loss: 0.9796, test_loss: 1.1226, test_f1: 0.4311
 epoch: 65, train_loss: 0.9748, test_loss: 1.1248, test_f1: 0.4265
 epoch: 66, train_loss: 0.9758, test_loss: 1.1213, test_f1: 0.4265
 epoch: 67, train_loss: 0.9711, test_loss: 1.1167, test_f1: 0.4265
 epoch: 68, train_loss: 0.9708, test_loss: 1.1177, test_f1: 0.4316
 epoch: 69, train_loss: 0.9749, test_loss: 1.1271, test_f1: 0.4260
 epoch: 70, train_loss: 0.9706, test_loss: 1.1272, test_f1: 0.4265
 epoch: 71, train_loss: 0.9645, test_loss: 1.1196, test_f1: 0.4316
 epoch: 72, train_loss: 0.9704, test_loss: 1.1207, test_f1: 0.4316
 epoch: 73, train_loss: 0.9714, test_loss: 1.1208, test_f1: 0.4316
 epoch: 74, train_loss: 0.9644, test_loss: 1.1212, test_f1: 0.4316
 epoch: 75, train_loss: 0.9731, test_loss: 1.1288, test_f1: 0.4154
 epoch: 76, train_loss: 0.9694, test_loss: 1.1223, test_f1: 0.4288
 epoch: 77, train_loss: 0.9669, test_loss: 1.1290, test_f1: 0.4311
 epoch: 78, train_loss: 0.9676, test_loss: 1.1262, test_f1: 0.4311
 epoch: 79, train_loss: 0.9681, test_loss: 1.1220, test_f1: 0.4311
 epoch: 80, train_loss: 0.9654, test_loss: 1.1223, test_f1: 0.4316
 epoch: 81, train_loss: 0.9610, test_loss: 1.1283, test_f1: 0.4316
 epoch: 82, train_loss: 0.9640, test_loss: 1.1247, test_f1: 0.4316
 epoch: 83, train_loss: 0.9676, test_loss: 1.1247, test_f1: 0.4316
 epoch: 84, train_loss: 0.9527, test_loss: 1.1288, test_f1: 0.4316
 epoch: 85, train_loss: 0.9660, test_loss: 1.1240, test_f1: 0.4340
 epoch: 86, train_loss: 0.9572, test_loss: 1.1147, test_f1: 0.4242
 epoch: 87, train_loss: 0.9534, test_loss: 1.1236, test_f1: 0.4322
 epoch: 88, train_loss: 0.9610, test_loss: 1.1264, test_f1: 0.4316
 epoch: 89, train_loss: 0.9507, test_loss: 1.1259, test_f1: 0.4293
 epoch: 90, train_loss: 0.9627, test_loss: 1.1149, test_f1: 0.4270
 epoch: 91, train_loss: 0.9548, test_loss: 1.1184, test_f1: 0.4322
 epoch: 92, train_loss: 0.9572, test_loss: 1.1231, test_f1: 0.4316
 epoch: 93, train_loss: 0.9451, test_loss: 1.1235, test_f1: 0.4311
 epoch: 94, train_loss: 0.9556, test_loss: 1.1176, test_f1: 0.4311
 epoch: 95, train_loss: 0.9489, test_loss: 1.1261, test_f1: 0.4262
 epoch: 96, train_loss: 0.9499, test_loss: 1.1257, test_f1: 0.4256
 epoch: 97, train_loss: 0.9595, test_loss: 1.1243, test_f1: 0.4316
 epoch: 98, train_loss: 0.9498, test_loss: 1.1171, test_f1: 0.4246
 epoch: 99, train_loss: 0.9515, test_loss: 1.1253, test_f1: 0.4322
##################ITERATION #5 ****************************************
 epoch: 0, train_loss: 1.2827, test_loss: 1.3198, test_f1: 0.2281
 epoch: 1, train_loss: 1.2455, test_loss: 1.3115, test_f1: 0.2281
 epoch: 2, train_loss: 1.2350, test_loss: 1.2947, test_f1: 0.2281
 epoch: 3, train_loss: 1.2172, test_loss: 1.2727, test_f1: 0.2491
 epoch: 4, train_loss: 1.2013, test_loss: 1.2468, test_f1: 0.3168
 epoch: 5, train_loss: 1.1910, test_loss: 1.2366, test_f1: 0.3355
 epoch: 6, train_loss: 1.1819, test_loss: 1.2240, test_f1: 0.3385
 epoch: 7, train_loss: 1.1712, test_loss: 1.2129, test_f1: 0.3445
 epoch: 8, train_loss: 1.1574, test_loss: 1.2063, test_f1: 0.3719
 epoch: 9, train_loss: 1.1479, test_loss: 1.1986, test_f1: 0.3954
 epoch: 10, train_loss: 1.1381, test_loss: 1.1920, test_f1: 0.4205
 epoch: 11, train_loss: 1.1241, test_loss: 1.1812, test_f1: 0.4268
 epoch: 12, train_loss: 1.1201, test_loss: 1.1752, test_f1: 0.4289
 epoch: 13, train_loss: 1.1154, test_loss: 1.1678, test_f1: 0.4286
 epoch: 14, train_loss: 1.1060, test_loss: 1.1625, test_f1: 0.4286
 epoch: 15, train_loss: 1.0934, test_loss: 1.1563, test_f1: 0.4285
 epoch: 16, train_loss: 1.0874, test_loss: 1.1516, test_f1: 0.4285
 epoch: 17, train_loss: 1.0856, test_loss: 1.1465, test_f1: 0.4280
 epoch: 18, train_loss: 1.0769, test_loss: 1.1415, test_f1: 0.4280
 epoch: 19, train_loss: 1.0708, test_loss: 1.1401, test_f1: 0.4285
 epoch: 20, train_loss: 1.0672, test_loss: 1.1334, test_f1: 0.4285
 epoch: 21, train_loss: 1.0638, test_loss: 1.1295, test_f1: 0.4309
 epoch: 22, train_loss: 1.0605, test_loss: 1.1275, test_f1: 0.4291
 epoch: 23, train_loss: 1.0537, test_loss: 1.1264, test_f1: 0.4285
 epoch: 24, train_loss: 1.0524, test_loss: 1.1222, test_f1: 0.4275
 epoch: 25, train_loss: 1.0520, test_loss: 1.1223, test_f1: 0.4309
 epoch: 26, train_loss: 1.0400, test_loss: 1.1174, test_f1: 0.4291
 epoch: 27, train_loss: 1.0447, test_loss: 1.1152, test_f1: 0.4280
 epoch: 28, train_loss: 1.0350, test_loss: 1.1126, test_f1: 0.4309
 epoch: 29, train_loss: 1.0342, test_loss: 1.1117, test_f1: 0.4309
 epoch: 30, train_loss: 1.0312, test_loss: 1.1098, test_f1: 0.4314
 epoch: 31, train_loss: 1.0282, test_loss: 1.1068, test_f1: 0.4314
 epoch: 32, train_loss: 1.0272, test_loss: 1.1019, test_f1: 0.4314
 epoch: 33, train_loss: 1.0224, test_loss: 1.0993, test_f1: 0.4314
 epoch: 34, train_loss: 1.0125, test_loss: 1.1041, test_f1: 0.4303
 epoch: 35, train_loss: 1.0162, test_loss: 1.1025, test_f1: 0.4314
 epoch: 36, train_loss: 1.0103, test_loss: 1.1009, test_f1: 0.4309
 epoch: 37, train_loss: 1.0178, test_loss: 1.0954, test_f1: 0.4303
 epoch: 38, train_loss: 1.0097, test_loss: 1.0927, test_f1: 0.4314
 epoch: 39, train_loss: 1.0020, test_loss: 1.0906, test_f1: 0.4285
 epoch: 40, train_loss: 1.0073, test_loss: 1.0918, test_f1: 0.4321
 epoch: 41, train_loss: 1.0034, test_loss: 1.0895, test_f1: 0.4309
 epoch: 42, train_loss: 0.9924, test_loss: 1.0892, test_f1: 0.4315
 epoch: 43, train_loss: 0.9969, test_loss: 1.0903, test_f1: 0.4321
 epoch: 44, train_loss: 0.9931, test_loss: 1.0892, test_f1: 0.4292
 epoch: 45, train_loss: 0.9927, test_loss: 1.0833, test_f1: 0.4335
 epoch: 46, train_loss: 0.9911, test_loss: 1.0798, test_f1: 0.4347
 epoch: 47, train_loss: 0.9876, test_loss: 1.0798, test_f1: 0.4315
 epoch: 48, train_loss: 0.9894, test_loss: 1.0752, test_f1: 0.4315
 epoch: 49, train_loss: 0.9987, test_loss: 1.0767, test_f1: 0.4268
 epoch: 50, train_loss: 0.9886, test_loss: 1.0756, test_f1: 0.4280
 epoch: 51, train_loss: 0.9821, test_loss: 1.0788, test_f1: 0.4462
 epoch: 52, train_loss: 0.9840, test_loss: 1.0778, test_f1: 0.4234
 epoch: 53, train_loss: 0.9798, test_loss: 1.0776, test_f1: 0.4263
 epoch: 54, train_loss: 0.9774, test_loss: 1.0795, test_f1: 0.4288
 epoch: 55, train_loss: 0.9692, test_loss: 1.0797, test_f1: 0.4288
 epoch: 56, train_loss: 0.9739, test_loss: 1.0775, test_f1: 0.4288
 epoch: 57, train_loss: 0.9774, test_loss: 1.0753, test_f1: 0.4471
 epoch: 58, train_loss: 0.9740, test_loss: 1.0720, test_f1: 0.4340
 epoch: 59, train_loss: 0.9778, test_loss: 1.0724, test_f1: 0.4360
 epoch: 60, train_loss: 0.9688, test_loss: 1.0722, test_f1: 0.4360
 epoch: 61, train_loss: 0.9814, test_loss: 1.0722, test_f1: 0.4267
 epoch: 62, train_loss: 0.9657, test_loss: 1.0787, test_f1: 0.4474
 epoch: 63, train_loss: 0.9732, test_loss: 1.0800, test_f1: 0.4484
 epoch: 64, train_loss: 0.9691, test_loss: 1.0737, test_f1: 0.4446
 epoch: 65, train_loss: 0.9729, test_loss: 1.0665, test_f1: 0.4232
 epoch: 66, train_loss: 0.9715, test_loss: 1.0656, test_f1: 0.4280
 epoch: 67, train_loss: 0.9682, test_loss: 1.0676, test_f1: 0.4280
 epoch: 68, train_loss: 0.9670, test_loss: 1.0712, test_f1: 0.4240
 epoch: 69, train_loss: 0.9667, test_loss: 1.0733, test_f1: 0.4232
 epoch: 70, train_loss: 0.9650, test_loss: 1.0693, test_f1: 0.4296
 epoch: 71, train_loss: 0.9699, test_loss: 1.0677, test_f1: 0.4319
 epoch: 72, train_loss: 0.9625, test_loss: 1.0684, test_f1: 0.4232
 epoch: 73, train_loss: 0.9654, test_loss: 1.0670, test_f1: 0.4254
 epoch: 74, train_loss: 0.9651, test_loss: 1.0689, test_f1: 0.4280
 epoch: 75, train_loss: 0.9605, test_loss: 1.0717, test_f1: 0.4290
 epoch: 76, train_loss: 0.9619, test_loss: 1.0641, test_f1: 0.4280
 epoch: 77, train_loss: 0.9625, test_loss: 1.0681, test_f1: 0.4231
 epoch: 78, train_loss: 0.9553, test_loss: 1.0643, test_f1: 0.4275
 epoch: 79, train_loss: 0.9547, test_loss: 1.0652, test_f1: 0.4365
 epoch: 80, train_loss: 0.9547, test_loss: 1.0637, test_f1: 0.4365
 epoch: 81, train_loss: 0.9541, test_loss: 1.0618, test_f1: 0.4257
 epoch: 82, train_loss: 0.9562, test_loss: 1.0657, test_f1: 0.4371
 epoch: 83, train_loss: 0.9488, test_loss: 1.0643, test_f1: 0.4319
 epoch: 84, train_loss: 0.9530, test_loss: 1.0606, test_f1: 0.4276
 epoch: 85, train_loss: 0.9537, test_loss: 1.0658, test_f1: 0.4303
 epoch: 86, train_loss: 0.9486, test_loss: 1.0611, test_f1: 0.4308
 epoch: 87, train_loss: 0.9545, test_loss: 1.0644, test_f1: 0.4390
 epoch: 88, train_loss: 0.9455, test_loss: 1.0620, test_f1: 0.4360
 epoch: 89, train_loss: 0.9557, test_loss: 1.0616, test_f1: 0.4308
 epoch: 90, train_loss: 0.9480, test_loss: 1.0651, test_f1: 0.4375
 epoch: 91, train_loss: 0.9535, test_loss: 1.0647, test_f1: 0.4492
 epoch: 92, train_loss: 0.9431, test_loss: 1.0606, test_f1: 0.4365
 epoch: 93, train_loss: 0.9545, test_loss: 1.0619, test_f1: 0.4280
 epoch: 94, train_loss: 0.9507, test_loss: 1.0607, test_f1: 0.4276
 epoch: 95, train_loss: 0.9460, test_loss: 1.0639, test_f1: 0.4298
 epoch: 96, train_loss: 0.9399, test_loss: 1.0643, test_f1: 0.4319
 epoch: 97, train_loss: 0.9472, test_loss: 1.0605, test_f1: 0.4319
 epoch: 98, train_loss: 0.9384, test_loss: 1.0588, test_f1: 0.4365
 epoch: 99, train_loss: 0.9459, test_loss: 1.0613, test_f1: 0.4440
##################ITERATION #6 ****************************************
 epoch: 0, train_loss: 1.2509, test_loss: 1.3031, test_f1: 0.2281
 epoch: 1, train_loss: 1.2175, test_loss: 1.3023, test_f1: 0.2281
 epoch: 2, train_loss: 1.2031, test_loss: 1.2972, test_f1: 0.2281
 epoch: 3, train_loss: 1.1871, test_loss: 1.2948, test_f1: 0.2281
 epoch: 4, train_loss: 1.1735, test_loss: 1.2878, test_f1: 0.2281
 epoch: 5, train_loss: 1.1578, test_loss: 1.2844, test_f1: 0.2390
 epoch: 6, train_loss: 1.1551, test_loss: 1.2483, test_f1: 0.2491
 epoch: 7, train_loss: 1.1366, test_loss: 1.2076, test_f1: 0.2654
 epoch: 8, train_loss: 1.1324, test_loss: 1.1899, test_f1: 0.3125
 epoch: 9, train_loss: 1.1254, test_loss: 1.1844, test_f1: 0.3279
 epoch: 10, train_loss: 1.1184, test_loss: 1.1793, test_f1: 0.3439
 epoch: 11, train_loss: 1.1089, test_loss: 1.1708, test_f1: 0.3591
 epoch: 12, train_loss: 1.1039, test_loss: 1.1669, test_f1: 0.3573
 epoch: 13, train_loss: 1.0917, test_loss: 1.1608, test_f1: 0.3740
 epoch: 14, train_loss: 1.0903, test_loss: 1.1598, test_f1: 0.3803
 epoch: 15, train_loss: 1.0781, test_loss: 1.1487, test_f1: 0.3922
 epoch: 16, train_loss: 1.0683, test_loss: 1.1503, test_f1: 0.3871
 epoch: 17, train_loss: 1.0721, test_loss: 1.1418, test_f1: 0.4029
 epoch: 18, train_loss: 1.0577, test_loss: 1.1409, test_f1: 0.4099
 epoch: 19, train_loss: 1.0534, test_loss: 1.1343, test_f1: 0.4163
 epoch: 20, train_loss: 1.0518, test_loss: 1.1371, test_f1: 0.4174
 epoch: 21, train_loss: 1.0492, test_loss: 1.1354, test_f1: 0.4062
 epoch: 22, train_loss: 1.0354, test_loss: 1.1297, test_f1: 0.4076
 epoch: 23, train_loss: 1.0389, test_loss: 1.1290, test_f1: 0.4181
 epoch: 24, train_loss: 1.0312, test_loss: 1.1234, test_f1: 0.4164
 epoch: 25, train_loss: 1.0319, test_loss: 1.1260, test_f1: 0.4207
 epoch: 26, train_loss: 1.0293, test_loss: 1.1301, test_f1: 0.4266
 epoch: 27, train_loss: 1.0248, test_loss: 1.1144, test_f1: 0.4132
 epoch: 28, train_loss: 1.0212, test_loss: 1.1195, test_f1: 0.4236
 epoch: 29, train_loss: 1.0159, test_loss: 1.1146, test_f1: 0.4215
 epoch: 30, train_loss: 1.0068, test_loss: 1.1079, test_f1: 0.4220
 epoch: 31, train_loss: 1.0035, test_loss: 1.1141, test_f1: 0.4225
 epoch: 32, train_loss: 1.0056, test_loss: 1.1055, test_f1: 0.4210
 epoch: 33, train_loss: 0.9952, test_loss: 1.1022, test_f1: 0.4233
 epoch: 34, train_loss: 1.0030, test_loss: 1.1044, test_f1: 0.4221
 epoch: 35, train_loss: 0.9942, test_loss: 1.1050, test_f1: 0.4247
 epoch: 36, train_loss: 0.9907, test_loss: 1.1010, test_f1: 0.4250
 epoch: 37, train_loss: 0.9904, test_loss: 1.1082, test_f1: 0.4369
 epoch: 38, train_loss: 0.9928, test_loss: 1.0991, test_f1: 0.4302
 epoch: 39, train_loss: 0.9842, test_loss: 1.0991, test_f1: 0.4173
 epoch: 40, train_loss: 0.9843, test_loss: 1.1048, test_f1: 0.4322
 epoch: 41, train_loss: 0.9797, test_loss: 1.1054, test_f1: 0.4221
 epoch: 42, train_loss: 0.9697, test_loss: 1.0991, test_f1: 0.4277
 epoch: 43, train_loss: 0.9806, test_loss: 1.0914, test_f1: 0.4234
 epoch: 44, train_loss: 0.9710, test_loss: 1.0940, test_f1: 0.4232
 epoch: 45, train_loss: 0.9619, test_loss: 1.0938, test_f1: 0.4358
 epoch: 46, train_loss: 0.9667, test_loss: 1.0902, test_f1: 0.4328
 epoch: 47, train_loss: 0.9611, test_loss: 1.0926, test_f1: 0.4247
 epoch: 48, train_loss: 0.9645, test_loss: 1.0900, test_f1: 0.4211
 epoch: 49, train_loss: 0.9638, test_loss: 1.0828, test_f1: 0.4209
 epoch: 50, train_loss: 0.9623, test_loss: 1.0869, test_f1: 0.4299
 epoch: 51, train_loss: 0.9622, test_loss: 1.0858, test_f1: 0.4450
 epoch: 52, train_loss: 0.9449, test_loss: 1.0804, test_f1: 0.4306
 epoch: 53, train_loss: 0.9511, test_loss: 1.0684, test_f1: 0.4363
 epoch: 54, train_loss: 0.9513, test_loss: 1.0839, test_f1: 0.4493
 epoch: 55, train_loss: 0.9401, test_loss: 1.0925, test_f1: 0.4307
 epoch: 56, train_loss: 0.9433, test_loss: 1.0877, test_f1: 0.4281
 epoch: 57, train_loss: 0.9538, test_loss: 1.0869, test_f1: 0.4199
 epoch: 58, train_loss: 0.9407, test_loss: 1.0884, test_f1: 0.4412
 epoch: 59, train_loss: 0.9425, test_loss: 1.0695, test_f1: 0.4309
 epoch: 60, train_loss: 0.9445, test_loss: 1.0726, test_f1: 0.4338
 epoch: 61, train_loss: 0.9490, test_loss: 1.0847, test_f1: 0.4370
 epoch: 62, train_loss: 0.9346, test_loss: 1.0827, test_f1: 0.4385
 epoch: 63, train_loss: 0.9364, test_loss: 1.0807, test_f1: 0.4298
 epoch: 64, train_loss: 0.9330, test_loss: 1.0769, test_f1: 0.4452
 epoch: 65, train_loss: 0.9447, test_loss: 1.0700, test_f1: 0.4392
 epoch: 66, train_loss: 0.9391, test_loss: 1.0826, test_f1: 0.4495
 epoch: 67, train_loss: 0.9401, test_loss: 1.0763, test_f1: 0.4423
 epoch: 68, train_loss: 0.9343, test_loss: 1.0809, test_f1: 0.4534
 epoch: 69, train_loss: 0.9347, test_loss: 1.0821, test_f1: 0.4444
 epoch: 70, train_loss: 0.9309, test_loss: 1.0750, test_f1: 0.4349
 epoch: 71, train_loss: 0.9222, test_loss: 1.0686, test_f1: 0.4481
 epoch: 72, train_loss: 0.9300, test_loss: 1.0773, test_f1: 0.4468
 epoch: 73, train_loss: 0.9285, test_loss: 1.0746, test_f1: 0.4463
 epoch: 74, train_loss: 0.9209, test_loss: 1.0726, test_f1: 0.4380
 epoch: 75, train_loss: 0.9262, test_loss: 1.0738, test_f1: 0.4411
 epoch: 76, train_loss: 0.9224, test_loss: 1.0785, test_f1: 0.4442
 epoch: 77, train_loss: 0.9198, test_loss: 1.0860, test_f1: 0.4559
 epoch: 78, train_loss: 0.9216, test_loss: 1.0875, test_f1: 0.4578
 epoch: 79, train_loss: 0.9288, test_loss: 1.0701, test_f1: 0.4603
 epoch: 80, train_loss: 0.9255, test_loss: 1.0866, test_f1: 0.4534
 epoch: 81, train_loss: 0.9191, test_loss: 1.0793, test_f1: 0.4595
 epoch: 82, train_loss: 0.9194, test_loss: 1.0733, test_f1: 0.4661
 epoch: 83, train_loss: 0.9195, test_loss: 1.0656, test_f1: 0.4641
 epoch: 84, train_loss: 0.9296, test_loss: 1.0769, test_f1: 0.4511
 epoch: 85, train_loss: 0.9179, test_loss: 1.0864, test_f1: 0.4662
 epoch: 86, train_loss: 0.9199, test_loss: 1.0732, test_f1: 0.4569
 epoch: 87, train_loss: 0.9151, test_loss: 1.0667, test_f1: 0.4758
 epoch: 88, train_loss: 0.9176, test_loss: 1.0698, test_f1: 0.4703
 epoch: 89, train_loss: 0.9199, test_loss: 1.0810, test_f1: 0.4618
 epoch: 90, train_loss: 0.9088, test_loss: 1.0708, test_f1: 0.4666
 epoch: 91, train_loss: 0.9130, test_loss: 1.0847, test_f1: 0.4745
 epoch: 92, train_loss: 0.9170, test_loss: 1.0689, test_f1: 0.4625
 epoch: 93, train_loss: 0.9129, test_loss: 1.0673, test_f1: 0.4872
 epoch: 94, train_loss: 0.9039, test_loss: 1.0764, test_f1: 0.4844
 epoch: 95, train_loss: 0.9059, test_loss: 1.0715, test_f1: 0.4818
 epoch: 96, train_loss: 0.9079, test_loss: 1.0772, test_f1: 0.4772
 epoch: 97, train_loss: 0.9043, test_loss: 1.0645, test_f1: 0.4634
 epoch: 98, train_loss: 0.9116, test_loss: 1.0606, test_f1: 0.4778
 epoch: 99, train_loss: 0.9164, test_loss: 1.0625, test_f1: 0.4672
##################ITERATION #7 ****************************************
 epoch: 0, train_loss: 1.2733, test_loss: 1.3077, test_f1: 0.2281
 epoch: 1, train_loss: 1.2366, test_loss: 1.3045, test_f1: 0.2281
 epoch: 2, train_loss: 1.2247, test_loss: 1.2909, test_f1: 0.2281
 epoch: 3, train_loss: 1.2060, test_loss: 1.2795, test_f1: 0.2281
 epoch: 4, train_loss: 1.1918, test_loss: 1.2760, test_f1: 0.2281
 epoch: 5, train_loss: 1.1862, test_loss: 1.2681, test_f1: 0.2281
 epoch: 6, train_loss: 1.1635, test_loss: 1.2503, test_f1: 0.2339
 epoch: 7, train_loss: 1.1601, test_loss: 1.2211, test_f1: 0.2443
 epoch: 8, train_loss: 1.1529, test_loss: 1.2058, test_f1: 0.2705
 epoch: 9, train_loss: 1.1486, test_loss: 1.1979, test_f1: 0.2974
 epoch: 10, train_loss: 1.1289, test_loss: 1.1929, test_f1: 0.3068
 epoch: 11, train_loss: 1.1326, test_loss: 1.1874, test_f1: 0.3234
 epoch: 12, train_loss: 1.1181, test_loss: 1.1816, test_f1: 0.3149
 epoch: 13, train_loss: 1.1113, test_loss: 1.1765, test_f1: 0.3164
 epoch: 14, train_loss: 1.1061, test_loss: 1.1750, test_f1: 0.3346
 epoch: 15, train_loss: 1.0982, test_loss: 1.1729, test_f1: 0.3508
 epoch: 16, train_loss: 1.0905, test_loss: 1.1723, test_f1: 0.3357
 epoch: 17, train_loss: 1.0864, test_loss: 1.1687, test_f1: 0.3618
 epoch: 18, train_loss: 1.0747, test_loss: 1.1683, test_f1: 0.3858
 epoch: 19, train_loss: 1.0715, test_loss: 1.1666, test_f1: 0.3703
 epoch: 20, train_loss: 1.0687, test_loss: 1.1616, test_f1: 0.3875
 epoch: 21, train_loss: 1.0634, test_loss: 1.1589, test_f1: 0.3675
 epoch: 22, train_loss: 1.0548, test_loss: 1.1568, test_f1: 0.4098
 epoch: 23, train_loss: 1.0435, test_loss: 1.1587, test_f1: 0.4078
 epoch: 24, train_loss: 1.0430, test_loss: 1.1603, test_f1: 0.4222
 epoch: 25, train_loss: 1.0387, test_loss: 1.1632, test_f1: 0.4218
 epoch: 26, train_loss: 1.0367, test_loss: 1.1598, test_f1: 0.4144
 epoch: 27, train_loss: 1.0332, test_loss: 1.1599, test_f1: 0.4153
 epoch: 28, train_loss: 1.0361, test_loss: 1.1563, test_f1: 0.4237
 epoch: 29, train_loss: 1.0186, test_loss: 1.1492, test_f1: 0.4228
 epoch: 30, train_loss: 1.0170, test_loss: 1.1507, test_f1: 0.4352
 epoch: 31, train_loss: 1.0119, test_loss: 1.1609, test_f1: 0.4414
 epoch: 32, train_loss: 1.0131, test_loss: 1.1542, test_f1: 0.4242
 epoch: 33, train_loss: 1.0122, test_loss: 1.1546, test_f1: 0.4174
 epoch: 34, train_loss: 1.0146, test_loss: 1.1486, test_f1: 0.4234
 epoch: 35, train_loss: 1.0098, test_loss: 1.1581, test_f1: 0.4138
 epoch: 36, train_loss: 1.0058, test_loss: 1.1458, test_f1: 0.4193
 epoch: 37, train_loss: 1.0011, test_loss: 1.1494, test_f1: 0.4242
 epoch: 38, train_loss: 1.0071, test_loss: 1.1540, test_f1: 0.4267
 epoch: 39, train_loss: 0.9991, test_loss: 1.1583, test_f1: 0.4332
 epoch: 40, train_loss: 0.9993, test_loss: 1.1626, test_f1: 0.4136
 epoch: 41, train_loss: 0.9966, test_loss: 1.1564, test_f1: 0.4400
 epoch: 42, train_loss: 0.9874, test_loss: 1.1597, test_f1: 0.4282
 epoch: 43, train_loss: 0.9823, test_loss: 1.1582, test_f1: 0.4375
 epoch: 44, train_loss: 0.9834, test_loss: 1.1547, test_f1: 0.4247
 epoch: 45, train_loss: 0.9793, test_loss: 1.1614, test_f1: 0.4471
 epoch: 46, train_loss: 0.9765, test_loss: 1.1550, test_f1: 0.4181
 epoch: 47, train_loss: 0.9774, test_loss: 1.1598, test_f1: 0.4297
 epoch: 48, train_loss: 0.9749, test_loss: 1.1616, test_f1: 0.4359
 epoch: 49, train_loss: 0.9680, test_loss: 1.1594, test_f1: 0.4500
 epoch: 50, train_loss: 0.9743, test_loss: 1.1664, test_f1: 0.4258
 epoch: 51, train_loss: 0.9684, test_loss: 1.1621, test_f1: 0.4041
 epoch: 52, train_loss: 0.9705, test_loss: 1.1643, test_f1: 0.4138
 epoch: 53, train_loss: 0.9611, test_loss: 1.1679, test_f1: 0.4222
 epoch: 54, train_loss: 0.9638, test_loss: 1.1663, test_f1: 0.4173
 epoch: 55, train_loss: 0.9686, test_loss: 1.1651, test_f1: 0.4036
 epoch: 56, train_loss: 0.9577, test_loss: 1.1553, test_f1: 0.4195
 epoch: 57, train_loss: 0.9589, test_loss: 1.1692, test_f1: 0.4311
 epoch: 58, train_loss: 0.9619, test_loss: 1.1613, test_f1: 0.3834
 epoch: 59, train_loss: 0.9609, test_loss: 1.1677, test_f1: 0.3978
 epoch: 60, train_loss: 0.9568, test_loss: 1.1744, test_f1: 0.4053
 epoch: 61, train_loss: 0.9572, test_loss: 1.1634, test_f1: 0.3801
 epoch: 62, train_loss: 0.9589, test_loss: 1.1686, test_f1: 0.4065
 epoch: 63, train_loss: 0.9554, test_loss: 1.1829, test_f1: 0.4335
 epoch: 64, train_loss: 0.9566, test_loss: 1.1760, test_f1: 0.4274
 epoch: 65, train_loss: 0.9543, test_loss: 1.1694, test_f1: 0.4143
 epoch: 66, train_loss: 0.9504, test_loss: 1.1748, test_f1: 0.4277
 epoch: 67, train_loss: 0.9450, test_loss: 1.1655, test_f1: 0.4258
 epoch: 68, train_loss: 0.9516, test_loss: 1.1613, test_f1: 0.4262
 epoch: 69, train_loss: 0.9523, test_loss: 1.1659, test_f1: 0.4215
 epoch: 70, train_loss: 0.9493, test_loss: 1.1690, test_f1: 0.4380
 epoch: 71, train_loss: 0.9480, test_loss: 1.1700, test_f1: 0.4310
 epoch: 72, train_loss: 0.9406, test_loss: 1.1747, test_f1: 0.4463
 epoch: 73, train_loss: 0.9615, test_loss: 1.1730, test_f1: 0.4405
 epoch: 74, train_loss: 0.9436, test_loss: 1.1708, test_f1: 0.4396
 epoch: 75, train_loss: 0.9416, test_loss: 1.1680, test_f1: 0.4270
 epoch: 76, train_loss: 0.9343, test_loss: 1.1760, test_f1: 0.4459
 epoch: 77, train_loss: 0.9389, test_loss: 1.1773, test_f1: 0.4460
 epoch: 78, train_loss: 0.9501, test_loss: 1.1796, test_f1: 0.4433
 epoch: 79, train_loss: 0.9417, test_loss: 1.1753, test_f1: 0.4326
 epoch: 80, train_loss: 0.9304, test_loss: 1.1725, test_f1: 0.4243
 epoch: 81, train_loss: 0.9363, test_loss: 1.1845, test_f1: 0.4298
 epoch: 82, train_loss: 0.9334, test_loss: 1.1940, test_f1: 0.4439
 epoch: 83, train_loss: 0.9431, test_loss: 1.1865, test_f1: 0.4356
 epoch: 84, train_loss: 0.9429, test_loss: 1.1827, test_f1: 0.4129
 epoch: 85, train_loss: 0.9370, test_loss: 1.1946, test_f1: 0.4585
 epoch: 86, train_loss: 0.9328, test_loss: 1.1919, test_f1: 0.4496
 epoch: 87, train_loss: 0.9305, test_loss: 1.1825, test_f1: 0.4455
 epoch: 88, train_loss: 0.9339, test_loss: 1.1875, test_f1: 0.4442
 epoch: 89, train_loss: 0.9380, test_loss: 1.1844, test_f1: 0.4449
 epoch: 90, train_loss: 0.9304, test_loss: 1.1914, test_f1: 0.4555
 epoch: 91, train_loss: 0.9282, test_loss: 1.1864, test_f1: 0.4514
 epoch: 92, train_loss: 0.9253, test_loss: 1.1851, test_f1: 0.4489
 epoch: 93, train_loss: 0.9174, test_loss: 1.1775, test_f1: 0.4517
 epoch: 94, train_loss: 0.9243, test_loss: 1.1715, test_f1: 0.4538
 epoch: 95, train_loss: 0.9258, test_loss: 1.1842, test_f1: 0.4348
 epoch: 96, train_loss: 0.9363, test_loss: 1.1848, test_f1: 0.4512
 epoch: 97, train_loss: 0.9214, test_loss: 1.1932, test_f1: 0.4452
 epoch: 98, train_loss: 0.9185, test_loss: 1.1794, test_f1: 0.4808
 epoch: 99, train_loss: 0.9241, test_loss: 1.1836, test_f1: 0.4668
##################ITERATION #8 ****************************************
 epoch: 0, train_loss: 1.3072, test_loss: 1.3194, test_f1: 0.2281
 epoch: 1, train_loss: 1.2658, test_loss: 1.3178, test_f1: 0.2281
 epoch: 2, train_loss: 1.2535, test_loss: 1.3179, test_f1: 0.2281
 epoch: 3, train_loss: 1.2401, test_loss: 1.2997, test_f1: 0.2281
 epoch: 4, train_loss: 1.2257, test_loss: 1.2782, test_f1: 0.2281
 epoch: 5, train_loss: 1.2127, test_loss: 1.2642, test_f1: 0.2281
 epoch: 6, train_loss: 1.2109, test_loss: 1.2571, test_f1: 0.2281
 epoch: 7, train_loss: 1.2007, test_loss: 1.2482, test_f1: 0.2281
 epoch: 8, train_loss: 1.1927, test_loss: 1.2483, test_f1: 0.2281
 epoch: 9, train_loss: 1.1805, test_loss: 1.2418, test_f1: 0.2281
 epoch: 10, train_loss: 1.1691, test_loss: 1.2348, test_f1: 0.2281
 epoch: 11, train_loss: 1.1658, test_loss: 1.2242, test_f1: 0.2692
 epoch: 12, train_loss: 1.1569, test_loss: 1.2175, test_f1: 0.3021
 epoch: 13, train_loss: 1.1566, test_loss: 1.2035, test_f1: 0.2815
 epoch: 14, train_loss: 1.1468, test_loss: 1.1958, test_f1: 0.3051
 epoch: 15, train_loss: 1.1345, test_loss: 1.1893, test_f1: 0.3146
 epoch: 16, train_loss: 1.1262, test_loss: 1.1834, test_f1: 0.3397
 epoch: 17, train_loss: 1.1222, test_loss: 1.1738, test_f1: 0.3613
 epoch: 18, train_loss: 1.1098, test_loss: 1.1623, test_f1: 0.3336
 epoch: 19, train_loss: 1.0998, test_loss: 1.1525, test_f1: 0.3325
 epoch: 20, train_loss: 1.0904, test_loss: 1.1437, test_f1: 0.3519
 epoch: 21, train_loss: 1.0870, test_loss: 1.1411, test_f1: 0.3538
 epoch: 22, train_loss: 1.0877, test_loss: 1.1359, test_f1: 0.3532
 epoch: 23, train_loss: 1.0732, test_loss: 1.1285, test_f1: 0.3730
 epoch: 24, train_loss: 1.0561, test_loss: 1.1197, test_f1: 0.3544
 epoch: 25, train_loss: 1.0539, test_loss: 1.1190, test_f1: 0.3455
 epoch: 26, train_loss: 1.0454, test_loss: 1.1124, test_f1: 0.3503
 epoch: 27, train_loss: 1.0346, test_loss: 1.1056, test_f1: 0.3628
 epoch: 28, train_loss: 1.0381, test_loss: 1.1014, test_f1: 0.3835
 epoch: 29, train_loss: 1.0298, test_loss: 1.0986, test_f1: 0.3895
 epoch: 30, train_loss: 1.0305, test_loss: 1.0933, test_f1: 0.3879
 epoch: 31, train_loss: 1.0158, test_loss: 1.0887, test_f1: 0.3879
 epoch: 32, train_loss: 1.0198, test_loss: 1.0871, test_f1: 0.3882
 epoch: 33, train_loss: 1.0189, test_loss: 1.0857, test_f1: 0.3857
 epoch: 34, train_loss: 1.0123, test_loss: 1.0825, test_f1: 0.3879
 epoch: 35, train_loss: 1.0096, test_loss: 1.0771, test_f1: 0.3873
 epoch: 36, train_loss: 0.9995, test_loss: 1.0734, test_f1: 0.4168
 epoch: 37, train_loss: 1.0037, test_loss: 1.0725, test_f1: 0.4302
 epoch: 38, train_loss: 0.9967, test_loss: 1.0720, test_f1: 0.4135
 epoch: 39, train_loss: 0.9939, test_loss: 1.0740, test_f1: 0.4085
 epoch: 40, train_loss: 0.9898, test_loss: 1.0610, test_f1: 0.4129
 epoch: 41, train_loss: 0.9883, test_loss: 1.0675, test_f1: 0.4250
 epoch: 42, train_loss: 0.9876, test_loss: 1.0703, test_f1: 0.4057
 epoch: 43, train_loss: 0.9798, test_loss: 1.0619, test_f1: 0.4162
 epoch: 44, train_loss: 0.9753, test_loss: 1.0695, test_f1: 0.4355
 epoch: 45, train_loss: 0.9803, test_loss: 1.0772, test_f1: 0.4324
 epoch: 46, train_loss: 0.9733, test_loss: 1.0714, test_f1: 0.4284
 epoch: 47, train_loss: 0.9698, test_loss: 1.0606, test_f1: 0.4223
 epoch: 48, train_loss: 0.9621, test_loss: 1.0653, test_f1: 0.4222
 epoch: 49, train_loss: 0.9610, test_loss: 1.0636, test_f1: 0.4168
 epoch: 50, train_loss: 0.9636, test_loss: 1.0559, test_f1: 0.4348
 epoch: 51, train_loss: 0.9631, test_loss: 1.0566, test_f1: 0.4380
 epoch: 52, train_loss: 0.9507, test_loss: 1.0508, test_f1: 0.4303
 epoch: 53, train_loss: 0.9524, test_loss: 1.0597, test_f1: 0.4380
 epoch: 54, train_loss: 0.9561, test_loss: 1.0678, test_f1: 0.4222
 epoch: 55, train_loss: 0.9548, test_loss: 1.0654, test_f1: 0.4380
 epoch: 56, train_loss: 0.9484, test_loss: 1.0531, test_f1: 0.4380
 epoch: 57, train_loss: 0.9558, test_loss: 1.0642, test_f1: 0.4380
 epoch: 58, train_loss: 0.9498, test_loss: 1.0566, test_f1: 0.4380
 epoch: 59, train_loss: 0.9510, test_loss: 1.0534, test_f1: 0.4380
 epoch: 60, train_loss: 0.9541, test_loss: 1.0579, test_f1: 0.4152
 epoch: 61, train_loss: 0.9450, test_loss: 1.0589, test_f1: 0.4239
 epoch: 62, train_loss: 0.9390, test_loss: 1.0550, test_f1: 0.4246
 epoch: 63, train_loss: 0.9470, test_loss: 1.0575, test_f1: 0.4246
 epoch: 64, train_loss: 0.9404, test_loss: 1.0581, test_f1: 0.4227
 epoch: 65, train_loss: 0.9373, test_loss: 1.0592, test_f1: 0.4246
 epoch: 66, train_loss: 0.9369, test_loss: 1.0593, test_f1: 0.4386
 epoch: 67, train_loss: 0.9395, test_loss: 1.0578, test_f1: 0.4315
 epoch: 68, train_loss: 0.9330, test_loss: 1.0564, test_f1: 0.4234
 epoch: 69, train_loss: 0.9344, test_loss: 1.0618, test_f1: 0.4367
 epoch: 70, train_loss: 0.9391, test_loss: 1.0595, test_f1: 0.4304
 epoch: 71, train_loss: 0.9296, test_loss: 1.0601, test_f1: 0.4204
 epoch: 72, train_loss: 0.9283, test_loss: 1.0602, test_f1: 0.4233
 epoch: 73, train_loss: 0.9368, test_loss: 1.0657, test_f1: 0.4232
 epoch: 74, train_loss: 0.9273, test_loss: 1.0595, test_f1: 0.4239
 epoch: 75, train_loss: 0.9243, test_loss: 1.0571, test_f1: 0.4239
 epoch: 76, train_loss: 0.9291, test_loss: 1.0628, test_f1: 0.4187
 epoch: 77, train_loss: 0.9270, test_loss: 1.0615, test_f1: 0.4374
 epoch: 78, train_loss: 0.9261, test_loss: 1.0622, test_f1: 0.4187
 epoch: 79, train_loss: 0.9290, test_loss: 1.0477, test_f1: 0.4169
 epoch: 80, train_loss: 0.9308, test_loss: 1.0566, test_f1: 0.4278
 epoch: 81, train_loss: 0.9224, test_loss: 1.0653, test_f1: 0.4428
 epoch: 82, train_loss: 0.9269, test_loss: 1.0481, test_f1: 0.4235
 epoch: 83, train_loss: 0.9198, test_loss: 1.0559, test_f1: 0.4240
 epoch: 84, train_loss: 0.9189, test_loss: 1.0621, test_f1: 0.4215
 epoch: 85, train_loss: 0.9233, test_loss: 1.0589, test_f1: 0.4234
 epoch: 86, train_loss: 0.9244, test_loss: 1.0538, test_f1: 0.4234
 epoch: 87, train_loss: 0.9209, test_loss: 1.0582, test_f1: 0.4249
 epoch: 88, train_loss: 0.9145, test_loss: 1.0733, test_f1: 0.4288
 epoch: 89, train_loss: 0.9175, test_loss: 1.0740, test_f1: 0.4411
 epoch: 90, train_loss: 0.9097, test_loss: 1.0678, test_f1: 0.4198
 epoch: 91, train_loss: 0.9160, test_loss: 1.0754, test_f1: 0.4320
 epoch: 92, train_loss: 0.9198, test_loss: 1.0650, test_f1: 0.4258
 epoch: 93, train_loss: 0.9145, test_loss: 1.0613, test_f1: 0.4315
 epoch: 94, train_loss: 0.9125, test_loss: 1.0628, test_f1: 0.4315
 epoch: 95, train_loss: 0.9122, test_loss: 1.0765, test_f1: 0.4234
 epoch: 96, train_loss: 0.9086, test_loss: 1.0870, test_f1: 0.4209
 epoch: 97, train_loss: 0.9016, test_loss: 1.0771, test_f1: 0.4330
 epoch: 98, train_loss: 0.9135, test_loss: 1.0722, test_f1: 0.4234
 epoch: 99, train_loss: 0.9106, test_loss: 1.0784, test_f1: 0.4239
##################ITERATION #9 ****************************************
 epoch: 0, train_loss: 1.2715, test_loss: 1.3078, test_f1: 0.2281
 epoch: 1, train_loss: 1.2338, test_loss: 1.3158, test_f1: 0.2281
 epoch: 2, train_loss: 1.2208, test_loss: 1.3383, test_f1: 0.2281
 epoch: 3, train_loss: 1.2014, test_loss: 1.3188, test_f1: 0.2281
 epoch: 4, train_loss: 1.1909, test_loss: 1.2836, test_f1: 0.2400
 epoch: 5, train_loss: 1.1849, test_loss: 1.2599, test_f1: 0.2394
 epoch: 6, train_loss: 1.1722, test_loss: 1.2344, test_f1: 0.2909
 epoch: 7, train_loss: 1.1557, test_loss: 1.2195, test_f1: 0.3109
 epoch: 8, train_loss: 1.1436, test_loss: 1.2065, test_f1: 0.3078
 epoch: 9, train_loss: 1.1357, test_loss: 1.1980, test_f1: 0.3109
 epoch: 10, train_loss: 1.1270, test_loss: 1.1884, test_f1: 0.3148
 epoch: 11, train_loss: 1.1190, test_loss: 1.1828, test_f1: 0.3188
 epoch: 12, train_loss: 1.1195, test_loss: 1.1778, test_f1: 0.3211
 epoch: 13, train_loss: 1.1045, test_loss: 1.1720, test_f1: 0.3237
 epoch: 14, train_loss: 1.0993, test_loss: 1.1668, test_f1: 0.3237
 epoch: 15, train_loss: 1.0985, test_loss: 1.1632, test_f1: 0.3237
 epoch: 16, train_loss: 1.0941, test_loss: 1.1581, test_f1: 0.3243
 epoch: 17, train_loss: 1.0749, test_loss: 1.1494, test_f1: 0.3227
 epoch: 18, train_loss: 1.0762, test_loss: 1.1485, test_f1: 0.3441
 epoch: 19, train_loss: 1.0631, test_loss: 1.1495, test_f1: 0.3431
 epoch: 20, train_loss: 1.0768, test_loss: 1.1475, test_f1: 0.3439
 epoch: 21, train_loss: 1.0599, test_loss: 1.1451, test_f1: 0.3427
 epoch: 22, train_loss: 1.0590, test_loss: 1.1476, test_f1: 0.3423
 epoch: 23, train_loss: 1.0491, test_loss: 1.1438, test_f1: 0.3472
 epoch: 24, train_loss: 1.0450, test_loss: 1.1395, test_f1: 0.3488
 epoch: 25, train_loss: 1.0422, test_loss: 1.1366, test_f1: 0.3709
 epoch: 26, train_loss: 1.0340, test_loss: 1.1307, test_f1: 0.3779
 epoch: 27, train_loss: 1.0271, test_loss: 1.1389, test_f1: 0.3785
 epoch: 28, train_loss: 1.0187, test_loss: 1.1456, test_f1: 0.3666
 epoch: 29, train_loss: 1.0248, test_loss: 1.1351, test_f1: 0.3727
 epoch: 30, train_loss: 1.0186, test_loss: 1.1285, test_f1: 0.4023
 epoch: 31, train_loss: 1.0156, test_loss: 1.1322, test_f1: 0.4029
 epoch: 32, train_loss: 1.0098, test_loss: 1.1288, test_f1: 0.4049
 epoch: 33, train_loss: 1.0072, test_loss: 1.1269, test_f1: 0.4236
 epoch: 34, train_loss: 1.0059, test_loss: 1.1261, test_f1: 0.4310
 epoch: 35, train_loss: 0.9974, test_loss: 1.1266, test_f1: 0.4398
 epoch: 36, train_loss: 1.0078, test_loss: 1.1285, test_f1: 0.4431
 epoch: 37, train_loss: 1.0006, test_loss: 1.1259, test_f1: 0.4302
 epoch: 38, train_loss: 0.9978, test_loss: 1.1240, test_f1: 0.4300
 epoch: 39, train_loss: 0.9887, test_loss: 1.1212, test_f1: 0.4416
 epoch: 40, train_loss: 0.9908, test_loss: 1.1253, test_f1: 0.4161
 epoch: 41, train_loss: 0.9859, test_loss: 1.1179, test_f1: 0.4433
 epoch: 42, train_loss: 0.9897, test_loss: 1.1237, test_f1: 0.4428
 epoch: 43, train_loss: 0.9790, test_loss: 1.1283, test_f1: 0.4402
 epoch: 44, train_loss: 0.9825, test_loss: 1.1266, test_f1: 0.4316
 epoch: 45, train_loss: 0.9745, test_loss: 1.1201, test_f1: 0.4346
 epoch: 46, train_loss: 0.9739, test_loss: 1.1193, test_f1: 0.4393
 epoch: 47, train_loss: 0.9699, test_loss: 1.1160, test_f1: 0.4404
 epoch: 48, train_loss: 0.9607, test_loss: 1.1222, test_f1: 0.4338
 epoch: 49, train_loss: 0.9711, test_loss: 1.1195, test_f1: 0.4460
 epoch: 50, train_loss: 0.9674, test_loss: 1.1040, test_f1: 0.4478
 epoch: 51, train_loss: 0.9703, test_loss: 1.1099, test_f1: 0.4547
 epoch: 52, train_loss: 0.9638, test_loss: 1.0997, test_f1: 0.4533
 epoch: 53, train_loss: 0.9696, test_loss: 1.1010, test_f1: 0.4524
 epoch: 54, train_loss: 0.9672, test_loss: 1.1190, test_f1: 0.4390
 epoch: 55, train_loss: 0.9582, test_loss: 1.1119, test_f1: 0.4419
 epoch: 56, train_loss: 0.9637, test_loss: 1.1078, test_f1: 0.4519
 epoch: 57, train_loss: 0.9585, test_loss: 1.1079, test_f1: 0.4471
 epoch: 58, train_loss: 0.9524, test_loss: 1.1115, test_f1: 0.4436
 epoch: 59, train_loss: 0.9511, test_loss: 1.1127, test_f1: 0.4419
 epoch: 60, train_loss: 0.9528, test_loss: 1.1097, test_f1: 0.4455
 epoch: 61, train_loss: 0.9607, test_loss: 1.1027, test_f1: 0.4510
 epoch: 62, train_loss: 0.9501, test_loss: 1.1063, test_f1: 0.4484
 epoch: 63, train_loss: 0.9533, test_loss: 1.1071, test_f1: 0.4404
 epoch: 64, train_loss: 0.9456, test_loss: 1.1096, test_f1: 0.4427
 epoch: 65, train_loss: 0.9555, test_loss: 1.1166, test_f1: 0.4411
 epoch: 66, train_loss: 0.9551, test_loss: 1.1066, test_f1: 0.4438
 epoch: 67, train_loss: 0.9506, test_loss: 1.1215, test_f1: 0.4468
 epoch: 68, train_loss: 0.9498, test_loss: 1.1125, test_f1: 0.4511
 epoch: 69, train_loss: 0.9580, test_loss: 1.1119, test_f1: 0.4433
 epoch: 70, train_loss: 0.9482, test_loss: 1.1135, test_f1: 0.4377
 epoch: 71, train_loss: 0.9435, test_loss: 1.1121, test_f1: 0.4474
 epoch: 72, train_loss: 0.9428, test_loss: 1.1128, test_f1: 0.4480
 epoch: 73, train_loss: 0.9434, test_loss: 1.1113, test_f1: 0.4398
 epoch: 74, train_loss: 0.9482, test_loss: 1.1154, test_f1: 0.4354
 epoch: 75, train_loss: 0.9452, test_loss: 1.1142, test_f1: 0.4459
 epoch: 76, train_loss: 0.9431, test_loss: 1.1148, test_f1: 0.4406
 epoch: 77, train_loss: 0.9392, test_loss: 1.1180, test_f1: 0.4411
 epoch: 78, train_loss: 0.9382, test_loss: 1.1110, test_f1: 0.4411
 epoch: 79, train_loss: 0.9447, test_loss: 1.1089, test_f1: 0.4416
 epoch: 80, train_loss: 0.9440, test_loss: 1.1123, test_f1: 0.4393
 epoch: 81, train_loss: 0.9358, test_loss: 1.1152, test_f1: 0.4383
 epoch: 82, train_loss: 0.9394, test_loss: 1.1177, test_f1: 0.4407
 epoch: 83, train_loss: 0.9412, test_loss: 1.1222, test_f1: 0.4392
 epoch: 84, train_loss: 0.9332, test_loss: 1.1173, test_f1: 0.4393
 epoch: 85, train_loss: 0.9394, test_loss: 1.1215, test_f1: 0.4360
 epoch: 86, train_loss: 0.9471, test_loss: 1.1129, test_f1: 0.4407
 epoch: 87, train_loss: 0.9344, test_loss: 1.1138, test_f1: 0.4431
 epoch: 88, train_loss: 0.9323, test_loss: 1.1216, test_f1: 0.4357
 epoch: 89, train_loss: 0.9297, test_loss: 1.1216, test_f1: 0.4439
 epoch: 90, train_loss: 0.9299, test_loss: 1.1218, test_f1: 0.4385
 epoch: 91, train_loss: 0.9315, test_loss: 1.1266, test_f1: 0.4334
 epoch: 92, train_loss: 0.9265, test_loss: 1.1290, test_f1: 0.4423
 epoch: 93, train_loss: 0.9364, test_loss: 1.1201, test_f1: 0.4400
 epoch: 94, train_loss: 0.9342, test_loss: 1.1201, test_f1: 0.4444
 epoch: 95, train_loss: 0.9299, test_loss: 1.1228, test_f1: 0.4350
 epoch: 96, train_loss: 0.9278, test_loss: 1.1211, test_f1: 0.4354
 epoch: 97, train_loss: 0.9354, test_loss: 1.1195, test_f1: 0.4514
 epoch: 98, train_loss: 0.9311, test_loss: 1.1183, test_f1: 0.4463
 epoch: 99, train_loss: 0.9312, test_loss: 1.1191, test_f1: 0.4350

Training completed in 393.69 seconds
Best F1: 0.4872 at epoch 93
Mean F1 across iterations: 0.4555  0.0198
========================FINAL RESULTS================================
FEGIN weighted F1: 0.4872  0.0198
python main.py --data ltspice_demos --representation component_pin_net --model FEGIN --layers 6 --hiddens 32 --batch_size 128 --lr 0.0001 --emb_size 128 --epochs 100 --save_appendix component_pin_net_L6_H32_BS128_LR0.0001_E128 --no_val
-----



STDERR:
  File "main.py", line 370, in <module>
    main()
  File "main.py", line 254, in main
    dataset = dataset_class(
  File "/home/philip/projects/ltspice_examples_code_repo/Circuit-Completion-Using-GNNs/component_classification_with_link_prediction_head/evaluation/FEGIN/kernel/circuit_datasets.py", line 15, in __init__
    self.data, self.slices = torch.load(self.processed_paths[0])
  File "/home/philip/.local/lib/python3.8/site-packages/torch/serialization.py", line 1040, in load
    warnings.warn(
  File "/usr/lib/python3.8/warnings.py", line 109, in _showwarnmsg
    sw(msg.message, msg.category, msg.filename, msg.lineno,
  File "main.py", line 47, in warn_with_traceback
    traceback.print_stack(file=log)
/home/philip/projects/ltspice_examples_code_repo/Circuit-Completion-Using-GNNs/component_classification_with_link_prediction_head/evaluation/FEGIN/kernel/circuit_datasets.py:15: FutureWarning: You are using `torch.load` with `weights_only=False` (the current default value), which uses the default pickle module implicitly. It is possible to construct malicious pickle data which will execute arbitrary code during unpickling (See https://github.com/pytorch/pytorch/blob/main/SECURITY.md#untrusted-models for more details). In a future release, the default value for `weights_only` will be flipped to `True`. This limits the functions that could be executed during unpickling. Arbitrary objects will no longer be allowed to be loaded via this mode unless they are explicitly allowlisted by the user via `torch.serialization.add_safe_globals`. We recommend you start setting `weights_only=True` for any use case where you don't have full control of the loaded file. Please open an issue on GitHub for any issues related to this experimental feature.
  self.data, self.slices = torch.load(self.processed_paths[0])
