STDOUT:
Results will be saved in /home/philip/projects/llm_inference_code_repo/Circuit-Completion-Using-GNNs/component_classification_with_link_prediction_head/evaluation/FEGIN/results/model_FEGIN_dataset_ltspice_examples
Command line input: python main.py --data ltspice_examples --representation component_component --model FEGIN --layers 3 --hiddens 128 --batch_size 32 --lr 0.001 --emb_size 512 --epochs 100 --save_appendix component_component_L3_H128_BS32_LR0.001_E512 --no_val
 is saved.
-----
ltspice_examples - FEGIN
Using 3 layers, 128 hidden units, h = 2
Loading component_component representation dataset
ENTERED
Training FEGIN on component_component representation
Train: 3556, Test: 845
##################ITERATION #0 ****************************************
 epoch: 0, train_loss: 1.2270, test_loss: 1.1200, test_f1: 0.4074
 epoch: 1, train_loss: 1.1117, test_loss: 1.0556, test_f1: 0.4609
 epoch: 2, train_loss: 1.0524, test_loss: 0.9855, test_f1: 0.5038
 epoch: 3, train_loss: 1.0112, test_loss: 0.9760, test_f1: 0.4868
 epoch: 4, train_loss: 0.9755, test_loss: 0.9793, test_f1: 0.4999
 epoch: 5, train_loss: 0.9496, test_loss: 0.9815, test_f1: 0.4888
 epoch: 6, train_loss: 0.9491, test_loss: 0.9240, test_f1: 0.5443
 epoch: 7, train_loss: 0.9160, test_loss: 0.9522, test_f1: 0.5088
 epoch: 8, train_loss: 0.9181, test_loss: 0.9340, test_f1: 0.5166
 epoch: 9, train_loss: 0.9017, test_loss: 0.9489, test_f1: 0.5144
 epoch: 10, train_loss: 0.8744, test_loss: 1.0471, test_f1: 0.5449
 epoch: 11, train_loss: 0.8855, test_loss: 0.9745, test_f1: 0.5051
 epoch: 12, train_loss: 0.8548, test_loss: 0.9841, test_f1: 0.5577
 epoch: 13, train_loss: 0.8631, test_loss: 0.9442, test_f1: 0.5554
 epoch: 14, train_loss: 0.8498, test_loss: 0.9618, test_f1: 0.5524
 epoch: 15, train_loss: 0.8324, test_loss: 1.0189, test_f1: 0.4969
 epoch: 16, train_loss: 0.8234, test_loss: 0.9729, test_f1: 0.5576
 epoch: 17, train_loss: 0.8096, test_loss: 0.9777, test_f1: 0.5292
 epoch: 18, train_loss: 0.8052, test_loss: 0.9725, test_f1: 0.4983
 epoch: 19, train_loss: 0.7896, test_loss: 0.9874, test_f1: 0.5358
 epoch: 20, train_loss: 0.7886, test_loss: 0.9668, test_f1: 0.5452
 epoch: 21, train_loss: 0.7789, test_loss: 0.9854, test_f1: 0.5550
 epoch: 22, train_loss: 0.7635, test_loss: 0.9777, test_f1: 0.5344
 epoch: 23, train_loss: 0.7442, test_loss: 0.9531, test_f1: 0.5825
 epoch: 24, train_loss: 0.7566, test_loss: 0.9796, test_f1: 0.5462
 epoch: 25, train_loss: 0.7702, test_loss: 1.0283, test_f1: 0.5402
 epoch: 26, train_loss: 0.7573, test_loss: 0.9425, test_f1: 0.5389
 epoch: 27, train_loss: 0.7328, test_loss: 1.0802, test_f1: 0.5304
 epoch: 28, train_loss: 0.7167, test_loss: 1.0278, test_f1: 0.5585
 epoch: 29, train_loss: 0.7140, test_loss: 1.0258, test_f1: 0.5440
 epoch: 30, train_loss: 0.7227, test_loss: 1.0853, test_f1: 0.5489
 epoch: 31, train_loss: 0.6942, test_loss: 1.0618, test_f1: 0.5534
 epoch: 32, train_loss: 0.7005, test_loss: 1.0978, test_f1: 0.5714
 epoch: 33, train_loss: 0.7016, test_loss: 1.2091, test_f1: 0.5471
 epoch: 34, train_loss: 0.7080, test_loss: 1.4360, test_f1: 0.5090
 epoch: 35, train_loss: 0.6805, test_loss: 1.1701, test_f1: 0.5527
 epoch: 36, train_loss: 0.6721, test_loss: 1.1280, test_f1: 0.5542
 epoch: 37, train_loss: 0.6676, test_loss: 1.1811, test_f1: 0.5396
 epoch: 38, train_loss: 0.6610, test_loss: 1.0718, test_f1: 0.5827
 epoch: 39, train_loss: 0.6572, test_loss: 1.1754, test_f1: 0.5551
 epoch: 40, train_loss: 0.6432, test_loss: 1.0975, test_f1: 0.5759
 epoch: 41, train_loss: 0.6222, test_loss: 1.1223, test_f1: 0.5646
 epoch: 42, train_loss: 0.6415, test_loss: 1.1192, test_f1: 0.5543
 epoch: 43, train_loss: 0.6445, test_loss: 1.2269, test_f1: 0.5445
 epoch: 44, train_loss: 0.6170, test_loss: 1.2112, test_f1: 0.5459
 epoch: 45, train_loss: 0.6416, test_loss: 1.1185, test_f1: 0.5348
 epoch: 46, train_loss: 0.6224, test_loss: 1.2612, test_f1: 0.5894
 epoch: 47, train_loss: 0.6087, test_loss: 1.2324, test_f1: 0.5458
 epoch: 48, train_loss: 0.6547, test_loss: 1.0626, test_f1: 0.5846
 epoch: 49, train_loss: 0.6093, test_loss: 1.0897, test_f1: 0.5777
 epoch: 50, train_loss: 0.5953, test_loss: 1.1398, test_f1: 0.5635
 epoch: 51, train_loss: 0.5487, test_loss: 1.2641, test_f1: 0.5409
 epoch: 52, train_loss: 0.5207, test_loss: 1.2527, test_f1: 0.5900
 epoch: 53, train_loss: 0.5266, test_loss: 1.2644, test_f1: 0.5694
 epoch: 54, train_loss: 0.5334, test_loss: 1.2792, test_f1: 0.5418
 epoch: 55, train_loss: 0.5115, test_loss: 1.2136, test_f1: 0.5749
 epoch: 56, train_loss: 0.5073, test_loss: 1.2014, test_f1: 0.5848
 epoch: 57, train_loss: 0.4910, test_loss: 1.2066, test_f1: 0.5890
 epoch: 58, train_loss: 0.4975, test_loss: 1.2683, test_f1: 0.5882
 epoch: 59, train_loss: 0.4743, test_loss: 1.3438, test_f1: 0.5754
 epoch: 60, train_loss: 0.4830, test_loss: 1.3479, test_f1: 0.5725
 epoch: 61, train_loss: 0.5124, test_loss: 1.2835, test_f1: 0.5482
 epoch: 62, train_loss: 0.4907, test_loss: 1.2593, test_f1: 0.5807
 epoch: 63, train_loss: 0.4645, test_loss: 1.2604, test_f1: 0.5797
 epoch: 64, train_loss: 0.4507, test_loss: 1.3296, test_f1: 0.5848
 epoch: 65, train_loss: 0.4596, test_loss: 1.3086, test_f1: 0.5684
 epoch: 66, train_loss: 0.4599, test_loss: 1.2845, test_f1: 0.5774
 epoch: 67, train_loss: 0.4562, test_loss: 1.4216, test_f1: 0.5676
 epoch: 68, train_loss: 0.4608, test_loss: 1.4012, test_f1: 0.5407
 epoch: 69, train_loss: 0.4266, test_loss: 1.3226, test_f1: 0.5856
 epoch: 70, train_loss: 0.4500, test_loss: 1.3619, test_f1: 0.5689
 epoch: 71, train_loss: 0.4179, test_loss: 1.2725, test_f1: 0.5674
 epoch: 72, train_loss: 0.4067, test_loss: 1.5036, test_f1: 0.5657
 epoch: 73, train_loss: 0.4348, test_loss: 1.3696, test_f1: 0.5733
 epoch: 74, train_loss: 0.4343, test_loss: 1.2988, test_f1: 0.6073
 epoch: 75, train_loss: 0.4265, test_loss: 1.3192, test_f1: 0.5799
 epoch: 76, train_loss: 0.4279, test_loss: 1.3793, test_f1: 0.5879
 epoch: 77, train_loss: 0.4310, test_loss: 1.3940, test_f1: 0.5679
 epoch: 78, train_loss: 0.4261, test_loss: 1.3592, test_f1: 0.5725
 epoch: 79, train_loss: 0.4202, test_loss: 1.4466, test_f1: 0.5499
 epoch: 80, train_loss: 0.4183, test_loss: 1.5223, test_f1: 0.5243
 epoch: 81, train_loss: 0.4004, test_loss: 1.4013, test_f1: 0.5744
 epoch: 82, train_loss: 0.4283, test_loss: 1.3292, test_f1: 0.5688
 epoch: 83, train_loss: 0.3927, test_loss: 1.3853, test_f1: 0.5750
 epoch: 84, train_loss: 0.3994, test_loss: 1.4589, test_f1: 0.5692
 epoch: 85, train_loss: 0.3994, test_loss: 1.3941, test_f1: 0.5854
 epoch: 86, train_loss: 0.3806, test_loss: 1.5068, test_f1: 0.5729
 epoch: 87, train_loss: 0.4249, test_loss: 1.3302, test_f1: 0.5883
 epoch: 88, train_loss: 0.4105, test_loss: 1.4700, test_f1: 0.6047
 epoch: 89, train_loss: 0.3970, test_loss: 1.3799, test_f1: 0.5715
 epoch: 90, train_loss: 0.3575, test_loss: 1.4711, test_f1: 0.5957
 epoch: 91, train_loss: 0.3571, test_loss: 1.5238, test_f1: 0.5812
 epoch: 92, train_loss: 0.3676, test_loss: 1.3585, test_f1: 0.5791
 epoch: 93, train_loss: 0.3818, test_loss: 1.4406, test_f1: 0.5754
 epoch: 94, train_loss: 0.3631, test_loss: 1.5238, test_f1: 0.5576
 epoch: 95, train_loss: 0.3617, test_loss: 1.4470, test_f1: 0.5892
 epoch: 96, train_loss: 0.3652, test_loss: 1.5268, test_f1: 0.5737
 epoch: 97, train_loss: 0.3493, test_loss: 1.4699, test_f1: 0.5751
 epoch: 98, train_loss: 0.3524, test_loss: 1.6172, test_f1: 0.5797
 epoch: 99, train_loss: 0.3425, test_loss: 1.5137, test_f1: 0.5834
##################ITERATION #1 ****************************************
 epoch: 0, train_loss: 1.2470, test_loss: 1.0934, test_f1: 0.4399
 epoch: 1, train_loss: 1.1352, test_loss: 1.0547, test_f1: 0.4171
 epoch: 2, train_loss: 1.0892, test_loss: 1.0299, test_f1: 0.4462
 epoch: 3, train_loss: 1.0493, test_loss: 1.0324, test_f1: 0.4284
 epoch: 4, train_loss: 1.0333, test_loss: 1.0030, test_f1: 0.4886
 epoch: 5, train_loss: 1.0030, test_loss: 1.0331, test_f1: 0.4667
 epoch: 6, train_loss: 0.9887, test_loss: 0.9593, test_f1: 0.4999
 epoch: 7, train_loss: 0.9725, test_loss: 0.9781, test_f1: 0.5169
 epoch: 8, train_loss: 0.9441, test_loss: 0.9175, test_f1: 0.5127
 epoch: 9, train_loss: 0.9399, test_loss: 1.0195, test_f1: 0.5248
 epoch: 10, train_loss: 0.9297, test_loss: 0.9421, test_f1: 0.5140
 epoch: 11, train_loss: 0.9180, test_loss: 1.0171, test_f1: 0.4637
 epoch: 12, train_loss: 0.8945, test_loss: 0.9339, test_f1: 0.5378
 epoch: 13, train_loss: 0.8701, test_loss: 1.0016, test_f1: 0.5373
 epoch: 14, train_loss: 0.8901, test_loss: 1.0264, test_f1: 0.4815
 epoch: 15, train_loss: 0.8435, test_loss: 1.0112, test_f1: 0.5303
 epoch: 16, train_loss: 0.8568, test_loss: 1.0050, test_f1: 0.5491
 epoch: 17, train_loss: 0.8353, test_loss: 0.9594, test_f1: 0.5210
 epoch: 18, train_loss: 0.8268, test_loss: 0.9520, test_f1: 0.5173
 epoch: 19, train_loss: 0.8164, test_loss: 0.9428, test_f1: 0.5612
 epoch: 20, train_loss: 0.8227, test_loss: 0.9957, test_f1: 0.5587
 epoch: 21, train_loss: 0.8172, test_loss: 0.8903, test_f1: 0.5727
 epoch: 22, train_loss: 0.7930, test_loss: 0.9743, test_f1: 0.5750
 epoch: 23, train_loss: 0.7668, test_loss: 0.9505, test_f1: 0.5469
 epoch: 24, train_loss: 0.7835, test_loss: 0.9887, test_f1: 0.5689
 epoch: 25, train_loss: 0.7530, test_loss: 0.9553, test_f1: 0.5719
 epoch: 26, train_loss: 0.7506, test_loss: 1.0221, test_f1: 0.5578
 epoch: 27, train_loss: 0.7623, test_loss: 1.0155, test_f1: 0.5577
 epoch: 28, train_loss: 0.7341, test_loss: 0.9860, test_f1: 0.5569
 epoch: 29, train_loss: 0.7407, test_loss: 1.0701, test_f1: 0.5508
 epoch: 30, train_loss: 0.7418, test_loss: 1.0026, test_f1: 0.5510
 epoch: 31, train_loss: 0.7410, test_loss: 1.2186, test_f1: 0.5231
 epoch: 32, train_loss: 0.7586, test_loss: 1.0560, test_f1: 0.5761
 epoch: 33, train_loss: 0.7413, test_loss: 0.9573, test_f1: 0.5762
 epoch: 34, train_loss: 0.7030, test_loss: 1.0726, test_f1: 0.5374
 epoch: 35, train_loss: 0.7064, test_loss: 1.0781, test_f1: 0.5596
 epoch: 36, train_loss: 0.6872, test_loss: 1.1138, test_f1: 0.5738
 epoch: 37, train_loss: 0.6861, test_loss: 1.0227, test_f1: 0.5688
 epoch: 38, train_loss: 0.6928, test_loss: 1.1190, test_f1: 0.5642
 epoch: 39, train_loss: 0.6581, test_loss: 1.0594, test_f1: 0.5567
 epoch: 40, train_loss: 0.6603, test_loss: 1.0250, test_f1: 0.5482
 epoch: 41, train_loss: 0.6720, test_loss: 1.0151, test_f1: 0.5583
 epoch: 42, train_loss: 0.6571, test_loss: 1.0067, test_f1: 0.5716
 epoch: 43, train_loss: 0.6425, test_loss: 1.0341, test_f1: 0.5650
 epoch: 44, train_loss: 0.6275, test_loss: 1.1059, test_f1: 0.5523
 epoch: 45, train_loss: 0.6380, test_loss: 1.0317, test_f1: 0.5738
 epoch: 46, train_loss: 0.6343, test_loss: 1.1363, test_f1: 0.5595
 epoch: 47, train_loss: 0.6192, test_loss: 1.1399, test_f1: 0.5310
 epoch: 48, train_loss: 0.6148, test_loss: 1.1314, test_f1: 0.5334
 epoch: 49, train_loss: 0.6079, test_loss: 1.1106, test_f1: 0.5614
 epoch: 50, train_loss: 0.5914, test_loss: 1.0862, test_f1: 0.5582
 epoch: 51, train_loss: 0.5639, test_loss: 1.1241, test_f1: 0.5683
 epoch: 52, train_loss: 0.5414, test_loss: 1.1157, test_f1: 0.5628
 epoch: 53, train_loss: 0.5423, test_loss: 1.1277, test_f1: 0.5755
 epoch: 54, train_loss: 0.5168, test_loss: 1.1995, test_f1: 0.5611
 epoch: 55, train_loss: 0.5194, test_loss: 1.1785, test_f1: 0.5744
 epoch: 56, train_loss: 0.5001, test_loss: 1.1428, test_f1: 0.5716
 epoch: 57, train_loss: 0.5202, test_loss: 1.1580, test_f1: 0.5784
 epoch: 58, train_loss: 0.5060, test_loss: 1.1532, test_f1: 0.5770
 epoch: 59, train_loss: 0.4981, test_loss: 1.1355, test_f1: 0.5721
 epoch: 60, train_loss: 0.4950, test_loss: 1.1742, test_f1: 0.6001
 epoch: 61, train_loss: 0.4964, test_loss: 1.1931, test_f1: 0.5850
 epoch: 62, train_loss: 0.5131, test_loss: 1.2302, test_f1: 0.5684
 epoch: 63, train_loss: 0.4934, test_loss: 1.2204, test_f1: 0.5739
 epoch: 64, train_loss: 0.4863, test_loss: 1.2103, test_f1: 0.5552
 epoch: 65, train_loss: 0.4706, test_loss: 1.2009, test_f1: 0.5799
 epoch: 66, train_loss: 0.4575, test_loss: 1.2295, test_f1: 0.5855
 epoch: 67, train_loss: 0.4529, test_loss: 1.2621, test_f1: 0.5762
 epoch: 68, train_loss: 0.4516, test_loss: 1.2463, test_f1: 0.5738
 epoch: 69, train_loss: 0.4629, test_loss: 1.2672, test_f1: 0.5829
 epoch: 70, train_loss: 0.4407, test_loss: 1.2588, test_f1: 0.5774
 epoch: 71, train_loss: 0.4364, test_loss: 1.2686, test_f1: 0.5876
 epoch: 72, train_loss: 0.4419, test_loss: 1.2454, test_f1: 0.5971
 epoch: 73, train_loss: 0.4270, test_loss: 1.3445, test_f1: 0.5605
 epoch: 74, train_loss: 0.4257, test_loss: 1.2310, test_f1: 0.5751
 epoch: 75, train_loss: 0.4290, test_loss: 1.2020, test_f1: 0.5796
 epoch: 76, train_loss: 0.4484, test_loss: 1.3943, test_f1: 0.5490
 epoch: 77, train_loss: 0.4229, test_loss: 1.2647, test_f1: 0.5673
 epoch: 78, train_loss: 0.4092, test_loss: 1.2880, test_f1: 0.5961
 epoch: 79, train_loss: 0.4296, test_loss: 1.2580, test_f1: 0.5853
 epoch: 80, train_loss: 0.4091, test_loss: 1.2083, test_f1: 0.5913
 epoch: 81, train_loss: 0.4168, test_loss: 1.2894, test_f1: 0.5733
 epoch: 82, train_loss: 0.5046, test_loss: 1.2094, test_f1: 0.5631
 epoch: 83, train_loss: 0.4187, test_loss: 1.2778, test_f1: 0.5680
 epoch: 84, train_loss: 0.4306, test_loss: 1.2310, test_f1: 0.5817
 epoch: 85, train_loss: 0.3963, test_loss: 1.3210, test_f1: 0.5724
 epoch: 86, train_loss: 0.3758, test_loss: 1.3575, test_f1: 0.5968
 epoch: 87, train_loss: 0.4857, test_loss: 1.2716, test_f1: 0.5935
 epoch: 88, train_loss: 0.4292, test_loss: 1.2398, test_f1: 0.5621
 epoch: 89, train_loss: 0.3903, test_loss: 1.3139, test_f1: 0.5568
 epoch: 90, train_loss: 0.4134, test_loss: 1.3362, test_f1: 0.5677
 epoch: 91, train_loss: 0.3644, test_loss: 1.2595, test_f1: 0.5597
 epoch: 92, train_loss: 0.3730, test_loss: 1.3113, test_f1: 0.5720
 epoch: 93, train_loss: 0.3891, test_loss: 1.2969, test_f1: 0.5853
 epoch: 94, train_loss: 0.3714, test_loss: 1.2550, test_f1: 0.5759
 epoch: 95, train_loss: 0.3882, test_loss: 1.2869, test_f1: 0.5709
 epoch: 96, train_loss: 0.3747, test_loss: 1.3723, test_f1: 0.5485
 epoch: 97, train_loss: 0.3554, test_loss: 1.4247, test_f1: 0.5511
 epoch: 98, train_loss: 0.3753, test_loss: 1.3457, test_f1: 0.5866
 epoch: 99, train_loss: 0.3557, test_loss: 1.3623, test_f1: 0.5821
##################ITERATION #2 ****************************************
 epoch: 0, train_loss: 1.2619, test_loss: 1.0628, test_f1: 0.4351
 epoch: 1, train_loss: 1.1052, test_loss: 1.0304, test_f1: 0.4562
 epoch: 2, train_loss: 1.0688, test_loss: 1.0413, test_f1: 0.4512
 epoch: 3, train_loss: 1.0519, test_loss: 0.9602, test_f1: 0.4706
 epoch: 4, train_loss: 1.0275, test_loss: 0.9637, test_f1: 0.4622
 epoch: 5, train_loss: 1.0019, test_loss: 0.9846, test_f1: 0.4971
 epoch: 6, train_loss: 0.9825, test_loss: 1.0079, test_f1: 0.4757
 epoch: 7, train_loss: 0.9627, test_loss: 0.9531, test_f1: 0.5011
 epoch: 8, train_loss: 0.9472, test_loss: 1.0197, test_f1: 0.4995
 epoch: 9, train_loss: 0.9382, test_loss: 0.9937, test_f1: 0.4803
 epoch: 10, train_loss: 0.9173, test_loss: 1.0020, test_f1: 0.4755
 epoch: 11, train_loss: 0.9058, test_loss: 0.9881, test_f1: 0.5170
 epoch: 12, train_loss: 0.9092, test_loss: 1.0093, test_f1: 0.5235
 epoch: 13, train_loss: 0.8839, test_loss: 1.0487, test_f1: 0.5126
 epoch: 14, train_loss: 0.8719, test_loss: 1.0755, test_f1: 0.5242
 epoch: 15, train_loss: 0.8630, test_loss: 1.0573, test_f1: 0.5159
 epoch: 16, train_loss: 0.8385, test_loss: 1.0659, test_f1: 0.5568
 epoch: 17, train_loss: 0.8318, test_loss: 1.0833, test_f1: 0.5247
 epoch: 18, train_loss: 0.8261, test_loss: 1.0281, test_f1: 0.5384
 epoch: 19, train_loss: 0.8125, test_loss: 1.0794, test_f1: 0.5596
 epoch: 20, train_loss: 0.8262, test_loss: 1.0671, test_f1: 0.5201
 epoch: 21, train_loss: 0.8039, test_loss: 1.0852, test_f1: 0.5172
 epoch: 22, train_loss: 0.8131, test_loss: 1.1880, test_f1: 0.5184
 epoch: 23, train_loss: 0.7889, test_loss: 1.1223, test_f1: 0.5182
 epoch: 24, train_loss: 0.7924, test_loss: 1.0520, test_f1: 0.5326
 epoch: 25, train_loss: 0.7729, test_loss: 1.0730, test_f1: 0.5598
 epoch: 26, train_loss: 0.7794, test_loss: 1.0588, test_f1: 0.5273
 epoch: 27, train_loss: 0.7680, test_loss: 1.1633, test_f1: 0.5092
 epoch: 28, train_loss: 0.7703, test_loss: 1.1400, test_f1: 0.5236
 epoch: 29, train_loss: 0.7675, test_loss: 1.1464, test_f1: 0.5276
 epoch: 30, train_loss: 0.7410, test_loss: 1.0460, test_f1: 0.5243
 epoch: 31, train_loss: 0.7345, test_loss: 1.1182, test_f1: 0.5269
 epoch: 32, train_loss: 0.7308, test_loss: 1.1201, test_f1: 0.5402
 epoch: 33, train_loss: 0.7195, test_loss: 1.1634, test_f1: 0.5316
 epoch: 34, train_loss: 0.6898, test_loss: 1.1701, test_f1: 0.5329
 epoch: 35, train_loss: 0.7020, test_loss: 1.1334, test_f1: 0.5656
 epoch: 36, train_loss: 0.6858, test_loss: 1.1692, test_f1: 0.5557
 epoch: 37, train_loss: 0.7005, test_loss: 1.1373, test_f1: 0.5446
 epoch: 38, train_loss: 0.6647, test_loss: 1.0830, test_f1: 0.5459
 epoch: 39, train_loss: 0.6941, test_loss: 1.1859, test_f1: 0.5623
 epoch: 40, train_loss: 0.6906, test_loss: 1.1001, test_f1: 0.5574
 epoch: 41, train_loss: 0.6863, test_loss: 1.1399, test_f1: 0.5490
 epoch: 42, train_loss: 0.6502, test_loss: 1.1694, test_f1: 0.5572
 epoch: 43, train_loss: 0.6605, test_loss: 1.1419, test_f1: 0.5448
 epoch: 44, train_loss: 0.6697, test_loss: 1.2197, test_f1: 0.5343
 epoch: 45, train_loss: 0.6549, test_loss: 1.1617, test_f1: 0.5373
 epoch: 46, train_loss: 0.6621, test_loss: 1.1136, test_f1: 0.5518
 epoch: 47, train_loss: 0.6607, test_loss: 1.1668, test_f1: 0.5451
 epoch: 48, train_loss: 0.6722, test_loss: 1.1364, test_f1: 0.5473
 epoch: 49, train_loss: 0.6421, test_loss: 1.1380, test_f1: 0.5549
 epoch: 50, train_loss: 0.6383, test_loss: 1.1831, test_f1: 0.5267
 epoch: 51, train_loss: 0.5876, test_loss: 1.1055, test_f1: 0.5669
 epoch: 52, train_loss: 0.5768, test_loss: 1.1959, test_f1: 0.5773
 epoch: 53, train_loss: 0.5843, test_loss: 1.1502, test_f1: 0.5733
 epoch: 54, train_loss: 0.5586, test_loss: 1.2546, test_f1: 0.5551
 epoch: 55, train_loss: 0.5483, test_loss: 1.1742, test_f1: 0.5707
 epoch: 56, train_loss: 0.5432, test_loss: 1.2042, test_f1: 0.5596
 epoch: 57, train_loss: 0.5316, test_loss: 1.1883, test_f1: 0.5512
 epoch: 58, train_loss: 0.5123, test_loss: 1.3402, test_f1: 0.5445
 epoch: 59, train_loss: 0.5244, test_loss: 1.3898, test_f1: 0.5404
 epoch: 60, train_loss: 0.5249, test_loss: 1.2611, test_f1: 0.5475
 epoch: 61, train_loss: 0.5243, test_loss: 1.2444, test_f1: 0.5367
 epoch: 62, train_loss: 0.5084, test_loss: 1.3455, test_f1: 0.5141
 epoch: 63, train_loss: 0.5197, test_loss: 1.3403, test_f1: 0.5428
 epoch: 64, train_loss: 0.5024, test_loss: 1.2724, test_f1: 0.5613
 epoch: 65, train_loss: 0.4801, test_loss: 1.2681, test_f1: 0.5681
 epoch: 66, train_loss: 0.5022, test_loss: 1.2610, test_f1: 0.5568
 epoch: 67, train_loss: 0.4879, test_loss: 1.3218, test_f1: 0.5493
 epoch: 68, train_loss: 0.4873, test_loss: 1.3360, test_f1: 0.5454
 epoch: 69, train_loss: 0.4833, test_loss: 1.4567, test_f1: 0.5369
 epoch: 70, train_loss: 0.4908, test_loss: 1.2797, test_f1: 0.5492
 epoch: 71, train_loss: 0.4593, test_loss: 1.3393, test_f1: 0.5618
 epoch: 72, train_loss: 0.4980, test_loss: 1.2543, test_f1: 0.5929
 epoch: 73, train_loss: 0.4670, test_loss: 1.2370, test_f1: 0.5651
 epoch: 74, train_loss: 0.4979, test_loss: 1.2959, test_f1: 0.5533
 epoch: 75, train_loss: 0.4723, test_loss: 1.4484, test_f1: 0.5195
 epoch: 76, train_loss: 0.4599, test_loss: 1.2319, test_f1: 0.5575
 epoch: 77, train_loss: 0.4625, test_loss: 1.5510, test_f1: 0.5233
 epoch: 78, train_loss: 0.4708, test_loss: 1.3206, test_f1: 0.5611
 epoch: 79, train_loss: 0.4527, test_loss: 1.3133, test_f1: 0.5722
 epoch: 80, train_loss: 0.4640, test_loss: 1.3119, test_f1: 0.5679
 epoch: 81, train_loss: 0.4388, test_loss: 1.3226, test_f1: 0.5679
 epoch: 82, train_loss: 0.4418, test_loss: 1.3971, test_f1: 0.5443
 epoch: 83, train_loss: 0.4457, test_loss: 1.3252, test_f1: 0.5648
 epoch: 84, train_loss: 0.4453, test_loss: 1.3069, test_f1: 0.5938
 epoch: 85, train_loss: 0.4318, test_loss: 1.4238, test_f1: 0.5369
 epoch: 86, train_loss: 0.4381, test_loss: 1.4071, test_f1: 0.5473
 epoch: 87, train_loss: 0.4183, test_loss: 1.3847, test_f1: 0.5599
 epoch: 88, train_loss: 0.4592, test_loss: 1.4009, test_f1: 0.5216
 epoch: 89, train_loss: 0.4169, test_loss: 1.4248, test_f1: 0.5591
 epoch: 90, train_loss: 0.4182, test_loss: 1.3310, test_f1: 0.5695
 epoch: 91, train_loss: 0.4325, test_loss: 1.4432, test_f1: 0.5302
 epoch: 92, train_loss: 0.4421, test_loss: 1.5070, test_f1: 0.5254
 epoch: 93, train_loss: 0.4263, test_loss: 1.4779, test_f1: 0.5435
 epoch: 94, train_loss: 0.4427, test_loss: 1.3175, test_f1: 0.5713
 epoch: 95, train_loss: 0.4057, test_loss: 1.3625, test_f1: 0.5229
 epoch: 96, train_loss: 0.4437, test_loss: 1.4861, test_f1: 0.5399
 epoch: 97, train_loss: 0.4294, test_loss: 1.4130, test_f1: 0.5384
 epoch: 98, train_loss: 0.4103, test_loss: 1.5552, test_f1: 0.5564
 epoch: 99, train_loss: 0.4031, test_loss: 1.6883, test_f1: 0.5136
##################ITERATION #3 ****************************************
 epoch: 0, train_loss: 1.2850, test_loss: 1.1354, test_f1: 0.4031
 epoch: 1, train_loss: 1.1326, test_loss: 1.0872, test_f1: 0.4463
 epoch: 2, train_loss: 1.0725, test_loss: 0.9751, test_f1: 0.4844
 epoch: 3, train_loss: 1.0476, test_loss: 1.0027, test_f1: 0.4531
 epoch: 4, train_loss: 1.0306, test_loss: 0.9450, test_f1: 0.4958
 epoch: 5, train_loss: 1.0045, test_loss: 0.9889, test_f1: 0.4751
 epoch: 6, train_loss: 0.9954, test_loss: 0.9379, test_f1: 0.4882
 epoch: 7, train_loss: 0.9794, test_loss: 0.9510, test_f1: 0.4814
 epoch: 8, train_loss: 0.9412, test_loss: 1.0888, test_f1: 0.4481
 epoch: 9, train_loss: 0.9397, test_loss: 1.0413, test_f1: 0.4923
 epoch: 10, train_loss: 0.9011, test_loss: 1.0056, test_f1: 0.4962
 epoch: 11, train_loss: 0.8968, test_loss: 0.9645, test_f1: 0.5342
 epoch: 12, train_loss: 0.8794, test_loss: 1.0451, test_f1: 0.4948
 epoch: 13, train_loss: 0.8686, test_loss: 0.9844, test_f1: 0.4987
 epoch: 14, train_loss: 0.8560, test_loss: 1.0582, test_f1: 0.5270
 epoch: 15, train_loss: 0.8514, test_loss: 0.9483, test_f1: 0.5057
 epoch: 16, train_loss: 0.8602, test_loss: 1.0618, test_f1: 0.5017
 epoch: 17, train_loss: 0.8416, test_loss: 1.0557, test_f1: 0.5262
 epoch: 18, train_loss: 0.8182, test_loss: 1.0268, test_f1: 0.5559
 epoch: 19, train_loss: 0.8436, test_loss: 1.0414, test_f1: 0.5109
 epoch: 20, train_loss: 0.8169, test_loss: 0.9727, test_f1: 0.5245
 epoch: 21, train_loss: 0.8051, test_loss: 0.9978, test_f1: 0.5726
 epoch: 22, train_loss: 0.7809, test_loss: 1.0490, test_f1: 0.5481
 epoch: 23, train_loss: 0.7835, test_loss: 1.0345, test_f1: 0.5437
 epoch: 24, train_loss: 0.7845, test_loss: 1.0052, test_f1: 0.5772
 epoch: 25, train_loss: 0.7656, test_loss: 0.9953, test_f1: 0.5783
 epoch: 26, train_loss: 0.7494, test_loss: 1.0578, test_f1: 0.5629
 epoch: 27, train_loss: 0.7609, test_loss: 1.0441, test_f1: 0.5620
 epoch: 28, train_loss: 0.7437, test_loss: 1.0366, test_f1: 0.5743
 epoch: 29, train_loss: 0.7281, test_loss: 1.0412, test_f1: 0.5456
 epoch: 30, train_loss: 0.7188, test_loss: 1.0222, test_f1: 0.5843
 epoch: 31, train_loss: 0.6975, test_loss: 1.1173, test_f1: 0.5426
 epoch: 32, train_loss: 0.6929, test_loss: 1.1894, test_f1: 0.5526
 epoch: 33, train_loss: 0.7167, test_loss: 1.0866, test_f1: 0.5526
 epoch: 34, train_loss: 0.7012, test_loss: 1.1182, test_f1: 0.5568
 epoch: 35, train_loss: 0.6874, test_loss: 1.0434, test_f1: 0.5404
 epoch: 36, train_loss: 0.6692, test_loss: 1.0873, test_f1: 0.5778
 epoch: 37, train_loss: 0.7180, test_loss: 1.1587, test_f1: 0.5607
 epoch: 38, train_loss: 0.6822, test_loss: 1.1001, test_f1: 0.5720
 epoch: 39, train_loss: 0.6582, test_loss: 1.1408, test_f1: 0.5653
 epoch: 40, train_loss: 0.6480, test_loss: 1.1187, test_f1: 0.5547
 epoch: 41, train_loss: 0.6462, test_loss: 1.1146, test_f1: 0.5693
 epoch: 42, train_loss: 0.6949, test_loss: 1.0906, test_f1: 0.5726
 epoch: 43, train_loss: 0.6506, test_loss: 1.1108, test_f1: 0.5538
 epoch: 44, train_loss: 0.6433, test_loss: 1.1056, test_f1: 0.5686
 epoch: 45, train_loss: 0.6353, test_loss: 1.1974, test_f1: 0.5808
 epoch: 46, train_loss: 0.6238, test_loss: 1.0547, test_f1: 0.5874
 epoch: 47, train_loss: 0.6069, test_loss: 1.1424, test_f1: 0.5738
 epoch: 48, train_loss: 0.6007, test_loss: 1.1450, test_f1: 0.5687
 epoch: 49, train_loss: 0.5948, test_loss: 1.1716, test_f1: 0.5620
 epoch: 50, train_loss: 0.5699, test_loss: 1.1175, test_f1: 0.5796
 epoch: 51, train_loss: 0.5541, test_loss: 1.1564, test_f1: 0.5776
 epoch: 52, train_loss: 0.5455, test_loss: 1.1875, test_f1: 0.5756
 epoch: 53, train_loss: 0.5179, test_loss: 1.2729, test_f1: 0.5469
 epoch: 54, train_loss: 0.5212, test_loss: 1.3238, test_f1: 0.5506
 epoch: 55, train_loss: 0.5251, test_loss: 1.1956, test_f1: 0.5565
 epoch: 56, train_loss: 0.5114, test_loss: 1.2479, test_f1: 0.5543
 epoch: 57, train_loss: 0.5024, test_loss: 1.3087, test_f1: 0.5256
 epoch: 58, train_loss: 0.4964, test_loss: 1.3070, test_f1: 0.5370
 epoch: 59, train_loss: 0.4982, test_loss: 1.2648, test_f1: 0.5525
 epoch: 60, train_loss: 0.4782, test_loss: 1.2024, test_f1: 0.5626
 epoch: 61, train_loss: 0.4957, test_loss: 1.1742, test_f1: 0.5974
 epoch: 62, train_loss: 0.4685, test_loss: 1.2780, test_f1: 0.5804
 epoch: 63, train_loss: 0.4716, test_loss: 1.2720, test_f1: 0.5721
 epoch: 64, train_loss: 0.4600, test_loss: 1.2765, test_f1: 0.5595
 epoch: 65, train_loss: 0.4561, test_loss: 1.2542, test_f1: 0.5670
 epoch: 66, train_loss: 0.4912, test_loss: 1.2929, test_f1: 0.5333
 epoch: 67, train_loss: 0.4752, test_loss: 1.3697, test_f1: 0.5452
 epoch: 68, train_loss: 0.4465, test_loss: 1.2363, test_f1: 0.5662
 epoch: 69, train_loss: 0.4450, test_loss: 1.2435, test_f1: 0.5921
 epoch: 70, train_loss: 0.4238, test_loss: 1.2743, test_f1: 0.5764
 epoch: 71, train_loss: 0.4177, test_loss: 1.2733, test_f1: 0.5722
 epoch: 72, train_loss: 0.4263, test_loss: 1.3036, test_f1: 0.5796
 epoch: 73, train_loss: 0.4250, test_loss: 1.4799, test_f1: 0.5497
 epoch: 74, train_loss: 0.4721, test_loss: 1.3938, test_f1: 0.5691
 epoch: 75, train_loss: 0.4504, test_loss: 1.3777, test_f1: 0.5654
 epoch: 76, train_loss: 0.4396, test_loss: 1.3351, test_f1: 0.5479
 epoch: 77, train_loss: 0.4233, test_loss: 1.3771, test_f1: 0.5703
 epoch: 78, train_loss: 0.4436, test_loss: 1.4678, test_f1: 0.5499
 epoch: 79, train_loss: 0.4076, test_loss: 1.4843, test_f1: 0.5594
 epoch: 80, train_loss: 0.4358, test_loss: 1.4343, test_f1: 0.5719
 epoch: 81, train_loss: 0.3975, test_loss: 1.4190, test_f1: 0.5691
 epoch: 82, train_loss: 0.4181, test_loss: 1.3103, test_f1: 0.5877
 epoch: 83, train_loss: 0.3970, test_loss: 1.3993, test_f1: 0.5604
 epoch: 84, train_loss: 0.3804, test_loss: 1.4036, test_f1: 0.5937
 epoch: 85, train_loss: 0.4240, test_loss: 1.3935, test_f1: 0.5594
 epoch: 86, train_loss: 0.3747, test_loss: 1.3645, test_f1: 0.5672
 epoch: 87, train_loss: 0.3606, test_loss: 1.3699, test_f1: 0.5888
 epoch: 88, train_loss: 0.3709, test_loss: 1.4613, test_f1: 0.5864
 epoch: 89, train_loss: 0.3762, test_loss: 1.3981, test_f1: 0.5801
 epoch: 90, train_loss: 0.3774, test_loss: 1.3723, test_f1: 0.5802
 epoch: 91, train_loss: 0.3478, test_loss: 1.4249, test_f1: 0.5826
 epoch: 92, train_loss: 0.3974, test_loss: 1.5841, test_f1: 0.5717
 epoch: 93, train_loss: 0.3790, test_loss: 1.5503, test_f1: 0.5422
 epoch: 94, train_loss: 0.3833, test_loss: 1.5017, test_f1: 0.5387
 epoch: 95, train_loss: 0.3770, test_loss: 1.3911, test_f1: 0.5659
 epoch: 96, train_loss: 0.3982, test_loss: 1.6139, test_f1: 0.5463
 epoch: 97, train_loss: 0.4223, test_loss: 1.4554, test_f1: 0.5616
 epoch: 98, train_loss: 0.3596, test_loss: 1.3968, test_f1: 0.5682
 epoch: 99, train_loss: 0.3419, test_loss: 1.6872, test_f1: 0.5748
##################ITERATION #4 ****************************************
 epoch: 0, train_loss: 1.2983, test_loss: 1.1285, test_f1: 0.4190
 epoch: 1, train_loss: 1.1311, test_loss: 1.0792, test_f1: 0.4324
 epoch: 2, train_loss: 1.0887, test_loss: 0.9884, test_f1: 0.4733
 epoch: 3, train_loss: 1.0618, test_loss: 0.9920, test_f1: 0.4713
 epoch: 4, train_loss: 1.0318, test_loss: 0.9714, test_f1: 0.4635
 epoch: 5, train_loss: 1.0075, test_loss: 0.9390, test_f1: 0.5263
 epoch: 6, train_loss: 0.9873, test_loss: 0.9297, test_f1: 0.5208
 epoch: 7, train_loss: 0.9533, test_loss: 0.9704, test_f1: 0.4976
 epoch: 8, train_loss: 0.9351, test_loss: 0.9568, test_f1: 0.5292
 epoch: 9, train_loss: 0.9414, test_loss: 0.9373, test_f1: 0.5158
 epoch: 10, train_loss: 0.9384, test_loss: 0.9948, test_f1: 0.5499
 epoch: 11, train_loss: 0.9015, test_loss: 0.9997, test_f1: 0.5229
 epoch: 12, train_loss: 0.8898, test_loss: 1.1379, test_f1: 0.5205
 epoch: 13, train_loss: 0.8849, test_loss: 1.0706, test_f1: 0.5552
 epoch: 14, train_loss: 0.8658, test_loss: 1.0556, test_f1: 0.5160
 epoch: 15, train_loss: 0.8777, test_loss: 1.1443, test_f1: 0.5290
 epoch: 16, train_loss: 0.8802, test_loss: 1.0590, test_f1: 0.5365
 epoch: 17, train_loss: 0.8414, test_loss: 1.1261, test_f1: 0.5276
 epoch: 18, train_loss: 0.8465, test_loss: 1.1681, test_f1: 0.5161
 epoch: 19, train_loss: 0.8269, test_loss: 1.0840, test_f1: 0.5280
 epoch: 20, train_loss: 0.8086, test_loss: 1.1319, test_f1: 0.5448
 epoch: 21, train_loss: 0.8174, test_loss: 1.0606, test_f1: 0.5516
 epoch: 22, train_loss: 0.7968, test_loss: 1.2066, test_f1: 0.5483
 epoch: 23, train_loss: 0.7819, test_loss: 1.0633, test_f1: 0.5605
 epoch: 24, train_loss: 0.7831, test_loss: 1.1355, test_f1: 0.5557
 epoch: 25, train_loss: 0.7728, test_loss: 1.1038, test_f1: 0.5216
 epoch: 26, train_loss: 0.7724, test_loss: 1.0872, test_f1: 0.5156
 epoch: 27, train_loss: 0.7617, test_loss: 1.2364, test_f1: 0.5264
 epoch: 28, train_loss: 0.7627, test_loss: 1.1850, test_f1: 0.5238
 epoch: 29, train_loss: 0.7417, test_loss: 1.2776, test_f1: 0.4996
 epoch: 30, train_loss: 0.7387, test_loss: 1.0960, test_f1: 0.5447
 epoch: 31, train_loss: 0.7169, test_loss: 1.1156, test_f1: 0.5535
 epoch: 32, train_loss: 0.7089, test_loss: 1.2334, test_f1: 0.4786
 epoch: 33, train_loss: 0.6987, test_loss: 1.1038, test_f1: 0.5504
 epoch: 34, train_loss: 0.6993, test_loss: 1.2929, test_f1: 0.5223
 epoch: 35, train_loss: 0.6975, test_loss: 1.2306, test_f1: 0.5575
 epoch: 36, train_loss: 0.6946, test_loss: 1.1873, test_f1: 0.5306
 epoch: 37, train_loss: 0.6806, test_loss: 1.1485, test_f1: 0.5661
 epoch: 38, train_loss: 0.6707, test_loss: 1.1308, test_f1: 0.5636
 epoch: 39, train_loss: 0.6786, test_loss: 1.1709, test_f1: 0.5488
 epoch: 40, train_loss: 0.6453, test_loss: 1.2463, test_f1: 0.5460
 epoch: 41, train_loss: 0.6866, test_loss: 1.1090, test_f1: 0.5395
 epoch: 42, train_loss: 0.6547, test_loss: 1.0688, test_f1: 0.5430
 epoch: 43, train_loss: 0.6538, test_loss: 1.1457, test_f1: 0.5493
 epoch: 44, train_loss: 0.6325, test_loss: 1.2242, test_f1: 0.5175
 epoch: 45, train_loss: 0.6355, test_loss: 1.1255, test_f1: 0.5363
 epoch: 46, train_loss: 0.6394, test_loss: 1.0735, test_f1: 0.5350
 epoch: 47, train_loss: 0.6315, test_loss: 1.1673, test_f1: 0.5233
 epoch: 48, train_loss: 0.6312, test_loss: 1.1794, test_f1: 0.5493
 epoch: 49, train_loss: 0.6074, test_loss: 1.2044, test_f1: 0.5573
 epoch: 50, train_loss: 0.6183, test_loss: 1.4388, test_f1: 0.5353
 epoch: 51, train_loss: 0.5847, test_loss: 1.4236, test_f1: 0.5096
 epoch: 52, train_loss: 0.5456, test_loss: 1.3740, test_f1: 0.5297
 epoch: 53, train_loss: 0.5434, test_loss: 1.3388, test_f1: 0.5417
 epoch: 54, train_loss: 0.5272, test_loss: 1.3239, test_f1: 0.5475
 epoch: 55, train_loss: 0.5359, test_loss: 1.3973, test_f1: 0.5720
 epoch: 56, train_loss: 0.5253, test_loss: 1.3907, test_f1: 0.5103
 epoch: 57, train_loss: 0.5162, test_loss: 1.4088, test_f1: 0.5409
 epoch: 58, train_loss: 0.4892, test_loss: 1.4104, test_f1: 0.5465
 epoch: 59, train_loss: 0.4942, test_loss: 1.2969, test_f1: 0.5662
 epoch: 60, train_loss: 0.5005, test_loss: 1.3733, test_f1: 0.5748
 epoch: 61, train_loss: 0.4856, test_loss: 1.4404, test_f1: 0.5359
 epoch: 62, train_loss: 0.5063, test_loss: 1.3288, test_f1: 0.5732
 epoch: 63, train_loss: 0.4830, test_loss: 1.3593, test_f1: 0.5553
 epoch: 64, train_loss: 0.4763, test_loss: 1.3353, test_f1: 0.5677
 epoch: 65, train_loss: 0.4829, test_loss: 1.3589, test_f1: 0.5496
 epoch: 66, train_loss: 0.4561, test_loss: 1.4020, test_f1: 0.5155
 epoch: 67, train_loss: 0.4771, test_loss: 1.3475, test_f1: 0.5746
 epoch: 68, train_loss: 0.4747, test_loss: 1.4488, test_f1: 0.5477
 epoch: 69, train_loss: 0.4600, test_loss: 1.3663, test_f1: 0.5625
 epoch: 70, train_loss: 0.4608, test_loss: 1.4171, test_f1: 0.5464
 epoch: 71, train_loss: 0.4474, test_loss: 1.4118, test_f1: 0.5625
 epoch: 72, train_loss: 0.4232, test_loss: 1.5563, test_f1: 0.5331
 epoch: 73, train_loss: 0.4596, test_loss: 1.4199, test_f1: 0.5711
 epoch: 74, train_loss: 0.4320, test_loss: 1.4272, test_f1: 0.5664
 epoch: 75, train_loss: 0.4408, test_loss: 1.3720, test_f1: 0.5635
 epoch: 76, train_loss: 0.4571, test_loss: 1.3866, test_f1: 0.5785
 epoch: 77, train_loss: 0.4132, test_loss: 1.3482, test_f1: 0.5710
 epoch: 78, train_loss: 0.4171, test_loss: 1.4744, test_f1: 0.5398
 epoch: 79, train_loss: 0.4316, test_loss: 1.4836, test_f1: 0.5560
 epoch: 80, train_loss: 0.4053, test_loss: 1.4483, test_f1: 0.5646
 epoch: 81, train_loss: 0.4146, test_loss: 1.4611, test_f1: 0.5553
 epoch: 82, train_loss: 0.4014, test_loss: 1.5173, test_f1: 0.5618
 epoch: 83, train_loss: 0.4238, test_loss: 1.4955, test_f1: 0.5553
 epoch: 84, train_loss: 0.4226, test_loss: 1.3958, test_f1: 0.5556
 epoch: 85, train_loss: 0.4005, test_loss: 1.4358, test_f1: 0.5614
 epoch: 86, train_loss: 0.3853, test_loss: 1.4819, test_f1: 0.5618
 epoch: 87, train_loss: 0.3883, test_loss: 1.4497, test_f1: 0.5597
 epoch: 88, train_loss: 0.3783, test_loss: 1.4027, test_f1: 0.5608
 epoch: 89, train_loss: 0.3729, test_loss: 1.5435, test_f1: 0.5398
 epoch: 90, train_loss: 0.4575, test_loss: 1.4621, test_f1: 0.5328
 epoch: 91, train_loss: 0.3893, test_loss: 1.6276, test_f1: 0.5254
 epoch: 92, train_loss: 0.3878, test_loss: 1.5372, test_f1: 0.5429
 epoch: 93, train_loss: 0.3750, test_loss: 1.4414, test_f1: 0.5709
 epoch: 94, train_loss: 0.3708, test_loss: 1.6130, test_f1: 0.5197
 epoch: 95, train_loss: 0.3615, test_loss: 1.3713, test_f1: 0.5660
 epoch: 96, train_loss: 0.3835, test_loss: 1.4084, test_f1: 0.5553
 epoch: 97, train_loss: 0.3916, test_loss: 1.3274, test_f1: 0.5543
 epoch: 98, train_loss: 0.3607, test_loss: 1.4901, test_f1: 0.5403
 epoch: 99, train_loss: 0.3976, test_loss: 1.4181, test_f1: 0.5362
##################ITERATION #5 ****************************************
 epoch: 0, train_loss: 1.2897, test_loss: 1.1160, test_f1: 0.4317
 epoch: 1, train_loss: 1.1294, test_loss: 1.0927, test_f1: 0.4324
 epoch: 2, train_loss: 1.0750, test_loss: 1.0209, test_f1: 0.4689
 epoch: 3, train_loss: 1.0557, test_loss: 1.0129, test_f1: 0.4745
 epoch: 4, train_loss: 1.0127, test_loss: 0.9496, test_f1: 0.5211
 epoch: 5, train_loss: 1.0034, test_loss: 0.9221, test_f1: 0.4972
 epoch: 6, train_loss: 0.9716, test_loss: 0.9521, test_f1: 0.4855
 epoch: 7, train_loss: 0.9782, test_loss: 1.0062, test_f1: 0.5216
 epoch: 8, train_loss: 0.9405, test_loss: 1.0506, test_f1: 0.5018
 epoch: 9, train_loss: 0.9385, test_loss: 0.9679, test_f1: 0.4998
 epoch: 10, train_loss: 0.9253, test_loss: 0.9359, test_f1: 0.5447
 epoch: 11, train_loss: 0.9290, test_loss: 0.9630, test_f1: 0.5593
 epoch: 12, train_loss: 0.9038, test_loss: 0.9926, test_f1: 0.5314
 epoch: 13, train_loss: 0.8823, test_loss: 0.9784, test_f1: 0.5119
 epoch: 14, train_loss: 0.8703, test_loss: 1.0163, test_f1: 0.5268
 epoch: 15, train_loss: 0.8786, test_loss: 1.0292, test_f1: 0.5389
 epoch: 16, train_loss: 0.8437, test_loss: 1.0334, test_f1: 0.5070
 epoch: 17, train_loss: 0.8447, test_loss: 1.1269, test_f1: 0.4805
 epoch: 18, train_loss: 0.8707, test_loss: 1.0131, test_f1: 0.5565
 epoch: 19, train_loss: 0.8455, test_loss: 1.0210, test_f1: 0.5485
 epoch: 20, train_loss: 0.8339, test_loss: 1.2924, test_f1: 0.4682
 epoch: 21, train_loss: 0.8264, test_loss: 1.1138, test_f1: 0.5025
 epoch: 22, train_loss: 0.8224, test_loss: 1.0619, test_f1: 0.5153
 epoch: 23, train_loss: 0.8053, test_loss: 1.1212, test_f1: 0.5198
 epoch: 24, train_loss: 0.8450, test_loss: 1.0405, test_f1: 0.4961
 epoch: 25, train_loss: 0.7814, test_loss: 1.1177, test_f1: 0.4948
 epoch: 26, train_loss: 0.7959, test_loss: 1.0796, test_f1: 0.5251
 epoch: 27, train_loss: 0.7848, test_loss: 1.0634, test_f1: 0.5390
 epoch: 28, train_loss: 0.7527, test_loss: 1.1690, test_f1: 0.5288
 epoch: 29, train_loss: 0.7796, test_loss: 0.9941, test_f1: 0.5446
 epoch: 30, train_loss: 0.7355, test_loss: 1.1705, test_f1: 0.5259
 epoch: 31, train_loss: 0.7476, test_loss: 1.1471, test_f1: 0.5516
 epoch: 32, train_loss: 0.7208, test_loss: 1.1138, test_f1: 0.5662
 epoch: 33, train_loss: 0.7391, test_loss: 1.1286, test_f1: 0.5268
 epoch: 34, train_loss: 0.7219, test_loss: 1.0182, test_f1: 0.5697
 epoch: 35, train_loss: 0.7404, test_loss: 1.0474, test_f1: 0.5762
 epoch: 36, train_loss: 0.7016, test_loss: 1.3214, test_f1: 0.4895
 epoch: 37, train_loss: 0.7096, test_loss: 1.1090, test_f1: 0.5413
 epoch: 38, train_loss: 0.7304, test_loss: 1.0559, test_f1: 0.5431
 epoch: 39, train_loss: 0.7076, test_loss: 1.0814, test_f1: 0.5403
 epoch: 40, train_loss: 0.6730, test_loss: 1.0919, test_f1: 0.5261
 epoch: 41, train_loss: 0.6879, test_loss: 1.1668, test_f1: 0.5205
 epoch: 42, train_loss: 0.6990, test_loss: 1.1946, test_f1: 0.5497
 epoch: 43, train_loss: 0.6548, test_loss: 1.2471, test_f1: 0.5415
 epoch: 44, train_loss: 0.6352, test_loss: 1.1052, test_f1: 0.5434
 epoch: 45, train_loss: 0.6507, test_loss: 1.2781, test_f1: 0.5383
 epoch: 46, train_loss: 0.6567, test_loss: 1.1595, test_f1: 0.5290
 epoch: 47, train_loss: 0.6199, test_loss: 1.2374, test_f1: 0.5361
 epoch: 48, train_loss: 0.6563, test_loss: 1.1762, test_f1: 0.5363
 epoch: 49, train_loss: 0.6251, test_loss: 1.1154, test_f1: 0.5547
 epoch: 50, train_loss: 0.6349, test_loss: 1.0791, test_f1: 0.5507
 epoch: 51, train_loss: 0.5821, test_loss: 1.1227, test_f1: 0.5674
 epoch: 52, train_loss: 0.5692, test_loss: 1.0700, test_f1: 0.5730
 epoch: 53, train_loss: 0.5667, test_loss: 1.1073, test_f1: 0.5487
 epoch: 54, train_loss: 0.5471, test_loss: 1.1804, test_f1: 0.5467
 epoch: 55, train_loss: 0.5325, test_loss: 1.1911, test_f1: 0.5430
 epoch: 56, train_loss: 0.5437, test_loss: 1.1940, test_f1: 0.5712
 epoch: 57, train_loss: 0.5273, test_loss: 1.2013, test_f1: 0.5477
 epoch: 58, train_loss: 0.5272, test_loss: 1.1831, test_f1: 0.5679
 epoch: 59, train_loss: 0.5090, test_loss: 1.2311, test_f1: 0.5758
 epoch: 60, train_loss: 0.5193, test_loss: 1.2933, test_f1: 0.5627
 epoch: 61, train_loss: 0.5100, test_loss: 1.3107, test_f1: 0.5475
 epoch: 62, train_loss: 0.5101, test_loss: 1.2190, test_f1: 0.5796
 epoch: 63, train_loss: 0.5161, test_loss: 1.1763, test_f1: 0.5682
 epoch: 64, train_loss: 0.4869, test_loss: 1.2634, test_f1: 0.5628
 epoch: 65, train_loss: 0.4833, test_loss: 1.1913, test_f1: 0.5400
 epoch: 66, train_loss: 0.4774, test_loss: 1.3126, test_f1: 0.5536
 epoch: 67, train_loss: 0.4801, test_loss: 1.2449, test_f1: 0.5410
 epoch: 68, train_loss: 0.4958, test_loss: 1.2362, test_f1: 0.5581
 epoch: 69, train_loss: 0.4662, test_loss: 1.2831, test_f1: 0.5737
 epoch: 70, train_loss: 0.4562, test_loss: 1.2554, test_f1: 0.5707
 epoch: 71, train_loss: 0.4627, test_loss: 1.2440, test_f1: 0.5511
 epoch: 72, train_loss: 0.4447, test_loss: 1.3080, test_f1: 0.5622
 epoch: 73, train_loss: 0.4718, test_loss: 1.3138, test_f1: 0.5559
 epoch: 74, train_loss: 0.4592, test_loss: 1.2949, test_f1: 0.5867
 epoch: 75, train_loss: 0.4530, test_loss: 1.3111, test_f1: 0.5962
 epoch: 76, train_loss: 0.4283, test_loss: 1.3288, test_f1: 0.5839
 epoch: 77, train_loss: 0.4572, test_loss: 1.2810, test_f1: 0.5839
 epoch: 78, train_loss: 0.4520, test_loss: 1.2937, test_f1: 0.5901
 epoch: 79, train_loss: 0.4756, test_loss: 1.1826, test_f1: 0.5745
 epoch: 80, train_loss: 0.4475, test_loss: 1.2542, test_f1: 0.5754
 epoch: 81, train_loss: 0.4228, test_loss: 1.2977, test_f1: 0.5740
 epoch: 82, train_loss: 0.4332, test_loss: 1.3851, test_f1: 0.5824
 epoch: 83, train_loss: 0.4227, test_loss: 1.2809, test_f1: 0.5732
 epoch: 84, train_loss: 0.4262, test_loss: 1.2882, test_f1: 0.5526
 epoch: 85, train_loss: 0.4260, test_loss: 1.3545, test_f1: 0.5466
 epoch: 86, train_loss: 0.4717, test_loss: 1.2821, test_f1: 0.5886
 epoch: 87, train_loss: 0.4150, test_loss: 1.3492, test_f1: 0.5616
 epoch: 88, train_loss: 0.4018, test_loss: 1.3391, test_f1: 0.5466
 epoch: 89, train_loss: 0.3994, test_loss: 1.3346, test_f1: 0.5686
 epoch: 90, train_loss: 0.3949, test_loss: 1.2820, test_f1: 0.5691
 epoch: 91, train_loss: 0.4205, test_loss: 1.4792, test_f1: 0.5542
 epoch: 92, train_loss: 0.4210, test_loss: 1.2768, test_f1: 0.5542
 epoch: 93, train_loss: 0.3855, test_loss: 1.3750, test_f1: 0.5759
 epoch: 94, train_loss: 0.3965, test_loss: 1.3070, test_f1: 0.5889
 epoch: 95, train_loss: 0.3860, test_loss: 1.3780, test_f1: 0.5722
 epoch: 96, train_loss: 0.3569, test_loss: 1.4590, test_f1: 0.5486
 epoch: 97, train_loss: 0.3749, test_loss: 1.4456, test_f1: 0.5673
 epoch: 98, train_loss: 0.3857, test_loss: 1.4447, test_f1: 0.5644
 epoch: 99, train_loss: 0.3788, test_loss: 1.3868, test_f1: 0.5534
##################ITERATION #6 ****************************************
 epoch: 0, train_loss: 1.2899, test_loss: 1.0773, test_f1: 0.4558
 epoch: 1, train_loss: 1.0964, test_loss: 1.0229, test_f1: 0.4806
 epoch: 2, train_loss: 1.0593, test_loss: 0.9933, test_f1: 0.4914
 epoch: 3, train_loss: 1.0351, test_loss: 1.0694, test_f1: 0.4876
 epoch: 4, train_loss: 1.0036, test_loss: 1.0079, test_f1: 0.4976
 epoch: 5, train_loss: 0.9906, test_loss: 0.9441, test_f1: 0.5043
 epoch: 6, train_loss: 0.9799, test_loss: 0.9674, test_f1: 0.5108
 epoch: 7, train_loss: 0.9612, test_loss: 0.9734, test_f1: 0.4736
 epoch: 8, train_loss: 0.9450, test_loss: 0.9409, test_f1: 0.5400
 epoch: 9, train_loss: 0.9292, test_loss: 0.9614, test_f1: 0.4883
 epoch: 10, train_loss: 0.9246, test_loss: 1.0397, test_f1: 0.4929
 epoch: 11, train_loss: 0.9105, test_loss: 1.0509, test_f1: 0.4505
 epoch: 12, train_loss: 0.9085, test_loss: 0.9911, test_f1: 0.5329
 epoch: 13, train_loss: 0.8916, test_loss: 0.9369, test_f1: 0.5402
 epoch: 14, train_loss: 0.8802, test_loss: 0.9921, test_f1: 0.5240
 epoch: 15, train_loss: 0.8665, test_loss: 0.9029, test_f1: 0.5350
 epoch: 16, train_loss: 0.8502, test_loss: 0.9660, test_f1: 0.5008
 epoch: 17, train_loss: 0.8501, test_loss: 0.9480, test_f1: 0.5459
 epoch: 18, train_loss: 0.8520, test_loss: 0.9336, test_f1: 0.5431
 epoch: 19, train_loss: 0.8325, test_loss: 0.9746, test_f1: 0.5383
 epoch: 20, train_loss: 0.8258, test_loss: 1.0017, test_f1: 0.5344
 epoch: 21, train_loss: 0.7947, test_loss: 0.9518, test_f1: 0.5361
 epoch: 22, train_loss: 0.7917, test_loss: 0.9586, test_f1: 0.5695
 epoch: 23, train_loss: 0.7979, test_loss: 0.9292, test_f1: 0.5536
 epoch: 24, train_loss: 0.7810, test_loss: 0.9365, test_f1: 0.5459
 epoch: 25, train_loss: 0.7693, test_loss: 0.9537, test_f1: 0.5227
 epoch: 26, train_loss: 0.7694, test_loss: 0.9419, test_f1: 0.5559
 epoch: 27, train_loss: 0.7703, test_loss: 1.0308, test_f1: 0.5543
 epoch: 28, train_loss: 0.7439, test_loss: 1.0023, test_f1: 0.5575
 epoch: 29, train_loss: 0.7518, test_loss: 0.9518, test_f1: 0.5682
 epoch: 30, train_loss: 0.7698, test_loss: 0.9986, test_f1: 0.5561
 epoch: 31, train_loss: 0.7589, test_loss: 1.1077, test_f1: 0.5186
 epoch: 32, train_loss: 0.7302, test_loss: 1.0097, test_f1: 0.5410
 epoch: 33, train_loss: 0.7323, test_loss: 0.9800, test_f1: 0.5695
 epoch: 34, train_loss: 0.7205, test_loss: 0.9849, test_f1: 0.5765
 epoch: 35, train_loss: 0.7160, test_loss: 1.0777, test_f1: 0.5235
 epoch: 36, train_loss: 0.6980, test_loss: 0.9978, test_f1: 0.5545
 epoch: 37, train_loss: 0.7246, test_loss: 1.0157, test_f1: 0.5601
 epoch: 38, train_loss: 0.7081, test_loss: 1.0935, test_f1: 0.5531
 epoch: 39, train_loss: 0.6793, test_loss: 1.1750, test_f1: 0.5283
 epoch: 40, train_loss: 0.6917, test_loss: 0.9871, test_f1: 0.5616
 epoch: 41, train_loss: 0.6867, test_loss: 1.0504, test_f1: 0.5689
 epoch: 42, train_loss: 0.6855, test_loss: 0.9964, test_f1: 0.5713
 epoch: 43, train_loss: 0.6522, test_loss: 1.1807, test_f1: 0.5572
 epoch: 44, train_loss: 0.6507, test_loss: 1.0931, test_f1: 0.5818
 epoch: 45, train_loss: 0.6477, test_loss: 1.0883, test_f1: 0.5646
 epoch: 46, train_loss: 0.6418, test_loss: 1.1029, test_f1: 0.5583
 epoch: 47, train_loss: 0.6185, test_loss: 1.1328, test_f1: 0.5699
 epoch: 48, train_loss: 0.6394, test_loss: 1.0938, test_f1: 0.5661
 epoch: 49, train_loss: 0.6342, test_loss: 1.0796, test_f1: 0.5548
 epoch: 50, train_loss: 0.6409, test_loss: 1.0622, test_f1: 0.5728
 epoch: 51, train_loss: 0.5929, test_loss: 1.1269, test_f1: 0.5650
 epoch: 52, train_loss: 0.5725, test_loss: 1.1184, test_f1: 0.5778
 epoch: 53, train_loss: 0.5501, test_loss: 1.1643, test_f1: 0.5758
 epoch: 54, train_loss: 0.5483, test_loss: 1.1474, test_f1: 0.5896
 epoch: 55, train_loss: 0.5441, test_loss: 1.2564, test_f1: 0.5781
 epoch: 56, train_loss: 0.5650, test_loss: 1.1608, test_f1: 0.5798
 epoch: 57, train_loss: 0.5180, test_loss: 1.1536, test_f1: 0.5915
 epoch: 58, train_loss: 0.5205, test_loss: 1.2117, test_f1: 0.5860
 epoch: 59, train_loss: 0.5235, test_loss: 1.2762, test_f1: 0.5913
 epoch: 60, train_loss: 0.5204, test_loss: 1.2234, test_f1: 0.5804
 epoch: 61, train_loss: 0.4925, test_loss: 1.2122, test_f1: 0.5969
 epoch: 62, train_loss: 0.4953, test_loss: 1.2175, test_f1: 0.5935
 epoch: 63, train_loss: 0.5073, test_loss: 1.1274, test_f1: 0.5895
 epoch: 64, train_loss: 0.5142, test_loss: 1.1510, test_f1: 0.5864
 epoch: 65, train_loss: 0.4893, test_loss: 1.3306, test_f1: 0.5522
 epoch: 66, train_loss: 0.5396, test_loss: 1.2009, test_f1: 0.6168
 epoch: 67, train_loss: 0.5043, test_loss: 1.2054, test_f1: 0.6084
 epoch: 68, train_loss: 0.4838, test_loss: 1.1452, test_f1: 0.5839
 epoch: 69, train_loss: 0.4648, test_loss: 1.2225, test_f1: 0.6079
 epoch: 70, train_loss: 0.4641, test_loss: 1.2564, test_f1: 0.5938
 epoch: 71, train_loss: 0.4490, test_loss: 1.2669, test_f1: 0.6006
 epoch: 72, train_loss: 0.4367, test_loss: 1.2700, test_f1: 0.6033
 epoch: 73, train_loss: 0.4427, test_loss: 1.2957, test_f1: 0.5944
 epoch: 74, train_loss: 0.4456, test_loss: 1.2839, test_f1: 0.5912
 epoch: 75, train_loss: 0.4505, test_loss: 1.2406, test_f1: 0.5994
 epoch: 76, train_loss: 0.4347, test_loss: 1.3421, test_f1: 0.5997
 epoch: 77, train_loss: 0.4529, test_loss: 1.1869, test_f1: 0.5990
 epoch: 78, train_loss: 0.4668, test_loss: 1.2338, test_f1: 0.6097
 epoch: 79, train_loss: 0.4178, test_loss: 1.2578, test_f1: 0.5996
 epoch: 80, train_loss: 0.4313, test_loss: 1.3460, test_f1: 0.6090
 epoch: 81, train_loss: 0.4208, test_loss: 1.3287, test_f1: 0.5840
 epoch: 82, train_loss: 0.4483, test_loss: 1.3566, test_f1: 0.5683
 epoch: 83, train_loss: 0.4128, test_loss: 1.2845, test_f1: 0.6034
 epoch: 84, train_loss: 0.4280, test_loss: 1.3112, test_f1: 0.5865
 epoch: 85, train_loss: 0.3939, test_loss: 1.3422, test_f1: 0.5851
 epoch: 86, train_loss: 0.4060, test_loss: 1.2927, test_f1: 0.5930
 epoch: 87, train_loss: 0.3910, test_loss: 1.4357, test_f1: 0.5915
 epoch: 88, train_loss: 0.4163, test_loss: 1.4604, test_f1: 0.5736
 epoch: 89, train_loss: 0.3852, test_loss: 1.3659, test_f1: 0.5876
 epoch: 90, train_loss: 0.3781, test_loss: 1.3931, test_f1: 0.5672
 epoch: 91, train_loss: 0.4220, test_loss: 1.3645, test_f1: 0.5876
 epoch: 92, train_loss: 0.3980, test_loss: 1.3697, test_f1: 0.5976
 epoch: 93, train_loss: 0.3949, test_loss: 1.3679, test_f1: 0.5517
 epoch: 94, train_loss: 0.3974, test_loss: 1.3395, test_f1: 0.5697
 epoch: 95, train_loss: 0.3812, test_loss: 1.3436, test_f1: 0.5790
 epoch: 96, train_loss: 0.3816, test_loss: 1.3803, test_f1: 0.6012
 epoch: 97, train_loss: 0.3625, test_loss: 1.3237, test_f1: 0.5856
 epoch: 98, train_loss: 0.3756, test_loss: 1.3801, test_f1: 0.6024
 epoch: 99, train_loss: 0.3667, test_loss: 1.3821, test_f1: 0.5992
##################ITERATION #7 ****************************************
 epoch: 0, train_loss: 1.3179, test_loss: 1.1642, test_f1: 0.4140
 epoch: 1, train_loss: 1.1545, test_loss: 1.1109, test_f1: 0.4302
 epoch: 2, train_loss: 1.1115, test_loss: 1.0074, test_f1: 0.4577
 epoch: 3, train_loss: 1.0761, test_loss: 1.0206, test_f1: 0.4824
 epoch: 4, train_loss: 1.0377, test_loss: 1.0088, test_f1: 0.4633
 epoch: 5, train_loss: 1.0192, test_loss: 0.9388, test_f1: 0.4866
 epoch: 6, train_loss: 0.9929, test_loss: 0.9691, test_f1: 0.4690
 epoch: 7, train_loss: 0.9735, test_loss: 0.9762, test_f1: 0.5536
 epoch: 8, train_loss: 0.9549, test_loss: 0.9761, test_f1: 0.4864
 epoch: 9, train_loss: 0.9345, test_loss: 0.9820, test_f1: 0.4961
 epoch: 10, train_loss: 0.9351, test_loss: 0.9688, test_f1: 0.4983
 epoch: 11, train_loss: 0.9183, test_loss: 0.9784, test_f1: 0.4949
 epoch: 12, train_loss: 0.9001, test_loss: 0.9537, test_f1: 0.5368
 epoch: 13, train_loss: 0.8855, test_loss: 1.0922, test_f1: 0.4891
 epoch: 14, train_loss: 0.8731, test_loss: 0.9368, test_f1: 0.5159
 epoch: 15, train_loss: 0.8484, test_loss: 0.9501, test_f1: 0.5469
 epoch: 16, train_loss: 0.8713, test_loss: 0.8824, test_f1: 0.5724
 epoch: 17, train_loss: 0.8438, test_loss: 0.9380, test_f1: 0.5362
 epoch: 18, train_loss: 0.8286, test_loss: 1.0494, test_f1: 0.5139
 epoch: 19, train_loss: 0.8315, test_loss: 0.9771, test_f1: 0.5352
 epoch: 20, train_loss: 0.8205, test_loss: 0.9797, test_f1: 0.5286
 epoch: 21, train_loss: 0.8196, test_loss: 1.0067, test_f1: 0.5398
 epoch: 22, train_loss: 0.8254, test_loss: 0.9884, test_f1: 0.5200
 epoch: 23, train_loss: 0.8135, test_loss: 1.0062, test_f1: 0.4801
 epoch: 24, train_loss: 0.8131, test_loss: 1.0206, test_f1: 0.5526
 epoch: 25, train_loss: 0.7781, test_loss: 0.9754, test_f1: 0.5609
 epoch: 26, train_loss: 0.7983, test_loss: 1.0078, test_f1: 0.5131
 epoch: 27, train_loss: 0.7638, test_loss: 0.9849, test_f1: 0.5366
 epoch: 28, train_loss: 0.7480, test_loss: 1.0284, test_f1: 0.5375
 epoch: 29, train_loss: 0.7377, test_loss: 1.1465, test_f1: 0.5464
 epoch: 30, train_loss: 0.7591, test_loss: 1.0364, test_f1: 0.5346
 epoch: 31, train_loss: 0.7409, test_loss: 1.0664, test_f1: 0.5381
 epoch: 32, train_loss: 0.7375, test_loss: 1.0194, test_f1: 0.5489
 epoch: 33, train_loss: 0.7293, test_loss: 0.9598, test_f1: 0.5442
 epoch: 34, train_loss: 0.7217, test_loss: 1.0703, test_f1: 0.5440
 epoch: 35, train_loss: 0.7156, test_loss: 1.0764, test_f1: 0.5518
 epoch: 36, train_loss: 0.7094, test_loss: 1.1204, test_f1: 0.5310
 epoch: 37, train_loss: 0.6876, test_loss: 1.0112, test_f1: 0.5437
 epoch: 38, train_loss: 0.6881, test_loss: 1.0171, test_f1: 0.5552
 epoch: 39, train_loss: 0.6778, test_loss: 1.0336, test_f1: 0.5273
 epoch: 40, train_loss: 0.7120, test_loss: 1.0151, test_f1: 0.5496
 epoch: 41, train_loss: 0.6824, test_loss: 1.0651, test_f1: 0.5518
 epoch: 42, train_loss: 0.6647, test_loss: 1.0675, test_f1: 0.5451
 epoch: 43, train_loss: 0.7212, test_loss: 1.0826, test_f1: 0.5491
 epoch: 44, train_loss: 0.6725, test_loss: 1.0692, test_f1: 0.5500
 epoch: 45, train_loss: 0.6728, test_loss: 1.2671, test_f1: 0.5212
 epoch: 46, train_loss: 0.6458, test_loss: 1.3038, test_f1: 0.5099
 epoch: 47, train_loss: 0.6522, test_loss: 1.0995, test_f1: 0.5479
 epoch: 48, train_loss: 0.6458, test_loss: 1.2179, test_f1: 0.5304
 epoch: 49, train_loss: 0.6223, test_loss: 1.2149, test_f1: 0.5266
 epoch: 50, train_loss: 0.6256, test_loss: 1.0924, test_f1: 0.5463
 epoch: 51, train_loss: 0.5912, test_loss: 1.1398, test_f1: 0.5583
 epoch: 52, train_loss: 0.5797, test_loss: 1.1954, test_f1: 0.5383
 epoch: 53, train_loss: 0.5729, test_loss: 1.1922, test_f1: 0.5439
 epoch: 54, train_loss: 0.5647, test_loss: 1.2213, test_f1: 0.5348
 epoch: 55, train_loss: 0.5342, test_loss: 1.1707, test_f1: 0.5566
 epoch: 56, train_loss: 0.5349, test_loss: 1.2234, test_f1: 0.5598
 epoch: 57, train_loss: 0.5400, test_loss: 1.3117, test_f1: 0.5312
 epoch: 58, train_loss: 0.5365, test_loss: 1.2208, test_f1: 0.5780
 epoch: 59, train_loss: 0.5139, test_loss: 1.2868, test_f1: 0.5421
 epoch: 60, train_loss: 0.5438, test_loss: 1.2553, test_f1: 0.5587
 epoch: 61, train_loss: 0.5138, test_loss: 1.2941, test_f1: 0.5463
 epoch: 62, train_loss: 0.5234, test_loss: 1.2817, test_f1: 0.5743
 epoch: 63, train_loss: 0.5017, test_loss: 1.2667, test_f1: 0.5667
 epoch: 64, train_loss: 0.5025, test_loss: 1.3031, test_f1: 0.5688
 epoch: 65, train_loss: 0.4838, test_loss: 1.3775, test_f1: 0.5418
 epoch: 66, train_loss: 0.5026, test_loss: 1.3200, test_f1: 0.5621
 epoch: 67, train_loss: 0.4707, test_loss: 1.2882, test_f1: 0.5724
 epoch: 68, train_loss: 0.4787, test_loss: 1.2752, test_f1: 0.5677
 epoch: 69, train_loss: 0.4645, test_loss: 1.3523, test_f1: 0.5447
 epoch: 70, train_loss: 0.4776, test_loss: 1.2943, test_f1: 0.5795
 epoch: 71, train_loss: 0.4895, test_loss: 1.3255, test_f1: 0.5916
 epoch: 72, train_loss: 0.4784, test_loss: 1.3946, test_f1: 0.5667
 epoch: 73, train_loss: 0.4727, test_loss: 1.3466, test_f1: 0.5790
 epoch: 74, train_loss: 0.4600, test_loss: 1.3467, test_f1: 0.5569
 epoch: 75, train_loss: 0.4655, test_loss: 1.3805, test_f1: 0.5449
 epoch: 76, train_loss: 0.4490, test_loss: 1.3563, test_f1: 0.5812
 epoch: 77, train_loss: 0.4486, test_loss: 1.3495, test_f1: 0.5609
 epoch: 78, train_loss: 0.4536, test_loss: 1.4691, test_f1: 0.5563
 epoch: 79, train_loss: 0.4311, test_loss: 1.4293, test_f1: 0.5730
 epoch: 80, train_loss: 0.4339, test_loss: 1.3788, test_f1: 0.6029
 epoch: 81, train_loss: 0.4401, test_loss: 1.3647, test_f1: 0.5624
 epoch: 82, train_loss: 0.4178, test_loss: 1.3109, test_f1: 0.5937
 epoch: 83, train_loss: 0.4184, test_loss: 1.3652, test_f1: 0.5936
 epoch: 84, train_loss: 0.4743, test_loss: 1.3114, test_f1: 0.5829
 epoch: 85, train_loss: 0.4413, test_loss: 1.3616, test_f1: 0.5777
 epoch: 86, train_loss: 0.4437, test_loss: 1.4377, test_f1: 0.5839
 epoch: 87, train_loss: 0.4112, test_loss: 1.4497, test_f1: 0.5595
 epoch: 88, train_loss: 0.4329, test_loss: 1.4129, test_f1: 0.5852
 epoch: 89, train_loss: 0.3943, test_loss: 1.4654, test_f1: 0.5700
 epoch: 90, train_loss: 0.4013, test_loss: 1.4883, test_f1: 0.5742
 epoch: 91, train_loss: 0.4249, test_loss: 1.5146, test_f1: 0.5595
 epoch: 92, train_loss: 0.3985, test_loss: 1.3221, test_f1: 0.5815
 epoch: 93, train_loss: 0.3991, test_loss: 1.4290, test_f1: 0.5774
 epoch: 94, train_loss: 0.3966, test_loss: 1.4150, test_f1: 0.5607
 epoch: 95, train_loss: 0.3888, test_loss: 1.5278, test_f1: 0.5694
 epoch: 96, train_loss: 0.4113, test_loss: 1.4231, test_f1: 0.5940
 epoch: 97, train_loss: 0.4036, test_loss: 1.3796, test_f1: 0.5828
 epoch: 98, train_loss: 0.3714, test_loss: 1.3877, test_f1: 0.5813
 epoch: 99, train_loss: 0.3853, test_loss: 1.4384, test_f1: 0.5577
##################ITERATION #8 ****************************************
 epoch: 0, train_loss: 1.3459, test_loss: 1.1360, test_f1: 0.3846
 epoch: 1, train_loss: 1.1260, test_loss: 1.0539, test_f1: 0.4191
 epoch: 2, train_loss: 1.0796, test_loss: 1.0188, test_f1: 0.4773
 epoch: 3, train_loss: 1.0536, test_loss: 1.0306, test_f1: 0.4545
 epoch: 4, train_loss: 1.0327, test_loss: 0.9831, test_f1: 0.5046
 epoch: 5, train_loss: 1.0080, test_loss: 0.9920, test_f1: 0.4808
 epoch: 6, train_loss: 1.0011, test_loss: 0.9925, test_f1: 0.4598
 epoch: 7, train_loss: 0.9831, test_loss: 1.0224, test_f1: 0.4786
 epoch: 8, train_loss: 0.9559, test_loss: 1.0925, test_f1: 0.4297
 epoch: 9, train_loss: 0.9647, test_loss: 1.0149, test_f1: 0.4978
 epoch: 10, train_loss: 0.9336, test_loss: 1.0225, test_f1: 0.5025
 epoch: 11, train_loss: 0.9185, test_loss: 1.0626, test_f1: 0.5185
 epoch: 12, train_loss: 0.9053, test_loss: 1.1406, test_f1: 0.5197
 epoch: 13, train_loss: 0.8842, test_loss: 1.0653, test_f1: 0.5172
 epoch: 14, train_loss: 0.8607, test_loss: 1.0858, test_f1: 0.5035
 epoch: 15, train_loss: 0.8610, test_loss: 1.0266, test_f1: 0.5105
 epoch: 16, train_loss: 0.8500, test_loss: 1.0986, test_f1: 0.5021
 epoch: 17, train_loss: 0.8694, test_loss: 1.0293, test_f1: 0.4925
 epoch: 18, train_loss: 0.8443, test_loss: 1.0803, test_f1: 0.4864
 epoch: 19, train_loss: 0.8333, test_loss: 1.2464, test_f1: 0.5048
 epoch: 20, train_loss: 0.8597, test_loss: 1.0911, test_f1: 0.5107
 epoch: 21, train_loss: 0.8724, test_loss: 1.0384, test_f1: 0.5227
 epoch: 22, train_loss: 0.8216, test_loss: 1.0885, test_f1: 0.5053
 epoch: 23, train_loss: 0.8213, test_loss: 1.1374, test_f1: 0.5122
 epoch: 24, train_loss: 0.8024, test_loss: 1.0676, test_f1: 0.5149
 epoch: 25, train_loss: 0.7985, test_loss: 1.2108, test_f1: 0.5252
 epoch: 26, train_loss: 0.7957, test_loss: 1.0805, test_f1: 0.5187
 epoch: 27, train_loss: 0.7917, test_loss: 1.1321, test_f1: 0.5419
 epoch: 28, train_loss: 0.7926, test_loss: 1.1091, test_f1: 0.5357
 epoch: 29, train_loss: 0.7594, test_loss: 1.0748, test_f1: 0.5351
 epoch: 30, train_loss: 0.7489, test_loss: 1.1595, test_f1: 0.5174
 epoch: 31, train_loss: 0.7561, test_loss: 1.0643, test_f1: 0.5490
 epoch: 32, train_loss: 0.7516, test_loss: 1.8528, test_f1: 0.5208
 epoch: 33, train_loss: 0.7255, test_loss: 1.1901, test_f1: 0.5374
 epoch: 34, train_loss: 0.7353, test_loss: 1.1659, test_f1: 0.5260
 epoch: 35, train_loss: 0.7376, test_loss: 1.1597, test_f1: 0.5320
 epoch: 36, train_loss: 0.7281, test_loss: 1.0442, test_f1: 0.5425
 epoch: 37, train_loss: 0.7241, test_loss: 1.0813, test_f1: 0.5325
 epoch: 38, train_loss: 0.7226, test_loss: 1.1375, test_f1: 0.5315
 epoch: 39, train_loss: 0.7020, test_loss: 1.0942, test_f1: 0.5191
 epoch: 40, train_loss: 0.6927, test_loss: 1.1355, test_f1: 0.5395
 epoch: 41, train_loss: 0.6758, test_loss: 1.1822, test_f1: 0.5322
 epoch: 42, train_loss: 0.6735, test_loss: 1.1987, test_f1: 0.5429
 epoch: 43, train_loss: 0.6736, test_loss: 1.1641, test_f1: 0.5225
 epoch: 44, train_loss: 0.6619, test_loss: 1.1331, test_f1: 0.5091
 epoch: 45, train_loss: 0.6576, test_loss: 1.2251, test_f1: 0.5285
 epoch: 46, train_loss: 0.6450, test_loss: 1.3104, test_f1: 0.5128
 epoch: 47, train_loss: 0.6521, test_loss: 1.4419, test_f1: 0.5077
 epoch: 48, train_loss: 0.6435, test_loss: 1.3298, test_f1: 0.5256
 epoch: 49, train_loss: 0.6636, test_loss: 1.1674, test_f1: 0.5577
 epoch: 50, train_loss: 0.6253, test_loss: 1.2274, test_f1: 0.5226
 epoch: 51, train_loss: 0.5964, test_loss: 1.1981, test_f1: 0.5438
 epoch: 52, train_loss: 0.5578, test_loss: 1.2761, test_f1: 0.5365
 epoch: 53, train_loss: 0.5624, test_loss: 1.2646, test_f1: 0.5542
 epoch: 54, train_loss: 0.5443, test_loss: 1.2272, test_f1: 0.5425
 epoch: 55, train_loss: 0.5576, test_loss: 1.3239, test_f1: 0.5124
 epoch: 56, train_loss: 0.5690, test_loss: 1.2935, test_f1: 0.5390
 epoch: 57, train_loss: 0.5200, test_loss: 1.3809, test_f1: 0.5181
 epoch: 58, train_loss: 0.5255, test_loss: 1.4040, test_f1: 0.5334
 epoch: 59, train_loss: 0.5049, test_loss: 1.5586, test_f1: 0.4992
 epoch: 60, train_loss: 0.5173, test_loss: 1.4197, test_f1: 0.5264
 epoch: 61, train_loss: 0.5194, test_loss: 1.3841, test_f1: 0.5078
 epoch: 62, train_loss: 0.4956, test_loss: 1.4360, test_f1: 0.5445
 epoch: 63, train_loss: 0.5021, test_loss: 1.4381, test_f1: 0.5079
 epoch: 64, train_loss: 0.4968, test_loss: 1.4483, test_f1: 0.5540
 epoch: 65, train_loss: 0.4997, test_loss: 1.3452, test_f1: 0.5380
 epoch: 66, train_loss: 0.4833, test_loss: 1.3755, test_f1: 0.4964
 epoch: 67, train_loss: 0.4865, test_loss: 1.4265, test_f1: 0.5370
 epoch: 68, train_loss: 0.4755, test_loss: 1.4187, test_f1: 0.5599
 epoch: 69, train_loss: 0.4853, test_loss: 1.3115, test_f1: 0.5390
 epoch: 70, train_loss: 0.4616, test_loss: 1.5385, test_f1: 0.5385
 epoch: 71, train_loss: 0.4851, test_loss: 1.4476, test_f1: 0.5460
 epoch: 72, train_loss: 0.4746, test_loss: 1.3786, test_f1: 0.5720
 epoch: 73, train_loss: 0.4818, test_loss: 1.5269, test_f1: 0.5395
 epoch: 74, train_loss: 0.4535, test_loss: 1.5383, test_f1: 0.5235
 epoch: 75, train_loss: 0.4542, test_loss: 1.4356, test_f1: 0.5425
 epoch: 76, train_loss: 0.4684, test_loss: 1.4241, test_f1: 0.5370
 epoch: 77, train_loss: 0.4225, test_loss: 1.5335, test_f1: 0.5307
 epoch: 78, train_loss: 0.4582, test_loss: 1.5527, test_f1: 0.5477
 epoch: 79, train_loss: 0.4551, test_loss: 1.5160, test_f1: 0.5400
 epoch: 80, train_loss: 0.4517, test_loss: 1.4414, test_f1: 0.5621
 epoch: 81, train_loss: 0.4319, test_loss: 1.6340, test_f1: 0.5294
 epoch: 82, train_loss: 0.4333, test_loss: 1.5636, test_f1: 0.5414
 epoch: 83, train_loss: 0.4340, test_loss: 1.4474, test_f1: 0.5591
 epoch: 84, train_loss: 0.4181, test_loss: 1.6106, test_f1: 0.5235
 epoch: 85, train_loss: 0.4402, test_loss: 1.5143, test_f1: 0.5677
 epoch: 86, train_loss: 0.4281, test_loss: 1.5389, test_f1: 0.5260
 epoch: 87, train_loss: 0.4224, test_loss: 1.5228, test_f1: 0.5539
 epoch: 88, train_loss: 0.4263, test_loss: 1.6158, test_f1: 0.5388
 epoch: 89, train_loss: 0.4049, test_loss: 1.4816, test_f1: 0.5637
 epoch: 90, train_loss: 0.4495, test_loss: 1.5673, test_f1: 0.5491
 epoch: 91, train_loss: 0.4176, test_loss: 1.4511, test_f1: 0.5644
 epoch: 92, train_loss: 0.4114, test_loss: 1.5747, test_f1: 0.5446
 epoch: 93, train_loss: 0.4034, test_loss: 1.5647, test_f1: 0.5322
 epoch: 94, train_loss: 0.3810, test_loss: 1.5436, test_f1: 0.5561
 epoch: 95, train_loss: 0.3945, test_loss: 1.5812, test_f1: 0.5342
 epoch: 96, train_loss: 0.3803, test_loss: 1.5403, test_f1: 0.5642
 epoch: 97, train_loss: 0.3995, test_loss: 1.5774, test_f1: 0.5482
 epoch: 98, train_loss: 0.3821, test_loss: 1.5325, test_f1: 0.5514
 epoch: 99, train_loss: 0.3919, test_loss: 1.5344, test_f1: 0.5661
##################ITERATION #9 ****************************************
 epoch: 0, train_loss: 1.2857, test_loss: 1.1428, test_f1: 0.4310
 epoch: 1, train_loss: 1.1249, test_loss: 1.0422, test_f1: 0.4593
 epoch: 2, train_loss: 1.0552, test_loss: 0.9995, test_f1: 0.4860
 epoch: 3, train_loss: 1.0396, test_loss: 0.9758, test_f1: 0.4611
 epoch: 4, train_loss: 0.9954, test_loss: 0.9499, test_f1: 0.4627
 epoch: 5, train_loss: 0.9961, test_loss: 0.9356, test_f1: 0.5289
 epoch: 6, train_loss: 0.9940, test_loss: 0.9666, test_f1: 0.4619
 epoch: 7, train_loss: 0.9440, test_loss: 0.9727, test_f1: 0.4954
 epoch: 8, train_loss: 0.9596, test_loss: 1.0195, test_f1: 0.4764
 epoch: 9, train_loss: 0.9410, test_loss: 0.9599, test_f1: 0.5223
 epoch: 10, train_loss: 0.9184, test_loss: 0.9744, test_f1: 0.5320
 epoch: 11, train_loss: 0.9429, test_loss: 0.9646, test_f1: 0.4967
 epoch: 12, train_loss: 0.9265, test_loss: 0.9871, test_f1: 0.5051
 epoch: 13, train_loss: 0.8914, test_loss: 0.9551, test_f1: 0.5440
 epoch: 14, train_loss: 0.8609, test_loss: 0.9963, test_f1: 0.5608
 epoch: 15, train_loss: 0.8570, test_loss: 1.1512, test_f1: 0.5142
 epoch: 16, train_loss: 0.8430, test_loss: 0.9453, test_f1: 0.5573
 epoch: 17, train_loss: 0.8297, test_loss: 1.0989, test_f1: 0.5407
 epoch: 18, train_loss: 0.8225, test_loss: 0.9651, test_f1: 0.5659
 epoch: 19, train_loss: 0.8286, test_loss: 0.9862, test_f1: 0.5416
 epoch: 20, train_loss: 0.8135, test_loss: 1.0749, test_f1: 0.5328
 epoch: 21, train_loss: 0.8122, test_loss: 1.0150, test_f1: 0.5715
 epoch: 22, train_loss: 0.7921, test_loss: 1.0351, test_f1: 0.5568
 epoch: 23, train_loss: 0.8033, test_loss: 1.1362, test_f1: 0.5158
 epoch: 24, train_loss: 0.8115, test_loss: 0.9789, test_f1: 0.5657
 epoch: 25, train_loss: 0.7867, test_loss: 1.0630, test_f1: 0.5273
 epoch: 26, train_loss: 0.7681, test_loss: 1.0896, test_f1: 0.5504
 epoch: 27, train_loss: 0.7581, test_loss: 1.1589, test_f1: 0.5367
 epoch: 28, train_loss: 0.7595, test_loss: 1.0904, test_f1: 0.5361
 epoch: 29, train_loss: 0.7642, test_loss: 1.0487, test_f1: 0.5616
 epoch: 30, train_loss: 0.7357, test_loss: 1.0498, test_f1: 0.5469
 epoch: 31, train_loss: 0.7464, test_loss: 1.0722, test_f1: 0.5466
 epoch: 32, train_loss: 0.7178, test_loss: 1.1243, test_f1: 0.5588
 epoch: 33, train_loss: 0.7170, test_loss: 1.0698, test_f1: 0.5599
 epoch: 34, train_loss: 0.7079, test_loss: 1.0352, test_f1: 0.5671
 epoch: 35, train_loss: 0.7257, test_loss: 1.0899, test_f1: 0.5397
 epoch: 36, train_loss: 0.6921, test_loss: 1.1124, test_f1: 0.5704
 epoch: 37, train_loss: 0.6977, test_loss: 1.1840, test_f1: 0.5453
 epoch: 38, train_loss: 0.6853, test_loss: 1.2082, test_f1: 0.5556
 epoch: 39, train_loss: 0.6859, test_loss: 1.1095, test_f1: 0.5561
 epoch: 40, train_loss: 0.6766, test_loss: 1.1652, test_f1: 0.5669
 epoch: 41, train_loss: 0.6906, test_loss: 1.0804, test_f1: 0.5744
 epoch: 42, train_loss: 0.6955, test_loss: 1.1278, test_f1: 0.5395
 epoch: 43, train_loss: 0.6828, test_loss: 1.1203, test_f1: 0.5426
 epoch: 44, train_loss: 0.6692, test_loss: 1.0035, test_f1: 0.5610
 epoch: 45, train_loss: 0.6478, test_loss: 1.1420, test_f1: 0.5526
 epoch: 46, train_loss: 0.7116, test_loss: 1.1780, test_f1: 0.5060
 epoch: 47, train_loss: 0.6690, test_loss: 1.0963, test_f1: 0.5553
 epoch: 48, train_loss: 0.6889, test_loss: 1.1463, test_f1: 0.5627
 epoch: 49, train_loss: 0.6470, test_loss: 1.1531, test_f1: 0.5617
 epoch: 50, train_loss: 0.6321, test_loss: 1.1399, test_f1: 0.5419
 epoch: 51, train_loss: 0.5831, test_loss: 1.1836, test_f1: 0.5696
 epoch: 52, train_loss: 0.5897, test_loss: 1.1330, test_f1: 0.5494
 epoch: 53, train_loss: 0.5811, test_loss: 1.1104, test_f1: 0.5747
 epoch: 54, train_loss: 0.5765, test_loss: 1.1110, test_f1: 0.5738
 epoch: 55, train_loss: 0.5600, test_loss: 1.0983, test_f1: 0.5627
 epoch: 56, train_loss: 0.5496, test_loss: 1.1538, test_f1: 0.5665
 epoch: 57, train_loss: 0.5518, test_loss: 1.1832, test_f1: 0.5861
 epoch: 58, train_loss: 0.5339, test_loss: 1.1557, test_f1: 0.5760
 epoch: 59, train_loss: 0.5548, test_loss: 1.1873, test_f1: 0.5531
 epoch: 60, train_loss: 0.5498, test_loss: 1.2061, test_f1: 0.5719
 epoch: 61, train_loss: 0.5260, test_loss: 1.2652, test_f1: 0.5486
 epoch: 62, train_loss: 0.5068, test_loss: 1.2682, test_f1: 0.5818
 epoch: 63, train_loss: 0.5199, test_loss: 1.2014, test_f1: 0.5738
 epoch: 64, train_loss: 0.5259, test_loss: 1.2363, test_f1: 0.5862
 epoch: 65, train_loss: 0.5053, test_loss: 1.2102, test_f1: 0.5964
 epoch: 66, train_loss: 0.5209, test_loss: 1.2607, test_f1: 0.5710
 epoch: 67, train_loss: 0.4886, test_loss: 1.3149, test_f1: 0.5929
 epoch: 68, train_loss: 0.4982, test_loss: 1.2588, test_f1: 0.5710
 epoch: 69, train_loss: 0.4945, test_loss: 1.2259, test_f1: 0.5645
 epoch: 70, train_loss: 0.4956, test_loss: 1.2556, test_f1: 0.5970
 epoch: 71, train_loss: 0.4834, test_loss: 1.3243, test_f1: 0.5791
 epoch: 72, train_loss: 0.5149, test_loss: 1.2450, test_f1: 0.6056
 epoch: 73, train_loss: 0.4799, test_loss: 1.3158, test_f1: 0.5714
 epoch: 74, train_loss: 0.4822, test_loss: 1.4054, test_f1: 0.5621
 epoch: 75, train_loss: 0.4697, test_loss: 1.3791, test_f1: 0.5964
 epoch: 76, train_loss: 0.5720, test_loss: 1.2508, test_f1: 0.5716
 epoch: 77, train_loss: 0.4905, test_loss: 1.3219, test_f1: 0.5648
 epoch: 78, train_loss: 0.4576, test_loss: 1.3084, test_f1: 0.5597
 epoch: 79, train_loss: 0.4619, test_loss: 1.3613, test_f1: 0.5875
 epoch: 80, train_loss: 0.4533, test_loss: 1.4425, test_f1: 0.5703
 epoch: 81, train_loss: 0.4592, test_loss: 1.2775, test_f1: 0.5881
 epoch: 82, train_loss: 0.4577, test_loss: 1.2675, test_f1: 0.5975
 epoch: 83, train_loss: 0.4362, test_loss: 1.3267, test_f1: 0.6084
 epoch: 84, train_loss: 0.4419, test_loss: 1.3535, test_f1: 0.5949
 epoch: 85, train_loss: 0.4261, test_loss: 1.2627, test_f1: 0.6225
 epoch: 86, train_loss: 0.4526, test_loss: 1.3404, test_f1: 0.6053
 epoch: 87, train_loss: 0.4269, test_loss: 1.3018, test_f1: 0.5845
 epoch: 88, train_loss: 0.4384, test_loss: 1.3359, test_f1: 0.5919
 epoch: 89, train_loss: 0.4219, test_loss: 1.2738, test_f1: 0.5828
 epoch: 90, train_loss: 0.4199, test_loss: 1.3713, test_f1: 0.5891
 epoch: 91, train_loss: 0.4150, test_loss: 1.2929, test_f1: 0.5826
 epoch: 92, train_loss: 0.4159, test_loss: 1.3905, test_f1: 0.5800
 epoch: 93, train_loss: 0.4353, test_loss: 1.3881, test_f1: 0.5816
 epoch: 94, train_loss: 0.4350, test_loss: 1.3366, test_f1: 0.5974
 epoch: 95, train_loss: 0.3949, test_loss: 1.3514, test_f1: 0.6033
 epoch: 96, train_loss: 0.3967, test_loss: 1.3893, test_f1: 0.5884
 epoch: 97, train_loss: 0.3936, test_loss: 1.3868, test_f1: 0.5904
 epoch: 98, train_loss: 0.3811, test_loss: 1.3057, test_f1: 0.6169
 epoch: 99, train_loss: 0.4537, test_loss: 1.3695, test_f1: 0.5946

Training completed in 1210.19 seconds
Best F1: 0.6225 at epoch 85
Mean F1 across iterations: 0.5987  0.0146
========================FINAL RESULTS================================
FEGIN weighted F1: 0.6225  0.0146
python main.py --data ltspice_examples --representation component_component --model FEGIN --layers 3 --hiddens 128 --batch_size 32 --lr 0.001 --emb_size 512 --epochs 100 --save_appendix component_component_L3_H128_BS32_LR0.001_E512 --no_val
-----



STDERR:
  File "main.py", line 370, in <module>
    main()
  File "main.py", line 254, in main
    dataset = dataset_class(
  File "/home/philip/projects/llm_inference_code_repo/Circuit-Completion-Using-GNNs/component_classification_with_link_prediction_head/evaluation/FEGIN/kernel/circuit_datasets.py", line 15, in __init__
    self.data, self.slices = torch.load(self.processed_paths[0])
  File "/home/philip/.local/lib/python3.8/site-packages/torch/serialization.py", line 1040, in load
    warnings.warn(
  File "/usr/lib/python3.8/warnings.py", line 109, in _showwarnmsg
    sw(msg.message, msg.category, msg.filename, msg.lineno,
  File "main.py", line 47, in warn_with_traceback
    traceback.print_stack(file=log)
/home/philip/projects/llm_inference_code_repo/Circuit-Completion-Using-GNNs/component_classification_with_link_prediction_head/evaluation/FEGIN/kernel/circuit_datasets.py:15: FutureWarning: You are using `torch.load` with `weights_only=False` (the current default value), which uses the default pickle module implicitly. It is possible to construct malicious pickle data which will execute arbitrary code during unpickling (See https://github.com/pytorch/pytorch/blob/main/SECURITY.md#untrusted-models for more details). In a future release, the default value for `weights_only` will be flipped to `True`. This limits the functions that could be executed during unpickling. Arbitrary objects will no longer be allowed to be loaded via this mode unless they are explicitly allowlisted by the user via `torch.serialization.add_safe_globals`. We recommend you start setting `weights_only=True` for any use case where you don't have full control of the loaded file. Please open an issue on GitHub for any issues related to this experimental feature.
  self.data, self.slices = torch.load(self.processed_paths[0])
