STDOUT:
Results will be saved in /home/philip/projects/ltspice_examples_code_repo/Circuit-Completion-Using-GNNs/component_classification_with_link_prediction_head/evaluation/FEGIN/results/model_FEGIN_dataset_ltspice_demos
Command line input: python main.py --data ltspice_demos --representation component_pin_net --model FEGIN --layers 6 --hiddens 16 --batch_size 64 --lr 0.01 --emb_size 512 --epochs 100 --save_appendix component_pin_net_L6_H16_BS64_LR0.01_E512 --no_val
 is saved.
-----
ltspice_demos - FEGIN
Using 6 layers, 16 hidden units, h = 2
Loading component_pin_net representation dataset
ENTERED
Training FEGIN on component_pin_net representation
Train: 1565, Test: 383
##################ITERATION #0 ****************************************
 epoch: 0, train_loss: 1.2609, test_loss: 1.4034, test_f1: 0.2281
 epoch: 1, train_loss: 1.0975, test_loss: 1.1773, test_f1: 0.3873
 epoch: 2, train_loss: 1.0420, test_loss: 1.1838, test_f1: 0.4324
 epoch: 3, train_loss: 1.0233, test_loss: 1.1039, test_f1: 0.4242
 epoch: 4, train_loss: 1.0192, test_loss: 1.1507, test_f1: 0.4503
 epoch: 5, train_loss: 1.0037, test_loss: 1.2155, test_f1: 0.4075
 epoch: 6, train_loss: 0.9865, test_loss: 1.1032, test_f1: 0.4396
 epoch: 7, train_loss: 0.9974, test_loss: 1.0466, test_f1: 0.4884
 epoch: 8, train_loss: 0.9778, test_loss: 1.1264, test_f1: 0.4765
 epoch: 9, train_loss: 0.9780, test_loss: 1.1091, test_f1: 0.3508
 epoch: 10, train_loss: 0.9711, test_loss: 1.0835, test_f1: 0.5363
 epoch: 11, train_loss: 0.9480, test_loss: 1.0670, test_f1: 0.4933
 epoch: 12, train_loss: 0.9502, test_loss: 1.1360, test_f1: 0.4995
 epoch: 13, train_loss: 0.9450, test_loss: 1.0200, test_f1: 0.5438
 epoch: 14, train_loss: 0.9365, test_loss: 1.0613, test_f1: 0.5434
 epoch: 15, train_loss: 0.9254, test_loss: 1.0526, test_f1: 0.5397
 epoch: 16, train_loss: 0.9202, test_loss: 0.9729, test_f1: 0.5692
 epoch: 17, train_loss: 0.9161, test_loss: 1.0108, test_f1: 0.5882
 epoch: 18, train_loss: 0.9103, test_loss: 1.0518, test_f1: 0.4397
 epoch: 19, train_loss: 0.9441, test_loss: 1.0646, test_f1: 0.3957
 epoch: 20, train_loss: 0.9102, test_loss: 0.9926, test_f1: 0.4631
 epoch: 21, train_loss: 0.9049, test_loss: 1.0074, test_f1: 0.4775
 epoch: 22, train_loss: 0.8943, test_loss: 1.0120, test_f1: 0.5903
 epoch: 23, train_loss: 0.8719, test_loss: 1.1509, test_f1: 0.4479
 epoch: 24, train_loss: 0.8759, test_loss: 1.0784, test_f1: 0.4346
 epoch: 25, train_loss: 0.8696, test_loss: 0.9897, test_f1: 0.6137
 epoch: 26, train_loss: 0.8781, test_loss: 1.5892, test_f1: 0.3139
 epoch: 27, train_loss: 0.8705, test_loss: 1.1398, test_f1: 0.4281
 epoch: 28, train_loss: 0.8794, test_loss: 1.1175, test_f1: 0.5337
 epoch: 29, train_loss: 0.8599, test_loss: 0.9506, test_f1: 0.5844
 epoch: 30, train_loss: 0.8511, test_loss: 0.9568, test_f1: 0.5493
 epoch: 31, train_loss: 0.8604, test_loss: 1.0065, test_f1: 0.6143
 epoch: 32, train_loss: 0.8239, test_loss: 1.0678, test_f1: 0.5961
 epoch: 33, train_loss: 0.8460, test_loss: 1.1301, test_f1: 0.4941
 epoch: 34, train_loss: 0.8184, test_loss: 1.2857, test_f1: 0.3908
 epoch: 35, train_loss: 0.8142, test_loss: 1.2283, test_f1: 0.4782
 epoch: 36, train_loss: 0.8104, test_loss: 1.2830, test_f1: 0.5653
 epoch: 37, train_loss: 0.8109, test_loss: 1.0307, test_f1: 0.5907
 epoch: 38, train_loss: 0.8281, test_loss: 1.4807, test_f1: 0.3900
 epoch: 39, train_loss: 0.8115, test_loss: 1.1572, test_f1: 0.5176
 epoch: 40, train_loss: 0.7971, test_loss: 1.1423, test_f1: 0.5675
 epoch: 41, train_loss: 0.7912, test_loss: 1.1981, test_f1: 0.5084
 epoch: 42, train_loss: 0.7835, test_loss: 1.1198, test_f1: 0.5739
 epoch: 43, train_loss: 0.7884, test_loss: 1.1330, test_f1: 0.5882
 epoch: 44, train_loss: 0.7871, test_loss: 1.1028, test_f1: 0.5764
 epoch: 45, train_loss: 0.8056, test_loss: 1.1054, test_f1: 0.5024
 epoch: 46, train_loss: 0.8115, test_loss: 1.1206, test_f1: 0.5798
 epoch: 47, train_loss: 0.7756, test_loss: 1.0664, test_f1: 0.6144
 epoch: 48, train_loss: 0.8059, test_loss: 1.1299, test_f1: 0.5424
 epoch: 49, train_loss: 0.7762, test_loss: 1.0855, test_f1: 0.5792
 epoch: 50, train_loss: 0.7699, test_loss: 1.1395, test_f1: 0.5850
 epoch: 51, train_loss: 0.7578, test_loss: 1.1730, test_f1: 0.5656
 epoch: 52, train_loss: 0.7341, test_loss: 1.3310, test_f1: 0.5774
 epoch: 53, train_loss: 0.7464, test_loss: 1.0475, test_f1: 0.6298
 epoch: 54, train_loss: 0.7511, test_loss: 1.1130, test_f1: 0.6004
 epoch: 55, train_loss: 0.7340, test_loss: 1.1107, test_f1: 0.5238
 epoch: 56, train_loss: 0.7458, test_loss: 1.2524, test_f1: 0.5933
 epoch: 57, train_loss: 0.7334, test_loss: 1.2752, test_f1: 0.5570
 epoch: 58, train_loss: 0.7436, test_loss: 1.1842, test_f1: 0.6296
 epoch: 59, train_loss: 0.7149, test_loss: 1.5184, test_f1: 0.5604
 epoch: 60, train_loss: 0.7084, test_loss: 1.2039, test_f1: 0.5936
 epoch: 61, train_loss: 0.7256, test_loss: 1.3180, test_f1: 0.5593
 epoch: 62, train_loss: 0.7043, test_loss: 1.2050, test_f1: 0.6077
 epoch: 63, train_loss: 0.7173, test_loss: 1.3308, test_f1: 0.5825
 epoch: 64, train_loss: 0.7068, test_loss: 1.2844, test_f1: 0.6016
 epoch: 65, train_loss: 0.7164, test_loss: 1.1679, test_f1: 0.6026
 epoch: 66, train_loss: 0.6980, test_loss: 1.4998, test_f1: 0.5922
 epoch: 67, train_loss: 0.6918, test_loss: 1.5174, test_f1: 0.5732
 epoch: 68, train_loss: 0.6956, test_loss: 1.2317, test_f1: 0.6206
 epoch: 69, train_loss: 0.6973, test_loss: 1.6712, test_f1: 0.5588
 epoch: 70, train_loss: 0.7144, test_loss: 1.1945, test_f1: 0.5991
 epoch: 71, train_loss: 0.6938, test_loss: 1.4689, test_f1: 0.5276
 epoch: 72, train_loss: 0.6827, test_loss: 1.2778, test_f1: 0.5694
 epoch: 73, train_loss: 0.6979, test_loss: 1.3591, test_f1: 0.5745
 epoch: 74, train_loss: 0.6882, test_loss: 1.2915, test_f1: 0.6470
 epoch: 75, train_loss: 0.7053, test_loss: 1.3055, test_f1: 0.6288
 epoch: 76, train_loss: 0.6826, test_loss: 1.3317, test_f1: 0.5613
 epoch: 77, train_loss: 0.6792, test_loss: 1.8182, test_f1: 0.5312
 epoch: 78, train_loss: 0.7008, test_loss: 1.3033, test_f1: 0.6146
 epoch: 79, train_loss: 0.7152, test_loss: 1.2048, test_f1: 0.6021
 epoch: 80, train_loss: 0.6858, test_loss: 1.3803, test_f1: 0.5137
 epoch: 81, train_loss: 0.6789, test_loss: 1.2162, test_f1: 0.6091
 epoch: 82, train_loss: 0.6665, test_loss: 1.2827, test_f1: 0.5809
 epoch: 83, train_loss: 0.6755, test_loss: 1.3269, test_f1: 0.6065
 epoch: 84, train_loss: 0.6671, test_loss: 1.2790, test_f1: 0.6053
 epoch: 85, train_loss: 0.6600, test_loss: 1.4505, test_f1: 0.6060
 epoch: 86, train_loss: 0.6781, test_loss: 1.1933, test_f1: 0.6330
 epoch: 87, train_loss: 0.6497, test_loss: 1.2526, test_f1: 0.6661
 epoch: 88, train_loss: 0.6582, test_loss: 1.2650, test_f1: 0.6639
 epoch: 89, train_loss: 0.6571, test_loss: 1.2211, test_f1: 0.6036
 epoch: 90, train_loss: 0.6440, test_loss: 1.2927, test_f1: 0.6138
 epoch: 91, train_loss: 0.6429, test_loss: 1.3227, test_f1: 0.6493
 epoch: 92, train_loss: 0.6607, test_loss: 1.2356, test_f1: 0.6011
 epoch: 93, train_loss: 0.6477, test_loss: 1.4105, test_f1: 0.6352
 epoch: 94, train_loss: 0.6558, test_loss: 1.3333, test_f1: 0.6239
 epoch: 95, train_loss: 0.6342, test_loss: 1.3322, test_f1: 0.6179
 epoch: 96, train_loss: 0.6271, test_loss: 1.2941, test_f1: 0.6204
 epoch: 97, train_loss: 0.6472, test_loss: 1.2419, test_f1: 0.6602
 epoch: 98, train_loss: 0.6362, test_loss: 1.2899, test_f1: 0.6571
 epoch: 99, train_loss: 0.6610, test_loss: 1.3421, test_f1: 0.6306
##################ITERATION #1 ****************************************
 epoch: 0, train_loss: 1.1590, test_loss: 1.4613, test_f1: 0.2281
 epoch: 1, train_loss: 1.0617, test_loss: 1.4829, test_f1: 0.1693
 epoch: 2, train_loss: 0.9922, test_loss: 1.0993, test_f1: 0.4003
 epoch: 3, train_loss: 0.9750, test_loss: 1.0393, test_f1: 0.5265
 epoch: 4, train_loss: 0.9528, test_loss: 1.7965, test_f1: 0.4146
 epoch: 5, train_loss: 0.9659, test_loss: 1.0427, test_f1: 0.4644
 epoch: 6, train_loss: 0.9377, test_loss: 0.9954, test_f1: 0.5388
 epoch: 7, train_loss: 0.9199, test_loss: 1.1178, test_f1: 0.4387
 epoch: 8, train_loss: 0.9098, test_loss: 1.0012, test_f1: 0.5209
 epoch: 9, train_loss: 0.8802, test_loss: 0.9840, test_f1: 0.5595
 epoch: 10, train_loss: 0.8680, test_loss: 1.0589, test_f1: 0.4910
 epoch: 11, train_loss: 0.8518, test_loss: 1.0521, test_f1: 0.5321
 epoch: 12, train_loss: 0.8487, test_loss: 0.9685, test_f1: 0.5851
 epoch: 13, train_loss: 0.8517, test_loss: 1.2212, test_f1: 0.4653
 epoch: 14, train_loss: 0.8375, test_loss: 1.3618, test_f1: 0.4752
 epoch: 15, train_loss: 0.8186, test_loss: 1.0334, test_f1: 0.4968
 epoch: 16, train_loss: 0.8003, test_loss: 1.1363, test_f1: 0.4935
 epoch: 17, train_loss: 0.8336, test_loss: 1.0154, test_f1: 0.5518
 epoch: 18, train_loss: 0.8124, test_loss: 1.1329, test_f1: 0.4422
 epoch: 19, train_loss: 0.8029, test_loss: 1.1236, test_f1: 0.5133
 epoch: 20, train_loss: 0.7918, test_loss: 1.0636, test_f1: 0.5397
 epoch: 21, train_loss: 0.7923, test_loss: 1.3825, test_f1: 0.4585
 epoch: 22, train_loss: 0.8076, test_loss: 0.9365, test_f1: 0.5838
 epoch: 23, train_loss: 0.8105, test_loss: 0.9247, test_f1: 0.5695
 epoch: 24, train_loss: 0.7904, test_loss: 0.9694, test_f1: 0.5473
 epoch: 25, train_loss: 0.7923, test_loss: 0.9807, test_f1: 0.5819
 epoch: 26, train_loss: 0.8093, test_loss: 1.0865, test_f1: 0.5423
 epoch: 27, train_loss: 0.7905, test_loss: 0.9837, test_f1: 0.5810
 epoch: 28, train_loss: 0.7924, test_loss: 0.9989, test_f1: 0.5855
 epoch: 29, train_loss: 0.8276, test_loss: 1.1011, test_f1: 0.4429
 epoch: 30, train_loss: 0.8198, test_loss: 1.3503, test_f1: 0.4678
 epoch: 31, train_loss: 0.7929, test_loss: 1.0609, test_f1: 0.5050
 epoch: 32, train_loss: 0.7963, test_loss: 1.1434, test_f1: 0.5320
 epoch: 33, train_loss: 0.8053, test_loss: 0.9967, test_f1: 0.5621
 epoch: 34, train_loss: 0.7764, test_loss: 1.1026, test_f1: 0.4713
 epoch: 35, train_loss: 0.7423, test_loss: 1.0744, test_f1: 0.5124
 epoch: 36, train_loss: 0.7748, test_loss: 2.0160, test_f1: 0.4312
 epoch: 37, train_loss: 0.7522, test_loss: 1.0531, test_f1: 0.4936
 epoch: 38, train_loss: 0.7441, test_loss: 1.0199, test_f1: 0.5554
 epoch: 39, train_loss: 0.7730, test_loss: 0.9580, test_f1: 0.5766
 epoch: 40, train_loss: 0.7470, test_loss: 1.0488, test_f1: 0.5204
 epoch: 41, train_loss: 0.7595, test_loss: 1.0034, test_f1: 0.5386
 epoch: 42, train_loss: 0.7468, test_loss: 0.9985, test_f1: 0.5363
 epoch: 43, train_loss: 0.7651, test_loss: 1.0000, test_f1: 0.5454
 epoch: 44, train_loss: 0.7311, test_loss: 1.0362, test_f1: 0.5416
 epoch: 45, train_loss: 0.7424, test_loss: 1.0718, test_f1: 0.5420
 epoch: 46, train_loss: 0.7522, test_loss: 1.1801, test_f1: 0.5660
 epoch: 47, train_loss: 0.7191, test_loss: 1.0717, test_f1: 0.5381
 epoch: 48, train_loss: 0.7185, test_loss: 1.2057, test_f1: 0.4834
 epoch: 49, train_loss: 0.7246, test_loss: 1.0166, test_f1: 0.5496
 epoch: 50, train_loss: 0.7286, test_loss: 1.0614, test_f1: 0.5486
 epoch: 51, train_loss: 0.7127, test_loss: 1.0161, test_f1: 0.5609
 epoch: 52, train_loss: 0.6878, test_loss: 1.0230, test_f1: 0.5708
 epoch: 53, train_loss: 0.6895, test_loss: 1.0973, test_f1: 0.5854
 epoch: 54, train_loss: 0.6669, test_loss: 1.1833, test_f1: 0.5382
 epoch: 55, train_loss: 0.6916, test_loss: 1.0146, test_f1: 0.5809
 epoch: 56, train_loss: 0.6802, test_loss: 1.2949, test_f1: 0.5185
 epoch: 57, train_loss: 0.7011, test_loss: 1.0028, test_f1: 0.6054
 epoch: 58, train_loss: 0.6718, test_loss: 1.0205, test_f1: 0.6134
 epoch: 59, train_loss: 0.6711, test_loss: 1.0541, test_f1: 0.6178
 epoch: 60, train_loss: 0.6637, test_loss: 1.2109, test_f1: 0.5456
 epoch: 61, train_loss: 0.6698, test_loss: 1.2942, test_f1: 0.5636
 epoch: 62, train_loss: 0.6619, test_loss: 1.0987, test_f1: 0.5972
 epoch: 63, train_loss: 0.6626, test_loss: 1.0511, test_f1: 0.5751
 epoch: 64, train_loss: 0.6464, test_loss: 1.1226, test_f1: 0.5941
 epoch: 65, train_loss: 0.6475, test_loss: 1.0151, test_f1: 0.5814
 epoch: 66, train_loss: 0.6139, test_loss: 1.2029, test_f1: 0.5523
 epoch: 67, train_loss: 0.6243, test_loss: 1.2326, test_f1: 0.5326
 epoch: 68, train_loss: 0.6346, test_loss: 1.1839, test_f1: 0.5607
 epoch: 69, train_loss: 0.6515, test_loss: 1.0314, test_f1: 0.6390
 epoch: 70, train_loss: 0.6504, test_loss: 1.1294, test_f1: 0.5733
 epoch: 71, train_loss: 0.6300, test_loss: 1.2814, test_f1: 0.5610
 epoch: 72, train_loss: 0.6233, test_loss: 1.0090, test_f1: 0.6540
 epoch: 73, train_loss: 0.6255, test_loss: 1.0353, test_f1: 0.6025
 epoch: 74, train_loss: 0.5924, test_loss: 1.1147, test_f1: 0.5870
 epoch: 75, train_loss: 0.6285, test_loss: 1.3784, test_f1: 0.6032
 epoch: 76, train_loss: 0.6122, test_loss: 1.0635, test_f1: 0.6023
 epoch: 77, train_loss: 0.6190, test_loss: 1.0829, test_f1: 0.6103
 epoch: 78, train_loss: 0.6067, test_loss: 1.2039, test_f1: 0.5850
 epoch: 79, train_loss: 0.6186, test_loss: 1.0789, test_f1: 0.6075
 epoch: 80, train_loss: 0.6199, test_loss: 0.9940, test_f1: 0.6391
 epoch: 81, train_loss: 0.5813, test_loss: 1.3202, test_f1: 0.5949
 epoch: 82, train_loss: 0.5967, test_loss: 1.0764, test_f1: 0.6043
 epoch: 83, train_loss: 0.6259, test_loss: 1.0688, test_f1: 0.6010
 epoch: 84, train_loss: 0.6047, test_loss: 1.1847, test_f1: 0.6015
 epoch: 85, train_loss: 0.5945, test_loss: 1.5528, test_f1: 0.5939
 epoch: 86, train_loss: 0.6105, test_loss: 1.0329, test_f1: 0.6198
 epoch: 87, train_loss: 0.6163, test_loss: 1.1017, test_f1: 0.6152
 epoch: 88, train_loss: 0.6100, test_loss: 1.1706, test_f1: 0.6056
 epoch: 89, train_loss: 0.5884, test_loss: 1.1398, test_f1: 0.6069
 epoch: 90, train_loss: 0.6164, test_loss: 1.1089, test_f1: 0.6347
 epoch: 91, train_loss: 0.6015, test_loss: 1.3585, test_f1: 0.5895
 epoch: 92, train_loss: 0.5919, test_loss: 1.1789, test_f1: 0.5931
 epoch: 93, train_loss: 0.5827, test_loss: 1.4110, test_f1: 0.5614
 epoch: 94, train_loss: 0.5732, test_loss: 1.5262, test_f1: 0.6080
 epoch: 95, train_loss: 0.5726, test_loss: 1.1487, test_f1: 0.5929
 epoch: 96, train_loss: 0.5836, test_loss: 1.2027, test_f1: 0.6108
 epoch: 97, train_loss: 0.5718, test_loss: 1.0955, test_f1: 0.6463
 epoch: 98, train_loss: 0.5997, test_loss: 1.1885, test_f1: 0.5773
 epoch: 99, train_loss: 0.5897, test_loss: 1.0599, test_f1: 0.6701
##################ITERATION #2 ****************************************
 epoch: 0, train_loss: 1.1640, test_loss: 1.3233, test_f1: 0.2333
 epoch: 1, train_loss: 0.9918, test_loss: 1.0398, test_f1: 0.5481
 epoch: 2, train_loss: 0.9512, test_loss: 1.0528, test_f1: 0.5227
 epoch: 3, train_loss: 0.9297, test_loss: 1.0963, test_f1: 0.4644
 epoch: 4, train_loss: 0.9347, test_loss: 1.0265, test_f1: 0.5601
 epoch: 5, train_loss: 0.9023, test_loss: 0.9851, test_f1: 0.5599
 epoch: 6, train_loss: 0.8802, test_loss: 1.1587, test_f1: 0.4580
 epoch: 7, train_loss: 0.9132, test_loss: 1.0183, test_f1: 0.4551
 epoch: 8, train_loss: 0.8989, test_loss: 0.9931, test_f1: 0.4427
 epoch: 9, train_loss: 0.8743, test_loss: 0.9920, test_f1: 0.4819
 epoch: 10, train_loss: 0.8641, test_loss: 0.9610, test_f1: 0.5503
 epoch: 11, train_loss: 0.8505, test_loss: 0.9713, test_f1: 0.5311
 epoch: 12, train_loss: 0.8374, test_loss: 1.0274, test_f1: 0.4689
 epoch: 13, train_loss: 0.8335, test_loss: 0.9448, test_f1: 0.4464
 epoch: 14, train_loss: 0.8659, test_loss: 1.0008, test_f1: 0.5047
 epoch: 15, train_loss: 0.9034, test_loss: 1.0361, test_f1: 0.5091
 epoch: 16, train_loss: 0.8445, test_loss: 0.9834, test_f1: 0.4606
 epoch: 17, train_loss: 0.8466, test_loss: 1.1294, test_f1: 0.4971
 epoch: 18, train_loss: 0.8486, test_loss: 1.0196, test_f1: 0.5668
 epoch: 19, train_loss: 0.8297, test_loss: 1.0001, test_f1: 0.5730
 epoch: 20, train_loss: 0.8305, test_loss: 1.0372, test_f1: 0.4919
 epoch: 21, train_loss: 0.8237, test_loss: 1.0139, test_f1: 0.5135
 epoch: 22, train_loss: 0.8321, test_loss: 1.0253, test_f1: 0.5263
 epoch: 23, train_loss: 0.8226, test_loss: 1.0156, test_f1: 0.5058
 epoch: 24, train_loss: 0.7980, test_loss: 0.9895, test_f1: 0.5305
 epoch: 25, train_loss: 0.7818, test_loss: 1.0305, test_f1: 0.5528
 epoch: 26, train_loss: 0.7847, test_loss: 1.0459, test_f1: 0.4982
 epoch: 27, train_loss: 0.7965, test_loss: 1.1419, test_f1: 0.5191
 epoch: 28, train_loss: 0.7731, test_loss: 1.0560, test_f1: 0.5365
 epoch: 29, train_loss: 0.7920, test_loss: 1.4318, test_f1: 0.4516
 epoch: 30, train_loss: 0.7987, test_loss: 1.0783, test_f1: 0.5035
 epoch: 31, train_loss: 0.7656, test_loss: 1.0219, test_f1: 0.5352
 epoch: 32, train_loss: 0.7729, test_loss: 0.9950, test_f1: 0.5562
 epoch: 33, train_loss: 0.7793, test_loss: 1.0482, test_f1: 0.5126
 epoch: 34, train_loss: 0.7654, test_loss: 1.7153, test_f1: 0.4259
 epoch: 35, train_loss: 0.7493, test_loss: 1.0151, test_f1: 0.5594
 epoch: 36, train_loss: 0.7767, test_loss: 1.3153, test_f1: 0.5081
 epoch: 37, train_loss: 0.7884, test_loss: 1.0915, test_f1: 0.5315
 epoch: 38, train_loss: 0.7738, test_loss: 1.0476, test_f1: 0.5341
 epoch: 39, train_loss: 0.7729, test_loss: 0.9859, test_f1: 0.6044
 epoch: 40, train_loss: 0.7861, test_loss: 1.0391, test_f1: 0.5588
 epoch: 41, train_loss: 0.7881, test_loss: 1.0367, test_f1: 0.5309
 epoch: 42, train_loss: 0.7666, test_loss: 1.2240, test_f1: 0.5205
 epoch: 43, train_loss: 0.7471, test_loss: 1.0707, test_f1: 0.5298
 epoch: 44, train_loss: 0.7442, test_loss: 1.0949, test_f1: 0.5164
 epoch: 45, train_loss: 0.7409, test_loss: 1.1735, test_f1: 0.4473
 epoch: 46, train_loss: 0.7375, test_loss: 1.0863, test_f1: 0.5638
 epoch: 47, train_loss: 0.7491, test_loss: 1.3188, test_f1: 0.5110
 epoch: 48, train_loss: 0.7327, test_loss: 1.2218, test_f1: 0.4649
 epoch: 49, train_loss: 0.7825, test_loss: 1.1527, test_f1: 0.5287
 epoch: 50, train_loss: 0.7534, test_loss: 1.5567, test_f1: 0.4729
 epoch: 51, train_loss: 0.7386, test_loss: 1.0899, test_f1: 0.5376
 epoch: 52, train_loss: 0.7226, test_loss: 1.0048, test_f1: 0.5839
 epoch: 53, train_loss: 0.7167, test_loss: 1.0205, test_f1: 0.6181
 epoch: 54, train_loss: 0.7068, test_loss: 1.0648, test_f1: 0.5854
 epoch: 55, train_loss: 0.6916, test_loss: 1.1137, test_f1: 0.5668
 epoch: 56, train_loss: 0.6850, test_loss: 1.1335, test_f1: 0.5362
 epoch: 57, train_loss: 0.6983, test_loss: 1.0483, test_f1: 0.5605
 epoch: 58, train_loss: 0.6997, test_loss: 1.0561, test_f1: 0.6005
 epoch: 59, train_loss: 0.7001, test_loss: 1.4636, test_f1: 0.4755
 epoch: 60, train_loss: 0.7033, test_loss: 1.0488, test_f1: 0.5757
 epoch: 61, train_loss: 0.7041, test_loss: 0.9988, test_f1: 0.6046
 epoch: 62, train_loss: 0.6858, test_loss: 1.2361, test_f1: 0.5475
 epoch: 63, train_loss: 0.6839, test_loss: 1.0099, test_f1: 0.5705
 epoch: 64, train_loss: 0.6837, test_loss: 1.1643, test_f1: 0.5630
 epoch: 65, train_loss: 0.6616, test_loss: 1.0690, test_f1: 0.5977
 epoch: 66, train_loss: 0.6741, test_loss: 1.0997, test_f1: 0.5550
 epoch: 67, train_loss: 0.6628, test_loss: 1.0618, test_f1: 0.5763
 epoch: 68, train_loss: 0.6673, test_loss: 1.0348, test_f1: 0.5689
 epoch: 69, train_loss: 0.6887, test_loss: 1.0360, test_f1: 0.5541
 epoch: 70, train_loss: 0.6612, test_loss: 1.1169, test_f1: 0.5555
 epoch: 71, train_loss: 0.6622, test_loss: 1.0202, test_f1: 0.5957
 epoch: 72, train_loss: 0.6884, test_loss: 1.1475, test_f1: 0.5795
 epoch: 73, train_loss: 0.6731, test_loss: 1.1036, test_f1: 0.5910
 epoch: 74, train_loss: 0.6680, test_loss: 1.1470, test_f1: 0.5559
 epoch: 75, train_loss: 0.6554, test_loss: 1.1456, test_f1: 0.5818
 epoch: 76, train_loss: 0.6374, test_loss: 1.2780, test_f1: 0.5634
 epoch: 77, train_loss: 0.6511, test_loss: 1.1452, test_f1: 0.5531
 epoch: 78, train_loss: 0.6491, test_loss: 1.1016, test_f1: 0.5794
 epoch: 79, train_loss: 0.6534, test_loss: 1.1323, test_f1: 0.5302
 epoch: 80, train_loss: 0.6507, test_loss: 1.2608, test_f1: 0.5180
 epoch: 81, train_loss: 0.6389, test_loss: 1.1214, test_f1: 0.5770
 epoch: 82, train_loss: 0.6504, test_loss: 1.1377, test_f1: 0.5843
 epoch: 83, train_loss: 0.6446, test_loss: 1.1262, test_f1: 0.5494
 epoch: 84, train_loss: 0.6515, test_loss: 1.0670, test_f1: 0.5891
 epoch: 85, train_loss: 0.6569, test_loss: 1.1303, test_f1: 0.5862
 epoch: 86, train_loss: 0.6452, test_loss: 1.1723, test_f1: 0.5542
 epoch: 87, train_loss: 0.6468, test_loss: 1.1166, test_f1: 0.5762
 epoch: 88, train_loss: 0.6461, test_loss: 1.0434, test_f1: 0.5962
 epoch: 89, train_loss: 0.6549, test_loss: 1.1375, test_f1: 0.5530
 epoch: 90, train_loss: 0.6553, test_loss: 1.1059, test_f1: 0.6022
 epoch: 91, train_loss: 0.6485, test_loss: 1.2550, test_f1: 0.5639
 epoch: 92, train_loss: 0.6220, test_loss: 1.0666, test_f1: 0.5728
 epoch: 93, train_loss: 0.6422, test_loss: 1.1478, test_f1: 0.5778
 epoch: 94, train_loss: 0.6369, test_loss: 1.1569, test_f1: 0.5863
 epoch: 95, train_loss: 0.6308, test_loss: 1.0764, test_f1: 0.5759
 epoch: 96, train_loss: 0.6095, test_loss: 1.2137, test_f1: 0.5491
 epoch: 97, train_loss: 0.6599, test_loss: 1.1104, test_f1: 0.6057
 epoch: 98, train_loss: 0.6496, test_loss: 1.0651, test_f1: 0.5995
 epoch: 99, train_loss: 0.6357, test_loss: 1.0628, test_f1: 0.5902
##################ITERATION #3 ****************************************
 epoch: 0, train_loss: 1.2222, test_loss: 1.4440, test_f1: 0.1779
 epoch: 1, train_loss: 1.0503, test_loss: 1.1738, test_f1: 0.4596
 epoch: 2, train_loss: 1.0085, test_loss: 1.0913, test_f1: 0.4536
 epoch: 3, train_loss: 0.9815, test_loss: 1.1046, test_f1: 0.4335
 epoch: 4, train_loss: 0.9539, test_loss: 1.0094, test_f1: 0.5353
 epoch: 5, train_loss: 0.9204, test_loss: 1.0509, test_f1: 0.4141
 epoch: 6, train_loss: 0.9632, test_loss: 0.9953, test_f1: 0.5424
 epoch: 7, train_loss: 0.9239, test_loss: 1.0140, test_f1: 0.5672
 epoch: 8, train_loss: 0.9006, test_loss: 1.0973, test_f1: 0.4576
 epoch: 9, train_loss: 0.8792, test_loss: 1.0549, test_f1: 0.4117
 epoch: 10, train_loss: 0.8468, test_loss: 1.0868, test_f1: 0.5593
 epoch: 11, train_loss: 0.8558, test_loss: 1.4884, test_f1: 0.4041
 epoch: 12, train_loss: 0.8544, test_loss: 0.9752, test_f1: 0.4679
 epoch: 13, train_loss: 0.8502, test_loss: 0.9879, test_f1: 0.5205
 epoch: 14, train_loss: 0.8285, test_loss: 1.0381, test_f1: 0.5864
 epoch: 15, train_loss: 0.8264, test_loss: 0.9799, test_f1: 0.5847
 epoch: 16, train_loss: 0.8342, test_loss: 1.1190, test_f1: 0.4543
 epoch: 17, train_loss: 0.8432, test_loss: 1.2282, test_f1: 0.5119
 epoch: 18, train_loss: 0.8156, test_loss: 1.1351, test_f1: 0.5592
 epoch: 19, train_loss: 0.8060, test_loss: 1.1811, test_f1: 0.5245
 epoch: 20, train_loss: 0.7932, test_loss: 4.5045, test_f1: 0.2172
 epoch: 21, train_loss: 0.7974, test_loss: 1.3798, test_f1: 0.4637
 epoch: 22, train_loss: 0.7861, test_loss: 1.4105, test_f1: 0.4915
 epoch: 23, train_loss: 0.7938, test_loss: 1.6627, test_f1: 0.4992
 epoch: 24, train_loss: 0.7621, test_loss: 1.2031, test_f1: 0.5136
 epoch: 25, train_loss: 0.7649, test_loss: 1.2098, test_f1: 0.5213
 epoch: 26, train_loss: 0.7700, test_loss: 1.0992, test_f1: 0.5004
 epoch: 27, train_loss: 0.7711, test_loss: 1.4678, test_f1: 0.5475
 epoch: 28, train_loss: 0.7569, test_loss: 1.5788, test_f1: 0.4778
 epoch: 29, train_loss: 0.7590, test_loss: 1.6986, test_f1: 0.5281
 epoch: 30, train_loss: 0.7665, test_loss: 1.4595, test_f1: 0.5627
 epoch: 31, train_loss: 0.7531, test_loss: 1.7090, test_f1: 0.4639
 epoch: 32, train_loss: 0.8137, test_loss: 1.0768, test_f1: 0.4977
 epoch: 33, train_loss: 0.7925, test_loss: 1.7434, test_f1: 0.4327
 epoch: 34, train_loss: 0.7839, test_loss: 1.0965, test_f1: 0.5370
 epoch: 35, train_loss: 0.7611, test_loss: 1.2863, test_f1: 0.5352
 epoch: 36, train_loss: 0.7389, test_loss: 1.3379, test_f1: 0.5190
 epoch: 37, train_loss: 0.7470, test_loss: 1.9929, test_f1: 0.4678
 epoch: 38, train_loss: 0.7314, test_loss: 0.9699, test_f1: 0.6107
 epoch: 39, train_loss: 0.7598, test_loss: 1.3614, test_f1: 0.4699
 epoch: 40, train_loss: 0.7743, test_loss: 1.4642, test_f1: 0.5224
 epoch: 41, train_loss: 0.7269, test_loss: 2.0325, test_f1: 0.4890
 epoch: 42, train_loss: 0.7149, test_loss: 1.4451, test_f1: 0.5131
 epoch: 43, train_loss: 0.7455, test_loss: 1.0997, test_f1: 0.5385
 epoch: 44, train_loss: 0.7230, test_loss: 1.3778, test_f1: 0.5360
 epoch: 45, train_loss: 0.7154, test_loss: 1.1216, test_f1: 0.5338
 epoch: 46, train_loss: 0.7258, test_loss: 1.0894, test_f1: 0.5657
 epoch: 47, train_loss: 0.7178, test_loss: 1.1350, test_f1: 0.5283
 epoch: 48, train_loss: 0.7026, test_loss: 1.5655, test_f1: 0.5284
 epoch: 49, train_loss: 0.7119, test_loss: 2.5871, test_f1: 0.4625
 epoch: 50, train_loss: 0.7275, test_loss: 1321.1658, test_f1: 0.1759
 epoch: 51, train_loss: 0.6826, test_loss: 1.6388, test_f1: 0.5286
 epoch: 52, train_loss: 0.6823, test_loss: 1.3274, test_f1: 0.5742
 epoch: 53, train_loss: 0.6774, test_loss: 1.4242, test_f1: 0.5310
 epoch: 54, train_loss: 0.6669, test_loss: 1.4586, test_f1: 0.5680
 epoch: 55, train_loss: 0.6719, test_loss: 1.6176, test_f1: 0.5657
 epoch: 56, train_loss: 0.6700, test_loss: 1.3994, test_f1: 0.5964
 epoch: 57, train_loss: 0.6762, test_loss: 1.5990, test_f1: 0.5469
 epoch: 58, train_loss: 0.6551, test_loss: 1.5944, test_f1: 0.5685
 epoch: 59, train_loss: 0.6585, test_loss: 1.7227, test_f1: 0.5880
 epoch: 60, train_loss: 0.6551, test_loss: 1.8205, test_f1: 0.5337
 epoch: 61, train_loss: 0.6558, test_loss: 1.6735, test_f1: 0.5439
 epoch: 62, train_loss: 0.6467, test_loss: 1.8667, test_f1: 0.5617
 epoch: 63, train_loss: 0.6221, test_loss: 1.6735, test_f1: 0.5265
 epoch: 64, train_loss: 0.6372, test_loss: 1.6028, test_f1: 0.5738
 epoch: 65, train_loss: 0.6374, test_loss: 2.0017, test_f1: 0.5743
 epoch: 66, train_loss: 0.6639, test_loss: 1.5923, test_f1: 0.5409
 epoch: 67, train_loss: 0.6407, test_loss: 2.2850, test_f1: 0.5624
 epoch: 68, train_loss: 0.6440, test_loss: 1.9456, test_f1: 0.5618
 epoch: 69, train_loss: 0.6267, test_loss: 1.8691, test_f1: 0.5721
 epoch: 70, train_loss: 0.6270, test_loss: 1.8313, test_f1: 0.5476
 epoch: 71, train_loss: 0.6268, test_loss: 1.9720, test_f1: 0.5387
 epoch: 72, train_loss: 0.6224, test_loss: 1.5309, test_f1: 0.5796
 epoch: 73, train_loss: 0.6413, test_loss: 1.5105, test_f1: 0.5278
 epoch: 74, train_loss: 0.6554, test_loss: 1.5488, test_f1: 0.5759
 epoch: 75, train_loss: 0.6516, test_loss: 1.6876, test_f1: 0.5423
 epoch: 76, train_loss: 0.6299, test_loss: 1.5191, test_f1: 0.5881
 epoch: 77, train_loss: 0.6206, test_loss: 2.0801, test_f1: 0.5560
 epoch: 78, train_loss: 0.6417, test_loss: 1.8577, test_f1: 0.5434
 epoch: 79, train_loss: 0.6075, test_loss: 1.4250, test_f1: 0.5401
 epoch: 80, train_loss: 0.6219, test_loss: 1.9178, test_f1: 0.5294
 epoch: 81, train_loss: 0.6083, test_loss: 1.8846, test_f1: 0.5828
 epoch: 82, train_loss: 0.6249, test_loss: 1.5201, test_f1: 0.5593
 epoch: 83, train_loss: 0.6212, test_loss: 1.7820, test_f1: 0.5455
 epoch: 84, train_loss: 0.5859, test_loss: 1.5747, test_f1: 0.5713
 epoch: 85, train_loss: 0.6307, test_loss: 1.8386, test_f1: 0.5194
 epoch: 86, train_loss: 0.6192, test_loss: 1.3688, test_f1: 0.5243
 epoch: 87, train_loss: 0.6731, test_loss: 1.6033, test_f1: 0.5619
 epoch: 88, train_loss: 0.6292, test_loss: 1.3737, test_f1: 0.5710
 epoch: 89, train_loss: 0.6225, test_loss: 1.9598, test_f1: 0.5641
 epoch: 90, train_loss: 0.5928, test_loss: 1.7702, test_f1: 0.5570
 epoch: 91, train_loss: 0.6279, test_loss: 1.7431, test_f1: 0.5601
 epoch: 92, train_loss: 0.6094, test_loss: 2.1733, test_f1: 0.5230
 epoch: 93, train_loss: 0.6148, test_loss: 2.2013, test_f1: 0.5713
 epoch: 94, train_loss: 0.6308, test_loss: 1.9345, test_f1: 0.5544
 epoch: 95, train_loss: 0.5878, test_loss: 2.0304, test_f1: 0.5724
 epoch: 96, train_loss: 0.6075, test_loss: 1.8667, test_f1: 0.6020
 epoch: 97, train_loss: 0.6179, test_loss: 1.5513, test_f1: 0.5645
 epoch: 98, train_loss: 0.6127, test_loss: 1.7937, test_f1: 0.5737
 epoch: 99, train_loss: 0.5916, test_loss: 1.6282, test_f1: 0.5785
##################ITERATION #4 ****************************************
 epoch: 0, train_loss: 1.2267, test_loss: 1.1982, test_f1: 0.3322
 epoch: 1, train_loss: 1.0232, test_loss: 1.1430, test_f1: 0.3525
 epoch: 2, train_loss: 1.0087, test_loss: 1.0927, test_f1: 0.4368
 epoch: 3, train_loss: 0.9879, test_loss: 1.0275, test_f1: 0.4676
 epoch: 4, train_loss: 0.9559, test_loss: 1.0074, test_f1: 0.4705
 epoch: 5, train_loss: 0.9363, test_loss: 1.0498, test_f1: 0.4879
 epoch: 6, train_loss: 0.9497, test_loss: 1.0317, test_f1: 0.4377
 epoch: 7, train_loss: 0.9242, test_loss: 1.0256, test_f1: 0.5806
 epoch: 8, train_loss: 0.8993, test_loss: 0.9732, test_f1: 0.5845
 epoch: 9, train_loss: 0.9017, test_loss: 1.1295, test_f1: 0.4252
 epoch: 10, train_loss: 0.8976, test_loss: 0.9536, test_f1: 0.4788
 epoch: 11, train_loss: 0.8692, test_loss: 1.0406, test_f1: 0.5526
 epoch: 12, train_loss: 0.8551, test_loss: 1.1081, test_f1: 0.5297
 epoch: 13, train_loss: 0.8418, test_loss: 0.9909, test_f1: 0.5285
 epoch: 14, train_loss: 0.8335, test_loss: 0.9708, test_f1: 0.5294
 epoch: 15, train_loss: 0.8500, test_loss: 1.0618, test_f1: 0.5498
 epoch: 16, train_loss: 0.8396, test_loss: 0.9530, test_f1: 0.5283
 epoch: 17, train_loss: 0.8343, test_loss: 0.9662, test_f1: 0.5846
 epoch: 18, train_loss: 0.8239, test_loss: 1.0456, test_f1: 0.4957
 epoch: 19, train_loss: 0.8173, test_loss: 1.0540, test_f1: 0.5466
 epoch: 20, train_loss: 0.8101, test_loss: 1.0356, test_f1: 0.5253
 epoch: 21, train_loss: 0.8219, test_loss: 1.7337, test_f1: 0.3770
 epoch: 22, train_loss: 0.8225, test_loss: 0.9851, test_f1: 0.5363
 epoch: 23, train_loss: 0.7994, test_loss: 1.0102, test_f1: 0.4660
 epoch: 24, train_loss: 0.8085, test_loss: 1.0370, test_f1: 0.5010
 epoch: 25, train_loss: 0.8031, test_loss: 1.0275, test_f1: 0.6229
 epoch: 26, train_loss: 0.7931, test_loss: 0.9897, test_f1: 0.5733
 epoch: 27, train_loss: 0.7853, test_loss: 1.1566, test_f1: 0.5650
 epoch: 28, train_loss: 0.7829, test_loss: 1.0539, test_f1: 0.5632
 epoch: 29, train_loss: 0.7748, test_loss: 1.0142, test_f1: 0.4955
 epoch: 30, train_loss: 0.7786, test_loss: 1.1676, test_f1: 0.4619
 epoch: 31, train_loss: 0.7974, test_loss: 1.0203, test_f1: 0.5213
 epoch: 32, train_loss: 0.7603, test_loss: 1.0369, test_f1: 0.5463
 epoch: 33, train_loss: 0.7973, test_loss: 0.9279, test_f1: 0.6169
 epoch: 34, train_loss: 0.7568, test_loss: 1.0379, test_f1: 0.5212
 epoch: 35, train_loss: 0.7538, test_loss: 1.0787, test_f1: 0.5925
 epoch: 36, train_loss: 0.7639, test_loss: 1.1595, test_f1: 0.4923
 epoch: 37, train_loss: 0.7414, test_loss: 1.3234, test_f1: 0.5145
 epoch: 38, train_loss: 0.7533, test_loss: 1.0305, test_f1: 0.5800
 epoch: 39, train_loss: 0.7638, test_loss: 1.1307, test_f1: 0.4598
 epoch: 40, train_loss: 0.7637, test_loss: 1.0459, test_f1: 0.5407
 epoch: 41, train_loss: 0.7612, test_loss: 1.0751, test_f1: 0.5982
 epoch: 42, train_loss: 0.7396, test_loss: 1.1133, test_f1: 0.5094
 epoch: 43, train_loss: 0.7271, test_loss: 1.0179, test_f1: 0.6149
 epoch: 44, train_loss: 0.7290, test_loss: 1.0236, test_f1: 0.5969
 epoch: 45, train_loss: 0.7204, test_loss: 1.1082, test_f1: 0.5564
 epoch: 46, train_loss: 0.7187, test_loss: 1.2484, test_f1: 0.5708
 epoch: 47, train_loss: 0.7228, test_loss: 1.0164, test_f1: 0.5225
 epoch: 48, train_loss: 0.7241, test_loss: 1.4105, test_f1: 0.5127
 epoch: 49, train_loss: 0.7362, test_loss: 1.0627, test_f1: 0.5579
 epoch: 50, train_loss: 0.7149, test_loss: 1.2630, test_f1: 0.5324
 epoch: 51, train_loss: 0.6925, test_loss: 1.0789, test_f1: 0.5418
 epoch: 52, train_loss: 0.7000, test_loss: 1.0916, test_f1: 0.5597
 epoch: 53, train_loss: 0.6906, test_loss: 1.1046, test_f1: 0.5461
 epoch: 54, train_loss: 0.6832, test_loss: 1.1111, test_f1: 0.6030
 epoch: 55, train_loss: 0.6899, test_loss: 1.0329, test_f1: 0.5894
 epoch: 56, train_loss: 0.6718, test_loss: 1.1063, test_f1: 0.5528
 epoch: 57, train_loss: 0.6978, test_loss: 1.1740, test_f1: 0.5678
 epoch: 58, train_loss: 0.6795, test_loss: 1.1185, test_f1: 0.6168
 epoch: 59, train_loss: 0.6536, test_loss: 1.2184, test_f1: 0.5390
 epoch: 60, train_loss: 0.6517, test_loss: 1.0886, test_f1: 0.5862
 epoch: 61, train_loss: 0.6686, test_loss: 1.0870, test_f1: 0.5640
 epoch: 62, train_loss: 0.6489, test_loss: 1.6268, test_f1: 0.5386
 epoch: 63, train_loss: 0.6852, test_loss: 1.4963, test_f1: 0.5406
 epoch: 64, train_loss: 0.6507, test_loss: 1.2458, test_f1: 0.5296
 epoch: 65, train_loss: 0.6625, test_loss: 1.1432, test_f1: 0.5342
 epoch: 66, train_loss: 0.6629, test_loss: 1.4296, test_f1: 0.5433
 epoch: 67, train_loss: 0.6907, test_loss: 1.5039, test_f1: 0.5415
 epoch: 68, train_loss: 0.7109, test_loss: 1.1044, test_f1: 0.4965
 epoch: 69, train_loss: 0.6816, test_loss: 1.3193, test_f1: 0.5172
 epoch: 70, train_loss: 0.6530, test_loss: 1.2988, test_f1: 0.5716
 epoch: 71, train_loss: 0.6588, test_loss: 1.1450, test_f1: 0.5302
 epoch: 72, train_loss: 0.6563, test_loss: 1.2834, test_f1: 0.5581
 epoch: 73, train_loss: 0.6293, test_loss: 1.3811, test_f1: 0.5424
 epoch: 74, train_loss: 0.6492, test_loss: 1.4223, test_f1: 0.5898
 epoch: 75, train_loss: 0.6498, test_loss: 1.0853, test_f1: 0.5629
 epoch: 76, train_loss: 0.6435, test_loss: 1.1726, test_f1: 0.5938
 epoch: 77, train_loss: 0.6796, test_loss: 1.0799, test_f1: 0.5863
 epoch: 78, train_loss: 0.6579, test_loss: 1.1623, test_f1: 0.5171
 epoch: 79, train_loss: 0.6995, test_loss: 1.3083, test_f1: 0.5254
 epoch: 80, train_loss: 0.6616, test_loss: 1.1531, test_f1: 0.5425
 epoch: 81, train_loss: 0.6651, test_loss: 1.0771, test_f1: 0.5938
 epoch: 82, train_loss: 0.6487, test_loss: 1.0912, test_f1: 0.6074
 epoch: 83, train_loss: 0.6325, test_loss: 1.1528, test_f1: 0.5559
 epoch: 84, train_loss: 0.6287, test_loss: 1.2898, test_f1: 0.5794
 epoch: 85, train_loss: 0.6303, test_loss: 1.2379, test_f1: 0.5605
 epoch: 86, train_loss: 0.6355, test_loss: 1.2508, test_f1: 0.5741
 epoch: 87, train_loss: 0.6322, test_loss: 1.7420, test_f1: 0.5656
 epoch: 88, train_loss: 0.6368, test_loss: 1.2204, test_f1: 0.5782
 epoch: 89, train_loss: 0.6100, test_loss: 1.1299, test_f1: 0.5516
 epoch: 90, train_loss: 0.6008, test_loss: 1.6578, test_f1: 0.5799
 epoch: 91, train_loss: 0.6079, test_loss: 1.1713, test_f1: 0.5508
 epoch: 92, train_loss: 0.6241, test_loss: 1.1535, test_f1: 0.5176
 epoch: 93, train_loss: 0.6097, test_loss: 1.2520, test_f1: 0.5992
 epoch: 94, train_loss: 0.6100, test_loss: 1.5998, test_f1: 0.5869
 epoch: 95, train_loss: 0.5978, test_loss: 1.4409, test_f1: 0.5674
 epoch: 96, train_loss: 0.6233, test_loss: 1.4068, test_f1: 0.5651
 epoch: 97, train_loss: 0.6024, test_loss: 1.4370, test_f1: 0.5413
 epoch: 98, train_loss: 0.6223, test_loss: 1.5105, test_f1: 0.5639
 epoch: 99, train_loss: 0.6083, test_loss: 1.1768, test_f1: 0.5633
##################ITERATION #5 ****************************************
 epoch: 0, train_loss: 1.2738, test_loss: 1.2299, test_f1: 0.2913
 epoch: 1, train_loss: 1.0315, test_loss: 1.1018, test_f1: 0.4460
 epoch: 2, train_loss: 1.0049, test_loss: 1.0707, test_f1: 0.4312
 epoch: 3, train_loss: 0.9838, test_loss: 1.0867, test_f1: 0.4400
 epoch: 4, train_loss: 0.9663, test_loss: 1.0417, test_f1: 0.5094
 epoch: 5, train_loss: 0.9599, test_loss: 1.0460, test_f1: 0.4769
 epoch: 6, train_loss: 0.9494, test_loss: 1.0409, test_f1: 0.5522
 epoch: 7, train_loss: 0.9207, test_loss: 1.0424, test_f1: 0.5797
 epoch: 8, train_loss: 0.9288, test_loss: 1.0398, test_f1: 0.5067
 epoch: 9, train_loss: 0.9276, test_loss: 1.1262, test_f1: 0.5034
 epoch: 10, train_loss: 0.9104, test_loss: 0.9739, test_f1: 0.5507
 epoch: 11, train_loss: 0.9196, test_loss: 1.0498, test_f1: 0.5623
 epoch: 12, train_loss: 0.8872, test_loss: 1.0018, test_f1: 0.5742
 epoch: 13, train_loss: 0.9074, test_loss: 1.0519, test_f1: 0.4727
 epoch: 14, train_loss: 0.8659, test_loss: 1.0574, test_f1: 0.5620
 epoch: 15, train_loss: 0.8655, test_loss: 1.0862, test_f1: 0.5322
 epoch: 16, train_loss: 0.8500, test_loss: 1.2360, test_f1: 0.4880
 epoch: 17, train_loss: 0.8685, test_loss: 1.0910, test_f1: 0.4944
 epoch: 18, train_loss: 0.8617, test_loss: 1.1001, test_f1: 0.5558
 epoch: 19, train_loss: 0.8545, test_loss: 1.0642, test_f1: 0.5434
 epoch: 20, train_loss: 0.8610, test_loss: 1.0436, test_f1: 0.5551
 epoch: 21, train_loss: 0.8366, test_loss: 1.1708, test_f1: 0.4621
 epoch: 22, train_loss: 0.8117, test_loss: 1.0950, test_f1: 0.5371
 epoch: 23, train_loss: 0.7911, test_loss: 0.9782, test_f1: 0.5248
 epoch: 24, train_loss: 0.7858, test_loss: 1.0838, test_f1: 0.5326
 epoch: 25, train_loss: 0.8028, test_loss: 1.1821, test_f1: 0.5077
 epoch: 26, train_loss: 0.7974, test_loss: 1.0055, test_f1: 0.5660
 epoch: 27, train_loss: 0.7558, test_loss: 1.0352, test_f1: 0.4806
 epoch: 28, train_loss: 0.8227, test_loss: 1.5322, test_f1: 0.4421
 epoch: 29, train_loss: 0.8403, test_loss: 0.9907, test_f1: 0.4332
 epoch: 30, train_loss: 0.8159, test_loss: 0.9763, test_f1: 0.6212
 epoch: 31, train_loss: 0.7865, test_loss: 0.9900, test_f1: 0.5982
 epoch: 32, train_loss: 0.7776, test_loss: 0.9749, test_f1: 0.5623
 epoch: 33, train_loss: 0.7631, test_loss: 1.0907, test_f1: 0.5718
 epoch: 34, train_loss: 0.7539, test_loss: 1.0406, test_f1: 0.5923
 epoch: 35, train_loss: 0.7509, test_loss: 1.1016, test_f1: 0.5219
 epoch: 36, train_loss: 0.7605, test_loss: 1.0512, test_f1: 0.5730
 epoch: 37, train_loss: 0.7430, test_loss: 1.0438, test_f1: 0.5105
 epoch: 38, train_loss: 0.7597, test_loss: 1.0591, test_f1: 0.4752
 epoch: 39, train_loss: 0.7463, test_loss: 1.0111, test_f1: 0.6167
 epoch: 40, train_loss: 0.7477, test_loss: 1.5019, test_f1: 0.5221
 epoch: 41, train_loss: 0.7630, test_loss: 0.9690, test_f1: 0.6258
 epoch: 42, train_loss: 0.7500, test_loss: 1.0555, test_f1: 0.5892
 epoch: 43, train_loss: 0.7459, test_loss: 1.0116, test_f1: 0.5850
 epoch: 44, train_loss: 0.7342, test_loss: 0.9941, test_f1: 0.5823
 epoch: 45, train_loss: 0.7176, test_loss: 0.9702, test_f1: 0.5669
 epoch: 46, train_loss: 0.7216, test_loss: 1.0272, test_f1: 0.5934
 epoch: 47, train_loss: 0.7188, test_loss: 1.4591, test_f1: 0.5477
 epoch: 48, train_loss: 0.7325, test_loss: 1.0043, test_f1: 0.6276
 epoch: 49, train_loss: 0.7015, test_loss: 1.0511, test_f1: 0.6240
 epoch: 50, train_loss: 0.6909, test_loss: 0.9694, test_f1: 0.5777
 epoch: 51, train_loss: 0.6763, test_loss: 1.0254, test_f1: 0.6020
 epoch: 52, train_loss: 0.6646, test_loss: 0.9682, test_f1: 0.6137
 epoch: 53, train_loss: 0.6523, test_loss: 0.9705, test_f1: 0.6292
 epoch: 54, train_loss: 0.6515, test_loss: 0.9724, test_f1: 0.5791
 epoch: 55, train_loss: 0.6495, test_loss: 1.0732, test_f1: 0.6184
 epoch: 56, train_loss: 0.6312, test_loss: 1.0488, test_f1: 0.6359
 epoch: 57, train_loss: 0.6348, test_loss: 1.0006, test_f1: 0.6209
 epoch: 58, train_loss: 0.6514, test_loss: 1.0516, test_f1: 0.6100
 epoch: 59, train_loss: 0.6658, test_loss: 1.1256, test_f1: 0.5772
 epoch: 60, train_loss: 0.6532, test_loss: 0.9669, test_f1: 0.6052
 epoch: 61, train_loss: 0.6387, test_loss: 1.0783, test_f1: 0.5829
 epoch: 62, train_loss: 0.6637, test_loss: 0.9846, test_f1: 0.6162
 epoch: 63, train_loss: 0.6467, test_loss: 1.0814, test_f1: 0.5716
 epoch: 64, train_loss: 0.6318, test_loss: 0.9693, test_f1: 0.6367
 epoch: 65, train_loss: 0.6195, test_loss: 1.0981, test_f1: 0.5645
 epoch: 66, train_loss: 0.6454, test_loss: 1.1705, test_f1: 0.5612
 epoch: 67, train_loss: 0.6322, test_loss: 1.0806, test_f1: 0.6085
 epoch: 68, train_loss: 0.6296, test_loss: 1.0198, test_f1: 0.6398
 epoch: 69, train_loss: 0.6100, test_loss: 1.0423, test_f1: 0.6184
 epoch: 70, train_loss: 0.6790, test_loss: 1.2741, test_f1: 0.5606
 epoch: 71, train_loss: 0.7151, test_loss: 1.1992, test_f1: 0.6065
 epoch: 72, train_loss: 0.6579, test_loss: 1.0430, test_f1: 0.6185
 epoch: 73, train_loss: 0.6383, test_loss: 1.1740, test_f1: 0.6032
 epoch: 74, train_loss: 0.6120, test_loss: 1.1405, test_f1: 0.6200
 epoch: 75, train_loss: 0.6157, test_loss: 1.0779, test_f1: 0.6516
 epoch: 76, train_loss: 0.6143, test_loss: 1.2126, test_f1: 0.5750
 epoch: 77, train_loss: 0.6126, test_loss: 1.1890, test_f1: 0.6123
 epoch: 78, train_loss: 0.6272, test_loss: 1.1026, test_f1: 0.6259
 epoch: 79, train_loss: 0.5816, test_loss: 1.1413, test_f1: 0.6316
 epoch: 80, train_loss: 0.5926, test_loss: 1.1554, test_f1: 0.6027
 epoch: 81, train_loss: 0.6106, test_loss: 1.0484, test_f1: 0.6261
 epoch: 82, train_loss: 0.6060, test_loss: 1.2301, test_f1: 0.6159
 epoch: 83, train_loss: 0.5815, test_loss: 1.0722, test_f1: 0.6286
 epoch: 84, train_loss: 0.6301, test_loss: 1.0920, test_f1: 0.6060
 epoch: 85, train_loss: 0.5855, test_loss: 1.1073, test_f1: 0.6152
 epoch: 86, train_loss: 0.5945, test_loss: 1.1082, test_f1: 0.6455
 epoch: 87, train_loss: 0.5880, test_loss: 1.1908, test_f1: 0.6063
 epoch: 88, train_loss: 0.5663, test_loss: 1.1040, test_f1: 0.6542
 epoch: 89, train_loss: 0.5500, test_loss: 1.0969, test_f1: 0.6288
 epoch: 90, train_loss: 0.5575, test_loss: 1.2188, test_f1: 0.5961
 epoch: 91, train_loss: 0.5692, test_loss: 1.1343, test_f1: 0.6412
 epoch: 92, train_loss: 0.5541, test_loss: 1.1376, test_f1: 0.5584
 epoch: 93, train_loss: 0.5648, test_loss: 1.1540, test_f1: 0.6185
 epoch: 94, train_loss: 0.5534, test_loss: 1.2535, test_f1: 0.6129
 epoch: 95, train_loss: 0.5715, test_loss: 1.1552, test_f1: 0.6381
 epoch: 96, train_loss: 0.5641, test_loss: 1.2278, test_f1: 0.5833
 epoch: 97, train_loss: 0.5347, test_loss: 1.1207, test_f1: 0.6324
 epoch: 98, train_loss: 0.5426, test_loss: 1.1581, test_f1: 0.6194
 epoch: 99, train_loss: 0.5651, test_loss: 1.2246, test_f1: 0.5984
##################ITERATION #6 ****************************************
 epoch: 0, train_loss: 1.2628, test_loss: 1.3829, test_f1: 0.1382
 epoch: 1, train_loss: 1.0481, test_loss: 1.1475, test_f1: 0.3660
 epoch: 2, train_loss: 0.9935, test_loss: 1.0498, test_f1: 0.4897
 epoch: 3, train_loss: 0.9614, test_loss: 1.1090, test_f1: 0.4047
 epoch: 4, train_loss: 0.9462, test_loss: 1.0416, test_f1: 0.5133
 epoch: 5, train_loss: 0.9549, test_loss: 1.5469, test_f1: 0.3838
 epoch: 6, train_loss: 0.9179, test_loss: 1.2954, test_f1: 0.4278
 epoch: 7, train_loss: 0.9378, test_loss: 1.0989, test_f1: 0.5602
 epoch: 8, train_loss: 0.9043, test_loss: 1.2382, test_f1: 0.4226
 epoch: 9, train_loss: 0.8946, test_loss: 1.0183, test_f1: 0.5627
 epoch: 10, train_loss: 0.8711, test_loss: 1.0060, test_f1: 0.5493
 epoch: 11, train_loss: 0.8516, test_loss: 1.0407, test_f1: 0.5512
 epoch: 12, train_loss: 0.8596, test_loss: 1.1592, test_f1: 0.4608
 epoch: 13, train_loss: 0.8796, test_loss: 0.9722, test_f1: 0.5296
 epoch: 14, train_loss: 0.8840, test_loss: 1.0673, test_f1: 0.4638
 epoch: 15, train_loss: 0.8645, test_loss: 0.9637, test_f1: 0.5824
 epoch: 16, train_loss: 0.8181, test_loss: 0.9974, test_f1: 0.5596
 epoch: 17, train_loss: 0.8306, test_loss: 0.9716, test_f1: 0.5884
 epoch: 18, train_loss: 0.8565, test_loss: 0.9733, test_f1: 0.5763
 epoch: 19, train_loss: 0.8288, test_loss: 0.9699, test_f1: 0.5594
 epoch: 20, train_loss: 0.8222, test_loss: 0.9964, test_f1: 0.5843
 epoch: 21, train_loss: 0.8267, test_loss: 1.1197, test_f1: 0.4957
 epoch: 22, train_loss: 0.8151, test_loss: 1.0714, test_f1: 0.5632
 epoch: 23, train_loss: 0.8171, test_loss: 1.0218, test_f1: 0.5414
 epoch: 24, train_loss: 0.8007, test_loss: 1.0878, test_f1: 0.5561
 epoch: 25, train_loss: 0.8105, test_loss: 1.1146, test_f1: 0.4952
 epoch: 26, train_loss: 0.8076, test_loss: 1.0134, test_f1: 0.5495
 epoch: 27, train_loss: 0.8027, test_loss: 1.0944, test_f1: 0.5288
 epoch: 28, train_loss: 0.8064, test_loss: 1.0127, test_f1: 0.5307
 epoch: 29, train_loss: 0.7814, test_loss: 0.9820, test_f1: 0.5789
 epoch: 30, train_loss: 0.8000, test_loss: 1.1483, test_f1: 0.4533
 epoch: 31, train_loss: 0.7787, test_loss: 1.6575, test_f1: 0.3009
 epoch: 32, train_loss: 0.7835, test_loss: 1.1314, test_f1: 0.4960
 epoch: 33, train_loss: 0.7894, test_loss: 1.1381, test_f1: 0.5677
 epoch: 34, train_loss: 0.7968, test_loss: 1.0443, test_f1: 0.5975
 epoch: 35, train_loss: 0.7868, test_loss: 1.4402, test_f1: 0.4454
 epoch: 36, train_loss: 0.7811, test_loss: 1.2543, test_f1: 0.5447
 epoch: 37, train_loss: 0.7591, test_loss: 1.0756, test_f1: 0.5781
 epoch: 38, train_loss: 0.7834, test_loss: 1.0180, test_f1: 0.5944
 epoch: 39, train_loss: 0.7663, test_loss: 1.1120, test_f1: 0.4766
 epoch: 40, train_loss: 0.7574, test_loss: 1.0820, test_f1: 0.5973
 epoch: 41, train_loss: 0.7503, test_loss: 1.1274, test_f1: 0.5544
 epoch: 42, train_loss: 0.7517, test_loss: 1.0418, test_f1: 0.6128
 epoch: 43, train_loss: 0.7547, test_loss: 1.0526, test_f1: 0.5489
 epoch: 44, train_loss: 0.7541, test_loss: 1.1353, test_f1: 0.5335
 epoch: 45, train_loss: 0.7431, test_loss: 1.0485, test_f1: 0.5995
 epoch: 46, train_loss: 0.7735, test_loss: 1.1010, test_f1: 0.5091
 epoch: 47, train_loss: 0.7673, test_loss: 1.4881, test_f1: 0.5305
 epoch: 48, train_loss: 0.7617, test_loss: 1.0236, test_f1: 0.5845
 epoch: 49, train_loss: 0.7423, test_loss: 1.2022, test_f1: 0.5565
 epoch: 50, train_loss: 0.7270, test_loss: 1.0546, test_f1: 0.5929
 epoch: 51, train_loss: 0.7008, test_loss: 1.0508, test_f1: 0.5993
 epoch: 52, train_loss: 0.6823, test_loss: 1.0397, test_f1: 0.6185
 epoch: 53, train_loss: 0.7074, test_loss: 0.9882, test_f1: 0.5970
 epoch: 54, train_loss: 0.6798, test_loss: 1.0144, test_f1: 0.6029
 epoch: 55, train_loss: 0.7006, test_loss: 1.0202, test_f1: 0.6141
 epoch: 56, train_loss: 0.6886, test_loss: 1.1849, test_f1: 0.5649
 epoch: 57, train_loss: 0.6748, test_loss: 1.0954, test_f1: 0.5975
 epoch: 58, train_loss: 0.6743, test_loss: 1.0647, test_f1: 0.5834
 epoch: 59, train_loss: 0.6878, test_loss: 0.9884, test_f1: 0.6209
 epoch: 60, train_loss: 0.6784, test_loss: 1.1855, test_f1: 0.5516
 epoch: 61, train_loss: 0.6843, test_loss: 1.0395, test_f1: 0.6017
 epoch: 62, train_loss: 0.6661, test_loss: 1.0629, test_f1: 0.5794
 epoch: 63, train_loss: 0.6633, test_loss: 1.0975, test_f1: 0.5962
 epoch: 64, train_loss: 0.6589, test_loss: 1.0547, test_f1: 0.6273
 epoch: 65, train_loss: 0.6534, test_loss: 1.0459, test_f1: 0.5641
 epoch: 66, train_loss: 0.6730, test_loss: 1.0183, test_f1: 0.6532
 epoch: 67, train_loss: 0.6506, test_loss: 1.0901, test_f1: 0.5955
 epoch: 68, train_loss: 0.6713, test_loss: 1.0455, test_f1: 0.6391
 epoch: 69, train_loss: 0.6703, test_loss: 1.0818, test_f1: 0.5755
 epoch: 70, train_loss: 0.6473, test_loss: 1.1064, test_f1: 0.6005
 epoch: 71, train_loss: 0.6365, test_loss: 1.1289, test_f1: 0.5555
 epoch: 72, train_loss: 0.6665, test_loss: 1.0840, test_f1: 0.5608
 epoch: 73, train_loss: 0.6513, test_loss: 1.2427, test_f1: 0.5397
 epoch: 74, train_loss: 0.6460, test_loss: 1.2180, test_f1: 0.5711
 epoch: 75, train_loss: 0.6576, test_loss: 0.9911, test_f1: 0.5905
 epoch: 76, train_loss: 0.6489, test_loss: 1.1030, test_f1: 0.5807
 epoch: 77, train_loss: 0.6719, test_loss: 1.1258, test_f1: 0.5849
 epoch: 78, train_loss: 0.6397, test_loss: 1.3475, test_f1: 0.5543
 epoch: 79, train_loss: 0.6460, test_loss: 1.1287, test_f1: 0.5989
 epoch: 80, train_loss: 0.6598, test_loss: 1.1151, test_f1: 0.6063
 epoch: 81, train_loss: 0.6384, test_loss: 1.0591, test_f1: 0.5733
 epoch: 82, train_loss: 0.6477, test_loss: 1.1177, test_f1: 0.6199
 epoch: 83, train_loss: 0.6419, test_loss: 1.0993, test_f1: 0.6007
 epoch: 84, train_loss: 0.6691, test_loss: 1.3941, test_f1: 0.5253
 epoch: 85, train_loss: 0.6384, test_loss: 1.2074, test_f1: 0.5871
 epoch: 86, train_loss: 0.6546, test_loss: 1.0748, test_f1: 0.6020
 epoch: 87, train_loss: 0.6695, test_loss: 1.1856, test_f1: 0.5480
 epoch: 88, train_loss: 0.6595, test_loss: 1.1114, test_f1: 0.6114
 epoch: 89, train_loss: 0.6370, test_loss: 1.1640, test_f1: 0.6039
 epoch: 90, train_loss: 0.6156, test_loss: 1.1079, test_f1: 0.6065
 epoch: 91, train_loss: 0.6613, test_loss: 1.0636, test_f1: 0.5957
 epoch: 92, train_loss: 0.6369, test_loss: 1.3245, test_f1: 0.5593
 epoch: 93, train_loss: 0.6566, test_loss: 1.0782, test_f1: 0.6047
 epoch: 94, train_loss: 0.6681, test_loss: 1.4389, test_f1: 0.4947
 epoch: 95, train_loss: 0.6826, test_loss: 1.2521, test_f1: 0.5467
 epoch: 96, train_loss: 0.6459, test_loss: 1.0712, test_f1: 0.6051
 epoch: 97, train_loss: 0.6263, test_loss: 1.2362, test_f1: 0.5974
 epoch: 98, train_loss: 0.6428, test_loss: 1.0671, test_f1: 0.6181
 epoch: 99, train_loss: 0.6166, test_loss: 1.1691, test_f1: 0.6369
##################ITERATION #7 ****************************************
 epoch: 0, train_loss: 1.2058, test_loss: 1.2350, test_f1: 0.2281
 epoch: 1, train_loss: 1.0771, test_loss: 1.1214, test_f1: 0.4037
 epoch: 2, train_loss: 1.0281, test_loss: 1.1551, test_f1: 0.4551
 epoch: 3, train_loss: 0.9929, test_loss: 1.1240, test_f1: 0.4172
 epoch: 4, train_loss: 1.0023, test_loss: 1.1818, test_f1: 0.4040
 epoch: 5, train_loss: 0.9906, test_loss: 1.0811, test_f1: 0.5119
 epoch: 6, train_loss: 0.9741, test_loss: 1.0722, test_f1: 0.4719
 epoch: 7, train_loss: 0.9599, test_loss: 1.0770, test_f1: 0.4436
 epoch: 8, train_loss: 0.9447, test_loss: 1.0223, test_f1: 0.4443
 epoch: 9, train_loss: 0.9163, test_loss: 1.1052, test_f1: 0.5276
 epoch: 10, train_loss: 0.9271, test_loss: 1.0980, test_f1: 0.4717
 epoch: 11, train_loss: 0.8978, test_loss: 1.0811, test_f1: 0.5493
 epoch: 12, train_loss: 0.9170, test_loss: 1.0536, test_f1: 0.4490
 epoch: 13, train_loss: 0.8776, test_loss: 1.0321, test_f1: 0.5409
 epoch: 14, train_loss: 0.9060, test_loss: 1.1006, test_f1: 0.5285
 epoch: 15, train_loss: 0.8631, test_loss: 1.0139, test_f1: 0.5508
 epoch: 16, train_loss: 0.8614, test_loss: 1.1306, test_f1: 0.4822
 epoch: 17, train_loss: 0.8716, test_loss: 1.0193, test_f1: 0.5582
 epoch: 18, train_loss: 0.8491, test_loss: 1.0974, test_f1: 0.5637
 epoch: 19, train_loss: 0.8336, test_loss: 1.0008, test_f1: 0.5625
 epoch: 20, train_loss: 0.8180, test_loss: 1.0106, test_f1: 0.5696
 epoch: 21, train_loss: 0.8199, test_loss: 1.0166, test_f1: 0.5839
 epoch: 22, train_loss: 0.8050, test_loss: 1.1782, test_f1: 0.5392
 epoch: 23, train_loss: 0.8041, test_loss: 1.0488, test_f1: 0.5691
 epoch: 24, train_loss: 0.7964, test_loss: 1.1123, test_f1: 0.5435
 epoch: 25, train_loss: 0.8246, test_loss: 1.1476, test_f1: 0.5279
 epoch: 26, train_loss: 0.8039, test_loss: 1.1133, test_f1: 0.5087
 epoch: 27, train_loss: 0.7906, test_loss: 1.0423, test_f1: 0.5832
 epoch: 28, train_loss: 0.8035, test_loss: 1.1385, test_f1: 0.5073
 epoch: 29, train_loss: 0.7743, test_loss: 1.1239, test_f1: 0.5725
 epoch: 30, train_loss: 0.7923, test_loss: 1.0446, test_f1: 0.5789
 epoch: 31, train_loss: 0.7677, test_loss: 1.3381, test_f1: 0.5021
 epoch: 32, train_loss: 0.7780, test_loss: 1.1848, test_f1: 0.4944
 epoch: 33, train_loss: 0.7817, test_loss: 1.0182, test_f1: 0.5469
 epoch: 34, train_loss: 0.7821, test_loss: 1.4933, test_f1: 0.4468
 epoch: 35, train_loss: 0.7796, test_loss: 1.0962, test_f1: 0.5760
 epoch: 36, train_loss: 0.8409, test_loss: 1.0656, test_f1: 0.5251
 epoch: 37, train_loss: 0.8170, test_loss: 1.0905, test_f1: 0.4941
 epoch: 38, train_loss: 0.8046, test_loss: 1.1780, test_f1: 0.5550
 epoch: 39, train_loss: 0.7407, test_loss: 1.1425, test_f1: 0.5537
 epoch: 40, train_loss: 0.7554, test_loss: 1.2189, test_f1: 0.5780
 epoch: 41, train_loss: 0.7725, test_loss: 1.0801, test_f1: 0.5132
 epoch: 42, train_loss: 0.7570, test_loss: 1.0684, test_f1: 0.5754
 epoch: 43, train_loss: 0.7696, test_loss: 1.4369, test_f1: 0.4446
 epoch: 44, train_loss: 0.7457, test_loss: 1.3665, test_f1: 0.4728
 epoch: 45, train_loss: 0.7612, test_loss: 1.3886, test_f1: 0.4969
 epoch: 46, train_loss: 0.7583, test_loss: 1.2698, test_f1: 0.5549
 epoch: 47, train_loss: 0.7378, test_loss: 1.2711, test_f1: 0.5015
 epoch: 48, train_loss: 0.7295, test_loss: 1.1336, test_f1: 0.5617
 epoch: 49, train_loss: 0.7282, test_loss: 1.9127, test_f1: 0.4673
 epoch: 50, train_loss: 0.7571, test_loss: 1.0748, test_f1: 0.6110
 epoch: 51, train_loss: 0.7157, test_loss: 1.1779, test_f1: 0.5284
 epoch: 52, train_loss: 0.7149, test_loss: 1.1834, test_f1: 0.5319
 epoch: 53, train_loss: 0.7026, test_loss: 1.1732, test_f1: 0.5479
 epoch: 54, train_loss: 0.7050, test_loss: 1.1439, test_f1: 0.5874
 epoch: 55, train_loss: 0.6969, test_loss: 1.2928, test_f1: 0.5498
 epoch: 56, train_loss: 0.6885, test_loss: 1.2663, test_f1: 0.5234
 epoch: 57, train_loss: 0.6774, test_loss: 1.1657, test_f1: 0.5763
 epoch: 58, train_loss: 0.6781, test_loss: 1.2996, test_f1: 0.5564
 epoch: 59, train_loss: 0.6963, test_loss: 1.2988, test_f1: 0.5628
 epoch: 60, train_loss: 0.7108, test_loss: 1.3713, test_f1: 0.5806
 epoch: 61, train_loss: 0.6654, test_loss: 1.2391, test_f1: 0.5361
 epoch: 62, train_loss: 0.6694, test_loss: 1.2794, test_f1: 0.5624
 epoch: 63, train_loss: 0.6552, test_loss: 1.2924, test_f1: 0.4847
 epoch: 64, train_loss: 0.6774, test_loss: 1.1805, test_f1: 0.5724
 epoch: 65, train_loss: 0.6807, test_loss: 1.2495, test_f1: 0.5586
 epoch: 66, train_loss: 0.6707, test_loss: 1.3622, test_f1: 0.5500
 epoch: 67, train_loss: 0.6874, test_loss: 1.2438, test_f1: 0.5388
 epoch: 68, train_loss: 0.6420, test_loss: 1.3486, test_f1: 0.5774
 epoch: 69, train_loss: 0.6671, test_loss: 1.3880, test_f1: 0.5650
 epoch: 70, train_loss: 0.7099, test_loss: 1.3177, test_f1: 0.5709
 epoch: 71, train_loss: 0.7240, test_loss: 1.0537, test_f1: 0.6157
 epoch: 72, train_loss: 0.6888, test_loss: 1.2588, test_f1: 0.5352
 epoch: 73, train_loss: 0.6769, test_loss: 1.2234, test_f1: 0.5574
 epoch: 74, train_loss: 0.6749, test_loss: 1.5436, test_f1: 0.5013
 epoch: 75, train_loss: 0.6730, test_loss: 1.2706, test_f1: 0.5615
 epoch: 76, train_loss: 0.6770, test_loss: 2.2141, test_f1: 0.5451
 epoch: 77, train_loss: 0.6378, test_loss: 1.1464, test_f1: 0.5902
 epoch: 78, train_loss: 0.6648, test_loss: 1.4552, test_f1: 0.5091
 epoch: 79, train_loss: 0.6601, test_loss: 1.4756, test_f1: 0.5197
 epoch: 80, train_loss: 0.6964, test_loss: 1.3158, test_f1: 0.5522
 epoch: 81, train_loss: 0.6622, test_loss: 1.1566, test_f1: 0.5917
 epoch: 82, train_loss: 0.6505, test_loss: 1.7730, test_f1: 0.5321
 epoch: 83, train_loss: 0.6562, test_loss: 1.1283, test_f1: 0.6314
 epoch: 84, train_loss: 0.6523, test_loss: 1.2662, test_f1: 0.5830
 epoch: 85, train_loss: 0.6326, test_loss: 1.7091, test_f1: 0.4739
 epoch: 86, train_loss: 0.6458, test_loss: 1.7377, test_f1: 0.5435
 epoch: 87, train_loss: 0.6313, test_loss: 1.2077, test_f1: 0.6127
 epoch: 88, train_loss: 0.6300, test_loss: 1.2790, test_f1: 0.5659
 epoch: 89, train_loss: 0.6425, test_loss: 1.1768, test_f1: 0.5552
 epoch: 90, train_loss: 0.6356, test_loss: 1.1353, test_f1: 0.5910
 epoch: 91, train_loss: 0.6345, test_loss: 1.2335, test_f1: 0.5617
 epoch: 92, train_loss: 0.6121, test_loss: 1.5404, test_f1: 0.5385
 epoch: 93, train_loss: 0.6390, test_loss: 1.1989, test_f1: 0.5791
 epoch: 94, train_loss: 0.6372, test_loss: 1.5046, test_f1: 0.5418
 epoch: 95, train_loss: 0.6168, test_loss: 1.4571, test_f1: 0.5466
 epoch: 96, train_loss: 0.6243, test_loss: 1.4069, test_f1: 0.5251
 epoch: 97, train_loss: 0.6066, test_loss: 1.2718, test_f1: 0.5889
 epoch: 98, train_loss: 0.6319, test_loss: 1.2898, test_f1: 0.5690
 epoch: 99, train_loss: 0.5807, test_loss: 1.2790, test_f1: 0.6200
##################ITERATION #8 ****************************************
 epoch: 0, train_loss: 1.2582, test_loss: 1.3476, test_f1: 0.2291
 epoch: 1, train_loss: 1.0196, test_loss: 1.1862, test_f1: 0.3430
 epoch: 2, train_loss: 0.9867, test_loss: 1.1112, test_f1: 0.4220
 epoch: 3, train_loss: 0.9595, test_loss: 1.0006, test_f1: 0.4774
 epoch: 4, train_loss: 0.9386, test_loss: 1.0064, test_f1: 0.4845
 epoch: 5, train_loss: 0.9465, test_loss: 1.0116, test_f1: 0.4696
 epoch: 6, train_loss: 0.9245, test_loss: 0.9728, test_f1: 0.5672
 epoch: 7, train_loss: 0.8959, test_loss: 0.9585, test_f1: 0.5358
 epoch: 8, train_loss: 0.8599, test_loss: 0.9940, test_f1: 0.5741
 epoch: 9, train_loss: 0.8768, test_loss: 1.0728, test_f1: 0.4238
 epoch: 10, train_loss: 0.9491, test_loss: 1.2852, test_f1: 0.4417
 epoch: 11, train_loss: 0.8793, test_loss: 0.9819, test_f1: 0.5505
 epoch: 12, train_loss: 0.8892, test_loss: 1.1416, test_f1: 0.4797
 epoch: 13, train_loss: 0.8614, test_loss: 1.0058, test_f1: 0.5298
 epoch: 14, train_loss: 0.8562, test_loss: 0.9787, test_f1: 0.5582
 epoch: 15, train_loss: 0.8740, test_loss: 1.3391, test_f1: 0.4755
 epoch: 16, train_loss: 0.8588, test_loss: 0.9690, test_f1: 0.5270
 epoch: 17, train_loss: 0.8665, test_loss: 0.9915, test_f1: 0.5389
 epoch: 18, train_loss: 0.8493, test_loss: 0.9933, test_f1: 0.5069
 epoch: 19, train_loss: 0.8312, test_loss: 0.9601, test_f1: 0.5823
 epoch: 20, train_loss: 0.8328, test_loss: 1.0482, test_f1: 0.5650
 epoch: 21, train_loss: 0.7975, test_loss: 1.0254, test_f1: 0.5696
 epoch: 22, train_loss: 0.8456, test_loss: 1.0558, test_f1: 0.4758
 epoch: 23, train_loss: 0.8135, test_loss: 0.9508, test_f1: 0.5846
 epoch: 24, train_loss: 0.7948, test_loss: 1.0703, test_f1: 0.5549
 epoch: 25, train_loss: 0.8086, test_loss: 1.1925, test_f1: 0.4777
 epoch: 26, train_loss: 0.8080, test_loss: 1.2690, test_f1: 0.5430
 epoch: 27, train_loss: 0.8088, test_loss: 1.7490, test_f1: 0.4741
 epoch: 28, train_loss: 0.7938, test_loss: 1.1552, test_f1: 0.5626
 epoch: 29, train_loss: 0.8016, test_loss: 1.3412, test_f1: 0.5043
 epoch: 30, train_loss: 0.7804, test_loss: 0.9936, test_f1: 0.5150
 epoch: 31, train_loss: 0.8285, test_loss: 1.8156, test_f1: 0.4416
 epoch: 32, train_loss: 0.7943, test_loss: 1.1018, test_f1: 0.5219
 epoch: 33, train_loss: 0.7808, test_loss: 1.0214, test_f1: 0.5389
 epoch: 34, train_loss: 0.7705, test_loss: 1.2942, test_f1: 0.5182
 epoch: 35, train_loss: 0.7589, test_loss: 1.0731, test_f1: 0.5053
 epoch: 36, train_loss: 0.7656, test_loss: 1.0835, test_f1: 0.5145
 epoch: 37, train_loss: 0.7966, test_loss: 1.2113, test_f1: 0.5237
 epoch: 38, train_loss: 0.7987, test_loss: 2.0768, test_f1: 0.3699
 epoch: 39, train_loss: 0.7892, test_loss: 1.0660, test_f1: 0.5227
 epoch: 40, train_loss: 0.7603, test_loss: 1.1046, test_f1: 0.5245
 epoch: 41, train_loss: 0.7271, test_loss: 1.2639, test_f1: 0.5320
 epoch: 42, train_loss: 0.7692, test_loss: 1.0891, test_f1: 0.5170
 epoch: 43, train_loss: 0.7755, test_loss: 1.2287, test_f1: 0.5717
 epoch: 44, train_loss: 0.7519, test_loss: 1.1495, test_f1: 0.5578
 epoch: 45, train_loss: 0.7427, test_loss: 1.0711, test_f1: 0.5194
 epoch: 46, train_loss: 0.7560, test_loss: 1.0667, test_f1: 0.5055
 epoch: 47, train_loss: 0.7665, test_loss: 1.8468, test_f1: 0.4556
 epoch: 48, train_loss: 0.7421, test_loss: 1.1575, test_f1: 0.5002
 epoch: 49, train_loss: 0.7524, test_loss: 1.2390, test_f1: 0.4366
 epoch: 50, train_loss: 0.7685, test_loss: 1.8754, test_f1: 0.4550
 epoch: 51, train_loss: 0.7716, test_loss: 1.0726, test_f1: 0.5225
 epoch: 52, train_loss: 0.7271, test_loss: 1.2940, test_f1: 0.5377
 epoch: 53, train_loss: 0.7111, test_loss: 1.3370, test_f1: 0.5555
 epoch: 54, train_loss: 0.7069, test_loss: 1.1070, test_f1: 0.5810
 epoch: 55, train_loss: 0.7230, test_loss: 1.1545, test_f1: 0.5682
 epoch: 56, train_loss: 0.7154, test_loss: 1.2371, test_f1: 0.5236
 epoch: 57, train_loss: 0.6907, test_loss: 1.1317, test_f1: 0.5667
 epoch: 58, train_loss: 0.6758, test_loss: 1.0999, test_f1: 0.5645
 epoch: 59, train_loss: 0.6615, test_loss: 1.2232, test_f1: 0.5044
 epoch: 60, train_loss: 0.6776, test_loss: 1.3838, test_f1: 0.5001
 epoch: 61, train_loss: 0.6862, test_loss: 1.2096, test_f1: 0.5507
 epoch: 62, train_loss: 0.6596, test_loss: 1.2561, test_f1: 0.5534
 epoch: 63, train_loss: 0.6654, test_loss: 1.0953, test_f1: 0.5858
 epoch: 64, train_loss: 0.6705, test_loss: 1.0798, test_f1: 0.5712
 epoch: 65, train_loss: 0.6838, test_loss: 1.5053, test_f1: 0.4657
 epoch: 66, train_loss: 0.6639, test_loss: 1.2578, test_f1: 0.5441
 epoch: 67, train_loss: 0.6524, test_loss: 2.1458, test_f1: 0.4724
 epoch: 68, train_loss: 0.6571, test_loss: 1.2197, test_f1: 0.5758
 epoch: 69, train_loss: 0.6734, test_loss: 1.2762, test_f1: 0.5692
 epoch: 70, train_loss: 0.6455, test_loss: 1.1537, test_f1: 0.5644
 epoch: 71, train_loss: 0.6664, test_loss: 1.1483, test_f1: 0.5680
 epoch: 72, train_loss: 0.6592, test_loss: 1.2837, test_f1: 0.4978
 epoch: 73, train_loss: 0.6718, test_loss: 1.1441, test_f1: 0.5364
 epoch: 74, train_loss: 0.6519, test_loss: 1.4436, test_f1: 0.5322
 epoch: 75, train_loss: 0.6400, test_loss: 1.2255, test_f1: 0.5623
 epoch: 76, train_loss: 0.6308, test_loss: 1.1884, test_f1: 0.5667
 epoch: 77, train_loss: 0.6473, test_loss: 1.1637, test_f1: 0.5720
 epoch: 78, train_loss: 0.6466, test_loss: 1.1548, test_f1: 0.5539
 epoch: 79, train_loss: 0.6048, test_loss: 1.0922, test_f1: 0.6133
 epoch: 80, train_loss: 0.6323, test_loss: 1.1917, test_f1: 0.5242
 epoch: 81, train_loss: 0.6435, test_loss: 1.2409, test_f1: 0.5899
 epoch: 82, train_loss: 0.6306, test_loss: 1.1864, test_f1: 0.5423
 epoch: 83, train_loss: 0.6494, test_loss: 1.0886, test_f1: 0.5903
 epoch: 84, train_loss: 0.6271, test_loss: 1.2677, test_f1: 0.5299
 epoch: 85, train_loss: 0.6529, test_loss: 1.2219, test_f1: 0.5719
 epoch: 86, train_loss: 0.6219, test_loss: 1.1389, test_f1: 0.5637
 epoch: 87, train_loss: 0.6174, test_loss: 1.0588, test_f1: 0.6379
 epoch: 88, train_loss: 0.6268, test_loss: 1.1505, test_f1: 0.5859
 epoch: 89, train_loss: 0.6140, test_loss: 1.4015, test_f1: 0.5472
 epoch: 90, train_loss: 0.6421, test_loss: 1.1385, test_f1: 0.5815
 epoch: 91, train_loss: 0.6260, test_loss: 1.2596, test_f1: 0.5605
 epoch: 92, train_loss: 0.6051, test_loss: 1.2413, test_f1: 0.4958
 epoch: 93, train_loss: 0.6224, test_loss: 1.2011, test_f1: 0.6056
 epoch: 94, train_loss: 0.5980, test_loss: 1.3281, test_f1: 0.5312
 epoch: 95, train_loss: 0.6047, test_loss: 1.2185, test_f1: 0.5790
 epoch: 96, train_loss: 0.6004, test_loss: 1.5371, test_f1: 0.5587
 epoch: 97, train_loss: 0.5907, test_loss: 1.1333, test_f1: 0.5950
 epoch: 98, train_loss: 0.6132, test_loss: 1.4759, test_f1: 0.5388
 epoch: 99, train_loss: 0.6005, test_loss: 1.3355, test_f1: 0.5545
##################ITERATION #9 ****************************************
 epoch: 0, train_loss: 1.2955, test_loss: 1.4469, test_f1: 0.1365
 epoch: 1, train_loss: 1.0854, test_loss: 1.2457, test_f1: 0.3831
 epoch: 2, train_loss: 1.0194, test_loss: 1.1134, test_f1: 0.4523
 epoch: 3, train_loss: 1.0066, test_loss: 1.0949, test_f1: 0.4727
 epoch: 4, train_loss: 0.9903, test_loss: 1.0839, test_f1: 0.5035
 epoch: 5, train_loss: 0.9601, test_loss: 1.0824, test_f1: 0.4731
 epoch: 6, train_loss: 0.9647, test_loss: 1.0379, test_f1: 0.4839
 epoch: 7, train_loss: 0.9717, test_loss: 1.0165, test_f1: 0.5169
 epoch: 8, train_loss: 0.9396, test_loss: 1.0222, test_f1: 0.5441
 epoch: 9, train_loss: 0.9384, test_loss: 1.0259, test_f1: 0.5518
 epoch: 10, train_loss: 0.9118, test_loss: 1.0357, test_f1: 0.5114
 epoch: 11, train_loss: 0.8965, test_loss: 0.9859, test_f1: 0.4883
 epoch: 12, train_loss: 0.8997, test_loss: 1.0390, test_f1: 0.5491
 epoch: 13, train_loss: 0.8766, test_loss: 0.9418, test_f1: 0.5732
 epoch: 14, train_loss: 0.8922, test_loss: 0.9974, test_f1: 0.5333
 epoch: 15, train_loss: 0.8619, test_loss: 1.0348, test_f1: 0.5586
 epoch: 16, train_loss: 0.8780, test_loss: 1.0619, test_f1: 0.5147
 epoch: 17, train_loss: 0.8544, test_loss: 0.9927, test_f1: 0.5410
 epoch: 18, train_loss: 0.8709, test_loss: 1.1071, test_f1: 0.4867
 epoch: 19, train_loss: 0.8477, test_loss: 1.0546, test_f1: 0.5013
 epoch: 20, train_loss: 0.8473, test_loss: 0.9333, test_f1: 0.5710
 epoch: 21, train_loss: 0.8116, test_loss: 0.9643, test_f1: 0.5702
 epoch: 22, train_loss: 0.8356, test_loss: 0.9951, test_f1: 0.5397
 epoch: 23, train_loss: 0.8349, test_loss: 1.0076, test_f1: 0.5621
 epoch: 24, train_loss: 0.8224, test_loss: 0.9445, test_f1: 0.5956
 epoch: 25, train_loss: 0.8035, test_loss: 1.1404, test_f1: 0.5281
 epoch: 26, train_loss: 0.8131, test_loss: 1.0471, test_f1: 0.5392
 epoch: 27, train_loss: 0.7984, test_loss: 1.0400, test_f1: 0.5587
 epoch: 28, train_loss: 0.8094, test_loss: 0.9786, test_f1: 0.5919
 epoch: 29, train_loss: 0.8323, test_loss: 1.0215, test_f1: 0.5515
 epoch: 30, train_loss: 0.7931, test_loss: 0.9778, test_f1: 0.5839
 epoch: 31, train_loss: 0.8051, test_loss: 0.9868, test_f1: 0.5856
 epoch: 32, train_loss: 0.8063, test_loss: 0.9460, test_f1: 0.5931
 epoch: 33, train_loss: 0.8132, test_loss: 0.9697, test_f1: 0.6060
 epoch: 34, train_loss: 0.8057, test_loss: 0.9514, test_f1: 0.5827
 epoch: 35, train_loss: 0.7798, test_loss: 1.0806, test_f1: 0.4944
 epoch: 36, train_loss: 0.7729, test_loss: 0.9622, test_f1: 0.5667
 epoch: 37, train_loss: 0.7656, test_loss: 1.1882, test_f1: 0.5165
 epoch: 38, train_loss: 0.7844, test_loss: 0.9515, test_f1: 0.6160
 epoch: 39, train_loss: 0.7782, test_loss: 1.1629, test_f1: 0.5042
 epoch: 40, train_loss: 0.7579, test_loss: 1.0513, test_f1: 0.5323
 epoch: 41, train_loss: 0.7916, test_loss: 0.9789, test_f1: 0.5780
 epoch: 42, train_loss: 0.7817, test_loss: 0.9516, test_f1: 0.5712
 epoch: 43, train_loss: 0.7686, test_loss: 0.9335, test_f1: 0.5910
 epoch: 44, train_loss: 0.7426, test_loss: 0.9601, test_f1: 0.5848
 epoch: 45, train_loss: 0.7507, test_loss: 1.3887, test_f1: 0.4550
 epoch: 46, train_loss: 0.7548, test_loss: 1.0472, test_f1: 0.5179
 epoch: 47, train_loss: 0.7137, test_loss: 1.0261, test_f1: 0.5908
 epoch: 48, train_loss: 0.7245, test_loss: 1.3998, test_f1: 0.4886
 epoch: 49, train_loss: 0.7678, test_loss: 1.1286, test_f1: 0.5431
 epoch: 50, train_loss: 0.7509, test_loss: 1.0701, test_f1: 0.5663
 epoch: 51, train_loss: 0.7137, test_loss: 0.9748, test_f1: 0.5626
 epoch: 52, train_loss: 0.6929, test_loss: 0.9434, test_f1: 0.6356
 epoch: 53, train_loss: 0.6949, test_loss: 0.9526, test_f1: 0.6267
 epoch: 54, train_loss: 0.6818, test_loss: 0.9612, test_f1: 0.6246
 epoch: 55, train_loss: 0.6656, test_loss: 0.9930, test_f1: 0.6184
 epoch: 56, train_loss: 0.6728, test_loss: 1.0528, test_f1: 0.5740
 epoch: 57, train_loss: 0.6633, test_loss: 1.0513, test_f1: 0.5986
 epoch: 58, train_loss: 0.6733, test_loss: 1.0031, test_f1: 0.6402
 epoch: 59, train_loss: 0.6691, test_loss: 0.9841, test_f1: 0.6313
 epoch: 60, train_loss: 0.6645, test_loss: 1.0649, test_f1: 0.5769
 epoch: 61, train_loss: 0.6491, test_loss: 1.0472, test_f1: 0.6058
 epoch: 62, train_loss: 0.6403, test_loss: 0.9868, test_f1: 0.6258
 epoch: 63, train_loss: 0.6552, test_loss: 1.0279, test_f1: 0.5959
 epoch: 64, train_loss: 0.6892, test_loss: 1.1730, test_f1: 0.5593
 epoch: 65, train_loss: 0.6528, test_loss: 1.1400, test_f1: 0.5621
 epoch: 66, train_loss: 0.6465, test_loss: 1.0114, test_f1: 0.6053
 epoch: 67, train_loss: 0.6511, test_loss: 0.9926, test_f1: 0.6531
 epoch: 68, train_loss: 0.6198, test_loss: 1.0189, test_f1: 0.6160
 epoch: 69, train_loss: 0.6303, test_loss: 1.0911, test_f1: 0.6243
 epoch: 70, train_loss: 0.6356, test_loss: 1.0331, test_f1: 0.6474
 epoch: 71, train_loss: 0.6218, test_loss: 1.1617, test_f1: 0.5909
 epoch: 72, train_loss: 0.6374, test_loss: 1.0065, test_f1: 0.6176
 epoch: 73, train_loss: 0.6246, test_loss: 1.0671, test_f1: 0.5936
 epoch: 74, train_loss: 0.6473, test_loss: 1.0728, test_f1: 0.5781
 epoch: 75, train_loss: 0.6190, test_loss: 1.0598, test_f1: 0.5887
 epoch: 76, train_loss: 0.6307, test_loss: 1.1100, test_f1: 0.5813
 epoch: 77, train_loss: 0.6240, test_loss: 1.0822, test_f1: 0.5925
 epoch: 78, train_loss: 0.6123, test_loss: 1.4634, test_f1: 0.4929
 epoch: 79, train_loss: 0.6593, test_loss: 1.2717, test_f1: 0.5586
 epoch: 80, train_loss: 0.6162, test_loss: 1.1728, test_f1: 0.5308
 epoch: 81, train_loss: 0.6166, test_loss: 1.0755, test_f1: 0.6086
 epoch: 82, train_loss: 0.6420, test_loss: 1.0903, test_f1: 0.6103
 epoch: 83, train_loss: 0.6028, test_loss: 1.0698, test_f1: 0.6449
 epoch: 84, train_loss: 0.5823, test_loss: 1.2731, test_f1: 0.5553
 epoch: 85, train_loss: 0.6125, test_loss: 1.0808, test_f1: 0.6003
 epoch: 86, train_loss: 0.6309, test_loss: 1.1027, test_f1: 0.6028
 epoch: 87, train_loss: 0.6188, test_loss: 1.0439, test_f1: 0.6290
 epoch: 88, train_loss: 0.6095, test_loss: 1.2175, test_f1: 0.5881
 epoch: 89, train_loss: 0.5658, test_loss: 1.0668, test_f1: 0.6291
 epoch: 90, train_loss: 0.5904, test_loss: 1.2851, test_f1: 0.5980
 epoch: 91, train_loss: 0.6168, test_loss: 1.1427, test_f1: 0.5802
 epoch: 92, train_loss: 0.5989, test_loss: 1.0434, test_f1: 0.6370
 epoch: 93, train_loss: 0.5915, test_loss: 1.1501, test_f1: 0.6489
 epoch: 94, train_loss: 0.5802, test_loss: 1.1305, test_f1: 0.6129
 epoch: 95, train_loss: 0.6005, test_loss: 1.2097, test_f1: 0.6026
 epoch: 96, train_loss: 0.6160, test_loss: 1.2442, test_f1: 0.5348
 epoch: 97, train_loss: 0.6177, test_loss: 1.2690, test_f1: 0.5544
 epoch: 98, train_loss: 0.6196, test_loss: 1.1638, test_f1: 0.6207
 epoch: 99, train_loss: 0.5714, test_loss: 1.0847, test_f1: 0.6019

Training completed in 524.94 seconds
Best F1: 0.6701 at epoch 99
Mean F1 across iterations: 0.6418  0.0195
========================FINAL RESULTS================================
FEGIN weighted F1: 0.6701  0.0195
python main.py --data ltspice_demos --representation component_pin_net --model FEGIN --layers 6 --hiddens 16 --batch_size 64 --lr 0.01 --emb_size 512 --epochs 100 --save_appendix component_pin_net_L6_H16_BS64_LR0.01_E512 --no_val
-----



STDERR:
  File "main.py", line 370, in <module>
    main()
  File "main.py", line 254, in main
    dataset = dataset_class(
  File "/home/philip/projects/ltspice_examples_code_repo/Circuit-Completion-Using-GNNs/component_classification_with_link_prediction_head/evaluation/FEGIN/kernel/circuit_datasets.py", line 15, in __init__
    self.data, self.slices = torch.load(self.processed_paths[0])
  File "/home/philip/.local/lib/python3.8/site-packages/torch/serialization.py", line 1040, in load
    warnings.warn(
  File "/usr/lib/python3.8/warnings.py", line 109, in _showwarnmsg
    sw(msg.message, msg.category, msg.filename, msg.lineno,
  File "main.py", line 47, in warn_with_traceback
    traceback.print_stack(file=log)
/home/philip/projects/ltspice_examples_code_repo/Circuit-Completion-Using-GNNs/component_classification_with_link_prediction_head/evaluation/FEGIN/kernel/circuit_datasets.py:15: FutureWarning: You are using `torch.load` with `weights_only=False` (the current default value), which uses the default pickle module implicitly. It is possible to construct malicious pickle data which will execute arbitrary code during unpickling (See https://github.com/pytorch/pytorch/blob/main/SECURITY.md#untrusted-models for more details). In a future release, the default value for `weights_only` will be flipped to `True`. This limits the functions that could be executed during unpickling. Arbitrary objects will no longer be allowed to be loaded via this mode unless they are explicitly allowlisted by the user via `torch.serialization.add_safe_globals`. We recommend you start setting `weights_only=True` for any use case where you don't have full control of the loaded file. Please open an issue on GitHub for any issues related to this experimental feature.
  self.data, self.slices = torch.load(self.processed_paths[0])
