STDOUT:
Results will be saved in /home/philip/projects/ltspice_examples_code_repo/Circuit-Completion-Using-GNNs/component_classification_with_link_prediction_head/evaluation/FEGIN/results/model_FEGIN_dataset_ltspice_demos
Command line input: python main.py --data ltspice_demos --representation component_pin --model FEGIN --layers 6 --hiddens 32 --batch_size 64 --lr 0.01 --emb_size 250 --epochs 100 --save_appendix component_pin_L6_H32_BS64_LR0.01_E250 --no_val
 is saved.
-----
ltspice_demos - FEGIN
Using 6 layers, 32 hidden units, h = 2
Loading component_pin representation dataset
ENTERED
Training FEGIN on component_pin representation
Train: 1565, Test: 383
##################ITERATION #0 ****************************************
 epoch: 0, train_loss: 1.2567, test_loss: 1.2537, test_f1: 0.3398
 epoch: 1, train_loss: 1.1694, test_loss: 1.3024, test_f1: 0.3408
 epoch: 2, train_loss: 1.0906, test_loss: 1.0966, test_f1: 0.4705
 epoch: 3, train_loss: 1.0138, test_loss: 1.0366, test_f1: 0.5100
 epoch: 4, train_loss: 0.9662, test_loss: 1.0190, test_f1: 0.4396
 epoch: 5, train_loss: 0.9358, test_loss: 0.9445, test_f1: 0.5536
 epoch: 6, train_loss: 0.8562, test_loss: 1.0766, test_f1: 0.4357
 epoch: 7, train_loss: 0.8779, test_loss: 1.0491, test_f1: 0.5026
 epoch: 8, train_loss: 0.8527, test_loss: 1.0593, test_f1: 0.5132
 epoch: 9, train_loss: 0.8311, test_loss: 1.1229, test_f1: 0.5570
 epoch: 10, train_loss: 0.8164, test_loss: 0.9927, test_f1: 0.5796
 epoch: 11, train_loss: 0.7834, test_loss: 1.2177, test_f1: 0.5531
 epoch: 12, train_loss: 0.7833, test_loss: 1.0310, test_f1: 0.5337
 epoch: 13, train_loss: 0.7521, test_loss: 1.2222, test_f1: 0.5859
 epoch: 14, train_loss: 0.7659, test_loss: 1.1844, test_f1: 0.5761
 epoch: 15, train_loss: 0.7547, test_loss: 1.0078, test_f1: 0.4660
 epoch: 16, train_loss: 0.7807, test_loss: 1.6558, test_f1: 0.4056
 epoch: 17, train_loss: 0.7875, test_loss: 3.1383, test_f1: 0.3144
 epoch: 18, train_loss: 0.7577, test_loss: 1.0749, test_f1: 0.4964
 epoch: 19, train_loss: 0.7637, test_loss: 1.0068, test_f1: 0.5586
 epoch: 20, train_loss: 0.7470, test_loss: 0.9560, test_f1: 0.6047
 epoch: 21, train_loss: 0.7465, test_loss: 1.0263, test_f1: 0.5318
 epoch: 22, train_loss: 0.7422, test_loss: 2.2617, test_f1: 0.4366
 epoch: 23, train_loss: 0.7545, test_loss: 1.1294, test_f1: 0.5672
 epoch: 24, train_loss: 0.7285, test_loss: 1.1259, test_f1: 0.5788
 epoch: 25, train_loss: 0.7294, test_loss: 0.9998, test_f1: 0.6166
 epoch: 26, train_loss: 0.7412, test_loss: 1.1336, test_f1: 0.6063
 epoch: 27, train_loss: 0.7420, test_loss: 1.1575, test_f1: 0.5869
 epoch: 28, train_loss: 0.7405, test_loss: 1.2393, test_f1: 0.4657
 epoch: 29, train_loss: 0.7335, test_loss: 1.4801, test_f1: 0.5384
 epoch: 30, train_loss: 0.7079, test_loss: 1.1794, test_f1: 0.5712
 epoch: 31, train_loss: 0.7019, test_loss: 1.4047, test_f1: 0.5314
 epoch: 32, train_loss: 0.7326, test_loss: 1.2422, test_f1: 0.5743
 epoch: 33, train_loss: 0.7225, test_loss: 1.0980, test_f1: 0.5439
 epoch: 34, train_loss: 0.7079, test_loss: 1.1771, test_f1: 0.5809
 epoch: 35, train_loss: 0.7090, test_loss: 0.9401, test_f1: 0.6104
 epoch: 36, train_loss: 0.7170, test_loss: 1.0624, test_f1: 0.5150
 epoch: 37, train_loss: 0.6997, test_loss: 1.2413, test_f1: 0.5234
 epoch: 38, train_loss: 0.7126, test_loss: 1.1178, test_f1: 0.5639
 epoch: 39, train_loss: 0.6973, test_loss: 1.1534, test_f1: 0.5359
 epoch: 40, train_loss: 0.6665, test_loss: 1.3861, test_f1: 0.5633
 epoch: 41, train_loss: 0.7105, test_loss: 1.2697, test_f1: 0.5435
 epoch: 42, train_loss: 0.6838, test_loss: 1.2632, test_f1: 0.5638
 epoch: 43, train_loss: 0.7013, test_loss: 1.5292, test_f1: 0.5072
 epoch: 44, train_loss: 0.6841, test_loss: 1.2476, test_f1: 0.5847
 epoch: 45, train_loss: 0.6764, test_loss: 1.2157, test_f1: 0.5850
 epoch: 46, train_loss: 0.6769, test_loss: 1.0222, test_f1: 0.6327
 epoch: 47, train_loss: 0.6519, test_loss: 1.1936, test_f1: 0.4870
 epoch: 48, train_loss: 0.6640, test_loss: 1.1179, test_f1: 0.5436
 epoch: 49, train_loss: 0.6476, test_loss: 1.5667, test_f1: 0.5428
 epoch: 50, train_loss: 0.6465, test_loss: 1.1228, test_f1: 0.6017
 epoch: 51, train_loss: 0.6199, test_loss: 1.1399, test_f1: 0.6282
 epoch: 52, train_loss: 0.5972, test_loss: 1.2650, test_f1: 0.6300
 epoch: 53, train_loss: 0.5885, test_loss: 1.2033, test_f1: 0.6588
 epoch: 54, train_loss: 0.5916, test_loss: 1.2179, test_f1: 0.6148
 epoch: 55, train_loss: 0.5705, test_loss: 1.2136, test_f1: 0.6618
 epoch: 56, train_loss: 0.5863, test_loss: 1.3200, test_f1: 0.6314
 epoch: 57, train_loss: 0.5713, test_loss: 1.2034, test_f1: 0.6620
 epoch: 58, train_loss: 0.5812, test_loss: 1.3028, test_f1: 0.6333
 epoch: 59, train_loss: 0.5963, test_loss: 1.3638, test_f1: 0.6248
 epoch: 60, train_loss: 0.5891, test_loss: 1.2580, test_f1: 0.6586
 epoch: 61, train_loss: 0.5645, test_loss: 1.2548, test_f1: 0.6253
 epoch: 62, train_loss: 0.5720, test_loss: 1.4226, test_f1: 0.5300
 epoch: 63, train_loss: 0.5817, test_loss: 1.1834, test_f1: 0.6426
 epoch: 64, train_loss: 0.5544, test_loss: 1.3553, test_f1: 0.6342
 epoch: 65, train_loss: 0.5461, test_loss: 1.3688, test_f1: 0.6472
 epoch: 66, train_loss: 0.5443, test_loss: 1.2734, test_f1: 0.6448
 epoch: 67, train_loss: 0.5489, test_loss: 1.3563, test_f1: 0.6597
 epoch: 68, train_loss: 0.5504, test_loss: 1.3611, test_f1: 0.6412
 epoch: 69, train_loss: 0.5539, test_loss: 1.2600, test_f1: 0.6769
 epoch: 70, train_loss: 0.5439, test_loss: 1.4332, test_f1: 0.6571
 epoch: 71, train_loss: 0.5431, test_loss: 1.4510, test_f1: 0.6381
 epoch: 72, train_loss: 0.5442, test_loss: 1.2406, test_f1: 0.6601
 epoch: 73, train_loss: 0.5270, test_loss: 1.1366, test_f1: 0.6341
 epoch: 74, train_loss: 0.5182, test_loss: 1.2551, test_f1: 0.6399
 epoch: 75, train_loss: 0.5530, test_loss: 1.3125, test_f1: 0.6828
 epoch: 76, train_loss: 0.5070, test_loss: 1.5190, test_f1: 0.6420
 epoch: 77, train_loss: 0.5195, test_loss: 1.4555, test_f1: 0.6578
 epoch: 78, train_loss: 0.5169, test_loss: 1.3590, test_f1: 0.6587
 epoch: 79, train_loss: 0.5204, test_loss: 1.3720, test_f1: 0.6674
 epoch: 80, train_loss: 0.4935, test_loss: 1.3161, test_f1: 0.6936
 epoch: 81, train_loss: 0.4955, test_loss: 1.3321, test_f1: 0.6032
 epoch: 82, train_loss: 0.5420, test_loss: 1.3035, test_f1: 0.6294
 epoch: 83, train_loss: 0.5210, test_loss: 1.3600, test_f1: 0.6337
 epoch: 84, train_loss: 0.5324, test_loss: 1.2110, test_f1: 0.6655
 epoch: 85, train_loss: 0.4959, test_loss: 1.2132, test_f1: 0.6821
 epoch: 86, train_loss: 0.5082, test_loss: 1.1969, test_f1: 0.6817
 epoch: 87, train_loss: 0.5155, test_loss: 1.4744, test_f1: 0.6636
 epoch: 88, train_loss: 0.5111, test_loss: 1.4574, test_f1: 0.6450
 epoch: 89, train_loss: 0.5063, test_loss: 1.3771, test_f1: 0.6079
 epoch: 90, train_loss: 0.5239, test_loss: 1.4709, test_f1: 0.6167
 epoch: 91, train_loss: 0.4780, test_loss: 1.2376, test_f1: 0.6711
 epoch: 92, train_loss: 0.4809, test_loss: 1.5911, test_f1: 0.6620
 epoch: 93, train_loss: 0.4623, test_loss: 1.2910, test_f1: 0.6732
 epoch: 94, train_loss: 0.4754, test_loss: 1.0982, test_f1: 0.6592
 epoch: 95, train_loss: 0.4698, test_loss: 1.3532, test_f1: 0.6171
 epoch: 96, train_loss: 0.4589, test_loss: 1.3356, test_f1: 0.6565
 epoch: 97, train_loss: 0.4662, test_loss: 1.7290, test_f1: 0.5885
 epoch: 98, train_loss: 0.4949, test_loss: 1.2695, test_f1: 0.6236
 epoch: 99, train_loss: 0.4677, test_loss: 1.5454, test_f1: 0.6360
##################ITERATION #1 ****************************************
 epoch: 0, train_loss: 1.1393, test_loss: 1.3546, test_f1: 0.2625
 epoch: 1, train_loss: 1.0098, test_loss: 1.2232, test_f1: 0.3976
 epoch: 2, train_loss: 0.9768, test_loss: 1.0822, test_f1: 0.4892
 epoch: 3, train_loss: 0.9247, test_loss: 1.1129, test_f1: 0.4537
 epoch: 4, train_loss: 0.9075, test_loss: 1.0331, test_f1: 0.5228
 epoch: 5, train_loss: 0.8709, test_loss: 1.1800, test_f1: 0.4698
 epoch: 6, train_loss: 0.8672, test_loss: 1.0859, test_f1: 0.5538
 epoch: 7, train_loss: 0.8302, test_loss: 1.0935, test_f1: 0.5091
 epoch: 8, train_loss: 0.8231, test_loss: 1.1196, test_f1: 0.5516
 epoch: 9, train_loss: 0.8214, test_loss: 1.0043, test_f1: 0.5366
 epoch: 10, train_loss: 0.8255, test_loss: 0.9980, test_f1: 0.5556
 epoch: 11, train_loss: 0.8049, test_loss: 1.0277, test_f1: 0.5483
 epoch: 12, train_loss: 0.8060, test_loss: 1.1188, test_f1: 0.5372
 epoch: 13, train_loss: 0.8017, test_loss: 1.0649, test_f1: 0.4893
 epoch: 14, train_loss: 0.7997, test_loss: 1.0186, test_f1: 0.5536
 epoch: 15, train_loss: 0.7661, test_loss: 1.5229, test_f1: 0.4118
 epoch: 16, train_loss: 0.7290, test_loss: 1.4886, test_f1: 0.3739
 epoch: 17, train_loss: 0.7366, test_loss: 1.1652, test_f1: 0.4578
 epoch: 18, train_loss: 0.7397, test_loss: 1.0508, test_f1: 0.4999
 epoch: 19, train_loss: 0.7640, test_loss: 0.9711, test_f1: 0.5745
 epoch: 20, train_loss: 0.7564, test_loss: 1.3137, test_f1: 0.4610
 epoch: 21, train_loss: 0.7276, test_loss: 1.0277, test_f1: 0.5531
 epoch: 22, train_loss: 0.7195, test_loss: 1.2774, test_f1: 0.4817
 epoch: 23, train_loss: 0.7094, test_loss: 1.3090, test_f1: 0.4656
 epoch: 24, train_loss: 0.6958, test_loss: 1.1332, test_f1: 0.6041
 epoch: 25, train_loss: 0.6922, test_loss: 1.3081, test_f1: 0.5711
 epoch: 26, train_loss: 0.7037, test_loss: 1.1167, test_f1: 0.5498
 epoch: 27, train_loss: 0.7015, test_loss: 1.2009, test_f1: 0.5848
 epoch: 28, train_loss: 0.7148, test_loss: 1.5822, test_f1: 0.4512
 epoch: 29, train_loss: 0.6809, test_loss: 1.1887, test_f1: 0.4772
 epoch: 30, train_loss: 0.6984, test_loss: 1.0791, test_f1: 0.5523
 epoch: 31, train_loss: 0.7244, test_loss: 1.0736, test_f1: 0.5850
 epoch: 32, train_loss: 0.6625, test_loss: 1.0745, test_f1: 0.5880
 epoch: 33, train_loss: 0.6757, test_loss: 1.0045, test_f1: 0.5971
 epoch: 34, train_loss: 0.6694, test_loss: 0.9471, test_f1: 0.5968
 epoch: 35, train_loss: 0.6476, test_loss: 1.0065, test_f1: 0.6305
 epoch: 36, train_loss: 0.6641, test_loss: 0.9957, test_f1: 0.6042
 epoch: 37, train_loss: 0.6431, test_loss: 1.3850, test_f1: 0.5261
 epoch: 38, train_loss: 0.6781, test_loss: 0.9445, test_f1: 0.6648
 epoch: 39, train_loss: 0.6410, test_loss: 1.1257, test_f1: 0.5651
 epoch: 40, train_loss: 0.6302, test_loss: 1.4438, test_f1: 0.6539
 epoch: 41, train_loss: 0.6324, test_loss: 1.3319, test_f1: 0.5345
 epoch: 42, train_loss: 0.6326, test_loss: 1.0165, test_f1: 0.6330
 epoch: 43, train_loss: 0.6370, test_loss: 1.1849, test_f1: 0.5752
 epoch: 44, train_loss: 0.6536, test_loss: 0.9694, test_f1: 0.6320
 epoch: 45, train_loss: 0.6464, test_loss: 1.1684, test_f1: 0.5755
 epoch: 46, train_loss: 0.6121, test_loss: 1.0644, test_f1: 0.6480
 epoch: 47, train_loss: 0.6038, test_loss: 1.1007, test_f1: 0.6400
 epoch: 48, train_loss: 0.5915, test_loss: 1.1567, test_f1: 0.6463
 epoch: 49, train_loss: 0.6319, test_loss: 1.2192, test_f1: 0.6189
 epoch: 50, train_loss: 0.6114, test_loss: 1.7469, test_f1: 0.5487
 epoch: 51, train_loss: 0.6029, test_loss: 1.0371, test_f1: 0.6509
 epoch: 52, train_loss: 0.5497, test_loss: 1.0635, test_f1: 0.6466
 epoch: 53, train_loss: 0.5456, test_loss: 1.2114, test_f1: 0.6420
 epoch: 54, train_loss: 0.5356, test_loss: 1.1621, test_f1: 0.6809
 epoch: 55, train_loss: 0.5421, test_loss: 1.2138, test_f1: 0.6551
 epoch: 56, train_loss: 0.5459, test_loss: 1.1896, test_f1: 0.6468
 epoch: 57, train_loss: 0.5178, test_loss: 1.1851, test_f1: 0.6088
 epoch: 58, train_loss: 0.5472, test_loss: 1.2744, test_f1: 0.6592
 epoch: 59, train_loss: 0.5137, test_loss: 1.4098, test_f1: 0.6160
 epoch: 60, train_loss: 0.5120, test_loss: 1.2004, test_f1: 0.6534
 epoch: 61, train_loss: 0.5253, test_loss: 1.3687, test_f1: 0.6441
 epoch: 62, train_loss: 0.4906, test_loss: 1.3915, test_f1: 0.6300
 epoch: 63, train_loss: 0.4947, test_loss: 1.2623, test_f1: 0.6524
 epoch: 64, train_loss: 0.4803, test_loss: 1.2973, test_f1: 0.6403
 epoch: 65, train_loss: 0.5047, test_loss: 1.3487, test_f1: 0.6719
 epoch: 66, train_loss: 0.4902, test_loss: 1.4807, test_f1: 0.6388
 epoch: 67, train_loss: 0.5035, test_loss: 1.4794, test_f1: 0.6277
 epoch: 68, train_loss: 0.4932, test_loss: 1.2903, test_f1: 0.6605
 epoch: 69, train_loss: 0.4736, test_loss: 1.3642, test_f1: 0.6293
 epoch: 70, train_loss: 0.4755, test_loss: 1.3135, test_f1: 0.6634
 epoch: 71, train_loss: 0.4715, test_loss: 1.5083, test_f1: 0.5788
 epoch: 72, train_loss: 0.4921, test_loss: 1.6778, test_f1: 0.5847
 epoch: 73, train_loss: 0.4903, test_loss: 1.3545, test_f1: 0.6417
 epoch: 74, train_loss: 0.5090, test_loss: 1.7015, test_f1: 0.6123
 epoch: 75, train_loss: 0.4845, test_loss: 1.5941, test_f1: 0.6398
 epoch: 76, train_loss: 0.4677, test_loss: 1.5837, test_f1: 0.6520
 epoch: 77, train_loss: 0.4683, test_loss: 1.4588, test_f1: 0.6234
 epoch: 78, train_loss: 0.4650, test_loss: 1.7106, test_f1: 0.6078
 epoch: 79, train_loss: 0.4772, test_loss: 1.4732, test_f1: 0.6350
 epoch: 80, train_loss: 0.4462, test_loss: 1.8081, test_f1: 0.6469
 epoch: 81, train_loss: 0.5194, test_loss: 1.2321, test_f1: 0.6384
 epoch: 82, train_loss: 0.4695, test_loss: 1.3675, test_f1: 0.6403
 epoch: 83, train_loss: 0.4692, test_loss: 1.3064, test_f1: 0.6251
 epoch: 84, train_loss: 0.4445, test_loss: 1.5685, test_f1: 0.6180
 epoch: 85, train_loss: 0.4237, test_loss: 1.6937, test_f1: 0.6243
 epoch: 86, train_loss: 0.4056, test_loss: 1.4474, test_f1: 0.6350
 epoch: 87, train_loss: 0.4747, test_loss: 1.5371, test_f1: 0.6427
 epoch: 88, train_loss: 0.4984, test_loss: 1.5805, test_f1: 0.6291
 epoch: 89, train_loss: 0.4347, test_loss: 1.9583, test_f1: 0.6613
 epoch: 90, train_loss: 0.4485, test_loss: 1.6038, test_f1: 0.6394
 epoch: 91, train_loss: 0.4301, test_loss: 1.7825, test_f1: 0.6348
 epoch: 92, train_loss: 0.4377, test_loss: 1.9534, test_f1: 0.6092
 epoch: 93, train_loss: 0.4381, test_loss: 1.6391, test_f1: 0.6554
 epoch: 94, train_loss: 0.4241, test_loss: 1.5494, test_f1: 0.6432
 epoch: 95, train_loss: 0.4272, test_loss: 1.5381, test_f1: 0.6470
 epoch: 96, train_loss: 0.3978, test_loss: 1.9829, test_f1: 0.5991
 epoch: 97, train_loss: 0.4057, test_loss: 1.6809, test_f1: 0.6081
 epoch: 98, train_loss: 0.3932, test_loss: 1.6212, test_f1: 0.6650
 epoch: 99, train_loss: 0.4276, test_loss: 1.7084, test_f1: 0.6321
##################ITERATION #2 ****************************************
 epoch: 0, train_loss: 1.2163, test_loss: 1.4556, test_f1: 0.2975
 epoch: 1, train_loss: 1.0405, test_loss: 1.5455, test_f1: 0.2262
 epoch: 2, train_loss: 0.9698, test_loss: 1.1335, test_f1: 0.4965
 epoch: 3, train_loss: 0.9170, test_loss: 1.0408, test_f1: 0.5509
 epoch: 4, train_loss: 0.9012, test_loss: 1.1533, test_f1: 0.4985
 epoch: 5, train_loss: 0.8630, test_loss: 1.6752, test_f1: 0.4741
 epoch: 6, train_loss: 0.8773, test_loss: 0.9655, test_f1: 0.5467
 epoch: 7, train_loss: 0.8640, test_loss: 0.9906, test_f1: 0.5562
 epoch: 8, train_loss: 0.8304, test_loss: 1.3088, test_f1: 0.5404
 epoch: 9, train_loss: 0.8406, test_loss: 0.9997, test_f1: 0.5686
 epoch: 10, train_loss: 0.8265, test_loss: 1.1679, test_f1: 0.4897
 epoch: 11, train_loss: 0.8349, test_loss: 0.9806, test_f1: 0.5901
 epoch: 12, train_loss: 0.8007, test_loss: 1.0862, test_f1: 0.5925
 epoch: 13, train_loss: 0.7871, test_loss: 1.1679, test_f1: 0.5895
 epoch: 14, train_loss: 0.7865, test_loss: 1.3445, test_f1: 0.4496
 epoch: 15, train_loss: 0.8272, test_loss: 0.9847, test_f1: 0.5768
 epoch: 16, train_loss: 0.7672, test_loss: 1.0007, test_f1: 0.5924
 epoch: 17, train_loss: 0.7936, test_loss: 1.8368, test_f1: 0.3973
 epoch: 18, train_loss: 0.7662, test_loss: 1.1121, test_f1: 0.5236
 epoch: 19, train_loss: 0.8072, test_loss: 1.3843, test_f1: 0.4961
 epoch: 20, train_loss: 0.7960, test_loss: 1.1915, test_f1: 0.5950
 epoch: 21, train_loss: 0.7742, test_loss: 1.0899, test_f1: 0.5507
 epoch: 22, train_loss: 0.7519, test_loss: 1.0115, test_f1: 0.5991
 epoch: 23, train_loss: 0.7578, test_loss: 1.2631, test_f1: 0.6080
 epoch: 24, train_loss: 0.7564, test_loss: 1.1191, test_f1: 0.6017
 epoch: 25, train_loss: 0.7394, test_loss: 1.2593, test_f1: 0.5778
 epoch: 26, train_loss: 0.7371, test_loss: 1.1946, test_f1: 0.5338
 epoch: 27, train_loss: 0.7312, test_loss: 1.1388, test_f1: 0.6088
 epoch: 28, train_loss: 0.7359, test_loss: 1.0989, test_f1: 0.5496
 epoch: 29, train_loss: 0.7085, test_loss: 1.3284, test_f1: 0.5729
 epoch: 30, train_loss: 0.7104, test_loss: 1.5109, test_f1: 0.5694
 epoch: 31, train_loss: 0.7339, test_loss: 1.0065, test_f1: 0.6100
 epoch: 32, train_loss: 0.7307, test_loss: 1.0167, test_f1: 0.5867
 epoch: 33, train_loss: 0.7103, test_loss: 1.2491, test_f1: 0.5607
 epoch: 34, train_loss: 0.7116, test_loss: 1.2368, test_f1: 0.5332
 epoch: 35, train_loss: 0.7326, test_loss: 1.2619, test_f1: 0.5558
 epoch: 36, train_loss: 0.7098, test_loss: 1.3132, test_f1: 0.5253
 epoch: 37, train_loss: 0.7066, test_loss: 1.2545, test_f1: 0.5035
 epoch: 38, train_loss: 0.6892, test_loss: 1.1648, test_f1: 0.5799
 epoch: 39, train_loss: 0.6878, test_loss: 1.5378, test_f1: 0.4916
 epoch: 40, train_loss: 0.7066, test_loss: 1.1713, test_f1: 0.5767
 epoch: 41, train_loss: 0.7041, test_loss: 1.2016, test_f1: 0.5775
 epoch: 42, train_loss: 0.6915, test_loss: 1.1253, test_f1: 0.5305
 epoch: 43, train_loss: 0.6757, test_loss: 1.3560, test_f1: 0.5597
 epoch: 44, train_loss: 0.6836, test_loss: 1.1503, test_f1: 0.6114
 epoch: 45, train_loss: 0.6788, test_loss: 1.2030, test_f1: 0.5575
 epoch: 46, train_loss: 0.6848, test_loss: 1.2560, test_f1: 0.5607
 epoch: 47, train_loss: 0.6946, test_loss: 1.5861, test_f1: 0.5401
 epoch: 48, train_loss: 0.6805, test_loss: 1.2125, test_f1: 0.5552
 epoch: 49, train_loss: 0.6522, test_loss: 1.1933, test_f1: 0.6020
 epoch: 50, train_loss: 0.6494, test_loss: 1.3626, test_f1: 0.5785
 epoch: 51, train_loss: 0.6422, test_loss: 1.2597, test_f1: 0.5655
 epoch: 52, train_loss: 0.6263, test_loss: 1.3630, test_f1: 0.5600
 epoch: 53, train_loss: 0.6193, test_loss: 1.2558, test_f1: 0.6028
 epoch: 54, train_loss: 0.6226, test_loss: 1.2375, test_f1: 0.5913
 epoch: 55, train_loss: 0.5926, test_loss: 1.1145, test_f1: 0.6273
 epoch: 56, train_loss: 0.5908, test_loss: 1.4126, test_f1: 0.5887
 epoch: 57, train_loss: 0.5958, test_loss: 1.4377, test_f1: 0.5896
 epoch: 58, train_loss: 0.6185, test_loss: 1.3197, test_f1: 0.5749
 epoch: 59, train_loss: 0.6052, test_loss: 1.1261, test_f1: 0.5789
 epoch: 60, train_loss: 0.5831, test_loss: 1.2066, test_f1: 0.6164
 epoch: 61, train_loss: 0.5765, test_loss: 1.4802, test_f1: 0.5904
 epoch: 62, train_loss: 0.5626, test_loss: 1.4606, test_f1: 0.6084
 epoch: 63, train_loss: 0.5511, test_loss: 1.4520, test_f1: 0.6110
 epoch: 64, train_loss: 0.5701, test_loss: 1.5719, test_f1: 0.5939
 epoch: 65, train_loss: 0.5873, test_loss: 1.5652, test_f1: 0.5636
 epoch: 66, train_loss: 0.6044, test_loss: 1.0604, test_f1: 0.5926
 epoch: 67, train_loss: 0.5752, test_loss: 1.5492, test_f1: 0.6276
 epoch: 68, train_loss: 0.5746, test_loss: 1.7564, test_f1: 0.6082
 epoch: 69, train_loss: 0.5548, test_loss: 1.4347, test_f1: 0.6122
 epoch: 70, train_loss: 0.5478, test_loss: 1.4948, test_f1: 0.6120
 epoch: 71, train_loss: 0.5760, test_loss: 1.2860, test_f1: 0.6032
 epoch: 72, train_loss: 0.5613, test_loss: 1.5452, test_f1: 0.5843
 epoch: 73, train_loss: 0.5295, test_loss: 1.5731, test_f1: 0.6019
 epoch: 74, train_loss: 0.5411, test_loss: 1.7552, test_f1: 0.5833
 epoch: 75, train_loss: 0.5660, test_loss: 1.4211, test_f1: 0.6143
 epoch: 76, train_loss: 0.5458, test_loss: 1.4309, test_f1: 0.5875
 epoch: 77, train_loss: 0.5653, test_loss: 1.6405, test_f1: 0.5933
 epoch: 78, train_loss: 0.5637, test_loss: 1.6016, test_f1: 0.5823
 epoch: 79, train_loss: 0.5462, test_loss: 1.4582, test_f1: 0.6279
 epoch: 80, train_loss: 0.5405, test_loss: 1.5559, test_f1: 0.6012
 epoch: 81, train_loss: 0.5299, test_loss: 1.9976, test_f1: 0.6233
 epoch: 82, train_loss: 0.5374, test_loss: 1.4736, test_f1: 0.5915
 epoch: 83, train_loss: 0.5371, test_loss: 1.4698, test_f1: 0.6025
 epoch: 84, train_loss: 0.5425, test_loss: 1.5709, test_f1: 0.5976
 epoch: 85, train_loss: 0.5486, test_loss: 1.3863, test_f1: 0.6309
 epoch: 86, train_loss: 0.5575, test_loss: 1.2603, test_f1: 0.5771
 epoch: 87, train_loss: 0.5268, test_loss: 1.4462, test_f1: 0.6427
 epoch: 88, train_loss: 0.5113, test_loss: 1.5220, test_f1: 0.6109
 epoch: 89, train_loss: 0.5057, test_loss: 1.7519, test_f1: 0.6008
 epoch: 90, train_loss: 0.4885, test_loss: 1.5560, test_f1: 0.5700
 epoch: 91, train_loss: 0.5135, test_loss: 1.6115, test_f1: 0.6083
 epoch: 92, train_loss: 0.5287, test_loss: 1.6301, test_f1: 0.6062
 epoch: 93, train_loss: 0.5067, test_loss: 1.4605, test_f1: 0.6066
 epoch: 94, train_loss: 0.4922, test_loss: 1.4378, test_f1: 0.5744
 epoch: 95, train_loss: 0.5221, test_loss: 1.4753, test_f1: 0.6078
 epoch: 96, train_loss: 0.5260, test_loss: 2.2840, test_f1: 0.5680
 epoch: 97, train_loss: 0.4988, test_loss: 1.5625, test_f1: 0.6270
 epoch: 98, train_loss: 0.4814, test_loss: 1.8939, test_f1: 0.6148
 epoch: 99, train_loss: 0.4900, test_loss: 1.6042, test_f1: 0.6286
##################ITERATION #3 ****************************************
 epoch: 0, train_loss: 1.1616, test_loss: 1.6440, test_f1: 0.2296
 epoch: 1, train_loss: 0.9924, test_loss: 1.3776, test_f1: 0.2117
 epoch: 2, train_loss: 0.9421, test_loss: 2.1323, test_f1: 0.2365
 epoch: 3, train_loss: 0.9138, test_loss: 0.9966, test_f1: 0.5227
 epoch: 4, train_loss: 0.8920, test_loss: 1.0965, test_f1: 0.5123
 epoch: 5, train_loss: 0.8951, test_loss: 1.0800, test_f1: 0.5228
 epoch: 6, train_loss: 0.8792, test_loss: 1.0705, test_f1: 0.4730
 epoch: 7, train_loss: 0.8557, test_loss: 1.1530, test_f1: 0.4817
 epoch: 8, train_loss: 0.8455, test_loss: 1.0383, test_f1: 0.5206
 epoch: 9, train_loss: 0.8276, test_loss: 1.1433, test_f1: 0.4718
 epoch: 10, train_loss: 0.8185, test_loss: 0.9955, test_f1: 0.5551
 epoch: 11, train_loss: 0.8028, test_loss: 1.0854, test_f1: 0.5667
 epoch: 12, train_loss: 0.8135, test_loss: 1.0419, test_f1: 0.5913
 epoch: 13, train_loss: 0.8033, test_loss: 1.7172, test_f1: 0.3742
 epoch: 14, train_loss: 0.7941, test_loss: 1.1920, test_f1: 0.5391
 epoch: 15, train_loss: 0.7963, test_loss: 1.2789, test_f1: 0.5111
 epoch: 16, train_loss: 0.7676, test_loss: 0.9537, test_f1: 0.5970
 epoch: 17, train_loss: 0.7746, test_loss: 0.9786, test_f1: 0.5718
 epoch: 18, train_loss: 0.7391, test_loss: 0.9764, test_f1: 0.6019
 epoch: 19, train_loss: 0.7399, test_loss: 0.9357, test_f1: 0.6217
 epoch: 20, train_loss: 0.7413, test_loss: 0.9996, test_f1: 0.5953
 epoch: 21, train_loss: 0.7349, test_loss: 1.1091, test_f1: 0.5865
 epoch: 22, train_loss: 0.7259, test_loss: 1.0659, test_f1: 0.5764
 epoch: 23, train_loss: 0.7487, test_loss: 0.9400, test_f1: 0.6336
 epoch: 24, train_loss: 0.7179, test_loss: 1.1722, test_f1: 0.5972
 epoch: 25, train_loss: 0.7154, test_loss: 1.4106, test_f1: 0.5682
 epoch: 26, train_loss: 0.6990, test_loss: 1.2159, test_f1: 0.5430
 epoch: 27, train_loss: 0.7223, test_loss: 1.2317, test_f1: 0.5692
 epoch: 28, train_loss: 0.7601, test_loss: 1.1313, test_f1: 0.5366
 epoch: 29, train_loss: 0.7011, test_loss: 1.4301, test_f1: 0.4972
 epoch: 30, train_loss: 0.7178, test_loss: 1.0628, test_f1: 0.5778
 epoch: 31, train_loss: 0.7126, test_loss: 1.0120, test_f1: 0.6187
 epoch: 32, train_loss: 0.7097, test_loss: 0.9853, test_f1: 0.5855
 epoch: 33, train_loss: 0.6986, test_loss: 1.3053, test_f1: 0.5234
 epoch: 34, train_loss: 0.7110, test_loss: 1.1442, test_f1: 0.5696
 epoch: 35, train_loss: 0.6787, test_loss: 1.0950, test_f1: 0.6049
 epoch: 36, train_loss: 0.6769, test_loss: 1.1006, test_f1: 0.6179
 epoch: 37, train_loss: 0.6971, test_loss: 1.0452, test_f1: 0.5935
 epoch: 38, train_loss: 0.6864, test_loss: 1.3216, test_f1: 0.5158
 epoch: 39, train_loss: 0.6742, test_loss: 1.0465, test_f1: 0.5892
 epoch: 40, train_loss: 0.6789, test_loss: 1.3711, test_f1: 0.5891
 epoch: 41, train_loss: 0.6878, test_loss: 1.2514, test_f1: 0.5778
 epoch: 42, train_loss: 0.6772, test_loss: 1.1647, test_f1: 0.6103
 epoch: 43, train_loss: 0.6786, test_loss: 1.4690, test_f1: 0.5300
 epoch: 44, train_loss: 0.6522, test_loss: 1.4854, test_f1: 0.5675
 epoch: 45, train_loss: 0.6710, test_loss: 1.0408, test_f1: 0.6293
 epoch: 46, train_loss: 0.6555, test_loss: 1.0972, test_f1: 0.6003
 epoch: 47, train_loss: 0.6401, test_loss: 1.2111, test_f1: 0.5413
 epoch: 48, train_loss: 0.6794, test_loss: 1.0259, test_f1: 0.5837
 epoch: 49, train_loss: 0.6728, test_loss: 1.1822, test_f1: 0.5957
 epoch: 50, train_loss: 0.6450, test_loss: 1.2918, test_f1: 0.5779
 epoch: 51, train_loss: 0.6435, test_loss: 1.0289, test_f1: 0.6197
 epoch: 52, train_loss: 0.6144, test_loss: 1.1325, test_f1: 0.5904
 epoch: 53, train_loss: 0.6089, test_loss: 1.1810, test_f1: 0.6104
 epoch: 54, train_loss: 0.6136, test_loss: 1.0505, test_f1: 0.6291
 epoch: 55, train_loss: 0.6141, test_loss: 1.2310, test_f1: 0.5994
 epoch: 56, train_loss: 0.5863, test_loss: 1.1695, test_f1: 0.6077
 epoch: 57, train_loss: 0.6051, test_loss: 1.0839, test_f1: 0.5927
 epoch: 58, train_loss: 0.5965, test_loss: 1.2119, test_f1: 0.5959
 epoch: 59, train_loss: 0.5981, test_loss: 1.5736, test_f1: 0.5330
 epoch: 60, train_loss: 0.5940, test_loss: 1.1693, test_f1: 0.5863
 epoch: 61, train_loss: 0.6057, test_loss: 1.2514, test_f1: 0.6230
 epoch: 62, train_loss: 0.5809, test_loss: 1.3800, test_f1: 0.5771
 epoch: 63, train_loss: 0.5643, test_loss: 1.2668, test_f1: 0.5893
 epoch: 64, train_loss: 0.5771, test_loss: 1.3427, test_f1: 0.5254
 epoch: 65, train_loss: 0.5803, test_loss: 1.1160, test_f1: 0.6066
 epoch: 66, train_loss: 0.5611, test_loss: 1.4363, test_f1: 0.5960
 epoch: 67, train_loss: 0.5632, test_loss: 1.4751, test_f1: 0.6135
 epoch: 68, train_loss: 0.5443, test_loss: 1.2107, test_f1: 0.5932
 epoch: 69, train_loss: 0.5682, test_loss: 1.3801, test_f1: 0.5906
 epoch: 70, train_loss: 0.5619, test_loss: 1.2898, test_f1: 0.5819
 epoch: 71, train_loss: 0.5687, test_loss: 1.1552, test_f1: 0.6585
 epoch: 72, train_loss: 0.5611, test_loss: 1.2531, test_f1: 0.6051
 epoch: 73, train_loss: 0.5473, test_loss: 1.5836, test_f1: 0.5670
 epoch: 74, train_loss: 0.5588, test_loss: 1.3381, test_f1: 0.5988
 epoch: 75, train_loss: 0.5428, test_loss: 1.2474, test_f1: 0.5938
 epoch: 76, train_loss: 0.5452, test_loss: 1.2909, test_f1: 0.5795
 epoch: 77, train_loss: 0.5429, test_loss: 1.1745, test_f1: 0.6271
 epoch: 78, train_loss: 0.5456, test_loss: 1.5792, test_f1: 0.5182
 epoch: 79, train_loss: 0.5402, test_loss: 1.7411, test_f1: 0.5758
 epoch: 80, train_loss: 0.5380, test_loss: 1.5913, test_f1: 0.5670
 epoch: 81, train_loss: 0.5292, test_loss: 1.3544, test_f1: 0.6153
 epoch: 82, train_loss: 0.4940, test_loss: 1.4760, test_f1: 0.5808
 epoch: 83, train_loss: 0.5394, test_loss: 1.4531, test_f1: 0.5953
 epoch: 84, train_loss: 0.5199, test_loss: 1.4214, test_f1: 0.6174
 epoch: 85, train_loss: 0.5125, test_loss: 1.5554, test_f1: 0.6156
 epoch: 86, train_loss: 0.5183, test_loss: 1.4072, test_f1: 0.5574
 epoch: 87, train_loss: 0.5249, test_loss: 1.5802, test_f1: 0.5841
 epoch: 88, train_loss: 0.5479, test_loss: 1.3321, test_f1: 0.5872
 epoch: 89, train_loss: 0.5191, test_loss: 1.6637, test_f1: 0.5735
 epoch: 90, train_loss: 0.5263, test_loss: 1.6205, test_f1: 0.5958
 epoch: 91, train_loss: 0.5472, test_loss: 1.5221, test_f1: 0.6297
 epoch: 92, train_loss: 0.5011, test_loss: 1.5363, test_f1: 0.5573
 epoch: 93, train_loss: 0.5076, test_loss: 1.5110, test_f1: 0.5668
 epoch: 94, train_loss: 0.5011, test_loss: 2.0215, test_f1: 0.5222
 epoch: 95, train_loss: 0.5299, test_loss: 1.3479, test_f1: 0.5379
 epoch: 96, train_loss: 0.5057, test_loss: 1.4418, test_f1: 0.6324
 epoch: 97, train_loss: 0.5110, test_loss: 1.4839, test_f1: 0.5969
 epoch: 98, train_loss: 0.4686, test_loss: 1.7887, test_f1: 0.6432
 epoch: 99, train_loss: 0.4641, test_loss: 1.7722, test_f1: 0.6240
##################ITERATION #4 ****************************************
 epoch: 0, train_loss: 1.2100, test_loss: 1.3176, test_f1: 0.2357
 epoch: 1, train_loss: 0.9815, test_loss: 1.0228, test_f1: 0.5308
 epoch: 2, train_loss: 0.9517, test_loss: 1.3008, test_f1: 0.5603
 epoch: 3, train_loss: 0.8862, test_loss: 0.9834, test_f1: 0.5633
 epoch: 4, train_loss: 0.8672, test_loss: 0.9632, test_f1: 0.6001
 epoch: 5, train_loss: 0.8439, test_loss: 0.9092, test_f1: 0.6004
 epoch: 6, train_loss: 0.8151, test_loss: 1.0492, test_f1: 0.5771
 epoch: 7, train_loss: 0.8091, test_loss: 1.0373, test_f1: 0.5651
 epoch: 8, train_loss: 0.8032, test_loss: 0.9278, test_f1: 0.6162
 epoch: 9, train_loss: 0.8254, test_loss: 1.1011, test_f1: 0.4654
 epoch: 10, train_loss: 0.8108, test_loss: 1.0503, test_f1: 0.5328
 epoch: 11, train_loss: 0.7987, test_loss: 1.3105, test_f1: 0.4180
 epoch: 12, train_loss: 0.7636, test_loss: 1.1594, test_f1: 0.4808
 epoch: 13, train_loss: 0.7428, test_loss: 0.9503, test_f1: 0.6246
 epoch: 14, train_loss: 0.7268, test_loss: 1.3903, test_f1: 0.5597
 epoch: 15, train_loss: 0.7067, test_loss: 0.9816, test_f1: 0.6360
 epoch: 16, train_loss: 0.7662, test_loss: 0.9654, test_f1: 0.6289
 epoch: 17, train_loss: 0.7251, test_loss: 1.1482, test_f1: 0.5412
 epoch: 18, train_loss: 0.7275, test_loss: 1.0063, test_f1: 0.5840
 epoch: 19, train_loss: 0.6920, test_loss: 0.9445, test_f1: 0.5919
 epoch: 20, train_loss: 0.6738, test_loss: 1.0337, test_f1: 0.5804
 epoch: 21, train_loss: 0.7061, test_loss: 0.9772, test_f1: 0.5774
 epoch: 22, train_loss: 0.6784, test_loss: 0.9647, test_f1: 0.5895
 epoch: 23, train_loss: 0.6688, test_loss: 1.2884, test_f1: 0.5748
 epoch: 24, train_loss: 0.6879, test_loss: 0.9879, test_f1: 0.6030
 epoch: 25, train_loss: 0.7270, test_loss: 1.0585, test_f1: 0.5977
 epoch: 26, train_loss: 0.6905, test_loss: 0.9789, test_f1: 0.5853
 epoch: 27, train_loss: 0.7089, test_loss: 1.0196, test_f1: 0.5617
 epoch: 28, train_loss: 0.6730, test_loss: 0.9682, test_f1: 0.6429
 epoch: 29, train_loss: 0.6338, test_loss: 1.1584, test_f1: 0.5821
 epoch: 30, train_loss: 0.6927, test_loss: 1.0179, test_f1: 0.6113
 epoch: 31, train_loss: 0.6882, test_loss: 0.9508, test_f1: 0.6238
 epoch: 32, train_loss: 0.6467, test_loss: 1.0837, test_f1: 0.5824
 epoch: 33, train_loss: 0.6580, test_loss: 1.3286, test_f1: 0.5960
 epoch: 34, train_loss: 0.6932, test_loss: 1.0972, test_f1: 0.5427
 epoch: 35, train_loss: 0.6579, test_loss: 1.3317, test_f1: 0.5503
 epoch: 36, train_loss: 0.6737, test_loss: 1.4342, test_f1: 0.5200
 epoch: 37, train_loss: 0.6246, test_loss: 0.9770, test_f1: 0.6206
 epoch: 38, train_loss: 0.6357, test_loss: 1.1128, test_f1: 0.6266
 epoch: 39, train_loss: 0.6386, test_loss: 1.1049, test_f1: 0.6172
 epoch: 40, train_loss: 0.6084, test_loss: 1.0985, test_f1: 0.5646
 epoch: 41, train_loss: 0.6208, test_loss: 1.1583, test_f1: 0.5585
 epoch: 42, train_loss: 0.6316, test_loss: 1.2941, test_f1: 0.5684
 epoch: 43, train_loss: 0.5949, test_loss: 0.9624, test_f1: 0.6174
 epoch: 44, train_loss: 0.6285, test_loss: 1.0179, test_f1: 0.6275
 epoch: 45, train_loss: 0.6024, test_loss: 1.1461, test_f1: 0.6070
 epoch: 46, train_loss: 0.6583, test_loss: 1.0104, test_f1: 0.5908
 epoch: 47, train_loss: 0.6491, test_loss: 1.5084, test_f1: 0.4948
 epoch: 48, train_loss: 0.5942, test_loss: 1.0726, test_f1: 0.5746
 epoch: 49, train_loss: 0.6078, test_loss: 1.1784, test_f1: 0.5802
 epoch: 50, train_loss: 0.5913, test_loss: 1.1490, test_f1: 0.5675
 epoch: 51, train_loss: 0.5759, test_loss: 1.0692, test_f1: 0.6139
 epoch: 52, train_loss: 0.5432, test_loss: 1.0920, test_f1: 0.5907
 epoch: 53, train_loss: 0.5035, test_loss: 1.2565, test_f1: 0.6417
 epoch: 54, train_loss: 0.5160, test_loss: 1.0629, test_f1: 0.6584
 epoch: 55, train_loss: 0.5445, test_loss: 1.3763, test_f1: 0.5724
 epoch: 56, train_loss: 0.5439, test_loss: 1.0533, test_f1: 0.6163
 epoch: 57, train_loss: 0.5043, test_loss: 1.1397, test_f1: 0.6331
 epoch: 58, train_loss: 0.4949, test_loss: 1.1685, test_f1: 0.6106
 epoch: 59, train_loss: 0.4976, test_loss: 1.0711, test_f1: 0.6564
 epoch: 60, train_loss: 0.4828, test_loss: 1.1293, test_f1: 0.6603
 epoch: 61, train_loss: 0.4836, test_loss: 1.2419, test_f1: 0.5852
 epoch: 62, train_loss: 0.4868, test_loss: 1.4459, test_f1: 0.5962
 epoch: 63, train_loss: 0.4464, test_loss: 1.5433, test_f1: 0.5621
 epoch: 64, train_loss: 0.5125, test_loss: 1.1849, test_f1: 0.6500
 epoch: 65, train_loss: 0.4514, test_loss: 1.1344, test_f1: 0.6614
 epoch: 66, train_loss: 0.4670, test_loss: 1.3792, test_f1: 0.5722
 epoch: 67, train_loss: 0.4908, test_loss: 1.1977, test_f1: 0.6366
 epoch: 68, train_loss: 0.4716, test_loss: 1.1841, test_f1: 0.6388
 epoch: 69, train_loss: 0.4991, test_loss: 1.3075, test_f1: 0.6180
 epoch: 70, train_loss: 0.4543, test_loss: 1.4563, test_f1: 0.5961
 epoch: 71, train_loss: 0.4535, test_loss: 1.4085, test_f1: 0.6286
 epoch: 72, train_loss: 0.4262, test_loss: 1.5190, test_f1: 0.5963
 epoch: 73, train_loss: 0.4561, test_loss: 1.2831, test_f1: 0.6072
 epoch: 74, train_loss: 0.4297, test_loss: 1.5725, test_f1: 0.6453
 epoch: 75, train_loss: 0.4561, test_loss: 1.3984, test_f1: 0.6014
 epoch: 76, train_loss: 0.4372, test_loss: 1.3607, test_f1: 0.6514
 epoch: 77, train_loss: 0.4633, test_loss: 1.3433, test_f1: 0.5802
 epoch: 78, train_loss: 0.4530, test_loss: 1.4566, test_f1: 0.6587
 epoch: 79, train_loss: 0.4276, test_loss: 1.4593, test_f1: 0.6113
 epoch: 80, train_loss: 0.4122, test_loss: 1.5557, test_f1: 0.5810
 epoch: 81, train_loss: 0.4174, test_loss: 1.7534, test_f1: 0.5903
 epoch: 82, train_loss: 0.4179, test_loss: 1.5784, test_f1: 0.6339
 epoch: 83, train_loss: 0.4257, test_loss: 1.4369, test_f1: 0.6190
 epoch: 84, train_loss: 0.4255, test_loss: 1.3397, test_f1: 0.6281
 epoch: 85, train_loss: 0.4109, test_loss: 1.5403, test_f1: 0.6541
 epoch: 86, train_loss: 0.4062, test_loss: 2.0455, test_f1: 0.5603
 epoch: 87, train_loss: 0.4243, test_loss: 1.3033, test_f1: 0.6755
 epoch: 88, train_loss: 0.4230, test_loss: 1.7458, test_f1: 0.5895
 epoch: 89, train_loss: 0.4482, test_loss: 1.4329, test_f1: 0.5646
 epoch: 90, train_loss: 0.4415, test_loss: 1.3896, test_f1: 0.6432
 epoch: 91, train_loss: 0.4166, test_loss: 1.4720, test_f1: 0.6216
 epoch: 92, train_loss: 0.4218, test_loss: 1.3393, test_f1: 0.6382
 epoch: 93, train_loss: 0.4105, test_loss: 1.3404, test_f1: 0.6694
 epoch: 94, train_loss: 0.3931, test_loss: 1.7271, test_f1: 0.5850
 epoch: 95, train_loss: 0.4390, test_loss: 1.6192, test_f1: 0.6100
 epoch: 96, train_loss: 0.4178, test_loss: 1.6252, test_f1: 0.5662
 epoch: 97, train_loss: 0.3853, test_loss: 1.3794, test_f1: 0.6867
 epoch: 98, train_loss: 0.3877, test_loss: 1.4788, test_f1: 0.6555
 epoch: 99, train_loss: 0.4057, test_loss: 1.5494, test_f1: 0.6330
##################ITERATION #5 ****************************************
 epoch: 0, train_loss: 1.2183, test_loss: 1.2513, test_f1: 0.2816
 epoch: 1, train_loss: 0.9855, test_loss: 1.2024, test_f1: 0.4747
 epoch: 2, train_loss: 0.9087, test_loss: 1.7107, test_f1: 0.2981
 epoch: 3, train_loss: 0.8650, test_loss: 0.9535, test_f1: 0.5946
 epoch: 4, train_loss: 0.8799, test_loss: 0.9775, test_f1: 0.5267
 epoch: 5, train_loss: 0.8493, test_loss: 1.2521, test_f1: 0.4199
 epoch: 6, train_loss: 0.8398, test_loss: 0.9486, test_f1: 0.5567
 epoch: 7, train_loss: 0.7983, test_loss: 0.9735, test_f1: 0.5778
 epoch: 8, train_loss: 0.8357, test_loss: 1.0580, test_f1: 0.5806
 epoch: 9, train_loss: 0.8287, test_loss: 1.0596, test_f1: 0.5819
 epoch: 10, train_loss: 0.8003, test_loss: 0.9611, test_f1: 0.5570
 epoch: 11, train_loss: 0.8070, test_loss: 0.9135, test_f1: 0.6227
 epoch: 12, train_loss: 0.7722, test_loss: 1.0248, test_f1: 0.5773
 epoch: 13, train_loss: 0.7776, test_loss: 0.9153, test_f1: 0.6223
 epoch: 14, train_loss: 0.7673, test_loss: 1.0533, test_f1: 0.5653
 epoch: 15, train_loss: 0.7673, test_loss: 1.3396, test_f1: 0.5194
 epoch: 16, train_loss: 0.7365, test_loss: 1.0332, test_f1: 0.5508
 epoch: 17, train_loss: 0.7398, test_loss: 1.0115, test_f1: 0.5768
 epoch: 18, train_loss: 0.7317, test_loss: 0.9153, test_f1: 0.6455
 epoch: 19, train_loss: 0.7352, test_loss: 1.1574, test_f1: 0.5265
 epoch: 20, train_loss: 0.7444, test_loss: 1.5853, test_f1: 0.4641
 epoch: 21, train_loss: 0.7170, test_loss: 1.0546, test_f1: 0.6206
 epoch: 22, train_loss: 0.7107, test_loss: 1.0268, test_f1: 0.5842
 epoch: 23, train_loss: 0.7248, test_loss: 1.1170, test_f1: 0.5810
 epoch: 24, train_loss: 0.7198, test_loss: 1.0237, test_f1: 0.6141
 epoch: 25, train_loss: 0.7346, test_loss: 1.0749, test_f1: 0.6358
 epoch: 26, train_loss: 0.7284, test_loss: 1.1075, test_f1: 0.5859
 epoch: 27, train_loss: 0.7190, test_loss: 0.9619, test_f1: 0.6030
 epoch: 28, train_loss: 0.7047, test_loss: 1.1470, test_f1: 0.5993
 epoch: 29, train_loss: 0.7021, test_loss: 1.1716, test_f1: 0.5898
 epoch: 30, train_loss: 0.6972, test_loss: 1.3269, test_f1: 0.5385
 epoch: 31, train_loss: 0.6961, test_loss: 1.0483, test_f1: 0.6060
 epoch: 32, train_loss: 0.7095, test_loss: 1.0417, test_f1: 0.6366
 epoch: 33, train_loss: 0.7052, test_loss: 1.1359, test_f1: 0.6181
 epoch: 34, train_loss: 0.6747, test_loss: 0.9672, test_f1: 0.6354
 epoch: 35, train_loss: 0.6698, test_loss: 1.3188, test_f1: 0.5943
 epoch: 36, train_loss: 0.6640, test_loss: 1.4179, test_f1: 0.5788
 epoch: 37, train_loss: 0.7206, test_loss: 1.1401, test_f1: 0.5832
 epoch: 38, train_loss: 0.6906, test_loss: 0.9446, test_f1: 0.6367
 epoch: 39, train_loss: 0.6734, test_loss: 1.1706, test_f1: 0.6168
 epoch: 40, train_loss: 0.6562, test_loss: 1.1830, test_f1: 0.6491
 epoch: 41, train_loss: 0.6585, test_loss: 1.7088, test_f1: 0.6291
 epoch: 42, train_loss: 0.6450, test_loss: 1.2800, test_f1: 0.5233
 epoch: 43, train_loss: 0.7227, test_loss: 11.0837, test_f1: 0.1723
 epoch: 44, train_loss: 0.8160, test_loss: 0.9789, test_f1: 0.6034
 epoch: 45, train_loss: 0.7250, test_loss: 1.0313, test_f1: 0.6427
 epoch: 46, train_loss: 0.7134, test_loss: 1.1562, test_f1: 0.5469
 epoch: 47, train_loss: 0.6696, test_loss: 1.0469, test_f1: 0.6346
 epoch: 48, train_loss: 0.6593, test_loss: 1.0873, test_f1: 0.6256
 epoch: 49, train_loss: 0.6617, test_loss: 1.1025, test_f1: 0.6381
 epoch: 50, train_loss: 0.6960, test_loss: 1.0340, test_f1: 0.6081
 epoch: 51, train_loss: 0.6471, test_loss: 0.9927, test_f1: 0.6090
 epoch: 52, train_loss: 0.6248, test_loss: 1.0444, test_f1: 0.6506
 epoch: 53, train_loss: 0.6098, test_loss: 1.2208, test_f1: 0.5189
 epoch: 54, train_loss: 0.6135, test_loss: 1.3393, test_f1: 0.6035
 epoch: 55, train_loss: 0.5886, test_loss: 1.2266, test_f1: 0.6418
 epoch: 56, train_loss: 0.5865, test_loss: 1.2326, test_f1: 0.6122
 epoch: 57, train_loss: 0.5867, test_loss: 1.2046, test_f1: 0.5927
 epoch: 58, train_loss: 0.5900, test_loss: 1.1294, test_f1: 0.6368
 epoch: 59, train_loss: 0.5754, test_loss: 1.2337, test_f1: 0.6694
 epoch: 60, train_loss: 0.5640, test_loss: 1.1512, test_f1: 0.6432
 epoch: 61, train_loss: 0.5714, test_loss: 1.4392, test_f1: 0.5951
 epoch: 62, train_loss: 0.6000, test_loss: 1.5148, test_f1: 0.6157
 epoch: 63, train_loss: 0.5722, test_loss: 1.2728, test_f1: 0.6054
 epoch: 64, train_loss: 0.5619, test_loss: 1.1881, test_f1: 0.6434
 epoch: 65, train_loss: 0.5830, test_loss: 1.1603, test_f1: 0.6572
 epoch: 66, train_loss: 0.5551, test_loss: 1.1253, test_f1: 0.6589
 epoch: 67, train_loss: 0.5672, test_loss: 1.3171, test_f1: 0.5849
 epoch: 68, train_loss: 0.5809, test_loss: 1.1977, test_f1: 0.7003
 epoch: 69, train_loss: 0.5607, test_loss: 1.3196, test_f1: 0.5889
 epoch: 70, train_loss: 0.5177, test_loss: 1.1114, test_f1: 0.6410
 epoch: 71, train_loss: 0.5428, test_loss: 1.2354, test_f1: 0.6495
 epoch: 72, train_loss: 0.5367, test_loss: 1.1790, test_f1: 0.6152
 epoch: 73, train_loss: 0.5217, test_loss: 1.0756, test_f1: 0.6800
 epoch: 74, train_loss: 0.5425, test_loss: 1.3277, test_f1: 0.5899
 epoch: 75, train_loss: 0.5210, test_loss: 1.2324, test_f1: 0.6229
 epoch: 76, train_loss: 0.5322, test_loss: 1.3924, test_f1: 0.5506
 epoch: 77, train_loss: 0.5284, test_loss: 1.3578, test_f1: 0.6009
 epoch: 78, train_loss: 0.5375, test_loss: 1.3061, test_f1: 0.6232
 epoch: 79, train_loss: 0.5220, test_loss: 1.3238, test_f1: 0.5931
 epoch: 80, train_loss: 0.5144, test_loss: 1.2468, test_f1: 0.6632
 epoch: 81, train_loss: 0.5045, test_loss: 1.5273, test_f1: 0.5727
 epoch: 82, train_loss: 0.5073, test_loss: 1.1925, test_f1: 0.6235
 epoch: 83, train_loss: 0.5385, test_loss: 1.4671, test_f1: 0.6479
 epoch: 84, train_loss: 0.5138, test_loss: 1.8153, test_f1: 0.5840
 epoch: 85, train_loss: 0.4970, test_loss: 1.2962, test_f1: 0.6322
 epoch: 86, train_loss: 0.5035, test_loss: 1.5502, test_f1: 0.6287
 epoch: 87, train_loss: 0.4857, test_loss: 1.5558, test_f1: 0.5593
 epoch: 88, train_loss: 0.4980, test_loss: 1.3193, test_f1: 0.6362
 epoch: 89, train_loss: 0.4834, test_loss: 1.4773, test_f1: 0.6046
 epoch: 90, train_loss: 0.4886, test_loss: 1.3664, test_f1: 0.6296
 epoch: 91, train_loss: 0.4823, test_loss: 1.4892, test_f1: 0.6117
 epoch: 92, train_loss: 0.4945, test_loss: 1.2644, test_f1: 0.6211
 epoch: 93, train_loss: 0.4717, test_loss: 1.7678, test_f1: 0.5232
 epoch: 94, train_loss: 0.4715, test_loss: 1.6364, test_f1: 0.5922
 epoch: 95, train_loss: 0.4897, test_loss: 1.6175, test_f1: 0.6161
 epoch: 96, train_loss: 0.4875, test_loss: 1.6467, test_f1: 0.6334
 epoch: 97, train_loss: 0.4738, test_loss: 1.4457, test_f1: 0.6028
 epoch: 98, train_loss: 0.4454, test_loss: 1.8662, test_f1: 0.5632
 epoch: 99, train_loss: 0.4528, test_loss: 1.9003, test_f1: 0.5463
##################ITERATION #6 ****************************************
 epoch: 0, train_loss: 1.2200, test_loss: 1.5505, test_f1: 0.2087
 epoch: 1, train_loss: 0.9848, test_loss: 1.3953, test_f1: 0.3492
 epoch: 2, train_loss: 0.8974, test_loss: 1.1418, test_f1: 0.4135
 epoch: 3, train_loss: 0.8654, test_loss: 1.0036, test_f1: 0.5664
 epoch: 4, train_loss: 0.8590, test_loss: 0.9470, test_f1: 0.5691
 epoch: 5, train_loss: 0.8372, test_loss: 1.0152, test_f1: 0.5015
 epoch: 6, train_loss: 0.8136, test_loss: 1.0454, test_f1: 0.4923
 epoch: 7, train_loss: 0.7950, test_loss: 0.9821, test_f1: 0.5833
 epoch: 8, train_loss: 0.7828, test_loss: 1.0550, test_f1: 0.5211
 epoch: 9, train_loss: 0.7715, test_loss: 1.0114, test_f1: 0.5496
 epoch: 10, train_loss: 0.7392, test_loss: 0.9930, test_f1: 0.6043
 epoch: 11, train_loss: 0.7477, test_loss: 1.0176, test_f1: 0.6107
 epoch: 12, train_loss: 0.7580, test_loss: 4.2801, test_f1: 0.2419
 epoch: 13, train_loss: 0.7854, test_loss: 1.0631, test_f1: 0.5727
 epoch: 14, train_loss: 0.7477, test_loss: 1.3163, test_f1: 0.6084
 epoch: 15, train_loss: 0.7671, test_loss: 0.9195, test_f1: 0.6361
 epoch: 16, train_loss: 0.7381, test_loss: 0.9662, test_f1: 0.6405
 epoch: 17, train_loss: 0.7279, test_loss: 1.0731, test_f1: 0.5395
 epoch: 18, train_loss: 0.7221, test_loss: 1.0472, test_f1: 0.5680
 epoch: 19, train_loss: 0.7326, test_loss: 1.0786, test_f1: 0.5626
 epoch: 20, train_loss: 0.7109, test_loss: 0.9283, test_f1: 0.6492
 epoch: 21, train_loss: 0.7139, test_loss: 1.0971, test_f1: 0.6130
 epoch: 22, train_loss: 0.6850, test_loss: 0.9868, test_f1: 0.6013
 epoch: 23, train_loss: 0.6936, test_loss: 1.1343, test_f1: 0.5092
 epoch: 24, train_loss: 0.6669, test_loss: 1.2036, test_f1: 0.5726
 epoch: 25, train_loss: 0.6777, test_loss: 1.0711, test_f1: 0.6205
 epoch: 26, train_loss: 0.6874, test_loss: 0.9785, test_f1: 0.6064
 epoch: 27, train_loss: 0.6454, test_loss: 1.0623, test_f1: 0.6501
 epoch: 28, train_loss: 0.6549, test_loss: 1.2304, test_f1: 0.5192
 epoch: 29, train_loss: 0.7466, test_loss: 0.9703, test_f1: 0.6678
 epoch: 30, train_loss: 0.6802, test_loss: 1.1734, test_f1: 0.5932
 epoch: 31, train_loss: 0.6551, test_loss: 1.0857, test_f1: 0.6362
 epoch: 32, train_loss: 0.6537, test_loss: 1.1027, test_f1: 0.6490
 epoch: 33, train_loss: 0.6582, test_loss: 1.1919, test_f1: 0.5846
 epoch: 34, train_loss: 0.6509, test_loss: 1.1653, test_f1: 0.5694
 epoch: 35, train_loss: 0.6280, test_loss: 1.2578, test_f1: 0.5911
 epoch: 36, train_loss: 0.6211, test_loss: 1.2069, test_f1: 0.6453
 epoch: 37, train_loss: 0.6261, test_loss: 1.3109, test_f1: 0.5763
 epoch: 38, train_loss: 0.6003, test_loss: 1.4293, test_f1: 0.5992
 epoch: 39, train_loss: 0.6008, test_loss: 1.3921, test_f1: 0.5823
 epoch: 40, train_loss: 0.6446, test_loss: 1.2814, test_f1: 0.5838
 epoch: 41, train_loss: 0.6578, test_loss: 1.2258, test_f1: 0.5746
 epoch: 42, train_loss: 0.6149, test_loss: 1.5697, test_f1: 0.5509
 epoch: 43, train_loss: 0.6035, test_loss: 1.3725, test_f1: 0.6324
 epoch: 44, train_loss: 0.6100, test_loss: 1.2087, test_f1: 0.6130
 epoch: 45, train_loss: 0.5925, test_loss: 1.5816, test_f1: 0.5872
 epoch: 46, train_loss: 0.5998, test_loss: 1.4280, test_f1: 0.5568
 epoch: 47, train_loss: 0.5853, test_loss: 1.4076, test_f1: 0.6639
 epoch: 48, train_loss: 0.6103, test_loss: 1.2604, test_f1: 0.6215
 epoch: 49, train_loss: 0.6024, test_loss: 1.2398, test_f1: 0.6137
 epoch: 50, train_loss: 0.5664, test_loss: 1.3150, test_f1: 0.5964
 epoch: 51, train_loss: 0.5712, test_loss: 1.3830, test_f1: 0.6397
 epoch: 52, train_loss: 0.5577, test_loss: 1.2878, test_f1: 0.6499
 epoch: 53, train_loss: 0.5198, test_loss: 1.4707, test_f1: 0.5894
 epoch: 54, train_loss: 0.5167, test_loss: 1.4165, test_f1: 0.6125
 epoch: 55, train_loss: 0.5259, test_loss: 1.2845, test_f1: 0.6545
 epoch: 56, train_loss: 0.5304, test_loss: 1.5873, test_f1: 0.6838
 epoch: 57, train_loss: 0.5078, test_loss: 1.3184, test_f1: 0.6353
 epoch: 58, train_loss: 0.4880, test_loss: 1.5118, test_f1: 0.6401
 epoch: 59, train_loss: 0.4786, test_loss: 1.5472, test_f1: 0.5831
 epoch: 60, train_loss: 0.4600, test_loss: 1.6270, test_f1: 0.6028
 epoch: 61, train_loss: 0.4891, test_loss: 1.5325, test_f1: 0.6325
 epoch: 62, train_loss: 0.4908, test_loss: 1.5173, test_f1: 0.6724
 epoch: 63, train_loss: 0.4492, test_loss: 1.7430, test_f1: 0.5930
 epoch: 64, train_loss: 0.5149, test_loss: 1.4678, test_f1: 0.6270
 epoch: 65, train_loss: 0.5551, test_loss: 1.7416, test_f1: 0.5832
 epoch: 66, train_loss: 0.4958, test_loss: 1.4312, test_f1: 0.6245
 epoch: 67, train_loss: 0.4854, test_loss: 1.4383, test_f1: 0.6657
 epoch: 68, train_loss: 0.4376, test_loss: 1.7195, test_f1: 0.6451
 epoch: 69, train_loss: 0.4586, test_loss: 1.4917, test_f1: 0.6615
 epoch: 70, train_loss: 0.4624, test_loss: 1.8811, test_f1: 0.6110
 epoch: 71, train_loss: 0.4510, test_loss: 1.7526, test_f1: 0.6211
 epoch: 72, train_loss: 0.5258, test_loss: 1.5747, test_f1: 0.6243
 epoch: 73, train_loss: 0.4475, test_loss: 1.6532, test_f1: 0.6034
 epoch: 74, train_loss: 0.4670, test_loss: 1.7541, test_f1: 0.6212
 epoch: 75, train_loss: 0.4382, test_loss: 1.3616, test_f1: 0.6762
 epoch: 76, train_loss: 0.4301, test_loss: 1.5169, test_f1: 0.6347
 epoch: 77, train_loss: 0.4636, test_loss: 1.5053, test_f1: 0.6261
 epoch: 78, train_loss: 0.4805, test_loss: 1.4446, test_f1: 0.6396
 epoch: 79, train_loss: 0.4192, test_loss: 1.5053, test_f1: 0.6108
 epoch: 80, train_loss: 0.4420, test_loss: 1.4162, test_f1: 0.6356
 epoch: 81, train_loss: 0.4305, test_loss: 1.6200, test_f1: 0.6585
 epoch: 82, train_loss: 0.4066, test_loss: 1.9613, test_f1: 0.5936
 epoch: 83, train_loss: 0.4286, test_loss: 1.7466, test_f1: 0.6413
 epoch: 84, train_loss: 0.4174, test_loss: 1.6466, test_f1: 0.5878
 epoch: 85, train_loss: 0.4141, test_loss: 1.8861, test_f1: 0.6362
 epoch: 86, train_loss: 0.4247, test_loss: 1.5564, test_f1: 0.6067
 epoch: 87, train_loss: 0.4167, test_loss: 1.7892, test_f1: 0.6198
 epoch: 88, train_loss: 0.4148, test_loss: 1.6604, test_f1: 0.6225
 epoch: 89, train_loss: 0.3965, test_loss: 1.7087, test_f1: 0.6270
 epoch: 90, train_loss: 0.3959, test_loss: 1.8538, test_f1: 0.5930
 epoch: 91, train_loss: 0.4348, test_loss: 1.5084, test_f1: 0.6600
 epoch: 92, train_loss: 0.4075, test_loss: 1.9279, test_f1: 0.6044
 epoch: 93, train_loss: 0.4031, test_loss: 1.7351, test_f1: 0.6197
 epoch: 94, train_loss: 0.4168, test_loss: 1.5773, test_f1: 0.6039
 epoch: 95, train_loss: 0.3696, test_loss: 1.6063, test_f1: 0.6183
 epoch: 96, train_loss: 0.4099, test_loss: 1.6153, test_f1: 0.6419
 epoch: 97, train_loss: 0.4068, test_loss: 1.6502, test_f1: 0.5814
 epoch: 98, train_loss: 0.4098, test_loss: 1.6357, test_f1: 0.5952
 epoch: 99, train_loss: 0.3973, test_loss: 1.9093, test_f1: 0.6380
##################ITERATION #7 ****************************************
 epoch: 0, train_loss: 1.2786, test_loss: 1.2653, test_f1: 0.3402
 epoch: 1, train_loss: 1.0505, test_loss: 1.1246, test_f1: 0.5168
 epoch: 2, train_loss: 0.9912, test_loss: 1.1777, test_f1: 0.4884
 epoch: 3, train_loss: 0.9413, test_loss: 1.1217, test_f1: 0.4994
 epoch: 4, train_loss: 0.9015, test_loss: 1.0249, test_f1: 0.5646
 epoch: 5, train_loss: 0.8907, test_loss: 0.9389, test_f1: 0.5877
 epoch: 6, train_loss: 0.8769, test_loss: 1.0712, test_f1: 0.5092
 epoch: 7, train_loss: 0.8862, test_loss: 1.0451, test_f1: 0.5393
 epoch: 8, train_loss: 0.8420, test_loss: 1.2533, test_f1: 0.5464
 epoch: 9, train_loss: 0.8555, test_loss: 0.9776, test_f1: 0.5688
 epoch: 10, train_loss: 0.8321, test_loss: 1.2930, test_f1: 0.5117
 epoch: 11, train_loss: 0.8374, test_loss: 1.2051, test_f1: 0.5142
 epoch: 12, train_loss: 0.8066, test_loss: 0.9707, test_f1: 0.5018
 epoch: 13, train_loss: 0.7808, test_loss: 1.1951, test_f1: 0.5185
 epoch: 14, train_loss: 0.8126, test_loss: 1.0162, test_f1: 0.5424
 epoch: 15, train_loss: 0.8160, test_loss: 1.1146, test_f1: 0.5228
 epoch: 16, train_loss: 0.7998, test_loss: 2.0471, test_f1: 0.4817
 epoch: 17, train_loss: 0.7706, test_loss: 0.9897, test_f1: 0.5836
 epoch: 18, train_loss: 0.7339, test_loss: 0.9085, test_f1: 0.6413
 epoch: 19, train_loss: 0.7548, test_loss: 1.8256, test_f1: 0.4625
 epoch: 20, train_loss: 0.7295, test_loss: 1.0003, test_f1: 0.6094
 epoch: 21, train_loss: 0.7172, test_loss: 1.1724, test_f1: 0.6478
 epoch: 22, train_loss: 0.7314, test_loss: 1.3526, test_f1: 0.4920
 epoch: 23, train_loss: 0.6989, test_loss: 1.1511, test_f1: 0.5521
 epoch: 24, train_loss: 0.7344, test_loss: 1.2297, test_f1: 0.5674
 epoch: 25, train_loss: 0.7111, test_loss: 1.5593, test_f1: 0.5240
 epoch: 26, train_loss: 0.7096, test_loss: 1.2273, test_f1: 0.6017
 epoch: 27, train_loss: 0.7225, test_loss: 1.0185, test_f1: 0.6130
 epoch: 28, train_loss: 0.6977, test_loss: 1.1686, test_f1: 0.5180
 epoch: 29, train_loss: 0.6855, test_loss: 1.1272, test_f1: 0.5856
 epoch: 30, train_loss: 0.7311, test_loss: 1.1960, test_f1: 0.5436
 epoch: 31, train_loss: 0.7109, test_loss: 1.0042, test_f1: 0.5975
 epoch: 32, train_loss: 0.6960, test_loss: 1.1590, test_f1: 0.5661
 epoch: 33, train_loss: 0.6699, test_loss: 1.1356, test_f1: 0.5942
 epoch: 34, train_loss: 0.6949, test_loss: 1.4434, test_f1: 0.5485
 epoch: 35, train_loss: 0.6867, test_loss: 1.0145, test_f1: 0.6008
 epoch: 36, train_loss: 0.6511, test_loss: 1.1546, test_f1: 0.5555
 epoch: 37, train_loss: 0.6570, test_loss: 1.3047, test_f1: 0.5813
 epoch: 38, train_loss: 0.6957, test_loss: 1.2826, test_f1: 0.5510
 epoch: 39, train_loss: 0.6861, test_loss: 1.4893, test_f1: 0.5491
 epoch: 40, train_loss: 0.6754, test_loss: 1.0815, test_f1: 0.6086
 epoch: 41, train_loss: 0.6812, test_loss: 1.1396, test_f1: 0.6162
 epoch: 42, train_loss: 0.6619, test_loss: 0.9962, test_f1: 0.6126
 epoch: 43, train_loss: 0.6431, test_loss: 1.1083, test_f1: 0.5367
 epoch: 44, train_loss: 0.6745, test_loss: 1.0176, test_f1: 0.5786
 epoch: 45, train_loss: 0.6555, test_loss: 0.9612, test_f1: 0.6034
 epoch: 46, train_loss: 0.6330, test_loss: 1.1732, test_f1: 0.5993
 epoch: 47, train_loss: 0.6447, test_loss: 0.9840, test_f1: 0.6005
 epoch: 48, train_loss: 0.6362, test_loss: 1.2457, test_f1: 0.5801
 epoch: 49, train_loss: 0.6971, test_loss: 1.1008, test_f1: 0.5659
 epoch: 50, train_loss: 0.6924, test_loss: 1.4651, test_f1: 0.4726
 epoch: 51, train_loss: 0.6663, test_loss: 1.0790, test_f1: 0.5829
 epoch: 52, train_loss: 0.6304, test_loss: 1.1097, test_f1: 0.6323
 epoch: 53, train_loss: 0.6234, test_loss: 1.1258, test_f1: 0.6292
 epoch: 54, train_loss: 0.5937, test_loss: 1.1186, test_f1: 0.6648
 epoch: 55, train_loss: 0.5892, test_loss: 1.1830, test_f1: 0.6102
 epoch: 56, train_loss: 0.5929, test_loss: 1.2588, test_f1: 0.6381
 epoch: 57, train_loss: 0.5611, test_loss: 1.1220, test_f1: 0.6369
 epoch: 58, train_loss: 0.5799, test_loss: 1.2555, test_f1: 0.6367
 epoch: 59, train_loss: 0.5862, test_loss: 1.1390, test_f1: 0.6577
 epoch: 60, train_loss: 0.5856, test_loss: 1.1694, test_f1: 0.5976
 epoch: 61, train_loss: 0.5676, test_loss: 1.2893, test_f1: 0.6098
 epoch: 62, train_loss: 0.5416, test_loss: 1.1369, test_f1: 0.6461
 epoch: 63, train_loss: 0.5483, test_loss: 1.2036, test_f1: 0.6535
 epoch: 64, train_loss: 0.5681, test_loss: 1.1733, test_f1: 0.6198
 epoch: 65, train_loss: 0.5729, test_loss: 1.2728, test_f1: 0.6317
 epoch: 66, train_loss: 0.5580, test_loss: 1.2432, test_f1: 0.6523
 epoch: 67, train_loss: 0.5385, test_loss: 1.2936, test_f1: 0.6391
 epoch: 68, train_loss: 0.5281, test_loss: 1.2779, test_f1: 0.6297
 epoch: 69, train_loss: 0.5500, test_loss: 1.1087, test_f1: 0.6052
 epoch: 70, train_loss: 0.5297, test_loss: 1.3946, test_f1: 0.6336
 epoch: 71, train_loss: 0.5153, test_loss: 1.3503, test_f1: 0.6368
 epoch: 72, train_loss: 0.5311, test_loss: 1.2852, test_f1: 0.6313
 epoch: 73, train_loss: 0.5260, test_loss: 1.3292, test_f1: 0.6247
 epoch: 74, train_loss: 0.5230, test_loss: 1.2209, test_f1: 0.6118
 epoch: 75, train_loss: 0.5013, test_loss: 1.2623, test_f1: 0.6720
 epoch: 76, train_loss: 0.5237, test_loss: 1.6372, test_f1: 0.5087
 epoch: 77, train_loss: 0.5306, test_loss: 1.2383, test_f1: 0.6182
 epoch: 78, train_loss: 0.5276, test_loss: 1.4169, test_f1: 0.5996
 epoch: 79, train_loss: 0.5264, test_loss: 1.4727, test_f1: 0.6143
 epoch: 80, train_loss: 0.5073, test_loss: 1.3457, test_f1: 0.6581
 epoch: 81, train_loss: 0.5281, test_loss: 1.1991, test_f1: 0.6453
 epoch: 82, train_loss: 0.5015, test_loss: 1.3603, test_f1: 0.6298
 epoch: 83, train_loss: 0.4995, test_loss: 1.3533, test_f1: 0.5947
 epoch: 84, train_loss: 0.4723, test_loss: 1.1803, test_f1: 0.6708
 epoch: 85, train_loss: 0.4868, test_loss: 1.3117, test_f1: 0.6387
 epoch: 86, train_loss: 0.4801, test_loss: 1.3774, test_f1: 0.6031
 epoch: 87, train_loss: 0.5319, test_loss: 1.2811, test_f1: 0.6533
 epoch: 88, train_loss: 0.4904, test_loss: 1.4395, test_f1: 0.6396
 epoch: 89, train_loss: 0.4784, test_loss: 1.4088, test_f1: 0.6561
 epoch: 90, train_loss: 0.4504, test_loss: 1.4052, test_f1: 0.6470
 epoch: 91, train_loss: 0.4953, test_loss: 1.5117, test_f1: 0.6494
 epoch: 92, train_loss: 0.5053, test_loss: 1.4412, test_f1: 0.5925
 epoch: 93, train_loss: 0.5355, test_loss: 1.2433, test_f1: 0.6392
 epoch: 94, train_loss: 0.4766, test_loss: 1.3267, test_f1: 0.6459
 epoch: 95, train_loss: 0.4764, test_loss: 1.5421, test_f1: 0.6268
 epoch: 96, train_loss: 0.4798, test_loss: 1.4069, test_f1: 0.6376
 epoch: 97, train_loss: 0.4659, test_loss: 1.5046, test_f1: 0.6233
 epoch: 98, train_loss: 0.4638, test_loss: 1.3883, test_f1: 0.6137
 epoch: 99, train_loss: 0.4585, test_loss: 1.3689, test_f1: 0.6620
##################ITERATION #8 ****************************************
 epoch: 0, train_loss: 1.1974, test_loss: 1.2123, test_f1: 0.2797
 epoch: 1, train_loss: 1.0269, test_loss: 1.0496, test_f1: 0.4774
 epoch: 2, train_loss: 0.9690, test_loss: 1.0768, test_f1: 0.5271
 epoch: 3, train_loss: 0.9355, test_loss: 1.3467, test_f1: 0.3938
 epoch: 4, train_loss: 0.8990, test_loss: 1.0163, test_f1: 0.5002
 epoch: 5, train_loss: 0.8782, test_loss: 1.0117, test_f1: 0.5730
 epoch: 6, train_loss: 0.8627, test_loss: 1.2388, test_f1: 0.4724
 epoch: 7, train_loss: 0.8423, test_loss: 1.0084, test_f1: 0.6104
 epoch: 8, train_loss: 0.8309, test_loss: 1.2005, test_f1: 0.4980
 epoch: 9, train_loss: 0.8253, test_loss: 0.9452, test_f1: 0.5729
 epoch: 10, train_loss: 0.7847, test_loss: 0.9479, test_f1: 0.5875
 epoch: 11, train_loss: 0.7976, test_loss: 1.2100, test_f1: 0.4604
 epoch: 12, train_loss: 0.7926, test_loss: 1.0257, test_f1: 0.5837
 epoch: 13, train_loss: 0.7826, test_loss: 1.0928, test_f1: 0.5442
 epoch: 14, train_loss: 0.7835, test_loss: 1.0040, test_f1: 0.5586
 epoch: 15, train_loss: 0.7456, test_loss: 0.9540, test_f1: 0.6116
 epoch: 16, train_loss: 0.7369, test_loss: 1.0584, test_f1: 0.5332
 epoch: 17, train_loss: 0.7562, test_loss: 1.9062, test_f1: 0.4378
 epoch: 18, train_loss: 0.7740, test_loss: 1.1422, test_f1: 0.5526
 epoch: 19, train_loss: 0.7244, test_loss: 1.2933, test_f1: 0.5426
 epoch: 20, train_loss: 0.7364, test_loss: 1.0666, test_f1: 0.5549
 epoch: 21, train_loss: 0.7348, test_loss: 1.0412, test_f1: 0.5498
 epoch: 22, train_loss: 0.7208, test_loss: 1.1225, test_f1: 0.5501
 epoch: 23, train_loss: 0.7257, test_loss: 1.0097, test_f1: 0.5755
 epoch: 24, train_loss: 0.7209, test_loss: 1.0147, test_f1: 0.5321
 epoch: 25, train_loss: 0.7377, test_loss: 1.1085, test_f1: 0.5878
 epoch: 26, train_loss: 0.6907, test_loss: 0.9131, test_f1: 0.6500
 epoch: 27, train_loss: 0.6857, test_loss: 1.3563, test_f1: 0.5094
 epoch: 28, train_loss: 0.7014, test_loss: 1.1008, test_f1: 0.5647
 epoch: 29, train_loss: 0.6973, test_loss: 3.1215, test_f1: 0.3949
 epoch: 30, train_loss: 0.7196, test_loss: 1.1448, test_f1: 0.5253
 epoch: 31, train_loss: 0.6779, test_loss: 1.0947, test_f1: 0.5666
 epoch: 32, train_loss: 0.7042, test_loss: 1.0185, test_f1: 0.5710
 epoch: 33, train_loss: 0.6703, test_loss: 0.9992, test_f1: 0.5648
 epoch: 34, train_loss: 0.6930, test_loss: 1.0308, test_f1: 0.5941
 epoch: 35, train_loss: 0.6667, test_loss: 1.0221, test_f1: 0.5622
 epoch: 36, train_loss: 0.6610, test_loss: 1.1569, test_f1: 0.5503
 epoch: 37, train_loss: 0.6789, test_loss: 0.8907, test_f1: 0.6530
 epoch: 38, train_loss: 0.6925, test_loss: 1.0109, test_f1: 0.5780
 epoch: 39, train_loss: 0.6928, test_loss: 0.9214, test_f1: 0.6425
 epoch: 40, train_loss: 0.6654, test_loss: 1.0635, test_f1: 0.5753
 epoch: 41, train_loss: 0.6536, test_loss: 0.9461, test_f1: 0.6329
 epoch: 42, train_loss: 0.6693, test_loss: 1.0356, test_f1: 0.5875
 epoch: 43, train_loss: 0.6315, test_loss: 0.9334, test_f1: 0.6500
 epoch: 44, train_loss: 0.6143, test_loss: 0.9409, test_f1: 0.6734
 epoch: 45, train_loss: 0.6312, test_loss: 1.0742, test_f1: 0.6046
 epoch: 46, train_loss: 0.6279, test_loss: 0.9937, test_f1: 0.5793
 epoch: 47, train_loss: 0.6328, test_loss: 1.0695, test_f1: 0.5711
 epoch: 48, train_loss: 0.6147, test_loss: 1.1929, test_f1: 0.5621
 epoch: 49, train_loss: 0.6340, test_loss: 1.2467, test_f1: 0.5549
 epoch: 50, train_loss: 0.6369, test_loss: 0.9413, test_f1: 0.5883
 epoch: 51, train_loss: 0.6168, test_loss: 0.9255, test_f1: 0.6330
 epoch: 52, train_loss: 0.5755, test_loss: 1.0371, test_f1: 0.6119
 epoch: 53, train_loss: 0.5786, test_loss: 1.1459, test_f1: 0.5649
 epoch: 54, train_loss: 0.5886, test_loss: 0.9870, test_f1: 0.6299
 epoch: 55, train_loss: 0.5711, test_loss: 1.0503, test_f1: 0.6047
 epoch: 56, train_loss: 0.5439, test_loss: 0.9745, test_f1: 0.6482
 epoch: 57, train_loss: 0.5312, test_loss: 0.9907, test_f1: 0.6411
 epoch: 58, train_loss: 0.5359, test_loss: 1.0083, test_f1: 0.6483
 epoch: 59, train_loss: 0.5340, test_loss: 0.9940, test_f1: 0.6488
 epoch: 60, train_loss: 0.5165, test_loss: 1.0996, test_f1: 0.5693
 epoch: 61, train_loss: 0.5693, test_loss: 1.1101, test_f1: 0.5779
 epoch: 62, train_loss: 0.5133, test_loss: 1.1375, test_f1: 0.6187
 epoch: 63, train_loss: 0.5141, test_loss: 1.0465, test_f1: 0.6507
 epoch: 64, train_loss: 0.5007, test_loss: 1.2695, test_f1: 0.6074
 epoch: 65, train_loss: 0.5120, test_loss: 1.1571, test_f1: 0.6139
 epoch: 66, train_loss: 0.4828, test_loss: 1.3983, test_f1: 0.5819
 epoch: 67, train_loss: 0.5108, test_loss: 1.1118, test_f1: 0.6219
 epoch: 68, train_loss: 0.5040, test_loss: 1.2290, test_f1: 0.6029
 epoch: 69, train_loss: 0.4947, test_loss: 1.1862, test_f1: 0.6194
 epoch: 70, train_loss: 0.4885, test_loss: 1.2468, test_f1: 0.5963
 epoch: 71, train_loss: 0.4859, test_loss: 1.4560, test_f1: 0.5618
 epoch: 72, train_loss: 0.4898, test_loss: 1.2461, test_f1: 0.6351
 epoch: 73, train_loss: 0.4707, test_loss: 1.3774, test_f1: 0.6059
 epoch: 74, train_loss: 0.4866, test_loss: 1.2696, test_f1: 0.6734
 epoch: 75, train_loss: 0.4822, test_loss: 1.1824, test_f1: 0.6358
 epoch: 76, train_loss: 0.4745, test_loss: 1.4886, test_f1: 0.5540
 epoch: 77, train_loss: 0.4859, test_loss: 1.2873, test_f1: 0.6296
 epoch: 78, train_loss: 0.5001, test_loss: 1.1887, test_f1: 0.5906
 epoch: 79, train_loss: 0.4918, test_loss: 1.3016, test_f1: 0.6301
 epoch: 80, train_loss: 0.4707, test_loss: 1.2560, test_f1: 0.6144
 epoch: 81, train_loss: 0.4424, test_loss: 1.2799, test_f1: 0.6181
 epoch: 82, train_loss: 0.4368, test_loss: 1.4957, test_f1: 0.5904
 epoch: 83, train_loss: 0.4626, test_loss: 1.2191, test_f1: 0.6341
 epoch: 84, train_loss: 0.4514, test_loss: 1.2842, test_f1: 0.5453
 epoch: 85, train_loss: 0.4748, test_loss: 1.1674, test_f1: 0.6792
 epoch: 86, train_loss: 0.4638, test_loss: 1.6648, test_f1: 0.6001
 epoch: 87, train_loss: 0.4805, test_loss: 1.3445, test_f1: 0.6158
 epoch: 88, train_loss: 0.4457, test_loss: 1.3352, test_f1: 0.6082
 epoch: 89, train_loss: 0.4510, test_loss: 1.5183, test_f1: 0.6471
 epoch: 90, train_loss: 0.4853, test_loss: 1.2670, test_f1: 0.6629
 epoch: 91, train_loss: 0.4308, test_loss: 1.3919, test_f1: 0.6300
 epoch: 92, train_loss: 0.4314, test_loss: 1.3574, test_f1: 0.6191
 epoch: 93, train_loss: 0.4117, test_loss: 1.6074, test_f1: 0.5922
 epoch: 94, train_loss: 0.4124, test_loss: 1.4265, test_f1: 0.6133
 epoch: 95, train_loss: 0.4034, test_loss: 1.5375, test_f1: 0.6174
 epoch: 96, train_loss: 0.4047, test_loss: 1.4491, test_f1: 0.6413
 epoch: 97, train_loss: 0.3888, test_loss: 1.7009, test_f1: 0.5992
 epoch: 98, train_loss: 0.4385, test_loss: 2.1380, test_f1: 0.5994
 epoch: 99, train_loss: 0.4377, test_loss: 1.2180, test_f1: 0.6781
##################ITERATION #9 ****************************************
 epoch: 0, train_loss: 1.2171, test_loss: 1.4664, test_f1: 0.1584
 epoch: 1, train_loss: 0.9515, test_loss: 1.6811, test_f1: 0.2056
 epoch: 2, train_loss: 0.8936, test_loss: 1.2693, test_f1: 0.3849
 epoch: 3, train_loss: 0.8850, test_loss: 1.0326, test_f1: 0.5455
 epoch: 4, train_loss: 0.8725, test_loss: 1.0964, test_f1: 0.4714
 epoch: 5, train_loss: 0.8129, test_loss: 1.0185, test_f1: 0.5015
 epoch: 6, train_loss: 0.8256, test_loss: 1.1029, test_f1: 0.4744
 epoch: 7, train_loss: 0.8095, test_loss: 0.9755, test_f1: 0.5163
 epoch: 8, train_loss: 0.7940, test_loss: 1.0772, test_f1: 0.5387
 epoch: 9, train_loss: 0.7874, test_loss: 1.0327, test_f1: 0.4779
 epoch: 10, train_loss: 0.7945, test_loss: 1.2393, test_f1: 0.4349
 epoch: 11, train_loss: 0.7768, test_loss: 1.1478, test_f1: 0.5170
 epoch: 12, train_loss: 0.7573, test_loss: 1.0289, test_f1: 0.5310
 epoch: 13, train_loss: 0.7470, test_loss: 0.9956, test_f1: 0.5216
 epoch: 14, train_loss: 0.7914, test_loss: 1.8014, test_f1: 0.3377
 epoch: 15, train_loss: 0.7508, test_loss: 1.0268, test_f1: 0.5960
 epoch: 16, train_loss: 0.7477, test_loss: 1.0865, test_f1: 0.5248
 epoch: 17, train_loss: 0.8297, test_loss: 1.0050, test_f1: 0.5659
 epoch: 18, train_loss: 0.8084, test_loss: 1.0425, test_f1: 0.5569
 epoch: 19, train_loss: 0.7676, test_loss: 0.9866, test_f1: 0.5958
 epoch: 20, train_loss: 0.7416, test_loss: 0.8900, test_f1: 0.6442
 epoch: 21, train_loss: 0.7261, test_loss: 0.9759, test_f1: 0.5715
 epoch: 22, train_loss: 0.7191, test_loss: 1.1851, test_f1: 0.4461
 epoch: 23, train_loss: 0.7276, test_loss: 1.7985, test_f1: 0.4100
 epoch: 24, train_loss: 0.7624, test_loss: 1.0953, test_f1: 0.5952
 epoch: 25, train_loss: 0.7315, test_loss: 0.9126, test_f1: 0.6209
 epoch: 26, train_loss: 0.7026, test_loss: 1.0417, test_f1: 0.5645
 epoch: 27, train_loss: 0.7162, test_loss: 1.4452, test_f1: 0.6011
 epoch: 28, train_loss: 0.7077, test_loss: 1.0108, test_f1: 0.5937
 epoch: 29, train_loss: 0.6820, test_loss: 1.0868, test_f1: 0.5462
 epoch: 30, train_loss: 0.6714, test_loss: 1.2806, test_f1: 0.6044
 epoch: 31, train_loss: 0.6605, test_loss: 1.1697, test_f1: 0.5566
 epoch: 32, train_loss: 0.6818, test_loss: 1.0601, test_f1: 0.6158
 epoch: 33, train_loss: 0.6743, test_loss: 1.0387, test_f1: 0.5763
 epoch: 34, train_loss: 0.6594, test_loss: 1.2550, test_f1: 0.5724
 epoch: 35, train_loss: 0.6663, test_loss: 1.0346, test_f1: 0.6372
 epoch: 36, train_loss: 0.6812, test_loss: 1.0162, test_f1: 0.6404
 epoch: 37, train_loss: 0.6266, test_loss: 1.2086, test_f1: 0.5947
 epoch: 38, train_loss: 0.6783, test_loss: 0.9511, test_f1: 0.6351
 epoch: 39, train_loss: 0.6724, test_loss: 1.4056, test_f1: 0.5919
 epoch: 40, train_loss: 0.6690, test_loss: 1.0722, test_f1: 0.6338
 epoch: 41, train_loss: 0.6592, test_loss: 1.0472, test_f1: 0.5899
 epoch: 42, train_loss: 0.6423, test_loss: 1.1302, test_f1: 0.5893
 epoch: 43, train_loss: 0.6352, test_loss: 1.1130, test_f1: 0.6046
 epoch: 44, train_loss: 0.6346, test_loss: 1.0199, test_f1: 0.6125
 epoch: 45, train_loss: 0.6293, test_loss: 1.1124, test_f1: 0.6516
 epoch: 46, train_loss: 0.6197, test_loss: 1.0861, test_f1: 0.6724
 epoch: 47, train_loss: 0.6094, test_loss: 1.2673, test_f1: 0.6496
 epoch: 48, train_loss: 0.6051, test_loss: 1.2163, test_f1: 0.6464
 epoch: 49, train_loss: 0.6054, test_loss: 1.2366, test_f1: 0.6298
 epoch: 50, train_loss: 0.5856, test_loss: 1.1590, test_f1: 0.6404
 epoch: 51, train_loss: 0.5756, test_loss: 1.2733, test_f1: 0.6266
 epoch: 52, train_loss: 0.5442, test_loss: 1.0782, test_f1: 0.6841
 epoch: 53, train_loss: 0.5655, test_loss: 1.1499, test_f1: 0.6488
 epoch: 54, train_loss: 0.5292, test_loss: 1.2397, test_f1: 0.6610
 epoch: 55, train_loss: 0.5282, test_loss: 1.2436, test_f1: 0.6487
 epoch: 56, train_loss: 0.5310, test_loss: 1.2622, test_f1: 0.6841
 epoch: 57, train_loss: 0.5189, test_loss: 1.4133, test_f1: 0.6441
 epoch: 58, train_loss: 0.4946, test_loss: 1.3726, test_f1: 0.6041
 epoch: 59, train_loss: 0.5471, test_loss: 1.2649, test_f1: 0.6322
 epoch: 60, train_loss: 0.5277, test_loss: 1.4970, test_f1: 0.6152
 epoch: 61, train_loss: 0.5048, test_loss: 1.3234, test_f1: 0.6528
 epoch: 62, train_loss: 0.5398, test_loss: 1.2819, test_f1: 0.6496
 epoch: 63, train_loss: 0.4957, test_loss: 1.3358, test_f1: 0.6163
 epoch: 64, train_loss: 0.4715, test_loss: 1.3770, test_f1: 0.6644
 epoch: 65, train_loss: 0.4766, test_loss: 1.2398, test_f1: 0.6235
 epoch: 66, train_loss: 0.4929, test_loss: 1.3562, test_f1: 0.6422
 epoch: 67, train_loss: 0.4815, test_loss: 1.6643, test_f1: 0.6001
 epoch: 68, train_loss: 0.4907, test_loss: 1.3790, test_f1: 0.6415
 epoch: 69, train_loss: 0.4935, test_loss: 1.4714, test_f1: 0.6101
 epoch: 70, train_loss: 0.4724, test_loss: 1.8551, test_f1: 0.6383
 epoch: 71, train_loss: 0.4699, test_loss: 1.3825, test_f1: 0.6333
 epoch: 72, train_loss: 0.5103, test_loss: 1.0742, test_f1: 0.6830
 epoch: 73, train_loss: 0.4525, test_loss: 1.3954, test_f1: 0.5938
 epoch: 74, train_loss: 0.4513, test_loss: 1.8975, test_f1: 0.5485
 epoch: 75, train_loss: 0.4547, test_loss: 1.6955, test_f1: 0.5996
 epoch: 76, train_loss: 0.4539, test_loss: 1.3904, test_f1: 0.6650
 epoch: 77, train_loss: 0.4415, test_loss: 1.6903, test_f1: 0.6347
 epoch: 78, train_loss: 0.4313, test_loss: 1.6176, test_f1: 0.6067
 epoch: 79, train_loss: 0.4663, test_loss: 1.5447, test_f1: 0.6400
 epoch: 80, train_loss: 0.4545, test_loss: 1.5369, test_f1: 0.5742
 epoch: 81, train_loss: 0.4667, test_loss: 1.5514, test_f1: 0.6109
 epoch: 82, train_loss: 0.4534, test_loss: 1.5056, test_f1: 0.6012
 epoch: 83, train_loss: 0.4199, test_loss: 1.4486, test_f1: 0.6516
 epoch: 84, train_loss: 0.4181, test_loss: 1.6152, test_f1: 0.6208
 epoch: 85, train_loss: 0.4184, test_loss: 1.7194, test_f1: 0.6338
 epoch: 86, train_loss: 0.4243, test_loss: 1.2855, test_f1: 0.6533
 epoch: 87, train_loss: 0.4604, test_loss: 1.2486, test_f1: 0.6426
 epoch: 88, train_loss: 0.4280, test_loss: 1.5089, test_f1: 0.6134
 epoch: 89, train_loss: 0.3882, test_loss: 1.6078, test_f1: 0.6681
 epoch: 90, train_loss: 0.4019, test_loss: 1.4991, test_f1: 0.6334
 epoch: 91, train_loss: 0.4273, test_loss: 1.4205, test_f1: 0.6663
 epoch: 92, train_loss: 0.4133, test_loss: 1.5165, test_f1: 0.6136
 epoch: 93, train_loss: 0.3895, test_loss: 1.8175, test_f1: 0.6040
 epoch: 94, train_loss: 0.3852, test_loss: 1.9760, test_f1: 0.6354
 epoch: 95, train_loss: 0.3842, test_loss: 1.5765, test_f1: 0.6439
 epoch: 96, train_loss: 0.3763, test_loss: 1.7355, test_f1: 0.6789
 epoch: 97, train_loss: 0.3903, test_loss: 1.6560, test_f1: 0.6241
 epoch: 98, train_loss: 0.3767, test_loss: 1.8479, test_f1: 0.6516
 epoch: 99, train_loss: 0.3918, test_loss: 2.0426, test_f1: 0.6105

Training completed in 534.27 seconds
Best F1: 0.7003 at epoch 68
Mean F1 across iterations: 0.6782  0.0160
========================FINAL RESULTS================================
FEGIN weighted F1: 0.7003  0.0160
python main.py --data ltspice_demos --representation component_pin --model FEGIN --layers 6 --hiddens 32 --batch_size 64 --lr 0.01 --emb_size 250 --epochs 100 --save_appendix component_pin_L6_H32_BS64_LR0.01_E250 --no_val
-----



STDERR:
  File "main.py", line 370, in <module>
    main()
  File "main.py", line 254, in main
    dataset = dataset_class(
  File "/home/philip/projects/ltspice_examples_code_repo/Circuit-Completion-Using-GNNs/component_classification_with_link_prediction_head/evaluation/FEGIN/kernel/circuit_datasets.py", line 15, in __init__
    self.data, self.slices = torch.load(self.processed_paths[0])
  File "/home/philip/.local/lib/python3.8/site-packages/torch/serialization.py", line 1040, in load
    warnings.warn(
  File "/usr/lib/python3.8/warnings.py", line 109, in _showwarnmsg
    sw(msg.message, msg.category, msg.filename, msg.lineno,
  File "main.py", line 47, in warn_with_traceback
    traceback.print_stack(file=log)
/home/philip/projects/ltspice_examples_code_repo/Circuit-Completion-Using-GNNs/component_classification_with_link_prediction_head/evaluation/FEGIN/kernel/circuit_datasets.py:15: FutureWarning: You are using `torch.load` with `weights_only=False` (the current default value), which uses the default pickle module implicitly. It is possible to construct malicious pickle data which will execute arbitrary code during unpickling (See https://github.com/pytorch/pytorch/blob/main/SECURITY.md#untrusted-models for more details). In a future release, the default value for `weights_only` will be flipped to `True`. This limits the functions that could be executed during unpickling. Arbitrary objects will no longer be allowed to be loaded via this mode unless they are explicitly allowlisted by the user via `torch.serialization.add_safe_globals`. We recommend you start setting `weights_only=True` for any use case where you don't have full control of the loaded file. Please open an issue on GitHub for any issues related to this experimental feature.
  self.data, self.slices = torch.load(self.processed_paths[0])
