STDOUT:
Results will be saved in /home/philip/projects/llm_inference_code_repo/Circuit-Completion-Using-GNNs/component_classification_with_link_prediction_head/evaluation/FEGIN/results/model_FEGIN_dataset_ltspice_examples
Command line input: python main.py --data ltspice_examples --representation component_pin_net --model FEGIN --layers 4 --hiddens 32 --batch_size 64 --lr 0.001 --emb_size 512 --epochs 100 --save_appendix component_pin_net_L4_H32_BS64_LR0.001_E512 --no_val
 is saved.
-----
ltspice_examples - FEGIN
Using 4 layers, 32 hidden units, h = 2
Loading component_pin_net representation dataset
ENTERED
Training FEGIN on component_pin_net representation
Train: 3558, Test: 846
##################ITERATION #0 ****************************************
 epoch: 0, train_loss: 1.2720, test_loss: 1.1736, test_f1: 0.3154
 epoch: 1, train_loss: 1.0902, test_loss: 1.0389, test_f1: 0.3810
 epoch: 2, train_loss: 1.0535, test_loss: 1.0205, test_f1: 0.4194
 epoch: 3, train_loss: 1.0251, test_loss: 1.0118, test_f1: 0.3966
 epoch: 4, train_loss: 1.0027, test_loss: 0.9615, test_f1: 0.4620
 epoch: 5, train_loss: 0.9838, test_loss: 0.9304, test_f1: 0.5169
 epoch: 6, train_loss: 0.9616, test_loss: 0.9190, test_f1: 0.5049
 epoch: 7, train_loss: 0.9373, test_loss: 0.9026, test_f1: 0.5210
 epoch: 8, train_loss: 0.9187, test_loss: 0.8945, test_f1: 0.5010
 epoch: 9, train_loss: 0.9073, test_loss: 0.8714, test_f1: 0.5443
 epoch: 10, train_loss: 0.8961, test_loss: 0.8950, test_f1: 0.5356
 epoch: 11, train_loss: 0.8905, test_loss: 0.8552, test_f1: 0.5430
 epoch: 12, train_loss: 0.8700, test_loss: 0.8662, test_f1: 0.5322
 epoch: 13, train_loss: 0.8632, test_loss: 0.8493, test_f1: 0.5641
 epoch: 14, train_loss: 0.8493, test_loss: 0.8500, test_f1: 0.5695
 epoch: 15, train_loss: 0.8498, test_loss: 0.8456, test_f1: 0.5540
 epoch: 16, train_loss: 0.8345, test_loss: 0.8290, test_f1: 0.5797
 epoch: 17, train_loss: 0.8179, test_loss: 0.8110, test_f1: 0.6026
 epoch: 18, train_loss: 0.8124, test_loss: 0.8038, test_f1: 0.5448
 epoch: 19, train_loss: 0.8011, test_loss: 0.9274, test_f1: 0.5269
 epoch: 20, train_loss: 0.8009, test_loss: 0.8076, test_f1: 0.5780
 epoch: 21, train_loss: 0.7864, test_loss: 0.8711, test_f1: 0.5647
 epoch: 22, train_loss: 0.7762, test_loss: 0.7927, test_f1: 0.6006
 epoch: 23, train_loss: 0.7854, test_loss: 0.8588, test_f1: 0.5754
 epoch: 24, train_loss: 0.7644, test_loss: 0.7966, test_f1: 0.5802
 epoch: 25, train_loss: 0.7643, test_loss: 0.8112, test_f1: 0.6167
 epoch: 26, train_loss: 0.7698, test_loss: 0.8043, test_f1: 0.5927
 epoch: 27, train_loss: 0.7436, test_loss: 0.8581, test_f1: 0.5605
 epoch: 28, train_loss: 0.7548, test_loss: 0.8082, test_f1: 0.6378
 epoch: 29, train_loss: 0.7267, test_loss: 0.7931, test_f1: 0.6273
 epoch: 30, train_loss: 0.7223, test_loss: 0.8307, test_f1: 0.5853
 epoch: 31, train_loss: 0.7097, test_loss: 0.8278, test_f1: 0.5913
 epoch: 32, train_loss: 0.7279, test_loss: 0.8673, test_f1: 0.6140
 epoch: 33, train_loss: 0.7184, test_loss: 0.7761, test_f1: 0.6437
 epoch: 34, train_loss: 0.6966, test_loss: 0.9155, test_f1: 0.5591
 epoch: 35, train_loss: 0.6935, test_loss: 0.8405, test_f1: 0.6436
 epoch: 36, train_loss: 0.6898, test_loss: 0.9312, test_f1: 0.6045
 epoch: 37, train_loss: 0.7033, test_loss: 0.8886, test_f1: 0.5916
 epoch: 38, train_loss: 0.6805, test_loss: 0.8280, test_f1: 0.6043
 epoch: 39, train_loss: 0.6718, test_loss: 0.8446, test_f1: 0.6320
 epoch: 40, train_loss: 0.6659, test_loss: 0.8237, test_f1: 0.6198
 epoch: 41, train_loss: 0.6619, test_loss: 0.9024, test_f1: 0.5713
 epoch: 42, train_loss: 0.6677, test_loss: 0.8485, test_f1: 0.6320
 epoch: 43, train_loss: 0.6582, test_loss: 0.7778, test_f1: 0.6232
 epoch: 44, train_loss: 0.6683, test_loss: 0.9180, test_f1: 0.5979
 epoch: 45, train_loss: 0.6515, test_loss: 0.7994, test_f1: 0.6271
 epoch: 46, train_loss: 0.6281, test_loss: 0.8596, test_f1: 0.6146
 epoch: 47, train_loss: 0.6335, test_loss: 0.9677, test_f1: 0.5984
 epoch: 48, train_loss: 0.6254, test_loss: 0.9546, test_f1: 0.6015
 epoch: 49, train_loss: 0.6225, test_loss: 0.8251, test_f1: 0.6369
 epoch: 50, train_loss: 0.6468, test_loss: 0.9853, test_f1: 0.5794
 epoch: 51, train_loss: 0.6231, test_loss: 0.9022, test_f1: 0.6197
 epoch: 52, train_loss: 0.5868, test_loss: 0.8837, test_f1: 0.6256
 epoch: 53, train_loss: 0.5734, test_loss: 0.8598, test_f1: 0.6392
 epoch: 54, train_loss: 0.5803, test_loss: 0.9082, test_f1: 0.6330
 epoch: 55, train_loss: 0.5675, test_loss: 0.9875, test_f1: 0.6175
 epoch: 56, train_loss: 0.5707, test_loss: 0.9801, test_f1: 0.6179
 epoch: 57, train_loss: 0.5781, test_loss: 0.9893, test_f1: 0.6144
 epoch: 58, train_loss: 0.5758, test_loss: 0.9516, test_f1: 0.6293
 epoch: 59, train_loss: 0.5725, test_loss: 0.9541, test_f1: 0.6308
 epoch: 60, train_loss: 0.5516, test_loss: 0.9933, test_f1: 0.6224
 epoch: 61, train_loss: 0.5662, test_loss: 0.9880, test_f1: 0.6259
 epoch: 62, train_loss: 0.5672, test_loss: 1.0685, test_f1: 0.6102
 epoch: 63, train_loss: 0.5702, test_loss: 1.0314, test_f1: 0.6069
 epoch: 64, train_loss: 0.5404, test_loss: 1.0696, test_f1: 0.6329
 epoch: 65, train_loss: 0.5624, test_loss: 1.0234, test_f1: 0.6162
 epoch: 66, train_loss: 0.5575, test_loss: 1.0670, test_f1: 0.5959
 epoch: 67, train_loss: 0.5518, test_loss: 1.0379, test_f1: 0.6055
 epoch: 68, train_loss: 0.5386, test_loss: 1.0325, test_f1: 0.6349
 epoch: 69, train_loss: 0.5563, test_loss: 0.9920, test_f1: 0.6324
 epoch: 70, train_loss: 0.5422, test_loss: 1.0244, test_f1: 0.6285
 epoch: 71, train_loss: 0.5397, test_loss: 1.1260, test_f1: 0.6154
 epoch: 72, train_loss: 0.5360, test_loss: 1.0965, test_f1: 0.6184
 epoch: 73, train_loss: 0.5350, test_loss: 1.0857, test_f1: 0.6002
 epoch: 74, train_loss: 0.5278, test_loss: 1.1324, test_f1: 0.6036
 epoch: 75, train_loss: 0.5411, test_loss: 1.1234, test_f1: 0.6083
 epoch: 76, train_loss: 0.5303, test_loss: 1.0462, test_f1: 0.6169
 epoch: 77, train_loss: 0.5199, test_loss: 1.1365, test_f1: 0.6079
 epoch: 78, train_loss: 0.5248, test_loss: 1.1318, test_f1: 0.6076
 epoch: 79, train_loss: 0.5280, test_loss: 1.1334, test_f1: 0.6165
 epoch: 80, train_loss: 0.5336, test_loss: 1.1018, test_f1: 0.6030
 epoch: 81, train_loss: 0.5149, test_loss: 1.0679, test_f1: 0.6269
 epoch: 82, train_loss: 0.5275, test_loss: 1.1730, test_f1: 0.6044
 epoch: 83, train_loss: 0.5072, test_loss: 1.0965, test_f1: 0.6166
 epoch: 84, train_loss: 0.5095, test_loss: 1.2074, test_f1: 0.6055
 epoch: 85, train_loss: 0.5317, test_loss: 1.1934, test_f1: 0.6069
 epoch: 86, train_loss: 0.5063, test_loss: 1.1686, test_f1: 0.6122
 epoch: 87, train_loss: 0.4997, test_loss: 1.1745, test_f1: 0.6143
 epoch: 88, train_loss: 0.5058, test_loss: 1.1785, test_f1: 0.6072
 epoch: 89, train_loss: 0.4820, test_loss: 1.0954, test_f1: 0.6020
 epoch: 90, train_loss: 0.4874, test_loss: 1.1345, test_f1: 0.6292
 epoch: 91, train_loss: 0.5014, test_loss: 1.1436, test_f1: 0.6229
 epoch: 92, train_loss: 0.4895, test_loss: 1.1252, test_f1: 0.6315
 epoch: 93, train_loss: 0.4889, test_loss: 1.2399, test_f1: 0.6211
 epoch: 94, train_loss: 0.4959, test_loss: 1.1190, test_f1: 0.6171
 epoch: 95, train_loss: 0.4927, test_loss: 1.2050, test_f1: 0.6167
 epoch: 96, train_loss: 0.4719, test_loss: 1.1924, test_f1: 0.6129
 epoch: 97, train_loss: 0.4800, test_loss: 1.1871, test_f1: 0.6151
 epoch: 98, train_loss: 0.4736, test_loss: 1.3594, test_f1: 0.6080
 epoch: 99, train_loss: 0.4876, test_loss: 1.2192, test_f1: 0.5999
##################ITERATION #1 ****************************************
 epoch: 0, train_loss: 1.1214, test_loss: 1.0388, test_f1: 0.4409
 epoch: 1, train_loss: 1.0072, test_loss: 0.9768, test_f1: 0.4651
 epoch: 2, train_loss: 0.9740, test_loss: 0.9481, test_f1: 0.4870
 epoch: 3, train_loss: 0.9565, test_loss: 0.9457, test_f1: 0.4906
 epoch: 4, train_loss: 0.9424, test_loss: 0.9392, test_f1: 0.5124
 epoch: 5, train_loss: 0.9186, test_loss: 0.9532, test_f1: 0.5368
 epoch: 6, train_loss: 0.9118, test_loss: 0.9468, test_f1: 0.5335
 epoch: 7, train_loss: 0.9108, test_loss: 0.9124, test_f1: 0.5031
 epoch: 8, train_loss: 0.8910, test_loss: 0.9174, test_f1: 0.5243
 epoch: 9, train_loss: 0.8763, test_loss: 0.8959, test_f1: 0.5105
 epoch: 10, train_loss: 0.8668, test_loss: 0.8893, test_f1: 0.5573
 epoch: 11, train_loss: 0.8662, test_loss: 0.8509, test_f1: 0.5641
 epoch: 12, train_loss: 0.8568, test_loss: 0.8723, test_f1: 0.5262
 epoch: 13, train_loss: 0.8430, test_loss: 0.8785, test_f1: 0.5746
 epoch: 14, train_loss: 0.8321, test_loss: 0.8463, test_f1: 0.5634
 epoch: 15, train_loss: 0.8121, test_loss: 0.8455, test_f1: 0.5886
 epoch: 16, train_loss: 0.8011, test_loss: 0.8884, test_f1: 0.5748
 epoch: 17, train_loss: 0.8133, test_loss: 0.8670, test_f1: 0.5843
 epoch: 18, train_loss: 0.7918, test_loss: 0.8765, test_f1: 0.5851
 epoch: 19, train_loss: 0.7949, test_loss: 0.9358, test_f1: 0.5756
 epoch: 20, train_loss: 0.7922, test_loss: 0.8692, test_f1: 0.5544
 epoch: 21, train_loss: 0.7895, test_loss: 0.7874, test_f1: 0.6041
 epoch: 22, train_loss: 0.7693, test_loss: 0.7917, test_f1: 0.6015
 epoch: 23, train_loss: 0.7548, test_loss: 0.8858, test_f1: 0.5843
 epoch: 24, train_loss: 0.7518, test_loss: 0.8447, test_f1: 0.5823
 epoch: 25, train_loss: 0.7481, test_loss: 0.8250, test_f1: 0.5949
 epoch: 26, train_loss: 0.7398, test_loss: 0.8739, test_f1: 0.5917
 epoch: 27, train_loss: 0.7360, test_loss: 0.8406, test_f1: 0.6125
 epoch: 28, train_loss: 0.7362, test_loss: 0.8378, test_f1: 0.6061
 epoch: 29, train_loss: 0.7309, test_loss: 0.7908, test_f1: 0.6075
 epoch: 30, train_loss: 0.7219, test_loss: 0.8596, test_f1: 0.5847
 epoch: 31, train_loss: 0.7225, test_loss: 0.8053, test_f1: 0.6315
 epoch: 32, train_loss: 0.7049, test_loss: 0.8589, test_f1: 0.6071
 epoch: 33, train_loss: 0.6946, test_loss: 0.8459, test_f1: 0.6186
 epoch: 34, train_loss: 0.6949, test_loss: 0.8011, test_f1: 0.6119
 epoch: 35, train_loss: 0.6951, test_loss: 0.8530, test_f1: 0.6219
 epoch: 36, train_loss: 0.6900, test_loss: 0.8668, test_f1: 0.6036
 epoch: 37, train_loss: 0.6868, test_loss: 0.8644, test_f1: 0.6286
 epoch: 38, train_loss: 0.6877, test_loss: 0.8089, test_f1: 0.6517
 epoch: 39, train_loss: 0.6683, test_loss: 0.8574, test_f1: 0.6446
 epoch: 40, train_loss: 0.6603, test_loss: 0.8056, test_f1: 0.6195
 epoch: 41, train_loss: 0.6541, test_loss: 0.7466, test_f1: 0.6447
 epoch: 42, train_loss: 0.6485, test_loss: 0.8123, test_f1: 0.6433
 epoch: 43, train_loss: 0.6438, test_loss: 0.8278, test_f1: 0.6482
 epoch: 44, train_loss: 0.6482, test_loss: 0.8100, test_f1: 0.6369
 epoch: 45, train_loss: 0.6443, test_loss: 0.7868, test_f1: 0.6518
 epoch: 46, train_loss: 0.6502, test_loss: 0.8452, test_f1: 0.6628
 epoch: 47, train_loss: 0.6409, test_loss: 0.8266, test_f1: 0.6011
 epoch: 48, train_loss: 0.6312, test_loss: 0.8985, test_f1: 0.5850
 epoch: 49, train_loss: 0.6360, test_loss: 0.8593, test_f1: 0.6145
 epoch: 50, train_loss: 0.6521, test_loss: 0.9100, test_f1: 0.6000
 epoch: 51, train_loss: 0.6171, test_loss: 0.7524, test_f1: 0.6357
 epoch: 52, train_loss: 0.5959, test_loss: 0.8224, test_f1: 0.6158
 epoch: 53, train_loss: 0.5884, test_loss: 0.9299, test_f1: 0.6231
 epoch: 54, train_loss: 0.5819, test_loss: 0.8166, test_f1: 0.6602
 epoch: 55, train_loss: 0.5951, test_loss: 0.8570, test_f1: 0.6213
 epoch: 56, train_loss: 0.5737, test_loss: 0.8950, test_f1: 0.6393
 epoch: 57, train_loss: 0.5844, test_loss: 0.8698, test_f1: 0.6528
 epoch: 58, train_loss: 0.5926, test_loss: 0.9346, test_f1: 0.6398
 epoch: 59, train_loss: 0.5718, test_loss: 0.8440, test_f1: 0.6406
 epoch: 60, train_loss: 0.5730, test_loss: 0.8470, test_f1: 0.6504
 epoch: 61, train_loss: 0.5706, test_loss: 0.8969, test_f1: 0.6591
 epoch: 62, train_loss: 0.5773, test_loss: 0.8638, test_f1: 0.6536
 epoch: 63, train_loss: 0.5681, test_loss: 0.8558, test_f1: 0.6577
 epoch: 64, train_loss: 0.5511, test_loss: 0.7422, test_f1: 0.6644
 epoch: 65, train_loss: 0.5663, test_loss: 0.8358, test_f1: 0.6488
 epoch: 66, train_loss: 0.5669, test_loss: 0.8486, test_f1: 0.6441
 epoch: 67, train_loss: 0.5562, test_loss: 0.8132, test_f1: 0.6420
 epoch: 68, train_loss: 0.5632, test_loss: 0.8017, test_f1: 0.6409
 epoch: 69, train_loss: 0.5594, test_loss: 0.8929, test_f1: 0.6361
 epoch: 70, train_loss: 0.5593, test_loss: 0.8274, test_f1: 0.6380
 epoch: 71, train_loss: 0.5295, test_loss: 0.8989, test_f1: 0.6443
 epoch: 72, train_loss: 0.5394, test_loss: 0.8898, test_f1: 0.6658
 epoch: 73, train_loss: 0.5465, test_loss: 0.9458, test_f1: 0.6512
 epoch: 74, train_loss: 0.5358, test_loss: 0.9862, test_f1: 0.6516
 epoch: 75, train_loss: 0.5346, test_loss: 0.9803, test_f1: 0.6411
 epoch: 76, train_loss: 0.5249, test_loss: 0.7887, test_f1: 0.6524
 epoch: 77, train_loss: 0.5286, test_loss: 0.9943, test_f1: 0.6489
 epoch: 78, train_loss: 0.5388, test_loss: 1.0213, test_f1: 0.6288
 epoch: 79, train_loss: 0.5292, test_loss: 0.9974, test_f1: 0.6422
 epoch: 80, train_loss: 0.5374, test_loss: 1.0510, test_f1: 0.6504
 epoch: 81, train_loss: 0.5304, test_loss: 1.0393, test_f1: 0.6402
 epoch: 82, train_loss: 0.5096, test_loss: 0.9690, test_f1: 0.6704
 epoch: 83, train_loss: 0.5193, test_loss: 1.0201, test_f1: 0.6608
 epoch: 84, train_loss: 0.5280, test_loss: 0.9231, test_f1: 0.6482
 epoch: 85, train_loss: 0.5139, test_loss: 1.0198, test_f1: 0.6568
 epoch: 86, train_loss: 0.5102, test_loss: 1.0228, test_f1: 0.6381
 epoch: 87, train_loss: 0.5215, test_loss: 0.9619, test_f1: 0.6575
 epoch: 88, train_loss: 0.5138, test_loss: 1.0223, test_f1: 0.6444
 epoch: 89, train_loss: 0.5102, test_loss: 1.1242, test_f1: 0.6523
 epoch: 90, train_loss: 0.4978, test_loss: 0.9732, test_f1: 0.6518
 epoch: 91, train_loss: 0.5006, test_loss: 1.1004, test_f1: 0.6504
 epoch: 92, train_loss: 0.4907, test_loss: 0.9982, test_f1: 0.6661
 epoch: 93, train_loss: 0.4932, test_loss: 1.1666, test_f1: 0.6261
 epoch: 94, train_loss: 0.4997, test_loss: 1.0852, test_f1: 0.6498
 epoch: 95, train_loss: 0.5017, test_loss: 1.0511, test_f1: 0.6559
 epoch: 96, train_loss: 0.4983, test_loss: 1.0605, test_f1: 0.6589
 epoch: 97, train_loss: 0.4964, test_loss: 1.0944, test_f1: 0.6295
 epoch: 98, train_loss: 0.4832, test_loss: 1.0702, test_f1: 0.6653
 epoch: 99, train_loss: 0.4864, test_loss: 1.0196, test_f1: 0.6554
##################ITERATION #2 ****************************************
 epoch: 0, train_loss: 1.1460, test_loss: 1.2850, test_f1: 0.2347
 epoch: 1, train_loss: 0.9953, test_loss: 0.9435, test_f1: 0.4572
 epoch: 2, train_loss: 0.9656, test_loss: 0.9244, test_f1: 0.5086
 epoch: 3, train_loss: 0.9460, test_loss: 0.8921, test_f1: 0.5280
 epoch: 4, train_loss: 0.9286, test_loss: 0.9227, test_f1: 0.4936
 epoch: 5, train_loss: 0.9136, test_loss: 0.8804, test_f1: 0.5238
 epoch: 6, train_loss: 0.8979, test_loss: 0.9210, test_f1: 0.5501
 epoch: 7, train_loss: 0.8739, test_loss: 0.8614, test_f1: 0.5257
 epoch: 8, train_loss: 0.8746, test_loss: 0.9744, test_f1: 0.4921
 epoch: 9, train_loss: 0.8565, test_loss: 0.8928, test_f1: 0.5464
 epoch: 10, train_loss: 0.8388, test_loss: 0.9462, test_f1: 0.5110
 epoch: 11, train_loss: 0.8240, test_loss: 0.8553, test_f1: 0.5336
 epoch: 12, train_loss: 0.8218, test_loss: 0.8760, test_f1: 0.5973
 epoch: 13, train_loss: 0.8176, test_loss: 0.8623, test_f1: 0.5599
 epoch: 14, train_loss: 0.8016, test_loss: 0.8653, test_f1: 0.5777
 epoch: 15, train_loss: 0.7809, test_loss: 0.8620, test_f1: 0.5940
 epoch: 16, train_loss: 0.7757, test_loss: 0.8854, test_f1: 0.6018
 epoch: 17, train_loss: 0.7665, test_loss: 0.8227, test_f1: 0.6165
 epoch: 18, train_loss: 0.7584, test_loss: 0.8471, test_f1: 0.5815
 epoch: 19, train_loss: 0.7486, test_loss: 0.8290, test_f1: 0.5895
 epoch: 20, train_loss: 0.7329, test_loss: 0.8431, test_f1: 0.6424
 epoch: 21, train_loss: 0.7299, test_loss: 1.0225, test_f1: 0.5798
 epoch: 22, train_loss: 0.7304, test_loss: 0.8557, test_f1: 0.5924
 epoch: 23, train_loss: 0.7197, test_loss: 0.8745, test_f1: 0.6460
 epoch: 24, train_loss: 0.7071, test_loss: 0.8774, test_f1: 0.6420
 epoch: 25, train_loss: 0.6952, test_loss: 0.8635, test_f1: 0.6407
 epoch: 26, train_loss: 0.7084, test_loss: 0.8393, test_f1: 0.6251
 epoch: 27, train_loss: 0.6863, test_loss: 0.8889, test_f1: 0.6220
 epoch: 28, train_loss: 0.6807, test_loss: 1.0624, test_f1: 0.5477
 epoch: 29, train_loss: 0.6740, test_loss: 0.8286, test_f1: 0.6441
 epoch: 30, train_loss: 0.6850, test_loss: 0.8329, test_f1: 0.6476
 epoch: 31, train_loss: 0.6623, test_loss: 0.8028, test_f1: 0.6357
 epoch: 32, train_loss: 0.6792, test_loss: 0.8562, test_f1: 0.6280
 epoch: 33, train_loss: 0.6521, test_loss: 0.8239, test_f1: 0.6531
 epoch: 34, train_loss: 0.6405, test_loss: 0.7844, test_f1: 0.6665
 epoch: 35, train_loss: 0.6495, test_loss: 0.7428, test_f1: 0.6542
 epoch: 36, train_loss: 0.6407, test_loss: 0.8809, test_f1: 0.6424
 epoch: 37, train_loss: 0.6436, test_loss: 0.9201, test_f1: 0.6319
 epoch: 38, train_loss: 0.6533, test_loss: 0.8296, test_f1: 0.6659
 epoch: 39, train_loss: 0.6301, test_loss: 0.9515, test_f1: 0.6113
 epoch: 40, train_loss: 0.6140, test_loss: 0.7933, test_f1: 0.6576
 epoch: 41, train_loss: 0.5987, test_loss: 0.8408, test_f1: 0.6672
 epoch: 42, train_loss: 0.6142, test_loss: 0.7848, test_f1: 0.6570
 epoch: 43, train_loss: 0.6140, test_loss: 0.8542, test_f1: 0.6551
 epoch: 44, train_loss: 0.6148, test_loss: 0.8869, test_f1: 0.6253
 epoch: 45, train_loss: 0.6079, test_loss: 0.9185, test_f1: 0.6376
 epoch: 46, train_loss: 0.6113, test_loss: 0.7712, test_f1: 0.6636
 epoch: 47, train_loss: 0.6023, test_loss: 0.8409, test_f1: 0.6688
 epoch: 48, train_loss: 0.5823, test_loss: 0.8419, test_f1: 0.6479
 epoch: 49, train_loss: 0.5899, test_loss: 0.8758, test_f1: 0.6491
 epoch: 50, train_loss: 0.5876, test_loss: 0.9111, test_f1: 0.6585
 epoch: 51, train_loss: 0.5659, test_loss: 0.8509, test_f1: 0.6735
 epoch: 52, train_loss: 0.5496, test_loss: 0.8509, test_f1: 0.6659
 epoch: 53, train_loss: 0.5422, test_loss: 0.8688, test_f1: 0.6804
 epoch: 54, train_loss: 0.5406, test_loss: 0.9195, test_f1: 0.6578
 epoch: 55, train_loss: 0.5434, test_loss: 0.8463, test_f1: 0.6672
 epoch: 56, train_loss: 0.5366, test_loss: 0.8835, test_f1: 0.6671
 epoch: 57, train_loss: 0.5340, test_loss: 0.8889, test_f1: 0.6700
 epoch: 58, train_loss: 0.5301, test_loss: 0.9388, test_f1: 0.6414
 epoch: 59, train_loss: 0.5284, test_loss: 0.8561, test_f1: 0.6783
 epoch: 60, train_loss: 0.5270, test_loss: 0.9100, test_f1: 0.6632
 epoch: 61, train_loss: 0.5243, test_loss: 0.9605, test_f1: 0.6593
 epoch: 62, train_loss: 0.5192, test_loss: 0.9256, test_f1: 0.6629
 epoch: 63, train_loss: 0.5185, test_loss: 0.9722, test_f1: 0.6425
 epoch: 64, train_loss: 0.5086, test_loss: 1.0235, test_f1: 0.6540
 epoch: 65, train_loss: 0.5118, test_loss: 1.0016, test_f1: 0.6477
 epoch: 66, train_loss: 0.4953, test_loss: 0.9947, test_f1: 0.6593
 epoch: 67, train_loss: 0.5205, test_loss: 0.9673, test_f1: 0.6608
 epoch: 68, train_loss: 0.4994, test_loss: 0.9092, test_f1: 0.6700
 epoch: 69, train_loss: 0.4969, test_loss: 1.0018, test_f1: 0.6565
 epoch: 70, train_loss: 0.4869, test_loss: 0.9804, test_f1: 0.6577
 epoch: 71, train_loss: 0.5101, test_loss: 0.9799, test_f1: 0.6703
 epoch: 72, train_loss: 0.5072, test_loss: 0.9538, test_f1: 0.6538
 epoch: 73, train_loss: 0.4906, test_loss: 1.0027, test_f1: 0.6651
 epoch: 74, train_loss: 0.4967, test_loss: 1.0241, test_f1: 0.6591
 epoch: 75, train_loss: 0.4902, test_loss: 1.0368, test_f1: 0.6831
 epoch: 76, train_loss: 0.4840, test_loss: 1.0744, test_f1: 0.6540
 epoch: 77, train_loss: 0.4803, test_loss: 1.0249, test_f1: 0.6628
 epoch: 78, train_loss: 0.4825, test_loss: 0.9821, test_f1: 0.6644
 epoch: 79, train_loss: 0.4619, test_loss: 0.9946, test_f1: 0.6696
 epoch: 80, train_loss: 0.4741, test_loss: 1.0248, test_f1: 0.6487
 epoch: 81, train_loss: 0.4796, test_loss: 0.9750, test_f1: 0.6713
 epoch: 82, train_loss: 0.4998, test_loss: 1.0471, test_f1: 0.6603
 epoch: 83, train_loss: 0.4742, test_loss: 0.9623, test_f1: 0.6728
 epoch: 84, train_loss: 0.4739, test_loss: 1.0207, test_f1: 0.6746
 epoch: 85, train_loss: 0.4786, test_loss: 1.0435, test_f1: 0.6680
 epoch: 86, train_loss: 0.4706, test_loss: 1.0763, test_f1: 0.6671
 epoch: 87, train_loss: 0.4699, test_loss: 1.0164, test_f1: 0.6776
 epoch: 88, train_loss: 0.4595, test_loss: 1.0169, test_f1: 0.6721
 epoch: 89, train_loss: 0.4568, test_loss: 1.0587, test_f1: 0.6668
 epoch: 90, train_loss: 0.4704, test_loss: 1.1045, test_f1: 0.6561
 epoch: 91, train_loss: 0.4475, test_loss: 1.0174, test_f1: 0.6622
 epoch: 92, train_loss: 0.4610, test_loss: 1.1265, test_f1: 0.6792
 epoch: 93, train_loss: 0.4584, test_loss: 1.0830, test_f1: 0.6654
 epoch: 94, train_loss: 0.4471, test_loss: 1.1350, test_f1: 0.6525
 epoch: 95, train_loss: 0.4491, test_loss: 1.1477, test_f1: 0.6529
 epoch: 96, train_loss: 0.4558, test_loss: 1.1199, test_f1: 0.6647
 epoch: 97, train_loss: 0.4536, test_loss: 1.0559, test_f1: 0.6631
 epoch: 98, train_loss: 0.4403, test_loss: 1.0291, test_f1: 0.6781
 epoch: 99, train_loss: 0.4525, test_loss: 1.0603, test_f1: 0.6921
##################ITERATION #3 ****************************************
 epoch: 0, train_loss: 1.1549, test_loss: 1.0621, test_f1: 0.4227
 epoch: 1, train_loss: 1.0198, test_loss: 0.9933, test_f1: 0.4672
 epoch: 2, train_loss: 0.9869, test_loss: 0.9995, test_f1: 0.4704
 epoch: 3, train_loss: 0.9768, test_loss: 1.0188, test_f1: 0.4631
 epoch: 4, train_loss: 0.9542, test_loss: 0.9643, test_f1: 0.5065
 epoch: 5, train_loss: 0.9304, test_loss: 0.9990, test_f1: 0.4656
 epoch: 6, train_loss: 0.9191, test_loss: 0.9863, test_f1: 0.4846
 epoch: 7, train_loss: 0.9153, test_loss: 0.9421, test_f1: 0.4944
 epoch: 8, train_loss: 0.8972, test_loss: 0.9031, test_f1: 0.5073
 epoch: 9, train_loss: 0.8962, test_loss: 0.9663, test_f1: 0.5183
 epoch: 10, train_loss: 0.8842, test_loss: 0.9679, test_f1: 0.5054
 epoch: 11, train_loss: 0.8811, test_loss: 0.9124, test_f1: 0.5156
 epoch: 12, train_loss: 0.8732, test_loss: 0.8814, test_f1: 0.5181
 epoch: 13, train_loss: 0.8581, test_loss: 0.8847, test_f1: 0.4813
 epoch: 14, train_loss: 0.8495, test_loss: 0.8748, test_f1: 0.5147
 epoch: 15, train_loss: 0.8262, test_loss: 0.8337, test_f1: 0.5401
 epoch: 16, train_loss: 0.8264, test_loss: 0.8972, test_f1: 0.5359
 epoch: 17, train_loss: 0.8234, test_loss: 0.7960, test_f1: 0.5482
 epoch: 18, train_loss: 0.8134, test_loss: 0.8105, test_f1: 0.5656
 epoch: 19, train_loss: 0.8158, test_loss: 0.8021, test_f1: 0.5920
 epoch: 20, train_loss: 0.8046, test_loss: 0.8201, test_f1: 0.5697
 epoch: 21, train_loss: 0.7989, test_loss: 0.9243, test_f1: 0.5337
 epoch: 22, train_loss: 0.7897, test_loss: 0.9051, test_f1: 0.6151
 epoch: 23, train_loss: 0.7826, test_loss: 0.8432, test_f1: 0.5838
 epoch: 24, train_loss: 0.7771, test_loss: 0.9046, test_f1: 0.5334
 epoch: 25, train_loss: 0.7608, test_loss: 0.8856, test_f1: 0.5768
 epoch: 26, train_loss: 0.7602, test_loss: 0.8774, test_f1: 0.6003
 epoch: 27, train_loss: 0.7608, test_loss: 0.8574, test_f1: 0.6303
 epoch: 28, train_loss: 0.7582, test_loss: 0.7790, test_f1: 0.6059
 epoch: 29, train_loss: 0.7445, test_loss: 0.8284, test_f1: 0.6144
 epoch: 30, train_loss: 0.7331, test_loss: 0.7593, test_f1: 0.6367
 epoch: 31, train_loss: 0.7272, test_loss: 0.8981, test_f1: 0.5926
 epoch: 32, train_loss: 0.7295, test_loss: 0.8476, test_f1: 0.5885
 epoch: 33, train_loss: 0.7179, test_loss: 0.8273, test_f1: 0.5941
 epoch: 34, train_loss: 0.7155, test_loss: 0.7765, test_f1: 0.6424
 epoch: 35, train_loss: 0.6994, test_loss: 0.8058, test_f1: 0.6105
 epoch: 36, train_loss: 0.7064, test_loss: 0.8054, test_f1: 0.6362
 epoch: 37, train_loss: 0.7175, test_loss: 0.8021, test_f1: 0.5995
 epoch: 38, train_loss: 0.7078, test_loss: 0.8518, test_f1: 0.5884
 epoch: 39, train_loss: 0.6803, test_loss: 0.8051, test_f1: 0.6124
 epoch: 40, train_loss: 0.6836, test_loss: 0.8203, test_f1: 0.6379
 epoch: 41, train_loss: 0.6791, test_loss: 0.8658, test_f1: 0.6463
 epoch: 42, train_loss: 0.6736, test_loss: 0.8150, test_f1: 0.6475
 epoch: 43, train_loss: 0.6628, test_loss: 0.7011, test_f1: 0.6498
 epoch: 44, train_loss: 0.6735, test_loss: 0.7691, test_f1: 0.6763
 epoch: 45, train_loss: 0.6686, test_loss: 0.8336, test_f1: 0.6547
 epoch: 46, train_loss: 0.6588, test_loss: 0.8253, test_f1: 0.6454
 epoch: 47, train_loss: 0.6562, test_loss: 0.8512, test_f1: 0.6437
 epoch: 48, train_loss: 0.6416, test_loss: 0.8687, test_f1: 0.6523
 epoch: 49, train_loss: 0.6530, test_loss: 0.8416, test_f1: 0.6691
 epoch: 50, train_loss: 0.6514, test_loss: 0.7987, test_f1: 0.6852
 epoch: 51, train_loss: 0.6149, test_loss: 0.7649, test_f1: 0.6576
 epoch: 52, train_loss: 0.6270, test_loss: 0.8059, test_f1: 0.6645
 epoch: 53, train_loss: 0.5992, test_loss: 0.8194, test_f1: 0.6589
 epoch: 54, train_loss: 0.5888, test_loss: 0.8765, test_f1: 0.6453
 epoch: 55, train_loss: 0.5862, test_loss: 0.8272, test_f1: 0.6651
 epoch: 56, train_loss: 0.5980, test_loss: 0.8283, test_f1: 0.6642
 epoch: 57, train_loss: 0.5849, test_loss: 0.8650, test_f1: 0.6615
 epoch: 58, train_loss: 0.5775, test_loss: 0.7676, test_f1: 0.6608
 epoch: 59, train_loss: 0.5808, test_loss: 0.8242, test_f1: 0.6630
 epoch: 60, train_loss: 0.5935, test_loss: 0.8008, test_f1: 0.6659
 epoch: 61, train_loss: 0.5751, test_loss: 0.7801, test_f1: 0.6568
 epoch: 62, train_loss: 0.5833, test_loss: 0.8720, test_f1: 0.6582
 epoch: 63, train_loss: 0.5817, test_loss: 0.9029, test_f1: 0.6544
 epoch: 64, train_loss: 0.5729, test_loss: 0.8537, test_f1: 0.6629
 epoch: 65, train_loss: 0.5766, test_loss: 0.8159, test_f1: 0.6797
 epoch: 66, train_loss: 0.5783, test_loss: 0.8034, test_f1: 0.6435
 epoch: 67, train_loss: 0.5693, test_loss: 0.8197, test_f1: 0.6482
 epoch: 68, train_loss: 0.5656, test_loss: 0.8195, test_f1: 0.6705
 epoch: 69, train_loss: 0.5599, test_loss: 0.8893, test_f1: 0.6475
 epoch: 70, train_loss: 0.5643, test_loss: 0.8244, test_f1: 0.6477
 epoch: 71, train_loss: 0.5503, test_loss: 0.8564, test_f1: 0.6603
 epoch: 72, train_loss: 0.5591, test_loss: 0.8754, test_f1: 0.6847
 epoch: 73, train_loss: 0.5529, test_loss: 0.8588, test_f1: 0.6798
 epoch: 74, train_loss: 0.5586, test_loss: 0.8456, test_f1: 0.6771
 epoch: 75, train_loss: 0.5378, test_loss: 0.8016, test_f1: 0.6870
 epoch: 76, train_loss: 0.5397, test_loss: 0.8814, test_f1: 0.6826
 epoch: 77, train_loss: 0.5296, test_loss: 0.8556, test_f1: 0.6723
 epoch: 78, train_loss: 0.5391, test_loss: 0.8443, test_f1: 0.6790
 epoch: 79, train_loss: 0.5499, test_loss: 0.8637, test_f1: 0.6944
 epoch: 80, train_loss: 0.5281, test_loss: 0.8261, test_f1: 0.6650
 epoch: 81, train_loss: 0.5471, test_loss: 0.8131, test_f1: 0.6857
 epoch: 82, train_loss: 0.5355, test_loss: 0.8625, test_f1: 0.6502
 epoch: 83, train_loss: 0.5330, test_loss: 0.8732, test_f1: 0.6654
 epoch: 84, train_loss: 0.5257, test_loss: 0.8755, test_f1: 0.6707
 epoch: 85, train_loss: 0.5329, test_loss: 0.9389, test_f1: 0.6836
 epoch: 86, train_loss: 0.5423, test_loss: 0.8901, test_f1: 0.6560
 epoch: 87, train_loss: 0.5386, test_loss: 0.9216, test_f1: 0.6448
 epoch: 88, train_loss: 0.5425, test_loss: 0.9378, test_f1: 0.6617
 epoch: 89, train_loss: 0.5168, test_loss: 0.8972, test_f1: 0.6695
 epoch: 90, train_loss: 0.5208, test_loss: 0.9902, test_f1: 0.6646
 epoch: 91, train_loss: 0.5153, test_loss: 0.9812, test_f1: 0.6541
 epoch: 92, train_loss: 0.5147, test_loss: 0.9469, test_f1: 0.6705
 epoch: 93, train_loss: 0.5142, test_loss: 0.9796, test_f1: 0.6409
 epoch: 94, train_loss: 0.5134, test_loss: 1.0349, test_f1: 0.6270
 epoch: 95, train_loss: 0.5115, test_loss: 0.9281, test_f1: 0.6534
 epoch: 96, train_loss: 0.5054, test_loss: 0.8400, test_f1: 0.6529
 epoch: 97, train_loss: 0.5023, test_loss: 0.9582, test_f1: 0.6669
 epoch: 98, train_loss: 0.5123, test_loss: 0.9377, test_f1: 0.6530
 epoch: 99, train_loss: 0.5054, test_loss: 0.9436, test_f1: 0.6766
##################ITERATION #4 ****************************************
 epoch: 0, train_loss: 1.2309, test_loss: 1.1640, test_f1: 0.3411
 epoch: 1, train_loss: 1.0299, test_loss: 1.0023, test_f1: 0.4763
 epoch: 2, train_loss: 0.9921, test_loss: 0.9730, test_f1: 0.4905
 epoch: 3, train_loss: 0.9546, test_loss: 0.9350, test_f1: 0.4832
 epoch: 4, train_loss: 0.9426, test_loss: 0.9241, test_f1: 0.5125
 epoch: 5, train_loss: 0.9277, test_loss: 0.8754, test_f1: 0.5299
 epoch: 6, train_loss: 0.8938, test_loss: 0.8996, test_f1: 0.4959
 epoch: 7, train_loss: 0.8845, test_loss: 0.9409, test_f1: 0.4970
 epoch: 8, train_loss: 0.8777, test_loss: 0.9042, test_f1: 0.5016
 epoch: 9, train_loss: 0.8833, test_loss: 0.8829, test_f1: 0.5565
 epoch: 10, train_loss: 0.8609, test_loss: 0.8384, test_f1: 0.5785
 epoch: 11, train_loss: 0.8326, test_loss: 0.8173, test_f1: 0.5464
 epoch: 12, train_loss: 0.8390, test_loss: 0.8211, test_f1: 0.5986
 epoch: 13, train_loss: 0.8189, test_loss: 0.8023, test_f1: 0.5737
 epoch: 14, train_loss: 0.8112, test_loss: 0.7999, test_f1: 0.6177
 epoch: 15, train_loss: 0.8159, test_loss: 0.8041, test_f1: 0.5907
 epoch: 16, train_loss: 0.8093, test_loss: 0.8362, test_f1: 0.5879
 epoch: 17, train_loss: 0.7901, test_loss: 0.7906, test_f1: 0.5749
 epoch: 18, train_loss: 0.7770, test_loss: 0.7535, test_f1: 0.6173
 epoch: 19, train_loss: 0.7684, test_loss: 0.8184, test_f1: 0.5756
 epoch: 20, train_loss: 0.7677, test_loss: 0.7730, test_f1: 0.6270
 epoch: 21, train_loss: 0.7578, test_loss: 0.8598, test_f1: 0.6390
 epoch: 22, train_loss: 0.7456, test_loss: 0.7590, test_f1: 0.6459
 epoch: 23, train_loss: 0.7393, test_loss: 0.7413, test_f1: 0.6628
 epoch: 24, train_loss: 0.7359, test_loss: 0.7455, test_f1: 0.6393
 epoch: 25, train_loss: 0.7243, test_loss: 0.8187, test_f1: 0.5888
 epoch: 26, train_loss: 0.7147, test_loss: 0.8128, test_f1: 0.5964
 epoch: 27, train_loss: 0.7139, test_loss: 0.7689, test_f1: 0.6191
 epoch: 28, train_loss: 0.6990, test_loss: 0.7224, test_f1: 0.6345
 epoch: 29, train_loss: 0.6868, test_loss: 0.7661, test_f1: 0.6578
 epoch: 30, train_loss: 0.6895, test_loss: 0.8218, test_f1: 0.5797
 epoch: 31, train_loss: 0.6906, test_loss: 0.7968, test_f1: 0.6625
 epoch: 32, train_loss: 0.6829, test_loss: 0.8561, test_f1: 0.6154
 epoch: 33, train_loss: 0.6839, test_loss: 0.7548, test_f1: 0.6401
 epoch: 34, train_loss: 0.6750, test_loss: 0.8089, test_f1: 0.6027
 epoch: 35, train_loss: 0.6618, test_loss: 0.9218, test_f1: 0.6099
 epoch: 36, train_loss: 0.6525, test_loss: 0.7923, test_f1: 0.6440
 epoch: 37, train_loss: 0.6476, test_loss: 0.9499, test_f1: 0.5777
 epoch: 38, train_loss: 0.6648, test_loss: 0.7985, test_f1: 0.6377
 epoch: 39, train_loss: 0.6415, test_loss: 0.7870, test_f1: 0.6401
 epoch: 40, train_loss: 0.6535, test_loss: 0.7027, test_f1: 0.6603
 epoch: 41, train_loss: 0.6248, test_loss: 0.8368, test_f1: 0.6485
 epoch: 42, train_loss: 0.6273, test_loss: 0.8119, test_f1: 0.6492
 epoch: 43, train_loss: 0.6228, test_loss: 0.9414, test_f1: 0.6134
 epoch: 44, train_loss: 0.6301, test_loss: 0.8083, test_f1: 0.6465
 epoch: 45, train_loss: 0.6104, test_loss: 0.8766, test_f1: 0.6438
 epoch: 46, train_loss: 0.6036, test_loss: 0.8280, test_f1: 0.6464
 epoch: 47, train_loss: 0.6111, test_loss: 0.8136, test_f1: 0.6519
 epoch: 48, train_loss: 0.5885, test_loss: 0.7669, test_f1: 0.6176
 epoch: 49, train_loss: 0.5854, test_loss: 0.8935, test_f1: 0.6167
 epoch: 50, train_loss: 0.5878, test_loss: 0.8550, test_f1: 0.6381
 epoch: 51, train_loss: 0.5956, test_loss: 0.8904, test_f1: 0.6433
 epoch: 52, train_loss: 0.5539, test_loss: 0.7455, test_f1: 0.6415
 epoch: 53, train_loss: 0.5597, test_loss: 0.8039, test_f1: 0.6541
 epoch: 54, train_loss: 0.5363, test_loss: 0.7828, test_f1: 0.6613
 epoch: 55, train_loss: 0.5405, test_loss: 0.8662, test_f1: 0.6522
 epoch: 56, train_loss: 0.5344, test_loss: 0.7890, test_f1: 0.6655
 epoch: 57, train_loss: 0.5154, test_loss: 0.8250, test_f1: 0.6696
 epoch: 58, train_loss: 0.5257, test_loss: 0.8575, test_f1: 0.6648
 epoch: 59, train_loss: 0.5395, test_loss: 0.8281, test_f1: 0.6663
 epoch: 60, train_loss: 0.5209, test_loss: 0.8276, test_f1: 0.6553
 epoch: 61, train_loss: 0.5187, test_loss: 0.8341, test_f1: 0.6680
 epoch: 62, train_loss: 0.5121, test_loss: 0.8923, test_f1: 0.6682
 epoch: 63, train_loss: 0.4945, test_loss: 0.8329, test_f1: 0.6822
 epoch: 64, train_loss: 0.4887, test_loss: 0.8270, test_f1: 0.6766
 epoch: 65, train_loss: 0.5008, test_loss: 0.8231, test_f1: 0.6837
 epoch: 66, train_loss: 0.4891, test_loss: 0.8365, test_f1: 0.6684
 epoch: 67, train_loss: 0.5090, test_loss: 0.8743, test_f1: 0.6661
 epoch: 68, train_loss: 0.4990, test_loss: 0.8615, test_f1: 0.6578
 epoch: 69, train_loss: 0.4849, test_loss: 0.8574, test_f1: 0.6908
 epoch: 70, train_loss: 0.5049, test_loss: 0.9178, test_f1: 0.6747
 epoch: 71, train_loss: 0.4835, test_loss: 0.8303, test_f1: 0.6621
 epoch: 72, train_loss: 0.4844, test_loss: 0.9140, test_f1: 0.6813
 epoch: 73, train_loss: 0.4678, test_loss: 0.9698, test_f1: 0.7033
 epoch: 74, train_loss: 0.4800, test_loss: 0.9256, test_f1: 0.6871
 epoch: 75, train_loss: 0.4658, test_loss: 0.9267, test_f1: 0.6622
 epoch: 76, train_loss: 0.4655, test_loss: 0.8816, test_f1: 0.7035
 epoch: 77, train_loss: 0.4646, test_loss: 0.9154, test_f1: 0.6737
 epoch: 78, train_loss: 0.4580, test_loss: 0.9201, test_f1: 0.6708
 epoch: 79, train_loss: 0.4761, test_loss: 0.8729, test_f1: 0.6756
 epoch: 80, train_loss: 0.4626, test_loss: 0.9032, test_f1: 0.6817
 epoch: 81, train_loss: 0.4580, test_loss: 0.9087, test_f1: 0.6873
 epoch: 82, train_loss: 0.4637, test_loss: 0.9703, test_f1: 0.6790
 epoch: 83, train_loss: 0.4641, test_loss: 0.8893, test_f1: 0.6921
 epoch: 84, train_loss: 0.4480, test_loss: 0.8838, test_f1: 0.6716
 epoch: 85, train_loss: 0.4688, test_loss: 0.9739, test_f1: 0.6791
 epoch: 86, train_loss: 0.4536, test_loss: 1.0114, test_f1: 0.6715
 epoch: 87, train_loss: 0.4368, test_loss: 0.9865, test_f1: 0.6795
 epoch: 88, train_loss: 0.4573, test_loss: 0.9822, test_f1: 0.6627
 epoch: 89, train_loss: 0.4506, test_loss: 0.9543, test_f1: 0.6958
 epoch: 90, train_loss: 0.4493, test_loss: 1.0065, test_f1: 0.6837
 epoch: 91, train_loss: 0.4409, test_loss: 1.0371, test_f1: 0.6641
 epoch: 92, train_loss: 0.4297, test_loss: 1.0500, test_f1: 0.6845
 epoch: 93, train_loss: 0.4257, test_loss: 0.9693, test_f1: 0.6774
 epoch: 94, train_loss: 0.4335, test_loss: 0.9422, test_f1: 0.6934
 epoch: 95, train_loss: 0.4457, test_loss: 0.9912, test_f1: 0.6722
 epoch: 96, train_loss: 0.4334, test_loss: 1.0017, test_f1: 0.7069
 epoch: 97, train_loss: 0.4201, test_loss: 1.1258, test_f1: 0.6883
 epoch: 98, train_loss: 0.4188, test_loss: 1.0603, test_f1: 0.6892
 epoch: 99, train_loss: 0.4269, test_loss: 1.0141, test_f1: 0.7002
##################ITERATION #5 ****************************************
 epoch: 0, train_loss: 1.2677, test_loss: 1.1766, test_f1: 0.4325
 epoch: 1, train_loss: 1.0310, test_loss: 0.9884, test_f1: 0.5001
 epoch: 2, train_loss: 0.9819, test_loss: 0.9759, test_f1: 0.4733
 epoch: 3, train_loss: 0.9723, test_loss: 1.0339, test_f1: 0.4588
 epoch: 4, train_loss: 0.9436, test_loss: 0.9586, test_f1: 0.5035
 epoch: 5, train_loss: 0.9266, test_loss: 0.9320, test_f1: 0.4940
 epoch: 6, train_loss: 0.8997, test_loss: 0.9613, test_f1: 0.5161
 epoch: 7, train_loss: 0.8887, test_loss: 0.9080, test_f1: 0.5164
 epoch: 8, train_loss: 0.8748, test_loss: 0.9131, test_f1: 0.5077
 epoch: 9, train_loss: 0.8572, test_loss: 0.9064, test_f1: 0.5392
 epoch: 10, train_loss: 0.8446, test_loss: 0.9132, test_f1: 0.5227
 epoch: 11, train_loss: 0.8427, test_loss: 0.8422, test_f1: 0.5422
 epoch: 12, train_loss: 0.8358, test_loss: 0.8522, test_f1: 0.5588
 epoch: 13, train_loss: 0.8255, test_loss: 0.8721, test_f1: 0.5533
 epoch: 14, train_loss: 0.8154, test_loss: 0.7830, test_f1: 0.6108
 epoch: 15, train_loss: 0.8089, test_loss: 0.7954, test_f1: 0.5607
 epoch: 16, train_loss: 0.7923, test_loss: 0.7661, test_f1: 0.6385
 epoch: 17, train_loss: 0.7892, test_loss: 0.8047, test_f1: 0.5799
 epoch: 18, train_loss: 0.7761, test_loss: 0.7860, test_f1: 0.6122
 epoch: 19, train_loss: 0.7735, test_loss: 0.8241, test_f1: 0.5608
 epoch: 20, train_loss: 0.7693, test_loss: 0.7408, test_f1: 0.6061
 epoch: 21, train_loss: 0.7531, test_loss: 0.8509, test_f1: 0.5717
 epoch: 22, train_loss: 0.7496, test_loss: 0.8387, test_f1: 0.5914
 epoch: 23, train_loss: 0.7449, test_loss: 0.7359, test_f1: 0.6773
 epoch: 24, train_loss: 0.7364, test_loss: 0.7897, test_f1: 0.5700
 epoch: 25, train_loss: 0.7390, test_loss: 0.7548, test_f1: 0.6170
 epoch: 26, train_loss: 0.7303, test_loss: 0.7950, test_f1: 0.6456
 epoch: 27, train_loss: 0.7194, test_loss: 0.7685, test_f1: 0.6362
 epoch: 28, train_loss: 0.7189, test_loss: 0.7096, test_f1: 0.6829
 epoch: 29, train_loss: 0.6975, test_loss: 0.7385, test_f1: 0.6334
 epoch: 30, train_loss: 0.6995, test_loss: 0.7643, test_f1: 0.6281
 epoch: 31, train_loss: 0.6927, test_loss: 0.8269, test_f1: 0.6402
 epoch: 32, train_loss: 0.6860, test_loss: 0.7833, test_f1: 0.6425
 epoch: 33, train_loss: 0.6904, test_loss: 0.8371, test_f1: 0.6148
 epoch: 34, train_loss: 0.6790, test_loss: 0.8308, test_f1: 0.6347
 epoch: 35, train_loss: 0.6792, test_loss: 0.8586, test_f1: 0.6488
 epoch: 36, train_loss: 0.6569, test_loss: 0.8452, test_f1: 0.6409
 epoch: 37, train_loss: 0.6656, test_loss: 0.8063, test_f1: 0.6385
 epoch: 38, train_loss: 0.6638, test_loss: 0.8179, test_f1: 0.6346
 epoch: 39, train_loss: 0.6588, test_loss: 0.8058, test_f1: 0.6498
 epoch: 40, train_loss: 0.6604, test_loss: 0.7847, test_f1: 0.6191
 epoch: 41, train_loss: 0.6589, test_loss: 0.7791, test_f1: 0.6544
 epoch: 42, train_loss: 0.6326, test_loss: 0.7762, test_f1: 0.6431
 epoch: 43, train_loss: 0.6246, test_loss: 0.7861, test_f1: 0.6509
 epoch: 44, train_loss: 0.6285, test_loss: 0.7934, test_f1: 0.6212
 epoch: 45, train_loss: 0.6392, test_loss: 0.7408, test_f1: 0.6540
 epoch: 46, train_loss: 0.6504, test_loss: 0.7597, test_f1: 0.6420
 epoch: 47, train_loss: 0.6321, test_loss: 0.7834, test_f1: 0.6648
 epoch: 48, train_loss: 0.6148, test_loss: 0.6922, test_f1: 0.6634
 epoch: 49, train_loss: 0.6244, test_loss: 0.7135, test_f1: 0.6673
 epoch: 50, train_loss: 0.6150, test_loss: 0.7707, test_f1: 0.6526
 epoch: 51, train_loss: 0.5956, test_loss: 0.7241, test_f1: 0.6518
 epoch: 52, train_loss: 0.5828, test_loss: 0.7357, test_f1: 0.6430
 epoch: 53, train_loss: 0.5608, test_loss: 0.7473, test_f1: 0.6429
 epoch: 54, train_loss: 0.5795, test_loss: 0.7021, test_f1: 0.6671
 epoch: 55, train_loss: 0.5703, test_loss: 0.7425, test_f1: 0.6491
 epoch: 56, train_loss: 0.5557, test_loss: 0.7596, test_f1: 0.6513
 epoch: 57, train_loss: 0.5520, test_loss: 0.7479, test_f1: 0.6618
 epoch: 58, train_loss: 0.5556, test_loss: 0.7781, test_f1: 0.6521
 epoch: 59, train_loss: 0.5611, test_loss: 0.7427, test_f1: 0.6542
 epoch: 60, train_loss: 0.5468, test_loss: 0.7126, test_f1: 0.6730
 epoch: 61, train_loss: 0.5421, test_loss: 0.7510, test_f1: 0.6568
 epoch: 62, train_loss: 0.5486, test_loss: 0.7461, test_f1: 0.6608
 epoch: 63, train_loss: 0.5341, test_loss: 0.7602, test_f1: 0.6515
 epoch: 64, train_loss: 0.5468, test_loss: 0.7133, test_f1: 0.6784
 epoch: 65, train_loss: 0.5276, test_loss: 0.7483, test_f1: 0.6816
 epoch: 66, train_loss: 0.5527, test_loss: 0.7638, test_f1: 0.6367
 epoch: 67, train_loss: 0.5351, test_loss: 0.7030, test_f1: 0.6714
 epoch: 68, train_loss: 0.5170, test_loss: 0.7249, test_f1: 0.6519
 epoch: 69, train_loss: 0.5205, test_loss: 0.7787, test_f1: 0.6563
 epoch: 70, train_loss: 0.5129, test_loss: 0.7582, test_f1: 0.6521
 epoch: 71, train_loss: 0.5165, test_loss: 0.7817, test_f1: 0.6616
 epoch: 72, train_loss: 0.5245, test_loss: 0.7718, test_f1: 0.6477
 epoch: 73, train_loss: 0.5206, test_loss: 0.7718, test_f1: 0.6435
 epoch: 74, train_loss: 0.5245, test_loss: 0.8255, test_f1: 0.6525
 epoch: 75, train_loss: 0.5226, test_loss: 0.8454, test_f1: 0.6504
 epoch: 76, train_loss: 0.5116, test_loss: 0.7952, test_f1: 0.6593
 epoch: 77, train_loss: 0.5015, test_loss: 0.7509, test_f1: 0.6584
 epoch: 78, train_loss: 0.5031, test_loss: 0.7645, test_f1: 0.6554
 epoch: 79, train_loss: 0.5108, test_loss: 0.7240, test_f1: 0.6593
 epoch: 80, train_loss: 0.5050, test_loss: 0.7644, test_f1: 0.6516
 epoch: 81, train_loss: 0.5081, test_loss: 0.8940, test_f1: 0.6452
 epoch: 82, train_loss: 0.5030, test_loss: 0.7749, test_f1: 0.6568
 epoch: 83, train_loss: 0.4862, test_loss: 0.8408, test_f1: 0.6540
 epoch: 84, train_loss: 0.5137, test_loss: 0.8327, test_f1: 0.6381
 epoch: 85, train_loss: 0.5083, test_loss: 0.7741, test_f1: 0.6664
 epoch: 86, train_loss: 0.5079, test_loss: 0.9239, test_f1: 0.6420
 epoch: 87, train_loss: 0.4892, test_loss: 0.9108, test_f1: 0.6383
 epoch: 88, train_loss: 0.5047, test_loss: 0.8864, test_f1: 0.6523
 epoch: 89, train_loss: 0.4939, test_loss: 0.8102, test_f1: 0.6586
 epoch: 90, train_loss: 0.4848, test_loss: 0.8619, test_f1: 0.6480
 epoch: 91, train_loss: 0.4855, test_loss: 0.9413, test_f1: 0.6447
 epoch: 92, train_loss: 0.4734, test_loss: 0.9016, test_f1: 0.6412
 epoch: 93, train_loss: 0.4749, test_loss: 0.8191, test_f1: 0.6419
 epoch: 94, train_loss: 0.4754, test_loss: 0.8420, test_f1: 0.6430
 epoch: 95, train_loss: 0.4681, test_loss: 0.8752, test_f1: 0.6404
 epoch: 96, train_loss: 0.4848, test_loss: 0.8706, test_f1: 0.6359
 epoch: 97, train_loss: 0.4619, test_loss: 0.9298, test_f1: 0.6463
 epoch: 98, train_loss: 0.4722, test_loss: 0.9119, test_f1: 0.6438
 epoch: 99, train_loss: 0.4844, test_loss: 0.8777, test_f1: 0.6581
##################ITERATION #6 ****************************************
 epoch: 0, train_loss: 1.2886, test_loss: 1.0892, test_f1: 0.3567
 epoch: 1, train_loss: 1.0263, test_loss: 0.9942, test_f1: 0.4969
 epoch: 2, train_loss: 0.9725, test_loss: 0.9173, test_f1: 0.4927
 epoch: 3, train_loss: 0.9486, test_loss: 0.9212, test_f1: 0.4949
 epoch: 4, train_loss: 0.9221, test_loss: 0.9242, test_f1: 0.5114
 epoch: 5, train_loss: 0.9126, test_loss: 0.9177, test_f1: 0.5036
 epoch: 6, train_loss: 0.8900, test_loss: 0.8865, test_f1: 0.5193
 epoch: 7, train_loss: 0.8876, test_loss: 0.9038, test_f1: 0.5179
 epoch: 8, train_loss: 0.8743, test_loss: 0.8819, test_f1: 0.5834
 epoch: 9, train_loss: 0.8715, test_loss: 0.8696, test_f1: 0.5540
 epoch: 10, train_loss: 0.8304, test_loss: 0.8574, test_f1: 0.5779
 epoch: 11, train_loss: 0.8315, test_loss: 0.8459, test_f1: 0.5660
 epoch: 12, train_loss: 0.8102, test_loss: 0.8522, test_f1: 0.5572
 epoch: 13, train_loss: 0.8081, test_loss: 0.8750, test_f1: 0.5498
 epoch: 14, train_loss: 0.7895, test_loss: 0.8250, test_f1: 0.5661
 epoch: 15, train_loss: 0.7822, test_loss: 0.8365, test_f1: 0.6077
 epoch: 16, train_loss: 0.7767, test_loss: 0.8034, test_f1: 0.6026
 epoch: 17, train_loss: 0.7647, test_loss: 0.8480, test_f1: 0.6184
 epoch: 18, train_loss: 0.7644, test_loss: 0.8119, test_f1: 0.5999
 epoch: 19, train_loss: 0.7610, test_loss: 0.7637, test_f1: 0.6448
 epoch: 20, train_loss: 0.7479, test_loss: 0.7637, test_f1: 0.6256
 epoch: 21, train_loss: 0.7341, test_loss: 0.8025, test_f1: 0.5973
 epoch: 22, train_loss: 0.7218, test_loss: 0.8039, test_f1: 0.6378
 epoch: 23, train_loss: 0.7246, test_loss: 0.7653, test_f1: 0.6387
 epoch: 24, train_loss: 0.7148, test_loss: 0.7902, test_f1: 0.6205
 epoch: 25, train_loss: 0.7165, test_loss: 0.8786, test_f1: 0.6279
 epoch: 26, train_loss: 0.7117, test_loss: 0.7688, test_f1: 0.6385
 epoch: 27, train_loss: 0.7008, test_loss: 0.8436, test_f1: 0.6277
 epoch: 28, train_loss: 0.7132, test_loss: 0.8069, test_f1: 0.6444
 epoch: 29, train_loss: 0.7085, test_loss: 0.7745, test_f1: 0.6381
 epoch: 30, train_loss: 0.6720, test_loss: 0.8086, test_f1: 0.6470
 epoch: 31, train_loss: 0.6902, test_loss: 0.7987, test_f1: 0.6281
 epoch: 32, train_loss: 0.6758, test_loss: 0.7663, test_f1: 0.6584
 epoch: 33, train_loss: 0.6741, test_loss: 0.8013, test_f1: 0.6297
 epoch: 34, train_loss: 0.6680, test_loss: 0.8110, test_f1: 0.6521
 epoch: 35, train_loss: 0.6735, test_loss: 0.8163, test_f1: 0.6266
 epoch: 36, train_loss: 0.6527, test_loss: 0.8374, test_f1: 0.6311
 epoch: 37, train_loss: 0.6747, test_loss: 0.7718, test_f1: 0.6257
 epoch: 38, train_loss: 0.6570, test_loss: 0.8150, test_f1: 0.6615
 epoch: 39, train_loss: 0.6222, test_loss: 0.8235, test_f1: 0.6405
 epoch: 40, train_loss: 0.6509, test_loss: 0.8158, test_f1: 0.6541
 epoch: 41, train_loss: 0.6437, test_loss: 0.8079, test_f1: 0.6313
 epoch: 42, train_loss: 0.6278, test_loss: 0.8520, test_f1: 0.6388
 epoch: 43, train_loss: 0.6242, test_loss: 0.8238, test_f1: 0.6627
 epoch: 44, train_loss: 0.6280, test_loss: 0.8617, test_f1: 0.6358
 epoch: 45, train_loss: 0.6214, test_loss: 0.8220, test_f1: 0.6602
 epoch: 46, train_loss: 0.6171, test_loss: 0.8152, test_f1: 0.6533
 epoch: 47, train_loss: 0.6173, test_loss: 0.7232, test_f1: 0.6701
 epoch: 48, train_loss: 0.6110, test_loss: 0.8395, test_f1: 0.6575
 epoch: 49, train_loss: 0.6056, test_loss: 0.8544, test_f1: 0.6593
 epoch: 50, train_loss: 0.6025, test_loss: 0.8435, test_f1: 0.6339
 epoch: 51, train_loss: 0.5703, test_loss: 0.8590, test_f1: 0.6703
 epoch: 52, train_loss: 0.5602, test_loss: 0.8734, test_f1: 0.6520
 epoch: 53, train_loss: 0.5510, test_loss: 0.8875, test_f1: 0.6667
 epoch: 54, train_loss: 0.5560, test_loss: 0.8449, test_f1: 0.6535
 epoch: 55, train_loss: 0.5395, test_loss: 0.8463, test_f1: 0.6752
 epoch: 56, train_loss: 0.5385, test_loss: 0.8601, test_f1: 0.6668
 epoch: 57, train_loss: 0.5449, test_loss: 0.8936, test_f1: 0.6314
 epoch: 58, train_loss: 0.5296, test_loss: 0.8519, test_f1: 0.6702
 epoch: 59, train_loss: 0.5431, test_loss: 0.8425, test_f1: 0.6654
 epoch: 60, train_loss: 0.5449, test_loss: 0.8969, test_f1: 0.6465
 epoch: 61, train_loss: 0.5398, test_loss: 0.9079, test_f1: 0.6379
 epoch: 62, train_loss: 0.5287, test_loss: 0.8890, test_f1: 0.6669
 epoch: 63, train_loss: 0.5221, test_loss: 0.9093, test_f1: 0.6427
 epoch: 64, train_loss: 0.5205, test_loss: 0.8608, test_f1: 0.6517
 epoch: 65, train_loss: 0.5178, test_loss: 0.8684, test_f1: 0.6646
 epoch: 66, train_loss: 0.5266, test_loss: 0.8465, test_f1: 0.6725
 epoch: 67, train_loss: 0.5003, test_loss: 0.9129, test_f1: 0.6584
 epoch: 68, train_loss: 0.5157, test_loss: 0.8669, test_f1: 0.6517
 epoch: 69, train_loss: 0.5164, test_loss: 0.9097, test_f1: 0.6532
 epoch: 70, train_loss: 0.5340, test_loss: 0.8703, test_f1: 0.6575
 epoch: 71, train_loss: 0.5254, test_loss: 0.9352, test_f1: 0.6502
 epoch: 72, train_loss: 0.5084, test_loss: 0.9551, test_f1: 0.6437
 epoch: 73, train_loss: 0.5007, test_loss: 0.9681, test_f1: 0.6477
 epoch: 74, train_loss: 0.5061, test_loss: 0.9312, test_f1: 0.6625
 epoch: 75, train_loss: 0.4780, test_loss: 0.9140, test_f1: 0.6666
 epoch: 76, train_loss: 0.4894, test_loss: 0.9052, test_f1: 0.6640
 epoch: 77, train_loss: 0.5022, test_loss: 0.8940, test_f1: 0.6715
 epoch: 78, train_loss: 0.4993, test_loss: 0.9629, test_f1: 0.6473
 epoch: 79, train_loss: 0.5014, test_loss: 0.9555, test_f1: 0.6655
 epoch: 80, train_loss: 0.4934, test_loss: 0.9478, test_f1: 0.6489
 epoch: 81, train_loss: 0.4969, test_loss: 0.9733, test_f1: 0.6475
 epoch: 82, train_loss: 0.4794, test_loss: 0.8855, test_f1: 0.6903
 epoch: 83, train_loss: 0.4776, test_loss: 0.9473, test_f1: 0.6529
 epoch: 84, train_loss: 0.4751, test_loss: 0.9680, test_f1: 0.6524
 epoch: 85, train_loss: 0.4826, test_loss: 1.0347, test_f1: 0.6476
 epoch: 86, train_loss: 0.4821, test_loss: 0.9987, test_f1: 0.6635
 epoch: 87, train_loss: 0.4857, test_loss: 0.9796, test_f1: 0.6654
 epoch: 88, train_loss: 0.4688, test_loss: 0.9773, test_f1: 0.6558
 epoch: 89, train_loss: 0.4889, test_loss: 0.9455, test_f1: 0.6726
 epoch: 90, train_loss: 0.4679, test_loss: 0.9353, test_f1: 0.6794
 epoch: 91, train_loss: 0.4620, test_loss: 0.9599, test_f1: 0.6649
 epoch: 92, train_loss: 0.4608, test_loss: 1.0056, test_f1: 0.6520
 epoch: 93, train_loss: 0.4785, test_loss: 0.9872, test_f1: 0.6648
 epoch: 94, train_loss: 0.4631, test_loss: 0.9879, test_f1: 0.6482
 epoch: 95, train_loss: 0.4556, test_loss: 0.9925, test_f1: 0.6793
 epoch: 96, train_loss: 0.4415, test_loss: 1.0443, test_f1: 0.6544
 epoch: 97, train_loss: 0.4553, test_loss: 0.9445, test_f1: 0.6649
 epoch: 98, train_loss: 0.4551, test_loss: 0.9741, test_f1: 0.6700
 epoch: 99, train_loss: 0.4448, test_loss: 0.9989, test_f1: 0.6494
##################ITERATION #7 ****************************************
 epoch: 0, train_loss: 1.4615, test_loss: 1.2597, test_f1: 0.3372
 epoch: 1, train_loss: 1.0833, test_loss: 1.0194, test_f1: 0.4525
 epoch: 2, train_loss: 1.0384, test_loss: 0.9591, test_f1: 0.4895
 epoch: 3, train_loss: 1.0133, test_loss: 0.9395, test_f1: 0.5003
 epoch: 4, train_loss: 0.9664, test_loss: 0.9284, test_f1: 0.5062
 epoch: 5, train_loss: 0.9683, test_loss: 0.9263, test_f1: 0.5016
 epoch: 6, train_loss: 0.9343, test_loss: 0.9178, test_f1: 0.4905
 epoch: 7, train_loss: 0.9228, test_loss: 0.8902, test_f1: 0.4932
 epoch: 8, train_loss: 0.9184, test_loss: 0.8920, test_f1: 0.5184
 epoch: 9, train_loss: 0.8907, test_loss: 0.8902, test_f1: 0.5314
 epoch: 10, train_loss: 0.8743, test_loss: 0.8682, test_f1: 0.5332
 epoch: 11, train_loss: 0.8814, test_loss: 0.8755, test_f1: 0.5208
 epoch: 12, train_loss: 0.8548, test_loss: 0.8653, test_f1: 0.5360
 epoch: 13, train_loss: 0.8582, test_loss: 0.8745, test_f1: 0.5404
 epoch: 14, train_loss: 0.8424, test_loss: 0.8538, test_f1: 0.5280
 epoch: 15, train_loss: 0.8295, test_loss: 0.8335, test_f1: 0.5216
 epoch: 16, train_loss: 0.8383, test_loss: 0.8182, test_f1: 0.5586
 epoch: 17, train_loss: 0.8163, test_loss: 0.8342, test_f1: 0.5384
 epoch: 18, train_loss: 0.8073, test_loss: 0.8235, test_f1: 0.5872
 epoch: 19, train_loss: 0.8103, test_loss: 0.8189, test_f1: 0.5916
 epoch: 20, train_loss: 0.7955, test_loss: 0.8255, test_f1: 0.5879
 epoch: 21, train_loss: 0.7738, test_loss: 0.8126, test_f1: 0.5755
 epoch: 22, train_loss: 0.7845, test_loss: 0.7882, test_f1: 0.5739
 epoch: 23, train_loss: 0.7750, test_loss: 0.8247, test_f1: 0.5630
 epoch: 24, train_loss: 0.7751, test_loss: 0.8086, test_f1: 0.5772
 epoch: 25, train_loss: 0.7658, test_loss: 0.9446, test_f1: 0.5329
 epoch: 26, train_loss: 0.7366, test_loss: 0.7808, test_f1: 0.6169
 epoch: 27, train_loss: 0.7489, test_loss: 0.7552, test_f1: 0.6469
 epoch: 28, train_loss: 0.7514, test_loss: 0.7910, test_f1: 0.5769
 epoch: 29, train_loss: 0.7384, test_loss: 0.7923, test_f1: 0.6054
 epoch: 30, train_loss: 0.7408, test_loss: 0.7868, test_f1: 0.6017
 epoch: 31, train_loss: 0.7352, test_loss: 0.7959, test_f1: 0.5829
 epoch: 32, train_loss: 0.7290, test_loss: 0.7770, test_f1: 0.6381
 epoch: 33, train_loss: 0.7291, test_loss: 0.7645, test_f1: 0.6332
 epoch: 34, train_loss: 0.7131, test_loss: 0.7366, test_f1: 0.6168
 epoch: 35, train_loss: 0.6939, test_loss: 0.7540, test_f1: 0.6434
 epoch: 36, train_loss: 0.6999, test_loss: 0.7565, test_f1: 0.6091
 epoch: 37, train_loss: 0.6994, test_loss: 0.7870, test_f1: 0.5991
 epoch: 38, train_loss: 0.6861, test_loss: 0.7433, test_f1: 0.6306
 epoch: 39, train_loss: 0.6841, test_loss: 0.7558, test_f1: 0.6358
 epoch: 40, train_loss: 0.6773, test_loss: 0.8056, test_f1: 0.6202
 epoch: 41, train_loss: 0.6802, test_loss: 0.7502, test_f1: 0.6597
 epoch: 42, train_loss: 0.6864, test_loss: 0.7656, test_f1: 0.6280
 epoch: 43, train_loss: 0.6621, test_loss: 0.7658, test_f1: 0.6262
 epoch: 44, train_loss: 0.6488, test_loss: 0.7835, test_f1: 0.6151
 epoch: 45, train_loss: 0.6534, test_loss: 0.8158, test_f1: 0.6263
 epoch: 46, train_loss: 0.6637, test_loss: 0.7338, test_f1: 0.6599
 epoch: 47, train_loss: 0.6542, test_loss: 0.7607, test_f1: 0.6225
 epoch: 48, train_loss: 0.6660, test_loss: 0.8035, test_f1: 0.6136
 epoch: 49, train_loss: 0.6559, test_loss: 0.7924, test_f1: 0.6357
 epoch: 50, train_loss: 0.6364, test_loss: 0.7893, test_f1: 0.6108
 epoch: 51, train_loss: 0.6221, test_loss: 0.7788, test_f1: 0.6505
 epoch: 52, train_loss: 0.6253, test_loss: 0.7624, test_f1: 0.6355
 epoch: 53, train_loss: 0.6081, test_loss: 0.7906, test_f1: 0.6187
 epoch: 54, train_loss: 0.5952, test_loss: 0.7696, test_f1: 0.6553
 epoch: 55, train_loss: 0.5942, test_loss: 0.7734, test_f1: 0.6471
 epoch: 56, train_loss: 0.5997, test_loss: 0.7715, test_f1: 0.6432
 epoch: 57, train_loss: 0.5971, test_loss: 0.8039, test_f1: 0.6512
 epoch: 58, train_loss: 0.5992, test_loss: 0.7973, test_f1: 0.6569
 epoch: 59, train_loss: 0.5898, test_loss: 0.7889, test_f1: 0.6394
 epoch: 60, train_loss: 0.5845, test_loss: 0.7817, test_f1: 0.6532
 epoch: 61, train_loss: 0.5984, test_loss: 0.7770, test_f1: 0.6591
 epoch: 62, train_loss: 0.5753, test_loss: 0.7946, test_f1: 0.6517
 epoch: 63, train_loss: 0.5799, test_loss: 0.7897, test_f1: 0.6497
 epoch: 64, train_loss: 0.6050, test_loss: 0.7721, test_f1: 0.6578
 epoch: 65, train_loss: 0.5774, test_loss: 0.8065, test_f1: 0.6385
 epoch: 66, train_loss: 0.5693, test_loss: 0.7665, test_f1: 0.6746
 epoch: 67, train_loss: 0.5828, test_loss: 0.7765, test_f1: 0.6573
 epoch: 68, train_loss: 0.5644, test_loss: 0.7891, test_f1: 0.6631
 epoch: 69, train_loss: 0.5562, test_loss: 0.7776, test_f1: 0.6486
 epoch: 70, train_loss: 0.5602, test_loss: 0.7778, test_f1: 0.6595
 epoch: 71, train_loss: 0.5681, test_loss: 0.8420, test_f1: 0.6429
 epoch: 72, train_loss: 0.5644, test_loss: 0.7999, test_f1: 0.6395
 epoch: 73, train_loss: 0.5514, test_loss: 0.8167, test_f1: 0.6493
 epoch: 74, train_loss: 0.5544, test_loss: 0.8130, test_f1: 0.6588
 epoch: 75, train_loss: 0.5451, test_loss: 0.8558, test_f1: 0.6371
 epoch: 76, train_loss: 0.5522, test_loss: 0.8259, test_f1: 0.6412
 epoch: 77, train_loss: 0.5500, test_loss: 0.8275, test_f1: 0.6539
 epoch: 78, train_loss: 0.5565, test_loss: 0.7955, test_f1: 0.6540
 epoch: 79, train_loss: 0.5564, test_loss: 0.8526, test_f1: 0.6371
 epoch: 80, train_loss: 0.5450, test_loss: 0.8294, test_f1: 0.6504
 epoch: 81, train_loss: 0.5319, test_loss: 0.8208, test_f1: 0.6408
 epoch: 82, train_loss: 0.5362, test_loss: 0.8293, test_f1: 0.6752
 epoch: 83, train_loss: 0.5310, test_loss: 0.7853, test_f1: 0.6581
 epoch: 84, train_loss: 0.5457, test_loss: 0.8311, test_f1: 0.6480
 epoch: 85, train_loss: 0.5463, test_loss: 0.8119, test_f1: 0.6360
 epoch: 86, train_loss: 0.5328, test_loss: 0.7751, test_f1: 0.6531
 epoch: 87, train_loss: 0.5263, test_loss: 0.8064, test_f1: 0.6569
 epoch: 88, train_loss: 0.5332, test_loss: 0.8318, test_f1: 0.6645
 epoch: 89, train_loss: 0.5239, test_loss: 0.8180, test_f1: 0.6649
 epoch: 90, train_loss: 0.5283, test_loss: 0.8491, test_f1: 0.6427
 epoch: 91, train_loss: 0.5315, test_loss: 0.8620, test_f1: 0.6387
 epoch: 92, train_loss: 0.5234, test_loss: 0.8158, test_f1: 0.6335
 epoch: 93, train_loss: 0.5240, test_loss: 0.8094, test_f1: 0.6516
 epoch: 94, train_loss: 0.5262, test_loss: 0.8471, test_f1: 0.6652
 epoch: 95, train_loss: 0.5128, test_loss: 0.8544, test_f1: 0.6356
 epoch: 96, train_loss: 0.5125, test_loss: 0.8269, test_f1: 0.6515
 epoch: 97, train_loss: 0.5127, test_loss: 0.8664, test_f1: 0.6620
 epoch: 98, train_loss: 0.4908, test_loss: 0.9117, test_f1: 0.6374
 epoch: 99, train_loss: 0.5037, test_loss: 0.8713, test_f1: 0.6522
##################ITERATION #8 ****************************************
 epoch: 0, train_loss: 1.3043, test_loss: 1.3696, test_f1: 0.3449
 epoch: 1, train_loss: 1.0471, test_loss: 0.9984, test_f1: 0.4474
 epoch: 2, train_loss: 1.0073, test_loss: 0.9596, test_f1: 0.5208
 epoch: 3, train_loss: 0.9695, test_loss: 0.9136, test_f1: 0.5142
 epoch: 4, train_loss: 0.9571, test_loss: 0.9727, test_f1: 0.4778
 epoch: 5, train_loss: 0.9378, test_loss: 0.9805, test_f1: 0.4778
 epoch: 6, train_loss: 0.9276, test_loss: 0.9385, test_f1: 0.4767
 epoch: 7, train_loss: 0.9211, test_loss: 0.9343, test_f1: 0.4900
 epoch: 8, train_loss: 0.8928, test_loss: 0.9265, test_f1: 0.5261
 epoch: 9, train_loss: 0.8782, test_loss: 0.9043, test_f1: 0.5082
 epoch: 10, train_loss: 0.8540, test_loss: 0.8931, test_f1: 0.5245
 epoch: 11, train_loss: 0.8511, test_loss: 0.8268, test_f1: 0.5726
 epoch: 12, train_loss: 0.8416, test_loss: 0.8585, test_f1: 0.5803
 epoch: 13, train_loss: 0.8270, test_loss: 0.8607, test_f1: 0.5805
 epoch: 14, train_loss: 0.8209, test_loss: 0.7729, test_f1: 0.5987
 epoch: 15, train_loss: 0.8135, test_loss: 0.8815, test_f1: 0.6061
 epoch: 16, train_loss: 0.7975, test_loss: 0.8406, test_f1: 0.6021
 epoch: 17, train_loss: 0.7925, test_loss: 0.8783, test_f1: 0.5890
 epoch: 18, train_loss: 0.7971, test_loss: 0.8893, test_f1: 0.6017
 epoch: 19, train_loss: 0.7829, test_loss: 0.8326, test_f1: 0.5904
 epoch: 20, train_loss: 0.7772, test_loss: 0.9080, test_f1: 0.5885
 epoch: 21, train_loss: 0.7592, test_loss: 0.9046, test_f1: 0.6134
 epoch: 22, train_loss: 0.7549, test_loss: 0.8310, test_f1: 0.6328
 epoch: 23, train_loss: 0.7641, test_loss: 0.8922, test_f1: 0.6194
 epoch: 24, train_loss: 0.7359, test_loss: 0.9075, test_f1: 0.6282
 epoch: 25, train_loss: 0.7495, test_loss: 0.9252, test_f1: 0.5953
 epoch: 26, train_loss: 0.7377, test_loss: 0.7764, test_f1: 0.6503
 epoch: 27, train_loss: 0.7207, test_loss: 0.7803, test_f1: 0.6169
 epoch: 28, train_loss: 0.7292, test_loss: 0.8830, test_f1: 0.6305
 epoch: 29, train_loss: 0.7048, test_loss: 0.8476, test_f1: 0.6486
 epoch: 30, train_loss: 0.7109, test_loss: 0.7979, test_f1: 0.6294
 epoch: 31, train_loss: 0.7119, test_loss: 0.7517, test_f1: 0.6591
 epoch: 32, train_loss: 0.7030, test_loss: 0.7655, test_f1: 0.6621
 epoch: 33, train_loss: 0.6979, test_loss: 0.8131, test_f1: 0.6315
 epoch: 34, train_loss: 0.7111, test_loss: 0.7816, test_f1: 0.6350
 epoch: 35, train_loss: 0.6986, test_loss: 0.8199, test_f1: 0.6558
 epoch: 36, train_loss: 0.6870, test_loss: 0.8558, test_f1: 0.6491
 epoch: 37, train_loss: 0.6773, test_loss: 0.7393, test_f1: 0.6606
 epoch: 38, train_loss: 0.6908, test_loss: 0.7213, test_f1: 0.6620
 epoch: 39, train_loss: 0.6785, test_loss: 0.8446, test_f1: 0.6608
 epoch: 40, train_loss: 0.6616, test_loss: 0.8300, test_f1: 0.6626
 epoch: 41, train_loss: 0.6583, test_loss: 0.8040, test_f1: 0.6791
 epoch: 42, train_loss: 0.6575, test_loss: 0.9209, test_f1: 0.6289
 epoch: 43, train_loss: 0.6696, test_loss: 0.9715, test_f1: 0.6051
 epoch: 44, train_loss: 0.6584, test_loss: 0.7586, test_f1: 0.6591
 epoch: 45, train_loss: 0.6438, test_loss: 0.7590, test_f1: 0.6384
 epoch: 46, train_loss: 0.6520, test_loss: 0.8068, test_f1: 0.6590
 epoch: 47, train_loss: 0.6566, test_loss: 0.7867, test_f1: 0.6448
 epoch: 48, train_loss: 0.6422, test_loss: 0.8201, test_f1: 0.6341
 epoch: 49, train_loss: 0.6523, test_loss: 0.8313, test_f1: 0.6286
 epoch: 50, train_loss: 0.6376, test_loss: 0.8610, test_f1: 0.6490
 epoch: 51, train_loss: 0.6138, test_loss: 0.8662, test_f1: 0.6452
 epoch: 52, train_loss: 0.5903, test_loss: 0.7950, test_f1: 0.6504
 epoch: 53, train_loss: 0.5958, test_loss: 0.7900, test_f1: 0.6567
 epoch: 54, train_loss: 0.5953, test_loss: 0.7321, test_f1: 0.6615
 epoch: 55, train_loss: 0.5812, test_loss: 0.7663, test_f1: 0.6760
 epoch: 56, train_loss: 0.5871, test_loss: 0.8039, test_f1: 0.6518
 epoch: 57, train_loss: 0.5782, test_loss: 0.8692, test_f1: 0.6316
 epoch: 58, train_loss: 0.5729, test_loss: 0.7597, test_f1: 0.6602
 epoch: 59, train_loss: 0.5874, test_loss: 0.7384, test_f1: 0.6631
 epoch: 60, train_loss: 0.5831, test_loss: 0.8414, test_f1: 0.6480
 epoch: 61, train_loss: 0.5646, test_loss: 0.7987, test_f1: 0.6678
 epoch: 62, train_loss: 0.5649, test_loss: 0.8324, test_f1: 0.6830
 epoch: 63, train_loss: 0.5556, test_loss: 0.8423, test_f1: 0.6778
 epoch: 64, train_loss: 0.5538, test_loss: 0.8407, test_f1: 0.6371
 epoch: 65, train_loss: 0.5600, test_loss: 0.8713, test_f1: 0.6546
 epoch: 66, train_loss: 0.5473, test_loss: 0.8992, test_f1: 0.6501
 epoch: 67, train_loss: 0.5599, test_loss: 0.8024, test_f1: 0.6555
 epoch: 68, train_loss: 0.5531, test_loss: 0.9095, test_f1: 0.6684
 epoch: 69, train_loss: 0.5452, test_loss: 0.8225, test_f1: 0.6622
 epoch: 70, train_loss: 0.5455, test_loss: 0.8746, test_f1: 0.6577
 epoch: 71, train_loss: 0.5365, test_loss: 0.9420, test_f1: 0.6415
 epoch: 72, train_loss: 0.5432, test_loss: 0.9090, test_f1: 0.6548
 epoch: 73, train_loss: 0.5462, test_loss: 0.8538, test_f1: 0.6691
 epoch: 74, train_loss: 0.5311, test_loss: 0.9014, test_f1: 0.6758
 epoch: 75, train_loss: 0.5297, test_loss: 0.9304, test_f1: 0.6725
 epoch: 76, train_loss: 0.5308, test_loss: 0.8933, test_f1: 0.6617
 epoch: 77, train_loss: 0.5288, test_loss: 0.9575, test_f1: 0.6615
 epoch: 78, train_loss: 0.5128, test_loss: 0.9094, test_f1: 0.6503
 epoch: 79, train_loss: 0.5304, test_loss: 0.9113, test_f1: 0.6466
 epoch: 80, train_loss: 0.5331, test_loss: 0.8910, test_f1: 0.6577
 epoch: 81, train_loss: 0.5280, test_loss: 0.8567, test_f1: 0.6774
 epoch: 82, train_loss: 0.5284, test_loss: 0.9325, test_f1: 0.6689
 epoch: 83, train_loss: 0.5256, test_loss: 0.8909, test_f1: 0.6561
 epoch: 84, train_loss: 0.5154, test_loss: 0.8630, test_f1: 0.6609
 epoch: 85, train_loss: 0.5149, test_loss: 0.9774, test_f1: 0.6414
 epoch: 86, train_loss: 0.4987, test_loss: 0.9150, test_f1: 0.6728
 epoch: 87, train_loss: 0.5127, test_loss: 0.9395, test_f1: 0.6420
 epoch: 88, train_loss: 0.5059, test_loss: 0.9431, test_f1: 0.6465
 epoch: 89, train_loss: 0.5295, test_loss: 0.8756, test_f1: 0.6720
 epoch: 90, train_loss: 0.5218, test_loss: 0.9531, test_f1: 0.6478
 epoch: 91, train_loss: 0.5047, test_loss: 0.9673, test_f1: 0.6731
 epoch: 92, train_loss: 0.4935, test_loss: 0.9662, test_f1: 0.6610
 epoch: 93, train_loss: 0.4954, test_loss: 1.0186, test_f1: 0.6783
 epoch: 94, train_loss: 0.5191, test_loss: 0.9578, test_f1: 0.6590
 epoch: 95, train_loss: 0.4942, test_loss: 0.9342, test_f1: 0.6609
 epoch: 96, train_loss: 0.5041, test_loss: 0.9118, test_f1: 0.6488
 epoch: 97, train_loss: 0.5020, test_loss: 0.9593, test_f1: 0.6402
 epoch: 98, train_loss: 0.5127, test_loss: 0.9886, test_f1: 0.6552
 epoch: 99, train_loss: 0.4838, test_loss: 0.9109, test_f1: 0.6818
##################ITERATION #9 ****************************************
 epoch: 0, train_loss: 1.3260, test_loss: 1.1238, test_f1: 0.4388
 epoch: 1, train_loss: 1.0466, test_loss: 0.9707, test_f1: 0.5000
 epoch: 2, train_loss: 0.9943, test_loss: 0.9834, test_f1: 0.4886
 epoch: 3, train_loss: 0.9765, test_loss: 0.9853, test_f1: 0.4943
 epoch: 4, train_loss: 0.9666, test_loss: 0.9786, test_f1: 0.4795
 epoch: 5, train_loss: 0.9361, test_loss: 0.9563, test_f1: 0.5196
 epoch: 6, train_loss: 0.9380, test_loss: 0.9450, test_f1: 0.5169
 epoch: 7, train_loss: 0.9133, test_loss: 0.8975, test_f1: 0.5347
 epoch: 8, train_loss: 0.9063, test_loss: 0.9462, test_f1: 0.5519
 epoch: 9, train_loss: 0.8863, test_loss: 0.9305, test_f1: 0.5580
 epoch: 10, train_loss: 0.8743, test_loss: 0.9386, test_f1: 0.5515
 epoch: 11, train_loss: 0.8630, test_loss: 0.9533, test_f1: 0.5261
 epoch: 12, train_loss: 0.8525, test_loss: 0.9486, test_f1: 0.5389
 epoch: 13, train_loss: 0.8686, test_loss: 0.9009, test_f1: 0.5644
 epoch: 14, train_loss: 0.8436, test_loss: 0.8932, test_f1: 0.5160
 epoch: 15, train_loss: 0.8437, test_loss: 0.8948, test_f1: 0.5666
 epoch: 16, train_loss: 0.8198, test_loss: 0.9193, test_f1: 0.5400
 epoch: 17, train_loss: 0.8085, test_loss: 0.8913, test_f1: 0.5612
 epoch: 18, train_loss: 0.8098, test_loss: 0.8450, test_f1: 0.5924
 epoch: 19, train_loss: 0.7998, test_loss: 0.8655, test_f1: 0.6090
 epoch: 20, train_loss: 0.8023, test_loss: 0.8567, test_f1: 0.6018
 epoch: 21, train_loss: 0.7819, test_loss: 0.8652, test_f1: 0.5823
 epoch: 22, train_loss: 0.7848, test_loss: 0.8611, test_f1: 0.5896
 epoch: 23, train_loss: 0.7798, test_loss: 0.8784, test_f1: 0.6012
 epoch: 24, train_loss: 0.7649, test_loss: 0.8718, test_f1: 0.5922
 epoch: 25, train_loss: 0.7845, test_loss: 0.8935, test_f1: 0.5825
 epoch: 26, train_loss: 0.7638, test_loss: 0.8633, test_f1: 0.5690
 epoch: 27, train_loss: 0.7672, test_loss: 0.8644, test_f1: 0.6006
 epoch: 28, train_loss: 0.7455, test_loss: 0.8397, test_f1: 0.6331
 epoch: 29, train_loss: 0.7459, test_loss: 0.8213, test_f1: 0.5975
 epoch: 30, train_loss: 0.7445, test_loss: 0.8424, test_f1: 0.6107
 epoch: 31, train_loss: 0.7289, test_loss: 0.7956, test_f1: 0.6435
 epoch: 32, train_loss: 0.7163, test_loss: 0.8098, test_f1: 0.6109
 epoch: 33, train_loss: 0.7265, test_loss: 0.8428, test_f1: 0.6223
 epoch: 34, train_loss: 0.7186, test_loss: 0.8218, test_f1: 0.6160
 epoch: 35, train_loss: 0.7056, test_loss: 0.7887, test_f1: 0.6425
 epoch: 36, train_loss: 0.7087, test_loss: 0.7947, test_f1: 0.6449
 epoch: 37, train_loss: 0.6952, test_loss: 0.8263, test_f1: 0.6454
 epoch: 38, train_loss: 0.6862, test_loss: 0.8220, test_f1: 0.6309
 epoch: 39, train_loss: 0.6849, test_loss: 0.8030, test_f1: 0.6597
 epoch: 40, train_loss: 0.6793, test_loss: 0.8755, test_f1: 0.6476
 epoch: 41, train_loss: 0.6846, test_loss: 0.9001, test_f1: 0.6088
 epoch: 42, train_loss: 0.6525, test_loss: 0.7979, test_f1: 0.6738
 epoch: 43, train_loss: 0.6644, test_loss: 0.8078, test_f1: 0.6734
 epoch: 44, train_loss: 0.6733, test_loss: 0.8540, test_f1: 0.6440
 epoch: 45, train_loss: 0.6538, test_loss: 0.8367, test_f1: 0.6634
 epoch: 46, train_loss: 0.6603, test_loss: 0.7995, test_f1: 0.6442
 epoch: 47, train_loss: 0.6489, test_loss: 0.9733, test_f1: 0.5854
 epoch: 48, train_loss: 0.6586, test_loss: 0.8607, test_f1: 0.6522
 epoch: 49, train_loss: 0.6518, test_loss: 0.8849, test_f1: 0.6374
 epoch: 50, train_loss: 0.6291, test_loss: 0.7969, test_f1: 0.6662
 epoch: 51, train_loss: 0.6129, test_loss: 0.8203, test_f1: 0.6441
 epoch: 52, train_loss: 0.5996, test_loss: 0.7891, test_f1: 0.6486
 epoch: 53, train_loss: 0.5991, test_loss: 0.8123, test_f1: 0.6788
 epoch: 54, train_loss: 0.6047, test_loss: 0.8318, test_f1: 0.6540
 epoch: 55, train_loss: 0.5899, test_loss: 0.8592, test_f1: 0.6453
 epoch: 56, train_loss: 0.5785, test_loss: 0.8379, test_f1: 0.6683
 epoch: 57, train_loss: 0.5833, test_loss: 0.7884, test_f1: 0.6660
 epoch: 58, train_loss: 0.5677, test_loss: 0.8821, test_f1: 0.6621
 epoch: 59, train_loss: 0.5730, test_loss: 0.9297, test_f1: 0.6613
 epoch: 60, train_loss: 0.5615, test_loss: 0.8656, test_f1: 0.6800
 epoch: 61, train_loss: 0.5651, test_loss: 0.8603, test_f1: 0.6616
 epoch: 62, train_loss: 0.5695, test_loss: 0.9007, test_f1: 0.6548
 epoch: 63, train_loss: 0.5712, test_loss: 0.9310, test_f1: 0.6412
 epoch: 64, train_loss: 0.5603, test_loss: 0.9276, test_f1: 0.6528
 epoch: 65, train_loss: 0.5508, test_loss: 0.9065, test_f1: 0.6601
 epoch: 66, train_loss: 0.5587, test_loss: 0.8972, test_f1: 0.6867
 epoch: 67, train_loss: 0.5553, test_loss: 0.9689, test_f1: 0.6583
 epoch: 68, train_loss: 0.5536, test_loss: 0.8937, test_f1: 0.6529
 epoch: 69, train_loss: 0.5377, test_loss: 0.9134, test_f1: 0.6647
 epoch: 70, train_loss: 0.5622, test_loss: 0.9098, test_f1: 0.6571
 epoch: 71, train_loss: 0.5575, test_loss: 0.9041, test_f1: 0.6515
 epoch: 72, train_loss: 0.5401, test_loss: 0.9474, test_f1: 0.6486
 epoch: 73, train_loss: 0.5440, test_loss: 0.8865, test_f1: 0.6586
 epoch: 74, train_loss: 0.5450, test_loss: 0.9722, test_f1: 0.6487
 epoch: 75, train_loss: 0.5248, test_loss: 0.9131, test_f1: 0.6700
 epoch: 76, train_loss: 0.5323, test_loss: 0.9736, test_f1: 0.6451
 epoch: 77, train_loss: 0.5401, test_loss: 0.8967, test_f1: 0.6671
 epoch: 78, train_loss: 0.5316, test_loss: 0.9355, test_f1: 0.6635
 epoch: 79, train_loss: 0.5019, test_loss: 1.0054, test_f1: 0.6464
 epoch: 80, train_loss: 0.5183, test_loss: 1.0020, test_f1: 0.6647
 epoch: 81, train_loss: 0.5044, test_loss: 0.9526, test_f1: 0.6518
 epoch: 82, train_loss: 0.5112, test_loss: 0.9745, test_f1: 0.6779
 epoch: 83, train_loss: 0.5140, test_loss: 0.9514, test_f1: 0.6448
 epoch: 84, train_loss: 0.5023, test_loss: 0.9749, test_f1: 0.6577
 epoch: 85, train_loss: 0.5051, test_loss: 0.9504, test_f1: 0.6813
 epoch: 86, train_loss: 0.5033, test_loss: 1.0318, test_f1: 0.6518
 epoch: 87, train_loss: 0.5078, test_loss: 0.9729, test_f1: 0.6644
 epoch: 88, train_loss: 0.4953, test_loss: 0.9918, test_f1: 0.6415
 epoch: 89, train_loss: 0.5114, test_loss: 1.0628, test_f1: 0.6432
 epoch: 90, train_loss: 0.5173, test_loss: 1.0726, test_f1: 0.6511
 epoch: 91, train_loss: 0.4919, test_loss: 1.0098, test_f1: 0.6592
 epoch: 92, train_loss: 0.5102, test_loss: 1.0423, test_f1: 0.6486
 epoch: 93, train_loss: 0.4960, test_loss: 1.0216, test_f1: 0.6723
 epoch: 94, train_loss: 0.4920, test_loss: 1.0692, test_f1: 0.6618
 epoch: 95, train_loss: 0.5136, test_loss: 1.0757, test_f1: 0.6635
 epoch: 96, train_loss: 0.5027, test_loss: 1.0751, test_f1: 0.6837
 epoch: 97, train_loss: 0.4955, test_loss: 1.0596, test_f1: 0.6525
 epoch: 98, train_loss: 0.4912, test_loss: 1.1588, test_f1: 0.6515
 epoch: 99, train_loss: 0.4870, test_loss: 1.0586, test_f1: 0.6597

Training completed in 956.65 seconds
Best F1: 0.7069 at epoch 96
Mean F1 across iterations: 0.6826  0.0162
========================FINAL RESULTS================================
FEGIN weighted F1: 0.7069  0.0162
python main.py --data ltspice_examples --representation component_pin_net --model FEGIN --layers 4 --hiddens 32 --batch_size 64 --lr 0.001 --emb_size 512 --epochs 100 --save_appendix component_pin_net_L4_H32_BS64_LR0.001_E512 --no_val
-----



STDERR:
  File "main.py", line 370, in <module>
    main()
  File "main.py", line 254, in main
    dataset = dataset_class(
  File "/home/philip/projects/llm_inference_code_repo/Circuit-Completion-Using-GNNs/component_classification_with_link_prediction_head/evaluation/FEGIN/kernel/circuit_datasets.py", line 15, in __init__
    self.data, self.slices = torch.load(self.processed_paths[0])
  File "/home/philip/.local/lib/python3.8/site-packages/torch/serialization.py", line 1040, in load
    warnings.warn(
  File "/usr/lib/python3.8/warnings.py", line 109, in _showwarnmsg
    sw(msg.message, msg.category, msg.filename, msg.lineno,
  File "main.py", line 47, in warn_with_traceback
    traceback.print_stack(file=log)
/home/philip/projects/llm_inference_code_repo/Circuit-Completion-Using-GNNs/component_classification_with_link_prediction_head/evaluation/FEGIN/kernel/circuit_datasets.py:15: FutureWarning: You are using `torch.load` with `weights_only=False` (the current default value), which uses the default pickle module implicitly. It is possible to construct malicious pickle data which will execute arbitrary code during unpickling (See https://github.com/pytorch/pytorch/blob/main/SECURITY.md#untrusted-models for more details). In a future release, the default value for `weights_only` will be flipped to `True`. This limits the functions that could be executed during unpickling. Arbitrary objects will no longer be allowed to be loaded via this mode unless they are explicitly allowlisted by the user via `torch.serialization.add_safe_globals`. We recommend you start setting `weights_only=True` for any use case where you don't have full control of the loaded file. Please open an issue on GitHub for any issues related to this experimental feature.
  self.data, self.slices = torch.load(self.processed_paths[0])
