STDOUT:
Results will be saved in /home/philip/projects/llm_inference_code_repo/Circuit-Completion-Using-GNNs/component_classification_with_link_prediction_head/evaluation/FEGIN/results/model_FEGIN_dataset_ltspice_examples
Command line input: python main.py --data ltspice_examples --representation component_net --model FEGIN --layers 6 --hiddens 64 --batch_size 64 --lr 0.0001 --emb_size 512 --epochs 100 --save_appendix component_net_L6_H64_BS64_LR0.0001_E512 --no_val
 is saved.
-----
ltspice_examples - FEGIN
Using 6 layers, 64 hidden units, h = 2
Loading component_net representation dataset
ENTERED
Training FEGIN on component_net representation
Train: 3558, Test: 846
##################ITERATION #0 ****************************************
 epoch: 0, train_loss: 1.3860, test_loss: 1.3661, test_f1: 0.1128
 epoch: 1, train_loss: 1.3441, test_loss: 1.3163, test_f1: 0.3272
 epoch: 2, train_loss: 1.3001, test_loss: 1.2696, test_f1: 0.2885
 epoch: 3, train_loss: 1.2567, test_loss: 1.2292, test_f1: 0.2860
 epoch: 4, train_loss: 1.2241, test_loss: 1.2019, test_f1: 0.3051
 epoch: 5, train_loss: 1.1973, test_loss: 1.1669, test_f1: 0.3529
 epoch: 6, train_loss: 1.1758, test_loss: 1.1356, test_f1: 0.3892
 epoch: 7, train_loss: 1.1452, test_loss: 1.1132, test_f1: 0.4272
 epoch: 8, train_loss: 1.1243, test_loss: 1.0958, test_f1: 0.4606
 epoch: 9, train_loss: 1.1018, test_loss: 1.0594, test_f1: 0.4783
 epoch: 10, train_loss: 1.0837, test_loss: 1.0432, test_f1: 0.4773
 epoch: 11, train_loss: 1.0586, test_loss: 1.0139, test_f1: 0.4856
 epoch: 12, train_loss: 1.0406, test_loss: 1.0035, test_f1: 0.4864
 epoch: 13, train_loss: 1.0280, test_loss: 0.9746, test_f1: 0.5150
 epoch: 14, train_loss: 1.0018, test_loss: 0.9633, test_f1: 0.4917
 epoch: 15, train_loss: 0.9846, test_loss: 0.9428, test_f1: 0.5307
 epoch: 16, train_loss: 0.9783, test_loss: 0.9352, test_f1: 0.5047
 epoch: 17, train_loss: 0.9637, test_loss: 0.9214, test_f1: 0.5071
 epoch: 18, train_loss: 0.9503, test_loss: 0.9113, test_f1: 0.5266
 epoch: 19, train_loss: 0.9518, test_loss: 0.9054, test_f1: 0.5256
 epoch: 20, train_loss: 0.9350, test_loss: 0.8959, test_f1: 0.5186
 epoch: 21, train_loss: 0.9312, test_loss: 0.9046, test_f1: 0.5267
 epoch: 22, train_loss: 0.9138, test_loss: 0.8969, test_f1: 0.5190
 epoch: 23, train_loss: 0.9094, test_loss: 0.8914, test_f1: 0.5204
 epoch: 24, train_loss: 0.9064, test_loss: 0.8836, test_f1: 0.5373
 epoch: 25, train_loss: 0.8956, test_loss: 0.8711, test_f1: 0.5251
 epoch: 26, train_loss: 0.8856, test_loss: 0.9010, test_f1: 0.5237
 epoch: 27, train_loss: 0.8833, test_loss: 0.8910, test_f1: 0.5273
 epoch: 28, train_loss: 0.8729, test_loss: 0.8618, test_f1: 0.5328
 epoch: 29, train_loss: 0.8700, test_loss: 0.8767, test_f1: 0.5334
 epoch: 30, train_loss: 0.8595, test_loss: 0.8748, test_f1: 0.5426
 epoch: 31, train_loss: 0.8684, test_loss: 0.8802, test_f1: 0.5415
 epoch: 32, train_loss: 0.8591, test_loss: 0.8712, test_f1: 0.5425
 epoch: 33, train_loss: 0.8516, test_loss: 0.8836, test_f1: 0.5426
 epoch: 34, train_loss: 0.8443, test_loss: 0.8737, test_f1: 0.5424
 epoch: 35, train_loss: 0.8410, test_loss: 0.8740, test_f1: 0.5295
 epoch: 36, train_loss: 0.8394, test_loss: 0.8713, test_f1: 0.5245
 epoch: 37, train_loss: 0.8363, test_loss: 0.8747, test_f1: 0.5381
 epoch: 38, train_loss: 0.8363, test_loss: 0.8658, test_f1: 0.5421
 epoch: 39, train_loss: 0.8246, test_loss: 0.8719, test_f1: 0.5447
 epoch: 40, train_loss: 0.8233, test_loss: 0.8803, test_f1: 0.5490
 epoch: 41, train_loss: 0.8196, test_loss: 0.8820, test_f1: 0.5462
 epoch: 42, train_loss: 0.8092, test_loss: 0.8689, test_f1: 0.5368
 epoch: 43, train_loss: 0.8060, test_loss: 0.8907, test_f1: 0.5400
 epoch: 44, train_loss: 0.8169, test_loss: 0.8729, test_f1: 0.5673
 epoch: 45, train_loss: 0.8147, test_loss: 0.8838, test_f1: 0.5492
 epoch: 46, train_loss: 0.8068, test_loss: 0.8590, test_f1: 0.5834
 epoch: 47, train_loss: 0.8033, test_loss: 0.8836, test_f1: 0.5500
 epoch: 48, train_loss: 0.7992, test_loss: 0.9122, test_f1: 0.5391
 epoch: 49, train_loss: 0.7963, test_loss: 0.8749, test_f1: 0.5813
 epoch: 50, train_loss: 0.7863, test_loss: 0.8691, test_f1: 0.5569
 epoch: 51, train_loss: 0.7769, test_loss: 0.8808, test_f1: 0.5446
 epoch: 52, train_loss: 0.7827, test_loss: 0.8762, test_f1: 0.5461
 epoch: 53, train_loss: 0.7837, test_loss: 0.8755, test_f1: 0.5446
 epoch: 54, train_loss: 0.7716, test_loss: 0.8768, test_f1: 0.5541
 epoch: 55, train_loss: 0.7780, test_loss: 0.8833, test_f1: 0.5444
 epoch: 56, train_loss: 0.7724, test_loss: 0.8792, test_f1: 0.5429
 epoch: 57, train_loss: 0.7622, test_loss: 0.8751, test_f1: 0.5648
 epoch: 58, train_loss: 0.7704, test_loss: 0.8664, test_f1: 0.5746
 epoch: 59, train_loss: 0.7626, test_loss: 0.8838, test_f1: 0.5319
 epoch: 60, train_loss: 0.7671, test_loss: 0.8868, test_f1: 0.5507
 epoch: 61, train_loss: 0.7741, test_loss: 0.8826, test_f1: 0.5460
 epoch: 62, train_loss: 0.7598, test_loss: 0.8808, test_f1: 0.5430
 epoch: 63, train_loss: 0.7680, test_loss: 0.8865, test_f1: 0.5588
 epoch: 64, train_loss: 0.7586, test_loss: 0.8805, test_f1: 0.5422
 epoch: 65, train_loss: 0.7611, test_loss: 0.8781, test_f1: 0.5497
 epoch: 66, train_loss: 0.7540, test_loss: 0.8963, test_f1: 0.5361
 epoch: 67, train_loss: 0.7757, test_loss: 0.8784, test_f1: 0.5595
 epoch: 68, train_loss: 0.7468, test_loss: 0.8838, test_f1: 0.5488
 epoch: 69, train_loss: 0.7564, test_loss: 0.8824, test_f1: 0.5539
 epoch: 70, train_loss: 0.7470, test_loss: 0.8815, test_f1: 0.5530
 epoch: 71, train_loss: 0.7511, test_loss: 0.8679, test_f1: 0.5516
 epoch: 72, train_loss: 0.7558, test_loss: 0.8764, test_f1: 0.5616
 epoch: 73, train_loss: 0.7537, test_loss: 0.8829, test_f1: 0.5655
 epoch: 74, train_loss: 0.7652, test_loss: 0.8843, test_f1: 0.5653
 epoch: 75, train_loss: 0.7557, test_loss: 0.8725, test_f1: 0.5779
 epoch: 76, train_loss: 0.7578, test_loss: 0.8725, test_f1: 0.5605
 epoch: 77, train_loss: 0.7490, test_loss: 0.8809, test_f1: 0.5694
 epoch: 78, train_loss: 0.7544, test_loss: 0.8871, test_f1: 0.5606
 epoch: 79, train_loss: 0.7595, test_loss: 0.9041, test_f1: 0.5444
 epoch: 80, train_loss: 0.7372, test_loss: 0.8933, test_f1: 0.5697
 epoch: 81, train_loss: 0.7446, test_loss: 0.8869, test_f1: 0.5557
 epoch: 82, train_loss: 0.7417, test_loss: 0.8667, test_f1: 0.5605
 epoch: 83, train_loss: 0.7396, test_loss: 0.8786, test_f1: 0.5637
 epoch: 84, train_loss: 0.7480, test_loss: 0.8917, test_f1: 0.5804
 epoch: 85, train_loss: 0.7396, test_loss: 0.8825, test_f1: 0.5552
 epoch: 86, train_loss: 0.7396, test_loss: 0.8977, test_f1: 0.5661
 epoch: 87, train_loss: 0.7303, test_loss: 0.8996, test_f1: 0.5807
 epoch: 88, train_loss: 0.7343, test_loss: 0.8767, test_f1: 0.5667
 epoch: 89, train_loss: 0.7323, test_loss: 0.8928, test_f1: 0.5661
 epoch: 90, train_loss: 0.7373, test_loss: 0.8912, test_f1: 0.5556
 epoch: 91, train_loss: 0.7211, test_loss: 0.9014, test_f1: 0.5715
 epoch: 92, train_loss: 0.7389, test_loss: 0.8976, test_f1: 0.5599
 epoch: 93, train_loss: 0.7327, test_loss: 0.9069, test_f1: 0.5807
 epoch: 94, train_loss: 0.7257, test_loss: 0.8941, test_f1: 0.5849
 epoch: 95, train_loss: 0.7401, test_loss: 0.8934, test_f1: 0.5910
 epoch: 96, train_loss: 0.7254, test_loss: 0.8755, test_f1: 0.5626
 epoch: 97, train_loss: 0.7262, test_loss: 0.9206, test_f1: 0.5877
 epoch: 98, train_loss: 0.7258, test_loss: 0.8932, test_f1: 0.5876
 epoch: 99, train_loss: 0.7255, test_loss: 0.9048, test_f1: 0.5663
##################ITERATION #1 ****************************************
 epoch: 0, train_loss: 1.3123, test_loss: 1.2870, test_f1: 0.3025
 epoch: 1, train_loss: 1.2361, test_loss: 1.1870, test_f1: 0.4017
 epoch: 2, train_loss: 1.1996, test_loss: 1.1467, test_f1: 0.4296
 epoch: 3, train_loss: 1.1647, test_loss: 1.1020, test_f1: 0.4499
 epoch: 4, train_loss: 1.1213, test_loss: 1.0655, test_f1: 0.4650
 epoch: 5, train_loss: 1.0907, test_loss: 1.0198, test_f1: 0.4773
 epoch: 6, train_loss: 1.0637, test_loss: 0.9861, test_f1: 0.4718
 epoch: 7, train_loss: 1.0376, test_loss: 0.9574, test_f1: 0.4966
 epoch: 8, train_loss: 1.0178, test_loss: 0.9560, test_f1: 0.5036
 epoch: 9, train_loss: 1.0072, test_loss: 0.9348, test_f1: 0.5012
 epoch: 10, train_loss: 0.9780, test_loss: 0.9176, test_f1: 0.5105
 epoch: 11, train_loss: 0.9665, test_loss: 0.9147, test_f1: 0.5079
 epoch: 12, train_loss: 0.9551, test_loss: 0.9159, test_f1: 0.5044
 epoch: 13, train_loss: 0.9499, test_loss: 0.8964, test_f1: 0.5124
 epoch: 14, train_loss: 0.9318, test_loss: 0.8873, test_f1: 0.5194
 epoch: 15, train_loss: 0.9254, test_loss: 0.9104, test_f1: 0.5130
 epoch: 16, train_loss: 0.9202, test_loss: 0.8962, test_f1: 0.5145
 epoch: 17, train_loss: 0.9119, test_loss: 0.9077, test_f1: 0.5247
 epoch: 18, train_loss: 0.8940, test_loss: 0.8982, test_f1: 0.5135
 epoch: 19, train_loss: 0.8955, test_loss: 0.8930, test_f1: 0.5367
 epoch: 20, train_loss: 0.8892, test_loss: 0.8962, test_f1: 0.5246
 epoch: 21, train_loss: 0.8719, test_loss: 0.8931, test_f1: 0.5383
 epoch: 22, train_loss: 0.8737, test_loss: 0.8884, test_f1: 0.5400
 epoch: 23, train_loss: 0.8663, test_loss: 0.9007, test_f1: 0.5392
 epoch: 24, train_loss: 0.8598, test_loss: 0.8888, test_f1: 0.5376
 epoch: 25, train_loss: 0.8597, test_loss: 0.8777, test_f1: 0.5440
 epoch: 26, train_loss: 0.8508, test_loss: 0.8848, test_f1: 0.5547
 epoch: 27, train_loss: 0.8487, test_loss: 0.8854, test_f1: 0.5446
 epoch: 28, train_loss: 0.8282, test_loss: 0.8930, test_f1: 0.5608
 epoch: 29, train_loss: 0.8365, test_loss: 0.8947, test_f1: 0.5259
 epoch: 30, train_loss: 0.8309, test_loss: 0.9190, test_f1: 0.5405
 epoch: 31, train_loss: 0.8224, test_loss: 0.9010, test_f1: 0.5351
 epoch: 32, train_loss: 0.8250, test_loss: 0.9186, test_f1: 0.5307
 epoch: 33, train_loss: 0.8182, test_loss: 0.9083, test_f1: 0.5460
 epoch: 34, train_loss: 0.8075, test_loss: 0.9065, test_f1: 0.5331
 epoch: 35, train_loss: 0.8095, test_loss: 0.9224, test_f1: 0.5358
 epoch: 36, train_loss: 0.8005, test_loss: 0.8879, test_f1: 0.5543
 epoch: 37, train_loss: 0.7963, test_loss: 0.8940, test_f1: 0.5541
 epoch: 38, train_loss: 0.7993, test_loss: 0.9194, test_f1: 0.5702
 epoch: 39, train_loss: 0.7868, test_loss: 0.9183, test_f1: 0.5553
 epoch: 40, train_loss: 0.7947, test_loss: 0.8770, test_f1: 0.5676
 epoch: 41, train_loss: 0.7851, test_loss: 0.9086, test_f1: 0.5472
 epoch: 42, train_loss: 0.7829, test_loss: 0.9497, test_f1: 0.5385
 epoch: 43, train_loss: 0.7931, test_loss: 0.9393, test_f1: 0.5713
 epoch: 44, train_loss: 0.7702, test_loss: 0.9303, test_f1: 0.5416
 epoch: 45, train_loss: 0.7643, test_loss: 0.9306, test_f1: 0.5476
 epoch: 46, train_loss: 0.7673, test_loss: 0.9136, test_f1: 0.5689
 epoch: 47, train_loss: 0.7649, test_loss: 0.9349, test_f1: 0.5650
 epoch: 48, train_loss: 0.7605, test_loss: 0.9250, test_f1: 0.5637
 epoch: 49, train_loss: 0.7599, test_loss: 0.9194, test_f1: 0.5724
 epoch: 50, train_loss: 0.7542, test_loss: 0.9424, test_f1: 0.5674
 epoch: 51, train_loss: 0.7580, test_loss: 0.9278, test_f1: 0.5684
 epoch: 52, train_loss: 0.7479, test_loss: 0.9373, test_f1: 0.5701
 epoch: 53, train_loss: 0.7462, test_loss: 0.9144, test_f1: 0.5745
 epoch: 54, train_loss: 0.7382, test_loss: 0.9128, test_f1: 0.5799
 epoch: 55, train_loss: 0.7393, test_loss: 0.9368, test_f1: 0.5671
 epoch: 56, train_loss: 0.7437, test_loss: 0.9509, test_f1: 0.5684
 epoch: 57, train_loss: 0.7360, test_loss: 0.9231, test_f1: 0.5776
 epoch: 58, train_loss: 0.7392, test_loss: 0.9068, test_f1: 0.5801
 epoch: 59, train_loss: 0.7253, test_loss: 0.9199, test_f1: 0.5779
 epoch: 60, train_loss: 0.7241, test_loss: 0.9298, test_f1: 0.5782
 epoch: 61, train_loss: 0.7324, test_loss: 0.9461, test_f1: 0.5787
 epoch: 62, train_loss: 0.7290, test_loss: 0.9442, test_f1: 0.5716
 epoch: 63, train_loss: 0.7268, test_loss: 0.9530, test_f1: 0.5731
 epoch: 64, train_loss: 0.7292, test_loss: 0.9384, test_f1: 0.5705
 epoch: 65, train_loss: 0.7220, test_loss: 0.9595, test_f1: 0.5713
 epoch: 66, train_loss: 0.7278, test_loss: 0.9465, test_f1: 0.5656
 epoch: 67, train_loss: 0.7199, test_loss: 0.9414, test_f1: 0.5726
 epoch: 68, train_loss: 0.7199, test_loss: 0.9404, test_f1: 0.5637
 epoch: 69, train_loss: 0.7187, test_loss: 0.9409, test_f1: 0.5735
 epoch: 70, train_loss: 0.7054, test_loss: 0.9283, test_f1: 0.5675
 epoch: 71, train_loss: 0.7231, test_loss: 0.9557, test_f1: 0.5871
 epoch: 72, train_loss: 0.7106, test_loss: 0.9346, test_f1: 0.5735
 epoch: 73, train_loss: 0.7027, test_loss: 0.9174, test_f1: 0.5812
 epoch: 74, train_loss: 0.7095, test_loss: 0.9487, test_f1: 0.5747
 epoch: 75, train_loss: 0.7134, test_loss: 0.9445, test_f1: 0.5680
 epoch: 76, train_loss: 0.7094, test_loss: 0.9512, test_f1: 0.5748
 epoch: 77, train_loss: 0.7061, test_loss: 0.9551, test_f1: 0.5773
 epoch: 78, train_loss: 0.7044, test_loss: 0.9627, test_f1: 0.5719
 epoch: 79, train_loss: 0.7086, test_loss: 0.9654, test_f1: 0.5780
 epoch: 80, train_loss: 0.6970, test_loss: 0.9493, test_f1: 0.5743
 epoch: 81, train_loss: 0.6961, test_loss: 0.9443, test_f1: 0.5812
 epoch: 82, train_loss: 0.6948, test_loss: 0.9348, test_f1: 0.5933
 epoch: 83, train_loss: 0.6907, test_loss: 0.9522, test_f1: 0.5830
 epoch: 84, train_loss: 0.7089, test_loss: 0.9535, test_f1: 0.5791
 epoch: 85, train_loss: 0.6936, test_loss: 0.9553, test_f1: 0.5761
 epoch: 86, train_loss: 0.6891, test_loss: 0.9813, test_f1: 0.5881
 epoch: 87, train_loss: 0.6892, test_loss: 0.9672, test_f1: 0.5826
 epoch: 88, train_loss: 0.6876, test_loss: 0.9877, test_f1: 0.5764
 epoch: 89, train_loss: 0.6833, test_loss: 0.9753, test_f1: 0.5799
 epoch: 90, train_loss: 0.6849, test_loss: 0.9855, test_f1: 0.5833
 epoch: 91, train_loss: 0.6855, test_loss: 0.9816, test_f1: 0.5838
 epoch: 92, train_loss: 0.6856, test_loss: 0.9815, test_f1: 0.5757
 epoch: 93, train_loss: 0.6852, test_loss: 0.9817, test_f1: 0.5888
 epoch: 94, train_loss: 0.6792, test_loss: 0.9911, test_f1: 0.5815
 epoch: 95, train_loss: 0.6815, test_loss: 0.9844, test_f1: 0.5763
 epoch: 96, train_loss: 0.6862, test_loss: 0.9659, test_f1: 0.5950
 epoch: 97, train_loss: 0.6739, test_loss: 0.9732, test_f1: 0.5897
 epoch: 98, train_loss: 0.6703, test_loss: 0.9996, test_f1: 0.5825
 epoch: 99, train_loss: 0.6785, test_loss: 0.9986, test_f1: 0.5895
##################ITERATION #2 ****************************************
 epoch: 0, train_loss: 1.2729, test_loss: 1.2814, test_f1: 0.3118
 epoch: 1, train_loss: 1.1999, test_loss: 1.1410, test_f1: 0.4151
 epoch: 2, train_loss: 1.1633, test_loss: 1.0972, test_f1: 0.4364
 epoch: 3, train_loss: 1.1206, test_loss: 1.0662, test_f1: 0.4329
 epoch: 4, train_loss: 1.0943, test_loss: 1.0329, test_f1: 0.4379
 epoch: 5, train_loss: 1.0726, test_loss: 1.0124, test_f1: 0.4499
 epoch: 6, train_loss: 1.0610, test_loss: 0.9864, test_f1: 0.4588
 epoch: 7, train_loss: 1.0333, test_loss: 0.9723, test_f1: 0.4771
 epoch: 8, train_loss: 1.0147, test_loss: 0.9619, test_f1: 0.4918
 epoch: 9, train_loss: 0.9981, test_loss: 0.9511, test_f1: 0.4817
 epoch: 10, train_loss: 0.9803, test_loss: 0.9310, test_f1: 0.5151
 epoch: 11, train_loss: 0.9711, test_loss: 0.9446, test_f1: 0.4930
 epoch: 12, train_loss: 0.9549, test_loss: 0.9475, test_f1: 0.4988
 epoch: 13, train_loss: 0.9452, test_loss: 0.9190, test_f1: 0.5062
 epoch: 14, train_loss: 0.9318, test_loss: 0.9162, test_f1: 0.5057
 epoch: 15, train_loss: 0.9236, test_loss: 0.9189, test_f1: 0.5080
 epoch: 16, train_loss: 0.9116, test_loss: 0.9228, test_f1: 0.5006
 epoch: 17, train_loss: 0.9077, test_loss: 0.9218, test_f1: 0.5120
 epoch: 18, train_loss: 0.9016, test_loss: 0.9176, test_f1: 0.5228
 epoch: 19, train_loss: 0.8875, test_loss: 0.9026, test_f1: 0.5179
 epoch: 20, train_loss: 0.8811, test_loss: 0.9014, test_f1: 0.5301
 epoch: 21, train_loss: 0.8784, test_loss: 0.9158, test_f1: 0.5244
 epoch: 22, train_loss: 0.8900, test_loss: 0.9161, test_f1: 0.5253
 epoch: 23, train_loss: 0.8710, test_loss: 0.9123, test_f1: 0.5395
 epoch: 24, train_loss: 0.8649, test_loss: 0.9212, test_f1: 0.5269
 epoch: 25, train_loss: 0.8589, test_loss: 0.9314, test_f1: 0.5339
 epoch: 26, train_loss: 0.8692, test_loss: 0.9579, test_f1: 0.5180
 epoch: 27, train_loss: 0.8456, test_loss: 0.9426, test_f1: 0.5251
 epoch: 28, train_loss: 0.8440, test_loss: 0.9239, test_f1: 0.5312
 epoch: 29, train_loss: 0.8345, test_loss: 0.9237, test_f1: 0.5326
 epoch: 30, train_loss: 0.8316, test_loss: 0.9224, test_f1: 0.5280
 epoch: 31, train_loss: 0.8376, test_loss: 0.9212, test_f1: 0.5507
 epoch: 32, train_loss: 0.8227, test_loss: 0.9249, test_f1: 0.5635
 epoch: 33, train_loss: 0.8348, test_loss: 0.9047, test_f1: 0.5556
 epoch: 34, train_loss: 0.8211, test_loss: 0.9392, test_f1: 0.5414
 epoch: 35, train_loss: 0.8257, test_loss: 0.9191, test_f1: 0.5451
 epoch: 36, train_loss: 0.8063, test_loss: 0.9226, test_f1: 0.5471
 epoch: 37, train_loss: 0.8035, test_loss: 0.9281, test_f1: 0.5503
 epoch: 38, train_loss: 0.7991, test_loss: 0.9488, test_f1: 0.5278
 epoch: 39, train_loss: 0.8072, test_loss: 0.9482, test_f1: 0.5592
 epoch: 40, train_loss: 0.7943, test_loss: 0.9205, test_f1: 0.5441
 epoch: 41, train_loss: 0.8034, test_loss: 0.9480, test_f1: 0.5599
 epoch: 42, train_loss: 0.7896, test_loss: 0.9162, test_f1: 0.5550
 epoch: 43, train_loss: 0.7821, test_loss: 0.9103, test_f1: 0.5814
 epoch: 44, train_loss: 0.7821, test_loss: 0.8938, test_f1: 0.5531
 epoch: 45, train_loss: 0.7814, test_loss: 0.9314, test_f1: 0.5511
 epoch: 46, train_loss: 0.7820, test_loss: 0.9048, test_f1: 0.5519
 epoch: 47, train_loss: 0.7730, test_loss: 0.9070, test_f1: 0.5879
 epoch: 48, train_loss: 0.7702, test_loss: 0.9499, test_f1: 0.5486
 epoch: 49, train_loss: 0.7706, test_loss: 0.9431, test_f1: 0.5500
 epoch: 50, train_loss: 0.7753, test_loss: 0.9329, test_f1: 0.5723
 epoch: 51, train_loss: 0.7523, test_loss: 0.9281, test_f1: 0.5566
 epoch: 52, train_loss: 0.7635, test_loss: 0.8992, test_f1: 0.5744
 epoch: 53, train_loss: 0.7463, test_loss: 0.9135, test_f1: 0.5859
 epoch: 54, train_loss: 0.7468, test_loss: 0.9300, test_f1: 0.5612
 epoch: 55, train_loss: 0.7515, test_loss: 0.9172, test_f1: 0.5947
 epoch: 56, train_loss: 0.7435, test_loss: 0.9088, test_f1: 0.5741
 epoch: 57, train_loss: 0.7344, test_loss: 0.9163, test_f1: 0.5586
 epoch: 58, train_loss: 0.7422, test_loss: 0.9411, test_f1: 0.5611
 epoch: 59, train_loss: 0.7439, test_loss: 0.9286, test_f1: 0.5700
 epoch: 60, train_loss: 0.7306, test_loss: 0.9263, test_f1: 0.5801
 epoch: 61, train_loss: 0.7305, test_loss: 0.9297, test_f1: 0.5677
 epoch: 62, train_loss: 0.7291, test_loss: 0.9313, test_f1: 0.5590
 epoch: 63, train_loss: 0.7260, test_loss: 0.9295, test_f1: 0.5728
 epoch: 64, train_loss: 0.7424, test_loss: 0.9402, test_f1: 0.5764
 epoch: 65, train_loss: 0.7251, test_loss: 0.9239, test_f1: 0.5704
 epoch: 66, train_loss: 0.7174, test_loss: 0.9335, test_f1: 0.5688
 epoch: 67, train_loss: 0.7285, test_loss: 0.9344, test_f1: 0.5777
 epoch: 68, train_loss: 0.7210, test_loss: 0.9332, test_f1: 0.5799
 epoch: 69, train_loss: 0.7201, test_loss: 0.9280, test_f1: 0.5778
 epoch: 70, train_loss: 0.7144, test_loss: 0.9320, test_f1: 0.5698
 epoch: 71, train_loss: 0.7065, test_loss: 0.9302, test_f1: 0.5703
 epoch: 72, train_loss: 0.7138, test_loss: 0.9138, test_f1: 0.5818
 epoch: 73, train_loss: 0.7127, test_loss: 0.9430, test_f1: 0.5965
 epoch: 74, train_loss: 0.7111, test_loss: 0.9594, test_f1: 0.5829
 epoch: 75, train_loss: 0.7248, test_loss: 0.9353, test_f1: 0.5764
 epoch: 76, train_loss: 0.7149, test_loss: 0.9574, test_f1: 0.5942
 epoch: 77, train_loss: 0.7108, test_loss: 0.9392, test_f1: 0.5824
 epoch: 78, train_loss: 0.7094, test_loss: 0.9330, test_f1: 0.5855
 epoch: 79, train_loss: 0.7177, test_loss: 0.9429, test_f1: 0.5828
 epoch: 80, train_loss: 0.7081, test_loss: 0.9484, test_f1: 0.5845
 epoch: 81, train_loss: 0.7078, test_loss: 0.9496, test_f1: 0.5790
 epoch: 82, train_loss: 0.7147, test_loss: 0.9570, test_f1: 0.5993
 epoch: 83, train_loss: 0.7109, test_loss: 0.9539, test_f1: 0.5864
 epoch: 84, train_loss: 0.7129, test_loss: 0.9455, test_f1: 0.5918
 epoch: 85, train_loss: 0.6976, test_loss: 0.9455, test_f1: 0.5723
 epoch: 86, train_loss: 0.7075, test_loss: 0.9314, test_f1: 0.5900
 epoch: 87, train_loss: 0.6934, test_loss: 0.9234, test_f1: 0.5947
 epoch: 88, train_loss: 0.7024, test_loss: 0.9424, test_f1: 0.5878
 epoch: 89, train_loss: 0.6909, test_loss: 0.9286, test_f1: 0.5897
 epoch: 90, train_loss: 0.6899, test_loss: 0.9513, test_f1: 0.5885
 epoch: 91, train_loss: 0.6889, test_loss: 0.9462, test_f1: 0.5851
 epoch: 92, train_loss: 0.6910, test_loss: 0.9479, test_f1: 0.5870
 epoch: 93, train_loss: 0.6897, test_loss: 0.9586, test_f1: 0.5855
 epoch: 94, train_loss: 0.6889, test_loss: 0.9396, test_f1: 0.5973
 epoch: 95, train_loss: 0.6840, test_loss: 0.9645, test_f1: 0.5872
 epoch: 96, train_loss: 0.6855, test_loss: 0.9309, test_f1: 0.5924
 epoch: 97, train_loss: 0.6882, test_loss: 0.9626, test_f1: 0.5907
 epoch: 98, train_loss: 0.6832, test_loss: 0.9436, test_f1: 0.5888
 epoch: 99, train_loss: 0.6829, test_loss: 0.9430, test_f1: 0.5837
##################ITERATION #3 ****************************************
 epoch: 0, train_loss: 1.2615, test_loss: 1.2326, test_f1: 0.3050
 epoch: 1, train_loss: 1.1882, test_loss: 1.1317, test_f1: 0.4297
 epoch: 2, train_loss: 1.1483, test_loss: 1.0947, test_f1: 0.4340
 epoch: 3, train_loss: 1.1240, test_loss: 1.0645, test_f1: 0.4458
 epoch: 4, train_loss: 1.1007, test_loss: 1.0368, test_f1: 0.4422
 epoch: 5, train_loss: 1.0796, test_loss: 1.0094, test_f1: 0.4753
 epoch: 6, train_loss: 1.0566, test_loss: 0.9933, test_f1: 0.4695
 epoch: 7, train_loss: 1.0395, test_loss: 0.9755, test_f1: 0.4811
 epoch: 8, train_loss: 1.0241, test_loss: 0.9538, test_f1: 0.5007
 epoch: 9, train_loss: 1.0050, test_loss: 0.9488, test_f1: 0.5019
 epoch: 10, train_loss: 0.9890, test_loss: 0.9405, test_f1: 0.5010
 epoch: 11, train_loss: 0.9813, test_loss: 0.9324, test_f1: 0.5025
 epoch: 12, train_loss: 0.9602, test_loss: 0.9335, test_f1: 0.5153
 epoch: 13, train_loss: 0.9573, test_loss: 0.9468, test_f1: 0.5102
 epoch: 14, train_loss: 0.9489, test_loss: 0.9380, test_f1: 0.5070
 epoch: 15, train_loss: 0.9376, test_loss: 0.9243, test_f1: 0.5148
 epoch: 16, train_loss: 0.9358, test_loss: 0.9134, test_f1: 0.5323
 epoch: 17, train_loss: 0.9221, test_loss: 0.9039, test_f1: 0.5282
 epoch: 18, train_loss: 0.9074, test_loss: 0.9079, test_f1: 0.5268
 epoch: 19, train_loss: 0.8990, test_loss: 0.9035, test_f1: 0.5318
 epoch: 20, train_loss: 0.8997, test_loss: 0.9139, test_f1: 0.5379
 epoch: 21, train_loss: 0.8930, test_loss: 0.9155, test_f1: 0.5194
 epoch: 22, train_loss: 0.8912, test_loss: 0.9297, test_f1: 0.5396
 epoch: 23, train_loss: 0.8892, test_loss: 0.9345, test_f1: 0.5322
 epoch: 24, train_loss: 0.8846, test_loss: 0.9442, test_f1: 0.5283
 epoch: 25, train_loss: 0.8760, test_loss: 0.9160, test_f1: 0.5361
 epoch: 26, train_loss: 0.8592, test_loss: 0.9385, test_f1: 0.5114
 epoch: 27, train_loss: 0.8658, test_loss: 0.8986, test_f1: 0.5346
 epoch: 28, train_loss: 0.8561, test_loss: 0.9139, test_f1: 0.5587
 epoch: 29, train_loss: 0.8630, test_loss: 0.9107, test_f1: 0.5486
 epoch: 30, train_loss: 0.8483, test_loss: 0.9126, test_f1: 0.5586
 epoch: 31, train_loss: 0.8422, test_loss: 0.9305, test_f1: 0.5469
 epoch: 32, train_loss: 0.8443, test_loss: 0.9087, test_f1: 0.5456
 epoch: 33, train_loss: 0.8357, test_loss: 0.9132, test_f1: 0.5701
 epoch: 34, train_loss: 0.8360, test_loss: 0.9074, test_f1: 0.5826
 epoch: 35, train_loss: 0.8384, test_loss: 0.9328, test_f1: 0.5445
 epoch: 36, train_loss: 0.8421, test_loss: 0.9404, test_f1: 0.5561
 epoch: 37, train_loss: 0.8221, test_loss: 0.9292, test_f1: 0.5676
 epoch: 38, train_loss: 0.8219, test_loss: 0.9273, test_f1: 0.5669
 epoch: 39, train_loss: 0.8160, test_loss: 0.9302, test_f1: 0.5239
 epoch: 40, train_loss: 0.8197, test_loss: 0.9308, test_f1: 0.5493
 epoch: 41, train_loss: 0.8018, test_loss: 0.9283, test_f1: 0.5566
 epoch: 42, train_loss: 0.8074, test_loss: 0.9310, test_f1: 0.5921
 epoch: 43, train_loss: 0.8111, test_loss: 0.9417, test_f1: 0.5460
 epoch: 44, train_loss: 0.7979, test_loss: 0.9689, test_f1: 0.5687
 epoch: 45, train_loss: 0.7966, test_loss: 0.9465, test_f1: 0.5589
 epoch: 46, train_loss: 0.7912, test_loss: 0.9578, test_f1: 0.5709
 epoch: 47, train_loss: 0.7902, test_loss: 0.9416, test_f1: 0.5588
 epoch: 48, train_loss: 0.7870, test_loss: 0.9443, test_f1: 0.5715
 epoch: 49, train_loss: 0.7809, test_loss: 0.9514, test_f1: 0.5626
 epoch: 50, train_loss: 0.7900, test_loss: 0.9342, test_f1: 0.5838
 epoch: 51, train_loss: 0.7703, test_loss: 0.9292, test_f1: 0.5856
 epoch: 52, train_loss: 0.7724, test_loss: 0.9180, test_f1: 0.5796
 epoch: 53, train_loss: 0.7645, test_loss: 0.9214, test_f1: 0.5825
 epoch: 54, train_loss: 0.7703, test_loss: 0.9339, test_f1: 0.5745
 epoch: 55, train_loss: 0.7682, test_loss: 0.9121, test_f1: 0.5861
 epoch: 56, train_loss: 0.7619, test_loss: 0.9339, test_f1: 0.5849
 epoch: 57, train_loss: 0.7586, test_loss: 0.9470, test_f1: 0.5791
 epoch: 58, train_loss: 0.7531, test_loss: 0.9342, test_f1: 0.6113
 epoch: 59, train_loss: 0.7596, test_loss: 0.9497, test_f1: 0.5748
 epoch: 60, train_loss: 0.7616, test_loss: 0.9758, test_f1: 0.5841
 epoch: 61, train_loss: 0.7477, test_loss: 0.9474, test_f1: 0.5931
 epoch: 62, train_loss: 0.7503, test_loss: 0.9738, test_f1: 0.5823
 epoch: 63, train_loss: 0.7463, test_loss: 0.9376, test_f1: 0.5955
 epoch: 64, train_loss: 0.7460, test_loss: 0.9388, test_f1: 0.5888
 epoch: 65, train_loss: 0.7489, test_loss: 0.9614, test_f1: 0.5864
 epoch: 66, train_loss: 0.7424, test_loss: 0.9560, test_f1: 0.5918
 epoch: 67, train_loss: 0.7430, test_loss: 0.9535, test_f1: 0.5863
 epoch: 68, train_loss: 0.7329, test_loss: 0.9509, test_f1: 0.5784
 epoch: 69, train_loss: 0.7348, test_loss: 0.9352, test_f1: 0.5983
 epoch: 70, train_loss: 0.7438, test_loss: 0.9302, test_f1: 0.5990
 epoch: 71, train_loss: 0.7465, test_loss: 0.9426, test_f1: 0.5838
 epoch: 72, train_loss: 0.7291, test_loss: 0.9552, test_f1: 0.5932
 epoch: 73, train_loss: 0.7312, test_loss: 0.9590, test_f1: 0.5921
 epoch: 74, train_loss: 0.7318, test_loss: 0.9766, test_f1: 0.5831
 epoch: 75, train_loss: 0.7309, test_loss: 0.9662, test_f1: 0.5832
 epoch: 76, train_loss: 0.7458, test_loss: 0.9821, test_f1: 0.5841
 epoch: 77, train_loss: 0.7322, test_loss: 0.9746, test_f1: 0.5802
 epoch: 78, train_loss: 0.7260, test_loss: 0.9771, test_f1: 0.6080
 epoch: 79, train_loss: 0.7310, test_loss: 0.9440, test_f1: 0.5925
 epoch: 80, train_loss: 0.7078, test_loss: 0.9728, test_f1: 0.6035
 epoch: 81, train_loss: 0.7326, test_loss: 0.9759, test_f1: 0.5820
 epoch: 82, train_loss: 0.7107, test_loss: 0.9703, test_f1: 0.5974
 epoch: 83, train_loss: 0.7122, test_loss: 0.9743, test_f1: 0.5854
 epoch: 84, train_loss: 0.7244, test_loss: 0.9678, test_f1: 0.5944
 epoch: 85, train_loss: 0.7283, test_loss: 0.9582, test_f1: 0.6066
 epoch: 86, train_loss: 0.7173, test_loss: 0.9687, test_f1: 0.5973
 epoch: 87, train_loss: 0.7105, test_loss: 0.9627, test_f1: 0.5818
 epoch: 88, train_loss: 0.7047, test_loss: 0.9756, test_f1: 0.5917
 epoch: 89, train_loss: 0.7121, test_loss: 0.9763, test_f1: 0.5898
 epoch: 90, train_loss: 0.7171, test_loss: 0.9800, test_f1: 0.5923
 epoch: 91, train_loss: 0.7080, test_loss: 0.9700, test_f1: 0.5911
 epoch: 92, train_loss: 0.7088, test_loss: 0.9802, test_f1: 0.6013
 epoch: 93, train_loss: 0.7221, test_loss: 0.9983, test_f1: 0.5907
 epoch: 94, train_loss: 0.7072, test_loss: 0.9903, test_f1: 0.5817
 epoch: 95, train_loss: 0.7098, test_loss: 0.9737, test_f1: 0.5854
 epoch: 96, train_loss: 0.6946, test_loss: 0.9710, test_f1: 0.5940
 epoch: 97, train_loss: 0.7070, test_loss: 0.9843, test_f1: 0.6040
 epoch: 98, train_loss: 0.7028, test_loss: 1.0081, test_f1: 0.5860
 epoch: 99, train_loss: 0.6969, test_loss: 0.9829, test_f1: 0.5819
##################ITERATION #4 ****************************************
 epoch: 0, train_loss: 1.2583, test_loss: 1.2272, test_f1: 0.3000
 epoch: 1, train_loss: 1.1769, test_loss: 1.1210, test_f1: 0.4013
 epoch: 2, train_loss: 1.1443, test_loss: 1.0819, test_f1: 0.4334
 epoch: 3, train_loss: 1.1144, test_loss: 1.0610, test_f1: 0.4384
 epoch: 4, train_loss: 1.0867, test_loss: 1.0457, test_f1: 0.4586
 epoch: 5, train_loss: 1.0672, test_loss: 1.0125, test_f1: 0.4724
 epoch: 6, train_loss: 1.0575, test_loss: 1.0082, test_f1: 0.4574
 epoch: 7, train_loss: 1.0380, test_loss: 0.9844, test_f1: 0.4832
 epoch: 8, train_loss: 1.0190, test_loss: 0.9749, test_f1: 0.4929
 epoch: 9, train_loss: 1.0152, test_loss: 0.9783, test_f1: 0.4663
 epoch: 10, train_loss: 1.0009, test_loss: 0.9731, test_f1: 0.4876
 epoch: 11, train_loss: 0.9846, test_loss: 0.9566, test_f1: 0.5058
 epoch: 12, train_loss: 0.9768, test_loss: 0.9569, test_f1: 0.4961
 epoch: 13, train_loss: 0.9614, test_loss: 0.9558, test_f1: 0.4916
 epoch: 14, train_loss: 0.9644, test_loss: 0.9418, test_f1: 0.4794
 epoch: 15, train_loss: 0.9502, test_loss: 0.9485, test_f1: 0.4873
 epoch: 16, train_loss: 0.9365, test_loss: 0.9336, test_f1: 0.5072
 epoch: 17, train_loss: 0.9313, test_loss: 0.9489, test_f1: 0.5191
 epoch: 18, train_loss: 0.9231, test_loss: 0.9278, test_f1: 0.5132
 epoch: 19, train_loss: 0.9177, test_loss: 0.9378, test_f1: 0.5172
 epoch: 20, train_loss: 0.9154, test_loss: 0.9453, test_f1: 0.5121
 epoch: 21, train_loss: 0.9015, test_loss: 0.9433, test_f1: 0.5109
 epoch: 22, train_loss: 0.8973, test_loss: 0.9246, test_f1: 0.5194
 epoch: 23, train_loss: 0.8921, test_loss: 0.9378, test_f1: 0.5090
 epoch: 24, train_loss: 0.8803, test_loss: 0.9365, test_f1: 0.5142
 epoch: 25, train_loss: 0.8962, test_loss: 0.9286, test_f1: 0.5359
 epoch: 26, train_loss: 0.8860, test_loss: 0.9484, test_f1: 0.4923
 epoch: 27, train_loss: 0.8784, test_loss: 0.9279, test_f1: 0.5203
 epoch: 28, train_loss: 0.8758, test_loss: 0.9519, test_f1: 0.5173
 epoch: 29, train_loss: 0.8622, test_loss: 0.9266, test_f1: 0.5186
 epoch: 30, train_loss: 0.8541, test_loss: 0.9361, test_f1: 0.5168
 epoch: 31, train_loss: 0.8526, test_loss: 0.9398, test_f1: 0.5166
 epoch: 32, train_loss: 0.8470, test_loss: 0.9311, test_f1: 0.5271
 epoch: 33, train_loss: 0.8531, test_loss: 0.9580, test_f1: 0.5181
 epoch: 34, train_loss: 0.8537, test_loss: 0.9451, test_f1: 0.5287
 epoch: 35, train_loss: 0.8422, test_loss: 0.9364, test_f1: 0.5172
 epoch: 36, train_loss: 0.8450, test_loss: 0.9504, test_f1: 0.5240
 epoch: 37, train_loss: 0.8308, test_loss: 0.9381, test_f1: 0.5222
 epoch: 38, train_loss: 0.8248, test_loss: 0.9331, test_f1: 0.5299
 epoch: 39, train_loss: 0.8394, test_loss: 0.9607, test_f1: 0.5084
 epoch: 40, train_loss: 0.8287, test_loss: 0.9417, test_f1: 0.5392
 epoch: 41, train_loss: 0.8127, test_loss: 0.9515, test_f1: 0.5230
 epoch: 42, train_loss: 0.8152, test_loss: 0.9597, test_f1: 0.5289
 epoch: 43, train_loss: 0.8122, test_loss: 0.9560, test_f1: 0.5384
 epoch: 44, train_loss: 0.8072, test_loss: 0.9565, test_f1: 0.5168
 epoch: 45, train_loss: 0.8058, test_loss: 0.9598, test_f1: 0.5472
 epoch: 46, train_loss: 0.8076, test_loss: 0.9941, test_f1: 0.5222
 epoch: 47, train_loss: 0.8016, test_loss: 0.9531, test_f1: 0.5498
 epoch: 48, train_loss: 0.8009, test_loss: 0.9647, test_f1: 0.5493
 epoch: 49, train_loss: 0.7930, test_loss: 0.9628, test_f1: 0.5389
 epoch: 50, train_loss: 0.7979, test_loss: 0.9878, test_f1: 0.5462
 epoch: 51, train_loss: 0.7971, test_loss: 0.9646, test_f1: 0.5639
 epoch: 52, train_loss: 0.7861, test_loss: 0.9645, test_f1: 0.5530
 epoch: 53, train_loss: 0.7965, test_loss: 0.9529, test_f1: 0.5639
 epoch: 54, train_loss: 0.7798, test_loss: 0.9741, test_f1: 0.5682
 epoch: 55, train_loss: 0.7830, test_loss: 0.9899, test_f1: 0.5543
 epoch: 56, train_loss: 0.7744, test_loss: 0.9715, test_f1: 0.5421
 epoch: 57, train_loss: 0.7629, test_loss: 0.9704, test_f1: 0.5752
 epoch: 58, train_loss: 0.7714, test_loss: 0.9574, test_f1: 0.5596
 epoch: 59, train_loss: 0.7753, test_loss: 0.9790, test_f1: 0.5545
 epoch: 60, train_loss: 0.7791, test_loss: 0.9550, test_f1: 0.5698
 epoch: 61, train_loss: 0.7707, test_loss: 0.9713, test_f1: 0.5572
 epoch: 62, train_loss: 0.7763, test_loss: 0.9557, test_f1: 0.5550
 epoch: 63, train_loss: 0.7609, test_loss: 0.9682, test_f1: 0.5688
 epoch: 64, train_loss: 0.7639, test_loss: 0.9637, test_f1: 0.5601
 epoch: 65, train_loss: 0.7708, test_loss: 0.9705, test_f1: 0.5683
 epoch: 66, train_loss: 0.7624, test_loss: 0.9571, test_f1: 0.5649
 epoch: 67, train_loss: 0.7495, test_loss: 0.9708, test_f1: 0.5758
 epoch: 68, train_loss: 0.7521, test_loss: 0.9627, test_f1: 0.5711
 epoch: 69, train_loss: 0.7559, test_loss: 0.9733, test_f1: 0.5803
 epoch: 70, train_loss: 0.7473, test_loss: 0.9827, test_f1: 0.5629
 epoch: 71, train_loss: 0.7416, test_loss: 0.9831, test_f1: 0.5543
 epoch: 72, train_loss: 0.7505, test_loss: 0.9843, test_f1: 0.5625
 epoch: 73, train_loss: 0.7415, test_loss: 0.9599, test_f1: 0.5766
 epoch: 74, train_loss: 0.7484, test_loss: 0.9890, test_f1: 0.5516
 epoch: 75, train_loss: 0.7464, test_loss: 0.9737, test_f1: 0.5715
 epoch: 76, train_loss: 0.7346, test_loss: 0.9858, test_f1: 0.5734
 epoch: 77, train_loss: 0.7461, test_loss: 0.9948, test_f1: 0.5600
 epoch: 78, train_loss: 0.7486, test_loss: 0.9817, test_f1: 0.5743
 epoch: 79, train_loss: 0.7440, test_loss: 0.9784, test_f1: 0.5719
 epoch: 80, train_loss: 0.7306, test_loss: 0.9864, test_f1: 0.5655
 epoch: 81, train_loss: 0.7365, test_loss: 0.9968, test_f1: 0.5609
 epoch: 82, train_loss: 0.7273, test_loss: 1.0162, test_f1: 0.5585
 epoch: 83, train_loss: 0.7359, test_loss: 1.0017, test_f1: 0.5601
 epoch: 84, train_loss: 0.7295, test_loss: 0.9989, test_f1: 0.5639
 epoch: 85, train_loss: 0.7295, test_loss: 0.9962, test_f1: 0.5652
 epoch: 86, train_loss: 0.7275, test_loss: 0.9688, test_f1: 0.5764
 epoch: 87, train_loss: 0.7134, test_loss: 0.9796, test_f1: 0.5826
 epoch: 88, train_loss: 0.7266, test_loss: 0.9873, test_f1: 0.5772
 epoch: 89, train_loss: 0.7313, test_loss: 0.9908, test_f1: 0.5743
 epoch: 90, train_loss: 0.7374, test_loss: 1.0079, test_f1: 0.5697
 epoch: 91, train_loss: 0.7302, test_loss: 0.9808, test_f1: 0.5667
 epoch: 92, train_loss: 0.7211, test_loss: 0.9969, test_f1: 0.5638
 epoch: 93, train_loss: 0.7102, test_loss: 0.9824, test_f1: 0.5783
 epoch: 94, train_loss: 0.7279, test_loss: 0.9718, test_f1: 0.5796
 epoch: 95, train_loss: 0.7140, test_loss: 1.0224, test_f1: 0.5519
 epoch: 96, train_loss: 0.7201, test_loss: 0.9863, test_f1: 0.5761
 epoch: 97, train_loss: 0.7184, test_loss: 0.9992, test_f1: 0.5836
 epoch: 98, train_loss: 0.7189, test_loss: 0.9802, test_f1: 0.5841
 epoch: 99, train_loss: 0.6998, test_loss: 1.0026, test_f1: 0.5756
##################ITERATION #5 ****************************************
 epoch: 0, train_loss: 1.2855, test_loss: 1.2642, test_f1: 0.3171
 epoch: 1, train_loss: 1.1799, test_loss: 1.1221, test_f1: 0.3879
 epoch: 2, train_loss: 1.1487, test_loss: 1.0907, test_f1: 0.4192
 epoch: 3, train_loss: 1.1215, test_loss: 1.0651, test_f1: 0.4282
 epoch: 4, train_loss: 1.0956, test_loss: 1.0386, test_f1: 0.4437
 epoch: 5, train_loss: 1.0830, test_loss: 1.0186, test_f1: 0.4711
 epoch: 6, train_loss: 1.0508, test_loss: 0.9882, test_f1: 0.4807
 epoch: 7, train_loss: 1.0359, test_loss: 0.9690, test_f1: 0.5076
 epoch: 8, train_loss: 1.0309, test_loss: 0.9587, test_f1: 0.5071
 epoch: 9, train_loss: 1.0133, test_loss: 0.9602, test_f1: 0.5028
 epoch: 10, train_loss: 1.0098, test_loss: 0.9331, test_f1: 0.5260
 epoch: 11, train_loss: 0.9824, test_loss: 0.9395, test_f1: 0.5205
 epoch: 12, train_loss: 0.9789, test_loss: 0.9355, test_f1: 0.5195
 epoch: 13, train_loss: 0.9758, test_loss: 0.9424, test_f1: 0.5244
 epoch: 14, train_loss: 0.9555, test_loss: 0.9233, test_f1: 0.5175
 epoch: 15, train_loss: 0.9486, test_loss: 0.9201, test_f1: 0.5288
 epoch: 16, train_loss: 0.9491, test_loss: 0.9200, test_f1: 0.5222
 epoch: 17, train_loss: 0.9406, test_loss: 0.9262, test_f1: 0.5044
 epoch: 18, train_loss: 0.9392, test_loss: 0.9207, test_f1: 0.5487
 epoch: 19, train_loss: 0.9314, test_loss: 0.9197, test_f1: 0.5308
 epoch: 20, train_loss: 0.9137, test_loss: 0.9166, test_f1: 0.5237
 epoch: 21, train_loss: 0.9214, test_loss: 0.9191, test_f1: 0.5472
 epoch: 22, train_loss: 0.9163, test_loss: 0.9104, test_f1: 0.5373
 epoch: 23, train_loss: 0.9023, test_loss: 0.9083, test_f1: 0.5277
 epoch: 24, train_loss: 0.8937, test_loss: 0.9207, test_f1: 0.5677
 epoch: 25, train_loss: 0.8849, test_loss: 0.9128, test_f1: 0.5217
 epoch: 26, train_loss: 0.8892, test_loss: 0.9124, test_f1: 0.5624
 epoch: 27, train_loss: 0.8876, test_loss: 0.9160, test_f1: 0.5524
 epoch: 28, train_loss: 0.8689, test_loss: 0.9193, test_f1: 0.5732
 epoch: 29, train_loss: 0.8843, test_loss: 0.9286, test_f1: 0.5462
 epoch: 30, train_loss: 0.8641, test_loss: 0.9182, test_f1: 0.5731
 epoch: 31, train_loss: 0.8596, test_loss: 0.9097, test_f1: 0.5622
 epoch: 32, train_loss: 0.8709, test_loss: 0.9032, test_f1: 0.5771
 epoch: 33, train_loss: 0.8584, test_loss: 0.9151, test_f1: 0.5502
 epoch: 34, train_loss: 0.8645, test_loss: 0.9222, test_f1: 0.5482
 epoch: 35, train_loss: 0.8548, test_loss: 0.9080, test_f1: 0.5650
 epoch: 36, train_loss: 0.8372, test_loss: 0.9119, test_f1: 0.5681
 epoch: 37, train_loss: 0.8444, test_loss: 0.9175, test_f1: 0.5690
 epoch: 38, train_loss: 0.8341, test_loss: 0.9155, test_f1: 0.5629
 epoch: 39, train_loss: 0.8422, test_loss: 0.9119, test_f1: 0.5613
 epoch: 40, train_loss: 0.8281, test_loss: 0.9277, test_f1: 0.5505
 epoch: 41, train_loss: 0.8325, test_loss: 0.9253, test_f1: 0.5603
 epoch: 42, train_loss: 0.8241, test_loss: 0.9387, test_f1: 0.5608
 epoch: 43, train_loss: 0.8150, test_loss: 0.9139, test_f1: 0.5616
 epoch: 44, train_loss: 0.8232, test_loss: 0.9158, test_f1: 0.5543
 epoch: 45, train_loss: 0.8153, test_loss: 0.9018, test_f1: 0.5757
 epoch: 46, train_loss: 0.8126, test_loss: 0.9188, test_f1: 0.5660
 epoch: 47, train_loss: 0.8027, test_loss: 0.9149, test_f1: 0.5656
 epoch: 48, train_loss: 0.8029, test_loss: 0.9437, test_f1: 0.5604
 epoch: 49, train_loss: 0.7991, test_loss: 0.9490, test_f1: 0.5525
 epoch: 50, train_loss: 0.7906, test_loss: 0.9439, test_f1: 0.5755
 epoch: 51, train_loss: 0.7929, test_loss: 0.9408, test_f1: 0.5636
 epoch: 52, train_loss: 0.7772, test_loss: 0.9437, test_f1: 0.5433
 epoch: 53, train_loss: 0.7842, test_loss: 0.9531, test_f1: 0.5523
 epoch: 54, train_loss: 0.7934, test_loss: 0.9312, test_f1: 0.5553
 epoch: 55, train_loss: 0.7755, test_loss: 0.9440, test_f1: 0.5633
 epoch: 56, train_loss: 0.7761, test_loss: 0.9444, test_f1: 0.5648
 epoch: 57, train_loss: 0.7754, test_loss: 0.9438, test_f1: 0.5644
 epoch: 58, train_loss: 0.7799, test_loss: 0.9392, test_f1: 0.5725
 epoch: 59, train_loss: 0.7862, test_loss: 0.9416, test_f1: 0.5996
 epoch: 60, train_loss: 0.7790, test_loss: 0.9463, test_f1: 0.5758
 epoch: 61, train_loss: 0.7664, test_loss: 0.9499, test_f1: 0.5752
 epoch: 62, train_loss: 0.7702, test_loss: 0.9462, test_f1: 0.5591
 epoch: 63, train_loss: 0.7724, test_loss: 0.9491, test_f1: 0.5721
 epoch: 64, train_loss: 0.7787, test_loss: 0.9523, test_f1: 0.5937
 epoch: 65, train_loss: 0.7668, test_loss: 0.9498, test_f1: 0.5745
 epoch: 66, train_loss: 0.7600, test_loss: 0.9544, test_f1: 0.5672
 epoch: 67, train_loss: 0.7638, test_loss: 0.9462, test_f1: 0.5970
 epoch: 68, train_loss: 0.7506, test_loss: 0.9480, test_f1: 0.5625
 epoch: 69, train_loss: 0.7527, test_loss: 0.9338, test_f1: 0.5765
 epoch: 70, train_loss: 0.7580, test_loss: 0.9600, test_f1: 0.5724
 epoch: 71, train_loss: 0.7568, test_loss: 0.9507, test_f1: 0.5789
 epoch: 72, train_loss: 0.7510, test_loss: 0.9600, test_f1: 0.5774
 epoch: 73, train_loss: 0.7575, test_loss: 0.9665, test_f1: 0.5553
 epoch: 74, train_loss: 0.7373, test_loss: 0.9374, test_f1: 0.5736
 epoch: 75, train_loss: 0.7565, test_loss: 0.9355, test_f1: 0.5778
 epoch: 76, train_loss: 0.7350, test_loss: 0.9335, test_f1: 0.5859
 epoch: 77, train_loss: 0.7378, test_loss: 0.9461, test_f1: 0.5878
 epoch: 78, train_loss: 0.7573, test_loss: 0.9358, test_f1: 0.5732
 epoch: 79, train_loss: 0.7488, test_loss: 0.9454, test_f1: 0.5618
 epoch: 80, train_loss: 0.7359, test_loss: 0.9479, test_f1: 0.5798
 epoch: 81, train_loss: 0.7463, test_loss: 0.9516, test_f1: 0.5811
 epoch: 82, train_loss: 0.7407, test_loss: 0.9706, test_f1: 0.5694
 epoch: 83, train_loss: 0.7345, test_loss: 0.9452, test_f1: 0.5847
 epoch: 84, train_loss: 0.7336, test_loss: 0.9630, test_f1: 0.5879
 epoch: 85, train_loss: 0.7301, test_loss: 0.9675, test_f1: 0.5898
 epoch: 86, train_loss: 0.7303, test_loss: 0.9618, test_f1: 0.5800
 epoch: 87, train_loss: 0.7351, test_loss: 0.9536, test_f1: 0.6057
 epoch: 88, train_loss: 0.7400, test_loss: 0.9436, test_f1: 0.5867
 epoch: 89, train_loss: 0.7291, test_loss: 0.9337, test_f1: 0.6049
 epoch: 90, train_loss: 0.7299, test_loss: 0.9587, test_f1: 0.5974
 epoch: 91, train_loss: 0.7251, test_loss: 0.9451, test_f1: 0.5968
 epoch: 92, train_loss: 0.7239, test_loss: 0.9504, test_f1: 0.5769
 epoch: 93, train_loss: 0.7333, test_loss: 0.9573, test_f1: 0.5847
 epoch: 94, train_loss: 0.7237, test_loss: 0.9584, test_f1: 0.5761
 epoch: 95, train_loss: 0.7226, test_loss: 0.9568, test_f1: 0.5923
 epoch: 96, train_loss: 0.7262, test_loss: 0.9615, test_f1: 0.5836
 epoch: 97, train_loss: 0.7234, test_loss: 0.9469, test_f1: 0.5967
 epoch: 98, train_loss: 0.7191, test_loss: 0.9664, test_f1: 0.5911
 epoch: 99, train_loss: 0.7241, test_loss: 0.9557, test_f1: 0.5824
##################ITERATION #6 ****************************************
 epoch: 0, train_loss: 1.2579, test_loss: 1.2338, test_f1: 0.3085
 epoch: 1, train_loss: 1.1579, test_loss: 1.0869, test_f1: 0.4737
 epoch: 2, train_loss: 1.1312, test_loss: 1.0512, test_f1: 0.4864
 epoch: 3, train_loss: 1.1063, test_loss: 1.0338, test_f1: 0.4857
 epoch: 4, train_loss: 1.0841, test_loss: 1.0097, test_f1: 0.4789
 epoch: 5, train_loss: 1.0636, test_loss: 0.9853, test_f1: 0.4807
 epoch: 6, train_loss: 1.0417, test_loss: 0.9771, test_f1: 0.4922
 epoch: 7, train_loss: 1.0309, test_loss: 0.9651, test_f1: 0.4971
 epoch: 8, train_loss: 1.0131, test_loss: 0.9506, test_f1: 0.5139
 epoch: 9, train_loss: 0.9932, test_loss: 0.9483, test_f1: 0.4999
 epoch: 10, train_loss: 0.9831, test_loss: 0.9319, test_f1: 0.5165
 epoch: 11, train_loss: 0.9705, test_loss: 0.9309, test_f1: 0.5176
 epoch: 12, train_loss: 0.9558, test_loss: 0.9317, test_f1: 0.5061
 epoch: 13, train_loss: 0.9506, test_loss: 0.9343, test_f1: 0.5141
 epoch: 14, train_loss: 0.9444, test_loss: 0.9275, test_f1: 0.5172
 epoch: 15, train_loss: 0.9419, test_loss: 0.9032, test_f1: 0.5286
 epoch: 16, train_loss: 0.9274, test_loss: 0.9021, test_f1: 0.5252
 epoch: 17, train_loss: 0.9257, test_loss: 0.9092, test_f1: 0.5445
 epoch: 18, train_loss: 0.9139, test_loss: 0.9041, test_f1: 0.5327
 epoch: 19, train_loss: 0.8997, test_loss: 0.9252, test_f1: 0.5043
 epoch: 20, train_loss: 0.8978, test_loss: 0.9040, test_f1: 0.5548
 epoch: 21, train_loss: 0.9033, test_loss: 0.8925, test_f1: 0.5534
 epoch: 22, train_loss: 0.8829, test_loss: 0.9003, test_f1: 0.5578
 epoch: 23, train_loss: 0.8804, test_loss: 0.9157, test_f1: 0.5270
 epoch: 24, train_loss: 0.8763, test_loss: 0.9011, test_f1: 0.5380
 epoch: 25, train_loss: 0.8793, test_loss: 0.8822, test_f1: 0.5320
 epoch: 26, train_loss: 0.8769, test_loss: 0.9086, test_f1: 0.5316
 epoch: 27, train_loss: 0.8780, test_loss: 0.9003, test_f1: 0.5371
 epoch: 28, train_loss: 0.8529, test_loss: 0.9127, test_f1: 0.5258
 epoch: 29, train_loss: 0.8614, test_loss: 0.9171, test_f1: 0.5350
 epoch: 30, train_loss: 0.8353, test_loss: 0.9070, test_f1: 0.5377
 epoch: 31, train_loss: 0.8383, test_loss: 0.8846, test_f1: 0.5466
 epoch: 32, train_loss: 0.8375, test_loss: 0.9099, test_f1: 0.5507
 epoch: 33, train_loss: 0.8308, test_loss: 0.9020, test_f1: 0.5464
 epoch: 34, train_loss: 0.8257, test_loss: 0.9152, test_f1: 0.5508
 epoch: 35, train_loss: 0.8233, test_loss: 0.9250, test_f1: 0.5519
 epoch: 36, train_loss: 0.8167, test_loss: 0.9005, test_f1: 0.5568
 epoch: 37, train_loss: 0.8090, test_loss: 0.9194, test_f1: 0.5571
 epoch: 38, train_loss: 0.8154, test_loss: 0.9336, test_f1: 0.5573
 epoch: 39, train_loss: 0.8227, test_loss: 0.9189, test_f1: 0.5693
 epoch: 40, train_loss: 0.7938, test_loss: 0.9414, test_f1: 0.5449
 epoch: 41, train_loss: 0.7962, test_loss: 0.9204, test_f1: 0.5613
 epoch: 42, train_loss: 0.8009, test_loss: 0.9048, test_f1: 0.5575
 epoch: 43, train_loss: 0.7912, test_loss: 0.9085, test_f1: 0.5579
 epoch: 44, train_loss: 0.7912, test_loss: 0.9258, test_f1: 0.5631
 epoch: 45, train_loss: 0.7834, test_loss: 0.9050, test_f1: 0.5563
 epoch: 46, train_loss: 0.7788, test_loss: 0.9016, test_f1: 0.5769
 epoch: 47, train_loss: 0.7781, test_loss: 0.9523, test_f1: 0.5712
 epoch: 48, train_loss: 0.7824, test_loss: 0.9116, test_f1: 0.5631
 epoch: 49, train_loss: 0.7735, test_loss: 0.9145, test_f1: 0.5584
 epoch: 50, train_loss: 0.7769, test_loss: 0.9324, test_f1: 0.5764
 epoch: 51, train_loss: 0.7677, test_loss: 0.9153, test_f1: 0.5703
 epoch: 52, train_loss: 0.7597, test_loss: 0.9345, test_f1: 0.5728
 epoch: 53, train_loss: 0.7505, test_loss: 0.9238, test_f1: 0.5763
 epoch: 54, train_loss: 0.7514, test_loss: 0.9187, test_f1: 0.5853
 epoch: 55, train_loss: 0.7437, test_loss: 0.9141, test_f1: 0.5717
 epoch: 56, train_loss: 0.7522, test_loss: 0.9274, test_f1: 0.5597
 epoch: 57, train_loss: 0.7531, test_loss: 0.9202, test_f1: 0.5716
 epoch: 58, train_loss: 0.7408, test_loss: 0.9282, test_f1: 0.5669
 epoch: 59, train_loss: 0.7502, test_loss: 0.9129, test_f1: 0.5725
 epoch: 60, train_loss: 0.7482, test_loss: 0.9318, test_f1: 0.5828
 epoch: 61, train_loss: 0.7481, test_loss: 0.9195, test_f1: 0.5796
 epoch: 62, train_loss: 0.7420, test_loss: 0.9271, test_f1: 0.5784
 epoch: 63, train_loss: 0.7406, test_loss: 0.9165, test_f1: 0.5835
 epoch: 64, train_loss: 0.7365, test_loss: 0.9406, test_f1: 0.5771
 epoch: 65, train_loss: 0.7346, test_loss: 0.9272, test_f1: 0.5875
 epoch: 66, train_loss: 0.7376, test_loss: 0.9263, test_f1: 0.5792
 epoch: 67, train_loss: 0.7275, test_loss: 0.9308, test_f1: 0.5752
 epoch: 68, train_loss: 0.7312, test_loss: 0.9273, test_f1: 0.5805
 epoch: 69, train_loss: 0.7303, test_loss: 0.9472, test_f1: 0.5850
 epoch: 70, train_loss: 0.7235, test_loss: 0.9051, test_f1: 0.5893
 epoch: 71, train_loss: 0.7280, test_loss: 0.9272, test_f1: 0.5829
 epoch: 72, train_loss: 0.7301, test_loss: 0.9321, test_f1: 0.5888
 epoch: 73, train_loss: 0.7202, test_loss: 0.9358, test_f1: 0.5752
 epoch: 74, train_loss: 0.7195, test_loss: 0.9231, test_f1: 0.5989
 epoch: 75, train_loss: 0.7246, test_loss: 0.9141, test_f1: 0.5827
 epoch: 76, train_loss: 0.7120, test_loss: 0.9288, test_f1: 0.5929
 epoch: 77, train_loss: 0.7169, test_loss: 0.9284, test_f1: 0.5666
 epoch: 78, train_loss: 0.7205, test_loss: 0.9555, test_f1: 0.5620
 epoch: 79, train_loss: 0.7090, test_loss: 0.9466, test_f1: 0.5793
 epoch: 80, train_loss: 0.7093, test_loss: 0.9515, test_f1: 0.5805
 epoch: 81, train_loss: 0.7057, test_loss: 0.9357, test_f1: 0.5800
 epoch: 82, train_loss: 0.7092, test_loss: 0.9375, test_f1: 0.5636
 epoch: 83, train_loss: 0.7046, test_loss: 0.9298, test_f1: 0.5788
 epoch: 84, train_loss: 0.7082, test_loss: 0.9359, test_f1: 0.5887
 epoch: 85, train_loss: 0.6940, test_loss: 0.9480, test_f1: 0.5964
 epoch: 86, train_loss: 0.6916, test_loss: 0.9454, test_f1: 0.5850
 epoch: 87, train_loss: 0.7088, test_loss: 0.9531, test_f1: 0.5902
 epoch: 88, train_loss: 0.6971, test_loss: 0.9614, test_f1: 0.5780
 epoch: 89, train_loss: 0.6910, test_loss: 0.9591, test_f1: 0.5783
 epoch: 90, train_loss: 0.7066, test_loss: 0.9461, test_f1: 0.5852
 epoch: 91, train_loss: 0.6911, test_loss: 0.9431, test_f1: 0.6045
 epoch: 92, train_loss: 0.7034, test_loss: 0.9396, test_f1: 0.5856
 epoch: 93, train_loss: 0.6910, test_loss: 0.9506, test_f1: 0.5859
 epoch: 94, train_loss: 0.6824, test_loss: 0.9298, test_f1: 0.5816
 epoch: 95, train_loss: 0.6919, test_loss: 0.9314, test_f1: 0.5926
 epoch: 96, train_loss: 0.7062, test_loss: 0.9526, test_f1: 0.5932
 epoch: 97, train_loss: 0.6871, test_loss: 0.9527, test_f1: 0.5909
 epoch: 98, train_loss: 0.6900, test_loss: 0.9424, test_f1: 0.5894
 epoch: 99, train_loss: 0.6821, test_loss: 0.9646, test_f1: 0.5847
##################ITERATION #7 ****************************************
 epoch: 0, train_loss: 1.2546, test_loss: 1.2149, test_f1: 0.3629
 epoch: 1, train_loss: 1.1675, test_loss: 1.1055, test_f1: 0.4207
 epoch: 2, train_loss: 1.1279, test_loss: 1.0957, test_f1: 0.4009
 epoch: 3, train_loss: 1.1176, test_loss: 1.0686, test_f1: 0.4198
 epoch: 4, train_loss: 1.0887, test_loss: 1.0329, test_f1: 0.4503
 epoch: 5, train_loss: 1.0803, test_loss: 1.0228, test_f1: 0.4650
 epoch: 6, train_loss: 1.0693, test_loss: 1.0053, test_f1: 0.4549
 epoch: 7, train_loss: 1.0424, test_loss: 0.9930, test_f1: 0.4622
 epoch: 8, train_loss: 1.0328, test_loss: 0.9773, test_f1: 0.4736
 epoch: 9, train_loss: 1.0374, test_loss: 0.9663, test_f1: 0.4751
 epoch: 10, train_loss: 1.0085, test_loss: 0.9741, test_f1: 0.4893
 epoch: 11, train_loss: 0.9977, test_loss: 0.9794, test_f1: 0.4765
 epoch: 12, train_loss: 0.9870, test_loss: 0.9445, test_f1: 0.5033
 epoch: 13, train_loss: 0.9870, test_loss: 0.9507, test_f1: 0.5055
 epoch: 14, train_loss: 0.9732, test_loss: 0.9476, test_f1: 0.4934
 epoch: 15, train_loss: 0.9667, test_loss: 0.9295, test_f1: 0.5091
 epoch: 16, train_loss: 0.9686, test_loss: 0.9335, test_f1: 0.5191
 epoch: 17, train_loss: 0.9490, test_loss: 0.9420, test_f1: 0.5081
 epoch: 18, train_loss: 0.9481, test_loss: 0.9383, test_f1: 0.5203
 epoch: 19, train_loss: 0.9400, test_loss: 0.9424, test_f1: 0.5215
 epoch: 20, train_loss: 0.9362, test_loss: 0.9513, test_f1: 0.5084
 epoch: 21, train_loss: 0.9275, test_loss: 0.9410, test_f1: 0.5108
 epoch: 22, train_loss: 0.9299, test_loss: 0.9403, test_f1: 0.5189
 epoch: 23, train_loss: 0.9127, test_loss: 0.9431, test_f1: 0.5207
 epoch: 24, train_loss: 0.9007, test_loss: 0.9272, test_f1: 0.5373
 epoch: 25, train_loss: 0.9011, test_loss: 0.9416, test_f1: 0.5233
 epoch: 26, train_loss: 0.9026, test_loss: 0.9428, test_f1: 0.5249
 epoch: 27, train_loss: 0.8974, test_loss: 0.9193, test_f1: 0.5394
 epoch: 28, train_loss: 0.8888, test_loss: 0.9376, test_f1: 0.5367
 epoch: 29, train_loss: 0.8912, test_loss: 0.9249, test_f1: 0.5359
 epoch: 30, train_loss: 0.8842, test_loss: 0.9232, test_f1: 0.5201
 epoch: 31, train_loss: 0.8783, test_loss: 0.9497, test_f1: 0.5296
 epoch: 32, train_loss: 0.8615, test_loss: 0.9409, test_f1: 0.5250
 epoch: 33, train_loss: 0.8543, test_loss: 0.9410, test_f1: 0.5345
 epoch: 34, train_loss: 0.8686, test_loss: 0.9340, test_f1: 0.5324
 epoch: 35, train_loss: 0.8653, test_loss: 0.9634, test_f1: 0.5278
 epoch: 36, train_loss: 0.8593, test_loss: 0.9479, test_f1: 0.5343
 epoch: 37, train_loss: 0.8514, test_loss: 0.9510, test_f1: 0.5421
 epoch: 38, train_loss: 0.8498, test_loss: 0.9555, test_f1: 0.5352
 epoch: 39, train_loss: 0.8399, test_loss: 0.9384, test_f1: 0.5604
 epoch: 40, train_loss: 0.8446, test_loss: 0.9588, test_f1: 0.5320
 epoch: 41, train_loss: 0.8427, test_loss: 0.9778, test_f1: 0.5458
 epoch: 42, train_loss: 0.8349, test_loss: 0.9605, test_f1: 0.5261
 epoch: 43, train_loss: 0.8285, test_loss: 0.9627, test_f1: 0.5344
 epoch: 44, train_loss: 0.8265, test_loss: 0.9742, test_f1: 0.5404
 epoch: 45, train_loss: 0.8207, test_loss: 0.9571, test_f1: 0.5509
 epoch: 46, train_loss: 0.8198, test_loss: 0.9752, test_f1: 0.5377
 epoch: 47, train_loss: 0.8268, test_loss: 0.9505, test_f1: 0.5514
 epoch: 48, train_loss: 0.8103, test_loss: 0.9566, test_f1: 0.5381
 epoch: 49, train_loss: 0.8121, test_loss: 0.9451, test_f1: 0.5499
 epoch: 50, train_loss: 0.8053, test_loss: 0.9847, test_f1: 0.5371
 epoch: 51, train_loss: 0.7970, test_loss: 0.9556, test_f1: 0.5551
 epoch: 52, train_loss: 0.7953, test_loss: 0.9684, test_f1: 0.5502
 epoch: 53, train_loss: 0.7862, test_loss: 0.9529, test_f1: 0.5534
 epoch: 54, train_loss: 0.7992, test_loss: 0.9542, test_f1: 0.5504
 epoch: 55, train_loss: 0.7948, test_loss: 0.9478, test_f1: 0.5534
 epoch: 56, train_loss: 0.7886, test_loss: 0.9830, test_f1: 0.5468
 epoch: 57, train_loss: 0.7752, test_loss: 0.9564, test_f1: 0.5621
 epoch: 58, train_loss: 0.7787, test_loss: 0.9661, test_f1: 0.5453
 epoch: 59, train_loss: 0.7859, test_loss: 0.9744, test_f1: 0.5535
 epoch: 60, train_loss: 0.7883, test_loss: 0.9832, test_f1: 0.5508
 epoch: 61, train_loss: 0.7808, test_loss: 0.9770, test_f1: 0.5433
 epoch: 62, train_loss: 0.7888, test_loss: 0.9732, test_f1: 0.5554
 epoch: 63, train_loss: 0.7790, test_loss: 0.9916, test_f1: 0.5420
 epoch: 64, train_loss: 0.7792, test_loss: 0.9923, test_f1: 0.5511
 epoch: 65, train_loss: 0.7885, test_loss: 0.9747, test_f1: 0.5324
 epoch: 66, train_loss: 0.7731, test_loss: 0.9832, test_f1: 0.5477
 epoch: 67, train_loss: 0.7650, test_loss: 0.9737, test_f1: 0.5567
 epoch: 68, train_loss: 0.7728, test_loss: 0.9596, test_f1: 0.5509
 epoch: 69, train_loss: 0.7823, test_loss: 0.9799, test_f1: 0.5526
 epoch: 70, train_loss: 0.7673, test_loss: 0.9847, test_f1: 0.5548
 epoch: 71, train_loss: 0.7640, test_loss: 0.9992, test_f1: 0.5461
 epoch: 72, train_loss: 0.7653, test_loss: 0.9897, test_f1: 0.5511
 epoch: 73, train_loss: 0.7553, test_loss: 0.9967, test_f1: 0.5532
 epoch: 74, train_loss: 0.7631, test_loss: 0.9991, test_f1: 0.5504
 epoch: 75, train_loss: 0.7560, test_loss: 0.9911, test_f1: 0.5662
 epoch: 76, train_loss: 0.7553, test_loss: 0.9913, test_f1: 0.5496
 epoch: 77, train_loss: 0.7623, test_loss: 0.9919, test_f1: 0.5615
 epoch: 78, train_loss: 0.7588, test_loss: 0.9888, test_f1: 0.5655
 epoch: 79, train_loss: 0.7534, test_loss: 1.0011, test_f1: 0.5613
 epoch: 80, train_loss: 0.7622, test_loss: 0.9880, test_f1: 0.5684
 epoch: 81, train_loss: 0.7460, test_loss: 0.9881, test_f1: 0.5695
 epoch: 82, train_loss: 0.7529, test_loss: 0.9992, test_f1: 0.5540
 epoch: 83, train_loss: 0.7508, test_loss: 0.9915, test_f1: 0.5635
 epoch: 84, train_loss: 0.7570, test_loss: 1.0183, test_f1: 0.5647
 epoch: 85, train_loss: 0.7457, test_loss: 1.0044, test_f1: 0.5595
 epoch: 86, train_loss: 0.7463, test_loss: 1.0016, test_f1: 0.5662
 epoch: 87, train_loss: 0.7328, test_loss: 1.0026, test_f1: 0.5529
 epoch: 88, train_loss: 0.7395, test_loss: 1.0047, test_f1: 0.5564
 epoch: 89, train_loss: 0.7479, test_loss: 1.0112, test_f1: 0.5560
 epoch: 90, train_loss: 0.7384, test_loss: 1.0088, test_f1: 0.5660
 epoch: 91, train_loss: 0.7348, test_loss: 1.0086, test_f1: 0.5660
 epoch: 92, train_loss: 0.7297, test_loss: 1.0195, test_f1: 0.5609
 epoch: 93, train_loss: 0.7411, test_loss: 1.0062, test_f1: 0.5670
 epoch: 94, train_loss: 0.7302, test_loss: 1.0110, test_f1: 0.5674
 epoch: 95, train_loss: 0.7267, test_loss: 0.9991, test_f1: 0.5727
 epoch: 96, train_loss: 0.7392, test_loss: 1.0089, test_f1: 0.5605
 epoch: 97, train_loss: 0.7245, test_loss: 1.0097, test_f1: 0.5616
 epoch: 98, train_loss: 0.7222, test_loss: 1.0264, test_f1: 0.5657
 epoch: 99, train_loss: 0.7246, test_loss: 1.0079, test_f1: 0.5817
##################ITERATION #8 ****************************************
 epoch: 0, train_loss: 1.2632, test_loss: 1.1839, test_f1: 0.4046
 epoch: 1, train_loss: 1.1627, test_loss: 1.0881, test_f1: 0.4432
 epoch: 2, train_loss: 1.1242, test_loss: 1.0546, test_f1: 0.4458
 epoch: 3, train_loss: 1.1009, test_loss: 1.0351, test_f1: 0.4604
 epoch: 4, train_loss: 1.0695, test_loss: 1.0049, test_f1: 0.4674
 epoch: 5, train_loss: 1.0558, test_loss: 0.9927, test_f1: 0.4792
 epoch: 6, train_loss: 1.0304, test_loss: 0.9972, test_f1: 0.4707
 epoch: 7, train_loss: 1.0238, test_loss: 0.9825, test_f1: 0.5017
 epoch: 8, train_loss: 1.0068, test_loss: 0.9859, test_f1: 0.4811
 epoch: 9, train_loss: 0.9805, test_loss: 0.9718, test_f1: 0.4844
 epoch: 10, train_loss: 0.9766, test_loss: 0.9827, test_f1: 0.4995
 epoch: 11, train_loss: 0.9718, test_loss: 0.9732, test_f1: 0.4816
 epoch: 12, train_loss: 0.9643, test_loss: 0.9846, test_f1: 0.4949
 epoch: 13, train_loss: 0.9494, test_loss: 0.9600, test_f1: 0.5036
 epoch: 14, train_loss: 0.9522, test_loss: 0.9666, test_f1: 0.5007
 epoch: 15, train_loss: 0.9408, test_loss: 0.9624, test_f1: 0.5046
 epoch: 16, train_loss: 0.9256, test_loss: 0.9568, test_f1: 0.4959
 epoch: 17, train_loss: 0.9376, test_loss: 0.9549, test_f1: 0.5143
 epoch: 18, train_loss: 0.9260, test_loss: 0.9726, test_f1: 0.5088
 epoch: 19, train_loss: 0.9118, test_loss: 0.9605, test_f1: 0.5262
 epoch: 20, train_loss: 0.9132, test_loss: 0.9599, test_f1: 0.5134
 epoch: 21, train_loss: 0.8959, test_loss: 0.9519, test_f1: 0.5164
 epoch: 22, train_loss: 0.8958, test_loss: 0.9598, test_f1: 0.5385
 epoch: 23, train_loss: 0.8882, test_loss: 0.9444, test_f1: 0.5111
 epoch: 24, train_loss: 0.8848, test_loss: 0.9641, test_f1: 0.5210
 epoch: 25, train_loss: 0.8908, test_loss: 0.9700, test_f1: 0.5079
 epoch: 26, train_loss: 0.8743, test_loss: 0.9496, test_f1: 0.5270
 epoch: 27, train_loss: 0.8771, test_loss: 0.9716, test_f1: 0.5306
 epoch: 28, train_loss: 0.8694, test_loss: 0.9412, test_f1: 0.5174
 epoch: 29, train_loss: 0.8524, test_loss: 0.9531, test_f1: 0.5236
 epoch: 30, train_loss: 0.8695, test_loss: 0.9673, test_f1: 0.5172
 epoch: 31, train_loss: 0.8626, test_loss: 0.9654, test_f1: 0.5077
 epoch: 32, train_loss: 0.8722, test_loss: 0.9864, test_f1: 0.5014
 epoch: 33, train_loss: 0.8468, test_loss: 0.9834, test_f1: 0.5142
 epoch: 34, train_loss: 0.8457, test_loss: 0.9694, test_f1: 0.5163
 epoch: 35, train_loss: 0.8451, test_loss: 0.9693, test_f1: 0.5150
 epoch: 36, train_loss: 0.8410, test_loss: 0.9664, test_f1: 0.5353
 epoch: 37, train_loss: 0.8276, test_loss: 0.9579, test_f1: 0.5166
 epoch: 38, train_loss: 0.8322, test_loss: 0.9494, test_f1: 0.5276
 epoch: 39, train_loss: 0.8358, test_loss: 0.9536, test_f1: 0.5317
 epoch: 40, train_loss: 0.8310, test_loss: 0.9555, test_f1: 0.5416
 epoch: 41, train_loss: 0.8157, test_loss: 0.9606, test_f1: 0.5391
 epoch: 42, train_loss: 0.8209, test_loss: 0.9628, test_f1: 0.5360
 epoch: 43, train_loss: 0.8183, test_loss: 0.9780, test_f1: 0.5391
 epoch: 44, train_loss: 0.8212, test_loss: 0.9620, test_f1: 0.5328
 epoch: 45, train_loss: 0.8063, test_loss: 0.9733, test_f1: 0.5233
 epoch: 46, train_loss: 0.7990, test_loss: 0.9723, test_f1: 0.5529
 epoch: 47, train_loss: 0.8066, test_loss: 0.9517, test_f1: 0.5504
 epoch: 48, train_loss: 0.8015, test_loss: 0.9820, test_f1: 0.5392
 epoch: 49, train_loss: 0.7955, test_loss: 0.9497, test_f1: 0.5592
 epoch: 50, train_loss: 0.8023, test_loss: 0.9543, test_f1: 0.5536
 epoch: 51, train_loss: 0.7895, test_loss: 0.9571, test_f1: 0.5585
 epoch: 52, train_loss: 0.7771, test_loss: 0.9523, test_f1: 0.5645
 epoch: 53, train_loss: 0.7815, test_loss: 0.9420, test_f1: 0.5756
 epoch: 54, train_loss: 0.7804, test_loss: 0.9433, test_f1: 0.5676
 epoch: 55, train_loss: 0.7773, test_loss: 0.9540, test_f1: 0.5643
 epoch: 56, train_loss: 0.7864, test_loss: 0.9498, test_f1: 0.5636
 epoch: 57, train_loss: 0.7772, test_loss: 0.9542, test_f1: 0.5696
 epoch: 58, train_loss: 0.7730, test_loss: 0.9551, test_f1: 0.5610
 epoch: 59, train_loss: 0.7836, test_loss: 0.9575, test_f1: 0.5560
 epoch: 60, train_loss: 0.7642, test_loss: 0.9615, test_f1: 0.5662
 epoch: 61, train_loss: 0.7547, test_loss: 0.9616, test_f1: 0.5695
 epoch: 62, train_loss: 0.7682, test_loss: 0.9688, test_f1: 0.5632
 epoch: 63, train_loss: 0.7552, test_loss: 0.9640, test_f1: 0.5717
 epoch: 64, train_loss: 0.7592, test_loss: 0.9657, test_f1: 0.5842
 epoch: 65, train_loss: 0.7495, test_loss: 0.9695, test_f1: 0.5732
 epoch: 66, train_loss: 0.7593, test_loss: 0.9647, test_f1: 0.5627
 epoch: 67, train_loss: 0.7629, test_loss: 0.9717, test_f1: 0.5627
 epoch: 68, train_loss: 0.7467, test_loss: 0.9557, test_f1: 0.5708
 epoch: 69, train_loss: 0.7489, test_loss: 0.9582, test_f1: 0.5642
 epoch: 70, train_loss: 0.7492, test_loss: 0.9635, test_f1: 0.5551
 epoch: 71, train_loss: 0.7530, test_loss: 0.9584, test_f1: 0.5614
 epoch: 72, train_loss: 0.7486, test_loss: 0.9566, test_f1: 0.5721
 epoch: 73, train_loss: 0.7602, test_loss: 0.9600, test_f1: 0.5863
 epoch: 74, train_loss: 0.7517, test_loss: 0.9559, test_f1: 0.5695
 epoch: 75, train_loss: 0.7443, test_loss: 0.9931, test_f1: 0.5483
 epoch: 76, train_loss: 0.7391, test_loss: 0.9804, test_f1: 0.5765
 epoch: 77, train_loss: 0.7404, test_loss: 0.9749, test_f1: 0.5812
 epoch: 78, train_loss: 0.7448, test_loss: 0.9859, test_f1: 0.5742
 epoch: 79, train_loss: 0.7412, test_loss: 0.9749, test_f1: 0.5819
 epoch: 80, train_loss: 0.7244, test_loss: 1.0092, test_f1: 0.5755
 epoch: 81, train_loss: 0.7232, test_loss: 0.9982, test_f1: 0.5711
 epoch: 82, train_loss: 0.7329, test_loss: 0.9911, test_f1: 0.5803
 epoch: 83, train_loss: 0.7308, test_loss: 0.9951, test_f1: 0.5774
 epoch: 84, train_loss: 0.7249, test_loss: 0.9913, test_f1: 0.5682
 epoch: 85, train_loss: 0.7236, test_loss: 0.9798, test_f1: 0.5954
 epoch: 86, train_loss: 0.7242, test_loss: 0.9883, test_f1: 0.5727
 epoch: 87, train_loss: 0.7286, test_loss: 0.9839, test_f1: 0.5889
 epoch: 88, train_loss: 0.7314, test_loss: 0.9868, test_f1: 0.5764
 epoch: 89, train_loss: 0.7275, test_loss: 0.9860, test_f1: 0.5861
 epoch: 90, train_loss: 0.7233, test_loss: 0.9827, test_f1: 0.5797
 epoch: 91, train_loss: 0.7197, test_loss: 0.9725, test_f1: 0.5929
 epoch: 92, train_loss: 0.7260, test_loss: 0.9897, test_f1: 0.5678
 epoch: 93, train_loss: 0.7142, test_loss: 0.9894, test_f1: 0.5790
 epoch: 94, train_loss: 0.7197, test_loss: 0.9978, test_f1: 0.5784
 epoch: 95, train_loss: 0.7274, test_loss: 0.9950, test_f1: 0.5814
 epoch: 96, train_loss: 0.7148, test_loss: 0.9922, test_f1: 0.5749
 epoch: 97, train_loss: 0.7211, test_loss: 1.0030, test_f1: 0.5901
 epoch: 98, train_loss: 0.7197, test_loss: 0.9906, test_f1: 0.5670
 epoch: 99, train_loss: 0.7073, test_loss: 0.9769, test_f1: 0.5898
##################ITERATION #9 ****************************************
 epoch: 0, train_loss: 1.2622, test_loss: 1.2407, test_f1: 0.2928
 epoch: 1, train_loss: 1.1579, test_loss: 1.0659, test_f1: 0.4150
 epoch: 2, train_loss: 1.1045, test_loss: 1.0430, test_f1: 0.4583
 epoch: 3, train_loss: 1.0833, test_loss: 1.0099, test_f1: 0.4596
 epoch: 4, train_loss: 1.0529, test_loss: 1.0026, test_f1: 0.4625
 epoch: 5, train_loss: 1.0528, test_loss: 0.9930, test_f1: 0.4737
 epoch: 6, train_loss: 1.0182, test_loss: 0.9846, test_f1: 0.4726
 epoch: 7, train_loss: 1.0056, test_loss: 0.9821, test_f1: 0.4903
 epoch: 8, train_loss: 0.9934, test_loss: 0.9654, test_f1: 0.4919
 epoch: 9, train_loss: 0.9748, test_loss: 0.9580, test_f1: 0.4971
 epoch: 10, train_loss: 0.9739, test_loss: 0.9665, test_f1: 0.4973
 epoch: 11, train_loss: 0.9599, test_loss: 0.9760, test_f1: 0.5100
 epoch: 12, train_loss: 0.9524, test_loss: 0.9664, test_f1: 0.5015
 epoch: 13, train_loss: 0.9424, test_loss: 0.9451, test_f1: 0.5133
 epoch: 14, train_loss: 0.9333, test_loss: 0.9385, test_f1: 0.5251
 epoch: 15, train_loss: 0.9355, test_loss: 0.9400, test_f1: 0.5153
 epoch: 16, train_loss: 0.9228, test_loss: 0.9541, test_f1: 0.5045
 epoch: 17, train_loss: 0.9200, test_loss: 0.9480, test_f1: 0.5194
 epoch: 18, train_loss: 0.9101, test_loss: 0.9499, test_f1: 0.5085
 epoch: 19, train_loss: 0.9002, test_loss: 0.9454, test_f1: 0.5206
 epoch: 20, train_loss: 0.8887, test_loss: 0.9296, test_f1: 0.5193
 epoch: 21, train_loss: 0.8919, test_loss: 0.9485, test_f1: 0.5180
 epoch: 22, train_loss: 0.8876, test_loss: 0.9369, test_f1: 0.5194
 epoch: 23, train_loss: 0.8737, test_loss: 0.9448, test_f1: 0.5392
 epoch: 24, train_loss: 0.8884, test_loss: 0.9436, test_f1: 0.5249
 epoch: 25, train_loss: 0.8736, test_loss: 0.9393, test_f1: 0.5220
 epoch: 26, train_loss: 0.8652, test_loss: 0.9448, test_f1: 0.5286
 epoch: 27, train_loss: 0.8780, test_loss: 0.9317, test_f1: 0.5327
 epoch: 28, train_loss: 0.8613, test_loss: 0.9593, test_f1: 0.5399
 epoch: 29, train_loss: 0.8664, test_loss: 0.9527, test_f1: 0.5235
 epoch: 30, train_loss: 0.8611, test_loss: 0.9338, test_f1: 0.5429
 epoch: 31, train_loss: 0.8508, test_loss: 0.9427, test_f1: 0.5344
 epoch: 32, train_loss: 0.8397, test_loss: 0.9469, test_f1: 0.5422
 epoch: 33, train_loss: 0.8369, test_loss: 0.9291, test_f1: 0.5409
 epoch: 34, train_loss: 0.8316, test_loss: 0.9442, test_f1: 0.5318
 epoch: 35, train_loss: 0.8431, test_loss: 0.9396, test_f1: 0.5171
 epoch: 36, train_loss: 0.8262, test_loss: 0.9644, test_f1: 0.5260
 epoch: 37, train_loss: 0.8247, test_loss: 0.9425, test_f1: 0.5558
 epoch: 38, train_loss: 0.8239, test_loss: 0.9448, test_f1: 0.5856
 epoch: 39, train_loss: 0.8176, test_loss: 0.9433, test_f1: 0.5436
 epoch: 40, train_loss: 0.8064, test_loss: 0.9354, test_f1: 0.5478
 epoch: 41, train_loss: 0.8263, test_loss: 0.9485, test_f1: 0.5772
 epoch: 42, train_loss: 0.8132, test_loss: 0.9368, test_f1: 0.5659
 epoch: 43, train_loss: 0.7913, test_loss: 0.9489, test_f1: 0.5749
 epoch: 44, train_loss: 0.7969, test_loss: 0.9414, test_f1: 0.5570
 epoch: 45, train_loss: 0.7947, test_loss: 0.9465, test_f1: 0.5835
 epoch: 46, train_loss: 0.7965, test_loss: 0.9491, test_f1: 0.5912
 epoch: 47, train_loss: 0.7834, test_loss: 0.9529, test_f1: 0.5806
 epoch: 48, train_loss: 0.7886, test_loss: 0.9386, test_f1: 0.5646
 epoch: 49, train_loss: 0.7821, test_loss: 0.9555, test_f1: 0.5559
 epoch: 50, train_loss: 0.7860, test_loss: 0.9543, test_f1: 0.5754
 epoch: 51, train_loss: 0.7779, test_loss: 0.9464, test_f1: 0.5835
 epoch: 52, train_loss: 0.7790, test_loss: 0.9517, test_f1: 0.5691
 epoch: 53, train_loss: 0.7638, test_loss: 0.9575, test_f1: 0.5697
 epoch: 54, train_loss: 0.7653, test_loss: 0.9489, test_f1: 0.5953
 epoch: 55, train_loss: 0.7716, test_loss: 0.9481, test_f1: 0.5840
 epoch: 56, train_loss: 0.7533, test_loss: 0.9482, test_f1: 0.5807
 epoch: 57, train_loss: 0.7737, test_loss: 0.9527, test_f1: 0.5832
 epoch: 58, train_loss: 0.7581, test_loss: 0.9504, test_f1: 0.5739
 epoch: 59, train_loss: 0.7685, test_loss: 0.9618, test_f1: 0.5611
 epoch: 60, train_loss: 0.7603, test_loss: 0.9568, test_f1: 0.5778
 epoch: 61, train_loss: 0.7603, test_loss: 0.9524, test_f1: 0.5836
 epoch: 62, train_loss: 0.7550, test_loss: 0.9582, test_f1: 0.5624
 epoch: 63, train_loss: 0.7386, test_loss: 0.9496, test_f1: 0.5978
 epoch: 64, train_loss: 0.7568, test_loss: 0.9639, test_f1: 0.5883
 epoch: 65, train_loss: 0.7465, test_loss: 0.9581, test_f1: 0.5738
 epoch: 66, train_loss: 0.7471, test_loss: 0.9691, test_f1: 0.5847
 epoch: 67, train_loss: 0.7481, test_loss: 0.9542, test_f1: 0.5812
 epoch: 68, train_loss: 0.7366, test_loss: 0.9458, test_f1: 0.5932
 epoch: 69, train_loss: 0.7518, test_loss: 0.9631, test_f1: 0.5834
 epoch: 70, train_loss: 0.7496, test_loss: 0.9573, test_f1: 0.5871
 epoch: 71, train_loss: 0.7434, test_loss: 0.9367, test_f1: 0.5864
 epoch: 72, train_loss: 0.7372, test_loss: 0.9427, test_f1: 0.5938
 epoch: 73, train_loss: 0.7377, test_loss: 0.9566, test_f1: 0.5997
 epoch: 74, train_loss: 0.7375, test_loss: 0.9625, test_f1: 0.6030
 epoch: 75, train_loss: 0.7413, test_loss: 0.9492, test_f1: 0.5944
 epoch: 76, train_loss: 0.7368, test_loss: 0.9518, test_f1: 0.5901
 epoch: 77, train_loss: 0.7385, test_loss: 0.9513, test_f1: 0.5771
 epoch: 78, train_loss: 0.7375, test_loss: 0.9471, test_f1: 0.5902
 epoch: 79, train_loss: 0.7209, test_loss: 0.9571, test_f1: 0.5886
 epoch: 80, train_loss: 0.7324, test_loss: 0.9677, test_f1: 0.5754
 epoch: 81, train_loss: 0.7399, test_loss: 0.9723, test_f1: 0.5799
 epoch: 82, train_loss: 0.7415, test_loss: 0.9549, test_f1: 0.5942
 epoch: 83, train_loss: 0.7245, test_loss: 0.9521, test_f1: 0.5845
 epoch: 84, train_loss: 0.7183, test_loss: 0.9681, test_f1: 0.5819
 epoch: 85, train_loss: 0.7284, test_loss: 0.9510, test_f1: 0.6041
 epoch: 86, train_loss: 0.7252, test_loss: 0.9632, test_f1: 0.5941
 epoch: 87, train_loss: 0.7242, test_loss: 0.9551, test_f1: 0.5941
 epoch: 88, train_loss: 0.7141, test_loss: 0.9549, test_f1: 0.5907
 epoch: 89, train_loss: 0.7124, test_loss: 0.9478, test_f1: 0.6112
 epoch: 90, train_loss: 0.7259, test_loss: 0.9514, test_f1: 0.5914
 epoch: 91, train_loss: 0.7196, test_loss: 0.9646, test_f1: 0.6009
 epoch: 92, train_loss: 0.7016, test_loss: 0.9595, test_f1: 0.6017
 epoch: 93, train_loss: 0.7152, test_loss: 0.9565, test_f1: 0.5954
 epoch: 94, train_loss: 0.6985, test_loss: 0.9679, test_f1: 0.6056
 epoch: 95, train_loss: 0.7011, test_loss: 0.9598, test_f1: 0.5981
 epoch: 96, train_loss: 0.7129, test_loss: 0.9605, test_f1: 0.5998
 epoch: 97, train_loss: 0.7033, test_loss: 0.9637, test_f1: 0.6065
 epoch: 98, train_loss: 0.6989, test_loss: 0.9825, test_f1: 0.5966
 epoch: 99, train_loss: 0.7034, test_loss: 0.9850, test_f1: 0.5910

Training completed in 1132.98 seconds
Best F1: 0.6113 at epoch 58
Mean F1 across iterations: 0.5979  0.0099
========================FINAL RESULTS================================
FEGIN weighted F1: 0.6113  0.0099
python main.py --data ltspice_examples --representation component_net --model FEGIN --layers 6 --hiddens 64 --batch_size 64 --lr 0.0001 --emb_size 512 --epochs 100 --save_appendix component_net_L6_H64_BS64_LR0.0001_E512 --no_val
-----



STDERR:
  File "main.py", line 370, in <module>
    main()
  File "main.py", line 254, in main
    dataset = dataset_class(
  File "/home/philip/projects/llm_inference_code_repo/Circuit-Completion-Using-GNNs/component_classification_with_link_prediction_head/evaluation/FEGIN/kernel/circuit_datasets.py", line 15, in __init__
    self.data, self.slices = torch.load(self.processed_paths[0])
  File "/home/philip/.local/lib/python3.8/site-packages/torch/serialization.py", line 1040, in load
    warnings.warn(
  File "/usr/lib/python3.8/warnings.py", line 109, in _showwarnmsg
    sw(msg.message, msg.category, msg.filename, msg.lineno,
  File "main.py", line 47, in warn_with_traceback
    traceback.print_stack(file=log)
/home/philip/projects/llm_inference_code_repo/Circuit-Completion-Using-GNNs/component_classification_with_link_prediction_head/evaluation/FEGIN/kernel/circuit_datasets.py:15: FutureWarning: You are using `torch.load` with `weights_only=False` (the current default value), which uses the default pickle module implicitly. It is possible to construct malicious pickle data which will execute arbitrary code during unpickling (See https://github.com/pytorch/pytorch/blob/main/SECURITY.md#untrusted-models for more details). In a future release, the default value for `weights_only` will be flipped to `True`. This limits the functions that could be executed during unpickling. Arbitrary objects will no longer be allowed to be loaded via this mode unless they are explicitly allowlisted by the user via `torch.serialization.add_safe_globals`. We recommend you start setting `weights_only=True` for any use case where you don't have full control of the loaded file. Please open an issue on GitHub for any issues related to this experimental feature.
  self.data, self.slices = torch.load(self.processed_paths[0])
