STDOUT:
Results will be saved in /home/philip/projects/ltspice_examples_code_repo/Circuit-Completion-Using-GNNs/component_classification_with_link_prediction_head/evaluation/FEGIN/results/model_FEGIN_dataset_ltspice_examples
Command line input: python main.py --data ltspice_examples --representation component_component --model FEGIN --layers 5 --hiddens 32 --batch_size 64 --lr 0.01 --emb_size 128 --epochs 100 --save_appendix component_component_L5_H32_BS64_LR0.01_E128 --no_val
 is saved.
-----
ltspice_examples - FEGIN
Using 5 layers, 32 hidden units, h = 2
Loading component_component representation dataset
ENTERED
Training FEGIN on component_component representation
Train: 3556, Test: 845
##################ITERATION #0 ****************************************
 epoch: 0, train_loss: 1.2650, test_loss: 1.4039, test_f1: 0.3093
 epoch: 1, train_loss: 1.2052, test_loss: 1.1591, test_f1: 0.3847
 epoch: 2, train_loss: 1.1610, test_loss: 1.1868, test_f1: 0.3595
 epoch: 3, train_loss: 1.1046, test_loss: 1.0106, test_f1: 0.4647
 epoch: 4, train_loss: 1.0729, test_loss: 1.0532, test_f1: 0.4492
 epoch: 5, train_loss: 1.0661, test_loss: 0.9948, test_f1: 0.4803
 epoch: 6, train_loss: 1.0303, test_loss: 1.2627, test_f1: 0.4347
 epoch: 7, train_loss: 1.0069, test_loss: 1.0505, test_f1: 0.5148
 epoch: 8, train_loss: 0.9948, test_loss: 1.1169, test_f1: 0.5138
 epoch: 9, train_loss: 0.9906, test_loss: 1.0895, test_f1: 0.4717
 epoch: 10, train_loss: 0.9662, test_loss: 1.0492, test_f1: 0.4641
 epoch: 11, train_loss: 0.9682, test_loss: 1.0549, test_f1: 0.4594
 epoch: 12, train_loss: 0.9558, test_loss: 1.0644, test_f1: 0.5254
 epoch: 13, train_loss: 0.9499, test_loss: 1.0060, test_f1: 0.4797
 epoch: 14, train_loss: 0.9484, test_loss: 1.0250, test_f1: 0.4918
 epoch: 15, train_loss: 0.9286, test_loss: 1.0868, test_f1: 0.4882
 epoch: 16, train_loss: 0.9298, test_loss: 1.1380, test_f1: 0.4610
 epoch: 17, train_loss: 0.9272, test_loss: 0.9914, test_f1: 0.5145
 epoch: 18, train_loss: 0.9196, test_loss: 1.0284, test_f1: 0.5022
 epoch: 19, train_loss: 0.9073, test_loss: 1.0646, test_f1: 0.4965
 epoch: 20, train_loss: 0.9206, test_loss: 1.0470, test_f1: 0.5048
 epoch: 21, train_loss: 0.8983, test_loss: 1.1128, test_f1: 0.4693
 epoch: 22, train_loss: 0.8934, test_loss: 1.0737, test_f1: 0.4837
 epoch: 23, train_loss: 0.8859, test_loss: 1.0137, test_f1: 0.5078
 epoch: 24, train_loss: 0.8874, test_loss: 1.0068, test_f1: 0.5056
 epoch: 25, train_loss: 0.8841, test_loss: 1.0797, test_f1: 0.5092
 epoch: 26, train_loss: 0.8822, test_loss: 0.9851, test_f1: 0.5309
 epoch: 27, train_loss: 0.8910, test_loss: 1.1413, test_f1: 0.5147
 epoch: 28, train_loss: 0.8743, test_loss: 0.9951, test_f1: 0.4954
 epoch: 29, train_loss: 0.8529, test_loss: 1.0082, test_f1: 0.5417
 epoch: 30, train_loss: 0.8625, test_loss: 1.0006, test_f1: 0.5251
 epoch: 31, train_loss: 0.8674, test_loss: 1.0260, test_f1: 0.5212
 epoch: 32, train_loss: 0.8446, test_loss: 0.9778, test_f1: 0.5468
 epoch: 33, train_loss: 0.8456, test_loss: 0.9707, test_f1: 0.5348
 epoch: 34, train_loss: 0.8414, test_loss: 0.9778, test_f1: 0.5630
 epoch: 35, train_loss: 0.8464, test_loss: 1.1277, test_f1: 0.5062
 epoch: 36, train_loss: 0.8410, test_loss: 1.1015, test_f1: 0.5111
 epoch: 37, train_loss: 0.8541, test_loss: 0.9529, test_f1: 0.5282
 epoch: 38, train_loss: 0.8421, test_loss: 1.1111, test_f1: 0.5213
 epoch: 39, train_loss: 0.8436, test_loss: 1.0688, test_f1: 0.5345
 epoch: 40, train_loss: 0.8480, test_loss: 1.0134, test_f1: 0.5696
 epoch: 41, train_loss: 0.8456, test_loss: 1.0010, test_f1: 0.5702
 epoch: 42, train_loss: 0.8179, test_loss: 0.9566, test_f1: 0.5651
 epoch: 43, train_loss: 0.8301, test_loss: 1.0083, test_f1: 0.5772
 epoch: 44, train_loss: 0.8121, test_loss: 1.0531, test_f1: 0.5409
 epoch: 45, train_loss: 0.8218, test_loss: 1.0497, test_f1: 0.5171
 epoch: 46, train_loss: 0.8142, test_loss: 1.1281, test_f1: 0.5273
 epoch: 47, train_loss: 0.8036, test_loss: 1.1571, test_f1: 0.5333
 epoch: 48, train_loss: 0.8086, test_loss: 1.0252, test_f1: 0.5656
 epoch: 49, train_loss: 0.8115, test_loss: 1.2387, test_f1: 0.5333
 epoch: 50, train_loss: 0.7976, test_loss: 1.0871, test_f1: 0.5493
 epoch: 51, train_loss: 0.7888, test_loss: 1.0342, test_f1: 0.5707
 epoch: 52, train_loss: 0.7709, test_loss: 1.1110, test_f1: 0.5247
 epoch: 53, train_loss: 0.7631, test_loss: 0.9670, test_f1: 0.5575
 epoch: 54, train_loss: 0.7560, test_loss: 1.0530, test_f1: 0.5615
 epoch: 55, train_loss: 0.7456, test_loss: 1.0452, test_f1: 0.5559
 epoch: 56, train_loss: 0.7532, test_loss: 1.0992, test_f1: 0.5717
 epoch: 57, train_loss: 0.7486, test_loss: 0.9915, test_f1: 0.5620
 epoch: 58, train_loss: 0.7529, test_loss: 1.0842, test_f1: 0.5822
 epoch: 59, train_loss: 0.7472, test_loss: 1.0697, test_f1: 0.5857
 epoch: 60, train_loss: 0.7324, test_loss: 1.0072, test_f1: 0.5718
 epoch: 61, train_loss: 0.7402, test_loss: 0.9920, test_f1: 0.5910
 epoch: 62, train_loss: 0.7298, test_loss: 0.9904, test_f1: 0.5991
 epoch: 63, train_loss: 0.7291, test_loss: 0.9845, test_f1: 0.5773
 epoch: 64, train_loss: 0.7400, test_loss: 0.9901, test_f1: 0.5875
 epoch: 65, train_loss: 0.7194, test_loss: 1.0138, test_f1: 0.5782
 epoch: 66, train_loss: 0.7133, test_loss: 1.0851, test_f1: 0.5839
 epoch: 67, train_loss: 0.7154, test_loss: 1.0641, test_f1: 0.5971
 epoch: 68, train_loss: 0.7074, test_loss: 1.0495, test_f1: 0.6042
 epoch: 69, train_loss: 0.7038, test_loss: 1.0870, test_f1: 0.5794
 epoch: 70, train_loss: 0.7174, test_loss: 1.1091, test_f1: 0.5454
 epoch: 71, train_loss: 0.6937, test_loss: 1.1084, test_f1: 0.5760
 epoch: 72, train_loss: 0.6971, test_loss: 1.0930, test_f1: 0.5952
 epoch: 73, train_loss: 0.7004, test_loss: 1.0891, test_f1: 0.5752
 epoch: 74, train_loss: 0.7025, test_loss: 1.1895, test_f1: 0.5588
 epoch: 75, train_loss: 0.7079, test_loss: 1.1043, test_f1: 0.5884
 epoch: 76, train_loss: 0.6935, test_loss: 1.0584, test_f1: 0.5855
 epoch: 77, train_loss: 0.6888, test_loss: 1.1128, test_f1: 0.5849
 epoch: 78, train_loss: 0.6889, test_loss: 1.2053, test_f1: 0.5836
 epoch: 79, train_loss: 0.7002, test_loss: 1.1180, test_f1: 0.5777
 epoch: 80, train_loss: 0.6872, test_loss: 1.1419, test_f1: 0.5748
 epoch: 81, train_loss: 0.6892, test_loss: 1.0918, test_f1: 0.5781
 epoch: 82, train_loss: 0.6914, test_loss: 1.0993, test_f1: 0.5681
 epoch: 83, train_loss: 0.6947, test_loss: 1.0589, test_f1: 0.6085
 epoch: 84, train_loss: 0.6758, test_loss: 1.1124, test_f1: 0.5679
 epoch: 85, train_loss: 0.6791, test_loss: 1.0999, test_f1: 0.5775
 epoch: 86, train_loss: 0.6852, test_loss: 1.0961, test_f1: 0.5866
 epoch: 87, train_loss: 0.6909, test_loss: 1.1152, test_f1: 0.5839
 epoch: 88, train_loss: 0.6680, test_loss: 1.1284, test_f1: 0.5786
 epoch: 89, train_loss: 0.6608, test_loss: 1.1371, test_f1: 0.5748
 epoch: 90, train_loss: 0.6676, test_loss: 1.0901, test_f1: 0.5907
 epoch: 91, train_loss: 0.6660, test_loss: 1.2142, test_f1: 0.5647
 epoch: 92, train_loss: 0.6689, test_loss: 1.1160, test_f1: 0.5953
 epoch: 93, train_loss: 0.6743, test_loss: 1.1542, test_f1: 0.5768
 epoch: 94, train_loss: 0.6726, test_loss: 1.2397, test_f1: 0.5862
 epoch: 95, train_loss: 0.6635, test_loss: 1.1643, test_f1: 0.5690
 epoch: 96, train_loss: 0.6576, test_loss: 1.0504, test_f1: 0.5865
 epoch: 97, train_loss: 0.6631, test_loss: 1.1929, test_f1: 0.5805
 epoch: 98, train_loss: 0.6669, test_loss: 1.2165, test_f1: 0.5837
 epoch: 99, train_loss: 0.6464, test_loss: 1.0856, test_f1: 0.6037
##################ITERATION #1 ****************************************
 epoch: 0, train_loss: 1.2714, test_loss: 1.1810, test_f1: 0.3104
 epoch: 1, train_loss: 1.1962, test_loss: 1.1099, test_f1: 0.3874
 epoch: 2, train_loss: 1.1265, test_loss: 1.0328, test_f1: 0.4610
 epoch: 3, train_loss: 1.0736, test_loss: 1.0461, test_f1: 0.4726
 epoch: 4, train_loss: 1.0445, test_loss: 0.9425, test_f1: 0.4740
 epoch: 5, train_loss: 1.0128, test_loss: 0.9085, test_f1: 0.5008
 epoch: 6, train_loss: 0.9879, test_loss: 0.8829, test_f1: 0.4930
 epoch: 7, train_loss: 0.9688, test_loss: 0.9483, test_f1: 0.4740
 epoch: 8, train_loss: 0.9730, test_loss: 1.0104, test_f1: 0.4718
 epoch: 9, train_loss: 0.9573, test_loss: 0.9064, test_f1: 0.5037
 epoch: 10, train_loss: 0.9387, test_loss: 0.9039, test_f1: 0.4935
 epoch: 11, train_loss: 0.9410, test_loss: 0.9050, test_f1: 0.4952
 epoch: 12, train_loss: 0.9560, test_loss: 1.0077, test_f1: 0.4987
 epoch: 13, train_loss: 0.9422, test_loss: 1.0213, test_f1: 0.4757
 epoch: 14, train_loss: 0.9284, test_loss: 0.9793, test_f1: 0.4895
 epoch: 15, train_loss: 0.9254, test_loss: 0.9808, test_f1: 0.5090
 epoch: 16, train_loss: 0.9409, test_loss: 0.8880, test_f1: 0.5189
 epoch: 17, train_loss: 0.9303, test_loss: 1.0825, test_f1: 0.5126
 epoch: 18, train_loss: 0.9103, test_loss: 0.8475, test_f1: 0.5248
 epoch: 19, train_loss: 0.8991, test_loss: 0.9333, test_f1: 0.5268
 epoch: 20, train_loss: 0.8899, test_loss: 0.9015, test_f1: 0.5129
 epoch: 21, train_loss: 0.8890, test_loss: 0.9517, test_f1: 0.5030
 epoch: 22, train_loss: 0.8693, test_loss: 1.0036, test_f1: 0.5197
 epoch: 23, train_loss: 0.8870, test_loss: 0.9332, test_f1: 0.5253
 epoch: 24, train_loss: 0.8852, test_loss: 1.0016, test_f1: 0.5039
 epoch: 25, train_loss: 0.8765, test_loss: 0.8679, test_f1: 0.5066
 epoch: 26, train_loss: 0.8687, test_loss: 1.0083, test_f1: 0.5263
 epoch: 27, train_loss: 0.8464, test_loss: 0.9699, test_f1: 0.5071
 epoch: 28, train_loss: 0.8652, test_loss: 1.0067, test_f1: 0.5270
 epoch: 29, train_loss: 0.8458, test_loss: 0.9816, test_f1: 0.5174
 epoch: 30, train_loss: 0.8596, test_loss: 1.1431, test_f1: 0.4974
 epoch: 31, train_loss: 0.8577, test_loss: 1.0469, test_f1: 0.5052
 epoch: 32, train_loss: 0.8527, test_loss: 1.0030, test_f1: 0.5257
 epoch: 33, train_loss: 0.8449, test_loss: 0.9990, test_f1: 0.4975
 epoch: 34, train_loss: 0.8419, test_loss: 0.9676, test_f1: 0.5315
 epoch: 35, train_loss: 0.8488, test_loss: 0.9633, test_f1: 0.4971
 epoch: 36, train_loss: 0.8523, test_loss: 0.9090, test_f1: 0.5221
 epoch: 37, train_loss: 0.8255, test_loss: 1.0401, test_f1: 0.4875
 epoch: 38, train_loss: 0.8521, test_loss: 0.9983, test_f1: 0.4946
 epoch: 39, train_loss: 0.8202, test_loss: 1.0985, test_f1: 0.4975
 epoch: 40, train_loss: 0.8269, test_loss: 1.0344, test_f1: 0.4842
 epoch: 41, train_loss: 0.8324, test_loss: 0.9856, test_f1: 0.5405
 epoch: 42, train_loss: 0.8144, test_loss: 0.9103, test_f1: 0.5141
 epoch: 43, train_loss: 0.8089, test_loss: 0.9914, test_f1: 0.5312
 epoch: 44, train_loss: 0.8026, test_loss: 0.9946, test_f1: 0.5336
 epoch: 45, train_loss: 0.8020, test_loss: 1.0975, test_f1: 0.5025
 epoch: 46, train_loss: 0.8063, test_loss: 1.1215, test_f1: 0.5366
 epoch: 47, train_loss: 0.8227, test_loss: 0.9288, test_f1: 0.5142
 epoch: 48, train_loss: 0.8015, test_loss: 1.0189, test_f1: 0.5240
 epoch: 49, train_loss: 0.8232, test_loss: 0.9242, test_f1: 0.5210
 epoch: 50, train_loss: 0.7982, test_loss: 0.8928, test_f1: 0.5527
 epoch: 51, train_loss: 0.7801, test_loss: 0.9708, test_f1: 0.5679
 epoch: 52, train_loss: 0.7557, test_loss: 1.0721, test_f1: 0.5129
 epoch: 53, train_loss: 0.7587, test_loss: 0.9780, test_f1: 0.5197
 epoch: 54, train_loss: 0.7378, test_loss: 1.1728, test_f1: 0.5222
 epoch: 55, train_loss: 0.7347, test_loss: 1.0514, test_f1: 0.5671
 epoch: 56, train_loss: 0.7460, test_loss: 0.9145, test_f1: 0.5590
 epoch: 57, train_loss: 0.7461, test_loss: 1.0177, test_f1: 0.5584
 epoch: 58, train_loss: 0.7232, test_loss: 0.9681, test_f1: 0.5691
 epoch: 59, train_loss: 0.7142, test_loss: 1.0518, test_f1: 0.5460
 epoch: 60, train_loss: 0.7412, test_loss: 1.0262, test_f1: 0.5356
 epoch: 61, train_loss: 0.7329, test_loss: 1.0137, test_f1: 0.5482
 epoch: 62, train_loss: 0.7365, test_loss: 1.0788, test_f1: 0.5378
 epoch: 63, train_loss: 0.7383, test_loss: 1.0318, test_f1: 0.5647
 epoch: 64, train_loss: 0.7300, test_loss: 1.1214, test_f1: 0.5349
 epoch: 65, train_loss: 0.7214, test_loss: 1.0138, test_f1: 0.5492
 epoch: 66, train_loss: 0.7114, test_loss: 1.1227, test_f1: 0.5484
 epoch: 67, train_loss: 0.7175, test_loss: 1.0963, test_f1: 0.5501
 epoch: 68, train_loss: 0.7133, test_loss: 1.0337, test_f1: 0.5434
 epoch: 69, train_loss: 0.7158, test_loss: 1.0037, test_f1: 0.5598
 epoch: 70, train_loss: 0.7010, test_loss: 1.0709, test_f1: 0.5669
 epoch: 71, train_loss: 0.7098, test_loss: 1.0967, test_f1: 0.5408
 epoch: 72, train_loss: 0.7074, test_loss: 1.1608, test_f1: 0.5048
 epoch: 73, train_loss: 0.7021, test_loss: 1.0104, test_f1: 0.5564
 epoch: 74, train_loss: 0.7112, test_loss: 0.9852, test_f1: 0.5544
 epoch: 75, train_loss: 0.7032, test_loss: 0.9672, test_f1: 0.5654
 epoch: 76, train_loss: 0.7195, test_loss: 1.0291, test_f1: 0.5638
 epoch: 77, train_loss: 0.6928, test_loss: 1.1973, test_f1: 0.5324
 epoch: 78, train_loss: 0.6933, test_loss: 1.0349, test_f1: 0.5624
 epoch: 79, train_loss: 0.6990, test_loss: 1.0070, test_f1: 0.5506
 epoch: 80, train_loss: 0.6862, test_loss: 1.1385, test_f1: 0.5299
 epoch: 81, train_loss: 0.6713, test_loss: 1.0662, test_f1: 0.5629
 epoch: 82, train_loss: 0.6809, test_loss: 1.0806, test_f1: 0.5548
 epoch: 83, train_loss: 0.6928, test_loss: 1.1259, test_f1: 0.5359
 epoch: 84, train_loss: 0.6747, test_loss: 1.1133, test_f1: 0.5469
 epoch: 85, train_loss: 0.6887, test_loss: 1.0006, test_f1: 0.5560
 epoch: 86, train_loss: 0.6789, test_loss: 1.1283, test_f1: 0.5433
 epoch: 87, train_loss: 0.6647, test_loss: 1.1138, test_f1: 0.5542
 epoch: 88, train_loss: 0.6873, test_loss: 1.1558, test_f1: 0.5330
 epoch: 89, train_loss: 0.6704, test_loss: 1.1062, test_f1: 0.5630
 epoch: 90, train_loss: 0.6913, test_loss: 1.0865, test_f1: 0.5253
 epoch: 91, train_loss: 0.6738, test_loss: 1.1097, test_f1: 0.5553
 epoch: 92, train_loss: 0.6587, test_loss: 1.1169, test_f1: 0.5425
 epoch: 93, train_loss: 0.6707, test_loss: 1.0968, test_f1: 0.5491
 epoch: 94, train_loss: 0.6679, test_loss: 1.1145, test_f1: 0.5613
 epoch: 95, train_loss: 0.6791, test_loss: 1.1136, test_f1: 0.5467
 epoch: 96, train_loss: 0.6518, test_loss: 1.1088, test_f1: 0.5573
 epoch: 97, train_loss: 0.6556, test_loss: 1.1358, test_f1: 0.5492
 epoch: 98, train_loss: 0.6851, test_loss: 1.1180, test_f1: 0.5725
 epoch: 99, train_loss: 0.6759, test_loss: 1.0784, test_f1: 0.5238
##################ITERATION #2 ****************************************
 epoch: 0, train_loss: 1.2865, test_loss: 1.2979, test_f1: 0.3294
 epoch: 1, train_loss: 1.1927, test_loss: 1.1139, test_f1: 0.4085
 epoch: 2, train_loss: 1.1029, test_loss: 1.0208, test_f1: 0.4331
 epoch: 3, train_loss: 1.0731, test_loss: 1.0082, test_f1: 0.4560
 epoch: 4, train_loss: 1.0350, test_loss: 0.9446, test_f1: 0.4811
 epoch: 5, train_loss: 1.0186, test_loss: 0.9556, test_f1: 0.4490
 epoch: 6, train_loss: 1.0094, test_loss: 0.9590, test_f1: 0.4791
 epoch: 7, train_loss: 0.9699, test_loss: 0.9271, test_f1: 0.5090
 epoch: 8, train_loss: 0.9668, test_loss: 1.0184, test_f1: 0.5368
 epoch: 9, train_loss: 0.9818, test_loss: 0.9979, test_f1: 0.4800
 epoch: 10, train_loss: 0.9696, test_loss: 1.0179, test_f1: 0.4866
 epoch: 11, train_loss: 0.9370, test_loss: 0.9873, test_f1: 0.5041
 epoch: 12, train_loss: 0.9262, test_loss: 1.0474, test_f1: 0.4871
 epoch: 13, train_loss: 0.9329, test_loss: 0.9874, test_f1: 0.5331
 epoch: 14, train_loss: 0.9189, test_loss: 1.0626, test_f1: 0.4985
 epoch: 15, train_loss: 0.9284, test_loss: 1.0626, test_f1: 0.4871
 epoch: 16, train_loss: 0.9053, test_loss: 1.0292, test_f1: 0.4936
 epoch: 17, train_loss: 0.9021, test_loss: 1.0049, test_f1: 0.5025
 epoch: 18, train_loss: 0.8980, test_loss: 1.0426, test_f1: 0.4797
 epoch: 19, train_loss: 0.8947, test_loss: 0.9227, test_f1: 0.5241
 epoch: 20, train_loss: 0.9043, test_loss: 0.9763, test_f1: 0.5459
 epoch: 21, train_loss: 0.8874, test_loss: 1.0053, test_f1: 0.4925
 epoch: 22, train_loss: 0.8848, test_loss: 0.9871, test_f1: 0.5132
 epoch: 23, train_loss: 0.8668, test_loss: 0.9709, test_f1: 0.5120
 epoch: 24, train_loss: 0.8752, test_loss: 0.9720, test_f1: 0.5760
 epoch: 25, train_loss: 0.8637, test_loss: 1.1288, test_f1: 0.5276
 epoch: 26, train_loss: 0.8681, test_loss: 1.0219, test_f1: 0.5269
 epoch: 27, train_loss: 0.8488, test_loss: 1.0332, test_f1: 0.5297
 epoch: 28, train_loss: 0.8579, test_loss: 1.0129, test_f1: 0.5405
 epoch: 29, train_loss: 0.8427, test_loss: 0.9715, test_f1: 0.5326
 epoch: 30, train_loss: 0.8525, test_loss: 0.9752, test_f1: 0.5667
 epoch: 31, train_loss: 0.8482, test_loss: 0.9719, test_f1: 0.5394
 epoch: 32, train_loss: 0.8478, test_loss: 1.1436, test_f1: 0.5247
 epoch: 33, train_loss: 0.8398, test_loss: 1.0338, test_f1: 0.5411
 epoch: 34, train_loss: 0.8476, test_loss: 1.1874, test_f1: 0.5241
 epoch: 35, train_loss: 0.8431, test_loss: 1.0687, test_f1: 0.5585
 epoch: 36, train_loss: 0.8283, test_loss: 1.0020, test_f1: 0.5322
 epoch: 37, train_loss: 0.8163, test_loss: 1.0060, test_f1: 0.5481
 epoch: 38, train_loss: 0.8546, test_loss: 1.1489, test_f1: 0.5124
 epoch: 39, train_loss: 0.8188, test_loss: 1.0685, test_f1: 0.5413
 epoch: 40, train_loss: 0.8238, test_loss: 1.0881, test_f1: 0.5094
 epoch: 41, train_loss: 0.8256, test_loss: 0.9981, test_f1: 0.5317
 epoch: 42, train_loss: 0.8052, test_loss: 1.0952, test_f1: 0.5600
 epoch: 43, train_loss: 0.8157, test_loss: 1.0198, test_f1: 0.5596
 epoch: 44, train_loss: 0.7924, test_loss: 1.1383, test_f1: 0.5693
 epoch: 45, train_loss: 0.8024, test_loss: 1.0652, test_f1: 0.5465
 epoch: 46, train_loss: 0.7900, test_loss: 1.0298, test_f1: 0.5526
 epoch: 47, train_loss: 0.8102, test_loss: 1.0318, test_f1: 0.5144
 epoch: 48, train_loss: 0.8073, test_loss: 1.0434, test_f1: 0.5658
 epoch: 49, train_loss: 0.7973, test_loss: 1.0581, test_f1: 0.5521
 epoch: 50, train_loss: 0.7924, test_loss: 1.0136, test_f1: 0.5618
 epoch: 51, train_loss: 0.7612, test_loss: 1.0512, test_f1: 0.5735
 epoch: 52, train_loss: 0.7461, test_loss: 1.0426, test_f1: 0.5392
 epoch: 53, train_loss: 0.7371, test_loss: 1.0779, test_f1: 0.5473
 epoch: 54, train_loss: 0.7403, test_loss: 1.1480, test_f1: 0.5134
 epoch: 55, train_loss: 0.7294, test_loss: 1.1424, test_f1: 0.5372
 epoch: 56, train_loss: 0.7286, test_loss: 1.0948, test_f1: 0.5646
 epoch: 57, train_loss: 0.7115, test_loss: 1.0826, test_f1: 0.5718
 epoch: 58, train_loss: 0.7235, test_loss: 1.0477, test_f1: 0.5729
 epoch: 59, train_loss: 0.7174, test_loss: 1.2302, test_f1: 0.5484
 epoch: 60, train_loss: 0.7148, test_loss: 1.1519, test_f1: 0.5482
 epoch: 61, train_loss: 0.7173, test_loss: 1.1367, test_f1: 0.5272
 epoch: 62, train_loss: 0.7163, test_loss: 1.0443, test_f1: 0.5374
 epoch: 63, train_loss: 0.7082, test_loss: 1.0414, test_f1: 0.5570
 epoch: 64, train_loss: 0.7230, test_loss: 1.0502, test_f1: 0.5623
 epoch: 65, train_loss: 0.7079, test_loss: 1.1180, test_f1: 0.5613
 epoch: 66, train_loss: 0.7215, test_loss: 1.1369, test_f1: 0.5553
 epoch: 67, train_loss: 0.7100, test_loss: 1.1807, test_f1: 0.5568
 epoch: 68, train_loss: 0.6940, test_loss: 1.2884, test_f1: 0.5380
 epoch: 69, train_loss: 0.7041, test_loss: 1.1865, test_f1: 0.5331
 epoch: 70, train_loss: 0.7048, test_loss: 1.1212, test_f1: 0.5532
 epoch: 71, train_loss: 0.6971, test_loss: 1.1533, test_f1: 0.5393
 epoch: 72, train_loss: 0.6897, test_loss: 1.0801, test_f1: 0.5333
 epoch: 73, train_loss: 0.6839, test_loss: 1.2158, test_f1: 0.5413
 epoch: 74, train_loss: 0.6799, test_loss: 1.1419, test_f1: 0.5309
 epoch: 75, train_loss: 0.6796, test_loss: 1.3121, test_f1: 0.5293
 epoch: 76, train_loss: 0.6740, test_loss: 1.1129, test_f1: 0.5356
 epoch: 77, train_loss: 0.6756, test_loss: 1.3445, test_f1: 0.5356
 epoch: 78, train_loss: 0.6742, test_loss: 1.1054, test_f1: 0.5895
 epoch: 79, train_loss: 0.6744, test_loss: 1.0685, test_f1: 0.5518
 epoch: 80, train_loss: 0.6743, test_loss: 1.1831, test_f1: 0.5433
 epoch: 81, train_loss: 0.6903, test_loss: 1.2588, test_f1: 0.5382
 epoch: 82, train_loss: 0.6527, test_loss: 1.1802, test_f1: 0.5547
 epoch: 83, train_loss: 0.6730, test_loss: 1.1764, test_f1: 0.5562
 epoch: 84, train_loss: 0.6730, test_loss: 1.2237, test_f1: 0.5402
 epoch: 85, train_loss: 0.6615, test_loss: 1.1620, test_f1: 0.5540
 epoch: 86, train_loss: 0.6402, test_loss: 1.1775, test_f1: 0.5645
 epoch: 87, train_loss: 0.6582, test_loss: 1.1363, test_f1: 0.5529
 epoch: 88, train_loss: 0.6514, test_loss: 1.2662, test_f1: 0.5592
 epoch: 89, train_loss: 0.6508, test_loss: 1.1687, test_f1: 0.5758
 epoch: 90, train_loss: 0.6557, test_loss: 1.2700, test_f1: 0.5464
 epoch: 91, train_loss: 0.6608, test_loss: 1.2035, test_f1: 0.5488
 epoch: 92, train_loss: 0.6625, test_loss: 1.1998, test_f1: 0.5560
 epoch: 93, train_loss: 0.6578, test_loss: 1.3240, test_f1: 0.5552
 epoch: 94, train_loss: 0.6327, test_loss: 1.4228, test_f1: 0.5287
 epoch: 95, train_loss: 0.6496, test_loss: 1.3159, test_f1: 0.5288
 epoch: 96, train_loss: 0.6423, test_loss: 1.2225, test_f1: 0.5519
 epoch: 97, train_loss: 0.6383, test_loss: 1.3388, test_f1: 0.5664
 epoch: 98, train_loss: 0.6528, test_loss: 1.3760, test_f1: 0.5272
 epoch: 99, train_loss: 0.6568, test_loss: 1.1805, test_f1: 0.5734
##################ITERATION #3 ****************************************
 epoch: 0, train_loss: 1.2823, test_loss: 1.1676, test_f1: 0.3700
 epoch: 1, train_loss: 1.1856, test_loss: 1.1239, test_f1: 0.3496
 epoch: 2, train_loss: 1.1317, test_loss: 1.2049, test_f1: 0.4068
 epoch: 3, train_loss: 1.0926, test_loss: 1.0524, test_f1: 0.4535
 epoch: 4, train_loss: 1.0418, test_loss: 1.2511, test_f1: 0.4465
 epoch: 5, train_loss: 1.0203, test_loss: 1.0003, test_f1: 0.4630
 epoch: 6, train_loss: 1.0118, test_loss: 0.9845, test_f1: 0.4701
 epoch: 7, train_loss: 0.9874, test_loss: 0.9664, test_f1: 0.4836
 epoch: 8, train_loss: 0.9641, test_loss: 1.0231, test_f1: 0.4746
 epoch: 9, train_loss: 0.9479, test_loss: 1.0070, test_f1: 0.5006
 epoch: 10, train_loss: 0.9594, test_loss: 1.0398, test_f1: 0.4924
 epoch: 11, train_loss: 0.9306, test_loss: 1.0693, test_f1: 0.4962
 epoch: 12, train_loss: 0.9438, test_loss: 1.0107, test_f1: 0.5116
 epoch: 13, train_loss: 0.9111, test_loss: 1.1031, test_f1: 0.4747
 epoch: 14, train_loss: 0.9104, test_loss: 1.0739, test_f1: 0.4987
 epoch: 15, train_loss: 0.8975, test_loss: 1.0816, test_f1: 0.5176
 epoch: 16, train_loss: 0.9009, test_loss: 0.9883, test_f1: 0.5431
 epoch: 17, train_loss: 0.8842, test_loss: 0.9702, test_f1: 0.5384
 epoch: 18, train_loss: 0.8893, test_loss: 1.0045, test_f1: 0.5133
 epoch: 19, train_loss: 0.8912, test_loss: 0.9712, test_f1: 0.5284
 epoch: 20, train_loss: 0.8871, test_loss: 0.9722, test_f1: 0.5394
 epoch: 21, train_loss: 0.8793, test_loss: 1.1220, test_f1: 0.5126
 epoch: 22, train_loss: 0.8692, test_loss: 0.9732, test_f1: 0.5546
 epoch: 23, train_loss: 0.8482, test_loss: 0.9986, test_f1: 0.5292
 epoch: 24, train_loss: 0.8660, test_loss: 1.0570, test_f1: 0.5163
 epoch: 25, train_loss: 0.8426, test_loss: 1.0545, test_f1: 0.5095
 epoch: 26, train_loss: 0.8465, test_loss: 0.9624, test_f1: 0.5750
 epoch: 27, train_loss: 0.8481, test_loss: 0.9826, test_f1: 0.5627
 epoch: 28, train_loss: 0.8337, test_loss: 0.9685, test_f1: 0.5651
 epoch: 29, train_loss: 0.8378, test_loss: 1.0132, test_f1: 0.5494
 epoch: 30, train_loss: 0.8306, test_loss: 0.9974, test_f1: 0.5507
 epoch: 31, train_loss: 0.8191, test_loss: 0.9167, test_f1: 0.5572
 epoch: 32, train_loss: 0.8181, test_loss: 0.9985, test_f1: 0.5607
 epoch: 33, train_loss: 0.8189, test_loss: 0.9771, test_f1: 0.5530
 epoch: 34, train_loss: 0.8224, test_loss: 1.1422, test_f1: 0.5166
 epoch: 35, train_loss: 0.8484, test_loss: 0.9468, test_f1: 0.5243
 epoch: 36, train_loss: 0.8157, test_loss: 1.0180, test_f1: 0.5219
 epoch: 37, train_loss: 0.8079, test_loss: 1.0025, test_f1: 0.5510
 epoch: 38, train_loss: 0.8046, test_loss: 0.9679, test_f1: 0.5433
 epoch: 39, train_loss: 0.8012, test_loss: 0.9736, test_f1: 0.5740
 epoch: 40, train_loss: 0.8015, test_loss: 0.9945, test_f1: 0.5923
 epoch: 41, train_loss: 0.7954, test_loss: 1.0574, test_f1: 0.5440
 epoch: 42, train_loss: 0.7853, test_loss: 0.9654, test_f1: 0.5639
 epoch: 43, train_loss: 0.7665, test_loss: 0.9955, test_f1: 0.5678
 epoch: 44, train_loss: 0.7629, test_loss: 1.0252, test_f1: 0.5763
 epoch: 45, train_loss: 0.8111, test_loss: 1.0518, test_f1: 0.5302
 epoch: 46, train_loss: 0.7845, test_loss: 1.1363, test_f1: 0.5305
 epoch: 47, train_loss: 0.7733, test_loss: 1.1244, test_f1: 0.5275
 epoch: 48, train_loss: 0.7672, test_loss: 1.0173, test_f1: 0.5868
 epoch: 49, train_loss: 0.7868, test_loss: 1.0255, test_f1: 0.5420
 epoch: 50, train_loss: 0.7786, test_loss: 0.9503, test_f1: 0.5750
 epoch: 51, train_loss: 0.7495, test_loss: 1.0251, test_f1: 0.5741
 epoch: 52, train_loss: 0.7339, test_loss: 1.0745, test_f1: 0.5744
 epoch: 53, train_loss: 0.7253, test_loss: 1.0497, test_f1: 0.5818
 epoch: 54, train_loss: 0.7082, test_loss: 1.0568, test_f1: 0.5996
 epoch: 55, train_loss: 0.7075, test_loss: 1.0956, test_f1: 0.5704
 epoch: 56, train_loss: 0.6987, test_loss: 1.0492, test_f1: 0.5549
 epoch: 57, train_loss: 0.7214, test_loss: 1.0640, test_f1: 0.5574
 epoch: 58, train_loss: 0.6910, test_loss: 1.0269, test_f1: 0.5837
 epoch: 59, train_loss: 0.7037, test_loss: 1.0173, test_f1: 0.5792
 epoch: 60, train_loss: 0.7141, test_loss: 0.9975, test_f1: 0.5754
 epoch: 61, train_loss: 0.6896, test_loss: 1.0383, test_f1: 0.6003
 epoch: 62, train_loss: 0.6907, test_loss: 1.1222, test_f1: 0.5610
 epoch: 63, train_loss: 0.6949, test_loss: 1.1024, test_f1: 0.5666
 epoch: 64, train_loss: 0.6887, test_loss: 0.9964, test_f1: 0.5806
 epoch: 65, train_loss: 0.6895, test_loss: 1.2811, test_f1: 0.5294
 epoch: 66, train_loss: 0.6898, test_loss: 1.0568, test_f1: 0.5490
 epoch: 67, train_loss: 0.6882, test_loss: 1.0935, test_f1: 0.5761
 epoch: 68, train_loss: 0.6847, test_loss: 1.1063, test_f1: 0.5639
 epoch: 69, train_loss: 0.6750, test_loss: 1.1164, test_f1: 0.5819
 epoch: 70, train_loss: 0.6664, test_loss: 1.1451, test_f1: 0.5682
 epoch: 71, train_loss: 0.6619, test_loss: 1.1266, test_f1: 0.5965
 epoch: 72, train_loss: 0.6559, test_loss: 1.1444, test_f1: 0.5775
 epoch: 73, train_loss: 0.6721, test_loss: 1.3876, test_f1: 0.5415
 epoch: 74, train_loss: 0.6476, test_loss: 1.1234, test_f1: 0.5860
 epoch: 75, train_loss: 0.6596, test_loss: 1.1755, test_f1: 0.5902
 epoch: 76, train_loss: 0.6626, test_loss: 1.2360, test_f1: 0.5632
 epoch: 77, train_loss: 0.6670, test_loss: 1.0774, test_f1: 0.5812
 epoch: 78, train_loss: 0.6540, test_loss: 1.2464, test_f1: 0.5651
 epoch: 79, train_loss: 0.6651, test_loss: 1.2556, test_f1: 0.5588
 epoch: 80, train_loss: 0.6513, test_loss: 1.1996, test_f1: 0.5781
 epoch: 81, train_loss: 0.6325, test_loss: 1.4032, test_f1: 0.5443
 epoch: 82, train_loss: 0.6453, test_loss: 1.2068, test_f1: 0.5346
 epoch: 83, train_loss: 0.6308, test_loss: 1.2517, test_f1: 0.5629
 epoch: 84, train_loss: 0.6343, test_loss: 1.2698, test_f1: 0.5604
 epoch: 85, train_loss: 0.6630, test_loss: 1.2181, test_f1: 0.5638
 epoch: 86, train_loss: 0.6363, test_loss: 1.3542, test_f1: 0.5453
 epoch: 87, train_loss: 0.6310, test_loss: 1.2384, test_f1: 0.5800
 epoch: 88, train_loss: 0.6363, test_loss: 1.4308, test_f1: 0.5513
 epoch: 89, train_loss: 0.6295, test_loss: 1.1650, test_f1: 0.5839
 epoch: 90, train_loss: 0.6190, test_loss: 1.2712, test_f1: 0.5693
 epoch: 91, train_loss: 0.7242, test_loss: 1.2448, test_f1: 0.5510
 epoch: 92, train_loss: 0.6706, test_loss: 1.2190, test_f1: 0.5646
 epoch: 93, train_loss: 0.6353, test_loss: 1.2082, test_f1: 0.5798
 epoch: 94, train_loss: 0.6379, test_loss: 1.1105, test_f1: 0.5657
 epoch: 95, train_loss: 0.6329, test_loss: 1.2098, test_f1: 0.5543
 epoch: 96, train_loss: 0.6357, test_loss: 1.0882, test_f1: 0.5543
 epoch: 97, train_loss: 0.6304, test_loss: 1.1884, test_f1: 0.5604
 epoch: 98, train_loss: 0.6164, test_loss: 1.2682, test_f1: 0.5661
 epoch: 99, train_loss: 0.6066, test_loss: 1.2645, test_f1: 0.5629
##################ITERATION #4 ****************************************
 epoch: 0, train_loss: 1.2525, test_loss: 1.2473, test_f1: 0.3509
 epoch: 1, train_loss: 1.1683, test_loss: 1.0768, test_f1: 0.4339
 epoch: 2, train_loss: 1.0904, test_loss: 0.9882, test_f1: 0.4725
 epoch: 3, train_loss: 1.0515, test_loss: 1.0309, test_f1: 0.4596
 epoch: 4, train_loss: 1.0424, test_loss: 1.0211, test_f1: 0.4457
 epoch: 5, train_loss: 1.0353, test_loss: 0.9879, test_f1: 0.5051
 epoch: 6, train_loss: 0.9945, test_loss: 0.9978, test_f1: 0.4803
 epoch: 7, train_loss: 0.9890, test_loss: 0.9854, test_f1: 0.4483
 epoch: 8, train_loss: 0.9764, test_loss: 1.0271, test_f1: 0.4882
 epoch: 9, train_loss: 0.9749, test_loss: 1.0052, test_f1: 0.4697
 epoch: 10, train_loss: 0.9600, test_loss: 1.0064, test_f1: 0.4659
 epoch: 11, train_loss: 0.9477, test_loss: 0.9990, test_f1: 0.4917
 epoch: 12, train_loss: 0.9390, test_loss: 0.9415, test_f1: 0.5007
 epoch: 13, train_loss: 0.9528, test_loss: 0.9490, test_f1: 0.4681
 epoch: 14, train_loss: 0.9297, test_loss: 0.9279, test_f1: 0.5369
 epoch: 15, train_loss: 0.9507, test_loss: 0.9962, test_f1: 0.4668
 epoch: 16, train_loss: 0.9262, test_loss: 0.9895, test_f1: 0.4932
 epoch: 17, train_loss: 0.9145, test_loss: 0.9756, test_f1: 0.5075
 epoch: 18, train_loss: 0.8977, test_loss: 0.9866, test_f1: 0.4917
 epoch: 19, train_loss: 0.8801, test_loss: 0.9526, test_f1: 0.5009
 epoch: 20, train_loss: 0.8998, test_loss: 1.0232, test_f1: 0.4768
 epoch: 21, train_loss: 0.8883, test_loss: 1.1627, test_f1: 0.4598
 epoch: 22, train_loss: 0.8794, test_loss: 1.0608, test_f1: 0.4862
 epoch: 23, train_loss: 0.8676, test_loss: 1.1956, test_f1: 0.4789
 epoch: 24, train_loss: 0.8565, test_loss: 1.1127, test_f1: 0.4746
 epoch: 25, train_loss: 0.8628, test_loss: 1.0421, test_f1: 0.4916
 epoch: 26, train_loss: 0.8609, test_loss: 1.0588, test_f1: 0.5103
 epoch: 27, train_loss: 0.8737, test_loss: 1.0690, test_f1: 0.4856
 epoch: 28, train_loss: 0.8728, test_loss: 0.9809, test_f1: 0.5252
 epoch: 29, train_loss: 0.8524, test_loss: 0.9881, test_f1: 0.5294
 epoch: 30, train_loss: 0.8443, test_loss: 1.1212, test_f1: 0.5006
 epoch: 31, train_loss: 0.8552, test_loss: 1.0688, test_f1: 0.4778
 epoch: 32, train_loss: 0.8368, test_loss: 0.8392, test_f1: 0.5539
 epoch: 33, train_loss: 0.8326, test_loss: 1.1036, test_f1: 0.5375
 epoch: 34, train_loss: 0.8378, test_loss: 0.9125, test_f1: 0.5093
 epoch: 35, train_loss: 0.8553, test_loss: 0.9657, test_f1: 0.5202
 epoch: 36, train_loss: 0.8372, test_loss: 0.9130, test_f1: 0.5187
 epoch: 37, train_loss: 0.8321, test_loss: 1.0451, test_f1: 0.4900
 epoch: 38, train_loss: 0.8449, test_loss: 1.0292, test_f1: 0.5225
 epoch: 39, train_loss: 0.8466, test_loss: 1.0109, test_f1: 0.5250
 epoch: 40, train_loss: 0.8283, test_loss: 0.9697, test_f1: 0.5534
 epoch: 41, train_loss: 0.8053, test_loss: 1.2242, test_f1: 0.5187
 epoch: 42, train_loss: 0.8299, test_loss: 1.0015, test_f1: 0.5224
 epoch: 43, train_loss: 0.8002, test_loss: 1.0271, test_f1: 0.5263
 epoch: 44, train_loss: 0.8091, test_loss: 0.9929, test_f1: 0.5128
 epoch: 45, train_loss: 0.8097, test_loss: 1.2215, test_f1: 0.4730
 epoch: 46, train_loss: 0.7946, test_loss: 0.9066, test_f1: 0.5268
 epoch: 47, train_loss: 0.7962, test_loss: 1.1671, test_f1: 0.4991
 epoch: 48, train_loss: 0.8047, test_loss: 0.9924, test_f1: 0.5582
 epoch: 49, train_loss: 0.7849, test_loss: 0.9590, test_f1: 0.5622
 epoch: 50, train_loss: 0.7790, test_loss: 1.2687, test_f1: 0.5540
 epoch: 51, train_loss: 0.7714, test_loss: 0.9901, test_f1: 0.5444
 epoch: 52, train_loss: 0.7391, test_loss: 1.2936, test_f1: 0.5247
 epoch: 53, train_loss: 0.7470, test_loss: 1.0616, test_f1: 0.5512
 epoch: 54, train_loss: 0.7593, test_loss: 1.2175, test_f1: 0.5224
 epoch: 55, train_loss: 0.7409, test_loss: 1.2167, test_f1: 0.5418
 epoch: 56, train_loss: 0.7239, test_loss: 1.0531, test_f1: 0.5498
 epoch: 57, train_loss: 0.7366, test_loss: 1.0022, test_f1: 0.5745
 epoch: 58, train_loss: 0.7195, test_loss: 1.0716, test_f1: 0.5389
 epoch: 59, train_loss: 0.7168, test_loss: 1.1446, test_f1: 0.5263
 epoch: 60, train_loss: 0.7120, test_loss: 1.0267, test_f1: 0.5851
 epoch: 61, train_loss: 0.7161, test_loss: 1.2852, test_f1: 0.5490
 epoch: 62, train_loss: 0.6953, test_loss: 1.0557, test_f1: 0.5569
 epoch: 63, train_loss: 0.7195, test_loss: 1.0654, test_f1: 0.5825
 epoch: 64, train_loss: 0.7050, test_loss: 1.1650, test_f1: 0.5296
 epoch: 65, train_loss: 0.7112, test_loss: 1.2547, test_f1: 0.5484
 epoch: 66, train_loss: 0.7200, test_loss: 1.0580, test_f1: 0.5572
 epoch: 67, train_loss: 0.7032, test_loss: 1.0791, test_f1: 0.5614
 epoch: 68, train_loss: 0.7247, test_loss: 1.0838, test_f1: 0.5675
 epoch: 69, train_loss: 0.7088, test_loss: 1.1434, test_f1: 0.5339
 epoch: 70, train_loss: 0.7083, test_loss: 1.0676, test_f1: 0.5435
 epoch: 71, train_loss: 0.6878, test_loss: 1.0207, test_f1: 0.5790
 epoch: 72, train_loss: 0.7101, test_loss: 1.1065, test_f1: 0.5619
 epoch: 73, train_loss: 0.6972, test_loss: 1.2133, test_f1: 0.5411
 epoch: 74, train_loss: 0.6914, test_loss: 1.2782, test_f1: 0.5446
 epoch: 75, train_loss: 0.6927, test_loss: 1.0926, test_f1: 0.5351
 epoch: 76, train_loss: 0.6870, test_loss: 1.1661, test_f1: 0.5327
 epoch: 77, train_loss: 0.6798, test_loss: 1.0248, test_f1: 0.5638
 epoch: 78, train_loss: 0.7011, test_loss: 1.1413, test_f1: 0.5297
 epoch: 79, train_loss: 0.6990, test_loss: 1.1369, test_f1: 0.5428
 epoch: 80, train_loss: 0.6802, test_loss: 1.0931, test_f1: 0.5459
 epoch: 81, train_loss: 0.6912, test_loss: 1.2909, test_f1: 0.5232
 epoch: 82, train_loss: 0.6783, test_loss: 1.1211, test_f1: 0.5441
 epoch: 83, train_loss: 0.6886, test_loss: 1.1204, test_f1: 0.5509
 epoch: 84, train_loss: 0.6895, test_loss: 1.0109, test_f1: 0.5222
 epoch: 85, train_loss: 0.6661, test_loss: 1.1079, test_f1: 0.5418
 epoch: 86, train_loss: 0.6510, test_loss: 1.1127, test_f1: 0.5692
 epoch: 87, train_loss: 0.6711, test_loss: 1.2682, test_f1: 0.5309
 epoch: 88, train_loss: 0.6435, test_loss: 1.2708, test_f1: 0.5460
 epoch: 89, train_loss: 0.6871, test_loss: 1.3128, test_f1: 0.5248
 epoch: 90, train_loss: 0.6529, test_loss: 1.1847, test_f1: 0.5297
 epoch: 91, train_loss: 0.6570, test_loss: 1.3145, test_f1: 0.5468
 epoch: 92, train_loss: 0.6506, test_loss: 1.0686, test_f1: 0.5580
 epoch: 93, train_loss: 0.6562, test_loss: 1.1640, test_f1: 0.5293
 epoch: 94, train_loss: 0.6791, test_loss: 1.0703, test_f1: 0.5477
 epoch: 95, train_loss: 0.6546, test_loss: 1.0957, test_f1: 0.5714
 epoch: 96, train_loss: 0.6559, test_loss: 1.1273, test_f1: 0.5604
 epoch: 97, train_loss: 0.6412, test_loss: 1.2511, test_f1: 0.5317
 epoch: 98, train_loss: 0.6416, test_loss: 1.3580, test_f1: 0.5538
 epoch: 99, train_loss: 0.6361, test_loss: 1.2461, test_f1: 0.5417
##################ITERATION #5 ****************************************
 epoch: 0, train_loss: 1.3000, test_loss: 1.2075, test_f1: 0.3561
 epoch: 1, train_loss: 1.1931, test_loss: 1.1359, test_f1: 0.4018
 epoch: 2, train_loss: 1.1366, test_loss: 1.0822, test_f1: 0.4245
 epoch: 3, train_loss: 1.1056, test_loss: 1.0377, test_f1: 0.4558
 epoch: 4, train_loss: 1.0720, test_loss: 1.0223, test_f1: 0.4508
 epoch: 5, train_loss: 1.0311, test_loss: 1.0103, test_f1: 0.4879
 epoch: 6, train_loss: 1.0299, test_loss: 1.0541, test_f1: 0.4803
 epoch: 7, train_loss: 1.0126, test_loss: 0.9771, test_f1: 0.4819
 epoch: 8, train_loss: 0.9858, test_loss: 1.1140, test_f1: 0.5011
 epoch: 9, train_loss: 0.9756, test_loss: 1.0742, test_f1: 0.4910
 epoch: 10, train_loss: 0.9831, test_loss: 1.0207, test_f1: 0.4618
 epoch: 11, train_loss: 0.9765, test_loss: 0.9057, test_f1: 0.4976
 epoch: 12, train_loss: 0.9708, test_loss: 1.0139, test_f1: 0.4950
 epoch: 13, train_loss: 0.9516, test_loss: 1.0254, test_f1: 0.4772
 epoch: 14, train_loss: 0.9629, test_loss: 0.9516, test_f1: 0.5114
 epoch: 15, train_loss: 0.9358, test_loss: 1.0370, test_f1: 0.4856
 epoch: 16, train_loss: 0.9278, test_loss: 1.2043, test_f1: 0.4978
 epoch: 17, train_loss: 0.9276, test_loss: 0.9894, test_f1: 0.4930
 epoch: 18, train_loss: 0.9047, test_loss: 1.0097, test_f1: 0.5255
 epoch: 19, train_loss: 0.8872, test_loss: 0.9845, test_f1: 0.5154
 epoch: 20, train_loss: 0.8919, test_loss: 1.0045, test_f1: 0.4982
 epoch: 21, train_loss: 0.8854, test_loss: 1.1672, test_f1: 0.4772
 epoch: 22, train_loss: 0.8830, test_loss: 1.0448, test_f1: 0.4908
 epoch: 23, train_loss: 0.8679, test_loss: 1.1768, test_f1: 0.4545
 epoch: 24, train_loss: 0.8803, test_loss: 1.0005, test_f1: 0.5144
 epoch: 25, train_loss: 0.8630, test_loss: 1.0034, test_f1: 0.4954
 epoch: 26, train_loss: 0.8846, test_loss: 1.0808, test_f1: 0.4868
 epoch: 27, train_loss: 0.8729, test_loss: 1.0274, test_f1: 0.5024
 epoch: 28, train_loss: 0.8808, test_loss: 1.0316, test_f1: 0.5058
 epoch: 29, train_loss: 0.8549, test_loss: 1.0143, test_f1: 0.5307
 epoch: 30, train_loss: 0.8510, test_loss: 1.0336, test_f1: 0.4988
 epoch: 31, train_loss: 0.8560, test_loss: 0.9707, test_f1: 0.5292
 epoch: 32, train_loss: 0.8417, test_loss: 1.0495, test_f1: 0.5220
 epoch: 33, train_loss: 0.8506, test_loss: 1.0003, test_f1: 0.5787
 epoch: 34, train_loss: 0.8543, test_loss: 1.0557, test_f1: 0.5276
 epoch: 35, train_loss: 0.8470, test_loss: 1.0583, test_f1: 0.5583
 epoch: 36, train_loss: 0.8397, test_loss: 1.0763, test_f1: 0.4967
 epoch: 37, train_loss: 0.8255, test_loss: 1.0332, test_f1: 0.5201
 epoch: 38, train_loss: 0.8598, test_loss: 1.1189, test_f1: 0.4927
 epoch: 39, train_loss: 0.8340, test_loss: 1.1031, test_f1: 0.5021
 epoch: 40, train_loss: 0.8334, test_loss: 1.0766, test_f1: 0.5122
 epoch: 41, train_loss: 0.8204, test_loss: 0.9879, test_f1: 0.5625
 epoch: 42, train_loss: 0.8105, test_loss: 1.0210, test_f1: 0.5457
 epoch: 43, train_loss: 0.8164, test_loss: 0.9920, test_f1: 0.5364
 epoch: 44, train_loss: 0.7979, test_loss: 1.0235, test_f1: 0.5437
 epoch: 45, train_loss: 0.8076, test_loss: 1.0391, test_f1: 0.5500
 epoch: 46, train_loss: 0.8116, test_loss: 1.1225, test_f1: 0.5266
 epoch: 47, train_loss: 0.8192, test_loss: 1.0687, test_f1: 0.5282
 epoch: 48, train_loss: 0.8145, test_loss: 1.0516, test_f1: 0.5653
 epoch: 49, train_loss: 0.8072, test_loss: 0.9911, test_f1: 0.5733
 epoch: 50, train_loss: 0.8080, test_loss: 0.9853, test_f1: 0.5894
 epoch: 51, train_loss: 0.7734, test_loss: 1.0122, test_f1: 0.5735
 epoch: 52, train_loss: 0.7614, test_loss: 1.1666, test_f1: 0.5452
 epoch: 53, train_loss: 0.7462, test_loss: 0.9852, test_f1: 0.5698
 epoch: 54, train_loss: 0.8193, test_loss: 0.9813, test_f1: 0.5495
 epoch: 55, train_loss: 0.7895, test_loss: 1.0377, test_f1: 0.5848
 epoch: 56, train_loss: 0.7756, test_loss: 1.0475, test_f1: 0.5705
 epoch: 57, train_loss: 0.7618, test_loss: 1.0397, test_f1: 0.5743
 epoch: 58, train_loss: 0.7579, test_loss: 1.0072, test_f1: 0.5726
 epoch: 59, train_loss: 0.7456, test_loss: 1.0485, test_f1: 0.5611
 epoch: 60, train_loss: 0.7475, test_loss: 1.0310, test_f1: 0.5733
 epoch: 61, train_loss: 0.7527, test_loss: 1.0628, test_f1: 0.5796
 epoch: 62, train_loss: 0.7436, test_loss: 1.1047, test_f1: 0.5548
 epoch: 63, train_loss: 0.7391, test_loss: 1.0845, test_f1: 0.5709
 epoch: 64, train_loss: 0.7206, test_loss: 1.0820, test_f1: 0.5534
 epoch: 65, train_loss: 0.7178, test_loss: 1.1582, test_f1: 0.5373
 epoch: 66, train_loss: 0.7389, test_loss: 1.0991, test_f1: 0.5528
 epoch: 67, train_loss: 0.7238, test_loss: 1.0767, test_f1: 0.5439
 epoch: 68, train_loss: 0.7312, test_loss: 1.0840, test_f1: 0.5587
 epoch: 69, train_loss: 0.7119, test_loss: 1.0706, test_f1: 0.5742
 epoch: 70, train_loss: 0.7277, test_loss: 1.1337, test_f1: 0.5513
 epoch: 71, train_loss: 0.7119, test_loss: 1.1224, test_f1: 0.5691
 epoch: 72, train_loss: 0.7151, test_loss: 1.1188, test_f1: 0.5531
 epoch: 73, train_loss: 0.7200, test_loss: 1.0785, test_f1: 0.5529
 epoch: 74, train_loss: 0.7087, test_loss: 1.0281, test_f1: 0.5692
 epoch: 75, train_loss: 0.7155, test_loss: 1.0824, test_f1: 0.5701
 epoch: 76, train_loss: 0.7149, test_loss: 1.0175, test_f1: 0.5713
 epoch: 77, train_loss: 0.7019, test_loss: 1.0405, test_f1: 0.5498
 epoch: 78, train_loss: 0.6859, test_loss: 1.1278, test_f1: 0.5468
 epoch: 79, train_loss: 0.7164, test_loss: 1.1131, test_f1: 0.5672
 epoch: 80, train_loss: 0.7135, test_loss: 1.1484, test_f1: 0.5473
 epoch: 81, train_loss: 0.7059, test_loss: 1.0681, test_f1: 0.5661
 epoch: 82, train_loss: 0.6840, test_loss: 1.1186, test_f1: 0.5592
 epoch: 83, train_loss: 0.6916, test_loss: 1.1207, test_f1: 0.5432
 epoch: 84, train_loss: 0.6854, test_loss: 1.1648, test_f1: 0.5631
 epoch: 85, train_loss: 0.6944, test_loss: 1.2345, test_f1: 0.5361
 epoch: 86, train_loss: 0.6941, test_loss: 1.1682, test_f1: 0.5566
 epoch: 87, train_loss: 0.6851, test_loss: 1.1105, test_f1: 0.5664
 epoch: 88, train_loss: 0.6982, test_loss: 1.1426, test_f1: 0.5381
 epoch: 89, train_loss: 0.6923, test_loss: 1.1574, test_f1: 0.5537
 epoch: 90, train_loss: 0.6664, test_loss: 1.1826, test_f1: 0.5462
 epoch: 91, train_loss: 0.6796, test_loss: 1.1511, test_f1: 0.5816
 epoch: 92, train_loss: 0.6674, test_loss: 1.2105, test_f1: 0.5617
 epoch: 93, train_loss: 0.6858, test_loss: 1.2007, test_f1: 0.5612
 epoch: 94, train_loss: 0.6742, test_loss: 1.1757, test_f1: 0.5490
 epoch: 95, train_loss: 0.6766, test_loss: 1.1585, test_f1: 0.5675
 epoch: 96, train_loss: 0.6653, test_loss: 1.2319, test_f1: 0.5681
 epoch: 97, train_loss: 0.6819, test_loss: 1.2412, test_f1: 0.5351
 epoch: 98, train_loss: 0.6838, test_loss: 1.2881, test_f1: 0.5728
 epoch: 99, train_loss: 0.6855, test_loss: 1.2104, test_f1: 0.5511
##################ITERATION #6 ****************************************
 epoch: 0, train_loss: 1.2970, test_loss: 1.2241, test_f1: 0.3456
 epoch: 1, train_loss: 1.2227, test_loss: 1.1761, test_f1: 0.3755
 epoch: 2, train_loss: 1.1758, test_loss: 1.0649, test_f1: 0.4668
 epoch: 3, train_loss: 1.1297, test_loss: 1.0932, test_f1: 0.3985
 epoch: 4, train_loss: 1.0943, test_loss: 0.9624, test_f1: 0.5127
 epoch: 5, train_loss: 1.0583, test_loss: 0.9700, test_f1: 0.4635
 epoch: 6, train_loss: 1.0663, test_loss: 0.9641, test_f1: 0.4626
 epoch: 7, train_loss: 1.0260, test_loss: 0.9943, test_f1: 0.4503
 epoch: 8, train_loss: 1.0721, test_loss: 0.9537, test_f1: 0.4308
 epoch: 9, train_loss: 1.0074, test_loss: 0.8693, test_f1: 0.5094
 epoch: 10, train_loss: 0.9869, test_loss: 0.9260, test_f1: 0.4852
 epoch: 11, train_loss: 0.9687, test_loss: 0.9002, test_f1: 0.4631
 epoch: 12, train_loss: 0.9514, test_loss: 1.0552, test_f1: 0.4602
 epoch: 13, train_loss: 0.9600, test_loss: 0.8982, test_f1: 0.5106
 epoch: 14, train_loss: 0.9480, test_loss: 0.9512, test_f1: 0.5202
 epoch: 15, train_loss: 0.9417, test_loss: 0.9484, test_f1: 0.5460
 epoch: 16, train_loss: 0.9222, test_loss: 1.0142, test_f1: 0.4771
 epoch: 17, train_loss: 0.9226, test_loss: 0.9604, test_f1: 0.5055
 epoch: 18, train_loss: 0.9075, test_loss: 0.9503, test_f1: 0.5322
 epoch: 19, train_loss: 0.9172, test_loss: 1.0249, test_f1: 0.5027
 epoch: 20, train_loss: 0.9018, test_loss: 1.0102, test_f1: 0.5002
 epoch: 21, train_loss: 0.9012, test_loss: 1.0603, test_f1: 0.4964
 epoch: 22, train_loss: 0.8947, test_loss: 0.9608, test_f1: 0.4945
 epoch: 23, train_loss: 0.8923, test_loss: 1.0104, test_f1: 0.5192
 epoch: 24, train_loss: 0.8810, test_loss: 0.9707, test_f1: 0.5368
 epoch: 25, train_loss: 0.8796, test_loss: 1.0706, test_f1: 0.4932
 epoch: 26, train_loss: 0.8985, test_loss: 1.0050, test_f1: 0.5211
 epoch: 27, train_loss: 0.8793, test_loss: 0.9877, test_f1: 0.5423
 epoch: 28, train_loss: 0.8819, test_loss: 0.9732, test_f1: 0.5474
 epoch: 29, train_loss: 0.8765, test_loss: 1.0126, test_f1: 0.5527
 epoch: 30, train_loss: 0.8714, test_loss: 0.9460, test_f1: 0.5292
 epoch: 31, train_loss: 0.8714, test_loss: 1.0365, test_f1: 0.5486
 epoch: 32, train_loss: 0.8537, test_loss: 0.9788, test_f1: 0.5424
 epoch: 33, train_loss: 0.8362, test_loss: 0.9286, test_f1: 0.5348
 epoch: 34, train_loss: 0.8523, test_loss: 0.9988, test_f1: 0.5431
 epoch: 35, train_loss: 0.8434, test_loss: 0.9566, test_f1: 0.5630
 epoch: 36, train_loss: 0.8475, test_loss: 1.2725, test_f1: 0.5145
 epoch: 37, train_loss: 0.8606, test_loss: 0.9507, test_f1: 0.5518
 epoch: 38, train_loss: 0.8259, test_loss: 0.9996, test_f1: 0.5180
 epoch: 39, train_loss: 0.8347, test_loss: 0.9753, test_f1: 0.5405
 epoch: 40, train_loss: 0.8208, test_loss: 1.2841, test_f1: 0.4790
 epoch: 41, train_loss: 0.8385, test_loss: 0.8984, test_f1: 0.5172
 epoch: 42, train_loss: 0.8314, test_loss: 0.9660, test_f1: 0.5268
 epoch: 43, train_loss: 0.8352, test_loss: 0.9434, test_f1: 0.5721
 epoch: 44, train_loss: 0.8100, test_loss: 1.0266, test_f1: 0.5417
 epoch: 45, train_loss: 0.7937, test_loss: 1.0961, test_f1: 0.5041
 epoch: 46, train_loss: 0.8021, test_loss: 1.0769, test_f1: 0.5340
 epoch: 47, train_loss: 0.8021, test_loss: 1.0400, test_f1: 0.5329
 epoch: 48, train_loss: 0.8178, test_loss: 1.0723, test_f1: 0.5053
 epoch: 49, train_loss: 0.8068, test_loss: 1.0889, test_f1: 0.5354
 epoch: 50, train_loss: 0.8050, test_loss: 0.9850, test_f1: 0.5511
 epoch: 51, train_loss: 0.7755, test_loss: 1.0965, test_f1: 0.5375
 epoch: 52, train_loss: 0.7602, test_loss: 0.9494, test_f1: 0.5997
 epoch: 53, train_loss: 0.7649, test_loss: 0.9864, test_f1: 0.5535
 epoch: 54, train_loss: 0.7466, test_loss: 0.9398, test_f1: 0.5594
 epoch: 55, train_loss: 0.7484, test_loss: 0.9759, test_f1: 0.5661
 epoch: 56, train_loss: 0.7433, test_loss: 1.0419, test_f1: 0.5753
 epoch: 57, train_loss: 0.7238, test_loss: 1.0373, test_f1: 0.5727
 epoch: 58, train_loss: 0.7364, test_loss: 0.9983, test_f1: 0.5641
 epoch: 59, train_loss: 0.7383, test_loss: 0.9236, test_f1: 0.6004
 epoch: 60, train_loss: 0.7316, test_loss: 1.0148, test_f1: 0.5572
 epoch: 61, train_loss: 0.7313, test_loss: 1.2035, test_f1: 0.5433
 epoch: 62, train_loss: 0.7297, test_loss: 1.0209, test_f1: 0.5332
 epoch: 63, train_loss: 0.7125, test_loss: 1.1254, test_f1: 0.5436
 epoch: 64, train_loss: 0.7104, test_loss: 1.1074, test_f1: 0.5513
 epoch: 65, train_loss: 0.7157, test_loss: 0.9908, test_f1: 0.5763
 epoch: 66, train_loss: 0.7117, test_loss: 0.9803, test_f1: 0.5803
 epoch: 67, train_loss: 0.6974, test_loss: 0.9967, test_f1: 0.5576
 epoch: 68, train_loss: 0.7060, test_loss: 1.0265, test_f1: 0.5642
 epoch: 69, train_loss: 0.7104, test_loss: 1.0323, test_f1: 0.5840
 epoch: 70, train_loss: 0.7027, test_loss: 1.0361, test_f1: 0.5699
 epoch: 71, train_loss: 0.7039, test_loss: 1.0239, test_f1: 0.5467
 epoch: 72, train_loss: 0.7002, test_loss: 1.0450, test_f1: 0.5494
 epoch: 73, train_loss: 0.6817, test_loss: 1.0007, test_f1: 0.5580
 epoch: 74, train_loss: 0.6789, test_loss: 0.9770, test_f1: 0.5576
 epoch: 75, train_loss: 0.7069, test_loss: 0.9534, test_f1: 0.5844
 epoch: 76, train_loss: 0.6785, test_loss: 1.0024, test_f1: 0.5873
 epoch: 77, train_loss: 0.6809, test_loss: 0.9942, test_f1: 0.5714
 epoch: 78, train_loss: 0.6826, test_loss: 0.9807, test_f1: 0.5803
 epoch: 79, train_loss: 0.6753, test_loss: 1.0222, test_f1: 0.5732
 epoch: 80, train_loss: 0.6860, test_loss: 1.0794, test_f1: 0.5657
 epoch: 81, train_loss: 0.6667, test_loss: 1.0885, test_f1: 0.5626
 epoch: 82, train_loss: 0.6729, test_loss: 1.2063, test_f1: 0.5412
 epoch: 83, train_loss: 0.6860, test_loss: 1.1407, test_f1: 0.5608
 epoch: 84, train_loss: 0.6820, test_loss: 1.0450, test_f1: 0.5787
 epoch: 85, train_loss: 0.6705, test_loss: 1.0114, test_f1: 0.5671
 epoch: 86, train_loss: 0.6771, test_loss: 1.0331, test_f1: 0.5624
 epoch: 87, train_loss: 0.6415, test_loss: 0.9954, test_f1: 0.5862
 epoch: 88, train_loss: 0.6444, test_loss: 1.1748, test_f1: 0.5453
 epoch: 89, train_loss: 0.6813, test_loss: 1.1370, test_f1: 0.5411
 epoch: 90, train_loss: 0.6744, test_loss: 1.0684, test_f1: 0.5428
 epoch: 91, train_loss: 0.6552, test_loss: 1.1266, test_f1: 0.5259
 epoch: 92, train_loss: 0.6676, test_loss: 1.2140, test_f1: 0.5102
 epoch: 93, train_loss: 0.6625, test_loss: 1.0695, test_f1: 0.5758
 epoch: 94, train_loss: 0.6505, test_loss: 1.0475, test_f1: 0.5390
 epoch: 95, train_loss: 0.6530, test_loss: 1.0023, test_f1: 0.5631
 epoch: 96, train_loss: 0.6613, test_loss: 1.1180, test_f1: 0.5286
 epoch: 97, train_loss: 0.6597, test_loss: 1.1898, test_f1: 0.5205
 epoch: 98, train_loss: 0.6611, test_loss: 0.9968, test_f1: 0.5752
 epoch: 99, train_loss: 0.6373, test_loss: 1.0343, test_f1: 0.5944
##################ITERATION #7 ****************************************
 epoch: 0, train_loss: 1.3120, test_loss: 1.3222, test_f1: 0.2890
 epoch: 1, train_loss: 1.2383, test_loss: 1.1794, test_f1: 0.4350
 epoch: 2, train_loss: 1.1934, test_loss: 1.1749, test_f1: 0.4200
 epoch: 3, train_loss: 1.1714, test_loss: 1.1186, test_f1: 0.4153
 epoch: 4, train_loss: 1.1425, test_loss: 1.1351, test_f1: 0.4455
 epoch: 5, train_loss: 1.1102, test_loss: 1.0706, test_f1: 0.4668
 epoch: 6, train_loss: 1.1045, test_loss: 1.0238, test_f1: 0.4898
 epoch: 7, train_loss: 1.0906, test_loss: 1.0428, test_f1: 0.4508
 epoch: 8, train_loss: 1.0837, test_loss: 0.9910, test_f1: 0.4623
 epoch: 9, train_loss: 1.0632, test_loss: 0.9702, test_f1: 0.4772
 epoch: 10, train_loss: 1.0447, test_loss: 0.9536, test_f1: 0.4948
 epoch: 11, train_loss: 1.0360, test_loss: 0.9660, test_f1: 0.5135
 epoch: 12, train_loss: 1.0318, test_loss: 0.9551, test_f1: 0.4866
 epoch: 13, train_loss: 1.0164, test_loss: 0.9326, test_f1: 0.4984
 epoch: 14, train_loss: 1.0044, test_loss: 0.9399, test_f1: 0.4876
 epoch: 15, train_loss: 1.0117, test_loss: 0.9516, test_f1: 0.4679
 epoch: 16, train_loss: 1.0096, test_loss: 1.0184, test_f1: 0.5314
 epoch: 17, train_loss: 0.9865, test_loss: 0.9849, test_f1: 0.4998
 epoch: 18, train_loss: 0.9840, test_loss: 0.9156, test_f1: 0.5197
 epoch: 19, train_loss: 0.9923, test_loss: 0.9780, test_f1: 0.4733
 epoch: 20, train_loss: 0.9763, test_loss: 0.9804, test_f1: 0.5335
 epoch: 21, train_loss: 0.9558, test_loss: 0.9306, test_f1: 0.5341
 epoch: 22, train_loss: 0.9538, test_loss: 1.0135, test_f1: 0.5082
 epoch: 23, train_loss: 0.9562, test_loss: 1.0381, test_f1: 0.4771
 epoch: 24, train_loss: 0.9445, test_loss: 0.9588, test_f1: 0.5205
 epoch: 25, train_loss: 0.9294, test_loss: 0.9011, test_f1: 0.5177
 epoch: 26, train_loss: 0.9376, test_loss: 0.9748, test_f1: 0.5060
 epoch: 27, train_loss: 0.9212, test_loss: 1.0032, test_f1: 0.5108
 epoch: 28, train_loss: 0.9251, test_loss: 0.9419, test_f1: 0.5422
 epoch: 29, train_loss: 0.9382, test_loss: 1.0023, test_f1: 0.5237
 epoch: 30, train_loss: 0.9111, test_loss: 0.9958, test_f1: 0.5290
 epoch: 31, train_loss: 0.9097, test_loss: 1.0156, test_f1: 0.5003
 epoch: 32, train_loss: 0.9222, test_loss: 1.0189, test_f1: 0.5312
 epoch: 33, train_loss: 0.9169, test_loss: 0.9850, test_f1: 0.5290
 epoch: 34, train_loss: 0.9187, test_loss: 1.0878, test_f1: 0.4674
 epoch: 35, train_loss: 0.9191, test_loss: 0.9603, test_f1: 0.5434
 epoch: 36, train_loss: 0.8898, test_loss: 0.9976, test_f1: 0.5221
 epoch: 37, train_loss: 0.9013, test_loss: 1.0069, test_f1: 0.5070
 epoch: 38, train_loss: 0.8914, test_loss: 0.9821, test_f1: 0.5243
 epoch: 39, train_loss: 0.8951, test_loss: 0.9811, test_f1: 0.5559
 epoch: 40, train_loss: 0.8822, test_loss: 0.9051, test_f1: 0.5452
 epoch: 41, train_loss: 0.8831, test_loss: 0.9521, test_f1: 0.5105
 epoch: 42, train_loss: 0.8817, test_loss: 0.9850, test_f1: 0.5247
 epoch: 43, train_loss: 0.8857, test_loss: 4.4738, test_f1: 0.5167
 epoch: 44, train_loss: 0.8943, test_loss: 0.8827, test_f1: 0.5369
 epoch: 45, train_loss: 0.8924, test_loss: 1.0535, test_f1: 0.5051
 epoch: 46, train_loss: 0.8819, test_loss: 1.9181, test_f1: 0.4952
 epoch: 47, train_loss: 0.8801, test_loss: 0.9582, test_f1: 0.5186
 epoch: 48, train_loss: 0.8698, test_loss: 0.9485, test_f1: 0.5453
 epoch: 49, train_loss: 0.8613, test_loss: 0.9822, test_f1: 0.5313
 epoch: 50, train_loss: 0.8661, test_loss: 0.9416, test_f1: 0.5338
 epoch: 51, train_loss: 0.8540, test_loss: 0.9452, test_f1: 0.5283
 epoch: 52, train_loss: 0.8241, test_loss: 0.9764, test_f1: 0.5316
 epoch: 53, train_loss: 0.8314, test_loss: 0.9380, test_f1: 0.5635
 epoch: 54, train_loss: 0.8200, test_loss: 0.9727, test_f1: 0.5485
 epoch: 55, train_loss: 0.8328, test_loss: 0.9536, test_f1: 0.5377
 epoch: 56, train_loss: 0.8224, test_loss: 0.9327, test_f1: 0.5496
 epoch: 57, train_loss: 0.8251, test_loss: 0.9538, test_f1: 0.5419
 epoch: 58, train_loss: 0.8169, test_loss: 0.9685, test_f1: 0.5261
 epoch: 59, train_loss: 0.8045, test_loss: 0.9574, test_f1: 0.5373
 epoch: 60, train_loss: 0.8239, test_loss: 0.9444, test_f1: 0.5588
 epoch: 61, train_loss: 0.8079, test_loss: 1.0112, test_f1: 0.5094
 epoch: 62, train_loss: 0.8114, test_loss: 0.9399, test_f1: 0.5673
 epoch: 63, train_loss: 0.8156, test_loss: 0.9456, test_f1: 0.5436
 epoch: 64, train_loss: 0.7891, test_loss: 0.9629, test_f1: 0.5383
 epoch: 65, train_loss: 0.8123, test_loss: 0.9979, test_f1: 0.5207
 epoch: 66, train_loss: 0.7920, test_loss: 0.9735, test_f1: 0.5311
 epoch: 67, train_loss: 0.7959, test_loss: 0.9794, test_f1: 0.5446
 epoch: 68, train_loss: 0.8110, test_loss: 0.9210, test_f1: 0.5452
 epoch: 69, train_loss: 0.7974, test_loss: 0.9663, test_f1: 0.5442
 epoch: 70, train_loss: 0.8036, test_loss: 0.9647, test_f1: 0.5516
 epoch: 71, train_loss: 0.7876, test_loss: 1.1113, test_f1: 0.4950
 epoch: 72, train_loss: 0.7909, test_loss: 1.0566, test_f1: 0.5253
 epoch: 73, train_loss: 0.7988, test_loss: 1.0039, test_f1: 0.5542
 epoch: 74, train_loss: 0.7844, test_loss: 1.0049, test_f1: 0.5571
 epoch: 75, train_loss: 0.7757, test_loss: 1.0974, test_f1: 0.5367
 epoch: 76, train_loss: 0.7823, test_loss: 1.3275, test_f1: 0.5015
 epoch: 77, train_loss: 0.7877, test_loss: 1.2397, test_f1: 0.5134
 epoch: 78, train_loss: 0.7806, test_loss: 1.0903, test_f1: 0.5325
 epoch: 79, train_loss: 0.7911, test_loss: 0.9543, test_f1: 0.5625
 epoch: 80, train_loss: 0.7813, test_loss: 1.1778, test_f1: 0.5407
 epoch: 81, train_loss: 0.7672, test_loss: 1.0650, test_f1: 0.5459
 epoch: 82, train_loss: 0.7756, test_loss: 1.0609, test_f1: 0.5320
 epoch: 83, train_loss: 0.7692, test_loss: 1.0289, test_f1: 0.5570
 epoch: 84, train_loss: 0.7634, test_loss: 1.0149, test_f1: 0.5593
 epoch: 85, train_loss: 0.7699, test_loss: 0.9641, test_f1: 0.5479
 epoch: 86, train_loss: 0.7591, test_loss: 1.1530, test_f1: 0.5306
 epoch: 87, train_loss: 0.7731, test_loss: 0.9859, test_f1: 0.5759
 epoch: 88, train_loss: 0.7677, test_loss: 1.0914, test_f1: 0.5475
 epoch: 89, train_loss: 0.7681, test_loss: 1.0168, test_f1: 0.5651
 epoch: 90, train_loss: 0.7613, test_loss: 1.0043, test_f1: 0.5435
 epoch: 91, train_loss: 0.7531, test_loss: 0.9934, test_f1: 0.5598
 epoch: 92, train_loss: 0.7507, test_loss: 0.9535, test_f1: 0.5484
 epoch: 93, train_loss: 0.7577, test_loss: 1.2509, test_f1: 0.5341
 epoch: 94, train_loss: 0.7544, test_loss: 1.0222, test_f1: 0.5270
 epoch: 95, train_loss: 0.7546, test_loss: 1.1901, test_f1: 0.5296
 epoch: 96, train_loss: 0.7440, test_loss: 1.0816, test_f1: 0.5247
 epoch: 97, train_loss: 0.7561, test_loss: 1.0366, test_f1: 0.5171
 epoch: 98, train_loss: 0.7482, test_loss: 1.2271, test_f1: 0.5162
 epoch: 99, train_loss: 0.7512, test_loss: 1.1255, test_f1: 0.5468
##################ITERATION #8 ****************************************
 epoch: 0, train_loss: 1.2784, test_loss: 1.2556, test_f1: 0.3514
 epoch: 1, train_loss: 1.1702, test_loss: 1.0815, test_f1: 0.4415
 epoch: 2, train_loss: 1.1000, test_loss: 1.0141, test_f1: 0.4505
 epoch: 3, train_loss: 1.0699, test_loss: 1.0085, test_f1: 0.4641
 epoch: 4, train_loss: 1.0592, test_loss: 0.9469, test_f1: 0.4654
 epoch: 5, train_loss: 1.0329, test_loss: 0.9654, test_f1: 0.4855
 epoch: 6, train_loss: 1.0250, test_loss: 0.9433, test_f1: 0.4782
 epoch: 7, train_loss: 0.9884, test_loss: 0.9527, test_f1: 0.4801
 epoch: 8, train_loss: 0.9818, test_loss: 1.0024, test_f1: 0.4603
 epoch: 9, train_loss: 0.9713, test_loss: 0.9591, test_f1: 0.4872
 epoch: 10, train_loss: 0.9450, test_loss: 0.9901, test_f1: 0.5088
 epoch: 11, train_loss: 0.9582, test_loss: 0.9389, test_f1: 0.4983
 epoch: 12, train_loss: 0.9462, test_loss: 0.9715, test_f1: 0.4867
 epoch: 13, train_loss: 0.9370, test_loss: 0.9897, test_f1: 0.4953
 epoch: 14, train_loss: 0.9391, test_loss: 0.9907, test_f1: 0.4642
 epoch: 15, train_loss: 0.9407, test_loss: 1.0307, test_f1: 0.4650
 epoch: 16, train_loss: 0.9252, test_loss: 0.9947, test_f1: 0.5336
 epoch: 17, train_loss: 0.9327, test_loss: 1.0173, test_f1: 0.5324
 epoch: 18, train_loss: 0.9077, test_loss: 1.0214, test_f1: 0.5188
 epoch: 19, train_loss: 0.9073, test_loss: 0.9915, test_f1: 0.5137
 epoch: 20, train_loss: 0.8983, test_loss: 1.0302, test_f1: 0.5268
 epoch: 21, train_loss: 0.8886, test_loss: 0.9828, test_f1: 0.5115
 epoch: 22, train_loss: 0.9028, test_loss: 1.0130, test_f1: 0.4978
 epoch: 23, train_loss: 0.9054, test_loss: 0.9623, test_f1: 0.5213
 epoch: 24, train_loss: 0.8742, test_loss: 0.9944, test_f1: 0.5336
 epoch: 25, train_loss: 0.8740, test_loss: 0.9624, test_f1: 0.5042
 epoch: 26, train_loss: 0.8879, test_loss: 0.9575, test_f1: 0.5352
 epoch: 27, train_loss: 0.8883, test_loss: 1.0095, test_f1: 0.4920
 epoch: 28, train_loss: 0.8805, test_loss: 1.0039, test_f1: 0.5115
 epoch: 29, train_loss: 0.8777, test_loss: 0.9723, test_f1: 0.5633
 epoch: 30, train_loss: 0.8684, test_loss: 0.9893, test_f1: 0.5490
 epoch: 31, train_loss: 0.8826, test_loss: 0.9860, test_f1: 0.4918
 epoch: 32, train_loss: 0.8557, test_loss: 0.9861, test_f1: 0.4847
 epoch: 33, train_loss: 0.8884, test_loss: 0.9766, test_f1: 0.5395
 epoch: 34, train_loss: 0.8613, test_loss: 1.0112, test_f1: 0.5183
 epoch: 35, train_loss: 0.8653, test_loss: 0.9628, test_f1: 0.5255
 epoch: 36, train_loss: 0.8602, test_loss: 1.0133, test_f1: 0.5288
 epoch: 37, train_loss: 0.8689, test_loss: 1.2275, test_f1: 0.4804
 epoch: 38, train_loss: 0.8665, test_loss: 1.0122, test_f1: 0.5523
 epoch: 39, train_loss: 0.8402, test_loss: 0.9647, test_f1: 0.5606
 epoch: 40, train_loss: 0.8227, test_loss: 1.0848, test_f1: 0.5155
 epoch: 41, train_loss: 0.8259, test_loss: 1.0597, test_f1: 0.5650
 epoch: 42, train_loss: 0.8468, test_loss: 1.0385, test_f1: 0.5042
 epoch: 43, train_loss: 0.8318, test_loss: 0.9872, test_f1: 0.5483
 epoch: 44, train_loss: 0.8186, test_loss: 1.0317, test_f1: 0.5251
 epoch: 45, train_loss: 0.8178, test_loss: 0.9613, test_f1: 0.5599
 epoch: 46, train_loss: 0.8098, test_loss: 1.1161, test_f1: 0.5296
 epoch: 47, train_loss: 0.8235, test_loss: 1.0453, test_f1: 0.5142
 epoch: 48, train_loss: 0.7983, test_loss: 1.0299, test_f1: 0.5053
 epoch: 49, train_loss: 0.8189, test_loss: 0.9889, test_f1: 0.5825
 epoch: 50, train_loss: 0.8051, test_loss: 1.0650, test_f1: 0.5091
 epoch: 51, train_loss: 0.7763, test_loss: 1.0101, test_f1: 0.5080
 epoch: 52, train_loss: 0.7710, test_loss: 1.0205, test_f1: 0.5453
 epoch: 53, train_loss: 0.7772, test_loss: 1.0437, test_f1: 0.5306
 epoch: 54, train_loss: 0.7629, test_loss: 1.1745, test_f1: 0.4949
 epoch: 55, train_loss: 0.7441, test_loss: 1.1022, test_f1: 0.5263
 epoch: 56, train_loss: 0.7537, test_loss: 1.0058, test_f1: 0.5535
 epoch: 57, train_loss: 0.7429, test_loss: 1.0390, test_f1: 0.5458
 epoch: 58, train_loss: 0.7552, test_loss: 1.1800, test_f1: 0.5392
 epoch: 59, train_loss: 0.7308, test_loss: 1.0426, test_f1: 0.5449
 epoch: 60, train_loss: 0.7480, test_loss: 1.1624, test_f1: 0.5102
 epoch: 61, train_loss: 0.7645, test_loss: 1.0552, test_f1: 0.5198
 epoch: 62, train_loss: 0.7390, test_loss: 1.2052, test_f1: 0.5346
 epoch: 63, train_loss: 0.7460, test_loss: 1.0220, test_f1: 0.5526
 epoch: 64, train_loss: 0.7254, test_loss: 1.0680, test_f1: 0.5541
 epoch: 65, train_loss: 0.7342, test_loss: 1.0756, test_f1: 0.5286
 epoch: 66, train_loss: 0.7351, test_loss: 1.0223, test_f1: 0.5567
 epoch: 67, train_loss: 0.7317, test_loss: 1.0944, test_f1: 0.5524
 epoch: 68, train_loss: 0.7315, test_loss: 1.0796, test_f1: 0.5507
 epoch: 69, train_loss: 0.7217, test_loss: 1.0939, test_f1: 0.5407
 epoch: 70, train_loss: 0.7154, test_loss: 1.0274, test_f1: 0.5690
 epoch: 71, train_loss: 0.7243, test_loss: 1.0369, test_f1: 0.5476
 epoch: 72, train_loss: 0.7044, test_loss: 1.1206, test_f1: 0.5425
 epoch: 73, train_loss: 0.7111, test_loss: 1.1317, test_f1: 0.5348
 epoch: 74, train_loss: 0.7184, test_loss: 1.0312, test_f1: 0.5809
 epoch: 75, train_loss: 0.7211, test_loss: 1.1787, test_f1: 0.5127
 epoch: 76, train_loss: 0.7135, test_loss: 1.0467, test_f1: 0.5898
 epoch: 77, train_loss: 0.7718, test_loss: 1.1485, test_f1: 0.5412
 epoch: 78, train_loss: 0.7428, test_loss: 1.0454, test_f1: 0.5391
 epoch: 79, train_loss: 0.7017, test_loss: 1.0671, test_f1: 0.5420
 epoch: 80, train_loss: 0.6961, test_loss: 1.0926, test_f1: 0.5403
 epoch: 81, train_loss: 0.7735, test_loss: 0.9900, test_f1: 0.5660
 epoch: 82, train_loss: 0.7335, test_loss: 0.9697, test_f1: 0.5860
 epoch: 83, train_loss: 0.7262, test_loss: 0.9831, test_f1: 0.5851
 epoch: 84, train_loss: 0.7034, test_loss: 1.0154, test_f1: 0.5652
 epoch: 85, train_loss: 0.7034, test_loss: 1.0071, test_f1: 0.5764
 epoch: 86, train_loss: 0.7015, test_loss: 1.0292, test_f1: 0.5650
 epoch: 87, train_loss: 0.6978, test_loss: 1.0585, test_f1: 0.5662
 epoch: 88, train_loss: 0.6900, test_loss: 1.0132, test_f1: 0.5961
 epoch: 89, train_loss: 0.6931, test_loss: 1.0900, test_f1: 0.5538
 epoch: 90, train_loss: 0.7048, test_loss: 1.1342, test_f1: 0.5584
 epoch: 91, train_loss: 0.7006, test_loss: 1.1424, test_f1: 0.5450
 epoch: 92, train_loss: 0.6938, test_loss: 1.1436, test_f1: 0.5327
 epoch: 93, train_loss: 0.6787, test_loss: 1.0728, test_f1: 0.5402
 epoch: 94, train_loss: 0.6960, test_loss: 1.0068, test_f1: 0.5760
 epoch: 95, train_loss: 0.7522, test_loss: 1.0222, test_f1: 0.5925
 epoch: 96, train_loss: 0.7286, test_loss: 1.0899, test_f1: 0.5724
 epoch: 97, train_loss: 0.6829, test_loss: 1.1486, test_f1: 0.5473
 epoch: 98, train_loss: 0.6893, test_loss: 1.1937, test_f1: 0.5461
 epoch: 99, train_loss: 0.6931, test_loss: 1.1230, test_f1: 0.5145
##################ITERATION #9 ****************************************
 epoch: 0, train_loss: 1.2873, test_loss: 1.1765, test_f1: 0.4350
 epoch: 1, train_loss: 1.1696, test_loss: 1.0607, test_f1: 0.5031
 epoch: 2, train_loss: 1.1209, test_loss: 1.0582, test_f1: 0.4868
 epoch: 3, train_loss: 1.1005, test_loss: 1.0175, test_f1: 0.5140
 epoch: 4, train_loss: 1.0770, test_loss: 1.0112, test_f1: 0.4777
 epoch: 5, train_loss: 1.0841, test_loss: 1.0527, test_f1: 0.5121
 epoch: 6, train_loss: 1.0610, test_loss: 1.0061, test_f1: 0.5256
 epoch: 7, train_loss: 1.0635, test_loss: 0.9542, test_f1: 0.5228
 epoch: 8, train_loss: 1.0445, test_loss: 0.9601, test_f1: 0.5167
 epoch: 9, train_loss: 1.0226, test_loss: 0.9936, test_f1: 0.5194
 epoch: 10, train_loss: 1.0102, test_loss: 0.9687, test_f1: 0.5021
 epoch: 11, train_loss: 1.0157, test_loss: 0.9417, test_f1: 0.4987
 epoch: 12, train_loss: 0.9823, test_loss: 0.8947, test_f1: 0.5254
 epoch: 13, train_loss: 0.9909, test_loss: 0.9091, test_f1: 0.5139
 epoch: 14, train_loss: 0.9919, test_loss: 0.9149, test_f1: 0.4741
 epoch: 15, train_loss: 0.9716, test_loss: 1.0270, test_f1: 0.4616
 epoch: 16, train_loss: 0.9815, test_loss: 0.9771, test_f1: 0.4635
 epoch: 17, train_loss: 0.9549, test_loss: 1.0306, test_f1: 0.5050
 epoch: 18, train_loss: 0.9505, test_loss: 1.0050, test_f1: 0.5051
 epoch: 19, train_loss: 0.9437, test_loss: 0.9831, test_f1: 0.5090
 epoch: 20, train_loss: 0.9397, test_loss: 1.0008, test_f1: 0.4915
 epoch: 21, train_loss: 0.9316, test_loss: 0.9777, test_f1: 0.4996
 epoch: 22, train_loss: 0.9485, test_loss: 0.9726, test_f1: 0.5000
 epoch: 23, train_loss: 0.9290, test_loss: 0.9711, test_f1: 0.4944
 epoch: 24, train_loss: 0.9182, test_loss: 0.8944, test_f1: 0.5202
 epoch: 25, train_loss: 0.9020, test_loss: 1.0040, test_f1: 0.5117
 epoch: 26, train_loss: 0.8909, test_loss: 1.1416, test_f1: 0.5309
 epoch: 27, train_loss: 0.8934, test_loss: 1.0618, test_f1: 0.4945
 epoch: 28, train_loss: 0.8788, test_loss: 1.0388, test_f1: 0.5168
 epoch: 29, train_loss: 0.8959, test_loss: 0.9721, test_f1: 0.5044
 epoch: 30, train_loss: 0.8782, test_loss: 1.3605, test_f1: 0.4782
 epoch: 31, train_loss: 0.8732, test_loss: 1.1795, test_f1: 0.5016
 epoch: 32, train_loss: 0.8690, test_loss: 1.0264, test_f1: 0.5277
 epoch: 33, train_loss: 0.8610, test_loss: 0.9721, test_f1: 0.5025
 epoch: 34, train_loss: 0.8630, test_loss: 1.0362, test_f1: 0.5438
 epoch: 35, train_loss: 0.8572, test_loss: 1.0659, test_f1: 0.4924
 epoch: 36, train_loss: 0.8783, test_loss: 0.9748, test_f1: 0.5380
 epoch: 37, train_loss: 0.8479, test_loss: 1.0701, test_f1: 0.5275
 epoch: 38, train_loss: 0.8429, test_loss: 1.0214, test_f1: 0.5036
 epoch: 39, train_loss: 0.8534, test_loss: 1.1808, test_f1: 0.4818
 epoch: 40, train_loss: 0.8370, test_loss: 1.2305, test_f1: 0.4744
 epoch: 41, train_loss: 0.8249, test_loss: 1.0092, test_f1: 0.5615
 epoch: 42, train_loss: 0.8471, test_loss: 1.3252, test_f1: 0.5458
 epoch: 43, train_loss: 0.8382, test_loss: 1.0464, test_f1: 0.5242
 epoch: 44, train_loss: 0.8352, test_loss: 1.0388, test_f1: 0.5424
 epoch: 45, train_loss: 0.8162, test_loss: 0.9932, test_f1: 0.4967
 epoch: 46, train_loss: 0.8444, test_loss: 1.0030, test_f1: 0.5475
 epoch: 47, train_loss: 0.8296, test_loss: 1.0053, test_f1: 0.5571
 epoch: 48, train_loss: 0.8342, test_loss: 1.0828, test_f1: 0.5247
 epoch: 49, train_loss: 0.8191, test_loss: 1.0794, test_f1: 0.5291
 epoch: 50, train_loss: 0.8229, test_loss: 1.2228, test_f1: 0.5152
 epoch: 51, train_loss: 0.7894, test_loss: 1.0557, test_f1: 0.5436
 epoch: 52, train_loss: 0.7805, test_loss: 1.0546, test_f1: 0.5332
 epoch: 53, train_loss: 0.7780, test_loss: 1.1467, test_f1: 0.5250
 epoch: 54, train_loss: 0.7540, test_loss: 1.1481, test_f1: 0.5301
 epoch: 55, train_loss: 0.7616, test_loss: 1.0725, test_f1: 0.5581
 epoch: 56, train_loss: 0.7665, test_loss: 1.0926, test_f1: 0.5392
 epoch: 57, train_loss: 0.7656, test_loss: 1.1014, test_f1: 0.5432
 epoch: 58, train_loss: 0.7502, test_loss: 1.1036, test_f1: 0.5567
 epoch: 59, train_loss: 0.7395, test_loss: 1.1866, test_f1: 0.5699
 epoch: 60, train_loss: 0.7493, test_loss: 1.1592, test_f1: 0.5368
 epoch: 61, train_loss: 0.7413, test_loss: 1.0859, test_f1: 0.5672
 epoch: 62, train_loss: 0.7444, test_loss: 1.0370, test_f1: 0.5829
 epoch: 63, train_loss: 0.7439, test_loss: 1.1825, test_f1: 0.5259
 epoch: 64, train_loss: 0.7400, test_loss: 1.1113, test_f1: 0.5604
 epoch: 65, train_loss: 0.7247, test_loss: 1.1220, test_f1: 0.5811
 epoch: 66, train_loss: 0.7262, test_loss: 1.1277, test_f1: 0.5715
 epoch: 67, train_loss: 0.7391, test_loss: 1.3305, test_f1: 0.5479
 epoch: 68, train_loss: 0.7174, test_loss: 1.4505, test_f1: 0.5344
 epoch: 69, train_loss: 0.7206, test_loss: 1.1473, test_f1: 0.5514
 epoch: 70, train_loss: 0.7268, test_loss: 1.1777, test_f1: 0.5448
 epoch: 71, train_loss: 0.7335, test_loss: 1.2443, test_f1: 0.5222
 epoch: 72, train_loss: 0.7672, test_loss: 1.0821, test_f1: 0.5687
 epoch: 73, train_loss: 0.7330, test_loss: 1.1466, test_f1: 0.5439
 epoch: 74, train_loss: 0.7074, test_loss: 1.2239, test_f1: 0.5672
 epoch: 75, train_loss: 0.7105, test_loss: 1.2878, test_f1: 0.5193
 epoch: 76, train_loss: 0.7141, test_loss: 1.1681, test_f1: 0.5821
 epoch: 77, train_loss: 0.7039, test_loss: 1.2431, test_f1: 0.5663
 epoch: 78, train_loss: 0.6974, test_loss: 1.2100, test_f1: 0.5719
 epoch: 79, train_loss: 0.7130, test_loss: 1.1896, test_f1: 0.5640
 epoch: 80, train_loss: 0.7009, test_loss: 1.2224, test_f1: 0.5773
 epoch: 81, train_loss: 0.6948, test_loss: 1.1596, test_f1: 0.5607
 epoch: 82, train_loss: 0.6989, test_loss: 1.2233, test_f1: 0.5567
 epoch: 83, train_loss: 0.6958, test_loss: 1.2281, test_f1: 0.5679
 epoch: 84, train_loss: 0.6736, test_loss: 1.2204, test_f1: 0.5765
 epoch: 85, train_loss: 0.6963, test_loss: 1.2237, test_f1: 0.5615
 epoch: 86, train_loss: 0.6895, test_loss: 1.1555, test_f1: 0.5826
 epoch: 87, train_loss: 0.6955, test_loss: 1.2089, test_f1: 0.5442
 epoch: 88, train_loss: 0.6846, test_loss: 1.2553, test_f1: 0.5876
 epoch: 89, train_loss: 0.6957, test_loss: 1.2996, test_f1: 0.5594
 epoch: 90, train_loss: 0.6955, test_loss: 1.2681, test_f1: 0.5561
 epoch: 91, train_loss: 0.7165, test_loss: 1.1122, test_f1: 0.5973
 epoch: 92, train_loss: 0.6858, test_loss: 1.1877, test_f1: 0.5865
 epoch: 93, train_loss: 0.6892, test_loss: 1.3770, test_f1: 0.5567
 epoch: 94, train_loss: 0.6833, test_loss: 1.1639, test_f1: 0.5743
 epoch: 95, train_loss: 0.6636, test_loss: 1.2176, test_f1: 0.5581
 epoch: 96, train_loss: 0.6793, test_loss: 1.3564, test_f1: 0.5341
 epoch: 97, train_loss: 0.6696, test_loss: 1.3342, test_f1: 0.5611
 epoch: 98, train_loss: 0.6656, test_loss: 1.2564, test_f1: 0.5852
 epoch: 99, train_loss: 0.6502, test_loss: 1.2538, test_f1: 0.5621

Training completed in 743.95 seconds
Best F1: 0.6085 at epoch 83
Mean F1 across iterations: 0.5915  0.0107
========================FINAL RESULTS================================
FEGIN weighted F1: 0.6085  0.0107
python main.py --data ltspice_examples --representation component_component --model FEGIN --layers 5 --hiddens 32 --batch_size 64 --lr 0.01 --emb_size 128 --epochs 100 --save_appendix component_component_L5_H32_BS64_LR0.01_E128 --no_val
-----



STDERR:
  File "main.py", line 370, in <module>
    main()
  File "main.py", line 254, in main
    dataset = dataset_class(
  File "/home/philip/projects/ltspice_examples_code_repo/Circuit-Completion-Using-GNNs/component_classification_with_link_prediction_head/evaluation/FEGIN/kernel/circuit_datasets.py", line 15, in __init__
    self.data, self.slices = torch.load(self.processed_paths[0])
  File "/home/philip/.local/lib/python3.8/site-packages/torch/serialization.py", line 1040, in load
    warnings.warn(
  File "/usr/lib/python3.8/warnings.py", line 109, in _showwarnmsg
    sw(msg.message, msg.category, msg.filename, msg.lineno,
  File "main.py", line 47, in warn_with_traceback
    traceback.print_stack(file=log)
/home/philip/projects/ltspice_examples_code_repo/Circuit-Completion-Using-GNNs/component_classification_with_link_prediction_head/evaluation/FEGIN/kernel/circuit_datasets.py:15: FutureWarning: You are using `torch.load` with `weights_only=False` (the current default value), which uses the default pickle module implicitly. It is possible to construct malicious pickle data which will execute arbitrary code during unpickling (See https://github.com/pytorch/pytorch/blob/main/SECURITY.md#untrusted-models for more details). In a future release, the default value for `weights_only` will be flipped to `True`. This limits the functions that could be executed during unpickling. Arbitrary objects will no longer be allowed to be loaded via this mode unless they are explicitly allowlisted by the user via `torch.serialization.add_safe_globals`. We recommend you start setting `weights_only=True` for any use case where you don't have full control of the loaded file. Please open an issue on GitHub for any issues related to this experimental feature.
  self.data, self.slices = torch.load(self.processed_paths[0])
