STDOUT:
Results will be saved in /home/philip/projects/ltspice_examples_code_repo/Circuit-Completion-Using-GNNs/component_classification_with_link_prediction_head/evaluation/FEGIN/results/model_FEGIN_dataset_ltspice_demos
Command line input: python main.py --data ltspice_demos --representation component_component --model FEGIN --layers 4 --hiddens 16 --batch_size 256 --lr 0.001 --emb_size 512 --epochs 100 --save_appendix component_component_L4_H16_BS256_LR0.001_E512 --no_val
 is saved.
-----
ltspice_demos - FEGIN
Using 4 layers, 16 hidden units, h = 2
Loading component_component representation dataset
ENTERED
Training FEGIN on component_component representation
Train: 1565, Test: 383
##################ITERATION #0 ****************************************
 epoch: 0, train_loss: 1.3696, test_loss: 1.3636, test_f1: 0.2281
 epoch: 1, train_loss: 1.3597, test_loss: 1.3600, test_f1: 0.2281
 epoch: 2, train_loss: 1.3548, test_loss: 1.3567, test_f1: 0.2281
 epoch: 3, train_loss: 1.3500, test_loss: 1.3529, test_f1: 0.2281
 epoch: 4, train_loss: 1.3445, test_loss: 1.3490, test_f1: 0.2281
 epoch: 5, train_loss: 1.3393, test_loss: 1.3446, test_f1: 0.2281
 epoch: 6, train_loss: 1.3331, test_loss: 1.3403, test_f1: 0.2281
 epoch: 7, train_loss: 1.3269, test_loss: 1.3353, test_f1: 0.2281
 epoch: 8, train_loss: 1.3188, test_loss: 1.3298, test_f1: 0.2281
 epoch: 9, train_loss: 1.3105, test_loss: 1.3227, test_f1: 0.2281
 epoch: 10, train_loss: 1.3005, test_loss: 1.3159, test_f1: 0.2281
 epoch: 11, train_loss: 1.2904, test_loss: 1.3080, test_f1: 0.2281
 epoch: 12, train_loss: 1.2734, test_loss: 1.3014, test_f1: 0.2281
 epoch: 13, train_loss: 1.2591, test_loss: 1.2919, test_f1: 0.2281
 epoch: 14, train_loss: 1.2499, test_loss: 1.2799, test_f1: 0.2281
 epoch: 15, train_loss: 1.2353, test_loss: 1.2675, test_f1: 0.2281
 epoch: 16, train_loss: 1.2197, test_loss: 1.2638, test_f1: 0.2281
 epoch: 17, train_loss: 1.2103, test_loss: 1.2739, test_f1: 0.2281
 epoch: 18, train_loss: 1.2014, test_loss: 1.2620, test_f1: 0.2281
 epoch: 19, train_loss: 1.1895, test_loss: 1.2469, test_f1: 0.2984
 epoch: 20, train_loss: 1.1836, test_loss: 1.2408, test_f1: 0.3067
 epoch: 21, train_loss: 1.1834, test_loss: 1.2584, test_f1: 0.2365
 epoch: 22, train_loss: 1.1687, test_loss: 1.2906, test_f1: 0.2525
 epoch: 23, train_loss: 1.1676, test_loss: 1.2906, test_f1: 0.3088
 epoch: 24, train_loss: 1.1531, test_loss: 1.2933, test_f1: 0.3208
 epoch: 25, train_loss: 1.1529, test_loss: 1.2919, test_f1: 0.3421
 epoch: 26, train_loss: 1.1516, test_loss: 1.2889, test_f1: 0.3586
 epoch: 27, train_loss: 1.1468, test_loss: 1.2975, test_f1: 0.4113
 epoch: 28, train_loss: 1.1361, test_loss: 1.3269, test_f1: 0.3772
 epoch: 29, train_loss: 1.1324, test_loss: 1.3735, test_f1: 0.3941
 epoch: 30, train_loss: 1.1277, test_loss: 1.3684, test_f1: 0.3966
 epoch: 31, train_loss: 1.1166, test_loss: 1.3292, test_f1: 0.3852
 epoch: 32, train_loss: 1.1092, test_loss: 1.3104, test_f1: 0.3888
 epoch: 33, train_loss: 1.1109, test_loss: 1.3617, test_f1: 0.3901
 epoch: 34, train_loss: 1.1066, test_loss: 1.4208, test_f1: 0.3923
 epoch: 35, train_loss: 1.1035, test_loss: 1.5255, test_f1: 0.3826
 epoch: 36, train_loss: 1.0951, test_loss: 1.5305, test_f1: 0.3895
 epoch: 37, train_loss: 1.0953, test_loss: 1.5141, test_f1: 0.3956
 epoch: 38, train_loss: 1.0905, test_loss: 1.6016, test_f1: 0.3837
 epoch: 39, train_loss: 1.0848, test_loss: 1.7579, test_f1: 0.3786
 epoch: 40, train_loss: 1.0744, test_loss: 1.7696, test_f1: 0.3786
 epoch: 41, train_loss: 1.0770, test_loss: 1.7188, test_f1: 0.3999
 epoch: 42, train_loss: 1.0742, test_loss: 1.7225, test_f1: 0.3850
 epoch: 43, train_loss: 1.0719, test_loss: 1.6737, test_f1: 0.3991
 epoch: 44, train_loss: 1.0669, test_loss: 1.5665, test_f1: 0.4001
 epoch: 45, train_loss: 1.0606, test_loss: 1.5939, test_f1: 0.3921
 epoch: 46, train_loss: 1.0531, test_loss: 1.6191, test_f1: 0.3899
 epoch: 47, train_loss: 1.0577, test_loss: 1.6726, test_f1: 0.3787
 epoch: 48, train_loss: 1.0394, test_loss: 1.6041, test_f1: 0.3766
 epoch: 49, train_loss: 1.0447, test_loss: 1.5941, test_f1: 0.3856
 epoch: 50, train_loss: 1.0403, test_loss: 1.5921, test_f1: 0.3992
 epoch: 51, train_loss: 1.0264, test_loss: 1.5832, test_f1: 0.3961
 epoch: 52, train_loss: 1.0243, test_loss: 1.6799, test_f1: 0.3986
 epoch: 53, train_loss: 1.0211, test_loss: 1.6983, test_f1: 0.4043
 epoch: 54, train_loss: 1.0121, test_loss: 1.7329, test_f1: 0.4041
 epoch: 55, train_loss: 1.0199, test_loss: 1.7617, test_f1: 0.3966
 epoch: 56, train_loss: 1.0158, test_loss: 1.7085, test_f1: 0.4020
 epoch: 57, train_loss: 1.0124, test_loss: 1.7173, test_f1: 0.4067
 epoch: 58, train_loss: 1.0172, test_loss: 1.6875, test_f1: 0.4209
 epoch: 59, train_loss: 1.0205, test_loss: 1.8234, test_f1: 0.3994
 epoch: 60, train_loss: 1.0092, test_loss: 1.8352, test_f1: 0.4052
 epoch: 61, train_loss: 1.0087, test_loss: 1.8773, test_f1: 0.3836
 epoch: 62, train_loss: 1.0163, test_loss: 1.8250, test_f1: 0.3837
 epoch: 63, train_loss: 1.0017, test_loss: 1.7506, test_f1: 0.4060
 epoch: 64, train_loss: 1.0128, test_loss: 1.7445, test_f1: 0.3806
 epoch: 65, train_loss: 0.9884, test_loss: 1.7834, test_f1: 0.3861
 epoch: 66, train_loss: 0.9842, test_loss: 1.7395, test_f1: 0.3855
 epoch: 67, train_loss: 0.9910, test_loss: 1.7736, test_f1: 0.4028
 epoch: 68, train_loss: 0.9885, test_loss: 1.8463, test_f1: 0.3928
 epoch: 69, train_loss: 0.9969, test_loss: 1.8560, test_f1: 0.3887
 epoch: 70, train_loss: 0.9746, test_loss: 1.7763, test_f1: 0.4002
 epoch: 71, train_loss: 0.9839, test_loss: 1.8056, test_f1: 0.3931
 epoch: 72, train_loss: 0.9976, test_loss: 1.8159, test_f1: 0.3865
 epoch: 73, train_loss: 0.9884, test_loss: 1.8095, test_f1: 0.4067
 epoch: 74, train_loss: 0.9778, test_loss: 1.9087, test_f1: 0.3976
 epoch: 75, train_loss: 0.9826, test_loss: 1.8884, test_f1: 0.3931
 epoch: 76, train_loss: 0.9792, test_loss: 1.8762, test_f1: 0.3978
 epoch: 77, train_loss: 0.9778, test_loss: 1.8602, test_f1: 0.3958
 epoch: 78, train_loss: 0.9713, test_loss: 1.7449, test_f1: 0.4029
 epoch: 79, train_loss: 0.9716, test_loss: 1.8592, test_f1: 0.3950
 epoch: 80, train_loss: 0.9708, test_loss: 1.9274, test_f1: 0.3871
 epoch: 81, train_loss: 0.9660, test_loss: 1.9345, test_f1: 0.4013
 epoch: 82, train_loss: 0.9585, test_loss: 1.9289, test_f1: 0.4062
 epoch: 83, train_loss: 0.9562, test_loss: 1.8824, test_f1: 0.3965
 epoch: 84, train_loss: 0.9756, test_loss: 1.9012, test_f1: 0.3866
 epoch: 85, train_loss: 0.9674, test_loss: 1.9052, test_f1: 0.3824
 epoch: 86, train_loss: 0.9693, test_loss: 1.9438, test_f1: 0.3919
 epoch: 87, train_loss: 0.9589, test_loss: 1.7953, test_f1: 0.3955
 epoch: 88, train_loss: 0.9436, test_loss: 1.9114, test_f1: 0.3976
 epoch: 89, train_loss: 0.9568, test_loss: 2.0191, test_f1: 0.3869
 epoch: 90, train_loss: 0.9469, test_loss: 2.0968, test_f1: 0.3853
 epoch: 91, train_loss: 0.9493, test_loss: 2.0585, test_f1: 0.3920
 epoch: 92, train_loss: 0.9526, test_loss: 2.0212, test_f1: 0.3941
 epoch: 93, train_loss: 0.9609, test_loss: 1.9581, test_f1: 0.3944
 epoch: 94, train_loss: 0.9452, test_loss: 2.0640, test_f1: 0.3894
 epoch: 95, train_loss: 0.9472, test_loss: 2.0692, test_f1: 0.3940
 epoch: 96, train_loss: 0.9445, test_loss: 2.1073, test_f1: 0.3854
 epoch: 97, train_loss: 0.9422, test_loss: 2.1189, test_f1: 0.4054
 epoch: 98, train_loss: 0.9481, test_loss: 2.1398, test_f1: 0.4028
 epoch: 99, train_loss: 0.9446, test_loss: 2.1207, test_f1: 0.4004
##################ITERATION #1 ****************************************
 epoch: 0, train_loss: 1.3509, test_loss: 1.3522, test_f1: 0.2281
 epoch: 1, train_loss: 1.3141, test_loss: 1.3425, test_f1: 0.2281
 epoch: 2, train_loss: 1.2992, test_loss: 1.3343, test_f1: 0.2281
 epoch: 3, train_loss: 1.2835, test_loss: 1.3240, test_f1: 0.2281
 epoch: 4, train_loss: 1.2698, test_loss: 1.3129, test_f1: 0.2281
 epoch: 5, train_loss: 1.2617, test_loss: 1.3038, test_f1: 0.2281
 epoch: 6, train_loss: 1.2493, test_loss: 1.2967, test_f1: 0.2401
 epoch: 7, train_loss: 1.2327, test_loss: 1.2926, test_f1: 0.2401
 epoch: 8, train_loss: 1.2172, test_loss: 1.2901, test_f1: 0.2492
 epoch: 9, train_loss: 1.2072, test_loss: 1.2949, test_f1: 0.2742
 epoch: 10, train_loss: 1.1908, test_loss: 1.3007, test_f1: 0.2757
 epoch: 11, train_loss: 1.1885, test_loss: 1.3057, test_f1: 0.3253
 epoch: 12, train_loss: 1.1753, test_loss: 1.3133, test_f1: 0.3702
 epoch: 13, train_loss: 1.1622, test_loss: 1.3100, test_f1: 0.3707
 epoch: 14, train_loss: 1.1473, test_loss: 1.3261, test_f1: 0.3783
 epoch: 15, train_loss: 1.1487, test_loss: 1.3193, test_f1: 0.3848
 epoch: 16, train_loss: 1.1288, test_loss: 1.3230, test_f1: 0.4040
 epoch: 17, train_loss: 1.1287, test_loss: 1.3280, test_f1: 0.4122
 epoch: 18, train_loss: 1.1174, test_loss: 1.3221, test_f1: 0.4355
 epoch: 19, train_loss: 1.1126, test_loss: 1.3199, test_f1: 0.4180
 epoch: 20, train_loss: 1.1107, test_loss: 1.3130, test_f1: 0.4317
 epoch: 21, train_loss: 1.1006, test_loss: 1.3050, test_f1: 0.4300
 epoch: 22, train_loss: 1.0974, test_loss: 1.3057, test_f1: 0.4388
 epoch: 23, train_loss: 1.0858, test_loss: 1.2999, test_f1: 0.4460
 epoch: 24, train_loss: 1.0838, test_loss: 1.2928, test_f1: 0.4395
 epoch: 25, train_loss: 1.0705, test_loss: 1.2915, test_f1: 0.4409
 epoch: 26, train_loss: 1.0786, test_loss: 1.2897, test_f1: 0.4377
 epoch: 27, train_loss: 1.0608, test_loss: 1.2669, test_f1: 0.4292
 epoch: 28, train_loss: 1.0656, test_loss: 1.2824, test_f1: 0.4349
 epoch: 29, train_loss: 1.0577, test_loss: 1.2758, test_f1: 0.4188
 epoch: 30, train_loss: 1.0582, test_loss: 1.2869, test_f1: 0.4469
 epoch: 31, train_loss: 1.0502, test_loss: 1.3011, test_f1: 0.4486
 epoch: 32, train_loss: 1.0483, test_loss: 1.2962, test_f1: 0.3709
 epoch: 33, train_loss: 1.0544, test_loss: 1.2622, test_f1: 0.3948
 epoch: 34, train_loss: 1.0528, test_loss: 1.2774, test_f1: 0.3890
 epoch: 35, train_loss: 1.0451, test_loss: 1.2918, test_f1: 0.4364
 epoch: 36, train_loss: 1.0311, test_loss: 1.2874, test_f1: 0.4410
 epoch: 37, train_loss: 1.0393, test_loss: 1.2920, test_f1: 0.4493
 epoch: 38, train_loss: 1.0339, test_loss: 1.3049, test_f1: 0.4236
 epoch: 39, train_loss: 1.0200, test_loss: 1.2726, test_f1: 0.4529
 epoch: 40, train_loss: 1.0287, test_loss: 1.2793, test_f1: 0.4593
 epoch: 41, train_loss: 1.0188, test_loss: 1.2992, test_f1: 0.4554
 epoch: 42, train_loss: 1.0095, test_loss: 1.3277, test_f1: 0.4536
 epoch: 43, train_loss: 1.0074, test_loss: 1.3214, test_f1: 0.4593
 epoch: 44, train_loss: 1.0040, test_loss: 1.3066, test_f1: 0.4618
 epoch: 45, train_loss: 1.0044, test_loss: 1.3141, test_f1: 0.4400
 epoch: 46, train_loss: 1.0073, test_loss: 1.3027, test_f1: 0.4753
 epoch: 47, train_loss: 1.0026, test_loss: 1.3128, test_f1: 0.4690
 epoch: 48, train_loss: 0.9928, test_loss: 1.3498, test_f1: 0.4643
 epoch: 49, train_loss: 0.9946, test_loss: 1.3536, test_f1: 0.4364
 epoch: 50, train_loss: 0.9970, test_loss: 1.3591, test_f1: 0.4318
 epoch: 51, train_loss: 0.9883, test_loss: 1.3510, test_f1: 0.4392
 epoch: 52, train_loss: 0.9844, test_loss: 1.3523, test_f1: 0.4555
 epoch: 53, train_loss: 0.9881, test_loss: 1.3529, test_f1: 0.4483
 epoch: 54, train_loss: 0.9771, test_loss: 1.3465, test_f1: 0.4434
 epoch: 55, train_loss: 0.9780, test_loss: 1.3590, test_f1: 0.4407
 epoch: 56, train_loss: 0.9826, test_loss: 1.3686, test_f1: 0.4476
 epoch: 57, train_loss: 0.9840, test_loss: 1.3658, test_f1: 0.4249
 epoch: 58, train_loss: 0.9865, test_loss: 1.3842, test_f1: 0.4236
 epoch: 59, train_loss: 0.9813, test_loss: 1.3796, test_f1: 0.4414
 epoch: 60, train_loss: 0.9718, test_loss: 1.3896, test_f1: 0.4320
 epoch: 61, train_loss: 0.9721, test_loss: 1.3809, test_f1: 0.4220
 epoch: 62, train_loss: 0.9619, test_loss: 1.4095, test_f1: 0.4128
 epoch: 63, train_loss: 0.9824, test_loss: 1.3968, test_f1: 0.4223
 epoch: 64, train_loss: 0.9867, test_loss: 1.3843, test_f1: 0.4358
 epoch: 65, train_loss: 0.9722, test_loss: 1.3719, test_f1: 0.4463
 epoch: 66, train_loss: 0.9768, test_loss: 1.3698, test_f1: 0.4263
 epoch: 67, train_loss: 0.9715, test_loss: 1.3800, test_f1: 0.4332
 epoch: 68, train_loss: 0.9620, test_loss: 1.3908, test_f1: 0.4288
 epoch: 69, train_loss: 0.9630, test_loss: 1.4052, test_f1: 0.4329
 epoch: 70, train_loss: 0.9609, test_loss: 1.4257, test_f1: 0.4360
 epoch: 71, train_loss: 0.9625, test_loss: 1.4367, test_f1: 0.4331
 epoch: 72, train_loss: 0.9553, test_loss: 1.4140, test_f1: 0.4280
 epoch: 73, train_loss: 0.9578, test_loss: 1.4234, test_f1: 0.4142
 epoch: 74, train_loss: 0.9596, test_loss: 1.4245, test_f1: 0.4093
 epoch: 75, train_loss: 0.9635, test_loss: 1.4222, test_f1: 0.4248
 epoch: 76, train_loss: 0.9636, test_loss: 1.4447, test_f1: 0.4292
 epoch: 77, train_loss: 0.9618, test_loss: 1.4496, test_f1: 0.4410
 epoch: 78, train_loss: 0.9560, test_loss: 1.4641, test_f1: 0.4348
 epoch: 79, train_loss: 0.9543, test_loss: 1.4676, test_f1: 0.4294
 epoch: 80, train_loss: 0.9476, test_loss: 1.4633, test_f1: 0.4348
 epoch: 81, train_loss: 0.9454, test_loss: 1.4762, test_f1: 0.4327
 epoch: 82, train_loss: 0.9474, test_loss: 1.4893, test_f1: 0.4281
 epoch: 83, train_loss: 0.9481, test_loss: 1.4959, test_f1: 0.4210
 epoch: 84, train_loss: 0.9479, test_loss: 1.4887, test_f1: 0.4167
 epoch: 85, train_loss: 0.9329, test_loss: 1.4462, test_f1: 0.4116
 epoch: 86, train_loss: 0.9480, test_loss: 1.4898, test_f1: 0.4206
 epoch: 87, train_loss: 0.9478, test_loss: 1.4918, test_f1: 0.4182
 epoch: 88, train_loss: 0.9452, test_loss: 1.5026, test_f1: 0.4330
 epoch: 89, train_loss: 0.9365, test_loss: 1.5022, test_f1: 0.4332
 epoch: 90, train_loss: 0.9477, test_loss: 1.4975, test_f1: 0.4312
 epoch: 91, train_loss: 0.9345, test_loss: 1.5103, test_f1: 0.4267
 epoch: 92, train_loss: 0.9472, test_loss: 1.4844, test_f1: 0.4290
 epoch: 93, train_loss: 0.9404, test_loss: 1.4827, test_f1: 0.4296
 epoch: 94, train_loss: 0.9462, test_loss: 1.5225, test_f1: 0.4252
 epoch: 95, train_loss: 0.9271, test_loss: 1.5237, test_f1: 0.4082
 epoch: 96, train_loss: 0.9416, test_loss: 1.4995, test_f1: 0.4365
 epoch: 97, train_loss: 0.9392, test_loss: 1.5074, test_f1: 0.4320
 epoch: 98, train_loss: 0.9295, test_loss: 1.5495, test_f1: 0.4196
 epoch: 99, train_loss: 0.9337, test_loss: 1.5350, test_f1: 0.4273
##################ITERATION #2 ****************************************
 epoch: 0, train_loss: 1.2928, test_loss: 1.3192, test_f1: 0.2281
 epoch: 1, train_loss: 1.2612, test_loss: 1.3169, test_f1: 0.2281
 epoch: 2, train_loss: 1.2539, test_loss: 1.3128, test_f1: 0.2281
 epoch: 3, train_loss: 1.2427, test_loss: 1.3089, test_f1: 0.2281
 epoch: 4, train_loss: 1.2361, test_loss: 1.3080, test_f1: 0.2404
 epoch: 5, train_loss: 1.2213, test_loss: 1.3080, test_f1: 0.2366
 epoch: 6, train_loss: 1.2096, test_loss: 1.3082, test_f1: 0.2391
 epoch: 7, train_loss: 1.1995, test_loss: 1.3129, test_f1: 0.2341
 epoch: 8, train_loss: 1.1947, test_loss: 1.3074, test_f1: 0.2628
 epoch: 9, train_loss: 1.1872, test_loss: 1.2869, test_f1: 0.2615
 epoch: 10, train_loss: 1.1768, test_loss: 1.2645, test_f1: 0.2898
 epoch: 11, train_loss: 1.1659, test_loss: 1.2489, test_f1: 0.3495
 epoch: 12, train_loss: 1.1563, test_loss: 1.2394, test_f1: 0.3673
 epoch: 13, train_loss: 1.1491, test_loss: 1.2330, test_f1: 0.3949
 epoch: 14, train_loss: 1.1539, test_loss: 1.2310, test_f1: 0.3666
 epoch: 15, train_loss: 1.1307, test_loss: 1.2340, test_f1: 0.3815
 epoch: 16, train_loss: 1.1390, test_loss: 1.2334, test_f1: 0.3919
 epoch: 17, train_loss: 1.1245, test_loss: 1.2532, test_f1: 0.3526
 epoch: 18, train_loss: 1.1275, test_loss: 1.2625, test_f1: 0.3769
 epoch: 19, train_loss: 1.1268, test_loss: 1.2271, test_f1: 0.3981
 epoch: 20, train_loss: 1.1103, test_loss: 1.2243, test_f1: 0.3841
 epoch: 21, train_loss: 1.1059, test_loss: 1.2280, test_f1: 0.3871
 epoch: 22, train_loss: 1.1037, test_loss: 1.2321, test_f1: 0.3935
 epoch: 23, train_loss: 1.1104, test_loss: 1.2233, test_f1: 0.4115
 epoch: 24, train_loss: 1.1082, test_loss: 1.2342, test_f1: 0.4046
 epoch: 25, train_loss: 1.1072, test_loss: 1.2279, test_f1: 0.3972
 epoch: 26, train_loss: 1.0956, test_loss: 1.2355, test_f1: 0.3864
 epoch: 27, train_loss: 1.0995, test_loss: 1.2517, test_f1: 0.3907
 epoch: 28, train_loss: 1.0861, test_loss: 1.2406, test_f1: 0.3905
 epoch: 29, train_loss: 1.0947, test_loss: 1.2393, test_f1: 0.3890
 epoch: 30, train_loss: 1.0853, test_loss: 1.2619, test_f1: 0.3983
 epoch: 31, train_loss: 1.0728, test_loss: 1.2841, test_f1: 0.3785
 epoch: 32, train_loss: 1.0738, test_loss: 1.2682, test_f1: 0.4018
 epoch: 33, train_loss: 1.0879, test_loss: 1.2535, test_f1: 0.3884
 epoch: 34, train_loss: 1.0739, test_loss: 1.2556, test_f1: 0.4041
 epoch: 35, train_loss: 1.0728, test_loss: 1.2644, test_f1: 0.3883
 epoch: 36, train_loss: 1.0709, test_loss: 1.2502, test_f1: 0.3807
 epoch: 37, train_loss: 1.0730, test_loss: 1.2663, test_f1: 0.3960
 epoch: 38, train_loss: 1.0612, test_loss: 1.3183, test_f1: 0.4092
 epoch: 39, train_loss: 1.0603, test_loss: 1.2941, test_f1: 0.3931
 epoch: 40, train_loss: 1.0514, test_loss: 1.2927, test_f1: 0.3977
 epoch: 41, train_loss: 1.0493, test_loss: 1.3491, test_f1: 0.3933
 epoch: 42, train_loss: 1.0537, test_loss: 1.4555, test_f1: 0.3597
 epoch: 43, train_loss: 1.0577, test_loss: 1.2889, test_f1: 0.3867
 epoch: 44, train_loss: 1.0414, test_loss: 1.2373, test_f1: 0.4203
 epoch: 45, train_loss: 1.0485, test_loss: 1.2659, test_f1: 0.4053
 epoch: 46, train_loss: 1.0445, test_loss: 1.3362, test_f1: 0.3849
 epoch: 47, train_loss: 1.0413, test_loss: 1.3064, test_f1: 0.3704
 epoch: 48, train_loss: 1.0271, test_loss: 1.3336, test_f1: 0.3732
 epoch: 49, train_loss: 1.0391, test_loss: 1.3819, test_f1: 0.3917
 epoch: 50, train_loss: 1.0259, test_loss: 1.4047, test_f1: 0.3947
 epoch: 51, train_loss: 1.0301, test_loss: 1.4571, test_f1: 0.3901
 epoch: 52, train_loss: 1.0235, test_loss: 1.4493, test_f1: 0.3764
 epoch: 53, train_loss: 1.0218, test_loss: 1.4198, test_f1: 0.3747
 epoch: 54, train_loss: 1.0251, test_loss: 1.3729, test_f1: 0.3894
 epoch: 55, train_loss: 1.0131, test_loss: 1.3523, test_f1: 0.3863
 epoch: 56, train_loss: 1.0164, test_loss: 1.3804, test_f1: 0.3817
 epoch: 57, train_loss: 1.0172, test_loss: 1.3952, test_f1: 0.3877
 epoch: 58, train_loss: 1.0142, test_loss: 1.3980, test_f1: 0.3869
 epoch: 59, train_loss: 1.0128, test_loss: 1.4066, test_f1: 0.4033
 epoch: 60, train_loss: 1.0226, test_loss: 1.4484, test_f1: 0.4067
 epoch: 61, train_loss: 1.0029, test_loss: 1.4404, test_f1: 0.3837
 epoch: 62, train_loss: 1.0176, test_loss: 1.4340, test_f1: 0.3859
 epoch: 63, train_loss: 1.0028, test_loss: 1.5898, test_f1: 0.3812
 epoch: 64, train_loss: 1.0076, test_loss: 1.5812, test_f1: 0.3855
 epoch: 65, train_loss: 1.0282, test_loss: 1.5040, test_f1: 0.3854
 epoch: 66, train_loss: 1.0080, test_loss: 1.3964, test_f1: 0.3767
 epoch: 67, train_loss: 1.0055, test_loss: 1.3816, test_f1: 0.3839
 epoch: 68, train_loss: 1.0047, test_loss: 1.4710, test_f1: 0.3890
 epoch: 69, train_loss: 1.0070, test_loss: 1.5993, test_f1: 0.4057
 epoch: 70, train_loss: 1.0031, test_loss: 1.5794, test_f1: 0.4007
 epoch: 71, train_loss: 1.0046, test_loss: 1.6743, test_f1: 0.3986
 epoch: 72, train_loss: 1.0042, test_loss: 1.6478, test_f1: 0.3912
 epoch: 73, train_loss: 1.0045, test_loss: 1.6035, test_f1: 0.3853
 epoch: 74, train_loss: 0.9980, test_loss: 1.5576, test_f1: 0.3997
 epoch: 75, train_loss: 0.9978, test_loss: 1.3348, test_f1: 0.3877
 epoch: 76, train_loss: 1.0073, test_loss: 1.3085, test_f1: 0.4023
 epoch: 77, train_loss: 1.0012, test_loss: 1.4241, test_f1: 0.3804
 epoch: 78, train_loss: 1.0017, test_loss: 1.4991, test_f1: 0.3958
 epoch: 79, train_loss: 1.0016, test_loss: 1.4809, test_f1: 0.3781
 epoch: 80, train_loss: 0.9956, test_loss: 1.4408, test_f1: 0.4008
 epoch: 81, train_loss: 0.9902, test_loss: 1.4520, test_f1: 0.4011
 epoch: 82, train_loss: 0.9851, test_loss: 1.4655, test_f1: 0.4010
 epoch: 83, train_loss: 0.9938, test_loss: 1.5062, test_f1: 0.3932
 epoch: 84, train_loss: 0.9937, test_loss: 1.5435, test_f1: 0.3977
 epoch: 85, train_loss: 0.9925, test_loss: 1.4772, test_f1: 0.3940
 epoch: 86, train_loss: 0.9839, test_loss: 1.5463, test_f1: 0.4042
 epoch: 87, train_loss: 1.0002, test_loss: 1.6641, test_f1: 0.4056
 epoch: 88, train_loss: 0.9930, test_loss: 1.6396, test_f1: 0.4064
 epoch: 89, train_loss: 0.9897, test_loss: 1.6181, test_f1: 0.3970
 epoch: 90, train_loss: 0.9827, test_loss: 1.5937, test_f1: 0.4010
 epoch: 91, train_loss: 0.9823, test_loss: 1.5292, test_f1: 0.3995
 epoch: 92, train_loss: 0.9848, test_loss: 1.5305, test_f1: 0.3998
 epoch: 93, train_loss: 0.9744, test_loss: 1.5548, test_f1: 0.3896
 epoch: 94, train_loss: 0.9831, test_loss: 1.5518, test_f1: 0.4050
 epoch: 95, train_loss: 0.9898, test_loss: 1.5904, test_f1: 0.4052
 epoch: 96, train_loss: 0.9901, test_loss: 1.5115, test_f1: 0.4041
 epoch: 97, train_loss: 0.9988, test_loss: 1.5608, test_f1: 0.4011
 epoch: 98, train_loss: 0.9782, test_loss: 1.5625, test_f1: 0.3946
 epoch: 99, train_loss: 0.9708, test_loss: 1.5501, test_f1: 0.3928
##################ITERATION #3 ****************************************
 epoch: 0, train_loss: 1.2776, test_loss: 1.3118, test_f1: 0.2281
 epoch: 1, train_loss: 1.2459, test_loss: 1.3100, test_f1: 0.2281
 epoch: 2, train_loss: 1.2253, test_loss: 1.3025, test_f1: 0.2281
 epoch: 3, train_loss: 1.2212, test_loss: 1.2892, test_f1: 0.2281
 epoch: 4, train_loss: 1.2047, test_loss: 1.2740, test_f1: 0.2248
 epoch: 5, train_loss: 1.2008, test_loss: 1.2632, test_f1: 0.2303
 epoch: 6, train_loss: 1.1953, test_loss: 1.2524, test_f1: 0.2311
 epoch: 7, train_loss: 1.1841, test_loss: 1.2443, test_f1: 0.2656
 epoch: 8, train_loss: 1.1805, test_loss: 1.2372, test_f1: 0.3215
 epoch: 9, train_loss: 1.1582, test_loss: 1.2258, test_f1: 0.3638
 epoch: 10, train_loss: 1.1572, test_loss: 1.2205, test_f1: 0.3553
 epoch: 11, train_loss: 1.1484, test_loss: 1.2167, test_f1: 0.3701
 epoch: 12, train_loss: 1.1534, test_loss: 1.2162, test_f1: 0.3506
 epoch: 13, train_loss: 1.1441, test_loss: 1.2167, test_f1: 0.3588
 epoch: 14, train_loss: 1.1424, test_loss: 1.2197, test_f1: 0.3610
 epoch: 15, train_loss: 1.1265, test_loss: 1.2183, test_f1: 0.3630
 epoch: 16, train_loss: 1.1229, test_loss: 1.2164, test_f1: 0.3778
 epoch: 17, train_loss: 1.1122, test_loss: 1.2093, test_f1: 0.3832
 epoch: 18, train_loss: 1.1087, test_loss: 1.2105, test_f1: 0.3675
 epoch: 19, train_loss: 1.1063, test_loss: 1.2115, test_f1: 0.3711
 epoch: 20, train_loss: 1.1056, test_loss: 1.2127, test_f1: 0.3895
 epoch: 21, train_loss: 1.1034, test_loss: 1.2090, test_f1: 0.4180
 epoch: 22, train_loss: 1.0892, test_loss: 1.2049, test_f1: 0.4115
 epoch: 23, train_loss: 1.0898, test_loss: 1.2006, test_f1: 0.4167
 epoch: 24, train_loss: 1.0879, test_loss: 1.1916, test_f1: 0.4215
 epoch: 25, train_loss: 1.0682, test_loss: 1.1899, test_f1: 0.4185
 epoch: 26, train_loss: 1.0784, test_loss: 1.1940, test_f1: 0.4177
 epoch: 27, train_loss: 1.0766, test_loss: 1.1977, test_f1: 0.4091
 epoch: 28, train_loss: 1.0616, test_loss: 1.1848, test_f1: 0.4231
 epoch: 29, train_loss: 1.0698, test_loss: 1.1792, test_f1: 0.4338
 epoch: 30, train_loss: 1.0546, test_loss: 1.1852, test_f1: 0.4172
 epoch: 31, train_loss: 1.0651, test_loss: 1.1868, test_f1: 0.4235
 epoch: 32, train_loss: 1.0539, test_loss: 1.1876, test_f1: 0.4584
 epoch: 33, train_loss: 1.0514, test_loss: 1.1771, test_f1: 0.4461
 epoch: 34, train_loss: 1.0459, test_loss: 1.1731, test_f1: 0.4415
 epoch: 35, train_loss: 1.0410, test_loss: 1.1938, test_f1: 0.4441
 epoch: 36, train_loss: 1.0397, test_loss: 1.1921, test_f1: 0.4424
 epoch: 37, train_loss: 1.0328, test_loss: 1.1825, test_f1: 0.4282
 epoch: 38, train_loss: 1.0363, test_loss: 1.1768, test_f1: 0.4440
 epoch: 39, train_loss: 1.0272, test_loss: 1.1583, test_f1: 0.4582
 epoch: 40, train_loss: 1.0362, test_loss: 1.1579, test_f1: 0.4674
 epoch: 41, train_loss: 1.0231, test_loss: 1.1804, test_f1: 0.4483
 epoch: 42, train_loss: 1.0194, test_loss: 1.1849, test_f1: 0.4461
 epoch: 43, train_loss: 1.0170, test_loss: 1.1943, test_f1: 0.4624
 epoch: 44, train_loss: 1.0159, test_loss: 1.1784, test_f1: 0.4782
 epoch: 45, train_loss: 1.0056, test_loss: 1.1775, test_f1: 0.4770
 epoch: 46, train_loss: 1.0084, test_loss: 1.1907, test_f1: 0.4725
 epoch: 47, train_loss: 1.0184, test_loss: 1.1989, test_f1: 0.4504
 epoch: 48, train_loss: 1.0223, test_loss: 1.1982, test_f1: 0.4610
 epoch: 49, train_loss: 1.0100, test_loss: 1.2040, test_f1: 0.4670
 epoch: 50, train_loss: 0.9914, test_loss: 1.1991, test_f1: 0.4699
 epoch: 51, train_loss: 0.9908, test_loss: 1.2025, test_f1: 0.4768
 epoch: 52, train_loss: 1.0038, test_loss: 1.2082, test_f1: 0.4857
 epoch: 53, train_loss: 0.9921, test_loss: 1.2170, test_f1: 0.4669
 epoch: 54, train_loss: 1.0047, test_loss: 1.2304, test_f1: 0.4536
 epoch: 55, train_loss: 1.0010, test_loss: 1.2310, test_f1: 0.4611
 epoch: 56, train_loss: 0.9925, test_loss: 1.2104, test_f1: 0.4692
 epoch: 57, train_loss: 0.9916, test_loss: 1.1997, test_f1: 0.4625
 epoch: 58, train_loss: 0.9768, test_loss: 1.1984, test_f1: 0.4648
 epoch: 59, train_loss: 0.9909, test_loss: 1.2044, test_f1: 0.4656
 epoch: 60, train_loss: 0.9892, test_loss: 1.2114, test_f1: 0.4508
 epoch: 61, train_loss: 0.9757, test_loss: 1.2179, test_f1: 0.4541
 epoch: 62, train_loss: 0.9793, test_loss: 1.2048, test_f1: 0.4605
 epoch: 63, train_loss: 0.9793, test_loss: 1.2103, test_f1: 0.4719
 epoch: 64, train_loss: 0.9708, test_loss: 1.2175, test_f1: 0.4616
 epoch: 65, train_loss: 0.9747, test_loss: 1.2064, test_f1: 0.4703
 epoch: 66, train_loss: 0.9770, test_loss: 1.2141, test_f1: 0.4731
 epoch: 67, train_loss: 0.9770, test_loss: 1.2294, test_f1: 0.4619
 epoch: 68, train_loss: 0.9650, test_loss: 1.2290, test_f1: 0.4601
 epoch: 69, train_loss: 0.9782, test_loss: 1.1999, test_f1: 0.4677
 epoch: 70, train_loss: 0.9745, test_loss: 1.1958, test_f1: 0.4604
 epoch: 71, train_loss: 0.9865, test_loss: 1.2001, test_f1: 0.4630
 epoch: 72, train_loss: 0.9691, test_loss: 1.2151, test_f1: 0.4631
 epoch: 73, train_loss: 0.9588, test_loss: 1.2429, test_f1: 0.4671
 epoch: 74, train_loss: 0.9831, test_loss: 1.2242, test_f1: 0.4622
 epoch: 75, train_loss: 0.9785, test_loss: 1.2265, test_f1: 0.4608
 epoch: 76, train_loss: 0.9713, test_loss: 1.2276, test_f1: 0.4605
 epoch: 77, train_loss: 0.9656, test_loss: 1.2178, test_f1: 0.4472
 epoch: 78, train_loss: 0.9770, test_loss: 1.2112, test_f1: 0.4555
 epoch: 79, train_loss: 0.9723, test_loss: 1.1989, test_f1: 0.4630
 epoch: 80, train_loss: 0.9734, test_loss: 1.1958, test_f1: 0.4765
 epoch: 81, train_loss: 0.9661, test_loss: 1.2047, test_f1: 0.4712
 epoch: 82, train_loss: 0.9524, test_loss: 1.1990, test_f1: 0.4725
 epoch: 83, train_loss: 0.9565, test_loss: 1.2209, test_f1: 0.4729
 epoch: 84, train_loss: 0.9473, test_loss: 1.2284, test_f1: 0.4626
 epoch: 85, train_loss: 0.9769, test_loss: 1.2402, test_f1: 0.4653
 epoch: 86, train_loss: 0.9504, test_loss: 1.2318, test_f1: 0.4659
 epoch: 87, train_loss: 0.9617, test_loss: 1.2207, test_f1: 0.4708
 epoch: 88, train_loss: 0.9645, test_loss: 1.2250, test_f1: 0.4735
 epoch: 89, train_loss: 0.9645, test_loss: 1.2074, test_f1: 0.4731
 epoch: 90, train_loss: 0.9480, test_loss: 1.2181, test_f1: 0.4713
 epoch: 91, train_loss: 0.9524, test_loss: 1.2263, test_f1: 0.4674
 epoch: 92, train_loss: 0.9546, test_loss: 1.2247, test_f1: 0.4817
 epoch: 93, train_loss: 0.9459, test_loss: 1.2124, test_f1: 0.4740
 epoch: 94, train_loss: 0.9476, test_loss: 1.1980, test_f1: 0.4824
 epoch: 95, train_loss: 0.9427, test_loss: 1.2000, test_f1: 0.4781
 epoch: 96, train_loss: 0.9394, test_loss: 1.2131, test_f1: 0.4485
 epoch: 97, train_loss: 0.9454, test_loss: 1.1983, test_f1: 0.4563
 epoch: 98, train_loss: 0.9428, test_loss: 1.1831, test_f1: 0.4890
 epoch: 99, train_loss: 0.9379, test_loss: 1.1789, test_f1: 0.4890
##################ITERATION #4 ****************************************
 epoch: 0, train_loss: 1.3027, test_loss: 1.3594, test_f1: 0.2281
 epoch: 1, train_loss: 1.2595, test_loss: 1.3519, test_f1: 0.2281
 epoch: 2, train_loss: 1.2420, test_loss: 1.3348, test_f1: 0.2281
 epoch: 3, train_loss: 1.2340, test_loss: 1.3167, test_f1: 0.2281
 epoch: 4, train_loss: 1.2248, test_loss: 1.2944, test_f1: 0.2294
 epoch: 5, train_loss: 1.2136, test_loss: 1.2770, test_f1: 0.2472
 epoch: 6, train_loss: 1.2004, test_loss: 1.2730, test_f1: 0.2616
 epoch: 7, train_loss: 1.1997, test_loss: 1.2728, test_f1: 0.2585
 epoch: 8, train_loss: 1.1897, test_loss: 1.2685, test_f1: 0.2735
 epoch: 9, train_loss: 1.1978, test_loss: 1.2624, test_f1: 0.3267
 epoch: 10, train_loss: 1.1798, test_loss: 1.2533, test_f1: 0.3599
 epoch: 11, train_loss: 1.1706, test_loss: 1.2475, test_f1: 0.3755
 epoch: 12, train_loss: 1.1610, test_loss: 1.2482, test_f1: 0.3982
 epoch: 13, train_loss: 1.1561, test_loss: 1.2385, test_f1: 0.3942
 epoch: 14, train_loss: 1.1638, test_loss: 1.2347, test_f1: 0.4133
 epoch: 15, train_loss: 1.1561, test_loss: 1.2323, test_f1: 0.4212
 epoch: 16, train_loss: 1.1438, test_loss: 1.2353, test_f1: 0.4245
 epoch: 17, train_loss: 1.1392, test_loss: 1.2389, test_f1: 0.4253
 epoch: 18, train_loss: 1.1209, test_loss: 1.2321, test_f1: 0.4254
 epoch: 19, train_loss: 1.1299, test_loss: 1.2202, test_f1: 0.4298
 epoch: 20, train_loss: 1.1130, test_loss: 1.2159, test_f1: 0.4399
 epoch: 21, train_loss: 1.1110, test_loss: 1.2142, test_f1: 0.4314
 epoch: 22, train_loss: 1.1002, test_loss: 1.2128, test_f1: 0.4388
 epoch: 23, train_loss: 1.1031, test_loss: 1.2208, test_f1: 0.4432
 epoch: 24, train_loss: 1.0979, test_loss: 1.2370, test_f1: 0.4164
 epoch: 25, train_loss: 1.0838, test_loss: 1.2117, test_f1: 0.4470
 epoch: 26, train_loss: 1.0907, test_loss: 1.2197, test_f1: 0.4480
 epoch: 27, train_loss: 1.0887, test_loss: 1.2355, test_f1: 0.4222
 epoch: 28, train_loss: 1.0746, test_loss: 1.2602, test_f1: 0.4176
 epoch: 29, train_loss: 1.0701, test_loss: 1.2377, test_f1: 0.4280
 epoch: 30, train_loss: 1.0638, test_loss: 1.2288, test_f1: 0.4378
 epoch: 31, train_loss: 1.0758, test_loss: 1.2465, test_f1: 0.4287
 epoch: 32, train_loss: 1.0724, test_loss: 1.2460, test_f1: 0.4112
 epoch: 33, train_loss: 1.0620, test_loss: 1.2344, test_f1: 0.4135
 epoch: 34, train_loss: 1.0465, test_loss: 1.2265, test_f1: 0.4346
 epoch: 35, train_loss: 1.0676, test_loss: 1.2146, test_f1: 0.4357
 epoch: 36, train_loss: 1.0566, test_loss: 1.2113, test_f1: 0.4323
 epoch: 37, train_loss: 1.0637, test_loss: 1.2052, test_f1: 0.4550
 epoch: 38, train_loss: 1.0459, test_loss: 1.2066, test_f1: 0.4494
 epoch: 39, train_loss: 1.0448, test_loss: 1.2010, test_f1: 0.4403
 epoch: 40, train_loss: 1.0396, test_loss: 1.1909, test_f1: 0.4430
 epoch: 41, train_loss: 1.0380, test_loss: 1.1917, test_f1: 0.4370
 epoch: 42, train_loss: 1.0239, test_loss: 1.2213, test_f1: 0.4445
 epoch: 43, train_loss: 1.0281, test_loss: 1.2290, test_f1: 0.4453
 epoch: 44, train_loss: 1.0183, test_loss: 1.2260, test_f1: 0.4401
 epoch: 45, train_loss: 1.0236, test_loss: 1.2261, test_f1: 0.4361
 epoch: 46, train_loss: 1.0104, test_loss: 1.2187, test_f1: 0.4505
 epoch: 47, train_loss: 1.0112, test_loss: 1.2028, test_f1: 0.4629
 epoch: 48, train_loss: 1.0120, test_loss: 1.2006, test_f1: 0.4066
 epoch: 49, train_loss: 1.0038, test_loss: 1.2061, test_f1: 0.3851
 epoch: 50, train_loss: 1.0127, test_loss: 1.1961, test_f1: 0.3893
 epoch: 51, train_loss: 1.0008, test_loss: 1.2027, test_f1: 0.4322
 epoch: 52, train_loss: 0.9950, test_loss: 1.2133, test_f1: 0.4322
 epoch: 53, train_loss: 1.0060, test_loss: 1.2053, test_f1: 0.4305
 epoch: 54, train_loss: 0.9967, test_loss: 1.2086, test_f1: 0.4410
 epoch: 55, train_loss: 1.0015, test_loss: 1.2049, test_f1: 0.4129
 epoch: 56, train_loss: 1.0003, test_loss: 1.2033, test_f1: 0.4067
 epoch: 57, train_loss: 1.0059, test_loss: 1.1991, test_f1: 0.4247
 epoch: 58, train_loss: 0.9980, test_loss: 1.2061, test_f1: 0.4219
 epoch: 59, train_loss: 0.9966, test_loss: 1.2075, test_f1: 0.4203
 epoch: 60, train_loss: 0.9887, test_loss: 1.2063, test_f1: 0.4259
 epoch: 61, train_loss: 0.9942, test_loss: 1.2047, test_f1: 0.4084
 epoch: 62, train_loss: 0.9795, test_loss: 1.1953, test_f1: 0.4286
 epoch: 63, train_loss: 0.9889, test_loss: 1.1960, test_f1: 0.4308
 epoch: 64, train_loss: 0.9953, test_loss: 1.1936, test_f1: 0.4194
 epoch: 65, train_loss: 0.9820, test_loss: 1.2065, test_f1: 0.4156
 epoch: 66, train_loss: 0.9751, test_loss: 1.2112, test_f1: 0.3990
 epoch: 67, train_loss: 0.9733, test_loss: 1.2291, test_f1: 0.4062
 epoch: 68, train_loss: 0.9776, test_loss: 1.2379, test_f1: 0.4059
 epoch: 69, train_loss: 0.9753, test_loss: 1.2241, test_f1: 0.4056
 epoch: 70, train_loss: 0.9805, test_loss: 1.2074, test_f1: 0.4202
 epoch: 71, train_loss: 0.9673, test_loss: 1.2174, test_f1: 0.4078
 epoch: 72, train_loss: 0.9730, test_loss: 1.2458, test_f1: 0.3810
 epoch: 73, train_loss: 0.9758, test_loss: 1.2515, test_f1: 0.4004
 epoch: 74, train_loss: 0.9755, test_loss: 1.2500, test_f1: 0.4144
 epoch: 75, train_loss: 0.9757, test_loss: 1.2517, test_f1: 0.4397
 epoch: 76, train_loss: 0.9766, test_loss: 1.2389, test_f1: 0.4142
 epoch: 77, train_loss: 0.9738, test_loss: 1.2527, test_f1: 0.4152
 epoch: 78, train_loss: 0.9647, test_loss: 1.2433, test_f1: 0.3706
 epoch: 79, train_loss: 0.9711, test_loss: 1.2324, test_f1: 0.3903
 epoch: 80, train_loss: 0.9708, test_loss: 1.2115, test_f1: 0.4252
 epoch: 81, train_loss: 0.9672, test_loss: 1.2036, test_f1: 0.4255
 epoch: 82, train_loss: 0.9678, test_loss: 1.1897, test_f1: 0.4339
 epoch: 83, train_loss: 0.9618, test_loss: 1.2052, test_f1: 0.4228
 epoch: 84, train_loss: 0.9647, test_loss: 1.2289, test_f1: 0.3992
 epoch: 85, train_loss: 0.9763, test_loss: 1.2435, test_f1: 0.4103
 epoch: 86, train_loss: 0.9565, test_loss: 1.2531, test_f1: 0.3972
 epoch: 87, train_loss: 0.9533, test_loss: 1.2435, test_f1: 0.3750
 epoch: 88, train_loss: 0.9515, test_loss: 1.2393, test_f1: 0.3800
 epoch: 89, train_loss: 0.9565, test_loss: 1.2113, test_f1: 0.3944
 epoch: 90, train_loss: 0.9545, test_loss: 1.2155, test_f1: 0.3935
 epoch: 91, train_loss: 0.9686, test_loss: 1.2157, test_f1: 0.4143
 epoch: 92, train_loss: 0.9462, test_loss: 1.2051, test_f1: 0.4201
 epoch: 93, train_loss: 0.9554, test_loss: 1.2059, test_f1: 0.4227
 epoch: 94, train_loss: 0.9460, test_loss: 1.2124, test_f1: 0.4182
 epoch: 95, train_loss: 0.9498, test_loss: 1.2275, test_f1: 0.4183
 epoch: 96, train_loss: 0.9481, test_loss: 1.2545, test_f1: 0.4482
 epoch: 97, train_loss: 0.9433, test_loss: 1.2756, test_f1: 0.4230
 epoch: 98, train_loss: 0.9368, test_loss: 1.2682, test_f1: 0.4123
 epoch: 99, train_loss: 0.9480, test_loss: 1.2615, test_f1: 0.4088
##################ITERATION #5 ****************************************
 epoch: 0, train_loss: 1.2969, test_loss: 1.3434, test_f1: 0.2248
 epoch: 1, train_loss: 1.2635, test_loss: 1.3360, test_f1: 0.2248
 epoch: 2, train_loss: 1.2471, test_loss: 1.3315, test_f1: 0.2248
 epoch: 3, train_loss: 1.2378, test_loss: 1.3342, test_f1: 0.2404
 epoch: 4, train_loss: 1.2365, test_loss: 1.3273, test_f1: 0.2404
 epoch: 5, train_loss: 1.2314, test_loss: 1.3211, test_f1: 0.2404
 epoch: 6, train_loss: 1.2223, test_loss: 1.3184, test_f1: 0.2404
 epoch: 7, train_loss: 1.2172, test_loss: 1.3169, test_f1: 0.2404
 epoch: 8, train_loss: 1.1966, test_loss: 1.3173, test_f1: 0.2391
 epoch: 9, train_loss: 1.2005, test_loss: 1.3140, test_f1: 0.2444
 epoch: 10, train_loss: 1.2033, test_loss: 1.3043, test_f1: 0.3129
 epoch: 11, train_loss: 1.2020, test_loss: 1.3073, test_f1: 0.3285
 epoch: 12, train_loss: 1.1967, test_loss: 1.3077, test_f1: 0.3298
 epoch: 13, train_loss: 1.1878, test_loss: 1.3036, test_f1: 0.3521
 epoch: 14, train_loss: 1.1879, test_loss: 1.3056, test_f1: 0.3480
 epoch: 15, train_loss: 1.1873, test_loss: 1.3020, test_f1: 0.3494
 epoch: 16, train_loss: 1.1838, test_loss: 1.3118, test_f1: 0.3618
 epoch: 17, train_loss: 1.1710, test_loss: 1.3210, test_f1: 0.3706
 epoch: 18, train_loss: 1.1743, test_loss: 1.3297, test_f1: 0.3833
 epoch: 19, train_loss: 1.1723, test_loss: 1.3244, test_f1: 0.3838
 epoch: 20, train_loss: 1.1799, test_loss: 1.3197, test_f1: 0.3852
 epoch: 21, train_loss: 1.1681, test_loss: 1.3076, test_f1: 0.3909
 epoch: 22, train_loss: 1.1584, test_loss: 1.3121, test_f1: 0.3938
 epoch: 23, train_loss: 1.1593, test_loss: 1.3206, test_f1: 0.3922
 epoch: 24, train_loss: 1.1482, test_loss: 1.3156, test_f1: 0.4119
 epoch: 25, train_loss: 1.1568, test_loss: 1.3262, test_f1: 0.4079
 epoch: 26, train_loss: 1.1433, test_loss: 1.3064, test_f1: 0.4169
 epoch: 27, train_loss: 1.1340, test_loss: 1.3158, test_f1: 0.4248
 epoch: 28, train_loss: 1.1336, test_loss: 1.3115, test_f1: 0.4096
 epoch: 29, train_loss: 1.1308, test_loss: 1.3198, test_f1: 0.4022
 epoch: 30, train_loss: 1.1217, test_loss: 1.3092, test_f1: 0.4224
 epoch: 31, train_loss: 1.1112, test_loss: 1.2970, test_f1: 0.4359
 epoch: 32, train_loss: 1.1174, test_loss: 1.2994, test_f1: 0.4236
 epoch: 33, train_loss: 1.1097, test_loss: 1.2868, test_f1: 0.4198
 epoch: 34, train_loss: 1.1016, test_loss: 1.2619, test_f1: 0.4191
 epoch: 35, train_loss: 1.1037, test_loss: 1.2610, test_f1: 0.4208
 epoch: 36, train_loss: 1.1019, test_loss: 1.2566, test_f1: 0.4248
 epoch: 37, train_loss: 1.0954, test_loss: 1.2506, test_f1: 0.4371
 epoch: 38, train_loss: 1.1038, test_loss: 1.2521, test_f1: 0.4295
 epoch: 39, train_loss: 1.0902, test_loss: 1.2421, test_f1: 0.4363
 epoch: 40, train_loss: 1.0808, test_loss: 1.2289, test_f1: 0.4328
 epoch: 41, train_loss: 1.0813, test_loss: 1.2366, test_f1: 0.4360
 epoch: 42, train_loss: 1.0738, test_loss: 1.2566, test_f1: 0.4186
 epoch: 43, train_loss: 1.0654, test_loss: 1.2633, test_f1: 0.4271
 epoch: 44, train_loss: 1.0632, test_loss: 1.2538, test_f1: 0.4289
 epoch: 45, train_loss: 1.0532, test_loss: 1.2515, test_f1: 0.4329
 epoch: 46, train_loss: 1.0560, test_loss: 1.2550, test_f1: 0.4438
 epoch: 47, train_loss: 1.0501, test_loss: 1.2567, test_f1: 0.4545
 epoch: 48, train_loss: 1.0516, test_loss: 1.2594, test_f1: 0.4395
 epoch: 49, train_loss: 1.0496, test_loss: 1.2466, test_f1: 0.4441
 epoch: 50, train_loss: 1.0465, test_loss: 1.2492, test_f1: 0.4484
 epoch: 51, train_loss: 1.0377, test_loss: 1.2627, test_f1: 0.4367
 epoch: 52, train_loss: 1.0413, test_loss: 1.2574, test_f1: 0.4342
 epoch: 53, train_loss: 1.0289, test_loss: 1.2643, test_f1: 0.4352
 epoch: 54, train_loss: 1.0321, test_loss: 1.2697, test_f1: 0.4198
 epoch: 55, train_loss: 1.0367, test_loss: 1.2876, test_f1: 0.4314
 epoch: 56, train_loss: 1.0180, test_loss: 1.2786, test_f1: 0.4263
 epoch: 57, train_loss: 1.0174, test_loss: 1.2730, test_f1: 0.4381
 epoch: 58, train_loss: 1.0185, test_loss: 1.2869, test_f1: 0.4408
 epoch: 59, train_loss: 1.0270, test_loss: 1.3022, test_f1: 0.4291
 epoch: 60, train_loss: 1.0118, test_loss: 1.3006, test_f1: 0.4315
 epoch: 61, train_loss: 1.0102, test_loss: 1.2854, test_f1: 0.4319
 epoch: 62, train_loss: 1.0140, test_loss: 1.2784, test_f1: 0.4345
 epoch: 63, train_loss: 1.0082, test_loss: 1.2760, test_f1: 0.4540
 epoch: 64, train_loss: 1.0050, test_loss: 1.2763, test_f1: 0.4327
 epoch: 65, train_loss: 1.0142, test_loss: 1.2807, test_f1: 0.4214
 epoch: 66, train_loss: 0.9991, test_loss: 1.2768, test_f1: 0.4328
 epoch: 67, train_loss: 0.9985, test_loss: 1.2783, test_f1: 0.4303
 epoch: 68, train_loss: 1.0081, test_loss: 1.2730, test_f1: 0.4345
 epoch: 69, train_loss: 0.9987, test_loss: 1.2641, test_f1: 0.4347
 epoch: 70, train_loss: 0.9923, test_loss: 1.2542, test_f1: 0.4380
 epoch: 71, train_loss: 0.9921, test_loss: 1.2610, test_f1: 0.4357
 epoch: 72, train_loss: 0.9978, test_loss: 1.2729, test_f1: 0.4396
 epoch: 73, train_loss: 0.9941, test_loss: 1.2718, test_f1: 0.4464
 epoch: 74, train_loss: 0.9896, test_loss: 1.2600, test_f1: 0.4515
 epoch: 75, train_loss: 0.9927, test_loss: 1.2640, test_f1: 0.4519
 epoch: 76, train_loss: 0.9892, test_loss: 1.2682, test_f1: 0.4651
 epoch: 77, train_loss: 0.9877, test_loss: 1.2902, test_f1: 0.4561
 epoch: 78, train_loss: 0.9831, test_loss: 1.2892, test_f1: 0.4649
 epoch: 79, train_loss: 0.9785, test_loss: 1.3015, test_f1: 0.4453
 epoch: 80, train_loss: 0.9852, test_loss: 1.3069, test_f1: 0.4450
 epoch: 81, train_loss: 0.9804, test_loss: 1.2984, test_f1: 0.4474
 epoch: 82, train_loss: 0.9780, test_loss: 1.2954, test_f1: 0.4347
 epoch: 83, train_loss: 0.9764, test_loss: 1.3030, test_f1: 0.4413
 epoch: 84, train_loss: 0.9650, test_loss: 1.3013, test_f1: 0.4468
 epoch: 85, train_loss: 0.9788, test_loss: 1.3009, test_f1: 0.4482
 epoch: 86, train_loss: 0.9527, test_loss: 1.2995, test_f1: 0.4535
 epoch: 87, train_loss: 0.9701, test_loss: 1.3003, test_f1: 0.4620
 epoch: 88, train_loss: 0.9641, test_loss: 1.3248, test_f1: 0.4675
 epoch: 89, train_loss: 0.9536, test_loss: 1.3721, test_f1: 0.4537
 epoch: 90, train_loss: 0.9611, test_loss: 1.3226, test_f1: 0.4660
 epoch: 91, train_loss: 0.9521, test_loss: 1.3084, test_f1: 0.4655
 epoch: 92, train_loss: 0.9719, test_loss: 1.3219, test_f1: 0.4588
 epoch: 93, train_loss: 0.9624, test_loss: 1.3354, test_f1: 0.4544
 epoch: 94, train_loss: 0.9535, test_loss: 1.3373, test_f1: 0.4540
 epoch: 95, train_loss: 0.9646, test_loss: 1.3405, test_f1: 0.4596
 epoch: 96, train_loss: 0.9674, test_loss: 1.3346, test_f1: 0.4541
 epoch: 97, train_loss: 0.9589, test_loss: 1.3158, test_f1: 0.4575
 epoch: 98, train_loss: 0.9604, test_loss: 1.3015, test_f1: 0.4568
 epoch: 99, train_loss: 0.9564, test_loss: 1.3052, test_f1: 0.4697
##################ITERATION #6 ****************************************
 epoch: 0, train_loss: 1.3046, test_loss: 1.3411, test_f1: 0.2281
 epoch: 1, train_loss: 1.2623, test_loss: 1.3320, test_f1: 0.2281
 epoch: 2, train_loss: 1.2458, test_loss: 1.3241, test_f1: 0.2281
 epoch: 3, train_loss: 1.2526, test_loss: 1.3129, test_f1: 0.2281
 epoch: 4, train_loss: 1.2267, test_loss: 1.3019, test_f1: 0.2281
 epoch: 5, train_loss: 1.2035, test_loss: 1.2886, test_f1: 0.2281
 epoch: 6, train_loss: 1.1973, test_loss: 1.2750, test_f1: 0.2447
 epoch: 7, train_loss: 1.2008, test_loss: 1.2589, test_f1: 0.2829
 epoch: 8, train_loss: 1.1888, test_loss: 1.2470, test_f1: 0.3394
 epoch: 9, train_loss: 1.1883, test_loss: 1.2358, test_f1: 0.3818
 epoch: 10, train_loss: 1.1852, test_loss: 1.2326, test_f1: 0.4054
 epoch: 11, train_loss: 1.1739, test_loss: 1.2313, test_f1: 0.4036
 epoch: 12, train_loss: 1.1600, test_loss: 1.2239, test_f1: 0.4216
 epoch: 13, train_loss: 1.1481, test_loss: 1.2132, test_f1: 0.4217
 epoch: 14, train_loss: 1.1478, test_loss: 1.2062, test_f1: 0.4354
 epoch: 15, train_loss: 1.1504, test_loss: 1.2047, test_f1: 0.4379
 epoch: 16, train_loss: 1.1516, test_loss: 1.2022, test_f1: 0.4516
 epoch: 17, train_loss: 1.1437, test_loss: 1.2003, test_f1: 0.4426
 epoch: 18, train_loss: 1.1342, test_loss: 1.1935, test_f1: 0.4383
 epoch: 19, train_loss: 1.1276, test_loss: 1.1868, test_f1: 0.4423
 epoch: 20, train_loss: 1.1162, test_loss: 1.1821, test_f1: 0.4531
 epoch: 21, train_loss: 1.1187, test_loss: 1.1794, test_f1: 0.4580
 epoch: 22, train_loss: 1.1134, test_loss: 1.1754, test_f1: 0.4661
 epoch: 23, train_loss: 1.1171, test_loss: 1.1803, test_f1: 0.4697
 epoch: 24, train_loss: 1.0975, test_loss: 1.1803, test_f1: 0.4647
 epoch: 25, train_loss: 1.1022, test_loss: 1.1802, test_f1: 0.4686
 epoch: 26, train_loss: 1.0957, test_loss: 1.1736, test_f1: 0.4701
 epoch: 27, train_loss: 1.0999, test_loss: 1.1686, test_f1: 0.4635
 epoch: 28, train_loss: 1.0880, test_loss: 1.1668, test_f1: 0.4724
 epoch: 29, train_loss: 1.0825, test_loss: 1.1810, test_f1: 0.4777
 epoch: 30, train_loss: 1.0835, test_loss: 1.1821, test_f1: 0.4716
 epoch: 31, train_loss: 1.0899, test_loss: 1.1911, test_f1: 0.4635
 epoch: 32, train_loss: 1.0763, test_loss: 1.1749, test_f1: 0.4594
 epoch: 33, train_loss: 1.0721, test_loss: 1.1719, test_f1: 0.4481
 epoch: 34, train_loss: 1.0844, test_loss: 1.1672, test_f1: 0.4679
 epoch: 35, train_loss: 1.0726, test_loss: 1.1737, test_f1: 0.4518
 epoch: 36, train_loss: 1.0869, test_loss: 1.1793, test_f1: 0.4488
 epoch: 37, train_loss: 1.0631, test_loss: 1.1781, test_f1: 0.4523
 epoch: 38, train_loss: 1.0651, test_loss: 1.1952, test_f1: 0.4523
 epoch: 39, train_loss: 1.0647, test_loss: 1.1787, test_f1: 0.4556
 epoch: 40, train_loss: 1.0497, test_loss: 1.1779, test_f1: 0.4703
 epoch: 41, train_loss: 1.0572, test_loss: 1.1970, test_f1: 0.4624
 epoch: 42, train_loss: 1.0645, test_loss: 1.1911, test_f1: 0.4645
 epoch: 43, train_loss: 1.0452, test_loss: 1.1838, test_f1: 0.4437
 epoch: 44, train_loss: 1.0364, test_loss: 1.1842, test_f1: 0.4301
 epoch: 45, train_loss: 1.0437, test_loss: 1.1904, test_f1: 0.4488
 epoch: 46, train_loss: 1.0361, test_loss: 1.1833, test_f1: 0.4460
 epoch: 47, train_loss: 1.0409, test_loss: 1.1808, test_f1: 0.4536
 epoch: 48, train_loss: 1.0288, test_loss: 1.1990, test_f1: 0.4460
 epoch: 49, train_loss: 1.0379, test_loss: 1.1826, test_f1: 0.4716
 epoch: 50, train_loss: 1.0489, test_loss: 1.1848, test_f1: 0.4520
 epoch: 51, train_loss: 1.0173, test_loss: 1.1844, test_f1: 0.4533
 epoch: 52, train_loss: 1.0216, test_loss: 1.1841, test_f1: 0.4520
 epoch: 53, train_loss: 1.0286, test_loss: 1.1874, test_f1: 0.4564
 epoch: 54, train_loss: 1.0250, test_loss: 1.1952, test_f1: 0.4437
 epoch: 55, train_loss: 1.0257, test_loss: 1.2110, test_f1: 0.4533
 epoch: 56, train_loss: 1.0245, test_loss: 1.2658, test_f1: 0.4430
 epoch: 57, train_loss: 1.0326, test_loss: 1.2336, test_f1: 0.4562
 epoch: 58, train_loss: 1.0255, test_loss: 1.1848, test_f1: 0.4672
 epoch: 59, train_loss: 1.0240, test_loss: 1.1833, test_f1: 0.4840
 epoch: 60, train_loss: 1.0190, test_loss: 1.1786, test_f1: 0.4664
 epoch: 61, train_loss: 1.0222, test_loss: 1.1779, test_f1: 0.4644
 epoch: 62, train_loss: 1.0214, test_loss: 1.1849, test_f1: 0.4788
 epoch: 63, train_loss: 1.0094, test_loss: 1.1868, test_f1: 0.4577
 epoch: 64, train_loss: 1.0151, test_loss: 1.1873, test_f1: 0.4472
 epoch: 65, train_loss: 1.0180, test_loss: 1.1857, test_f1: 0.4637
 epoch: 66, train_loss: 1.0172, test_loss: 1.1999, test_f1: 0.4397
 epoch: 67, train_loss: 1.0187, test_loss: 1.2188, test_f1: 0.4377
 epoch: 68, train_loss: 1.0147, test_loss: 1.1742, test_f1: 0.4661
 epoch: 69, train_loss: 1.0144, test_loss: 1.1718, test_f1: 0.4535
 epoch: 70, train_loss: 0.9985, test_loss: 1.1770, test_f1: 0.4598
 epoch: 71, train_loss: 1.0110, test_loss: 1.1729, test_f1: 0.4635
 epoch: 72, train_loss: 1.0118, test_loss: 1.1729, test_f1: 0.4661
 epoch: 73, train_loss: 1.0046, test_loss: 1.1739, test_f1: 0.4641
 epoch: 74, train_loss: 0.9982, test_loss: 1.1741, test_f1: 0.4664
 epoch: 75, train_loss: 1.0009, test_loss: 1.1795, test_f1: 0.4639
 epoch: 76, train_loss: 0.9973, test_loss: 1.1800, test_f1: 0.4621
 epoch: 77, train_loss: 0.9982, test_loss: 1.1834, test_f1: 0.4778
 epoch: 78, train_loss: 0.9971, test_loss: 1.1762, test_f1: 0.4612
 epoch: 79, train_loss: 0.9914, test_loss: 1.1865, test_f1: 0.4617
 epoch: 80, train_loss: 0.9976, test_loss: 1.1944, test_f1: 0.4651
 epoch: 81, train_loss: 1.0069, test_loss: 1.1893, test_f1: 0.4703
 epoch: 82, train_loss: 0.9864, test_loss: 1.1791, test_f1: 0.4761
 epoch: 83, train_loss: 0.9852, test_loss: 1.1806, test_f1: 0.4777
 epoch: 84, train_loss: 0.9828, test_loss: 1.1797, test_f1: 0.4696
 epoch: 85, train_loss: 0.9876, test_loss: 1.1813, test_f1: 0.4693
 epoch: 86, train_loss: 0.9716, test_loss: 1.1852, test_f1: 0.4753
 epoch: 87, train_loss: 0.9870, test_loss: 1.1913, test_f1: 0.4682
 epoch: 88, train_loss: 0.9804, test_loss: 1.1919, test_f1: 0.4605
 epoch: 89, train_loss: 0.9918, test_loss: 1.1873, test_f1: 0.4565
 epoch: 90, train_loss: 0.9830, test_loss: 1.1862, test_f1: 0.4585
 epoch: 91, train_loss: 0.9827, test_loss: 1.1847, test_f1: 0.4616
 epoch: 92, train_loss: 0.9772, test_loss: 1.1858, test_f1: 0.4622
 epoch: 93, train_loss: 0.9882, test_loss: 1.1854, test_f1: 0.4547
 epoch: 94, train_loss: 0.9875, test_loss: 1.1891, test_f1: 0.4690
 epoch: 95, train_loss: 0.9765, test_loss: 1.2016, test_f1: 0.4597
 epoch: 96, train_loss: 0.9641, test_loss: 1.2021, test_f1: 0.4659
 epoch: 97, train_loss: 0.9830, test_loss: 1.1924, test_f1: 0.4725
 epoch: 98, train_loss: 0.9708, test_loss: 1.2016, test_f1: 0.4720
 epoch: 99, train_loss: 0.9820, test_loss: 1.2062, test_f1: 0.4547
##################ITERATION #7 ****************************************
 epoch: 0, train_loss: 1.3846, test_loss: 1.3608, test_f1: 0.2263
 epoch: 1, train_loss: 1.3000, test_loss: 1.3505, test_f1: 0.2285
 epoch: 2, train_loss: 1.2760, test_loss: 1.3376, test_f1: 0.2238
 epoch: 3, train_loss: 1.2630, test_loss: 1.3328, test_f1: 0.2398
 epoch: 4, train_loss: 1.2329, test_loss: 1.3371, test_f1: 0.2404
 epoch: 5, train_loss: 1.2192, test_loss: 1.3513, test_f1: 0.2404
 epoch: 6, train_loss: 1.2172, test_loss: 1.3626, test_f1: 0.2404
 epoch: 7, train_loss: 1.2058, test_loss: 1.3678, test_f1: 0.2606
 epoch: 8, train_loss: 1.1909, test_loss: 1.3743, test_f1: 0.2812
 epoch: 9, train_loss: 1.1846, test_loss: 1.3848, test_f1: 0.2625
 epoch: 10, train_loss: 1.1824, test_loss: 1.3879, test_f1: 0.2763
 epoch: 11, train_loss: 1.1752, test_loss: 1.3528, test_f1: 0.3121
 epoch: 12, train_loss: 1.1613, test_loss: 1.3294, test_f1: 0.3200
 epoch: 13, train_loss: 1.1496, test_loss: 1.3458, test_f1: 0.3156
 epoch: 14, train_loss: 1.1396, test_loss: 1.3789, test_f1: 0.3245
 epoch: 15, train_loss: 1.1442, test_loss: 1.4119, test_f1: 0.3406
 epoch: 16, train_loss: 1.1378, test_loss: 1.3641, test_f1: 0.3463
 epoch: 17, train_loss: 1.1304, test_loss: 1.3623, test_f1: 0.3334
 epoch: 18, train_loss: 1.1074, test_loss: 1.3570, test_f1: 0.3322
 epoch: 19, train_loss: 1.1175, test_loss: 1.3849, test_f1: 0.3388
 epoch: 20, train_loss: 1.1068, test_loss: 1.3793, test_f1: 0.3519
 epoch: 21, train_loss: 1.0996, test_loss: 1.4456, test_f1: 0.3644
 epoch: 22, train_loss: 1.0979, test_loss: 1.4390, test_f1: 0.3495
 epoch: 23, train_loss: 1.0904, test_loss: 1.4719, test_f1: 0.3602
 epoch: 24, train_loss: 1.0793, test_loss: 1.5120, test_f1: 0.3770
 epoch: 25, train_loss: 1.0737, test_loss: 1.5112, test_f1: 0.3665
 epoch: 26, train_loss: 1.0745, test_loss: 1.4438, test_f1: 0.3536
 epoch: 27, train_loss: 1.0754, test_loss: 1.5371, test_f1: 0.3408
 epoch: 28, train_loss: 1.0692, test_loss: 1.5278, test_f1: 0.3500
 epoch: 29, train_loss: 1.0608, test_loss: 1.7007, test_f1: 0.3673
 epoch: 30, train_loss: 1.0541, test_loss: 1.9857, test_f1: 0.3699
 epoch: 31, train_loss: 1.0637, test_loss: 2.1728, test_f1: 0.3547
 epoch: 32, train_loss: 1.0611, test_loss: 2.1455, test_f1: 0.3637
 epoch: 33, train_loss: 1.0373, test_loss: 1.7486, test_f1: 0.3706
 epoch: 34, train_loss: 1.0444, test_loss: 1.5946, test_f1: 0.3713
 epoch: 35, train_loss: 1.0304, test_loss: 1.6295, test_f1: 0.4033
 epoch: 36, train_loss: 1.0271, test_loss: 1.6954, test_f1: 0.3939
 epoch: 37, train_loss: 1.0382, test_loss: 1.8514, test_f1: 0.3726
 epoch: 38, train_loss: 1.0354, test_loss: 1.8980, test_f1: 0.3741
 epoch: 39, train_loss: 1.0225, test_loss: 1.8065, test_f1: 0.3780
 epoch: 40, train_loss: 1.0366, test_loss: 1.7056, test_f1: 0.3686
 epoch: 41, train_loss: 1.0307, test_loss: 1.7448, test_f1: 0.3535
 epoch: 42, train_loss: 1.0313, test_loss: 1.6068, test_f1: 0.3761
 epoch: 43, train_loss: 1.0235, test_loss: 1.4491, test_f1: 0.3578
 epoch: 44, train_loss: 1.0199, test_loss: 1.4961, test_f1: 0.3866
 epoch: 45, train_loss: 1.0235, test_loss: 1.5764, test_f1: 0.3687
 epoch: 46, train_loss: 1.0067, test_loss: 1.7182, test_f1: 0.3594
 epoch: 47, train_loss: 1.0121, test_loss: 1.8091, test_f1: 0.3594
 epoch: 48, train_loss: 0.9971, test_loss: 1.6150, test_f1: 0.3834
 epoch: 49, train_loss: 1.0046, test_loss: 1.5682, test_f1: 0.3760
 epoch: 50, train_loss: 1.0051, test_loss: 1.5475, test_f1: 0.3762
 epoch: 51, train_loss: 0.9880, test_loss: 1.6537, test_f1: 0.3678
 epoch: 52, train_loss: 0.9963, test_loss: 1.6977, test_f1: 0.3727
 epoch: 53, train_loss: 0.9778, test_loss: 1.7911, test_f1: 0.4065
 epoch: 54, train_loss: 0.9892, test_loss: 1.6955, test_f1: 0.4034
 epoch: 55, train_loss: 0.9814, test_loss: 1.5482, test_f1: 0.3796
 epoch: 56, train_loss: 0.9843, test_loss: 1.5066, test_f1: 0.3908
 epoch: 57, train_loss: 0.9777, test_loss: 1.5097, test_f1: 0.4027
 epoch: 58, train_loss: 0.9777, test_loss: 1.5574, test_f1: 0.4182
 epoch: 59, train_loss: 0.9725, test_loss: 1.6752, test_f1: 0.4172
 epoch: 60, train_loss: 0.9741, test_loss: 1.6845, test_f1: 0.4158
 epoch: 61, train_loss: 0.9677, test_loss: 1.5522, test_f1: 0.4155
 epoch: 62, train_loss: 0.9665, test_loss: 1.5725, test_f1: 0.4182
 epoch: 63, train_loss: 0.9724, test_loss: 1.5941, test_f1: 0.4224
 epoch: 64, train_loss: 0.9672, test_loss: 1.5292, test_f1: 0.4424
 epoch: 65, train_loss: 0.9736, test_loss: 1.4915, test_f1: 0.4430
 epoch: 66, train_loss: 0.9737, test_loss: 1.4153, test_f1: 0.4364
 epoch: 67, train_loss: 0.9736, test_loss: 1.5513, test_f1: 0.4411
 epoch: 68, train_loss: 0.9798, test_loss: 1.6924, test_f1: 0.4152
 epoch: 69, train_loss: 0.9700, test_loss: 1.5923, test_f1: 0.4186
 epoch: 70, train_loss: 0.9714, test_loss: 1.4666, test_f1: 0.4034
 epoch: 71, train_loss: 0.9658, test_loss: 1.6386, test_f1: 0.4083
 epoch: 72, train_loss: 0.9675, test_loss: 1.7527, test_f1: 0.4210
 epoch: 73, train_loss: 0.9709, test_loss: 1.8484, test_f1: 0.4232
 epoch: 74, train_loss: 0.9689, test_loss: 1.8487, test_f1: 0.4234
 epoch: 75, train_loss: 0.9546, test_loss: 1.8153, test_f1: 0.4342
 epoch: 76, train_loss: 0.9668, test_loss: 1.7795, test_f1: 0.4291
 epoch: 77, train_loss: 0.9716, test_loss: 1.6839, test_f1: 0.4420
 epoch: 78, train_loss: 0.9701, test_loss: 1.7975, test_f1: 0.4378
 epoch: 79, train_loss: 0.9647, test_loss: 1.9182, test_f1: 0.4314
 epoch: 80, train_loss: 0.9648, test_loss: 1.8730, test_f1: 0.4430
 epoch: 81, train_loss: 0.9638, test_loss: 1.6816, test_f1: 0.4300
 epoch: 82, train_loss: 0.9469, test_loss: 1.5643, test_f1: 0.4348
 epoch: 83, train_loss: 0.9569, test_loss: 1.4966, test_f1: 0.4081
 epoch: 84, train_loss: 0.9511, test_loss: 1.5202, test_f1: 0.4137
 epoch: 85, train_loss: 0.9544, test_loss: 1.5844, test_f1: 0.4446
 epoch: 86, train_loss: 0.9594, test_loss: 1.5402, test_f1: 0.4456
 epoch: 87, train_loss: 0.9529, test_loss: 1.8253, test_f1: 0.4347
 epoch: 88, train_loss: 0.9572, test_loss: 2.0651, test_f1: 0.4378
 epoch: 89, train_loss: 0.9439, test_loss: 2.0518, test_f1: 0.4508
 epoch: 90, train_loss: 0.9527, test_loss: 1.8736, test_f1: 0.4290
 epoch: 91, train_loss: 0.9597, test_loss: 1.4717, test_f1: 0.4364
 epoch: 92, train_loss: 0.9582, test_loss: 1.3993, test_f1: 0.4411
 epoch: 93, train_loss: 0.9510, test_loss: 1.3793, test_f1: 0.4505
 epoch: 94, train_loss: 0.9333, test_loss: 1.3651, test_f1: 0.4367
 epoch: 95, train_loss: 0.9545, test_loss: 1.4021, test_f1: 0.4492
 epoch: 96, train_loss: 0.9432, test_loss: 1.4112, test_f1: 0.4476
 epoch: 97, train_loss: 0.9405, test_loss: 1.4222, test_f1: 0.4506
 epoch: 98, train_loss: 0.9297, test_loss: 1.4844, test_f1: 0.4514
 epoch: 99, train_loss: 0.9384, test_loss: 1.5305, test_f1: 0.4500
##################ITERATION #8 ****************************************
 epoch: 0, train_loss: 1.3398, test_loss: 1.3330, test_f1: 0.2281
 epoch: 1, train_loss: 1.2755, test_loss: 1.3343, test_f1: 0.2281
 epoch: 2, train_loss: 1.2592, test_loss: 1.3276, test_f1: 0.2281
 epoch: 3, train_loss: 1.2221, test_loss: 1.3149, test_f1: 0.2281
 epoch: 4, train_loss: 1.2210, test_loss: 1.2951, test_f1: 0.2336
 epoch: 5, train_loss: 1.2117, test_loss: 1.2805, test_f1: 0.3249
 epoch: 6, train_loss: 1.1934, test_loss: 1.2759, test_f1: 0.3504
 epoch: 7, train_loss: 1.1860, test_loss: 1.2622, test_f1: 0.3465
 epoch: 8, train_loss: 1.1790, test_loss: 1.2649, test_f1: 0.3453
 epoch: 9, train_loss: 1.1823, test_loss: 1.2513, test_f1: 0.3690
 epoch: 10, train_loss: 1.1683, test_loss: 1.2548, test_f1: 0.3936
 epoch: 11, train_loss: 1.1620, test_loss: 1.2385, test_f1: 0.4092
 epoch: 12, train_loss: 1.1552, test_loss: 1.2355, test_f1: 0.4030
 epoch: 13, train_loss: 1.1462, test_loss: 1.2391, test_f1: 0.4090
 epoch: 14, train_loss: 1.1360, test_loss: 1.2324, test_f1: 0.4131
 epoch: 15, train_loss: 1.1300, test_loss: 1.2271, test_f1: 0.4046
 epoch: 16, train_loss: 1.1359, test_loss: 1.2234, test_f1: 0.4012
 epoch: 17, train_loss: 1.1258, test_loss: 1.2151, test_f1: 0.4147
 epoch: 18, train_loss: 1.1166, test_loss: 1.2097, test_f1: 0.4213
 epoch: 19, train_loss: 1.1174, test_loss: 1.2138, test_f1: 0.4039
 epoch: 20, train_loss: 1.1160, test_loss: 1.2077, test_f1: 0.4222
 epoch: 21, train_loss: 1.1036, test_loss: 1.2055, test_f1: 0.4239
 epoch: 22, train_loss: 1.1124, test_loss: 1.2017, test_f1: 0.4172
 epoch: 23, train_loss: 1.1104, test_loss: 1.1999, test_f1: 0.4318
 epoch: 24, train_loss: 1.1015, test_loss: 1.1979, test_f1: 0.4227
 epoch: 25, train_loss: 1.1074, test_loss: 1.2076, test_f1: 0.4359
 epoch: 26, train_loss: 1.1064, test_loss: 1.2119, test_f1: 0.4234
 epoch: 27, train_loss: 1.0926, test_loss: 1.1951, test_f1: 0.4283
 epoch: 28, train_loss: 1.0811, test_loss: 1.1883, test_f1: 0.4383
 epoch: 29, train_loss: 1.0885, test_loss: 1.2081, test_f1: 0.4246
 epoch: 30, train_loss: 1.0895, test_loss: 1.2149, test_f1: 0.4314
 epoch: 31, train_loss: 1.0850, test_loss: 1.2079, test_f1: 0.4481
 epoch: 32, train_loss: 1.0684, test_loss: 1.2022, test_f1: 0.4195
 epoch: 33, train_loss: 1.0915, test_loss: 1.1915, test_f1: 0.4484
 epoch: 34, train_loss: 1.0846, test_loss: 1.1864, test_f1: 0.4511
 epoch: 35, train_loss: 1.0738, test_loss: 1.1932, test_f1: 0.4085
 epoch: 36, train_loss: 1.0740, test_loss: 1.1942, test_f1: 0.4004
 epoch: 37, train_loss: 1.0537, test_loss: 1.1910, test_f1: 0.4448
 epoch: 38, train_loss: 1.0653, test_loss: 1.1887, test_f1: 0.4461
 epoch: 39, train_loss: 1.0477, test_loss: 1.1941, test_f1: 0.4519
 epoch: 40, train_loss: 1.0491, test_loss: 1.1976, test_f1: 0.4379
 epoch: 41, train_loss: 1.0566, test_loss: 1.1946, test_f1: 0.4416
 epoch: 42, train_loss: 1.0544, test_loss: 1.2081, test_f1: 0.4551
 epoch: 43, train_loss: 1.0505, test_loss: 1.2134, test_f1: 0.4431
 epoch: 44, train_loss: 1.0566, test_loss: 1.2109, test_f1: 0.4288
 epoch: 45, train_loss: 1.0499, test_loss: 1.2184, test_f1: 0.4384
 epoch: 46, train_loss: 1.0475, test_loss: 1.2175, test_f1: 0.4604
 epoch: 47, train_loss: 1.0424, test_loss: 1.2235, test_f1: 0.4153
 epoch: 48, train_loss: 1.0445, test_loss: 1.2144, test_f1: 0.4250
 epoch: 49, train_loss: 1.0393, test_loss: 1.1906, test_f1: 0.4390
 epoch: 50, train_loss: 1.0655, test_loss: 1.2035, test_f1: 0.4509
 epoch: 51, train_loss: 1.0239, test_loss: 1.1880, test_f1: 0.4390
 epoch: 52, train_loss: 1.0311, test_loss: 1.1828, test_f1: 0.4454
 epoch: 53, train_loss: 1.0301, test_loss: 1.1916, test_f1: 0.4661
 epoch: 54, train_loss: 1.0335, test_loss: 1.1813, test_f1: 0.4555
 epoch: 55, train_loss: 1.0351, test_loss: 1.1740, test_f1: 0.4506
 epoch: 56, train_loss: 1.0313, test_loss: 1.1747, test_f1: 0.4328
 epoch: 57, train_loss: 1.0283, test_loss: 1.1945, test_f1: 0.4537
 epoch: 58, train_loss: 1.0270, test_loss: 1.1904, test_f1: 0.4378
 epoch: 59, train_loss: 1.0249, test_loss: 1.1894, test_f1: 0.4386
 epoch: 60, train_loss: 1.0168, test_loss: 1.1841, test_f1: 0.4408
 epoch: 61, train_loss: 1.0277, test_loss: 1.1798, test_f1: 0.4461
 epoch: 62, train_loss: 1.0104, test_loss: 1.1917, test_f1: 0.4492
 epoch: 63, train_loss: 1.0213, test_loss: 1.1858, test_f1: 0.4497
 epoch: 64, train_loss: 1.0119, test_loss: 1.1851, test_f1: 0.4381
 epoch: 65, train_loss: 1.0011, test_loss: 1.1818, test_f1: 0.4366
 epoch: 66, train_loss: 1.0159, test_loss: 1.1778, test_f1: 0.4330
 epoch: 67, train_loss: 1.0054, test_loss: 1.1751, test_f1: 0.4405
 epoch: 68, train_loss: 1.0160, test_loss: 1.1748, test_f1: 0.4478
 epoch: 69, train_loss: 1.0027, test_loss: 1.1708, test_f1: 0.4677
 epoch: 70, train_loss: 1.0088, test_loss: 1.1703, test_f1: 0.4491
 epoch: 71, train_loss: 1.0112, test_loss: 1.1733, test_f1: 0.4451
 epoch: 72, train_loss: 1.0076, test_loss: 1.1801, test_f1: 0.4385
 epoch: 73, train_loss: 0.9978, test_loss: 1.1875, test_f1: 0.4432
 epoch: 74, train_loss: 1.0031, test_loss: 1.1862, test_f1: 0.4311
 epoch: 75, train_loss: 1.0128, test_loss: 1.1791, test_f1: 0.4274
 epoch: 76, train_loss: 0.9916, test_loss: 1.1715, test_f1: 0.4333
 epoch: 77, train_loss: 0.9963, test_loss: 1.1706, test_f1: 0.4341
 epoch: 78, train_loss: 0.9942, test_loss: 1.1687, test_f1: 0.4595
 epoch: 79, train_loss: 1.0027, test_loss: 1.1729, test_f1: 0.4505
 epoch: 80, train_loss: 1.0003, test_loss: 1.1793, test_f1: 0.4580
 epoch: 81, train_loss: 0.9919, test_loss: 1.1738, test_f1: 0.4500
 epoch: 82, train_loss: 0.9937, test_loss: 1.1665, test_f1: 0.4592
 epoch: 83, train_loss: 1.0127, test_loss: 1.1714, test_f1: 0.4298
 epoch: 84, train_loss: 0.9987, test_loss: 1.1901, test_f1: 0.4158
 epoch: 85, train_loss: 0.9982, test_loss: 1.1850, test_f1: 0.4336
 epoch: 86, train_loss: 1.0008, test_loss: 1.1879, test_f1: 0.4280
 epoch: 87, train_loss: 0.9852, test_loss: 1.1837, test_f1: 0.4369
 epoch: 88, train_loss: 1.0066, test_loss: 1.1836, test_f1: 0.4351
 epoch: 89, train_loss: 1.0057, test_loss: 1.1883, test_f1: 0.4538
 epoch: 90, train_loss: 0.9903, test_loss: 1.1810, test_f1: 0.4482
 epoch: 91, train_loss: 0.9924, test_loss: 1.1806, test_f1: 0.4486
 epoch: 92, train_loss: 0.9851, test_loss: 1.1755, test_f1: 0.4413
 epoch: 93, train_loss: 0.9834, test_loss: 1.1734, test_f1: 0.4151
 epoch: 94, train_loss: 0.9749, test_loss: 1.1798, test_f1: 0.4517
 epoch: 95, train_loss: 0.9832, test_loss: 1.1755, test_f1: 0.4507
 epoch: 96, train_loss: 0.9659, test_loss: 1.1860, test_f1: 0.4459
 epoch: 97, train_loss: 0.9906, test_loss: 1.1937, test_f1: 0.4644
 epoch: 98, train_loss: 0.9748, test_loss: 1.1905, test_f1: 0.4716
 epoch: 99, train_loss: 0.9777, test_loss: 1.1817, test_f1: 0.4671
##################ITERATION #9 ****************************************
 epoch: 0, train_loss: 1.2963, test_loss: 1.4660, test_f1: 0.2630
 epoch: 1, train_loss: 1.2423, test_loss: 1.4000, test_f1: 0.2379
 epoch: 2, train_loss: 1.2131, test_loss: 1.3672, test_f1: 0.2332
 epoch: 3, train_loss: 1.2098, test_loss: 1.3528, test_f1: 0.2332
 epoch: 4, train_loss: 1.1967, test_loss: 1.3435, test_f1: 0.2627
 epoch: 5, train_loss: 1.1784, test_loss: 1.3250, test_f1: 0.2388
 epoch: 6, train_loss: 1.1633, test_loss: 1.3081, test_f1: 0.2943
 epoch: 7, train_loss: 1.1615, test_loss: 1.2942, test_f1: 0.3352
 epoch: 8, train_loss: 1.1517, test_loss: 1.2760, test_f1: 0.3459
 epoch: 9, train_loss: 1.1524, test_loss: 1.2623, test_f1: 0.3610
 epoch: 10, train_loss: 1.1511, test_loss: 1.2647, test_f1: 0.3576
 epoch: 11, train_loss: 1.1367, test_loss: 1.2524, test_f1: 0.3833
 epoch: 12, train_loss: 1.1397, test_loss: 1.2403, test_f1: 0.4000
 epoch: 13, train_loss: 1.1317, test_loss: 1.2741, test_f1: 0.4000
 epoch: 14, train_loss: 1.1171, test_loss: 1.3124, test_f1: 0.4060
 epoch: 15, train_loss: 1.1223, test_loss: 1.3284, test_f1: 0.3991
 epoch: 16, train_loss: 1.1025, test_loss: 1.3129, test_f1: 0.3964
 epoch: 17, train_loss: 1.1117, test_loss: 1.2955, test_f1: 0.3928
 epoch: 18, train_loss: 1.1063, test_loss: 1.2860, test_f1: 0.3859
 epoch: 19, train_loss: 1.0996, test_loss: 1.3012, test_f1: 0.3896
 epoch: 20, train_loss: 1.1049, test_loss: 1.3747, test_f1: 0.3909
 epoch: 21, train_loss: 1.0694, test_loss: 1.3453, test_f1: 0.3940
 epoch: 22, train_loss: 1.0938, test_loss: 1.3017, test_f1: 0.3985
 epoch: 23, train_loss: 1.0815, test_loss: 1.2769, test_f1: 0.4107
 epoch: 24, train_loss: 1.0752, test_loss: 1.2863, test_f1: 0.4151
 epoch: 25, train_loss: 1.0746, test_loss: 1.2691, test_f1: 0.4145
 epoch: 26, train_loss: 1.0738, test_loss: 1.2554, test_f1: 0.3868
 epoch: 27, train_loss: 1.0641, test_loss: 1.2293, test_f1: 0.3763
 epoch: 28, train_loss: 1.0493, test_loss: 1.2230, test_f1: 0.4012
 epoch: 29, train_loss: 1.0592, test_loss: 1.2265, test_f1: 0.4069
 epoch: 30, train_loss: 1.0520, test_loss: 1.2251, test_f1: 0.3852
 epoch: 31, train_loss: 1.0499, test_loss: 1.2323, test_f1: 0.3830
 epoch: 32, train_loss: 1.0549, test_loss: 1.2559, test_f1: 0.4235
 epoch: 33, train_loss: 1.0433, test_loss: 1.2576, test_f1: 0.4005
 epoch: 34, train_loss: 1.0351, test_loss: 1.2363, test_f1: 0.3834
 epoch: 35, train_loss: 1.0364, test_loss: 1.2428, test_f1: 0.3993
 epoch: 36, train_loss: 1.0268, test_loss: 1.2716, test_f1: 0.4226
 epoch: 37, train_loss: 1.0245, test_loss: 1.2453, test_f1: 0.4344
 epoch: 38, train_loss: 1.0292, test_loss: 1.2322, test_f1: 0.4426
 epoch: 39, train_loss: 1.0092, test_loss: 1.2665, test_f1: 0.4500
 epoch: 40, train_loss: 1.0271, test_loss: 1.2338, test_f1: 0.4664
 epoch: 41, train_loss: 1.0190, test_loss: 1.2158, test_f1: 0.4730
 epoch: 42, train_loss: 1.0156, test_loss: 1.2011, test_f1: 0.4468
 epoch: 43, train_loss: 1.0126, test_loss: 1.2122, test_f1: 0.4631
 epoch: 44, train_loss: 1.0139, test_loss: 1.2189, test_f1: 0.4875
 epoch: 45, train_loss: 1.0213, test_loss: 1.2228, test_f1: 0.4803
 epoch: 46, train_loss: 0.9918, test_loss: 1.2474, test_f1: 0.4714
 epoch: 47, train_loss: 0.9912, test_loss: 1.2865, test_f1: 0.4870
 epoch: 48, train_loss: 0.9845, test_loss: 1.2848, test_f1: 0.4907
 epoch: 49, train_loss: 1.0037, test_loss: 1.2687, test_f1: 0.4849
 epoch: 50, train_loss: 0.9855, test_loss: 1.2339, test_f1: 0.4788
 epoch: 51, train_loss: 0.9745, test_loss: 1.2477, test_f1: 0.4789
 epoch: 52, train_loss: 0.9725, test_loss: 1.2689, test_f1: 0.4754
 epoch: 53, train_loss: 0.9842, test_loss: 1.2792, test_f1: 0.4804
 epoch: 54, train_loss: 0.9860, test_loss: 1.3114, test_f1: 0.4771
 epoch: 55, train_loss: 0.9866, test_loss: 1.3057, test_f1: 0.4772
 epoch: 56, train_loss: 0.9824, test_loss: 1.3080, test_f1: 0.4661
 epoch: 57, train_loss: 0.9822, test_loss: 1.2846, test_f1: 0.4770
 epoch: 58, train_loss: 0.9805, test_loss: 1.2640, test_f1: 0.5035
 epoch: 59, train_loss: 0.9693, test_loss: 1.2594, test_f1: 0.5103
 epoch: 60, train_loss: 0.9732, test_loss: 1.2769, test_f1: 0.4979
 epoch: 61, train_loss: 0.9716, test_loss: 1.2881, test_f1: 0.5031
 epoch: 62, train_loss: 0.9644, test_loss: 1.3130, test_f1: 0.5021
 epoch: 63, train_loss: 0.9744, test_loss: 1.2856, test_f1: 0.4990
 epoch: 64, train_loss: 0.9671, test_loss: 1.2765, test_f1: 0.5012
 epoch: 65, train_loss: 0.9564, test_loss: 1.2736, test_f1: 0.5019
 epoch: 66, train_loss: 0.9595, test_loss: 1.2875, test_f1: 0.4947
 epoch: 67, train_loss: 0.9683, test_loss: 1.3024, test_f1: 0.4920
 epoch: 68, train_loss: 0.9614, test_loss: 1.2963, test_f1: 0.4619
 epoch: 69, train_loss: 0.9731, test_loss: 1.2671, test_f1: 0.4473
 epoch: 70, train_loss: 0.9670, test_loss: 1.3347, test_f1: 0.4478
 epoch: 71, train_loss: 0.9677, test_loss: 1.3420, test_f1: 0.4765
 epoch: 72, train_loss: 0.9598, test_loss: 1.2785, test_f1: 0.4970
 epoch: 73, train_loss: 0.9661, test_loss: 1.2584, test_f1: 0.4902
 epoch: 74, train_loss: 0.9673, test_loss: 1.2605, test_f1: 0.4877
 epoch: 75, train_loss: 0.9690, test_loss: 1.2742, test_f1: 0.4886
 epoch: 76, train_loss: 0.9646, test_loss: 1.3297, test_f1: 0.4689
 epoch: 77, train_loss: 0.9595, test_loss: 1.3059, test_f1: 0.5000
 epoch: 78, train_loss: 0.9493, test_loss: 1.2801, test_f1: 0.5068
 epoch: 79, train_loss: 0.9578, test_loss: 1.2727, test_f1: 0.4708
 epoch: 80, train_loss: 0.9453, test_loss: 1.2684, test_f1: 0.4721
 epoch: 81, train_loss: 0.9440, test_loss: 1.2760, test_f1: 0.5087
 epoch: 82, train_loss: 0.9554, test_loss: 1.2975, test_f1: 0.4974
 epoch: 83, train_loss: 0.9388, test_loss: 1.2981, test_f1: 0.5067
 epoch: 84, train_loss: 0.9488, test_loss: 1.2866, test_f1: 0.5064
 epoch: 85, train_loss: 0.9578, test_loss: 1.3243, test_f1: 0.4809
 epoch: 86, train_loss: 0.9465, test_loss: 1.3360, test_f1: 0.4606
 epoch: 87, train_loss: 0.9352, test_loss: 1.3634, test_f1: 0.4880
 epoch: 88, train_loss: 0.9492, test_loss: 1.3802, test_f1: 0.4792
 epoch: 89, train_loss: 0.9386, test_loss: 1.4245, test_f1: 0.4914
 epoch: 90, train_loss: 0.9289, test_loss: 1.4277, test_f1: 0.4924
 epoch: 91, train_loss: 0.9509, test_loss: 1.3263, test_f1: 0.4946
 epoch: 92, train_loss: 0.9261, test_loss: 1.2821, test_f1: 0.4934
 epoch: 93, train_loss: 0.9332, test_loss: 1.3042, test_f1: 0.4682
 epoch: 94, train_loss: 0.9347, test_loss: 1.3439, test_f1: 0.4814
 epoch: 95, train_loss: 0.9369, test_loss: 1.3586, test_f1: 0.5093
 epoch: 96, train_loss: 0.9387, test_loss: 1.3214, test_f1: 0.5265
 epoch: 97, train_loss: 0.9284, test_loss: 1.2994, test_f1: 0.5276
 epoch: 98, train_loss: 0.9226, test_loss: 1.3064, test_f1: 0.5264
 epoch: 99, train_loss: 0.9326, test_loss: 1.3181, test_f1: 0.4705

Training completed in 293.99 seconds
Best F1: 0.5276 at epoch 97
Mean F1 across iterations: 0.4673  0.0302
========================FINAL RESULTS================================
FEGIN weighted F1: 0.5276  0.0302
python main.py --data ltspice_demos --representation component_component --model FEGIN --layers 4 --hiddens 16 --batch_size 256 --lr 0.001 --emb_size 512 --epochs 100 --save_appendix component_component_L4_H16_BS256_LR0.001_E512 --no_val
-----



STDERR:
  File "main.py", line 370, in <module>
    main()
  File "main.py", line 254, in main
    dataset = dataset_class(
  File "/home/philip/projects/ltspice_examples_code_repo/Circuit-Completion-Using-GNNs/component_classification_with_link_prediction_head/evaluation/FEGIN/kernel/circuit_datasets.py", line 15, in __init__
    self.data, self.slices = torch.load(self.processed_paths[0])
  File "/home/philip/.local/lib/python3.8/site-packages/torch/serialization.py", line 1040, in load
    warnings.warn(
  File "/usr/lib/python3.8/warnings.py", line 109, in _showwarnmsg
    sw(msg.message, msg.category, msg.filename, msg.lineno,
  File "main.py", line 47, in warn_with_traceback
    traceback.print_stack(file=log)
/home/philip/projects/ltspice_examples_code_repo/Circuit-Completion-Using-GNNs/component_classification_with_link_prediction_head/evaluation/FEGIN/kernel/circuit_datasets.py:15: FutureWarning: You are using `torch.load` with `weights_only=False` (the current default value), which uses the default pickle module implicitly. It is possible to construct malicious pickle data which will execute arbitrary code during unpickling (See https://github.com/pytorch/pytorch/blob/main/SECURITY.md#untrusted-models for more details). In a future release, the default value for `weights_only` will be flipped to `True`. This limits the functions that could be executed during unpickling. Arbitrary objects will no longer be allowed to be loaded via this mode unless they are explicitly allowlisted by the user via `torch.serialization.add_safe_globals`. We recommend you start setting `weights_only=True` for any use case where you don't have full control of the loaded file. Please open an issue on GitHub for any issues related to this experimental feature.
  self.data, self.slices = torch.load(self.processed_paths[0])
