STDOUT:
Results will be saved in /home/philip/projects/ltspice_examples_code_repo/Circuit-Completion-Using-GNNs/component_classification_with_link_prediction_head/evaluation/FEGIN/results/model_FEGIN_dataset_ltspice_demos
Command line input: python main.py --data ltspice_demos --representation component_pin_net --model FEGIN --layers 3 --hiddens 128 --batch_size 32 --lr 0.0001 --emb_size 128 --epochs 100 --save_appendix component_pin_net_L3_H128_BS32_LR0.0001_E128 --no_val
 is saved.
-----
ltspice_demos - FEGIN
Using 3 layers, 128 hidden units, h = 2
Loading component_pin_net representation dataset
ENTERED
Training FEGIN on component_pin_net representation
Train: 1565, Test: 383
##################ITERATION #0 ****************************************
 epoch: 0, train_loss: 1.3644, test_loss: 1.3551, test_f1: 0.1425
 epoch: 1, train_loss: 1.2738, test_loss: 1.2657, test_f1: 0.3438
 epoch: 2, train_loss: 1.1896, test_loss: 1.2238, test_f1: 0.3511
 epoch: 3, train_loss: 1.1458, test_loss: 1.2054, test_f1: 0.4327
 epoch: 4, train_loss: 1.1235, test_loss: 1.1971, test_f1: 0.4327
 epoch: 5, train_loss: 1.1058, test_loss: 1.1907, test_f1: 0.4433
 epoch: 6, train_loss: 1.0869, test_loss: 1.1761, test_f1: 0.4446
 epoch: 7, train_loss: 1.0643, test_loss: 1.1682, test_f1: 0.4457
 epoch: 8, train_loss: 1.0497, test_loss: 1.1489, test_f1: 0.4468
 epoch: 9, train_loss: 1.0277, test_loss: 1.1308, test_f1: 0.4603
 epoch: 10, train_loss: 0.9994, test_loss: 1.1147, test_f1: 0.4645
 epoch: 11, train_loss: 0.9878, test_loss: 1.0987, test_f1: 0.4791
 epoch: 12, train_loss: 0.9719, test_loss: 1.0905, test_f1: 0.4869
 epoch: 13, train_loss: 0.9520, test_loss: 1.0926, test_f1: 0.4976
 epoch: 14, train_loss: 0.9441, test_loss: 1.0834, test_f1: 0.5103
 epoch: 15, train_loss: 0.9345, test_loss: 1.0657, test_f1: 0.5210
 epoch: 16, train_loss: 0.9342, test_loss: 1.0619, test_f1: 0.5465
 epoch: 17, train_loss: 0.9238, test_loss: 1.0437, test_f1: 0.5365
 epoch: 18, train_loss: 0.9072, test_loss: 1.0500, test_f1: 0.5456
 epoch: 19, train_loss: 0.8943, test_loss: 1.0568, test_f1: 0.5387
 epoch: 20, train_loss: 0.8916, test_loss: 1.0624, test_f1: 0.5340
 epoch: 21, train_loss: 0.8779, test_loss: 1.0566, test_f1: 0.5161
 epoch: 22, train_loss: 0.8789, test_loss: 1.0440, test_f1: 0.5289
 epoch: 23, train_loss: 0.8508, test_loss: 1.0102, test_f1: 0.5470
 epoch: 24, train_loss: 0.8391, test_loss: 1.0072, test_f1: 0.5109
 epoch: 25, train_loss: 0.8311, test_loss: 1.0511, test_f1: 0.5489
 epoch: 26, train_loss: 0.8270, test_loss: 1.0265, test_f1: 0.5551
 epoch: 27, train_loss: 0.8063, test_loss: 1.0214, test_f1: 0.5400
 epoch: 28, train_loss: 0.8084, test_loss: 1.0267, test_f1: 0.5620
 epoch: 29, train_loss: 0.7813, test_loss: 1.0243, test_f1: 0.5518
 epoch: 30, train_loss: 0.7728, test_loss: 1.0264, test_f1: 0.5478
 epoch: 31, train_loss: 0.7544, test_loss: 0.9893, test_f1: 0.5826
 epoch: 32, train_loss: 0.7474, test_loss: 1.0469, test_f1: 0.5767
 epoch: 33, train_loss: 0.7332, test_loss: 0.9787, test_f1: 0.5818
 epoch: 34, train_loss: 0.7197, test_loss: 1.0607, test_f1: 0.5740
 epoch: 35, train_loss: 0.7124, test_loss: 0.9998, test_f1: 0.5861
 epoch: 36, train_loss: 0.6964, test_loss: 1.0363, test_f1: 0.5914
 epoch: 37, train_loss: 0.6730, test_loss: 1.0249, test_f1: 0.6127
 epoch: 38, train_loss: 0.6651, test_loss: 1.0395, test_f1: 0.6012
 epoch: 39, train_loss: 0.6614, test_loss: 1.0590, test_f1: 0.5897
 epoch: 40, train_loss: 0.6502, test_loss: 1.0037, test_f1: 0.5830
 epoch: 41, train_loss: 0.6605, test_loss: 1.0825, test_f1: 0.6269
 epoch: 42, train_loss: 0.6173, test_loss: 1.0476, test_f1: 0.6042
 epoch: 43, train_loss: 0.6257, test_loss: 1.0488, test_f1: 0.6287
 epoch: 44, train_loss: 0.6162, test_loss: 1.0922, test_f1: 0.6198
 epoch: 45, train_loss: 0.6090, test_loss: 1.0723, test_f1: 0.6347
 epoch: 46, train_loss: 0.5864, test_loss: 1.0956, test_f1: 0.6058
 epoch: 47, train_loss: 0.5907, test_loss: 1.1341, test_f1: 0.6116
 epoch: 48, train_loss: 0.5687, test_loss: 1.0859, test_f1: 0.6221
 epoch: 49, train_loss: 0.5825, test_loss: 1.1035, test_f1: 0.6133
 epoch: 50, train_loss: 0.5621, test_loss: 1.1281, test_f1: 0.6113
 epoch: 51, train_loss: 0.5391, test_loss: 1.0891, test_f1: 0.6291
 epoch: 52, train_loss: 0.5210, test_loss: 1.1049, test_f1: 0.6465
 epoch: 53, train_loss: 0.5321, test_loss: 1.0669, test_f1: 0.6527
 epoch: 54, train_loss: 0.5157, test_loss: 1.1185, test_f1: 0.6313
 epoch: 55, train_loss: 0.4990, test_loss: 1.1133, test_f1: 0.6288
 epoch: 56, train_loss: 0.5163, test_loss: 1.1137, test_f1: 0.6350
 epoch: 57, train_loss: 0.5003, test_loss: 1.1230, test_f1: 0.6469
 epoch: 58, train_loss: 0.4846, test_loss: 1.1318, test_f1: 0.6376
 epoch: 59, train_loss: 0.4901, test_loss: 1.1517, test_f1: 0.6297
 epoch: 60, train_loss: 0.4814, test_loss: 1.1591, test_f1: 0.6331
 epoch: 61, train_loss: 0.4812, test_loss: 1.1745, test_f1: 0.6341
 epoch: 62, train_loss: 0.4817, test_loss: 1.1638, test_f1: 0.6352
 epoch: 63, train_loss: 0.4707, test_loss: 1.1731, test_f1: 0.6247
 epoch: 64, train_loss: 0.4654, test_loss: 1.2361, test_f1: 0.6362
 epoch: 65, train_loss: 0.4626, test_loss: 1.1700, test_f1: 0.6417
 epoch: 66, train_loss: 0.4631, test_loss: 1.1751, test_f1: 0.6510
 epoch: 67, train_loss: 0.4628, test_loss: 1.1991, test_f1: 0.6391
 epoch: 68, train_loss: 0.4524, test_loss: 1.2164, test_f1: 0.6446
 epoch: 69, train_loss: 0.4570, test_loss: 1.2517, test_f1: 0.6305
 epoch: 70, train_loss: 0.4546, test_loss: 1.2260, test_f1: 0.6300
 epoch: 71, train_loss: 0.4419, test_loss: 1.1974, test_f1: 0.6380
 epoch: 72, train_loss: 0.4348, test_loss: 1.2361, test_f1: 0.6418
 epoch: 73, train_loss: 0.4326, test_loss: 1.2464, test_f1: 0.6368
 epoch: 74, train_loss: 0.4302, test_loss: 1.2709, test_f1: 0.6285
 epoch: 75, train_loss: 0.4167, test_loss: 1.2156, test_f1: 0.6521
 epoch: 76, train_loss: 0.4334, test_loss: 1.2535, test_f1: 0.6397
 epoch: 77, train_loss: 0.4402, test_loss: 1.3639, test_f1: 0.6173
 epoch: 78, train_loss: 0.4104, test_loss: 1.2808, test_f1: 0.6425
 epoch: 79, train_loss: 0.4021, test_loss: 1.3560, test_f1: 0.6170
 epoch: 80, train_loss: 0.3989, test_loss: 1.3052, test_f1: 0.6365
 epoch: 81, train_loss: 0.4025, test_loss: 1.3161, test_f1: 0.6499
 epoch: 82, train_loss: 0.4064, test_loss: 1.3670, test_f1: 0.6301
 epoch: 83, train_loss: 0.3872, test_loss: 1.3421, test_f1: 0.6313
 epoch: 84, train_loss: 0.3850, test_loss: 1.3525, test_f1: 0.6275
 epoch: 85, train_loss: 0.3926, test_loss: 1.3762, test_f1: 0.6105
 epoch: 86, train_loss: 0.3810, test_loss: 1.3740, test_f1: 0.5875
 epoch: 87, train_loss: 0.3904, test_loss: 1.3644, test_f1: 0.6407
 epoch: 88, train_loss: 0.3813, test_loss: 1.3949, test_f1: 0.6294
 epoch: 89, train_loss: 0.3689, test_loss: 1.4103, test_f1: 0.6142
 epoch: 90, train_loss: 0.3689, test_loss: 1.4323, test_f1: 0.6280
 epoch: 91, train_loss: 0.3562, test_loss: 1.4945, test_f1: 0.6238
 epoch: 92, train_loss: 0.3529, test_loss: 1.3803, test_f1: 0.6349
 epoch: 93, train_loss: 0.3397, test_loss: 1.4405, test_f1: 0.6009
 epoch: 94, train_loss: 0.3566, test_loss: 1.4737, test_f1: 0.6133
 epoch: 95, train_loss: 0.3414, test_loss: 1.4515, test_f1: 0.6378
 epoch: 96, train_loss: 0.3617, test_loss: 1.5016, test_f1: 0.6162
 epoch: 97, train_loss: 0.3465, test_loss: 1.5899, test_f1: 0.5882
 epoch: 98, train_loss: 0.3480, test_loss: 1.5322, test_f1: 0.5934
 epoch: 99, train_loss: 0.3202, test_loss: 1.5388, test_f1: 0.6204
##################ITERATION #1 ****************************************
 epoch: 0, train_loss: 1.2470, test_loss: 1.2720, test_f1: 0.2996
 epoch: 1, train_loss: 1.1185, test_loss: 1.1560, test_f1: 0.4495
 epoch: 2, train_loss: 1.0599, test_loss: 1.1067, test_f1: 0.4780
 epoch: 3, train_loss: 1.0241, test_loss: 1.0838, test_f1: 0.4986
 epoch: 4, train_loss: 0.9980, test_loss: 1.0641, test_f1: 0.5240
 epoch: 5, train_loss: 0.9799, test_loss: 1.0471, test_f1: 0.5319
 epoch: 6, train_loss: 0.9554, test_loss: 1.0402, test_f1: 0.5297
 epoch: 7, train_loss: 0.9425, test_loss: 1.0289, test_f1: 0.5542
 epoch: 8, train_loss: 0.9305, test_loss: 1.0228, test_f1: 0.5365
 epoch: 9, train_loss: 0.9219, test_loss: 1.0132, test_f1: 0.5630
 epoch: 10, train_loss: 0.9038, test_loss: 1.0007, test_f1: 0.5570
 epoch: 11, train_loss: 0.8980, test_loss: 1.0015, test_f1: 0.5545
 epoch: 12, train_loss: 0.8836, test_loss: 0.9982, test_f1: 0.5489
 epoch: 13, train_loss: 0.8575, test_loss: 1.0032, test_f1: 0.5722
 epoch: 14, train_loss: 0.8487, test_loss: 0.9999, test_f1: 0.5732
 epoch: 15, train_loss: 0.8293, test_loss: 1.0084, test_f1: 0.5730
 epoch: 16, train_loss: 0.8319, test_loss: 0.9903, test_f1: 0.5607
 epoch: 17, train_loss: 0.8171, test_loss: 0.9777, test_f1: 0.5755
 epoch: 18, train_loss: 0.8032, test_loss: 1.0058, test_f1: 0.5709
 epoch: 19, train_loss: 0.7820, test_loss: 0.9821, test_f1: 0.5832
 epoch: 20, train_loss: 0.7691, test_loss: 0.9809, test_f1: 0.6022
 epoch: 21, train_loss: 0.7832, test_loss: 0.9730, test_f1: 0.6161
 epoch: 22, train_loss: 0.7481, test_loss: 0.9931, test_f1: 0.6153
 epoch: 23, train_loss: 0.7446, test_loss: 0.9851, test_f1: 0.6346
 epoch: 24, train_loss: 0.7259, test_loss: 0.9882, test_f1: 0.6050
 epoch: 25, train_loss: 0.7143, test_loss: 0.9891, test_f1: 0.6220
 epoch: 26, train_loss: 0.7022, test_loss: 0.9844, test_f1: 0.6300
 epoch: 27, train_loss: 0.6975, test_loss: 1.0066, test_f1: 0.6119
 epoch: 28, train_loss: 0.6865, test_loss: 1.0185, test_f1: 0.6295
 epoch: 29, train_loss: 0.6854, test_loss: 1.0651, test_f1: 0.5909
 epoch: 30, train_loss: 0.6719, test_loss: 1.0097, test_f1: 0.6134
 epoch: 31, train_loss: 0.6521, test_loss: 1.0033, test_f1: 0.6270
 epoch: 32, train_loss: 0.6600, test_loss: 0.9871, test_f1: 0.6412
 epoch: 33, train_loss: 0.6526, test_loss: 1.0458, test_f1: 0.6437
 epoch: 34, train_loss: 0.6232, test_loss: 1.0476, test_f1: 0.6293
 epoch: 35, train_loss: 0.6281, test_loss: 1.0587, test_f1: 0.6216
 epoch: 36, train_loss: 0.6155, test_loss: 1.0198, test_f1: 0.6249
 epoch: 37, train_loss: 0.6175, test_loss: 1.0695, test_f1: 0.6222
 epoch: 38, train_loss: 0.5908, test_loss: 1.0554, test_f1: 0.6153
 epoch: 39, train_loss: 0.5950, test_loss: 1.0613, test_f1: 0.6423
 epoch: 40, train_loss: 0.5829, test_loss: 1.0806, test_f1: 0.6448
 epoch: 41, train_loss: 0.5748, test_loss: 1.1256, test_f1: 0.6305
 epoch: 42, train_loss: 0.5894, test_loss: 1.0675, test_f1: 0.6240
 epoch: 43, train_loss: 0.5541, test_loss: 1.0601, test_f1: 0.6323
 epoch: 44, train_loss: 0.5580, test_loss: 1.0741, test_f1: 0.6593
 epoch: 45, train_loss: 0.5591, test_loss: 1.1340, test_f1: 0.6397
 epoch: 46, train_loss: 0.5653, test_loss: 1.0790, test_f1: 0.6340
 epoch: 47, train_loss: 0.5391, test_loss: 1.0903, test_f1: 0.6594
 epoch: 48, train_loss: 0.5344, test_loss: 1.0805, test_f1: 0.6553
 epoch: 49, train_loss: 0.5126, test_loss: 1.1109, test_f1: 0.6540
 epoch: 50, train_loss: 0.5196, test_loss: 1.1154, test_f1: 0.6669
 epoch: 51, train_loss: 0.4823, test_loss: 1.1002, test_f1: 0.6537
 epoch: 52, train_loss: 0.4767, test_loss: 1.1018, test_f1: 0.6624
 epoch: 53, train_loss: 0.4773, test_loss: 1.1223, test_f1: 0.6399
 epoch: 54, train_loss: 0.4731, test_loss: 1.1325, test_f1: 0.6527
 epoch: 55, train_loss: 0.4642, test_loss: 1.1385, test_f1: 0.6640
 epoch: 56, train_loss: 0.4574, test_loss: 1.1409, test_f1: 0.6526
 epoch: 57, train_loss: 0.4687, test_loss: 1.1510, test_f1: 0.6343
 epoch: 58, train_loss: 0.4545, test_loss: 1.1860, test_f1: 0.6352
 epoch: 59, train_loss: 0.4610, test_loss: 1.1703, test_f1: 0.6679
 epoch: 60, train_loss: 0.4549, test_loss: 1.1586, test_f1: 0.6404
 epoch: 61, train_loss: 0.4440, test_loss: 1.1619, test_f1: 0.6496
 epoch: 62, train_loss: 0.4401, test_loss: 1.1716, test_f1: 0.6570
 epoch: 63, train_loss: 0.4246, test_loss: 1.2014, test_f1: 0.6475
 epoch: 64, train_loss: 0.4264, test_loss: 1.1882, test_f1: 0.6395
 epoch: 65, train_loss: 0.4199, test_loss: 1.2207, test_f1: 0.6539
 epoch: 66, train_loss: 0.4206, test_loss: 1.1886, test_f1: 0.6462
 epoch: 67, train_loss: 0.4257, test_loss: 1.1847, test_f1: 0.6768
 epoch: 68, train_loss: 0.4243, test_loss: 1.1928, test_f1: 0.6359
 epoch: 69, train_loss: 0.4145, test_loss: 1.2028, test_f1: 0.6744
 epoch: 70, train_loss: 0.3911, test_loss: 1.2247, test_f1: 0.6512
 epoch: 71, train_loss: 0.4078, test_loss: 1.2399, test_f1: 0.6443
 epoch: 72, train_loss: 0.4125, test_loss: 1.2205, test_f1: 0.6715
 epoch: 73, train_loss: 0.3857, test_loss: 1.2292, test_f1: 0.6470
 epoch: 74, train_loss: 0.3909, test_loss: 1.2373, test_f1: 0.6530
 epoch: 75, train_loss: 0.3956, test_loss: 1.2235, test_f1: 0.6331
 epoch: 76, train_loss: 0.4113, test_loss: 1.2625, test_f1: 0.6499
 epoch: 77, train_loss: 0.3701, test_loss: 1.2962, test_f1: 0.6649
 epoch: 78, train_loss: 0.3842, test_loss: 1.2793, test_f1: 0.6752
 epoch: 79, train_loss: 0.3882, test_loss: 1.3297, test_f1: 0.6319
 epoch: 80, train_loss: 0.3856, test_loss: 1.2526, test_f1: 0.6591
 epoch: 81, train_loss: 0.3629, test_loss: 1.2607, test_f1: 0.6594
 epoch: 82, train_loss: 0.3628, test_loss: 1.2943, test_f1: 0.6250
 epoch: 83, train_loss: 0.3837, test_loss: 1.2799, test_f1: 0.6516
 epoch: 84, train_loss: 0.3707, test_loss: 1.3051, test_f1: 0.6448
 epoch: 85, train_loss: 0.3632, test_loss: 1.3276, test_f1: 0.6510
 epoch: 86, train_loss: 0.3446, test_loss: 1.3078, test_f1: 0.6474
 epoch: 87, train_loss: 0.3448, test_loss: 1.3727, test_f1: 0.6353
 epoch: 88, train_loss: 0.3425, test_loss: 1.3717, test_f1: 0.6504
 epoch: 89, train_loss: 0.3290, test_loss: 1.3544, test_f1: 0.6673
 epoch: 90, train_loss: 0.3480, test_loss: 1.3312, test_f1: 0.6790
 epoch: 91, train_loss: 0.3357, test_loss: 1.4054, test_f1: 0.6347
 epoch: 92, train_loss: 0.3429, test_loss: 1.3515, test_f1: 0.6384
 epoch: 93, train_loss: 0.3267, test_loss: 1.4099, test_f1: 0.6201
 epoch: 94, train_loss: 0.3441, test_loss: 1.4195, test_f1: 0.6510
 epoch: 95, train_loss: 0.3330, test_loss: 1.3857, test_f1: 0.6669
 epoch: 96, train_loss: 0.3062, test_loss: 1.4064, test_f1: 0.6351
 epoch: 97, train_loss: 0.3149, test_loss: 1.4295, test_f1: 0.6457
 epoch: 98, train_loss: 0.3259, test_loss: 1.4166, test_f1: 0.6607
 epoch: 99, train_loss: 0.2953, test_loss: 1.3740, test_f1: 0.6461
##################ITERATION #2 ****************************************
 epoch: 0, train_loss: 1.1814, test_loss: 1.2698, test_f1: 0.3395
 epoch: 1, train_loss: 1.0505, test_loss: 1.0931, test_f1: 0.4969
 epoch: 2, train_loss: 1.0183, test_loss: 1.0664, test_f1: 0.5070
 epoch: 3, train_loss: 0.9940, test_loss: 1.0506, test_f1: 0.5159
 epoch: 4, train_loss: 0.9724, test_loss: 1.0304, test_f1: 0.5440
 epoch: 5, train_loss: 0.9513, test_loss: 1.0331, test_f1: 0.5300
 epoch: 6, train_loss: 0.9264, test_loss: 1.0252, test_f1: 0.5199
 epoch: 7, train_loss: 0.9204, test_loss: 1.0211, test_f1: 0.5174
 epoch: 8, train_loss: 0.8988, test_loss: 1.0232, test_f1: 0.5310
 epoch: 9, train_loss: 0.9072, test_loss: 1.0111, test_f1: 0.5475
 epoch: 10, train_loss: 0.8792, test_loss: 1.0023, test_f1: 0.5490
 epoch: 11, train_loss: 0.8570, test_loss: 1.0057, test_f1: 0.5385
 epoch: 12, train_loss: 0.8529, test_loss: 0.9983, test_f1: 0.5576
 epoch: 13, train_loss: 0.8486, test_loss: 0.9889, test_f1: 0.5516
 epoch: 14, train_loss: 0.8282, test_loss: 1.0092, test_f1: 0.5761
 epoch: 15, train_loss: 0.8242, test_loss: 0.9853, test_f1: 0.5740
 epoch: 16, train_loss: 0.8005, test_loss: 0.9779, test_f1: 0.5846
 epoch: 17, train_loss: 0.7931, test_loss: 1.0246, test_f1: 0.5670
 epoch: 18, train_loss: 0.7847, test_loss: 0.9886, test_f1: 0.5876
 epoch: 19, train_loss: 0.7681, test_loss: 1.0133, test_f1: 0.5735
 epoch: 20, train_loss: 0.7537, test_loss: 1.0284, test_f1: 0.5845
 epoch: 21, train_loss: 0.7493, test_loss: 1.0021, test_f1: 0.6097
 epoch: 22, train_loss: 0.7361, test_loss: 0.9998, test_f1: 0.5759
 epoch: 23, train_loss: 0.7274, test_loss: 1.0032, test_f1: 0.5983
 epoch: 24, train_loss: 0.7128, test_loss: 1.0665, test_f1: 0.5683
 epoch: 25, train_loss: 0.6912, test_loss: 1.0461, test_f1: 0.5878
 epoch: 26, train_loss: 0.6893, test_loss: 1.0940, test_f1: 0.5604
 epoch: 27, train_loss: 0.6729, test_loss: 1.0287, test_f1: 0.6124
 epoch: 28, train_loss: 0.6764, test_loss: 1.0331, test_f1: 0.6122
 epoch: 29, train_loss: 0.6768, test_loss: 1.0491, test_f1: 0.6018
 epoch: 30, train_loss: 0.6569, test_loss: 1.0356, test_f1: 0.6037
 epoch: 31, train_loss: 0.6320, test_loss: 1.0448, test_f1: 0.6140
 epoch: 32, train_loss: 0.6077, test_loss: 1.0711, test_f1: 0.6013
 epoch: 33, train_loss: 0.6265, test_loss: 1.0338, test_f1: 0.6120
 epoch: 34, train_loss: 0.6061, test_loss: 1.0786, test_f1: 0.6073
 epoch: 35, train_loss: 0.6066, test_loss: 1.0806, test_f1: 0.6146
 epoch: 36, train_loss: 0.6126, test_loss: 1.0750, test_f1: 0.6260
 epoch: 37, train_loss: 0.5902, test_loss: 1.0755, test_f1: 0.6370
 epoch: 38, train_loss: 0.5721, test_loss: 1.1257, test_f1: 0.6213
 epoch: 39, train_loss: 0.5516, test_loss: 1.1740, test_f1: 0.6130
 epoch: 40, train_loss: 0.5679, test_loss: 1.1741, test_f1: 0.5930
 epoch: 41, train_loss: 0.5522, test_loss: 1.1964, test_f1: 0.5898
 epoch: 42, train_loss: 0.5493, test_loss: 1.1690, test_f1: 0.6140
 epoch: 43, train_loss: 0.5218, test_loss: 1.1439, test_f1: 0.6163
 epoch: 44, train_loss: 0.5284, test_loss: 1.1924, test_f1: 0.6118
 epoch: 45, train_loss: 0.5037, test_loss: 1.1596, test_f1: 0.6399
 epoch: 46, train_loss: 0.5115, test_loss: 1.2248, test_f1: 0.6147
 epoch: 47, train_loss: 0.5123, test_loss: 1.1589, test_f1: 0.6352
 epoch: 48, train_loss: 0.4723, test_loss: 1.2103, test_f1: 0.6152
 epoch: 49, train_loss: 0.4867, test_loss: 1.1857, test_f1: 0.6151
 epoch: 50, train_loss: 0.4733, test_loss: 1.2606, test_f1: 0.6111
 epoch: 51, train_loss: 0.4627, test_loss: 1.2556, test_f1: 0.6076
 epoch: 52, train_loss: 0.4554, test_loss: 1.2579, test_f1: 0.6155
 epoch: 53, train_loss: 0.4485, test_loss: 1.2173, test_f1: 0.6274
 epoch: 54, train_loss: 0.4317, test_loss: 1.2846, test_f1: 0.6359
 epoch: 55, train_loss: 0.4252, test_loss: 1.3198, test_f1: 0.6150
 epoch: 56, train_loss: 0.4351, test_loss: 1.2651, test_f1: 0.6350
 epoch: 57, train_loss: 0.4330, test_loss: 1.3132, test_f1: 0.6052
 epoch: 58, train_loss: 0.4225, test_loss: 1.2592, test_f1: 0.6215
 epoch: 59, train_loss: 0.4264, test_loss: 1.3433, test_f1: 0.6139
 epoch: 60, train_loss: 0.4044, test_loss: 1.3295, test_f1: 0.6147
 epoch: 61, train_loss: 0.4127, test_loss: 1.3331, test_f1: 0.6172
 epoch: 62, train_loss: 0.3982, test_loss: 1.3799, test_f1: 0.6138
 epoch: 63, train_loss: 0.4058, test_loss: 1.3990, test_f1: 0.6041
 epoch: 64, train_loss: 0.4026, test_loss: 1.4123, test_f1: 0.6066
 epoch: 65, train_loss: 0.4214, test_loss: 1.3539, test_f1: 0.6041
 epoch: 66, train_loss: 0.3953, test_loss: 1.4195, test_f1: 0.6030
 epoch: 67, train_loss: 0.3842, test_loss: 1.4058, test_f1: 0.6163
 epoch: 68, train_loss: 0.3752, test_loss: 1.3815, test_f1: 0.6113
 epoch: 69, train_loss: 0.3817, test_loss: 1.4260, test_f1: 0.6072
 epoch: 70, train_loss: 0.3744, test_loss: 1.4272, test_f1: 0.6290
 epoch: 71, train_loss: 0.3804, test_loss: 1.4422, test_f1: 0.5978
 epoch: 72, train_loss: 0.3772, test_loss: 1.4490, test_f1: 0.5941
 epoch: 73, train_loss: 0.3686, test_loss: 1.4415, test_f1: 0.6074
 epoch: 74, train_loss: 0.3535, test_loss: 1.4941, test_f1: 0.6217
 epoch: 75, train_loss: 0.3613, test_loss: 1.5262, test_f1: 0.6054
 epoch: 76, train_loss: 0.3473, test_loss: 1.5191, test_f1: 0.5952
 epoch: 77, train_loss: 0.3592, test_loss: 1.5560, test_f1: 0.6217
 epoch: 78, train_loss: 0.3376, test_loss: 1.5255, test_f1: 0.5969
 epoch: 79, train_loss: 0.3557, test_loss: 1.5380, test_f1: 0.6002
 epoch: 80, train_loss: 0.3250, test_loss: 1.5667, test_f1: 0.6133
 epoch: 81, train_loss: 0.3136, test_loss: 1.6491, test_f1: 0.5910
 epoch: 82, train_loss: 0.3358, test_loss: 1.6100, test_f1: 0.6110
 epoch: 83, train_loss: 0.3328, test_loss: 1.6502, test_f1: 0.6129
 epoch: 84, train_loss: 0.3306, test_loss: 1.6211, test_f1: 0.5925
 epoch: 85, train_loss: 0.3374, test_loss: 1.6022, test_f1: 0.5945
 epoch: 86, train_loss: 0.3238, test_loss: 1.5740, test_f1: 0.6023
 epoch: 87, train_loss: 0.3213, test_loss: 1.6628, test_f1: 0.5809
 epoch: 88, train_loss: 0.3024, test_loss: 1.6452, test_f1: 0.5915
 epoch: 89, train_loss: 0.3226, test_loss: 1.7324, test_f1: 0.5664
 epoch: 90, train_loss: 0.3258, test_loss: 1.6787, test_f1: 0.5980
 epoch: 91, train_loss: 0.3202, test_loss: 1.6287, test_f1: 0.6041
 epoch: 92, train_loss: 0.3338, test_loss: 1.7266, test_f1: 0.5918
 epoch: 93, train_loss: 0.2861, test_loss: 1.7624, test_f1: 0.5933
 epoch: 94, train_loss: 0.2727, test_loss: 1.7528, test_f1: 0.5938
 epoch: 95, train_loss: 0.3035, test_loss: 1.7528, test_f1: 0.5991
 epoch: 96, train_loss: 0.3117, test_loss: 1.7252, test_f1: 0.6101
 epoch: 97, train_loss: 0.2956, test_loss: 1.7061, test_f1: 0.5998
 epoch: 98, train_loss: 0.2798, test_loss: 1.7805, test_f1: 0.5947
 epoch: 99, train_loss: 0.2828, test_loss: 1.7473, test_f1: 0.6040
##################ITERATION #3 ****************************************
 epoch: 0, train_loss: 1.1718, test_loss: 1.2236, test_f1: 0.2831
 epoch: 1, train_loss: 1.0501, test_loss: 1.0800, test_f1: 0.4938
 epoch: 2, train_loss: 0.9962, test_loss: 1.0637, test_f1: 0.4957
 epoch: 3, train_loss: 0.9619, test_loss: 1.0450, test_f1: 0.5390
 epoch: 4, train_loss: 0.9494, test_loss: 1.0334, test_f1: 0.5385
 epoch: 5, train_loss: 0.9307, test_loss: 1.0190, test_f1: 0.5559
 epoch: 6, train_loss: 0.9111, test_loss: 1.0144, test_f1: 0.5413
 epoch: 7, train_loss: 0.8969, test_loss: 1.0102, test_f1: 0.5604
 epoch: 8, train_loss: 0.8701, test_loss: 1.0115, test_f1: 0.5518
 epoch: 9, train_loss: 0.8548, test_loss: 1.0039, test_f1: 0.5641
 epoch: 10, train_loss: 0.8564, test_loss: 1.0065, test_f1: 0.5343
 epoch: 11, train_loss: 0.8341, test_loss: 0.9903, test_f1: 0.5698
 epoch: 12, train_loss: 0.8363, test_loss: 0.9895, test_f1: 0.5646
 epoch: 13, train_loss: 0.7964, test_loss: 1.0040, test_f1: 0.5726
 epoch: 14, train_loss: 0.7912, test_loss: 0.9895, test_f1: 0.5712
 epoch: 15, train_loss: 0.7729, test_loss: 0.9808, test_f1: 0.5953
 epoch: 16, train_loss: 0.7556, test_loss: 0.9999, test_f1: 0.5982
 epoch: 17, train_loss: 0.7352, test_loss: 1.0089, test_f1: 0.6102
 epoch: 18, train_loss: 0.7233, test_loss: 0.9831, test_f1: 0.5817
 epoch: 19, train_loss: 0.7239, test_loss: 0.9860, test_f1: 0.6015
 epoch: 20, train_loss: 0.6918, test_loss: 1.0369, test_f1: 0.5990
 epoch: 21, train_loss: 0.6906, test_loss: 1.0213, test_f1: 0.6032
 epoch: 22, train_loss: 0.6757, test_loss: 1.0155, test_f1: 0.6181
 epoch: 23, train_loss: 0.6621, test_loss: 0.9969, test_f1: 0.6041
 epoch: 24, train_loss: 0.6534, test_loss: 1.0052, test_f1: 0.6085
 epoch: 25, train_loss: 0.6527, test_loss: 1.0471, test_f1: 0.5768
 epoch: 26, train_loss: 0.6336, test_loss: 1.0048, test_f1: 0.6017
 epoch: 27, train_loss: 0.6309, test_loss: 1.0210, test_f1: 0.6224
 epoch: 28, train_loss: 0.6151, test_loss: 1.0011, test_f1: 0.6359
 epoch: 29, train_loss: 0.5876, test_loss: 1.0644, test_f1: 0.6329
 epoch: 30, train_loss: 0.5793, test_loss: 1.0828, test_f1: 0.6212
 epoch: 31, train_loss: 0.5811, test_loss: 1.0406, test_f1: 0.6168
 epoch: 32, train_loss: 0.5621, test_loss: 1.0374, test_f1: 0.6096
 epoch: 33, train_loss: 0.5647, test_loss: 1.0820, test_f1: 0.6065
 epoch: 34, train_loss: 0.5685, test_loss: 1.0737, test_f1: 0.6338
 epoch: 35, train_loss: 0.5620, test_loss: 1.0905, test_f1: 0.6104
 epoch: 36, train_loss: 0.5418, test_loss: 1.1043, test_f1: 0.6195
 epoch: 37, train_loss: 0.5327, test_loss: 1.2087, test_f1: 0.6058
 epoch: 38, train_loss: 0.5222, test_loss: 1.0866, test_f1: 0.6505
 epoch: 39, train_loss: 0.5198, test_loss: 1.1246, test_f1: 0.6348
 epoch: 40, train_loss: 0.5132, test_loss: 1.1493, test_f1: 0.6341
 epoch: 41, train_loss: 0.5071, test_loss: 1.1241, test_f1: 0.6306
 epoch: 42, train_loss: 0.4873, test_loss: 1.1913, test_f1: 0.6133
 epoch: 43, train_loss: 0.4689, test_loss: 1.1656, test_f1: 0.6348
 epoch: 44, train_loss: 0.4612, test_loss: 1.2020, test_f1: 0.6372
 epoch: 45, train_loss: 0.4554, test_loss: 1.1533, test_f1: 0.6321
 epoch: 46, train_loss: 0.4722, test_loss: 1.1814, test_f1: 0.6213
 epoch: 47, train_loss: 0.4510, test_loss: 1.1796, test_f1: 0.6320
 epoch: 48, train_loss: 0.4618, test_loss: 1.2244, test_f1: 0.6484
 epoch: 49, train_loss: 0.4558, test_loss: 1.2324, test_f1: 0.6166
 epoch: 50, train_loss: 0.4390, test_loss: 1.2607, test_f1: 0.6205
 epoch: 51, train_loss: 0.4078, test_loss: 1.2486, test_f1: 0.6402
 epoch: 52, train_loss: 0.4191, test_loss: 1.2219, test_f1: 0.6421
 epoch: 53, train_loss: 0.3977, test_loss: 1.2602, test_f1: 0.6402
 epoch: 54, train_loss: 0.4149, test_loss: 1.2471, test_f1: 0.6519
 epoch: 55, train_loss: 0.4002, test_loss: 1.2857, test_f1: 0.6520
 epoch: 56, train_loss: 0.3968, test_loss: 1.2274, test_f1: 0.6575
 epoch: 57, train_loss: 0.3950, test_loss: 1.2893, test_f1: 0.6549
 epoch: 58, train_loss: 0.3915, test_loss: 1.2719, test_f1: 0.6624
 epoch: 59, train_loss: 0.3859, test_loss: 1.3045, test_f1: 0.6418
 epoch: 60, train_loss: 0.3674, test_loss: 1.2962, test_f1: 0.6611
 epoch: 61, train_loss: 0.3957, test_loss: 1.3044, test_f1: 0.6406
 epoch: 62, train_loss: 0.3832, test_loss: 1.3112, test_f1: 0.6621
 epoch: 63, train_loss: 0.3688, test_loss: 1.3298, test_f1: 0.6611
 epoch: 64, train_loss: 0.3400, test_loss: 1.3271, test_f1: 0.6744
 epoch: 65, train_loss: 0.3409, test_loss: 1.3357, test_f1: 0.6462
 epoch: 66, train_loss: 0.3521, test_loss: 1.3933, test_f1: 0.6459
 epoch: 67, train_loss: 0.3646, test_loss: 1.3929, test_f1: 0.6358
 epoch: 68, train_loss: 0.3664, test_loss: 1.3146, test_f1: 0.6416
 epoch: 69, train_loss: 0.3649, test_loss: 1.3344, test_f1: 0.6560
 epoch: 70, train_loss: 0.3425, test_loss: 1.3821, test_f1: 0.6419
 epoch: 71, train_loss: 0.3279, test_loss: 1.3452, test_f1: 0.6389
 epoch: 72, train_loss: 0.3331, test_loss: 1.3885, test_f1: 0.6469
 epoch: 73, train_loss: 0.3383, test_loss: 1.4080, test_f1: 0.6633
 epoch: 74, train_loss: 0.3318, test_loss: 1.4189, test_f1: 0.6456
 epoch: 75, train_loss: 0.3093, test_loss: 1.4517, test_f1: 0.6385
 epoch: 76, train_loss: 0.3211, test_loss: 1.4925, test_f1: 0.6528
 epoch: 77, train_loss: 0.3278, test_loss: 1.4375, test_f1: 0.6203
 epoch: 78, train_loss: 0.3043, test_loss: 1.4444, test_f1: 0.6321
 epoch: 79, train_loss: 0.3444, test_loss: 1.4486, test_f1: 0.6468
 epoch: 80, train_loss: 0.2922, test_loss: 1.4408, test_f1: 0.6283
 epoch: 81, train_loss: 0.3027, test_loss: 1.5216, test_f1: 0.6778
 epoch: 82, train_loss: 0.3199, test_loss: 1.4687, test_f1: 0.6409
 epoch: 83, train_loss: 0.3028, test_loss: 1.5639, test_f1: 0.6444
 epoch: 84, train_loss: 0.3058, test_loss: 1.4970, test_f1: 0.6450
 epoch: 85, train_loss: 0.3159, test_loss: 1.5085, test_f1: 0.6445
 epoch: 86, train_loss: 0.2818, test_loss: 1.5534, test_f1: 0.6289
 epoch: 87, train_loss: 0.2823, test_loss: 1.5606, test_f1: 0.6398
 epoch: 88, train_loss: 0.2716, test_loss: 1.4906, test_f1: 0.6604
 epoch: 89, train_loss: 0.2771, test_loss: 1.6022, test_f1: 0.6482
 epoch: 90, train_loss: 0.2809, test_loss: 1.5427, test_f1: 0.6601
 epoch: 91, train_loss: 0.2942, test_loss: 1.5667, test_f1: 0.6761
 epoch: 92, train_loss: 0.2890, test_loss: 1.5434, test_f1: 0.6570
 epoch: 93, train_loss: 0.2875, test_loss: 1.5419, test_f1: 0.6651
 epoch: 94, train_loss: 0.2722, test_loss: 1.6384, test_f1: 0.6647
 epoch: 95, train_loss: 0.2869, test_loss: 1.5878, test_f1: 0.6211
 epoch: 96, train_loss: 0.2726, test_loss: 1.6874, test_f1: 0.6397
 epoch: 97, train_loss: 0.2682, test_loss: 1.6426, test_f1: 0.6288
 epoch: 98, train_loss: 0.2765, test_loss: 1.6931, test_f1: 0.6445
 epoch: 99, train_loss: 0.2425, test_loss: 1.6904, test_f1: 0.6425
##################ITERATION #4 ****************************************
 epoch: 0, train_loss: 1.1413, test_loss: 1.1886, test_f1: 0.2545
 epoch: 1, train_loss: 1.0094, test_loss: 1.0528, test_f1: 0.4924
 epoch: 2, train_loss: 0.9795, test_loss: 1.0367, test_f1: 0.5062
 epoch: 3, train_loss: 0.9478, test_loss: 1.0272, test_f1: 0.5047
 epoch: 4, train_loss: 0.9423, test_loss: 1.0282, test_f1: 0.4983
 epoch: 5, train_loss: 0.9026, test_loss: 1.0139, test_f1: 0.5211
 epoch: 6, train_loss: 0.8850, test_loss: 1.0068, test_f1: 0.5338
 epoch: 7, train_loss: 0.8740, test_loss: 1.0112, test_f1: 0.5088
 epoch: 8, train_loss: 0.8502, test_loss: 1.0015, test_f1: 0.5575
 epoch: 9, train_loss: 0.8375, test_loss: 0.9954, test_f1: 0.5286
 epoch: 10, train_loss: 0.8174, test_loss: 0.9872, test_f1: 0.5651
 epoch: 11, train_loss: 0.7982, test_loss: 0.9677, test_f1: 0.5764
 epoch: 12, train_loss: 0.7916, test_loss: 0.9821, test_f1: 0.5541
 epoch: 13, train_loss: 0.7799, test_loss: 0.9913, test_f1: 0.5554
 epoch: 14, train_loss: 0.7517, test_loss: 0.9912, test_f1: 0.5752
 epoch: 15, train_loss: 0.7453, test_loss: 0.9823, test_f1: 0.5562
 epoch: 16, train_loss: 0.7216, test_loss: 0.9968, test_f1: 0.5425
 epoch: 17, train_loss: 0.7131, test_loss: 0.9786, test_f1: 0.5970
 epoch: 18, train_loss: 0.7034, test_loss: 1.0025, test_f1: 0.5527
 epoch: 19, train_loss: 0.6856, test_loss: 1.0021, test_f1: 0.5975
 epoch: 20, train_loss: 0.6816, test_loss: 0.9981, test_f1: 0.5882
 epoch: 21, train_loss: 0.6674, test_loss: 1.0060, test_f1: 0.5919
 epoch: 22, train_loss: 0.6554, test_loss: 1.0159, test_f1: 0.5935
 epoch: 23, train_loss: 0.6483, test_loss: 1.0042, test_f1: 0.5844
 epoch: 24, train_loss: 0.6302, test_loss: 1.0412, test_f1: 0.6044
 epoch: 25, train_loss: 0.6080, test_loss: 1.0325, test_f1: 0.6177
 epoch: 26, train_loss: 0.6143, test_loss: 1.0294, test_f1: 0.6219
 epoch: 27, train_loss: 0.6074, test_loss: 1.0398, test_f1: 0.6081
 epoch: 28, train_loss: 0.5939, test_loss: 1.0573, test_f1: 0.5692
 epoch: 29, train_loss: 0.5969, test_loss: 1.0706, test_f1: 0.6336
 epoch: 30, train_loss: 0.5696, test_loss: 1.0583, test_f1: 0.6138
 epoch: 31, train_loss: 0.5679, test_loss: 1.0732, test_f1: 0.6294
 epoch: 32, train_loss: 0.5553, test_loss: 1.1183, test_f1: 0.6270
 epoch: 33, train_loss: 0.5354, test_loss: 1.0952, test_f1: 0.6321
 epoch: 34, train_loss: 0.5423, test_loss: 1.1162, test_f1: 0.6025
 epoch: 35, train_loss: 0.5431, test_loss: 1.0873, test_f1: 0.6171
 epoch: 36, train_loss: 0.5216, test_loss: 1.1277, test_f1: 0.5901
 epoch: 37, train_loss: 0.5311, test_loss: 1.1159, test_f1: 0.6138
 epoch: 38, train_loss: 0.4833, test_loss: 1.1067, test_f1: 0.6409
 epoch: 39, train_loss: 0.4874, test_loss: 1.2324, test_f1: 0.5635
 epoch: 40, train_loss: 0.4880, test_loss: 1.1738, test_f1: 0.6204
 epoch: 41, train_loss: 0.4925, test_loss: 1.1804, test_f1: 0.6328
 epoch: 42, train_loss: 0.4733, test_loss: 1.1571, test_f1: 0.6358
 epoch: 43, train_loss: 0.4728, test_loss: 1.1747, test_f1: 0.6462
 epoch: 44, train_loss: 0.4796, test_loss: 1.1962, test_f1: 0.6250
 epoch: 45, train_loss: 0.4607, test_loss: 1.2284, test_f1: 0.6139
 epoch: 46, train_loss: 0.4648, test_loss: 1.1595, test_f1: 0.6112
 epoch: 47, train_loss: 0.4473, test_loss: 1.2038, test_f1: 0.6214
 epoch: 48, train_loss: 0.4434, test_loss: 1.2742, test_f1: 0.5993
 epoch: 49, train_loss: 0.4329, test_loss: 1.2448, test_f1: 0.6527
 epoch: 50, train_loss: 0.4384, test_loss: 1.2350, test_f1: 0.6093
 epoch: 51, train_loss: 0.4082, test_loss: 1.2089, test_f1: 0.6147
 epoch: 52, train_loss: 0.4113, test_loss: 1.2671, test_f1: 0.6238
 epoch: 53, train_loss: 0.3888, test_loss: 1.2099, test_f1: 0.6238
 epoch: 54, train_loss: 0.3873, test_loss: 1.2735, test_f1: 0.6282
 epoch: 55, train_loss: 0.3924, test_loss: 1.2191, test_f1: 0.6315
 epoch: 56, train_loss: 0.3854, test_loss: 1.3029, test_f1: 0.6205
 epoch: 57, train_loss: 0.3757, test_loss: 1.2765, test_f1: 0.6209
 epoch: 58, train_loss: 0.3570, test_loss: 1.2862, test_f1: 0.6188
 epoch: 59, train_loss: 0.3674, test_loss: 1.3689, test_f1: 0.6076
 epoch: 60, train_loss: 0.3583, test_loss: 1.3212, test_f1: 0.6379
 epoch: 61, train_loss: 0.3555, test_loss: 1.3415, test_f1: 0.6021
 epoch: 62, train_loss: 0.3616, test_loss: 1.4062, test_f1: 0.6055
 epoch: 63, train_loss: 0.3547, test_loss: 1.3185, test_f1: 0.6220
 epoch: 64, train_loss: 0.3561, test_loss: 1.3689, test_f1: 0.6122
 epoch: 65, train_loss: 0.3552, test_loss: 1.3695, test_f1: 0.6134
 epoch: 66, train_loss: 0.3545, test_loss: 1.3665, test_f1: 0.6187
 epoch: 67, train_loss: 0.3426, test_loss: 1.3587, test_f1: 0.6187
 epoch: 68, train_loss: 0.3464, test_loss: 1.3991, test_f1: 0.6150
 epoch: 69, train_loss: 0.3239, test_loss: 1.3925, test_f1: 0.6124
 epoch: 70, train_loss: 0.3325, test_loss: 1.4229, test_f1: 0.6279
 epoch: 71, train_loss: 0.3338, test_loss: 1.4862, test_f1: 0.6208
 epoch: 72, train_loss: 0.3155, test_loss: 1.4331, test_f1: 0.6275
 epoch: 73, train_loss: 0.3352, test_loss: 1.4305, test_f1: 0.6190
 epoch: 74, train_loss: 0.3301, test_loss: 1.4692, test_f1: 0.6290
 epoch: 75, train_loss: 0.3233, test_loss: 1.4387, test_f1: 0.6310
 epoch: 76, train_loss: 0.3033, test_loss: 1.4605, test_f1: 0.6310
 epoch: 77, train_loss: 0.3263, test_loss: 1.4691, test_f1: 0.6289
 epoch: 78, train_loss: 0.3143, test_loss: 1.4923, test_f1: 0.6288
 epoch: 79, train_loss: 0.3286, test_loss: 1.5287, test_f1: 0.6371
 epoch: 80, train_loss: 0.3136, test_loss: 1.5000, test_f1: 0.6282
 epoch: 81, train_loss: 0.3084, test_loss: 1.5096, test_f1: 0.6378
 epoch: 82, train_loss: 0.2925, test_loss: 1.5309, test_f1: 0.6263
 epoch: 83, train_loss: 0.2982, test_loss: 1.6090, test_f1: 0.6095
 epoch: 84, train_loss: 0.2780, test_loss: 1.5577, test_f1: 0.6174
 epoch: 85, train_loss: 0.2937, test_loss: 1.5912, test_f1: 0.6230
 epoch: 86, train_loss: 0.2904, test_loss: 1.5983, test_f1: 0.6085
 epoch: 87, train_loss: 0.2650, test_loss: 1.6047, test_f1: 0.6334
 epoch: 88, train_loss: 0.2786, test_loss: 1.6029, test_f1: 0.6338
 epoch: 89, train_loss: 0.2500, test_loss: 1.6332, test_f1: 0.6291
 epoch: 90, train_loss: 0.2699, test_loss: 1.6414, test_f1: 0.6134
 epoch: 91, train_loss: 0.2743, test_loss: 1.5865, test_f1: 0.6324
 epoch: 92, train_loss: 0.2955, test_loss: 1.6720, test_f1: 0.6363
 epoch: 93, train_loss: 0.2913, test_loss: 1.6453, test_f1: 0.6134
 epoch: 94, train_loss: 0.2793, test_loss: 1.6516, test_f1: 0.6136
 epoch: 95, train_loss: 0.2697, test_loss: 1.6312, test_f1: 0.6198
 epoch: 96, train_loss: 0.2848, test_loss: 1.6996, test_f1: 0.6273
 epoch: 97, train_loss: 0.2581, test_loss: 1.6788, test_f1: 0.6261
 epoch: 98, train_loss: 0.2565, test_loss: 1.6517, test_f1: 0.6206
 epoch: 99, train_loss: 0.2564, test_loss: 1.6604, test_f1: 0.6126
##################ITERATION #5 ****************************************
 epoch: 0, train_loss: 1.1719, test_loss: 1.3116, test_f1: 0.2289
 epoch: 1, train_loss: 1.0140, test_loss: 1.0608, test_f1: 0.5646
 epoch: 2, train_loss: 0.9746, test_loss: 1.0373, test_f1: 0.5534
 epoch: 3, train_loss: 0.9448, test_loss: 1.0277, test_f1: 0.5861
 epoch: 4, train_loss: 0.9169, test_loss: 1.0101, test_f1: 0.5599
 epoch: 5, train_loss: 0.9182, test_loss: 1.0106, test_f1: 0.5762
 epoch: 6, train_loss: 0.8772, test_loss: 1.0004, test_f1: 0.5322
 epoch: 7, train_loss: 0.8672, test_loss: 1.0014, test_f1: 0.5436
 epoch: 8, train_loss: 0.8589, test_loss: 0.9973, test_f1: 0.5825
 epoch: 9, train_loss: 0.8370, test_loss: 0.9829, test_f1: 0.5844
 epoch: 10, train_loss: 0.8203, test_loss: 1.0003, test_f1: 0.5676
 epoch: 11, train_loss: 0.8059, test_loss: 1.0047, test_f1: 0.6033
 epoch: 12, train_loss: 0.7825, test_loss: 1.0151, test_f1: 0.5759
 epoch: 13, train_loss: 0.7771, test_loss: 0.9973, test_f1: 0.6134
 epoch: 14, train_loss: 0.7553, test_loss: 1.0061, test_f1: 0.5889
 epoch: 15, train_loss: 0.7584, test_loss: 1.0209, test_f1: 0.5886
 epoch: 16, train_loss: 0.7135, test_loss: 1.0215, test_f1: 0.5759
 epoch: 17, train_loss: 0.7277, test_loss: 1.0375, test_f1: 0.5957
 epoch: 18, train_loss: 0.7202, test_loss: 1.0403, test_f1: 0.6122
 epoch: 19, train_loss: 0.7088, test_loss: 1.0540, test_f1: 0.5922
 epoch: 20, train_loss: 0.6918, test_loss: 1.0540, test_f1: 0.6038
 epoch: 21, train_loss: 0.6928, test_loss: 1.1125, test_f1: 0.5897
 epoch: 22, train_loss: 0.6883, test_loss: 1.0644, test_f1: 0.5826
 epoch: 23, train_loss: 0.6599, test_loss: 1.0659, test_f1: 0.5804
 epoch: 24, train_loss: 0.6378, test_loss: 1.0630, test_f1: 0.6129
 epoch: 25, train_loss: 0.6333, test_loss: 1.0846, test_f1: 0.5825
 epoch: 26, train_loss: 0.6325, test_loss: 1.0648, test_f1: 0.6158
 epoch: 27, train_loss: 0.6241, test_loss: 1.1226, test_f1: 0.5954
 epoch: 28, train_loss: 0.6152, test_loss: 1.1523, test_f1: 0.5729
 epoch: 29, train_loss: 0.5958, test_loss: 1.1665, test_f1: 0.5812
 epoch: 30, train_loss: 0.5759, test_loss: 1.1576, test_f1: 0.5824
 epoch: 31, train_loss: 0.5917, test_loss: 1.1845, test_f1: 0.5811
 epoch: 32, train_loss: 0.5767, test_loss: 1.1993, test_f1: 0.5777
 epoch: 33, train_loss: 0.5694, test_loss: 1.2472, test_f1: 0.5824
 epoch: 34, train_loss: 0.5560, test_loss: 1.2245, test_f1: 0.5942
 epoch: 35, train_loss: 0.5508, test_loss: 1.2719, test_f1: 0.5919
 epoch: 36, train_loss: 0.5308, test_loss: 1.2535, test_f1: 0.5941
 epoch: 37, train_loss: 0.5274, test_loss: 1.2722, test_f1: 0.5783
 epoch: 38, train_loss: 0.5044, test_loss: 1.2488, test_f1: 0.6201
 epoch: 39, train_loss: 0.5142, test_loss: 1.2850, test_f1: 0.5862
 epoch: 40, train_loss: 0.5019, test_loss: 1.2684, test_f1: 0.5905
 epoch: 41, train_loss: 0.4918, test_loss: 1.3420, test_f1: 0.5953
 epoch: 42, train_loss: 0.4764, test_loss: 1.2488, test_f1: 0.5944
 epoch: 43, train_loss: 0.4844, test_loss: 1.3160, test_f1: 0.5982
 epoch: 44, train_loss: 0.4857, test_loss: 1.3411, test_f1: 0.5984
 epoch: 45, train_loss: 0.4661, test_loss: 1.4712, test_f1: 0.5797
 epoch: 46, train_loss: 0.4677, test_loss: 1.4074, test_f1: 0.6145
 epoch: 47, train_loss: 0.4571, test_loss: 1.4731, test_f1: 0.6148
 epoch: 48, train_loss: 0.4488, test_loss: 1.4204, test_f1: 0.6201
 epoch: 49, train_loss: 0.4438, test_loss: 1.4665, test_f1: 0.5855
 epoch: 50, train_loss: 0.4341, test_loss: 1.4554, test_f1: 0.6111
 epoch: 51, train_loss: 0.4006, test_loss: 1.4131, test_f1: 0.6046
 epoch: 52, train_loss: 0.3900, test_loss: 1.4350, test_f1: 0.6226
 epoch: 53, train_loss: 0.3868, test_loss: 1.4501, test_f1: 0.6056
 epoch: 54, train_loss: 0.3853, test_loss: 1.4724, test_f1: 0.6180
 epoch: 55, train_loss: 0.3848, test_loss: 1.4844, test_f1: 0.6209
 epoch: 56, train_loss: 0.3789, test_loss: 1.5109, test_f1: 0.5952
 epoch: 57, train_loss: 0.3702, test_loss: 1.5135, test_f1: 0.5978
 epoch: 58, train_loss: 0.3675, test_loss: 1.5302, test_f1: 0.6037
 epoch: 59, train_loss: 0.3620, test_loss: 1.5235, test_f1: 0.6144
 epoch: 60, train_loss: 0.3571, test_loss: 1.5266, test_f1: 0.6259
 epoch: 61, train_loss: 0.3637, test_loss: 1.5182, test_f1: 0.5847
 epoch: 62, train_loss: 0.3456, test_loss: 1.5439, test_f1: 0.6251
 epoch: 63, train_loss: 0.3501, test_loss: 1.5528, test_f1: 0.6002
 epoch: 64, train_loss: 0.3518, test_loss: 1.5277, test_f1: 0.5839
 epoch: 65, train_loss: 0.3503, test_loss: 1.5970, test_f1: 0.6224
 epoch: 66, train_loss: 0.3447, test_loss: 1.5432, test_f1: 0.5984
 epoch: 67, train_loss: 0.3487, test_loss: 1.6291, test_f1: 0.5973
 epoch: 68, train_loss: 0.3231, test_loss: 1.6436, test_f1: 0.6052
 epoch: 69, train_loss: 0.3408, test_loss: 1.6321, test_f1: 0.5907
 epoch: 70, train_loss: 0.3332, test_loss: 1.6342, test_f1: 0.5904
 epoch: 71, train_loss: 0.3276, test_loss: 1.6885, test_f1: 0.5569
 epoch: 72, train_loss: 0.3271, test_loss: 1.6222, test_f1: 0.5832
 epoch: 73, train_loss: 0.2967, test_loss: 1.6699, test_f1: 0.5855
 epoch: 74, train_loss: 0.3027, test_loss: 1.6686, test_f1: 0.5758
 epoch: 75, train_loss: 0.3187, test_loss: 1.7307, test_f1: 0.5754
 epoch: 76, train_loss: 0.3127, test_loss: 1.7034, test_f1: 0.6245
 epoch: 77, train_loss: 0.2998, test_loss: 1.6895, test_f1: 0.5854
 epoch: 78, train_loss: 0.3038, test_loss: 1.7583, test_f1: 0.5942
 epoch: 79, train_loss: 0.2853, test_loss: 1.7538, test_f1: 0.5479
 epoch: 80, train_loss: 0.2780, test_loss: 1.6946, test_f1: 0.6101
 epoch: 81, train_loss: 0.2867, test_loss: 1.7894, test_f1: 0.6054
 epoch: 82, train_loss: 0.2865, test_loss: 1.7562, test_f1: 0.6291
 epoch: 83, train_loss: 0.2876, test_loss: 1.8230, test_f1: 0.5725
 epoch: 84, train_loss: 0.2720, test_loss: 1.8056, test_f1: 0.5953
 epoch: 85, train_loss: 0.2625, test_loss: 1.8217, test_f1: 0.6129
 epoch: 86, train_loss: 0.2767, test_loss: 1.8121, test_f1: 0.6032
 epoch: 87, train_loss: 0.2506, test_loss: 1.8249, test_f1: 0.5884
 epoch: 88, train_loss: 0.2648, test_loss: 1.8935, test_f1: 0.5527
 epoch: 89, train_loss: 0.2693, test_loss: 1.7699, test_f1: 0.5906
 epoch: 90, train_loss: 0.2721, test_loss: 1.8121, test_f1: 0.6157
 epoch: 91, train_loss: 0.2530, test_loss: 1.8849, test_f1: 0.5905
 epoch: 92, train_loss: 0.2431, test_loss: 1.9378, test_f1: 0.5428
 epoch: 93, train_loss: 0.2445, test_loss: 1.9371, test_f1: 0.6082
 epoch: 94, train_loss: 0.2637, test_loss: 1.8854, test_f1: 0.5654
 epoch: 95, train_loss: 0.2539, test_loss: 1.9530, test_f1: 0.5454
 epoch: 96, train_loss: 0.2545, test_loss: 1.9948, test_f1: 0.5810
 epoch: 97, train_loss: 0.2553, test_loss: 2.0464, test_f1: 0.5580
 epoch: 98, train_loss: 0.2412, test_loss: 1.8718, test_f1: 0.5912
 epoch: 99, train_loss: 0.2472, test_loss: 1.9269, test_f1: 0.6224
##################ITERATION #6 ****************************************
 epoch: 0, train_loss: 1.1683, test_loss: 1.2622, test_f1: 0.3090
 epoch: 1, train_loss: 1.0428, test_loss: 1.0777, test_f1: 0.4674
 epoch: 2, train_loss: 0.9882, test_loss: 1.0711, test_f1: 0.4851
 epoch: 3, train_loss: 0.9585, test_loss: 1.0598, test_f1: 0.5192
 epoch: 4, train_loss: 0.9222, test_loss: 1.0432, test_f1: 0.5298
 epoch: 5, train_loss: 0.9131, test_loss: 1.0310, test_f1: 0.5254
 epoch: 6, train_loss: 0.8896, test_loss: 1.0248, test_f1: 0.5181
 epoch: 7, train_loss: 0.8819, test_loss: 1.0258, test_f1: 0.5195
 epoch: 8, train_loss: 0.8613, test_loss: 1.0002, test_f1: 0.5835
 epoch: 9, train_loss: 0.8409, test_loss: 1.0038, test_f1: 0.5590
 epoch: 10, train_loss: 0.8256, test_loss: 0.9963, test_f1: 0.5990
 epoch: 11, train_loss: 0.8009, test_loss: 1.0053, test_f1: 0.5633
 epoch: 12, train_loss: 0.7933, test_loss: 1.0051, test_f1: 0.5618
 epoch: 13, train_loss: 0.7709, test_loss: 0.9712, test_f1: 0.5904
 epoch: 14, train_loss: 0.7568, test_loss: 0.9958, test_f1: 0.5730
 epoch: 15, train_loss: 0.7557, test_loss: 0.9941, test_f1: 0.5806
 epoch: 16, train_loss: 0.7469, test_loss: 1.0199, test_f1: 0.5810
 epoch: 17, train_loss: 0.7439, test_loss: 1.0174, test_f1: 0.5853
 epoch: 18, train_loss: 0.7182, test_loss: 1.0327, test_f1: 0.5956
 epoch: 19, train_loss: 0.7043, test_loss: 0.9886, test_f1: 0.6211
 epoch: 20, train_loss: 0.6901, test_loss: 1.0212, test_f1: 0.6078
 epoch: 21, train_loss: 0.6781, test_loss: 1.0344, test_f1: 0.6014
 epoch: 22, train_loss: 0.6790, test_loss: 1.0162, test_f1: 0.6123
 epoch: 23, train_loss: 0.6645, test_loss: 1.0076, test_f1: 0.6374
 epoch: 24, train_loss: 0.6441, test_loss: 1.0513, test_f1: 0.6021
 epoch: 25, train_loss: 0.6330, test_loss: 1.0260, test_f1: 0.6055
 epoch: 26, train_loss: 0.6409, test_loss: 1.0496, test_f1: 0.6127
 epoch: 27, train_loss: 0.6108, test_loss: 1.0374, test_f1: 0.6182
 epoch: 28, train_loss: 0.6058, test_loss: 1.0556, test_f1: 0.6161
 epoch: 29, train_loss: 0.6172, test_loss: 1.0321, test_f1: 0.6381
 epoch: 30, train_loss: 0.5973, test_loss: 1.0362, test_f1: 0.6539
 epoch: 31, train_loss: 0.5822, test_loss: 1.0580, test_f1: 0.6365
 epoch: 32, train_loss: 0.5712, test_loss: 1.0511, test_f1: 0.6149
 epoch: 33, train_loss: 0.5597, test_loss: 1.0465, test_f1: 0.6222
 epoch: 34, train_loss: 0.5602, test_loss: 1.0738, test_f1: 0.6245
 epoch: 35, train_loss: 0.5464, test_loss: 1.1125, test_f1: 0.6220
 epoch: 36, train_loss: 0.5433, test_loss: 1.1172, test_f1: 0.6189
 epoch: 37, train_loss: 0.5431, test_loss: 1.1554, test_f1: 0.6120
 epoch: 38, train_loss: 0.5312, test_loss: 1.1769, test_f1: 0.5823
 epoch: 39, train_loss: 0.5364, test_loss: 1.1507, test_f1: 0.6399
 epoch: 40, train_loss: 0.5002, test_loss: 1.1921, test_f1: 0.6191
 epoch: 41, train_loss: 0.5174, test_loss: 1.1484, test_f1: 0.6261
 epoch: 42, train_loss: 0.4951, test_loss: 1.1395, test_f1: 0.6248
 epoch: 43, train_loss: 0.4877, test_loss: 1.1538, test_f1: 0.6363
 epoch: 44, train_loss: 0.4600, test_loss: 1.1316, test_f1: 0.6482
 epoch: 45, train_loss: 0.4776, test_loss: 1.1117, test_f1: 0.6366
 epoch: 46, train_loss: 0.4788, test_loss: 1.1431, test_f1: 0.6453
 epoch: 47, train_loss: 0.4519, test_loss: 1.1990, test_f1: 0.6294
 epoch: 48, train_loss: 0.4551, test_loss: 1.2400, test_f1: 0.6417
 epoch: 49, train_loss: 0.4373, test_loss: 1.2139, test_f1: 0.6367
 epoch: 50, train_loss: 0.4199, test_loss: 1.2291, test_f1: 0.6577
 epoch: 51, train_loss: 0.4098, test_loss: 1.2403, test_f1: 0.6535
 epoch: 52, train_loss: 0.4084, test_loss: 1.2573, test_f1: 0.6384
 epoch: 53, train_loss: 0.3913, test_loss: 1.2634, test_f1: 0.6585
 epoch: 54, train_loss: 0.3900, test_loss: 1.2633, test_f1: 0.6517
 epoch: 55, train_loss: 0.3946, test_loss: 1.3028, test_f1: 0.6404
 epoch: 56, train_loss: 0.3970, test_loss: 1.3041, test_f1: 0.6500
 epoch: 57, train_loss: 0.3758, test_loss: 1.2660, test_f1: 0.6533
 epoch: 58, train_loss: 0.3651, test_loss: 1.2812, test_f1: 0.6364
 epoch: 59, train_loss: 0.3705, test_loss: 1.2756, test_f1: 0.6599
 epoch: 60, train_loss: 0.3680, test_loss: 1.3046, test_f1: 0.6385
 epoch: 61, train_loss: 0.3696, test_loss: 1.3274, test_f1: 0.6477
 epoch: 62, train_loss: 0.3493, test_loss: 1.3681, test_f1: 0.6415
 epoch: 63, train_loss: 0.3666, test_loss: 1.3317, test_f1: 0.6287
 epoch: 64, train_loss: 0.3552, test_loss: 1.3630, test_f1: 0.6558
 epoch: 65, train_loss: 0.3647, test_loss: 1.3691, test_f1: 0.6380
 epoch: 66, train_loss: 0.3562, test_loss: 1.3447, test_f1: 0.6409
 epoch: 67, train_loss: 0.3630, test_loss: 1.3665, test_f1: 0.6383
 epoch: 68, train_loss: 0.3460, test_loss: 1.3740, test_f1: 0.6405
 epoch: 69, train_loss: 0.3439, test_loss: 1.3769, test_f1: 0.6300
 epoch: 70, train_loss: 0.3384, test_loss: 1.4136, test_f1: 0.6326
 epoch: 71, train_loss: 0.3339, test_loss: 1.3973, test_f1: 0.6352
 epoch: 72, train_loss: 0.3323, test_loss: 1.4086, test_f1: 0.6373
 epoch: 73, train_loss: 0.2999, test_loss: 1.4199, test_f1: 0.6493
 epoch: 74, train_loss: 0.3154, test_loss: 1.4709, test_f1: 0.6408
 epoch: 75, train_loss: 0.3261, test_loss: 1.4210, test_f1: 0.6457
 epoch: 76, train_loss: 0.3193, test_loss: 1.4036, test_f1: 0.6477
 epoch: 77, train_loss: 0.3050, test_loss: 1.4581, test_f1: 0.6435
 epoch: 78, train_loss: 0.3135, test_loss: 1.4666, test_f1: 0.6341
 epoch: 79, train_loss: 0.2996, test_loss: 1.4998, test_f1: 0.6292
 epoch: 80, train_loss: 0.3042, test_loss: 1.5169, test_f1: 0.6314
 epoch: 81, train_loss: 0.3072, test_loss: 1.4921, test_f1: 0.6332
 epoch: 82, train_loss: 0.3134, test_loss: 1.5241, test_f1: 0.6115
 epoch: 83, train_loss: 0.2984, test_loss: 1.5530, test_f1: 0.6329
 epoch: 84, train_loss: 0.2942, test_loss: 1.5168, test_f1: 0.6092
 epoch: 85, train_loss: 0.2934, test_loss: 1.5294, test_f1: 0.6408
 epoch: 86, train_loss: 0.2963, test_loss: 1.5033, test_f1: 0.6408
 epoch: 87, train_loss: 0.2833, test_loss: 1.5230, test_f1: 0.6289
 epoch: 88, train_loss: 0.3005, test_loss: 1.5304, test_f1: 0.6281
 epoch: 89, train_loss: 0.2804, test_loss: 1.5758, test_f1: 0.6372
 epoch: 90, train_loss: 0.2773, test_loss: 1.6082, test_f1: 0.6347
 epoch: 91, train_loss: 0.2777, test_loss: 1.5702, test_f1: 0.6332
 epoch: 92, train_loss: 0.2942, test_loss: 1.5585, test_f1: 0.6377
 epoch: 93, train_loss: 0.2600, test_loss: 1.6366, test_f1: 0.6440
 epoch: 94, train_loss: 0.2535, test_loss: 1.6075, test_f1: 0.6329
 epoch: 95, train_loss: 0.2758, test_loss: 1.6499, test_f1: 0.6282
 epoch: 96, train_loss: 0.2779, test_loss: 1.7039, test_f1: 0.6285
 epoch: 97, train_loss: 0.2607, test_loss: 1.6570, test_f1: 0.6233
 epoch: 98, train_loss: 0.2627, test_loss: 1.7072, test_f1: 0.6124
 epoch: 99, train_loss: 0.2491, test_loss: 1.6904, test_f1: 0.6258
##################ITERATION #7 ****************************************
 epoch: 0, train_loss: 1.2159, test_loss: 1.2284, test_f1: 0.2778
 epoch: 1, train_loss: 1.0133, test_loss: 1.0579, test_f1: 0.5214
 epoch: 2, train_loss: 0.9798, test_loss: 1.0320, test_f1: 0.5579
 epoch: 3, train_loss: 0.9520, test_loss: 1.0170, test_f1: 0.5715
 epoch: 4, train_loss: 0.9092, test_loss: 1.0101, test_f1: 0.5372
 epoch: 5, train_loss: 0.9251, test_loss: 1.0040, test_f1: 0.5256
 epoch: 6, train_loss: 0.9059, test_loss: 1.0113, test_f1: 0.5308
 epoch: 7, train_loss: 0.8532, test_loss: 1.0007, test_f1: 0.5463
 epoch: 8, train_loss: 0.8433, test_loss: 1.0039, test_f1: 0.5319
 epoch: 9, train_loss: 0.8493, test_loss: 0.9912, test_f1: 0.5516
 epoch: 10, train_loss: 0.8363, test_loss: 1.0071, test_f1: 0.5394
 epoch: 11, train_loss: 0.8190, test_loss: 1.0065, test_f1: 0.5638
 epoch: 12, train_loss: 0.8062, test_loss: 0.9920, test_f1: 0.5739
 epoch: 13, train_loss: 0.7759, test_loss: 1.0010, test_f1: 0.5798
 epoch: 14, train_loss: 0.7563, test_loss: 1.0013, test_f1: 0.5915
 epoch: 15, train_loss: 0.7525, test_loss: 1.0062, test_f1: 0.5761
 epoch: 16, train_loss: 0.7251, test_loss: 1.0102, test_f1: 0.5695
 epoch: 17, train_loss: 0.7275, test_loss: 1.0003, test_f1: 0.5943
 epoch: 18, train_loss: 0.7169, test_loss: 0.9940, test_f1: 0.6022
 epoch: 19, train_loss: 0.7105, test_loss: 1.0135, test_f1: 0.6039
 epoch: 20, train_loss: 0.6992, test_loss: 1.0157, test_f1: 0.6050
 epoch: 21, train_loss: 0.6956, test_loss: 1.0145, test_f1: 0.5940
 epoch: 22, train_loss: 0.6816, test_loss: 1.0008, test_f1: 0.5844
 epoch: 23, train_loss: 0.6651, test_loss: 1.0192, test_f1: 0.6025
 epoch: 24, train_loss: 0.6441, test_loss: 1.0258, test_f1: 0.6156
 epoch: 25, train_loss: 0.6485, test_loss: 1.0717, test_f1: 0.5925
 epoch: 26, train_loss: 0.6392, test_loss: 1.0657, test_f1: 0.6084
 epoch: 27, train_loss: 0.6212, test_loss: 1.0843, test_f1: 0.6095
 epoch: 28, train_loss: 0.6008, test_loss: 1.0716, test_f1: 0.5962
 epoch: 29, train_loss: 0.6100, test_loss: 1.0683, test_f1: 0.6014
 epoch: 30, train_loss: 0.5958, test_loss: 1.0631, test_f1: 0.6020
 epoch: 31, train_loss: 0.6161, test_loss: 1.1064, test_f1: 0.6148
 epoch: 32, train_loss: 0.5887, test_loss: 1.0965, test_f1: 0.6079
 epoch: 33, train_loss: 0.5772, test_loss: 1.1033, test_f1: 0.6431
 epoch: 34, train_loss: 0.5545, test_loss: 1.1020, test_f1: 0.6027
 epoch: 35, train_loss: 0.5880, test_loss: 1.1216, test_f1: 0.6210
 epoch: 36, train_loss: 0.5518, test_loss: 1.1396, test_f1: 0.6170
 epoch: 37, train_loss: 0.5575, test_loss: 1.1693, test_f1: 0.5930
 epoch: 38, train_loss: 0.5397, test_loss: 1.1379, test_f1: 0.5985
 epoch: 39, train_loss: 0.5203, test_loss: 1.1770, test_f1: 0.5964
 epoch: 40, train_loss: 0.5349, test_loss: 1.1861, test_f1: 0.6243
 epoch: 41, train_loss: 0.5219, test_loss: 1.1851, test_f1: 0.6211
 epoch: 42, train_loss: 0.5164, test_loss: 1.1805, test_f1: 0.6185
 epoch: 43, train_loss: 0.5106, test_loss: 1.1963, test_f1: 0.6002
 epoch: 44, train_loss: 0.5160, test_loss: 1.2091, test_f1: 0.5961
 epoch: 45, train_loss: 0.4904, test_loss: 1.1908, test_f1: 0.6091
 epoch: 46, train_loss: 0.4751, test_loss: 1.2643, test_f1: 0.6148
 epoch: 47, train_loss: 0.5000, test_loss: 1.2488, test_f1: 0.6194
 epoch: 48, train_loss: 0.4864, test_loss: 1.2944, test_f1: 0.6163
 epoch: 49, train_loss: 0.4791, test_loss: 1.3392, test_f1: 0.6131
 epoch: 50, train_loss: 0.4752, test_loss: 1.2860, test_f1: 0.6199
 epoch: 51, train_loss: 0.4426, test_loss: 1.2952, test_f1: 0.6138
 epoch: 52, train_loss: 0.4301, test_loss: 1.3198, test_f1: 0.6227
 epoch: 53, train_loss: 0.4206, test_loss: 1.3056, test_f1: 0.6278
 epoch: 54, train_loss: 0.4032, test_loss: 1.3175, test_f1: 0.6159
 epoch: 55, train_loss: 0.4230, test_loss: 1.3086, test_f1: 0.6085
 epoch: 56, train_loss: 0.4176, test_loss: 1.3712, test_f1: 0.6182
 epoch: 57, train_loss: 0.4017, test_loss: 1.3356, test_f1: 0.6193
 epoch: 58, train_loss: 0.4050, test_loss: 1.3711, test_f1: 0.6106
 epoch: 59, train_loss: 0.3912, test_loss: 1.3710, test_f1: 0.6278
 epoch: 60, train_loss: 0.4029, test_loss: 1.3669, test_f1: 0.6156
 epoch: 61, train_loss: 0.4023, test_loss: 1.3767, test_f1: 0.6318
 epoch: 62, train_loss: 0.3923, test_loss: 1.4075, test_f1: 0.6255
 epoch: 63, train_loss: 0.4017, test_loss: 1.3936, test_f1: 0.6105
 epoch: 64, train_loss: 0.3875, test_loss: 1.3749, test_f1: 0.6187
 epoch: 65, train_loss: 0.3847, test_loss: 1.3962, test_f1: 0.6351
 epoch: 66, train_loss: 0.3886, test_loss: 1.4387, test_f1: 0.6144
 epoch: 67, train_loss: 0.4003, test_loss: 1.4323, test_f1: 0.6283
 epoch: 68, train_loss: 0.3578, test_loss: 1.4635, test_f1: 0.6301
 epoch: 69, train_loss: 0.3695, test_loss: 1.5055, test_f1: 0.6213
 epoch: 70, train_loss: 0.3665, test_loss: 1.4566, test_f1: 0.6301
 epoch: 71, train_loss: 0.3590, test_loss: 1.4781, test_f1: 0.6401
 epoch: 72, train_loss: 0.3618, test_loss: 1.5006, test_f1: 0.6323
 epoch: 73, train_loss: 0.3661, test_loss: 1.4624, test_f1: 0.6322
 epoch: 74, train_loss: 0.3496, test_loss: 1.4920, test_f1: 0.6393
 epoch: 75, train_loss: 0.3535, test_loss: 1.5134, test_f1: 0.6157
 epoch: 76, train_loss: 0.3424, test_loss: 1.5312, test_f1: 0.6125
 epoch: 77, train_loss: 0.3437, test_loss: 1.5604, test_f1: 0.6247
 epoch: 78, train_loss: 0.3413, test_loss: 1.5411, test_f1: 0.6244
 epoch: 79, train_loss: 0.3467, test_loss: 1.5691, test_f1: 0.6160
 epoch: 80, train_loss: 0.3454, test_loss: 1.5926, test_f1: 0.6282
 epoch: 81, train_loss: 0.3268, test_loss: 1.5296, test_f1: 0.6165
 epoch: 82, train_loss: 0.2990, test_loss: 1.6026, test_f1: 0.6266
 epoch: 83, train_loss: 0.3218, test_loss: 1.6007, test_f1: 0.6187
 epoch: 84, train_loss: 0.3207, test_loss: 1.5979, test_f1: 0.6157
 epoch: 85, train_loss: 0.3030, test_loss: 1.6149, test_f1: 0.6037
 epoch: 86, train_loss: 0.3376, test_loss: 1.5691, test_f1: 0.6254
 epoch: 87, train_loss: 0.3159, test_loss: 1.5704, test_f1: 0.6175
 epoch: 88, train_loss: 0.3299, test_loss: 1.6288, test_f1: 0.6251
 epoch: 89, train_loss: 0.3118, test_loss: 1.6373, test_f1: 0.6141
 epoch: 90, train_loss: 0.2957, test_loss: 1.7248, test_f1: 0.6106
 epoch: 91, train_loss: 0.3107, test_loss: 1.6205, test_f1: 0.6177
 epoch: 92, train_loss: 0.2957, test_loss: 1.6478, test_f1: 0.6289
 epoch: 93, train_loss: 0.2910, test_loss: 1.6787, test_f1: 0.6300
 epoch: 94, train_loss: 0.3033, test_loss: 1.6346, test_f1: 0.6265
 epoch: 95, train_loss: 0.2775, test_loss: 1.7138, test_f1: 0.6240
 epoch: 96, train_loss: 0.2883, test_loss: 1.7198, test_f1: 0.6223
 epoch: 97, train_loss: 0.2848, test_loss: 1.6955, test_f1: 0.6179
 epoch: 98, train_loss: 0.2694, test_loss: 1.8025, test_f1: 0.6167
 epoch: 99, train_loss: 0.2921, test_loss: 1.7044, test_f1: 0.6159
##################ITERATION #8 ****************************************
 epoch: 0, train_loss: 1.2412, test_loss: 1.5816, test_f1: 0.2722
 epoch: 1, train_loss: 1.0485, test_loss: 1.0427, test_f1: 0.5389
 epoch: 2, train_loss: 1.0013, test_loss: 1.0488, test_f1: 0.5780
 epoch: 3, train_loss: 0.9687, test_loss: 1.0369, test_f1: 0.5507
 epoch: 4, train_loss: 0.9160, test_loss: 1.0354, test_f1: 0.5825
 epoch: 5, train_loss: 0.9068, test_loss: 1.0047, test_f1: 0.5751
 epoch: 6, train_loss: 0.8838, test_loss: 1.0198, test_f1: 0.5799
 epoch: 7, train_loss: 0.8639, test_loss: 1.0091, test_f1: 0.6155
 epoch: 8, train_loss: 0.8589, test_loss: 1.0062, test_f1: 0.5713
 epoch: 9, train_loss: 0.8418, test_loss: 1.0039, test_f1: 0.6028
 epoch: 10, train_loss: 0.8270, test_loss: 0.9938, test_f1: 0.6209
 epoch: 11, train_loss: 0.7903, test_loss: 1.0015, test_f1: 0.6219
 epoch: 12, train_loss: 0.7875, test_loss: 1.0055, test_f1: 0.6189
 epoch: 13, train_loss: 0.7623, test_loss: 1.0224, test_f1: 0.5822
 epoch: 14, train_loss: 0.7584, test_loss: 0.9978, test_f1: 0.6164
 epoch: 15, train_loss: 0.7191, test_loss: 1.0407, test_f1: 0.6156
 epoch: 16, train_loss: 0.7349, test_loss: 1.0005, test_f1: 0.6193
 epoch: 17, train_loss: 0.7201, test_loss: 1.0419, test_f1: 0.6188
 epoch: 18, train_loss: 0.6992, test_loss: 1.0194, test_f1: 0.6236
 epoch: 19, train_loss: 0.7001, test_loss: 1.0463, test_f1: 0.5978
 epoch: 20, train_loss: 0.7004, test_loss: 1.0242, test_f1: 0.5994
 epoch: 21, train_loss: 0.6738, test_loss: 1.0813, test_f1: 0.5790
 epoch: 22, train_loss: 0.6536, test_loss: 1.0519, test_f1: 0.6279
 epoch: 23, train_loss: 0.6561, test_loss: 1.0541, test_f1: 0.5968
 epoch: 24, train_loss: 0.6338, test_loss: 1.0949, test_f1: 0.6146
 epoch: 25, train_loss: 0.6385, test_loss: 1.0814, test_f1: 0.6209
 epoch: 26, train_loss: 0.6185, test_loss: 1.0905, test_f1: 0.6101
 epoch: 27, train_loss: 0.6098, test_loss: 1.1085, test_f1: 0.5919
 epoch: 28, train_loss: 0.6165, test_loss: 1.0942, test_f1: 0.6467
 epoch: 29, train_loss: 0.5862, test_loss: 1.1346, test_f1: 0.6094
 epoch: 30, train_loss: 0.5793, test_loss: 1.1549, test_f1: 0.6063
 epoch: 31, train_loss: 0.5737, test_loss: 1.1588, test_f1: 0.6539
 epoch: 32, train_loss: 0.5600, test_loss: 1.1453, test_f1: 0.6231
 epoch: 33, train_loss: 0.5696, test_loss: 1.1793, test_f1: 0.5731
 epoch: 34, train_loss: 0.5457, test_loss: 1.1830, test_f1: 0.6046
 epoch: 35, train_loss: 0.5526, test_loss: 1.1683, test_f1: 0.5963
 epoch: 36, train_loss: 0.5285, test_loss: 1.1814, test_f1: 0.6001
 epoch: 37, train_loss: 0.5181, test_loss: 1.2820, test_f1: 0.5903
 epoch: 38, train_loss: 0.5023, test_loss: 1.2504, test_f1: 0.6015
 epoch: 39, train_loss: 0.5169, test_loss: 1.2948, test_f1: 0.5764
 epoch: 40, train_loss: 0.5021, test_loss: 1.3295, test_f1: 0.5964
 epoch: 41, train_loss: 0.4809, test_loss: 1.3206, test_f1: 0.5803
 epoch: 42, train_loss: 0.4844, test_loss: 1.3686, test_f1: 0.5675
 epoch: 43, train_loss: 0.4715, test_loss: 1.3229, test_f1: 0.5696
 epoch: 44, train_loss: 0.4710, test_loss: 1.3627, test_f1: 0.5744
 epoch: 45, train_loss: 0.4645, test_loss: 1.3169, test_f1: 0.5839
 epoch: 46, train_loss: 0.4633, test_loss: 1.4211, test_f1: 0.5621
 epoch: 47, train_loss: 0.4527, test_loss: 1.3716, test_f1: 0.5844
 epoch: 48, train_loss: 0.4306, test_loss: 1.4076, test_f1: 0.5979
 epoch: 49, train_loss: 0.4385, test_loss: 1.3908, test_f1: 0.6342
 epoch: 50, train_loss: 0.4301, test_loss: 1.4372, test_f1: 0.6079
 epoch: 51, train_loss: 0.3995, test_loss: 1.4211, test_f1: 0.6157
 epoch: 52, train_loss: 0.3920, test_loss: 1.4181, test_f1: 0.6267
 epoch: 53, train_loss: 0.3905, test_loss: 1.4723, test_f1: 0.5936
 epoch: 54, train_loss: 0.4054, test_loss: 1.5100, test_f1: 0.5798
 epoch: 55, train_loss: 0.3762, test_loss: 1.4735, test_f1: 0.5723
 epoch: 56, train_loss: 0.3829, test_loss: 1.4748, test_f1: 0.5810
 epoch: 57, train_loss: 0.3637, test_loss: 1.5175, test_f1: 0.5829
 epoch: 58, train_loss: 0.3847, test_loss: 1.5313, test_f1: 0.5857
 epoch: 59, train_loss: 0.3748, test_loss: 1.5039, test_f1: 0.5923
 epoch: 60, train_loss: 0.3687, test_loss: 1.5996, test_f1: 0.5687
 epoch: 61, train_loss: 0.3562, test_loss: 1.5514, test_f1: 0.5804
 epoch: 62, train_loss: 0.3557, test_loss: 1.5998, test_f1: 0.5661
 epoch: 63, train_loss: 0.3349, test_loss: 1.5905, test_f1: 0.5756
 epoch: 64, train_loss: 0.3409, test_loss: 1.5561, test_f1: 0.5905
 epoch: 65, train_loss: 0.3407, test_loss: 1.5722, test_f1: 0.5765
 epoch: 66, train_loss: 0.3350, test_loss: 1.6474, test_f1: 0.5871
 epoch: 67, train_loss: 0.3452, test_loss: 1.6222, test_f1: 0.5876
 epoch: 68, train_loss: 0.3321, test_loss: 1.6351, test_f1: 0.5891
 epoch: 69, train_loss: 0.3367, test_loss: 1.5986, test_f1: 0.5957
 epoch: 70, train_loss: 0.3415, test_loss: 1.6001, test_f1: 0.5953
 epoch: 71, train_loss: 0.3302, test_loss: 1.6473, test_f1: 0.5733
 epoch: 72, train_loss: 0.3167, test_loss: 1.6478, test_f1: 0.5741
 epoch: 73, train_loss: 0.3340, test_loss: 1.6473, test_f1: 0.5678
 epoch: 74, train_loss: 0.3041, test_loss: 1.7150, test_f1: 0.5873
 epoch: 75, train_loss: 0.3272, test_loss: 1.7749, test_f1: 0.5647
 epoch: 76, train_loss: 0.3103, test_loss: 1.8005, test_f1: 0.5803
 epoch: 77, train_loss: 0.3222, test_loss: 1.7425, test_f1: 0.5698
 epoch: 78, train_loss: 0.3083, test_loss: 1.7704, test_f1: 0.5716
 epoch: 79, train_loss: 0.2996, test_loss: 1.7940, test_f1: 0.5781
 epoch: 80, train_loss: 0.3118, test_loss: 1.8093, test_f1: 0.5795
 epoch: 81, train_loss: 0.2825, test_loss: 1.8140, test_f1: 0.5719
 epoch: 82, train_loss: 0.2772, test_loss: 1.7968, test_f1: 0.5728
 epoch: 83, train_loss: 0.2769, test_loss: 1.8676, test_f1: 0.5669
 epoch: 84, train_loss: 0.2740, test_loss: 1.8724, test_f1: 0.5682
 epoch: 85, train_loss: 0.2972, test_loss: 1.8068, test_f1: 0.5705
 epoch: 86, train_loss: 0.2905, test_loss: 1.8851, test_f1: 0.5727
 epoch: 87, train_loss: 0.2902, test_loss: 1.9820, test_f1: 0.5772
 epoch: 88, train_loss: 0.2890, test_loss: 1.9365, test_f1: 0.5723
 epoch: 89, train_loss: 0.2848, test_loss: 1.8916, test_f1: 0.5695
 epoch: 90, train_loss: 0.2824, test_loss: 1.9313, test_f1: 0.5611
 epoch: 91, train_loss: 0.2741, test_loss: 2.0140, test_f1: 0.5617
 epoch: 92, train_loss: 0.2579, test_loss: 2.0128, test_f1: 0.5491
 epoch: 93, train_loss: 0.2653, test_loss: 1.9921, test_f1: 0.5565
 epoch: 94, train_loss: 0.2539, test_loss: 1.9552, test_f1: 0.5735
 epoch: 95, train_loss: 0.2683, test_loss: 1.9244, test_f1: 0.5731
 epoch: 96, train_loss: 0.2738, test_loss: 2.0408, test_f1: 0.5632
 epoch: 97, train_loss: 0.2614, test_loss: 2.0145, test_f1: 0.5672
 epoch: 98, train_loss: 0.2652, test_loss: 1.9886, test_f1: 0.5504
 epoch: 99, train_loss: 0.2596, test_loss: 2.0364, test_f1: 0.5635
##################ITERATION #9 ****************************************
 epoch: 0, train_loss: 1.2577, test_loss: 1.2110, test_f1: 0.3540
 epoch: 1, train_loss: 1.0495, test_loss: 1.0822, test_f1: 0.5011
 epoch: 2, train_loss: 1.0070, test_loss: 1.0722, test_f1: 0.4765
 epoch: 3, train_loss: 0.9610, test_loss: 1.0372, test_f1: 0.5456
 epoch: 4, train_loss: 0.9242, test_loss: 1.0392, test_f1: 0.5544
 epoch: 5, train_loss: 0.9079, test_loss: 1.0373, test_f1: 0.5650
 epoch: 6, train_loss: 0.8933, test_loss: 1.0245, test_f1: 0.5547
 epoch: 7, train_loss: 0.8849, test_loss: 1.0250, test_f1: 0.5377
 epoch: 8, train_loss: 0.8432, test_loss: 1.0225, test_f1: 0.5731
 epoch: 9, train_loss: 0.8387, test_loss: 1.0406, test_f1: 0.5205
 epoch: 10, train_loss: 0.7990, test_loss: 1.0116, test_f1: 0.5578
 epoch: 11, train_loss: 0.7926, test_loss: 1.0032, test_f1: 0.5828
 epoch: 12, train_loss: 0.7727, test_loss: 1.0379, test_f1: 0.5725
 epoch: 13, train_loss: 0.7665, test_loss: 1.0286, test_f1: 0.6013
 epoch: 14, train_loss: 0.7455, test_loss: 1.0260, test_f1: 0.5916
 epoch: 15, train_loss: 0.7423, test_loss: 1.0646, test_f1: 0.5514
 epoch: 16, train_loss: 0.7269, test_loss: 1.0482, test_f1: 0.5822
 epoch: 17, train_loss: 0.7208, test_loss: 1.0429, test_f1: 0.5860
 epoch: 18, train_loss: 0.7202, test_loss: 1.0588, test_f1: 0.5950
 epoch: 19, train_loss: 0.7032, test_loss: 1.0252, test_f1: 0.5755
 epoch: 20, train_loss: 0.6791, test_loss: 1.0241, test_f1: 0.6282
 epoch: 21, train_loss: 0.6770, test_loss: 1.0771, test_f1: 0.5927
 epoch: 22, train_loss: 0.6685, test_loss: 1.0786, test_f1: 0.5993
 epoch: 23, train_loss: 0.6518, test_loss: 1.0899, test_f1: 0.5869
 epoch: 24, train_loss: 0.6305, test_loss: 1.0793, test_f1: 0.6119
 epoch: 25, train_loss: 0.6471, test_loss: 1.0982, test_f1: 0.5839
 epoch: 26, train_loss: 0.6314, test_loss: 1.0918, test_f1: 0.6441
 epoch: 27, train_loss: 0.6017, test_loss: 1.1518, test_f1: 0.5653
 epoch: 28, train_loss: 0.6014, test_loss: 1.1175, test_f1: 0.6124
 epoch: 29, train_loss: 0.5862, test_loss: 1.1922, test_f1: 0.5625
 epoch: 30, train_loss: 0.5860, test_loss: 1.1452, test_f1: 0.6060
 epoch: 31, train_loss: 0.5855, test_loss: 1.1897, test_f1: 0.5635
 epoch: 32, train_loss: 0.5615, test_loss: 1.2052, test_f1: 0.5878
 epoch: 33, train_loss: 0.5433, test_loss: 1.1353, test_f1: 0.6215
 epoch: 34, train_loss: 0.5661, test_loss: 1.1572, test_f1: 0.6081
 epoch: 35, train_loss: 0.5335, test_loss: 1.1837, test_f1: 0.6195
 epoch: 36, train_loss: 0.5345, test_loss: 1.2242, test_f1: 0.6057
 epoch: 37, train_loss: 0.5567, test_loss: 1.1830, test_f1: 0.6063
 epoch: 38, train_loss: 0.5113, test_loss: 1.2371, test_f1: 0.6105
 epoch: 39, train_loss: 0.4938, test_loss: 1.2410, test_f1: 0.6447
 epoch: 40, train_loss: 0.4975, test_loss: 1.3297, test_f1: 0.5867
 epoch: 41, train_loss: 0.4951, test_loss: 1.2576, test_f1: 0.6405
 epoch: 42, train_loss: 0.5101, test_loss: 1.2724, test_f1: 0.6077
 epoch: 43, train_loss: 0.4722, test_loss: 1.3015, test_f1: 0.5974
 epoch: 44, train_loss: 0.4825, test_loss: 1.3914, test_f1: 0.6017
 epoch: 45, train_loss: 0.4578, test_loss: 1.3499, test_f1: 0.5980
 epoch: 46, train_loss: 0.4432, test_loss: 1.3852, test_f1: 0.6466
 epoch: 47, train_loss: 0.4746, test_loss: 1.3700, test_f1: 0.6220
 epoch: 48, train_loss: 0.4366, test_loss: 1.3860, test_f1: 0.6371
 epoch: 49, train_loss: 0.4383, test_loss: 1.4034, test_f1: 0.6092
 epoch: 50, train_loss: 0.4487, test_loss: 1.3241, test_f1: 0.6440
 epoch: 51, train_loss: 0.4100, test_loss: 1.4042, test_f1: 0.6323
 epoch: 52, train_loss: 0.3949, test_loss: 1.4036, test_f1: 0.6277
 epoch: 53, train_loss: 0.4036, test_loss: 1.4345, test_f1: 0.6084
 epoch: 54, train_loss: 0.3854, test_loss: 1.4873, test_f1: 0.5884
 epoch: 55, train_loss: 0.3922, test_loss: 1.4669, test_f1: 0.6159
 epoch: 56, train_loss: 0.3880, test_loss: 1.4579, test_f1: 0.6377
 epoch: 57, train_loss: 0.3563, test_loss: 1.5140, test_f1: 0.6231
 epoch: 58, train_loss: 0.3619, test_loss: 1.4732, test_f1: 0.6389
 epoch: 59, train_loss: 0.3621, test_loss: 1.4684, test_f1: 0.6646
 epoch: 60, train_loss: 0.3687, test_loss: 1.5692, test_f1: 0.6385
 epoch: 61, train_loss: 0.3692, test_loss: 1.5003, test_f1: 0.6318
 epoch: 62, train_loss: 0.3740, test_loss: 1.5601, test_f1: 0.5960
 epoch: 63, train_loss: 0.3461, test_loss: 1.5576, test_f1: 0.6186
 epoch: 64, train_loss: 0.3474, test_loss: 1.6218, test_f1: 0.6096
 epoch: 65, train_loss: 0.3389, test_loss: 1.6376, test_f1: 0.6121
 epoch: 66, train_loss: 0.3524, test_loss: 1.5817, test_f1: 0.6662
 epoch: 67, train_loss: 0.3388, test_loss: 1.5709, test_f1: 0.6322
 epoch: 68, train_loss: 0.3394, test_loss: 1.6402, test_f1: 0.5860
 epoch: 69, train_loss: 0.3405, test_loss: 1.5881, test_f1: 0.6405
 epoch: 70, train_loss: 0.3331, test_loss: 1.6295, test_f1: 0.6119
 epoch: 71, train_loss: 0.3353, test_loss: 1.6610, test_f1: 0.6269
 epoch: 72, train_loss: 0.3328, test_loss: 1.7017, test_f1: 0.6116
 epoch: 73, train_loss: 0.3420, test_loss: 1.6871, test_f1: 0.6209
 epoch: 74, train_loss: 0.3325, test_loss: 1.7187, test_f1: 0.5775
 epoch: 75, train_loss: 0.3055, test_loss: 1.7131, test_f1: 0.6191
 epoch: 76, train_loss: 0.3128, test_loss: 1.7188, test_f1: 0.6056
 epoch: 77, train_loss: 0.2942, test_loss: 1.6920, test_f1: 0.6064
 epoch: 78, train_loss: 0.3015, test_loss: 1.6890, test_f1: 0.6193
 epoch: 79, train_loss: 0.3092, test_loss: 1.7651, test_f1: 0.6391
 epoch: 80, train_loss: 0.3100, test_loss: 1.7525, test_f1: 0.6325
 epoch: 81, train_loss: 0.2944, test_loss: 1.7196, test_f1: 0.6562
 epoch: 82, train_loss: 0.3050, test_loss: 1.7324, test_f1: 0.6102
 epoch: 83, train_loss: 0.2827, test_loss: 1.8247, test_f1: 0.6097
 epoch: 84, train_loss: 0.2809, test_loss: 1.8141, test_f1: 0.6037
 epoch: 85, train_loss: 0.2828, test_loss: 1.8565, test_f1: 0.6177
 epoch: 86, train_loss: 0.3069, test_loss: 1.9768, test_f1: 0.5809
 epoch: 87, train_loss: 0.2859, test_loss: 1.9179, test_f1: 0.6320
 epoch: 88, train_loss: 0.2802, test_loss: 1.8312, test_f1: 0.6210
 epoch: 89, train_loss: 0.2700, test_loss: 1.9169, test_f1: 0.6058
 epoch: 90, train_loss: 0.2582, test_loss: 1.8560, test_f1: 0.6283
 epoch: 91, train_loss: 0.2795, test_loss: 1.8916, test_f1: 0.6126
 epoch: 92, train_loss: 0.2705, test_loss: 1.8626, test_f1: 0.6237
 epoch: 93, train_loss: 0.2623, test_loss: 1.9184, test_f1: 0.5995
 epoch: 94, train_loss: 0.2781, test_loss: 1.8831, test_f1: 0.6405
 epoch: 95, train_loss: 0.2571, test_loss: 1.9178, test_f1: 0.6145
 epoch: 96, train_loss: 0.2733, test_loss: 1.9151, test_f1: 0.6375
 epoch: 97, train_loss: 0.2532, test_loss: 1.9805, test_f1: 0.6277
 epoch: 98, train_loss: 0.2322, test_loss: 1.9255, test_f1: 0.6240
 epoch: 99, train_loss: 0.2412, test_loss: 1.9844, test_f1: 0.6090

Training completed in 603.92 seconds
Best F1: 0.6790 at epoch 90
Mean F1 across iterations: 0.6554  0.0151
========================FINAL RESULTS================================
FEGIN weighted F1: 0.6790  0.0151
python main.py --data ltspice_demos --representation component_pin_net --model FEGIN --layers 3 --hiddens 128 --batch_size 32 --lr 0.0001 --emb_size 128 --epochs 100 --save_appendix component_pin_net_L3_H128_BS32_LR0.0001_E128 --no_val
-----



STDERR:
  File "main.py", line 370, in <module>
    main()
  File "main.py", line 254, in main
    dataset = dataset_class(
  File "/home/philip/projects/ltspice_examples_code_repo/Circuit-Completion-Using-GNNs/component_classification_with_link_prediction_head/evaluation/FEGIN/kernel/circuit_datasets.py", line 15, in __init__
    self.data, self.slices = torch.load(self.processed_paths[0])
  File "/home/philip/.local/lib/python3.8/site-packages/torch/serialization.py", line 1040, in load
    warnings.warn(
  File "/usr/lib/python3.8/warnings.py", line 109, in _showwarnmsg
    sw(msg.message, msg.category, msg.filename, msg.lineno,
  File "main.py", line 47, in warn_with_traceback
    traceback.print_stack(file=log)
/home/philip/projects/ltspice_examples_code_repo/Circuit-Completion-Using-GNNs/component_classification_with_link_prediction_head/evaluation/FEGIN/kernel/circuit_datasets.py:15: FutureWarning: You are using `torch.load` with `weights_only=False` (the current default value), which uses the default pickle module implicitly. It is possible to construct malicious pickle data which will execute arbitrary code during unpickling (See https://github.com/pytorch/pytorch/blob/main/SECURITY.md#untrusted-models for more details). In a future release, the default value for `weights_only` will be flipped to `True`. This limits the functions that could be executed during unpickling. Arbitrary objects will no longer be allowed to be loaded via this mode unless they are explicitly allowlisted by the user via `torch.serialization.add_safe_globals`. We recommend you start setting `weights_only=True` for any use case where you don't have full control of the loaded file. Please open an issue on GitHub for any issues related to this experimental feature.
  self.data, self.slices = torch.load(self.processed_paths[0])
