STDOUT:
Results will be saved in /home/philip/projects/ltspice_examples_code_repo/Circuit-Completion-Using-GNNs/component_classification_with_link_prediction_head/evaluation/FEGIN/results/model_FEGIN_dataset_ltspice_examples
Command line input: python main.py --data ltspice_examples --representation component_component --model FEGIN --layers 5 --hiddens 128 --batch_size 256 --lr 0.0001 --emb_size 250 --epochs 100 --save_appendix component_component_L5_H128_BS256_LR0.0001_E250 --no_val
 is saved.
-----
ltspice_examples - FEGIN
Using 5 layers, 128 hidden units, h = 2
Loading component_component representation dataset
ENTERED
Training FEGIN on component_component representation
Train: 3556, Test: 845
##################ITERATION #0 ****************************************
 epoch: 0, train_loss: 1.3908, test_loss: 1.3850, test_f1: 0.0794
 epoch: 1, train_loss: 1.3731, test_loss: 1.3756, test_f1: 0.2809
 epoch: 2, train_loss: 1.3600, test_loss: 1.3591, test_f1: 0.3162
 epoch: 3, train_loss: 1.3435, test_loss: 1.3380, test_f1: 0.3005
 epoch: 4, train_loss: 1.3235, test_loss: 1.3134, test_f1: 0.2884
 epoch: 5, train_loss: 1.3009, test_loss: 1.2856, test_f1: 0.2970
 epoch: 6, train_loss: 1.2750, test_loss: 1.2581, test_f1: 0.2989
 epoch: 7, train_loss: 1.2554, test_loss: 1.2305, test_f1: 0.3054
 epoch: 8, train_loss: 1.2342, test_loss: 1.2104, test_f1: 0.3381
 epoch: 9, train_loss: 1.2179, test_loss: 1.1895, test_f1: 0.3443
 epoch: 10, train_loss: 1.1978, test_loss: 1.1742, test_f1: 0.3357
 epoch: 11, train_loss: 1.1836, test_loss: 1.1588, test_f1: 0.3588
 epoch: 12, train_loss: 1.1648, test_loss: 1.1455, test_f1: 0.3704
 epoch: 13, train_loss: 1.1514, test_loss: 1.1302, test_f1: 0.3947
 epoch: 14, train_loss: 1.1313, test_loss: 1.1319, test_f1: 0.4149
 epoch: 15, train_loss: 1.1141, test_loss: 1.1133, test_f1: 0.4319
 epoch: 16, train_loss: 1.1031, test_loss: 1.1065, test_f1: 0.4401
 epoch: 17, train_loss: 1.0887, test_loss: 1.0872, test_f1: 0.4614
 epoch: 18, train_loss: 1.0694, test_loss: 1.0839, test_f1: 0.4622
 epoch: 19, train_loss: 1.0463, test_loss: 1.0687, test_f1: 0.4598
 epoch: 20, train_loss: 1.0392, test_loss: 1.0624, test_f1: 0.4555
 epoch: 21, train_loss: 1.0217, test_loss: 1.0638, test_f1: 0.4682
 epoch: 22, train_loss: 1.0037, test_loss: 1.0491, test_f1: 0.4776
 epoch: 23, train_loss: 0.9840, test_loss: 1.0528, test_f1: 0.4775
 epoch: 24, train_loss: 0.9780, test_loss: 1.0448, test_f1: 0.4756
 epoch: 25, train_loss: 0.9593, test_loss: 1.0592, test_f1: 0.4744
 epoch: 26, train_loss: 0.9465, test_loss: 1.0452, test_f1: 0.4867
 epoch: 27, train_loss: 0.9410, test_loss: 1.0722, test_f1: 0.4706
 epoch: 28, train_loss: 0.9261, test_loss: 1.0527, test_f1: 0.4730
 epoch: 29, train_loss: 0.9075, test_loss: 1.0597, test_f1: 0.4800
 epoch: 30, train_loss: 0.9008, test_loss: 1.0880, test_f1: 0.4815
 epoch: 31, train_loss: 0.9004, test_loss: 1.0714, test_f1: 0.4749
 epoch: 32, train_loss: 0.8869, test_loss: 1.0973, test_f1: 0.4706
 epoch: 33, train_loss: 0.8804, test_loss: 1.0931, test_f1: 0.4694
 epoch: 34, train_loss: 0.8691, test_loss: 1.0890, test_f1: 0.4698
 epoch: 35, train_loss: 0.8573, test_loss: 1.0679, test_f1: 0.4763
 epoch: 36, train_loss: 0.8438, test_loss: 1.0791, test_f1: 0.4794
 epoch: 37, train_loss: 0.8371, test_loss: 1.1033, test_f1: 0.4658
 epoch: 38, train_loss: 0.8373, test_loss: 1.1731, test_f1: 0.4599
 epoch: 39, train_loss: 0.8303, test_loss: 1.1217, test_f1: 0.4658
 epoch: 40, train_loss: 0.8247, test_loss: 1.1244, test_f1: 0.4744
 epoch: 41, train_loss: 0.7988, test_loss: 1.1753, test_f1: 0.4522
 epoch: 42, train_loss: 0.7973, test_loss: 1.1817, test_f1: 0.4678
 epoch: 43, train_loss: 0.7957, test_loss: 1.1902, test_f1: 0.4674
 epoch: 44, train_loss: 0.7944, test_loss: 1.1727, test_f1: 0.4714
 epoch: 45, train_loss: 0.7792, test_loss: 1.2036, test_f1: 0.4712
 epoch: 46, train_loss: 0.7826, test_loss: 1.2005, test_f1: 0.4720
 epoch: 47, train_loss: 0.7656, test_loss: 1.2309, test_f1: 0.4635
 epoch: 48, train_loss: 0.7624, test_loss: 1.2096, test_f1: 0.4728
 epoch: 49, train_loss: 0.7408, test_loss: 1.2232, test_f1: 0.4764
 epoch: 50, train_loss: 0.7399, test_loss: 1.2640, test_f1: 0.4875
 epoch: 51, train_loss: 0.7304, test_loss: 1.2767, test_f1: 0.4702
 epoch: 52, train_loss: 0.7263, test_loss: 1.2592, test_f1: 0.4783
 epoch: 53, train_loss: 0.7095, test_loss: 1.2169, test_f1: 0.4848
 epoch: 54, train_loss: 0.7196, test_loss: 1.2303, test_f1: 0.4824
 epoch: 55, train_loss: 0.7134, test_loss: 1.2453, test_f1: 0.4840
 epoch: 56, train_loss: 0.6966, test_loss: 1.2300, test_f1: 0.4926
 epoch: 57, train_loss: 0.7011, test_loss: 1.2661, test_f1: 0.4976
 epoch: 58, train_loss: 0.6901, test_loss: 1.2811, test_f1: 0.4949
 epoch: 59, train_loss: 0.6881, test_loss: 1.2946, test_f1: 0.4840
 epoch: 60, train_loss: 0.6814, test_loss: 1.2920, test_f1: 0.4833
 epoch: 61, train_loss: 0.6727, test_loss: 1.2866, test_f1: 0.4885
 epoch: 62, train_loss: 0.6716, test_loss: 1.3281, test_f1: 0.4905
 epoch: 63, train_loss: 0.6821, test_loss: 1.3023, test_f1: 0.4887
 epoch: 64, train_loss: 0.6698, test_loss: 1.3284, test_f1: 0.4825
 epoch: 65, train_loss: 0.6704, test_loss: 1.3521, test_f1: 0.4968
 epoch: 66, train_loss: 0.6673, test_loss: 1.2820, test_f1: 0.4935
 epoch: 67, train_loss: 0.6741, test_loss: 1.3385, test_f1: 0.4854
 epoch: 68, train_loss: 0.6563, test_loss: 1.3310, test_f1: 0.5048
 epoch: 69, train_loss: 0.6636, test_loss: 1.3283, test_f1: 0.4996
 epoch: 70, train_loss: 0.6696, test_loss: 1.3116, test_f1: 0.4987
 epoch: 71, train_loss: 0.6659, test_loss: 1.3400, test_f1: 0.5110
 epoch: 72, train_loss: 0.6556, test_loss: 1.3342, test_f1: 0.5028
 epoch: 73, train_loss: 0.6445, test_loss: 1.3676, test_f1: 0.5191
 epoch: 74, train_loss: 0.6489, test_loss: 1.3884, test_f1: 0.5039
 epoch: 75, train_loss: 0.6422, test_loss: 1.3392, test_f1: 0.5016
 epoch: 76, train_loss: 0.6443, test_loss: 1.3292, test_f1: 0.5075
 epoch: 77, train_loss: 0.6355, test_loss: 1.3502, test_f1: 0.5162
 epoch: 78, train_loss: 0.6339, test_loss: 1.3740, test_f1: 0.5189
 epoch: 79, train_loss: 0.6187, test_loss: 1.4029, test_f1: 0.5181
 epoch: 80, train_loss: 0.6290, test_loss: 1.3741, test_f1: 0.5127
 epoch: 81, train_loss: 0.6225, test_loss: 1.3464, test_f1: 0.5068
 epoch: 82, train_loss: 0.6093, test_loss: 1.3875, test_f1: 0.5087
 epoch: 83, train_loss: 0.6220, test_loss: 1.3451, test_f1: 0.5004
 epoch: 84, train_loss: 0.6096, test_loss: 1.3792, test_f1: 0.5101
 epoch: 85, train_loss: 0.6058, test_loss: 1.4229, test_f1: 0.5093
 epoch: 86, train_loss: 0.5962, test_loss: 1.4101, test_f1: 0.5200
 epoch: 87, train_loss: 0.6009, test_loss: 1.4054, test_f1: 0.5091
 epoch: 88, train_loss: 0.6040, test_loss: 1.4116, test_f1: 0.5079
 epoch: 89, train_loss: 0.6058, test_loss: 1.4065, test_f1: 0.5048
 epoch: 90, train_loss: 0.5974, test_loss: 1.4205, test_f1: 0.5122
 epoch: 91, train_loss: 0.5897, test_loss: 1.4333, test_f1: 0.5128
 epoch: 92, train_loss: 0.5875, test_loss: 1.4886, test_f1: 0.5065
 epoch: 93, train_loss: 0.5773, test_loss: 1.4711, test_f1: 0.5137
 epoch: 94, train_loss: 0.5820, test_loss: 1.4497, test_f1: 0.5224
 epoch: 95, train_loss: 0.5930, test_loss: 1.4429, test_f1: 0.5147
 epoch: 96, train_loss: 0.5829, test_loss: 1.3966, test_f1: 0.5067
 epoch: 97, train_loss: 0.5838, test_loss: 1.3938, test_f1: 0.5142
 epoch: 98, train_loss: 0.5844, test_loss: 1.4619, test_f1: 0.5129
 epoch: 99, train_loss: 0.5689, test_loss: 1.4111, test_f1: 0.5172
##################ITERATION #1 ****************************************
 epoch: 0, train_loss: 1.3415, test_loss: 1.3507, test_f1: 0.2274
 epoch: 1, train_loss: 1.2845, test_loss: 1.3180, test_f1: 0.2274
 epoch: 2, train_loss: 1.2576, test_loss: 1.2819, test_f1: 0.2677
 epoch: 3, train_loss: 1.2328, test_loss: 1.2429, test_f1: 0.2981
 epoch: 4, train_loss: 1.2105, test_loss: 1.2039, test_f1: 0.3504
 epoch: 5, train_loss: 1.1892, test_loss: 1.1762, test_f1: 0.4079
 epoch: 6, train_loss: 1.1745, test_loss: 1.1570, test_f1: 0.4179
 epoch: 7, train_loss: 1.1558, test_loss: 1.1418, test_f1: 0.4245
 epoch: 8, train_loss: 1.1395, test_loss: 1.1293, test_f1: 0.4403
 epoch: 9, train_loss: 1.1170, test_loss: 1.1192, test_f1: 0.4436
 epoch: 10, train_loss: 1.1060, test_loss: 1.1057, test_f1: 0.4575
 epoch: 11, train_loss: 1.0897, test_loss: 1.0996, test_f1: 0.4636
 epoch: 12, train_loss: 1.0680, test_loss: 1.0885, test_f1: 0.4716
 epoch: 13, train_loss: 1.0508, test_loss: 1.0754, test_f1: 0.4588
 epoch: 14, train_loss: 1.0361, test_loss: 1.0712, test_f1: 0.4579
 epoch: 15, train_loss: 1.0218, test_loss: 1.0515, test_f1: 0.4704
 epoch: 16, train_loss: 1.0015, test_loss: 1.0554, test_f1: 0.4691
 epoch: 17, train_loss: 0.9918, test_loss: 1.0306, test_f1: 0.4831
 epoch: 18, train_loss: 0.9721, test_loss: 1.0494, test_f1: 0.4670
 epoch: 19, train_loss: 0.9643, test_loss: 1.0334, test_f1: 0.4837
 epoch: 20, train_loss: 0.9382, test_loss: 1.0461, test_f1: 0.4799
 epoch: 21, train_loss: 0.9138, test_loss: 1.0466, test_f1: 0.4770
 epoch: 22, train_loss: 0.9015, test_loss: 1.0630, test_f1: 0.4911
 epoch: 23, train_loss: 0.8977, test_loss: 1.0641, test_f1: 0.4792
 epoch: 24, train_loss: 0.8887, test_loss: 1.0775, test_f1: 0.4691
 epoch: 25, train_loss: 0.8581, test_loss: 1.0526, test_f1: 0.4658
 epoch: 26, train_loss: 0.8500, test_loss: 1.0524, test_f1: 0.5037
 epoch: 27, train_loss: 0.8263, test_loss: 1.1148, test_f1: 0.4838
 epoch: 28, train_loss: 0.8268, test_loss: 1.0848, test_f1: 0.4686
 epoch: 29, train_loss: 0.8041, test_loss: 1.1089, test_f1: 0.4766
 epoch: 30, train_loss: 0.8076, test_loss: 1.0901, test_f1: 0.4841
 epoch: 31, train_loss: 0.7846, test_loss: 1.1252, test_f1: 0.4791
 epoch: 32, train_loss: 0.7807, test_loss: 1.1306, test_f1: 0.4740
 epoch: 33, train_loss: 0.7701, test_loss: 1.1027, test_f1: 0.4834
 epoch: 34, train_loss: 0.7534, test_loss: 1.1396, test_f1: 0.4812
 epoch: 35, train_loss: 0.7550, test_loss: 1.1093, test_f1: 0.5014
 epoch: 36, train_loss: 0.7401, test_loss: 1.1646, test_f1: 0.4843
 epoch: 37, train_loss: 0.7276, test_loss: 1.1775, test_f1: 0.4832
 epoch: 38, train_loss: 0.7215, test_loss: 1.1718, test_f1: 0.4901
 epoch: 39, train_loss: 0.7135, test_loss: 1.1885, test_f1: 0.4834
 epoch: 40, train_loss: 0.6961, test_loss: 1.1884, test_f1: 0.4702
 epoch: 41, train_loss: 0.6989, test_loss: 1.2318, test_f1: 0.5090
 epoch: 42, train_loss: 0.6902, test_loss: 1.2022, test_f1: 0.4990
 epoch: 43, train_loss: 0.6728, test_loss: 1.2061, test_f1: 0.4915
 epoch: 44, train_loss: 0.6657, test_loss: 1.2412, test_f1: 0.4871
 epoch: 45, train_loss: 0.6819, test_loss: 1.2985, test_f1: 0.4837
 epoch: 46, train_loss: 0.6749, test_loss: 1.2322, test_f1: 0.4871
 epoch: 47, train_loss: 0.6636, test_loss: 1.3078, test_f1: 0.4953
 epoch: 48, train_loss: 0.6625, test_loss: 1.3121, test_f1: 0.4984
 epoch: 49, train_loss: 0.6400, test_loss: 1.2139, test_f1: 0.5094
 epoch: 50, train_loss: 0.6342, test_loss: 1.2753, test_f1: 0.4940
 epoch: 51, train_loss: 0.6123, test_loss: 1.2371, test_f1: 0.5048
 epoch: 52, train_loss: 0.6137, test_loss: 1.2717, test_f1: 0.4983
 epoch: 53, train_loss: 0.6116, test_loss: 1.2864, test_f1: 0.4800
 epoch: 54, train_loss: 0.5977, test_loss: 1.3034, test_f1: 0.5018
 epoch: 55, train_loss: 0.6040, test_loss: 1.3120, test_f1: 0.4833
 epoch: 56, train_loss: 0.5999, test_loss: 1.3159, test_f1: 0.4923
 epoch: 57, train_loss: 0.5926, test_loss: 1.3496, test_f1: 0.4928
 epoch: 58, train_loss: 0.5810, test_loss: 1.3206, test_f1: 0.4965
 epoch: 59, train_loss: 0.5861, test_loss: 1.3297, test_f1: 0.4980
 epoch: 60, train_loss: 0.5774, test_loss: 1.3621, test_f1: 0.4882
 epoch: 61, train_loss: 0.5682, test_loss: 1.3725, test_f1: 0.4989
 epoch: 62, train_loss: 0.5773, test_loss: 1.3738, test_f1: 0.4976
 epoch: 63, train_loss: 0.5600, test_loss: 1.3761, test_f1: 0.4879
 epoch: 64, train_loss: 0.5757, test_loss: 1.3586, test_f1: 0.5002
 epoch: 65, train_loss: 0.5682, test_loss: 1.3824, test_f1: 0.4980
 epoch: 66, train_loss: 0.5627, test_loss: 1.4123, test_f1: 0.4935
 epoch: 67, train_loss: 0.5694, test_loss: 1.4042, test_f1: 0.5035
 epoch: 68, train_loss: 0.5565, test_loss: 1.4023, test_f1: 0.5092
 epoch: 69, train_loss: 0.5593, test_loss: 1.4205, test_f1: 0.5046
 epoch: 70, train_loss: 0.5729, test_loss: 1.3963, test_f1: 0.5048
 epoch: 71, train_loss: 0.5722, test_loss: 1.4089, test_f1: 0.4967
 epoch: 72, train_loss: 0.5502, test_loss: 1.4242, test_f1: 0.4895
 epoch: 73, train_loss: 0.5597, test_loss: 1.4228, test_f1: 0.4963
 epoch: 74, train_loss: 0.5423, test_loss: 1.4218, test_f1: 0.5098
 epoch: 75, train_loss: 0.5486, test_loss: 1.4466, test_f1: 0.5009
 epoch: 76, train_loss: 0.5398, test_loss: 1.4561, test_f1: 0.4949
 epoch: 77, train_loss: 0.5348, test_loss: 1.4097, test_f1: 0.4993
 epoch: 78, train_loss: 0.5309, test_loss: 1.4230, test_f1: 0.5100
 epoch: 79, train_loss: 0.5165, test_loss: 1.4216, test_f1: 0.5150
 epoch: 80, train_loss: 0.5455, test_loss: 1.4815, test_f1: 0.5096
 epoch: 81, train_loss: 0.5250, test_loss: 1.4579, test_f1: 0.4976
 epoch: 82, train_loss: 0.5216, test_loss: 1.4508, test_f1: 0.5044
 epoch: 83, train_loss: 0.5160, test_loss: 1.4685, test_f1: 0.5085
 epoch: 84, train_loss: 0.5145, test_loss: 1.4621, test_f1: 0.5074
 epoch: 85, train_loss: 0.5129, test_loss: 1.4806, test_f1: 0.5027
 epoch: 86, train_loss: 0.5147, test_loss: 1.4729, test_f1: 0.5171
 epoch: 87, train_loss: 0.4997, test_loss: 1.5014, test_f1: 0.4978
 epoch: 88, train_loss: 0.5140, test_loss: 1.4605, test_f1: 0.5053
 epoch: 89, train_loss: 0.4889, test_loss: 1.4623, test_f1: 0.4983
 epoch: 90, train_loss: 0.5098, test_loss: 1.4893, test_f1: 0.4983
 epoch: 91, train_loss: 0.4949, test_loss: 1.5219, test_f1: 0.4893
 epoch: 92, train_loss: 0.4999, test_loss: 1.4944, test_f1: 0.5045
 epoch: 93, train_loss: 0.5084, test_loss: 1.5048, test_f1: 0.5063
 epoch: 94, train_loss: 0.5034, test_loss: 1.5305, test_f1: 0.4898
 epoch: 95, train_loss: 0.4941, test_loss: 1.5044, test_f1: 0.5064
 epoch: 96, train_loss: 0.5008, test_loss: 1.4736, test_f1: 0.4984
 epoch: 97, train_loss: 0.4898, test_loss: 1.5359, test_f1: 0.5002
 epoch: 98, train_loss: 0.4894, test_loss: 1.5300, test_f1: 0.5081
 epoch: 99, train_loss: 0.4960, test_loss: 1.5396, test_f1: 0.5136
##################ITERATION #2 ****************************************
 epoch: 0, train_loss: 1.3447, test_loss: 1.3352, test_f1: 0.2650
 epoch: 1, train_loss: 1.2627, test_loss: 1.2905, test_f1: 0.2858
 epoch: 2, train_loss: 1.2307, test_loss: 1.2413, test_f1: 0.3174
 epoch: 3, train_loss: 1.2095, test_loss: 1.1985, test_f1: 0.4304
 epoch: 4, train_loss: 1.1828, test_loss: 1.1659, test_f1: 0.4483
 epoch: 5, train_loss: 1.1613, test_loss: 1.1465, test_f1: 0.4559
 epoch: 6, train_loss: 1.1442, test_loss: 1.1267, test_f1: 0.4592
 epoch: 7, train_loss: 1.1322, test_loss: 1.1085, test_f1: 0.4667
 epoch: 8, train_loss: 1.1119, test_loss: 1.0948, test_f1: 0.4560
 epoch: 9, train_loss: 1.0990, test_loss: 1.0836, test_f1: 0.4645
 epoch: 10, train_loss: 1.0837, test_loss: 1.0788, test_f1: 0.4485
 epoch: 11, train_loss: 1.0654, test_loss: 1.0647, test_f1: 0.4543
 epoch: 12, train_loss: 1.0441, test_loss: 1.0527, test_f1: 0.4587
 epoch: 13, train_loss: 1.0353, test_loss: 1.0448, test_f1: 0.4584
 epoch: 14, train_loss: 1.0205, test_loss: 1.0319, test_f1: 0.4584
 epoch: 15, train_loss: 1.0072, test_loss: 1.0258, test_f1: 0.4476
 epoch: 16, train_loss: 1.0008, test_loss: 1.0237, test_f1: 0.4651
 epoch: 17, train_loss: 0.9798, test_loss: 1.0213, test_f1: 0.4761
 epoch: 18, train_loss: 0.9644, test_loss: 1.0210, test_f1: 0.4921
 epoch: 19, train_loss: 0.9532, test_loss: 1.0077, test_f1: 0.4760
 epoch: 20, train_loss: 0.9371, test_loss: 1.0374, test_f1: 0.4744
 epoch: 21, train_loss: 0.9311, test_loss: 1.0201, test_f1: 0.4793
 epoch: 22, train_loss: 0.9016, test_loss: 1.0110, test_f1: 0.4894
 epoch: 23, train_loss: 0.8975, test_loss: 1.0198, test_f1: 0.4998
 epoch: 24, train_loss: 0.8836, test_loss: 1.0152, test_f1: 0.4787
 epoch: 25, train_loss: 0.8689, test_loss: 1.0274, test_f1: 0.4848
 epoch: 26, train_loss: 0.8555, test_loss: 1.0435, test_f1: 0.4697
 epoch: 27, train_loss: 0.8536, test_loss: 1.0189, test_f1: 0.5081
 epoch: 28, train_loss: 0.8353, test_loss: 1.0311, test_f1: 0.5037
 epoch: 29, train_loss: 0.8319, test_loss: 1.0070, test_f1: 0.5016
 epoch: 30, train_loss: 0.8281, test_loss: 1.0228, test_f1: 0.4901
 epoch: 31, train_loss: 0.8102, test_loss: 1.0480, test_f1: 0.4998
 epoch: 32, train_loss: 0.8116, test_loss: 1.0493, test_f1: 0.5023
 epoch: 33, train_loss: 0.7821, test_loss: 1.0799, test_f1: 0.5135
 epoch: 34, train_loss: 0.7745, test_loss: 1.0558, test_f1: 0.5166
 epoch: 35, train_loss: 0.7666, test_loss: 1.0517, test_f1: 0.5326
 epoch: 36, train_loss: 0.7594, test_loss: 1.1046, test_f1: 0.5223
 epoch: 37, train_loss: 0.7537, test_loss: 1.0747, test_f1: 0.5053
 epoch: 38, train_loss: 0.7423, test_loss: 1.0965, test_f1: 0.5069
 epoch: 39, train_loss: 0.7349, test_loss: 1.1725, test_f1: 0.4945
 epoch: 40, train_loss: 0.7250, test_loss: 1.1250, test_f1: 0.5375
 epoch: 41, train_loss: 0.7103, test_loss: 1.1015, test_f1: 0.5210
 epoch: 42, train_loss: 0.7127, test_loss: 1.1752, test_f1: 0.5191
 epoch: 43, train_loss: 0.7023, test_loss: 1.1377, test_f1: 0.5309
 epoch: 44, train_loss: 0.6953, test_loss: 1.1518, test_f1: 0.5324
 epoch: 45, train_loss: 0.6922, test_loss: 1.1350, test_f1: 0.5321
 epoch: 46, train_loss: 0.6991, test_loss: 1.1711, test_f1: 0.5178
 epoch: 47, train_loss: 0.6797, test_loss: 1.1383, test_f1: 0.5191
 epoch: 48, train_loss: 0.6825, test_loss: 1.1884, test_f1: 0.5266
 epoch: 49, train_loss: 0.6550, test_loss: 1.2089, test_f1: 0.5125
 epoch: 50, train_loss: 0.6581, test_loss: 1.2593, test_f1: 0.5023
 epoch: 51, train_loss: 0.6464, test_loss: 1.2577, test_f1: 0.5067
 epoch: 52, train_loss: 0.6347, test_loss: 1.2713, test_f1: 0.5236
 epoch: 53, train_loss: 0.6271, test_loss: 1.2650, test_f1: 0.5116
 epoch: 54, train_loss: 0.6237, test_loss: 1.2394, test_f1: 0.5106
 epoch: 55, train_loss: 0.6104, test_loss: 1.2464, test_f1: 0.5111
 epoch: 56, train_loss: 0.6215, test_loss: 1.3059, test_f1: 0.4997
 epoch: 57, train_loss: 0.6097, test_loss: 1.2315, test_f1: 0.5026
 epoch: 58, train_loss: 0.6086, test_loss: 1.2510, test_f1: 0.5170
 epoch: 59, train_loss: 0.6137, test_loss: 1.2920, test_f1: 0.5293
 epoch: 60, train_loss: 0.6019, test_loss: 1.3165, test_f1: 0.5193
 epoch: 61, train_loss: 0.5932, test_loss: 1.3398, test_f1: 0.5091
 epoch: 62, train_loss: 0.5922, test_loss: 1.2912, test_f1: 0.5096
 epoch: 63, train_loss: 0.6029, test_loss: 1.3165, test_f1: 0.5232
 epoch: 64, train_loss: 0.5861, test_loss: 1.2940, test_f1: 0.5226
 epoch: 65, train_loss: 0.5700, test_loss: 1.2923, test_f1: 0.5270
 epoch: 66, train_loss: 0.5886, test_loss: 1.3285, test_f1: 0.5272
 epoch: 67, train_loss: 0.5767, test_loss: 1.3160, test_f1: 0.5352
 epoch: 68, train_loss: 0.5785, test_loss: 1.3397, test_f1: 0.5361
 epoch: 69, train_loss: 0.5654, test_loss: 1.3499, test_f1: 0.5342
 epoch: 70, train_loss: 0.5669, test_loss: 1.3010, test_f1: 0.5322
 epoch: 71, train_loss: 0.5653, test_loss: 1.3509, test_f1: 0.5218
 epoch: 72, train_loss: 0.5560, test_loss: 1.3447, test_f1: 0.5400
 epoch: 73, train_loss: 0.5619, test_loss: 1.3666, test_f1: 0.5229
 epoch: 74, train_loss: 0.5590, test_loss: 1.3117, test_f1: 0.5368
 epoch: 75, train_loss: 0.5687, test_loss: 1.3457, test_f1: 0.5425
 epoch: 76, train_loss: 0.5512, test_loss: 1.3637, test_f1: 0.5302
 epoch: 77, train_loss: 0.5493, test_loss: 1.3101, test_f1: 0.5383
 epoch: 78, train_loss: 0.5552, test_loss: 1.3629, test_f1: 0.5367
 epoch: 79, train_loss: 0.5470, test_loss: 1.3343, test_f1: 0.5307
 epoch: 80, train_loss: 0.5592, test_loss: 1.3930, test_f1: 0.5334
 epoch: 81, train_loss: 0.5387, test_loss: 1.3925, test_f1: 0.5344
 epoch: 82, train_loss: 0.5549, test_loss: 1.3335, test_f1: 0.5359
 epoch: 83, train_loss: 0.5419, test_loss: 1.3737, test_f1: 0.5343
 epoch: 84, train_loss: 0.5359, test_loss: 1.3717, test_f1: 0.5381
 epoch: 85, train_loss: 0.5313, test_loss: 1.3578, test_f1: 0.5445
 epoch: 86, train_loss: 0.5273, test_loss: 1.3671, test_f1: 0.5490
 epoch: 87, train_loss: 0.5157, test_loss: 1.3994, test_f1: 0.5258
 epoch: 88, train_loss: 0.5291, test_loss: 1.3688, test_f1: 0.5334
 epoch: 89, train_loss: 0.5239, test_loss: 1.4232, test_f1: 0.5325
 epoch: 90, train_loss: 0.5007, test_loss: 1.4286, test_f1: 0.5450
 epoch: 91, train_loss: 0.5225, test_loss: 1.4050, test_f1: 0.5254
 epoch: 92, train_loss: 0.5129, test_loss: 1.4579, test_f1: 0.5350
 epoch: 93, train_loss: 0.5228, test_loss: 1.4391, test_f1: 0.5369
 epoch: 94, train_loss: 0.5059, test_loss: 1.4292, test_f1: 0.5330
 epoch: 95, train_loss: 0.5065, test_loss: 1.5040, test_f1: 0.5327
 epoch: 96, train_loss: 0.5154, test_loss: 1.4188, test_f1: 0.5344
 epoch: 97, train_loss: 0.5093, test_loss: 1.4408, test_f1: 0.5176
 epoch: 98, train_loss: 0.5000, test_loss: 1.4567, test_f1: 0.5314
 epoch: 99, train_loss: 0.5067, test_loss: 1.4491, test_f1: 0.5438
##################ITERATION #3 ****************************************
 epoch: 0, train_loss: 1.2897, test_loss: 1.3144, test_f1: 0.2427
 epoch: 1, train_loss: 1.2290, test_loss: 1.2727, test_f1: 0.2760
 epoch: 2, train_loss: 1.2123, test_loss: 1.2321, test_f1: 0.3959
 epoch: 3, train_loss: 1.1862, test_loss: 1.2053, test_f1: 0.3976
 epoch: 4, train_loss: 1.1618, test_loss: 1.1771, test_f1: 0.4050
 epoch: 5, train_loss: 1.1487, test_loss: 1.1462, test_f1: 0.4199
 epoch: 6, train_loss: 1.1320, test_loss: 1.1471, test_f1: 0.4241
 epoch: 7, train_loss: 1.1099, test_loss: 1.1241, test_f1: 0.4271
 epoch: 8, train_loss: 1.0981, test_loss: 1.1070, test_f1: 0.4333
 epoch: 9, train_loss: 1.0826, test_loss: 1.0912, test_f1: 0.4321
 epoch: 10, train_loss: 1.0619, test_loss: 1.0756, test_f1: 0.4610
 epoch: 11, train_loss: 1.0545, test_loss: 1.0685, test_f1: 0.4679
 epoch: 12, train_loss: 1.0299, test_loss: 1.0499, test_f1: 0.4851
 epoch: 13, train_loss: 1.0125, test_loss: 1.0396, test_f1: 0.4834
 epoch: 14, train_loss: 1.0047, test_loss: 1.0344, test_f1: 0.4722
 epoch: 15, train_loss: 0.9860, test_loss: 1.0308, test_f1: 0.4650
 epoch: 16, train_loss: 0.9692, test_loss: 1.0231, test_f1: 0.4715
 epoch: 17, train_loss: 0.9509, test_loss: 1.0259, test_f1: 0.4516
 epoch: 18, train_loss: 0.9400, test_loss: 1.0360, test_f1: 0.4544
 epoch: 19, train_loss: 0.9306, test_loss: 1.0417, test_f1: 0.4568
 epoch: 20, train_loss: 0.9257, test_loss: 1.0300, test_f1: 0.4558
 epoch: 21, train_loss: 0.9168, test_loss: 1.0546, test_f1: 0.4639
 epoch: 22, train_loss: 0.8890, test_loss: 1.0355, test_f1: 0.4632
 epoch: 23, train_loss: 0.8899, test_loss: 1.0376, test_f1: 0.4722
 epoch: 24, train_loss: 0.8786, test_loss: 1.0509, test_f1: 0.4589
 epoch: 25, train_loss: 0.8677, test_loss: 1.0506, test_f1: 0.4750
 epoch: 26, train_loss: 0.8658, test_loss: 1.0449, test_f1: 0.4740
 epoch: 27, train_loss: 0.8456, test_loss: 1.0657, test_f1: 0.4684
 epoch: 28, train_loss: 0.8377, test_loss: 1.0564, test_f1: 0.4822
 epoch: 29, train_loss: 0.8280, test_loss: 1.0522, test_f1: 0.4965
 epoch: 30, train_loss: 0.8125, test_loss: 1.0498, test_f1: 0.4991
 epoch: 31, train_loss: 0.7991, test_loss: 1.0711, test_f1: 0.4954
 epoch: 32, train_loss: 0.7936, test_loss: 1.0910, test_f1: 0.4866
 epoch: 33, train_loss: 0.7870, test_loss: 1.0549, test_f1: 0.5014
 epoch: 34, train_loss: 0.7799, test_loss: 1.0681, test_f1: 0.5038
 epoch: 35, train_loss: 0.7661, test_loss: 1.0688, test_f1: 0.5107
 epoch: 36, train_loss: 0.7586, test_loss: 1.1370, test_f1: 0.4990
 epoch: 37, train_loss: 0.7607, test_loss: 1.1225, test_f1: 0.4772
 epoch: 38, train_loss: 0.7443, test_loss: 1.1335, test_f1: 0.4973
 epoch: 39, train_loss: 0.7328, test_loss: 1.1111, test_f1: 0.5011
 epoch: 40, train_loss: 0.7318, test_loss: 1.1382, test_f1: 0.4951
 epoch: 41, train_loss: 0.7284, test_loss: 1.1489, test_f1: 0.4943
 epoch: 42, train_loss: 0.7138, test_loss: 1.1276, test_f1: 0.5043
 epoch: 43, train_loss: 0.7078, test_loss: 1.1149, test_f1: 0.5099
 epoch: 44, train_loss: 0.7071, test_loss: 1.1346, test_f1: 0.5013
 epoch: 45, train_loss: 0.6834, test_loss: 1.2383, test_f1: 0.5016
 epoch: 46, train_loss: 0.6898, test_loss: 1.1459, test_f1: 0.5115
 epoch: 47, train_loss: 0.6795, test_loss: 1.1569, test_f1: 0.4994
 epoch: 48, train_loss: 0.6648, test_loss: 1.1789, test_f1: 0.5100
 epoch: 49, train_loss: 0.6646, test_loss: 1.2056, test_f1: 0.5093
 epoch: 50, train_loss: 0.6579, test_loss: 1.2191, test_f1: 0.5078
 epoch: 51, train_loss: 0.6450, test_loss: 1.1987, test_f1: 0.5225
 epoch: 52, train_loss: 0.6319, test_loss: 1.2006, test_f1: 0.5063
 epoch: 53, train_loss: 0.6217, test_loss: 1.2231, test_f1: 0.5022
 epoch: 54, train_loss: 0.6261, test_loss: 1.1918, test_f1: 0.5178
 epoch: 55, train_loss: 0.6284, test_loss: 1.2415, test_f1: 0.5135
 epoch: 56, train_loss: 0.6048, test_loss: 1.2214, test_f1: 0.5350
 epoch: 57, train_loss: 0.6207, test_loss: 1.2479, test_f1: 0.5351
 epoch: 58, train_loss: 0.6245, test_loss: 1.2318, test_f1: 0.5220
 epoch: 59, train_loss: 0.6078, test_loss: 1.2293, test_f1: 0.5275
 epoch: 60, train_loss: 0.5982, test_loss: 1.2588, test_f1: 0.5106
 epoch: 61, train_loss: 0.5989, test_loss: 1.2594, test_f1: 0.5189
 epoch: 62, train_loss: 0.5917, test_loss: 1.3063, test_f1: 0.5221
 epoch: 63, train_loss: 0.5915, test_loss: 1.2985, test_f1: 0.5222
 epoch: 64, train_loss: 0.6015, test_loss: 1.2596, test_f1: 0.5220
 epoch: 65, train_loss: 0.5862, test_loss: 1.2666, test_f1: 0.5227
 epoch: 66, train_loss: 0.5916, test_loss: 1.3343, test_f1: 0.5370
 epoch: 67, train_loss: 0.5777, test_loss: 1.2970, test_f1: 0.5186
 epoch: 68, train_loss: 0.5877, test_loss: 1.2794, test_f1: 0.5320
 epoch: 69, train_loss: 0.5726, test_loss: 1.3395, test_f1: 0.5186
 epoch: 70, train_loss: 0.5647, test_loss: 1.3369, test_f1: 0.5167
 epoch: 71, train_loss: 0.5652, test_loss: 1.2849, test_f1: 0.5251
 epoch: 72, train_loss: 0.5561, test_loss: 1.2777, test_f1: 0.5196
 epoch: 73, train_loss: 0.5658, test_loss: 1.3028, test_f1: 0.5185
 epoch: 74, train_loss: 0.5437, test_loss: 1.3325, test_f1: 0.5357
 epoch: 75, train_loss: 0.5489, test_loss: 1.3351, test_f1: 0.5344
 epoch: 76, train_loss: 0.5453, test_loss: 1.3413, test_f1: 0.5297
 epoch: 77, train_loss: 0.5444, test_loss: 1.3170, test_f1: 0.5337
 epoch: 78, train_loss: 0.5366, test_loss: 1.3360, test_f1: 0.5181
 epoch: 79, train_loss: 0.5544, test_loss: 1.3638, test_f1: 0.5324
 epoch: 80, train_loss: 0.5266, test_loss: 1.4098, test_f1: 0.5405
 epoch: 81, train_loss: 0.5549, test_loss: 1.3311, test_f1: 0.5323
 epoch: 82, train_loss: 0.5375, test_loss: 1.3504, test_f1: 0.5303
 epoch: 83, train_loss: 0.5405, test_loss: 1.4028, test_f1: 0.5255
 epoch: 84, train_loss: 0.5287, test_loss: 1.4019, test_f1: 0.5375
 epoch: 85, train_loss: 0.5179, test_loss: 1.3812, test_f1: 0.5410
 epoch: 86, train_loss: 0.5163, test_loss: 1.3512, test_f1: 0.5394
 epoch: 87, train_loss: 0.5069, test_loss: 1.3560, test_f1: 0.5397
 epoch: 88, train_loss: 0.5349, test_loss: 1.3989, test_f1: 0.5343
 epoch: 89, train_loss: 0.5212, test_loss: 1.4324, test_f1: 0.5184
 epoch: 90, train_loss: 0.5046, test_loss: 1.4470, test_f1: 0.5455
 epoch: 91, train_loss: 0.4944, test_loss: 1.4629, test_f1: 0.5323
 epoch: 92, train_loss: 0.5179, test_loss: 1.4668, test_f1: 0.5244
 epoch: 93, train_loss: 0.4999, test_loss: 1.5050, test_f1: 0.5325
 epoch: 94, train_loss: 0.4885, test_loss: 1.4599, test_f1: 0.5365
 epoch: 95, train_loss: 0.4972, test_loss: 1.4060, test_f1: 0.5498
 epoch: 96, train_loss: 0.4951, test_loss: 1.4231, test_f1: 0.5330
 epoch: 97, train_loss: 0.5058, test_loss: 1.4483, test_f1: 0.5463
 epoch: 98, train_loss: 0.4990, test_loss: 1.4551, test_f1: 0.5430
 epoch: 99, train_loss: 0.4956, test_loss: 1.4405, test_f1: 0.5471
##################ITERATION #4 ****************************************
 epoch: 0, train_loss: 1.2993, test_loss: 1.3227, test_f1: 0.2274
 epoch: 1, train_loss: 1.2249, test_loss: 1.2660, test_f1: 0.2427
 epoch: 2, train_loss: 1.2023, test_loss: 1.2166, test_f1: 0.3937
 epoch: 3, train_loss: 1.1798, test_loss: 1.1757, test_f1: 0.4231
 epoch: 4, train_loss: 1.1556, test_loss: 1.1516, test_f1: 0.4555
 epoch: 5, train_loss: 1.1495, test_loss: 1.1280, test_f1: 0.4456
 epoch: 6, train_loss: 1.1267, test_loss: 1.1148, test_f1: 0.4425
 epoch: 7, train_loss: 1.1155, test_loss: 1.1007, test_f1: 0.4518
 epoch: 8, train_loss: 1.0965, test_loss: 1.0935, test_f1: 0.4621
 epoch: 9, train_loss: 1.0767, test_loss: 1.0815, test_f1: 0.4506
 epoch: 10, train_loss: 1.0789, test_loss: 1.0757, test_f1: 0.4598
 epoch: 11, train_loss: 1.0524, test_loss: 1.0695, test_f1: 0.4554
 epoch: 12, train_loss: 1.0437, test_loss: 1.0574, test_f1: 0.4689
 epoch: 13, train_loss: 1.0246, test_loss: 1.0513, test_f1: 0.4555
 epoch: 14, train_loss: 1.0229, test_loss: 1.0375, test_f1: 0.4465
 epoch: 15, train_loss: 1.0087, test_loss: 1.0355, test_f1: 0.4446
 epoch: 16, train_loss: 0.9986, test_loss: 1.0479, test_f1: 0.4434
 epoch: 17, train_loss: 0.9855, test_loss: 1.0290, test_f1: 0.4564
 epoch: 18, train_loss: 0.9764, test_loss: 1.0367, test_f1: 0.4429
 epoch: 19, train_loss: 0.9621, test_loss: 1.0289, test_f1: 0.4703
 epoch: 20, train_loss: 0.9505, test_loss: 1.0361, test_f1: 0.4531
 epoch: 21, train_loss: 0.9306, test_loss: 1.0243, test_f1: 0.4580
 epoch: 22, train_loss: 0.9313, test_loss: 1.0343, test_f1: 0.4706
 epoch: 23, train_loss: 0.9150, test_loss: 1.0318, test_f1: 0.4718
 epoch: 24, train_loss: 0.9041, test_loss: 1.0407, test_f1: 0.4710
 epoch: 25, train_loss: 0.8941, test_loss: 1.0532, test_f1: 0.4546
 epoch: 26, train_loss: 0.8879, test_loss: 1.0352, test_f1: 0.4770
 epoch: 27, train_loss: 0.8745, test_loss: 1.0575, test_f1: 0.4645
 epoch: 28, train_loss: 0.8697, test_loss: 1.0510, test_f1: 0.4768
 epoch: 29, train_loss: 0.8533, test_loss: 1.0832, test_f1: 0.4669
 epoch: 30, train_loss: 0.8435, test_loss: 1.0510, test_f1: 0.4760
 epoch: 31, train_loss: 0.8357, test_loss: 1.0706, test_f1: 0.4725
 epoch: 32, train_loss: 0.8237, test_loss: 1.1029, test_f1: 0.4672
 epoch: 33, train_loss: 0.8320, test_loss: 1.1020, test_f1: 0.4915
 epoch: 34, train_loss: 0.8131, test_loss: 1.0639, test_f1: 0.4785
 epoch: 35, train_loss: 0.8102, test_loss: 1.1220, test_f1: 0.4754
 epoch: 36, train_loss: 0.8036, test_loss: 1.1217, test_f1: 0.4892
 epoch: 37, train_loss: 0.7753, test_loss: 1.1142, test_f1: 0.4817
 epoch: 38, train_loss: 0.7809, test_loss: 1.1515, test_f1: 0.4790
 epoch: 39, train_loss: 0.7703, test_loss: 1.1012, test_f1: 0.5022
 epoch: 40, train_loss: 0.7616, test_loss: 1.2063, test_f1: 0.5051
 epoch: 41, train_loss: 0.7501, test_loss: 1.2050, test_f1: 0.4971
 epoch: 42, train_loss: 0.7591, test_loss: 1.1931, test_f1: 0.4802
 epoch: 43, train_loss: 0.7363, test_loss: 1.3062, test_f1: 0.4860
 epoch: 44, train_loss: 0.7310, test_loss: 1.2021, test_f1: 0.4840
 epoch: 45, train_loss: 0.7379, test_loss: 1.2628, test_f1: 0.5062
 epoch: 46, train_loss: 0.7298, test_loss: 1.2255, test_f1: 0.4904
 epoch: 47, train_loss: 0.7265, test_loss: 1.2837, test_f1: 0.4966
 epoch: 48, train_loss: 0.7078, test_loss: 1.1900, test_f1: 0.5065
 epoch: 49, train_loss: 0.6960, test_loss: 1.2463, test_f1: 0.4927
 epoch: 50, train_loss: 0.6909, test_loss: 1.3016, test_f1: 0.5056
 epoch: 51, train_loss: 0.6766, test_loss: 1.3183, test_f1: 0.4981
 epoch: 52, train_loss: 0.6584, test_loss: 1.2665, test_f1: 0.4981
 epoch: 53, train_loss: 0.6724, test_loss: 1.2944, test_f1: 0.5067
 epoch: 54, train_loss: 0.6716, test_loss: 1.3164, test_f1: 0.4906
 epoch: 55, train_loss: 0.6679, test_loss: 1.2844, test_f1: 0.4875
 epoch: 56, train_loss: 0.6605, test_loss: 1.2823, test_f1: 0.4836
 epoch: 57, train_loss: 0.6585, test_loss: 1.2895, test_f1: 0.4871
 epoch: 58, train_loss: 0.6414, test_loss: 1.3633, test_f1: 0.4854
 epoch: 59, train_loss: 0.6517, test_loss: 1.3235, test_f1: 0.5032
 epoch: 60, train_loss: 0.6521, test_loss: 1.3277, test_f1: 0.4845
 epoch: 61, train_loss: 0.6387, test_loss: 1.3020, test_f1: 0.5010
 epoch: 62, train_loss: 0.6422, test_loss: 1.3495, test_f1: 0.4919
 epoch: 63, train_loss: 0.6364, test_loss: 1.3616, test_f1: 0.4971
 epoch: 64, train_loss: 0.6400, test_loss: 1.2958, test_f1: 0.4986
 epoch: 65, train_loss: 0.6289, test_loss: 1.3667, test_f1: 0.5040
 epoch: 66, train_loss: 0.6286, test_loss: 1.3331, test_f1: 0.4992
 epoch: 67, train_loss: 0.6148, test_loss: 1.3873, test_f1: 0.5042
 epoch: 68, train_loss: 0.6178, test_loss: 1.3765, test_f1: 0.5199
 epoch: 69, train_loss: 0.6109, test_loss: 1.4397, test_f1: 0.4852
 epoch: 70, train_loss: 0.5987, test_loss: 1.3801, test_f1: 0.4931
 epoch: 71, train_loss: 0.6081, test_loss: 1.3558, test_f1: 0.5071
 epoch: 72, train_loss: 0.6038, test_loss: 1.3876, test_f1: 0.5083
 epoch: 73, train_loss: 0.5989, test_loss: 1.3644, test_f1: 0.5158
 epoch: 74, train_loss: 0.6045, test_loss: 1.4584, test_f1: 0.5031
 epoch: 75, train_loss: 0.6044, test_loss: 1.4856, test_f1: 0.5016
 epoch: 76, train_loss: 0.5975, test_loss: 1.4631, test_f1: 0.5097
 epoch: 77, train_loss: 0.6032, test_loss: 1.3658, test_f1: 0.5144
 epoch: 78, train_loss: 0.6031, test_loss: 1.4625, test_f1: 0.5053
 epoch: 79, train_loss: 0.5823, test_loss: 1.4856, test_f1: 0.5032
 epoch: 80, train_loss: 0.5885, test_loss: 1.4730, test_f1: 0.5018
 epoch: 81, train_loss: 0.5781, test_loss: 1.4912, test_f1: 0.5019
 epoch: 82, train_loss: 0.5954, test_loss: 1.5362, test_f1: 0.5128
 epoch: 83, train_loss: 0.5910, test_loss: 1.4708, test_f1: 0.5198
 epoch: 84, train_loss: 0.5795, test_loss: 1.4394, test_f1: 0.5218
 epoch: 85, train_loss: 0.5638, test_loss: 1.5669, test_f1: 0.5155
 epoch: 86, train_loss: 0.5568, test_loss: 1.4980, test_f1: 0.4977
 epoch: 87, train_loss: 0.5846, test_loss: 1.4930, test_f1: 0.5002
 epoch: 88, train_loss: 0.5448, test_loss: 1.5091, test_f1: 0.5195
 epoch: 89, train_loss: 0.5494, test_loss: 1.4677, test_f1: 0.5224
 epoch: 90, train_loss: 0.5557, test_loss: 1.4866, test_f1: 0.5140
 epoch: 91, train_loss: 0.5419, test_loss: 1.4914, test_f1: 0.5162
 epoch: 92, train_loss: 0.5639, test_loss: 1.4667, test_f1: 0.5217
 epoch: 93, train_loss: 0.5449, test_loss: 1.5265, test_f1: 0.5235
 epoch: 94, train_loss: 0.5521, test_loss: 1.5289, test_f1: 0.5229
 epoch: 95, train_loss: 0.5510, test_loss: 1.4859, test_f1: 0.5121
 epoch: 96, train_loss: 0.5391, test_loss: 1.4538, test_f1: 0.5311
 epoch: 97, train_loss: 0.5327, test_loss: 1.5302, test_f1: 0.5123
 epoch: 98, train_loss: 0.5369, test_loss: 1.5344, test_f1: 0.5162
 epoch: 99, train_loss: 0.5408, test_loss: 1.4645, test_f1: 0.5183
##################ITERATION #5 ****************************************
 epoch: 0, train_loss: 1.3169, test_loss: 1.3083, test_f1: 0.2602
 epoch: 1, train_loss: 1.2258, test_loss: 1.2682, test_f1: 0.2534
 epoch: 2, train_loss: 1.2010, test_loss: 1.2149, test_f1: 0.2832
 epoch: 3, train_loss: 1.1748, test_loss: 1.1751, test_f1: 0.3708
 epoch: 4, train_loss: 1.1605, test_loss: 1.1421, test_f1: 0.4401
 epoch: 5, train_loss: 1.1397, test_loss: 1.1224, test_f1: 0.4258
 epoch: 6, train_loss: 1.1285, test_loss: 1.1094, test_f1: 0.4447
 epoch: 7, train_loss: 1.1150, test_loss: 1.1092, test_f1: 0.4343
 epoch: 8, train_loss: 1.1052, test_loss: 1.1035, test_f1: 0.4213
 epoch: 9, train_loss: 1.0927, test_loss: 1.0899, test_f1: 0.4210
 epoch: 10, train_loss: 1.0744, test_loss: 1.0796, test_f1: 0.4433
 epoch: 11, train_loss: 1.0725, test_loss: 1.0697, test_f1: 0.4489
 epoch: 12, train_loss: 1.0553, test_loss: 1.0710, test_f1: 0.4540
 epoch: 13, train_loss: 1.0398, test_loss: 1.0613, test_f1: 0.4593
 epoch: 14, train_loss: 1.0360, test_loss: 1.0560, test_f1: 0.4623
 epoch: 15, train_loss: 1.0256, test_loss: 1.0368, test_f1: 0.4628
 epoch: 16, train_loss: 1.0067, test_loss: 1.0459, test_f1: 0.4516
 epoch: 17, train_loss: 0.9988, test_loss: 1.0411, test_f1: 0.4577
 epoch: 18, train_loss: 0.9824, test_loss: 1.0416, test_f1: 0.4548
 epoch: 19, train_loss: 0.9696, test_loss: 1.0339, test_f1: 0.4723
 epoch: 20, train_loss: 0.9638, test_loss: 1.0339, test_f1: 0.4643
 epoch: 21, train_loss: 0.9452, test_loss: 1.0332, test_f1: 0.4672
 epoch: 22, train_loss: 0.9300, test_loss: 1.0162, test_f1: 0.4607
 epoch: 23, train_loss: 0.9270, test_loss: 1.0472, test_f1: 0.4801
 epoch: 24, train_loss: 0.9116, test_loss: 1.0457, test_f1: 0.4698
 epoch: 25, train_loss: 0.9035, test_loss: 1.0516, test_f1: 0.4619
 epoch: 26, train_loss: 0.8979, test_loss: 1.0486, test_f1: 0.4809
 epoch: 27, train_loss: 0.8844, test_loss: 1.0625, test_f1: 0.4750
 epoch: 28, train_loss: 0.8753, test_loss: 1.0710, test_f1: 0.4806
 epoch: 29, train_loss: 0.8617, test_loss: 1.1430, test_f1: 0.4760
 epoch: 30, train_loss: 0.8567, test_loss: 1.0827, test_f1: 0.4704
 epoch: 31, train_loss: 0.8499, test_loss: 1.0853, test_f1: 0.4750
 epoch: 32, train_loss: 0.8341, test_loss: 1.0820, test_f1: 0.4692
 epoch: 33, train_loss: 0.8160, test_loss: 1.2370, test_f1: 0.4789
 epoch: 34, train_loss: 0.8179, test_loss: 1.2753, test_f1: 0.4843
 epoch: 35, train_loss: 0.8115, test_loss: 1.1723, test_f1: 0.4664
 epoch: 36, train_loss: 0.8104, test_loss: 1.0985, test_f1: 0.4910
 epoch: 37, train_loss: 0.7851, test_loss: 1.1086, test_f1: 0.4821
 epoch: 38, train_loss: 0.7861, test_loss: 1.2291, test_f1: 0.4984
 epoch: 39, train_loss: 0.7836, test_loss: 1.1870, test_f1: 0.4867
 epoch: 40, train_loss: 0.7705, test_loss: 1.1650, test_f1: 0.4883
 epoch: 41, train_loss: 0.7598, test_loss: 1.1321, test_f1: 0.4778
 epoch: 42, train_loss: 0.7504, test_loss: 1.1394, test_f1: 0.4991
 epoch: 43, train_loss: 0.7321, test_loss: 1.1505, test_f1: 0.4831
 epoch: 44, train_loss: 0.7573, test_loss: 1.1757, test_f1: 0.4812
 epoch: 45, train_loss: 0.7400, test_loss: 1.1608, test_f1: 0.4783
 epoch: 46, train_loss: 0.7253, test_loss: 1.1608, test_f1: 0.4929
 epoch: 47, train_loss: 0.7291, test_loss: 1.1738, test_f1: 0.5033
 epoch: 48, train_loss: 0.6951, test_loss: 1.2250, test_f1: 0.4864
 epoch: 49, train_loss: 0.7133, test_loss: 1.2327, test_f1: 0.4908
 epoch: 50, train_loss: 0.6945, test_loss: 1.1804, test_f1: 0.4920
 epoch: 51, train_loss: 0.6661, test_loss: 1.2124, test_f1: 0.4846
 epoch: 52, train_loss: 0.6758, test_loss: 1.2265, test_f1: 0.4943
 epoch: 53, train_loss: 0.6808, test_loss: 1.2396, test_f1: 0.4850
 epoch: 54, train_loss: 0.6688, test_loss: 1.2560, test_f1: 0.4815
 epoch: 55, train_loss: 0.6712, test_loss: 1.2355, test_f1: 0.5099
 epoch: 56, train_loss: 0.6549, test_loss: 1.3034, test_f1: 0.4807
 epoch: 57, train_loss: 0.6395, test_loss: 1.3115, test_f1: 0.4645
 epoch: 58, train_loss: 0.6465, test_loss: 1.2887, test_f1: 0.4743
 epoch: 59, train_loss: 0.6452, test_loss: 1.2630, test_f1: 0.4932
 epoch: 60, train_loss: 0.6377, test_loss: 1.2714, test_f1: 0.4772
 epoch: 61, train_loss: 0.6517, test_loss: 1.2427, test_f1: 0.4897
 epoch: 62, train_loss: 0.6392, test_loss: 1.2424, test_f1: 0.4942
 epoch: 63, train_loss: 0.6481, test_loss: 1.2976, test_f1: 0.4889
 epoch: 64, train_loss: 0.6339, test_loss: 1.3576, test_f1: 0.4922
 epoch: 65, train_loss: 0.6370, test_loss: 1.3411, test_f1: 0.4894
 epoch: 66, train_loss: 0.6269, test_loss: 1.3363, test_f1: 0.4948
 epoch: 67, train_loss: 0.6241, test_loss: 1.3531, test_f1: 0.4871
 epoch: 68, train_loss: 0.6205, test_loss: 1.3617, test_f1: 0.4731
 epoch: 69, train_loss: 0.6224, test_loss: 1.3338, test_f1: 0.4833
 epoch: 70, train_loss: 0.6109, test_loss: 1.3503, test_f1: 0.4878
 epoch: 71, train_loss: 0.6153, test_loss: 1.3191, test_f1: 0.4941
 epoch: 72, train_loss: 0.6165, test_loss: 1.3016, test_f1: 0.4973
 epoch: 73, train_loss: 0.6080, test_loss: 1.3278, test_f1: 0.5091
 epoch: 74, train_loss: 0.5924, test_loss: 1.3200, test_f1: 0.4930
 epoch: 75, train_loss: 0.5879, test_loss: 1.3021, test_f1: 0.4993
 epoch: 76, train_loss: 0.5963, test_loss: 1.3403, test_f1: 0.5081
 epoch: 77, train_loss: 0.5699, test_loss: 1.3690, test_f1: 0.4857
 epoch: 78, train_loss: 0.5880, test_loss: 1.3754, test_f1: 0.4816
 epoch: 79, train_loss: 0.5829, test_loss: 1.4171, test_f1: 0.4842
 epoch: 80, train_loss: 0.5920, test_loss: 1.3754, test_f1: 0.5002
 epoch: 81, train_loss: 0.5782, test_loss: 1.3953, test_f1: 0.5053
 epoch: 82, train_loss: 0.5889, test_loss: 1.4130, test_f1: 0.4877
 epoch: 83, train_loss: 0.5764, test_loss: 1.4304, test_f1: 0.4827
 epoch: 84, train_loss: 0.5902, test_loss: 1.3507, test_f1: 0.5126
 epoch: 85, train_loss: 0.5665, test_loss: 1.4806, test_f1: 0.4867
 epoch: 86, train_loss: 0.5619, test_loss: 1.4699, test_f1: 0.4870
 epoch: 87, train_loss: 0.5678, test_loss: 1.4442, test_f1: 0.4959
 epoch: 88, train_loss: 0.5699, test_loss: 1.4283, test_f1: 0.4984
 epoch: 89, train_loss: 0.5552, test_loss: 1.4206, test_f1: 0.5000
 epoch: 90, train_loss: 0.5448, test_loss: 1.4048, test_f1: 0.4916
 epoch: 91, train_loss: 0.5374, test_loss: 1.3926, test_f1: 0.4971
 epoch: 92, train_loss: 0.5492, test_loss: 1.3736, test_f1: 0.5165
 epoch: 93, train_loss: 0.5472, test_loss: 1.3674, test_f1: 0.5239
 epoch: 94, train_loss: 0.5551, test_loss: 1.4258, test_f1: 0.4869
 epoch: 95, train_loss: 0.5329, test_loss: 1.3917, test_f1: 0.5073
 epoch: 96, train_loss: 0.5438, test_loss: 1.4090, test_f1: 0.5065
 epoch: 97, train_loss: 0.5356, test_loss: 1.4790, test_f1: 0.4836
 epoch: 98, train_loss: 0.5413, test_loss: 1.4904, test_f1: 0.4846
 epoch: 99, train_loss: 0.5429, test_loss: 1.4697, test_f1: 0.4802
##################ITERATION #6 ****************************************
 epoch: 0, train_loss: 1.3199, test_loss: 1.3132, test_f1: 0.2729
 epoch: 1, train_loss: 1.2113, test_loss: 1.2426, test_f1: 0.4161
 epoch: 2, train_loss: 1.1831, test_loss: 1.1777, test_f1: 0.4570
 epoch: 3, train_loss: 1.1504, test_loss: 1.1375, test_f1: 0.4375
 epoch: 4, train_loss: 1.1412, test_loss: 1.1215, test_f1: 0.4503
 epoch: 5, train_loss: 1.1172, test_loss: 1.1008, test_f1: 0.4643
 epoch: 6, train_loss: 1.1054, test_loss: 1.0845, test_f1: 0.4656
 epoch: 7, train_loss: 1.0907, test_loss: 1.0705, test_f1: 0.4595
 epoch: 8, train_loss: 1.0737, test_loss: 1.0586, test_f1: 0.4734
 epoch: 9, train_loss: 1.0680, test_loss: 1.0587, test_f1: 0.4664
 epoch: 10, train_loss: 1.0514, test_loss: 1.0535, test_f1: 0.4614
 epoch: 11, train_loss: 1.0315, test_loss: 1.0381, test_f1: 0.4649
 epoch: 12, train_loss: 1.0226, test_loss: 1.0426, test_f1: 0.4571
 epoch: 13, train_loss: 1.0072, test_loss: 1.0303, test_f1: 0.4664
 epoch: 14, train_loss: 1.0044, test_loss: 1.0361, test_f1: 0.4725
 epoch: 15, train_loss: 0.9912, test_loss: 1.0382, test_f1: 0.4518
 epoch: 16, train_loss: 0.9817, test_loss: 1.0347, test_f1: 0.4630
 epoch: 17, train_loss: 0.9777, test_loss: 1.0272, test_f1: 0.4666
 epoch: 18, train_loss: 0.9738, test_loss: 1.0265, test_f1: 0.4749
 epoch: 19, train_loss: 0.9502, test_loss: 1.0329, test_f1: 0.4574
 epoch: 20, train_loss: 0.9475, test_loss: 1.0481, test_f1: 0.4576
 epoch: 21, train_loss: 0.9381, test_loss: 1.0401, test_f1: 0.4632
 epoch: 22, train_loss: 0.9171, test_loss: 1.0475, test_f1: 0.4688
 epoch: 23, train_loss: 0.9185, test_loss: 1.0261, test_f1: 0.4855
 epoch: 24, train_loss: 0.9092, test_loss: 1.0462, test_f1: 0.4769
 epoch: 25, train_loss: 0.9099, test_loss: 1.0327, test_f1: 0.4790
 epoch: 26, train_loss: 0.8881, test_loss: 1.0422, test_f1: 0.4785
 epoch: 27, train_loss: 0.8721, test_loss: 1.0428, test_f1: 0.4744
 epoch: 28, train_loss: 0.8724, test_loss: 1.0340, test_f1: 0.4888
 epoch: 29, train_loss: 0.8685, test_loss: 1.0631, test_f1: 0.4631
 epoch: 30, train_loss: 0.8510, test_loss: 1.0518, test_f1: 0.4826
 epoch: 31, train_loss: 0.8520, test_loss: 1.0576, test_f1: 0.4929
 epoch: 32, train_loss: 0.8409, test_loss: 1.0790, test_f1: 0.4912
 epoch: 33, train_loss: 0.8358, test_loss: 1.0460, test_f1: 0.5047
 epoch: 34, train_loss: 0.8268, test_loss: 1.0879, test_f1: 0.4860
 epoch: 35, train_loss: 0.8070, test_loss: 1.0845, test_f1: 0.4885
 epoch: 36, train_loss: 0.8119, test_loss: 1.0759, test_f1: 0.4910
 epoch: 37, train_loss: 0.8122, test_loss: 1.1185, test_f1: 0.4859
 epoch: 38, train_loss: 0.7946, test_loss: 1.1004, test_f1: 0.4937
 epoch: 39, train_loss: 0.7780, test_loss: 1.0971, test_f1: 0.4826
 epoch: 40, train_loss: 0.7699, test_loss: 1.1008, test_f1: 0.5020
 epoch: 41, train_loss: 0.7639, test_loss: 1.1253, test_f1: 0.4976
 epoch: 42, train_loss: 0.7679, test_loss: 1.1366, test_f1: 0.5088
 epoch: 43, train_loss: 0.7515, test_loss: 1.1352, test_f1: 0.5101
 epoch: 44, train_loss: 0.7393, test_loss: 1.1627, test_f1: 0.4969
 epoch: 45, train_loss: 0.7307, test_loss: 1.1693, test_f1: 0.5126
 epoch: 46, train_loss: 0.7342, test_loss: 1.1532, test_f1: 0.4926
 epoch: 47, train_loss: 0.7227, test_loss: 1.1532, test_f1: 0.5179
 epoch: 48, train_loss: 0.7142, test_loss: 1.1885, test_f1: 0.5310
 epoch: 49, train_loss: 0.7168, test_loss: 1.2103, test_f1: 0.5311
 epoch: 50, train_loss: 0.6972, test_loss: 1.1864, test_f1: 0.5238
 epoch: 51, train_loss: 0.6840, test_loss: 1.1724, test_f1: 0.5341
 epoch: 52, train_loss: 0.6924, test_loss: 1.2178, test_f1: 0.5257
 epoch: 53, train_loss: 0.6784, test_loss: 1.2324, test_f1: 0.5242
 epoch: 54, train_loss: 0.6714, test_loss: 1.2284, test_f1: 0.5274
 epoch: 55, train_loss: 0.6694, test_loss: 1.2467, test_f1: 0.5453
 epoch: 56, train_loss: 0.6619, test_loss: 1.2384, test_f1: 0.5259
 epoch: 57, train_loss: 0.6574, test_loss: 1.2504, test_f1: 0.5328
 epoch: 58, train_loss: 0.6582, test_loss: 1.2538, test_f1: 0.5237
 epoch: 59, train_loss: 0.6508, test_loss: 1.2620, test_f1: 0.5306
 epoch: 60, train_loss: 0.6414, test_loss: 1.2751, test_f1: 0.5245
 epoch: 61, train_loss: 0.6414, test_loss: 1.2731, test_f1: 0.5307
 epoch: 62, train_loss: 0.6431, test_loss: 1.2656, test_f1: 0.5263
 epoch: 63, train_loss: 0.6420, test_loss: 1.2799, test_f1: 0.5337
 epoch: 64, train_loss: 0.6378, test_loss: 1.2912, test_f1: 0.5306
 epoch: 65, train_loss: 0.6327, test_loss: 1.2820, test_f1: 0.5404
 epoch: 66, train_loss: 0.6450, test_loss: 1.2853, test_f1: 0.5334
 epoch: 67, train_loss: 0.6381, test_loss: 1.3221, test_f1: 0.5299
 epoch: 68, train_loss: 0.6259, test_loss: 1.2807, test_f1: 0.5364
 epoch: 69, train_loss: 0.6227, test_loss: 1.2851, test_f1: 0.5331
 epoch: 70, train_loss: 0.6206, test_loss: 1.2984, test_f1: 0.5340
 epoch: 71, train_loss: 0.6336, test_loss: 1.3071, test_f1: 0.5348
 epoch: 72, train_loss: 0.6238, test_loss: 1.3268, test_f1: 0.5240
 epoch: 73, train_loss: 0.6032, test_loss: 1.3012, test_f1: 0.5318
 epoch: 74, train_loss: 0.6179, test_loss: 1.3294, test_f1: 0.5327
 epoch: 75, train_loss: 0.6124, test_loss: 1.3437, test_f1: 0.5300
 epoch: 76, train_loss: 0.5971, test_loss: 1.3263, test_f1: 0.5374
 epoch: 77, train_loss: 0.5825, test_loss: 1.3590, test_f1: 0.5241
 epoch: 78, train_loss: 0.5879, test_loss: 1.3389, test_f1: 0.5249
 epoch: 79, train_loss: 0.5934, test_loss: 1.3502, test_f1: 0.5276
 epoch: 80, train_loss: 0.5919, test_loss: 1.3569, test_f1: 0.5199
 epoch: 81, train_loss: 0.5843, test_loss: 1.3664, test_f1: 0.5283
 epoch: 82, train_loss: 0.5692, test_loss: 1.3716, test_f1: 0.5260
 epoch: 83, train_loss: 0.5745, test_loss: 1.3816, test_f1: 0.5359
 epoch: 84, train_loss: 0.5643, test_loss: 1.3722, test_f1: 0.5259
 epoch: 85, train_loss: 0.5593, test_loss: 1.3720, test_f1: 0.5411
 epoch: 86, train_loss: 0.5707, test_loss: 1.3818, test_f1: 0.5267
 epoch: 87, train_loss: 0.5564, test_loss: 1.4198, test_f1: 0.5232
 epoch: 88, train_loss: 0.5654, test_loss: 1.4130, test_f1: 0.5240
 epoch: 89, train_loss: 0.5467, test_loss: 1.4047, test_f1: 0.5241
 epoch: 90, train_loss: 0.5626, test_loss: 1.4220, test_f1: 0.5376
 epoch: 91, train_loss: 0.5570, test_loss: 1.4179, test_f1: 0.5276
 epoch: 92, train_loss: 0.5486, test_loss: 1.4140, test_f1: 0.5302
 epoch: 93, train_loss: 0.5461, test_loss: 1.4398, test_f1: 0.5166
 epoch: 94, train_loss: 0.5531, test_loss: 1.4426, test_f1: 0.5390
 epoch: 95, train_loss: 0.5517, test_loss: 1.4679, test_f1: 0.5127
 epoch: 96, train_loss: 0.5395, test_loss: 1.4516, test_f1: 0.5363
 epoch: 97, train_loss: 0.5513, test_loss: 1.4813, test_f1: 0.5177
 epoch: 98, train_loss: 0.5473, test_loss: 1.4441, test_f1: 0.5372
 epoch: 99, train_loss: 0.5407, test_loss: 1.4418, test_f1: 0.5372
##################ITERATION #7 ****************************************
 epoch: 0, train_loss: 1.3163, test_loss: 1.3128, test_f1: 0.2438
 epoch: 1, train_loss: 1.2269, test_loss: 1.2652, test_f1: 0.2982
 epoch: 2, train_loss: 1.2011, test_loss: 1.2030, test_f1: 0.3922
 epoch: 3, train_loss: 1.1734, test_loss: 1.1458, test_f1: 0.4554
 epoch: 4, train_loss: 1.1466, test_loss: 1.1160, test_f1: 0.4782
 epoch: 5, train_loss: 1.1356, test_loss: 1.0960, test_f1: 0.4586
 epoch: 6, train_loss: 1.1044, test_loss: 1.0886, test_f1: 0.4669
 epoch: 7, train_loss: 1.1098, test_loss: 1.0839, test_f1: 0.4706
 epoch: 8, train_loss: 1.0793, test_loss: 1.0655, test_f1: 0.4571
 epoch: 9, train_loss: 1.0677, test_loss: 1.0569, test_f1: 0.4812
 epoch: 10, train_loss: 1.0588, test_loss: 1.0503, test_f1: 0.4813
 epoch: 11, train_loss: 1.0581, test_loss: 1.0497, test_f1: 0.4493
 epoch: 12, train_loss: 1.0332, test_loss: 1.0452, test_f1: 0.4647
 epoch: 13, train_loss: 1.0093, test_loss: 1.0386, test_f1: 0.4599
 epoch: 14, train_loss: 1.0089, test_loss: 1.0353, test_f1: 0.4600
 epoch: 15, train_loss: 1.0035, test_loss: 1.0223, test_f1: 0.4709
 epoch: 16, train_loss: 0.9925, test_loss: 1.0329, test_f1: 0.4653
 epoch: 17, train_loss: 0.9739, test_loss: 1.0357, test_f1: 0.4581
 epoch: 18, train_loss: 0.9675, test_loss: 1.0303, test_f1: 0.4735
 epoch: 19, train_loss: 0.9655, test_loss: 1.0263, test_f1: 0.4790
 epoch: 20, train_loss: 0.9493, test_loss: 1.0332, test_f1: 0.4689
 epoch: 21, train_loss: 0.9397, test_loss: 1.0259, test_f1: 0.4789
 epoch: 22, train_loss: 0.9324, test_loss: 1.0255, test_f1: 0.4705
 epoch: 23, train_loss: 0.9238, test_loss: 1.0075, test_f1: 0.4837
 epoch: 24, train_loss: 0.9029, test_loss: 1.0383, test_f1: 0.4651
 epoch: 25, train_loss: 0.8901, test_loss: 1.0274, test_f1: 0.4898
 epoch: 26, train_loss: 0.8872, test_loss: 1.0520, test_f1: 0.4747
 epoch: 27, train_loss: 0.8793, test_loss: 1.0386, test_f1: 0.4877
 epoch: 28, train_loss: 0.8714, test_loss: 1.0117, test_f1: 0.5115
 epoch: 29, train_loss: 0.8587, test_loss: 1.0167, test_f1: 0.5091
 epoch: 30, train_loss: 0.8584, test_loss: 1.0495, test_f1: 0.5065
 epoch: 31, train_loss: 0.8387, test_loss: 1.0385, test_f1: 0.4991
 epoch: 32, train_loss: 0.8336, test_loss: 1.0511, test_f1: 0.5086
 epoch: 33, train_loss: 0.8236, test_loss: 1.0416, test_f1: 0.4944
 epoch: 34, train_loss: 0.8121, test_loss: 1.0639, test_f1: 0.5076
 epoch: 35, train_loss: 0.8001, test_loss: 1.0993, test_f1: 0.5158
 epoch: 36, train_loss: 0.8134, test_loss: 1.0350, test_f1: 0.4885
 epoch: 37, train_loss: 0.7943, test_loss: 1.0486, test_f1: 0.5085
 epoch: 38, train_loss: 0.7936, test_loss: 1.0942, test_f1: 0.5194
 epoch: 39, train_loss: 0.7706, test_loss: 1.0965, test_f1: 0.5110
 epoch: 40, train_loss: 0.7591, test_loss: 1.0819, test_f1: 0.5224
 epoch: 41, train_loss: 0.7629, test_loss: 1.0764, test_f1: 0.5198
 epoch: 42, train_loss: 0.7602, test_loss: 1.0999, test_f1: 0.5147
 epoch: 43, train_loss: 0.7385, test_loss: 1.0814, test_f1: 0.5186
 epoch: 44, train_loss: 0.7378, test_loss: 1.0840, test_f1: 0.5047
 epoch: 45, train_loss: 0.7393, test_loss: 1.1517, test_f1: 0.5003
 epoch: 46, train_loss: 0.7231, test_loss: 1.0949, test_f1: 0.5088
 epoch: 47, train_loss: 0.7134, test_loss: 1.1242, test_f1: 0.5289
 epoch: 48, train_loss: 0.7142, test_loss: 1.1254, test_f1: 0.5490
 epoch: 49, train_loss: 0.7053, test_loss: 1.1000, test_f1: 0.5238
 epoch: 50, train_loss: 0.6825, test_loss: 1.1517, test_f1: 0.5017
 epoch: 51, train_loss: 0.6719, test_loss: 1.1560, test_f1: 0.5204
 epoch: 52, train_loss: 0.6872, test_loss: 1.1807, test_f1: 0.5220
 epoch: 53, train_loss: 0.6674, test_loss: 1.1593, test_f1: 0.5055
 epoch: 54, train_loss: 0.6459, test_loss: 1.1817, test_f1: 0.5142
 epoch: 55, train_loss: 0.6404, test_loss: 1.1980, test_f1: 0.5113
 epoch: 56, train_loss: 0.6522, test_loss: 1.1816, test_f1: 0.5143
 epoch: 57, train_loss: 0.6377, test_loss: 1.2100, test_f1: 0.5193
 epoch: 58, train_loss: 0.6429, test_loss: 1.2327, test_f1: 0.5063
 epoch: 59, train_loss: 0.6223, test_loss: 1.2333, test_f1: 0.5029
 epoch: 60, train_loss: 0.6275, test_loss: 1.2370, test_f1: 0.5038
 epoch: 61, train_loss: 0.6331, test_loss: 1.2317, test_f1: 0.5034
 epoch: 62, train_loss: 0.6152, test_loss: 1.2520, test_f1: 0.5060
 epoch: 63, train_loss: 0.6354, test_loss: 1.2616, test_f1: 0.5161
 epoch: 64, train_loss: 0.6405, test_loss: 1.2412, test_f1: 0.5045
 epoch: 65, train_loss: 0.6181, test_loss: 1.2527, test_f1: 0.5024
 epoch: 66, train_loss: 0.6139, test_loss: 1.2596, test_f1: 0.4960
 epoch: 67, train_loss: 0.6225, test_loss: 1.2714, test_f1: 0.5122
 epoch: 68, train_loss: 0.6074, test_loss: 1.2528, test_f1: 0.5144
 epoch: 69, train_loss: 0.5949, test_loss: 1.2815, test_f1: 0.5113
 epoch: 70, train_loss: 0.5937, test_loss: 1.2776, test_f1: 0.5125
 epoch: 71, train_loss: 0.6034, test_loss: 1.2753, test_f1: 0.5123
 epoch: 72, train_loss: 0.5897, test_loss: 1.2866, test_f1: 0.5173
 epoch: 73, train_loss: 0.5994, test_loss: 1.3098, test_f1: 0.5294
 epoch: 74, train_loss: 0.5782, test_loss: 1.2782, test_f1: 0.5142
 epoch: 75, train_loss: 0.5919, test_loss: 1.2885, test_f1: 0.5173
 epoch: 76, train_loss: 0.5688, test_loss: 1.2865, test_f1: 0.5325
 epoch: 77, train_loss: 0.5692, test_loss: 1.3038, test_f1: 0.5176
 epoch: 78, train_loss: 0.5772, test_loss: 1.3176, test_f1: 0.5166
 epoch: 79, train_loss: 0.5879, test_loss: 1.3147, test_f1: 0.5286
 epoch: 80, train_loss: 0.5642, test_loss: 1.3232, test_f1: 0.5083
 epoch: 81, train_loss: 0.5743, test_loss: 1.3364, test_f1: 0.4981
 epoch: 82, train_loss: 0.5635, test_loss: 1.3420, test_f1: 0.5232
 epoch: 83, train_loss: 0.5619, test_loss: 1.3651, test_f1: 0.4985
 epoch: 84, train_loss: 0.5494, test_loss: 1.3776, test_f1: 0.5109
 epoch: 85, train_loss: 0.5502, test_loss: 1.3561, test_f1: 0.5091
 epoch: 86, train_loss: 0.5538, test_loss: 1.3750, test_f1: 0.5163
 epoch: 87, train_loss: 0.5477, test_loss: 1.3954, test_f1: 0.5206
 epoch: 88, train_loss: 0.5382, test_loss: 1.3553, test_f1: 0.5310
 epoch: 89, train_loss: 0.5472, test_loss: 1.3763, test_f1: 0.5230
 epoch: 90, train_loss: 0.5565, test_loss: 1.3887, test_f1: 0.5325
 epoch: 91, train_loss: 0.5452, test_loss: 1.3804, test_f1: 0.5138
 epoch: 92, train_loss: 0.5271, test_loss: 1.4373, test_f1: 0.5242
 epoch: 93, train_loss: 0.5415, test_loss: 1.4023, test_f1: 0.5028
 epoch: 94, train_loss: 0.5342, test_loss: 1.4111, test_f1: 0.5122
 epoch: 95, train_loss: 0.5393, test_loss: 1.3741, test_f1: 0.5318
 epoch: 96, train_loss: 0.5369, test_loss: 1.3872, test_f1: 0.5188
 epoch: 97, train_loss: 0.5369, test_loss: 1.4482, test_f1: 0.5012
 epoch: 98, train_loss: 0.5106, test_loss: 1.4285, test_f1: 0.5094
 epoch: 99, train_loss: 0.5297, test_loss: 1.4539, test_f1: 0.5228
##################ITERATION #8 ****************************************
 epoch: 0, train_loss: 1.3644, test_loss: 1.3068, test_f1: 0.2613
 epoch: 1, train_loss: 1.2602, test_loss: 1.2529, test_f1: 0.2444
 epoch: 2, train_loss: 1.2277, test_loss: 1.1944, test_f1: 0.3660
 epoch: 3, train_loss: 1.1978, test_loss: 1.1526, test_f1: 0.4218
 epoch: 4, train_loss: 1.1802, test_loss: 1.1321, test_f1: 0.4306
 epoch: 5, train_loss: 1.1657, test_loss: 1.1170, test_f1: 0.4522
 epoch: 6, train_loss: 1.1334, test_loss: 1.0995, test_f1: 0.4449
 epoch: 7, train_loss: 1.1322, test_loss: 1.0843, test_f1: 0.4658
 epoch: 8, train_loss: 1.1074, test_loss: 1.0761, test_f1: 0.4676
 epoch: 9, train_loss: 1.1031, test_loss: 1.0735, test_f1: 0.4625
 epoch: 10, train_loss: 1.0856, test_loss: 1.0610, test_f1: 0.4794
 epoch: 11, train_loss: 1.0868, test_loss: 1.0567, test_f1: 0.4764
 epoch: 12, train_loss: 1.0619, test_loss: 1.0444, test_f1: 0.5022
 epoch: 13, train_loss: 1.0514, test_loss: 1.0445, test_f1: 0.4815
 epoch: 14, train_loss: 1.0350, test_loss: 1.0361, test_f1: 0.4802
 epoch: 15, train_loss: 1.0330, test_loss: 1.0330, test_f1: 0.4818
 epoch: 16, train_loss: 1.0174, test_loss: 1.0271, test_f1: 0.4782
 epoch: 17, train_loss: 1.0169, test_loss: 1.0220, test_f1: 0.4829
 epoch: 18, train_loss: 1.0167, test_loss: 1.0224, test_f1: 0.4593
 epoch: 19, train_loss: 0.9852, test_loss: 1.0215, test_f1: 0.4770
 epoch: 20, train_loss: 0.9791, test_loss: 1.0147, test_f1: 0.4843
 epoch: 21, train_loss: 0.9820, test_loss: 1.0191, test_f1: 0.4858
 epoch: 22, train_loss: 0.9721, test_loss: 1.0191, test_f1: 0.4754
 epoch: 23, train_loss: 0.9596, test_loss: 1.0280, test_f1: 0.4711
 epoch: 24, train_loss: 0.9484, test_loss: 1.0098, test_f1: 0.4794
 epoch: 25, train_loss: 0.9312, test_loss: 1.0079, test_f1: 0.4959
 epoch: 26, train_loss: 0.9385, test_loss: 1.0159, test_f1: 0.5139
 epoch: 27, train_loss: 0.9236, test_loss: 1.0229, test_f1: 0.4824
 epoch: 28, train_loss: 0.9201, test_loss: 1.0301, test_f1: 0.4787
 epoch: 29, train_loss: 0.9060, test_loss: 1.0418, test_f1: 0.4881
 epoch: 30, train_loss: 0.9076, test_loss: 1.0125, test_f1: 0.4955
 epoch: 31, train_loss: 0.8739, test_loss: 1.0265, test_f1: 0.4980
 epoch: 32, train_loss: 0.8785, test_loss: 1.0408, test_f1: 0.5010
 epoch: 33, train_loss: 0.8794, test_loss: 1.0461, test_f1: 0.4945
 epoch: 34, train_loss: 0.8564, test_loss: 1.0372, test_f1: 0.4863
 epoch: 35, train_loss: 0.8478, test_loss: 1.0316, test_f1: 0.4771
 epoch: 36, train_loss: 0.8371, test_loss: 1.0415, test_f1: 0.4864
 epoch: 37, train_loss: 0.8273, test_loss: 1.0556, test_f1: 0.4991
 epoch: 38, train_loss: 0.8181, test_loss: 1.0684, test_f1: 0.4949
 epoch: 39, train_loss: 0.8297, test_loss: 1.0833, test_f1: 0.4844
 epoch: 40, train_loss: 0.8153, test_loss: 1.0435, test_f1: 0.5009
 epoch: 41, train_loss: 0.8147, test_loss: 1.0765, test_f1: 0.5072
 epoch: 42, train_loss: 0.8102, test_loss: 1.0846, test_f1: 0.4909
 epoch: 43, train_loss: 0.8006, test_loss: 1.0557, test_f1: 0.4867
 epoch: 44, train_loss: 0.7862, test_loss: 1.1034, test_f1: 0.4754
 epoch: 45, train_loss: 0.7846, test_loss: 1.1221, test_f1: 0.4859
 epoch: 46, train_loss: 0.7746, test_loss: 1.1310, test_f1: 0.4705
 epoch: 47, train_loss: 0.7644, test_loss: 1.1234, test_f1: 0.5010
 epoch: 48, train_loss: 0.7547, test_loss: 1.1154, test_f1: 0.5073
 epoch: 49, train_loss: 0.7549, test_loss: 1.1307, test_f1: 0.4973
 epoch: 50, train_loss: 0.7450, test_loss: 1.1585, test_f1: 0.4934
 epoch: 51, train_loss: 0.7266, test_loss: 1.1433, test_f1: 0.5005
 epoch: 52, train_loss: 0.7152, test_loss: 1.1332, test_f1: 0.5075
 epoch: 53, train_loss: 0.7110, test_loss: 1.1523, test_f1: 0.5066
 epoch: 54, train_loss: 0.7089, test_loss: 1.1378, test_f1: 0.5055
 epoch: 55, train_loss: 0.6918, test_loss: 1.1509, test_f1: 0.5162
 epoch: 56, train_loss: 0.7025, test_loss: 1.1495, test_f1: 0.5202
 epoch: 57, train_loss: 0.6944, test_loss: 1.1761, test_f1: 0.5016
 epoch: 58, train_loss: 0.6975, test_loss: 1.1889, test_f1: 0.5160
 epoch: 59, train_loss: 0.6813, test_loss: 1.1768, test_f1: 0.5193
 epoch: 60, train_loss: 0.6729, test_loss: 1.1824, test_f1: 0.5129
 epoch: 61, train_loss: 0.6920, test_loss: 1.1740, test_f1: 0.5093
 epoch: 62, train_loss: 0.6662, test_loss: 1.1884, test_f1: 0.5074
 epoch: 63, train_loss: 0.6805, test_loss: 1.2142, test_f1: 0.5069
 epoch: 64, train_loss: 0.6847, test_loss: 1.2151, test_f1: 0.5064
 epoch: 65, train_loss: 0.6819, test_loss: 1.1902, test_f1: 0.5201
 epoch: 66, train_loss: 0.6540, test_loss: 1.2363, test_f1: 0.5041
 epoch: 67, train_loss: 0.6477, test_loss: 1.2452, test_f1: 0.5019
 epoch: 68, train_loss: 0.6612, test_loss: 1.2257, test_f1: 0.5071
 epoch: 69, train_loss: 0.6620, test_loss: 1.2532, test_f1: 0.5055
 epoch: 70, train_loss: 0.6569, test_loss: 1.2522, test_f1: 0.4902
 epoch: 71, train_loss: 0.6418, test_loss: 1.2402, test_f1: 0.5156
 epoch: 72, train_loss: 0.6438, test_loss: 1.2641, test_f1: 0.4995
 epoch: 73, train_loss: 0.6290, test_loss: 1.3046, test_f1: 0.4958
 epoch: 74, train_loss: 0.6345, test_loss: 1.3181, test_f1: 0.4874
 epoch: 75, train_loss: 0.6343, test_loss: 1.2987, test_f1: 0.4995
 epoch: 76, train_loss: 0.6214, test_loss: 1.3026, test_f1: 0.4976
 epoch: 77, train_loss: 0.6144, test_loss: 1.3322, test_f1: 0.5002
 epoch: 78, train_loss: 0.6337, test_loss: 1.3394, test_f1: 0.5143
 epoch: 79, train_loss: 0.6138, test_loss: 1.3560, test_f1: 0.4920
 epoch: 80, train_loss: 0.6247, test_loss: 1.3321, test_f1: 0.4991
 epoch: 81, train_loss: 0.6108, test_loss: 1.2994, test_f1: 0.5227
 epoch: 82, train_loss: 0.6124, test_loss: 1.3430, test_f1: 0.4821
 epoch: 83, train_loss: 0.6013, test_loss: 1.3315, test_f1: 0.5011
 epoch: 84, train_loss: 0.5964, test_loss: 1.3588, test_f1: 0.4926
 epoch: 85, train_loss: 0.6135, test_loss: 1.3702, test_f1: 0.5003
 epoch: 86, train_loss: 0.6144, test_loss: 1.3644, test_f1: 0.4979
 epoch: 87, train_loss: 0.5888, test_loss: 1.3605, test_f1: 0.4962
 epoch: 88, train_loss: 0.5862, test_loss: 1.3867, test_f1: 0.4835
 epoch: 89, train_loss: 0.5944, test_loss: 1.3753, test_f1: 0.5059
 epoch: 90, train_loss: 0.5918, test_loss: 1.3855, test_f1: 0.4894
 epoch: 91, train_loss: 0.5839, test_loss: 1.3988, test_f1: 0.4925
 epoch: 92, train_loss: 0.5899, test_loss: 1.4026, test_f1: 0.4794
 epoch: 93, train_loss: 0.5781, test_loss: 1.4047, test_f1: 0.5054
 epoch: 94, train_loss: 0.5769, test_loss: 1.4005, test_f1: 0.5038
 epoch: 95, train_loss: 0.5661, test_loss: 1.4539, test_f1: 0.5019
 epoch: 96, train_loss: 0.5618, test_loss: 1.4071, test_f1: 0.5101
 epoch: 97, train_loss: 0.5812, test_loss: 1.4596, test_f1: 0.5008
 epoch: 98, train_loss: 0.5678, test_loss: 1.4460, test_f1: 0.5046
 epoch: 99, train_loss: 0.5749, test_loss: 1.4849, test_f1: 0.4975
##################ITERATION #9 ****************************************
 epoch: 0, train_loss: 1.3599, test_loss: 1.2982, test_f1: 0.2580
 epoch: 1, train_loss: 1.2565, test_loss: 1.2779, test_f1: 0.2589
 epoch: 2, train_loss: 1.2195, test_loss: 1.2444, test_f1: 0.2964
 epoch: 3, train_loss: 1.2032, test_loss: 1.2130, test_f1: 0.3747
 epoch: 4, train_loss: 1.1840, test_loss: 1.1490, test_f1: 0.4473
 epoch: 5, train_loss: 1.1652, test_loss: 1.1280, test_f1: 0.4551
 epoch: 6, train_loss: 1.1375, test_loss: 1.1185, test_f1: 0.4440
 epoch: 7, train_loss: 1.1185, test_loss: 1.1093, test_f1: 0.4352
 epoch: 8, train_loss: 1.1260, test_loss: 1.1010, test_f1: 0.4216
 epoch: 9, train_loss: 1.0938, test_loss: 1.1043, test_f1: 0.4350
 epoch: 10, train_loss: 1.0768, test_loss: 1.1052, test_f1: 0.4351
 epoch: 11, train_loss: 1.0758, test_loss: 1.0888, test_f1: 0.4534
 epoch: 12, train_loss: 1.0561, test_loss: 1.0724, test_f1: 0.4521
 epoch: 13, train_loss: 1.0387, test_loss: 1.0787, test_f1: 0.4484
 epoch: 14, train_loss: 1.0404, test_loss: 1.0621, test_f1: 0.4570
 epoch: 15, train_loss: 1.0191, test_loss: 1.0745, test_f1: 0.4582
 epoch: 16, train_loss: 1.0088, test_loss: 1.0674, test_f1: 0.4563
 epoch: 17, train_loss: 0.9980, test_loss: 1.0946, test_f1: 0.4512
 epoch: 18, train_loss: 0.9881, test_loss: 1.0797, test_f1: 0.4669
 epoch: 19, train_loss: 0.9815, test_loss: 1.0923, test_f1: 0.4650
 epoch: 20, train_loss: 0.9613, test_loss: 1.0440, test_f1: 0.4840
 epoch: 21, train_loss: 0.9628, test_loss: 1.0376, test_f1: 0.4979
 epoch: 22, train_loss: 0.9538, test_loss: 1.0356, test_f1: 0.4904
 epoch: 23, train_loss: 0.9373, test_loss: 1.0506, test_f1: 0.4946
 epoch: 24, train_loss: 0.9347, test_loss: 1.0602, test_f1: 0.4963
 epoch: 25, train_loss: 0.9213, test_loss: 1.0769, test_f1: 0.4921
 epoch: 26, train_loss: 0.9057, test_loss: 1.0962, test_f1: 0.4725
 epoch: 27, train_loss: 0.8929, test_loss: 1.0731, test_f1: 0.4877
 epoch: 28, train_loss: 0.8942, test_loss: 1.0466, test_f1: 0.4972
 epoch: 29, train_loss: 0.8760, test_loss: 1.0731, test_f1: 0.4936
 epoch: 30, train_loss: 0.8699, test_loss: 1.1091, test_f1: 0.4788
 epoch: 31, train_loss: 0.8654, test_loss: 1.0921, test_f1: 0.4891
 epoch: 32, train_loss: 0.8621, test_loss: 1.0680, test_f1: 0.4976
 epoch: 33, train_loss: 0.8521, test_loss: 1.0813, test_f1: 0.5104
 epoch: 34, train_loss: 0.8407, test_loss: 1.1561, test_f1: 0.4806
 epoch: 35, train_loss: 0.8331, test_loss: 1.1435, test_f1: 0.4861
 epoch: 36, train_loss: 0.8357, test_loss: 1.2375, test_f1: 0.4775
 epoch: 37, train_loss: 0.8230, test_loss: 1.1753, test_f1: 0.5018
 epoch: 38, train_loss: 0.7975, test_loss: 1.1575, test_f1: 0.4982
 epoch: 39, train_loss: 0.8128, test_loss: 1.1643, test_f1: 0.5010
 epoch: 40, train_loss: 0.8042, test_loss: 1.2166, test_f1: 0.4896
 epoch: 41, train_loss: 0.8000, test_loss: 1.2779, test_f1: 0.4972
 epoch: 42, train_loss: 0.7802, test_loss: 1.3071, test_f1: 0.4925
 epoch: 43, train_loss: 0.7657, test_loss: 1.2181, test_f1: 0.4949
 epoch: 44, train_loss: 0.7630, test_loss: 1.1276, test_f1: 0.5127
 epoch: 45, train_loss: 0.7657, test_loss: 1.1512, test_f1: 0.5384
 epoch: 46, train_loss: 0.7720, test_loss: 1.2096, test_f1: 0.5056
 epoch: 47, train_loss: 0.7481, test_loss: 1.3932, test_f1: 0.4979
 epoch: 48, train_loss: 0.7356, test_loss: 1.3257, test_f1: 0.5103
 epoch: 49, train_loss: 0.7268, test_loss: 1.3408, test_f1: 0.5010
 epoch: 50, train_loss: 0.7284, test_loss: 1.2978, test_f1: 0.5032
 epoch: 51, train_loss: 0.7219, test_loss: 1.2665, test_f1: 0.5183
 epoch: 52, train_loss: 0.7002, test_loss: 1.2501, test_f1: 0.5225
 epoch: 53, train_loss: 0.7056, test_loss: 1.2546, test_f1: 0.5130
 epoch: 54, train_loss: 0.6777, test_loss: 1.2556, test_f1: 0.4993
 epoch: 55, train_loss: 0.6872, test_loss: 1.2218, test_f1: 0.5158
 epoch: 56, train_loss: 0.6838, test_loss: 1.2930, test_f1: 0.5029
 epoch: 57, train_loss: 0.6951, test_loss: 1.3690, test_f1: 0.4953
 epoch: 58, train_loss: 0.6666, test_loss: 1.3447, test_f1: 0.5023
 epoch: 59, train_loss: 0.6860, test_loss: 1.3712, test_f1: 0.5192
 epoch: 60, train_loss: 0.6792, test_loss: 1.2924, test_f1: 0.5102
 epoch: 61, train_loss: 0.6672, test_loss: 1.3245, test_f1: 0.5006
 epoch: 62, train_loss: 0.6691, test_loss: 1.3987, test_f1: 0.5081
 epoch: 63, train_loss: 0.6598, test_loss: 1.4220, test_f1: 0.5126
 epoch: 64, train_loss: 0.6612, test_loss: 1.3610, test_f1: 0.5052
 epoch: 65, train_loss: 0.6469, test_loss: 1.3048, test_f1: 0.5169
 epoch: 66, train_loss: 0.6413, test_loss: 1.3295, test_f1: 0.5137
 epoch: 67, train_loss: 0.6368, test_loss: 1.3223, test_f1: 0.5178
 epoch: 68, train_loss: 0.6571, test_loss: 1.3121, test_f1: 0.5185
 epoch: 69, train_loss: 0.6516, test_loss: 1.3959, test_f1: 0.5177
 epoch: 70, train_loss: 0.6418, test_loss: 1.4221, test_f1: 0.5125
 epoch: 71, train_loss: 0.6442, test_loss: 1.3904, test_f1: 0.5129
 epoch: 72, train_loss: 0.6494, test_loss: 1.3510, test_f1: 0.5208
 epoch: 73, train_loss: 0.6452, test_loss: 1.3043, test_f1: 0.5290
 epoch: 74, train_loss: 0.6245, test_loss: 1.3443, test_f1: 0.5194
 epoch: 75, train_loss: 0.6370, test_loss: 1.4289, test_f1: 0.5174
 epoch: 76, train_loss: 0.6284, test_loss: 1.3815, test_f1: 0.5050
 epoch: 77, train_loss: 0.6279, test_loss: 1.3130, test_f1: 0.5204
 epoch: 78, train_loss: 0.6187, test_loss: 1.3497, test_f1: 0.5198
 epoch: 79, train_loss: 0.6201, test_loss: 1.3180, test_f1: 0.5145
 epoch: 80, train_loss: 0.6252, test_loss: 1.3477, test_f1: 0.5206
 epoch: 81, train_loss: 0.6102, test_loss: 1.3952, test_f1: 0.5257
 epoch: 82, train_loss: 0.6225, test_loss: 1.4316, test_f1: 0.5026
 epoch: 83, train_loss: 0.6116, test_loss: 1.4365, test_f1: 0.5042
 epoch: 84, train_loss: 0.5931, test_loss: 1.4090, test_f1: 0.4984
 epoch: 85, train_loss: 0.6097, test_loss: 1.3572, test_f1: 0.5197
 epoch: 86, train_loss: 0.6031, test_loss: 1.3380, test_f1: 0.5261
 epoch: 87, train_loss: 0.6070, test_loss: 1.4929, test_f1: 0.5018
 epoch: 88, train_loss: 0.6199, test_loss: 1.4220, test_f1: 0.5035
 epoch: 89, train_loss: 0.5923, test_loss: 1.4953, test_f1: 0.5124
 epoch: 90, train_loss: 0.5847, test_loss: 1.3569, test_f1: 0.5378
 epoch: 91, train_loss: 0.5831, test_loss: 1.4111, test_f1: 0.5155
 epoch: 92, train_loss: 0.5850, test_loss: 1.4293, test_f1: 0.5170
 epoch: 93, train_loss: 0.5790, test_loss: 1.4501, test_f1: 0.5067
 epoch: 94, train_loss: 0.5870, test_loss: 1.5544, test_f1: 0.5185
 epoch: 95, train_loss: 0.5680, test_loss: 1.4385, test_f1: 0.5156
 epoch: 96, train_loss: 0.5750, test_loss: 1.5757, test_f1: 0.5143
 epoch: 97, train_loss: 0.5542, test_loss: 1.4365, test_f1: 0.5409
 epoch: 98, train_loss: 0.5903, test_loss: 1.4552, test_f1: 0.5226
 epoch: 99, train_loss: 0.5504, test_loss: 1.5192, test_f1: 0.5153

Training completed in 431.62 seconds
Best F1: 0.5498 at epoch 95
Mean F1 across iterations: 0.5351  0.0123
========================FINAL RESULTS================================
FEGIN weighted F1: 0.5498  0.0123
python main.py --data ltspice_examples --representation component_component --model FEGIN --layers 5 --hiddens 128 --batch_size 256 --lr 0.0001 --emb_size 250 --epochs 100 --save_appendix component_component_L5_H128_BS256_LR0.0001_E250 --no_val
-----



STDERR:
  File "main.py", line 370, in <module>
    main()
  File "main.py", line 254, in main
    dataset = dataset_class(
  File "/home/philip/projects/ltspice_examples_code_repo/Circuit-Completion-Using-GNNs/component_classification_with_link_prediction_head/evaluation/FEGIN/kernel/circuit_datasets.py", line 15, in __init__
    self.data, self.slices = torch.load(self.processed_paths[0])
  File "/home/philip/.local/lib/python3.8/site-packages/torch/serialization.py", line 1040, in load
    warnings.warn(
  File "/usr/lib/python3.8/warnings.py", line 109, in _showwarnmsg
    sw(msg.message, msg.category, msg.filename, msg.lineno,
  File "main.py", line 47, in warn_with_traceback
    traceback.print_stack(file=log)
/home/philip/projects/ltspice_examples_code_repo/Circuit-Completion-Using-GNNs/component_classification_with_link_prediction_head/evaluation/FEGIN/kernel/circuit_datasets.py:15: FutureWarning: You are using `torch.load` with `weights_only=False` (the current default value), which uses the default pickle module implicitly. It is possible to construct malicious pickle data which will execute arbitrary code during unpickling (See https://github.com/pytorch/pytorch/blob/main/SECURITY.md#untrusted-models for more details). In a future release, the default value for `weights_only` will be flipped to `True`. This limits the functions that could be executed during unpickling. Arbitrary objects will no longer be allowed to be loaded via this mode unless they are explicitly allowlisted by the user via `torch.serialization.add_safe_globals`. We recommend you start setting `weights_only=True` for any use case where you don't have full control of the loaded file. Please open an issue on GitHub for any issues related to this experimental feature.
  self.data, self.slices = torch.load(self.processed_paths[0])
