STDOUT:
Results will be saved in /home/philip/projects/ltspice_examples_code_repo/Circuit-Completion-Using-GNNs/component_classification_with_link_prediction_head/evaluation/FEGIN/results/model_FEGIN_dataset_ltspice_demos
Command line input: python main.py --data ltspice_demos --representation component_pin --model FEGIN --layers 3 --hiddens 64 --batch_size 256 --lr 0.01 --emb_size 250 --epochs 100 --save_appendix component_pin_L3_H64_BS256_LR0.01_E250 --no_val
 is saved.
-----
ltspice_demos - FEGIN
Using 3 layers, 64 hidden units, h = 2
Loading component_pin representation dataset
ENTERED
Training FEGIN on component_pin representation
Train: 1565, Test: 383
##################ITERATION #0 ****************************************
 epoch: 0, train_loss: 1.2932, test_loss: 1.3521, test_f1: 0.1365
 epoch: 1, train_loss: 1.1650, test_loss: 1.3880, test_f1: 0.3344
 epoch: 2, train_loss: 1.1066, test_loss: 1.9790, test_f1: 0.1365
 epoch: 3, train_loss: 1.0342, test_loss: 1.9550, test_f1: 0.2567
 epoch: 4, train_loss: 0.9530, test_loss: 1.7288, test_f1: 0.3109
 epoch: 5, train_loss: 0.9127, test_loss: 1.1994, test_f1: 0.4462
 epoch: 6, train_loss: 0.8932, test_loss: 1.2625, test_f1: 0.3328
 epoch: 7, train_loss: 0.8944, test_loss: 1.2106, test_f1: 0.4579
 epoch: 8, train_loss: 0.8637, test_loss: 1.1535, test_f1: 0.5002
 epoch: 9, train_loss: 0.8283, test_loss: 1.0805, test_f1: 0.4892
 epoch: 10, train_loss: 0.8421, test_loss: 1.0850, test_f1: 0.5661
 epoch: 11, train_loss: 0.8075, test_loss: 0.9509, test_f1: 0.5824
 epoch: 12, train_loss: 0.8239, test_loss: 1.0497, test_f1: 0.4355
 epoch: 13, train_loss: 0.8051, test_loss: 0.9497, test_f1: 0.5753
 epoch: 14, train_loss: 0.7729, test_loss: 0.9388, test_f1: 0.6070
 epoch: 15, train_loss: 0.7780, test_loss: 1.4184, test_f1: 0.4935
 epoch: 16, train_loss: 0.7912, test_loss: 2.4572, test_f1: 0.2566
 epoch: 17, train_loss: 0.8089, test_loss: 1.0768, test_f1: 0.5323
 epoch: 18, train_loss: 0.7807, test_loss: 1.0721, test_f1: 0.5621
 epoch: 19, train_loss: 0.7677, test_loss: 1.1759, test_f1: 0.5302
 epoch: 20, train_loss: 0.7477, test_loss: 1.1262, test_f1: 0.5934
 epoch: 21, train_loss: 0.7492, test_loss: 0.9900, test_f1: 0.5822
 epoch: 22, train_loss: 0.7106, test_loss: 0.9498, test_f1: 0.6392
 epoch: 23, train_loss: 0.7276, test_loss: 0.8932, test_f1: 0.6249
 epoch: 24, train_loss: 0.7305, test_loss: 1.0612, test_f1: 0.4746
 epoch: 25, train_loss: 0.7354, test_loss: 1.3967, test_f1: 0.5232
 epoch: 26, train_loss: 0.7228, test_loss: 1.0384, test_f1: 0.5657
 epoch: 27, train_loss: 0.7259, test_loss: 1.1887, test_f1: 0.5914
 epoch: 28, train_loss: 0.7016, test_loss: 0.8761, test_f1: 0.6419
 epoch: 29, train_loss: 0.6835, test_loss: 0.8960, test_f1: 0.5722
 epoch: 30, train_loss: 0.6670, test_loss: 1.2460, test_f1: 0.5215
 epoch: 31, train_loss: 0.6916, test_loss: 1.0304, test_f1: 0.5726
 epoch: 32, train_loss: 0.7323, test_loss: 1.1518, test_f1: 0.5774
 epoch: 33, train_loss: 0.7378, test_loss: 1.5469, test_f1: 0.5366
 epoch: 34, train_loss: 0.7001, test_loss: 1.1945, test_f1: 0.5461
 epoch: 35, train_loss: 0.7232, test_loss: 0.9888, test_f1: 0.4921
 epoch: 36, train_loss: 0.7085, test_loss: 1.3529, test_f1: 0.5363
 epoch: 37, train_loss: 0.7143, test_loss: 1.7928, test_f1: 0.4966
 epoch: 38, train_loss: 0.6724, test_loss: 0.8506, test_f1: 0.6885
 epoch: 39, train_loss: 0.6798, test_loss: 0.8974, test_f1: 0.5790
 epoch: 40, train_loss: 0.7352, test_loss: 0.9059, test_f1: 0.6138
 epoch: 41, train_loss: 0.7281, test_loss: 0.9412, test_f1: 0.5358
 epoch: 42, train_loss: 0.7040, test_loss: 1.0229, test_f1: 0.4918
 epoch: 43, train_loss: 0.6543, test_loss: 1.1266, test_f1: 0.5394
 epoch: 44, train_loss: 0.6171, test_loss: 0.9996, test_f1: 0.5669
 epoch: 45, train_loss: 0.6113, test_loss: 1.2726, test_f1: 0.5023
 epoch: 46, train_loss: 0.5945, test_loss: 1.0072, test_f1: 0.6212
 epoch: 47, train_loss: 0.5765, test_loss: 1.3845, test_f1: 0.5182
 epoch: 48, train_loss: 0.5914, test_loss: 1.3100, test_f1: 0.5539
 epoch: 49, train_loss: 0.5972, test_loss: 1.1127, test_f1: 0.5969
 epoch: 50, train_loss: 0.5884, test_loss: 1.1113, test_f1: 0.5774
 epoch: 51, train_loss: 0.6033, test_loss: 1.0426, test_f1: 0.5780
 epoch: 52, train_loss: 0.5667, test_loss: 1.0008, test_f1: 0.6577
 epoch: 53, train_loss: 0.5276, test_loss: 1.2011, test_f1: 0.5879
 epoch: 54, train_loss: 0.5315, test_loss: 1.2167, test_f1: 0.6049
 epoch: 55, train_loss: 0.5305, test_loss: 1.1699, test_f1: 0.6084
 epoch: 56, train_loss: 0.5176, test_loss: 1.2571, test_f1: 0.5810
 epoch: 57, train_loss: 0.5040, test_loss: 1.2016, test_f1: 0.6126
 epoch: 58, train_loss: 0.5079, test_loss: 1.4311, test_f1: 0.5817
 epoch: 59, train_loss: 0.5069, test_loss: 1.6163, test_f1: 0.5295
 epoch: 60, train_loss: 0.5030, test_loss: 1.1147, test_f1: 0.6401
 epoch: 61, train_loss: 0.4751, test_loss: 1.2164, test_f1: 0.6402
 epoch: 62, train_loss: 0.4812, test_loss: 1.3682, test_f1: 0.5787
 epoch: 63, train_loss: 0.4912, test_loss: 1.4170, test_f1: 0.5496
 epoch: 64, train_loss: 0.5422, test_loss: 1.0899, test_f1: 0.6607
 epoch: 65, train_loss: 0.4958, test_loss: 1.2466, test_f1: 0.6296
 epoch: 66, train_loss: 0.4913, test_loss: 1.3410, test_f1: 0.6555
 epoch: 67, train_loss: 0.4974, test_loss: 1.4600, test_f1: 0.6523
 epoch: 68, train_loss: 0.4673, test_loss: 1.7891, test_f1: 0.6155
 epoch: 69, train_loss: 0.4543, test_loss: 1.8722, test_f1: 0.6228
 epoch: 70, train_loss: 0.4738, test_loss: 1.6660, test_f1: 0.5948
 epoch: 71, train_loss: 0.4340, test_loss: 1.6367, test_f1: 0.5650
 epoch: 72, train_loss: 0.4279, test_loss: 1.4650, test_f1: 0.6170
 epoch: 73, train_loss: 0.4052, test_loss: 1.5919, test_f1: 0.6040
 epoch: 74, train_loss: 0.4041, test_loss: 1.8151, test_f1: 0.6016
 epoch: 75, train_loss: 0.3898, test_loss: 2.0307, test_f1: 0.6039
 epoch: 76, train_loss: 0.4165, test_loss: 2.1893, test_f1: 0.6031
 epoch: 77, train_loss: 0.4077, test_loss: 2.4597, test_f1: 0.5989
 epoch: 78, train_loss: 0.4410, test_loss: 1.8909, test_f1: 0.5870
 epoch: 79, train_loss: 0.4382, test_loss: 1.8682, test_f1: 0.5908
 epoch: 80, train_loss: 0.4976, test_loss: 1.4000, test_f1: 0.6172
 epoch: 81, train_loss: 0.4391, test_loss: 1.4966, test_f1: 0.6087
 epoch: 82, train_loss: 0.4252, test_loss: 1.5313, test_f1: 0.6140
 epoch: 83, train_loss: 0.3758, test_loss: 2.0095, test_f1: 0.5946
 epoch: 84, train_loss: 0.3818, test_loss: 1.8642, test_f1: 0.6284
 epoch: 85, train_loss: 0.4164, test_loss: 2.2267, test_f1: 0.5938
 epoch: 86, train_loss: 0.4438, test_loss: 2.0672, test_f1: 0.6022
 epoch: 87, train_loss: 0.4179, test_loss: 1.7041, test_f1: 0.5322
 epoch: 88, train_loss: 0.4042, test_loss: 1.5211, test_f1: 0.6265
 epoch: 89, train_loss: 0.4323, test_loss: 1.6737, test_f1: 0.6150
 epoch: 90, train_loss: 0.4185, test_loss: 1.9165, test_f1: 0.6052
 epoch: 91, train_loss: 0.3819, test_loss: 2.2426, test_f1: 0.5559
 epoch: 92, train_loss: 0.3393, test_loss: 2.2665, test_f1: 0.5833
 epoch: 93, train_loss: 0.3363, test_loss: 2.3986, test_f1: 0.5719
 epoch: 94, train_loss: 0.3411, test_loss: 1.9684, test_f1: 0.6133
 epoch: 95, train_loss: 0.3177, test_loss: 1.9358, test_f1: 0.6291
 epoch: 96, train_loss: 0.3281, test_loss: 2.5838, test_f1: 0.6184
 epoch: 97, train_loss: 0.3255, test_loss: 2.7532, test_f1: 0.5837
 epoch: 98, train_loss: 0.3634, test_loss: 2.7288, test_f1: 0.6077
 epoch: 99, train_loss: 0.3889, test_loss: 2.0254, test_f1: 0.6207
##################ITERATION #1 ****************************************
 epoch: 0, train_loss: 1.2046, test_loss: 1.3618, test_f1: 0.2285
 epoch: 1, train_loss: 1.0051, test_loss: 1.5142, test_f1: 0.2881
 epoch: 2, train_loss: 0.9418, test_loss: 1.4562, test_f1: 0.3450
 epoch: 3, train_loss: 0.8907, test_loss: 1.6065, test_f1: 0.2563
 epoch: 4, train_loss: 0.8263, test_loss: 1.8481, test_f1: 0.3734
 epoch: 5, train_loss: 0.8060, test_loss: 1.7275, test_f1: 0.2968
 epoch: 6, train_loss: 0.8012, test_loss: 1.4061, test_f1: 0.4254
 epoch: 7, train_loss: 0.7722, test_loss: 1.2220, test_f1: 0.5366
 epoch: 8, train_loss: 0.8404, test_loss: 1.4189, test_f1: 0.4474
 epoch: 9, train_loss: 0.7745, test_loss: 1.0602, test_f1: 0.5850
 epoch: 10, train_loss: 0.7589, test_loss: 1.0500, test_f1: 0.6194
 epoch: 11, train_loss: 0.7534, test_loss: 1.3190, test_f1: 0.4648
 epoch: 12, train_loss: 0.7461, test_loss: 1.1104, test_f1: 0.4784
 epoch: 13, train_loss: 0.7413, test_loss: 1.1313, test_f1: 0.5255
 epoch: 14, train_loss: 0.7425, test_loss: 1.0706, test_f1: 0.4403
 epoch: 15, train_loss: 0.7625, test_loss: 1.0837, test_f1: 0.5611
 epoch: 16, train_loss: 0.7403, test_loss: 1.0513, test_f1: 0.5372
 epoch: 17, train_loss: 0.7672, test_loss: 0.9420, test_f1: 0.5169
 epoch: 18, train_loss: 0.7252, test_loss: 1.1506, test_f1: 0.5630
 epoch: 19, train_loss: 0.7282, test_loss: 1.1985, test_f1: 0.5718
 epoch: 20, train_loss: 0.7261, test_loss: 1.7625, test_f1: 0.3836
 epoch: 21, train_loss: 0.7265, test_loss: 1.1736, test_f1: 0.4711
 epoch: 22, train_loss: 0.7513, test_loss: 1.0569, test_f1: 0.4954
 epoch: 23, train_loss: 0.7287, test_loss: 1.0460, test_f1: 0.5882
 epoch: 24, train_loss: 0.7322, test_loss: 1.0386, test_f1: 0.4499
 epoch: 25, train_loss: 0.7044, test_loss: 1.0500, test_f1: 0.5559
 epoch: 26, train_loss: 0.6767, test_loss: 1.0969, test_f1: 0.4620
 epoch: 27, train_loss: 0.6748, test_loss: 1.0758, test_f1: 0.5826
 epoch: 28, train_loss: 0.6923, test_loss: 1.1197, test_f1: 0.5757
 epoch: 29, train_loss: 0.6806, test_loss: 1.1079, test_f1: 0.5288
 epoch: 30, train_loss: 0.6575, test_loss: 1.0151, test_f1: 0.5785
 epoch: 31, train_loss: 0.6801, test_loss: 1.1686, test_f1: 0.5653
 epoch: 32, train_loss: 0.6705, test_loss: 1.3511, test_f1: 0.5119
 epoch: 33, train_loss: 0.6804, test_loss: 1.0755, test_f1: 0.6294
 epoch: 34, train_loss: 0.6699, test_loss: 0.9874, test_f1: 0.6309
 epoch: 35, train_loss: 0.6757, test_loss: 1.2468, test_f1: 0.5793
 epoch: 36, train_loss: 0.6401, test_loss: 1.0457, test_f1: 0.6418
 epoch: 37, train_loss: 0.7187, test_loss: 2.0222, test_f1: 0.4177
 epoch: 38, train_loss: 0.6701, test_loss: 1.4088, test_f1: 0.5577
 epoch: 39, train_loss: 0.6311, test_loss: 1.2885, test_f1: 0.5390
 epoch: 40, train_loss: 0.6518, test_loss: 1.0654, test_f1: 0.5614
 epoch: 41, train_loss: 0.6122, test_loss: 1.0437, test_f1: 0.5903
 epoch: 42, train_loss: 0.5997, test_loss: 1.0332, test_f1: 0.5787
 epoch: 43, train_loss: 0.5922, test_loss: 1.2436, test_f1: 0.5139
 epoch: 44, train_loss: 0.6590, test_loss: 1.0037, test_f1: 0.5788
 epoch: 45, train_loss: 0.6393, test_loss: 2.3664, test_f1: 0.2881
 epoch: 46, train_loss: 0.6726, test_loss: 1.3581, test_f1: 0.5511
 epoch: 47, train_loss: 0.6540, test_loss: 1.0396, test_f1: 0.5069
 epoch: 48, train_loss: 0.6441, test_loss: 1.0165, test_f1: 0.6550
 epoch: 49, train_loss: 0.5917, test_loss: 1.0362, test_f1: 0.6424
 epoch: 50, train_loss: 0.5784, test_loss: 1.0764, test_f1: 0.6185
 epoch: 51, train_loss: 0.5379, test_loss: 1.0718, test_f1: 0.6520
 epoch: 52, train_loss: 0.5435, test_loss: 1.0907, test_f1: 0.6279
 epoch: 53, train_loss: 0.5350, test_loss: 1.1956, test_f1: 0.6255
 epoch: 54, train_loss: 0.5207, test_loss: 1.3564, test_f1: 0.5982
 epoch: 55, train_loss: 0.4916, test_loss: 1.1835, test_f1: 0.6412
 epoch: 56, train_loss: 0.5158, test_loss: 1.3024, test_f1: 0.5924
 epoch: 57, train_loss: 0.5069, test_loss: 1.2482, test_f1: 0.6522
 epoch: 58, train_loss: 0.4925, test_loss: 1.2971, test_f1: 0.6484
 epoch: 59, train_loss: 0.4968, test_loss: 1.3045, test_f1: 0.5973
 epoch: 60, train_loss: 0.4753, test_loss: 1.3201, test_f1: 0.6159
 epoch: 61, train_loss: 0.4532, test_loss: 1.3971, test_f1: 0.6313
 epoch: 62, train_loss: 0.4596, test_loss: 1.3441, test_f1: 0.6255
 epoch: 63, train_loss: 0.4829, test_loss: 1.4353, test_f1: 0.6466
 epoch: 64, train_loss: 0.4663, test_loss: 1.4789, test_f1: 0.6310
 epoch: 65, train_loss: 0.4576, test_loss: 1.2488, test_f1: 0.6138
 epoch: 66, train_loss: 0.4463, test_loss: 1.4158, test_f1: 0.5878
 epoch: 67, train_loss: 0.4450, test_loss: 1.4647, test_f1: 0.6325
 epoch: 68, train_loss: 0.4322, test_loss: 1.5756, test_f1: 0.6049
 epoch: 69, train_loss: 0.4271, test_loss: 1.6257, test_f1: 0.6302
 epoch: 70, train_loss: 0.4299, test_loss: 1.9024, test_f1: 0.5545
 epoch: 71, train_loss: 0.4555, test_loss: 1.4889, test_f1: 0.6181
 epoch: 72, train_loss: 0.4472, test_loss: 1.6171, test_f1: 0.6350
 epoch: 73, train_loss: 0.4563, test_loss: 1.2738, test_f1: 0.6685
 epoch: 74, train_loss: 0.4400, test_loss: 1.6746, test_f1: 0.6331
 epoch: 75, train_loss: 0.4500, test_loss: 1.6468, test_f1: 0.6328
 epoch: 76, train_loss: 0.3946, test_loss: 1.6425, test_f1: 0.6483
 epoch: 77, train_loss: 0.4334, test_loss: 1.5283, test_f1: 0.6221
 epoch: 78, train_loss: 0.4090, test_loss: 1.5880, test_f1: 0.6342
 epoch: 79, train_loss: 0.4230, test_loss: 1.7894, test_f1: 0.6280
 epoch: 80, train_loss: 0.4508, test_loss: 1.6371, test_f1: 0.6017
 epoch: 81, train_loss: 0.4656, test_loss: 1.5973, test_f1: 0.5533
 epoch: 82, train_loss: 0.4468, test_loss: 1.4883, test_f1: 0.5695
 epoch: 83, train_loss: 0.4273, test_loss: 1.2690, test_f1: 0.6208
 epoch: 84, train_loss: 0.4220, test_loss: 1.5571, test_f1: 0.6119
 epoch: 85, train_loss: 0.4187, test_loss: 1.5349, test_f1: 0.6375
 epoch: 86, train_loss: 0.3775, test_loss: 1.5584, test_f1: 0.6411
 epoch: 87, train_loss: 0.3835, test_loss: 1.6619, test_f1: 0.6141
 epoch: 88, train_loss: 0.3763, test_loss: 1.6737, test_f1: 0.5634
 epoch: 89, train_loss: 0.3877, test_loss: 1.5961, test_f1: 0.6114
 epoch: 90, train_loss: 0.3520, test_loss: 1.7197, test_f1: 0.6194
 epoch: 91, train_loss: 0.3627, test_loss: 1.8470, test_f1: 0.6169
 epoch: 92, train_loss: 0.3834, test_loss: 1.6638, test_f1: 0.6314
 epoch: 93, train_loss: 0.4607, test_loss: 1.4210, test_f1: 0.5908
 epoch: 94, train_loss: 0.4776, test_loss: 1.4586, test_f1: 0.6287
 epoch: 95, train_loss: 0.4741, test_loss: 1.1498, test_f1: 0.6126
 epoch: 96, train_loss: 0.4305, test_loss: 1.1597, test_f1: 0.6475
 epoch: 97, train_loss: 0.4436, test_loss: 1.3294, test_f1: 0.6075
 epoch: 98, train_loss: 0.4337, test_loss: 1.4648, test_f1: 0.5729
 epoch: 99, train_loss: 0.4066, test_loss: 1.4142, test_f1: 0.6060
##################ITERATION #2 ****************************************
 epoch: 0, train_loss: 1.2158, test_loss: 1.3109, test_f1: 0.3604
 epoch: 1, train_loss: 0.9681, test_loss: 1.3222, test_f1: 0.3998
 epoch: 2, train_loss: 0.9119, test_loss: 1.2386, test_f1: 0.4317
 epoch: 3, train_loss: 0.8869, test_loss: 1.1579, test_f1: 0.5108
 epoch: 4, train_loss: 0.8908, test_loss: 1.0947, test_f1: 0.5689
 epoch: 5, train_loss: 0.8402, test_loss: 1.0889, test_f1: 0.5234
 epoch: 6, train_loss: 0.8259, test_loss: 1.0587, test_f1: 0.5834
 epoch: 7, train_loss: 0.7860, test_loss: 1.1839, test_f1: 0.5219
 epoch: 8, train_loss: 0.7750, test_loss: 1.0426, test_f1: 0.6027
 epoch: 9, train_loss: 0.7652, test_loss: 1.2302, test_f1: 0.5409
 epoch: 10, train_loss: 0.7745, test_loss: 1.0538, test_f1: 0.5409
 epoch: 11, train_loss: 0.7905, test_loss: 1.7642, test_f1: 0.4409
 epoch: 12, train_loss: 0.7533, test_loss: 4.9746, test_f1: 0.2490
 epoch: 13, train_loss: 0.7203, test_loss: 1.6743, test_f1: 0.3927
 epoch: 14, train_loss: 0.6955, test_loss: 1.6233, test_f1: 0.3919
 epoch: 15, train_loss: 0.7158, test_loss: 0.9958, test_f1: 0.5679
 epoch: 16, train_loss: 0.7209, test_loss: 1.1094, test_f1: 0.5727
 epoch: 17, train_loss: 0.7215, test_loss: 1.4183, test_f1: 0.5020
 epoch: 18, train_loss: 0.7071, test_loss: 1.0919, test_f1: 0.6014
 epoch: 19, train_loss: 0.6990, test_loss: 0.9476, test_f1: 0.6426
 epoch: 20, train_loss: 0.6772, test_loss: 0.9915, test_f1: 0.5580
 epoch: 21, train_loss: 0.6812, test_loss: 1.5738, test_f1: 0.5369
 epoch: 22, train_loss: 0.7359, test_loss: 1.4645, test_f1: 0.4789
 epoch: 23, train_loss: 0.7105, test_loss: 1.0936, test_f1: 0.5183
 epoch: 24, train_loss: 0.7173, test_loss: 1.2861, test_f1: 0.5040
 epoch: 25, train_loss: 0.6962, test_loss: 1.7428, test_f1: 0.3956
 epoch: 26, train_loss: 0.6838, test_loss: 1.7355, test_f1: 0.4097
 epoch: 27, train_loss: 0.6563, test_loss: 1.1516, test_f1: 0.5700
 epoch: 28, train_loss: 0.6681, test_loss: 1.3398, test_f1: 0.5147
 epoch: 29, train_loss: 0.6503, test_loss: 1.1562, test_f1: 0.5739
 epoch: 30, train_loss: 0.6651, test_loss: 0.9945, test_f1: 0.5830
 epoch: 31, train_loss: 0.6449, test_loss: 0.9636, test_f1: 0.6162
 epoch: 32, train_loss: 0.6056, test_loss: 1.1001, test_f1: 0.5925
 epoch: 33, train_loss: 0.6046, test_loss: 0.8808, test_f1: 0.6157
 epoch: 34, train_loss: 0.6125, test_loss: 1.0389, test_f1: 0.6084
 epoch: 35, train_loss: 0.5695, test_loss: 1.2854, test_f1: 0.5017
 epoch: 36, train_loss: 0.5752, test_loss: 2.6866, test_f1: 0.4408
 epoch: 37, train_loss: 0.6213, test_loss: 1.2620, test_f1: 0.5524
 epoch: 38, train_loss: 0.5841, test_loss: 1.0699, test_f1: 0.6142
 epoch: 39, train_loss: 0.5905, test_loss: 0.9839, test_f1: 0.6967
 epoch: 40, train_loss: 0.5767, test_loss: 0.9290, test_f1: 0.6365
 epoch: 41, train_loss: 0.5764, test_loss: 1.1127, test_f1: 0.5851
 epoch: 42, train_loss: 0.5670, test_loss: 1.0985, test_f1: 0.5734
 epoch: 43, train_loss: 0.5623, test_loss: 1.1482, test_f1: 0.6094
 epoch: 44, train_loss: 0.6433, test_loss: 1.1005, test_f1: 0.5859
 epoch: 45, train_loss: 0.6423, test_loss: 1.2430, test_f1: 0.5103
 epoch: 46, train_loss: 0.5844, test_loss: 1.0646, test_f1: 0.5535
 epoch: 47, train_loss: 0.5606, test_loss: 0.9661, test_f1: 0.6268
 epoch: 48, train_loss: 0.5441, test_loss: 1.0426, test_f1: 0.5951
 epoch: 49, train_loss: 0.5630, test_loss: 1.2263, test_f1: 0.5509
 epoch: 50, train_loss: 0.5305, test_loss: 1.0681, test_f1: 0.6317
 epoch: 51, train_loss: 0.5010, test_loss: 1.0538, test_f1: 0.6138
 epoch: 52, train_loss: 0.4929, test_loss: 1.0378, test_f1: 0.6258
 epoch: 53, train_loss: 0.4660, test_loss: 1.0434, test_f1: 0.6352
 epoch: 54, train_loss: 0.4459, test_loss: 0.9978, test_f1: 0.6322
 epoch: 55, train_loss: 0.4623, test_loss: 1.0789, test_f1: 0.6243
 epoch: 56, train_loss: 0.4564, test_loss: 1.1779, test_f1: 0.6214
 epoch: 57, train_loss: 0.4573, test_loss: 2.1792, test_f1: 0.4494
 epoch: 58, train_loss: 0.4547, test_loss: 1.2556, test_f1: 0.5522
 epoch: 59, train_loss: 0.4512, test_loss: 1.1917, test_f1: 0.5869
 epoch: 60, train_loss: 0.5124, test_loss: 1.1285, test_f1: 0.6100
 epoch: 61, train_loss: 0.4757, test_loss: 1.1730, test_f1: 0.5839
 epoch: 62, train_loss: 0.4157, test_loss: 1.2601, test_f1: 0.5722
 epoch: 63, train_loss: 0.4340, test_loss: 1.2048, test_f1: 0.5879
 epoch: 64, train_loss: 0.4261, test_loss: 1.0607, test_f1: 0.6420
 epoch: 65, train_loss: 0.4182, test_loss: 1.0703, test_f1: 0.6257
 epoch: 66, train_loss: 0.4015, test_loss: 1.2331, test_f1: 0.6279
 epoch: 67, train_loss: 0.3954, test_loss: 1.3983, test_f1: 0.6145
 epoch: 68, train_loss: 0.3919, test_loss: 1.4264, test_f1: 0.5887
 epoch: 69, train_loss: 0.4239, test_loss: 1.4056, test_f1: 0.6144
 epoch: 70, train_loss: 0.3973, test_loss: 1.4816, test_f1: 0.5819
 epoch: 71, train_loss: 0.4039, test_loss: 1.2011, test_f1: 0.6540
 epoch: 72, train_loss: 0.3998, test_loss: 1.1785, test_f1: 0.6252
 epoch: 73, train_loss: 0.3758, test_loss: 1.1524, test_f1: 0.6494
 epoch: 74, train_loss: 0.3878, test_loss: 1.3142, test_f1: 0.6184
 epoch: 75, train_loss: 0.4155, test_loss: 1.3961, test_f1: 0.5883
 epoch: 76, train_loss: 0.4082, test_loss: 1.6516, test_f1: 0.5314
 epoch: 77, train_loss: 0.4184, test_loss: 1.4032, test_f1: 0.5926
 epoch: 78, train_loss: 0.4145, test_loss: 1.3201, test_f1: 0.5994
 epoch: 79, train_loss: 0.4116, test_loss: 1.3247, test_f1: 0.6193
 epoch: 80, train_loss: 0.3896, test_loss: 1.5559, test_f1: 0.5930
 epoch: 81, train_loss: 0.3596, test_loss: 1.3556, test_f1: 0.6355
 epoch: 82, train_loss: 0.3583, test_loss: 1.3702, test_f1: 0.6334
 epoch: 83, train_loss: 0.3683, test_loss: 1.3780, test_f1: 0.6150
 epoch: 84, train_loss: 0.3703, test_loss: 1.5048, test_f1: 0.5908
 epoch: 85, train_loss: 0.3431, test_loss: 1.3339, test_f1: 0.5980
 epoch: 86, train_loss: 0.3422, test_loss: 1.3048, test_f1: 0.6195
 epoch: 87, train_loss: 0.3580, test_loss: 1.4745, test_f1: 0.5750
 epoch: 88, train_loss: 0.3655, test_loss: 1.5897, test_f1: 0.5915
 epoch: 89, train_loss: 0.3220, test_loss: 1.8475, test_f1: 0.5812
 epoch: 90, train_loss: 0.3140, test_loss: 1.6169, test_f1: 0.6103
 epoch: 91, train_loss: 0.3180, test_loss: 1.8173, test_f1: 0.5985
 epoch: 92, train_loss: 0.3163, test_loss: 1.4973, test_f1: 0.6509
 epoch: 93, train_loss: 0.3105, test_loss: 1.8378, test_f1: 0.5479
 epoch: 94, train_loss: 0.3154, test_loss: 1.7863, test_f1: 0.6451
 epoch: 95, train_loss: 0.3202, test_loss: 1.8336, test_f1: 0.5898
 epoch: 96, train_loss: 0.3011, test_loss: 1.9220, test_f1: 0.5842
 epoch: 97, train_loss: 0.3243, test_loss: 1.6110, test_f1: 0.5932
 epoch: 98, train_loss: 0.3375, test_loss: 1.8193, test_f1: 0.6217
 epoch: 99, train_loss: 0.3231, test_loss: 1.6972, test_f1: 0.6231
##################ITERATION #3 ****************************************
 epoch: 0, train_loss: 1.3811, test_loss: 1.6548, test_f1: 0.3186
 epoch: 1, train_loss: 1.0733, test_loss: 1.3915, test_f1: 0.3017
 epoch: 2, train_loss: 0.9886, test_loss: 1.2872, test_f1: 0.3289
 epoch: 3, train_loss: 0.9534, test_loss: 1.1281, test_f1: 0.4710
 epoch: 4, train_loss: 0.9035, test_loss: 1.1022, test_f1: 0.4907
 epoch: 5, train_loss: 0.8908, test_loss: 1.0645, test_f1: 0.5607
 epoch: 6, train_loss: 0.8560, test_loss: 1.1153, test_f1: 0.4411
 epoch: 7, train_loss: 0.8496, test_loss: 1.0651, test_f1: 0.5142
 epoch: 8, train_loss: 0.8366, test_loss: 1.0497, test_f1: 0.5751
 epoch: 9, train_loss: 0.8031, test_loss: 1.0880, test_f1: 0.5119
 epoch: 10, train_loss: 0.8101, test_loss: 1.0835, test_f1: 0.5336
 epoch: 11, train_loss: 0.8097, test_loss: 1.0659, test_f1: 0.4798
 epoch: 12, train_loss: 0.8364, test_loss: 1.0231, test_f1: 0.5635
 epoch: 13, train_loss: 0.8076, test_loss: 1.1590, test_f1: 0.4963
 epoch: 14, train_loss: 0.7985, test_loss: 0.9720, test_f1: 0.5961
 epoch: 15, train_loss: 0.7796, test_loss: 1.0042, test_f1: 0.5618
 epoch: 16, train_loss: 0.8501, test_loss: 1.0801, test_f1: 0.5628
 epoch: 17, train_loss: 0.7850, test_loss: 1.2314, test_f1: 0.5350
 epoch: 18, train_loss: 0.7739, test_loss: 1.0094, test_f1: 0.5936
 epoch: 19, train_loss: 0.7529, test_loss: 1.0946, test_f1: 0.5323
 epoch: 20, train_loss: 0.7352, test_loss: 1.0583, test_f1: 0.5997
 epoch: 21, train_loss: 0.7316, test_loss: 1.0630, test_f1: 0.5602
 epoch: 22, train_loss: 0.7461, test_loss: 1.0504, test_f1: 0.5139
 epoch: 23, train_loss: 0.7440, test_loss: 0.9766, test_f1: 0.6075
 epoch: 24, train_loss: 0.7266, test_loss: 1.1235, test_f1: 0.5515
 epoch: 25, train_loss: 0.7414, test_loss: 1.0310, test_f1: 0.5539
 epoch: 26, train_loss: 0.7368, test_loss: 1.0972, test_f1: 0.5639
 epoch: 27, train_loss: 0.7071, test_loss: 1.1228, test_f1: 0.6038
 epoch: 28, train_loss: 0.7540, test_loss: 1.0691, test_f1: 0.5928
 epoch: 29, train_loss: 0.8001, test_loss: 0.9869, test_f1: 0.6015
 epoch: 30, train_loss: 0.7775, test_loss: 1.1043, test_f1: 0.5646
 epoch: 31, train_loss: 0.7405, test_loss: 1.2156, test_f1: 0.5757
 epoch: 32, train_loss: 0.7456, test_loss: 1.0652, test_f1: 0.5482
 epoch: 33, train_loss: 0.7508, test_loss: 1.0971, test_f1: 0.5179
 epoch: 34, train_loss: 0.7273, test_loss: 0.9764, test_f1: 0.6147
 epoch: 35, train_loss: 0.6983, test_loss: 1.0201, test_f1: 0.5441
 epoch: 36, train_loss: 0.6979, test_loss: 0.9479, test_f1: 0.6239
 epoch: 37, train_loss: 0.6877, test_loss: 1.0736, test_f1: 0.5706
 epoch: 38, train_loss: 0.6908, test_loss: 1.2140, test_f1: 0.5767
 epoch: 39, train_loss: 0.6956, test_loss: 1.0364, test_f1: 0.5788
 epoch: 40, train_loss: 0.7006, test_loss: 1.1032, test_f1: 0.5788
 epoch: 41, train_loss: 0.6600, test_loss: 1.3262, test_f1: 0.5388
 epoch: 42, train_loss: 0.6434, test_loss: 1.0629, test_f1: 0.6068
 epoch: 43, train_loss: 0.6445, test_loss: 1.8634, test_f1: 0.5522
 epoch: 44, train_loss: 0.6866, test_loss: 1.1171, test_f1: 0.5680
 epoch: 45, train_loss: 0.6592, test_loss: 1.0803, test_f1: 0.5296
 epoch: 46, train_loss: 0.6578, test_loss: 0.9681, test_f1: 0.5666
 epoch: 47, train_loss: 0.7019, test_loss: 1.0994, test_f1: 0.5898
 epoch: 48, train_loss: 0.7158, test_loss: 1.3321, test_f1: 0.5260
 epoch: 49, train_loss: 0.7254, test_loss: 1.2579, test_f1: 0.4277
 epoch: 50, train_loss: 0.6801, test_loss: 1.3795, test_f1: 0.4855
 epoch: 51, train_loss: 0.6632, test_loss: 1.3279, test_f1: 0.5110
 epoch: 52, train_loss: 0.6595, test_loss: 1.0537, test_f1: 0.6019
 epoch: 53, train_loss: 0.6386, test_loss: 0.9506, test_f1: 0.6408
 epoch: 54, train_loss: 0.6109, test_loss: 0.9924, test_f1: 0.6585
 epoch: 55, train_loss: 0.5959, test_loss: 1.0564, test_f1: 0.5990
 epoch: 56, train_loss: 0.5991, test_loss: 1.0983, test_f1: 0.5684
 epoch: 57, train_loss: 0.5843, test_loss: 1.0675, test_f1: 0.5948
 epoch: 58, train_loss: 0.5881, test_loss: 1.1960, test_f1: 0.5767
 epoch: 59, train_loss: 0.5883, test_loss: 1.1505, test_f1: 0.5781
 epoch: 60, train_loss: 0.6006, test_loss: 1.2386, test_f1: 0.5985
 epoch: 61, train_loss: 0.5772, test_loss: 1.1139, test_f1: 0.6056
 epoch: 62, train_loss: 0.5589, test_loss: 1.2458, test_f1: 0.6125
 epoch: 63, train_loss: 0.5695, test_loss: 1.1473, test_f1: 0.6383
 epoch: 64, train_loss: 0.5678, test_loss: 1.3002, test_f1: 0.6438
 epoch: 65, train_loss: 0.5548, test_loss: 1.2146, test_f1: 0.6058
 epoch: 66, train_loss: 0.6094, test_loss: 1.0468, test_f1: 0.5617
 epoch: 67, train_loss: 0.6331, test_loss: 1.0641, test_f1: 0.5996
 epoch: 68, train_loss: 0.5970, test_loss: 1.3557, test_f1: 0.5185
 epoch: 69, train_loss: 0.5686, test_loss: 1.3657, test_f1: 0.5745
 epoch: 70, train_loss: 0.5541, test_loss: 1.2360, test_f1: 0.5824
 epoch: 71, train_loss: 0.5529, test_loss: 1.2167, test_f1: 0.5995
 epoch: 72, train_loss: 0.5389, test_loss: 1.0588, test_f1: 0.6182
 epoch: 73, train_loss: 0.5413, test_loss: 1.1370, test_f1: 0.5941
 epoch: 74, train_loss: 0.5119, test_loss: 1.2202, test_f1: 0.5644
 epoch: 75, train_loss: 0.5399, test_loss: 1.3286, test_f1: 0.5605
 epoch: 76, train_loss: 0.5295, test_loss: 1.2830, test_f1: 0.5971
 epoch: 77, train_loss: 0.5325, test_loss: 1.5456, test_f1: 0.5597
 epoch: 78, train_loss: 0.5366, test_loss: 1.2399, test_f1: 0.6187
 epoch: 79, train_loss: 0.5361, test_loss: 1.3101, test_f1: 0.6153
 epoch: 80, train_loss: 0.5160, test_loss: 1.2621, test_f1: 0.6118
 epoch: 81, train_loss: 0.5572, test_loss: 1.1011, test_f1: 0.6574
 epoch: 82, train_loss: 0.5301, test_loss: 1.1547, test_f1: 0.5891
 epoch: 83, train_loss: 0.5060, test_loss: 1.1391, test_f1: 0.6167
 epoch: 84, train_loss: 0.4820, test_loss: 1.1323, test_f1: 0.6066
 epoch: 85, train_loss: 0.4790, test_loss: 1.2365, test_f1: 0.5852
 epoch: 86, train_loss: 0.4873, test_loss: 1.2018, test_f1: 0.5674
 epoch: 87, train_loss: 0.4864, test_loss: 1.1813, test_f1: 0.5669
 epoch: 88, train_loss: 0.4986, test_loss: 1.3166, test_f1: 0.5742
 epoch: 89, train_loss: 0.4690, test_loss: 1.1164, test_f1: 0.6362
 epoch: 90, train_loss: 0.4707, test_loss: 1.2763, test_f1: 0.6260
 epoch: 91, train_loss: 0.4860, test_loss: 1.3603, test_f1: 0.6091
 epoch: 92, train_loss: 0.4786, test_loss: 1.2478, test_f1: 0.6280
 epoch: 93, train_loss: 0.4825, test_loss: 1.3887, test_f1: 0.6254
 epoch: 94, train_loss: 0.4795, test_loss: 1.1824, test_f1: 0.6426
 epoch: 95, train_loss: 0.4699, test_loss: 1.1427, test_f1: 0.6210
 epoch: 96, train_loss: 0.4749, test_loss: 1.3678, test_f1: 0.6195
 epoch: 97, train_loss: 0.4712, test_loss: 1.1808, test_f1: 0.6549
 epoch: 98, train_loss: 0.4529, test_loss: 1.4071, test_f1: 0.6186
 epoch: 99, train_loss: 0.4615, test_loss: 1.3182, test_f1: 0.5791
##################ITERATION #4 ****************************************
 epoch: 0, train_loss: 1.5658, test_loss: 1.4616, test_f1: 0.2989
 epoch: 1, train_loss: 1.1454, test_loss: 1.3623, test_f1: 0.3020
 epoch: 2, train_loss: 1.0287, test_loss: 1.5184, test_f1: 0.3290
 epoch: 3, train_loss: 0.9405, test_loss: 1.6732, test_f1: 0.2212
 epoch: 4, train_loss: 0.8814, test_loss: 2.3420, test_f1: 0.0989
 epoch: 5, train_loss: 0.8476, test_loss: 2.5427, test_f1: 0.1539
 epoch: 6, train_loss: 0.8142, test_loss: 3.1166, test_f1: 0.2077
 epoch: 7, train_loss: 0.8243, test_loss: 1.3499, test_f1: 0.3370
 epoch: 8, train_loss: 0.8393, test_loss: 2.2652, test_f1: 0.3723
 epoch: 9, train_loss: 0.8300, test_loss: 1.3801, test_f1: 0.4314
 epoch: 10, train_loss: 0.8049, test_loss: 1.9057, test_f1: 0.4061
 epoch: 11, train_loss: 0.7795, test_loss: 1.0969, test_f1: 0.5389
 epoch: 12, train_loss: 0.7712, test_loss: 1.1416, test_f1: 0.4838
 epoch: 13, train_loss: 0.7561, test_loss: 1.2412, test_f1: 0.5260
 epoch: 14, train_loss: 0.7561, test_loss: 1.1275, test_f1: 0.5772
 epoch: 15, train_loss: 0.7262, test_loss: 1.0515, test_f1: 0.6131
 epoch: 16, train_loss: 0.7209, test_loss: 1.1604, test_f1: 0.5458
 epoch: 17, train_loss: 0.7215, test_loss: 1.1427, test_f1: 0.5746
 epoch: 18, train_loss: 0.7082, test_loss: 1.0800, test_f1: 0.5885
 epoch: 19, train_loss: 0.7019, test_loss: 1.2370, test_f1: 0.5643
 epoch: 20, train_loss: 0.7102, test_loss: 1.2842, test_f1: 0.5151
 epoch: 21, train_loss: 0.6810, test_loss: 1.1048, test_f1: 0.5050
 epoch: 22, train_loss: 0.6821, test_loss: 1.7491, test_f1: 0.3835
 epoch: 23, train_loss: 0.6631, test_loss: 1.4046, test_f1: 0.5550
 epoch: 24, train_loss: 0.6586, test_loss: 1.4048, test_f1: 0.5298
 epoch: 25, train_loss: 0.6724, test_loss: 1.0097, test_f1: 0.6284
 epoch: 26, train_loss: 0.6701, test_loss: 1.0115, test_f1: 0.5242
 epoch: 27, train_loss: 0.6336, test_loss: 1.1491, test_f1: 0.5784
 epoch: 28, train_loss: 0.6354, test_loss: 1.3671, test_f1: 0.5166
 epoch: 29, train_loss: 0.6550, test_loss: 1.0820, test_f1: 0.6258
 epoch: 30, train_loss: 0.6723, test_loss: 1.7187, test_f1: 0.6009
 epoch: 31, train_loss: 0.6591, test_loss: 1.5562, test_f1: 0.4805
 epoch: 32, train_loss: 0.6183, test_loss: 1.3465, test_f1: 0.5543
 epoch: 33, train_loss: 0.6047, test_loss: 1.0616, test_f1: 0.6290
 epoch: 34, train_loss: 0.6002, test_loss: 1.0728, test_f1: 0.6176
 epoch: 35, train_loss: 0.5790, test_loss: 1.1102, test_f1: 0.6045
 epoch: 36, train_loss: 0.5847, test_loss: 1.0975, test_f1: 0.6337
 epoch: 37, train_loss: 0.5549, test_loss: 1.1487, test_f1: 0.5700
 epoch: 38, train_loss: 0.5515, test_loss: 1.3627, test_f1: 0.5636
 epoch: 39, train_loss: 0.6201, test_loss: 1.2711, test_f1: 0.5384
 epoch: 40, train_loss: 0.6220, test_loss: 1.2722, test_f1: 0.5377
 epoch: 41, train_loss: 0.6190, test_loss: 1.5150, test_f1: 0.5566
 epoch: 42, train_loss: 0.6340, test_loss: 1.3597, test_f1: 0.6226
 epoch: 43, train_loss: 0.5908, test_loss: 1.2602, test_f1: 0.6460
 epoch: 44, train_loss: 0.5555, test_loss: 1.4223, test_f1: 0.5026
 epoch: 45, train_loss: 0.5440, test_loss: 1.4553, test_f1: 0.6116
 epoch: 46, train_loss: 0.5171, test_loss: 1.2689, test_f1: 0.6220
 epoch: 47, train_loss: 0.4938, test_loss: 1.2894, test_f1: 0.6196
 epoch: 48, train_loss: 0.5311, test_loss: 1.7325, test_f1: 0.4963
 epoch: 49, train_loss: 0.5159, test_loss: 1.3675, test_f1: 0.5958
 epoch: 50, train_loss: 0.4794, test_loss: 3.8423, test_f1: 0.4467
 epoch: 51, train_loss: 0.4486, test_loss: 6.3825, test_f1: 0.3010
 epoch: 52, train_loss: 0.4426, test_loss: 1.4306, test_f1: 0.5006
 epoch: 53, train_loss: 0.4277, test_loss: 1.5614, test_f1: 0.5414
 epoch: 54, train_loss: 0.4335, test_loss: 1.2497, test_f1: 0.6474
 epoch: 55, train_loss: 0.4139, test_loss: 1.3840, test_f1: 0.6012
 epoch: 56, train_loss: 0.4975, test_loss: 1.4134, test_f1: 0.5896
 epoch: 57, train_loss: 0.4324, test_loss: 1.6106, test_f1: 0.5745
 epoch: 58, train_loss: 0.4456, test_loss: 1.6128, test_f1: 0.5755
 epoch: 59, train_loss: 0.4204, test_loss: 1.5140, test_f1: 0.5706
 epoch: 60, train_loss: 0.4743, test_loss: 1.3568, test_f1: 0.5823
 epoch: 61, train_loss: 0.4378, test_loss: 1.2149, test_f1: 0.6365
 epoch: 62, train_loss: 0.3972, test_loss: 1.1678, test_f1: 0.6397
 epoch: 63, train_loss: 0.4045, test_loss: 1.2941, test_f1: 0.6369
 epoch: 64, train_loss: 0.4014, test_loss: 1.2691, test_f1: 0.6081
 epoch: 65, train_loss: 0.3580, test_loss: 1.3216, test_f1: 0.5876
 epoch: 66, train_loss: 0.3748, test_loss: 1.4232, test_f1: 0.6173
 epoch: 67, train_loss: 0.3839, test_loss: 1.3932, test_f1: 0.6828
 epoch: 68, train_loss: 0.3639, test_loss: 1.7204, test_f1: 0.6575
 epoch: 69, train_loss: 0.3873, test_loss: 1.4063, test_f1: 0.6127
 epoch: 70, train_loss: 0.4193, test_loss: 1.6041, test_f1: 0.6532
 epoch: 71, train_loss: 0.4135, test_loss: 1.3816, test_f1: 0.6183
 epoch: 72, train_loss: 0.4228, test_loss: 1.6998, test_f1: 0.5612
 epoch: 73, train_loss: 0.3952, test_loss: 1.5342, test_f1: 0.5699
 epoch: 74, train_loss: 0.3716, test_loss: 1.3445, test_f1: 0.6409
 epoch: 75, train_loss: 0.3600, test_loss: 1.4495, test_f1: 0.6506
 epoch: 76, train_loss: 0.3556, test_loss: 1.5559, test_f1: 0.6109
 epoch: 77, train_loss: 0.3321, test_loss: 1.6336, test_f1: 0.5964
 epoch: 78, train_loss: 0.3385, test_loss: 1.7468, test_f1: 0.6234
 epoch: 79, train_loss: 0.3232, test_loss: 1.5100, test_f1: 0.6384
 epoch: 80, train_loss: 0.3475, test_loss: 1.7182, test_f1: 0.5872
 epoch: 81, train_loss: 0.3417, test_loss: 1.4591, test_f1: 0.6673
 epoch: 82, train_loss: 0.3574, test_loss: 1.9969, test_f1: 0.5757
 epoch: 83, train_loss: 0.3823, test_loss: 1.4502, test_f1: 0.5561
 epoch: 84, train_loss: 0.4029, test_loss: 1.1963, test_f1: 0.6225
 epoch: 85, train_loss: 0.3654, test_loss: 1.6854, test_f1: 0.6343
 epoch: 86, train_loss: 0.3699, test_loss: 1.4395, test_f1: 0.6031
 epoch: 87, train_loss: 0.3497, test_loss: 1.4924, test_f1: 0.5678
 epoch: 88, train_loss: 0.3428, test_loss: 1.6010, test_f1: 0.5717
 epoch: 89, train_loss: 0.3583, test_loss: 1.3961, test_f1: 0.6400
 epoch: 90, train_loss: 0.3807, test_loss: 1.8304, test_f1: 0.5844
 epoch: 91, train_loss: 0.3472, test_loss: 1.4635, test_f1: 0.6607
 epoch: 92, train_loss: 0.3398, test_loss: 1.8213, test_f1: 0.5534
 epoch: 93, train_loss: 0.3097, test_loss: 1.7054, test_f1: 0.6090
 epoch: 94, train_loss: 0.2902, test_loss: 1.7576, test_f1: 0.6418
 epoch: 95, train_loss: 0.3038, test_loss: 1.5415, test_f1: 0.6407
 epoch: 96, train_loss: 0.3265, test_loss: 1.5296, test_f1: 0.6340
 epoch: 97, train_loss: 0.3224, test_loss: 1.6751, test_f1: 0.5868
 epoch: 98, train_loss: 0.3088, test_loss: 1.8745, test_f1: 0.5864
 epoch: 99, train_loss: 0.2931, test_loss: 2.0490, test_f1: 0.6012
##################ITERATION #5 ****************************************
 epoch: 0, train_loss: 1.5672, test_loss: 1.8659, test_f1: 0.3363
 epoch: 1, train_loss: 1.0732, test_loss: 1.5196, test_f1: 0.3347
 epoch: 2, train_loss: 0.9653, test_loss: 1.4482, test_f1: 0.3476
 epoch: 3, train_loss: 0.9062, test_loss: 1.4184, test_f1: 0.4134
 epoch: 4, train_loss: 0.8862, test_loss: 1.5012, test_f1: 0.3958
 epoch: 5, train_loss: 0.8522, test_loss: 1.2941, test_f1: 0.4932
 epoch: 6, train_loss: 0.8361, test_loss: 1.0549, test_f1: 0.5728
 epoch: 7, train_loss: 0.8069, test_loss: 1.0669, test_f1: 0.5151
 epoch: 8, train_loss: 0.7932, test_loss: 1.1262, test_f1: 0.5258
 epoch: 9, train_loss: 0.7872, test_loss: 1.0029, test_f1: 0.5658
 epoch: 10, train_loss: 0.7434, test_loss: 1.1090, test_f1: 0.5758
 epoch: 11, train_loss: 0.7657, test_loss: 1.3285, test_f1: 0.5416
 epoch: 12, train_loss: 0.7663, test_loss: 1.7061, test_f1: 0.4352
 epoch: 13, train_loss: 0.7606, test_loss: 1.3721, test_f1: 0.5387
 epoch: 14, train_loss: 0.7622, test_loss: 1.0744, test_f1: 0.5938
 epoch: 15, train_loss: 0.7670, test_loss: 1.2100, test_f1: 0.4905
 epoch: 16, train_loss: 0.7840, test_loss: 1.3206, test_f1: 0.5136
 epoch: 17, train_loss: 0.7336, test_loss: 1.0686, test_f1: 0.5940
 epoch: 18, train_loss: 0.7266, test_loss: 1.1417, test_f1: 0.5534
 epoch: 19, train_loss: 0.7435, test_loss: 1.4223, test_f1: 0.5756
 epoch: 20, train_loss: 0.7144, test_loss: 0.9264, test_f1: 0.6417
 epoch: 21, train_loss: 0.7062, test_loss: 0.9298, test_f1: 0.6033
 epoch: 22, train_loss: 0.6935, test_loss: 0.9217, test_f1: 0.5964
 epoch: 23, train_loss: 0.6580, test_loss: 1.0114, test_f1: 0.6331
 epoch: 24, train_loss: 0.6646, test_loss: 1.8004, test_f1: 0.4583
 epoch: 25, train_loss: 0.6505, test_loss: 1.3989, test_f1: 0.5215
 epoch: 26, train_loss: 0.6335, test_loss: 1.2573, test_f1: 0.5363
 epoch: 27, train_loss: 0.6700, test_loss: 1.1124, test_f1: 0.5078
 epoch: 28, train_loss: 0.6359, test_loss: 1.2333, test_f1: 0.5785
 epoch: 29, train_loss: 0.6708, test_loss: 1.0528, test_f1: 0.5448
 epoch: 30, train_loss: 0.6890, test_loss: 1.1449, test_f1: 0.5155
 epoch: 31, train_loss: 0.6903, test_loss: 1.0939, test_f1: 0.4969
 epoch: 32, train_loss: 0.6592, test_loss: 1.0364, test_f1: 0.6089
 epoch: 33, train_loss: 0.6266, test_loss: 1.0301, test_f1: 0.5955
 epoch: 34, train_loss: 0.6210, test_loss: 1.1466, test_f1: 0.6050
 epoch: 35, train_loss: 0.6246, test_loss: 1.1241, test_f1: 0.5434
 epoch: 36, train_loss: 0.5965, test_loss: 1.5282, test_f1: 0.4464
 epoch: 37, train_loss: 0.6027, test_loss: 1.1719, test_f1: 0.6044
 epoch: 38, train_loss: 0.6038, test_loss: 1.2448, test_f1: 0.5577
 epoch: 39, train_loss: 0.5844, test_loss: 1.3349, test_f1: 0.6202
 epoch: 40, train_loss: 0.6014, test_loss: 1.2744, test_f1: 0.5952
 epoch: 41, train_loss: 0.5828, test_loss: 1.2097, test_f1: 0.5323
 epoch: 42, train_loss: 0.5839, test_loss: 1.6973, test_f1: 0.4827
 epoch: 43, train_loss: 0.5767, test_loss: 1.3003, test_f1: 0.5706
 epoch: 44, train_loss: 0.6002, test_loss: 1.1558, test_f1: 0.5487
 epoch: 45, train_loss: 0.5974, test_loss: 1.3183, test_f1: 0.6005
 epoch: 46, train_loss: 0.6044, test_loss: 1.2095, test_f1: 0.6452
 epoch: 47, train_loss: 0.6087, test_loss: 1.4037, test_f1: 0.5983
 epoch: 48, train_loss: 0.6140, test_loss: 1.4138, test_f1: 0.5455
 epoch: 49, train_loss: 0.6312, test_loss: 1.2287, test_f1: 0.5626
 epoch: 50, train_loss: 0.6424, test_loss: 1.2293, test_f1: 0.5865
 epoch: 51, train_loss: 0.6192, test_loss: 1.1512, test_f1: 0.6138
 epoch: 52, train_loss: 0.5684, test_loss: 1.1503, test_f1: 0.5983
 epoch: 53, train_loss: 0.5421, test_loss: 1.2550, test_f1: 0.6025
 epoch: 54, train_loss: 0.5091, test_loss: 1.2010, test_f1: 0.6018
 epoch: 55, train_loss: 0.4893, test_loss: 1.1605, test_f1: 0.5928
 epoch: 56, train_loss: 0.4744, test_loss: 1.0884, test_f1: 0.5900
 epoch: 57, train_loss: 0.5040, test_loss: 1.1919, test_f1: 0.6387
 epoch: 58, train_loss: 0.5195, test_loss: 1.6144, test_f1: 0.5910
 epoch: 59, train_loss: 0.5058, test_loss: 1.0028, test_f1: 0.6452
 epoch: 60, train_loss: 0.5005, test_loss: 1.1825, test_f1: 0.6153
 epoch: 61, train_loss: 0.4817, test_loss: 1.1320, test_f1: 0.5762
 epoch: 62, train_loss: 0.4846, test_loss: 1.1914, test_f1: 0.6375
 epoch: 63, train_loss: 0.4712, test_loss: 1.4015, test_f1: 0.6612
 epoch: 64, train_loss: 0.4658, test_loss: 1.1779, test_f1: 0.6519
 epoch: 65, train_loss: 0.4811, test_loss: 1.2691, test_f1: 0.6291
 epoch: 66, train_loss: 0.4514, test_loss: 1.1922, test_f1: 0.6435
 epoch: 67, train_loss: 0.4408, test_loss: 1.4795, test_f1: 0.6455
 epoch: 68, train_loss: 0.4568, test_loss: 1.2385, test_f1: 0.6230
 epoch: 69, train_loss: 0.4817, test_loss: 1.4216, test_f1: 0.6227
 epoch: 70, train_loss: 0.4810, test_loss: 1.2461, test_f1: 0.5760
 epoch: 71, train_loss: 0.4501, test_loss: 1.1371, test_f1: 0.6879
 epoch: 72, train_loss: 0.4411, test_loss: 1.3213, test_f1: 0.6291
 epoch: 73, train_loss: 0.4469, test_loss: 1.1740, test_f1: 0.6487
 epoch: 74, train_loss: 0.4668, test_loss: 1.3840, test_f1: 0.6434
 epoch: 75, train_loss: 0.4476, test_loss: 1.5107, test_f1: 0.5407
 epoch: 76, train_loss: 0.4395, test_loss: 1.4328, test_f1: 0.5356
 epoch: 77, train_loss: 0.4779, test_loss: 1.2405, test_f1: 0.6446
 epoch: 78, train_loss: 0.4451, test_loss: 1.3558, test_f1: 0.6336
 epoch: 79, train_loss: 0.4363, test_loss: 1.2433, test_f1: 0.6475
 epoch: 80, train_loss: 0.4128, test_loss: 1.2754, test_f1: 0.6096
 epoch: 81, train_loss: 0.4228, test_loss: 1.4965, test_f1: 0.5928
 epoch: 82, train_loss: 0.4031, test_loss: 1.2880, test_f1: 0.6688
 epoch: 83, train_loss: 0.3959, test_loss: 1.2615, test_f1: 0.6121
 epoch: 84, train_loss: 0.3789, test_loss: 1.3794, test_f1: 0.6407
 epoch: 85, train_loss: 0.4053, test_loss: 1.4685, test_f1: 0.6360
 epoch: 86, train_loss: 0.4010, test_loss: 1.3212, test_f1: 0.5882
 epoch: 87, train_loss: 0.3890, test_loss: 1.2967, test_f1: 0.5954
 epoch: 88, train_loss: 0.3888, test_loss: 1.5210, test_f1: 0.5347
 epoch: 89, train_loss: 0.3721, test_loss: 1.2960, test_f1: 0.5995
 epoch: 90, train_loss: 0.3643, test_loss: 1.4663, test_f1: 0.6285
 epoch: 91, train_loss: 0.3686, test_loss: 1.4815, test_f1: 0.5845
 epoch: 92, train_loss: 0.3697, test_loss: 1.9290, test_f1: 0.5469
 epoch: 93, train_loss: 0.3831, test_loss: 1.6811, test_f1: 0.6313
 epoch: 94, train_loss: 0.3783, test_loss: 1.6059, test_f1: 0.6056
 epoch: 95, train_loss: 0.3529, test_loss: 1.5237, test_f1: 0.6428
 epoch: 96, train_loss: 0.3634, test_loss: 1.4109, test_f1: 0.6287
 epoch: 97, train_loss: 0.3523, test_loss: 1.4319, test_f1: 0.5842
 epoch: 98, train_loss: 0.3370, test_loss: 1.4425, test_f1: 0.6158
 epoch: 99, train_loss: 0.3354, test_loss: 1.6229, test_f1: 0.6242
##################ITERATION #6 ****************************************
 epoch: 0, train_loss: 1.4197, test_loss: 2.0940, test_f1: 0.2281
 epoch: 1, train_loss: 1.0554, test_loss: 1.6753, test_f1: 0.3291
 epoch: 2, train_loss: 0.9506, test_loss: 1.4561, test_f1: 0.2899
 epoch: 3, train_loss: 0.9008, test_loss: 1.2370, test_f1: 0.3755
 epoch: 4, train_loss: 0.8591, test_loss: 1.2316, test_f1: 0.4753
 epoch: 5, train_loss: 0.8368, test_loss: 1.2200, test_f1: 0.4836
 epoch: 6, train_loss: 0.8235, test_loss: 1.3755, test_f1: 0.4477
 epoch: 7, train_loss: 0.8007, test_loss: 1.5872, test_f1: 0.3637
 epoch: 8, train_loss: 0.7863, test_loss: 1.1482, test_f1: 0.5145
 epoch: 9, train_loss: 0.7791, test_loss: 1.1310, test_f1: 0.4919
 epoch: 10, train_loss: 0.7727, test_loss: 1.0012, test_f1: 0.4826
 epoch: 11, train_loss: 0.7506, test_loss: 0.9997, test_f1: 0.5224
 epoch: 12, train_loss: 0.7491, test_loss: 1.0130, test_f1: 0.5460
 epoch: 13, train_loss: 0.7332, test_loss: 1.0197, test_f1: 0.5442
 epoch: 14, train_loss: 0.7182, test_loss: 1.1322, test_f1: 0.5551
 epoch: 15, train_loss: 0.7055, test_loss: 1.0695, test_f1: 0.5161
 epoch: 16, train_loss: 0.6931, test_loss: 1.1857, test_f1: 0.5643
 epoch: 17, train_loss: 0.7125, test_loss: 1.8152, test_f1: 0.4323
 epoch: 18, train_loss: 0.7603, test_loss: 1.1124, test_f1: 0.5518
 epoch: 19, train_loss: 0.7628, test_loss: 0.9824, test_f1: 0.5734
 epoch: 20, train_loss: 0.6918, test_loss: 1.6130, test_f1: 0.4701
 epoch: 21, train_loss: 0.7051, test_loss: 1.2377, test_f1: 0.5100
 epoch: 22, train_loss: 0.6824, test_loss: 1.1469, test_f1: 0.5108
 epoch: 23, train_loss: 0.6792, test_loss: 1.0554, test_f1: 0.5442
 epoch: 24, train_loss: 0.7329, test_loss: 1.0274, test_f1: 0.5487
 epoch: 25, train_loss: 0.7493, test_loss: 1.0718, test_f1: 0.4287
 epoch: 26, train_loss: 0.7306, test_loss: 1.0526, test_f1: 0.5636
 epoch: 27, train_loss: 0.7349, test_loss: 1.0368, test_f1: 0.5886
 epoch: 28, train_loss: 0.7106, test_loss: 0.9550, test_f1: 0.6119
 epoch: 29, train_loss: 0.6860, test_loss: 1.0178, test_f1: 0.5725
 epoch: 30, train_loss: 0.7160, test_loss: 1.6123, test_f1: 0.3682
 epoch: 31, train_loss: 0.7064, test_loss: 1.2288, test_f1: 0.5258
 epoch: 32, train_loss: 0.7133, test_loss: 1.0580, test_f1: 0.5728
 epoch: 33, train_loss: 0.6830, test_loss: 1.0088, test_f1: 0.5735
 epoch: 34, train_loss: 0.6546, test_loss: 0.9984, test_f1: 0.6178
 epoch: 35, train_loss: 0.6406, test_loss: 1.1859, test_f1: 0.6013
 epoch: 36, train_loss: 0.6432, test_loss: 0.9649, test_f1: 0.5843
 epoch: 37, train_loss: 0.6559, test_loss: 1.0869, test_f1: 0.5660
 epoch: 38, train_loss: 0.6159, test_loss: 1.0366, test_f1: 0.6280
 epoch: 39, train_loss: 0.6153, test_loss: 1.0665, test_f1: 0.6040
 epoch: 40, train_loss: 0.6008, test_loss: 1.2338, test_f1: 0.5229
 epoch: 41, train_loss: 0.5784, test_loss: 1.0244, test_f1: 0.6384
 epoch: 42, train_loss: 0.5992, test_loss: 1.1824, test_f1: 0.5582
 epoch: 43, train_loss: 0.5588, test_loss: 1.1370, test_f1: 0.6252
 epoch: 44, train_loss: 0.5801, test_loss: 1.3430, test_f1: 0.5560
 epoch: 45, train_loss: 0.5587, test_loss: 1.0396, test_f1: 0.6493
 epoch: 46, train_loss: 0.5619, test_loss: 1.1964, test_f1: 0.6839
 epoch: 47, train_loss: 0.5312, test_loss: 1.1944, test_f1: 0.6114
 epoch: 48, train_loss: 0.5835, test_loss: 1.2825, test_f1: 0.5316
 epoch: 49, train_loss: 0.6002, test_loss: 1.2981, test_f1: 0.5484
 epoch: 50, train_loss: 0.5849, test_loss: 1.9302, test_f1: 0.4208
 epoch: 51, train_loss: 0.5684, test_loss: 1.0590, test_f1: 0.5827
 epoch: 52, train_loss: 0.5492, test_loss: 0.9675, test_f1: 0.6882
 epoch: 53, train_loss: 0.5194, test_loss: 1.1298, test_f1: 0.6698
 epoch: 54, train_loss: 0.5158, test_loss: 1.1401, test_f1: 0.6566
 epoch: 55, train_loss: 0.5028, test_loss: 1.0928, test_f1: 0.6346
 epoch: 56, train_loss: 0.4921, test_loss: 1.2749, test_f1: 0.5686
 epoch: 57, train_loss: 0.4718, test_loss: 1.0901, test_f1: 0.6399
 epoch: 58, train_loss: 0.4704, test_loss: 1.1550, test_f1: 0.5789
 epoch: 59, train_loss: 0.4670, test_loss: 1.2627, test_f1: 0.5719
 epoch: 60, train_loss: 0.4352, test_loss: 1.2650, test_f1: 0.6230
 epoch: 61, train_loss: 0.4541, test_loss: 1.2927, test_f1: 0.6431
 epoch: 62, train_loss: 0.4437, test_loss: 1.2775, test_f1: 0.6115
 epoch: 63, train_loss: 0.4497, test_loss: 1.3090, test_f1: 0.6050
 epoch: 64, train_loss: 0.4379, test_loss: 1.1979, test_f1: 0.6220
 epoch: 65, train_loss: 0.4587, test_loss: 1.0774, test_f1: 0.6291
 epoch: 66, train_loss: 0.4778, test_loss: 1.2986, test_f1: 0.5730
 epoch: 67, train_loss: 0.4850, test_loss: 1.3761, test_f1: 0.6089
 epoch: 68, train_loss: 0.4446, test_loss: 1.1858, test_f1: 0.5815
 epoch: 69, train_loss: 0.4467, test_loss: 1.0748, test_f1: 0.6597
 epoch: 70, train_loss: 0.4605, test_loss: 1.1194, test_f1: 0.6523
 epoch: 71, train_loss: 0.4500, test_loss: 1.2058, test_f1: 0.5924
 epoch: 72, train_loss: 0.4144, test_loss: 1.2009, test_f1: 0.6487
 epoch: 73, train_loss: 0.4312, test_loss: 1.2223, test_f1: 0.6324
 epoch: 74, train_loss: 0.3969, test_loss: 1.2985, test_f1: 0.6101
 epoch: 75, train_loss: 0.4377, test_loss: 1.2266, test_f1: 0.6272
 epoch: 76, train_loss: 0.4150, test_loss: 1.3011, test_f1: 0.6282
 epoch: 77, train_loss: 0.3932, test_loss: 1.2597, test_f1: 0.6381
 epoch: 78, train_loss: 0.3734, test_loss: 1.3922, test_f1: 0.6394
 epoch: 79, train_loss: 0.3856, test_loss: 1.3330, test_f1: 0.6516
 epoch: 80, train_loss: 0.3697, test_loss: 1.2094, test_f1: 0.6318
 epoch: 81, train_loss: 0.3794, test_loss: 1.1277, test_f1: 0.6475
 epoch: 82, train_loss: 0.3866, test_loss: 1.2541, test_f1: 0.6175
 epoch: 83, train_loss: 0.3439, test_loss: 1.5188, test_f1: 0.6265
 epoch: 84, train_loss: 0.3561, test_loss: 1.4222, test_f1: 0.6761
 epoch: 85, train_loss: 0.3587, test_loss: 1.3779, test_f1: 0.6597
 epoch: 86, train_loss: 0.3732, test_loss: 1.4392, test_f1: 0.6472
 epoch: 87, train_loss: 0.3718, test_loss: 1.6074, test_f1: 0.5914
 epoch: 88, train_loss: 0.4118, test_loss: 1.7112, test_f1: 0.5841
 epoch: 89, train_loss: 0.4693, test_loss: 1.6179, test_f1: 0.5665
 epoch: 90, train_loss: 0.5010, test_loss: 1.4396, test_f1: 0.5633
 epoch: 91, train_loss: 0.4941, test_loss: 1.1920, test_f1: 0.6154
 epoch: 92, train_loss: 0.4763, test_loss: 1.0752, test_f1: 0.5978
 epoch: 93, train_loss: 0.4239, test_loss: 1.1094, test_f1: 0.6173
 epoch: 94, train_loss: 0.4021, test_loss: 1.2848, test_f1: 0.6364
 epoch: 95, train_loss: 0.3763, test_loss: 1.4313, test_f1: 0.5874
 epoch: 96, train_loss: 0.3838, test_loss: 1.3435, test_f1: 0.5859
 epoch: 97, train_loss: 0.3811, test_loss: 1.2812, test_f1: 0.5999
 epoch: 98, train_loss: 0.3591, test_loss: 1.4764, test_f1: 0.6007
 epoch: 99, train_loss: 0.3703, test_loss: 1.3371, test_f1: 0.6122
##################ITERATION #7 ****************************************
 epoch: 0, train_loss: 1.4850, test_loss: 1.5713, test_f1: 0.3392
 epoch: 1, train_loss: 1.1130, test_loss: 1.3928, test_f1: 0.3017
 epoch: 2, train_loss: 1.0151, test_loss: 1.4077, test_f1: 0.3332
 epoch: 3, train_loss: 0.9525, test_loss: 1.5824, test_f1: 0.2337
 epoch: 4, train_loss: 0.9268, test_loss: 1.9330, test_f1: 0.1279
 epoch: 5, train_loss: 0.8909, test_loss: 2.1863, test_f1: 0.1254
 epoch: 6, train_loss: 0.8485, test_loss: 1.5321, test_f1: 0.2796
 epoch: 7, train_loss: 0.8112, test_loss: 1.4764, test_f1: 0.3080
 epoch: 8, train_loss: 0.7819, test_loss: 1.9516, test_f1: 0.3666
 epoch: 9, train_loss: 0.7850, test_loss: 1.5576, test_f1: 0.4127
 epoch: 10, train_loss: 0.7571, test_loss: 1.2090, test_f1: 0.5415
 epoch: 11, train_loss: 0.8035, test_loss: 1.4413, test_f1: 0.4441
 epoch: 12, train_loss: 0.7923, test_loss: 0.9409, test_f1: 0.5797
 epoch: 13, train_loss: 0.7735, test_loss: 1.0094, test_f1: 0.5490
 epoch: 14, train_loss: 0.7536, test_loss: 1.1017, test_f1: 0.5757
 epoch: 15, train_loss: 0.7552, test_loss: 1.0709, test_f1: 0.5040
 epoch: 16, train_loss: 0.7245, test_loss: 1.1537, test_f1: 0.4449
 epoch: 17, train_loss: 0.7384, test_loss: 0.9770, test_f1: 0.4761
 epoch: 18, train_loss: 0.7030, test_loss: 1.0475, test_f1: 0.5008
 epoch: 19, train_loss: 0.6961, test_loss: 0.9373, test_f1: 0.6175
 epoch: 20, train_loss: 0.7521, test_loss: 1.2226, test_f1: 0.5630
 epoch: 21, train_loss: 0.7333, test_loss: 0.9445, test_f1: 0.5984
 epoch: 22, train_loss: 0.7408, test_loss: 0.9315, test_f1: 0.6467
 epoch: 23, train_loss: 0.7238, test_loss: 1.0156, test_f1: 0.6423
 epoch: 24, train_loss: 0.7432, test_loss: 1.1188, test_f1: 0.4432
 epoch: 25, train_loss: 0.7202, test_loss: 1.0992, test_f1: 0.5995
 epoch: 26, train_loss: 0.6874, test_loss: 1.0477, test_f1: 0.6135
 epoch: 27, train_loss: 0.6605, test_loss: 1.2950, test_f1: 0.5100
 epoch: 28, train_loss: 0.6642, test_loss: 1.4304, test_f1: 0.4688
 epoch: 29, train_loss: 0.6717, test_loss: 0.9961, test_f1: 0.6115
 epoch: 30, train_loss: 0.6583, test_loss: 0.9614, test_f1: 0.6358
 epoch: 31, train_loss: 0.6393, test_loss: 1.0387, test_f1: 0.6125
 epoch: 32, train_loss: 0.6342, test_loss: 1.0114, test_f1: 0.6083
 epoch: 33, train_loss: 0.6813, test_loss: 1.0042, test_f1: 0.6089
 epoch: 34, train_loss: 0.6671, test_loss: 1.2325, test_f1: 0.4903
 epoch: 35, train_loss: 0.6469, test_loss: 1.4049, test_f1: 0.5426
 epoch: 36, train_loss: 0.6496, test_loss: 2.2666, test_f1: 0.3988
 epoch: 37, train_loss: 0.6418, test_loss: 1.1033, test_f1: 0.5326
 epoch: 38, train_loss: 0.6360, test_loss: 1.0694, test_f1: 0.6307
 epoch: 39, train_loss: 0.6404, test_loss: 1.2879, test_f1: 0.6326
 epoch: 40, train_loss: 0.6378, test_loss: 1.4038, test_f1: 0.4809
 epoch: 41, train_loss: 0.6259, test_loss: 1.1439, test_f1: 0.6069
 epoch: 42, train_loss: 0.6263, test_loss: 1.0697, test_f1: 0.5620
 epoch: 43, train_loss: 0.6073, test_loss: 1.0214, test_f1: 0.5701
 epoch: 44, train_loss: 0.6011, test_loss: 1.0732, test_f1: 0.6189
 epoch: 45, train_loss: 0.6022, test_loss: 1.3369, test_f1: 0.6149
 epoch: 46, train_loss: 0.5645, test_loss: 1.1466, test_f1: 0.6824
 epoch: 47, train_loss: 0.5767, test_loss: 1.3810, test_f1: 0.5894
 epoch: 48, train_loss: 0.5643, test_loss: 1.2642, test_f1: 0.6449
 epoch: 49, train_loss: 0.5777, test_loss: 1.1195, test_f1: 0.5852
 epoch: 50, train_loss: 0.5749, test_loss: 1.4458, test_f1: 0.4935
 epoch: 51, train_loss: 0.5574, test_loss: 1.3027, test_f1: 0.6415
 epoch: 52, train_loss: 0.5372, test_loss: 1.1184, test_f1: 0.6305
 epoch: 53, train_loss: 0.5278, test_loss: 1.2177, test_f1: 0.5986
 epoch: 54, train_loss: 0.5053, test_loss: 1.4056, test_f1: 0.5886
 epoch: 55, train_loss: 0.4958, test_loss: 1.3481, test_f1: 0.6290
 epoch: 56, train_loss: 0.4948, test_loss: 1.2945, test_f1: 0.6210
 epoch: 57, train_loss: 0.4982, test_loss: 1.5660, test_f1: 0.5716
 epoch: 58, train_loss: 0.5197, test_loss: 1.3359, test_f1: 0.5923
 epoch: 59, train_loss: 0.4917, test_loss: 1.3145, test_f1: 0.5774
 epoch: 60, train_loss: 0.4695, test_loss: 1.3201, test_f1: 0.6381
 epoch: 61, train_loss: 0.5004, test_loss: 1.3549, test_f1: 0.6315
 epoch: 62, train_loss: 0.5253, test_loss: 1.8257, test_f1: 0.5286
 epoch: 63, train_loss: 0.4933, test_loss: 1.1950, test_f1: 0.6678
 epoch: 64, train_loss: 0.4904, test_loss: 1.2484, test_f1: 0.5592
 epoch: 65, train_loss: 0.4859, test_loss: 1.3232, test_f1: 0.5316
 epoch: 66, train_loss: 0.4941, test_loss: 1.0798, test_f1: 0.6612
 epoch: 67, train_loss: 0.4869, test_loss: 1.0847, test_f1: 0.6356
 epoch: 68, train_loss: 0.4709, test_loss: 1.3003, test_f1: 0.5597
 epoch: 69, train_loss: 0.4478, test_loss: 1.3969, test_f1: 0.5933
 epoch: 70, train_loss: 0.4591, test_loss: 1.2993, test_f1: 0.6635
 epoch: 71, train_loss: 0.4579, test_loss: 1.3639, test_f1: 0.6031
 epoch: 72, train_loss: 0.4595, test_loss: 1.4252, test_f1: 0.6163
 epoch: 73, train_loss: 0.4494, test_loss: 1.1638, test_f1: 0.6103
 epoch: 74, train_loss: 0.5429, test_loss: 1.2744, test_f1: 0.6404
 epoch: 75, train_loss: 0.4987, test_loss: 1.3590, test_f1: 0.5932
 epoch: 76, train_loss: 0.4897, test_loss: 1.6614, test_f1: 0.6037
 epoch: 77, train_loss: 0.5012, test_loss: 1.5130, test_f1: 0.6447
 epoch: 78, train_loss: 0.4620, test_loss: 1.5388, test_f1: 0.6102
 epoch: 79, train_loss: 0.4497, test_loss: 1.5432, test_f1: 0.5918
 epoch: 80, train_loss: 0.4254, test_loss: 1.5671, test_f1: 0.6166
 epoch: 81, train_loss: 0.4080, test_loss: 1.5855, test_f1: 0.5977
 epoch: 82, train_loss: 0.4280, test_loss: 1.5571, test_f1: 0.6194
 epoch: 83, train_loss: 0.4076, test_loss: 1.5747, test_f1: 0.6019
 epoch: 84, train_loss: 0.3968, test_loss: 1.5332, test_f1: 0.6145
 epoch: 85, train_loss: 0.4228, test_loss: 2.0269, test_f1: 0.5409
 epoch: 86, train_loss: 0.4394, test_loss: 1.6644, test_f1: 0.5665
 epoch: 87, train_loss: 0.4501, test_loss: 1.7791, test_f1: 0.6041
 epoch: 88, train_loss: 0.4592, test_loss: 1.6811, test_f1: 0.6372
 epoch: 89, train_loss: 0.3955, test_loss: 1.5502, test_f1: 0.6437
 epoch: 90, train_loss: 0.4147, test_loss: 1.6270, test_f1: 0.5822
 epoch: 91, train_loss: 0.3907, test_loss: 1.6358, test_f1: 0.6061
 epoch: 92, train_loss: 0.4133, test_loss: 1.5585, test_f1: 0.6134
 epoch: 93, train_loss: 0.3602, test_loss: 1.6233, test_f1: 0.6360
 epoch: 94, train_loss: 0.3644, test_loss: 1.6710, test_f1: 0.6611
 epoch: 95, train_loss: 0.3574, test_loss: 1.6981, test_f1: 0.6169
 epoch: 96, train_loss: 0.3346, test_loss: 1.8192, test_f1: 0.6333
 epoch: 97, train_loss: 0.3724, test_loss: 2.1286, test_f1: 0.6296
 epoch: 98, train_loss: 0.3772, test_loss: 2.0815, test_f1: 0.6063
 epoch: 99, train_loss: 0.3584, test_loss: 2.1237, test_f1: 0.5633
##################ITERATION #8 ****************************************
 epoch: 0, train_loss: 1.6276, test_loss: 1.7740, test_f1: 0.1365
 epoch: 1, train_loss: 1.0537, test_loss: 1.4645, test_f1: 0.1396
 epoch: 2, train_loss: 0.9733, test_loss: 1.3286, test_f1: 0.3664
 epoch: 3, train_loss: 0.9388, test_loss: 1.1468, test_f1: 0.5173
 epoch: 4, train_loss: 0.9389, test_loss: 1.2161, test_f1: 0.3811
 epoch: 5, train_loss: 0.8925, test_loss: 1.4267, test_f1: 0.4041
 epoch: 6, train_loss: 0.8854, test_loss: 1.3552, test_f1: 0.3374
 epoch: 7, train_loss: 0.8519, test_loss: 1.1536, test_f1: 0.4852
 epoch: 8, train_loss: 0.8302, test_loss: 0.9667, test_f1: 0.5275
 epoch: 9, train_loss: 0.8447, test_loss: 1.0375, test_f1: 0.4970
 epoch: 10, train_loss: 0.8373, test_loss: 0.9969, test_f1: 0.5337
 epoch: 11, train_loss: 0.7929, test_loss: 0.9893, test_f1: 0.5472
 epoch: 12, train_loss: 0.8392, test_loss: 1.4482, test_f1: 0.4504
 epoch: 13, train_loss: 0.7834, test_loss: 0.9668, test_f1: 0.5340
 epoch: 14, train_loss: 0.7840, test_loss: 1.0322, test_f1: 0.5436
 epoch: 15, train_loss: 0.8164, test_loss: 1.0033, test_f1: 0.5554
 epoch: 16, train_loss: 0.7825, test_loss: 1.0977, test_f1: 0.5134
 epoch: 17, train_loss: 0.7810, test_loss: 1.1944, test_f1: 0.4723
 epoch: 18, train_loss: 0.7691, test_loss: 0.9452, test_f1: 0.5680
 epoch: 19, train_loss: 0.7634, test_loss: 1.0464, test_f1: 0.5690
 epoch: 20, train_loss: 0.7200, test_loss: 1.1054, test_f1: 0.5513
 epoch: 21, train_loss: 0.7342, test_loss: 0.9853, test_f1: 0.5727
 epoch: 22, train_loss: 0.7220, test_loss: 0.9256, test_f1: 0.5645
 epoch: 23, train_loss: 0.7054, test_loss: 0.9398, test_f1: 0.6226
 epoch: 24, train_loss: 0.7069, test_loss: 1.0296, test_f1: 0.5194
 epoch: 25, train_loss: 0.6824, test_loss: 1.0941, test_f1: 0.5403
 epoch: 26, train_loss: 0.7094, test_loss: 1.0227, test_f1: 0.5939
 epoch: 27, train_loss: 0.7158, test_loss: 0.9449, test_f1: 0.6087
 epoch: 28, train_loss: 0.7402, test_loss: 1.0846, test_f1: 0.5277
 epoch: 29, train_loss: 0.7162, test_loss: 1.1519, test_f1: 0.5427
 epoch: 30, train_loss: 0.6934, test_loss: 1.2070, test_f1: 0.5546
 epoch: 31, train_loss: 0.6695, test_loss: 1.0902, test_f1: 0.6002
 epoch: 32, train_loss: 0.6756, test_loss: 1.1640, test_f1: 0.5968
 epoch: 33, train_loss: 0.6636, test_loss: 1.7808, test_f1: 0.4465
 epoch: 34, train_loss: 0.6632, test_loss: 1.0731, test_f1: 0.5324
 epoch: 35, train_loss: 0.6525, test_loss: 1.0161, test_f1: 0.5397
 epoch: 36, train_loss: 0.6719, test_loss: 1.1122, test_f1: 0.5777
 epoch: 37, train_loss: 0.6695, test_loss: 1.0121, test_f1: 0.6391
 epoch: 38, train_loss: 0.7008, test_loss: 1.1114, test_f1: 0.5497
 epoch: 39, train_loss: 0.6759, test_loss: 1.4482, test_f1: 0.4536
 epoch: 40, train_loss: 0.6426, test_loss: 0.9774, test_f1: 0.6551
 epoch: 41, train_loss: 0.6121, test_loss: 1.0707, test_f1: 0.6300
 epoch: 42, train_loss: 0.6343, test_loss: 1.4164, test_f1: 0.4421
 epoch: 43, train_loss: 0.6150, test_loss: 1.2809, test_f1: 0.4216
 epoch: 44, train_loss: 0.6002, test_loss: 1.0837, test_f1: 0.5606
 epoch: 45, train_loss: 0.6212, test_loss: 1.2223, test_f1: 0.6186
 epoch: 46, train_loss: 0.6215, test_loss: 1.2505, test_f1: 0.5054
 epoch: 47, train_loss: 0.6026, test_loss: 1.0079, test_f1: 0.5976
 epoch: 48, train_loss: 0.5910, test_loss: 1.3690, test_f1: 0.5419
 epoch: 49, train_loss: 0.5850, test_loss: 0.9550, test_f1: 0.6496
 epoch: 50, train_loss: 0.5636, test_loss: 1.0166, test_f1: 0.6196
 epoch: 51, train_loss: 0.5631, test_loss: 1.0076, test_f1: 0.6523
 epoch: 52, train_loss: 0.5261, test_loss: 1.0321, test_f1: 0.6287
 epoch: 53, train_loss: 0.5152, test_loss: 1.0537, test_f1: 0.6069
 epoch: 54, train_loss: 0.5071, test_loss: 1.0536, test_f1: 0.6511
 epoch: 55, train_loss: 0.5226, test_loss: 1.0185, test_f1: 0.6313
 epoch: 56, train_loss: 0.5353, test_loss: 1.6812, test_f1: 0.5227
 epoch: 57, train_loss: 0.5248, test_loss: 1.5197, test_f1: 0.5549
 epoch: 58, train_loss: 0.4923, test_loss: 1.1346, test_f1: 0.6014
 epoch: 59, train_loss: 0.4801, test_loss: 1.0221, test_f1: 0.6460
 epoch: 60, train_loss: 0.4505, test_loss: 1.0437, test_f1: 0.6996
 epoch: 61, train_loss: 0.4644, test_loss: 1.2167, test_f1: 0.6305
 epoch: 62, train_loss: 0.4633, test_loss: 1.1089, test_f1: 0.6728
 epoch: 63, train_loss: 0.4532, test_loss: 1.1469, test_f1: 0.6221
 epoch: 64, train_loss: 0.4418, test_loss: 1.1947, test_f1: 0.5876
 epoch: 65, train_loss: 0.4880, test_loss: 1.0928, test_f1: 0.6310
 epoch: 66, train_loss: 0.5401, test_loss: 1.4276, test_f1: 0.5025
 epoch: 67, train_loss: 0.5410, test_loss: 1.4716, test_f1: 0.5127
 epoch: 68, train_loss: 0.5300, test_loss: 1.3089, test_f1: 0.5715
 epoch: 69, train_loss: 0.5169, test_loss: 1.3145, test_f1: 0.5489
 epoch: 70, train_loss: 0.5112, test_loss: 1.6409, test_f1: 0.5116
 epoch: 71, train_loss: 0.4973, test_loss: 1.3363, test_f1: 0.5896
 epoch: 72, train_loss: 0.4642, test_loss: 1.0984, test_f1: 0.6139
 epoch: 73, train_loss: 0.4704, test_loss: 1.1600, test_f1: 0.5567
 epoch: 74, train_loss: 0.4419, test_loss: 1.1914, test_f1: 0.5541
 epoch: 75, train_loss: 0.4337, test_loss: 1.2323, test_f1: 0.5643
 epoch: 76, train_loss: 0.4212, test_loss: 1.2297, test_f1: 0.6144
 epoch: 77, train_loss: 0.4125, test_loss: 1.1713, test_f1: 0.6179
 epoch: 78, train_loss: 0.4368, test_loss: 1.2386, test_f1: 0.5797
 epoch: 79, train_loss: 0.4312, test_loss: 1.1670, test_f1: 0.6373
 epoch: 80, train_loss: 0.4256, test_loss: 1.1966, test_f1: 0.6117
 epoch: 81, train_loss: 0.4314, test_loss: 1.2222, test_f1: 0.5694
 epoch: 82, train_loss: 0.4554, test_loss: 1.3922, test_f1: 0.5637
 epoch: 83, train_loss: 0.4643, test_loss: 1.3477, test_f1: 0.6112
 epoch: 84, train_loss: 0.4697, test_loss: 1.1716, test_f1: 0.5985
 epoch: 85, train_loss: 0.4547, test_loss: 1.1725, test_f1: 0.5996
 epoch: 86, train_loss: 0.4317, test_loss: 1.0915, test_f1: 0.6235
 epoch: 87, train_loss: 0.4021, test_loss: 1.1551, test_f1: 0.6164
 epoch: 88, train_loss: 0.3850, test_loss: 1.2326, test_f1: 0.5989
 epoch: 89, train_loss: 0.3866, test_loss: 1.2160, test_f1: 0.5927
 epoch: 90, train_loss: 0.3522, test_loss: 1.2480, test_f1: 0.6246
 epoch: 91, train_loss: 0.3801, test_loss: 1.1530, test_f1: 0.6762
 epoch: 92, train_loss: 0.3714, test_loss: 1.2645, test_f1: 0.5965
 epoch: 93, train_loss: 0.3978, test_loss: 1.5509, test_f1: 0.5790
 epoch: 94, train_loss: 0.3856, test_loss: 1.3776, test_f1: 0.5983
 epoch: 95, train_loss: 0.3732, test_loss: 1.3847, test_f1: 0.5979
 epoch: 96, train_loss: 0.4235, test_loss: 1.3978, test_f1: 0.6075
 epoch: 97, train_loss: 0.3721, test_loss: 1.5153, test_f1: 0.5765
 epoch: 98, train_loss: 0.3559, test_loss: 1.3843, test_f1: 0.5983
 epoch: 99, train_loss: 0.3534, test_loss: 1.4094, test_f1: 0.6012
##################ITERATION #9 ****************************************
 epoch: 0, train_loss: 1.7254, test_loss: 1.8897, test_f1: 0.1455
 epoch: 1, train_loss: 1.1434, test_loss: 1.4205, test_f1: 0.2924
 epoch: 2, train_loss: 1.0249, test_loss: 1.3480, test_f1: 0.3095
 epoch: 3, train_loss: 0.9741, test_loss: 1.3217, test_f1: 0.4025
 epoch: 4, train_loss: 0.9208, test_loss: 1.1808, test_f1: 0.4416
 epoch: 5, train_loss: 0.8749, test_loss: 1.1412, test_f1: 0.4102
 epoch: 6, train_loss: 0.8900, test_loss: 1.3150, test_f1: 0.3505
 epoch: 7, train_loss: 0.8593, test_loss: 1.2919, test_f1: 0.4097
 epoch: 8, train_loss: 0.7947, test_loss: 1.3440, test_f1: 0.4063
 epoch: 9, train_loss: 0.7810, test_loss: 2.0055, test_f1: 0.2948
 epoch: 10, train_loss: 0.7972, test_loss: 2.0929, test_f1: 0.3206
 epoch: 11, train_loss: 0.7915, test_loss: 1.6080, test_f1: 0.4375
 epoch: 12, train_loss: 0.7567, test_loss: 1.2049, test_f1: 0.5797
 epoch: 13, train_loss: 0.7305, test_loss: 1.0722, test_f1: 0.5675
 epoch: 14, train_loss: 0.7256, test_loss: 1.1215, test_f1: 0.5229
 epoch: 15, train_loss: 0.7013, test_loss: 0.9926, test_f1: 0.5972
 epoch: 16, train_loss: 0.7099, test_loss: 1.2996, test_f1: 0.4914
 epoch: 17, train_loss: 0.7343, test_loss: 1.0502, test_f1: 0.5106
 epoch: 18, train_loss: 0.6937, test_loss: 1.4015, test_f1: 0.4306
 epoch: 19, train_loss: 0.6912, test_loss: 1.5459, test_f1: 0.4032
 epoch: 20, train_loss: 0.6598, test_loss: 1.1739, test_f1: 0.5640
 epoch: 21, train_loss: 0.6573, test_loss: 1.1132, test_f1: 0.6210
 epoch: 22, train_loss: 0.6409, test_loss: 1.0818, test_f1: 0.5881
 epoch: 23, train_loss: 0.6145, test_loss: 1.2936, test_f1: 0.5066
 epoch: 24, train_loss: 0.6889, test_loss: 1.1662, test_f1: 0.6153
 epoch: 25, train_loss: 0.7098, test_loss: 1.4333, test_f1: 0.5402
 epoch: 26, train_loss: 0.6725, test_loss: 1.4646, test_f1: 0.5270
 epoch: 27, train_loss: 0.6751, test_loss: 1.3679, test_f1: 0.3895
 epoch: 28, train_loss: 0.6552, test_loss: 1.1281, test_f1: 0.6139
 epoch: 29, train_loss: 0.6524, test_loss: 1.1166, test_f1: 0.6100
 epoch: 30, train_loss: 0.6389, test_loss: 1.6181, test_f1: 0.5390
 epoch: 31, train_loss: 0.6139, test_loss: 2.2087, test_f1: 0.3753
 epoch: 32, train_loss: 0.5998, test_loss: 1.2030, test_f1: 0.5834
 epoch: 33, train_loss: 0.6874, test_loss: 2.4072, test_f1: 0.4164
 epoch: 34, train_loss: 0.6537, test_loss: 1.0832, test_f1: 0.5599
 epoch: 35, train_loss: 0.6396, test_loss: 1.0899, test_f1: 0.5727
 epoch: 36, train_loss: 0.6461, test_loss: 1.1542, test_f1: 0.5570
 epoch: 37, train_loss: 0.6269, test_loss: 1.1866, test_f1: 0.6180
 epoch: 38, train_loss: 0.6059, test_loss: 1.2099, test_f1: 0.5902
 epoch: 39, train_loss: 0.6179, test_loss: 1.0850, test_f1: 0.5560
 epoch: 40, train_loss: 0.6097, test_loss: 0.9864, test_f1: 0.6380
 epoch: 41, train_loss: 0.5701, test_loss: 1.3696, test_f1: 0.5496
 epoch: 42, train_loss: 0.5714, test_loss: 1.1552, test_f1: 0.5859
 epoch: 43, train_loss: 0.5890, test_loss: 1.0036, test_f1: 0.6103
 epoch: 44, train_loss: 0.5384, test_loss: 1.1659, test_f1: 0.6335
 epoch: 45, train_loss: 0.5392, test_loss: 1.2009, test_f1: 0.5905
 epoch: 46, train_loss: 0.5363, test_loss: 1.2149, test_f1: 0.5823
 epoch: 47, train_loss: 0.5372, test_loss: 1.1456, test_f1: 0.6137
 epoch: 48, train_loss: 0.5621, test_loss: 1.4265, test_f1: 0.6286
 epoch: 49, train_loss: 0.5322, test_loss: 1.4868, test_f1: 0.5881
 epoch: 50, train_loss: 0.5084, test_loss: 1.5583, test_f1: 0.6133
 epoch: 51, train_loss: 0.4835, test_loss: 1.5969, test_f1: 0.6087
 epoch: 52, train_loss: 0.4922, test_loss: 1.2701, test_f1: 0.6378
 epoch: 53, train_loss: 0.4797, test_loss: 1.3085, test_f1: 0.6317
 epoch: 54, train_loss: 0.4691, test_loss: 1.3072, test_f1: 0.6189
 epoch: 55, train_loss: 0.4740, test_loss: 1.2500, test_f1: 0.5663
 epoch: 56, train_loss: 0.5269, test_loss: 1.3650, test_f1: 0.5278
 epoch: 57, train_loss: 0.5174, test_loss: 1.3376, test_f1: 0.5650
 epoch: 58, train_loss: 0.4879, test_loss: 1.4916, test_f1: 0.5722
 epoch: 59, train_loss: 0.4908, test_loss: 1.2976, test_f1: 0.6360
 epoch: 60, train_loss: 0.4721, test_loss: 1.2718, test_f1: 0.6126
 epoch: 61, train_loss: 0.4531, test_loss: 1.4183, test_f1: 0.5845
 epoch: 62, train_loss: 0.4534, test_loss: 1.2269, test_f1: 0.5766
 epoch: 63, train_loss: 0.4324, test_loss: 1.2992, test_f1: 0.5832
 epoch: 64, train_loss: 0.4461, test_loss: 1.1579, test_f1: 0.6509
 epoch: 65, train_loss: 0.4153, test_loss: 1.2396, test_f1: 0.6222
 epoch: 66, train_loss: 0.4296, test_loss: 1.2791, test_f1: 0.6118
 epoch: 67, train_loss: 0.4368, test_loss: 1.1847, test_f1: 0.6574
 epoch: 68, train_loss: 0.4414, test_loss: 1.1326, test_f1: 0.6505
 epoch: 69, train_loss: 0.4186, test_loss: 1.4281, test_f1: 0.5725
 epoch: 70, train_loss: 0.4441, test_loss: 1.1982, test_f1: 0.6402
 epoch: 71, train_loss: 0.4014, test_loss: 1.2073, test_f1: 0.6262
 epoch: 72, train_loss: 0.4224, test_loss: 1.2298, test_f1: 0.5621
 epoch: 73, train_loss: 0.4160, test_loss: 1.3096, test_f1: 0.5968
 epoch: 74, train_loss: 0.4052, test_loss: 1.2863, test_f1: 0.5654
 epoch: 75, train_loss: 0.4070, test_loss: 1.1632, test_f1: 0.6216
 epoch: 76, train_loss: 0.4318, test_loss: 1.2551, test_f1: 0.6021
 epoch: 77, train_loss: 0.4064, test_loss: 1.2196, test_f1: 0.6324
 epoch: 78, train_loss: 0.3740, test_loss: 1.3986, test_f1: 0.6304
 epoch: 79, train_loss: 0.4201, test_loss: 1.4943, test_f1: 0.6076
 epoch: 80, train_loss: 0.4077, test_loss: 1.3968, test_f1: 0.6382
 epoch: 81, train_loss: 0.4040, test_loss: 1.3568, test_f1: 0.6189
 epoch: 82, train_loss: 0.3777, test_loss: 1.4046, test_f1: 0.6506
 epoch: 83, train_loss: 0.3671, test_loss: 1.4163, test_f1: 0.6178
 epoch: 84, train_loss: 0.3644, test_loss: 1.2641, test_f1: 0.6440
 epoch: 85, train_loss: 0.3462, test_loss: 1.3829, test_f1: 0.6256
 epoch: 86, train_loss: 0.3706, test_loss: 1.3061, test_f1: 0.6384
 epoch: 87, train_loss: 0.3811, test_loss: 1.7082, test_f1: 0.5588
 epoch: 88, train_loss: 0.3890, test_loss: 1.2391, test_f1: 0.6206
 epoch: 89, train_loss: 0.3913, test_loss: 1.2720, test_f1: 0.5991
 epoch: 90, train_loss: 0.3797, test_loss: 1.3191, test_f1: 0.6169
 epoch: 91, train_loss: 0.3855, test_loss: 1.4742, test_f1: 0.6154
 epoch: 92, train_loss: 0.4362, test_loss: 1.5010, test_f1: 0.5879
 epoch: 93, train_loss: 0.4256, test_loss: 1.4389, test_f1: 0.5343
 epoch: 94, train_loss: 0.4101, test_loss: 1.2579, test_f1: 0.6256
 epoch: 95, train_loss: 0.3700, test_loss: 1.4344, test_f1: 0.6303
 epoch: 96, train_loss: 0.3959, test_loss: 1.4128, test_f1: 0.6387
 epoch: 97, train_loss: 0.3759, test_loss: 1.4773, test_f1: 0.6338
 epoch: 98, train_loss: 0.3650, test_loss: 1.3306, test_f1: 0.6405
 epoch: 99, train_loss: 0.3498, test_loss: 1.4261, test_f1: 0.6233

Training completed in 305.71 seconds
Best F1: 0.6996 at epoch 60
Mean F1 across iterations: 0.6811  0.0140
========================FINAL RESULTS================================
FEGIN weighted F1: 0.6996  0.0140
python main.py --data ltspice_demos --representation component_pin --model FEGIN --layers 3 --hiddens 64 --batch_size 256 --lr 0.01 --emb_size 250 --epochs 100 --save_appendix component_pin_L3_H64_BS256_LR0.01_E250 --no_val
-----



STDERR:
  File "main.py", line 370, in <module>
    main()
  File "main.py", line 254, in main
    dataset = dataset_class(
  File "/home/philip/projects/ltspice_examples_code_repo/Circuit-Completion-Using-GNNs/component_classification_with_link_prediction_head/evaluation/FEGIN/kernel/circuit_datasets.py", line 15, in __init__
    self.data, self.slices = torch.load(self.processed_paths[0])
  File "/home/philip/.local/lib/python3.8/site-packages/torch/serialization.py", line 1040, in load
    warnings.warn(
  File "/usr/lib/python3.8/warnings.py", line 109, in _showwarnmsg
    sw(msg.message, msg.category, msg.filename, msg.lineno,
  File "main.py", line 47, in warn_with_traceback
    traceback.print_stack(file=log)
/home/philip/projects/ltspice_examples_code_repo/Circuit-Completion-Using-GNNs/component_classification_with_link_prediction_head/evaluation/FEGIN/kernel/circuit_datasets.py:15: FutureWarning: You are using `torch.load` with `weights_only=False` (the current default value), which uses the default pickle module implicitly. It is possible to construct malicious pickle data which will execute arbitrary code during unpickling (See https://github.com/pytorch/pytorch/blob/main/SECURITY.md#untrusted-models for more details). In a future release, the default value for `weights_only` will be flipped to `True`. This limits the functions that could be executed during unpickling. Arbitrary objects will no longer be allowed to be loaded via this mode unless they are explicitly allowlisted by the user via `torch.serialization.add_safe_globals`. We recommend you start setting `weights_only=True` for any use case where you don't have full control of the loaded file. Please open an issue on GitHub for any issues related to this experimental feature.
  self.data, self.slices = torch.load(self.processed_paths[0])
