STDOUT:
Results will be saved in /home/philip/projects/ltspice_examples_code_repo/Circuit-Completion-Using-GNNs/component_classification_with_link_prediction_head/evaluation/FEGIN/results/model_FEGIN_dataset_ltspice_demos
Command line input: python main.py --data ltspice_demos --representation component_pin_net --model FEGIN --layers 2 --hiddens 64 --batch_size 32 --lr 0.01 --emb_size 128 --epochs 100 --save_appendix component_pin_net_L2_H64_BS32_LR0.01_E128 --no_val
 is saved.
-----
ltspice_demos - FEGIN
Using 2 layers, 64 hidden units, h = 2
Loading component_pin_net representation dataset
ENTERED
Training FEGIN on component_pin_net representation
Train: 1565, Test: 383
##################ITERATION #0 ****************************************
 epoch: 0, train_loss: 1.1210, test_loss: 1.3233, test_f1: 0.3288
 epoch: 1, train_loss: 1.0096, test_loss: 1.0713, test_f1: 0.5074
 epoch: 2, train_loss: 0.9645, test_loss: 1.0896, test_f1: 0.4268
 epoch: 3, train_loss: 0.9518, test_loss: 1.1651, test_f1: 0.4713
 epoch: 4, train_loss: 0.9242, test_loss: 1.1490, test_f1: 0.5081
 epoch: 5, train_loss: 0.9038, test_loss: 0.9721, test_f1: 0.5265
 epoch: 6, train_loss: 0.9013, test_loss: 0.9634, test_f1: 0.5705
 epoch: 7, train_loss: 0.8801, test_loss: 1.0473, test_f1: 0.5445
 epoch: 8, train_loss: 0.8563, test_loss: 1.0057, test_f1: 0.5215
 epoch: 9, train_loss: 0.8302, test_loss: 1.0418, test_f1: 0.4034
 epoch: 10, train_loss: 0.8331, test_loss: 1.0172, test_f1: 0.5625
 epoch: 11, train_loss: 0.8066, test_loss: 1.5463, test_f1: 0.4403
 epoch: 12, train_loss: 0.8817, test_loss: 1.0225, test_f1: 0.5769
 epoch: 13, train_loss: 0.8597, test_loss: 0.9785, test_f1: 0.4554
 epoch: 14, train_loss: 0.7958, test_loss: 0.9321, test_f1: 0.6359
 epoch: 15, train_loss: 0.7891, test_loss: 1.1238, test_f1: 0.5495
 epoch: 16, train_loss: 0.7767, test_loss: 1.0237, test_f1: 0.5658
 epoch: 17, train_loss: 0.7780, test_loss: 1.5581, test_f1: 0.4216
 epoch: 18, train_loss: 0.7691, test_loss: 1.1205, test_f1: 0.5250
 epoch: 19, train_loss: 0.7425, test_loss: 1.0093, test_f1: 0.5709
 epoch: 20, train_loss: 0.7558, test_loss: 1.0635, test_f1: 0.5166
 epoch: 21, train_loss: 0.7575, test_loss: 1.1526, test_f1: 0.4885
 epoch: 22, train_loss: 0.7423, test_loss: 0.9805, test_f1: 0.5349
 epoch: 23, train_loss: 0.7362, test_loss: 1.1809, test_f1: 0.5319
 epoch: 24, train_loss: 0.7331, test_loss: 1.0195, test_f1: 0.5895
 epoch: 25, train_loss: 0.7051, test_loss: 0.9608, test_f1: 0.6152
 epoch: 26, train_loss: 0.7057, test_loss: 1.2174, test_f1: 0.5434
 epoch: 27, train_loss: 0.7154, test_loss: 1.5868, test_f1: 0.5623
 epoch: 28, train_loss: 0.7159, test_loss: 1.0116, test_f1: 0.5827
 epoch: 29, train_loss: 0.7217, test_loss: 1.0460, test_f1: 0.6089
 epoch: 30, train_loss: 0.6930, test_loss: 1.2446, test_f1: 0.5871
 epoch: 31, train_loss: 0.6789, test_loss: 1.1801, test_f1: 0.5436
 epoch: 32, train_loss: 0.6693, test_loss: 1.2826, test_f1: 0.5154
 epoch: 33, train_loss: 0.6888, test_loss: 1.0216, test_f1: 0.5770
 epoch: 34, train_loss: 0.6911, test_loss: 1.2188, test_f1: 0.5191
 epoch: 35, train_loss: 0.6513, test_loss: 1.6030, test_f1: 0.6069
 epoch: 36, train_loss: 0.6689, test_loss: 1.1113, test_f1: 0.5959
 epoch: 37, train_loss: 0.6487, test_loss: 1.6224, test_f1: 0.5346
 epoch: 38, train_loss: 0.6658, test_loss: 1.1183, test_f1: 0.5496
 epoch: 39, train_loss: 0.6288, test_loss: 1.7034, test_f1: 0.5591
 epoch: 40, train_loss: 0.6427, test_loss: 1.1215, test_f1: 0.4716
 epoch: 41, train_loss: 0.6567, test_loss: 1.9346, test_f1: 0.4707
 epoch: 42, train_loss: 0.6459, test_loss: 1.1761, test_f1: 0.5917
 epoch: 43, train_loss: 0.6229, test_loss: 1.7499, test_f1: 0.5341
 epoch: 44, train_loss: 0.6057, test_loss: 1.2526, test_f1: 0.5984
 epoch: 45, train_loss: 0.6063, test_loss: 1.5763, test_f1: 0.5482
 epoch: 46, train_loss: 0.6355, test_loss: 1.2027, test_f1: 0.5957
 epoch: 47, train_loss: 0.6161, test_loss: 1.1676, test_f1: 0.5984
 epoch: 48, train_loss: 0.6089, test_loss: 1.0765, test_f1: 0.6499
 epoch: 49, train_loss: 0.5934, test_loss: 1.4106, test_f1: 0.5937
 epoch: 50, train_loss: 0.6081, test_loss: 1.0876, test_f1: 0.6116
 epoch: 51, train_loss: 0.5309, test_loss: 1.3405, test_f1: 0.6172
 epoch: 52, train_loss: 0.5315, test_loss: 1.3669, test_f1: 0.6043
 epoch: 53, train_loss: 0.5152, test_loss: 1.1117, test_f1: 0.6102
 epoch: 54, train_loss: 0.5229, test_loss: 1.2623, test_f1: 0.6107
 epoch: 55, train_loss: 0.5220, test_loss: 1.3324, test_f1: 0.5998
 epoch: 56, train_loss: 0.4939, test_loss: 1.5300, test_f1: 0.5879
 epoch: 57, train_loss: 0.5075, test_loss: 1.5460, test_f1: 0.6258
 epoch: 58, train_loss: 0.4708, test_loss: 1.3164, test_f1: 0.6257
 epoch: 59, train_loss: 0.4827, test_loss: 1.4558, test_f1: 0.6194
 epoch: 60, train_loss: 0.4793, test_loss: 1.3717, test_f1: 0.5756
 epoch: 61, train_loss: 0.4731, test_loss: 1.5570, test_f1: 0.6101
 epoch: 62, train_loss: 0.4777, test_loss: 1.5911, test_f1: 0.6177
 epoch: 63, train_loss: 0.4763, test_loss: 1.5042, test_f1: 0.6072
 epoch: 64, train_loss: 0.4693, test_loss: 1.6428, test_f1: 0.5897
 epoch: 65, train_loss: 0.4666, test_loss: 1.3529, test_f1: 0.5965
 epoch: 66, train_loss: 0.4444, test_loss: 1.4577, test_f1: 0.6504
 epoch: 67, train_loss: 0.4422, test_loss: 1.5272, test_f1: 0.6151
 epoch: 68, train_loss: 0.4687, test_loss: 1.3167, test_f1: 0.6204
 epoch: 69, train_loss: 0.4319, test_loss: 1.4627, test_f1: 0.5726
 epoch: 70, train_loss: 0.4381, test_loss: 1.8209, test_f1: 0.5904
 epoch: 71, train_loss: 0.4508, test_loss: 1.5486, test_f1: 0.6161
 epoch: 72, train_loss: 0.4516, test_loss: 1.5930, test_f1: 0.6312
 epoch: 73, train_loss: 0.4358, test_loss: 1.5656, test_f1: 0.6363
 epoch: 74, train_loss: 0.4402, test_loss: 1.6164, test_f1: 0.5845
 epoch: 75, train_loss: 0.3904, test_loss: 1.6637, test_f1: 0.6182
 epoch: 76, train_loss: 0.4040, test_loss: 1.6023, test_f1: 0.6157
 epoch: 77, train_loss: 0.4264, test_loss: 1.5518, test_f1: 0.6347
 epoch: 78, train_loss: 0.4130, test_loss: 1.8458, test_f1: 0.5785
 epoch: 79, train_loss: 0.4122, test_loss: 1.4441, test_f1: 0.6700
 epoch: 80, train_loss: 0.4039, test_loss: 1.7432, test_f1: 0.6293
 epoch: 81, train_loss: 0.4019, test_loss: 1.4488, test_f1: 0.6303
 epoch: 82, train_loss: 0.4017, test_loss: 1.8566, test_f1: 0.5942
 epoch: 83, train_loss: 0.4157, test_loss: 1.6555, test_f1: 0.5965
 epoch: 84, train_loss: 0.4129, test_loss: 1.5958, test_f1: 0.6473
 epoch: 85, train_loss: 0.4358, test_loss: 1.7679, test_f1: 0.6160
 epoch: 86, train_loss: 0.3849, test_loss: 1.4734, test_f1: 0.6313
 epoch: 87, train_loss: 0.4239, test_loss: 1.6862, test_f1: 0.6067
 epoch: 88, train_loss: 0.3778, test_loss: 1.8122, test_f1: 0.6238
 epoch: 89, train_loss: 0.4099, test_loss: 1.7732, test_f1: 0.6017
 epoch: 90, train_loss: 0.3973, test_loss: 1.6094, test_f1: 0.6454
 epoch: 91, train_loss: 0.3492, test_loss: 1.6954, test_f1: 0.6355
 epoch: 92, train_loss: 0.3902, test_loss: 1.5963, test_f1: 0.6183
 epoch: 93, train_loss: 0.3952, test_loss: 1.5154, test_f1: 0.6451
 epoch: 94, train_loss: 0.3999, test_loss: 1.7585, test_f1: 0.6189
 epoch: 95, train_loss: 0.3903, test_loss: 1.5517, test_f1: 0.6102
 epoch: 96, train_loss: 0.4000, test_loss: 1.4976, test_f1: 0.5953
 epoch: 97, train_loss: 0.3860, test_loss: 1.6398, test_f1: 0.6174
 epoch: 98, train_loss: 0.3749, test_loss: 1.6315, test_f1: 0.5990
 epoch: 99, train_loss: 0.3482, test_loss: 1.8791, test_f1: 0.5739
##################ITERATION #1 ****************************************
 epoch: 0, train_loss: 1.0865, test_loss: 1.2065, test_f1: 0.4406
 epoch: 1, train_loss: 0.9616, test_loss: 1.1532, test_f1: 0.4591
 epoch: 2, train_loss: 0.9288, test_loss: 0.9901, test_f1: 0.5528
 epoch: 3, train_loss: 0.8966, test_loss: 0.9787, test_f1: 0.6035
 epoch: 4, train_loss: 0.8862, test_loss: 1.0562, test_f1: 0.4612
 epoch: 5, train_loss: 0.8601, test_loss: 1.5640, test_f1: 0.3845
 epoch: 6, train_loss: 0.8512, test_loss: 1.0964, test_f1: 0.5925
 epoch: 7, train_loss: 0.8548, test_loss: 1.0437, test_f1: 0.4100
 epoch: 8, train_loss: 0.8261, test_loss: 1.0137, test_f1: 0.4704
 epoch: 9, train_loss: 0.8199, test_loss: 0.9804, test_f1: 0.4825
 epoch: 10, train_loss: 0.8229, test_loss: 0.9869, test_f1: 0.6145
 epoch: 11, train_loss: 0.8111, test_loss: 1.0258, test_f1: 0.4748
 epoch: 12, train_loss: 0.8091, test_loss: 1.0453, test_f1: 0.5233
 epoch: 13, train_loss: 0.8068, test_loss: 1.0713, test_f1: 0.4656
 epoch: 14, train_loss: 0.7917, test_loss: 1.0398, test_f1: 0.5101
 epoch: 15, train_loss: 0.8057, test_loss: 0.9995, test_f1: 0.5507
 epoch: 16, train_loss: 0.7666, test_loss: 1.1648, test_f1: 0.4059
 epoch: 17, train_loss: 0.7773, test_loss: 1.1371, test_f1: 0.5055
 epoch: 18, train_loss: 0.7533, test_loss: 1.0572, test_f1: 0.5255
 epoch: 19, train_loss: 0.7534, test_loss: 1.4570, test_f1: 0.4853
 epoch: 20, train_loss: 0.7544, test_loss: 1.0926, test_f1: 0.4697
 epoch: 21, train_loss: 0.7645, test_loss: 1.0168, test_f1: 0.5437
 epoch: 22, train_loss: 0.7244, test_loss: 1.1259, test_f1: 0.5405
 epoch: 23, train_loss: 0.7470, test_loss: 1.0780, test_f1: 0.5388
 epoch: 24, train_loss: 0.7094, test_loss: 1.3490, test_f1: 0.5654
 epoch: 25, train_loss: 0.7037, test_loss: 1.0545, test_f1: 0.5370
 epoch: 26, train_loss: 0.6865, test_loss: 1.2418, test_f1: 0.4633
 epoch: 27, train_loss: 0.7061, test_loss: 1.2158, test_f1: 0.5764
 epoch: 28, train_loss: 0.7226, test_loss: 1.2040, test_f1: 0.5207
 epoch: 29, train_loss: 0.6617, test_loss: 1.1677, test_f1: 0.4779
 epoch: 30, train_loss: 0.6672, test_loss: 2.4128, test_f1: 0.4676
 epoch: 31, train_loss: 0.6886, test_loss: 1.2331, test_f1: 0.5569
 epoch: 32, train_loss: 0.6730, test_loss: 1.3739, test_f1: 0.4512
 epoch: 33, train_loss: 0.6749, test_loss: 1.4343, test_f1: 0.5516
 epoch: 34, train_loss: 0.6440, test_loss: 1.2484, test_f1: 0.5785
 epoch: 35, train_loss: 0.6638, test_loss: 1.1947, test_f1: 0.5198
 epoch: 36, train_loss: 0.6479, test_loss: 1.5579, test_f1: 0.5693
 epoch: 37, train_loss: 0.6494, test_loss: 1.1022, test_f1: 0.5334
 epoch: 38, train_loss: 0.6832, test_loss: 1.1316, test_f1: 0.5714
 epoch: 39, train_loss: 0.6311, test_loss: 1.3502, test_f1: 0.5145
 epoch: 40, train_loss: 0.6048, test_loss: 1.2731, test_f1: 0.5400
 epoch: 41, train_loss: 0.6578, test_loss: 1.2695, test_f1: 0.5302
 epoch: 42, train_loss: 0.6271, test_loss: 1.4614, test_f1: 0.5645
 epoch: 43, train_loss: 0.5956, test_loss: 1.2193, test_f1: 0.5992
 epoch: 44, train_loss: 0.5811, test_loss: 1.4131, test_f1: 0.5805
 epoch: 45, train_loss: 0.6049, test_loss: 1.3082, test_f1: 0.5568
 epoch: 46, train_loss: 0.6398, test_loss: 1.3908, test_f1: 0.5999
 epoch: 47, train_loss: 0.6199, test_loss: 1.5844, test_f1: 0.5539
 epoch: 48, train_loss: 0.6361, test_loss: 1.3662, test_f1: 0.5455
 epoch: 49, train_loss: 0.6000, test_loss: 1.1393, test_f1: 0.5070
 epoch: 50, train_loss: 0.6134, test_loss: 1.2627, test_f1: 0.5308
 epoch: 51, train_loss: 0.5445, test_loss: 1.2898, test_f1: 0.6005
 epoch: 52, train_loss: 0.5289, test_loss: 1.4075, test_f1: 0.5662
 epoch: 53, train_loss: 0.5148, test_loss: 1.4299, test_f1: 0.5622
 epoch: 54, train_loss: 0.5018, test_loss: 1.4345, test_f1: 0.5642
 epoch: 55, train_loss: 0.4884, test_loss: 1.5499, test_f1: 0.5589
 epoch: 56, train_loss: 0.4689, test_loss: 1.8708, test_f1: 0.5733
 epoch: 57, train_loss: 0.5038, test_loss: 1.3544, test_f1: 0.5628
 epoch: 58, train_loss: 0.5014, test_loss: 1.4146, test_f1: 0.6030
 epoch: 59, train_loss: 0.4685, test_loss: 1.3467, test_f1: 0.5788
 epoch: 60, train_loss: 0.4690, test_loss: 1.5181, test_f1: 0.5681
 epoch: 61, train_loss: 0.4792, test_loss: 1.4500, test_f1: 0.5515
 epoch: 62, train_loss: 0.4611, test_loss: 1.5681, test_f1: 0.5534
 epoch: 63, train_loss: 0.4456, test_loss: 1.5128, test_f1: 0.5884
 epoch: 64, train_loss: 0.4596, test_loss: 1.6407, test_f1: 0.5586
 epoch: 65, train_loss: 0.4663, test_loss: 1.5589, test_f1: 0.5935
 epoch: 66, train_loss: 0.4497, test_loss: 1.4946, test_f1: 0.5335
 epoch: 67, train_loss: 0.4410, test_loss: 1.5443, test_f1: 0.6200
 epoch: 68, train_loss: 0.4367, test_loss: 1.6783, test_f1: 0.6124
 epoch: 69, train_loss: 0.4591, test_loss: 1.5252, test_f1: 0.5471
 epoch: 70, train_loss: 0.4382, test_loss: 1.4871, test_f1: 0.5533
 epoch: 71, train_loss: 0.4204, test_loss: 1.4916, test_f1: 0.5889
 epoch: 72, train_loss: 0.4357, test_loss: 1.6677, test_f1: 0.6148
 epoch: 73, train_loss: 0.4144, test_loss: 1.6085, test_f1: 0.6110
 epoch: 74, train_loss: 0.4405, test_loss: 1.3734, test_f1: 0.6112
 epoch: 75, train_loss: 0.4389, test_loss: 1.5590, test_f1: 0.5825
 epoch: 76, train_loss: 0.4410, test_loss: 1.8241, test_f1: 0.5010
 epoch: 77, train_loss: 0.4234, test_loss: 1.6424, test_f1: 0.5660
 epoch: 78, train_loss: 0.4019, test_loss: 1.5934, test_f1: 0.5539
 epoch: 79, train_loss: 0.4414, test_loss: 1.5905, test_f1: 0.5621
 epoch: 80, train_loss: 0.3951, test_loss: 1.5067, test_f1: 0.5965
 epoch: 81, train_loss: 0.4211, test_loss: 1.5572, test_f1: 0.6110
 epoch: 82, train_loss: 0.4062, test_loss: 1.6005, test_f1: 0.5874
 epoch: 83, train_loss: 0.3946, test_loss: 1.6028, test_f1: 0.5770
 epoch: 84, train_loss: 0.3961, test_loss: 1.6310, test_f1: 0.6364
 epoch: 85, train_loss: 0.3946, test_loss: 1.6970, test_f1: 0.5930
 epoch: 86, train_loss: 0.4105, test_loss: 1.5518, test_f1: 0.6308
 epoch: 87, train_loss: 0.3873, test_loss: 1.7040, test_f1: 0.6243
 epoch: 88, train_loss: 0.4024, test_loss: 1.4715, test_f1: 0.6206
 epoch: 89, train_loss: 0.3705, test_loss: 1.7426, test_f1: 0.5561
 epoch: 90, train_loss: 0.3830, test_loss: 1.6424, test_f1: 0.6437
 epoch: 91, train_loss: 0.3771, test_loss: 1.8369, test_f1: 0.6166
 epoch: 92, train_loss: 0.3836, test_loss: 1.8495, test_f1: 0.6341
 epoch: 93, train_loss: 0.3847, test_loss: 1.7402, test_f1: 0.5963
 epoch: 94, train_loss: 0.3971, test_loss: 1.9427, test_f1: 0.5470
 epoch: 95, train_loss: 0.3863, test_loss: 1.7492, test_f1: 0.5520
 epoch: 96, train_loss: 0.3777, test_loss: 1.7619, test_f1: 0.5739
 epoch: 97, train_loss: 0.4245, test_loss: 1.7246, test_f1: 0.6006
 epoch: 98, train_loss: 0.3715, test_loss: 1.6199, test_f1: 0.5701
 epoch: 99, train_loss: 0.4005, test_loss: 1.5111, test_f1: 0.6059
##################ITERATION #2 ****************************************
 epoch: 0, train_loss: 1.1343, test_loss: 1.3137, test_f1: 0.3243
 epoch: 1, train_loss: 0.9374, test_loss: 1.0580, test_f1: 0.5723
 epoch: 2, train_loss: 0.8891, test_loss: 1.0534, test_f1: 0.4625
 epoch: 3, train_loss: 0.8997, test_loss: 0.9830, test_f1: 0.5470
 epoch: 4, train_loss: 0.8653, test_loss: 1.1084, test_f1: 0.5332
 epoch: 5, train_loss: 0.8764, test_loss: 1.0653, test_f1: 0.4881
 epoch: 6, train_loss: 0.8257, test_loss: 1.1132, test_f1: 0.5582
 epoch: 7, train_loss: 0.8229, test_loss: 1.0573, test_f1: 0.5804
 epoch: 8, train_loss: 0.8390, test_loss: 1.0317, test_f1: 0.5114
 epoch: 9, train_loss: 0.8205, test_loss: 1.0503, test_f1: 0.5003
 epoch: 10, train_loss: 0.7947, test_loss: 0.9384, test_f1: 0.5970
 epoch: 11, train_loss: 0.8056, test_loss: 0.9423, test_f1: 0.5977
 epoch: 12, train_loss: 0.7786, test_loss: 1.0763, test_f1: 0.4336
 epoch: 13, train_loss: 0.7895, test_loss: 0.9940, test_f1: 0.5802
 epoch: 14, train_loss: 0.7904, test_loss: 1.0095, test_f1: 0.5261
 epoch: 15, train_loss: 0.7731, test_loss: 1.0655, test_f1: 0.5618
 epoch: 16, train_loss: 0.7572, test_loss: 1.1456, test_f1: 0.5313
 epoch: 17, train_loss: 0.7736, test_loss: 1.0574, test_f1: 0.5469
 epoch: 18, train_loss: 0.7474, test_loss: 1.0649, test_f1: 0.5490
 epoch: 19, train_loss: 0.7314, test_loss: 0.9766, test_f1: 0.6438
 epoch: 20, train_loss: 0.7362, test_loss: 0.9854, test_f1: 0.6075
 epoch: 21, train_loss: 0.7103, test_loss: 0.9850, test_f1: 0.6077
 epoch: 22, train_loss: 0.7188, test_loss: 1.0715, test_f1: 0.5473
 epoch: 23, train_loss: 0.7376, test_loss: 1.0053, test_f1: 0.5809
 epoch: 24, train_loss: 0.6937, test_loss: 1.1100, test_f1: 0.5846
 epoch: 25, train_loss: 0.6836, test_loss: 1.1647, test_f1: 0.5925
 epoch: 26, train_loss: 0.7206, test_loss: 1.3276, test_f1: 0.5686
 epoch: 27, train_loss: 0.7191, test_loss: 1.3035, test_f1: 0.5521
 epoch: 28, train_loss: 0.6686, test_loss: 1.1640, test_f1: 0.5677
 epoch: 29, train_loss: 0.6674, test_loss: 1.0026, test_f1: 0.5478
 epoch: 30, train_loss: 0.6387, test_loss: 1.1418, test_f1: 0.6081
 epoch: 31, train_loss: 0.6829, test_loss: 1.1649, test_f1: 0.4595
 epoch: 32, train_loss: 0.7165, test_loss: 1.0701, test_f1: 0.5530
 epoch: 33, train_loss: 0.7149, test_loss: 1.0301, test_f1: 0.5357
 epoch: 34, train_loss: 0.6470, test_loss: 1.0282, test_f1: 0.5913
 epoch: 35, train_loss: 0.6300, test_loss: 1.2606, test_f1: 0.6090
 epoch: 36, train_loss: 0.6128, test_loss: 1.2172, test_f1: 0.5440
 epoch: 37, train_loss: 0.6648, test_loss: 1.1608, test_f1: 0.5785
 epoch: 38, train_loss: 0.6301, test_loss: 1.8180, test_f1: 0.5900
 epoch: 39, train_loss: 0.6133, test_loss: 1.3639, test_f1: 0.6024
 epoch: 40, train_loss: 0.6518, test_loss: 1.0850, test_f1: 0.5865
 epoch: 41, train_loss: 0.6169, test_loss: 1.4967, test_f1: 0.5444
 epoch: 42, train_loss: 0.6065, test_loss: 1.3870, test_f1: 0.5901
 epoch: 43, train_loss: 0.6097, test_loss: 1.2481, test_f1: 0.5485
 epoch: 44, train_loss: 0.5953, test_loss: 1.1736, test_f1: 0.5947
 epoch: 45, train_loss: 0.5701, test_loss: 1.1874, test_f1: 0.5807
 epoch: 46, train_loss: 0.5856, test_loss: 1.8507, test_f1: 0.6065
 epoch: 47, train_loss: 0.5812, test_loss: 1.4764, test_f1: 0.4945
 epoch: 48, train_loss: 0.5728, test_loss: 1.0897, test_f1: 0.6165
 epoch: 49, train_loss: 0.5713, test_loss: 1.2591, test_f1: 0.6165
 epoch: 50, train_loss: 0.5664, test_loss: 1.1701, test_f1: 0.6255
 epoch: 51, train_loss: 0.5330, test_loss: 1.1278, test_f1: 0.6549
 epoch: 52, train_loss: 0.5105, test_loss: 1.1469, test_f1: 0.6442
 epoch: 53, train_loss: 0.5053, test_loss: 1.2917, test_f1: 0.5733
 epoch: 54, train_loss: 0.4594, test_loss: 1.4793, test_f1: 0.6289
 epoch: 55, train_loss: 0.4881, test_loss: 1.2414, test_f1: 0.6301
 epoch: 56, train_loss: 0.4608, test_loss: 1.3535, test_f1: 0.6215
 epoch: 57, train_loss: 0.4711, test_loss: 1.1367, test_f1: 0.6245
 epoch: 58, train_loss: 0.4616, test_loss: 1.2760, test_f1: 0.6517
 epoch: 59, train_loss: 0.4593, test_loss: 1.4378, test_f1: 0.5798
 epoch: 60, train_loss: 0.4327, test_loss: 1.6444, test_f1: 0.6007
 epoch: 61, train_loss: 0.4545, test_loss: 1.6733, test_f1: 0.5335
 epoch: 62, train_loss: 0.4548, test_loss: 1.2775, test_f1: 0.6161
 epoch: 63, train_loss: 0.4576, test_loss: 1.4156, test_f1: 0.6261
 epoch: 64, train_loss: 0.4585, test_loss: 1.4838, test_f1: 0.6158
 epoch: 65, train_loss: 0.4698, test_loss: 1.3337, test_f1: 0.5769
 epoch: 66, train_loss: 0.4220, test_loss: 1.4682, test_f1: 0.6176
 epoch: 67, train_loss: 0.4298, test_loss: 1.3237, test_f1: 0.6116
 epoch: 68, train_loss: 0.4393, test_loss: 1.1977, test_f1: 0.6360
 epoch: 69, train_loss: 0.4614, test_loss: 1.3495, test_f1: 0.6267
 epoch: 70, train_loss: 0.4518, test_loss: 1.3719, test_f1: 0.6206
 epoch: 71, train_loss: 0.4032, test_loss: 1.7213, test_f1: 0.6014
 epoch: 72, train_loss: 0.4115, test_loss: 1.4913, test_f1: 0.6017
 epoch: 73, train_loss: 0.4210, test_loss: 1.6734, test_f1: 0.6038
 epoch: 74, train_loss: 0.3950, test_loss: 1.2747, test_f1: 0.6221
 epoch: 75, train_loss: 0.4324, test_loss: 1.6649, test_f1: 0.5612
 epoch: 76, train_loss: 0.3935, test_loss: 1.4154, test_f1: 0.6136
 epoch: 77, train_loss: 0.3899, test_loss: 1.4455, test_f1: 0.5793
 epoch: 78, train_loss: 0.3750, test_loss: 1.4477, test_f1: 0.5972
 epoch: 79, train_loss: 0.4084, test_loss: 1.4389, test_f1: 0.6206
 epoch: 80, train_loss: 0.4162, test_loss: 1.6399, test_f1: 0.6022
 epoch: 81, train_loss: 0.4039, test_loss: 1.5232, test_f1: 0.5899
 epoch: 82, train_loss: 0.3396, test_loss: 1.4939, test_f1: 0.6222
 epoch: 83, train_loss: 0.3749, test_loss: 1.4630, test_f1: 0.5892
 epoch: 84, train_loss: 0.3873, test_loss: 1.4943, test_f1: 0.5568
 epoch: 85, train_loss: 0.3940, test_loss: 1.6231, test_f1: 0.5685
 epoch: 86, train_loss: 0.3686, test_loss: 1.5389, test_f1: 0.6213
 epoch: 87, train_loss: 0.4050, test_loss: 1.4708, test_f1: 0.5769
 epoch: 88, train_loss: 0.3818, test_loss: 1.3923, test_f1: 0.6552
 epoch: 89, train_loss: 0.3467, test_loss: 1.4818, test_f1: 0.6320
 epoch: 90, train_loss: 0.3700, test_loss: 1.4206, test_f1: 0.6372
 epoch: 91, train_loss: 0.3594, test_loss: 1.5840, test_f1: 0.6145
 epoch: 92, train_loss: 0.3447, test_loss: 1.7664, test_f1: 0.5957
 epoch: 93, train_loss: 0.3977, test_loss: 1.4490, test_f1: 0.6392
 epoch: 94, train_loss: 0.3537, test_loss: 1.6195, test_f1: 0.5921
 epoch: 95, train_loss: 0.3444, test_loss: 1.5908, test_f1: 0.5653
 epoch: 96, train_loss: 0.3645, test_loss: 1.8458, test_f1: 0.5906
 epoch: 97, train_loss: 0.3201, test_loss: 1.5379, test_f1: 0.6025
 epoch: 98, train_loss: 0.3594, test_loss: 1.6271, test_f1: 0.6083
 epoch: 99, train_loss: 0.3703, test_loss: 1.8454, test_f1: 0.5902
##################ITERATION #3 ****************************************
 epoch: 0, train_loss: 1.0886, test_loss: 1.2008, test_f1: 0.4306
 epoch: 1, train_loss: 0.9679, test_loss: 1.0029, test_f1: 0.4686
 epoch: 2, train_loss: 0.9220, test_loss: 0.9415, test_f1: 0.5766
 epoch: 3, train_loss: 0.9087, test_loss: 1.0937, test_f1: 0.3476
 epoch: 4, train_loss: 0.9086, test_loss: 1.0214, test_f1: 0.4911
 epoch: 5, train_loss: 0.8806, test_loss: 1.0464, test_f1: 0.5111
 epoch: 6, train_loss: 0.8564, test_loss: 1.0087, test_f1: 0.4982
 epoch: 7, train_loss: 0.8516, test_loss: 0.9870, test_f1: 0.4346
 epoch: 8, train_loss: 0.8383, test_loss: 1.1578, test_f1: 0.5385
 epoch: 9, train_loss: 0.8431, test_loss: 0.9711, test_f1: 0.6086
 epoch: 10, train_loss: 0.8415, test_loss: 1.0810, test_f1: 0.4960
 epoch: 11, train_loss: 0.8203, test_loss: 1.0597, test_f1: 0.5096
 epoch: 12, train_loss: 0.8140, test_loss: 1.0205, test_f1: 0.5172
 epoch: 13, train_loss: 0.8227, test_loss: 1.0015, test_f1: 0.5722
 epoch: 14, train_loss: 0.8102, test_loss: 0.9406, test_f1: 0.5669
 epoch: 15, train_loss: 0.8099, test_loss: 1.0062, test_f1: 0.5235
 epoch: 16, train_loss: 0.7735, test_loss: 0.9951, test_f1: 0.5569
 epoch: 17, train_loss: 0.8091, test_loss: 1.0374, test_f1: 0.5005
 epoch: 18, train_loss: 0.7914, test_loss: 1.0002, test_f1: 0.5627
 epoch: 19, train_loss: 0.7928, test_loss: 1.0378, test_f1: 0.5366
 epoch: 20, train_loss: 0.7705, test_loss: 1.0442, test_f1: 0.5806
 epoch: 21, train_loss: 0.7701, test_loss: 1.1792, test_f1: 0.4864
 epoch: 22, train_loss: 0.7555, test_loss: 0.9973, test_f1: 0.5336
 epoch: 23, train_loss: 0.7857, test_loss: 0.9837, test_f1: 0.5425
 epoch: 24, train_loss: 0.7724, test_loss: 0.9945, test_f1: 0.5956
 epoch: 25, train_loss: 0.7438, test_loss: 1.1447, test_f1: 0.5203
 epoch: 26, train_loss: 0.7435, test_loss: 1.1260, test_f1: 0.5033
 epoch: 27, train_loss: 0.7263, test_loss: 1.0309, test_f1: 0.6320
 epoch: 28, train_loss: 0.7307, test_loss: 1.2928, test_f1: 0.5793
 epoch: 29, train_loss: 0.7299, test_loss: 1.1714, test_f1: 0.5461
 epoch: 30, train_loss: 0.7385, test_loss: 1.1653, test_f1: 0.5925
 epoch: 31, train_loss: 0.7104, test_loss: 0.9881, test_f1: 0.6382
 epoch: 32, train_loss: 0.6979, test_loss: 1.1643, test_f1: 0.5590
 epoch: 33, train_loss: 0.7116, test_loss: 1.0904, test_f1: 0.5125
 epoch: 34, train_loss: 0.6843, test_loss: 1.1911, test_f1: 0.4292
 epoch: 35, train_loss: 0.6843, test_loss: 1.0548, test_f1: 0.6781
 epoch: 36, train_loss: 0.6884, test_loss: 1.1157, test_f1: 0.5471
 epoch: 37, train_loss: 0.6619, test_loss: 1.0535, test_f1: 0.6508
 epoch: 38, train_loss: 0.6875, test_loss: 1.1279, test_f1: 0.5832
 epoch: 39, train_loss: 0.6789, test_loss: 1.1779, test_f1: 0.5739
 epoch: 40, train_loss: 0.6866, test_loss: 0.9845, test_f1: 0.6236
 epoch: 41, train_loss: 0.6282, test_loss: 1.2230, test_f1: 0.5509
 epoch: 42, train_loss: 0.6552, test_loss: 1.0700, test_f1: 0.6571
 epoch: 43, train_loss: 0.6708, test_loss: 1.1537, test_f1: 0.6214
 epoch: 44, train_loss: 0.6375, test_loss: 1.2850, test_f1: 0.5564
 epoch: 45, train_loss: 0.6434, test_loss: 1.1627, test_f1: 0.6192
 epoch: 46, train_loss: 0.6074, test_loss: 1.2672, test_f1: 0.6070
 epoch: 47, train_loss: 0.6375, test_loss: 1.0065, test_f1: 0.6672
 epoch: 48, train_loss: 0.6320, test_loss: 1.1767, test_f1: 0.5773
 epoch: 49, train_loss: 0.6254, test_loss: 2.1717, test_f1: 0.4244
 epoch: 50, train_loss: 0.6211, test_loss: 1.2267, test_f1: 0.5834
 epoch: 51, train_loss: 0.5840, test_loss: 1.0638, test_f1: 0.6669
 epoch: 52, train_loss: 0.5765, test_loss: 1.1612, test_f1: 0.6102
 epoch: 53, train_loss: 0.5561, test_loss: 1.2933, test_f1: 0.6166
 epoch: 54, train_loss: 0.5445, test_loss: 1.1584, test_f1: 0.5982
 epoch: 55, train_loss: 0.5283, test_loss: 1.1800, test_f1: 0.5939
 epoch: 56, train_loss: 0.5276, test_loss: 1.4191, test_f1: 0.5071
 epoch: 57, train_loss: 0.5287, test_loss: 1.2610, test_f1: 0.6457
 epoch: 58, train_loss: 0.5232, test_loss: 1.5315, test_f1: 0.5707
 epoch: 59, train_loss: 0.5291, test_loss: 1.2695, test_f1: 0.6280
 epoch: 60, train_loss: 0.5266, test_loss: 1.2846, test_f1: 0.6436
 epoch: 61, train_loss: 0.5104, test_loss: 1.4566, test_f1: 0.5441
 epoch: 62, train_loss: 0.5224, test_loss: 1.3058, test_f1: 0.5967
 epoch: 63, train_loss: 0.5217, test_loss: 1.3150, test_f1: 0.6096
 epoch: 64, train_loss: 0.4864, test_loss: 1.4419, test_f1: 0.6309
 epoch: 65, train_loss: 0.5132, test_loss: 1.3268, test_f1: 0.5809
 epoch: 66, train_loss: 0.4996, test_loss: 1.5045, test_f1: 0.6073
 epoch: 67, train_loss: 0.4749, test_loss: 1.4023, test_f1: 0.6772
 epoch: 68, train_loss: 0.4443, test_loss: 1.6610, test_f1: 0.6203
 epoch: 69, train_loss: 0.4658, test_loss: 1.5562, test_f1: 0.6285
 epoch: 70, train_loss: 0.5189, test_loss: 1.3561, test_f1: 0.6376
 epoch: 71, train_loss: 0.4776, test_loss: 1.3297, test_f1: 0.6398
 epoch: 72, train_loss: 0.4652, test_loss: 1.4731, test_f1: 0.6288
 epoch: 73, train_loss: 0.4466, test_loss: 1.3894, test_f1: 0.6203
 epoch: 74, train_loss: 0.4545, test_loss: 1.4529, test_f1: 0.5978
 epoch: 75, train_loss: 0.4671, test_loss: 1.3804, test_f1: 0.6397
 epoch: 76, train_loss: 0.4948, test_loss: 1.5147, test_f1: 0.6279
 epoch: 77, train_loss: 0.4624, test_loss: 1.7163, test_f1: 0.5869
 epoch: 78, train_loss: 0.4799, test_loss: 1.7680, test_f1: 0.5957
 epoch: 79, train_loss: 0.4529, test_loss: 1.7945, test_f1: 0.5782
 epoch: 80, train_loss: 0.4337, test_loss: 1.6611, test_f1: 0.6336
 epoch: 81, train_loss: 0.4853, test_loss: 1.5421, test_f1: 0.6112
 epoch: 82, train_loss: 0.4644, test_loss: 1.5627, test_f1: 0.6125
 epoch: 83, train_loss: 0.4331, test_loss: 1.6605, test_f1: 0.6017
 epoch: 84, train_loss: 0.4632, test_loss: 1.8192, test_f1: 0.5975
 epoch: 85, train_loss: 0.4353, test_loss: 1.8881, test_f1: 0.6067
 epoch: 86, train_loss: 0.4654, test_loss: 1.5411, test_f1: 0.6066
 epoch: 87, train_loss: 0.4359, test_loss: 1.6216, test_f1: 0.5998
 epoch: 88, train_loss: 0.4405, test_loss: 1.8788, test_f1: 0.6206
 epoch: 89, train_loss: 0.4382, test_loss: 1.6115, test_f1: 0.6243
 epoch: 90, train_loss: 0.3888, test_loss: 1.8094, test_f1: 0.6181
 epoch: 91, train_loss: 0.4376, test_loss: 1.6597, test_f1: 0.5923
 epoch: 92, train_loss: 0.4595, test_loss: 1.9689, test_f1: 0.6234
 epoch: 93, train_loss: 0.4154, test_loss: 2.0108, test_f1: 0.5651
 epoch: 94, train_loss: 0.3997, test_loss: 1.4436, test_f1: 0.6701
 epoch: 95, train_loss: 0.4195, test_loss: 1.8926, test_f1: 0.6103
 epoch: 96, train_loss: 0.3966, test_loss: 1.9267, test_f1: 0.5992
 epoch: 97, train_loss: 0.4123, test_loss: 1.8710, test_f1: 0.6150
 epoch: 98, train_loss: 0.4060, test_loss: 1.6835, test_f1: 0.5966
 epoch: 99, train_loss: 0.3694, test_loss: 1.9129, test_f1: 0.5876
##################ITERATION #4 ****************************************
 epoch: 0, train_loss: 1.1454, test_loss: 1.1058, test_f1: 0.4940
 epoch: 1, train_loss: 0.9605, test_loss: 1.0863, test_f1: 0.5242
 epoch: 2, train_loss: 0.9073, test_loss: 0.9991, test_f1: 0.5082
 epoch: 3, train_loss: 0.8883, test_loss: 1.0308, test_f1: 0.5580
 epoch: 4, train_loss: 0.8875, test_loss: 1.1137, test_f1: 0.4361
 epoch: 5, train_loss: 0.8763, test_loss: 0.9842, test_f1: 0.5131
 epoch: 6, train_loss: 0.8646, test_loss: 1.0603, test_f1: 0.4997
 epoch: 7, train_loss: 0.8353, test_loss: 1.0182, test_f1: 0.5506
 epoch: 8, train_loss: 0.8245, test_loss: 1.4289, test_f1: 0.4285
 epoch: 9, train_loss: 0.8311, test_loss: 1.0546, test_f1: 0.5185
 epoch: 10, train_loss: 0.8354, test_loss: 0.9844, test_f1: 0.5613
 epoch: 11, train_loss: 0.8221, test_loss: 1.0581, test_f1: 0.5376
 epoch: 12, train_loss: 0.7933, test_loss: 1.0005, test_f1: 0.5347
 epoch: 13, train_loss: 0.8029, test_loss: 1.0016, test_f1: 0.5088
 epoch: 14, train_loss: 0.8239, test_loss: 1.5277, test_f1: 0.4656
 epoch: 15, train_loss: 0.8283, test_loss: 1.1545, test_f1: 0.5217
 epoch: 16, train_loss: 0.8275, test_loss: 0.9716, test_f1: 0.5743
 epoch: 17, train_loss: 0.7950, test_loss: 1.0122, test_f1: 0.5604
 epoch: 18, train_loss: 0.7834, test_loss: 1.0794, test_f1: 0.5444
 epoch: 19, train_loss: 0.7732, test_loss: 0.9892, test_f1: 0.5877
 epoch: 20, train_loss: 0.7525, test_loss: 1.0386, test_f1: 0.5537
 epoch: 21, train_loss: 0.7452, test_loss: 1.1589, test_f1: 0.4731
 epoch: 22, train_loss: 0.7528, test_loss: 1.2756, test_f1: 0.5065
 epoch: 23, train_loss: 0.7691, test_loss: 1.1052, test_f1: 0.5355
 epoch: 24, train_loss: 0.7405, test_loss: 1.0826, test_f1: 0.5559
 epoch: 25, train_loss: 0.7536, test_loss: 1.0473, test_f1: 0.4963
 epoch: 26, train_loss: 0.7569, test_loss: 1.1033, test_f1: 0.4299
 epoch: 27, train_loss: 0.7474, test_loss: 1.0158, test_f1: 0.5060
 epoch: 28, train_loss: 0.7191, test_loss: 1.0578, test_f1: 0.5737
 epoch: 29, train_loss: 0.6987, test_loss: 0.9553, test_f1: 0.6225
 epoch: 30, train_loss: 0.7114, test_loss: 1.4165, test_f1: 0.5198
 epoch: 31, train_loss: 0.7211, test_loss: 1.2219, test_f1: 0.5017
 epoch: 32, train_loss: 0.7120, test_loss: 1.0664, test_f1: 0.4998
 epoch: 33, train_loss: 0.6821, test_loss: 1.8181, test_f1: 0.4886
 epoch: 34, train_loss: 0.6957, test_loss: 1.0040, test_f1: 0.5561
 epoch: 35, train_loss: 0.6803, test_loss: 1.1836, test_f1: 0.5692
 epoch: 36, train_loss: 0.6639, test_loss: 1.5008, test_f1: 0.5627
 epoch: 37, train_loss: 0.6630, test_loss: 1.1306, test_f1: 0.5993
 epoch: 38, train_loss: 0.6481, test_loss: 1.0928, test_f1: 0.6095
 epoch: 39, train_loss: 0.6598, test_loss: 1.2222, test_f1: 0.5823
 epoch: 40, train_loss: 0.6622, test_loss: 1.1959, test_f1: 0.5534
 epoch: 41, train_loss: 0.6355, test_loss: 1.2383, test_f1: 0.5686
 epoch: 42, train_loss: 0.6479, test_loss: 1.1692, test_f1: 0.5767
 epoch: 43, train_loss: 0.6485, test_loss: 1.2660, test_f1: 0.5285
 epoch: 44, train_loss: 0.6256, test_loss: 1.2397, test_f1: 0.5209
 epoch: 45, train_loss: 0.6198, test_loss: 1.0790, test_f1: 0.6227
 epoch: 46, train_loss: 0.6320, test_loss: 1.1579, test_f1: 0.5918
 epoch: 47, train_loss: 0.6298, test_loss: 1.1164, test_f1: 0.5801
 epoch: 48, train_loss: 0.6357, test_loss: 1.1246, test_f1: 0.5750
 epoch: 49, train_loss: 0.6524, test_loss: 1.2374, test_f1: 0.5307
 epoch: 50, train_loss: 0.6342, test_loss: 1.1374, test_f1: 0.6079
 epoch: 51, train_loss: 0.5947, test_loss: 1.0793, test_f1: 0.6543
 epoch: 52, train_loss: 0.5470, test_loss: 1.2458, test_f1: 0.6118
 epoch: 53, train_loss: 0.5559, test_loss: 1.4430, test_f1: 0.6020
 epoch: 54, train_loss: 0.5289, test_loss: 1.3231, test_f1: 0.6128
 epoch: 55, train_loss: 0.5342, test_loss: 1.1564, test_f1: 0.6185
 epoch: 56, train_loss: 0.5145, test_loss: 1.3232, test_f1: 0.5884
 epoch: 57, train_loss: 0.5342, test_loss: 1.4263, test_f1: 0.5650
 epoch: 58, train_loss: 0.5076, test_loss: 1.2960, test_f1: 0.5680
 epoch: 59, train_loss: 0.4983, test_loss: 1.0855, test_f1: 0.6433
 epoch: 60, train_loss: 0.5187, test_loss: 1.6420, test_f1: 0.5797
 epoch: 61, train_loss: 0.4751, test_loss: 1.4400, test_f1: 0.6221
 epoch: 62, train_loss: 0.5019, test_loss: 1.4622, test_f1: 0.5474
 epoch: 63, train_loss: 0.5081, test_loss: 1.4359, test_f1: 0.5820
 epoch: 64, train_loss: 0.4791, test_loss: 1.5186, test_f1: 0.5931
 epoch: 65, train_loss: 0.5181, test_loss: 1.1493, test_f1: 0.6328
 epoch: 66, train_loss: 0.4949, test_loss: 1.3243, test_f1: 0.6060
 epoch: 67, train_loss: 0.4922, test_loss: 1.6870, test_f1: 0.5791
 epoch: 68, train_loss: 0.4906, test_loss: 1.2328, test_f1: 0.6702
 epoch: 69, train_loss: 0.4655, test_loss: 1.5069, test_f1: 0.5520
 epoch: 70, train_loss: 0.4753, test_loss: 1.5181, test_f1: 0.6134
 epoch: 71, train_loss: 0.4540, test_loss: 1.3827, test_f1: 0.5818
 epoch: 72, train_loss: 0.4888, test_loss: 1.3826, test_f1: 0.6413
 epoch: 73, train_loss: 0.4724, test_loss: 1.2917, test_f1: 0.5963
 epoch: 74, train_loss: 0.4534, test_loss: 1.2208, test_f1: 0.6402
 epoch: 75, train_loss: 0.4474, test_loss: 1.4787, test_f1: 0.5638
 epoch: 76, train_loss: 0.4681, test_loss: 1.2170, test_f1: 0.6560
 epoch: 77, train_loss: 0.4472, test_loss: 1.5680, test_f1: 0.5780
 epoch: 78, train_loss: 0.4757, test_loss: 1.3487, test_f1: 0.6069
 epoch: 79, train_loss: 0.4600, test_loss: 1.3107, test_f1: 0.6185
 epoch: 80, train_loss: 0.4523, test_loss: 1.6551, test_f1: 0.5600
 epoch: 81, train_loss: 0.4310, test_loss: 1.2586, test_f1: 0.6143
 epoch: 82, train_loss: 0.4448, test_loss: 1.5106, test_f1: 0.5867
 epoch: 83, train_loss: 0.4440, test_loss: 1.5895, test_f1: 0.5408
 epoch: 84, train_loss: 0.4612, test_loss: 1.3957, test_f1: 0.5881
 epoch: 85, train_loss: 0.4403, test_loss: 1.4743, test_f1: 0.5611
 epoch: 86, train_loss: 0.4220, test_loss: 1.5627, test_f1: 0.5790
 epoch: 87, train_loss: 0.4398, test_loss: 1.4225, test_f1: 0.5722
 epoch: 88, train_loss: 0.4192, test_loss: 1.4170, test_f1: 0.5815
 epoch: 89, train_loss: 0.4171, test_loss: 1.6759, test_f1: 0.5989
 epoch: 90, train_loss: 0.4074, test_loss: 1.4632, test_f1: 0.6125
 epoch: 91, train_loss: 0.4197, test_loss: 1.4007, test_f1: 0.6047
 epoch: 92, train_loss: 0.4037, test_loss: 2.1426, test_f1: 0.5529
 epoch: 93, train_loss: 0.4154, test_loss: 1.3682, test_f1: 0.5863
 epoch: 94, train_loss: 0.3972, test_loss: 1.4597, test_f1: 0.5637
 epoch: 95, train_loss: 0.4219, test_loss: 1.4771, test_f1: 0.5902
 epoch: 96, train_loss: 0.4429, test_loss: 1.6038, test_f1: 0.5635
 epoch: 97, train_loss: 0.3893, test_loss: 1.5282, test_f1: 0.5695
 epoch: 98, train_loss: 0.3972, test_loss: 1.4694, test_f1: 0.5803
 epoch: 99, train_loss: 0.4079, test_loss: 1.4931, test_f1: 0.6530
##################ITERATION #5 ****************************************
 epoch: 0, train_loss: 1.0965, test_loss: 1.0963, test_f1: 0.5005
 epoch: 1, train_loss: 0.9261, test_loss: 1.0846, test_f1: 0.5121
 epoch: 2, train_loss: 0.8908, test_loss: 1.0055, test_f1: 0.5355
 epoch: 3, train_loss: 0.8632, test_loss: 0.9681, test_f1: 0.5261
 epoch: 4, train_loss: 0.8751, test_loss: 1.0132, test_f1: 0.5321
 epoch: 5, train_loss: 0.8625, test_loss: 1.1029, test_f1: 0.4083
 epoch: 6, train_loss: 0.8666, test_loss: 1.0153, test_f1: 0.5367
 epoch: 7, train_loss: 0.8572, test_loss: 0.9932, test_f1: 0.5849
 epoch: 8, train_loss: 0.8656, test_loss: 1.0006, test_f1: 0.5398
 epoch: 9, train_loss: 0.8410, test_loss: 1.0405, test_f1: 0.4863
 epoch: 10, train_loss: 0.8397, test_loss: 1.1332, test_f1: 0.5295
 epoch: 11, train_loss: 0.8345, test_loss: 1.2463, test_f1: 0.5197
 epoch: 12, train_loss: 0.8693, test_loss: 1.0040, test_f1: 0.5628
 epoch: 13, train_loss: 0.8201, test_loss: 1.0584, test_f1: 0.4646
 epoch: 14, train_loss: 0.8180, test_loss: 1.0159, test_f1: 0.5046
 epoch: 15, train_loss: 0.8066, test_loss: 1.0280, test_f1: 0.5748
 epoch: 16, train_loss: 0.7835, test_loss: 0.9648, test_f1: 0.6204
 epoch: 17, train_loss: 0.8171, test_loss: 1.0633, test_f1: 0.4944
 epoch: 18, train_loss: 0.7805, test_loss: 1.0657, test_f1: 0.5174
 epoch: 19, train_loss: 0.7516, test_loss: 1.0375, test_f1: 0.5246
 epoch: 20, train_loss: 0.7462, test_loss: 1.2447, test_f1: 0.5632
 epoch: 21, train_loss: 0.7602, test_loss: 1.3437, test_f1: 0.5953
 epoch: 22, train_loss: 0.7652, test_loss: 1.0616, test_f1: 0.6077
 epoch: 23, train_loss: 0.7256, test_loss: 1.1049, test_f1: 0.6012
 epoch: 24, train_loss: 0.7419, test_loss: 1.4566, test_f1: 0.5370
 epoch: 25, train_loss: 0.7042, test_loss: 1.2142, test_f1: 0.4240
 epoch: 26, train_loss: 0.7426, test_loss: 1.4605, test_f1: 0.3990
 epoch: 27, train_loss: 0.7786, test_loss: 1.0291, test_f1: 0.5724
 epoch: 28, train_loss: 0.6986, test_loss: 1.2639, test_f1: 0.4844
 epoch: 29, train_loss: 0.7187, test_loss: 1.2805, test_f1: 0.4985
 epoch: 30, train_loss: 0.6872, test_loss: 1.1572, test_f1: 0.5550
 epoch: 31, train_loss: 0.7397, test_loss: 1.0584, test_f1: 0.4616
 epoch: 32, train_loss: 0.7340, test_loss: 1.0138, test_f1: 0.4973
 epoch: 33, train_loss: 0.7042, test_loss: 1.0058, test_f1: 0.6072
 epoch: 34, train_loss: 0.6745, test_loss: 1.2157, test_f1: 0.5361
 epoch: 35, train_loss: 0.6605, test_loss: 1.0743, test_f1: 0.5703
 epoch: 36, train_loss: 0.6593, test_loss: 1.3145, test_f1: 0.5157
 epoch: 37, train_loss: 0.6556, test_loss: 1.2659, test_f1: 0.5642
 epoch: 38, train_loss: 0.6593, test_loss: 1.2532, test_f1: 0.5339
 epoch: 39, train_loss: 0.6988, test_loss: 1.3162, test_f1: 0.5507
 epoch: 40, train_loss: 0.6782, test_loss: 2.3574, test_f1: 0.5144
 epoch: 41, train_loss: 0.6618, test_loss: 1.7273, test_f1: 0.4790
 epoch: 42, train_loss: 0.6291, test_loss: 1.1811, test_f1: 0.5441
 epoch: 43, train_loss: 0.6946, test_loss: 1.0948, test_f1: 0.5938
 epoch: 44, train_loss: 0.6331, test_loss: 1.2214, test_f1: 0.5412
 epoch: 45, train_loss: 0.6262, test_loss: 1.3152, test_f1: 0.5632
 epoch: 46, train_loss: 0.6508, test_loss: 1.2087, test_f1: 0.5623
 epoch: 47, train_loss: 0.6344, test_loss: 1.1946, test_f1: 0.6233
 epoch: 48, train_loss: 0.5963, test_loss: 1.2113, test_f1: 0.5726
 epoch: 49, train_loss: 0.5894, test_loss: 1.1191, test_f1: 0.5602
 epoch: 50, train_loss: 0.6128, test_loss: 1.2181, test_f1: 0.5899
 epoch: 51, train_loss: 0.5382, test_loss: 1.3598, test_f1: 0.6122
 epoch: 52, train_loss: 0.5398, test_loss: 1.3836, test_f1: 0.6318
 epoch: 53, train_loss: 0.5263, test_loss: 1.2811, test_f1: 0.5847
 epoch: 54, train_loss: 0.5195, test_loss: 1.2503, test_f1: 0.6029
 epoch: 55, train_loss: 0.5102, test_loss: 1.3693, test_f1: 0.5660
 epoch: 56, train_loss: 0.5165, test_loss: 1.3630, test_f1: 0.5865
 epoch: 57, train_loss: 0.4984, test_loss: 1.3310, test_f1: 0.5938
 epoch: 58, train_loss: 0.5047, test_loss: 1.3620, test_f1: 0.5863
 epoch: 59, train_loss: 0.4809, test_loss: 1.3296, test_f1: 0.5957
 epoch: 60, train_loss: 0.5025, test_loss: 1.3495, test_f1: 0.5815
 epoch: 61, train_loss: 0.4656, test_loss: 1.4844, test_f1: 0.5285
 epoch: 62, train_loss: 0.5045, test_loss: 1.6616, test_f1: 0.5599
 epoch: 63, train_loss: 0.4926, test_loss: 1.6938, test_f1: 0.4992
 epoch: 64, train_loss: 0.4717, test_loss: 1.2175, test_f1: 0.6325
 epoch: 65, train_loss: 0.5153, test_loss: 1.2408, test_f1: 0.6142
 epoch: 66, train_loss: 0.4733, test_loss: 1.2781, test_f1: 0.6330
 epoch: 67, train_loss: 0.4676, test_loss: 1.4669, test_f1: 0.6342
 epoch: 68, train_loss: 0.4693, test_loss: 1.6119, test_f1: 0.6278
 epoch: 69, train_loss: 0.4656, test_loss: 1.5589, test_f1: 0.6032
 epoch: 70, train_loss: 0.4526, test_loss: 1.3984, test_f1: 0.6181
 epoch: 71, train_loss: 0.4910, test_loss: 1.4578, test_f1: 0.6185
 epoch: 72, train_loss: 0.4626, test_loss: 1.5207, test_f1: 0.5969
 epoch: 73, train_loss: 0.4545, test_loss: 1.3727, test_f1: 0.5975
 epoch: 74, train_loss: 0.4414, test_loss: 1.5598, test_f1: 0.6299
 epoch: 75, train_loss: 0.4685, test_loss: 1.3816, test_f1: 0.6258
 epoch: 76, train_loss: 0.4613, test_loss: 1.5866, test_f1: 0.5946
 epoch: 77, train_loss: 0.4680, test_loss: 1.5629, test_f1: 0.5755
 epoch: 78, train_loss: 0.4617, test_loss: 1.4299, test_f1: 0.6202
 epoch: 79, train_loss: 0.4535, test_loss: 1.4929, test_f1: 0.6177
 epoch: 80, train_loss: 0.4487, test_loss: 1.5781, test_f1: 0.6320
 epoch: 81, train_loss: 0.4618, test_loss: 1.7004, test_f1: 0.6036
 epoch: 82, train_loss: 0.4313, test_loss: 1.6069, test_f1: 0.6375
 epoch: 83, train_loss: 0.4182, test_loss: 1.8910, test_f1: 0.6166
 epoch: 84, train_loss: 0.4080, test_loss: 1.5902, test_f1: 0.6053
 epoch: 85, train_loss: 0.4179, test_loss: 1.7929, test_f1: 0.5928
 epoch: 86, train_loss: 0.4147, test_loss: 1.5108, test_f1: 0.6534
 epoch: 87, train_loss: 0.4463, test_loss: 1.6251, test_f1: 0.6474
 epoch: 88, train_loss: 0.4242, test_loss: 1.5946, test_f1: 0.6537
 epoch: 89, train_loss: 0.4162, test_loss: 1.6412, test_f1: 0.6087
 epoch: 90, train_loss: 0.4088, test_loss: 1.6531, test_f1: 0.6379
 epoch: 91, train_loss: 0.4208, test_loss: 1.8378, test_f1: 0.6527
 epoch: 92, train_loss: 0.4653, test_loss: 1.5183, test_f1: 0.6141
 epoch: 93, train_loss: 0.3926, test_loss: 1.4731, test_f1: 0.6310
 epoch: 94, train_loss: 0.4292, test_loss: 1.6578, test_f1: 0.6107
 epoch: 95, train_loss: 0.3805, test_loss: 1.7183, test_f1: 0.6592
 epoch: 96, train_loss: 0.4273, test_loss: 1.5133, test_f1: 0.6438
 epoch: 97, train_loss: 0.4079, test_loss: 1.4119, test_f1: 0.6378
 epoch: 98, train_loss: 0.4010, test_loss: 1.4804, test_f1: 0.6146
 epoch: 99, train_loss: 0.3911, test_loss: 1.3257, test_f1: 0.6482
##################ITERATION #6 ****************************************
 epoch: 0, train_loss: 1.1350, test_loss: 1.1151, test_f1: 0.3511
 epoch: 1, train_loss: 0.9584, test_loss: 1.0234, test_f1: 0.5374
 epoch: 2, train_loss: 0.9092, test_loss: 0.9758, test_f1: 0.5995
 epoch: 3, train_loss: 0.8690, test_loss: 1.0093, test_f1: 0.5320
 epoch: 4, train_loss: 0.8693, test_loss: 1.0965, test_f1: 0.4464
 epoch: 5, train_loss: 0.8533, test_loss: 1.2355, test_f1: 0.4845
 epoch: 6, train_loss: 0.8251, test_loss: 1.0864, test_f1: 0.5333
 epoch: 7, train_loss: 0.8289, test_loss: 1.5468, test_f1: 0.4259
 epoch: 8, train_loss: 0.8246, test_loss: 1.1412, test_f1: 0.5523
 epoch: 9, train_loss: 0.8460, test_loss: 1.5945, test_f1: 0.4687
 epoch: 10, train_loss: 0.8204, test_loss: 1.0849, test_f1: 0.5286
 epoch: 11, train_loss: 0.8375, test_loss: 1.1461, test_f1: 0.4761
 epoch: 12, train_loss: 0.7701, test_loss: 1.0739, test_f1: 0.5549
 epoch: 13, train_loss: 0.7790, test_loss: 0.9722, test_f1: 0.5821
 epoch: 14, train_loss: 0.7384, test_loss: 1.0047, test_f1: 0.5874
 epoch: 15, train_loss: 0.7489, test_loss: 1.2744, test_f1: 0.5540
 epoch: 16, train_loss: 0.7563, test_loss: 1.0307, test_f1: 0.6011
 epoch: 17, train_loss: 0.7606, test_loss: 1.0292, test_f1: 0.5282
 epoch: 18, train_loss: 0.7312, test_loss: 1.6861, test_f1: 0.4995
 epoch: 19, train_loss: 0.7462, test_loss: 1.0601, test_f1: 0.5039
 epoch: 20, train_loss: 0.7184, test_loss: 1.0696, test_f1: 0.5486
 epoch: 21, train_loss: 0.7387, test_loss: 1.0335, test_f1: 0.5923
 epoch: 22, train_loss: 0.6972, test_loss: 1.3004, test_f1: 0.5387
 epoch: 23, train_loss: 0.7139, test_loss: 0.9495, test_f1: 0.6155
 epoch: 24, train_loss: 0.6711, test_loss: 1.0504, test_f1: 0.5440
 epoch: 25, train_loss: 0.6907, test_loss: 1.2045, test_f1: 0.5591
 epoch: 26, train_loss: 0.6972, test_loss: 1.0137, test_f1: 0.5739
 epoch: 27, train_loss: 0.6843, test_loss: 1.1325, test_f1: 0.5508
 epoch: 28, train_loss: 0.6912, test_loss: 1.0521, test_f1: 0.6101
 epoch: 29, train_loss: 0.6950, test_loss: 1.1067, test_f1: 0.5733
 epoch: 30, train_loss: 0.6926, test_loss: 1.3613, test_f1: 0.4569
 epoch: 31, train_loss: 0.6831, test_loss: 1.1332, test_f1: 0.5923
 epoch: 32, train_loss: 0.6873, test_loss: 1.0527, test_f1: 0.5653
 epoch: 33, train_loss: 0.6560, test_loss: 1.2140, test_f1: 0.5985
 epoch: 34, train_loss: 0.6535, test_loss: 1.0836, test_f1: 0.5779
 epoch: 35, train_loss: 0.6302, test_loss: 1.0672, test_f1: 0.5935
 epoch: 36, train_loss: 0.6617, test_loss: 1.3098, test_f1: 0.5572
 epoch: 37, train_loss: 0.6266, test_loss: 1.0161, test_f1: 0.5901
 epoch: 38, train_loss: 0.6079, test_loss: 1.0990, test_f1: 0.5801
 epoch: 39, train_loss: 0.6881, test_loss: 1.0757, test_f1: 0.5846
 epoch: 40, train_loss: 0.6341, test_loss: 1.1241, test_f1: 0.6007
 epoch: 41, train_loss: 0.6381, test_loss: 1.1023, test_f1: 0.5801
 epoch: 42, train_loss: 0.6048, test_loss: 1.1938, test_f1: 0.5179
 epoch: 43, train_loss: 0.6306, test_loss: 1.0081, test_f1: 0.5947
 epoch: 44, train_loss: 0.6025, test_loss: 1.0508, test_f1: 0.6213
 epoch: 45, train_loss: 0.6257, test_loss: 1.1448, test_f1: 0.5206
 epoch: 46, train_loss: 0.6305, test_loss: 1.1412, test_f1: 0.5193
 epoch: 47, train_loss: 0.6157, test_loss: 1.2993, test_f1: 0.5367
 epoch: 48, train_loss: 0.6017, test_loss: 1.0726, test_f1: 0.5699
 epoch: 49, train_loss: 0.6429, test_loss: 1.1611, test_f1: 0.5932
 epoch: 50, train_loss: 0.6185, test_loss: 1.3199, test_f1: 0.5824
 epoch: 51, train_loss: 0.5715, test_loss: 1.0749, test_f1: 0.6173
 epoch: 52, train_loss: 0.5281, test_loss: 1.2717, test_f1: 0.5411
 epoch: 53, train_loss: 0.5463, test_loss: 1.2669, test_f1: 0.5791
 epoch: 54, train_loss: 0.5138, test_loss: 1.1589, test_f1: 0.5934
 epoch: 55, train_loss: 0.5090, test_loss: 1.1969, test_f1: 0.6068
 epoch: 56, train_loss: 0.4813, test_loss: 1.2711, test_f1: 0.5988
 epoch: 57, train_loss: 0.4959, test_loss: 1.5707, test_f1: 0.5643
 epoch: 58, train_loss: 0.4807, test_loss: 1.3035, test_f1: 0.5906
 epoch: 59, train_loss: 0.5111, test_loss: 1.2831, test_f1: 0.5961
 epoch: 60, train_loss: 0.5095, test_loss: 1.3535, test_f1: 0.5736
 epoch: 61, train_loss: 0.4681, test_loss: 1.2141, test_f1: 0.6049
 epoch: 62, train_loss: 0.5166, test_loss: 1.2116, test_f1: 0.5894
 epoch: 63, train_loss: 0.5154, test_loss: 1.4786, test_f1: 0.5574
 epoch: 64, train_loss: 0.4814, test_loss: 1.2518, test_f1: 0.6077
 epoch: 65, train_loss: 0.5111, test_loss: 1.2991, test_f1: 0.5548
 epoch: 66, train_loss: 0.4569, test_loss: 1.3086, test_f1: 0.5909
 epoch: 67, train_loss: 0.4954, test_loss: 1.3543, test_f1: 0.5601
 epoch: 68, train_loss: 0.4752, test_loss: 1.2819, test_f1: 0.5768
 epoch: 69, train_loss: 0.4772, test_loss: 1.2264, test_f1: 0.5884
 epoch: 70, train_loss: 0.4655, test_loss: 1.3428, test_f1: 0.6027
 epoch: 71, train_loss: 0.4416, test_loss: 1.3255, test_f1: 0.6212
 epoch: 72, train_loss: 0.4690, test_loss: 1.6336, test_f1: 0.5652
 epoch: 73, train_loss: 0.4748, test_loss: 1.4973, test_f1: 0.5592
 epoch: 74, train_loss: 0.4434, test_loss: 1.3383, test_f1: 0.5570
 epoch: 75, train_loss: 0.4915, test_loss: 1.3917, test_f1: 0.5514
 epoch: 76, train_loss: 0.4462, test_loss: 1.3169, test_f1: 0.6124
 epoch: 77, train_loss: 0.4403, test_loss: 1.5166, test_f1: 0.5571
 epoch: 78, train_loss: 0.4622, test_loss: 1.5343, test_f1: 0.5883
 epoch: 79, train_loss: 0.4360, test_loss: 1.2265, test_f1: 0.5741
 epoch: 80, train_loss: 0.4497, test_loss: 1.2616, test_f1: 0.6008
 epoch: 81, train_loss: 0.4283, test_loss: 1.4511, test_f1: 0.5717
 epoch: 82, train_loss: 0.4596, test_loss: 1.5950, test_f1: 0.5850
 epoch: 83, train_loss: 0.4209, test_loss: 1.3498, test_f1: 0.6112
 epoch: 84, train_loss: 0.4312, test_loss: 1.4293, test_f1: 0.5714
 epoch: 85, train_loss: 0.4431, test_loss: 1.4873, test_f1: 0.5815
 epoch: 86, train_loss: 0.4118, test_loss: 1.3629, test_f1: 0.5992
 epoch: 87, train_loss: 0.4137, test_loss: 1.4681, test_f1: 0.5600
 epoch: 88, train_loss: 0.4085, test_loss: 1.4332, test_f1: 0.5762
 epoch: 89, train_loss: 0.4010, test_loss: 1.7945, test_f1: 0.5774
 epoch: 90, train_loss: 0.3886, test_loss: 1.5159, test_f1: 0.5763
 epoch: 91, train_loss: 0.4380, test_loss: 1.5677, test_f1: 0.5763
 epoch: 92, train_loss: 0.3700, test_loss: 1.7412, test_f1: 0.5816
 epoch: 93, train_loss: 0.3714, test_loss: 1.8682, test_f1: 0.5873
 epoch: 94, train_loss: 0.3926, test_loss: 1.5403, test_f1: 0.5718
 epoch: 95, train_loss: 0.3981, test_loss: 1.5191, test_f1: 0.5718
 epoch: 96, train_loss: 0.3685, test_loss: 1.5887, test_f1: 0.5677
 epoch: 97, train_loss: 0.4018, test_loss: 1.4519, test_f1: 0.5636
 epoch: 98, train_loss: 0.3840, test_loss: 1.6285, test_f1: 0.5613
 epoch: 99, train_loss: 0.3744, test_loss: 1.4608, test_f1: 0.5853
##################ITERATION #7 ****************************************
 epoch: 0, train_loss: 1.1583, test_loss: 1.2047, test_f1: 0.3428
 epoch: 1, train_loss: 0.9750, test_loss: 1.1104, test_f1: 0.4201
 epoch: 2, train_loss: 0.9378, test_loss: 0.9905, test_f1: 0.5657
 epoch: 3, train_loss: 0.8752, test_loss: 1.3854, test_f1: 0.4479
 epoch: 4, train_loss: 0.8801, test_loss: 1.0167, test_f1: 0.4306
 epoch: 5, train_loss: 0.8708, test_loss: 0.9956, test_f1: 0.5236
 epoch: 6, train_loss: 0.8437, test_loss: 1.0259, test_f1: 0.5551
 epoch: 7, train_loss: 0.8258, test_loss: 1.2920, test_f1: 0.3836
 epoch: 8, train_loss: 0.8477, test_loss: 1.1046, test_f1: 0.5146
 epoch: 9, train_loss: 0.8028, test_loss: 1.0489, test_f1: 0.5002
 epoch: 10, train_loss: 0.7924, test_loss: 1.0818, test_f1: 0.5248
 epoch: 11, train_loss: 0.7986, test_loss: 1.1001, test_f1: 0.5574
 epoch: 12, train_loss: 0.7968, test_loss: 1.1050, test_f1: 0.4371
 epoch: 13, train_loss: 0.8003, test_loss: 1.0555, test_f1: 0.4342
 epoch: 14, train_loss: 0.7706, test_loss: 1.0429, test_f1: 0.5340
 epoch: 15, train_loss: 0.7551, test_loss: 1.2216, test_f1: 0.4902
 epoch: 16, train_loss: 0.7636, test_loss: 1.1688, test_f1: 0.4485
 epoch: 17, train_loss: 0.7372, test_loss: 1.1148, test_f1: 0.6003
 epoch: 18, train_loss: 0.7251, test_loss: 1.0228, test_f1: 0.5734
 epoch: 19, train_loss: 0.7229, test_loss: 1.6488, test_f1: 0.5052
 epoch: 20, train_loss: 0.7420, test_loss: 1.0763, test_f1: 0.5324
 epoch: 21, train_loss: 0.7111, test_loss: 1.1385, test_f1: 0.5359
 epoch: 22, train_loss: 0.7073, test_loss: 1.1279, test_f1: 0.5550
 epoch: 23, train_loss: 0.6702, test_loss: 1.3208, test_f1: 0.5352
 epoch: 24, train_loss: 0.6906, test_loss: 1.3381, test_f1: 0.5279
 epoch: 25, train_loss: 0.6753, test_loss: 1.1464, test_f1: 0.4519
 epoch: 26, train_loss: 0.6962, test_loss: 1.0042, test_f1: 0.6443
 epoch: 27, train_loss: 0.6610, test_loss: 1.3466, test_f1: 0.5858
 epoch: 28, train_loss: 0.6752, test_loss: 1.3454, test_f1: 0.5740
 epoch: 29, train_loss: 0.6623, test_loss: 1.2562, test_f1: 0.5637
 epoch: 30, train_loss: 0.6581, test_loss: 1.3511, test_f1: 0.5214
 epoch: 31, train_loss: 0.6379, test_loss: 1.0832, test_f1: 0.6335
 epoch: 32, train_loss: 0.6660, test_loss: 1.2400, test_f1: 0.6188
 epoch: 33, train_loss: 0.6495, test_loss: 1.1077, test_f1: 0.5164
 epoch: 34, train_loss: 0.6618, test_loss: 1.1597, test_f1: 0.5756
 epoch: 35, train_loss: 0.6758, test_loss: 1.2690, test_f1: 0.5704
 epoch: 36, train_loss: 0.6704, test_loss: 1.1418, test_f1: 0.5795
 epoch: 37, train_loss: 0.6499, test_loss: 1.2230, test_f1: 0.5817
 epoch: 38, train_loss: 0.6448, test_loss: 1.1027, test_f1: 0.5741
 epoch: 39, train_loss: 0.6031, test_loss: 1.3494, test_f1: 0.5605
 epoch: 40, train_loss: 0.6148, test_loss: 1.1269, test_f1: 0.6125
 epoch: 41, train_loss: 0.5873, test_loss: 1.6461, test_f1: 0.5569
 epoch: 42, train_loss: 0.5978, test_loss: 1.4406, test_f1: 0.5425
 epoch: 43, train_loss: 0.6074, test_loss: 1.2833, test_f1: 0.5838
 epoch: 44, train_loss: 0.5977, test_loss: 1.3835, test_f1: 0.5317
 epoch: 45, train_loss: 0.6268, test_loss: 1.2086, test_f1: 0.5580
 epoch: 46, train_loss: 0.6037, test_loss: 1.6569, test_f1: 0.5176
 epoch: 47, train_loss: 0.5942, test_loss: 1.7545, test_f1: 0.5896
 epoch: 48, train_loss: 0.6129, test_loss: 1.2770, test_f1: 0.5929
 epoch: 49, train_loss: 0.6036, test_loss: 1.2794, test_f1: 0.6553
 epoch: 50, train_loss: 0.5783, test_loss: 1.3015, test_f1: 0.6150
 epoch: 51, train_loss: 0.5211, test_loss: 1.3226, test_f1: 0.5858
 epoch: 52, train_loss: 0.5069, test_loss: 1.3591, test_f1: 0.6515
 epoch: 53, train_loss: 0.5102, test_loss: 1.2837, test_f1: 0.5772
 epoch: 54, train_loss: 0.5054, test_loss: 1.2295, test_f1: 0.5898
 epoch: 55, train_loss: 0.4959, test_loss: 1.1527, test_f1: 0.6548
 epoch: 56, train_loss: 0.5003, test_loss: 1.2669, test_f1: 0.6585
 epoch: 57, train_loss: 0.4781, test_loss: 1.2910, test_f1: 0.6243
 epoch: 58, train_loss: 0.4853, test_loss: 1.3378, test_f1: 0.6033
 epoch: 59, train_loss: 0.4448, test_loss: 1.4700, test_f1: 0.6193
 epoch: 60, train_loss: 0.4762, test_loss: 1.3035, test_f1: 0.6036
 epoch: 61, train_loss: 0.4555, test_loss: 1.3488, test_f1: 0.6153
 epoch: 62, train_loss: 0.4585, test_loss: 1.4682, test_f1: 0.5911
 epoch: 63, train_loss: 0.4743, test_loss: 1.2944, test_f1: 0.6307
 epoch: 64, train_loss: 0.4651, test_loss: 1.3677, test_f1: 0.6068
 epoch: 65, train_loss: 0.4974, test_loss: 1.1704, test_f1: 0.6534
 epoch: 66, train_loss: 0.4450, test_loss: 1.3494, test_f1: 0.6254
 epoch: 67, train_loss: 0.4532, test_loss: 1.3290, test_f1: 0.6226
 epoch: 68, train_loss: 0.4577, test_loss: 1.2907, test_f1: 0.6296
 epoch: 69, train_loss: 0.4525, test_loss: 1.5707, test_f1: 0.6369
 epoch: 70, train_loss: 0.4293, test_loss: 1.4324, test_f1: 0.6336
 epoch: 71, train_loss: 0.4179, test_loss: 1.4330, test_f1: 0.6416
 epoch: 72, train_loss: 0.4289, test_loss: 1.4168, test_f1: 0.6622
 epoch: 73, train_loss: 0.4209, test_loss: 1.3331, test_f1: 0.6492
 epoch: 74, train_loss: 0.4323, test_loss: 1.4376, test_f1: 0.6375
 epoch: 75, train_loss: 0.4183, test_loss: 1.3334, test_f1: 0.6897
 epoch: 76, train_loss: 0.4389, test_loss: 1.3591, test_f1: 0.6397
 epoch: 77, train_loss: 0.4434, test_loss: 1.3162, test_f1: 0.6389
 epoch: 78, train_loss: 0.4125, test_loss: 1.4894, test_f1: 0.6505
 epoch: 79, train_loss: 0.4097, test_loss: 1.3605, test_f1: 0.6531
 epoch: 80, train_loss: 0.4224, test_loss: 1.5214, test_f1: 0.6141
 epoch: 81, train_loss: 0.4203, test_loss: 1.6722, test_f1: 0.6196
 epoch: 82, train_loss: 0.4194, test_loss: 1.4205, test_f1: 0.6428
 epoch: 83, train_loss: 0.4262, test_loss: 1.4235, test_f1: 0.5996
 epoch: 84, train_loss: 0.3900, test_loss: 1.3701, test_f1: 0.6371
 epoch: 85, train_loss: 0.3986, test_loss: 1.4277, test_f1: 0.6446
 epoch: 86, train_loss: 0.4112, test_loss: 1.4483, test_f1: 0.6511
 epoch: 87, train_loss: 0.3996, test_loss: 1.4306, test_f1: 0.6685
 epoch: 88, train_loss: 0.3910, test_loss: 1.4588, test_f1: 0.6289
 epoch: 89, train_loss: 0.4351, test_loss: 1.3078, test_f1: 0.6708
 epoch: 90, train_loss: 0.3938, test_loss: 1.3033, test_f1: 0.6618
 epoch: 91, train_loss: 0.3937, test_loss: 1.4301, test_f1: 0.6761
 epoch: 92, train_loss: 0.4006, test_loss: 1.5301, test_f1: 0.6361
 epoch: 93, train_loss: 0.3870, test_loss: 1.5126, test_f1: 0.6376
 epoch: 94, train_loss: 0.3892, test_loss: 1.4641, test_f1: 0.6424
 epoch: 95, train_loss: 0.3495, test_loss: 1.5824, test_f1: 0.6125
 epoch: 96, train_loss: 0.4274, test_loss: 1.4288, test_f1: 0.6078
 epoch: 97, train_loss: 0.3736, test_loss: 1.6051, test_f1: 0.6068
 epoch: 98, train_loss: 0.3847, test_loss: 1.4822, test_f1: 0.6466
 epoch: 99, train_loss: 0.3912, test_loss: 1.3828, test_f1: 0.6499
##################ITERATION #8 ****************************************
 epoch: 0, train_loss: 1.1088, test_loss: 1.0442, test_f1: 0.5061
 epoch: 1, train_loss: 0.9458, test_loss: 1.2067, test_f1: 0.3902
 epoch: 2, train_loss: 0.9147, test_loss: 1.0739, test_f1: 0.4720
 epoch: 3, train_loss: 0.8913, test_loss: 1.0228, test_f1: 0.5355
 epoch: 4, train_loss: 0.8653, test_loss: 1.0771, test_f1: 0.5497
 epoch: 5, train_loss: 0.8618, test_loss: 0.9818, test_f1: 0.4980
 epoch: 6, train_loss: 0.8086, test_loss: 1.0354, test_f1: 0.5611
 epoch: 7, train_loss: 0.8050, test_loss: 1.1376, test_f1: 0.4726
 epoch: 8, train_loss: 0.8027, test_loss: 1.0269, test_f1: 0.5280
 epoch: 9, train_loss: 0.8094, test_loss: 0.9865, test_f1: 0.5492
 epoch: 10, train_loss: 0.8098, test_loss: 1.2467, test_f1: 0.5164
 epoch: 11, train_loss: 0.7859, test_loss: 1.2042, test_f1: 0.4997
 epoch: 12, train_loss: 0.8004, test_loss: 1.0346, test_f1: 0.4663
 epoch: 13, train_loss: 0.7640, test_loss: 1.3289, test_f1: 0.4505
 epoch: 14, train_loss: 0.7621, test_loss: 1.0637, test_f1: 0.5995
 epoch: 15, train_loss: 0.7183, test_loss: 2.3004, test_f1: 0.3850
 epoch: 16, train_loss: 0.7585, test_loss: 1.0739, test_f1: 0.5072
 epoch: 17, train_loss: 0.7448, test_loss: 1.0794, test_f1: 0.5437
 epoch: 18, train_loss: 0.7127, test_loss: 1.1056, test_f1: 0.5570
 epoch: 19, train_loss: 0.7217, test_loss: 1.3521, test_f1: 0.4908
 epoch: 20, train_loss: 0.7102, test_loss: 1.1779, test_f1: 0.5732
 epoch: 21, train_loss: 0.7232, test_loss: 0.9885, test_f1: 0.6275
 epoch: 22, train_loss: 0.7027, test_loss: 1.3083, test_f1: 0.5689
 epoch: 23, train_loss: 0.6619, test_loss: 1.3215, test_f1: 0.5506
 epoch: 24, train_loss: 0.7275, test_loss: 1.0362, test_f1: 0.5933
 epoch: 25, train_loss: 0.6703, test_loss: 1.1148, test_f1: 0.6045
 epoch: 26, train_loss: 0.6843, test_loss: 1.2236, test_f1: 0.5211
 epoch: 27, train_loss: 0.6683, test_loss: 1.1064, test_f1: 0.6215
 epoch: 28, train_loss: 0.6644, test_loss: 1.0966, test_f1: 0.5828
 epoch: 29, train_loss: 0.6602, test_loss: 1.0739, test_f1: 0.5714
 epoch: 30, train_loss: 0.6393, test_loss: 1.4603, test_f1: 0.6146
 epoch: 31, train_loss: 0.6650, test_loss: 1.2001, test_f1: 0.4577
 epoch: 32, train_loss: 0.6867, test_loss: 1.1175, test_f1: 0.6095
 epoch: 33, train_loss: 0.6380, test_loss: 1.2193, test_f1: 0.5617
 epoch: 34, train_loss: 0.6221, test_loss: 1.3424, test_f1: 0.6006
 epoch: 35, train_loss: 0.6579, test_loss: 1.2366, test_f1: 0.5508
 epoch: 36, train_loss: 0.6402, test_loss: 1.4708, test_f1: 0.5964
 epoch: 37, train_loss: 0.6121, test_loss: 1.4076, test_f1: 0.5587
 epoch: 38, train_loss: 0.6324, test_loss: 1.6709, test_f1: 0.5537
 epoch: 39, train_loss: 0.6235, test_loss: 1.1103, test_f1: 0.6520
 epoch: 40, train_loss: 0.5901, test_loss: 1.3675, test_f1: 0.5510
 epoch: 41, train_loss: 0.6628, test_loss: 1.5055, test_f1: 0.5539
 epoch: 42, train_loss: 0.6125, test_loss: 1.1250, test_f1: 0.5536
 epoch: 43, train_loss: 0.5882, test_loss: 1.4151, test_f1: 0.5795
 epoch: 44, train_loss: 0.5591, test_loss: 1.2356, test_f1: 0.5662
 epoch: 45, train_loss: 0.5837, test_loss: 1.5922, test_f1: 0.5874
 epoch: 46, train_loss: 0.5398, test_loss: 1.3653, test_f1: 0.6144
 epoch: 47, train_loss: 0.5575, test_loss: 1.3081, test_f1: 0.5757
 epoch: 48, train_loss: 0.5829, test_loss: 2.6759, test_f1: 0.5744
 epoch: 49, train_loss: 0.6004, test_loss: 1.2790, test_f1: 0.5896
 epoch: 50, train_loss: 0.5680, test_loss: 1.4060, test_f1: 0.5661
 epoch: 51, train_loss: 0.5372, test_loss: 1.1221, test_f1: 0.6316
 epoch: 52, train_loss: 0.5239, test_loss: 1.2213, test_f1: 0.6317
 epoch: 53, train_loss: 0.5008, test_loss: 1.4420, test_f1: 0.5835
 epoch: 54, train_loss: 0.4596, test_loss: 1.2965, test_f1: 0.6081
 epoch: 55, train_loss: 0.4554, test_loss: 1.2797, test_f1: 0.6243
 epoch: 56, train_loss: 0.4622, test_loss: 1.6379, test_f1: 0.6060
 epoch: 57, train_loss: 0.4817, test_loss: 1.6544, test_f1: 0.5896
 epoch: 58, train_loss: 0.4648, test_loss: 1.6528, test_f1: 0.5772
 epoch: 59, train_loss: 0.4684, test_loss: 1.5027, test_f1: 0.5683
 epoch: 60, train_loss: 0.4655, test_loss: 1.7403, test_f1: 0.5570
 epoch: 61, train_loss: 0.4741, test_loss: 1.5363, test_f1: 0.5675
 epoch: 62, train_loss: 0.5034, test_loss: 1.3980, test_f1: 0.6593
 epoch: 63, train_loss: 0.4479, test_loss: 1.3992, test_f1: 0.6325
 epoch: 64, train_loss: 0.4310, test_loss: 1.5451, test_f1: 0.6248
 epoch: 65, train_loss: 0.4337, test_loss: 1.7513, test_f1: 0.5662
 epoch: 66, train_loss: 0.4419, test_loss: 2.0540, test_f1: 0.6309
 epoch: 67, train_loss: 0.4326, test_loss: 1.5168, test_f1: 0.6077
 epoch: 68, train_loss: 0.4435, test_loss: 1.4925, test_f1: 0.6187
 epoch: 69, train_loss: 0.4299, test_loss: 1.5574, test_f1: 0.5611
 epoch: 70, train_loss: 0.4622, test_loss: 1.4102, test_f1: 0.5983
 epoch: 71, train_loss: 0.4236, test_loss: 2.0707, test_f1: 0.5934
 epoch: 72, train_loss: 0.4074, test_loss: 1.4901, test_f1: 0.6416
 epoch: 73, train_loss: 0.4202, test_loss: 1.9391, test_f1: 0.6331
 epoch: 74, train_loss: 0.4007, test_loss: 1.8810, test_f1: 0.5733
 epoch: 75, train_loss: 0.4168, test_loss: 1.8338, test_f1: 0.5992
 epoch: 76, train_loss: 0.4463, test_loss: 1.9691, test_f1: 0.5869
 epoch: 77, train_loss: 0.3817, test_loss: 2.1376, test_f1: 0.6034
 epoch: 78, train_loss: 0.4041, test_loss: 1.5782, test_f1: 0.6078
 epoch: 79, train_loss: 0.4313, test_loss: 1.5804, test_f1: 0.6210
 epoch: 80, train_loss: 0.4299, test_loss: 1.7773, test_f1: 0.6157
 epoch: 81, train_loss: 0.4159, test_loss: 1.5606, test_f1: 0.5962
 epoch: 82, train_loss: 0.4420, test_loss: 1.7800, test_f1: 0.5787
 epoch: 83, train_loss: 0.3900, test_loss: 2.2181, test_f1: 0.6197
 epoch: 84, train_loss: 0.4310, test_loss: 1.9339, test_f1: 0.5460
 epoch: 85, train_loss: 0.3786, test_loss: 1.9444, test_f1: 0.6090
 epoch: 86, train_loss: 0.3713, test_loss: 1.5220, test_f1: 0.6217
 epoch: 87, train_loss: 0.4687, test_loss: 1.4266, test_f1: 0.6052
 epoch: 88, train_loss: 0.4024, test_loss: 2.2648, test_f1: 0.5720
 epoch: 89, train_loss: 0.3774, test_loss: 1.7015, test_f1: 0.6531
 epoch: 90, train_loss: 0.3754, test_loss: 2.1716, test_f1: 0.5680
 epoch: 91, train_loss: 0.3928, test_loss: 1.7099, test_f1: 0.5616
 epoch: 92, train_loss: 0.3968, test_loss: 1.8457, test_f1: 0.5735
 epoch: 93, train_loss: 0.3452, test_loss: 1.7835, test_f1: 0.6138
 epoch: 94, train_loss: 0.3838, test_loss: 1.6680, test_f1: 0.5780
 epoch: 95, train_loss: 0.3789, test_loss: 1.6478, test_f1: 0.6388
 epoch: 96, train_loss: 0.3731, test_loss: 1.5398, test_f1: 0.6011
 epoch: 97, train_loss: 0.3830, test_loss: 1.7871, test_f1: 0.5736
 epoch: 98, train_loss: 0.3982, test_loss: 1.7586, test_f1: 0.6007
 epoch: 99, train_loss: 0.3994, test_loss: 2.0218, test_f1: 0.5724
##################ITERATION #9 ****************************************
 epoch: 0, train_loss: 1.1088, test_loss: 1.0935, test_f1: 0.4187
 epoch: 1, train_loss: 0.9585, test_loss: 1.0320, test_f1: 0.5485
 epoch: 2, train_loss: 0.9038, test_loss: 1.0377, test_f1: 0.4932
 epoch: 3, train_loss: 0.8666, test_loss: 0.9940, test_f1: 0.4957
 epoch: 4, train_loss: 0.8688, test_loss: 0.9694, test_f1: 0.4487
 epoch: 5, train_loss: 0.8566, test_loss: 1.0162, test_f1: 0.5392
 epoch: 6, train_loss: 0.8219, test_loss: 0.9715, test_f1: 0.5484
 epoch: 7, train_loss: 0.8408, test_loss: 1.1663, test_f1: 0.5060
 epoch: 8, train_loss: 0.8059, test_loss: 1.0137, test_f1: 0.5536
 epoch: 9, train_loss: 0.8782, test_loss: 1.2948, test_f1: 0.3967
 epoch: 10, train_loss: 0.8392, test_loss: 0.9666, test_f1: 0.5390
 epoch: 11, train_loss: 0.7994, test_loss: 0.9802, test_f1: 0.5882
 epoch: 12, train_loss: 0.7994, test_loss: 1.0378, test_f1: 0.5493
 epoch: 13, train_loss: 0.7776, test_loss: 1.0638, test_f1: 0.5596
 epoch: 14, train_loss: 0.7850, test_loss: 0.9814, test_f1: 0.5663
 epoch: 15, train_loss: 0.7905, test_loss: 1.1886, test_f1: 0.5280
 epoch: 16, train_loss: 0.7957, test_loss: 0.9996, test_f1: 0.5214
 epoch: 17, train_loss: 0.7652, test_loss: 1.0228, test_f1: 0.5557
 epoch: 18, train_loss: 0.7404, test_loss: 1.0490, test_f1: 0.5895
 epoch: 19, train_loss: 0.7528, test_loss: 1.0941, test_f1: 0.6106
 epoch: 20, train_loss: 0.7250, test_loss: 1.4843, test_f1: 0.4791
 epoch: 21, train_loss: 0.7226, test_loss: 1.0850, test_f1: 0.5024
 epoch: 22, train_loss: 0.7149, test_loss: 1.0718, test_f1: 0.5915
 epoch: 23, train_loss: 0.7356, test_loss: 1.2809, test_f1: 0.5404
 epoch: 24, train_loss: 0.7398, test_loss: 1.0343, test_f1: 0.6083
 epoch: 25, train_loss: 0.6966, test_loss: 1.2306, test_f1: 0.5730
 epoch: 26, train_loss: 0.6816, test_loss: 1.3881, test_f1: 0.5593
 epoch: 27, train_loss: 0.6878, test_loss: 1.2145, test_f1: 0.5714
 epoch: 28, train_loss: 0.6861, test_loss: 1.0502, test_f1: 0.5753
 epoch: 29, train_loss: 0.6640, test_loss: 1.0808, test_f1: 0.5760
 epoch: 30, train_loss: 0.6250, test_loss: 1.2349, test_f1: 0.5373
 epoch: 31, train_loss: 0.6500, test_loss: 1.3757, test_f1: 0.5496
 epoch: 32, train_loss: 0.6706, test_loss: 1.1108, test_f1: 0.6069
 epoch: 33, train_loss: 0.6647, test_loss: 1.0218, test_f1: 0.6238
 epoch: 34, train_loss: 0.6575, test_loss: 1.2979, test_f1: 0.5787
 epoch: 35, train_loss: 0.6394, test_loss: 1.1181, test_f1: 0.5912
 epoch: 36, train_loss: 0.6451, test_loss: 1.0940, test_f1: 0.5390
 epoch: 37, train_loss: 0.6316, test_loss: 1.0929, test_f1: 0.5406
 epoch: 38, train_loss: 0.6145, test_loss: 0.9976, test_f1: 0.6408
 epoch: 39, train_loss: 0.6066, test_loss: 1.0382, test_f1: 0.6052
 epoch: 40, train_loss: 0.6192, test_loss: 1.3790, test_f1: 0.5823
 epoch: 41, train_loss: 0.6454, test_loss: 1.8068, test_f1: 0.4953
 epoch: 42, train_loss: 0.7561, test_loss: 1.0355, test_f1: 0.5052
 epoch: 43, train_loss: 0.6559, test_loss: 1.0269, test_f1: 0.6411
 epoch: 44, train_loss: 0.5772, test_loss: 1.1032, test_f1: 0.5992
 epoch: 45, train_loss: 0.6556, test_loss: 1.1076, test_f1: 0.5507
 epoch: 46, train_loss: 0.6318, test_loss: 1.1271, test_f1: 0.5766
 epoch: 47, train_loss: 0.6431, test_loss: 1.1789, test_f1: 0.5629
 epoch: 48, train_loss: 0.5773, test_loss: 1.0899, test_f1: 0.6026
 epoch: 49, train_loss: 0.5732, test_loss: 1.1217, test_f1: 0.5597
 epoch: 50, train_loss: 0.5626, test_loss: 1.6492, test_f1: 0.5577
 epoch: 51, train_loss: 0.5509, test_loss: 1.0957, test_f1: 0.6080
 epoch: 52, train_loss: 0.4983, test_loss: 1.1808, test_f1: 0.6420
 epoch: 53, train_loss: 0.5226, test_loss: 1.1015, test_f1: 0.6321
 epoch: 54, train_loss: 0.5201, test_loss: 1.2199, test_f1: 0.6104
 epoch: 55, train_loss: 0.4865, test_loss: 1.2531, test_f1: 0.6243
 epoch: 56, train_loss: 0.4940, test_loss: 1.3883, test_f1: 0.5963
 epoch: 57, train_loss: 0.4934, test_loss: 1.3925, test_f1: 0.6212
 epoch: 58, train_loss: 0.5018, test_loss: 1.1859, test_f1: 0.6259
 epoch: 59, train_loss: 0.4779, test_loss: 1.3998, test_f1: 0.6213
 epoch: 60, train_loss: 0.4533, test_loss: 1.2051, test_f1: 0.6002
 epoch: 61, train_loss: 0.4733, test_loss: 1.2518, test_f1: 0.6594
 epoch: 62, train_loss: 0.4860, test_loss: 1.2954, test_f1: 0.6458
 epoch: 63, train_loss: 0.4839, test_loss: 1.2653, test_f1: 0.6166
 epoch: 64, train_loss: 0.4694, test_loss: 1.2242, test_f1: 0.6426
 epoch: 65, train_loss: 0.4725, test_loss: 1.3754, test_f1: 0.6725
 epoch: 66, train_loss: 0.4586, test_loss: 1.2758, test_f1: 0.6431
 epoch: 67, train_loss: 0.4886, test_loss: 1.2379, test_f1: 0.6578
 epoch: 68, train_loss: 0.4442, test_loss: 1.3178, test_f1: 0.6141
 epoch: 69, train_loss: 0.4634, test_loss: 1.2151, test_f1: 0.6625
 epoch: 70, train_loss: 0.4385, test_loss: 1.3256, test_f1: 0.6193
 epoch: 71, train_loss: 0.4328, test_loss: 1.3147, test_f1: 0.6187
 epoch: 72, train_loss: 0.4219, test_loss: 1.3730, test_f1: 0.6055
 epoch: 73, train_loss: 0.4238, test_loss: 1.3849, test_f1: 0.5831
 epoch: 74, train_loss: 0.4652, test_loss: 1.2821, test_f1: 0.5818
 epoch: 75, train_loss: 0.4435, test_loss: 1.3225, test_f1: 0.6223
 epoch: 76, train_loss: 0.4547, test_loss: 1.3065, test_f1: 0.6650
 epoch: 77, train_loss: 0.4151, test_loss: 1.2749, test_f1: 0.6252
 epoch: 78, train_loss: 0.4100, test_loss: 1.2488, test_f1: 0.6640
 epoch: 79, train_loss: 0.4269, test_loss: 1.3886, test_f1: 0.6605
 epoch: 80, train_loss: 0.4326, test_loss: 1.3945, test_f1: 0.6227
 epoch: 81, train_loss: 0.4208, test_loss: 1.2504, test_f1: 0.6781
 epoch: 82, train_loss: 0.4219, test_loss: 1.3603, test_f1: 0.6186
 epoch: 83, train_loss: 0.4180, test_loss: 1.3481, test_f1: 0.6560
 epoch: 84, train_loss: 0.3988, test_loss: 1.5096, test_f1: 0.5974
 epoch: 85, train_loss: 0.3793, test_loss: 1.2946, test_f1: 0.6545
 epoch: 86, train_loss: 0.3971, test_loss: 1.2896, test_f1: 0.6541
 epoch: 87, train_loss: 0.4019, test_loss: 1.3155, test_f1: 0.6301
 epoch: 88, train_loss: 0.4039, test_loss: 1.3907, test_f1: 0.5482
 epoch: 89, train_loss: 0.4058, test_loss: 1.5454, test_f1: 0.6241
 epoch: 90, train_loss: 0.3980, test_loss: 1.4222, test_f1: 0.6132
 epoch: 91, train_loss: 0.3579, test_loss: 1.5099, test_f1: 0.6374
 epoch: 92, train_loss: 0.3732, test_loss: 1.5249, test_f1: 0.6377
 epoch: 93, train_loss: 0.3871, test_loss: 1.5718, test_f1: 0.5836
 epoch: 94, train_loss: 0.4041, test_loss: 1.4277, test_f1: 0.6377
 epoch: 95, train_loss: 0.3879, test_loss: 1.2031, test_f1: 0.6900
 epoch: 96, train_loss: 0.4051, test_loss: 1.3700, test_f1: 0.6582
 epoch: 97, train_loss: 0.3760, test_loss: 1.8459, test_f1: 0.5817
 epoch: 98, train_loss: 0.3981, test_loss: 1.3072, test_f1: 0.6560
 epoch: 99, train_loss: 0.3672, test_loss: 1.7227, test_f1: 0.5892

Training completed in 507.31 seconds
Best F1: 0.6900 at epoch 95
Mean F1 across iterations: 0.6637  0.0199
========================FINAL RESULTS================================
FEGIN weighted F1: 0.6900  0.0199
python main.py --data ltspice_demos --representation component_pin_net --model FEGIN --layers 2 --hiddens 64 --batch_size 32 --lr 0.01 --emb_size 128 --epochs 100 --save_appendix component_pin_net_L2_H64_BS32_LR0.01_E128 --no_val
-----



STDERR:
  File "main.py", line 370, in <module>
    main()
  File "main.py", line 254, in main
    dataset = dataset_class(
  File "/home/philip/projects/ltspice_examples_code_repo/Circuit-Completion-Using-GNNs/component_classification_with_link_prediction_head/evaluation/FEGIN/kernel/circuit_datasets.py", line 15, in __init__
    self.data, self.slices = torch.load(self.processed_paths[0])
  File "/home/philip/.local/lib/python3.8/site-packages/torch/serialization.py", line 1040, in load
    warnings.warn(
  File "/usr/lib/python3.8/warnings.py", line 109, in _showwarnmsg
    sw(msg.message, msg.category, msg.filename, msg.lineno,
  File "main.py", line 47, in warn_with_traceback
    traceback.print_stack(file=log)
/home/philip/projects/ltspice_examples_code_repo/Circuit-Completion-Using-GNNs/component_classification_with_link_prediction_head/evaluation/FEGIN/kernel/circuit_datasets.py:15: FutureWarning: You are using `torch.load` with `weights_only=False` (the current default value), which uses the default pickle module implicitly. It is possible to construct malicious pickle data which will execute arbitrary code during unpickling (See https://github.com/pytorch/pytorch/blob/main/SECURITY.md#untrusted-models for more details). In a future release, the default value for `weights_only` will be flipped to `True`. This limits the functions that could be executed during unpickling. Arbitrary objects will no longer be allowed to be loaded via this mode unless they are explicitly allowlisted by the user via `torch.serialization.add_safe_globals`. We recommend you start setting `weights_only=True` for any use case where you don't have full control of the loaded file. Please open an issue on GitHub for any issues related to this experimental feature.
  self.data, self.slices = torch.load(self.processed_paths[0])
