STDOUT:
Results will be saved in /home/philip/projects/llm_inference_code_repo/Circuit-Completion-Using-GNNs/component_classification_with_link_prediction_head/evaluation/FEGIN/results/model_FEGIN_dataset_ltspice_examples
Command line input: python main.py --data ltspice_examples --representation component_net --model FEGIN --layers 5 --hiddens 64 --batch_size 32 --lr 0.0001 --emb_size 250 --epochs 100 --save_appendix component_net_L5_H64_BS32_LR0.0001_E250 --no_val
 is saved.
-----
ltspice_examples - FEGIN
Using 5 layers, 64 hidden units, h = 2
Loading component_net representation dataset
ENTERED
Training FEGIN on component_net representation
Train: 3558, Test: 846
##################ITERATION #0 ****************************************
 epoch: 0, train_loss: 1.3828, test_loss: 1.3307, test_f1: 0.2463
 epoch: 1, train_loss: 1.3150, test_loss: 1.2709, test_f1: 0.2500
 epoch: 2, train_loss: 1.2633, test_loss: 1.2274, test_f1: 0.2922
 epoch: 3, train_loss: 1.2331, test_loss: 1.1974, test_f1: 0.3106
 epoch: 4, train_loss: 1.2117, test_loss: 1.1842, test_f1: 0.3404
 epoch: 5, train_loss: 1.1917, test_loss: 1.1595, test_f1: 0.3464
 epoch: 6, train_loss: 1.1728, test_loss: 1.1311, test_f1: 0.3501
 epoch: 7, train_loss: 1.1522, test_loss: 1.1083, test_f1: 0.3635
 epoch: 8, train_loss: 1.1285, test_loss: 1.0819, test_f1: 0.4204
 epoch: 9, train_loss: 1.1080, test_loss: 1.0596, test_f1: 0.4790
 epoch: 10, train_loss: 1.0864, test_loss: 1.0269, test_f1: 0.5306
 epoch: 11, train_loss: 1.0660, test_loss: 1.0141, test_f1: 0.5037
 epoch: 12, train_loss: 1.0503, test_loss: 1.0038, test_f1: 0.5148
 epoch: 13, train_loss: 1.0135, test_loss: 0.9652, test_f1: 0.5062
 epoch: 14, train_loss: 0.9936, test_loss: 0.9499, test_f1: 0.5193
 epoch: 15, train_loss: 0.9827, test_loss: 0.9443, test_f1: 0.5137
 epoch: 16, train_loss: 0.9654, test_loss: 0.9252, test_f1: 0.5212
 epoch: 17, train_loss: 0.9611, test_loss: 0.9160, test_f1: 0.5305
 epoch: 18, train_loss: 0.9455, test_loss: 0.9201, test_f1: 0.5136
 epoch: 19, train_loss: 0.9282, test_loss: 0.9264, test_f1: 0.5225
 epoch: 20, train_loss: 0.9235, test_loss: 0.9403, test_f1: 0.5165
 epoch: 21, train_loss: 0.9175, test_loss: 0.9406, test_f1: 0.5004
 epoch: 22, train_loss: 0.9093, test_loss: 0.9279, test_f1: 0.5170
 epoch: 23, train_loss: 0.9143, test_loss: 0.9344, test_f1: 0.5177
 epoch: 24, train_loss: 0.9034, test_loss: 0.9135, test_f1: 0.5160
 epoch: 25, train_loss: 0.8857, test_loss: 0.9200, test_f1: 0.5122
 epoch: 26, train_loss: 0.8930, test_loss: 0.9393, test_f1: 0.5213
 epoch: 27, train_loss: 0.8850, test_loss: 0.9161, test_f1: 0.5183
 epoch: 28, train_loss: 0.8847, test_loss: 0.9287, test_f1: 0.5382
 epoch: 29, train_loss: 0.8760, test_loss: 0.9305, test_f1: 0.5276
 epoch: 30, train_loss: 0.8683, test_loss: 0.9090, test_f1: 0.5533
 epoch: 31, train_loss: 0.8786, test_loss: 0.9360, test_f1: 0.5163
 epoch: 32, train_loss: 0.8612, test_loss: 0.9263, test_f1: 0.5360
 epoch: 33, train_loss: 0.8639, test_loss: 0.9363, test_f1: 0.5295
 epoch: 34, train_loss: 0.8578, test_loss: 0.9062, test_f1: 0.5422
 epoch: 35, train_loss: 0.8646, test_loss: 0.9053, test_f1: 0.5395
 epoch: 36, train_loss: 0.8518, test_loss: 0.9088, test_f1: 0.5341
 epoch: 37, train_loss: 0.8523, test_loss: 0.9181, test_f1: 0.5300
 epoch: 38, train_loss: 0.8365, test_loss: 0.9284, test_f1: 0.5573
 epoch: 39, train_loss: 0.8486, test_loss: 0.9339, test_f1: 0.5239
 epoch: 40, train_loss: 0.8446, test_loss: 0.9169, test_f1: 0.5721
 epoch: 41, train_loss: 0.8319, test_loss: 0.9020, test_f1: 0.5540
 epoch: 42, train_loss: 0.8290, test_loss: 0.9124, test_f1: 0.5675
 epoch: 43, train_loss: 0.8303, test_loss: 0.9226, test_f1: 0.5757
 epoch: 44, train_loss: 0.8167, test_loss: 0.9227, test_f1: 0.5707
 epoch: 45, train_loss: 0.8211, test_loss: 0.8992, test_f1: 0.5502
 epoch: 46, train_loss: 0.8110, test_loss: 0.9188, test_f1: 0.5747
 epoch: 47, train_loss: 0.8121, test_loss: 0.9100, test_f1: 0.5704
 epoch: 48, train_loss: 0.8079, test_loss: 0.9169, test_f1: 0.5703
 epoch: 49, train_loss: 0.8198, test_loss: 0.9526, test_f1: 0.5293
 epoch: 50, train_loss: 0.8086, test_loss: 0.9250, test_f1: 0.5603
 epoch: 51, train_loss: 0.7967, test_loss: 0.9136, test_f1: 0.5658
 epoch: 52, train_loss: 0.7945, test_loss: 0.9268, test_f1: 0.5819
 epoch: 53, train_loss: 0.7970, test_loss: 0.9154, test_f1: 0.5910
 epoch: 54, train_loss: 0.7943, test_loss: 0.9298, test_f1: 0.5534
 epoch: 55, train_loss: 0.7839, test_loss: 0.9195, test_f1: 0.5894
 epoch: 56, train_loss: 0.7904, test_loss: 0.9368, test_f1: 0.5562
 epoch: 57, train_loss: 0.7970, test_loss: 0.9218, test_f1: 0.5598
 epoch: 58, train_loss: 0.7942, test_loss: 0.9219, test_f1: 0.5593
 epoch: 59, train_loss: 0.7937, test_loss: 0.9409, test_f1: 0.5879
 epoch: 60, train_loss: 0.7863, test_loss: 0.9323, test_f1: 0.5915
 epoch: 61, train_loss: 0.7869, test_loss: 0.9244, test_f1: 0.5963
 epoch: 62, train_loss: 0.7833, test_loss: 0.9270, test_f1: 0.5807
 epoch: 63, train_loss: 0.7802, test_loss: 0.9249, test_f1: 0.5844
 epoch: 64, train_loss: 0.7792, test_loss: 0.9359, test_f1: 0.5743
 epoch: 65, train_loss: 0.7661, test_loss: 0.9473, test_f1: 0.5598
 epoch: 66, train_loss: 0.7681, test_loss: 0.9137, test_f1: 0.5912
 epoch: 67, train_loss: 0.7722, test_loss: 0.9213, test_f1: 0.5865
 epoch: 68, train_loss: 0.7768, test_loss: 0.9187, test_f1: 0.6058
 epoch: 69, train_loss: 0.7732, test_loss: 0.9265, test_f1: 0.5640
 epoch: 70, train_loss: 0.7677, test_loss: 0.9503, test_f1: 0.5782
 epoch: 71, train_loss: 0.7794, test_loss: 0.9317, test_f1: 0.5951
 epoch: 72, train_loss: 0.7590, test_loss: 0.9292, test_f1: 0.5824
 epoch: 73, train_loss: 0.7729, test_loss: 0.9440, test_f1: 0.5621
 epoch: 74, train_loss: 0.7571, test_loss: 0.9392, test_f1: 0.5687
 epoch: 75, train_loss: 0.7529, test_loss: 0.9382, test_f1: 0.5952
 epoch: 76, train_loss: 0.7624, test_loss: 0.9226, test_f1: 0.5885
 epoch: 77, train_loss: 0.7555, test_loss: 0.9408, test_f1: 0.5786
 epoch: 78, train_loss: 0.7646, test_loss: 0.9383, test_f1: 0.5797
 epoch: 79, train_loss: 0.7593, test_loss: 0.9671, test_f1: 0.5568
 epoch: 80, train_loss: 0.7480, test_loss: 0.9357, test_f1: 0.6006
 epoch: 81, train_loss: 0.7553, test_loss: 0.9336, test_f1: 0.5865
 epoch: 82, train_loss: 0.7516, test_loss: 0.9285, test_f1: 0.5918
 epoch: 83, train_loss: 0.7542, test_loss: 0.9276, test_f1: 0.5824
 epoch: 84, train_loss: 0.7476, test_loss: 0.9274, test_f1: 0.5889
 epoch: 85, train_loss: 0.7436, test_loss: 0.9231, test_f1: 0.5797
 epoch: 86, train_loss: 0.7492, test_loss: 0.9572, test_f1: 0.5625
 epoch: 87, train_loss: 0.7453, test_loss: 0.9444, test_f1: 0.5816
 epoch: 88, train_loss: 0.7564, test_loss: 0.9571, test_f1: 0.5673
 epoch: 89, train_loss: 0.7478, test_loss: 0.9496, test_f1: 0.5633
 epoch: 90, train_loss: 0.7464, test_loss: 0.9232, test_f1: 0.5932
 epoch: 91, train_loss: 0.7448, test_loss: 0.9535, test_f1: 0.5696
 epoch: 92, train_loss: 0.7460, test_loss: 0.9287, test_f1: 0.5816
 epoch: 93, train_loss: 0.7312, test_loss: 1.0178, test_f1: 0.5658
 epoch: 94, train_loss: 0.7273, test_loss: 0.9394, test_f1: 0.5759
 epoch: 95, train_loss: 0.7426, test_loss: 0.9371, test_f1: 0.5961
 epoch: 96, train_loss: 0.7354, test_loss: 0.9856, test_f1: 0.5575
 epoch: 97, train_loss: 0.7312, test_loss: 0.9680, test_f1: 0.5752
 epoch: 98, train_loss: 0.7372, test_loss: 0.9514, test_f1: 0.5828
 epoch: 99, train_loss: 0.7404, test_loss: 0.9674, test_f1: 0.5632
##################ITERATION #1 ****************************************
 epoch: 0, train_loss: 1.3024, test_loss: 1.2119, test_f1: 0.3723
 epoch: 1, train_loss: 1.2126, test_loss: 1.1695, test_f1: 0.4243
 epoch: 2, train_loss: 1.1718, test_loss: 1.1173, test_f1: 0.4397
 epoch: 3, train_loss: 1.1326, test_loss: 1.0752, test_f1: 0.4542
 epoch: 4, train_loss: 1.0996, test_loss: 1.0377, test_f1: 0.4563
 epoch: 5, train_loss: 1.0691, test_loss: 0.9943, test_f1: 0.4620
 epoch: 6, train_loss: 1.0515, test_loss: 0.9709, test_f1: 0.4884
 epoch: 7, train_loss: 1.0205, test_loss: 0.9713, test_f1: 0.4756
 epoch: 8, train_loss: 1.0054, test_loss: 0.9687, test_f1: 0.5062
 epoch: 9, train_loss: 0.9903, test_loss: 0.9583, test_f1: 0.4762
 epoch: 10, train_loss: 0.9785, test_loss: 0.9670, test_f1: 0.4968
 epoch: 11, train_loss: 0.9682, test_loss: 0.9382, test_f1: 0.5240
 epoch: 12, train_loss: 0.9498, test_loss: 0.9372, test_f1: 0.5018
 epoch: 13, train_loss: 0.9444, test_loss: 0.9562, test_f1: 0.5243
 epoch: 14, train_loss: 0.9246, test_loss: 0.9304, test_f1: 0.5448
 epoch: 15, train_loss: 0.9333, test_loss: 0.9453, test_f1: 0.5172
 epoch: 16, train_loss: 0.9173, test_loss: 0.9341, test_f1: 0.5234
 epoch: 17, train_loss: 0.9072, test_loss: 0.9439, test_f1: 0.5425
 epoch: 18, train_loss: 0.9171, test_loss: 0.9142, test_f1: 0.5652
 epoch: 19, train_loss: 0.9140, test_loss: 0.9332, test_f1: 0.5479
 epoch: 20, train_loss: 0.8967, test_loss: 0.9149, test_f1: 0.5452
 epoch: 21, train_loss: 0.8946, test_loss: 0.9374, test_f1: 0.5474
 epoch: 22, train_loss: 0.8936, test_loss: 0.9210, test_f1: 0.5510
 epoch: 23, train_loss: 0.8850, test_loss: 0.9334, test_f1: 0.5413
 epoch: 24, train_loss: 0.8775, test_loss: 0.9259, test_f1: 0.5491
 epoch: 25, train_loss: 0.8783, test_loss: 0.9183, test_f1: 0.5586
 epoch: 26, train_loss: 0.8690, test_loss: 0.9222, test_f1: 0.5378
 epoch: 27, train_loss: 0.8633, test_loss: 0.9245, test_f1: 0.5505
 epoch: 28, train_loss: 0.8638, test_loss: 0.9271, test_f1: 0.5508
 epoch: 29, train_loss: 0.8633, test_loss: 0.9412, test_f1: 0.5509
 epoch: 30, train_loss: 0.8576, test_loss: 0.9344, test_f1: 0.5519
 epoch: 31, train_loss: 0.8633, test_loss: 0.9502, test_f1: 0.5440
 epoch: 32, train_loss: 0.8553, test_loss: 0.9495, test_f1: 0.5387
 epoch: 33, train_loss: 0.8476, test_loss: 0.9426, test_f1: 0.5463
 epoch: 34, train_loss: 0.8528, test_loss: 0.9401, test_f1: 0.5564
 epoch: 35, train_loss: 0.8523, test_loss: 0.9161, test_f1: 0.5724
 epoch: 36, train_loss: 0.8498, test_loss: 0.9227, test_f1: 0.5454
 epoch: 37, train_loss: 0.8396, test_loss: 0.9263, test_f1: 0.5627
 epoch: 38, train_loss: 0.8357, test_loss: 0.9292, test_f1: 0.5528
 epoch: 39, train_loss: 0.8261, test_loss: 0.9428, test_f1: 0.5769
 epoch: 40, train_loss: 0.8294, test_loss: 0.9278, test_f1: 0.5531
 epoch: 41, train_loss: 0.8316, test_loss: 0.9239, test_f1: 0.5688
 epoch: 42, train_loss: 0.8240, test_loss: 0.9244, test_f1: 0.5616
 epoch: 43, train_loss: 0.8208, test_loss: 0.9281, test_f1: 0.5722
 epoch: 44, train_loss: 0.8199, test_loss: 0.9019, test_f1: 0.5605
 epoch: 45, train_loss: 0.8144, test_loss: 0.9091, test_f1: 0.5699
 epoch: 46, train_loss: 0.8079, test_loss: 0.9039, test_f1: 0.5697
 epoch: 47, train_loss: 0.8009, test_loss: 0.9098, test_f1: 0.5674
 epoch: 48, train_loss: 0.8035, test_loss: 0.9150, test_f1: 0.5668
 epoch: 49, train_loss: 0.7973, test_loss: 0.9378, test_f1: 0.5712
 epoch: 50, train_loss: 0.8016, test_loss: 0.9201, test_f1: 0.5765
 epoch: 51, train_loss: 0.7967, test_loss: 0.9184, test_f1: 0.5843
 epoch: 52, train_loss: 0.7951, test_loss: 0.9232, test_f1: 0.5852
 epoch: 53, train_loss: 0.7825, test_loss: 0.9248, test_f1: 0.5666
 epoch: 54, train_loss: 0.7896, test_loss: 0.9248, test_f1: 0.5860
 epoch: 55, train_loss: 0.7761, test_loss: 0.9405, test_f1: 0.5629
 epoch: 56, train_loss: 0.7752, test_loss: 0.9188, test_f1: 0.5810
 epoch: 57, train_loss: 0.7884, test_loss: 0.9494, test_f1: 0.5862
 epoch: 58, train_loss: 0.7749, test_loss: 0.9373, test_f1: 0.5787
 epoch: 59, train_loss: 0.7781, test_loss: 0.9157, test_f1: 0.5867
 epoch: 60, train_loss: 0.7655, test_loss: 0.9246, test_f1: 0.5903
 epoch: 61, train_loss: 0.7766, test_loss: 0.9332, test_f1: 0.5848
 epoch: 62, train_loss: 0.7716, test_loss: 0.9119, test_f1: 0.5889
 epoch: 63, train_loss: 0.7784, test_loss: 0.9165, test_f1: 0.5653
 epoch: 64, train_loss: 0.7674, test_loss: 0.9384, test_f1: 0.5703
 epoch: 65, train_loss: 0.7662, test_loss: 0.9266, test_f1: 0.5943
 epoch: 66, train_loss: 0.7596, test_loss: 0.9230, test_f1: 0.5951
 epoch: 67, train_loss: 0.7608, test_loss: 0.9234, test_f1: 0.5870
 epoch: 68, train_loss: 0.7615, test_loss: 0.9044, test_f1: 0.5938
 epoch: 69, train_loss: 0.7680, test_loss: 0.9118, test_f1: 0.5871
 epoch: 70, train_loss: 0.7669, test_loss: 0.9199, test_f1: 0.5784
 epoch: 71, train_loss: 0.7616, test_loss: 0.9113, test_f1: 0.5984
 epoch: 72, train_loss: 0.7537, test_loss: 0.9271, test_f1: 0.6124
 epoch: 73, train_loss: 0.7558, test_loss: 0.9272, test_f1: 0.5784
 epoch: 74, train_loss: 0.7648, test_loss: 0.9326, test_f1: 0.5891
 epoch: 75, train_loss: 0.7731, test_loss: 0.9314, test_f1: 0.6025
 epoch: 76, train_loss: 0.7526, test_loss: 0.9103, test_f1: 0.5970
 epoch: 77, train_loss: 0.7591, test_loss: 0.9183, test_f1: 0.5966
 epoch: 78, train_loss: 0.7540, test_loss: 0.9260, test_f1: 0.5829
 epoch: 79, train_loss: 0.7563, test_loss: 0.9289, test_f1: 0.5958
 epoch: 80, train_loss: 0.7434, test_loss: 0.9264, test_f1: 0.5910
 epoch: 81, train_loss: 0.7524, test_loss: 0.9206, test_f1: 0.5813
 epoch: 82, train_loss: 0.7395, test_loss: 0.9277, test_f1: 0.5957
 epoch: 83, train_loss: 0.7417, test_loss: 0.9292, test_f1: 0.5993
 epoch: 84, train_loss: 0.7479, test_loss: 0.9189, test_f1: 0.5963
 epoch: 85, train_loss: 0.7408, test_loss: 0.9172, test_f1: 0.6014
 epoch: 86, train_loss: 0.7437, test_loss: 0.9337, test_f1: 0.5801
 epoch: 87, train_loss: 0.7356, test_loss: 0.9644, test_f1: 0.5827
 epoch: 88, train_loss: 0.7397, test_loss: 0.9391, test_f1: 0.6101
 epoch: 89, train_loss: 0.7374, test_loss: 0.9484, test_f1: 0.5945
 epoch: 90, train_loss: 0.7302, test_loss: 0.9301, test_f1: 0.6030
 epoch: 91, train_loss: 0.7211, test_loss: 0.9398, test_f1: 0.5982
 epoch: 92, train_loss: 0.7279, test_loss: 0.9335, test_f1: 0.5952
 epoch: 93, train_loss: 0.7388, test_loss: 0.9494, test_f1: 0.5891
 epoch: 94, train_loss: 0.7390, test_loss: 0.9162, test_f1: 0.6089
 epoch: 95, train_loss: 0.7201, test_loss: 0.9421, test_f1: 0.5863
 epoch: 96, train_loss: 0.7308, test_loss: 0.9370, test_f1: 0.6008
 epoch: 97, train_loss: 0.7213, test_loss: 0.9231, test_f1: 0.5995
 epoch: 98, train_loss: 0.7208, test_loss: 0.9390, test_f1: 0.5962
 epoch: 99, train_loss: 0.7315, test_loss: 0.9316, test_f1: 0.6028
##################ITERATION #2 ****************************************
 epoch: 0, train_loss: 1.2587, test_loss: 1.1690, test_f1: 0.3723
 epoch: 1, train_loss: 1.1723, test_loss: 1.1095, test_f1: 0.4083
 epoch: 2, train_loss: 1.1331, test_loss: 1.0599, test_f1: 0.4230
 epoch: 3, train_loss: 1.0992, test_loss: 1.0184, test_f1: 0.4579
 epoch: 4, train_loss: 1.0613, test_loss: 0.9841, test_f1: 0.4775
 epoch: 5, train_loss: 1.0307, test_loss: 0.9684, test_f1: 0.4743
 epoch: 6, train_loss: 1.0115, test_loss: 0.9568, test_f1: 0.4858
 epoch: 7, train_loss: 0.9902, test_loss: 0.9495, test_f1: 0.5014
 epoch: 8, train_loss: 0.9725, test_loss: 0.9492, test_f1: 0.4966
 epoch: 9, train_loss: 0.9651, test_loss: 0.9437, test_f1: 0.5035
 epoch: 10, train_loss: 0.9460, test_loss: 0.9148, test_f1: 0.5221
 epoch: 11, train_loss: 0.9439, test_loss: 0.9265, test_f1: 0.5250
 epoch: 12, train_loss: 0.9371, test_loss: 0.9575, test_f1: 0.5066
 epoch: 13, train_loss: 0.9319, test_loss: 0.9337, test_f1: 0.5257
 epoch: 14, train_loss: 0.9275, test_loss: 0.9608, test_f1: 0.5044
 epoch: 15, train_loss: 0.9149, test_loss: 0.9343, test_f1: 0.5329
 epoch: 16, train_loss: 0.9059, test_loss: 0.9335, test_f1: 0.5286
 epoch: 17, train_loss: 0.8965, test_loss: 0.9429, test_f1: 0.5267
 epoch: 18, train_loss: 0.8953, test_loss: 0.9393, test_f1: 0.5281
 epoch: 19, train_loss: 0.8923, test_loss: 0.9259, test_f1: 0.5268
 epoch: 20, train_loss: 0.8825, test_loss: 0.9542, test_f1: 0.5262
 epoch: 21, train_loss: 0.8683, test_loss: 0.9218, test_f1: 0.5442
 epoch: 22, train_loss: 0.8674, test_loss: 0.9632, test_f1: 0.5241
 epoch: 23, train_loss: 0.8621, test_loss: 0.9492, test_f1: 0.5262
 epoch: 24, train_loss: 0.8637, test_loss: 0.9430, test_f1: 0.5307
 epoch: 25, train_loss: 0.8496, test_loss: 0.9559, test_f1: 0.5333
 epoch: 26, train_loss: 0.8395, test_loss: 0.9361, test_f1: 0.5543
 epoch: 27, train_loss: 0.8588, test_loss: 0.9422, test_f1: 0.5492
 epoch: 28, train_loss: 0.8375, test_loss: 0.9474, test_f1: 0.5361
 epoch: 29, train_loss: 0.8359, test_loss: 0.9502, test_f1: 0.5538
 epoch: 30, train_loss: 0.8214, test_loss: 0.9267, test_f1: 0.5619
 epoch: 31, train_loss: 0.8262, test_loss: 0.9369, test_f1: 0.5707
 epoch: 32, train_loss: 0.8268, test_loss: 0.9538, test_f1: 0.5454
 epoch: 33, train_loss: 0.8229, test_loss: 0.9855, test_f1: 0.5534
 epoch: 34, train_loss: 0.8221, test_loss: 0.9553, test_f1: 0.5494
 epoch: 35, train_loss: 0.8078, test_loss: 0.9378, test_f1: 0.5641
 epoch: 36, train_loss: 0.8033, test_loss: 0.9320, test_f1: 0.5664
 epoch: 37, train_loss: 0.8047, test_loss: 0.9435, test_f1: 0.5661
 epoch: 38, train_loss: 0.8073, test_loss: 0.9352, test_f1: 0.5662
 epoch: 39, train_loss: 0.8076, test_loss: 0.9363, test_f1: 0.5599
 epoch: 40, train_loss: 0.8047, test_loss: 0.9368, test_f1: 0.5726
 epoch: 41, train_loss: 0.7906, test_loss: 0.9558, test_f1: 0.5893
 epoch: 42, train_loss: 0.7966, test_loss: 0.9811, test_f1: 0.5614
 epoch: 43, train_loss: 0.7901, test_loss: 0.9430, test_f1: 0.5913
 epoch: 44, train_loss: 0.7883, test_loss: 0.9554, test_f1: 0.5888
 epoch: 45, train_loss: 0.7863, test_loss: 0.9464, test_f1: 0.6027
 epoch: 46, train_loss: 0.7693, test_loss: 0.9377, test_f1: 0.5746
 epoch: 47, train_loss: 0.7740, test_loss: 0.9378, test_f1: 0.5783
 epoch: 48, train_loss: 0.7747, test_loss: 0.9462, test_f1: 0.5849
 epoch: 49, train_loss: 0.7560, test_loss: 0.9652, test_f1: 0.5821
 epoch: 50, train_loss: 0.7693, test_loss: 0.9448, test_f1: 0.5818
 epoch: 51, train_loss: 0.7509, test_loss: 0.9432, test_f1: 0.5781
 epoch: 52, train_loss: 0.7368, test_loss: 0.9370, test_f1: 0.5916
 epoch: 53, train_loss: 0.7575, test_loss: 0.9534, test_f1: 0.5862
 epoch: 54, train_loss: 0.7475, test_loss: 0.9507, test_f1: 0.5912
 epoch: 55, train_loss: 0.7435, test_loss: 0.9555, test_f1: 0.5838
 epoch: 56, train_loss: 0.7351, test_loss: 0.9524, test_f1: 0.5968
 epoch: 57, train_loss: 0.7413, test_loss: 0.9516, test_f1: 0.5861
 epoch: 58, train_loss: 0.7332, test_loss: 0.9378, test_f1: 0.5856
 epoch: 59, train_loss: 0.7438, test_loss: 0.9379, test_f1: 0.5967
 epoch: 60, train_loss: 0.7304, test_loss: 0.9498, test_f1: 0.6035
 epoch: 61, train_loss: 0.7335, test_loss: 0.9295, test_f1: 0.6118
 epoch: 62, train_loss: 0.7373, test_loss: 0.9278, test_f1: 0.6016
 epoch: 63, train_loss: 0.7355, test_loss: 0.9412, test_f1: 0.6045
 epoch: 64, train_loss: 0.7353, test_loss: 0.9349, test_f1: 0.5996
 epoch: 65, train_loss: 0.7303, test_loss: 0.9671, test_f1: 0.6181
 epoch: 66, train_loss: 0.7214, test_loss: 0.9214, test_f1: 0.6024
 epoch: 67, train_loss: 0.7180, test_loss: 0.9570, test_f1: 0.6153
 epoch: 68, train_loss: 0.7307, test_loss: 0.9616, test_f1: 0.6039
 epoch: 69, train_loss: 0.7257, test_loss: 0.9260, test_f1: 0.6211
 epoch: 70, train_loss: 0.7215, test_loss: 0.9505, test_f1: 0.6032
 epoch: 71, train_loss: 0.7181, test_loss: 0.9610, test_f1: 0.5888
 epoch: 72, train_loss: 0.7246, test_loss: 0.9436, test_f1: 0.6079
 epoch: 73, train_loss: 0.7211, test_loss: 0.9687, test_f1: 0.5830
 epoch: 74, train_loss: 0.7129, test_loss: 0.9573, test_f1: 0.5891
 epoch: 75, train_loss: 0.7162, test_loss: 0.9290, test_f1: 0.6082
 epoch: 76, train_loss: 0.7023, test_loss: 0.9531, test_f1: 0.6003
 epoch: 77, train_loss: 0.7131, test_loss: 0.9582, test_f1: 0.6158
 epoch: 78, train_loss: 0.7052, test_loss: 0.9808, test_f1: 0.6191
 epoch: 79, train_loss: 0.6995, test_loss: 0.9313, test_f1: 0.6288
 epoch: 80, train_loss: 0.6995, test_loss: 0.9554, test_f1: 0.6279
 epoch: 81, train_loss: 0.7097, test_loss: 0.9418, test_f1: 0.6101
 epoch: 82, train_loss: 0.7009, test_loss: 0.9447, test_f1: 0.6258
 epoch: 83, train_loss: 0.7031, test_loss: 0.9264, test_f1: 0.6286
 epoch: 84, train_loss: 0.7137, test_loss: 0.9372, test_f1: 0.6042
 epoch: 85, train_loss: 0.7029, test_loss: 0.9207, test_f1: 0.6292
 epoch: 86, train_loss: 0.7088, test_loss: 0.9615, test_f1: 0.6130
 epoch: 87, train_loss: 0.6958, test_loss: 0.9615, test_f1: 0.6115
 epoch: 88, train_loss: 0.7018, test_loss: 0.9636, test_f1: 0.6093
 epoch: 89, train_loss: 0.6959, test_loss: 0.9548, test_f1: 0.6093
 epoch: 90, train_loss: 0.7023, test_loss: 0.9586, test_f1: 0.6139
 epoch: 91, train_loss: 0.6975, test_loss: 0.9748, test_f1: 0.5994
 epoch: 92, train_loss: 0.6941, test_loss: 0.9675, test_f1: 0.6194
 epoch: 93, train_loss: 0.7012, test_loss: 0.9726, test_f1: 0.6159
 epoch: 94, train_loss: 0.6895, test_loss: 0.9417, test_f1: 0.6295
 epoch: 95, train_loss: 0.6848, test_loss: 0.9350, test_f1: 0.6316
 epoch: 96, train_loss: 0.6958, test_loss: 0.9497, test_f1: 0.6264
 epoch: 97, train_loss: 0.6926, test_loss: 0.9417, test_f1: 0.6213
 epoch: 98, train_loss: 0.6790, test_loss: 0.9727, test_f1: 0.6137
 epoch: 99, train_loss: 0.6750, test_loss: 0.9506, test_f1: 0.6025
##################ITERATION #3 ****************************************
 epoch: 0, train_loss: 1.2515, test_loss: 1.1600, test_f1: 0.3795
 epoch: 1, train_loss: 1.1783, test_loss: 1.1102, test_f1: 0.4511
 epoch: 2, train_loss: 1.1335, test_loss: 1.0729, test_f1: 0.4585
 epoch: 3, train_loss: 1.1033, test_loss: 1.0409, test_f1: 0.4460
 epoch: 4, train_loss: 1.0895, test_loss: 1.0181, test_f1: 0.5008
 epoch: 5, train_loss: 1.0651, test_loss: 0.9908, test_f1: 0.4920
 epoch: 6, train_loss: 1.0470, test_loss: 0.9737, test_f1: 0.5184
 epoch: 7, train_loss: 1.0246, test_loss: 0.9607, test_f1: 0.5217
 epoch: 8, train_loss: 1.0030, test_loss: 0.9501, test_f1: 0.5126
 epoch: 9, train_loss: 1.0006, test_loss: 0.9578, test_f1: 0.5245
 epoch: 10, train_loss: 0.9866, test_loss: 0.9459, test_f1: 0.5239
 epoch: 11, train_loss: 0.9705, test_loss: 0.9416, test_f1: 0.5240
 epoch: 12, train_loss: 0.9644, test_loss: 0.9239, test_f1: 0.5081
 epoch: 13, train_loss: 0.9599, test_loss: 0.9238, test_f1: 0.5060
 epoch: 14, train_loss: 0.9515, test_loss: 0.9161, test_f1: 0.5295
 epoch: 15, train_loss: 0.9339, test_loss: 0.9080, test_f1: 0.5218
 epoch: 16, train_loss: 0.9305, test_loss: 0.9191, test_f1: 0.5169
 epoch: 17, train_loss: 0.9294, test_loss: 0.9235, test_f1: 0.5357
 epoch: 18, train_loss: 0.9207, test_loss: 0.9176, test_f1: 0.5366
 epoch: 19, train_loss: 0.9123, test_loss: 0.9217, test_f1: 0.5399
 epoch: 20, train_loss: 0.9011, test_loss: 0.9271, test_f1: 0.5569
 epoch: 21, train_loss: 0.9041, test_loss: 0.9131, test_f1: 0.5471
 epoch: 22, train_loss: 0.8980, test_loss: 0.9124, test_f1: 0.5512
 epoch: 23, train_loss: 0.8881, test_loss: 0.9130, test_f1: 0.5369
 epoch: 24, train_loss: 0.8809, test_loss: 0.9142, test_f1: 0.5463
 epoch: 25, train_loss: 0.8776, test_loss: 0.9236, test_f1: 0.5489
 epoch: 26, train_loss: 0.8833, test_loss: 0.9248, test_f1: 0.5418
 epoch: 27, train_loss: 0.8659, test_loss: 0.9294, test_f1: 0.5594
 epoch: 28, train_loss: 0.8604, test_loss: 0.9243, test_f1: 0.5497
 epoch: 29, train_loss: 0.8702, test_loss: 0.9310, test_f1: 0.5648
 epoch: 30, train_loss: 0.8622, test_loss: 0.9246, test_f1: 0.5546
 epoch: 31, train_loss: 0.8550, test_loss: 0.9320, test_f1: 0.5505
 epoch: 32, train_loss: 0.8506, test_loss: 0.9048, test_f1: 0.5606
 epoch: 33, train_loss: 0.8521, test_loss: 0.9092, test_f1: 0.5521
 epoch: 34, train_loss: 0.8481, test_loss: 0.9185, test_f1: 0.5519
 epoch: 35, train_loss: 0.8409, test_loss: 0.9596, test_f1: 0.5522
 epoch: 36, train_loss: 0.8284, test_loss: 0.9216, test_f1: 0.5544
 epoch: 37, train_loss: 0.8336, test_loss: 0.9191, test_f1: 0.5477
 epoch: 38, train_loss: 0.8350, test_loss: 0.8925, test_f1: 0.5537
 epoch: 39, train_loss: 0.8374, test_loss: 0.8983, test_f1: 0.5630
 epoch: 40, train_loss: 0.8305, test_loss: 0.9011, test_f1: 0.5724
 epoch: 41, train_loss: 0.8267, test_loss: 0.9148, test_f1: 0.5530
 epoch: 42, train_loss: 0.8106, test_loss: 0.9018, test_f1: 0.5772
 epoch: 43, train_loss: 0.8146, test_loss: 0.9315, test_f1: 0.5430
 epoch: 44, train_loss: 0.8099, test_loss: 0.9351, test_f1: 0.5382
 epoch: 45, train_loss: 0.8128, test_loss: 0.9258, test_f1: 0.5454
 epoch: 46, train_loss: 0.8058, test_loss: 0.9362, test_f1: 0.5415
 epoch: 47, train_loss: 0.7992, test_loss: 0.9517, test_f1: 0.5427
 epoch: 48, train_loss: 0.7969, test_loss: 0.9431, test_f1: 0.5476
 epoch: 49, train_loss: 0.7970, test_loss: 0.9270, test_f1: 0.5583
 epoch: 50, train_loss: 0.7884, test_loss: 0.9355, test_f1: 0.5455
 epoch: 51, train_loss: 0.7876, test_loss: 0.9386, test_f1: 0.5521
 epoch: 52, train_loss: 0.7835, test_loss: 0.9087, test_f1: 0.5616
 epoch: 53, train_loss: 0.7846, test_loss: 0.9165, test_f1: 0.5575
 epoch: 54, train_loss: 0.7781, test_loss: 0.9309, test_f1: 0.5431
 epoch: 55, train_loss: 0.7734, test_loss: 0.9353, test_f1: 0.5601
 epoch: 56, train_loss: 0.7828, test_loss: 0.9279, test_f1: 0.5525
 epoch: 57, train_loss: 0.7834, test_loss: 0.9243, test_f1: 0.5637
 epoch: 58, train_loss: 0.7681, test_loss: 0.9285, test_f1: 0.5577
 epoch: 59, train_loss: 0.7781, test_loss: 0.9394, test_f1: 0.5484
 epoch: 60, train_loss: 0.7732, test_loss: 0.9200, test_f1: 0.5619
 epoch: 61, train_loss: 0.7684, test_loss: 0.9411, test_f1: 0.5663
 epoch: 62, train_loss: 0.7744, test_loss: 0.9367, test_f1: 0.5496
 epoch: 63, train_loss: 0.7617, test_loss: 0.9363, test_f1: 0.5627
 epoch: 64, train_loss: 0.7586, test_loss: 0.9400, test_f1: 0.5509
 epoch: 65, train_loss: 0.7565, test_loss: 0.9450, test_f1: 0.5653
 epoch: 66, train_loss: 0.7572, test_loss: 0.9473, test_f1: 0.5731
 epoch: 67, train_loss: 0.7613, test_loss: 0.9329, test_f1: 0.5642
 epoch: 68, train_loss: 0.7501, test_loss: 0.9289, test_f1: 0.5650
 epoch: 69, train_loss: 0.7619, test_loss: 0.9535, test_f1: 0.5699
 epoch: 70, train_loss: 0.7509, test_loss: 0.9377, test_f1: 0.5604
 epoch: 71, train_loss: 0.7514, test_loss: 0.9210, test_f1: 0.5604
 epoch: 72, train_loss: 0.7637, test_loss: 0.9031, test_f1: 0.5736
 epoch: 73, train_loss: 0.7501, test_loss: 0.9419, test_f1: 0.5683
 epoch: 74, train_loss: 0.7446, test_loss: 0.9285, test_f1: 0.5688
 epoch: 75, train_loss: 0.7442, test_loss: 0.9415, test_f1: 0.5718
 epoch: 76, train_loss: 0.7448, test_loss: 0.9696, test_f1: 0.5684
 epoch: 77, train_loss: 0.7459, test_loss: 0.9564, test_f1: 0.5731
 epoch: 78, train_loss: 0.7454, test_loss: 0.9357, test_f1: 0.5892
 epoch: 79, train_loss: 0.7448, test_loss: 0.9555, test_f1: 0.5666
 epoch: 80, train_loss: 0.7468, test_loss: 0.9584, test_f1: 0.5839
 epoch: 81, train_loss: 0.7398, test_loss: 0.9259, test_f1: 0.5722
 epoch: 82, train_loss: 0.7398, test_loss: 0.9471, test_f1: 0.5807
 epoch: 83, train_loss: 0.7400, test_loss: 0.9099, test_f1: 0.5789
 epoch: 84, train_loss: 0.7418, test_loss: 0.9388, test_f1: 0.5735
 epoch: 85, train_loss: 0.7352, test_loss: 0.9298, test_f1: 0.5814
 epoch: 86, train_loss: 0.7268, test_loss: 0.9218, test_f1: 0.5869
 epoch: 87, train_loss: 0.7132, test_loss: 0.9373, test_f1: 0.5811
 epoch: 88, train_loss: 0.7360, test_loss: 0.9347, test_f1: 0.5882
 epoch: 89, train_loss: 0.7267, test_loss: 0.9551, test_f1: 0.5900
 epoch: 90, train_loss: 0.7219, test_loss: 0.9425, test_f1: 0.5898
 epoch: 91, train_loss: 0.7266, test_loss: 0.9539, test_f1: 0.5896
 epoch: 92, train_loss: 0.7338, test_loss: 0.9550, test_f1: 0.5811
 epoch: 93, train_loss: 0.7175, test_loss: 0.9572, test_f1: 0.5804
 epoch: 94, train_loss: 0.7270, test_loss: 0.9370, test_f1: 0.5819
 epoch: 95, train_loss: 0.7179, test_loss: 0.9334, test_f1: 0.5881
 epoch: 96, train_loss: 0.7118, test_loss: 0.9283, test_f1: 0.5960
 epoch: 97, train_loss: 0.7260, test_loss: 0.9619, test_f1: 0.5869
 epoch: 98, train_loss: 0.7032, test_loss: 0.9623, test_f1: 0.5855
 epoch: 99, train_loss: 0.7249, test_loss: 0.9456, test_f1: 0.6010
##################ITERATION #4 ****************************************
 epoch: 0, train_loss: 1.2632, test_loss: 1.1103, test_f1: 0.4035
 epoch: 1, train_loss: 1.1435, test_loss: 1.0585, test_f1: 0.4594
 epoch: 2, train_loss: 1.1051, test_loss: 1.0108, test_f1: 0.4666
 epoch: 3, train_loss: 1.0650, test_loss: 0.9990, test_f1: 0.4634
 epoch: 4, train_loss: 1.0477, test_loss: 0.9728, test_f1: 0.4912
 epoch: 5, train_loss: 1.0301, test_loss: 0.9533, test_f1: 0.5002
 epoch: 6, train_loss: 1.0059, test_loss: 0.9549, test_f1: 0.4784
 epoch: 7, train_loss: 0.9900, test_loss: 0.9495, test_f1: 0.4840
 epoch: 8, train_loss: 0.9839, test_loss: 0.9373, test_f1: 0.4850
 epoch: 9, train_loss: 0.9808, test_loss: 0.9573, test_f1: 0.4826
 epoch: 10, train_loss: 0.9591, test_loss: 0.9672, test_f1: 0.4894
 epoch: 11, train_loss: 0.9570, test_loss: 0.9349, test_f1: 0.5270
 epoch: 12, train_loss: 0.9457, test_loss: 0.9280, test_f1: 0.4890
 epoch: 13, train_loss: 0.9404, test_loss: 0.9202, test_f1: 0.4943
 epoch: 14, train_loss: 0.9243, test_loss: 0.9242, test_f1: 0.5069
 epoch: 15, train_loss: 0.9235, test_loss: 0.9447, test_f1: 0.5043
 epoch: 16, train_loss: 0.9094, test_loss: 0.9331, test_f1: 0.5138
 epoch: 17, train_loss: 0.9109, test_loss: 0.9337, test_f1: 0.5163
 epoch: 18, train_loss: 0.9137, test_loss: 0.9306, test_f1: 0.5178
 epoch: 19, train_loss: 0.9085, test_loss: 0.9252, test_f1: 0.5026
 epoch: 20, train_loss: 0.8960, test_loss: 0.9464, test_f1: 0.5223
 epoch: 21, train_loss: 0.8968, test_loss: 0.9348, test_f1: 0.5134
 epoch: 22, train_loss: 0.8863, test_loss: 0.9330, test_f1: 0.5040
 epoch: 23, train_loss: 0.8774, test_loss: 0.9245, test_f1: 0.5221
 epoch: 24, train_loss: 0.8701, test_loss: 0.9337, test_f1: 0.5347
 epoch: 25, train_loss: 0.8841, test_loss: 0.9297, test_f1: 0.5190
 epoch: 26, train_loss: 0.8724, test_loss: 0.9106, test_f1: 0.5710
 epoch: 27, train_loss: 0.8644, test_loss: 0.9080, test_f1: 0.5685
 epoch: 28, train_loss: 0.8551, test_loss: 0.9146, test_f1: 0.5487
 epoch: 29, train_loss: 0.8622, test_loss: 0.9404, test_f1: 0.5470
 epoch: 30, train_loss: 0.8575, test_loss: 0.9513, test_f1: 0.5387
 epoch: 31, train_loss: 0.8551, test_loss: 0.9655, test_f1: 0.5321
 epoch: 32, train_loss: 0.8467, test_loss: 0.9470, test_f1: 0.5567
 epoch: 33, train_loss: 0.8553, test_loss: 0.9458, test_f1: 0.5525
 epoch: 34, train_loss: 0.8410, test_loss: 0.9293, test_f1: 0.5517
 epoch: 35, train_loss: 0.8354, test_loss: 0.8994, test_f1: 0.5667
 epoch: 36, train_loss: 0.8316, test_loss: 0.9143, test_f1: 0.5613
 epoch: 37, train_loss: 0.8409, test_loss: 0.9436, test_f1: 0.5404
 epoch: 38, train_loss: 0.8413, test_loss: 0.9261, test_f1: 0.5547
 epoch: 39, train_loss: 0.8184, test_loss: 0.9269, test_f1: 0.5614
 epoch: 40, train_loss: 0.8190, test_loss: 0.9138, test_f1: 0.5516
 epoch: 41, train_loss: 0.8175, test_loss: 0.9152, test_f1: 0.5625
 epoch: 42, train_loss: 0.8240, test_loss: 0.9375, test_f1: 0.5668
 epoch: 43, train_loss: 0.8035, test_loss: 0.9515, test_f1: 0.5720
 epoch: 44, train_loss: 0.8150, test_loss: 0.9204, test_f1: 0.5611
 epoch: 45, train_loss: 0.8040, test_loss: 0.9129, test_f1: 0.5665
 epoch: 46, train_loss: 0.7989, test_loss: 0.9180, test_f1: 0.5781
 epoch: 47, train_loss: 0.8132, test_loss: 0.9412, test_f1: 0.5693
 epoch: 48, train_loss: 0.8024, test_loss: 0.9095, test_f1: 0.5684
 epoch: 49, train_loss: 0.7971, test_loss: 0.9344, test_f1: 0.5711
 epoch: 50, train_loss: 0.7905, test_loss: 0.9330, test_f1: 0.5650
 epoch: 51, train_loss: 0.7879, test_loss: 0.9223, test_f1: 0.5638
 epoch: 52, train_loss: 0.7901, test_loss: 0.9297, test_f1: 0.5770
 epoch: 53, train_loss: 0.7800, test_loss: 0.9390, test_f1: 0.5669
 epoch: 54, train_loss: 0.7696, test_loss: 0.9351, test_f1: 0.5626
 epoch: 55, train_loss: 0.7824, test_loss: 0.9416, test_f1: 0.5717
 epoch: 56, train_loss: 0.7764, test_loss: 0.9220, test_f1: 0.5786
 epoch: 57, train_loss: 0.7790, test_loss: 0.9357, test_f1: 0.5768
 epoch: 58, train_loss: 0.7760, test_loss: 0.9455, test_f1: 0.5549
 epoch: 59, train_loss: 0.7701, test_loss: 0.9498, test_f1: 0.5616
 epoch: 60, train_loss: 0.7764, test_loss: 0.9526, test_f1: 0.5629
 epoch: 61, train_loss: 0.7826, test_loss: 0.9394, test_f1: 0.5724
 epoch: 62, train_loss: 0.7703, test_loss: 0.9425, test_f1: 0.5762
 epoch: 63, train_loss: 0.7671, test_loss: 0.9710, test_f1: 0.5730
 epoch: 64, train_loss: 0.7642, test_loss: 0.9514, test_f1: 0.5693
 epoch: 65, train_loss: 0.7606, test_loss: 0.9409, test_f1: 0.5746
 epoch: 66, train_loss: 0.7606, test_loss: 0.9505, test_f1: 0.5699
 epoch: 67, train_loss: 0.7656, test_loss: 0.9590, test_f1: 0.5807
 epoch: 68, train_loss: 0.7559, test_loss: 0.9501, test_f1: 0.5663
 epoch: 69, train_loss: 0.7553, test_loss: 0.9676, test_f1: 0.5778
 epoch: 70, train_loss: 0.7690, test_loss: 0.9473, test_f1: 0.5688
 epoch: 71, train_loss: 0.7585, test_loss: 0.9395, test_f1: 0.5805
 epoch: 72, train_loss: 0.7611, test_loss: 0.9305, test_f1: 0.5764
 epoch: 73, train_loss: 0.7532, test_loss: 0.9286, test_f1: 0.5820
 epoch: 74, train_loss: 0.7425, test_loss: 0.9420, test_f1: 0.5902
 epoch: 75, train_loss: 0.7509, test_loss: 0.9440, test_f1: 0.6009
 epoch: 76, train_loss: 0.7558, test_loss: 0.9436, test_f1: 0.5763
 epoch: 77, train_loss: 0.7425, test_loss: 0.9654, test_f1: 0.5899
 epoch: 78, train_loss: 0.7531, test_loss: 0.9501, test_f1: 0.5766
 epoch: 79, train_loss: 0.7394, test_loss: 0.9374, test_f1: 0.5856
 epoch: 80, train_loss: 0.7553, test_loss: 0.9501, test_f1: 0.5831
 epoch: 81, train_loss: 0.7286, test_loss: 0.9693, test_f1: 0.5813
 epoch: 82, train_loss: 0.7330, test_loss: 0.9562, test_f1: 0.5873
 epoch: 83, train_loss: 0.7409, test_loss: 0.9558, test_f1: 0.5781
 epoch: 84, train_loss: 0.7461, test_loss: 0.9325, test_f1: 0.5789
 epoch: 85, train_loss: 0.7361, test_loss: 0.9402, test_f1: 0.5888
 epoch: 86, train_loss: 0.7422, test_loss: 0.9670, test_f1: 0.5822
 epoch: 87, train_loss: 0.7404, test_loss: 0.9453, test_f1: 0.5740
 epoch: 88, train_loss: 0.7325, test_loss: 0.9456, test_f1: 0.5929
 epoch: 89, train_loss: 0.7403, test_loss: 0.9306, test_f1: 0.5768
 epoch: 90, train_loss: 0.7279, test_loss: 0.9676, test_f1: 0.5901
 epoch: 91, train_loss: 0.7332, test_loss: 0.9557, test_f1: 0.5780
 epoch: 92, train_loss: 0.7346, test_loss: 0.9608, test_f1: 0.5794
 epoch: 93, train_loss: 0.7267, test_loss: 0.9405, test_f1: 0.5917
 epoch: 94, train_loss: 0.7209, test_loss: 0.9288, test_f1: 0.5763
 epoch: 95, train_loss: 0.7410, test_loss: 0.9471, test_f1: 0.5838
 epoch: 96, train_loss: 0.7253, test_loss: 0.9474, test_f1: 0.5747
 epoch: 97, train_loss: 0.7310, test_loss: 0.9385, test_f1: 0.5762
 epoch: 98, train_loss: 0.7213, test_loss: 0.9564, test_f1: 0.5722
 epoch: 99, train_loss: 0.7271, test_loss: 0.9411, test_f1: 0.5863
##################ITERATION #5 ****************************************
 epoch: 0, train_loss: 1.2653, test_loss: 1.1084, test_f1: 0.4359
 epoch: 1, train_loss: 1.1443, test_loss: 1.0662, test_f1: 0.4622
 epoch: 2, train_loss: 1.1122, test_loss: 1.0419, test_f1: 0.4618
 epoch: 3, train_loss: 1.0752, test_loss: 1.0189, test_f1: 0.4817
 epoch: 4, train_loss: 1.0726, test_loss: 1.0051, test_f1: 0.4599
 epoch: 5, train_loss: 1.0445, test_loss: 0.9924, test_f1: 0.4736
 epoch: 6, train_loss: 1.0264, test_loss: 0.9717, test_f1: 0.4950
 epoch: 7, train_loss: 1.0107, test_loss: 0.9635, test_f1: 0.4946
 epoch: 8, train_loss: 0.9985, test_loss: 0.9607, test_f1: 0.5197
 epoch: 9, train_loss: 0.9931, test_loss: 0.9542, test_f1: 0.4816
 epoch: 10, train_loss: 0.9681, test_loss: 0.9659, test_f1: 0.4971
 epoch: 11, train_loss: 0.9664, test_loss: 0.9471, test_f1: 0.5088
 epoch: 12, train_loss: 0.9619, test_loss: 0.9627, test_f1: 0.4883
 epoch: 13, train_loss: 0.9532, test_loss: 0.9613, test_f1: 0.4867
 epoch: 14, train_loss: 0.9513, test_loss: 0.9485, test_f1: 0.5174
 epoch: 15, train_loss: 0.9410, test_loss: 0.9690, test_f1: 0.5165
 epoch: 16, train_loss: 0.9216, test_loss: 0.9416, test_f1: 0.4952
 epoch: 17, train_loss: 0.9270, test_loss: 0.9488, test_f1: 0.5002
 epoch: 18, train_loss: 0.9157, test_loss: 0.9744, test_f1: 0.5090
 epoch: 19, train_loss: 0.9118, test_loss: 0.9594, test_f1: 0.5014
 epoch: 20, train_loss: 0.9135, test_loss: 0.9763, test_f1: 0.5084
 epoch: 21, train_loss: 0.9111, test_loss: 0.9592, test_f1: 0.5101
 epoch: 22, train_loss: 0.8923, test_loss: 0.9423, test_f1: 0.5081
 epoch: 23, train_loss: 0.8963, test_loss: 0.9485, test_f1: 0.5218
 epoch: 24, train_loss: 0.8897, test_loss: 0.9577, test_f1: 0.5187
 epoch: 25, train_loss: 0.8794, test_loss: 0.9330, test_f1: 0.5298
 epoch: 26, train_loss: 0.8704, test_loss: 0.9600, test_f1: 0.5154
 epoch: 27, train_loss: 0.8729, test_loss: 0.9400, test_f1: 0.5297
 epoch: 28, train_loss: 0.8703, test_loss: 0.9569, test_f1: 0.5368
 epoch: 29, train_loss: 0.8671, test_loss: 0.9451, test_f1: 0.5444
 epoch: 30, train_loss: 0.8681, test_loss: 0.9520, test_f1: 0.5356
 epoch: 31, train_loss: 0.8560, test_loss: 0.9505, test_f1: 0.5495
 epoch: 32, train_loss: 0.8515, test_loss: 0.9573, test_f1: 0.5441
 epoch: 33, train_loss: 0.8523, test_loss: 0.9549, test_f1: 0.5395
 epoch: 34, train_loss: 0.8577, test_loss: 0.9817, test_f1: 0.5502
 epoch: 35, train_loss: 0.8424, test_loss: 0.9870, test_f1: 0.5286
 epoch: 36, train_loss: 0.8255, test_loss: 0.9648, test_f1: 0.5607
 epoch: 37, train_loss: 0.8375, test_loss: 0.9484, test_f1: 0.5608
 epoch: 38, train_loss: 0.8323, test_loss: 0.9716, test_f1: 0.5592
 epoch: 39, train_loss: 0.8283, test_loss: 0.9743, test_f1: 0.5504
 epoch: 40, train_loss: 0.8228, test_loss: 0.9683, test_f1: 0.5561
 epoch: 41, train_loss: 0.8198, test_loss: 0.9902, test_f1: 0.5577
 epoch: 42, train_loss: 0.8218, test_loss: 0.9434, test_f1: 0.5649
 epoch: 43, train_loss: 0.8088, test_loss: 0.9403, test_f1: 0.5704
 epoch: 44, train_loss: 0.8109, test_loss: 0.9642, test_f1: 0.5697
 epoch: 45, train_loss: 0.8078, test_loss: 0.9434, test_f1: 0.5779
 epoch: 46, train_loss: 0.7949, test_loss: 0.9580, test_f1: 0.5795
 epoch: 47, train_loss: 0.7955, test_loss: 0.9578, test_f1: 0.5658
 epoch: 48, train_loss: 0.7933, test_loss: 0.9376, test_f1: 0.5832
 epoch: 49, train_loss: 0.7956, test_loss: 0.9401, test_f1: 0.5663
 epoch: 50, train_loss: 0.7901, test_loss: 0.9638, test_f1: 0.5890
 epoch: 51, train_loss: 0.7849, test_loss: 0.9619, test_f1: 0.5794
 epoch: 52, train_loss: 0.7800, test_loss: 0.9564, test_f1: 0.5804
 epoch: 53, train_loss: 0.7742, test_loss: 0.9553, test_f1: 0.5815
 epoch: 54, train_loss: 0.7700, test_loss: 0.9823, test_f1: 0.5864
 epoch: 55, train_loss: 0.7780, test_loss: 0.9500, test_f1: 0.5908
 epoch: 56, train_loss: 0.7666, test_loss: 0.9415, test_f1: 0.5975
 epoch: 57, train_loss: 0.7684, test_loss: 0.9478, test_f1: 0.5880
 epoch: 58, train_loss: 0.7646, test_loss: 0.9528, test_f1: 0.5853
 epoch: 59, train_loss: 0.7571, test_loss: 0.9426, test_f1: 0.5893
 epoch: 60, train_loss: 0.7719, test_loss: 0.9394, test_f1: 0.5896
 epoch: 61, train_loss: 0.7632, test_loss: 0.9406, test_f1: 0.5900
 epoch: 62, train_loss: 0.7631, test_loss: 0.9185, test_f1: 0.6083
 epoch: 63, train_loss: 0.7689, test_loss: 0.9731, test_f1: 0.5785
 epoch: 64, train_loss: 0.7655, test_loss: 0.9634, test_f1: 0.5978
 epoch: 65, train_loss: 0.7412, test_loss: 0.9793, test_f1: 0.5820
 epoch: 66, train_loss: 0.7530, test_loss: 0.9769, test_f1: 0.6054
 epoch: 67, train_loss: 0.7475, test_loss: 0.9653, test_f1: 0.5963
 epoch: 68, train_loss: 0.7563, test_loss: 1.0006, test_f1: 0.5984
 epoch: 69, train_loss: 0.7442, test_loss: 0.9748, test_f1: 0.5949
 epoch: 70, train_loss: 0.7367, test_loss: 0.9517, test_f1: 0.5972
 epoch: 71, train_loss: 0.7416, test_loss: 0.9382, test_f1: 0.6039
 epoch: 72, train_loss: 0.7451, test_loss: 0.9147, test_f1: 0.6018
 epoch: 73, train_loss: 0.7336, test_loss: 0.9332, test_f1: 0.5934
 epoch: 74, train_loss: 0.7462, test_loss: 0.9559, test_f1: 0.6018
 epoch: 75, train_loss: 0.7449, test_loss: 0.9458, test_f1: 0.6203
 epoch: 76, train_loss: 0.7332, test_loss: 0.9857, test_f1: 0.6135
 epoch: 77, train_loss: 0.7286, test_loss: 0.9792, test_f1: 0.5871
 epoch: 78, train_loss: 0.7274, test_loss: 0.9507, test_f1: 0.6266
 epoch: 79, train_loss: 0.7246, test_loss: 0.9545, test_f1: 0.6164
 epoch: 80, train_loss: 0.7207, test_loss: 0.9678, test_f1: 0.6204
 epoch: 81, train_loss: 0.7251, test_loss: 0.9691, test_f1: 0.6130
 epoch: 82, train_loss: 0.7252, test_loss: 0.9833, test_f1: 0.6155
 epoch: 83, train_loss: 0.7256, test_loss: 0.9690, test_f1: 0.6176
 epoch: 84, train_loss: 0.7240, test_loss: 0.9730, test_f1: 0.6048
 epoch: 85, train_loss: 0.7282, test_loss: 0.9707, test_f1: 0.6066
 epoch: 86, train_loss: 0.7123, test_loss: 0.9585, test_f1: 0.6204
 epoch: 87, train_loss: 0.7114, test_loss: 0.9522, test_f1: 0.6202
 epoch: 88, train_loss: 0.7257, test_loss: 0.9410, test_f1: 0.6105
 epoch: 89, train_loss: 0.7087, test_loss: 0.9643, test_f1: 0.6321
 epoch: 90, train_loss: 0.7197, test_loss: 0.9508, test_f1: 0.6131
 epoch: 91, train_loss: 0.7196, test_loss: 0.9728, test_f1: 0.6184
 epoch: 92, train_loss: 0.7050, test_loss: 0.9567, test_f1: 0.6054
 epoch: 93, train_loss: 0.7092, test_loss: 0.9582, test_f1: 0.6128
 epoch: 94, train_loss: 0.7088, test_loss: 0.9610, test_f1: 0.6148
 epoch: 95, train_loss: 0.7056, test_loss: 0.9766, test_f1: 0.6334
 epoch: 96, train_loss: 0.7056, test_loss: 0.9688, test_f1: 0.6279
 epoch: 97, train_loss: 0.6947, test_loss: 0.9754, test_f1: 0.6173
 epoch: 98, train_loss: 0.6979, test_loss: 0.9501, test_f1: 0.6400
 epoch: 99, train_loss: 0.6983, test_loss: 0.9826, test_f1: 0.6080
##################ITERATION #6 ****************************************
 epoch: 0, train_loss: 1.2722, test_loss: 1.1393, test_f1: 0.3842
 epoch: 1, train_loss: 1.1591, test_loss: 1.0816, test_f1: 0.4219
 epoch: 2, train_loss: 1.1254, test_loss: 1.0684, test_f1: 0.4389
 epoch: 3, train_loss: 1.1033, test_loss: 1.0249, test_f1: 0.4423
 epoch: 4, train_loss: 1.0805, test_loss: 0.9975, test_f1: 0.4572
 epoch: 5, train_loss: 1.0619, test_loss: 1.0138, test_f1: 0.4521
 epoch: 6, train_loss: 1.0504, test_loss: 0.9809, test_f1: 0.4804
 epoch: 7, train_loss: 1.0393, test_loss: 0.9629, test_f1: 0.4954
 epoch: 8, train_loss: 1.0243, test_loss: 0.9583, test_f1: 0.4772
 epoch: 9, train_loss: 1.0015, test_loss: 0.9578, test_f1: 0.4895
 epoch: 10, train_loss: 0.9955, test_loss: 0.9533, test_f1: 0.4812
 epoch: 11, train_loss: 0.9841, test_loss: 0.9456, test_f1: 0.4864
 epoch: 12, train_loss: 0.9737, test_loss: 0.9627, test_f1: 0.4939
 epoch: 13, train_loss: 0.9689, test_loss: 0.9487, test_f1: 0.5222
 epoch: 14, train_loss: 0.9552, test_loss: 0.9507, test_f1: 0.5216
 epoch: 15, train_loss: 0.9495, test_loss: 0.9450, test_f1: 0.5271
 epoch: 16, train_loss: 0.9360, test_loss: 0.9381, test_f1: 0.5159
 epoch: 17, train_loss: 0.9362, test_loss: 0.9250, test_f1: 0.5322
 epoch: 18, train_loss: 0.9223, test_loss: 0.9469, test_f1: 0.5348
 epoch: 19, train_loss: 0.9132, test_loss: 0.9374, test_f1: 0.5434
 epoch: 20, train_loss: 0.9151, test_loss: 0.9541, test_f1: 0.5174
 epoch: 21, train_loss: 0.9114, test_loss: 0.9385, test_f1: 0.5407
 epoch: 22, train_loss: 0.8983, test_loss: 0.9491, test_f1: 0.5496
 epoch: 23, train_loss: 0.8914, test_loss: 0.9708, test_f1: 0.5431
 epoch: 24, train_loss: 0.8828, test_loss: 0.9554, test_f1: 0.5423
 epoch: 25, train_loss: 0.8838, test_loss: 0.9523, test_f1: 0.5519
 epoch: 26, train_loss: 0.8713, test_loss: 0.9549, test_f1: 0.5388
 epoch: 27, train_loss: 0.8738, test_loss: 0.9448, test_f1: 0.5419
 epoch: 28, train_loss: 0.8717, test_loss: 0.9549, test_f1: 0.5290
 epoch: 29, train_loss: 0.8580, test_loss: 0.9462, test_f1: 0.5545
 epoch: 30, train_loss: 0.8571, test_loss: 0.9440, test_f1: 0.5570
 epoch: 31, train_loss: 0.8649, test_loss: 0.9392, test_f1: 0.5546
 epoch: 32, train_loss: 0.8482, test_loss: 0.9633, test_f1: 0.5468
 epoch: 33, train_loss: 0.8402, test_loss: 0.9550, test_f1: 0.5482
 epoch: 34, train_loss: 0.8387, test_loss: 0.9702, test_f1: 0.5447
 epoch: 35, train_loss: 0.8384, test_loss: 0.9477, test_f1: 0.5558
 epoch: 36, train_loss: 0.8327, test_loss: 0.9482, test_f1: 0.5461
 epoch: 37, train_loss: 0.8323, test_loss: 0.9419, test_f1: 0.5574
 epoch: 38, train_loss: 0.8301, test_loss: 0.9934, test_f1: 0.5356
 epoch: 39, train_loss: 0.8223, test_loss: 0.9720, test_f1: 0.5509
 epoch: 40, train_loss: 0.8216, test_loss: 0.9596, test_f1: 0.5551
 epoch: 41, train_loss: 0.8169, test_loss: 0.9394, test_f1: 0.5612
 epoch: 42, train_loss: 0.8206, test_loss: 0.9561, test_f1: 0.5486
 epoch: 43, train_loss: 0.8118, test_loss: 0.9606, test_f1: 0.5572
 epoch: 44, train_loss: 0.8044, test_loss: 0.9714, test_f1: 0.5672
 epoch: 45, train_loss: 0.8112, test_loss: 0.9652, test_f1: 0.5533
 epoch: 46, train_loss: 0.8014, test_loss: 0.9721, test_f1: 0.5538
 epoch: 47, train_loss: 0.8116, test_loss: 0.9669, test_f1: 0.5558
 epoch: 48, train_loss: 0.7900, test_loss: 0.9595, test_f1: 0.5697
 epoch: 49, train_loss: 0.8002, test_loss: 0.9736, test_f1: 0.5594
 epoch: 50, train_loss: 0.8027, test_loss: 0.9638, test_f1: 0.5647
 epoch: 51, train_loss: 0.7814, test_loss: 0.9723, test_f1: 0.5677
 epoch: 52, train_loss: 0.7869, test_loss: 0.9810, test_f1: 0.5569
 epoch: 53, train_loss: 0.7663, test_loss: 0.9880, test_f1: 0.5505
 epoch: 54, train_loss: 0.7762, test_loss: 0.9662, test_f1: 0.5795
 epoch: 55, train_loss: 0.7684, test_loss: 0.9858, test_f1: 0.5550
 epoch: 56, train_loss: 0.7657, test_loss: 0.9757, test_f1: 0.5688
 epoch: 57, train_loss: 0.7730, test_loss: 0.9938, test_f1: 0.5620
 epoch: 58, train_loss: 0.7711, test_loss: 1.0140, test_f1: 0.5506
 epoch: 59, train_loss: 0.7664, test_loss: 0.9709, test_f1: 0.5638
 epoch: 60, train_loss: 0.7686, test_loss: 0.9779, test_f1: 0.5671
 epoch: 61, train_loss: 0.7672, test_loss: 0.9729, test_f1: 0.5606
 epoch: 62, train_loss: 0.7600, test_loss: 0.9641, test_f1: 0.5742
 epoch: 63, train_loss: 0.7618, test_loss: 0.9821, test_f1: 0.5495
 epoch: 64, train_loss: 0.7600, test_loss: 0.9919, test_f1: 0.5680
 epoch: 65, train_loss: 0.7542, test_loss: 1.0113, test_f1: 0.5760
 epoch: 66, train_loss: 0.7521, test_loss: 0.9915, test_f1: 0.5621
 epoch: 67, train_loss: 0.7640, test_loss: 0.9914, test_f1: 0.5668
 epoch: 68, train_loss: 0.7471, test_loss: 0.9783, test_f1: 0.5498
 epoch: 69, train_loss: 0.7637, test_loss: 0.9997, test_f1: 0.5537
 epoch: 70, train_loss: 0.7501, test_loss: 0.9790, test_f1: 0.5573
 epoch: 71, train_loss: 0.7570, test_loss: 0.9963, test_f1: 0.5598
 epoch: 72, train_loss: 0.7509, test_loss: 0.9877, test_f1: 0.5675
 epoch: 73, train_loss: 0.7494, test_loss: 0.9748, test_f1: 0.5777
 epoch: 74, train_loss: 0.7409, test_loss: 0.9934, test_f1: 0.5780
 epoch: 75, train_loss: 0.7369, test_loss: 0.9799, test_f1: 0.5771
 epoch: 76, train_loss: 0.7460, test_loss: 0.9849, test_f1: 0.5769
 epoch: 77, train_loss: 0.7361, test_loss: 1.0041, test_f1: 0.5731
 epoch: 78, train_loss: 0.7218, test_loss: 1.0010, test_f1: 0.5651
 epoch: 79, train_loss: 0.7320, test_loss: 0.9882, test_f1: 0.5725
 epoch: 80, train_loss: 0.7320, test_loss: 0.9994, test_f1: 0.5709
 epoch: 81, train_loss: 0.7306, test_loss: 0.9931, test_f1: 0.5756
 epoch: 82, train_loss: 0.7303, test_loss: 0.9887, test_f1: 0.5811
 epoch: 83, train_loss: 0.7270, test_loss: 0.9942, test_f1: 0.5784
 epoch: 84, train_loss: 0.7401, test_loss: 1.0021, test_f1: 0.5601
 epoch: 85, train_loss: 0.7250, test_loss: 0.9948, test_f1: 0.5697
 epoch: 86, train_loss: 0.7255, test_loss: 0.9969, test_f1: 0.5721
 epoch: 87, train_loss: 0.7232, test_loss: 1.0053, test_f1: 0.5768
 epoch: 88, train_loss: 0.7184, test_loss: 1.0135, test_f1: 0.5654
 epoch: 89, train_loss: 0.7322, test_loss: 1.0018, test_f1: 0.5747
 epoch: 90, train_loss: 0.7198, test_loss: 1.0095, test_f1: 0.5667
 epoch: 91, train_loss: 0.7198, test_loss: 0.9995, test_f1: 0.5616
 epoch: 92, train_loss: 0.7251, test_loss: 0.9990, test_f1: 0.5708
 epoch: 93, train_loss: 0.7129, test_loss: 1.0067, test_f1: 0.5959
 epoch: 94, train_loss: 0.7047, test_loss: 0.9946, test_f1: 0.5750
 epoch: 95, train_loss: 0.7109, test_loss: 1.0039, test_f1: 0.5857
 epoch: 96, train_loss: 0.7166, test_loss: 0.9784, test_f1: 0.5755
 epoch: 97, train_loss: 0.7152, test_loss: 0.9989, test_f1: 0.5765
 epoch: 98, train_loss: 0.7206, test_loss: 1.0014, test_f1: 0.5793
 epoch: 99, train_loss: 0.7022, test_loss: 0.9993, test_f1: 0.5709
##################ITERATION #7 ****************************************
 epoch: 0, train_loss: 1.2800, test_loss: 1.1372, test_f1: 0.3839
 epoch: 1, train_loss: 1.1634, test_loss: 1.0767, test_f1: 0.4352
 epoch: 2, train_loss: 1.1223, test_loss: 1.0401, test_f1: 0.4337
 epoch: 3, train_loss: 1.0932, test_loss: 1.0296, test_f1: 0.4480
 epoch: 4, train_loss: 1.0565, test_loss: 1.0000, test_f1: 0.4504
 epoch: 5, train_loss: 1.0549, test_loss: 0.9743, test_f1: 0.4667
 epoch: 6, train_loss: 1.0469, test_loss: 0.9927, test_f1: 0.4885
 epoch: 7, train_loss: 1.0144, test_loss: 0.9838, test_f1: 0.4687
 epoch: 8, train_loss: 1.0110, test_loss: 0.9519, test_f1: 0.4792
 epoch: 9, train_loss: 0.9883, test_loss: 0.9599, test_f1: 0.4680
 epoch: 10, train_loss: 0.9862, test_loss: 0.9293, test_f1: 0.4980
 epoch: 11, train_loss: 0.9703, test_loss: 0.9310, test_f1: 0.5013
 epoch: 12, train_loss: 0.9679, test_loss: 0.9310, test_f1: 0.5071
 epoch: 13, train_loss: 0.9680, test_loss: 0.9495, test_f1: 0.4858
 epoch: 14, train_loss: 0.9556, test_loss: 0.9499, test_f1: 0.4864
 epoch: 15, train_loss: 0.9424, test_loss: 0.9478, test_f1: 0.5087
 epoch: 16, train_loss: 0.9277, test_loss: 0.9496, test_f1: 0.4953
 epoch: 17, train_loss: 0.9326, test_loss: 0.9371, test_f1: 0.5061
 epoch: 18, train_loss: 0.9220, test_loss: 0.9323, test_f1: 0.5230
 epoch: 19, train_loss: 0.9212, test_loss: 0.9542, test_f1: 0.5124
 epoch: 20, train_loss: 0.9137, test_loss: 0.9386, test_f1: 0.5155
 epoch: 21, train_loss: 0.8984, test_loss: 0.9359, test_f1: 0.5030
 epoch: 22, train_loss: 0.9092, test_loss: 0.9305, test_f1: 0.5191
 epoch: 23, train_loss: 0.8981, test_loss: 0.9324, test_f1: 0.5259
 epoch: 24, train_loss: 0.8991, test_loss: 0.9608, test_f1: 0.5360
 epoch: 25, train_loss: 0.8964, test_loss: 0.9497, test_f1: 0.5287
 epoch: 26, train_loss: 0.8846, test_loss: 0.9391, test_f1: 0.5176
 epoch: 27, train_loss: 0.8725, test_loss: 0.9494, test_f1: 0.5333
 epoch: 28, train_loss: 0.8797, test_loss: 0.9652, test_f1: 0.5232
 epoch: 29, train_loss: 0.8784, test_loss: 0.9630, test_f1: 0.5363
 epoch: 30, train_loss: 0.8685, test_loss: 0.9431, test_f1: 0.5213
 epoch: 31, train_loss: 0.8571, test_loss: 0.9643, test_f1: 0.5257
 epoch: 32, train_loss: 0.8561, test_loss: 0.9410, test_f1: 0.5335
 epoch: 33, train_loss: 0.8512, test_loss: 0.9520, test_f1: 0.5196
 epoch: 34, train_loss: 0.8479, test_loss: 0.9648, test_f1: 0.5473
 epoch: 35, train_loss: 0.8489, test_loss: 0.9590, test_f1: 0.5513
 epoch: 36, train_loss: 0.8510, test_loss: 0.9599, test_f1: 0.5403
 epoch: 37, train_loss: 0.8329, test_loss: 0.9541, test_f1: 0.5380
 epoch: 38, train_loss: 0.8400, test_loss: 0.9405, test_f1: 0.5487
 epoch: 39, train_loss: 0.8400, test_loss: 1.0062, test_f1: 0.5187
 epoch: 40, train_loss: 0.8374, test_loss: 0.9464, test_f1: 0.5544
 epoch: 41, train_loss: 0.8326, test_loss: 0.9733, test_f1: 0.5315
 epoch: 42, train_loss: 0.8252, test_loss: 0.9616, test_f1: 0.5566
 epoch: 43, train_loss: 0.8330, test_loss: 0.9622, test_f1: 0.5551
 epoch: 44, train_loss: 0.8224, test_loss: 0.9331, test_f1: 0.5282
 epoch: 45, train_loss: 0.8242, test_loss: 0.9408, test_f1: 0.5607
 epoch: 46, train_loss: 0.8005, test_loss: 0.9434, test_f1: 0.5605
 epoch: 47, train_loss: 0.8169, test_loss: 0.9342, test_f1: 0.6009
 epoch: 48, train_loss: 0.8101, test_loss: 0.9730, test_f1: 0.5582
 epoch: 49, train_loss: 0.8078, test_loss: 0.9501, test_f1: 0.5496
 epoch: 50, train_loss: 0.8056, test_loss: 0.9754, test_f1: 0.5691
 epoch: 51, train_loss: 0.7900, test_loss: 0.9799, test_f1: 0.5612
 epoch: 52, train_loss: 0.7952, test_loss: 0.9515, test_f1: 0.5622
 epoch: 53, train_loss: 0.7955, test_loss: 0.9666, test_f1: 0.5559
 epoch: 54, train_loss: 0.7879, test_loss: 0.9884, test_f1: 0.5323
 epoch: 55, train_loss: 0.7874, test_loss: 0.9617, test_f1: 0.5624
 epoch: 56, train_loss: 0.7856, test_loss: 0.9706, test_f1: 0.5695
 epoch: 57, train_loss: 0.7791, test_loss: 0.9629, test_f1: 0.5482
 epoch: 58, train_loss: 0.7822, test_loss: 0.9642, test_f1: 0.5854
 epoch: 59, train_loss: 0.7821, test_loss: 0.9712, test_f1: 0.5623
 epoch: 60, train_loss: 0.7860, test_loss: 0.9866, test_f1: 0.5562
 epoch: 61, train_loss: 0.7801, test_loss: 0.9725, test_f1: 0.5715
 epoch: 62, train_loss: 0.7724, test_loss: 0.9872, test_f1: 0.5519
 epoch: 63, train_loss: 0.7981, test_loss: 0.9962, test_f1: 0.5556
 epoch: 64, train_loss: 0.7738, test_loss: 0.9941, test_f1: 0.5606
 epoch: 65, train_loss: 0.7672, test_loss: 0.9866, test_f1: 0.5410
 epoch: 66, train_loss: 0.7649, test_loss: 0.9787, test_f1: 0.5601
 epoch: 67, train_loss: 0.7677, test_loss: 1.0055, test_f1: 0.5508
 epoch: 68, train_loss: 0.7615, test_loss: 0.9607, test_f1: 0.5915
 epoch: 69, train_loss: 0.7759, test_loss: 0.9938, test_f1: 0.5560
 epoch: 70, train_loss: 0.7664, test_loss: 0.9862, test_f1: 0.5776
 epoch: 71, train_loss: 0.7594, test_loss: 0.9735, test_f1: 0.5673
 epoch: 72, train_loss: 0.7637, test_loss: 0.9681, test_f1: 0.5670
 epoch: 73, train_loss: 0.7541, test_loss: 0.9891, test_f1: 0.5831
 epoch: 74, train_loss: 0.7597, test_loss: 0.9827, test_f1: 0.5640
 epoch: 75, train_loss: 0.7528, test_loss: 0.9853, test_f1: 0.5876
 epoch: 76, train_loss: 0.7498, test_loss: 0.9895, test_f1: 0.5405
 epoch: 77, train_loss: 0.7495, test_loss: 0.9778, test_f1: 0.5797
 epoch: 78, train_loss: 0.7576, test_loss: 0.9856, test_f1: 0.5634
 epoch: 79, train_loss: 0.7568, test_loss: 0.9750, test_f1: 0.5698
 epoch: 80, train_loss: 0.7590, test_loss: 0.9678, test_f1: 0.5618
 epoch: 81, train_loss: 0.7481, test_loss: 0.9978, test_f1: 0.5559
 epoch: 82, train_loss: 0.7429, test_loss: 0.9681, test_f1: 0.5855
 epoch: 83, train_loss: 0.7452, test_loss: 0.9775, test_f1: 0.6012
 epoch: 84, train_loss: 0.7454, test_loss: 0.9814, test_f1: 0.5888
 epoch: 85, train_loss: 0.7560, test_loss: 0.9787, test_f1: 0.5779
 epoch: 86, train_loss: 0.7353, test_loss: 0.9869, test_f1: 0.5936
 epoch: 87, train_loss: 0.7433, test_loss: 0.9797, test_f1: 0.5805
 epoch: 88, train_loss: 0.7387, test_loss: 0.9598, test_f1: 0.5843
 epoch: 89, train_loss: 0.7320, test_loss: 0.9612, test_f1: 0.6078
 epoch: 90, train_loss: 0.7376, test_loss: 0.9737, test_f1: 0.6239
 epoch: 91, train_loss: 0.7333, test_loss: 0.9890, test_f1: 0.5852
 epoch: 92, train_loss: 0.7377, test_loss: 0.9739, test_f1: 0.5952
 epoch: 93, train_loss: 0.7356, test_loss: 0.9785, test_f1: 0.5933
 epoch: 94, train_loss: 0.7290, test_loss: 0.9924, test_f1: 0.5859
 epoch: 95, train_loss: 0.7238, test_loss: 0.9920, test_f1: 0.6004
 epoch: 96, train_loss: 0.7256, test_loss: 0.9838, test_f1: 0.6018
 epoch: 97, train_loss: 0.7278, test_loss: 0.9863, test_f1: 0.5985
 epoch: 98, train_loss: 0.7131, test_loss: 1.0048, test_f1: 0.5707
 epoch: 99, train_loss: 0.7325, test_loss: 0.9880, test_f1: 0.6053
##################ITERATION #8 ****************************************
 epoch: 0, train_loss: 1.2724, test_loss: 1.1477, test_f1: 0.3608
 epoch: 1, train_loss: 1.1695, test_loss: 1.0922, test_f1: 0.4392
 epoch: 2, train_loss: 1.1154, test_loss: 1.0512, test_f1: 0.4457
 epoch: 3, train_loss: 1.0960, test_loss: 1.0579, test_f1: 0.4558
 epoch: 4, train_loss: 1.0654, test_loss: 1.0365, test_f1: 0.4598
 epoch: 5, train_loss: 1.0600, test_loss: 1.0336, test_f1: 0.4484
 epoch: 6, train_loss: 1.0214, test_loss: 1.0224, test_f1: 0.4630
 epoch: 7, train_loss: 1.0171, test_loss: 0.9773, test_f1: 0.4927
 epoch: 8, train_loss: 0.9976, test_loss: 0.9543, test_f1: 0.4763
 epoch: 9, train_loss: 0.9953, test_loss: 0.9436, test_f1: 0.4965
 epoch: 10, train_loss: 0.9778, test_loss: 0.9800, test_f1: 0.4804
 epoch: 11, train_loss: 0.9764, test_loss: 0.9468, test_f1: 0.5029
 epoch: 12, train_loss: 0.9615, test_loss: 0.9355, test_f1: 0.5061
 epoch: 13, train_loss: 0.9741, test_loss: 0.9518, test_f1: 0.5031
 epoch: 14, train_loss: 0.9532, test_loss: 0.9466, test_f1: 0.5019
 epoch: 15, train_loss: 0.9505, test_loss: 0.9327, test_f1: 0.5175
 epoch: 16, train_loss: 0.9267, test_loss: 0.9416, test_f1: 0.4925
 epoch: 17, train_loss: 0.9304, test_loss: 0.9305, test_f1: 0.5063
 epoch: 18, train_loss: 0.9304, test_loss: 0.9241, test_f1: 0.5080
 epoch: 19, train_loss: 0.9203, test_loss: 0.9214, test_f1: 0.5133
 epoch: 20, train_loss: 0.9238, test_loss: 0.9171, test_f1: 0.5307
 epoch: 21, train_loss: 0.9099, test_loss: 0.9115, test_f1: 0.5191
 epoch: 22, train_loss: 0.9072, test_loss: 0.9224, test_f1: 0.5358
 epoch: 23, train_loss: 0.9129, test_loss: 0.9063, test_f1: 0.5176
 epoch: 24, train_loss: 0.8956, test_loss: 0.9055, test_f1: 0.5264
 epoch: 25, train_loss: 0.9040, test_loss: 0.9414, test_f1: 0.5208
 epoch: 26, train_loss: 0.8910, test_loss: 0.9234, test_f1: 0.5256
 epoch: 27, train_loss: 0.8857, test_loss: 0.9191, test_f1: 0.5418
 epoch: 28, train_loss: 0.8847, test_loss: 0.9319, test_f1: 0.5295
 epoch: 29, train_loss: 0.8764, test_loss: 0.9143, test_f1: 0.5296
 epoch: 30, train_loss: 0.8685, test_loss: 0.9257, test_f1: 0.5338
 epoch: 31, train_loss: 0.8696, test_loss: 0.9090, test_f1: 0.5429
 epoch: 32, train_loss: 0.8723, test_loss: 0.9352, test_f1: 0.5335
 epoch: 33, train_loss: 0.8728, test_loss: 0.9432, test_f1: 0.5404
 epoch: 34, train_loss: 0.8610, test_loss: 0.9232, test_f1: 0.5361
 epoch: 35, train_loss: 0.8681, test_loss: 0.9319, test_f1: 0.5449
 epoch: 36, train_loss: 0.8494, test_loss: 0.9059, test_f1: 0.5358
 epoch: 37, train_loss: 0.8381, test_loss: 0.9023, test_f1: 0.5556
 epoch: 38, train_loss: 0.8516, test_loss: 0.9089, test_f1: 0.5578
 epoch: 39, train_loss: 0.8413, test_loss: 0.8956, test_f1: 0.5685
 epoch: 40, train_loss: 0.8517, test_loss: 0.9020, test_f1: 0.5495
 epoch: 41, train_loss: 0.8373, test_loss: 0.8935, test_f1: 0.5425
 epoch: 42, train_loss: 0.8255, test_loss: 0.8982, test_f1: 0.5537
 epoch: 43, train_loss: 0.8392, test_loss: 0.9222, test_f1: 0.5319
 epoch: 44, train_loss: 0.8366, test_loss: 0.9026, test_f1: 0.5561
 epoch: 45, train_loss: 0.8194, test_loss: 0.8862, test_f1: 0.5533
 epoch: 46, train_loss: 0.8422, test_loss: 0.9124, test_f1: 0.5513
 epoch: 47, train_loss: 0.8242, test_loss: 0.9030, test_f1: 0.5490
 epoch: 48, train_loss: 0.8198, test_loss: 0.9231, test_f1: 0.5597
 epoch: 49, train_loss: 0.8253, test_loss: 0.9107, test_f1: 0.5612
 epoch: 50, train_loss: 0.8123, test_loss: 0.8986, test_f1: 0.5870
 epoch: 51, train_loss: 0.7994, test_loss: 0.8683, test_f1: 0.6048
 epoch: 52, train_loss: 0.8093, test_loss: 0.8987, test_f1: 0.5934
 epoch: 53, train_loss: 0.7899, test_loss: 0.8986, test_f1: 0.5726
 epoch: 54, train_loss: 0.7967, test_loss: 0.8912, test_f1: 0.5655
 epoch: 55, train_loss: 0.8005, test_loss: 0.9075, test_f1: 0.5742
 epoch: 56, train_loss: 0.8022, test_loss: 0.9073, test_f1: 0.5680
 epoch: 57, train_loss: 0.7956, test_loss: 0.9142, test_f1: 0.5771
 epoch: 58, train_loss: 0.7952, test_loss: 0.9059, test_f1: 0.5683
 epoch: 59, train_loss: 0.7964, test_loss: 0.9248, test_f1: 0.5853
 epoch: 60, train_loss: 0.7957, test_loss: 0.8965, test_f1: 0.5776
 epoch: 61, train_loss: 0.7893, test_loss: 0.8901, test_f1: 0.5825
 epoch: 62, train_loss: 0.7941, test_loss: 0.9034, test_f1: 0.5599
 epoch: 63, train_loss: 0.7960, test_loss: 0.9052, test_f1: 0.5648
 epoch: 64, train_loss: 0.7840, test_loss: 0.9138, test_f1: 0.5794
 epoch: 65, train_loss: 0.7801, test_loss: 0.8884, test_f1: 0.5887
 epoch: 66, train_loss: 0.7796, test_loss: 0.8986, test_f1: 0.5973
 epoch: 67, train_loss: 0.7805, test_loss: 0.9017, test_f1: 0.5739
 epoch: 68, train_loss: 0.7782, test_loss: 0.8920, test_f1: 0.5830
 epoch: 69, train_loss: 0.7752, test_loss: 0.8954, test_f1: 0.5694
 epoch: 70, train_loss: 0.7792, test_loss: 0.8953, test_f1: 0.5885
 epoch: 71, train_loss: 0.7690, test_loss: 0.8784, test_f1: 0.6049
 epoch: 72, train_loss: 0.7804, test_loss: 0.9030, test_f1: 0.6017
 epoch: 73, train_loss: 0.7754, test_loss: 0.8872, test_f1: 0.5796
 epoch: 74, train_loss: 0.7693, test_loss: 0.8899, test_f1: 0.5829
 epoch: 75, train_loss: 0.7764, test_loss: 0.8894, test_f1: 0.5876
 epoch: 76, train_loss: 0.7748, test_loss: 0.8964, test_f1: 0.5915
 epoch: 77, train_loss: 0.7693, test_loss: 0.9146, test_f1: 0.6033
 epoch: 78, train_loss: 0.7606, test_loss: 0.9041, test_f1: 0.5961
 epoch: 79, train_loss: 0.7582, test_loss: 0.8968, test_f1: 0.6079
 epoch: 80, train_loss: 0.7701, test_loss: 0.8989, test_f1: 0.6100
 epoch: 81, train_loss: 0.7674, test_loss: 0.9369, test_f1: 0.5806
 epoch: 82, train_loss: 0.7724, test_loss: 0.8998, test_f1: 0.6192
 epoch: 83, train_loss: 0.7694, test_loss: 0.9076, test_f1: 0.5956
 epoch: 84, train_loss: 0.7630, test_loss: 0.9018, test_f1: 0.5877
 epoch: 85, train_loss: 0.7523, test_loss: 0.8968, test_f1: 0.6067
 epoch: 86, train_loss: 0.7502, test_loss: 0.8991, test_f1: 0.6144
 epoch: 87, train_loss: 0.7559, test_loss: 0.9102, test_f1: 0.6057
 epoch: 88, train_loss: 0.7595, test_loss: 0.9029, test_f1: 0.5936
 epoch: 89, train_loss: 0.7474, test_loss: 0.8891, test_f1: 0.5955
 epoch: 90, train_loss: 0.7560, test_loss: 0.8924, test_f1: 0.5919
 epoch: 91, train_loss: 0.7435, test_loss: 0.9021, test_f1: 0.6129
 epoch: 92, train_loss: 0.7345, test_loss: 0.8958, test_f1: 0.6153
 epoch: 93, train_loss: 0.7538, test_loss: 0.8845, test_f1: 0.6283
 epoch: 94, train_loss: 0.7510, test_loss: 0.8945, test_f1: 0.6170
 epoch: 95, train_loss: 0.7557, test_loss: 0.8962, test_f1: 0.5968
 epoch: 96, train_loss: 0.7521, test_loss: 0.9081, test_f1: 0.6108
 epoch: 97, train_loss: 0.7481, test_loss: 0.9047, test_f1: 0.6178
 epoch: 98, train_loss: 0.7487, test_loss: 0.8945, test_f1: 0.6034
 epoch: 99, train_loss: 0.7503, test_loss: 0.9065, test_f1: 0.6027
##################ITERATION #9 ****************************************
 epoch: 0, train_loss: 1.2358, test_loss: 1.0805, test_f1: 0.4151
 epoch: 1, train_loss: 1.1289, test_loss: 1.0122, test_f1: 0.4491
 epoch: 2, train_loss: 1.0852, test_loss: 0.9954, test_f1: 0.4602
 epoch: 3, train_loss: 1.0617, test_loss: 0.9572, test_f1: 0.4811
 epoch: 4, train_loss: 1.0401, test_loss: 0.9545, test_f1: 0.4708
 epoch: 5, train_loss: 1.0338, test_loss: 0.9486, test_f1: 0.4849
 epoch: 6, train_loss: 1.0110, test_loss: 0.9609, test_f1: 0.5005
 epoch: 7, train_loss: 0.9963, test_loss: 0.9482, test_f1: 0.4860
 epoch: 8, train_loss: 0.9859, test_loss: 0.9573, test_f1: 0.4805
 epoch: 9, train_loss: 0.9766, test_loss: 0.9348, test_f1: 0.4781
 epoch: 10, train_loss: 0.9737, test_loss: 0.9311, test_f1: 0.5029
 epoch: 11, train_loss: 0.9679, test_loss: 0.9367, test_f1: 0.4925
 epoch: 12, train_loss: 0.9581, test_loss: 0.9347, test_f1: 0.4834
 epoch: 13, train_loss: 0.9518, test_loss: 0.9210, test_f1: 0.5185
 epoch: 14, train_loss: 0.9438, test_loss: 0.9368, test_f1: 0.5181
 epoch: 15, train_loss: 0.9368, test_loss: 0.9378, test_f1: 0.4963
 epoch: 16, train_loss: 0.9332, test_loss: 0.9132, test_f1: 0.5075
 epoch: 17, train_loss: 0.9244, test_loss: 0.9294, test_f1: 0.5055
 epoch: 18, train_loss: 0.9270, test_loss: 0.9125, test_f1: 0.5184
 epoch: 19, train_loss: 0.9114, test_loss: 0.9406, test_f1: 0.5122
 epoch: 20, train_loss: 0.8995, test_loss: 0.9191, test_f1: 0.5145
 epoch: 21, train_loss: 0.8949, test_loss: 0.9136, test_f1: 0.5477
 epoch: 22, train_loss: 0.8941, test_loss: 0.9074, test_f1: 0.5169
 epoch: 23, train_loss: 0.8891, test_loss: 0.9301, test_f1: 0.5159
 epoch: 24, train_loss: 0.8821, test_loss: 0.9248, test_f1: 0.5284
 epoch: 25, train_loss: 0.8805, test_loss: 0.9199, test_f1: 0.5354
 epoch: 26, train_loss: 0.8693, test_loss: 0.9116, test_f1: 0.5409
 epoch: 27, train_loss: 0.8629, test_loss: 0.9180, test_f1: 0.5464
 epoch: 28, train_loss: 0.8746, test_loss: 0.9116, test_f1: 0.5592
 epoch: 29, train_loss: 0.8674, test_loss: 0.9209, test_f1: 0.5297
 epoch: 30, train_loss: 0.8606, test_loss: 0.9351, test_f1: 0.5436
 epoch: 31, train_loss: 0.8459, test_loss: 0.9244, test_f1: 0.5335
 epoch: 32, train_loss: 0.8482, test_loss: 0.9131, test_f1: 0.5695
 epoch: 33, train_loss: 0.8409, test_loss: 0.9228, test_f1: 0.5431
 epoch: 34, train_loss: 0.8411, test_loss: 0.9219, test_f1: 0.5410
 epoch: 35, train_loss: 0.8366, test_loss: 0.9414, test_f1: 0.5297
 epoch: 36, train_loss: 0.8368, test_loss: 0.9367, test_f1: 0.5380
 epoch: 37, train_loss: 0.8277, test_loss: 0.9282, test_f1: 0.5493
 epoch: 38, train_loss: 0.8335, test_loss: 0.9059, test_f1: 0.5603
 epoch: 39, train_loss: 0.8206, test_loss: 0.9400, test_f1: 0.5561
 epoch: 40, train_loss: 0.8128, test_loss: 0.9334, test_f1: 0.5814
 epoch: 41, train_loss: 0.8075, test_loss: 0.9292, test_f1: 0.5570
 epoch: 42, train_loss: 0.8033, test_loss: 0.9139, test_f1: 0.5664
 epoch: 43, train_loss: 0.8059, test_loss: 0.9263, test_f1: 0.5679
 epoch: 44, train_loss: 0.7999, test_loss: 0.9327, test_f1: 0.5902
 epoch: 45, train_loss: 0.7963, test_loss: 0.9301, test_f1: 0.5712
 epoch: 46, train_loss: 0.7990, test_loss: 0.9061, test_f1: 0.5703
 epoch: 47, train_loss: 0.7883, test_loss: 0.9318, test_f1: 0.5725
 epoch: 48, train_loss: 0.7800, test_loss: 0.9106, test_f1: 0.5773
 epoch: 49, train_loss: 0.7852, test_loss: 0.9087, test_f1: 0.6044
 epoch: 50, train_loss: 0.7729, test_loss: 0.9059, test_f1: 0.5941
 epoch: 51, train_loss: 0.7730, test_loss: 0.8973, test_f1: 0.6022
 epoch: 52, train_loss: 0.7734, test_loss: 0.9084, test_f1: 0.6231
 epoch: 53, train_loss: 0.7700, test_loss: 0.8957, test_f1: 0.5964
 epoch: 54, train_loss: 0.7569, test_loss: 0.8895, test_f1: 0.6217
 epoch: 55, train_loss: 0.7680, test_loss: 0.9104, test_f1: 0.5896
 epoch: 56, train_loss: 0.7582, test_loss: 0.8929, test_f1: 0.6084
 epoch: 57, train_loss: 0.7631, test_loss: 0.9280, test_f1: 0.6033
 epoch: 58, train_loss: 0.7647, test_loss: 0.9042, test_f1: 0.6015
 epoch: 59, train_loss: 0.7461, test_loss: 0.9142, test_f1: 0.5856
 epoch: 60, train_loss: 0.7466, test_loss: 0.8960, test_f1: 0.5978
 epoch: 61, train_loss: 0.7484, test_loss: 0.9177, test_f1: 0.5995
 epoch: 62, train_loss: 0.7524, test_loss: 0.8990, test_f1: 0.6196
 epoch: 63, train_loss: 0.7608, test_loss: 0.9067, test_f1: 0.5834
 epoch: 64, train_loss: 0.7438, test_loss: 0.9225, test_f1: 0.5898
 epoch: 65, train_loss: 0.7520, test_loss: 0.9087, test_f1: 0.6018
 epoch: 66, train_loss: 0.7546, test_loss: 0.9170, test_f1: 0.5988
 epoch: 67, train_loss: 0.7483, test_loss: 0.9171, test_f1: 0.6206
 epoch: 68, train_loss: 0.7450, test_loss: 0.8980, test_f1: 0.5921
 epoch: 69, train_loss: 0.7534, test_loss: 0.9211, test_f1: 0.5957
 epoch: 70, train_loss: 0.7290, test_loss: 0.9143, test_f1: 0.6090
 epoch: 71, train_loss: 0.7465, test_loss: 0.9090, test_f1: 0.5767
 epoch: 72, train_loss: 0.7320, test_loss: 0.9158, test_f1: 0.5909
 epoch: 73, train_loss: 0.7319, test_loss: 0.9081, test_f1: 0.6108
 epoch: 74, train_loss: 0.7323, test_loss: 0.9055, test_f1: 0.6144
 epoch: 75, train_loss: 0.7282, test_loss: 0.9060, test_f1: 0.6124
 epoch: 76, train_loss: 0.7340, test_loss: 0.9094, test_f1: 0.6060
 epoch: 77, train_loss: 0.7304, test_loss: 0.9175, test_f1: 0.6034
 epoch: 78, train_loss: 0.7240, test_loss: 0.9019, test_f1: 0.6180
 epoch: 79, train_loss: 0.7392, test_loss: 0.9054, test_f1: 0.6274
 epoch: 80, train_loss: 0.7327, test_loss: 0.8990, test_f1: 0.6068
 epoch: 81, train_loss: 0.7222, test_loss: 0.9091, test_f1: 0.6179
 epoch: 82, train_loss: 0.7268, test_loss: 0.9044, test_f1: 0.6319
 epoch: 83, train_loss: 0.7173, test_loss: 0.9023, test_f1: 0.6077
 epoch: 84, train_loss: 0.7223, test_loss: 0.9081, test_f1: 0.6242
 epoch: 85, train_loss: 0.7214, test_loss: 0.9280, test_f1: 0.6136
 epoch: 86, train_loss: 0.7202, test_loss: 0.9035, test_f1: 0.6177
 epoch: 87, train_loss: 0.7186, test_loss: 0.8997, test_f1: 0.6414
 epoch: 88, train_loss: 0.7106, test_loss: 0.9092, test_f1: 0.6166
 epoch: 89, train_loss: 0.7014, test_loss: 0.9129, test_f1: 0.6105
 epoch: 90, train_loss: 0.7073, test_loss: 0.9230, test_f1: 0.6092
 epoch: 91, train_loss: 0.7008, test_loss: 0.9160, test_f1: 0.6143
 epoch: 92, train_loss: 0.7069, test_loss: 0.9230, test_f1: 0.6319
 epoch: 93, train_loss: 0.7003, test_loss: 0.9100, test_f1: 0.6497
 epoch: 94, train_loss: 0.7013, test_loss: 0.9115, test_f1: 0.6294
 epoch: 95, train_loss: 0.7096, test_loss: 0.9102, test_f1: 0.6188
 epoch: 96, train_loss: 0.6959, test_loss: 0.9268, test_f1: 0.6232
 epoch: 97, train_loss: 0.7052, test_loss: 0.9233, test_f1: 0.6092
 epoch: 98, train_loss: 0.7014, test_loss: 0.9206, test_f1: 0.6307
 epoch: 99, train_loss: 0.6974, test_loss: 0.9202, test_f1: 0.6344

Training completed in 1451.29 seconds
Best F1: 0.6497 at epoch 93
Mean F1 across iterations: 0.6190  0.0175
========================FINAL RESULTS================================
FEGIN weighted F1: 0.6497  0.0175
python main.py --data ltspice_examples --representation component_net --model FEGIN --layers 5 --hiddens 64 --batch_size 32 --lr 0.0001 --emb_size 250 --epochs 100 --save_appendix component_net_L5_H64_BS32_LR0.0001_E250 --no_val
-----



STDERR:
  File "main.py", line 370, in <module>
    main()
  File "main.py", line 254, in main
    dataset = dataset_class(
  File "/home/philip/projects/llm_inference_code_repo/Circuit-Completion-Using-GNNs/component_classification_with_link_prediction_head/evaluation/FEGIN/kernel/circuit_datasets.py", line 15, in __init__
    self.data, self.slices = torch.load(self.processed_paths[0])
  File "/home/philip/.local/lib/python3.8/site-packages/torch/serialization.py", line 1040, in load
    warnings.warn(
  File "/usr/lib/python3.8/warnings.py", line 109, in _showwarnmsg
    sw(msg.message, msg.category, msg.filename, msg.lineno,
  File "main.py", line 47, in warn_with_traceback
    traceback.print_stack(file=log)
/home/philip/projects/llm_inference_code_repo/Circuit-Completion-Using-GNNs/component_classification_with_link_prediction_head/evaluation/FEGIN/kernel/circuit_datasets.py:15: FutureWarning: You are using `torch.load` with `weights_only=False` (the current default value), which uses the default pickle module implicitly. It is possible to construct malicious pickle data which will execute arbitrary code during unpickling (See https://github.com/pytorch/pytorch/blob/main/SECURITY.md#untrusted-models for more details). In a future release, the default value for `weights_only` will be flipped to `True`. This limits the functions that could be executed during unpickling. Arbitrary objects will no longer be allowed to be loaded via this mode unless they are explicitly allowlisted by the user via `torch.serialization.add_safe_globals`. We recommend you start setting `weights_only=True` for any use case where you don't have full control of the loaded file. Please open an issue on GitHub for any issues related to this experimental feature.
  self.data, self.slices = torch.load(self.processed_paths[0])
