STDOUT:
Results will be saved in /home/philip/projects/ltspice_examples_code_repo/Circuit-Completion-Using-GNNs/component_classification_with_link_prediction_head/evaluation/FEGIN/results/model_FEGIN_dataset_ltspice_demos
Command line input: python main.py --data ltspice_demos --representation component_pin_net --model FEGIN --layers 6 --hiddens 128 --batch_size 128 --lr 0.01 --emb_size 250 --epochs 100 --save_appendix component_pin_net_L6_H128_BS128_LR0.01_E250 --no_val
 is saved.
-----
ltspice_demos - FEGIN
Using 6 layers, 128 hidden units, h = 2
Loading component_pin_net representation dataset
ENTERED
Training FEGIN on component_pin_net representation
Train: 1565, Test: 383
##################ITERATION #0 ****************************************
 epoch: 0, train_loss: 1.3670, test_loss: 1.2826, test_f1: 0.3573
 epoch: 1, train_loss: 1.0823, test_loss: 1.5007, test_f1: 0.3322
 epoch: 2, train_loss: 1.0452, test_loss: 1.1825, test_f1: 0.4143
 epoch: 3, train_loss: 1.0111, test_loss: 1.0662, test_f1: 0.4276
 epoch: 4, train_loss: 0.9800, test_loss: 1.2298, test_f1: 0.3623
 epoch: 5, train_loss: 0.9729, test_loss: 1.0744, test_f1: 0.4601
 epoch: 6, train_loss: 0.9588, test_loss: 1.2197, test_f1: 0.4362
 epoch: 7, train_loss: 0.9306, test_loss: 1.6204, test_f1: 0.4594
 epoch: 8, train_loss: 0.9138, test_loss: 1.1492, test_f1: 0.5185
 epoch: 9, train_loss: 0.9104, test_loss: 1.0534, test_f1: 0.4802
 epoch: 10, train_loss: 0.9038, test_loss: 1.0722, test_f1: 0.5140
 epoch: 11, train_loss: 0.9281, test_loss: 1.0681, test_f1: 0.4488
 epoch: 12, train_loss: 0.9077, test_loss: 1.0099, test_f1: 0.5188
 epoch: 13, train_loss: 0.8871, test_loss: 1.0969, test_f1: 0.4466
 epoch: 14, train_loss: 0.9048, test_loss: 1.1949, test_f1: 0.5106
 epoch: 15, train_loss: 0.8678, test_loss: 1.5158, test_f1: 0.4205
 epoch: 16, train_loss: 0.8539, test_loss: 1.0212, test_f1: 0.5107
 epoch: 17, train_loss: 0.8475, test_loss: 1.0959, test_f1: 0.5246
 epoch: 18, train_loss: 0.8309, test_loss: 1.0601, test_f1: 0.4731
 epoch: 19, train_loss: 0.8310, test_loss: 2.8716, test_f1: 0.2740
 epoch: 20, train_loss: 0.8220, test_loss: 0.9682, test_f1: 0.5581
 epoch: 21, train_loss: 0.7743, test_loss: 1.2394, test_f1: 0.4525
 epoch: 22, train_loss: 0.7797, test_loss: 0.9612, test_f1: 0.5810
 epoch: 23, train_loss: 0.7364, test_loss: 1.1658, test_f1: 0.5475
 epoch: 24, train_loss: 0.7726, test_loss: 1.1463, test_f1: 0.5245
 epoch: 25, train_loss: 0.7636, test_loss: 1.0190, test_f1: 0.5676
 epoch: 26, train_loss: 0.7133, test_loss: 1.7808, test_f1: 0.5498
 epoch: 27, train_loss: 0.7193, test_loss: 1.0627, test_f1: 0.6135
 epoch: 28, train_loss: 0.6959, test_loss: 0.9573, test_f1: 0.6057
 epoch: 29, train_loss: 0.7715, test_loss: 1.2995, test_f1: 0.4873
 epoch: 30, train_loss: 0.7025, test_loss: 1.0775, test_f1: 0.5817
 epoch: 31, train_loss: 0.6689, test_loss: 1.0611, test_f1: 0.5681
 epoch: 32, train_loss: 0.6845, test_loss: 1.0753, test_f1: 0.5494
 epoch: 33, train_loss: 0.6625, test_loss: 1.2182, test_f1: 0.5494
 epoch: 34, train_loss: 0.6666, test_loss: 0.9932, test_f1: 0.5283
 epoch: 35, train_loss: 0.6599, test_loss: 1.2704, test_f1: 0.5263
 epoch: 36, train_loss: 0.6255, test_loss: 1.1581, test_f1: 0.5936
 epoch: 37, train_loss: 0.6395, test_loss: 1.2287, test_f1: 0.4511
 epoch: 38, train_loss: 0.6056, test_loss: 1.1941, test_f1: 0.5240
 epoch: 39, train_loss: 0.6511, test_loss: 1.0002, test_f1: 0.6182
 epoch: 40, train_loss: 0.5957, test_loss: 0.9770, test_f1: 0.6092
 epoch: 41, train_loss: 0.5658, test_loss: 1.4428, test_f1: 0.5848
 epoch: 42, train_loss: 0.6020, test_loss: 1.3133, test_f1: 0.5193
 epoch: 43, train_loss: 0.5870, test_loss: 1.2026, test_f1: 0.6337
 epoch: 44, train_loss: 0.5776, test_loss: 1.3742, test_f1: 0.5934
 epoch: 45, train_loss: 0.5591, test_loss: 1.5469, test_f1: 0.5569
 epoch: 46, train_loss: 0.6156, test_loss: 1.3242, test_f1: 0.5445
 epoch: 47, train_loss: 0.5753, test_loss: 1.6306, test_f1: 0.5177
 epoch: 48, train_loss: 0.5470, test_loss: 1.4752, test_f1: 0.5592
 epoch: 49, train_loss: 0.5684, test_loss: 1.2213, test_f1: 0.5937
 epoch: 50, train_loss: 0.5966, test_loss: 1.2575, test_f1: 0.6485
 epoch: 51, train_loss: 0.5276, test_loss: 1.3223, test_f1: 0.5915
 epoch: 52, train_loss: 0.4831, test_loss: 1.5156, test_f1: 0.6067
 epoch: 53, train_loss: 0.4698, test_loss: 1.5613, test_f1: 0.5831
 epoch: 54, train_loss: 0.4889, test_loss: 1.3552, test_f1: 0.6660
 epoch: 55, train_loss: 0.4889, test_loss: 1.4742, test_f1: 0.6098
 epoch: 56, train_loss: 0.4429, test_loss: 1.5649, test_f1: 0.6165
 epoch: 57, train_loss: 0.4165, test_loss: 1.5680, test_f1: 0.6485
 epoch: 58, train_loss: 0.4177, test_loss: 1.7861, test_f1: 0.6194
 epoch: 59, train_loss: 0.4037, test_loss: 1.8328, test_f1: 0.6172
 epoch: 60, train_loss: 0.4033, test_loss: 1.7666, test_f1: 0.6157
 epoch: 61, train_loss: 0.3819, test_loss: 1.6620, test_f1: 0.6071
 epoch: 62, train_loss: 0.4037, test_loss: 1.7778, test_f1: 0.6085
 epoch: 63, train_loss: 0.4139, test_loss: 1.7124, test_f1: 0.6306
 epoch: 64, train_loss: 0.4334, test_loss: 1.8855, test_f1: 0.6006
 epoch: 65, train_loss: 0.4283, test_loss: 1.7093, test_f1: 0.5499
 epoch: 66, train_loss: 0.3908, test_loss: 1.8837, test_f1: 0.5886
 epoch: 67, train_loss: 0.3767, test_loss: 1.6976, test_f1: 0.6168
 epoch: 68, train_loss: 0.3737, test_loss: 1.7168, test_f1: 0.5958
 epoch: 69, train_loss: 0.3440, test_loss: 1.9737, test_f1: 0.6276
 epoch: 70, train_loss: 0.4368, test_loss: 1.8543, test_f1: 0.5686
 epoch: 71, train_loss: 0.4046, test_loss: 1.8308, test_f1: 0.6351
 epoch: 72, train_loss: 0.3854, test_loss: 2.1713, test_f1: 0.5604
 epoch: 73, train_loss: 0.3644, test_loss: 1.7302, test_f1: 0.6148
 epoch: 74, train_loss: 0.3416, test_loss: 2.1455, test_f1: 0.5685
 epoch: 75, train_loss: 0.3736, test_loss: 2.1469, test_f1: 0.6203
 epoch: 76, train_loss: 0.3557, test_loss: 2.0396, test_f1: 0.6290
 epoch: 77, train_loss: 0.3593, test_loss: 1.8830, test_f1: 0.6371
 epoch: 78, train_loss: 0.3172, test_loss: 1.9125, test_f1: 0.6131
 epoch: 79, train_loss: 0.3248, test_loss: 2.0517, test_f1: 0.6135
 epoch: 80, train_loss: 0.3147, test_loss: 1.9109, test_f1: 0.6180
 epoch: 81, train_loss: 0.3227, test_loss: 2.1634, test_f1: 0.6054
 epoch: 82, train_loss: 0.3345, test_loss: 1.8300, test_f1: 0.6081
 epoch: 83, train_loss: 0.3248, test_loss: 2.2071, test_f1: 0.5660
 epoch: 84, train_loss: 0.3135, test_loss: 2.0537, test_f1: 0.6059
 epoch: 85, train_loss: 0.3459, test_loss: 2.4345, test_f1: 0.5602
 epoch: 86, train_loss: 0.3127, test_loss: 2.0406, test_f1: 0.6010
 epoch: 87, train_loss: 0.3068, test_loss: 1.9308, test_f1: 0.6303
 epoch: 88, train_loss: 0.2480, test_loss: 2.1011, test_f1: 0.6143
 epoch: 89, train_loss: 0.2813, test_loss: 2.4484, test_f1: 0.6043
 epoch: 90, train_loss: 0.3258, test_loss: 2.3331, test_f1: 0.6170
 epoch: 91, train_loss: 0.3204, test_loss: 2.2081, test_f1: 0.5851
 epoch: 92, train_loss: 0.3356, test_loss: 2.1070, test_f1: 0.5723
 epoch: 93, train_loss: 0.3021, test_loss: 2.2707, test_f1: 0.6207
 epoch: 94, train_loss: 0.3007, test_loss: 2.0290, test_f1: 0.6220
 epoch: 95, train_loss: 0.3086, test_loss: 2.2708, test_f1: 0.5777
 epoch: 96, train_loss: 0.3142, test_loss: 2.5399, test_f1: 0.5483
 epoch: 97, train_loss: 0.2607, test_loss: 2.5567, test_f1: 0.5980
 epoch: 98, train_loss: 0.2415, test_loss: 2.3976, test_f1: 0.6282
 epoch: 99, train_loss: 0.2116, test_loss: 2.4028, test_f1: 0.6080
##################ITERATION #1 ****************************************
 epoch: 0, train_loss: 1.2431, test_loss: 2.2857, test_f1: 0.2281
 epoch: 1, train_loss: 1.0169, test_loss: 1.4727, test_f1: 0.2488
 epoch: 2, train_loss: 0.9769, test_loss: 1.1847, test_f1: 0.4090
 epoch: 3, train_loss: 0.9539, test_loss: 1.1500, test_f1: 0.3680
 epoch: 4, train_loss: 0.9475, test_loss: 1.2888, test_f1: 0.4376
 epoch: 5, train_loss: 0.9045, test_loss: 1.3364, test_f1: 0.3965
 epoch: 6, train_loss: 0.9008, test_loss: 1.0450, test_f1: 0.4278
 epoch: 7, train_loss: 0.8547, test_loss: 1.0153, test_f1: 0.5431
 epoch: 8, train_loss: 0.8560, test_loss: 1.2218, test_f1: 0.5105
 epoch: 9, train_loss: 0.8344, test_loss: 1.0640, test_f1: 0.5109
 epoch: 10, train_loss: 0.8008, test_loss: 1.0913, test_f1: 0.4967
 epoch: 11, train_loss: 0.8102, test_loss: 1.2039, test_f1: 0.4311
 epoch: 12, train_loss: 0.7988, test_loss: 1.1261, test_f1: 0.5434
 epoch: 13, train_loss: 0.7709, test_loss: 1.0861, test_f1: 0.5080
 epoch: 14, train_loss: 0.7704, test_loss: 1.2216, test_f1: 0.5204
 epoch: 15, train_loss: 0.7602, test_loss: 1.0111, test_f1: 0.5564
 epoch: 16, train_loss: 0.7605, test_loss: 1.0865, test_f1: 0.5069
 epoch: 17, train_loss: 0.7484, test_loss: 1.1223, test_f1: 0.4648
 epoch: 18, train_loss: 0.7300, test_loss: 1.2095, test_f1: 0.4660
 epoch: 19, train_loss: 0.7156, test_loss: 1.1932, test_f1: 0.5137
 epoch: 20, train_loss: 0.7376, test_loss: 1.1715, test_f1: 0.5612
 epoch: 21, train_loss: 0.7362, test_loss: 1.0589, test_f1: 0.5118
 epoch: 22, train_loss: 0.6997, test_loss: 1.1763, test_f1: 0.5058
 epoch: 23, train_loss: 0.6799, test_loss: 1.2257, test_f1: 0.5232
 epoch: 24, train_loss: 0.7033, test_loss: 1.6403, test_f1: 0.4764
 epoch: 25, train_loss: 0.6833, test_loss: 1.4540, test_f1: 0.4320
 epoch: 26, train_loss: 0.6657, test_loss: 1.5707, test_f1: 0.5417
 epoch: 27, train_loss: 0.6662, test_loss: 1.3111, test_f1: 0.5280
 epoch: 28, train_loss: 0.6550, test_loss: 1.5501, test_f1: 0.5372
 epoch: 29, train_loss: 0.6544, test_loss: 1.4580, test_f1: 0.5108
 epoch: 30, train_loss: 0.6522, test_loss: 1.3305, test_f1: 0.5365
 epoch: 31, train_loss: 0.6251, test_loss: 1.3786, test_f1: 0.5997
 epoch: 32, train_loss: 0.6027, test_loss: 1.5909, test_f1: 0.5238
 epoch: 33, train_loss: 0.6276, test_loss: 1.4261, test_f1: 0.5025
 epoch: 34, train_loss: 0.6462, test_loss: 1.2493, test_f1: 0.5382
 epoch: 35, train_loss: 0.6357, test_loss: 1.7933, test_f1: 0.5227
 epoch: 36, train_loss: 0.6527, test_loss: 1.7349, test_f1: 0.5052
 epoch: 37, train_loss: 0.5966, test_loss: 1.4633, test_f1: 0.5830
 epoch: 38, train_loss: 0.6075, test_loss: 1.3200, test_f1: 0.5455
 epoch: 39, train_loss: 0.6057, test_loss: 1.5691, test_f1: 0.5644
 epoch: 40, train_loss: 0.5873, test_loss: 2.2374, test_f1: 0.4508
 epoch: 41, train_loss: 0.5721, test_loss: 1.2843, test_f1: 0.5435
 epoch: 42, train_loss: 0.5490, test_loss: 1.3433, test_f1: 0.5424
 epoch: 43, train_loss: 0.5923, test_loss: 1.4626, test_f1: 0.5720
 epoch: 44, train_loss: 0.5604, test_loss: 1.5736, test_f1: 0.5258
 epoch: 45, train_loss: 0.5538, test_loss: 1.4721, test_f1: 0.5025
 epoch: 46, train_loss: 0.5290, test_loss: 1.4617, test_f1: 0.5713
 epoch: 47, train_loss: 0.5576, test_loss: 1.6373, test_f1: 0.5462
 epoch: 48, train_loss: 0.6715, test_loss: 1.3840, test_f1: 0.5387
 epoch: 49, train_loss: 0.6312, test_loss: 1.2487, test_f1: 0.5928
 epoch: 50, train_loss: 0.5868, test_loss: 1.1780, test_f1: 0.6057
 epoch: 51, train_loss: 0.5180, test_loss: 1.2889, test_f1: 0.6088
 epoch: 52, train_loss: 0.4741, test_loss: 1.3693, test_f1: 0.6130
 epoch: 53, train_loss: 0.4539, test_loss: 1.4519, test_f1: 0.6254
 epoch: 54, train_loss: 0.4596, test_loss: 1.6848, test_f1: 0.6088
 epoch: 55, train_loss: 0.4649, test_loss: 1.5487, test_f1: 0.6349
 epoch: 56, train_loss: 0.4143, test_loss: 1.5422, test_f1: 0.6179
 epoch: 57, train_loss: 0.4259, test_loss: 1.7386, test_f1: 0.5890
 epoch: 58, train_loss: 0.4250, test_loss: 1.6816, test_f1: 0.5962
 epoch: 59, train_loss: 0.4523, test_loss: 1.4951, test_f1: 0.5697
 epoch: 60, train_loss: 0.3911, test_loss: 1.7284, test_f1: 0.6177
 epoch: 61, train_loss: 0.3697, test_loss: 1.8945, test_f1: 0.6046
 epoch: 62, train_loss: 0.3644, test_loss: 1.7575, test_f1: 0.6366
 epoch: 63, train_loss: 0.3704, test_loss: 1.5394, test_f1: 0.6256
 epoch: 64, train_loss: 0.3757, test_loss: 2.0903, test_f1: 0.6114
 epoch: 65, train_loss: 0.3390, test_loss: 1.7980, test_f1: 0.6340
 epoch: 66, train_loss: 0.3791, test_loss: 1.8388, test_f1: 0.6344
 epoch: 67, train_loss: 0.3758, test_loss: 1.8320, test_f1: 0.5971
 epoch: 68, train_loss: 0.3519, test_loss: 1.7954, test_f1: 0.5907
 epoch: 69, train_loss: 0.3425, test_loss: 2.0281, test_f1: 0.6354
 epoch: 70, train_loss: 0.3762, test_loss: 2.1184, test_f1: 0.6318
 epoch: 71, train_loss: 0.3601, test_loss: 2.1613, test_f1: 0.6234
 epoch: 72, train_loss: 0.3813, test_loss: 1.9075, test_f1: 0.6430
 epoch: 73, train_loss: 0.4113, test_loss: 1.8810, test_f1: 0.5932
 epoch: 74, train_loss: 0.3799, test_loss: 1.6667, test_f1: 0.5980
 epoch: 75, train_loss: 0.3687, test_loss: 1.8284, test_f1: 0.5750
 epoch: 76, train_loss: 0.3337, test_loss: 1.9410, test_f1: 0.6025
 epoch: 77, train_loss: 0.2962, test_loss: 1.6725, test_f1: 0.6244
 epoch: 78, train_loss: 0.3194, test_loss: 1.7571, test_f1: 0.6555
 epoch: 79, train_loss: 0.3147, test_loss: 1.7721, test_f1: 0.6140
 epoch: 80, train_loss: 0.3266, test_loss: 1.7490, test_f1: 0.6411
 epoch: 81, train_loss: 0.3398, test_loss: 2.2347, test_f1: 0.6336
 epoch: 82, train_loss: 0.3069, test_loss: 1.8851, test_f1: 0.6171
 epoch: 83, train_loss: 0.3170, test_loss: 1.6568, test_f1: 0.6395
 epoch: 84, train_loss: 0.2771, test_loss: 1.8276, test_f1: 0.5686
 epoch: 85, train_loss: 0.2931, test_loss: 1.9144, test_f1: 0.6152
 epoch: 86, train_loss: 0.2724, test_loss: 1.6077, test_f1: 0.6196
 epoch: 87, train_loss: 0.2574, test_loss: 2.3960, test_f1: 0.5665
 epoch: 88, train_loss: 0.2932, test_loss: 2.1048, test_f1: 0.6171
 epoch: 89, train_loss: 0.3092, test_loss: 1.8921, test_f1: 0.6499
 epoch: 90, train_loss: 0.2599, test_loss: 1.9932, test_f1: 0.6294
 epoch: 91, train_loss: 0.2507, test_loss: 2.2661, test_f1: 0.6383
 epoch: 92, train_loss: 0.2548, test_loss: 1.9973, test_f1: 0.6350
 epoch: 93, train_loss: 0.2538, test_loss: 2.1381, test_f1: 0.6360
 epoch: 94, train_loss: 0.2490, test_loss: 2.1722, test_f1: 0.6277
 epoch: 95, train_loss: 0.2750, test_loss: 2.2090, test_f1: 0.5972
 epoch: 96, train_loss: 0.2683, test_loss: 1.8643, test_f1: 0.6558
 epoch: 97, train_loss: 0.2329, test_loss: 2.2137, test_f1: 0.6271
 epoch: 98, train_loss: 0.2276, test_loss: 2.0481, test_f1: 0.6227
 epoch: 99, train_loss: 0.2236, test_loss: 1.8521, test_f1: 0.6112
##################ITERATION #2 ****************************************
 epoch: 0, train_loss: 1.2263, test_loss: 1.4463, test_f1: 0.2485
 epoch: 1, train_loss: 1.0082, test_loss: 1.1129, test_f1: 0.4281
 epoch: 2, train_loss: 0.9780, test_loss: 1.1751, test_f1: 0.4275
 epoch: 3, train_loss: 0.9807, test_loss: 1.1442, test_f1: 0.4794
 epoch: 4, train_loss: 0.9384, test_loss: 1.0918, test_f1: 0.4767
 epoch: 5, train_loss: 0.9130, test_loss: 1.1168, test_f1: 0.5270
 epoch: 6, train_loss: 0.9115, test_loss: 1.2338, test_f1: 0.4819
 epoch: 7, train_loss: 0.8828, test_loss: 1.3416, test_f1: 0.4651
 epoch: 8, train_loss: 0.8687, test_loss: 1.0843, test_f1: 0.5717
 epoch: 9, train_loss: 0.8428, test_loss: 1.1411, test_f1: 0.5033
 epoch: 10, train_loss: 0.8194, test_loss: 1.0968, test_f1: 0.5042
 epoch: 11, train_loss: 0.7981, test_loss: 1.3733, test_f1: 0.4880
 epoch: 12, train_loss: 0.7971, test_loss: 1.2696, test_f1: 0.5114
 epoch: 13, train_loss: 0.8077, test_loss: 1.4845, test_f1: 0.4835
 epoch: 14, train_loss: 0.7961, test_loss: 2.2923, test_f1: 0.3677
 epoch: 15, train_loss: 0.7677, test_loss: 1.2948, test_f1: 0.4209
 epoch: 16, train_loss: 0.7405, test_loss: 1.3153, test_f1: 0.4984
 epoch: 17, train_loss: 0.7661, test_loss: 1.3624, test_f1: 0.5239
 epoch: 18, train_loss: 0.7454, test_loss: 1.2102, test_f1: 0.6019
 epoch: 19, train_loss: 0.6818, test_loss: 1.3449, test_f1: 0.5229
 epoch: 20, train_loss: 0.6890, test_loss: 1.1731, test_f1: 0.5740
 epoch: 21, train_loss: 0.7031, test_loss: 1.2818, test_f1: 0.5541
 epoch: 22, train_loss: 0.6463, test_loss: 1.3828, test_f1: 0.5248
 epoch: 23, train_loss: 0.6864, test_loss: 1.3237, test_f1: 0.4587
 epoch: 24, train_loss: 0.6516, test_loss: 1.3034, test_f1: 0.5400
 epoch: 25, train_loss: 0.6380, test_loss: 1.3853, test_f1: 0.5407
 epoch: 26, train_loss: 0.6425, test_loss: 2.2025, test_f1: 0.4508
 epoch: 27, train_loss: 0.6587, test_loss: 1.4258, test_f1: 0.5245
 epoch: 28, train_loss: 0.6333, test_loss: 1.4636, test_f1: 0.5854
 epoch: 29, train_loss: 0.6153, test_loss: 2.3900, test_f1: 0.4131
 epoch: 30, train_loss: 0.6083, test_loss: 1.4713, test_f1: 0.4502
 epoch: 31, train_loss: 0.6099, test_loss: 1.4514, test_f1: 0.5317
 epoch: 32, train_loss: 0.6177, test_loss: 1.4700, test_f1: 0.4673
 epoch: 33, train_loss: 0.5951, test_loss: 1.2864, test_f1: 0.5427
 epoch: 34, train_loss: 0.6199, test_loss: 1.3768, test_f1: 0.5693
 epoch: 35, train_loss: 0.6167, test_loss: 1.2429, test_f1: 0.6086
 epoch: 36, train_loss: 0.6324, test_loss: 1.2819, test_f1: 0.5782
 epoch: 37, train_loss: 0.6209, test_loss: 1.1871, test_f1: 0.5505
 epoch: 38, train_loss: 0.5508, test_loss: 1.2609, test_f1: 0.6163
 epoch: 39, train_loss: 0.5790, test_loss: 1.2325, test_f1: 0.6259
 epoch: 40, train_loss: 0.6018, test_loss: 1.5144, test_f1: 0.5976
 epoch: 41, train_loss: 0.5709, test_loss: 1.4096, test_f1: 0.5099
 epoch: 42, train_loss: 0.5728, test_loss: 1.5157, test_f1: 0.6113
 epoch: 43, train_loss: 0.5384, test_loss: 1.8699, test_f1: 0.5323
 epoch: 44, train_loss: 0.5169, test_loss: 1.3279, test_f1: 0.5742
 epoch: 45, train_loss: 0.5134, test_loss: 1.5819, test_f1: 0.5328
 epoch: 46, train_loss: 0.5392, test_loss: 1.2826, test_f1: 0.6230
 epoch: 47, train_loss: 0.5177, test_loss: 1.8252, test_f1: 0.5424
 epoch: 48, train_loss: 0.5041, test_loss: 1.5131, test_f1: 0.6060
 epoch: 49, train_loss: 0.4738, test_loss: 1.3282, test_f1: 0.5980
 epoch: 50, train_loss: 0.4904, test_loss: 1.6292, test_f1: 0.5476
 epoch: 51, train_loss: 0.5090, test_loss: 1.5584, test_f1: 0.5425
 epoch: 52, train_loss: 0.4342, test_loss: 1.6596, test_f1: 0.5723
 epoch: 53, train_loss: 0.4036, test_loss: 1.5843, test_f1: 0.5667
 epoch: 54, train_loss: 0.3993, test_loss: 1.7916, test_f1: 0.5914
 epoch: 55, train_loss: 0.4062, test_loss: 1.5915, test_f1: 0.5739
 epoch: 56, train_loss: 0.3759, test_loss: 1.6748, test_f1: 0.5778
 epoch: 57, train_loss: 0.3781, test_loss: 1.8181, test_f1: 0.6042
 epoch: 58, train_loss: 0.3370, test_loss: 1.8456, test_f1: 0.5689
 epoch: 59, train_loss: 0.3490, test_loss: 2.1594, test_f1: 0.6002
 epoch: 60, train_loss: 0.3437, test_loss: 2.1390, test_f1: 0.5777
 epoch: 61, train_loss: 0.3334, test_loss: 2.1141, test_f1: 0.5674
 epoch: 62, train_loss: 0.3523, test_loss: 1.9052, test_f1: 0.5757
 epoch: 63, train_loss: 0.3368, test_loss: 2.1212, test_f1: 0.6256
 epoch: 64, train_loss: 0.3138, test_loss: 2.1399, test_f1: 0.5811
 epoch: 65, train_loss: 0.3017, test_loss: 2.0777, test_f1: 0.5974
 epoch: 66, train_loss: 0.3329, test_loss: 2.1505, test_f1: 0.5837
 epoch: 67, train_loss: 0.3500, test_loss: 3.2778, test_f1: 0.4901
 epoch: 68, train_loss: 0.3291, test_loss: 2.2531, test_f1: 0.5633
 epoch: 69, train_loss: 0.3294, test_loss: 2.0605, test_f1: 0.5709
 epoch: 70, train_loss: 0.2828, test_loss: 1.9617, test_f1: 0.5873
 epoch: 71, train_loss: 0.3320, test_loss: 2.4645, test_f1: 0.5567
 epoch: 72, train_loss: 0.3184, test_loss: 2.0698, test_f1: 0.5861
 epoch: 73, train_loss: 0.3345, test_loss: 2.1650, test_f1: 0.5827
 epoch: 74, train_loss: 0.3198, test_loss: 2.2894, test_f1: 0.5678
 epoch: 75, train_loss: 0.3159, test_loss: 2.4580, test_f1: 0.5973
 epoch: 76, train_loss: 0.2569, test_loss: 2.2897, test_f1: 0.5874
 epoch: 77, train_loss: 0.2702, test_loss: 2.7051, test_f1: 0.5637
 epoch: 78, train_loss: 0.2919, test_loss: 2.1840, test_f1: 0.5804
 epoch: 79, train_loss: 0.3326, test_loss: 2.2804, test_f1: 0.5810
 epoch: 80, train_loss: 0.3643, test_loss: 1.7116, test_f1: 0.5919
 epoch: 81, train_loss: 0.3237, test_loss: 1.8862, test_f1: 0.5951
 epoch: 82, train_loss: 0.2901, test_loss: 2.1354, test_f1: 0.6025
 epoch: 83, train_loss: 0.2589, test_loss: 2.2167, test_f1: 0.5772
 epoch: 84, train_loss: 0.2757, test_loss: 2.1442, test_f1: 0.5916
 epoch: 85, train_loss: 0.2422, test_loss: 2.1672, test_f1: 0.6146
 epoch: 86, train_loss: 0.3223, test_loss: 2.1596, test_f1: 0.5675
 epoch: 87, train_loss: 0.2784, test_loss: 2.1740, test_f1: 0.5742
 epoch: 88, train_loss: 0.2576, test_loss: 2.6724, test_f1: 0.5629
 epoch: 89, train_loss: 0.2466, test_loss: 2.7988, test_f1: 0.5685
 epoch: 90, train_loss: 0.2303, test_loss: 2.2971, test_f1: 0.5938
 epoch: 91, train_loss: 0.2341, test_loss: 2.3470, test_f1: 0.6017
 epoch: 92, train_loss: 0.2314, test_loss: 2.7547, test_f1: 0.5524
 epoch: 93, train_loss: 0.1919, test_loss: 2.3600, test_f1: 0.5728
 epoch: 94, train_loss: 0.2252, test_loss: 2.8305, test_f1: 0.5447
 epoch: 95, train_loss: 0.2022, test_loss: 2.2478, test_f1: 0.6234
 epoch: 96, train_loss: 0.2472, test_loss: 2.3047, test_f1: 0.6059
 epoch: 97, train_loss: 0.1984, test_loss: 2.6253, test_f1: 0.6195
 epoch: 98, train_loss: 0.2095, test_loss: 2.4299, test_f1: 0.6011
 epoch: 99, train_loss: 0.2164, test_loss: 2.3938, test_f1: 0.5794
##################ITERATION #3 ****************************************
 epoch: 0, train_loss: 1.3094, test_loss: 2.0968, test_f1: 0.1374
 epoch: 1, train_loss: 1.0275, test_loss: 1.1524, test_f1: 0.3919
 epoch: 2, train_loss: 0.9779, test_loss: 1.1024, test_f1: 0.5124
 epoch: 3, train_loss: 0.9341, test_loss: 1.1106, test_f1: 0.4882
 epoch: 4, train_loss: 0.9206, test_loss: 1.0386, test_f1: 0.5024
 epoch: 5, train_loss: 0.9069, test_loss: 1.0227, test_f1: 0.5346
 epoch: 6, train_loss: 0.8611, test_loss: 1.0581, test_f1: 0.4338
 epoch: 7, train_loss: 0.8475, test_loss: 1.0680, test_f1: 0.4967
 epoch: 8, train_loss: 0.8432, test_loss: 1.1153, test_f1: 0.4721
 epoch: 9, train_loss: 0.8524, test_loss: 1.0778, test_f1: 0.4162
 epoch: 10, train_loss: 0.8344, test_loss: 1.0136, test_f1: 0.4793
 epoch: 11, train_loss: 0.7993, test_loss: 1.1546, test_f1: 0.5225
 epoch: 12, train_loss: 0.7839, test_loss: 1.4095, test_f1: 0.4172
 epoch: 13, train_loss: 0.7631, test_loss: 1.0710, test_f1: 0.5677
 epoch: 14, train_loss: 0.7480, test_loss: 1.1503, test_f1: 0.4569
 epoch: 15, train_loss: 0.7464, test_loss: 1.3051, test_f1: 0.4760
 epoch: 16, train_loss: 0.7663, test_loss: 1.1571, test_f1: 0.5583
 epoch: 17, train_loss: 0.7395, test_loss: 1.1804, test_f1: 0.4473
 epoch: 18, train_loss: 0.6912, test_loss: 1.3628, test_f1: 0.4250
 epoch: 19, train_loss: 0.7184, test_loss: 1.4280, test_f1: 0.4584
 epoch: 20, train_loss: 0.7117, test_loss: 1.0734, test_f1: 0.5940
 epoch: 21, train_loss: 0.6961, test_loss: 1.1443, test_f1: 0.5604
 epoch: 22, train_loss: 0.6673, test_loss: 2.1845, test_f1: 0.3695
 epoch: 23, train_loss: 0.6948, test_loss: 1.3317, test_f1: 0.5328
 epoch: 24, train_loss: 0.6698, test_loss: 1.4221, test_f1: 0.5145
 epoch: 25, train_loss: 0.6565, test_loss: 1.8125, test_f1: 0.5174
 epoch: 26, train_loss: 0.6802, test_loss: 1.5056, test_f1: 0.4565
 epoch: 27, train_loss: 0.6721, test_loss: 1.0817, test_f1: 0.6052
 epoch: 28, train_loss: 0.6732, test_loss: 1.1343, test_f1: 0.6054
 epoch: 29, train_loss: 0.6633, test_loss: 1.2913, test_f1: 0.6246
 epoch: 30, train_loss: 0.6516, test_loss: 1.4475, test_f1: 0.5430
 epoch: 31, train_loss: 0.6267, test_loss: 1.8184, test_f1: 0.4567
 epoch: 32, train_loss: 0.6047, test_loss: 1.2246, test_f1: 0.5568
 epoch: 33, train_loss: 0.6193, test_loss: 1.3180, test_f1: 0.5600
 epoch: 34, train_loss: 0.6048, test_loss: 1.5873, test_f1: 0.5498
 epoch: 35, train_loss: 0.6156, test_loss: 1.1747, test_f1: 0.5578
 epoch: 36, train_loss: 0.5916, test_loss: 1.8189, test_f1: 0.5387
 epoch: 37, train_loss: 0.6069, test_loss: 1.6138, test_f1: 0.5962
 epoch: 38, train_loss: 0.5913, test_loss: 1.5093, test_f1: 0.5995
 epoch: 39, train_loss: 0.5609, test_loss: 1.2210, test_f1: 0.5998
 epoch: 40, train_loss: 0.6046, test_loss: 1.6014, test_f1: 0.5935
 epoch: 41, train_loss: 0.5626, test_loss: 1.9715, test_f1: 0.4854
 epoch: 42, train_loss: 0.5398, test_loss: 1.7206, test_f1: 0.5223
 epoch: 43, train_loss: 0.5325, test_loss: 1.9343, test_f1: 0.5993
 epoch: 44, train_loss: 0.5405, test_loss: 2.0886, test_f1: 0.5575
 epoch: 45, train_loss: 0.5027, test_loss: 1.4847, test_f1: 0.6092
 epoch: 46, train_loss: 0.5113, test_loss: 1.7965, test_f1: 0.5723
 epoch: 47, train_loss: 0.5711, test_loss: 2.1613, test_f1: 0.5139
 epoch: 48, train_loss: 0.5504, test_loss: 2.2520, test_f1: 0.5325
 epoch: 49, train_loss: 0.4992, test_loss: 1.6062, test_f1: 0.5871
 epoch: 50, train_loss: 0.5148, test_loss: 1.5014, test_f1: 0.6109
 epoch: 51, train_loss: 0.5152, test_loss: 1.4762, test_f1: 0.5624
 epoch: 52, train_loss: 0.4637, test_loss: 1.3738, test_f1: 0.6167
 epoch: 53, train_loss: 0.4127, test_loss: 1.9684, test_f1: 0.5557
 epoch: 54, train_loss: 0.4620, test_loss: 5.2681, test_f1: 0.5904
 epoch: 55, train_loss: 0.4214, test_loss: 1.7593, test_f1: 0.5985
 epoch: 56, train_loss: 0.4287, test_loss: 2.2055, test_f1: 0.5845
 epoch: 57, train_loss: 0.3777, test_loss: 1.7248, test_f1: 0.5988
 epoch: 58, train_loss: 0.4170, test_loss: 1.9558, test_f1: 0.5494
 epoch: 59, train_loss: 0.4511, test_loss: 1.5607, test_f1: 0.6044
 epoch: 60, train_loss: 0.4225, test_loss: 1.5122, test_f1: 0.6103
 epoch: 61, train_loss: 0.3686, test_loss: 2.1041, test_f1: 0.6117
 epoch: 62, train_loss: 0.3603, test_loss: 2.1196, test_f1: 0.5598
 epoch: 63, train_loss: 0.4206, test_loss: 2.4816, test_f1: 0.5880
 epoch: 64, train_loss: 0.3539, test_loss: 2.2307, test_f1: 0.6011
 epoch: 65, train_loss: 0.3710, test_loss: 1.7701, test_f1: 0.6165
 epoch: 66, train_loss: 0.3460, test_loss: 1.5034, test_f1: 0.5809
 epoch: 67, train_loss: 0.3829, test_loss: 2.2745, test_f1: 0.5555
 epoch: 68, train_loss: 0.3159, test_loss: 2.9197, test_f1: 0.5849
 epoch: 69, train_loss: 0.3492, test_loss: 2.3144, test_f1: 0.5667
 epoch: 70, train_loss: 0.3349, test_loss: 2.6035, test_f1: 0.6183
 epoch: 71, train_loss: 0.3253, test_loss: 2.5324, test_f1: 0.5670
 epoch: 72, train_loss: 0.3155, test_loss: 1.9649, test_f1: 0.6036
 epoch: 73, train_loss: 0.2873, test_loss: 2.1938, test_f1: 0.6090
 epoch: 74, train_loss: 0.3121, test_loss: 2.2979, test_f1: 0.6449
 epoch: 75, train_loss: 0.3212, test_loss: 2.3744, test_f1: 0.5673
 epoch: 76, train_loss: 0.3363, test_loss: 1.7604, test_f1: 0.6464
 epoch: 77, train_loss: 0.3747, test_loss: 2.7861, test_f1: 0.5826
 epoch: 78, train_loss: 0.4294, test_loss: 1.5220, test_f1: 0.6387
 epoch: 79, train_loss: 0.3729, test_loss: 2.3923, test_f1: 0.5875
 epoch: 80, train_loss: 0.4315, test_loss: 2.2239, test_f1: 0.5556
 epoch: 81, train_loss: 0.3564, test_loss: 1.3816, test_f1: 0.6771
 epoch: 82, train_loss: 0.2933, test_loss: 1.6631, test_f1: 0.6342
 epoch: 83, train_loss: 0.2979, test_loss: 1.7483, test_f1: 0.6211
 epoch: 84, train_loss: 0.2617, test_loss: 2.0757, test_f1: 0.6172
 epoch: 85, train_loss: 0.2531, test_loss: 2.6516, test_f1: 0.5957
 epoch: 86, train_loss: 0.2485, test_loss: 2.3623, test_f1: 0.5585
 epoch: 87, train_loss: 0.2690, test_loss: 2.7691, test_f1: 0.5553
 epoch: 88, train_loss: 0.2565, test_loss: 3.2280, test_f1: 0.5821
 epoch: 89, train_loss: 0.2807, test_loss: 3.2993, test_f1: 0.5531
 epoch: 90, train_loss: 0.2880, test_loss: 1.9663, test_f1: 0.6239
 epoch: 91, train_loss: 0.2900, test_loss: 2.1872, test_f1: 0.6086
 epoch: 92, train_loss: 0.2409, test_loss: 2.2403, test_f1: 0.5935
 epoch: 93, train_loss: 0.2648, test_loss: 2.4130, test_f1: 0.6014
 epoch: 94, train_loss: 0.2350, test_loss: 3.1137, test_f1: 0.5927
 epoch: 95, train_loss: 0.2385, test_loss: 3.1760, test_f1: 0.6182
 epoch: 96, train_loss: 0.2473, test_loss: 3.0324, test_f1: 0.5914
 epoch: 97, train_loss: 0.2317, test_loss: 2.3377, test_f1: 0.5941
 epoch: 98, train_loss: 0.2046, test_loss: 2.5818, test_f1: 0.5982
 epoch: 99, train_loss: 0.2149, test_loss: 3.8398, test_f1: 0.5880
##################ITERATION #4 ****************************************
 epoch: 0, train_loss: 1.3837, test_loss: 1.8233, test_f1: 0.2281
 epoch: 1, train_loss: 1.0589, test_loss: 1.3079, test_f1: 0.3642
 epoch: 2, train_loss: 0.9842, test_loss: 1.0383, test_f1: 0.4390
 epoch: 3, train_loss: 0.9743, test_loss: 1.1140, test_f1: 0.4912
 epoch: 4, train_loss: 0.9268, test_loss: 1.0381, test_f1: 0.5430
 epoch: 5, train_loss: 0.9104, test_loss: 1.0119, test_f1: 0.5377
 epoch: 6, train_loss: 0.8965, test_loss: 1.0153, test_f1: 0.5504
 epoch: 7, train_loss: 0.8749, test_loss: 1.1002, test_f1: 0.4848
 epoch: 8, train_loss: 0.8769, test_loss: 1.0895, test_f1: 0.5447
 epoch: 9, train_loss: 0.8897, test_loss: 0.9847, test_f1: 0.5181
 epoch: 10, train_loss: 0.8525, test_loss: 1.6013, test_f1: 0.4168
 epoch: 11, train_loss: 0.8457, test_loss: 1.1975, test_f1: 0.4892
 epoch: 12, train_loss: 0.8272, test_loss: 0.9975, test_f1: 0.5569
 epoch: 13, train_loss: 0.7966, test_loss: 1.0733, test_f1: 0.5138
 epoch: 14, train_loss: 0.8073, test_loss: 1.4449, test_f1: 0.4007
 epoch: 15, train_loss: 0.8208, test_loss: 0.9983, test_f1: 0.4957
 epoch: 16, train_loss: 0.7837, test_loss: 1.2235, test_f1: 0.5167
 epoch: 17, train_loss: 0.7462, test_loss: 1.3619, test_f1: 0.4256
 epoch: 18, train_loss: 0.7996, test_loss: 1.1445, test_f1: 0.5263
 epoch: 19, train_loss: 0.7542, test_loss: 1.1109, test_f1: 0.5384
 epoch: 20, train_loss: 0.7332, test_loss: 1.0636, test_f1: 0.5455
 epoch: 21, train_loss: 0.7458, test_loss: 1.1063, test_f1: 0.5295
 epoch: 22, train_loss: 0.7197, test_loss: 1.6953, test_f1: 0.4109
 epoch: 23, train_loss: 0.7061, test_loss: 1.4855, test_f1: 0.4705
 epoch: 24, train_loss: 0.7238, test_loss: 1.0644, test_f1: 0.5857
 epoch: 25, train_loss: 0.7309, test_loss: 1.0483, test_f1: 0.5547
 epoch: 26, train_loss: 0.7127, test_loss: 1.0534, test_f1: 0.5874
 epoch: 27, train_loss: 0.7020, test_loss: 1.1641, test_f1: 0.5707
 epoch: 28, train_loss: 0.6694, test_loss: 1.1688, test_f1: 0.5465
 epoch: 29, train_loss: 0.6509, test_loss: 1.2747, test_f1: 0.5290
 epoch: 30, train_loss: 0.6337, test_loss: 1.4063, test_f1: 0.4844
 epoch: 31, train_loss: 0.6971, test_loss: 1.1389, test_f1: 0.5299
 epoch: 32, train_loss: 0.6763, test_loss: 1.1328, test_f1: 0.5448
 epoch: 33, train_loss: 0.6938, test_loss: 1.1697, test_f1: 0.5505
 epoch: 34, train_loss: 0.6236, test_loss: 1.3165, test_f1: 0.5503
 epoch: 35, train_loss: 0.6181, test_loss: 1.3042, test_f1: 0.5730
 epoch: 36, train_loss: 0.6155, test_loss: 1.3455, test_f1: 0.5441
 epoch: 37, train_loss: 0.5973, test_loss: 1.2105, test_f1: 0.5688
 epoch: 38, train_loss: 0.6223, test_loss: 1.7353, test_f1: 0.4867
 epoch: 39, train_loss: 0.5894, test_loss: 1.6726, test_f1: 0.5595
 epoch: 40, train_loss: 0.5436, test_loss: 1.2503, test_f1: 0.6000
 epoch: 41, train_loss: 0.5855, test_loss: 1.3797, test_f1: 0.5446
 epoch: 42, train_loss: 0.5645, test_loss: 1.5238, test_f1: 0.5642
 epoch: 43, train_loss: 0.5563, test_loss: 1.7484, test_f1: 0.5089
 epoch: 44, train_loss: 0.5435, test_loss: 1.4316, test_f1: 0.4805
 epoch: 45, train_loss: 0.5584, test_loss: 1.3074, test_f1: 0.5809
 epoch: 46, train_loss: 0.5883, test_loss: 1.3650, test_f1: 0.5233
 epoch: 47, train_loss: 0.5740, test_loss: 1.2947, test_f1: 0.5502
 epoch: 48, train_loss: 0.5301, test_loss: 1.8306, test_f1: 0.5722
 epoch: 49, train_loss: 0.5498, test_loss: 1.8046, test_f1: 0.5192
 epoch: 50, train_loss: 0.4890, test_loss: 1.5611, test_f1: 0.5986
 epoch: 51, train_loss: 0.5024, test_loss: 1.3129, test_f1: 0.6078
 epoch: 52, train_loss: 0.4354, test_loss: 1.6824, test_f1: 0.5662
 epoch: 53, train_loss: 0.3872, test_loss: 1.5967, test_f1: 0.6170
 epoch: 54, train_loss: 0.4069, test_loss: 1.6821, test_f1: 0.6208
 epoch: 55, train_loss: 0.3959, test_loss: 1.6380, test_f1: 0.5999
 epoch: 56, train_loss: 0.3646, test_loss: 1.8706, test_f1: 0.6052
 epoch: 57, train_loss: 0.4782, test_loss: 1.3355, test_f1: 0.6164
 epoch: 58, train_loss: 0.4743, test_loss: 1.6797, test_f1: 0.5635
 epoch: 59, train_loss: 0.4035, test_loss: 1.7370, test_f1: 0.5846
 epoch: 60, train_loss: 0.3992, test_loss: 1.5787, test_f1: 0.5853
 epoch: 61, train_loss: 0.3684, test_loss: 1.5991, test_f1: 0.6394
 epoch: 62, train_loss: 0.3535, test_loss: 1.9146, test_f1: 0.5497
 epoch: 63, train_loss: 0.3545, test_loss: 2.3961, test_f1: 0.5830
 epoch: 64, train_loss: 0.3768, test_loss: 2.4912, test_f1: 0.6000
 epoch: 65, train_loss: 0.3697, test_loss: 1.6669, test_f1: 0.6199
 epoch: 66, train_loss: 0.3490, test_loss: 2.2069, test_f1: 0.5472
 epoch: 67, train_loss: 0.3242, test_loss: 1.9876, test_f1: 0.6089
 epoch: 68, train_loss: 0.3516, test_loss: 1.8487, test_f1: 0.6031
 epoch: 69, train_loss: 0.3014, test_loss: 2.2005, test_f1: 0.6235
 epoch: 70, train_loss: 0.3118, test_loss: 2.3191, test_f1: 0.6039
 epoch: 71, train_loss: 0.2957, test_loss: 2.4832, test_f1: 0.5745
 epoch: 72, train_loss: 0.3438, test_loss: 2.4434, test_f1: 0.5838
 epoch: 73, train_loss: 0.2944, test_loss: 2.9194, test_f1: 0.5466
 epoch: 74, train_loss: 0.4557, test_loss: 1.9124, test_f1: 0.5329
 epoch: 75, train_loss: 0.3825, test_loss: 2.1577, test_f1: 0.4938
 epoch: 76, train_loss: 0.3716, test_loss: 1.7913, test_f1: 0.6226
 epoch: 77, train_loss: 0.3675, test_loss: 1.7577, test_f1: 0.5878
 epoch: 78, train_loss: 0.3389, test_loss: 2.1552, test_f1: 0.5609
 epoch: 79, train_loss: 0.3217, test_loss: 2.4686, test_f1: 0.5507
 epoch: 80, train_loss: 0.3002, test_loss: 2.2713, test_f1: 0.5879
 epoch: 81, train_loss: 0.3007, test_loss: 2.2161, test_f1: 0.6146
 epoch: 82, train_loss: 0.3152, test_loss: 2.4180, test_f1: 0.5772
 epoch: 83, train_loss: 0.2803, test_loss: 2.3171, test_f1: 0.5397
 epoch: 84, train_loss: 0.3159, test_loss: 2.2964, test_f1: 0.6111
 epoch: 85, train_loss: 0.2736, test_loss: 2.3024, test_f1: 0.6079
 epoch: 86, train_loss: 0.2995, test_loss: 2.6598, test_f1: 0.6142
 epoch: 87, train_loss: 0.2637, test_loss: 2.5390, test_f1: 0.5646
 epoch: 88, train_loss: 0.2763, test_loss: 2.5708, test_f1: 0.5542
 epoch: 89, train_loss: 0.2558, test_loss: 2.4982, test_f1: 0.5688
 epoch: 90, train_loss: 0.2777, test_loss: 2.8856, test_f1: 0.6040
 epoch: 91, train_loss: 0.2756, test_loss: 2.2590, test_f1: 0.6108
 epoch: 92, train_loss: 0.2727, test_loss: 2.5228, test_f1: 0.5998
 epoch: 93, train_loss: 0.2456, test_loss: 2.6037, test_f1: 0.5569
 epoch: 94, train_loss: 0.2408, test_loss: 2.6921, test_f1: 0.6085
 epoch: 95, train_loss: 0.2717, test_loss: 2.2403, test_f1: 0.6125
 epoch: 96, train_loss: 0.2552, test_loss: 2.4381, test_f1: 0.5918
 epoch: 97, train_loss: 0.2422, test_loss: 2.3106, test_f1: 0.6355
 epoch: 98, train_loss: 0.2526, test_loss: 2.7793, test_f1: 0.5792
 epoch: 99, train_loss: 0.2623, test_loss: 2.7533, test_f1: 0.6052
##################ITERATION #5 ****************************************
 epoch: 0, train_loss: 1.2503, test_loss: 1.3606, test_f1: 0.2831
 epoch: 1, train_loss: 1.0246, test_loss: 1.2929, test_f1: 0.3017
 epoch: 2, train_loss: 0.9833, test_loss: 1.0890, test_f1: 0.4348
 epoch: 3, train_loss: 0.9440, test_loss: 1.1610, test_f1: 0.4703
 epoch: 4, train_loss: 0.9213, test_loss: 1.0629, test_f1: 0.4997
 epoch: 5, train_loss: 0.8955, test_loss: 1.1226, test_f1: 0.4875
 epoch: 6, train_loss: 0.8519, test_loss: 0.9791, test_f1: 0.4951
 epoch: 7, train_loss: 0.8403, test_loss: 1.0102, test_f1: 0.5160
 epoch: 8, train_loss: 0.8561, test_loss: 1.7433, test_f1: 0.4411
 epoch: 9, train_loss: 0.8595, test_loss: 1.0717, test_f1: 0.5291
 epoch: 10, train_loss: 0.8247, test_loss: 0.9638, test_f1: 0.5306
 epoch: 11, train_loss: 0.7833, test_loss: 0.9792, test_f1: 0.5768
 epoch: 12, train_loss: 0.7665, test_loss: 1.1847, test_f1: 0.4742
 epoch: 13, train_loss: 0.7833, test_loss: 2.0744, test_f1: 0.4558
 epoch: 14, train_loss: 0.7685, test_loss: 1.2647, test_f1: 0.4715
 epoch: 15, train_loss: 0.7517, test_loss: 1.0210, test_f1: 0.4749
 epoch: 16, train_loss: 0.7298, test_loss: 1.5006, test_f1: 0.4619
 epoch: 17, train_loss: 0.7151, test_loss: 1.0996, test_f1: 0.5100
 epoch: 18, train_loss: 0.7387, test_loss: 1.0120, test_f1: 0.5174
 epoch: 19, train_loss: 0.7424, test_loss: 1.1550, test_f1: 0.5047
 epoch: 20, train_loss: 0.7294, test_loss: 1.2097, test_f1: 0.4914
 epoch: 21, train_loss: 0.7043, test_loss: 1.1627, test_f1: 0.5442
 epoch: 22, train_loss: 0.7137, test_loss: 1.0396, test_f1: 0.5825
 epoch: 23, train_loss: 0.7792, test_loss: 1.4824, test_f1: 0.4377
 epoch: 24, train_loss: 0.7136, test_loss: 1.0941, test_f1: 0.5117
 epoch: 25, train_loss: 0.6521, test_loss: 1.9278, test_f1: 0.4759
 epoch: 26, train_loss: 0.6501, test_loss: 1.3033, test_f1: 0.5374
 epoch: 27, train_loss: 0.6300, test_loss: 1.2487, test_f1: 0.5405
 epoch: 28, train_loss: 0.6333, test_loss: 1.3581, test_f1: 0.5989
 epoch: 29, train_loss: 0.5960, test_loss: 2.2453, test_f1: 0.5208
 epoch: 30, train_loss: 0.6460, test_loss: 1.1646, test_f1: 0.5836
 epoch: 31, train_loss: 0.5718, test_loss: 1.1357, test_f1: 0.5906
 epoch: 32, train_loss: 0.5728, test_loss: 1.9415, test_f1: 0.5408
 epoch: 33, train_loss: 0.5839, test_loss: 1.1897, test_f1: 0.5490
 epoch: 34, train_loss: 0.6213, test_loss: 1.1557, test_f1: 0.5925
 epoch: 35, train_loss: 0.5891, test_loss: 1.2841, test_f1: 0.5867
 epoch: 36, train_loss: 0.6295, test_loss: 1.2996, test_f1: 0.5195
 epoch: 37, train_loss: 0.5924, test_loss: 1.1620, test_f1: 0.5941
 epoch: 38, train_loss: 0.5684, test_loss: 1.3204, test_f1: 0.5680
 epoch: 39, train_loss: 0.5895, test_loss: 1.2477, test_f1: 0.5441
 epoch: 40, train_loss: 0.5695, test_loss: 1.2974, test_f1: 0.5858
 epoch: 41, train_loss: 0.5339, test_loss: 1.5026, test_f1: 0.5616
 epoch: 42, train_loss: 0.5119, test_loss: 1.3403, test_f1: 0.5990
 epoch: 43, train_loss: 0.4919, test_loss: 1.4470, test_f1: 0.5474
 epoch: 44, train_loss: 0.5156, test_loss: 1.5270, test_f1: 0.5735
 epoch: 45, train_loss: 0.5599, test_loss: 2.1334, test_f1: 0.4695
 epoch: 46, train_loss: 0.6157, test_loss: 1.2319, test_f1: 0.5807
 epoch: 47, train_loss: 0.5907, test_loss: 1.8538, test_f1: 0.5515
 epoch: 48, train_loss: 0.5762, test_loss: 1.3289, test_f1: 0.5550
 epoch: 49, train_loss: 0.5190, test_loss: 1.3125, test_f1: 0.6115
 epoch: 50, train_loss: 0.4745, test_loss: 6.5312, test_f1: 0.2307
 epoch: 51, train_loss: 0.4388, test_loss: 1.3963, test_f1: 0.5605
 epoch: 52, train_loss: 0.4228, test_loss: 1.5529, test_f1: 0.5885
 epoch: 53, train_loss: 0.4241, test_loss: 1.4407, test_f1: 0.6202
 epoch: 54, train_loss: 0.3926, test_loss: 1.4619, test_f1: 0.6442
 epoch: 55, train_loss: 0.3876, test_loss: 1.6773, test_f1: 0.5864
 epoch: 56, train_loss: 0.3502, test_loss: 1.5543, test_f1: 0.6098
 epoch: 57, train_loss: 0.3628, test_loss: 1.6034, test_f1: 0.6167
 epoch: 58, train_loss: 0.3555, test_loss: 1.6358, test_f1: 0.6194
 epoch: 59, train_loss: 0.3262, test_loss: 1.5175, test_f1: 0.6185
 epoch: 60, train_loss: 0.3305, test_loss: 1.7476, test_f1: 0.5988
 epoch: 61, train_loss: 0.3273, test_loss: 1.5742, test_f1: 0.6372
 epoch: 62, train_loss: 0.3373, test_loss: 1.6055, test_f1: 0.6173
 epoch: 63, train_loss: 0.3629, test_loss: 1.7268, test_f1: 0.5909
 epoch: 64, train_loss: 0.4009, test_loss: 1.5686, test_f1: 0.5663
 epoch: 65, train_loss: 0.3566, test_loss: 1.6290, test_f1: 0.6505
 epoch: 66, train_loss: 0.3320, test_loss: 1.8855, test_f1: 0.6215
 epoch: 67, train_loss: 0.3081, test_loss: 1.7625, test_f1: 0.5760
 epoch: 68, train_loss: 0.3038, test_loss: 1.6889, test_f1: 0.6007
 epoch: 69, train_loss: 0.3029, test_loss: 1.7380, test_f1: 0.6151
 epoch: 70, train_loss: 0.2978, test_loss: 1.7042, test_f1: 0.6210
 epoch: 71, train_loss: 0.2887, test_loss: 1.9025, test_f1: 0.6254
 epoch: 72, train_loss: 0.3036, test_loss: 2.0076, test_f1: 0.6064
 epoch: 73, train_loss: 0.2864, test_loss: 1.9727, test_f1: 0.5623
 epoch: 74, train_loss: 0.3787, test_loss: 1.8237, test_f1: 0.6566
 epoch: 75, train_loss: 0.2891, test_loss: 1.8154, test_f1: 0.6304
 epoch: 76, train_loss: 0.2853, test_loss: 1.8843, test_f1: 0.6463
 epoch: 77, train_loss: 0.2712, test_loss: 2.0022, test_f1: 0.5893
 epoch: 78, train_loss: 0.2869, test_loss: 1.9110, test_f1: 0.6129
 epoch: 79, train_loss: 0.2684, test_loss: 1.9404, test_f1: 0.6160
 epoch: 80, train_loss: 0.2630, test_loss: 2.0370, test_f1: 0.6362
 epoch: 81, train_loss: 0.2431, test_loss: 1.9932, test_f1: 0.6237
 epoch: 82, train_loss: 0.2069, test_loss: 2.1891, test_f1: 0.6175
 epoch: 83, train_loss: 0.2520, test_loss: 2.0109, test_f1: 0.6431
 epoch: 84, train_loss: 0.2601, test_loss: 1.9519, test_f1: 0.6459
 epoch: 85, train_loss: 0.2547, test_loss: 2.0622, test_f1: 0.6381
 epoch: 86, train_loss: 0.2877, test_loss: 2.1573, test_f1: 0.6360
 epoch: 87, train_loss: 0.2915, test_loss: 1.8616, test_f1: 0.6376
 epoch: 88, train_loss: 0.2592, test_loss: 1.7658, test_f1: 0.6452
 epoch: 89, train_loss: 0.2096, test_loss: 1.7832, test_f1: 0.6404
 epoch: 90, train_loss: 0.2285, test_loss: 2.3958, test_f1: 0.6069
 epoch: 91, train_loss: 0.2360, test_loss: 2.3394, test_f1: 0.5440
 epoch: 92, train_loss: 0.2573, test_loss: 2.2784, test_f1: 0.5471
 epoch: 93, train_loss: 0.2257, test_loss: 2.1300, test_f1: 0.5715
 epoch: 94, train_loss: 0.2161, test_loss: 1.8003, test_f1: 0.6318
 epoch: 95, train_loss: 0.2072, test_loss: 2.0778, test_f1: 0.5921
 epoch: 96, train_loss: 0.2460, test_loss: 1.9075, test_f1: 0.6378
 epoch: 97, train_loss: 0.2107, test_loss: 2.0441, test_f1: 0.5795
 epoch: 98, train_loss: 0.1973, test_loss: 1.9709, test_f1: 0.6325
 epoch: 99, train_loss: 0.2315, test_loss: 1.8813, test_f1: 0.5844
##################ITERATION #6 ****************************************
 epoch: 0, train_loss: 1.3715, test_loss: 1.3074, test_f1: 0.3278
 epoch: 1, train_loss: 1.0071, test_loss: 1.2915, test_f1: 0.2700
 epoch: 2, train_loss: 0.9480, test_loss: 1.2737, test_f1: 0.3549
 epoch: 3, train_loss: 0.9231, test_loss: 1.1872, test_f1: 0.4304
 epoch: 4, train_loss: 0.9204, test_loss: 1.1774, test_f1: 0.5074
 epoch: 5, train_loss: 0.9055, test_loss: 1.2296, test_f1: 0.4158
 epoch: 6, train_loss: 0.8857, test_loss: 1.3364, test_f1: 0.4907
 epoch: 7, train_loss: 0.8621, test_loss: 1.3594, test_f1: 0.5011
 epoch: 8, train_loss: 0.8474, test_loss: 1.0532, test_f1: 0.5561
 epoch: 9, train_loss: 0.8304, test_loss: 1.1257, test_f1: 0.5404
 epoch: 10, train_loss: 0.8320, test_loss: 1.0198, test_f1: 0.5590
 epoch: 11, train_loss: 0.8056, test_loss: 1.5013, test_f1: 0.5237
 epoch: 12, train_loss: 0.8326, test_loss: 1.1603, test_f1: 0.5539
 epoch: 13, train_loss: 0.7816, test_loss: 1.3841, test_f1: 0.5375
 epoch: 14, train_loss: 0.7577, test_loss: 1.3598, test_f1: 0.5014
 epoch: 15, train_loss: 0.7643, test_loss: 1.2319, test_f1: 0.5062
 epoch: 16, train_loss: 0.7368, test_loss: 1.3813, test_f1: 0.4391
 epoch: 17, train_loss: 0.7683, test_loss: 1.2764, test_f1: 0.5580
 epoch: 18, train_loss: 0.7317, test_loss: 1.5589, test_f1: 0.5218
 epoch: 19, train_loss: 0.7074, test_loss: 1.4751, test_f1: 0.5737
 epoch: 20, train_loss: 0.7383, test_loss: 1.3854, test_f1: 0.4434
 epoch: 21, train_loss: 0.6725, test_loss: 1.1881, test_f1: 0.5416
 epoch: 22, train_loss: 0.7078, test_loss: 1.3214, test_f1: 0.4282
 epoch: 23, train_loss: 0.6389, test_loss: 1.2271, test_f1: 0.5959
 epoch: 24, train_loss: 0.6361, test_loss: 1.3828, test_f1: 0.4912
 epoch: 25, train_loss: 0.6356, test_loss: 1.7522, test_f1: 0.5463
 epoch: 26, train_loss: 0.6196, test_loss: 1.2547, test_f1: 0.5780
 epoch: 27, train_loss: 0.6142, test_loss: 1.4363, test_f1: 0.5519
 epoch: 28, train_loss: 0.6678, test_loss: 2.2025, test_f1: 0.5260
 epoch: 29, train_loss: 0.5938, test_loss: 1.3828, test_f1: 0.5239
 epoch: 30, train_loss: 0.5882, test_loss: 1.6200, test_f1: 0.4854
 epoch: 31, train_loss: 0.5721, test_loss: 1.6152, test_f1: 0.5480
 epoch: 32, train_loss: 0.5760, test_loss: 2.1211, test_f1: 0.5004
 epoch: 33, train_loss: 0.6436, test_loss: 1.4113, test_f1: 0.5945
 epoch: 34, train_loss: 0.5907, test_loss: 2.4252, test_f1: 0.4304
 epoch: 35, train_loss: 0.6201, test_loss: 1.9463, test_f1: 0.4805
 epoch: 36, train_loss: 0.6038, test_loss: 1.3016, test_f1: 0.5203
 epoch: 37, train_loss: 0.5833, test_loss: 1.3461, test_f1: 0.5428
 epoch: 38, train_loss: 0.6188, test_loss: 2.1067, test_f1: 0.4944
 epoch: 39, train_loss: 0.6793, test_loss: 1.4635, test_f1: 0.5535
 epoch: 40, train_loss: 0.7109, test_loss: 1.5970, test_f1: 0.4197
 epoch: 41, train_loss: 0.6253, test_loss: 1.3470, test_f1: 0.5537
 epoch: 42, train_loss: 0.5829, test_loss: 1.2223, test_f1: 0.6405
 epoch: 43, train_loss: 0.5375, test_loss: 1.3659, test_f1: 0.5703
 epoch: 44, train_loss: 0.5147, test_loss: 1.3541, test_f1: 0.5667
 epoch: 45, train_loss: 0.5521, test_loss: 1.3241, test_f1: 0.5903
 epoch: 46, train_loss: 0.5292, test_loss: 1.6758, test_f1: 0.5293
 epoch: 47, train_loss: 0.5012, test_loss: 1.3594, test_f1: 0.5760
 epoch: 48, train_loss: 0.4512, test_loss: 2.0152, test_f1: 0.5082
 epoch: 49, train_loss: 0.5134, test_loss: 1.2776, test_f1: 0.5824
 epoch: 50, train_loss: 0.4642, test_loss: 1.4292, test_f1: 0.5547
 epoch: 51, train_loss: 0.4847, test_loss: 1.3083, test_f1: 0.6406
 epoch: 52, train_loss: 0.4186, test_loss: 1.5557, test_f1: 0.6116
 epoch: 53, train_loss: 0.3822, test_loss: 1.5984, test_f1: 0.6110
 epoch: 54, train_loss: 0.3768, test_loss: 1.7544, test_f1: 0.5781
 epoch: 55, train_loss: 0.3260, test_loss: 1.7390, test_f1: 0.5955
 epoch: 56, train_loss: 0.3657, test_loss: 1.8565, test_f1: 0.5708
 epoch: 57, train_loss: 0.3833, test_loss: 1.8528, test_f1: 0.5737
 epoch: 58, train_loss: 0.3741, test_loss: 1.8751, test_f1: 0.5907
 epoch: 59, train_loss: 0.3749, test_loss: 1.7044, test_f1: 0.5800
 epoch: 60, train_loss: 0.3753, test_loss: 1.5694, test_f1: 0.6139
 epoch: 61, train_loss: 0.3776, test_loss: 1.5980, test_f1: 0.5897
 epoch: 62, train_loss: 0.3444, test_loss: 1.7722, test_f1: 0.6086
 epoch: 63, train_loss: 0.3171, test_loss: 1.6823, test_f1: 0.5913
 epoch: 64, train_loss: 0.2975, test_loss: 1.8129, test_f1: 0.5994
 epoch: 65, train_loss: 0.3140, test_loss: 2.1710, test_f1: 0.5748
 epoch: 66, train_loss: 0.2778, test_loss: 1.8323, test_f1: 0.6120
 epoch: 67, train_loss: 0.2820, test_loss: 2.2110, test_f1: 0.5915
 epoch: 68, train_loss: 0.3492, test_loss: 2.0100, test_f1: 0.5830
 epoch: 69, train_loss: 0.3432, test_loss: 1.8086, test_f1: 0.5594
 epoch: 70, train_loss: 0.3700, test_loss: 2.1476, test_f1: 0.5684
 epoch: 71, train_loss: 0.2971, test_loss: 2.4607, test_f1: 0.5779
 epoch: 72, train_loss: 0.2936, test_loss: 2.0911, test_f1: 0.5647
 epoch: 73, train_loss: 0.2446, test_loss: 2.0741, test_f1: 0.5898
 epoch: 74, train_loss: 0.2867, test_loss: 1.8475, test_f1: 0.5642
 epoch: 75, train_loss: 0.2767, test_loss: 2.0656, test_f1: 0.5656
 epoch: 76, train_loss: 0.3143, test_loss: 1.9339, test_f1: 0.6127
 epoch: 77, train_loss: 0.3009, test_loss: 2.9479, test_f1: 0.5123
 epoch: 78, train_loss: 0.3196, test_loss: 2.4101, test_f1: 0.4839
 epoch: 79, train_loss: 0.3638, test_loss: 2.0139, test_f1: 0.5774
 epoch: 80, train_loss: 0.3280, test_loss: 2.0016, test_f1: 0.5771
 epoch: 81, train_loss: 0.2784, test_loss: 2.1874, test_f1: 0.6057
 epoch: 82, train_loss: 0.2657, test_loss: 2.1639, test_f1: 0.5899
 epoch: 83, train_loss: 0.2655, test_loss: 2.3056, test_f1: 0.6191
 epoch: 84, train_loss: 0.2684, test_loss: 2.4681, test_f1: 0.5870
 epoch: 85, train_loss: 0.2977, test_loss: 2.2389, test_f1: 0.5537
 epoch: 86, train_loss: 0.2552, test_loss: 2.5517, test_f1: 0.5508
 epoch: 87, train_loss: 0.3059, test_loss: 2.3445, test_f1: 0.5989
 epoch: 88, train_loss: 0.3204, test_loss: 2.1105, test_f1: 0.5661
 epoch: 89, train_loss: 0.2762, test_loss: 2.2191, test_f1: 0.5904
 epoch: 90, train_loss: 0.2836, test_loss: 3.2435, test_f1: 0.5145
 epoch: 91, train_loss: 0.2324, test_loss: 2.4705, test_f1: 0.5889
 epoch: 92, train_loss: 0.2155, test_loss: 2.7204, test_f1: 0.6025
 epoch: 93, train_loss: 0.2474, test_loss: 2.7711, test_f1: 0.5399
 epoch: 94, train_loss: 0.2236, test_loss: 2.9932, test_f1: 0.5497
 epoch: 95, train_loss: 0.2731, test_loss: 2.2858, test_f1: 0.5944
 epoch: 96, train_loss: 0.2539, test_loss: 2.4838, test_f1: 0.5605
 epoch: 97, train_loss: 0.2671, test_loss: 2.2867, test_f1: 0.5727
 epoch: 98, train_loss: 0.2302, test_loss: 2.6062, test_f1: 0.5760
 epoch: 99, train_loss: 0.2504, test_loss: 2.4459, test_f1: 0.6023
##################ITERATION #7 ****************************************
 epoch: 0, train_loss: 1.3058, test_loss: 1.4159, test_f1: 0.2281
 epoch: 1, train_loss: 1.0298, test_loss: 1.3539, test_f1: 0.2441
 epoch: 2, train_loss: 0.9801, test_loss: 1.1050, test_f1: 0.3938
 epoch: 3, train_loss: 0.9205, test_loss: 0.9837, test_f1: 0.5050
 epoch: 4, train_loss: 0.8927, test_loss: 0.9916, test_f1: 0.5141
 epoch: 5, train_loss: 0.8916, test_loss: 1.0964, test_f1: 0.4623
 epoch: 6, train_loss: 0.9113, test_loss: 0.9941, test_f1: 0.4315
 epoch: 7, train_loss: 0.8820, test_loss: 1.0152, test_f1: 0.5407
 epoch: 8, train_loss: 0.8581, test_loss: 1.0148, test_f1: 0.5013
 epoch: 9, train_loss: 0.8428, test_loss: 0.9593, test_f1: 0.5427
 epoch: 10, train_loss: 0.8237, test_loss: 1.0079, test_f1: 0.5445
 epoch: 11, train_loss: 0.7992, test_loss: 0.9866, test_f1: 0.5831
 epoch: 12, train_loss: 0.8170, test_loss: 1.2083, test_f1: 0.5228
 epoch: 13, train_loss: 0.8126, test_loss: 0.9619, test_f1: 0.5888
 epoch: 14, train_loss: 0.7905, test_loss: 1.1472, test_f1: 0.5237
 epoch: 15, train_loss: 0.7764, test_loss: 1.1149, test_f1: 0.6013
 epoch: 16, train_loss: 0.7713, test_loss: 1.0128, test_f1: 0.5330
 epoch: 17, train_loss: 0.7389, test_loss: 1.1724, test_f1: 0.5314
 epoch: 18, train_loss: 0.7248, test_loss: 1.1851, test_f1: 0.5222
 epoch: 19, train_loss: 0.8066, test_loss: 1.0902, test_f1: 0.4858
 epoch: 20, train_loss: 0.8296, test_loss: 1.7903, test_f1: 0.3264
 epoch: 21, train_loss: 0.7923, test_loss: 1.0636, test_f1: 0.5139
 epoch: 22, train_loss: 0.7355, test_loss: 0.9627, test_f1: 0.6277
 epoch: 23, train_loss: 0.7005, test_loss: 1.2014, test_f1: 0.5524
 epoch: 24, train_loss: 0.6982, test_loss: 1.0372, test_f1: 0.5558
 epoch: 25, train_loss: 0.6949, test_loss: 1.2629, test_f1: 0.4550
 epoch: 26, train_loss: 0.6812, test_loss: 1.0897, test_f1: 0.5273
 epoch: 27, train_loss: 0.7151, test_loss: 1.0354, test_f1: 0.5843
 epoch: 28, train_loss: 0.6667, test_loss: 1.3103, test_f1: 0.5410
 epoch: 29, train_loss: 0.6914, test_loss: 0.9853, test_f1: 0.5706
 epoch: 30, train_loss: 0.6771, test_loss: 1.1244, test_f1: 0.5370
 epoch: 31, train_loss: 0.6375, test_loss: 1.0921, test_f1: 0.5419
 epoch: 32, train_loss: 0.7019, test_loss: 0.9758, test_f1: 0.6200
 epoch: 33, train_loss: 0.6640, test_loss: 1.2912, test_f1: 0.5787
 epoch: 34, train_loss: 0.6352, test_loss: 1.2139, test_f1: 0.4895
 epoch: 35, train_loss: 0.6260, test_loss: 1.2118, test_f1: 0.5491
 epoch: 36, train_loss: 0.5987, test_loss: 1.2316, test_f1: 0.4955
 epoch: 37, train_loss: 0.6149, test_loss: 1.2581, test_f1: 0.5120
 epoch: 38, train_loss: 0.6104, test_loss: 1.3275, test_f1: 0.4968
 epoch: 39, train_loss: 0.6132, test_loss: 1.2309, test_f1: 0.5212
 epoch: 40, train_loss: 0.6393, test_loss: 1.0259, test_f1: 0.5532
 epoch: 41, train_loss: 0.6529, test_loss: 1.5526, test_f1: 0.4281
 epoch: 42, train_loss: 0.6576, test_loss: 1.0386, test_f1: 0.6020
 epoch: 43, train_loss: 0.6549, test_loss: 1.1034, test_f1: 0.5542
 epoch: 44, train_loss: 0.6168, test_loss: 0.9493, test_f1: 0.5856
 epoch: 45, train_loss: 0.6113, test_loss: 1.1774, test_f1: 0.5858
 epoch: 46, train_loss: 0.5788, test_loss: 0.9885, test_f1: 0.6005
 epoch: 47, train_loss: 0.6182, test_loss: 1.0017, test_f1: 0.5786
 epoch: 48, train_loss: 0.5951, test_loss: 1.2028, test_f1: 0.5191
 epoch: 49, train_loss: 0.5936, test_loss: 1.0998, test_f1: 0.6049
 epoch: 50, train_loss: 0.5640, test_loss: 1.1194, test_f1: 0.5810
 epoch: 51, train_loss: 0.5360, test_loss: 1.0906, test_f1: 0.5935
 epoch: 52, train_loss: 0.4943, test_loss: 1.1283, test_f1: 0.6164
 epoch: 53, train_loss: 0.4803, test_loss: 1.1126, test_f1: 0.5731
 epoch: 54, train_loss: 0.4649, test_loss: 1.2178, test_f1: 0.6293
 epoch: 55, train_loss: 0.4531, test_loss: 1.1940, test_f1: 0.6402
 epoch: 56, train_loss: 0.4404, test_loss: 1.0772, test_f1: 0.5910
 epoch: 57, train_loss: 0.4876, test_loss: 1.4977, test_f1: 0.5722
 epoch: 58, train_loss: 0.4581, test_loss: 1.8971, test_f1: 0.5502
 epoch: 59, train_loss: 0.4571, test_loss: 1.2211, test_f1: 0.6600
 epoch: 60, train_loss: 0.4376, test_loss: 1.2379, test_f1: 0.6438
 epoch: 61, train_loss: 0.4426, test_loss: 1.3699, test_f1: 0.5725
 epoch: 62, train_loss: 0.4527, test_loss: 1.3631, test_f1: 0.6116
 epoch: 63, train_loss: 0.4362, test_loss: 1.4329, test_f1: 0.6069
 epoch: 64, train_loss: 0.4395, test_loss: 1.3856, test_f1: 0.6636
 epoch: 65, train_loss: 0.4315, test_loss: 1.3956, test_f1: 0.6458
 epoch: 66, train_loss: 0.3831, test_loss: 1.4490, test_f1: 0.6578
 epoch: 67, train_loss: 0.4158, test_loss: 1.4390, test_f1: 0.6692
 epoch: 68, train_loss: 0.3757, test_loss: 1.4890, test_f1: 0.5955
 epoch: 69, train_loss: 0.3654, test_loss: 1.5082, test_f1: 0.6524
 epoch: 70, train_loss: 0.3829, test_loss: 1.5820, test_f1: 0.6552
 epoch: 71, train_loss: 0.4060, test_loss: 1.3578, test_f1: 0.6289
 epoch: 72, train_loss: 0.3660, test_loss: 1.5770, test_f1: 0.6121
 epoch: 73, train_loss: 0.3980, test_loss: 1.7663, test_f1: 0.5770
 epoch: 74, train_loss: 0.3861, test_loss: 1.6430, test_f1: 0.6191
 epoch: 75, train_loss: 0.3506, test_loss: 1.6086, test_f1: 0.6534
 epoch: 76, train_loss: 0.3583, test_loss: 1.5921, test_f1: 0.6140
 epoch: 77, train_loss: 0.4452, test_loss: 1.5124, test_f1: 0.6152
 epoch: 78, train_loss: 0.3999, test_loss: 1.2580, test_f1: 0.6578
 epoch: 79, train_loss: 0.3870, test_loss: 1.3463, test_f1: 0.6620
 epoch: 80, train_loss: 0.3582, test_loss: 1.5642, test_f1: 0.5977
 epoch: 81, train_loss: 0.3854, test_loss: 1.4466, test_f1: 0.6760
 epoch: 82, train_loss: 0.3308, test_loss: 1.3816, test_f1: 0.6511
 epoch: 83, train_loss: 0.3525, test_loss: 1.5991, test_f1: 0.6515
 epoch: 84, train_loss: 0.3462, test_loss: 1.6323, test_f1: 0.6300
 epoch: 85, train_loss: 0.3718, test_loss: 1.6679, test_f1: 0.6382
 epoch: 86, train_loss: 0.3248, test_loss: 1.7084, test_f1: 0.6371
 epoch: 87, train_loss: 0.3302, test_loss: 1.5064, test_f1: 0.6686
 epoch: 88, train_loss: 0.3084, test_loss: 1.7253, test_f1: 0.6356
 epoch: 89, train_loss: 0.3285, test_loss: 1.5812, test_f1: 0.6480
 epoch: 90, train_loss: 0.3177, test_loss: 1.5321, test_f1: 0.6411
 epoch: 91, train_loss: 0.3316, test_loss: 1.5250, test_f1: 0.6238
 epoch: 92, train_loss: 0.3320, test_loss: 1.5447, test_f1: 0.6403
 epoch: 93, train_loss: 0.3211, test_loss: 1.7430, test_f1: 0.6317
 epoch: 94, train_loss: 0.3202, test_loss: 1.7820, test_f1: 0.6412
 epoch: 95, train_loss: 0.2872, test_loss: 1.6452, test_f1: 0.6271
 epoch: 96, train_loss: 0.2827, test_loss: 1.7685, test_f1: 0.6056
 epoch: 97, train_loss: 0.3509, test_loss: 1.7096, test_f1: 0.6684
 epoch: 98, train_loss: 0.3222, test_loss: 1.4969, test_f1: 0.6482
 epoch: 99, train_loss: 0.3267, test_loss: 1.5797, test_f1: 0.6248
##################ITERATION #8 ****************************************
 epoch: 0, train_loss: 1.3141, test_loss: 1.4606, test_f1: 0.2281
 epoch: 1, train_loss: 1.0649, test_loss: 1.2183, test_f1: 0.2910
 epoch: 2, train_loss: 1.0361, test_loss: 1.0724, test_f1: 0.4451
 epoch: 3, train_loss: 0.9845, test_loss: 1.0300, test_f1: 0.4487
 epoch: 4, train_loss: 0.9485, test_loss: 1.0274, test_f1: 0.5436
 epoch: 5, train_loss: 0.9162, test_loss: 1.0324, test_f1: 0.4380
 epoch: 6, train_loss: 0.8844, test_loss: 1.0020, test_f1: 0.4350
 epoch: 7, train_loss: 0.8648, test_loss: 1.0077, test_f1: 0.5601
 epoch: 8, train_loss: 0.8661, test_loss: 1.0962, test_f1: 0.5158
 epoch: 9, train_loss: 0.8117, test_loss: 1.0550, test_f1: 0.5278
 epoch: 10, train_loss: 0.7869, test_loss: 1.1239, test_f1: 0.5298
 epoch: 11, train_loss: 0.7686, test_loss: 1.0219, test_f1: 0.4962
 epoch: 12, train_loss: 0.7664, test_loss: 0.9973, test_f1: 0.5252
 epoch: 13, train_loss: 0.7719, test_loss: 1.1582, test_f1: 0.4939
 epoch: 14, train_loss: 0.7616, test_loss: 1.1024, test_f1: 0.5432
 epoch: 15, train_loss: 0.7491, test_loss: 1.3131, test_f1: 0.5107
 epoch: 16, train_loss: 0.7308, test_loss: 1.0188, test_f1: 0.5934
 epoch: 17, train_loss: 0.7178, test_loss: 1.6161, test_f1: 0.4119
 epoch: 18, train_loss: 0.7525, test_loss: 1.3054, test_f1: 0.5455
 epoch: 19, train_loss: 0.7571, test_loss: 1.2566, test_f1: 0.5271
 epoch: 20, train_loss: 0.7141, test_loss: 1.1502, test_f1: 0.5317
 epoch: 21, train_loss: 0.7806, test_loss: 1.7828, test_f1: 0.3813
 epoch: 22, train_loss: 0.7454, test_loss: 1.0388, test_f1: 0.5719
 epoch: 23, train_loss: 0.7054, test_loss: 1.1538, test_f1: 0.5553
 epoch: 24, train_loss: 0.7039, test_loss: 1.1728, test_f1: 0.5849
 epoch: 25, train_loss: 0.7101, test_loss: 1.1407, test_f1: 0.5248
 epoch: 26, train_loss: 0.6872, test_loss: 1.2772, test_f1: 0.5058
 epoch: 27, train_loss: 0.6443, test_loss: 1.4362, test_f1: 0.5384
 epoch: 28, train_loss: 0.6723, test_loss: 1.4281, test_f1: 0.4846
 epoch: 29, train_loss: 0.6436, test_loss: 1.4257, test_f1: 0.5430
 epoch: 30, train_loss: 0.7460, test_loss: 1.2475, test_f1: 0.5189
 epoch: 31, train_loss: 0.6957, test_loss: 1.2331, test_f1: 0.5603
 epoch: 32, train_loss: 0.6987, test_loss: 1.4074, test_f1: 0.5389
 epoch: 33, train_loss: 0.6789, test_loss: 1.0624, test_f1: 0.5254
 epoch: 34, train_loss: 0.6645, test_loss: 1.5266, test_f1: 0.5225
 epoch: 35, train_loss: 0.6334, test_loss: 1.2478, test_f1: 0.5704
 epoch: 36, train_loss: 0.6194, test_loss: 1.1741, test_f1: 0.5826
 epoch: 37, train_loss: 0.6138, test_loss: 1.4194, test_f1: 0.5574
 epoch: 38, train_loss: 0.6091, test_loss: 1.4205, test_f1: 0.5434
 epoch: 39, train_loss: 0.6399, test_loss: 1.3993, test_f1: 0.5643
 epoch: 40, train_loss: 0.6066, test_loss: 1.1366, test_f1: 0.6086
 epoch: 41, train_loss: 0.5701, test_loss: 1.5396, test_f1: 0.5251
 epoch: 42, train_loss: 0.6357, test_loss: 1.4835, test_f1: 0.5750
 epoch: 43, train_loss: 0.6628, test_loss: 1.9372, test_f1: 0.5355
 epoch: 44, train_loss: 0.6206, test_loss: 1.9626, test_f1: 0.5353
 epoch: 45, train_loss: 0.5787, test_loss: 1.5382, test_f1: 0.5763
 epoch: 46, train_loss: 0.6186, test_loss: 1.2937, test_f1: 0.5626
 epoch: 47, train_loss: 0.5813, test_loss: 1.5108, test_f1: 0.5061
 epoch: 48, train_loss: 0.6164, test_loss: 1.2297, test_f1: 0.5456
 epoch: 49, train_loss: 0.5691, test_loss: 1.7639, test_f1: 0.5043
 epoch: 50, train_loss: 0.5669, test_loss: 1.2689, test_f1: 0.5615
 epoch: 51, train_loss: 0.5281, test_loss: 1.4430, test_f1: 0.5445
 epoch: 52, train_loss: 0.5093, test_loss: 1.4342, test_f1: 0.5742
 epoch: 53, train_loss: 0.5088, test_loss: 1.3217, test_f1: 0.5557
 epoch: 54, train_loss: 0.5005, test_loss: 1.1176, test_f1: 0.5894
 epoch: 55, train_loss: 0.4838, test_loss: 1.5759, test_f1: 0.5560
 epoch: 56, train_loss: 0.4563, test_loss: 1.4255, test_f1: 0.5564
 epoch: 57, train_loss: 0.4350, test_loss: 1.5936, test_f1: 0.5762
 epoch: 58, train_loss: 0.4343, test_loss: 1.4506, test_f1: 0.5631
 epoch: 59, train_loss: 0.4249, test_loss: 1.6595, test_f1: 0.5562
 epoch: 60, train_loss: 0.4812, test_loss: 1.2437, test_f1: 0.5939
 epoch: 61, train_loss: 0.4609, test_loss: 1.5234, test_f1: 0.5613
 epoch: 62, train_loss: 0.4179, test_loss: 1.8955, test_f1: 0.5600
 epoch: 63, train_loss: 0.4439, test_loss: 1.5397, test_f1: 0.5046
 epoch: 64, train_loss: 0.4577, test_loss: 1.8735, test_f1: 0.5737
 epoch: 65, train_loss: 0.4336, test_loss: 1.4872, test_f1: 0.5970
 epoch: 66, train_loss: 0.4167, test_loss: 1.9580, test_f1: 0.5515
 epoch: 67, train_loss: 0.4123, test_loss: 1.8826, test_f1: 0.5577
 epoch: 68, train_loss: 0.3858, test_loss: 1.4105, test_f1: 0.5876
 epoch: 69, train_loss: 0.3965, test_loss: 1.6654, test_f1: 0.5497
 epoch: 70, train_loss: 0.3890, test_loss: 1.8705, test_f1: 0.5893
 epoch: 71, train_loss: 0.4107, test_loss: 1.4459, test_f1: 0.6047
 epoch: 72, train_loss: 0.4211, test_loss: 1.6889, test_f1: 0.5640
 epoch: 73, train_loss: 0.4244, test_loss: 1.2929, test_f1: 0.6049
 epoch: 74, train_loss: 0.3785, test_loss: 1.6028, test_f1: 0.5632
 epoch: 75, train_loss: 0.3919, test_loss: 2.0928, test_f1: 0.5527
 epoch: 76, train_loss: 0.3958, test_loss: 2.4183, test_f1: 0.5333
 epoch: 77, train_loss: 0.4138, test_loss: 1.7872, test_f1: 0.5655
 epoch: 78, train_loss: 0.3684, test_loss: 2.5507, test_f1: 0.5776
 epoch: 79, train_loss: 0.3959, test_loss: 1.4625, test_f1: 0.6044
 epoch: 80, train_loss: 0.3939, test_loss: 1.6098, test_f1: 0.5921
 epoch: 81, train_loss: 0.3515, test_loss: 1.4678, test_f1: 0.6329
 epoch: 82, train_loss: 0.3732, test_loss: 1.6936, test_f1: 0.5566
 epoch: 83, train_loss: 0.3636, test_loss: 1.6377, test_f1: 0.6251
 epoch: 84, train_loss: 0.3327, test_loss: 1.9002, test_f1: 0.5411
 epoch: 85, train_loss: 0.3032, test_loss: 2.2451, test_f1: 0.5783
 epoch: 86, train_loss: 0.4611, test_loss: 1.7211, test_f1: 0.5058
 epoch: 87, train_loss: 0.4181, test_loss: 1.5004, test_f1: 0.5953
 epoch: 88, train_loss: 0.4183, test_loss: 1.9149, test_f1: 0.5605
 epoch: 89, train_loss: 0.3708, test_loss: 2.0010, test_f1: 0.5972
 epoch: 90, train_loss: 0.3489, test_loss: 1.8626, test_f1: 0.5971
 epoch: 91, train_loss: 0.3378, test_loss: 1.7621, test_f1: 0.5377
 epoch: 92, train_loss: 0.3312, test_loss: 1.6695, test_f1: 0.5816
 epoch: 93, train_loss: 0.3203, test_loss: 1.6886, test_f1: 0.6295
 epoch: 94, train_loss: 0.3628, test_loss: 2.0322, test_f1: 0.5601
 epoch: 95, train_loss: 0.3343, test_loss: 1.4004, test_f1: 0.6317
 epoch: 96, train_loss: 0.3249, test_loss: 1.6902, test_f1: 0.5997
 epoch: 97, train_loss: 0.2696, test_loss: 1.9611, test_f1: 0.5594
 epoch: 98, train_loss: 0.2980, test_loss: 1.8370, test_f1: 0.5799
 epoch: 99, train_loss: 0.2909, test_loss: 2.0419, test_f1: 0.5834
##################ITERATION #9 ****************************************
 epoch: 0, train_loss: 1.5016, test_loss: 2.0564, test_f1: 0.0519
 epoch: 1, train_loss: 1.0402, test_loss: 1.5319, test_f1: 0.2340
 epoch: 2, train_loss: 0.9969, test_loss: 1.2363, test_f1: 0.3994
 epoch: 3, train_loss: 0.9441, test_loss: 1.0642, test_f1: 0.5153
 epoch: 4, train_loss: 0.9214, test_loss: 1.0771, test_f1: 0.5274
 epoch: 5, train_loss: 0.9032, test_loss: 1.1119, test_f1: 0.4956
 epoch: 6, train_loss: 0.9052, test_loss: 1.0329, test_f1: 0.5041
 epoch: 7, train_loss: 0.8888, test_loss: 1.0651, test_f1: 0.5381
 epoch: 8, train_loss: 0.8581, test_loss: 1.0562, test_f1: 0.5022
 epoch: 9, train_loss: 0.8247, test_loss: 1.0213, test_f1: 0.4820
 epoch: 10, train_loss: 0.8085, test_loss: 1.2881, test_f1: 0.4118
 epoch: 11, train_loss: 0.7775, test_loss: 1.0823, test_f1: 0.4730
 epoch: 12, train_loss: 0.7796, test_loss: 1.3184, test_f1: 0.4318
 epoch: 13, train_loss: 0.7515, test_loss: 1.1005, test_f1: 0.4861
 epoch: 14, train_loss: 0.7311, test_loss: 1.0969, test_f1: 0.4678
 epoch: 15, train_loss: 0.7219, test_loss: 1.1080, test_f1: 0.5815
 epoch: 16, train_loss: 0.7602, test_loss: 1.0842, test_f1: 0.5151
 epoch: 17, train_loss: 0.7649, test_loss: 1.0345, test_f1: 0.4971
 epoch: 18, train_loss: 0.7702, test_loss: 1.2234, test_f1: 0.5452
 epoch: 19, train_loss: 0.7101, test_loss: 1.1463, test_f1: 0.5566
 epoch: 20, train_loss: 0.6932, test_loss: 1.2142, test_f1: 0.5240
 epoch: 21, train_loss: 0.6634, test_loss: 1.4133, test_f1: 0.5194
 epoch: 22, train_loss: 0.6877, test_loss: 1.0823, test_f1: 0.5426
 epoch: 23, train_loss: 0.6726, test_loss: 1.3127, test_f1: 0.4995
 epoch: 24, train_loss: 0.6530, test_loss: 1.2005, test_f1: 0.5531
 epoch: 25, train_loss: 0.6688, test_loss: 1.3735, test_f1: 0.5049
 epoch: 26, train_loss: 0.6679, test_loss: 1.2549, test_f1: 0.5751
 epoch: 27, train_loss: 0.6346, test_loss: 1.2442, test_f1: 0.5678
 epoch: 28, train_loss: 0.6179, test_loss: 1.0828, test_f1: 0.5851
 epoch: 29, train_loss: 0.6005, test_loss: 1.1490, test_f1: 0.5726
 epoch: 30, train_loss: 0.5922, test_loss: 1.2854, test_f1: 0.5642
 epoch: 31, train_loss: 0.5773, test_loss: 1.3357, test_f1: 0.5316
 epoch: 32, train_loss: 0.6045, test_loss: 1.2863, test_f1: 0.5722
 epoch: 33, train_loss: 0.6086, test_loss: 1.1884, test_f1: 0.5453
 epoch: 34, train_loss: 0.6148, test_loss: 1.6614, test_f1: 0.5469
 epoch: 35, train_loss: 0.6004, test_loss: 1.3415, test_f1: 0.5648
 epoch: 36, train_loss: 0.5956, test_loss: 1.6616, test_f1: 0.5386
 epoch: 37, train_loss: 0.6573, test_loss: 1.5421, test_f1: 0.5248
 epoch: 38, train_loss: 0.5815, test_loss: 1.2910, test_f1: 0.5624
 epoch: 39, train_loss: 0.6096, test_loss: 1.1913, test_f1: 0.5873
 epoch: 40, train_loss: 0.5815, test_loss: 1.1510, test_f1: 0.5859
 epoch: 41, train_loss: 0.5980, test_loss: 4.3288, test_f1: 0.3608
 epoch: 42, train_loss: 0.5611, test_loss: 2.2780, test_f1: 0.3970
 epoch: 43, train_loss: 0.5785, test_loss: 1.4997, test_f1: 0.5491
 epoch: 44, train_loss: 0.6043, test_loss: 1.1908, test_f1: 0.5883
 epoch: 45, train_loss: 0.5566, test_loss: 1.4006, test_f1: 0.4864
 epoch: 46, train_loss: 0.5284, test_loss: 1.7404, test_f1: 0.5149
 epoch: 47, train_loss: 0.5767, test_loss: 1.2479, test_f1: 0.5534
 epoch: 48, train_loss: 0.5580, test_loss: 1.3349, test_f1: 0.5479
 epoch: 49, train_loss: 0.5536, test_loss: 1.3401, test_f1: 0.5631
 epoch: 50, train_loss: 0.5360, test_loss: 1.7978, test_f1: 0.5652
 epoch: 51, train_loss: 0.5297, test_loss: 1.2991, test_f1: 0.6246
 epoch: 52, train_loss: 0.4514, test_loss: 1.4087, test_f1: 0.5590
 epoch: 53, train_loss: 0.4123, test_loss: 1.4679, test_f1: 0.5943
 epoch: 54, train_loss: 0.4174, test_loss: 1.7905, test_f1: 0.5450
 epoch: 55, train_loss: 0.4326, test_loss: 1.4919, test_f1: 0.5791
 epoch: 56, train_loss: 0.4084, test_loss: 1.6830, test_f1: 0.5826
 epoch: 57, train_loss: 0.4147, test_loss: 1.7315, test_f1: 0.5497
 epoch: 58, train_loss: 0.4029, test_loss: 1.9589, test_f1: 0.5284
 epoch: 59, train_loss: 0.4159, test_loss: 1.7745, test_f1: 0.5337
 epoch: 60, train_loss: 0.3792, test_loss: 1.7949, test_f1: 0.5425
 epoch: 61, train_loss: 0.3570, test_loss: 1.6347, test_f1: 0.5782
 epoch: 62, train_loss: 0.3423, test_loss: 1.7855, test_f1: 0.5794
 epoch: 63, train_loss: 0.3578, test_loss: 2.3921, test_f1: 0.4999
 epoch: 64, train_loss: 0.3544, test_loss: 2.0402, test_f1: 0.5615
 epoch: 65, train_loss: 0.3275, test_loss: 1.7893, test_f1: 0.5758
 epoch: 66, train_loss: 0.3511, test_loss: 1.9217, test_f1: 0.5581
 epoch: 67, train_loss: 0.3562, test_loss: 1.9862, test_f1: 0.5109
 epoch: 68, train_loss: 0.3673, test_loss: 1.6276, test_f1: 0.5950
 epoch: 69, train_loss: 0.3544, test_loss: 2.0122, test_f1: 0.5627
 epoch: 70, train_loss: 0.3693, test_loss: 2.3662, test_f1: 0.4799
 epoch: 71, train_loss: 0.3466, test_loss: 1.7528, test_f1: 0.5713
 epoch: 72, train_loss: 0.3297, test_loss: 1.9918, test_f1: 0.5799
 epoch: 73, train_loss: 0.3576, test_loss: 1.9051, test_f1: 0.5865
 epoch: 74, train_loss: 0.3303, test_loss: 1.8202, test_f1: 0.5516
 epoch: 75, train_loss: 0.3171, test_loss: 1.8214, test_f1: 0.5822
 epoch: 76, train_loss: 0.3441, test_loss: 2.3781, test_f1: 0.5510
 epoch: 77, train_loss: 0.3270, test_loss: 2.3601, test_f1: 0.4929
 epoch: 78, train_loss: 0.3520, test_loss: 2.1399, test_f1: 0.5291
 epoch: 79, train_loss: 0.3214, test_loss: 2.1501, test_f1: 0.5654
 epoch: 80, train_loss: 0.2866, test_loss: 2.2221, test_f1: 0.6001
 epoch: 81, train_loss: 0.2947, test_loss: 2.0223, test_f1: 0.5631
 epoch: 82, train_loss: 0.3455, test_loss: 1.8379, test_f1: 0.5703
 epoch: 83, train_loss: 0.2925, test_loss: 2.1831, test_f1: 0.5273
 epoch: 84, train_loss: 0.3227, test_loss: 2.0620, test_f1: 0.5737
 epoch: 85, train_loss: 0.3046, test_loss: 2.4300, test_f1: 0.4981
 epoch: 86, train_loss: 0.2860, test_loss: 2.1612, test_f1: 0.5619
 epoch: 87, train_loss: 0.3330, test_loss: 2.3717, test_f1: 0.5666
 epoch: 88, train_loss: 0.3162, test_loss: 1.8192, test_f1: 0.5761
 epoch: 89, train_loss: 0.2841, test_loss: 1.8274, test_f1: 0.6042
 epoch: 90, train_loss: 0.3080, test_loss: 2.0487, test_f1: 0.5660
 epoch: 91, train_loss: 0.3327, test_loss: 1.9423, test_f1: 0.5598
 epoch: 92, train_loss: 0.3138, test_loss: 2.4155, test_f1: 0.5261
 epoch: 93, train_loss: 0.3556, test_loss: 1.7232, test_f1: 0.6019
 epoch: 94, train_loss: 0.3149, test_loss: 2.2896, test_f1: 0.5654
 epoch: 95, train_loss: 0.2696, test_loss: 2.3588, test_f1: 0.5494
 epoch: 96, train_loss: 0.2553, test_loss: 2.2344, test_f1: 0.5535
 epoch: 97, train_loss: 0.2935, test_loss: 1.8503, test_f1: 0.6043
 epoch: 98, train_loss: 0.2671, test_loss: 1.8883, test_f1: 0.6034
 epoch: 99, train_loss: 0.2700, test_loss: 2.3379, test_f1: 0.5481

Training completed in 540.37 seconds
Best F1: 0.6771 at epoch 81
Mean F1 across iterations: 0.6495  0.0186
========================FINAL RESULTS================================
FEGIN weighted F1: 0.6771  0.0186
python main.py --data ltspice_demos --representation component_pin_net --model FEGIN --layers 6 --hiddens 128 --batch_size 128 --lr 0.01 --emb_size 250 --epochs 100 --save_appendix component_pin_net_L6_H128_BS128_LR0.01_E250 --no_val
-----



STDERR:
  File "main.py", line 370, in <module>
    main()
  File "main.py", line 254, in main
    dataset = dataset_class(
  File "/home/philip/projects/ltspice_examples_code_repo/Circuit-Completion-Using-GNNs/component_classification_with_link_prediction_head/evaluation/FEGIN/kernel/circuit_datasets.py", line 15, in __init__
    self.data, self.slices = torch.load(self.processed_paths[0])
  File "/home/philip/.local/lib/python3.8/site-packages/torch/serialization.py", line 1040, in load
    warnings.warn(
  File "/usr/lib/python3.8/warnings.py", line 109, in _showwarnmsg
    sw(msg.message, msg.category, msg.filename, msg.lineno,
  File "main.py", line 47, in warn_with_traceback
    traceback.print_stack(file=log)
/home/philip/projects/ltspice_examples_code_repo/Circuit-Completion-Using-GNNs/component_classification_with_link_prediction_head/evaluation/FEGIN/kernel/circuit_datasets.py:15: FutureWarning: You are using `torch.load` with `weights_only=False` (the current default value), which uses the default pickle module implicitly. It is possible to construct malicious pickle data which will execute arbitrary code during unpickling (See https://github.com/pytorch/pytorch/blob/main/SECURITY.md#untrusted-models for more details). In a future release, the default value for `weights_only` will be flipped to `True`. This limits the functions that could be executed during unpickling. Arbitrary objects will no longer be allowed to be loaded via this mode unless they are explicitly allowlisted by the user via `torch.serialization.add_safe_globals`. We recommend you start setting `weights_only=True` for any use case where you don't have full control of the loaded file. Please open an issue on GitHub for any issues related to this experimental feature.
  self.data, self.slices = torch.load(self.processed_paths[0])
