STDOUT:
Results will be saved in /home/philip/projects/ltspice_examples_code_repo/Circuit-Completion-Using-GNNs/component_classification_with_link_prediction_head/evaluation/FEGIN/results/model_FEGIN_dataset_ltspice_demos
Command line input: python main.py --data ltspice_demos --representation component_pin_net --model FEGIN --layers 4 --hiddens 64 --batch_size 64 --lr 0.001 --emb_size 128 --epochs 100 --save_appendix component_pin_net_L4_H64_BS64_LR0.001_E128 --no_val
 is saved.
-----
ltspice_demos - FEGIN
Using 4 layers, 64 hidden units, h = 2
Loading component_pin_net representation dataset
ENTERED
Training FEGIN on component_pin_net representation
Train: 1565, Test: 383
##################ITERATION #0 ****************************************
 epoch: 0, train_loss: 1.2779, test_loss: 1.3108, test_f1: 0.3232
 epoch: 1, train_loss: 1.0867, test_loss: 1.2132, test_f1: 0.4227
 epoch: 2, train_loss: 1.0212, test_loss: 1.1495, test_f1: 0.4493
 epoch: 3, train_loss: 0.9888, test_loss: 1.0907, test_f1: 0.4493
 epoch: 4, train_loss: 0.9602, test_loss: 1.0670, test_f1: 0.4419
 epoch: 5, train_loss: 0.9457, test_loss: 1.0940, test_f1: 0.4815
 epoch: 6, train_loss: 0.9351, test_loss: 1.1182, test_f1: 0.5284
 epoch: 7, train_loss: 0.9150, test_loss: 1.2494, test_f1: 0.4845
 epoch: 8, train_loss: 0.8942, test_loss: 1.0126, test_f1: 0.5543
 epoch: 9, train_loss: 0.8914, test_loss: 1.0244, test_f1: 0.5732
 epoch: 10, train_loss: 0.8702, test_loss: 1.0313, test_f1: 0.5814
 epoch: 11, train_loss: 0.8421, test_loss: 1.0215, test_f1: 0.5259
 epoch: 12, train_loss: 0.8184, test_loss: 1.0583, test_f1: 0.5641
 epoch: 13, train_loss: 0.8036, test_loss: 1.0172, test_f1: 0.5933
 epoch: 14, train_loss: 0.7877, test_loss: 1.0238, test_f1: 0.6066
 epoch: 15, train_loss: 0.7581, test_loss: 1.0547, test_f1: 0.5870
 epoch: 16, train_loss: 0.7488, test_loss: 1.0712, test_f1: 0.5468
 epoch: 17, train_loss: 0.7013, test_loss: 1.0210, test_f1: 0.6388
 epoch: 18, train_loss: 0.6764, test_loss: 1.1214, test_f1: 0.6128
 epoch: 19, train_loss: 0.6974, test_loss: 1.0561, test_f1: 0.6131
 epoch: 20, train_loss: 0.6875, test_loss: 1.0491, test_f1: 0.6113
 epoch: 21, train_loss: 0.6691, test_loss: 1.0747, test_f1: 0.6338
 epoch: 22, train_loss: 0.6339, test_loss: 1.0741, test_f1: 0.6318
 epoch: 23, train_loss: 0.5915, test_loss: 1.0555, test_f1: 0.6451
 epoch: 24, train_loss: 0.6107, test_loss: 1.1321, test_f1: 0.5559
 epoch: 25, train_loss: 0.5869, test_loss: 1.0751, test_f1: 0.6603
 epoch: 26, train_loss: 0.5731, test_loss: 1.2386, test_f1: 0.5860
 epoch: 27, train_loss: 0.5672, test_loss: 1.0759, test_f1: 0.6284
 epoch: 28, train_loss: 0.5376, test_loss: 1.2161, test_f1: 0.6673
 epoch: 29, train_loss: 0.5262, test_loss: 1.1505, test_f1: 0.6429
 epoch: 30, train_loss: 0.5357, test_loss: 1.3348, test_f1: 0.5732
 epoch: 31, train_loss: 0.5000, test_loss: 1.2124, test_f1: 0.6284
 epoch: 32, train_loss: 0.4785, test_loss: 1.2729, test_f1: 0.6472
 epoch: 33, train_loss: 0.5316, test_loss: 1.3124, test_f1: 0.6348
 epoch: 34, train_loss: 0.4959, test_loss: 1.3471, test_f1: 0.6542
 epoch: 35, train_loss: 0.4614, test_loss: 1.3307, test_f1: 0.6190
 epoch: 36, train_loss: 0.4526, test_loss: 1.5584, test_f1: 0.5754
 epoch: 37, train_loss: 0.4427, test_loss: 1.4347, test_f1: 0.6358
 epoch: 38, train_loss: 0.4414, test_loss: 1.4813, test_f1: 0.6157
 epoch: 39, train_loss: 0.4072, test_loss: 1.5436, test_f1: 0.5951
 epoch: 40, train_loss: 0.4562, test_loss: 1.5222, test_f1: 0.6347
 epoch: 41, train_loss: 0.4118, test_loss: 1.5601, test_f1: 0.6229
 epoch: 42, train_loss: 0.3953, test_loss: 1.4906, test_f1: 0.6087
 epoch: 43, train_loss: 0.3810, test_loss: 1.5584, test_f1: 0.6363
 epoch: 44, train_loss: 0.3685, test_loss: 1.8253, test_f1: 0.5632
 epoch: 45, train_loss: 0.3667, test_loss: 1.7224, test_f1: 0.6375
 epoch: 46, train_loss: 0.3705, test_loss: 1.8092, test_f1: 0.5924
 epoch: 47, train_loss: 0.3624, test_loss: 1.7538, test_f1: 0.6245
 epoch: 48, train_loss: 0.3620, test_loss: 1.6580, test_f1: 0.6472
 epoch: 49, train_loss: 0.3217, test_loss: 1.9219, test_f1: 0.6357
 epoch: 50, train_loss: 0.3222, test_loss: 2.0542, test_f1: 0.6312
 epoch: 51, train_loss: 0.2679, test_loss: 1.9409, test_f1: 0.6329
 epoch: 52, train_loss: 0.2645, test_loss: 2.0536, test_f1: 0.6031
 epoch: 53, train_loss: 0.2668, test_loss: 1.9887, test_f1: 0.6162
 epoch: 54, train_loss: 0.2448, test_loss: 2.0899, test_f1: 0.6046
 epoch: 55, train_loss: 0.2388, test_loss: 1.9709, test_f1: 0.6108
 epoch: 56, train_loss: 0.2327, test_loss: 2.1951, test_f1: 0.6334
 epoch: 57, train_loss: 0.2342, test_loss: 2.0759, test_f1: 0.6407
 epoch: 58, train_loss: 0.2137, test_loss: 2.2167, test_f1: 0.6381
 epoch: 59, train_loss: 0.2446, test_loss: 2.4381, test_f1: 0.6035
 epoch: 60, train_loss: 0.2509, test_loss: 2.3438, test_f1: 0.6172
 epoch: 61, train_loss: 0.2460, test_loss: 2.2677, test_f1: 0.6019
 epoch: 62, train_loss: 0.2108, test_loss: 2.2825, test_f1: 0.6016
 epoch: 63, train_loss: 0.2053, test_loss: 2.3440, test_f1: 0.6225
 epoch: 64, train_loss: 0.1974, test_loss: 2.3744, test_f1: 0.6341
 epoch: 65, train_loss: 0.1886, test_loss: 2.3845, test_f1: 0.6212
 epoch: 66, train_loss: 0.2069, test_loss: 2.3087, test_f1: 0.6352
 epoch: 67, train_loss: 0.2067, test_loss: 2.3206, test_f1: 0.5998
 epoch: 68, train_loss: 0.1759, test_loss: 2.3968, test_f1: 0.6161
 epoch: 69, train_loss: 0.2010, test_loss: 2.5453, test_f1: 0.6094
 epoch: 70, train_loss: 0.2251, test_loss: 2.7007, test_f1: 0.6186
 epoch: 71, train_loss: 0.1923, test_loss: 2.4849, test_f1: 0.6129
 epoch: 72, train_loss: 0.1820, test_loss: 2.4736, test_f1: 0.6203
 epoch: 73, train_loss: 0.1944, test_loss: 2.7774, test_f1: 0.5987
 epoch: 74, train_loss: 0.2230, test_loss: 2.4964, test_f1: 0.6189
 epoch: 75, train_loss: 0.1944, test_loss: 2.6055, test_f1: 0.6375
 epoch: 76, train_loss: 0.1686, test_loss: 2.5381, test_f1: 0.6235
 epoch: 77, train_loss: 0.1589, test_loss: 2.7372, test_f1: 0.6120
 epoch: 78, train_loss: 0.1562, test_loss: 2.5473, test_f1: 0.6107
 epoch: 79, train_loss: 0.1508, test_loss: 2.7630, test_f1: 0.6020
 epoch: 80, train_loss: 0.1465, test_loss: 2.9063, test_f1: 0.5960
 epoch: 81, train_loss: 0.1486, test_loss: 2.9494, test_f1: 0.5951
 epoch: 82, train_loss: 0.1474, test_loss: 2.7468, test_f1: 0.6099
 epoch: 83, train_loss: 0.1362, test_loss: 2.9633, test_f1: 0.6042
 epoch: 84, train_loss: 0.1432, test_loss: 2.9544, test_f1: 0.6274
 epoch: 85, train_loss: 0.1507, test_loss: 3.1473, test_f1: 0.5911
 epoch: 86, train_loss: 0.1460, test_loss: 2.8405, test_f1: 0.6092
 epoch: 87, train_loss: 0.1442, test_loss: 2.8285, test_f1: 0.6168
 epoch: 88, train_loss: 0.1306, test_loss: 3.0349, test_f1: 0.6029
 epoch: 89, train_loss: 0.1431, test_loss: 3.0797, test_f1: 0.6067
 epoch: 90, train_loss: 0.1446, test_loss: 2.9942, test_f1: 0.6001
 epoch: 91, train_loss: 0.1582, test_loss: 3.2554, test_f1: 0.6187
 epoch: 92, train_loss: 0.1537, test_loss: 3.1649, test_f1: 0.6220
 epoch: 93, train_loss: 0.1406, test_loss: 3.2483, test_f1: 0.6297
 epoch: 94, train_loss: 0.1491, test_loss: 3.0446, test_f1: 0.6018
 epoch: 95, train_loss: 0.1442, test_loss: 3.0414, test_f1: 0.6122
 epoch: 96, train_loss: 0.1267, test_loss: 3.1909, test_f1: 0.6175
 epoch: 97, train_loss: 0.1324, test_loss: 3.3498, test_f1: 0.6198
 epoch: 98, train_loss: 0.1328, test_loss: 3.0469, test_f1: 0.6226
 epoch: 99, train_loss: 0.1179, test_loss: 3.2571, test_f1: 0.6283
##################ITERATION #1 ****************************************
 epoch: 0, train_loss: 1.1248, test_loss: 2.2475, test_f1: 0.0301
 epoch: 1, train_loss: 1.0050, test_loss: 2.2357, test_f1: 0.1470
 epoch: 2, train_loss: 0.9642, test_loss: 1.0810, test_f1: 0.4599
 epoch: 3, train_loss: 0.9498, test_loss: 1.0124, test_f1: 0.5580
 epoch: 4, train_loss: 0.9185, test_loss: 1.0124, test_f1: 0.5544
 epoch: 5, train_loss: 0.8957, test_loss: 0.9826, test_f1: 0.5587
 epoch: 6, train_loss: 0.8627, test_loss: 1.0204, test_f1: 0.5208
 epoch: 7, train_loss: 0.8696, test_loss: 1.0067, test_f1: 0.5648
 epoch: 8, train_loss: 0.8355, test_loss: 1.0900, test_f1: 0.5251
 epoch: 9, train_loss: 0.8084, test_loss: 1.0283, test_f1: 0.5600
 epoch: 10, train_loss: 0.7952, test_loss: 1.0347, test_f1: 0.5505
 epoch: 11, train_loss: 0.7653, test_loss: 1.0564, test_f1: 0.5944
 epoch: 12, train_loss: 0.7585, test_loss: 1.0737, test_f1: 0.5622
 epoch: 13, train_loss: 0.7127, test_loss: 1.0304, test_f1: 0.6080
 epoch: 14, train_loss: 0.7024, test_loss: 1.0431, test_f1: 0.5972
 epoch: 15, train_loss: 0.6611, test_loss: 1.0965, test_f1: 0.6170
 epoch: 16, train_loss: 0.6618, test_loss: 1.0431, test_f1: 0.6007
 epoch: 17, train_loss: 0.6443, test_loss: 1.1758, test_f1: 0.5458
 epoch: 18, train_loss: 0.6167, test_loss: 1.1090, test_f1: 0.6013
 epoch: 19, train_loss: 0.5999, test_loss: 1.1162, test_f1: 0.6180
 epoch: 20, train_loss: 0.5929, test_loss: 1.1908, test_f1: 0.6325
 epoch: 21, train_loss: 0.5806, test_loss: 1.1247, test_f1: 0.6100
 epoch: 22, train_loss: 0.5660, test_loss: 1.2427, test_f1: 0.6107
 epoch: 23, train_loss: 0.5544, test_loss: 1.1764, test_f1: 0.6030
 epoch: 24, train_loss: 0.5530, test_loss: 1.1970, test_f1: 0.6393
 epoch: 25, train_loss: 0.5201, test_loss: 1.3108, test_f1: 0.6046
 epoch: 26, train_loss: 0.5279, test_loss: 1.2415, test_f1: 0.6487
 epoch: 27, train_loss: 0.5025, test_loss: 1.2688, test_f1: 0.6052
 epoch: 28, train_loss: 0.4792, test_loss: 1.3564, test_f1: 0.6319
 epoch: 29, train_loss: 0.4779, test_loss: 1.4267, test_f1: 0.5942
 epoch: 30, train_loss: 0.4689, test_loss: 1.2048, test_f1: 0.6117
 epoch: 31, train_loss: 0.4595, test_loss: 1.4763, test_f1: 0.6056
 epoch: 32, train_loss: 0.4445, test_loss: 1.3983, test_f1: 0.6521
 epoch: 33, train_loss: 0.4292, test_loss: 1.4674, test_f1: 0.6167
 epoch: 34, train_loss: 0.3942, test_loss: 1.4202, test_f1: 0.6174
 epoch: 35, train_loss: 0.4184, test_loss: 1.3804, test_f1: 0.6575
 epoch: 36, train_loss: 0.4208, test_loss: 1.4948, test_f1: 0.6021
 epoch: 37, train_loss: 0.4194, test_loss: 1.4468, test_f1: 0.6303
 epoch: 38, train_loss: 0.3919, test_loss: 1.4845, test_f1: 0.6367
 epoch: 39, train_loss: 0.3772, test_loss: 1.4293, test_f1: 0.6277
 epoch: 40, train_loss: 0.4105, test_loss: 1.7605, test_f1: 0.5755
 epoch: 41, train_loss: 0.3723, test_loss: 1.4323, test_f1: 0.6394
 epoch: 42, train_loss: 0.4024, test_loss: 1.5188, test_f1: 0.6195
 epoch: 43, train_loss: 0.3389, test_loss: 1.6416, test_f1: 0.5957
 epoch: 44, train_loss: 0.3442, test_loss: 1.6854, test_f1: 0.6351
 epoch: 45, train_loss: 0.3324, test_loss: 1.6961, test_f1: 0.6544
 epoch: 46, train_loss: 0.3369, test_loss: 1.7381, test_f1: 0.6125
 epoch: 47, train_loss: 0.3141, test_loss: 1.7649, test_f1: 0.6179
 epoch: 48, train_loss: 0.3289, test_loss: 1.8361, test_f1: 0.6162
 epoch: 49, train_loss: 0.3616, test_loss: 1.7831, test_f1: 0.5834
 epoch: 50, train_loss: 0.3022, test_loss: 1.8468, test_f1: 0.6247
 epoch: 51, train_loss: 0.2662, test_loss: 1.9019, test_f1: 0.6054
 epoch: 52, train_loss: 0.2448, test_loss: 1.7699, test_f1: 0.6554
 epoch: 53, train_loss: 0.2390, test_loss: 1.9483, test_f1: 0.6050
 epoch: 54, train_loss: 0.2219, test_loss: 1.9808, test_f1: 0.6469
 epoch: 55, train_loss: 0.2372, test_loss: 1.9715, test_f1: 0.6440
 epoch: 56, train_loss: 0.2229, test_loss: 2.1522, test_f1: 0.6206
 epoch: 57, train_loss: 0.2117, test_loss: 2.0637, test_f1: 0.6216
 epoch: 58, train_loss: 0.2049, test_loss: 2.0820, test_f1: 0.6169
 epoch: 59, train_loss: 0.1956, test_loss: 2.2636, test_f1: 0.6023
 epoch: 60, train_loss: 0.2100, test_loss: 2.2414, test_f1: 0.6212
 epoch: 61, train_loss: 0.1849, test_loss: 2.1362, test_f1: 0.6302
 epoch: 62, train_loss: 0.1899, test_loss: 2.1938, test_f1: 0.6233
 epoch: 63, train_loss: 0.1836, test_loss: 2.1530, test_f1: 0.6285
 epoch: 64, train_loss: 0.1821, test_loss: 2.3779, test_f1: 0.6097
 epoch: 65, train_loss: 0.1841, test_loss: 2.2830, test_f1: 0.6332
 epoch: 66, train_loss: 0.1644, test_loss: 2.4150, test_f1: 0.6349
 epoch: 67, train_loss: 0.1741, test_loss: 2.4403, test_f1: 0.6015
 epoch: 68, train_loss: 0.1819, test_loss: 2.4775, test_f1: 0.6188
 epoch: 69, train_loss: 0.1606, test_loss: 2.4724, test_f1: 0.6217
 epoch: 70, train_loss: 0.1567, test_loss: 2.5153, test_f1: 0.6200
 epoch: 71, train_loss: 0.1549, test_loss: 2.5340, test_f1: 0.6123
 epoch: 72, train_loss: 0.1732, test_loss: 2.6347, test_f1: 0.6074
 epoch: 73, train_loss: 0.1765, test_loss: 2.6304, test_f1: 0.6178
 epoch: 74, train_loss: 0.1743, test_loss: 2.5007, test_f1: 0.5960
 epoch: 75, train_loss: 0.1516, test_loss: 2.5619, test_f1: 0.6191
 epoch: 76, train_loss: 0.1643, test_loss: 2.6608, test_f1: 0.6055
 epoch: 77, train_loss: 0.1385, test_loss: 2.7227, test_f1: 0.6090
 epoch: 78, train_loss: 0.1412, test_loss: 2.6854, test_f1: 0.6174
 epoch: 79, train_loss: 0.1456, test_loss: 2.8633, test_f1: 0.5958
 epoch: 80, train_loss: 0.1522, test_loss: 2.6352, test_f1: 0.6480
 epoch: 81, train_loss: 0.1494, test_loss: 2.7164, test_f1: 0.6252
 epoch: 82, train_loss: 0.1387, test_loss: 2.6942, test_f1: 0.6196
 epoch: 83, train_loss: 0.1396, test_loss: 2.6031, test_f1: 0.6253
 epoch: 84, train_loss: 0.1191, test_loss: 2.7288, test_f1: 0.6398
 epoch: 85, train_loss: 0.1268, test_loss: 3.0940, test_f1: 0.6119
 epoch: 86, train_loss: 0.1425, test_loss: 3.0191, test_f1: 0.6040
 epoch: 87, train_loss: 0.1574, test_loss: 2.9463, test_f1: 0.6343
 epoch: 88, train_loss: 0.1520, test_loss: 2.8284, test_f1: 0.6090
 epoch: 89, train_loss: 0.1188, test_loss: 2.7004, test_f1: 0.6541
 epoch: 90, train_loss: 0.1379, test_loss: 2.8518, test_f1: 0.6080
 epoch: 91, train_loss: 0.1385, test_loss: 2.8841, test_f1: 0.6314
 epoch: 92, train_loss: 0.1260, test_loss: 2.8258, test_f1: 0.6185
 epoch: 93, train_loss: 0.1111, test_loss: 2.7137, test_f1: 0.6507
 epoch: 94, train_loss: 0.1170, test_loss: 2.8131, test_f1: 0.6410
 epoch: 95, train_loss: 0.1348, test_loss: 3.0662, test_f1: 0.6277
 epoch: 96, train_loss: 0.1301, test_loss: 3.1480, test_f1: 0.6170
 epoch: 97, train_loss: 0.1125, test_loss: 2.8131, test_f1: 0.6259
 epoch: 98, train_loss: 0.1221, test_loss: 3.1454, test_f1: 0.6096
 epoch: 99, train_loss: 0.1124, test_loss: 3.3822, test_f1: 0.5993
##################ITERATION #2 ****************************************
 epoch: 0, train_loss: 1.1745, test_loss: 1.2841, test_f1: 0.1365
 epoch: 1, train_loss: 0.9860, test_loss: 1.2775, test_f1: 0.3244
 epoch: 2, train_loss: 0.9367, test_loss: 1.0531, test_f1: 0.4895
 epoch: 3, train_loss: 0.8965, test_loss: 1.0575, test_f1: 0.5211
 epoch: 4, train_loss: 0.8722, test_loss: 1.0182, test_f1: 0.5474
 epoch: 5, train_loss: 0.8479, test_loss: 1.0427, test_f1: 0.5608
 epoch: 6, train_loss: 0.8136, test_loss: 1.0639, test_f1: 0.5150
 epoch: 7, train_loss: 0.7890, test_loss: 1.1141, test_f1: 0.5212
 epoch: 8, train_loss: 0.7941, test_loss: 1.0189, test_f1: 0.5638
 epoch: 9, train_loss: 0.7602, test_loss: 1.0411, test_f1: 0.5754
 epoch: 10, train_loss: 0.7298, test_loss: 1.0580, test_f1: 0.5383
 epoch: 11, train_loss: 0.7045, test_loss: 1.0488, test_f1: 0.5678
 epoch: 12, train_loss: 0.6962, test_loss: 1.1041, test_f1: 0.5844
 epoch: 13, train_loss: 0.6614, test_loss: 1.1373, test_f1: 0.5879
 epoch: 14, train_loss: 0.6770, test_loss: 1.2113, test_f1: 0.4978
 epoch: 15, train_loss: 0.6572, test_loss: 1.1796, test_f1: 0.6042
 epoch: 16, train_loss: 0.6406, test_loss: 1.0899, test_f1: 0.6335
 epoch: 17, train_loss: 0.6367, test_loss: 1.1422, test_f1: 0.6334
 epoch: 18, train_loss: 0.6232, test_loss: 1.1263, test_f1: 0.5802
 epoch: 19, train_loss: 0.6069, test_loss: 1.1349, test_f1: 0.6447
 epoch: 20, train_loss: 0.5701, test_loss: 1.2670, test_f1: 0.5878
 epoch: 21, train_loss: 0.5607, test_loss: 1.2649, test_f1: 0.5911
 epoch: 22, train_loss: 0.5741, test_loss: 1.3253, test_f1: 0.5916
 epoch: 23, train_loss: 0.5425, test_loss: 1.2866, test_f1: 0.5795
 epoch: 24, train_loss: 0.5395, test_loss: 1.2177, test_f1: 0.6495
 epoch: 25, train_loss: 0.5328, test_loss: 1.3108, test_f1: 0.5858
 epoch: 26, train_loss: 0.5040, test_loss: 1.4453, test_f1: 0.5568
 epoch: 27, train_loss: 0.5041, test_loss: 1.2897, test_f1: 0.6164
 epoch: 28, train_loss: 0.4924, test_loss: 1.3811, test_f1: 0.5630
 epoch: 29, train_loss: 0.4762, test_loss: 1.3210, test_f1: 0.6055
 epoch: 30, train_loss: 0.4589, test_loss: 1.4789, test_f1: 0.6018
 epoch: 31, train_loss: 0.4585, test_loss: 1.4313, test_f1: 0.6443
 epoch: 32, train_loss: 0.4707, test_loss: 1.6343, test_f1: 0.6079
 epoch: 33, train_loss: 0.4459, test_loss: 1.4331, test_f1: 0.6064
 epoch: 34, train_loss: 0.4504, test_loss: 1.5954, test_f1: 0.6034
 epoch: 35, train_loss: 0.4254, test_loss: 1.5266, test_f1: 0.5905
 epoch: 36, train_loss: 0.4131, test_loss: 1.5461, test_f1: 0.6300
 epoch: 37, train_loss: 0.4169, test_loss: 1.5415, test_f1: 0.5962
 epoch: 38, train_loss: 0.4223, test_loss: 1.5704, test_f1: 0.6108
 epoch: 39, train_loss: 0.4064, test_loss: 1.5138, test_f1: 0.6524
 epoch: 40, train_loss: 0.3976, test_loss: 1.6310, test_f1: 0.5988
 epoch: 41, train_loss: 0.4012, test_loss: 1.6451, test_f1: 0.5712
 epoch: 42, train_loss: 0.3919, test_loss: 1.7026, test_f1: 0.6095
 epoch: 43, train_loss: 0.3925, test_loss: 1.7156, test_f1: 0.5869
 epoch: 44, train_loss: 0.3974, test_loss: 1.7007, test_f1: 0.6543
 epoch: 45, train_loss: 0.3519, test_loss: 1.9809, test_f1: 0.5513
 epoch: 46, train_loss: 0.3512, test_loss: 1.7794, test_f1: 0.6005
 epoch: 47, train_loss: 0.3679, test_loss: 1.8327, test_f1: 0.6196
 epoch: 48, train_loss: 0.3222, test_loss: 1.8222, test_f1: 0.6291
 epoch: 49, train_loss: 0.3584, test_loss: 1.9666, test_f1: 0.6061
 epoch: 50, train_loss: 0.3570, test_loss: 1.6864, test_f1: 0.6388
 epoch: 51, train_loss: 0.2881, test_loss: 1.9988, test_f1: 0.6336
 epoch: 52, train_loss: 0.2631, test_loss: 1.9773, test_f1: 0.6373
 epoch: 53, train_loss: 0.2419, test_loss: 2.0082, test_f1: 0.6335
 epoch: 54, train_loss: 0.2471, test_loss: 2.1101, test_f1: 0.6271
 epoch: 55, train_loss: 0.2520, test_loss: 2.1125, test_f1: 0.6276
 epoch: 56, train_loss: 0.2458, test_loss: 2.0706, test_f1: 0.6077
 epoch: 57, train_loss: 0.2502, test_loss: 2.0653, test_f1: 0.6373
 epoch: 58, train_loss: 0.2108, test_loss: 2.2941, test_f1: 0.6056
 epoch: 59, train_loss: 0.2176, test_loss: 2.2924, test_f1: 0.6403
 epoch: 60, train_loss: 0.2187, test_loss: 2.3695, test_f1: 0.6029
 epoch: 61, train_loss: 0.2385, test_loss: 2.1805, test_f1: 0.6299
 epoch: 62, train_loss: 0.2281, test_loss: 2.3761, test_f1: 0.6343
 epoch: 63, train_loss: 0.2129, test_loss: 2.2669, test_f1: 0.6162
 epoch: 64, train_loss: 0.1858, test_loss: 2.3537, test_f1: 0.6437
 epoch: 65, train_loss: 0.2012, test_loss: 2.4791, test_f1: 0.6092
 epoch: 66, train_loss: 0.1940, test_loss: 2.4668, test_f1: 0.6248
 epoch: 67, train_loss: 0.1921, test_loss: 2.5707, test_f1: 0.6111
 epoch: 68, train_loss: 0.1759, test_loss: 2.4332, test_f1: 0.6417
 epoch: 69, train_loss: 0.1927, test_loss: 2.5434, test_f1: 0.6243
 epoch: 70, train_loss: 0.1871, test_loss: 2.5077, test_f1: 0.6172
 epoch: 71, train_loss: 0.1711, test_loss: 2.5447, test_f1: 0.6153
 epoch: 72, train_loss: 0.1598, test_loss: 2.6970, test_f1: 0.6091
 epoch: 73, train_loss: 0.1721, test_loss: 2.8041, test_f1: 0.6171
 epoch: 74, train_loss: 0.1770, test_loss: 2.6185, test_f1: 0.6386
 epoch: 75, train_loss: 0.1588, test_loss: 2.6353, test_f1: 0.6287
 epoch: 76, train_loss: 0.1656, test_loss: 2.6819, test_f1: 0.6455
 epoch: 77, train_loss: 0.2045, test_loss: 2.9864, test_f1: 0.5776
 epoch: 78, train_loss: 0.1815, test_loss: 2.4759, test_f1: 0.6137
 epoch: 79, train_loss: 0.1817, test_loss: 2.6738, test_f1: 0.6258
 epoch: 80, train_loss: 0.1860, test_loss: 2.7990, test_f1: 0.5972
 epoch: 81, train_loss: 0.1757, test_loss: 2.6415, test_f1: 0.6305
 epoch: 82, train_loss: 0.1802, test_loss: 2.9206, test_f1: 0.6227
 epoch: 83, train_loss: 0.1647, test_loss: 2.7641, test_f1: 0.6206
 epoch: 84, train_loss: 0.1441, test_loss: 2.7104, test_f1: 0.6153
 epoch: 85, train_loss: 0.1531, test_loss: 2.8222, test_f1: 0.6134
 epoch: 86, train_loss: 0.1468, test_loss: 3.1059, test_f1: 0.6177
 epoch: 87, train_loss: 0.1446, test_loss: 3.0597, test_f1: 0.6013
 epoch: 88, train_loss: 0.1149, test_loss: 2.7806, test_f1: 0.6334
 epoch: 89, train_loss: 0.1371, test_loss: 2.8703, test_f1: 0.6224
 epoch: 90, train_loss: 0.1117, test_loss: 3.1605, test_f1: 0.6100
 epoch: 91, train_loss: 0.1364, test_loss: 2.9377, test_f1: 0.6524
 epoch: 92, train_loss: 0.1339, test_loss: 3.0761, test_f1: 0.6189
 epoch: 93, train_loss: 0.1481, test_loss: 3.1548, test_f1: 0.6254
 epoch: 94, train_loss: 0.1303, test_loss: 2.9803, test_f1: 0.6400
 epoch: 95, train_loss: 0.1478, test_loss: 2.8551, test_f1: 0.6354
 epoch: 96, train_loss: 0.1248, test_loss: 3.0503, test_f1: 0.6466
 epoch: 97, train_loss: 0.1506, test_loss: 3.0409, test_f1: 0.6247
 epoch: 98, train_loss: 0.1343, test_loss: 3.0915, test_f1: 0.6143
 epoch: 99, train_loss: 0.1416, test_loss: 3.2348, test_f1: 0.6190
##################ITERATION #3 ****************************************
 epoch: 0, train_loss: 1.1621, test_loss: 1.2689, test_f1: 0.3648
 epoch: 1, train_loss: 0.9884, test_loss: 1.1588, test_f1: 0.4332
 epoch: 2, train_loss: 0.9390, test_loss: 1.0249, test_f1: 0.5305
 epoch: 3, train_loss: 0.8856, test_loss: 1.0127, test_f1: 0.5459
 epoch: 4, train_loss: 0.8606, test_loss: 1.0533, test_f1: 0.5391
 epoch: 5, train_loss: 0.8182, test_loss: 1.0056, test_f1: 0.5994
 epoch: 6, train_loss: 0.8126, test_loss: 1.0347, test_f1: 0.5752
 epoch: 7, train_loss: 0.7954, test_loss: 1.0455, test_f1: 0.5662
 epoch: 8, train_loss: 0.7590, test_loss: 1.0749, test_f1: 0.5612
 epoch: 9, train_loss: 0.7416, test_loss: 1.0911, test_f1: 0.5441
 epoch: 10, train_loss: 0.7305, test_loss: 1.0468, test_f1: 0.6168
 epoch: 11, train_loss: 0.7129, test_loss: 1.1701, test_f1: 0.5324
 epoch: 12, train_loss: 0.6780, test_loss: 1.1650, test_f1: 0.6200
 epoch: 13, train_loss: 0.6737, test_loss: 1.0919, test_f1: 0.6102
 epoch: 14, train_loss: 0.6449, test_loss: 1.1885, test_f1: 0.6088
 epoch: 15, train_loss: 0.5971, test_loss: 1.1418, test_f1: 0.6598
 epoch: 16, train_loss: 0.6177, test_loss: 1.3325, test_f1: 0.4985
 epoch: 17, train_loss: 0.6212, test_loss: 1.2393, test_f1: 0.6251
 epoch: 18, train_loss: 0.5875, test_loss: 1.1071, test_f1: 0.6407
 epoch: 19, train_loss: 0.5764, test_loss: 1.2455, test_f1: 0.6230
 epoch: 20, train_loss: 0.5783, test_loss: 1.2942, test_f1: 0.6220
 epoch: 21, train_loss: 0.5407, test_loss: 1.2905, test_f1: 0.6105
 epoch: 22, train_loss: 0.5310, test_loss: 1.2553, test_f1: 0.6224
 epoch: 23, train_loss: 0.5109, test_loss: 1.3417, test_f1: 0.6300
 epoch: 24, train_loss: 0.4865, test_loss: 1.4211, test_f1: 0.6485
 epoch: 25, train_loss: 0.4918, test_loss: 1.2887, test_f1: 0.6120
 epoch: 26, train_loss: 0.4638, test_loss: 1.4628, test_f1: 0.6149
 epoch: 27, train_loss: 0.4500, test_loss: 1.4036, test_f1: 0.6447
 epoch: 28, train_loss: 0.4530, test_loss: 1.5942, test_f1: 0.5768
 epoch: 29, train_loss: 0.4449, test_loss: 1.5981, test_f1: 0.6068
 epoch: 30, train_loss: 0.4727, test_loss: 1.5959, test_f1: 0.6224
 epoch: 31, train_loss: 0.4599, test_loss: 1.6289, test_f1: 0.5940
 epoch: 32, train_loss: 0.4036, test_loss: 1.5203, test_f1: 0.6307
 epoch: 33, train_loss: 0.3893, test_loss: 1.5230, test_f1: 0.6205
 epoch: 34, train_loss: 0.3761, test_loss: 1.7106, test_f1: 0.6346
 epoch: 35, train_loss: 0.3978, test_loss: 1.7446, test_f1: 0.6092
 epoch: 36, train_loss: 0.3812, test_loss: 1.7930, test_f1: 0.6346
 epoch: 37, train_loss: 0.4235, test_loss: 1.6573, test_f1: 0.6324
 epoch: 38, train_loss: 0.4505, test_loss: 1.7178, test_f1: 0.5915
 epoch: 39, train_loss: 0.3625, test_loss: 1.6612, test_f1: 0.6259
 epoch: 40, train_loss: 0.3551, test_loss: 1.7065, test_f1: 0.6368
 epoch: 41, train_loss: 0.3284, test_loss: 1.7700, test_f1: 0.6268
 epoch: 42, train_loss: 0.3219, test_loss: 1.9404, test_f1: 0.6099
 epoch: 43, train_loss: 0.3054, test_loss: 1.8793, test_f1: 0.6471
 epoch: 44, train_loss: 0.3513, test_loss: 2.1780, test_f1: 0.5520
 epoch: 45, train_loss: 0.3319, test_loss: 1.8978, test_f1: 0.6156
 epoch: 46, train_loss: 0.3389, test_loss: 1.8188, test_f1: 0.6216
 epoch: 47, train_loss: 0.3232, test_loss: 2.2762, test_f1: 0.5743
 epoch: 48, train_loss: 0.3062, test_loss: 1.8447, test_f1: 0.6461
 epoch: 49, train_loss: 0.2884, test_loss: 2.0282, test_f1: 0.6363
 epoch: 50, train_loss: 0.3101, test_loss: 2.0028, test_f1: 0.6332
 epoch: 51, train_loss: 0.2638, test_loss: 2.0949, test_f1: 0.6129
 epoch: 52, train_loss: 0.2265, test_loss: 2.2315, test_f1: 0.5669
 epoch: 53, train_loss: 0.2123, test_loss: 2.2045, test_f1: 0.6207
 epoch: 54, train_loss: 0.1973, test_loss: 2.0637, test_f1: 0.6341
 epoch: 55, train_loss: 0.2014, test_loss: 2.1761, test_f1: 0.6427
 epoch: 56, train_loss: 0.2226, test_loss: 2.2143, test_f1: 0.6341
 epoch: 57, train_loss: 0.1983, test_loss: 2.1552, test_f1: 0.6344
 epoch: 58, train_loss: 0.1763, test_loss: 2.3646, test_f1: 0.6037
 epoch: 59, train_loss: 0.1665, test_loss: 2.3164, test_f1: 0.6292
 epoch: 60, train_loss: 0.1761, test_loss: 2.3611, test_f1: 0.6457
 epoch: 61, train_loss: 0.1862, test_loss: 2.3496, test_f1: 0.6363
 epoch: 62, train_loss: 0.1804, test_loss: 2.5242, test_f1: 0.6033
 epoch: 63, train_loss: 0.1921, test_loss: 2.3415, test_f1: 0.6321
 epoch: 64, train_loss: 0.1617, test_loss: 2.5127, test_f1: 0.6198
 epoch: 65, train_loss: 0.1806, test_loss: 2.6349, test_f1: 0.6087
 epoch: 66, train_loss: 0.1764, test_loss: 2.4964, test_f1: 0.6490
 epoch: 67, train_loss: 0.1589, test_loss: 2.5098, test_f1: 0.6345
 epoch: 68, train_loss: 0.1490, test_loss: 2.5206, test_f1: 0.6345
 epoch: 69, train_loss: 0.1554, test_loss: 2.5069, test_f1: 0.6287
 epoch: 70, train_loss: 0.1746, test_loss: 2.6150, test_f1: 0.5984
 epoch: 71, train_loss: 0.1809, test_loss: 2.6944, test_f1: 0.6129
 epoch: 72, train_loss: 0.1672, test_loss: 2.6513, test_f1: 0.6193
 epoch: 73, train_loss: 0.1701, test_loss: 2.9607, test_f1: 0.5868
 epoch: 74, train_loss: 0.1499, test_loss: 2.5128, test_f1: 0.6180
 epoch: 75, train_loss: 0.1402, test_loss: 2.8023, test_f1: 0.6239
 epoch: 76, train_loss: 0.1289, test_loss: 2.7861, test_f1: 0.6209
 epoch: 77, train_loss: 0.1709, test_loss: 2.7533, test_f1: 0.6127
 epoch: 78, train_loss: 0.1799, test_loss: 3.1358, test_f1: 0.5690
 epoch: 79, train_loss: 0.1750, test_loss: 2.7527, test_f1: 0.5899
 epoch: 80, train_loss: 0.1453, test_loss: 2.5414, test_f1: 0.6166
 epoch: 81, train_loss: 0.1439, test_loss: 3.1653, test_f1: 0.5653
 epoch: 82, train_loss: 0.1480, test_loss: 2.9393, test_f1: 0.5833
 epoch: 83, train_loss: 0.1700, test_loss: 2.8349, test_f1: 0.6256
 epoch: 84, train_loss: 0.1721, test_loss: 2.9104, test_f1: 0.5856
 epoch: 85, train_loss: 0.1589, test_loss: 2.7301, test_f1: 0.6108
 epoch: 86, train_loss: 0.1340, test_loss: 2.8876, test_f1: 0.6030
 epoch: 87, train_loss: 0.1236, test_loss: 2.8676, test_f1: 0.6238
 epoch: 88, train_loss: 0.1916, test_loss: 2.9204, test_f1: 0.5974
 epoch: 89, train_loss: 0.1407, test_loss: 2.7873, test_f1: 0.6290
 epoch: 90, train_loss: 0.1322, test_loss: 2.8588, test_f1: 0.6144
 epoch: 91, train_loss: 0.1463, test_loss: 2.9710, test_f1: 0.6223
 epoch: 92, train_loss: 0.1423, test_loss: 3.0670, test_f1: 0.6041
 epoch: 93, train_loss: 0.1322, test_loss: 2.8339, test_f1: 0.5926
 epoch: 94, train_loss: 0.1017, test_loss: 3.0075, test_f1: 0.6248
 epoch: 95, train_loss: 0.1074, test_loss: 3.1078, test_f1: 0.6154
 epoch: 96, train_loss: 0.1051, test_loss: 2.9085, test_f1: 0.6204
 epoch: 97, train_loss: 0.1393, test_loss: 3.0202, test_f1: 0.6158
 epoch: 98, train_loss: 0.0965, test_loss: 3.1877, test_f1: 0.6152
 epoch: 99, train_loss: 0.1129, test_loss: 2.9714, test_f1: 0.6083
##################ITERATION #4 ****************************************
 epoch: 0, train_loss: 1.2264, test_loss: 1.4293, test_f1: 0.1365
 epoch: 1, train_loss: 1.0281, test_loss: 1.1888, test_f1: 0.2448
 epoch: 2, train_loss: 0.9585, test_loss: 1.0458, test_f1: 0.5649
 epoch: 3, train_loss: 0.9209, test_loss: 1.0347, test_f1: 0.5427
 epoch: 4, train_loss: 0.8865, test_loss: 1.0455, test_f1: 0.5026
 epoch: 5, train_loss: 0.8498, test_loss: 1.0301, test_f1: 0.5540
 epoch: 6, train_loss: 0.8221, test_loss: 0.9787, test_f1: 0.6023
 epoch: 7, train_loss: 0.8098, test_loss: 1.0399, test_f1: 0.5607
 epoch: 8, train_loss: 0.7899, test_loss: 0.9930, test_f1: 0.6209
 epoch: 9, train_loss: 0.7703, test_loss: 1.0153, test_f1: 0.5653
 epoch: 10, train_loss: 0.7632, test_loss: 0.9931, test_f1: 0.6332
 epoch: 11, train_loss: 0.7310, test_loss: 1.0556, test_f1: 0.5684
 epoch: 12, train_loss: 0.7122, test_loss: 0.9978, test_f1: 0.5525
 epoch: 13, train_loss: 0.6995, test_loss: 1.0270, test_f1: 0.5325
 epoch: 14, train_loss: 0.6846, test_loss: 1.0160, test_f1: 0.6455
 epoch: 15, train_loss: 0.6528, test_loss: 1.0688, test_f1: 0.5956
 epoch: 16, train_loss: 0.6446, test_loss: 1.0766, test_f1: 0.6223
 epoch: 17, train_loss: 0.6102, test_loss: 1.0012, test_f1: 0.6503
 epoch: 18, train_loss: 0.6113, test_loss: 1.0057, test_f1: 0.6207
 epoch: 19, train_loss: 0.6046, test_loss: 1.0598, test_f1: 0.5986
 epoch: 20, train_loss: 0.5755, test_loss: 1.1377, test_f1: 0.5875
 epoch: 21, train_loss: 0.6020, test_loss: 1.0950, test_f1: 0.6419
 epoch: 22, train_loss: 0.5752, test_loss: 1.1057, test_f1: 0.6465
 epoch: 23, train_loss: 0.5535, test_loss: 1.1438, test_f1: 0.6128
 epoch: 24, train_loss: 0.5300, test_loss: 1.1497, test_f1: 0.6388
 epoch: 25, train_loss: 0.5190, test_loss: 1.0706, test_f1: 0.6347
 epoch: 26, train_loss: 0.5091, test_loss: 1.1692, test_f1: 0.6528
 epoch: 27, train_loss: 0.4963, test_loss: 1.1017, test_f1: 0.6485
 epoch: 28, train_loss: 0.4774, test_loss: 1.1742, test_f1: 0.6169
 epoch: 29, train_loss: 0.4912, test_loss: 1.2388, test_f1: 0.5931
 epoch: 30, train_loss: 0.4664, test_loss: 1.2159, test_f1: 0.6404
 epoch: 31, train_loss: 0.5013, test_loss: 1.2742, test_f1: 0.5879
 epoch: 32, train_loss: 0.4803, test_loss: 1.2058, test_f1: 0.6642
 epoch: 33, train_loss: 0.4359, test_loss: 1.2594, test_f1: 0.6162
 epoch: 34, train_loss: 0.4339, test_loss: 1.2725, test_f1: 0.6472
 epoch: 35, train_loss: 0.4403, test_loss: 1.2798, test_f1: 0.6012
 epoch: 36, train_loss: 0.4429, test_loss: 1.2425, test_f1: 0.6135
 epoch: 37, train_loss: 0.4204, test_loss: 1.4030, test_f1: 0.6015
 epoch: 38, train_loss: 0.4206, test_loss: 1.2902, test_f1: 0.6259
 epoch: 39, train_loss: 0.3883, test_loss: 1.4040, test_f1: 0.6543
 epoch: 40, train_loss: 0.4031, test_loss: 1.4796, test_f1: 0.6355
 epoch: 41, train_loss: 0.4078, test_loss: 1.2988, test_f1: 0.6313
 epoch: 42, train_loss: 0.4043, test_loss: 1.5656, test_f1: 0.6137
 epoch: 43, train_loss: 0.3940, test_loss: 1.4040, test_f1: 0.6178
 epoch: 44, train_loss: 0.3877, test_loss: 1.5187, test_f1: 0.6163
 epoch: 45, train_loss: 0.3833, test_loss: 1.4704, test_f1: 0.6414
 epoch: 46, train_loss: 0.3379, test_loss: 1.5311, test_f1: 0.6198
 epoch: 47, train_loss: 0.3456, test_loss: 1.3889, test_f1: 0.6277
 epoch: 48, train_loss: 0.3374, test_loss: 1.6539, test_f1: 0.6345
 epoch: 49, train_loss: 0.3181, test_loss: 1.5310, test_f1: 0.6308
 epoch: 50, train_loss: 0.3472, test_loss: 1.6526, test_f1: 0.6140
 epoch: 51, train_loss: 0.3404, test_loss: 1.7481, test_f1: 0.6050
 epoch: 52, train_loss: 0.2970, test_loss: 1.6776, test_f1: 0.6080
 epoch: 53, train_loss: 0.2641, test_loss: 1.7605, test_f1: 0.6104
 epoch: 54, train_loss: 0.2452, test_loss: 1.8220, test_f1: 0.6306
 epoch: 55, train_loss: 0.2187, test_loss: 1.8213, test_f1: 0.6433
 epoch: 56, train_loss: 0.2503, test_loss: 1.7809, test_f1: 0.6162
 epoch: 57, train_loss: 0.2464, test_loss: 1.8713, test_f1: 0.6131
 epoch: 58, train_loss: 0.2387, test_loss: 1.8232, test_f1: 0.6207
 epoch: 59, train_loss: 0.2251, test_loss: 1.8161, test_f1: 0.6143
 epoch: 60, train_loss: 0.2174, test_loss: 1.8667, test_f1: 0.6206
 epoch: 61, train_loss: 0.2294, test_loss: 1.8728, test_f1: 0.6569
 epoch: 62, train_loss: 0.2266, test_loss: 1.8403, test_f1: 0.6188
 epoch: 63, train_loss: 0.2060, test_loss: 2.0400, test_f1: 0.6213
 epoch: 64, train_loss: 0.1926, test_loss: 1.9276, test_f1: 0.6253
 epoch: 65, train_loss: 0.2270, test_loss: 1.9719, test_f1: 0.6177
 epoch: 66, train_loss: 0.2103, test_loss: 2.0692, test_f1: 0.6332
 epoch: 67, train_loss: 0.1823, test_loss: 1.9818, test_f1: 0.6256
 epoch: 68, train_loss: 0.2151, test_loss: 2.0132, test_f1: 0.6220
 epoch: 69, train_loss: 0.1920, test_loss: 2.0010, test_f1: 0.6277
 epoch: 70, train_loss: 0.1922, test_loss: 2.0056, test_f1: 0.6310
 epoch: 71, train_loss: 0.2256, test_loss: 2.0362, test_f1: 0.6399
 epoch: 72, train_loss: 0.1928, test_loss: 2.2146, test_f1: 0.6299
 epoch: 73, train_loss: 0.1855, test_loss: 2.1758, test_f1: 0.6290
 epoch: 74, train_loss: 0.2020, test_loss: 2.1869, test_f1: 0.6222
 epoch: 75, train_loss: 0.1669, test_loss: 2.2263, test_f1: 0.6148
 epoch: 76, train_loss: 0.1785, test_loss: 2.2350, test_f1: 0.6016
 epoch: 77, train_loss: 0.1777, test_loss: 2.1553, test_f1: 0.6240
 epoch: 78, train_loss: 0.1761, test_loss: 2.3581, test_f1: 0.6058
 epoch: 79, train_loss: 0.1745, test_loss: 2.2946, test_f1: 0.5624
 epoch: 80, train_loss: 0.1898, test_loss: 2.2341, test_f1: 0.6252
 epoch: 81, train_loss: 0.1630, test_loss: 2.4054, test_f1: 0.6265
 epoch: 82, train_loss: 0.1592, test_loss: 2.3741, test_f1: 0.6111
 epoch: 83, train_loss: 0.1538, test_loss: 2.4907, test_f1: 0.5754
 epoch: 84, train_loss: 0.1552, test_loss: 2.3632, test_f1: 0.6227
 epoch: 85, train_loss: 0.1808, test_loss: 2.4656, test_f1: 0.6226
 epoch: 86, train_loss: 0.1721, test_loss: 2.4022, test_f1: 0.6414
 epoch: 87, train_loss: 0.1855, test_loss: 2.2773, test_f1: 0.6362
 epoch: 88, train_loss: 0.1782, test_loss: 2.6551, test_f1: 0.5744
 epoch: 89, train_loss: 0.1406, test_loss: 2.5079, test_f1: 0.6343
 epoch: 90, train_loss: 0.1564, test_loss: 2.5706, test_f1: 0.6024
 epoch: 91, train_loss: 0.1404, test_loss: 2.5409, test_f1: 0.6259
 epoch: 92, train_loss: 0.1694, test_loss: 2.6766, test_f1: 0.6076
 epoch: 93, train_loss: 0.1493, test_loss: 2.6544, test_f1: 0.6058
 epoch: 94, train_loss: 0.1420, test_loss: 2.5536, test_f1: 0.6291
 epoch: 95, train_loss: 0.1479, test_loss: 2.6317, test_f1: 0.6200
 epoch: 96, train_loss: 0.1911, test_loss: 2.6853, test_f1: 0.6045
 epoch: 97, train_loss: 0.1656, test_loss: 2.7332, test_f1: 0.5941
 epoch: 98, train_loss: 0.1550, test_loss: 2.7182, test_f1: 0.6120
 epoch: 99, train_loss: 0.1414, test_loss: 2.8226, test_f1: 0.5861
##################ITERATION #5 ****************************************
 epoch: 0, train_loss: 1.3941, test_loss: 1.4584, test_f1: 0.2281
 epoch: 1, train_loss: 1.0758, test_loss: 1.4483, test_f1: 0.3368
 epoch: 2, train_loss: 1.0136, test_loss: 1.0666, test_f1: 0.5348
 epoch: 3, train_loss: 0.9410, test_loss: 1.0656, test_f1: 0.5404
 epoch: 4, train_loss: 0.9098, test_loss: 1.0904, test_f1: 0.5272
 epoch: 5, train_loss: 0.8754, test_loss: 1.0438, test_f1: 0.5442
 epoch: 6, train_loss: 0.8324, test_loss: 1.0348, test_f1: 0.5469
 epoch: 7, train_loss: 0.8372, test_loss: 1.0356, test_f1: 0.5556
 epoch: 8, train_loss: 0.7970, test_loss: 1.0528, test_f1: 0.5422
 epoch: 9, train_loss: 0.7734, test_loss: 1.0902, test_f1: 0.5238
 epoch: 10, train_loss: 0.7705, test_loss: 1.0098, test_f1: 0.5607
 epoch: 11, train_loss: 0.7498, test_loss: 1.0157, test_f1: 0.5780
 epoch: 12, train_loss: 0.7365, test_loss: 1.0300, test_f1: 0.6000
 epoch: 13, train_loss: 0.6994, test_loss: 1.1121, test_f1: 0.5662
 epoch: 14, train_loss: 0.6955, test_loss: 1.1599, test_f1: 0.5693
 epoch: 15, train_loss: 0.6911, test_loss: 1.1042, test_f1: 0.6015
 epoch: 16, train_loss: 0.7018, test_loss: 1.0628, test_f1: 0.5620
 epoch: 17, train_loss: 0.6812, test_loss: 1.1152, test_f1: 0.6054
 epoch: 18, train_loss: 0.6734, test_loss: 1.1603, test_f1: 0.5516
 epoch: 19, train_loss: 0.6497, test_loss: 1.1782, test_f1: 0.6123
 epoch: 20, train_loss: 0.6297, test_loss: 1.1764, test_f1: 0.5948
 epoch: 21, train_loss: 0.6036, test_loss: 1.1014, test_f1: 0.6029
 epoch: 22, train_loss: 0.5651, test_loss: 1.2029, test_f1: 0.5651
 epoch: 23, train_loss: 0.5754, test_loss: 1.1542, test_f1: 0.5935
 epoch: 24, train_loss: 0.5735, test_loss: 1.0870, test_f1: 0.6225
 epoch: 25, train_loss: 0.5608, test_loss: 1.1487, test_f1: 0.6126
 epoch: 26, train_loss: 0.5540, test_loss: 1.1381, test_f1: 0.6344
 epoch: 27, train_loss: 0.5526, test_loss: 1.2211, test_f1: 0.5798
 epoch: 28, train_loss: 0.5214, test_loss: 1.2098, test_f1: 0.6329
 epoch: 29, train_loss: 0.5177, test_loss: 1.2122, test_f1: 0.5955
 epoch: 30, train_loss: 0.5271, test_loss: 1.3475, test_f1: 0.6080
 epoch: 31, train_loss: 0.5073, test_loss: 1.1620, test_f1: 0.6085
 epoch: 32, train_loss: 0.4950, test_loss: 1.3079, test_f1: 0.5977
 epoch: 33, train_loss: 0.4568, test_loss: 1.2893, test_f1: 0.6051
 epoch: 34, train_loss: 0.4668, test_loss: 1.3307, test_f1: 0.6361
 epoch: 35, train_loss: 0.4477, test_loss: 1.3331, test_f1: 0.6294
 epoch: 36, train_loss: 0.4478, test_loss: 1.4805, test_f1: 0.6231
 epoch: 37, train_loss: 0.4470, test_loss: 1.4734, test_f1: 0.5769
 epoch: 38, train_loss: 0.4576, test_loss: 1.4476, test_f1: 0.5772
 epoch: 39, train_loss: 0.4278, test_loss: 1.3970, test_f1: 0.6250
 epoch: 40, train_loss: 0.4315, test_loss: 1.5742, test_f1: 0.5962
 epoch: 41, train_loss: 0.4370, test_loss: 1.6081, test_f1: 0.5950
 epoch: 42, train_loss: 0.4202, test_loss: 1.3211, test_f1: 0.6371
 epoch: 43, train_loss: 0.3880, test_loss: 1.5937, test_f1: 0.6098
 epoch: 44, train_loss: 0.3721, test_loss: 1.4978, test_f1: 0.6299
 epoch: 45, train_loss: 0.3436, test_loss: 1.5932, test_f1: 0.6408
 epoch: 46, train_loss: 0.3407, test_loss: 1.6928, test_f1: 0.6086
 epoch: 47, train_loss: 0.3544, test_loss: 2.0736, test_f1: 0.5618
 epoch: 48, train_loss: 0.3785, test_loss: 1.8050, test_f1: 0.5798
 epoch: 49, train_loss: 0.3366, test_loss: 1.6810, test_f1: 0.5916
 epoch: 50, train_loss: 0.3287, test_loss: 1.7085, test_f1: 0.6323
 epoch: 51, train_loss: 0.2755, test_loss: 1.7821, test_f1: 0.6089
 epoch: 52, train_loss: 0.2794, test_loss: 1.7830, test_f1: 0.6463
 epoch: 53, train_loss: 0.2626, test_loss: 1.7737, test_f1: 0.5952
 epoch: 54, train_loss: 0.2524, test_loss: 1.9461, test_f1: 0.5982
 epoch: 55, train_loss: 0.2504, test_loss: 1.9354, test_f1: 0.6285
 epoch: 56, train_loss: 0.2483, test_loss: 1.8605, test_f1: 0.6127
 epoch: 57, train_loss: 0.2503, test_loss: 1.9330, test_f1: 0.6208
 epoch: 58, train_loss: 0.2376, test_loss: 1.9530, test_f1: 0.6091
 epoch: 59, train_loss: 0.2158, test_loss: 1.9588, test_f1: 0.6351
 epoch: 60, train_loss: 0.2410, test_loss: 2.0118, test_f1: 0.6019
 epoch: 61, train_loss: 0.2289, test_loss: 2.0556, test_f1: 0.5968
 epoch: 62, train_loss: 0.2259, test_loss: 2.0426, test_f1: 0.6162
 epoch: 63, train_loss: 0.2238, test_loss: 2.0500, test_f1: 0.6271
 epoch: 64, train_loss: 0.2167, test_loss: 2.0472, test_f1: 0.6137
 epoch: 65, train_loss: 0.2073, test_loss: 2.1152, test_f1: 0.6006
 epoch: 66, train_loss: 0.1978, test_loss: 2.3028, test_f1: 0.5911
 epoch: 67, train_loss: 0.2105, test_loss: 2.2097, test_f1: 0.6293
 epoch: 68, train_loss: 0.2067, test_loss: 2.1163, test_f1: 0.6166
 epoch: 69, train_loss: 0.2093, test_loss: 2.2272, test_f1: 0.6149
 epoch: 70, train_loss: 0.2086, test_loss: 2.3382, test_f1: 0.5980
 epoch: 71, train_loss: 0.1752, test_loss: 2.1771, test_f1: 0.6241
 epoch: 72, train_loss: 0.1892, test_loss: 2.1261, test_f1: 0.6166
 epoch: 73, train_loss: 0.1806, test_loss: 2.4060, test_f1: 0.6113
 epoch: 74, train_loss: 0.2089, test_loss: 2.1881, test_f1: 0.6185
 epoch: 75, train_loss: 0.2113, test_loss: 2.5899, test_f1: 0.5669
 epoch: 76, train_loss: 0.1798, test_loss: 2.2943, test_f1: 0.6071
 epoch: 77, train_loss: 0.2031, test_loss: 2.3146, test_f1: 0.5862
 epoch: 78, train_loss: 0.1736, test_loss: 2.3732, test_f1: 0.6101
 epoch: 79, train_loss: 0.1637, test_loss: 2.4822, test_f1: 0.5967
 epoch: 80, train_loss: 0.1509, test_loss: 2.5755, test_f1: 0.5655
 epoch: 81, train_loss: 0.1898, test_loss: 2.4550, test_f1: 0.5944
 epoch: 82, train_loss: 0.1658, test_loss: 2.3559, test_f1: 0.6153
 epoch: 83, train_loss: 0.1490, test_loss: 2.3723, test_f1: 0.6049
 epoch: 84, train_loss: 0.1518, test_loss: 2.3953, test_f1: 0.6164
 epoch: 85, train_loss: 0.1752, test_loss: 2.3863, test_f1: 0.6172
 epoch: 86, train_loss: 0.1725, test_loss: 2.7140, test_f1: 0.5908
 epoch: 87, train_loss: 0.1460, test_loss: 2.5477, test_f1: 0.5664
 epoch: 88, train_loss: 0.1318, test_loss: 2.5975, test_f1: 0.5851
 epoch: 89, train_loss: 0.1464, test_loss: 2.8873, test_f1: 0.5626
 epoch: 90, train_loss: 0.1389, test_loss: 2.6006, test_f1: 0.6115
 epoch: 91, train_loss: 0.1624, test_loss: 2.7158, test_f1: 0.6280
 epoch: 92, train_loss: 0.1464, test_loss: 2.7555, test_f1: 0.5996
 epoch: 93, train_loss: 0.1671, test_loss: 2.8186, test_f1: 0.5972
 epoch: 94, train_loss: 0.1829, test_loss: 2.6831, test_f1: 0.5574
 epoch: 95, train_loss: 0.1680, test_loss: 2.8856, test_f1: 0.5738
 epoch: 96, train_loss: 0.1618, test_loss: 2.7439, test_f1: 0.5874
 epoch: 97, train_loss: 0.1404, test_loss: 2.8074, test_f1: 0.5701
 epoch: 98, train_loss: 0.1331, test_loss: 2.7390, test_f1: 0.6152
 epoch: 99, train_loss: 0.1350, test_loss: 2.7492, test_f1: 0.5941
##################ITERATION #6 ****************************************
 epoch: 0, train_loss: 1.3341, test_loss: 1.4797, test_f1: 0.1245
 epoch: 1, train_loss: 1.0103, test_loss: 1.5143, test_f1: 0.2071
 epoch: 2, train_loss: 0.9384, test_loss: 1.0713, test_f1: 0.5337
 epoch: 3, train_loss: 0.9008, test_loss: 1.0719, test_f1: 0.5211
 epoch: 4, train_loss: 0.8835, test_loss: 1.0636, test_f1: 0.5382
 epoch: 5, train_loss: 0.8364, test_loss: 1.0624, test_f1: 0.5899
 epoch: 6, train_loss: 0.8198, test_loss: 1.0916, test_f1: 0.5785
 epoch: 7, train_loss: 0.8077, test_loss: 1.1063, test_f1: 0.5552
 epoch: 8, train_loss: 0.7835, test_loss: 1.0735, test_f1: 0.5739
 epoch: 9, train_loss: 0.7431, test_loss: 1.1181, test_f1: 0.5590
 epoch: 10, train_loss: 0.7151, test_loss: 1.1756, test_f1: 0.5834
 epoch: 11, train_loss: 0.7355, test_loss: 1.0985, test_f1: 0.5807
 epoch: 12, train_loss: 0.6960, test_loss: 1.1811, test_f1: 0.5518
 epoch: 13, train_loss: 0.6669, test_loss: 1.2456, test_f1: 0.5563
 epoch: 14, train_loss: 0.6720, test_loss: 1.1250, test_f1: 0.5810
 epoch: 15, train_loss: 0.6548, test_loss: 1.0996, test_f1: 0.5913
 epoch: 16, train_loss: 0.6212, test_loss: 1.2085, test_f1: 0.5379
 epoch: 17, train_loss: 0.6029, test_loss: 1.2549, test_f1: 0.5680
 epoch: 18, train_loss: 0.6045, test_loss: 1.3503, test_f1: 0.5646
 epoch: 19, train_loss: 0.6062, test_loss: 1.4762, test_f1: 0.5988
 epoch: 20, train_loss: 0.5696, test_loss: 1.2847, test_f1: 0.6131
 epoch: 21, train_loss: 0.5638, test_loss: 1.3349, test_f1: 0.5936
 epoch: 22, train_loss: 0.5584, test_loss: 1.3628, test_f1: 0.5620
 epoch: 23, train_loss: 0.5427, test_loss: 1.2516, test_f1: 0.6465
 epoch: 24, train_loss: 0.5197, test_loss: 1.4769, test_f1: 0.5390
 epoch: 25, train_loss: 0.5155, test_loss: 1.3126, test_f1: 0.5680
 epoch: 26, train_loss: 0.5126, test_loss: 1.3547, test_f1: 0.6248
 epoch: 27, train_loss: 0.5061, test_loss: 1.3683, test_f1: 0.6060
 epoch: 28, train_loss: 0.4889, test_loss: 1.4490, test_f1: 0.5558
 epoch: 29, train_loss: 0.4712, test_loss: 1.4289, test_f1: 0.5613
 epoch: 30, train_loss: 0.4763, test_loss: 1.5174, test_f1: 0.5659
 epoch: 31, train_loss: 0.4705, test_loss: 1.3753, test_f1: 0.5981
 epoch: 32, train_loss: 0.4701, test_loss: 1.4799, test_f1: 0.5595
 epoch: 33, train_loss: 0.4499, test_loss: 1.5734, test_f1: 0.5832
 epoch: 34, train_loss: 0.4490, test_loss: 1.5601, test_f1: 0.6109
 epoch: 35, train_loss: 0.4451, test_loss: 1.3911, test_f1: 0.6076
 epoch: 36, train_loss: 0.4435, test_loss: 1.4409, test_f1: 0.6087
 epoch: 37, train_loss: 0.4244, test_loss: 1.6077, test_f1: 0.5793
 epoch: 38, train_loss: 0.3941, test_loss: 1.4715, test_f1: 0.6340
 epoch: 39, train_loss: 0.3775, test_loss: 1.5977, test_f1: 0.5983
 epoch: 40, train_loss: 0.3537, test_loss: 1.6438, test_f1: 0.5910
 epoch: 41, train_loss: 0.3695, test_loss: 2.0773, test_f1: 0.5367
 epoch: 42, train_loss: 0.3313, test_loss: 1.6933, test_f1: 0.6020
 epoch: 43, train_loss: 0.3399, test_loss: 1.8219, test_f1: 0.5542
 epoch: 44, train_loss: 0.3519, test_loss: 1.4913, test_f1: 0.6506
 epoch: 45, train_loss: 0.3420, test_loss: 1.5170, test_f1: 0.6046
 epoch: 46, train_loss: 0.3405, test_loss: 1.6671, test_f1: 0.5963
 epoch: 47, train_loss: 0.3537, test_loss: 1.4957, test_f1: 0.6113
 epoch: 48, train_loss: 0.3351, test_loss: 1.6430, test_f1: 0.5866
 epoch: 49, train_loss: 0.3240, test_loss: 1.6187, test_f1: 0.6156
 epoch: 50, train_loss: 0.3135, test_loss: 1.7380, test_f1: 0.5433
 epoch: 51, train_loss: 0.2626, test_loss: 1.7008, test_f1: 0.6009
 epoch: 52, train_loss: 0.2437, test_loss: 1.7945, test_f1: 0.5976
 epoch: 53, train_loss: 0.2253, test_loss: 1.7286, test_f1: 0.6360
 epoch: 54, train_loss: 0.2248, test_loss: 1.7386, test_f1: 0.6164
 epoch: 55, train_loss: 0.2137, test_loss: 1.7320, test_f1: 0.6264
 epoch: 56, train_loss: 0.2199, test_loss: 1.8856, test_f1: 0.6169
 epoch: 57, train_loss: 0.2455, test_loss: 1.9490, test_f1: 0.6070
 epoch: 58, train_loss: 0.2333, test_loss: 1.8262, test_f1: 0.6029
 epoch: 59, train_loss: 0.2132, test_loss: 2.0887, test_f1: 0.5846
 epoch: 60, train_loss: 0.2261, test_loss: 2.0021, test_f1: 0.5970
 epoch: 61, train_loss: 0.2267, test_loss: 2.0498, test_f1: 0.5701
 epoch: 62, train_loss: 0.1985, test_loss: 2.0809, test_f1: 0.5846
 epoch: 63, train_loss: 0.1917, test_loss: 2.1899, test_f1: 0.5926
 epoch: 64, train_loss: 0.1953, test_loss: 1.9761, test_f1: 0.5725
 epoch: 65, train_loss: 0.1960, test_loss: 2.1398, test_f1: 0.5613
 epoch: 66, train_loss: 0.1823, test_loss: 2.1408, test_f1: 0.5884
 epoch: 67, train_loss: 0.1734, test_loss: 2.2926, test_f1: 0.6012
 epoch: 68, train_loss: 0.1605, test_loss: 2.2542, test_f1: 0.5860
 epoch: 69, train_loss: 0.2049, test_loss: 2.2844, test_f1: 0.5965
 epoch: 70, train_loss: 0.2030, test_loss: 2.1198, test_f1: 0.5842
 epoch: 71, train_loss: 0.1812, test_loss: 2.2805, test_f1: 0.5900
 epoch: 72, train_loss: 0.1788, test_loss: 2.3248, test_f1: 0.5737
 epoch: 73, train_loss: 0.1529, test_loss: 2.3497, test_f1: 0.5812
 epoch: 74, train_loss: 0.1391, test_loss: 2.3672, test_f1: 0.6013
 epoch: 75, train_loss: 0.1771, test_loss: 2.4042, test_f1: 0.5923
 epoch: 76, train_loss: 0.1744, test_loss: 2.3363, test_f1: 0.5865
 epoch: 77, train_loss: 0.1741, test_loss: 2.3773, test_f1: 0.6010
 epoch: 78, train_loss: 0.1732, test_loss: 2.5870, test_f1: 0.5752
 epoch: 79, train_loss: 0.1449, test_loss: 2.4430, test_f1: 0.6163
 epoch: 80, train_loss: 0.1613, test_loss: 2.3932, test_f1: 0.5773
 epoch: 81, train_loss: 0.1385, test_loss: 2.6673, test_f1: 0.5917
 epoch: 82, train_loss: 0.1826, test_loss: 2.4750, test_f1: 0.6012
 epoch: 83, train_loss: 0.1622, test_loss: 2.4232, test_f1: 0.6204
 epoch: 84, train_loss: 0.1267, test_loss: 2.4995, test_f1: 0.5880
 epoch: 85, train_loss: 0.1464, test_loss: 2.4164, test_f1: 0.6114
 epoch: 86, train_loss: 0.1383, test_loss: 2.9430, test_f1: 0.5808
 epoch: 87, train_loss: 0.1466, test_loss: 2.7078, test_f1: 0.5916
 epoch: 88, train_loss: 0.1699, test_loss: 2.9424, test_f1: 0.5668
 epoch: 89, train_loss: 0.1457, test_loss: 2.5677, test_f1: 0.6334
 epoch: 90, train_loss: 0.1321, test_loss: 2.7255, test_f1: 0.5970
 epoch: 91, train_loss: 0.1399, test_loss: 2.7444, test_f1: 0.5892
 epoch: 92, train_loss: 0.1160, test_loss: 2.6776, test_f1: 0.5974
 epoch: 93, train_loss: 0.1326, test_loss: 2.7964, test_f1: 0.6024
 epoch: 94, train_loss: 0.1696, test_loss: 2.8410, test_f1: 0.5800
 epoch: 95, train_loss: 0.1889, test_loss: 2.8698, test_f1: 0.5689
 epoch: 96, train_loss: 0.1412, test_loss: 2.6626, test_f1: 0.5896
 epoch: 97, train_loss: 0.1394, test_loss: 2.6739, test_f1: 0.5837
 epoch: 98, train_loss: 0.1386, test_loss: 2.8592, test_f1: 0.5804
 epoch: 99, train_loss: 0.1470, test_loss: 2.8651, test_f1: 0.6062
##################ITERATION #7 ****************************************
 epoch: 0, train_loss: 1.5075, test_loss: 1.6619, test_f1: 0.1365
 epoch: 1, train_loss: 1.1366, test_loss: 2.0954, test_f1: 0.1870
 epoch: 2, train_loss: 0.9905, test_loss: 1.2109, test_f1: 0.4149
 epoch: 3, train_loss: 0.9531, test_loss: 1.1016, test_f1: 0.5332
 epoch: 4, train_loss: 0.8964, test_loss: 1.0356, test_f1: 0.5362
 epoch: 5, train_loss: 0.8816, test_loss: 1.0342, test_f1: 0.5486
 epoch: 6, train_loss: 0.8482, test_loss: 1.0395, test_f1: 0.5552
 epoch: 7, train_loss: 0.8390, test_loss: 1.1273, test_f1: 0.5008
 epoch: 8, train_loss: 0.7909, test_loss: 1.0222, test_f1: 0.5595
 epoch: 9, train_loss: 0.7669, test_loss: 1.0990, test_f1: 0.5679
 epoch: 10, train_loss: 0.7628, test_loss: 1.1032, test_f1: 0.5466
 epoch: 11, train_loss: 0.7324, test_loss: 1.0634, test_f1: 0.5956
 epoch: 12, train_loss: 0.7375, test_loss: 1.0833, test_f1: 0.5605
 epoch: 13, train_loss: 0.7237, test_loss: 1.0663, test_f1: 0.5978
 epoch: 14, train_loss: 0.6869, test_loss: 1.1397, test_f1: 0.5919
 epoch: 15, train_loss: 0.6715, test_loss: 1.1216, test_f1: 0.5577
 epoch: 16, train_loss: 0.6399, test_loss: 1.1281, test_f1: 0.5887
 epoch: 17, train_loss: 0.6369, test_loss: 1.1357, test_f1: 0.5928
 epoch: 18, train_loss: 0.6185, test_loss: 1.0645, test_f1: 0.6375
 epoch: 19, train_loss: 0.5926, test_loss: 1.1925, test_f1: 0.6019
 epoch: 20, train_loss: 0.6058, test_loss: 1.1583, test_f1: 0.6089
 epoch: 21, train_loss: 0.5803, test_loss: 1.2031, test_f1: 0.5777
 epoch: 22, train_loss: 0.5793, test_loss: 1.1785, test_f1: 0.6129
 epoch: 23, train_loss: 0.5566, test_loss: 1.2340, test_f1: 0.5798
 epoch: 24, train_loss: 0.5464, test_loss: 1.2571, test_f1: 0.6171
 epoch: 25, train_loss: 0.5226, test_loss: 1.1841, test_f1: 0.6382
 epoch: 26, train_loss: 0.4935, test_loss: 1.2100, test_f1: 0.6270
 epoch: 27, train_loss: 0.5173, test_loss: 1.2688, test_f1: 0.6368
 epoch: 28, train_loss: 0.5249, test_loss: 1.2256, test_f1: 0.6366
 epoch: 29, train_loss: 0.4943, test_loss: 1.2009, test_f1: 0.6199
 epoch: 30, train_loss: 0.5174, test_loss: 1.2688, test_f1: 0.6540
 epoch: 31, train_loss: 0.4792, test_loss: 1.2706, test_f1: 0.6469
 epoch: 32, train_loss: 0.4650, test_loss: 1.3654, test_f1: 0.6296
 epoch: 33, train_loss: 0.4463, test_loss: 1.2666, test_f1: 0.6259
 epoch: 34, train_loss: 0.4278, test_loss: 1.4928, test_f1: 0.5834
 epoch: 35, train_loss: 0.4474, test_loss: 1.3042, test_f1: 0.6379
 epoch: 36, train_loss: 0.4569, test_loss: 1.4500, test_f1: 0.5767
 epoch: 37, train_loss: 0.4175, test_loss: 1.4321, test_f1: 0.6181
 epoch: 38, train_loss: 0.4307, test_loss: 1.4539, test_f1: 0.6352
 epoch: 39, train_loss: 0.4051, test_loss: 1.4597, test_f1: 0.6357
 epoch: 40, train_loss: 0.4000, test_loss: 1.4684, test_f1: 0.5787
 epoch: 41, train_loss: 0.3833, test_loss: 1.5174, test_f1: 0.6047
 epoch: 42, train_loss: 0.4106, test_loss: 1.4921, test_f1: 0.6099
 epoch: 43, train_loss: 0.3741, test_loss: 1.3894, test_f1: 0.6151
 epoch: 44, train_loss: 0.3616, test_loss: 1.5964, test_f1: 0.6477
 epoch: 45, train_loss: 0.3709, test_loss: 1.5203, test_f1: 0.6282
 epoch: 46, train_loss: 0.3831, test_loss: 1.6369, test_f1: 0.6015
 epoch: 47, train_loss: 0.3287, test_loss: 1.5620, test_f1: 0.5996
 epoch: 48, train_loss: 0.3435, test_loss: 1.5618, test_f1: 0.6680
 epoch: 49, train_loss: 0.3233, test_loss: 1.6834, test_f1: 0.6061
 epoch: 50, train_loss: 0.3225, test_loss: 1.6179, test_f1: 0.6354
 epoch: 51, train_loss: 0.2954, test_loss: 1.5929, test_f1: 0.6240
 epoch: 52, train_loss: 0.2509, test_loss: 1.8482, test_f1: 0.5906
 epoch: 53, train_loss: 0.2547, test_loss: 1.8406, test_f1: 0.5793
 epoch: 54, train_loss: 0.2286, test_loss: 1.7543, test_f1: 0.6076
 epoch: 55, train_loss: 0.2402, test_loss: 1.8314, test_f1: 0.5886
 epoch: 56, train_loss: 0.2352, test_loss: 1.8308, test_f1: 0.6200
 epoch: 57, train_loss: 0.2306, test_loss: 1.8201, test_f1: 0.6097
 epoch: 58, train_loss: 0.2291, test_loss: 2.0157, test_f1: 0.5764
 epoch: 59, train_loss: 0.2345, test_loss: 1.9688, test_f1: 0.5969
 epoch: 60, train_loss: 0.2570, test_loss: 1.8631, test_f1: 0.6054
 epoch: 61, train_loss: 0.2094, test_loss: 1.8887, test_f1: 0.6188
 epoch: 62, train_loss: 0.2119, test_loss: 1.8873, test_f1: 0.6261
 epoch: 63, train_loss: 0.2248, test_loss: 2.0205, test_f1: 0.6108
 epoch: 64, train_loss: 0.1865, test_loss: 1.9023, test_f1: 0.6215
 epoch: 65, train_loss: 0.2011, test_loss: 2.0151, test_f1: 0.6191
 epoch: 66, train_loss: 0.1963, test_loss: 2.0143, test_f1: 0.6319
 epoch: 67, train_loss: 0.1945, test_loss: 2.1830, test_f1: 0.5881
 epoch: 68, train_loss: 0.1943, test_loss: 2.0105, test_f1: 0.6367
 epoch: 69, train_loss: 0.1974, test_loss: 2.2068, test_f1: 0.6060
 epoch: 70, train_loss: 0.1896, test_loss: 2.1410, test_f1: 0.6049
 epoch: 71, train_loss: 0.1953, test_loss: 2.1143, test_f1: 0.6127
 epoch: 72, train_loss: 0.1678, test_loss: 2.1521, test_f1: 0.5971
 epoch: 73, train_loss: 0.2076, test_loss: 2.0965, test_f1: 0.6312
 epoch: 74, train_loss: 0.1879, test_loss: 2.1775, test_f1: 0.6036
 epoch: 75, train_loss: 0.2037, test_loss: 2.2443, test_f1: 0.5556
 epoch: 76, train_loss: 0.1894, test_loss: 2.1099, test_f1: 0.6227
 epoch: 77, train_loss: 0.2050, test_loss: 2.2212, test_f1: 0.5723
 epoch: 78, train_loss: 0.1816, test_loss: 2.0609, test_f1: 0.6116
 epoch: 79, train_loss: 0.1550, test_loss: 2.1709, test_f1: 0.6275
 epoch: 80, train_loss: 0.1757, test_loss: 2.2585, test_f1: 0.6052
 epoch: 81, train_loss: 0.1872, test_loss: 2.1602, test_f1: 0.6074
 epoch: 82, train_loss: 0.1788, test_loss: 2.2702, test_f1: 0.6134
 epoch: 83, train_loss: 0.1574, test_loss: 2.2785, test_f1: 0.6162
 epoch: 84, train_loss: 0.1444, test_loss: 2.2532, test_f1: 0.6233
 epoch: 85, train_loss: 0.1692, test_loss: 2.3422, test_f1: 0.6343
 epoch: 86, train_loss: 0.1565, test_loss: 2.3999, test_f1: 0.6260
 epoch: 87, train_loss: 0.1558, test_loss: 2.3850, test_f1: 0.6265
 epoch: 88, train_loss: 0.1606, test_loss: 2.3005, test_f1: 0.6283
 epoch: 89, train_loss: 0.1802, test_loss: 2.4721, test_f1: 0.5642
 epoch: 90, train_loss: 0.1537, test_loss: 2.5006, test_f1: 0.5582
 epoch: 91, train_loss: 0.1952, test_loss: 2.3145, test_f1: 0.6000
 epoch: 92, train_loss: 0.1734, test_loss: 2.5171, test_f1: 0.5588
 epoch: 93, train_loss: 0.1882, test_loss: 2.4437, test_f1: 0.6449
 epoch: 94, train_loss: 0.1755, test_loss: 2.1913, test_f1: 0.6366
 epoch: 95, train_loss: 0.1695, test_loss: 2.4994, test_f1: 0.6028
 epoch: 96, train_loss: 0.1626, test_loss: 2.3973, test_f1: 0.5836
 epoch: 97, train_loss: 0.1357, test_loss: 2.4896, test_f1: 0.6138
 epoch: 98, train_loss: 0.1415, test_loss: 2.4835, test_f1: 0.6241
 epoch: 99, train_loss: 0.1333, test_loss: 2.5528, test_f1: 0.5801
##################ITERATION #8 ****************************************
 epoch: 0, train_loss: 1.6218, test_loss: 1.4242, test_f1: 0.1662
 epoch: 1, train_loss: 1.1247, test_loss: 2.0552, test_f1: 0.1359
 epoch: 2, train_loss: 1.0475, test_loss: 1.2205, test_f1: 0.4505
 epoch: 3, train_loss: 0.9696, test_loss: 1.1163, test_f1: 0.4925
 epoch: 4, train_loss: 0.9121, test_loss: 1.1651, test_f1: 0.5019
 epoch: 5, train_loss: 0.9169, test_loss: 1.0499, test_f1: 0.5449
 epoch: 6, train_loss: 0.8282, test_loss: 1.1061, test_f1: 0.5688
 epoch: 7, train_loss: 0.8333, test_loss: 1.0896, test_f1: 0.5827
 epoch: 8, train_loss: 0.8166, test_loss: 1.0648, test_f1: 0.5801
 epoch: 9, train_loss: 0.7967, test_loss: 1.1445, test_f1: 0.5763
 epoch: 10, train_loss: 0.7831, test_loss: 1.0946, test_f1: 0.5666
 epoch: 11, train_loss: 0.7720, test_loss: 1.0775, test_f1: 0.5557
 epoch: 12, train_loss: 0.7612, test_loss: 1.0966, test_f1: 0.5885
 epoch: 13, train_loss: 0.7243, test_loss: 1.1598, test_f1: 0.5788
 epoch: 14, train_loss: 0.7214, test_loss: 1.1456, test_f1: 0.5821
 epoch: 15, train_loss: 0.7200, test_loss: 1.1920, test_f1: 0.5470
 epoch: 16, train_loss: 0.6702, test_loss: 1.2268, test_f1: 0.5374
 epoch: 17, train_loss: 0.6464, test_loss: 1.2162, test_f1: 0.5555
 epoch: 18, train_loss: 0.6701, test_loss: 1.2979, test_f1: 0.5411
 epoch: 19, train_loss: 0.6410, test_loss: 1.2423, test_f1: 0.6053
 epoch: 20, train_loss: 0.6214, test_loss: 1.1535, test_f1: 0.6002
 epoch: 21, train_loss: 0.5951, test_loss: 1.1998, test_f1: 0.6259
 epoch: 22, train_loss: 0.5861, test_loss: 1.2848, test_f1: 0.5973
 epoch: 23, train_loss: 0.5640, test_loss: 1.2115, test_f1: 0.6011
 epoch: 24, train_loss: 0.5858, test_loss: 1.2204, test_f1: 0.6181
 epoch: 25, train_loss: 0.5859, test_loss: 1.3408, test_f1: 0.5825
 epoch: 26, train_loss: 0.5627, test_loss: 1.3261, test_f1: 0.6188
 epoch: 27, train_loss: 0.5461, test_loss: 1.3270, test_f1: 0.5867
 epoch: 28, train_loss: 0.5221, test_loss: 1.2969, test_f1: 0.6238
 epoch: 29, train_loss: 0.5257, test_loss: 1.3750, test_f1: 0.5974
 epoch: 30, train_loss: 0.5166, test_loss: 1.3517, test_f1: 0.6080
 epoch: 31, train_loss: 0.5105, test_loss: 1.2774, test_f1: 0.6007
 epoch: 32, train_loss: 0.4938, test_loss: 1.4216, test_f1: 0.6293
 epoch: 33, train_loss: 0.4581, test_loss: 1.5256, test_f1: 0.5849
 epoch: 34, train_loss: 0.4876, test_loss: 1.3644, test_f1: 0.6356
 epoch: 35, train_loss: 0.4829, test_loss: 1.4800, test_f1: 0.6248
 epoch: 36, train_loss: 0.4942, test_loss: 1.4525, test_f1: 0.6164
 epoch: 37, train_loss: 0.4774, test_loss: 1.3293, test_f1: 0.6327
 epoch: 38, train_loss: 0.4357, test_loss: 1.4553, test_f1: 0.6388
 epoch: 39, train_loss: 0.4506, test_loss: 1.4829, test_f1: 0.6256
 epoch: 40, train_loss: 0.4130, test_loss: 1.5240, test_f1: 0.6341
 epoch: 41, train_loss: 0.4260, test_loss: 1.4524, test_f1: 0.6358
 epoch: 42, train_loss: 0.4045, test_loss: 1.5974, test_f1: 0.6266
 epoch: 43, train_loss: 0.4019, test_loss: 1.6443, test_f1: 0.6214
 epoch: 44, train_loss: 0.3675, test_loss: 1.6613, test_f1: 0.6015
 epoch: 45, train_loss: 0.3955, test_loss: 1.8805, test_f1: 0.5910
 epoch: 46, train_loss: 0.3729, test_loss: 1.6152, test_f1: 0.6306
 epoch: 47, train_loss: 0.3814, test_loss: 1.7256, test_f1: 0.6004
 epoch: 48, train_loss: 0.3591, test_loss: 1.6376, test_f1: 0.6296
 epoch: 49, train_loss: 0.3831, test_loss: 1.6577, test_f1: 0.6347
 epoch: 50, train_loss: 0.3911, test_loss: 1.8215, test_f1: 0.6195
 epoch: 51, train_loss: 0.3284, test_loss: 1.7866, test_f1: 0.6324
 epoch: 52, train_loss: 0.2973, test_loss: 1.7665, test_f1: 0.6286
 epoch: 53, train_loss: 0.2746, test_loss: 1.7366, test_f1: 0.6269
 epoch: 54, train_loss: 0.2859, test_loss: 1.8352, test_f1: 0.6202
 epoch: 55, train_loss: 0.2966, test_loss: 1.8587, test_f1: 0.6174
 epoch: 56, train_loss: 0.2687, test_loss: 1.9289, test_f1: 0.6377
 epoch: 57, train_loss: 0.2701, test_loss: 1.8771, test_f1: 0.6331
 epoch: 58, train_loss: 0.2624, test_loss: 1.9556, test_f1: 0.5879
 epoch: 59, train_loss: 0.2677, test_loss: 1.9190, test_f1: 0.6103
 epoch: 60, train_loss: 0.2438, test_loss: 2.0557, test_f1: 0.6381
 epoch: 61, train_loss: 0.2557, test_loss: 1.9963, test_f1: 0.6190
 epoch: 62, train_loss: 0.2410, test_loss: 2.0858, test_f1: 0.6223
 epoch: 63, train_loss: 0.2271, test_loss: 2.1319, test_f1: 0.6288
 epoch: 64, train_loss: 0.2411, test_loss: 2.0039, test_f1: 0.6541
 epoch: 65, train_loss: 0.2249, test_loss: 2.1636, test_f1: 0.6448
 epoch: 66, train_loss: 0.1980, test_loss: 2.1308, test_f1: 0.6087
 epoch: 67, train_loss: 0.2279, test_loss: 2.1164, test_f1: 0.6149
 epoch: 68, train_loss: 0.2107, test_loss: 2.2177, test_f1: 0.5978
 epoch: 69, train_loss: 0.2475, test_loss: 2.2147, test_f1: 0.6280
 epoch: 70, train_loss: 0.2305, test_loss: 2.2139, test_f1: 0.6320
 epoch: 71, train_loss: 0.2058, test_loss: 2.1497, test_f1: 0.6445
 epoch: 72, train_loss: 0.2123, test_loss: 2.4353, test_f1: 0.5906
 epoch: 73, train_loss: 0.2101, test_loss: 2.1823, test_f1: 0.6426
 epoch: 74, train_loss: 0.1996, test_loss: 2.2726, test_f1: 0.6319
 epoch: 75, train_loss: 0.2063, test_loss: 2.5890, test_f1: 0.5853
 epoch: 76, train_loss: 0.2140, test_loss: 2.2824, test_f1: 0.6305
 epoch: 77, train_loss: 0.2322, test_loss: 2.4873, test_f1: 0.6153
 epoch: 78, train_loss: 0.2108, test_loss: 2.6291, test_f1: 0.5950
 epoch: 79, train_loss: 0.2249, test_loss: 2.3679, test_f1: 0.6222
 epoch: 80, train_loss: 0.2199, test_loss: 2.1787, test_f1: 0.6337
 epoch: 81, train_loss: 0.2095, test_loss: 2.4195, test_f1: 0.6149
 epoch: 82, train_loss: 0.1986, test_loss: 2.3445, test_f1: 0.6334
 epoch: 83, train_loss: 0.1781, test_loss: 2.4840, test_f1: 0.6159
 epoch: 84, train_loss: 0.1797, test_loss: 2.6343, test_f1: 0.6091
 epoch: 85, train_loss: 0.1711, test_loss: 2.5246, test_f1: 0.6401
 epoch: 86, train_loss: 0.1842, test_loss: 2.6719, test_f1: 0.6065
 epoch: 87, train_loss: 0.1741, test_loss: 2.5652, test_f1: 0.6214
 epoch: 88, train_loss: 0.1953, test_loss: 2.5812, test_f1: 0.6142
 epoch: 89, train_loss: 0.2020, test_loss: 2.6589, test_f1: 0.6040
 epoch: 90, train_loss: 0.1891, test_loss: 2.4348, test_f1: 0.6288
 epoch: 91, train_loss: 0.1989, test_loss: 2.4686, test_f1: 0.6428
 epoch: 92, train_loss: 0.1600, test_loss: 2.7756, test_f1: 0.5946
 epoch: 93, train_loss: 0.1920, test_loss: 2.6748, test_f1: 0.6013
 epoch: 94, train_loss: 0.1812, test_loss: 2.6567, test_f1: 0.6353
 epoch: 95, train_loss: 0.1684, test_loss: 2.8213, test_f1: 0.5733
 epoch: 96, train_loss: 0.1729, test_loss: 2.4863, test_f1: 0.6093
 epoch: 97, train_loss: 0.1472, test_loss: 2.4180, test_f1: 0.6401
 epoch: 98, train_loss: 0.1694, test_loss: 2.5235, test_f1: 0.6367
 epoch: 99, train_loss: 0.1641, test_loss: 2.5937, test_f1: 0.6140
##################ITERATION #9 ****************************************
 epoch: 0, train_loss: 1.5192, test_loss: 1.4337, test_f1: 0.2583
 epoch: 1, train_loss: 1.1287, test_loss: 1.2026, test_f1: 0.3924
 epoch: 2, train_loss: 1.0214, test_loss: 1.1037, test_f1: 0.5218
 epoch: 3, train_loss: 0.9522, test_loss: 1.1019, test_f1: 0.5371
 epoch: 4, train_loss: 0.9154, test_loss: 1.1247, test_f1: 0.5344
 epoch: 5, train_loss: 0.8991, test_loss: 1.1665, test_f1: 0.5497
 epoch: 6, train_loss: 0.8602, test_loss: 1.0663, test_f1: 0.5921
 epoch: 7, train_loss: 0.8383, test_loss: 1.1014, test_f1: 0.5943
 epoch: 8, train_loss: 0.8242, test_loss: 1.1528, test_f1: 0.5828
 epoch: 9, train_loss: 0.7810, test_loss: 1.0969, test_f1: 0.6005
 epoch: 10, train_loss: 0.7836, test_loss: 1.1384, test_f1: 0.5857
 epoch: 11, train_loss: 0.7376, test_loss: 1.1220, test_f1: 0.6091
 epoch: 12, train_loss: 0.6862, test_loss: 1.1546, test_f1: 0.5753
 epoch: 13, train_loss: 0.6923, test_loss: 1.2021, test_f1: 0.5775
 epoch: 14, train_loss: 0.6703, test_loss: 1.1718, test_f1: 0.5892
 epoch: 15, train_loss: 0.6702, test_loss: 1.1216, test_f1: 0.5601
 epoch: 16, train_loss: 0.6499, test_loss: 1.1537, test_f1: 0.6293
 epoch: 17, train_loss: 0.6412, test_loss: 1.3135, test_f1: 0.5981
 epoch: 18, train_loss: 0.6273, test_loss: 1.2276, test_f1: 0.5641
 epoch: 19, train_loss: 0.6102, test_loss: 1.1859, test_f1: 0.6080
 epoch: 20, train_loss: 0.6242, test_loss: 1.3446, test_f1: 0.5737
 epoch: 21, train_loss: 0.5861, test_loss: 1.2895, test_f1: 0.5975
 epoch: 22, train_loss: 0.5571, test_loss: 1.3430, test_f1: 0.5919
 epoch: 23, train_loss: 0.5720, test_loss: 1.4527, test_f1: 0.5698
 epoch: 24, train_loss: 0.5690, test_loss: 1.4094, test_f1: 0.5929
 epoch: 25, train_loss: 0.5893, test_loss: 1.5186, test_f1: 0.5385
 epoch: 26, train_loss: 0.5432, test_loss: 1.3906, test_f1: 0.5520
 epoch: 27, train_loss: 0.5252, test_loss: 1.2947, test_f1: 0.6087
 epoch: 28, train_loss: 0.5082, test_loss: 1.3742, test_f1: 0.5914
 epoch: 29, train_loss: 0.4898, test_loss: 1.4549, test_f1: 0.5725
 epoch: 30, train_loss: 0.4779, test_loss: 1.4668, test_f1: 0.5868
 epoch: 31, train_loss: 0.4758, test_loss: 1.5899, test_f1: 0.5586
 epoch: 32, train_loss: 0.4552, test_loss: 1.5713, test_f1: 0.6100
 epoch: 33, train_loss: 0.4603, test_loss: 1.6310, test_f1: 0.5969
 epoch: 34, train_loss: 0.4269, test_loss: 1.5006, test_f1: 0.5944
 epoch: 35, train_loss: 0.4675, test_loss: 1.5962, test_f1: 0.5864
 epoch: 36, train_loss: 0.4316, test_loss: 1.4558, test_f1: 0.6046
 epoch: 37, train_loss: 0.4555, test_loss: 1.7217, test_f1: 0.5997
 epoch: 38, train_loss: 0.4197, test_loss: 1.7171, test_f1: 0.5837
 epoch: 39, train_loss: 0.4282, test_loss: 1.5233, test_f1: 0.6105
 epoch: 40, train_loss: 0.4240, test_loss: 1.6303, test_f1: 0.5965
 epoch: 41, train_loss: 0.3855, test_loss: 1.5974, test_f1: 0.6365
 epoch: 42, train_loss: 0.3580, test_loss: 1.8104, test_f1: 0.6027
 epoch: 43, train_loss: 0.3549, test_loss: 1.8141, test_f1: 0.6137
 epoch: 44, train_loss: 0.3892, test_loss: 1.9137, test_f1: 0.5886
 epoch: 45, train_loss: 0.3909, test_loss: 1.8211, test_f1: 0.6326
 epoch: 46, train_loss: 0.3536, test_loss: 2.0891, test_f1: 0.5783
 epoch: 47, train_loss: 0.3685, test_loss: 1.9943, test_f1: 0.5810
 epoch: 48, train_loss: 0.3504, test_loss: 1.8591, test_f1: 0.5901
 epoch: 49, train_loss: 0.3295, test_loss: 1.9258, test_f1: 0.5645
 epoch: 50, train_loss: 0.3401, test_loss: 2.0252, test_f1: 0.6340
 epoch: 51, train_loss: 0.3137, test_loss: 2.0457, test_f1: 0.6111
 epoch: 52, train_loss: 0.2783, test_loss: 2.1927, test_f1: 0.6027
 epoch: 53, train_loss: 0.2546, test_loss: 2.0640, test_f1: 0.5830
 epoch: 54, train_loss: 0.2421, test_loss: 2.2778, test_f1: 0.5860
 epoch: 55, train_loss: 0.2547, test_loss: 2.0685, test_f1: 0.5834
 epoch: 56, train_loss: 0.2376, test_loss: 2.2955, test_f1: 0.6069
 epoch: 57, train_loss: 0.2520, test_loss: 2.3152, test_f1: 0.5721
 epoch: 58, train_loss: 0.2507, test_loss: 2.1651, test_f1: 0.5889
 epoch: 59, train_loss: 0.2343, test_loss: 2.2285, test_f1: 0.6084
 epoch: 60, train_loss: 0.2282, test_loss: 2.3317, test_f1: 0.5704
 epoch: 61, train_loss: 0.2235, test_loss: 2.1096, test_f1: 0.5659
 epoch: 62, train_loss: 0.2130, test_loss: 2.2997, test_f1: 0.6016
 epoch: 63, train_loss: 0.2171, test_loss: 2.5101, test_f1: 0.5902
 epoch: 64, train_loss: 0.2232, test_loss: 2.5574, test_f1: 0.5745
 epoch: 65, train_loss: 0.2035, test_loss: 2.2312, test_f1: 0.5842
 epoch: 66, train_loss: 0.2097, test_loss: 2.3847, test_f1: 0.5806
 epoch: 67, train_loss: 0.2239, test_loss: 2.4098, test_f1: 0.5960
 epoch: 68, train_loss: 0.2196, test_loss: 2.3536, test_f1: 0.5883
 epoch: 69, train_loss: 0.2175, test_loss: 2.4716, test_f1: 0.5870
 epoch: 70, train_loss: 0.2235, test_loss: 2.4095, test_f1: 0.5740
 epoch: 71, train_loss: 0.2038, test_loss: 2.4167, test_f1: 0.6005
 epoch: 72, train_loss: 0.1946, test_loss: 2.4189, test_f1: 0.5882
 epoch: 73, train_loss: 0.1972, test_loss: 2.3998, test_f1: 0.6088
 epoch: 74, train_loss: 0.1892, test_loss: 2.4143, test_f1: 0.6065
 epoch: 75, train_loss: 0.1664, test_loss: 2.4792, test_f1: 0.5723
 epoch: 76, train_loss: 0.1742, test_loss: 2.6541, test_f1: 0.5823
 epoch: 77, train_loss: 0.1955, test_loss: 2.5342, test_f1: 0.6066
 epoch: 78, train_loss: 0.1837, test_loss: 2.5786, test_f1: 0.6224
 epoch: 79, train_loss: 0.1653, test_loss: 2.4236, test_f1: 0.6066
 epoch: 80, train_loss: 0.1574, test_loss: 2.8113, test_f1: 0.6133
 epoch: 81, train_loss: 0.1673, test_loss: 2.6213, test_f1: 0.6063
 epoch: 82, train_loss: 0.1761, test_loss: 2.7463, test_f1: 0.5932
 epoch: 83, train_loss: 0.1842, test_loss: 2.7361, test_f1: 0.5920
 epoch: 84, train_loss: 0.1717, test_loss: 2.6731, test_f1: 0.6081
 epoch: 85, train_loss: 0.1734, test_loss: 2.5853, test_f1: 0.6078
 epoch: 86, train_loss: 0.1867, test_loss: 3.1454, test_f1: 0.5878
 epoch: 87, train_loss: 0.1729, test_loss: 2.8221, test_f1: 0.5936
 epoch: 88, train_loss: 0.1695, test_loss: 2.7290, test_f1: 0.5780
 epoch: 89, train_loss: 0.1437, test_loss: 2.6221, test_f1: 0.6099
 epoch: 90, train_loss: 0.1726, test_loss: 2.3801, test_f1: 0.6082
 epoch: 91, train_loss: 0.1670, test_loss: 2.6415, test_f1: 0.6087
 epoch: 92, train_loss: 0.1770, test_loss: 2.5445, test_f1: 0.6082
 epoch: 93, train_loss: 0.1621, test_loss: 2.5955, test_f1: 0.6115
 epoch: 94, train_loss: 0.1520, test_loss: 2.8504, test_f1: 0.6068
 epoch: 95, train_loss: 0.1432, test_loss: 2.6603, test_f1: 0.5989
 epoch: 96, train_loss: 0.1314, test_loss: 2.7857, test_f1: 0.6119
 epoch: 97, train_loss: 0.1444, test_loss: 3.1159, test_f1: 0.5795
 epoch: 98, train_loss: 0.1637, test_loss: 2.7836, test_f1: 0.5722
 epoch: 99, train_loss: 0.1452, test_loss: 2.9715, test_f1: 0.5899

Training completed in 656.07 seconds
Best F1: 0.6680 at epoch 48
Mean F1 across iterations: 0.6559  0.0093
========================FINAL RESULTS================================
FEGIN weighted F1: 0.6680  0.0093
python main.py --data ltspice_demos --representation component_pin_net --model FEGIN --layers 4 --hiddens 64 --batch_size 64 --lr 0.001 --emb_size 128 --epochs 100 --save_appendix component_pin_net_L4_H64_BS64_LR0.001_E128 --no_val
-----



STDERR:
  File "main.py", line 370, in <module>
    main()
  File "main.py", line 254, in main
    dataset = dataset_class(
  File "/home/philip/projects/ltspice_examples_code_repo/Circuit-Completion-Using-GNNs/component_classification_with_link_prediction_head/evaluation/FEGIN/kernel/circuit_datasets.py", line 15, in __init__
    self.data, self.slices = torch.load(self.processed_paths[0])
  File "/home/philip/.local/lib/python3.8/site-packages/torch/serialization.py", line 1040, in load
    warnings.warn(
  File "/usr/lib/python3.8/warnings.py", line 109, in _showwarnmsg
    sw(msg.message, msg.category, msg.filename, msg.lineno,
  File "main.py", line 47, in warn_with_traceback
    traceback.print_stack(file=log)
/home/philip/projects/ltspice_examples_code_repo/Circuit-Completion-Using-GNNs/component_classification_with_link_prediction_head/evaluation/FEGIN/kernel/circuit_datasets.py:15: FutureWarning: You are using `torch.load` with `weights_only=False` (the current default value), which uses the default pickle module implicitly. It is possible to construct malicious pickle data which will execute arbitrary code during unpickling (See https://github.com/pytorch/pytorch/blob/main/SECURITY.md#untrusted-models for more details). In a future release, the default value for `weights_only` will be flipped to `True`. This limits the functions that could be executed during unpickling. Arbitrary objects will no longer be allowed to be loaded via this mode unless they are explicitly allowlisted by the user via `torch.serialization.add_safe_globals`. We recommend you start setting `weights_only=True` for any use case where you don't have full control of the loaded file. Please open an issue on GitHub for any issues related to this experimental feature.
  self.data, self.slices = torch.load(self.processed_paths[0])
