STDOUT:
Results will be saved in /home/philip/projects/ltspice_examples_code_repo/Circuit-Completion-Using-GNNs/component_classification_with_link_prediction_head/evaluation/FEGIN/results/model_FEGIN_dataset_ltspice_examples
Command line input: python main.py --data ltspice_examples --representation component_pin_net --model FEGIN --layers 4 --hiddens 16 --batch_size 32 --lr 0.01 --emb_size 250 --epochs 100 --save_appendix component_pin_net_L4_H16_BS32_LR0.01_E250 --no_val
 is saved.
-----
ltspice_examples - FEGIN
Using 4 layers, 16 hidden units, h = 2
Loading component_pin_net representation dataset
ENTERED
Training FEGIN on component_pin_net representation
Train: 3558, Test: 846
##################ITERATION #0 ****************************************
 epoch: 0, train_loss: 1.1750, test_loss: 1.1835, test_f1: 0.4120
 epoch: 1, train_loss: 1.0446, test_loss: 1.0557, test_f1: 0.4430
 epoch: 2, train_loss: 1.0181, test_loss: 1.0178, test_f1: 0.4618
 epoch: 3, train_loss: 0.9956, test_loss: 0.9941, test_f1: 0.4725
 epoch: 4, train_loss: 0.9996, test_loss: 1.0161, test_f1: 0.4744
 epoch: 5, train_loss: 0.9999, test_loss: 0.9531, test_f1: 0.4958
 epoch: 6, train_loss: 0.9697, test_loss: 0.9383, test_f1: 0.5168
 epoch: 7, train_loss: 0.9607, test_loss: 1.0907, test_f1: 0.4070
 epoch: 8, train_loss: 0.9640, test_loss: 1.0048, test_f1: 0.4782
 epoch: 9, train_loss: 0.9529, test_loss: 0.9649, test_f1: 0.5124
 epoch: 10, train_loss: 0.9473, test_loss: 0.9087, test_f1: 0.5213
 epoch: 11, train_loss: 0.9509, test_loss: 0.9068, test_f1: 0.5318
 epoch: 12, train_loss: 0.9386, test_loss: 0.9132, test_f1: 0.5102
 epoch: 13, train_loss: 0.9149, test_loss: 0.9210, test_f1: 0.5236
 epoch: 14, train_loss: 0.9199, test_loss: 0.9299, test_f1: 0.5539
 epoch: 15, train_loss: 0.9222, test_loss: 0.9627, test_f1: 0.5222
 epoch: 16, train_loss: 0.9195, test_loss: 0.9445, test_f1: 0.5059
 epoch: 17, train_loss: 0.9091, test_loss: 0.9516, test_f1: 0.5190
 epoch: 18, train_loss: 0.8915, test_loss: 0.9070, test_f1: 0.5293
 epoch: 19, train_loss: 0.9099, test_loss: 0.8961, test_f1: 0.5190
 epoch: 20, train_loss: 0.9042, test_loss: 0.8942, test_f1: 0.5232
 epoch: 21, train_loss: 0.8895, test_loss: 0.8589, test_f1: 0.5337
 epoch: 22, train_loss: 0.9015, test_loss: 1.0644, test_f1: 0.4431
 epoch: 23, train_loss: 0.8947, test_loss: 0.9965, test_f1: 0.5001
 epoch: 24, train_loss: 0.8952, test_loss: 0.9441, test_f1: 0.5529
 epoch: 25, train_loss: 0.9037, test_loss: 1.0030, test_f1: 0.5365
 epoch: 26, train_loss: 0.8928, test_loss: 0.9201, test_f1: 0.5563
 epoch: 27, train_loss: 0.8723, test_loss: 0.9558, test_f1: 0.5457
 epoch: 28, train_loss: 0.8687, test_loss: 0.9057, test_f1: 0.5538
 epoch: 29, train_loss: 0.8940, test_loss: 0.8853, test_f1: 0.5960
 epoch: 30, train_loss: 0.8838, test_loss: 0.9045, test_f1: 0.5475
 epoch: 31, train_loss: 0.8701, test_loss: 0.8968, test_f1: 0.5247
 epoch: 32, train_loss: 0.8802, test_loss: 0.8851, test_f1: 0.5778
 epoch: 33, train_loss: 0.8515, test_loss: 0.8925, test_f1: 0.5447
 epoch: 34, train_loss: 0.8641, test_loss: 0.9356, test_f1: 0.5163
 epoch: 35, train_loss: 0.8699, test_loss: 0.8728, test_f1: 0.5316
 epoch: 36, train_loss: 0.8576, test_loss: 0.8985, test_f1: 0.5882
 epoch: 37, train_loss: 0.8670, test_loss: 0.8771, test_f1: 0.5427
 epoch: 38, train_loss: 0.8503, test_loss: 0.8972, test_f1: 0.5926
 epoch: 39, train_loss: 0.8524, test_loss: 0.9033, test_f1: 0.5488
 epoch: 40, train_loss: 0.8525, test_loss: 0.8962, test_f1: 0.5553
 epoch: 41, train_loss: 0.8525, test_loss: 0.9178, test_f1: 0.5320
 epoch: 42, train_loss: 0.8471, test_loss: 0.8569, test_f1: 0.5575
 epoch: 43, train_loss: 0.8480, test_loss: 0.8795, test_f1: 0.5928
 epoch: 44, train_loss: 0.8421, test_loss: 0.8616, test_f1: 0.6057
 epoch: 45, train_loss: 0.8377, test_loss: 0.9260, test_f1: 0.5787
 epoch: 46, train_loss: 0.8420, test_loss: 0.8518, test_f1: 0.5604
 epoch: 47, train_loss: 0.8381, test_loss: 0.8500, test_f1: 0.5892
 epoch: 48, train_loss: 0.8509, test_loss: 0.8091, test_f1: 0.5689
 epoch: 49, train_loss: 0.8464, test_loss: 0.8693, test_f1: 0.5806
 epoch: 50, train_loss: 0.8372, test_loss: 0.8415, test_f1: 0.5358
 epoch: 51, train_loss: 0.8208, test_loss: 0.8379, test_f1: 0.5847
 epoch: 52, train_loss: 0.8085, test_loss: 0.8170, test_f1: 0.5956
 epoch: 53, train_loss: 0.8038, test_loss: 0.8078, test_f1: 0.6010
 epoch: 54, train_loss: 0.8145, test_loss: 0.8161, test_f1: 0.5913
 epoch: 55, train_loss: 0.8080, test_loss: 0.8569, test_f1: 0.5760
 epoch: 56, train_loss: 0.8012, test_loss: 0.8027, test_f1: 0.5938
 epoch: 57, train_loss: 0.8145, test_loss: 0.8301, test_f1: 0.5942
 epoch: 58, train_loss: 0.8022, test_loss: 0.8756, test_f1: 0.5760
 epoch: 59, train_loss: 0.8006, test_loss: 0.8191, test_f1: 0.5967
 epoch: 60, train_loss: 0.8010, test_loss: 0.8530, test_f1: 0.5796
 epoch: 61, train_loss: 0.7865, test_loss: 0.8410, test_f1: 0.6205
 epoch: 62, train_loss: 0.8046, test_loss: 0.7997, test_f1: 0.6209
 epoch: 63, train_loss: 0.7943, test_loss: 0.7736, test_f1: 0.6087
 epoch: 64, train_loss: 0.7954, test_loss: 0.8494, test_f1: 0.5923
 epoch: 65, train_loss: 0.7867, test_loss: 0.8786, test_f1: 0.5940
 epoch: 66, train_loss: 0.7892, test_loss: 0.8380, test_f1: 0.5878
 epoch: 67, train_loss: 0.7970, test_loss: 0.7917, test_f1: 0.5874
 epoch: 68, train_loss: 0.7966, test_loss: 0.8660, test_f1: 0.5841
 epoch: 69, train_loss: 0.7952, test_loss: 0.8349, test_f1: 0.6134
 epoch: 70, train_loss: 0.7753, test_loss: 0.8142, test_f1: 0.6349
 epoch: 71, train_loss: 0.7800, test_loss: 0.8386, test_f1: 0.6478
 epoch: 72, train_loss: 0.7691, test_loss: 0.8182, test_f1: 0.6457
 epoch: 73, train_loss: 0.7793, test_loss: 0.8760, test_f1: 0.6314
 epoch: 74, train_loss: 0.7903, test_loss: 0.8670, test_f1: 0.6357
 epoch: 75, train_loss: 0.7768, test_loss: 0.8937, test_f1: 0.5892
 epoch: 76, train_loss: 0.7779, test_loss: 0.8437, test_f1: 0.6066
 epoch: 77, train_loss: 0.7788, test_loss: 0.8422, test_f1: 0.6065
 epoch: 78, train_loss: 0.7797, test_loss: 0.8247, test_f1: 0.5952
 epoch: 79, train_loss: 0.7641, test_loss: 0.8244, test_f1: 0.5660
 epoch: 80, train_loss: 0.7742, test_loss: 0.8562, test_f1: 0.6198
 epoch: 81, train_loss: 0.7786, test_loss: 0.8622, test_f1: 0.6035
 epoch: 82, train_loss: 0.7784, test_loss: 0.7747, test_f1: 0.6310
 epoch: 83, train_loss: 0.7671, test_loss: 0.8428, test_f1: 0.6255
 epoch: 84, train_loss: 0.7759, test_loss: 0.8007, test_f1: 0.6246
 epoch: 85, train_loss: 0.7662, test_loss: 0.8522, test_f1: 0.6207
 epoch: 86, train_loss: 0.7744, test_loss: 0.8144, test_f1: 0.6062
 epoch: 87, train_loss: 0.7666, test_loss: 0.8323, test_f1: 0.6356
 epoch: 88, train_loss: 0.7544, test_loss: 0.8251, test_f1: 0.6011
 epoch: 89, train_loss: 0.7632, test_loss: 0.7816, test_f1: 0.6194
 epoch: 90, train_loss: 0.7610, test_loss: 0.8806, test_f1: 0.6242
 epoch: 91, train_loss: 0.7706, test_loss: 0.8799, test_f1: 0.6351
 epoch: 92, train_loss: 0.7747, test_loss: 0.9208, test_f1: 0.6189
 epoch: 93, train_loss: 0.7653, test_loss: 0.8721, test_f1: 0.6121
 epoch: 94, train_loss: 0.7537, test_loss: 0.8299, test_f1: 0.6037
 epoch: 95, train_loss: 0.7602, test_loss: 0.8725, test_f1: 0.6128
 epoch: 96, train_loss: 0.7581, test_loss: 0.8504, test_f1: 0.6026
 epoch: 97, train_loss: 0.7513, test_loss: 0.8163, test_f1: 0.6393
 epoch: 98, train_loss: 0.7505, test_loss: 0.8069, test_f1: 0.6300
 epoch: 99, train_loss: 0.7672, test_loss: 0.7804, test_f1: 0.6328
##################ITERATION #1 ****************************************
 epoch: 0, train_loss: 1.1177, test_loss: 1.2704, test_f1: 0.4013
 epoch: 1, train_loss: 1.0478, test_loss: 1.0902, test_f1: 0.3425
 epoch: 2, train_loss: 1.0332, test_loss: 1.0197, test_f1: 0.4167
 epoch: 3, train_loss: 1.0084, test_loss: 1.0821, test_f1: 0.4251
 epoch: 4, train_loss: 1.0012, test_loss: 1.0542, test_f1: 0.4572
 epoch: 5, train_loss: 0.9747, test_loss: 0.9830, test_f1: 0.4727
 epoch: 6, train_loss: 0.9761, test_loss: 0.9905, test_f1: 0.4745
 epoch: 7, train_loss: 0.9761, test_loss: 1.0253, test_f1: 0.4700
 epoch: 8, train_loss: 0.9711, test_loss: 1.0243, test_f1: 0.4518
 epoch: 9, train_loss: 0.9622, test_loss: 0.9397, test_f1: 0.5062
 epoch: 10, train_loss: 0.9520, test_loss: 1.0132, test_f1: 0.4678
 epoch: 11, train_loss: 0.9427, test_loss: 1.0020, test_f1: 0.5113
 epoch: 12, train_loss: 0.9416, test_loss: 0.9284, test_f1: 0.4676
 epoch: 13, train_loss: 0.9313, test_loss: 1.0050, test_f1: 0.4979
 epoch: 14, train_loss: 0.9241, test_loss: 0.9111, test_f1: 0.4922
 epoch: 15, train_loss: 0.9218, test_loss: 0.9447, test_f1: 0.5143
 epoch: 16, train_loss: 0.9198, test_loss: 0.9230, test_f1: 0.5222
 epoch: 17, train_loss: 0.9083, test_loss: 0.9685, test_f1: 0.4918
 epoch: 18, train_loss: 0.9192, test_loss: 0.9061, test_f1: 0.5116
 epoch: 19, train_loss: 0.9027, test_loss: 0.9413, test_f1: 0.5229
 epoch: 20, train_loss: 0.9018, test_loss: 0.8426, test_f1: 0.5351
 epoch: 21, train_loss: 0.9081, test_loss: 0.9095, test_f1: 0.5394
 epoch: 22, train_loss: 0.9027, test_loss: 0.9339, test_f1: 0.5222
 epoch: 23, train_loss: 0.9034, test_loss: 0.8625, test_f1: 0.5618
 epoch: 24, train_loss: 0.8853, test_loss: 0.9000, test_f1: 0.4997
 epoch: 25, train_loss: 0.8981, test_loss: 0.8906, test_f1: 0.5274
 epoch: 26, train_loss: 0.8846, test_loss: 0.8750, test_f1: 0.5621
 epoch: 27, train_loss: 0.8794, test_loss: 0.9048, test_f1: 0.5453
 epoch: 28, train_loss: 0.8935, test_loss: 0.8890, test_f1: 0.5264
 epoch: 29, train_loss: 0.8858, test_loss: 1.0706, test_f1: 0.4662
 epoch: 30, train_loss: 0.8817, test_loss: 0.8992, test_f1: 0.5158
 epoch: 31, train_loss: 0.8602, test_loss: 0.8476, test_f1: 0.5377
 epoch: 32, train_loss: 0.8525, test_loss: 0.8408, test_f1: 0.5401
 epoch: 33, train_loss: 0.8686, test_loss: 0.8725, test_f1: 0.5686
 epoch: 34, train_loss: 0.8910, test_loss: 0.8418, test_f1: 0.5595
 epoch: 35, train_loss: 0.8502, test_loss: 0.7959, test_f1: 0.5753
 epoch: 36, train_loss: 0.8558, test_loss: 0.8736, test_f1: 0.5459
 epoch: 37, train_loss: 0.8655, test_loss: 0.9060, test_f1: 0.5452
 epoch: 38, train_loss: 0.8527, test_loss: 0.8742, test_f1: 0.5490
 epoch: 39, train_loss: 0.8510, test_loss: 0.8526, test_f1: 0.5671
 epoch: 40, train_loss: 0.8544, test_loss: 0.9363, test_f1: 0.5701
 epoch: 41, train_loss: 0.8537, test_loss: 0.8571, test_f1: 0.5217
 epoch: 42, train_loss: 0.8461, test_loss: 0.8034, test_f1: 0.5877
 epoch: 43, train_loss: 0.8274, test_loss: 0.8288, test_f1: 0.5410
 epoch: 44, train_loss: 0.8427, test_loss: 0.8801, test_f1: 0.5560
 epoch: 45, train_loss: 0.8446, test_loss: 0.8797, test_f1: 0.5850
 epoch: 46, train_loss: 0.8494, test_loss: 0.8645, test_f1: 0.5565
 epoch: 47, train_loss: 0.8431, test_loss: 0.8566, test_f1: 0.5504
 epoch: 48, train_loss: 0.8303, test_loss: 0.8961, test_f1: 0.6081
 epoch: 49, train_loss: 0.8243, test_loss: 0.8719, test_f1: 0.5672
 epoch: 50, train_loss: 0.8274, test_loss: 0.8029, test_f1: 0.5971
 epoch: 51, train_loss: 0.8075, test_loss: 0.8645, test_f1: 0.6083
 epoch: 52, train_loss: 0.7998, test_loss: 0.7782, test_f1: 0.5985
 epoch: 53, train_loss: 0.7928, test_loss: 0.7812, test_f1: 0.6349
 epoch: 54, train_loss: 0.7906, test_loss: 0.7962, test_f1: 0.6056
 epoch: 55, train_loss: 0.7972, test_loss: 0.7293, test_f1: 0.6325
 epoch: 56, train_loss: 0.7898, test_loss: 0.7987, test_f1: 0.5953
 epoch: 57, train_loss: 0.7886, test_loss: 0.7665, test_f1: 0.6267
 epoch: 58, train_loss: 0.7850, test_loss: 0.7450, test_f1: 0.6381
 epoch: 59, train_loss: 0.7789, test_loss: 0.7628, test_f1: 0.6109
 epoch: 60, train_loss: 0.7880, test_loss: 0.7786, test_f1: 0.6241
 epoch: 61, train_loss: 0.7790, test_loss: 0.8396, test_f1: 0.5703
 epoch: 62, train_loss: 0.7739, test_loss: 0.7129, test_f1: 0.6256
 epoch: 63, train_loss: 0.7684, test_loss: 0.7956, test_f1: 0.6105
 epoch: 64, train_loss: 0.7796, test_loss: 0.7981, test_f1: 0.6007
 epoch: 65, train_loss: 0.7759, test_loss: 0.8100, test_f1: 0.5917
 epoch: 66, train_loss: 0.7813, test_loss: 0.8021, test_f1: 0.5953
 epoch: 67, train_loss: 0.7769, test_loss: 0.8020, test_f1: 0.5947
 epoch: 68, train_loss: 0.7631, test_loss: 0.7834, test_f1: 0.6185
 epoch: 69, train_loss: 0.7699, test_loss: 0.8025, test_f1: 0.6134
 epoch: 70, train_loss: 0.7634, test_loss: 0.8777, test_f1: 0.5973
 epoch: 71, train_loss: 0.7571, test_loss: 0.8200, test_f1: 0.6162
 epoch: 72, train_loss: 0.7689, test_loss: 0.8112, test_f1: 0.5851
 epoch: 73, train_loss: 0.7672, test_loss: 0.8150, test_f1: 0.5853
 epoch: 74, train_loss: 0.7487, test_loss: 0.7968, test_f1: 0.5945
 epoch: 75, train_loss: 0.7599, test_loss: 0.7232, test_f1: 0.6446
 epoch: 76, train_loss: 0.7603, test_loss: 0.8278, test_f1: 0.6140
 epoch: 77, train_loss: 0.7607, test_loss: 0.7879, test_f1: 0.6289
 epoch: 78, train_loss: 0.7504, test_loss: 0.7597, test_f1: 0.6431
 epoch: 79, train_loss: 0.7688, test_loss: 0.8334, test_f1: 0.6192
 epoch: 80, train_loss: 0.7633, test_loss: 0.8798, test_f1: 0.5900
 epoch: 81, train_loss: 0.7628, test_loss: 0.8076, test_f1: 0.6139
 epoch: 82, train_loss: 0.7678, test_loss: 0.8047, test_f1: 0.6051
 epoch: 83, train_loss: 0.7521, test_loss: 0.8634, test_f1: 0.6124
 epoch: 84, train_loss: 0.7509, test_loss: 0.8814, test_f1: 0.6243
 epoch: 85, train_loss: 0.7593, test_loss: 0.8600, test_f1: 0.5962
 epoch: 86, train_loss: 0.7677, test_loss: 0.9041, test_f1: 0.6151
 epoch: 87, train_loss: 0.7576, test_loss: 0.9735, test_f1: 0.5948
 epoch: 88, train_loss: 0.7616, test_loss: 0.8287, test_f1: 0.6000
 epoch: 89, train_loss: 0.7491, test_loss: 0.7622, test_f1: 0.6278
 epoch: 90, train_loss: 0.7381, test_loss: 0.7718, test_f1: 0.6231
 epoch: 91, train_loss: 0.7399, test_loss: 0.8402, test_f1: 0.5911
 epoch: 92, train_loss: 0.7407, test_loss: 0.7965, test_f1: 0.6375
 epoch: 93, train_loss: 0.7497, test_loss: 0.7928, test_f1: 0.6039
 epoch: 94, train_loss: 0.7421, test_loss: 0.7771, test_f1: 0.6355
 epoch: 95, train_loss: 0.7440, test_loss: 0.8350, test_f1: 0.6135
 epoch: 96, train_loss: 0.7406, test_loss: 0.9048, test_f1: 0.6141
 epoch: 97, train_loss: 0.7459, test_loss: 0.8328, test_f1: 0.5939
 epoch: 98, train_loss: 0.7391, test_loss: 0.8296, test_f1: 0.5920
 epoch: 99, train_loss: 0.7475, test_loss: 0.8809, test_f1: 0.6147
##################ITERATION #2 ****************************************
 epoch: 0, train_loss: 1.1198, test_loss: 1.0545, test_f1: 0.3641
 epoch: 1, train_loss: 1.0317, test_loss: 1.0688, test_f1: 0.4670
 epoch: 2, train_loss: 1.0182, test_loss: 1.0179, test_f1: 0.4809
 epoch: 3, train_loss: 0.9933, test_loss: 1.0622, test_f1: 0.4760
 epoch: 4, train_loss: 0.9841, test_loss: 0.9884, test_f1: 0.5415
 epoch: 5, train_loss: 0.9785, test_loss: 1.0249, test_f1: 0.4714
 epoch: 6, train_loss: 0.9600, test_loss: 1.0297, test_f1: 0.4841
 epoch: 7, train_loss: 0.9545, test_loss: 1.0133, test_f1: 0.4948
 epoch: 8, train_loss: 0.9404, test_loss: 1.0178, test_f1: 0.4980
 epoch: 9, train_loss: 0.9393, test_loss: 0.9756, test_f1: 0.5105
 epoch: 10, train_loss: 0.9223, test_loss: 1.0610, test_f1: 0.4789
 epoch: 11, train_loss: 0.9403, test_loss: 1.0304, test_f1: 0.5115
 epoch: 12, train_loss: 0.9349, test_loss: 0.9473, test_f1: 0.5033
 epoch: 13, train_loss: 0.9305, test_loss: 0.9455, test_f1: 0.5161
 epoch: 14, train_loss: 0.9229, test_loss: 0.9396, test_f1: 0.5204
 epoch: 15, train_loss: 0.9205, test_loss: 0.9801, test_f1: 0.5123
 epoch: 16, train_loss: 0.9213, test_loss: 0.9840, test_f1: 0.5367
 epoch: 17, train_loss: 0.9160, test_loss: 0.9229, test_f1: 0.5273
 epoch: 18, train_loss: 0.9115, test_loss: 0.9501, test_f1: 0.5143
 epoch: 19, train_loss: 0.9001, test_loss: 0.9472, test_f1: 0.5277
 epoch: 20, train_loss: 0.9035, test_loss: 0.9812, test_f1: 0.5070
 epoch: 21, train_loss: 0.9004, test_loss: 0.9063, test_f1: 0.5122
 epoch: 22, train_loss: 0.8905, test_loss: 0.9054, test_f1: 0.5241
 epoch: 23, train_loss: 0.8875, test_loss: 0.8675, test_f1: 0.5387
 epoch: 24, train_loss: 0.8895, test_loss: 0.8758, test_f1: 0.5373
 epoch: 25, train_loss: 0.8666, test_loss: 0.8888, test_f1: 0.5299
 epoch: 26, train_loss: 0.8719, test_loss: 0.8335, test_f1: 0.5261
 epoch: 27, train_loss: 0.8827, test_loss: 0.9507, test_f1: 0.5397
 epoch: 28, train_loss: 0.8718, test_loss: 0.8923, test_f1: 0.5321
 epoch: 29, train_loss: 0.8535, test_loss: 0.7958, test_f1: 0.5803
 epoch: 30, train_loss: 0.8562, test_loss: 0.8372, test_f1: 0.5596
 epoch: 31, train_loss: 0.8709, test_loss: 0.8886, test_f1: 0.5314
 epoch: 32, train_loss: 0.8705, test_loss: 0.8616, test_f1: 0.5430
 epoch: 33, train_loss: 0.8568, test_loss: 0.8201, test_f1: 0.5479
 epoch: 34, train_loss: 0.8833, test_loss: 0.8859, test_f1: 0.5315
 epoch: 35, train_loss: 0.8626, test_loss: 0.8581, test_f1: 0.5290
 epoch: 36, train_loss: 0.8710, test_loss: 0.8846, test_f1: 0.5325
 epoch: 37, train_loss: 0.9139, test_loss: 0.8998, test_f1: 0.5115
 epoch: 38, train_loss: 0.8897, test_loss: 0.9528, test_f1: 0.4995
 epoch: 39, train_loss: 0.8679, test_loss: 0.8091, test_f1: 0.5512
 epoch: 40, train_loss: 0.8742, test_loss: 0.8649, test_f1: 0.5088
 epoch: 41, train_loss: 0.8674, test_loss: 0.9118, test_f1: 0.5174
 epoch: 42, train_loss: 0.8422, test_loss: 0.8252, test_f1: 0.5420
 epoch: 43, train_loss: 0.8473, test_loss: 0.8454, test_f1: 0.5434
 epoch: 44, train_loss: 0.8397, test_loss: 0.8480, test_f1: 0.5720
 epoch: 45, train_loss: 0.8331, test_loss: 0.8480, test_f1: 0.5517
 epoch: 46, train_loss: 0.8201, test_loss: 0.8569, test_f1: 0.5262
 epoch: 47, train_loss: 0.8446, test_loss: 0.8603, test_f1: 0.5460
 epoch: 48, train_loss: 0.8490, test_loss: 0.8560, test_f1: 0.5497
 epoch: 49, train_loss: 0.8304, test_loss: 0.8328, test_f1: 0.5394
 epoch: 50, train_loss: 0.8349, test_loss: 0.8693, test_f1: 0.5609
 epoch: 51, train_loss: 0.7933, test_loss: 0.8398, test_f1: 0.5735
 epoch: 52, train_loss: 0.7954, test_loss: 0.8121, test_f1: 0.6133
 epoch: 53, train_loss: 0.7999, test_loss: 0.8221, test_f1: 0.5689
 epoch: 54, train_loss: 0.7921, test_loss: 0.8065, test_f1: 0.5856
 epoch: 55, train_loss: 0.7938, test_loss: 0.7871, test_f1: 0.6105
 epoch: 56, train_loss: 0.7889, test_loss: 0.8206, test_f1: 0.5663
 epoch: 57, train_loss: 0.7916, test_loss: 0.8206, test_f1: 0.5892
 epoch: 58, train_loss: 0.7937, test_loss: 0.7786, test_f1: 0.5823
 epoch: 59, train_loss: 0.7702, test_loss: 0.7980, test_f1: 0.6143
 epoch: 60, train_loss: 0.7929, test_loss: 0.8151, test_f1: 0.6144
 epoch: 61, train_loss: 0.7868, test_loss: 0.8401, test_f1: 0.5804
 epoch: 62, train_loss: 0.7775, test_loss: 0.8450, test_f1: 0.6159
 epoch: 63, train_loss: 0.7806, test_loss: 0.8291, test_f1: 0.5735
 epoch: 64, train_loss: 0.7733, test_loss: 0.7563, test_f1: 0.6240
 epoch: 65, train_loss: 0.7766, test_loss: 0.8192, test_f1: 0.6245
 epoch: 66, train_loss: 0.7819, test_loss: 0.7770, test_f1: 0.5990
 epoch: 67, train_loss: 0.7692, test_loss: 0.8061, test_f1: 0.5861
 epoch: 68, train_loss: 0.7656, test_loss: 0.8350, test_f1: 0.5574
 epoch: 69, train_loss: 0.7682, test_loss: 0.8593, test_f1: 0.6086
 epoch: 70, train_loss: 0.7699, test_loss: 0.8220, test_f1: 0.6404
 epoch: 71, train_loss: 0.7644, test_loss: 0.7822, test_f1: 0.5957
 epoch: 72, train_loss: 0.7766, test_loss: 0.8054, test_f1: 0.6202
 epoch: 73, train_loss: 0.7831, test_loss: 0.7926, test_f1: 0.5934
 epoch: 74, train_loss: 0.7578, test_loss: 0.7692, test_f1: 0.6424
 epoch: 75, train_loss: 0.7638, test_loss: 0.8225, test_f1: 0.5996
 epoch: 76, train_loss: 0.7700, test_loss: 0.8107, test_f1: 0.6185
 epoch: 77, train_loss: 0.7667, test_loss: 0.8072, test_f1: 0.6323
 epoch: 78, train_loss: 0.7564, test_loss: 0.8025, test_f1: 0.6047
 epoch: 79, train_loss: 0.7705, test_loss: 0.7683, test_f1: 0.5942
 epoch: 80, train_loss: 0.7557, test_loss: 0.8011, test_f1: 0.5922
 epoch: 81, train_loss: 0.7818, test_loss: 0.8030, test_f1: 0.6272
 epoch: 82, train_loss: 0.7556, test_loss: 0.7947, test_f1: 0.5967
 epoch: 83, train_loss: 0.7700, test_loss: 0.7861, test_f1: 0.6189
 epoch: 84, train_loss: 0.7631, test_loss: 0.8242, test_f1: 0.6326
 epoch: 85, train_loss: 0.7497, test_loss: 0.8318, test_f1: 0.6064
 epoch: 86, train_loss: 0.7657, test_loss: 0.7734, test_f1: 0.6150
 epoch: 87, train_loss: 0.7504, test_loss: 0.8914, test_f1: 0.6262
 epoch: 88, train_loss: 0.7538, test_loss: 0.8309, test_f1: 0.6174
 epoch: 89, train_loss: 0.7501, test_loss: 0.8356, test_f1: 0.5821
 epoch: 90, train_loss: 0.7470, test_loss: 0.8001, test_f1: 0.6170
 epoch: 91, train_loss: 0.7461, test_loss: 0.8193, test_f1: 0.6172
 epoch: 92, train_loss: 0.7505, test_loss: 0.8214, test_f1: 0.6186
 epoch: 93, train_loss: 0.7433, test_loss: 0.8628, test_f1: 0.5930
 epoch: 94, train_loss: 0.7614, test_loss: 0.7610, test_f1: 0.6156
 epoch: 95, train_loss: 0.7535, test_loss: 0.7857, test_f1: 0.6302
 epoch: 96, train_loss: 0.7447, test_loss: 0.7777, test_f1: 0.6303
 epoch: 97, train_loss: 0.7577, test_loss: 0.8085, test_f1: 0.5906
 epoch: 98, train_loss: 0.7488, test_loss: 0.7736, test_f1: 0.5754
 epoch: 99, train_loss: 0.7548, test_loss: 0.7538, test_f1: 0.6245
##################ITERATION #3 ****************************************
 epoch: 0, train_loss: 1.1253, test_loss: 1.2368, test_f1: 0.3239
 epoch: 1, train_loss: 1.0382, test_loss: 1.0408, test_f1: 0.4532
 epoch: 2, train_loss: 1.0171, test_loss: 1.0634, test_f1: 0.4294
 epoch: 3, train_loss: 1.0049, test_loss: 1.0464, test_f1: 0.4669
 epoch: 4, train_loss: 0.9968, test_loss: 1.0192, test_f1: 0.4624
 epoch: 5, train_loss: 0.9740, test_loss: 0.9865, test_f1: 0.4875
 epoch: 6, train_loss: 0.9759, test_loss: 1.0698, test_f1: 0.4362
 epoch: 7, train_loss: 0.9693, test_loss: 1.0614, test_f1: 0.4604
 epoch: 8, train_loss: 0.9573, test_loss: 1.0368, test_f1: 0.4810
 epoch: 9, train_loss: 0.9523, test_loss: 1.0223, test_f1: 0.4665
 epoch: 10, train_loss: 0.9468, test_loss: 1.0560, test_f1: 0.4969
 epoch: 11, train_loss: 0.9357, test_loss: 0.9952, test_f1: 0.5090
 epoch: 12, train_loss: 0.9445, test_loss: 0.9594, test_f1: 0.5225
 epoch: 13, train_loss: 0.9293, test_loss: 1.2034, test_f1: 0.4219
 epoch: 14, train_loss: 0.9311, test_loss: 0.9759, test_f1: 0.5033
 epoch: 15, train_loss: 0.9243, test_loss: 0.9573, test_f1: 0.4988
 epoch: 16, train_loss: 0.9302, test_loss: 0.9912, test_f1: 0.5005
 epoch: 17, train_loss: 0.9310, test_loss: 0.9668, test_f1: 0.4954
 epoch: 18, train_loss: 0.9154, test_loss: 1.0863, test_f1: 0.4950
 epoch: 19, train_loss: 0.9124, test_loss: 0.9648, test_f1: 0.5125
 epoch: 20, train_loss: 0.9024, test_loss: 0.9850, test_f1: 0.4994
 epoch: 21, train_loss: 0.8909, test_loss: 1.0109, test_f1: 0.4945
 epoch: 22, train_loss: 0.9157, test_loss: 0.9272, test_f1: 0.5103
 epoch: 23, train_loss: 0.8967, test_loss: 0.9808, test_f1: 0.5072
 epoch: 24, train_loss: 0.8926, test_loss: 0.9395, test_f1: 0.5149
 epoch: 25, train_loss: 0.9001, test_loss: 0.9758, test_f1: 0.5189
 epoch: 26, train_loss: 0.8909, test_loss: 0.9243, test_f1: 0.5128
 epoch: 27, train_loss: 0.8885, test_loss: 0.9927, test_f1: 0.4983
 epoch: 28, train_loss: 0.8874, test_loss: 0.9823, test_f1: 0.5018
 epoch: 29, train_loss: 0.8807, test_loss: 1.0022, test_f1: 0.4902
 epoch: 30, train_loss: 0.8926, test_loss: 0.8651, test_f1: 0.5328
 epoch: 31, train_loss: 0.8914, test_loss: 0.9161, test_f1: 0.5136
 epoch: 32, train_loss: 0.8678, test_loss: 0.8821, test_f1: 0.5087
 epoch: 33, train_loss: 0.8733, test_loss: 0.9492, test_f1: 0.4990
 epoch: 34, train_loss: 0.8762, test_loss: 0.8887, test_f1: 0.5267
 epoch: 35, train_loss: 0.8735, test_loss: 0.9294, test_f1: 0.5241
 epoch: 36, train_loss: 0.8650, test_loss: 0.8472, test_f1: 0.5368
 epoch: 37, train_loss: 0.8668, test_loss: 0.9135, test_f1: 0.5382
 epoch: 38, train_loss: 0.8588, test_loss: 1.0193, test_f1: 0.5104
 epoch: 39, train_loss: 0.8691, test_loss: 0.9546, test_f1: 0.5406
 epoch: 40, train_loss: 0.8597, test_loss: 0.9128, test_f1: 0.5316
 epoch: 41, train_loss: 0.8512, test_loss: 0.9402, test_f1: 0.5269
 epoch: 42, train_loss: 0.8653, test_loss: 0.9237, test_f1: 0.5642
 epoch: 43, train_loss: 0.8468, test_loss: 0.9372, test_f1: 0.5429
 epoch: 44, train_loss: 0.8621, test_loss: 0.9167, test_f1: 0.5208
 epoch: 45, train_loss: 0.8496, test_loss: 0.9411, test_f1: 0.5171
 epoch: 46, train_loss: 0.8414, test_loss: 0.8718, test_f1: 0.5247
 epoch: 47, train_loss: 0.8415, test_loss: 0.9869, test_f1: 0.5003
 epoch: 48, train_loss: 0.8319, test_loss: 0.8734, test_f1: 0.5364
 epoch: 49, train_loss: 0.8359, test_loss: 0.9216, test_f1: 0.5243
 epoch: 50, train_loss: 0.8545, test_loss: 0.8640, test_f1: 0.5432
 epoch: 51, train_loss: 0.8294, test_loss: 0.8461, test_f1: 0.5449
 epoch: 52, train_loss: 0.8172, test_loss: 0.8507, test_f1: 0.5330
 epoch: 53, train_loss: 0.8006, test_loss: 0.9058, test_f1: 0.5320
 epoch: 54, train_loss: 0.8043, test_loss: 0.8599, test_f1: 0.5370
 epoch: 55, train_loss: 0.8052, test_loss: 0.8623, test_f1: 0.5362
 epoch: 56, train_loss: 0.8119, test_loss: 0.8582, test_f1: 0.5310
 epoch: 57, train_loss: 0.8156, test_loss: 0.8837, test_f1: 0.5425
 epoch: 58, train_loss: 0.8102, test_loss: 0.8403, test_f1: 0.5599
 epoch: 59, train_loss: 0.7878, test_loss: 0.8550, test_f1: 0.5723
 epoch: 60, train_loss: 0.7872, test_loss: 0.9004, test_f1: 0.5460
 epoch: 61, train_loss: 0.7890, test_loss: 0.8609, test_f1: 0.5449
 epoch: 62, train_loss: 0.7913, test_loss: 0.9176, test_f1: 0.5678
 epoch: 63, train_loss: 0.7810, test_loss: 0.8266, test_f1: 0.5879
 epoch: 64, train_loss: 0.7869, test_loss: 0.8765, test_f1: 0.5727
 epoch: 65, train_loss: 0.7701, test_loss: 0.8566, test_f1: 0.5591
 epoch: 66, train_loss: 0.7788, test_loss: 0.8685, test_f1: 0.5951
 epoch: 67, train_loss: 0.7805, test_loss: 0.8561, test_f1: 0.5746
 epoch: 68, train_loss: 0.7837, test_loss: 0.8883, test_f1: 0.5774
 epoch: 69, train_loss: 0.7774, test_loss: 0.8221, test_f1: 0.5766
 epoch: 70, train_loss: 0.7697, test_loss: 0.8528, test_f1: 0.5525
 epoch: 71, train_loss: 0.7759, test_loss: 0.8989, test_f1: 0.5643
 epoch: 72, train_loss: 0.7767, test_loss: 0.9132, test_f1: 0.5560
 epoch: 73, train_loss: 0.7721, test_loss: 0.9280, test_f1: 0.5334
 epoch: 74, train_loss: 0.7688, test_loss: 0.8719, test_f1: 0.5908
 epoch: 75, train_loss: 0.7572, test_loss: 0.9220, test_f1: 0.5568
 epoch: 76, train_loss: 0.7791, test_loss: 0.8762, test_f1: 0.5598
 epoch: 77, train_loss: 0.7665, test_loss: 0.9168, test_f1: 0.5934
 epoch: 78, train_loss: 0.7641, test_loss: 0.8900, test_f1: 0.5462
 epoch: 79, train_loss: 0.7546, test_loss: 0.9203, test_f1: 0.5949
 epoch: 80, train_loss: 0.7692, test_loss: 0.8491, test_f1: 0.5690
 epoch: 81, train_loss: 0.7812, test_loss: 0.8914, test_f1: 0.5982
 epoch: 82, train_loss: 0.7507, test_loss: 0.8432, test_f1: 0.5986
 epoch: 83, train_loss: 0.7579, test_loss: 0.9724, test_f1: 0.5844
 epoch: 84, train_loss: 0.7589, test_loss: 0.8926, test_f1: 0.5946
 epoch: 85, train_loss: 0.7596, test_loss: 0.8760, test_f1: 0.5671
 epoch: 86, train_loss: 0.7586, test_loss: 0.8370, test_f1: 0.6145
 epoch: 87, train_loss: 0.7534, test_loss: 0.8715, test_f1: 0.6032
 epoch: 88, train_loss: 0.7645, test_loss: 0.8285, test_f1: 0.5890
 epoch: 89, train_loss: 0.7521, test_loss: 0.8789, test_f1: 0.5724
 epoch: 90, train_loss: 0.7596, test_loss: 0.8361, test_f1: 0.5876
 epoch: 91, train_loss: 0.7600, test_loss: 0.9095, test_f1: 0.5885
 epoch: 92, train_loss: 0.7583, test_loss: 0.9697, test_f1: 0.5844
 epoch: 93, train_loss: 0.7388, test_loss: 0.8927, test_f1: 0.5904
 epoch: 94, train_loss: 0.7537, test_loss: 0.8502, test_f1: 0.5812
 epoch: 95, train_loss: 0.7551, test_loss: 0.8703, test_f1: 0.5740
 epoch: 96, train_loss: 0.7740, test_loss: 0.8356, test_f1: 0.5980
 epoch: 97, train_loss: 0.7698, test_loss: 0.8084, test_f1: 0.6259
 epoch: 98, train_loss: 0.7530, test_loss: 0.8672, test_f1: 0.5739
 epoch: 99, train_loss: 0.7564, test_loss: 0.8462, test_f1: 0.5916
##################ITERATION #4 ****************************************
 epoch: 0, train_loss: 1.1280, test_loss: 1.0723, test_f1: 0.3425
 epoch: 1, train_loss: 1.0424, test_loss: 2.8290, test_f1: 0.3735
 epoch: 2, train_loss: 1.0244, test_loss: 1.0620, test_f1: 0.4329
 epoch: 3, train_loss: 1.0135, test_loss: 1.0209, test_f1: 0.4739
 epoch: 4, train_loss: 0.9865, test_loss: 1.0330, test_f1: 0.4421
 epoch: 5, train_loss: 0.9795, test_loss: 1.0096, test_f1: 0.4842
 epoch: 6, train_loss: 0.9707, test_loss: 1.0176, test_f1: 0.4704
 epoch: 7, train_loss: 0.9528, test_loss: 1.0249, test_f1: 0.4788
 epoch: 8, train_loss: 0.9572, test_loss: 1.0426, test_f1: 0.4435
 epoch: 9, train_loss: 0.9626, test_loss: 1.0495, test_f1: 0.4800
 epoch: 10, train_loss: 0.9524, test_loss: 0.9845, test_f1: 0.4991
 epoch: 11, train_loss: 0.9516, test_loss: 0.9884, test_f1: 0.4579
 epoch: 12, train_loss: 0.9383, test_loss: 0.9667, test_f1: 0.4905
 epoch: 13, train_loss: 0.9361, test_loss: 0.8749, test_f1: 0.5273
 epoch: 14, train_loss: 0.9192, test_loss: 0.9680, test_f1: 0.5130
 epoch: 15, train_loss: 0.9247, test_loss: 0.9972, test_f1: 0.4793
 epoch: 16, train_loss: 0.9278, test_loss: 0.9645, test_f1: 0.4948
 epoch: 17, train_loss: 0.9060, test_loss: 0.9178, test_f1: 0.5168
 epoch: 18, train_loss: 0.9059, test_loss: 0.8679, test_f1: 0.5288
 epoch: 19, train_loss: 0.8956, test_loss: 0.8769, test_f1: 0.5808
 epoch: 20, train_loss: 0.8897, test_loss: 0.8918, test_f1: 0.5528
 epoch: 21, train_loss: 0.8960, test_loss: 0.8887, test_f1: 0.5052
 epoch: 22, train_loss: 0.8663, test_loss: 1.0313, test_f1: 0.4805
 epoch: 23, train_loss: 0.8953, test_loss: 1.0074, test_f1: 0.4790
 epoch: 24, train_loss: 0.8756, test_loss: 0.8887, test_f1: 0.5918
 epoch: 25, train_loss: 0.8627, test_loss: 0.9201, test_f1: 0.5973
 epoch: 26, train_loss: 0.8676, test_loss: 0.8785, test_f1: 0.5278
 epoch: 27, train_loss: 0.8861, test_loss: 0.8559, test_f1: 0.5748
 epoch: 28, train_loss: 0.8622, test_loss: 0.8587, test_f1: 0.5534
 epoch: 29, train_loss: 0.8794, test_loss: 0.8704, test_f1: 0.5315
 epoch: 30, train_loss: 0.8585, test_loss: 0.8830, test_f1: 0.5870
 epoch: 31, train_loss: 0.8598, test_loss: 0.9228, test_f1: 0.5908
 epoch: 32, train_loss: 0.8553, test_loss: 0.8826, test_f1: 0.5269
 epoch: 33, train_loss: 0.8601, test_loss: 0.9292, test_f1: 0.5531
 epoch: 34, train_loss: 0.8572, test_loss: 0.9709, test_f1: 0.5270
 epoch: 35, train_loss: 0.8498, test_loss: 0.8390, test_f1: 0.5514
 epoch: 36, train_loss: 0.8616, test_loss: 0.9000, test_f1: 0.5916
 epoch: 37, train_loss: 0.8318, test_loss: 0.8880, test_f1: 0.5233
 epoch: 38, train_loss: 0.8494, test_loss: 0.9023, test_f1: 0.5242
 epoch: 39, train_loss: 0.8456, test_loss: 0.8644, test_f1: 0.5545
 epoch: 40, train_loss: 0.8497, test_loss: 0.9271, test_f1: 0.5251
 epoch: 41, train_loss: 0.8278, test_loss: 0.8696, test_f1: 0.5848
 epoch: 42, train_loss: 0.8268, test_loss: 0.8461, test_f1: 0.5854
 epoch: 43, train_loss: 0.8417, test_loss: 0.8233, test_f1: 0.5446
 epoch: 44, train_loss: 0.8735, test_loss: 0.9365, test_f1: 0.4962
 epoch: 45, train_loss: 0.8553, test_loss: 0.8160, test_f1: 0.5557
 epoch: 46, train_loss: 0.8472, test_loss: 0.8909, test_f1: 0.5252
 epoch: 47, train_loss: 0.8375, test_loss: 0.8730, test_f1: 0.5178
 epoch: 48, train_loss: 0.8226, test_loss: 0.8640, test_f1: 0.5724
 epoch: 49, train_loss: 0.8356, test_loss: 0.7939, test_f1: 0.6006
 epoch: 50, train_loss: 0.8187, test_loss: 0.8068, test_f1: 0.5825
 epoch: 51, train_loss: 0.8013, test_loss: 0.8035, test_f1: 0.5731
 epoch: 52, train_loss: 0.7975, test_loss: 0.8207, test_f1: 0.5888
 epoch: 53, train_loss: 0.7928, test_loss: 0.8356, test_f1: 0.5619
 epoch: 54, train_loss: 0.7984, test_loss: 0.8207, test_f1: 0.6117
 epoch: 55, train_loss: 0.7862, test_loss: 0.8165, test_f1: 0.5897
 epoch: 56, train_loss: 0.7839, test_loss: 0.8103, test_f1: 0.6014
 epoch: 57, train_loss: 0.7816, test_loss: 0.8431, test_f1: 0.5860
 epoch: 58, train_loss: 0.7751, test_loss: 0.8613, test_f1: 0.5446
 epoch: 59, train_loss: 0.7751, test_loss: 0.8174, test_f1: 0.5893
 epoch: 60, train_loss: 0.7713, test_loss: 0.7723, test_f1: 0.6053
 epoch: 61, train_loss: 0.7600, test_loss: 0.8159, test_f1: 0.5846
 epoch: 62, train_loss: 0.7625, test_loss: 0.7859, test_f1: 0.5969
 epoch: 63, train_loss: 0.7726, test_loss: 0.7827, test_f1: 0.6265
 epoch: 64, train_loss: 0.7698, test_loss: 0.7874, test_f1: 0.5913
 epoch: 65, train_loss: 0.7660, test_loss: 0.7996, test_f1: 0.5953
 epoch: 66, train_loss: 0.7578, test_loss: 0.8891, test_f1: 0.5632
 epoch: 67, train_loss: 0.7742, test_loss: 0.7817, test_f1: 0.5903
 epoch: 68, train_loss: 0.7704, test_loss: 0.7863, test_f1: 0.5795
 epoch: 69, train_loss: 0.7635, test_loss: 0.7903, test_f1: 0.6196
 epoch: 70, train_loss: 0.7521, test_loss: 0.8227, test_f1: 0.5982
 epoch: 71, train_loss: 0.7604, test_loss: 0.8497, test_f1: 0.5863
 epoch: 72, train_loss: 0.7557, test_loss: 0.8099, test_f1: 0.5934
 epoch: 73, train_loss: 0.7444, test_loss: 0.8145, test_f1: 0.6004
 epoch: 74, train_loss: 0.7749, test_loss: 0.8241, test_f1: 0.5766
 epoch: 75, train_loss: 0.7629, test_loss: 0.8208, test_f1: 0.6073
 epoch: 76, train_loss: 0.7613, test_loss: 0.7751, test_f1: 0.6284
 epoch: 77, train_loss: 0.7384, test_loss: 0.7889, test_f1: 0.6234
 epoch: 78, train_loss: 0.7484, test_loss: 0.8079, test_f1: 0.5858
 epoch: 79, train_loss: 0.7416, test_loss: 0.8389, test_f1: 0.5851
 epoch: 80, train_loss: 0.7475, test_loss: 0.8170, test_f1: 0.5732
 epoch: 81, train_loss: 0.7393, test_loss: 0.8342, test_f1: 0.6065
 epoch: 82, train_loss: 0.7384, test_loss: 0.8284, test_f1: 0.5865
 epoch: 83, train_loss: 0.7394, test_loss: 0.8290, test_f1: 0.5874
 epoch: 84, train_loss: 0.7318, test_loss: 0.8344, test_f1: 0.5860
 epoch: 85, train_loss: 0.7415, test_loss: 0.8216, test_f1: 0.6137
 epoch: 86, train_loss: 0.7420, test_loss: 0.7780, test_f1: 0.6190
 epoch: 87, train_loss: 0.7527, test_loss: 0.8010, test_f1: 0.5921
 epoch: 88, train_loss: 0.7480, test_loss: 0.7988, test_f1: 0.6304
 epoch: 89, train_loss: 0.7348, test_loss: 0.8124, test_f1: 0.6137
 epoch: 90, train_loss: 0.7178, test_loss: 0.8075, test_f1: 0.5879
 epoch: 91, train_loss: 0.7312, test_loss: 0.9229, test_f1: 0.5562
 epoch: 92, train_loss: 0.7344, test_loss: 0.7300, test_f1: 0.6181
 epoch: 93, train_loss: 0.7379, test_loss: 0.7639, test_f1: 0.6135
 epoch: 94, train_loss: 0.7222, test_loss: 0.8085, test_f1: 0.6051
 epoch: 95, train_loss: 0.7226, test_loss: 0.7485, test_f1: 0.6128
 epoch: 96, train_loss: 0.7262, test_loss: 0.7533, test_f1: 0.6231
 epoch: 97, train_loss: 0.7383, test_loss: 0.7726, test_f1: 0.6166
 epoch: 98, train_loss: 0.7264, test_loss: 0.7435, test_f1: 0.6435
 epoch: 99, train_loss: 0.7246, test_loss: 0.7337, test_f1: 0.6415
##################ITERATION #5 ****************************************
 epoch: 0, train_loss: 1.1050, test_loss: 1.0721, test_f1: 0.3413
 epoch: 1, train_loss: 1.0334, test_loss: 1.0085, test_f1: 0.4143
 epoch: 2, train_loss: 1.0079, test_loss: 1.0181, test_f1: 0.4775
 epoch: 3, train_loss: 1.0015, test_loss: 1.0238, test_f1: 0.4710
 epoch: 4, train_loss: 0.9802, test_loss: 0.9720, test_f1: 0.5018
 epoch: 5, train_loss: 0.9816, test_loss: 0.9941, test_f1: 0.4401
 epoch: 6, train_loss: 0.9727, test_loss: 1.0255, test_f1: 0.4689
 epoch: 7, train_loss: 0.9593, test_loss: 1.0267, test_f1: 0.5496
 epoch: 8, train_loss: 0.9452, test_loss: 1.0282, test_f1: 0.4954
 epoch: 9, train_loss: 0.9619, test_loss: 0.9732, test_f1: 0.4921
 epoch: 10, train_loss: 0.9432, test_loss: 0.9805, test_f1: 0.5525
 epoch: 11, train_loss: 0.9333, test_loss: 0.9852, test_f1: 0.4938
 epoch: 12, train_loss: 0.9205, test_loss: 0.9708, test_f1: 0.4915
 epoch: 13, train_loss: 0.9289, test_loss: 0.9837, test_f1: 0.5165
 epoch: 14, train_loss: 0.9161, test_loss: 0.9428, test_f1: 0.5243
 epoch: 15, train_loss: 0.9286, test_loss: 0.9471, test_f1: 0.5053
 epoch: 16, train_loss: 0.9153, test_loss: 1.0551, test_f1: 0.4625
 epoch: 17, train_loss: 0.9124, test_loss: 0.9112, test_f1: 0.5587
 epoch: 18, train_loss: 0.8932, test_loss: 0.8645, test_f1: 0.5615
 epoch: 19, train_loss: 0.8950, test_loss: 0.8835, test_f1: 0.5263
 epoch: 20, train_loss: 0.8976, test_loss: 0.9300, test_f1: 0.5020
 epoch: 21, train_loss: 0.8825, test_loss: 0.9197, test_f1: 0.4750
 epoch: 22, train_loss: 0.8649, test_loss: 1.0055, test_f1: 0.4592
 epoch: 23, train_loss: 0.8691, test_loss: 0.8684, test_f1: 0.5707
 epoch: 24, train_loss: 0.8574, test_loss: 0.9280, test_f1: 0.5031
 epoch: 25, train_loss: 0.8626, test_loss: 0.8662, test_f1: 0.5410
 epoch: 26, train_loss: 0.8602, test_loss: 0.9860, test_f1: 0.4658
 epoch: 27, train_loss: 0.8779, test_loss: 0.8421, test_f1: 0.5411
 epoch: 28, train_loss: 0.8516, test_loss: 0.8410, test_f1: 0.5579
 epoch: 29, train_loss: 0.8475, test_loss: 0.8967, test_f1: 0.5616
 epoch: 30, train_loss: 0.8601, test_loss: 0.8555, test_f1: 0.5363
 epoch: 31, train_loss: 0.8776, test_loss: 0.8858, test_f1: 0.5317
 epoch: 32, train_loss: 0.8625, test_loss: 0.8694, test_f1: 0.5348
 epoch: 33, train_loss: 0.8513, test_loss: 0.8639, test_f1: 0.5367
 epoch: 34, train_loss: 0.8404, test_loss: 0.8581, test_f1: 0.5426
 epoch: 35, train_loss: 0.8332, test_loss: 0.8889, test_f1: 0.5075
 epoch: 36, train_loss: 0.8318, test_loss: 0.9055, test_f1: 0.5034
 epoch: 37, train_loss: 0.8300, test_loss: 0.8657, test_f1: 0.5030
 epoch: 38, train_loss: 0.8393, test_loss: 0.8473, test_f1: 0.5485
 epoch: 39, train_loss: 0.8419, test_loss: 0.8585, test_f1: 0.5975
 epoch: 40, train_loss: 0.8265, test_loss: 0.9348, test_f1: 0.5297
 epoch: 41, train_loss: 0.8416, test_loss: 0.8409, test_f1: 0.5480
 epoch: 42, train_loss: 0.8366, test_loss: 0.8760, test_f1: 0.5272
 epoch: 43, train_loss: 0.8288, test_loss: 0.8519, test_f1: 0.5533
 epoch: 44, train_loss: 0.8230, test_loss: 0.8399, test_f1: 0.5861
 epoch: 45, train_loss: 0.8246, test_loss: 0.8641, test_f1: 0.5448
 epoch: 46, train_loss: 0.8141, test_loss: 0.8409, test_f1: 0.5434
 epoch: 47, train_loss: 0.8373, test_loss: 0.8597, test_f1: 0.5879
 epoch: 48, train_loss: 0.8274, test_loss: 0.8908, test_f1: 0.6005
 epoch: 49, train_loss: 0.8364, test_loss: 0.8699, test_f1: 0.5512
 epoch: 50, train_loss: 0.8189, test_loss: 0.8433, test_f1: 0.6003
 epoch: 51, train_loss: 0.7917, test_loss: 0.8442, test_f1: 0.5399
 epoch: 52, train_loss: 0.7890, test_loss: 0.8354, test_f1: 0.5723
 epoch: 53, train_loss: 0.7797, test_loss: 0.8390, test_f1: 0.5973
 epoch: 54, train_loss: 0.7885, test_loss: 0.8257, test_f1: 0.5759
 epoch: 55, train_loss: 0.7851, test_loss: 0.8814, test_f1: 0.5431
 epoch: 56, train_loss: 0.7809, test_loss: 0.8610, test_f1: 0.6107
 epoch: 57, train_loss: 0.7766, test_loss: 0.8723, test_f1: 0.5476
 epoch: 58, train_loss: 0.7916, test_loss: 0.8386, test_f1: 0.5485
 epoch: 59, train_loss: 0.7721, test_loss: 0.8135, test_f1: 0.5493
 epoch: 60, train_loss: 0.7741, test_loss: 0.8259, test_f1: 0.5982
 epoch: 61, train_loss: 0.7591, test_loss: 0.8664, test_f1: 0.5495
 epoch: 62, train_loss: 0.7681, test_loss: 0.8873, test_f1: 0.5786
 epoch: 63, train_loss: 0.7713, test_loss: 0.8576, test_f1: 0.5449
 epoch: 64, train_loss: 0.7714, test_loss: 0.8430, test_f1: 0.5686
 epoch: 65, train_loss: 0.7998, test_loss: 0.8496, test_f1: 0.5923
 epoch: 66, train_loss: 0.7788, test_loss: 0.8448, test_f1: 0.5665
 epoch: 67, train_loss: 0.7809, test_loss: 0.8569, test_f1: 0.5634
 epoch: 68, train_loss: 0.7734, test_loss: 0.8454, test_f1: 0.5658
 epoch: 69, train_loss: 0.7664, test_loss: 0.8345, test_f1: 0.5778
 epoch: 70, train_loss: 0.7774, test_loss: 0.8254, test_f1: 0.6083
 epoch: 71, train_loss: 0.7769, test_loss: 0.8270, test_f1: 0.5993
 epoch: 72, train_loss: 0.7498, test_loss: 0.8431, test_f1: 0.5608
 epoch: 73, train_loss: 0.7561, test_loss: 0.8424, test_f1: 0.5938
 epoch: 74, train_loss: 0.7546, test_loss: 0.8681, test_f1: 0.5727
 epoch: 75, train_loss: 0.7614, test_loss: 0.8516, test_f1: 0.6008
 epoch: 76, train_loss: 0.7641, test_loss: 0.8497, test_f1: 0.5543
 epoch: 77, train_loss: 0.7532, test_loss: 0.8480, test_f1: 0.5949
 epoch: 78, train_loss: 0.7630, test_loss: 0.8159, test_f1: 0.6387
 epoch: 79, train_loss: 0.7638, test_loss: 0.8183, test_f1: 0.5989
 epoch: 80, train_loss: 0.7631, test_loss: 0.8400, test_f1: 0.5462
 epoch: 81, train_loss: 0.7618, test_loss: 0.8443, test_f1: 0.5670
 epoch: 82, train_loss: 0.7550, test_loss: 0.8173, test_f1: 0.5950
 epoch: 83, train_loss: 0.7493, test_loss: 0.8225, test_f1: 0.6006
 epoch: 84, train_loss: 0.7454, test_loss: 0.8711, test_f1: 0.5878
 epoch: 85, train_loss: 0.7549, test_loss: 0.8339, test_f1: 0.5766
 epoch: 86, train_loss: 0.7562, test_loss: 0.8078, test_f1: 0.6140
 epoch: 87, train_loss: 0.7379, test_loss: 0.8852, test_f1: 0.5560
 epoch: 88, train_loss: 0.7481, test_loss: 0.8559, test_f1: 0.5876
 epoch: 89, train_loss: 0.7502, test_loss: 0.8142, test_f1: 0.5642
 epoch: 90, train_loss: 0.7367, test_loss: 0.8035, test_f1: 0.6169
 epoch: 91, train_loss: 0.7364, test_loss: 0.8606, test_f1: 0.5800
 epoch: 92, train_loss: 0.7737, test_loss: 0.8272, test_f1: 0.6062
 epoch: 93, train_loss: 0.7439, test_loss: 0.8564, test_f1: 0.5780
 epoch: 94, train_loss: 0.7303, test_loss: 0.8129, test_f1: 0.5896
 epoch: 95, train_loss: 0.7497, test_loss: 0.8168, test_f1: 0.5966
 epoch: 96, train_loss: 0.7514, test_loss: 0.8842, test_f1: 0.5749
 epoch: 97, train_loss: 0.7578, test_loss: 0.8299, test_f1: 0.6148
 epoch: 98, train_loss: 0.7500, test_loss: 0.8206, test_f1: 0.5583
 epoch: 99, train_loss: 0.7362, test_loss: 0.8227, test_f1: 0.5823
##################ITERATION #6 ****************************************
 epoch: 0, train_loss: 1.1161, test_loss: 1.1130, test_f1: 0.3725
 epoch: 1, train_loss: 1.0437, test_loss: 1.0649, test_f1: 0.4308
 epoch: 2, train_loss: 1.0195, test_loss: 1.0395, test_f1: 0.4222
 epoch: 3, train_loss: 0.9942, test_loss: 1.0218, test_f1: 0.4664
 epoch: 4, train_loss: 0.9841, test_loss: 1.0127, test_f1: 0.4762
 epoch: 5, train_loss: 0.9784, test_loss: 1.0197, test_f1: 0.4736
 epoch: 6, train_loss: 0.9662, test_loss: 1.0999, test_f1: 0.4623
 epoch: 7, train_loss: 0.9706, test_loss: 0.9845, test_f1: 0.5002
 epoch: 8, train_loss: 0.9769, test_loss: 0.9783, test_f1: 0.4950
 epoch: 9, train_loss: 0.9533, test_loss: 0.9821, test_f1: 0.4780
 epoch: 10, train_loss: 0.9747, test_loss: 1.0350, test_f1: 0.4351
 epoch: 11, train_loss: 0.9629, test_loss: 1.0325, test_f1: 0.4488
 epoch: 12, train_loss: 0.9524, test_loss: 0.9925, test_f1: 0.4781
 epoch: 13, train_loss: 0.9544, test_loss: 0.9999, test_f1: 0.5037
 epoch: 14, train_loss: 0.9473, test_loss: 0.9824, test_f1: 0.5236
 epoch: 15, train_loss: 0.9472, test_loss: 0.9522, test_f1: 0.4930
 epoch: 16, train_loss: 0.9302, test_loss: 0.9347, test_f1: 0.5320
 epoch: 17, train_loss: 0.9151, test_loss: 0.9261, test_f1: 0.5155
 epoch: 18, train_loss: 0.9341, test_loss: 0.9003, test_f1: 0.4910
 epoch: 19, train_loss: 0.9223, test_loss: 0.8669, test_f1: 0.5184
 epoch: 20, train_loss: 0.8979, test_loss: 0.9192, test_f1: 0.5232
 epoch: 21, train_loss: 0.9023, test_loss: 0.8625, test_f1: 0.5442
 epoch: 22, train_loss: 0.8830, test_loss: 0.9550, test_f1: 0.5239
 epoch: 23, train_loss: 0.8840, test_loss: 0.8506, test_f1: 0.5397
 epoch: 24, train_loss: 0.9051, test_loss: 0.8813, test_f1: 0.5383
 epoch: 25, train_loss: 0.8929, test_loss: 0.9704, test_f1: 0.4837
 epoch: 26, train_loss: 0.8682, test_loss: 0.8429, test_f1: 0.5399
 epoch: 27, train_loss: 0.8634, test_loss: 0.8951, test_f1: 0.5625
 epoch: 28, train_loss: 0.9058, test_loss: 0.8990, test_f1: 0.5177
 epoch: 29, train_loss: 0.8747, test_loss: 0.8499, test_f1: 0.5288
 epoch: 30, train_loss: 0.8622, test_loss: 0.8925, test_f1: 0.5406
 epoch: 31, train_loss: 0.8563, test_loss: 0.8939, test_f1: 0.5200
 epoch: 32, train_loss: 0.8428, test_loss: 0.8827, test_f1: 0.5308
 epoch: 33, train_loss: 0.8544, test_loss: 0.8382, test_f1: 0.5341
 epoch: 34, train_loss: 0.8640, test_loss: 0.8563, test_f1: 0.5295
 epoch: 35, train_loss: 0.8467, test_loss: 0.8900, test_f1: 0.5315
 epoch: 36, train_loss: 0.8434, test_loss: 0.8432, test_f1: 0.5427
 epoch: 37, train_loss: 0.8510, test_loss: 0.9485, test_f1: 0.4912
 epoch: 38, train_loss: 0.8532, test_loss: 1.1243, test_f1: 0.4684
 epoch: 39, train_loss: 1.0066, test_loss: 1.0196, test_f1: 0.4451
 epoch: 40, train_loss: 0.9252, test_loss: 0.9068, test_f1: 0.5575
 epoch: 41, train_loss: 0.8894, test_loss: 0.9330, test_f1: 0.5090
 epoch: 42, train_loss: 0.8637, test_loss: 0.8790, test_f1: 0.5369
 epoch: 43, train_loss: 0.8515, test_loss: 0.8550, test_f1: 0.5589
 epoch: 44, train_loss: 0.8389, test_loss: 0.8319, test_f1: 0.6084
 epoch: 45, train_loss: 0.8402, test_loss: 0.8394, test_f1: 0.5737
 epoch: 46, train_loss: 0.8329, test_loss: 0.8577, test_f1: 0.5614
 epoch: 47, train_loss: 0.8382, test_loss: 0.8758, test_f1: 0.5461
 epoch: 48, train_loss: 0.8338, test_loss: 0.8402, test_f1: 0.5568
 epoch: 49, train_loss: 0.8298, test_loss: 0.9273, test_f1: 0.5300
 epoch: 50, train_loss: 0.8543, test_loss: 0.8796, test_f1: 0.5329
 epoch: 51, train_loss: 0.8201, test_loss: 0.8854, test_f1: 0.5729
 epoch: 52, train_loss: 0.8121, test_loss: 0.8515, test_f1: 0.6040
 epoch: 53, train_loss: 0.7958, test_loss: 0.8257, test_f1: 0.5816
 epoch: 54, train_loss: 0.8127, test_loss: 0.8599, test_f1: 0.5754
 epoch: 55, train_loss: 0.8099, test_loss: 0.8646, test_f1: 0.5969
 epoch: 56, train_loss: 0.8064, test_loss: 0.8665, test_f1: 0.5504
 epoch: 57, train_loss: 0.8011, test_loss: 0.8412, test_f1: 0.6300
 epoch: 58, train_loss: 0.7848, test_loss: 0.8435, test_f1: 0.6090
 epoch: 59, train_loss: 0.8002, test_loss: 0.8163, test_f1: 0.6298
 epoch: 60, train_loss: 0.8090, test_loss: 0.8271, test_f1: 0.6073
 epoch: 61, train_loss: 0.7889, test_loss: 0.8406, test_f1: 0.6076
 epoch: 62, train_loss: 0.7892, test_loss: 0.8286, test_f1: 0.6192
 epoch: 63, train_loss: 0.7902, test_loss: 0.8288, test_f1: 0.6140
 epoch: 64, train_loss: 0.7867, test_loss: 0.8045, test_f1: 0.6203
 epoch: 65, train_loss: 0.7748, test_loss: 0.8468, test_f1: 0.6148
 epoch: 66, train_loss: 0.7896, test_loss: 0.8211, test_f1: 0.6085
 epoch: 67, train_loss: 0.8015, test_loss: 0.8467, test_f1: 0.6102
 epoch: 68, train_loss: 0.7663, test_loss: 0.8445, test_f1: 0.6072
 epoch: 69, train_loss: 0.7716, test_loss: 0.8674, test_f1: 0.6020
 epoch: 70, train_loss: 0.7939, test_loss: 0.8172, test_f1: 0.5894
 epoch: 71, train_loss: 0.7828, test_loss: 0.8137, test_f1: 0.5991
 epoch: 72, train_loss: 0.7656, test_loss: 0.8665, test_f1: 0.6137
 epoch: 73, train_loss: 0.7679, test_loss: 0.8435, test_f1: 0.6347
 epoch: 74, train_loss: 0.7656, test_loss: 0.8169, test_f1: 0.6261
 epoch: 75, train_loss: 0.7784, test_loss: 0.8259, test_f1: 0.6508
 epoch: 76, train_loss: 0.7592, test_loss: 0.8480, test_f1: 0.6073
 epoch: 77, train_loss: 0.7619, test_loss: 0.8251, test_f1: 0.6570
 epoch: 78, train_loss: 0.7541, test_loss: 0.8047, test_f1: 0.6310
 epoch: 79, train_loss: 0.7710, test_loss: 0.8281, test_f1: 0.6137
 epoch: 80, train_loss: 0.7612, test_loss: 0.8367, test_f1: 0.6181
 epoch: 81, train_loss: 0.7615, test_loss: 0.8111, test_f1: 0.6405
 epoch: 82, train_loss: 0.7575, test_loss: 0.8261, test_f1: 0.6434
 epoch: 83, train_loss: 0.7577, test_loss: 0.8541, test_f1: 0.6334
 epoch: 84, train_loss: 0.7760, test_loss: 0.8401, test_f1: 0.6090
 epoch: 85, train_loss: 0.7472, test_loss: 0.8209, test_f1: 0.6395
 epoch: 86, train_loss: 0.7639, test_loss: 0.8312, test_f1: 0.6316
 epoch: 87, train_loss: 0.7496, test_loss: 0.8533, test_f1: 0.5919
 epoch: 88, train_loss: 0.7591, test_loss: 0.8119, test_f1: 0.6354
 epoch: 89, train_loss: 0.7780, test_loss: 0.8077, test_f1: 0.6334
 epoch: 90, train_loss: 0.7459, test_loss: 0.8356, test_f1: 0.6451
 epoch: 91, train_loss: 0.7498, test_loss: 0.8329, test_f1: 0.6221
 epoch: 92, train_loss: 0.7404, test_loss: 0.8172, test_f1: 0.6504
 epoch: 93, train_loss: 0.7473, test_loss: 0.8205, test_f1: 0.6312
 epoch: 94, train_loss: 0.7318, test_loss: 0.8281, test_f1: 0.6411
 epoch: 95, train_loss: 0.7546, test_loss: 0.8395, test_f1: 0.6251
 epoch: 96, train_loss: 0.7559, test_loss: 0.8314, test_f1: 0.6448
 epoch: 97, train_loss: 0.7564, test_loss: 0.8259, test_f1: 0.6438
 epoch: 98, train_loss: 0.7505, test_loss: 0.8015, test_f1: 0.6509
 epoch: 99, train_loss: 0.7395, test_loss: 0.8167, test_f1: 0.6668
##################ITERATION #7 ****************************************
 epoch: 0, train_loss: 1.1286, test_loss: 1.1478, test_f1: 0.3179
 epoch: 1, train_loss: 1.0143, test_loss: 1.0837, test_f1: 0.4786
 epoch: 2, train_loss: 0.9950, test_loss: 1.0493, test_f1: 0.4751
 epoch: 3, train_loss: 0.9711, test_loss: 0.9499, test_f1: 0.4755
 epoch: 4, train_loss: 0.9576, test_loss: 1.0036, test_f1: 0.4960
 epoch: 5, train_loss: 0.9635, test_loss: 1.0618, test_f1: 0.4636
 epoch: 6, train_loss: 0.9620, test_loss: 0.9532, test_f1: 0.5053
 epoch: 7, train_loss: 0.9415, test_loss: 0.9222, test_f1: 0.5280
 epoch: 8, train_loss: 0.9419, test_loss: 0.9765, test_f1: 0.5508
 epoch: 9, train_loss: 0.9423, test_loss: 1.1135, test_f1: 0.4696
 epoch: 10, train_loss: 0.9290, test_loss: 0.8967, test_f1: 0.5342
 epoch: 11, train_loss: 0.9090, test_loss: 0.9563, test_f1: 0.4755
 epoch: 12, train_loss: 0.9058, test_loss: 1.0015, test_f1: 0.5550
 epoch: 13, train_loss: 0.9047, test_loss: 0.9184, test_f1: 0.4998
 epoch: 14, train_loss: 0.8968, test_loss: 0.8769, test_f1: 0.5387
 epoch: 15, train_loss: 0.8942, test_loss: 0.9063, test_f1: 0.5285
 epoch: 16, train_loss: 0.8963, test_loss: 0.8868, test_f1: 0.5689
 epoch: 17, train_loss: 0.8761, test_loss: 0.8875, test_f1: 0.5566
 epoch: 18, train_loss: 0.8904, test_loss: 0.8819, test_f1: 0.5245
 epoch: 19, train_loss: 0.8857, test_loss: 0.8644, test_f1: 0.5474
 epoch: 20, train_loss: 0.8894, test_loss: 0.8978, test_f1: 0.5322
 epoch: 21, train_loss: 0.8578, test_loss: 0.9266, test_f1: 0.5164
 epoch: 22, train_loss: 0.8730, test_loss: 0.8956, test_f1: 0.5390
 epoch: 23, train_loss: 0.8644, test_loss: 0.8819, test_f1: 0.5375
 epoch: 24, train_loss: 0.8674, test_loss: 0.9552, test_f1: 0.4945
 epoch: 25, train_loss: 0.8658, test_loss: 0.9424, test_f1: 0.4901
 epoch: 26, train_loss: 0.8486, test_loss: 0.8510, test_f1: 0.5497
 epoch: 27, train_loss: 0.8766, test_loss: 0.8823, test_f1: 0.5374
 epoch: 28, train_loss: 0.8423, test_loss: 0.8610, test_f1: 0.5984
 epoch: 29, train_loss: 0.8578, test_loss: 0.8547, test_f1: 0.5923
 epoch: 30, train_loss: 0.8578, test_loss: 0.8780, test_f1: 0.6092
 epoch: 31, train_loss: 0.8460, test_loss: 0.8910, test_f1: 0.5402
 epoch: 32, train_loss: 0.8570, test_loss: 0.9105, test_f1: 0.5338
 epoch: 33, train_loss: 0.8480, test_loss: 0.8866, test_f1: 0.6063
 epoch: 34, train_loss: 0.8433, test_loss: 0.8654, test_f1: 0.5848
 epoch: 35, train_loss: 0.8415, test_loss: 0.8557, test_f1: 0.5631
 epoch: 36, train_loss: 0.8435, test_loss: 0.8422, test_f1: 0.5542
 epoch: 37, train_loss: 0.8310, test_loss: 0.9029, test_f1: 0.5519
 epoch: 38, train_loss: 0.8219, test_loss: 0.9971, test_f1: 0.5336
 epoch: 39, train_loss: 0.8480, test_loss: 0.9172, test_f1: 0.5464
 epoch: 40, train_loss: 0.8320, test_loss: 0.8760, test_f1: 0.5807
 epoch: 41, train_loss: 0.8395, test_loss: 0.8745, test_f1: 0.5616
 epoch: 42, train_loss: 0.8406, test_loss: 0.9710, test_f1: 0.5907
 epoch: 43, train_loss: 0.8218, test_loss: 0.9831, test_f1: 0.5140
 epoch: 44, train_loss: 0.8257, test_loss: 0.8347, test_f1: 0.5900
 epoch: 45, train_loss: 0.8239, test_loss: 0.8988, test_f1: 0.5585
 epoch: 46, train_loss: 0.8187, test_loss: 0.8706, test_f1: 0.5511
 epoch: 47, train_loss: 0.8213, test_loss: 0.8507, test_f1: 0.5335
 epoch: 48, train_loss: 0.8141, test_loss: 0.8647, test_f1: 0.5593
 epoch: 49, train_loss: 0.8096, test_loss: 0.8533, test_f1: 0.5882
 epoch: 50, train_loss: 0.8131, test_loss: 0.8590, test_f1: 0.5654
 epoch: 51, train_loss: 0.7758, test_loss: 0.8400, test_f1: 0.5816
 epoch: 52, train_loss: 0.7830, test_loss: 0.8593, test_f1: 0.5757
 epoch: 53, train_loss: 0.7663, test_loss: 0.8478, test_f1: 0.5629
 epoch: 54, train_loss: 0.7672, test_loss: 0.8837, test_f1: 0.5543
 epoch: 55, train_loss: 0.7760, test_loss: 0.8723, test_f1: 0.5678
 epoch: 56, train_loss: 0.7575, test_loss: 0.8270, test_f1: 0.5732
 epoch: 57, train_loss: 0.7638, test_loss: 0.8940, test_f1: 0.5548
 epoch: 58, train_loss: 0.7658, test_loss: 0.9231, test_f1: 0.5620
 epoch: 59, train_loss: 0.7647, test_loss: 0.8498, test_f1: 0.5754
 epoch: 60, train_loss: 0.7518, test_loss: 0.8882, test_f1: 0.5817
 epoch: 61, train_loss: 0.7597, test_loss: 0.8395, test_f1: 0.6012
 epoch: 62, train_loss: 0.7565, test_loss: 0.8556, test_f1: 0.5792
 epoch: 63, train_loss: 0.7649, test_loss: 0.9414, test_f1: 0.5574
 epoch: 64, train_loss: 0.7566, test_loss: 0.8379, test_f1: 0.6192
 epoch: 65, train_loss: 0.7564, test_loss: 0.8671, test_f1: 0.5986
 epoch: 66, train_loss: 0.7572, test_loss: 0.7692, test_f1: 0.6265
 epoch: 67, train_loss: 0.7522, test_loss: 0.8813, test_f1: 0.5677
 epoch: 68, train_loss: 0.7525, test_loss: 0.8283, test_f1: 0.5783
 epoch: 69, train_loss: 0.7405, test_loss: 0.9003, test_f1: 0.5969
 epoch: 70, train_loss: 0.7494, test_loss: 0.8486, test_f1: 0.5841
 epoch: 71, train_loss: 0.7400, test_loss: 0.8471, test_f1: 0.5954
 epoch: 72, train_loss: 0.7351, test_loss: 0.8754, test_f1: 0.5894
 epoch: 73, train_loss: 0.7469, test_loss: 0.8610, test_f1: 0.6064
 epoch: 74, train_loss: 0.7394, test_loss: 0.8343, test_f1: 0.6030
 epoch: 75, train_loss: 0.7260, test_loss: 0.8178, test_f1: 0.6052
 epoch: 76, train_loss: 0.7505, test_loss: 0.9059, test_f1: 0.5861
 epoch: 77, train_loss: 0.7349, test_loss: 0.9123, test_f1: 0.6044
 epoch: 78, train_loss: 0.7304, test_loss: 0.9364, test_f1: 0.5771
 epoch: 79, train_loss: 0.7448, test_loss: 0.8874, test_f1: 0.5861
 epoch: 80, train_loss: 0.7146, test_loss: 0.8624, test_f1: 0.5959
 epoch: 81, train_loss: 0.7419, test_loss: 0.8612, test_f1: 0.6182
 epoch: 82, train_loss: 0.7446, test_loss: 0.9816, test_f1: 0.5526
 epoch: 83, train_loss: 0.7591, test_loss: 0.9099, test_f1: 0.5983
 epoch: 84, train_loss: 0.7282, test_loss: 0.8433, test_f1: 0.6105
 epoch: 85, train_loss: 0.7324, test_loss: 0.8954, test_f1: 0.6035
 epoch: 86, train_loss: 0.7243, test_loss: 0.8273, test_f1: 0.6012
 epoch: 87, train_loss: 0.7289, test_loss: 0.9033, test_f1: 0.5712
 epoch: 88, train_loss: 0.7342, test_loss: 0.9185, test_f1: 0.5877
 epoch: 89, train_loss: 0.7290, test_loss: 0.8049, test_f1: 0.6112
 epoch: 90, train_loss: 0.7257, test_loss: 0.8634, test_f1: 0.5968
 epoch: 91, train_loss: 0.7406, test_loss: 0.8800, test_f1: 0.5872
 epoch: 92, train_loss: 0.7270, test_loss: 0.8920, test_f1: 0.6173
 epoch: 93, train_loss: 0.7243, test_loss: 0.8314, test_f1: 0.6167
 epoch: 94, train_loss: 0.7162, test_loss: 0.8682, test_f1: 0.6008
 epoch: 95, train_loss: 0.7132, test_loss: 0.8437, test_f1: 0.6193
 epoch: 96, train_loss: 0.7290, test_loss: 0.8902, test_f1: 0.5969
 epoch: 97, train_loss: 0.7303, test_loss: 0.9225, test_f1: 0.5862
 epoch: 98, train_loss: 0.7061, test_loss: 0.8587, test_f1: 0.6004
 epoch: 99, train_loss: 0.7065, test_loss: 0.8729, test_f1: 0.5799
##################ITERATION #8 ****************************************
 epoch: 0, train_loss: 1.1476, test_loss: 1.0774, test_f1: 0.3887
 epoch: 1, train_loss: 1.0132, test_loss: 1.0287, test_f1: 0.4363
 epoch: 2, train_loss: 0.9996, test_loss: 1.0029, test_f1: 0.4964
 epoch: 3, train_loss: 0.9841, test_loss: 0.9695, test_f1: 0.4901
 epoch: 4, train_loss: 0.9765, test_loss: 1.0129, test_f1: 0.4587
 epoch: 5, train_loss: 0.9629, test_loss: 0.9741, test_f1: 0.4907
 epoch: 6, train_loss: 0.9343, test_loss: 0.9660, test_f1: 0.5038
 epoch: 7, train_loss: 0.9418, test_loss: 0.9669, test_f1: 0.4951
 epoch: 8, train_loss: 0.9521, test_loss: 1.0279, test_f1: 0.4747
 epoch: 9, train_loss: 0.9389, test_loss: 0.9606, test_f1: 0.4960
 epoch: 10, train_loss: 0.9305, test_loss: 0.9967, test_f1: 0.4831
 epoch: 11, train_loss: 0.9208, test_loss: 0.9996, test_f1: 0.4921
 epoch: 12, train_loss: 0.9161, test_loss: 0.9386, test_f1: 0.5272
 epoch: 13, train_loss: 0.9314, test_loss: 0.9798, test_f1: 0.4362
 epoch: 14, train_loss: 0.9408, test_loss: 0.9097, test_f1: 0.5590
 epoch: 15, train_loss: 0.9253, test_loss: 0.9054, test_f1: 0.5173
 epoch: 16, train_loss: 0.8965, test_loss: 0.9158, test_f1: 0.5802
 epoch: 17, train_loss: 0.8995, test_loss: 0.9307, test_f1: 0.5400
 epoch: 18, train_loss: 0.8931, test_loss: 0.8660, test_f1: 0.5633
 epoch: 19, train_loss: 0.8685, test_loss: 0.8423, test_f1: 0.5876
 epoch: 20, train_loss: 0.8668, test_loss: 0.8552, test_f1: 0.5601
 epoch: 21, train_loss: 0.8897, test_loss: 0.8873, test_f1: 0.5963
 epoch: 22, train_loss: 0.8782, test_loss: 0.9028, test_f1: 0.5437
 epoch: 23, train_loss: 0.8777, test_loss: 0.8612, test_f1: 0.5415
 epoch: 24, train_loss: 0.8684, test_loss: 0.8725, test_f1: 0.5326
 epoch: 25, train_loss: 0.8704, test_loss: 0.8588, test_f1: 0.5878
 epoch: 26, train_loss: 0.8577, test_loss: 0.8840, test_f1: 0.5227
 epoch: 27, train_loss: 0.8712, test_loss: 0.8619, test_f1: 0.5626
 epoch: 28, train_loss: 0.8552, test_loss: 0.8915, test_f1: 0.5594
 epoch: 29, train_loss: 0.8640, test_loss: 0.8663, test_f1: 0.5471
 epoch: 30, train_loss: 0.8526, test_loss: 0.8711, test_f1: 0.5591
 epoch: 31, train_loss: 0.8519, test_loss: 0.8858, test_f1: 0.5234
 epoch: 32, train_loss: 0.8404, test_loss: 0.8453, test_f1: 0.5870
 epoch: 33, train_loss: 0.8486, test_loss: 0.9449, test_f1: 0.5587
 epoch: 34, train_loss: 0.8358, test_loss: 0.8602, test_f1: 0.5721
 epoch: 35, train_loss: 0.8314, test_loss: 0.8388, test_f1: 0.5533
 epoch: 36, train_loss: 0.8336, test_loss: 0.8392, test_f1: 0.6090
 epoch: 37, train_loss: 0.8350, test_loss: 0.8523, test_f1: 0.5402
 epoch: 38, train_loss: 0.8258, test_loss: 0.8613, test_f1: 0.6136
 epoch: 39, train_loss: 0.8538, test_loss: 0.8255, test_f1: 0.5884
 epoch: 40, train_loss: 0.8257, test_loss: 0.8447, test_f1: 0.5948
 epoch: 41, train_loss: 0.8294, test_loss: 0.8535, test_f1: 0.5955
 epoch: 42, train_loss: 0.8282, test_loss: 0.8593, test_f1: 0.5859
 epoch: 43, train_loss: 0.8132, test_loss: 0.8434, test_f1: 0.5759
 epoch: 44, train_loss: 0.8354, test_loss: 0.8611, test_f1: 0.5712
 epoch: 45, train_loss: 0.8211, test_loss: 0.8497, test_f1: 0.6052
 epoch: 46, train_loss: 0.8326, test_loss: 0.8176, test_f1: 0.5668
 epoch: 47, train_loss: 0.8111, test_loss: 0.8097, test_f1: 0.5782
 epoch: 48, train_loss: 0.8125, test_loss: 0.8417, test_f1: 0.5804
 epoch: 49, train_loss: 0.8151, test_loss: 0.8574, test_f1: 0.6305
 epoch: 50, train_loss: 0.8298, test_loss: 0.8304, test_f1: 0.5947
 epoch: 51, train_loss: 0.7867, test_loss: 0.8153, test_f1: 0.5769
 epoch: 52, train_loss: 0.8037, test_loss: 0.8131, test_f1: 0.6085
 epoch: 53, train_loss: 0.7803, test_loss: 0.8106, test_f1: 0.6277
 epoch: 54, train_loss: 0.7942, test_loss: 0.7999, test_f1: 0.6199
 epoch: 55, train_loss: 0.7864, test_loss: 0.8054, test_f1: 0.6267
 epoch: 56, train_loss: 0.7823, test_loss: 0.8556, test_f1: 0.5947
 epoch: 57, train_loss: 0.7750, test_loss: 0.8248, test_f1: 0.5763
 epoch: 58, train_loss: 0.7810, test_loss: 0.8505, test_f1: 0.5917
 epoch: 59, train_loss: 0.7798, test_loss: 0.8446, test_f1: 0.6106
 epoch: 60, train_loss: 0.7786, test_loss: 0.8384, test_f1: 0.5904
 epoch: 61, train_loss: 0.7762, test_loss: 0.8149, test_f1: 0.6072
 epoch: 62, train_loss: 0.7635, test_loss: 0.8092, test_f1: 0.5955
 epoch: 63, train_loss: 0.7651, test_loss: 0.8318, test_f1: 0.5770
 epoch: 64, train_loss: 0.7751, test_loss: 0.8046, test_f1: 0.6034
 epoch: 65, train_loss: 0.7763, test_loss: 0.8195, test_f1: 0.5843
 epoch: 66, train_loss: 0.7548, test_loss: 0.8220, test_f1: 0.6315
 epoch: 67, train_loss: 0.7590, test_loss: 0.8126, test_f1: 0.5825
 epoch: 68, train_loss: 0.7644, test_loss: 0.8121, test_f1: 0.6096
 epoch: 69, train_loss: 0.7653, test_loss: 0.8158, test_f1: 0.5821
 epoch: 70, train_loss: 0.7621, test_loss: 0.8386, test_f1: 0.5848
 epoch: 71, train_loss: 0.7642, test_loss: 0.7987, test_f1: 0.6201
 epoch: 72, train_loss: 0.7603, test_loss: 0.8172, test_f1: 0.6168
 epoch: 73, train_loss: 0.7719, test_loss: 0.8362, test_f1: 0.5994
 epoch: 74, train_loss: 0.7450, test_loss: 0.7991, test_f1: 0.5951
 epoch: 75, train_loss: 0.7562, test_loss: 0.8161, test_f1: 0.5972
 epoch: 76, train_loss: 0.7608, test_loss: 0.8172, test_f1: 0.6002
 epoch: 77, train_loss: 0.7568, test_loss: 0.8120, test_f1: 0.6161
 epoch: 78, train_loss: 0.7765, test_loss: 0.8150, test_f1: 0.5947
 epoch: 79, train_loss: 0.7480, test_loss: 0.8200, test_f1: 0.6238
 epoch: 80, train_loss: 0.7579, test_loss: 0.8076, test_f1: 0.6037
 epoch: 81, train_loss: 0.7537, test_loss: 0.8062, test_f1: 0.5919
 epoch: 82, train_loss: 0.7741, test_loss: 0.8132, test_f1: 0.5904
 epoch: 83, train_loss: 0.7500, test_loss: 0.8101, test_f1: 0.5938
 epoch: 84, train_loss: 0.7467, test_loss: 0.8079, test_f1: 0.6398
 epoch: 85, train_loss: 0.7555, test_loss: 0.8213, test_f1: 0.6115
 epoch: 86, train_loss: 0.7648, test_loss: 0.8034, test_f1: 0.6103
 epoch: 87, train_loss: 0.7373, test_loss: 0.8362, test_f1: 0.5604
 epoch: 88, train_loss: 0.7534, test_loss: 0.8247, test_f1: 0.5890
 epoch: 89, train_loss: 0.7578, test_loss: 0.8252, test_f1: 0.6095
 epoch: 90, train_loss: 0.7554, test_loss: 0.8143, test_f1: 0.6087
 epoch: 91, train_loss: 0.7384, test_loss: 0.8045, test_f1: 0.5963
 epoch: 92, train_loss: 0.7480, test_loss: 0.8237, test_f1: 0.6017
 epoch: 93, train_loss: 0.7357, test_loss: 0.7842, test_f1: 0.6379
 epoch: 94, train_loss: 0.7534, test_loss: 0.8109, test_f1: 0.6173
 epoch: 95, train_loss: 0.7537, test_loss: 0.8226, test_f1: 0.6132
 epoch: 96, train_loss: 0.7357, test_loss: 0.7941, test_f1: 0.6337
 epoch: 97, train_loss: 0.7380, test_loss: 0.8252, test_f1: 0.6277
 epoch: 98, train_loss: 0.7388, test_loss: 0.8053, test_f1: 0.6194
 epoch: 99, train_loss: 0.7361, test_loss: 0.8532, test_f1: 0.5881
##################ITERATION #9 ****************************************
 epoch: 0, train_loss: 1.1387, test_loss: 1.0325, test_f1: 0.4697
 epoch: 1, train_loss: 1.0262, test_loss: 0.9762, test_f1: 0.4547
 epoch: 2, train_loss: 0.9942, test_loss: 1.0159, test_f1: 0.5146
 epoch: 3, train_loss: 0.9913, test_loss: 1.1611, test_f1: 0.3707
 epoch: 4, train_loss: 0.9892, test_loss: 0.9699, test_f1: 0.4285
 epoch: 5, train_loss: 0.9744, test_loss: 0.9458, test_f1: 0.5145
 epoch: 6, train_loss: 0.9637, test_loss: 0.9989, test_f1: 0.5000
 epoch: 7, train_loss: 0.9533, test_loss: 1.0175, test_f1: 0.5131
 epoch: 8, train_loss: 0.9469, test_loss: 0.9767, test_f1: 0.4858
 epoch: 9, train_loss: 0.9601, test_loss: 0.9186, test_f1: 0.5293
 epoch: 10, train_loss: 0.9392, test_loss: 0.9003, test_f1: 0.5234
 epoch: 11, train_loss: 0.9414, test_loss: 0.8956, test_f1: 0.5194
 epoch: 12, train_loss: 0.9199, test_loss: 1.1669, test_f1: 0.4056
 epoch: 13, train_loss: 0.9083, test_loss: 0.9320, test_f1: 0.5027
 epoch: 14, train_loss: 0.9486, test_loss: 0.9604, test_f1: 0.5050
 epoch: 15, train_loss: 0.9150, test_loss: 0.9325, test_f1: 0.5055
 epoch: 16, train_loss: 0.9039, test_loss: 0.8791, test_f1: 0.5669
 epoch: 17, train_loss: 0.9061, test_loss: 0.9440, test_f1: 0.4864
 epoch: 18, train_loss: 0.9202, test_loss: 0.8535, test_f1: 0.5247
 epoch: 19, train_loss: 0.8978, test_loss: 1.1223, test_f1: 0.4701
 epoch: 20, train_loss: 0.8970, test_loss: 0.8006, test_f1: 0.5957
 epoch: 21, train_loss: 0.8886, test_loss: 0.8921, test_f1: 0.5342
 epoch: 22, train_loss: 0.8764, test_loss: 0.8472, test_f1: 0.5650
 epoch: 23, train_loss: 0.8934, test_loss: 0.8504, test_f1: 0.5791
 epoch: 24, train_loss: 0.8882, test_loss: 0.8364, test_f1: 0.5858
 epoch: 25, train_loss: 0.8589, test_loss: 0.8309, test_f1: 0.5965
 epoch: 26, train_loss: 0.8714, test_loss: 0.8237, test_f1: 0.5588
 epoch: 27, train_loss: 0.8720, test_loss: 0.7914, test_f1: 0.5587
 epoch: 28, train_loss: 0.8834, test_loss: 0.8319, test_f1: 0.5556
 epoch: 29, train_loss: 0.8664, test_loss: 0.8353, test_f1: 0.5799
 epoch: 30, train_loss: 0.8550, test_loss: 0.8722, test_f1: 0.5624
 epoch: 31, train_loss: 0.8600, test_loss: 0.8797, test_f1: 0.5588
 epoch: 32, train_loss: 0.8685, test_loss: 0.8289, test_f1: 0.5869
 epoch: 33, train_loss: 0.8832, test_loss: 0.8695, test_f1: 0.5281
 epoch: 34, train_loss: 0.8588, test_loss: 0.8624, test_f1: 0.6193
 epoch: 35, train_loss: 0.8593, test_loss: 0.8490, test_f1: 0.6017
 epoch: 36, train_loss: 0.8644, test_loss: 0.8054, test_f1: 0.6216
 epoch: 37, train_loss: 0.8512, test_loss: 0.7980, test_f1: 0.5765
 epoch: 38, train_loss: 0.8538, test_loss: 0.8342, test_f1: 0.5608
 epoch: 39, train_loss: 0.8555, test_loss: 0.9808, test_f1: 0.5256
 epoch: 40, train_loss: 0.8659, test_loss: 0.9093, test_f1: 0.5361
 epoch: 41, train_loss: 0.8499, test_loss: 0.8237, test_f1: 0.5878
 epoch: 42, train_loss: 0.8706, test_loss: 0.8323, test_f1: 0.5389
 epoch: 43, train_loss: 0.8455, test_loss: 0.7965, test_f1: 0.5975
 epoch: 44, train_loss: 0.8454, test_loss: 0.7680, test_f1: 0.6176
 epoch: 45, train_loss: 0.8443, test_loss: 0.8313, test_f1: 0.5649
 epoch: 46, train_loss: 0.8614, test_loss: 0.7651, test_f1: 0.6114
 epoch: 47, train_loss: 0.8306, test_loss: 0.8233, test_f1: 0.5820
 epoch: 48, train_loss: 0.8396, test_loss: 0.8255, test_f1: 0.5685
 epoch: 49, train_loss: 0.8408, test_loss: 0.8249, test_f1: 0.5970
 epoch: 50, train_loss: 0.8731, test_loss: 0.8229, test_f1: 0.5828
 epoch: 51, train_loss: 0.8504, test_loss: 0.8204, test_f1: 0.5802
 epoch: 52, train_loss: 0.8258, test_loss: 0.7988, test_f1: 0.6016
 epoch: 53, train_loss: 0.8166, test_loss: 0.7725, test_f1: 0.6345
 epoch: 54, train_loss: 0.8077, test_loss: 0.8174, test_f1: 0.6117
 epoch: 55, train_loss: 0.8025, test_loss: 0.8101, test_f1: 0.6325
 epoch: 56, train_loss: 0.8234, test_loss: 0.8343, test_f1: 0.5715
 epoch: 57, train_loss: 0.8088, test_loss: 0.7927, test_f1: 0.5950
 epoch: 58, train_loss: 0.8147, test_loss: 0.8094, test_f1: 0.5798
 epoch: 59, train_loss: 0.8049, test_loss: 0.8118, test_f1: 0.6026
 epoch: 60, train_loss: 0.8018, test_loss: 0.8064, test_f1: 0.6446
 epoch: 61, train_loss: 0.8100, test_loss: 0.8375, test_f1: 0.6319
 epoch: 62, train_loss: 0.7962, test_loss: 0.8009, test_f1: 0.6178
 epoch: 63, train_loss: 0.8013, test_loss: 0.7637, test_f1: 0.6189
 epoch: 64, train_loss: 0.8009, test_loss: 0.7838, test_f1: 0.6206
 epoch: 65, train_loss: 0.7960, test_loss: 0.8033, test_f1: 0.6481
 epoch: 66, train_loss: 0.7975, test_loss: 0.7881, test_f1: 0.6244
 epoch: 67, train_loss: 0.7802, test_loss: 0.8103, test_f1: 0.6313
 epoch: 68, train_loss: 0.7868, test_loss: 0.8030, test_f1: 0.6129
 epoch: 69, train_loss: 0.7966, test_loss: 0.7929, test_f1: 0.6179
 epoch: 70, train_loss: 0.7956, test_loss: 0.8037, test_f1: 0.5997
 epoch: 71, train_loss: 0.7945, test_loss: 0.7928, test_f1: 0.6299
 epoch: 72, train_loss: 0.8018, test_loss: 0.7883, test_f1: 0.5921
 epoch: 73, train_loss: 0.8075, test_loss: 0.8167, test_f1: 0.6129
 epoch: 74, train_loss: 0.7885, test_loss: 0.8189, test_f1: 0.6185
 epoch: 75, train_loss: 0.7897, test_loss: 0.8039, test_f1: 0.6248
 epoch: 76, train_loss: 0.7876, test_loss: 0.7913, test_f1: 0.6387
 epoch: 77, train_loss: 0.7909, test_loss: 0.7985, test_f1: 0.6391
 epoch: 78, train_loss: 0.7914, test_loss: 0.7997, test_f1: 0.6452
 epoch: 79, train_loss: 0.7840, test_loss: 0.7923, test_f1: 0.6413
 epoch: 80, train_loss: 0.7928, test_loss: 0.8355, test_f1: 0.5951
 epoch: 81, train_loss: 0.7905, test_loss: 0.8240, test_f1: 0.6198
 epoch: 82, train_loss: 0.7916, test_loss: 0.8061, test_f1: 0.6181
 epoch: 83, train_loss: 0.7923, test_loss: 0.8443, test_f1: 0.5894
 epoch: 84, train_loss: 0.7878, test_loss: 0.7738, test_f1: 0.6371
 epoch: 85, train_loss: 0.7763, test_loss: 0.8042, test_f1: 0.6374
 epoch: 86, train_loss: 0.7676, test_loss: 0.8253, test_f1: 0.6436
 epoch: 87, train_loss: 0.7801, test_loss: 0.7764, test_f1: 0.6315
 epoch: 88, train_loss: 0.7873, test_loss: 0.7710, test_f1: 0.6454
 epoch: 89, train_loss: 0.7932, test_loss: 0.7876, test_f1: 0.6464
 epoch: 90, train_loss: 0.7770, test_loss: 0.8396, test_f1: 0.6028
 epoch: 91, train_loss: 0.7844, test_loss: 0.7820, test_f1: 0.6375
 epoch: 92, train_loss: 0.7825, test_loss: 0.8125, test_f1: 0.6067
 epoch: 93, train_loss: 0.7672, test_loss: 0.7899, test_f1: 0.6167
 epoch: 94, train_loss: 0.7822, test_loss: 0.7933, test_f1: 0.6157
 epoch: 95, train_loss: 0.7760, test_loss: 0.7860, test_f1: 0.6497
 epoch: 96, train_loss: 0.7721, test_loss: 0.8028, test_f1: 0.6280
 epoch: 97, train_loss: 0.7781, test_loss: 0.8255, test_f1: 0.6224
 epoch: 98, train_loss: 0.7584, test_loss: 0.7904, test_f1: 0.6220
 epoch: 99, train_loss: 0.7715, test_loss: 0.7510, test_f1: 0.6198

Training completed in 1110.65 seconds
Best F1: 0.6668 at epoch 99
Mean F1 across iterations: 0.6426  0.0111
========================FINAL RESULTS================================
FEGIN weighted F1: 0.6668  0.0111
python main.py --data ltspice_examples --representation component_pin_net --model FEGIN --layers 4 --hiddens 16 --batch_size 32 --lr 0.01 --emb_size 250 --epochs 100 --save_appendix component_pin_net_L4_H16_BS32_LR0.01_E250 --no_val
-----



STDERR:
  File "main.py", line 370, in <module>
    main()
  File "main.py", line 254, in main
    dataset = dataset_class(
  File "/home/philip/projects/ltspice_examples_code_repo/Circuit-Completion-Using-GNNs/component_classification_with_link_prediction_head/evaluation/FEGIN/kernel/circuit_datasets.py", line 15, in __init__
    self.data, self.slices = torch.load(self.processed_paths[0])
  File "/home/philip/.local/lib/python3.8/site-packages/torch/serialization.py", line 1040, in load
    warnings.warn(
  File "/usr/lib/python3.8/warnings.py", line 109, in _showwarnmsg
    sw(msg.message, msg.category, msg.filename, msg.lineno,
  File "main.py", line 47, in warn_with_traceback
    traceback.print_stack(file=log)
/home/philip/projects/ltspice_examples_code_repo/Circuit-Completion-Using-GNNs/component_classification_with_link_prediction_head/evaluation/FEGIN/kernel/circuit_datasets.py:15: FutureWarning: You are using `torch.load` with `weights_only=False` (the current default value), which uses the default pickle module implicitly. It is possible to construct malicious pickle data which will execute arbitrary code during unpickling (See https://github.com/pytorch/pytorch/blob/main/SECURITY.md#untrusted-models for more details). In a future release, the default value for `weights_only` will be flipped to `True`. This limits the functions that could be executed during unpickling. Arbitrary objects will no longer be allowed to be loaded via this mode unless they are explicitly allowlisted by the user via `torch.serialization.add_safe_globals`. We recommend you start setting `weights_only=True` for any use case where you don't have full control of the loaded file. Please open an issue on GitHub for any issues related to this experimental feature.
  self.data, self.slices = torch.load(self.processed_paths[0])
