STDOUT:
Results will be saved in /home/philip/projects/ltspice_examples_code_repo/Circuit-Completion-Using-GNNs/component_classification_with_link_prediction_head/evaluation/FEGIN/results/model_FEGIN_dataset_ltspice_examples
Command line input: python main.py --data ltspice_examples --representation component_pin_net --model FEGIN --layers 3 --hiddens 128 --batch_size 32 --lr 0.0001 --emb_size 128 --epochs 100 --save_appendix component_pin_net_L3_H128_BS32_LR0.0001_E128 --no_val
 is saved.
-----
ltspice_examples - FEGIN
Using 3 layers, 128 hidden units, h = 2
Loading component_pin_net representation dataset
ENTERED
Training FEGIN on component_pin_net representation
Train: 3558, Test: 846
##################ITERATION #0 ****************************************
 epoch: 0, train_loss: 1.3110, test_loss: 1.1885, test_f1: 0.3014
 epoch: 1, train_loss: 1.1820, test_loss: 1.1293, test_f1: 0.3821
 epoch: 2, train_loss: 1.1184, test_loss: 1.0550, test_f1: 0.4528
 epoch: 3, train_loss: 1.0492, test_loss: 1.0293, test_f1: 0.4579
 epoch: 4, train_loss: 1.0066, test_loss: 1.0027, test_f1: 0.5127
 epoch: 5, train_loss: 0.9805, test_loss: 0.9600, test_f1: 0.5065
 epoch: 6, train_loss: 0.9569, test_loss: 0.9589, test_f1: 0.5215
 epoch: 7, train_loss: 0.9303, test_loss: 0.9639, test_f1: 0.5301
 epoch: 8, train_loss: 0.9276, test_loss: 0.9032, test_f1: 0.5096
 epoch: 9, train_loss: 0.9093, test_loss: 0.9157, test_f1: 0.5164
 epoch: 10, train_loss: 0.8989, test_loss: 0.8994, test_f1: 0.5280
 epoch: 11, train_loss: 0.8827, test_loss: 0.9191, test_f1: 0.5198
 epoch: 12, train_loss: 0.8783, test_loss: 0.8729, test_f1: 0.5290
 epoch: 13, train_loss: 0.8662, test_loss: 0.8716, test_f1: 0.5333
 epoch: 14, train_loss: 0.8465, test_loss: 0.8810, test_f1: 0.5356
 epoch: 15, train_loss: 0.8517, test_loss: 0.8605, test_f1: 0.5393
 epoch: 16, train_loss: 0.8414, test_loss: 0.8635, test_f1: 0.5296
 epoch: 17, train_loss: 0.8348, test_loss: 0.8381, test_f1: 0.5548
 epoch: 18, train_loss: 0.8193, test_loss: 0.8444, test_f1: 0.5536
 epoch: 19, train_loss: 0.8084, test_loss: 0.8491, test_f1: 0.5550
 epoch: 20, train_loss: 0.8058, test_loss: 0.8320, test_f1: 0.5694
 epoch: 21, train_loss: 0.7977, test_loss: 0.8399, test_f1: 0.5698
 epoch: 22, train_loss: 0.7914, test_loss: 0.8490, test_f1: 0.5592
 epoch: 23, train_loss: 0.7766, test_loss: 0.8325, test_f1: 0.5450
 epoch: 24, train_loss: 0.7737, test_loss: 0.8271, test_f1: 0.5682
 epoch: 25, train_loss: 0.7722, test_loss: 0.8008, test_f1: 0.5662
 epoch: 26, train_loss: 0.7696, test_loss: 0.8190, test_f1: 0.5916
 epoch: 27, train_loss: 0.7528, test_loss: 0.7894, test_f1: 0.5704
 epoch: 28, train_loss: 0.7585, test_loss: 0.8607, test_f1: 0.5967
 epoch: 29, train_loss: 0.7529, test_loss: 0.8341, test_f1: 0.6165
 epoch: 30, train_loss: 0.7411, test_loss: 0.8044, test_f1: 0.6168
 epoch: 31, train_loss: 0.7411, test_loss: 0.8439, test_f1: 0.5815
 epoch: 32, train_loss: 0.7311, test_loss: 0.8356, test_f1: 0.5966
 epoch: 33, train_loss: 0.7230, test_loss: 0.8390, test_f1: 0.5962
 epoch: 34, train_loss: 0.7179, test_loss: 0.8213, test_f1: 0.5883
 epoch: 35, train_loss: 0.7191, test_loss: 0.8289, test_f1: 0.5898
 epoch: 36, train_loss: 0.7108, test_loss: 0.8352, test_f1: 0.6115
 epoch: 37, train_loss: 0.6965, test_loss: 0.8148, test_f1: 0.6142
 epoch: 38, train_loss: 0.7037, test_loss: 0.8881, test_f1: 0.6052
 epoch: 39, train_loss: 0.6833, test_loss: 0.8636, test_f1: 0.5643
 epoch: 40, train_loss: 0.6885, test_loss: 0.8312, test_f1: 0.5961
 epoch: 41, train_loss: 0.6781, test_loss: 0.7916, test_f1: 0.6222
 epoch: 42, train_loss: 0.6773, test_loss: 0.8542, test_f1: 0.6019
 epoch: 43, train_loss: 0.6814, test_loss: 0.8579, test_f1: 0.6325
 epoch: 44, train_loss: 0.6700, test_loss: 0.8763, test_f1: 0.5872
 epoch: 45, train_loss: 0.6638, test_loss: 0.9154, test_f1: 0.6056
 epoch: 46, train_loss: 0.6538, test_loss: 0.8654, test_f1: 0.6086
 epoch: 47, train_loss: 0.6698, test_loss: 0.8853, test_f1: 0.6130
 epoch: 48, train_loss: 0.6499, test_loss: 0.8952, test_f1: 0.5957
 epoch: 49, train_loss: 0.6595, test_loss: 0.8898, test_f1: 0.6151
 epoch: 50, train_loss: 0.6366, test_loss: 0.8783, test_f1: 0.6391
 epoch: 51, train_loss: 0.6203, test_loss: 0.8682, test_f1: 0.6172
 epoch: 52, train_loss: 0.6266, test_loss: 0.8930, test_f1: 0.6359
 epoch: 53, train_loss: 0.6101, test_loss: 0.9019, test_f1: 0.6141
 epoch: 54, train_loss: 0.6025, test_loss: 0.9029, test_f1: 0.6248
 epoch: 55, train_loss: 0.6053, test_loss: 0.9220, test_f1: 0.6354
 epoch: 56, train_loss: 0.6071, test_loss: 0.9097, test_f1: 0.6247
 epoch: 57, train_loss: 0.5978, test_loss: 0.9242, test_f1: 0.6329
 epoch: 58, train_loss: 0.5991, test_loss: 0.9455, test_f1: 0.6213
 epoch: 59, train_loss: 0.5881, test_loss: 0.9725, test_f1: 0.6306
 epoch: 60, train_loss: 0.5832, test_loss: 0.9692, test_f1: 0.6290
 epoch: 61, train_loss: 0.5853, test_loss: 0.9737, test_f1: 0.6279
 epoch: 62, train_loss: 0.5906, test_loss: 0.9768, test_f1: 0.6308
 epoch: 63, train_loss: 0.5849, test_loss: 0.9471, test_f1: 0.6517
 epoch: 64, train_loss: 0.5715, test_loss: 0.9917, test_f1: 0.6387
 epoch: 65, train_loss: 0.5835, test_loss: 0.9839, test_f1: 0.6375
 epoch: 66, train_loss: 0.5764, test_loss: 0.9719, test_f1: 0.6309
 epoch: 67, train_loss: 0.5791, test_loss: 0.9619, test_f1: 0.6343
 epoch: 68, train_loss: 0.5729, test_loss: 0.9984, test_f1: 0.6385
 epoch: 69, train_loss: 0.5615, test_loss: 1.0141, test_f1: 0.6188
 epoch: 70, train_loss: 0.5719, test_loss: 0.9680, test_f1: 0.6393
 epoch: 71, train_loss: 0.5558, test_loss: 1.0365, test_f1: 0.6338
 epoch: 72, train_loss: 0.5632, test_loss: 1.0034, test_f1: 0.6337
 epoch: 73, train_loss: 0.5567, test_loss: 0.9811, test_f1: 0.6461
 epoch: 74, train_loss: 0.5536, test_loss: 0.9911, test_f1: 0.6373
 epoch: 75, train_loss: 0.5506, test_loss: 0.9908, test_f1: 0.6455
 epoch: 76, train_loss: 0.5481, test_loss: 1.0061, test_f1: 0.6536
 epoch: 77, train_loss: 0.5505, test_loss: 0.9569, test_f1: 0.6450
 epoch: 78, train_loss: 0.5433, test_loss: 0.9881, test_f1: 0.6343
 epoch: 79, train_loss: 0.5359, test_loss: 1.0039, test_f1: 0.6453
 epoch: 80, train_loss: 0.5445, test_loss: 1.0022, test_f1: 0.6366
 epoch: 81, train_loss: 0.5384, test_loss: 0.9603, test_f1: 0.6431
 epoch: 82, train_loss: 0.5319, test_loss: 1.0618, test_f1: 0.6329
 epoch: 83, train_loss: 0.5224, test_loss: 1.0853, test_f1: 0.6152
 epoch: 84, train_loss: 0.5178, test_loss: 1.1011, test_f1: 0.6054
 epoch: 85, train_loss: 0.5275, test_loss: 1.0312, test_f1: 0.6207
 epoch: 86, train_loss: 0.5356, test_loss: 1.0804, test_f1: 0.6230
 epoch: 87, train_loss: 0.5333, test_loss: 1.0603, test_f1: 0.6156
 epoch: 88, train_loss: 0.5275, test_loss: 1.0629, test_f1: 0.6356
 epoch: 89, train_loss: 0.5125, test_loss: 1.0638, test_f1: 0.6336
 epoch: 90, train_loss: 0.5189, test_loss: 1.0626, test_f1: 0.6405
 epoch: 91, train_loss: 0.5033, test_loss: 1.0722, test_f1: 0.6299
 epoch: 92, train_loss: 0.4943, test_loss: 1.0874, test_f1: 0.6353
 epoch: 93, train_loss: 0.5110, test_loss: 1.1420, test_f1: 0.6153
 epoch: 94, train_loss: 0.5087, test_loss: 1.0871, test_f1: 0.6424
 epoch: 95, train_loss: 0.5036, test_loss: 1.0875, test_f1: 0.6348
 epoch: 96, train_loss: 0.5125, test_loss: 1.1341, test_f1: 0.6398
 epoch: 97, train_loss: 0.5019, test_loss: 1.0834, test_f1: 0.6233
 epoch: 98, train_loss: 0.4888, test_loss: 1.1375, test_f1: 0.6170
 epoch: 99, train_loss: 0.4932, test_loss: 1.1539, test_f1: 0.6088
##################ITERATION #1 ****************************************
 epoch: 0, train_loss: 1.2080, test_loss: 1.0527, test_f1: 0.4237
 epoch: 1, train_loss: 1.0399, test_loss: 0.9882, test_f1: 0.4962
 epoch: 2, train_loss: 0.9876, test_loss: 0.9512, test_f1: 0.5073
 epoch: 3, train_loss: 0.9594, test_loss: 0.9411, test_f1: 0.5402
 epoch: 4, train_loss: 0.9384, test_loss: 0.9252, test_f1: 0.5186
 epoch: 5, train_loss: 0.9221, test_loss: 0.8915, test_f1: 0.5361
 epoch: 6, train_loss: 0.9024, test_loss: 0.9185, test_f1: 0.5405
 epoch: 7, train_loss: 0.8965, test_loss: 0.8959, test_f1: 0.5570
 epoch: 8, train_loss: 0.8658, test_loss: 0.8366, test_f1: 0.5713
 epoch: 9, train_loss: 0.8607, test_loss: 0.8443, test_f1: 0.5808
 epoch: 10, train_loss: 0.8354, test_loss: 0.8507, test_f1: 0.5649
 epoch: 11, train_loss: 0.8324, test_loss: 0.8268, test_f1: 0.5786
 epoch: 12, train_loss: 0.8259, test_loss: 0.8186, test_f1: 0.5831
 epoch: 13, train_loss: 0.8176, test_loss: 0.8137, test_f1: 0.5803
 epoch: 14, train_loss: 0.8013, test_loss: 0.8261, test_f1: 0.5659
 epoch: 15, train_loss: 0.8002, test_loss: 0.8168, test_f1: 0.5702
 epoch: 16, train_loss: 0.7840, test_loss: 0.7911, test_f1: 0.5883
 epoch: 17, train_loss: 0.7785, test_loss: 0.7555, test_f1: 0.5994
 epoch: 18, train_loss: 0.7694, test_loss: 0.7852, test_f1: 0.6123
 epoch: 19, train_loss: 0.7538, test_loss: 0.8155, test_f1: 0.6429
 epoch: 20, train_loss: 0.7525, test_loss: 0.7617, test_f1: 0.6153
 epoch: 21, train_loss: 0.7324, test_loss: 0.7421, test_f1: 0.6154
 epoch: 22, train_loss: 0.7267, test_loss: 0.7684, test_f1: 0.5958
 epoch: 23, train_loss: 0.7311, test_loss: 0.7325, test_f1: 0.6622
 epoch: 24, train_loss: 0.7216, test_loss: 0.7326, test_f1: 0.6344
 epoch: 25, train_loss: 0.6998, test_loss: 0.7755, test_f1: 0.6371
 epoch: 26, train_loss: 0.7033, test_loss: 0.7538, test_f1: 0.6190
 epoch: 27, train_loss: 0.6830, test_loss: 0.7602, test_f1: 0.6281
 epoch: 28, train_loss: 0.6879, test_loss: 0.7939, test_f1: 0.6133
 epoch: 29, train_loss: 0.6724, test_loss: 0.7380, test_f1: 0.6413
 epoch: 30, train_loss: 0.6697, test_loss: 0.7628, test_f1: 0.6463
 epoch: 31, train_loss: 0.6595, test_loss: 0.7530, test_f1: 0.6447
 epoch: 32, train_loss: 0.6657, test_loss: 0.7473, test_f1: 0.6276
 epoch: 33, train_loss: 0.6495, test_loss: 0.7491, test_f1: 0.6435
 epoch: 34, train_loss: 0.6551, test_loss: 0.7353, test_f1: 0.6416
 epoch: 35, train_loss: 0.6348, test_loss: 0.7460, test_f1: 0.6501
 epoch: 36, train_loss: 0.6229, test_loss: 0.7927, test_f1: 0.6228
 epoch: 37, train_loss: 0.6096, test_loss: 0.7499, test_f1: 0.6315
 epoch: 38, train_loss: 0.6252, test_loss: 0.7465, test_f1: 0.6510
 epoch: 39, train_loss: 0.6116, test_loss: 0.7453, test_f1: 0.6547
 epoch: 40, train_loss: 0.6035, test_loss: 0.7634, test_f1: 0.6336
 epoch: 41, train_loss: 0.5962, test_loss: 0.7454, test_f1: 0.6561
 epoch: 42, train_loss: 0.6060, test_loss: 0.7922, test_f1: 0.6256
 epoch: 43, train_loss: 0.5928, test_loss: 0.7733, test_f1: 0.6553
 epoch: 44, train_loss: 0.5751, test_loss: 0.7753, test_f1: 0.6383
 epoch: 45, train_loss: 0.5762, test_loss: 0.8085, test_f1: 0.6498
 epoch: 46, train_loss: 0.5835, test_loss: 0.7603, test_f1: 0.6534
 epoch: 47, train_loss: 0.5689, test_loss: 0.7882, test_f1: 0.6195
 epoch: 48, train_loss: 0.5667, test_loss: 0.7358, test_f1: 0.6426
 epoch: 49, train_loss: 0.5651, test_loss: 0.8026, test_f1: 0.6452
 epoch: 50, train_loss: 0.5545, test_loss: 0.8265, test_f1: 0.6348
 epoch: 51, train_loss: 0.5404, test_loss: 0.8235, test_f1: 0.6311
 epoch: 52, train_loss: 0.5356, test_loss: 0.7963, test_f1: 0.6531
 epoch: 53, train_loss: 0.5268, test_loss: 0.8357, test_f1: 0.6234
 epoch: 54, train_loss: 0.5310, test_loss: 0.8333, test_f1: 0.6356
 epoch: 55, train_loss: 0.5124, test_loss: 0.8209, test_f1: 0.6400
 epoch: 56, train_loss: 0.5093, test_loss: 0.8593, test_f1: 0.6460
 epoch: 57, train_loss: 0.5199, test_loss: 0.8001, test_f1: 0.6523
 epoch: 58, train_loss: 0.5073, test_loss: 0.7873, test_f1: 0.6376
 epoch: 59, train_loss: 0.5163, test_loss: 0.8609, test_f1: 0.6397
 epoch: 60, train_loss: 0.5021, test_loss: 0.8528, test_f1: 0.6448
 epoch: 61, train_loss: 0.5014, test_loss: 0.8231, test_f1: 0.6315
 epoch: 62, train_loss: 0.4970, test_loss: 0.8345, test_f1: 0.6438
 epoch: 63, train_loss: 0.4987, test_loss: 0.8834, test_f1: 0.6253
 epoch: 64, train_loss: 0.4933, test_loss: 0.8441, test_f1: 0.6504
 epoch: 65, train_loss: 0.4881, test_loss: 0.8116, test_f1: 0.6305
 epoch: 66, train_loss: 0.4968, test_loss: 0.8208, test_f1: 0.6491
 epoch: 67, train_loss: 0.4909, test_loss: 0.8673, test_f1: 0.6293
 epoch: 68, train_loss: 0.4778, test_loss: 0.8453, test_f1: 0.6581
 epoch: 69, train_loss: 0.4754, test_loss: 0.8238, test_f1: 0.6692
 epoch: 70, train_loss: 0.4841, test_loss: 0.8714, test_f1: 0.6462
 epoch: 71, train_loss: 0.4821, test_loss: 0.8358, test_f1: 0.6725
 epoch: 72, train_loss: 0.4706, test_loss: 0.9047, test_f1: 0.6283
 epoch: 73, train_loss: 0.4650, test_loss: 0.8908, test_f1: 0.6446
 epoch: 74, train_loss: 0.4633, test_loss: 0.8810, test_f1: 0.6547
 epoch: 75, train_loss: 0.4529, test_loss: 0.9020, test_f1: 0.6203
 epoch: 76, train_loss: 0.4671, test_loss: 0.8939, test_f1: 0.6275
 epoch: 77, train_loss: 0.4598, test_loss: 0.9340, test_f1: 0.6302
 epoch: 78, train_loss: 0.4458, test_loss: 0.8620, test_f1: 0.6530
 epoch: 79, train_loss: 0.4506, test_loss: 0.9183, test_f1: 0.6560
 epoch: 80, train_loss: 0.4594, test_loss: 0.9208, test_f1: 0.6315
 epoch: 81, train_loss: 0.4380, test_loss: 0.9498, test_f1: 0.6317
 epoch: 82, train_loss: 0.4469, test_loss: 0.9362, test_f1: 0.6419
 epoch: 83, train_loss: 0.4385, test_loss: 0.8752, test_f1: 0.6279
 epoch: 84, train_loss: 0.4455, test_loss: 0.8972, test_f1: 0.6249
 epoch: 85, train_loss: 0.4356, test_loss: 1.0169, test_f1: 0.6406
 epoch: 86, train_loss: 0.4354, test_loss: 0.9544, test_f1: 0.6256
 epoch: 87, train_loss: 0.4282, test_loss: 0.9749, test_f1: 0.6211
 epoch: 88, train_loss: 0.4367, test_loss: 0.9509, test_f1: 0.6206
 epoch: 89, train_loss: 0.4224, test_loss: 0.9635, test_f1: 0.6338
 epoch: 90, train_loss: 0.4261, test_loss: 0.9347, test_f1: 0.6501
 epoch: 91, train_loss: 0.4235, test_loss: 0.9387, test_f1: 0.6456
 epoch: 92, train_loss: 0.4155, test_loss: 0.9297, test_f1: 0.6327
 epoch: 93, train_loss: 0.4218, test_loss: 0.9503, test_f1: 0.6617
 epoch: 94, train_loss: 0.4191, test_loss: 1.0342, test_f1: 0.6128
 epoch: 95, train_loss: 0.4162, test_loss: 0.9130, test_f1: 0.6227
 epoch: 96, train_loss: 0.4258, test_loss: 0.9293, test_f1: 0.6519
 epoch: 97, train_loss: 0.4102, test_loss: 0.9959, test_f1: 0.6353
 epoch: 98, train_loss: 0.4015, test_loss: 0.9569, test_f1: 0.6247
 epoch: 99, train_loss: 0.4122, test_loss: 0.9716, test_f1: 0.6320
##################ITERATION #2 ****************************************
 epoch: 0, train_loss: 1.1485, test_loss: 1.0322, test_f1: 0.4878
 epoch: 1, train_loss: 1.0150, test_loss: 0.9831, test_f1: 0.4816
 epoch: 2, train_loss: 0.9659, test_loss: 0.9673, test_f1: 0.5196
 epoch: 3, train_loss: 0.9526, test_loss: 0.9358, test_f1: 0.5338
 epoch: 4, train_loss: 0.9369, test_loss: 0.9106, test_f1: 0.5272
 epoch: 5, train_loss: 0.9252, test_loss: 0.8874, test_f1: 0.5527
 epoch: 6, train_loss: 0.9045, test_loss: 0.8839, test_f1: 0.5427
 epoch: 7, train_loss: 0.8920, test_loss: 0.8590, test_f1: 0.5472
 epoch: 8, train_loss: 0.8756, test_loss: 0.8714, test_f1: 0.5380
 epoch: 9, train_loss: 0.8659, test_loss: 0.8629, test_f1: 0.5506
 epoch: 10, train_loss: 0.8537, test_loss: 0.8374, test_f1: 0.5572
 epoch: 11, train_loss: 0.8418, test_loss: 0.8085, test_f1: 0.5756
 epoch: 12, train_loss: 0.8218, test_loss: 0.8161, test_f1: 0.5629
 epoch: 13, train_loss: 0.8151, test_loss: 0.8041, test_f1: 0.5604
 epoch: 14, train_loss: 0.8182, test_loss: 0.7876, test_f1: 0.5963
 epoch: 15, train_loss: 0.7956, test_loss: 0.7985, test_f1: 0.6009
 epoch: 16, train_loss: 0.7859, test_loss: 0.7796, test_f1: 0.5956
 epoch: 17, train_loss: 0.7792, test_loss: 0.7866, test_f1: 0.5982
 epoch: 18, train_loss: 0.7783, test_loss: 0.7684, test_f1: 0.6088
 epoch: 19, train_loss: 0.7607, test_loss: 0.7870, test_f1: 0.6139
 epoch: 20, train_loss: 0.7631, test_loss: 0.7909, test_f1: 0.5890
 epoch: 21, train_loss: 0.7472, test_loss: 0.8061, test_f1: 0.5950
 epoch: 22, train_loss: 0.7307, test_loss: 0.7856, test_f1: 0.6156
 epoch: 23, train_loss: 0.7277, test_loss: 0.7357, test_f1: 0.6419
 epoch: 24, train_loss: 0.7175, test_loss: 0.7616, test_f1: 0.6412
 epoch: 25, train_loss: 0.7029, test_loss: 0.7542, test_f1: 0.6167
 epoch: 26, train_loss: 0.7059, test_loss: 0.7767, test_f1: 0.6415
 epoch: 27, train_loss: 0.7090, test_loss: 0.7948, test_f1: 0.6505
 epoch: 28, train_loss: 0.6909, test_loss: 0.7535, test_f1: 0.6217
 epoch: 29, train_loss: 0.6821, test_loss: 0.8159, test_f1: 0.6321
 epoch: 30, train_loss: 0.6658, test_loss: 0.7818, test_f1: 0.6342
 epoch: 31, train_loss: 0.6660, test_loss: 0.7436, test_f1: 0.6470
 epoch: 32, train_loss: 0.6720, test_loss: 0.8223, test_f1: 0.6439
 epoch: 33, train_loss: 0.6544, test_loss: 0.7633, test_f1: 0.6427
 epoch: 34, train_loss: 0.6418, test_loss: 0.8037, test_f1: 0.6598
 epoch: 35, train_loss: 0.6392, test_loss: 0.8150, test_f1: 0.6480
 epoch: 36, train_loss: 0.6372, test_loss: 0.7918, test_f1: 0.6718
 epoch: 37, train_loss: 0.6286, test_loss: 0.8495, test_f1: 0.6340
 epoch: 38, train_loss: 0.6230, test_loss: 0.8366, test_f1: 0.6437
 epoch: 39, train_loss: 0.6292, test_loss: 0.8586, test_f1: 0.6521
 epoch: 40, train_loss: 0.6086, test_loss: 0.8572, test_f1: 0.6537
 epoch: 41, train_loss: 0.5925, test_loss: 0.8644, test_f1: 0.6518
 epoch: 42, train_loss: 0.6060, test_loss: 0.8838, test_f1: 0.6455
 epoch: 43, train_loss: 0.5991, test_loss: 0.9182, test_f1: 0.6245
 epoch: 44, train_loss: 0.5902, test_loss: 0.8570, test_f1: 0.6203
 epoch: 45, train_loss: 0.5896, test_loss: 0.8598, test_f1: 0.6462
 epoch: 46, train_loss: 0.5877, test_loss: 0.8770, test_f1: 0.6455
 epoch: 47, train_loss: 0.5750, test_loss: 0.8826, test_f1: 0.6383
 epoch: 48, train_loss: 0.5699, test_loss: 0.9148, test_f1: 0.6413
 epoch: 49, train_loss: 0.5707, test_loss: 0.8973, test_f1: 0.6463
 epoch: 50, train_loss: 0.5596, test_loss: 0.8858, test_f1: 0.6470
 epoch: 51, train_loss: 0.5417, test_loss: 0.9155, test_f1: 0.6391
 epoch: 52, train_loss: 0.5385, test_loss: 0.9361, test_f1: 0.6199
 epoch: 53, train_loss: 0.5278, test_loss: 0.9129, test_f1: 0.6283
 epoch: 54, train_loss: 0.5265, test_loss: 0.9164, test_f1: 0.6281
 epoch: 55, train_loss: 0.5120, test_loss: 0.9138, test_f1: 0.6451
 epoch: 56, train_loss: 0.5250, test_loss: 0.9310, test_f1: 0.6405
 epoch: 57, train_loss: 0.5208, test_loss: 0.9646, test_f1: 0.6279
 epoch: 58, train_loss: 0.5000, test_loss: 0.9511, test_f1: 0.6479
 epoch: 59, train_loss: 0.5041, test_loss: 0.9362, test_f1: 0.6396
 epoch: 60, train_loss: 0.5124, test_loss: 0.9717, test_f1: 0.6315
 epoch: 61, train_loss: 0.5091, test_loss: 0.9287, test_f1: 0.6267
 epoch: 62, train_loss: 0.5082, test_loss: 0.9254, test_f1: 0.6334
 epoch: 63, train_loss: 0.5030, test_loss: 0.9701, test_f1: 0.6443
 epoch: 64, train_loss: 0.4916, test_loss: 0.9709, test_f1: 0.6319
 epoch: 65, train_loss: 0.5046, test_loss: 0.9822, test_f1: 0.6264
 epoch: 66, train_loss: 0.4981, test_loss: 0.9659, test_f1: 0.6489
 epoch: 67, train_loss: 0.4912, test_loss: 0.9584, test_f1: 0.6349
 epoch: 68, train_loss: 0.4816, test_loss: 0.9848, test_f1: 0.6280
 epoch: 69, train_loss: 0.4813, test_loss: 1.0162, test_f1: 0.6355
 epoch: 70, train_loss: 0.4879, test_loss: 1.0160, test_f1: 0.6282
 epoch: 71, train_loss: 0.4789, test_loss: 1.0150, test_f1: 0.6409
 epoch: 72, train_loss: 0.4715, test_loss: 0.9665, test_f1: 0.6345
 epoch: 73, train_loss: 0.4763, test_loss: 1.0189, test_f1: 0.6218
 epoch: 74, train_loss: 0.4593, test_loss: 1.0604, test_f1: 0.6260
 epoch: 75, train_loss: 0.4737, test_loss: 1.0356, test_f1: 0.6248
 epoch: 76, train_loss: 0.4704, test_loss: 1.0501, test_f1: 0.6409
 epoch: 77, train_loss: 0.4683, test_loss: 1.0573, test_f1: 0.6319
 epoch: 78, train_loss: 0.4618, test_loss: 1.0500, test_f1: 0.6348
 epoch: 79, train_loss: 0.4540, test_loss: 1.0826, test_f1: 0.6392
 epoch: 80, train_loss: 0.4464, test_loss: 1.0754, test_f1: 0.6390
 epoch: 81, train_loss: 0.4577, test_loss: 1.0837, test_f1: 0.6330
 epoch: 82, train_loss: 0.4461, test_loss: 1.0519, test_f1: 0.6285
 epoch: 83, train_loss: 0.4527, test_loss: 1.0863, test_f1: 0.6432
 epoch: 84, train_loss: 0.4532, test_loss: 1.0584, test_f1: 0.6481
 epoch: 85, train_loss: 0.4362, test_loss: 1.1098, test_f1: 0.6287
 epoch: 86, train_loss: 0.4542, test_loss: 1.0475, test_f1: 0.6440
 epoch: 87, train_loss: 0.4418, test_loss: 1.0989, test_f1: 0.6452
 epoch: 88, train_loss: 0.4306, test_loss: 1.1059, test_f1: 0.6386
 epoch: 89, train_loss: 0.4242, test_loss: 1.0718, test_f1: 0.6465
 epoch: 90, train_loss: 0.4438, test_loss: 1.0557, test_f1: 0.6407
 epoch: 91, train_loss: 0.4176, test_loss: 1.1278, test_f1: 0.6416
 epoch: 92, train_loss: 0.4456, test_loss: 1.1898, test_f1: 0.6335
 epoch: 93, train_loss: 0.4387, test_loss: 1.1146, test_f1: 0.6541
 epoch: 94, train_loss: 0.4162, test_loss: 1.1380, test_f1: 0.6276
 epoch: 95, train_loss: 0.4226, test_loss: 1.1423, test_f1: 0.6410
 epoch: 96, train_loss: 0.4258, test_loss: 1.1224, test_f1: 0.6490
 epoch: 97, train_loss: 0.4125, test_loss: 1.1273, test_f1: 0.6463
 epoch: 98, train_loss: 0.4245, test_loss: 1.1361, test_f1: 0.6499
 epoch: 99, train_loss: 0.4105, test_loss: 1.1850, test_f1: 0.6205
##################ITERATION #3 ****************************************
 epoch: 0, train_loss: 1.1168, test_loss: 1.0139, test_f1: 0.4672
 epoch: 1, train_loss: 1.0123, test_loss: 0.9662, test_f1: 0.4711
 epoch: 2, train_loss: 0.9786, test_loss: 0.9603, test_f1: 0.5138
 epoch: 3, train_loss: 0.9539, test_loss: 0.9373, test_f1: 0.4943
 epoch: 4, train_loss: 0.9402, test_loss: 0.9243, test_f1: 0.5003
 epoch: 5, train_loss: 0.9255, test_loss: 0.9264, test_f1: 0.5127
 epoch: 6, train_loss: 0.9142, test_loss: 0.9139, test_f1: 0.5353
 epoch: 7, train_loss: 0.8984, test_loss: 0.8840, test_f1: 0.5494
 epoch: 8, train_loss: 0.8791, test_loss: 0.8704, test_f1: 0.5416
 epoch: 9, train_loss: 0.8647, test_loss: 0.8456, test_f1: 0.5508
 epoch: 10, train_loss: 0.8502, test_loss: 0.8589, test_f1: 0.5709
 epoch: 11, train_loss: 0.8477, test_loss: 0.8338, test_f1: 0.5709
 epoch: 12, train_loss: 0.8365, test_loss: 0.8289, test_f1: 0.5722
 epoch: 13, train_loss: 0.8204, test_loss: 0.8261, test_f1: 0.6134
 epoch: 14, train_loss: 0.8217, test_loss: 0.8256, test_f1: 0.6086
 epoch: 15, train_loss: 0.8039, test_loss: 0.7977, test_f1: 0.5964
 epoch: 16, train_loss: 0.7893, test_loss: 0.7931, test_f1: 0.6033
 epoch: 17, train_loss: 0.7906, test_loss: 0.7857, test_f1: 0.6226
 epoch: 18, train_loss: 0.7726, test_loss: 0.8091, test_f1: 0.6262
 epoch: 19, train_loss: 0.7643, test_loss: 0.8081, test_f1: 0.6190
 epoch: 20, train_loss: 0.7576, test_loss: 0.7885, test_f1: 0.6429
 epoch: 21, train_loss: 0.7523, test_loss: 0.7650, test_f1: 0.6253
 epoch: 22, train_loss: 0.7503, test_loss: 0.7593, test_f1: 0.6354
 epoch: 23, train_loss: 0.7322, test_loss: 0.7761, test_f1: 0.6526
 epoch: 24, train_loss: 0.7345, test_loss: 0.7653, test_f1: 0.6344
 epoch: 25, train_loss: 0.7246, test_loss: 0.7673, test_f1: 0.6518
 epoch: 26, train_loss: 0.7013, test_loss: 0.7682, test_f1: 0.6636
 epoch: 27, train_loss: 0.7123, test_loss: 0.7328, test_f1: 0.6776
 epoch: 28, train_loss: 0.7037, test_loss: 0.7416, test_f1: 0.6571
 epoch: 29, train_loss: 0.6907, test_loss: 0.7363, test_f1: 0.6405
 epoch: 30, train_loss: 0.6899, test_loss: 0.7338, test_f1: 0.6821
 epoch: 31, train_loss: 0.6828, test_loss: 0.7565, test_f1: 0.6379
 epoch: 32, train_loss: 0.6720, test_loss: 0.7303, test_f1: 0.6685
 epoch: 33, train_loss: 0.6674, test_loss: 0.7238, test_f1: 0.6456
 epoch: 34, train_loss: 0.6539, test_loss: 0.7605, test_f1: 0.6575
 epoch: 35, train_loss: 0.6627, test_loss: 0.7805, test_f1: 0.6196
 epoch: 36, train_loss: 0.6492, test_loss: 0.7467, test_f1: 0.6724
 epoch: 37, train_loss: 0.6442, test_loss: 0.7343, test_f1: 0.6989
 epoch: 38, train_loss: 0.6326, test_loss: 0.7180, test_f1: 0.6621
 epoch: 39, train_loss: 0.6298, test_loss: 0.7326, test_f1: 0.6757
 epoch: 40, train_loss: 0.6165, test_loss: 0.7159, test_f1: 0.6599
 epoch: 41, train_loss: 0.6214, test_loss: 0.6994, test_f1: 0.6877
 epoch: 42, train_loss: 0.6155, test_loss: 0.6984, test_f1: 0.6933
 epoch: 43, train_loss: 0.6116, test_loss: 0.7244, test_f1: 0.6687
 epoch: 44, train_loss: 0.6061, test_loss: 0.7411, test_f1: 0.6675
 epoch: 45, train_loss: 0.5862, test_loss: 0.7469, test_f1: 0.6814
 epoch: 46, train_loss: 0.5906, test_loss: 0.7201, test_f1: 0.6962
 epoch: 47, train_loss: 0.5955, test_loss: 0.7308, test_f1: 0.6618
 epoch: 48, train_loss: 0.5842, test_loss: 0.7467, test_f1: 0.6438
 epoch: 49, train_loss: 0.5779, test_loss: 0.7741, test_f1: 0.6732
 epoch: 50, train_loss: 0.5635, test_loss: 0.7433, test_f1: 0.6796
 epoch: 51, train_loss: 0.5487, test_loss: 0.7581, test_f1: 0.6750
 epoch: 52, train_loss: 0.5375, test_loss: 0.7636, test_f1: 0.6867
 epoch: 53, train_loss: 0.5510, test_loss: 0.8098, test_f1: 0.6511
 epoch: 54, train_loss: 0.5306, test_loss: 0.8034, test_f1: 0.6900
 epoch: 55, train_loss: 0.5380, test_loss: 0.7456, test_f1: 0.6869
 epoch: 56, train_loss: 0.5346, test_loss: 0.7992, test_f1: 0.6910
 epoch: 57, train_loss: 0.5192, test_loss: 0.7549, test_f1: 0.6598
 epoch: 58, train_loss: 0.5225, test_loss: 0.7276, test_f1: 0.6742
 epoch: 59, train_loss: 0.5137, test_loss: 0.7788, test_f1: 0.6643
 epoch: 60, train_loss: 0.5157, test_loss: 0.7805, test_f1: 0.6740
 epoch: 61, train_loss: 0.5179, test_loss: 0.8064, test_f1: 0.6809
 epoch: 62, train_loss: 0.5213, test_loss: 0.7755, test_f1: 0.6535
 epoch: 63, train_loss: 0.5156, test_loss: 0.8046, test_f1: 0.6495
 epoch: 64, train_loss: 0.5070, test_loss: 0.8234, test_f1: 0.6686
 epoch: 65, train_loss: 0.5035, test_loss: 0.8034, test_f1: 0.6478
 epoch: 66, train_loss: 0.5012, test_loss: 0.7651, test_f1: 0.6593
 epoch: 67, train_loss: 0.4904, test_loss: 0.7888, test_f1: 0.6551
 epoch: 68, train_loss: 0.4891, test_loss: 0.8121, test_f1: 0.6623
 epoch: 69, train_loss: 0.4918, test_loss: 0.7987, test_f1: 0.6670
 epoch: 70, train_loss: 0.4938, test_loss: 0.8007, test_f1: 0.6687
 epoch: 71, train_loss: 0.4842, test_loss: 0.8074, test_f1: 0.6464
 epoch: 72, train_loss: 0.4834, test_loss: 0.7973, test_f1: 0.6609
 epoch: 73, train_loss: 0.4809, test_loss: 0.8272, test_f1: 0.6516
 epoch: 74, train_loss: 0.4747, test_loss: 0.8653, test_f1: 0.6542
 epoch: 75, train_loss: 0.4707, test_loss: 0.8009, test_f1: 0.6674
 epoch: 76, train_loss: 0.4695, test_loss: 0.8416, test_f1: 0.6656
 epoch: 77, train_loss: 0.4722, test_loss: 0.8588, test_f1: 0.6514
 epoch: 78, train_loss: 0.4684, test_loss: 0.8800, test_f1: 0.6592
 epoch: 79, train_loss: 0.4706, test_loss: 0.8819, test_f1: 0.6768
 epoch: 80, train_loss: 0.4611, test_loss: 0.8347, test_f1: 0.6535
 epoch: 81, train_loss: 0.4683, test_loss: 0.8457, test_f1: 0.6582
 epoch: 82, train_loss: 0.4552, test_loss: 0.8625, test_f1: 0.6514
 epoch: 83, train_loss: 0.4639, test_loss: 0.8473, test_f1: 0.6759
 epoch: 84, train_loss: 0.4474, test_loss: 0.8574, test_f1: 0.6827
 epoch: 85, train_loss: 0.4530, test_loss: 0.9174, test_f1: 0.6573
 epoch: 86, train_loss: 0.4464, test_loss: 0.8828, test_f1: 0.6698
 epoch: 87, train_loss: 0.4497, test_loss: 0.8522, test_f1: 0.6538
 epoch: 88, train_loss: 0.4515, test_loss: 0.8794, test_f1: 0.6532
 epoch: 89, train_loss: 0.4455, test_loss: 0.8383, test_f1: 0.6646
 epoch: 90, train_loss: 0.4345, test_loss: 0.9134, test_f1: 0.6559
 epoch: 91, train_loss: 0.4423, test_loss: 0.9106, test_f1: 0.6753
 epoch: 92, train_loss: 0.4319, test_loss: 0.8921, test_f1: 0.6494
 epoch: 93, train_loss: 0.4491, test_loss: 0.8632, test_f1: 0.6676
 epoch: 94, train_loss: 0.4355, test_loss: 0.8733, test_f1: 0.6545
 epoch: 95, train_loss: 0.4177, test_loss: 0.8454, test_f1: 0.6544
 epoch: 96, train_loss: 0.4292, test_loss: 0.8981, test_f1: 0.6478
 epoch: 97, train_loss: 0.4179, test_loss: 0.8918, test_f1: 0.6674
 epoch: 98, train_loss: 0.4092, test_loss: 0.9487, test_f1: 0.6560
 epoch: 99, train_loss: 0.4301, test_loss: 0.9794, test_f1: 0.6739
##################ITERATION #4 ****************************************
 epoch: 0, train_loss: 1.1330, test_loss: 0.9816, test_f1: 0.4588
 epoch: 1, train_loss: 0.9903, test_loss: 0.9575, test_f1: 0.4720
 epoch: 2, train_loss: 0.9678, test_loss: 0.9402, test_f1: 0.5058
 epoch: 3, train_loss: 0.9362, test_loss: 0.8986, test_f1: 0.5037
 epoch: 4, train_loss: 0.9238, test_loss: 0.8930, test_f1: 0.5812
 epoch: 5, train_loss: 0.9134, test_loss: 0.8630, test_f1: 0.5557
 epoch: 6, train_loss: 0.8958, test_loss: 0.8408, test_f1: 0.5594
 epoch: 7, train_loss: 0.8844, test_loss: 0.8369, test_f1: 0.5720
 epoch: 8, train_loss: 0.8631, test_loss: 0.8197, test_f1: 0.5819
 epoch: 9, train_loss: 0.8512, test_loss: 0.8081, test_f1: 0.5808
 epoch: 10, train_loss: 0.8354, test_loss: 0.8158, test_f1: 0.6039
 epoch: 11, train_loss: 0.8198, test_loss: 0.8036, test_f1: 0.5928
 epoch: 12, train_loss: 0.8222, test_loss: 0.7998, test_f1: 0.5927
 epoch: 13, train_loss: 0.7939, test_loss: 0.7869, test_f1: 0.5955
 epoch: 14, train_loss: 0.7842, test_loss: 0.7872, test_f1: 0.6060
 epoch: 15, train_loss: 0.7708, test_loss: 0.7729, test_f1: 0.5959
 epoch: 16, train_loss: 0.7727, test_loss: 0.7660, test_f1: 0.6233
 epoch: 17, train_loss: 0.7663, test_loss: 0.7642, test_f1: 0.6213
 epoch: 18, train_loss: 0.7507, test_loss: 0.7764, test_f1: 0.6133
 epoch: 19, train_loss: 0.7456, test_loss: 0.7531, test_f1: 0.6266
 epoch: 20, train_loss: 0.7422, test_loss: 0.7750, test_f1: 0.6544
 epoch: 21, train_loss: 0.7237, test_loss: 0.7636, test_f1: 0.6329
 epoch: 22, train_loss: 0.7157, test_loss: 0.7442, test_f1: 0.6709
 epoch: 23, train_loss: 0.7069, test_loss: 0.7435, test_f1: 0.6345
 epoch: 24, train_loss: 0.6990, test_loss: 0.8153, test_f1: 0.6554
 epoch: 25, train_loss: 0.6969, test_loss: 0.7526, test_f1: 0.6483
 epoch: 26, train_loss: 0.6845, test_loss: 0.7468, test_f1: 0.6358
 epoch: 27, train_loss: 0.6788, test_loss: 0.7477, test_f1: 0.6672
 epoch: 28, train_loss: 0.6580, test_loss: 0.7431, test_f1: 0.6623
 epoch: 29, train_loss: 0.6600, test_loss: 0.7774, test_f1: 0.6580
 epoch: 30, train_loss: 0.6563, test_loss: 0.8316, test_f1: 0.6319
 epoch: 31, train_loss: 0.6433, test_loss: 0.7566, test_f1: 0.6624
 epoch: 32, train_loss: 0.6623, test_loss: 0.7414, test_f1: 0.6618
 epoch: 33, train_loss: 0.6401, test_loss: 0.7565, test_f1: 0.6779
 epoch: 34, train_loss: 0.6362, test_loss: 0.7756, test_f1: 0.6515
 epoch: 35, train_loss: 0.6294, test_loss: 0.7726, test_f1: 0.6566
 epoch: 36, train_loss: 0.6128, test_loss: 0.7477, test_f1: 0.6357
 epoch: 37, train_loss: 0.6171, test_loss: 0.7573, test_f1: 0.6343
 epoch: 38, train_loss: 0.6171, test_loss: 0.8458, test_f1: 0.6201
 epoch: 39, train_loss: 0.6014, test_loss: 0.7307, test_f1: 0.6520
 epoch: 40, train_loss: 0.5910, test_loss: 0.7983, test_f1: 0.6394
 epoch: 41, train_loss: 0.6046, test_loss: 0.8402, test_f1: 0.6375
 epoch: 42, train_loss: 0.6035, test_loss: 0.7957, test_f1: 0.6430
 epoch: 43, train_loss: 0.5849, test_loss: 0.7883, test_f1: 0.6566
 epoch: 44, train_loss: 0.5712, test_loss: 0.7536, test_f1: 0.6503
 epoch: 45, train_loss: 0.5648, test_loss: 0.8340, test_f1: 0.6651
 epoch: 46, train_loss: 0.5627, test_loss: 0.8075, test_f1: 0.6518
 epoch: 47, train_loss: 0.5579, test_loss: 0.8843, test_f1: 0.6385
 epoch: 48, train_loss: 0.5575, test_loss: 0.8133, test_f1: 0.6727
 epoch: 49, train_loss: 0.5572, test_loss: 0.9125, test_f1: 0.6344
 epoch: 50, train_loss: 0.5432, test_loss: 0.8497, test_f1: 0.6460
 epoch: 51, train_loss: 0.5232, test_loss: 0.8660, test_f1: 0.6364
 epoch: 52, train_loss: 0.5147, test_loss: 0.8329, test_f1: 0.6399
 epoch: 53, train_loss: 0.5126, test_loss: 0.8756, test_f1: 0.6416
 epoch: 54, train_loss: 0.5065, test_loss: 0.8838, test_f1: 0.6544
 epoch: 55, train_loss: 0.5041, test_loss: 0.8901, test_f1: 0.6422
 epoch: 56, train_loss: 0.5100, test_loss: 0.9159, test_f1: 0.6305
 epoch: 57, train_loss: 0.5077, test_loss: 0.8180, test_f1: 0.6536
 epoch: 58, train_loss: 0.4965, test_loss: 0.8659, test_f1: 0.6603
 epoch: 59, train_loss: 0.4876, test_loss: 0.8850, test_f1: 0.6435
 epoch: 60, train_loss: 0.5008, test_loss: 0.8825, test_f1: 0.6408
 epoch: 61, train_loss: 0.4871, test_loss: 0.8888, test_f1: 0.6399
 epoch: 62, train_loss: 0.4896, test_loss: 0.8754, test_f1: 0.6545
 epoch: 63, train_loss: 0.4922, test_loss: 0.8779, test_f1: 0.6702
 epoch: 64, train_loss: 0.4819, test_loss: 0.9294, test_f1: 0.6486
 epoch: 65, train_loss: 0.4768, test_loss: 0.9031, test_f1: 0.6474
 epoch: 66, train_loss: 0.4743, test_loss: 0.9113, test_f1: 0.6388
 epoch: 67, train_loss: 0.4621, test_loss: 0.9416, test_f1: 0.6516
 epoch: 68, train_loss: 0.4687, test_loss: 0.8710, test_f1: 0.6660
 epoch: 69, train_loss: 0.4627, test_loss: 0.9325, test_f1: 0.6330
 epoch: 70, train_loss: 0.4729, test_loss: 0.9392, test_f1: 0.6409
 epoch: 71, train_loss: 0.4649, test_loss: 0.8715, test_f1: 0.6521
 epoch: 72, train_loss: 0.4700, test_loss: 0.9153, test_f1: 0.6415
 epoch: 73, train_loss: 0.4674, test_loss: 0.9221, test_f1: 0.6414
 epoch: 74, train_loss: 0.4490, test_loss: 0.9148, test_f1: 0.6376
 epoch: 75, train_loss: 0.4478, test_loss: 0.9469, test_f1: 0.6559
 epoch: 76, train_loss: 0.4394, test_loss: 0.9488, test_f1: 0.6605
 epoch: 77, train_loss: 0.4480, test_loss: 0.9605, test_f1: 0.6606
 epoch: 78, train_loss: 0.4435, test_loss: 0.9667, test_f1: 0.6645
 epoch: 79, train_loss: 0.4349, test_loss: 0.9876, test_f1: 0.6497
 epoch: 80, train_loss: 0.4382, test_loss: 0.9880, test_f1: 0.6514
 epoch: 81, train_loss: 0.4351, test_loss: 0.9266, test_f1: 0.6485
 epoch: 82, train_loss: 0.4357, test_loss: 0.9571, test_f1: 0.6627
 epoch: 83, train_loss: 0.4332, test_loss: 0.9944, test_f1: 0.6442
 epoch: 84, train_loss: 0.4328, test_loss: 0.9822, test_f1: 0.6647
 epoch: 85, train_loss: 0.4216, test_loss: 1.0275, test_f1: 0.6433
 epoch: 86, train_loss: 0.4148, test_loss: 0.9877, test_f1: 0.6495
 epoch: 87, train_loss: 0.4267, test_loss: 1.0070, test_f1: 0.6445
 epoch: 88, train_loss: 0.4166, test_loss: 0.9445, test_f1: 0.6646
 epoch: 89, train_loss: 0.4084, test_loss: 1.0293, test_f1: 0.6424
 epoch: 90, train_loss: 0.4210, test_loss: 1.0034, test_f1: 0.6557
 epoch: 91, train_loss: 0.4127, test_loss: 1.0361, test_f1: 0.6595
 epoch: 92, train_loss: 0.4043, test_loss: 1.0685, test_f1: 0.6450
 epoch: 93, train_loss: 0.4095, test_loss: 1.0055, test_f1: 0.6587
 epoch: 94, train_loss: 0.3977, test_loss: 0.9956, test_f1: 0.6582
 epoch: 95, train_loss: 0.4146, test_loss: 1.1211, test_f1: 0.6593
 epoch: 96, train_loss: 0.3857, test_loss: 1.0536, test_f1: 0.6588
 epoch: 97, train_loss: 0.3940, test_loss: 1.1108, test_f1: 0.6492
 epoch: 98, train_loss: 0.3984, test_loss: 1.0929, test_f1: 0.6630
 epoch: 99, train_loss: 0.3915, test_loss: 1.1017, test_f1: 0.6605
##################ITERATION #5 ****************************************
 epoch: 0, train_loss: 1.1404, test_loss: 0.9601, test_f1: 0.4842
 epoch: 1, train_loss: 1.0067, test_loss: 0.9305, test_f1: 0.5386
 epoch: 2, train_loss: 0.9757, test_loss: 0.9026, test_f1: 0.5235
 epoch: 3, train_loss: 0.9427, test_loss: 0.8874, test_f1: 0.5060
 epoch: 4, train_loss: 0.9283, test_loss: 0.8713, test_f1: 0.5026
 epoch: 5, train_loss: 0.9018, test_loss: 0.8743, test_f1: 0.5272
 epoch: 6, train_loss: 0.8819, test_loss: 0.8423, test_f1: 0.5306
 epoch: 7, train_loss: 0.8698, test_loss: 0.8219, test_f1: 0.5534
 epoch: 8, train_loss: 0.8609, test_loss: 0.8165, test_f1: 0.5342
 epoch: 9, train_loss: 0.8484, test_loss: 0.7864, test_f1: 0.6004
 epoch: 10, train_loss: 0.8201, test_loss: 0.7957, test_f1: 0.5894
 epoch: 11, train_loss: 0.8196, test_loss: 0.7817, test_f1: 0.5916
 epoch: 12, train_loss: 0.8069, test_loss: 0.7813, test_f1: 0.5938
 epoch: 13, train_loss: 0.8004, test_loss: 0.7709, test_f1: 0.5934
 epoch: 14, train_loss: 0.7922, test_loss: 0.7641, test_f1: 0.6065
 epoch: 15, train_loss: 0.7716, test_loss: 0.7610, test_f1: 0.6009
 epoch: 16, train_loss: 0.7656, test_loss: 0.7635, test_f1: 0.5960
 epoch: 17, train_loss: 0.7610, test_loss: 0.7701, test_f1: 0.6042
 epoch: 18, train_loss: 0.7600, test_loss: 0.7503, test_f1: 0.6056
 epoch: 19, train_loss: 0.7377, test_loss: 0.7404, test_f1: 0.6135
 epoch: 20, train_loss: 0.7322, test_loss: 0.7355, test_f1: 0.6377
 epoch: 21, train_loss: 0.7334, test_loss: 0.7319, test_f1: 0.6393
 epoch: 22, train_loss: 0.7269, test_loss: 0.7380, test_f1: 0.6109
 epoch: 23, train_loss: 0.7208, test_loss: 0.7285, test_f1: 0.6373
 epoch: 24, train_loss: 0.6979, test_loss: 0.7343, test_f1: 0.6470
 epoch: 25, train_loss: 0.6874, test_loss: 0.7426, test_f1: 0.6402
 epoch: 26, train_loss: 0.6906, test_loss: 0.7475, test_f1: 0.6314
 epoch: 27, train_loss: 0.6863, test_loss: 0.7691, test_f1: 0.5876
 epoch: 28, train_loss: 0.6668, test_loss: 0.7252, test_f1: 0.6669
 epoch: 29, train_loss: 0.6700, test_loss: 0.7279, test_f1: 0.6432
 epoch: 30, train_loss: 0.6562, test_loss: 0.7261, test_f1: 0.6838
 epoch: 31, train_loss: 0.6635, test_loss: 0.7515, test_f1: 0.6579
 epoch: 32, train_loss: 0.6498, test_loss: 0.7444, test_f1: 0.6478
 epoch: 33, train_loss: 0.6449, test_loss: 0.7334, test_f1: 0.6698
 epoch: 34, train_loss: 0.6301, test_loss: 0.7235, test_f1: 0.6553
 epoch: 35, train_loss: 0.6237, test_loss: 0.7550, test_f1: 0.6461
 epoch: 36, train_loss: 0.6170, test_loss: 0.7447, test_f1: 0.6498
 epoch: 37, train_loss: 0.6142, test_loss: 0.7324, test_f1: 0.6712
 epoch: 38, train_loss: 0.6152, test_loss: 0.7424, test_f1: 0.6803
 epoch: 39, train_loss: 0.6034, test_loss: 0.7424, test_f1: 0.6566
 epoch: 40, train_loss: 0.6128, test_loss: 0.7346, test_f1: 0.6461
 epoch: 41, train_loss: 0.5872, test_loss: 0.7472, test_f1: 0.6706
 epoch: 42, train_loss: 0.5819, test_loss: 0.7835, test_f1: 0.6620
 epoch: 43, train_loss: 0.5859, test_loss: 0.7365, test_f1: 0.6538
 epoch: 44, train_loss: 0.5784, test_loss: 0.8394, test_f1: 0.6308
 epoch: 45, train_loss: 0.5648, test_loss: 0.7962, test_f1: 0.6438
 epoch: 46, train_loss: 0.5675, test_loss: 0.8096, test_f1: 0.6331
 epoch: 47, train_loss: 0.5717, test_loss: 0.8152, test_f1: 0.6398
 epoch: 48, train_loss: 0.5616, test_loss: 0.7732, test_f1: 0.6282
 epoch: 49, train_loss: 0.5512, test_loss: 0.8048, test_f1: 0.6681
 epoch: 50, train_loss: 0.5426, test_loss: 0.8478, test_f1: 0.6490
 epoch: 51, train_loss: 0.5231, test_loss: 0.7835, test_f1: 0.6576
 epoch: 52, train_loss: 0.5279, test_loss: 0.8018, test_f1: 0.6544
 epoch: 53, train_loss: 0.5092, test_loss: 0.8200, test_f1: 0.6377
 epoch: 54, train_loss: 0.5071, test_loss: 0.8284, test_f1: 0.6483
 epoch: 55, train_loss: 0.5232, test_loss: 0.8275, test_f1: 0.6263
 epoch: 56, train_loss: 0.5072, test_loss: 0.8410, test_f1: 0.6356
 epoch: 57, train_loss: 0.5015, test_loss: 0.8242, test_f1: 0.6398
 epoch: 58, train_loss: 0.4950, test_loss: 0.8453, test_f1: 0.6467
 epoch: 59, train_loss: 0.5054, test_loss: 0.8101, test_f1: 0.6517
 epoch: 60, train_loss: 0.5017, test_loss: 0.8140, test_f1: 0.6638
 epoch: 61, train_loss: 0.4953, test_loss: 0.8709, test_f1: 0.6275
 epoch: 62, train_loss: 0.4816, test_loss: 0.8355, test_f1: 0.6258
 epoch: 63, train_loss: 0.4743, test_loss: 0.8577, test_f1: 0.6355
 epoch: 64, train_loss: 0.4931, test_loss: 0.9067, test_f1: 0.6363
 epoch: 65, train_loss: 0.4824, test_loss: 0.8714, test_f1: 0.6468
 epoch: 66, train_loss: 0.4789, test_loss: 0.8724, test_f1: 0.6272
 epoch: 67, train_loss: 0.4749, test_loss: 0.9475, test_f1: 0.6326
 epoch: 68, train_loss: 0.4947, test_loss: 0.8596, test_f1: 0.6658
 epoch: 69, train_loss: 0.4669, test_loss: 0.9271, test_f1: 0.6272
 epoch: 70, train_loss: 0.4558, test_loss: 0.8934, test_f1: 0.6410
 epoch: 71, train_loss: 0.4729, test_loss: 0.9254, test_f1: 0.6413
 epoch: 72, train_loss: 0.4672, test_loss: 0.9255, test_f1: 0.6421
 epoch: 73, train_loss: 0.4616, test_loss: 0.9259, test_f1: 0.6514
 epoch: 74, train_loss: 0.4476, test_loss: 0.9778, test_f1: 0.6404
 epoch: 75, train_loss: 0.4656, test_loss: 0.9761, test_f1: 0.6507
 epoch: 76, train_loss: 0.4619, test_loss: 1.0024, test_f1: 0.6265
 epoch: 77, train_loss: 0.4660, test_loss: 0.9975, test_f1: 0.6452
 epoch: 78, train_loss: 0.4487, test_loss: 0.9925, test_f1: 0.6465
 epoch: 79, train_loss: 0.4500, test_loss: 1.0205, test_f1: 0.6436
 epoch: 80, train_loss: 0.4488, test_loss: 0.9513, test_f1: 0.6383
 epoch: 81, train_loss: 0.4328, test_loss: 0.9802, test_f1: 0.6447
 epoch: 82, train_loss: 0.4312, test_loss: 1.0491, test_f1: 0.6476
 epoch: 83, train_loss: 0.4404, test_loss: 0.9775, test_f1: 0.6365
 epoch: 84, train_loss: 0.4237, test_loss: 0.9822, test_f1: 0.6416
 epoch: 85, train_loss: 0.4431, test_loss: 0.9964, test_f1: 0.6399
 epoch: 86, train_loss: 0.4206, test_loss: 1.0075, test_f1: 0.6484
 epoch: 87, train_loss: 0.4365, test_loss: 0.9637, test_f1: 0.6587
 epoch: 88, train_loss: 0.4229, test_loss: 0.9787, test_f1: 0.6555
 epoch: 89, train_loss: 0.4244, test_loss: 0.9958, test_f1: 0.6503
 epoch: 90, train_loss: 0.4269, test_loss: 1.0493, test_f1: 0.6369
 epoch: 91, train_loss: 0.4071, test_loss: 1.0446, test_f1: 0.6440
 epoch: 92, train_loss: 0.4141, test_loss: 1.0096, test_f1: 0.6495
 epoch: 93, train_loss: 0.4196, test_loss: 1.0829, test_f1: 0.6484
 epoch: 94, train_loss: 0.4145, test_loss: 1.0051, test_f1: 0.6375
 epoch: 95, train_loss: 0.4106, test_loss: 1.0368, test_f1: 0.6432
 epoch: 96, train_loss: 0.3933, test_loss: 1.0954, test_f1: 0.6501
 epoch: 97, train_loss: 0.4091, test_loss: 1.0818, test_f1: 0.6352
 epoch: 98, train_loss: 0.4098, test_loss: 1.0574, test_f1: 0.6517
 epoch: 99, train_loss: 0.4052, test_loss: 1.0246, test_f1: 0.6430
##################ITERATION #6 ****************************************
 epoch: 0, train_loss: 1.1997, test_loss: 0.9625, test_f1: 0.5018
 epoch: 1, train_loss: 1.0226, test_loss: 0.9363, test_f1: 0.5044
 epoch: 2, train_loss: 0.9893, test_loss: 0.9076, test_f1: 0.5050
 epoch: 3, train_loss: 0.9419, test_loss: 0.8962, test_f1: 0.5420
 epoch: 4, train_loss: 0.9291, test_loss: 0.9058, test_f1: 0.5052
 epoch: 5, train_loss: 0.9133, test_loss: 0.8572, test_f1: 0.5456
 epoch: 6, train_loss: 0.8878, test_loss: 0.8748, test_f1: 0.5551
 epoch: 7, train_loss: 0.8786, test_loss: 0.8424, test_f1: 0.5725
 epoch: 8, train_loss: 0.8805, test_loss: 0.8412, test_f1: 0.5708
 epoch: 9, train_loss: 0.8453, test_loss: 0.8412, test_f1: 0.5816
 epoch: 10, train_loss: 0.8435, test_loss: 0.8087, test_f1: 0.5979
 epoch: 11, train_loss: 0.8160, test_loss: 0.8041, test_f1: 0.5839
 epoch: 12, train_loss: 0.8045, test_loss: 0.8104, test_f1: 0.6345
 epoch: 13, train_loss: 0.8001, test_loss: 0.7980, test_f1: 0.5753
 epoch: 14, train_loss: 0.7818, test_loss: 0.7714, test_f1: 0.6271
 epoch: 15, train_loss: 0.7921, test_loss: 0.7864, test_f1: 0.5948
 epoch: 16, train_loss: 0.7732, test_loss: 0.7666, test_f1: 0.6214
 epoch: 17, train_loss: 0.7625, test_loss: 0.7598, test_f1: 0.6323
 epoch: 18, train_loss: 0.7523, test_loss: 0.7621, test_f1: 0.6116
 epoch: 19, train_loss: 0.7402, test_loss: 0.7388, test_f1: 0.6354
 epoch: 20, train_loss: 0.7362, test_loss: 0.7663, test_f1: 0.6239
 epoch: 21, train_loss: 0.7338, test_loss: 0.7786, test_f1: 0.5991
 epoch: 22, train_loss: 0.7252, test_loss: 0.7500, test_f1: 0.6327
 epoch: 23, train_loss: 0.7205, test_loss: 0.7489, test_f1: 0.6490
 epoch: 24, train_loss: 0.7016, test_loss: 0.7269, test_f1: 0.6605
 epoch: 25, train_loss: 0.6993, test_loss: 0.7315, test_f1: 0.6595
 epoch: 26, train_loss: 0.6832, test_loss: 0.7365, test_f1: 0.6569
 epoch: 27, train_loss: 0.6897, test_loss: 0.7403, test_f1: 0.6571
 epoch: 28, train_loss: 0.6707, test_loss: 0.7310, test_f1: 0.6574
 epoch: 29, train_loss: 0.6724, test_loss: 0.7626, test_f1: 0.6394
 epoch: 30, train_loss: 0.6625, test_loss: 0.7690, test_f1: 0.6496
 epoch: 31, train_loss: 0.6628, test_loss: 0.7661, test_f1: 0.6395
 epoch: 32, train_loss: 0.6536, test_loss: 0.7339, test_f1: 0.6588
 epoch: 33, train_loss: 0.6456, test_loss: 0.7455, test_f1: 0.6889
 epoch: 34, train_loss: 0.6505, test_loss: 0.7593, test_f1: 0.6696
 epoch: 35, train_loss: 0.6459, test_loss: 0.7925, test_f1: 0.6185
 epoch: 36, train_loss: 0.6295, test_loss: 0.7193, test_f1: 0.7044
 epoch: 37, train_loss: 0.6155, test_loss: 0.7327, test_f1: 0.6616
 epoch: 38, train_loss: 0.6124, test_loss: 0.7630, test_f1: 0.6444
 epoch: 39, train_loss: 0.6157, test_loss: 0.8111, test_f1: 0.6387
 epoch: 40, train_loss: 0.6061, test_loss: 0.7910, test_f1: 0.6603
 epoch: 41, train_loss: 0.6230, test_loss: 0.7678, test_f1: 0.6610
 epoch: 42, train_loss: 0.5984, test_loss: 0.7536, test_f1: 0.6760
 epoch: 43, train_loss: 0.5807, test_loss: 0.8122, test_f1: 0.6572
 epoch: 44, train_loss: 0.5768, test_loss: 0.8040, test_f1: 0.6593
 epoch: 45, train_loss: 0.5844, test_loss: 0.7892, test_f1: 0.6653
 epoch: 46, train_loss: 0.5776, test_loss: 0.8090, test_f1: 0.6464
 epoch: 47, train_loss: 0.5557, test_loss: 0.8049, test_f1: 0.6505
 epoch: 48, train_loss: 0.5633, test_loss: 0.8274, test_f1: 0.6463
 epoch: 49, train_loss: 0.5684, test_loss: 0.8359, test_f1: 0.6507
 epoch: 50, train_loss: 0.5553, test_loss: 0.8502, test_f1: 0.6322
 epoch: 51, train_loss: 0.5425, test_loss: 0.8241, test_f1: 0.6404
 epoch: 52, train_loss: 0.5228, test_loss: 0.8062, test_f1: 0.6578
 epoch: 53, train_loss: 0.5175, test_loss: 0.8035, test_f1: 0.6652
 epoch: 54, train_loss: 0.5260, test_loss: 0.8069, test_f1: 0.6574
 epoch: 55, train_loss: 0.5106, test_loss: 0.8359, test_f1: 0.6453
 epoch: 56, train_loss: 0.5093, test_loss: 0.8148, test_f1: 0.6605
 epoch: 57, train_loss: 0.5217, test_loss: 0.8695, test_f1: 0.6522
 epoch: 58, train_loss: 0.5027, test_loss: 0.8317, test_f1: 0.6670
 epoch: 59, train_loss: 0.4986, test_loss: 0.8485, test_f1: 0.6613
 epoch: 60, train_loss: 0.5082, test_loss: 0.8550, test_f1: 0.6588
 epoch: 61, train_loss: 0.4887, test_loss: 0.8799, test_f1: 0.6424
 epoch: 62, train_loss: 0.5037, test_loss: 0.8793, test_f1: 0.6565
 epoch: 63, train_loss: 0.5030, test_loss: 0.8314, test_f1: 0.6694
 epoch: 64, train_loss: 0.4961, test_loss: 0.8399, test_f1: 0.6558
 epoch: 65, train_loss: 0.4819, test_loss: 0.8561, test_f1: 0.6539
 epoch: 66, train_loss: 0.4842, test_loss: 0.8577, test_f1: 0.6643
 epoch: 67, train_loss: 0.4796, test_loss: 0.8670, test_f1: 0.6739
 epoch: 68, train_loss: 0.4756, test_loss: 0.9058, test_f1: 0.6497
 epoch: 69, train_loss: 0.4811, test_loss: 0.8626, test_f1: 0.6780
 epoch: 70, train_loss: 0.4749, test_loss: 0.8828, test_f1: 0.6629
 epoch: 71, train_loss: 0.4777, test_loss: 0.9127, test_f1: 0.6683
 epoch: 72, train_loss: 0.4713, test_loss: 0.9728, test_f1: 0.6427
 epoch: 73, train_loss: 0.4666, test_loss: 0.8781, test_f1: 0.6463
 epoch: 74, train_loss: 0.4710, test_loss: 0.8847, test_f1: 0.6685
 epoch: 75, train_loss: 0.4800, test_loss: 0.8999, test_f1: 0.6696
 epoch: 76, train_loss: 0.4601, test_loss: 0.9129, test_f1: 0.6537
 epoch: 77, train_loss: 0.4659, test_loss: 0.8862, test_f1: 0.6666
 epoch: 78, train_loss: 0.4587, test_loss: 0.9356, test_f1: 0.6584
 epoch: 79, train_loss: 0.4572, test_loss: 0.9451, test_f1: 0.6646
 epoch: 80, train_loss: 0.4573, test_loss: 0.9440, test_f1: 0.6564
 epoch: 81, train_loss: 0.4477, test_loss: 0.9558, test_f1: 0.6451
 epoch: 82, train_loss: 0.4427, test_loss: 0.9849, test_f1: 0.6590
 epoch: 83, train_loss: 0.4472, test_loss: 0.9835, test_f1: 0.6575
 epoch: 84, train_loss: 0.4424, test_loss: 1.0380, test_f1: 0.6399
 epoch: 85, train_loss: 0.4563, test_loss: 0.9467, test_f1: 0.6572
 epoch: 86, train_loss: 0.4314, test_loss: 0.9815, test_f1: 0.6498
 epoch: 87, train_loss: 0.4400, test_loss: 0.9925, test_f1: 0.6521
 epoch: 88, train_loss: 0.4370, test_loss: 1.0019, test_f1: 0.6356
 epoch: 89, train_loss: 0.4328, test_loss: 0.9785, test_f1: 0.6607
 epoch: 90, train_loss: 0.4168, test_loss: 0.9971, test_f1: 0.6580
 epoch: 91, train_loss: 0.4241, test_loss: 0.9999, test_f1: 0.6437
 epoch: 92, train_loss: 0.4208, test_loss: 1.0216, test_f1: 0.6510
 epoch: 93, train_loss: 0.4216, test_loss: 1.0280, test_f1: 0.6470
 epoch: 94, train_loss: 0.4133, test_loss: 1.0136, test_f1: 0.6592
 epoch: 95, train_loss: 0.4227, test_loss: 1.0531, test_f1: 0.6512
 epoch: 96, train_loss: 0.4176, test_loss: 1.0406, test_f1: 0.6350
 epoch: 97, train_loss: 0.3980, test_loss: 1.0842, test_f1: 0.6374
 epoch: 98, train_loss: 0.4012, test_loss: 1.0895, test_f1: 0.6499
 epoch: 99, train_loss: 0.4142, test_loss: 1.0947, test_f1: 0.6384
##################ITERATION #7 ****************************************
 epoch: 0, train_loss: 1.2134, test_loss: 0.9748, test_f1: 0.4843
 epoch: 1, train_loss: 1.0274, test_loss: 0.9301, test_f1: 0.5247
 epoch: 2, train_loss: 1.0003, test_loss: 0.9359, test_f1: 0.5097
 epoch: 3, train_loss: 0.9565, test_loss: 0.9159, test_f1: 0.5129
 epoch: 4, train_loss: 0.9341, test_loss: 0.9005, test_f1: 0.5597
 epoch: 5, train_loss: 0.9262, test_loss: 0.8729, test_f1: 0.5439
 epoch: 6, train_loss: 0.9087, test_loss: 0.8775, test_f1: 0.5465
 epoch: 7, train_loss: 0.8894, test_loss: 0.8533, test_f1: 0.5788
 epoch: 8, train_loss: 0.8627, test_loss: 0.8559, test_f1: 0.6123
 epoch: 9, train_loss: 0.8690, test_loss: 0.8658, test_f1: 0.5678
 epoch: 10, train_loss: 0.8495, test_loss: 0.8627, test_f1: 0.6090
 epoch: 11, train_loss: 0.8420, test_loss: 0.8538, test_f1: 0.5986
 epoch: 12, train_loss: 0.8205, test_loss: 0.8493, test_f1: 0.6159
 epoch: 13, train_loss: 0.8047, test_loss: 0.8313, test_f1: 0.5903
 epoch: 14, train_loss: 0.8048, test_loss: 0.8302, test_f1: 0.6083
 epoch: 15, train_loss: 0.8014, test_loss: 0.8842, test_f1: 0.5614
 epoch: 16, train_loss: 0.7904, test_loss: 0.8021, test_f1: 0.6137
 epoch: 17, train_loss: 0.7768, test_loss: 0.8592, test_f1: 0.6106
 epoch: 18, train_loss: 0.7747, test_loss: 0.8328, test_f1: 0.6280
 epoch: 19, train_loss: 0.7632, test_loss: 0.8712, test_f1: 0.6382
 epoch: 20, train_loss: 0.7395, test_loss: 0.8463, test_f1: 0.6284
 epoch: 21, train_loss: 0.7369, test_loss: 0.7916, test_f1: 0.6438
 epoch: 22, train_loss: 0.7451, test_loss: 0.8128, test_f1: 0.6383
 epoch: 23, train_loss: 0.7296, test_loss: 0.8220, test_f1: 0.6225
 epoch: 24, train_loss: 0.7120, test_loss: 0.8243, test_f1: 0.6641
 epoch: 25, train_loss: 0.7152, test_loss: 0.8147, test_f1: 0.6253
 epoch: 26, train_loss: 0.7060, test_loss: 0.8403, test_f1: 0.6446
 epoch: 27, train_loss: 0.6896, test_loss: 0.8230, test_f1: 0.6504
 epoch: 28, train_loss: 0.6989, test_loss: 0.8487, test_f1: 0.6497
 epoch: 29, train_loss: 0.6886, test_loss: 0.8419, test_f1: 0.6282
 epoch: 30, train_loss: 0.6869, test_loss: 0.8685, test_f1: 0.6202
 epoch: 31, train_loss: 0.6700, test_loss: 0.8425, test_f1: 0.6230
 epoch: 32, train_loss: 0.6591, test_loss: 0.8386, test_f1: 0.6440
 epoch: 33, train_loss: 0.6700, test_loss: 0.8392, test_f1: 0.6211
 epoch: 34, train_loss: 0.6493, test_loss: 0.8328, test_f1: 0.6364
 epoch: 35, train_loss: 0.6443, test_loss: 0.8130, test_f1: 0.6333
 epoch: 36, train_loss: 0.6448, test_loss: 0.8310, test_f1: 0.6373
 epoch: 37, train_loss: 0.6272, test_loss: 0.9029, test_f1: 0.6302
 epoch: 38, train_loss: 0.6322, test_loss: 0.8040, test_f1: 0.6641
 epoch: 39, train_loss: 0.6326, test_loss: 0.8118, test_f1: 0.6454
 epoch: 40, train_loss: 0.6114, test_loss: 0.8416, test_f1: 0.6359
 epoch: 41, train_loss: 0.6230, test_loss: 0.8791, test_f1: 0.6243
 epoch: 42, train_loss: 0.6149, test_loss: 0.8675, test_f1: 0.6359
 epoch: 43, train_loss: 0.5973, test_loss: 0.7885, test_f1: 0.6511
 epoch: 44, train_loss: 0.6138, test_loss: 0.8327, test_f1: 0.6369
 epoch: 45, train_loss: 0.6082, test_loss: 0.8752, test_f1: 0.6471
 epoch: 46, train_loss: 0.5995, test_loss: 0.8754, test_f1: 0.6428
 epoch: 47, train_loss: 0.5997, test_loss: 0.8713, test_f1: 0.6709
 epoch: 48, train_loss: 0.5889, test_loss: 0.8330, test_f1: 0.6656
 epoch: 49, train_loss: 0.5741, test_loss: 0.8761, test_f1: 0.6815
 epoch: 50, train_loss: 0.5784, test_loss: 0.8588, test_f1: 0.6522
 epoch: 51, train_loss: 0.5649, test_loss: 0.8609, test_f1: 0.6576
 epoch: 52, train_loss: 0.5465, test_loss: 0.8748, test_f1: 0.6625
 epoch: 53, train_loss: 0.5427, test_loss: 0.8530, test_f1: 0.6446
 epoch: 54, train_loss: 0.5288, test_loss: 0.8981, test_f1: 0.6375
 epoch: 55, train_loss: 0.5295, test_loss: 0.9067, test_f1: 0.6621
 epoch: 56, train_loss: 0.5316, test_loss: 0.8950, test_f1: 0.6543
 epoch: 57, train_loss: 0.5294, test_loss: 0.8733, test_f1: 0.6565
 epoch: 58, train_loss: 0.5287, test_loss: 0.8987, test_f1: 0.6409
 epoch: 59, train_loss: 0.5108, test_loss: 0.9252, test_f1: 0.6375
 epoch: 60, train_loss: 0.5210, test_loss: 0.8868, test_f1: 0.6329
 epoch: 61, train_loss: 0.5391, test_loss: 0.8938, test_f1: 0.6496
 epoch: 62, train_loss: 0.5138, test_loss: 0.8936, test_f1: 0.6475
 epoch: 63, train_loss: 0.5055, test_loss: 0.8705, test_f1: 0.6682
 epoch: 64, train_loss: 0.4966, test_loss: 0.9330, test_f1: 0.6485
 epoch: 65, train_loss: 0.5097, test_loss: 0.9310, test_f1: 0.6510
 epoch: 66, train_loss: 0.5002, test_loss: 0.9393, test_f1: 0.6318
 epoch: 67, train_loss: 0.5162, test_loss: 0.9274, test_f1: 0.6302
 epoch: 68, train_loss: 0.4979, test_loss: 0.9567, test_f1: 0.6412
 epoch: 69, train_loss: 0.4989, test_loss: 0.9843, test_f1: 0.6623
 epoch: 70, train_loss: 0.4987, test_loss: 0.9564, test_f1: 0.6565
 epoch: 71, train_loss: 0.4903, test_loss: 0.9332, test_f1: 0.6591
 epoch: 72, train_loss: 0.4909, test_loss: 0.9970, test_f1: 0.6427
 epoch: 73, train_loss: 0.4878, test_loss: 0.9831, test_f1: 0.6418
 epoch: 74, train_loss: 0.4771, test_loss: 0.9717, test_f1: 0.6597
 epoch: 75, train_loss: 0.4983, test_loss: 0.9720, test_f1: 0.6439
 epoch: 76, train_loss: 0.4714, test_loss: 1.0225, test_f1: 0.6442
 epoch: 77, train_loss: 0.4787, test_loss: 0.9500, test_f1: 0.6635
 epoch: 78, train_loss: 0.4693, test_loss: 0.9650, test_f1: 0.6566
 epoch: 79, train_loss: 0.4667, test_loss: 0.9935, test_f1: 0.6552
 epoch: 80, train_loss: 0.4682, test_loss: 0.9391, test_f1: 0.6605
 epoch: 81, train_loss: 0.4727, test_loss: 0.9848, test_f1: 0.6433
 epoch: 82, train_loss: 0.4609, test_loss: 0.9659, test_f1: 0.6532
 epoch: 83, train_loss: 0.4609, test_loss: 1.0253, test_f1: 0.6390
 epoch: 84, train_loss: 0.4641, test_loss: 0.9905, test_f1: 0.6452
 epoch: 85, train_loss: 0.4569, test_loss: 1.0009, test_f1: 0.6621
 epoch: 86, train_loss: 0.4656, test_loss: 1.0450, test_f1: 0.6561
 epoch: 87, train_loss: 0.4588, test_loss: 0.9932, test_f1: 0.6498
 epoch: 88, train_loss: 0.4522, test_loss: 1.0110, test_f1: 0.6495
 epoch: 89, train_loss: 0.4441, test_loss: 1.0443, test_f1: 0.6448
 epoch: 90, train_loss: 0.4378, test_loss: 1.0530, test_f1: 0.6418
 epoch: 91, train_loss: 0.4401, test_loss: 1.0283, test_f1: 0.6505
 epoch: 92, train_loss: 0.4374, test_loss: 1.0745, test_f1: 0.6471
 epoch: 93, train_loss: 0.4235, test_loss: 1.0804, test_f1: 0.6391
 epoch: 94, train_loss: 0.4326, test_loss: 1.0799, test_f1: 0.6483
 epoch: 95, train_loss: 0.4374, test_loss: 1.0949, test_f1: 0.6421
 epoch: 96, train_loss: 0.4276, test_loss: 1.0983, test_f1: 0.6639
 epoch: 97, train_loss: 0.4296, test_loss: 1.1160, test_f1: 0.6418
 epoch: 98, train_loss: 0.4279, test_loss: 1.1155, test_f1: 0.6435
 epoch: 99, train_loss: 0.4202, test_loss: 1.1128, test_f1: 0.6506
##################ITERATION #8 ****************************************
 epoch: 0, train_loss: 1.2207, test_loss: 1.0116, test_f1: 0.4962
 epoch: 1, train_loss: 1.0493, test_loss: 0.9627, test_f1: 0.5378
 epoch: 2, train_loss: 0.9992, test_loss: 0.9359, test_f1: 0.5348
 epoch: 3, train_loss: 0.9760, test_loss: 0.9445, test_f1: 0.5261
 epoch: 4, train_loss: 0.9555, test_loss: 0.9120, test_f1: 0.5646
 epoch: 5, train_loss: 0.9015, test_loss: 0.8905, test_f1: 0.5467
 epoch: 6, train_loss: 0.8951, test_loss: 0.8711, test_f1: 0.5770
 epoch: 7, train_loss: 0.8931, test_loss: 0.8596, test_f1: 0.5832
 epoch: 8, train_loss: 0.8725, test_loss: 0.8659, test_f1: 0.5761
 epoch: 9, train_loss: 0.8537, test_loss: 0.8594, test_f1: 0.5627
 epoch: 10, train_loss: 0.8460, test_loss: 0.8375, test_f1: 0.5737
 epoch: 11, train_loss: 0.8315, test_loss: 0.8301, test_f1: 0.5715
 epoch: 12, train_loss: 0.8125, test_loss: 0.8028, test_f1: 0.5955
 epoch: 13, train_loss: 0.8081, test_loss: 0.8213, test_f1: 0.5839
 epoch: 14, train_loss: 0.7944, test_loss: 0.8182, test_f1: 0.5945
 epoch: 15, train_loss: 0.7764, test_loss: 0.7753, test_f1: 0.5985
 epoch: 16, train_loss: 0.7898, test_loss: 0.7872, test_f1: 0.6180
 epoch: 17, train_loss: 0.7525, test_loss: 0.8079, test_f1: 0.5991
 epoch: 18, train_loss: 0.7534, test_loss: 0.7509, test_f1: 0.5993
 epoch: 19, train_loss: 0.7370, test_loss: 0.7562, test_f1: 0.6231
 epoch: 20, train_loss: 0.7358, test_loss: 0.7799, test_f1: 0.5856
 epoch: 21, train_loss: 0.7380, test_loss: 0.8016, test_f1: 0.6027
 epoch: 22, train_loss: 0.7299, test_loss: 0.7897, test_f1: 0.6448
 epoch: 23, train_loss: 0.7196, test_loss: 0.7650, test_f1: 0.5981
 epoch: 24, train_loss: 0.7096, test_loss: 0.7400, test_f1: 0.6493
 epoch: 25, train_loss: 0.6978, test_loss: 0.7538, test_f1: 0.6457
 epoch: 26, train_loss: 0.6907, test_loss: 0.7855, test_f1: 0.6468
 epoch: 27, train_loss: 0.6811, test_loss: 0.7516, test_f1: 0.6569
 epoch: 28, train_loss: 0.6646, test_loss: 0.7984, test_f1: 0.6588
 epoch: 29, train_loss: 0.6630, test_loss: 0.7542, test_f1: 0.6341
 epoch: 30, train_loss: 0.6659, test_loss: 0.7469, test_f1: 0.6574
 epoch: 31, train_loss: 0.6582, test_loss: 0.7667, test_f1: 0.6476
 epoch: 32, train_loss: 0.6562, test_loss: 0.7380, test_f1: 0.6470
 epoch: 33, train_loss: 0.6497, test_loss: 0.7648, test_f1: 0.6534
 epoch: 34, train_loss: 0.6360, test_loss: 0.7287, test_f1: 0.6524
 epoch: 35, train_loss: 0.6411, test_loss: 0.7552, test_f1: 0.6527
 epoch: 36, train_loss: 0.6294, test_loss: 0.7237, test_f1: 0.6446
 epoch: 37, train_loss: 0.6203, test_loss: 0.7419, test_f1: 0.6469
 epoch: 38, train_loss: 0.6292, test_loss: 0.7777, test_f1: 0.6388
 epoch: 39, train_loss: 0.6031, test_loss: 0.7422, test_f1: 0.6614
 epoch: 40, train_loss: 0.6003, test_loss: 0.7861, test_f1: 0.6492
 epoch: 41, train_loss: 0.5890, test_loss: 0.7766, test_f1: 0.6430
 epoch: 42, train_loss: 0.5856, test_loss: 0.7548, test_f1: 0.6691
 epoch: 43, train_loss: 0.5905, test_loss: 0.8059, test_f1: 0.6437
 epoch: 44, train_loss: 0.5732, test_loss: 0.7752, test_f1: 0.6429
 epoch: 45, train_loss: 0.5814, test_loss: 0.7803, test_f1: 0.6405
 epoch: 46, train_loss: 0.5733, test_loss: 0.7987, test_f1: 0.6408
 epoch: 47, train_loss: 0.5744, test_loss: 0.8041, test_f1: 0.6474
 epoch: 48, train_loss: 0.5481, test_loss: 0.8335, test_f1: 0.6286
 epoch: 49, train_loss: 0.5590, test_loss: 0.8412, test_f1: 0.6446
 epoch: 50, train_loss: 0.5570, test_loss: 0.8749, test_f1: 0.6329
 epoch: 51, train_loss: 0.5445, test_loss: 0.8746, test_f1: 0.6489
 epoch: 52, train_loss: 0.5250, test_loss: 0.8890, test_f1: 0.6560
 epoch: 53, train_loss: 0.5163, test_loss: 0.8382, test_f1: 0.6563
 epoch: 54, train_loss: 0.5150, test_loss: 0.8193, test_f1: 0.6661
 epoch: 55, train_loss: 0.5274, test_loss: 0.8727, test_f1: 0.6476
 epoch: 56, train_loss: 0.5088, test_loss: 0.8461, test_f1: 0.6612
 epoch: 57, train_loss: 0.5030, test_loss: 0.8693, test_f1: 0.6424
 epoch: 58, train_loss: 0.5154, test_loss: 0.8718, test_f1: 0.6438
 epoch: 59, train_loss: 0.5016, test_loss: 0.8678, test_f1: 0.6592
 epoch: 60, train_loss: 0.4857, test_loss: 0.8692, test_f1: 0.6448
 epoch: 61, train_loss: 0.4971, test_loss: 0.8430, test_f1: 0.6491
 epoch: 62, train_loss: 0.5031, test_loss: 0.8782, test_f1: 0.6561
 epoch: 63, train_loss: 0.4800, test_loss: 0.8597, test_f1: 0.6452
 epoch: 64, train_loss: 0.4916, test_loss: 0.9631, test_f1: 0.6408
 epoch: 65, train_loss: 0.4874, test_loss: 0.9216, test_f1: 0.6526
 epoch: 66, train_loss: 0.4806, test_loss: 0.9668, test_f1: 0.6622
 epoch: 67, train_loss: 0.4695, test_loss: 0.8922, test_f1: 0.6507
 epoch: 68, train_loss: 0.4600, test_loss: 0.9268, test_f1: 0.6638
 epoch: 69, train_loss: 0.4712, test_loss: 0.9652, test_f1: 0.6549
 epoch: 70, train_loss: 0.4801, test_loss: 0.9693, test_f1: 0.6412
 epoch: 71, train_loss: 0.4668, test_loss: 0.9799, test_f1: 0.6433
 epoch: 72, train_loss: 0.4538, test_loss: 0.9688, test_f1: 0.6547
 epoch: 73, train_loss: 0.4555, test_loss: 0.9950, test_f1: 0.6434
 epoch: 74, train_loss: 0.4605, test_loss: 0.9902, test_f1: 0.6470
 epoch: 75, train_loss: 0.4632, test_loss: 0.9719, test_f1: 0.6523
 epoch: 76, train_loss: 0.4584, test_loss: 0.9848, test_f1: 0.6460
 epoch: 77, train_loss: 0.4394, test_loss: 0.9980, test_f1: 0.6463
 epoch: 78, train_loss: 0.4504, test_loss: 1.0107, test_f1: 0.6551
 epoch: 79, train_loss: 0.4263, test_loss: 1.0084, test_f1: 0.6485
 epoch: 80, train_loss: 0.4415, test_loss: 1.0295, test_f1: 0.6374
 epoch: 81, train_loss: 0.4471, test_loss: 0.9713, test_f1: 0.6597
 epoch: 82, train_loss: 0.4389, test_loss: 1.0386, test_f1: 0.6594
 epoch: 83, train_loss: 0.4394, test_loss: 1.0136, test_f1: 0.6534
 epoch: 84, train_loss: 0.4381, test_loss: 1.0187, test_f1: 0.6475
 epoch: 85, train_loss: 0.4247, test_loss: 1.0334, test_f1: 0.6492
 epoch: 86, train_loss: 0.4214, test_loss: 1.0503, test_f1: 0.6516
 epoch: 87, train_loss: 0.4266, test_loss: 1.0981, test_f1: 0.6518
 epoch: 88, train_loss: 0.4153, test_loss: 1.1811, test_f1: 0.6558
 epoch: 89, train_loss: 0.4104, test_loss: 1.0592, test_f1: 0.6434
 epoch: 90, train_loss: 0.4171, test_loss: 1.0663, test_f1: 0.6542
 epoch: 91, train_loss: 0.4295, test_loss: 1.1088, test_f1: 0.6442
 epoch: 92, train_loss: 0.4183, test_loss: 1.1266, test_f1: 0.6422
 epoch: 93, train_loss: 0.4064, test_loss: 1.1037, test_f1: 0.6486
 epoch: 94, train_loss: 0.4094, test_loss: 1.0720, test_f1: 0.6352
 epoch: 95, train_loss: 0.4101, test_loss: 1.1157, test_f1: 0.6478
 epoch: 96, train_loss: 0.3977, test_loss: 1.1242, test_f1: 0.6516
 epoch: 97, train_loss: 0.3961, test_loss: 1.1300, test_f1: 0.6478
 epoch: 98, train_loss: 0.3967, test_loss: 1.1646, test_f1: 0.6547
 epoch: 99, train_loss: 0.3926, test_loss: 1.1805, test_f1: 0.6532
##################ITERATION #9 ****************************************
 epoch: 0, train_loss: 1.2097, test_loss: 1.0178, test_f1: 0.4759
 epoch: 1, train_loss: 1.0403, test_loss: 0.9952, test_f1: 0.5194
 epoch: 2, train_loss: 0.9958, test_loss: 0.9667, test_f1: 0.5196
 epoch: 3, train_loss: 0.9519, test_loss: 0.9335, test_f1: 0.5326
 epoch: 4, train_loss: 0.9423, test_loss: 0.9043, test_f1: 0.5701
 epoch: 5, train_loss: 0.9203, test_loss: 0.9068, test_f1: 0.5599
 epoch: 6, train_loss: 0.9103, test_loss: 0.9151, test_f1: 0.5615
 epoch: 7, train_loss: 0.8997, test_loss: 0.8756, test_f1: 0.5513
 epoch: 8, train_loss: 0.8637, test_loss: 0.8577, test_f1: 0.5588
 epoch: 9, train_loss: 0.8796, test_loss: 0.8727, test_f1: 0.5815
 epoch: 10, train_loss: 0.8442, test_loss: 0.8267, test_f1: 0.6025
 epoch: 11, train_loss: 0.8371, test_loss: 0.8594, test_f1: 0.6172
 epoch: 12, train_loss: 0.8187, test_loss: 0.8491, test_f1: 0.6245
 epoch: 13, train_loss: 0.8248, test_loss: 0.8013, test_f1: 0.5775
 epoch: 14, train_loss: 0.8118, test_loss: 0.8116, test_f1: 0.5941
 epoch: 15, train_loss: 0.7965, test_loss: 0.8306, test_f1: 0.5754
 epoch: 16, train_loss: 0.7869, test_loss: 0.8261, test_f1: 0.6216
 epoch: 17, train_loss: 0.7771, test_loss: 0.7803, test_f1: 0.6742
 epoch: 18, train_loss: 0.7677, test_loss: 0.7694, test_f1: 0.6665
 epoch: 19, train_loss: 0.7540, test_loss: 0.8008, test_f1: 0.6387
 epoch: 20, train_loss: 0.7560, test_loss: 0.7693, test_f1: 0.6231
 epoch: 21, train_loss: 0.7360, test_loss: 0.7348, test_f1: 0.6187
 epoch: 22, train_loss: 0.7407, test_loss: 0.7238, test_f1: 0.6477
 epoch: 23, train_loss: 0.7315, test_loss: 0.7427, test_f1: 0.6574
 epoch: 24, train_loss: 0.7175, test_loss: 0.7423, test_f1: 0.6785
 epoch: 25, train_loss: 0.7187, test_loss: 0.7196, test_f1: 0.6621
 epoch: 26, train_loss: 0.7043, test_loss: 0.7691, test_f1: 0.6411
 epoch: 27, train_loss: 0.7160, test_loss: 0.7413, test_f1: 0.6418
 epoch: 28, train_loss: 0.6920, test_loss: 0.7260, test_f1: 0.6647
 epoch: 29, train_loss: 0.6802, test_loss: 0.7274, test_f1: 0.6672
 epoch: 30, train_loss: 0.6926, test_loss: 0.7285, test_f1: 0.6780
 epoch: 31, train_loss: 0.6792, test_loss: 0.7762, test_f1: 0.6757
 epoch: 32, train_loss: 0.6732, test_loss: 0.7368, test_f1: 0.6619
 epoch: 33, train_loss: 0.6811, test_loss: 0.7130, test_f1: 0.6681
 epoch: 34, train_loss: 0.6410, test_loss: 0.7233, test_f1: 0.6897
 epoch: 35, train_loss: 0.6397, test_loss: 0.7576, test_f1: 0.6873
 epoch: 36, train_loss: 0.6508, test_loss: 0.7557, test_f1: 0.6432
 epoch: 37, train_loss: 0.6396, test_loss: 0.7859, test_f1: 0.6513
 epoch: 38, train_loss: 0.6354, test_loss: 0.7169, test_f1: 0.6647
 epoch: 39, train_loss: 0.6397, test_loss: 0.7531, test_f1: 0.6374
 epoch: 40, train_loss: 0.6211, test_loss: 0.7127, test_f1: 0.6424
 epoch: 41, train_loss: 0.6115, test_loss: 0.7196, test_f1: 0.6495
 epoch: 42, train_loss: 0.6059, test_loss: 0.7843, test_f1: 0.6542
 epoch: 43, train_loss: 0.6120, test_loss: 0.7710, test_f1: 0.6508
 epoch: 44, train_loss: 0.6186, test_loss: 0.7108, test_f1: 0.6873
 epoch: 45, train_loss: 0.6137, test_loss: 0.7417, test_f1: 0.6258
 epoch: 46, train_loss: 0.5894, test_loss: 0.8503, test_f1: 0.6392
 epoch: 47, train_loss: 0.5883, test_loss: 0.7591, test_f1: 0.6550
 epoch: 48, train_loss: 0.5878, test_loss: 0.7860, test_f1: 0.6664
 epoch: 49, train_loss: 0.5729, test_loss: 0.7626, test_f1: 0.6407
 epoch: 50, train_loss: 0.5584, test_loss: 0.7719, test_f1: 0.6428
 epoch: 51, train_loss: 0.5467, test_loss: 0.7496, test_f1: 0.6618
 epoch: 52, train_loss: 0.5455, test_loss: 0.7514, test_f1: 0.6718
 epoch: 53, train_loss: 0.5437, test_loss: 0.7157, test_f1: 0.6619
 epoch: 54, train_loss: 0.5350, test_loss: 0.7210, test_f1: 0.6661
 epoch: 55, train_loss: 0.5341, test_loss: 0.7730, test_f1: 0.6464
 epoch: 56, train_loss: 0.5332, test_loss: 0.7615, test_f1: 0.6598
 epoch: 57, train_loss: 0.5365, test_loss: 0.7954, test_f1: 0.6595
 epoch: 58, train_loss: 0.5294, test_loss: 0.7591, test_f1: 0.6613
 epoch: 59, train_loss: 0.5267, test_loss: 0.8258, test_f1: 0.6564
 epoch: 60, train_loss: 0.5247, test_loss: 0.7931, test_f1: 0.6617
 epoch: 61, train_loss: 0.5131, test_loss: 0.8374, test_f1: 0.6412
 epoch: 62, train_loss: 0.5160, test_loss: 0.7841, test_f1: 0.6488
 epoch: 63, train_loss: 0.5004, test_loss: 0.7764, test_f1: 0.6480
 epoch: 64, train_loss: 0.5167, test_loss: 0.7979, test_f1: 0.6508
 epoch: 65, train_loss: 0.5055, test_loss: 0.8106, test_f1: 0.6586
 epoch: 66, train_loss: 0.4971, test_loss: 0.7762, test_f1: 0.6971
 epoch: 67, train_loss: 0.5133, test_loss: 0.7585, test_f1: 0.6675
 epoch: 68, train_loss: 0.4822, test_loss: 0.7999, test_f1: 0.6694
 epoch: 69, train_loss: 0.4974, test_loss: 0.7915, test_f1: 0.6576
 epoch: 70, train_loss: 0.4846, test_loss: 0.8619, test_f1: 0.6863
 epoch: 71, train_loss: 0.4647, test_loss: 0.7916, test_f1: 0.6666
 epoch: 72, train_loss: 0.4979, test_loss: 0.8554, test_f1: 0.6568
 epoch: 73, train_loss: 0.4830, test_loss: 0.7989, test_f1: 0.6731
 epoch: 74, train_loss: 0.4733, test_loss: 0.8200, test_f1: 0.6688
 epoch: 75, train_loss: 0.4753, test_loss: 0.8147, test_f1: 0.6737
 epoch: 76, train_loss: 0.4664, test_loss: 0.8310, test_f1: 0.6470
 epoch: 77, train_loss: 0.4767, test_loss: 0.8882, test_f1: 0.6477
 epoch: 78, train_loss: 0.4629, test_loss: 0.8557, test_f1: 0.6581
 epoch: 79, train_loss: 0.4658, test_loss: 0.8586, test_f1: 0.6780
 epoch: 80, train_loss: 0.4701, test_loss: 0.9010, test_f1: 0.6685
 epoch: 81, train_loss: 0.4711, test_loss: 0.8668, test_f1: 0.6657
 epoch: 82, train_loss: 0.4558, test_loss: 0.9027, test_f1: 0.6770
 epoch: 83, train_loss: 0.4588, test_loss: 0.9467, test_f1: 0.6855
 epoch: 84, train_loss: 0.4616, test_loss: 0.9237, test_f1: 0.6713
 epoch: 85, train_loss: 0.4554, test_loss: 0.9419, test_f1: 0.6652
 epoch: 86, train_loss: 0.4450, test_loss: 0.9492, test_f1: 0.6532
 epoch: 87, train_loss: 0.4487, test_loss: 0.9737, test_f1: 0.6823
 epoch: 88, train_loss: 0.4566, test_loss: 0.9521, test_f1: 0.6601
 epoch: 89, train_loss: 0.4368, test_loss: 0.9232, test_f1: 0.6677
 epoch: 90, train_loss: 0.4416, test_loss: 0.9371, test_f1: 0.6512
 epoch: 91, train_loss: 0.4341, test_loss: 0.9413, test_f1: 0.6861
 epoch: 92, train_loss: 0.4290, test_loss: 0.9627, test_f1: 0.6645
 epoch: 93, train_loss: 0.4348, test_loss: 1.0390, test_f1: 0.6683
 epoch: 94, train_loss: 0.4346, test_loss: 0.9376, test_f1: 0.6730
 epoch: 95, train_loss: 0.4258, test_loss: 0.9582, test_f1: 0.6744
 epoch: 96, train_loss: 0.4307, test_loss: 1.0524, test_f1: 0.6650
 epoch: 97, train_loss: 0.4233, test_loss: 1.0239, test_f1: 0.6613
 epoch: 98, train_loss: 0.4204, test_loss: 0.9716, test_f1: 0.6709
 epoch: 99, train_loss: 0.4197, test_loss: 1.0128, test_f1: 0.6763

Training completed in 969.00 seconds
Best F1: 0.7044 at epoch 36
Mean F1 across iterations: 0.6811  0.0148
========================FINAL RESULTS================================
FEGIN weighted F1: 0.7044  0.0148
python main.py --data ltspice_examples --representation component_pin_net --model FEGIN --layers 3 --hiddens 128 --batch_size 32 --lr 0.0001 --emb_size 128 --epochs 100 --save_appendix component_pin_net_L3_H128_BS32_LR0.0001_E128 --no_val
-----



STDERR:
  File "main.py", line 370, in <module>
    main()
  File "main.py", line 254, in main
    dataset = dataset_class(
  File "/home/philip/projects/ltspice_examples_code_repo/Circuit-Completion-Using-GNNs/component_classification_with_link_prediction_head/evaluation/FEGIN/kernel/circuit_datasets.py", line 15, in __init__
    self.data, self.slices = torch.load(self.processed_paths[0])
  File "/home/philip/.local/lib/python3.8/site-packages/torch/serialization.py", line 1040, in load
    warnings.warn(
  File "/usr/lib/python3.8/warnings.py", line 109, in _showwarnmsg
    sw(msg.message, msg.category, msg.filename, msg.lineno,
  File "main.py", line 47, in warn_with_traceback
    traceback.print_stack(file=log)
/home/philip/projects/ltspice_examples_code_repo/Circuit-Completion-Using-GNNs/component_classification_with_link_prediction_head/evaluation/FEGIN/kernel/circuit_datasets.py:15: FutureWarning: You are using `torch.load` with `weights_only=False` (the current default value), which uses the default pickle module implicitly. It is possible to construct malicious pickle data which will execute arbitrary code during unpickling (See https://github.com/pytorch/pytorch/blob/main/SECURITY.md#untrusted-models for more details). In a future release, the default value for `weights_only` will be flipped to `True`. This limits the functions that could be executed during unpickling. Arbitrary objects will no longer be allowed to be loaded via this mode unless they are explicitly allowlisted by the user via `torch.serialization.add_safe_globals`. We recommend you start setting `weights_only=True` for any use case where you don't have full control of the loaded file. Please open an issue on GitHub for any issues related to this experimental feature.
  self.data, self.slices = torch.load(self.processed_paths[0])
