STDOUT:
Results will be saved in /home/philip/projects/ltspice_examples_code_repo/Circuit-Completion-Using-GNNs/component_classification_with_link_prediction_head/evaluation/FEGIN/results/model_FEGIN_dataset_ltspice_demos
Command line input: python main.py --data ltspice_demos --representation component_component --model FEGIN --layers 2 --hiddens 128 --batch_size 256 --lr 0.0001 --emb_size 128 --epochs 100 --save_appendix component_component_L2_H128_BS256_LR0.0001_E128 --no_val
 is saved.
-----
ltspice_demos - FEGIN
Using 2 layers, 128 hidden units, h = 2
Loading component_component representation dataset
ENTERED
Training FEGIN on component_component representation
Train: 1565, Test: 383
##################ITERATION #0 ****************************************
 epoch: 0, train_loss: 1.3788, test_loss: 1.3778, test_f1: 0.2281
 epoch: 1, train_loss: 1.3667, test_loss: 1.3746, test_f1: 0.2281
 epoch: 2, train_loss: 1.3594, test_loss: 1.3705, test_f1: 0.2281
 epoch: 3, train_loss: 1.3531, test_loss: 1.3655, test_f1: 0.2281
 epoch: 4, train_loss: 1.3455, test_loss: 1.3593, test_f1: 0.2281
 epoch: 5, train_loss: 1.3383, test_loss: 1.3522, test_f1: 0.2281
 epoch: 6, train_loss: 1.3299, test_loss: 1.3442, test_f1: 0.2281
 epoch: 7, train_loss: 1.3206, test_loss: 1.3352, test_f1: 0.2281
 epoch: 8, train_loss: 1.3115, test_loss: 1.3266, test_f1: 0.2281
 epoch: 9, train_loss: 1.3014, test_loss: 1.3176, test_f1: 0.2281
 epoch: 10, train_loss: 1.2893, test_loss: 1.3090, test_f1: 0.2281
 epoch: 11, train_loss: 1.2786, test_loss: 1.3017, test_f1: 0.2281
 epoch: 12, train_loss: 1.2645, test_loss: 1.2945, test_f1: 0.2281
 epoch: 13, train_loss: 1.2546, test_loss: 1.2878, test_f1: 0.2281
 epoch: 14, train_loss: 1.2412, test_loss: 1.2821, test_f1: 0.2281
 epoch: 15, train_loss: 1.2295, test_loss: 1.2762, test_f1: 0.2281
 epoch: 16, train_loss: 1.2204, test_loss: 1.2709, test_f1: 0.2281
 epoch: 17, train_loss: 1.2111, test_loss: 1.2661, test_f1: 0.2281
 epoch: 18, train_loss: 1.2037, test_loss: 1.2640, test_f1: 0.2281
 epoch: 19, train_loss: 1.1954, test_loss: 1.2595, test_f1: 0.2640
 epoch: 20, train_loss: 1.1842, test_loss: 1.2549, test_f1: 0.2587
 epoch: 21, train_loss: 1.1779, test_loss: 1.2512, test_f1: 0.2587
 epoch: 22, train_loss: 1.1691, test_loss: 1.2478, test_f1: 0.2587
 epoch: 23, train_loss: 1.1607, test_loss: 1.2415, test_f1: 0.2587
 epoch: 24, train_loss: 1.1574, test_loss: 1.2384, test_f1: 0.2587
 epoch: 25, train_loss: 1.1525, test_loss: 1.2378, test_f1: 0.2573
 epoch: 26, train_loss: 1.1466, test_loss: 1.2307, test_f1: 0.2587
 epoch: 27, train_loss: 1.1398, test_loss: 1.2291, test_f1: 0.2587
 epoch: 28, train_loss: 1.1316, test_loss: 1.2222, test_f1: 0.2801
 epoch: 29, train_loss: 1.1253, test_loss: 1.2186, test_f1: 0.2948
 epoch: 30, train_loss: 1.1210, test_loss: 1.2125, test_f1: 0.3083
 epoch: 31, train_loss: 1.1185, test_loss: 1.2073, test_f1: 0.3148
 epoch: 32, train_loss: 1.1115, test_loss: 1.2069, test_f1: 0.3380
 epoch: 33, train_loss: 1.1063, test_loss: 1.2063, test_f1: 0.3674
 epoch: 34, train_loss: 1.0953, test_loss: 1.2004, test_f1: 0.3661
 epoch: 35, train_loss: 1.0904, test_loss: 1.1962, test_f1: 0.3594
 epoch: 36, train_loss: 1.0880, test_loss: 1.1892, test_f1: 0.3559
 epoch: 37, train_loss: 1.0770, test_loss: 1.1862, test_f1: 0.3580
 epoch: 38, train_loss: 1.0721, test_loss: 1.1805, test_f1: 0.3560
 epoch: 39, train_loss: 1.0645, test_loss: 1.1810, test_f1: 0.3714
 epoch: 40, train_loss: 1.0606, test_loss: 1.1797, test_f1: 0.3606
 epoch: 41, train_loss: 1.0523, test_loss: 1.1778, test_f1: 0.4026
 epoch: 42, train_loss: 1.0486, test_loss: 1.1708, test_f1: 0.3793
 epoch: 43, train_loss: 1.0405, test_loss: 1.1666, test_f1: 0.3660
 epoch: 44, train_loss: 1.0332, test_loss: 1.1615, test_f1: 0.3873
 epoch: 45, train_loss: 1.0247, test_loss: 1.1627, test_f1: 0.3891
 epoch: 46, train_loss: 1.0158, test_loss: 1.1595, test_f1: 0.4075
 epoch: 47, train_loss: 1.0061, test_loss: 1.1569, test_f1: 0.4004
 epoch: 48, train_loss: 0.9974, test_loss: 1.1516, test_f1: 0.4098
 epoch: 49, train_loss: 0.9905, test_loss: 1.1475, test_f1: 0.4131
 epoch: 50, train_loss: 0.9812, test_loss: 1.1490, test_f1: 0.4208
 epoch: 51, train_loss: 0.9829, test_loss: 1.1540, test_f1: 0.4186
 epoch: 52, train_loss: 0.9717, test_loss: 1.1571, test_f1: 0.4113
 epoch: 53, train_loss: 0.9649, test_loss: 1.1557, test_f1: 0.4221
 epoch: 54, train_loss: 0.9618, test_loss: 1.1490, test_f1: 0.4135
 epoch: 55, train_loss: 0.9581, test_loss: 1.1498, test_f1: 0.4348
 epoch: 56, train_loss: 0.9502, test_loss: 1.1499, test_f1: 0.4377
 epoch: 57, train_loss: 0.9527, test_loss: 1.1504, test_f1: 0.4388
 epoch: 58, train_loss: 0.9536, test_loss: 1.1499, test_f1: 0.4446
 epoch: 59, train_loss: 0.9437, test_loss: 1.1533, test_f1: 0.4364
 epoch: 60, train_loss: 0.9367, test_loss: 1.1515, test_f1: 0.4473
 epoch: 61, train_loss: 0.9343, test_loss: 1.1556, test_f1: 0.4550
 epoch: 62, train_loss: 0.9326, test_loss: 1.1515, test_f1: 0.4758
 epoch: 63, train_loss: 0.9262, test_loss: 1.1524, test_f1: 0.4867
 epoch: 64, train_loss: 0.9220, test_loss: 1.1604, test_f1: 0.4732
 epoch: 65, train_loss: 0.9198, test_loss: 1.1615, test_f1: 0.4759
 epoch: 66, train_loss: 0.9194, test_loss: 1.1581, test_f1: 0.4763
 epoch: 67, train_loss: 0.9212, test_loss: 1.1605, test_f1: 0.4702
 epoch: 68, train_loss: 0.9104, test_loss: 1.1652, test_f1: 0.4812
 epoch: 69, train_loss: 0.9164, test_loss: 1.1594, test_f1: 0.4870
 epoch: 70, train_loss: 0.9030, test_loss: 1.1587, test_f1: 0.4888
 epoch: 71, train_loss: 0.9006, test_loss: 1.1555, test_f1: 0.5010
 epoch: 72, train_loss: 0.8978, test_loss: 1.1565, test_f1: 0.4959
 epoch: 73, train_loss: 0.9014, test_loss: 1.1648, test_f1: 0.5148
 epoch: 74, train_loss: 0.8959, test_loss: 1.1726, test_f1: 0.5014
 epoch: 75, train_loss: 0.8900, test_loss: 1.1703, test_f1: 0.5029
 epoch: 76, train_loss: 0.8844, test_loss: 1.1752, test_f1: 0.5021
 epoch: 77, train_loss: 0.8822, test_loss: 1.1719, test_f1: 0.5103
 epoch: 78, train_loss: 0.8767, test_loss: 1.1716, test_f1: 0.5102
 epoch: 79, train_loss: 0.8807, test_loss: 1.1688, test_f1: 0.5101
 epoch: 80, train_loss: 0.8752, test_loss: 1.1692, test_f1: 0.5117
 epoch: 81, train_loss: 0.8700, test_loss: 1.1711, test_f1: 0.5005
 epoch: 82, train_loss: 0.8627, test_loss: 1.1638, test_f1: 0.5078
 epoch: 83, train_loss: 0.8660, test_loss: 1.1766, test_f1: 0.5065
 epoch: 84, train_loss: 0.8669, test_loss: 1.1801, test_f1: 0.5094
 epoch: 85, train_loss: 0.8653, test_loss: 1.1912, test_f1: 0.4935
 epoch: 86, train_loss: 0.8606, test_loss: 1.1854, test_f1: 0.4898
 epoch: 87, train_loss: 0.8509, test_loss: 1.1877, test_f1: 0.4953
 epoch: 88, train_loss: 0.8548, test_loss: 1.1802, test_f1: 0.4891
 epoch: 89, train_loss: 0.8464, test_loss: 1.1845, test_f1: 0.4932
 epoch: 90, train_loss: 0.8453, test_loss: 1.1943, test_f1: 0.4973
 epoch: 91, train_loss: 0.8359, test_loss: 1.1919, test_f1: 0.5151
 epoch: 92, train_loss: 0.8355, test_loss: 1.1970, test_f1: 0.5128
 epoch: 93, train_loss: 0.8325, test_loss: 1.1982, test_f1: 0.5142
 epoch: 94, train_loss: 0.8330, test_loss: 1.1992, test_f1: 0.5186
 epoch: 95, train_loss: 0.8306, test_loss: 1.1900, test_f1: 0.5274
 epoch: 96, train_loss: 0.8287, test_loss: 1.1937, test_f1: 0.5247
 epoch: 97, train_loss: 0.8322, test_loss: 1.2011, test_f1: 0.5210
 epoch: 98, train_loss: 0.8249, test_loss: 1.2077, test_f1: 0.5103
 epoch: 99, train_loss: 0.8164, test_loss: 1.2140, test_f1: 0.5044
##################ITERATION #1 ****************************************
 epoch: 0, train_loss: 1.3465, test_loss: 1.3563, test_f1: 0.2281
 epoch: 1, train_loss: 1.3169, test_loss: 1.3514, test_f1: 0.2281
 epoch: 2, train_loss: 1.3035, test_loss: 1.3428, test_f1: 0.2281
 epoch: 3, train_loss: 1.2902, test_loss: 1.3327, test_f1: 0.2281
 epoch: 4, train_loss: 1.2753, test_loss: 1.3240, test_f1: 0.2281
 epoch: 5, train_loss: 1.2641, test_loss: 1.3159, test_f1: 0.2281
 epoch: 6, train_loss: 1.2528, test_loss: 1.3066, test_f1: 0.2281
 epoch: 7, train_loss: 1.2403, test_loss: 1.3010, test_f1: 0.2281
 epoch: 8, train_loss: 1.2273, test_loss: 1.2912, test_f1: 0.2281
 epoch: 9, train_loss: 1.2147, test_loss: 1.2857, test_f1: 0.2281
 epoch: 10, train_loss: 1.2083, test_loss: 1.2790, test_f1: 0.2281
 epoch: 11, train_loss: 1.2024, test_loss: 1.2756, test_f1: 0.2393
 epoch: 12, train_loss: 1.1912, test_loss: 1.2742, test_f1: 0.2493
 epoch: 13, train_loss: 1.1851, test_loss: 1.2723, test_f1: 0.2931
 epoch: 14, train_loss: 1.1766, test_loss: 1.2671, test_f1: 0.3062
 epoch: 15, train_loss: 1.1662, test_loss: 1.2603, test_f1: 0.3062
 epoch: 16, train_loss: 1.1571, test_loss: 1.2567, test_f1: 0.3222
 epoch: 17, train_loss: 1.1482, test_loss: 1.2522, test_f1: 0.3343
 epoch: 18, train_loss: 1.1386, test_loss: 1.2412, test_f1: 0.3466
 epoch: 19, train_loss: 1.1266, test_loss: 1.2353, test_f1: 0.3477
 epoch: 20, train_loss: 1.1198, test_loss: 1.2293, test_f1: 0.3440
 epoch: 21, train_loss: 1.1136, test_loss: 1.2237, test_f1: 0.3315
 epoch: 22, train_loss: 1.1058, test_loss: 1.2194, test_f1: 0.3281
 epoch: 23, train_loss: 1.0994, test_loss: 1.2164, test_f1: 0.3315
 epoch: 24, train_loss: 1.0867, test_loss: 1.2110, test_f1: 0.3268
 epoch: 25, train_loss: 1.0760, test_loss: 1.2059, test_f1: 0.3276
 epoch: 26, train_loss: 1.0702, test_loss: 1.1997, test_f1: 0.3438
 epoch: 27, train_loss: 1.0615, test_loss: 1.1939, test_f1: 0.3402
 epoch: 28, train_loss: 1.0515, test_loss: 1.1914, test_f1: 0.3487
 epoch: 29, train_loss: 1.0407, test_loss: 1.1899, test_f1: 0.3482
 epoch: 30, train_loss: 1.0440, test_loss: 1.1903, test_f1: 0.3755
 epoch: 31, train_loss: 1.0247, test_loss: 1.1863, test_f1: 0.3744
 epoch: 32, train_loss: 1.0136, test_loss: 1.1792, test_f1: 0.4080
 epoch: 33, train_loss: 1.0100, test_loss: 1.1788, test_f1: 0.4169
 epoch: 34, train_loss: 1.0025, test_loss: 1.1789, test_f1: 0.4117
 epoch: 35, train_loss: 0.9974, test_loss: 1.1740, test_f1: 0.4185
 epoch: 36, train_loss: 0.9959, test_loss: 1.1712, test_f1: 0.4439
 epoch: 37, train_loss: 0.9846, test_loss: 1.1673, test_f1: 0.4494
 epoch: 38, train_loss: 0.9693, test_loss: 1.1632, test_f1: 0.4566
 epoch: 39, train_loss: 0.9729, test_loss: 1.1551, test_f1: 0.4645
 epoch: 40, train_loss: 0.9549, test_loss: 1.1494, test_f1: 0.4797
 epoch: 41, train_loss: 0.9550, test_loss: 1.1408, test_f1: 0.4868
 epoch: 42, train_loss: 0.9467, test_loss: 1.1366, test_f1: 0.4909
 epoch: 43, train_loss: 0.9371, test_loss: 1.1385, test_f1: 0.4981
 epoch: 44, train_loss: 0.9215, test_loss: 1.1390, test_f1: 0.5127
 epoch: 45, train_loss: 0.9233, test_loss: 1.1448, test_f1: 0.5376
 epoch: 46, train_loss: 0.9206, test_loss: 1.1424, test_f1: 0.5655
 epoch: 47, train_loss: 0.9136, test_loss: 1.1351, test_f1: 0.5500
 epoch: 48, train_loss: 0.9080, test_loss: 1.1319, test_f1: 0.5610
 epoch: 49, train_loss: 0.8949, test_loss: 1.1296, test_f1: 0.5629
 epoch: 50, train_loss: 0.8830, test_loss: 1.1280, test_f1: 0.5594
 epoch: 51, train_loss: 0.8818, test_loss: 1.1212, test_f1: 0.5674
 epoch: 52, train_loss: 0.8785, test_loss: 1.1210, test_f1: 0.5676
 epoch: 53, train_loss: 0.8776, test_loss: 1.1195, test_f1: 0.5706
 epoch: 54, train_loss: 0.8697, test_loss: 1.1153, test_f1: 0.5702
 epoch: 55, train_loss: 0.8629, test_loss: 1.1164, test_f1: 0.5649
 epoch: 56, train_loss: 0.8639, test_loss: 1.1201, test_f1: 0.5694
 epoch: 57, train_loss: 0.8631, test_loss: 1.1214, test_f1: 0.5779
 epoch: 58, train_loss: 0.8594, test_loss: 1.1136, test_f1: 0.5761
 epoch: 59, train_loss: 0.8562, test_loss: 1.1143, test_f1: 0.5761
 epoch: 60, train_loss: 0.8471, test_loss: 1.1107, test_f1: 0.5707
 epoch: 61, train_loss: 0.8472, test_loss: 1.1164, test_f1: 0.5787
 epoch: 62, train_loss: 0.8542, test_loss: 1.1153, test_f1: 0.5762
 epoch: 63, train_loss: 0.8448, test_loss: 1.1137, test_f1: 0.5811
 epoch: 64, train_loss: 0.8477, test_loss: 1.1108, test_f1: 0.5841
 epoch: 65, train_loss: 0.8404, test_loss: 1.1110, test_f1: 0.5863
 epoch: 66, train_loss: 0.8349, test_loss: 1.1102, test_f1: 0.5787
 epoch: 67, train_loss: 0.8386, test_loss: 1.1116, test_f1: 0.5779
 epoch: 68, train_loss: 0.8285, test_loss: 1.1031, test_f1: 0.5915
 epoch: 69, train_loss: 0.8286, test_loss: 1.1053, test_f1: 0.5971
 epoch: 70, train_loss: 0.8302, test_loss: 1.1085, test_f1: 0.6025
 epoch: 71, train_loss: 0.8216, test_loss: 1.1140, test_f1: 0.5953
 epoch: 72, train_loss: 0.8228, test_loss: 1.1059, test_f1: 0.5947
 epoch: 73, train_loss: 0.8179, test_loss: 1.1108, test_f1: 0.5964
 epoch: 74, train_loss: 0.8130, test_loss: 1.1112, test_f1: 0.5835
 epoch: 75, train_loss: 0.8161, test_loss: 1.1205, test_f1: 0.5799
 epoch: 76, train_loss: 0.8168, test_loss: 1.1198, test_f1: 0.6106
 epoch: 77, train_loss: 0.8057, test_loss: 1.1118, test_f1: 0.6029
 epoch: 78, train_loss: 0.7975, test_loss: 1.1106, test_f1: 0.5971
 epoch: 79, train_loss: 0.8017, test_loss: 1.1252, test_f1: 0.6048
 epoch: 80, train_loss: 0.8006, test_loss: 1.1245, test_f1: 0.6049
 epoch: 81, train_loss: 0.7978, test_loss: 1.1203, test_f1: 0.5719
 epoch: 82, train_loss: 0.7946, test_loss: 1.1154, test_f1: 0.5716
 epoch: 83, train_loss: 0.7875, test_loss: 1.1195, test_f1: 0.5735
 epoch: 84, train_loss: 0.7860, test_loss: 1.1242, test_f1: 0.5972
 epoch: 85, train_loss: 0.7891, test_loss: 1.1214, test_f1: 0.5943
 epoch: 86, train_loss: 0.7858, test_loss: 1.1185, test_f1: 0.5774
 epoch: 87, train_loss: 0.7757, test_loss: 1.1218, test_f1: 0.5872
 epoch: 88, train_loss: 0.7760, test_loss: 1.1295, test_f1: 0.5700
 epoch: 89, train_loss: 0.7726, test_loss: 1.1406, test_f1: 0.5585
 epoch: 90, train_loss: 0.7786, test_loss: 1.1445, test_f1: 0.5609
 epoch: 91, train_loss: 0.7810, test_loss: 1.1384, test_f1: 0.5727
 epoch: 92, train_loss: 0.7734, test_loss: 1.1323, test_f1: 0.5734
 epoch: 93, train_loss: 0.7729, test_loss: 1.1269, test_f1: 0.5900
 epoch: 94, train_loss: 0.7658, test_loss: 1.1269, test_f1: 0.5865
 epoch: 95, train_loss: 0.7684, test_loss: 1.1359, test_f1: 0.5672
 epoch: 96, train_loss: 0.7576, test_loss: 1.1414, test_f1: 0.5748
 epoch: 97, train_loss: 0.7521, test_loss: 1.1358, test_f1: 0.5820
 epoch: 98, train_loss: 0.7538, test_loss: 1.1314, test_f1: 0.5822
 epoch: 99, train_loss: 0.7522, test_loss: 1.1353, test_f1: 0.5881
##################ITERATION #2 ****************************************
 epoch: 0, train_loss: 1.3210, test_loss: 1.3447, test_f1: 0.2290
 epoch: 1, train_loss: 1.2819, test_loss: 1.3438, test_f1: 0.2329
 epoch: 2, train_loss: 1.2689, test_loss: 1.3371, test_f1: 0.2290
 epoch: 3, train_loss: 1.2500, test_loss: 1.3303, test_f1: 0.2354
 epoch: 4, train_loss: 1.2363, test_loss: 1.3205, test_f1: 0.2456
 epoch: 5, train_loss: 1.2216, test_loss: 1.3083, test_f1: 0.2913
 epoch: 6, train_loss: 1.2090, test_loss: 1.2937, test_f1: 0.3217
 epoch: 7, train_loss: 1.1924, test_loss: 1.2770, test_f1: 0.3430
 epoch: 8, train_loss: 1.1844, test_loss: 1.2652, test_f1: 0.3602
 epoch: 9, train_loss: 1.1730, test_loss: 1.2458, test_f1: 0.3354
 epoch: 10, train_loss: 1.1594, test_loss: 1.2371, test_f1: 0.3606
 epoch: 11, train_loss: 1.1516, test_loss: 1.2284, test_f1: 0.3779
 epoch: 12, train_loss: 1.1369, test_loss: 1.2243, test_f1: 0.4288
 epoch: 13, train_loss: 1.1265, test_loss: 1.2147, test_f1: 0.4307
 epoch: 14, train_loss: 1.1154, test_loss: 1.2106, test_f1: 0.4229
 epoch: 15, train_loss: 1.1071, test_loss: 1.2013, test_f1: 0.4188
 epoch: 16, train_loss: 1.0918, test_loss: 1.1956, test_f1: 0.4189
 epoch: 17, train_loss: 1.0865, test_loss: 1.1913, test_f1: 0.4267
 epoch: 18, train_loss: 1.0724, test_loss: 1.1904, test_f1: 0.4279
 epoch: 19, train_loss: 1.0734, test_loss: 1.1853, test_f1: 0.4446
 epoch: 20, train_loss: 1.0609, test_loss: 1.1824, test_f1: 0.4423
 epoch: 21, train_loss: 1.0567, test_loss: 1.1739, test_f1: 0.4500
 epoch: 22, train_loss: 1.0424, test_loss: 1.1686, test_f1: 0.4559
 epoch: 23, train_loss: 1.0356, test_loss: 1.1628, test_f1: 0.4723
 epoch: 24, train_loss: 1.0264, test_loss: 1.1554, test_f1: 0.4886
 epoch: 25, train_loss: 1.0189, test_loss: 1.1481, test_f1: 0.4910
 epoch: 26, train_loss: 1.0177, test_loss: 1.1434, test_f1: 0.4921
 epoch: 27, train_loss: 1.0087, test_loss: 1.1404, test_f1: 0.5155
 epoch: 28, train_loss: 1.0049, test_loss: 1.1340, test_f1: 0.5034
 epoch: 29, train_loss: 0.9956, test_loss: 1.1387, test_f1: 0.4969
 epoch: 30, train_loss: 0.9852, test_loss: 1.1337, test_f1: 0.4988
 epoch: 31, train_loss: 0.9816, test_loss: 1.1371, test_f1: 0.4884
 epoch: 32, train_loss: 0.9657, test_loss: 1.1296, test_f1: 0.5067
 epoch: 33, train_loss: 0.9643, test_loss: 1.1340, test_f1: 0.5126
 epoch: 34, train_loss: 0.9602, test_loss: 1.1358, test_f1: 0.5102
 epoch: 35, train_loss: 0.9608, test_loss: 1.1223, test_f1: 0.5278
 epoch: 36, train_loss: 0.9485, test_loss: 1.1175, test_f1: 0.5272
 epoch: 37, train_loss: 0.9429, test_loss: 1.1124, test_f1: 0.5303
 epoch: 38, train_loss: 0.9397, test_loss: 1.1078, test_f1: 0.5309
 epoch: 39, train_loss: 0.9302, test_loss: 1.1029, test_f1: 0.5236
 epoch: 40, train_loss: 0.9191, test_loss: 1.1045, test_f1: 0.5219
 epoch: 41, train_loss: 0.9223, test_loss: 1.1093, test_f1: 0.5140
 epoch: 42, train_loss: 0.9156, test_loss: 1.1003, test_f1: 0.5293
 epoch: 43, train_loss: 0.9088, test_loss: 1.0968, test_f1: 0.5359
 epoch: 44, train_loss: 0.9085, test_loss: 1.0964, test_f1: 0.5373
 epoch: 45, train_loss: 0.9007, test_loss: 1.1030, test_f1: 0.5232
 epoch: 46, train_loss: 0.8943, test_loss: 1.1023, test_f1: 0.5307
 epoch: 47, train_loss: 0.8866, test_loss: 1.0978, test_f1: 0.5374
 epoch: 48, train_loss: 0.8842, test_loss: 1.0927, test_f1: 0.5330
 epoch: 49, train_loss: 0.8740, test_loss: 1.0893, test_f1: 0.5340
 epoch: 50, train_loss: 0.8715, test_loss: 1.0812, test_f1: 0.5365
 epoch: 51, train_loss: 0.8733, test_loss: 1.0890, test_f1: 0.5384
 epoch: 52, train_loss: 0.8671, test_loss: 1.0837, test_f1: 0.5512
 epoch: 53, train_loss: 0.8644, test_loss: 1.0866, test_f1: 0.5379
 epoch: 54, train_loss: 0.8545, test_loss: 1.0884, test_f1: 0.5396
 epoch: 55, train_loss: 0.8624, test_loss: 1.0915, test_f1: 0.5371
 epoch: 56, train_loss: 0.8584, test_loss: 1.0875, test_f1: 0.5370
 epoch: 57, train_loss: 0.8489, test_loss: 1.0916, test_f1: 0.5342
 epoch: 58, train_loss: 0.8548, test_loss: 1.0945, test_f1: 0.5467
 epoch: 59, train_loss: 0.8440, test_loss: 1.0920, test_f1: 0.5391
 epoch: 60, train_loss: 0.8516, test_loss: 1.0934, test_f1: 0.5570
 epoch: 61, train_loss: 0.8475, test_loss: 1.0910, test_f1: 0.5493
 epoch: 62, train_loss: 0.8479, test_loss: 1.0892, test_f1: 0.5468
 epoch: 63, train_loss: 0.8386, test_loss: 1.0877, test_f1: 0.5425
 epoch: 64, train_loss: 0.8453, test_loss: 1.0821, test_f1: 0.5405
 epoch: 65, train_loss: 0.8383, test_loss: 1.0948, test_f1: 0.5326
 epoch: 66, train_loss: 0.8372, test_loss: 1.0869, test_f1: 0.5379
 epoch: 67, train_loss: 0.8317, test_loss: 1.0941, test_f1: 0.5350
 epoch: 68, train_loss: 0.8361, test_loss: 1.1013, test_f1: 0.5424
 epoch: 69, train_loss: 0.8286, test_loss: 1.1015, test_f1: 0.5453
 epoch: 70, train_loss: 0.8276, test_loss: 1.1088, test_f1: 0.5475
 epoch: 71, train_loss: 0.8250, test_loss: 1.0934, test_f1: 0.5424
 epoch: 72, train_loss: 0.8162, test_loss: 1.0879, test_f1: 0.5373
 epoch: 73, train_loss: 0.8178, test_loss: 1.0775, test_f1: 0.5427
 epoch: 74, train_loss: 0.8222, test_loss: 1.0778, test_f1: 0.5483
 epoch: 75, train_loss: 0.8177, test_loss: 1.0876, test_f1: 0.5505
 epoch: 76, train_loss: 0.8238, test_loss: 1.0820, test_f1: 0.5479
 epoch: 77, train_loss: 0.8132, test_loss: 1.1079, test_f1: 0.5349
 epoch: 78, train_loss: 0.8102, test_loss: 1.1024, test_f1: 0.5401
 epoch: 79, train_loss: 0.8106, test_loss: 1.1135, test_f1: 0.5452
 epoch: 80, train_loss: 0.7991, test_loss: 1.1060, test_f1: 0.5378
 epoch: 81, train_loss: 0.8011, test_loss: 1.0934, test_f1: 0.5429
 epoch: 82, train_loss: 0.8050, test_loss: 1.0871, test_f1: 0.5480
 epoch: 83, train_loss: 0.8089, test_loss: 1.0917, test_f1: 0.5453
 epoch: 84, train_loss: 0.8016, test_loss: 1.0953, test_f1: 0.5576
 epoch: 85, train_loss: 0.7966, test_loss: 1.0885, test_f1: 0.5630
 epoch: 86, train_loss: 0.7883, test_loss: 1.0814, test_f1: 0.5605
 epoch: 87, train_loss: 0.7929, test_loss: 1.0892, test_f1: 0.5527
 epoch: 88, train_loss: 0.7990, test_loss: 1.0907, test_f1: 0.5657
 epoch: 89, train_loss: 0.7943, test_loss: 1.0967, test_f1: 0.5525
 epoch: 90, train_loss: 0.7822, test_loss: 1.0925, test_f1: 0.5550
 epoch: 91, train_loss: 0.7864, test_loss: 1.1018, test_f1: 0.5502
 epoch: 92, train_loss: 0.7764, test_loss: 1.0911, test_f1: 0.5556
 epoch: 93, train_loss: 0.7762, test_loss: 1.0886, test_f1: 0.5511
 epoch: 94, train_loss: 0.7778, test_loss: 1.0856, test_f1: 0.5541
 epoch: 95, train_loss: 0.7771, test_loss: 1.0846, test_f1: 0.5615
 epoch: 96, train_loss: 0.7736, test_loss: 1.1000, test_f1: 0.5748
 epoch: 97, train_loss: 0.7767, test_loss: 1.0940, test_f1: 0.5699
 epoch: 98, train_loss: 0.7680, test_loss: 1.1236, test_f1: 0.5522
 epoch: 99, train_loss: 0.7621, test_loss: 1.1241, test_f1: 0.5599
##################ITERATION #3 ****************************************
 epoch: 0, train_loss: 1.2935, test_loss: 1.3244, test_f1: 0.3582
 epoch: 1, train_loss: 1.2538, test_loss: 1.3255, test_f1: 0.3198
 epoch: 2, train_loss: 1.2358, test_loss: 1.3211, test_f1: 0.2954
 epoch: 3, train_loss: 1.2196, test_loss: 1.3111, test_f1: 0.3113
 epoch: 4, train_loss: 1.2143, test_loss: 1.2982, test_f1: 0.3324
 epoch: 5, train_loss: 1.1978, test_loss: 1.2854, test_f1: 0.3439
 epoch: 6, train_loss: 1.1881, test_loss: 1.2689, test_f1: 0.3565
 epoch: 7, train_loss: 1.1800, test_loss: 1.2560, test_f1: 0.4017
 epoch: 8, train_loss: 1.1705, test_loss: 1.2445, test_f1: 0.4363
 epoch: 9, train_loss: 1.1624, test_loss: 1.2351, test_f1: 0.4537
 epoch: 10, train_loss: 1.1493, test_loss: 1.2263, test_f1: 0.4501
 epoch: 11, train_loss: 1.1394, test_loss: 1.2224, test_f1: 0.4443
 epoch: 12, train_loss: 1.1274, test_loss: 1.2124, test_f1: 0.4411
 epoch: 13, train_loss: 1.1163, test_loss: 1.2005, test_f1: 0.4369
 epoch: 14, train_loss: 1.1058, test_loss: 1.1972, test_f1: 0.4387
 epoch: 15, train_loss: 1.0965, test_loss: 1.1845, test_f1: 0.4542
 epoch: 16, train_loss: 1.0878, test_loss: 1.1837, test_f1: 0.4459
 epoch: 17, train_loss: 1.0828, test_loss: 1.1764, test_f1: 0.4753
 epoch: 18, train_loss: 1.0641, test_loss: 1.1556, test_f1: 0.4748
 epoch: 19, train_loss: 1.0580, test_loss: 1.1527, test_f1: 0.4604
 epoch: 20, train_loss: 1.0516, test_loss: 1.1489, test_f1: 0.4535
 epoch: 21, train_loss: 1.0399, test_loss: 1.1469, test_f1: 0.4584
 epoch: 22, train_loss: 1.0397, test_loss: 1.1405, test_f1: 0.4615
 epoch: 23, train_loss: 1.0301, test_loss: 1.1345, test_f1: 0.4887
 epoch: 24, train_loss: 1.0207, test_loss: 1.1435, test_f1: 0.4819
 epoch: 25, train_loss: 1.0173, test_loss: 1.1442, test_f1: 0.4867
 epoch: 26, train_loss: 1.0104, test_loss: 1.1363, test_f1: 0.4957
 epoch: 27, train_loss: 0.9876, test_loss: 1.1221, test_f1: 0.5049
 epoch: 28, train_loss: 0.9891, test_loss: 1.1219, test_f1: 0.4987
 epoch: 29, train_loss: 0.9801, test_loss: 1.1226, test_f1: 0.5032
 epoch: 30, train_loss: 0.9790, test_loss: 1.1209, test_f1: 0.5101
 epoch: 31, train_loss: 0.9650, test_loss: 1.1219, test_f1: 0.5246
 epoch: 32, train_loss: 0.9728, test_loss: 1.1171, test_f1: 0.5185
 epoch: 33, train_loss: 0.9676, test_loss: 1.1163, test_f1: 0.4979
 epoch: 34, train_loss: 0.9512, test_loss: 1.1190, test_f1: 0.4927
 epoch: 35, train_loss: 0.9461, test_loss: 1.1183, test_f1: 0.4924
 epoch: 36, train_loss: 0.9395, test_loss: 1.1203, test_f1: 0.4923
 epoch: 37, train_loss: 0.9440, test_loss: 1.1162, test_f1: 0.4956
 epoch: 38, train_loss: 0.9278, test_loss: 1.1166, test_f1: 0.4980
 epoch: 39, train_loss: 0.9211, test_loss: 1.1062, test_f1: 0.5080
 epoch: 40, train_loss: 0.9139, test_loss: 1.1092, test_f1: 0.5081
 epoch: 41, train_loss: 0.9154, test_loss: 1.1126, test_f1: 0.5062
 epoch: 42, train_loss: 0.9037, test_loss: 1.1117, test_f1: 0.5233
 epoch: 43, train_loss: 0.8981, test_loss: 1.1151, test_f1: 0.5176
 epoch: 44, train_loss: 0.8945, test_loss: 1.1192, test_f1: 0.5269
 epoch: 45, train_loss: 0.8807, test_loss: 1.1223, test_f1: 0.5299
 epoch: 46, train_loss: 0.8888, test_loss: 1.1229, test_f1: 0.5270
 epoch: 47, train_loss: 0.8745, test_loss: 1.1192, test_f1: 0.5350
 epoch: 48, train_loss: 0.8775, test_loss: 1.1149, test_f1: 0.5322
 epoch: 49, train_loss: 0.8650, test_loss: 1.1047, test_f1: 0.5428
 epoch: 50, train_loss: 0.8593, test_loss: 1.1070, test_f1: 0.5379
 epoch: 51, train_loss: 0.8642, test_loss: 1.1130, test_f1: 0.5357
 epoch: 52, train_loss: 0.8586, test_loss: 1.1109, test_f1: 0.5456
 epoch: 53, train_loss: 0.8504, test_loss: 1.1147, test_f1: 0.5478
 epoch: 54, train_loss: 0.8492, test_loss: 1.1193, test_f1: 0.5374
 epoch: 55, train_loss: 0.8537, test_loss: 1.1180, test_f1: 0.5223
 epoch: 56, train_loss: 0.8426, test_loss: 1.1105, test_f1: 0.5297
 epoch: 57, train_loss: 0.8362, test_loss: 1.1065, test_f1: 0.5400
 epoch: 58, train_loss: 0.8367, test_loss: 1.1063, test_f1: 0.5530
 epoch: 59, train_loss: 0.8362, test_loss: 1.1054, test_f1: 0.5510
 epoch: 60, train_loss: 0.8353, test_loss: 1.1122, test_f1: 0.5386
 epoch: 61, train_loss: 0.8295, test_loss: 1.1068, test_f1: 0.5486
 epoch: 62, train_loss: 0.8309, test_loss: 1.1042, test_f1: 0.5584
 epoch: 63, train_loss: 0.8318, test_loss: 1.1057, test_f1: 0.5454
 epoch: 64, train_loss: 0.8142, test_loss: 1.1106, test_f1: 0.5432
 epoch: 65, train_loss: 0.8284, test_loss: 1.1108, test_f1: 0.5505
 epoch: 66, train_loss: 0.8203, test_loss: 1.1043, test_f1: 0.5636
 epoch: 67, train_loss: 0.8196, test_loss: 1.1100, test_f1: 0.5558
 epoch: 68, train_loss: 0.8077, test_loss: 1.1089, test_f1: 0.5455
 epoch: 69, train_loss: 0.8175, test_loss: 1.1119, test_f1: 0.5404
 epoch: 70, train_loss: 0.8073, test_loss: 1.1139, test_f1: 0.5409
 epoch: 71, train_loss: 0.8018, test_loss: 1.1113, test_f1: 0.5428
 epoch: 72, train_loss: 0.7988, test_loss: 1.1096, test_f1: 0.5470
 epoch: 73, train_loss: 0.8054, test_loss: 1.1095, test_f1: 0.5632
 epoch: 74, train_loss: 0.8044, test_loss: 1.1167, test_f1: 0.5607
 epoch: 75, train_loss: 0.7986, test_loss: 1.1187, test_f1: 0.5486
 epoch: 76, train_loss: 0.8143, test_loss: 1.1096, test_f1: 0.5565
 epoch: 77, train_loss: 0.7974, test_loss: 1.1123, test_f1: 0.5607
 epoch: 78, train_loss: 0.7977, test_loss: 1.1136, test_f1: 0.5655
 epoch: 79, train_loss: 0.7921, test_loss: 1.1172, test_f1: 0.5641
 epoch: 80, train_loss: 0.7789, test_loss: 1.1164, test_f1: 0.5666
 epoch: 81, train_loss: 0.7854, test_loss: 1.1162, test_f1: 0.5689
 epoch: 82, train_loss: 0.7820, test_loss: 1.1178, test_f1: 0.5518
 epoch: 83, train_loss: 0.7829, test_loss: 1.1141, test_f1: 0.5693
 epoch: 84, train_loss: 0.7794, test_loss: 1.1183, test_f1: 0.5776
 epoch: 85, train_loss: 0.7760, test_loss: 1.1233, test_f1: 0.5652
 epoch: 86, train_loss: 0.7703, test_loss: 1.1257, test_f1: 0.5631
 epoch: 87, train_loss: 0.7765, test_loss: 1.1208, test_f1: 0.5634
 epoch: 88, train_loss: 0.7749, test_loss: 1.1181, test_f1: 0.5710
 epoch: 89, train_loss: 0.7612, test_loss: 1.1234, test_f1: 0.5625
 epoch: 90, train_loss: 0.7769, test_loss: 1.1248, test_f1: 0.5626
 epoch: 91, train_loss: 0.7790, test_loss: 1.1145, test_f1: 0.5548
 epoch: 92, train_loss: 0.7718, test_loss: 1.1156, test_f1: 0.5676
 epoch: 93, train_loss: 0.7536, test_loss: 1.1214, test_f1: 0.5546
 epoch: 94, train_loss: 0.7469, test_loss: 1.1173, test_f1: 0.5775
 epoch: 95, train_loss: 0.7600, test_loss: 1.1215, test_f1: 0.5674
 epoch: 96, train_loss: 0.7477, test_loss: 1.1265, test_f1: 0.5783
 epoch: 97, train_loss: 0.7400, test_loss: 1.1276, test_f1: 0.5863
 epoch: 98, train_loss: 0.7570, test_loss: 1.1316, test_f1: 0.5927
 epoch: 99, train_loss: 0.7453, test_loss: 1.1273, test_f1: 0.5835
##################ITERATION #4 ****************************************
 epoch: 0, train_loss: 1.2802, test_loss: 1.3471, test_f1: 0.1553
 epoch: 1, train_loss: 1.2345, test_loss: 1.3343, test_f1: 0.3129
 epoch: 2, train_loss: 1.2145, test_loss: 1.3209, test_f1: 0.3404
 epoch: 3, train_loss: 1.1968, test_loss: 1.3060, test_f1: 0.3405
 epoch: 4, train_loss: 1.1676, test_loss: 1.2863, test_f1: 0.3466
 epoch: 5, train_loss: 1.1593, test_loss: 1.2701, test_f1: 0.3987
 epoch: 6, train_loss: 1.1492, test_loss: 1.2447, test_f1: 0.4428
 epoch: 7, train_loss: 1.1385, test_loss: 1.2230, test_f1: 0.4569
 epoch: 8, train_loss: 1.1109, test_loss: 1.2052, test_f1: 0.4641
 epoch: 9, train_loss: 1.1087, test_loss: 1.1878, test_f1: 0.4646
 epoch: 10, train_loss: 1.0889, test_loss: 1.1689, test_f1: 0.4776
 epoch: 11, train_loss: 1.0730, test_loss: 1.1579, test_f1: 0.4768
 epoch: 12, train_loss: 1.0709, test_loss: 1.1575, test_f1: 0.4929
 epoch: 13, train_loss: 1.0690, test_loss: 1.1503, test_f1: 0.4949
 epoch: 14, train_loss: 1.0480, test_loss: 1.1482, test_f1: 0.4827
 epoch: 15, train_loss: 1.0357, test_loss: 1.1462, test_f1: 0.4844
 epoch: 16, train_loss: 1.0353, test_loss: 1.1342, test_f1: 0.4724
 epoch: 17, train_loss: 1.0223, test_loss: 1.1276, test_f1: 0.4844
 epoch: 18, train_loss: 1.0061, test_loss: 1.1180, test_f1: 0.4879
 epoch: 19, train_loss: 1.0019, test_loss: 1.1152, test_f1: 0.5031
 epoch: 20, train_loss: 0.9934, test_loss: 1.1195, test_f1: 0.5070
 epoch: 21, train_loss: 0.9943, test_loss: 1.1232, test_f1: 0.5009
 epoch: 22, train_loss: 0.9866, test_loss: 1.1237, test_f1: 0.5091
 epoch: 23, train_loss: 0.9747, test_loss: 1.1145, test_f1: 0.5284
 epoch: 24, train_loss: 0.9644, test_loss: 1.1143, test_f1: 0.5148
 epoch: 25, train_loss: 0.9627, test_loss: 1.1132, test_f1: 0.5389
 epoch: 26, train_loss: 0.9597, test_loss: 1.1127, test_f1: 0.5286
 epoch: 27, train_loss: 0.9396, test_loss: 1.1162, test_f1: 0.5456
 epoch: 28, train_loss: 0.9355, test_loss: 1.1245, test_f1: 0.5347
 epoch: 29, train_loss: 0.9279, test_loss: 1.1348, test_f1: 0.5468
 epoch: 30, train_loss: 0.9249, test_loss: 1.1274, test_f1: 0.5346
 epoch: 31, train_loss: 0.9204, test_loss: 1.1148, test_f1: 0.5404
 epoch: 32, train_loss: 0.9245, test_loss: 1.1072, test_f1: 0.5495
 epoch: 33, train_loss: 0.9135, test_loss: 1.1100, test_f1: 0.5596
 epoch: 34, train_loss: 0.9009, test_loss: 1.1287, test_f1: 0.5387
 epoch: 35, train_loss: 0.8979, test_loss: 1.1308, test_f1: 0.5355
 epoch: 36, train_loss: 0.8911, test_loss: 1.1235, test_f1: 0.5619
 epoch: 37, train_loss: 0.8887, test_loss: 1.1084, test_f1: 0.5734
 epoch: 38, train_loss: 0.8801, test_loss: 1.1103, test_f1: 0.5838
 epoch: 39, train_loss: 0.8721, test_loss: 1.1077, test_f1: 0.5808
 epoch: 40, train_loss: 0.8772, test_loss: 1.1077, test_f1: 0.5700
 epoch: 41, train_loss: 0.8653, test_loss: 1.1133, test_f1: 0.5756
 epoch: 42, train_loss: 0.8559, test_loss: 1.1417, test_f1: 0.5289
 epoch: 43, train_loss: 0.8519, test_loss: 1.1460, test_f1: 0.5430
 epoch: 44, train_loss: 0.8583, test_loss: 1.1386, test_f1: 0.5582
 epoch: 45, train_loss: 0.8445, test_loss: 1.1386, test_f1: 0.5548
 epoch: 46, train_loss: 0.8297, test_loss: 1.1416, test_f1: 0.5418
 epoch: 47, train_loss: 0.8367, test_loss: 1.1474, test_f1: 0.5644
 epoch: 48, train_loss: 0.8219, test_loss: 1.1694, test_f1: 0.5514
 epoch: 49, train_loss: 0.8339, test_loss: 1.1615, test_f1: 0.5354
 epoch: 50, train_loss: 0.8341, test_loss: 1.1519, test_f1: 0.5456
 epoch: 51, train_loss: 0.8196, test_loss: 1.1738, test_f1: 0.4933
 epoch: 52, train_loss: 0.8238, test_loss: 1.1736, test_f1: 0.4885
 epoch: 53, train_loss: 0.8065, test_loss: 1.1790, test_f1: 0.4859
 epoch: 54, train_loss: 0.8057, test_loss: 1.1880, test_f1: 0.4975
 epoch: 55, train_loss: 0.7978, test_loss: 1.1973, test_f1: 0.5351
 epoch: 56, train_loss: 0.8041, test_loss: 1.1940, test_f1: 0.5247
 epoch: 57, train_loss: 0.7990, test_loss: 1.2011, test_f1: 0.5329
 epoch: 58, train_loss: 0.8044, test_loss: 1.2065, test_f1: 0.5415
 epoch: 59, train_loss: 0.8075, test_loss: 1.1961, test_f1: 0.5376
 epoch: 60, train_loss: 0.7947, test_loss: 1.1928, test_f1: 0.5309
 epoch: 61, train_loss: 0.8030, test_loss: 1.2099, test_f1: 0.5330
 epoch: 62, train_loss: 0.7895, test_loss: 1.2146, test_f1: 0.5452
 epoch: 63, train_loss: 0.7772, test_loss: 1.2012, test_f1: 0.5484
 epoch: 64, train_loss: 0.7894, test_loss: 1.1794, test_f1: 0.5457
 epoch: 65, train_loss: 0.7923, test_loss: 1.1822, test_f1: 0.5397
 epoch: 66, train_loss: 0.7828, test_loss: 1.1706, test_f1: 0.5423
 epoch: 67, train_loss: 0.7858, test_loss: 1.1808, test_f1: 0.5354
 epoch: 68, train_loss: 0.7796, test_loss: 1.2009, test_f1: 0.5267
 epoch: 69, train_loss: 0.7686, test_loss: 1.2024, test_f1: 0.5554
 epoch: 70, train_loss: 0.7719, test_loss: 1.2111, test_f1: 0.5558
 epoch: 71, train_loss: 0.7596, test_loss: 1.2084, test_f1: 0.5428
 epoch: 72, train_loss: 0.7820, test_loss: 1.2081, test_f1: 0.5327
 epoch: 73, train_loss: 0.7669, test_loss: 1.2092, test_f1: 0.5134
 epoch: 74, train_loss: 0.7651, test_loss: 1.2271, test_f1: 0.5070
 epoch: 75, train_loss: 0.7663, test_loss: 1.2198, test_f1: 0.5348
 epoch: 76, train_loss: 0.7679, test_loss: 1.2026, test_f1: 0.5502
 epoch: 77, train_loss: 0.7606, test_loss: 1.2216, test_f1: 0.5333
 epoch: 78, train_loss: 0.7572, test_loss: 1.2468, test_f1: 0.5090
 epoch: 79, train_loss: 0.7541, test_loss: 1.2745, test_f1: 0.4999
 epoch: 80, train_loss: 0.7618, test_loss: 1.2745, test_f1: 0.5537
 epoch: 81, train_loss: 0.7600, test_loss: 1.2616, test_f1: 0.5561
 epoch: 82, train_loss: 0.7522, test_loss: 1.2543, test_f1: 0.5540
 epoch: 83, train_loss: 0.7447, test_loss: 1.2276, test_f1: 0.5540
 epoch: 84, train_loss: 0.7453, test_loss: 1.2262, test_f1: 0.5611
 epoch: 85, train_loss: 0.7463, test_loss: 1.2546, test_f1: 0.5507
 epoch: 86, train_loss: 0.7447, test_loss: 1.2891, test_f1: 0.5319
 epoch: 87, train_loss: 0.7404, test_loss: 1.2564, test_f1: 0.5509
 epoch: 88, train_loss: 0.7374, test_loss: 1.2324, test_f1: 0.5451
 epoch: 89, train_loss: 0.7312, test_loss: 1.2404, test_f1: 0.5369
 epoch: 90, train_loss: 0.7420, test_loss: 1.2539, test_f1: 0.5347
 epoch: 91, train_loss: 0.7353, test_loss: 1.2460, test_f1: 0.5422
 epoch: 92, train_loss: 0.7362, test_loss: 1.2489, test_f1: 0.5336
 epoch: 93, train_loss: 0.7280, test_loss: 1.2792, test_f1: 0.5272
 epoch: 94, train_loss: 0.7254, test_loss: 1.2460, test_f1: 0.5328
 epoch: 95, train_loss: 0.7328, test_loss: 1.2251, test_f1: 0.5474
 epoch: 96, train_loss: 0.7302, test_loss: 1.2109, test_f1: 0.5558
 epoch: 97, train_loss: 0.7351, test_loss: 1.2179, test_f1: 0.5535
 epoch: 98, train_loss: 0.7299, test_loss: 1.2341, test_f1: 0.5478
 epoch: 99, train_loss: 0.7146, test_loss: 1.2455, test_f1: 0.5342
##################ITERATION #5 ****************************************
 epoch: 0, train_loss: 1.2754, test_loss: 1.3344, test_f1: 0.2481
 epoch: 1, train_loss: 1.2308, test_loss: 1.3301, test_f1: 0.3327
 epoch: 2, train_loss: 1.2162, test_loss: 1.3283, test_f1: 0.3313
 epoch: 3, train_loss: 1.1974, test_loss: 1.3287, test_f1: 0.3438
 epoch: 4, train_loss: 1.1795, test_loss: 1.3248, test_f1: 0.3655
 epoch: 5, train_loss: 1.1711, test_loss: 1.3102, test_f1: 0.4086
 epoch: 6, train_loss: 1.1557, test_loss: 1.2867, test_f1: 0.4223
 epoch: 7, train_loss: 1.1392, test_loss: 1.2652, test_f1: 0.4202
 epoch: 8, train_loss: 1.1301, test_loss: 1.2440, test_f1: 0.4201
 epoch: 9, train_loss: 1.1108, test_loss: 1.2255, test_f1: 0.4037
 epoch: 10, train_loss: 1.1031, test_loss: 1.2156, test_f1: 0.4104
 epoch: 11, train_loss: 1.1053, test_loss: 1.2075, test_f1: 0.4282
 epoch: 12, train_loss: 1.0908, test_loss: 1.2041, test_f1: 0.4205
 epoch: 13, train_loss: 1.0705, test_loss: 1.2064, test_f1: 0.4453
 epoch: 14, train_loss: 1.0578, test_loss: 1.2080, test_f1: 0.4426
 epoch: 15, train_loss: 1.0650, test_loss: 1.2138, test_f1: 0.4374
 epoch: 16, train_loss: 1.0460, test_loss: 1.2168, test_f1: 0.4523
 epoch: 17, train_loss: 1.0321, test_loss: 1.2090, test_f1: 0.4522
 epoch: 18, train_loss: 1.0222, test_loss: 1.2054, test_f1: 0.4613
 epoch: 19, train_loss: 1.0136, test_loss: 1.2089, test_f1: 0.4735
 epoch: 20, train_loss: 1.0108, test_loss: 1.2274, test_f1: 0.4806
 epoch: 21, train_loss: 1.0064, test_loss: 1.2257, test_f1: 0.5022
 epoch: 22, train_loss: 0.9983, test_loss: 1.2255, test_f1: 0.5173
 epoch: 23, train_loss: 0.9949, test_loss: 1.2270, test_f1: 0.5118
 epoch: 24, train_loss: 0.9775, test_loss: 1.2221, test_f1: 0.5011
 epoch: 25, train_loss: 0.9696, test_loss: 1.2257, test_f1: 0.5013
 epoch: 26, train_loss: 0.9697, test_loss: 1.2407, test_f1: 0.5057
 epoch: 27, train_loss: 0.9637, test_loss: 1.2368, test_f1: 0.5193
 epoch: 28, train_loss: 0.9417, test_loss: 1.2428, test_f1: 0.5162
 epoch: 29, train_loss: 0.9514, test_loss: 1.2418, test_f1: 0.5431
 epoch: 30, train_loss: 0.9385, test_loss: 1.2523, test_f1: 0.5217
 epoch: 31, train_loss: 0.9339, test_loss: 1.2325, test_f1: 0.5273
 epoch: 32, train_loss: 0.9329, test_loss: 1.2348, test_f1: 0.5220
 epoch: 33, train_loss: 0.9242, test_loss: 1.2473, test_f1: 0.5296
 epoch: 34, train_loss: 0.9143, test_loss: 1.2656, test_f1: 0.5101
 epoch: 35, train_loss: 0.9152, test_loss: 1.2807, test_f1: 0.5048
 epoch: 36, train_loss: 0.9126, test_loss: 1.2745, test_f1: 0.5118
 epoch: 37, train_loss: 0.9023, test_loss: 1.2612, test_f1: 0.5393
 epoch: 38, train_loss: 0.8946, test_loss: 1.2617, test_f1: 0.5489
 epoch: 39, train_loss: 0.8895, test_loss: 1.2610, test_f1: 0.5593
 epoch: 40, train_loss: 0.8890, test_loss: 1.2807, test_f1: 0.5179
 epoch: 41, train_loss: 0.8743, test_loss: 1.2840, test_f1: 0.5099
 epoch: 42, train_loss: 0.8754, test_loss: 1.2814, test_f1: 0.5187
 epoch: 43, train_loss: 0.8666, test_loss: 1.2581, test_f1: 0.5504
 epoch: 44, train_loss: 0.8534, test_loss: 1.2811, test_f1: 0.5362
 epoch: 45, train_loss: 0.8588, test_loss: 1.2954, test_f1: 0.5313
 epoch: 46, train_loss: 0.8482, test_loss: 1.2984, test_f1: 0.5281
 epoch: 47, train_loss: 0.8480, test_loss: 1.2999, test_f1: 0.5366
 epoch: 48, train_loss: 0.8425, test_loss: 1.3246, test_f1: 0.5236
 epoch: 49, train_loss: 0.8398, test_loss: 1.3470, test_f1: 0.4886
 epoch: 50, train_loss: 0.8392, test_loss: 1.3381, test_f1: 0.4981
 epoch: 51, train_loss: 0.8324, test_loss: 1.3343, test_f1: 0.5306
 epoch: 52, train_loss: 0.8296, test_loss: 1.3253, test_f1: 0.5512
 epoch: 53, train_loss: 0.8123, test_loss: 1.3328, test_f1: 0.5560
 epoch: 54, train_loss: 0.8199, test_loss: 1.3375, test_f1: 0.5520
 epoch: 55, train_loss: 0.8249, test_loss: 1.3325, test_f1: 0.5457
 epoch: 56, train_loss: 0.8225, test_loss: 1.3490, test_f1: 0.5151
 epoch: 57, train_loss: 0.8116, test_loss: 1.3512, test_f1: 0.5425
 epoch: 58, train_loss: 0.8157, test_loss: 1.3533, test_f1: 0.5346
 epoch: 59, train_loss: 0.8074, test_loss: 1.3718, test_f1: 0.5029
 epoch: 60, train_loss: 0.8067, test_loss: 1.3647, test_f1: 0.5359
 epoch: 61, train_loss: 0.8000, test_loss: 1.3413, test_f1: 0.5396
 epoch: 62, train_loss: 0.8040, test_loss: 1.3444, test_f1: 0.5409
 epoch: 63, train_loss: 0.7950, test_loss: 1.3535, test_f1: 0.5336
 epoch: 64, train_loss: 0.7877, test_loss: 1.3620, test_f1: 0.5368
 epoch: 65, train_loss: 0.7972, test_loss: 1.3604, test_f1: 0.5453
 epoch: 66, train_loss: 0.7967, test_loss: 1.3591, test_f1: 0.5451
 epoch: 67, train_loss: 0.7906, test_loss: 1.3620, test_f1: 0.5357
 epoch: 68, train_loss: 0.7842, test_loss: 1.3718, test_f1: 0.5129
 epoch: 69, train_loss: 0.7812, test_loss: 1.3809, test_f1: 0.5000
 epoch: 70, train_loss: 0.7844, test_loss: 1.3744, test_f1: 0.5034
 epoch: 71, train_loss: 0.7764, test_loss: 1.3511, test_f1: 0.5441
 epoch: 72, train_loss: 0.7827, test_loss: 1.3766, test_f1: 0.5353
 epoch: 73, train_loss: 0.7721, test_loss: 1.3765, test_f1: 0.5368
 epoch: 74, train_loss: 0.7705, test_loss: 1.3927, test_f1: 0.5127
 epoch: 75, train_loss: 0.7757, test_loss: 1.3833, test_f1: 0.5316
 epoch: 76, train_loss: 0.7697, test_loss: 1.3904, test_f1: 0.5514
 epoch: 77, train_loss: 0.7744, test_loss: 1.3855, test_f1: 0.5487
 epoch: 78, train_loss: 0.7688, test_loss: 1.4010, test_f1: 0.5378
 epoch: 79, train_loss: 0.7584, test_loss: 1.3988, test_f1: 0.5410
 epoch: 80, train_loss: 0.7651, test_loss: 1.3933, test_f1: 0.5307
 epoch: 81, train_loss: 0.7611, test_loss: 1.3935, test_f1: 0.5447
 epoch: 82, train_loss: 0.7566, test_loss: 1.3664, test_f1: 0.5613
 epoch: 83, train_loss: 0.7555, test_loss: 1.3864, test_f1: 0.5492
 epoch: 84, train_loss: 0.7525, test_loss: 1.3923, test_f1: 0.5519
 epoch: 85, train_loss: 0.7602, test_loss: 1.4303, test_f1: 0.5055
 epoch: 86, train_loss: 0.7466, test_loss: 1.4147, test_f1: 0.5318
 epoch: 87, train_loss: 0.7457, test_loss: 1.4262, test_f1: 0.5408
 epoch: 88, train_loss: 0.7501, test_loss: 1.4055, test_f1: 0.5441
 epoch: 89, train_loss: 0.7497, test_loss: 1.4090, test_f1: 0.5351
 epoch: 90, train_loss: 0.7468, test_loss: 1.4364, test_f1: 0.5350
 epoch: 91, train_loss: 0.7498, test_loss: 1.4667, test_f1: 0.5278
 epoch: 92, train_loss: 0.7454, test_loss: 1.4511, test_f1: 0.5305
 epoch: 93, train_loss: 0.7344, test_loss: 1.4495, test_f1: 0.5407
 epoch: 94, train_loss: 0.7319, test_loss: 1.4427, test_f1: 0.5372
 epoch: 95, train_loss: 0.7257, test_loss: 1.4244, test_f1: 0.5378
 epoch: 96, train_loss: 0.7208, test_loss: 1.4314, test_f1: 0.5454
 epoch: 97, train_loss: 0.7280, test_loss: 1.4372, test_f1: 0.5483
 epoch: 98, train_loss: 0.7204, test_loss: 1.4525, test_f1: 0.5464
 epoch: 99, train_loss: 0.7261, test_loss: 1.4449, test_f1: 0.5498
##################ITERATION #6 ****************************************
 epoch: 0, train_loss: 1.2913, test_loss: 1.3348, test_f1: 0.3093
 epoch: 1, train_loss: 1.2249, test_loss: 1.3345, test_f1: 0.3366
 epoch: 2, train_loss: 1.2155, test_loss: 1.3305, test_f1: 0.3346
 epoch: 3, train_loss: 1.1916, test_loss: 1.3307, test_f1: 0.3406
 epoch: 4, train_loss: 1.1746, test_loss: 1.3230, test_f1: 0.3275
 epoch: 5, train_loss: 1.1568, test_loss: 1.3115, test_f1: 0.3062
 epoch: 6, train_loss: 1.1478, test_loss: 1.2963, test_f1: 0.3652
 epoch: 7, train_loss: 1.1298, test_loss: 1.2714, test_f1: 0.3947
 epoch: 8, train_loss: 1.1172, test_loss: 1.2472, test_f1: 0.3947
 epoch: 9, train_loss: 1.1193, test_loss: 1.2345, test_f1: 0.4198
 epoch: 10, train_loss: 1.1111, test_loss: 1.2201, test_f1: 0.4182
 epoch: 11, train_loss: 1.0929, test_loss: 1.1992, test_f1: 0.4134
 epoch: 12, train_loss: 1.0953, test_loss: 1.1890, test_f1: 0.4436
 epoch: 13, train_loss: 1.0729, test_loss: 1.1854, test_f1: 0.4764
 epoch: 14, train_loss: 1.0666, test_loss: 1.1809, test_f1: 0.4724
 epoch: 15, train_loss: 1.0580, test_loss: 1.1790, test_f1: 0.4598
 epoch: 16, train_loss: 1.0463, test_loss: 1.1867, test_f1: 0.4673
 epoch: 17, train_loss: 1.0316, test_loss: 1.1865, test_f1: 0.4395
 epoch: 18, train_loss: 1.0268, test_loss: 1.1847, test_f1: 0.4649
 epoch: 19, train_loss: 1.0286, test_loss: 1.1778, test_f1: 0.4666
 epoch: 20, train_loss: 1.0102, test_loss: 1.1682, test_f1: 0.4855
 epoch: 21, train_loss: 1.0001, test_loss: 1.1815, test_f1: 0.4702
 epoch: 22, train_loss: 1.0039, test_loss: 1.1948, test_f1: 0.4526
 epoch: 23, train_loss: 0.9826, test_loss: 1.1858, test_f1: 0.4561
 epoch: 24, train_loss: 0.9764, test_loss: 1.1819, test_f1: 0.4620
 epoch: 25, train_loss: 0.9799, test_loss: 1.1817, test_f1: 0.4886
 epoch: 26, train_loss: 0.9619, test_loss: 1.2050, test_f1: 0.4928
 epoch: 27, train_loss: 0.9508, test_loss: 1.1930, test_f1: 0.4994
 epoch: 28, train_loss: 0.9368, test_loss: 1.1879, test_f1: 0.5017
 epoch: 29, train_loss: 0.9427, test_loss: 1.1627, test_f1: 0.5039
 epoch: 30, train_loss: 0.9330, test_loss: 1.1588, test_f1: 0.5086
 epoch: 31, train_loss: 0.9355, test_loss: 1.1631, test_f1: 0.5128
 epoch: 32, train_loss: 0.9244, test_loss: 1.1823, test_f1: 0.5160
 epoch: 33, train_loss: 0.9126, test_loss: 1.1786, test_f1: 0.5047
 epoch: 34, train_loss: 0.9136, test_loss: 1.1796, test_f1: 0.5124
 epoch: 35, train_loss: 0.8982, test_loss: 1.1795, test_f1: 0.5209
 epoch: 36, train_loss: 0.9052, test_loss: 1.2101, test_f1: 0.5215
 epoch: 37, train_loss: 0.8840, test_loss: 1.1953, test_f1: 0.5211
 epoch: 38, train_loss: 0.8820, test_loss: 1.2369, test_f1: 0.5176
 epoch: 39, train_loss: 0.8833, test_loss: 1.2335, test_f1: 0.5144
 epoch: 40, train_loss: 0.8920, test_loss: 1.2134, test_f1: 0.5071
 epoch: 41, train_loss: 0.8618, test_loss: 1.2160, test_f1: 0.5059
 epoch: 42, train_loss: 0.8642, test_loss: 1.2416, test_f1: 0.4814
 epoch: 43, train_loss: 0.8611, test_loss: 1.2441, test_f1: 0.5001
 epoch: 44, train_loss: 0.8580, test_loss: 1.2951, test_f1: 0.4961
 epoch: 45, train_loss: 0.8388, test_loss: 1.2690, test_f1: 0.5401
 epoch: 46, train_loss: 0.8486, test_loss: 1.2496, test_f1: 0.5384
 epoch: 47, train_loss: 0.8427, test_loss: 1.2422, test_f1: 0.5491
 epoch: 48, train_loss: 0.8347, test_loss: 1.2042, test_f1: 0.5346
 epoch: 49, train_loss: 0.8491, test_loss: 1.2169, test_f1: 0.5327
 epoch: 50, train_loss: 0.8319, test_loss: 1.2256, test_f1: 0.5515
 epoch: 51, train_loss: 0.8277, test_loss: 1.2712, test_f1: 0.5501
 epoch: 52, train_loss: 0.8219, test_loss: 1.3303, test_f1: 0.5272
 epoch: 53, train_loss: 0.8133, test_loss: 1.2980, test_f1: 0.5338
 epoch: 54, train_loss: 0.8129, test_loss: 1.3086, test_f1: 0.5505
 epoch: 55, train_loss: 0.8193, test_loss: 1.2551, test_f1: 0.5518
 epoch: 56, train_loss: 0.8116, test_loss: 1.2585, test_f1: 0.5371
 epoch: 57, train_loss: 0.8026, test_loss: 1.2477, test_f1: 0.5468
 epoch: 58, train_loss: 0.7961, test_loss: 1.2592, test_f1: 0.5479
 epoch: 59, train_loss: 0.8015, test_loss: 1.3031, test_f1: 0.5394
 epoch: 60, train_loss: 0.8028, test_loss: 1.2833, test_f1: 0.5423
 epoch: 61, train_loss: 0.8059, test_loss: 1.2905, test_f1: 0.5347
 epoch: 62, train_loss: 0.7971, test_loss: 1.3013, test_f1: 0.5239
 epoch: 63, train_loss: 0.7966, test_loss: 1.3007, test_f1: 0.5351
 epoch: 64, train_loss: 0.7946, test_loss: 1.3214, test_f1: 0.5384
 epoch: 65, train_loss: 0.7878, test_loss: 1.3046, test_f1: 0.5348
 epoch: 66, train_loss: 0.7882, test_loss: 1.2987, test_f1: 0.5373
 epoch: 67, train_loss: 0.7952, test_loss: 1.2834, test_f1: 0.5427
 epoch: 68, train_loss: 0.7897, test_loss: 1.3010, test_f1: 0.5481
 epoch: 69, train_loss: 0.7757, test_loss: 1.3033, test_f1: 0.5455
 epoch: 70, train_loss: 0.7842, test_loss: 1.3284, test_f1: 0.5428
 epoch: 71, train_loss: 0.7644, test_loss: 1.2982, test_f1: 0.5434
 epoch: 72, train_loss: 0.7723, test_loss: 1.3111, test_f1: 0.5353
 epoch: 73, train_loss: 0.7775, test_loss: 1.3179, test_f1: 0.5377
 epoch: 74, train_loss: 0.7672, test_loss: 1.3370, test_f1: 0.5356
 epoch: 75, train_loss: 0.7739, test_loss: 1.3392, test_f1: 0.5456
 epoch: 76, train_loss: 0.7815, test_loss: 1.3342, test_f1: 0.5274
 epoch: 77, train_loss: 0.7675, test_loss: 1.3193, test_f1: 0.5407
 epoch: 78, train_loss: 0.7684, test_loss: 1.2948, test_f1: 0.5268
 epoch: 79, train_loss: 0.7507, test_loss: 1.3099, test_f1: 0.5351
 epoch: 80, train_loss: 0.7634, test_loss: 1.3649, test_f1: 0.5257
 epoch: 81, train_loss: 0.7562, test_loss: 1.3647, test_f1: 0.5275
 epoch: 82, train_loss: 0.7602, test_loss: 1.3523, test_f1: 0.5351
 epoch: 83, train_loss: 0.7543, test_loss: 1.3617, test_f1: 0.5297
 epoch: 84, train_loss: 0.7521, test_loss: 1.3588, test_f1: 0.5278
 epoch: 85, train_loss: 0.7457, test_loss: 1.4098, test_f1: 0.5377
 epoch: 86, train_loss: 0.7480, test_loss: 1.4454, test_f1: 0.5330
 epoch: 87, train_loss: 0.7499, test_loss: 1.3757, test_f1: 0.5384
 epoch: 88, train_loss: 0.7539, test_loss: 1.3713, test_f1: 0.5429
 epoch: 89, train_loss: 0.7462, test_loss: 1.4204, test_f1: 0.5525
 epoch: 90, train_loss: 0.7479, test_loss: 1.4160, test_f1: 0.5401
 epoch: 91, train_loss: 0.7434, test_loss: 1.3896, test_f1: 0.5374
 epoch: 92, train_loss: 0.7402, test_loss: 1.4117, test_f1: 0.5231
 epoch: 93, train_loss: 0.7330, test_loss: 1.4360, test_f1: 0.5365
 epoch: 94, train_loss: 0.7316, test_loss: 1.4237, test_f1: 0.5285
 epoch: 95, train_loss: 0.7360, test_loss: 1.4484, test_f1: 0.5414
 epoch: 96, train_loss: 0.7258, test_loss: 1.4550, test_f1: 0.5389
 epoch: 97, train_loss: 0.7246, test_loss: 1.4226, test_f1: 0.5281
 epoch: 98, train_loss: 0.7317, test_loss: 1.4136, test_f1: 0.5302
 epoch: 99, train_loss: 0.7249, test_loss: 1.4431, test_f1: 0.5343
##################ITERATION #7 ****************************************
 epoch: 0, train_loss: 1.2935, test_loss: 1.3304, test_f1: 0.2490
 epoch: 1, train_loss: 1.2123, test_loss: 1.3221, test_f1: 0.3025
 epoch: 2, train_loss: 1.1932, test_loss: 1.3102, test_f1: 0.3321
 epoch: 3, train_loss: 1.1687, test_loss: 1.2949, test_f1: 0.3665
 epoch: 4, train_loss: 1.1525, test_loss: 1.2778, test_f1: 0.3956
 epoch: 5, train_loss: 1.1237, test_loss: 1.2566, test_f1: 0.4432
 epoch: 6, train_loss: 1.1233, test_loss: 1.2306, test_f1: 0.4509
 epoch: 7, train_loss: 1.1091, test_loss: 1.2092, test_f1: 0.4634
 epoch: 8, train_loss: 1.0861, test_loss: 1.1918, test_f1: 0.4749
 epoch: 9, train_loss: 1.0751, test_loss: 1.1791, test_f1: 0.4807
 epoch: 10, train_loss: 1.0539, test_loss: 1.1706, test_f1: 0.4723
 epoch: 11, train_loss: 1.0503, test_loss: 1.1632, test_f1: 0.4828
 epoch: 12, train_loss: 1.0391, test_loss: 1.1655, test_f1: 0.4920
 epoch: 13, train_loss: 1.0317, test_loss: 1.1615, test_f1: 0.5078
 epoch: 14, train_loss: 1.0242, test_loss: 1.1627, test_f1: 0.5064
 epoch: 15, train_loss: 1.0103, test_loss: 1.1653, test_f1: 0.5184
 epoch: 16, train_loss: 0.9993, test_loss: 1.1684, test_f1: 0.5065
 epoch: 17, train_loss: 1.0013, test_loss: 1.1747, test_f1: 0.5047
 epoch: 18, train_loss: 0.9817, test_loss: 1.1852, test_f1: 0.5322
 epoch: 19, train_loss: 0.9727, test_loss: 1.1879, test_f1: 0.5380
 epoch: 20, train_loss: 0.9802, test_loss: 1.1850, test_f1: 0.5434
 epoch: 21, train_loss: 0.9589, test_loss: 1.1815, test_f1: 0.5408
 epoch: 22, train_loss: 0.9669, test_loss: 1.1792, test_f1: 0.5403
 epoch: 23, train_loss: 0.9541, test_loss: 1.1786, test_f1: 0.5286
 epoch: 24, train_loss: 0.9366, test_loss: 1.1797, test_f1: 0.5344
 epoch: 25, train_loss: 0.9381, test_loss: 1.1904, test_f1: 0.5170
 epoch: 26, train_loss: 0.9302, test_loss: 1.1898, test_f1: 0.5647
 epoch: 27, train_loss: 0.9268, test_loss: 1.1842, test_f1: 0.5830
 epoch: 28, train_loss: 0.9152, test_loss: 1.1745, test_f1: 0.5749
 epoch: 29, train_loss: 0.9149, test_loss: 1.1682, test_f1: 0.5713
 epoch: 30, train_loss: 0.9052, test_loss: 1.1657, test_f1: 0.5612
 epoch: 31, train_loss: 0.9109, test_loss: 1.1777, test_f1: 0.5433
 epoch: 32, train_loss: 0.9032, test_loss: 1.1730, test_f1: 0.5671
 epoch: 33, train_loss: 0.8775, test_loss: 1.1500, test_f1: 0.5794
 epoch: 34, train_loss: 0.8805, test_loss: 1.1467, test_f1: 0.5765
 epoch: 35, train_loss: 0.8833, test_loss: 1.1510, test_f1: 0.5663
 epoch: 36, train_loss: 0.8644, test_loss: 1.1480, test_f1: 0.5615
 epoch: 37, train_loss: 0.8677, test_loss: 1.1438, test_f1: 0.5674
 epoch: 38, train_loss: 0.8618, test_loss: 1.1353, test_f1: 0.5799
 epoch: 39, train_loss: 0.8504, test_loss: 1.1428, test_f1: 0.5774
 epoch: 40, train_loss: 0.8486, test_loss: 1.1687, test_f1: 0.5539
 epoch: 41, train_loss: 0.8382, test_loss: 1.1855, test_f1: 0.5684
 epoch: 42, train_loss: 0.8527, test_loss: 1.1932, test_f1: 0.5663
 epoch: 43, train_loss: 0.8546, test_loss: 1.1837, test_f1: 0.5716
 epoch: 44, train_loss: 0.8306, test_loss: 1.1934, test_f1: 0.5760
 epoch: 45, train_loss: 0.8347, test_loss: 1.2218, test_f1: 0.5637
 epoch: 46, train_loss: 0.8226, test_loss: 1.2412, test_f1: 0.5566
 epoch: 47, train_loss: 0.8147, test_loss: 1.2161, test_f1: 0.5613
 epoch: 48, train_loss: 0.8230, test_loss: 1.1667, test_f1: 0.5515
 epoch: 49, train_loss: 0.8158, test_loss: 1.1843, test_f1: 0.5565
 epoch: 50, train_loss: 0.8160, test_loss: 1.1834, test_f1: 0.5575
 epoch: 51, train_loss: 0.7981, test_loss: 1.1839, test_f1: 0.5612
 epoch: 52, train_loss: 0.8154, test_loss: 1.2000, test_f1: 0.5669
 epoch: 53, train_loss: 0.7970, test_loss: 1.2436, test_f1: 0.5623
 epoch: 54, train_loss: 0.7898, test_loss: 1.2748, test_f1: 0.5708
 epoch: 55, train_loss: 0.8004, test_loss: 1.2629, test_f1: 0.5665
 epoch: 56, train_loss: 0.7934, test_loss: 1.2636, test_f1: 0.5685
 epoch: 57, train_loss: 0.7933, test_loss: 1.2475, test_f1: 0.5636
 epoch: 58, train_loss: 0.7846, test_loss: 1.2448, test_f1: 0.5678
 epoch: 59, train_loss: 0.7903, test_loss: 1.2369, test_f1: 0.5620
 epoch: 60, train_loss: 0.7821, test_loss: 1.2401, test_f1: 0.5488
 epoch: 61, train_loss: 0.7868, test_loss: 1.2512, test_f1: 0.5349
 epoch: 62, train_loss: 0.7765, test_loss: 1.2192, test_f1: 0.5547
 epoch: 63, train_loss: 0.7856, test_loss: 1.2180, test_f1: 0.5684
 epoch: 64, train_loss: 0.7738, test_loss: 1.2207, test_f1: 0.5683
 epoch: 65, train_loss: 0.7790, test_loss: 1.2258, test_f1: 0.5720
 epoch: 66, train_loss: 0.7714, test_loss: 1.2188, test_f1: 0.5742
 epoch: 67, train_loss: 0.7720, test_loss: 1.2358, test_f1: 0.5716
 epoch: 68, train_loss: 0.7658, test_loss: 1.2594, test_f1: 0.5525
 epoch: 69, train_loss: 0.7627, test_loss: 1.2854, test_f1: 0.5459
 epoch: 70, train_loss: 0.7591, test_loss: 1.2811, test_f1: 0.5536
 epoch: 71, train_loss: 0.7660, test_loss: 1.2568, test_f1: 0.5535
 epoch: 72, train_loss: 0.7619, test_loss: 1.2284, test_f1: 0.5546
 epoch: 73, train_loss: 0.7655, test_loss: 1.2201, test_f1: 0.5638
 epoch: 74, train_loss: 0.7584, test_loss: 1.2304, test_f1: 0.5637
 epoch: 75, train_loss: 0.7449, test_loss: 1.2421, test_f1: 0.5641
 epoch: 76, train_loss: 0.7607, test_loss: 1.2522, test_f1: 0.5673
 epoch: 77, train_loss: 0.7549, test_loss: 1.2574, test_f1: 0.5670
 epoch: 78, train_loss: 0.7484, test_loss: 1.2432, test_f1: 0.5636
 epoch: 79, train_loss: 0.7570, test_loss: 1.2482, test_f1: 0.5709
 epoch: 80, train_loss: 0.7484, test_loss: 1.2455, test_f1: 0.5684
 epoch: 81, train_loss: 0.7442, test_loss: 1.2340, test_f1: 0.5668
 epoch: 82, train_loss: 0.7351, test_loss: 1.2400, test_f1: 0.5640
 epoch: 83, train_loss: 0.7467, test_loss: 1.2497, test_f1: 0.5726
 epoch: 84, train_loss: 0.7402, test_loss: 1.2706, test_f1: 0.5629
 epoch: 85, train_loss: 0.7436, test_loss: 1.2763, test_f1: 0.5686
 epoch: 86, train_loss: 0.7401, test_loss: 1.2432, test_f1: 0.5699
 epoch: 87, train_loss: 0.7185, test_loss: 1.2582, test_f1: 0.5679
 epoch: 88, train_loss: 0.7290, test_loss: 1.2708, test_f1: 0.5602
 epoch: 89, train_loss: 0.7316, test_loss: 1.2629, test_f1: 0.5727
 epoch: 90, train_loss: 0.7158, test_loss: 1.2578, test_f1: 0.5624
 epoch: 91, train_loss: 0.7178, test_loss: 1.2723, test_f1: 0.5694
 epoch: 92, train_loss: 0.7111, test_loss: 1.2548, test_f1: 0.5561
 epoch: 93, train_loss: 0.7117, test_loss: 1.2610, test_f1: 0.5539
 epoch: 94, train_loss: 0.7389, test_loss: 1.2678, test_f1: 0.5545
 epoch: 95, train_loss: 0.7100, test_loss: 1.2873, test_f1: 0.5542
 epoch: 96, train_loss: 0.7082, test_loss: 1.2999, test_f1: 0.5605
 epoch: 97, train_loss: 0.7226, test_loss: 1.3097, test_f1: 0.5657
 epoch: 98, train_loss: 0.7173, test_loss: 1.2891, test_f1: 0.5680
 epoch: 99, train_loss: 0.7163, test_loss: 1.2763, test_f1: 0.5682
##################ITERATION #8 ****************************************
 epoch: 0, train_loss: 1.2546, test_loss: 1.3554, test_f1: 0.1531
 epoch: 1, train_loss: 1.1962, test_loss: 1.3361, test_f1: 0.2140
 epoch: 2, train_loss: 1.1716, test_loss: 1.3211, test_f1: 0.2879
 epoch: 3, train_loss: 1.1486, test_loss: 1.2996, test_f1: 0.3482
 epoch: 4, train_loss: 1.1319, test_loss: 1.2702, test_f1: 0.4137
 epoch: 5, train_loss: 1.1286, test_loss: 1.2393, test_f1: 0.4470
 epoch: 6, train_loss: 1.1118, test_loss: 1.2125, test_f1: 0.4475
 epoch: 7, train_loss: 1.0942, test_loss: 1.1855, test_f1: 0.4821
 epoch: 8, train_loss: 1.0797, test_loss: 1.1782, test_f1: 0.4576
 epoch: 9, train_loss: 1.0547, test_loss: 1.1707, test_f1: 0.4710
 epoch: 10, train_loss: 1.0479, test_loss: 1.1716, test_f1: 0.4889
 epoch: 11, train_loss: 1.0367, test_loss: 1.1771, test_f1: 0.5027
 epoch: 12, train_loss: 1.0391, test_loss: 1.1806, test_f1: 0.5071
 epoch: 13, train_loss: 1.0354, test_loss: 1.1659, test_f1: 0.5112
 epoch: 14, train_loss: 1.0153, test_loss: 1.1454, test_f1: 0.5096
 epoch: 15, train_loss: 1.0138, test_loss: 1.1394, test_f1: 0.5099
 epoch: 16, train_loss: 1.0030, test_loss: 1.1410, test_f1: 0.4993
 epoch: 17, train_loss: 0.9887, test_loss: 1.1358, test_f1: 0.5063
 epoch: 18, train_loss: 0.9828, test_loss: 1.1514, test_f1: 0.4931
 epoch: 19, train_loss: 0.9901, test_loss: 1.1648, test_f1: 0.4808
 epoch: 20, train_loss: 0.9579, test_loss: 1.1636, test_f1: 0.4937
 epoch: 21, train_loss: 0.9717, test_loss: 1.1557, test_f1: 0.5068
 epoch: 22, train_loss: 0.9625, test_loss: 1.1503, test_f1: 0.5176
 epoch: 23, train_loss: 0.9549, test_loss: 1.1462, test_f1: 0.5151
 epoch: 24, train_loss: 0.9499, test_loss: 1.1505, test_f1: 0.5025
 epoch: 25, train_loss: 0.9369, test_loss: 1.1483, test_f1: 0.5070
 epoch: 26, train_loss: 0.9351, test_loss: 1.1473, test_f1: 0.5105
 epoch: 27, train_loss: 0.9348, test_loss: 1.1537, test_f1: 0.5298
 epoch: 28, train_loss: 0.9228, test_loss: 1.1584, test_f1: 0.5238
 epoch: 29, train_loss: 0.9315, test_loss: 1.1651, test_f1: 0.5294
 epoch: 30, train_loss: 0.9177, test_loss: 1.1803, test_f1: 0.5036
 epoch: 31, train_loss: 0.9218, test_loss: 1.1868, test_f1: 0.4924
 epoch: 32, train_loss: 0.8990, test_loss: 1.2146, test_f1: 0.4899
 epoch: 33, train_loss: 0.9003, test_loss: 1.1905, test_f1: 0.4937
 epoch: 34, train_loss: 0.9035, test_loss: 1.1893, test_f1: 0.4787
 epoch: 35, train_loss: 0.9001, test_loss: 1.1944, test_f1: 0.4784
 epoch: 36, train_loss: 0.8830, test_loss: 1.1978, test_f1: 0.4713
 epoch: 37, train_loss: 0.8884, test_loss: 1.1725, test_f1: 0.5044
 epoch: 38, train_loss: 0.8870, test_loss: 1.1907, test_f1: 0.5114
 epoch: 39, train_loss: 0.8707, test_loss: 1.2030, test_f1: 0.5234
 epoch: 40, train_loss: 0.8666, test_loss: 1.2102, test_f1: 0.5151
 epoch: 41, train_loss: 0.8680, test_loss: 1.2155, test_f1: 0.5207
 epoch: 42, train_loss: 0.8622, test_loss: 1.2042, test_f1: 0.5146
 epoch: 43, train_loss: 0.8715, test_loss: 1.1977, test_f1: 0.5094
 epoch: 44, train_loss: 0.8679, test_loss: 1.2509, test_f1: 0.4691
 epoch: 45, train_loss: 0.8459, test_loss: 1.2529, test_f1: 0.4777
 epoch: 46, train_loss: 0.8528, test_loss: 1.2348, test_f1: 0.5040
 epoch: 47, train_loss: 0.8493, test_loss: 1.2084, test_f1: 0.5180
 epoch: 48, train_loss: 0.8334, test_loss: 1.2228, test_f1: 0.5281
 epoch: 49, train_loss: 0.8416, test_loss: 1.1977, test_f1: 0.5260
 epoch: 50, train_loss: 0.8291, test_loss: 1.2004, test_f1: 0.5441
 epoch: 51, train_loss: 0.8375, test_loss: 1.2132, test_f1: 0.5469
 epoch: 52, train_loss: 0.8322, test_loss: 1.2199, test_f1: 0.5414
 epoch: 53, train_loss: 0.8345, test_loss: 1.2348, test_f1: 0.5343
 epoch: 54, train_loss: 0.8204, test_loss: 1.2346, test_f1: 0.5313
 epoch: 55, train_loss: 0.8288, test_loss: 1.2470, test_f1: 0.5211
 epoch: 56, train_loss: 0.8184, test_loss: 1.2654, test_f1: 0.5189
 epoch: 57, train_loss: 0.8246, test_loss: 1.2627, test_f1: 0.5069
 epoch: 58, train_loss: 0.8263, test_loss: 1.2951, test_f1: 0.4872
 epoch: 59, train_loss: 0.8221, test_loss: 1.2690, test_f1: 0.4906
 epoch: 60, train_loss: 0.8108, test_loss: 1.2766, test_f1: 0.5181
 epoch: 61, train_loss: 0.8109, test_loss: 1.2649, test_f1: 0.5236
 epoch: 62, train_loss: 0.8085, test_loss: 1.2735, test_f1: 0.5206
 epoch: 63, train_loss: 0.8172, test_loss: 1.2668, test_f1: 0.5204
 epoch: 64, train_loss: 0.7997, test_loss: 1.2642, test_f1: 0.5451
 epoch: 65, train_loss: 0.8084, test_loss: 1.2564, test_f1: 0.5261
 epoch: 66, train_loss: 0.8056, test_loss: 1.2806, test_f1: 0.5067
 epoch: 67, train_loss: 0.8084, test_loss: 1.2771, test_f1: 0.5201
 epoch: 68, train_loss: 0.8022, test_loss: 1.2707, test_f1: 0.4981
 epoch: 69, train_loss: 0.7927, test_loss: 1.2887, test_f1: 0.5173
 epoch: 70, train_loss: 0.7957, test_loss: 1.2677, test_f1: 0.5145
 epoch: 71, train_loss: 0.7911, test_loss: 1.2644, test_f1: 0.5224
 epoch: 72, train_loss: 0.7881, test_loss: 1.2562, test_f1: 0.5399
 epoch: 73, train_loss: 0.8019, test_loss: 1.2737, test_f1: 0.5107
 epoch: 74, train_loss: 0.7860, test_loss: 1.2861, test_f1: 0.5157
 epoch: 75, train_loss: 0.7971, test_loss: 1.2882, test_f1: 0.5228
 epoch: 76, train_loss: 0.7886, test_loss: 1.2802, test_f1: 0.5223
 epoch: 77, train_loss: 0.8096, test_loss: 1.2981, test_f1: 0.5229
 epoch: 78, train_loss: 0.7836, test_loss: 1.3223, test_f1: 0.5253
 epoch: 79, train_loss: 0.7836, test_loss: 1.3813, test_f1: 0.5093
 epoch: 80, train_loss: 0.7905, test_loss: 1.3986, test_f1: 0.5166
 epoch: 81, train_loss: 0.7857, test_loss: 1.3517, test_f1: 0.5099
 epoch: 82, train_loss: 0.7718, test_loss: 1.3245, test_f1: 0.5261
 epoch: 83, train_loss: 0.7577, test_loss: 1.3150, test_f1: 0.5291
 epoch: 84, train_loss: 0.7682, test_loss: 1.2942, test_f1: 0.5203
 epoch: 85, train_loss: 0.7740, test_loss: 1.2927, test_f1: 0.5297
 epoch: 86, train_loss: 0.7647, test_loss: 1.3006, test_f1: 0.5465
 epoch: 87, train_loss: 0.7738, test_loss: 1.3016, test_f1: 0.5521
 epoch: 88, train_loss: 0.7659, test_loss: 1.3164, test_f1: 0.5313
 epoch: 89, train_loss: 0.7716, test_loss: 1.3011, test_f1: 0.5521
 epoch: 90, train_loss: 0.7633, test_loss: 1.3111, test_f1: 0.5646
 epoch: 91, train_loss: 0.7558, test_loss: 1.3091, test_f1: 0.5561
 epoch: 92, train_loss: 0.7609, test_loss: 1.3145, test_f1: 0.5564
 epoch: 93, train_loss: 0.7661, test_loss: 1.3253, test_f1: 0.5509
 epoch: 94, train_loss: 0.7582, test_loss: 1.3170, test_f1: 0.5588
 epoch: 95, train_loss: 0.7666, test_loss: 1.3406, test_f1: 0.5510
 epoch: 96, train_loss: 0.7687, test_loss: 1.3184, test_f1: 0.5601
 epoch: 97, train_loss: 0.7426, test_loss: 1.3171, test_f1: 0.5457
 epoch: 98, train_loss: 0.7572, test_loss: 1.3417, test_f1: 0.5396
 epoch: 99, train_loss: 0.7563, test_loss: 1.3560, test_f1: 0.5321
##################ITERATION #9 ****************************************
 epoch: 0, train_loss: 1.2379, test_loss: 1.3313, test_f1: 0.2426
 epoch: 1, train_loss: 1.1869, test_loss: 1.3367, test_f1: 0.3057
 epoch: 2, train_loss: 1.1686, test_loss: 1.3314, test_f1: 0.3127
 epoch: 3, train_loss: 1.1550, test_loss: 1.3219, test_f1: 0.3480
 epoch: 4, train_loss: 1.1307, test_loss: 1.3058, test_f1: 0.4172
 epoch: 5, train_loss: 1.1115, test_loss: 1.2801, test_f1: 0.4185
 epoch: 6, train_loss: 1.1182, test_loss: 1.2617, test_f1: 0.4186
 epoch: 7, train_loss: 1.0934, test_loss: 1.2471, test_f1: 0.4374
 epoch: 8, train_loss: 1.0842, test_loss: 1.2401, test_f1: 0.4611
 epoch: 9, train_loss: 1.0738, test_loss: 1.2392, test_f1: 0.4844
 epoch: 10, train_loss: 1.0568, test_loss: 1.2308, test_f1: 0.4818
 epoch: 11, train_loss: 1.0663, test_loss: 1.2302, test_f1: 0.4783
 epoch: 12, train_loss: 1.0464, test_loss: 1.2202, test_f1: 0.4953
 epoch: 13, train_loss: 1.0275, test_loss: 1.2315, test_f1: 0.5007
 epoch: 14, train_loss: 1.0270, test_loss: 1.2236, test_f1: 0.5164
 epoch: 15, train_loss: 1.0277, test_loss: 1.2150, test_f1: 0.5180
 epoch: 16, train_loss: 1.0168, test_loss: 1.2149, test_f1: 0.5115
 epoch: 17, train_loss: 1.0031, test_loss: 1.2298, test_f1: 0.5286
 epoch: 18, train_loss: 1.0025, test_loss: 1.2454, test_f1: 0.5256
 epoch: 19, train_loss: 0.9942, test_loss: 1.2307, test_f1: 0.5383
 epoch: 20, train_loss: 0.9824, test_loss: 1.2253, test_f1: 0.5483
 epoch: 21, train_loss: 0.9878, test_loss: 1.2144, test_f1: 0.5581
 epoch: 22, train_loss: 0.9645, test_loss: 1.2130, test_f1: 0.5432
 epoch: 23, train_loss: 0.9527, test_loss: 1.2102, test_f1: 0.5382
 epoch: 24, train_loss: 0.9518, test_loss: 1.2160, test_f1: 0.5435
 epoch: 25, train_loss: 0.9435, test_loss: 1.2122, test_f1: 0.5498
 epoch: 26, train_loss: 0.9421, test_loss: 1.2120, test_f1: 0.5464
 epoch: 27, train_loss: 0.9374, test_loss: 1.2167, test_f1: 0.5531
 epoch: 28, train_loss: 0.9409, test_loss: 1.2139, test_f1: 0.5661
 epoch: 29, train_loss: 0.9292, test_loss: 1.2237, test_f1: 0.5588
 epoch: 30, train_loss: 0.9191, test_loss: 1.2075, test_f1: 0.5692
 epoch: 31, train_loss: 0.9329, test_loss: 1.2251, test_f1: 0.5634
 epoch: 32, train_loss: 0.9042, test_loss: 1.2341, test_f1: 0.5275
 epoch: 33, train_loss: 0.9080, test_loss: 1.2180, test_f1: 0.5268
 epoch: 34, train_loss: 0.9055, test_loss: 1.2821, test_f1: 0.5246
 epoch: 35, train_loss: 0.8970, test_loss: 1.2762, test_f1: 0.5246
 epoch: 36, train_loss: 0.8971, test_loss: 1.2920, test_f1: 0.5391
 epoch: 37, train_loss: 0.8717, test_loss: 1.3096, test_f1: 0.5372
 epoch: 38, train_loss: 0.8842, test_loss: 1.2700, test_f1: 0.5260
 epoch: 39, train_loss: 0.8785, test_loss: 1.2162, test_f1: 0.5372
 epoch: 40, train_loss: 0.8751, test_loss: 1.2315, test_f1: 0.5307
 epoch: 41, train_loss: 0.8729, test_loss: 1.2388, test_f1: 0.5271
 epoch: 42, train_loss: 0.8665, test_loss: 1.2634, test_f1: 0.5288
 epoch: 43, train_loss: 0.8514, test_loss: 1.2820, test_f1: 0.5251
 epoch: 44, train_loss: 0.8484, test_loss: 1.2644, test_f1: 0.5404
 epoch: 45, train_loss: 0.8422, test_loss: 1.2528, test_f1: 0.5506
 epoch: 46, train_loss: 0.8523, test_loss: 1.2479, test_f1: 0.5422
 epoch: 47, train_loss: 0.8426, test_loss: 1.2519, test_f1: 0.5458
 epoch: 48, train_loss: 0.8312, test_loss: 1.2868, test_f1: 0.5386
 epoch: 49, train_loss: 0.8458, test_loss: 1.2862, test_f1: 0.5310
 epoch: 50, train_loss: 0.8290, test_loss: 1.3125, test_f1: 0.5033
 epoch: 51, train_loss: 0.8315, test_loss: 1.3469, test_f1: 0.5107
 epoch: 52, train_loss: 0.8241, test_loss: 1.3734, test_f1: 0.5306
 epoch: 53, train_loss: 0.8240, test_loss: 1.3817, test_f1: 0.5270
 epoch: 54, train_loss: 0.8284, test_loss: 1.3431, test_f1: 0.5170
 epoch: 55, train_loss: 0.8112, test_loss: 1.3664, test_f1: 0.5314
 epoch: 56, train_loss: 0.8322, test_loss: 1.3540, test_f1: 0.5408
 epoch: 57, train_loss: 0.8144, test_loss: 1.3683, test_f1: 0.5068
 epoch: 58, train_loss: 0.8115, test_loss: 1.3701, test_f1: 0.5249
 epoch: 59, train_loss: 0.8069, test_loss: 1.3464, test_f1: 0.5480
 epoch: 60, train_loss: 0.7990, test_loss: 1.3118, test_f1: 0.5380
 epoch: 61, train_loss: 0.8057, test_loss: 1.3246, test_f1: 0.5224
 epoch: 62, train_loss: 0.7977, test_loss: 1.3165, test_f1: 0.5194
 epoch: 63, train_loss: 0.7952, test_loss: 1.2874, test_f1: 0.5334
 epoch: 64, train_loss: 0.8061, test_loss: 1.3306, test_f1: 0.5127
 epoch: 65, train_loss: 0.7873, test_loss: 1.3408, test_f1: 0.5012
 epoch: 66, train_loss: 0.8008, test_loss: 1.3660, test_f1: 0.5247
 epoch: 67, train_loss: 0.7957, test_loss: 1.3590, test_f1: 0.5289
 epoch: 68, train_loss: 0.7820, test_loss: 1.3611, test_f1: 0.5429
 epoch: 69, train_loss: 0.7848, test_loss: 1.3458, test_f1: 0.5516
 epoch: 70, train_loss: 0.7861, test_loss: 1.3699, test_f1: 0.5402
 epoch: 71, train_loss: 0.7913, test_loss: 1.3728, test_f1: 0.5377
 epoch: 72, train_loss: 0.7893, test_loss: 1.3306, test_f1: 0.5357
 epoch: 73, train_loss: 0.7845, test_loss: 1.3526, test_f1: 0.5178
 epoch: 74, train_loss: 0.7849, test_loss: 1.3604, test_f1: 0.5179
 epoch: 75, train_loss: 0.7890, test_loss: 1.3550, test_f1: 0.5369
 epoch: 76, train_loss: 0.7752, test_loss: 1.3247, test_f1: 0.5475
 epoch: 77, train_loss: 0.7790, test_loss: 1.3632, test_f1: 0.5342
 epoch: 78, train_loss: 0.7776, test_loss: 1.3419, test_f1: 0.5396
 epoch: 79, train_loss: 0.7623, test_loss: 1.3665, test_f1: 0.5366
 epoch: 80, train_loss: 0.7738, test_loss: 1.3147, test_f1: 0.5392
 epoch: 81, train_loss: 0.7631, test_loss: 1.3290, test_f1: 0.5213
 epoch: 82, train_loss: 0.7716, test_loss: 1.4068, test_f1: 0.5131
 epoch: 83, train_loss: 0.7616, test_loss: 1.3675, test_f1: 0.5340
 epoch: 84, train_loss: 0.7599, test_loss: 1.3830, test_f1: 0.5398
 epoch: 85, train_loss: 0.7553, test_loss: 1.3667, test_f1: 0.5419
 epoch: 86, train_loss: 0.7627, test_loss: 1.3881, test_f1: 0.5412
 epoch: 87, train_loss: 0.7562, test_loss: 1.4136, test_f1: 0.5326
 epoch: 88, train_loss: 0.7603, test_loss: 1.4452, test_f1: 0.5121
 epoch: 89, train_loss: 0.7588, test_loss: 1.4080, test_f1: 0.5279
 epoch: 90, train_loss: 0.7572, test_loss: 1.3788, test_f1: 0.5255
 epoch: 91, train_loss: 0.7622, test_loss: 1.3649, test_f1: 0.5351
 epoch: 92, train_loss: 0.7435, test_loss: 1.3561, test_f1: 0.5286
 epoch: 93, train_loss: 0.7543, test_loss: 1.3500, test_f1: 0.5179
 epoch: 94, train_loss: 0.7531, test_loss: 1.3730, test_f1: 0.5191
 epoch: 95, train_loss: 0.7453, test_loss: 1.4147, test_f1: 0.5115
 epoch: 96, train_loss: 0.7390, test_loss: 1.3989, test_f1: 0.5191
 epoch: 97, train_loss: 0.7364, test_loss: 1.4216, test_f1: 0.5543
 epoch: 98, train_loss: 0.7338, test_loss: 1.3651, test_f1: 0.5356
 epoch: 99, train_loss: 0.7418, test_loss: 1.4048, test_f1: 0.5411

Training completed in 279.41 seconds
Best F1: 0.6106 at epoch 76
Mean F1 across iterations: 0.5720  0.0218
========================FINAL RESULTS================================
FEGIN weighted F1: 0.6106  0.0218
python main.py --data ltspice_demos --representation component_component --model FEGIN --layers 2 --hiddens 128 --batch_size 256 --lr 0.0001 --emb_size 128 --epochs 100 --save_appendix component_component_L2_H128_BS256_LR0.0001_E128 --no_val
-----



STDERR:
  File "main.py", line 370, in <module>
    main()
  File "main.py", line 254, in main
    dataset = dataset_class(
  File "/home/philip/projects/ltspice_examples_code_repo/Circuit-Completion-Using-GNNs/component_classification_with_link_prediction_head/evaluation/FEGIN/kernel/circuit_datasets.py", line 15, in __init__
    self.data, self.slices = torch.load(self.processed_paths[0])
  File "/home/philip/.local/lib/python3.8/site-packages/torch/serialization.py", line 1040, in load
    warnings.warn(
  File "/usr/lib/python3.8/warnings.py", line 109, in _showwarnmsg
    sw(msg.message, msg.category, msg.filename, msg.lineno,
  File "main.py", line 47, in warn_with_traceback
    traceback.print_stack(file=log)
/home/philip/projects/ltspice_examples_code_repo/Circuit-Completion-Using-GNNs/component_classification_with_link_prediction_head/evaluation/FEGIN/kernel/circuit_datasets.py:15: FutureWarning: You are using `torch.load` with `weights_only=False` (the current default value), which uses the default pickle module implicitly. It is possible to construct malicious pickle data which will execute arbitrary code during unpickling (See https://github.com/pytorch/pytorch/blob/main/SECURITY.md#untrusted-models for more details). In a future release, the default value for `weights_only` will be flipped to `True`. This limits the functions that could be executed during unpickling. Arbitrary objects will no longer be allowed to be loaded via this mode unless they are explicitly allowlisted by the user via `torch.serialization.add_safe_globals`. We recommend you start setting `weights_only=True` for any use case where you don't have full control of the loaded file. Please open an issue on GitHub for any issues related to this experimental feature.
  self.data, self.slices = torch.load(self.processed_paths[0])
