STDOUT:
Results will be saved in /home/philip/projects/ltspice_examples_code_repo/Circuit-Completion-Using-GNNs/component_classification_with_link_prediction_head/evaluation/FEGIN/results/model_FEGIN_dataset_ltspice_examples
Command line input: python main.py --data ltspice_examples --representation component_net --model FEGIN --layers 5 --hiddens 32 --batch_size 128 --lr 0.0001 --emb_size 250 --epochs 100 --save_appendix component_net_L5_H32_BS128_LR0.0001_E250 --no_val
 is saved.
-----
ltspice_examples - FEGIN
Using 5 layers, 32 hidden units, h = 2
Loading component_net representation dataset
ENTERED
Training FEGIN on component_net representation
Train: 3558, Test: 846
##################ITERATION #0 ****************************************
 epoch: 0, train_loss: 1.4192, test_loss: 1.4163, test_f1: 0.1004
 epoch: 1, train_loss: 1.4099, test_loss: 1.4043, test_f1: 0.1004
 epoch: 2, train_loss: 1.4038, test_loss: 1.3990, test_f1: 0.1161
 epoch: 3, train_loss: 1.3974, test_loss: 1.3916, test_f1: 0.1198
 epoch: 4, train_loss: 1.3913, test_loss: 1.3839, test_f1: 0.1123
 epoch: 5, train_loss: 1.3832, test_loss: 1.3763, test_f1: 0.1701
 epoch: 6, train_loss: 1.3755, test_loss: 1.3685, test_f1: 0.2209
 epoch: 7, train_loss: 1.3660, test_loss: 1.3591, test_f1: 0.2818
 epoch: 8, train_loss: 1.3563, test_loss: 1.3479, test_f1: 0.3323
 epoch: 9, train_loss: 1.3456, test_loss: 1.3371, test_f1: 0.3316
 epoch: 10, train_loss: 1.3328, test_loss: 1.3246, test_f1: 0.3334
 epoch: 11, train_loss: 1.3223, test_loss: 1.3112, test_f1: 0.3318
 epoch: 12, train_loss: 1.3076, test_loss: 1.2986, test_f1: 0.3272
 epoch: 13, train_loss: 1.2972, test_loss: 1.2862, test_f1: 0.3260
 epoch: 14, train_loss: 1.2824, test_loss: 1.2734, test_f1: 0.3248
 epoch: 15, train_loss: 1.2719, test_loss: 1.2602, test_f1: 0.3256
 epoch: 16, train_loss: 1.2548, test_loss: 1.2477, test_f1: 0.3300
 epoch: 17, train_loss: 1.2432, test_loss: 1.2382, test_f1: 0.3311
 epoch: 18, train_loss: 1.2327, test_loss: 1.2247, test_f1: 0.3384
 epoch: 19, train_loss: 1.2214, test_loss: 1.2170, test_f1: 0.3445
 epoch: 20, train_loss: 1.2118, test_loss: 1.2055, test_f1: 0.3454
 epoch: 21, train_loss: 1.1973, test_loss: 1.1926, test_f1: 0.3439
 epoch: 22, train_loss: 1.1936, test_loss: 1.1864, test_f1: 0.3686
 epoch: 23, train_loss: 1.1805, test_loss: 1.1788, test_f1: 0.3663
 epoch: 24, train_loss: 1.1740, test_loss: 1.1692, test_f1: 0.3656
 epoch: 25, train_loss: 1.1661, test_loss: 1.1589, test_f1: 0.3818
 epoch: 26, train_loss: 1.1617, test_loss: 1.1495, test_f1: 0.3898
 epoch: 27, train_loss: 1.1540, test_loss: 1.1450, test_f1: 0.3899
 epoch: 28, train_loss: 1.1441, test_loss: 1.1403, test_f1: 0.4176
 epoch: 29, train_loss: 1.1391, test_loss: 1.1322, test_f1: 0.4262
 epoch: 30, train_loss: 1.1263, test_loss: 1.1229, test_f1: 0.4393
 epoch: 31, train_loss: 1.1281, test_loss: 1.1183, test_f1: 0.4516
 epoch: 32, train_loss: 1.1250, test_loss: 1.1108, test_f1: 0.4578
 epoch: 33, train_loss: 1.1134, test_loss: 1.1011, test_f1: 0.4657
 epoch: 34, train_loss: 1.1123, test_loss: 1.0954, test_f1: 0.4589
 epoch: 35, train_loss: 1.1037, test_loss: 1.0877, test_f1: 0.4740
 epoch: 36, train_loss: 1.0939, test_loss: 1.0833, test_f1: 0.4783
 epoch: 37, train_loss: 1.0957, test_loss: 1.0709, test_f1: 0.4918
 epoch: 38, train_loss: 1.0875, test_loss: 1.0642, test_f1: 0.4927
 epoch: 39, train_loss: 1.0760, test_loss: 1.0626, test_f1: 0.4967
 epoch: 40, train_loss: 1.0679, test_loss: 1.0534, test_f1: 0.4998
 epoch: 41, train_loss: 1.0668, test_loss: 1.0488, test_f1: 0.5063
 epoch: 42, train_loss: 1.0575, test_loss: 1.0401, test_f1: 0.5105
 epoch: 43, train_loss: 1.0480, test_loss: 1.0405, test_f1: 0.5242
 epoch: 44, train_loss: 1.0495, test_loss: 1.0317, test_f1: 0.5150
 epoch: 45, train_loss: 1.0360, test_loss: 1.0205, test_f1: 0.5309
 epoch: 46, train_loss: 1.0291, test_loss: 1.0213, test_f1: 0.5152
 epoch: 47, train_loss: 1.0227, test_loss: 1.0079, test_f1: 0.5314
 epoch: 48, train_loss: 1.0226, test_loss: 1.0017, test_f1: 0.5254
 epoch: 49, train_loss: 1.0063, test_loss: 0.9980, test_f1: 0.5117
 epoch: 50, train_loss: 1.0047, test_loss: 0.9909, test_f1: 0.5231
 epoch: 51, train_loss: 1.0024, test_loss: 0.9890, test_f1: 0.5187
 epoch: 52, train_loss: 0.9958, test_loss: 0.9875, test_f1: 0.5202
 epoch: 53, train_loss: 0.9916, test_loss: 0.9804, test_f1: 0.5189
 epoch: 54, train_loss: 0.9807, test_loss: 0.9815, test_f1: 0.5188
 epoch: 55, train_loss: 0.9836, test_loss: 0.9785, test_f1: 0.5189
 epoch: 56, train_loss: 0.9849, test_loss: 0.9741, test_f1: 0.5167
 epoch: 57, train_loss: 0.9759, test_loss: 0.9744, test_f1: 0.5219
 epoch: 58, train_loss: 0.9878, test_loss: 0.9733, test_f1: 0.5275
 epoch: 59, train_loss: 0.9757, test_loss: 0.9696, test_f1: 0.5155
 epoch: 60, train_loss: 0.9704, test_loss: 0.9677, test_f1: 0.5231
 epoch: 61, train_loss: 0.9699, test_loss: 0.9630, test_f1: 0.5231
 epoch: 62, train_loss: 0.9663, test_loss: 0.9606, test_f1: 0.5297
 epoch: 63, train_loss: 0.9713, test_loss: 0.9591, test_f1: 0.5215
 epoch: 64, train_loss: 0.9685, test_loss: 0.9596, test_f1: 0.5242
 epoch: 65, train_loss: 0.9606, test_loss: 0.9546, test_f1: 0.5295
 epoch: 66, train_loss: 0.9566, test_loss: 0.9502, test_f1: 0.5240
 epoch: 67, train_loss: 0.9595, test_loss: 0.9494, test_f1: 0.5273
 epoch: 68, train_loss: 0.9490, test_loss: 0.9488, test_f1: 0.5352
 epoch: 69, train_loss: 0.9609, test_loss: 0.9461, test_f1: 0.5368
 epoch: 70, train_loss: 0.9536, test_loss: 0.9462, test_f1: 0.5280
 epoch: 71, train_loss: 0.9571, test_loss: 0.9408, test_f1: 0.5308
 epoch: 72, train_loss: 0.9439, test_loss: 0.9443, test_f1: 0.5356
 epoch: 73, train_loss: 0.9441, test_loss: 0.9376, test_f1: 0.5347
 epoch: 74, train_loss: 0.9436, test_loss: 0.9370, test_f1: 0.5351
 epoch: 75, train_loss: 0.9459, test_loss: 0.9364, test_f1: 0.5320
 epoch: 76, train_loss: 0.9276, test_loss: 0.9387, test_f1: 0.5391
 epoch: 77, train_loss: 0.9310, test_loss: 0.9355, test_f1: 0.5397
 epoch: 78, train_loss: 0.9293, test_loss: 0.9341, test_f1: 0.5397
 epoch: 79, train_loss: 0.9250, test_loss: 0.9347, test_f1: 0.5349
 epoch: 80, train_loss: 0.9256, test_loss: 0.9330, test_f1: 0.5239
 epoch: 81, train_loss: 0.9178, test_loss: 0.9281, test_f1: 0.5358
 epoch: 82, train_loss: 0.9309, test_loss: 0.9275, test_f1: 0.5346
 epoch: 83, train_loss: 0.9290, test_loss: 0.9301, test_f1: 0.5373
 epoch: 84, train_loss: 0.9207, test_loss: 0.9254, test_f1: 0.5374
 epoch: 85, train_loss: 0.9184, test_loss: 0.9229, test_f1: 0.5211
 epoch: 86, train_loss: 0.9180, test_loss: 0.9183, test_f1: 0.5254
 epoch: 87, train_loss: 0.9136, test_loss: 0.9216, test_f1: 0.5369
 epoch: 88, train_loss: 0.9145, test_loss: 0.9250, test_f1: 0.5197
 epoch: 89, train_loss: 0.9155, test_loss: 0.9203, test_f1: 0.5364
 epoch: 90, train_loss: 0.9116, test_loss: 0.9147, test_f1: 0.5356
 epoch: 91, train_loss: 0.9156, test_loss: 0.9214, test_f1: 0.5391
 epoch: 92, train_loss: 0.8982, test_loss: 0.9192, test_f1: 0.5174
 epoch: 93, train_loss: 0.9102, test_loss: 0.9221, test_f1: 0.5257
 epoch: 94, train_loss: 0.9009, test_loss: 0.9185, test_f1: 0.5184
 epoch: 95, train_loss: 0.9092, test_loss: 0.9091, test_f1: 0.5210
 epoch: 96, train_loss: 0.9034, test_loss: 0.9117, test_f1: 0.5263
 epoch: 97, train_loss: 0.9037, test_loss: 0.9112, test_f1: 0.5401
 epoch: 98, train_loss: 0.8992, test_loss: 0.9098, test_f1: 0.5193
 epoch: 99, train_loss: 0.8975, test_loss: 0.9193, test_f1: 0.5341
##################ITERATION #1 ****************************************
 epoch: 0, train_loss: 1.3825, test_loss: 1.3899, test_f1: 0.1004
 epoch: 1, train_loss: 1.3580, test_loss: 1.3639, test_f1: 0.1001
 epoch: 2, train_loss: 1.3423, test_loss: 1.3396, test_f1: 0.2885
 epoch: 3, train_loss: 1.3241, test_loss: 1.3198, test_f1: 0.3266
 epoch: 4, train_loss: 1.3079, test_loss: 1.3015, test_f1: 0.3467
 epoch: 5, train_loss: 1.2923, test_loss: 1.2857, test_f1: 0.3350
 epoch: 6, train_loss: 1.2815, test_loss: 1.2714, test_f1: 0.3592
 epoch: 7, train_loss: 1.2671, test_loss: 1.2546, test_f1: 0.3512
 epoch: 8, train_loss: 1.2553, test_loss: 1.2399, test_f1: 0.3534
 epoch: 9, train_loss: 1.2419, test_loss: 1.2259, test_f1: 0.3526
 epoch: 10, train_loss: 1.2329, test_loss: 1.2130, test_f1: 0.3617
 epoch: 11, train_loss: 1.2222, test_loss: 1.1995, test_f1: 0.3674
 epoch: 12, train_loss: 1.2132, test_loss: 1.1854, test_f1: 0.3799
 epoch: 13, train_loss: 1.1986, test_loss: 1.1748, test_f1: 0.3932
 epoch: 14, train_loss: 1.1928, test_loss: 1.1636, test_f1: 0.4045
 epoch: 15, train_loss: 1.1808, test_loss: 1.1513, test_f1: 0.4140
 epoch: 16, train_loss: 1.1728, test_loss: 1.1389, test_f1: 0.4379
 epoch: 17, train_loss: 1.1671, test_loss: 1.1284, test_f1: 0.4407
 epoch: 18, train_loss: 1.1563, test_loss: 1.1187, test_f1: 0.4548
 epoch: 19, train_loss: 1.1427, test_loss: 1.1067, test_f1: 0.4570
 epoch: 20, train_loss: 1.1394, test_loss: 1.0973, test_f1: 0.4563
 epoch: 21, train_loss: 1.1274, test_loss: 1.0856, test_f1: 0.4575
 epoch: 22, train_loss: 1.1226, test_loss: 1.0773, test_f1: 0.4670
 epoch: 23, train_loss: 1.1158, test_loss: 1.0638, test_f1: 0.4741
 epoch: 24, train_loss: 1.1007, test_loss: 1.0560, test_f1: 0.4759
 epoch: 25, train_loss: 1.0933, test_loss: 1.0461, test_f1: 0.4812
 epoch: 26, train_loss: 1.0838, test_loss: 1.0294, test_f1: 0.4726
 epoch: 27, train_loss: 1.0809, test_loss: 1.0220, test_f1: 0.4824
 epoch: 28, train_loss: 1.0750, test_loss: 1.0220, test_f1: 0.4885
 epoch: 29, train_loss: 1.0590, test_loss: 1.0100, test_f1: 0.4916
 epoch: 30, train_loss: 1.0549, test_loss: 0.9971, test_f1: 0.4993
 epoch: 31, train_loss: 1.0528, test_loss: 0.9964, test_f1: 0.5018
 epoch: 32, train_loss: 1.0444, test_loss: 0.9887, test_f1: 0.4946
 epoch: 33, train_loss: 1.0471, test_loss: 0.9869, test_f1: 0.4859
 epoch: 34, train_loss: 1.0295, test_loss: 0.9822, test_f1: 0.4925
 epoch: 35, train_loss: 1.0273, test_loss: 0.9739, test_f1: 0.5106
 epoch: 36, train_loss: 1.0178, test_loss: 0.9731, test_f1: 0.4946
 epoch: 37, train_loss: 1.0188, test_loss: 0.9680, test_f1: 0.5043
 epoch: 38, train_loss: 1.0100, test_loss: 0.9574, test_f1: 0.5015
 epoch: 39, train_loss: 1.0123, test_loss: 0.9608, test_f1: 0.5047
 epoch: 40, train_loss: 1.0025, test_loss: 0.9477, test_f1: 0.4989
 epoch: 41, train_loss: 0.9915, test_loss: 0.9492, test_f1: 0.5028
 epoch: 42, train_loss: 0.9904, test_loss: 0.9467, test_f1: 0.5141
 epoch: 43, train_loss: 0.9927, test_loss: 0.9467, test_f1: 0.5253
 epoch: 44, train_loss: 0.9761, test_loss: 0.9536, test_f1: 0.5042
 epoch: 45, train_loss: 0.9809, test_loss: 0.9406, test_f1: 0.5178
 epoch: 46, train_loss: 0.9712, test_loss: 0.9378, test_f1: 0.5140
 epoch: 47, train_loss: 0.9706, test_loss: 0.9305, test_f1: 0.5137
 epoch: 48, train_loss: 0.9667, test_loss: 0.9333, test_f1: 0.5181
 epoch: 49, train_loss: 0.9616, test_loss: 0.9347, test_f1: 0.5232
 epoch: 50, train_loss: 0.9611, test_loss: 0.9313, test_f1: 0.5247
 epoch: 51, train_loss: 0.9497, test_loss: 0.9323, test_f1: 0.5191
 epoch: 52, train_loss: 0.9560, test_loss: 0.9285, test_f1: 0.5231
 epoch: 53, train_loss: 0.9506, test_loss: 0.9249, test_f1: 0.5221
 epoch: 54, train_loss: 0.9492, test_loss: 0.9289, test_f1: 0.5153
 epoch: 55, train_loss: 0.9491, test_loss: 0.9234, test_f1: 0.5184
 epoch: 56, train_loss: 0.9433, test_loss: 0.9276, test_f1: 0.5274
 epoch: 57, train_loss: 0.9432, test_loss: 0.9256, test_f1: 0.5211
 epoch: 58, train_loss: 0.9412, test_loss: 0.9292, test_f1: 0.5255
 epoch: 59, train_loss: 0.9389, test_loss: 0.9282, test_f1: 0.5200
 epoch: 60, train_loss: 0.9320, test_loss: 0.9237, test_f1: 0.5247
 epoch: 61, train_loss: 0.9395, test_loss: 0.9236, test_f1: 0.5214
 epoch: 62, train_loss: 0.9335, test_loss: 0.9261, test_f1: 0.5216
 epoch: 63, train_loss: 0.9276, test_loss: 0.9222, test_f1: 0.5298
 epoch: 64, train_loss: 0.9394, test_loss: 0.9293, test_f1: 0.5260
 epoch: 65, train_loss: 0.9303, test_loss: 0.9212, test_f1: 0.5294
 epoch: 66, train_loss: 0.9310, test_loss: 0.9216, test_f1: 0.5292
 epoch: 67, train_loss: 0.9317, test_loss: 0.9258, test_f1: 0.5294
 epoch: 68, train_loss: 0.9315, test_loss: 0.9256, test_f1: 0.5304
 epoch: 69, train_loss: 0.9231, test_loss: 0.9242, test_f1: 0.5240
 epoch: 70, train_loss: 0.9259, test_loss: 0.9185, test_f1: 0.5334
 epoch: 71, train_loss: 0.9248, test_loss: 0.9209, test_f1: 0.5286
 epoch: 72, train_loss: 0.9262, test_loss: 0.9202, test_f1: 0.5245
 epoch: 73, train_loss: 0.9265, test_loss: 0.9233, test_f1: 0.5351
 epoch: 74, train_loss: 0.9277, test_loss: 0.9253, test_f1: 0.5293
 epoch: 75, train_loss: 0.9260, test_loss: 0.9272, test_f1: 0.5195
 epoch: 76, train_loss: 0.9213, test_loss: 0.9211, test_f1: 0.5377
 epoch: 77, train_loss: 0.9239, test_loss: 0.9233, test_f1: 0.5248
 epoch: 78, train_loss: 0.9179, test_loss: 0.9186, test_f1: 0.5296
 epoch: 79, train_loss: 0.9158, test_loss: 0.9223, test_f1: 0.5209
 epoch: 80, train_loss: 0.9088, test_loss: 0.9170, test_f1: 0.5379
 epoch: 81, train_loss: 0.9126, test_loss: 0.9146, test_f1: 0.5365
 epoch: 82, train_loss: 0.9167, test_loss: 0.9178, test_f1: 0.5314
 epoch: 83, train_loss: 0.9029, test_loss: 0.9108, test_f1: 0.5393
 epoch: 84, train_loss: 0.9029, test_loss: 0.9130, test_f1: 0.5355
 epoch: 85, train_loss: 0.9159, test_loss: 0.9182, test_f1: 0.5378
 epoch: 86, train_loss: 0.9065, test_loss: 0.9180, test_f1: 0.5321
 epoch: 87, train_loss: 0.9064, test_loss: 0.9152, test_f1: 0.5314
 epoch: 88, train_loss: 0.9039, test_loss: 0.9242, test_f1: 0.5359
 epoch: 89, train_loss: 0.9111, test_loss: 0.9207, test_f1: 0.5283
 epoch: 90, train_loss: 0.9086, test_loss: 0.9171, test_f1: 0.5444
 epoch: 91, train_loss: 0.9000, test_loss: 0.9248, test_f1: 0.5297
 epoch: 92, train_loss: 0.9119, test_loss: 0.9151, test_f1: 0.5292
 epoch: 93, train_loss: 0.8994, test_loss: 0.9211, test_f1: 0.5233
 epoch: 94, train_loss: 0.9082, test_loss: 0.9170, test_f1: 0.5331
 epoch: 95, train_loss: 0.8900, test_loss: 0.9283, test_f1: 0.5200
 epoch: 96, train_loss: 0.8955, test_loss: 0.9174, test_f1: 0.5350
 epoch: 97, train_loss: 0.8953, test_loss: 0.9154, test_f1: 0.5207
 epoch: 98, train_loss: 0.9073, test_loss: 0.9247, test_f1: 0.5322
 epoch: 99, train_loss: 0.8927, test_loss: 0.9272, test_f1: 0.5241
##################ITERATION #2 ****************************************
 epoch: 0, train_loss: 1.3339, test_loss: 1.3495, test_f1: 0.2270
 epoch: 1, train_loss: 1.3014, test_loss: 1.3248, test_f1: 0.2270
 epoch: 2, train_loss: 1.2869, test_loss: 1.2934, test_f1: 0.2270
 epoch: 3, train_loss: 1.2753, test_loss: 1.2732, test_f1: 0.2439
 epoch: 4, train_loss: 1.2631, test_loss: 1.2577, test_f1: 0.2611
 epoch: 5, train_loss: 1.2498, test_loss: 1.2450, test_f1: 0.2760
 epoch: 6, train_loss: 1.2448, test_loss: 1.2378, test_f1: 0.2915
 epoch: 7, train_loss: 1.2319, test_loss: 1.2254, test_f1: 0.2986
 epoch: 8, train_loss: 1.2210, test_loss: 1.2143, test_f1: 0.3164
 epoch: 9, train_loss: 1.2149, test_loss: 1.1982, test_f1: 0.3268
 epoch: 10, train_loss: 1.2069, test_loss: 1.1918, test_f1: 0.3615
 epoch: 11, train_loss: 1.1933, test_loss: 1.1828, test_f1: 0.3654
 epoch: 12, train_loss: 1.1854, test_loss: 1.1666, test_f1: 0.3732
 epoch: 13, train_loss: 1.1781, test_loss: 1.1552, test_f1: 0.3801
 epoch: 14, train_loss: 1.1643, test_loss: 1.1442, test_f1: 0.3898
 epoch: 15, train_loss: 1.1539, test_loss: 1.1360, test_f1: 0.3916
 epoch: 16, train_loss: 1.1432, test_loss: 1.1265, test_f1: 0.4082
 epoch: 17, train_loss: 1.1364, test_loss: 1.1127, test_f1: 0.4342
 epoch: 18, train_loss: 1.1248, test_loss: 1.1032, test_f1: 0.4401
 epoch: 19, train_loss: 1.1204, test_loss: 1.0932, test_f1: 0.4496
 epoch: 20, train_loss: 1.1092, test_loss: 1.0819, test_f1: 0.4561
 epoch: 21, train_loss: 1.0938, test_loss: 1.0680, test_f1: 0.4655
 epoch: 22, train_loss: 1.0968, test_loss: 1.0641, test_f1: 0.4581
 epoch: 23, train_loss: 1.0840, test_loss: 1.0529, test_f1: 0.4699
 epoch: 24, train_loss: 1.0781, test_loss: 1.0455, test_f1: 0.4612
 epoch: 25, train_loss: 1.0608, test_loss: 1.0355, test_f1: 0.4597
 epoch: 26, train_loss: 1.0618, test_loss: 1.0292, test_f1: 0.4655
 epoch: 27, train_loss: 1.0522, test_loss: 1.0210, test_f1: 0.4646
 epoch: 28, train_loss: 1.0482, test_loss: 1.0090, test_f1: 0.4723
 epoch: 29, train_loss: 1.0455, test_loss: 1.0083, test_f1: 0.4656
 epoch: 30, train_loss: 1.0373, test_loss: 1.0001, test_f1: 0.4639
 epoch: 31, train_loss: 1.0324, test_loss: 0.9933, test_f1: 0.4735
 epoch: 32, train_loss: 1.0274, test_loss: 0.9821, test_f1: 0.4723
 epoch: 33, train_loss: 1.0111, test_loss: 0.9790, test_f1: 0.4760
 epoch: 34, train_loss: 1.0064, test_loss: 0.9791, test_f1: 0.4770
 epoch: 35, train_loss: 1.0072, test_loss: 0.9789, test_f1: 0.4724
 epoch: 36, train_loss: 1.0010, test_loss: 0.9759, test_f1: 0.4831
 epoch: 37, train_loss: 1.0017, test_loss: 0.9747, test_f1: 0.4691
 epoch: 38, train_loss: 0.9951, test_loss: 0.9739, test_f1: 0.4811
 epoch: 39, train_loss: 0.9909, test_loss: 0.9663, test_f1: 0.4806
 epoch: 40, train_loss: 0.9894, test_loss: 0.9628, test_f1: 0.4709
 epoch: 41, train_loss: 0.9803, test_loss: 0.9584, test_f1: 0.4848
 epoch: 42, train_loss: 0.9729, test_loss: 0.9659, test_f1: 0.4885
 epoch: 43, train_loss: 0.9802, test_loss: 0.9623, test_f1: 0.4876
 epoch: 44, train_loss: 0.9705, test_loss: 0.9608, test_f1: 0.4863
 epoch: 45, train_loss: 0.9744, test_loss: 0.9651, test_f1: 0.4875
 epoch: 46, train_loss: 0.9682, test_loss: 0.9633, test_f1: 0.4870
 epoch: 47, train_loss: 0.9618, test_loss: 0.9457, test_f1: 0.4956
 epoch: 48, train_loss: 0.9631, test_loss: 0.9543, test_f1: 0.5048
 epoch: 49, train_loss: 0.9595, test_loss: 0.9433, test_f1: 0.4933
 epoch: 50, train_loss: 0.9440, test_loss: 0.9559, test_f1: 0.4846
 epoch: 51, train_loss: 0.9465, test_loss: 0.9433, test_f1: 0.4977
 epoch: 52, train_loss: 0.9514, test_loss: 0.9392, test_f1: 0.4964
 epoch: 53, train_loss: 0.9459, test_loss: 0.9531, test_f1: 0.5016
 epoch: 54, train_loss: 0.9539, test_loss: 0.9436, test_f1: 0.5066
 epoch: 55, train_loss: 0.9403, test_loss: 0.9475, test_f1: 0.5105
 epoch: 56, train_loss: 0.9417, test_loss: 0.9443, test_f1: 0.5078
 epoch: 57, train_loss: 0.9402, test_loss: 0.9500, test_f1: 0.5069
 epoch: 58, train_loss: 0.9390, test_loss: 0.9429, test_f1: 0.5144
 epoch: 59, train_loss: 0.9356, test_loss: 0.9421, test_f1: 0.4938
 epoch: 60, train_loss: 0.9413, test_loss: 0.9487, test_f1: 0.5086
 epoch: 61, train_loss: 0.9338, test_loss: 0.9437, test_f1: 0.5005
 epoch: 62, train_loss: 0.9310, test_loss: 0.9390, test_f1: 0.5068
 epoch: 63, train_loss: 0.9263, test_loss: 0.9400, test_f1: 0.5098
 epoch: 64, train_loss: 0.9357, test_loss: 0.9388, test_f1: 0.5123
 epoch: 65, train_loss: 0.9322, test_loss: 0.9360, test_f1: 0.5103
 epoch: 66, train_loss: 0.9232, test_loss: 0.9385, test_f1: 0.5102
 epoch: 67, train_loss: 0.9211, test_loss: 0.9339, test_f1: 0.5146
 epoch: 68, train_loss: 0.9268, test_loss: 0.9389, test_f1: 0.5067
 epoch: 69, train_loss: 0.9192, test_loss: 0.9415, test_f1: 0.5078
 epoch: 70, train_loss: 0.9237, test_loss: 0.9375, test_f1: 0.5062
 epoch: 71, train_loss: 0.9248, test_loss: 0.9435, test_f1: 0.5030
 epoch: 72, train_loss: 0.9209, test_loss: 0.9360, test_f1: 0.5157
 epoch: 73, train_loss: 0.9213, test_loss: 0.9537, test_f1: 0.4976
 epoch: 74, train_loss: 0.9200, test_loss: 0.9359, test_f1: 0.5109
 epoch: 75, train_loss: 0.9134, test_loss: 0.9365, test_f1: 0.5109
 epoch: 76, train_loss: 0.9177, test_loss: 0.9366, test_f1: 0.5095
 epoch: 77, train_loss: 0.9193, test_loss: 0.9307, test_f1: 0.5172
 epoch: 78, train_loss: 0.9083, test_loss: 0.9294, test_f1: 0.5133
 epoch: 79, train_loss: 0.9257, test_loss: 0.9324, test_f1: 0.5087
 epoch: 80, train_loss: 0.9105, test_loss: 0.9369, test_f1: 0.5145
 epoch: 81, train_loss: 0.9114, test_loss: 0.9325, test_f1: 0.5174
 epoch: 82, train_loss: 0.9200, test_loss: 0.9325, test_f1: 0.5121
 epoch: 83, train_loss: 0.9148, test_loss: 0.9370, test_f1: 0.5131
 epoch: 84, train_loss: 0.9040, test_loss: 0.9469, test_f1: 0.5032
 epoch: 85, train_loss: 0.9128, test_loss: 0.9347, test_f1: 0.5142
 epoch: 86, train_loss: 0.9171, test_loss: 0.9247, test_f1: 0.5135
 epoch: 87, train_loss: 0.9090, test_loss: 0.9297, test_f1: 0.5158
 epoch: 88, train_loss: 0.9002, test_loss: 0.9330, test_f1: 0.5121
 epoch: 89, train_loss: 0.9074, test_loss: 0.9378, test_f1: 0.5083
 epoch: 90, train_loss: 0.8996, test_loss: 0.9358, test_f1: 0.5181
 epoch: 91, train_loss: 0.8988, test_loss: 0.9410, test_f1: 0.5154
 epoch: 92, train_loss: 0.8966, test_loss: 0.9334, test_f1: 0.5147
 epoch: 93, train_loss: 0.8927, test_loss: 0.9316, test_f1: 0.5110
 epoch: 94, train_loss: 0.9023, test_loss: 0.9255, test_f1: 0.5222
 epoch: 95, train_loss: 0.9171, test_loss: 0.9317, test_f1: 0.5190
 epoch: 96, train_loss: 0.8998, test_loss: 0.9333, test_f1: 0.5163
 epoch: 97, train_loss: 0.8983, test_loss: 0.9372, test_f1: 0.5099
 epoch: 98, train_loss: 0.9016, test_loss: 0.9378, test_f1: 0.5119
 epoch: 99, train_loss: 0.8939, test_loss: 0.9260, test_f1: 0.5158
##################ITERATION #3 ****************************************
 epoch: 0, train_loss: 1.3134, test_loss: 1.3452, test_f1: 0.2270
 epoch: 1, train_loss: 1.2815, test_loss: 1.3096, test_f1: 0.2260
 epoch: 2, train_loss: 1.2636, test_loss: 1.2664, test_f1: 0.2270
 epoch: 3, train_loss: 1.2487, test_loss: 1.2391, test_f1: 0.2270
 epoch: 4, train_loss: 1.2360, test_loss: 1.2228, test_f1: 0.2416
 epoch: 5, train_loss: 1.2270, test_loss: 1.2096, test_f1: 0.2484
 epoch: 6, train_loss: 1.2178, test_loss: 1.1985, test_f1: 0.3003
 epoch: 7, train_loss: 1.2049, test_loss: 1.1831, test_f1: 0.3181
 epoch: 8, train_loss: 1.1990, test_loss: 1.1706, test_f1: 0.3460
 epoch: 9, train_loss: 1.1808, test_loss: 1.1571, test_f1: 0.3610
 epoch: 10, train_loss: 1.1768, test_loss: 1.1464, test_f1: 0.3914
 epoch: 11, train_loss: 1.1641, test_loss: 1.1339, test_f1: 0.3981
 epoch: 12, train_loss: 1.1589, test_loss: 1.1224, test_f1: 0.4181
 epoch: 13, train_loss: 1.1494, test_loss: 1.1092, test_f1: 0.4273
 epoch: 14, train_loss: 1.1431, test_loss: 1.1020, test_f1: 0.4351
 epoch: 15, train_loss: 1.1295, test_loss: 1.0903, test_f1: 0.4427
 epoch: 16, train_loss: 1.1201, test_loss: 1.0775, test_f1: 0.4326
 epoch: 17, train_loss: 1.1157, test_loss: 1.0756, test_f1: 0.4337
 epoch: 18, train_loss: 1.0972, test_loss: 1.0574, test_f1: 0.4379
 epoch: 19, train_loss: 1.0962, test_loss: 1.0563, test_f1: 0.4390
 epoch: 20, train_loss: 1.0893, test_loss: 1.0462, test_f1: 0.4440
 epoch: 21, train_loss: 1.0804, test_loss: 1.0454, test_f1: 0.4486
 epoch: 22, train_loss: 1.0711, test_loss: 1.0319, test_f1: 0.4605
 epoch: 23, train_loss: 1.0618, test_loss: 1.0231, test_f1: 0.4569
 epoch: 24, train_loss: 1.0527, test_loss: 1.0203, test_f1: 0.4527
 epoch: 25, train_loss: 1.0427, test_loss: 1.0159, test_f1: 0.4539
 epoch: 26, train_loss: 1.0501, test_loss: 1.0033, test_f1: 0.4741
 epoch: 27, train_loss: 1.0349, test_loss: 0.9995, test_f1: 0.4655
 epoch: 28, train_loss: 1.0260, test_loss: 0.9998, test_f1: 0.4690
 epoch: 29, train_loss: 1.0282, test_loss: 0.9940, test_f1: 0.4717
 epoch: 30, train_loss: 1.0107, test_loss: 0.9849, test_f1: 0.4653
 epoch: 31, train_loss: 1.0066, test_loss: 0.9878, test_f1: 0.4709
 epoch: 32, train_loss: 0.9983, test_loss: 0.9826, test_f1: 0.4827
 epoch: 33, train_loss: 0.9969, test_loss: 0.9883, test_f1: 0.4737
 epoch: 34, train_loss: 1.0031, test_loss: 0.9793, test_f1: 0.4877
 epoch: 35, train_loss: 0.9936, test_loss: 0.9796, test_f1: 0.4787
 epoch: 36, train_loss: 0.9849, test_loss: 0.9791, test_f1: 0.4790
 epoch: 37, train_loss: 0.9784, test_loss: 0.9745, test_f1: 0.4869
 epoch: 38, train_loss: 0.9800, test_loss: 0.9778, test_f1: 0.4768
 epoch: 39, train_loss: 0.9724, test_loss: 0.9751, test_f1: 0.4812
 epoch: 40, train_loss: 0.9647, test_loss: 0.9703, test_f1: 0.4908
 epoch: 41, train_loss: 0.9585, test_loss: 0.9650, test_f1: 0.4951
 epoch: 42, train_loss: 0.9529, test_loss: 0.9650, test_f1: 0.4905
 epoch: 43, train_loss: 0.9531, test_loss: 0.9718, test_f1: 0.4836
 epoch: 44, train_loss: 0.9561, test_loss: 0.9654, test_f1: 0.4921
 epoch: 45, train_loss: 0.9451, test_loss: 0.9628, test_f1: 0.4880
 epoch: 46, train_loss: 0.9472, test_loss: 0.9691, test_f1: 0.4903
 epoch: 47, train_loss: 0.9401, test_loss: 0.9613, test_f1: 0.4915
 epoch: 48, train_loss: 0.9355, test_loss: 0.9552, test_f1: 0.4918
 epoch: 49, train_loss: 0.9428, test_loss: 0.9584, test_f1: 0.4922
 epoch: 50, train_loss: 0.9378, test_loss: 0.9616, test_f1: 0.4860
 epoch: 51, train_loss: 0.9328, test_loss: 0.9536, test_f1: 0.4931
 epoch: 52, train_loss: 0.9264, test_loss: 0.9543, test_f1: 0.4952
 epoch: 53, train_loss: 0.9310, test_loss: 0.9571, test_f1: 0.4910
 epoch: 54, train_loss: 0.9228, test_loss: 0.9525, test_f1: 0.4972
 epoch: 55, train_loss: 0.9296, test_loss: 0.9582, test_f1: 0.4939
 epoch: 56, train_loss: 0.9138, test_loss: 0.9532, test_f1: 0.5035
 epoch: 57, train_loss: 0.9218, test_loss: 0.9625, test_f1: 0.4893
 epoch: 58, train_loss: 0.9197, test_loss: 0.9530, test_f1: 0.4917
 epoch: 59, train_loss: 0.9140, test_loss: 0.9617, test_f1: 0.4903
 epoch: 60, train_loss: 0.9202, test_loss: 0.9487, test_f1: 0.4976
 epoch: 61, train_loss: 0.9181, test_loss: 0.9544, test_f1: 0.4863
 epoch: 62, train_loss: 0.9131, test_loss: 0.9548, test_f1: 0.4908
 epoch: 63, train_loss: 0.9222, test_loss: 0.9483, test_f1: 0.5062
 epoch: 64, train_loss: 0.9102, test_loss: 0.9473, test_f1: 0.5107
 epoch: 65, train_loss: 0.9170, test_loss: 0.9571, test_f1: 0.4989
 epoch: 66, train_loss: 0.9125, test_loss: 0.9569, test_f1: 0.5057
 epoch: 67, train_loss: 0.9118, test_loss: 0.9644, test_f1: 0.4961
 epoch: 68, train_loss: 0.9074, test_loss: 0.9543, test_f1: 0.5026
 epoch: 69, train_loss: 0.8995, test_loss: 0.9563, test_f1: 0.5013
 epoch: 70, train_loss: 0.9064, test_loss: 0.9553, test_f1: 0.4983
 epoch: 71, train_loss: 0.9035, test_loss: 0.9649, test_f1: 0.4952
 epoch: 72, train_loss: 0.9053, test_loss: 0.9555, test_f1: 0.5100
 epoch: 73, train_loss: 0.9058, test_loss: 0.9593, test_f1: 0.4984
 epoch: 74, train_loss: 0.9041, test_loss: 0.9541, test_f1: 0.4954
 epoch: 75, train_loss: 0.8984, test_loss: 0.9477, test_f1: 0.5122
 epoch: 76, train_loss: 0.8960, test_loss: 0.9640, test_f1: 0.4973
 epoch: 77, train_loss: 0.9020, test_loss: 0.9561, test_f1: 0.5016
 epoch: 78, train_loss: 0.8904, test_loss: 0.9531, test_f1: 0.4998
 epoch: 79, train_loss: 0.8948, test_loss: 0.9580, test_f1: 0.5030
 epoch: 80, train_loss: 0.8978, test_loss: 0.9596, test_f1: 0.5076
 epoch: 81, train_loss: 0.8964, test_loss: 0.9537, test_f1: 0.4968
 epoch: 82, train_loss: 0.8984, test_loss: 0.9606, test_f1: 0.4904
 epoch: 83, train_loss: 0.8941, test_loss: 0.9515, test_f1: 0.5029
 epoch: 84, train_loss: 0.8936, test_loss: 0.9595, test_f1: 0.4971
 epoch: 85, train_loss: 0.8973, test_loss: 0.9499, test_f1: 0.5052
 epoch: 86, train_loss: 0.8814, test_loss: 0.9544, test_f1: 0.5013
 epoch: 87, train_loss: 0.8776, test_loss: 0.9544, test_f1: 0.5155
 epoch: 88, train_loss: 0.8816, test_loss: 0.9546, test_f1: 0.5028
 epoch: 89, train_loss: 0.8859, test_loss: 0.9603, test_f1: 0.5014
 epoch: 90, train_loss: 0.8810, test_loss: 0.9565, test_f1: 0.5118
 epoch: 91, train_loss: 0.8705, test_loss: 0.9559, test_f1: 0.5034
 epoch: 92, train_loss: 0.8771, test_loss: 0.9622, test_f1: 0.5093
 epoch: 93, train_loss: 0.8861, test_loss: 0.9612, test_f1: 0.5022
 epoch: 94, train_loss: 0.8811, test_loss: 0.9629, test_f1: 0.5107
 epoch: 95, train_loss: 0.8787, test_loss: 0.9612, test_f1: 0.5372
 epoch: 96, train_loss: 0.8774, test_loss: 0.9511, test_f1: 0.5323
 epoch: 97, train_loss: 0.8801, test_loss: 0.9677, test_f1: 0.5268
 epoch: 98, train_loss: 0.8848, test_loss: 0.9740, test_f1: 0.5307
 epoch: 99, train_loss: 0.8713, test_loss: 0.9702, test_f1: 0.5310
##################ITERATION #4 ****************************************
 epoch: 0, train_loss: 1.2939, test_loss: 1.3464, test_f1: 0.2270
 epoch: 1, train_loss: 1.2505, test_loss: 1.2699, test_f1: 0.3519
 epoch: 2, train_loss: 1.2420, test_loss: 1.2101, test_f1: 0.3563
 epoch: 3, train_loss: 1.2242, test_loss: 1.1828, test_f1: 0.3721
 epoch: 4, train_loss: 1.2085, test_loss: 1.1644, test_f1: 0.3788
 epoch: 5, train_loss: 1.1996, test_loss: 1.1489, test_f1: 0.3804
 epoch: 6, train_loss: 1.1794, test_loss: 1.1297, test_f1: 0.3925
 epoch: 7, train_loss: 1.1665, test_loss: 1.1130, test_f1: 0.3946
 epoch: 8, train_loss: 1.1529, test_loss: 1.0994, test_f1: 0.4025
 epoch: 9, train_loss: 1.1527, test_loss: 1.0883, test_f1: 0.4186
 epoch: 10, train_loss: 1.1335, test_loss: 1.0738, test_f1: 0.4339
 epoch: 11, train_loss: 1.1282, test_loss: 1.0619, test_f1: 0.4356
 epoch: 12, train_loss: 1.1096, test_loss: 1.0466, test_f1: 0.4414
 epoch: 13, train_loss: 1.1057, test_loss: 1.0368, test_f1: 0.4482
 epoch: 14, train_loss: 1.0933, test_loss: 1.0215, test_f1: 0.4575
 epoch: 15, train_loss: 1.0827, test_loss: 1.0136, test_f1: 0.4638
 epoch: 16, train_loss: 1.0765, test_loss: 1.0039, test_f1: 0.4586
 epoch: 17, train_loss: 1.0699, test_loss: 0.9924, test_f1: 0.4668
 epoch: 18, train_loss: 1.0591, test_loss: 0.9852, test_f1: 0.4759
 epoch: 19, train_loss: 1.0519, test_loss: 0.9781, test_f1: 0.4854
 epoch: 20, train_loss: 1.0424, test_loss: 0.9703, test_f1: 0.4837
 epoch: 21, train_loss: 1.0369, test_loss: 0.9571, test_f1: 0.4891
 epoch: 22, train_loss: 1.0245, test_loss: 0.9532, test_f1: 0.5019
 epoch: 23, train_loss: 1.0223, test_loss: 0.9547, test_f1: 0.4950
 epoch: 24, train_loss: 1.0080, test_loss: 0.9453, test_f1: 0.4987
 epoch: 25, train_loss: 1.0101, test_loss: 0.9382, test_f1: 0.4995
 epoch: 26, train_loss: 0.9976, test_loss: 0.9379, test_f1: 0.5010
 epoch: 27, train_loss: 0.9940, test_loss: 0.9405, test_f1: 0.5050
 epoch: 28, train_loss: 0.9984, test_loss: 0.9263, test_f1: 0.5080
 epoch: 29, train_loss: 0.9833, test_loss: 0.9267, test_f1: 0.5108
 epoch: 30, train_loss: 0.9745, test_loss: 0.9242, test_f1: 0.5098
 epoch: 31, train_loss: 0.9780, test_loss: 0.9205, test_f1: 0.5099
 epoch: 32, train_loss: 0.9729, test_loss: 0.9198, test_f1: 0.5151
 epoch: 33, train_loss: 0.9605, test_loss: 0.9119, test_f1: 0.5177
 epoch: 34, train_loss: 0.9708, test_loss: 0.9127, test_f1: 0.5263
 epoch: 35, train_loss: 0.9567, test_loss: 0.9069, test_f1: 0.5236
 epoch: 36, train_loss: 0.9587, test_loss: 0.9065, test_f1: 0.5251
 epoch: 37, train_loss: 0.9463, test_loss: 0.9077, test_f1: 0.5215
 epoch: 38, train_loss: 0.9526, test_loss: 0.9050, test_f1: 0.5289
 epoch: 39, train_loss: 0.9375, test_loss: 0.9030, test_f1: 0.5243
 epoch: 40, train_loss: 0.9399, test_loss: 0.9031, test_f1: 0.5221
 epoch: 41, train_loss: 0.9265, test_loss: 0.9034, test_f1: 0.5241
 epoch: 42, train_loss: 0.9375, test_loss: 0.9043, test_f1: 0.5190
 epoch: 43, train_loss: 0.9286, test_loss: 0.9018, test_f1: 0.5240
 epoch: 44, train_loss: 0.9153, test_loss: 0.9063, test_f1: 0.5230
 epoch: 45, train_loss: 0.9248, test_loss: 0.9038, test_f1: 0.5236
 epoch: 46, train_loss: 0.9232, test_loss: 0.9028, test_f1: 0.5209
 epoch: 47, train_loss: 0.9228, test_loss: 0.9065, test_f1: 0.5273
 epoch: 48, train_loss: 0.9128, test_loss: 0.9019, test_f1: 0.5260
 epoch: 49, train_loss: 0.9157, test_loss: 0.8965, test_f1: 0.5268
 epoch: 50, train_loss: 0.9093, test_loss: 0.9049, test_f1: 0.5323
 epoch: 51, train_loss: 0.9145, test_loss: 0.9083, test_f1: 0.5303
 epoch: 52, train_loss: 0.9022, test_loss: 0.8998, test_f1: 0.5284
 epoch: 53, train_loss: 0.8932, test_loss: 0.9029, test_f1: 0.5272
 epoch: 54, train_loss: 0.9066, test_loss: 0.9070, test_f1: 0.5270
 epoch: 55, train_loss: 0.8979, test_loss: 0.9079, test_f1: 0.5280
 epoch: 56, train_loss: 0.8869, test_loss: 0.9060, test_f1: 0.5302
 epoch: 57, train_loss: 0.8985, test_loss: 0.9043, test_f1: 0.5295
 epoch: 58, train_loss: 0.9044, test_loss: 0.9060, test_f1: 0.5260
 epoch: 59, train_loss: 0.8979, test_loss: 0.9025, test_f1: 0.5307
 epoch: 60, train_loss: 0.8914, test_loss: 0.9103, test_f1: 0.5205
 epoch: 61, train_loss: 0.8915, test_loss: 0.9010, test_f1: 0.5225
 epoch: 62, train_loss: 0.8945, test_loss: 0.8995, test_f1: 0.5282
 epoch: 63, train_loss: 0.8891, test_loss: 0.9021, test_f1: 0.5292
 epoch: 64, train_loss: 0.8882, test_loss: 0.9058, test_f1: 0.5226
 epoch: 65, train_loss: 0.8840, test_loss: 0.9088, test_f1: 0.5281
 epoch: 66, train_loss: 0.8899, test_loss: 0.9044, test_f1: 0.5260
 epoch: 67, train_loss: 0.8829, test_loss: 0.9023, test_f1: 0.5311
 epoch: 68, train_loss: 0.8854, test_loss: 0.9044, test_f1: 0.5307
 epoch: 69, train_loss: 0.8811, test_loss: 0.9094, test_f1: 0.5308
 epoch: 70, train_loss: 0.8741, test_loss: 0.9066, test_f1: 0.5272
 epoch: 71, train_loss: 0.8744, test_loss: 0.9081, test_f1: 0.5292
 epoch: 72, train_loss: 0.8779, test_loss: 0.9070, test_f1: 0.5264
 epoch: 73, train_loss: 0.8789, test_loss: 0.9083, test_f1: 0.5285
 epoch: 74, train_loss: 0.8785, test_loss: 0.9073, test_f1: 0.5272
 epoch: 75, train_loss: 0.8725, test_loss: 0.9056, test_f1: 0.5309
 epoch: 76, train_loss: 0.8797, test_loss: 0.9043, test_f1: 0.5321
 epoch: 77, train_loss: 0.8800, test_loss: 0.9063, test_f1: 0.5289
 epoch: 78, train_loss: 0.8687, test_loss: 0.9045, test_f1: 0.5271
 epoch: 79, train_loss: 0.8796, test_loss: 0.9079, test_f1: 0.5287
 epoch: 80, train_loss: 0.8829, test_loss: 0.9087, test_f1: 0.5210
 epoch: 81, train_loss: 0.8679, test_loss: 0.9078, test_f1: 0.5213
 epoch: 82, train_loss: 0.8634, test_loss: 0.9110, test_f1: 0.5284
 epoch: 83, train_loss: 0.8710, test_loss: 0.9046, test_f1: 0.5257
 epoch: 84, train_loss: 0.8754, test_loss: 0.9032, test_f1: 0.5241
 epoch: 85, train_loss: 0.8720, test_loss: 0.9072, test_f1: 0.5241
 epoch: 86, train_loss: 0.8567, test_loss: 0.9046, test_f1: 0.5314
 epoch: 87, train_loss: 0.8589, test_loss: 0.9104, test_f1: 0.5282
 epoch: 88, train_loss: 0.8736, test_loss: 0.9007, test_f1: 0.5311
 epoch: 89, train_loss: 0.8706, test_loss: 0.9056, test_f1: 0.5243
 epoch: 90, train_loss: 0.8685, test_loss: 0.9035, test_f1: 0.5291
 epoch: 91, train_loss: 0.8716, test_loss: 0.9090, test_f1: 0.5256
 epoch: 92, train_loss: 0.8595, test_loss: 0.9053, test_f1: 0.5260
 epoch: 93, train_loss: 0.8462, test_loss: 0.9166, test_f1: 0.5216
 epoch: 94, train_loss: 0.8608, test_loss: 0.9052, test_f1: 0.5325
 epoch: 95, train_loss: 0.8631, test_loss: 0.9080, test_f1: 0.5295
 epoch: 96, train_loss: 0.8497, test_loss: 0.9095, test_f1: 0.5296
 epoch: 97, train_loss: 0.8551, test_loss: 0.9152, test_f1: 0.5278
 epoch: 98, train_loss: 0.8586, test_loss: 0.9184, test_f1: 0.5293
 epoch: 99, train_loss: 0.8532, test_loss: 0.9072, test_f1: 0.5321
##################ITERATION #5 ****************************************
 epoch: 0, train_loss: 1.3018, test_loss: 1.3788, test_f1: 0.2261
 epoch: 1, train_loss: 1.2609, test_loss: 1.2902, test_f1: 0.2760
 epoch: 2, train_loss: 1.2411, test_loss: 1.2304, test_f1: 0.2870
 epoch: 3, train_loss: 1.2297, test_loss: 1.2055, test_f1: 0.2970
 epoch: 4, train_loss: 1.2205, test_loss: 1.1896, test_f1: 0.3327
 epoch: 5, train_loss: 1.2031, test_loss: 1.1737, test_f1: 0.3444
 epoch: 6, train_loss: 1.1919, test_loss: 1.1624, test_f1: 0.3940
 epoch: 7, train_loss: 1.1785, test_loss: 1.1460, test_f1: 0.3969
 epoch: 8, train_loss: 1.1687, test_loss: 1.1314, test_f1: 0.4255
 epoch: 9, train_loss: 1.1641, test_loss: 1.1203, test_f1: 0.4364
 epoch: 10, train_loss: 1.1511, test_loss: 1.1036, test_f1: 0.4503
 epoch: 11, train_loss: 1.1395, test_loss: 1.1005, test_f1: 0.4442
 epoch: 12, train_loss: 1.1314, test_loss: 1.0862, test_f1: 0.4564
 epoch: 13, train_loss: 1.1282, test_loss: 1.0756, test_f1: 0.4529
 epoch: 14, train_loss: 1.1102, test_loss: 1.0665, test_f1: 0.4571
 epoch: 15, train_loss: 1.1032, test_loss: 1.0596, test_f1: 0.4554
 epoch: 16, train_loss: 1.1015, test_loss: 1.0468, test_f1: 0.4748
 epoch: 17, train_loss: 1.0934, test_loss: 1.0447, test_f1: 0.4686
 epoch: 18, train_loss: 1.0775, test_loss: 1.0396, test_f1: 0.4674
 epoch: 19, train_loss: 1.0756, test_loss: 1.0293, test_f1: 0.4627
 epoch: 20, train_loss: 1.0638, test_loss: 1.0186, test_f1: 0.4541
 epoch: 21, train_loss: 1.0603, test_loss: 1.0173, test_f1: 0.4679
 epoch: 22, train_loss: 1.0567, test_loss: 1.0205, test_f1: 0.4514
 epoch: 23, train_loss: 1.0474, test_loss: 1.0124, test_f1: 0.4552
 epoch: 24, train_loss: 1.0375, test_loss: 1.0040, test_f1: 0.4574
 epoch: 25, train_loss: 1.0363, test_loss: 0.9976, test_f1: 0.4610
 epoch: 26, train_loss: 1.0347, test_loss: 0.9979, test_f1: 0.4500
 epoch: 27, train_loss: 1.0302, test_loss: 1.0031, test_f1: 0.4555
 epoch: 28, train_loss: 1.0134, test_loss: 0.9861, test_f1: 0.4651
 epoch: 29, train_loss: 1.0159, test_loss: 0.9879, test_f1: 0.4683
 epoch: 30, train_loss: 1.0058, test_loss: 0.9829, test_f1: 0.4712
 epoch: 31, train_loss: 0.9951, test_loss: 0.9774, test_f1: 0.4621
 epoch: 32, train_loss: 1.0072, test_loss: 0.9807, test_f1: 0.4628
 epoch: 33, train_loss: 0.9972, test_loss: 0.9713, test_f1: 0.4806
 epoch: 34, train_loss: 0.9976, test_loss: 0.9756, test_f1: 0.4724
 epoch: 35, train_loss: 0.9934, test_loss: 0.9706, test_f1: 0.4719
 epoch: 36, train_loss: 0.9877, test_loss: 0.9640, test_f1: 0.4745
 epoch: 37, train_loss: 0.9810, test_loss: 0.9630, test_f1: 0.4747
 epoch: 38, train_loss: 0.9729, test_loss: 0.9735, test_f1: 0.4597
 epoch: 39, train_loss: 0.9731, test_loss: 0.9735, test_f1: 0.4724
 epoch: 40, train_loss: 0.9701, test_loss: 0.9750, test_f1: 0.4612
 epoch: 41, train_loss: 0.9697, test_loss: 0.9587, test_f1: 0.4683
 epoch: 42, train_loss: 0.9659, test_loss: 0.9651, test_f1: 0.4754
 epoch: 43, train_loss: 0.9692, test_loss: 0.9517, test_f1: 0.4831
 epoch: 44, train_loss: 0.9576, test_loss: 0.9582, test_f1: 0.4769
 epoch: 45, train_loss: 0.9486, test_loss: 0.9618, test_f1: 0.4801
 epoch: 46, train_loss: 0.9442, test_loss: 0.9505, test_f1: 0.4782
 epoch: 47, train_loss: 0.9449, test_loss: 0.9494, test_f1: 0.4789
 epoch: 48, train_loss: 0.9524, test_loss: 0.9664, test_f1: 0.4720
 epoch: 49, train_loss: 0.9430, test_loss: 0.9583, test_f1: 0.4634
 epoch: 50, train_loss: 0.9423, test_loss: 0.9571, test_f1: 0.4655
 epoch: 51, train_loss: 0.9367, test_loss: 0.9484, test_f1: 0.4688
 epoch: 52, train_loss: 0.9309, test_loss: 0.9548, test_f1: 0.4635
 epoch: 53, train_loss: 0.9277, test_loss: 0.9616, test_f1: 0.4709
 epoch: 54, train_loss: 0.9301, test_loss: 0.9525, test_f1: 0.4822
 epoch: 55, train_loss: 0.9316, test_loss: 0.9489, test_f1: 0.4825
 epoch: 56, train_loss: 0.9373, test_loss: 0.9537, test_f1: 0.4796
 epoch: 57, train_loss: 0.9317, test_loss: 0.9578, test_f1: 0.4795
 epoch: 58, train_loss: 0.9272, test_loss: 0.9503, test_f1: 0.4821
 epoch: 59, train_loss: 0.9323, test_loss: 0.9491, test_f1: 0.4919
 epoch: 60, train_loss: 0.9172, test_loss: 0.9587, test_f1: 0.4908
 epoch: 61, train_loss: 0.9244, test_loss: 0.9490, test_f1: 0.4856
 epoch: 62, train_loss: 0.9212, test_loss: 0.9544, test_f1: 0.4857
 epoch: 63, train_loss: 0.9264, test_loss: 0.9571, test_f1: 0.4927
 epoch: 64, train_loss: 0.9292, test_loss: 0.9425, test_f1: 0.4939
 epoch: 65, train_loss: 0.9195, test_loss: 0.9561, test_f1: 0.4817
 epoch: 66, train_loss: 0.9165, test_loss: 0.9511, test_f1: 0.4855
 epoch: 67, train_loss: 0.9123, test_loss: 0.9561, test_f1: 0.4914
 epoch: 68, train_loss: 0.9148, test_loss: 0.9565, test_f1: 0.4839
 epoch: 69, train_loss: 0.9110, test_loss: 0.9415, test_f1: 0.4978
 epoch: 70, train_loss: 0.9071, test_loss: 0.9574, test_f1: 0.4783
 epoch: 71, train_loss: 0.9160, test_loss: 0.9403, test_f1: 0.4922
 epoch: 72, train_loss: 0.9131, test_loss: 0.9471, test_f1: 0.4937
 epoch: 73, train_loss: 0.9032, test_loss: 0.9475, test_f1: 0.4905
 epoch: 74, train_loss: 0.9104, test_loss: 0.9568, test_f1: 0.4807
 epoch: 75, train_loss: 0.9125, test_loss: 0.9515, test_f1: 0.4874
 epoch: 76, train_loss: 0.9083, test_loss: 0.9376, test_f1: 0.4913
 epoch: 77, train_loss: 0.9051, test_loss: 0.9597, test_f1: 0.4830
 epoch: 78, train_loss: 0.9133, test_loss: 0.9549, test_f1: 0.4820
 epoch: 79, train_loss: 0.9081, test_loss: 0.9549, test_f1: 0.4830
 epoch: 80, train_loss: 0.9006, test_loss: 0.9429, test_f1: 0.4889
 epoch: 81, train_loss: 0.8961, test_loss: 0.9379, test_f1: 0.5021
 epoch: 82, train_loss: 0.9060, test_loss: 0.9429, test_f1: 0.4892
 epoch: 83, train_loss: 0.9040, test_loss: 0.9424, test_f1: 0.5001
 epoch: 84, train_loss: 0.8999, test_loss: 0.9604, test_f1: 0.4964
 epoch: 85, train_loss: 0.8976, test_loss: 0.9439, test_f1: 0.5036
 epoch: 86, train_loss: 0.9051, test_loss: 0.9517, test_f1: 0.4990
 epoch: 87, train_loss: 0.8893, test_loss: 0.9423, test_f1: 0.4999
 epoch: 88, train_loss: 0.8947, test_loss: 0.9414, test_f1: 0.5040
 epoch: 89, train_loss: 0.9017, test_loss: 0.9450, test_f1: 0.4938
 epoch: 90, train_loss: 0.8862, test_loss: 0.9479, test_f1: 0.4982
 epoch: 91, train_loss: 0.8965, test_loss: 0.9294, test_f1: 0.4921
 epoch: 92, train_loss: 0.8926, test_loss: 0.9302, test_f1: 0.4927
 epoch: 93, train_loss: 0.8976, test_loss: 0.9333, test_f1: 0.5166
 epoch: 94, train_loss: 0.8961, test_loss: 0.9450, test_f1: 0.4950
 epoch: 95, train_loss: 0.8862, test_loss: 0.9353, test_f1: 0.5068
 epoch: 96, train_loss: 0.8982, test_loss: 0.9535, test_f1: 0.5006
 epoch: 97, train_loss: 0.8771, test_loss: 0.9469, test_f1: 0.4993
 epoch: 98, train_loss: 0.8841, test_loss: 0.9494, test_f1: 0.4971
 epoch: 99, train_loss: 0.8762, test_loss: 0.9414, test_f1: 0.5045
##################ITERATION #6 ****************************************
 epoch: 0, train_loss: 1.3299, test_loss: 1.3072, test_f1: 0.2270
 epoch: 1, train_loss: 1.2674, test_loss: 1.2457, test_f1: 0.2760
 epoch: 2, train_loss: 1.2538, test_loss: 1.2159, test_f1: 0.3004
 epoch: 3, train_loss: 1.2281, test_loss: 1.1975, test_f1: 0.3012
 epoch: 4, train_loss: 1.2069, test_loss: 1.1834, test_f1: 0.3116
 epoch: 5, train_loss: 1.1991, test_loss: 1.1721, test_f1: 0.3456
 epoch: 6, train_loss: 1.1892, test_loss: 1.1563, test_f1: 0.3700
 epoch: 7, train_loss: 1.1705, test_loss: 1.1432, test_f1: 0.3979
 epoch: 8, train_loss: 1.1636, test_loss: 1.1281, test_f1: 0.4060
 epoch: 9, train_loss: 1.1582, test_loss: 1.1130, test_f1: 0.4160
 epoch: 10, train_loss: 1.1400, test_loss: 1.1049, test_f1: 0.3992
 epoch: 11, train_loss: 1.1299, test_loss: 1.0923, test_f1: 0.4244
 epoch: 12, train_loss: 1.1238, test_loss: 1.0774, test_f1: 0.4256
 epoch: 13, train_loss: 1.1006, test_loss: 1.0685, test_f1: 0.4344
 epoch: 14, train_loss: 1.1020, test_loss: 1.0567, test_f1: 0.4396
 epoch: 15, train_loss: 1.0970, test_loss: 1.0457, test_f1: 0.4414
 epoch: 16, train_loss: 1.0873, test_loss: 1.0324, test_f1: 0.4493
 epoch: 17, train_loss: 1.0799, test_loss: 1.0252, test_f1: 0.4646
 epoch: 18, train_loss: 1.0663, test_loss: 1.0172, test_f1: 0.4476
 epoch: 19, train_loss: 1.0603, test_loss: 1.0085, test_f1: 0.4685
 epoch: 20, train_loss: 1.0496, test_loss: 1.0092, test_f1: 0.4545
 epoch: 21, train_loss: 1.0503, test_loss: 0.9985, test_f1: 0.4663
 epoch: 22, train_loss: 1.0434, test_loss: 0.9987, test_f1: 0.4688
 epoch: 23, train_loss: 1.0446, test_loss: 0.9961, test_f1: 0.4492
 epoch: 24, train_loss: 1.0337, test_loss: 0.9853, test_f1: 0.4819
 epoch: 25, train_loss: 1.0276, test_loss: 0.9896, test_f1: 0.4709
 epoch: 26, train_loss: 1.0180, test_loss: 0.9849, test_f1: 0.4744
 epoch: 27, train_loss: 1.0163, test_loss: 0.9853, test_f1: 0.4720
 epoch: 28, train_loss: 1.0194, test_loss: 0.9815, test_f1: 0.4820
 epoch: 29, train_loss: 1.0090, test_loss: 0.9768, test_f1: 0.4819
 epoch: 30, train_loss: 1.0115, test_loss: 0.9739, test_f1: 0.4905
 epoch: 31, train_loss: 1.0016, test_loss: 0.9728, test_f1: 0.4887
 epoch: 32, train_loss: 1.0028, test_loss: 0.9755, test_f1: 0.4862
 epoch: 33, train_loss: 0.9939, test_loss: 0.9635, test_f1: 0.4869
 epoch: 34, train_loss: 0.9920, test_loss: 0.9663, test_f1: 0.4855
 epoch: 35, train_loss: 0.9895, test_loss: 0.9808, test_f1: 0.4745
 epoch: 36, train_loss: 0.9766, test_loss: 0.9688, test_f1: 0.4752
 epoch: 37, train_loss: 0.9752, test_loss: 0.9669, test_f1: 0.4810
 epoch: 38, train_loss: 0.9803, test_loss: 0.9723, test_f1: 0.4831
 epoch: 39, train_loss: 0.9666, test_loss: 0.9685, test_f1: 0.4998
 epoch: 40, train_loss: 0.9695, test_loss: 0.9578, test_f1: 0.4935
 epoch: 41, train_loss: 0.9680, test_loss: 0.9852, test_f1: 0.4814
 epoch: 42, train_loss: 0.9707, test_loss: 0.9693, test_f1: 0.4955
 epoch: 43, train_loss: 0.9597, test_loss: 0.9712, test_f1: 0.4813
 epoch: 44, train_loss: 0.9631, test_loss: 0.9637, test_f1: 0.5039
 epoch: 45, train_loss: 0.9573, test_loss: 0.9627, test_f1: 0.5029
 epoch: 46, train_loss: 0.9511, test_loss: 0.9641, test_f1: 0.4948
 epoch: 47, train_loss: 0.9531, test_loss: 0.9710, test_f1: 0.5104
 epoch: 48, train_loss: 0.9603, test_loss: 0.9643, test_f1: 0.5038
 epoch: 49, train_loss: 0.9446, test_loss: 0.9674, test_f1: 0.4961
 epoch: 50, train_loss: 0.9460, test_loss: 0.9643, test_f1: 0.4960
 epoch: 51, train_loss: 0.9457, test_loss: 0.9586, test_f1: 0.5053
 epoch: 52, train_loss: 0.9460, test_loss: 0.9647, test_f1: 0.5134
 epoch: 53, train_loss: 0.9468, test_loss: 0.9620, test_f1: 0.5149
 epoch: 54, train_loss: 0.9358, test_loss: 0.9709, test_f1: 0.4956
 epoch: 55, train_loss: 0.9404, test_loss: 0.9680, test_f1: 0.4989
 epoch: 56, train_loss: 0.9302, test_loss: 0.9664, test_f1: 0.4982
 epoch: 57, train_loss: 0.9420, test_loss: 0.9704, test_f1: 0.4930
 epoch: 58, train_loss: 0.9327, test_loss: 0.9662, test_f1: 0.5006
 epoch: 59, train_loss: 0.9419, test_loss: 0.9720, test_f1: 0.4994
 epoch: 60, train_loss: 0.9351, test_loss: 0.9697, test_f1: 0.5026
 epoch: 61, train_loss: 0.9414, test_loss: 0.9693, test_f1: 0.4956
 epoch: 62, train_loss: 0.9431, test_loss: 0.9656, test_f1: 0.5108
 epoch: 63, train_loss: 0.9402, test_loss: 0.9653, test_f1: 0.5128
 epoch: 64, train_loss: 0.9430, test_loss: 0.9732, test_f1: 0.4983
 epoch: 65, train_loss: 0.9350, test_loss: 0.9744, test_f1: 0.4927
 epoch: 66, train_loss: 0.9339, test_loss: 0.9723, test_f1: 0.5130
 epoch: 67, train_loss: 0.9350, test_loss: 0.9757, test_f1: 0.4992
 epoch: 68, train_loss: 0.9278, test_loss: 0.9684, test_f1: 0.5209
 epoch: 69, train_loss: 0.9265, test_loss: 0.9745, test_f1: 0.4944
 epoch: 70, train_loss: 0.9299, test_loss: 0.9614, test_f1: 0.5085
 epoch: 71, train_loss: 0.9279, test_loss: 0.9729, test_f1: 0.5100
 epoch: 72, train_loss: 0.9257, test_loss: 0.9737, test_f1: 0.5123
 epoch: 73, train_loss: 0.9233, test_loss: 0.9686, test_f1: 0.5120
 epoch: 74, train_loss: 0.9352, test_loss: 0.9724, test_f1: 0.5157
 epoch: 75, train_loss: 0.9144, test_loss: 0.9882, test_f1: 0.4878
 epoch: 76, train_loss: 0.9234, test_loss: 0.9734, test_f1: 0.5244
 epoch: 77, train_loss: 0.9221, test_loss: 0.9773, test_f1: 0.5198
 epoch: 78, train_loss: 0.9234, test_loss: 0.9780, test_f1: 0.5178
 epoch: 79, train_loss: 0.9285, test_loss: 0.9699, test_f1: 0.5237
 epoch: 80, train_loss: 0.9213, test_loss: 0.9652, test_f1: 0.5176
 epoch: 81, train_loss: 0.9206, test_loss: 0.9716, test_f1: 0.5004
 epoch: 82, train_loss: 0.9165, test_loss: 0.9635, test_f1: 0.5099
 epoch: 83, train_loss: 0.9248, test_loss: 0.9817, test_f1: 0.5144
 epoch: 84, train_loss: 0.9139, test_loss: 0.9783, test_f1: 0.5182
 epoch: 85, train_loss: 0.9220, test_loss: 0.9785, test_f1: 0.5199
 epoch: 86, train_loss: 0.9058, test_loss: 0.9733, test_f1: 0.5196
 epoch: 87, train_loss: 0.9150, test_loss: 0.9736, test_f1: 0.5165
 epoch: 88, train_loss: 0.9076, test_loss: 0.9659, test_f1: 0.5030
 epoch: 89, train_loss: 0.9219, test_loss: 0.9811, test_f1: 0.4933
 epoch: 90, train_loss: 0.9084, test_loss: 0.9810, test_f1: 0.5212
 epoch: 91, train_loss: 0.9183, test_loss: 0.9882, test_f1: 0.5081
 epoch: 92, train_loss: 0.9066, test_loss: 0.9775, test_f1: 0.5008
 epoch: 93, train_loss: 0.9208, test_loss: 0.9724, test_f1: 0.5253
 epoch: 94, train_loss: 0.9013, test_loss: 0.9731, test_f1: 0.5171
 epoch: 95, train_loss: 0.9061, test_loss: 0.9743, test_f1: 0.5217
 epoch: 96, train_loss: 0.9150, test_loss: 0.9754, test_f1: 0.5222
 epoch: 97, train_loss: 0.9125, test_loss: 0.9849, test_f1: 0.5173
 epoch: 98, train_loss: 0.9099, test_loss: 0.9748, test_f1: 0.5019
 epoch: 99, train_loss: 0.9090, test_loss: 0.9886, test_f1: 0.5074
##################ITERATION #7 ****************************************
 epoch: 0, train_loss: 1.3326, test_loss: 1.3026, test_f1: 0.2270
 epoch: 1, train_loss: 1.2808, test_loss: 1.2497, test_f1: 0.2461
 epoch: 2, train_loss: 1.2524, test_loss: 1.2228, test_f1: 0.2959
 epoch: 3, train_loss: 1.2288, test_loss: 1.2074, test_f1: 0.3082
 epoch: 4, train_loss: 1.2238, test_loss: 1.1880, test_f1: 0.3191
 epoch: 5, train_loss: 1.2072, test_loss: 1.1712, test_f1: 0.3373
 epoch: 6, train_loss: 1.2001, test_loss: 1.1580, test_f1: 0.3449
 epoch: 7, train_loss: 1.1871, test_loss: 1.1428, test_f1: 0.3711
 epoch: 8, train_loss: 1.1724, test_loss: 1.1298, test_f1: 0.3980
 epoch: 9, train_loss: 1.1618, test_loss: 1.1163, test_f1: 0.3964
 epoch: 10, train_loss: 1.1541, test_loss: 1.1067, test_f1: 0.4107
 epoch: 11, train_loss: 1.1390, test_loss: 1.0950, test_f1: 0.4313
 epoch: 12, train_loss: 1.1344, test_loss: 1.0852, test_f1: 0.4315
 epoch: 13, train_loss: 1.1262, test_loss: 1.0672, test_f1: 0.4370
 epoch: 14, train_loss: 1.1078, test_loss: 1.0626, test_f1: 0.4418
 epoch: 15, train_loss: 1.1018, test_loss: 1.0486, test_f1: 0.4591
 epoch: 16, train_loss: 1.0884, test_loss: 1.0396, test_f1: 0.4619
 epoch: 17, train_loss: 1.0908, test_loss: 1.0353, test_f1: 0.4589
 epoch: 18, train_loss: 1.0835, test_loss: 1.0294, test_f1: 0.4408
 epoch: 19, train_loss: 1.0693, test_loss: 1.0189, test_f1: 0.4441
 epoch: 20, train_loss: 1.0523, test_loss: 1.0114, test_f1: 0.4512
 epoch: 21, train_loss: 1.0472, test_loss: 1.0030, test_f1: 0.4452
 epoch: 22, train_loss: 1.0408, test_loss: 0.9936, test_f1: 0.4576
 epoch: 23, train_loss: 1.0403, test_loss: 0.9871, test_f1: 0.4685
 epoch: 24, train_loss: 1.0261, test_loss: 0.9778, test_f1: 0.4526
 epoch: 25, train_loss: 1.0231, test_loss: 0.9741, test_f1: 0.4649
 epoch: 26, train_loss: 1.0183, test_loss: 0.9699, test_f1: 0.4710
 epoch: 27, train_loss: 1.0180, test_loss: 0.9622, test_f1: 0.4721
 epoch: 28, train_loss: 1.0169, test_loss: 0.9628, test_f1: 0.4686
 epoch: 29, train_loss: 1.0069, test_loss: 0.9552, test_f1: 0.4733
 epoch: 30, train_loss: 1.0012, test_loss: 0.9507, test_f1: 0.4723
 epoch: 31, train_loss: 0.9954, test_loss: 0.9481, test_f1: 0.5032
 epoch: 32, train_loss: 0.9967, test_loss: 0.9452, test_f1: 0.4939
 epoch: 33, train_loss: 0.9865, test_loss: 0.9416, test_f1: 0.4831
 epoch: 34, train_loss: 0.9845, test_loss: 0.9443, test_f1: 0.4776
 epoch: 35, train_loss: 0.9824, test_loss: 0.9362, test_f1: 0.4874
 epoch: 36, train_loss: 0.9683, test_loss: 0.9316, test_f1: 0.4881
 epoch: 37, train_loss: 0.9739, test_loss: 0.9321, test_f1: 0.4888
 epoch: 38, train_loss: 0.9657, test_loss: 0.9273, test_f1: 0.4917
 epoch: 39, train_loss: 0.9627, test_loss: 0.9234, test_f1: 0.4750
 epoch: 40, train_loss: 0.9571, test_loss: 0.9206, test_f1: 0.4911
 epoch: 41, train_loss: 0.9570, test_loss: 0.9193, test_f1: 0.4928
 epoch: 42, train_loss: 0.9526, test_loss: 0.9195, test_f1: 0.4973
 epoch: 43, train_loss: 0.9555, test_loss: 0.9178, test_f1: 0.5103
 epoch: 44, train_loss: 0.9483, test_loss: 0.9146, test_f1: 0.4999
 epoch: 45, train_loss: 0.9405, test_loss: 0.9072, test_f1: 0.4932
 epoch: 46, train_loss: 0.9465, test_loss: 0.9109, test_f1: 0.4951
 epoch: 47, train_loss: 0.9299, test_loss: 0.9103, test_f1: 0.4957
 epoch: 48, train_loss: 0.9377, test_loss: 0.9069, test_f1: 0.4936
 epoch: 49, train_loss: 0.9362, test_loss: 0.9021, test_f1: 0.4991
 epoch: 50, train_loss: 0.9212, test_loss: 0.9062, test_f1: 0.5078
 epoch: 51, train_loss: 0.9291, test_loss: 0.8982, test_f1: 0.5072
 epoch: 52, train_loss: 0.9153, test_loss: 0.8970, test_f1: 0.4971
 epoch: 53, train_loss: 0.9244, test_loss: 0.8974, test_f1: 0.5159
 epoch: 54, train_loss: 0.9164, test_loss: 0.8991, test_f1: 0.4987
 epoch: 55, train_loss: 0.9108, test_loss: 0.8988, test_f1: 0.5116
 epoch: 56, train_loss: 0.9097, test_loss: 0.8985, test_f1: 0.4996
 epoch: 57, train_loss: 0.9178, test_loss: 0.8994, test_f1: 0.5038
 epoch: 58, train_loss: 0.9144, test_loss: 0.9010, test_f1: 0.5034
 epoch: 59, train_loss: 0.9136, test_loss: 0.8995, test_f1: 0.4995
 epoch: 60, train_loss: 0.9112, test_loss: 0.8936, test_f1: 0.5023
 epoch: 61, train_loss: 0.9102, test_loss: 0.8957, test_f1: 0.5156
 epoch: 62, train_loss: 0.9086, test_loss: 0.8966, test_f1: 0.5017
 epoch: 63, train_loss: 0.9140, test_loss: 0.8965, test_f1: 0.5087
 epoch: 64, train_loss: 0.9068, test_loss: 0.8964, test_f1: 0.5054
 epoch: 65, train_loss: 0.9044, test_loss: 0.8957, test_f1: 0.5031
 epoch: 66, train_loss: 0.9066, test_loss: 0.8944, test_f1: 0.5043
 epoch: 67, train_loss: 0.9007, test_loss: 0.8956, test_f1: 0.5110
 epoch: 68, train_loss: 0.9074, test_loss: 0.8953, test_f1: 0.5158
 epoch: 69, train_loss: 0.8988, test_loss: 0.8918, test_f1: 0.5048
 epoch: 70, train_loss: 0.8951, test_loss: 0.8930, test_f1: 0.5020
 epoch: 71, train_loss: 0.9039, test_loss: 0.8920, test_f1: 0.5013
 epoch: 72, train_loss: 0.8928, test_loss: 0.8915, test_f1: 0.4993
 epoch: 73, train_loss: 0.8933, test_loss: 0.8930, test_f1: 0.5096
 epoch: 74, train_loss: 0.9010, test_loss: 0.8877, test_f1: 0.5209
 epoch: 75, train_loss: 0.9061, test_loss: 0.8957, test_f1: 0.5151
 epoch: 76, train_loss: 0.8989, test_loss: 0.8931, test_f1: 0.5092
 epoch: 77, train_loss: 0.8968, test_loss: 0.8886, test_f1: 0.5218
 epoch: 78, train_loss: 0.8984, test_loss: 0.8934, test_f1: 0.5186
 epoch: 79, train_loss: 0.8999, test_loss: 0.8905, test_f1: 0.5237
 epoch: 80, train_loss: 0.8983, test_loss: 0.8888, test_f1: 0.5129
 epoch: 81, train_loss: 0.8895, test_loss: 0.8900, test_f1: 0.5198
 epoch: 82, train_loss: 0.8857, test_loss: 0.8906, test_f1: 0.5269
 epoch: 83, train_loss: 0.8828, test_loss: 0.8888, test_f1: 0.5149
 epoch: 84, train_loss: 0.8937, test_loss: 0.8857, test_f1: 0.5224
 epoch: 85, train_loss: 0.8881, test_loss: 0.8884, test_f1: 0.5284
 epoch: 86, train_loss: 0.8877, test_loss: 0.8890, test_f1: 0.5232
 epoch: 87, train_loss: 0.8876, test_loss: 0.8864, test_f1: 0.5210
 epoch: 88, train_loss: 0.8849, test_loss: 0.8919, test_f1: 0.5225
 epoch: 89, train_loss: 0.8850, test_loss: 0.8847, test_f1: 0.5275
 epoch: 90, train_loss: 0.8730, test_loss: 0.8893, test_f1: 0.5211
 epoch: 91, train_loss: 0.8783, test_loss: 0.8908, test_f1: 0.5188
 epoch: 92, train_loss: 0.8814, test_loss: 0.8854, test_f1: 0.5213
 epoch: 93, train_loss: 0.8723, test_loss: 0.8920, test_f1: 0.5194
 epoch: 94, train_loss: 0.8864, test_loss: 0.8897, test_f1: 0.5180
 epoch: 95, train_loss: 0.8829, test_loss: 0.8909, test_f1: 0.5110
 epoch: 96, train_loss: 0.8807, test_loss: 0.8891, test_f1: 0.5218
 epoch: 97, train_loss: 0.8695, test_loss: 0.8896, test_f1: 0.5163
 epoch: 98, train_loss: 0.8773, test_loss: 0.8890, test_f1: 0.5157
 epoch: 99, train_loss: 0.8786, test_loss: 0.8832, test_f1: 0.5148
##################ITERATION #8 ****************************************
 epoch: 0, train_loss: 1.2987, test_loss: 1.3648, test_f1: 0.2507
 epoch: 1, train_loss: 1.2551, test_loss: 1.2407, test_f1: 0.2747
 epoch: 2, train_loss: 1.2286, test_loss: 1.2053, test_f1: 0.3152
 epoch: 3, train_loss: 1.2079, test_loss: 1.1817, test_f1: 0.3671
 epoch: 4, train_loss: 1.1979, test_loss: 1.1658, test_f1: 0.3878
 epoch: 5, train_loss: 1.1881, test_loss: 1.1531, test_f1: 0.3763
 epoch: 6, train_loss: 1.1656, test_loss: 1.1365, test_f1: 0.3909
 epoch: 7, train_loss: 1.1604, test_loss: 1.1407, test_f1: 0.3830
 epoch: 8, train_loss: 1.1507, test_loss: 1.1268, test_f1: 0.3960
 epoch: 9, train_loss: 1.1418, test_loss: 1.1154, test_f1: 0.4026
 epoch: 10, train_loss: 1.1309, test_loss: 1.1008, test_f1: 0.3969
 epoch: 11, train_loss: 1.1207, test_loss: 1.0825, test_f1: 0.4081
 epoch: 12, train_loss: 1.1172, test_loss: 1.0792, test_f1: 0.4135
 epoch: 13, train_loss: 1.1038, test_loss: 1.0764, test_f1: 0.4303
 epoch: 14, train_loss: 1.1011, test_loss: 1.0688, test_f1: 0.4203
 epoch: 15, train_loss: 1.0924, test_loss: 1.0631, test_f1: 0.4298
 epoch: 16, train_loss: 1.0884, test_loss: 1.0525, test_f1: 0.4448
 epoch: 17, train_loss: 1.0802, test_loss: 1.0501, test_f1: 0.4390
 epoch: 18, train_loss: 1.0597, test_loss: 1.0324, test_f1: 0.4554
 epoch: 19, train_loss: 1.0585, test_loss: 1.0539, test_f1: 0.4441
 epoch: 20, train_loss: 1.0607, test_loss: 1.0315, test_f1: 0.4572
 epoch: 21, train_loss: 1.0511, test_loss: 1.0462, test_f1: 0.4527
 epoch: 22, train_loss: 1.0392, test_loss: 1.0340, test_f1: 0.4524
 epoch: 23, train_loss: 1.0362, test_loss: 1.0235, test_f1: 0.4658
 epoch: 24, train_loss: 1.0327, test_loss: 1.0348, test_f1: 0.4675
 epoch: 25, train_loss: 1.0312, test_loss: 1.0277, test_f1: 0.4546
 epoch: 26, train_loss: 1.0228, test_loss: 1.0220, test_f1: 0.4732
 epoch: 27, train_loss: 1.0206, test_loss: 1.0325, test_f1: 0.4682
 epoch: 28, train_loss: 1.0235, test_loss: 1.0239, test_f1: 0.4748
 epoch: 29, train_loss: 1.0081, test_loss: 1.0182, test_f1: 0.4730
 epoch: 30, train_loss: 1.0018, test_loss: 1.0190, test_f1: 0.4623
 epoch: 31, train_loss: 0.9995, test_loss: 1.0059, test_f1: 0.4832
 epoch: 32, train_loss: 0.9986, test_loss: 1.0009, test_f1: 0.4780
 epoch: 33, train_loss: 0.9958, test_loss: 1.0115, test_f1: 0.4773
 epoch: 34, train_loss: 0.9909, test_loss: 1.0036, test_f1: 0.4759
 epoch: 35, train_loss: 0.9887, test_loss: 0.9821, test_f1: 0.4866
 epoch: 36, train_loss: 0.9815, test_loss: 0.9967, test_f1: 0.4851
 epoch: 37, train_loss: 0.9768, test_loss: 0.9998, test_f1: 0.4857
 epoch: 38, train_loss: 0.9933, test_loss: 1.0090, test_f1: 0.4809
 epoch: 39, train_loss: 0.9804, test_loss: 0.9858, test_f1: 0.4853
 epoch: 40, train_loss: 0.9730, test_loss: 0.9914, test_f1: 0.4950
 epoch: 41, train_loss: 0.9649, test_loss: 1.0134, test_f1: 0.4809
 epoch: 42, train_loss: 0.9751, test_loss: 1.0057, test_f1: 0.4888
 epoch: 43, train_loss: 0.9720, test_loss: 0.9837, test_f1: 0.4966
 epoch: 44, train_loss: 0.9625, test_loss: 0.9750, test_f1: 0.4982
 epoch: 45, train_loss: 0.9633, test_loss: 0.9953, test_f1: 0.4879
 epoch: 46, train_loss: 0.9658, test_loss: 0.9953, test_f1: 0.4954
 epoch: 47, train_loss: 0.9591, test_loss: 1.0075, test_f1: 0.4909
 epoch: 48, train_loss: 0.9604, test_loss: 0.9758, test_f1: 0.5125
 epoch: 49, train_loss: 0.9482, test_loss: 0.9798, test_f1: 0.5117
 epoch: 50, train_loss: 0.9522, test_loss: 0.9878, test_f1: 0.5127
 epoch: 51, train_loss: 0.9502, test_loss: 0.9892, test_f1: 0.5084
 epoch: 52, train_loss: 0.9405, test_loss: 0.9894, test_f1: 0.5214
 epoch: 53, train_loss: 0.9404, test_loss: 0.9747, test_f1: 0.5141
 epoch: 54, train_loss: 0.9440, test_loss: 0.9874, test_f1: 0.5174
 epoch: 55, train_loss: 0.9430, test_loss: 0.9831, test_f1: 0.5059
 epoch: 56, train_loss: 0.9283, test_loss: 0.9811, test_f1: 0.5177
 epoch: 57, train_loss: 0.9385, test_loss: 0.9715, test_f1: 0.5171
 epoch: 58, train_loss: 0.9323, test_loss: 0.9876, test_f1: 0.5084
 epoch: 59, train_loss: 0.9378, test_loss: 0.9794, test_f1: 0.5129
 epoch: 60, train_loss: 0.9266, test_loss: 0.9785, test_f1: 0.5125
 epoch: 61, train_loss: 0.9343, test_loss: 0.9826, test_f1: 0.5106
 epoch: 62, train_loss: 0.9340, test_loss: 0.9862, test_f1: 0.5182
 epoch: 63, train_loss: 0.9124, test_loss: 0.9836, test_f1: 0.5120
 epoch: 64, train_loss: 0.9394, test_loss: 0.9689, test_f1: 0.5166
 epoch: 65, train_loss: 0.9312, test_loss: 0.9873, test_f1: 0.5139
 epoch: 66, train_loss: 0.9193, test_loss: 0.9920, test_f1: 0.5136
 epoch: 67, train_loss: 0.9271, test_loss: 0.9871, test_f1: 0.5139
 epoch: 68, train_loss: 0.9263, test_loss: 0.9775, test_f1: 0.5138
 epoch: 69, train_loss: 0.9217, test_loss: 0.9801, test_f1: 0.5043
 epoch: 70, train_loss: 0.9242, test_loss: 0.9819, test_f1: 0.5102
 epoch: 71, train_loss: 0.9220, test_loss: 0.9818, test_f1: 0.5060
 epoch: 72, train_loss: 0.9202, test_loss: 0.9733, test_f1: 0.5120
 epoch: 73, train_loss: 0.9160, test_loss: 0.9813, test_f1: 0.5014
 epoch: 74, train_loss: 0.9198, test_loss: 0.9787, test_f1: 0.5082
 epoch: 75, train_loss: 0.9089, test_loss: 0.9803, test_f1: 0.5063
 epoch: 76, train_loss: 0.9192, test_loss: 0.9824, test_f1: 0.5078
 epoch: 77, train_loss: 0.9106, test_loss: 0.9830, test_f1: 0.5108
 epoch: 78, train_loss: 0.9195, test_loss: 0.9933, test_f1: 0.5088
 epoch: 79, train_loss: 0.9068, test_loss: 0.9827, test_f1: 0.5152
 epoch: 80, train_loss: 0.9023, test_loss: 0.9809, test_f1: 0.5088
 epoch: 81, train_loss: 0.9024, test_loss: 0.9709, test_f1: 0.5068
 epoch: 82, train_loss: 0.9088, test_loss: 0.9750, test_f1: 0.5085
 epoch: 83, train_loss: 0.9038, test_loss: 0.9764, test_f1: 0.5128
 epoch: 84, train_loss: 0.9027, test_loss: 0.9713, test_f1: 0.5107
 epoch: 85, train_loss: 0.9055, test_loss: 1.0001, test_f1: 0.5056
 epoch: 86, train_loss: 0.8993, test_loss: 0.9685, test_f1: 0.5122
 epoch: 87, train_loss: 0.9002, test_loss: 0.9562, test_f1: 0.5115
 epoch: 88, train_loss: 0.9006, test_loss: 0.9565, test_f1: 0.5137
 epoch: 89, train_loss: 0.9032, test_loss: 0.9902, test_f1: 0.5057
 epoch: 90, train_loss: 0.9015, test_loss: 0.9780, test_f1: 0.5074
 epoch: 91, train_loss: 0.8909, test_loss: 0.9856, test_f1: 0.5103
 epoch: 92, train_loss: 0.8955, test_loss: 0.9808, test_f1: 0.5100
 epoch: 93, train_loss: 0.8968, test_loss: 0.9710, test_f1: 0.5085
 epoch: 94, train_loss: 0.8924, test_loss: 0.9780, test_f1: 0.5067
 epoch: 95, train_loss: 0.8926, test_loss: 0.9626, test_f1: 0.5123
 epoch: 96, train_loss: 0.9016, test_loss: 0.9895, test_f1: 0.5091
 epoch: 97, train_loss: 0.9033, test_loss: 0.9722, test_f1: 0.5128
 epoch: 98, train_loss: 0.8960, test_loss: 0.9757, test_f1: 0.5063
 epoch: 99, train_loss: 0.9014, test_loss: 0.9810, test_f1: 0.5132
##################ITERATION #9 ****************************************
 epoch: 0, train_loss: 1.3685, test_loss: 1.3458, test_f1: 0.2270
 epoch: 1, train_loss: 1.2850, test_loss: 1.3125, test_f1: 0.3057
 epoch: 2, train_loss: 1.2571, test_loss: 1.2469, test_f1: 0.3302
 epoch: 3, train_loss: 1.2435, test_loss: 1.2205, test_f1: 0.3528
 epoch: 4, train_loss: 1.2292, test_loss: 1.2041, test_f1: 0.3604
 epoch: 5, train_loss: 1.2139, test_loss: 1.1847, test_f1: 0.3794
 epoch: 6, train_loss: 1.2021, test_loss: 1.1706, test_f1: 0.3884
 epoch: 7, train_loss: 1.1947, test_loss: 1.1581, test_f1: 0.4070
 epoch: 8, train_loss: 1.1835, test_loss: 1.1459, test_f1: 0.4111
 epoch: 9, train_loss: 1.1696, test_loss: 1.1410, test_f1: 0.4154
 epoch: 10, train_loss: 1.1552, test_loss: 1.1238, test_f1: 0.4224
 epoch: 11, train_loss: 1.1494, test_loss: 1.1109, test_f1: 0.4257
 epoch: 12, train_loss: 1.1492, test_loss: 1.1019, test_f1: 0.4353
 epoch: 13, train_loss: 1.1473, test_loss: 1.0844, test_f1: 0.4360
 epoch: 14, train_loss: 1.1347, test_loss: 1.0715, test_f1: 0.4544
 epoch: 15, train_loss: 1.1186, test_loss: 1.0680, test_f1: 0.4521
 epoch: 16, train_loss: 1.1129, test_loss: 1.0495, test_f1: 0.4718
 epoch: 17, train_loss: 1.1039, test_loss: 1.0447, test_f1: 0.4759
 epoch: 18, train_loss: 1.0965, test_loss: 1.0306, test_f1: 0.4900
 epoch: 19, train_loss: 1.0940, test_loss: 1.0374, test_f1: 0.4572
 epoch: 20, train_loss: 1.0828, test_loss: 1.0226, test_f1: 0.4811
 epoch: 21, train_loss: 1.0823, test_loss: 1.0090, test_f1: 0.4885
 epoch: 22, train_loss: 1.0698, test_loss: 1.0062, test_f1: 0.4959
 epoch: 23, train_loss: 1.0641, test_loss: 0.9958, test_f1: 0.5010
 epoch: 24, train_loss: 1.0670, test_loss: 0.9985, test_f1: 0.4811
 epoch: 25, train_loss: 1.0576, test_loss: 0.9898, test_f1: 0.4862
 epoch: 26, train_loss: 1.0607, test_loss: 0.9870, test_f1: 0.4816
 epoch: 27, train_loss: 1.0501, test_loss: 0.9957, test_f1: 0.4910
 epoch: 28, train_loss: 1.0394, test_loss: 0.9688, test_f1: 0.5162
 epoch: 29, train_loss: 1.0343, test_loss: 0.9842, test_f1: 0.4846
 epoch: 30, train_loss: 1.0381, test_loss: 0.9776, test_f1: 0.5006
 epoch: 31, train_loss: 1.0244, test_loss: 0.9659, test_f1: 0.4970
 epoch: 32, train_loss: 1.0229, test_loss: 0.9723, test_f1: 0.4855
 epoch: 33, train_loss: 1.0265, test_loss: 0.9659, test_f1: 0.5034
 epoch: 34, train_loss: 1.0170, test_loss: 0.9646, test_f1: 0.5032
 epoch: 35, train_loss: 1.0220, test_loss: 0.9696, test_f1: 0.4999
 epoch: 36, train_loss: 1.0036, test_loss: 0.9516, test_f1: 0.5091
 epoch: 37, train_loss: 1.0045, test_loss: 0.9567, test_f1: 0.5015
 epoch: 38, train_loss: 1.0014, test_loss: 0.9509, test_f1: 0.5053
 epoch: 39, train_loss: 0.9939, test_loss: 0.9593, test_f1: 0.5099
 epoch: 40, train_loss: 0.9961, test_loss: 0.9575, test_f1: 0.5045
 epoch: 41, train_loss: 0.9995, test_loss: 0.9516, test_f1: 0.5132
 epoch: 42, train_loss: 0.9911, test_loss: 0.9702, test_f1: 0.4869
 epoch: 43, train_loss: 0.9844, test_loss: 0.9374, test_f1: 0.5140
 epoch: 44, train_loss: 0.9925, test_loss: 0.9532, test_f1: 0.5006
 epoch: 45, train_loss: 0.9829, test_loss: 0.9325, test_f1: 0.5001
 epoch: 46, train_loss: 0.9706, test_loss: 0.9294, test_f1: 0.5140
 epoch: 47, train_loss: 0.9789, test_loss: 0.9411, test_f1: 0.5071
 epoch: 48, train_loss: 0.9690, test_loss: 0.9592, test_f1: 0.5010
 epoch: 49, train_loss: 0.9639, test_loss: 0.9220, test_f1: 0.5179
 epoch: 50, train_loss: 0.9760, test_loss: 0.9462, test_f1: 0.5179
 epoch: 51, train_loss: 0.9556, test_loss: 0.9349, test_f1: 0.5149
 epoch: 52, train_loss: 0.9629, test_loss: 0.9462, test_f1: 0.5163
 epoch: 53, train_loss: 0.9641, test_loss: 0.9379, test_f1: 0.5130
 epoch: 54, train_loss: 0.9574, test_loss: 0.9193, test_f1: 0.5105
 epoch: 55, train_loss: 0.9587, test_loss: 0.9348, test_f1: 0.5148
 epoch: 56, train_loss: 0.9629, test_loss: 0.9303, test_f1: 0.5086
 epoch: 57, train_loss: 0.9496, test_loss: 0.9333, test_f1: 0.5097
 epoch: 58, train_loss: 0.9517, test_loss: 0.9246, test_f1: 0.5055
 epoch: 59, train_loss: 0.9497, test_loss: 0.9323, test_f1: 0.5097
 epoch: 60, train_loss: 0.9515, test_loss: 0.9337, test_f1: 0.5133
 epoch: 61, train_loss: 0.9482, test_loss: 0.9225, test_f1: 0.5106
 epoch: 62, train_loss: 0.9411, test_loss: 0.9397, test_f1: 0.5095
 epoch: 63, train_loss: 0.9494, test_loss: 0.9311, test_f1: 0.5144
 epoch: 64, train_loss: 0.9421, test_loss: 0.9197, test_f1: 0.5099
 epoch: 65, train_loss: 0.9413, test_loss: 0.9275, test_f1: 0.5053
 epoch: 66, train_loss: 0.9408, test_loss: 0.9328, test_f1: 0.5123
 epoch: 67, train_loss: 0.9461, test_loss: 0.9295, test_f1: 0.5029
 epoch: 68, train_loss: 0.9336, test_loss: 0.9271, test_f1: 0.5087
 epoch: 69, train_loss: 0.9387, test_loss: 0.9405, test_f1: 0.5123
 epoch: 70, train_loss: 0.9487, test_loss: 0.9533, test_f1: 0.5154
 epoch: 71, train_loss: 0.9385, test_loss: 0.9395, test_f1: 0.5057
 epoch: 72, train_loss: 0.9414, test_loss: 0.9268, test_f1: 0.5103
 epoch: 73, train_loss: 0.9242, test_loss: 0.9275, test_f1: 0.5108
 epoch: 74, train_loss: 0.9337, test_loss: 0.9259, test_f1: 0.5064
 epoch: 75, train_loss: 0.9278, test_loss: 0.9218, test_f1: 0.5099
 epoch: 76, train_loss: 0.9283, test_loss: 0.9287, test_f1: 0.5019
 epoch: 77, train_loss: 0.9251, test_loss: 0.9323, test_f1: 0.5088
 epoch: 78, train_loss: 0.9324, test_loss: 0.9272, test_f1: 0.5044
 epoch: 79, train_loss: 0.9314, test_loss: 0.9335, test_f1: 0.5067
 epoch: 80, train_loss: 0.9174, test_loss: 0.9320, test_f1: 0.5162
 epoch: 81, train_loss: 0.9277, test_loss: 0.9417, test_f1: 0.4994
 epoch: 82, train_loss: 0.9201, test_loss: 0.9414, test_f1: 0.5060
 epoch: 83, train_loss: 0.9296, test_loss: 0.9315, test_f1: 0.5066
 epoch: 84, train_loss: 0.9217, test_loss: 0.9366, test_f1: 0.5064
 epoch: 85, train_loss: 0.9246, test_loss: 0.9404, test_f1: 0.5037
 epoch: 86, train_loss: 0.9392, test_loss: 0.9387, test_f1: 0.4964
 epoch: 87, train_loss: 0.9174, test_loss: 0.9269, test_f1: 0.5005
 epoch: 88, train_loss: 0.9118, test_loss: 0.9169, test_f1: 0.5170
 epoch: 89, train_loss: 0.9155, test_loss: 0.9223, test_f1: 0.5084
 epoch: 90, train_loss: 0.9166, test_loss: 0.9361, test_f1: 0.5042
 epoch: 91, train_loss: 0.9201, test_loss: 0.9366, test_f1: 0.5067
 epoch: 92, train_loss: 0.9174, test_loss: 0.9166, test_f1: 0.5039
 epoch: 93, train_loss: 0.9171, test_loss: 0.9343, test_f1: 0.5059
 epoch: 94, train_loss: 0.9055, test_loss: 0.9286, test_f1: 0.5043
 epoch: 95, train_loss: 0.9170, test_loss: 0.9153, test_f1: 0.5020
 epoch: 96, train_loss: 0.9154, test_loss: 0.9421, test_f1: 0.5011
 epoch: 97, train_loss: 0.9071, test_loss: 0.9368, test_f1: 0.5069
 epoch: 98, train_loss: 0.9110, test_loss: 0.9256, test_f1: 0.4979
 epoch: 99, train_loss: 0.9164, test_loss: 0.9510, test_f1: 0.5115

Training completed in 516.50 seconds
Best F1: 0.5444 at epoch 90
Mean F1 across iterations: 0.5286  0.0091
========================FINAL RESULTS================================
FEGIN weighted F1: 0.5444  0.0091
python main.py --data ltspice_examples --representation component_net --model FEGIN --layers 5 --hiddens 32 --batch_size 128 --lr 0.0001 --emb_size 250 --epochs 100 --save_appendix component_net_L5_H32_BS128_LR0.0001_E250 --no_val
-----



STDERR:
  File "main.py", line 370, in <module>
    main()
  File "main.py", line 254, in main
    dataset = dataset_class(
  File "/home/philip/projects/ltspice_examples_code_repo/Circuit-Completion-Using-GNNs/component_classification_with_link_prediction_head/evaluation/FEGIN/kernel/circuit_datasets.py", line 15, in __init__
    self.data, self.slices = torch.load(self.processed_paths[0])
  File "/home/philip/.local/lib/python3.8/site-packages/torch/serialization.py", line 1040, in load
    warnings.warn(
  File "/usr/lib/python3.8/warnings.py", line 109, in _showwarnmsg
    sw(msg.message, msg.category, msg.filename, msg.lineno,
  File "main.py", line 47, in warn_with_traceback
    traceback.print_stack(file=log)
/home/philip/projects/ltspice_examples_code_repo/Circuit-Completion-Using-GNNs/component_classification_with_link_prediction_head/evaluation/FEGIN/kernel/circuit_datasets.py:15: FutureWarning: You are using `torch.load` with `weights_only=False` (the current default value), which uses the default pickle module implicitly. It is possible to construct malicious pickle data which will execute arbitrary code during unpickling (See https://github.com/pytorch/pytorch/blob/main/SECURITY.md#untrusted-models for more details). In a future release, the default value for `weights_only` will be flipped to `True`. This limits the functions that could be executed during unpickling. Arbitrary objects will no longer be allowed to be loaded via this mode unless they are explicitly allowlisted by the user via `torch.serialization.add_safe_globals`. We recommend you start setting `weights_only=True` for any use case where you don't have full control of the loaded file. Please open an issue on GitHub for any issues related to this experimental feature.
  self.data, self.slices = torch.load(self.processed_paths[0])
