STDOUT:
Results will be saved in /home/philip/projects/ltspice_examples_code_repo/Circuit-Completion-Using-GNNs/component_classification_with_link_prediction_head/evaluation/FEGIN/results/model_FEGIN_dataset_ltspice_demos
Command line input: python main.py --data ltspice_demos --representation component_pin_net --model FEGIN --layers 4 --hiddens 128 --batch_size 32 --lr 0.0001 --emb_size 512 --epochs 100 --save_appendix component_pin_net_L4_H128_BS32_LR0.0001_E512 --no_val
 is saved.
-----
ltspice_demos - FEGIN
Using 4 layers, 128 hidden units, h = 2
Loading component_pin_net representation dataset
ENTERED
Training FEGIN on component_pin_net representation
Train: 1565, Test: 383
##################ITERATION #0 ****************************************
 epoch: 0, train_loss: 1.3514, test_loss: 1.3435, test_f1: 0.1405
 epoch: 1, train_loss: 1.2670, test_loss: 1.2637, test_f1: 0.3350
 epoch: 2, train_loss: 1.1834, test_loss: 1.2083, test_f1: 0.3534
 epoch: 3, train_loss: 1.1306, test_loss: 1.1883, test_f1: 0.4386
 epoch: 4, train_loss: 1.0980, test_loss: 1.1636, test_f1: 0.4422
 epoch: 5, train_loss: 1.0609, test_loss: 1.1322, test_f1: 0.4436
 epoch: 6, train_loss: 1.0294, test_loss: 1.0992, test_f1: 0.4496
 epoch: 7, train_loss: 0.9985, test_loss: 1.0939, test_f1: 0.4487
 epoch: 8, train_loss: 0.9826, test_loss: 1.0860, test_f1: 0.4540
 epoch: 9, train_loss: 0.9768, test_loss: 1.0793, test_f1: 0.4697
 epoch: 10, train_loss: 0.9648, test_loss: 1.0785, test_f1: 0.4721
 epoch: 11, train_loss: 0.9519, test_loss: 1.0642, test_f1: 0.5243
 epoch: 12, train_loss: 0.9481, test_loss: 1.0735, test_f1: 0.5086
 epoch: 13, train_loss: 0.9439, test_loss: 1.0715, test_f1: 0.5394
 epoch: 14, train_loss: 0.9315, test_loss: 1.0848, test_f1: 0.5311
 epoch: 15, train_loss: 0.9266, test_loss: 1.0593, test_f1: 0.5355
 epoch: 16, train_loss: 0.9158, test_loss: 1.0348, test_f1: 0.5664
 epoch: 17, train_loss: 0.9058, test_loss: 1.0569, test_f1: 0.5433
 epoch: 18, train_loss: 0.8985, test_loss: 1.0518, test_f1: 0.5618
 epoch: 19, train_loss: 0.8851, test_loss: 1.0363, test_f1: 0.5555
 epoch: 20, train_loss: 0.8805, test_loss: 1.0572, test_f1: 0.5377
 epoch: 21, train_loss: 0.8697, test_loss: 1.0147, test_f1: 0.5402
 epoch: 22, train_loss: 0.8603, test_loss: 1.0523, test_f1: 0.5318
 epoch: 23, train_loss: 0.8434, test_loss: 1.0702, test_f1: 0.5403
 epoch: 24, train_loss: 0.8314, test_loss: 1.0374, test_f1: 0.5402
 epoch: 25, train_loss: 0.8343, test_loss: 1.0571, test_f1: 0.5654
 epoch: 26, train_loss: 0.8118, test_loss: 1.0200, test_f1: 0.5772
 epoch: 27, train_loss: 0.8070, test_loss: 1.0223, test_f1: 0.5820
 epoch: 28, train_loss: 0.7965, test_loss: 0.9770, test_f1: 0.5437
 epoch: 29, train_loss: 0.7715, test_loss: 1.0027, test_f1: 0.5956
 epoch: 30, train_loss: 0.7474, test_loss: 1.0293, test_f1: 0.5978
 epoch: 31, train_loss: 0.7393, test_loss: 1.0250, test_f1: 0.5849
 epoch: 32, train_loss: 0.7243, test_loss: 1.0764, test_f1: 0.5577
 epoch: 33, train_loss: 0.7332, test_loss: 1.0464, test_f1: 0.5948
 epoch: 34, train_loss: 0.7108, test_loss: 1.0478, test_f1: 0.5875
 epoch: 35, train_loss: 0.6897, test_loss: 1.0443, test_f1: 0.5953
 epoch: 36, train_loss: 0.6828, test_loss: 1.0435, test_f1: 0.5911
 epoch: 37, train_loss: 0.6717, test_loss: 0.9760, test_f1: 0.5989
 epoch: 38, train_loss: 0.6724, test_loss: 1.1211, test_f1: 0.5880
 epoch: 39, train_loss: 0.6358, test_loss: 1.0699, test_f1: 0.5920
 epoch: 40, train_loss: 0.6461, test_loss: 1.0059, test_f1: 0.6041
 epoch: 41, train_loss: 0.6389, test_loss: 1.0512, test_f1: 0.6118
 epoch: 42, train_loss: 0.6277, test_loss: 1.0359, test_f1: 0.6158
 epoch: 43, train_loss: 0.6041, test_loss: 1.0047, test_f1: 0.6382
 epoch: 44, train_loss: 0.6062, test_loss: 1.0787, test_f1: 0.5925
 epoch: 45, train_loss: 0.5903, test_loss: 1.1084, test_f1: 0.6120
 epoch: 46, train_loss: 0.5873, test_loss: 1.0229, test_f1: 0.6289
 epoch: 47, train_loss: 0.5813, test_loss: 1.0094, test_f1: 0.6279
 epoch: 48, train_loss: 0.5853, test_loss: 1.0903, test_f1: 0.6163
 epoch: 49, train_loss: 0.5563, test_loss: 1.1375, test_f1: 0.6035
 epoch: 50, train_loss: 0.5392, test_loss: 1.0868, test_f1: 0.6232
 epoch: 51, train_loss: 0.5177, test_loss: 1.1080, test_f1: 0.6228
 epoch: 52, train_loss: 0.5127, test_loss: 1.1211, test_f1: 0.6192
 epoch: 53, train_loss: 0.5240, test_loss: 1.0843, test_f1: 0.6410
 epoch: 54, train_loss: 0.5207, test_loss: 1.1069, test_f1: 0.6615
 epoch: 55, train_loss: 0.5011, test_loss: 1.1611, test_f1: 0.6173
 epoch: 56, train_loss: 0.5019, test_loss: 1.1253, test_f1: 0.6399
 epoch: 57, train_loss: 0.4917, test_loss: 1.1442, test_f1: 0.6269
 epoch: 58, train_loss: 0.4875, test_loss: 1.1396, test_f1: 0.6129
 epoch: 59, train_loss: 0.4814, test_loss: 1.1471, test_f1: 0.6468
 epoch: 60, train_loss: 0.4719, test_loss: 1.1737, test_f1: 0.6241
 epoch: 61, train_loss: 0.4594, test_loss: 1.1852, test_f1: 0.6490
 epoch: 62, train_loss: 0.4832, test_loss: 1.1634, test_f1: 0.6222
 epoch: 63, train_loss: 0.4515, test_loss: 1.2172, test_f1: 0.6293
 epoch: 64, train_loss: 0.4488, test_loss: 1.1968, test_f1: 0.6249
 epoch: 65, train_loss: 0.4506, test_loss: 1.2567, test_f1: 0.6279
 epoch: 66, train_loss: 0.4601, test_loss: 1.2025, test_f1: 0.6395
 epoch: 67, train_loss: 0.4456, test_loss: 1.1981, test_f1: 0.6542
 epoch: 68, train_loss: 0.4422, test_loss: 1.2241, test_f1: 0.6434
 epoch: 69, train_loss: 0.4315, test_loss: 1.2126, test_f1: 0.6317
 epoch: 70, train_loss: 0.4415, test_loss: 1.2528, test_f1: 0.6274
 epoch: 71, train_loss: 0.4365, test_loss: 1.2127, test_f1: 0.6445
 epoch: 72, train_loss: 0.4170, test_loss: 1.3036, test_f1: 0.6292
 epoch: 73, train_loss: 0.4228, test_loss: 1.2974, test_f1: 0.6156
 epoch: 74, train_loss: 0.4146, test_loss: 1.2560, test_f1: 0.6327
 epoch: 75, train_loss: 0.4490, test_loss: 1.3052, test_f1: 0.6360
 epoch: 76, train_loss: 0.4180, test_loss: 1.3094, test_f1: 0.6307
 epoch: 77, train_loss: 0.3859, test_loss: 1.3325, test_f1: 0.6438
 epoch: 78, train_loss: 0.3944, test_loss: 1.2831, test_f1: 0.6385
 epoch: 79, train_loss: 0.3841, test_loss: 1.3044, test_f1: 0.6247
 epoch: 80, train_loss: 0.3918, test_loss: 1.3441, test_f1: 0.6541
 epoch: 81, train_loss: 0.3915, test_loss: 1.3498, test_f1: 0.6221
 epoch: 82, train_loss: 0.3945, test_loss: 1.3891, test_f1: 0.6426
 epoch: 83, train_loss: 0.3731, test_loss: 1.4405, test_f1: 0.6397
 epoch: 84, train_loss: 0.3648, test_loss: 1.4053, test_f1: 0.6303
 epoch: 85, train_loss: 0.3683, test_loss: 1.4492, test_f1: 0.6339
 epoch: 86, train_loss: 0.3684, test_loss: 1.3965, test_f1: 0.6638
 epoch: 87, train_loss: 0.3664, test_loss: 1.4026, test_f1: 0.6291
 epoch: 88, train_loss: 0.3645, test_loss: 1.3724, test_f1: 0.6396
 epoch: 89, train_loss: 0.3424, test_loss: 1.4128, test_f1: 0.6591
 epoch: 90, train_loss: 0.3470, test_loss: 1.4711, test_f1: 0.6485
 epoch: 91, train_loss: 0.3601, test_loss: 1.4614, test_f1: 0.6197
 epoch: 92, train_loss: 0.3421, test_loss: 1.5296, test_f1: 0.6490
 epoch: 93, train_loss: 0.3574, test_loss: 1.4940, test_f1: 0.6404
 epoch: 94, train_loss: 0.3360, test_loss: 1.5405, test_f1: 0.6191
 epoch: 95, train_loss: 0.3163, test_loss: 1.5318, test_f1: 0.6294
 epoch: 96, train_loss: 0.3195, test_loss: 1.5459, test_f1: 0.6406
 epoch: 97, train_loss: 0.3091, test_loss: 1.5246, test_f1: 0.6388
 epoch: 98, train_loss: 0.3270, test_loss: 1.5537, test_f1: 0.6423
 epoch: 99, train_loss: 0.3197, test_loss: 1.6000, test_f1: 0.6433
##################ITERATION #1 ****************************************
 epoch: 0, train_loss: 1.2382, test_loss: 1.2755, test_f1: 0.3218
 epoch: 1, train_loss: 1.1046, test_loss: 1.1472, test_f1: 0.4401
 epoch: 2, train_loss: 1.0478, test_loss: 1.0957, test_f1: 0.4782
 epoch: 3, train_loss: 1.0072, test_loss: 1.0741, test_f1: 0.4945
 epoch: 4, train_loss: 0.9860, test_loss: 1.0539, test_f1: 0.5091
 epoch: 5, train_loss: 0.9668, test_loss: 1.0404, test_f1: 0.5207
 epoch: 6, train_loss: 0.9394, test_loss: 1.0356, test_f1: 0.5302
 epoch: 7, train_loss: 0.9225, test_loss: 1.0407, test_f1: 0.4962
 epoch: 8, train_loss: 0.9060, test_loss: 1.0229, test_f1: 0.5208
 epoch: 9, train_loss: 0.8912, test_loss: 1.0356, test_f1: 0.5206
 epoch: 10, train_loss: 0.8830, test_loss: 1.0242, test_f1: 0.5429
 epoch: 11, train_loss: 0.8740, test_loss: 1.0252, test_f1: 0.5218
 epoch: 12, train_loss: 0.8566, test_loss: 1.0280, test_f1: 0.5436
 epoch: 13, train_loss: 0.8418, test_loss: 1.0320, test_f1: 0.5424
 epoch: 14, train_loss: 0.8354, test_loss: 1.0381, test_f1: 0.5181
 epoch: 15, train_loss: 0.8175, test_loss: 1.0149, test_f1: 0.5494
 epoch: 16, train_loss: 0.7953, test_loss: 1.0095, test_f1: 0.5683
 epoch: 17, train_loss: 0.7880, test_loss: 1.0414, test_f1: 0.5505
 epoch: 18, train_loss: 0.7737, test_loss: 1.0331, test_f1: 0.5703
 epoch: 19, train_loss: 0.7692, test_loss: 1.0191, test_f1: 0.5599
 epoch: 20, train_loss: 0.7552, test_loss: 1.0157, test_f1: 0.5658
 epoch: 21, train_loss: 0.7457, test_loss: 1.0456, test_f1: 0.5670
 epoch: 22, train_loss: 0.7189, test_loss: 1.0638, test_f1: 0.5867
 epoch: 23, train_loss: 0.6970, test_loss: 1.0859, test_f1: 0.5619
 epoch: 24, train_loss: 0.7051, test_loss: 1.0538, test_f1: 0.5856
 epoch: 25, train_loss: 0.6761, test_loss: 1.0747, test_f1: 0.5882
 epoch: 26, train_loss: 0.6621, test_loss: 1.0765, test_f1: 0.5956
 epoch: 27, train_loss: 0.6628, test_loss: 1.0831, test_f1: 0.6129
 epoch: 28, train_loss: 0.6503, test_loss: 1.0846, test_f1: 0.5833
 epoch: 29, train_loss: 0.6348, test_loss: 1.1360, test_f1: 0.5924
 epoch: 30, train_loss: 0.6419, test_loss: 1.0695, test_f1: 0.6049
 epoch: 31, train_loss: 0.6112, test_loss: 1.1159, test_f1: 0.6029
 epoch: 32, train_loss: 0.5938, test_loss: 1.0684, test_f1: 0.6119
 epoch: 33, train_loss: 0.5951, test_loss: 1.1633, test_f1: 0.5985
 epoch: 34, train_loss: 0.5751, test_loss: 1.1326, test_f1: 0.6231
 epoch: 35, train_loss: 0.5725, test_loss: 1.2039, test_f1: 0.5984
 epoch: 36, train_loss: 0.5772, test_loss: 1.2002, test_f1: 0.6045
 epoch: 37, train_loss: 0.5685, test_loss: 1.1218, test_f1: 0.6269
 epoch: 38, train_loss: 0.5437, test_loss: 1.2469, test_f1: 0.5986
 epoch: 39, train_loss: 0.5494, test_loss: 1.1578, test_f1: 0.6287
 epoch: 40, train_loss: 0.5417, test_loss: 1.1770, test_f1: 0.6208
 epoch: 41, train_loss: 0.5363, test_loss: 1.1462, test_f1: 0.6055
 epoch: 42, train_loss: 0.5091, test_loss: 1.2302, test_f1: 0.5898
 epoch: 43, train_loss: 0.5238, test_loss: 1.1442, test_f1: 0.6392
 epoch: 44, train_loss: 0.4881, test_loss: 1.3324, test_f1: 0.6116
 epoch: 45, train_loss: 0.4958, test_loss: 1.3433, test_f1: 0.6041
 epoch: 46, train_loss: 0.4817, test_loss: 1.3288, test_f1: 0.6267
 epoch: 47, train_loss: 0.4813, test_loss: 1.2441, test_f1: 0.6356
 epoch: 48, train_loss: 0.4498, test_loss: 1.2858, test_f1: 0.6199
 epoch: 49, train_loss: 0.4763, test_loss: 1.2538, test_f1: 0.6510
 epoch: 50, train_loss: 0.4644, test_loss: 1.3124, test_f1: 0.5899
 epoch: 51, train_loss: 0.4450, test_loss: 1.3573, test_f1: 0.6222
 epoch: 52, train_loss: 0.4231, test_loss: 1.2977, test_f1: 0.6328
 epoch: 53, train_loss: 0.4098, test_loss: 1.3590, test_f1: 0.6218
 epoch: 54, train_loss: 0.3967, test_loss: 1.4137, test_f1: 0.6194
 epoch: 55, train_loss: 0.4109, test_loss: 1.4210, test_f1: 0.6150
 epoch: 56, train_loss: 0.3979, test_loss: 1.3963, test_f1: 0.6207
 epoch: 57, train_loss: 0.3994, test_loss: 1.4618, test_f1: 0.5905
 epoch: 58, train_loss: 0.3906, test_loss: 1.4538, test_f1: 0.6022
 epoch: 59, train_loss: 0.3812, test_loss: 1.4748, test_f1: 0.5920
 epoch: 60, train_loss: 0.3790, test_loss: 1.4317, test_f1: 0.6285
 epoch: 61, train_loss: 0.3744, test_loss: 1.4988, test_f1: 0.6105
 epoch: 62, train_loss: 0.3771, test_loss: 1.4810, test_f1: 0.6325
 epoch: 63, train_loss: 0.3717, test_loss: 1.4854, test_f1: 0.6100
 epoch: 64, train_loss: 0.3479, test_loss: 1.5310, test_f1: 0.6396
 epoch: 65, train_loss: 0.3610, test_loss: 1.5497, test_f1: 0.6402
 epoch: 66, train_loss: 0.3550, test_loss: 1.5179, test_f1: 0.6311
 epoch: 67, train_loss: 0.3436, test_loss: 1.5901, test_f1: 0.6454
 epoch: 68, train_loss: 0.3352, test_loss: 1.6099, test_f1: 0.6180
 epoch: 69, train_loss: 0.3388, test_loss: 1.5416, test_f1: 0.6721
 epoch: 70, train_loss: 0.3293, test_loss: 1.6197, test_f1: 0.6547
 epoch: 71, train_loss: 0.3311, test_loss: 1.5941, test_f1: 0.6112
 epoch: 72, train_loss: 0.3350, test_loss: 1.5820, test_f1: 0.6410
 epoch: 73, train_loss: 0.3258, test_loss: 1.6559, test_f1: 0.6161
 epoch: 74, train_loss: 0.3194, test_loss: 1.6393, test_f1: 0.6222
 epoch: 75, train_loss: 0.3183, test_loss: 1.6765, test_f1: 0.6373
 epoch: 76, train_loss: 0.3186, test_loss: 1.6514, test_f1: 0.6340
 epoch: 77, train_loss: 0.3167, test_loss: 1.6886, test_f1: 0.6078
 epoch: 78, train_loss: 0.3047, test_loss: 1.7230, test_f1: 0.6576
 epoch: 79, train_loss: 0.2916, test_loss: 1.7054, test_f1: 0.6124
 epoch: 80, train_loss: 0.3075, test_loss: 1.7462, test_f1: 0.6353
 epoch: 81, train_loss: 0.3133, test_loss: 1.6694, test_f1: 0.6510
 epoch: 82, train_loss: 0.2896, test_loss: 1.7567, test_f1: 0.6369
 epoch: 83, train_loss: 0.2787, test_loss: 1.7598, test_f1: 0.6275
 epoch: 84, train_loss: 0.3081, test_loss: 1.6683, test_f1: 0.6360
 epoch: 85, train_loss: 0.2848, test_loss: 1.7326, test_f1: 0.6382
 epoch: 86, train_loss: 0.2964, test_loss: 1.7934, test_f1: 0.6251
 epoch: 87, train_loss: 0.2953, test_loss: 1.8139, test_f1: 0.5993
 epoch: 88, train_loss: 0.2674, test_loss: 1.8181, test_f1: 0.6083
 epoch: 89, train_loss: 0.2657, test_loss: 1.7820, test_f1: 0.6221
 epoch: 90, train_loss: 0.2702, test_loss: 1.9373, test_f1: 0.6082
 epoch: 91, train_loss: 0.2593, test_loss: 1.9615, test_f1: 0.6159
 epoch: 92, train_loss: 0.2608, test_loss: 1.8843, test_f1: 0.6281
 epoch: 93, train_loss: 0.2658, test_loss: 1.9136, test_f1: 0.6151
 epoch: 94, train_loss: 0.2483, test_loss: 1.9314, test_f1: 0.6278
 epoch: 95, train_loss: 0.2483, test_loss: 1.9020, test_f1: 0.6441
 epoch: 96, train_loss: 0.2418, test_loss: 1.9108, test_f1: 0.6216
 epoch: 97, train_loss: 0.2667, test_loss: 1.8724, test_f1: 0.6534
 epoch: 98, train_loss: 0.2367, test_loss: 2.0177, test_f1: 0.5893
 epoch: 99, train_loss: 0.2501, test_loss: 1.9384, test_f1: 0.6518
##################ITERATION #2 ****************************************
 epoch: 0, train_loss: 1.1699, test_loss: 1.2071, test_f1: 0.4401
 epoch: 1, train_loss: 1.0391, test_loss: 1.0809, test_f1: 0.4687
 epoch: 2, train_loss: 0.9981, test_loss: 1.0593, test_f1: 0.5214
 epoch: 3, train_loss: 0.9691, test_loss: 1.0425, test_f1: 0.5328
 epoch: 4, train_loss: 0.9502, test_loss: 1.0273, test_f1: 0.5086
 epoch: 5, train_loss: 0.9320, test_loss: 1.0260, test_f1: 0.5200
 epoch: 6, train_loss: 0.9139, test_loss: 1.0136, test_f1: 0.5478
 epoch: 7, train_loss: 0.8994, test_loss: 1.0059, test_f1: 0.5477
 epoch: 8, train_loss: 0.8693, test_loss: 1.0082, test_f1: 0.5442
 epoch: 9, train_loss: 0.8664, test_loss: 0.9983, test_f1: 0.5550
 epoch: 10, train_loss: 0.8510, test_loss: 1.0138, test_f1: 0.5463
 epoch: 11, train_loss: 0.8486, test_loss: 1.0002, test_f1: 0.5703
 epoch: 12, train_loss: 0.8185, test_loss: 1.0019, test_f1: 0.5818
 epoch: 13, train_loss: 0.7998, test_loss: 0.9940, test_f1: 0.5748
 epoch: 14, train_loss: 0.7914, test_loss: 1.0178, test_f1: 0.5979
 epoch: 15, train_loss: 0.7798, test_loss: 1.0011, test_f1: 0.5869
 epoch: 16, train_loss: 0.7670, test_loss: 0.9919, test_f1: 0.6043
 epoch: 17, train_loss: 0.7452, test_loss: 1.0056, test_f1: 0.6075
 epoch: 18, train_loss: 0.7317, test_loss: 0.9998, test_f1: 0.6050
 epoch: 19, train_loss: 0.7093, test_loss: 1.0259, test_f1: 0.6052
 epoch: 20, train_loss: 0.7134, test_loss: 0.9981, test_f1: 0.5910
 epoch: 21, train_loss: 0.6948, test_loss: 1.0358, test_f1: 0.6038
 epoch: 22, train_loss: 0.6721, test_loss: 1.0466, test_f1: 0.5951
 epoch: 23, train_loss: 0.6711, test_loss: 1.0520, test_f1: 0.6162
 epoch: 24, train_loss: 0.6405, test_loss: 1.0725, test_f1: 0.6086
 epoch: 25, train_loss: 0.6430, test_loss: 1.0469, test_f1: 0.6254
 epoch: 26, train_loss: 0.6243, test_loss: 1.0528, test_f1: 0.6416
 epoch: 27, train_loss: 0.6121, test_loss: 1.0786, test_f1: 0.6314
 epoch: 28, train_loss: 0.5922, test_loss: 1.0416, test_f1: 0.5943
 epoch: 29, train_loss: 0.5892, test_loss: 1.1228, test_f1: 0.6159
 epoch: 30, train_loss: 0.5806, test_loss: 1.1142, test_f1: 0.6238
 epoch: 31, train_loss: 0.5717, test_loss: 1.1569, test_f1: 0.5925
 epoch: 32, train_loss: 0.5628, test_loss: 1.1716, test_f1: 0.6108
 epoch: 33, train_loss: 0.5527, test_loss: 1.1315, test_f1: 0.6191
 epoch: 34, train_loss: 0.5484, test_loss: 1.1210, test_f1: 0.6092
 epoch: 35, train_loss: 0.5231, test_loss: 1.1454, test_f1: 0.6135
 epoch: 36, train_loss: 0.5247, test_loss: 1.1792, test_f1: 0.6267
 epoch: 37, train_loss: 0.5202, test_loss: 1.2440, test_f1: 0.6325
 epoch: 38, train_loss: 0.4948, test_loss: 1.2355, test_f1: 0.6156
 epoch: 39, train_loss: 0.4953, test_loss: 1.2220, test_f1: 0.6129
 epoch: 40, train_loss: 0.4855, test_loss: 1.1814, test_f1: 0.6307
 epoch: 41, train_loss: 0.4789, test_loss: 1.2877, test_f1: 0.6181
 epoch: 42, train_loss: 0.5067, test_loss: 1.2567, test_f1: 0.5959
 epoch: 43, train_loss: 0.4559, test_loss: 1.2819, test_f1: 0.6100
 epoch: 44, train_loss: 0.4571, test_loss: 1.2999, test_f1: 0.6264
 epoch: 45, train_loss: 0.4353, test_loss: 1.3273, test_f1: 0.6078
 epoch: 46, train_loss: 0.4330, test_loss: 1.3025, test_f1: 0.6412
 epoch: 47, train_loss: 0.4283, test_loss: 1.3347, test_f1: 0.6513
 epoch: 48, train_loss: 0.4235, test_loss: 1.3588, test_f1: 0.6131
 epoch: 49, train_loss: 0.4113, test_loss: 1.3608, test_f1: 0.6165
 epoch: 50, train_loss: 0.4092, test_loss: 1.4141, test_f1: 0.6317
 epoch: 51, train_loss: 0.3924, test_loss: 1.3975, test_f1: 0.6183
 epoch: 52, train_loss: 0.3674, test_loss: 1.4332, test_f1: 0.6381
 epoch: 53, train_loss: 0.3550, test_loss: 1.4046, test_f1: 0.6269
 epoch: 54, train_loss: 0.3604, test_loss: 1.4380, test_f1: 0.6322
 epoch: 55, train_loss: 0.3497, test_loss: 1.4884, test_f1: 0.6198
 epoch: 56, train_loss: 0.3327, test_loss: 1.4781, test_f1: 0.6260
 epoch: 57, train_loss: 0.3661, test_loss: 1.5176, test_f1: 0.6297
 epoch: 58, train_loss: 0.3384, test_loss: 1.4948, test_f1: 0.6233
 epoch: 59, train_loss: 0.3332, test_loss: 1.5118, test_f1: 0.6420
 epoch: 60, train_loss: 0.3425, test_loss: 1.5295, test_f1: 0.6175
 epoch: 61, train_loss: 0.3250, test_loss: 1.5631, test_f1: 0.6265
 epoch: 62, train_loss: 0.3393, test_loss: 1.5330, test_f1: 0.6301
 epoch: 63, train_loss: 0.3313, test_loss: 1.5583, test_f1: 0.6188
 epoch: 64, train_loss: 0.3237, test_loss: 1.5998, test_f1: 0.6199
 epoch: 65, train_loss: 0.3184, test_loss: 1.5937, test_f1: 0.6348
 epoch: 66, train_loss: 0.3052, test_loss: 1.6488, test_f1: 0.6158
 epoch: 67, train_loss: 0.3232, test_loss: 1.6174, test_f1: 0.6228
 epoch: 68, train_loss: 0.2984, test_loss: 1.6706, test_f1: 0.6298
 epoch: 69, train_loss: 0.3007, test_loss: 1.6573, test_f1: 0.6101
 epoch: 70, train_loss: 0.2974, test_loss: 1.6621, test_f1: 0.6337
 epoch: 71, train_loss: 0.2939, test_loss: 1.6967, test_f1: 0.6370
 epoch: 72, train_loss: 0.2898, test_loss: 1.7059, test_f1: 0.6155
 epoch: 73, train_loss: 0.3060, test_loss: 1.7472, test_f1: 0.6156
 epoch: 74, train_loss: 0.2898, test_loss: 1.7698, test_f1: 0.6338
 epoch: 75, train_loss: 0.2925, test_loss: 1.7531, test_f1: 0.6144
 epoch: 76, train_loss: 0.2885, test_loss: 1.7605, test_f1: 0.6147
 epoch: 77, train_loss: 0.2617, test_loss: 1.7307, test_f1: 0.6233
 epoch: 78, train_loss: 0.2693, test_loss: 1.7860, test_f1: 0.6242
 epoch: 79, train_loss: 0.2804, test_loss: 1.7519, test_f1: 0.6328
 epoch: 80, train_loss: 0.2658, test_loss: 1.8115, test_f1: 0.6275
 epoch: 81, train_loss: 0.2542, test_loss: 1.8353, test_f1: 0.6270
 epoch: 82, train_loss: 0.2631, test_loss: 1.8805, test_f1: 0.6191
 epoch: 83, train_loss: 0.2519, test_loss: 1.8468, test_f1: 0.6308
 epoch: 84, train_loss: 0.2687, test_loss: 1.8561, test_f1: 0.6138
 epoch: 85, train_loss: 0.2491, test_loss: 1.8221, test_f1: 0.6285
 epoch: 86, train_loss: 0.2465, test_loss: 1.8623, test_f1: 0.6329
 epoch: 87, train_loss: 0.2477, test_loss: 1.8779, test_f1: 0.6256
 epoch: 88, train_loss: 0.2511, test_loss: 1.9051, test_f1: 0.6205
 epoch: 89, train_loss: 0.2538, test_loss: 1.9571, test_f1: 0.6278
 epoch: 90, train_loss: 0.2300, test_loss: 1.9599, test_f1: 0.6329
 epoch: 91, train_loss: 0.2510, test_loss: 2.0173, test_f1: 0.6128
 epoch: 92, train_loss: 0.2339, test_loss: 1.9918, test_f1: 0.5991
 epoch: 93, train_loss: 0.2480, test_loss: 1.9644, test_f1: 0.6084
 epoch: 94, train_loss: 0.2165, test_loss: 2.0389, test_f1: 0.6193
 epoch: 95, train_loss: 0.2299, test_loss: 2.0261, test_f1: 0.6163
 epoch: 96, train_loss: 0.2356, test_loss: 2.0787, test_f1: 0.6209
 epoch: 97, train_loss: 0.2162, test_loss: 2.0749, test_f1: 0.5900
 epoch: 98, train_loss: 0.2216, test_loss: 2.0667, test_f1: 0.6262
 epoch: 99, train_loss: 0.2167, test_loss: 2.1054, test_f1: 0.6211
##################ITERATION #3 ****************************************
 epoch: 0, train_loss: 1.1546, test_loss: 1.2413, test_f1: 0.3232
 epoch: 1, train_loss: 1.0290, test_loss: 1.0679, test_f1: 0.4953
 epoch: 2, train_loss: 0.9908, test_loss: 1.0471, test_f1: 0.4995
 epoch: 3, train_loss: 0.9858, test_loss: 1.0298, test_f1: 0.5302
 epoch: 4, train_loss: 0.9573, test_loss: 1.0248, test_f1: 0.5170
 epoch: 5, train_loss: 0.9206, test_loss: 1.0163, test_f1: 0.5172
 epoch: 6, train_loss: 0.9163, test_loss: 1.0110, test_f1: 0.5334
 epoch: 7, train_loss: 0.8997, test_loss: 0.9940, test_f1: 0.5511
 epoch: 8, train_loss: 0.8826, test_loss: 1.0008, test_f1: 0.5504
 epoch: 9, train_loss: 0.8836, test_loss: 0.9814, test_f1: 0.5680
 epoch: 10, train_loss: 0.8693, test_loss: 0.9771, test_f1: 0.5647
 epoch: 11, train_loss: 0.8557, test_loss: 0.9816, test_f1: 0.5973
 epoch: 12, train_loss: 0.8308, test_loss: 0.9839, test_f1: 0.5821
 epoch: 13, train_loss: 0.8187, test_loss: 0.9775, test_f1: 0.5644
 epoch: 14, train_loss: 0.8096, test_loss: 0.9907, test_f1: 0.5822
 epoch: 15, train_loss: 0.8023, test_loss: 0.9679, test_f1: 0.5773
 epoch: 16, train_loss: 0.7857, test_loss: 1.0120, test_f1: 0.5696
 epoch: 17, train_loss: 0.7617, test_loss: 0.9840, test_f1: 0.6070
 epoch: 18, train_loss: 0.7576, test_loss: 0.9956, test_f1: 0.5953
 epoch: 19, train_loss: 0.7401, test_loss: 0.9982, test_f1: 0.6059
 epoch: 20, train_loss: 0.7259, test_loss: 0.9866, test_f1: 0.6067
 epoch: 21, train_loss: 0.7120, test_loss: 1.0024, test_f1: 0.5971
 epoch: 22, train_loss: 0.6945, test_loss: 0.9938, test_f1: 0.6160
 epoch: 23, train_loss: 0.6882, test_loss: 1.0013, test_f1: 0.6310
 epoch: 24, train_loss: 0.6882, test_loss: 0.9987, test_f1: 0.6174
 epoch: 25, train_loss: 0.6783, test_loss: 1.0327, test_f1: 0.6242
 epoch: 26, train_loss: 0.6603, test_loss: 1.0303, test_f1: 0.6315
 epoch: 27, train_loss: 0.6633, test_loss: 1.0238, test_f1: 0.6220
 epoch: 28, train_loss: 0.6159, test_loss: 1.0732, test_f1: 0.6330
 epoch: 29, train_loss: 0.6237, test_loss: 1.0791, test_f1: 0.6273
 epoch: 30, train_loss: 0.6193, test_loss: 1.0616, test_f1: 0.6401
 epoch: 31, train_loss: 0.5917, test_loss: 1.0831, test_f1: 0.6485
 epoch: 32, train_loss: 0.5862, test_loss: 1.0965, test_f1: 0.6460
 epoch: 33, train_loss: 0.5688, test_loss: 1.1600, test_f1: 0.6139
 epoch: 34, train_loss: 0.5612, test_loss: 1.1254, test_f1: 0.6193
 epoch: 35, train_loss: 0.5561, test_loss: 1.1437, test_f1: 0.6282
 epoch: 36, train_loss: 0.5516, test_loss: 1.1411, test_f1: 0.6296
 epoch: 37, train_loss: 0.5285, test_loss: 1.1386, test_f1: 0.6255
 epoch: 38, train_loss: 0.5485, test_loss: 1.1773, test_f1: 0.6299
 epoch: 39, train_loss: 0.5119, test_loss: 1.1442, test_f1: 0.5965
 epoch: 40, train_loss: 0.5068, test_loss: 1.1914, test_f1: 0.6146
 epoch: 41, train_loss: 0.4899, test_loss: 1.1700, test_f1: 0.6310
 epoch: 42, train_loss: 0.4943, test_loss: 1.2209, test_f1: 0.6320
 epoch: 43, train_loss: 0.4944, test_loss: 1.2003, test_f1: 0.6021
 epoch: 44, train_loss: 0.4836, test_loss: 1.2548, test_f1: 0.6386
 epoch: 45, train_loss: 0.4685, test_loss: 1.2659, test_f1: 0.6241
 epoch: 46, train_loss: 0.4600, test_loss: 1.2431, test_f1: 0.6211
 epoch: 47, train_loss: 0.4538, test_loss: 1.2792, test_f1: 0.6186
 epoch: 48, train_loss: 0.4681, test_loss: 1.3210, test_f1: 0.6137
 epoch: 49, train_loss: 0.4357, test_loss: 1.3518, test_f1: 0.6166
 epoch: 50, train_loss: 0.4212, test_loss: 1.3200, test_f1: 0.6114
 epoch: 51, train_loss: 0.4115, test_loss: 1.3587, test_f1: 0.6137
 epoch: 52, train_loss: 0.3906, test_loss: 1.3815, test_f1: 0.6232
 epoch: 53, train_loss: 0.3867, test_loss: 1.4136, test_f1: 0.6276
 epoch: 54, train_loss: 0.3718, test_loss: 1.4081, test_f1: 0.6231
 epoch: 55, train_loss: 0.3516, test_loss: 1.3905, test_f1: 0.6136
 epoch: 56, train_loss: 0.3715, test_loss: 1.4163, test_f1: 0.6237
 epoch: 57, train_loss: 0.3492, test_loss: 1.4155, test_f1: 0.6216
 epoch: 58, train_loss: 0.3584, test_loss: 1.4637, test_f1: 0.6391
 epoch: 59, train_loss: 0.3437, test_loss: 1.4252, test_f1: 0.6222
 epoch: 60, train_loss: 0.3413, test_loss: 1.4743, test_f1: 0.6209
 epoch: 61, train_loss: 0.3412, test_loss: 1.4525, test_f1: 0.6278
 epoch: 62, train_loss: 0.3414, test_loss: 1.4526, test_f1: 0.6235
 epoch: 63, train_loss: 0.3290, test_loss: 1.4715, test_f1: 0.6278
 epoch: 64, train_loss: 0.3321, test_loss: 1.5147, test_f1: 0.6377
 epoch: 65, train_loss: 0.3325, test_loss: 1.5615, test_f1: 0.6238
 epoch: 66, train_loss: 0.3086, test_loss: 1.5563, test_f1: 0.6230
 epoch: 67, train_loss: 0.3209, test_loss: 1.6269, test_f1: 0.6298
 epoch: 68, train_loss: 0.3008, test_loss: 1.6008, test_f1: 0.6217
 epoch: 69, train_loss: 0.3010, test_loss: 1.6347, test_f1: 0.6340
 epoch: 70, train_loss: 0.2957, test_loss: 1.6103, test_f1: 0.6380
 epoch: 71, train_loss: 0.2687, test_loss: 1.6852, test_f1: 0.6218
 epoch: 72, train_loss: 0.2924, test_loss: 1.6922, test_f1: 0.6318
 epoch: 73, train_loss: 0.2992, test_loss: 1.7278, test_f1: 0.6344
 epoch: 74, train_loss: 0.2809, test_loss: 1.7258, test_f1: 0.6229
 epoch: 75, train_loss: 0.2759, test_loss: 1.7479, test_f1: 0.6194
 epoch: 76, train_loss: 0.2961, test_loss: 1.8036, test_f1: 0.6145
 epoch: 77, train_loss: 0.2933, test_loss: 1.7326, test_f1: 0.6313
 epoch: 78, train_loss: 0.2762, test_loss: 1.6653, test_f1: 0.6200
 epoch: 79, train_loss: 0.2806, test_loss: 1.7275, test_f1: 0.6289
 epoch: 80, train_loss: 0.2760, test_loss: 1.7741, test_f1: 0.6159
 epoch: 81, train_loss: 0.2564, test_loss: 1.8278, test_f1: 0.6117
 epoch: 82, train_loss: 0.2610, test_loss: 1.8418, test_f1: 0.6086
 epoch: 83, train_loss: 0.2631, test_loss: 1.8902, test_f1: 0.6211
 epoch: 84, train_loss: 0.2663, test_loss: 1.9276, test_f1: 0.6031
 epoch: 85, train_loss: 0.2468, test_loss: 1.9232, test_f1: 0.6281
 epoch: 86, train_loss: 0.2626, test_loss: 1.8689, test_f1: 0.6112
 epoch: 87, train_loss: 0.2482, test_loss: 1.9060, test_f1: 0.6169
 epoch: 88, train_loss: 0.2419, test_loss: 1.8994, test_f1: 0.6267
 epoch: 89, train_loss: 0.2335, test_loss: 1.9439, test_f1: 0.6113
 epoch: 90, train_loss: 0.2475, test_loss: 1.9646, test_f1: 0.6287
 epoch: 91, train_loss: 0.2289, test_loss: 1.9409, test_f1: 0.6244
 epoch: 92, train_loss: 0.2332, test_loss: 1.9954, test_f1: 0.6122
 epoch: 93, train_loss: 0.2335, test_loss: 1.9357, test_f1: 0.6206
 epoch: 94, train_loss: 0.2243, test_loss: 1.9615, test_f1: 0.6283
 epoch: 95, train_loss: 0.2286, test_loss: 1.9771, test_f1: 0.6290
 epoch: 96, train_loss: 0.2139, test_loss: 2.0115, test_f1: 0.6309
 epoch: 97, train_loss: 0.2123, test_loss: 2.0369, test_f1: 0.6219
 epoch: 98, train_loss: 0.2272, test_loss: 2.0492, test_f1: 0.6205
 epoch: 99, train_loss: 0.2263, test_loss: 2.0730, test_f1: 0.6419
##################ITERATION #4 ****************************************
 epoch: 0, train_loss: 1.1429, test_loss: 1.3069, test_f1: 0.3042
 epoch: 1, train_loss: 1.0175, test_loss: 1.0578, test_f1: 0.5142
 epoch: 2, train_loss: 0.9675, test_loss: 1.0422, test_f1: 0.5284
 epoch: 3, train_loss: 0.9441, test_loss: 1.0264, test_f1: 0.5615
 epoch: 4, train_loss: 0.9329, test_loss: 1.0197, test_f1: 0.5649
 epoch: 5, train_loss: 0.9152, test_loss: 1.0087, test_f1: 0.5261
 epoch: 6, train_loss: 0.9007, test_loss: 1.0007, test_f1: 0.5649
 epoch: 7, train_loss: 0.8943, test_loss: 0.9979, test_f1: 0.5609
 epoch: 8, train_loss: 0.8822, test_loss: 0.9965, test_f1: 0.5450
 epoch: 9, train_loss: 0.8578, test_loss: 1.0109, test_f1: 0.5649
 epoch: 10, train_loss: 0.8391, test_loss: 1.0038, test_f1: 0.5666
 epoch: 11, train_loss: 0.8300, test_loss: 0.9947, test_f1: 0.5894
 epoch: 12, train_loss: 0.8106, test_loss: 1.0066, test_f1: 0.5759
 epoch: 13, train_loss: 0.8008, test_loss: 1.0431, test_f1: 0.5717
 epoch: 14, train_loss: 0.7778, test_loss: 1.0092, test_f1: 0.5930
 epoch: 15, train_loss: 0.7737, test_loss: 1.0292, test_f1: 0.5713
 epoch: 16, train_loss: 0.7663, test_loss: 1.0219, test_f1: 0.5671
 epoch: 17, train_loss: 0.7667, test_loss: 1.0156, test_f1: 0.5978
 epoch: 18, train_loss: 0.7389, test_loss: 1.0555, test_f1: 0.5946
 epoch: 19, train_loss: 0.7357, test_loss: 1.0360, test_f1: 0.6109
 epoch: 20, train_loss: 0.7077, test_loss: 1.0346, test_f1: 0.5988
 epoch: 21, train_loss: 0.6918, test_loss: 1.0312, test_f1: 0.6502
 epoch: 22, train_loss: 0.6968, test_loss: 1.0552, test_f1: 0.6266
 epoch: 23, train_loss: 0.6766, test_loss: 1.0793, test_f1: 0.5959
 epoch: 24, train_loss: 0.6825, test_loss: 1.0685, test_f1: 0.5782
 epoch: 25, train_loss: 0.6505, test_loss: 1.0992, test_f1: 0.6096
 epoch: 26, train_loss: 0.6391, test_loss: 1.1156, test_f1: 0.6280
 epoch: 27, train_loss: 0.6560, test_loss: 1.0829, test_f1: 0.6220
 epoch: 28, train_loss: 0.6131, test_loss: 1.1002, test_f1: 0.6123
 epoch: 29, train_loss: 0.6160, test_loss: 1.0907, test_f1: 0.6353
 epoch: 30, train_loss: 0.6065, test_loss: 1.1287, test_f1: 0.6337
 epoch: 31, train_loss: 0.6027, test_loss: 1.0966, test_f1: 0.6390
 epoch: 32, train_loss: 0.5825, test_loss: 1.1154, test_f1: 0.6341
 epoch: 33, train_loss: 0.5854, test_loss: 1.1185, test_f1: 0.6315
 epoch: 34, train_loss: 0.5606, test_loss: 1.1423, test_f1: 0.6476
 epoch: 35, train_loss: 0.5474, test_loss: 1.1652, test_f1: 0.6395
 epoch: 36, train_loss: 0.5483, test_loss: 1.1685, test_f1: 0.6195
 epoch: 37, train_loss: 0.5285, test_loss: 1.1909, test_f1: 0.6329
 epoch: 38, train_loss: 0.5382, test_loss: 1.2186, test_f1: 0.6308
 epoch: 39, train_loss: 0.5274, test_loss: 1.2385, test_f1: 0.6104
 epoch: 40, train_loss: 0.5121, test_loss: 1.2682, test_f1: 0.6200
 epoch: 41, train_loss: 0.5179, test_loss: 1.2771, test_f1: 0.6259
 epoch: 42, train_loss: 0.5209, test_loss: 1.2406, test_f1: 0.6574
 epoch: 43, train_loss: 0.5006, test_loss: 1.2975, test_f1: 0.6344
 epoch: 44, train_loss: 0.4876, test_loss: 1.2577, test_f1: 0.6539
 epoch: 45, train_loss: 0.4644, test_loss: 1.3104, test_f1: 0.6447
 epoch: 46, train_loss: 0.4754, test_loss: 1.3057, test_f1: 0.6214
 epoch: 47, train_loss: 0.4609, test_loss: 1.3130, test_f1: 0.6501
 epoch: 48, train_loss: 0.4565, test_loss: 1.3358, test_f1: 0.6589
 epoch: 49, train_loss: 0.4593, test_loss: 1.3155, test_f1: 0.6520
 epoch: 50, train_loss: 0.4537, test_loss: 1.3680, test_f1: 0.6410
 epoch: 51, train_loss: 0.4214, test_loss: 1.3837, test_f1: 0.6400
 epoch: 52, train_loss: 0.4015, test_loss: 1.4313, test_f1: 0.6225
 epoch: 53, train_loss: 0.3897, test_loss: 1.4146, test_f1: 0.6389
 epoch: 54, train_loss: 0.4046, test_loss: 1.4123, test_f1: 0.6493
 epoch: 55, train_loss: 0.4074, test_loss: 1.4164, test_f1: 0.6330
 epoch: 56, train_loss: 0.3851, test_loss: 1.4779, test_f1: 0.6414
 epoch: 57, train_loss: 0.3749, test_loss: 1.4505, test_f1: 0.6566
 epoch: 58, train_loss: 0.3832, test_loss: 1.5091, test_f1: 0.6518
 epoch: 59, train_loss: 0.3598, test_loss: 1.5149, test_f1: 0.6284
 epoch: 60, train_loss: 0.3700, test_loss: 1.4756, test_f1: 0.6512
 epoch: 61, train_loss: 0.3849, test_loss: 1.5430, test_f1: 0.6470
 epoch: 62, train_loss: 0.3783, test_loss: 1.5471, test_f1: 0.6428
 epoch: 63, train_loss: 0.3583, test_loss: 1.4921, test_f1: 0.6370
 epoch: 64, train_loss: 0.3529, test_loss: 1.5933, test_f1: 0.6274
 epoch: 65, train_loss: 0.3433, test_loss: 1.6261, test_f1: 0.6368
 epoch: 66, train_loss: 0.3482, test_loss: 1.5803, test_f1: 0.6442
 epoch: 67, train_loss: 0.3574, test_loss: 1.6011, test_f1: 0.6411
 epoch: 68, train_loss: 0.3486, test_loss: 1.6143, test_f1: 0.6299
 epoch: 69, train_loss: 0.3287, test_loss: 1.6234, test_f1: 0.6256
 epoch: 70, train_loss: 0.3402, test_loss: 1.6535, test_f1: 0.6293
 epoch: 71, train_loss: 0.3499, test_loss: 1.6272, test_f1: 0.6225
 epoch: 72, train_loss: 0.3300, test_loss: 1.5933, test_f1: 0.6659
 epoch: 73, train_loss: 0.3089, test_loss: 1.6720, test_f1: 0.6547
 epoch: 74, train_loss: 0.3173, test_loss: 1.7221, test_f1: 0.6279
 epoch: 75, train_loss: 0.3176, test_loss: 1.6798, test_f1: 0.6453
 epoch: 76, train_loss: 0.3138, test_loss: 1.7630, test_f1: 0.6172
 epoch: 77, train_loss: 0.3099, test_loss: 1.7013, test_f1: 0.6432
 epoch: 78, train_loss: 0.2863, test_loss: 1.7463, test_f1: 0.6279
 epoch: 79, train_loss: 0.3193, test_loss: 1.7380, test_f1: 0.6518
 epoch: 80, train_loss: 0.3127, test_loss: 1.7652, test_f1: 0.6261
 epoch: 81, train_loss: 0.2733, test_loss: 1.7772, test_f1: 0.6490
 epoch: 82, train_loss: 0.2739, test_loss: 1.7675, test_f1: 0.6402
 epoch: 83, train_loss: 0.2898, test_loss: 1.8084, test_f1: 0.6300
 epoch: 84, train_loss: 0.2814, test_loss: 1.8569, test_f1: 0.6157
 epoch: 85, train_loss: 0.2921, test_loss: 1.8423, test_f1: 0.6317
 epoch: 86, train_loss: 0.2784, test_loss: 1.8170, test_f1: 0.6410
 epoch: 87, train_loss: 0.2539, test_loss: 1.8803, test_f1: 0.6306
 epoch: 88, train_loss: 0.2647, test_loss: 1.8589, test_f1: 0.6249
 epoch: 89, train_loss: 0.2761, test_loss: 1.9550, test_f1: 0.6178
 epoch: 90, train_loss: 0.2848, test_loss: 1.8533, test_f1: 0.6331
 epoch: 91, train_loss: 0.2591, test_loss: 1.9842, test_f1: 0.6300
 epoch: 92, train_loss: 0.2739, test_loss: 2.0124, test_f1: 0.6210
 epoch: 93, train_loss: 0.2480, test_loss: 1.9211, test_f1: 0.6358
 epoch: 94, train_loss: 0.2587, test_loss: 1.9409, test_f1: 0.6251
 epoch: 95, train_loss: 0.2448, test_loss: 2.0243, test_f1: 0.6158
 epoch: 96, train_loss: 0.2351, test_loss: 2.1394, test_f1: 0.6237
 epoch: 97, train_loss: 0.2456, test_loss: 1.9494, test_f1: 0.6365
 epoch: 98, train_loss: 0.2594, test_loss: 2.0630, test_f1: 0.6219
 epoch: 99, train_loss: 0.2526, test_loss: 2.1442, test_f1: 0.6101
##################ITERATION #5 ****************************************
 epoch: 0, train_loss: 1.1789, test_loss: 1.2656, test_f1: 0.3350
 epoch: 1, train_loss: 1.0149, test_loss: 1.0648, test_f1: 0.5243
 epoch: 2, train_loss: 0.9906, test_loss: 1.0588, test_f1: 0.5533
 epoch: 3, train_loss: 0.9409, test_loss: 1.0396, test_f1: 0.5415
 epoch: 4, train_loss: 0.9209, test_loss: 1.0446, test_f1: 0.5549
 epoch: 5, train_loss: 0.9046, test_loss: 1.0441, test_f1: 0.5686
 epoch: 6, train_loss: 0.8898, test_loss: 1.0345, test_f1: 0.5669
 epoch: 7, train_loss: 0.8707, test_loss: 1.0166, test_f1: 0.5720
 epoch: 8, train_loss: 0.8607, test_loss: 1.0295, test_f1: 0.5776
 epoch: 9, train_loss: 0.8535, test_loss: 1.0257, test_f1: 0.5796
 epoch: 10, train_loss: 0.8226, test_loss: 1.0279, test_f1: 0.5663
 epoch: 11, train_loss: 0.8135, test_loss: 1.0332, test_f1: 0.5691
 epoch: 12, train_loss: 0.8154, test_loss: 1.0186, test_f1: 0.5760
 epoch: 13, train_loss: 0.7741, test_loss: 1.0235, test_f1: 0.5887
 epoch: 14, train_loss: 0.7614, test_loss: 1.0224, test_f1: 0.6145
 epoch: 15, train_loss: 0.7519, test_loss: 1.0377, test_f1: 0.5377
 epoch: 16, train_loss: 0.7397, test_loss: 1.0552, test_f1: 0.5693
 epoch: 17, train_loss: 0.7147, test_loss: 1.0665, test_f1: 0.5783
 epoch: 18, train_loss: 0.7112, test_loss: 1.0672, test_f1: 0.6145
 epoch: 19, train_loss: 0.6830, test_loss: 1.0477, test_f1: 0.6087
 epoch: 20, train_loss: 0.6715, test_loss: 1.0801, test_f1: 0.6434
 epoch: 21, train_loss: 0.6785, test_loss: 1.1083, test_f1: 0.5965
 epoch: 22, train_loss: 0.6678, test_loss: 1.1045, test_f1: 0.5768
 epoch: 23, train_loss: 0.6405, test_loss: 1.1124, test_f1: 0.6016
 epoch: 24, train_loss: 0.6323, test_loss: 1.1117, test_f1: 0.6133
 epoch: 25, train_loss: 0.6049, test_loss: 1.1355, test_f1: 0.6435
 epoch: 26, train_loss: 0.6228, test_loss: 1.1959, test_f1: 0.6208
 epoch: 27, train_loss: 0.6034, test_loss: 1.1458, test_f1: 0.5910
 epoch: 28, train_loss: 0.5871, test_loss: 1.1804, test_f1: 0.6341
 epoch: 29, train_loss: 0.5635, test_loss: 1.1748, test_f1: 0.5997
 epoch: 30, train_loss: 0.5385, test_loss: 1.1915, test_f1: 0.6133
 epoch: 31, train_loss: 0.5527, test_loss: 1.1901, test_f1: 0.6251
 epoch: 32, train_loss: 0.5576, test_loss: 1.2390, test_f1: 0.6134
 epoch: 33, train_loss: 0.5378, test_loss: 1.2801, test_f1: 0.6214
 epoch: 34, train_loss: 0.5304, test_loss: 1.2957, test_f1: 0.6013
 epoch: 35, train_loss: 0.5129, test_loss: 1.2700, test_f1: 0.6150
 epoch: 36, train_loss: 0.5018, test_loss: 1.3098, test_f1: 0.6261
 epoch: 37, train_loss: 0.5138, test_loss: 1.2871, test_f1: 0.6334
 epoch: 38, train_loss: 0.4875, test_loss: 1.4073, test_f1: 0.6044
 epoch: 39, train_loss: 0.4894, test_loss: 1.4106, test_f1: 0.5867
 epoch: 40, train_loss: 0.4740, test_loss: 1.4538, test_f1: 0.6322
 epoch: 41, train_loss: 0.4756, test_loss: 1.4718, test_f1: 0.6317
 epoch: 42, train_loss: 0.4494, test_loss: 1.4617, test_f1: 0.6213
 epoch: 43, train_loss: 0.4535, test_loss: 1.4973, test_f1: 0.6085
 epoch: 44, train_loss: 0.4501, test_loss: 1.4536, test_f1: 0.6124
 epoch: 45, train_loss: 0.4192, test_loss: 1.5874, test_f1: 0.6078
 epoch: 46, train_loss: 0.4448, test_loss: 1.5601, test_f1: 0.6136
 epoch: 47, train_loss: 0.4092, test_loss: 1.5999, test_f1: 0.6241
 epoch: 48, train_loss: 0.4086, test_loss: 1.5698, test_f1: 0.6227
 epoch: 49, train_loss: 0.4017, test_loss: 1.6049, test_f1: 0.6372
 epoch: 50, train_loss: 0.3994, test_loss: 1.6137, test_f1: 0.6236
 epoch: 51, train_loss: 0.3873, test_loss: 1.5712, test_f1: 0.6250
 epoch: 52, train_loss: 0.3612, test_loss: 1.5630, test_f1: 0.6276
 epoch: 53, train_loss: 0.3587, test_loss: 1.5668, test_f1: 0.6379
 epoch: 54, train_loss: 0.3609, test_loss: 1.6418, test_f1: 0.6197
 epoch: 55, train_loss: 0.3628, test_loss: 1.6075, test_f1: 0.6352
 epoch: 56, train_loss: 0.3389, test_loss: 1.6271, test_f1: 0.6285
 epoch: 57, train_loss: 0.3436, test_loss: 1.6467, test_f1: 0.6208
 epoch: 58, train_loss: 0.3243, test_loss: 1.6422, test_f1: 0.6274
 epoch: 59, train_loss: 0.3201, test_loss: 1.6679, test_f1: 0.6124
 epoch: 60, train_loss: 0.3291, test_loss: 1.6429, test_f1: 0.6445
 epoch: 61, train_loss: 0.3260, test_loss: 1.7247, test_f1: 0.6137
 epoch: 62, train_loss: 0.3137, test_loss: 1.7776, test_f1: 0.6208
 epoch: 63, train_loss: 0.3097, test_loss: 1.8116, test_f1: 0.6210
 epoch: 64, train_loss: 0.3380, test_loss: 1.7397, test_f1: 0.6367
 epoch: 65, train_loss: 0.2998, test_loss: 1.8482, test_f1: 0.6266
 epoch: 66, train_loss: 0.2923, test_loss: 1.8013, test_f1: 0.6277
 epoch: 67, train_loss: 0.3128, test_loss: 1.7947, test_f1: 0.6190
 epoch: 68, train_loss: 0.3020, test_loss: 1.8373, test_f1: 0.6278
 epoch: 69, train_loss: 0.2988, test_loss: 1.7998, test_f1: 0.6165
 epoch: 70, train_loss: 0.2957, test_loss: 1.7897, test_f1: 0.6140
 epoch: 71, train_loss: 0.2857, test_loss: 1.8940, test_f1: 0.6036
 epoch: 72, train_loss: 0.2784, test_loss: 1.8890, test_f1: 0.6087
 epoch: 73, train_loss: 0.2762, test_loss: 1.8692, test_f1: 0.6179
 epoch: 74, train_loss: 0.2660, test_loss: 1.8363, test_f1: 0.6155
 epoch: 75, train_loss: 0.2874, test_loss: 1.9294, test_f1: 0.6070
 epoch: 76, train_loss: 0.2845, test_loss: 1.9680, test_f1: 0.6151
 epoch: 77, train_loss: 0.2583, test_loss: 2.0377, test_f1: 0.6001
 epoch: 78, train_loss: 0.2688, test_loss: 1.9654, test_f1: 0.6046
 epoch: 79, train_loss: 0.2608, test_loss: 2.0201, test_f1: 0.6050
 epoch: 80, train_loss: 0.2765, test_loss: 2.0894, test_f1: 0.6152
 epoch: 81, train_loss: 0.2612, test_loss: 2.0166, test_f1: 0.6112
 epoch: 82, train_loss: 0.2741, test_loss: 2.0457, test_f1: 0.5983
 epoch: 83, train_loss: 0.2420, test_loss: 2.1516, test_f1: 0.6152
 epoch: 84, train_loss: 0.2515, test_loss: 2.0848, test_f1: 0.5988
 epoch: 85, train_loss: 0.2676, test_loss: 2.0509, test_f1: 0.6058
 epoch: 86, train_loss: 0.2708, test_loss: 2.0545, test_f1: 0.6132
 epoch: 87, train_loss: 0.2369, test_loss: 2.1690, test_f1: 0.5976
 epoch: 88, train_loss: 0.2337, test_loss: 2.1053, test_f1: 0.6096
 epoch: 89, train_loss: 0.2428, test_loss: 2.1684, test_f1: 0.6069
 epoch: 90, train_loss: 0.2345, test_loss: 2.1053, test_f1: 0.6060
 epoch: 91, train_loss: 0.2324, test_loss: 2.1491, test_f1: 0.6181
 epoch: 92, train_loss: 0.2522, test_loss: 2.1197, test_f1: 0.6085
 epoch: 93, train_loss: 0.2305, test_loss: 2.1300, test_f1: 0.6073
 epoch: 94, train_loss: 0.2418, test_loss: 2.2432, test_f1: 0.5943
 epoch: 95, train_loss: 0.2384, test_loss: 2.2277, test_f1: 0.5893
 epoch: 96, train_loss: 0.2194, test_loss: 2.0861, test_f1: 0.6128
 epoch: 97, train_loss: 0.2051, test_loss: 2.1902, test_f1: 0.6217
 epoch: 98, train_loss: 0.2082, test_loss: 2.1396, test_f1: 0.6154
 epoch: 99, train_loss: 0.2233, test_loss: 2.3299, test_f1: 0.6069
##################ITERATION #6 ****************************************
 epoch: 0, train_loss: 1.1864, test_loss: 1.3790, test_f1: 0.3046
 epoch: 1, train_loss: 1.0203, test_loss: 1.0660, test_f1: 0.5246
 epoch: 2, train_loss: 0.9864, test_loss: 1.0494, test_f1: 0.5739
 epoch: 3, train_loss: 0.9407, test_loss: 1.0350, test_f1: 0.5673
 epoch: 4, train_loss: 0.9275, test_loss: 1.0398, test_f1: 0.5509
 epoch: 5, train_loss: 0.9022, test_loss: 1.0498, test_f1: 0.5568
 epoch: 6, train_loss: 0.8771, test_loss: 1.0290, test_f1: 0.5764
 epoch: 7, train_loss: 0.8649, test_loss: 1.0252, test_f1: 0.5787
 epoch: 8, train_loss: 0.8379, test_loss: 1.0255, test_f1: 0.5576
 epoch: 9, train_loss: 0.8193, test_loss: 1.0385, test_f1: 0.5716
 epoch: 10, train_loss: 0.8042, test_loss: 1.0245, test_f1: 0.5609
 epoch: 11, train_loss: 0.7817, test_loss: 1.0488, test_f1: 0.5379
 epoch: 12, train_loss: 0.7779, test_loss: 1.0381, test_f1: 0.5875
 epoch: 13, train_loss: 0.7607, test_loss: 1.0453, test_f1: 0.5802
 epoch: 14, train_loss: 0.7422, test_loss: 1.0395, test_f1: 0.5813
 epoch: 15, train_loss: 0.7322, test_loss: 1.0687, test_f1: 0.5813
 epoch: 16, train_loss: 0.7426, test_loss: 1.0481, test_f1: 0.5987
 epoch: 17, train_loss: 0.7048, test_loss: 1.0770, test_f1: 0.5685
 epoch: 18, train_loss: 0.6972, test_loss: 1.0552, test_f1: 0.5827
 epoch: 19, train_loss: 0.6879, test_loss: 1.0728, test_f1: 0.6074
 epoch: 20, train_loss: 0.6536, test_loss: 1.0822, test_f1: 0.5885
 epoch: 21, train_loss: 0.6609, test_loss: 1.0624, test_f1: 0.5733
 epoch: 22, train_loss: 0.6419, test_loss: 1.0887, test_f1: 0.6185
 epoch: 23, train_loss: 0.6434, test_loss: 1.0847, test_f1: 0.5951
 epoch: 24, train_loss: 0.6136, test_loss: 1.2022, test_f1: 0.5985
 epoch: 25, train_loss: 0.6198, test_loss: 1.0994, test_f1: 0.5988
 epoch: 26, train_loss: 0.5985, test_loss: 1.0996, test_f1: 0.6092
 epoch: 27, train_loss: 0.5912, test_loss: 1.1465, test_f1: 0.5749
 epoch: 28, train_loss: 0.5708, test_loss: 1.1720, test_f1: 0.6129
 epoch: 29, train_loss: 0.5939, test_loss: 1.1833, test_f1: 0.5741
 epoch: 30, train_loss: 0.5770, test_loss: 1.1603, test_f1: 0.6017
 epoch: 31, train_loss: 0.5480, test_loss: 1.1941, test_f1: 0.5957
 epoch: 32, train_loss: 0.5539, test_loss: 1.1907, test_f1: 0.6048
 epoch: 33, train_loss: 0.5466, test_loss: 1.1593, test_f1: 0.6326
 epoch: 34, train_loss: 0.5170, test_loss: 1.2675, test_f1: 0.6242
 epoch: 35, train_loss: 0.5205, test_loss: 1.2332, test_f1: 0.6018
 epoch: 36, train_loss: 0.5006, test_loss: 1.2673, test_f1: 0.6076
 epoch: 37, train_loss: 0.4984, test_loss: 1.3223, test_f1: 0.5928
 epoch: 38, train_loss: 0.4965, test_loss: 1.3281, test_f1: 0.5972
 epoch: 39, train_loss: 0.4739, test_loss: 1.3369, test_f1: 0.6115
 epoch: 40, train_loss: 0.4674, test_loss: 1.3180, test_f1: 0.5996
 epoch: 41, train_loss: 0.4877, test_loss: 1.3051, test_f1: 0.5946
 epoch: 42, train_loss: 0.4880, test_loss: 1.2998, test_f1: 0.6402
 epoch: 43, train_loss: 0.4670, test_loss: 1.3617, test_f1: 0.5877
 epoch: 44, train_loss: 0.4291, test_loss: 1.4034, test_f1: 0.6028
 epoch: 45, train_loss: 0.4351, test_loss: 1.3236, test_f1: 0.5951
 epoch: 46, train_loss: 0.4322, test_loss: 1.4215, test_f1: 0.6152
 epoch: 47, train_loss: 0.4116, test_loss: 1.4712, test_f1: 0.5919
 epoch: 48, train_loss: 0.4088, test_loss: 1.4276, test_f1: 0.6205
 epoch: 49, train_loss: 0.4297, test_loss: 1.4256, test_f1: 0.5979
 epoch: 50, train_loss: 0.3961, test_loss: 1.4574, test_f1: 0.5918
 epoch: 51, train_loss: 0.3962, test_loss: 1.4509, test_f1: 0.6107
 epoch: 52, train_loss: 0.3474, test_loss: 1.5100, test_f1: 0.5998
 epoch: 53, train_loss: 0.3799, test_loss: 1.5490, test_f1: 0.6051
 epoch: 54, train_loss: 0.3445, test_loss: 1.4921, test_f1: 0.5954
 epoch: 55, train_loss: 0.3400, test_loss: 1.5332, test_f1: 0.6084
 epoch: 56, train_loss: 0.3332, test_loss: 1.5574, test_f1: 0.5871
 epoch: 57, train_loss: 0.3294, test_loss: 1.5378, test_f1: 0.6001
 epoch: 58, train_loss: 0.3374, test_loss: 1.5816, test_f1: 0.5977
 epoch: 59, train_loss: 0.3467, test_loss: 1.6090, test_f1: 0.5739
 epoch: 60, train_loss: 0.3437, test_loss: 1.5372, test_f1: 0.5926
 epoch: 61, train_loss: 0.3313, test_loss: 1.6422, test_f1: 0.5545
 epoch: 62, train_loss: 0.2903, test_loss: 1.6040, test_f1: 0.6001
 epoch: 63, train_loss: 0.3308, test_loss: 1.6077, test_f1: 0.6051
 epoch: 64, train_loss: 0.3173, test_loss: 1.6797, test_f1: 0.5923
 epoch: 65, train_loss: 0.3088, test_loss: 1.5548, test_f1: 0.6074
 epoch: 66, train_loss: 0.3076, test_loss: 1.6520, test_f1: 0.6082
 epoch: 67, train_loss: 0.3078, test_loss: 1.6056, test_f1: 0.6060
 epoch: 68, train_loss: 0.2910, test_loss: 1.5859, test_f1: 0.6084
 epoch: 69, train_loss: 0.2990, test_loss: 1.6731, test_f1: 0.5992
 epoch: 70, train_loss: 0.2773, test_loss: 1.7288, test_f1: 0.6014
 epoch: 71, train_loss: 0.3044, test_loss: 1.6830, test_f1: 0.5886
 epoch: 72, train_loss: 0.2711, test_loss: 1.7051, test_f1: 0.6084
 epoch: 73, train_loss: 0.2868, test_loss: 1.7178, test_f1: 0.5954
 epoch: 74, train_loss: 0.2899, test_loss: 1.7561, test_f1: 0.5878
 epoch: 75, train_loss: 0.2957, test_loss: 1.7681, test_f1: 0.5955
 epoch: 76, train_loss: 0.2821, test_loss: 1.7711, test_f1: 0.6039
 epoch: 77, train_loss: 0.2905, test_loss: 1.7770, test_f1: 0.6012
 epoch: 78, train_loss: 0.2606, test_loss: 1.7958, test_f1: 0.6023
 epoch: 79, train_loss: 0.2785, test_loss: 1.7569, test_f1: 0.6090
 epoch: 80, train_loss: 0.2677, test_loss: 1.8091, test_f1: 0.5836
 epoch: 81, train_loss: 0.2561, test_loss: 1.8168, test_f1: 0.5981
 epoch: 82, train_loss: 0.2488, test_loss: 1.8468, test_f1: 0.5725
 epoch: 83, train_loss: 0.2662, test_loss: 1.8462, test_f1: 0.6181
 epoch: 84, train_loss: 0.2659, test_loss: 1.8783, test_f1: 0.5887
 epoch: 85, train_loss: 0.2559, test_loss: 1.9014, test_f1: 0.5984
 epoch: 86, train_loss: 0.2493, test_loss: 1.8384, test_f1: 0.6075
 epoch: 87, train_loss: 0.2438, test_loss: 1.8528, test_f1: 0.6271
 epoch: 88, train_loss: 0.2559, test_loss: 1.9278, test_f1: 0.6056
 epoch: 89, train_loss: 0.2362, test_loss: 1.8520, test_f1: 0.5876
 epoch: 90, train_loss: 0.2412, test_loss: 1.9819, test_f1: 0.5775
 epoch: 91, train_loss: 0.2426, test_loss: 1.9334, test_f1: 0.6108
 epoch: 92, train_loss: 0.2332, test_loss: 1.8888, test_f1: 0.6158
 epoch: 93, train_loss: 0.2491, test_loss: 1.9178, test_f1: 0.6260
 epoch: 94, train_loss: 0.2198, test_loss: 1.9799, test_f1: 0.5965
 epoch: 95, train_loss: 0.2236, test_loss: 1.9875, test_f1: 0.5882
 epoch: 96, train_loss: 0.2401, test_loss: 2.0543, test_f1: 0.5768
 epoch: 97, train_loss: 0.2042, test_loss: 2.0526, test_f1: 0.5874
 epoch: 98, train_loss: 0.2159, test_loss: 2.0381, test_f1: 0.6092
 epoch: 99, train_loss: 0.2210, test_loss: 2.0102, test_f1: 0.6020
##################ITERATION #7 ****************************************
 epoch: 0, train_loss: 1.1959, test_loss: 1.2533, test_f1: 0.4355
 epoch: 1, train_loss: 1.0407, test_loss: 1.0669, test_f1: 0.4990
 epoch: 2, train_loss: 1.0132, test_loss: 1.0598, test_f1: 0.5197
 epoch: 3, train_loss: 0.9730, test_loss: 1.0536, test_f1: 0.5078
 epoch: 4, train_loss: 0.9303, test_loss: 1.0159, test_f1: 0.5453
 epoch: 5, train_loss: 0.9262, test_loss: 1.0199, test_f1: 0.5289
 epoch: 6, train_loss: 0.8809, test_loss: 1.0241, test_f1: 0.5248
 epoch: 7, train_loss: 0.8566, test_loss: 1.0094, test_f1: 0.5592
 epoch: 8, train_loss: 0.8449, test_loss: 1.0218, test_f1: 0.5423
 epoch: 9, train_loss: 0.8510, test_loss: 1.0215, test_f1: 0.5301
 epoch: 10, train_loss: 0.8046, test_loss: 1.0254, test_f1: 0.5172
 epoch: 11, train_loss: 0.8115, test_loss: 1.0219, test_f1: 0.5630
 epoch: 12, train_loss: 0.7867, test_loss: 1.0213, test_f1: 0.5714
 epoch: 13, train_loss: 0.7383, test_loss: 1.0310, test_f1: 0.5362
 epoch: 14, train_loss: 0.7496, test_loss: 1.0405, test_f1: 0.5913
 epoch: 15, train_loss: 0.7396, test_loss: 1.0332, test_f1: 0.5739
 epoch: 16, train_loss: 0.7261, test_loss: 1.0435, test_f1: 0.5811
 epoch: 17, train_loss: 0.7190, test_loss: 1.0276, test_f1: 0.5597
 epoch: 18, train_loss: 0.7003, test_loss: 1.0427, test_f1: 0.5649
 epoch: 19, train_loss: 0.6926, test_loss: 1.0636, test_f1: 0.5842
 epoch: 20, train_loss: 0.6649, test_loss: 1.0935, test_f1: 0.5561
 epoch: 21, train_loss: 0.6531, test_loss: 1.0812, test_f1: 0.5755
 epoch: 22, train_loss: 0.6619, test_loss: 1.1062, test_f1: 0.5717
 epoch: 23, train_loss: 0.6451, test_loss: 1.0933, test_f1: 0.6302
 epoch: 24, train_loss: 0.6152, test_loss: 1.0826, test_f1: 0.5870
 epoch: 25, train_loss: 0.6169, test_loss: 1.1095, test_f1: 0.6152
 epoch: 26, train_loss: 0.5843, test_loss: 1.1126, test_f1: 0.6050
 epoch: 27, train_loss: 0.6047, test_loss: 1.1374, test_f1: 0.5851
 epoch: 28, train_loss: 0.5927, test_loss: 1.1397, test_f1: 0.5940
 epoch: 29, train_loss: 0.5741, test_loss: 1.1892, test_f1: 0.5721
 epoch: 30, train_loss: 0.5520, test_loss: 1.1945, test_f1: 0.6078
 epoch: 31, train_loss: 0.5830, test_loss: 1.2105, test_f1: 0.5955
 epoch: 32, train_loss: 0.5538, test_loss: 1.1429, test_f1: 0.6502
 epoch: 33, train_loss: 0.5416, test_loss: 1.2381, test_f1: 0.5901
 epoch: 34, train_loss: 0.5173, test_loss: 1.2342, test_f1: 0.6091
 epoch: 35, train_loss: 0.5274, test_loss: 1.2461, test_f1: 0.6286
 epoch: 36, train_loss: 0.4995, test_loss: 1.2664, test_f1: 0.6034
 epoch: 37, train_loss: 0.5053, test_loss: 1.2410, test_f1: 0.6195
 epoch: 38, train_loss: 0.5041, test_loss: 1.3480, test_f1: 0.6171
 epoch: 39, train_loss: 0.4824, test_loss: 1.2953, test_f1: 0.5919
 epoch: 40, train_loss: 0.4722, test_loss: 1.3161, test_f1: 0.5871
 epoch: 41, train_loss: 0.4508, test_loss: 1.3735, test_f1: 0.6347
 epoch: 42, train_loss: 0.4685, test_loss: 1.3519, test_f1: 0.6348
 epoch: 43, train_loss: 0.4528, test_loss: 1.3699, test_f1: 0.6199
 epoch: 44, train_loss: 0.4443, test_loss: 1.4532, test_f1: 0.5888
 epoch: 45, train_loss: 0.4460, test_loss: 1.4248, test_f1: 0.6161
 epoch: 46, train_loss: 0.4443, test_loss: 1.4432, test_f1: 0.6070
 epoch: 47, train_loss: 0.4317, test_loss: 1.4792, test_f1: 0.6032
 epoch: 48, train_loss: 0.4282, test_loss: 1.4832, test_f1: 0.6022
 epoch: 49, train_loss: 0.4071, test_loss: 1.4933, test_f1: 0.6187
 epoch: 50, train_loss: 0.3818, test_loss: 1.5491, test_f1: 0.6146
 epoch: 51, train_loss: 0.3680, test_loss: 1.4842, test_f1: 0.6168
 epoch: 52, train_loss: 0.3617, test_loss: 1.5837, test_f1: 0.6290
 epoch: 53, train_loss: 0.3620, test_loss: 1.5230, test_f1: 0.6110
 epoch: 54, train_loss: 0.3622, test_loss: 1.5705, test_f1: 0.6041
 epoch: 55, train_loss: 0.3533, test_loss: 1.5492, test_f1: 0.6114
 epoch: 56, train_loss: 0.3523, test_loss: 1.5908, test_f1: 0.6126
 epoch: 57, train_loss: 0.3398, test_loss: 1.6670, test_f1: 0.6096
 epoch: 58, train_loss: 0.3449, test_loss: 1.6740, test_f1: 0.5984
 epoch: 59, train_loss: 0.3148, test_loss: 1.6981, test_f1: 0.6024
 epoch: 60, train_loss: 0.2978, test_loss: 1.7280, test_f1: 0.6171
 epoch: 61, train_loss: 0.3221, test_loss: 1.6766, test_f1: 0.6204
 epoch: 62, train_loss: 0.3179, test_loss: 1.7182, test_f1: 0.6179
 epoch: 63, train_loss: 0.3116, test_loss: 1.7593, test_f1: 0.6191
 epoch: 64, train_loss: 0.3014, test_loss: 1.7843, test_f1: 0.6148
 epoch: 65, train_loss: 0.2997, test_loss: 1.8529, test_f1: 0.6067
 epoch: 66, train_loss: 0.3025, test_loss: 1.8513, test_f1: 0.6172
 epoch: 67, train_loss: 0.2893, test_loss: 1.7977, test_f1: 0.6163
 epoch: 68, train_loss: 0.3093, test_loss: 1.8047, test_f1: 0.6064
 epoch: 69, train_loss: 0.3042, test_loss: 1.8462, test_f1: 0.6222
 epoch: 70, train_loss: 0.2999, test_loss: 1.8331, test_f1: 0.6124
 epoch: 71, train_loss: 0.2864, test_loss: 1.9399, test_f1: 0.6120
 epoch: 72, train_loss: 0.2985, test_loss: 1.8567, test_f1: 0.6224
 epoch: 73, train_loss: 0.2957, test_loss: 1.8509, test_f1: 0.6154
 epoch: 74, train_loss: 0.2897, test_loss: 1.8709, test_f1: 0.6154
 epoch: 75, train_loss: 0.2651, test_loss: 1.9215, test_f1: 0.6137
 epoch: 76, train_loss: 0.2816, test_loss: 2.0220, test_f1: 0.6107
 epoch: 77, train_loss: 0.2574, test_loss: 1.9910, test_f1: 0.6129
 epoch: 78, train_loss: 0.2746, test_loss: 1.9625, test_f1: 0.6231
 epoch: 79, train_loss: 0.2692, test_loss: 1.9927, test_f1: 0.6215
 epoch: 80, train_loss: 0.2698, test_loss: 1.9890, test_f1: 0.6127
 epoch: 81, train_loss: 0.2733, test_loss: 2.0439, test_f1: 0.6172
 epoch: 82, train_loss: 0.2486, test_loss: 2.0125, test_f1: 0.6120
 epoch: 83, train_loss: 0.2509, test_loss: 2.0695, test_f1: 0.6173
 epoch: 84, train_loss: 0.2568, test_loss: 2.0503, test_f1: 0.6059
 epoch: 85, train_loss: 0.2616, test_loss: 2.1281, test_f1: 0.6001
 epoch: 86, train_loss: 0.2515, test_loss: 2.0572, test_f1: 0.6060
 epoch: 87, train_loss: 0.2423, test_loss: 2.0887, test_f1: 0.6180
 epoch: 88, train_loss: 0.2173, test_loss: 2.0931, test_f1: 0.6200
 epoch: 89, train_loss: 0.2083, test_loss: 2.1837, test_f1: 0.6108
 epoch: 90, train_loss: 0.2326, test_loss: 2.1515, test_f1: 0.6271
 epoch: 91, train_loss: 0.2281, test_loss: 2.1995, test_f1: 0.6144
 epoch: 92, train_loss: 0.2205, test_loss: 2.1647, test_f1: 0.6183
 epoch: 93, train_loss: 0.2200, test_loss: 2.2107, test_f1: 0.6070
 epoch: 94, train_loss: 0.2353, test_loss: 2.1803, test_f1: 0.6175
 epoch: 95, train_loss: 0.2208, test_loss: 2.2969, test_f1: 0.6226
 epoch: 96, train_loss: 0.2378, test_loss: 2.2664, test_f1: 0.6135
 epoch: 97, train_loss: 0.2175, test_loss: 2.2624, test_f1: 0.6039
 epoch: 98, train_loss: 0.2225, test_loss: 2.2381, test_f1: 0.6152
 epoch: 99, train_loss: 0.2139, test_loss: 2.2809, test_f1: 0.6092
##################ITERATION #8 ****************************************
 epoch: 0, train_loss: 1.2317, test_loss: 1.2931, test_f1: 0.3325
 epoch: 1, train_loss: 1.0582, test_loss: 1.0441, test_f1: 0.4992
 epoch: 2, train_loss: 0.9997, test_loss: 1.0391, test_f1: 0.5022
 epoch: 3, train_loss: 0.9638, test_loss: 1.0361, test_f1: 0.5412
 epoch: 4, train_loss: 0.9189, test_loss: 1.0230, test_f1: 0.5326
 epoch: 5, train_loss: 0.9097, test_loss: 1.0375, test_f1: 0.5390
 epoch: 6, train_loss: 0.8989, test_loss: 1.0112, test_f1: 0.5666
 epoch: 7, train_loss: 0.8655, test_loss: 1.0046, test_f1: 0.5758
 epoch: 8, train_loss: 0.8474, test_loss: 1.0037, test_f1: 0.5709
 epoch: 9, train_loss: 0.8263, test_loss: 1.0063, test_f1: 0.5466
 epoch: 10, train_loss: 0.8225, test_loss: 0.9935, test_f1: 0.5796
 epoch: 11, train_loss: 0.7921, test_loss: 1.0034, test_f1: 0.5668
 epoch: 12, train_loss: 0.7837, test_loss: 0.9783, test_f1: 0.6164
 epoch: 13, train_loss: 0.7800, test_loss: 0.9907, test_f1: 0.5965
 epoch: 14, train_loss: 0.7528, test_loss: 1.0141, test_f1: 0.6008
 epoch: 15, train_loss: 0.7537, test_loss: 1.0174, test_f1: 0.6162
 epoch: 16, train_loss: 0.7309, test_loss: 0.9744, test_f1: 0.6269
 epoch: 17, train_loss: 0.7325, test_loss: 1.0321, test_f1: 0.5925
 epoch: 18, train_loss: 0.7029, test_loss: 1.0143, test_f1: 0.6474
 epoch: 19, train_loss: 0.7006, test_loss: 1.0284, test_f1: 0.6002
 epoch: 20, train_loss: 0.6783, test_loss: 1.0623, test_f1: 0.6213
 epoch: 21, train_loss: 0.6759, test_loss: 1.0414, test_f1: 0.6402
 epoch: 22, train_loss: 0.6760, test_loss: 1.0571, test_f1: 0.6241
 epoch: 23, train_loss: 0.6718, test_loss: 1.0764, test_f1: 0.6495
 epoch: 24, train_loss: 0.6486, test_loss: 1.0257, test_f1: 0.6262
 epoch: 25, train_loss: 0.6484, test_loss: 1.0803, test_f1: 0.6456
 epoch: 26, train_loss: 0.6384, test_loss: 1.0848, test_f1: 0.6132
 epoch: 27, train_loss: 0.6050, test_loss: 1.0890, test_f1: 0.6442
 epoch: 28, train_loss: 0.6024, test_loss: 1.1127, test_f1: 0.5972
 epoch: 29, train_loss: 0.5858, test_loss: 1.1277, test_f1: 0.5993
 epoch: 30, train_loss: 0.5917, test_loss: 1.0985, test_f1: 0.6408
 epoch: 31, train_loss: 0.5791, test_loss: 1.0904, test_f1: 0.6328
 epoch: 32, train_loss: 0.5641, test_loss: 1.1187, test_f1: 0.6515
 epoch: 33, train_loss: 0.5332, test_loss: 1.1216, test_f1: 0.6449
 epoch: 34, train_loss: 0.5642, test_loss: 1.1240, test_f1: 0.6250
 epoch: 35, train_loss: 0.5425, test_loss: 1.1260, test_f1: 0.6409
 epoch: 36, train_loss: 0.5342, test_loss: 1.1522, test_f1: 0.6654
 epoch: 37, train_loss: 0.5368, test_loss: 1.2211, test_f1: 0.6265
 epoch: 38, train_loss: 0.5175, test_loss: 1.1903, test_f1: 0.6211
 epoch: 39, train_loss: 0.5048, test_loss: 1.1606, test_f1: 0.6448
 epoch: 40, train_loss: 0.5059, test_loss: 1.1761, test_f1: 0.6407
 epoch: 41, train_loss: 0.4901, test_loss: 1.1580, test_f1: 0.6533
 epoch: 42, train_loss: 0.4828, test_loss: 1.2160, test_f1: 0.6284
 epoch: 43, train_loss: 0.4568, test_loss: 1.2460, test_f1: 0.6685
 epoch: 44, train_loss: 0.4828, test_loss: 1.2524, test_f1: 0.6317
 epoch: 45, train_loss: 0.4472, test_loss: 1.2427, test_f1: 0.6617
 epoch: 46, train_loss: 0.4387, test_loss: 1.2602, test_f1: 0.6500
 epoch: 47, train_loss: 0.4431, test_loss: 1.2845, test_f1: 0.6574
 epoch: 48, train_loss: 0.4587, test_loss: 1.2969, test_f1: 0.6613
 epoch: 49, train_loss: 0.4467, test_loss: 1.3206, test_f1: 0.6348
 epoch: 50, train_loss: 0.4473, test_loss: 1.3394, test_f1: 0.6443
 epoch: 51, train_loss: 0.4250, test_loss: 1.2945, test_f1: 0.6275
 epoch: 52, train_loss: 0.3814, test_loss: 1.2814, test_f1: 0.6463
 epoch: 53, train_loss: 0.3870, test_loss: 1.3489, test_f1: 0.6650
 epoch: 54, train_loss: 0.3783, test_loss: 1.3303, test_f1: 0.6464
 epoch: 55, train_loss: 0.3844, test_loss: 1.3672, test_f1: 0.6544
 epoch: 56, train_loss: 0.3810, test_loss: 1.3581, test_f1: 0.6525
 epoch: 57, train_loss: 0.3862, test_loss: 1.3806, test_f1: 0.6568
 epoch: 58, train_loss: 0.3516, test_loss: 1.3874, test_f1: 0.6700
 epoch: 59, train_loss: 0.3732, test_loss: 1.4464, test_f1: 0.6439
 epoch: 60, train_loss: 0.3592, test_loss: 1.4460, test_f1: 0.6207
 epoch: 61, train_loss: 0.3474, test_loss: 1.4238, test_f1: 0.6517
 epoch: 62, train_loss: 0.3471, test_loss: 1.4224, test_f1: 0.6582
 epoch: 63, train_loss: 0.3380, test_loss: 1.4274, test_f1: 0.6548
 epoch: 64, train_loss: 0.3255, test_loss: 1.4549, test_f1: 0.6583
 epoch: 65, train_loss: 0.3364, test_loss: 1.4972, test_f1: 0.6542
 epoch: 66, train_loss: 0.3179, test_loss: 1.5211, test_f1: 0.6421
 epoch: 67, train_loss: 0.3182, test_loss: 1.4562, test_f1: 0.6569
 epoch: 68, train_loss: 0.3321, test_loss: 1.5187, test_f1: 0.6587
 epoch: 69, train_loss: 0.3039, test_loss: 1.5239, test_f1: 0.6400
 epoch: 70, train_loss: 0.3066, test_loss: 1.5943, test_f1: 0.6452
 epoch: 71, train_loss: 0.3142, test_loss: 1.5914, test_f1: 0.6356
 epoch: 72, train_loss: 0.2895, test_loss: 1.5750, test_f1: 0.6602
 epoch: 73, train_loss: 0.3043, test_loss: 1.6697, test_f1: 0.6191
 epoch: 74, train_loss: 0.3061, test_loss: 1.6252, test_f1: 0.6401
 epoch: 75, train_loss: 0.2922, test_loss: 1.6161, test_f1: 0.6497
 epoch: 76, train_loss: 0.2996, test_loss: 1.6074, test_f1: 0.6617
 epoch: 77, train_loss: 0.2850, test_loss: 1.6897, test_f1: 0.6351
 epoch: 78, train_loss: 0.2895, test_loss: 1.6434, test_f1: 0.6420
 epoch: 79, train_loss: 0.2854, test_loss: 1.6412, test_f1: 0.6359
 epoch: 80, train_loss: 0.2967, test_loss: 1.6362, test_f1: 0.6266
 epoch: 81, train_loss: 0.2780, test_loss: 1.7096, test_f1: 0.6323
 epoch: 82, train_loss: 0.2813, test_loss: 1.7379, test_f1: 0.6417
 epoch: 83, train_loss: 0.2798, test_loss: 1.6813, test_f1: 0.6433
 epoch: 84, train_loss: 0.2792, test_loss: 1.7288, test_f1: 0.6133
 epoch: 85, train_loss: 0.2994, test_loss: 1.7244, test_f1: 0.6398
 epoch: 86, train_loss: 0.2525, test_loss: 1.6639, test_f1: 0.6600
 epoch: 87, train_loss: 0.2812, test_loss: 1.7198, test_f1: 0.6324
 epoch: 88, train_loss: 0.2648, test_loss: 1.6996, test_f1: 0.6535
 epoch: 89, train_loss: 0.2432, test_loss: 1.7621, test_f1: 0.6400
 epoch: 90, train_loss: 0.2757, test_loss: 1.7499, test_f1: 0.6487
 epoch: 91, train_loss: 0.2672, test_loss: 1.8497, test_f1: 0.6062
 epoch: 92, train_loss: 0.2501, test_loss: 1.8018, test_f1: 0.6428
 epoch: 93, train_loss: 0.2480, test_loss: 1.8207, test_f1: 0.6037
 epoch: 94, train_loss: 0.2374, test_loss: 1.8545, test_f1: 0.5962
 epoch: 95, train_loss: 0.2656, test_loss: 1.8412, test_f1: 0.6241
 epoch: 96, train_loss: 0.2261, test_loss: 1.9004, test_f1: 0.6146
 epoch: 97, train_loss: 0.2568, test_loss: 1.9554, test_f1: 0.6362
 epoch: 98, train_loss: 0.2353, test_loss: 1.8731, test_f1: 0.6244
 epoch: 99, train_loss: 0.2441, test_loss: 1.8882, test_f1: 0.6245
##################ITERATION #9 ****************************************
 epoch: 0, train_loss: 1.2598, test_loss: 1.4030, test_f1: 0.2336
 epoch: 1, train_loss: 1.0408, test_loss: 1.0786, test_f1: 0.5439
 epoch: 2, train_loss: 1.0449, test_loss: 1.0463, test_f1: 0.5360
 epoch: 3, train_loss: 0.9530, test_loss: 1.0288, test_f1: 0.5361
 epoch: 4, train_loss: 0.9400, test_loss: 1.0374, test_f1: 0.5194
 epoch: 5, train_loss: 0.9266, test_loss: 1.0524, test_f1: 0.5035
 epoch: 6, train_loss: 0.8826, test_loss: 1.0423, test_f1: 0.5171
 epoch: 7, train_loss: 0.8540, test_loss: 1.0405, test_f1: 0.5349
 epoch: 8, train_loss: 0.8479, test_loss: 1.0189, test_f1: 0.5463
 epoch: 9, train_loss: 0.8282, test_loss: 1.0070, test_f1: 0.5419
 epoch: 10, train_loss: 0.7997, test_loss: 1.0345, test_f1: 0.5537
 epoch: 11, train_loss: 0.7795, test_loss: 1.0351, test_f1: 0.5373
 epoch: 12, train_loss: 0.7693, test_loss: 1.0089, test_f1: 0.5454
 epoch: 13, train_loss: 0.7640, test_loss: 1.0387, test_f1: 0.5503
 epoch: 14, train_loss: 0.7577, test_loss: 1.0345, test_f1: 0.5833
 epoch: 15, train_loss: 0.7381, test_loss: 1.0339, test_f1: 0.5992
 epoch: 16, train_loss: 0.7295, test_loss: 1.0157, test_f1: 0.5627
 epoch: 17, train_loss: 0.7479, test_loss: 1.0473, test_f1: 0.6049
 epoch: 18, train_loss: 0.7058, test_loss: 1.0413, test_f1: 0.5984
 epoch: 19, train_loss: 0.6873, test_loss: 1.0381, test_f1: 0.5882
 epoch: 20, train_loss: 0.6912, test_loss: 1.0655, test_f1: 0.5958
 epoch: 21, train_loss: 0.6594, test_loss: 1.0738, test_f1: 0.5812
 epoch: 22, train_loss: 0.6495, test_loss: 1.0669, test_f1: 0.6057
 epoch: 23, train_loss: 0.6386, test_loss: 1.0420, test_f1: 0.6133
 epoch: 24, train_loss: 0.6588, test_loss: 1.0510, test_f1: 0.6257
 epoch: 25, train_loss: 0.6295, test_loss: 1.0664, test_f1: 0.6036
 epoch: 26, train_loss: 0.6431, test_loss: 1.0849, test_f1: 0.6163
 epoch: 27, train_loss: 0.6120, test_loss: 1.1245, test_f1: 0.6122
 epoch: 28, train_loss: 0.6087, test_loss: 1.1744, test_f1: 0.6027
 epoch: 29, train_loss: 0.5944, test_loss: 1.1053, test_f1: 0.6117
 epoch: 30, train_loss: 0.6003, test_loss: 1.0949, test_f1: 0.6251
 epoch: 31, train_loss: 0.5557, test_loss: 1.1263, test_f1: 0.5960
 epoch: 32, train_loss: 0.5788, test_loss: 1.1158, test_f1: 0.6215
 epoch: 33, train_loss: 0.5331, test_loss: 1.1475, test_f1: 0.6254
 epoch: 34, train_loss: 0.5375, test_loss: 1.1851, test_f1: 0.6271
 epoch: 35, train_loss: 0.5409, test_loss: 1.1571, test_f1: 0.6384
 epoch: 36, train_loss: 0.5217, test_loss: 1.1496, test_f1: 0.6211
 epoch: 37, train_loss: 0.5056, test_loss: 1.1689, test_f1: 0.6197
 epoch: 38, train_loss: 0.5089, test_loss: 1.1864, test_f1: 0.6486
 epoch: 39, train_loss: 0.5210, test_loss: 1.2547, test_f1: 0.6301
 epoch: 40, train_loss: 0.5120, test_loss: 1.2104, test_f1: 0.6263
 epoch: 41, train_loss: 0.4889, test_loss: 1.2600, test_f1: 0.6297
 epoch: 42, train_loss: 0.4793, test_loss: 1.2379, test_f1: 0.6240
 epoch: 43, train_loss: 0.4715, test_loss: 1.2687, test_f1: 0.6182
 epoch: 44, train_loss: 0.4750, test_loss: 1.2145, test_f1: 0.6438
 epoch: 45, train_loss: 0.4546, test_loss: 1.2436, test_f1: 0.6509
 epoch: 46, train_loss: 0.4587, test_loss: 1.3200, test_f1: 0.6387
 epoch: 47, train_loss: 0.4539, test_loss: 1.2849, test_f1: 0.6342
 epoch: 48, train_loss: 0.4321, test_loss: 1.3416, test_f1: 0.6413
 epoch: 49, train_loss: 0.4359, test_loss: 1.3483, test_f1: 0.6214
 epoch: 50, train_loss: 0.4415, test_loss: 1.3079, test_f1: 0.6133
 epoch: 51, train_loss: 0.4115, test_loss: 1.3091, test_f1: 0.6314
 epoch: 52, train_loss: 0.3800, test_loss: 1.3376, test_f1: 0.6477
 epoch: 53, train_loss: 0.3994, test_loss: 1.3057, test_f1: 0.6607
 epoch: 54, train_loss: 0.3803, test_loss: 1.3531, test_f1: 0.6132
 epoch: 55, train_loss: 0.3670, test_loss: 1.3877, test_f1: 0.6268
 epoch: 56, train_loss: 0.3752, test_loss: 1.3760, test_f1: 0.6297
 epoch: 57, train_loss: 0.3556, test_loss: 1.4020, test_f1: 0.6076
 epoch: 58, train_loss: 0.3580, test_loss: 1.4412, test_f1: 0.6173
 epoch: 59, train_loss: 0.3529, test_loss: 1.4443, test_f1: 0.6291
 epoch: 60, train_loss: 0.3409, test_loss: 1.4661, test_f1: 0.6265
 epoch: 61, train_loss: 0.3307, test_loss: 1.4335, test_f1: 0.6218
 epoch: 62, train_loss: 0.3392, test_loss: 1.4493, test_f1: 0.6302
 epoch: 63, train_loss: 0.3387, test_loss: 1.4615, test_f1: 0.6219
 epoch: 64, train_loss: 0.3424, test_loss: 1.4539, test_f1: 0.6208
 epoch: 65, train_loss: 0.3545, test_loss: 1.4570, test_f1: 0.6320
 epoch: 66, train_loss: 0.3324, test_loss: 1.4886, test_f1: 0.6293
 epoch: 67, train_loss: 0.3075, test_loss: 1.4653, test_f1: 0.6404
 epoch: 68, train_loss: 0.3250, test_loss: 1.4808, test_f1: 0.6294
 epoch: 69, train_loss: 0.3164, test_loss: 1.4977, test_f1: 0.6334
 epoch: 70, train_loss: 0.3098, test_loss: 1.5392, test_f1: 0.6302
 epoch: 71, train_loss: 0.3138, test_loss: 1.5078, test_f1: 0.6294
 epoch: 72, train_loss: 0.3151, test_loss: 1.5529, test_f1: 0.6272
 epoch: 73, train_loss: 0.3188, test_loss: 1.5725, test_f1: 0.6357
 epoch: 74, train_loss: 0.3078, test_loss: 1.5355, test_f1: 0.6349
 epoch: 75, train_loss: 0.3074, test_loss: 1.5861, test_f1: 0.6193
 epoch: 76, train_loss: 0.3075, test_loss: 1.5391, test_f1: 0.6408
 epoch: 77, train_loss: 0.2734, test_loss: 1.5639, test_f1: 0.6155
 epoch: 78, train_loss: 0.2793, test_loss: 1.6157, test_f1: 0.6300
 epoch: 79, train_loss: 0.2787, test_loss: 1.6477, test_f1: 0.6230
 epoch: 80, train_loss: 0.3110, test_loss: 1.6609, test_f1: 0.6333
 epoch: 81, train_loss: 0.2878, test_loss: 1.6978, test_f1: 0.6168
 epoch: 82, train_loss: 0.2872, test_loss: 1.6951, test_f1: 0.6264
 epoch: 83, train_loss: 0.2728, test_loss: 1.7290, test_f1: 0.6289
 epoch: 84, train_loss: 0.2712, test_loss: 1.7131, test_f1: 0.6360
 epoch: 85, train_loss: 0.2745, test_loss: 1.6498, test_f1: 0.6400
 epoch: 86, train_loss: 0.2628, test_loss: 1.7347, test_f1: 0.6329
 epoch: 87, train_loss: 0.2771, test_loss: 1.7557, test_f1: 0.6271
 epoch: 88, train_loss: 0.2815, test_loss: 1.7578, test_f1: 0.6288
 epoch: 89, train_loss: 0.2606, test_loss: 1.7679, test_f1: 0.6263
 epoch: 90, train_loss: 0.2589, test_loss: 1.7532, test_f1: 0.6287
 epoch: 91, train_loss: 0.2394, test_loss: 1.7731, test_f1: 0.6192
 epoch: 92, train_loss: 0.2505, test_loss: 1.7596, test_f1: 0.6133
 epoch: 93, train_loss: 0.2470, test_loss: 1.7777, test_f1: 0.6321
 epoch: 94, train_loss: 0.2311, test_loss: 1.8477, test_f1: 0.6396
 epoch: 95, train_loss: 0.2347, test_loss: 1.7718, test_f1: 0.6318
 epoch: 96, train_loss: 0.2324, test_loss: 1.8146, test_f1: 0.6479
 epoch: 97, train_loss: 0.2361, test_loss: 1.8521, test_f1: 0.6267
 epoch: 98, train_loss: 0.2311, test_loss: 1.8592, test_f1: 0.6258
 epoch: 99, train_loss: 0.2476, test_loss: 1.7790, test_f1: 0.6459

Training completed in 691.16 seconds
Best F1: 0.6721 at epoch 69
Mean F1 across iterations: 0.6567  0.0106
========================FINAL RESULTS================================
FEGIN weighted F1: 0.6721  0.0106
python main.py --data ltspice_demos --representation component_pin_net --model FEGIN --layers 4 --hiddens 128 --batch_size 32 --lr 0.0001 --emb_size 512 --epochs 100 --save_appendix component_pin_net_L4_H128_BS32_LR0.0001_E512 --no_val
-----



STDERR:
  File "main.py", line 370, in <module>
    main()
  File "main.py", line 254, in main
    dataset = dataset_class(
  File "/home/philip/projects/ltspice_examples_code_repo/Circuit-Completion-Using-GNNs/component_classification_with_link_prediction_head/evaluation/FEGIN/kernel/circuit_datasets.py", line 15, in __init__
    self.data, self.slices = torch.load(self.processed_paths[0])
  File "/home/philip/.local/lib/python3.8/site-packages/torch/serialization.py", line 1040, in load
    warnings.warn(
  File "/usr/lib/python3.8/warnings.py", line 109, in _showwarnmsg
    sw(msg.message, msg.category, msg.filename, msg.lineno,
  File "main.py", line 47, in warn_with_traceback
    traceback.print_stack(file=log)
/home/philip/projects/ltspice_examples_code_repo/Circuit-Completion-Using-GNNs/component_classification_with_link_prediction_head/evaluation/FEGIN/kernel/circuit_datasets.py:15: FutureWarning: You are using `torch.load` with `weights_only=False` (the current default value), which uses the default pickle module implicitly. It is possible to construct malicious pickle data which will execute arbitrary code during unpickling (See https://github.com/pytorch/pytorch/blob/main/SECURITY.md#untrusted-models for more details). In a future release, the default value for `weights_only` will be flipped to `True`. This limits the functions that could be executed during unpickling. Arbitrary objects will no longer be allowed to be loaded via this mode unless they are explicitly allowlisted by the user via `torch.serialization.add_safe_globals`. We recommend you start setting `weights_only=True` for any use case where you don't have full control of the loaded file. Please open an issue on GitHub for any issues related to this experimental feature.
  self.data, self.slices = torch.load(self.processed_paths[0])
