STDOUT:
Results will be saved in /home/philip/projects/ltspice_examples_code_repo/Circuit-Completion-Using-GNNs/component_classification_with_link_prediction_head/evaluation/FEGIN/results/model_FEGIN_dataset_ltspice_examples
Command line input: python main.py --data ltspice_examples --representation component_pin_net --model FEGIN --layers 5 --hiddens 32 --batch_size 32 --lr 0.001 --emb_size 128 --epochs 100 --save_appendix component_pin_net_L5_H32_BS32_LR0.001_E128 --no_val
 is saved.
-----
ltspice_examples - FEGIN
Using 5 layers, 32 hidden units, h = 2
Loading component_pin_net representation dataset
ENTERED
Training FEGIN on component_pin_net representation
Train: 3558, Test: 846
##################ITERATION #0 ****************************************
 epoch: 0, train_loss: 1.2148, test_loss: 1.0679, test_f1: 0.4304
 epoch: 1, train_loss: 1.0496, test_loss: 1.0334, test_f1: 0.4769
 epoch: 2, train_loss: 1.0096, test_loss: 1.0200, test_f1: 0.5254
 epoch: 3, train_loss: 1.0021, test_loss: 0.9787, test_f1: 0.4877
 epoch: 4, train_loss: 0.9707, test_loss: 1.0416, test_f1: 0.5012
 epoch: 5, train_loss: 0.9535, test_loss: 0.9815, test_f1: 0.4858
 epoch: 6, train_loss: 0.9428, test_loss: 0.9247, test_f1: 0.5190
 epoch: 7, train_loss: 0.9295, test_loss: 0.9258, test_f1: 0.5420
 epoch: 8, train_loss: 0.9164, test_loss: 0.9317, test_f1: 0.5625
 epoch: 9, train_loss: 0.9076, test_loss: 0.9142, test_f1: 0.5284
 epoch: 10, train_loss: 0.8919, test_loss: 0.9065, test_f1: 0.5290
 epoch: 11, train_loss: 0.8829, test_loss: 0.9193, test_f1: 0.5335
 epoch: 12, train_loss: 0.8890, test_loss: 0.8639, test_f1: 0.5553
 epoch: 13, train_loss: 0.8682, test_loss: 0.8990, test_f1: 0.5466
 epoch: 14, train_loss: 0.8528, test_loss: 0.8803, test_f1: 0.5722
 epoch: 15, train_loss: 0.8546, test_loss: 0.8963, test_f1: 0.5757
 epoch: 16, train_loss: 0.8324, test_loss: 0.9120, test_f1: 0.5355
 epoch: 17, train_loss: 0.8437, test_loss: 0.8707, test_f1: 0.5468
 epoch: 18, train_loss: 0.8258, test_loss: 0.8488, test_f1: 0.5554
 epoch: 19, train_loss: 0.8200, test_loss: 0.8598, test_f1: 0.5531
 epoch: 20, train_loss: 0.8104, test_loss: 0.8192, test_f1: 0.5863
 epoch: 21, train_loss: 0.8015, test_loss: 0.8530, test_f1: 0.5969
 epoch: 22, train_loss: 0.8000, test_loss: 0.8463, test_f1: 0.5656
 epoch: 23, train_loss: 0.7748, test_loss: 0.8716, test_f1: 0.6022
 epoch: 24, train_loss: 0.7878, test_loss: 0.8376, test_f1: 0.5755
 epoch: 25, train_loss: 0.7710, test_loss: 0.8744, test_f1: 0.5346
 epoch: 26, train_loss: 0.7549, test_loss: 0.8348, test_f1: 0.6208
 epoch: 27, train_loss: 0.7591, test_loss: 0.8932, test_f1: 0.5953
 epoch: 28, train_loss: 0.7594, test_loss: 0.8103, test_f1: 0.6091
 epoch: 29, train_loss: 0.7523, test_loss: 0.8524, test_f1: 0.5748
 epoch: 30, train_loss: 0.7503, test_loss: 0.7856, test_f1: 0.5955
 epoch: 31, train_loss: 0.7305, test_loss: 0.8911, test_f1: 0.5541
 epoch: 32, train_loss: 0.7312, test_loss: 0.7830, test_f1: 0.5657
 epoch: 33, train_loss: 0.7231, test_loss: 0.8339, test_f1: 0.5832
 epoch: 34, train_loss: 0.7246, test_loss: 0.8283, test_f1: 0.5756
 epoch: 35, train_loss: 0.7078, test_loss: 0.8270, test_f1: 0.5904
 epoch: 36, train_loss: 0.7085, test_loss: 0.9358, test_f1: 0.6116
 epoch: 37, train_loss: 0.7109, test_loss: 0.8411, test_f1: 0.6122
 epoch: 38, train_loss: 0.7165, test_loss: 0.8772, test_f1: 0.5815
 epoch: 39, train_loss: 0.6992, test_loss: 0.7902, test_f1: 0.5899
 epoch: 40, train_loss: 0.6963, test_loss: 0.7777, test_f1: 0.5945
 epoch: 41, train_loss: 0.6943, test_loss: 0.8853, test_f1: 0.6007
 epoch: 42, train_loss: 0.6659, test_loss: 0.8099, test_f1: 0.6273
 epoch: 43, train_loss: 0.6750, test_loss: 0.7982, test_f1: 0.5914
 epoch: 44, train_loss: 0.6781, test_loss: 0.8718, test_f1: 0.5897
 epoch: 45, train_loss: 0.6672, test_loss: 0.7746, test_f1: 0.6307
 epoch: 46, train_loss: 0.6638, test_loss: 0.9250, test_f1: 0.5774
 epoch: 47, train_loss: 0.6727, test_loss: 0.8492, test_f1: 0.6035
 epoch: 48, train_loss: 0.6453, test_loss: 0.8976, test_f1: 0.6035
 epoch: 49, train_loss: 0.6491, test_loss: 0.8843, test_f1: 0.6006
 epoch: 50, train_loss: 0.6357, test_loss: 0.9823, test_f1: 0.6097
 epoch: 51, train_loss: 0.6263, test_loss: 0.8842, test_f1: 0.6266
 epoch: 52, train_loss: 0.6112, test_loss: 0.8676, test_f1: 0.6218
 epoch: 53, train_loss: 0.6010, test_loss: 0.9180, test_f1: 0.6088
 epoch: 54, train_loss: 0.6054, test_loss: 0.8530, test_f1: 0.6210
 epoch: 55, train_loss: 0.5987, test_loss: 0.8801, test_f1: 0.6153
 epoch: 56, train_loss: 0.5834, test_loss: 0.8792, test_f1: 0.6377
 epoch: 57, train_loss: 0.5808, test_loss: 0.9052, test_f1: 0.6194
 epoch: 58, train_loss: 0.5800, test_loss: 0.9010, test_f1: 0.6421
 epoch: 59, train_loss: 0.5855, test_loss: 0.8959, test_f1: 0.6180
 epoch: 60, train_loss: 0.5711, test_loss: 0.9085, test_f1: 0.6229
 epoch: 61, train_loss: 0.5676, test_loss: 0.9237, test_f1: 0.6385
 epoch: 62, train_loss: 0.5797, test_loss: 0.9302, test_f1: 0.6247
 epoch: 63, train_loss: 0.5856, test_loss: 0.8770, test_f1: 0.6463
 epoch: 64, train_loss: 0.5617, test_loss: 0.9444, test_f1: 0.6261
 epoch: 65, train_loss: 0.5645, test_loss: 0.9195, test_f1: 0.6382
 epoch: 66, train_loss: 0.5649, test_loss: 0.9786, test_f1: 0.6360
 epoch: 67, train_loss: 0.5701, test_loss: 0.9175, test_f1: 0.6410
 epoch: 68, train_loss: 0.5619, test_loss: 0.8728, test_f1: 0.6462
 epoch: 69, train_loss: 0.5562, test_loss: 0.9125, test_f1: 0.6333
 epoch: 70, train_loss: 0.5473, test_loss: 0.9323, test_f1: 0.6405
 epoch: 71, train_loss: 0.5539, test_loss: 0.9276, test_f1: 0.6444
 epoch: 72, train_loss: 0.5548, test_loss: 0.9508, test_f1: 0.6488
 epoch: 73, train_loss: 0.5500, test_loss: 0.9512, test_f1: 0.6581
 epoch: 74, train_loss: 0.5587, test_loss: 0.9194, test_f1: 0.6465
 epoch: 75, train_loss: 0.5421, test_loss: 0.9164, test_f1: 0.6609
 epoch: 76, train_loss: 0.5393, test_loss: 0.9381, test_f1: 0.6250
 epoch: 77, train_loss: 0.5388, test_loss: 0.9725, test_f1: 0.6345
 epoch: 78, train_loss: 0.5346, test_loss: 1.0015, test_f1: 0.6211
 epoch: 79, train_loss: 0.5314, test_loss: 0.9875, test_f1: 0.6345
 epoch: 80, train_loss: 0.5390, test_loss: 0.9732, test_f1: 0.6254
 epoch: 81, train_loss: 0.5410, test_loss: 0.9241, test_f1: 0.6479
 epoch: 82, train_loss: 0.5202, test_loss: 0.9684, test_f1: 0.6277
 epoch: 83, train_loss: 0.5179, test_loss: 1.0160, test_f1: 0.6365
 epoch: 84, train_loss: 0.5338, test_loss: 1.0020, test_f1: 0.6224
 epoch: 85, train_loss: 0.5315, test_loss: 0.9351, test_f1: 0.6546
 epoch: 86, train_loss: 0.5127, test_loss: 0.9529, test_f1: 0.6576
 epoch: 87, train_loss: 0.5147, test_loss: 1.0462, test_f1: 0.6504
 epoch: 88, train_loss: 0.5074, test_loss: 0.9445, test_f1: 0.6581
 epoch: 89, train_loss: 0.5170, test_loss: 0.9927, test_f1: 0.6552
 epoch: 90, train_loss: 0.5301, test_loss: 1.0271, test_f1: 0.6347
 epoch: 91, train_loss: 0.5117, test_loss: 1.0709, test_f1: 0.6192
 epoch: 92, train_loss: 0.4930, test_loss: 1.0441, test_f1: 0.6371
 epoch: 93, train_loss: 0.5261, test_loss: 0.9876, test_f1: 0.6451
 epoch: 94, train_loss: 0.5261, test_loss: 0.9570, test_f1: 0.6331
 epoch: 95, train_loss: 0.5027, test_loss: 1.0270, test_f1: 0.6537
 epoch: 96, train_loss: 0.5080, test_loss: 1.0278, test_f1: 0.6454
 epoch: 97, train_loss: 0.4977, test_loss: 1.0364, test_f1: 0.6331
 epoch: 98, train_loss: 0.5150, test_loss: 1.0471, test_f1: 0.6596
 epoch: 99, train_loss: 0.4987, test_loss: 1.0263, test_f1: 0.6359
##################ITERATION #1 ****************************************
 epoch: 0, train_loss: 1.1202, test_loss: 1.0475, test_f1: 0.4471
 epoch: 1, train_loss: 1.0081, test_loss: 1.0037, test_f1: 0.4876
 epoch: 2, train_loss: 0.9768, test_loss: 0.9218, test_f1: 0.5235
 epoch: 3, train_loss: 0.9659, test_loss: 0.9345, test_f1: 0.5389
 epoch: 4, train_loss: 0.9469, test_loss: 0.9016, test_f1: 0.4971
 epoch: 5, train_loss: 0.9319, test_loss: 0.8940, test_f1: 0.5363
 epoch: 6, train_loss: 0.9169, test_loss: 0.9326, test_f1: 0.5039
 epoch: 7, train_loss: 0.8947, test_loss: 0.9144, test_f1: 0.5017
 epoch: 8, train_loss: 0.8856, test_loss: 0.8963, test_f1: 0.5155
 epoch: 9, train_loss: 0.8660, test_loss: 0.8472, test_f1: 0.5521
 epoch: 10, train_loss: 0.8695, test_loss: 0.8526, test_f1: 0.5594
 epoch: 11, train_loss: 0.8494, test_loss: 0.8130, test_f1: 0.5729
 epoch: 12, train_loss: 0.8489, test_loss: 0.8331, test_f1: 0.5582
 epoch: 13, train_loss: 0.8383, test_loss: 0.8736, test_f1: 0.5165
 epoch: 14, train_loss: 0.8363, test_loss: 0.8225, test_f1: 0.5732
 epoch: 15, train_loss: 0.8126, test_loss: 0.7887, test_f1: 0.5809
 epoch: 16, train_loss: 0.8003, test_loss: 0.8808, test_f1: 0.6013
 epoch: 17, train_loss: 0.7891, test_loss: 0.8763, test_f1: 0.5676
 epoch: 18, train_loss: 0.7941, test_loss: 0.7886, test_f1: 0.5955
 epoch: 19, train_loss: 0.7824, test_loss: 0.8385, test_f1: 0.5700
 epoch: 20, train_loss: 0.7748, test_loss: 0.7922, test_f1: 0.5863
 epoch: 21, train_loss: 0.7723, test_loss: 0.7526, test_f1: 0.6482
 epoch: 22, train_loss: 0.7579, test_loss: 0.7620, test_f1: 0.6078
 epoch: 23, train_loss: 0.7595, test_loss: 0.7746, test_f1: 0.6339
 epoch: 24, train_loss: 0.7421, test_loss: 0.8291, test_f1: 0.6227
 epoch: 25, train_loss: 0.7383, test_loss: 0.7687, test_f1: 0.6013
 epoch: 26, train_loss: 0.7356, test_loss: 0.7737, test_f1: 0.5755
 epoch: 27, train_loss: 0.7145, test_loss: 0.7381, test_f1: 0.6252
 epoch: 28, train_loss: 0.7314, test_loss: 0.7531, test_f1: 0.6492
 epoch: 29, train_loss: 0.7227, test_loss: 0.7798, test_f1: 0.6550
 epoch: 30, train_loss: 0.7067, test_loss: 0.7312, test_f1: 0.6333
 epoch: 31, train_loss: 0.7049, test_loss: 0.7161, test_f1: 0.6316
 epoch: 32, train_loss: 0.7060, test_loss: 0.7337, test_f1: 0.6359
 epoch: 33, train_loss: 0.6891, test_loss: 0.7410, test_f1: 0.6244
 epoch: 34, train_loss: 0.6929, test_loss: 0.7595, test_f1: 0.6114
 epoch: 35, train_loss: 0.6937, test_loss: 0.8220, test_f1: 0.6271
 epoch: 36, train_loss: 0.6709, test_loss: 0.7860, test_f1: 0.6458
 epoch: 37, train_loss: 0.6891, test_loss: 0.7465, test_f1: 0.6180
 epoch: 38, train_loss: 0.6619, test_loss: 0.7518, test_f1: 0.6195
 epoch: 39, train_loss: 0.6815, test_loss: 0.8384, test_f1: 0.5838
 epoch: 40, train_loss: 0.6789, test_loss: 0.7248, test_f1: 0.6606
 epoch: 41, train_loss: 0.6606, test_loss: 0.7482, test_f1: 0.6327
 epoch: 42, train_loss: 0.6658, test_loss: 0.7069, test_f1: 0.6524
 epoch: 43, train_loss: 0.6582, test_loss: 0.7725, test_f1: 0.6442
 epoch: 44, train_loss: 0.6403, test_loss: 0.8121, test_f1: 0.6154
 epoch: 45, train_loss: 0.6368, test_loss: 0.7584, test_f1: 0.6328
 epoch: 46, train_loss: 0.6565, test_loss: 0.7847, test_f1: 0.6479
 epoch: 47, train_loss: 0.6504, test_loss: 0.7335, test_f1: 0.6521
 epoch: 48, train_loss: 0.6310, test_loss: 0.8620, test_f1: 0.6341
 epoch: 49, train_loss: 0.6392, test_loss: 0.8365, test_f1: 0.6459
 epoch: 50, train_loss: 0.6521, test_loss: 0.7027, test_f1: 0.6606
 epoch: 51, train_loss: 0.6094, test_loss: 0.7439, test_f1: 0.6336
 epoch: 52, train_loss: 0.6012, test_loss: 0.7236, test_f1: 0.6534
 epoch: 53, train_loss: 0.5824, test_loss: 0.7326, test_f1: 0.6605
 epoch: 54, train_loss: 0.5901, test_loss: 0.7607, test_f1: 0.6486
 epoch: 55, train_loss: 0.5786, test_loss: 0.7310, test_f1: 0.6699
 epoch: 56, train_loss: 0.5835, test_loss: 0.7555, test_f1: 0.6560
 epoch: 57, train_loss: 0.5762, test_loss: 0.7366, test_f1: 0.6513
 epoch: 58, train_loss: 0.5778, test_loss: 0.7642, test_f1: 0.6675
 epoch: 59, train_loss: 0.5729, test_loss: 0.7218, test_f1: 0.6540
 epoch: 60, train_loss: 0.5742, test_loss: 0.7524, test_f1: 0.6683
 epoch: 61, train_loss: 0.5752, test_loss: 0.7887, test_f1: 0.6422
 epoch: 62, train_loss: 0.5615, test_loss: 0.7610, test_f1: 0.6327
 epoch: 63, train_loss: 0.5582, test_loss: 0.7917, test_f1: 0.6510
 epoch: 64, train_loss: 0.5499, test_loss: 0.7649, test_f1: 0.6488
 epoch: 65, train_loss: 0.5603, test_loss: 0.7824, test_f1: 0.6464
 epoch: 66, train_loss: 0.5786, test_loss: 0.8286, test_f1: 0.6387
 epoch: 67, train_loss: 0.5590, test_loss: 0.8134, test_f1: 0.6556
 epoch: 68, train_loss: 0.5651, test_loss: 0.8155, test_f1: 0.6453
 epoch: 69, train_loss: 0.5474, test_loss: 0.7912, test_f1: 0.6448
 epoch: 70, train_loss: 0.5464, test_loss: 0.7711, test_f1: 0.6564
 epoch: 71, train_loss: 0.5609, test_loss: 0.7993, test_f1: 0.6721
 epoch: 72, train_loss: 0.5706, test_loss: 0.8223, test_f1: 0.6570
 epoch: 73, train_loss: 0.5512, test_loss: 0.8079, test_f1: 0.6619
 epoch: 74, train_loss: 0.5371, test_loss: 0.8055, test_f1: 0.6643
 epoch: 75, train_loss: 0.5633, test_loss: 0.7614, test_f1: 0.6853
 epoch: 76, train_loss: 0.5471, test_loss: 0.7745, test_f1: 0.6566
 epoch: 77, train_loss: 0.5386, test_loss: 0.7930, test_f1: 0.6593
 epoch: 78, train_loss: 0.5451, test_loss: 0.7316, test_f1: 0.6891
 epoch: 79, train_loss: 0.5463, test_loss: 0.7991, test_f1: 0.6826
 epoch: 80, train_loss: 0.5426, test_loss: 0.7591, test_f1: 0.6614
 epoch: 81, train_loss: 0.5346, test_loss: 0.7699, test_f1: 0.6700
 epoch: 82, train_loss: 0.5176, test_loss: 0.8389, test_f1: 0.6576
 epoch: 83, train_loss: 0.5228, test_loss: 0.8543, test_f1: 0.6765
 epoch: 84, train_loss: 0.5203, test_loss: 0.8081, test_f1: 0.6523
 epoch: 85, train_loss: 0.5331, test_loss: 0.8274, test_f1: 0.6674
 epoch: 86, train_loss: 0.5310, test_loss: 0.8009, test_f1: 0.6693
 epoch: 87, train_loss: 0.5280, test_loss: 0.7906, test_f1: 0.6602
 epoch: 88, train_loss: 0.5153, test_loss: 0.8370, test_f1: 0.6578
 epoch: 89, train_loss: 0.5220, test_loss: 0.8256, test_f1: 0.6600
 epoch: 90, train_loss: 0.5172, test_loss: 0.7997, test_f1: 0.6503
 epoch: 91, train_loss: 0.5064, test_loss: 0.8414, test_f1: 0.6550
 epoch: 92, train_loss: 0.5087, test_loss: 0.8349, test_f1: 0.6876
 epoch: 93, train_loss: 0.5027, test_loss: 0.8233, test_f1: 0.6651
 epoch: 94, train_loss: 0.5109, test_loss: 0.8247, test_f1: 0.6750
 epoch: 95, train_loss: 0.5146, test_loss: 0.8177, test_f1: 0.6534
 epoch: 96, train_loss: 0.5051, test_loss: 0.7863, test_f1: 0.6571
 epoch: 97, train_loss: 0.5130, test_loss: 0.8559, test_f1: 0.6693
 epoch: 98, train_loss: 0.4968, test_loss: 0.8380, test_f1: 0.6662
 epoch: 99, train_loss: 0.5142, test_loss: 0.7935, test_f1: 0.6781
##################ITERATION #2 ****************************************
 epoch: 0, train_loss: 1.1305, test_loss: 1.0064, test_f1: 0.4734
 epoch: 1, train_loss: 1.0070, test_loss: 0.9426, test_f1: 0.5013
 epoch: 2, train_loss: 0.9673, test_loss: 0.9002, test_f1: 0.5125
 epoch: 3, train_loss: 0.9420, test_loss: 0.9224, test_f1: 0.4929
 epoch: 4, train_loss: 0.9261, test_loss: 0.9069, test_f1: 0.5217
 epoch: 5, train_loss: 0.9276, test_loss: 0.9171, test_f1: 0.5220
 epoch: 6, train_loss: 0.9097, test_loss: 0.8832, test_f1: 0.5374
 epoch: 7, train_loss: 0.8931, test_loss: 0.8806, test_f1: 0.5258
 epoch: 8, train_loss: 0.8834, test_loss: 0.8622, test_f1: 0.5834
 epoch: 9, train_loss: 0.8890, test_loss: 0.8704, test_f1: 0.5582
 epoch: 10, train_loss: 0.8782, test_loss: 0.8200, test_f1: 0.5797
 epoch: 11, train_loss: 0.8657, test_loss: 0.8117, test_f1: 0.5817
 epoch: 12, train_loss: 0.8446, test_loss: 0.7984, test_f1: 0.5775
 epoch: 13, train_loss: 0.8346, test_loss: 0.8525, test_f1: 0.5846
 epoch: 14, train_loss: 0.8232, test_loss: 0.8302, test_f1: 0.5913
 epoch: 15, train_loss: 0.8105, test_loss: 0.8055, test_f1: 0.5726
 epoch: 16, train_loss: 0.8125, test_loss: 0.7650, test_f1: 0.5901
 epoch: 17, train_loss: 0.8047, test_loss: 0.8028, test_f1: 0.6002
 epoch: 18, train_loss: 0.8019, test_loss: 0.7340, test_f1: 0.6390
 epoch: 19, train_loss: 0.7682, test_loss: 0.7469, test_f1: 0.6112
 epoch: 20, train_loss: 0.7620, test_loss: 0.8685, test_f1: 0.6166
 epoch: 21, train_loss: 0.7789, test_loss: 0.8381, test_f1: 0.5755
 epoch: 22, train_loss: 0.7684, test_loss: 0.7984, test_f1: 0.6153
 epoch: 23, train_loss: 0.7849, test_loss: 0.8040, test_f1: 0.5747
 epoch: 24, train_loss: 0.7734, test_loss: 0.7608, test_f1: 0.5865
 epoch: 25, train_loss: 0.7534, test_loss: 0.7579, test_f1: 0.6132
 epoch: 26, train_loss: 0.7225, test_loss: 0.7590, test_f1: 0.6262
 epoch: 27, train_loss: 0.7332, test_loss: 0.7405, test_f1: 0.6353
 epoch: 28, train_loss: 0.7108, test_loss: 0.7881, test_f1: 0.6370
 epoch: 29, train_loss: 0.7225, test_loss: 0.7403, test_f1: 0.6107
 epoch: 30, train_loss: 0.7208, test_loss: 0.7963, test_f1: 0.6397
 epoch: 31, train_loss: 0.7201, test_loss: 0.7747, test_f1: 0.6248
 epoch: 32, train_loss: 0.7079, test_loss: 0.7823, test_f1: 0.6180
 epoch: 33, train_loss: 0.7053, test_loss: 0.6945, test_f1: 0.6673
 epoch: 34, train_loss: 0.7051, test_loss: 0.8453, test_f1: 0.6226
 epoch: 35, train_loss: 0.6902, test_loss: 0.7763, test_f1: 0.6419
 epoch: 36, train_loss: 0.6802, test_loss: 0.7381, test_f1: 0.6665
 epoch: 37, train_loss: 0.6829, test_loss: 0.7534, test_f1: 0.6389
 epoch: 38, train_loss: 0.6879, test_loss: 0.7944, test_f1: 0.6401
 epoch: 39, train_loss: 0.6877, test_loss: 0.7619, test_f1: 0.6364
 epoch: 40, train_loss: 0.6696, test_loss: 0.7316, test_f1: 0.6303
 epoch: 41, train_loss: 0.6880, test_loss: 0.7618, test_f1: 0.6076
 epoch: 42, train_loss: 0.6781, test_loss: 0.7968, test_f1: 0.6294
 epoch: 43, train_loss: 0.6668, test_loss: 0.7688, test_f1: 0.6402
 epoch: 44, train_loss: 0.6638, test_loss: 0.7796, test_f1: 0.6489
 epoch: 45, train_loss: 0.6608, test_loss: 0.8059, test_f1: 0.6894
 epoch: 46, train_loss: 0.6542, test_loss: 0.8119, test_f1: 0.6224
 epoch: 47, train_loss: 0.6620, test_loss: 0.7960, test_f1: 0.6326
 epoch: 48, train_loss: 0.6717, test_loss: 0.8351, test_f1: 0.6772
 epoch: 49, train_loss: 0.6414, test_loss: 0.8053, test_f1: 0.6396
 epoch: 50, train_loss: 0.6433, test_loss: 0.6970, test_f1: 0.6788
 epoch: 51, train_loss: 0.6067, test_loss: 0.7502, test_f1: 0.6491
 epoch: 52, train_loss: 0.6047, test_loss: 0.7593, test_f1: 0.6531
 epoch: 53, train_loss: 0.6077, test_loss: 0.7509, test_f1: 0.6790
 epoch: 54, train_loss: 0.5994, test_loss: 0.7778, test_f1: 0.6513
 epoch: 55, train_loss: 0.5718, test_loss: 0.7801, test_f1: 0.6655
 epoch: 56, train_loss: 0.5875, test_loss: 0.8051, test_f1: 0.6622
 epoch: 57, train_loss: 0.5881, test_loss: 0.8105, test_f1: 0.6671
 epoch: 58, train_loss: 0.5800, test_loss: 0.7987, test_f1: 0.6449
 epoch: 59, train_loss: 0.5796, test_loss: 0.7714, test_f1: 0.6781
 epoch: 60, train_loss: 0.5765, test_loss: 0.8281, test_f1: 0.6415
 epoch: 61, train_loss: 0.5643, test_loss: 0.8461, test_f1: 0.6539
 epoch: 62, train_loss: 0.5691, test_loss: 0.8562, test_f1: 0.6627
 epoch: 63, train_loss: 0.5636, test_loss: 0.8292, test_f1: 0.6877
 epoch: 64, train_loss: 0.5616, test_loss: 0.8493, test_f1: 0.6710
 epoch: 65, train_loss: 0.5436, test_loss: 0.8560, test_f1: 0.6408
 epoch: 66, train_loss: 0.5581, test_loss: 0.8525, test_f1: 0.6594
 epoch: 67, train_loss: 0.5491, test_loss: 0.8552, test_f1: 0.6774
 epoch: 68, train_loss: 0.5593, test_loss: 0.8367, test_f1: 0.6650
 epoch: 69, train_loss: 0.5471, test_loss: 0.8502, test_f1: 0.6709
 epoch: 70, train_loss: 0.5571, test_loss: 0.8971, test_f1: 0.6441
 epoch: 71, train_loss: 0.5453, test_loss: 0.8632, test_f1: 0.6974
 epoch: 72, train_loss: 0.5413, test_loss: 0.8267, test_f1: 0.6718
 epoch: 73, train_loss: 0.5328, test_loss: 0.8790, test_f1: 0.6802
 epoch: 74, train_loss: 0.5356, test_loss: 0.8935, test_f1: 0.6663
 epoch: 75, train_loss: 0.5370, test_loss: 0.9051, test_f1: 0.6459
 epoch: 76, train_loss: 0.5363, test_loss: 0.8815, test_f1: 0.6645
 epoch: 77, train_loss: 0.5269, test_loss: 0.9484, test_f1: 0.6570
 epoch: 78, train_loss: 0.5188, test_loss: 0.8834, test_f1: 0.6602
 epoch: 79, train_loss: 0.5366, test_loss: 0.8086, test_f1: 0.6713
 epoch: 80, train_loss: 0.5130, test_loss: 0.8678, test_f1: 0.6666
 epoch: 81, train_loss: 0.5096, test_loss: 0.8938, test_f1: 0.6962
 epoch: 82, train_loss: 0.5108, test_loss: 0.9025, test_f1: 0.6784
 epoch: 83, train_loss: 0.5280, test_loss: 0.9159, test_f1: 0.6538
 epoch: 84, train_loss: 0.5239, test_loss: 0.9320, test_f1: 0.6667
 epoch: 85, train_loss: 0.4983, test_loss: 0.8683, test_f1: 0.6637
 epoch: 86, train_loss: 0.5190, test_loss: 0.9859, test_f1: 0.6329
 epoch: 87, train_loss: 0.5069, test_loss: 0.8839, test_f1: 0.6802
 epoch: 88, train_loss: 0.5227, test_loss: 0.8493, test_f1: 0.6604
 epoch: 89, train_loss: 0.5099, test_loss: 0.8502, test_f1: 0.6901
 epoch: 90, train_loss: 0.4986, test_loss: 0.8656, test_f1: 0.7103
 epoch: 91, train_loss: 0.5136, test_loss: 0.8524, test_f1: 0.7024
 epoch: 92, train_loss: 0.4874, test_loss: 0.9129, test_f1: 0.6659
 epoch: 93, train_loss: 0.5034, test_loss: 0.9719, test_f1: 0.6830
 epoch: 94, train_loss: 0.4997, test_loss: 0.9493, test_f1: 0.6361
 epoch: 95, train_loss: 0.4931, test_loss: 0.9314, test_f1: 0.6538
 epoch: 96, train_loss: 0.4786, test_loss: 0.9353, test_f1: 0.6703
 epoch: 97, train_loss: 0.4756, test_loss: 0.9748, test_f1: 0.6735
 epoch: 98, train_loss: 0.4981, test_loss: 0.9458, test_f1: 0.6730
 epoch: 99, train_loss: 0.4810, test_loss: 0.9871, test_f1: 0.6745
##################ITERATION #3 ****************************************
 epoch: 0, train_loss: 1.1544, test_loss: 1.0533, test_f1: 0.4952
 epoch: 1, train_loss: 1.0318, test_loss: 1.0203, test_f1: 0.4776
 epoch: 2, train_loss: 0.9998, test_loss: 0.9945, test_f1: 0.5004
 epoch: 3, train_loss: 0.9792, test_loss: 0.9692, test_f1: 0.5090
 epoch: 4, train_loss: 0.9568, test_loss: 0.9603, test_f1: 0.5352
 epoch: 5, train_loss: 0.9334, test_loss: 0.9782, test_f1: 0.5375
 epoch: 6, train_loss: 0.9213, test_loss: 0.9046, test_f1: 0.4992
 epoch: 7, train_loss: 0.9003, test_loss: 0.9404, test_f1: 0.5382
 epoch: 8, train_loss: 0.8853, test_loss: 0.8539, test_f1: 0.5532
 epoch: 9, train_loss: 0.8855, test_loss: 0.8501, test_f1: 0.5348
 epoch: 10, train_loss: 0.8689, test_loss: 0.9279, test_f1: 0.5353
 epoch: 11, train_loss: 0.8465, test_loss: 0.8656, test_f1: 0.5278
 epoch: 12, train_loss: 0.8374, test_loss: 0.8916, test_f1: 0.5026
 epoch: 13, train_loss: 0.8473, test_loss: 0.8006, test_f1: 0.5775
 epoch: 14, train_loss: 0.8287, test_loss: 0.8182, test_f1: 0.5634
 epoch: 15, train_loss: 0.8237, test_loss: 0.8207, test_f1: 0.5614
 epoch: 16, train_loss: 0.8073, test_loss: 0.7921, test_f1: 0.6031
 epoch: 17, train_loss: 0.8013, test_loss: 0.8814, test_f1: 0.6024
 epoch: 18, train_loss: 0.8014, test_loss: 0.7702, test_f1: 0.6032
 epoch: 19, train_loss: 0.7987, test_loss: 0.7783, test_f1: 0.6070
 epoch: 20, train_loss: 0.7672, test_loss: 0.7602, test_f1: 0.6395
 epoch: 21, train_loss: 0.7665, test_loss: 0.7678, test_f1: 0.6210
 epoch: 22, train_loss: 0.7623, test_loss: 0.7364, test_f1: 0.6618
 epoch: 23, train_loss: 0.7529, test_loss: 0.7387, test_f1: 0.6402
 epoch: 24, train_loss: 0.7443, test_loss: 0.7540, test_f1: 0.6348
 epoch: 25, train_loss: 0.7330, test_loss: 0.7293, test_f1: 0.6512
 epoch: 26, train_loss: 0.7527, test_loss: 0.7240, test_f1: 0.6675
 epoch: 27, train_loss: 0.7259, test_loss: 0.7157, test_f1: 0.6646
 epoch: 28, train_loss: 0.7193, test_loss: 0.7404, test_f1: 0.6247
 epoch: 29, train_loss: 0.7230, test_loss: 0.7298, test_f1: 0.6590
 epoch: 30, train_loss: 0.7098, test_loss: 0.7188, test_f1: 0.6411
 epoch: 31, train_loss: 0.7103, test_loss: 0.7113, test_f1: 0.6599
 epoch: 32, train_loss: 0.7138, test_loss: 0.7742, test_f1: 0.6182
 epoch: 33, train_loss: 0.6922, test_loss: 0.7201, test_f1: 0.6504
 epoch: 34, train_loss: 0.6931, test_loss: 0.7317, test_f1: 0.6445
 epoch: 35, train_loss: 0.6907, test_loss: 0.7140, test_f1: 0.6573
 epoch: 36, train_loss: 0.6957, test_loss: 0.6996, test_f1: 0.6621
 epoch: 37, train_loss: 0.6787, test_loss: 0.7135, test_f1: 0.6875
 epoch: 38, train_loss: 0.6720, test_loss: 0.7716, test_f1: 0.6309
 epoch: 39, train_loss: 0.6802, test_loss: 0.7699, test_f1: 0.6361
 epoch: 40, train_loss: 0.6806, test_loss: 0.7804, test_f1: 0.6356
 epoch: 41, train_loss: 0.6597, test_loss: 0.7230, test_f1: 0.6542
 epoch: 42, train_loss: 0.6845, test_loss: 0.6738, test_f1: 0.6888
 epoch: 43, train_loss: 0.6724, test_loss: 0.7256, test_f1: 0.6810
 epoch: 44, train_loss: 0.6551, test_loss: 0.7280, test_f1: 0.6525
 epoch: 45, train_loss: 0.6563, test_loss: 0.7062, test_f1: 0.6763
 epoch: 46, train_loss: 0.6361, test_loss: 0.6904, test_f1: 0.6713
 epoch: 47, train_loss: 0.6410, test_loss: 0.7240, test_f1: 0.6715
 epoch: 48, train_loss: 0.6555, test_loss: 0.7404, test_f1: 0.6591
 epoch: 49, train_loss: 0.6440, test_loss: 0.6910, test_f1: 0.6842
 epoch: 50, train_loss: 0.6294, test_loss: 0.7336, test_f1: 0.6465
 epoch: 51, train_loss: 0.6230, test_loss: 0.7259, test_f1: 0.6482
 epoch: 52, train_loss: 0.5927, test_loss: 0.6893, test_f1: 0.6738
 epoch: 53, train_loss: 0.5993, test_loss: 0.7199, test_f1: 0.6690
 epoch: 54, train_loss: 0.5909, test_loss: 0.7091, test_f1: 0.6610
 epoch: 55, train_loss: 0.5701, test_loss: 0.7202, test_f1: 0.6713
 epoch: 56, train_loss: 0.5854, test_loss: 0.7266, test_f1: 0.6840
 epoch: 57, train_loss: 0.5806, test_loss: 0.7798, test_f1: 0.6630
 epoch: 58, train_loss: 0.5766, test_loss: 0.7722, test_f1: 0.6407
 epoch: 59, train_loss: 0.5654, test_loss: 0.7948, test_f1: 0.6243
 epoch: 60, train_loss: 0.5774, test_loss: 0.7405, test_f1: 0.6688
 epoch: 61, train_loss: 0.5646, test_loss: 0.8132, test_f1: 0.6616
 epoch: 62, train_loss: 0.5676, test_loss: 0.7379, test_f1: 0.6777
 epoch: 63, train_loss: 0.5588, test_loss: 0.7618, test_f1: 0.6695
 epoch: 64, train_loss: 0.5672, test_loss: 0.8178, test_f1: 0.6524
 epoch: 65, train_loss: 0.5584, test_loss: 0.8099, test_f1: 0.6650
 epoch: 66, train_loss: 0.5548, test_loss: 0.8070, test_f1: 0.6458
 epoch: 67, train_loss: 0.5558, test_loss: 0.7717, test_f1: 0.6494
 epoch: 68, train_loss: 0.5642, test_loss: 0.7919, test_f1: 0.6446
 epoch: 69, train_loss: 0.5449, test_loss: 0.7740, test_f1: 0.6554
 epoch: 70, train_loss: 0.5361, test_loss: 0.8365, test_f1: 0.6673
 epoch: 71, train_loss: 0.5541, test_loss: 0.8520, test_f1: 0.6400
 epoch: 72, train_loss: 0.5384, test_loss: 0.8305, test_f1: 0.6673
 epoch: 73, train_loss: 0.5362, test_loss: 0.8495, test_f1: 0.6449
 epoch: 74, train_loss: 0.5506, test_loss: 0.8356, test_f1: 0.6572
 epoch: 75, train_loss: 0.5508, test_loss: 0.7876, test_f1: 0.6730
 epoch: 76, train_loss: 0.5305, test_loss: 0.8123, test_f1: 0.6495
 epoch: 77, train_loss: 0.5516, test_loss: 0.8736, test_f1: 0.6733
 epoch: 78, train_loss: 0.5267, test_loss: 0.8818, test_f1: 0.6520
 epoch: 79, train_loss: 0.5192, test_loss: 0.8111, test_f1: 0.6754
 epoch: 80, train_loss: 0.5351, test_loss: 0.8209, test_f1: 0.6351
 epoch: 81, train_loss: 0.5430, test_loss: 0.8501, test_f1: 0.6561
 epoch: 82, train_loss: 0.5328, test_loss: 0.8607, test_f1: 0.6558
 epoch: 83, train_loss: 0.5698, test_loss: 0.8155, test_f1: 0.6610
 epoch: 84, train_loss: 0.5132, test_loss: 0.8395, test_f1: 0.6503
 epoch: 85, train_loss: 0.5090, test_loss: 0.9081, test_f1: 0.6519
 epoch: 86, train_loss: 0.5156, test_loss: 0.8798, test_f1: 0.6583
 epoch: 87, train_loss: 0.5295, test_loss: 0.8200, test_f1: 0.6659
 epoch: 88, train_loss: 0.5010, test_loss: 0.8660, test_f1: 0.6661
 epoch: 89, train_loss: 0.5036, test_loss: 0.9177, test_f1: 0.6694
 epoch: 90, train_loss: 0.5160, test_loss: 0.9570, test_f1: 0.6488
 epoch: 91, train_loss: 0.5117, test_loss: 0.9716, test_f1: 0.6574
 epoch: 92, train_loss: 0.4973, test_loss: 0.9689, test_f1: 0.6663
 epoch: 93, train_loss: 0.5075, test_loss: 0.9527, test_f1: 0.6713
 epoch: 94, train_loss: 0.4998, test_loss: 0.9593, test_f1: 0.6573
 epoch: 95, train_loss: 0.4918, test_loss: 0.9318, test_f1: 0.6688
 epoch: 96, train_loss: 0.5013, test_loss: 0.9883, test_f1: 0.6744
 epoch: 97, train_loss: 0.5177, test_loss: 0.9541, test_f1: 0.6694
 epoch: 98, train_loss: 0.5082, test_loss: 0.9887, test_f1: 0.6657
 epoch: 99, train_loss: 0.5059, test_loss: 0.8839, test_f1: 0.6725
##################ITERATION #4 ****************************************
 epoch: 0, train_loss: 1.1798, test_loss: 1.0033, test_f1: 0.5076
 epoch: 1, train_loss: 1.0184, test_loss: 0.9618, test_f1: 0.4989
 epoch: 2, train_loss: 0.9689, test_loss: 0.9544, test_f1: 0.5330
 epoch: 3, train_loss: 0.9675, test_loss: 0.9788, test_f1: 0.5137
 epoch: 4, train_loss: 0.9437, test_loss: 0.9173, test_f1: 0.5384
 epoch: 5, train_loss: 0.9384, test_loss: 0.9092, test_f1: 0.5219
 epoch: 6, train_loss: 0.9223, test_loss: 0.8850, test_f1: 0.5334
 epoch: 7, train_loss: 0.9155, test_loss: 0.9030, test_f1: 0.5606
 epoch: 8, train_loss: 0.8937, test_loss: 0.9026, test_f1: 0.5563
 epoch: 9, train_loss: 0.8937, test_loss: 0.9077, test_f1: 0.5397
 epoch: 10, train_loss: 0.8767, test_loss: 0.9122, test_f1: 0.5454
 epoch: 11, train_loss: 0.8761, test_loss: 0.9072, test_f1: 0.5235
 epoch: 12, train_loss: 0.8766, test_loss: 0.9222, test_f1: 0.5373
 epoch: 13, train_loss: 0.8627, test_loss: 0.8285, test_f1: 0.5625
 epoch: 14, train_loss: 0.8491, test_loss: 0.8820, test_f1: 0.5939
 epoch: 15, train_loss: 0.8413, test_loss: 0.8214, test_f1: 0.5701
 epoch: 16, train_loss: 0.8268, test_loss: 0.8577, test_f1: 0.5749
 epoch: 17, train_loss: 0.8419, test_loss: 0.8592, test_f1: 0.5742
 epoch: 18, train_loss: 0.8157, test_loss: 0.8275, test_f1: 0.5557
 epoch: 19, train_loss: 0.8067, test_loss: 0.8414, test_f1: 0.5956
 epoch: 20, train_loss: 0.8167, test_loss: 0.8186, test_f1: 0.6195
 epoch: 21, train_loss: 0.8152, test_loss: 0.8340, test_f1: 0.6159
 epoch: 22, train_loss: 0.7957, test_loss: 0.8368, test_f1: 0.5916
 epoch: 23, train_loss: 0.7801, test_loss: 0.8280, test_f1: 0.6482
 epoch: 24, train_loss: 0.7608, test_loss: 0.7807, test_f1: 0.6445
 epoch: 25, train_loss: 0.7599, test_loss: 0.7933, test_f1: 0.6652
 epoch: 26, train_loss: 0.7609, test_loss: 0.8116, test_f1: 0.6381
 epoch: 27, train_loss: 0.7518, test_loss: 0.7913, test_f1: 0.6549
 epoch: 28, train_loss: 0.7612, test_loss: 0.8066, test_f1: 0.6582
 epoch: 29, train_loss: 0.7384, test_loss: 0.7700, test_f1: 0.6269
 epoch: 30, train_loss: 0.7657, test_loss: 0.7237, test_f1: 0.6567
 epoch: 31, train_loss: 0.7459, test_loss: 0.7560, test_f1: 0.6424
 epoch: 32, train_loss: 0.7250, test_loss: 0.7690, test_f1: 0.6604
 epoch: 33, train_loss: 0.7029, test_loss: 0.7848, test_f1: 0.6475
 epoch: 34, train_loss: 0.7205, test_loss: 0.7455, test_f1: 0.6596
 epoch: 35, train_loss: 0.7056, test_loss: 0.8104, test_f1: 0.6672
 epoch: 36, train_loss: 0.7302, test_loss: 0.9409, test_f1: 0.6008
 epoch: 37, train_loss: 0.7172, test_loss: 0.7184, test_f1: 0.6699
 epoch: 38, train_loss: 0.7055, test_loss: 0.7702, test_f1: 0.6427
 epoch: 39, train_loss: 0.6990, test_loss: 0.7666, test_f1: 0.6361
 epoch: 40, train_loss: 0.6931, test_loss: 0.8263, test_f1: 0.6279
 epoch: 41, train_loss: 0.6912, test_loss: 0.7405, test_f1: 0.6469
 epoch: 42, train_loss: 0.6950, test_loss: 0.7337, test_f1: 0.6605
 epoch: 43, train_loss: 0.6884, test_loss: 0.7257, test_f1: 0.6509
 epoch: 44, train_loss: 0.6593, test_loss: 0.7519, test_f1: 0.6619
 epoch: 45, train_loss: 0.6610, test_loss: 0.8191, test_f1: 0.6588
 epoch: 46, train_loss: 0.6632, test_loss: 0.8393, test_f1: 0.6491
 epoch: 47, train_loss: 0.6562, test_loss: 0.7926, test_f1: 0.6906
 epoch: 48, train_loss: 0.6558, test_loss: 0.7872, test_f1: 0.6593
 epoch: 49, train_loss: 0.6525, test_loss: 0.7796, test_f1: 0.6669
 epoch: 50, train_loss: 0.6386, test_loss: 0.8197, test_f1: 0.6548
 epoch: 51, train_loss: 0.6286, test_loss: 0.7506, test_f1: 0.6613
 epoch: 52, train_loss: 0.6179, test_loss: 0.7305, test_f1: 0.6540
 epoch: 53, train_loss: 0.6035, test_loss: 0.7621, test_f1: 0.6629
 epoch: 54, train_loss: 0.5928, test_loss: 0.7907, test_f1: 0.6666
 epoch: 55, train_loss: 0.6023, test_loss: 0.8064, test_f1: 0.6496
 epoch: 56, train_loss: 0.6003, test_loss: 0.7742, test_f1: 0.6793
 epoch: 57, train_loss: 0.5725, test_loss: 0.7053, test_f1: 0.6846
 epoch: 58, train_loss: 0.5658, test_loss: 0.7813, test_f1: 0.6542
 epoch: 59, train_loss: 0.5762, test_loss: 0.7629, test_f1: 0.6450
 epoch: 60, train_loss: 0.5686, test_loss: 0.8176, test_f1: 0.6570
 epoch: 61, train_loss: 0.5750, test_loss: 0.8116, test_f1: 0.6641
 epoch: 62, train_loss: 0.5729, test_loss: 0.7699, test_f1: 0.6536
 epoch: 63, train_loss: 0.5731, test_loss: 0.8884, test_f1: 0.6543
 epoch: 64, train_loss: 0.5715, test_loss: 0.7643, test_f1: 0.6576
 epoch: 65, train_loss: 0.5566, test_loss: 0.7657, test_f1: 0.6775
 epoch: 66, train_loss: 0.5622, test_loss: 0.8453, test_f1: 0.6651
 epoch: 67, train_loss: 0.5601, test_loss: 0.7972, test_f1: 0.6635
 epoch: 68, train_loss: 0.5603, test_loss: 0.8399, test_f1: 0.6608
 epoch: 69, train_loss: 0.5535, test_loss: 0.8074, test_f1: 0.6620
 epoch: 70, train_loss: 0.5450, test_loss: 0.7717, test_f1: 0.6765
 epoch: 71, train_loss: 0.5420, test_loss: 0.8707, test_f1: 0.6694
 epoch: 72, train_loss: 0.5519, test_loss: 0.8548, test_f1: 0.6530
 epoch: 73, train_loss: 0.5398, test_loss: 0.8808, test_f1: 0.6582
 epoch: 74, train_loss: 0.5282, test_loss: 0.8399, test_f1: 0.6643
 epoch: 75, train_loss: 0.5415, test_loss: 0.8249, test_f1: 0.6698
 epoch: 76, train_loss: 0.5397, test_loss: 0.8507, test_f1: 0.6671
 epoch: 77, train_loss: 0.5174, test_loss: 0.9024, test_f1: 0.6597
 epoch: 78, train_loss: 0.5369, test_loss: 0.8364, test_f1: 0.6720
 epoch: 79, train_loss: 0.5163, test_loss: 0.8533, test_f1: 0.6421
 epoch: 80, train_loss: 0.5223, test_loss: 0.8690, test_f1: 0.6574
 epoch: 81, train_loss: 0.5325, test_loss: 0.8450, test_f1: 0.6665
 epoch: 82, train_loss: 0.5206, test_loss: 0.9028, test_f1: 0.6487
 epoch: 83, train_loss: 0.5326, test_loss: 0.7960, test_f1: 0.6615
 epoch: 84, train_loss: 0.5244, test_loss: 0.9142, test_f1: 0.6738
 epoch: 85, train_loss: 0.5130, test_loss: 0.8178, test_f1: 0.6875
 epoch: 86, train_loss: 0.5075, test_loss: 0.8623, test_f1: 0.6463
 epoch: 87, train_loss: 0.5154, test_loss: 0.8889, test_f1: 0.6494
 epoch: 88, train_loss: 0.4970, test_loss: 0.8441, test_f1: 0.6635
 epoch: 89, train_loss: 0.5030, test_loss: 0.9096, test_f1: 0.6486
 epoch: 90, train_loss: 0.4985, test_loss: 0.8118, test_f1: 0.6673
 epoch: 91, train_loss: 0.5176, test_loss: 0.8810, test_f1: 0.6561
 epoch: 92, train_loss: 0.4981, test_loss: 0.8345, test_f1: 0.6616
 epoch: 93, train_loss: 0.4914, test_loss: 0.8481, test_f1: 0.6703
 epoch: 94, train_loss: 0.4898, test_loss: 0.8112, test_f1: 0.6787
 epoch: 95, train_loss: 0.4804, test_loss: 0.9009, test_f1: 0.6729
 epoch: 96, train_loss: 0.5034, test_loss: 0.7947, test_f1: 0.6731
 epoch: 97, train_loss: 0.4829, test_loss: 0.8229, test_f1: 0.6896
 epoch: 98, train_loss: 0.4935, test_loss: 0.7847, test_f1: 0.6630
 epoch: 99, train_loss: 0.4890, test_loss: 0.8958, test_f1: 0.6622
##################ITERATION #5 ****************************************
 epoch: 0, train_loss: 1.2130, test_loss: 1.0279, test_f1: 0.4860
 epoch: 1, train_loss: 1.0342, test_loss: 0.9979, test_f1: 0.4644
 epoch: 2, train_loss: 1.0034, test_loss: 0.9494, test_f1: 0.5229
 epoch: 3, train_loss: 0.9870, test_loss: 1.0153, test_f1: 0.4772
 epoch: 4, train_loss: 0.9523, test_loss: 0.9837, test_f1: 0.5118
 epoch: 5, train_loss: 0.9463, test_loss: 0.9319, test_f1: 0.5385
 epoch: 6, train_loss: 0.9274, test_loss: 0.9634, test_f1: 0.5159
 epoch: 7, train_loss: 0.9270, test_loss: 0.9850, test_f1: 0.5251
 epoch: 8, train_loss: 0.9033, test_loss: 0.9250, test_f1: 0.5379
 epoch: 9, train_loss: 0.8966, test_loss: 0.9108, test_f1: 0.5524
 epoch: 10, train_loss: 0.8823, test_loss: 0.8855, test_f1: 0.5485
 epoch: 11, train_loss: 0.8759, test_loss: 0.8808, test_f1: 0.5440
 epoch: 12, train_loss: 0.8675, test_loss: 0.8657, test_f1: 0.5652
 epoch: 13, train_loss: 0.8697, test_loss: 0.8714, test_f1: 0.5586
 epoch: 14, train_loss: 0.8462, test_loss: 0.8727, test_f1: 0.5419
 epoch: 15, train_loss: 0.8461, test_loss: 0.8706, test_f1: 0.6259
 epoch: 16, train_loss: 0.8416, test_loss: 0.8764, test_f1: 0.5946
 epoch: 17, train_loss: 0.8202, test_loss: 0.8212, test_f1: 0.6053
 epoch: 18, train_loss: 0.8054, test_loss: 0.8224, test_f1: 0.6062
 epoch: 19, train_loss: 0.7908, test_loss: 0.8023, test_f1: 0.6200
 epoch: 20, train_loss: 0.7961, test_loss: 0.7915, test_f1: 0.6290
 epoch: 21, train_loss: 0.7802, test_loss: 0.7799, test_f1: 0.5961
 epoch: 22, train_loss: 0.8031, test_loss: 0.7831, test_f1: 0.5834
 epoch: 23, train_loss: 0.7825, test_loss: 0.8527, test_f1: 0.5820
 epoch: 24, train_loss: 0.7757, test_loss: 0.8323, test_f1: 0.6108
 epoch: 25, train_loss: 0.7667, test_loss: 0.8400, test_f1: 0.5947
 epoch: 26, train_loss: 0.7457, test_loss: 0.7467, test_f1: 0.6404
 epoch: 27, train_loss: 0.7606, test_loss: 0.7998, test_f1: 0.6039
 epoch: 28, train_loss: 0.7435, test_loss: 0.8204, test_f1: 0.6136
 epoch: 29, train_loss: 0.7434, test_loss: 0.7801, test_f1: 0.6179
 epoch: 30, train_loss: 0.7493, test_loss: 0.7510, test_f1: 0.6158
 epoch: 31, train_loss: 0.7488, test_loss: 0.8494, test_f1: 0.5970
 epoch: 32, train_loss: 0.7402, test_loss: 0.7496, test_f1: 0.6336
 epoch: 33, train_loss: 0.7266, test_loss: 0.8116, test_f1: 0.6148
 epoch: 34, train_loss: 0.7128, test_loss: 0.7672, test_f1: 0.6433
 epoch: 35, train_loss: 0.7133, test_loss: 0.8111, test_f1: 0.6579
 epoch: 36, train_loss: 0.6992, test_loss: 0.7743, test_f1: 0.6648
 epoch: 37, train_loss: 0.7098, test_loss: 0.8326, test_f1: 0.6323
 epoch: 38, train_loss: 0.7083, test_loss: 0.7568, test_f1: 0.6221
 epoch: 39, train_loss: 0.7049, test_loss: 0.8150, test_f1: 0.6506
 epoch: 40, train_loss: 0.6887, test_loss: 0.7462, test_f1: 0.6346
 epoch: 41, train_loss: 0.6895, test_loss: 0.7447, test_f1: 0.6567
 epoch: 42, train_loss: 0.7014, test_loss: 0.7408, test_f1: 0.6601
 epoch: 43, train_loss: 0.6784, test_loss: 0.7343, test_f1: 0.6575
 epoch: 44, train_loss: 0.6865, test_loss: 0.7471, test_f1: 0.6518
 epoch: 45, train_loss: 0.6761, test_loss: 0.7512, test_f1: 0.6415
 epoch: 46, train_loss: 0.6817, test_loss: 0.7886, test_f1: 0.6510
 epoch: 47, train_loss: 0.6693, test_loss: 0.7607, test_f1: 0.6661
 epoch: 48, train_loss: 0.6778, test_loss: 0.7936, test_f1: 0.6831
 epoch: 49, train_loss: 0.6619, test_loss: 0.8355, test_f1: 0.6278
 epoch: 50, train_loss: 0.6454, test_loss: 0.7041, test_f1: 0.6803
 epoch: 51, train_loss: 0.6277, test_loss: 0.7868, test_f1: 0.6432
 epoch: 52, train_loss: 0.6196, test_loss: 0.7352, test_f1: 0.6641
 epoch: 53, train_loss: 0.6092, test_loss: 0.7830, test_f1: 0.6738
 epoch: 54, train_loss: 0.6281, test_loss: 0.7631, test_f1: 0.6514
 epoch: 55, train_loss: 0.6107, test_loss: 0.7499, test_f1: 0.6503
 epoch: 56, train_loss: 0.6087, test_loss: 0.8184, test_f1: 0.6553
 epoch: 57, train_loss: 0.5912, test_loss: 0.8009, test_f1: 0.6590
 epoch: 58, train_loss: 0.5783, test_loss: 0.8469, test_f1: 0.6504
 epoch: 59, train_loss: 0.5997, test_loss: 0.8041, test_f1: 0.6712
 epoch: 60, train_loss: 0.5866, test_loss: 0.8336, test_f1: 0.6802
 epoch: 61, train_loss: 0.5881, test_loss: 0.9133, test_f1: 0.6538
 epoch: 62, train_loss: 0.6047, test_loss: 0.7971, test_f1: 0.6550
 epoch: 63, train_loss: 0.5791, test_loss: 0.8030, test_f1: 0.6766
 epoch: 64, train_loss: 0.5722, test_loss: 0.7653, test_f1: 0.6580
 epoch: 65, train_loss: 0.5761, test_loss: 0.8585, test_f1: 0.6711
 epoch: 66, train_loss: 0.5963, test_loss: 0.7542, test_f1: 0.6746
 epoch: 67, train_loss: 0.5722, test_loss: 0.8068, test_f1: 0.6875
 epoch: 68, train_loss: 0.5704, test_loss: 0.7686, test_f1: 0.6816
 epoch: 69, train_loss: 0.5732, test_loss: 0.7842, test_f1: 0.6597
 epoch: 70, train_loss: 0.5661, test_loss: 0.8152, test_f1: 0.6570
 epoch: 71, train_loss: 0.5710, test_loss: 0.8138, test_f1: 0.7007
 epoch: 72, train_loss: 0.5814, test_loss: 0.8829, test_f1: 0.6622
 epoch: 73, train_loss: 0.5623, test_loss: 0.9003, test_f1: 0.6653
 epoch: 74, train_loss: 0.5632, test_loss: 0.8723, test_f1: 0.6780
 epoch: 75, train_loss: 0.5656, test_loss: 0.9159, test_f1: 0.6583
 epoch: 76, train_loss: 0.5535, test_loss: 0.9311, test_f1: 0.6472
 epoch: 77, train_loss: 0.5632, test_loss: 0.8639, test_f1: 0.6775
 epoch: 78, train_loss: 0.5450, test_loss: 0.8696, test_f1: 0.6662
 epoch: 79, train_loss: 0.5634, test_loss: 0.9151, test_f1: 0.6480
 epoch: 80, train_loss: 0.5507, test_loss: 0.8334, test_f1: 0.6752
 epoch: 81, train_loss: 0.5675, test_loss: 0.8882, test_f1: 0.6746
 epoch: 82, train_loss: 0.5513, test_loss: 0.7771, test_f1: 0.6879
 epoch: 83, train_loss: 0.5549, test_loss: 0.8316, test_f1: 0.6727
 epoch: 84, train_loss: 0.5583, test_loss: 0.8480, test_f1: 0.6599
 epoch: 85, train_loss: 0.5420, test_loss: 0.8769, test_f1: 0.6752
 epoch: 86, train_loss: 0.5577, test_loss: 0.8198, test_f1: 0.6653
 epoch: 87, train_loss: 0.5496, test_loss: 0.8839, test_f1: 0.6818
 epoch: 88, train_loss: 0.5545, test_loss: 0.8876, test_f1: 0.6543
 epoch: 89, train_loss: 0.5328, test_loss: 0.9330, test_f1: 0.6692
 epoch: 90, train_loss: 0.5424, test_loss: 0.9215, test_f1: 0.6757
 epoch: 91, train_loss: 0.5217, test_loss: 0.8964, test_f1: 0.6751
 epoch: 92, train_loss: 0.5293, test_loss: 0.8982, test_f1: 0.6756
 epoch: 93, train_loss: 0.5375, test_loss: 0.8555, test_f1: 0.7073
 epoch: 94, train_loss: 0.5248, test_loss: 0.9065, test_f1: 0.6674
 epoch: 95, train_loss: 0.5214, test_loss: 0.9861, test_f1: 0.6788
 epoch: 96, train_loss: 0.5381, test_loss: 0.8968, test_f1: 0.6929
 epoch: 97, train_loss: 0.5251, test_loss: 0.9227, test_f1: 0.6822
 epoch: 98, train_loss: 0.5321, test_loss: 0.9710, test_f1: 0.6743
 epoch: 99, train_loss: 0.5255, test_loss: 1.0220, test_f1: 0.6643
##################ITERATION #6 ****************************************
 epoch: 0, train_loss: 1.2159, test_loss: 0.9863, test_f1: 0.5102
 epoch: 1, train_loss: 0.9984, test_loss: 0.9138, test_f1: 0.5538
 epoch: 2, train_loss: 0.9768, test_loss: 0.9549, test_f1: 0.5442
 epoch: 3, train_loss: 0.9469, test_loss: 0.9408, test_f1: 0.5410
 epoch: 4, train_loss: 0.9339, test_loss: 0.9193, test_f1: 0.5599
 epoch: 5, train_loss: 0.9141, test_loss: 0.9062, test_f1: 0.5852
 epoch: 6, train_loss: 0.8934, test_loss: 0.9199, test_f1: 0.5198
 epoch: 7, train_loss: 0.8868, test_loss: 0.9018, test_f1: 0.5688
 epoch: 8, train_loss: 0.8748, test_loss: 0.8652, test_f1: 0.5469
 epoch: 9, train_loss: 0.8585, test_loss: 0.8967, test_f1: 0.6036
 epoch: 10, train_loss: 0.8394, test_loss: 0.8521, test_f1: 0.5752
 epoch: 11, train_loss: 0.8333, test_loss: 0.8549, test_f1: 0.6353
 epoch: 12, train_loss: 0.8400, test_loss: 0.8431, test_f1: 0.6333
 epoch: 13, train_loss: 0.8149, test_loss: 0.8445, test_f1: 0.6070
 epoch: 14, train_loss: 0.7947, test_loss: 0.7926, test_f1: 0.6135
 epoch: 15, train_loss: 0.7862, test_loss: 0.8377, test_f1: 0.6308
 epoch: 16, train_loss: 0.7812, test_loss: 0.8353, test_f1: 0.6134
 epoch: 17, train_loss: 0.7613, test_loss: 0.8576, test_f1: 0.6141
 epoch: 18, train_loss: 0.7728, test_loss: 0.8568, test_f1: 0.5929
 epoch: 19, train_loss: 0.7515, test_loss: 0.7770, test_f1: 0.6343
 epoch: 20, train_loss: 0.7665, test_loss: 0.7856, test_f1: 0.6405
 epoch: 21, train_loss: 0.7521, test_loss: 0.8286, test_f1: 0.6239
 epoch: 22, train_loss: 0.7502, test_loss: 0.7229, test_f1: 0.6547
 epoch: 23, train_loss: 0.7363, test_loss: 0.8292, test_f1: 0.6172
 epoch: 24, train_loss: 0.7217, test_loss: 0.7519, test_f1: 0.6448
 epoch: 25, train_loss: 0.7229, test_loss: 0.7998, test_f1: 0.6448
 epoch: 26, train_loss: 0.7206, test_loss: 0.8452, test_f1: 0.6142
 epoch: 27, train_loss: 0.7227, test_loss: 0.7480, test_f1: 0.6280
 epoch: 28, train_loss: 0.7112, test_loss: 0.7923, test_f1: 0.6233
 epoch: 29, train_loss: 0.7091, test_loss: 0.7575, test_f1: 0.6335
 epoch: 30, train_loss: 0.6997, test_loss: 0.7907, test_f1: 0.6471
 epoch: 31, train_loss: 0.6788, test_loss: 0.7558, test_f1: 0.6524
 epoch: 32, train_loss: 0.6805, test_loss: 0.7290, test_f1: 0.6344
 epoch: 33, train_loss: 0.6696, test_loss: 0.7440, test_f1: 0.6449
 epoch: 34, train_loss: 0.6621, test_loss: 0.7502, test_f1: 0.6384
 epoch: 35, train_loss: 0.6775, test_loss: 0.6925, test_f1: 0.6584
 epoch: 36, train_loss: 0.6606, test_loss: 0.7236, test_f1: 0.6451
 epoch: 37, train_loss: 0.6726, test_loss: 0.7052, test_f1: 0.6902
 epoch: 38, train_loss: 0.6592, test_loss: 0.7717, test_f1: 0.6165
 epoch: 39, train_loss: 0.6604, test_loss: 0.7772, test_f1: 0.6115
 epoch: 40, train_loss: 0.6562, test_loss: 0.7007, test_f1: 0.6523
 epoch: 41, train_loss: 0.6299, test_loss: 0.7393, test_f1: 0.6758
 epoch: 42, train_loss: 0.6242, test_loss: 0.6724, test_f1: 0.6824
 epoch: 43, train_loss: 0.6634, test_loss: 0.7466, test_f1: 0.6470
 epoch: 44, train_loss: 0.6534, test_loss: 0.7445, test_f1: 0.6656
 epoch: 45, train_loss: 0.6129, test_loss: 0.7807, test_f1: 0.6247
 epoch: 46, train_loss: 0.6205, test_loss: 0.6931, test_f1: 0.6613
 epoch: 47, train_loss: 0.6073, test_loss: 0.7629, test_f1: 0.6646
 epoch: 48, train_loss: 0.6193, test_loss: 0.7659, test_f1: 0.6500
 epoch: 49, train_loss: 0.6084, test_loss: 0.7547, test_f1: 0.6741
 epoch: 50, train_loss: 0.6131, test_loss: 0.7221, test_f1: 0.6679
 epoch: 51, train_loss: 0.5928, test_loss: 0.7463, test_f1: 0.6355
 epoch: 52, train_loss: 0.5745, test_loss: 0.6784, test_f1: 0.6857
 epoch: 53, train_loss: 0.5488, test_loss: 0.7003, test_f1: 0.6786
 epoch: 54, train_loss: 0.5682, test_loss: 0.7157, test_f1: 0.6760
 epoch: 55, train_loss: 0.5483, test_loss: 0.6887, test_f1: 0.6816
 epoch: 56, train_loss: 0.5527, test_loss: 0.7151, test_f1: 0.6457
 epoch: 57, train_loss: 0.5481, test_loss: 0.7776, test_f1: 0.6634
 epoch: 58, train_loss: 0.5464, test_loss: 0.7470, test_f1: 0.6766
 epoch: 59, train_loss: 0.5552, test_loss: 0.7229, test_f1: 0.6650
 epoch: 60, train_loss: 0.5456, test_loss: 0.7854, test_f1: 0.6656
 epoch: 61, train_loss: 0.5404, test_loss: 0.7097, test_f1: 0.6621
 epoch: 62, train_loss: 0.5436, test_loss: 0.7597, test_f1: 0.6531
 epoch: 63, train_loss: 0.5369, test_loss: 0.7334, test_f1: 0.6692
 epoch: 64, train_loss: 0.5279, test_loss: 0.7496, test_f1: 0.6613
 epoch: 65, train_loss: 0.5390, test_loss: 0.6827, test_f1: 0.6775
 epoch: 66, train_loss: 0.5312, test_loss: 0.7742, test_f1: 0.6557
 epoch: 67, train_loss: 0.5252, test_loss: 0.7558, test_f1: 0.6651
 epoch: 68, train_loss: 0.5341, test_loss: 0.7650, test_f1: 0.7001
 epoch: 69, train_loss: 0.5290, test_loss: 0.7838, test_f1: 0.6570
 epoch: 70, train_loss: 0.5319, test_loss: 0.7777, test_f1: 0.6912
 epoch: 71, train_loss: 0.5164, test_loss: 0.7497, test_f1: 0.6957
 epoch: 72, train_loss: 0.5167, test_loss: 0.7559, test_f1: 0.6936
 epoch: 73, train_loss: 0.5191, test_loss: 0.7953, test_f1: 0.6843
 epoch: 74, train_loss: 0.5220, test_loss: 0.7537, test_f1: 0.6812
 epoch: 75, train_loss: 0.5052, test_loss: 0.8069, test_f1: 0.6472
 epoch: 76, train_loss: 0.5104, test_loss: 0.7820, test_f1: 0.6810
 epoch: 77, train_loss: 0.4905, test_loss: 0.8123, test_f1: 0.6607
 epoch: 78, train_loss: 0.5031, test_loss: 0.7736, test_f1: 0.6797
 epoch: 79, train_loss: 0.5016, test_loss: 0.7650, test_f1: 0.6719
 epoch: 80, train_loss: 0.4903, test_loss: 0.8134, test_f1: 0.6936
 epoch: 81, train_loss: 0.4840, test_loss: 0.8024, test_f1: 0.6878
 epoch: 82, train_loss: 0.5023, test_loss: 0.7618, test_f1: 0.6671
 epoch: 83, train_loss: 0.4884, test_loss: 0.8237, test_f1: 0.6697
 epoch: 84, train_loss: 0.5080, test_loss: 0.7883, test_f1: 0.6570
 epoch: 85, train_loss: 0.4924, test_loss: 0.7280, test_f1: 0.6830
 epoch: 86, train_loss: 0.4795, test_loss: 0.8685, test_f1: 0.6792
 epoch: 87, train_loss: 0.4706, test_loss: 0.8558, test_f1: 0.6429
 epoch: 88, train_loss: 0.4813, test_loss: 0.8361, test_f1: 0.6676
 epoch: 89, train_loss: 0.4818, test_loss: 0.8688, test_f1: 0.6844
 epoch: 90, train_loss: 0.4862, test_loss: 0.8491, test_f1: 0.6757
 epoch: 91, train_loss: 0.4739, test_loss: 0.8767, test_f1: 0.6645
 epoch: 92, train_loss: 0.4473, test_loss: 0.8977, test_f1: 0.6607
 epoch: 93, train_loss: 0.4706, test_loss: 0.8452, test_f1: 0.6622
 epoch: 94, train_loss: 0.4857, test_loss: 0.8184, test_f1: 0.6679
 epoch: 95, train_loss: 0.4595, test_loss: 0.7793, test_f1: 0.6808
 epoch: 96, train_loss: 0.4588, test_loss: 0.7984, test_f1: 0.6820
 epoch: 97, train_loss: 0.4707, test_loss: 0.7550, test_f1: 0.6985
 epoch: 98, train_loss: 0.4752, test_loss: 0.8389, test_f1: 0.6774
 epoch: 99, train_loss: 0.4713, test_loss: 0.8126, test_f1: 0.6800
##################ITERATION #7 ****************************************
 epoch: 0, train_loss: 1.2635, test_loss: 1.0791, test_f1: 0.4986
 epoch: 1, train_loss: 1.0178, test_loss: 1.0319, test_f1: 0.4911
 epoch: 2, train_loss: 0.9767, test_loss: 0.9848, test_f1: 0.5326
 epoch: 3, train_loss: 0.9685, test_loss: 1.0145, test_f1: 0.5183
 epoch: 4, train_loss: 0.9508, test_loss: 0.9918, test_f1: 0.5065
 epoch: 5, train_loss: 0.9359, test_loss: 0.9302, test_f1: 0.5021
 epoch: 6, train_loss: 0.9151, test_loss: 0.9043, test_f1: 0.5523
 epoch: 7, train_loss: 0.9064, test_loss: 0.9175, test_f1: 0.5322
 epoch: 8, train_loss: 0.9110, test_loss: 0.9219, test_f1: 0.5198
 epoch: 9, train_loss: 0.8893, test_loss: 0.8670, test_f1: 0.5223
 epoch: 10, train_loss: 0.8766, test_loss: 0.8413, test_f1: 0.5948
 epoch: 11, train_loss: 0.8674, test_loss: 0.8462, test_f1: 0.5834
 epoch: 12, train_loss: 0.8569, test_loss: 0.8513, test_f1: 0.5307
 epoch: 13, train_loss: 0.8465, test_loss: 0.8091, test_f1: 0.5984
 epoch: 14, train_loss: 0.8298, test_loss: 0.8925, test_f1: 0.5766
 epoch: 15, train_loss: 0.8320, test_loss: 0.8803, test_f1: 0.5906
 epoch: 16, train_loss: 0.8312, test_loss: 0.8705, test_f1: 0.5514
 epoch: 17, train_loss: 0.8141, test_loss: 0.8705, test_f1: 0.5722
 epoch: 18, train_loss: 0.8044, test_loss: 0.8612, test_f1: 0.5762
 epoch: 19, train_loss: 0.8095, test_loss: 0.8527, test_f1: 0.5949
 epoch: 20, train_loss: 0.7909, test_loss: 0.7680, test_f1: 0.5843
 epoch: 21, train_loss: 0.7836, test_loss: 0.7979, test_f1: 0.5629
 epoch: 22, train_loss: 0.7785, test_loss: 0.8631, test_f1: 0.6151
 epoch: 23, train_loss: 0.7671, test_loss: 0.8414, test_f1: 0.6221
 epoch: 24, train_loss: 0.7653, test_loss: 0.8373, test_f1: 0.5833
 epoch: 25, train_loss: 0.7559, test_loss: 0.8640, test_f1: 0.5819
 epoch: 26, train_loss: 0.7472, test_loss: 0.8759, test_f1: 0.5789
 epoch: 27, train_loss: 0.7519, test_loss: 0.8330, test_f1: 0.6002
 epoch: 28, train_loss: 0.7452, test_loss: 0.7628, test_f1: 0.6201
 epoch: 29, train_loss: 0.7297, test_loss: 0.8169, test_f1: 0.6144
 epoch: 30, train_loss: 0.7254, test_loss: 0.8265, test_f1: 0.6037
 epoch: 31, train_loss: 0.7371, test_loss: 0.7969, test_f1: 0.6048
 epoch: 32, train_loss: 0.7216, test_loss: 0.8320, test_f1: 0.6131
 epoch: 33, train_loss: 0.7018, test_loss: 0.7533, test_f1: 0.6306
 epoch: 34, train_loss: 0.6996, test_loss: 0.8255, test_f1: 0.6542
 epoch: 35, train_loss: 0.7039, test_loss: 0.7797, test_f1: 0.6469
 epoch: 36, train_loss: 0.6792, test_loss: 0.8011, test_f1: 0.6390
 epoch: 37, train_loss: 0.6919, test_loss: 0.8146, test_f1: 0.6699
 epoch: 38, train_loss: 0.6818, test_loss: 0.8068, test_f1: 0.6183
 epoch: 39, train_loss: 0.6957, test_loss: 0.7958, test_f1: 0.6137
 epoch: 40, train_loss: 0.6905, test_loss: 0.7742, test_f1: 0.6218
 epoch: 41, train_loss: 0.6823, test_loss: 0.8249, test_f1: 0.6097
 epoch: 42, train_loss: 0.6678, test_loss: 0.8039, test_f1: 0.6382
 epoch: 43, train_loss: 0.6721, test_loss: 0.7589, test_f1: 0.6272
 epoch: 44, train_loss: 0.6697, test_loss: 0.7637, test_f1: 0.6510
 epoch: 45, train_loss: 0.6652, test_loss: 0.7574, test_f1: 0.6232
 epoch: 46, train_loss: 0.6639, test_loss: 0.7853, test_f1: 0.6244
 epoch: 47, train_loss: 0.6526, test_loss: 0.8078, test_f1: 0.6819
 epoch: 48, train_loss: 0.6447, test_loss: 0.7670, test_f1: 0.6570
 epoch: 49, train_loss: 0.6395, test_loss: 0.7949, test_f1: 0.6220
 epoch: 50, train_loss: 0.6516, test_loss: 0.6914, test_f1: 0.6939
 epoch: 51, train_loss: 0.6260, test_loss: 0.7171, test_f1: 0.6825
 epoch: 52, train_loss: 0.6050, test_loss: 0.7568, test_f1: 0.6772
 epoch: 53, train_loss: 0.6028, test_loss: 0.7511, test_f1: 0.6580
 epoch: 54, train_loss: 0.5869, test_loss: 0.7536, test_f1: 0.6526
 epoch: 55, train_loss: 0.5820, test_loss: 0.7368, test_f1: 0.6622
 epoch: 56, train_loss: 0.5682, test_loss: 0.7875, test_f1: 0.6805
 epoch: 57, train_loss: 0.5877, test_loss: 0.7637, test_f1: 0.6653
 epoch: 58, train_loss: 0.5803, test_loss: 0.7667, test_f1: 0.6687
 epoch: 59, train_loss: 0.5728, test_loss: 0.7673, test_f1: 0.6541
 epoch: 60, train_loss: 0.5773, test_loss: 0.7970, test_f1: 0.6714
 epoch: 61, train_loss: 0.5705, test_loss: 0.7663, test_f1: 0.6560
 epoch: 62, train_loss: 0.5752, test_loss: 0.7364, test_f1: 0.7093
 epoch: 63, train_loss: 0.5602, test_loss: 0.7278, test_f1: 0.6494
 epoch: 64, train_loss: 0.5526, test_loss: 0.7430, test_f1: 0.6773
 epoch: 65, train_loss: 0.5495, test_loss: 0.6915, test_f1: 0.7122
 epoch: 66, train_loss: 0.5513, test_loss: 0.7844, test_f1: 0.6759
 epoch: 67, train_loss: 0.5510, test_loss: 0.8035, test_f1: 0.6777
 epoch: 68, train_loss: 0.5493, test_loss: 0.7761, test_f1: 0.6575
 epoch: 69, train_loss: 0.5469, test_loss: 0.7679, test_f1: 0.6641
 epoch: 70, train_loss: 0.5720, test_loss: 0.7346, test_f1: 0.7003
 epoch: 71, train_loss: 0.5422, test_loss: 0.7493, test_f1: 0.6794
 epoch: 72, train_loss: 0.5397, test_loss: 0.7550, test_f1: 0.6740
 epoch: 73, train_loss: 0.5313, test_loss: 0.7065, test_f1: 0.6788
 epoch: 74, train_loss: 0.5384, test_loss: 0.7388, test_f1: 0.6633
 epoch: 75, train_loss: 0.5382, test_loss: 0.7298, test_f1: 0.6677
 epoch: 76, train_loss: 0.5279, test_loss: 0.7251, test_f1: 0.6719
 epoch: 77, train_loss: 0.5295, test_loss: 0.6728, test_f1: 0.6972
 epoch: 78, train_loss: 0.5361, test_loss: 0.7062, test_f1: 0.6789
 epoch: 79, train_loss: 0.5277, test_loss: 0.7839, test_f1: 0.6597
 epoch: 80, train_loss: 0.5245, test_loss: 0.8324, test_f1: 0.6668
 epoch: 81, train_loss: 0.4955, test_loss: 0.7971, test_f1: 0.6946
 epoch: 82, train_loss: 0.5333, test_loss: 0.8238, test_f1: 0.6668
 epoch: 83, train_loss: 0.5205, test_loss: 0.8375, test_f1: 0.6678
 epoch: 84, train_loss: 0.5274, test_loss: 0.7970, test_f1: 0.6696
 epoch: 85, train_loss: 0.5112, test_loss: 0.8498, test_f1: 0.6670
 epoch: 86, train_loss: 0.5143, test_loss: 0.8693, test_f1: 0.6719
 epoch: 87, train_loss: 0.5011, test_loss: 0.8021, test_f1: 0.6622
 epoch: 88, train_loss: 0.5126, test_loss: 0.7958, test_f1: 0.6601
 epoch: 89, train_loss: 0.4886, test_loss: 0.8557, test_f1: 0.6651
 epoch: 90, train_loss: 0.4988, test_loss: 0.8088, test_f1: 0.6683
 epoch: 91, train_loss: 0.4931, test_loss: 0.7642, test_f1: 0.6682
 epoch: 92, train_loss: 0.4924, test_loss: 0.8179, test_f1: 0.6788
 epoch: 93, train_loss: 0.5090, test_loss: 0.8002, test_f1: 0.6682
 epoch: 94, train_loss: 0.5000, test_loss: 0.8235, test_f1: 0.6771
 epoch: 95, train_loss: 0.4967, test_loss: 0.8685, test_f1: 0.6578
 epoch: 96, train_loss: 0.4896, test_loss: 0.8020, test_f1: 0.6839
 epoch: 97, train_loss: 0.4845, test_loss: 0.7787, test_f1: 0.6972
 epoch: 98, train_loss: 0.4897, test_loss: 0.8297, test_f1: 0.6611
 epoch: 99, train_loss: 0.4847, test_loss: 0.8919, test_f1: 0.6818
##################ITERATION #8 ****************************************
 epoch: 0, train_loss: 1.2247, test_loss: 0.9898, test_f1: 0.4961
 epoch: 1, train_loss: 1.0362, test_loss: 0.9309, test_f1: 0.5088
 epoch: 2, train_loss: 1.0045, test_loss: 0.9411, test_f1: 0.5342
 epoch: 3, train_loss: 0.9632, test_loss: 0.8833, test_f1: 0.5491
 epoch: 4, train_loss: 0.9506, test_loss: 0.8869, test_f1: 0.5436
 epoch: 5, train_loss: 0.9326, test_loss: 0.9076, test_f1: 0.5157
 epoch: 6, train_loss: 0.9364, test_loss: 0.8749, test_f1: 0.5489
 epoch: 7, train_loss: 0.9031, test_loss: 0.8909, test_f1: 0.5451
 epoch: 8, train_loss: 0.9102, test_loss: 0.9022, test_f1: 0.5578
 epoch: 9, train_loss: 0.8979, test_loss: 0.8689, test_f1: 0.5136
 epoch: 10, train_loss: 0.8865, test_loss: 0.8972, test_f1: 0.5618
 epoch: 11, train_loss: 0.8648, test_loss: 0.8724, test_f1: 0.5562
 epoch: 12, train_loss: 0.8652, test_loss: 0.8667, test_f1: 0.6036
 epoch: 13, train_loss: 0.8544, test_loss: 0.8205, test_f1: 0.5842
 epoch: 14, train_loss: 0.8459, test_loss: 0.7964, test_f1: 0.5934
 epoch: 15, train_loss: 0.8351, test_loss: 0.7941, test_f1: 0.5957
 epoch: 16, train_loss: 0.8276, test_loss: 0.8172, test_f1: 0.5943
 epoch: 17, train_loss: 0.8283, test_loss: 0.8005, test_f1: 0.5675
 epoch: 18, train_loss: 0.8173, test_loss: 0.7906, test_f1: 0.5756
 epoch: 19, train_loss: 0.8175, test_loss: 0.7945, test_f1: 0.5702
 epoch: 20, train_loss: 0.8091, test_loss: 0.7704, test_f1: 0.5988
 epoch: 21, train_loss: 0.8007, test_loss: 0.7418, test_f1: 0.6550
 epoch: 22, train_loss: 0.7861, test_loss: 0.7429, test_f1: 0.6023
 epoch: 23, train_loss: 0.7726, test_loss: 0.7301, test_f1: 0.5850
 epoch: 24, train_loss: 0.7688, test_loss: 0.7616, test_f1: 0.6029
 epoch: 25, train_loss: 0.7602, test_loss: 0.7917, test_f1: 0.5775
 epoch: 26, train_loss: 0.7624, test_loss: 0.7932, test_f1: 0.6013
 epoch: 27, train_loss: 0.7514, test_loss: 0.8076, test_f1: 0.5883
 epoch: 28, train_loss: 0.7466, test_loss: 0.8448, test_f1: 0.6214
 epoch: 29, train_loss: 0.7483, test_loss: 0.8178, test_f1: 0.6020
 epoch: 30, train_loss: 0.7258, test_loss: 0.8049, test_f1: 0.5718
 epoch: 31, train_loss: 0.7267, test_loss: 0.7881, test_f1: 0.6217
 epoch: 32, train_loss: 0.7269, test_loss: 0.7687, test_f1: 0.6176
 epoch: 33, train_loss: 0.7215, test_loss: 0.7945, test_f1: 0.6257
 epoch: 34, train_loss: 0.7275, test_loss: 0.7940, test_f1: 0.6432
 epoch: 35, train_loss: 0.7100, test_loss: 0.7469, test_f1: 0.6272
 epoch: 36, train_loss: 0.7148, test_loss: 0.7883, test_f1: 0.6316
 epoch: 37, train_loss: 0.7153, test_loss: 0.7934, test_f1: 0.6360
 epoch: 38, train_loss: 0.6968, test_loss: 0.8200, test_f1: 0.6495
 epoch: 39, train_loss: 0.7069, test_loss: 0.7584, test_f1: 0.6427
 epoch: 40, train_loss: 0.6809, test_loss: 0.7781, test_f1: 0.6345
 epoch: 41, train_loss: 0.6790, test_loss: 0.8505, test_f1: 0.5848
 epoch: 42, train_loss: 0.6831, test_loss: 0.7809, test_f1: 0.6500
 epoch: 43, train_loss: 0.6788, test_loss: 0.8531, test_f1: 0.6059
 epoch: 44, train_loss: 0.6878, test_loss: 0.8417, test_f1: 0.5890
 epoch: 45, train_loss: 0.6593, test_loss: 0.8210, test_f1: 0.6565
 epoch: 46, train_loss: 0.6745, test_loss: 0.7726, test_f1: 0.6568
 epoch: 47, train_loss: 0.6597, test_loss: 0.7834, test_f1: 0.6519
 epoch: 48, train_loss: 0.6584, test_loss: 0.8138, test_f1: 0.6432
 epoch: 49, train_loss: 0.6781, test_loss: 0.7987, test_f1: 0.6604
 epoch: 50, train_loss: 0.6576, test_loss: 0.8377, test_f1: 0.6401
 epoch: 51, train_loss: 0.6254, test_loss: 0.8006, test_f1: 0.6530
 epoch: 52, train_loss: 0.6067, test_loss: 0.7850, test_f1: 0.6485
 epoch: 53, train_loss: 0.5963, test_loss: 0.7929, test_f1: 0.6603
 epoch: 54, train_loss: 0.5910, test_loss: 0.8211, test_f1: 0.6557
 epoch: 55, train_loss: 0.6011, test_loss: 0.7913, test_f1: 0.6759
 epoch: 56, train_loss: 0.6026, test_loss: 0.8007, test_f1: 0.6646
 epoch: 57, train_loss: 0.5890, test_loss: 0.7817, test_f1: 0.6711
 epoch: 58, train_loss: 0.5815, test_loss: 0.8377, test_f1: 0.6654
 epoch: 59, train_loss: 0.5963, test_loss: 0.8062, test_f1: 0.6773
 epoch: 60, train_loss: 0.5821, test_loss: 0.7978, test_f1: 0.6628
 epoch: 61, train_loss: 0.5899, test_loss: 0.8459, test_f1: 0.6551
 epoch: 62, train_loss: 0.5707, test_loss: 0.8227, test_f1: 0.6671
 epoch: 63, train_loss: 0.5664, test_loss: 0.8343, test_f1: 0.6669
 epoch: 64, train_loss: 0.5698, test_loss: 0.8372, test_f1: 0.6656
 epoch: 65, train_loss: 0.5552, test_loss: 0.8565, test_f1: 0.6500
 epoch: 66, train_loss: 0.5782, test_loss: 0.8801, test_f1: 0.6521
 epoch: 67, train_loss: 0.5631, test_loss: 0.8724, test_f1: 0.6539
 epoch: 68, train_loss: 0.5589, test_loss: 0.8804, test_f1: 0.6394
 epoch: 69, train_loss: 0.5520, test_loss: 0.8362, test_f1: 0.6632
 epoch: 70, train_loss: 0.5778, test_loss: 0.8316, test_f1: 0.6478
 epoch: 71, train_loss: 0.5511, test_loss: 0.8607, test_f1: 0.6582
 epoch: 72, train_loss: 0.5794, test_loss: 0.8652, test_f1: 0.6697
 epoch: 73, train_loss: 0.5577, test_loss: 0.8160, test_f1: 0.6762
 epoch: 74, train_loss: 0.5520, test_loss: 0.8430, test_f1: 0.6562
 epoch: 75, train_loss: 0.5439, test_loss: 0.8390, test_f1: 0.6664
 epoch: 76, train_loss: 0.5504, test_loss: 0.8425, test_f1: 0.6751
 epoch: 77, train_loss: 0.5327, test_loss: 0.8626, test_f1: 0.6550
 epoch: 78, train_loss: 0.5367, test_loss: 0.9148, test_f1: 0.6515
 epoch: 79, train_loss: 0.5335, test_loss: 0.8618, test_f1: 0.6512
 epoch: 80, train_loss: 0.5310, test_loss: 0.8867, test_f1: 0.6445
 epoch: 81, train_loss: 0.5232, test_loss: 0.9124, test_f1: 0.6490
 epoch: 82, train_loss: 0.5395, test_loss: 0.8489, test_f1: 0.6523
 epoch: 83, train_loss: 0.5316, test_loss: 0.9006, test_f1: 0.6544
 epoch: 84, train_loss: 0.5111, test_loss: 0.9208, test_f1: 0.6615
 epoch: 85, train_loss: 0.5126, test_loss: 0.9059, test_f1: 0.6530
 epoch: 86, train_loss: 0.5252, test_loss: 0.9245, test_f1: 0.6518
 epoch: 87, train_loss: 0.5160, test_loss: 0.8993, test_f1: 0.6570
 epoch: 88, train_loss: 0.5054, test_loss: 0.9224, test_f1: 0.6464
 epoch: 89, train_loss: 0.5215, test_loss: 0.8786, test_f1: 0.6664
 epoch: 90, train_loss: 0.5123, test_loss: 0.8755, test_f1: 0.6560
 epoch: 91, train_loss: 0.5154, test_loss: 0.8368, test_f1: 0.6620
 epoch: 92, train_loss: 0.5032, test_loss: 0.8614, test_f1: 0.6692
 epoch: 93, train_loss: 0.5017, test_loss: 0.9979, test_f1: 0.6392
 epoch: 94, train_loss: 0.5148, test_loss: 0.9120, test_f1: 0.6651
 epoch: 95, train_loss: 0.5113, test_loss: 0.9425, test_f1: 0.6518
 epoch: 96, train_loss: 0.5170, test_loss: 0.8868, test_f1: 0.6695
 epoch: 97, train_loss: 0.5133, test_loss: 0.9265, test_f1: 0.6500
 epoch: 98, train_loss: 0.4935, test_loss: 0.8870, test_f1: 0.6595
 epoch: 99, train_loss: 0.5071, test_loss: 0.9399, test_f1: 0.6525
##################ITERATION #9 ****************************************
 epoch: 0, train_loss: 1.2737, test_loss: 1.0585, test_f1: 0.4679
 epoch: 1, train_loss: 1.0378, test_loss: 0.9830, test_f1: 0.4622
 epoch: 2, train_loss: 1.0083, test_loss: 0.9768, test_f1: 0.4891
 epoch: 3, train_loss: 0.9765, test_loss: 0.9277, test_f1: 0.5184
 epoch: 4, train_loss: 0.9517, test_loss: 0.9309, test_f1: 0.5016
 epoch: 5, train_loss: 0.9491, test_loss: 0.9656, test_f1: 0.5206
 epoch: 6, train_loss: 0.9506, test_loss: 0.8766, test_f1: 0.5088
 epoch: 7, train_loss: 0.9259, test_loss: 0.8454, test_f1: 0.5244
 epoch: 8, train_loss: 0.9256, test_loss: 0.9290, test_f1: 0.5600
 epoch: 9, train_loss: 0.9044, test_loss: 0.8928, test_f1: 0.5366
 epoch: 10, train_loss: 0.8955, test_loss: 0.8852, test_f1: 0.5278
 epoch: 11, train_loss: 0.8902, test_loss: 0.8654, test_f1: 0.5637
 epoch: 12, train_loss: 0.8696, test_loss: 0.7866, test_f1: 0.5840
 epoch: 13, train_loss: 0.8764, test_loss: 0.8163, test_f1: 0.6143
 epoch: 14, train_loss: 0.8644, test_loss: 0.8534, test_f1: 0.5915
 epoch: 15, train_loss: 0.8532, test_loss: 0.8297, test_f1: 0.5696
 epoch: 16, train_loss: 0.8487, test_loss: 0.8060, test_f1: 0.5928
 epoch: 17, train_loss: 0.8168, test_loss: 0.8627, test_f1: 0.5758
 epoch: 18, train_loss: 0.8201, test_loss: 0.8425, test_f1: 0.5650
 epoch: 19, train_loss: 0.8209, test_loss: 0.7780, test_f1: 0.6108
 epoch: 20, train_loss: 0.8102, test_loss: 0.8043, test_f1: 0.6111
 epoch: 21, train_loss: 0.8195, test_loss: 0.7986, test_f1: 0.6181
 epoch: 22, train_loss: 0.7800, test_loss: 0.7761, test_f1: 0.6205
 epoch: 23, train_loss: 0.7731, test_loss: 0.7668, test_f1: 0.6464
 epoch: 24, train_loss: 0.7777, test_loss: 0.7373, test_f1: 0.6183
 epoch: 25, train_loss: 0.7688, test_loss: 0.7865, test_f1: 0.6214
 epoch: 26, train_loss: 0.7605, test_loss: 0.7307, test_f1: 0.6418
 epoch: 27, train_loss: 0.7610, test_loss: 0.7797, test_f1: 0.6283
 epoch: 28, train_loss: 0.7402, test_loss: 0.7762, test_f1: 0.6349
 epoch: 29, train_loss: 0.7622, test_loss: 0.7137, test_f1: 0.6360
 epoch: 30, train_loss: 0.7638, test_loss: 0.8292, test_f1: 0.6345
 epoch: 31, train_loss: 0.7327, test_loss: 0.7271, test_f1: 0.6492
 epoch: 32, train_loss: 0.7368, test_loss: 0.7054, test_f1: 0.6614
 epoch: 33, train_loss: 0.7379, test_loss: 0.7297, test_f1: 0.6755
 epoch: 34, train_loss: 0.7453, test_loss: 0.6786, test_f1: 0.6863
 epoch: 35, train_loss: 0.7140, test_loss: 0.6992, test_f1: 0.6387
 epoch: 36, train_loss: 0.7095, test_loss: 0.7384, test_f1: 0.6638
 epoch: 37, train_loss: 0.7119, test_loss: 0.7883, test_f1: 0.6485
 epoch: 38, train_loss: 0.6995, test_loss: 0.6714, test_f1: 0.6714
 epoch: 39, train_loss: 0.7198, test_loss: 0.7849, test_f1: 0.6720
 epoch: 40, train_loss: 0.6925, test_loss: 0.6861, test_f1: 0.6792
 epoch: 41, train_loss: 0.7043, test_loss: 0.6665, test_f1: 0.6835
 epoch: 42, train_loss: 0.7112, test_loss: 0.6615, test_f1: 0.6594
 epoch: 43, train_loss: 0.7057, test_loss: 0.7135, test_f1: 0.6629
 epoch: 44, train_loss: 0.6964, test_loss: 0.7343, test_f1: 0.6313
 epoch: 45, train_loss: 0.6962, test_loss: 0.8220, test_f1: 0.6402
 epoch: 46, train_loss: 0.7015, test_loss: 0.7023, test_f1: 0.6559
 epoch: 47, train_loss: 0.6768, test_loss: 0.7395, test_f1: 0.6550
 epoch: 48, train_loss: 0.6812, test_loss: 0.6822, test_f1: 0.6717
 epoch: 49, train_loss: 0.6733, test_loss: 0.8397, test_f1: 0.6576
 epoch: 50, train_loss: 0.6692, test_loss: 0.8594, test_f1: 0.6566
 epoch: 51, train_loss: 0.6361, test_loss: 0.7307, test_f1: 0.6707
 epoch: 52, train_loss: 0.6344, test_loss: 0.7279, test_f1: 0.6708
 epoch: 53, train_loss: 0.6390, test_loss: 0.7453, test_f1: 0.6575
 epoch: 54, train_loss: 0.6185, test_loss: 0.7389, test_f1: 0.6510
 epoch: 55, train_loss: 0.6184, test_loss: 0.7269, test_f1: 0.6561
 epoch: 56, train_loss: 0.6147, test_loss: 0.7622, test_f1: 0.6646
 epoch: 57, train_loss: 0.6146, test_loss: 0.8019, test_f1: 0.6695
 epoch: 58, train_loss: 0.6099, test_loss: 0.7487, test_f1: 0.6755
 epoch: 59, train_loss: 0.5977, test_loss: 0.7336, test_f1: 0.6869
 epoch: 60, train_loss: 0.6060, test_loss: 0.7339, test_f1: 0.6553
 epoch: 61, train_loss: 0.6027, test_loss: 0.7715, test_f1: 0.6553
 epoch: 62, train_loss: 0.5964, test_loss: 0.7912, test_f1: 0.6588
 epoch: 63, train_loss: 0.6110, test_loss: 0.7658, test_f1: 0.6663
 epoch: 64, train_loss: 0.6023, test_loss: 0.7548, test_f1: 0.6649
 epoch: 65, train_loss: 0.6036, test_loss: 0.7858, test_f1: 0.6691
 epoch: 66, train_loss: 0.6098, test_loss: 0.7952, test_f1: 0.6673
 epoch: 67, train_loss: 0.5831, test_loss: 0.8150, test_f1: 0.6355
 epoch: 68, train_loss: 0.5977, test_loss: 0.8380, test_f1: 0.6973
 epoch: 69, train_loss: 0.6014, test_loss: 0.7993, test_f1: 0.6680
 epoch: 70, train_loss: 0.6010, test_loss: 0.7740, test_f1: 0.6674
 epoch: 71, train_loss: 0.5988, test_loss: 0.8595, test_f1: 0.6752
 epoch: 72, train_loss: 0.5710, test_loss: 0.8688, test_f1: 0.6647
 epoch: 73, train_loss: 0.5753, test_loss: 0.7749, test_f1: 0.6689
 epoch: 74, train_loss: 0.5713, test_loss: 0.8188, test_f1: 0.6782
 epoch: 75, train_loss: 0.5802, test_loss: 0.7357, test_f1: 0.6807
 epoch: 76, train_loss: 0.5827, test_loss: 0.7833, test_f1: 0.6843
 epoch: 77, train_loss: 0.5793, test_loss: 0.7714, test_f1: 0.6603
 epoch: 78, train_loss: 0.5744, test_loss: 0.8227, test_f1: 0.6626
 epoch: 79, train_loss: 0.5583, test_loss: 0.8008, test_f1: 0.6599
 epoch: 80, train_loss: 0.5773, test_loss: 0.8656, test_f1: 0.6677
 epoch: 81, train_loss: 0.5523, test_loss: 0.7957, test_f1: 0.6785
 epoch: 82, train_loss: 0.5694, test_loss: 0.8215, test_f1: 0.6736
 epoch: 83, train_loss: 0.5740, test_loss: 0.8568, test_f1: 0.6747
 epoch: 84, train_loss: 0.5457, test_loss: 0.8467, test_f1: 0.6674
 epoch: 85, train_loss: 0.5655, test_loss: 0.9588, test_f1: 0.6377
 epoch: 86, train_loss: 0.5573, test_loss: 0.8920, test_f1: 0.6701
 epoch: 87, train_loss: 0.5537, test_loss: 0.9171, test_f1: 0.6637
 epoch: 88, train_loss: 0.5501, test_loss: 0.8461, test_f1: 0.6659
 epoch: 89, train_loss: 0.5578, test_loss: 0.8953, test_f1: 0.6623
 epoch: 90, train_loss: 0.5484, test_loss: 0.9490, test_f1: 0.6444
 epoch: 91, train_loss: 0.5413, test_loss: 0.8037, test_f1: 0.6752
 epoch: 92, train_loss: 0.5512, test_loss: 0.8664, test_f1: 0.6484
 epoch: 93, train_loss: 0.5369, test_loss: 0.8928, test_f1: 0.6782
 epoch: 94, train_loss: 0.5397, test_loss: 0.8648, test_f1: 0.6871
 epoch: 95, train_loss: 0.5422, test_loss: 0.8706, test_f1: 0.6763
 epoch: 96, train_loss: 0.5464, test_loss: 0.9470, test_f1: 0.6710
 epoch: 97, train_loss: 0.5498, test_loss: 0.8947, test_f1: 0.6580
 epoch: 98, train_loss: 0.5315, test_loss: 0.9544, test_f1: 0.6486
 epoch: 99, train_loss: 0.5582, test_loss: 0.8989, test_f1: 0.6497

Training completed in 1313.49 seconds
Best F1: 0.7122 at epoch 65
Mean F1 across iterations: 0.6934  0.0150
========================FINAL RESULTS================================
FEGIN weighted F1: 0.7122  0.0150
python main.py --data ltspice_examples --representation component_pin_net --model FEGIN --layers 5 --hiddens 32 --batch_size 32 --lr 0.001 --emb_size 128 --epochs 100 --save_appendix component_pin_net_L5_H32_BS32_LR0.001_E128 --no_val
-----



STDERR:
  File "main.py", line 370, in <module>
    main()
  File "main.py", line 254, in main
    dataset = dataset_class(
  File "/home/philip/projects/ltspice_examples_code_repo/Circuit-Completion-Using-GNNs/component_classification_with_link_prediction_head/evaluation/FEGIN/kernel/circuit_datasets.py", line 15, in __init__
    self.data, self.slices = torch.load(self.processed_paths[0])
  File "/home/philip/.local/lib/python3.8/site-packages/torch/serialization.py", line 1040, in load
    warnings.warn(
  File "/usr/lib/python3.8/warnings.py", line 109, in _showwarnmsg
    sw(msg.message, msg.category, msg.filename, msg.lineno,
  File "main.py", line 47, in warn_with_traceback
    traceback.print_stack(file=log)
/home/philip/projects/ltspice_examples_code_repo/Circuit-Completion-Using-GNNs/component_classification_with_link_prediction_head/evaluation/FEGIN/kernel/circuit_datasets.py:15: FutureWarning: You are using `torch.load` with `weights_only=False` (the current default value), which uses the default pickle module implicitly. It is possible to construct malicious pickle data which will execute arbitrary code during unpickling (See https://github.com/pytorch/pytorch/blob/main/SECURITY.md#untrusted-models for more details). In a future release, the default value for `weights_only` will be flipped to `True`. This limits the functions that could be executed during unpickling. Arbitrary objects will no longer be allowed to be loaded via this mode unless they are explicitly allowlisted by the user via `torch.serialization.add_safe_globals`. We recommend you start setting `weights_only=True` for any use case where you don't have full control of the loaded file. Please open an issue on GitHub for any issues related to this experimental feature.
  self.data, self.slices = torch.load(self.processed_paths[0])
