STDOUT:
Results will be saved in /home/philip/projects/ltspice_examples_code_repo/Circuit-Completion-Using-GNNs/component_classification_with_link_prediction_head/evaluation/FEGIN/results/model_FEGIN_dataset_ltspice_examples
Command line input: python main.py --data ltspice_examples --representation component_component --model FEGIN --layers 6 --hiddens 64 --batch_size 256 --lr 0.0001 --emb_size 250 --epochs 100 --save_appendix component_component_L6_H64_BS256_LR0.0001_E250 --no_val
 is saved.
-----
ltspice_examples - FEGIN
Using 6 layers, 64 hidden units, h = 2
Loading component_component representation dataset
ENTERED
Training FEGIN on component_component representation
Train: 3556, Test: 845
##################ITERATION #0 ****************************************
 epoch: 0, train_loss: 1.3604, test_loss: 1.3647, test_f1: 0.2274
 epoch: 1, train_loss: 1.3529, test_loss: 1.3592, test_f1: 0.2555
 epoch: 2, train_loss: 1.3468, test_loss: 1.3497, test_f1: 0.2665
 epoch: 3, train_loss: 1.3412, test_loss: 1.3394, test_f1: 0.2685
 epoch: 4, train_loss: 1.3342, test_loss: 1.3292, test_f1: 0.2659
 epoch: 5, train_loss: 1.3269, test_loss: 1.3191, test_f1: 0.2851
 epoch: 6, train_loss: 1.3182, test_loss: 1.3090, test_f1: 0.3054
 epoch: 7, train_loss: 1.3089, test_loss: 1.2978, test_f1: 0.3069
 epoch: 8, train_loss: 1.2987, test_loss: 1.2865, test_f1: 0.3068
 epoch: 9, train_loss: 1.2874, test_loss: 1.2744, test_f1: 0.3084
 epoch: 10, train_loss: 1.2775, test_loss: 1.2626, test_f1: 0.3140
 epoch: 11, train_loss: 1.2682, test_loss: 1.2509, test_f1: 0.3124
 epoch: 12, train_loss: 1.2557, test_loss: 1.2399, test_f1: 0.3150
 epoch: 13, train_loss: 1.2480, test_loss: 1.2281, test_f1: 0.3174
 epoch: 14, train_loss: 1.2388, test_loss: 1.2196, test_f1: 0.3177
 epoch: 15, train_loss: 1.2299, test_loss: 1.2099, test_f1: 0.3151
 epoch: 16, train_loss: 1.2208, test_loss: 1.2023, test_f1: 0.3323
 epoch: 17, train_loss: 1.2156, test_loss: 1.1948, test_f1: 0.3355
 epoch: 18, train_loss: 1.2112, test_loss: 1.1881, test_f1: 0.3415
 epoch: 19, train_loss: 1.1986, test_loss: 1.1818, test_f1: 0.3452
 epoch: 20, train_loss: 1.1956, test_loss: 1.1741, test_f1: 0.3467
 epoch: 21, train_loss: 1.1864, test_loss: 1.1669, test_f1: 0.3460
 epoch: 22, train_loss: 1.1767, test_loss: 1.1610, test_f1: 0.3527
 epoch: 23, train_loss: 1.1768, test_loss: 1.1543, test_f1: 0.3378
 epoch: 24, train_loss: 1.1656, test_loss: 1.1453, test_f1: 0.3561
 epoch: 25, train_loss: 1.1566, test_loss: 1.1404, test_f1: 0.3528
 epoch: 26, train_loss: 1.1464, test_loss: 1.1352, test_f1: 0.3618
 epoch: 27, train_loss: 1.1412, test_loss: 1.1357, test_f1: 0.3586
 epoch: 28, train_loss: 1.1315, test_loss: 1.1319, test_f1: 0.3572
 epoch: 29, train_loss: 1.1216, test_loss: 1.1264, test_f1: 0.3600
 epoch: 30, train_loss: 1.1209, test_loss: 1.1139, test_f1: 0.3724
 epoch: 31, train_loss: 1.1112, test_loss: 1.1210, test_f1: 0.3752
 epoch: 32, train_loss: 1.1002, test_loss: 1.1157, test_f1: 0.3707
 epoch: 33, train_loss: 1.0963, test_loss: 1.1109, test_f1: 0.3719
 epoch: 34, train_loss: 1.0868, test_loss: 1.1024, test_f1: 0.3683
 epoch: 35, train_loss: 1.0870, test_loss: 1.1018, test_f1: 0.3712
 epoch: 36, train_loss: 1.0743, test_loss: 1.0997, test_f1: 0.3843
 epoch: 37, train_loss: 1.0641, test_loss: 1.1054, test_f1: 0.3880
 epoch: 38, train_loss: 1.0543, test_loss: 1.1114, test_f1: 0.4188
 epoch: 39, train_loss: 1.0591, test_loss: 1.0996, test_f1: 0.4413
 epoch: 40, train_loss: 1.0492, test_loss: 1.0917, test_f1: 0.4675
 epoch: 41, train_loss: 1.0442, test_loss: 1.1018, test_f1: 0.4615
 epoch: 42, train_loss: 1.0342, test_loss: 1.0915, test_f1: 0.4471
 epoch: 43, train_loss: 1.0328, test_loss: 1.0925, test_f1: 0.4506
 epoch: 44, train_loss: 1.0299, test_loss: 1.1001, test_f1: 0.4505
 epoch: 45, train_loss: 1.0179, test_loss: 1.0807, test_f1: 0.4607
 epoch: 46, train_loss: 1.0087, test_loss: 1.0872, test_f1: 0.4664
 epoch: 47, train_loss: 1.0099, test_loss: 1.0742, test_f1: 0.4648
 epoch: 48, train_loss: 0.9998, test_loss: 1.0808, test_f1: 0.4591
 epoch: 49, train_loss: 0.9979, test_loss: 1.0878, test_f1: 0.4682
 epoch: 50, train_loss: 0.9889, test_loss: 1.0636, test_f1: 0.4597
 epoch: 51, train_loss: 0.9806, test_loss: 1.0776, test_f1: 0.4661
 epoch: 52, train_loss: 0.9856, test_loss: 1.0832, test_f1: 0.4663
 epoch: 53, train_loss: 0.9685, test_loss: 1.0738, test_f1: 0.4607
 epoch: 54, train_loss: 0.9726, test_loss: 1.0771, test_f1: 0.4575
 epoch: 55, train_loss: 0.9768, test_loss: 1.0855, test_f1: 0.4568
 epoch: 56, train_loss: 0.9670, test_loss: 1.0836, test_f1: 0.4548
 epoch: 57, train_loss: 0.9706, test_loss: 1.0762, test_f1: 0.4676
 epoch: 58, train_loss: 0.9655, test_loss: 1.0814, test_f1: 0.4600
 epoch: 59, train_loss: 0.9537, test_loss: 1.0867, test_f1: 0.4565
 epoch: 60, train_loss: 0.9544, test_loss: 1.0874, test_f1: 0.4487
 epoch: 61, train_loss: 0.9579, test_loss: 1.0887, test_f1: 0.4639
 epoch: 62, train_loss: 0.9551, test_loss: 1.0870, test_f1: 0.4574
 epoch: 63, train_loss: 0.9470, test_loss: 1.0849, test_f1: 0.4615
 epoch: 64, train_loss: 0.9562, test_loss: 1.0827, test_f1: 0.4590
 epoch: 65, train_loss: 0.9503, test_loss: 1.0927, test_f1: 0.4575
 epoch: 66, train_loss: 0.9556, test_loss: 1.0930, test_f1: 0.4614
 epoch: 67, train_loss: 0.9446, test_loss: 1.0929, test_f1: 0.4603
 epoch: 68, train_loss: 0.9425, test_loss: 1.1031, test_f1: 0.4581
 epoch: 69, train_loss: 0.9336, test_loss: 1.0833, test_f1: 0.4637
 epoch: 70, train_loss: 0.9404, test_loss: 1.0893, test_f1: 0.4598
 epoch: 71, train_loss: 0.9373, test_loss: 1.0958, test_f1: 0.4527
 epoch: 72, train_loss: 0.9354, test_loss: 1.0941, test_f1: 0.4541
 epoch: 73, train_loss: 0.9291, test_loss: 1.0883, test_f1: 0.4596
 epoch: 74, train_loss: 0.9273, test_loss: 1.0949, test_f1: 0.4623
 epoch: 75, train_loss: 0.9301, test_loss: 1.0869, test_f1: 0.4606
 epoch: 76, train_loss: 0.9263, test_loss: 1.0977, test_f1: 0.4553
 epoch: 77, train_loss: 0.9312, test_loss: 1.1177, test_f1: 0.4572
 epoch: 78, train_loss: 0.9226, test_loss: 1.1143, test_f1: 0.4607
 epoch: 79, train_loss: 0.9182, test_loss: 1.1082, test_f1: 0.4533
 epoch: 80, train_loss: 0.9225, test_loss: 1.1132, test_f1: 0.4414
 epoch: 81, train_loss: 0.9099, test_loss: 1.1167, test_f1: 0.4425
 epoch: 82, train_loss: 0.9164, test_loss: 1.1093, test_f1: 0.4489
 epoch: 83, train_loss: 0.9199, test_loss: 1.0978, test_f1: 0.4570
 epoch: 84, train_loss: 0.9213, test_loss: 1.0922, test_f1: 0.4474
 epoch: 85, train_loss: 0.9089, test_loss: 1.1066, test_f1: 0.4467
 epoch: 86, train_loss: 0.9207, test_loss: 1.1040, test_f1: 0.4550
 epoch: 87, train_loss: 0.9221, test_loss: 1.1180, test_f1: 0.4541
 epoch: 88, train_loss: 0.9088, test_loss: 1.1039, test_f1: 0.4469
 epoch: 89, train_loss: 0.8982, test_loss: 1.1015, test_f1: 0.4484
 epoch: 90, train_loss: 0.8981, test_loss: 1.1185, test_f1: 0.4560
 epoch: 91, train_loss: 0.8975, test_loss: 1.1095, test_f1: 0.4481
 epoch: 92, train_loss: 0.8966, test_loss: 1.1039, test_f1: 0.4427
 epoch: 93, train_loss: 0.9015, test_loss: 1.1110, test_f1: 0.4469
 epoch: 94, train_loss: 0.9050, test_loss: 1.1150, test_f1: 0.4447
 epoch: 95, train_loss: 0.8924, test_loss: 1.1163, test_f1: 0.4542
 epoch: 96, train_loss: 0.8843, test_loss: 1.1064, test_f1: 0.4478
 epoch: 97, train_loss: 0.8755, test_loss: 1.1174, test_f1: 0.4399
 epoch: 98, train_loss: 0.8881, test_loss: 1.1145, test_f1: 0.4523
 epoch: 99, train_loss: 0.8793, test_loss: 1.1265, test_f1: 0.4494
##################ITERATION #1 ****************************************
 epoch: 0, train_loss: 1.3368, test_loss: 1.3453, test_f1: 0.2274
 epoch: 1, train_loss: 1.3217, test_loss: 1.3323, test_f1: 0.2274
 epoch: 2, train_loss: 1.3116, test_loss: 1.3206, test_f1: 0.2274
 epoch: 3, train_loss: 1.3000, test_loss: 1.3051, test_f1: 0.2274
 epoch: 4, train_loss: 1.2892, test_loss: 1.2897, test_f1: 0.2543
 epoch: 5, train_loss: 1.2779, test_loss: 1.2718, test_f1: 0.2688
 epoch: 6, train_loss: 1.2678, test_loss: 1.2570, test_f1: 0.2906
 epoch: 7, train_loss: 1.2557, test_loss: 1.2422, test_f1: 0.3106
 epoch: 8, train_loss: 1.2451, test_loss: 1.2291, test_f1: 0.3135
 epoch: 9, train_loss: 1.2369, test_loss: 1.2144, test_f1: 0.3165
 epoch: 10, train_loss: 1.2235, test_loss: 1.2031, test_f1: 0.3210
 epoch: 11, train_loss: 1.2130, test_loss: 1.1913, test_f1: 0.3322
 epoch: 12, train_loss: 1.2052, test_loss: 1.1801, test_f1: 0.3352
 epoch: 13, train_loss: 1.1969, test_loss: 1.1697, test_f1: 0.3427
 epoch: 14, train_loss: 1.1838, test_loss: 1.1616, test_f1: 0.3666
 epoch: 15, train_loss: 1.1784, test_loss: 1.1507, test_f1: 0.3707
 epoch: 16, train_loss: 1.1676, test_loss: 1.1429, test_f1: 0.3874
 epoch: 17, train_loss: 1.1612, test_loss: 1.1353, test_f1: 0.3905
 epoch: 18, train_loss: 1.1521, test_loss: 1.1265, test_f1: 0.4105
 epoch: 19, train_loss: 1.1490, test_loss: 1.1233, test_f1: 0.4073
 epoch: 20, train_loss: 1.1358, test_loss: 1.1139, test_f1: 0.4103
 epoch: 21, train_loss: 1.1306, test_loss: 1.1087, test_f1: 0.4105
 epoch: 22, train_loss: 1.1210, test_loss: 1.1068, test_f1: 0.4206
 epoch: 23, train_loss: 1.1118, test_loss: 1.0985, test_f1: 0.4180
 epoch: 24, train_loss: 1.1070, test_loss: 1.0905, test_f1: 0.4178
 epoch: 25, train_loss: 1.0961, test_loss: 1.0820, test_f1: 0.4226
 epoch: 26, train_loss: 1.0898, test_loss: 1.0852, test_f1: 0.4206
 epoch: 27, train_loss: 1.0824, test_loss: 1.0799, test_f1: 0.4237
 epoch: 28, train_loss: 1.0692, test_loss: 1.0732, test_f1: 0.4246
 epoch: 29, train_loss: 1.0711, test_loss: 1.0681, test_f1: 0.4428
 epoch: 30, train_loss: 1.0577, test_loss: 1.0649, test_f1: 0.4404
 epoch: 31, train_loss: 1.0478, test_loss: 1.0644, test_f1: 0.4548
 epoch: 32, train_loss: 1.0421, test_loss: 1.0589, test_f1: 0.4550
 epoch: 33, train_loss: 1.0296, test_loss: 1.0550, test_f1: 0.4617
 epoch: 34, train_loss: 1.0221, test_loss: 1.0551, test_f1: 0.4552
 epoch: 35, train_loss: 1.0103, test_loss: 1.0542, test_f1: 0.4622
 epoch: 36, train_loss: 1.0088, test_loss: 1.0442, test_f1: 0.4728
 epoch: 37, train_loss: 1.0052, test_loss: 1.0628, test_f1: 0.4643
 epoch: 38, train_loss: 0.9908, test_loss: 1.0515, test_f1: 0.4845
 epoch: 39, train_loss: 0.9838, test_loss: 1.0469, test_f1: 0.4831
 epoch: 40, train_loss: 0.9823, test_loss: 1.0468, test_f1: 0.4644
 epoch: 41, train_loss: 0.9759, test_loss: 1.0571, test_f1: 0.4789
 epoch: 42, train_loss: 0.9666, test_loss: 1.0546, test_f1: 0.4686
 epoch: 43, train_loss: 0.9606, test_loss: 1.0552, test_f1: 0.4657
 epoch: 44, train_loss: 0.9510, test_loss: 1.0652, test_f1: 0.4766
 epoch: 45, train_loss: 0.9521, test_loss: 1.0554, test_f1: 0.4574
 epoch: 46, train_loss: 0.9462, test_loss: 1.0455, test_f1: 0.4766
 epoch: 47, train_loss: 0.9394, test_loss: 1.0670, test_f1: 0.4781
 epoch: 48, train_loss: 0.9339, test_loss: 1.0553, test_f1: 0.4725
 epoch: 49, train_loss: 0.9337, test_loss: 1.0639, test_f1: 0.4722
 epoch: 50, train_loss: 0.9230, test_loss: 1.0524, test_f1: 0.4759
 epoch: 51, train_loss: 0.9096, test_loss: 1.0597, test_f1: 0.4732
 epoch: 52, train_loss: 0.9019, test_loss: 1.0628, test_f1: 0.4728
 epoch: 53, train_loss: 0.9042, test_loss: 1.0659, test_f1: 0.4727
 epoch: 54, train_loss: 0.9144, test_loss: 1.0653, test_f1: 0.4731
 epoch: 55, train_loss: 0.9011, test_loss: 1.0639, test_f1: 0.4721
 epoch: 56, train_loss: 0.8938, test_loss: 1.0662, test_f1: 0.4704
 epoch: 57, train_loss: 0.9054, test_loss: 1.0799, test_f1: 0.4688
 epoch: 58, train_loss: 0.8999, test_loss: 1.0732, test_f1: 0.4688
 epoch: 59, train_loss: 0.8928, test_loss: 1.0776, test_f1: 0.4655
 epoch: 60, train_loss: 0.9005, test_loss: 1.0744, test_f1: 0.4652
 epoch: 61, train_loss: 0.8858, test_loss: 1.0748, test_f1: 0.4703
 epoch: 62, train_loss: 0.8880, test_loss: 1.0768, test_f1: 0.4662
 epoch: 63, train_loss: 0.8843, test_loss: 1.0720, test_f1: 0.4617
 epoch: 64, train_loss: 0.8735, test_loss: 1.0746, test_f1: 0.4634
 epoch: 65, train_loss: 0.8876, test_loss: 1.0738, test_f1: 0.4624
 epoch: 66, train_loss: 0.8860, test_loss: 1.0694, test_f1: 0.4537
 epoch: 67, train_loss: 0.8767, test_loss: 1.0836, test_f1: 0.4617
 epoch: 68, train_loss: 0.8756, test_loss: 1.0907, test_f1: 0.4639
 epoch: 69, train_loss: 0.8640, test_loss: 1.0904, test_f1: 0.4592
 epoch: 70, train_loss: 0.8615, test_loss: 1.0860, test_f1: 0.4537
 epoch: 71, train_loss: 0.8603, test_loss: 1.0959, test_f1: 0.4554
 epoch: 72, train_loss: 0.8624, test_loss: 1.1140, test_f1: 0.4503
 epoch: 73, train_loss: 0.8604, test_loss: 1.0961, test_f1: 0.4591
 epoch: 74, train_loss: 0.8657, test_loss: 1.1072, test_f1: 0.4628
 epoch: 75, train_loss: 0.8512, test_loss: 1.1078, test_f1: 0.4657
 epoch: 76, train_loss: 0.8526, test_loss: 1.0941, test_f1: 0.4709
 epoch: 77, train_loss: 0.8504, test_loss: 1.1120, test_f1: 0.4575
 epoch: 78, train_loss: 0.8546, test_loss: 1.1043, test_f1: 0.4623
 epoch: 79, train_loss: 0.8520, test_loss: 1.1164, test_f1: 0.4589
 epoch: 80, train_loss: 0.8583, test_loss: 1.1163, test_f1: 0.4618
 epoch: 81, train_loss: 0.8390, test_loss: 1.1172, test_f1: 0.4683
 epoch: 82, train_loss: 0.8291, test_loss: 1.1179, test_f1: 0.4586
 epoch: 83, train_loss: 0.8422, test_loss: 1.1267, test_f1: 0.4525
 epoch: 84, train_loss: 0.8426, test_loss: 1.1269, test_f1: 0.4677
 epoch: 85, train_loss: 0.8422, test_loss: 1.1302, test_f1: 0.4633
 epoch: 86, train_loss: 0.8281, test_loss: 1.1326, test_f1: 0.4641
 epoch: 87, train_loss: 0.8337, test_loss: 1.1194, test_f1: 0.4661
 epoch: 88, train_loss: 0.8314, test_loss: 1.1287, test_f1: 0.4766
 epoch: 89, train_loss: 0.8318, test_loss: 1.1315, test_f1: 0.4737
 epoch: 90, train_loss: 0.8301, test_loss: 1.1439, test_f1: 0.4673
 epoch: 91, train_loss: 0.8274, test_loss: 1.1308, test_f1: 0.4560
 epoch: 92, train_loss: 0.8189, test_loss: 1.1377, test_f1: 0.4590
 epoch: 93, train_loss: 0.8271, test_loss: 1.1471, test_f1: 0.4574
 epoch: 94, train_loss: 0.8356, test_loss: 1.1306, test_f1: 0.4784
 epoch: 95, train_loss: 0.8151, test_loss: 1.1344, test_f1: 0.4712
 epoch: 96, train_loss: 0.8171, test_loss: 1.1278, test_f1: 0.4623
 epoch: 97, train_loss: 0.8109, test_loss: 1.1187, test_f1: 0.4776
 epoch: 98, train_loss: 0.8236, test_loss: 1.1315, test_f1: 0.4704
 epoch: 99, train_loss: 0.8123, test_loss: 1.1451, test_f1: 0.4581
##################ITERATION #2 ****************************************
 epoch: 0, train_loss: 1.3216, test_loss: 1.3388, test_f1: 0.2274
 epoch: 1, train_loss: 1.2962, test_loss: 1.3207, test_f1: 0.2274
 epoch: 2, train_loss: 1.2802, test_loss: 1.2911, test_f1: 0.2274
 epoch: 3, train_loss: 1.2688, test_loss: 1.2633, test_f1: 0.2547
 epoch: 4, train_loss: 1.2554, test_loss: 1.2445, test_f1: 0.2815
 epoch: 5, train_loss: 1.2460, test_loss: 1.2315, test_f1: 0.3043
 epoch: 6, train_loss: 1.2371, test_loss: 1.2186, test_f1: 0.3269
 epoch: 7, train_loss: 1.2245, test_loss: 1.2089, test_f1: 0.3278
 epoch: 8, train_loss: 1.2162, test_loss: 1.1999, test_f1: 0.3284
 epoch: 9, train_loss: 1.2045, test_loss: 1.1900, test_f1: 0.3543
 epoch: 10, train_loss: 1.1969, test_loss: 1.1802, test_f1: 0.3959
 epoch: 11, train_loss: 1.1859, test_loss: 1.1709, test_f1: 0.4300
 epoch: 12, train_loss: 1.1765, test_loss: 1.1648, test_f1: 0.4314
 epoch: 13, train_loss: 1.1611, test_loss: 1.1549, test_f1: 0.4613
 epoch: 14, train_loss: 1.1574, test_loss: 1.1468, test_f1: 0.4575
 epoch: 15, train_loss: 1.1422, test_loss: 1.1406, test_f1: 0.4564
 epoch: 16, train_loss: 1.1389, test_loss: 1.1317, test_f1: 0.4537
 epoch: 17, train_loss: 1.1272, test_loss: 1.1269, test_f1: 0.4507
 epoch: 18, train_loss: 1.1233, test_loss: 1.1227, test_f1: 0.4497
 epoch: 19, train_loss: 1.1126, test_loss: 1.1182, test_f1: 0.4551
 epoch: 20, train_loss: 1.1053, test_loss: 1.1113, test_f1: 0.4581
 epoch: 21, train_loss: 1.1042, test_loss: 1.1089, test_f1: 0.4596
 epoch: 22, train_loss: 1.0885, test_loss: 1.1060, test_f1: 0.4438
 epoch: 23, train_loss: 1.0723, test_loss: 1.0966, test_f1: 0.4565
 epoch: 24, train_loss: 1.0655, test_loss: 1.0910, test_f1: 0.4568
 epoch: 25, train_loss: 1.0535, test_loss: 1.0880, test_f1: 0.4427
 epoch: 26, train_loss: 1.0517, test_loss: 1.0905, test_f1: 0.4501
 epoch: 27, train_loss: 1.0482, test_loss: 1.0889, test_f1: 0.4536
 epoch: 28, train_loss: 1.0326, test_loss: 1.0824, test_f1: 0.4510
 epoch: 29, train_loss: 1.0270, test_loss: 1.0804, test_f1: 0.4528
 epoch: 30, train_loss: 1.0171, test_loss: 1.0778, test_f1: 0.4541
 epoch: 31, train_loss: 1.0091, test_loss: 1.0775, test_f1: 0.4581
 epoch: 32, train_loss: 1.0093, test_loss: 1.0697, test_f1: 0.4712
 epoch: 33, train_loss: 0.9941, test_loss: 1.0830, test_f1: 0.4524
 epoch: 34, train_loss: 0.9897, test_loss: 1.0678, test_f1: 0.4670
 epoch: 35, train_loss: 0.9781, test_loss: 1.0878, test_f1: 0.4469
 epoch: 36, train_loss: 0.9819, test_loss: 1.0727, test_f1: 0.4388
 epoch: 37, train_loss: 0.9679, test_loss: 1.0705, test_f1: 0.4518
 epoch: 38, train_loss: 0.9699, test_loss: 1.0744, test_f1: 0.4457
 epoch: 39, train_loss: 0.9658, test_loss: 1.0687, test_f1: 0.4713
 epoch: 40, train_loss: 0.9428, test_loss: 1.0634, test_f1: 0.4758
 epoch: 41, train_loss: 0.9473, test_loss: 1.0574, test_f1: 0.4869
 epoch: 42, train_loss: 0.9397, test_loss: 1.0645, test_f1: 0.4691
 epoch: 43, train_loss: 0.9240, test_loss: 1.0815, test_f1: 0.4577
 epoch: 44, train_loss: 0.9300, test_loss: 1.0773, test_f1: 0.4563
 epoch: 45, train_loss: 0.9256, test_loss: 1.0753, test_f1: 0.4403
 epoch: 46, train_loss: 0.9103, test_loss: 1.0767, test_f1: 0.4610
 epoch: 47, train_loss: 0.9084, test_loss: 1.0899, test_f1: 0.4692
 epoch: 48, train_loss: 0.9063, test_loss: 1.0835, test_f1: 0.4603
 epoch: 49, train_loss: 0.8939, test_loss: 1.0997, test_f1: 0.4733
 epoch: 50, train_loss: 0.8998, test_loss: 1.0964, test_f1: 0.4587
 epoch: 51, train_loss: 0.8886, test_loss: 1.0997, test_f1: 0.4520
 epoch: 52, train_loss: 0.8777, test_loss: 1.1028, test_f1: 0.4534
 epoch: 53, train_loss: 0.8750, test_loss: 1.1011, test_f1: 0.4610
 epoch: 54, train_loss: 0.8807, test_loss: 1.0999, test_f1: 0.4600
 epoch: 55, train_loss: 0.8704, test_loss: 1.1045, test_f1: 0.4556
 epoch: 56, train_loss: 0.8742, test_loss: 1.1096, test_f1: 0.4620
 epoch: 57, train_loss: 0.8560, test_loss: 1.1149, test_f1: 0.4608
 epoch: 58, train_loss: 0.8681, test_loss: 1.1181, test_f1: 0.4569
 epoch: 59, train_loss: 0.8495, test_loss: 1.1120, test_f1: 0.4587
 epoch: 60, train_loss: 0.8574, test_loss: 1.1173, test_f1: 0.4599
 epoch: 61, train_loss: 0.8555, test_loss: 1.1294, test_f1: 0.4545
 epoch: 62, train_loss: 0.8630, test_loss: 1.1278, test_f1: 0.4545
 epoch: 63, train_loss: 0.8471, test_loss: 1.1289, test_f1: 0.4705
 epoch: 64, train_loss: 0.8560, test_loss: 1.1281, test_f1: 0.4459
 epoch: 65, train_loss: 0.8468, test_loss: 1.1337, test_f1: 0.4741
 epoch: 66, train_loss: 0.8493, test_loss: 1.1380, test_f1: 0.4628
 epoch: 67, train_loss: 0.8417, test_loss: 1.1359, test_f1: 0.4653
 epoch: 68, train_loss: 0.8441, test_loss: 1.1399, test_f1: 0.4653
 epoch: 69, train_loss: 0.8462, test_loss: 1.1449, test_f1: 0.4691
 epoch: 70, train_loss: 0.8402, test_loss: 1.1468, test_f1: 0.4643
 epoch: 71, train_loss: 0.8402, test_loss: 1.1413, test_f1: 0.4680
 epoch: 72, train_loss: 0.8444, test_loss: 1.1464, test_f1: 0.4636
 epoch: 73, train_loss: 0.8331, test_loss: 1.1333, test_f1: 0.4689
 epoch: 74, train_loss: 0.8226, test_loss: 1.1322, test_f1: 0.4543
 epoch: 75, train_loss: 0.8256, test_loss: 1.1392, test_f1: 0.4618
 epoch: 76, train_loss: 0.8284, test_loss: 1.1511, test_f1: 0.4561
 epoch: 77, train_loss: 0.8222, test_loss: 1.1655, test_f1: 0.4567
 epoch: 78, train_loss: 0.8205, test_loss: 1.1581, test_f1: 0.4583
 epoch: 79, train_loss: 0.8173, test_loss: 1.1540, test_f1: 0.4552
 epoch: 80, train_loss: 0.8062, test_loss: 1.1552, test_f1: 0.4640
 epoch: 81, train_loss: 0.8152, test_loss: 1.1716, test_f1: 0.4653
 epoch: 82, train_loss: 0.8258, test_loss: 1.1673, test_f1: 0.4615
 epoch: 83, train_loss: 0.8015, test_loss: 1.1760, test_f1: 0.4542
 epoch: 84, train_loss: 0.8102, test_loss: 1.1849, test_f1: 0.4533
 epoch: 85, train_loss: 0.8121, test_loss: 1.1836, test_f1: 0.4566
 epoch: 86, train_loss: 0.8015, test_loss: 1.1986, test_f1: 0.4554
 epoch: 87, train_loss: 0.8061, test_loss: 1.1844, test_f1: 0.4660
 epoch: 88, train_loss: 0.7994, test_loss: 1.1868, test_f1: 0.4613
 epoch: 89, train_loss: 0.7960, test_loss: 1.1911, test_f1: 0.4662
 epoch: 90, train_loss: 0.7966, test_loss: 1.1747, test_f1: 0.4579
 epoch: 91, train_loss: 0.7917, test_loss: 1.1858, test_f1: 0.4595
 epoch: 92, train_loss: 0.7962, test_loss: 1.2006, test_f1: 0.4543
 epoch: 93, train_loss: 0.7876, test_loss: 1.1761, test_f1: 0.4636
 epoch: 94, train_loss: 0.7887, test_loss: 1.1938, test_f1: 0.4635
 epoch: 95, train_loss: 0.7882, test_loss: 1.2096, test_f1: 0.4452
 epoch: 96, train_loss: 0.7852, test_loss: 1.2069, test_f1: 0.4633
 epoch: 97, train_loss: 0.7816, test_loss: 1.2063, test_f1: 0.4560
 epoch: 98, train_loss: 0.7868, test_loss: 1.2239, test_f1: 0.4582
 epoch: 99, train_loss: 0.7732, test_loss: 1.2020, test_f1: 0.4665
##################ITERATION #3 ****************************************
 epoch: 0, train_loss: 1.3072, test_loss: 1.3247, test_f1: 0.2274
 epoch: 1, train_loss: 1.2846, test_loss: 1.3050, test_f1: 0.2274
 epoch: 2, train_loss: 1.2749, test_loss: 1.2749, test_f1: 0.2268
 epoch: 3, train_loss: 1.2587, test_loss: 1.2506, test_f1: 0.2645
 epoch: 4, train_loss: 1.2514, test_loss: 1.2347, test_f1: 0.2971
 epoch: 5, train_loss: 1.2419, test_loss: 1.2235, test_f1: 0.3120
 epoch: 6, train_loss: 1.2319, test_loss: 1.2140, test_f1: 0.3252
 epoch: 7, train_loss: 1.2210, test_loss: 1.2045, test_f1: 0.3349
 epoch: 8, train_loss: 1.2144, test_loss: 1.1972, test_f1: 0.3404
 epoch: 9, train_loss: 1.2072, test_loss: 1.1892, test_f1: 0.3431
 epoch: 10, train_loss: 1.1952, test_loss: 1.1808, test_f1: 0.3504
 epoch: 11, train_loss: 1.1848, test_loss: 1.1738, test_f1: 0.3550
 epoch: 12, train_loss: 1.1836, test_loss: 1.1698, test_f1: 0.3837
 epoch: 13, train_loss: 1.1768, test_loss: 1.1627, test_f1: 0.4025
 epoch: 14, train_loss: 1.1694, test_loss: 1.1586, test_f1: 0.4246
 epoch: 15, train_loss: 1.1649, test_loss: 1.1549, test_f1: 0.4293
 epoch: 16, train_loss: 1.1576, test_loss: 1.1494, test_f1: 0.4256
 epoch: 17, train_loss: 1.1601, test_loss: 1.1460, test_f1: 0.4402
 epoch: 18, train_loss: 1.1459, test_loss: 1.1384, test_f1: 0.4439
 epoch: 19, train_loss: 1.1440, test_loss: 1.1326, test_f1: 0.4434
 epoch: 20, train_loss: 1.1326, test_loss: 1.1245, test_f1: 0.4416
 epoch: 21, train_loss: 1.1307, test_loss: 1.1243, test_f1: 0.4246
 epoch: 22, train_loss: 1.1189, test_loss: 1.1192, test_f1: 0.4445
 epoch: 23, train_loss: 1.1249, test_loss: 1.1138, test_f1: 0.4382
 epoch: 24, train_loss: 1.1095, test_loss: 1.1112, test_f1: 0.4436
 epoch: 25, train_loss: 1.1079, test_loss: 1.1065, test_f1: 0.4469
 epoch: 26, train_loss: 1.0989, test_loss: 1.1040, test_f1: 0.4478
 epoch: 27, train_loss: 1.0991, test_loss: 1.1011, test_f1: 0.4444
 epoch: 28, train_loss: 1.0894, test_loss: 1.0921, test_f1: 0.4512
 epoch: 29, train_loss: 1.0888, test_loss: 1.0881, test_f1: 0.4503
 epoch: 30, train_loss: 1.0724, test_loss: 1.0808, test_f1: 0.4748
 epoch: 31, train_loss: 1.0680, test_loss: 1.0803, test_f1: 0.4738
 epoch: 32, train_loss: 1.0673, test_loss: 1.0808, test_f1: 0.4657
 epoch: 33, train_loss: 1.0591, test_loss: 1.0778, test_f1: 0.4745
 epoch: 34, train_loss: 1.0458, test_loss: 1.0790, test_f1: 0.4595
 epoch: 35, train_loss: 1.0520, test_loss: 1.0752, test_f1: 0.4679
 epoch: 36, train_loss: 1.0441, test_loss: 1.0660, test_f1: 0.4648
 epoch: 37, train_loss: 1.0368, test_loss: 1.0704, test_f1: 0.4597
 epoch: 38, train_loss: 1.0225, test_loss: 1.0734, test_f1: 0.4566
 epoch: 39, train_loss: 1.0261, test_loss: 1.0809, test_f1: 0.4561
 epoch: 40, train_loss: 1.0208, test_loss: 1.0640, test_f1: 0.4572
 epoch: 41, train_loss: 1.0166, test_loss: 1.0632, test_f1: 0.4673
 epoch: 42, train_loss: 1.0079, test_loss: 1.0624, test_f1: 0.4587
 epoch: 43, train_loss: 1.0000, test_loss: 1.0514, test_f1: 0.4796
 epoch: 44, train_loss: 1.0034, test_loss: 1.0654, test_f1: 0.4711
 epoch: 45, train_loss: 0.9922, test_loss: 1.0692, test_f1: 0.4692
 epoch: 46, train_loss: 0.9873, test_loss: 1.0698, test_f1: 0.4615
 epoch: 47, train_loss: 0.9813, test_loss: 1.0519, test_f1: 0.4626
 epoch: 48, train_loss: 0.9830, test_loss: 1.0652, test_f1: 0.4512
 epoch: 49, train_loss: 0.9711, test_loss: 1.0566, test_f1: 0.4572
 epoch: 50, train_loss: 0.9716, test_loss: 1.0612, test_f1: 0.4616
 epoch: 51, train_loss: 0.9558, test_loss: 1.0639, test_f1: 0.4535
 epoch: 52, train_loss: 0.9658, test_loss: 1.0746, test_f1: 0.4521
 epoch: 53, train_loss: 0.9547, test_loss: 1.0823, test_f1: 0.4445
 epoch: 54, train_loss: 0.9645, test_loss: 1.0829, test_f1: 0.4497
 epoch: 55, train_loss: 0.9541, test_loss: 1.0542, test_f1: 0.4606
 epoch: 56, train_loss: 0.9413, test_loss: 1.0608, test_f1: 0.4614
 epoch: 57, train_loss: 0.9475, test_loss: 1.0617, test_f1: 0.4604
 epoch: 58, train_loss: 0.9469, test_loss: 1.0702, test_f1: 0.4489
 epoch: 59, train_loss: 0.9368, test_loss: 1.0630, test_f1: 0.4561
 epoch: 60, train_loss: 0.9466, test_loss: 1.0749, test_f1: 0.4521
 epoch: 61, train_loss: 0.9345, test_loss: 1.0749, test_f1: 0.4475
 epoch: 62, train_loss: 0.9278, test_loss: 1.0727, test_f1: 0.4529
 epoch: 63, train_loss: 0.9393, test_loss: 1.0683, test_f1: 0.4621
 epoch: 64, train_loss: 0.9275, test_loss: 1.0725, test_f1: 0.4531
 epoch: 65, train_loss: 0.9243, test_loss: 1.0827, test_f1: 0.4550
 epoch: 66, train_loss: 0.9244, test_loss: 1.0734, test_f1: 0.4594
 epoch: 67, train_loss: 0.9146, test_loss: 1.0739, test_f1: 0.4545
 epoch: 68, train_loss: 0.9178, test_loss: 1.0757, test_f1: 0.4482
 epoch: 69, train_loss: 0.9228, test_loss: 1.0701, test_f1: 0.4594
 epoch: 70, train_loss: 0.9113, test_loss: 1.0745, test_f1: 0.4624
 epoch: 71, train_loss: 0.9113, test_loss: 1.0805, test_f1: 0.4585
 epoch: 72, train_loss: 0.9170, test_loss: 1.0856, test_f1: 0.4598
 epoch: 73, train_loss: 0.9053, test_loss: 1.0728, test_f1: 0.4548
 epoch: 74, train_loss: 0.9121, test_loss: 1.0860, test_f1: 0.4524
 epoch: 75, train_loss: 0.9135, test_loss: 1.0785, test_f1: 0.4519
 epoch: 76, train_loss: 0.9047, test_loss: 1.0825, test_f1: 0.4601
 epoch: 77, train_loss: 0.8994, test_loss: 1.0951, test_f1: 0.4591
 epoch: 78, train_loss: 0.9135, test_loss: 1.0919, test_f1: 0.4507
 epoch: 79, train_loss: 0.9066, test_loss: 1.0964, test_f1: 0.4491
 epoch: 80, train_loss: 0.8957, test_loss: 1.0762, test_f1: 0.4533
 epoch: 81, train_loss: 0.8966, test_loss: 1.0764, test_f1: 0.4575
 epoch: 82, train_loss: 0.8877, test_loss: 1.0849, test_f1: 0.4606
 epoch: 83, train_loss: 0.8875, test_loss: 1.0829, test_f1: 0.4591
 epoch: 84, train_loss: 0.8840, test_loss: 1.0770, test_f1: 0.4613
 epoch: 85, train_loss: 0.8870, test_loss: 1.0812, test_f1: 0.4635
 epoch: 86, train_loss: 0.8829, test_loss: 1.0859, test_f1: 0.4612
 epoch: 87, train_loss: 0.8869, test_loss: 1.0910, test_f1: 0.4616
 epoch: 88, train_loss: 0.8859, test_loss: 1.0859, test_f1: 0.4532
 epoch: 89, train_loss: 0.8781, test_loss: 1.0695, test_f1: 0.4580
 epoch: 90, train_loss: 0.8792, test_loss: 1.0866, test_f1: 0.4532
 epoch: 91, train_loss: 0.8872, test_loss: 1.0818, test_f1: 0.4655
 epoch: 92, train_loss: 0.8794, test_loss: 1.0952, test_f1: 0.4579
 epoch: 93, train_loss: 0.8653, test_loss: 1.0878, test_f1: 0.4531
 epoch: 94, train_loss: 0.8584, test_loss: 1.0894, test_f1: 0.4591
 epoch: 95, train_loss: 0.8750, test_loss: 1.1012, test_f1: 0.4560
 epoch: 96, train_loss: 0.8658, test_loss: 1.0942, test_f1: 0.4620
 epoch: 97, train_loss: 0.8657, test_loss: 1.1114, test_f1: 0.4600
 epoch: 98, train_loss: 0.8609, test_loss: 1.0946, test_f1: 0.4569
 epoch: 99, train_loss: 0.8611, test_loss: 1.1090, test_f1: 0.4496
##################ITERATION #4 ****************************************
 epoch: 0, train_loss: 1.3096, test_loss: 1.3108, test_f1: 0.2274
 epoch: 1, train_loss: 1.2778, test_loss: 1.2903, test_f1: 0.2274
 epoch: 2, train_loss: 1.2633, test_loss: 1.2627, test_f1: 0.2557
 epoch: 3, train_loss: 1.2556, test_loss: 1.2376, test_f1: 0.2874
 epoch: 4, train_loss: 1.2434, test_loss: 1.2219, test_f1: 0.3162
 epoch: 5, train_loss: 1.2344, test_loss: 1.2116, test_f1: 0.3452
 epoch: 6, train_loss: 1.2232, test_loss: 1.2042, test_f1: 0.3789
 epoch: 7, train_loss: 1.2165, test_loss: 1.1967, test_f1: 0.3988
 epoch: 8, train_loss: 1.2129, test_loss: 1.1903, test_f1: 0.4061
 epoch: 9, train_loss: 1.2017, test_loss: 1.1821, test_f1: 0.4030
 epoch: 10, train_loss: 1.1975, test_loss: 1.1761, test_f1: 0.4124
 epoch: 11, train_loss: 1.1916, test_loss: 1.1707, test_f1: 0.4285
 epoch: 12, train_loss: 1.1823, test_loss: 1.1633, test_f1: 0.4327
 epoch: 13, train_loss: 1.1785, test_loss: 1.1595, test_f1: 0.4375
 epoch: 14, train_loss: 1.1711, test_loss: 1.1542, test_f1: 0.4334
 epoch: 15, train_loss: 1.1645, test_loss: 1.1508, test_f1: 0.4262
 epoch: 16, train_loss: 1.1654, test_loss: 1.1473, test_f1: 0.4262
 epoch: 17, train_loss: 1.1545, test_loss: 1.1435, test_f1: 0.4193
 epoch: 18, train_loss: 1.1469, test_loss: 1.1399, test_f1: 0.4302
 epoch: 19, train_loss: 1.1452, test_loss: 1.1347, test_f1: 0.4181
 epoch: 20, train_loss: 1.1369, test_loss: 1.1304, test_f1: 0.4230
 epoch: 21, train_loss: 1.1371, test_loss: 1.1283, test_f1: 0.4161
 epoch: 22, train_loss: 1.1290, test_loss: 1.1240, test_f1: 0.4130
 epoch: 23, train_loss: 1.1218, test_loss: 1.1163, test_f1: 0.4254
 epoch: 24, train_loss: 1.1190, test_loss: 1.1171, test_f1: 0.4160
 epoch: 25, train_loss: 1.1111, test_loss: 1.1105, test_f1: 0.4324
 epoch: 26, train_loss: 1.1014, test_loss: 1.1086, test_f1: 0.4390
 epoch: 27, train_loss: 1.0970, test_loss: 1.1058, test_f1: 0.4411
 epoch: 28, train_loss: 1.0972, test_loss: 1.1030, test_f1: 0.4454
 epoch: 29, train_loss: 1.0912, test_loss: 1.0957, test_f1: 0.4428
 epoch: 30, train_loss: 1.0797, test_loss: 1.0950, test_f1: 0.4248
 epoch: 31, train_loss: 1.0811, test_loss: 1.0866, test_f1: 0.4268
 epoch: 32, train_loss: 1.0672, test_loss: 1.0885, test_f1: 0.4358
 epoch: 33, train_loss: 1.0649, test_loss: 1.0817, test_f1: 0.4330
 epoch: 34, train_loss: 1.0628, test_loss: 1.0719, test_f1: 0.4389
 epoch: 35, train_loss: 1.0408, test_loss: 1.0758, test_f1: 0.4459
 epoch: 36, train_loss: 1.0477, test_loss: 1.0624, test_f1: 0.4633
 epoch: 37, train_loss: 1.0398, test_loss: 1.0612, test_f1: 0.4617
 epoch: 38, train_loss: 1.0349, test_loss: 1.0584, test_f1: 0.4569
 epoch: 39, train_loss: 1.0312, test_loss: 1.0636, test_f1: 0.4522
 epoch: 40, train_loss: 1.0166, test_loss: 1.0539, test_f1: 0.4613
 epoch: 41, train_loss: 1.0109, test_loss: 1.0504, test_f1: 0.4647
 epoch: 42, train_loss: 1.0079, test_loss: 1.0682, test_f1: 0.4472
 epoch: 43, train_loss: 1.0039, test_loss: 1.0506, test_f1: 0.4626
 epoch: 44, train_loss: 0.9935, test_loss: 1.0574, test_f1: 0.4587
 epoch: 45, train_loss: 0.9984, test_loss: 1.0542, test_f1: 0.4640
 epoch: 46, train_loss: 0.9871, test_loss: 1.0674, test_f1: 0.4469
 epoch: 47, train_loss: 0.9683, test_loss: 1.0342, test_f1: 0.4764
 epoch: 48, train_loss: 0.9800, test_loss: 1.0354, test_f1: 0.4762
 epoch: 49, train_loss: 0.9677, test_loss: 1.0398, test_f1: 0.4691
 epoch: 50, train_loss: 0.9571, test_loss: 1.0343, test_f1: 0.4643
 epoch: 51, train_loss: 0.9485, test_loss: 1.0426, test_f1: 0.4689
 epoch: 52, train_loss: 0.9564, test_loss: 1.0389, test_f1: 0.4793
 epoch: 53, train_loss: 0.9484, test_loss: 1.0271, test_f1: 0.4816
 epoch: 54, train_loss: 0.9339, test_loss: 1.0365, test_f1: 0.4765
 epoch: 55, train_loss: 0.9529, test_loss: 1.0332, test_f1: 0.4815
 epoch: 56, train_loss: 0.9398, test_loss: 1.0429, test_f1: 0.4762
 epoch: 57, train_loss: 0.9452, test_loss: 1.0333, test_f1: 0.4802
 epoch: 58, train_loss: 0.9326, test_loss: 1.0362, test_f1: 0.4743
 epoch: 59, train_loss: 0.9315, test_loss: 1.0502, test_f1: 0.4699
 epoch: 60, train_loss: 0.9321, test_loss: 1.0376, test_f1: 0.4772
 epoch: 61, train_loss: 0.9371, test_loss: 1.0427, test_f1: 0.4683
 epoch: 62, train_loss: 0.9212, test_loss: 1.0227, test_f1: 0.4815
 epoch: 63, train_loss: 0.9248, test_loss: 1.0348, test_f1: 0.4785
 epoch: 64, train_loss: 0.9109, test_loss: 1.0532, test_f1: 0.4720
 epoch: 65, train_loss: 0.9076, test_loss: 1.0467, test_f1: 0.4828
 epoch: 66, train_loss: 0.9126, test_loss: 1.0480, test_f1: 0.4756
 epoch: 67, train_loss: 0.9122, test_loss: 1.0355, test_f1: 0.4874
 epoch: 68, train_loss: 0.9066, test_loss: 1.0496, test_f1: 0.4667
 epoch: 69, train_loss: 0.9135, test_loss: 1.0495, test_f1: 0.4722
 epoch: 70, train_loss: 0.9004, test_loss: 1.0551, test_f1: 0.4725
 epoch: 71, train_loss: 0.9029, test_loss: 1.0531, test_f1: 0.4723
 epoch: 72, train_loss: 0.9010, test_loss: 1.0418, test_f1: 0.4833
 epoch: 73, train_loss: 0.8952, test_loss: 1.0577, test_f1: 0.4785
 epoch: 74, train_loss: 0.8962, test_loss: 1.0341, test_f1: 0.4845
 epoch: 75, train_loss: 0.8903, test_loss: 1.0478, test_f1: 0.4807
 epoch: 76, train_loss: 0.8947, test_loss: 1.0402, test_f1: 0.4859
 epoch: 77, train_loss: 0.8914, test_loss: 1.0577, test_f1: 0.4788
 epoch: 78, train_loss: 0.8827, test_loss: 1.0503, test_f1: 0.4807
 epoch: 79, train_loss: 0.9022, test_loss: 1.0624, test_f1: 0.4820
 epoch: 80, train_loss: 0.8831, test_loss: 1.0430, test_f1: 0.4858
 epoch: 81, train_loss: 0.8877, test_loss: 1.0564, test_f1: 0.4784
 epoch: 82, train_loss: 0.8728, test_loss: 1.0493, test_f1: 0.4799
 epoch: 83, train_loss: 0.8815, test_loss: 1.0695, test_f1: 0.4829
 epoch: 84, train_loss: 0.8767, test_loss: 1.0522, test_f1: 0.4847
 epoch: 85, train_loss: 0.8812, test_loss: 1.0623, test_f1: 0.4790
 epoch: 86, train_loss: 0.8709, test_loss: 1.0634, test_f1: 0.4722
 epoch: 87, train_loss: 0.8753, test_loss: 1.0747, test_f1: 0.4719
 epoch: 88, train_loss: 0.8661, test_loss: 1.0753, test_f1: 0.4770
 epoch: 89, train_loss: 0.8718, test_loss: 1.0504, test_f1: 0.4769
 epoch: 90, train_loss: 0.8645, test_loss: 1.0661, test_f1: 0.4883
 epoch: 91, train_loss: 0.8672, test_loss: 1.0701, test_f1: 0.4851
 epoch: 92, train_loss: 0.8626, test_loss: 1.0632, test_f1: 0.4816
 epoch: 93, train_loss: 0.8681, test_loss: 1.0748, test_f1: 0.4797
 epoch: 94, train_loss: 0.8463, test_loss: 1.0692, test_f1: 0.4756
 epoch: 95, train_loss: 0.8528, test_loss: 1.0732, test_f1: 0.4757
 epoch: 96, train_loss: 0.8597, test_loss: 1.0753, test_f1: 0.4784
 epoch: 97, train_loss: 0.8521, test_loss: 1.0681, test_f1: 0.4884
 epoch: 98, train_loss: 0.8595, test_loss: 1.0831, test_f1: 0.4809
 epoch: 99, train_loss: 0.8673, test_loss: 1.0780, test_f1: 0.4862
##################ITERATION #5 ****************************************
 epoch: 0, train_loss: 1.3167, test_loss: 1.3134, test_f1: 0.2274
 epoch: 1, train_loss: 1.2733, test_loss: 1.2943, test_f1: 0.2276
 epoch: 2, train_loss: 1.2574, test_loss: 1.2659, test_f1: 0.2810
 epoch: 3, train_loss: 1.2417, test_loss: 1.2456, test_f1: 0.2966
 epoch: 4, train_loss: 1.2307, test_loss: 1.2300, test_f1: 0.3176
 epoch: 5, train_loss: 1.2181, test_loss: 1.2635, test_f1: 0.3604
 epoch: 6, train_loss: 1.2112, test_loss: 1.2967, test_f1: 0.4084
 epoch: 7, train_loss: 1.2025, test_loss: 1.2991, test_f1: 0.4284
 epoch: 8, train_loss: 1.1915, test_loss: 1.2836, test_f1: 0.4307
 epoch: 9, train_loss: 1.1800, test_loss: 1.2648, test_f1: 0.4313
 epoch: 10, train_loss: 1.1835, test_loss: 1.2228, test_f1: 0.4301
 epoch: 11, train_loss: 1.1622, test_loss: 1.2613, test_f1: 0.4186
 epoch: 12, train_loss: 1.1601, test_loss: 1.2597, test_f1: 0.4375
 epoch: 13, train_loss: 1.1529, test_loss: 1.2096, test_f1: 0.4417
 epoch: 14, train_loss: 1.1423, test_loss: 1.1969, test_f1: 0.4411
 epoch: 15, train_loss: 1.1326, test_loss: 1.1926, test_f1: 0.4449
 epoch: 16, train_loss: 1.1328, test_loss: 1.1574, test_f1: 0.4487
 epoch: 17, train_loss: 1.1332, test_loss: 1.1491, test_f1: 0.4435
 epoch: 18, train_loss: 1.1128, test_loss: 1.1440, test_f1: 0.4472
 epoch: 19, train_loss: 1.1156, test_loss: 1.1395, test_f1: 0.4480
 epoch: 20, train_loss: 1.1084, test_loss: 1.1331, test_f1: 0.4490
 epoch: 21, train_loss: 1.1041, test_loss: 1.1376, test_f1: 0.4482
 epoch: 22, train_loss: 1.0970, test_loss: 1.1166, test_f1: 0.4510
 epoch: 23, train_loss: 1.0934, test_loss: 1.1180, test_f1: 0.4356
 epoch: 24, train_loss: 1.0840, test_loss: 1.1243, test_f1: 0.4479
 epoch: 25, train_loss: 1.0802, test_loss: 1.1284, test_f1: 0.4473
 epoch: 26, train_loss: 1.0749, test_loss: 1.1156, test_f1: 0.4461
 epoch: 27, train_loss: 1.0713, test_loss: 1.1124, test_f1: 0.4378
 epoch: 28, train_loss: 1.0633, test_loss: 1.1026, test_f1: 0.4262
 epoch: 29, train_loss: 1.0603, test_loss: 1.1139, test_f1: 0.4353
 epoch: 30, train_loss: 1.0491, test_loss: 1.1236, test_f1: 0.4321
 epoch: 31, train_loss: 1.0558, test_loss: 1.1120, test_f1: 0.4230
 epoch: 32, train_loss: 1.0435, test_loss: 1.0864, test_f1: 0.4324
 epoch: 33, train_loss: 1.0290, test_loss: 1.0864, test_f1: 0.4322
 epoch: 34, train_loss: 1.0264, test_loss: 1.1025, test_f1: 0.4315
 epoch: 35, train_loss: 1.0340, test_loss: 1.1004, test_f1: 0.4331
 epoch: 36, train_loss: 1.0209, test_loss: 1.0849, test_f1: 0.4292
 epoch: 37, train_loss: 1.0169, test_loss: 1.0904, test_f1: 0.4386
 epoch: 38, train_loss: 1.0078, test_loss: 1.0992, test_f1: 0.4387
 epoch: 39, train_loss: 0.9982, test_loss: 1.0983, test_f1: 0.4348
 epoch: 40, train_loss: 0.9998, test_loss: 1.1143, test_f1: 0.4421
 epoch: 41, train_loss: 0.9964, test_loss: 1.1989, test_f1: 0.4362
 epoch: 42, train_loss: 0.9899, test_loss: 1.1169, test_f1: 0.4455
 epoch: 43, train_loss: 0.9842, test_loss: 1.1177, test_f1: 0.4467
 epoch: 44, train_loss: 0.9757, test_loss: 1.1578, test_f1: 0.4366
 epoch: 45, train_loss: 0.9761, test_loss: 1.2139, test_f1: 0.4269
 epoch: 46, train_loss: 0.9621, test_loss: 1.2372, test_f1: 0.4437
 epoch: 47, train_loss: 0.9744, test_loss: 1.2988, test_f1: 0.4216
 epoch: 48, train_loss: 0.9672, test_loss: 1.3684, test_f1: 0.4393
 epoch: 49, train_loss: 0.9580, test_loss: 1.3886, test_f1: 0.4301
 epoch: 50, train_loss: 0.9522, test_loss: 1.3617, test_f1: 0.4318
 epoch: 51, train_loss: 0.9565, test_loss: 1.3865, test_f1: 0.4194
 epoch: 52, train_loss: 0.9358, test_loss: 1.3330, test_f1: 0.4272
 epoch: 53, train_loss: 0.9292, test_loss: 1.3634, test_f1: 0.4324
 epoch: 54, train_loss: 0.9257, test_loss: 1.4175, test_f1: 0.4389
 epoch: 55, train_loss: 0.9298, test_loss: 1.3278, test_f1: 0.4360
 epoch: 56, train_loss: 0.9248, test_loss: 1.4303, test_f1: 0.4314
 epoch: 57, train_loss: 0.9358, test_loss: 1.4368, test_f1: 0.4362
 epoch: 58, train_loss: 0.9371, test_loss: 1.4354, test_f1: 0.4327
 epoch: 59, train_loss: 0.9220, test_loss: 1.4976, test_f1: 0.4294
 epoch: 60, train_loss: 0.9278, test_loss: 1.5291, test_f1: 0.4374
 epoch: 61, train_loss: 0.9251, test_loss: 1.5117, test_f1: 0.4288
 epoch: 62, train_loss: 0.9071, test_loss: 1.4117, test_f1: 0.4367
 epoch: 63, train_loss: 0.9188, test_loss: 1.5292, test_f1: 0.4355
 epoch: 64, train_loss: 0.9198, test_loss: 1.6081, test_f1: 0.4376
 epoch: 65, train_loss: 0.9013, test_loss: 1.5672, test_f1: 0.4312
 epoch: 66, train_loss: 0.9153, test_loss: 1.5372, test_f1: 0.4385
 epoch: 67, train_loss: 0.9127, test_loss: 1.5865, test_f1: 0.4333
 epoch: 68, train_loss: 0.9036, test_loss: 1.5337, test_f1: 0.4317
 epoch: 69, train_loss: 0.8946, test_loss: 1.5310, test_f1: 0.4366
 epoch: 70, train_loss: 0.8976, test_loss: 1.5471, test_f1: 0.4367
 epoch: 71, train_loss: 0.9009, test_loss: 1.5742, test_f1: 0.4347
 epoch: 72, train_loss: 0.8949, test_loss: 1.4968, test_f1: 0.4365
 epoch: 73, train_loss: 0.8989, test_loss: 1.5370, test_f1: 0.4320
 epoch: 74, train_loss: 0.8934, test_loss: 1.6296, test_f1: 0.4302
 epoch: 75, train_loss: 0.8901, test_loss: 1.5383, test_f1: 0.4377
 epoch: 76, train_loss: 0.8947, test_loss: 1.5997, test_f1: 0.4331
 epoch: 77, train_loss: 0.8827, test_loss: 1.6568, test_f1: 0.4367
 epoch: 78, train_loss: 0.8821, test_loss: 1.6178, test_f1: 0.4326
 epoch: 79, train_loss: 0.8802, test_loss: 1.5911, test_f1: 0.4427
 epoch: 80, train_loss: 0.8841, test_loss: 1.6386, test_f1: 0.4319
 epoch: 81, train_loss: 0.8754, test_loss: 1.6508, test_f1: 0.4277
 epoch: 82, train_loss: 0.8620, test_loss: 1.5171, test_f1: 0.4347
 epoch: 83, train_loss: 0.8731, test_loss: 1.4934, test_f1: 0.4363
 epoch: 84, train_loss: 0.8639, test_loss: 1.6440, test_f1: 0.4400
 epoch: 85, train_loss: 0.8654, test_loss: 1.5935, test_f1: 0.4347
 epoch: 86, train_loss: 0.8604, test_loss: 1.4958, test_f1: 0.4300
 epoch: 87, train_loss: 0.8521, test_loss: 1.5142, test_f1: 0.4342
 epoch: 88, train_loss: 0.8667, test_loss: 1.5508, test_f1: 0.4374
 epoch: 89, train_loss: 0.8627, test_loss: 1.5763, test_f1: 0.4334
 epoch: 90, train_loss: 0.8688, test_loss: 1.4732, test_f1: 0.4332
 epoch: 91, train_loss: 0.8648, test_loss: 1.4384, test_f1: 0.4364
 epoch: 92, train_loss: 0.8567, test_loss: 1.4724, test_f1: 0.4400
 epoch: 93, train_loss: 0.8538, test_loss: 1.4391, test_f1: 0.4428
 epoch: 94, train_loss: 0.8661, test_loss: 1.4402, test_f1: 0.4324
 epoch: 95, train_loss: 0.8572, test_loss: 1.5986, test_f1: 0.4372
 epoch: 96, train_loss: 0.8530, test_loss: 1.4862, test_f1: 0.4290
 epoch: 97, train_loss: 0.8516, test_loss: 1.4810, test_f1: 0.4390
 epoch: 98, train_loss: 0.8441, test_loss: 1.4369, test_f1: 0.4384
 epoch: 99, train_loss: 0.8409, test_loss: 1.5570, test_f1: 0.4303
##################ITERATION #6 ****************************************
 epoch: 0, train_loss: 1.3097, test_loss: 1.3071, test_f1: 0.2274
 epoch: 1, train_loss: 1.2653, test_loss: 1.2892, test_f1: 0.2367
 epoch: 2, train_loss: 1.2496, test_loss: 1.2711, test_f1: 0.2537
 epoch: 3, train_loss: 1.2428, test_loss: 1.2491, test_f1: 0.3280
 epoch: 4, train_loss: 1.2331, test_loss: 1.2223, test_f1: 0.3836
 epoch: 5, train_loss: 1.2125, test_loss: 1.2042, test_f1: 0.4178
 epoch: 6, train_loss: 1.2167, test_loss: 1.1944, test_f1: 0.4099
 epoch: 7, train_loss: 1.2084, test_loss: 1.1855, test_f1: 0.4136
 epoch: 8, train_loss: 1.2005, test_loss: 1.1776, test_f1: 0.4050
 epoch: 9, train_loss: 1.1968, test_loss: 1.1714, test_f1: 0.4074
 epoch: 10, train_loss: 1.1814, test_loss: 1.1682, test_f1: 0.4078
 epoch: 11, train_loss: 1.1806, test_loss: 1.1648, test_f1: 0.4086
 epoch: 12, train_loss: 1.1682, test_loss: 1.1579, test_f1: 0.4160
 epoch: 13, train_loss: 1.1601, test_loss: 1.1503, test_f1: 0.4171
 epoch: 14, train_loss: 1.1535, test_loss: 1.1457, test_f1: 0.4346
 epoch: 15, train_loss: 1.1542, test_loss: 1.1424, test_f1: 0.4272
 epoch: 16, train_loss: 1.1474, test_loss: 1.1342, test_f1: 0.4248
 epoch: 17, train_loss: 1.1391, test_loss: 1.1273, test_f1: 0.4338
 epoch: 18, train_loss: 1.1317, test_loss: 1.1187, test_f1: 0.4484
 epoch: 19, train_loss: 1.1212, test_loss: 1.1139, test_f1: 0.4580
 epoch: 20, train_loss: 1.1160, test_loss: 1.1077, test_f1: 0.4551
 epoch: 21, train_loss: 1.1058, test_loss: 1.1043, test_f1: 0.4656
 epoch: 22, train_loss: 1.1033, test_loss: 1.1035, test_f1: 0.4581
 epoch: 23, train_loss: 1.1035, test_loss: 1.0994, test_f1: 0.4629
 epoch: 24, train_loss: 1.0979, test_loss: 1.0977, test_f1: 0.4664
 epoch: 25, train_loss: 1.0894, test_loss: 1.0922, test_f1: 0.4641
 epoch: 26, train_loss: 1.0892, test_loss: 1.0866, test_f1: 0.4664
 epoch: 27, train_loss: 1.0798, test_loss: 1.0862, test_f1: 0.4619
 epoch: 28, train_loss: 1.0680, test_loss: 1.0875, test_f1: 0.4618
 epoch: 29, train_loss: 1.0739, test_loss: 1.0892, test_f1: 0.4732
 epoch: 30, train_loss: 1.0701, test_loss: 1.0822, test_f1: 0.4677
 epoch: 31, train_loss: 1.0633, test_loss: 1.0735, test_f1: 0.4698
 epoch: 32, train_loss: 1.0598, test_loss: 1.0629, test_f1: 0.4703
 epoch: 33, train_loss: 1.0579, test_loss: 1.0632, test_f1: 0.4659
 epoch: 34, train_loss: 1.0405, test_loss: 1.0663, test_f1: 0.4662
 epoch: 35, train_loss: 1.0356, test_loss: 1.0748, test_f1: 0.4574
 epoch: 36, train_loss: 1.0299, test_loss: 1.0651, test_f1: 0.4506
 epoch: 37, train_loss: 1.0279, test_loss: 1.0623, test_f1: 0.4564
 epoch: 38, train_loss: 1.0235, test_loss: 1.0682, test_f1: 0.4545
 epoch: 39, train_loss: 1.0150, test_loss: 1.0594, test_f1: 0.4675
 epoch: 40, train_loss: 1.0147, test_loss: 1.0541, test_f1: 0.4632
 epoch: 41, train_loss: 1.0115, test_loss: 1.0571, test_f1: 0.4647
 epoch: 42, train_loss: 1.0078, test_loss: 1.0636, test_f1: 0.4723
 epoch: 43, train_loss: 1.0039, test_loss: 1.0695, test_f1: 0.4580
 epoch: 44, train_loss: 0.9918, test_loss: 1.0611, test_f1: 0.4475
 epoch: 45, train_loss: 0.9855, test_loss: 1.0583, test_f1: 0.4685
 epoch: 46, train_loss: 0.9789, test_loss: 1.0634, test_f1: 0.4510
 epoch: 47, train_loss: 0.9671, test_loss: 1.0581, test_f1: 0.4617
 epoch: 48, train_loss: 0.9760, test_loss: 1.0549, test_f1: 0.4703
 epoch: 49, train_loss: 0.9684, test_loss: 1.0730, test_f1: 0.4600
 epoch: 50, train_loss: 0.9797, test_loss: 1.0600, test_f1: 0.4619
 epoch: 51, train_loss: 0.9574, test_loss: 1.0577, test_f1: 0.4683
 epoch: 52, train_loss: 0.9571, test_loss: 1.0563, test_f1: 0.4670
 epoch: 53, train_loss: 0.9580, test_loss: 1.0471, test_f1: 0.4686
 epoch: 54, train_loss: 0.9525, test_loss: 1.0533, test_f1: 0.4732
 epoch: 55, train_loss: 0.9424, test_loss: 1.0603, test_f1: 0.4644
 epoch: 56, train_loss: 0.9339, test_loss: 1.0641, test_f1: 0.4592
 epoch: 57, train_loss: 0.9580, test_loss: 1.0590, test_f1: 0.4607
 epoch: 58, train_loss: 0.9410, test_loss: 1.0610, test_f1: 0.4627
 epoch: 59, train_loss: 0.9406, test_loss: 1.0577, test_f1: 0.4666
 epoch: 60, train_loss: 0.9329, test_loss: 1.0536, test_f1: 0.4653
 epoch: 61, train_loss: 0.9293, test_loss: 1.0579, test_f1: 0.4764
 epoch: 62, train_loss: 0.9322, test_loss: 1.0575, test_f1: 0.4715
 epoch: 63, train_loss: 0.9324, test_loss: 1.0585, test_f1: 0.4703
 epoch: 64, train_loss: 0.9255, test_loss: 1.0643, test_f1: 0.4613
 epoch: 65, train_loss: 0.9247, test_loss: 1.0636, test_f1: 0.4622
 epoch: 66, train_loss: 0.9377, test_loss: 1.0481, test_f1: 0.4673
 epoch: 67, train_loss: 0.9134, test_loss: 1.0578, test_f1: 0.4629
 epoch: 68, train_loss: 0.9168, test_loss: 1.0750, test_f1: 0.4605
 epoch: 69, train_loss: 0.9113, test_loss: 1.0547, test_f1: 0.4640
 epoch: 70, train_loss: 0.9084, test_loss: 1.0652, test_f1: 0.4689
 epoch: 71, train_loss: 0.9054, test_loss: 1.0682, test_f1: 0.4604
 epoch: 72, train_loss: 0.9060, test_loss: 1.0713, test_f1: 0.4687
 epoch: 73, train_loss: 0.8947, test_loss: 1.0716, test_f1: 0.4631
 epoch: 74, train_loss: 0.9066, test_loss: 1.0683, test_f1: 0.4698
 epoch: 75, train_loss: 0.8981, test_loss: 1.0660, test_f1: 0.4646
 epoch: 76, train_loss: 0.9027, test_loss: 1.0733, test_f1: 0.4670
 epoch: 77, train_loss: 0.8925, test_loss: 1.0750, test_f1: 0.4642
 epoch: 78, train_loss: 0.8894, test_loss: 1.0590, test_f1: 0.4669
 epoch: 79, train_loss: 0.8989, test_loss: 1.0723, test_f1: 0.4701
 epoch: 80, train_loss: 0.8864, test_loss: 1.0733, test_f1: 0.4584
 epoch: 81, train_loss: 0.8848, test_loss: 1.0853, test_f1: 0.4638
 epoch: 82, train_loss: 0.8922, test_loss: 1.0827, test_f1: 0.4584
 epoch: 83, train_loss: 0.8811, test_loss: 1.0755, test_f1: 0.4654
 epoch: 84, train_loss: 0.8732, test_loss: 1.0742, test_f1: 0.4605
 epoch: 85, train_loss: 0.8728, test_loss: 1.0741, test_f1: 0.4634
 epoch: 86, train_loss: 0.8843, test_loss: 1.0924, test_f1: 0.4599
 epoch: 87, train_loss: 0.8762, test_loss: 1.0874, test_f1: 0.4641
 epoch: 88, train_loss: 0.8717, test_loss: 1.0876, test_f1: 0.4658
 epoch: 89, train_loss: 0.8737, test_loss: 1.0779, test_f1: 0.4649
 epoch: 90, train_loss: 0.8709, test_loss: 1.0790, test_f1: 0.4626
 epoch: 91, train_loss: 0.8721, test_loss: 1.0741, test_f1: 0.4673
 epoch: 92, train_loss: 0.8762, test_loss: 1.0884, test_f1: 0.4683
 epoch: 93, train_loss: 0.8754, test_loss: 1.0716, test_f1: 0.4678
 epoch: 94, train_loss: 0.8667, test_loss: 1.0852, test_f1: 0.4760
 epoch: 95, train_loss: 0.8630, test_loss: 1.0952, test_f1: 0.4809
 epoch: 96, train_loss: 0.8634, test_loss: 1.1015, test_f1: 0.4634
 epoch: 97, train_loss: 0.8496, test_loss: 1.1162, test_f1: 0.4728
 epoch: 98, train_loss: 0.8545, test_loss: 1.0888, test_f1: 0.4781
 epoch: 99, train_loss: 0.8713, test_loss: 1.1068, test_f1: 0.4783
##################ITERATION #7 ****************************************
 epoch: 0, train_loss: 1.2996, test_loss: 1.3015, test_f1: 0.2274
 epoch: 1, train_loss: 1.2607, test_loss: 1.2851, test_f1: 0.2274
 epoch: 2, train_loss: 1.2426, test_loss: 1.2652, test_f1: 0.2636
 epoch: 3, train_loss: 1.2275, test_loss: 1.2336, test_f1: 0.3399
 epoch: 4, train_loss: 1.2192, test_loss: 1.2097, test_f1: 0.3908
 epoch: 5, train_loss: 1.2096, test_loss: 1.1940, test_f1: 0.4003
 epoch: 6, train_loss: 1.2009, test_loss: 1.1852, test_f1: 0.4088
 epoch: 7, train_loss: 1.1931, test_loss: 1.1789, test_f1: 0.4187
 epoch: 8, train_loss: 1.1816, test_loss: 1.1686, test_f1: 0.4159
 epoch: 9, train_loss: 1.1795, test_loss: 1.1631, test_f1: 0.4262
 epoch: 10, train_loss: 1.1772, test_loss: 1.1556, test_f1: 0.4319
 epoch: 11, train_loss: 1.1652, test_loss: 1.1495, test_f1: 0.4379
 epoch: 12, train_loss: 1.1556, test_loss: 1.1411, test_f1: 0.4457
 epoch: 13, train_loss: 1.1500, test_loss: 1.1340, test_f1: 0.4403
 epoch: 14, train_loss: 1.1424, test_loss: 1.1294, test_f1: 0.4298
 epoch: 15, train_loss: 1.1399, test_loss: 1.1218, test_f1: 0.4325
 epoch: 16, train_loss: 1.1376, test_loss: 1.1159, test_f1: 0.4411
 epoch: 17, train_loss: 1.1281, test_loss: 1.1120, test_f1: 0.4435
 epoch: 18, train_loss: 1.1276, test_loss: 1.1064, test_f1: 0.4466
 epoch: 19, train_loss: 1.1231, test_loss: 1.1020, test_f1: 0.4489
 epoch: 20, train_loss: 1.1100, test_loss: 1.0925, test_f1: 0.4556
 epoch: 21, train_loss: 1.1060, test_loss: 1.0910, test_f1: 0.4567
 epoch: 22, train_loss: 1.0997, test_loss: 1.0897, test_f1: 0.4493
 epoch: 23, train_loss: 1.0962, test_loss: 1.0834, test_f1: 0.4501
 epoch: 24, train_loss: 1.0922, test_loss: 1.0825, test_f1: 0.4468
 epoch: 25, train_loss: 1.0801, test_loss: 1.0751, test_f1: 0.4388
 epoch: 26, train_loss: 1.0681, test_loss: 1.0738, test_f1: 0.4503
 epoch: 27, train_loss: 1.0683, test_loss: 1.0760, test_f1: 0.4490
 epoch: 28, train_loss: 1.0598, test_loss: 1.0646, test_f1: 0.4400
 epoch: 29, train_loss: 1.0474, test_loss: 1.0682, test_f1: 0.4539
 epoch: 30, train_loss: 1.0489, test_loss: 1.0605, test_f1: 0.4455
 epoch: 31, train_loss: 1.0477, test_loss: 1.0556, test_f1: 0.4500
 epoch: 32, train_loss: 1.0312, test_loss: 1.0577, test_f1: 0.4554
 epoch: 33, train_loss: 1.0271, test_loss: 1.0556, test_f1: 0.4503
 epoch: 34, train_loss: 1.0281, test_loss: 1.0476, test_f1: 0.4527
 epoch: 35, train_loss: 1.0237, test_loss: 1.0546, test_f1: 0.4457
 epoch: 36, train_loss: 1.0171, test_loss: 1.0470, test_f1: 0.4452
 epoch: 37, train_loss: 1.0155, test_loss: 1.0554, test_f1: 0.4560
 epoch: 38, train_loss: 0.9977, test_loss: 1.0443, test_f1: 0.4569
 epoch: 39, train_loss: 0.9911, test_loss: 1.0527, test_f1: 0.4512
 epoch: 40, train_loss: 0.9973, test_loss: 1.0436, test_f1: 0.4645
 epoch: 41, train_loss: 0.9916, test_loss: 1.0592, test_f1: 0.4400
 epoch: 42, train_loss: 0.9879, test_loss: 1.0551, test_f1: 0.4569
 epoch: 43, train_loss: 0.9853, test_loss: 1.0466, test_f1: 0.4647
 epoch: 44, train_loss: 0.9848, test_loss: 1.0569, test_f1: 0.4577
 epoch: 45, train_loss: 0.9738, test_loss: 1.0497, test_f1: 0.4515
 epoch: 46, train_loss: 0.9668, test_loss: 1.0614, test_f1: 0.4556
 epoch: 47, train_loss: 0.9747, test_loss: 1.0677, test_f1: 0.4516
 epoch: 48, train_loss: 0.9674, test_loss: 1.0719, test_f1: 0.4584
 epoch: 49, train_loss: 0.9576, test_loss: 1.0644, test_f1: 0.4625
 epoch: 50, train_loss: 0.9483, test_loss: 1.0599, test_f1: 0.4561
 epoch: 51, train_loss: 0.9417, test_loss: 1.0649, test_f1: 0.4579
 epoch: 52, train_loss: 0.9461, test_loss: 1.0606, test_f1: 0.4592
 epoch: 53, train_loss: 0.9488, test_loss: 1.0674, test_f1: 0.4460
 epoch: 54, train_loss: 0.9351, test_loss: 1.0686, test_f1: 0.4603
 epoch: 55, train_loss: 0.9428, test_loss: 1.0733, test_f1: 0.4648
 epoch: 56, train_loss: 0.9359, test_loss: 1.0788, test_f1: 0.4600
 epoch: 57, train_loss: 0.9355, test_loss: 1.0717, test_f1: 0.4656
 epoch: 58, train_loss: 0.9316, test_loss: 1.0753, test_f1: 0.4658
 epoch: 59, train_loss: 0.9318, test_loss: 1.0766, test_f1: 0.4620
 epoch: 60, train_loss: 0.9214, test_loss: 1.0866, test_f1: 0.4630
 epoch: 61, train_loss: 0.9172, test_loss: 1.0773, test_f1: 0.4604
 epoch: 62, train_loss: 0.9311, test_loss: 1.0748, test_f1: 0.4611
 epoch: 63, train_loss: 0.9266, test_loss: 1.0897, test_f1: 0.4587
 epoch: 64, train_loss: 0.9268, test_loss: 1.0765, test_f1: 0.4658
 epoch: 65, train_loss: 0.9064, test_loss: 1.0797, test_f1: 0.4744
 epoch: 66, train_loss: 0.9077, test_loss: 1.0860, test_f1: 0.4490
 epoch: 67, train_loss: 0.9047, test_loss: 1.0826, test_f1: 0.4535
 epoch: 68, train_loss: 0.9053, test_loss: 1.0881, test_f1: 0.4542
 epoch: 69, train_loss: 0.9040, test_loss: 1.0936, test_f1: 0.4501
 epoch: 70, train_loss: 0.9148, test_loss: 1.0882, test_f1: 0.4443
 epoch: 71, train_loss: 0.8914, test_loss: 1.0963, test_f1: 0.4503
 epoch: 72, train_loss: 0.8906, test_loss: 1.0966, test_f1: 0.4590
 epoch: 73, train_loss: 0.8921, test_loss: 1.1019, test_f1: 0.4555
 epoch: 74, train_loss: 0.8916, test_loss: 1.1070, test_f1: 0.4425
 epoch: 75, train_loss: 0.8876, test_loss: 1.0924, test_f1: 0.4631
 epoch: 76, train_loss: 0.8860, test_loss: 1.1021, test_f1: 0.4626
 epoch: 77, train_loss: 0.8938, test_loss: 1.1027, test_f1: 0.4550
 epoch: 78, train_loss: 0.8876, test_loss: 1.1114, test_f1: 0.4553
 epoch: 79, train_loss: 0.8876, test_loss: 1.1126, test_f1: 0.4566
 epoch: 80, train_loss: 0.8890, test_loss: 1.1108, test_f1: 0.4454
 epoch: 81, train_loss: 0.8752, test_loss: 1.1164, test_f1: 0.4535
 epoch: 82, train_loss: 0.8786, test_loss: 1.1314, test_f1: 0.4453
 epoch: 83, train_loss: 0.8737, test_loss: 1.1223, test_f1: 0.4507
 epoch: 84, train_loss: 0.8774, test_loss: 1.1186, test_f1: 0.4572
 epoch: 85, train_loss: 0.8728, test_loss: 1.1203, test_f1: 0.4578
 epoch: 86, train_loss: 0.8761, test_loss: 1.1041, test_f1: 0.4557
 epoch: 87, train_loss: 0.8844, test_loss: 1.1198, test_f1: 0.4654
 epoch: 88, train_loss: 0.8677, test_loss: 1.1204, test_f1: 0.4594
 epoch: 89, train_loss: 0.8694, test_loss: 1.1110, test_f1: 0.4561
 epoch: 90, train_loss: 0.8607, test_loss: 1.1235, test_f1: 0.4553
 epoch: 91, train_loss: 0.8693, test_loss: 1.1283, test_f1: 0.4552
 epoch: 92, train_loss: 0.8635, test_loss: 1.1280, test_f1: 0.4580
 epoch: 93, train_loss: 0.8610, test_loss: 1.1267, test_f1: 0.4651
 epoch: 94, train_loss: 0.8614, test_loss: 1.1213, test_f1: 0.4598
 epoch: 95, train_loss: 0.8727, test_loss: 1.1261, test_f1: 0.4579
 epoch: 96, train_loss: 0.8543, test_loss: 1.1210, test_f1: 0.4653
 epoch: 97, train_loss: 0.8588, test_loss: 1.1196, test_f1: 0.4619
 epoch: 98, train_loss: 0.8666, test_loss: 1.1197, test_f1: 0.4568
 epoch: 99, train_loss: 0.8522, test_loss: 1.1213, test_f1: 0.4634
##################ITERATION #8 ****************************************
 epoch: 0, train_loss: 1.3758, test_loss: 1.3510, test_f1: 0.2246
 epoch: 1, train_loss: 1.3019, test_loss: 1.3031, test_f1: 0.2274
 epoch: 2, train_loss: 1.2823, test_loss: 1.2729, test_f1: 0.2517
 epoch: 3, train_loss: 1.2669, test_loss: 1.2431, test_f1: 0.3382
 epoch: 4, train_loss: 1.2439, test_loss: 1.2162, test_f1: 0.3536
 epoch: 5, train_loss: 1.2320, test_loss: 1.1948, test_f1: 0.3832
 epoch: 6, train_loss: 1.2211, test_loss: 1.1799, test_f1: 0.3853
 epoch: 7, train_loss: 1.2069, test_loss: 1.1668, test_f1: 0.3962
 epoch: 8, train_loss: 1.2058, test_loss: 1.1586, test_f1: 0.4004
 epoch: 9, train_loss: 1.1871, test_loss: 1.1511, test_f1: 0.4011
 epoch: 10, train_loss: 1.1832, test_loss: 1.1443, test_f1: 0.3982
 epoch: 11, train_loss: 1.1840, test_loss: 1.1382, test_f1: 0.4128
 epoch: 12, train_loss: 1.1714, test_loss: 1.1318, test_f1: 0.4199
 epoch: 13, train_loss: 1.1688, test_loss: 1.1265, test_f1: 0.4277
 epoch: 14, train_loss: 1.1562, test_loss: 1.1218, test_f1: 0.4236
 epoch: 15, train_loss: 1.1483, test_loss: 1.1159, test_f1: 0.4260
 epoch: 16, train_loss: 1.1424, test_loss: 1.1124, test_f1: 0.4311
 epoch: 17, train_loss: 1.1422, test_loss: 1.1039, test_f1: 0.4341
 epoch: 18, train_loss: 1.1347, test_loss: 1.0986, test_f1: 0.4330
 epoch: 19, train_loss: 1.1273, test_loss: 1.0938, test_f1: 0.4331
 epoch: 20, train_loss: 1.1086, test_loss: 1.0921, test_f1: 0.4319
 epoch: 21, train_loss: 1.1125, test_loss: 1.0863, test_f1: 0.4370
 epoch: 22, train_loss: 1.1164, test_loss: 1.0825, test_f1: 0.4472
 epoch: 23, train_loss: 1.1105, test_loss: 1.0795, test_f1: 0.4456
 epoch: 24, train_loss: 1.0997, test_loss: 1.0710, test_f1: 0.4502
 epoch: 25, train_loss: 1.0947, test_loss: 1.0688, test_f1: 0.4409
 epoch: 26, train_loss: 1.0851, test_loss: 1.0675, test_f1: 0.4513
 epoch: 27, train_loss: 1.0862, test_loss: 1.0628, test_f1: 0.4576
 epoch: 28, train_loss: 1.0794, test_loss: 1.0551, test_f1: 0.4527
 epoch: 29, train_loss: 1.0660, test_loss: 1.0459, test_f1: 0.4511
 epoch: 30, train_loss: 1.0675, test_loss: 1.0443, test_f1: 0.4683
 epoch: 31, train_loss: 1.0557, test_loss: 1.0406, test_f1: 0.4706
 epoch: 32, train_loss: 1.0586, test_loss: 1.0330, test_f1: 0.4749
 epoch: 33, train_loss: 1.0481, test_loss: 1.0200, test_f1: 0.4711
 epoch: 34, train_loss: 1.0403, test_loss: 1.0151, test_f1: 0.4687
 epoch: 35, train_loss: 1.0432, test_loss: 1.0166, test_f1: 0.4803
 epoch: 36, train_loss: 1.0270, test_loss: 1.0173, test_f1: 0.4836
 epoch: 37, train_loss: 1.0278, test_loss: 1.0153, test_f1: 0.4796
 epoch: 38, train_loss: 1.0226, test_loss: 1.0139, test_f1: 0.4822
 epoch: 39, train_loss: 1.0140, test_loss: 1.0075, test_f1: 0.4750
 epoch: 40, train_loss: 1.0107, test_loss: 1.0077, test_f1: 0.4775
 epoch: 41, train_loss: 0.9994, test_loss: 1.0034, test_f1: 0.4810
 epoch: 42, train_loss: 0.9927, test_loss: 0.9985, test_f1: 0.4910
 epoch: 43, train_loss: 1.0020, test_loss: 1.0050, test_f1: 0.4774
 epoch: 44, train_loss: 0.9980, test_loss: 1.0007, test_f1: 0.4846
 epoch: 45, train_loss: 0.9892, test_loss: 0.9834, test_f1: 0.4883
 epoch: 46, train_loss: 0.9782, test_loss: 0.9790, test_f1: 0.4917
 epoch: 47, train_loss: 0.9772, test_loss: 0.9811, test_f1: 0.4957
 epoch: 48, train_loss: 0.9693, test_loss: 0.9911, test_f1: 0.4794
 epoch: 49, train_loss: 0.9711, test_loss: 0.9802, test_f1: 0.4931
 epoch: 50, train_loss: 0.9583, test_loss: 0.9800, test_f1: 0.4832
 epoch: 51, train_loss: 0.9472, test_loss: 0.9786, test_f1: 0.4877
 epoch: 52, train_loss: 0.9551, test_loss: 0.9766, test_f1: 0.4867
 epoch: 53, train_loss: 0.9470, test_loss: 0.9766, test_f1: 0.4732
 epoch: 54, train_loss: 0.9448, test_loss: 0.9774, test_f1: 0.4723
 epoch: 55, train_loss: 0.9396, test_loss: 0.9769, test_f1: 0.4876
 epoch: 56, train_loss: 0.9398, test_loss: 0.9809, test_f1: 0.4756
 epoch: 57, train_loss: 0.9308, test_loss: 0.9784, test_f1: 0.4883
 epoch: 58, train_loss: 0.9438, test_loss: 0.9805, test_f1: 0.4784
 epoch: 59, train_loss: 0.9381, test_loss: 0.9866, test_f1: 0.4703
 epoch: 60, train_loss: 0.9193, test_loss: 0.9907, test_f1: 0.4816
 epoch: 61, train_loss: 0.9182, test_loss: 0.9834, test_f1: 0.4681
 epoch: 62, train_loss: 0.9252, test_loss: 0.9812, test_f1: 0.4742
 epoch: 63, train_loss: 0.9255, test_loss: 0.9933, test_f1: 0.4699
 epoch: 64, train_loss: 0.9202, test_loss: 0.9844, test_f1: 0.4814
 epoch: 65, train_loss: 0.9172, test_loss: 0.9895, test_f1: 0.4831
 epoch: 66, train_loss: 0.9221, test_loss: 0.9873, test_f1: 0.4778
 epoch: 67, train_loss: 0.9159, test_loss: 0.9913, test_f1: 0.4754
 epoch: 68, train_loss: 0.9147, test_loss: 0.9887, test_f1: 0.4754
 epoch: 69, train_loss: 0.9095, test_loss: 0.9789, test_f1: 0.4817
 epoch: 70, train_loss: 0.8979, test_loss: 0.9878, test_f1: 0.4726
 epoch: 71, train_loss: 0.9038, test_loss: 0.9875, test_f1: 0.4718
 epoch: 72, train_loss: 0.9055, test_loss: 0.9910, test_f1: 0.4837
 epoch: 73, train_loss: 0.8926, test_loss: 0.9918, test_f1: 0.4652
 epoch: 74, train_loss: 0.8983, test_loss: 0.9847, test_f1: 0.4671
 epoch: 75, train_loss: 0.8828, test_loss: 0.9837, test_f1: 0.4830
 epoch: 76, train_loss: 0.9045, test_loss: 0.9840, test_f1: 0.4794
 epoch: 77, train_loss: 0.8826, test_loss: 0.9966, test_f1: 0.4683
 epoch: 78, train_loss: 0.8908, test_loss: 0.9932, test_f1: 0.4746
 epoch: 79, train_loss: 0.8911, test_loss: 0.9965, test_f1: 0.4721
 epoch: 80, train_loss: 0.8809, test_loss: 0.9965, test_f1: 0.4747
 epoch: 81, train_loss: 0.8719, test_loss: 1.0003, test_f1: 0.4696
 epoch: 82, train_loss: 0.8699, test_loss: 0.9985, test_f1: 0.4670
 epoch: 83, train_loss: 0.8851, test_loss: 1.0108, test_f1: 0.4552
 epoch: 84, train_loss: 0.8790, test_loss: 1.0020, test_f1: 0.4622
 epoch: 85, train_loss: 0.8854, test_loss: 1.0029, test_f1: 0.4699
 epoch: 86, train_loss: 0.8627, test_loss: 1.0049, test_f1: 0.4786
 epoch: 87, train_loss: 0.8664, test_loss: 1.0000, test_f1: 0.4849
 epoch: 88, train_loss: 0.8562, test_loss: 1.0057, test_f1: 0.4821
 epoch: 89, train_loss: 0.8599, test_loss: 0.9922, test_f1: 0.4890
 epoch: 90, train_loss: 0.8706, test_loss: 1.0135, test_f1: 0.4807
 epoch: 91, train_loss: 0.8604, test_loss: 1.0223, test_f1: 0.4906
 epoch: 92, train_loss: 0.8621, test_loss: 1.0180, test_f1: 0.4890
 epoch: 93, train_loss: 0.8633, test_loss: 1.0115, test_f1: 0.4946
 epoch: 94, train_loss: 0.8547, test_loss: 1.0137, test_f1: 0.4873
 epoch: 95, train_loss: 0.8522, test_loss: 1.0109, test_f1: 0.4712
 epoch: 96, train_loss: 0.8531, test_loss: 1.0036, test_f1: 0.4725
 epoch: 97, train_loss: 0.8585, test_loss: 1.0076, test_f1: 0.4825
 epoch: 98, train_loss: 0.8499, test_loss: 1.0071, test_f1: 0.4800
 epoch: 99, train_loss: 0.8450, test_loss: 1.0071, test_f1: 0.4745
##################ITERATION #9 ****************************************
 epoch: 0, train_loss: 1.3427, test_loss: 1.3166, test_f1: 0.2274
 epoch: 1, train_loss: 1.2873, test_loss: 1.2982, test_f1: 0.2274
 epoch: 2, train_loss: 1.2649, test_loss: 1.2692, test_f1: 0.2580
 epoch: 3, train_loss: 1.2446, test_loss: 1.2381, test_f1: 0.2795
 epoch: 4, train_loss: 1.2288, test_loss: 1.2168, test_f1: 0.3247
 epoch: 5, train_loss: 1.2267, test_loss: 1.1973, test_f1: 0.3843
 epoch: 6, train_loss: 1.2066, test_loss: 1.1839, test_f1: 0.4006
 epoch: 7, train_loss: 1.1961, test_loss: 1.1753, test_f1: 0.3955
 epoch: 8, train_loss: 1.1850, test_loss: 1.1667, test_f1: 0.4103
 epoch: 9, train_loss: 1.1793, test_loss: 1.1576, test_f1: 0.4179
 epoch: 10, train_loss: 1.1708, test_loss: 1.1456, test_f1: 0.4194
 epoch: 11, train_loss: 1.1675, test_loss: 1.1381, test_f1: 0.4227
 epoch: 12, train_loss: 1.1573, test_loss: 1.1392, test_f1: 0.4303
 epoch: 13, train_loss: 1.1475, test_loss: 1.1347, test_f1: 0.4298
 epoch: 14, train_loss: 1.1386, test_loss: 1.1227, test_f1: 0.4418
 epoch: 15, train_loss: 1.1288, test_loss: 1.1137, test_f1: 0.4361
 epoch: 16, train_loss: 1.1298, test_loss: 1.1129, test_f1: 0.4367
 epoch: 17, train_loss: 1.1172, test_loss: 1.1050, test_f1: 0.4510
 epoch: 18, train_loss: 1.1209, test_loss: 1.0988, test_f1: 0.4334
 epoch: 19, train_loss: 1.1049, test_loss: 1.0946, test_f1: 0.4506
 epoch: 20, train_loss: 1.1020, test_loss: 1.0942, test_f1: 0.4488
 epoch: 21, train_loss: 1.0885, test_loss: 1.0906, test_f1: 0.4546
 epoch: 22, train_loss: 1.0844, test_loss: 1.0825, test_f1: 0.4529
 epoch: 23, train_loss: 1.0820, test_loss: 1.0765, test_f1: 0.4522
 epoch: 24, train_loss: 1.0703, test_loss: 1.0743, test_f1: 0.4613
 epoch: 25, train_loss: 1.0654, test_loss: 1.0683, test_f1: 0.4561
 epoch: 26, train_loss: 1.0525, test_loss: 1.0593, test_f1: 0.4589
 epoch: 27, train_loss: 1.0543, test_loss: 1.0479, test_f1: 0.4599
 epoch: 28, train_loss: 1.0441, test_loss: 1.0514, test_f1: 0.4575
 epoch: 29, train_loss: 1.0303, test_loss: 1.0425, test_f1: 0.4602
 epoch: 30, train_loss: 1.0377, test_loss: 1.0432, test_f1: 0.4698
 epoch: 31, train_loss: 1.0378, test_loss: 1.0432, test_f1: 0.4612
 epoch: 32, train_loss: 1.0399, test_loss: 1.0461, test_f1: 0.4678
 epoch: 33, train_loss: 1.0234, test_loss: 1.0503, test_f1: 0.4591
 epoch: 34, train_loss: 1.0215, test_loss: 1.0311, test_f1: 0.4730
 epoch: 35, train_loss: 1.0092, test_loss: 1.0356, test_f1: 0.4749
 epoch: 36, train_loss: 1.0018, test_loss: 1.0364, test_f1: 0.4680
 epoch: 37, train_loss: 0.9932, test_loss: 1.0294, test_f1: 0.4708
 epoch: 38, train_loss: 0.9858, test_loss: 1.0269, test_f1: 0.4712
 epoch: 39, train_loss: 0.9806, test_loss: 1.0307, test_f1: 0.4676
 epoch: 40, train_loss: 0.9808, test_loss: 1.0348, test_f1: 0.4689
 epoch: 41, train_loss: 0.9744, test_loss: 1.0423, test_f1: 0.4695
 epoch: 42, train_loss: 0.9727, test_loss: 1.0465, test_f1: 0.4580
 epoch: 43, train_loss: 0.9676, test_loss: 1.0457, test_f1: 0.4540
 epoch: 44, train_loss: 0.9635, test_loss: 1.0525, test_f1: 0.4691
 epoch: 45, train_loss: 0.9606, test_loss: 1.0552, test_f1: 0.4549
 epoch: 46, train_loss: 0.9632, test_loss: 1.0485, test_f1: 0.4698
 epoch: 47, train_loss: 0.9377, test_loss: 1.0403, test_f1: 0.4624
 epoch: 48, train_loss: 0.9483, test_loss: 1.0402, test_f1: 0.4650
 epoch: 49, train_loss: 0.9445, test_loss: 1.0461, test_f1: 0.4694
 epoch: 50, train_loss: 0.9510, test_loss: 1.0452, test_f1: 0.4490
 epoch: 51, train_loss: 0.9297, test_loss: 1.0551, test_f1: 0.4573
 epoch: 52, train_loss: 0.9249, test_loss: 1.0377, test_f1: 0.4593
 epoch: 53, train_loss: 0.9172, test_loss: 1.0552, test_f1: 0.4575
 epoch: 54, train_loss: 0.9218, test_loss: 1.0453, test_f1: 0.4519
 epoch: 55, train_loss: 0.9245, test_loss: 1.0573, test_f1: 0.4457
 epoch: 56, train_loss: 0.9159, test_loss: 1.0397, test_f1: 0.4515
 epoch: 57, train_loss: 0.9044, test_loss: 1.0574, test_f1: 0.4492
 epoch: 58, train_loss: 0.9020, test_loss: 1.0643, test_f1: 0.4487
 epoch: 59, train_loss: 0.9074, test_loss: 1.0557, test_f1: 0.4541
 epoch: 60, train_loss: 0.8966, test_loss: 1.0641, test_f1: 0.4568
 epoch: 61, train_loss: 0.9009, test_loss: 1.0602, test_f1: 0.4500
 epoch: 62, train_loss: 0.9033, test_loss: 1.0584, test_f1: 0.4596
 epoch: 63, train_loss: 0.9012, test_loss: 1.0628, test_f1: 0.4570
 epoch: 64, train_loss: 0.8897, test_loss: 1.0720, test_f1: 0.4509
 epoch: 65, train_loss: 0.8891, test_loss: 1.0696, test_f1: 0.4592
 epoch: 66, train_loss: 0.8806, test_loss: 1.0775, test_f1: 0.4639
 epoch: 67, train_loss: 0.8970, test_loss: 1.0718, test_f1: 0.4506
 epoch: 68, train_loss: 0.8798, test_loss: 1.0911, test_f1: 0.4532
 epoch: 69, train_loss: 0.8927, test_loss: 1.0741, test_f1: 0.4553
 epoch: 70, train_loss: 0.8889, test_loss: 1.0807, test_f1: 0.4715
 epoch: 71, train_loss: 0.8855, test_loss: 1.0563, test_f1: 0.4659
 epoch: 72, train_loss: 0.8886, test_loss: 1.0622, test_f1: 0.4662
 epoch: 73, train_loss: 0.8686, test_loss: 1.0536, test_f1: 0.4752
 epoch: 74, train_loss: 0.8729, test_loss: 1.0735, test_f1: 0.4629
 epoch: 75, train_loss: 0.8648, test_loss: 1.0743, test_f1: 0.4643
 epoch: 76, train_loss: 0.8659, test_loss: 1.0812, test_f1: 0.4637
 epoch: 77, train_loss: 0.8640, test_loss: 1.0775, test_f1: 0.4569
 epoch: 78, train_loss: 0.8738, test_loss: 1.0718, test_f1: 0.4552
 epoch: 79, train_loss: 0.8737, test_loss: 1.0762, test_f1: 0.4586
 epoch: 80, train_loss: 0.8711, test_loss: 1.0820, test_f1: 0.4465
 epoch: 81, train_loss: 0.8761, test_loss: 1.0874, test_f1: 0.4474
 epoch: 82, train_loss: 0.8551, test_loss: 1.0875, test_f1: 0.4489
 epoch: 83, train_loss: 0.8405, test_loss: 1.0855, test_f1: 0.4562
 epoch: 84, train_loss: 0.8514, test_loss: 1.0719, test_f1: 0.4569
 epoch: 85, train_loss: 0.8373, test_loss: 1.0664, test_f1: 0.4630
 epoch: 86, train_loss: 0.8477, test_loss: 1.0711, test_f1: 0.4617
 epoch: 87, train_loss: 0.8448, test_loss: 1.0819, test_f1: 0.4534
 epoch: 88, train_loss: 0.8482, test_loss: 1.0812, test_f1: 0.4566
 epoch: 89, train_loss: 0.8476, test_loss: 1.0868, test_f1: 0.4642
 epoch: 90, train_loss: 0.8422, test_loss: 1.0838, test_f1: 0.4608
 epoch: 91, train_loss: 0.8297, test_loss: 1.0964, test_f1: 0.4506
 epoch: 92, train_loss: 0.8480, test_loss: 1.0865, test_f1: 0.4483
 epoch: 93, train_loss: 0.8312, test_loss: 1.0900, test_f1: 0.4525
 epoch: 94, train_loss: 0.8300, test_loss: 1.0969, test_f1: 0.4557
 epoch: 95, train_loss: 0.8452, test_loss: 1.1018, test_f1: 0.4546
 epoch: 96, train_loss: 0.8187, test_loss: 1.0950, test_f1: 0.4495
 epoch: 97, train_loss: 0.8330, test_loss: 1.0915, test_f1: 0.4493
 epoch: 98, train_loss: 0.8327, test_loss: 1.1077, test_f1: 0.4486
 epoch: 99, train_loss: 0.8382, test_loss: 1.0948, test_f1: 0.4595

Training completed in 421.31 seconds
Best F1: 0.4957 at epoch 47
Mean F1 across iterations: 0.4785  0.0118
========================FINAL RESULTS================================
FEGIN weighted F1: 0.4957  0.0118
python main.py --data ltspice_examples --representation component_component --model FEGIN --layers 6 --hiddens 64 --batch_size 256 --lr 0.0001 --emb_size 250 --epochs 100 --save_appendix component_component_L6_H64_BS256_LR0.0001_E250 --no_val
-----



STDERR:
  File "main.py", line 370, in <module>
    main()
  File "main.py", line 254, in main
    dataset = dataset_class(
  File "/home/philip/projects/ltspice_examples_code_repo/Circuit-Completion-Using-GNNs/component_classification_with_link_prediction_head/evaluation/FEGIN/kernel/circuit_datasets.py", line 15, in __init__
    self.data, self.slices = torch.load(self.processed_paths[0])
  File "/home/philip/.local/lib/python3.8/site-packages/torch/serialization.py", line 1040, in load
    warnings.warn(
  File "/usr/lib/python3.8/warnings.py", line 109, in _showwarnmsg
    sw(msg.message, msg.category, msg.filename, msg.lineno,
  File "main.py", line 47, in warn_with_traceback
    traceback.print_stack(file=log)
/home/philip/projects/ltspice_examples_code_repo/Circuit-Completion-Using-GNNs/component_classification_with_link_prediction_head/evaluation/FEGIN/kernel/circuit_datasets.py:15: FutureWarning: You are using `torch.load` with `weights_only=False` (the current default value), which uses the default pickle module implicitly. It is possible to construct malicious pickle data which will execute arbitrary code during unpickling (See https://github.com/pytorch/pytorch/blob/main/SECURITY.md#untrusted-models for more details). In a future release, the default value for `weights_only` will be flipped to `True`. This limits the functions that could be executed during unpickling. Arbitrary objects will no longer be allowed to be loaded via this mode unless they are explicitly allowlisted by the user via `torch.serialization.add_safe_globals`. We recommend you start setting `weights_only=True` for any use case where you don't have full control of the loaded file. Please open an issue on GitHub for any issues related to this experimental feature.
  self.data, self.slices = torch.load(self.processed_paths[0])
