STDOUT:
Results will be saved in /home/philip/projects/ltspice_examples_code_repo/Circuit-Completion-Using-GNNs/component_classification_with_link_prediction_head/evaluation/FEGIN/results/model_FEGIN_dataset_ltspice_demos
Command line input: python main.py --data ltspice_demos --representation component_component --model FEGIN --layers 2 --hiddens 64 --batch_size 32 --lr 0.01 --emb_size 512 --epochs 100 --save_appendix component_component_L2_H64_BS32_LR0.01_E512 --no_val
 is saved.
-----
ltspice_demos - FEGIN
Using 2 layers, 64 hidden units, h = 2
Loading component_component representation dataset
ENTERED
Training FEGIN on component_component representation
Train: 1565, Test: 383
##################ITERATION #0 ****************************************
 epoch: 0, train_loss: 1.2330, test_loss: 1.3346, test_f1: 0.2821
 epoch: 1, train_loss: 1.0916, test_loss: 1.3349, test_f1: 0.3864
 epoch: 2, train_loss: 1.0164, test_loss: 1.0601, test_f1: 0.3994
 epoch: 3, train_loss: 0.9996, test_loss: 1.1977, test_f1: 0.3757
 epoch: 4, train_loss: 0.9821, test_loss: 1.3051, test_f1: 0.4543
 epoch: 5, train_loss: 0.9370, test_loss: 0.9775, test_f1: 0.5527
 epoch: 6, train_loss: 0.8952, test_loss: 1.0388, test_f1: 0.5306
 epoch: 7, train_loss: 0.8938, test_loss: 1.2654, test_f1: 0.4587
 epoch: 8, train_loss: 0.8756, test_loss: 1.0415, test_f1: 0.4385
 epoch: 9, train_loss: 0.8827, test_loss: 1.2106, test_f1: 0.3520
 epoch: 10, train_loss: 0.8751, test_loss: 1.2430, test_f1: 0.5183
 epoch: 11, train_loss: 0.8792, test_loss: 1.0393, test_f1: 0.5732
 epoch: 12, train_loss: 0.8417, test_loss: 1.0632, test_f1: 0.5130
 epoch: 13, train_loss: 0.8721, test_loss: 1.0769, test_f1: 0.5434
 epoch: 14, train_loss: 0.8381, test_loss: 1.0095, test_f1: 0.4377
 epoch: 15, train_loss: 0.8453, test_loss: 1.2641, test_f1: 0.5115
 epoch: 16, train_loss: 0.8302, test_loss: 1.0198, test_f1: 0.5427
 epoch: 17, train_loss: 0.8175, test_loss: 1.0495, test_f1: 0.5524
 epoch: 18, train_loss: 0.8462, test_loss: 0.9875, test_f1: 0.5699
 epoch: 19, train_loss: 0.8104, test_loss: 1.0591, test_f1: 0.4451
 epoch: 20, train_loss: 0.8356, test_loss: 1.0064, test_f1: 0.5379
 epoch: 21, train_loss: 0.8074, test_loss: 1.0665, test_f1: 0.6189
 epoch: 22, train_loss: 0.8270, test_loss: 1.0830, test_f1: 0.5783
 epoch: 23, train_loss: 0.8119, test_loss: 1.1252, test_f1: 0.5297
 epoch: 24, train_loss: 0.8427, test_loss: 1.1403, test_f1: 0.5538
 epoch: 25, train_loss: 0.8166, test_loss: 1.0839, test_f1: 0.5240
 epoch: 26, train_loss: 0.7964, test_loss: 1.0527, test_f1: 0.5979
 epoch: 27, train_loss: 0.8059, test_loss: 0.9970, test_f1: 0.6099
 epoch: 28, train_loss: 0.7807, test_loss: 1.1830, test_f1: 0.5841
 epoch: 29, train_loss: 0.7629, test_loss: 1.1605, test_f1: 0.6114
 epoch: 30, train_loss: 0.7699, test_loss: 1.1068, test_f1: 0.5084
 epoch: 31, train_loss: 0.7978, test_loss: 1.5808, test_f1: 0.5203
 epoch: 32, train_loss: 0.7793, test_loss: 1.1769, test_f1: 0.4754
 epoch: 33, train_loss: 0.7883, test_loss: 1.3373, test_f1: 0.4970
 epoch: 34, train_loss: 0.7528, test_loss: 1.1185, test_f1: 0.5915
 epoch: 35, train_loss: 0.7529, test_loss: 1.0764, test_f1: 0.5947
 epoch: 36, train_loss: 0.7431, test_loss: 1.1869, test_f1: 0.5761
 epoch: 37, train_loss: 0.7448, test_loss: 1.1818, test_f1: 0.6497
 epoch: 38, train_loss: 0.7488, test_loss: 1.2361, test_f1: 0.5935
 epoch: 39, train_loss: 0.7434, test_loss: 1.1858, test_f1: 0.5362
 epoch: 40, train_loss: 0.7478, test_loss: 1.0858, test_f1: 0.5739
 epoch: 41, train_loss: 0.7087, test_loss: 1.0433, test_f1: 0.5892
 epoch: 42, train_loss: 0.7453, test_loss: 1.2091, test_f1: 0.6367
 epoch: 43, train_loss: 0.7465, test_loss: 1.1014, test_f1: 0.5990
 epoch: 44, train_loss: 0.7257, test_loss: 1.2019, test_f1: 0.6403
 epoch: 45, train_loss: 0.6969, test_loss: 1.3958, test_f1: 0.5497
 epoch: 46, train_loss: 0.7022, test_loss: 1.3567, test_f1: 0.5262
 epoch: 47, train_loss: 0.7007, test_loss: 1.1424, test_f1: 0.6324
 epoch: 48, train_loss: 0.7180, test_loss: 1.3406, test_f1: 0.5595
 epoch: 49, train_loss: 0.7060, test_loss: 1.6147, test_f1: 0.5651
 epoch: 50, train_loss: 0.7214, test_loss: 1.2408, test_f1: 0.5813
 epoch: 51, train_loss: 0.6826, test_loss: 1.4066, test_f1: 0.5427
 epoch: 52, train_loss: 0.6340, test_loss: 1.3406, test_f1: 0.5924
 epoch: 53, train_loss: 0.6277, test_loss: 1.4766, test_f1: 0.5894
 epoch: 54, train_loss: 0.6112, test_loss: 1.4989, test_f1: 0.5337
 epoch: 55, train_loss: 0.6135, test_loss: 1.5111, test_f1: 0.5851
 epoch: 56, train_loss: 0.6282, test_loss: 1.3293, test_f1: 0.6244
 epoch: 57, train_loss: 0.5877, test_loss: 1.3762, test_f1: 0.6222
 epoch: 58, train_loss: 0.6028, test_loss: 1.4942, test_f1: 0.5355
 epoch: 59, train_loss: 0.6235, test_loss: 1.6953, test_f1: 0.5245
 epoch: 60, train_loss: 0.6047, test_loss: 1.3221, test_f1: 0.6064
 epoch: 61, train_loss: 0.6155, test_loss: 1.4416, test_f1: 0.5971
 epoch: 62, train_loss: 0.5869, test_loss: 1.3829, test_f1: 0.6060
 epoch: 63, train_loss: 0.5809, test_loss: 1.4749, test_f1: 0.5712
 epoch: 64, train_loss: 0.5606, test_loss: 1.5405, test_f1: 0.5756
 epoch: 65, train_loss: 0.6218, test_loss: 1.3186, test_f1: 0.5771
 epoch: 66, train_loss: 0.6189, test_loss: 1.2716, test_f1: 0.6008
 epoch: 67, train_loss: 0.5718, test_loss: 1.4955, test_f1: 0.5935
 epoch: 68, train_loss: 0.5697, test_loss: 1.5365, test_f1: 0.5416
 epoch: 69, train_loss: 0.5732, test_loss: 1.6369, test_f1: 0.5827
 epoch: 70, train_loss: 0.5740, test_loss: 1.4947, test_f1: 0.6130
 epoch: 71, train_loss: 0.5544, test_loss: 1.6912, test_f1: 0.5818
 epoch: 72, train_loss: 0.5374, test_loss: 1.6554, test_f1: 0.5616
 epoch: 73, train_loss: 0.5758, test_loss: 1.5822, test_f1: 0.5714
 epoch: 74, train_loss: 0.5791, test_loss: 1.7251, test_f1: 0.5543
 epoch: 75, train_loss: 0.5621, test_loss: 1.6009, test_f1: 0.5728
 epoch: 76, train_loss: 0.5637, test_loss: 1.5938, test_f1: 0.5722
 epoch: 77, train_loss: 0.5240, test_loss: 1.7295, test_f1: 0.5828
 epoch: 78, train_loss: 0.5251, test_loss: 1.7035, test_f1: 0.5559
 epoch: 79, train_loss: 0.5232, test_loss: 1.5777, test_f1: 0.5757
 epoch: 80, train_loss: 0.5278, test_loss: 1.5412, test_f1: 0.6013
 epoch: 81, train_loss: 0.5062, test_loss: 1.6576, test_f1: 0.6005
 epoch: 82, train_loss: 0.5096, test_loss: 1.6437, test_f1: 0.5881
 epoch: 83, train_loss: 0.5037, test_loss: 2.0025, test_f1: 0.5344
 epoch: 84, train_loss: 0.4829, test_loss: 1.8599, test_f1: 0.5572
 epoch: 85, train_loss: 0.5360, test_loss: 1.7280, test_f1: 0.5605
 epoch: 86, train_loss: 0.4907, test_loss: 1.7669, test_f1: 0.5489
 epoch: 87, train_loss: 0.5058, test_loss: 1.8021, test_f1: 0.5346
 epoch: 88, train_loss: 0.4709, test_loss: 1.7201, test_f1: 0.5942
 epoch: 89, train_loss: 0.4860, test_loss: 1.7772, test_f1: 0.6013
 epoch: 90, train_loss: 0.4585, test_loss: 1.8675, test_f1: 0.5451
 epoch: 91, train_loss: 0.4870, test_loss: 1.7546, test_f1: 0.5574
 epoch: 92, train_loss: 0.4558, test_loss: 1.8175, test_f1: 0.5763
 epoch: 93, train_loss: 0.4671, test_loss: 1.7617, test_f1: 0.5918
 epoch: 94, train_loss: 0.4485, test_loss: 1.8147, test_f1: 0.5793
 epoch: 95, train_loss: 0.4759, test_loss: 1.9274, test_f1: 0.5897
 epoch: 96, train_loss: 0.4263, test_loss: 2.0134, test_f1: 0.5964
 epoch: 97, train_loss: 0.4761, test_loss: 1.9064, test_f1: 0.5877
 epoch: 98, train_loss: 0.4505, test_loss: 1.9524, test_f1: 0.5511
 epoch: 99, train_loss: 0.4877, test_loss: 1.7962, test_f1: 0.6167
##################ITERATION #1 ****************************************
 epoch: 0, train_loss: 1.2364, test_loss: 1.3508, test_f1: 0.3307
 epoch: 1, train_loss: 1.1275, test_loss: 1.2240, test_f1: 0.4500
 epoch: 2, train_loss: 1.0651, test_loss: 1.4166, test_f1: 0.3211
 epoch: 3, train_loss: 1.0185, test_loss: 1.0926, test_f1: 0.5051
 epoch: 4, train_loss: 0.9988, test_loss: 1.0889, test_f1: 0.5151
 epoch: 5, train_loss: 0.9380, test_loss: 0.9996, test_f1: 0.4996
 epoch: 6, train_loss: 0.9058, test_loss: 1.1001, test_f1: 0.5096
 epoch: 7, train_loss: 0.8855, test_loss: 0.9805, test_f1: 0.5482
 epoch: 8, train_loss: 0.8924, test_loss: 1.0252, test_f1: 0.5469
 epoch: 9, train_loss: 0.8850, test_loss: 1.1009, test_f1: 0.5218
 epoch: 10, train_loss: 0.8795, test_loss: 1.2197, test_f1: 0.5290
 epoch: 11, train_loss: 0.8977, test_loss: 1.0356, test_f1: 0.5586
 epoch: 12, train_loss: 0.8991, test_loss: 1.0205, test_f1: 0.4732
 epoch: 13, train_loss: 0.8565, test_loss: 0.9729, test_f1: 0.5468
 epoch: 14, train_loss: 0.8482, test_loss: 1.0103, test_f1: 0.5744
 epoch: 15, train_loss: 0.8755, test_loss: 1.0481, test_f1: 0.5709
 epoch: 16, train_loss: 0.8359, test_loss: 0.9879, test_f1: 0.5564
 epoch: 17, train_loss: 0.8312, test_loss: 1.0417, test_f1: 0.5860
 epoch: 18, train_loss: 0.8161, test_loss: 1.0312, test_f1: 0.5992
 epoch: 19, train_loss: 0.8235, test_loss: 1.0063, test_f1: 0.5605
 epoch: 20, train_loss: 0.8397, test_loss: 0.9978, test_f1: 0.5433
 epoch: 21, train_loss: 0.8145, test_loss: 1.2380, test_f1: 0.5388
 epoch: 22, train_loss: 0.8233, test_loss: 0.9775, test_f1: 0.5785
 epoch: 23, train_loss: 0.8018, test_loss: 1.0313, test_f1: 0.5132
 epoch: 24, train_loss: 0.7723, test_loss: 1.0472, test_f1: 0.5546
 epoch: 25, train_loss: 0.7854, test_loss: 1.1082, test_f1: 0.4914
 epoch: 26, train_loss: 0.7813, test_loss: 0.9608, test_f1: 0.6145
 epoch: 27, train_loss: 0.7677, test_loss: 1.0151, test_f1: 0.6011
 epoch: 28, train_loss: 0.7789, test_loss: 1.0648, test_f1: 0.5544
 epoch: 29, train_loss: 0.7645, test_loss: 0.9818, test_f1: 0.6199
 epoch: 30, train_loss: 0.7505, test_loss: 1.0688, test_f1: 0.5924
 epoch: 31, train_loss: 0.7358, test_loss: 1.0923, test_f1: 0.4778
 epoch: 32, train_loss: 0.7628, test_loss: 1.2977, test_f1: 0.5141
 epoch: 33, train_loss: 0.7831, test_loss: 1.1028, test_f1: 0.5965
 epoch: 34, train_loss: 0.7298, test_loss: 1.0315, test_f1: 0.5838
 epoch: 35, train_loss: 0.7466, test_loss: 0.9920, test_f1: 0.6045
 epoch: 36, train_loss: 0.7317, test_loss: 1.0106, test_f1: 0.5596
 epoch: 37, train_loss: 0.7096, test_loss: 1.1143, test_f1: 0.5657
 epoch: 38, train_loss: 0.7164, test_loss: 1.1609, test_f1: 0.5336
 epoch: 39, train_loss: 0.7223, test_loss: 1.2050, test_f1: 0.5961
 epoch: 40, train_loss: 0.7071, test_loss: 1.0026, test_f1: 0.5824
 epoch: 41, train_loss: 0.7261, test_loss: 1.1462, test_f1: 0.5698
 epoch: 42, train_loss: 0.7113, test_loss: 1.0835, test_f1: 0.6054
 epoch: 43, train_loss: 0.6874, test_loss: 1.0333, test_f1: 0.6091
 epoch: 44, train_loss: 0.6960, test_loss: 1.0794, test_f1: 0.5693
 epoch: 45, train_loss: 0.6792, test_loss: 1.0683, test_f1: 0.6034
 epoch: 46, train_loss: 0.6837, test_loss: 1.1353, test_f1: 0.5565
 epoch: 47, train_loss: 0.6884, test_loss: 1.1928, test_f1: 0.5398
 epoch: 48, train_loss: 0.6798, test_loss: 1.2773, test_f1: 0.5288
 epoch: 49, train_loss: 0.6609, test_loss: 1.2012, test_f1: 0.5630
 epoch: 50, train_loss: 0.6824, test_loss: 2.2676, test_f1: 0.5602
 epoch: 51, train_loss: 0.6196, test_loss: 1.1209, test_f1: 0.5713
 epoch: 52, train_loss: 0.6039, test_loss: 1.3207, test_f1: 0.5995
 epoch: 53, train_loss: 0.5876, test_loss: 1.2885, test_f1: 0.6096
 epoch: 54, train_loss: 0.5913, test_loss: 1.0803, test_f1: 0.6012
 epoch: 55, train_loss: 0.5785, test_loss: 1.3491, test_f1: 0.5844
 epoch: 56, train_loss: 0.5557, test_loss: 1.1662, test_f1: 0.5716
 epoch: 57, train_loss: 0.5511, test_loss: 1.4068, test_f1: 0.6180
 epoch: 58, train_loss: 0.5792, test_loss: 1.3011, test_f1: 0.6018
 epoch: 59, train_loss: 0.5792, test_loss: 1.3645, test_f1: 0.6395
 epoch: 60, train_loss: 0.5555, test_loss: 1.5432, test_f1: 0.5633
 epoch: 61, train_loss: 0.5567, test_loss: 1.6205, test_f1: 0.5911
 epoch: 62, train_loss: 0.5519, test_loss: 1.3060, test_f1: 0.6041
 epoch: 63, train_loss: 0.5408, test_loss: 1.4405, test_f1: 0.5538
 epoch: 64, train_loss: 0.5419, test_loss: 1.4080, test_f1: 0.5906
 epoch: 65, train_loss: 0.5183, test_loss: 1.5026, test_f1: 0.5655
 epoch: 66, train_loss: 0.5231, test_loss: 1.3115, test_f1: 0.6182
 epoch: 67, train_loss: 0.5092, test_loss: 1.4612, test_f1: 0.5718
 epoch: 68, train_loss: 0.5249, test_loss: 1.5406, test_f1: 0.6001
 epoch: 69, train_loss: 0.5266, test_loss: 1.3535, test_f1: 0.6363
 epoch: 70, train_loss: 0.4945, test_loss: 1.5168, test_f1: 0.5992
 epoch: 71, train_loss: 0.5155, test_loss: 1.4069, test_f1: 0.5958
 epoch: 72, train_loss: 0.4617, test_loss: 1.5735, test_f1: 0.5914
 epoch: 73, train_loss: 0.5248, test_loss: 1.4257, test_f1: 0.6118
 epoch: 74, train_loss: 0.5005, test_loss: 1.4550, test_f1: 0.5796
 epoch: 75, train_loss: 0.5010, test_loss: 1.5131, test_f1: 0.5576
 epoch: 76, train_loss: 0.4928, test_loss: 1.5773, test_f1: 0.5767
 epoch: 77, train_loss: 0.5040, test_loss: 1.5529, test_f1: 0.5698
 epoch: 78, train_loss: 0.4705, test_loss: 1.6337, test_f1: 0.5829
 epoch: 79, train_loss: 0.4831, test_loss: 1.4449, test_f1: 0.6014
 epoch: 80, train_loss: 0.4740, test_loss: 1.5401, test_f1: 0.5948
 epoch: 81, train_loss: 0.4791, test_loss: 1.4901, test_f1: 0.5294
 epoch: 82, train_loss: 0.4663, test_loss: 1.7155, test_f1: 0.6076
 epoch: 83, train_loss: 0.4548, test_loss: 1.4118, test_f1: 0.6209
 epoch: 84, train_loss: 0.4777, test_loss: 1.5445, test_f1: 0.5644
 epoch: 85, train_loss: 0.4356, test_loss: 1.5885, test_f1: 0.5960
 epoch: 86, train_loss: 0.4580, test_loss: 1.5483, test_f1: 0.5808
 epoch: 87, train_loss: 0.4477, test_loss: 1.4966, test_f1: 0.6032
 epoch: 88, train_loss: 0.4240, test_loss: 1.7161, test_f1: 0.5442
 epoch: 89, train_loss: 0.4511, test_loss: 1.7843, test_f1: 0.5939
 epoch: 90, train_loss: 0.4358, test_loss: 2.1377, test_f1: 0.5881
 epoch: 91, train_loss: 0.4237, test_loss: 1.6831, test_f1: 0.5903
 epoch: 92, train_loss: 0.4417, test_loss: 1.4882, test_f1: 0.5972
 epoch: 93, train_loss: 0.4226, test_loss: 1.6612, test_f1: 0.5729
 epoch: 94, train_loss: 0.4176, test_loss: 1.7162, test_f1: 0.6179
 epoch: 95, train_loss: 0.4311, test_loss: 1.7613, test_f1: 0.6018
 epoch: 96, train_loss: 0.4248, test_loss: 1.6440, test_f1: 0.5461
 epoch: 97, train_loss: 0.4118, test_loss: 1.7995, test_f1: 0.5769
 epoch: 98, train_loss: 0.4081, test_loss: 1.7658, test_f1: 0.5873
 epoch: 99, train_loss: 0.4285, test_loss: 1.9554, test_f1: 0.6023
##################ITERATION #2 ****************************************
 epoch: 0, train_loss: 1.2728, test_loss: 1.2756, test_f1: 0.2333
 epoch: 1, train_loss: 1.1938, test_loss: 1.2428, test_f1: 0.2281
 epoch: 2, train_loss: 1.1345, test_loss: 1.2530, test_f1: 0.3675
 epoch: 3, train_loss: 1.1110, test_loss: 1.2114, test_f1: 0.3061
 epoch: 4, train_loss: 1.0775, test_loss: 1.1987, test_f1: 0.4138
 epoch: 5, train_loss: 1.0661, test_loss: 1.4123, test_f1: 0.3594
 epoch: 6, train_loss: 1.0349, test_loss: 1.0913, test_f1: 0.4251
 epoch: 7, train_loss: 0.9896, test_loss: 1.0570, test_f1: 0.5052
 epoch: 8, train_loss: 0.9567, test_loss: 1.0820, test_f1: 0.5085
 epoch: 9, train_loss: 0.9486, test_loss: 1.0749, test_f1: 0.4174
 epoch: 10, train_loss: 0.8942, test_loss: 1.0271, test_f1: 0.5063
 epoch: 11, train_loss: 0.9034, test_loss: 1.0788, test_f1: 0.4383
 epoch: 12, train_loss: 0.8664, test_loss: 1.1088, test_f1: 0.4584
 epoch: 13, train_loss: 0.8886, test_loss: 1.1745, test_f1: 0.5038
 epoch: 14, train_loss: 0.8804, test_loss: 1.0964, test_f1: 0.5434
 epoch: 15, train_loss: 0.9075, test_loss: 1.0972, test_f1: 0.5524
 epoch: 16, train_loss: 0.8531, test_loss: 1.0927, test_f1: 0.5224
 epoch: 17, train_loss: 0.8456, test_loss: 1.0961, test_f1: 0.5373
 epoch: 18, train_loss: 0.8294, test_loss: 1.5799, test_f1: 0.4173
 epoch: 19, train_loss: 0.8496, test_loss: 1.1278, test_f1: 0.5583
 epoch: 20, train_loss: 0.8424, test_loss: 1.1197, test_f1: 0.4810
 epoch: 21, train_loss: 0.8222, test_loss: 1.1357, test_f1: 0.4448
 epoch: 22, train_loss: 0.8195, test_loss: 1.0601, test_f1: 0.5111
 epoch: 23, train_loss: 0.8006, test_loss: 1.2577, test_f1: 0.5707
 epoch: 24, train_loss: 0.7881, test_loss: 1.1587, test_f1: 0.5868
 epoch: 25, train_loss: 0.8038, test_loss: 1.0791, test_f1: 0.5798
 epoch: 26, train_loss: 0.7987, test_loss: 1.1093, test_f1: 0.5455
 epoch: 27, train_loss: 0.8277, test_loss: 1.0530, test_f1: 0.6000
 epoch: 28, train_loss: 0.8058, test_loss: 1.0623, test_f1: 0.6157
 epoch: 29, train_loss: 0.7984, test_loss: 1.0477, test_f1: 0.5641
 epoch: 30, train_loss: 0.7831, test_loss: 1.0183, test_f1: 0.6161
 epoch: 31, train_loss: 0.7671, test_loss: 1.0944, test_f1: 0.5748
 epoch: 32, train_loss: 0.7864, test_loss: 1.1614, test_f1: 0.5393
 epoch: 33, train_loss: 0.8035, test_loss: 1.3969, test_f1: 0.5414
 epoch: 34, train_loss: 0.7738, test_loss: 1.0581, test_f1: 0.4771
 epoch: 35, train_loss: 0.7884, test_loss: 1.1537, test_f1: 0.5014
 epoch: 36, train_loss: 0.7316, test_loss: 1.1067, test_f1: 0.5504
 epoch: 37, train_loss: 0.7716, test_loss: 1.1370, test_f1: 0.5283
 epoch: 38, train_loss: 0.8287, test_loss: 1.1295, test_f1: 0.5428
 epoch: 39, train_loss: 0.8330, test_loss: 1.0162, test_f1: 0.5236
 epoch: 40, train_loss: 0.8477, test_loss: 1.0529, test_f1: 0.5266
 epoch: 41, train_loss: 0.8212, test_loss: 1.1217, test_f1: 0.5315
 epoch: 42, train_loss: 0.8094, test_loss: 1.0342, test_f1: 0.5445
 epoch: 43, train_loss: 0.7720, test_loss: 1.0875, test_f1: 0.5802
 epoch: 44, train_loss: 0.7599, test_loss: 1.2125, test_f1: 0.5757
 epoch: 45, train_loss: 0.7538, test_loss: 1.1107, test_f1: 0.5592
 epoch: 46, train_loss: 0.7630, test_loss: 1.0471, test_f1: 0.5507
 epoch: 47, train_loss: 0.7347, test_loss: 1.2984, test_f1: 0.5246
 epoch: 48, train_loss: 0.7537, test_loss: 1.1299, test_f1: 0.5866
 epoch: 49, train_loss: 0.7390, test_loss: 1.1230, test_f1: 0.5523
 epoch: 50, train_loss: 0.7378, test_loss: 1.0798, test_f1: 0.5705
 epoch: 51, train_loss: 0.7175, test_loss: 1.1141, test_f1: 0.6106
 epoch: 52, train_loss: 0.6758, test_loss: 1.1871, test_f1: 0.5923
 epoch: 53, train_loss: 0.6740, test_loss: 1.1488, test_f1: 0.5953
 epoch: 54, train_loss: 0.6591, test_loss: 1.1258, test_f1: 0.6194
 epoch: 55, train_loss: 0.6518, test_loss: 1.1481, test_f1: 0.6210
 epoch: 56, train_loss: 0.6493, test_loss: 1.4638, test_f1: 0.5894
 epoch: 57, train_loss: 0.6495, test_loss: 1.2605, test_f1: 0.6034
 epoch: 58, train_loss: 0.6543, test_loss: 1.3397, test_f1: 0.5640
 epoch: 59, train_loss: 0.6398, test_loss: 1.2243, test_f1: 0.5901
 epoch: 60, train_loss: 0.6428, test_loss: 1.2672, test_f1: 0.5894
 epoch: 61, train_loss: 0.6366, test_loss: 1.2382, test_f1: 0.5811
 epoch: 62, train_loss: 0.6103, test_loss: 1.3284, test_f1: 0.5799
 epoch: 63, train_loss: 0.6117, test_loss: 1.2952, test_f1: 0.6122
 epoch: 64, train_loss: 0.6008, test_loss: 1.3932, test_f1: 0.5902
 epoch: 65, train_loss: 0.6454, test_loss: 1.2439, test_f1: 0.6042
 epoch: 66, train_loss: 0.6105, test_loss: 1.3654, test_f1: 0.5829
 epoch: 67, train_loss: 0.6060, test_loss: 1.4220, test_f1: 0.5693
 epoch: 68, train_loss: 0.5767, test_loss: 1.5649, test_f1: 0.5581
 epoch: 69, train_loss: 0.6003, test_loss: 1.5057, test_f1: 0.5895
 epoch: 70, train_loss: 0.5978, test_loss: 1.3945, test_f1: 0.5617
 epoch: 71, train_loss: 0.5950, test_loss: 1.4194, test_f1: 0.5379
 epoch: 72, train_loss: 0.5892, test_loss: 1.5170, test_f1: 0.5917
 epoch: 73, train_loss: 0.5734, test_loss: 1.5643, test_f1: 0.5976
 epoch: 74, train_loss: 0.5688, test_loss: 1.6162, test_f1: 0.5270
 epoch: 75, train_loss: 0.5744, test_loss: 1.5339, test_f1: 0.5197
 epoch: 76, train_loss: 0.5645, test_loss: 1.7648, test_f1: 0.5658
 epoch: 77, train_loss: 0.5843, test_loss: 1.5074, test_f1: 0.5771
 epoch: 78, train_loss: 0.5928, test_loss: 1.4320, test_f1: 0.6000
 epoch: 79, train_loss: 0.5588, test_loss: 1.5720, test_f1: 0.5220
 epoch: 80, train_loss: 0.5662, test_loss: 1.6099, test_f1: 0.5177
 epoch: 81, train_loss: 0.5623, test_loss: 1.5932, test_f1: 0.5884
 epoch: 82, train_loss: 0.5999, test_loss: 1.4769, test_f1: 0.5672
 epoch: 83, train_loss: 0.5556, test_loss: 1.8379, test_f1: 0.5518
 epoch: 84, train_loss: 0.5443, test_loss: 1.8799, test_f1: 0.4890
 epoch: 85, train_loss: 0.5715, test_loss: 2.0897, test_f1: 0.5881
 epoch: 86, train_loss: 0.5483, test_loss: 1.6557, test_f1: 0.5500
 epoch: 87, train_loss: 0.5587, test_loss: 1.7835, test_f1: 0.5829
 epoch: 88, train_loss: 0.5512, test_loss: 1.5683, test_f1: 0.5571
 epoch: 89, train_loss: 0.5621, test_loss: 1.8366, test_f1: 0.5651
 epoch: 90, train_loss: 0.5407, test_loss: 1.6738, test_f1: 0.5719
 epoch: 91, train_loss: 0.5433, test_loss: 1.7379, test_f1: 0.5574
 epoch: 92, train_loss: 0.5118, test_loss: 1.8018, test_f1: 0.5199
 epoch: 93, train_loss: 0.5454, test_loss: 1.4582, test_f1: 0.5856
 epoch: 94, train_loss: 0.5214, test_loss: 1.6106, test_f1: 0.5553
 epoch: 95, train_loss: 0.5048, test_loss: 1.8345, test_f1: 0.5629
 epoch: 96, train_loss: 0.5200, test_loss: 1.7841, test_f1: 0.5032
 epoch: 97, train_loss: 0.5209, test_loss: 1.9284, test_f1: 0.5319
 epoch: 98, train_loss: 0.5037, test_loss: 1.7659, test_f1: 0.5315
 epoch: 99, train_loss: 0.5060, test_loss: 1.9803, test_f1: 0.5688
##################ITERATION #3 ****************************************
 epoch: 0, train_loss: 1.2482, test_loss: 1.2316, test_f1: 0.3108
 epoch: 1, train_loss: 1.1411, test_loss: 1.1665, test_f1: 0.3975
 epoch: 2, train_loss: 1.1181, test_loss: 1.1848, test_f1: 0.3156
 epoch: 3, train_loss: 1.0740, test_loss: 1.1406, test_f1: 0.3851
 epoch: 4, train_loss: 1.0257, test_loss: 1.1276, test_f1: 0.5234
 epoch: 5, train_loss: 0.9590, test_loss: 1.0468, test_f1: 0.5087
 epoch: 6, train_loss: 0.9236, test_loss: 1.0954, test_f1: 0.4718
 epoch: 7, train_loss: 0.9238, test_loss: 1.0607, test_f1: 0.4741
 epoch: 8, train_loss: 0.9251, test_loss: 1.0136, test_f1: 0.5168
 epoch: 9, train_loss: 0.9417, test_loss: 1.2562, test_f1: 0.5037
 epoch: 10, train_loss: 0.9306, test_loss: 1.1427, test_f1: 0.5655
 epoch: 11, train_loss: 0.9051, test_loss: 0.9768, test_f1: 0.5342
 epoch: 12, train_loss: 0.8797, test_loss: 1.0959, test_f1: 0.5206
 epoch: 13, train_loss: 0.8660, test_loss: 1.1522, test_f1: 0.5855
 epoch: 14, train_loss: 0.8641, test_loss: 1.0554, test_f1: 0.5629
 epoch: 15, train_loss: 0.8365, test_loss: 0.9823, test_f1: 0.5404
 epoch: 16, train_loss: 0.8481, test_loss: 1.0956, test_f1: 0.5786
 epoch: 17, train_loss: 0.8762, test_loss: 1.0608, test_f1: 0.5081
 epoch: 18, train_loss: 0.8506, test_loss: 1.0279, test_f1: 0.5152
 epoch: 19, train_loss: 0.8721, test_loss: 1.0470, test_f1: 0.5411
 epoch: 20, train_loss: 0.8361, test_loss: 1.0281, test_f1: 0.5098
 epoch: 21, train_loss: 0.8213, test_loss: 1.0908, test_f1: 0.5104
 epoch: 22, train_loss: 0.8495, test_loss: 1.0700, test_f1: 0.5682
 epoch: 23, train_loss: 0.8099, test_loss: 1.0158, test_f1: 0.5165
 epoch: 24, train_loss: 0.7931, test_loss: 1.0135, test_f1: 0.5347
 epoch: 25, train_loss: 0.8127, test_loss: 1.0284, test_f1: 0.5694
 epoch: 26, train_loss: 0.8037, test_loss: 1.1226, test_f1: 0.5801
 epoch: 27, train_loss: 0.8083, test_loss: 1.0632, test_f1: 0.5249
 epoch: 28, train_loss: 0.8095, test_loss: 1.2281, test_f1: 0.5610
 epoch: 29, train_loss: 0.7876, test_loss: 1.1068, test_f1: 0.5341
 epoch: 30, train_loss: 0.8046, test_loss: 1.0661, test_f1: 0.5065
 epoch: 31, train_loss: 0.8267, test_loss: 1.0276, test_f1: 0.5419
 epoch: 32, train_loss: 0.8085, test_loss: 1.0806, test_f1: 0.5726
 epoch: 33, train_loss: 0.8104, test_loss: 1.2946, test_f1: 0.5714
 epoch: 34, train_loss: 0.8249, test_loss: 1.3538, test_f1: 0.5874
 epoch: 35, train_loss: 0.7986, test_loss: 1.2271, test_f1: 0.5493
 epoch: 36, train_loss: 0.7527, test_loss: 1.2445, test_f1: 0.5750
 epoch: 37, train_loss: 0.7910, test_loss: 1.1678, test_f1: 0.6264
 epoch: 38, train_loss: 0.7745, test_loss: 1.1291, test_f1: 0.5468
 epoch: 39, train_loss: 0.7852, test_loss: 1.3774, test_f1: 0.5425
 epoch: 40, train_loss: 0.8009, test_loss: 1.1947, test_f1: 0.5351
 epoch: 41, train_loss: 0.7727, test_loss: 1.5013, test_f1: 0.5634
 epoch: 42, train_loss: 0.7523, test_loss: 1.4278, test_f1: 0.4849
 epoch: 43, train_loss: 0.7846, test_loss: 1.3475, test_f1: 0.5897
 epoch: 44, train_loss: 0.7530, test_loss: 1.2912, test_f1: 0.5891
 epoch: 45, train_loss: 0.7624, test_loss: 1.3309, test_f1: 0.5344
 epoch: 46, train_loss: 0.7649, test_loss: 1.3119, test_f1: 0.5830
 epoch: 47, train_loss: 0.7517, test_loss: 1.6697, test_f1: 0.5739
 epoch: 48, train_loss: 0.7309, test_loss: 1.2354, test_f1: 0.4878
 epoch: 49, train_loss: 0.7386, test_loss: 1.2305, test_f1: 0.5340
 epoch: 50, train_loss: 0.7352, test_loss: 1.4334, test_f1: 0.5585
 epoch: 51, train_loss: 0.6970, test_loss: 1.2831, test_f1: 0.5573
 epoch: 52, train_loss: 0.6921, test_loss: 1.3314, test_f1: 0.5992
 epoch: 53, train_loss: 0.6903, test_loss: 1.4141, test_f1: 0.5484
 epoch: 54, train_loss: 0.6909, test_loss: 1.5003, test_f1: 0.5107
 epoch: 55, train_loss: 0.6612, test_loss: 1.4236, test_f1: 0.5546
 epoch: 56, train_loss: 0.6742, test_loss: 1.5693, test_f1: 0.5602
 epoch: 57, train_loss: 0.6674, test_loss: 1.5019, test_f1: 0.6053
 epoch: 58, train_loss: 0.6674, test_loss: 1.3334, test_f1: 0.6121
 epoch: 59, train_loss: 0.6703, test_loss: 1.3066, test_f1: 0.6190
 epoch: 60, train_loss: 0.6687, test_loss: 1.4744, test_f1: 0.5492
 epoch: 61, train_loss: 0.6552, test_loss: 1.6499, test_f1: 0.5789
 epoch: 62, train_loss: 0.6584, test_loss: 1.5872, test_f1: 0.5592
 epoch: 63, train_loss: 0.6301, test_loss: 1.4719, test_f1: 0.5567
 epoch: 64, train_loss: 0.6479, test_loss: 1.5726, test_f1: 0.5411
 epoch: 65, train_loss: 0.6464, test_loss: 1.4823, test_f1: 0.5821
 epoch: 66, train_loss: 0.6537, test_loss: 1.4578, test_f1: 0.5587
 epoch: 67, train_loss: 0.6515, test_loss: 1.6106, test_f1: 0.5166
 epoch: 68, train_loss: 0.6428, test_loss: 1.6242, test_f1: 0.5308
 epoch: 69, train_loss: 0.6155, test_loss: 1.7832, test_f1: 0.5370
 epoch: 70, train_loss: 0.6324, test_loss: 1.5201, test_f1: 0.5753
 epoch: 71, train_loss: 0.6125, test_loss: 1.4973, test_f1: 0.5965
 epoch: 72, train_loss: 0.6164, test_loss: 1.6643, test_f1: 0.5378
 epoch: 73, train_loss: 0.6187, test_loss: 1.4376, test_f1: 0.5953
 epoch: 74, train_loss: 0.5962, test_loss: 1.2746, test_f1: 0.6161
 epoch: 75, train_loss: 0.6348, test_loss: 1.5885, test_f1: 0.5706
 epoch: 76, train_loss: 0.5961, test_loss: 1.8198, test_f1: 0.5508
 epoch: 77, train_loss: 0.6102, test_loss: 1.4512, test_f1: 0.5794
 epoch: 78, train_loss: 0.6252, test_loss: 1.4118, test_f1: 0.5280
 epoch: 79, train_loss: 0.5794, test_loss: 1.5355, test_f1: 0.5695
 epoch: 80, train_loss: 0.6045, test_loss: 1.4529, test_f1: 0.6085
 epoch: 81, train_loss: 0.6074, test_loss: 1.8423, test_f1: 0.5596
 epoch: 82, train_loss: 0.6076, test_loss: 1.7583, test_f1: 0.5352
 epoch: 83, train_loss: 0.5870, test_loss: 1.7330, test_f1: 0.5882
 epoch: 84, train_loss: 0.5949, test_loss: 1.6856, test_f1: 0.5509
 epoch: 85, train_loss: 0.5775, test_loss: 1.9322, test_f1: 0.5877
 epoch: 86, train_loss: 0.5822, test_loss: 1.8438, test_f1: 0.5475
 epoch: 87, train_loss: 0.5742, test_loss: 1.6733, test_f1: 0.5811
 epoch: 88, train_loss: 0.5702, test_loss: 2.1007, test_f1: 0.5265
 epoch: 89, train_loss: 0.5836, test_loss: 1.7900, test_f1: 0.5792
 epoch: 90, train_loss: 0.5694, test_loss: 1.9707, test_f1: 0.5445
 epoch: 91, train_loss: 0.5639, test_loss: 1.6320, test_f1: 0.5899
 epoch: 92, train_loss: 0.6094, test_loss: 1.9464, test_f1: 0.5359
 epoch: 93, train_loss: 0.5374, test_loss: 1.8177, test_f1: 0.6095
 epoch: 94, train_loss: 0.5425, test_loss: 1.9722, test_f1: 0.5886
 epoch: 95, train_loss: 0.5769, test_loss: 1.6885, test_f1: 0.6078
 epoch: 96, train_loss: 0.5470, test_loss: 1.8673, test_f1: 0.5690
 epoch: 97, train_loss: 0.5470, test_loss: 1.7752, test_f1: 0.5632
 epoch: 98, train_loss: 0.5381, test_loss: 1.6096, test_f1: 0.5533
 epoch: 99, train_loss: 0.5447, test_loss: 1.6847, test_f1: 0.5554
##################ITERATION #4 ****************************************
 epoch: 0, train_loss: 1.2832, test_loss: 1.3064, test_f1: 0.2281
 epoch: 1, train_loss: 1.1865, test_loss: 1.3115, test_f1: 0.2281
 epoch: 2, train_loss: 1.1106, test_loss: 1.1712, test_f1: 0.3142
 epoch: 3, train_loss: 1.0386, test_loss: 1.0931, test_f1: 0.4324
 epoch: 4, train_loss: 0.9799, test_loss: 1.0836, test_f1: 0.5187
 epoch: 5, train_loss: 0.9423, test_loss: 1.0580, test_f1: 0.5534
 epoch: 6, train_loss: 0.9165, test_loss: 1.1808, test_f1: 0.3670
 epoch: 7, train_loss: 0.9155, test_loss: 1.0197, test_f1: 0.4554
 epoch: 8, train_loss: 0.9231, test_loss: 1.0069, test_f1: 0.5093
 epoch: 9, train_loss: 0.9112, test_loss: 0.9930, test_f1: 0.5536
 epoch: 10, train_loss: 0.8975, test_loss: 1.1412, test_f1: 0.3951
 epoch: 11, train_loss: 0.9035, test_loss: 1.0246, test_f1: 0.5408
 epoch: 12, train_loss: 0.9014, test_loss: 0.9774, test_f1: 0.5598
 epoch: 13, train_loss: 0.9240, test_loss: 0.9955, test_f1: 0.5220
 epoch: 14, train_loss: 0.8940, test_loss: 1.0092, test_f1: 0.4319
 epoch: 15, train_loss: 0.8593, test_loss: 1.0275, test_f1: 0.5118
 epoch: 16, train_loss: 0.8409, test_loss: 0.9864, test_f1: 0.5758
 epoch: 17, train_loss: 0.8611, test_loss: 1.0102, test_f1: 0.5447
 epoch: 18, train_loss: 0.8343, test_loss: 0.9971, test_f1: 0.5843
 epoch: 19, train_loss: 0.8470, test_loss: 1.0204, test_f1: 0.5159
 epoch: 20, train_loss: 0.8348, test_loss: 1.0272, test_f1: 0.5425
 epoch: 21, train_loss: 0.8621, test_loss: 1.0044, test_f1: 0.5524
 epoch: 22, train_loss: 0.8269, test_loss: 1.0277, test_f1: 0.5887
 epoch: 23, train_loss: 0.8161, test_loss: 1.0076, test_f1: 0.5275
 epoch: 24, train_loss: 0.8097, test_loss: 1.0220, test_f1: 0.5721
 epoch: 25, train_loss: 0.8248, test_loss: 1.0721, test_f1: 0.5934
 epoch: 26, train_loss: 0.7964, test_loss: 1.0172, test_f1: 0.6148
 epoch: 27, train_loss: 0.7931, test_loss: 0.9662, test_f1: 0.6302
 epoch: 28, train_loss: 0.7934, test_loss: 1.0429, test_f1: 0.5753
 epoch: 29, train_loss: 0.7816, test_loss: 1.0655, test_f1: 0.5792
 epoch: 30, train_loss: 0.7781, test_loss: 1.4244, test_f1: 0.5718
 epoch: 31, train_loss: 0.7745, test_loss: 1.1090, test_f1: 0.4882
 epoch: 32, train_loss: 0.7683, test_loss: 1.2380, test_f1: 0.5581
 epoch: 33, train_loss: 0.8018, test_loss: 1.0025, test_f1: 0.5757
 epoch: 34, train_loss: 0.7517, test_loss: 1.0155, test_f1: 0.6001
 epoch: 35, train_loss: 0.7522, test_loss: 1.0438, test_f1: 0.6024
 epoch: 36, train_loss: 0.7317, test_loss: 1.0781, test_f1: 0.6137
 epoch: 37, train_loss: 0.7535, test_loss: 1.1062, test_f1: 0.5471
 epoch: 38, train_loss: 0.7649, test_loss: 1.0864, test_f1: 0.5994
 epoch: 39, train_loss: 0.7609, test_loss: 0.9826, test_f1: 0.6210
 epoch: 40, train_loss: 0.7357, test_loss: 1.1222, test_f1: 0.5644
 epoch: 41, train_loss: 0.7508, test_loss: 1.0182, test_f1: 0.5794
 epoch: 42, train_loss: 0.7191, test_loss: 1.4448, test_f1: 0.5269
 epoch: 43, train_loss: 0.7336, test_loss: 1.1057, test_f1: 0.5753
 epoch: 44, train_loss: 0.7163, test_loss: 1.3453, test_f1: 0.5299
 epoch: 45, train_loss: 0.7067, test_loss: 1.1360, test_f1: 0.5802
 epoch: 46, train_loss: 0.7113, test_loss: 1.1294, test_f1: 0.5899
 epoch: 47, train_loss: 0.7233, test_loss: 1.1878, test_f1: 0.5556
 epoch: 48, train_loss: 0.7111, test_loss: 1.2990, test_f1: 0.4246
 epoch: 49, train_loss: 0.7884, test_loss: 1.0456, test_f1: 0.5910
 epoch: 50, train_loss: 0.7142, test_loss: 1.4274, test_f1: 0.6063
 epoch: 51, train_loss: 0.6611, test_loss: 1.1093, test_f1: 0.6163
 epoch: 52, train_loss: 0.6401, test_loss: 1.1539, test_f1: 0.6481
 epoch: 53, train_loss: 0.6411, test_loss: 1.2182, test_f1: 0.6307
 epoch: 54, train_loss: 0.6403, test_loss: 1.3762, test_f1: 0.5768
 epoch: 55, train_loss: 0.6760, test_loss: 1.1464, test_f1: 0.6099
 epoch: 56, train_loss: 0.6409, test_loss: 1.3080, test_f1: 0.5724
 epoch: 57, train_loss: 0.6257, test_loss: 1.2549, test_f1: 0.5613
 epoch: 58, train_loss: 0.6091, test_loss: 1.2648, test_f1: 0.6004
 epoch: 59, train_loss: 0.5985, test_loss: 1.2750, test_f1: 0.5834
 epoch: 60, train_loss: 0.5760, test_loss: 1.4226, test_f1: 0.5841
 epoch: 61, train_loss: 0.5938, test_loss: 1.3130, test_f1: 0.5555
 epoch: 62, train_loss: 0.5910, test_loss: 1.3175, test_f1: 0.6156
 epoch: 63, train_loss: 0.6104, test_loss: 1.3192, test_f1: 0.5877
 epoch: 64, train_loss: 0.5618, test_loss: 1.3792, test_f1: 0.6154
 epoch: 65, train_loss: 0.5784, test_loss: 1.4472, test_f1: 0.5968
 epoch: 66, train_loss: 0.5736, test_loss: 1.3456, test_f1: 0.6192
 epoch: 67, train_loss: 0.5565, test_loss: 1.4380, test_f1: 0.5890
 epoch: 68, train_loss: 0.5725, test_loss: 1.4979, test_f1: 0.6177
 epoch: 69, train_loss: 0.5378, test_loss: 1.5670, test_f1: 0.5949
 epoch: 70, train_loss: 0.5851, test_loss: 1.2384, test_f1: 0.6165
 epoch: 71, train_loss: 0.5558, test_loss: 1.4034, test_f1: 0.6408
 epoch: 72, train_loss: 0.5524, test_loss: 1.2780, test_f1: 0.6130
 epoch: 73, train_loss: 0.5281, test_loss: 1.4521, test_f1: 0.5623
 epoch: 74, train_loss: 0.5602, test_loss: 1.4529, test_f1: 0.5978
 epoch: 75, train_loss: 0.5318, test_loss: 1.5300, test_f1: 0.5867
 epoch: 76, train_loss: 0.5089, test_loss: 1.5346, test_f1: 0.6189
 epoch: 77, train_loss: 0.5323, test_loss: 1.3925, test_f1: 0.6149
 epoch: 78, train_loss: 0.5238, test_loss: 1.3793, test_f1: 0.6285
 epoch: 79, train_loss: 0.5311, test_loss: 1.4322, test_f1: 0.5858
 epoch: 80, train_loss: 0.4994, test_loss: 1.5266, test_f1: 0.6381
 epoch: 81, train_loss: 0.5113, test_loss: 1.3973, test_f1: 0.5785
 epoch: 82, train_loss: 0.5244, test_loss: 1.5664, test_f1: 0.5710
 epoch: 83, train_loss: 0.5109, test_loss: 1.5992, test_f1: 0.6105
 epoch: 84, train_loss: 0.5117, test_loss: 1.4490, test_f1: 0.5942
 epoch: 85, train_loss: 0.5166, test_loss: 1.5026, test_f1: 0.6175
 epoch: 86, train_loss: 0.5098, test_loss: 1.6494, test_f1: 0.5638
 epoch: 87, train_loss: 0.4988, test_loss: 1.3773, test_f1: 0.6251
 epoch: 88, train_loss: 0.4982, test_loss: 1.5738, test_f1: 0.6283
 epoch: 89, train_loss: 0.4778, test_loss: 1.5524, test_f1: 0.6113
 epoch: 90, train_loss: 0.4794, test_loss: 1.6457, test_f1: 0.5971
 epoch: 91, train_loss: 0.4771, test_loss: 1.6489, test_f1: 0.5940
 epoch: 92, train_loss: 0.4687, test_loss: 1.5807, test_f1: 0.6006
 epoch: 93, train_loss: 0.4908, test_loss: 1.6254, test_f1: 0.6416
 epoch: 94, train_loss: 0.4609, test_loss: 1.5509, test_f1: 0.6380
 epoch: 95, train_loss: 0.4604, test_loss: 1.6524, test_f1: 0.6101
 epoch: 96, train_loss: 0.4669, test_loss: 1.6990, test_f1: 0.5627
 epoch: 97, train_loss: 0.4966, test_loss: 1.7323, test_f1: 0.5437
 epoch: 98, train_loss: 0.4790, test_loss: 1.8303, test_f1: 0.5943
 epoch: 99, train_loss: 0.4612, test_loss: 1.6833, test_f1: 0.5233
##################ITERATION #5 ****************************************
 epoch: 0, train_loss: 1.2628, test_loss: 1.3284, test_f1: 0.2507
 epoch: 1, train_loss: 1.0641, test_loss: 1.3934, test_f1: 0.3922
 epoch: 2, train_loss: 0.9900, test_loss: 1.0412, test_f1: 0.5327
 epoch: 3, train_loss: 0.9415, test_loss: 1.4920, test_f1: 0.4268
 epoch: 4, train_loss: 0.9173, test_loss: 1.0145, test_f1: 0.5719
 epoch: 5, train_loss: 0.9030, test_loss: 1.1270, test_f1: 0.4768
 epoch: 6, train_loss: 0.8886, test_loss: 1.0795, test_f1: 0.5489
 epoch: 7, train_loss: 0.8979, test_loss: 1.0245, test_f1: 0.5339
 epoch: 8, train_loss: 0.8604, test_loss: 0.9770, test_f1: 0.5759
 epoch: 9, train_loss: 0.8583, test_loss: 1.2636, test_f1: 0.3614
 epoch: 10, train_loss: 0.8515, test_loss: 1.3488, test_f1: 0.4525
 epoch: 11, train_loss: 0.8372, test_loss: 1.0319, test_f1: 0.5470
 epoch: 12, train_loss: 0.8962, test_loss: 1.0046, test_f1: 0.4888
 epoch: 13, train_loss: 0.8204, test_loss: 0.9938, test_f1: 0.5276
 epoch: 14, train_loss: 0.8166, test_loss: 1.0049, test_f1: 0.5793
 epoch: 15, train_loss: 0.8120, test_loss: 1.0840, test_f1: 0.5385
 epoch: 16, train_loss: 0.7840, test_loss: 1.0178, test_f1: 0.5770
 epoch: 17, train_loss: 0.7879, test_loss: 1.0882, test_f1: 0.5196
 epoch: 18, train_loss: 0.8349, test_loss: 1.0173, test_f1: 0.5777
 epoch: 19, train_loss: 0.8433, test_loss: 1.1164, test_f1: 0.6098
 epoch: 20, train_loss: 0.8093, test_loss: 1.1394, test_f1: 0.5459
 epoch: 21, train_loss: 0.8488, test_loss: 1.1959, test_f1: 0.4245
 epoch: 22, train_loss: 0.8456, test_loss: 0.9729, test_f1: 0.5821
 epoch: 23, train_loss: 0.8025, test_loss: 1.0069, test_f1: 0.5712
 epoch: 24, train_loss: 0.7879, test_loss: 1.2778, test_f1: 0.4838
 epoch: 25, train_loss: 0.8939, test_loss: 1.0510, test_f1: 0.5780
 epoch: 26, train_loss: 0.8375, test_loss: 1.0433, test_f1: 0.5733
 epoch: 27, train_loss: 0.8228, test_loss: 1.0625, test_f1: 0.5814
 epoch: 28, train_loss: 0.8130, test_loss: 1.0752, test_f1: 0.5711
 epoch: 29, train_loss: 0.7984, test_loss: 1.0507, test_f1: 0.5690
 epoch: 30, train_loss: 0.7949, test_loss: 1.3183, test_f1: 0.5729
 epoch: 31, train_loss: 0.8047, test_loss: 1.0564, test_f1: 0.5649
 epoch: 32, train_loss: 0.7702, test_loss: 1.1671, test_f1: 0.5651
 epoch: 33, train_loss: 0.7538, test_loss: 1.3240, test_f1: 0.5889
 epoch: 34, train_loss: 0.7542, test_loss: 1.1503, test_f1: 0.5417
 epoch: 35, train_loss: 0.7693, test_loss: 1.2446, test_f1: 0.5305
 epoch: 36, train_loss: 0.7893, test_loss: 1.4001, test_f1: 0.5659
 epoch: 37, train_loss: 0.7579, test_loss: 1.1568, test_f1: 0.5959
 epoch: 38, train_loss: 0.7392, test_loss: 1.1424, test_f1: 0.5675
 epoch: 39, train_loss: 0.7251, test_loss: 1.3430, test_f1: 0.5628
 epoch: 40, train_loss: 0.7172, test_loss: 1.6150, test_f1: 0.5382
 epoch: 41, train_loss: 0.7121, test_loss: 1.5177, test_f1: 0.5577
 epoch: 42, train_loss: 0.6978, test_loss: 1.1582, test_f1: 0.5738
 epoch: 43, train_loss: 0.7271, test_loss: 1.2475, test_f1: 0.5634
 epoch: 44, train_loss: 0.7253, test_loss: 1.0912, test_f1: 0.6216
 epoch: 45, train_loss: 0.7166, test_loss: 1.2289, test_f1: 0.5766
 epoch: 46, train_loss: 0.7148, test_loss: 1.3218, test_f1: 0.5739
 epoch: 47, train_loss: 0.6979, test_loss: 1.0678, test_f1: 0.5786
 epoch: 48, train_loss: 0.7096, test_loss: 1.0897, test_f1: 0.5932
 epoch: 49, train_loss: 0.7108, test_loss: 1.7415, test_f1: 0.5508
 epoch: 50, train_loss: 0.7114, test_loss: 1.1843, test_f1: 0.5376
 epoch: 51, train_loss: 0.6540, test_loss: 1.5087, test_f1: 0.5754
 epoch: 52, train_loss: 0.6418, test_loss: 1.5631, test_f1: 0.5758
 epoch: 53, train_loss: 0.6496, test_loss: 1.4822, test_f1: 0.5773
 epoch: 54, train_loss: 0.6357, test_loss: 1.3080, test_f1: 0.5626
 epoch: 55, train_loss: 0.6099, test_loss: 1.7448, test_f1: 0.5789
 epoch: 56, train_loss: 0.6131, test_loss: 1.4256, test_f1: 0.5831
 epoch: 57, train_loss: 0.6044, test_loss: 1.5325, test_f1: 0.5929
 epoch: 58, train_loss: 0.6205, test_loss: 1.4742, test_f1: 0.5197
 epoch: 59, train_loss: 0.6819, test_loss: 1.1494, test_f1: 0.5941
 epoch: 60, train_loss: 0.6247, test_loss: 1.5152, test_f1: 0.5890
 epoch: 61, train_loss: 0.6165, test_loss: 1.3977, test_f1: 0.5676
 epoch: 62, train_loss: 0.6263, test_loss: 1.7439, test_f1: 0.5762
 epoch: 63, train_loss: 0.5750, test_loss: 1.3276, test_f1: 0.6030
 epoch: 64, train_loss: 0.6291, test_loss: 1.4013, test_f1: 0.5895
 epoch: 65, train_loss: 0.5939, test_loss: 1.5543, test_f1: 0.5349
 epoch: 66, train_loss: 0.6059, test_loss: 1.5810, test_f1: 0.5676
 epoch: 67, train_loss: 0.5948, test_loss: 1.3576, test_f1: 0.5849
 epoch: 68, train_loss: 0.5636, test_loss: 1.5244, test_f1: 0.5885
 epoch: 69, train_loss: 0.6156, test_loss: 1.3885, test_f1: 0.6034
 epoch: 70, train_loss: 0.5761, test_loss: 1.9849, test_f1: 0.5463
 epoch: 71, train_loss: 0.5906, test_loss: 1.7032, test_f1: 0.6114
 epoch: 72, train_loss: 0.5947, test_loss: 1.5638, test_f1: 0.5795
 epoch: 73, train_loss: 0.5596, test_loss: 1.7158, test_f1: 0.5709
 epoch: 74, train_loss: 0.5552, test_loss: 1.8570, test_f1: 0.5724
 epoch: 75, train_loss: 0.5517, test_loss: 1.4139, test_f1: 0.5608
 epoch: 76, train_loss: 0.5618, test_loss: 1.6984, test_f1: 0.5917
 epoch: 77, train_loss: 0.5506, test_loss: 1.9452, test_f1: 0.5635
 epoch: 78, train_loss: 0.5519, test_loss: 1.9112, test_f1: 0.6175
 epoch: 79, train_loss: 0.5390, test_loss: 1.8846, test_f1: 0.6180
 epoch: 80, train_loss: 0.5350, test_loss: 2.3208, test_f1: 0.5683
 epoch: 81, train_loss: 0.5602, test_loss: 1.4267, test_f1: 0.5961
 epoch: 82, train_loss: 0.5909, test_loss: 2.0657, test_f1: 0.5416
 epoch: 83, train_loss: 0.5524, test_loss: 1.9670, test_f1: 0.5736
 epoch: 84, train_loss: 0.5399, test_loss: 2.2201, test_f1: 0.5792
 epoch: 85, train_loss: 0.5267, test_loss: 1.6036, test_f1: 0.5584
 epoch: 86, train_loss: 0.5331, test_loss: 1.3463, test_f1: 0.5649
 epoch: 87, train_loss: 0.5345, test_loss: 1.4643, test_f1: 0.5564
 epoch: 88, train_loss: 0.5444, test_loss: 1.9424, test_f1: 0.5560
 epoch: 89, train_loss: 0.5358, test_loss: 2.1590, test_f1: 0.5294
 epoch: 90, train_loss: 0.5351, test_loss: 1.7258, test_f1: 0.6034
 epoch: 91, train_loss: 0.5476, test_loss: 2.4295, test_f1: 0.5832
 epoch: 92, train_loss: 0.5461, test_loss: 1.7798, test_f1: 0.5968
 epoch: 93, train_loss: 0.5382, test_loss: 1.9238, test_f1: 0.5807
 epoch: 94, train_loss: 0.5189, test_loss: 2.1945, test_f1: 0.5857
 epoch: 95, train_loss: 0.5196, test_loss: 2.2122, test_f1: 0.6430
 epoch: 96, train_loss: 0.5345, test_loss: 1.6623, test_f1: 0.5459
 epoch: 97, train_loss: 0.5332, test_loss: 1.9722, test_f1: 0.5492
 epoch: 98, train_loss: 0.5144, test_loss: 1.5389, test_f1: 0.5691
 epoch: 99, train_loss: 0.5274, test_loss: 1.6301, test_f1: 0.5843
##################ITERATION #6 ****************************************
 epoch: 0, train_loss: 1.2353, test_loss: 1.3426, test_f1: 0.4155
 epoch: 1, train_loss: 1.0725, test_loss: 1.3989, test_f1: 0.3516
 epoch: 2, train_loss: 1.0159, test_loss: 1.1873, test_f1: 0.3993
 epoch: 3, train_loss: 0.9606, test_loss: 1.1394, test_f1: 0.4568
 epoch: 4, train_loss: 0.9687, test_loss: 1.0500, test_f1: 0.4954
 epoch: 5, train_loss: 0.9067, test_loss: 1.0467, test_f1: 0.5161
 epoch: 6, train_loss: 0.8989, test_loss: 1.0599, test_f1: 0.4753
 epoch: 7, train_loss: 0.8847, test_loss: 1.0687, test_f1: 0.5482
 epoch: 8, train_loss: 0.9234, test_loss: 1.0773, test_f1: 0.5400
 epoch: 9, train_loss: 0.9072, test_loss: 1.0023, test_f1: 0.5504
 epoch: 10, train_loss: 0.8881, test_loss: 1.4133, test_f1: 0.5086
 epoch: 11, train_loss: 0.9017, test_loss: 0.9778, test_f1: 0.5823
 epoch: 12, train_loss: 0.8581, test_loss: 1.1093, test_f1: 0.4958
 epoch: 13, train_loss: 0.8637, test_loss: 1.0731, test_f1: 0.5157
 epoch: 14, train_loss: 0.8486, test_loss: 1.0082, test_f1: 0.5493
 epoch: 15, train_loss: 0.8427, test_loss: 1.0444, test_f1: 0.5152
 epoch: 16, train_loss: 0.8232, test_loss: 1.0539, test_f1: 0.5620
 epoch: 17, train_loss: 0.8418, test_loss: 1.0753, test_f1: 0.5402
 epoch: 18, train_loss: 0.8262, test_loss: 1.1510, test_f1: 0.5816
 epoch: 19, train_loss: 0.8151, test_loss: 0.9851, test_f1: 0.5874
 epoch: 20, train_loss: 0.8158, test_loss: 1.0188, test_f1: 0.5791
 epoch: 21, train_loss: 0.8135, test_loss: 1.1716, test_f1: 0.5113
 epoch: 22, train_loss: 0.8053, test_loss: 1.0511, test_f1: 0.5346
 epoch: 23, train_loss: 0.7879, test_loss: 1.1637, test_f1: 0.5033
 epoch: 24, train_loss: 0.8080, test_loss: 0.9924, test_f1: 0.5715
 epoch: 25, train_loss: 0.7738, test_loss: 1.0577, test_f1: 0.5628
 epoch: 26, train_loss: 0.7683, test_loss: 1.2622, test_f1: 0.5334
 epoch: 27, train_loss: 0.8176, test_loss: 1.0797, test_f1: 0.5239
 epoch: 28, train_loss: 0.8268, test_loss: 1.1649, test_f1: 0.5494
 epoch: 29, train_loss: 0.7532, test_loss: 1.0794, test_f1: 0.5515
 epoch: 30, train_loss: 0.7469, test_loss: 1.1154, test_f1: 0.5304
 epoch: 31, train_loss: 0.7636, test_loss: 1.1065, test_f1: 0.5442
 epoch: 32, train_loss: 0.7744, test_loss: 1.1367, test_f1: 0.5313
 epoch: 33, train_loss: 0.7512, test_loss: 1.0768, test_f1: 0.5693
 epoch: 34, train_loss: 0.7442, test_loss: 1.1784, test_f1: 0.5565
 epoch: 35, train_loss: 0.7379, test_loss: 1.1998, test_f1: 0.5578
 epoch: 36, train_loss: 0.7564, test_loss: 1.0372, test_f1: 0.6071
 epoch: 37, train_loss: 0.7219, test_loss: 1.1658, test_f1: 0.6361
 epoch: 38, train_loss: 0.7152, test_loss: 1.2022, test_f1: 0.5540
 epoch: 39, train_loss: 0.7401, test_loss: 1.3263, test_f1: 0.5571
 epoch: 40, train_loss: 0.7413, test_loss: 1.2309, test_f1: 0.5208
 epoch: 41, train_loss: 0.7013, test_loss: 1.3146, test_f1: 0.5931
 epoch: 42, train_loss: 0.7556, test_loss: 1.4626, test_f1: 0.5013
 epoch: 43, train_loss: 0.7418, test_loss: 0.9856, test_f1: 0.6162
 epoch: 44, train_loss: 0.7085, test_loss: 2.1519, test_f1: 0.4360
 epoch: 45, train_loss: 0.7746, test_loss: 1.0412, test_f1: 0.5613
 epoch: 46, train_loss: 0.7477, test_loss: 1.0763, test_f1: 0.5290
 epoch: 47, train_loss: 0.7436, test_loss: 1.1731, test_f1: 0.5226
 epoch: 48, train_loss: 0.7323, test_loss: 1.1202, test_f1: 0.5896
 epoch: 49, train_loss: 0.7322, test_loss: 1.3200, test_f1: 0.4923
 epoch: 50, train_loss: 0.7022, test_loss: 1.0351, test_f1: 0.5982
 epoch: 51, train_loss: 0.6686, test_loss: 1.1610, test_f1: 0.6204
 epoch: 52, train_loss: 0.6368, test_loss: 1.1728, test_f1: 0.6235
 epoch: 53, train_loss: 0.6399, test_loss: 1.1872, test_f1: 0.6065
 epoch: 54, train_loss: 0.6261, test_loss: 1.2442, test_f1: 0.6221
 epoch: 55, train_loss: 0.6487, test_loss: 1.1907, test_f1: 0.6066
 epoch: 56, train_loss: 0.6372, test_loss: 1.1660, test_f1: 0.5966
 epoch: 57, train_loss: 0.6215, test_loss: 1.1750, test_f1: 0.5663
 epoch: 58, train_loss: 0.6000, test_loss: 1.3885, test_f1: 0.5973
 epoch: 59, train_loss: 0.6065, test_loss: 1.2968, test_f1: 0.5286
 epoch: 60, train_loss: 0.6348, test_loss: 1.2150, test_f1: 0.5674
 epoch: 61, train_loss: 0.6003, test_loss: 1.2754, test_f1: 0.5649
 epoch: 62, train_loss: 0.5864, test_loss: 1.4328, test_f1: 0.5538
 epoch: 63, train_loss: 0.5931, test_loss: 1.3946, test_f1: 0.5761
 epoch: 64, train_loss: 0.5819, test_loss: 1.4024, test_f1: 0.5891
 epoch: 65, train_loss: 0.5903, test_loss: 1.5374, test_f1: 0.5989
 epoch: 66, train_loss: 0.5868, test_loss: 1.4244, test_f1: 0.5943
 epoch: 67, train_loss: 0.5674, test_loss: 1.3568, test_f1: 0.6405
 epoch: 68, train_loss: 0.5895, test_loss: 1.5358, test_f1: 0.5966
 epoch: 69, train_loss: 0.5823, test_loss: 1.4290, test_f1: 0.5979
 epoch: 70, train_loss: 0.5684, test_loss: 1.4559, test_f1: 0.5871
 epoch: 71, train_loss: 0.5556, test_loss: 1.5730, test_f1: 0.5703
 epoch: 72, train_loss: 0.5909, test_loss: 1.3029, test_f1: 0.6062
 epoch: 73, train_loss: 0.5811, test_loss: 1.5303, test_f1: 0.5867
 epoch: 74, train_loss: 0.5467, test_loss: 1.5984, test_f1: 0.5683
 epoch: 75, train_loss: 0.5406, test_loss: 1.6178, test_f1: 0.6103
 epoch: 76, train_loss: 0.5426, test_loss: 1.5133, test_f1: 0.5712
 epoch: 77, train_loss: 0.5346, test_loss: 2.1523, test_f1: 0.5601
 epoch: 78, train_loss: 0.5481, test_loss: 1.5695, test_f1: 0.5548
 epoch: 79, train_loss: 0.5483, test_loss: 1.4816, test_f1: 0.5959
 epoch: 80, train_loss: 0.5263, test_loss: 1.3732, test_f1: 0.5878
 epoch: 81, train_loss: 0.5256, test_loss: 1.4102, test_f1: 0.6022
 epoch: 82, train_loss: 0.5229, test_loss: 1.4324, test_f1: 0.5784
 epoch: 83, train_loss: 0.5113, test_loss: 1.6293, test_f1: 0.5644
 epoch: 84, train_loss: 0.5115, test_loss: 1.5395, test_f1: 0.5686
 epoch: 85, train_loss: 0.5421, test_loss: 1.5741, test_f1: 0.5771
 epoch: 86, train_loss: 0.5416, test_loss: 1.3644, test_f1: 0.5693
 epoch: 87, train_loss: 0.5434, test_loss: 1.3806, test_f1: 0.6303
 epoch: 88, train_loss: 0.5159, test_loss: 1.2650, test_f1: 0.6221
 epoch: 89, train_loss: 0.5199, test_loss: 1.3408, test_f1: 0.6181
 epoch: 90, train_loss: 0.4978, test_loss: 1.3227, test_f1: 0.5764
 epoch: 91, train_loss: 0.4980, test_loss: 1.4137, test_f1: 0.6161
 epoch: 92, train_loss: 0.4999, test_loss: 1.9259, test_f1: 0.5709
 epoch: 93, train_loss: 0.5302, test_loss: 1.4655, test_f1: 0.5993
 epoch: 94, train_loss: 0.5029, test_loss: 1.4416, test_f1: 0.5877
 epoch: 95, train_loss: 0.5240, test_loss: 1.5027, test_f1: 0.5750
 epoch: 96, train_loss: 0.5001, test_loss: 2.0025, test_f1: 0.6509
 epoch: 97, train_loss: 0.4638, test_loss: 1.5257, test_f1: 0.6205
 epoch: 98, train_loss: 0.5020, test_loss: 1.5004, test_f1: 0.6270
 epoch: 99, train_loss: 0.4923, test_loss: 1.9848, test_f1: 0.5508
##################ITERATION #7 ****************************************
 epoch: 0, train_loss: 1.2318, test_loss: 1.1427, test_f1: 0.4885
 epoch: 1, train_loss: 1.0621, test_loss: 1.0766, test_f1: 0.4706
 epoch: 2, train_loss: 0.9691, test_loss: 1.1336, test_f1: 0.4293
 epoch: 3, train_loss: 0.9474, test_loss: 1.0757, test_f1: 0.4608
 epoch: 4, train_loss: 0.9052, test_loss: 0.9807, test_f1: 0.5474
 epoch: 5, train_loss: 0.8920, test_loss: 1.0982, test_f1: 0.5400
 epoch: 6, train_loss: 0.9113, test_loss: 1.0788, test_f1: 0.5213
 epoch: 7, train_loss: 0.8915, test_loss: 1.0558, test_f1: 0.5104
 epoch: 8, train_loss: 0.9323, test_loss: 0.9377, test_f1: 0.5588
 epoch: 9, train_loss: 0.8623, test_loss: 0.9653, test_f1: 0.5643
 epoch: 10, train_loss: 0.8517, test_loss: 0.9958, test_f1: 0.5863
 epoch: 11, train_loss: 0.8396, test_loss: 0.9095, test_f1: 0.5926
 epoch: 12, train_loss: 0.8534, test_loss: 0.9777, test_f1: 0.5206
 epoch: 13, train_loss: 0.8309, test_loss: 1.0623, test_f1: 0.5070
 epoch: 14, train_loss: 0.7978, test_loss: 0.9649, test_f1: 0.5877
 epoch: 15, train_loss: 0.7963, test_loss: 1.1999, test_f1: 0.5128
 epoch: 16, train_loss: 0.7895, test_loss: 0.9739, test_f1: 0.5432
 epoch: 17, train_loss: 0.8225, test_loss: 1.0108, test_f1: 0.4962
 epoch: 18, train_loss: 0.8018, test_loss: 0.9464, test_f1: 0.5480
 epoch: 19, train_loss: 0.7779, test_loss: 0.9635, test_f1: 0.5820
 epoch: 20, train_loss: 0.7915, test_loss: 1.1184, test_f1: 0.5679
 epoch: 21, train_loss: 0.7920, test_loss: 0.9839, test_f1: 0.5759
 epoch: 22, train_loss: 0.8002, test_loss: 0.9902, test_f1: 0.5780
 epoch: 23, train_loss: 0.7909, test_loss: 0.9856, test_f1: 0.5990
 epoch: 24, train_loss: 0.7742, test_loss: 0.9512, test_f1: 0.5764
 epoch: 25, train_loss: 0.7718, test_loss: 1.0078, test_f1: 0.6061
 epoch: 26, train_loss: 0.7656, test_loss: 1.0757, test_f1: 0.5350
 epoch: 27, train_loss: 0.7776, test_loss: 0.9482, test_f1: 0.5097
 epoch: 28, train_loss: 0.7797, test_loss: 1.0357, test_f1: 0.5787
 epoch: 29, train_loss: 0.7774, test_loss: 0.9171, test_f1: 0.5633
 epoch: 30, train_loss: 0.7331, test_loss: 0.9964, test_f1: 0.5852
 epoch: 31, train_loss: 0.7497, test_loss: 1.0070, test_f1: 0.5989
 epoch: 32, train_loss: 0.7266, test_loss: 1.0832, test_f1: 0.5607
 epoch: 33, train_loss: 0.7525, test_loss: 1.0191, test_f1: 0.6134
 epoch: 34, train_loss: 0.7314, test_loss: 1.0186, test_f1: 0.6118
 epoch: 35, train_loss: 0.7230, test_loss: 1.1330, test_f1: 0.5440
 epoch: 36, train_loss: 0.6921, test_loss: 1.0229, test_f1: 0.5979
 epoch: 37, train_loss: 0.7041, test_loss: 1.0669, test_f1: 0.5553
 epoch: 38, train_loss: 0.6985, test_loss: 1.0436, test_f1: 0.6060
 epoch: 39, train_loss: 0.7036, test_loss: 1.0265, test_f1: 0.5098
 epoch: 40, train_loss: 0.7178, test_loss: 1.0343, test_f1: 0.5764
 epoch: 41, train_loss: 0.7060, test_loss: 0.9987, test_f1: 0.6029
 epoch: 42, train_loss: 0.6868, test_loss: 1.1311, test_f1: 0.5815
 epoch: 43, train_loss: 0.7673, test_loss: 1.0810, test_f1: 0.5858
 epoch: 44, train_loss: 0.7413, test_loss: 1.2658, test_f1: 0.5125
 epoch: 45, train_loss: 0.7283, test_loss: 1.1720, test_f1: 0.5416
 epoch: 46, train_loss: 0.7121, test_loss: 1.2749, test_f1: 0.5806
 epoch: 47, train_loss: 0.7107, test_loss: 1.0262, test_f1: 0.5784
 epoch: 48, train_loss: 0.6788, test_loss: 1.0830, test_f1: 0.5512
 epoch: 49, train_loss: 0.6903, test_loss: 1.1741, test_f1: 0.5922
 epoch: 50, train_loss: 0.7095, test_loss: 1.2181, test_f1: 0.5684
 epoch: 51, train_loss: 0.7886, test_loss: 1.2142, test_f1: 0.5715
 epoch: 52, train_loss: 0.7087, test_loss: 1.1031, test_f1: 0.5365
 epoch: 53, train_loss: 0.6725, test_loss: 1.1740, test_f1: 0.5933
 epoch: 54, train_loss: 0.6298, test_loss: 1.1483, test_f1: 0.5930
 epoch: 55, train_loss: 0.6270, test_loss: 1.1850, test_f1: 0.5636
 epoch: 56, train_loss: 0.6175, test_loss: 1.3099, test_f1: 0.6002
 epoch: 57, train_loss: 0.6098, test_loss: 1.2286, test_f1: 0.6259
 epoch: 58, train_loss: 0.5972, test_loss: 1.2949, test_f1: 0.5827
 epoch: 59, train_loss: 0.6049, test_loss: 1.3076, test_f1: 0.5647
 epoch: 60, train_loss: 0.5971, test_loss: 1.2048, test_f1: 0.6022
 epoch: 61, train_loss: 0.5700, test_loss: 1.2239, test_f1: 0.6226
 epoch: 62, train_loss: 0.5637, test_loss: 1.3087, test_f1: 0.6167
 epoch: 63, train_loss: 0.5925, test_loss: 1.2573, test_f1: 0.5916
 epoch: 64, train_loss: 0.5628, test_loss: 1.2201, test_f1: 0.6101
 epoch: 65, train_loss: 0.5416, test_loss: 1.3796, test_f1: 0.5403
 epoch: 66, train_loss: 0.5458, test_loss: 1.3346, test_f1: 0.5532
 epoch: 67, train_loss: 0.5369, test_loss: 1.2769, test_f1: 0.6011
 epoch: 68, train_loss: 0.5454, test_loss: 1.2411, test_f1: 0.6091
 epoch: 69, train_loss: 0.5406, test_loss: 1.3782, test_f1: 0.5822
 epoch: 70, train_loss: 0.5351, test_loss: 1.3295, test_f1: 0.5930
 epoch: 71, train_loss: 0.5155, test_loss: 1.3294, test_f1: 0.5694
 epoch: 72, train_loss: 0.5275, test_loss: 1.2397, test_f1: 0.5798
 epoch: 73, train_loss: 0.5301, test_loss: 1.3145, test_f1: 0.5731
 epoch: 74, train_loss: 0.5229, test_loss: 1.2329, test_f1: 0.5802
 epoch: 75, train_loss: 0.4751, test_loss: 1.3887, test_f1: 0.6019
 epoch: 76, train_loss: 0.5130, test_loss: 1.4284, test_f1: 0.5609
 epoch: 77, train_loss: 0.4940, test_loss: 1.2760, test_f1: 0.6020
 epoch: 78, train_loss: 0.5001, test_loss: 1.3744, test_f1: 0.6165
 epoch: 79, train_loss: 0.4928, test_loss: 1.2262, test_f1: 0.6083
 epoch: 80, train_loss: 0.4696, test_loss: 1.3536, test_f1: 0.6193
 epoch: 81, train_loss: 0.5023, test_loss: 1.4644, test_f1: 0.5732
 epoch: 82, train_loss: 0.4730, test_loss: 1.3144, test_f1: 0.6258
 epoch: 83, train_loss: 0.4837, test_loss: 1.5231, test_f1: 0.5445
 epoch: 84, train_loss: 0.4844, test_loss: 1.4104, test_f1: 0.5709
 epoch: 85, train_loss: 0.4959, test_loss: 1.4187, test_f1: 0.5832
 epoch: 86, train_loss: 0.4611, test_loss: 1.4420, test_f1: 0.6028
 epoch: 87, train_loss: 0.4670, test_loss: 1.4023, test_f1: 0.5975
 epoch: 88, train_loss: 0.4961, test_loss: 1.4325, test_f1: 0.5496
 epoch: 89, train_loss: 0.4660, test_loss: 1.3859, test_f1: 0.6208
 epoch: 90, train_loss: 0.4577, test_loss: 1.6180, test_f1: 0.5310
 epoch: 91, train_loss: 0.4318, test_loss: 1.4196, test_f1: 0.5842
 epoch: 92, train_loss: 0.4600, test_loss: 1.3742, test_f1: 0.6054
 epoch: 93, train_loss: 0.4488, test_loss: 1.7015, test_f1: 0.6073
 epoch: 94, train_loss: 0.4798, test_loss: 1.3817, test_f1: 0.6202
 epoch: 95, train_loss: 0.4442, test_loss: 1.4445, test_f1: 0.5996
 epoch: 96, train_loss: 0.4555, test_loss: 1.5233, test_f1: 0.6069
 epoch: 97, train_loss: 0.4378, test_loss: 1.5984, test_f1: 0.5986
 epoch: 98, train_loss: 0.4350, test_loss: 1.5924, test_f1: 0.6064
 epoch: 99, train_loss: 0.4552, test_loss: 1.3749, test_f1: 0.6146
##################ITERATION #8 ****************************************
 epoch: 0, train_loss: 1.2493, test_loss: 1.2909, test_f1: 0.2953
 epoch: 1, train_loss: 1.0709, test_loss: 1.9668, test_f1: 0.1805
 epoch: 2, train_loss: 0.9829, test_loss: 1.0637, test_f1: 0.5289
 epoch: 3, train_loss: 0.9310, test_loss: 1.3098, test_f1: 0.4838
 epoch: 4, train_loss: 0.9327, test_loss: 1.2475, test_f1: 0.4938
 epoch: 5, train_loss: 0.9091, test_loss: 1.0022, test_f1: 0.5017
 epoch: 6, train_loss: 0.9051, test_loss: 1.0209, test_f1: 0.5362
 epoch: 7, train_loss: 0.9048, test_loss: 1.1389, test_f1: 0.4647
 epoch: 8, train_loss: 0.8734, test_loss: 1.0245, test_f1: 0.5521
 epoch: 9, train_loss: 0.8399, test_loss: 1.0040, test_f1: 0.5529
 epoch: 10, train_loss: 0.8642, test_loss: 1.0418, test_f1: 0.5087
 epoch: 11, train_loss: 0.8862, test_loss: 1.0066, test_f1: 0.4325
 epoch: 12, train_loss: 0.8593, test_loss: 1.0864, test_f1: 0.4803
 epoch: 13, train_loss: 0.8354, test_loss: 1.1875, test_f1: 0.5126
 epoch: 14, train_loss: 0.8433, test_loss: 1.0290, test_f1: 0.5029
 epoch: 15, train_loss: 0.8240, test_loss: 0.9917, test_f1: 0.5696
 epoch: 16, train_loss: 0.8338, test_loss: 1.0018, test_f1: 0.5527
 epoch: 17, train_loss: 0.7959, test_loss: 1.0420, test_f1: 0.5356
 epoch: 18, train_loss: 0.8284, test_loss: 1.0546, test_f1: 0.4879
 epoch: 19, train_loss: 0.8447, test_loss: 1.0437, test_f1: 0.6015
 epoch: 20, train_loss: 0.8191, test_loss: 1.0396, test_f1: 0.5601
 epoch: 21, train_loss: 0.8194, test_loss: 1.0192, test_f1: 0.5513
 epoch: 22, train_loss: 0.7928, test_loss: 1.0636, test_f1: 0.5612
 epoch: 23, train_loss: 0.7938, test_loss: 0.9882, test_f1: 0.5601
 epoch: 24, train_loss: 0.8109, test_loss: 1.2002, test_f1: 0.4902
 epoch: 25, train_loss: 0.7555, test_loss: 1.2663, test_f1: 0.5692
 epoch: 26, train_loss: 0.8001, test_loss: 1.1616, test_f1: 0.5661
 epoch: 27, train_loss: 0.7749, test_loss: 1.0110, test_f1: 0.6102
 epoch: 28, train_loss: 0.7942, test_loss: 1.0897, test_f1: 0.5372
 epoch: 29, train_loss: 0.7573, test_loss: 1.0147, test_f1: 0.5517
 epoch: 30, train_loss: 0.7680, test_loss: 1.4438, test_f1: 0.5301
 epoch: 31, train_loss: 0.7732, test_loss: 1.0653, test_f1: 0.5163
 epoch: 32, train_loss: 0.7525, test_loss: 1.0261, test_f1: 0.5956
 epoch: 33, train_loss: 0.7371, test_loss: 1.2524, test_f1: 0.5791
 epoch: 34, train_loss: 0.7207, test_loss: 1.1037, test_f1: 0.5610
 epoch: 35, train_loss: 0.7458, test_loss: 1.8755, test_f1: 0.5094
 epoch: 36, train_loss: 0.7383, test_loss: 1.0115, test_f1: 0.5854
 epoch: 37, train_loss: 0.7351, test_loss: 1.1657, test_f1: 0.5968
 epoch: 38, train_loss: 0.7303, test_loss: 1.5605, test_f1: 0.5480
 epoch: 39, train_loss: 0.7225, test_loss: 1.4837, test_f1: 0.5563
 epoch: 40, train_loss: 0.7253, test_loss: 1.3215, test_f1: 0.5504
 epoch: 41, train_loss: 0.7130, test_loss: 1.5163, test_f1: 0.5299
 epoch: 42, train_loss: 0.7487, test_loss: 1.4736, test_f1: 0.5438
 epoch: 43, train_loss: 0.7122, test_loss: 1.7277, test_f1: 0.5321
 epoch: 44, train_loss: 0.7251, test_loss: 2.0846, test_f1: 0.5517
 epoch: 45, train_loss: 0.6970, test_loss: 2.4436, test_f1: 0.4072
 epoch: 46, train_loss: 0.9389, test_loss: 1.4209, test_f1: 0.5254
 epoch: 47, train_loss: 0.8208, test_loss: 1.1715, test_f1: 0.5927
 epoch: 48, train_loss: 0.7610, test_loss: 1.4760, test_f1: 0.5060
 epoch: 49, train_loss: 0.7649, test_loss: 1.7557, test_f1: 0.5987
 epoch: 50, train_loss: 0.7069, test_loss: 2.1022, test_f1: 0.5250
 epoch: 51, train_loss: 0.6826, test_loss: 2.0536, test_f1: 0.5857
 epoch: 52, train_loss: 0.6782, test_loss: 1.9043, test_f1: 0.5840
 epoch: 53, train_loss: 0.6508, test_loss: 1.9160, test_f1: 0.5641
 epoch: 54, train_loss: 0.6548, test_loss: 1.9784, test_f1: 0.5433
 epoch: 55, train_loss: 0.6282, test_loss: 2.2161, test_f1: 0.5561
 epoch: 56, train_loss: 0.6199, test_loss: 2.3661, test_f1: 0.5729
 epoch: 57, train_loss: 0.6424, test_loss: 2.4572, test_f1: 0.5813
 epoch: 58, train_loss: 0.6225, test_loss: 2.4139, test_f1: 0.5825
 epoch: 59, train_loss: 0.5954, test_loss: 2.3159, test_f1: 0.5708
 epoch: 60, train_loss: 0.6168, test_loss: 2.3467, test_f1: 0.5668
 epoch: 61, train_loss: 0.5717, test_loss: 2.6779, test_f1: 0.5819
 epoch: 62, train_loss: 0.5705, test_loss: 1.8896, test_f1: 0.5727
 epoch: 63, train_loss: 0.5708, test_loss: 2.4960, test_f1: 0.5959
 epoch: 64, train_loss: 0.5509, test_loss: 2.8029, test_f1: 0.5680
 epoch: 65, train_loss: 0.5832, test_loss: 1.9592, test_f1: 0.5776
 epoch: 66, train_loss: 0.5521, test_loss: 2.4187, test_f1: 0.5432
 epoch: 67, train_loss: 0.5706, test_loss: 2.7274, test_f1: 0.5589
 epoch: 68, train_loss: 0.5694, test_loss: 3.1263, test_f1: 0.5839
 epoch: 69, train_loss: 0.5385, test_loss: 2.5363, test_f1: 0.5709
 epoch: 70, train_loss: 0.5412, test_loss: 2.0442, test_f1: 0.6190
 epoch: 71, train_loss: 0.5313, test_loss: 2.3995, test_f1: 0.6102
 epoch: 72, train_loss: 0.5043, test_loss: 2.2797, test_f1: 0.6074
 epoch: 73, train_loss: 0.5380, test_loss: 2.8020, test_f1: 0.5528
 epoch: 74, train_loss: 0.5261, test_loss: 2.6954, test_f1: 0.5480
 epoch: 75, train_loss: 0.5376, test_loss: 2.3605, test_f1: 0.6046
 epoch: 76, train_loss: 0.5003, test_loss: 2.2137, test_f1: 0.5773
 epoch: 77, train_loss: 0.5311, test_loss: 2.3375, test_f1: 0.5647
 epoch: 78, train_loss: 0.5071, test_loss: 2.2573, test_f1: 0.5715
 epoch: 79, train_loss: 0.4808, test_loss: 2.3231, test_f1: 0.5567
 epoch: 80, train_loss: 0.4764, test_loss: 3.0302, test_f1: 0.5904
 epoch: 81, train_loss: 0.4849, test_loss: 2.1822, test_f1: 0.5727
 epoch: 82, train_loss: 0.4908, test_loss: 2.4193, test_f1: 0.5947
 epoch: 83, train_loss: 0.4850, test_loss: 2.9458, test_f1: 0.6011
 epoch: 84, train_loss: 0.4902, test_loss: 2.2749, test_f1: 0.5889
 epoch: 85, train_loss: 0.4626, test_loss: 3.4601, test_f1: 0.5241
 epoch: 86, train_loss: 0.4796, test_loss: 1.5996, test_f1: 0.5959
 epoch: 87, train_loss: 0.4811, test_loss: 2.9632, test_f1: 0.5858
 epoch: 88, train_loss: 0.4550, test_loss: 2.2433, test_f1: 0.5964
 epoch: 89, train_loss: 0.4207, test_loss: 2.3166, test_f1: 0.5342
 epoch: 90, train_loss: 0.4522, test_loss: 1.7780, test_f1: 0.5744
 epoch: 91, train_loss: 0.4740, test_loss: 2.8799, test_f1: 0.5290
 epoch: 92, train_loss: 0.4316, test_loss: 2.4544, test_f1: 0.5616
 epoch: 93, train_loss: 0.4310, test_loss: 3.9656, test_f1: 0.4915
 epoch: 94, train_loss: 0.4503, test_loss: 2.5781, test_f1: 0.5454
 epoch: 95, train_loss: 0.4220, test_loss: 2.9342, test_f1: 0.5535
 epoch: 96, train_loss: 0.4017, test_loss: 2.8318, test_f1: 0.5347
 epoch: 97, train_loss: 0.4804, test_loss: 2.7561, test_f1: 0.5807
 epoch: 98, train_loss: 0.4436, test_loss: 2.7957, test_f1: 0.5612
 epoch: 99, train_loss: 0.4435, test_loss: 2.9684, test_f1: 0.5649
##################ITERATION #9 ****************************************
 epoch: 0, train_loss: 1.2676, test_loss: 1.2558, test_f1: 0.3476
 epoch: 1, train_loss: 1.0599, test_loss: 1.1556, test_f1: 0.4944
 epoch: 2, train_loss: 0.9800, test_loss: 1.0959, test_f1: 0.5311
 epoch: 3, train_loss: 0.9543, test_loss: 1.1469, test_f1: 0.5021
 epoch: 4, train_loss: 0.9369, test_loss: 1.0341, test_f1: 0.5715
 epoch: 5, train_loss: 0.8995, test_loss: 1.1278, test_f1: 0.4282
 epoch: 6, train_loss: 0.8897, test_loss: 0.9999, test_f1: 0.5621
 epoch: 7, train_loss: 0.8881, test_loss: 1.0253, test_f1: 0.5410
 epoch: 8, train_loss: 0.8592, test_loss: 1.0249, test_f1: 0.5269
 epoch: 9, train_loss: 0.8252, test_loss: 1.0938, test_f1: 0.5254
 epoch: 10, train_loss: 0.8351, test_loss: 1.2175, test_f1: 0.5995
 epoch: 11, train_loss: 0.8518, test_loss: 1.0573, test_f1: 0.5145
 epoch: 12, train_loss: 0.8628, test_loss: 0.9991, test_f1: 0.5831
 epoch: 13, train_loss: 0.8301, test_loss: 1.0099, test_f1: 0.5335
 epoch: 14, train_loss: 0.8281, test_loss: 1.0431, test_f1: 0.5516
 epoch: 15, train_loss: 0.7893, test_loss: 1.0280, test_f1: 0.5720
 epoch: 16, train_loss: 0.7789, test_loss: 1.0606, test_f1: 0.5703
 epoch: 17, train_loss: 0.7899, test_loss: 1.0485, test_f1: 0.5602
 epoch: 18, train_loss: 0.7718, test_loss: 1.1302, test_f1: 0.5411
 epoch: 19, train_loss: 0.7587, test_loss: 1.2136, test_f1: 0.5334
 epoch: 20, train_loss: 0.7595, test_loss: 2.1471, test_f1: 0.3955
 epoch: 21, train_loss: 0.7748, test_loss: 1.1548, test_f1: 0.5576
 epoch: 22, train_loss: 0.8262, test_loss: 1.0604, test_f1: 0.6211
 epoch: 23, train_loss: 0.8440, test_loss: 1.2949, test_f1: 0.5607
 epoch: 24, train_loss: 0.7827, test_loss: 0.9639, test_f1: 0.5611
 epoch: 25, train_loss: 0.7522, test_loss: 1.1806, test_f1: 0.4740
 epoch: 26, train_loss: 0.7890, test_loss: 1.0548, test_f1: 0.5506
 epoch: 27, train_loss: 0.7488, test_loss: 1.1055, test_f1: 0.5080
 epoch: 28, train_loss: 0.7416, test_loss: 1.0618, test_f1: 0.5663
 epoch: 29, train_loss: 0.7348, test_loss: 1.0518, test_f1: 0.5598
 epoch: 30, train_loss: 0.7348, test_loss: 1.1083, test_f1: 0.5729
 epoch: 31, train_loss: 0.7264, test_loss: 1.0423, test_f1: 0.5942
 epoch: 32, train_loss: 0.7328, test_loss: 1.1799, test_f1: 0.5741
 epoch: 33, train_loss: 0.7184, test_loss: 1.1867, test_f1: 0.5661
 epoch: 34, train_loss: 0.7368, test_loss: 1.1242, test_f1: 0.5302
 epoch: 35, train_loss: 0.7070, test_loss: 1.4426, test_f1: 0.5220
 epoch: 36, train_loss: 0.7213, test_loss: 1.0647, test_f1: 0.5480
 epoch: 37, train_loss: 0.7349, test_loss: 1.2093, test_f1: 0.5320
 epoch: 38, train_loss: 0.6901, test_loss: 1.1411, test_f1: 0.5309
 epoch: 39, train_loss: 0.6941, test_loss: 1.1871, test_f1: 0.6211
 epoch: 40, train_loss: 0.7066, test_loss: 1.2918, test_f1: 0.5469
 epoch: 41, train_loss: 0.7061, test_loss: 1.1592, test_f1: 0.5542
 epoch: 42, train_loss: 0.6952, test_loss: 1.1451, test_f1: 0.6117
 epoch: 43, train_loss: 0.6762, test_loss: 1.2260, test_f1: 0.6184
 epoch: 44, train_loss: 0.6902, test_loss: 1.1455, test_f1: 0.5756
 epoch: 45, train_loss: 0.6884, test_loss: 1.2336, test_f1: 0.5496
 epoch: 46, train_loss: 0.6981, test_loss: 1.3021, test_f1: 0.5796
 epoch: 47, train_loss: 0.6403, test_loss: 1.3550, test_f1: 0.5883
 epoch: 48, train_loss: 0.6581, test_loss: 1.3589, test_f1: 0.5898
 epoch: 49, train_loss: 0.6892, test_loss: 1.1729, test_f1: 0.5777
 epoch: 50, train_loss: 0.6477, test_loss: 1.6382, test_f1: 0.5753
 epoch: 51, train_loss: 0.6257, test_loss: 1.2492, test_f1: 0.6244
 epoch: 52, train_loss: 0.6021, test_loss: 1.4338, test_f1: 0.6010
 epoch: 53, train_loss: 0.5747, test_loss: 1.2247, test_f1: 0.6076
 epoch: 54, train_loss: 0.5591, test_loss: 1.6026, test_f1: 0.6037
 epoch: 55, train_loss: 0.5594, test_loss: 1.6016, test_f1: 0.5551
 epoch: 56, train_loss: 0.5911, test_loss: 1.5978, test_f1: 0.5863
 epoch: 57, train_loss: 0.5969, test_loss: 1.2305, test_f1: 0.6260
 epoch: 58, train_loss: 0.5620, test_loss: 1.2235, test_f1: 0.5940
 epoch: 59, train_loss: 0.5729, test_loss: 1.3523, test_f1: 0.5769
 epoch: 60, train_loss: 0.5583, test_loss: 1.5147, test_f1: 0.5986
 epoch: 61, train_loss: 0.5348, test_loss: 1.7117, test_f1: 0.5574
 epoch: 62, train_loss: 0.5508, test_loss: 1.4961, test_f1: 0.5858
 epoch: 63, train_loss: 0.5494, test_loss: 1.5806, test_f1: 0.5752
 epoch: 64, train_loss: 0.5351, test_loss: 1.7917, test_f1: 0.5612
 epoch: 65, train_loss: 0.5317, test_loss: 1.7616, test_f1: 0.5670
 epoch: 66, train_loss: 0.5346, test_loss: 1.9222, test_f1: 0.5735
 epoch: 67, train_loss: 0.5433, test_loss: 1.8094, test_f1: 0.5615
 epoch: 68, train_loss: 0.5169, test_loss: 1.7761, test_f1: 0.5706
 epoch: 69, train_loss: 0.5464, test_loss: 1.7047, test_f1: 0.5825
 epoch: 70, train_loss: 0.5153, test_loss: 1.3884, test_f1: 0.6117
 epoch: 71, train_loss: 0.5320, test_loss: 1.6346, test_f1: 0.6087
 epoch: 72, train_loss: 0.5165, test_loss: 1.4439, test_f1: 0.5893
 epoch: 73, train_loss: 0.5216, test_loss: 1.6955, test_f1: 0.5276
 epoch: 74, train_loss: 0.4767, test_loss: 1.4977, test_f1: 0.6291
 epoch: 75, train_loss: 0.4965, test_loss: 1.5504, test_f1: 0.5921
 epoch: 76, train_loss: 0.4925, test_loss: 1.7635, test_f1: 0.6202
 epoch: 77, train_loss: 0.5059, test_loss: 1.5143, test_f1: 0.5973
 epoch: 78, train_loss: 0.4782, test_loss: 1.5220, test_f1: 0.5963
 epoch: 79, train_loss: 0.4807, test_loss: 1.6242, test_f1: 0.5645
 epoch: 80, train_loss: 0.4749, test_loss: 1.4437, test_f1: 0.6101
 epoch: 81, train_loss: 0.4699, test_loss: 1.5514, test_f1: 0.5594
 epoch: 82, train_loss: 0.4800, test_loss: 1.7420, test_f1: 0.5919
 epoch: 83, train_loss: 0.4912, test_loss: 1.5627, test_f1: 0.5830
 epoch: 84, train_loss: 0.4937, test_loss: 1.9713, test_f1: 0.5212
 epoch: 85, train_loss: 0.4755, test_loss: 1.8381, test_f1: 0.5527
 epoch: 86, train_loss: 0.5054, test_loss: 1.6352, test_f1: 0.5763
 epoch: 87, train_loss: 0.4603, test_loss: 1.6394, test_f1: 0.5499
 epoch: 88, train_loss: 0.4495, test_loss: 1.9777, test_f1: 0.5274
 epoch: 89, train_loss: 0.4681, test_loss: 1.8304, test_f1: 0.5717
 epoch: 90, train_loss: 0.4604, test_loss: 1.7063, test_f1: 0.5894
 epoch: 91, train_loss: 0.4661, test_loss: 1.7485, test_f1: 0.5822
 epoch: 92, train_loss: 0.4677, test_loss: 1.7508, test_f1: 0.5759
 epoch: 93, train_loss: 0.4543, test_loss: 1.5014, test_f1: 0.5720
 epoch: 94, train_loss: 0.4227, test_loss: 2.1237, test_f1: 0.5805
 epoch: 95, train_loss: 0.4376, test_loss: 1.5715, test_f1: 0.5733
 epoch: 96, train_loss: 0.4266, test_loss: 1.9279, test_f1: 0.6071
 epoch: 97, train_loss: 0.4830, test_loss: 1.6995, test_f1: 0.5561
 epoch: 98, train_loss: 0.4461, test_loss: 1.9950, test_f1: 0.5859
 epoch: 99, train_loss: 0.4485, test_loss: 1.7622, test_f1: 0.5633

Training completed in 766.44 seconds
Best F1: 0.6509 at epoch 96
Mean F1 across iterations: 0.6353  0.0117
========================FINAL RESULTS================================
FEGIN weighted F1: 0.6509  0.0117
python main.py --data ltspice_demos --representation component_component --model FEGIN --layers 2 --hiddens 64 --batch_size 32 --lr 0.01 --emb_size 512 --epochs 100 --save_appendix component_component_L2_H64_BS32_LR0.01_E512 --no_val
-----



STDERR:
  File "main.py", line 370, in <module>
    main()
  File "main.py", line 254, in main
    dataset = dataset_class(
  File "/home/philip/projects/ltspice_examples_code_repo/Circuit-Completion-Using-GNNs/component_classification_with_link_prediction_head/evaluation/FEGIN/kernel/circuit_datasets.py", line 15, in __init__
    self.data, self.slices = torch.load(self.processed_paths[0])
  File "/home/philip/.local/lib/python3.8/site-packages/torch/serialization.py", line 1040, in load
    warnings.warn(
  File "/usr/lib/python3.8/warnings.py", line 109, in _showwarnmsg
    sw(msg.message, msg.category, msg.filename, msg.lineno,
  File "main.py", line 47, in warn_with_traceback
    traceback.print_stack(file=log)
/home/philip/projects/ltspice_examples_code_repo/Circuit-Completion-Using-GNNs/component_classification_with_link_prediction_head/evaluation/FEGIN/kernel/circuit_datasets.py:15: FutureWarning: You are using `torch.load` with `weights_only=False` (the current default value), which uses the default pickle module implicitly. It is possible to construct malicious pickle data which will execute arbitrary code during unpickling (See https://github.com/pytorch/pytorch/blob/main/SECURITY.md#untrusted-models for more details). In a future release, the default value for `weights_only` will be flipped to `True`. This limits the functions that could be executed during unpickling. Arbitrary objects will no longer be allowed to be loaded via this mode unless they are explicitly allowlisted by the user via `torch.serialization.add_safe_globals`. We recommend you start setting `weights_only=True` for any use case where you don't have full control of the loaded file. Please open an issue on GitHub for any issues related to this experimental feature.
  self.data, self.slices = torch.load(self.processed_paths[0])
