STDOUT:
Results will be saved in /home/philip/projects/ltspice_examples_code_repo/Circuit-Completion-Using-GNNs/component_classification_with_link_prediction_head/evaluation/FEGIN/results/model_FEGIN_dataset_ltspice_demos
Command line input: python main.py --data ltspice_demos --representation component_net --model FEGIN --layers 5 --hiddens 64 --batch_size 128 --lr 0.0001 --emb_size 512 --epochs 100 --save_appendix component_net_L5_H64_BS128_LR0.0001_E512 --no_val
 is saved.
-----
ltspice_demos - FEGIN
Using 5 layers, 64 hidden units, h = 2
Loading component_net representation dataset
ENTERED
Training FEGIN on component_net representation
Train: 1565, Test: 383
##################ITERATION #0 ****************************************
 epoch: 0, train_loss: 1.3944, test_loss: 1.3975, test_f1: 0.1365
 epoch: 1, train_loss: 1.3826, test_loss: 1.3923, test_f1: 0.1365
 epoch: 2, train_loss: 1.3729, test_loss: 1.3846, test_f1: 0.1365
 epoch: 3, train_loss: 1.3639, test_loss: 1.3792, test_f1: 0.1423
 epoch: 4, train_loss: 1.3526, test_loss: 1.3715, test_f1: 0.1981
 epoch: 5, train_loss: 1.3396, test_loss: 1.3589, test_f1: 0.2193
 epoch: 6, train_loss: 1.3256, test_loss: 1.3424, test_f1: 0.2735
 epoch: 7, train_loss: 1.3100, test_loss: 1.3246, test_f1: 0.3116
 epoch: 8, train_loss: 1.2906, test_loss: 1.3101, test_f1: 0.2793
 epoch: 9, train_loss: 1.2717, test_loss: 1.2948, test_f1: 0.2787
 epoch: 10, train_loss: 1.2500, test_loss: 1.2779, test_f1: 0.2799
 epoch: 11, train_loss: 1.2337, test_loss: 1.2646, test_f1: 0.2799
 epoch: 12, train_loss: 1.2154, test_loss: 1.2533, test_f1: 0.2813
 epoch: 13, train_loss: 1.1945, test_loss: 1.2417, test_f1: 0.2825
 epoch: 14, train_loss: 1.1833, test_loss: 1.2308, test_f1: 0.2815
 epoch: 15, train_loss: 1.1741, test_loss: 1.2240, test_f1: 0.2804
 epoch: 16, train_loss: 1.1709, test_loss: 1.2164, test_f1: 0.2872
 epoch: 17, train_loss: 1.1582, test_loss: 1.2105, test_f1: 0.2876
 epoch: 18, train_loss: 1.1529, test_loss: 1.2006, test_f1: 0.2900
 epoch: 19, train_loss: 1.1435, test_loss: 1.1934, test_f1: 0.2990
 epoch: 20, train_loss: 1.1363, test_loss: 1.1899, test_f1: 0.3026
 epoch: 21, train_loss: 1.1290, test_loss: 1.1822, test_f1: 0.3060
 epoch: 22, train_loss: 1.1226, test_loss: 1.1769, test_f1: 0.3098
 epoch: 23, train_loss: 1.1159, test_loss: 1.1759, test_f1: 0.3064
 epoch: 24, train_loss: 1.1148, test_loss: 1.1705, test_f1: 0.3576
 epoch: 25, train_loss: 1.1068, test_loss: 1.1662, test_f1: 0.3566
 epoch: 26, train_loss: 1.1060, test_loss: 1.1573, test_f1: 0.3407
 epoch: 27, train_loss: 1.0951, test_loss: 1.1551, test_f1: 0.3525
 epoch: 28, train_loss: 1.1001, test_loss: 1.1517, test_f1: 0.3701
 epoch: 29, train_loss: 1.0919, test_loss: 1.1448, test_f1: 0.3806
 epoch: 30, train_loss: 1.0851, test_loss: 1.1385, test_f1: 0.3990
 epoch: 31, train_loss: 1.0814, test_loss: 1.1393, test_f1: 0.3879
 epoch: 32, train_loss: 1.0762, test_loss: 1.1349, test_f1: 0.4001
 epoch: 33, train_loss: 1.0715, test_loss: 1.1279, test_f1: 0.4297
 epoch: 34, train_loss: 1.0651, test_loss: 1.1204, test_f1: 0.4514
 epoch: 35, train_loss: 1.0640, test_loss: 1.1202, test_f1: 0.4634
 epoch: 36, train_loss: 1.0635, test_loss: 1.1179, test_f1: 0.4592
 epoch: 37, train_loss: 1.0481, test_loss: 1.1129, test_f1: 0.4805
 epoch: 38, train_loss: 1.0448, test_loss: 1.1082, test_f1: 0.4765
 epoch: 39, train_loss: 1.0419, test_loss: 1.1032, test_f1: 0.4590
 epoch: 40, train_loss: 1.0362, test_loss: 1.0979, test_f1: 0.4810
 epoch: 41, train_loss: 1.0316, test_loss: 1.0972, test_f1: 0.4730
 epoch: 42, train_loss: 1.0241, test_loss: 1.0923, test_f1: 0.4658
 epoch: 43, train_loss: 1.0311, test_loss: 1.0839, test_f1: 0.4941
 epoch: 44, train_loss: 1.0151, test_loss: 1.0846, test_f1: 0.4827
 epoch: 45, train_loss: 1.0057, test_loss: 1.0871, test_f1: 0.4792
 epoch: 46, train_loss: 1.0062, test_loss: 1.0959, test_f1: 0.4929
 epoch: 47, train_loss: 1.0021, test_loss: 1.0803, test_f1: 0.4809
 epoch: 48, train_loss: 0.9935, test_loss: 1.0790, test_f1: 0.5033
 epoch: 49, train_loss: 0.9923, test_loss: 1.0856, test_f1: 0.5047
 epoch: 50, train_loss: 0.9871, test_loss: 1.0691, test_f1: 0.5042
 epoch: 51, train_loss: 0.9764, test_loss: 1.0629, test_f1: 0.5075
 epoch: 52, train_loss: 0.9770, test_loss: 1.0658, test_f1: 0.5123
 epoch: 53, train_loss: 0.9677, test_loss: 1.0696, test_f1: 0.5012
 epoch: 54, train_loss: 0.9690, test_loss: 1.0652, test_f1: 0.5003
 epoch: 55, train_loss: 0.9637, test_loss: 1.0577, test_f1: 0.5107
 epoch: 56, train_loss: 0.9608, test_loss: 1.0596, test_f1: 0.5168
 epoch: 57, train_loss: 0.9561, test_loss: 1.0583, test_f1: 0.5203
 epoch: 58, train_loss: 0.9605, test_loss: 1.0554, test_f1: 0.5308
 epoch: 59, train_loss: 0.9476, test_loss: 1.0521, test_f1: 0.5239
 epoch: 60, train_loss: 0.9444, test_loss: 1.0527, test_f1: 0.5232
 epoch: 61, train_loss: 0.9448, test_loss: 1.0578, test_f1: 0.5257
 epoch: 62, train_loss: 0.9447, test_loss: 1.0520, test_f1: 0.5359
 epoch: 63, train_loss: 0.9443, test_loss: 1.0571, test_f1: 0.5282
 epoch: 64, train_loss: 0.9404, test_loss: 1.0451, test_f1: 0.5175
 epoch: 65, train_loss: 0.9322, test_loss: 1.0538, test_f1: 0.5328
 epoch: 66, train_loss: 0.9315, test_loss: 1.0662, test_f1: 0.5278
 epoch: 67, train_loss: 0.9220, test_loss: 1.0535, test_f1: 0.5284
 epoch: 68, train_loss: 0.9242, test_loss: 1.0529, test_f1: 0.5339
 epoch: 69, train_loss: 0.9169, test_loss: 1.0482, test_f1: 0.5425
 epoch: 70, train_loss: 0.9258, test_loss: 1.0428, test_f1: 0.5420
 epoch: 71, train_loss: 0.9155, test_loss: 1.0577, test_f1: 0.5279
 epoch: 72, train_loss: 0.9102, test_loss: 1.0382, test_f1: 0.5325
 epoch: 73, train_loss: 0.9176, test_loss: 1.0377, test_f1: 0.5390
 epoch: 74, train_loss: 0.9080, test_loss: 1.0348, test_f1: 0.5340
 epoch: 75, train_loss: 0.9112, test_loss: 1.0676, test_f1: 0.5216
 epoch: 76, train_loss: 0.9079, test_loss: 1.0743, test_f1: 0.5316
 epoch: 77, train_loss: 0.9077, test_loss: 1.0574, test_f1: 0.5425
 epoch: 78, train_loss: 0.9043, test_loss: 1.0503, test_f1: 0.5418
 epoch: 79, train_loss: 0.9003, test_loss: 1.0607, test_f1: 0.5434
 epoch: 80, train_loss: 0.9008, test_loss: 1.0480, test_f1: 0.5459
 epoch: 81, train_loss: 0.8866, test_loss: 1.0465, test_f1: 0.5429
 epoch: 82, train_loss: 0.8813, test_loss: 1.0387, test_f1: 0.5443
 epoch: 83, train_loss: 0.8854, test_loss: 1.0338, test_f1: 0.5472
 epoch: 84, train_loss: 0.8880, test_loss: 1.0361, test_f1: 0.5319
 epoch: 85, train_loss: 0.8769, test_loss: 1.0591, test_f1: 0.5367
 epoch: 86, train_loss: 0.8791, test_loss: 1.0614, test_f1: 0.5414
 epoch: 87, train_loss: 0.8713, test_loss: 1.0599, test_f1: 0.5320
 epoch: 88, train_loss: 0.8700, test_loss: 1.0377, test_f1: 0.5380
 epoch: 89, train_loss: 0.8735, test_loss: 1.0677, test_f1: 0.5402
 epoch: 90, train_loss: 0.8761, test_loss: 1.0615, test_f1: 0.5408
 epoch: 91, train_loss: 0.8789, test_loss: 1.0629, test_f1: 0.5506
 epoch: 92, train_loss: 0.8757, test_loss: 1.0489, test_f1: 0.5442
 epoch: 93, train_loss: 0.8765, test_loss: 1.0441, test_f1: 0.5542
 epoch: 94, train_loss: 0.8606, test_loss: 1.0704, test_f1: 0.5502
 epoch: 95, train_loss: 0.8660, test_loss: 1.0469, test_f1: 0.5494
 epoch: 96, train_loss: 0.8639, test_loss: 1.0485, test_f1: 0.5441
 epoch: 97, train_loss: 0.8574, test_loss: 1.0606, test_f1: 0.5293
 epoch: 98, train_loss: 0.8493, test_loss: 1.0643, test_f1: 0.5377
 epoch: 99, train_loss: 0.8580, test_loss: 1.0676, test_f1: 0.5505
##################ITERATION #1 ****************************************
 epoch: 0, train_loss: 1.3285, test_loss: 1.3666, test_f1: 0.1365
 epoch: 1, train_loss: 1.2926, test_loss: 1.3618, test_f1: 0.1365
 epoch: 2, train_loss: 1.2714, test_loss: 1.3544, test_f1: 0.1365
 epoch: 3, train_loss: 1.2504, test_loss: 1.3370, test_f1: 0.2100
 epoch: 4, train_loss: 1.2294, test_loss: 1.2983, test_f1: 0.3225
 epoch: 5, train_loss: 1.2111, test_loss: 1.2636, test_f1: 0.3202
 epoch: 6, train_loss: 1.1978, test_loss: 1.2441, test_f1: 0.3302
 epoch: 7, train_loss: 1.1839, test_loss: 1.2304, test_f1: 0.3304
 epoch: 8, train_loss: 1.1685, test_loss: 1.2199, test_f1: 0.3049
 epoch: 9, train_loss: 1.1529, test_loss: 1.2123, test_f1: 0.3173
 epoch: 10, train_loss: 1.1448, test_loss: 1.2056, test_f1: 0.3009
 epoch: 11, train_loss: 1.1341, test_loss: 1.1997, test_f1: 0.2848
 epoch: 12, train_loss: 1.1246, test_loss: 1.1931, test_f1: 0.2814
 epoch: 13, train_loss: 1.1173, test_loss: 1.1867, test_f1: 0.3217
 epoch: 14, train_loss: 1.1090, test_loss: 1.1912, test_f1: 0.3302
 epoch: 15, train_loss: 1.0962, test_loss: 1.1828, test_f1: 0.3342
 epoch: 16, train_loss: 1.0926, test_loss: 1.1756, test_f1: 0.3435
 epoch: 17, train_loss: 1.0801, test_loss: 1.1707, test_f1: 0.3391
 epoch: 18, train_loss: 1.0753, test_loss: 1.1681, test_f1: 0.3463
 epoch: 19, train_loss: 1.0637, test_loss: 1.1649, test_f1: 0.3719
 epoch: 20, train_loss: 1.0594, test_loss: 1.1680, test_f1: 0.3859
 epoch: 21, train_loss: 1.0543, test_loss: 1.1673, test_f1: 0.4027
 epoch: 22, train_loss: 1.0424, test_loss: 1.1598, test_f1: 0.4330
 epoch: 23, train_loss: 1.0355, test_loss: 1.1631, test_f1: 0.4461
 epoch: 24, train_loss: 1.0328, test_loss: 1.1388, test_f1: 0.4520
 epoch: 25, train_loss: 1.0285, test_loss: 1.1470, test_f1: 0.4546
 epoch: 26, train_loss: 1.0146, test_loss: 1.1596, test_f1: 0.4628
 epoch: 27, train_loss: 1.0088, test_loss: 1.1657, test_f1: 0.4761
 epoch: 28, train_loss: 0.9991, test_loss: 1.1402, test_f1: 0.4684
 epoch: 29, train_loss: 0.9927, test_loss: 1.1302, test_f1: 0.4752
 epoch: 30, train_loss: 0.9942, test_loss: 1.1193, test_f1: 0.4830
 epoch: 31, train_loss: 0.9876, test_loss: 1.1163, test_f1: 0.4878
 epoch: 32, train_loss: 0.9683, test_loss: 1.1138, test_f1: 0.5144
 epoch: 33, train_loss: 0.9607, test_loss: 1.1278, test_f1: 0.5092
 epoch: 34, train_loss: 0.9539, test_loss: 1.0964, test_f1: 0.5084
 epoch: 35, train_loss: 0.9497, test_loss: 1.1146, test_f1: 0.5058
 epoch: 36, train_loss: 0.9419, test_loss: 1.1034, test_f1: 0.5007
 epoch: 37, train_loss: 0.9458, test_loss: 1.1055, test_f1: 0.5122
 epoch: 38, train_loss: 0.9393, test_loss: 1.0941, test_f1: 0.5080
 epoch: 39, train_loss: 0.9166, test_loss: 1.0917, test_f1: 0.5037
 epoch: 40, train_loss: 0.9295, test_loss: 1.1011, test_f1: 0.5094
 epoch: 41, train_loss: 0.9171, test_loss: 1.1144, test_f1: 0.5205
 epoch: 42, train_loss: 0.9159, test_loss: 1.0949, test_f1: 0.5264
 epoch: 43, train_loss: 0.8982, test_loss: 1.0801, test_f1: 0.5295
 epoch: 44, train_loss: 0.8985, test_loss: 1.1208, test_f1: 0.5305
 epoch: 45, train_loss: 0.9040, test_loss: 1.0865, test_f1: 0.5309
 epoch: 46, train_loss: 0.8858, test_loss: 1.1216, test_f1: 0.5158
 epoch: 47, train_loss: 0.8809, test_loss: 1.1224, test_f1: 0.5350
 epoch: 48, train_loss: 0.8805, test_loss: 1.1161, test_f1: 0.5200
 epoch: 49, train_loss: 0.8753, test_loss: 1.1025, test_f1: 0.5161
 epoch: 50, train_loss: 0.8723, test_loss: 1.1229, test_f1: 0.5412
 epoch: 51, train_loss: 0.8703, test_loss: 1.0984, test_f1: 0.5324
 epoch: 52, train_loss: 0.8707, test_loss: 1.1479, test_f1: 0.5276
 epoch: 53, train_loss: 0.8636, test_loss: 1.1382, test_f1: 0.5255
 epoch: 54, train_loss: 0.8647, test_loss: 1.1222, test_f1: 0.5309
 epoch: 55, train_loss: 0.8484, test_loss: 1.1213, test_f1: 0.5332
 epoch: 56, train_loss: 0.8613, test_loss: 1.1094, test_f1: 0.5349
 epoch: 57, train_loss: 0.8493, test_loss: 1.1278, test_f1: 0.5476
 epoch: 58, train_loss: 0.8432, test_loss: 1.1248, test_f1: 0.5451
 epoch: 59, train_loss: 0.8476, test_loss: 1.1321, test_f1: 0.5412
 epoch: 60, train_loss: 0.8396, test_loss: 1.1307, test_f1: 0.5389
 epoch: 61, train_loss: 0.8492, test_loss: 1.1414, test_f1: 0.5378
 epoch: 62, train_loss: 0.8465, test_loss: 1.1665, test_f1: 0.5369
 epoch: 63, train_loss: 0.8392, test_loss: 1.1450, test_f1: 0.5503
 epoch: 64, train_loss: 0.8514, test_loss: 1.1060, test_f1: 0.5626
 epoch: 65, train_loss: 0.8321, test_loss: 1.1101, test_f1: 0.5553
 epoch: 66, train_loss: 0.8303, test_loss: 1.1257, test_f1: 0.5544
 epoch: 67, train_loss: 0.8325, test_loss: 1.1261, test_f1: 0.5584
 epoch: 68, train_loss: 0.8292, test_loss: 1.1144, test_f1: 0.5709
 epoch: 69, train_loss: 0.8334, test_loss: 1.1581, test_f1: 0.5424
 epoch: 70, train_loss: 0.8165, test_loss: 1.1262, test_f1: 0.5606
 epoch: 71, train_loss: 0.8226, test_loss: 1.1387, test_f1: 0.5477
 epoch: 72, train_loss: 0.8254, test_loss: 1.1656, test_f1: 0.5375
 epoch: 73, train_loss: 0.8215, test_loss: 1.1872, test_f1: 0.5392
 epoch: 74, train_loss: 0.8217, test_loss: 1.1332, test_f1: 0.5529
 epoch: 75, train_loss: 0.8256, test_loss: 1.1521, test_f1: 0.5540
 epoch: 76, train_loss: 0.8219, test_loss: 1.1536, test_f1: 0.5616
 epoch: 77, train_loss: 0.8057, test_loss: 1.1642, test_f1: 0.5600
 epoch: 78, train_loss: 0.8117, test_loss: 1.1531, test_f1: 0.5539
 epoch: 79, train_loss: 0.8142, test_loss: 1.1682, test_f1: 0.5599
 epoch: 80, train_loss: 0.8079, test_loss: 1.1651, test_f1: 0.5547
 epoch: 81, train_loss: 0.8126, test_loss: 1.1348, test_f1: 0.5663
 epoch: 82, train_loss: 0.8138, test_loss: 1.1523, test_f1: 0.5629
 epoch: 83, train_loss: 0.7998, test_loss: 1.1338, test_f1: 0.5595
 epoch: 84, train_loss: 0.8059, test_loss: 1.0990, test_f1: 0.5621
 epoch: 85, train_loss: 0.7970, test_loss: 1.1231, test_f1: 0.5528
 epoch: 86, train_loss: 0.7997, test_loss: 1.1676, test_f1: 0.5646
 epoch: 87, train_loss: 0.7927, test_loss: 1.1649, test_f1: 0.5590
 epoch: 88, train_loss: 0.7930, test_loss: 1.1742, test_f1: 0.5715
 epoch: 89, train_loss: 0.8012, test_loss: 1.2140, test_f1: 0.5573
 epoch: 90, train_loss: 0.7938, test_loss: 1.1755, test_f1: 0.5623
 epoch: 91, train_loss: 0.7863, test_loss: 1.1381, test_f1: 0.5636
 epoch: 92, train_loss: 0.8056, test_loss: 1.1728, test_f1: 0.5621
 epoch: 93, train_loss: 0.8065, test_loss: 1.1734, test_f1: 0.5626
 epoch: 94, train_loss: 0.7913, test_loss: 1.1199, test_f1: 0.5437
 epoch: 95, train_loss: 0.7924, test_loss: 1.1714, test_f1: 0.5580
 epoch: 96, train_loss: 0.7834, test_loss: 1.1444, test_f1: 0.5404
 epoch: 97, train_loss: 0.7891, test_loss: 1.1921, test_f1: 0.5511
 epoch: 98, train_loss: 0.7919, test_loss: 1.2000, test_f1: 0.5560
 epoch: 99, train_loss: 0.7842, test_loss: 1.1840, test_f1: 0.5718
##################ITERATION #2 ****************************************
 epoch: 0, train_loss: 1.2977, test_loss: 1.3614, test_f1: 0.1365
 epoch: 1, train_loss: 1.2576, test_loss: 1.3384, test_f1: 0.2818
 epoch: 2, train_loss: 1.2368, test_loss: 1.3230, test_f1: 0.2860
 epoch: 3, train_loss: 1.2162, test_loss: 1.3109, test_f1: 0.2768
 epoch: 4, train_loss: 1.1973, test_loss: 1.2875, test_f1: 0.3383
 epoch: 5, train_loss: 1.1813, test_loss: 1.2615, test_f1: 0.3664
 epoch: 6, train_loss: 1.1681, test_loss: 1.2440, test_f1: 0.3759
 epoch: 7, train_loss: 1.1538, test_loss: 1.2254, test_f1: 0.3883
 epoch: 8, train_loss: 1.1493, test_loss: 1.2107, test_f1: 0.3801
 epoch: 9, train_loss: 1.1326, test_loss: 1.2010, test_f1: 0.3910
 epoch: 10, train_loss: 1.1235, test_loss: 1.1919, test_f1: 0.3639
 epoch: 11, train_loss: 1.1198, test_loss: 1.1818, test_f1: 0.3612
 epoch: 12, train_loss: 1.1104, test_loss: 1.1762, test_f1: 0.3806
 epoch: 13, train_loss: 1.0944, test_loss: 1.1664, test_f1: 0.3905
 epoch: 14, train_loss: 1.0839, test_loss: 1.1593, test_f1: 0.4009
 epoch: 15, train_loss: 1.0812, test_loss: 1.1549, test_f1: 0.4028
 epoch: 16, train_loss: 1.0681, test_loss: 1.1463, test_f1: 0.4317
 epoch: 17, train_loss: 1.0650, test_loss: 1.1416, test_f1: 0.4722
 epoch: 18, train_loss: 1.0610, test_loss: 1.1310, test_f1: 0.4719
 epoch: 19, train_loss: 1.0491, test_loss: 1.1210, test_f1: 0.4824
 epoch: 20, train_loss: 1.0418, test_loss: 1.1191, test_f1: 0.4860
 epoch: 21, train_loss: 1.0307, test_loss: 1.1065, test_f1: 0.4863
 epoch: 22, train_loss: 1.0209, test_loss: 1.1035, test_f1: 0.4891
 epoch: 23, train_loss: 1.0198, test_loss: 1.0985, test_f1: 0.4896
 epoch: 24, train_loss: 1.0142, test_loss: 1.0907, test_f1: 0.4878
 epoch: 25, train_loss: 1.0066, test_loss: 1.0831, test_f1: 0.5005
 epoch: 26, train_loss: 0.9940, test_loss: 1.0745, test_f1: 0.4985
 epoch: 27, train_loss: 0.9880, test_loss: 1.0642, test_f1: 0.5047
 epoch: 28, train_loss: 0.9787, test_loss: 1.0631, test_f1: 0.4933
 epoch: 29, train_loss: 0.9706, test_loss: 1.0610, test_f1: 0.4961
 epoch: 30, train_loss: 0.9657, test_loss: 1.0509, test_f1: 0.5062
 epoch: 31, train_loss: 0.9665, test_loss: 1.0498, test_f1: 0.5218
 epoch: 32, train_loss: 0.9500, test_loss: 1.0659, test_f1: 0.5137
 epoch: 33, train_loss: 0.9432, test_loss: 1.0484, test_f1: 0.5030
 epoch: 34, train_loss: 0.9418, test_loss: 1.0419, test_f1: 0.5140
 epoch: 35, train_loss: 0.9336, test_loss: 1.0443, test_f1: 0.5116
 epoch: 36, train_loss: 0.9292, test_loss: 1.0416, test_f1: 0.5194
 epoch: 37, train_loss: 0.9247, test_loss: 1.0293, test_f1: 0.5211
 epoch: 38, train_loss: 0.9229, test_loss: 1.0324, test_f1: 0.5386
 epoch: 39, train_loss: 0.9123, test_loss: 1.0253, test_f1: 0.5398
 epoch: 40, train_loss: 0.9058, test_loss: 1.0240, test_f1: 0.5459
 epoch: 41, train_loss: 0.9003, test_loss: 1.0245, test_f1: 0.5432
 epoch: 42, train_loss: 0.8969, test_loss: 1.0228, test_f1: 0.5457
 epoch: 43, train_loss: 0.8832, test_loss: 1.0185, test_f1: 0.5417
 epoch: 44, train_loss: 0.8861, test_loss: 1.0181, test_f1: 0.5369
 epoch: 45, train_loss: 0.8818, test_loss: 1.0585, test_f1: 0.5340
 epoch: 46, train_loss: 0.8785, test_loss: 1.0562, test_f1: 0.5354
 epoch: 47, train_loss: 0.8798, test_loss: 1.0625, test_f1: 0.5390
 epoch: 48, train_loss: 0.8627, test_loss: 1.0361, test_f1: 0.5458
 epoch: 49, train_loss: 0.8603, test_loss: 1.0221, test_f1: 0.5640
 epoch: 50, train_loss: 0.8564, test_loss: 1.0336, test_f1: 0.5498
 epoch: 51, train_loss: 0.8524, test_loss: 1.0433, test_f1: 0.5454
 epoch: 52, train_loss: 0.8551, test_loss: 1.0431, test_f1: 0.5426
 epoch: 53, train_loss: 0.8459, test_loss: 1.0406, test_f1: 0.5464
 epoch: 54, train_loss: 0.8504, test_loss: 1.0359, test_f1: 0.5553
 epoch: 55, train_loss: 0.8422, test_loss: 1.0644, test_f1: 0.5494
 epoch: 56, train_loss: 0.8389, test_loss: 1.0512, test_f1: 0.5608
 epoch: 57, train_loss: 0.8375, test_loss: 1.0599, test_f1: 0.5536
 epoch: 58, train_loss: 0.8334, test_loss: 1.0520, test_f1: 0.5560
 epoch: 59, train_loss: 0.8251, test_loss: 1.0561, test_f1: 0.5587
 epoch: 60, train_loss: 0.8304, test_loss: 1.0467, test_f1: 0.5615
 epoch: 61, train_loss: 0.8295, test_loss: 1.0461, test_f1: 0.5622
 epoch: 62, train_loss: 0.8380, test_loss: 1.0674, test_f1: 0.5501
 epoch: 63, train_loss: 0.8281, test_loss: 1.0672, test_f1: 0.5473
 epoch: 64, train_loss: 0.8332, test_loss: 1.0435, test_f1: 0.5634
 epoch: 65, train_loss: 0.8252, test_loss: 1.0508, test_f1: 0.5465
 epoch: 66, train_loss: 0.8112, test_loss: 1.0647, test_f1: 0.5438
 epoch: 67, train_loss: 0.8248, test_loss: 1.0538, test_f1: 0.5617
 epoch: 68, train_loss: 0.8288, test_loss: 1.0706, test_f1: 0.5694
 epoch: 69, train_loss: 0.8234, test_loss: 1.0526, test_f1: 0.5665
 epoch: 70, train_loss: 0.8092, test_loss: 1.0674, test_f1: 0.5754
 epoch: 71, train_loss: 0.8036, test_loss: 1.0602, test_f1: 0.5782
 epoch: 72, train_loss: 0.8176, test_loss: 1.0608, test_f1: 0.5673
 epoch: 73, train_loss: 0.8152, test_loss: 1.0548, test_f1: 0.5691
 epoch: 74, train_loss: 0.8118, test_loss: 1.0556, test_f1: 0.5748
 epoch: 75, train_loss: 0.8189, test_loss: 1.0988, test_f1: 0.5585
 epoch: 76, train_loss: 0.8041, test_loss: 1.0780, test_f1: 0.5703
 epoch: 77, train_loss: 0.7983, test_loss: 1.0647, test_f1: 0.5686
 epoch: 78, train_loss: 0.8056, test_loss: 1.0874, test_f1: 0.5689
 epoch: 79, train_loss: 0.7977, test_loss: 1.0826, test_f1: 0.5804
 epoch: 80, train_loss: 0.8041, test_loss: 1.0976, test_f1: 0.5734
 epoch: 81, train_loss: 0.7995, test_loss: 1.0912, test_f1: 0.5687
 epoch: 82, train_loss: 0.7959, test_loss: 1.0688, test_f1: 0.5773
 epoch: 83, train_loss: 0.7953, test_loss: 1.0867, test_f1: 0.5659
 epoch: 84, train_loss: 0.8156, test_loss: 1.0961, test_f1: 0.5666
 epoch: 85, train_loss: 0.8065, test_loss: 1.0968, test_f1: 0.5673
 epoch: 86, train_loss: 0.7974, test_loss: 1.0862, test_f1: 0.5648
 epoch: 87, train_loss: 0.7975, test_loss: 1.1067, test_f1: 0.5671
 epoch: 88, train_loss: 0.7995, test_loss: 1.0983, test_f1: 0.5650
 epoch: 89, train_loss: 0.7953, test_loss: 1.0875, test_f1: 0.5765
 epoch: 90, train_loss: 0.7925, test_loss: 1.0787, test_f1: 0.5702
 epoch: 91, train_loss: 0.7896, test_loss: 1.1058, test_f1: 0.5728
 epoch: 92, train_loss: 0.7794, test_loss: 1.0947, test_f1: 0.5767
 epoch: 93, train_loss: 0.7829, test_loss: 1.0918, test_f1: 0.5696
 epoch: 94, train_loss: 0.7705, test_loss: 1.0913, test_f1: 0.5746
 epoch: 95, train_loss: 0.7838, test_loss: 1.0799, test_f1: 0.5699
 epoch: 96, train_loss: 0.7679, test_loss: 1.1190, test_f1: 0.5806
 epoch: 97, train_loss: 0.7834, test_loss: 1.0808, test_f1: 0.5723
 epoch: 98, train_loss: 0.7829, test_loss: 1.0884, test_f1: 0.5687
 epoch: 99, train_loss: 0.7731, test_loss: 1.1094, test_f1: 0.5702
##################ITERATION #3 ****************************************
 epoch: 0, train_loss: 1.3026, test_loss: 1.3623, test_f1: 0.1738
 epoch: 1, train_loss: 1.2400, test_loss: 1.3571, test_f1: 0.2882
 epoch: 2, train_loss: 1.2197, test_loss: 1.3396, test_f1: 0.2970
 epoch: 3, train_loss: 1.1867, test_loss: 1.3129, test_f1: 0.3421
 epoch: 4, train_loss: 1.1732, test_loss: 1.2915, test_f1: 0.3551
 epoch: 5, train_loss: 1.1580, test_loss: 1.2534, test_f1: 0.3906
 epoch: 6, train_loss: 1.1411, test_loss: 1.2200, test_f1: 0.4079
 epoch: 7, train_loss: 1.1317, test_loss: 1.1962, test_f1: 0.3959
 epoch: 8, train_loss: 1.1243, test_loss: 1.1844, test_f1: 0.4162
 epoch: 9, train_loss: 1.1123, test_loss: 1.1794, test_f1: 0.4199
 epoch: 10, train_loss: 1.0879, test_loss: 1.1719, test_f1: 0.4293
 epoch: 11, train_loss: 1.0903, test_loss: 1.1601, test_f1: 0.4377
 epoch: 12, train_loss: 1.0854, test_loss: 1.1463, test_f1: 0.4497
 epoch: 13, train_loss: 1.0711, test_loss: 1.1420, test_f1: 0.4445
 epoch: 14, train_loss: 1.0663, test_loss: 1.1332, test_f1: 0.4625
 epoch: 15, train_loss: 1.0507, test_loss: 1.1263, test_f1: 0.4643
 epoch: 16, train_loss: 1.0461, test_loss: 1.1205, test_f1: 0.4756
 epoch: 17, train_loss: 1.0301, test_loss: 1.1152, test_f1: 0.4900
 epoch: 18, train_loss: 1.0192, test_loss: 1.1104, test_f1: 0.5021
 epoch: 19, train_loss: 1.0121, test_loss: 1.1039, test_f1: 0.4975
 epoch: 20, train_loss: 1.0083, test_loss: 1.1040, test_f1: 0.5081
 epoch: 21, train_loss: 0.9925, test_loss: 1.0980, test_f1: 0.4892
 epoch: 22, train_loss: 1.0083, test_loss: 1.0936, test_f1: 0.4919
 epoch: 23, train_loss: 0.9941, test_loss: 1.0919, test_f1: 0.4974
 epoch: 24, train_loss: 0.9844, test_loss: 1.0849, test_f1: 0.4986
 epoch: 25, train_loss: 0.9718, test_loss: 1.0719, test_f1: 0.4975
 epoch: 26, train_loss: 0.9614, test_loss: 1.0809, test_f1: 0.5001
 epoch: 27, train_loss: 0.9667, test_loss: 1.0602, test_f1: 0.5066
 epoch: 28, train_loss: 0.9575, test_loss: 1.0550, test_f1: 0.5054
 epoch: 29, train_loss: 0.9572, test_loss: 1.0465, test_f1: 0.4947
 epoch: 30, train_loss: 0.9437, test_loss: 1.0516, test_f1: 0.5001
 epoch: 31, train_loss: 0.9366, test_loss: 1.0617, test_f1: 0.5043
 epoch: 32, train_loss: 0.9322, test_loss: 1.0524, test_f1: 0.5000
 epoch: 33, train_loss: 0.9344, test_loss: 1.0433, test_f1: 0.5080
 epoch: 34, train_loss: 0.9298, test_loss: 1.0459, test_f1: 0.5138
 epoch: 35, train_loss: 0.9272, test_loss: 1.0540, test_f1: 0.5317
 epoch: 36, train_loss: 0.9176, test_loss: 1.0417, test_f1: 0.5250
 epoch: 37, train_loss: 0.9068, test_loss: 1.0308, test_f1: 0.5379
 epoch: 38, train_loss: 0.9073, test_loss: 1.0376, test_f1: 0.5145
 epoch: 39, train_loss: 0.9048, test_loss: 1.0282, test_f1: 0.5387
 epoch: 40, train_loss: 0.9040, test_loss: 1.0421, test_f1: 0.5294
 epoch: 41, train_loss: 0.9007, test_loss: 1.0384, test_f1: 0.5430
 epoch: 42, train_loss: 0.8934, test_loss: 1.0442, test_f1: 0.5372
 epoch: 43, train_loss: 0.8954, test_loss: 1.0361, test_f1: 0.5467
 epoch: 44, train_loss: 0.8815, test_loss: 1.0406, test_f1: 0.5324
 epoch: 45, train_loss: 0.8760, test_loss: 1.0323, test_f1: 0.5314
 epoch: 46, train_loss: 0.8846, test_loss: 1.0457, test_f1: 0.5325
 epoch: 47, train_loss: 0.8725, test_loss: 1.0327, test_f1: 0.5397
 epoch: 48, train_loss: 0.8732, test_loss: 1.0252, test_f1: 0.5504
 epoch: 49, train_loss: 0.8622, test_loss: 1.0086, test_f1: 0.5628
 epoch: 50, train_loss: 0.8633, test_loss: 1.0371, test_f1: 0.5621
 epoch: 51, train_loss: 0.8622, test_loss: 1.0377, test_f1: 0.5678
 epoch: 52, train_loss: 0.8585, test_loss: 1.0536, test_f1: 0.5662
 epoch: 53, train_loss: 0.8537, test_loss: 1.0568, test_f1: 0.5602
 epoch: 54, train_loss: 0.8527, test_loss: 1.0528, test_f1: 0.5541
 epoch: 55, train_loss: 0.8458, test_loss: 1.0487, test_f1: 0.5473
 epoch: 56, train_loss: 0.8488, test_loss: 1.0525, test_f1: 0.5552
 epoch: 57, train_loss: 0.8481, test_loss: 1.0486, test_f1: 0.5491
 epoch: 58, train_loss: 0.8510, test_loss: 1.0510, test_f1: 0.5621
 epoch: 59, train_loss: 0.8316, test_loss: 1.0434, test_f1: 0.5641
 epoch: 60, train_loss: 0.8447, test_loss: 1.0323, test_f1: 0.5526
 epoch: 61, train_loss: 0.8341, test_loss: 1.0570, test_f1: 0.5487
 epoch: 62, train_loss: 0.8320, test_loss: 1.0422, test_f1: 0.5645
 epoch: 63, train_loss: 0.8319, test_loss: 1.0626, test_f1: 0.5520
 epoch: 64, train_loss: 0.8315, test_loss: 1.0570, test_f1: 0.5553
 epoch: 65, train_loss: 0.8359, test_loss: 1.0447, test_f1: 0.5592
 epoch: 66, train_loss: 0.8218, test_loss: 1.0593, test_f1: 0.5757
 epoch: 67, train_loss: 0.8253, test_loss: 1.0485, test_f1: 0.5735
 epoch: 68, train_loss: 0.8360, test_loss: 1.0574, test_f1: 0.5722
 epoch: 69, train_loss: 0.8311, test_loss: 1.0571, test_f1: 0.5718
 epoch: 70, train_loss: 0.8265, test_loss: 1.0514, test_f1: 0.5766
 epoch: 71, train_loss: 0.8278, test_loss: 1.0676, test_f1: 0.5675
 epoch: 72, train_loss: 0.8212, test_loss: 1.0800, test_f1: 0.5630
 epoch: 73, train_loss: 0.8124, test_loss: 1.0624, test_f1: 0.5630
 epoch: 74, train_loss: 0.8180, test_loss: 1.0657, test_f1: 0.5650
 epoch: 75, train_loss: 0.8223, test_loss: 1.0468, test_f1: 0.5745
 epoch: 76, train_loss: 0.8220, test_loss: 1.0505, test_f1: 0.5793
 epoch: 77, train_loss: 0.8104, test_loss: 1.0548, test_f1: 0.5756
 epoch: 78, train_loss: 0.8196, test_loss: 1.0629, test_f1: 0.5788
 epoch: 79, train_loss: 0.8213, test_loss: 1.0860, test_f1: 0.5677
 epoch: 80, train_loss: 0.8175, test_loss: 1.0707, test_f1: 0.5717
 epoch: 81, train_loss: 0.8157, test_loss: 1.0729, test_f1: 0.5716
 epoch: 82, train_loss: 0.8246, test_loss: 1.0760, test_f1: 0.5808
 epoch: 83, train_loss: 0.7989, test_loss: 1.0689, test_f1: 0.5744
 epoch: 84, train_loss: 0.8139, test_loss: 1.0571, test_f1: 0.5689
 epoch: 85, train_loss: 0.8054, test_loss: 1.0720, test_f1: 0.5608
 epoch: 86, train_loss: 0.7963, test_loss: 1.0744, test_f1: 0.5578
 epoch: 87, train_loss: 0.8030, test_loss: 1.0731, test_f1: 0.5588
 epoch: 88, train_loss: 0.7980, test_loss: 1.0702, test_f1: 0.5740
 epoch: 89, train_loss: 0.8111, test_loss: 1.0691, test_f1: 0.5733
 epoch: 90, train_loss: 0.7961, test_loss: 1.0684, test_f1: 0.5734
 epoch: 91, train_loss: 0.7984, test_loss: 1.0831, test_f1: 0.5671
 epoch: 92, train_loss: 0.7990, test_loss: 1.0654, test_f1: 0.5629
 epoch: 93, train_loss: 0.7949, test_loss: 1.0682, test_f1: 0.5729
 epoch: 94, train_loss: 0.7903, test_loss: 1.0752, test_f1: 0.5650
 epoch: 95, train_loss: 0.7869, test_loss: 1.0897, test_f1: 0.5812
 epoch: 96, train_loss: 0.7879, test_loss: 1.1047, test_f1: 0.5706
 epoch: 97, train_loss: 0.7853, test_loss: 1.0986, test_f1: 0.5570
 epoch: 98, train_loss: 0.7923, test_loss: 1.1220, test_f1: 0.5664
 epoch: 99, train_loss: 0.7889, test_loss: 1.0986, test_f1: 0.5614
##################ITERATION #4 ****************************************
 epoch: 0, train_loss: 1.2687, test_loss: 1.3511, test_f1: 0.2281
 epoch: 1, train_loss: 1.2098, test_loss: 1.3312, test_f1: 0.2281
 epoch: 2, train_loss: 1.1944, test_loss: 1.2998, test_f1: 0.2623
 epoch: 3, train_loss: 1.1711, test_loss: 1.2918, test_f1: 0.2668
 epoch: 4, train_loss: 1.1600, test_loss: 1.2649, test_f1: 0.3024
 epoch: 5, train_loss: 1.1367, test_loss: 1.2560, test_f1: 0.3387
 epoch: 6, train_loss: 1.1232, test_loss: 1.2231, test_f1: 0.4098
 epoch: 7, train_loss: 1.1153, test_loss: 1.1892, test_f1: 0.4423
 epoch: 8, train_loss: 1.1032, test_loss: 1.1765, test_f1: 0.4480
 epoch: 9, train_loss: 1.0923, test_loss: 1.1736, test_f1: 0.4571
 epoch: 10, train_loss: 1.0847, test_loss: 1.1741, test_f1: 0.4855
 epoch: 11, train_loss: 1.0717, test_loss: 1.1707, test_f1: 0.4619
 epoch: 12, train_loss: 1.0594, test_loss: 1.1608, test_f1: 0.4840
 epoch: 13, train_loss: 1.0625, test_loss: 1.1590, test_f1: 0.4990
 epoch: 14, train_loss: 1.0565, test_loss: 1.1565, test_f1: 0.4940
 epoch: 15, train_loss: 1.0408, test_loss: 1.1422, test_f1: 0.4771
 epoch: 16, train_loss: 1.0457, test_loss: 1.1259, test_f1: 0.4969
 epoch: 17, train_loss: 1.0334, test_loss: 1.1279, test_f1: 0.5062
 epoch: 18, train_loss: 1.0282, test_loss: 1.1373, test_f1: 0.4959
 epoch: 19, train_loss: 1.0104, test_loss: 1.1359, test_f1: 0.5101
 epoch: 20, train_loss: 1.0130, test_loss: 1.1346, test_f1: 0.4941
 epoch: 21, train_loss: 1.0052, test_loss: 1.1235, test_f1: 0.4998
 epoch: 22, train_loss: 0.9905, test_loss: 1.1378, test_f1: 0.5220
 epoch: 23, train_loss: 0.9877, test_loss: 1.1202, test_f1: 0.5213
 epoch: 24, train_loss: 0.9894, test_loss: 1.1063, test_f1: 0.5263
 epoch: 25, train_loss: 0.9800, test_loss: 1.1057, test_f1: 0.5141
 epoch: 26, train_loss: 0.9672, test_loss: 1.1304, test_f1: 0.5198
 epoch: 27, train_loss: 0.9746, test_loss: 1.1084, test_f1: 0.5186
 epoch: 28, train_loss: 0.9594, test_loss: 1.1130, test_f1: 0.5340
 epoch: 29, train_loss: 0.9468, test_loss: 1.1094, test_f1: 0.5302
 epoch: 30, train_loss: 0.9476, test_loss: 1.1115, test_f1: 0.5328
 epoch: 31, train_loss: 0.9400, test_loss: 1.0952, test_f1: 0.5264
 epoch: 32, train_loss: 0.9457, test_loss: 1.0998, test_f1: 0.5188
 epoch: 33, train_loss: 0.9486, test_loss: 1.0915, test_f1: 0.5135
 epoch: 34, train_loss: 0.9354, test_loss: 1.0994, test_f1: 0.5176
 epoch: 35, train_loss: 0.9254, test_loss: 1.0935, test_f1: 0.5237
 epoch: 36, train_loss: 0.9297, test_loss: 1.1016, test_f1: 0.5235
 epoch: 37, train_loss: 0.9211, test_loss: 1.0967, test_f1: 0.5435
 epoch: 38, train_loss: 0.9122, test_loss: 1.0990, test_f1: 0.5212
 epoch: 39, train_loss: 0.9163, test_loss: 1.1136, test_f1: 0.5192
 epoch: 40, train_loss: 0.9100, test_loss: 1.0783, test_f1: 0.5479
 epoch: 41, train_loss: 0.9047, test_loss: 1.0951, test_f1: 0.5477
 epoch: 42, train_loss: 0.8961, test_loss: 1.1149, test_f1: 0.5340
 epoch: 43, train_loss: 0.9217, test_loss: 1.1202, test_f1: 0.5015
 epoch: 44, train_loss: 0.8943, test_loss: 1.1446, test_f1: 0.5188
 epoch: 45, train_loss: 0.8973, test_loss: 1.1269, test_f1: 0.5109
 epoch: 46, train_loss: 0.8804, test_loss: 1.1055, test_f1: 0.5269
 epoch: 47, train_loss: 0.8748, test_loss: 1.0979, test_f1: 0.5440
 epoch: 48, train_loss: 0.8801, test_loss: 1.1263, test_f1: 0.5252
 epoch: 49, train_loss: 0.8802, test_loss: 1.1124, test_f1: 0.5366
 epoch: 50, train_loss: 0.8683, test_loss: 1.1099, test_f1: 0.5402
 epoch: 51, train_loss: 0.8745, test_loss: 1.1035, test_f1: 0.5555
 epoch: 52, train_loss: 0.8721, test_loss: 1.1075, test_f1: 0.5493
 epoch: 53, train_loss: 0.8607, test_loss: 1.1233, test_f1: 0.5436
 epoch: 54, train_loss: 0.8527, test_loss: 1.1221, test_f1: 0.5506
 epoch: 55, train_loss: 0.8724, test_loss: 1.1262, test_f1: 0.5335
 epoch: 56, train_loss: 0.8579, test_loss: 1.1142, test_f1: 0.5396
 epoch: 57, train_loss: 0.8503, test_loss: 1.1106, test_f1: 0.5412
 epoch: 58, train_loss: 0.8465, test_loss: 1.1445, test_f1: 0.5310
 epoch: 59, train_loss: 0.8501, test_loss: 1.1345, test_f1: 0.5481
 epoch: 60, train_loss: 0.8548, test_loss: 1.1287, test_f1: 0.5544
 epoch: 61, train_loss: 0.8438, test_loss: 1.1504, test_f1: 0.5567
 epoch: 62, train_loss: 0.8449, test_loss: 1.1590, test_f1: 0.5463
 epoch: 63, train_loss: 0.8483, test_loss: 1.1725, test_f1: 0.5368
 epoch: 64, train_loss: 0.8417, test_loss: 1.1645, test_f1: 0.5494
 epoch: 65, train_loss: 0.8473, test_loss: 1.1685, test_f1: 0.5352
 epoch: 66, train_loss: 0.8552, test_loss: 1.1684, test_f1: 0.5503
 epoch: 67, train_loss: 0.8364, test_loss: 1.1538, test_f1: 0.5568
 epoch: 68, train_loss: 0.8299, test_loss: 1.1498, test_f1: 0.5490
 epoch: 69, train_loss: 0.8358, test_loss: 1.1374, test_f1: 0.5530
 epoch: 70, train_loss: 0.8356, test_loss: 1.1542, test_f1: 0.5505
 epoch: 71, train_loss: 0.8238, test_loss: 1.1697, test_f1: 0.5498
 epoch: 72, train_loss: 0.8273, test_loss: 1.1890, test_f1: 0.5362
 epoch: 73, train_loss: 0.8255, test_loss: 1.1611, test_f1: 0.5471
 epoch: 74, train_loss: 0.8452, test_loss: 1.1770, test_f1: 0.5348
 epoch: 75, train_loss: 0.8332, test_loss: 1.1987, test_f1: 0.5336
 epoch: 76, train_loss: 0.8258, test_loss: 1.2080, test_f1: 0.5295
 epoch: 77, train_loss: 0.8397, test_loss: 1.1841, test_f1: 0.5537
 epoch: 78, train_loss: 0.8396, test_loss: 1.2058, test_f1: 0.5370
 epoch: 79, train_loss: 0.8300, test_loss: 1.1919, test_f1: 0.5381
 epoch: 80, train_loss: 0.8320, test_loss: 1.1910, test_f1: 0.5385
 epoch: 81, train_loss: 0.8284, test_loss: 1.1921, test_f1: 0.5488
 epoch: 82, train_loss: 0.8134, test_loss: 1.2097, test_f1: 0.5464
 epoch: 83, train_loss: 0.8040, test_loss: 1.2096, test_f1: 0.5469
 epoch: 84, train_loss: 0.8219, test_loss: 1.2055, test_f1: 0.5571
 epoch: 85, train_loss: 0.8191, test_loss: 1.1943, test_f1: 0.5470
 epoch: 86, train_loss: 0.8092, test_loss: 1.2177, test_f1: 0.5421
 epoch: 87, train_loss: 0.8005, test_loss: 1.2119, test_f1: 0.5380
 epoch: 88, train_loss: 0.8210, test_loss: 1.1879, test_f1: 0.5382
 epoch: 89, train_loss: 0.8164, test_loss: 1.2011, test_f1: 0.5344
 epoch: 90, train_loss: 0.8192, test_loss: 1.2066, test_f1: 0.5444
 epoch: 91, train_loss: 0.8151, test_loss: 1.2005, test_f1: 0.5449
 epoch: 92, train_loss: 0.7980, test_loss: 1.1641, test_f1: 0.5446
 epoch: 93, train_loss: 0.7904, test_loss: 1.1562, test_f1: 0.5486
 epoch: 94, train_loss: 0.8049, test_loss: 1.1609, test_f1: 0.5420
 epoch: 95, train_loss: 0.8018, test_loss: 1.1708, test_f1: 0.5480
 epoch: 96, train_loss: 0.7989, test_loss: 1.1912, test_f1: 0.5521
 epoch: 97, train_loss: 0.8035, test_loss: 1.2152, test_f1: 0.5508
 epoch: 98, train_loss: 0.7921, test_loss: 1.2291, test_f1: 0.5491
 epoch: 99, train_loss: 0.7931, test_loss: 1.2137, test_f1: 0.5501
##################ITERATION #5 ****************************************
 epoch: 0, train_loss: 1.2372, test_loss: 1.3245, test_f1: 0.2281
 epoch: 1, train_loss: 1.1820, test_loss: 1.3411, test_f1: 0.2281
 epoch: 2, train_loss: 1.1612, test_loss: 1.3201, test_f1: 0.2712
 epoch: 3, train_loss: 1.1461, test_loss: 1.2810, test_f1: 0.2819
 epoch: 4, train_loss: 1.1221, test_loss: 1.2444, test_f1: 0.3510
 epoch: 5, train_loss: 1.1068, test_loss: 1.1963, test_f1: 0.3769
 epoch: 6, train_loss: 1.0936, test_loss: 1.1604, test_f1: 0.4284
 epoch: 7, train_loss: 1.0858, test_loss: 1.1476, test_f1: 0.4258
 epoch: 8, train_loss: 1.0746, test_loss: 1.1428, test_f1: 0.4194
 epoch: 9, train_loss: 1.0694, test_loss: 1.1435, test_f1: 0.4217
 epoch: 10, train_loss: 1.0651, test_loss: 1.1397, test_f1: 0.4113
 epoch: 11, train_loss: 1.0581, test_loss: 1.1328, test_f1: 0.4137
 epoch: 12, train_loss: 1.0408, test_loss: 1.1204, test_f1: 0.4221
 epoch: 13, train_loss: 1.0414, test_loss: 1.1194, test_f1: 0.4102
 epoch: 14, train_loss: 1.0252, test_loss: 1.1214, test_f1: 0.4022
 epoch: 15, train_loss: 1.0205, test_loss: 1.1101, test_f1: 0.4056
 epoch: 16, train_loss: 1.0145, test_loss: 1.1027, test_f1: 0.4425
 epoch: 17, train_loss: 1.0146, test_loss: 1.1101, test_f1: 0.4382
 epoch: 18, train_loss: 1.0090, test_loss: 1.1060, test_f1: 0.4585
 epoch: 19, train_loss: 0.9896, test_loss: 1.0885, test_f1: 0.4558
 epoch: 20, train_loss: 0.9930, test_loss: 1.0903, test_f1: 0.4742
 epoch: 21, train_loss: 0.9800, test_loss: 1.0833, test_f1: 0.4830
 epoch: 22, train_loss: 0.9749, test_loss: 1.0809, test_f1: 0.4968
 epoch: 23, train_loss: 0.9718, test_loss: 1.0901, test_f1: 0.4914
 epoch: 24, train_loss: 0.9728, test_loss: 1.0840, test_f1: 0.4923
 epoch: 25, train_loss: 0.9726, test_loss: 1.0799, test_f1: 0.5048
 epoch: 26, train_loss: 0.9494, test_loss: 1.0717, test_f1: 0.5052
 epoch: 27, train_loss: 0.9505, test_loss: 1.0779, test_f1: 0.5023
 epoch: 28, train_loss: 0.9468, test_loss: 1.0736, test_f1: 0.5100
 epoch: 29, train_loss: 0.9392, test_loss: 1.0804, test_f1: 0.5160
 epoch: 30, train_loss: 0.9451, test_loss: 1.0635, test_f1: 0.5189
 epoch: 31, train_loss: 0.9383, test_loss: 1.0796, test_f1: 0.5130
 epoch: 32, train_loss: 0.9266, test_loss: 1.0715, test_f1: 0.5266
 epoch: 33, train_loss: 0.9211, test_loss: 1.0580, test_f1: 0.5201
 epoch: 34, train_loss: 0.9108, test_loss: 1.0545, test_f1: 0.5211
 epoch: 35, train_loss: 0.9201, test_loss: 1.0348, test_f1: 0.5273
 epoch: 36, train_loss: 0.9085, test_loss: 1.0895, test_f1: 0.5149
 epoch: 37, train_loss: 0.9090, test_loss: 1.0842, test_f1: 0.5327
 epoch: 38, train_loss: 0.9013, test_loss: 1.0711, test_f1: 0.5420
 epoch: 39, train_loss: 0.9028, test_loss: 1.0685, test_f1: 0.5448
 epoch: 40, train_loss: 0.9075, test_loss: 1.0738, test_f1: 0.5329
 epoch: 41, train_loss: 0.9022, test_loss: 1.0744, test_f1: 0.5391
 epoch: 42, train_loss: 0.8823, test_loss: 1.1051, test_f1: 0.5438
 epoch: 43, train_loss: 0.8921, test_loss: 1.0804, test_f1: 0.5422
 epoch: 44, train_loss: 0.8779, test_loss: 1.0775, test_f1: 0.5477
 epoch: 45, train_loss: 0.8809, test_loss: 1.0605, test_f1: 0.5524
 epoch: 46, train_loss: 0.8778, test_loss: 1.0681, test_f1: 0.5402
 epoch: 47, train_loss: 0.8680, test_loss: 1.0896, test_f1: 0.5364
 epoch: 48, train_loss: 0.8762, test_loss: 1.0521, test_f1: 0.5547
 epoch: 49, train_loss: 0.8664, test_loss: 1.0452, test_f1: 0.5556
 epoch: 50, train_loss: 0.8582, test_loss: 1.0737, test_f1: 0.5492
 epoch: 51, train_loss: 0.8483, test_loss: 1.0592, test_f1: 0.5626
 epoch: 52, train_loss: 0.8557, test_loss: 1.0590, test_f1: 0.5652
 epoch: 53, train_loss: 0.8451, test_loss: 1.0547, test_f1: 0.5511
 epoch: 54, train_loss: 0.8554, test_loss: 1.0603, test_f1: 0.5521
 epoch: 55, train_loss: 0.8518, test_loss: 1.0612, test_f1: 0.5653
 epoch: 56, train_loss: 0.8491, test_loss: 1.0654, test_f1: 0.5612
 epoch: 57, train_loss: 0.8496, test_loss: 1.0662, test_f1: 0.5692
 epoch: 58, train_loss: 0.8534, test_loss: 1.0646, test_f1: 0.5814
 epoch: 59, train_loss: 0.8396, test_loss: 1.0595, test_f1: 0.5630
 epoch: 60, train_loss: 0.8456, test_loss: 1.0580, test_f1: 0.5633
 epoch: 61, train_loss: 0.8365, test_loss: 1.0637, test_f1: 0.5705
 epoch: 62, train_loss: 0.8374, test_loss: 1.0751, test_f1: 0.5557
 epoch: 63, train_loss: 0.8398, test_loss: 1.0768, test_f1: 0.5840
 epoch: 64, train_loss: 0.8310, test_loss: 1.0718, test_f1: 0.5557
 epoch: 65, train_loss: 0.8365, test_loss: 1.0644, test_f1: 0.5868
 epoch: 66, train_loss: 0.8281, test_loss: 1.0613, test_f1: 0.5679
 epoch: 67, train_loss: 0.8348, test_loss: 1.0833, test_f1: 0.5560
 epoch: 68, train_loss: 0.8361, test_loss: 1.0666, test_f1: 0.5634
 epoch: 69, train_loss: 0.8175, test_loss: 1.0555, test_f1: 0.5684
 epoch: 70, train_loss: 0.8279, test_loss: 1.0991, test_f1: 0.5430
 epoch: 71, train_loss: 0.8312, test_loss: 1.0675, test_f1: 0.5699
 epoch: 72, train_loss: 0.8308, test_loss: 1.0641, test_f1: 0.5666
 epoch: 73, train_loss: 0.8213, test_loss: 1.0723, test_f1: 0.5782
 epoch: 74, train_loss: 0.8139, test_loss: 1.0871, test_f1: 0.5586
 epoch: 75, train_loss: 0.8191, test_loss: 1.0989, test_f1: 0.5710
 epoch: 76, train_loss: 0.8232, test_loss: 1.0726, test_f1: 0.5793
 epoch: 77, train_loss: 0.8102, test_loss: 1.0931, test_f1: 0.5539
 epoch: 78, train_loss: 0.8132, test_loss: 1.0717, test_f1: 0.5630
 epoch: 79, train_loss: 0.8155, test_loss: 1.0706, test_f1: 0.5599
 epoch: 80, train_loss: 0.8037, test_loss: 1.0624, test_f1: 0.5567
 epoch: 81, train_loss: 0.8111, test_loss: 1.0688, test_f1: 0.5617
 epoch: 82, train_loss: 0.8031, test_loss: 1.0719, test_f1: 0.5586
 epoch: 83, train_loss: 0.8092, test_loss: 1.0585, test_f1: 0.5593
 epoch: 84, train_loss: 0.8037, test_loss: 1.0634, test_f1: 0.5635
 epoch: 85, train_loss: 0.8035, test_loss: 1.0780, test_f1: 0.5633
 epoch: 86, train_loss: 0.8096, test_loss: 1.0892, test_f1: 0.5508
 epoch: 87, train_loss: 0.7963, test_loss: 1.0573, test_f1: 0.5633
 epoch: 88, train_loss: 0.8015, test_loss: 1.0550, test_f1: 0.5588
 epoch: 89, train_loss: 0.7916, test_loss: 1.0876, test_f1: 0.5665
 epoch: 90, train_loss: 0.8001, test_loss: 1.0834, test_f1: 0.5753
 epoch: 91, train_loss: 0.7980, test_loss: 1.0652, test_f1: 0.5548
 epoch: 92, train_loss: 0.7922, test_loss: 1.0546, test_f1: 0.5638
 epoch: 93, train_loss: 0.7863, test_loss: 1.0892, test_f1: 0.5648
 epoch: 94, train_loss: 0.8060, test_loss: 1.0466, test_f1: 0.5725
 epoch: 95, train_loss: 0.7943, test_loss: 1.0662, test_f1: 0.5803
 epoch: 96, train_loss: 0.7843, test_loss: 1.0569, test_f1: 0.5751
 epoch: 97, train_loss: 0.7853, test_loss: 1.0872, test_f1: 0.5726
 epoch: 98, train_loss: 0.7978, test_loss: 1.0789, test_f1: 0.5608
 epoch: 99, train_loss: 0.7848, test_loss: 1.0882, test_f1: 0.5678
##################ITERATION #6 ****************************************
 epoch: 0, train_loss: 1.2546, test_loss: 1.3148, test_f1: 0.2281
 epoch: 1, train_loss: 1.1895, test_loss: 1.3127, test_f1: 0.2281
 epoch: 2, train_loss: 1.1592, test_loss: 1.2856, test_f1: 0.2477
 epoch: 3, train_loss: 1.1438, test_loss: 1.2622, test_f1: 0.2676
 epoch: 4, train_loss: 1.1248, test_loss: 1.2328, test_f1: 0.2901
 epoch: 5, train_loss: 1.1066, test_loss: 1.1966, test_f1: 0.3571
 epoch: 6, train_loss: 1.0960, test_loss: 1.1750, test_f1: 0.3664
 epoch: 7, train_loss: 1.0906, test_loss: 1.1575, test_f1: 0.4206
 epoch: 8, train_loss: 1.0745, test_loss: 1.1415, test_f1: 0.4586
 epoch: 9, train_loss: 1.0635, test_loss: 1.1235, test_f1: 0.4650
 epoch: 10, train_loss: 1.0590, test_loss: 1.1279, test_f1: 0.4587
 epoch: 11, train_loss: 1.0506, test_loss: 1.1129, test_f1: 0.4701
 epoch: 12, train_loss: 1.0497, test_loss: 1.1049, test_f1: 0.4686
 epoch: 13, train_loss: 1.0267, test_loss: 1.0941, test_f1: 0.4700
 epoch: 14, train_loss: 1.0230, test_loss: 1.0811, test_f1: 0.4788
 epoch: 15, train_loss: 1.0125, test_loss: 1.0713, test_f1: 0.4835
 epoch: 16, train_loss: 1.0042, test_loss: 1.0697, test_f1: 0.4851
 epoch: 17, train_loss: 1.0052, test_loss: 1.0638, test_f1: 0.4935
 epoch: 18, train_loss: 0.9939, test_loss: 1.0616, test_f1: 0.4833
 epoch: 19, train_loss: 0.9896, test_loss: 1.0635, test_f1: 0.4928
 epoch: 20, train_loss: 0.9769, test_loss: 1.0543, test_f1: 0.5051
 epoch: 21, train_loss: 0.9707, test_loss: 1.0504, test_f1: 0.5101
 epoch: 22, train_loss: 0.9720, test_loss: 1.0458, test_f1: 0.4987
 epoch: 23, train_loss: 0.9566, test_loss: 1.0447, test_f1: 0.5055
 epoch: 24, train_loss: 0.9624, test_loss: 1.0497, test_f1: 0.5193
 epoch: 25, train_loss: 0.9556, test_loss: 1.0444, test_f1: 0.5093
 epoch: 26, train_loss: 0.9469, test_loss: 1.0266, test_f1: 0.5140
 epoch: 27, train_loss: 0.9371, test_loss: 1.0247, test_f1: 0.5144
 epoch: 28, train_loss: 0.9391, test_loss: 1.0333, test_f1: 0.5214
 epoch: 29, train_loss: 0.9292, test_loss: 1.0339, test_f1: 0.5223
 epoch: 30, train_loss: 0.9398, test_loss: 1.0295, test_f1: 0.5228
 epoch: 31, train_loss: 0.9240, test_loss: 1.0298, test_f1: 0.5243
 epoch: 32, train_loss: 0.9188, test_loss: 1.0361, test_f1: 0.5200
 epoch: 33, train_loss: 0.9187, test_loss: 1.0117, test_f1: 0.5364
 epoch: 34, train_loss: 0.9034, test_loss: 1.0251, test_f1: 0.5291
 epoch: 35, train_loss: 0.9107, test_loss: 1.0184, test_f1: 0.5479
 epoch: 36, train_loss: 0.9083, test_loss: 1.0203, test_f1: 0.5591
 epoch: 37, train_loss: 0.8900, test_loss: 1.0359, test_f1: 0.5423
 epoch: 38, train_loss: 0.8878, test_loss: 1.0252, test_f1: 0.5572
 epoch: 39, train_loss: 0.8859, test_loss: 1.0218, test_f1: 0.5536
 epoch: 40, train_loss: 0.8943, test_loss: 1.0133, test_f1: 0.5619
 epoch: 41, train_loss: 0.8875, test_loss: 1.0123, test_f1: 0.5689
 epoch: 42, train_loss: 0.8844, test_loss: 1.0198, test_f1: 0.5686
 epoch: 43, train_loss: 0.8682, test_loss: 1.0034, test_f1: 0.5605
 epoch: 44, train_loss: 0.8791, test_loss: 1.0112, test_f1: 0.5785
 epoch: 45, train_loss: 0.8706, test_loss: 1.0183, test_f1: 0.5660
 epoch: 46, train_loss: 0.8730, test_loss: 1.0174, test_f1: 0.5626
 epoch: 47, train_loss: 0.8624, test_loss: 1.0283, test_f1: 0.5535
 epoch: 48, train_loss: 0.8563, test_loss: 1.0275, test_f1: 0.5625
 epoch: 49, train_loss: 0.8708, test_loss: 1.0266, test_f1: 0.5599
 epoch: 50, train_loss: 0.8604, test_loss: 1.0107, test_f1: 0.5651
 epoch: 51, train_loss: 0.8575, test_loss: 1.0172, test_f1: 0.5703
 epoch: 52, train_loss: 0.8556, test_loss: 1.0355, test_f1: 0.5751
 epoch: 53, train_loss: 0.8411, test_loss: 1.0331, test_f1: 0.5767
 epoch: 54, train_loss: 0.8517, test_loss: 1.0373, test_f1: 0.5554
 epoch: 55, train_loss: 0.8479, test_loss: 1.0393, test_f1: 0.5661
 epoch: 56, train_loss: 0.8387, test_loss: 1.0442, test_f1: 0.5569
 epoch: 57, train_loss: 0.8410, test_loss: 1.0341, test_f1: 0.5577
 epoch: 58, train_loss: 0.8379, test_loss: 1.0249, test_f1: 0.5782
 epoch: 59, train_loss: 0.8274, test_loss: 1.0199, test_f1: 0.5761
 epoch: 60, train_loss: 0.8235, test_loss: 1.0285, test_f1: 0.5679
 epoch: 61, train_loss: 0.8229, test_loss: 1.0387, test_f1: 0.5748
 epoch: 62, train_loss: 0.8339, test_loss: 1.0394, test_f1: 0.5895
 epoch: 63, train_loss: 0.8285, test_loss: 1.0289, test_f1: 0.5754
 epoch: 64, train_loss: 0.8263, test_loss: 1.0183, test_f1: 0.6071
 epoch: 65, train_loss: 0.8242, test_loss: 1.0296, test_f1: 0.5966
 epoch: 66, train_loss: 0.8163, test_loss: 1.0259, test_f1: 0.5888
 epoch: 67, train_loss: 0.8190, test_loss: 1.0346, test_f1: 0.5860
 epoch: 68, train_loss: 0.8204, test_loss: 1.0325, test_f1: 0.5663
 epoch: 69, train_loss: 0.8142, test_loss: 1.0305, test_f1: 0.5572
 epoch: 70, train_loss: 0.8295, test_loss: 1.0323, test_f1: 0.5772
 epoch: 71, train_loss: 0.8183, test_loss: 1.0301, test_f1: 0.5888
 epoch: 72, train_loss: 0.8121, test_loss: 1.0254, test_f1: 0.6022
 epoch: 73, train_loss: 0.8211, test_loss: 1.0234, test_f1: 0.5803
 epoch: 74, train_loss: 0.8138, test_loss: 1.0235, test_f1: 0.5831
 epoch: 75, train_loss: 0.8210, test_loss: 1.0270, test_f1: 0.5738
 epoch: 76, train_loss: 0.8112, test_loss: 1.0429, test_f1: 0.5876
 epoch: 77, train_loss: 0.8188, test_loss: 1.0176, test_f1: 0.5792
 epoch: 78, train_loss: 0.8038, test_loss: 1.0165, test_f1: 0.5790
 epoch: 79, train_loss: 0.7997, test_loss: 1.0214, test_f1: 0.5841
 epoch: 80, train_loss: 0.8053, test_loss: 1.0294, test_f1: 0.6004
 epoch: 81, train_loss: 0.8094, test_loss: 1.0323, test_f1: 0.6032
 epoch: 82, train_loss: 0.8011, test_loss: 1.0154, test_f1: 0.5896
 epoch: 83, train_loss: 0.8003, test_loss: 1.0302, test_f1: 0.5922
 epoch: 84, train_loss: 0.8152, test_loss: 1.0357, test_f1: 0.5982
 epoch: 85, train_loss: 0.7996, test_loss: 1.0181, test_f1: 0.5826
 epoch: 86, train_loss: 0.7867, test_loss: 1.0208, test_f1: 0.5896
 epoch: 87, train_loss: 0.7956, test_loss: 1.0360, test_f1: 0.5921
 epoch: 88, train_loss: 0.7870, test_loss: 1.0266, test_f1: 0.5842
 epoch: 89, train_loss: 0.7932, test_loss: 1.0387, test_f1: 0.6070
 epoch: 90, train_loss: 0.7839, test_loss: 1.0334, test_f1: 0.5972
 epoch: 91, train_loss: 0.7952, test_loss: 1.0300, test_f1: 0.6054
 epoch: 92, train_loss: 0.7767, test_loss: 1.0405, test_f1: 0.6153
 epoch: 93, train_loss: 0.7884, test_loss: 1.0493, test_f1: 0.5964
 epoch: 94, train_loss: 0.7836, test_loss: 1.0385, test_f1: 0.5990
 epoch: 95, train_loss: 0.7841, test_loss: 1.0284, test_f1: 0.6016
 epoch: 96, train_loss: 0.7954, test_loss: 1.0274, test_f1: 0.6098
 epoch: 97, train_loss: 0.7852, test_loss: 1.0446, test_f1: 0.5912
 epoch: 98, train_loss: 0.7748, test_loss: 1.0307, test_f1: 0.5924
 epoch: 99, train_loss: 0.7842, test_loss: 1.0353, test_f1: 0.6095
##################ITERATION #7 ****************************************
 epoch: 0, train_loss: 1.2616, test_loss: 1.3559, test_f1: 0.2281
 epoch: 1, train_loss: 1.1869, test_loss: 1.3187, test_f1: 0.2281
 epoch: 2, train_loss: 1.1687, test_loss: 1.2789, test_f1: 0.2444
 epoch: 3, train_loss: 1.1427, test_loss: 1.2552, test_f1: 0.2725
 epoch: 4, train_loss: 1.1271, test_loss: 1.2161, test_f1: 0.2758
 epoch: 5, train_loss: 1.1059, test_loss: 1.1889, test_f1: 0.3250
 epoch: 6, train_loss: 1.1027, test_loss: 1.1567, test_f1: 0.3758
 epoch: 7, train_loss: 1.0934, test_loss: 1.1372, test_f1: 0.4266
 epoch: 8, train_loss: 1.0663, test_loss: 1.1220, test_f1: 0.4825
 epoch: 9, train_loss: 1.0648, test_loss: 1.1097, test_f1: 0.4897
 epoch: 10, train_loss: 1.0530, test_loss: 1.0984, test_f1: 0.4634
 epoch: 11, train_loss: 1.0398, test_loss: 1.0913, test_f1: 0.4874
 epoch: 12, train_loss: 1.0360, test_loss: 1.0905, test_f1: 0.4937
 epoch: 13, train_loss: 1.0262, test_loss: 1.0810, test_f1: 0.4994
 epoch: 14, train_loss: 1.0219, test_loss: 1.0851, test_f1: 0.5052
 epoch: 15, train_loss: 1.0093, test_loss: 1.0844, test_f1: 0.5133
 epoch: 16, train_loss: 1.0022, test_loss: 1.0845, test_f1: 0.4927
 epoch: 17, train_loss: 1.0051, test_loss: 1.0633, test_f1: 0.5087
 epoch: 18, train_loss: 0.9892, test_loss: 1.0549, test_f1: 0.5102
 epoch: 19, train_loss: 0.9911, test_loss: 1.0564, test_f1: 0.5085
 epoch: 20, train_loss: 0.9787, test_loss: 1.0451, test_f1: 0.5291
 epoch: 21, train_loss: 0.9734, test_loss: 1.0433, test_f1: 0.5300
 epoch: 22, train_loss: 0.9680, test_loss: 1.0448, test_f1: 0.5123
 epoch: 23, train_loss: 0.9658, test_loss: 1.0379, test_f1: 0.5054
 epoch: 24, train_loss: 0.9613, test_loss: 1.0328, test_f1: 0.5266
 epoch: 25, train_loss: 0.9588, test_loss: 1.0331, test_f1: 0.5210
 epoch: 26, train_loss: 0.9476, test_loss: 1.0334, test_f1: 0.5062
 epoch: 27, train_loss: 0.9471, test_loss: 1.0227, test_f1: 0.5104
 epoch: 28, train_loss: 0.9441, test_loss: 1.0167, test_f1: 0.5260
 epoch: 29, train_loss: 0.9323, test_loss: 1.0144, test_f1: 0.5274
 epoch: 30, train_loss: 0.9398, test_loss: 1.0283, test_f1: 0.4969
 epoch: 31, train_loss: 0.9238, test_loss: 1.0335, test_f1: 0.5215
 epoch: 32, train_loss: 0.9387, test_loss: 1.0285, test_f1: 0.5201
 epoch: 33, train_loss: 0.9253, test_loss: 1.0162, test_f1: 0.5137
 epoch: 34, train_loss: 0.9047, test_loss: 1.0325, test_f1: 0.5230
 epoch: 35, train_loss: 0.9070, test_loss: 1.0404, test_f1: 0.5244
 epoch: 36, train_loss: 0.9139, test_loss: 1.0369, test_f1: 0.5385
 epoch: 37, train_loss: 0.9171, test_loss: 1.0283, test_f1: 0.5237
 epoch: 38, train_loss: 0.9028, test_loss: 1.0302, test_f1: 0.5246
 epoch: 39, train_loss: 0.9028, test_loss: 1.0314, test_f1: 0.5343
 epoch: 40, train_loss: 0.8990, test_loss: 1.0291, test_f1: 0.5275
 epoch: 41, train_loss: 0.8966, test_loss: 1.0448, test_f1: 0.5165
 epoch: 42, train_loss: 0.8895, test_loss: 1.0344, test_f1: 0.5336
 epoch: 43, train_loss: 0.8971, test_loss: 1.0083, test_f1: 0.5236
 epoch: 44, train_loss: 0.8872, test_loss: 1.0110, test_f1: 0.5659
 epoch: 45, train_loss: 0.8856, test_loss: 1.0148, test_f1: 0.5298
 epoch: 46, train_loss: 0.8647, test_loss: 1.0072, test_f1: 0.5424
 epoch: 47, train_loss: 0.8715, test_loss: 1.0256, test_f1: 0.5524
 epoch: 48, train_loss: 0.8644, test_loss: 1.0151, test_f1: 0.5366
 epoch: 49, train_loss: 0.8786, test_loss: 0.9891, test_f1: 0.5474
 epoch: 50, train_loss: 0.8745, test_loss: 1.0148, test_f1: 0.5413
 epoch: 51, train_loss: 0.8541, test_loss: 1.0180, test_f1: 0.5414
 epoch: 52, train_loss: 0.8545, test_loss: 0.9868, test_f1: 0.5592
 epoch: 53, train_loss: 0.8628, test_loss: 1.0094, test_f1: 0.5381
 epoch: 54, train_loss: 0.8553, test_loss: 1.0233, test_f1: 0.5436
 epoch: 55, train_loss: 0.8474, test_loss: 1.0156, test_f1: 0.5438
 epoch: 56, train_loss: 0.8408, test_loss: 1.0041, test_f1: 0.5582
 epoch: 57, train_loss: 0.8364, test_loss: 1.0044, test_f1: 0.5477
 epoch: 58, train_loss: 0.8500, test_loss: 1.0050, test_f1: 0.5602
 epoch: 59, train_loss: 0.8403, test_loss: 1.0066, test_f1: 0.5565
 epoch: 60, train_loss: 0.8388, test_loss: 0.9919, test_f1: 0.5548
 epoch: 61, train_loss: 0.8422, test_loss: 1.0081, test_f1: 0.5601
 epoch: 62, train_loss: 0.8362, test_loss: 1.0098, test_f1: 0.5619
 epoch: 63, train_loss: 0.8327, test_loss: 1.0114, test_f1: 0.5469
 epoch: 64, train_loss: 0.8320, test_loss: 1.0096, test_f1: 0.5662
 epoch: 65, train_loss: 0.8405, test_loss: 1.0084, test_f1: 0.5480
 epoch: 66, train_loss: 0.8385, test_loss: 0.9987, test_f1: 0.5522
 epoch: 67, train_loss: 0.8336, test_loss: 1.0053, test_f1: 0.5525
 epoch: 68, train_loss: 0.8477, test_loss: 1.0069, test_f1: 0.5581
 epoch: 69, train_loss: 0.8434, test_loss: 1.0051, test_f1: 0.5701
 epoch: 70, train_loss: 0.8189, test_loss: 0.9906, test_f1: 0.5685
 epoch: 71, train_loss: 0.8233, test_loss: 1.0014, test_f1: 0.5712
 epoch: 72, train_loss: 0.8156, test_loss: 0.9911, test_f1: 0.5683
 epoch: 73, train_loss: 0.8166, test_loss: 0.9951, test_f1: 0.5742
 epoch: 74, train_loss: 0.8212, test_loss: 1.0126, test_f1: 0.5613
 epoch: 75, train_loss: 0.8136, test_loss: 1.0090, test_f1: 0.5648
 epoch: 76, train_loss: 0.8197, test_loss: 0.9908, test_f1: 0.5775
 epoch: 77, train_loss: 0.8211, test_loss: 0.9905, test_f1: 0.5792
 epoch: 78, train_loss: 0.8103, test_loss: 0.9982, test_f1: 0.5810
 epoch: 79, train_loss: 0.8122, test_loss: 0.9987, test_f1: 0.5772
 epoch: 80, train_loss: 0.8177, test_loss: 0.9989, test_f1: 0.5631
 epoch: 81, train_loss: 0.8036, test_loss: 1.0052, test_f1: 0.5706
 epoch: 82, train_loss: 0.8193, test_loss: 0.9966, test_f1: 0.5714
 epoch: 83, train_loss: 0.8098, test_loss: 0.9940, test_f1: 0.5668
 epoch: 84, train_loss: 0.8156, test_loss: 1.0100, test_f1: 0.5697
 epoch: 85, train_loss: 0.8107, test_loss: 1.0019, test_f1: 0.5814
 epoch: 86, train_loss: 0.8141, test_loss: 1.0067, test_f1: 0.5862
 epoch: 87, train_loss: 0.8045, test_loss: 1.0052, test_f1: 0.5787
 epoch: 88, train_loss: 0.7993, test_loss: 1.0086, test_f1: 0.5593
 epoch: 89, train_loss: 0.8039, test_loss: 1.0118, test_f1: 0.5589
 epoch: 90, train_loss: 0.8120, test_loss: 1.0048, test_f1: 0.5634
 epoch: 91, train_loss: 0.8004, test_loss: 1.0077, test_f1: 0.5729
 epoch: 92, train_loss: 0.7913, test_loss: 1.0024, test_f1: 0.5692
 epoch: 93, train_loss: 0.8113, test_loss: 1.0085, test_f1: 0.5730
 epoch: 94, train_loss: 0.7970, test_loss: 1.0201, test_f1: 0.5580
 epoch: 95, train_loss: 0.7924, test_loss: 1.0157, test_f1: 0.5784
 epoch: 96, train_loss: 0.7955, test_loss: 1.0130, test_f1: 0.5682
 epoch: 97, train_loss: 0.8007, test_loss: 1.0042, test_f1: 0.5740
 epoch: 98, train_loss: 0.8093, test_loss: 1.0129, test_f1: 0.5712
 epoch: 99, train_loss: 0.7949, test_loss: 1.0135, test_f1: 0.5819
##################ITERATION #8 ****************************************
 epoch: 0, train_loss: 1.2919, test_loss: 1.3389, test_f1: 0.2320
 epoch: 1, train_loss: 1.1992, test_loss: 1.3064, test_f1: 0.2544
 epoch: 2, train_loss: 1.1585, test_loss: 1.2800, test_f1: 0.3547
 epoch: 3, train_loss: 1.1303, test_loss: 1.2358, test_f1: 0.4148
 epoch: 4, train_loss: 1.1216, test_loss: 1.2034, test_f1: 0.3848
 epoch: 5, train_loss: 1.1005, test_loss: 1.1788, test_f1: 0.4093
 epoch: 6, train_loss: 1.0940, test_loss: 1.1578, test_f1: 0.4739
 epoch: 7, train_loss: 1.0769, test_loss: 1.1367, test_f1: 0.4873
 epoch: 8, train_loss: 1.0656, test_loss: 1.1136, test_f1: 0.4774
 epoch: 9, train_loss: 1.0581, test_loss: 1.1138, test_f1: 0.4705
 epoch: 10, train_loss: 1.0387, test_loss: 1.1129, test_f1: 0.4604
 epoch: 11, train_loss: 1.0381, test_loss: 1.1057, test_f1: 0.4758
 epoch: 12, train_loss: 1.0136, test_loss: 1.0940, test_f1: 0.4820
 epoch: 13, train_loss: 1.0244, test_loss: 1.0967, test_f1: 0.4890
 epoch: 14, train_loss: 1.0105, test_loss: 1.0873, test_f1: 0.4926
 epoch: 15, train_loss: 0.9979, test_loss: 1.0726, test_f1: 0.4945
 epoch: 16, train_loss: 0.9943, test_loss: 1.0719, test_f1: 0.4880
 epoch: 17, train_loss: 0.9930, test_loss: 1.0722, test_f1: 0.5023
 epoch: 18, train_loss: 0.9900, test_loss: 1.0669, test_f1: 0.5068
 epoch: 19, train_loss: 0.9693, test_loss: 1.0583, test_f1: 0.5077
 epoch: 20, train_loss: 0.9709, test_loss: 1.0596, test_f1: 0.5181
 epoch: 21, train_loss: 0.9545, test_loss: 1.0589, test_f1: 0.5101
 epoch: 22, train_loss: 0.9599, test_loss: 1.0673, test_f1: 0.5084
 epoch: 23, train_loss: 0.9538, test_loss: 1.0649, test_f1: 0.5131
 epoch: 24, train_loss: 0.9361, test_loss: 1.0444, test_f1: 0.5338
 epoch: 25, train_loss: 0.9446, test_loss: 1.0526, test_f1: 0.5333
 epoch: 26, train_loss: 0.9435, test_loss: 1.0456, test_f1: 0.5410
 epoch: 27, train_loss: 0.9327, test_loss: 1.0449, test_f1: 0.5368
 epoch: 28, train_loss: 0.9231, test_loss: 1.0377, test_f1: 0.5408
 epoch: 29, train_loss: 0.9158, test_loss: 1.0488, test_f1: 0.5498
 epoch: 30, train_loss: 0.9146, test_loss: 1.0405, test_f1: 0.5405
 epoch: 31, train_loss: 0.9077, test_loss: 1.0342, test_f1: 0.5451
 epoch: 32, train_loss: 0.9038, test_loss: 1.0255, test_f1: 0.5441
 epoch: 33, train_loss: 0.8863, test_loss: 1.0464, test_f1: 0.5506
 epoch: 34, train_loss: 0.8943, test_loss: 1.0265, test_f1: 0.5520
 epoch: 35, train_loss: 0.8914, test_loss: 1.0359, test_f1: 0.5629
 epoch: 36, train_loss: 0.8921, test_loss: 1.0572, test_f1: 0.5565
 epoch: 37, train_loss: 0.8786, test_loss: 1.0371, test_f1: 0.5656
 epoch: 38, train_loss: 0.8837, test_loss: 1.0279, test_f1: 0.5589
 epoch: 39, train_loss: 0.8797, test_loss: 1.0380, test_f1: 0.5585
 epoch: 40, train_loss: 0.8747, test_loss: 1.0327, test_f1: 0.5582
 epoch: 41, train_loss: 0.8606, test_loss: 1.0611, test_f1: 0.5482
 epoch: 42, train_loss: 0.8563, test_loss: 1.0393, test_f1: 0.5566
 epoch: 43, train_loss: 0.8581, test_loss: 1.0203, test_f1: 0.5812
 epoch: 44, train_loss: 0.8639, test_loss: 1.0394, test_f1: 0.5763
 epoch: 45, train_loss: 0.8621, test_loss: 1.0338, test_f1: 0.5715
 epoch: 46, train_loss: 0.8411, test_loss: 1.0631, test_f1: 0.5660
 epoch: 47, train_loss: 0.8504, test_loss: 1.0298, test_f1: 0.5789
 epoch: 48, train_loss: 0.8377, test_loss: 1.0658, test_f1: 0.5770
 epoch: 49, train_loss: 0.8369, test_loss: 1.0643, test_f1: 0.5777
 epoch: 50, train_loss: 0.8224, test_loss: 1.0485, test_f1: 0.5737
 epoch: 51, train_loss: 0.8155, test_loss: 1.0264, test_f1: 0.5784
 epoch: 52, train_loss: 0.8310, test_loss: 1.0254, test_f1: 0.5856
 epoch: 53, train_loss: 0.8206, test_loss: 1.0438, test_f1: 0.5889
 epoch: 54, train_loss: 0.8288, test_loss: 1.0347, test_f1: 0.5743
 epoch: 55, train_loss: 0.8212, test_loss: 1.0383, test_f1: 0.5694
 epoch: 56, train_loss: 0.8093, test_loss: 1.0367, test_f1: 0.5777
 epoch: 57, train_loss: 0.8237, test_loss: 1.0329, test_f1: 0.5857
 epoch: 58, train_loss: 0.8193, test_loss: 1.0451, test_f1: 0.5687
 epoch: 59, train_loss: 0.8101, test_loss: 1.0431, test_f1: 0.5797
 epoch: 60, train_loss: 0.8258, test_loss: 1.0474, test_f1: 0.5779
 epoch: 61, train_loss: 0.8326, test_loss: 1.0668, test_f1: 0.5737
 epoch: 62, train_loss: 0.8181, test_loss: 1.0570, test_f1: 0.5769
 epoch: 63, train_loss: 0.8133, test_loss: 1.0549, test_f1: 0.5833
 epoch: 64, train_loss: 0.7906, test_loss: 1.0517, test_f1: 0.5686
 epoch: 65, train_loss: 0.7986, test_loss: 1.0588, test_f1: 0.5991
 epoch: 66, train_loss: 0.8014, test_loss: 1.0577, test_f1: 0.5889
 epoch: 67, train_loss: 0.7823, test_loss: 1.0796, test_f1: 0.5868
 epoch: 68, train_loss: 0.8036, test_loss: 1.0722, test_f1: 0.5945
 epoch: 69, train_loss: 0.7981, test_loss: 1.0602, test_f1: 0.5915
 epoch: 70, train_loss: 0.8046, test_loss: 1.0631, test_f1: 0.6080
 epoch: 71, train_loss: 0.7994, test_loss: 1.0575, test_f1: 0.5840
 epoch: 72, train_loss: 0.7808, test_loss: 1.0474, test_f1: 0.5878
 epoch: 73, train_loss: 0.8026, test_loss: 1.0677, test_f1: 0.5857
 epoch: 74, train_loss: 0.7920, test_loss: 1.0514, test_f1: 0.5959
 epoch: 75, train_loss: 0.7945, test_loss: 1.0621, test_f1: 0.5887
 epoch: 76, train_loss: 0.7869, test_loss: 1.0697, test_f1: 0.5965
 epoch: 77, train_loss: 0.7866, test_loss: 1.0805, test_f1: 0.5951
 epoch: 78, train_loss: 0.7784, test_loss: 1.0556, test_f1: 0.6008
 epoch: 79, train_loss: 0.7797, test_loss: 1.0500, test_f1: 0.5888
 epoch: 80, train_loss: 0.7843, test_loss: 1.0510, test_f1: 0.5865
 epoch: 81, train_loss: 0.7873, test_loss: 1.0670, test_f1: 0.5996
 epoch: 82, train_loss: 0.7801, test_loss: 1.0717, test_f1: 0.6014
 epoch: 83, train_loss: 0.7720, test_loss: 1.0736, test_f1: 0.5884
 epoch: 84, train_loss: 0.7763, test_loss: 1.0896, test_f1: 0.5867
 epoch: 85, train_loss: 0.7824, test_loss: 1.0798, test_f1: 0.5917
 epoch: 86, train_loss: 0.7792, test_loss: 1.0825, test_f1: 0.5999
 epoch: 87, train_loss: 0.7726, test_loss: 1.0804, test_f1: 0.5928
 epoch: 88, train_loss: 0.7724, test_loss: 1.0745, test_f1: 0.5993
 epoch: 89, train_loss: 0.7821, test_loss: 1.0744, test_f1: 0.6062
 epoch: 90, train_loss: 0.7716, test_loss: 1.0749, test_f1: 0.5987
 epoch: 91, train_loss: 0.7758, test_loss: 1.1046, test_f1: 0.6033
 epoch: 92, train_loss: 0.7666, test_loss: 1.1245, test_f1: 0.5951
 epoch: 93, train_loss: 0.7767, test_loss: 1.0875, test_f1: 0.5891
 epoch: 94, train_loss: 0.7708, test_loss: 1.0788, test_f1: 0.5788
 epoch: 95, train_loss: 0.7588, test_loss: 1.0956, test_f1: 0.5912
 epoch: 96, train_loss: 0.7651, test_loss: 1.1032, test_f1: 0.5946
 epoch: 97, train_loss: 0.7524, test_loss: 1.0662, test_f1: 0.6140
 epoch: 98, train_loss: 0.7691, test_loss: 1.0911, test_f1: 0.5870
 epoch: 99, train_loss: 0.7598, test_loss: 1.0997, test_f1: 0.6075
##################ITERATION #9 ****************************************
 epoch: 0, train_loss: 1.2883, test_loss: 1.3635, test_f1: 0.2281
 epoch: 1, train_loss: 1.1884, test_loss: 1.4623, test_f1: 0.0727
 epoch: 2, train_loss: 1.1717, test_loss: 1.4305, test_f1: 0.1120
 epoch: 3, train_loss: 1.1410, test_loss: 1.3409, test_f1: 0.2815
 epoch: 4, train_loss: 1.1208, test_loss: 1.2378, test_f1: 0.3539
 epoch: 5, train_loss: 1.1016, test_loss: 1.1931, test_f1: 0.3853
 epoch: 6, train_loss: 1.0851, test_loss: 1.1566, test_f1: 0.4531
 epoch: 7, train_loss: 1.0775, test_loss: 1.1380, test_f1: 0.4790
 epoch: 8, train_loss: 1.0632, test_loss: 1.1309, test_f1: 0.4874
 epoch: 9, train_loss: 1.0569, test_loss: 1.1219, test_f1: 0.4884
 epoch: 10, train_loss: 1.0292, test_loss: 1.1094, test_f1: 0.5180
 epoch: 11, train_loss: 1.0345, test_loss: 1.0975, test_f1: 0.5326
 epoch: 12, train_loss: 1.0206, test_loss: 1.0906, test_f1: 0.5304
 epoch: 13, train_loss: 1.0225, test_loss: 1.0801, test_f1: 0.5378
 epoch: 14, train_loss: 1.0065, test_loss: 1.0793, test_f1: 0.5337
 epoch: 15, train_loss: 0.9938, test_loss: 1.0813, test_f1: 0.5136
 epoch: 16, train_loss: 0.9987, test_loss: 1.0738, test_f1: 0.5252
 epoch: 17, train_loss: 0.9831, test_loss: 1.0606, test_f1: 0.5350
 epoch: 18, train_loss: 0.9849, test_loss: 1.0617, test_f1: 0.5443
 epoch: 19, train_loss: 0.9787, test_loss: 1.0540, test_f1: 0.5465
 epoch: 20, train_loss: 0.9772, test_loss: 1.0587, test_f1: 0.5446
 epoch: 21, train_loss: 0.9731, test_loss: 1.0573, test_f1: 0.5372
 epoch: 22, train_loss: 0.9523, test_loss: 1.0584, test_f1: 0.5372
 epoch: 23, train_loss: 0.9492, test_loss: 1.0539, test_f1: 0.5424
 epoch: 24, train_loss: 0.9331, test_loss: 1.0433, test_f1: 0.5472
 epoch: 25, train_loss: 0.9344, test_loss: 1.0419, test_f1: 0.5458
 epoch: 26, train_loss: 0.9287, test_loss: 1.0445, test_f1: 0.5453
 epoch: 27, train_loss: 0.9339, test_loss: 1.0416, test_f1: 0.5343
 epoch: 28, train_loss: 0.9266, test_loss: 1.0568, test_f1: 0.5427
 epoch: 29, train_loss: 0.9232, test_loss: 1.0449, test_f1: 0.5426
 epoch: 30, train_loss: 0.9122, test_loss: 1.0442, test_f1: 0.5528
 epoch: 31, train_loss: 0.9168, test_loss: 1.0363, test_f1: 0.5568
 epoch: 32, train_loss: 0.9102, test_loss: 1.0244, test_f1: 0.5479
 epoch: 33, train_loss: 0.9058, test_loss: 1.0199, test_f1: 0.5408
 epoch: 34, train_loss: 0.9023, test_loss: 1.0315, test_f1: 0.5523
 epoch: 35, train_loss: 0.8918, test_loss: 1.0297, test_f1: 0.5540
 epoch: 36, train_loss: 0.8872, test_loss: 1.0449, test_f1: 0.5421
 epoch: 37, train_loss: 0.8926, test_loss: 1.0375, test_f1: 0.5695
 epoch: 38, train_loss: 0.8756, test_loss: 1.0274, test_f1: 0.5823
 epoch: 39, train_loss: 0.8840, test_loss: 1.0190, test_f1: 0.5571
 epoch: 40, train_loss: 0.8693, test_loss: 1.0218, test_f1: 0.5627
 epoch: 41, train_loss: 0.8657, test_loss: 1.0313, test_f1: 0.5674
 epoch: 42, train_loss: 0.8666, test_loss: 1.0413, test_f1: 0.5637
 epoch: 43, train_loss: 0.8664, test_loss: 1.0270, test_f1: 0.5683
 epoch: 44, train_loss: 0.8582, test_loss: 1.0193, test_f1: 0.5744
 epoch: 45, train_loss: 0.8597, test_loss: 1.0324, test_f1: 0.5715
 epoch: 46, train_loss: 0.8583, test_loss: 1.0195, test_f1: 0.5732
 epoch: 47, train_loss: 0.8507, test_loss: 1.0208, test_f1: 0.5783
 epoch: 48, train_loss: 0.8506, test_loss: 1.0203, test_f1: 0.5773
 epoch: 49, train_loss: 0.8384, test_loss: 1.0316, test_f1: 0.5812
 epoch: 50, train_loss: 0.8300, test_loss: 1.0355, test_f1: 0.5698
 epoch: 51, train_loss: 0.8364, test_loss: 1.0398, test_f1: 0.5883
 epoch: 52, train_loss: 0.8348, test_loss: 1.0426, test_f1: 0.5831
 epoch: 53, train_loss: 0.8315, test_loss: 1.0395, test_f1: 0.5757
 epoch: 54, train_loss: 0.8315, test_loss: 1.0345, test_f1: 0.5757
 epoch: 55, train_loss: 0.8339, test_loss: 1.0274, test_f1: 0.5905
 epoch: 56, train_loss: 0.8175, test_loss: 1.0240, test_f1: 0.5907
 epoch: 57, train_loss: 0.8291, test_loss: 1.0281, test_f1: 0.5857
 epoch: 58, train_loss: 0.8177, test_loss: 1.0295, test_f1: 0.5857
 epoch: 59, train_loss: 0.8251, test_loss: 1.0222, test_f1: 0.5928
 epoch: 60, train_loss: 0.8197, test_loss: 1.0226, test_f1: 0.5926
 epoch: 61, train_loss: 0.8276, test_loss: 1.0326, test_f1: 0.5876
 epoch: 62, train_loss: 0.8143, test_loss: 1.0237, test_f1: 0.5871
 epoch: 63, train_loss: 0.8215, test_loss: 1.0217, test_f1: 0.5865
 epoch: 64, train_loss: 0.8050, test_loss: 1.0150, test_f1: 0.5928
 epoch: 65, train_loss: 0.8121, test_loss: 1.0300, test_f1: 0.5881
 epoch: 66, train_loss: 0.8170, test_loss: 1.0347, test_f1: 0.5835
 epoch: 67, train_loss: 0.8111, test_loss: 1.0211, test_f1: 0.5861
 epoch: 68, train_loss: 0.7973, test_loss: 1.0437, test_f1: 0.5853
 epoch: 69, train_loss: 0.8090, test_loss: 1.0475, test_f1: 0.5823
 epoch: 70, train_loss: 0.7994, test_loss: 1.0298, test_f1: 0.5903
 epoch: 71, train_loss: 0.8071, test_loss: 1.0318, test_f1: 0.5882
 epoch: 72, train_loss: 0.7983, test_loss: 1.0598, test_f1: 0.5926
 epoch: 73, train_loss: 0.8025, test_loss: 1.0542, test_f1: 0.5904
 epoch: 74, train_loss: 0.8079, test_loss: 1.0372, test_f1: 0.5926
 epoch: 75, train_loss: 0.7955, test_loss: 1.0502, test_f1: 0.5908
 epoch: 76, train_loss: 0.7825, test_loss: 1.0527, test_f1: 0.5850
 epoch: 77, train_loss: 0.7822, test_loss: 1.0447, test_f1: 0.5963
 epoch: 78, train_loss: 0.7985, test_loss: 1.0437, test_f1: 0.5985
 epoch: 79, train_loss: 0.7862, test_loss: 1.0457, test_f1: 0.6015
 epoch: 80, train_loss: 0.8023, test_loss: 1.0410, test_f1: 0.5989
 epoch: 81, train_loss: 0.7881, test_loss: 1.0454, test_f1: 0.5885
 epoch: 82, train_loss: 0.7877, test_loss: 1.0477, test_f1: 0.5957
 epoch: 83, train_loss: 0.7913, test_loss: 1.0464, test_f1: 0.5957
 epoch: 84, train_loss: 0.7890, test_loss: 1.0397, test_f1: 0.5963
 epoch: 85, train_loss: 0.7807, test_loss: 1.0389, test_f1: 0.5986
 epoch: 86, train_loss: 0.7872, test_loss: 1.0488, test_f1: 0.5913
 epoch: 87, train_loss: 0.7861, test_loss: 1.0480, test_f1: 0.5904
 epoch: 88, train_loss: 0.7714, test_loss: 1.0387, test_f1: 0.5958
 epoch: 89, train_loss: 0.7803, test_loss: 1.0624, test_f1: 0.5914
 epoch: 90, train_loss: 0.7759, test_loss: 1.0586, test_f1: 0.5968
 epoch: 91, train_loss: 0.7790, test_loss: 1.0606, test_f1: 0.5963
 epoch: 92, train_loss: 0.7759, test_loss: 1.0803, test_f1: 0.5884
 epoch: 93, train_loss: 0.7719, test_loss: 1.0655, test_f1: 0.5933
 epoch: 94, train_loss: 0.7706, test_loss: 1.0619, test_f1: 0.5913
 epoch: 95, train_loss: 0.7703, test_loss: 1.0701, test_f1: 0.5964
 epoch: 96, train_loss: 0.7638, test_loss: 1.0592, test_f1: 0.5936
 epoch: 97, train_loss: 0.7704, test_loss: 1.0848, test_f1: 0.5842
 epoch: 98, train_loss: 0.7652, test_loss: 1.0727, test_f1: 0.5837
 epoch: 99, train_loss: 0.7783, test_loss: 1.0691, test_f1: 0.5906

Training completed in 480.79 seconds
Best F1: 0.6153 at epoch 92
Mean F1 across iterations: 0.5849  0.0199
========================FINAL RESULTS================================
FEGIN weighted F1: 0.6153  0.0199
python main.py --data ltspice_demos --representation component_net --model FEGIN --layers 5 --hiddens 64 --batch_size 128 --lr 0.0001 --emb_size 512 --epochs 100 --save_appendix component_net_L5_H64_BS128_LR0.0001_E512 --no_val
-----



STDERR:
  File "main.py", line 370, in <module>
    main()
  File "main.py", line 254, in main
    dataset = dataset_class(
  File "/home/philip/projects/ltspice_examples_code_repo/Circuit-Completion-Using-GNNs/component_classification_with_link_prediction_head/evaluation/FEGIN/kernel/circuit_datasets.py", line 15, in __init__
    self.data, self.slices = torch.load(self.processed_paths[0])
  File "/home/philip/.local/lib/python3.8/site-packages/torch/serialization.py", line 1040, in load
    warnings.warn(
  File "/usr/lib/python3.8/warnings.py", line 109, in _showwarnmsg
    sw(msg.message, msg.category, msg.filename, msg.lineno,
  File "main.py", line 47, in warn_with_traceback
    traceback.print_stack(file=log)
/home/philip/projects/ltspice_examples_code_repo/Circuit-Completion-Using-GNNs/component_classification_with_link_prediction_head/evaluation/FEGIN/kernel/circuit_datasets.py:15: FutureWarning: You are using `torch.load` with `weights_only=False` (the current default value), which uses the default pickle module implicitly. It is possible to construct malicious pickle data which will execute arbitrary code during unpickling (See https://github.com/pytorch/pytorch/blob/main/SECURITY.md#untrusted-models for more details). In a future release, the default value for `weights_only` will be flipped to `True`. This limits the functions that could be executed during unpickling. Arbitrary objects will no longer be allowed to be loaded via this mode unless they are explicitly allowlisted by the user via `torch.serialization.add_safe_globals`. We recommend you start setting `weights_only=True` for any use case where you don't have full control of the loaded file. Please open an issue on GitHub for any issues related to this experimental feature.
  self.data, self.slices = torch.load(self.processed_paths[0])
