STDOUT:
Results will be saved in /home/philip/projects/ltspice_examples_code_repo/Circuit-Completion-Using-GNNs/component_classification_with_link_prediction_head/evaluation/FEGIN/results/model_FEGIN_dataset_ltspice_demos
Command line input: python main.py --data ltspice_demos --representation component_net --model FEGIN --layers 5 --hiddens 32 --batch_size 64 --lr 0.01 --emb_size 512 --epochs 100 --save_appendix component_net_L5_H32_BS64_LR0.01_E512 --no_val
 is saved.
-----
ltspice_demos - FEGIN
Using 5 layers, 32 hidden units, h = 2
Loading component_net representation dataset
ENTERED
Training FEGIN on component_net representation
Train: 1565, Test: 383
##################ITERATION #0 ****************************************
 epoch: 0, train_loss: 1.2378, test_loss: 1.4720, test_f1: 0.1368
 epoch: 1, train_loss: 1.0952, test_loss: 1.2667, test_f1: 0.4229
 epoch: 2, train_loss: 1.0297, test_loss: 1.2212, test_f1: 0.4461
 epoch: 3, train_loss: 0.9982, test_loss: 1.1106, test_f1: 0.4831
 epoch: 4, train_loss: 1.0252, test_loss: 1.3115, test_f1: 0.4502
 epoch: 5, train_loss: 0.9659, test_loss: 1.0915, test_f1: 0.4706
 epoch: 6, train_loss: 0.9658, test_loss: 1.1413, test_f1: 0.5026
 epoch: 7, train_loss: 0.9445, test_loss: 1.0813, test_f1: 0.5158
 epoch: 8, train_loss: 0.9409, test_loss: 1.1875, test_f1: 0.5242
 epoch: 9, train_loss: 0.9129, test_loss: 1.0167, test_f1: 0.4259
 epoch: 10, train_loss: 0.9191, test_loss: 1.0491, test_f1: 0.5501
 epoch: 11, train_loss: 0.8905, test_loss: 1.0608, test_f1: 0.4718
 epoch: 12, train_loss: 0.8702, test_loss: 1.3544, test_f1: 0.3482
 epoch: 13, train_loss: 0.8729, test_loss: 1.1402, test_f1: 0.4858
 epoch: 14, train_loss: 0.8544, test_loss: 1.0579, test_f1: 0.5871
 epoch: 15, train_loss: 0.8625, test_loss: 1.4570, test_f1: 0.3696
 epoch: 16, train_loss: 0.8664, test_loss: 0.9992, test_f1: 0.5025
 epoch: 17, train_loss: 0.8279, test_loss: 1.0511, test_f1: 0.5894
 epoch: 18, train_loss: 0.8392, test_loss: 1.2964, test_f1: 0.5323
 epoch: 19, train_loss: 0.8229, test_loss: 1.0450, test_f1: 0.5857
 epoch: 20, train_loss: 0.8219, test_loss: 1.9885, test_f1: 0.4045
 epoch: 21, train_loss: 0.8401, test_loss: 1.1512, test_f1: 0.5584
 epoch: 22, train_loss: 0.8046, test_loss: 1.0785, test_f1: 0.4998
 epoch: 23, train_loss: 0.7982, test_loss: 1.0210, test_f1: 0.6000
 epoch: 24, train_loss: 0.8057, test_loss: 1.1131, test_f1: 0.5970
 epoch: 25, train_loss: 0.7806, test_loss: 1.0484, test_f1: 0.6043
 epoch: 26, train_loss: 0.7591, test_loss: 1.0463, test_f1: 0.5892
 epoch: 27, train_loss: 0.7501, test_loss: 1.4059, test_f1: 0.5610
 epoch: 28, train_loss: 0.7654, test_loss: 1.1939, test_f1: 0.4079
 epoch: 29, train_loss: 0.7582, test_loss: 1.2634, test_f1: 0.5404
 epoch: 30, train_loss: 0.7401, test_loss: 1.2105, test_f1: 0.5873
 epoch: 31, train_loss: 0.7242, test_loss: 1.2489, test_f1: 0.5936
 epoch: 32, train_loss: 0.7107, test_loss: 1.5813, test_f1: 0.4664
 epoch: 33, train_loss: 0.7844, test_loss: 1.1775, test_f1: 0.5816
 epoch: 34, train_loss: 0.7146, test_loss: 1.1604, test_f1: 0.5947
 epoch: 35, train_loss: 0.7061, test_loss: 1.1985, test_f1: 0.5722
 epoch: 36, train_loss: 0.7180, test_loss: 1.1470, test_f1: 0.5349
 epoch: 37, train_loss: 0.7073, test_loss: 1.1790, test_f1: 0.5958
 epoch: 38, train_loss: 0.7045, test_loss: 1.1979, test_f1: 0.5422
 epoch: 39, train_loss: 0.6851, test_loss: 1.0817, test_f1: 0.5347
 epoch: 40, train_loss: 0.6811, test_loss: 1.1783, test_f1: 0.6050
 epoch: 41, train_loss: 0.6642, test_loss: 1.9621, test_f1: 0.4935
 epoch: 42, train_loss: 0.6986, test_loss: 1.3491, test_f1: 0.5720
 epoch: 43, train_loss: 0.6971, test_loss: 1.3178, test_f1: 0.5200
 epoch: 44, train_loss: 0.6882, test_loss: 1.1855, test_f1: 0.5884
 epoch: 45, train_loss: 0.6738, test_loss: 1.4139, test_f1: 0.5973
 epoch: 46, train_loss: 0.7009, test_loss: 1.3289, test_f1: 0.5563
 epoch: 47, train_loss: 0.6917, test_loss: 1.3155, test_f1: 0.5342
 epoch: 48, train_loss: 0.6605, test_loss: 1.4770, test_f1: 0.5086
 epoch: 49, train_loss: 0.6518, test_loss: 1.4367, test_f1: 0.5387
 epoch: 50, train_loss: 0.6166, test_loss: 1.3599, test_f1: 0.5732
 epoch: 51, train_loss: 0.6031, test_loss: 1.3197, test_f1: 0.5944
 epoch: 52, train_loss: 0.5894, test_loss: 1.5041, test_f1: 0.5985
 epoch: 53, train_loss: 0.5708, test_loss: 1.3465, test_f1: 0.5697
 epoch: 54, train_loss: 0.5554, test_loss: 1.4404, test_f1: 0.5910
 epoch: 55, train_loss: 0.5725, test_loss: 1.4322, test_f1: 0.5637
 epoch: 56, train_loss: 0.5840, test_loss: 1.4348, test_f1: 0.5776
 epoch: 57, train_loss: 0.5736, test_loss: 1.4917, test_f1: 0.5585
 epoch: 58, train_loss: 0.5603, test_loss: 1.4886, test_f1: 0.5735
 epoch: 59, train_loss: 0.5542, test_loss: 1.5228, test_f1: 0.6044
 epoch: 60, train_loss: 0.5743, test_loss: 1.4044, test_f1: 0.5759
 epoch: 61, train_loss: 0.5624, test_loss: 1.4141, test_f1: 0.5749
 epoch: 62, train_loss: 0.5470, test_loss: 1.6730, test_f1: 0.6148
 epoch: 63, train_loss: 0.5338, test_loss: 1.4348, test_f1: 0.5666
 epoch: 64, train_loss: 0.5474, test_loss: 1.5132, test_f1: 0.5766
 epoch: 65, train_loss: 0.5502, test_loss: 1.6366, test_f1: 0.5969
 epoch: 66, train_loss: 0.5326, test_loss: 1.3590, test_f1: 0.5749
 epoch: 67, train_loss: 0.5272, test_loss: 1.5807, test_f1: 0.5448
 epoch: 68, train_loss: 0.5586, test_loss: 1.3402, test_f1: 0.6068
 epoch: 69, train_loss: 0.5263, test_loss: 1.5152, test_f1: 0.5758
 epoch: 70, train_loss: 0.5345, test_loss: 1.4794, test_f1: 0.5991
 epoch: 71, train_loss: 0.5213, test_loss: 1.6350, test_f1: 0.5264
 epoch: 72, train_loss: 0.5378, test_loss: 1.8151, test_f1: 0.5916
 epoch: 73, train_loss: 0.5509, test_loss: 1.5442, test_f1: 0.5859
 epoch: 74, train_loss: 0.5074, test_loss: 1.5246, test_f1: 0.5793
 epoch: 75, train_loss: 0.5305, test_loss: 1.9708, test_f1: 0.5796
 epoch: 76, train_loss: 0.5150, test_loss: 1.8002, test_f1: 0.5703
 epoch: 77, train_loss: 0.5043, test_loss: 1.6123, test_f1: 0.5571
 epoch: 78, train_loss: 0.5070, test_loss: 1.7314, test_f1: 0.5938
 epoch: 79, train_loss: 0.4816, test_loss: 1.6458, test_f1: 0.5555
 epoch: 80, train_loss: 0.5205, test_loss: 1.5771, test_f1: 0.5914
 epoch: 81, train_loss: 0.4983, test_loss: 1.6197, test_f1: 0.6066
 epoch: 82, train_loss: 0.4961, test_loss: 1.5947, test_f1: 0.5416
 epoch: 83, train_loss: 0.5212, test_loss: 1.9123, test_f1: 0.5647
 epoch: 84, train_loss: 0.5050, test_loss: 1.7030, test_f1: 0.5826
 epoch: 85, train_loss: 0.4938, test_loss: 2.1046, test_f1: 0.5810
 epoch: 86, train_loss: 0.4919, test_loss: 1.8527, test_f1: 0.5618
 epoch: 87, train_loss: 0.5028, test_loss: 2.0431, test_f1: 0.5521
 epoch: 88, train_loss: 0.5188, test_loss: 1.6311, test_f1: 0.5592
 epoch: 89, train_loss: 0.4801, test_loss: 2.2279, test_f1: 0.5499
 epoch: 90, train_loss: 0.5001, test_loss: 1.8603, test_f1: 0.5569
 epoch: 91, train_loss: 0.5431, test_loss: 1.9547, test_f1: 0.5631
 epoch: 92, train_loss: 0.4715, test_loss: 1.8669, test_f1: 0.5716
 epoch: 93, train_loss: 0.4731, test_loss: 1.6092, test_f1: 0.5733
 epoch: 94, train_loss: 0.4713, test_loss: 1.7679, test_f1: 0.5492
 epoch: 95, train_loss: 0.4651, test_loss: 1.8413, test_f1: 0.5487
 epoch: 96, train_loss: 0.4715, test_loss: 1.9697, test_f1: 0.5099
 epoch: 97, train_loss: 0.4937, test_loss: 1.6916, test_f1: 0.5718
 epoch: 98, train_loss: 0.4591, test_loss: 1.8517, test_f1: 0.5750
 epoch: 99, train_loss: 0.4485, test_loss: 1.9959, test_f1: 0.5530
##################ITERATION #1 ****************************************
 epoch: 0, train_loss: 1.2135, test_loss: 1.2985, test_f1: 0.2925
 epoch: 1, train_loss: 1.0638, test_loss: 1.1128, test_f1: 0.3955
 epoch: 2, train_loss: 1.0067, test_loss: 1.0620, test_f1: 0.5044
 epoch: 3, train_loss: 1.0143, test_loss: 1.1595, test_f1: 0.4148
 epoch: 4, train_loss: 0.9795, test_loss: 1.0874, test_f1: 0.4445
 epoch: 5, train_loss: 0.9495, test_loss: 1.0561, test_f1: 0.4700
 epoch: 6, train_loss: 0.9545, test_loss: 1.1401, test_f1: 0.4254
 epoch: 7, train_loss: 0.9343, test_loss: 1.0545, test_f1: 0.4462
 epoch: 8, train_loss: 0.9440, test_loss: 1.0680, test_f1: 0.4898
 epoch: 9, train_loss: 0.9145, test_loss: 1.3657, test_f1: 0.3757
 epoch: 10, train_loss: 0.9221, test_loss: 1.1847, test_f1: 0.3868
 epoch: 11, train_loss: 0.9294, test_loss: 1.0870, test_f1: 0.4806
 epoch: 12, train_loss: 0.9274, test_loss: 1.1589, test_f1: 0.5167
 epoch: 13, train_loss: 0.8959, test_loss: 1.0873, test_f1: 0.5788
 epoch: 14, train_loss: 0.8948, test_loss: 1.0855, test_f1: 0.5230
 epoch: 15, train_loss: 0.8721, test_loss: 1.0496, test_f1: 0.5480
 epoch: 16, train_loss: 0.8689, test_loss: 1.0567, test_f1: 0.5419
 epoch: 17, train_loss: 0.8724, test_loss: 1.0330, test_f1: 0.5152
 epoch: 18, train_loss: 0.8430, test_loss: 1.1312, test_f1: 0.5566
 epoch: 19, train_loss: 0.8375, test_loss: 1.2253, test_f1: 0.5233
 epoch: 20, train_loss: 0.8484, test_loss: 1.0188, test_f1: 0.5479
 epoch: 21, train_loss: 0.8492, test_loss: 1.1434, test_f1: 0.5536
 epoch: 22, train_loss: 0.8214, test_loss: 1.0758, test_f1: 0.5541
 epoch: 23, train_loss: 0.8256, test_loss: 1.0488, test_f1: 0.5484
 epoch: 24, train_loss: 0.8063, test_loss: 1.0575, test_f1: 0.5794
 epoch: 25, train_loss: 0.7928, test_loss: 1.1116, test_f1: 0.5334
 epoch: 26, train_loss: 0.7993, test_loss: 1.0774, test_f1: 0.5685
 epoch: 27, train_loss: 0.7742, test_loss: 1.1971, test_f1: 0.5597
 epoch: 28, train_loss: 0.8093, test_loss: 1.1746, test_f1: 0.5223
 epoch: 29, train_loss: 0.8111, test_loss: 1.2550, test_f1: 0.5169
 epoch: 30, train_loss: 0.7988, test_loss: 1.1381, test_f1: 0.5338
 epoch: 31, train_loss: 0.7650, test_loss: 1.2237, test_f1: 0.5543
 epoch: 32, train_loss: 0.7716, test_loss: 1.0792, test_f1: 0.5457
 epoch: 33, train_loss: 0.7448, test_loss: 1.1709, test_f1: 0.4890
 epoch: 34, train_loss: 0.7647, test_loss: 1.0736, test_f1: 0.5492
 epoch: 35, train_loss: 0.7746, test_loss: 1.1422, test_f1: 0.5678
 epoch: 36, train_loss: 0.7363, test_loss: 1.1404, test_f1: 0.4858
 epoch: 37, train_loss: 0.7653, test_loss: 1.2486, test_f1: 0.5133
 epoch: 38, train_loss: 0.7457, test_loss: 1.0866, test_f1: 0.5686
 epoch: 39, train_loss: 0.7150, test_loss: 1.1846, test_f1: 0.5744
 epoch: 40, train_loss: 0.7206, test_loss: 1.0818, test_f1: 0.5580
 epoch: 41, train_loss: 0.7001, test_loss: 1.4931, test_f1: 0.5696
 epoch: 42, train_loss: 0.7415, test_loss: 1.3752, test_f1: 0.5314
 epoch: 43, train_loss: 0.7165, test_loss: 1.2358, test_f1: 0.5705
 epoch: 44, train_loss: 0.7056, test_loss: 1.2374, test_f1: 0.5407
 epoch: 45, train_loss: 0.7198, test_loss: 1.0560, test_f1: 0.6069
 epoch: 46, train_loss: 0.7128, test_loss: 1.0854, test_f1: 0.5949
 epoch: 47, train_loss: 0.7081, test_loss: 1.1256, test_f1: 0.5674
 epoch: 48, train_loss: 0.7001, test_loss: 1.1457, test_f1: 0.5413
 epoch: 49, train_loss: 0.6845, test_loss: 1.1286, test_f1: 0.5776
 epoch: 50, train_loss: 0.6964, test_loss: 1.3398, test_f1: 0.5465
 epoch: 51, train_loss: 0.6688, test_loss: 1.1542, test_f1: 0.5375
 epoch: 52, train_loss: 0.6270, test_loss: 1.2220, test_f1: 0.5518
 epoch: 53, train_loss: 0.6193, test_loss: 1.1988, test_f1: 0.5523
 epoch: 54, train_loss: 0.6040, test_loss: 1.3338, test_f1: 0.5582
 epoch: 55, train_loss: 0.5997, test_loss: 1.2647, test_f1: 0.5561
 epoch: 56, train_loss: 0.6097, test_loss: 2.4090, test_f1: 0.5128
 epoch: 57, train_loss: 0.5809, test_loss: 1.3291, test_f1: 0.5594
 epoch: 58, train_loss: 0.5971, test_loss: 1.3018, test_f1: 0.5758
 epoch: 59, train_loss: 0.5738, test_loss: 1.5780, test_f1: 0.5749
 epoch: 60, train_loss: 0.5791, test_loss: 1.4322, test_f1: 0.5703
 epoch: 61, train_loss: 0.5935, test_loss: 1.4968, test_f1: 0.5760
 epoch: 62, train_loss: 0.5749, test_loss: 1.8011, test_f1: 0.5028
 epoch: 63, train_loss: 0.5743, test_loss: 1.4033, test_f1: 0.5615
 epoch: 64, train_loss: 0.5540, test_loss: 1.6065, test_f1: 0.5735
 epoch: 65, train_loss: 0.5541, test_loss: 1.3295, test_f1: 0.5895
 epoch: 66, train_loss: 0.5729, test_loss: 1.6507, test_f1: 0.5404
 epoch: 67, train_loss: 0.5477, test_loss: 1.3061, test_f1: 0.5595
 epoch: 68, train_loss: 0.5635, test_loss: 1.4845, test_f1: 0.5643
 epoch: 69, train_loss: 0.5963, test_loss: 1.4941, test_f1: 0.6023
 epoch: 70, train_loss: 0.5529, test_loss: 1.3468, test_f1: 0.5839
 epoch: 71, train_loss: 0.5468, test_loss: 1.6615, test_f1: 0.5703
 epoch: 72, train_loss: 0.5338, test_loss: 1.5444, test_f1: 0.5381
 epoch: 73, train_loss: 0.5470, test_loss: 1.3900, test_f1: 0.5678
 epoch: 74, train_loss: 0.5283, test_loss: 1.6931, test_f1: 0.5872
 epoch: 75, train_loss: 0.5281, test_loss: 1.5946, test_f1: 0.5732
 epoch: 76, train_loss: 0.5218, test_loss: 1.5589, test_f1: 0.5916
 epoch: 77, train_loss: 0.5209, test_loss: 1.7801, test_f1: 0.5023
 epoch: 78, train_loss: 0.5389, test_loss: 1.7329, test_f1: 0.5549
 epoch: 79, train_loss: 0.5371, test_loss: 1.5923, test_f1: 0.5694
 epoch: 80, train_loss: 0.5228, test_loss: 1.6432, test_f1: 0.5802
 epoch: 81, train_loss: 0.5396, test_loss: 1.6637, test_f1: 0.5673
 epoch: 82, train_loss: 0.5274, test_loss: 1.6828, test_f1: 0.5962
 epoch: 83, train_loss: 0.5380, test_loss: 1.3488, test_f1: 0.5785
 epoch: 84, train_loss: 0.5049, test_loss: 1.7568, test_f1: 0.5442
 epoch: 85, train_loss: 0.4716, test_loss: 1.5847, test_f1: 0.5675
 epoch: 86, train_loss: 0.5372, test_loss: 1.5107, test_f1: 0.5855
 epoch: 87, train_loss: 0.5034, test_loss: 1.7991, test_f1: 0.5483
 epoch: 88, train_loss: 0.4846, test_loss: 1.9932, test_f1: 0.5515
 epoch: 89, train_loss: 0.5151, test_loss: 1.6325, test_f1: 0.5842
 epoch: 90, train_loss: 0.5139, test_loss: 1.6932, test_f1: 0.5743
 epoch: 91, train_loss: 0.4923, test_loss: 1.5066, test_f1: 0.5670
 epoch: 92, train_loss: 0.5031, test_loss: 1.6104, test_f1: 0.5539
 epoch: 93, train_loss: 0.4724, test_loss: 1.6311, test_f1: 0.5811
 epoch: 94, train_loss: 0.4908, test_loss: 1.5426, test_f1: 0.5444
 epoch: 95, train_loss: 0.4945, test_loss: 1.7582, test_f1: 0.5628
 epoch: 96, train_loss: 0.4785, test_loss: 1.7774, test_f1: 0.5644
 epoch: 97, train_loss: 0.4726, test_loss: 1.8961, test_f1: 0.5297
 epoch: 98, train_loss: 0.4630, test_loss: 1.6213, test_f1: 0.5765
 epoch: 99, train_loss: 0.4633, test_loss: 1.9023, test_f1: 0.5849
##################ITERATION #2 ****************************************
 epoch: 0, train_loss: 1.1822, test_loss: 1.3925, test_f1: 0.3572
 epoch: 1, train_loss: 1.0826, test_loss: 1.2015, test_f1: 0.3970
 epoch: 2, train_loss: 1.0187, test_loss: 1.0973, test_f1: 0.4548
 epoch: 3, train_loss: 1.0277, test_loss: 1.0823, test_f1: 0.4842
 epoch: 4, train_loss: 0.9802, test_loss: 1.0975, test_f1: 0.4984
 epoch: 5, train_loss: 0.9697, test_loss: 1.0753, test_f1: 0.3719
 epoch: 6, train_loss: 0.9352, test_loss: 1.1037, test_f1: 0.5003
 epoch: 7, train_loss: 0.9320, test_loss: 1.0507, test_f1: 0.5278
 epoch: 8, train_loss: 0.9236, test_loss: 0.9831, test_f1: 0.5453
 epoch: 9, train_loss: 0.9160, test_loss: 1.0455, test_f1: 0.5011
 epoch: 10, train_loss: 0.9182, test_loss: 1.0679, test_f1: 0.5182
 epoch: 11, train_loss: 0.8986, test_loss: 1.0970, test_f1: 0.5100
 epoch: 12, train_loss: 0.9015, test_loss: 1.1079, test_f1: 0.5053
 epoch: 13, train_loss: 0.8740, test_loss: 1.0483, test_f1: 0.5466
 epoch: 14, train_loss: 0.8701, test_loss: 1.0810, test_f1: 0.5872
 epoch: 15, train_loss: 0.8497, test_loss: 1.0837, test_f1: 0.6000
 epoch: 16, train_loss: 0.8625, test_loss: 1.0664, test_f1: 0.5370
 epoch: 17, train_loss: 0.8603, test_loss: 1.0778, test_f1: 0.4983
 epoch: 18, train_loss: 0.8492, test_loss: 1.6149, test_f1: 0.3408
 epoch: 19, train_loss: 0.8544, test_loss: 1.0271, test_f1: 0.5067
 epoch: 20, train_loss: 0.8436, test_loss: 1.5376, test_f1: 0.4119
 epoch: 21, train_loss: 0.8122, test_loss: 1.1350, test_f1: 0.5682
 epoch: 22, train_loss: 0.8134, test_loss: 1.6380, test_f1: 0.3108
 epoch: 23, train_loss: 0.8122, test_loss: 1.1120, test_f1: 0.5506
 epoch: 24, train_loss: 0.8081, test_loss: 1.5487, test_f1: 0.4085
 epoch: 25, train_loss: 0.7796, test_loss: 1.5922, test_f1: 0.3737
 epoch: 26, train_loss: 0.8075, test_loss: 1.1282, test_f1: 0.5582
 epoch: 27, train_loss: 0.7831, test_loss: 1.0977, test_f1: 0.5204
 epoch: 28, train_loss: 0.7702, test_loss: 1.8871, test_f1: 0.3150
 epoch: 29, train_loss: 0.7517, test_loss: 1.3141, test_f1: 0.4179
 epoch: 30, train_loss: 0.7294, test_loss: 1.2046, test_f1: 0.6056
 epoch: 31, train_loss: 0.7585, test_loss: 1.3004, test_f1: 0.4803
 epoch: 32, train_loss: 0.7436, test_loss: 1.0822, test_f1: 0.5869
 epoch: 33, train_loss: 0.7468, test_loss: 1.2161, test_f1: 0.5723
 epoch: 34, train_loss: 0.7212, test_loss: 1.1327, test_f1: 0.5478
 epoch: 35, train_loss: 0.7358, test_loss: 1.0285, test_f1: 0.6301
 epoch: 36, train_loss: 0.7060, test_loss: 1.0351, test_f1: 0.5483
 epoch: 37, train_loss: 0.7187, test_loss: 1.1360, test_f1: 0.5742
 epoch: 38, train_loss: 0.6791, test_loss: 1.2734, test_f1: 0.5716
 epoch: 39, train_loss: 0.7427, test_loss: 1.1887, test_f1: 0.5806
 epoch: 40, train_loss: 0.7025, test_loss: 1.2603, test_f1: 0.5325
 epoch: 41, train_loss: 0.6840, test_loss: 1.3179, test_f1: 0.5786
 epoch: 42, train_loss: 0.6609, test_loss: 1.0804, test_f1: 0.5414
 epoch: 43, train_loss: 0.6746, test_loss: 1.3999, test_f1: 0.5409
 epoch: 44, train_loss: 0.6853, test_loss: 1.2730, test_f1: 0.6349
 epoch: 45, train_loss: 0.6529, test_loss: 1.1396, test_f1: 0.5653
 epoch: 46, train_loss: 0.6494, test_loss: 1.2543, test_f1: 0.5990
 epoch: 47, train_loss: 0.6724, test_loss: 1.0797, test_f1: 0.5879
 epoch: 48, train_loss: 0.6647, test_loss: 1.6020, test_f1: 0.5292
 epoch: 49, train_loss: 0.6249, test_loss: 1.3494, test_f1: 0.5353
 epoch: 50, train_loss: 0.6696, test_loss: 1.3877, test_f1: 0.5073
 epoch: 51, train_loss: 0.6346, test_loss: 1.5187, test_f1: 0.6135
 epoch: 52, train_loss: 0.6072, test_loss: 1.3226, test_f1: 0.5828
 epoch: 53, train_loss: 0.5587, test_loss: 1.3897, test_f1: 0.6005
 epoch: 54, train_loss: 0.5947, test_loss: 1.1829, test_f1: 0.5786
 epoch: 55, train_loss: 0.5714, test_loss: 1.2416, test_f1: 0.6087
 epoch: 56, train_loss: 0.5870, test_loss: 1.2821, test_f1: 0.6309
 epoch: 57, train_loss: 0.5664, test_loss: 1.2238, test_f1: 0.5855
 epoch: 58, train_loss: 0.5532, test_loss: 1.3635, test_f1: 0.6142
 epoch: 59, train_loss: 0.5733, test_loss: 1.3852, test_f1: 0.6294
 epoch: 60, train_loss: 0.5332, test_loss: 1.3811, test_f1: 0.5799
 epoch: 61, train_loss: 0.5406, test_loss: 1.2986, test_f1: 0.5848
 epoch: 62, train_loss: 0.5684, test_loss: 1.3560, test_f1: 0.6210
 epoch: 63, train_loss: 0.5572, test_loss: 1.5221, test_f1: 0.6058
 epoch: 64, train_loss: 0.5409, test_loss: 1.4661, test_f1: 0.5857
 epoch: 65, train_loss: 0.5459, test_loss: 1.5938, test_f1: 0.5929
 epoch: 66, train_loss: 0.5376, test_loss: 1.4091, test_f1: 0.6090
 epoch: 67, train_loss: 0.5372, test_loss: 1.3428, test_f1: 0.6243
 epoch: 68, train_loss: 0.5316, test_loss: 1.5994, test_f1: 0.5862
 epoch: 69, train_loss: 0.5283, test_loss: 1.5269, test_f1: 0.5932
 epoch: 70, train_loss: 0.5067, test_loss: 1.4186, test_f1: 0.5689
 epoch: 71, train_loss: 0.4978, test_loss: 1.5518, test_f1: 0.6052
 epoch: 72, train_loss: 0.5007, test_loss: 1.5799, test_f1: 0.5641
 epoch: 73, train_loss: 0.5162, test_loss: 1.5375, test_f1: 0.5980
 epoch: 74, train_loss: 0.5192, test_loss: 1.4589, test_f1: 0.6186
 epoch: 75, train_loss: 0.5210, test_loss: 1.4400, test_f1: 0.6126
 epoch: 76, train_loss: 0.5072, test_loss: 1.4387, test_f1: 0.6137
 epoch: 77, train_loss: 0.4748, test_loss: 1.6780, test_f1: 0.5958
 epoch: 78, train_loss: 0.5129, test_loss: 1.4790, test_f1: 0.6130
 epoch: 79, train_loss: 0.5018, test_loss: 1.5312, test_f1: 0.5895
 epoch: 80, train_loss: 0.4677, test_loss: 1.7013, test_f1: 0.6395
 epoch: 81, train_loss: 0.4980, test_loss: 1.3499, test_f1: 0.6138
 epoch: 82, train_loss: 0.4853, test_loss: 1.6459, test_f1: 0.5224
 epoch: 83, train_loss: 0.4880, test_loss: 1.9009, test_f1: 0.5538
 epoch: 84, train_loss: 0.4727, test_loss: 1.4921, test_f1: 0.6151
 epoch: 85, train_loss: 0.4604, test_loss: 1.9282, test_f1: 0.6067
 epoch: 86, train_loss: 0.4645, test_loss: 1.7044, test_f1: 0.6110
 epoch: 87, train_loss: 0.4627, test_loss: 1.7092, test_f1: 0.6318
 epoch: 88, train_loss: 0.4563, test_loss: 2.0038, test_f1: 0.6105
 epoch: 89, train_loss: 0.4941, test_loss: 1.6885, test_f1: 0.6068
 epoch: 90, train_loss: 0.4813, test_loss: 1.7010, test_f1: 0.6267
 epoch: 91, train_loss: 0.4760, test_loss: 1.6718, test_f1: 0.6104
 epoch: 92, train_loss: 0.5038, test_loss: 1.3887, test_f1: 0.6275
 epoch: 93, train_loss: 0.4428, test_loss: 1.6521, test_f1: 0.6336
 epoch: 94, train_loss: 0.4447, test_loss: 2.1865, test_f1: 0.5415
 epoch: 95, train_loss: 0.4188, test_loss: 1.9074, test_f1: 0.5629
 epoch: 96, train_loss: 0.4064, test_loss: 2.0096, test_f1: 0.6099
 epoch: 97, train_loss: 0.4506, test_loss: 1.7718, test_f1: 0.5670
 epoch: 98, train_loss: 0.4419, test_loss: 1.5554, test_f1: 0.6275
 epoch: 99, train_loss: 0.4568, test_loss: 1.7154, test_f1: 0.5222
##################ITERATION #3 ****************************************
 epoch: 0, train_loss: 1.2360, test_loss: 1.3638, test_f1: 0.3451
 epoch: 1, train_loss: 1.0920, test_loss: 1.1971, test_f1: 0.4336
 epoch: 2, train_loss: 1.0321, test_loss: 1.0919, test_f1: 0.4740
 epoch: 3, train_loss: 1.0001, test_loss: 1.0896, test_f1: 0.5045
 epoch: 4, train_loss: 0.9919, test_loss: 1.0231, test_f1: 0.5311
 epoch: 5, train_loss: 0.9604, test_loss: 1.0706, test_f1: 0.4943
 epoch: 6, train_loss: 0.9914, test_loss: 1.0545, test_f1: 0.4951
 epoch: 7, train_loss: 0.9587, test_loss: 1.1980, test_f1: 0.4784
 epoch: 8, train_loss: 0.9576, test_loss: 1.0670, test_f1: 0.5112
 epoch: 9, train_loss: 0.9338, test_loss: 1.2081, test_f1: 0.4656
 epoch: 10, train_loss: 0.9263, test_loss: 1.1777, test_f1: 0.4540
 epoch: 11, train_loss: 0.9142, test_loss: 1.1426, test_f1: 0.4796
 epoch: 12, train_loss: 0.9076, test_loss: 1.0377, test_f1: 0.5117
 epoch: 13, train_loss: 0.8866, test_loss: 1.2295, test_f1: 0.4909
 epoch: 14, train_loss: 0.8816, test_loss: 1.1859, test_f1: 0.4515
 epoch: 15, train_loss: 0.8737, test_loss: 1.1643, test_f1: 0.5158
 epoch: 16, train_loss: 0.8833, test_loss: 1.1861, test_f1: 0.4958
 epoch: 17, train_loss: 0.8434, test_loss: 1.1874, test_f1: 0.5447
 epoch: 18, train_loss: 0.8363, test_loss: 1.0989, test_f1: 0.5321
 epoch: 19, train_loss: 0.8247, test_loss: 1.2910, test_f1: 0.4868
 epoch: 20, train_loss: 0.8088, test_loss: 1.1478, test_f1: 0.4901
 epoch: 21, train_loss: 0.8515, test_loss: 1.1001, test_f1: 0.5452
 epoch: 22, train_loss: 0.8079, test_loss: 1.2456, test_f1: 0.5046
 epoch: 23, train_loss: 0.7868, test_loss: 1.1635, test_f1: 0.5286
 epoch: 24, train_loss: 0.7758, test_loss: 1.1900, test_f1: 0.5744
 epoch: 25, train_loss: 0.7860, test_loss: 1.1040, test_f1: 0.5400
 epoch: 26, train_loss: 0.7562, test_loss: 1.2383, test_f1: 0.5217
 epoch: 27, train_loss: 0.7621, test_loss: 1.2518, test_f1: 0.5332
 epoch: 28, train_loss: 0.7491, test_loss: 1.2612, test_f1: 0.5299
 epoch: 29, train_loss: 0.7388, test_loss: 2.6925, test_f1: 0.2661
 epoch: 30, train_loss: 0.7979, test_loss: 1.4243, test_f1: 0.4802
 epoch: 31, train_loss: 0.7562, test_loss: 1.1175, test_f1: 0.5443
 epoch: 32, train_loss: 0.7564, test_loss: 1.1254, test_f1: 0.5677
 epoch: 33, train_loss: 0.7377, test_loss: 1.4515, test_f1: 0.4518
 epoch: 34, train_loss: 0.7621, test_loss: 1.5134, test_f1: 0.4496
 epoch: 35, train_loss: 0.7631, test_loss: 1.1792, test_f1: 0.5845
 epoch: 36, train_loss: 0.7125, test_loss: 1.0889, test_f1: 0.5878
 epoch: 37, train_loss: 0.7054, test_loss: 1.2576, test_f1: 0.5419
 epoch: 38, train_loss: 0.7005, test_loss: 1.2591, test_f1: 0.5156
 epoch: 39, train_loss: 0.7065, test_loss: 1.2147, test_f1: 0.5175
 epoch: 40, train_loss: 0.6965, test_loss: 1.2792, test_f1: 0.5071
 epoch: 41, train_loss: 0.7042, test_loss: 1.2803, test_f1: 0.5585
 epoch: 42, train_loss: 0.6811, test_loss: 1.5110, test_f1: 0.4479
 epoch: 43, train_loss: 0.6719, test_loss: 1.6572, test_f1: 0.4432
 epoch: 44, train_loss: 0.6892, test_loss: 1.2483, test_f1: 0.4864
 epoch: 45, train_loss: 0.6904, test_loss: 1.3469, test_f1: 0.4209
 epoch: 46, train_loss: 0.6799, test_loss: 1.3796, test_f1: 0.5556
 epoch: 47, train_loss: 0.6944, test_loss: 1.3181, test_f1: 0.5126
 epoch: 48, train_loss: 0.6708, test_loss: 1.1977, test_f1: 0.5638
 epoch: 49, train_loss: 0.6746, test_loss: 1.3447, test_f1: 0.5628
 epoch: 50, train_loss: 0.6574, test_loss: 1.2435, test_f1: 0.5100
 epoch: 51, train_loss: 0.6297, test_loss: 1.3601, test_f1: 0.5734
 epoch: 52, train_loss: 0.6140, test_loss: 1.2407, test_f1: 0.5527
 epoch: 53, train_loss: 0.5785, test_loss: 1.3032, test_f1: 0.5430
 epoch: 54, train_loss: 0.6280, test_loss: 1.4313, test_f1: 0.5779
 epoch: 55, train_loss: 0.6062, test_loss: 1.2063, test_f1: 0.5721
 epoch: 56, train_loss: 0.5861, test_loss: 1.3425, test_f1: 0.5590
 epoch: 57, train_loss: 0.6021, test_loss: 1.3554, test_f1: 0.5505
 epoch: 58, train_loss: 0.5641, test_loss: 1.4468, test_f1: 0.5090
 epoch: 59, train_loss: 0.5723, test_loss: 1.5155, test_f1: 0.5157
 epoch: 60, train_loss: 0.5821, test_loss: 1.3875, test_f1: 0.5596
 epoch: 61, train_loss: 0.5613, test_loss: 1.4151, test_f1: 0.5557
 epoch: 62, train_loss: 0.5724, test_loss: 1.3447, test_f1: 0.5906
 epoch: 63, train_loss: 0.5800, test_loss: 1.4574, test_f1: 0.5657
 epoch: 64, train_loss: 0.5681, test_loss: 1.4389, test_f1: 0.5278
 epoch: 65, train_loss: 0.5667, test_loss: 1.2957, test_f1: 0.5743
 epoch: 66, train_loss: 0.5639, test_loss: 1.3512, test_f1: 0.5991
 epoch: 67, train_loss: 0.5504, test_loss: 1.4156, test_f1: 0.5481
 epoch: 68, train_loss: 0.5548, test_loss: 1.3324, test_f1: 0.5758
 epoch: 69, train_loss: 0.5452, test_loss: 1.4020, test_f1: 0.5497
 epoch: 70, train_loss: 0.5455, test_loss: 1.4944, test_f1: 0.5304
 epoch: 71, train_loss: 0.5492, test_loss: 1.3444, test_f1: 0.5511
 epoch: 72, train_loss: 0.5180, test_loss: 1.4062, test_f1: 0.5809
 epoch: 73, train_loss: 0.5303, test_loss: 1.5594, test_f1: 0.5789
 epoch: 74, train_loss: 0.5573, test_loss: 1.4010, test_f1: 0.5797
 epoch: 75, train_loss: 0.5326, test_loss: 1.4606, test_f1: 0.5267
 epoch: 76, train_loss: 0.4952, test_loss: 1.4674, test_f1: 0.5714
 epoch: 77, train_loss: 0.5078, test_loss: 1.5274, test_f1: 0.6032
 epoch: 78, train_loss: 0.5125, test_loss: 1.5267, test_f1: 0.5349
 epoch: 79, train_loss: 0.5298, test_loss: 1.7035, test_f1: 0.5473
 epoch: 80, train_loss: 0.5124, test_loss: 1.3793, test_f1: 0.5669
 epoch: 81, train_loss: 0.5132, test_loss: 1.6258, test_f1: 0.5058
 epoch: 82, train_loss: 0.4885, test_loss: 1.5656, test_f1: 0.5551
 epoch: 83, train_loss: 0.4949, test_loss: 1.5519, test_f1: 0.5824
 epoch: 84, train_loss: 0.4782, test_loss: 1.5384, test_f1: 0.5722
 epoch: 85, train_loss: 0.4890, test_loss: 1.5978, test_f1: 0.5847
 epoch: 86, train_loss: 0.4888, test_loss: 1.6799, test_f1: 0.5459
 epoch: 87, train_loss: 0.5002, test_loss: 1.6203, test_f1: 0.5478
 epoch: 88, train_loss: 0.5182, test_loss: 1.5198, test_f1: 0.5684
 epoch: 89, train_loss: 0.4958, test_loss: 1.6104, test_f1: 0.5652
 epoch: 90, train_loss: 0.5035, test_loss: 1.5601, test_f1: 0.5714
 epoch: 91, train_loss: 0.4856, test_loss: 1.5995, test_f1: 0.5484
 epoch: 92, train_loss: 0.4669, test_loss: 1.6396, test_f1: 0.5477
 epoch: 93, train_loss: 0.4761, test_loss: 1.6545, test_f1: 0.5451
 epoch: 94, train_loss: 0.4660, test_loss: 1.4875, test_f1: 0.5831
 epoch: 95, train_loss: 0.4968, test_loss: 1.5997, test_f1: 0.5711
 epoch: 96, train_loss: 0.4569, test_loss: 1.6131, test_f1: 0.5694
 epoch: 97, train_loss: 0.4479, test_loss: 1.8088, test_f1: 0.5491
 epoch: 98, train_loss: 0.4697, test_loss: 1.6237, test_f1: 0.5628
 epoch: 99, train_loss: 0.4756, test_loss: 1.7010, test_f1: 0.5870
##################ITERATION #4 ****************************************
 epoch: 0, train_loss: 1.2466, test_loss: 1.5354, test_f1: 0.2263
 epoch: 1, train_loss: 1.0920, test_loss: 1.1603, test_f1: 0.4714
 epoch: 2, train_loss: 1.0247, test_loss: 1.1243, test_f1: 0.4671
 epoch: 3, train_loss: 1.0191, test_loss: 1.1395, test_f1: 0.4504
 epoch: 4, train_loss: 1.0020, test_loss: 1.1272, test_f1: 0.4651
 epoch: 5, train_loss: 0.9837, test_loss: 1.1522, test_f1: 0.4907
 epoch: 6, train_loss: 0.9824, test_loss: 1.1065, test_f1: 0.5172
 epoch: 7, train_loss: 0.9588, test_loss: 1.0866, test_f1: 0.5103
 epoch: 8, train_loss: 0.9666, test_loss: 1.1321, test_f1: 0.4519
 epoch: 9, train_loss: 0.9570, test_loss: 1.0986, test_f1: 0.4971
 epoch: 10, train_loss: 0.9621, test_loss: 1.0582, test_f1: 0.4511
 epoch: 11, train_loss: 0.9354, test_loss: 1.0959, test_f1: 0.4990
 epoch: 12, train_loss: 0.9208, test_loss: 1.1933, test_f1: 0.5126
 epoch: 13, train_loss: 0.9286, test_loss: 0.9971, test_f1: 0.5325
 epoch: 14, train_loss: 0.9131, test_loss: 1.0678, test_f1: 0.5314
 epoch: 15, train_loss: 0.9187, test_loss: 1.2247, test_f1: 0.5022
 epoch: 16, train_loss: 0.9001, test_loss: 1.0665, test_f1: 0.5449
 epoch: 17, train_loss: 0.8785, test_loss: 1.0251, test_f1: 0.5566
 epoch: 18, train_loss: 0.8692, test_loss: 1.0060, test_f1: 0.5761
 epoch: 19, train_loss: 0.8638, test_loss: 1.1392, test_f1: 0.4665
 epoch: 20, train_loss: 0.8729, test_loss: 1.1191, test_f1: 0.5420
 epoch: 21, train_loss: 0.8694, test_loss: 1.1136, test_f1: 0.5633
 epoch: 22, train_loss: 0.8583, test_loss: 1.0390, test_f1: 0.4776
 epoch: 23, train_loss: 0.8409, test_loss: 0.9955, test_f1: 0.5354
 epoch: 24, train_loss: 0.8518, test_loss: 1.1132, test_f1: 0.5571
 epoch: 25, train_loss: 0.8393, test_loss: 1.0876, test_f1: 0.6016
 epoch: 26, train_loss: 0.8654, test_loss: 1.1457, test_f1: 0.5432
 epoch: 27, train_loss: 0.8306, test_loss: 1.1871, test_f1: 0.5620
 epoch: 28, train_loss: 0.8190, test_loss: 1.1841, test_f1: 0.5046
 epoch: 29, train_loss: 0.7923, test_loss: 1.2205, test_f1: 0.4946
 epoch: 30, train_loss: 0.7962, test_loss: 1.0857, test_f1: 0.5610
 epoch: 31, train_loss: 0.8075, test_loss: 1.2190, test_f1: 0.4649
 epoch: 32, train_loss: 0.7720, test_loss: 1.3280, test_f1: 0.5330
 epoch: 33, train_loss: 0.7909, test_loss: 1.2006, test_f1: 0.5793
 epoch: 34, train_loss: 0.7777, test_loss: 1.0927, test_f1: 0.5975
 epoch: 35, train_loss: 0.7458, test_loss: 1.1935, test_f1: 0.6192
 epoch: 36, train_loss: 0.7409, test_loss: 1.2111, test_f1: 0.5618
 epoch: 37, train_loss: 0.7567, test_loss: 1.1165, test_f1: 0.5800
 epoch: 38, train_loss: 0.7499, test_loss: 1.1243, test_f1: 0.6285
 epoch: 39, train_loss: 0.7354, test_loss: 1.1743, test_f1: 0.5119
 epoch: 40, train_loss: 0.7291, test_loss: 1.1737, test_f1: 0.6311
 epoch: 41, train_loss: 0.7285, test_loss: 1.2092, test_f1: 0.5108
 epoch: 42, train_loss: 0.7343, test_loss: 1.5075, test_f1: 0.5409
 epoch: 43, train_loss: 0.7114, test_loss: 1.5863, test_f1: 0.5470
 epoch: 44, train_loss: 0.7366, test_loss: 1.1682, test_f1: 0.5576
 epoch: 45, train_loss: 0.7086, test_loss: 1.2517, test_f1: 0.5686
 epoch: 46, train_loss: 0.7451, test_loss: 1.3184, test_f1: 0.6071
 epoch: 47, train_loss: 0.7246, test_loss: 1.1906, test_f1: 0.5634
 epoch: 48, train_loss: 0.7100, test_loss: 1.2915, test_f1: 0.5646
 epoch: 49, train_loss: 0.7321, test_loss: 1.0759, test_f1: 0.5204
 epoch: 50, train_loss: 0.6879, test_loss: 1.3339, test_f1: 0.5274
 epoch: 51, train_loss: 0.6889, test_loss: 1.2672, test_f1: 0.6033
 epoch: 52, train_loss: 0.6565, test_loss: 1.2548, test_f1: 0.5792
 epoch: 53, train_loss: 0.6476, test_loss: 1.1987, test_f1: 0.5971
 epoch: 54, train_loss: 0.6662, test_loss: 1.2920, test_f1: 0.5970
 epoch: 55, train_loss: 0.6499, test_loss: 1.1918, test_f1: 0.6126
 epoch: 56, train_loss: 0.6172, test_loss: 1.3028, test_f1: 0.5683
 epoch: 57, train_loss: 0.6110, test_loss: 1.2724, test_f1: 0.5887
 epoch: 58, train_loss: 0.5988, test_loss: 1.4409, test_f1: 0.5857
 epoch: 59, train_loss: 0.6249, test_loss: 1.3013, test_f1: 0.6097
 epoch: 60, train_loss: 0.5722, test_loss: 1.3772, test_f1: 0.5705
 epoch: 61, train_loss: 0.6008, test_loss: 1.4874, test_f1: 0.5386
 epoch: 62, train_loss: 0.5916, test_loss: 1.2962, test_f1: 0.5627
 epoch: 63, train_loss: 0.5951, test_loss: 1.4640, test_f1: 0.5778
 epoch: 64, train_loss: 0.6102, test_loss: 1.3103, test_f1: 0.6019
 epoch: 65, train_loss: 0.5899, test_loss: 1.4396, test_f1: 0.5011
 epoch: 66, train_loss: 0.5849, test_loss: 1.4535, test_f1: 0.5998
 epoch: 67, train_loss: 0.5681, test_loss: 1.8094, test_f1: 0.5632
 epoch: 68, train_loss: 0.5721, test_loss: 1.4917, test_f1: 0.5844
 epoch: 69, train_loss: 0.5478, test_loss: 1.3959, test_f1: 0.5973
 epoch: 70, train_loss: 0.5676, test_loss: 1.4642, test_f1: 0.5422
 epoch: 71, train_loss: 0.5736, test_loss: 1.7827, test_f1: 0.5880
 epoch: 72, train_loss: 0.5719, test_loss: 1.5016, test_f1: 0.5484
 epoch: 73, train_loss: 0.5547, test_loss: 1.6587, test_f1: 0.6023
 epoch: 74, train_loss: 0.5658, test_loss: 1.5909, test_f1: 0.6072
 epoch: 75, train_loss: 0.5592, test_loss: 1.5687, test_f1: 0.5934
 epoch: 76, train_loss: 0.5473, test_loss: 1.4571, test_f1: 0.5470
 epoch: 77, train_loss: 0.5561, test_loss: 1.7417, test_f1: 0.5819
 epoch: 78, train_loss: 0.5443, test_loss: 1.4469, test_f1: 0.6237
 epoch: 79, train_loss: 0.5526, test_loss: 1.5490, test_f1: 0.5783
 epoch: 80, train_loss: 0.5464, test_loss: 1.7172, test_f1: 0.5956
 epoch: 81, train_loss: 0.5095, test_loss: 1.6152, test_f1: 0.5888
 epoch: 82, train_loss: 0.5305, test_loss: 1.5030, test_f1: 0.6094
 epoch: 83, train_loss: 0.5312, test_loss: 1.7816, test_f1: 0.6103
 epoch: 84, train_loss: 0.5139, test_loss: 1.5273, test_f1: 0.6305
 epoch: 85, train_loss: 0.5118, test_loss: 1.7008, test_f1: 0.6029
 epoch: 86, train_loss: 0.5315, test_loss: 1.7276, test_f1: 0.6258
 epoch: 87, train_loss: 0.5071, test_loss: 1.5111, test_f1: 0.6070
 epoch: 88, train_loss: 0.4983, test_loss: 1.5962, test_f1: 0.6004
 epoch: 89, train_loss: 0.4834, test_loss: 1.7067, test_f1: 0.6198
 epoch: 90, train_loss: 0.5069, test_loss: 1.7311, test_f1: 0.5779
 epoch: 91, train_loss: 0.5110, test_loss: 1.6639, test_f1: 0.6162
 epoch: 92, train_loss: 0.5177, test_loss: 2.1442, test_f1: 0.5340
 epoch: 93, train_loss: 0.5000, test_loss: 1.5945, test_f1: 0.5880
 epoch: 94, train_loss: 0.4895, test_loss: 1.7730, test_f1: 0.5870
 epoch: 95, train_loss: 0.4877, test_loss: 1.6787, test_f1: 0.5929
 epoch: 96, train_loss: 0.5088, test_loss: 1.6134, test_f1: 0.6104
 epoch: 97, train_loss: 0.4818, test_loss: 1.9460, test_f1: 0.5809
 epoch: 98, train_loss: 0.5304, test_loss: 1.6244, test_f1: 0.6051
 epoch: 99, train_loss: 0.4761, test_loss: 2.3139, test_f1: 0.6014
##################ITERATION #5 ****************************************
 epoch: 0, train_loss: 1.2479, test_loss: 1.2789, test_f1: 0.3294
 epoch: 1, train_loss: 1.0731, test_loss: 1.1547, test_f1: 0.4108
 epoch: 2, train_loss: 1.0257, test_loss: 1.0982, test_f1: 0.5089
 epoch: 3, train_loss: 0.9832, test_loss: 1.1634, test_f1: 0.5011
 epoch: 4, train_loss: 0.9504, test_loss: 1.2877, test_f1: 0.4508
 epoch: 5, train_loss: 0.9405, test_loss: 1.1343, test_f1: 0.5175
 epoch: 6, train_loss: 0.9594, test_loss: 1.1250, test_f1: 0.5080
 epoch: 7, train_loss: 0.9394, test_loss: 1.3638, test_f1: 0.4585
 epoch: 8, train_loss: 0.9502, test_loss: 1.0801, test_f1: 0.5275
 epoch: 9, train_loss: 0.9192, test_loss: 1.1250, test_f1: 0.4815
 epoch: 10, train_loss: 0.9049, test_loss: 1.1439, test_f1: 0.5089
 epoch: 11, train_loss: 0.8964, test_loss: 1.0773, test_f1: 0.5301
 epoch: 12, train_loss: 0.8954, test_loss: 1.1625, test_f1: 0.5367
 epoch: 13, train_loss: 0.8926, test_loss: 1.1599, test_f1: 0.5195
 epoch: 14, train_loss: 0.8985, test_loss: 1.0779, test_f1: 0.5024
 epoch: 15, train_loss: 0.8897, test_loss: 1.2436, test_f1: 0.5024
 epoch: 16, train_loss: 0.8786, test_loss: 1.3389, test_f1: 0.5078
 epoch: 17, train_loss: 0.8769, test_loss: 1.3039, test_f1: 0.4891
 epoch: 18, train_loss: 0.8340, test_loss: 1.3223, test_f1: 0.5663
 epoch: 19, train_loss: 0.8533, test_loss: 1.2541, test_f1: 0.5157
 epoch: 20, train_loss: 0.8192, test_loss: 1.0281, test_f1: 0.5941
 epoch: 21, train_loss: 0.8038, test_loss: 1.1304, test_f1: 0.5543
 epoch: 22, train_loss: 0.8187, test_loss: 1.3127, test_f1: 0.5358
 epoch: 23, train_loss: 0.8149, test_loss: 1.1716, test_f1: 0.5233
 epoch: 24, train_loss: 0.8265, test_loss: 1.0971, test_f1: 0.5278
 epoch: 25, train_loss: 0.7963, test_loss: 1.2903, test_f1: 0.4998
 epoch: 26, train_loss: 0.8059, test_loss: 1.0242, test_f1: 0.5806
 epoch: 27, train_loss: 0.7685, test_loss: 1.1530, test_f1: 0.5115
 epoch: 28, train_loss: 0.7793, test_loss: 1.1337, test_f1: 0.5363
 epoch: 29, train_loss: 0.7563, test_loss: 1.1625, test_f1: 0.5421
 epoch: 30, train_loss: 0.7236, test_loss: 1.1835, test_f1: 0.5472
 epoch: 31, train_loss: 0.7401, test_loss: 1.1796, test_f1: 0.5363
 epoch: 32, train_loss: 0.7377, test_loss: 1.2235, test_f1: 0.5662
 epoch: 33, train_loss: 0.7351, test_loss: 1.0871, test_f1: 0.5891
 epoch: 34, train_loss: 0.7476, test_loss: 1.1214, test_f1: 0.5666
 epoch: 35, train_loss: 0.7376, test_loss: 1.1572, test_f1: 0.5493
 epoch: 36, train_loss: 0.7569, test_loss: 0.9788, test_f1: 0.5589
 epoch: 37, train_loss: 0.7233, test_loss: 1.0596, test_f1: 0.5726
 epoch: 38, train_loss: 0.7129, test_loss: 1.0752, test_f1: 0.5722
 epoch: 39, train_loss: 0.7240, test_loss: 1.1373, test_f1: 0.5703
 epoch: 40, train_loss: 0.6929, test_loss: 1.1052, test_f1: 0.5905
 epoch: 41, train_loss: 0.7011, test_loss: 1.1238, test_f1: 0.5829
 epoch: 42, train_loss: 0.6897, test_loss: 1.0990, test_f1: 0.5886
 epoch: 43, train_loss: 0.6816, test_loss: 1.1312, test_f1: 0.5270
 epoch: 44, train_loss: 0.6685, test_loss: 1.1883, test_f1: 0.5886
 epoch: 45, train_loss: 0.6363, test_loss: 1.4522, test_f1: 0.5306
 epoch: 46, train_loss: 0.6576, test_loss: 1.2150, test_f1: 0.5730
 epoch: 47, train_loss: 0.6835, test_loss: 1.3273, test_f1: 0.6129
 epoch: 48, train_loss: 0.6333, test_loss: 1.3341, test_f1: 0.5423
 epoch: 49, train_loss: 0.6478, test_loss: 1.2215, test_f1: 0.5410
 epoch: 50, train_loss: 0.6320, test_loss: 1.1397, test_f1: 0.5725
 epoch: 51, train_loss: 0.6065, test_loss: 1.1834, test_f1: 0.6071
 epoch: 52, train_loss: 0.5742, test_loss: 1.2446, test_f1: 0.5484
 epoch: 53, train_loss: 0.5685, test_loss: 1.3001, test_f1: 0.5458
 epoch: 54, train_loss: 0.5643, test_loss: 1.3408, test_f1: 0.5600
 epoch: 55, train_loss: 0.5440, test_loss: 1.2340, test_f1: 0.5746
 epoch: 56, train_loss: 0.5374, test_loss: 1.4380, test_f1: 0.5585
 epoch: 57, train_loss: 0.5396, test_loss: 1.5404, test_f1: 0.5680
 epoch: 58, train_loss: 0.5434, test_loss: 1.4610, test_f1: 0.5911
 epoch: 59, train_loss: 0.5349, test_loss: 1.4657, test_f1: 0.5816
 epoch: 60, train_loss: 0.5432, test_loss: 1.3802, test_f1: 0.5941
 epoch: 61, train_loss: 0.5124, test_loss: 1.8751, test_f1: 0.5584
 epoch: 62, train_loss: 0.5346, test_loss: 1.5152, test_f1: 0.5910
 epoch: 63, train_loss: 0.5113, test_loss: 1.7876, test_f1: 0.5784
 epoch: 64, train_loss: 0.4981, test_loss: 1.5918, test_f1: 0.5754
 epoch: 65, train_loss: 0.5019, test_loss: 1.6418, test_f1: 0.5616
 epoch: 66, train_loss: 0.5257, test_loss: 1.5156, test_f1: 0.5853
 epoch: 67, train_loss: 0.5006, test_loss: 1.6914, test_f1: 0.5911
 epoch: 68, train_loss: 0.4919, test_loss: 3.9280, test_f1: 0.5087
 epoch: 69, train_loss: 0.4919, test_loss: 1.7894, test_f1: 0.5452
 epoch: 70, train_loss: 0.4697, test_loss: 1.7860, test_f1: 0.5598
 epoch: 71, train_loss: 0.4630, test_loss: 1.7718, test_f1: 0.5575
 epoch: 72, train_loss: 0.4871, test_loss: 1.6879, test_f1: 0.5722
 epoch: 73, train_loss: 0.4928, test_loss: 1.8588, test_f1: 0.5868
 epoch: 74, train_loss: 0.4789, test_loss: 3.3816, test_f1: 0.5140
 epoch: 75, train_loss: 0.4985, test_loss: 2.6998, test_f1: 0.5605
 epoch: 76, train_loss: 0.4373, test_loss: 1.7973, test_f1: 0.5144
 epoch: 77, train_loss: 0.4643, test_loss: 2.0217, test_f1: 0.5764
 epoch: 78, train_loss: 0.4752, test_loss: 2.3076, test_f1: 0.5902
 epoch: 79, train_loss: 0.4874, test_loss: 1.8729, test_f1: 0.5675
 epoch: 80, train_loss: 0.4529, test_loss: 2.4466, test_f1: 0.5783
 epoch: 81, train_loss: 0.4438, test_loss: 2.4577, test_f1: 0.5592
 epoch: 82, train_loss: 0.4586, test_loss: 2.1881, test_f1: 0.5625
 epoch: 83, train_loss: 0.4528, test_loss: 2.7180, test_f1: 0.5633
 epoch: 84, train_loss: 0.4385, test_loss: 2.0330, test_f1: 0.5193
 epoch: 85, train_loss: 0.4679, test_loss: 1.9493, test_f1: 0.5566
 epoch: 86, train_loss: 0.4754, test_loss: 1.6712, test_f1: 0.5556
 epoch: 87, train_loss: 0.4323, test_loss: 1.6965, test_f1: 0.5801
 epoch: 88, train_loss: 0.4722, test_loss: 1.9675, test_f1: 0.5588
 epoch: 89, train_loss: 0.4582, test_loss: 1.8119, test_f1: 0.5964
 epoch: 90, train_loss: 0.4258, test_loss: 1.6787, test_f1: 0.5636
 epoch: 91, train_loss: 0.4440, test_loss: 1.8772, test_f1: 0.6185
 epoch: 92, train_loss: 0.4546, test_loss: 2.4277, test_f1: 0.6029
 epoch: 93, train_loss: 0.4197, test_loss: 1.7502, test_f1: 0.5351
 epoch: 94, train_loss: 0.4337, test_loss: 1.8081, test_f1: 0.5913
 epoch: 95, train_loss: 0.4307, test_loss: 1.8764, test_f1: 0.5240
 epoch: 96, train_loss: 0.3915, test_loss: 2.0818, test_f1: 0.5794
 epoch: 97, train_loss: 0.4116, test_loss: 1.9566, test_f1: 0.5713
 epoch: 98, train_loss: 0.3997, test_loss: 1.7958, test_f1: 0.5614
 epoch: 99, train_loss: 0.4209, test_loss: 1.7827, test_f1: 0.5885
##################ITERATION #6 ****************************************
 epoch: 0, train_loss: 1.2433, test_loss: 1.3104, test_f1: 0.2567
 epoch: 1, train_loss: 1.0971, test_loss: 1.1722, test_f1: 0.3420
 epoch: 2, train_loss: 1.0595, test_loss: 1.1180, test_f1: 0.4729
 epoch: 3, train_loss: 1.0146, test_loss: 1.1245, test_f1: 0.4902
 epoch: 4, train_loss: 1.0071, test_loss: 1.1049, test_f1: 0.5017
 epoch: 5, train_loss: 0.9663, test_loss: 1.1494, test_f1: 0.5034
 epoch: 6, train_loss: 0.9606, test_loss: 1.1446, test_f1: 0.5121
 epoch: 7, train_loss: 0.9559, test_loss: 1.0506, test_f1: 0.5548
 epoch: 8, train_loss: 0.9391, test_loss: 1.0341, test_f1: 0.5375
 epoch: 9, train_loss: 0.9344, test_loss: 1.0523, test_f1: 0.5635
 epoch: 10, train_loss: 0.9337, test_loss: 1.1317, test_f1: 0.5325
 epoch: 11, train_loss: 0.8966, test_loss: 1.1173, test_f1: 0.5529
 epoch: 12, train_loss: 0.8878, test_loss: 1.1682, test_f1: 0.5748
 epoch: 13, train_loss: 0.8932, test_loss: 1.1019, test_f1: 0.5002
 epoch: 14, train_loss: 0.8910, test_loss: 1.0883, test_f1: 0.5294
 epoch: 15, train_loss: 0.8842, test_loss: 1.0692, test_f1: 0.5903
 epoch: 16, train_loss: 0.8703, test_loss: 1.0244, test_f1: 0.5822
 epoch: 17, train_loss: 0.8500, test_loss: 1.0455, test_f1: 0.5844
 epoch: 18, train_loss: 0.8538, test_loss: 1.1346, test_f1: 0.5444
 epoch: 19, train_loss: 0.8397, test_loss: 0.9862, test_f1: 0.5736
 epoch: 20, train_loss: 0.8352, test_loss: 1.1763, test_f1: 0.5335
 epoch: 21, train_loss: 0.8135, test_loss: 1.1367, test_f1: 0.5254
 epoch: 22, train_loss: 0.8107, test_loss: 1.0508, test_f1: 0.5930
 epoch: 23, train_loss: 0.7987, test_loss: 1.2174, test_f1: 0.5203
 epoch: 24, train_loss: 0.8321, test_loss: 1.0686, test_f1: 0.5624
 epoch: 25, train_loss: 0.7848, test_loss: 1.0237, test_f1: 0.5875
 epoch: 26, train_loss: 0.7973, test_loss: 1.1125, test_f1: 0.5249
 epoch: 27, train_loss: 0.7875, test_loss: 1.1145, test_f1: 0.5725
 epoch: 28, train_loss: 0.7927, test_loss: 1.0832, test_f1: 0.5663
 epoch: 29, train_loss: 0.7798, test_loss: 1.1183, test_f1: 0.5716
 epoch: 30, train_loss: 0.8102, test_loss: 1.4267, test_f1: 0.4591
 epoch: 31, train_loss: 0.7590, test_loss: 1.0521, test_f1: 0.5972
 epoch: 32, train_loss: 0.7418, test_loss: 1.1031, test_f1: 0.4896
 epoch: 33, train_loss: 0.7451, test_loss: 1.1339, test_f1: 0.5991
 epoch: 34, train_loss: 0.7325, test_loss: 1.1370, test_f1: 0.5370
 epoch: 35, train_loss: 0.7202, test_loss: 1.1679, test_f1: 0.5503
 epoch: 36, train_loss: 0.7546, test_loss: 1.2473, test_f1: 0.5689
 epoch: 37, train_loss: 0.8182, test_loss: 1.1286, test_f1: 0.5503
 epoch: 38, train_loss: 0.7586, test_loss: 1.0646, test_f1: 0.5950
 epoch: 39, train_loss: 0.6994, test_loss: 1.1580, test_f1: 0.5493
 epoch: 40, train_loss: 0.6905, test_loss: 1.1785, test_f1: 0.5832
 epoch: 41, train_loss: 0.6945, test_loss: 1.3024, test_f1: 0.5593
 epoch: 42, train_loss: 0.7200, test_loss: 1.0234, test_f1: 0.5641
 epoch: 43, train_loss: 0.7306, test_loss: 1.1751, test_f1: 0.5746
 epoch: 44, train_loss: 0.7579, test_loss: 1.2317, test_f1: 0.5814
 epoch: 45, train_loss: 0.7189, test_loss: 1.1175, test_f1: 0.5815
 epoch: 46, train_loss: 0.7077, test_loss: 1.0838, test_f1: 0.5726
 epoch: 47, train_loss: 0.6921, test_loss: 1.3142, test_f1: 0.5718
 epoch: 48, train_loss: 0.7101, test_loss: 1.2260, test_f1: 0.5028
 epoch: 49, train_loss: 0.7201, test_loss: 1.1603, test_f1: 0.5467
 epoch: 50, train_loss: 0.6829, test_loss: 1.1828, test_f1: 0.5679
 epoch: 51, train_loss: 0.6489, test_loss: 1.1712, test_f1: 0.6020
 epoch: 52, train_loss: 0.6390, test_loss: 1.2321, test_f1: 0.5808
 epoch: 53, train_loss: 0.6325, test_loss: 1.2511, test_f1: 0.5835
 epoch: 54, train_loss: 0.6109, test_loss: 1.1987, test_f1: 0.5989
 epoch: 55, train_loss: 0.6186, test_loss: 1.3352, test_f1: 0.5744
 epoch: 56, train_loss: 0.6171, test_loss: 1.3043, test_f1: 0.5675
 epoch: 57, train_loss: 0.6004, test_loss: 1.3145, test_f1: 0.5555
 epoch: 58, train_loss: 0.5952, test_loss: 1.2045, test_f1: 0.5951
 epoch: 59, train_loss: 0.5948, test_loss: 1.3357, test_f1: 0.5891
 epoch: 60, train_loss: 0.6042, test_loss: 1.3475, test_f1: 0.5847
 epoch: 61, train_loss: 0.5915, test_loss: 1.3017, test_f1: 0.5774
 epoch: 62, train_loss: 0.6117, test_loss: 1.3509, test_f1: 0.5410
 epoch: 63, train_loss: 0.5919, test_loss: 1.3286, test_f1: 0.5568
 epoch: 64, train_loss: 0.5700, test_loss: 1.2721, test_f1: 0.5762
 epoch: 65, train_loss: 0.6027, test_loss: 1.3553, test_f1: 0.6041
 epoch: 66, train_loss: 0.5906, test_loss: 1.2268, test_f1: 0.5874
 epoch: 67, train_loss: 0.5812, test_loss: 1.2354, test_f1: 0.5816
 epoch: 68, train_loss: 0.5762, test_loss: 1.3026, test_f1: 0.6120
 epoch: 69, train_loss: 0.5799, test_loss: 1.2494, test_f1: 0.5922
 epoch: 70, train_loss: 0.5524, test_loss: 1.3158, test_f1: 0.6090
 epoch: 71, train_loss: 0.5438, test_loss: 1.3392, test_f1: 0.6044
 epoch: 72, train_loss: 0.5269, test_loss: 1.2631, test_f1: 0.6076
 epoch: 73, train_loss: 0.5133, test_loss: 1.3547, test_f1: 0.5815
 epoch: 74, train_loss: 0.5491, test_loss: 1.3702, test_f1: 0.6212
 epoch: 75, train_loss: 0.5412, test_loss: 1.2687, test_f1: 0.5948
 epoch: 76, train_loss: 0.5625, test_loss: 1.2299, test_f1: 0.6090
 epoch: 77, train_loss: 0.5353, test_loss: 1.4583, test_f1: 0.5437
 epoch: 78, train_loss: 0.5417, test_loss: 1.3248, test_f1: 0.5690
 epoch: 79, train_loss: 0.5041, test_loss: 1.4036, test_f1: 0.5738
 epoch: 80, train_loss: 0.5419, test_loss: 1.3466, test_f1: 0.6105
 epoch: 81, train_loss: 0.5142, test_loss: 1.3885, test_f1: 0.6314
 epoch: 82, train_loss: 0.5366, test_loss: 1.4231, test_f1: 0.5983
 epoch: 83, train_loss: 0.5187, test_loss: 1.3073, test_f1: 0.6121
 epoch: 84, train_loss: 0.5191, test_loss: 1.2845, test_f1: 0.6372
 epoch: 85, train_loss: 0.5609, test_loss: 1.3364, test_f1: 0.6150
 epoch: 86, train_loss: 0.5450, test_loss: 1.2981, test_f1: 0.6193
 epoch: 87, train_loss: 0.5055, test_loss: 1.3736, test_f1: 0.6144
 epoch: 88, train_loss: 0.5104, test_loss: 1.3216, test_f1: 0.6201
 epoch: 89, train_loss: 0.4910, test_loss: 1.3913, test_f1: 0.5849
 epoch: 90, train_loss: 0.4694, test_loss: 1.4629, test_f1: 0.6019
 epoch: 91, train_loss: 0.5146, test_loss: 1.3567, test_f1: 0.6435
 epoch: 92, train_loss: 0.4935, test_loss: 1.3614, test_f1: 0.5848
 epoch: 93, train_loss: 0.5246, test_loss: 1.2669, test_f1: 0.6299
 epoch: 94, train_loss: 0.4797, test_loss: 1.4209, test_f1: 0.6166
 epoch: 95, train_loss: 0.4949, test_loss: 1.6308, test_f1: 0.5956
 epoch: 96, train_loss: 0.4866, test_loss: 1.2985, test_f1: 0.5984
 epoch: 97, train_loss: 0.4834, test_loss: 1.3052, test_f1: 0.6429
 epoch: 98, train_loss: 0.4851, test_loss: 1.3479, test_f1: 0.6017
 epoch: 99, train_loss: 0.4908, test_loss: 1.3416, test_f1: 0.6302
##################ITERATION #7 ****************************************
 epoch: 0, train_loss: 1.2740, test_loss: 1.3422, test_f1: 0.3302
 epoch: 1, train_loss: 1.1018, test_loss: 1.2296, test_f1: 0.4040
 epoch: 2, train_loss: 1.0736, test_loss: 1.1992, test_f1: 0.4192
 epoch: 3, train_loss: 1.0329, test_loss: 1.0494, test_f1: 0.5248
 epoch: 4, train_loss: 1.0014, test_loss: 1.1080, test_f1: 0.4894
 epoch: 5, train_loss: 1.0089, test_loss: 1.1200, test_f1: 0.4740
 epoch: 6, train_loss: 0.9703, test_loss: 1.0954, test_f1: 0.4869
 epoch: 7, train_loss: 0.9902, test_loss: 1.2477, test_f1: 0.4331
 epoch: 8, train_loss: 0.9546, test_loss: 1.3088, test_f1: 0.4794
 epoch: 9, train_loss: 0.9886, test_loss: 1.0774, test_f1: 0.5274
 epoch: 10, train_loss: 0.9426, test_loss: 1.0421, test_f1: 0.5523
 epoch: 11, train_loss: 0.9179, test_loss: 1.1534, test_f1: 0.4640
 epoch: 12, train_loss: 0.9118, test_loss: 1.0693, test_f1: 0.4818
 epoch: 13, train_loss: 0.8964, test_loss: 1.1345, test_f1: 0.5574
 epoch: 14, train_loss: 0.9191, test_loss: 1.1699, test_f1: 0.5061
 epoch: 15, train_loss: 0.9493, test_loss: 1.1082, test_f1: 0.5279
 epoch: 16, train_loss: 0.9216, test_loss: 1.0748, test_f1: 0.5601
 epoch: 17, train_loss: 0.8886, test_loss: 1.0226, test_f1: 0.5988
 epoch: 18, train_loss: 0.8831, test_loss: 1.0672, test_f1: 0.5629
 epoch: 19, train_loss: 0.8512, test_loss: 1.0480, test_f1: 0.5826
 epoch: 20, train_loss: 0.8470, test_loss: 0.9755, test_f1: 0.5903
 epoch: 21, train_loss: 0.8507, test_loss: 0.9885, test_f1: 0.5642
 epoch: 22, train_loss: 0.8460, test_loss: 1.0058, test_f1: 0.5785
 epoch: 23, train_loss: 0.8199, test_loss: 1.0408, test_f1: 0.5449
 epoch: 24, train_loss: 0.8397, test_loss: 0.9713, test_f1: 0.5600
 epoch: 25, train_loss: 0.8164, test_loss: 1.1817, test_f1: 0.5624
 epoch: 26, train_loss: 0.7997, test_loss: 1.1776, test_f1: 0.5666
 epoch: 27, train_loss: 0.7944, test_loss: 1.0690, test_f1: 0.5724
 epoch: 28, train_loss: 0.7836, test_loss: 0.9852, test_f1: 0.5844
 epoch: 29, train_loss: 0.7859, test_loss: 1.0990, test_f1: 0.5771
 epoch: 30, train_loss: 0.7754, test_loss: 1.0603, test_f1: 0.5826
 epoch: 31, train_loss: 0.7422, test_loss: 1.0887, test_f1: 0.5921
 epoch: 32, train_loss: 0.7624, test_loss: 1.0125, test_f1: 0.6117
 epoch: 33, train_loss: 0.7586, test_loss: 1.1517, test_f1: 0.5842
 epoch: 34, train_loss: 0.7700, test_loss: 1.0105, test_f1: 0.6051
 epoch: 35, train_loss: 0.7516, test_loss: 1.0932, test_f1: 0.5930
 epoch: 36, train_loss: 0.7204, test_loss: 1.1145, test_f1: 0.5941
 epoch: 37, train_loss: 0.7574, test_loss: 1.2752, test_f1: 0.5410
 epoch: 38, train_loss: 0.7427, test_loss: 1.1091, test_f1: 0.5538
 epoch: 39, train_loss: 0.7091, test_loss: 1.0727, test_f1: 0.5819
 epoch: 40, train_loss: 0.7060, test_loss: 1.1249, test_f1: 0.5899
 epoch: 41, train_loss: 0.6997, test_loss: 1.1456, test_f1: 0.5554
 epoch: 42, train_loss: 0.7272, test_loss: 1.0695, test_f1: 0.6032
 epoch: 43, train_loss: 0.6985, test_loss: 1.1627, test_f1: 0.5631
 epoch: 44, train_loss: 0.6922, test_loss: 1.0834, test_f1: 0.5603
 epoch: 45, train_loss: 0.6748, test_loss: 1.1658, test_f1: 0.5648
 epoch: 46, train_loss: 0.6815, test_loss: 1.1894, test_f1: 0.5841
 epoch: 47, train_loss: 0.6783, test_loss: 1.1455, test_f1: 0.5269
 epoch: 48, train_loss: 0.6728, test_loss: 1.1581, test_f1: 0.5736
 epoch: 49, train_loss: 0.6559, test_loss: 1.1831, test_f1: 0.5356
 epoch: 50, train_loss: 0.6698, test_loss: 1.2450, test_f1: 0.5286
 epoch: 51, train_loss: 0.6213, test_loss: 1.1633, test_f1: 0.5588
 epoch: 52, train_loss: 0.6133, test_loss: 1.1291, test_f1: 0.6142
 epoch: 53, train_loss: 0.6007, test_loss: 1.1435, test_f1: 0.6157
 epoch: 54, train_loss: 0.6045, test_loss: 1.1931, test_f1: 0.5882
 epoch: 55, train_loss: 0.5781, test_loss: 1.2215, test_f1: 0.5815
 epoch: 56, train_loss: 0.5677, test_loss: 1.2081, test_f1: 0.5698
 epoch: 57, train_loss: 0.5540, test_loss: 1.1920, test_f1: 0.5956
 epoch: 58, train_loss: 0.5655, test_loss: 1.3144, test_f1: 0.5649
 epoch: 59, train_loss: 0.5601, test_loss: 1.3102, test_f1: 0.6237
 epoch: 60, train_loss: 0.5700, test_loss: 1.3834, test_f1: 0.6061
 epoch: 61, train_loss: 0.5601, test_loss: 1.2094, test_f1: 0.5796
 epoch: 62, train_loss: 0.5538, test_loss: 1.2857, test_f1: 0.6044
 epoch: 63, train_loss: 0.5699, test_loss: 1.3004, test_f1: 0.6064
 epoch: 64, train_loss: 0.5415, test_loss: 1.2305, test_f1: 0.6011
 epoch: 65, train_loss: 0.5311, test_loss: 1.3279, test_f1: 0.6002
 epoch: 66, train_loss: 0.5560, test_loss: 1.2848, test_f1: 0.6044
 epoch: 67, train_loss: 0.5572, test_loss: 1.2713, test_f1: 0.5916
 epoch: 68, train_loss: 0.5687, test_loss: 1.4628, test_f1: 0.5039
 epoch: 69, train_loss: 0.5310, test_loss: 1.2605, test_f1: 0.6152
 epoch: 70, train_loss: 0.5301, test_loss: 1.4105, test_f1: 0.5773
 epoch: 71, train_loss: 0.5513, test_loss: 1.3478, test_f1: 0.5894
 epoch: 72, train_loss: 0.5233, test_loss: 1.2586, test_f1: 0.6033
 epoch: 73, train_loss: 0.5174, test_loss: 1.3510, test_f1: 0.5721
 epoch: 74, train_loss: 0.5030, test_loss: 1.4573, test_f1: 0.5640
 epoch: 75, train_loss: 0.5377, test_loss: 1.4929, test_f1: 0.5699
 epoch: 76, train_loss: 0.5013, test_loss: 1.2581, test_f1: 0.6124
 epoch: 77, train_loss: 0.5215, test_loss: 1.3871, test_f1: 0.5966
 epoch: 78, train_loss: 0.5264, test_loss: 1.4797, test_f1: 0.5736
 epoch: 79, train_loss: 0.5413, test_loss: 1.6516, test_f1: 0.5920
 epoch: 80, train_loss: 0.5278, test_loss: 1.7547, test_f1: 0.6056
 epoch: 81, train_loss: 0.5052, test_loss: 1.9670, test_f1: 0.6083
 epoch: 82, train_loss: 0.4883, test_loss: 1.9079, test_f1: 0.6220
 epoch: 83, train_loss: 0.4891, test_loss: 2.0123, test_f1: 0.6004
 epoch: 84, train_loss: 0.4913, test_loss: 1.3439, test_f1: 0.6573
 epoch: 85, train_loss: 0.5020, test_loss: 1.4823, test_f1: 0.5981
 epoch: 86, train_loss: 0.4856, test_loss: 1.5884, test_f1: 0.5608
 epoch: 87, train_loss: 0.4870, test_loss: 1.3529, test_f1: 0.5627
 epoch: 88, train_loss: 0.4825, test_loss: 1.4393, test_f1: 0.6384
 epoch: 89, train_loss: 0.4654, test_loss: 1.6164, test_f1: 0.5958
 epoch: 90, train_loss: 0.4938, test_loss: 1.4428, test_f1: 0.6015
 epoch: 91, train_loss: 0.4699, test_loss: 1.4573, test_f1: 0.6087
 epoch: 92, train_loss: 0.4510, test_loss: 1.5472, test_f1: 0.6066
 epoch: 93, train_loss: 0.4362, test_loss: 1.6591, test_f1: 0.5974
 epoch: 94, train_loss: 0.4576, test_loss: 1.4139, test_f1: 0.6396
 epoch: 95, train_loss: 0.4723, test_loss: 1.6062, test_f1: 0.5841
 epoch: 96, train_loss: 0.4985, test_loss: 1.5232, test_f1: 0.6189
 epoch: 97, train_loss: 0.4768, test_loss: 1.5830, test_f1: 0.6294
 epoch: 98, train_loss: 0.4353, test_loss: 1.5534, test_f1: 0.6176
 epoch: 99, train_loss: 0.4284, test_loss: 1.5308, test_f1: 0.6128
##################ITERATION #8 ****************************************
 epoch: 0, train_loss: 1.2886, test_loss: 1.3685, test_f1: 0.1727
 epoch: 1, train_loss: 1.1182, test_loss: 1.2245, test_f1: 0.3896
 epoch: 2, train_loss: 1.0429, test_loss: 1.0491, test_f1: 0.4268
 epoch: 3, train_loss: 1.0083, test_loss: 1.2045, test_f1: 0.4498
 epoch: 4, train_loss: 1.0007, test_loss: 1.0280, test_f1: 0.5178
 epoch: 5, train_loss: 0.9967, test_loss: 1.0362, test_f1: 0.4015
 epoch: 6, train_loss: 0.9548, test_loss: 1.1430, test_f1: 0.4688
 epoch: 7, train_loss: 0.9286, test_loss: 1.0575, test_f1: 0.4831
 epoch: 8, train_loss: 0.9024, test_loss: 1.0665, test_f1: 0.4348
 epoch: 9, train_loss: 0.9071, test_loss: 1.0473, test_f1: 0.4648
 epoch: 10, train_loss: 0.9095, test_loss: 1.0822, test_f1: 0.5195
 epoch: 11, train_loss: 0.8944, test_loss: 1.1120, test_f1: 0.4774
 epoch: 12, train_loss: 0.9161, test_loss: 1.0116, test_f1: 0.5519
 epoch: 13, train_loss: 0.8747, test_loss: 0.9961, test_f1: 0.5260
 epoch: 14, train_loss: 0.8801, test_loss: 1.1093, test_f1: 0.4738
 epoch: 15, train_loss: 0.8608, test_loss: 0.9625, test_f1: 0.6087
 epoch: 16, train_loss: 0.8374, test_loss: 0.9867, test_f1: 0.4918
 epoch: 17, train_loss: 0.8174, test_loss: 1.1838, test_f1: 0.4924
 epoch: 18, train_loss: 0.8060, test_loss: 1.1082, test_f1: 0.5530
 epoch: 19, train_loss: 0.8073, test_loss: 1.0069, test_f1: 0.5637
 epoch: 20, train_loss: 0.8141, test_loss: 1.0322, test_f1: 0.5816
 epoch: 21, train_loss: 0.7985, test_loss: 1.0160, test_f1: 0.5471
 epoch: 22, train_loss: 0.7864, test_loss: 1.1622, test_f1: 0.5729
 epoch: 23, train_loss: 0.7941, test_loss: 1.0192, test_f1: 0.6037
 epoch: 24, train_loss: 0.7775, test_loss: 1.0698, test_f1: 0.5461
 epoch: 25, train_loss: 0.7515, test_loss: 1.1439, test_f1: 0.5696
 epoch: 26, train_loss: 0.7403, test_loss: 1.4653, test_f1: 0.4239
 epoch: 27, train_loss: 0.7332, test_loss: 1.0038, test_f1: 0.6032
 epoch: 28, train_loss: 0.7418, test_loss: 0.9939, test_f1: 0.6006
 epoch: 29, train_loss: 0.7080, test_loss: 2.0607, test_f1: 0.4231
 epoch: 30, train_loss: 0.7384, test_loss: 1.0692, test_f1: 0.6296
 epoch: 31, train_loss: 0.7251, test_loss: 1.2640, test_f1: 0.5498
 epoch: 32, train_loss: 0.7159, test_loss: 1.2064, test_f1: 0.5883
 epoch: 33, train_loss: 0.7288, test_loss: 1.1702, test_f1: 0.5709
 epoch: 34, train_loss: 0.7343, test_loss: 1.5270, test_f1: 0.4709
 epoch: 35, train_loss: 0.7089, test_loss: 1.2597, test_f1: 0.5840
 epoch: 36, train_loss: 0.7182, test_loss: 1.2956, test_f1: 0.5534
 epoch: 37, train_loss: 0.6961, test_loss: 1.1440, test_f1: 0.6206
 epoch: 38, train_loss: 0.6759, test_loss: 1.1140, test_f1: 0.6410
 epoch: 39, train_loss: 0.6804, test_loss: 1.1683, test_f1: 0.6054
 epoch: 40, train_loss: 0.6907, test_loss: 1.2111, test_f1: 0.5692
 epoch: 41, train_loss: 0.7031, test_loss: 1.2410, test_f1: 0.5564
 epoch: 42, train_loss: 0.6820, test_loss: 1.3296, test_f1: 0.5553
 epoch: 43, train_loss: 0.7033, test_loss: 1.1266, test_f1: 0.5857
 epoch: 44, train_loss: 0.6857, test_loss: 1.0758, test_f1: 0.6287
 epoch: 45, train_loss: 0.6856, test_loss: 1.2877, test_f1: 0.5490
 epoch: 46, train_loss: 0.6564, test_loss: 1.1763, test_f1: 0.5749
 epoch: 47, train_loss: 0.6463, test_loss: 1.2581, test_f1: 0.6118
 epoch: 48, train_loss: 0.6540, test_loss: 1.2599, test_f1: 0.5888
 epoch: 49, train_loss: 0.6712, test_loss: 1.1025, test_f1: 0.6223
 epoch: 50, train_loss: 0.6673, test_loss: 1.2085, test_f1: 0.5113
 epoch: 51, train_loss: 0.6128, test_loss: 1.1352, test_f1: 0.6382
 epoch: 52, train_loss: 0.6004, test_loss: 1.1918, test_f1: 0.6033
 epoch: 53, train_loss: 0.5996, test_loss: 1.2856, test_f1: 0.6120
 epoch: 54, train_loss: 0.5793, test_loss: 1.3380, test_f1: 0.5920
 epoch: 55, train_loss: 0.5709, test_loss: 1.3523, test_f1: 0.6028
 epoch: 56, train_loss: 0.5908, test_loss: 1.2362, test_f1: 0.5618
 epoch: 57, train_loss: 0.5595, test_loss: 1.5946, test_f1: 0.5556
 epoch: 58, train_loss: 0.5625, test_loss: 1.4070, test_f1: 0.5711
 epoch: 59, train_loss: 0.5794, test_loss: 1.3781, test_f1: 0.5840
 epoch: 60, train_loss: 0.5787, test_loss: 1.1240, test_f1: 0.6277
 epoch: 61, train_loss: 0.5541, test_loss: 1.2241, test_f1: 0.6102
 epoch: 62, train_loss: 0.5305, test_loss: 1.5686, test_f1: 0.5750
 epoch: 63, train_loss: 0.5354, test_loss: 1.3783, test_f1: 0.6187
 epoch: 64, train_loss: 0.5354, test_loss: 1.4558, test_f1: 0.6163
 epoch: 65, train_loss: 0.5337, test_loss: 1.4419, test_f1: 0.5449
 epoch: 66, train_loss: 0.5206, test_loss: 1.3936, test_f1: 0.6213
 epoch: 67, train_loss: 0.5161, test_loss: 1.3387, test_f1: 0.6177
 epoch: 68, train_loss: 0.5019, test_loss: 1.4429, test_f1: 0.6409
 epoch: 69, train_loss: 0.5412, test_loss: 1.3397, test_f1: 0.6277
 epoch: 70, train_loss: 0.5646, test_loss: 1.5031, test_f1: 0.5604
 epoch: 71, train_loss: 0.5221, test_loss: 1.3543, test_f1: 0.6022
 epoch: 72, train_loss: 0.4992, test_loss: 1.4975, test_f1: 0.6290
 epoch: 73, train_loss: 0.5171, test_loss: 1.5358, test_f1: 0.5687
 epoch: 74, train_loss: 0.5178, test_loss: 1.4799, test_f1: 0.6117
 epoch: 75, train_loss: 0.5031, test_loss: 1.4803, test_f1: 0.6245
 epoch: 76, train_loss: 0.4953, test_loss: 1.5012, test_f1: 0.6220
 epoch: 77, train_loss: 0.5056, test_loss: 1.5869, test_f1: 0.6194
 epoch: 78, train_loss: 0.4910, test_loss: 1.7297, test_f1: 0.5918
 epoch: 79, train_loss: 0.5024, test_loss: 1.4132, test_f1: 0.6105
 epoch: 80, train_loss: 0.4536, test_loss: 1.5058, test_f1: 0.6295
 epoch: 81, train_loss: 0.4768, test_loss: 1.6762, test_f1: 0.6040
 epoch: 82, train_loss: 0.4686, test_loss: 1.5590, test_f1: 0.6387
 epoch: 83, train_loss: 0.4702, test_loss: 1.7077, test_f1: 0.5933
 epoch: 84, train_loss: 0.4615, test_loss: 1.5681, test_f1: 0.6424
 epoch: 85, train_loss: 0.4755, test_loss: 1.7801, test_f1: 0.6351
 epoch: 86, train_loss: 0.5120, test_loss: 1.4240, test_f1: 0.6384
 epoch: 87, train_loss: 0.5100, test_loss: 1.5681, test_f1: 0.6080
 epoch: 88, train_loss: 0.4579, test_loss: 1.6032, test_f1: 0.5919
 epoch: 89, train_loss: 0.4499, test_loss: 1.6985, test_f1: 0.6220
 epoch: 90, train_loss: 0.4478, test_loss: 1.6321, test_f1: 0.6143
 epoch: 91, train_loss: 0.4745, test_loss: 1.5797, test_f1: 0.6167
 epoch: 92, train_loss: 0.4843, test_loss: 1.5439, test_f1: 0.6258
 epoch: 93, train_loss: 0.4753, test_loss: 1.5970, test_f1: 0.6081
 epoch: 94, train_loss: 0.4782, test_loss: 1.4828, test_f1: 0.6389
 epoch: 95, train_loss: 0.4696, test_loss: 1.5686, test_f1: 0.5712
 epoch: 96, train_loss: 0.5022, test_loss: 1.4479, test_f1: 0.6226
 epoch: 97, train_loss: 0.4408, test_loss: 1.5663, test_f1: 0.6019
 epoch: 98, train_loss: 0.4575, test_loss: 1.6254, test_f1: 0.6233
 epoch: 99, train_loss: 0.4344, test_loss: 1.6028, test_f1: 0.6307
##################ITERATION #9 ****************************************
 epoch: 0, train_loss: 1.3004, test_loss: 1.5079, test_f1: 0.1434
 epoch: 1, train_loss: 1.0545, test_loss: 1.1815, test_f1: 0.4487
 epoch: 2, train_loss: 0.9867, test_loss: 1.1082, test_f1: 0.4999
 epoch: 3, train_loss: 0.9679, test_loss: 1.0864, test_f1: 0.5507
 epoch: 4, train_loss: 0.9849, test_loss: 1.1736, test_f1: 0.4427
 epoch: 5, train_loss: 0.9553, test_loss: 1.1267, test_f1: 0.4353
 epoch: 6, train_loss: 0.9291, test_loss: 1.1488, test_f1: 0.4980
 epoch: 7, train_loss: 0.9449, test_loss: 1.1521, test_f1: 0.5240
 epoch: 8, train_loss: 0.9185, test_loss: 1.0669, test_f1: 0.5584
 epoch: 9, train_loss: 0.9158, test_loss: 1.0988, test_f1: 0.5500
 epoch: 10, train_loss: 0.8864, test_loss: 1.1224, test_f1: 0.5434
 epoch: 11, train_loss: 0.8876, test_loss: 1.0956, test_f1: 0.5636
 epoch: 12, train_loss: 0.8757, test_loss: 1.1873, test_f1: 0.5169
 epoch: 13, train_loss: 0.8872, test_loss: 1.1581, test_f1: 0.5623
 epoch: 14, train_loss: 0.8450, test_loss: 1.2581, test_f1: 0.5017
 epoch: 15, train_loss: 0.8527, test_loss: 1.2086, test_f1: 0.5586
 epoch: 16, train_loss: 0.8538, test_loss: 1.1448, test_f1: 0.5104
 epoch: 17, train_loss: 0.8672, test_loss: 1.1553, test_f1: 0.5100
 epoch: 18, train_loss: 0.8471, test_loss: 1.1475, test_f1: 0.5444
 epoch: 19, train_loss: 0.8403, test_loss: 1.0837, test_f1: 0.5345
 epoch: 20, train_loss: 0.8128, test_loss: 1.3819, test_f1: 0.5445
 epoch: 21, train_loss: 0.8219, test_loss: 1.1861, test_f1: 0.5329
 epoch: 22, train_loss: 0.7736, test_loss: 1.1823, test_f1: 0.5645
 epoch: 23, train_loss: 0.7622, test_loss: 1.0687, test_f1: 0.5772
 epoch: 24, train_loss: 0.7742, test_loss: 1.1437, test_f1: 0.5886
 epoch: 25, train_loss: 0.7446, test_loss: 1.2527, test_f1: 0.5784
 epoch: 26, train_loss: 0.7866, test_loss: 1.2262, test_f1: 0.5579
 epoch: 27, train_loss: 0.7721, test_loss: 1.3469, test_f1: 0.5435
 epoch: 28, train_loss: 0.7953, test_loss: 1.0909, test_f1: 0.5882
 epoch: 29, train_loss: 0.7637, test_loss: 1.1545, test_f1: 0.5837
 epoch: 30, train_loss: 0.7482, test_loss: 1.2875, test_f1: 0.5291
 epoch: 31, train_loss: 0.7320, test_loss: 1.2217, test_f1: 0.5487
 epoch: 32, train_loss: 0.7512, test_loss: 1.1651, test_f1: 0.5561
 epoch: 33, train_loss: 0.7170, test_loss: 1.3107, test_f1: 0.5544
 epoch: 34, train_loss: 0.7135, test_loss: 1.3973, test_f1: 0.5106
 epoch: 35, train_loss: 0.7267, test_loss: 1.3086, test_f1: 0.5940
 epoch: 36, train_loss: 0.7140, test_loss: 1.2200, test_f1: 0.5333
 epoch: 37, train_loss: 0.7086, test_loss: 1.3970, test_f1: 0.5121
 epoch: 38, train_loss: 0.7129, test_loss: 1.3869, test_f1: 0.5647
 epoch: 39, train_loss: 0.7002, test_loss: 1.5642, test_f1: 0.5589
 epoch: 40, train_loss: 0.7075, test_loss: 1.2523, test_f1: 0.5643
 epoch: 41, train_loss: 0.6735, test_loss: 1.2879, test_f1: 0.5603
 epoch: 42, train_loss: 0.6524, test_loss: 1.3116, test_f1: 0.5303
 epoch: 43, train_loss: 0.6746, test_loss: 1.5311, test_f1: 0.5179
 epoch: 44, train_loss: 0.6548, test_loss: 1.5246, test_f1: 0.5899
 epoch: 45, train_loss: 0.6486, test_loss: 1.3269, test_f1: 0.5954
 epoch: 46, train_loss: 0.6532, test_loss: 1.3481, test_f1: 0.5864
 epoch: 47, train_loss: 0.6494, test_loss: 1.2487, test_f1: 0.5879
 epoch: 48, train_loss: 0.6617, test_loss: 1.6136, test_f1: 0.5198
 epoch: 49, train_loss: 0.6453, test_loss: 1.2495, test_f1: 0.5045
 epoch: 50, train_loss: 0.6679, test_loss: 1.2093, test_f1: 0.5614
 epoch: 51, train_loss: 0.6438, test_loss: 1.2883, test_f1: 0.5916
 epoch: 52, train_loss: 0.6053, test_loss: 1.3358, test_f1: 0.6090
 epoch: 53, train_loss: 0.5810, test_loss: 1.4844, test_f1: 0.5528
 epoch: 54, train_loss: 0.5905, test_loss: 1.2972, test_f1: 0.5905
 epoch: 55, train_loss: 0.5674, test_loss: 1.4616, test_f1: 0.6160
 epoch: 56, train_loss: 0.5533, test_loss: 1.3353, test_f1: 0.5726
 epoch: 57, train_loss: 0.5452, test_loss: 1.3666, test_f1: 0.5937
 epoch: 58, train_loss: 0.5572, test_loss: 1.5390, test_f1: 0.5710
 epoch: 59, train_loss: 0.5418, test_loss: 1.4651, test_f1: 0.5737
 epoch: 60, train_loss: 0.5338, test_loss: 1.5669, test_f1: 0.5781
 epoch: 61, train_loss: 0.5168, test_loss: 1.5955, test_f1: 0.5916
 epoch: 62, train_loss: 0.4899, test_loss: 1.4801, test_f1: 0.6047
 epoch: 63, train_loss: 0.5332, test_loss: 1.5112, test_f1: 0.6306
 epoch: 64, train_loss: 0.5140, test_loss: 1.7394, test_f1: 0.5505
 epoch: 65, train_loss: 0.5397, test_loss: 1.6360, test_f1: 0.6002
 epoch: 66, train_loss: 0.5393, test_loss: 1.6946, test_f1: 0.5884
 epoch: 67, train_loss: 0.5348, test_loss: 1.7121, test_f1: 0.5994
 epoch: 68, train_loss: 0.5190, test_loss: 1.6133, test_f1: 0.5962
 epoch: 69, train_loss: 0.5267, test_loss: 2.1220, test_f1: 0.5620
 epoch: 70, train_loss: 0.5249, test_loss: 1.6233, test_f1: 0.6195
 epoch: 71, train_loss: 0.4802, test_loss: 1.5963, test_f1: 0.5985
 epoch: 72, train_loss: 0.5011, test_loss: 1.7111, test_f1: 0.5764
 epoch: 73, train_loss: 0.5001, test_loss: 1.6558, test_f1: 0.5803
 epoch: 74, train_loss: 0.5004, test_loss: 1.5220, test_f1: 0.5009
 epoch: 75, train_loss: 0.5580, test_loss: 1.8189, test_f1: 0.6200
 epoch: 76, train_loss: 0.5378, test_loss: 1.6482, test_f1: 0.5710
 epoch: 77, train_loss: 0.4693, test_loss: 1.7660, test_f1: 0.6027
 epoch: 78, train_loss: 0.4836, test_loss: 1.7200, test_f1: 0.6272
 epoch: 79, train_loss: 0.4898, test_loss: 1.7998, test_f1: 0.5652
 epoch: 80, train_loss: 0.4921, test_loss: 1.6656, test_f1: 0.5792
 epoch: 81, train_loss: 0.4494, test_loss: 1.7090, test_f1: 0.6093
 epoch: 82, train_loss: 0.4790, test_loss: 1.6878, test_f1: 0.6036
 epoch: 83, train_loss: 0.4458, test_loss: 1.7405, test_f1: 0.5596
 epoch: 84, train_loss: 0.4747, test_loss: 1.6851, test_f1: 0.6380
 epoch: 85, train_loss: 0.4473, test_loss: 1.6610, test_f1: 0.5903
 epoch: 86, train_loss: 0.4470, test_loss: 1.8908, test_f1: 0.6260
 epoch: 87, train_loss: 0.4587, test_loss: 2.0438, test_f1: 0.5744
 epoch: 88, train_loss: 0.4979, test_loss: 1.8655, test_f1: 0.5734
 epoch: 89, train_loss: 0.4686, test_loss: 1.7325, test_f1: 0.5862
 epoch: 90, train_loss: 0.4354, test_loss: 1.7572, test_f1: 0.6236
 epoch: 91, train_loss: 0.4617, test_loss: 1.7973, test_f1: 0.5991
 epoch: 92, train_loss: 0.4692, test_loss: 1.8062, test_f1: 0.5947
 epoch: 93, train_loss: 0.4448, test_loss: 1.9313, test_f1: 0.5953
 epoch: 94, train_loss: 0.4401, test_loss: 1.7885, test_f1: 0.6174
 epoch: 95, train_loss: 0.4611, test_loss: 2.0794, test_f1: 0.5840
 epoch: 96, train_loss: 0.4347, test_loss: 1.9944, test_f1: 0.5972
 epoch: 97, train_loss: 0.4330, test_loss: 1.9361, test_f1: 0.6268
 epoch: 98, train_loss: 0.4446, test_loss: 1.9306, test_f1: 0.5990
 epoch: 99, train_loss: 0.4248, test_loss: 1.9467, test_f1: 0.6241

Training completed in 676.08 seconds
Best F1: 0.6573 at epoch 84
Mean F1 across iterations: 0.6295  0.0169
========================FINAL RESULTS================================
FEGIN weighted F1: 0.6573  0.0169
python main.py --data ltspice_demos --representation component_net --model FEGIN --layers 5 --hiddens 32 --batch_size 64 --lr 0.01 --emb_size 512 --epochs 100 --save_appendix component_net_L5_H32_BS64_LR0.01_E512 --no_val
-----



STDERR:
  File "main.py", line 370, in <module>
    main()
  File "main.py", line 254, in main
    dataset = dataset_class(
  File "/home/philip/projects/ltspice_examples_code_repo/Circuit-Completion-Using-GNNs/component_classification_with_link_prediction_head/evaluation/FEGIN/kernel/circuit_datasets.py", line 15, in __init__
    self.data, self.slices = torch.load(self.processed_paths[0])
  File "/home/philip/.local/lib/python3.8/site-packages/torch/serialization.py", line 1040, in load
    warnings.warn(
  File "/usr/lib/python3.8/warnings.py", line 109, in _showwarnmsg
    sw(msg.message, msg.category, msg.filename, msg.lineno,
  File "main.py", line 47, in warn_with_traceback
    traceback.print_stack(file=log)
/home/philip/projects/ltspice_examples_code_repo/Circuit-Completion-Using-GNNs/component_classification_with_link_prediction_head/evaluation/FEGIN/kernel/circuit_datasets.py:15: FutureWarning: You are using `torch.load` with `weights_only=False` (the current default value), which uses the default pickle module implicitly. It is possible to construct malicious pickle data which will execute arbitrary code during unpickling (See https://github.com/pytorch/pytorch/blob/main/SECURITY.md#untrusted-models for more details). In a future release, the default value for `weights_only` will be flipped to `True`. This limits the functions that could be executed during unpickling. Arbitrary objects will no longer be allowed to be loaded via this mode unless they are explicitly allowlisted by the user via `torch.serialization.add_safe_globals`. We recommend you start setting `weights_only=True` for any use case where you don't have full control of the loaded file. Please open an issue on GitHub for any issues related to this experimental feature.
  self.data, self.slices = torch.load(self.processed_paths[0])
