STDOUT:
Results will be saved in /home/philip/projects/ltspice_examples_code_repo/Circuit-Completion-Using-GNNs/component_classification_with_link_prediction_head/evaluation/FEGIN/results/model_FEGIN_dataset_ltspice_demos
Command line input: python main.py --data ltspice_demos --representation component_net --model FEGIN --layers 2 --hiddens 128 --batch_size 64 --lr 0.0001 --emb_size 128 --epochs 100 --save_appendix component_net_L2_H128_BS64_LR0.0001_E128 --no_val
 is saved.
-----
ltspice_demos - FEGIN
Using 2 layers, 128 hidden units, h = 2
Loading component_net representation dataset
ENTERED
Training FEGIN on component_net representation
Train: 1565, Test: 383
##################ITERATION #0 ****************************************
 epoch: 0, train_loss: 1.3674, test_loss: 1.3694, test_f1: 0.2281
 epoch: 1, train_loss: 1.3355, test_loss: 1.3530, test_f1: 0.2281
 epoch: 2, train_loss: 1.3086, test_loss: 1.3231, test_f1: 0.2281
 epoch: 3, train_loss: 1.2749, test_loss: 1.2918, test_f1: 0.2449
 epoch: 4, train_loss: 1.2336, test_loss: 1.2669, test_f1: 0.2721
 epoch: 5, train_loss: 1.1981, test_loss: 1.2455, test_f1: 0.2775
 epoch: 6, train_loss: 1.1759, test_loss: 1.2327, test_f1: 0.2833
 epoch: 7, train_loss: 1.1478, test_loss: 1.2210, test_f1: 0.2886
 epoch: 8, train_loss: 1.1298, test_loss: 1.2111, test_f1: 0.3179
 epoch: 9, train_loss: 1.1159, test_loss: 1.1993, test_f1: 0.3720
 epoch: 10, train_loss: 1.0993, test_loss: 1.1930, test_f1: 0.4035
 epoch: 11, train_loss: 1.0762, test_loss: 1.1769, test_f1: 0.4073
 epoch: 12, train_loss: 1.0598, test_loss: 1.1690, test_f1: 0.4028
 epoch: 13, train_loss: 1.0402, test_loss: 1.1556, test_f1: 0.4029
 epoch: 14, train_loss: 1.0298, test_loss: 1.1491, test_f1: 0.4146
 epoch: 15, train_loss: 1.0155, test_loss: 1.1255, test_f1: 0.4140
 epoch: 16, train_loss: 1.0023, test_loss: 1.1269, test_f1: 0.4245
 epoch: 17, train_loss: 0.9866, test_loss: 1.0997, test_f1: 0.4480
 epoch: 18, train_loss: 0.9731, test_loss: 1.0870, test_f1: 0.4550
 epoch: 19, train_loss: 0.9638, test_loss: 1.0854, test_f1: 0.4736
 epoch: 20, train_loss: 0.9536, test_loss: 1.0849, test_f1: 0.4745
 epoch: 21, train_loss: 0.9381, test_loss: 1.0604, test_f1: 0.4904
 epoch: 22, train_loss: 0.9335, test_loss: 1.0720, test_f1: 0.4817
 epoch: 23, train_loss: 0.9143, test_loss: 1.0732, test_f1: 0.4990
 epoch: 24, train_loss: 0.9115, test_loss: 1.0959, test_f1: 0.4964
 epoch: 25, train_loss: 0.8965, test_loss: 1.0631, test_f1: 0.5037
 epoch: 26, train_loss: 0.9002, test_loss: 1.0555, test_f1: 0.5111
 epoch: 27, train_loss: 0.8895, test_loss: 1.0555, test_f1: 0.5307
 epoch: 28, train_loss: 0.8799, test_loss: 1.0643, test_f1: 0.5308
 epoch: 29, train_loss: 0.8744, test_loss: 1.0545, test_f1: 0.5246
 epoch: 30, train_loss: 0.8685, test_loss: 1.0333, test_f1: 0.5515
 epoch: 31, train_loss: 0.8609, test_loss: 1.0597, test_f1: 0.5165
 epoch: 32, train_loss: 0.8548, test_loss: 1.0482, test_f1: 0.5676
 epoch: 33, train_loss: 0.8445, test_loss: 1.0340, test_f1: 0.5487
 epoch: 34, train_loss: 0.8402, test_loss: 1.0006, test_f1: 0.5803
 epoch: 35, train_loss: 0.8360, test_loss: 1.0429, test_f1: 0.5659
 epoch: 36, train_loss: 0.8325, test_loss: 1.0328, test_f1: 0.5850
 epoch: 37, train_loss: 0.8231, test_loss: 1.0443, test_f1: 0.5698
 epoch: 38, train_loss: 0.8251, test_loss: 1.0667, test_f1: 0.5640
 epoch: 39, train_loss: 0.8095, test_loss: 1.0068, test_f1: 0.5726
 epoch: 40, train_loss: 0.8114, test_loss: 1.0528, test_f1: 0.5727
 epoch: 41, train_loss: 0.7997, test_loss: 1.0593, test_f1: 0.5740
 epoch: 42, train_loss: 0.7973, test_loss: 1.0619, test_f1: 0.5393
 epoch: 43, train_loss: 0.7896, test_loss: 1.0243, test_f1: 0.5593
 epoch: 44, train_loss: 0.7784, test_loss: 1.0977, test_f1: 0.5479
 epoch: 45, train_loss: 0.7808, test_loss: 1.0118, test_f1: 0.6065
 epoch: 46, train_loss: 0.7782, test_loss: 1.0374, test_f1: 0.5566
 epoch: 47, train_loss: 0.7635, test_loss: 1.0443, test_f1: 0.5974
 epoch: 48, train_loss: 0.7591, test_loss: 1.0605, test_f1: 0.5492
 epoch: 49, train_loss: 0.7478, test_loss: 1.0229, test_f1: 0.5831
 epoch: 50, train_loss: 0.7521, test_loss: 0.9898, test_f1: 0.5725
 epoch: 51, train_loss: 0.7344, test_loss: 1.0213, test_f1: 0.6011
 epoch: 52, train_loss: 0.7276, test_loss: 1.0019, test_f1: 0.6047
 epoch: 53, train_loss: 0.7314, test_loss: 1.0103, test_f1: 0.6007
 epoch: 54, train_loss: 0.7217, test_loss: 1.0004, test_f1: 0.6099
 epoch: 55, train_loss: 0.7216, test_loss: 1.0149, test_f1: 0.5992
 epoch: 56, train_loss: 0.7147, test_loss: 1.0247, test_f1: 0.5948
 epoch: 57, train_loss: 0.7135, test_loss: 1.0188, test_f1: 0.6046
 epoch: 58, train_loss: 0.7161, test_loss: 1.0255, test_f1: 0.6179
 epoch: 59, train_loss: 0.7132, test_loss: 1.0227, test_f1: 0.6048
 epoch: 60, train_loss: 0.7149, test_loss: 1.0096, test_f1: 0.5956
 epoch: 61, train_loss: 0.7077, test_loss: 1.0375, test_f1: 0.5768
 epoch: 62, train_loss: 0.7059, test_loss: 1.0319, test_f1: 0.6011
 epoch: 63, train_loss: 0.7046, test_loss: 1.0216, test_f1: 0.6191
 epoch: 64, train_loss: 0.7052, test_loss: 1.0134, test_f1: 0.6104
 epoch: 65, train_loss: 0.6991, test_loss: 1.0561, test_f1: 0.5999
 epoch: 66, train_loss: 0.6940, test_loss: 1.0318, test_f1: 0.6084
 epoch: 67, train_loss: 0.6968, test_loss: 1.0229, test_f1: 0.6088
 epoch: 68, train_loss: 0.6774, test_loss: 1.0129, test_f1: 0.6254
 epoch: 69, train_loss: 0.6781, test_loss: 1.0184, test_f1: 0.6208
 epoch: 70, train_loss: 0.6839, test_loss: 1.0121, test_f1: 0.6181
 epoch: 71, train_loss: 0.6817, test_loss: 1.0312, test_f1: 0.6042
 epoch: 72, train_loss: 0.6754, test_loss: 1.0322, test_f1: 0.6251
 epoch: 73, train_loss: 0.6760, test_loss: 1.0154, test_f1: 0.5964
 epoch: 74, train_loss: 0.6641, test_loss: 1.0508, test_f1: 0.6160
 epoch: 75, train_loss: 0.6566, test_loss: 1.0260, test_f1: 0.6206
 epoch: 76, train_loss: 0.6602, test_loss: 1.0354, test_f1: 0.6243
 epoch: 77, train_loss: 0.6634, test_loss: 1.0333, test_f1: 0.6031
 epoch: 78, train_loss: 0.6628, test_loss: 1.0364, test_f1: 0.6192
 epoch: 79, train_loss: 0.6547, test_loss: 1.0485, test_f1: 0.6142
 epoch: 80, train_loss: 0.6456, test_loss: 1.0334, test_f1: 0.6046
 epoch: 81, train_loss: 0.6427, test_loss: 1.0465, test_f1: 0.6136
 epoch: 82, train_loss: 0.6470, test_loss: 1.0333, test_f1: 0.6169
 epoch: 83, train_loss: 0.6450, test_loss: 1.0653, test_f1: 0.6097
 epoch: 84, train_loss: 0.6480, test_loss: 1.0397, test_f1: 0.6200
 epoch: 85, train_loss: 0.6460, test_loss: 1.0296, test_f1: 0.6398
 epoch: 86, train_loss: 0.6281, test_loss: 1.0243, test_f1: 0.6279
 epoch: 87, train_loss: 0.6406, test_loss: 1.0456, test_f1: 0.6308
 epoch: 88, train_loss: 0.6310, test_loss: 1.0505, test_f1: 0.6453
 epoch: 89, train_loss: 0.6293, test_loss: 1.0379, test_f1: 0.6295
 epoch: 90, train_loss: 0.6218, test_loss: 1.0800, test_f1: 0.6032
 epoch: 91, train_loss: 0.6281, test_loss: 1.0558, test_f1: 0.6447
 epoch: 92, train_loss: 0.6231, test_loss: 1.0495, test_f1: 0.6500
 epoch: 93, train_loss: 0.6222, test_loss: 1.0687, test_f1: 0.6310
 epoch: 94, train_loss: 0.6139, test_loss: 1.0724, test_f1: 0.6368
 epoch: 95, train_loss: 0.6212, test_loss: 1.0451, test_f1: 0.6459
 epoch: 96, train_loss: 0.6252, test_loss: 1.0818, test_f1: 0.6407
 epoch: 97, train_loss: 0.6083, test_loss: 1.0889, test_f1: 0.6322
 epoch: 98, train_loss: 0.6109, test_loss: 1.0323, test_f1: 0.6406
 epoch: 99, train_loss: 0.6030, test_loss: 1.0909, test_f1: 0.6449
##################ITERATION #1 ****************************************
 epoch: 0, train_loss: 1.2847, test_loss: 1.3222, test_f1: 0.1654
 epoch: 1, train_loss: 1.1885, test_loss: 1.2727, test_f1: 0.3284
 epoch: 2, train_loss: 1.1492, test_loss: 1.2253, test_f1: 0.3491
 epoch: 3, train_loss: 1.1238, test_loss: 1.1924, test_f1: 0.3877
 epoch: 4, train_loss: 1.0926, test_loss: 1.1693, test_f1: 0.4208
 epoch: 5, train_loss: 1.0673, test_loss: 1.1467, test_f1: 0.4351
 epoch: 6, train_loss: 1.0510, test_loss: 1.1304, test_f1: 0.4627
 epoch: 7, train_loss: 1.0258, test_loss: 1.1111, test_f1: 0.4769
 epoch: 8, train_loss: 1.0006, test_loss: 1.0954, test_f1: 0.4829
 epoch: 9, train_loss: 0.9820, test_loss: 1.0848, test_f1: 0.4847
 epoch: 10, train_loss: 0.9699, test_loss: 1.0797, test_f1: 0.4847
 epoch: 11, train_loss: 0.9617, test_loss: 1.0694, test_f1: 0.4946
 epoch: 12, train_loss: 0.9438, test_loss: 1.0544, test_f1: 0.4951
 epoch: 13, train_loss: 0.9371, test_loss: 1.0497, test_f1: 0.5032
 epoch: 14, train_loss: 0.9221, test_loss: 1.0471, test_f1: 0.5068
 epoch: 15, train_loss: 0.9150, test_loss: 1.0397, test_f1: 0.5029
 epoch: 16, train_loss: 0.8978, test_loss: 1.0507, test_f1: 0.5115
 epoch: 17, train_loss: 0.8892, test_loss: 1.0675, test_f1: 0.5341
 epoch: 18, train_loss: 0.8970, test_loss: 1.0670, test_f1: 0.5306
 epoch: 19, train_loss: 0.8812, test_loss: 1.0589, test_f1: 0.5373
 epoch: 20, train_loss: 0.8709, test_loss: 1.0427, test_f1: 0.5386
 epoch: 21, train_loss: 0.8643, test_loss: 1.0402, test_f1: 0.5444
 epoch: 22, train_loss: 0.8516, test_loss: 1.0586, test_f1: 0.5377
 epoch: 23, train_loss: 0.8653, test_loss: 1.0439, test_f1: 0.5498
 epoch: 24, train_loss: 0.8380, test_loss: 1.0582, test_f1: 0.5584
 epoch: 25, train_loss: 0.8464, test_loss: 1.0566, test_f1: 0.5576
 epoch: 26, train_loss: 0.8359, test_loss: 1.0489, test_f1: 0.5783
 epoch: 27, train_loss: 0.8326, test_loss: 1.0398, test_f1: 0.5809
 epoch: 28, train_loss: 0.8209, test_loss: 1.0597, test_f1: 0.5763
 epoch: 29, train_loss: 0.8061, test_loss: 1.0440, test_f1: 0.5747
 epoch: 30, train_loss: 0.8116, test_loss: 1.0490, test_f1: 0.5824
 epoch: 31, train_loss: 0.8112, test_loss: 1.0740, test_f1: 0.5884
 epoch: 32, train_loss: 0.8052, test_loss: 1.0539, test_f1: 0.5562
 epoch: 33, train_loss: 0.7965, test_loss: 1.0503, test_f1: 0.5549
 epoch: 34, train_loss: 0.7930, test_loss: 1.0334, test_f1: 0.5891
 epoch: 35, train_loss: 0.7852, test_loss: 1.0586, test_f1: 0.5814
 epoch: 36, train_loss: 0.7755, test_loss: 1.0734, test_f1: 0.5757
 epoch: 37, train_loss: 0.7781, test_loss: 1.0389, test_f1: 0.5774
 epoch: 38, train_loss: 0.7708, test_loss: 1.0561, test_f1: 0.5741
 epoch: 39, train_loss: 0.7578, test_loss: 1.0451, test_f1: 0.5842
 epoch: 40, train_loss: 0.7495, test_loss: 1.0755, test_f1: 0.5777
 epoch: 41, train_loss: 0.7441, test_loss: 1.0812, test_f1: 0.5847
 epoch: 42, train_loss: 0.7465, test_loss: 1.0747, test_f1: 0.5715
 epoch: 43, train_loss: 0.7432, test_loss: 1.0764, test_f1: 0.5842
 epoch: 44, train_loss: 0.7422, test_loss: 1.0810, test_f1: 0.5783
 epoch: 45, train_loss: 0.7335, test_loss: 1.1030, test_f1: 0.6023
 epoch: 46, train_loss: 0.7292, test_loss: 1.0797, test_f1: 0.5723
 epoch: 47, train_loss: 0.7187, test_loss: 1.1096, test_f1: 0.5945
 epoch: 48, train_loss: 0.7059, test_loss: 1.0828, test_f1: 0.5890
 epoch: 49, train_loss: 0.7082, test_loss: 1.0630, test_f1: 0.6008
 epoch: 50, train_loss: 0.7177, test_loss: 1.1184, test_f1: 0.5964
 epoch: 51, train_loss: 0.6921, test_loss: 1.0776, test_f1: 0.6112
 epoch: 52, train_loss: 0.6920, test_loss: 1.0940, test_f1: 0.6048
 epoch: 53, train_loss: 0.6849, test_loss: 1.0858, test_f1: 0.6029
 epoch: 54, train_loss: 0.6907, test_loss: 1.0851, test_f1: 0.5966
 epoch: 55, train_loss: 0.6752, test_loss: 1.0931, test_f1: 0.5976
 epoch: 56, train_loss: 0.6677, test_loss: 1.1046, test_f1: 0.5958
 epoch: 57, train_loss: 0.6774, test_loss: 1.1146, test_f1: 0.5869
 epoch: 58, train_loss: 0.6696, test_loss: 1.1000, test_f1: 0.5862
 epoch: 59, train_loss: 0.6750, test_loss: 1.1279, test_f1: 0.5990
 epoch: 60, train_loss: 0.6650, test_loss: 1.1385, test_f1: 0.6058
 epoch: 61, train_loss: 0.6693, test_loss: 1.1246, test_f1: 0.6042
 epoch: 62, train_loss: 0.6612, test_loss: 1.1242, test_f1: 0.5989
 epoch: 63, train_loss: 0.6482, test_loss: 1.1278, test_f1: 0.6063
 epoch: 64, train_loss: 0.6449, test_loss: 1.1274, test_f1: 0.6039
 epoch: 65, train_loss: 0.6434, test_loss: 1.1254, test_f1: 0.6107
 epoch: 66, train_loss: 0.6439, test_loss: 1.1561, test_f1: 0.6063
 epoch: 67, train_loss: 0.6417, test_loss: 1.1378, test_f1: 0.6081
 epoch: 68, train_loss: 0.6410, test_loss: 1.1237, test_f1: 0.6100
 epoch: 69, train_loss: 0.6407, test_loss: 1.1522, test_f1: 0.6171
 epoch: 70, train_loss: 0.6433, test_loss: 1.1575, test_f1: 0.6132
 epoch: 71, train_loss: 0.6373, test_loss: 1.1684, test_f1: 0.6008
 epoch: 72, train_loss: 0.6290, test_loss: 1.1901, test_f1: 0.6010
 epoch: 73, train_loss: 0.6356, test_loss: 1.1846, test_f1: 0.6115
 epoch: 74, train_loss: 0.6270, test_loss: 1.1768, test_f1: 0.5962
 epoch: 75, train_loss: 0.6274, test_loss: 1.1904, test_f1: 0.6000
 epoch: 76, train_loss: 0.6174, test_loss: 1.1769, test_f1: 0.6068
 epoch: 77, train_loss: 0.6165, test_loss: 1.1717, test_f1: 0.6118
 epoch: 78, train_loss: 0.6199, test_loss: 1.1799, test_f1: 0.6025
 epoch: 79, train_loss: 0.6175, test_loss: 1.2349, test_f1: 0.6047
 epoch: 80, train_loss: 0.6135, test_loss: 1.2042, test_f1: 0.5953
 epoch: 81, train_loss: 0.6072, test_loss: 1.2135, test_f1: 0.5860
 epoch: 82, train_loss: 0.6073, test_loss: 1.1886, test_f1: 0.5882
 epoch: 83, train_loss: 0.5904, test_loss: 1.1793, test_f1: 0.6113
 epoch: 84, train_loss: 0.6051, test_loss: 1.2181, test_f1: 0.5779
 epoch: 85, train_loss: 0.6002, test_loss: 1.2111, test_f1: 0.5974
 epoch: 86, train_loss: 0.6111, test_loss: 1.2404, test_f1: 0.5875
 epoch: 87, train_loss: 0.5970, test_loss: 1.2137, test_f1: 0.5898
 epoch: 88, train_loss: 0.5875, test_loss: 1.2428, test_f1: 0.5999
 epoch: 89, train_loss: 0.5867, test_loss: 1.2333, test_f1: 0.5908
 epoch: 90, train_loss: 0.5794, test_loss: 1.2363, test_f1: 0.5745
 epoch: 91, train_loss: 0.5801, test_loss: 1.2054, test_f1: 0.6083
 epoch: 92, train_loss: 0.5787, test_loss: 1.2608, test_f1: 0.5770
 epoch: 93, train_loss: 0.5675, test_loss: 1.2620, test_f1: 0.5727
 epoch: 94, train_loss: 0.5664, test_loss: 1.2684, test_f1: 0.5900
 epoch: 95, train_loss: 0.5650, test_loss: 1.2699, test_f1: 0.5814
 epoch: 96, train_loss: 0.5714, test_loss: 1.2519, test_f1: 0.5847
 epoch: 97, train_loss: 0.5562, test_loss: 1.2850, test_f1: 0.5853
 epoch: 98, train_loss: 0.5571, test_loss: 1.2908, test_f1: 0.5748
 epoch: 99, train_loss: 0.5796, test_loss: 1.2605, test_f1: 0.5972
##################ITERATION #2 ****************************************
 epoch: 0, train_loss: 1.2458, test_loss: 1.2926, test_f1: 0.2583
 epoch: 1, train_loss: 1.1643, test_loss: 1.2477, test_f1: 0.3611
 epoch: 2, train_loss: 1.1282, test_loss: 1.2000, test_f1: 0.4070
 epoch: 3, train_loss: 1.0936, test_loss: 1.1704, test_f1: 0.4005
 epoch: 4, train_loss: 1.0715, test_loss: 1.1388, test_f1: 0.4415
 epoch: 5, train_loss: 1.0446, test_loss: 1.1185, test_f1: 0.4518
 epoch: 6, train_loss: 1.0173, test_loss: 1.1069, test_f1: 0.4539
 epoch: 7, train_loss: 1.0051, test_loss: 1.0916, test_f1: 0.4532
 epoch: 8, train_loss: 0.9881, test_loss: 1.0828, test_f1: 0.4903
 epoch: 9, train_loss: 0.9767, test_loss: 1.0740, test_f1: 0.4985
 epoch: 10, train_loss: 0.9616, test_loss: 1.0734, test_f1: 0.4972
 epoch: 11, train_loss: 0.9499, test_loss: 1.0640, test_f1: 0.5055
 epoch: 12, train_loss: 0.9310, test_loss: 1.0581, test_f1: 0.5111
 epoch: 13, train_loss: 0.9284, test_loss: 1.0593, test_f1: 0.5000
 epoch: 14, train_loss: 0.9269, test_loss: 1.0582, test_f1: 0.5228
 epoch: 15, train_loss: 0.9136, test_loss: 1.0473, test_f1: 0.5258
 epoch: 16, train_loss: 0.8964, test_loss: 1.0593, test_f1: 0.5092
 epoch: 17, train_loss: 0.8949, test_loss: 1.0493, test_f1: 0.5163
 epoch: 18, train_loss: 0.8923, test_loss: 1.0447, test_f1: 0.5323
 epoch: 19, train_loss: 0.8819, test_loss: 1.0556, test_f1: 0.5208
 epoch: 20, train_loss: 0.8724, test_loss: 1.0463, test_f1: 0.5309
 epoch: 21, train_loss: 0.8726, test_loss: 1.0387, test_f1: 0.5297
 epoch: 22, train_loss: 0.8541, test_loss: 1.0573, test_f1: 0.5311
 epoch: 23, train_loss: 0.8491, test_loss: 1.0425, test_f1: 0.5329
 epoch: 24, train_loss: 0.8473, test_loss: 1.0312, test_f1: 0.5470
 epoch: 25, train_loss: 0.8552, test_loss: 1.0605, test_f1: 0.5386
 epoch: 26, train_loss: 0.8392, test_loss: 1.0437, test_f1: 0.5487
 epoch: 27, train_loss: 0.8429, test_loss: 1.0511, test_f1: 0.5464
 epoch: 28, train_loss: 0.8275, test_loss: 1.0386, test_f1: 0.5450
 epoch: 29, train_loss: 0.8267, test_loss: 1.0458, test_f1: 0.5507
 epoch: 30, train_loss: 0.8265, test_loss: 1.0359, test_f1: 0.5577
 epoch: 31, train_loss: 0.8228, test_loss: 1.0537, test_f1: 0.5556
 epoch: 32, train_loss: 0.8213, test_loss: 1.0394, test_f1: 0.5631
 epoch: 33, train_loss: 0.8053, test_loss: 1.0545, test_f1: 0.5458
 epoch: 34, train_loss: 0.8040, test_loss: 1.0463, test_f1: 0.5421
 epoch: 35, train_loss: 0.7998, test_loss: 1.0674, test_f1: 0.5503
 epoch: 36, train_loss: 0.7842, test_loss: 1.0360, test_f1: 0.5910
 epoch: 37, train_loss: 0.7841, test_loss: 1.0476, test_f1: 0.5378
 epoch: 38, train_loss: 0.7778, test_loss: 1.0432, test_f1: 0.5676
 epoch: 39, train_loss: 0.7714, test_loss: 1.0786, test_f1: 0.5484
 epoch: 40, train_loss: 0.7549, test_loss: 1.0365, test_f1: 0.5614
 epoch: 41, train_loss: 0.7541, test_loss: 1.0518, test_f1: 0.5664
 epoch: 42, train_loss: 0.7548, test_loss: 1.0768, test_f1: 0.5709
 epoch: 43, train_loss: 0.7511, test_loss: 1.0728, test_f1: 0.5871
 epoch: 44, train_loss: 0.7489, test_loss: 1.0689, test_f1: 0.5821
 epoch: 45, train_loss: 0.7428, test_loss: 1.0411, test_f1: 0.5665
 epoch: 46, train_loss: 0.7390, test_loss: 1.0941, test_f1: 0.5799
 epoch: 47, train_loss: 0.7249, test_loss: 1.0844, test_f1: 0.5813
 epoch: 48, train_loss: 0.7138, test_loss: 1.1073, test_f1: 0.5816
 epoch: 49, train_loss: 0.7142, test_loss: 1.0890, test_f1: 0.5829
 epoch: 50, train_loss: 0.7095, test_loss: 1.0751, test_f1: 0.5920
 epoch: 51, train_loss: 0.6944, test_loss: 1.0640, test_f1: 0.5815
 epoch: 52, train_loss: 0.6865, test_loss: 1.0766, test_f1: 0.5779
 epoch: 53, train_loss: 0.6983, test_loss: 1.0759, test_f1: 0.5885
 epoch: 54, train_loss: 0.6972, test_loss: 1.0897, test_f1: 0.5883
 epoch: 55, train_loss: 0.6858, test_loss: 1.1246, test_f1: 0.6030
 epoch: 56, train_loss: 0.6729, test_loss: 1.0951, test_f1: 0.5882
 epoch: 57, train_loss: 0.6723, test_loss: 1.0855, test_f1: 0.5897
 epoch: 58, train_loss: 0.6630, test_loss: 1.0795, test_f1: 0.5991
 epoch: 59, train_loss: 0.6706, test_loss: 1.1122, test_f1: 0.5922
 epoch: 60, train_loss: 0.6692, test_loss: 1.0552, test_f1: 0.5944
 epoch: 61, train_loss: 0.6626, test_loss: 1.0967, test_f1: 0.5921
 epoch: 62, train_loss: 0.6535, test_loss: 1.1357, test_f1: 0.5943
 epoch: 63, train_loss: 0.6587, test_loss: 1.1296, test_f1: 0.6057
 epoch: 64, train_loss: 0.6529, test_loss: 1.1080, test_f1: 0.5941
 epoch: 65, train_loss: 0.6461, test_loss: 1.1340, test_f1: 0.5897
 epoch: 66, train_loss: 0.6481, test_loss: 1.1114, test_f1: 0.5923
 epoch: 67, train_loss: 0.6376, test_loss: 1.1413, test_f1: 0.5995
 epoch: 68, train_loss: 0.6325, test_loss: 1.1583, test_f1: 0.5940
 epoch: 69, train_loss: 0.6356, test_loss: 1.1379, test_f1: 0.5799
 epoch: 70, train_loss: 0.6351, test_loss: 1.1429, test_f1: 0.5854
 epoch: 71, train_loss: 0.6388, test_loss: 1.1610, test_f1: 0.5875
 epoch: 72, train_loss: 0.6329, test_loss: 1.1320, test_f1: 0.6007
 epoch: 73, train_loss: 0.6257, test_loss: 1.1591, test_f1: 0.5964
 epoch: 74, train_loss: 0.6210, test_loss: 1.1406, test_f1: 0.5956
 epoch: 75, train_loss: 0.6030, test_loss: 1.1857, test_f1: 0.5982
 epoch: 76, train_loss: 0.6199, test_loss: 1.2004, test_f1: 0.5940
 epoch: 77, train_loss: 0.6059, test_loss: 1.1550, test_f1: 0.5953
 epoch: 78, train_loss: 0.6306, test_loss: 1.1656, test_f1: 0.5989
 epoch: 79, train_loss: 0.6125, test_loss: 1.1775, test_f1: 0.5951
 epoch: 80, train_loss: 0.6042, test_loss: 1.1968, test_f1: 0.5923
 epoch: 81, train_loss: 0.6067, test_loss: 1.1783, test_f1: 0.6010
 epoch: 82, train_loss: 0.6106, test_loss: 1.1752, test_f1: 0.6001
 epoch: 83, train_loss: 0.6022, test_loss: 1.1764, test_f1: 0.6005
 epoch: 84, train_loss: 0.5951, test_loss: 1.1997, test_f1: 0.6064
 epoch: 85, train_loss: 0.5956, test_loss: 1.2290, test_f1: 0.5932
 epoch: 86, train_loss: 0.6022, test_loss: 1.1740, test_f1: 0.6007
 epoch: 87, train_loss: 0.5818, test_loss: 1.2501, test_f1: 0.6008
 epoch: 88, train_loss: 0.5950, test_loss: 1.2020, test_f1: 0.6032
 epoch: 89, train_loss: 0.5840, test_loss: 1.2221, test_f1: 0.5989
 epoch: 90, train_loss: 0.5873, test_loss: 1.2439, test_f1: 0.5898
 epoch: 91, train_loss: 0.5746, test_loss: 1.2267, test_f1: 0.6046
 epoch: 92, train_loss: 0.5756, test_loss: 1.2344, test_f1: 0.5958
 epoch: 93, train_loss: 0.5829, test_loss: 1.2410, test_f1: 0.5969
 epoch: 94, train_loss: 0.5800, test_loss: 1.2286, test_f1: 0.5993
 epoch: 95, train_loss: 0.5843, test_loss: 1.2538, test_f1: 0.6086
 epoch: 96, train_loss: 0.5765, test_loss: 1.2657, test_f1: 0.5884
 epoch: 97, train_loss: 0.5724, test_loss: 1.2156, test_f1: 0.6096
 epoch: 98, train_loss: 0.5580, test_loss: 1.2731, test_f1: 0.5990
 epoch: 99, train_loss: 0.5522, test_loss: 1.2533, test_f1: 0.6067
##################ITERATION #3 ****************************************
 epoch: 0, train_loss: 1.2399, test_loss: 1.2852, test_f1: 0.2722
 epoch: 1, train_loss: 1.1365, test_loss: 1.2230, test_f1: 0.3363
 epoch: 2, train_loss: 1.1043, test_loss: 1.1691, test_f1: 0.4151
 epoch: 3, train_loss: 1.0746, test_loss: 1.1440, test_f1: 0.4305
 epoch: 4, train_loss: 1.0426, test_loss: 1.1175, test_f1: 0.4840
 epoch: 5, train_loss: 1.0254, test_loss: 1.1082, test_f1: 0.4929
 epoch: 6, train_loss: 1.0063, test_loss: 1.0955, test_f1: 0.4925
 epoch: 7, train_loss: 0.9914, test_loss: 1.0870, test_f1: 0.4892
 epoch: 8, train_loss: 0.9762, test_loss: 1.0645, test_f1: 0.4940
 epoch: 9, train_loss: 0.9657, test_loss: 1.0652, test_f1: 0.4968
 epoch: 10, train_loss: 0.9463, test_loss: 1.0615, test_f1: 0.4907
 epoch: 11, train_loss: 0.9397, test_loss: 1.0549, test_f1: 0.5216
 epoch: 12, train_loss: 0.9307, test_loss: 1.0514, test_f1: 0.5155
 epoch: 13, train_loss: 0.9321, test_loss: 1.0492, test_f1: 0.5180
 epoch: 14, train_loss: 0.9099, test_loss: 1.0440, test_f1: 0.5187
 epoch: 15, train_loss: 0.9041, test_loss: 1.0453, test_f1: 0.5275
 epoch: 16, train_loss: 0.8977, test_loss: 1.0522, test_f1: 0.5341
 epoch: 17, train_loss: 0.8840, test_loss: 1.0562, test_f1: 0.5143
 epoch: 18, train_loss: 0.8772, test_loss: 1.0424, test_f1: 0.5270
 epoch: 19, train_loss: 0.8651, test_loss: 1.0323, test_f1: 0.5485
 epoch: 20, train_loss: 0.8604, test_loss: 1.0548, test_f1: 0.5313
 epoch: 21, train_loss: 0.8603, test_loss: 1.0427, test_f1: 0.5393
 epoch: 22, train_loss: 0.8475, test_loss: 1.0402, test_f1: 0.5419
 epoch: 23, train_loss: 0.8419, test_loss: 1.0441, test_f1: 0.5464
 epoch: 24, train_loss: 0.8354, test_loss: 1.0424, test_f1: 0.5475
 epoch: 25, train_loss: 0.8298, test_loss: 1.0339, test_f1: 0.5630
 epoch: 26, train_loss: 0.8214, test_loss: 1.0475, test_f1: 0.5700
 epoch: 27, train_loss: 0.8063, test_loss: 1.0449, test_f1: 0.5684
 epoch: 28, train_loss: 0.8136, test_loss: 1.0620, test_f1: 0.5466
 epoch: 29, train_loss: 0.8038, test_loss: 1.0505, test_f1: 0.5617
 epoch: 30, train_loss: 0.7949, test_loss: 1.0516, test_f1: 0.5871
 epoch: 31, train_loss: 0.7902, test_loss: 1.0496, test_f1: 0.5781
 epoch: 32, train_loss: 0.7788, test_loss: 1.0833, test_f1: 0.5507
 epoch: 33, train_loss: 0.7889, test_loss: 1.0435, test_f1: 0.5506
 epoch: 34, train_loss: 0.7650, test_loss: 1.0678, test_f1: 0.5717
 epoch: 35, train_loss: 0.7665, test_loss: 1.0403, test_f1: 0.5832
 epoch: 36, train_loss: 0.7620, test_loss: 1.0414, test_f1: 0.5848
 epoch: 37, train_loss: 0.7525, test_loss: 1.0409, test_f1: 0.6093
 epoch: 38, train_loss: 0.7451, test_loss: 1.0540, test_f1: 0.5807
 epoch: 39, train_loss: 0.7549, test_loss: 1.0776, test_f1: 0.5608
 epoch: 40, train_loss: 0.7359, test_loss: 1.0731, test_f1: 0.5595
 epoch: 41, train_loss: 0.7293, test_loss: 1.0570, test_f1: 0.5791
 epoch: 42, train_loss: 0.7255, test_loss: 1.0745, test_f1: 0.6063
 epoch: 43, train_loss: 0.7167, test_loss: 1.0483, test_f1: 0.5977
 epoch: 44, train_loss: 0.7193, test_loss: 1.0504, test_f1: 0.6148
 epoch: 45, train_loss: 0.7222, test_loss: 1.0821, test_f1: 0.6052
 epoch: 46, train_loss: 0.7086, test_loss: 1.0855, test_f1: 0.5979
 epoch: 47, train_loss: 0.6998, test_loss: 1.0987, test_f1: 0.5579
 epoch: 48, train_loss: 0.6843, test_loss: 1.0569, test_f1: 0.6228
 epoch: 49, train_loss: 0.6868, test_loss: 1.0913, test_f1: 0.6126
 epoch: 50, train_loss: 0.6819, test_loss: 1.1149, test_f1: 0.6105
 epoch: 51, train_loss: 0.6686, test_loss: 1.1035, test_f1: 0.5724
 epoch: 52, train_loss: 0.6597, test_loss: 1.0812, test_f1: 0.5810
 epoch: 53, train_loss: 0.6548, test_loss: 1.0826, test_f1: 0.6035
 epoch: 54, train_loss: 0.6726, test_loss: 1.0809, test_f1: 0.6147
 epoch: 55, train_loss: 0.6618, test_loss: 1.0800, test_f1: 0.5871
 epoch: 56, train_loss: 0.6486, test_loss: 1.0762, test_f1: 0.6106
 epoch: 57, train_loss: 0.6673, test_loss: 1.0851, test_f1: 0.5876
 epoch: 58, train_loss: 0.6432, test_loss: 1.0829, test_f1: 0.6006
 epoch: 59, train_loss: 0.6425, test_loss: 1.0896, test_f1: 0.6056
 epoch: 60, train_loss: 0.6462, test_loss: 1.1255, test_f1: 0.6152
 epoch: 61, train_loss: 0.6411, test_loss: 1.1065, test_f1: 0.6201
 epoch: 62, train_loss: 0.6416, test_loss: 1.1247, test_f1: 0.5916
 epoch: 63, train_loss: 0.6400, test_loss: 1.0847, test_f1: 0.6094
 epoch: 64, train_loss: 0.6385, test_loss: 1.1082, test_f1: 0.6146
 epoch: 65, train_loss: 0.6254, test_loss: 1.0907, test_f1: 0.6208
 epoch: 66, train_loss: 0.6276, test_loss: 1.1461, test_f1: 0.6184
 epoch: 67, train_loss: 0.6171, test_loss: 1.1229, test_f1: 0.6070
 epoch: 68, train_loss: 0.6069, test_loss: 1.1525, test_f1: 0.6003
 epoch: 69, train_loss: 0.6093, test_loss: 1.1435, test_f1: 0.6198
 epoch: 70, train_loss: 0.6037, test_loss: 1.1103, test_f1: 0.6210
 epoch: 71, train_loss: 0.6163, test_loss: 1.1231, test_f1: 0.5983
 epoch: 72, train_loss: 0.6006, test_loss: 1.1869, test_f1: 0.5903
 epoch: 73, train_loss: 0.6006, test_loss: 1.1160, test_f1: 0.6084
 epoch: 74, train_loss: 0.6046, test_loss: 1.1534, test_f1: 0.6104
 epoch: 75, train_loss: 0.5916, test_loss: 1.1263, test_f1: 0.6182
 epoch: 76, train_loss: 0.5970, test_loss: 1.1517, test_f1: 0.5986
 epoch: 77, train_loss: 0.5802, test_loss: 1.1876, test_f1: 0.5851
 epoch: 78, train_loss: 0.5863, test_loss: 1.1574, test_f1: 0.6079
 epoch: 79, train_loss: 0.5859, test_loss: 1.1883, test_f1: 0.5876
 epoch: 80, train_loss: 0.5845, test_loss: 1.1494, test_f1: 0.5935
 epoch: 81, train_loss: 0.5787, test_loss: 1.1720, test_f1: 0.6029
 epoch: 82, train_loss: 0.5659, test_loss: 1.1896, test_f1: 0.6048
 epoch: 83, train_loss: 0.5544, test_loss: 1.1659, test_f1: 0.6054
 epoch: 84, train_loss: 0.5829, test_loss: 1.1427, test_f1: 0.6025
 epoch: 85, train_loss: 0.5628, test_loss: 1.1779, test_f1: 0.6229
 epoch: 86, train_loss: 0.5755, test_loss: 1.1394, test_f1: 0.6030
 epoch: 87, train_loss: 0.5669, test_loss: 1.1433, test_f1: 0.6155
 epoch: 88, train_loss: 0.5735, test_loss: 1.1598, test_f1: 0.6231
 epoch: 89, train_loss: 0.5536, test_loss: 1.1306, test_f1: 0.5793
 epoch: 90, train_loss: 0.5472, test_loss: 1.1741, test_f1: 0.5974
 epoch: 91, train_loss: 0.5755, test_loss: 1.1842, test_f1: 0.6029
 epoch: 92, train_loss: 0.5510, test_loss: 1.1603, test_f1: 0.5940
 epoch: 93, train_loss: 0.5539, test_loss: 1.1652, test_f1: 0.6239
 epoch: 94, train_loss: 0.5576, test_loss: 1.1950, test_f1: 0.6063
 epoch: 95, train_loss: 0.5342, test_loss: 1.1512, test_f1: 0.6072
 epoch: 96, train_loss: 0.5282, test_loss: 1.2121, test_f1: 0.5781
 epoch: 97, train_loss: 0.5302, test_loss: 1.2116, test_f1: 0.5872
 epoch: 98, train_loss: 0.5412, test_loss: 1.2386, test_f1: 0.6051
 epoch: 99, train_loss: 0.5376, test_loss: 1.2087, test_f1: 0.5941
##################ITERATION #4 ****************************************
 epoch: 0, train_loss: 1.2264, test_loss: 1.2980, test_f1: 0.1368
 epoch: 1, train_loss: 1.1274, test_loss: 1.2229, test_f1: 0.3843
 epoch: 2, train_loss: 1.0655, test_loss: 1.1486, test_f1: 0.4591
 epoch: 3, train_loss: 1.0570, test_loss: 1.1241, test_f1: 0.4819
 epoch: 4, train_loss: 1.0326, test_loss: 1.1096, test_f1: 0.4971
 epoch: 5, train_loss: 1.0144, test_loss: 1.0986, test_f1: 0.5035
 epoch: 6, train_loss: 0.9924, test_loss: 1.0846, test_f1: 0.5013
 epoch: 7, train_loss: 0.9846, test_loss: 1.0775, test_f1: 0.5182
 epoch: 8, train_loss: 0.9637, test_loss: 1.0567, test_f1: 0.5249
 epoch: 9, train_loss: 0.9399, test_loss: 1.0614, test_f1: 0.5201
 epoch: 10, train_loss: 0.9456, test_loss: 1.0418, test_f1: 0.5363
 epoch: 11, train_loss: 0.9282, test_loss: 1.0414, test_f1: 0.5391
 epoch: 12, train_loss: 0.9159, test_loss: 1.0511, test_f1: 0.5134
 epoch: 13, train_loss: 0.8975, test_loss: 1.0357, test_f1: 0.5520
 epoch: 14, train_loss: 0.8880, test_loss: 1.0201, test_f1: 0.5441
 epoch: 15, train_loss: 0.9063, test_loss: 1.0055, test_f1: 0.5350
 epoch: 16, train_loss: 0.8865, test_loss: 0.9946, test_f1: 0.5636
 epoch: 17, train_loss: 0.8812, test_loss: 1.0030, test_f1: 0.5556
 epoch: 18, train_loss: 0.8624, test_loss: 0.9957, test_f1: 0.5517
 epoch: 19, train_loss: 0.8558, test_loss: 0.9899, test_f1: 0.5659
 epoch: 20, train_loss: 0.8383, test_loss: 0.9912, test_f1: 0.5614
 epoch: 21, train_loss: 0.8398, test_loss: 0.9831, test_f1: 0.5697
 epoch: 22, train_loss: 0.8251, test_loss: 0.9837, test_f1: 0.5842
 epoch: 23, train_loss: 0.8320, test_loss: 0.9649, test_f1: 0.6126
 epoch: 24, train_loss: 0.8225, test_loss: 0.9919, test_f1: 0.5755
 epoch: 25, train_loss: 0.8270, test_loss: 0.9889, test_f1: 0.6018
 epoch: 26, train_loss: 0.8077, test_loss: 0.9695, test_f1: 0.5874
 epoch: 27, train_loss: 0.8097, test_loss: 0.9647, test_f1: 0.6201
 epoch: 28, train_loss: 0.7840, test_loss: 0.9609, test_f1: 0.6188
 epoch: 29, train_loss: 0.7775, test_loss: 0.9776, test_f1: 0.6094
 epoch: 30, train_loss: 0.7809, test_loss: 0.9751, test_f1: 0.5924
 epoch: 31, train_loss: 0.7776, test_loss: 0.9849, test_f1: 0.6275
 epoch: 32, train_loss: 0.7524, test_loss: 0.9597, test_f1: 0.6165
 epoch: 33, train_loss: 0.7567, test_loss: 0.9621, test_f1: 0.6193
 epoch: 34, train_loss: 0.7517, test_loss: 0.9636, test_f1: 0.6247
 epoch: 35, train_loss: 0.7477, test_loss: 0.9686, test_f1: 0.6408
 epoch: 36, train_loss: 0.7469, test_loss: 0.9818, test_f1: 0.6192
 epoch: 37, train_loss: 0.7392, test_loss: 0.9723, test_f1: 0.6426
 epoch: 38, train_loss: 0.7283, test_loss: 0.9566, test_f1: 0.6163
 epoch: 39, train_loss: 0.7332, test_loss: 0.9706, test_f1: 0.6232
 epoch: 40, train_loss: 0.7103, test_loss: 0.9718, test_f1: 0.6304
 epoch: 41, train_loss: 0.7133, test_loss: 1.0004, test_f1: 0.6284
 epoch: 42, train_loss: 0.7073, test_loss: 0.9760, test_f1: 0.6243
 epoch: 43, train_loss: 0.6962, test_loss: 0.9659, test_f1: 0.6206
 epoch: 44, train_loss: 0.6928, test_loss: 0.9929, test_f1: 0.6046
 epoch: 45, train_loss: 0.7006, test_loss: 0.9841, test_f1: 0.6209
 epoch: 46, train_loss: 0.6778, test_loss: 0.9905, test_f1: 0.6038
 epoch: 47, train_loss: 0.6722, test_loss: 1.0163, test_f1: 0.6067
 epoch: 48, train_loss: 0.6606, test_loss: 1.0093, test_f1: 0.6229
 epoch: 49, train_loss: 0.6613, test_loss: 1.0350, test_f1: 0.6141
 epoch: 50, train_loss: 0.6675, test_loss: 1.0326, test_f1: 0.6157
 epoch: 51, train_loss: 0.6574, test_loss: 1.0210, test_f1: 0.6141
 epoch: 52, train_loss: 0.6491, test_loss: 1.0352, test_f1: 0.6290
 epoch: 53, train_loss: 0.6539, test_loss: 1.0164, test_f1: 0.6072
 epoch: 54, train_loss: 0.6329, test_loss: 1.0239, test_f1: 0.6341
 epoch: 55, train_loss: 0.6278, test_loss: 1.0458, test_f1: 0.5960
 epoch: 56, train_loss: 0.6325, test_loss: 1.0475, test_f1: 0.5967
 epoch: 57, train_loss: 0.6174, test_loss: 1.0415, test_f1: 0.6187
 epoch: 58, train_loss: 0.6203, test_loss: 1.0689, test_f1: 0.6082
 epoch: 59, train_loss: 0.6200, test_loss: 1.0612, test_f1: 0.6207
 epoch: 60, train_loss: 0.6207, test_loss: 1.0527, test_f1: 0.6184
 epoch: 61, train_loss: 0.6125, test_loss: 1.0817, test_f1: 0.6120
 epoch: 62, train_loss: 0.6173, test_loss: 1.1073, test_f1: 0.6002
 epoch: 63, train_loss: 0.6139, test_loss: 1.0982, test_f1: 0.6078
 epoch: 64, train_loss: 0.6159, test_loss: 1.1015, test_f1: 0.5976
 epoch: 65, train_loss: 0.6037, test_loss: 1.0900, test_f1: 0.6166
 epoch: 66, train_loss: 0.5877, test_loss: 1.1056, test_f1: 0.6146
 epoch: 67, train_loss: 0.5927, test_loss: 1.1234, test_f1: 0.6066
 epoch: 68, train_loss: 0.5999, test_loss: 1.1463, test_f1: 0.6082
 epoch: 69, train_loss: 0.5776, test_loss: 1.1314, test_f1: 0.6138
 epoch: 70, train_loss: 0.5955, test_loss: 1.1392, test_f1: 0.6170
 epoch: 71, train_loss: 0.5823, test_loss: 1.1461, test_f1: 0.6116
 epoch: 72, train_loss: 0.5770, test_loss: 1.1346, test_f1: 0.6101
 epoch: 73, train_loss: 0.5690, test_loss: 1.1863, test_f1: 0.6093
 epoch: 74, train_loss: 0.5847, test_loss: 1.1436, test_f1: 0.6062
 epoch: 75, train_loss: 0.5719, test_loss: 1.1767, test_f1: 0.6143
 epoch: 76, train_loss: 0.5704, test_loss: 1.1881, test_f1: 0.6091
 epoch: 77, train_loss: 0.5722, test_loss: 1.1800, test_f1: 0.6251
 epoch: 78, train_loss: 0.5705, test_loss: 1.2358, test_f1: 0.6176
 epoch: 79, train_loss: 0.5696, test_loss: 1.2385, test_f1: 0.5881
 epoch: 80, train_loss: 0.5546, test_loss: 1.2049, test_f1: 0.6188
 epoch: 81, train_loss: 0.5554, test_loss: 1.2140, test_f1: 0.6038
 epoch: 82, train_loss: 0.5407, test_loss: 1.2052, test_f1: 0.6139
 epoch: 83, train_loss: 0.5628, test_loss: 1.2367, test_f1: 0.6012
 epoch: 84, train_loss: 0.5345, test_loss: 1.2401, test_f1: 0.6070
 epoch: 85, train_loss: 0.5495, test_loss: 1.3107, test_f1: 0.6008
 epoch: 86, train_loss: 0.5511, test_loss: 1.2791, test_f1: 0.6129
 epoch: 87, train_loss: 0.5285, test_loss: 1.2681, test_f1: 0.6204
 epoch: 88, train_loss: 0.5499, test_loss: 1.3270, test_f1: 0.5875
 epoch: 89, train_loss: 0.5305, test_loss: 1.3682, test_f1: 0.6120
 epoch: 90, train_loss: 0.5280, test_loss: 1.3092, test_f1: 0.6200
 epoch: 91, train_loss: 0.5433, test_loss: 1.3609, test_f1: 0.6098
 epoch: 92, train_loss: 0.5252, test_loss: 1.3488, test_f1: 0.6123
 epoch: 93, train_loss: 0.5398, test_loss: 1.3131, test_f1: 0.6246
 epoch: 94, train_loss: 0.5089, test_loss: 1.3504, test_f1: 0.6019
 epoch: 95, train_loss: 0.5217, test_loss: 1.3805, test_f1: 0.6139
 epoch: 96, train_loss: 0.5214, test_loss: 1.3996, test_f1: 0.6120
 epoch: 97, train_loss: 0.5051, test_loss: 1.4346, test_f1: 0.6063
 epoch: 98, train_loss: 0.5045, test_loss: 1.4050, test_f1: 0.5856
 epoch: 99, train_loss: 0.5161, test_loss: 1.3956, test_f1: 0.5914
##################ITERATION #5 ****************************************
 epoch: 0, train_loss: 1.2388, test_loss: 1.2950, test_f1: 0.3131
 epoch: 1, train_loss: 1.1098, test_loss: 1.1986, test_f1: 0.3860
 epoch: 2, train_loss: 1.0690, test_loss: 1.1611, test_f1: 0.4419
 epoch: 3, train_loss: 1.0366, test_loss: 1.1419, test_f1: 0.4978
 epoch: 4, train_loss: 1.0241, test_loss: 1.1304, test_f1: 0.4681
 epoch: 5, train_loss: 0.9989, test_loss: 1.1201, test_f1: 0.4763
 epoch: 6, train_loss: 0.9701, test_loss: 1.0977, test_f1: 0.4916
 epoch: 7, train_loss: 0.9738, test_loss: 1.1112, test_f1: 0.4938
 epoch: 8, train_loss: 0.9498, test_loss: 1.0988, test_f1: 0.5021
 epoch: 9, train_loss: 0.9487, test_loss: 1.0925, test_f1: 0.5088
 epoch: 10, train_loss: 0.9262, test_loss: 1.0777, test_f1: 0.5374
 epoch: 11, train_loss: 0.9246, test_loss: 1.0811, test_f1: 0.5106
 epoch: 12, train_loss: 0.9193, test_loss: 1.0717, test_f1: 0.4928
 epoch: 13, train_loss: 0.8947, test_loss: 1.0621, test_f1: 0.5253
 epoch: 14, train_loss: 0.8948, test_loss: 1.0585, test_f1: 0.5354
 epoch: 15, train_loss: 0.8805, test_loss: 1.0503, test_f1: 0.5369
 epoch: 16, train_loss: 0.8673, test_loss: 1.0492, test_f1: 0.5523
 epoch: 17, train_loss: 0.8593, test_loss: 1.0482, test_f1: 0.5572
 epoch: 18, train_loss: 0.8535, test_loss: 1.0525, test_f1: 0.5537
 epoch: 19, train_loss: 0.8441, test_loss: 1.0354, test_f1: 0.5438
 epoch: 20, train_loss: 0.8322, test_loss: 1.0429, test_f1: 0.5532
 epoch: 21, train_loss: 0.8237, test_loss: 1.0332, test_f1: 0.5699
 epoch: 22, train_loss: 0.8190, test_loss: 1.0392, test_f1: 0.5650
 epoch: 23, train_loss: 0.8057, test_loss: 1.0250, test_f1: 0.5732
 epoch: 24, train_loss: 0.8085, test_loss: 1.0288, test_f1: 0.5777
 epoch: 25, train_loss: 0.7902, test_loss: 1.0071, test_f1: 0.5799
 epoch: 26, train_loss: 0.7828, test_loss: 1.0246, test_f1: 0.5742
 epoch: 27, train_loss: 0.7789, test_loss: 1.0237, test_f1: 0.5976
 epoch: 28, train_loss: 0.7672, test_loss: 1.0114, test_f1: 0.6280
 epoch: 29, train_loss: 0.7644, test_loss: 1.0253, test_f1: 0.5973
 epoch: 30, train_loss: 0.7694, test_loss: 1.0069, test_f1: 0.5950
 epoch: 31, train_loss: 0.7616, test_loss: 1.0126, test_f1: 0.6027
 epoch: 32, train_loss: 0.7549, test_loss: 1.0319, test_f1: 0.6128
 epoch: 33, train_loss: 0.7451, test_loss: 0.9975, test_f1: 0.6058
 epoch: 34, train_loss: 0.7443, test_loss: 1.0083, test_f1: 0.6348
 epoch: 35, train_loss: 0.7302, test_loss: 0.9991, test_f1: 0.6187
 epoch: 36, train_loss: 0.7288, test_loss: 1.0085, test_f1: 0.6187
 epoch: 37, train_loss: 0.7143, test_loss: 0.9985, test_f1: 0.6233
 epoch: 38, train_loss: 0.7198, test_loss: 1.0435, test_f1: 0.6321
 epoch: 39, train_loss: 0.6937, test_loss: 1.0271, test_f1: 0.6199
 epoch: 40, train_loss: 0.7093, test_loss: 1.0540, test_f1: 0.6232
 epoch: 41, train_loss: 0.7031, test_loss: 1.0436, test_f1: 0.6213
 epoch: 42, train_loss: 0.7012, test_loss: 1.0147, test_f1: 0.6227
 epoch: 43, train_loss: 0.6782, test_loss: 1.0298, test_f1: 0.6089
 epoch: 44, train_loss: 0.6722, test_loss: 1.0283, test_f1: 0.6371
 epoch: 45, train_loss: 0.6788, test_loss: 1.0483, test_f1: 0.6334
 epoch: 46, train_loss: 0.6767, test_loss: 1.0358, test_f1: 0.6291
 epoch: 47, train_loss: 0.6729, test_loss: 0.9907, test_f1: 0.6502
 epoch: 48, train_loss: 0.6516, test_loss: 1.0477, test_f1: 0.6222
 epoch: 49, train_loss: 0.6570, test_loss: 1.0320, test_f1: 0.6295
 epoch: 50, train_loss: 0.6427, test_loss: 1.0545, test_f1: 0.6190
 epoch: 51, train_loss: 0.6356, test_loss: 1.0679, test_f1: 0.6189
 epoch: 52, train_loss: 0.6251, test_loss: 1.0638, test_f1: 0.6304
 epoch: 53, train_loss: 0.6275, test_loss: 1.0725, test_f1: 0.6419
 epoch: 54, train_loss: 0.6177, test_loss: 1.0419, test_f1: 0.6376
 epoch: 55, train_loss: 0.6242, test_loss: 1.0681, test_f1: 0.6193
 epoch: 56, train_loss: 0.6240, test_loss: 1.0695, test_f1: 0.6229
 epoch: 57, train_loss: 0.5990, test_loss: 1.0462, test_f1: 0.6325
 epoch: 58, train_loss: 0.6155, test_loss: 1.0552, test_f1: 0.6426
 epoch: 59, train_loss: 0.5962, test_loss: 1.0655, test_f1: 0.6395
 epoch: 60, train_loss: 0.6045, test_loss: 1.0620, test_f1: 0.6375
 epoch: 61, train_loss: 0.5890, test_loss: 1.0770, test_f1: 0.6305
 epoch: 62, train_loss: 0.6089, test_loss: 1.0697, test_f1: 0.6354
 epoch: 63, train_loss: 0.5842, test_loss: 1.0671, test_f1: 0.6436
 epoch: 64, train_loss: 0.5866, test_loss: 1.0978, test_f1: 0.6198
 epoch: 65, train_loss: 0.5925, test_loss: 1.0696, test_f1: 0.6406
 epoch: 66, train_loss: 0.6003, test_loss: 1.0855, test_f1: 0.6366
 epoch: 67, train_loss: 0.5843, test_loss: 1.0861, test_f1: 0.6185
 epoch: 68, train_loss: 0.5842, test_loss: 1.0831, test_f1: 0.6353
 epoch: 69, train_loss: 0.5747, test_loss: 1.1153, test_f1: 0.6148
 epoch: 70, train_loss: 0.5903, test_loss: 1.0987, test_f1: 0.6320
 epoch: 71, train_loss: 0.5600, test_loss: 1.1106, test_f1: 0.6319
 epoch: 72, train_loss: 0.5621, test_loss: 1.1229, test_f1: 0.6252
 epoch: 73, train_loss: 0.5730, test_loss: 1.1209, test_f1: 0.6494
 epoch: 74, train_loss: 0.5754, test_loss: 1.1184, test_f1: 0.6325
 epoch: 75, train_loss: 0.5651, test_loss: 1.1462, test_f1: 0.6453
 epoch: 76, train_loss: 0.5609, test_loss: 1.1221, test_f1: 0.6385
 epoch: 77, train_loss: 0.5482, test_loss: 1.1136, test_f1: 0.6381
 epoch: 78, train_loss: 0.5443, test_loss: 1.1121, test_f1: 0.6355
 epoch: 79, train_loss: 0.5542, test_loss: 1.1197, test_f1: 0.6490
 epoch: 80, train_loss: 0.5524, test_loss: 1.1370, test_f1: 0.6372
 epoch: 81, train_loss: 0.5530, test_loss: 1.1407, test_f1: 0.6283
 epoch: 82, train_loss: 0.5306, test_loss: 1.1321, test_f1: 0.6244
 epoch: 83, train_loss: 0.5376, test_loss: 1.1147, test_f1: 0.6321
 epoch: 84, train_loss: 0.5401, test_loss: 1.1444, test_f1: 0.6353
 epoch: 85, train_loss: 0.5359, test_loss: 1.1463, test_f1: 0.6435
 epoch: 86, train_loss: 0.5380, test_loss: 1.1075, test_f1: 0.6454
 epoch: 87, train_loss: 0.5294, test_loss: 1.1523, test_f1: 0.6329
 epoch: 88, train_loss: 0.5234, test_loss: 1.1481, test_f1: 0.6422
 epoch: 89, train_loss: 0.5217, test_loss: 1.1827, test_f1: 0.6328
 epoch: 90, train_loss: 0.5232, test_loss: 1.1482, test_f1: 0.6328
 epoch: 91, train_loss: 0.5074, test_loss: 1.1512, test_f1: 0.6378
 epoch: 92, train_loss: 0.5168, test_loss: 1.1529, test_f1: 0.6480
 epoch: 93, train_loss: 0.5246, test_loss: 1.1386, test_f1: 0.6406
 epoch: 94, train_loss: 0.5260, test_loss: 1.1417, test_f1: 0.6495
 epoch: 95, train_loss: 0.5195, test_loss: 1.1607, test_f1: 0.6430
 epoch: 96, train_loss: 0.4976, test_loss: 1.1722, test_f1: 0.6379
 epoch: 97, train_loss: 0.5042, test_loss: 1.1703, test_f1: 0.6106
 epoch: 98, train_loss: 0.5099, test_loss: 1.1825, test_f1: 0.6405
 epoch: 99, train_loss: 0.4873, test_loss: 1.1626, test_f1: 0.6451
##################ITERATION #6 ****************************************
 epoch: 0, train_loss: 1.2539, test_loss: 1.2658, test_f1: 0.2585
 epoch: 1, train_loss: 1.1120, test_loss: 1.2223, test_f1: 0.3883
 epoch: 2, train_loss: 1.0718, test_loss: 1.1583, test_f1: 0.4638
 epoch: 3, train_loss: 1.0511, test_loss: 1.1221, test_f1: 0.4897
 epoch: 4, train_loss: 1.0276, test_loss: 1.1024, test_f1: 0.4998
 epoch: 5, train_loss: 1.0151, test_loss: 1.0885, test_f1: 0.4972
 epoch: 6, train_loss: 1.0006, test_loss: 1.0778, test_f1: 0.5191
 epoch: 7, train_loss: 0.9860, test_loss: 1.0723, test_f1: 0.5219
 epoch: 8, train_loss: 0.9563, test_loss: 1.0658, test_f1: 0.5290
 epoch: 9, train_loss: 0.9625, test_loss: 1.0537, test_f1: 0.5435
 epoch: 10, train_loss: 0.9425, test_loss: 1.0601, test_f1: 0.5139
 epoch: 11, train_loss: 0.9184, test_loss: 1.0439, test_f1: 0.5459
 epoch: 12, train_loss: 0.9177, test_loss: 1.0352, test_f1: 0.5499
 epoch: 13, train_loss: 0.9147, test_loss: 1.0279, test_f1: 0.5633
 epoch: 14, train_loss: 0.9041, test_loss: 1.0243, test_f1: 0.5407
 epoch: 15, train_loss: 0.8910, test_loss: 1.0188, test_f1: 0.5525
 epoch: 16, train_loss: 0.8820, test_loss: 1.0278, test_f1: 0.5722
 epoch: 17, train_loss: 0.8893, test_loss: 1.0141, test_f1: 0.5639
 epoch: 18, train_loss: 0.8687, test_loss: 1.0207, test_f1: 0.5762
 epoch: 19, train_loss: 0.8614, test_loss: 0.9971, test_f1: 0.5907
 epoch: 20, train_loss: 0.8771, test_loss: 1.0049, test_f1: 0.5928
 epoch: 21, train_loss: 0.8359, test_loss: 0.9981, test_f1: 0.5800
 epoch: 22, train_loss: 0.8458, test_loss: 0.9868, test_f1: 0.5964
 epoch: 23, train_loss: 0.8188, test_loss: 1.0076, test_f1: 0.6021
 epoch: 24, train_loss: 0.8231, test_loss: 1.0106, test_f1: 0.5899
 epoch: 25, train_loss: 0.8122, test_loss: 0.9987, test_f1: 0.6087
 epoch: 26, train_loss: 0.8146, test_loss: 1.0132, test_f1: 0.6118
 epoch: 27, train_loss: 0.8007, test_loss: 1.0153, test_f1: 0.6351
 epoch: 28, train_loss: 0.7986, test_loss: 1.0072, test_f1: 0.6042
 epoch: 29, train_loss: 0.7942, test_loss: 1.0044, test_f1: 0.6208
 epoch: 30, train_loss: 0.7778, test_loss: 1.0002, test_f1: 0.6352
 epoch: 31, train_loss: 0.7800, test_loss: 0.9887, test_f1: 0.6416
 epoch: 32, train_loss: 0.7659, test_loss: 1.0001, test_f1: 0.6203
 epoch: 33, train_loss: 0.7686, test_loss: 0.9969, test_f1: 0.6238
 epoch: 34, train_loss: 0.7663, test_loss: 1.0179, test_f1: 0.6328
 epoch: 35, train_loss: 0.7656, test_loss: 1.0119, test_f1: 0.6098
 epoch: 36, train_loss: 0.7603, test_loss: 0.9842, test_f1: 0.6175
 epoch: 37, train_loss: 0.7493, test_loss: 0.9934, test_f1: 0.6333
 epoch: 38, train_loss: 0.7379, test_loss: 0.9938, test_f1: 0.6405
 epoch: 39, train_loss: 0.7391, test_loss: 1.0234, test_f1: 0.6168
 epoch: 40, train_loss: 0.7207, test_loss: 0.9819, test_f1: 0.6092
 epoch: 41, train_loss: 0.7271, test_loss: 1.0190, test_f1: 0.6315
 epoch: 42, train_loss: 0.7225, test_loss: 1.0199, test_f1: 0.6243
 epoch: 43, train_loss: 0.7048, test_loss: 1.0159, test_f1: 0.6125
 epoch: 44, train_loss: 0.7037, test_loss: 1.0103, test_f1: 0.6329
 epoch: 45, train_loss: 0.6940, test_loss: 1.0267, test_f1: 0.6456
 epoch: 46, train_loss: 0.7082, test_loss: 1.0329, test_f1: 0.6278
 epoch: 47, train_loss: 0.6929, test_loss: 1.0053, test_f1: 0.6334
 epoch: 48, train_loss: 0.6851, test_loss: 1.0394, test_f1: 0.6331
 epoch: 49, train_loss: 0.6770, test_loss: 1.0140, test_f1: 0.6389
 epoch: 50, train_loss: 0.6950, test_loss: 1.0457, test_f1: 0.6321
 epoch: 51, train_loss: 0.6607, test_loss: 1.0442, test_f1: 0.6197
 epoch: 52, train_loss: 0.6601, test_loss: 1.0648, test_f1: 0.6339
 epoch: 53, train_loss: 0.6559, test_loss: 1.0488, test_f1: 0.6427
 epoch: 54, train_loss: 0.6514, test_loss: 1.0558, test_f1: 0.6364
 epoch: 55, train_loss: 0.6487, test_loss: 1.0597, test_f1: 0.6218
 epoch: 56, train_loss: 0.6560, test_loss: 1.0409, test_f1: 0.6371
 epoch: 57, train_loss: 0.6474, test_loss: 1.0311, test_f1: 0.6446
 epoch: 58, train_loss: 0.6349, test_loss: 1.0419, test_f1: 0.6394
 epoch: 59, train_loss: 0.6298, test_loss: 1.0614, test_f1: 0.6223
 epoch: 60, train_loss: 0.6383, test_loss: 1.0359, test_f1: 0.6398
 epoch: 61, train_loss: 0.6285, test_loss: 1.0532, test_f1: 0.6321
 epoch: 62, train_loss: 0.6349, test_loss: 1.0658, test_f1: 0.6209
 epoch: 63, train_loss: 0.6260, test_loss: 1.0758, test_f1: 0.6320
 epoch: 64, train_loss: 0.6161, test_loss: 1.0856, test_f1: 0.6397
 epoch: 65, train_loss: 0.6055, test_loss: 1.0669, test_f1: 0.6283
 epoch: 66, train_loss: 0.6157, test_loss: 1.0859, test_f1: 0.6323
 epoch: 67, train_loss: 0.6117, test_loss: 1.0895, test_f1: 0.6237
 epoch: 68, train_loss: 0.6243, test_loss: 1.0892, test_f1: 0.6218
 epoch: 69, train_loss: 0.5946, test_loss: 1.0768, test_f1: 0.6267
 epoch: 70, train_loss: 0.6047, test_loss: 1.1038, test_f1: 0.6317
 epoch: 71, train_loss: 0.6017, test_loss: 1.0890, test_f1: 0.6248
 epoch: 72, train_loss: 0.6088, test_loss: 1.1062, test_f1: 0.6340
 epoch: 73, train_loss: 0.6001, test_loss: 1.0982, test_f1: 0.6513
 epoch: 74, train_loss: 0.5919, test_loss: 1.1331, test_f1: 0.6317
 epoch: 75, train_loss: 0.5915, test_loss: 1.1032, test_f1: 0.6352
 epoch: 76, train_loss: 0.5995, test_loss: 1.1348, test_f1: 0.5978
 epoch: 77, train_loss: 0.5814, test_loss: 1.1216, test_f1: 0.6485
 epoch: 78, train_loss: 0.5782, test_loss: 1.1040, test_f1: 0.6268
 epoch: 79, train_loss: 0.5738, test_loss: 1.1235, test_f1: 0.6321
 epoch: 80, train_loss: 0.5683, test_loss: 1.1292, test_f1: 0.6121
 epoch: 81, train_loss: 0.5692, test_loss: 1.1163, test_f1: 0.6330
 epoch: 82, train_loss: 0.5787, test_loss: 1.1223, test_f1: 0.6354
 epoch: 83, train_loss: 0.5778, test_loss: 1.1358, test_f1: 0.6458
 epoch: 84, train_loss: 0.5516, test_loss: 1.1384, test_f1: 0.6163
 epoch: 85, train_loss: 0.5766, test_loss: 1.1490, test_f1: 0.6071
 epoch: 86, train_loss: 0.5407, test_loss: 1.1519, test_f1: 0.6268
 epoch: 87, train_loss: 0.5565, test_loss: 1.1832, test_f1: 0.6152
 epoch: 88, train_loss: 0.5589, test_loss: 1.1738, test_f1: 0.6349
 epoch: 89, train_loss: 0.5431, test_loss: 1.1676, test_f1: 0.6241
 epoch: 90, train_loss: 0.5600, test_loss: 1.1583, test_f1: 0.6264
 epoch: 91, train_loss: 0.5500, test_loss: 1.1623, test_f1: 0.6374
 epoch: 92, train_loss: 0.5379, test_loss: 1.2124, test_f1: 0.6006
 epoch: 93, train_loss: 0.5496, test_loss: 1.1527, test_f1: 0.6363
 epoch: 94, train_loss: 0.5455, test_loss: 1.2140, test_f1: 0.6234
 epoch: 95, train_loss: 0.5494, test_loss: 1.1946, test_f1: 0.6214
 epoch: 96, train_loss: 0.5384, test_loss: 1.1800, test_f1: 0.6218
 epoch: 97, train_loss: 0.5313, test_loss: 1.2049, test_f1: 0.6303
 epoch: 98, train_loss: 0.5242, test_loss: 1.2046, test_f1: 0.6159
 epoch: 99, train_loss: 0.5243, test_loss: 1.2279, test_f1: 0.6034
##################ITERATION #7 ****************************************
 epoch: 0, train_loss: 1.2227, test_loss: 1.2727, test_f1: 0.1671
 epoch: 1, train_loss: 1.1102, test_loss: 1.1902, test_f1: 0.4145
 epoch: 2, train_loss: 1.0672, test_loss: 1.1280, test_f1: 0.4786
 epoch: 3, train_loss: 1.0601, test_loss: 1.1110, test_f1: 0.5018
 epoch: 4, train_loss: 1.0241, test_loss: 1.0991, test_f1: 0.5178
 epoch: 5, train_loss: 1.0061, test_loss: 1.1090, test_f1: 0.5260
 epoch: 6, train_loss: 0.9914, test_loss: 1.0866, test_f1: 0.5312
 epoch: 7, train_loss: 0.9717, test_loss: 1.0650, test_f1: 0.5414
 epoch: 8, train_loss: 0.9604, test_loss: 1.0634, test_f1: 0.5407
 epoch: 9, train_loss: 0.9367, test_loss: 1.0631, test_f1: 0.5179
 epoch: 10, train_loss: 0.9389, test_loss: 1.0561, test_f1: 0.5406
 epoch: 11, train_loss: 0.9209, test_loss: 1.0646, test_f1: 0.5243
 epoch: 12, train_loss: 0.9078, test_loss: 1.0508, test_f1: 0.5107
 epoch: 13, train_loss: 0.8928, test_loss: 1.0533, test_f1: 0.5215
 epoch: 14, train_loss: 0.8823, test_loss: 1.0516, test_f1: 0.5297
 epoch: 15, train_loss: 0.8872, test_loss: 1.0420, test_f1: 0.5142
 epoch: 16, train_loss: 0.8700, test_loss: 1.0220, test_f1: 0.5245
 epoch: 17, train_loss: 0.8564, test_loss: 1.0340, test_f1: 0.5386
 epoch: 18, train_loss: 0.8585, test_loss: 1.0378, test_f1: 0.5260
 epoch: 19, train_loss: 0.8615, test_loss: 1.0326, test_f1: 0.5575
 epoch: 20, train_loss: 0.8327, test_loss: 1.0418, test_f1: 0.5417
 epoch: 21, train_loss: 0.8302, test_loss: 1.0537, test_f1: 0.5392
 epoch: 22, train_loss: 0.8337, test_loss: 1.0282, test_f1: 0.5621
 epoch: 23, train_loss: 0.8253, test_loss: 1.0279, test_f1: 0.5651
 epoch: 24, train_loss: 0.8249, test_loss: 1.0455, test_f1: 0.5716
 epoch: 25, train_loss: 0.8101, test_loss: 1.0516, test_f1: 0.5747
 epoch: 26, train_loss: 0.8087, test_loss: 1.0416, test_f1: 0.5736
 epoch: 27, train_loss: 0.7972, test_loss: 1.0511, test_f1: 0.5626
 epoch: 28, train_loss: 0.8043, test_loss: 1.0678, test_f1: 0.5791
 epoch: 29, train_loss: 0.7812, test_loss: 1.0580, test_f1: 0.5872
 epoch: 30, train_loss: 0.7940, test_loss: 1.0975, test_f1: 0.5906
 epoch: 31, train_loss: 0.7743, test_loss: 1.0455, test_f1: 0.5922
 epoch: 32, train_loss: 0.7747, test_loss: 1.0662, test_f1: 0.5725
 epoch: 33, train_loss: 0.7640, test_loss: 1.0852, test_f1: 0.5370
 epoch: 34, train_loss: 0.7580, test_loss: 1.0855, test_f1: 0.5831
 epoch: 35, train_loss: 0.7458, test_loss: 1.1016, test_f1: 0.5973
 epoch: 36, train_loss: 0.7547, test_loss: 1.0589, test_f1: 0.6112
 epoch: 37, train_loss: 0.7437, test_loss: 1.0782, test_f1: 0.6030
 epoch: 38, train_loss: 0.7498, test_loss: 1.0662, test_f1: 0.5957
 epoch: 39, train_loss: 0.7356, test_loss: 1.1145, test_f1: 0.5811
 epoch: 40, train_loss: 0.7229, test_loss: 1.0734, test_f1: 0.5940
 epoch: 41, train_loss: 0.7130, test_loss: 1.0640, test_f1: 0.6086
 epoch: 42, train_loss: 0.7120, test_loss: 1.0789, test_f1: 0.5703
 epoch: 43, train_loss: 0.6960, test_loss: 1.0750, test_f1: 0.5969
 epoch: 44, train_loss: 0.6910, test_loss: 1.0764, test_f1: 0.6047
 epoch: 45, train_loss: 0.6906, test_loss: 1.1055, test_f1: 0.5994
 epoch: 46, train_loss: 0.7028, test_loss: 1.0939, test_f1: 0.6064
 epoch: 47, train_loss: 0.7036, test_loss: 1.1169, test_f1: 0.5784
 epoch: 48, train_loss: 0.6730, test_loss: 1.1548, test_f1: 0.5958
 epoch: 49, train_loss: 0.6766, test_loss: 1.1278, test_f1: 0.5979
 epoch: 50, train_loss: 0.6584, test_loss: 1.1090, test_f1: 0.5801
 epoch: 51, train_loss: 0.6536, test_loss: 1.1175, test_f1: 0.5888
 epoch: 52, train_loss: 0.6457, test_loss: 1.1444, test_f1: 0.6012
 epoch: 53, train_loss: 0.6420, test_loss: 1.1223, test_f1: 0.5840
 epoch: 54, train_loss: 0.6561, test_loss: 1.1336, test_f1: 0.5941
 epoch: 55, train_loss: 0.6431, test_loss: 1.1599, test_f1: 0.5764
 epoch: 56, train_loss: 0.6359, test_loss: 1.1413, test_f1: 0.5981
 epoch: 57, train_loss: 0.6315, test_loss: 1.1565, test_f1: 0.5939
 epoch: 58, train_loss: 0.6283, test_loss: 1.1435, test_f1: 0.5904
 epoch: 59, train_loss: 0.6078, test_loss: 1.1305, test_f1: 0.6020
 epoch: 60, train_loss: 0.6076, test_loss: 1.1392, test_f1: 0.5915
 epoch: 61, train_loss: 0.6313, test_loss: 1.1552, test_f1: 0.5749
 epoch: 62, train_loss: 0.5965, test_loss: 1.1642, test_f1: 0.5896
 epoch: 63, train_loss: 0.6156, test_loss: 1.1501, test_f1: 0.5986
 epoch: 64, train_loss: 0.5905, test_loss: 1.1522, test_f1: 0.5970
 epoch: 65, train_loss: 0.5955, test_loss: 1.1790, test_f1: 0.6035
 epoch: 66, train_loss: 0.6009, test_loss: 1.1632, test_f1: 0.6064
 epoch: 67, train_loss: 0.5973, test_loss: 1.1996, test_f1: 0.5990
 epoch: 68, train_loss: 0.5941, test_loss: 1.1884, test_f1: 0.6043
 epoch: 69, train_loss: 0.5883, test_loss: 1.1720, test_f1: 0.6068
 epoch: 70, train_loss: 0.5899, test_loss: 1.1844, test_f1: 0.6030
 epoch: 71, train_loss: 0.5951, test_loss: 1.1856, test_f1: 0.5958
 epoch: 72, train_loss: 0.5878, test_loss: 1.1923, test_f1: 0.6039
 epoch: 73, train_loss: 0.5952, test_loss: 1.1784, test_f1: 0.5921
 epoch: 74, train_loss: 0.5826, test_loss: 1.1793, test_f1: 0.6124
 epoch: 75, train_loss: 0.5987, test_loss: 1.1663, test_f1: 0.6221
 epoch: 76, train_loss: 0.5791, test_loss: 1.2091, test_f1: 0.6114
 epoch: 77, train_loss: 0.5668, test_loss: 1.2085, test_f1: 0.6198
 epoch: 78, train_loss: 0.5798, test_loss: 1.2205, test_f1: 0.6046
 epoch: 79, train_loss: 0.5574, test_loss: 1.2408, test_f1: 0.6168
 epoch: 80, train_loss: 0.5619, test_loss: 1.2304, test_f1: 0.6162
 epoch: 81, train_loss: 0.5494, test_loss: 1.2238, test_f1: 0.6229
 epoch: 82, train_loss: 0.5575, test_loss: 1.2252, test_f1: 0.6121
 epoch: 83, train_loss: 0.5469, test_loss: 1.2643, test_f1: 0.5988
 epoch: 84, train_loss: 0.5446, test_loss: 1.2505, test_f1: 0.6002
 epoch: 85, train_loss: 0.5362, test_loss: 1.2210, test_f1: 0.5918
 epoch: 86, train_loss: 0.5505, test_loss: 1.2293, test_f1: 0.5973
 epoch: 87, train_loss: 0.5464, test_loss: 1.2530, test_f1: 0.6338
 epoch: 88, train_loss: 0.5405, test_loss: 1.2383, test_f1: 0.6190
 epoch: 89, train_loss: 0.5385, test_loss: 1.2746, test_f1: 0.6102
 epoch: 90, train_loss: 0.5324, test_loss: 1.2444, test_f1: 0.6246
 epoch: 91, train_loss: 0.5306, test_loss: 1.2346, test_f1: 0.6055
 epoch: 92, train_loss: 0.5305, test_loss: 1.2477, test_f1: 0.6136
 epoch: 93, train_loss: 0.5174, test_loss: 1.2791, test_f1: 0.6206
 epoch: 94, train_loss: 0.5314, test_loss: 1.2637, test_f1: 0.6176
 epoch: 95, train_loss: 0.5234, test_loss: 1.2507, test_f1: 0.6295
 epoch: 96, train_loss: 0.5169, test_loss: 1.2879, test_f1: 0.6081
 epoch: 97, train_loss: 0.4956, test_loss: 1.2901, test_f1: 0.6038
 epoch: 98, train_loss: 0.5101, test_loss: 1.2918, test_f1: 0.5959
 epoch: 99, train_loss: 0.5075, test_loss: 1.3041, test_f1: 0.6064
##################ITERATION #8 ****************************************
 epoch: 0, train_loss: 1.2539, test_loss: 1.2495, test_f1: 0.3087
 epoch: 1, train_loss: 1.1137, test_loss: 1.1876, test_f1: 0.4448
 epoch: 2, train_loss: 1.0822, test_loss: 1.1183, test_f1: 0.4865
 epoch: 3, train_loss: 1.0663, test_loss: 1.1036, test_f1: 0.4929
 epoch: 4, train_loss: 1.0143, test_loss: 1.0839, test_f1: 0.5199
 epoch: 5, train_loss: 0.9913, test_loss: 1.0789, test_f1: 0.5196
 epoch: 6, train_loss: 0.9908, test_loss: 1.0686, test_f1: 0.5150
 epoch: 7, train_loss: 0.9809, test_loss: 1.0671, test_f1: 0.5255
 epoch: 8, train_loss: 0.9419, test_loss: 1.0577, test_f1: 0.5434
 epoch: 9, train_loss: 0.9616, test_loss: 1.0550, test_f1: 0.5285
 epoch: 10, train_loss: 0.9462, test_loss: 1.0400, test_f1: 0.5274
 epoch: 11, train_loss: 0.9184, test_loss: 1.0434, test_f1: 0.5347
 epoch: 12, train_loss: 0.9031, test_loss: 1.0345, test_f1: 0.5480
 epoch: 13, train_loss: 0.9138, test_loss: 1.0386, test_f1: 0.5535
 epoch: 14, train_loss: 0.8881, test_loss: 1.0381, test_f1: 0.5357
 epoch: 15, train_loss: 0.8789, test_loss: 1.0473, test_f1: 0.5528
 epoch: 16, train_loss: 0.8817, test_loss: 1.0434, test_f1: 0.5495
 epoch: 17, train_loss: 0.8639, test_loss: 1.0284, test_f1: 0.5766
 epoch: 18, train_loss: 0.8492, test_loss: 1.0410, test_f1: 0.5652
 epoch: 19, train_loss: 0.8464, test_loss: 1.0398, test_f1: 0.5801
 epoch: 20, train_loss: 0.8469, test_loss: 1.0275, test_f1: 0.5819
 epoch: 21, train_loss: 0.8368, test_loss: 1.0502, test_f1: 0.5819
 epoch: 22, train_loss: 0.8287, test_loss: 1.0412, test_f1: 0.5901
 epoch: 23, train_loss: 0.8078, test_loss: 1.0238, test_f1: 0.6006
 epoch: 24, train_loss: 0.8141, test_loss: 1.0281, test_f1: 0.6075
 epoch: 25, train_loss: 0.8068, test_loss: 1.0317, test_f1: 0.5969
 epoch: 26, train_loss: 0.8081, test_loss: 1.0304, test_f1: 0.6094
 epoch: 27, train_loss: 0.7838, test_loss: 1.0286, test_f1: 0.6105
 epoch: 28, train_loss: 0.7884, test_loss: 1.0587, test_f1: 0.5915
 epoch: 29, train_loss: 0.7924, test_loss: 1.0248, test_f1: 0.6013
 epoch: 30, train_loss: 0.7751, test_loss: 1.0451, test_f1: 0.6064
 epoch: 31, train_loss: 0.7652, test_loss: 1.0398, test_f1: 0.6037
 epoch: 32, train_loss: 0.7616, test_loss: 1.0410, test_f1: 0.6055
 epoch: 33, train_loss: 0.7621, test_loss: 1.0114, test_f1: 0.6353
 epoch: 34, train_loss: 0.7450, test_loss: 1.0258, test_f1: 0.6312
 epoch: 35, train_loss: 0.7342, test_loss: 1.0288, test_f1: 0.6356
 epoch: 36, train_loss: 0.7259, test_loss: 1.0554, test_f1: 0.6077
 epoch: 37, train_loss: 0.7514, test_loss: 1.0362, test_f1: 0.6185
 epoch: 38, train_loss: 0.7308, test_loss: 1.0523, test_f1: 0.6435
 epoch: 39, train_loss: 0.7178, test_loss: 1.0527, test_f1: 0.6255
 epoch: 40, train_loss: 0.6895, test_loss: 1.0505, test_f1: 0.6146
 epoch: 41, train_loss: 0.7274, test_loss: 1.0567, test_f1: 0.6265
 epoch: 42, train_loss: 0.7166, test_loss: 1.0684, test_f1: 0.6351
 epoch: 43, train_loss: 0.6982, test_loss: 1.0745, test_f1: 0.6241
 epoch: 44, train_loss: 0.6864, test_loss: 1.0716, test_f1: 0.6275
 epoch: 45, train_loss: 0.6829, test_loss: 1.0810, test_f1: 0.6432
 epoch: 46, train_loss: 0.6844, test_loss: 1.0560, test_f1: 0.6062
 epoch: 47, train_loss: 0.6779, test_loss: 1.0920, test_f1: 0.6292
 epoch: 48, train_loss: 0.6659, test_loss: 1.0671, test_f1: 0.6562
 epoch: 49, train_loss: 0.6566, test_loss: 1.0763, test_f1: 0.6452
 epoch: 50, train_loss: 0.6526, test_loss: 1.0873, test_f1: 0.6512
 epoch: 51, train_loss: 0.6443, test_loss: 1.0863, test_f1: 0.6394
 epoch: 52, train_loss: 0.6399, test_loss: 1.0896, test_f1: 0.6439
 epoch: 53, train_loss: 0.6266, test_loss: 1.0920, test_f1: 0.6456
 epoch: 54, train_loss: 0.6229, test_loss: 1.1057, test_f1: 0.6432
 epoch: 55, train_loss: 0.6367, test_loss: 1.0931, test_f1: 0.6485
 epoch: 56, train_loss: 0.6339, test_loss: 1.0887, test_f1: 0.6458
 epoch: 57, train_loss: 0.6232, test_loss: 1.1082, test_f1: 0.6300
 epoch: 58, train_loss: 0.6316, test_loss: 1.1100, test_f1: 0.6246
 epoch: 59, train_loss: 0.6115, test_loss: 1.1143, test_f1: 0.6407
 epoch: 60, train_loss: 0.6123, test_loss: 1.1032, test_f1: 0.6503
 epoch: 61, train_loss: 0.6276, test_loss: 1.1167, test_f1: 0.6176
 epoch: 62, train_loss: 0.5923, test_loss: 1.1195, test_f1: 0.6344
 epoch: 63, train_loss: 0.6239, test_loss: 1.1349, test_f1: 0.6405
 epoch: 64, train_loss: 0.5964, test_loss: 1.1111, test_f1: 0.6530
 epoch: 65, train_loss: 0.5912, test_loss: 1.1361, test_f1: 0.6354
 epoch: 66, train_loss: 0.5876, test_loss: 1.1431, test_f1: 0.6322
 epoch: 67, train_loss: 0.5810, test_loss: 1.1474, test_f1: 0.6471
 epoch: 68, train_loss: 0.5902, test_loss: 1.1435, test_f1: 0.6442
 epoch: 69, train_loss: 0.5724, test_loss: 1.1606, test_f1: 0.6457
 epoch: 70, train_loss: 0.5599, test_loss: 1.1640, test_f1: 0.6310
 epoch: 71, train_loss: 0.5775, test_loss: 1.1608, test_f1: 0.6321
 epoch: 72, train_loss: 0.5755, test_loss: 1.1824, test_f1: 0.6251
 epoch: 73, train_loss: 0.5651, test_loss: 1.1778, test_f1: 0.6311
 epoch: 74, train_loss: 0.5665, test_loss: 1.1716, test_f1: 0.6513
 epoch: 75, train_loss: 0.5786, test_loss: 1.2034, test_f1: 0.6238
 epoch: 76, train_loss: 0.5706, test_loss: 1.1778, test_f1: 0.6512
 epoch: 77, train_loss: 0.5583, test_loss: 1.2388, test_f1: 0.6078
 epoch: 78, train_loss: 0.5517, test_loss: 1.2151, test_f1: 0.6327
 epoch: 79, train_loss: 0.5509, test_loss: 1.1703, test_f1: 0.6356
 epoch: 80, train_loss: 0.5334, test_loss: 1.2230, test_f1: 0.5964
 epoch: 81, train_loss: 0.5451, test_loss: 1.2110, test_f1: 0.6488
 epoch: 82, train_loss: 0.5404, test_loss: 1.1869, test_f1: 0.6170
 epoch: 83, train_loss: 0.5195, test_loss: 1.2013, test_f1: 0.6176
 epoch: 84, train_loss: 0.5439, test_loss: 1.2261, test_f1: 0.6298
 epoch: 85, train_loss: 0.5510, test_loss: 1.2729, test_f1: 0.6244
 epoch: 86, train_loss: 0.5369, test_loss: 1.2151, test_f1: 0.6408
 epoch: 87, train_loss: 0.5344, test_loss: 1.2429, test_f1: 0.6200
 epoch: 88, train_loss: 0.5295, test_loss: 1.2322, test_f1: 0.6408
 epoch: 89, train_loss: 0.5279, test_loss: 1.2637, test_f1: 0.6029
 epoch: 90, train_loss: 0.5115, test_loss: 1.2568, test_f1: 0.6193
 epoch: 91, train_loss: 0.5012, test_loss: 1.2547, test_f1: 0.6176
 epoch: 92, train_loss: 0.5093, test_loss: 1.2529, test_f1: 0.6306
 epoch: 93, train_loss: 0.5172, test_loss: 1.2636, test_f1: 0.6174
 epoch: 94, train_loss: 0.5254, test_loss: 1.2428, test_f1: 0.6461
 epoch: 95, train_loss: 0.5268, test_loss: 1.2278, test_f1: 0.6346
 epoch: 96, train_loss: 0.5204, test_loss: 1.2636, test_f1: 0.6225
 epoch: 97, train_loss: 0.5012, test_loss: 1.2560, test_f1: 0.6450
 epoch: 98, train_loss: 0.4922, test_loss: 1.2607, test_f1: 0.6284
 epoch: 99, train_loss: 0.4924, test_loss: 1.2385, test_f1: 0.6405
##################ITERATION #9 ****************************************
 epoch: 0, train_loss: 1.3107, test_loss: 1.3593, test_f1: 0.1365
 epoch: 1, train_loss: 1.1479, test_loss: 1.1773, test_f1: 0.4251
 epoch: 2, train_loss: 1.0793, test_loss: 1.1177, test_f1: 0.5007
 epoch: 3, train_loss: 1.0726, test_loss: 1.1283, test_f1: 0.4662
 epoch: 4, train_loss: 1.0422, test_loss: 1.1227, test_f1: 0.4562
 epoch: 5, train_loss: 1.0293, test_loss: 1.1175, test_f1: 0.4593
 epoch: 6, train_loss: 0.9988, test_loss: 1.1272, test_f1: 0.4671
 epoch: 7, train_loss: 0.9794, test_loss: 1.1486, test_f1: 0.4833
 epoch: 8, train_loss: 0.9710, test_loss: 1.1301, test_f1: 0.4643
 epoch: 9, train_loss: 0.9582, test_loss: 1.1141, test_f1: 0.4866
 epoch: 10, train_loss: 0.9539, test_loss: 1.1166, test_f1: 0.4962
 epoch: 11, train_loss: 0.9332, test_loss: 1.1178, test_f1: 0.4901
 epoch: 12, train_loss: 0.9137, test_loss: 1.1278, test_f1: 0.5204
 epoch: 13, train_loss: 0.8892, test_loss: 1.1323, test_f1: 0.5033
 epoch: 14, train_loss: 0.8918, test_loss: 1.1267, test_f1: 0.5106
 epoch: 15, train_loss: 0.8864, test_loss: 1.1283, test_f1: 0.5127
 epoch: 16, train_loss: 0.8757, test_loss: 1.1217, test_f1: 0.5330
 epoch: 17, train_loss: 0.8593, test_loss: 1.1215, test_f1: 0.5706
 epoch: 18, train_loss: 0.8676, test_loss: 1.1280, test_f1: 0.5315
 epoch: 19, train_loss: 0.8582, test_loss: 1.1197, test_f1: 0.5553
 epoch: 20, train_loss: 0.8438, test_loss: 1.1030, test_f1: 0.5756
 epoch: 21, train_loss: 0.8484, test_loss: 1.1129, test_f1: 0.5847
 epoch: 22, train_loss: 0.8214, test_loss: 1.0817, test_f1: 0.5583
 epoch: 23, train_loss: 0.8180, test_loss: 1.0878, test_f1: 0.5859
 epoch: 24, train_loss: 0.8078, test_loss: 1.1218, test_f1: 0.5880
 epoch: 25, train_loss: 0.8110, test_loss: 1.1415, test_f1: 0.5765
 epoch: 26, train_loss: 0.8059, test_loss: 1.1308, test_f1: 0.5929
 epoch: 27, train_loss: 0.7940, test_loss: 1.1328, test_f1: 0.5739
 epoch: 28, train_loss: 0.7866, test_loss: 1.1243, test_f1: 0.5906
 epoch: 29, train_loss: 0.7863, test_loss: 1.1379, test_f1: 0.5777
 epoch: 30, train_loss: 0.7853, test_loss: 1.1445, test_f1: 0.5985
 epoch: 31, train_loss: 0.7568, test_loss: 1.1407, test_f1: 0.5980
 epoch: 32, train_loss: 0.7754, test_loss: 1.1300, test_f1: 0.6139
 epoch: 33, train_loss: 0.7754, test_loss: 1.1258, test_f1: 0.6173
 epoch: 34, train_loss: 0.7515, test_loss: 1.1597, test_f1: 0.6026
 epoch: 35, train_loss: 0.7555, test_loss: 1.2070, test_f1: 0.5792
 epoch: 36, train_loss: 0.7344, test_loss: 1.1711, test_f1: 0.6243
 epoch: 37, train_loss: 0.7244, test_loss: 1.1446, test_f1: 0.6212
 epoch: 38, train_loss: 0.7391, test_loss: 1.1489, test_f1: 0.6163
 epoch: 39, train_loss: 0.7174, test_loss: 1.1633, test_f1: 0.5972
 epoch: 40, train_loss: 0.7211, test_loss: 1.1413, test_f1: 0.6093
 epoch: 41, train_loss: 0.7151, test_loss: 1.1886, test_f1: 0.6232
 epoch: 42, train_loss: 0.6910, test_loss: 1.1428, test_f1: 0.5935
 epoch: 43, train_loss: 0.7115, test_loss: 1.1198, test_f1: 0.6190
 epoch: 44, train_loss: 0.7009, test_loss: 1.1638, test_f1: 0.5967
 epoch: 45, train_loss: 0.6867, test_loss: 1.1339, test_f1: 0.6330
 epoch: 46, train_loss: 0.6910, test_loss: 1.1626, test_f1: 0.6112
 epoch: 47, train_loss: 0.6709, test_loss: 1.1534, test_f1: 0.6131
 epoch: 48, train_loss: 0.6614, test_loss: 1.1406, test_f1: 0.6241
 epoch: 49, train_loss: 0.6715, test_loss: 1.1958, test_f1: 0.6105
 epoch: 50, train_loss: 0.6730, test_loss: 1.1543, test_f1: 0.6366
 epoch: 51, train_loss: 0.6481, test_loss: 1.1489, test_f1: 0.6208
 epoch: 52, train_loss: 0.6557, test_loss: 1.1461, test_f1: 0.6175
 epoch: 53, train_loss: 0.6509, test_loss: 1.1369, test_f1: 0.6175
 epoch: 54, train_loss: 0.6535, test_loss: 1.1537, test_f1: 0.6136
 epoch: 55, train_loss: 0.6319, test_loss: 1.1521, test_f1: 0.6003
 epoch: 56, train_loss: 0.6325, test_loss: 1.1853, test_f1: 0.6133
 epoch: 57, train_loss: 0.6231, test_loss: 1.1889, test_f1: 0.5935
 epoch: 58, train_loss: 0.6293, test_loss: 1.1987, test_f1: 0.6262
 epoch: 59, train_loss: 0.6269, test_loss: 1.1892, test_f1: 0.5965
 epoch: 60, train_loss: 0.6077, test_loss: 1.2055, test_f1: 0.5969
 epoch: 61, train_loss: 0.6104, test_loss: 1.1833, test_f1: 0.6058
 epoch: 62, train_loss: 0.6306, test_loss: 1.2071, test_f1: 0.5967
 epoch: 63, train_loss: 0.6267, test_loss: 1.1941, test_f1: 0.6112
 epoch: 64, train_loss: 0.6066, test_loss: 1.1904, test_f1: 0.6152
 epoch: 65, train_loss: 0.6077, test_loss: 1.1983, test_f1: 0.5993
 epoch: 66, train_loss: 0.6064, test_loss: 1.2139, test_f1: 0.5915
 epoch: 67, train_loss: 0.6040, test_loss: 1.1926, test_f1: 0.5973
 epoch: 68, train_loss: 0.5892, test_loss: 1.2042, test_f1: 0.5890
 epoch: 69, train_loss: 0.5992, test_loss: 1.2290, test_f1: 0.5927
 epoch: 70, train_loss: 0.5909, test_loss: 1.2052, test_f1: 0.6060
 epoch: 71, train_loss: 0.5993, test_loss: 1.2128, test_f1: 0.5950
 epoch: 72, train_loss: 0.5982, test_loss: 1.2037, test_f1: 0.5944
 epoch: 73, train_loss: 0.5760, test_loss: 1.2096, test_f1: 0.5971
 epoch: 74, train_loss: 0.5887, test_loss: 1.2163, test_f1: 0.5968
 epoch: 75, train_loss: 0.5724, test_loss: 1.2106, test_f1: 0.6027
 epoch: 76, train_loss: 0.5631, test_loss: 1.2182, test_f1: 0.5973
 epoch: 77, train_loss: 0.5667, test_loss: 1.2039, test_f1: 0.6026
 epoch: 78, train_loss: 0.5739, test_loss: 1.2218, test_f1: 0.6002
 epoch: 79, train_loss: 0.5613, test_loss: 1.2077, test_f1: 0.6075
 epoch: 80, train_loss: 0.5638, test_loss: 1.2346, test_f1: 0.6103
 epoch: 81, train_loss: 0.5706, test_loss: 1.2142, test_f1: 0.6102
 epoch: 82, train_loss: 0.5514, test_loss: 1.2169, test_f1: 0.5937
 epoch: 83, train_loss: 0.5701, test_loss: 1.2247, test_f1: 0.6105
 epoch: 84, train_loss: 0.5376, test_loss: 1.2394, test_f1: 0.6000
 epoch: 85, train_loss: 0.5461, test_loss: 1.2192, test_f1: 0.6163
 epoch: 86, train_loss: 0.5685, test_loss: 1.2339, test_f1: 0.6132
 epoch: 87, train_loss: 0.5435, test_loss: 1.2407, test_f1: 0.6134
 epoch: 88, train_loss: 0.5510, test_loss: 1.2414, test_f1: 0.6293
 epoch: 89, train_loss: 0.5522, test_loss: 1.2529, test_f1: 0.6106
 epoch: 90, train_loss: 0.5366, test_loss: 1.2499, test_f1: 0.6050
 epoch: 91, train_loss: 0.5339, test_loss: 1.2284, test_f1: 0.6134
 epoch: 92, train_loss: 0.5278, test_loss: 1.2294, test_f1: 0.6079
 epoch: 93, train_loss: 0.5424, test_loss: 1.2390, test_f1: 0.6130
 epoch: 94, train_loss: 0.5302, test_loss: 1.2812, test_f1: 0.6133
 epoch: 95, train_loss: 0.5395, test_loss: 1.2685, test_f1: 0.6081
 epoch: 96, train_loss: 0.5393, test_loss: 1.2446, test_f1: 0.6102
 epoch: 97, train_loss: 0.5164, test_loss: 1.2809, test_f1: 0.6156
 epoch: 98, train_loss: 0.5153, test_loss: 1.3057, test_f1: 0.6077
 epoch: 99, train_loss: 0.5141, test_loss: 1.2774, test_f1: 0.6101

Training completed in 527.59 seconds
Best F1: 0.6562 at epoch 48
Mean F1 across iterations: 0.6371  0.0151
========================FINAL RESULTS================================
FEGIN weighted F1: 0.6562  0.0151
python main.py --data ltspice_demos --representation component_net --model FEGIN --layers 2 --hiddens 128 --batch_size 64 --lr 0.0001 --emb_size 128 --epochs 100 --save_appendix component_net_L2_H128_BS64_LR0.0001_E128 --no_val
-----



STDERR:
  File "main.py", line 370, in <module>
    main()
  File "main.py", line 254, in main
    dataset = dataset_class(
  File "/home/philip/projects/ltspice_examples_code_repo/Circuit-Completion-Using-GNNs/component_classification_with_link_prediction_head/evaluation/FEGIN/kernel/circuit_datasets.py", line 15, in __init__
    self.data, self.slices = torch.load(self.processed_paths[0])
  File "/home/philip/.local/lib/python3.8/site-packages/torch/serialization.py", line 1040, in load
    warnings.warn(
  File "/usr/lib/python3.8/warnings.py", line 109, in _showwarnmsg
    sw(msg.message, msg.category, msg.filename, msg.lineno,
  File "main.py", line 47, in warn_with_traceback
    traceback.print_stack(file=log)
/home/philip/projects/ltspice_examples_code_repo/Circuit-Completion-Using-GNNs/component_classification_with_link_prediction_head/evaluation/FEGIN/kernel/circuit_datasets.py:15: FutureWarning: You are using `torch.load` with `weights_only=False` (the current default value), which uses the default pickle module implicitly. It is possible to construct malicious pickle data which will execute arbitrary code during unpickling (See https://github.com/pytorch/pytorch/blob/main/SECURITY.md#untrusted-models for more details). In a future release, the default value for `weights_only` will be flipped to `True`. This limits the functions that could be executed during unpickling. Arbitrary objects will no longer be allowed to be loaded via this mode unless they are explicitly allowlisted by the user via `torch.serialization.add_safe_globals`. We recommend you start setting `weights_only=True` for any use case where you don't have full control of the loaded file. Please open an issue on GitHub for any issues related to this experimental feature.
  self.data, self.slices = torch.load(self.processed_paths[0])
