STDOUT:
Results will be saved in /home/philip/projects/ltspice_examples_code_repo/Circuit-Completion-Using-GNNs/component_classification_with_link_prediction_head/evaluation/FEGIN/results/model_FEGIN_dataset_ltspice_demos
Command line input: python main.py --data ltspice_demos --representation component_pin_net --model FEGIN --layers 3 --hiddens 16 --batch_size 128 --lr 0.001 --emb_size 128 --epochs 100 --save_appendix component_pin_net_L3_H16_BS128_LR0.001_E128 --no_val
 is saved.
-----
ltspice_demos - FEGIN
Using 3 layers, 16 hidden units, h = 2
Loading component_pin_net representation dataset
ENTERED
Training FEGIN on component_pin_net representation
Train: 1565, Test: 383
##################ITERATION #0 ****************************************
 epoch: 0, train_loss: 1.3673, test_loss: 1.3598, test_f1: 0.2281
 epoch: 1, train_loss: 1.3508, test_loss: 1.3531, test_f1: 0.2281
 epoch: 2, train_loss: 1.3393, test_loss: 1.3460, test_f1: 0.2281
 epoch: 3, train_loss: 1.3249, test_loss: 1.3370, test_f1: 0.2281
 epoch: 4, train_loss: 1.3094, test_loss: 1.3161, test_f1: 0.2281
 epoch: 5, train_loss: 1.2879, test_loss: 1.2917, test_f1: 0.2285
 epoch: 6, train_loss: 1.2618, test_loss: 1.2681, test_f1: 0.2306
 epoch: 7, train_loss: 1.2314, test_loss: 1.2455, test_f1: 0.2360
 epoch: 8, train_loss: 1.1971, test_loss: 1.2226, test_f1: 0.2644
 epoch: 9, train_loss: 1.1662, test_loss: 1.1954, test_f1: 0.3199
 epoch: 10, train_loss: 1.1320, test_loss: 1.1595, test_f1: 0.3503
 epoch: 11, train_loss: 1.1000, test_loss: 1.1368, test_f1: 0.3773
 epoch: 12, train_loss: 1.0652, test_loss: 1.1167, test_f1: 0.4099
 epoch: 13, train_loss: 1.0560, test_loss: 1.1035, test_f1: 0.3875
 epoch: 14, train_loss: 1.0349, test_loss: 1.1065, test_f1: 0.3387
 epoch: 15, train_loss: 1.0294, test_loss: 1.0950, test_f1: 0.3562
 epoch: 16, train_loss: 1.0288, test_loss: 1.0800, test_f1: 0.3598
 epoch: 17, train_loss: 1.0080, test_loss: 1.0815, test_f1: 0.3835
 epoch: 18, train_loss: 0.9943, test_loss: 1.0889, test_f1: 0.4149
 epoch: 19, train_loss: 0.9921, test_loss: 1.0703, test_f1: 0.4363
 epoch: 20, train_loss: 0.9950, test_loss: 1.0714, test_f1: 0.4295
 epoch: 21, train_loss: 0.9870, test_loss: 1.0836, test_f1: 0.4327
 epoch: 22, train_loss: 0.9851, test_loss: 1.0825, test_f1: 0.4352
 epoch: 23, train_loss: 0.9758, test_loss: 1.0619, test_f1: 0.3842
 epoch: 24, train_loss: 0.9736, test_loss: 1.0623, test_f1: 0.4158
 epoch: 25, train_loss: 0.9713, test_loss: 1.0524, test_f1: 0.3841
 epoch: 26, train_loss: 0.9715, test_loss: 1.0734, test_f1: 0.3864
 epoch: 27, train_loss: 0.9607, test_loss: 1.0520, test_f1: 0.4429
 epoch: 28, train_loss: 0.9617, test_loss: 1.0639, test_f1: 0.4401
 epoch: 29, train_loss: 0.9550, test_loss: 1.0578, test_f1: 0.4484
 epoch: 30, train_loss: 0.9524, test_loss: 1.0646, test_f1: 0.4550
 epoch: 31, train_loss: 0.9561, test_loss: 1.0715, test_f1: 0.4525
 epoch: 32, train_loss: 0.9505, test_loss: 1.0525, test_f1: 0.4657
 epoch: 33, train_loss: 0.9434, test_loss: 1.0602, test_f1: 0.4597
 epoch: 34, train_loss: 0.9529, test_loss: 1.0496, test_f1: 0.4740
 epoch: 35, train_loss: 0.9383, test_loss: 1.0555, test_f1: 0.4584
 epoch: 36, train_loss: 0.9301, test_loss: 1.0692, test_f1: 0.4572
 epoch: 37, train_loss: 0.9351, test_loss: 1.0631, test_f1: 0.4537
 epoch: 38, train_loss: 0.9328, test_loss: 1.0602, test_f1: 0.4355
 epoch: 39, train_loss: 0.9304, test_loss: 1.0777, test_f1: 0.4862
 epoch: 40, train_loss: 0.9383, test_loss: 1.0604, test_f1: 0.4836
 epoch: 41, train_loss: 0.9181, test_loss: 1.0523, test_f1: 0.4979
 epoch: 42, train_loss: 0.9211, test_loss: 1.0621, test_f1: 0.5062
 epoch: 43, train_loss: 0.9105, test_loss: 1.0535, test_f1: 0.5216
 epoch: 44, train_loss: 0.9151, test_loss: 1.0543, test_f1: 0.4982
 epoch: 45, train_loss: 0.9037, test_loss: 1.0405, test_f1: 0.4898
 epoch: 46, train_loss: 0.9023, test_loss: 1.0468, test_f1: 0.5237
 epoch: 47, train_loss: 0.9240, test_loss: 1.0334, test_f1: 0.5625
 epoch: 48, train_loss: 0.9038, test_loss: 1.0587, test_f1: 0.5430
 epoch: 49, train_loss: 0.9019, test_loss: 1.0751, test_f1: 0.5387
 epoch: 50, train_loss: 0.9017, test_loss: 1.0940, test_f1: 0.5412
 epoch: 51, train_loss: 0.8941, test_loss: 1.0794, test_f1: 0.5262
 epoch: 52, train_loss: 0.8904, test_loss: 1.0829, test_f1: 0.5350
 epoch: 53, train_loss: 0.9002, test_loss: 1.0780, test_f1: 0.5474
 epoch: 54, train_loss: 0.8949, test_loss: 1.0707, test_f1: 0.5534
 epoch: 55, train_loss: 0.8946, test_loss: 1.0838, test_f1: 0.5522
 epoch: 56, train_loss: 0.8888, test_loss: 1.0474, test_f1: 0.5499
 epoch: 57, train_loss: 0.8885, test_loss: 1.0787, test_f1: 0.5538
 epoch: 58, train_loss: 0.8896, test_loss: 1.0452, test_f1: 0.5291
 epoch: 59, train_loss: 0.8841, test_loss: 1.0974, test_f1: 0.5362
 epoch: 60, train_loss: 0.8844, test_loss: 1.0914, test_f1: 0.5397
 epoch: 61, train_loss: 0.8869, test_loss: 1.0775, test_f1: 0.5610
 epoch: 62, train_loss: 0.8767, test_loss: 1.0797, test_f1: 0.5605
 epoch: 63, train_loss: 0.8808, test_loss: 1.0683, test_f1: 0.5403
 epoch: 64, train_loss: 0.8765, test_loss: 1.1211, test_f1: 0.5497
 epoch: 65, train_loss: 0.8784, test_loss: 1.1156, test_f1: 0.5736
 epoch: 66, train_loss: 0.8737, test_loss: 1.0754, test_f1: 0.5471
 epoch: 67, train_loss: 0.8781, test_loss: 1.0904, test_f1: 0.5604
 epoch: 68, train_loss: 0.8633, test_loss: 1.0762, test_f1: 0.5710
 epoch: 69, train_loss: 0.8716, test_loss: 1.1000, test_f1: 0.5710
 epoch: 70, train_loss: 0.8749, test_loss: 1.0932, test_f1: 0.5630
 epoch: 71, train_loss: 0.8589, test_loss: 1.1180, test_f1: 0.5666
 epoch: 72, train_loss: 0.8482, test_loss: 1.0852, test_f1: 0.5665
 epoch: 73, train_loss: 0.8641, test_loss: 1.0794, test_f1: 0.5408
 epoch: 74, train_loss: 0.8589, test_loss: 1.0695, test_f1: 0.5335
 epoch: 75, train_loss: 0.8683, test_loss: 1.0880, test_f1: 0.5635
 epoch: 76, train_loss: 0.8629, test_loss: 1.1146, test_f1: 0.5633
 epoch: 77, train_loss: 0.8583, test_loss: 1.1066, test_f1: 0.5721
 epoch: 78, train_loss: 0.8532, test_loss: 1.0645, test_f1: 0.5611
 epoch: 79, train_loss: 0.8505, test_loss: 1.1302, test_f1: 0.5596
 epoch: 80, train_loss: 0.8542, test_loss: 1.0915, test_f1: 0.5626
 epoch: 81, train_loss: 0.8564, test_loss: 1.1179, test_f1: 0.5589
 epoch: 82, train_loss: 0.8475, test_loss: 1.1270, test_f1: 0.5609
 epoch: 83, train_loss: 0.8464, test_loss: 1.1291, test_f1: 0.5839
 epoch: 84, train_loss: 0.8413, test_loss: 1.1407, test_f1: 0.5514
 epoch: 85, train_loss: 0.8612, test_loss: 1.0973, test_f1: 0.5688
 epoch: 86, train_loss: 0.8387, test_loss: 1.1011, test_f1: 0.5348
 epoch: 87, train_loss: 0.8395, test_loss: 1.1236, test_f1: 0.5647
 epoch: 88, train_loss: 0.8398, test_loss: 1.0838, test_f1: 0.5773
 epoch: 89, train_loss: 0.8369, test_loss: 1.1042, test_f1: 0.5498
 epoch: 90, train_loss: 0.8394, test_loss: 1.0790, test_f1: 0.5883
 epoch: 91, train_loss: 0.8271, test_loss: 1.0948, test_f1: 0.5577
 epoch: 92, train_loss: 0.8304, test_loss: 1.1265, test_f1: 0.5689
 epoch: 93, train_loss: 0.8389, test_loss: 1.0968, test_f1: 0.6018
 epoch: 94, train_loss: 0.8344, test_loss: 1.1419, test_f1: 0.5602
 epoch: 95, train_loss: 0.8278, test_loss: 1.0926, test_f1: 0.5934
 epoch: 96, train_loss: 0.8136, test_loss: 1.0898, test_f1: 0.5798
 epoch: 97, train_loss: 0.8328, test_loss: 1.1217, test_f1: 0.5864
 epoch: 98, train_loss: 0.8184, test_loss: 1.1211, test_f1: 0.5979
 epoch: 99, train_loss: 0.8259, test_loss: 1.0709, test_f1: 0.5560
##################ITERATION #1 ****************************************
 epoch: 0, train_loss: 1.3661, test_loss: 1.3541, test_f1: 0.0939
 epoch: 1, train_loss: 1.2974, test_loss: 1.3319, test_f1: 0.2281
 epoch: 2, train_loss: 1.2552, test_loss: 1.3007, test_f1: 0.2281
 epoch: 3, train_loss: 1.2237, test_loss: 1.2721, test_f1: 0.2281
 epoch: 4, train_loss: 1.1947, test_loss: 1.2423, test_f1: 0.2720
 epoch: 5, train_loss: 1.1674, test_loss: 1.2126, test_f1: 0.3011
 epoch: 6, train_loss: 1.1339, test_loss: 1.1878, test_f1: 0.3795
 epoch: 7, train_loss: 1.1164, test_loss: 1.1762, test_f1: 0.3699
 epoch: 8, train_loss: 1.0974, test_loss: 1.1521, test_f1: 0.3919
 epoch: 9, train_loss: 1.0860, test_loss: 1.1494, test_f1: 0.3755
 epoch: 10, train_loss: 1.0726, test_loss: 1.1303, test_f1: 0.4235
 epoch: 11, train_loss: 1.0573, test_loss: 1.1108, test_f1: 0.4242
 epoch: 12, train_loss: 1.0511, test_loss: 1.0977, test_f1: 0.4219
 epoch: 13, train_loss: 1.0379, test_loss: 1.0911, test_f1: 0.4265
 epoch: 14, train_loss: 1.0212, test_loss: 1.0839, test_f1: 0.4259
 epoch: 15, train_loss: 1.0203, test_loss: 1.0943, test_f1: 0.4220
 epoch: 16, train_loss: 1.0153, test_loss: 1.0660, test_f1: 0.4273
 epoch: 17, train_loss: 1.0109, test_loss: 1.0645, test_f1: 0.4277
 epoch: 18, train_loss: 1.0096, test_loss: 1.0729, test_f1: 0.4251
 epoch: 19, train_loss: 0.9984, test_loss: 1.0649, test_f1: 0.4277
 epoch: 20, train_loss: 0.9859, test_loss: 1.0682, test_f1: 0.4203
 epoch: 21, train_loss: 0.9821, test_loss: 1.0573, test_f1: 0.4266
 epoch: 22, train_loss: 0.9774, test_loss: 1.0622, test_f1: 0.4302
 epoch: 23, train_loss: 0.9794, test_loss: 1.0582, test_f1: 0.4006
 epoch: 24, train_loss: 0.9717, test_loss: 1.0568, test_f1: 0.4321
 epoch: 25, train_loss: 0.9598, test_loss: 1.0535, test_f1: 0.4516
 epoch: 26, train_loss: 0.9648, test_loss: 1.0437, test_f1: 0.4264
 epoch: 27, train_loss: 0.9654, test_loss: 1.0463, test_f1: 0.4422
 epoch: 28, train_loss: 0.9558, test_loss: 1.0515, test_f1: 0.4365
 epoch: 29, train_loss: 0.9520, test_loss: 1.0389, test_f1: 0.4296
 epoch: 30, train_loss: 0.9452, test_loss: 1.0451, test_f1: 0.4289
 epoch: 31, train_loss: 0.9432, test_loss: 1.0471, test_f1: 0.4344
 epoch: 32, train_loss: 0.9409, test_loss: 1.0389, test_f1: 0.4741
 epoch: 33, train_loss: 0.9354, test_loss: 1.0505, test_f1: 0.4749
 epoch: 34, train_loss: 0.9404, test_loss: 1.0528, test_f1: 0.4929
 epoch: 35, train_loss: 0.9333, test_loss: 1.0322, test_f1: 0.4785
 epoch: 36, train_loss: 0.9318, test_loss: 1.0418, test_f1: 0.4620
 epoch: 37, train_loss: 0.9274, test_loss: 1.0524, test_f1: 0.4769
 epoch: 38, train_loss: 0.9339, test_loss: 1.0245, test_f1: 0.4869
 epoch: 39, train_loss: 0.9287, test_loss: 1.0254, test_f1: 0.5124
 epoch: 40, train_loss: 0.9187, test_loss: 1.0369, test_f1: 0.5085
 epoch: 41, train_loss: 0.9121, test_loss: 1.0307, test_f1: 0.5377
 epoch: 42, train_loss: 0.9107, test_loss: 1.0317, test_f1: 0.5476
 epoch: 43, train_loss: 0.9135, test_loss: 1.0392, test_f1: 0.5406
 epoch: 44, train_loss: 0.9145, test_loss: 1.0360, test_f1: 0.5288
 epoch: 45, train_loss: 0.9039, test_loss: 1.0280, test_f1: 0.5291
 epoch: 46, train_loss: 0.9029, test_loss: 1.0363, test_f1: 0.5524
 epoch: 47, train_loss: 0.8993, test_loss: 1.0453, test_f1: 0.5257
 epoch: 48, train_loss: 0.9041, test_loss: 1.0667, test_f1: 0.5291
 epoch: 49, train_loss: 0.8950, test_loss: 1.0223, test_f1: 0.5277
 epoch: 50, train_loss: 0.8928, test_loss: 1.0324, test_f1: 0.5319
 epoch: 51, train_loss: 0.8895, test_loss: 1.0377, test_f1: 0.5284
 epoch: 52, train_loss: 0.8830, test_loss: 1.0422, test_f1: 0.5307
 epoch: 53, train_loss: 0.8859, test_loss: 1.0249, test_f1: 0.5320
 epoch: 54, train_loss: 0.8806, test_loss: 1.0284, test_f1: 0.5390
 epoch: 55, train_loss: 0.8906, test_loss: 1.0344, test_f1: 0.5345
 epoch: 56, train_loss: 0.8844, test_loss: 1.0401, test_f1: 0.5336
 epoch: 57, train_loss: 0.8724, test_loss: 1.0466, test_f1: 0.5274
 epoch: 58, train_loss: 0.8759, test_loss: 1.0409, test_f1: 0.5311
 epoch: 59, train_loss: 0.8825, test_loss: 1.0397, test_f1: 0.5200
 epoch: 60, train_loss: 0.8810, test_loss: 1.0394, test_f1: 0.5228
 epoch: 61, train_loss: 0.8630, test_loss: 1.0379, test_f1: 0.5432
 epoch: 62, train_loss: 0.8716, test_loss: 1.0615, test_f1: 0.5461
 epoch: 63, train_loss: 0.8657, test_loss: 1.0497, test_f1: 0.5481
 epoch: 64, train_loss: 0.8695, test_loss: 1.0398, test_f1: 0.5413
 epoch: 65, train_loss: 0.8680, test_loss: 1.0349, test_f1: 0.5359
 epoch: 66, train_loss: 0.8714, test_loss: 1.0374, test_f1: 0.5494
 epoch: 67, train_loss: 0.8641, test_loss: 1.0624, test_f1: 0.5265
 epoch: 68, train_loss: 0.8679, test_loss: 1.0575, test_f1: 0.5384
 epoch: 69, train_loss: 0.8841, test_loss: 1.0236, test_f1: 0.5454
 epoch: 70, train_loss: 0.8653, test_loss: 1.0378, test_f1: 0.5596
 epoch: 71, train_loss: 0.8626, test_loss: 1.0274, test_f1: 0.5524
 epoch: 72, train_loss: 0.8528, test_loss: 1.0224, test_f1: 0.5386
 epoch: 73, train_loss: 0.8614, test_loss: 1.0331, test_f1: 0.5574
 epoch: 74, train_loss: 0.8518, test_loss: 1.0538, test_f1: 0.5478
 epoch: 75, train_loss: 0.8641, test_loss: 1.0442, test_f1: 0.5544
 epoch: 76, train_loss: 0.8644, test_loss: 1.0295, test_f1: 0.5351
 epoch: 77, train_loss: 0.8592, test_loss: 1.0365, test_f1: 0.5329
 epoch: 78, train_loss: 0.8389, test_loss: 1.0518, test_f1: 0.5354
 epoch: 79, train_loss: 0.8463, test_loss: 1.0479, test_f1: 0.5566
 epoch: 80, train_loss: 0.8419, test_loss: 1.0376, test_f1: 0.5411
 epoch: 81, train_loss: 0.8468, test_loss: 1.0318, test_f1: 0.5304
 epoch: 82, train_loss: 0.8475, test_loss: 1.0456, test_f1: 0.5462
 epoch: 83, train_loss: 0.8478, test_loss: 1.0703, test_f1: 0.5609
 epoch: 84, train_loss: 0.8465, test_loss: 1.0424, test_f1: 0.5724
 epoch: 85, train_loss: 0.8364, test_loss: 1.0357, test_f1: 0.5529
 epoch: 86, train_loss: 0.8500, test_loss: 1.0614, test_f1: 0.5596
 epoch: 87, train_loss: 0.8440, test_loss: 1.0664, test_f1: 0.5359
 epoch: 88, train_loss: 0.8348, test_loss: 1.0596, test_f1: 0.5574
 epoch: 89, train_loss: 0.8306, test_loss: 1.0474, test_f1: 0.5192
 epoch: 90, train_loss: 0.8404, test_loss: 1.1098, test_f1: 0.5579
 epoch: 91, train_loss: 0.8175, test_loss: 1.0535, test_f1: 0.5534
 epoch: 92, train_loss: 0.8272, test_loss: 1.0344, test_f1: 0.5695
 epoch: 93, train_loss: 0.8276, test_loss: 1.0950, test_f1: 0.5634
 epoch: 94, train_loss: 0.8166, test_loss: 1.0459, test_f1: 0.5432
 epoch: 95, train_loss: 0.8204, test_loss: 1.0561, test_f1: 0.5359
 epoch: 96, train_loss: 0.8237, test_loss: 1.0645, test_f1: 0.5594
 epoch: 97, train_loss: 0.8147, test_loss: 1.0425, test_f1: 0.5490
 epoch: 98, train_loss: 0.8117, test_loss: 1.0563, test_f1: 0.5414
 epoch: 99, train_loss: 0.8181, test_loss: 1.0666, test_f1: 0.5192
##################ITERATION #2 ****************************************
 epoch: 0, train_loss: 1.4059, test_loss: 1.3982, test_f1: 0.0507
 epoch: 1, train_loss: 1.2687, test_loss: 1.3467, test_f1: 0.2266
 epoch: 2, train_loss: 1.2258, test_loss: 1.3300, test_f1: 0.2281
 epoch: 3, train_loss: 1.1673, test_loss: 1.3046, test_f1: 0.2281
 epoch: 4, train_loss: 1.1289, test_loss: 1.2119, test_f1: 0.2539
 epoch: 5, train_loss: 1.0926, test_loss: 1.1429, test_f1: 0.3234
 epoch: 6, train_loss: 1.0605, test_loss: 1.1177, test_f1: 0.3370
 epoch: 7, train_loss: 1.0340, test_loss: 1.0913, test_f1: 0.3579
 epoch: 8, train_loss: 1.0277, test_loss: 1.0857, test_f1: 0.4766
 epoch: 9, train_loss: 1.0212, test_loss: 1.0859, test_f1: 0.4668
 epoch: 10, train_loss: 1.0054, test_loss: 1.0903, test_f1: 0.4892
 epoch: 11, train_loss: 0.9845, test_loss: 1.0965, test_f1: 0.4915
 epoch: 12, train_loss: 0.9787, test_loss: 1.0722, test_f1: 0.4887
 epoch: 13, train_loss: 0.9728, test_loss: 1.0744, test_f1: 0.4996
 epoch: 14, train_loss: 0.9747, test_loss: 1.0801, test_f1: 0.4903
 epoch: 15, train_loss: 0.9642, test_loss: 1.0710, test_f1: 0.4981
 epoch: 16, train_loss: 0.9540, test_loss: 1.0713, test_f1: 0.4960
 epoch: 17, train_loss: 0.9528, test_loss: 1.0921, test_f1: 0.4997
 epoch: 18, train_loss: 0.9556, test_loss: 1.0749, test_f1: 0.5170
 epoch: 19, train_loss: 0.9444, test_loss: 1.0869, test_f1: 0.5058
 epoch: 20, train_loss: 0.9397, test_loss: 1.0674, test_f1: 0.5032
 epoch: 21, train_loss: 0.9387, test_loss: 1.0682, test_f1: 0.5074
 epoch: 22, train_loss: 0.9334, test_loss: 1.0762, test_f1: 0.5269
 epoch: 23, train_loss: 0.9270, test_loss: 1.0749, test_f1: 0.5102
 epoch: 24, train_loss: 0.9260, test_loss: 1.0838, test_f1: 0.4884
 epoch: 25, train_loss: 0.9267, test_loss: 1.0859, test_f1: 0.5153
 epoch: 26, train_loss: 0.9196, test_loss: 1.0849, test_f1: 0.5483
 epoch: 27, train_loss: 0.9170, test_loss: 1.0814, test_f1: 0.5348
 epoch: 28, train_loss: 0.9091, test_loss: 1.0617, test_f1: 0.5352
 epoch: 29, train_loss: 0.9017, test_loss: 1.0869, test_f1: 0.5275
 epoch: 30, train_loss: 0.9069, test_loss: 1.0780, test_f1: 0.5306
 epoch: 31, train_loss: 0.8970, test_loss: 1.0921, test_f1: 0.5161
 epoch: 32, train_loss: 0.8999, test_loss: 1.0897, test_f1: 0.5137
 epoch: 33, train_loss: 0.8898, test_loss: 1.0847, test_f1: 0.5403
 epoch: 34, train_loss: 0.8932, test_loss: 1.0596, test_f1: 0.5568
 epoch: 35, train_loss: 0.8796, test_loss: 1.1074, test_f1: 0.5684
 epoch: 36, train_loss: 0.8886, test_loss: 1.0854, test_f1: 0.5390
 epoch: 37, train_loss: 0.8693, test_loss: 1.0771, test_f1: 0.5322
 epoch: 38, train_loss: 0.8661, test_loss: 1.0935, test_f1: 0.5561
 epoch: 39, train_loss: 0.8646, test_loss: 1.0945, test_f1: 0.5631
 epoch: 40, train_loss: 0.8628, test_loss: 1.0620, test_f1: 0.5560
 epoch: 41, train_loss: 0.8502, test_loss: 1.0625, test_f1: 0.5395
 epoch: 42, train_loss: 0.8559, test_loss: 1.0293, test_f1: 0.5814
 epoch: 43, train_loss: 0.8441, test_loss: 1.0637, test_f1: 0.5796
 epoch: 44, train_loss: 0.8513, test_loss: 1.0723, test_f1: 0.5822
 epoch: 45, train_loss: 0.8344, test_loss: 1.0753, test_f1: 0.5796
 epoch: 46, train_loss: 0.8234, test_loss: 1.0693, test_f1: 0.5833
 epoch: 47, train_loss: 0.8312, test_loss: 1.0647, test_f1: 0.5840
 epoch: 48, train_loss: 0.8234, test_loss: 1.0618, test_f1: 0.5895
 epoch: 49, train_loss: 0.8209, test_loss: 1.0629, test_f1: 0.5791
 epoch: 50, train_loss: 0.8229, test_loss: 1.0739, test_f1: 0.5880
 epoch: 51, train_loss: 0.8070, test_loss: 1.0783, test_f1: 0.5838
 epoch: 52, train_loss: 0.8059, test_loss: 1.0771, test_f1: 0.5929
 epoch: 53, train_loss: 0.8049, test_loss: 1.0778, test_f1: 0.5799
 epoch: 54, train_loss: 0.8010, test_loss: 1.0767, test_f1: 0.5820
 epoch: 55, train_loss: 0.8049, test_loss: 1.0934, test_f1: 0.5739
 epoch: 56, train_loss: 0.8004, test_loss: 1.0783, test_f1: 0.5901
 epoch: 57, train_loss: 0.7900, test_loss: 1.0934, test_f1: 0.5776
 epoch: 58, train_loss: 0.7892, test_loss: 1.0845, test_f1: 0.5746
 epoch: 59, train_loss: 0.8082, test_loss: 1.0628, test_f1: 0.5975
 epoch: 60, train_loss: 0.7830, test_loss: 1.0985, test_f1: 0.6042
 epoch: 61, train_loss: 0.7962, test_loss: 1.0804, test_f1: 0.5891
 epoch: 62, train_loss: 0.7855, test_loss: 1.0849, test_f1: 0.5857
 epoch: 63, train_loss: 0.7652, test_loss: 1.1031, test_f1: 0.5875
 epoch: 64, train_loss: 0.7931, test_loss: 1.0782, test_f1: 0.5918
 epoch: 65, train_loss: 0.7833, test_loss: 1.1064, test_f1: 0.5709
 epoch: 66, train_loss: 0.7818, test_loss: 1.0952, test_f1: 0.5759
 epoch: 67, train_loss: 0.7737, test_loss: 1.0731, test_f1: 0.5950
 epoch: 68, train_loss: 0.7842, test_loss: 1.0903, test_f1: 0.5846
 epoch: 69, train_loss: 0.7711, test_loss: 1.0872, test_f1: 0.5893
 epoch: 70, train_loss: 0.7606, test_loss: 1.0841, test_f1: 0.5888
 epoch: 71, train_loss: 0.7748, test_loss: 1.0796, test_f1: 0.6062
 epoch: 72, train_loss: 0.7658, test_loss: 1.0856, test_f1: 0.6068
 epoch: 73, train_loss: 0.7858, test_loss: 1.0580, test_f1: 0.5951
 epoch: 74, train_loss: 0.7795, test_loss: 1.0899, test_f1: 0.5628
 epoch: 75, train_loss: 0.7453, test_loss: 1.0650, test_f1: 0.5721
 epoch: 76, train_loss: 0.7601, test_loss: 1.0578, test_f1: 0.6081
 epoch: 77, train_loss: 0.7528, test_loss: 1.1398, test_f1: 0.6118
 epoch: 78, train_loss: 0.7548, test_loss: 1.0929, test_f1: 0.6119
 epoch: 79, train_loss: 0.7511, test_loss: 1.0976, test_f1: 0.6240
 epoch: 80, train_loss: 0.7638, test_loss: 1.1043, test_f1: 0.6163
 epoch: 81, train_loss: 0.7552, test_loss: 1.1334, test_f1: 0.5936
 epoch: 82, train_loss: 0.7399, test_loss: 1.0986, test_f1: 0.5687
 epoch: 83, train_loss: 0.7441, test_loss: 1.1198, test_f1: 0.5954
 epoch: 84, train_loss: 0.7467, test_loss: 1.0930, test_f1: 0.6082
 epoch: 85, train_loss: 0.7491, test_loss: 1.1069, test_f1: 0.5730
 epoch: 86, train_loss: 0.7413, test_loss: 1.1212, test_f1: 0.6178
 epoch: 87, train_loss: 0.7309, test_loss: 1.1301, test_f1: 0.6002
 epoch: 88, train_loss: 0.7342, test_loss: 1.0842, test_f1: 0.5905
 epoch: 89, train_loss: 0.7398, test_loss: 1.0874, test_f1: 0.5992
 epoch: 90, train_loss: 0.7344, test_loss: 1.1077, test_f1: 0.5836
 epoch: 91, train_loss: 0.7296, test_loss: 1.0967, test_f1: 0.6095
 epoch: 92, train_loss: 0.7394, test_loss: 1.1141, test_f1: 0.5721
 epoch: 93, train_loss: 0.7196, test_loss: 1.1818, test_f1: 0.5966
 epoch: 94, train_loss: 0.7384, test_loss: 1.1322, test_f1: 0.5932
 epoch: 95, train_loss: 0.7409, test_loss: 1.1988, test_f1: 0.5922
 epoch: 96, train_loss: 0.7483, test_loss: 1.0999, test_f1: 0.6076
 epoch: 97, train_loss: 0.7321, test_loss: 1.1067, test_f1: 0.6036
 epoch: 98, train_loss: 0.7266, test_loss: 1.1075, test_f1: 0.6206
 epoch: 99, train_loss: 0.7287, test_loss: 1.1087, test_f1: 0.5920
##################ITERATION #3 ****************************************
 epoch: 0, train_loss: 1.3296, test_loss: 1.2965, test_f1: 0.2281
 epoch: 1, train_loss: 1.2154, test_loss: 1.3022, test_f1: 0.2281
 epoch: 2, train_loss: 1.1775, test_loss: 1.3107, test_f1: 0.2281
 epoch: 3, train_loss: 1.1607, test_loss: 1.2579, test_f1: 0.2270
 epoch: 4, train_loss: 1.1201, test_loss: 1.2199, test_f1: 0.3427
 epoch: 5, train_loss: 1.1138, test_loss: 1.1750, test_f1: 0.4237
 epoch: 6, train_loss: 1.0817, test_loss: 1.1363, test_f1: 0.4297
 epoch: 7, train_loss: 1.0802, test_loss: 1.1129, test_f1: 0.4579
 epoch: 8, train_loss: 1.0510, test_loss: 1.1087, test_f1: 0.4673
 epoch: 9, train_loss: 1.0533, test_loss: 1.0859, test_f1: 0.4729
 epoch: 10, train_loss: 1.0361, test_loss: 1.0741, test_f1: 0.4955
 epoch: 11, train_loss: 1.0219, test_loss: 1.0677, test_f1: 0.5006
 epoch: 12, train_loss: 0.9938, test_loss: 1.0599, test_f1: 0.5110
 epoch: 13, train_loss: 0.9926, test_loss: 1.0627, test_f1: 0.5072
 epoch: 14, train_loss: 0.9935, test_loss: 1.0542, test_f1: 0.5066
 epoch: 15, train_loss: 0.9780, test_loss: 1.0570, test_f1: 0.5012
 epoch: 16, train_loss: 0.9653, test_loss: 1.0395, test_f1: 0.4985
 epoch: 17, train_loss: 0.9655, test_loss: 1.0307, test_f1: 0.5354
 epoch: 18, train_loss: 0.9549, test_loss: 1.0409, test_f1: 0.5228
 epoch: 19, train_loss: 0.9435, test_loss: 1.0499, test_f1: 0.5162
 epoch: 20, train_loss: 0.9460, test_loss: 1.0453, test_f1: 0.5292
 epoch: 21, train_loss: 0.9368, test_loss: 1.0282, test_f1: 0.5363
 epoch: 22, train_loss: 0.9288, test_loss: 1.0230, test_f1: 0.5332
 epoch: 23, train_loss: 0.9235, test_loss: 1.0232, test_f1: 0.5299
 epoch: 24, train_loss: 0.9262, test_loss: 1.0201, test_f1: 0.5262
 epoch: 25, train_loss: 0.9167, test_loss: 1.0145, test_f1: 0.5419
 epoch: 26, train_loss: 0.9129, test_loss: 1.0370, test_f1: 0.5332
 epoch: 27, train_loss: 0.8964, test_loss: 1.0242, test_f1: 0.5417
 epoch: 28, train_loss: 0.8985, test_loss: 1.0109, test_f1: 0.5374
 epoch: 29, train_loss: 0.8947, test_loss: 1.0212, test_f1: 0.5267
 epoch: 30, train_loss: 0.8879, test_loss: 1.0080, test_f1: 0.5445
 epoch: 31, train_loss: 0.8834, test_loss: 1.0119, test_f1: 0.5435
 epoch: 32, train_loss: 0.8727, test_loss: 1.0145, test_f1: 0.5367
 epoch: 33, train_loss: 0.8789, test_loss: 1.0103, test_f1: 0.5556
 epoch: 34, train_loss: 0.8725, test_loss: 1.0371, test_f1: 0.5360
 epoch: 35, train_loss: 0.8726, test_loss: 1.0147, test_f1: 0.5408
 epoch: 36, train_loss: 0.8766, test_loss: 0.9938, test_f1: 0.5141
 epoch: 37, train_loss: 0.8659, test_loss: 1.0111, test_f1: 0.5383
 epoch: 38, train_loss: 0.8802, test_loss: 1.0212, test_f1: 0.5513
 epoch: 39, train_loss: 0.8622, test_loss: 1.0033, test_f1: 0.5777
 epoch: 40, train_loss: 0.8665, test_loss: 1.0068, test_f1: 0.5529
 epoch: 41, train_loss: 0.8640, test_loss: 0.9886, test_f1: 0.5538
 epoch: 42, train_loss: 0.8525, test_loss: 1.0040, test_f1: 0.5547
 epoch: 43, train_loss: 0.8464, test_loss: 1.0088, test_f1: 0.5458
 epoch: 44, train_loss: 0.8472, test_loss: 1.0113, test_f1: 0.5294
 epoch: 45, train_loss: 0.8581, test_loss: 0.9916, test_f1: 0.5417
 epoch: 46, train_loss: 0.8446, test_loss: 1.0105, test_f1: 0.5516
 epoch: 47, train_loss: 0.8374, test_loss: 0.9958, test_f1: 0.5639
 epoch: 48, train_loss: 0.8412, test_loss: 1.0252, test_f1: 0.5507
 epoch: 49, train_loss: 0.8448, test_loss: 1.0011, test_f1: 0.5730
 epoch: 50, train_loss: 0.8276, test_loss: 1.0275, test_f1: 0.5706
 epoch: 51, train_loss: 0.8176, test_loss: 1.0078, test_f1: 0.5839
 epoch: 52, train_loss: 0.8213, test_loss: 0.9991, test_f1: 0.5949
 epoch: 53, train_loss: 0.8152, test_loss: 0.9995, test_f1: 0.5810
 epoch: 54, train_loss: 0.8142, test_loss: 1.0285, test_f1: 0.5522
 epoch: 55, train_loss: 0.8063, test_loss: 1.0103, test_f1: 0.5851
 epoch: 56, train_loss: 0.8169, test_loss: 1.0016, test_f1: 0.6007
 epoch: 57, train_loss: 0.8140, test_loss: 1.0084, test_f1: 0.5763
 epoch: 58, train_loss: 0.8100, test_loss: 0.9956, test_f1: 0.5841
 epoch: 59, train_loss: 0.8150, test_loss: 1.0070, test_f1: 0.5877
 epoch: 60, train_loss: 0.8049, test_loss: 0.9946, test_f1: 0.6065
 epoch: 61, train_loss: 0.7949, test_loss: 1.0172, test_f1: 0.5856
 epoch: 62, train_loss: 0.8127, test_loss: 1.0036, test_f1: 0.5682
 epoch: 63, train_loss: 0.8096, test_loss: 0.9977, test_f1: 0.5878
 epoch: 64, train_loss: 0.7971, test_loss: 0.9915, test_f1: 0.5711
 epoch: 65, train_loss: 0.8006, test_loss: 1.0061, test_f1: 0.5777
 epoch: 66, train_loss: 0.8130, test_loss: 1.0075, test_f1: 0.5588
 epoch: 67, train_loss: 0.8001, test_loss: 1.0020, test_f1: 0.5862
 epoch: 68, train_loss: 0.7985, test_loss: 1.0041, test_f1: 0.5966
 epoch: 69, train_loss: 0.7934, test_loss: 1.0000, test_f1: 0.6021
 epoch: 70, train_loss: 0.7824, test_loss: 1.0095, test_f1: 0.5889
 epoch: 71, train_loss: 0.7795, test_loss: 1.0083, test_f1: 0.5524
 epoch: 72, train_loss: 0.7915, test_loss: 1.0194, test_f1: 0.5732
 epoch: 73, train_loss: 0.7922, test_loss: 1.0139, test_f1: 0.5644
 epoch: 74, train_loss: 0.7772, test_loss: 1.0110, test_f1: 0.5416
 epoch: 75, train_loss: 0.7794, test_loss: 1.0203, test_f1: 0.5714
 epoch: 76, train_loss: 0.7827, test_loss: 1.0189, test_f1: 0.5756
 epoch: 77, train_loss: 0.7756, test_loss: 1.0255, test_f1: 0.5680
 epoch: 78, train_loss: 0.7845, test_loss: 1.0224, test_f1: 0.5786
 epoch: 79, train_loss: 0.7861, test_loss: 1.0145, test_f1: 0.5849
 epoch: 80, train_loss: 0.7703, test_loss: 1.0260, test_f1: 0.5518
 epoch: 81, train_loss: 0.7840, test_loss: 1.0255, test_f1: 0.5663
 epoch: 82, train_loss: 0.7760, test_loss: 1.0359, test_f1: 0.5580
 epoch: 83, train_loss: 0.7666, test_loss: 1.0292, test_f1: 0.5632
 epoch: 84, train_loss: 0.7825, test_loss: 1.0425, test_f1: 0.5376
 epoch: 85, train_loss: 0.7757, test_loss: 1.0338, test_f1: 0.5771
 epoch: 86, train_loss: 0.7632, test_loss: 1.0509, test_f1: 0.5613
 epoch: 87, train_loss: 0.7834, test_loss: 1.0443, test_f1: 0.5482
 epoch: 88, train_loss: 0.7747, test_loss: 1.0491, test_f1: 0.5529
 epoch: 89, train_loss: 0.7700, test_loss: 1.0337, test_f1: 0.5567
 epoch: 90, train_loss: 0.7646, test_loss: 1.0513, test_f1: 0.5490
 epoch: 91, train_loss: 0.7536, test_loss: 1.0363, test_f1: 0.5765
 epoch: 92, train_loss: 0.7640, test_loss: 1.0387, test_f1: 0.5649
 epoch: 93, train_loss: 0.7737, test_loss: 1.0164, test_f1: 0.5815
 epoch: 94, train_loss: 0.7610, test_loss: 1.0690, test_f1: 0.5413
 epoch: 95, train_loss: 0.7646, test_loss: 1.0180, test_f1: 0.5717
 epoch: 96, train_loss: 0.7629, test_loss: 1.0370, test_f1: 0.5541
 epoch: 97, train_loss: 0.7783, test_loss: 1.0304, test_f1: 0.5935
 epoch: 98, train_loss: 0.7455, test_loss: 1.0391, test_f1: 0.5627
 epoch: 99, train_loss: 0.7591, test_loss: 1.0394, test_f1: 0.5682
##################ITERATION #4 ****************************************
 epoch: 0, train_loss: 1.2444, test_loss: 1.3148, test_f1: 0.2281
 epoch: 1, train_loss: 1.1505, test_loss: 1.3275, test_f1: 0.2281
 epoch: 2, train_loss: 1.1072, test_loss: 1.2730, test_f1: 0.2281
 epoch: 3, train_loss: 1.0874, test_loss: 1.1935, test_f1: 0.2718
 epoch: 4, train_loss: 1.0656, test_loss: 1.1611, test_f1: 0.3298
 epoch: 5, train_loss: 1.0511, test_loss: 1.1488, test_f1: 0.3788
 epoch: 6, train_loss: 1.0481, test_loss: 1.1336, test_f1: 0.4250
 epoch: 7, train_loss: 1.0328, test_loss: 1.1168, test_f1: 0.4424
 epoch: 8, train_loss: 1.0161, test_loss: 1.1074, test_f1: 0.4422
 epoch: 9, train_loss: 1.0045, test_loss: 1.0977, test_f1: 0.4225
 epoch: 10, train_loss: 1.0078, test_loss: 1.0941, test_f1: 0.4377
 epoch: 11, train_loss: 0.9925, test_loss: 1.0983, test_f1: 0.4559
 epoch: 12, train_loss: 0.9881, test_loss: 1.0888, test_f1: 0.4535
 epoch: 13, train_loss: 0.9778, test_loss: 1.0755, test_f1: 0.4946
 epoch: 14, train_loss: 0.9673, test_loss: 1.0647, test_f1: 0.5032
 epoch: 15, train_loss: 0.9651, test_loss: 1.0678, test_f1: 0.4888
 epoch: 16, train_loss: 0.9733, test_loss: 1.0685, test_f1: 0.5116
 epoch: 17, train_loss: 0.9494, test_loss: 1.0559, test_f1: 0.5163
 epoch: 18, train_loss: 0.9486, test_loss: 1.0656, test_f1: 0.5133
 epoch: 19, train_loss: 0.9571, test_loss: 1.0704, test_f1: 0.5091
 epoch: 20, train_loss: 0.9444, test_loss: 1.0588, test_f1: 0.5370
 epoch: 21, train_loss: 0.9357, test_loss: 1.0534, test_f1: 0.5448
 epoch: 22, train_loss: 0.9301, test_loss: 1.0324, test_f1: 0.5181
 epoch: 23, train_loss: 0.9290, test_loss: 1.0389, test_f1: 0.5279
 epoch: 24, train_loss: 0.9299, test_loss: 1.0483, test_f1: 0.5280
 epoch: 25, train_loss: 0.9322, test_loss: 1.0443, test_f1: 0.5032
 epoch: 26, train_loss: 0.9324, test_loss: 1.0620, test_f1: 0.5224
 epoch: 27, train_loss: 0.9280, test_loss: 1.0420, test_f1: 0.5463
 epoch: 28, train_loss: 0.9181, test_loss: 1.0697, test_f1: 0.5171
 epoch: 29, train_loss: 0.9136, test_loss: 1.0391, test_f1: 0.5376
 epoch: 30, train_loss: 0.9043, test_loss: 1.0415, test_f1: 0.5470
 epoch: 31, train_loss: 0.9039, test_loss: 1.0290, test_f1: 0.5580
 epoch: 32, train_loss: 0.8970, test_loss: 1.0222, test_f1: 0.5416
 epoch: 33, train_loss: 0.9021, test_loss: 1.0157, test_f1: 0.5723
 epoch: 34, train_loss: 0.9138, test_loss: 1.0520, test_f1: 0.5380
 epoch: 35, train_loss: 0.8971, test_loss: 1.0493, test_f1: 0.5220
 epoch: 36, train_loss: 0.9156, test_loss: 1.0628, test_f1: 0.5494
 epoch: 37, train_loss: 0.9038, test_loss: 1.0203, test_f1: 0.5569
 epoch: 38, train_loss: 0.8953, test_loss: 1.0190, test_f1: 0.5496
 epoch: 39, train_loss: 0.8872, test_loss: 1.0179, test_f1: 0.5438
 epoch: 40, train_loss: 0.8961, test_loss: 1.0361, test_f1: 0.5642
 epoch: 41, train_loss: 0.8852, test_loss: 1.0118, test_f1: 0.5385
 epoch: 42, train_loss: 0.8726, test_loss: 1.0102, test_f1: 0.5657
 epoch: 43, train_loss: 0.8661, test_loss: 1.0187, test_f1: 0.5772
 epoch: 44, train_loss: 0.8786, test_loss: 1.0074, test_f1: 0.5692
 epoch: 45, train_loss: 0.8692, test_loss: 1.0227, test_f1: 0.5674
 epoch: 46, train_loss: 0.8589, test_loss: 1.0302, test_f1: 0.5641
 epoch: 47, train_loss: 0.8640, test_loss: 0.9930, test_f1: 0.5621
 epoch: 48, train_loss: 0.8600, test_loss: 1.0044, test_f1: 0.5778
 epoch: 49, train_loss: 0.8780, test_loss: 1.0509, test_f1: 0.5606
 epoch: 50, train_loss: 0.8695, test_loss: 0.9926, test_f1: 0.5868
 epoch: 51, train_loss: 0.8479, test_loss: 0.9744, test_f1: 0.5839
 epoch: 52, train_loss: 0.8475, test_loss: 0.9785, test_f1: 0.5787
 epoch: 53, train_loss: 0.8437, test_loss: 0.9904, test_f1: 0.5904
 epoch: 54, train_loss: 0.8421, test_loss: 0.9891, test_f1: 0.5828
 epoch: 55, train_loss: 0.8316, test_loss: 0.9787, test_f1: 0.5774
 epoch: 56, train_loss: 0.8249, test_loss: 0.9907, test_f1: 0.5669
 epoch: 57, train_loss: 0.8396, test_loss: 0.9847, test_f1: 0.5894
 epoch: 58, train_loss: 0.8466, test_loss: 0.9899, test_f1: 0.5837
 epoch: 59, train_loss: 0.8315, test_loss: 0.9825, test_f1: 0.5768
 epoch: 60, train_loss: 0.8170, test_loss: 0.9769, test_f1: 0.5820
 epoch: 61, train_loss: 0.8445, test_loss: 0.9973, test_f1: 0.5659
 epoch: 62, train_loss: 0.8327, test_loss: 0.9985, test_f1: 0.5777
 epoch: 63, train_loss: 0.8361, test_loss: 0.9920, test_f1: 0.5786
 epoch: 64, train_loss: 0.8337, test_loss: 1.0159, test_f1: 0.5616
 epoch: 65, train_loss: 0.8232, test_loss: 0.9932, test_f1: 0.5836
 epoch: 66, train_loss: 0.8350, test_loss: 1.0043, test_f1: 0.5699
 epoch: 67, train_loss: 0.8305, test_loss: 0.9862, test_f1: 0.5776
 epoch: 68, train_loss: 0.8100, test_loss: 0.9964, test_f1: 0.5702
 epoch: 69, train_loss: 0.8248, test_loss: 0.9946, test_f1: 0.5683
 epoch: 70, train_loss: 0.8259, test_loss: 0.9818, test_f1: 0.5894
 epoch: 71, train_loss: 0.8359, test_loss: 0.9749, test_f1: 0.5816
 epoch: 72, train_loss: 0.8091, test_loss: 0.9902, test_f1: 0.5695
 epoch: 73, train_loss: 0.8246, test_loss: 0.9979, test_f1: 0.5737
 epoch: 74, train_loss: 0.7995, test_loss: 0.9622, test_f1: 0.5936
 epoch: 75, train_loss: 0.8296, test_loss: 0.9808, test_f1: 0.5717
 epoch: 76, train_loss: 0.8190, test_loss: 0.9884, test_f1: 0.5682
 epoch: 77, train_loss: 0.8192, test_loss: 0.9845, test_f1: 0.5738
 epoch: 78, train_loss: 0.8085, test_loss: 1.0093, test_f1: 0.5695
 epoch: 79, train_loss: 0.8238, test_loss: 0.9791, test_f1: 0.5706
 epoch: 80, train_loss: 0.8133, test_loss: 0.9893, test_f1: 0.5919
 epoch: 81, train_loss: 0.8024, test_loss: 1.0025, test_f1: 0.5684
 epoch: 82, train_loss: 0.8029, test_loss: 0.9898, test_f1: 0.5788
 epoch: 83, train_loss: 0.8080, test_loss: 0.9787, test_f1: 0.5721
 epoch: 84, train_loss: 0.8063, test_loss: 0.9977, test_f1: 0.5788
 epoch: 85, train_loss: 0.8036, test_loss: 1.0029, test_f1: 0.5853
 epoch: 86, train_loss: 0.8032, test_loss: 1.0072, test_f1: 0.5655
 epoch: 87, train_loss: 0.7982, test_loss: 0.9883, test_f1: 0.5758
 epoch: 88, train_loss: 0.7947, test_loss: 0.9941, test_f1: 0.5775
 epoch: 89, train_loss: 0.8051, test_loss: 0.9783, test_f1: 0.5855
 epoch: 90, train_loss: 0.7807, test_loss: 0.9843, test_f1: 0.5758
 epoch: 91, train_loss: 0.7977, test_loss: 0.9924, test_f1: 0.5847
 epoch: 92, train_loss: 0.8039, test_loss: 0.9712, test_f1: 0.5653
 epoch: 93, train_loss: 0.8001, test_loss: 0.9844, test_f1: 0.5935
 epoch: 94, train_loss: 0.7870, test_loss: 0.9665, test_f1: 0.5863
 epoch: 95, train_loss: 0.7863, test_loss: 0.9877, test_f1: 0.5627
 epoch: 96, train_loss: 0.7856, test_loss: 0.9788, test_f1: 0.5760
 epoch: 97, train_loss: 0.7909, test_loss: 1.0004, test_f1: 0.5598
 epoch: 98, train_loss: 0.7889, test_loss: 0.9650, test_f1: 0.5820
 epoch: 99, train_loss: 0.7830, test_loss: 0.9883, test_f1: 0.5748
##################ITERATION #5 ****************************************
 epoch: 0, train_loss: 1.5236, test_loss: 1.6326, test_f1: 0.0507
 epoch: 1, train_loss: 1.2734, test_loss: 1.5301, test_f1: 0.0507
 epoch: 2, train_loss: 1.1937, test_loss: 1.3975, test_f1: 0.2371
 epoch: 3, train_loss: 1.1535, test_loss: 1.3617, test_f1: 0.2371
 epoch: 4, train_loss: 1.0948, test_loss: 1.2694, test_f1: 0.2510
 epoch: 5, train_loss: 1.0924, test_loss: 1.1774, test_f1: 0.3496
 epoch: 6, train_loss: 1.0588, test_loss: 1.1247, test_f1: 0.4292
 epoch: 7, train_loss: 1.0414, test_loss: 1.1100, test_f1: 0.4281
 epoch: 8, train_loss: 1.0290, test_loss: 1.1024, test_f1: 0.4351
 epoch: 9, train_loss: 1.0288, test_loss: 1.0941, test_f1: 0.4295
 epoch: 10, train_loss: 1.0087, test_loss: 1.0813, test_f1: 0.4299
 epoch: 11, train_loss: 1.0128, test_loss: 1.0741, test_f1: 0.4438
 epoch: 12, train_loss: 0.9998, test_loss: 1.0716, test_f1: 0.4691
 epoch: 13, train_loss: 0.9920, test_loss: 1.0725, test_f1: 0.4765
 epoch: 14, train_loss: 0.9862, test_loss: 1.0648, test_f1: 0.4728
 epoch: 15, train_loss: 0.9807, test_loss: 1.0615, test_f1: 0.4774
 epoch: 16, train_loss: 0.9895, test_loss: 1.0858, test_f1: 0.4957
 epoch: 17, train_loss: 0.9654, test_loss: 1.0565, test_f1: 0.4841
 epoch: 18, train_loss: 0.9681, test_loss: 1.0503, test_f1: 0.5257
 epoch: 19, train_loss: 0.9569, test_loss: 1.0384, test_f1: 0.5160
 epoch: 20, train_loss: 0.9491, test_loss: 1.0386, test_f1: 0.5092
 epoch: 21, train_loss: 0.9402, test_loss: 1.0364, test_f1: 0.5139
 epoch: 22, train_loss: 0.9457, test_loss: 1.0333, test_f1: 0.5195
 epoch: 23, train_loss: 0.9368, test_loss: 1.0226, test_f1: 0.5129
 epoch: 24, train_loss: 0.9248, test_loss: 1.0387, test_f1: 0.5141
 epoch: 25, train_loss: 0.9253, test_loss: 1.0247, test_f1: 0.5401
 epoch: 26, train_loss: 0.9218, test_loss: 1.0220, test_f1: 0.5456
 epoch: 27, train_loss: 0.9108, test_loss: 1.0171, test_f1: 0.5364
 epoch: 28, train_loss: 0.8992, test_loss: 1.0124, test_f1: 0.5197
 epoch: 29, train_loss: 0.9097, test_loss: 1.0162, test_f1: 0.5299
 epoch: 30, train_loss: 0.8898, test_loss: 1.0126, test_f1: 0.5184
 epoch: 31, train_loss: 0.9013, test_loss: 1.0148, test_f1: 0.5207
 epoch: 32, train_loss: 0.8967, test_loss: 1.0236, test_f1: 0.5301
 epoch: 33, train_loss: 0.8970, test_loss: 1.0426, test_f1: 0.5250
 epoch: 34, train_loss: 0.9037, test_loss: 1.0184, test_f1: 0.5066
 epoch: 35, train_loss: 0.8822, test_loss: 1.0536, test_f1: 0.5080
 epoch: 36, train_loss: 0.8803, test_loss: 1.0175, test_f1: 0.5186
 epoch: 37, train_loss: 0.8799, test_loss: 1.0189, test_f1: 0.5250
 epoch: 38, train_loss: 0.8808, test_loss: 1.0169, test_f1: 0.5236
 epoch: 39, train_loss: 0.8717, test_loss: 1.0042, test_f1: 0.5329
 epoch: 40, train_loss: 0.8600, test_loss: 1.0244, test_f1: 0.5413
 epoch: 41, train_loss: 0.8710, test_loss: 1.0241, test_f1: 0.5400
 epoch: 42, train_loss: 0.8682, test_loss: 1.0174, test_f1: 0.5124
 epoch: 43, train_loss: 0.8683, test_loss: 1.0191, test_f1: 0.5305
 epoch: 44, train_loss: 0.8444, test_loss: 1.0077, test_f1: 0.5356
 epoch: 45, train_loss: 0.8513, test_loss: 1.0543, test_f1: 0.5179
 epoch: 46, train_loss: 0.8459, test_loss: 0.9939, test_f1: 0.5356
 epoch: 47, train_loss: 0.8564, test_loss: 1.0313, test_f1: 0.5517
 epoch: 48, train_loss: 0.8302, test_loss: 1.0759, test_f1: 0.5064
 epoch: 49, train_loss: 0.8315, test_loss: 1.0129, test_f1: 0.5092
 epoch: 50, train_loss: 0.8326, test_loss: 1.0326, test_f1: 0.5362
 epoch: 51, train_loss: 0.8254, test_loss: 1.0828, test_f1: 0.5329
 epoch: 52, train_loss: 0.8339, test_loss: 1.0177, test_f1: 0.5042
 epoch: 53, train_loss: 0.8181, test_loss: 1.0472, test_f1: 0.5185
 epoch: 54, train_loss: 0.8126, test_loss: 1.0207, test_f1: 0.5393
 epoch: 55, train_loss: 0.8143, test_loss: 1.0346, test_f1: 0.5276
 epoch: 56, train_loss: 0.8098, test_loss: 1.0335, test_f1: 0.5363
 epoch: 57, train_loss: 0.8195, test_loss: 1.0109, test_f1: 0.5448
 epoch: 58, train_loss: 0.8169, test_loss: 1.0096, test_f1: 0.5389
 epoch: 59, train_loss: 0.8094, test_loss: 1.0282, test_f1: 0.5463
 epoch: 60, train_loss: 0.7958, test_loss: 1.0154, test_f1: 0.5331
 epoch: 61, train_loss: 0.7995, test_loss: 1.0018, test_f1: 0.5586
 epoch: 62, train_loss: 0.8002, test_loss: 0.9940, test_f1: 0.5446
 epoch: 63, train_loss: 0.8032, test_loss: 1.0443, test_f1: 0.5440
 epoch: 64, train_loss: 0.7902, test_loss: 1.0082, test_f1: 0.5566
 epoch: 65, train_loss: 0.7988, test_loss: 1.0117, test_f1: 0.5427
 epoch: 66, train_loss: 0.7825, test_loss: 1.0618, test_f1: 0.5349
 epoch: 67, train_loss: 0.7763, test_loss: 0.9830, test_f1: 0.5576
 epoch: 68, train_loss: 0.7646, test_loss: 0.9867, test_f1: 0.5646
 epoch: 69, train_loss: 0.7821, test_loss: 1.0284, test_f1: 0.5526
 epoch: 70, train_loss: 0.7840, test_loss: 1.0027, test_f1: 0.5408
 epoch: 71, train_loss: 0.7912, test_loss: 1.0301, test_f1: 0.5400
 epoch: 72, train_loss: 0.7800, test_loss: 1.0418, test_f1: 0.5303
 epoch: 73, train_loss: 0.7782, test_loss: 1.0317, test_f1: 0.5405
 epoch: 74, train_loss: 0.7658, test_loss: 1.0226, test_f1: 0.5472
 epoch: 75, train_loss: 0.7628, test_loss: 1.0068, test_f1: 0.5466
 epoch: 76, train_loss: 0.7793, test_loss: 1.0580, test_f1: 0.5207
 epoch: 77, train_loss: 0.7712, test_loss: 0.9985, test_f1: 0.5406
 epoch: 78, train_loss: 0.7553, test_loss: 1.0098, test_f1: 0.5604
 epoch: 79, train_loss: 0.7605, test_loss: 1.0321, test_f1: 0.5425
 epoch: 80, train_loss: 0.7593, test_loss: 1.0191, test_f1: 0.5474
 epoch: 81, train_loss: 0.7664, test_loss: 1.0187, test_f1: 0.5362
 epoch: 82, train_loss: 0.7537, test_loss: 1.0331, test_f1: 0.5289
 epoch: 83, train_loss: 0.7583, test_loss: 1.0503, test_f1: 0.5444
 epoch: 84, train_loss: 0.7551, test_loss: 1.0365, test_f1: 0.5505
 epoch: 85, train_loss: 0.7489, test_loss: 1.0006, test_f1: 0.5400
 epoch: 86, train_loss: 0.7694, test_loss: 1.0227, test_f1: 0.5426
 epoch: 87, train_loss: 0.7577, test_loss: 1.0695, test_f1: 0.5249
 epoch: 88, train_loss: 0.7549, test_loss: 1.0264, test_f1: 0.5487
 epoch: 89, train_loss: 0.7383, test_loss: 1.0330, test_f1: 0.5572
 epoch: 90, train_loss: 0.7367, test_loss: 1.0499, test_f1: 0.5544
 epoch: 91, train_loss: 0.7355, test_loss: 1.0743, test_f1: 0.5205
 epoch: 92, train_loss: 0.7573, test_loss: 1.0515, test_f1: 0.5316
 epoch: 93, train_loss: 0.7465, test_loss: 1.0244, test_f1: 0.5407
 epoch: 94, train_loss: 0.7544, test_loss: 1.0359, test_f1: 0.5274
 epoch: 95, train_loss: 0.7357, test_loss: 1.0310, test_f1: 0.5398
 epoch: 96, train_loss: 0.7425, test_loss: 1.0789, test_f1: 0.5494
 epoch: 97, train_loss: 0.7224, test_loss: 1.0662, test_f1: 0.5344
 epoch: 98, train_loss: 0.7342, test_loss: 1.0643, test_f1: 0.5419
 epoch: 99, train_loss: 0.7317, test_loss: 1.0582, test_f1: 0.5356
##################ITERATION #6 ****************************************
 epoch: 0, train_loss: 1.3110, test_loss: 1.3374, test_f1: 0.2281
 epoch: 1, train_loss: 1.1880, test_loss: 1.3518, test_f1: 0.2281
 epoch: 2, train_loss: 1.1422, test_loss: 1.3800, test_f1: 0.2823
 epoch: 3, train_loss: 1.1110, test_loss: 1.3171, test_f1: 0.2455
 epoch: 4, train_loss: 1.0843, test_loss: 1.1967, test_f1: 0.3671
 epoch: 5, train_loss: 1.0620, test_loss: 1.1457, test_f1: 0.4638
 epoch: 6, train_loss: 1.0527, test_loss: 1.1129, test_f1: 0.4919
 epoch: 7, train_loss: 1.0267, test_loss: 1.1012, test_f1: 0.4773
 epoch: 8, train_loss: 1.0425, test_loss: 1.0958, test_f1: 0.4818
 epoch: 9, train_loss: 1.0080, test_loss: 1.1029, test_f1: 0.4984
 epoch: 10, train_loss: 1.0017, test_loss: 1.0804, test_f1: 0.4879
 epoch: 11, train_loss: 0.9942, test_loss: 1.0781, test_f1: 0.4955
 epoch: 12, train_loss: 0.9855, test_loss: 1.0620, test_f1: 0.5198
 epoch: 13, train_loss: 0.9799, test_loss: 1.0521, test_f1: 0.5177
 epoch: 14, train_loss: 0.9785, test_loss: 1.0417, test_f1: 0.5241
 epoch: 15, train_loss: 0.9683, test_loss: 1.0510, test_f1: 0.5058
 epoch: 16, train_loss: 0.9753, test_loss: 1.0570, test_f1: 0.5004
 epoch: 17, train_loss: 0.9563, test_loss: 1.0543, test_f1: 0.5233
 epoch: 18, train_loss: 0.9687, test_loss: 1.0347, test_f1: 0.5249
 epoch: 19, train_loss: 0.9683, test_loss: 1.0332, test_f1: 0.5184
 epoch: 20, train_loss: 0.9701, test_loss: 1.0319, test_f1: 0.5131
 epoch: 21, train_loss: 0.9486, test_loss: 1.0273, test_f1: 0.5043
 epoch: 22, train_loss: 0.9453, test_loss: 1.0193, test_f1: 0.5154
 epoch: 23, train_loss: 0.9399, test_loss: 1.0281, test_f1: 0.5209
 epoch: 24, train_loss: 0.9343, test_loss: 1.0235, test_f1: 0.5130
 epoch: 25, train_loss: 0.9378, test_loss: 1.0314, test_f1: 0.5166
 epoch: 26, train_loss: 0.9314, test_loss: 1.0309, test_f1: 0.5202
 epoch: 27, train_loss: 0.9374, test_loss: 1.0173, test_f1: 0.5256
 epoch: 28, train_loss: 0.9379, test_loss: 1.0238, test_f1: 0.5494
 epoch: 29, train_loss: 0.9322, test_loss: 1.0333, test_f1: 0.5143
 epoch: 30, train_loss: 0.9186, test_loss: 1.0160, test_f1: 0.5374
 epoch: 31, train_loss: 0.9175, test_loss: 1.0128, test_f1: 0.5382
 epoch: 32, train_loss: 0.9167, test_loss: 1.0051, test_f1: 0.5341
 epoch: 33, train_loss: 0.9096, test_loss: 1.0028, test_f1: 0.5295
 epoch: 34, train_loss: 0.9008, test_loss: 1.0004, test_f1: 0.5338
 epoch: 35, train_loss: 0.9129, test_loss: 1.0078, test_f1: 0.5452
 epoch: 36, train_loss: 0.8927, test_loss: 1.0164, test_f1: 0.5364
 epoch: 37, train_loss: 0.9024, test_loss: 1.0020, test_f1: 0.5592
 epoch: 38, train_loss: 0.8924, test_loss: 1.0097, test_f1: 0.5423
 epoch: 39, train_loss: 0.9024, test_loss: 1.0009, test_f1: 0.5518
 epoch: 40, train_loss: 0.8865, test_loss: 1.0097, test_f1: 0.5415
 epoch: 41, train_loss: 0.8908, test_loss: 0.9998, test_f1: 0.5360
 epoch: 42, train_loss: 0.8978, test_loss: 1.0002, test_f1: 0.5456
 epoch: 43, train_loss: 0.8847, test_loss: 0.9977, test_f1: 0.5486
 epoch: 44, train_loss: 0.8729, test_loss: 1.0002, test_f1: 0.5481
 epoch: 45, train_loss: 0.8757, test_loss: 0.9994, test_f1: 0.5378
 epoch: 46, train_loss: 0.8731, test_loss: 1.0126, test_f1: 0.5418
 epoch: 47, train_loss: 0.8745, test_loss: 0.9915, test_f1: 0.5555
 epoch: 48, train_loss: 0.8660, test_loss: 0.9985, test_f1: 0.5499
 epoch: 49, train_loss: 0.8583, test_loss: 1.0143, test_f1: 0.5594
 epoch: 50, train_loss: 0.8568, test_loss: 1.0026, test_f1: 0.5536
 epoch: 51, train_loss: 0.8614, test_loss: 1.0022, test_f1: 0.5548
 epoch: 52, train_loss: 0.8443, test_loss: 0.9996, test_f1: 0.5615
 epoch: 53, train_loss: 0.8348, test_loss: 0.9908, test_f1: 0.5463
 epoch: 54, train_loss: 0.8387, test_loss: 0.9911, test_f1: 0.5576
 epoch: 55, train_loss: 0.8350, test_loss: 0.9980, test_f1: 0.5765
 epoch: 56, train_loss: 0.8495, test_loss: 0.9896, test_f1: 0.5612
 epoch: 57, train_loss: 0.8390, test_loss: 0.9918, test_f1: 0.5444
 epoch: 58, train_loss: 0.8395, test_loss: 0.9948, test_f1: 0.5585
 epoch: 59, train_loss: 0.8407, test_loss: 0.9929, test_f1: 0.5702
 epoch: 60, train_loss: 0.8361, test_loss: 0.9896, test_f1: 0.5609
 epoch: 61, train_loss: 0.8223, test_loss: 0.9955, test_f1: 0.5617
 epoch: 62, train_loss: 0.8260, test_loss: 0.9905, test_f1: 0.5610
 epoch: 63, train_loss: 0.8313, test_loss: 0.9885, test_f1: 0.5644
 epoch: 64, train_loss: 0.8301, test_loss: 0.9941, test_f1: 0.5695
 epoch: 65, train_loss: 0.8325, test_loss: 0.9951, test_f1: 0.5705
 epoch: 66, train_loss: 0.8226, test_loss: 0.9846, test_f1: 0.5703
 epoch: 67, train_loss: 0.8234, test_loss: 0.9907, test_f1: 0.5784
 epoch: 68, train_loss: 0.8296, test_loss: 1.0045, test_f1: 0.5729
 epoch: 69, train_loss: 0.8215, test_loss: 0.9856, test_f1: 0.5731
 epoch: 70, train_loss: 0.8285, test_loss: 0.9804, test_f1: 0.5822
 epoch: 71, train_loss: 0.8160, test_loss: 0.9809, test_f1: 0.5798
 epoch: 72, train_loss: 0.8091, test_loss: 0.9781, test_f1: 0.5585
 epoch: 73, train_loss: 0.8083, test_loss: 0.9805, test_f1: 0.5682
 epoch: 74, train_loss: 0.8041, test_loss: 0.9881, test_f1: 0.5699
 epoch: 75, train_loss: 0.8178, test_loss: 0.9865, test_f1: 0.5672
 epoch: 76, train_loss: 0.8092, test_loss: 0.9830, test_f1: 0.5823
 epoch: 77, train_loss: 0.8245, test_loss: 0.9860, test_f1: 0.5727
 epoch: 78, train_loss: 0.7975, test_loss: 0.9881, test_f1: 0.5657
 epoch: 79, train_loss: 0.7973, test_loss: 0.9907, test_f1: 0.5761
 epoch: 80, train_loss: 0.8117, test_loss: 0.9991, test_f1: 0.5487
 epoch: 81, train_loss: 0.7865, test_loss: 1.0006, test_f1: 0.5586
 epoch: 82, train_loss: 0.7957, test_loss: 0.9886, test_f1: 0.5584
 epoch: 83, train_loss: 0.7890, test_loss: 0.9871, test_f1: 0.5626
 epoch: 84, train_loss: 0.7825, test_loss: 0.9874, test_f1: 0.5647
 epoch: 85, train_loss: 0.7876, test_loss: 0.9878, test_f1: 0.5606
 epoch: 86, train_loss: 0.7949, test_loss: 1.0080, test_f1: 0.5658
 epoch: 87, train_loss: 0.7898, test_loss: 0.9949, test_f1: 0.5837
 epoch: 88, train_loss: 0.7809, test_loss: 0.9846, test_f1: 0.5690
 epoch: 89, train_loss: 0.7935, test_loss: 0.9920, test_f1: 0.5611
 epoch: 90, train_loss: 0.7724, test_loss: 1.0114, test_f1: 0.5650
 epoch: 91, train_loss: 0.7854, test_loss: 1.0043, test_f1: 0.5798
 epoch: 92, train_loss: 0.7808, test_loss: 1.0112, test_f1: 0.5636
 epoch: 93, train_loss: 0.7820, test_loss: 0.9995, test_f1: 0.5600
 epoch: 94, train_loss: 0.7746, test_loss: 1.0046, test_f1: 0.5735
 epoch: 95, train_loss: 0.7778, test_loss: 1.0103, test_f1: 0.5681
 epoch: 96, train_loss: 0.7771, test_loss: 1.0102, test_f1: 0.5545
 epoch: 97, train_loss: 0.7858, test_loss: 0.9985, test_f1: 0.5649
 epoch: 98, train_loss: 0.7735, test_loss: 0.9914, test_f1: 0.5739
 epoch: 99, train_loss: 0.7776, test_loss: 0.9963, test_f1: 0.5711
##################ITERATION #7 ****************************************
 epoch: 0, train_loss: 1.3447, test_loss: 1.3399, test_f1: 0.2281
 epoch: 1, train_loss: 1.1897, test_loss: 1.3536, test_f1: 0.2281
 epoch: 2, train_loss: 1.1412, test_loss: 1.2988, test_f1: 0.3092
 epoch: 3, train_loss: 1.1276, test_loss: 1.2213, test_f1: 0.3374
 epoch: 4, train_loss: 1.0933, test_loss: 1.1891, test_f1: 0.4133
 epoch: 5, train_loss: 1.0837, test_loss: 1.1618, test_f1: 0.4152
 epoch: 6, train_loss: 1.0656, test_loss: 1.1411, test_f1: 0.4273
 epoch: 7, train_loss: 1.0686, test_loss: 1.1330, test_f1: 0.4369
 epoch: 8, train_loss: 1.0482, test_loss: 1.1396, test_f1: 0.4301
 epoch: 9, train_loss: 1.0401, test_loss: 1.1312, test_f1: 0.4387
 epoch: 10, train_loss: 1.0373, test_loss: 1.1228, test_f1: 0.4394
 epoch: 11, train_loss: 1.0299, test_loss: 1.1288, test_f1: 0.4129
 epoch: 12, train_loss: 1.0266, test_loss: 1.1404, test_f1: 0.4033
 epoch: 13, train_loss: 1.0023, test_loss: 1.1313, test_f1: 0.4435
 epoch: 14, train_loss: 0.9961, test_loss: 1.1307, test_f1: 0.4281
 epoch: 15, train_loss: 0.9986, test_loss: 1.1163, test_f1: 0.4451
 epoch: 16, train_loss: 0.9966, test_loss: 1.1147, test_f1: 0.4502
 epoch: 17, train_loss: 0.9923, test_loss: 1.1151, test_f1: 0.4586
 epoch: 18, train_loss: 0.9681, test_loss: 1.0983, test_f1: 0.4680
 epoch: 19, train_loss: 0.9674, test_loss: 1.1171, test_f1: 0.4723
 epoch: 20, train_loss: 0.9594, test_loss: 1.1009, test_f1: 0.4845
 epoch: 21, train_loss: 0.9610, test_loss: 1.0791, test_f1: 0.5365
 epoch: 22, train_loss: 0.9547, test_loss: 1.0799, test_f1: 0.5278
 epoch: 23, train_loss: 0.9485, test_loss: 1.0721, test_f1: 0.5092
 epoch: 24, train_loss: 0.9379, test_loss: 1.0871, test_f1: 0.5014
 epoch: 25, train_loss: 0.9400, test_loss: 1.0627, test_f1: 0.5258
 epoch: 26, train_loss: 0.9196, test_loss: 1.0557, test_f1: 0.5457
 epoch: 27, train_loss: 0.9208, test_loss: 1.0522, test_f1: 0.5368
 epoch: 28, train_loss: 0.9306, test_loss: 1.0405, test_f1: 0.5486
 epoch: 29, train_loss: 0.9225, test_loss: 1.0479, test_f1: 0.5527
 epoch: 30, train_loss: 0.9058, test_loss: 1.0290, test_f1: 0.5473
 epoch: 31, train_loss: 0.9047, test_loss: 1.0448, test_f1: 0.5532
 epoch: 32, train_loss: 0.9130, test_loss: 1.0262, test_f1: 0.5674
 epoch: 33, train_loss: 0.9044, test_loss: 1.0054, test_f1: 0.5739
 epoch: 34, train_loss: 0.8983, test_loss: 1.0019, test_f1: 0.5641
 epoch: 35, train_loss: 0.8973, test_loss: 1.0313, test_f1: 0.5563
 epoch: 36, train_loss: 0.8872, test_loss: 1.0272, test_f1: 0.5683
 epoch: 37, train_loss: 0.8742, test_loss: 1.0333, test_f1: 0.5545
 epoch: 38, train_loss: 0.8726, test_loss: 1.0136, test_f1: 0.5471
 epoch: 39, train_loss: 0.8902, test_loss: 1.0118, test_f1: 0.5592
 epoch: 40, train_loss: 0.8700, test_loss: 0.9982, test_f1: 0.5591
 epoch: 41, train_loss: 0.8628, test_loss: 1.0272, test_f1: 0.5332
 epoch: 42, train_loss: 0.8544, test_loss: 1.0431, test_f1: 0.5550
 epoch: 43, train_loss: 0.8522, test_loss: 1.0176, test_f1: 0.5551
 epoch: 44, train_loss: 0.8543, test_loss: 1.0031, test_f1: 0.5598
 epoch: 45, train_loss: 0.8503, test_loss: 1.0125, test_f1: 0.5344
 epoch: 46, train_loss: 0.8450, test_loss: 1.0072, test_f1: 0.5559
 epoch: 47, train_loss: 0.8374, test_loss: 1.0976, test_f1: 0.5502
 epoch: 48, train_loss: 0.8420, test_loss: 1.0027, test_f1: 0.5523
 epoch: 49, train_loss: 0.8214, test_loss: 1.0648, test_f1: 0.5617
 epoch: 50, train_loss: 0.8250, test_loss: 1.0311, test_f1: 0.5583
 epoch: 51, train_loss: 0.8242, test_loss: 1.0137, test_f1: 0.5663
 epoch: 52, train_loss: 0.8154, test_loss: 0.9984, test_f1: 0.5653
 epoch: 53, train_loss: 0.8095, test_loss: 1.0001, test_f1: 0.5703
 epoch: 54, train_loss: 0.8229, test_loss: 0.9829, test_f1: 0.5780
 epoch: 55, train_loss: 0.7952, test_loss: 1.0045, test_f1: 0.5698
 epoch: 56, train_loss: 0.7972, test_loss: 1.0005, test_f1: 0.5882
 epoch: 57, train_loss: 0.7982, test_loss: 0.9910, test_f1: 0.5880
 epoch: 58, train_loss: 0.7859, test_loss: 1.0041, test_f1: 0.5861
 epoch: 59, train_loss: 0.7856, test_loss: 1.0093, test_f1: 0.5730
 epoch: 60, train_loss: 0.7914, test_loss: 1.0194, test_f1: 0.5657
 epoch: 61, train_loss: 0.7860, test_loss: 1.0622, test_f1: 0.5657
 epoch: 62, train_loss: 0.7693, test_loss: 1.0255, test_f1: 0.5737
 epoch: 63, train_loss: 0.7811, test_loss: 1.0057, test_f1: 0.5852
 epoch: 64, train_loss: 0.7863, test_loss: 0.9997, test_f1: 0.5936
 epoch: 65, train_loss: 0.7669, test_loss: 1.0076, test_f1: 0.5731
 epoch: 66, train_loss: 0.7787, test_loss: 1.0131, test_f1: 0.5891
 epoch: 67, train_loss: 0.7657, test_loss: 1.0130, test_f1: 0.5672
 epoch: 68, train_loss: 0.7825, test_loss: 1.0054, test_f1: 0.5813
 epoch: 69, train_loss: 0.7678, test_loss: 1.0052, test_f1: 0.5908
 epoch: 70, train_loss: 0.7677, test_loss: 0.9965, test_f1: 0.5838
 epoch: 71, train_loss: 0.7675, test_loss: 1.0406, test_f1: 0.5791
 epoch: 72, train_loss: 0.7547, test_loss: 1.0463, test_f1: 0.5719
 epoch: 73, train_loss: 0.7629, test_loss: 1.0296, test_f1: 0.5919
 epoch: 74, train_loss: 0.7547, test_loss: 1.0146, test_f1: 0.5783
 epoch: 75, train_loss: 0.7641, test_loss: 1.0089, test_f1: 0.5772
 epoch: 76, train_loss: 0.7620, test_loss: 0.9838, test_f1: 0.5998
 epoch: 77, train_loss: 0.7533, test_loss: 1.0416, test_f1: 0.5621
 epoch: 78, train_loss: 0.7603, test_loss: 1.0086, test_f1: 0.5864
 epoch: 79, train_loss: 0.7299, test_loss: 1.0107, test_f1: 0.6108
 epoch: 80, train_loss: 0.7286, test_loss: 1.0253, test_f1: 0.5867
 epoch: 81, train_loss: 0.7426, test_loss: 1.0301, test_f1: 0.5789
 epoch: 82, train_loss: 0.7379, test_loss: 1.0853, test_f1: 0.5556
 epoch: 83, train_loss: 0.7508, test_loss: 1.0759, test_f1: 0.5700
 epoch: 84, train_loss: 0.7360, test_loss: 1.0532, test_f1: 0.5654
 epoch: 85, train_loss: 0.7294, test_loss: 1.0425, test_f1: 0.5614
 epoch: 86, train_loss: 0.7129, test_loss: 1.0143, test_f1: 0.5892
 epoch: 87, train_loss: 0.7320, test_loss: 1.0547, test_f1: 0.5635
 epoch: 88, train_loss: 0.7078, test_loss: 1.1033, test_f1: 0.5771
 epoch: 89, train_loss: 0.7222, test_loss: 1.1195, test_f1: 0.5691
 epoch: 90, train_loss: 0.7064, test_loss: 1.0887, test_f1: 0.5614
 epoch: 91, train_loss: 0.7438, test_loss: 1.0971, test_f1: 0.5835
 epoch: 92, train_loss: 0.7142, test_loss: 1.0824, test_f1: 0.5473
 epoch: 93, train_loss: 0.7295, test_loss: 1.0056, test_f1: 0.6116
 epoch: 94, train_loss: 0.6938, test_loss: 1.0075, test_f1: 0.5898
 epoch: 95, train_loss: 0.7080, test_loss: 1.0537, test_f1: 0.5851
 epoch: 96, train_loss: 0.7105, test_loss: 1.0475, test_f1: 0.5819
 epoch: 97, train_loss: 0.7172, test_loss: 1.0997, test_f1: 0.5689
 epoch: 98, train_loss: 0.7056, test_loss: 1.1379, test_f1: 0.5924
 epoch: 99, train_loss: 0.6956, test_loss: 1.0560, test_f1: 0.5730
##################ITERATION #8 ****************************************
 epoch: 0, train_loss: 1.4123, test_loss: 1.4325, test_f1: 0.3232
 epoch: 1, train_loss: 1.2114, test_loss: 1.4222, test_f1: 0.3067
 epoch: 2, train_loss: 1.1716, test_loss: 1.3712, test_f1: 0.3259
 epoch: 3, train_loss: 1.1153, test_loss: 1.3204, test_f1: 0.3349
 epoch: 4, train_loss: 1.1027, test_loss: 1.2398, test_f1: 0.3382
 epoch: 5, train_loss: 1.0923, test_loss: 1.1703, test_f1: 0.3988
 epoch: 6, train_loss: 1.0739, test_loss: 1.1473, test_f1: 0.4253
 epoch: 7, train_loss: 1.0609, test_loss: 1.1333, test_f1: 0.4549
 epoch: 8, train_loss: 1.0455, test_loss: 1.1211, test_f1: 0.4564
 epoch: 9, train_loss: 1.0235, test_loss: 1.1066, test_f1: 0.4819
 epoch: 10, train_loss: 1.0203, test_loss: 1.1097, test_f1: 0.4752
 epoch: 11, train_loss: 0.9971, test_loss: 1.1139, test_f1: 0.4765
 epoch: 12, train_loss: 1.0061, test_loss: 1.0927, test_f1: 0.4957
 epoch: 13, train_loss: 1.0056, test_loss: 1.0939, test_f1: 0.4760
 epoch: 14, train_loss: 0.9866, test_loss: 1.0911, test_f1: 0.4785
 epoch: 15, train_loss: 0.9748, test_loss: 1.0991, test_f1: 0.5013
 epoch: 16, train_loss: 0.9733, test_loss: 1.0784, test_f1: 0.4855
 epoch: 17, train_loss: 0.9649, test_loss: 1.0857, test_f1: 0.4849
 epoch: 18, train_loss: 0.9728, test_loss: 1.0876, test_f1: 0.4879
 epoch: 19, train_loss: 0.9678, test_loss: 1.0770, test_f1: 0.5052
 epoch: 20, train_loss: 0.9396, test_loss: 1.0609, test_f1: 0.5063
 epoch: 21, train_loss: 0.9449, test_loss: 1.0580, test_f1: 0.5020
 epoch: 22, train_loss: 0.9343, test_loss: 1.0553, test_f1: 0.5199
 epoch: 23, train_loss: 0.9279, test_loss: 1.0364, test_f1: 0.5185
 epoch: 24, train_loss: 0.9247, test_loss: 1.0527, test_f1: 0.5127
 epoch: 25, train_loss: 0.9102, test_loss: 1.0388, test_f1: 0.5193
 epoch: 26, train_loss: 0.9241, test_loss: 1.0403, test_f1: 0.5179
 epoch: 27, train_loss: 0.9184, test_loss: 1.0283, test_f1: 0.5300
 epoch: 28, train_loss: 0.9144, test_loss: 1.0151, test_f1: 0.5375
 epoch: 29, train_loss: 0.9060, test_loss: 1.0241, test_f1: 0.5432
 epoch: 30, train_loss: 0.9145, test_loss: 1.0290, test_f1: 0.5202
 epoch: 31, train_loss: 0.9025, test_loss: 1.0217, test_f1: 0.5380
 epoch: 32, train_loss: 0.8929, test_loss: 1.0017, test_f1: 0.5461
 epoch: 33, train_loss: 0.8859, test_loss: 1.0045, test_f1: 0.5410
 epoch: 34, train_loss: 0.8975, test_loss: 1.0105, test_f1: 0.5514
 epoch: 35, train_loss: 0.8718, test_loss: 0.9915, test_f1: 0.5549
 epoch: 36, train_loss: 0.8772, test_loss: 0.9954, test_f1: 0.5394
 epoch: 37, train_loss: 0.8695, test_loss: 1.0005, test_f1: 0.5570
 epoch: 38, train_loss: 0.8847, test_loss: 0.9954, test_f1: 0.5480
 epoch: 39, train_loss: 0.8664, test_loss: 0.9863, test_f1: 0.5396
 epoch: 40, train_loss: 0.8448, test_loss: 1.0005, test_f1: 0.5420
 epoch: 41, train_loss: 0.8592, test_loss: 1.0003, test_f1: 0.5401
 epoch: 42, train_loss: 0.8500, test_loss: 1.0044, test_f1: 0.5543
 epoch: 43, train_loss: 0.8389, test_loss: 0.9775, test_f1: 0.5746
 epoch: 44, train_loss: 0.8366, test_loss: 0.9881, test_f1: 0.5565
 epoch: 45, train_loss: 0.8397, test_loss: 0.9971, test_f1: 0.5582
 epoch: 46, train_loss: 0.8397, test_loss: 1.0130, test_f1: 0.5215
 epoch: 47, train_loss: 0.8460, test_loss: 0.9852, test_f1: 0.5652
 epoch: 48, train_loss: 0.8125, test_loss: 0.9958, test_f1: 0.5747
 epoch: 49, train_loss: 0.8216, test_loss: 0.9793, test_f1: 0.6021
 epoch: 50, train_loss: 0.8004, test_loss: 0.9823, test_f1: 0.5310
 epoch: 51, train_loss: 0.8130, test_loss: 0.9598, test_f1: 0.5837
 epoch: 52, train_loss: 0.8064, test_loss: 0.9615, test_f1: 0.5906
 epoch: 53, train_loss: 0.8085, test_loss: 0.9718, test_f1: 0.5934
 epoch: 54, train_loss: 0.7961, test_loss: 0.9633, test_f1: 0.5693
 epoch: 55, train_loss: 0.8137, test_loss: 0.9719, test_f1: 0.5954
 epoch: 56, train_loss: 0.7887, test_loss: 0.9614, test_f1: 0.5980
 epoch: 57, train_loss: 0.7983, test_loss: 0.9750, test_f1: 0.5895
 epoch: 58, train_loss: 0.7732, test_loss: 0.9659, test_f1: 0.5598
 epoch: 59, train_loss: 0.7863, test_loss: 0.9689, test_f1: 0.5968
 epoch: 60, train_loss: 0.7751, test_loss: 0.9668, test_f1: 0.5956
 epoch: 61, train_loss: 0.7855, test_loss: 0.9690, test_f1: 0.5912
 epoch: 62, train_loss: 0.7778, test_loss: 0.9557, test_f1: 0.6041
 epoch: 63, train_loss: 0.7702, test_loss: 0.9645, test_f1: 0.5885
 epoch: 64, train_loss: 0.7716, test_loss: 0.9615, test_f1: 0.5985
 epoch: 65, train_loss: 0.7794, test_loss: 0.9452, test_f1: 0.5994
 epoch: 66, train_loss: 0.7838, test_loss: 0.9578, test_f1: 0.6165
 epoch: 67, train_loss: 0.7672, test_loss: 0.9495, test_f1: 0.5876
 epoch: 68, train_loss: 0.7589, test_loss: 0.9492, test_f1: 0.5943
 epoch: 69, train_loss: 0.7593, test_loss: 0.9636, test_f1: 0.6255
 epoch: 70, train_loss: 0.7645, test_loss: 0.9509, test_f1: 0.6073
 epoch: 71, train_loss: 0.7729, test_loss: 0.9634, test_f1: 0.5930
 epoch: 72, train_loss: 0.7624, test_loss: 0.9583, test_f1: 0.5816
 epoch: 73, train_loss: 0.7625, test_loss: 0.9671, test_f1: 0.5670
 epoch: 74, train_loss: 0.7599, test_loss: 0.9689, test_f1: 0.5927
 epoch: 75, train_loss: 0.7353, test_loss: 0.9505, test_f1: 0.6120
 epoch: 76, train_loss: 0.7662, test_loss: 0.9664, test_f1: 0.6181
 epoch: 77, train_loss: 0.7522, test_loss: 0.9653, test_f1: 0.5947
 epoch: 78, train_loss: 0.7392, test_loss: 0.9867, test_f1: 0.5755
 epoch: 79, train_loss: 0.7291, test_loss: 0.9615, test_f1: 0.6193
 epoch: 80, train_loss: 0.7370, test_loss: 0.9795, test_f1: 0.5786
 epoch: 81, train_loss: 0.7620, test_loss: 0.9576, test_f1: 0.6018
 epoch: 82, train_loss: 0.7514, test_loss: 0.9525, test_f1: 0.6119
 epoch: 83, train_loss: 0.7487, test_loss: 0.9867, test_f1: 0.5816
 epoch: 84, train_loss: 0.7555, test_loss: 0.9671, test_f1: 0.5993
 epoch: 85, train_loss: 0.7352, test_loss: 0.9678, test_f1: 0.5950
 epoch: 86, train_loss: 0.7386, test_loss: 0.9534, test_f1: 0.6077
 epoch: 87, train_loss: 0.7175, test_loss: 0.9867, test_f1: 0.5966
 epoch: 88, train_loss: 0.7329, test_loss: 0.9503, test_f1: 0.5928
 epoch: 89, train_loss: 0.7420, test_loss: 0.9398, test_f1: 0.6103
 epoch: 90, train_loss: 0.7458, test_loss: 0.9511, test_f1: 0.6261
 epoch: 91, train_loss: 0.7206, test_loss: 0.9778, test_f1: 0.6042
 epoch: 92, train_loss: 0.7422, test_loss: 0.9612, test_f1: 0.6018
 epoch: 93, train_loss: 0.7251, test_loss: 0.9589, test_f1: 0.6223
 epoch: 94, train_loss: 0.7179, test_loss: 0.9842, test_f1: 0.5775
 epoch: 95, train_loss: 0.7224, test_loss: 0.9912, test_f1: 0.5830
 epoch: 96, train_loss: 0.7148, test_loss: 0.9759, test_f1: 0.6053
 epoch: 97, train_loss: 0.7157, test_loss: 0.9773, test_f1: 0.5974
 epoch: 98, train_loss: 0.7134, test_loss: 0.9661, test_f1: 0.6092
 epoch: 99, train_loss: 0.7165, test_loss: 0.9669, test_f1: 0.6032
##################ITERATION #9 ****************************************
 epoch: 0, train_loss: 1.2885, test_loss: 1.4327, test_f1: 0.2583
 epoch: 1, train_loss: 1.1464, test_loss: 1.3093, test_f1: 0.2281
 epoch: 2, train_loss: 1.0873, test_loss: 1.2035, test_f1: 0.2520
 epoch: 3, train_loss: 1.0746, test_loss: 1.1775, test_f1: 0.3992
 epoch: 4, train_loss: 1.0443, test_loss: 1.1559, test_f1: 0.4217
 epoch: 5, train_loss: 1.0354, test_loss: 1.1195, test_f1: 0.4853
 epoch: 6, train_loss: 1.0255, test_loss: 1.0887, test_f1: 0.5022
 epoch: 7, train_loss: 0.9976, test_loss: 1.0746, test_f1: 0.5084
 epoch: 8, train_loss: 1.0033, test_loss: 1.0533, test_f1: 0.5236
 epoch: 9, train_loss: 0.9715, test_loss: 1.0451, test_f1: 0.5325
 epoch: 10, train_loss: 0.9660, test_loss: 1.0484, test_f1: 0.5412
 epoch: 11, train_loss: 0.9723, test_loss: 1.0392, test_f1: 0.5453
 epoch: 12, train_loss: 0.9610, test_loss: 1.0246, test_f1: 0.5443
 epoch: 13, train_loss: 0.9378, test_loss: 1.0156, test_f1: 0.5446
 epoch: 14, train_loss: 0.9369, test_loss: 1.0120, test_f1: 0.5413
 epoch: 15, train_loss: 0.9251, test_loss: 1.0272, test_f1: 0.5308
 epoch: 16, train_loss: 0.9139, test_loss: 0.9976, test_f1: 0.5533
 epoch: 17, train_loss: 0.9164, test_loss: 1.0039, test_f1: 0.5629
 epoch: 18, train_loss: 0.8954, test_loss: 1.0413, test_f1: 0.5431
 epoch: 19, train_loss: 0.9073, test_loss: 1.0090, test_f1: 0.5474
 epoch: 20, train_loss: 0.8914, test_loss: 1.0295, test_f1: 0.5501
 epoch: 21, train_loss: 0.8871, test_loss: 1.0131, test_f1: 0.5324
 epoch: 22, train_loss: 0.8844, test_loss: 0.9999, test_f1: 0.5523
 epoch: 23, train_loss: 0.8804, test_loss: 1.0170, test_f1: 0.5492
 epoch: 24, train_loss: 0.8755, test_loss: 0.9778, test_f1: 0.5506
 epoch: 25, train_loss: 0.8726, test_loss: 0.9795, test_f1: 0.5555
 epoch: 26, train_loss: 0.8616, test_loss: 0.9983, test_f1: 0.5381
 epoch: 27, train_loss: 0.8584, test_loss: 1.0022, test_f1: 0.5341
 epoch: 28, train_loss: 0.8523, test_loss: 1.0018, test_f1: 0.5568
 epoch: 29, train_loss: 0.8423, test_loss: 0.9953, test_f1: 0.5343
 epoch: 30, train_loss: 0.8555, test_loss: 1.0194, test_f1: 0.5384
 epoch: 31, train_loss: 0.8298, test_loss: 0.9826, test_f1: 0.5566
 epoch: 32, train_loss: 0.8360, test_loss: 0.9724, test_f1: 0.5736
 epoch: 33, train_loss: 0.8246, test_loss: 0.9694, test_f1: 0.5913
 epoch: 34, train_loss: 0.8338, test_loss: 0.9934, test_f1: 0.5668
 epoch: 35, train_loss: 0.8369, test_loss: 1.0023, test_f1: 0.5547
 epoch: 36, train_loss: 0.8096, test_loss: 0.9690, test_f1: 0.5878
 epoch: 37, train_loss: 0.8078, test_loss: 0.9898, test_f1: 0.5651
 epoch: 38, train_loss: 0.8015, test_loss: 0.9810, test_f1: 0.5722
 epoch: 39, train_loss: 0.8182, test_loss: 0.9895, test_f1: 0.5535
 epoch: 40, train_loss: 0.8189, test_loss: 0.9680, test_f1: 0.5858
 epoch: 41, train_loss: 0.8086, test_loss: 0.9710, test_f1: 0.5801
 epoch: 42, train_loss: 0.8108, test_loss: 1.0384, test_f1: 0.5533
 epoch: 43, train_loss: 0.8001, test_loss: 0.9566, test_f1: 0.6001
 epoch: 44, train_loss: 0.7923, test_loss: 1.0885, test_f1: 0.5386
 epoch: 45, train_loss: 0.7858, test_loss: 0.9937, test_f1: 0.5499
 epoch: 46, train_loss: 0.7915, test_loss: 0.9254, test_f1: 0.5920
 epoch: 47, train_loss: 0.7870, test_loss: 0.9875, test_f1: 0.5692
 epoch: 48, train_loss: 0.7854, test_loss: 0.9634, test_f1: 0.5746
 epoch: 49, train_loss: 0.7719, test_loss: 0.9585, test_f1: 0.6032
 epoch: 50, train_loss: 0.7545, test_loss: 0.9517, test_f1: 0.5756
 epoch: 51, train_loss: 0.7659, test_loss: 0.9541, test_f1: 0.5823
 epoch: 52, train_loss: 0.7430, test_loss: 0.9756, test_f1: 0.5471
 epoch: 53, train_loss: 0.7348, test_loss: 0.9510, test_f1: 0.5789
 epoch: 54, train_loss: 0.7420, test_loss: 0.9507, test_f1: 0.5851
 epoch: 55, train_loss: 0.7434, test_loss: 0.9466, test_f1: 0.5938
 epoch: 56, train_loss: 0.7485, test_loss: 0.9721, test_f1: 0.5523
 epoch: 57, train_loss: 0.7477, test_loss: 0.9583, test_f1: 0.5454
 epoch: 58, train_loss: 0.7519, test_loss: 0.9770, test_f1: 0.5774
 epoch: 59, train_loss: 0.7480, test_loss: 0.9657, test_f1: 0.6042
 epoch: 60, train_loss: 0.7486, test_loss: 0.9720, test_f1: 0.5818
 epoch: 61, train_loss: 0.7475, test_loss: 0.9440, test_f1: 0.6120
 epoch: 62, train_loss: 0.7319, test_loss: 0.9963, test_f1: 0.6041
 epoch: 63, train_loss: 0.7313, test_loss: 0.9603, test_f1: 0.5833
 epoch: 64, train_loss: 0.7492, test_loss: 0.9730, test_f1: 0.5880
 epoch: 65, train_loss: 0.7327, test_loss: 0.9634, test_f1: 0.6022
 epoch: 66, train_loss: 0.7377, test_loss: 0.9705, test_f1: 0.5987
 epoch: 67, train_loss: 0.7189, test_loss: 0.9985, test_f1: 0.5663
 epoch: 68, train_loss: 0.7217, test_loss: 0.9379, test_f1: 0.5785
 epoch: 69, train_loss: 0.7243, test_loss: 0.9445, test_f1: 0.6114
 epoch: 70, train_loss: 0.7220, test_loss: 0.9433, test_f1: 0.5822
 epoch: 71, train_loss: 0.7097, test_loss: 0.9419, test_f1: 0.5899
 epoch: 72, train_loss: 0.7228, test_loss: 0.9639, test_f1: 0.5690
 epoch: 73, train_loss: 0.7204, test_loss: 0.9825, test_f1: 0.5397
 epoch: 74, train_loss: 0.6917, test_loss: 0.9553, test_f1: 0.5972
 epoch: 75, train_loss: 0.7110, test_loss: 0.9604, test_f1: 0.5888
 epoch: 76, train_loss: 0.7118, test_loss: 0.9564, test_f1: 0.6259
 epoch: 77, train_loss: 0.7338, test_loss: 0.9687, test_f1: 0.5665
 epoch: 78, train_loss: 0.6991, test_loss: 1.0158, test_f1: 0.5646
 epoch: 79, train_loss: 0.7034, test_loss: 0.9461, test_f1: 0.6012
 epoch: 80, train_loss: 0.7043, test_loss: 0.9679, test_f1: 0.5959
 epoch: 81, train_loss: 0.6975, test_loss: 0.9393, test_f1: 0.6239
 epoch: 82, train_loss: 0.7109, test_loss: 0.9499, test_f1: 0.5965
 epoch: 83, train_loss: 0.7283, test_loss: 1.0163, test_f1: 0.5793
 epoch: 84, train_loss: 0.7033, test_loss: 0.9672, test_f1: 0.6123
 epoch: 85, train_loss: 0.7045, test_loss: 0.9520, test_f1: 0.5981
 epoch: 86, train_loss: 0.6933, test_loss: 0.9654, test_f1: 0.5942
 epoch: 87, train_loss: 0.6926, test_loss: 0.9422, test_f1: 0.6120
 epoch: 88, train_loss: 0.6955, test_loss: 0.9441, test_f1: 0.6062
 epoch: 89, train_loss: 0.6943, test_loss: 0.9686, test_f1: 0.5928
 epoch: 90, train_loss: 0.6977, test_loss: 0.9724, test_f1: 0.5774
 epoch: 91, train_loss: 0.6782, test_loss: 0.9848, test_f1: 0.5700
 epoch: 92, train_loss: 0.6674, test_loss: 0.9506, test_f1: 0.6125
 epoch: 93, train_loss: 0.6840, test_loss: 0.9786, test_f1: 0.6121
 epoch: 94, train_loss: 0.6708, test_loss: 0.9690, test_f1: 0.5930
 epoch: 95, train_loss: 0.6744, test_loss: 0.9925, test_f1: 0.6012
 epoch: 96, train_loss: 0.6857, test_loss: 0.9430, test_f1: 0.6117
 epoch: 97, train_loss: 0.6795, test_loss: 0.9595, test_f1: 0.6169
 epoch: 98, train_loss: 0.6845, test_loss: 0.9593, test_f1: 0.6133
 epoch: 99, train_loss: 0.6689, test_loss: 0.9469, test_f1: 0.5999

Training completed in 339.43 seconds
Best F1: 0.6261 at epoch 90
Mean F1 across iterations: 0.6010  0.0210
========================FINAL RESULTS================================
FEGIN weighted F1: 0.6261  0.0210
python main.py --data ltspice_demos --representation component_pin_net --model FEGIN --layers 3 --hiddens 16 --batch_size 128 --lr 0.001 --emb_size 128 --epochs 100 --save_appendix component_pin_net_L3_H16_BS128_LR0.001_E128 --no_val
-----



STDERR:
  File "main.py", line 370, in <module>
    main()
  File "main.py", line 254, in main
    dataset = dataset_class(
  File "/home/philip/projects/ltspice_examples_code_repo/Circuit-Completion-Using-GNNs/component_classification_with_link_prediction_head/evaluation/FEGIN/kernel/circuit_datasets.py", line 15, in __init__
    self.data, self.slices = torch.load(self.processed_paths[0])
  File "/home/philip/.local/lib/python3.8/site-packages/torch/serialization.py", line 1040, in load
    warnings.warn(
  File "/usr/lib/python3.8/warnings.py", line 109, in _showwarnmsg
    sw(msg.message, msg.category, msg.filename, msg.lineno,
  File "main.py", line 47, in warn_with_traceback
    traceback.print_stack(file=log)
/home/philip/projects/ltspice_examples_code_repo/Circuit-Completion-Using-GNNs/component_classification_with_link_prediction_head/evaluation/FEGIN/kernel/circuit_datasets.py:15: FutureWarning: You are using `torch.load` with `weights_only=False` (the current default value), which uses the default pickle module implicitly. It is possible to construct malicious pickle data which will execute arbitrary code during unpickling (See https://github.com/pytorch/pytorch/blob/main/SECURITY.md#untrusted-models for more details). In a future release, the default value for `weights_only` will be flipped to `True`. This limits the functions that could be executed during unpickling. Arbitrary objects will no longer be allowed to be loaded via this mode unless they are explicitly allowlisted by the user via `torch.serialization.add_safe_globals`. We recommend you start setting `weights_only=True` for any use case where you don't have full control of the loaded file. Please open an issue on GitHub for any issues related to this experimental feature.
  self.data, self.slices = torch.load(self.processed_paths[0])
