STDOUT:
Results will be saved in /home/philip/projects/ltspice_examples_code_repo/Circuit-Completion-Using-GNNs/component_classification_with_link_prediction_head/evaluation/FEGIN/results/model_FEGIN_dataset_ltspice_examples
Command line input: python main.py --data ltspice_examples --representation component_component --model FEGIN --layers 2 --hiddens 64 --batch_size 32 --lr 0.0001 --emb_size 128 --epochs 100 --save_appendix component_component_L2_H64_BS32_LR0.0001_E128 --no_val
 is saved.
-----
ltspice_examples - FEGIN
Using 2 layers, 64 hidden units, h = 2
Loading component_component representation dataset
ENTERED
Training FEGIN on component_component representation
Train: 3556, Test: 845
##################ITERATION #0 ****************************************
 epoch: 0, train_loss: 1.3779, test_loss: 1.3513, test_f1: 0.2659
 epoch: 1, train_loss: 1.3336, test_loss: 1.3074, test_f1: 0.2541
 epoch: 2, train_loss: 1.2919, test_loss: 1.2636, test_f1: 0.2585
 epoch: 3, train_loss: 1.2592, test_loss: 1.2281, test_f1: 0.3019
 epoch: 4, train_loss: 1.2352, test_loss: 1.2007, test_f1: 0.3297
 epoch: 5, train_loss: 1.2217, test_loss: 1.1817, test_f1: 0.3563
 epoch: 6, train_loss: 1.2045, test_loss: 1.1658, test_f1: 0.3522
 epoch: 7, train_loss: 1.1904, test_loss: 1.1563, test_f1: 0.3537
 epoch: 8, train_loss: 1.1747, test_loss: 1.1416, test_f1: 0.3566
 epoch: 9, train_loss: 1.1693, test_loss: 1.1269, test_f1: 0.3906
 epoch: 10, train_loss: 1.1539, test_loss: 1.1126, test_f1: 0.3968
 epoch: 11, train_loss: 1.1450, test_loss: 1.1011, test_f1: 0.4247
 epoch: 12, train_loss: 1.1370, test_loss: 1.0905, test_f1: 0.4319
 epoch: 13, train_loss: 1.1211, test_loss: 1.0801, test_f1: 0.4235
 epoch: 14, train_loss: 1.1127, test_loss: 1.0783, test_f1: 0.4391
 epoch: 15, train_loss: 1.1038, test_loss: 1.0665, test_f1: 0.4516
 epoch: 16, train_loss: 1.1013, test_loss: 1.0499, test_f1: 0.4553
 epoch: 17, train_loss: 1.0886, test_loss: 1.0448, test_f1: 0.4472
 epoch: 18, train_loss: 1.0798, test_loss: 1.0291, test_f1: 0.4598
 epoch: 19, train_loss: 1.0712, test_loss: 1.0193, test_f1: 0.4618
 epoch: 20, train_loss: 1.0676, test_loss: 1.0075, test_f1: 0.4662
 epoch: 21, train_loss: 1.0612, test_loss: 1.0137, test_f1: 0.4705
 epoch: 22, train_loss: 1.0500, test_loss: 1.0030, test_f1: 0.4813
 epoch: 23, train_loss: 1.0415, test_loss: 0.9871, test_f1: 0.4634
 epoch: 24, train_loss: 1.0364, test_loss: 0.9834, test_f1: 0.4722
 epoch: 25, train_loss: 1.0274, test_loss: 0.9826, test_f1: 0.4778
 epoch: 26, train_loss: 1.0306, test_loss: 0.9782, test_f1: 0.4693
 epoch: 27, train_loss: 1.0078, test_loss: 0.9647, test_f1: 0.4827
 epoch: 28, train_loss: 1.0139, test_loss: 0.9558, test_f1: 0.4881
 epoch: 29, train_loss: 1.0037, test_loss: 0.9524, test_f1: 0.4996
 epoch: 30, train_loss: 1.0044, test_loss: 0.9581, test_f1: 0.4771
 epoch: 31, train_loss: 1.0061, test_loss: 0.9415, test_f1: 0.5072
 epoch: 32, train_loss: 0.9872, test_loss: 0.9533, test_f1: 0.4958
 epoch: 33, train_loss: 0.9800, test_loss: 0.9435, test_f1: 0.4979
 epoch: 34, train_loss: 0.9956, test_loss: 0.9351, test_f1: 0.5165
 epoch: 35, train_loss: 0.9873, test_loss: 0.9341, test_f1: 0.5179
 epoch: 36, train_loss: 0.9784, test_loss: 0.9358, test_f1: 0.5119
 epoch: 37, train_loss: 0.9715, test_loss: 0.9319, test_f1: 0.5131
 epoch: 38, train_loss: 0.9599, test_loss: 0.9205, test_f1: 0.5408
 epoch: 39, train_loss: 0.9556, test_loss: 0.9284, test_f1: 0.5097
 epoch: 40, train_loss: 0.9647, test_loss: 0.9168, test_f1: 0.5392
 epoch: 41, train_loss: 0.9560, test_loss: 0.9117, test_f1: 0.5397
 epoch: 42, train_loss: 0.9514, test_loss: 0.9181, test_f1: 0.5228
 epoch: 43, train_loss: 0.9377, test_loss: 0.9114, test_f1: 0.5102
 epoch: 44, train_loss: 0.9381, test_loss: 0.9117, test_f1: 0.5377
 epoch: 45, train_loss: 0.9486, test_loss: 0.9009, test_f1: 0.5446
 epoch: 46, train_loss: 0.9355, test_loss: 0.9146, test_f1: 0.5262
 epoch: 47, train_loss: 0.9461, test_loss: 0.8996, test_f1: 0.5335
 epoch: 48, train_loss: 0.9329, test_loss: 0.9102, test_f1: 0.5206
 epoch: 49, train_loss: 0.9309, test_loss: 0.9132, test_f1: 0.5305
 epoch: 50, train_loss: 0.9242, test_loss: 0.9065, test_f1: 0.5527
 epoch: 51, train_loss: 0.9190, test_loss: 0.9063, test_f1: 0.5251
 epoch: 52, train_loss: 0.9119, test_loss: 0.8955, test_f1: 0.5399
 epoch: 53, train_loss: 0.9121, test_loss: 0.8917, test_f1: 0.5346
 epoch: 54, train_loss: 0.9107, test_loss: 0.9092, test_f1: 0.5265
 epoch: 55, train_loss: 0.9081, test_loss: 0.8937, test_f1: 0.5528
 epoch: 56, train_loss: 0.9075, test_loss: 0.8989, test_f1: 0.5289
 epoch: 57, train_loss: 0.8992, test_loss: 0.8963, test_f1: 0.5387
 epoch: 58, train_loss: 0.9095, test_loss: 0.9047, test_f1: 0.5354
 epoch: 59, train_loss: 0.8919, test_loss: 0.9037, test_f1: 0.5421
 epoch: 60, train_loss: 0.9026, test_loss: 0.8972, test_f1: 0.5403
 epoch: 61, train_loss: 0.9025, test_loss: 0.9027, test_f1: 0.5228
 epoch: 62, train_loss: 0.9030, test_loss: 0.8988, test_f1: 0.5366
 epoch: 63, train_loss: 0.9013, test_loss: 0.9096, test_f1: 0.5240
 epoch: 64, train_loss: 0.8921, test_loss: 0.9000, test_f1: 0.5358
 epoch: 65, train_loss: 0.9030, test_loss: 0.9167, test_f1: 0.5250
 epoch: 66, train_loss: 0.8832, test_loss: 0.9064, test_f1: 0.5354
 epoch: 67, train_loss: 0.8950, test_loss: 0.8929, test_f1: 0.5575
 epoch: 68, train_loss: 0.8909, test_loss: 0.9050, test_f1: 0.5348
 epoch: 69, train_loss: 0.8951, test_loss: 0.9035, test_f1: 0.5334
 epoch: 70, train_loss: 0.8876, test_loss: 0.9053, test_f1: 0.5362
 epoch: 71, train_loss: 0.8825, test_loss: 0.8855, test_f1: 0.5570
 epoch: 72, train_loss: 0.8909, test_loss: 0.8945, test_f1: 0.5457
 epoch: 73, train_loss: 0.8883, test_loss: 0.9049, test_f1: 0.5282
 epoch: 74, train_loss: 0.8782, test_loss: 0.9005, test_f1: 0.5514
 epoch: 75, train_loss: 0.8863, test_loss: 0.8991, test_f1: 0.5347
 epoch: 76, train_loss: 0.8753, test_loss: 0.8946, test_f1: 0.5406
 epoch: 77, train_loss: 0.8809, test_loss: 0.8989, test_f1: 0.5196
 epoch: 78, train_loss: 0.8756, test_loss: 0.8920, test_f1: 0.5362
 epoch: 79, train_loss: 0.8743, test_loss: 0.8831, test_f1: 0.5460
 epoch: 80, train_loss: 0.8790, test_loss: 0.9153, test_f1: 0.5276
 epoch: 81, train_loss: 0.8682, test_loss: 0.9033, test_f1: 0.5340
 epoch: 82, train_loss: 0.8619, test_loss: 0.9055, test_f1: 0.5388
 epoch: 83, train_loss: 0.8644, test_loss: 0.9017, test_f1: 0.5273
 epoch: 84, train_loss: 0.8612, test_loss: 0.8896, test_f1: 0.5477
 epoch: 85, train_loss: 0.8710, test_loss: 0.8999, test_f1: 0.5286
 epoch: 86, train_loss: 0.8632, test_loss: 0.8949, test_f1: 0.5457
 epoch: 87, train_loss: 0.8625, test_loss: 0.8999, test_f1: 0.5256
 epoch: 88, train_loss: 0.8661, test_loss: 0.9153, test_f1: 0.5358
 epoch: 89, train_loss: 0.8642, test_loss: 0.9110, test_f1: 0.5204
 epoch: 90, train_loss: 0.8544, test_loss: 0.9159, test_f1: 0.5231
 epoch: 91, train_loss: 0.8555, test_loss: 0.9149, test_f1: 0.5408
 epoch: 92, train_loss: 0.8638, test_loss: 0.8918, test_f1: 0.5332
 epoch: 93, train_loss: 0.8594, test_loss: 0.9157, test_f1: 0.5314
 epoch: 94, train_loss: 0.8560, test_loss: 0.8977, test_f1: 0.5282
 epoch: 95, train_loss: 0.8578, test_loss: 0.9117, test_f1: 0.5181
 epoch: 96, train_loss: 0.8589, test_loss: 0.8973, test_f1: 0.5489
 epoch: 97, train_loss: 0.8508, test_loss: 0.9288, test_f1: 0.5297
 epoch: 98, train_loss: 0.8605, test_loss: 0.9027, test_f1: 0.5381
 epoch: 99, train_loss: 0.8537, test_loss: 0.9203, test_f1: 0.5293
##################ITERATION #1 ****************************************
 epoch: 0, train_loss: 1.3105, test_loss: 1.2409, test_f1: 0.3616
 epoch: 1, train_loss: 1.2392, test_loss: 1.2042, test_f1: 0.3874
 epoch: 2, train_loss: 1.2099, test_loss: 1.1762, test_f1: 0.4046
 epoch: 3, train_loss: 1.1845, test_loss: 1.1433, test_f1: 0.4275
 epoch: 4, train_loss: 1.1647, test_loss: 1.1233, test_f1: 0.4259
 epoch: 5, train_loss: 1.1461, test_loss: 1.1048, test_f1: 0.4258
 epoch: 6, train_loss: 1.1240, test_loss: 1.0849, test_f1: 0.4315
 epoch: 7, train_loss: 1.1113, test_loss: 1.0702, test_f1: 0.4388
 epoch: 8, train_loss: 1.0998, test_loss: 1.0521, test_f1: 0.4524
 epoch: 9, train_loss: 1.0896, test_loss: 1.0371, test_f1: 0.4473
 epoch: 10, train_loss: 1.0770, test_loss: 1.0328, test_f1: 0.4533
 epoch: 11, train_loss: 1.0699, test_loss: 1.0265, test_f1: 0.4690
 epoch: 12, train_loss: 1.0579, test_loss: 1.0026, test_f1: 0.4863
 epoch: 13, train_loss: 1.0445, test_loss: 1.0057, test_f1: 0.4806
 epoch: 14, train_loss: 1.0337, test_loss: 0.9974, test_f1: 0.4790
 epoch: 15, train_loss: 1.0366, test_loss: 0.9957, test_f1: 0.4729
 epoch: 16, train_loss: 1.0304, test_loss: 0.9988, test_f1: 0.4737
 epoch: 17, train_loss: 1.0123, test_loss: 0.9657, test_f1: 0.4861
 epoch: 18, train_loss: 1.0106, test_loss: 0.9719, test_f1: 0.4924
 epoch: 19, train_loss: 0.9967, test_loss: 0.9652, test_f1: 0.4863
 epoch: 20, train_loss: 0.9968, test_loss: 0.9811, test_f1: 0.4881
 epoch: 21, train_loss: 0.9928, test_loss: 0.9680, test_f1: 0.4874
 epoch: 22, train_loss: 0.9882, test_loss: 0.9483, test_f1: 0.5018
 epoch: 23, train_loss: 0.9844, test_loss: 0.9584, test_f1: 0.4592
 epoch: 24, train_loss: 0.9736, test_loss: 0.9481, test_f1: 0.4810
 epoch: 25, train_loss: 0.9676, test_loss: 0.9696, test_f1: 0.4558
 epoch: 26, train_loss: 0.9550, test_loss: 0.9459, test_f1: 0.4694
 epoch: 27, train_loss: 0.9696, test_loss: 0.9434, test_f1: 0.4850
 epoch: 28, train_loss: 0.9671, test_loss: 0.9472, test_f1: 0.4902
 epoch: 29, train_loss: 0.9481, test_loss: 0.9388, test_f1: 0.4877
 epoch: 30, train_loss: 0.9484, test_loss: 0.9432, test_f1: 0.4986
 epoch: 31, train_loss: 0.9379, test_loss: 0.9489, test_f1: 0.4805
 epoch: 32, train_loss: 0.9380, test_loss: 0.9448, test_f1: 0.4856
 epoch: 33, train_loss: 0.9356, test_loss: 0.9422, test_f1: 0.4872
 epoch: 34, train_loss: 0.9302, test_loss: 0.9366, test_f1: 0.4963
 epoch: 35, train_loss: 0.9283, test_loss: 0.9436, test_f1: 0.4935
 epoch: 36, train_loss: 0.9251, test_loss: 0.9320, test_f1: 0.4920
 epoch: 37, train_loss: 0.9203, test_loss: 0.9559, test_f1: 0.4800
 epoch: 38, train_loss: 0.9044, test_loss: 0.9719, test_f1: 0.4920
 epoch: 39, train_loss: 0.9037, test_loss: 0.9560, test_f1: 0.5035
 epoch: 40, train_loss: 0.9106, test_loss: 0.9702, test_f1: 0.5013
 epoch: 41, train_loss: 0.9052, test_loss: 0.9607, test_f1: 0.4940
 epoch: 42, train_loss: 0.9078, test_loss: 0.9553, test_f1: 0.5025
 epoch: 43, train_loss: 0.8985, test_loss: 0.9537, test_f1: 0.4947
 epoch: 44, train_loss: 0.8932, test_loss: 0.9576, test_f1: 0.5050
 epoch: 45, train_loss: 0.8897, test_loss: 0.9569, test_f1: 0.5007
 epoch: 46, train_loss: 0.9015, test_loss: 0.9562, test_f1: 0.4828
 epoch: 47, train_loss: 0.8752, test_loss: 0.9690, test_f1: 0.5211
 epoch: 48, train_loss: 0.8862, test_loss: 0.9745, test_f1: 0.4904
 epoch: 49, train_loss: 0.8814, test_loss: 0.9633, test_f1: 0.5019
 epoch: 50, train_loss: 0.8850, test_loss: 0.9608, test_f1: 0.5063
 epoch: 51, train_loss: 0.8679, test_loss: 0.9572, test_f1: 0.5133
 epoch: 52, train_loss: 0.8663, test_loss: 0.9711, test_f1: 0.4892
 epoch: 53, train_loss: 0.8788, test_loss: 0.9584, test_f1: 0.5257
 epoch: 54, train_loss: 0.8683, test_loss: 0.9646, test_f1: 0.5203
 epoch: 55, train_loss: 0.8647, test_loss: 0.9523, test_f1: 0.5275
 epoch: 56, train_loss: 0.8635, test_loss: 0.9598, test_f1: 0.5152
 epoch: 57, train_loss: 0.8594, test_loss: 0.9775, test_f1: 0.5250
 epoch: 58, train_loss: 0.8627, test_loss: 0.9609, test_f1: 0.5155
 epoch: 59, train_loss: 0.8617, test_loss: 0.9709, test_f1: 0.5039
 epoch: 60, train_loss: 0.8493, test_loss: 0.9861, test_f1: 0.5149
 epoch: 61, train_loss: 0.8641, test_loss: 1.0538, test_f1: 0.5035
 epoch: 62, train_loss: 0.8533, test_loss: 0.9704, test_f1: 0.5196
 epoch: 63, train_loss: 0.8500, test_loss: 0.9792, test_f1: 0.5142
 epoch: 64, train_loss: 0.8465, test_loss: 0.9627, test_f1: 0.5308
 epoch: 65, train_loss: 0.8481, test_loss: 0.9592, test_f1: 0.5257
 epoch: 66, train_loss: 0.8538, test_loss: 0.9838, test_f1: 0.5236
 epoch: 67, train_loss: 0.8448, test_loss: 0.9659, test_f1: 0.5240
 epoch: 68, train_loss: 0.8384, test_loss: 0.9846, test_f1: 0.5232
 epoch: 69, train_loss: 0.8377, test_loss: 0.9886, test_f1: 0.5308
 epoch: 70, train_loss: 0.8427, test_loss: 0.9843, test_f1: 0.5325
 epoch: 71, train_loss: 0.8409, test_loss: 0.9872, test_f1: 0.5381
 epoch: 72, train_loss: 0.8352, test_loss: 0.9738, test_f1: 0.5361
 epoch: 73, train_loss: 0.8492, test_loss: 0.9877, test_f1: 0.5307
 epoch: 74, train_loss: 0.8336, test_loss: 1.0109, test_f1: 0.5228
 epoch: 75, train_loss: 0.8511, test_loss: 0.9783, test_f1: 0.5337
 epoch: 76, train_loss: 0.8322, test_loss: 1.0016, test_f1: 0.5147
 epoch: 77, train_loss: 0.8219, test_loss: 0.9904, test_f1: 0.5220
 epoch: 78, train_loss: 0.8357, test_loss: 0.9793, test_f1: 0.5192
 epoch: 79, train_loss: 0.8378, test_loss: 0.9989, test_f1: 0.5244
 epoch: 80, train_loss: 0.8173, test_loss: 0.9835, test_f1: 0.5356
 epoch: 81, train_loss: 0.8206, test_loss: 0.9958, test_f1: 0.5305
 epoch: 82, train_loss: 0.8357, test_loss: 1.0023, test_f1: 0.5235
 epoch: 83, train_loss: 0.8177, test_loss: 1.0121, test_f1: 0.5139
 epoch: 84, train_loss: 0.8261, test_loss: 0.9947, test_f1: 0.5262
 epoch: 85, train_loss: 0.8210, test_loss: 0.9973, test_f1: 0.5127
 epoch: 86, train_loss: 0.8180, test_loss: 0.9895, test_f1: 0.5376
 epoch: 87, train_loss: 0.8113, test_loss: 0.9892, test_f1: 0.5406
 epoch: 88, train_loss: 0.8186, test_loss: 1.0142, test_f1: 0.5249
 epoch: 89, train_loss: 0.8255, test_loss: 0.9887, test_f1: 0.5376
 epoch: 90, train_loss: 0.8139, test_loss: 0.9870, test_f1: 0.5409
 epoch: 91, train_loss: 0.8134, test_loss: 0.9971, test_f1: 0.5423
 epoch: 92, train_loss: 0.8126, test_loss: 1.0038, test_f1: 0.5425
 epoch: 93, train_loss: 0.8096, test_loss: 1.0046, test_f1: 0.5436
 epoch: 94, train_loss: 0.8112, test_loss: 0.9946, test_f1: 0.5214
 epoch: 95, train_loss: 0.8205, test_loss: 1.0124, test_f1: 0.5203
 epoch: 96, train_loss: 0.8053, test_loss: 1.0468, test_f1: 0.5108
 epoch: 97, train_loss: 0.7936, test_loss: 1.0142, test_f1: 0.5043
 epoch: 98, train_loss: 0.8038, test_loss: 1.0440, test_f1: 0.5195
 epoch: 99, train_loss: 0.8110, test_loss: 1.0182, test_f1: 0.5280
##################ITERATION #2 ****************************************
 epoch: 0, train_loss: 1.3047, test_loss: 1.2355, test_f1: 0.3282
 epoch: 1, train_loss: 1.2449, test_loss: 1.2076, test_f1: 0.3313
 epoch: 2, train_loss: 1.2148, test_loss: 1.1835, test_f1: 0.3891
 epoch: 3, train_loss: 1.1985, test_loss: 1.1549, test_f1: 0.4470
 epoch: 4, train_loss: 1.1789, test_loss: 1.1365, test_f1: 0.4418
 epoch: 5, train_loss: 1.1564, test_loss: 1.1141, test_f1: 0.4533
 epoch: 6, train_loss: 1.1499, test_loss: 1.0927, test_f1: 0.4483
 epoch: 7, train_loss: 1.1255, test_loss: 1.0690, test_f1: 0.4656
 epoch: 8, train_loss: 1.1159, test_loss: 1.0583, test_f1: 0.4677
 epoch: 9, train_loss: 1.0972, test_loss: 1.0439, test_f1: 0.4590
 epoch: 10, train_loss: 1.0882, test_loss: 1.0323, test_f1: 0.4623
 epoch: 11, train_loss: 1.0844, test_loss: 1.0237, test_f1: 0.4731
 epoch: 12, train_loss: 1.0669, test_loss: 1.0095, test_f1: 0.4723
 epoch: 13, train_loss: 1.0671, test_loss: 1.0004, test_f1: 0.4785
 epoch: 14, train_loss: 1.0448, test_loss: 0.9890, test_f1: 0.4875
 epoch: 15, train_loss: 1.0330, test_loss: 0.9812, test_f1: 0.4817
 epoch: 16, train_loss: 1.0351, test_loss: 0.9692, test_f1: 0.4752
 epoch: 17, train_loss: 1.0224, test_loss: 0.9665, test_f1: 0.4755
 epoch: 18, train_loss: 1.0162, test_loss: 0.9587, test_f1: 0.4974
 epoch: 19, train_loss: 1.0076, test_loss: 0.9531, test_f1: 0.4698
 epoch: 20, train_loss: 1.0004, test_loss: 0.9584, test_f1: 0.4814
 epoch: 21, train_loss: 0.9985, test_loss: 0.9456, test_f1: 0.4919
 epoch: 22, train_loss: 0.9904, test_loss: 0.9472, test_f1: 0.4796
 epoch: 23, train_loss: 0.9819, test_loss: 0.9540, test_f1: 0.4770
 epoch: 24, train_loss: 0.9842, test_loss: 0.9494, test_f1: 0.4840
 epoch: 25, train_loss: 0.9730, test_loss: 0.9444, test_f1: 0.4779
 epoch: 26, train_loss: 0.9793, test_loss: 0.9305, test_f1: 0.4983
 epoch: 27, train_loss: 0.9723, test_loss: 0.9332, test_f1: 0.4812
 epoch: 28, train_loss: 0.9736, test_loss: 0.9430, test_f1: 0.4837
 epoch: 29, train_loss: 0.9613, test_loss: 0.9346, test_f1: 0.4891
 epoch: 30, train_loss: 0.9503, test_loss: 0.9483, test_f1: 0.4764
 epoch: 31, train_loss: 0.9457, test_loss: 0.9329, test_f1: 0.4881
 epoch: 32, train_loss: 0.9388, test_loss: 0.9257, test_f1: 0.5021
 epoch: 33, train_loss: 0.9296, test_loss: 0.9439, test_f1: 0.4964
 epoch: 34, train_loss: 0.9342, test_loss: 0.9416, test_f1: 0.4942
 epoch: 35, train_loss: 0.9259, test_loss: 0.9362, test_f1: 0.5172
 epoch: 36, train_loss: 0.9347, test_loss: 0.9218, test_f1: 0.5069
 epoch: 37, train_loss: 0.9320, test_loss: 0.9400, test_f1: 0.5118
 epoch: 38, train_loss: 0.9228, test_loss: 0.9310, test_f1: 0.5143
 epoch: 39, train_loss: 0.9207, test_loss: 0.9411, test_f1: 0.5112
 epoch: 40, train_loss: 0.9054, test_loss: 0.9378, test_f1: 0.5064
 epoch: 41, train_loss: 0.9060, test_loss: 0.9412, test_f1: 0.5048
 epoch: 42, train_loss: 0.8965, test_loss: 0.9475, test_f1: 0.5079
 epoch: 43, train_loss: 0.9029, test_loss: 0.9471, test_f1: 0.5028
 epoch: 44, train_loss: 0.9000, test_loss: 0.9631, test_f1: 0.5173
 epoch: 45, train_loss: 0.8896, test_loss: 0.9689, test_f1: 0.5071
 epoch: 46, train_loss: 0.8840, test_loss: 0.9505, test_f1: 0.5105
 epoch: 47, train_loss: 0.8834, test_loss: 0.9478, test_f1: 0.5140
 epoch: 48, train_loss: 0.8868, test_loss: 0.9542, test_f1: 0.5148
 epoch: 49, train_loss: 0.8744, test_loss: 0.9647, test_f1: 0.5141
 epoch: 50, train_loss: 0.8845, test_loss: 0.9325, test_f1: 0.5323
 epoch: 51, train_loss: 0.8667, test_loss: 0.9475, test_f1: 0.5271
 epoch: 52, train_loss: 0.8707, test_loss: 0.9565, test_f1: 0.5260
 epoch: 53, train_loss: 0.8564, test_loss: 0.9540, test_f1: 0.5321
 epoch: 54, train_loss: 0.8668, test_loss: 0.9527, test_f1: 0.5193
 epoch: 55, train_loss: 0.8610, test_loss: 0.9695, test_f1: 0.5132
 epoch: 56, train_loss: 0.8650, test_loss: 0.9718, test_f1: 0.5257
 epoch: 57, train_loss: 0.8660, test_loss: 0.9679, test_f1: 0.5307
 epoch: 58, train_loss: 0.8631, test_loss: 0.9684, test_f1: 0.5149
 epoch: 59, train_loss: 0.8506, test_loss: 0.9672, test_f1: 0.5259
 epoch: 60, train_loss: 0.8560, test_loss: 0.9696, test_f1: 0.5193
 epoch: 61, train_loss: 0.8513, test_loss: 0.9652, test_f1: 0.5271
 epoch: 62, train_loss: 0.8585, test_loss: 0.9714, test_f1: 0.5249
 epoch: 63, train_loss: 0.8437, test_loss: 0.9829, test_f1: 0.5145
 epoch: 64, train_loss: 0.8500, test_loss: 0.9704, test_f1: 0.5334
 epoch: 65, train_loss: 0.8401, test_loss: 0.9627, test_f1: 0.5397
 epoch: 66, train_loss: 0.8441, test_loss: 0.9641, test_f1: 0.5292
 epoch: 67, train_loss: 0.8390, test_loss: 0.9802, test_f1: 0.5327
 epoch: 68, train_loss: 0.8390, test_loss: 0.9879, test_f1: 0.5245
 epoch: 69, train_loss: 0.8423, test_loss: 0.9568, test_f1: 0.5345
 epoch: 70, train_loss: 0.8354, test_loss: 0.9745, test_f1: 0.5313
 epoch: 71, train_loss: 0.8289, test_loss: 0.9753, test_f1: 0.5275
 epoch: 72, train_loss: 0.8254, test_loss: 0.9863, test_f1: 0.5359
 epoch: 73, train_loss: 0.8339, test_loss: 0.9860, test_f1: 0.5304
 epoch: 74, train_loss: 0.8323, test_loss: 0.9720, test_f1: 0.5292
 epoch: 75, train_loss: 0.8306, test_loss: 0.9803, test_f1: 0.5274
 epoch: 76, train_loss: 0.8332, test_loss: 0.9928, test_f1: 0.5288
 epoch: 77, train_loss: 0.8386, test_loss: 0.9996, test_f1: 0.5356
 epoch: 78, train_loss: 0.8315, test_loss: 0.9848, test_f1: 0.5351
 epoch: 79, train_loss: 0.8187, test_loss: 0.9671, test_f1: 0.5484
 epoch: 80, train_loss: 0.8224, test_loss: 0.9996, test_f1: 0.5264
 epoch: 81, train_loss: 0.8279, test_loss: 0.9871, test_f1: 0.5368
 epoch: 82, train_loss: 0.8237, test_loss: 0.9974, test_f1: 0.5233
 epoch: 83, train_loss: 0.8215, test_loss: 1.0040, test_f1: 0.5308
 epoch: 84, train_loss: 0.8218, test_loss: 1.0095, test_f1: 0.5278
 epoch: 85, train_loss: 0.8174, test_loss: 1.0014, test_f1: 0.5316
 epoch: 86, train_loss: 0.8192, test_loss: 1.0049, test_f1: 0.5368
 epoch: 87, train_loss: 0.8107, test_loss: 0.9971, test_f1: 0.5289
 epoch: 88, train_loss: 0.8151, test_loss: 1.0124, test_f1: 0.5237
 epoch: 89, train_loss: 0.8057, test_loss: 0.9900, test_f1: 0.5437
 epoch: 90, train_loss: 0.8061, test_loss: 1.0011, test_f1: 0.5282
 epoch: 91, train_loss: 0.8101, test_loss: 1.0098, test_f1: 0.5311
 epoch: 92, train_loss: 0.8071, test_loss: 0.9987, test_f1: 0.5392
 epoch: 93, train_loss: 0.8187, test_loss: 1.0029, test_f1: 0.5389
 epoch: 94, train_loss: 0.8179, test_loss: 1.0437, test_f1: 0.5190
 epoch: 95, train_loss: 0.8055, test_loss: 1.0237, test_f1: 0.5408
 epoch: 96, train_loss: 0.8178, test_loss: 1.0209, test_f1: 0.5248
 epoch: 97, train_loss: 0.8095, test_loss: 1.0162, test_f1: 0.5415
 epoch: 98, train_loss: 0.8093, test_loss: 1.0234, test_f1: 0.5269
 epoch: 99, train_loss: 0.8027, test_loss: 1.0654, test_f1: 0.5239
##################ITERATION #3 ****************************************
 epoch: 0, train_loss: 1.3008, test_loss: 1.2125, test_f1: 0.3512
 epoch: 1, train_loss: 1.2285, test_loss: 1.1758, test_f1: 0.4175
 epoch: 2, train_loss: 1.2116, test_loss: 1.1696, test_f1: 0.4096
 epoch: 3, train_loss: 1.1866, test_loss: 1.1438, test_f1: 0.4342
 epoch: 4, train_loss: 1.1813, test_loss: 1.1312, test_f1: 0.4314
 epoch: 5, train_loss: 1.1724, test_loss: 1.1207, test_f1: 0.4608
 epoch: 6, train_loss: 1.1505, test_loss: 1.1117, test_f1: 0.4523
 epoch: 7, train_loss: 1.1404, test_loss: 1.0937, test_f1: 0.4461
 epoch: 8, train_loss: 1.1203, test_loss: 1.0908, test_f1: 0.4591
 epoch: 9, train_loss: 1.1207, test_loss: 1.0760, test_f1: 0.4615
 epoch: 10, train_loss: 1.1067, test_loss: 1.0684, test_f1: 0.4633
 epoch: 11, train_loss: 1.1032, test_loss: 1.0642, test_f1: 0.4621
 epoch: 12, train_loss: 1.0974, test_loss: 1.0561, test_f1: 0.4748
 epoch: 13, train_loss: 1.0833, test_loss: 1.0617, test_f1: 0.4613
 epoch: 14, train_loss: 1.0804, test_loss: 1.0382, test_f1: 0.4783
 epoch: 15, train_loss: 1.0703, test_loss: 1.0327, test_f1: 0.4679
 epoch: 16, train_loss: 1.0696, test_loss: 1.0223, test_f1: 0.4758
 epoch: 17, train_loss: 1.0545, test_loss: 1.0279, test_f1: 0.4746
 epoch: 18, train_loss: 1.0427, test_loss: 1.0108, test_f1: 0.4710
 epoch: 19, train_loss: 1.0397, test_loss: 1.0131, test_f1: 0.4699
 epoch: 20, train_loss: 1.0376, test_loss: 1.0107, test_f1: 0.4377
 epoch: 21, train_loss: 1.0222, test_loss: 1.0004, test_f1: 0.4768
 epoch: 22, train_loss: 1.0200, test_loss: 1.0040, test_f1: 0.4778
 epoch: 23, train_loss: 1.0216, test_loss: 1.0011, test_f1: 0.4761
 epoch: 24, train_loss: 1.0178, test_loss: 0.9893, test_f1: 0.4770
 epoch: 25, train_loss: 1.0053, test_loss: 0.9824, test_f1: 0.4718
 epoch: 26, train_loss: 1.0060, test_loss: 0.9806, test_f1: 0.4839
 epoch: 27, train_loss: 1.0095, test_loss: 0.9755, test_f1: 0.4930
 epoch: 28, train_loss: 1.0044, test_loss: 0.9822, test_f1: 0.4964
 epoch: 29, train_loss: 0.9972, test_loss: 0.9897, test_f1: 0.4546
 epoch: 30, train_loss: 0.9845, test_loss: 0.9866, test_f1: 0.4783
 epoch: 31, train_loss: 0.9812, test_loss: 0.9930, test_f1: 0.4910
 epoch: 32, train_loss: 0.9747, test_loss: 0.9800, test_f1: 0.4644
 epoch: 33, train_loss: 0.9789, test_loss: 0.9975, test_f1: 0.4875
 epoch: 34, train_loss: 0.9700, test_loss: 0.9862, test_f1: 0.4938
 epoch: 35, train_loss: 0.9680, test_loss: 0.9758, test_f1: 0.5031
 epoch: 36, train_loss: 0.9714, test_loss: 0.9791, test_f1: 0.5076
 epoch: 37, train_loss: 0.9618, test_loss: 0.9786, test_f1: 0.4915
 epoch: 38, train_loss: 0.9621, test_loss: 0.9903, test_f1: 0.4911
 epoch: 39, train_loss: 0.9576, test_loss: 1.0071, test_f1: 0.5014
 epoch: 40, train_loss: 0.9554, test_loss: 0.9985, test_f1: 0.4845
 epoch: 41, train_loss: 0.9567, test_loss: 0.9984, test_f1: 0.4986
 epoch: 42, train_loss: 0.9449, test_loss: 0.9804, test_f1: 0.5013
 epoch: 43, train_loss: 0.9463, test_loss: 1.0025, test_f1: 0.5023
 epoch: 44, train_loss: 0.9392, test_loss: 0.9773, test_f1: 0.5092
 epoch: 45, train_loss: 0.9255, test_loss: 0.9790, test_f1: 0.5172
 epoch: 46, train_loss: 0.9188, test_loss: 0.9779, test_f1: 0.5085
 epoch: 47, train_loss: 0.9278, test_loss: 1.0103, test_f1: 0.5001
 epoch: 48, train_loss: 0.9202, test_loss: 0.9942, test_f1: 0.5198
 epoch: 49, train_loss: 0.9254, test_loss: 0.9983, test_f1: 0.5053
 epoch: 50, train_loss: 0.9086, test_loss: 0.9845, test_f1: 0.5237
 epoch: 51, train_loss: 0.9084, test_loss: 0.9730, test_f1: 0.5129
 epoch: 52, train_loss: 0.9057, test_loss: 0.9926, test_f1: 0.5105
 epoch: 53, train_loss: 0.9054, test_loss: 0.9986, test_f1: 0.5172
 epoch: 54, train_loss: 0.9090, test_loss: 0.9965, test_f1: 0.5065
 epoch: 55, train_loss: 0.9087, test_loss: 0.9955, test_f1: 0.5230
 epoch: 56, train_loss: 0.8878, test_loss: 0.9868, test_f1: 0.5230
 epoch: 57, train_loss: 0.9066, test_loss: 1.0054, test_f1: 0.5063
 epoch: 58, train_loss: 0.9049, test_loss: 0.9705, test_f1: 0.5092
 epoch: 59, train_loss: 0.9017, test_loss: 0.9920, test_f1: 0.5205
 epoch: 60, train_loss: 0.9012, test_loss: 1.0008, test_f1: 0.5227
 epoch: 61, train_loss: 0.8839, test_loss: 0.9937, test_f1: 0.5144
 epoch: 62, train_loss: 0.8984, test_loss: 1.0088, test_f1: 0.5123
 epoch: 63, train_loss: 0.9000, test_loss: 0.9900, test_f1: 0.5164
 epoch: 64, train_loss: 0.8940, test_loss: 1.0123, test_f1: 0.5236
 epoch: 65, train_loss: 0.8981, test_loss: 1.0156, test_f1: 0.4891
 epoch: 66, train_loss: 0.8878, test_loss: 0.9889, test_f1: 0.5095
 epoch: 67, train_loss: 0.8910, test_loss: 0.9978, test_f1: 0.5276
 epoch: 68, train_loss: 0.8833, test_loss: 1.0097, test_f1: 0.5442
 epoch: 69, train_loss: 0.8907, test_loss: 0.9951, test_f1: 0.5171
 epoch: 70, train_loss: 0.8858, test_loss: 0.9967, test_f1: 0.5204
 epoch: 71, train_loss: 0.8896, test_loss: 1.0048, test_f1: 0.5090
 epoch: 72, train_loss: 0.8802, test_loss: 1.0145, test_f1: 0.5367
 epoch: 73, train_loss: 0.8863, test_loss: 1.0236, test_f1: 0.5325
 epoch: 74, train_loss: 0.8681, test_loss: 1.0192, test_f1: 0.5367
 epoch: 75, train_loss: 0.8736, test_loss: 1.0371, test_f1: 0.5071
 epoch: 76, train_loss: 0.8723, test_loss: 1.0218, test_f1: 0.5321
 epoch: 77, train_loss: 0.8666, test_loss: 1.0107, test_f1: 0.5269
 epoch: 78, train_loss: 0.8736, test_loss: 1.0156, test_f1: 0.5266
 epoch: 79, train_loss: 0.8648, test_loss: 1.0067, test_f1: 0.5350
 epoch: 80, train_loss: 0.8804, test_loss: 1.0430, test_f1: 0.5245
 epoch: 81, train_loss: 0.8702, test_loss: 1.0250, test_f1: 0.5208
 epoch: 82, train_loss: 0.8711, test_loss: 1.0146, test_f1: 0.5261
 epoch: 83, train_loss: 0.8795, test_loss: 1.0480, test_f1: 0.5141
 epoch: 84, train_loss: 0.8607, test_loss: 0.9977, test_f1: 0.5556
 epoch: 85, train_loss: 0.8593, test_loss: 1.0244, test_f1: 0.5145
 epoch: 86, train_loss: 0.8489, test_loss: 1.0363, test_f1: 0.5130
 epoch: 87, train_loss: 0.8722, test_loss: 1.0388, test_f1: 0.5310
 epoch: 88, train_loss: 0.8657, test_loss: 1.0291, test_f1: 0.5288
 epoch: 89, train_loss: 0.8538, test_loss: 1.0251, test_f1: 0.5200
 epoch: 90, train_loss: 0.8582, test_loss: 1.0386, test_f1: 0.5218
 epoch: 91, train_loss: 0.8490, test_loss: 1.0245, test_f1: 0.5294
 epoch: 92, train_loss: 0.8581, test_loss: 1.0069, test_f1: 0.5393
 epoch: 93, train_loss: 0.8530, test_loss: 1.0025, test_f1: 0.5366
 epoch: 94, train_loss: 0.8464, test_loss: 1.0277, test_f1: 0.5210
 epoch: 95, train_loss: 0.8477, test_loss: 1.0207, test_f1: 0.5421
 epoch: 96, train_loss: 0.8423, test_loss: 1.0466, test_f1: 0.5152
 epoch: 97, train_loss: 0.8471, test_loss: 1.0241, test_f1: 0.5321
 epoch: 98, train_loss: 0.8503, test_loss: 1.0382, test_f1: 0.5203
 epoch: 99, train_loss: 0.8427, test_loss: 1.0316, test_f1: 0.5166
##################ITERATION #4 ****************************************
 epoch: 0, train_loss: 1.2801, test_loss: 1.2053, test_f1: 0.3682
 epoch: 1, train_loss: 1.2316, test_loss: 1.1822, test_f1: 0.4101
 epoch: 2, train_loss: 1.2009, test_loss: 1.1522, test_f1: 0.4169
 epoch: 3, train_loss: 1.1883, test_loss: 1.1293, test_f1: 0.4721
 epoch: 4, train_loss: 1.1775, test_loss: 1.1181, test_f1: 0.4351
 epoch: 5, train_loss: 1.1612, test_loss: 1.1037, test_f1: 0.4427
 epoch: 6, train_loss: 1.1544, test_loss: 1.0890, test_f1: 0.4438
 epoch: 7, train_loss: 1.1350, test_loss: 1.0773, test_f1: 0.4522
 epoch: 8, train_loss: 1.1172, test_loss: 1.0667, test_f1: 0.4364
 epoch: 9, train_loss: 1.1105, test_loss: 1.0525, test_f1: 0.4494
 epoch: 10, train_loss: 1.1086, test_loss: 1.0334, test_f1: 0.4505
 epoch: 11, train_loss: 1.0850, test_loss: 1.0366, test_f1: 0.4683
 epoch: 12, train_loss: 1.0791, test_loss: 1.0388, test_f1: 0.4370
 epoch: 13, train_loss: 1.0742, test_loss: 1.0140, test_f1: 0.4421
 epoch: 14, train_loss: 1.0655, test_loss: 1.0110, test_f1: 0.4573
 epoch: 15, train_loss: 1.0617, test_loss: 1.0058, test_f1: 0.4683
 epoch: 16, train_loss: 1.0473, test_loss: 0.9934, test_f1: 0.4685
 epoch: 17, train_loss: 1.0376, test_loss: 0.9991, test_f1: 0.4729
 epoch: 18, train_loss: 1.0386, test_loss: 0.9886, test_f1: 0.4768
 epoch: 19, train_loss: 1.0362, test_loss: 0.9777, test_f1: 0.4581
 epoch: 20, train_loss: 1.0289, test_loss: 0.9753, test_f1: 0.4743
 epoch: 21, train_loss: 1.0188, test_loss: 0.9832, test_f1: 0.4682
 epoch: 22, train_loss: 1.0136, test_loss: 0.9708, test_f1: 0.4716
 epoch: 23, train_loss: 0.9979, test_loss: 0.9622, test_f1: 0.4922
 epoch: 24, train_loss: 1.0033, test_loss: 0.9522, test_f1: 0.4882
 epoch: 25, train_loss: 1.0030, test_loss: 0.9564, test_f1: 0.4840
 epoch: 26, train_loss: 0.9872, test_loss: 0.9581, test_f1: 0.4947
 epoch: 27, train_loss: 0.9944, test_loss: 0.9567, test_f1: 0.4928
 epoch: 28, train_loss: 0.9813, test_loss: 0.9693, test_f1: 0.4878
 epoch: 29, train_loss: 0.9781, test_loss: 0.9602, test_f1: 0.4974
 epoch: 30, train_loss: 0.9746, test_loss: 0.9486, test_f1: 0.4828
 epoch: 31, train_loss: 0.9776, test_loss: 0.9355, test_f1: 0.4831
 epoch: 32, train_loss: 0.9759, test_loss: 0.9826, test_f1: 0.4990
 epoch: 33, train_loss: 0.9611, test_loss: 0.9524, test_f1: 0.5055
 epoch: 34, train_loss: 0.9652, test_loss: 0.9827, test_f1: 0.5054
 epoch: 35, train_loss: 0.9653, test_loss: 0.9567, test_f1: 0.5035
 epoch: 36, train_loss: 0.9605, test_loss: 0.9576, test_f1: 0.4966
 epoch: 37, train_loss: 0.9550, test_loss: 0.9609, test_f1: 0.4938
 epoch: 38, train_loss: 0.9592, test_loss: 0.9725, test_f1: 0.5016
 epoch: 39, train_loss: 0.9574, test_loss: 0.9534, test_f1: 0.5059
 epoch: 40, train_loss: 0.9543, test_loss: 0.9325, test_f1: 0.4897
 epoch: 41, train_loss: 0.9465, test_loss: 0.9641, test_f1: 0.4956
 epoch: 42, train_loss: 0.9384, test_loss: 0.9406, test_f1: 0.4823
 epoch: 43, train_loss: 0.9353, test_loss: 0.9587, test_f1: 0.5028
 epoch: 44, train_loss: 0.9461, test_loss: 0.9640, test_f1: 0.5035
 epoch: 45, train_loss: 0.9358, test_loss: 0.9517, test_f1: 0.4830
 epoch: 46, train_loss: 0.9264, test_loss: 0.9810, test_f1: 0.4932
 epoch: 47, train_loss: 0.9277, test_loss: 0.9608, test_f1: 0.4929
 epoch: 48, train_loss: 0.9290, test_loss: 0.9780, test_f1: 0.4942
 epoch: 49, train_loss: 0.9272, test_loss: 0.9460, test_f1: 0.4900
 epoch: 50, train_loss: 0.9214, test_loss: 0.9727, test_f1: 0.4847
 epoch: 51, train_loss: 0.9223, test_loss: 0.9626, test_f1: 0.5006
 epoch: 52, train_loss: 0.9275, test_loss: 0.9559, test_f1: 0.5009
 epoch: 53, train_loss: 0.9046, test_loss: 0.9704, test_f1: 0.5043
 epoch: 54, train_loss: 0.9159, test_loss: 0.9689, test_f1: 0.4962
 epoch: 55, train_loss: 0.9005, test_loss: 0.9502, test_f1: 0.4881
 epoch: 56, train_loss: 0.9010, test_loss: 0.9798, test_f1: 0.4904
 epoch: 57, train_loss: 0.8995, test_loss: 0.9638, test_f1: 0.4885
 epoch: 58, train_loss: 0.9153, test_loss: 0.9816, test_f1: 0.4986
 epoch: 59, train_loss: 0.9035, test_loss: 0.9732, test_f1: 0.5026
 epoch: 60, train_loss: 0.8923, test_loss: 0.9729, test_f1: 0.5001
 epoch: 61, train_loss: 0.8986, test_loss: 0.9742, test_f1: 0.4898
 epoch: 62, train_loss: 0.8990, test_loss: 1.0080, test_f1: 0.5001
 epoch: 63, train_loss: 0.9014, test_loss: 0.9846, test_f1: 0.4952
 epoch: 64, train_loss: 0.9047, test_loss: 0.9693, test_f1: 0.5054
 epoch: 65, train_loss: 0.8904, test_loss: 0.9785, test_f1: 0.5030
 epoch: 66, train_loss: 0.9005, test_loss: 0.9717, test_f1: 0.5001
 epoch: 67, train_loss: 0.8982, test_loss: 0.9703, test_f1: 0.5084
 epoch: 68, train_loss: 0.8937, test_loss: 0.9830, test_f1: 0.4951
 epoch: 69, train_loss: 0.8937, test_loss: 0.9855, test_f1: 0.5015
 epoch: 70, train_loss: 0.8847, test_loss: 0.9709, test_f1: 0.4835
 epoch: 71, train_loss: 0.8869, test_loss: 0.9910, test_f1: 0.5000
 epoch: 72, train_loss: 0.8887, test_loss: 0.9604, test_f1: 0.5178
 epoch: 73, train_loss: 0.8965, test_loss: 0.9889, test_f1: 0.5050
 epoch: 74, train_loss: 0.8912, test_loss: 0.9866, test_f1: 0.4936
 epoch: 75, train_loss: 0.8759, test_loss: 0.9992, test_f1: 0.4998
 epoch: 76, train_loss: 0.8797, test_loss: 0.9887, test_f1: 0.4946
 epoch: 77, train_loss: 0.8850, test_loss: 0.9686, test_f1: 0.5158
 epoch: 78, train_loss: 0.8784, test_loss: 0.9852, test_f1: 0.5015
 epoch: 79, train_loss: 0.8820, test_loss: 0.9873, test_f1: 0.4979
 epoch: 80, train_loss: 0.8769, test_loss: 0.9820, test_f1: 0.5105
 epoch: 81, train_loss: 0.8834, test_loss: 0.9629, test_f1: 0.5216
 epoch: 82, train_loss: 0.8801, test_loss: 0.9801, test_f1: 0.4937
 epoch: 83, train_loss: 0.8876, test_loss: 1.0045, test_f1: 0.5078
 epoch: 84, train_loss: 0.8829, test_loss: 1.0003, test_f1: 0.5076
 epoch: 85, train_loss: 0.8741, test_loss: 0.9847, test_f1: 0.5131
 epoch: 86, train_loss: 0.8817, test_loss: 1.0124, test_f1: 0.5037
 epoch: 87, train_loss: 0.8730, test_loss: 1.0365, test_f1: 0.5052
 epoch: 88, train_loss: 0.8661, test_loss: 1.0043, test_f1: 0.5115
 epoch: 89, train_loss: 0.8665, test_loss: 1.0030, test_f1: 0.5093
 epoch: 90, train_loss: 0.8668, test_loss: 0.9999, test_f1: 0.5078
 epoch: 91, train_loss: 0.8668, test_loss: 1.0155, test_f1: 0.5064
 epoch: 92, train_loss: 0.8701, test_loss: 1.0200, test_f1: 0.5089
 epoch: 93, train_loss: 0.8646, test_loss: 1.0188, test_f1: 0.5057
 epoch: 94, train_loss: 0.8656, test_loss: 0.9792, test_f1: 0.5086
 epoch: 95, train_loss: 0.8530, test_loss: 0.9936, test_f1: 0.5170
 epoch: 96, train_loss: 0.8590, test_loss: 1.0194, test_f1: 0.5050
 epoch: 97, train_loss: 0.8567, test_loss: 1.0333, test_f1: 0.5141
 epoch: 98, train_loss: 0.8492, test_loss: 0.9907, test_f1: 0.5162
 epoch: 99, train_loss: 0.8757, test_loss: 1.0197, test_f1: 0.5112
##################ITERATION #5 ****************************************
 epoch: 0, train_loss: 1.2992, test_loss: 1.1854, test_f1: 0.3732
 epoch: 1, train_loss: 1.2123, test_loss: 1.1492, test_f1: 0.4444
 epoch: 2, train_loss: 1.1904, test_loss: 1.1267, test_f1: 0.4440
 epoch: 3, train_loss: 1.1770, test_loss: 1.1149, test_f1: 0.4730
 epoch: 4, train_loss: 1.1503, test_loss: 1.1048, test_f1: 0.4463
 epoch: 5, train_loss: 1.1406, test_loss: 1.0859, test_f1: 0.4664
 epoch: 6, train_loss: 1.1266, test_loss: 1.0654, test_f1: 0.4549
 epoch: 7, train_loss: 1.1121, test_loss: 1.0550, test_f1: 0.4918
 epoch: 8, train_loss: 1.1009, test_loss: 1.0554, test_f1: 0.4687
 epoch: 9, train_loss: 1.0983, test_loss: 1.0352, test_f1: 0.4970
 epoch: 10, train_loss: 1.0943, test_loss: 1.0338, test_f1: 0.4752
 epoch: 11, train_loss: 1.0918, test_loss: 1.0244, test_f1: 0.4690
 epoch: 12, train_loss: 1.0770, test_loss: 1.0295, test_f1: 0.4602
 epoch: 13, train_loss: 1.0693, test_loss: 1.0102, test_f1: 0.4676
 epoch: 14, train_loss: 1.0503, test_loss: 1.0140, test_f1: 0.4754
 epoch: 15, train_loss: 1.0550, test_loss: 1.0211, test_f1: 0.4649
 epoch: 16, train_loss: 1.0461, test_loss: 1.0136, test_f1: 0.4647
 epoch: 17, train_loss: 1.0355, test_loss: 0.9980, test_f1: 0.4769
 epoch: 18, train_loss: 1.0303, test_loss: 1.0126, test_f1: 0.4668
 epoch: 19, train_loss: 1.0392, test_loss: 0.9893, test_f1: 0.4709
 epoch: 20, train_loss: 1.0278, test_loss: 0.9851, test_f1: 0.4736
 epoch: 21, train_loss: 1.0240, test_loss: 0.9993, test_f1: 0.4588
 epoch: 22, train_loss: 1.0207, test_loss: 0.9864, test_f1: 0.4776
 epoch: 23, train_loss: 1.0200, test_loss: 0.9803, test_f1: 0.4721
 epoch: 24, train_loss: 1.0164, test_loss: 0.9992, test_f1: 0.4591
 epoch: 25, train_loss: 1.0104, test_loss: 0.9730, test_f1: 0.4666
 epoch: 26, train_loss: 1.0025, test_loss: 0.9718, test_f1: 0.4589
 epoch: 27, train_loss: 1.0004, test_loss: 0.9920, test_f1: 0.4917
 epoch: 28, train_loss: 1.0087, test_loss: 0.9897, test_f1: 0.4634
 epoch: 29, train_loss: 0.9844, test_loss: 0.9796, test_f1: 0.4703
 epoch: 30, train_loss: 0.9951, test_loss: 0.9895, test_f1: 0.4767
 epoch: 31, train_loss: 0.9772, test_loss: 0.9746, test_f1: 0.4649
 epoch: 32, train_loss: 0.9858, test_loss: 0.9762, test_f1: 0.4696
 epoch: 33, train_loss: 0.9823, test_loss: 0.9644, test_f1: 0.4759
 epoch: 34, train_loss: 0.9765, test_loss: 0.9915, test_f1: 0.4720
 epoch: 35, train_loss: 0.9775, test_loss: 0.9602, test_f1: 0.4881
 epoch: 36, train_loss: 0.9669, test_loss: 0.9754, test_f1: 0.4870
 epoch: 37, train_loss: 0.9756, test_loss: 0.9674, test_f1: 0.4805
 epoch: 38, train_loss: 0.9585, test_loss: 0.9726, test_f1: 0.4853
 epoch: 39, train_loss: 0.9555, test_loss: 0.9558, test_f1: 0.4869
 epoch: 40, train_loss: 0.9602, test_loss: 0.9977, test_f1: 0.4594
 epoch: 41, train_loss: 0.9537, test_loss: 0.9571, test_f1: 0.4800
 epoch: 42, train_loss: 0.9433, test_loss: 0.9885, test_f1: 0.4615
 epoch: 43, train_loss: 0.9441, test_loss: 0.9583, test_f1: 0.4582
 epoch: 44, train_loss: 0.9418, test_loss: 0.9444, test_f1: 0.4781
 epoch: 45, train_loss: 0.9486, test_loss: 0.9827, test_f1: 0.4712
 epoch: 46, train_loss: 0.9349, test_loss: 0.9691, test_f1: 0.4741
 epoch: 47, train_loss: 0.9205, test_loss: 0.9543, test_f1: 0.4758
 epoch: 48, train_loss: 0.9376, test_loss: 0.9611, test_f1: 0.4725
 epoch: 49, train_loss: 0.9303, test_loss: 0.9513, test_f1: 0.4860
 epoch: 50, train_loss: 0.9252, test_loss: 0.9363, test_f1: 0.4869
 epoch: 51, train_loss: 0.9112, test_loss: 0.9387, test_f1: 0.4789
 epoch: 52, train_loss: 0.9078, test_loss: 0.9473, test_f1: 0.4740
 epoch: 53, train_loss: 0.9121, test_loss: 0.9648, test_f1: 0.4778
 epoch: 54, train_loss: 0.9125, test_loss: 0.9605, test_f1: 0.4765
 epoch: 55, train_loss: 0.9067, test_loss: 0.9547, test_f1: 0.4859
 epoch: 56, train_loss: 0.9090, test_loss: 0.9838, test_f1: 0.4830
 epoch: 57, train_loss: 0.9064, test_loss: 0.9503, test_f1: 0.4668
 epoch: 58, train_loss: 0.9077, test_loss: 0.9439, test_f1: 0.4839
 epoch: 59, train_loss: 0.9005, test_loss: 0.9571, test_f1: 0.4848
 epoch: 60, train_loss: 0.8945, test_loss: 0.9560, test_f1: 0.4922
 epoch: 61, train_loss: 0.9106, test_loss: 0.9627, test_f1: 0.4747
 epoch: 62, train_loss: 0.9041, test_loss: 0.9341, test_f1: 0.5078
 epoch: 63, train_loss: 0.9016, test_loss: 0.9507, test_f1: 0.4834
 epoch: 64, train_loss: 0.9038, test_loss: 0.9429, test_f1: 0.4832
 epoch: 65, train_loss: 0.9060, test_loss: 0.9603, test_f1: 0.4830
 epoch: 66, train_loss: 0.8863, test_loss: 0.9419, test_f1: 0.4952
 epoch: 67, train_loss: 0.8983, test_loss: 1.0251, test_f1: 0.4606
 epoch: 68, train_loss: 0.8958, test_loss: 0.9729, test_f1: 0.4731
 epoch: 69, train_loss: 0.8960, test_loss: 0.9594, test_f1: 0.4896
 epoch: 70, train_loss: 0.8949, test_loss: 0.9746, test_f1: 0.4869
 epoch: 71, train_loss: 0.8927, test_loss: 1.0109, test_f1: 0.4655
 epoch: 72, train_loss: 0.8956, test_loss: 0.9673, test_f1: 0.4874
 epoch: 73, train_loss: 0.8992, test_loss: 0.9782, test_f1: 0.4915
 epoch: 74, train_loss: 0.8791, test_loss: 0.9526, test_f1: 0.4933
 epoch: 75, train_loss: 0.8807, test_loss: 0.9578, test_f1: 0.4945
 epoch: 76, train_loss: 0.8781, test_loss: 0.9570, test_f1: 0.4911
 epoch: 77, train_loss: 0.8845, test_loss: 0.9651, test_f1: 0.4931
 epoch: 78, train_loss: 0.8868, test_loss: 0.9362, test_f1: 0.4957
 epoch: 79, train_loss: 0.8763, test_loss: 0.9720, test_f1: 0.4865
 epoch: 80, train_loss: 0.8725, test_loss: 0.9522, test_f1: 0.4974
 epoch: 81, train_loss: 0.8780, test_loss: 1.0123, test_f1: 0.4753
 epoch: 82, train_loss: 0.8748, test_loss: 0.9962, test_f1: 0.4763
 epoch: 83, train_loss: 0.8702, test_loss: 0.9915, test_f1: 0.4777
 epoch: 84, train_loss: 0.8754, test_loss: 0.9574, test_f1: 0.4956
 epoch: 85, train_loss: 0.8688, test_loss: 1.0182, test_f1: 0.4685
 epoch: 86, train_loss: 0.8813, test_loss: 0.9769, test_f1: 0.4893
 epoch: 87, train_loss: 0.8810, test_loss: 0.9716, test_f1: 0.4917
 epoch: 88, train_loss: 0.8723, test_loss: 0.9619, test_f1: 0.5068
 epoch: 89, train_loss: 0.8683, test_loss: 0.9546, test_f1: 0.5083
 epoch: 90, train_loss: 0.8755, test_loss: 0.9849, test_f1: 0.4853
 epoch: 91, train_loss: 0.8623, test_loss: 0.9658, test_f1: 0.5049
 epoch: 92, train_loss: 0.8588, test_loss: 0.9705, test_f1: 0.4972
 epoch: 93, train_loss: 0.8807, test_loss: 0.9623, test_f1: 0.4938
 epoch: 94, train_loss: 0.8627, test_loss: 1.0478, test_f1: 0.4770
 epoch: 95, train_loss: 0.8765, test_loss: 0.9589, test_f1: 0.4998
 epoch: 96, train_loss: 0.8605, test_loss: 0.9944, test_f1: 0.4874
 epoch: 97, train_loss: 0.8685, test_loss: 0.9735, test_f1: 0.5116
 epoch: 98, train_loss: 0.8702, test_loss: 0.9846, test_f1: 0.5048
 epoch: 99, train_loss: 0.8530, test_loss: 0.9605, test_f1: 0.5122
##################ITERATION #6 ****************************************
 epoch: 0, train_loss: 1.3385, test_loss: 1.1878, test_f1: 0.3732
 epoch: 1, train_loss: 1.2335, test_loss: 1.1654, test_f1: 0.4045
 epoch: 2, train_loss: 1.2096, test_loss: 1.1452, test_f1: 0.4379
 epoch: 3, train_loss: 1.2000, test_loss: 1.1299, test_f1: 0.4588
 epoch: 4, train_loss: 1.1880, test_loss: 1.1175, test_f1: 0.4485
 epoch: 5, train_loss: 1.1644, test_loss: 1.1060, test_f1: 0.4451
 epoch: 6, train_loss: 1.1489, test_loss: 1.0952, test_f1: 0.4493
 epoch: 7, train_loss: 1.1302, test_loss: 1.0814, test_f1: 0.4521
 epoch: 8, train_loss: 1.1305, test_loss: 1.0775, test_f1: 0.4383
 epoch: 9, train_loss: 1.1223, test_loss: 1.0800, test_f1: 0.4542
 epoch: 10, train_loss: 1.1184, test_loss: 1.0647, test_f1: 0.4511
 epoch: 11, train_loss: 1.1019, test_loss: 1.0599, test_f1: 0.4424
 epoch: 12, train_loss: 1.1054, test_loss: 1.0637, test_f1: 0.4671
 epoch: 13, train_loss: 1.0791, test_loss: 1.0475, test_f1: 0.4366
 epoch: 14, train_loss: 1.0869, test_loss: 1.0421, test_f1: 0.4386
 epoch: 15, train_loss: 1.0711, test_loss: 1.0322, test_f1: 0.4392
 epoch: 16, train_loss: 1.0655, test_loss: 1.0368, test_f1: 0.4425
 epoch: 17, train_loss: 1.0651, test_loss: 1.0139, test_f1: 0.4370
 epoch: 18, train_loss: 1.0634, test_loss: 1.0180, test_f1: 0.4372
 epoch: 19, train_loss: 1.0477, test_loss: 1.0146, test_f1: 0.4629
 epoch: 20, train_loss: 1.0527, test_loss: 1.0086, test_f1: 0.4505
 epoch: 21, train_loss: 1.0446, test_loss: 0.9954, test_f1: 0.4725
 epoch: 22, train_loss: 1.0310, test_loss: 1.0090, test_f1: 0.4616
 epoch: 23, train_loss: 1.0297, test_loss: 0.9982, test_f1: 0.4737
 epoch: 24, train_loss: 1.0299, test_loss: 0.9920, test_f1: 0.4559
 epoch: 25, train_loss: 1.0101, test_loss: 0.9959, test_f1: 0.4628
 epoch: 26, train_loss: 1.0205, test_loss: 0.9799, test_f1: 0.4724
 epoch: 27, train_loss: 1.0062, test_loss: 1.0149, test_f1: 0.4555
 epoch: 28, train_loss: 1.0042, test_loss: 0.9828, test_f1: 0.4593
 epoch: 29, train_loss: 1.0024, test_loss: 0.9871, test_f1: 0.4516
 epoch: 30, train_loss: 0.9953, test_loss: 0.9877, test_f1: 0.4724
 epoch: 31, train_loss: 0.9912, test_loss: 0.9895, test_f1: 0.4752
 epoch: 32, train_loss: 0.9849, test_loss: 0.9960, test_f1: 0.4454
 epoch: 33, train_loss: 0.9777, test_loss: 0.9970, test_f1: 0.4675
 epoch: 34, train_loss: 0.9838, test_loss: 0.9925, test_f1: 0.4785
 epoch: 35, train_loss: 0.9724, test_loss: 0.9945, test_f1: 0.4580
 epoch: 36, train_loss: 0.9839, test_loss: 0.9952, test_f1: 0.4538
 epoch: 37, train_loss: 0.9586, test_loss: 1.0069, test_f1: 0.4521
 epoch: 38, train_loss: 0.9638, test_loss: 0.9872, test_f1: 0.4623
 epoch: 39, train_loss: 0.9613, test_loss: 0.9988, test_f1: 0.4660
 epoch: 40, train_loss: 0.9536, test_loss: 1.0044, test_f1: 0.4656
 epoch: 41, train_loss: 0.9540, test_loss: 1.0022, test_f1: 0.4653
 epoch: 42, train_loss: 0.9511, test_loss: 0.9864, test_f1: 0.4751
 epoch: 43, train_loss: 0.9470, test_loss: 0.9956, test_f1: 0.4551
 epoch: 44, train_loss: 0.9424, test_loss: 0.9972, test_f1: 0.4655
 epoch: 45, train_loss: 0.9439, test_loss: 1.0046, test_f1: 0.4595
 epoch: 46, train_loss: 0.9256, test_loss: 1.0158, test_f1: 0.4555
 epoch: 47, train_loss: 0.9300, test_loss: 0.9836, test_f1: 0.4788
 epoch: 48, train_loss: 0.9254, test_loss: 1.0021, test_f1: 0.4719
 epoch: 49, train_loss: 0.9193, test_loss: 1.0050, test_f1: 0.4826
 epoch: 50, train_loss: 0.9173, test_loss: 1.0135, test_f1: 0.4635
 epoch: 51, train_loss: 0.9171, test_loss: 1.0053, test_f1: 0.4734
 epoch: 52, train_loss: 0.9031, test_loss: 1.0240, test_f1: 0.4801
 epoch: 53, train_loss: 0.9195, test_loss: 1.0181, test_f1: 0.4787
 epoch: 54, train_loss: 0.9057, test_loss: 1.0208, test_f1: 0.4951
 epoch: 55, train_loss: 0.9087, test_loss: 1.0145, test_f1: 0.4790
 epoch: 56, train_loss: 0.9056, test_loss: 0.9980, test_f1: 0.4753
 epoch: 57, train_loss: 0.8973, test_loss: 1.0319, test_f1: 0.4726
 epoch: 58, train_loss: 0.9060, test_loss: 1.0102, test_f1: 0.4832
 epoch: 59, train_loss: 0.8951, test_loss: 1.0365, test_f1: 0.4801
 epoch: 60, train_loss: 0.9001, test_loss: 1.0280, test_f1: 0.4628
 epoch: 61, train_loss: 0.9011, test_loss: 1.0142, test_f1: 0.4595
 epoch: 62, train_loss: 0.8940, test_loss: 1.0478, test_f1: 0.4549
 epoch: 63, train_loss: 0.8849, test_loss: 1.0475, test_f1: 0.4490
 epoch: 64, train_loss: 0.8993, test_loss: 1.0436, test_f1: 0.4742
 epoch: 65, train_loss: 0.8891, test_loss: 1.0320, test_f1: 0.5088
 epoch: 66, train_loss: 0.8880, test_loss: 1.0246, test_f1: 0.4993
 epoch: 67, train_loss: 0.8997, test_loss: 1.0515, test_f1: 0.4486
 epoch: 68, train_loss: 0.8952, test_loss: 1.0585, test_f1: 0.4599
 epoch: 69, train_loss: 0.8886, test_loss: 1.0093, test_f1: 0.4756
 epoch: 70, train_loss: 0.8932, test_loss: 1.0650, test_f1: 0.4638
 epoch: 71, train_loss: 0.8886, test_loss: 1.0338, test_f1: 0.4683
 epoch: 72, train_loss: 0.8878, test_loss: 1.0503, test_f1: 0.4621
 epoch: 73, train_loss: 0.8744, test_loss: 1.0916, test_f1: 0.4733
 epoch: 74, train_loss: 0.8751, test_loss: 1.0751, test_f1: 0.4701
 epoch: 75, train_loss: 0.8776, test_loss: 1.0418, test_f1: 0.4940
 epoch: 76, train_loss: 0.8757, test_loss: 1.0689, test_f1: 0.4515
 epoch: 77, train_loss: 0.8702, test_loss: 1.0244, test_f1: 0.4820
 epoch: 78, train_loss: 0.8791, test_loss: 1.0984, test_f1: 0.4549
 epoch: 79, train_loss: 0.8639, test_loss: 1.0860, test_f1: 0.4474
 epoch: 80, train_loss: 0.8632, test_loss: 1.0797, test_f1: 0.4493
 epoch: 81, train_loss: 0.8677, test_loss: 1.0849, test_f1: 0.4534
 epoch: 82, train_loss: 0.8648, test_loss: 1.0645, test_f1: 0.4568
 epoch: 83, train_loss: 0.8636, test_loss: 1.1284, test_f1: 0.4542
 epoch: 84, train_loss: 0.8758, test_loss: 1.0501, test_f1: 0.5053
 epoch: 85, train_loss: 0.8722, test_loss: 1.0672, test_f1: 0.4783
 epoch: 86, train_loss: 0.8546, test_loss: 1.0597, test_f1: 0.4554
 epoch: 87, train_loss: 0.8670, test_loss: 1.0701, test_f1: 0.4532
 epoch: 88, train_loss: 0.8681, test_loss: 1.0797, test_f1: 0.4654
 epoch: 89, train_loss: 0.8733, test_loss: 1.0968, test_f1: 0.4588
 epoch: 90, train_loss: 0.8534, test_loss: 1.1249, test_f1: 0.4652
 epoch: 91, train_loss: 0.8557, test_loss: 1.1145, test_f1: 0.4555
 epoch: 92, train_loss: 0.8592, test_loss: 1.1060, test_f1: 0.4622
 epoch: 93, train_loss: 0.8572, test_loss: 1.0793, test_f1: 0.4469
 epoch: 94, train_loss: 0.8531, test_loss: 1.0474, test_f1: 0.4745
 epoch: 95, train_loss: 0.8517, test_loss: 1.1094, test_f1: 0.4593
 epoch: 96, train_loss: 0.8497, test_loss: 1.0765, test_f1: 0.4668
 epoch: 97, train_loss: 0.8500, test_loss: 1.1356, test_f1: 0.4666
 epoch: 98, train_loss: 0.8609, test_loss: 1.0754, test_f1: 0.4673
 epoch: 99, train_loss: 0.8477, test_loss: 1.0773, test_f1: 0.4617
##################ITERATION #7 ****************************************
 epoch: 0, train_loss: 1.3304, test_loss: 1.2060, test_f1: 0.3999
 epoch: 1, train_loss: 1.2500, test_loss: 1.1836, test_f1: 0.3928
 epoch: 2, train_loss: 1.2323, test_loss: 1.1704, test_f1: 0.3804
 epoch: 3, train_loss: 1.2304, test_loss: 1.1617, test_f1: 0.4038
 epoch: 4, train_loss: 1.2068, test_loss: 1.1444, test_f1: 0.3953
 epoch: 5, train_loss: 1.1810, test_loss: 1.1335, test_f1: 0.4113
 epoch: 6, train_loss: 1.1799, test_loss: 1.1237, test_f1: 0.4201
 epoch: 7, train_loss: 1.1689, test_loss: 1.1064, test_f1: 0.4265
 epoch: 8, train_loss: 1.1486, test_loss: 1.0927, test_f1: 0.4405
 epoch: 9, train_loss: 1.1471, test_loss: 1.0809, test_f1: 0.4443
 epoch: 10, train_loss: 1.1362, test_loss: 1.0810, test_f1: 0.4328
 epoch: 11, train_loss: 1.1332, test_loss: 1.0674, test_f1: 0.4230
 epoch: 12, train_loss: 1.1247, test_loss: 1.0624, test_f1: 0.4267
 epoch: 13, train_loss: 1.1139, test_loss: 1.0522, test_f1: 0.4176
 epoch: 14, train_loss: 1.1050, test_loss: 1.0445, test_f1: 0.4308
 epoch: 15, train_loss: 1.0985, test_loss: 1.0351, test_f1: 0.4284
 epoch: 16, train_loss: 1.0855, test_loss: 1.0304, test_f1: 0.4265
 epoch: 17, train_loss: 1.0802, test_loss: 1.0163, test_f1: 0.4410
 epoch: 18, train_loss: 1.0740, test_loss: 1.0172, test_f1: 0.4364
 epoch: 19, train_loss: 1.0698, test_loss: 1.0122, test_f1: 0.4398
 epoch: 20, train_loss: 1.0647, test_loss: 1.0035, test_f1: 0.4402
 epoch: 21, train_loss: 1.0618, test_loss: 0.9981, test_f1: 0.4528
 epoch: 22, train_loss: 1.0566, test_loss: 0.9979, test_f1: 0.4479
 epoch: 23, train_loss: 1.0436, test_loss: 0.9917, test_f1: 0.4480
 epoch: 24, train_loss: 1.0360, test_loss: 1.0021, test_f1: 0.4464
 epoch: 25, train_loss: 1.0321, test_loss: 0.9879, test_f1: 0.4469
 epoch: 26, train_loss: 1.0324, test_loss: 0.9837, test_f1: 0.4551
 epoch: 27, train_loss: 1.0295, test_loss: 0.9869, test_f1: 0.4480
 epoch: 28, train_loss: 1.0292, test_loss: 0.9865, test_f1: 0.4558
 epoch: 29, train_loss: 1.0191, test_loss: 0.9723, test_f1: 0.4611
 epoch: 30, train_loss: 1.0158, test_loss: 0.9722, test_f1: 0.4613
 epoch: 31, train_loss: 1.0082, test_loss: 0.9683, test_f1: 0.4490
 epoch: 32, train_loss: 1.0073, test_loss: 0.9762, test_f1: 0.4483
 epoch: 33, train_loss: 0.9965, test_loss: 0.9595, test_f1: 0.4596
 epoch: 34, train_loss: 0.9960, test_loss: 0.9649, test_f1: 0.4376
 epoch: 35, train_loss: 0.9926, test_loss: 0.9602, test_f1: 0.4579
 epoch: 36, train_loss: 0.9967, test_loss: 0.9547, test_f1: 0.4581
 epoch: 37, train_loss: 0.9901, test_loss: 0.9663, test_f1: 0.4401
 epoch: 38, train_loss: 0.9865, test_loss: 0.9707, test_f1: 0.4576
 epoch: 39, train_loss: 0.9871, test_loss: 0.9681, test_f1: 0.4556
 epoch: 40, train_loss: 0.9681, test_loss: 0.9622, test_f1: 0.4786
 epoch: 41, train_loss: 0.9834, test_loss: 0.9501, test_f1: 0.4599
 epoch: 42, train_loss: 0.9732, test_loss: 0.9615, test_f1: 0.4467
 epoch: 43, train_loss: 0.9628, test_loss: 0.9603, test_f1: 0.4616
 epoch: 44, train_loss: 0.9588, test_loss: 0.9368, test_f1: 0.4597
 epoch: 45, train_loss: 0.9608, test_loss: 0.9365, test_f1: 0.4696
 epoch: 46, train_loss: 0.9529, test_loss: 0.9590, test_f1: 0.4560
 epoch: 47, train_loss: 0.9477, test_loss: 0.9573, test_f1: 0.4767
 epoch: 48, train_loss: 0.9491, test_loss: 0.9465, test_f1: 0.4599
 epoch: 49, train_loss: 0.9491, test_loss: 0.9550, test_f1: 0.4755
 epoch: 50, train_loss: 0.9549, test_loss: 0.9598, test_f1: 0.4503
 epoch: 51, train_loss: 0.9416, test_loss: 0.9647, test_f1: 0.4569
 epoch: 52, train_loss: 0.9512, test_loss: 0.9467, test_f1: 0.4741
 epoch: 53, train_loss: 0.9332, test_loss: 0.9495, test_f1: 0.4884
 epoch: 54, train_loss: 0.9424, test_loss: 0.9539, test_f1: 0.4835
 epoch: 55, train_loss: 0.9308, test_loss: 0.9461, test_f1: 0.4936
 epoch: 56, train_loss: 0.9302, test_loss: 0.9270, test_f1: 0.4940
 epoch: 57, train_loss: 0.9293, test_loss: 0.9511, test_f1: 0.4857
 epoch: 58, train_loss: 0.9356, test_loss: 0.9484, test_f1: 0.5134
 epoch: 59, train_loss: 0.9275, test_loss: 0.9455, test_f1: 0.4877
 epoch: 60, train_loss: 0.9256, test_loss: 0.9581, test_f1: 0.4561
 epoch: 61, train_loss: 0.9323, test_loss: 0.9381, test_f1: 0.4690
 epoch: 62, train_loss: 0.9242, test_loss: 0.9572, test_f1: 0.4980
 epoch: 63, train_loss: 0.9167, test_loss: 0.9356, test_f1: 0.4946
 epoch: 64, train_loss: 0.9188, test_loss: 0.9625, test_f1: 0.5058
 epoch: 65, train_loss: 0.9186, test_loss: 0.9348, test_f1: 0.4863
 epoch: 66, train_loss: 0.9274, test_loss: 0.9628, test_f1: 0.5132
 epoch: 67, train_loss: 0.9170, test_loss: 0.9534, test_f1: 0.5182
 epoch: 68, train_loss: 0.9207, test_loss: 0.9455, test_f1: 0.4902
 epoch: 69, train_loss: 0.9074, test_loss: 0.9451, test_f1: 0.4838
 epoch: 70, train_loss: 0.9198, test_loss: 0.9544, test_f1: 0.5191
 epoch: 71, train_loss: 0.9082, test_loss: 0.9518, test_f1: 0.4820
 epoch: 72, train_loss: 0.9195, test_loss: 0.9299, test_f1: 0.4986
 epoch: 73, train_loss: 0.9206, test_loss: 0.9514, test_f1: 0.5070
 epoch: 74, train_loss: 0.9183, test_loss: 0.9689, test_f1: 0.4715
 epoch: 75, train_loss: 0.9087, test_loss: 0.9458, test_f1: 0.4977
 epoch: 76, train_loss: 0.8978, test_loss: 0.9563, test_f1: 0.4798
 epoch: 77, train_loss: 0.9086, test_loss: 0.9453, test_f1: 0.4937
 epoch: 78, train_loss: 0.9070, test_loss: 0.9557, test_f1: 0.4714
 epoch: 79, train_loss: 0.8999, test_loss: 0.9656, test_f1: 0.4794
 epoch: 80, train_loss: 0.9044, test_loss: 0.9445, test_f1: 0.4966
 epoch: 81, train_loss: 0.8929, test_loss: 0.9558, test_f1: 0.4908
 epoch: 82, train_loss: 0.8922, test_loss: 0.9584, test_f1: 0.5023
 epoch: 83, train_loss: 0.8920, test_loss: 0.9770, test_f1: 0.4993
 epoch: 84, train_loss: 0.9038, test_loss: 0.9469, test_f1: 0.4998
 epoch: 85, train_loss: 0.8972, test_loss: 0.9344, test_f1: 0.4851
 epoch: 86, train_loss: 0.8864, test_loss: 0.9619, test_f1: 0.4798
 epoch: 87, train_loss: 0.8982, test_loss: 0.9747, test_f1: 0.4940
 epoch: 88, train_loss: 0.8927, test_loss: 0.9523, test_f1: 0.4935
 epoch: 89, train_loss: 0.8944, test_loss: 0.9650, test_f1: 0.5055
 epoch: 90, train_loss: 0.8932, test_loss: 0.9461, test_f1: 0.4909
 epoch: 91, train_loss: 0.8919, test_loss: 0.9681, test_f1: 0.5137
 epoch: 92, train_loss: 0.8954, test_loss: 0.9670, test_f1: 0.4991
 epoch: 93, train_loss: 0.8955, test_loss: 0.9416, test_f1: 0.5068
 epoch: 94, train_loss: 0.8872, test_loss: 0.9510, test_f1: 0.4941
 epoch: 95, train_loss: 0.8952, test_loss: 0.9602, test_f1: 0.4946
 epoch: 96, train_loss: 0.8814, test_loss: 0.9715, test_f1: 0.5009
 epoch: 97, train_loss: 0.8943, test_loss: 0.9627, test_f1: 0.5159
 epoch: 98, train_loss: 0.8896, test_loss: 0.9654, test_f1: 0.5069
 epoch: 99, train_loss: 0.8801, test_loss: 0.9665, test_f1: 0.5213
##################ITERATION #8 ****************************************
 epoch: 0, train_loss: 1.3590, test_loss: 1.2077, test_f1: 0.3399
 epoch: 1, train_loss: 1.2603, test_loss: 1.1744, test_f1: 0.3875
 epoch: 2, train_loss: 1.2324, test_loss: 1.1463, test_f1: 0.3984
 epoch: 3, train_loss: 1.2116, test_loss: 1.1446, test_f1: 0.4074
 epoch: 4, train_loss: 1.2020, test_loss: 1.1313, test_f1: 0.4218
 epoch: 5, train_loss: 1.1784, test_loss: 1.1106, test_f1: 0.4282
 epoch: 6, train_loss: 1.1758, test_loss: 1.1194, test_f1: 0.4255
 epoch: 7, train_loss: 1.1615, test_loss: 1.0919, test_f1: 0.4397
 epoch: 8, train_loss: 1.1529, test_loss: 1.0778, test_f1: 0.4523
 epoch: 9, train_loss: 1.1330, test_loss: 1.0963, test_f1: 0.4373
 epoch: 10, train_loss: 1.1281, test_loss: 1.0551, test_f1: 0.4665
 epoch: 11, train_loss: 1.1158, test_loss: 1.0506, test_f1: 0.4740
 epoch: 12, train_loss: 1.1080, test_loss: 1.0327, test_f1: 0.4592
 epoch: 13, train_loss: 1.0956, test_loss: 1.0218, test_f1: 0.4668
 epoch: 14, train_loss: 1.0874, test_loss: 1.0214, test_f1: 0.4580
 epoch: 15, train_loss: 1.0878, test_loss: 0.9991, test_f1: 0.4648
 epoch: 16, train_loss: 1.0688, test_loss: 0.9987, test_f1: 0.4646
 epoch: 17, train_loss: 1.0587, test_loss: 0.9874, test_f1: 0.5154
 epoch: 18, train_loss: 1.0538, test_loss: 0.9833, test_f1: 0.4939
 epoch: 19, train_loss: 1.0559, test_loss: 0.9806, test_f1: 0.4838
 epoch: 20, train_loss: 1.0434, test_loss: 0.9619, test_f1: 0.4748
 epoch: 21, train_loss: 1.0306, test_loss: 0.9645, test_f1: 0.4853
 epoch: 22, train_loss: 1.0277, test_loss: 0.9671, test_f1: 0.5056
 epoch: 23, train_loss: 1.0252, test_loss: 0.9483, test_f1: 0.4965
 epoch: 24, train_loss: 1.0211, test_loss: 0.9588, test_f1: 0.4771
 epoch: 25, train_loss: 1.0224, test_loss: 0.9498, test_f1: 0.4705
 epoch: 26, train_loss: 1.0095, test_loss: 0.9532, test_f1: 0.4664
 epoch: 27, train_loss: 1.0000, test_loss: 0.9423, test_f1: 0.4880
 epoch: 28, train_loss: 0.9889, test_loss: 0.9464, test_f1: 0.4896
 epoch: 29, train_loss: 0.9932, test_loss: 0.9433, test_f1: 0.4816
 epoch: 30, train_loss: 0.9852, test_loss: 0.9533, test_f1: 0.4848
 epoch: 31, train_loss: 0.9777, test_loss: 0.9391, test_f1: 0.4813
 epoch: 32, train_loss: 0.9815, test_loss: 0.9470, test_f1: 0.4837
 epoch: 33, train_loss: 0.9778, test_loss: 0.9632, test_f1: 0.4674
 epoch: 34, train_loss: 0.9740, test_loss: 0.9474, test_f1: 0.4883
 epoch: 35, train_loss: 0.9723, test_loss: 0.9416, test_f1: 0.4899
 epoch: 36, train_loss: 0.9580, test_loss: 0.9467, test_f1: 0.4634
 epoch: 37, train_loss: 0.9540, test_loss: 0.9534, test_f1: 0.4812
 epoch: 38, train_loss: 0.9395, test_loss: 0.9469, test_f1: 0.5100
 epoch: 39, train_loss: 0.9397, test_loss: 0.9341, test_f1: 0.4905
 epoch: 40, train_loss: 0.9402, test_loss: 0.9227, test_f1: 0.5048
 epoch: 41, train_loss: 0.9325, test_loss: 0.9333, test_f1: 0.4991
 epoch: 42, train_loss: 0.9249, test_loss: 0.9118, test_f1: 0.5128
 epoch: 43, train_loss: 0.9217, test_loss: 0.9251, test_f1: 0.5038
 epoch: 44, train_loss: 0.9197, test_loss: 0.9318, test_f1: 0.4934
 epoch: 45, train_loss: 0.9357, test_loss: 0.9405, test_f1: 0.4935
 epoch: 46, train_loss: 0.9188, test_loss: 0.9402, test_f1: 0.4951
 epoch: 47, train_loss: 0.9155, test_loss: 0.9367, test_f1: 0.4993
 epoch: 48, train_loss: 0.9128, test_loss: 0.9200, test_f1: 0.5205
 epoch: 49, train_loss: 0.9061, test_loss: 0.9429, test_f1: 0.5009
 epoch: 50, train_loss: 0.9007, test_loss: 0.9317, test_f1: 0.5013
 epoch: 51, train_loss: 0.9021, test_loss: 0.9550, test_f1: 0.5016
 epoch: 52, train_loss: 0.8997, test_loss: 0.9165, test_f1: 0.5126
 epoch: 53, train_loss: 0.8866, test_loss: 0.9269, test_f1: 0.5100
 epoch: 54, train_loss: 0.8935, test_loss: 0.9224, test_f1: 0.5156
 epoch: 55, train_loss: 0.8877, test_loss: 0.9645, test_f1: 0.5011
 epoch: 56, train_loss: 0.8881, test_loss: 0.9163, test_f1: 0.5203
 epoch: 57, train_loss: 0.8739, test_loss: 0.9361, test_f1: 0.5121
 epoch: 58, train_loss: 0.8880, test_loss: 0.9390, test_f1: 0.4979
 epoch: 59, train_loss: 0.8810, test_loss: 0.9255, test_f1: 0.5038
 epoch: 60, train_loss: 0.8759, test_loss: 0.9449, test_f1: 0.5168
 epoch: 61, train_loss: 0.8818, test_loss: 0.9209, test_f1: 0.5146
 epoch: 62, train_loss: 0.8803, test_loss: 0.9785, test_f1: 0.5056
 epoch: 63, train_loss: 0.8866, test_loss: 0.9364, test_f1: 0.5014
 epoch: 64, train_loss: 0.8745, test_loss: 0.9542, test_f1: 0.5164
 epoch: 65, train_loss: 0.8766, test_loss: 0.9427, test_f1: 0.5040
 epoch: 66, train_loss: 0.8742, test_loss: 0.9413, test_f1: 0.5008
 epoch: 67, train_loss: 0.8723, test_loss: 0.9656, test_f1: 0.5065
 epoch: 68, train_loss: 0.8791, test_loss: 0.9240, test_f1: 0.5081
 epoch: 69, train_loss: 0.8814, test_loss: 0.9425, test_f1: 0.5085
 epoch: 70, train_loss: 0.8619, test_loss: 0.9454, test_f1: 0.5104
 epoch: 71, train_loss: 0.8642, test_loss: 0.9504, test_f1: 0.4993
 epoch: 72, train_loss: 0.8719, test_loss: 0.9326, test_f1: 0.5233
 epoch: 73, train_loss: 0.8650, test_loss: 0.9408, test_f1: 0.5174
 epoch: 74, train_loss: 0.8559, test_loss: 0.9291, test_f1: 0.5090
 epoch: 75, train_loss: 0.8506, test_loss: 0.9273, test_f1: 0.5344
 epoch: 76, train_loss: 0.8602, test_loss: 0.9421, test_f1: 0.5139
 epoch: 77, train_loss: 0.8574, test_loss: 0.9372, test_f1: 0.5043
 epoch: 78, train_loss: 0.8527, test_loss: 0.9409, test_f1: 0.5142
 epoch: 79, train_loss: 0.8496, test_loss: 0.9325, test_f1: 0.5113
 epoch: 80, train_loss: 0.8548, test_loss: 0.9541, test_f1: 0.5080
 epoch: 81, train_loss: 0.8519, test_loss: 0.9522, test_f1: 0.5074
 epoch: 82, train_loss: 0.8584, test_loss: 0.9675, test_f1: 0.5159
 epoch: 83, train_loss: 0.8522, test_loss: 0.9437, test_f1: 0.5165
 epoch: 84, train_loss: 0.8484, test_loss: 0.9599, test_f1: 0.5162
 epoch: 85, train_loss: 0.8440, test_loss: 0.9850, test_f1: 0.5332
 epoch: 86, train_loss: 0.8524, test_loss: 0.9514, test_f1: 0.5110
 epoch: 87, train_loss: 0.8508, test_loss: 0.9682, test_f1: 0.4947
 epoch: 88, train_loss: 0.8440, test_loss: 0.9655, test_f1: 0.5198
 epoch: 89, train_loss: 0.8480, test_loss: 0.9623, test_f1: 0.5242
 epoch: 90, train_loss: 0.8422, test_loss: 0.9425, test_f1: 0.5262
 epoch: 91, train_loss: 0.8345, test_loss: 0.9679, test_f1: 0.5160
 epoch: 92, train_loss: 0.8374, test_loss: 0.9423, test_f1: 0.5195
 epoch: 93, train_loss: 0.8392, test_loss: 0.9425, test_f1: 0.5210
 epoch: 94, train_loss: 0.8443, test_loss: 0.9727, test_f1: 0.5178
 epoch: 95, train_loss: 0.8181, test_loss: 0.9567, test_f1: 0.5131
 epoch: 96, train_loss: 0.8296, test_loss: 0.9619, test_f1: 0.5179
 epoch: 97, train_loss: 0.8378, test_loss: 0.9740, test_f1: 0.5245
 epoch: 98, train_loss: 0.8220, test_loss: 0.9651, test_f1: 0.5230
 epoch: 99, train_loss: 0.8233, test_loss: 0.9802, test_f1: 0.5123
##################ITERATION #9 ****************************************
 epoch: 0, train_loss: 1.3551, test_loss: 1.2215, test_f1: 0.3244
 epoch: 1, train_loss: 1.2588, test_loss: 1.1764, test_f1: 0.3588
 epoch: 2, train_loss: 1.2393, test_loss: 1.1595, test_f1: 0.3735
 epoch: 3, train_loss: 1.2248, test_loss: 1.1639, test_f1: 0.3797
 epoch: 4, train_loss: 1.2062, test_loss: 1.1366, test_f1: 0.4249
 epoch: 5, train_loss: 1.1846, test_loss: 1.1086, test_f1: 0.4285
 epoch: 6, train_loss: 1.1656, test_loss: 1.0941, test_f1: 0.4480
 epoch: 7, train_loss: 1.1431, test_loss: 1.1043, test_f1: 0.4339
 epoch: 8, train_loss: 1.1430, test_loss: 1.0815, test_f1: 0.4589
 epoch: 9, train_loss: 1.1293, test_loss: 1.0551, test_f1: 0.4671
 epoch: 10, train_loss: 1.1055, test_loss: 1.0462, test_f1: 0.4573
 epoch: 11, train_loss: 1.1062, test_loss: 1.0390, test_f1: 0.4760
 epoch: 12, train_loss: 1.0964, test_loss: 1.0324, test_f1: 0.4624
 epoch: 13, train_loss: 1.0950, test_loss: 1.0178, test_f1: 0.4673
 epoch: 14, train_loss: 1.0834, test_loss: 1.1580, test_f1: 0.4391
 epoch: 15, train_loss: 1.0783, test_loss: 1.0066, test_f1: 0.4702
 epoch: 16, train_loss: 1.0583, test_loss: 1.0089, test_f1: 0.4885
 epoch: 17, train_loss: 1.0550, test_loss: 1.3100, test_f1: 0.4383
 epoch: 18, train_loss: 1.0456, test_loss: 1.3335, test_f1: 0.4362
 epoch: 19, train_loss: 1.0425, test_loss: 0.9895, test_f1: 0.4638
 epoch: 20, train_loss: 1.0318, test_loss: 0.9870, test_f1: 0.4960
 epoch: 21, train_loss: 1.0331, test_loss: 1.0228, test_f1: 0.4751
 epoch: 22, train_loss: 1.0256, test_loss: 0.9885, test_f1: 0.4747
 epoch: 23, train_loss: 1.0160, test_loss: 1.0415, test_f1: 0.4847
 epoch: 24, train_loss: 1.0175, test_loss: 0.9769, test_f1: 0.4979
 epoch: 25, train_loss: 1.0074, test_loss: 1.3331, test_f1: 0.4475
 epoch: 26, train_loss: 1.0103, test_loss: 0.9567, test_f1: 0.4871
 epoch: 27, train_loss: 1.0010, test_loss: 0.9496, test_f1: 0.4840
 epoch: 28, train_loss: 1.0127, test_loss: 0.9508, test_f1: 0.4879
 epoch: 29, train_loss: 0.9941, test_loss: 0.9529, test_f1: 0.4728
 epoch: 30, train_loss: 0.9983, test_loss: 0.9515, test_f1: 0.4552
 epoch: 31, train_loss: 0.9921, test_loss: 0.9543, test_f1: 0.4720
 epoch: 32, train_loss: 0.9876, test_loss: 1.0233, test_f1: 0.4743
 epoch: 33, train_loss: 0.9736, test_loss: 0.9503, test_f1: 0.4924
 epoch: 34, train_loss: 0.9808, test_loss: 0.9459, test_f1: 0.4896
 epoch: 35, train_loss: 0.9673, test_loss: 0.9661, test_f1: 0.4696
 epoch: 36, train_loss: 0.9678, test_loss: 0.9369, test_f1: 0.4790
 epoch: 37, train_loss: 0.9594, test_loss: 0.9273, test_f1: 0.4905
 epoch: 38, train_loss: 0.9635, test_loss: 0.9338, test_f1: 0.4937
 epoch: 39, train_loss: 0.9570, test_loss: 0.9224, test_f1: 0.4984
 epoch: 40, train_loss: 0.9437, test_loss: 0.9177, test_f1: 0.5043
 epoch: 41, train_loss: 0.9520, test_loss: 0.9463, test_f1: 0.4897
 epoch: 42, train_loss: 0.9433, test_loss: 0.9367, test_f1: 0.5072
 epoch: 43, train_loss: 0.9371, test_loss: 0.9325, test_f1: 0.5053
 epoch: 44, train_loss: 0.9446, test_loss: 0.9346, test_f1: 0.5107
 epoch: 45, train_loss: 0.9366, test_loss: 0.9270, test_f1: 0.5076
 epoch: 46, train_loss: 0.9258, test_loss: 0.9236, test_f1: 0.5015
 epoch: 47, train_loss: 0.9293, test_loss: 0.9186, test_f1: 0.5029
 epoch: 48, train_loss: 0.9202, test_loss: 0.9260, test_f1: 0.4959
 epoch: 49, train_loss: 0.9306, test_loss: 0.9125, test_f1: 0.5233
 epoch: 50, train_loss: 0.9159, test_loss: 0.9187, test_f1: 0.4903
 epoch: 51, train_loss: 0.9099, test_loss: 0.9221, test_f1: 0.5131
 epoch: 52, train_loss: 0.9115, test_loss: 0.9061, test_f1: 0.5078
 epoch: 53, train_loss: 0.9087, test_loss: 0.9243, test_f1: 0.5098
 epoch: 54, train_loss: 0.9083, test_loss: 0.9199, test_f1: 0.5127
 epoch: 55, train_loss: 0.9124, test_loss: 0.9192, test_f1: 0.5091
 epoch: 56, train_loss: 0.9062, test_loss: 0.9195, test_f1: 0.5128
 epoch: 57, train_loss: 0.9061, test_loss: 0.9260, test_f1: 0.5063
 epoch: 58, train_loss: 0.9015, test_loss: 0.9233, test_f1: 0.5116
 epoch: 59, train_loss: 0.9009, test_loss: 0.9225, test_f1: 0.5052
 epoch: 60, train_loss: 0.9008, test_loss: 0.9211, test_f1: 0.5092
 epoch: 61, train_loss: 0.8987, test_loss: 0.9200, test_f1: 0.5071
 epoch: 62, train_loss: 0.9101, test_loss: 0.9267, test_f1: 0.5247
 epoch: 63, train_loss: 0.8900, test_loss: 0.9214, test_f1: 0.5145
 epoch: 64, train_loss: 0.8951, test_loss: 0.9186, test_f1: 0.5202
 epoch: 65, train_loss: 0.8927, test_loss: 0.9183, test_f1: 0.5115
 epoch: 66, train_loss: 0.9012, test_loss: 0.9220, test_f1: 0.5111
 epoch: 67, train_loss: 0.8957, test_loss: 0.9294, test_f1: 0.5249
 epoch: 68, train_loss: 0.8908, test_loss: 0.9136, test_f1: 0.5329
 epoch: 69, train_loss: 0.8875, test_loss: 0.9121, test_f1: 0.5170
 epoch: 70, train_loss: 0.8768, test_loss: 0.9309, test_f1: 0.5114
 epoch: 71, train_loss: 0.8862, test_loss: 0.9257, test_f1: 0.5164
 epoch: 72, train_loss: 0.9011, test_loss: 0.9346, test_f1: 0.5171
 epoch: 73, train_loss: 0.8797, test_loss: 0.9227, test_f1: 0.5241
 epoch: 74, train_loss: 0.8866, test_loss: 0.9241, test_f1: 0.5323
 epoch: 75, train_loss: 0.8754, test_loss: 0.9338, test_f1: 0.5093
 epoch: 76, train_loss: 0.8836, test_loss: 0.9249, test_f1: 0.5140
 epoch: 77, train_loss: 0.8855, test_loss: 0.9112, test_f1: 0.5137
 epoch: 78, train_loss: 0.8776, test_loss: 0.9192, test_f1: 0.5196
 epoch: 79, train_loss: 0.8848, test_loss: 0.9394, test_f1: 0.5179
 epoch: 80, train_loss: 0.8708, test_loss: 0.9293, test_f1: 0.5244
 epoch: 81, train_loss: 0.8688, test_loss: 0.9242, test_f1: 0.5182
 epoch: 82, train_loss: 0.8776, test_loss: 0.9345, test_f1: 0.5072
 epoch: 83, train_loss: 0.8711, test_loss: 0.9157, test_f1: 0.5337
 epoch: 84, train_loss: 0.8746, test_loss: 0.9268, test_f1: 0.5298
 epoch: 85, train_loss: 0.8676, test_loss: 0.9234, test_f1: 0.5219
 epoch: 86, train_loss: 0.8686, test_loss: 0.9339, test_f1: 0.5260
 epoch: 87, train_loss: 0.8809, test_loss: 0.9642, test_f1: 0.5035
 epoch: 88, train_loss: 0.8726, test_loss: 0.9353, test_f1: 0.5348
 epoch: 89, train_loss: 0.8678, test_loss: 0.9496, test_f1: 0.5259
 epoch: 90, train_loss: 0.8778, test_loss: 0.9425, test_f1: 0.5158
 epoch: 91, train_loss: 0.8595, test_loss: 0.9282, test_f1: 0.5215
 epoch: 92, train_loss: 0.8698, test_loss: 0.9333, test_f1: 0.5156
 epoch: 93, train_loss: 0.8503, test_loss: 0.9249, test_f1: 0.5367
 epoch: 94, train_loss: 0.8576, test_loss: 0.9268, test_f1: 0.5259
 epoch: 95, train_loss: 0.8642, test_loss: 0.9364, test_f1: 0.5220
 epoch: 96, train_loss: 0.8670, test_loss: 0.9295, test_f1: 0.5262
 epoch: 97, train_loss: 0.8603, test_loss: 0.9396, test_f1: 0.5259
 epoch: 98, train_loss: 0.8539, test_loss: 0.9321, test_f1: 0.5155
 epoch: 99, train_loss: 0.8404, test_loss: 0.9432, test_f1: 0.5220

Training completed in 795.98 seconds
Best F1: 0.5575 at epoch 67
Mean F1 across iterations: 0.5340  0.0166
========================FINAL RESULTS================================
FEGIN weighted F1: 0.5575  0.0166
python main.py --data ltspice_examples --representation component_component --model FEGIN --layers 2 --hiddens 64 --batch_size 32 --lr 0.0001 --emb_size 128 --epochs 100 --save_appendix component_component_L2_H64_BS32_LR0.0001_E128 --no_val
-----



STDERR:
  File "main.py", line 370, in <module>
    main()
  File "main.py", line 254, in main
    dataset = dataset_class(
  File "/home/philip/projects/ltspice_examples_code_repo/Circuit-Completion-Using-GNNs/component_classification_with_link_prediction_head/evaluation/FEGIN/kernel/circuit_datasets.py", line 15, in __init__
    self.data, self.slices = torch.load(self.processed_paths[0])
  File "/home/philip/.local/lib/python3.8/site-packages/torch/serialization.py", line 1040, in load
    warnings.warn(
  File "/usr/lib/python3.8/warnings.py", line 109, in _showwarnmsg
    sw(msg.message, msg.category, msg.filename, msg.lineno,
  File "main.py", line 47, in warn_with_traceback
    traceback.print_stack(file=log)
/home/philip/projects/ltspice_examples_code_repo/Circuit-Completion-Using-GNNs/component_classification_with_link_prediction_head/evaluation/FEGIN/kernel/circuit_datasets.py:15: FutureWarning: You are using `torch.load` with `weights_only=False` (the current default value), which uses the default pickle module implicitly. It is possible to construct malicious pickle data which will execute arbitrary code during unpickling (See https://github.com/pytorch/pytorch/blob/main/SECURITY.md#untrusted-models for more details). In a future release, the default value for `weights_only` will be flipped to `True`. This limits the functions that could be executed during unpickling. Arbitrary objects will no longer be allowed to be loaded via this mode unless they are explicitly allowlisted by the user via `torch.serialization.add_safe_globals`. We recommend you start setting `weights_only=True` for any use case where you don't have full control of the loaded file. Please open an issue on GitHub for any issues related to this experimental feature.
  self.data, self.slices = torch.load(self.processed_paths[0])
