STDOUT:
Results will be saved in /home/philip/projects/ltspice_examples_code_repo/Circuit-Completion-Using-GNNs/component_classification_with_link_prediction_head/evaluation/FEGIN/results/model_FEGIN_dataset_ltspice_demos
Command line input: python main.py --data ltspice_demos --representation component_pin --model FEGIN --layers 2 --hiddens 128 --batch_size 64 --lr 0.01 --emb_size 512 --epochs 100 --save_appendix component_pin_L2_H128_BS64_LR0.01_E512 --no_val
 is saved.
-----
ltspice_demos - FEGIN
Using 2 layers, 128 hidden units, h = 2
Loading component_pin representation dataset
ENTERED
Training FEGIN on component_pin representation
Train: 1565, Test: 383
##################ITERATION #0 ****************************************
 epoch: 0, train_loss: 1.1794, test_loss: 1.3529, test_f1: 0.1414
 epoch: 1, train_loss: 1.0291, test_loss: 1.0860, test_f1: 0.4502
 epoch: 2, train_loss: 0.9513, test_loss: 1.3764, test_f1: 0.3762
 epoch: 3, train_loss: 0.8765, test_loss: 1.5822, test_f1: 0.4586
 epoch: 4, train_loss: 0.8504, test_loss: 1.1138, test_f1: 0.4792
 epoch: 5, train_loss: 0.8024, test_loss: 1.0459, test_f1: 0.5197
 epoch: 6, train_loss: 0.8118, test_loss: 0.9583, test_f1: 0.6052
 epoch: 7, train_loss: 0.7681, test_loss: 1.0003, test_f1: 0.5753
 epoch: 8, train_loss: 0.7656, test_loss: 1.0569, test_f1: 0.5677
 epoch: 9, train_loss: 0.7825, test_loss: 1.0811, test_f1: 0.5221
 epoch: 10, train_loss: 0.7639, test_loss: 0.9566, test_f1: 0.4861
 epoch: 11, train_loss: 0.7754, test_loss: 0.9517, test_f1: 0.5572
 epoch: 12, train_loss: 0.7515, test_loss: 1.1119, test_f1: 0.6290
 epoch: 13, train_loss: 0.7407, test_loss: 1.0248, test_f1: 0.5990
 epoch: 14, train_loss: 0.7365, test_loss: 0.9657, test_f1: 0.5494
 epoch: 15, train_loss: 0.7231, test_loss: 1.1723, test_f1: 0.6276
 epoch: 16, train_loss: 0.7019, test_loss: 0.9713, test_f1: 0.5829
 epoch: 17, train_loss: 0.6957, test_loss: 1.6171, test_f1: 0.4086
 epoch: 18, train_loss: 0.6818, test_loss: 1.1579, test_f1: 0.6337
 epoch: 19, train_loss: 0.6284, test_loss: 1.2267, test_f1: 0.6668
 epoch: 20, train_loss: 0.6341, test_loss: 1.1342, test_f1: 0.6200
 epoch: 21, train_loss: 0.6240, test_loss: 1.1892, test_f1: 0.5844
 epoch: 22, train_loss: 0.6478, test_loss: 1.2934, test_f1: 0.6239
 epoch: 23, train_loss: 0.6363, test_loss: 1.0128, test_f1: 0.5973
 epoch: 24, train_loss: 0.6083, test_loss: 1.1571, test_f1: 0.6493
 epoch: 25, train_loss: 0.6096, test_loss: 1.0946, test_f1: 0.6636
 epoch: 26, train_loss: 0.6085, test_loss: 1.3472, test_f1: 0.5628
 epoch: 27, train_loss: 0.5788, test_loss: 1.1260, test_f1: 0.5908
 epoch: 28, train_loss: 0.5730, test_loss: 1.4892, test_f1: 0.6103
 epoch: 29, train_loss: 0.5901, test_loss: 1.1517, test_f1: 0.6062
 epoch: 30, train_loss: 0.5431, test_loss: 1.4383, test_f1: 0.6004
 epoch: 31, train_loss: 0.5495, test_loss: 1.2431, test_f1: 0.6214
 epoch: 32, train_loss: 0.4796, test_loss: 1.1124, test_f1: 0.6345
 epoch: 33, train_loss: 0.5227, test_loss: 1.6319, test_f1: 0.5065
 epoch: 34, train_loss: 0.5464, test_loss: 1.2437, test_f1: 0.5579
 epoch: 35, train_loss: 0.5267, test_loss: 1.1682, test_f1: 0.6394
 epoch: 36, train_loss: 0.5007, test_loss: 1.5726, test_f1: 0.5933
 epoch: 37, train_loss: 0.4767, test_loss: 1.2766, test_f1: 0.6013
 epoch: 38, train_loss: 0.4878, test_loss: 1.4483, test_f1: 0.6170
 epoch: 39, train_loss: 0.4525, test_loss: 1.3251, test_f1: 0.6132
 epoch: 40, train_loss: 0.5402, test_loss: 2.0157, test_f1: 0.5487
 epoch: 41, train_loss: 0.5206, test_loss: 1.1761, test_f1: 0.5643
 epoch: 42, train_loss: 0.4749, test_loss: 1.6284, test_f1: 0.6480
 epoch: 43, train_loss: 0.4789, test_loss: 1.1926, test_f1: 0.6396
 epoch: 44, train_loss: 0.4372, test_loss: 1.6222, test_f1: 0.5939
 epoch: 45, train_loss: 0.4757, test_loss: 1.7510, test_f1: 0.5361
 epoch: 46, train_loss: 0.4188, test_loss: 2.0976, test_f1: 0.6270
 epoch: 47, train_loss: 0.4106, test_loss: 1.8149, test_f1: 0.5967
 epoch: 48, train_loss: 0.4790, test_loss: 1.5114, test_f1: 0.6067
 epoch: 49, train_loss: 0.4376, test_loss: 1.3568, test_f1: 0.6428
 epoch: 50, train_loss: 0.4003, test_loss: 1.6606, test_f1: 0.6180
 epoch: 51, train_loss: 0.3389, test_loss: 1.5731, test_f1: 0.6484
 epoch: 52, train_loss: 0.3423, test_loss: 1.7256, test_f1: 0.6430
 epoch: 53, train_loss: 0.3220, test_loss: 1.4879, test_f1: 0.6566
 epoch: 54, train_loss: 0.3037, test_loss: 1.9017, test_f1: 0.6535
 epoch: 55, train_loss: 0.3024, test_loss: 1.8858, test_f1: 0.6400
 epoch: 56, train_loss: 0.3123, test_loss: 1.7560, test_f1: 0.6444
 epoch: 57, train_loss: 0.3123, test_loss: 2.1712, test_f1: 0.6055
 epoch: 58, train_loss: 0.2943, test_loss: 1.8659, test_f1: 0.6292
 epoch: 59, train_loss: 0.2670, test_loss: 1.8672, test_f1: 0.6605
 epoch: 60, train_loss: 0.3124, test_loss: 1.7167, test_f1: 0.6313
 epoch: 61, train_loss: 0.2715, test_loss: 2.3261, test_f1: 0.6339
 epoch: 62, train_loss: 0.2708, test_loss: 2.1334, test_f1: 0.6343
 epoch: 63, train_loss: 0.2485, test_loss: 1.9060, test_f1: 0.6477
 epoch: 64, train_loss: 0.2552, test_loss: 2.3575, test_f1: 0.6182
 epoch: 65, train_loss: 0.2535, test_loss: 2.0236, test_f1: 0.6435
 epoch: 66, train_loss: 0.2248, test_loss: 2.1674, test_f1: 0.6176
 epoch: 67, train_loss: 0.2562, test_loss: 2.3441, test_f1: 0.6647
 epoch: 68, train_loss: 0.2302, test_loss: 2.0449, test_f1: 0.6376
 epoch: 69, train_loss: 0.2329, test_loss: 2.2263, test_f1: 0.6232
 epoch: 70, train_loss: 0.2708, test_loss: 2.0413, test_f1: 0.6410
 epoch: 71, train_loss: 0.2253, test_loss: 2.2627, test_f1: 0.6399
 epoch: 72, train_loss: 0.1842, test_loss: 2.5340, test_f1: 0.6284
 epoch: 73, train_loss: 0.2033, test_loss: 2.5233, test_f1: 0.6555
 epoch: 74, train_loss: 0.2232, test_loss: 2.3092, test_f1: 0.6694
 epoch: 75, train_loss: 0.1978, test_loss: 2.3160, test_f1: 0.6598
 epoch: 76, train_loss: 0.2063, test_loss: 2.4396, test_f1: 0.6348
 epoch: 77, train_loss: 0.2039, test_loss: 2.1930, test_f1: 0.6347
 epoch: 78, train_loss: 0.1844, test_loss: 2.6302, test_f1: 0.6452
 epoch: 79, train_loss: 0.2057, test_loss: 2.1211, test_f1: 0.6592
 epoch: 80, train_loss: 0.2220, test_loss: 2.1028, test_f1: 0.6427
 epoch: 81, train_loss: 0.1859, test_loss: 2.2866, test_f1: 0.6427
 epoch: 82, train_loss: 0.1923, test_loss: 2.3633, test_f1: 0.6359
 epoch: 83, train_loss: 0.1919, test_loss: 2.4223, test_f1: 0.6300
 epoch: 84, train_loss: 0.2133, test_loss: 2.4201, test_f1: 0.6019
 epoch: 85, train_loss: 0.2207, test_loss: 2.3864, test_f1: 0.6294
 epoch: 86, train_loss: 0.1956, test_loss: 2.4879, test_f1: 0.6312
 epoch: 87, train_loss: 0.1741, test_loss: 2.4062, test_f1: 0.6344
 epoch: 88, train_loss: 0.1738, test_loss: 2.7959, test_f1: 0.6515
 epoch: 89, train_loss: 0.2259, test_loss: 2.2404, test_f1: 0.6572
 epoch: 90, train_loss: 0.2049, test_loss: 2.3936, test_f1: 0.6116
 epoch: 91, train_loss: 0.1635, test_loss: 2.4273, test_f1: 0.6386
 epoch: 92, train_loss: 0.1861, test_loss: 2.6609, test_f1: 0.6306
 epoch: 93, train_loss: 0.1531, test_loss: 2.1911, test_f1: 0.6619
 epoch: 94, train_loss: 0.1778, test_loss: 2.2266, test_f1: 0.6305
 epoch: 95, train_loss: 0.1659, test_loss: 2.7533, test_f1: 0.6344
 epoch: 96, train_loss: 0.1714, test_loss: 2.7519, test_f1: 0.6249
 epoch: 97, train_loss: 0.1381, test_loss: 2.7144, test_f1: 0.6612
 epoch: 98, train_loss: 0.1768, test_loss: 2.6259, test_f1: 0.6973
 epoch: 99, train_loss: 0.1714, test_loss: 2.5824, test_f1: 0.6462
##################ITERATION #1 ****************************************
 epoch: 0, train_loss: 1.2208, test_loss: 1.2504, test_f1: 0.3134
 epoch: 1, train_loss: 0.9862, test_loss: 1.0953, test_f1: 0.4951
 epoch: 2, train_loss: 0.8928, test_loss: 1.0883, test_f1: 0.3945
 epoch: 3, train_loss: 0.8314, test_loss: 1.1015, test_f1: 0.4645
 epoch: 4, train_loss: 0.8541, test_loss: 1.0176, test_f1: 0.5588
 epoch: 5, train_loss: 0.7995, test_loss: 1.0775, test_f1: 0.5345
 epoch: 6, train_loss: 0.8139, test_loss: 1.3625, test_f1: 0.4586
 epoch: 7, train_loss: 0.8083, test_loss: 1.1603, test_f1: 0.5808
 epoch: 8, train_loss: 0.7845, test_loss: 1.0272, test_f1: 0.5844
 epoch: 9, train_loss: 0.7811, test_loss: 1.0198, test_f1: 0.5877
 epoch: 10, train_loss: 0.7939, test_loss: 1.2389, test_f1: 0.4956
 epoch: 11, train_loss: 0.7642, test_loss: 1.2850, test_f1: 0.5441
 epoch: 12, train_loss: 0.7350, test_loss: 0.9939, test_f1: 0.6343
 epoch: 13, train_loss: 0.7352, test_loss: 1.1323, test_f1: 0.5729
 epoch: 14, train_loss: 0.7350, test_loss: 1.2387, test_f1: 0.5377
 epoch: 15, train_loss: 0.7299, test_loss: 1.1708, test_f1: 0.5004
 epoch: 16, train_loss: 0.7235, test_loss: 1.1166, test_f1: 0.5608
 epoch: 17, train_loss: 0.7763, test_loss: 1.1991, test_f1: 0.5788
 epoch: 18, train_loss: 0.7193, test_loss: 1.0846, test_f1: 0.5478
 epoch: 19, train_loss: 0.6788, test_loss: 1.0343, test_f1: 0.5898
 epoch: 20, train_loss: 0.6655, test_loss: 1.2088, test_f1: 0.5761
 epoch: 21, train_loss: 0.6884, test_loss: 1.1669, test_f1: 0.5536
 epoch: 22, train_loss: 0.7432, test_loss: 1.1667, test_f1: 0.5635
 epoch: 23, train_loss: 0.7108, test_loss: 1.3089, test_f1: 0.6268
 epoch: 24, train_loss: 0.6769, test_loss: 1.0034, test_f1: 0.6195
 epoch: 25, train_loss: 0.6919, test_loss: 1.1421, test_f1: 0.5746
 epoch: 26, train_loss: 0.6703, test_loss: 1.0094, test_f1: 0.5855
 epoch: 27, train_loss: 0.6541, test_loss: 1.4943, test_f1: 0.5873
 epoch: 28, train_loss: 0.6304, test_loss: 1.0390, test_f1: 0.6323
 epoch: 29, train_loss: 0.6599, test_loss: 1.2600, test_f1: 0.5410
 epoch: 30, train_loss: 0.6388, test_loss: 1.1094, test_f1: 0.6220
 epoch: 31, train_loss: 0.6237, test_loss: 1.1747, test_f1: 0.6213
 epoch: 32, train_loss: 0.6329, test_loss: 1.6950, test_f1: 0.5549
 epoch: 33, train_loss: 0.6593, test_loss: 1.1574, test_f1: 0.5769
 epoch: 34, train_loss: 0.6118, test_loss: 1.0870, test_f1: 0.5233
 epoch: 35, train_loss: 0.6034, test_loss: 1.2662, test_f1: 0.6127
 epoch: 36, train_loss: 0.5739, test_loss: 1.1894, test_f1: 0.5978
 epoch: 37, train_loss: 0.5924, test_loss: 1.5811, test_f1: 0.5272
 epoch: 38, train_loss: 0.5805, test_loss: 1.4639, test_f1: 0.5425
 epoch: 39, train_loss: 0.6075, test_loss: 1.1181, test_f1: 0.5863
 epoch: 40, train_loss: 0.5913, test_loss: 1.2249, test_f1: 0.6069
 epoch: 41, train_loss: 0.5526, test_loss: 1.1881, test_f1: 0.6795
 epoch: 42, train_loss: 0.5470, test_loss: 1.3102, test_f1: 0.6717
 epoch: 43, train_loss: 0.5849, test_loss: 1.0564, test_f1: 0.6132
 epoch: 44, train_loss: 0.5614, test_loss: 1.0694, test_f1: 0.6142
 epoch: 45, train_loss: 0.5473, test_loss: 1.3199, test_f1: 0.6218
 epoch: 46, train_loss: 0.5343, test_loss: 1.5042, test_f1: 0.5412
 epoch: 47, train_loss: 0.5533, test_loss: 1.3856, test_f1: 0.5627
 epoch: 48, train_loss: 0.5694, test_loss: 1.2222, test_f1: 0.5907
 epoch: 49, train_loss: 0.5488, test_loss: 1.3535, test_f1: 0.5503
 epoch: 50, train_loss: 0.5057, test_loss: 1.2032, test_f1: 0.6041
 epoch: 51, train_loss: 0.4895, test_loss: 1.1237, test_f1: 0.5958
 epoch: 52, train_loss: 0.4462, test_loss: 1.3522, test_f1: 0.6216
 epoch: 53, train_loss: 0.4310, test_loss: 1.6891, test_f1: 0.5473
 epoch: 54, train_loss: 0.4258, test_loss: 1.3155, test_f1: 0.6192
 epoch: 55, train_loss: 0.3848, test_loss: 1.5915, test_f1: 0.6044
 epoch: 56, train_loss: 0.3846, test_loss: 1.4592, test_f1: 0.6160
 epoch: 57, train_loss: 0.3965, test_loss: 1.6953, test_f1: 0.6163
 epoch: 58, train_loss: 0.3881, test_loss: 1.6689, test_f1: 0.6338
 epoch: 59, train_loss: 0.3594, test_loss: 1.3842, test_f1: 0.6224
 epoch: 60, train_loss: 0.3450, test_loss: 2.0324, test_f1: 0.5994
 epoch: 61, train_loss: 0.3709, test_loss: 1.8088, test_f1: 0.5944
 epoch: 62, train_loss: 0.3515, test_loss: 1.8952, test_f1: 0.6091
 epoch: 63, train_loss: 0.3449, test_loss: 1.4399, test_f1: 0.6462
 epoch: 64, train_loss: 0.3525, test_loss: 1.6918, test_f1: 0.6050
 epoch: 65, train_loss: 0.3294, test_loss: 1.8710, test_f1: 0.6086
 epoch: 66, train_loss: 0.3273, test_loss: 1.7081, test_f1: 0.6134
 epoch: 67, train_loss: 0.3459, test_loss: 1.4959, test_f1: 0.6380
 epoch: 68, train_loss: 0.3407, test_loss: 2.0071, test_f1: 0.5971
 epoch: 69, train_loss: 0.2971, test_loss: 2.0391, test_f1: 0.5957
 epoch: 70, train_loss: 0.3301, test_loss: 1.9223, test_f1: 0.6031
 epoch: 71, train_loss: 0.3176, test_loss: 1.8535, test_f1: 0.6184
 epoch: 72, train_loss: 0.3419, test_loss: 1.5963, test_f1: 0.6027
 epoch: 73, train_loss: 0.2909, test_loss: 2.2983, test_f1: 0.5814
 epoch: 74, train_loss: 0.2815, test_loss: 1.8585, test_f1: 0.6573
 epoch: 75, train_loss: 0.2619, test_loss: 1.8617, test_f1: 0.6043
 epoch: 76, train_loss: 0.2809, test_loss: 2.0405, test_f1: 0.6599
 epoch: 77, train_loss: 0.2710, test_loss: 1.9364, test_f1: 0.6577
 epoch: 78, train_loss: 0.2880, test_loss: 1.6797, test_f1: 0.6376
 epoch: 79, train_loss: 0.2864, test_loss: 1.6142, test_f1: 0.6174
 epoch: 80, train_loss: 0.2773, test_loss: 2.0431, test_f1: 0.6274
 epoch: 81, train_loss: 0.2877, test_loss: 1.8014, test_f1: 0.6064
 epoch: 82, train_loss: 0.2846, test_loss: 1.8612, test_f1: 0.5933
 epoch: 83, train_loss: 0.2708, test_loss: 2.1646, test_f1: 0.5815
 epoch: 84, train_loss: 0.2394, test_loss: 1.9727, test_f1: 0.6044
 epoch: 85, train_loss: 0.2654, test_loss: 1.9621, test_f1: 0.6026
 epoch: 86, train_loss: 0.2568, test_loss: 1.8628, test_f1: 0.6046
 epoch: 87, train_loss: 0.2258, test_loss: 2.2869, test_f1: 0.6401
 epoch: 88, train_loss: 0.2557, test_loss: 1.8621, test_f1: 0.6488
 epoch: 89, train_loss: 0.2305, test_loss: 1.8682, test_f1: 0.6401
 epoch: 90, train_loss: 0.1760, test_loss: 1.9702, test_f1: 0.6418
 epoch: 91, train_loss: 0.2019, test_loss: 1.9782, test_f1: 0.6361
 epoch: 92, train_loss: 0.2113, test_loss: 2.2635, test_f1: 0.5930
 epoch: 93, train_loss: 0.1882, test_loss: 2.2441, test_f1: 0.6607
 epoch: 94, train_loss: 0.2175, test_loss: 2.5805, test_f1: 0.5925
 epoch: 95, train_loss: 0.1911, test_loss: 2.2549, test_f1: 0.6405
 epoch: 96, train_loss: 0.2241, test_loss: 2.0855, test_f1: 0.6176
 epoch: 97, train_loss: 0.2216, test_loss: 1.9788, test_f1: 0.6075
 epoch: 98, train_loss: 0.1843, test_loss: 1.9966, test_f1: 0.6350
 epoch: 99, train_loss: 0.2190, test_loss: 2.3909, test_f1: 0.6185
##################ITERATION #2 ****************************************
 epoch: 0, train_loss: 1.2126, test_loss: 1.7075, test_f1: 0.3272
 epoch: 1, train_loss: 0.9431, test_loss: 1.0411, test_f1: 0.5415
 epoch: 2, train_loss: 0.8971, test_loss: 1.2782, test_f1: 0.3532
 epoch: 3, train_loss: 0.8697, test_loss: 1.0106, test_f1: 0.5854
 epoch: 4, train_loss: 0.8286, test_loss: 1.5629, test_f1: 0.4216
 epoch: 5, train_loss: 0.8063, test_loss: 1.1433, test_f1: 0.5391
 epoch: 6, train_loss: 0.7732, test_loss: 1.1552, test_f1: 0.4880
 epoch: 7, train_loss: 0.7779, test_loss: 1.2563, test_f1: 0.5628
 epoch: 8, train_loss: 0.7710, test_loss: 1.1784, test_f1: 0.5562
 epoch: 9, train_loss: 0.7696, test_loss: 0.9778, test_f1: 0.6437
 epoch: 10, train_loss: 0.7552, test_loss: 5.5962, test_f1: 0.2877
 epoch: 11, train_loss: 0.7299, test_loss: 1.3443, test_f1: 0.5600
 epoch: 12, train_loss: 0.7491, test_loss: 1.1428, test_f1: 0.5769
 epoch: 13, train_loss: 0.7570, test_loss: 1.1717, test_f1: 0.6007
 epoch: 14, train_loss: 0.7462, test_loss: 1.0367, test_f1: 0.5701
 epoch: 15, train_loss: 0.7160, test_loss: 1.0941, test_f1: 0.5819
 epoch: 16, train_loss: 0.6909, test_loss: 1.7335, test_f1: 0.5767
 epoch: 17, train_loss: 0.6976, test_loss: 1.0765, test_f1: 0.6348
 epoch: 18, train_loss: 0.7014, test_loss: 1.1841, test_f1: 0.5403
 epoch: 19, train_loss: 0.6925, test_loss: 1.2628, test_f1: 0.6232
 epoch: 20, train_loss: 0.6697, test_loss: 1.3075, test_f1: 0.5313
 epoch: 21, train_loss: 0.6367, test_loss: 1.1961, test_f1: 0.5061
 epoch: 22, train_loss: 0.6513, test_loss: 1.2462, test_f1: 0.5165
 epoch: 23, train_loss: 0.6391, test_loss: 1.3420, test_f1: 0.5920
 epoch: 24, train_loss: 0.6457, test_loss: 1.0529, test_f1: 0.6129
 epoch: 25, train_loss: 0.6057, test_loss: 1.2611, test_f1: 0.5756
 epoch: 26, train_loss: 0.6073, test_loss: 1.2263, test_f1: 0.6544
 epoch: 27, train_loss: 0.5865, test_loss: 2.0337, test_f1: 0.5152
 epoch: 28, train_loss: 0.6113, test_loss: 1.2426, test_f1: 0.5931
 epoch: 29, train_loss: 0.6503, test_loss: 1.1866, test_f1: 0.5906
 epoch: 30, train_loss: 0.5787, test_loss: 1.2055, test_f1: 0.6309
 epoch: 31, train_loss: 0.5703, test_loss: 1.5019, test_f1: 0.5923
 epoch: 32, train_loss: 0.5379, test_loss: 1.2053, test_f1: 0.6367
 epoch: 33, train_loss: 0.5823, test_loss: 1.3198, test_f1: 0.6078
 epoch: 34, train_loss: 0.5830, test_loss: 1.1435, test_f1: 0.5856
 epoch: 35, train_loss: 0.5853, test_loss: 1.4901, test_f1: 0.6178
 epoch: 36, train_loss: 0.5510, test_loss: 1.1328, test_f1: 0.6310
 epoch: 37, train_loss: 0.6080, test_loss: 1.1457, test_f1: 0.5819
 epoch: 38, train_loss: 0.5927, test_loss: 1.3586, test_f1: 0.5913
 epoch: 39, train_loss: 0.5842, test_loss: 0.9943, test_f1: 0.6460
 epoch: 40, train_loss: 0.5594, test_loss: 1.2610, test_f1: 0.6048
 epoch: 41, train_loss: 0.5438, test_loss: 1.1009, test_f1: 0.6646
 epoch: 42, train_loss: 0.5485, test_loss: 1.2637, test_f1: 0.6249
 epoch: 43, train_loss: 0.5149, test_loss: 1.2646, test_f1: 0.6738
 epoch: 44, train_loss: 0.5108, test_loss: 1.6035, test_f1: 0.6076
 epoch: 45, train_loss: 0.5123, test_loss: 1.2615, test_f1: 0.6334
 epoch: 46, train_loss: 0.4763, test_loss: 1.4652, test_f1: 0.6180
 epoch: 47, train_loss: 0.5352, test_loss: 1.2805, test_f1: 0.5877
 epoch: 48, train_loss: 0.5095, test_loss: 1.1538, test_f1: 0.6817
 epoch: 49, train_loss: 0.5255, test_loss: 1.5383, test_f1: 0.5924
 epoch: 50, train_loss: 0.4991, test_loss: 1.4284, test_f1: 0.5578
 epoch: 51, train_loss: 0.4532, test_loss: 1.3364, test_f1: 0.6502
 epoch: 52, train_loss: 0.4293, test_loss: 1.5898, test_f1: 0.6234
 epoch: 53, train_loss: 0.4113, test_loss: 1.6402, test_f1: 0.6576
 epoch: 54, train_loss: 0.3707, test_loss: 1.4883, test_f1: 0.6452
 epoch: 55, train_loss: 0.3699, test_loss: 1.6283, test_f1: 0.6454
 epoch: 56, train_loss: 0.3880, test_loss: 1.4743, test_f1: 0.6433
 epoch: 57, train_loss: 0.3855, test_loss: 1.5495, test_f1: 0.6560
 epoch: 58, train_loss: 0.3618, test_loss: 1.6499, test_f1: 0.6457
 epoch: 59, train_loss: 0.3656, test_loss: 1.5160, test_f1: 0.6234
 epoch: 60, train_loss: 0.3529, test_loss: 1.7321, test_f1: 0.6326
 epoch: 61, train_loss: 0.3450, test_loss: 1.6612, test_f1: 0.6527
 epoch: 62, train_loss: 0.3189, test_loss: 1.4919, test_f1: 0.6793
 epoch: 63, train_loss: 0.3259, test_loss: 1.7103, test_f1: 0.6604
 epoch: 64, train_loss: 0.3183, test_loss: 1.7336, test_f1: 0.6359
 epoch: 65, train_loss: 0.2884, test_loss: 1.9654, test_f1: 0.6436
 epoch: 66, train_loss: 0.3164, test_loss: 1.6355, test_f1: 0.6230
 epoch: 67, train_loss: 0.3304, test_loss: 1.6761, test_f1: 0.6610
 epoch: 68, train_loss: 0.2925, test_loss: 1.5907, test_f1: 0.6763
 epoch: 69, train_loss: 0.2639, test_loss: 1.7009, test_f1: 0.6578
 epoch: 70, train_loss: 0.3350, test_loss: 1.6622, test_f1: 0.6472
 epoch: 71, train_loss: 0.3119, test_loss: 1.7786, test_f1: 0.6934
 epoch: 72, train_loss: 0.2939, test_loss: 1.7151, test_f1: 0.6143
 epoch: 73, train_loss: 0.2824, test_loss: 1.7653, test_f1: 0.6675
 epoch: 74, train_loss: 0.2641, test_loss: 1.8050, test_f1: 0.6877
 epoch: 75, train_loss: 0.3165, test_loss: 2.1733, test_f1: 0.6231
 epoch: 76, train_loss: 0.2347, test_loss: 2.0699, test_f1: 0.6639
 epoch: 77, train_loss: 0.2661, test_loss: 2.0499, test_f1: 0.6035
 epoch: 78, train_loss: 0.2555, test_loss: 1.7443, test_f1: 0.6364
 epoch: 79, train_loss: 0.2832, test_loss: 1.9918, test_f1: 0.6200
 epoch: 80, train_loss: 0.2817, test_loss: 1.9286, test_f1: 0.6667
 epoch: 81, train_loss: 0.2582, test_loss: 2.2098, test_f1: 0.6462
 epoch: 82, train_loss: 0.2488, test_loss: 2.0377, test_f1: 0.6043
 epoch: 83, train_loss: 0.2359, test_loss: 2.2731, test_f1: 0.6887
 epoch: 84, train_loss: 0.2927, test_loss: 1.9179, test_f1: 0.6356
 epoch: 85, train_loss: 0.2139, test_loss: 2.3157, test_f1: 0.6307
 epoch: 86, train_loss: 0.2285, test_loss: 2.2775, test_f1: 0.6356
 epoch: 87, train_loss: 0.2719, test_loss: 1.7295, test_f1: 0.6691
 epoch: 88, train_loss: 0.2149, test_loss: 2.0620, test_f1: 0.6314
 epoch: 89, train_loss: 0.2065, test_loss: 2.2488, test_f1: 0.6231
 epoch: 90, train_loss: 0.2182, test_loss: 2.5915, test_f1: 0.6855
 epoch: 91, train_loss: 0.2328, test_loss: 2.7394, test_f1: 0.6543
 epoch: 92, train_loss: 0.2464, test_loss: 2.4346, test_f1: 0.6387
 epoch: 93, train_loss: 0.2231, test_loss: 2.0885, test_f1: 0.6336
 epoch: 94, train_loss: 0.2001, test_loss: 2.2315, test_f1: 0.6296
 epoch: 95, train_loss: 0.2498, test_loss: 2.2533, test_f1: 0.6862
 epoch: 96, train_loss: 0.2400, test_loss: 2.1628, test_f1: 0.6443
 epoch: 97, train_loss: 0.1950, test_loss: 2.5630, test_f1: 0.6450
 epoch: 98, train_loss: 0.1757, test_loss: 2.4789, test_f1: 0.6566
 epoch: 99, train_loss: 0.1877, test_loss: 2.5313, test_f1: 0.7103
##################ITERATION #3 ****************************************
 epoch: 0, train_loss: 1.2044, test_loss: 1.2696, test_f1: 0.3326
 epoch: 1, train_loss: 0.9390, test_loss: 1.1855, test_f1: 0.5050
 epoch: 2, train_loss: 0.8999, test_loss: 1.0574, test_f1: 0.5397
 epoch: 3, train_loss: 0.8560, test_loss: 1.0465, test_f1: 0.5409
 epoch: 4, train_loss: 0.8225, test_loss: 1.1517, test_f1: 0.4852
 epoch: 5, train_loss: 0.7915, test_loss: 1.0567, test_f1: 0.5640
 epoch: 6, train_loss: 0.7740, test_loss: 1.2015, test_f1: 0.6020
 epoch: 7, train_loss: 0.7416, test_loss: 1.3282, test_f1: 0.5029
 epoch: 8, train_loss: 0.7644, test_loss: 1.1095, test_f1: 0.5933
 epoch: 9, train_loss: 0.7322, test_loss: 1.2196, test_f1: 0.5189
 epoch: 10, train_loss: 0.7121, test_loss: 1.0533, test_f1: 0.6608
 epoch: 11, train_loss: 0.6953, test_loss: 0.9291, test_f1: 0.6823
 epoch: 12, train_loss: 0.6804, test_loss: 1.1860, test_f1: 0.5648
 epoch: 13, train_loss: 0.6674, test_loss: 1.0795, test_f1: 0.6208
 epoch: 14, train_loss: 0.6483, test_loss: 1.7097, test_f1: 0.4938
 epoch: 15, train_loss: 0.6943, test_loss: 1.3866, test_f1: 0.4753
 epoch: 16, train_loss: 0.6462, test_loss: 1.2491, test_f1: 0.6554
 epoch: 17, train_loss: 0.6155, test_loss: 1.1419, test_f1: 0.5134
 epoch: 18, train_loss: 0.6091, test_loss: 1.1123, test_f1: 0.6215
 epoch: 19, train_loss: 0.6328, test_loss: 1.0807, test_f1: 0.6246
 epoch: 20, train_loss: 0.6451, test_loss: 0.9453, test_f1: 0.6552
 epoch: 21, train_loss: 0.5865, test_loss: 1.0541, test_f1: 0.6155
 epoch: 22, train_loss: 0.6163, test_loss: 1.2389, test_f1: 0.6517
 epoch: 23, train_loss: 0.6476, test_loss: 1.0298, test_f1: 0.6143
 epoch: 24, train_loss: 0.5930, test_loss: 0.9959, test_f1: 0.6717
 epoch: 25, train_loss: 0.6071, test_loss: 1.1866, test_f1: 0.6498
 epoch: 26, train_loss: 0.5804, test_loss: 1.1700, test_f1: 0.6201
 epoch: 27, train_loss: 0.5856, test_loss: 1.3249, test_f1: 0.6353
 epoch: 28, train_loss: 0.5511, test_loss: 1.0599, test_f1: 0.6474
 epoch: 29, train_loss: 0.5374, test_loss: 1.7056, test_f1: 0.5814
 epoch: 30, train_loss: 0.5426, test_loss: 1.2209, test_f1: 0.5794
 epoch: 31, train_loss: 0.5611, test_loss: 1.2322, test_f1: 0.6164
 epoch: 32, train_loss: 0.5224, test_loss: 1.1100, test_f1: 0.6837
 epoch: 33, train_loss: 0.5157, test_loss: 1.3492, test_f1: 0.6013
 epoch: 34, train_loss: 0.4936, test_loss: 1.5386, test_f1: 0.5728
 epoch: 35, train_loss: 0.4671, test_loss: 1.4499, test_f1: 0.5367
 epoch: 36, train_loss: 0.5571, test_loss: 1.2608, test_f1: 0.5602
 epoch: 37, train_loss: 0.5207, test_loss: 1.4526, test_f1: 0.5529
 epoch: 38, train_loss: 0.4869, test_loss: 1.2707, test_f1: 0.5978
 epoch: 39, train_loss: 0.4842, test_loss: 1.2751, test_f1: 0.6152
 epoch: 40, train_loss: 0.4910, test_loss: 1.2524, test_f1: 0.5865
 epoch: 41, train_loss: 0.4561, test_loss: 1.4426, test_f1: 0.5847
 epoch: 42, train_loss: 0.4358, test_loss: 1.4474, test_f1: 0.5859
 epoch: 43, train_loss: 0.4527, test_loss: 1.4757, test_f1: 0.5858
 epoch: 44, train_loss: 0.4163, test_loss: 1.3738, test_f1: 0.6209
 epoch: 45, train_loss: 0.5134, test_loss: 1.3286, test_f1: 0.5403
 epoch: 46, train_loss: 0.4634, test_loss: 1.5061, test_f1: 0.5639
 epoch: 47, train_loss: 0.4403, test_loss: 1.5288, test_f1: 0.5237
 epoch: 48, train_loss: 0.4009, test_loss: 1.5846, test_f1: 0.5844
 epoch: 49, train_loss: 0.4116, test_loss: 1.8051, test_f1: 0.5364
 epoch: 50, train_loss: 0.4699, test_loss: 1.4414, test_f1: 0.6559
 epoch: 51, train_loss: 0.3901, test_loss: 1.4087, test_f1: 0.6511
 epoch: 52, train_loss: 0.3502, test_loss: 1.5657, test_f1: 0.6236
 epoch: 53, train_loss: 0.3846, test_loss: 1.5801, test_f1: 0.5929
 epoch: 54, train_loss: 0.3316, test_loss: 1.8298, test_f1: 0.6255
 epoch: 55, train_loss: 0.3426, test_loss: 1.7078, test_f1: 0.5774
 epoch: 56, train_loss: 0.3155, test_loss: 1.7834, test_f1: 0.5965
 epoch: 57, train_loss: 0.3379, test_loss: 1.6601, test_f1: 0.5908
 epoch: 58, train_loss: 0.3168, test_loss: 1.4854, test_f1: 0.6218
 epoch: 59, train_loss: 0.3043, test_loss: 1.6893, test_f1: 0.6139
 epoch: 60, train_loss: 0.2749, test_loss: 1.7707, test_f1: 0.6175
 epoch: 61, train_loss: 0.2841, test_loss: 1.8985, test_f1: 0.6139
 epoch: 62, train_loss: 0.3073, test_loss: 2.0175, test_f1: 0.6313
 epoch: 63, train_loss: 0.2736, test_loss: 2.0240, test_f1: 0.6001
 epoch: 64, train_loss: 0.2889, test_loss: 2.3524, test_f1: 0.6041
 epoch: 65, train_loss: 0.2831, test_loss: 2.0546, test_f1: 0.6077
 epoch: 66, train_loss: 0.2618, test_loss: 2.0136, test_f1: 0.6394
 epoch: 67, train_loss: 0.2493, test_loss: 2.2322, test_f1: 0.5736
 epoch: 68, train_loss: 0.2343, test_loss: 2.1625, test_f1: 0.6347
 epoch: 69, train_loss: 0.2287, test_loss: 2.0225, test_f1: 0.6426
 epoch: 70, train_loss: 0.2387, test_loss: 2.4800, test_f1: 0.5963
 epoch: 71, train_loss: 0.2357, test_loss: 2.1115, test_f1: 0.6348
 epoch: 72, train_loss: 0.2065, test_loss: 2.3202, test_f1: 0.6069
 epoch: 73, train_loss: 0.2506, test_loss: 2.2018, test_f1: 0.6215
 epoch: 74, train_loss: 0.2252, test_loss: 2.6044, test_f1: 0.5944
 epoch: 75, train_loss: 0.2179, test_loss: 2.3489, test_f1: 0.6623
 epoch: 76, train_loss: 0.2445, test_loss: 2.5816, test_f1: 0.5846
 epoch: 77, train_loss: 0.2866, test_loss: 2.0952, test_f1: 0.5967
 epoch: 78, train_loss: 0.2533, test_loss: 2.0318, test_f1: 0.6571
 epoch: 79, train_loss: 0.2341, test_loss: 2.4290, test_f1: 0.5880
 epoch: 80, train_loss: 0.2688, test_loss: 2.3139, test_f1: 0.5904
 epoch: 81, train_loss: 0.2463, test_loss: 2.2622, test_f1: 0.6398
 epoch: 82, train_loss: 0.2169, test_loss: 1.8320, test_f1: 0.6381
 epoch: 83, train_loss: 0.2355, test_loss: 2.0446, test_f1: 0.6451
 epoch: 84, train_loss: 0.1805, test_loss: 2.3378, test_f1: 0.6428
 epoch: 85, train_loss: 0.1766, test_loss: 2.5674, test_f1: 0.6372
 epoch: 86, train_loss: 0.1691, test_loss: 2.6831, test_f1: 0.5939
 epoch: 87, train_loss: 0.2077, test_loss: 2.2650, test_f1: 0.6156
 epoch: 88, train_loss: 0.2138, test_loss: 2.5750, test_f1: 0.6150
 epoch: 89, train_loss: 0.1784, test_loss: 2.5665, test_f1: 0.6389
 epoch: 90, train_loss: 0.2026, test_loss: 2.6353, test_f1: 0.6420
 epoch: 91, train_loss: 0.1939, test_loss: 3.0847, test_f1: 0.6191
 epoch: 92, train_loss: 0.1827, test_loss: 2.5924, test_f1: 0.6259
 epoch: 93, train_loss: 0.2066, test_loss: 2.5432, test_f1: 0.6351
 epoch: 94, train_loss: 0.1677, test_loss: 2.3113, test_f1: 0.6385
 epoch: 95, train_loss: 0.1745, test_loss: 2.2863, test_f1: 0.6465
 epoch: 96, train_loss: 0.1774, test_loss: 2.4612, test_f1: 0.6352
 epoch: 97, train_loss: 0.2077, test_loss: 2.2698, test_f1: 0.6602
 epoch: 98, train_loss: 0.2185, test_loss: 2.2305, test_f1: 0.6459
 epoch: 99, train_loss: 0.1499, test_loss: 2.3825, test_f1: 0.6272
##################ITERATION #4 ****************************************
 epoch: 0, train_loss: 1.3162, test_loss: 1.5772, test_f1: 0.1552
 epoch: 1, train_loss: 1.0164, test_loss: 1.3308, test_f1: 0.3866
 epoch: 2, train_loss: 0.9265, test_loss: 1.1386, test_f1: 0.4983
 epoch: 3, train_loss: 0.8715, test_loss: 0.9895, test_f1: 0.5722
 epoch: 4, train_loss: 0.8534, test_loss: 1.1595, test_f1: 0.4986
 epoch: 5, train_loss: 0.8356, test_loss: 1.0390, test_f1: 0.5299
 epoch: 6, train_loss: 0.8189, test_loss: 1.1831, test_f1: 0.4900
 epoch: 7, train_loss: 0.8184, test_loss: 1.0596, test_f1: 0.5186
 epoch: 8, train_loss: 0.7936, test_loss: 0.9544, test_f1: 0.4964
 epoch: 9, train_loss: 0.7863, test_loss: 1.2199, test_f1: 0.4697
 epoch: 10, train_loss: 0.7798, test_loss: 1.1443, test_f1: 0.5457
 epoch: 11, train_loss: 0.7647, test_loss: 1.0226, test_f1: 0.5806
 epoch: 12, train_loss: 0.7562, test_loss: 1.1413, test_f1: 0.5604
 epoch: 13, train_loss: 0.7429, test_loss: 1.6633, test_f1: 0.5362
 epoch: 14, train_loss: 0.7366, test_loss: 1.1163, test_f1: 0.5389
 epoch: 15, train_loss: 0.7460, test_loss: 0.9499, test_f1: 0.5961
 epoch: 16, train_loss: 0.7236, test_loss: 3.0802, test_f1: 0.5055
 epoch: 17, train_loss: 0.7180, test_loss: 1.0004, test_f1: 0.4733
 epoch: 18, train_loss: 0.7366, test_loss: 1.1457, test_f1: 0.4602
 epoch: 19, train_loss: 0.7042, test_loss: 1.2208, test_f1: 0.5267
 epoch: 20, train_loss: 0.6952, test_loss: 1.1281, test_f1: 0.5842
 epoch: 21, train_loss: 0.6521, test_loss: 1.2038, test_f1: 0.5896
 epoch: 22, train_loss: 0.6568, test_loss: 1.3372, test_f1: 0.6218
 epoch: 23, train_loss: 0.7029, test_loss: 1.1588, test_f1: 0.5777
 epoch: 24, train_loss: 0.6655, test_loss: 1.4544, test_f1: 0.6327
 epoch: 25, train_loss: 0.6740, test_loss: 1.1014, test_f1: 0.5871
 epoch: 26, train_loss: 0.6567, test_loss: 1.0251, test_f1: 0.6294
 epoch: 27, train_loss: 0.6582, test_loss: 2.2530, test_f1: 0.3626
 epoch: 28, train_loss: 0.6836, test_loss: 0.9967, test_f1: 0.5821
 epoch: 29, train_loss: 0.6538, test_loss: 1.0385, test_f1: 0.6117
 epoch: 30, train_loss: 0.6343, test_loss: 0.9919, test_f1: 0.6231
 epoch: 31, train_loss: 0.6481, test_loss: 1.0307, test_f1: 0.5874
 epoch: 32, train_loss: 0.6210, test_loss: 0.9876, test_f1: 0.6372
 epoch: 33, train_loss: 0.5857, test_loss: 1.5587, test_f1: 0.5451
 epoch: 34, train_loss: 0.6207, test_loss: 1.1520, test_f1: 0.6396
 epoch: 35, train_loss: 0.5553, test_loss: 1.5900, test_f1: 0.6005
 epoch: 36, train_loss: 0.5677, test_loss: 1.3057, test_f1: 0.5338
 epoch: 37, train_loss: 0.5460, test_loss: 1.6001, test_f1: 0.5907
 epoch: 38, train_loss: 0.5776, test_loss: 1.1021, test_f1: 0.5807
 epoch: 39, train_loss: 0.5454, test_loss: 1.2026, test_f1: 0.6176
 epoch: 40, train_loss: 0.5409, test_loss: 1.4235, test_f1: 0.5166
 epoch: 41, train_loss: 0.5638, test_loss: 1.0765, test_f1: 0.5975
 epoch: 42, train_loss: 0.5338, test_loss: 1.3073, test_f1: 0.5892
 epoch: 43, train_loss: 0.4929, test_loss: 1.1269, test_f1: 0.6150
 epoch: 44, train_loss: 0.4941, test_loss: 1.2087, test_f1: 0.6334
 epoch: 45, train_loss: 0.4840, test_loss: 1.2478, test_f1: 0.6134
 epoch: 46, train_loss: 0.5192, test_loss: 1.5437, test_f1: 0.6459
 epoch: 47, train_loss: 0.4864, test_loss: 1.4251, test_f1: 0.6355
 epoch: 48, train_loss: 0.5647, test_loss: 1.2488, test_f1: 0.5993
 epoch: 49, train_loss: 0.5022, test_loss: 1.6002, test_f1: 0.5786
 epoch: 50, train_loss: 0.5829, test_loss: 1.3928, test_f1: 0.5972
 epoch: 51, train_loss: 0.4904, test_loss: 1.1098, test_f1: 0.6609
 epoch: 52, train_loss: 0.4557, test_loss: 1.2609, test_f1: 0.6557
 epoch: 53, train_loss: 0.4124, test_loss: 1.5183, test_f1: 0.5909
 epoch: 54, train_loss: 0.3902, test_loss: 1.6493, test_f1: 0.6520
 epoch: 55, train_loss: 0.3609, test_loss: 1.7294, test_f1: 0.6012
 epoch: 56, train_loss: 0.3699, test_loss: 1.5336, test_f1: 0.6201
 epoch: 57, train_loss: 0.3634, test_loss: 1.4737, test_f1: 0.6059
 epoch: 58, train_loss: 0.3631, test_loss: 1.7682, test_f1: 0.5890
 epoch: 59, train_loss: 0.3537, test_loss: 1.5649, test_f1: 0.6208
 epoch: 60, train_loss: 0.3496, test_loss: 1.7119, test_f1: 0.5771
 epoch: 61, train_loss: 0.3416, test_loss: 1.5173, test_f1: 0.6117
 epoch: 62, train_loss: 0.3313, test_loss: 1.5616, test_f1: 0.6037
 epoch: 63, train_loss: 0.3161, test_loss: 1.9303, test_f1: 0.5746
 epoch: 64, train_loss: 0.3285, test_loss: 1.5509, test_f1: 0.6391
 epoch: 65, train_loss: 0.3761, test_loss: 1.6899, test_f1: 0.6216
 epoch: 66, train_loss: 0.3639, test_loss: 1.4365, test_f1: 0.6211
 epoch: 67, train_loss: 0.3179, test_loss: 2.0405, test_f1: 0.6136
 epoch: 68, train_loss: 0.3124, test_loss: 1.8876, test_f1: 0.6509
 epoch: 69, train_loss: 0.3120, test_loss: 1.9178, test_f1: 0.6036
 epoch: 70, train_loss: 0.3163, test_loss: 1.9777, test_f1: 0.5887
 epoch: 71, train_loss: 0.2902, test_loss: 1.9058, test_f1: 0.6366
 epoch: 72, train_loss: 0.2976, test_loss: 1.7566, test_f1: 0.6068
 epoch: 73, train_loss: 0.2957, test_loss: 1.9116, test_f1: 0.5894
 epoch: 74, train_loss: 0.2638, test_loss: 2.3178, test_f1: 0.5906
 epoch: 75, train_loss: 0.2725, test_loss: 1.7799, test_f1: 0.6663
 epoch: 76, train_loss: 0.2690, test_loss: 2.0976, test_f1: 0.6449
 epoch: 77, train_loss: 0.2748, test_loss: 1.8652, test_f1: 0.6440
 epoch: 78, train_loss: 0.2684, test_loss: 1.8841, test_f1: 0.6320
 epoch: 79, train_loss: 0.2585, test_loss: 1.7104, test_f1: 0.6096
 epoch: 80, train_loss: 0.2445, test_loss: 2.0303, test_f1: 0.6130
 epoch: 81, train_loss: 0.3039, test_loss: 1.8052, test_f1: 0.6452
 epoch: 82, train_loss: 0.2170, test_loss: 1.9600, test_f1: 0.6370
 epoch: 83, train_loss: 0.2516, test_loss: 1.9021, test_f1: 0.6251
 epoch: 84, train_loss: 0.2576, test_loss: 1.8870, test_f1: 0.6461
 epoch: 85, train_loss: 0.2414, test_loss: 1.9077, test_f1: 0.6319
 epoch: 86, train_loss: 0.2421, test_loss: 2.1516, test_f1: 0.5801
 epoch: 87, train_loss: 0.2674, test_loss: 2.1585, test_f1: 0.6189
 epoch: 88, train_loss: 0.2330, test_loss: 1.9377, test_f1: 0.6707
 epoch: 89, train_loss: 0.2462, test_loss: 1.9977, test_f1: 0.6159
 epoch: 90, train_loss: 0.2179, test_loss: 2.0151, test_f1: 0.6323
 epoch: 91, train_loss: 0.1967, test_loss: 2.0642, test_f1: 0.6161
 epoch: 92, train_loss: 0.2327, test_loss: 2.2920, test_f1: 0.6208
 epoch: 93, train_loss: 0.2425, test_loss: 1.8221, test_f1: 0.6141
 epoch: 94, train_loss: 0.2400, test_loss: 1.9028, test_f1: 0.6391
 epoch: 95, train_loss: 0.2244, test_loss: 2.0090, test_f1: 0.6431
 epoch: 96, train_loss: 0.1967, test_loss: 2.1999, test_f1: 0.6464
 epoch: 97, train_loss: 0.2155, test_loss: 2.2281, test_f1: 0.6383
 epoch: 98, train_loss: 0.1764, test_loss: 2.1787, test_f1: 0.6430
 epoch: 99, train_loss: 0.1965, test_loss: 2.3178, test_f1: 0.6628
##################ITERATION #5 ****************************************
 epoch: 0, train_loss: 1.3229, test_loss: 1.3307, test_f1: 0.3015
 epoch: 1, train_loss: 0.9574, test_loss: 1.0340, test_f1: 0.5436
 epoch: 2, train_loss: 0.8739, test_loss: 1.0823, test_f1: 0.4654
 epoch: 3, train_loss: 0.8631, test_loss: 1.0688, test_f1: 0.5067
 epoch: 4, train_loss: 0.8312, test_loss: 1.1502, test_f1: 0.4753
 epoch: 5, train_loss: 0.7817, test_loss: 1.0389, test_f1: 0.5721
 epoch: 6, train_loss: 0.8109, test_loss: 1.0453, test_f1: 0.5230
 epoch: 7, train_loss: 0.8110, test_loss: 1.0244, test_f1: 0.5194
 epoch: 8, train_loss: 0.7583, test_loss: 1.0629, test_f1: 0.5838
 epoch: 9, train_loss: 0.7313, test_loss: 1.1208, test_f1: 0.5396
 epoch: 10, train_loss: 0.7551, test_loss: 1.2408, test_f1: 0.4618
 epoch: 11, train_loss: 0.7229, test_loss: 1.2506, test_f1: 0.5783
 epoch: 12, train_loss: 0.7339, test_loss: 1.0428, test_f1: 0.5497
 epoch: 13, train_loss: 0.7501, test_loss: 0.9451, test_f1: 0.6404
 epoch: 14, train_loss: 0.6971, test_loss: 1.0119, test_f1: 0.5986
 epoch: 15, train_loss: 0.7324, test_loss: 1.0242, test_f1: 0.5089
 epoch: 16, train_loss: 0.7125, test_loss: 1.0045, test_f1: 0.5369
 epoch: 17, train_loss: 0.7140, test_loss: 1.2033, test_f1: 0.5136
 epoch: 18, train_loss: 0.6750, test_loss: 1.0276, test_f1: 0.6395
 epoch: 19, train_loss: 0.7032, test_loss: 1.1315, test_f1: 0.5270
 epoch: 20, train_loss: 0.6754, test_loss: 1.2419, test_f1: 0.5962
 epoch: 21, train_loss: 0.6603, test_loss: 1.1250, test_f1: 0.6305
 epoch: 22, train_loss: 0.6476, test_loss: 1.1532, test_f1: 0.5810
 epoch: 23, train_loss: 0.6587, test_loss: 1.3446, test_f1: 0.5276
 epoch: 24, train_loss: 0.6266, test_loss: 1.0264, test_f1: 0.6674
 epoch: 25, train_loss: 0.6471, test_loss: 1.2079, test_f1: 0.6158
 epoch: 26, train_loss: 0.6383, test_loss: 1.0280, test_f1: 0.6745
 epoch: 27, train_loss: 0.6391, test_loss: 1.2056, test_f1: 0.5918
 epoch: 28, train_loss: 0.6655, test_loss: 1.2220, test_f1: 0.6071
 epoch: 29, train_loss: 0.6304, test_loss: 1.0747, test_f1: 0.6261
 epoch: 30, train_loss: 0.5988, test_loss: 0.9847, test_f1: 0.6948
 epoch: 31, train_loss: 0.5648, test_loss: 1.6220, test_f1: 0.6147
 epoch: 32, train_loss: 0.6202, test_loss: 1.2503, test_f1: 0.6003
 epoch: 33, train_loss: 0.6059, test_loss: 1.1943, test_f1: 0.6493
 epoch: 34, train_loss: 0.6323, test_loss: 0.9869, test_f1: 0.6532
 epoch: 35, train_loss: 0.6009, test_loss: 1.0049, test_f1: 0.6692
 epoch: 36, train_loss: 0.5822, test_loss: 1.1481, test_f1: 0.5610
 epoch: 37, train_loss: 0.5948, test_loss: 1.1392, test_f1: 0.6483
 epoch: 38, train_loss: 0.5599, test_loss: 1.0787, test_f1: 0.6555
 epoch: 39, train_loss: 0.5545, test_loss: 1.0206, test_f1: 0.6077
 epoch: 40, train_loss: 0.5794, test_loss: 1.4901, test_f1: 0.3527
 epoch: 41, train_loss: 0.5915, test_loss: 1.0801, test_f1: 0.5747
 epoch: 42, train_loss: 0.5505, test_loss: 0.9760, test_f1: 0.6297
 epoch: 43, train_loss: 0.5384, test_loss: 1.3487, test_f1: 0.5840
 epoch: 44, train_loss: 0.4989, test_loss: 1.1196, test_f1: 0.6451
 epoch: 45, train_loss: 0.5089, test_loss: 1.1561, test_f1: 0.6225
 epoch: 46, train_loss: 0.5112, test_loss: 1.0678, test_f1: 0.6144
 epoch: 47, train_loss: 0.4814, test_loss: 1.0541, test_f1: 0.6632
 epoch: 48, train_loss: 0.4868, test_loss: 1.0516, test_f1: 0.6524
 epoch: 49, train_loss: 0.5021, test_loss: 1.0247, test_f1: 0.6382
 epoch: 50, train_loss: 0.4538, test_loss: 1.2361, test_f1: 0.6086
 epoch: 51, train_loss: 0.4663, test_loss: 1.1994, test_f1: 0.6673
 epoch: 52, train_loss: 0.4304, test_loss: 1.3404, test_f1: 0.6084
 epoch: 53, train_loss: 0.4155, test_loss: 1.2287, test_f1: 0.6353
 epoch: 54, train_loss: 0.3943, test_loss: 1.3338, test_f1: 0.6568
 epoch: 55, train_loss: 0.3802, test_loss: 1.2366, test_f1: 0.6228
 epoch: 56, train_loss: 0.3802, test_loss: 1.3083, test_f1: 0.6578
 epoch: 57, train_loss: 0.3451, test_loss: 1.3223, test_f1: 0.6506
 epoch: 58, train_loss: 0.3619, test_loss: 1.2946, test_f1: 0.6504
 epoch: 59, train_loss: 0.3587, test_loss: 1.2856, test_f1: 0.6710
 epoch: 60, train_loss: 0.3437, test_loss: 1.3202, test_f1: 0.6745
 epoch: 61, train_loss: 0.3480, test_loss: 1.2455, test_f1: 0.6735
 epoch: 62, train_loss: 0.3562, test_loss: 1.4832, test_f1: 0.6437
 epoch: 63, train_loss: 0.4037, test_loss: 1.4619, test_f1: 0.5787
 epoch: 64, train_loss: 0.3578, test_loss: 1.2657, test_f1: 0.6390
 epoch: 65, train_loss: 0.3578, test_loss: 1.3154, test_f1: 0.6176
 epoch: 66, train_loss: 0.3493, test_loss: 1.2407, test_f1: 0.6271
 epoch: 67, train_loss: 0.3156, test_loss: 1.2619, test_f1: 0.6375
 epoch: 68, train_loss: 0.3291, test_loss: 1.4382, test_f1: 0.6146
 epoch: 69, train_loss: 0.3509, test_loss: 1.2113, test_f1: 0.6763
 epoch: 70, train_loss: 0.3074, test_loss: 1.3634, test_f1: 0.6520
 epoch: 71, train_loss: 0.3003, test_loss: 1.4190, test_f1: 0.6194
 epoch: 72, train_loss: 0.3007, test_loss: 1.4411, test_f1: 0.6482
 epoch: 73, train_loss: 0.3425, test_loss: 1.6132, test_f1: 0.5600
 epoch: 74, train_loss: 0.3294, test_loss: 1.1813, test_f1: 0.6745
 epoch: 75, train_loss: 0.3154, test_loss: 1.3294, test_f1: 0.6740
 epoch: 76, train_loss: 0.2870, test_loss: 1.5765, test_f1: 0.5964
 epoch: 77, train_loss: 0.3192, test_loss: 1.4143, test_f1: 0.6481
 epoch: 78, train_loss: 0.2879, test_loss: 1.4832, test_f1: 0.6262
 epoch: 79, train_loss: 0.3264, test_loss: 1.5805, test_f1: 0.6368
 epoch: 80, train_loss: 0.3142, test_loss: 1.3597, test_f1: 0.6155
 epoch: 81, train_loss: 0.3050, test_loss: 1.5056, test_f1: 0.6123
 epoch: 82, train_loss: 0.2873, test_loss: 1.3071, test_f1: 0.7097
 epoch: 83, train_loss: 0.2829, test_loss: 1.4252, test_f1: 0.6668
 epoch: 84, train_loss: 0.3056, test_loss: 1.3665, test_f1: 0.6753
 epoch: 85, train_loss: 0.2825, test_loss: 1.2996, test_f1: 0.6419
 epoch: 86, train_loss: 0.2617, test_loss: 1.6681, test_f1: 0.6484
 epoch: 87, train_loss: 0.2564, test_loss: 1.4260, test_f1: 0.6663
 epoch: 88, train_loss: 0.2504, test_loss: 1.5833, test_f1: 0.6164
 epoch: 89, train_loss: 0.2330, test_loss: 1.5031, test_f1: 0.6374
 epoch: 90, train_loss: 0.2643, test_loss: 1.7192, test_f1: 0.5909
 epoch: 91, train_loss: 0.2537, test_loss: 1.5645, test_f1: 0.6181
 epoch: 92, train_loss: 0.2394, test_loss: 1.6046, test_f1: 0.6456
 epoch: 93, train_loss: 0.2701, test_loss: 1.6795, test_f1: 0.6604
 epoch: 94, train_loss: 0.2655, test_loss: 1.4330, test_f1: 0.6336
 epoch: 95, train_loss: 0.2238, test_loss: 1.4976, test_f1: 0.6852
 epoch: 96, train_loss: 0.2300, test_loss: 1.5518, test_f1: 0.6743
 epoch: 97, train_loss: 0.2473, test_loss: 1.6867, test_f1: 0.6491
 epoch: 98, train_loss: 0.2690, test_loss: 1.5626, test_f1: 0.6557
 epoch: 99, train_loss: 0.2147, test_loss: 1.7739, test_f1: 0.5993
##################ITERATION #6 ****************************************
 epoch: 0, train_loss: 1.2733, test_loss: 1.3507, test_f1: 0.3384
 epoch: 1, train_loss: 1.0642, test_loss: 1.0525, test_f1: 0.4866
 epoch: 2, train_loss: 0.9628, test_loss: 1.0847, test_f1: 0.5447
 epoch: 3, train_loss: 0.9013, test_loss: 0.9767, test_f1: 0.5447
 epoch: 4, train_loss: 0.9042, test_loss: 1.1742, test_f1: 0.4664
 epoch: 5, train_loss: 0.8261, test_loss: 1.2133, test_f1: 0.5602
 epoch: 6, train_loss: 0.8345, test_loss: 1.0357, test_f1: 0.5834
 epoch: 7, train_loss: 0.8199, test_loss: 1.2597, test_f1: 0.4911
 epoch: 8, train_loss: 0.8245, test_loss: 1.1309, test_f1: 0.3872
 epoch: 9, train_loss: 0.7745, test_loss: 1.1319, test_f1: 0.6348
 epoch: 10, train_loss: 0.7702, test_loss: 1.0812, test_f1: 0.5667
 epoch: 11, train_loss: 0.7760, test_loss: 0.9912, test_f1: 0.5206
 epoch: 12, train_loss: 0.7310, test_loss: 1.1993, test_f1: 0.5882
 epoch: 13, train_loss: 0.7306, test_loss: 1.4021, test_f1: 0.5077
 epoch: 14, train_loss: 0.7319, test_loss: 1.0899, test_f1: 0.5977
 epoch: 15, train_loss: 0.7192, test_loss: 1.2063, test_f1: 0.5582
 epoch: 16, train_loss: 0.6919, test_loss: 1.1155, test_f1: 0.5488
 epoch: 17, train_loss: 0.7132, test_loss: 1.0597, test_f1: 0.5302
 epoch: 18, train_loss: 0.6757, test_loss: 1.3529, test_f1: 0.5162
 epoch: 19, train_loss: 0.7157, test_loss: 1.1766, test_f1: 0.5524
 epoch: 20, train_loss: 0.7116, test_loss: 0.9554, test_f1: 0.5736
 epoch: 21, train_loss: 0.6764, test_loss: 1.2201, test_f1: 0.5877
 epoch: 22, train_loss: 0.6630, test_loss: 1.1822, test_f1: 0.5493
 epoch: 23, train_loss: 0.6512, test_loss: 0.9416, test_f1: 0.6342
 epoch: 24, train_loss: 0.6236, test_loss: 1.0969, test_f1: 0.6085
 epoch: 25, train_loss: 0.5753, test_loss: 1.0868, test_f1: 0.5561
 epoch: 26, train_loss: 0.5995, test_loss: 1.2123, test_f1: 0.5867
 epoch: 27, train_loss: 0.6258, test_loss: 1.6709, test_f1: 0.5057
 epoch: 28, train_loss: 0.6199, test_loss: 1.3142, test_f1: 0.5930
 epoch: 29, train_loss: 0.5926, test_loss: 1.1783, test_f1: 0.5615
 epoch: 30, train_loss: 0.5816, test_loss: 1.0834, test_f1: 0.5290
 epoch: 31, train_loss: 0.5871, test_loss: 1.4894, test_f1: 0.6198
 epoch: 32, train_loss: 0.5706, test_loss: 1.3161, test_f1: 0.6688
 epoch: 33, train_loss: 0.5908, test_loss: 1.0999, test_f1: 0.5779
 epoch: 34, train_loss: 0.5805, test_loss: 1.1269, test_f1: 0.6083
 epoch: 35, train_loss: 0.5603, test_loss: 1.2926, test_f1: 0.6280
 epoch: 36, train_loss: 0.5312, test_loss: 1.0394, test_f1: 0.6187
 epoch: 37, train_loss: 0.5259, test_loss: 1.4627, test_f1: 0.5507
 epoch: 38, train_loss: 0.5204, test_loss: 1.1247, test_f1: 0.5792
 epoch: 39, train_loss: 0.5214, test_loss: 1.1715, test_f1: 0.5766
 epoch: 40, train_loss: 0.5192, test_loss: 1.2433, test_f1: 0.6237
 epoch: 41, train_loss: 0.5162, test_loss: 1.2778, test_f1: 0.5946
 epoch: 42, train_loss: 0.5084, test_loss: 1.0819, test_f1: 0.6736
 epoch: 43, train_loss: 0.5023, test_loss: 1.2351, test_f1: 0.5631
 epoch: 44, train_loss: 0.4884, test_loss: 1.3329, test_f1: 0.5338
 epoch: 45, train_loss: 0.5005, test_loss: 1.5033, test_f1: 0.5831
 epoch: 46, train_loss: 0.4406, test_loss: 1.4777, test_f1: 0.6140
 epoch: 47, train_loss: 0.4346, test_loss: 1.3278, test_f1: 0.6170
 epoch: 48, train_loss: 0.4807, test_loss: 1.3876, test_f1: 0.5031
 epoch: 49, train_loss: 0.5020, test_loss: 1.6623, test_f1: 0.5663
 epoch: 50, train_loss: 0.4335, test_loss: 1.2603, test_f1: 0.6560
 epoch: 51, train_loss: 0.4064, test_loss: 1.4546, test_f1: 0.5662
 epoch: 52, train_loss: 0.3928, test_loss: 1.3216, test_f1: 0.6094
 epoch: 53, train_loss: 0.3280, test_loss: 1.4787, test_f1: 0.5787
 epoch: 54, train_loss: 0.3441, test_loss: 1.6459, test_f1: 0.6016
 epoch: 55, train_loss: 0.3478, test_loss: 1.7871, test_f1: 0.5672
 epoch: 56, train_loss: 0.3228, test_loss: 1.5560, test_f1: 0.6342
 epoch: 57, train_loss: 0.3257, test_loss: 1.5440, test_f1: 0.5618
 epoch: 58, train_loss: 0.3076, test_loss: 1.6262, test_f1: 0.5596
 epoch: 59, train_loss: 0.3176, test_loss: 1.6480, test_f1: 0.6273
 epoch: 60, train_loss: 0.3049, test_loss: 1.7939, test_f1: 0.5645
 epoch: 61, train_loss: 0.2788, test_loss: 1.5885, test_f1: 0.6284
 epoch: 62, train_loss: 0.2647, test_loss: 1.7487, test_f1: 0.5861
 epoch: 63, train_loss: 0.2476, test_loss: 1.9348, test_f1: 0.6461
 epoch: 64, train_loss: 0.2792, test_loss: 1.8770, test_f1: 0.6326
 epoch: 65, train_loss: 0.2450, test_loss: 1.7899, test_f1: 0.6279
 epoch: 66, train_loss: 0.2805, test_loss: 1.9366, test_f1: 0.6223
 epoch: 67, train_loss: 0.2389, test_loss: 2.1209, test_f1: 0.5985
 epoch: 68, train_loss: 0.2749, test_loss: 2.1399, test_f1: 0.5757
 epoch: 69, train_loss: 0.2499, test_loss: 1.8668, test_f1: 0.6185
 epoch: 70, train_loss: 0.2511, test_loss: 1.6543, test_f1: 0.6350
 epoch: 71, train_loss: 0.2750, test_loss: 1.8304, test_f1: 0.5836
 epoch: 72, train_loss: 0.2498, test_loss: 1.8931, test_f1: 0.6419
 epoch: 73, train_loss: 0.2489, test_loss: 1.9368, test_f1: 0.5974
 epoch: 74, train_loss: 0.2314, test_loss: 2.0998, test_f1: 0.6132
 epoch: 75, train_loss: 0.2130, test_loss: 2.4528, test_f1: 0.5538
 epoch: 76, train_loss: 0.2341, test_loss: 1.7769, test_f1: 0.6236
 epoch: 77, train_loss: 0.2113, test_loss: 2.4519, test_f1: 0.6238
 epoch: 78, train_loss: 0.2503, test_loss: 1.7770, test_f1: 0.6299
 epoch: 79, train_loss: 0.1997, test_loss: 1.9553, test_f1: 0.6288
 epoch: 80, train_loss: 0.2005, test_loss: 2.1633, test_f1: 0.5958
 epoch: 81, train_loss: 0.2197, test_loss: 2.0393, test_f1: 0.6028
 epoch: 82, train_loss: 0.2259, test_loss: 2.0854, test_f1: 0.6324
 epoch: 83, train_loss: 0.2115, test_loss: 2.2002, test_f1: 0.6267
 epoch: 84, train_loss: 0.2158, test_loss: 2.0141, test_f1: 0.6064
 epoch: 85, train_loss: 0.1937, test_loss: 1.9492, test_f1: 0.6185
 epoch: 86, train_loss: 0.1924, test_loss: 2.0895, test_f1: 0.5866
 epoch: 87, train_loss: 0.1931, test_loss: 2.1574, test_f1: 0.5829
 epoch: 88, train_loss: 0.1664, test_loss: 2.1099, test_f1: 0.6185
 epoch: 89, train_loss: 0.2256, test_loss: 1.9450, test_f1: 0.6367
 epoch: 90, train_loss: 0.2103, test_loss: 2.6411, test_f1: 0.6106
 epoch: 91, train_loss: 0.1962, test_loss: 1.8629, test_f1: 0.6281
 epoch: 92, train_loss: 0.1845, test_loss: 2.2241, test_f1: 0.5977
 epoch: 93, train_loss: 0.1936, test_loss: 1.9657, test_f1: 0.6520
 epoch: 94, train_loss: 0.1832, test_loss: 2.2234, test_f1: 0.5832
 epoch: 95, train_loss: 0.1841, test_loss: 2.6133, test_f1: 0.5942
 epoch: 96, train_loss: 0.1857, test_loss: 2.1649, test_f1: 0.6290
 epoch: 97, train_loss: 0.1633, test_loss: 2.0990, test_f1: 0.6228
 epoch: 98, train_loss: 0.1610, test_loss: 2.1790, test_f1: 0.6264
 epoch: 99, train_loss: 0.1586, test_loss: 2.3447, test_f1: 0.5903
##################ITERATION #7 ****************************************
 epoch: 0, train_loss: 1.2484, test_loss: 1.3216, test_f1: 0.3563
 epoch: 1, train_loss: 1.0011, test_loss: 1.0443, test_f1: 0.4656
 epoch: 2, train_loss: 0.9275, test_loss: 1.1131, test_f1: 0.4329
 epoch: 3, train_loss: 0.8627, test_loss: 0.9859, test_f1: 0.5366
 epoch: 4, train_loss: 0.8549, test_loss: 1.1732, test_f1: 0.5001
 epoch: 5, train_loss: 0.8484, test_loss: 1.1614, test_f1: 0.4908
 epoch: 6, train_loss: 0.8432, test_loss: 1.0902, test_f1: 0.5004
 epoch: 7, train_loss: 0.8046, test_loss: 0.9935, test_f1: 0.6188
 epoch: 8, train_loss: 0.7893, test_loss: 1.0024, test_f1: 0.6301
 epoch: 9, train_loss: 0.8238, test_loss: 1.1198, test_f1: 0.5675
 epoch: 10, train_loss: 0.7992, test_loss: 1.1634, test_f1: 0.5181
 epoch: 11, train_loss: 0.7601, test_loss: 0.9664, test_f1: 0.6080
 epoch: 12, train_loss: 0.7482, test_loss: 0.9464, test_f1: 0.5609
 epoch: 13, train_loss: 0.7339, test_loss: 1.0295, test_f1: 0.6155
 epoch: 14, train_loss: 0.7304, test_loss: 0.9357, test_f1: 0.6311
 epoch: 15, train_loss: 0.7222, test_loss: 0.9590, test_f1: 0.6111
 epoch: 16, train_loss: 0.6947, test_loss: 1.1041, test_f1: 0.5776
 epoch: 17, train_loss: 0.7021, test_loss: 1.2918, test_f1: 0.5858
 epoch: 18, train_loss: 0.6813, test_loss: 1.3555, test_f1: 0.5609
 epoch: 19, train_loss: 0.6881, test_loss: 1.1121, test_f1: 0.5184
 epoch: 20, train_loss: 0.7162, test_loss: 1.2245, test_f1: 0.5589
 epoch: 21, train_loss: 0.6735, test_loss: 1.1774, test_f1: 0.5636
 epoch: 22, train_loss: 0.6624, test_loss: 1.2498, test_f1: 0.4997
 epoch: 23, train_loss: 0.6645, test_loss: 1.8641, test_f1: 0.4639
 epoch: 24, train_loss: 0.6854, test_loss: 0.9983, test_f1: 0.6102
 epoch: 25, train_loss: 0.6371, test_loss: 1.1209, test_f1: 0.5018
 epoch: 26, train_loss: 0.6402, test_loss: 0.9671, test_f1: 0.6610
 epoch: 27, train_loss: 0.6389, test_loss: 1.0482, test_f1: 0.5516
 epoch: 28, train_loss: 0.6278, test_loss: 1.1191, test_f1: 0.5606
 epoch: 29, train_loss: 0.6540, test_loss: 1.0285, test_f1: 0.6553
 epoch: 30, train_loss: 0.6439, test_loss: 1.4703, test_f1: 0.5735
 epoch: 31, train_loss: 0.6318, test_loss: 0.9004, test_f1: 0.6498
 epoch: 32, train_loss: 0.5984, test_loss: 1.3913, test_f1: 0.5689
 epoch: 33, train_loss: 0.5971, test_loss: 1.2295, test_f1: 0.5899
 epoch: 34, train_loss: 0.5964, test_loss: 1.4989, test_f1: 0.5630
 epoch: 35, train_loss: 0.5697, test_loss: 1.0640, test_f1: 0.6324
 epoch: 36, train_loss: 0.5914, test_loss: 1.1816, test_f1: 0.6117
 epoch: 37, train_loss: 0.6032, test_loss: 1.2141, test_f1: 0.6058
 epoch: 38, train_loss: 0.5812, test_loss: 1.4116, test_f1: 0.5872
 epoch: 39, train_loss: 0.5667, test_loss: 1.1087, test_f1: 0.5959
 epoch: 40, train_loss: 0.5410, test_loss: 1.1795, test_f1: 0.6228
 epoch: 41, train_loss: 0.5043, test_loss: 1.2473, test_f1: 0.5787
 epoch: 42, train_loss: 0.5121, test_loss: 1.2217, test_f1: 0.5915
 epoch: 43, train_loss: 0.5213, test_loss: 1.0626, test_f1: 0.6149
 epoch: 44, train_loss: 0.5802, test_loss: 2.1153, test_f1: 0.5452
 epoch: 45, train_loss: 0.5506, test_loss: 1.3313, test_f1: 0.5837
 epoch: 46, train_loss: 0.5080, test_loss: 1.4723, test_f1: 0.6224
 epoch: 47, train_loss: 0.5289, test_loss: 1.4688, test_f1: 0.6366
 epoch: 48, train_loss: 0.5141, test_loss: 1.4413, test_f1: 0.6523
 epoch: 49, train_loss: 0.5354, test_loss: 1.0925, test_f1: 0.6248
 epoch: 50, train_loss: 0.4900, test_loss: 1.7365, test_f1: 0.6352
 epoch: 51, train_loss: 0.4556, test_loss: 1.3495, test_f1: 0.5925
 epoch: 52, train_loss: 0.4214, test_loss: 2.0365, test_f1: 0.5694
 epoch: 53, train_loss: 0.4042, test_loss: 1.4189, test_f1: 0.6025
 epoch: 54, train_loss: 0.3721, test_loss: 1.5722, test_f1: 0.6014
 epoch: 55, train_loss: 0.3641, test_loss: 1.6817, test_f1: 0.6511
 epoch: 56, train_loss: 0.3638, test_loss: 1.6778, test_f1: 0.5999
 epoch: 57, train_loss: 0.3724, test_loss: 2.0303, test_f1: 0.5796
 epoch: 58, train_loss: 0.3702, test_loss: 1.5873, test_f1: 0.6528
 epoch: 59, train_loss: 0.3518, test_loss: 1.6385, test_f1: 0.6000
 epoch: 60, train_loss: 0.3581, test_loss: 1.7958, test_f1: 0.5898
 epoch: 61, train_loss: 0.3530, test_loss: 1.9065, test_f1: 0.6180
 epoch: 62, train_loss: 0.3343, test_loss: 1.7627, test_f1: 0.6592
 epoch: 63, train_loss: 0.3549, test_loss: 1.7187, test_f1: 0.6336
 epoch: 64, train_loss: 0.3397, test_loss: 1.7387, test_f1: 0.5911
 epoch: 65, train_loss: 0.3291, test_loss: 1.4552, test_f1: 0.6507
 epoch: 66, train_loss: 0.3088, test_loss: 1.8900, test_f1: 0.6291
 epoch: 67, train_loss: 0.3194, test_loss: 1.8040, test_f1: 0.6505
 epoch: 68, train_loss: 0.3214, test_loss: 2.2826, test_f1: 0.6366
 epoch: 69, train_loss: 0.3035, test_loss: 1.6936, test_f1: 0.6241
 epoch: 70, train_loss: 0.3109, test_loss: 1.8190, test_f1: 0.6427
 epoch: 71, train_loss: 0.2538, test_loss: 2.2951, test_f1: 0.6267
 epoch: 72, train_loss: 0.3247, test_loss: 2.1229, test_f1: 0.6132
 epoch: 73, train_loss: 0.3242, test_loss: 1.9413, test_f1: 0.6292
 epoch: 74, train_loss: 0.3042, test_loss: 1.8797, test_f1: 0.6353
 epoch: 75, train_loss: 0.2892, test_loss: 2.0530, test_f1: 0.6140
 epoch: 76, train_loss: 0.2952, test_loss: 2.0700, test_f1: 0.6171
 epoch: 77, train_loss: 0.2696, test_loss: 1.9108, test_f1: 0.6244
 epoch: 78, train_loss: 0.2962, test_loss: 1.8668, test_f1: 0.5903
 epoch: 79, train_loss: 0.2857, test_loss: 1.9602, test_f1: 0.6204
 epoch: 80, train_loss: 0.2635, test_loss: 1.9073, test_f1: 0.6623
 epoch: 81, train_loss: 0.2569, test_loss: 1.9098, test_f1: 0.6377
 epoch: 82, train_loss: 0.2383, test_loss: 2.0998, test_f1: 0.6288
 epoch: 83, train_loss: 0.2886, test_loss: 1.7868, test_f1: 0.6676
 epoch: 84, train_loss: 0.2658, test_loss: 2.1192, test_f1: 0.6336
 epoch: 85, train_loss: 0.2756, test_loss: 1.8200, test_f1: 0.6476
 epoch: 86, train_loss: 0.2660, test_loss: 1.8494, test_f1: 0.5984
 epoch: 87, train_loss: 0.2600, test_loss: 2.1871, test_f1: 0.5723
 epoch: 88, train_loss: 0.2744, test_loss: 1.9479, test_f1: 0.6396
 epoch: 89, train_loss: 0.2842, test_loss: 2.4051, test_f1: 0.6362
 epoch: 90, train_loss: 0.2522, test_loss: 2.0692, test_f1: 0.6559
 epoch: 91, train_loss: 0.2327, test_loss: 2.0358, test_f1: 0.6500
 epoch: 92, train_loss: 0.2655, test_loss: 1.9167, test_f1: 0.6641
 epoch: 93, train_loss: 0.2163, test_loss: 2.0392, test_f1: 0.6288
 epoch: 94, train_loss: 0.2659, test_loss: 1.8952, test_f1: 0.6453
 epoch: 95, train_loss: 0.2364, test_loss: 2.0459, test_f1: 0.6325
 epoch: 96, train_loss: 0.2326, test_loss: 2.1257, test_f1: 0.5826
 epoch: 97, train_loss: 0.2225, test_loss: 1.9353, test_f1: 0.6533
 epoch: 98, train_loss: 0.2190, test_loss: 2.2358, test_f1: 0.6056
 epoch: 99, train_loss: 0.2151, test_loss: 2.0611, test_f1: 0.5844
##################ITERATION #8 ****************************************
 epoch: 0, train_loss: 1.3345, test_loss: 1.2535, test_f1: 0.3623
 epoch: 1, train_loss: 1.0503, test_loss: 1.4066, test_f1: 0.3179
 epoch: 2, train_loss: 0.9593, test_loss: 1.3125, test_f1: 0.4238
 epoch: 3, train_loss: 0.9321, test_loss: 1.1917, test_f1: 0.4829
 epoch: 4, train_loss: 0.8936, test_loss: 1.0281, test_f1: 0.4170
 epoch: 5, train_loss: 0.8636, test_loss: 1.4352, test_f1: 0.3981
 epoch: 6, train_loss: 0.8408, test_loss: 0.9924, test_f1: 0.4506
 epoch: 7, train_loss: 0.7814, test_loss: 0.9334, test_f1: 0.5676
 epoch: 8, train_loss: 0.7843, test_loss: 1.0195, test_f1: 0.4809
 epoch: 9, train_loss: 0.7612, test_loss: 0.9196, test_f1: 0.6130
 epoch: 10, train_loss: 0.7642, test_loss: 1.1125, test_f1: 0.4249
 epoch: 11, train_loss: 0.7732, test_loss: 0.9960, test_f1: 0.6084
 epoch: 12, train_loss: 0.7373, test_loss: 0.8945, test_f1: 0.5358
 epoch: 13, train_loss: 0.7517, test_loss: 1.0210, test_f1: 0.5684
 epoch: 14, train_loss: 0.7621, test_loss: 0.9917, test_f1: 0.6099
 epoch: 15, train_loss: 0.7201, test_loss: 1.5097, test_f1: 0.4638
 epoch: 16, train_loss: 0.6976, test_loss: 1.3623, test_f1: 0.5452
 epoch: 17, train_loss: 0.7376, test_loss: 1.0425, test_f1: 0.6241
 epoch: 18, train_loss: 0.6917, test_loss: 1.0287, test_f1: 0.6251
 epoch: 19, train_loss: 0.6720, test_loss: 1.5165, test_f1: 0.4183
 epoch: 20, train_loss: 0.6830, test_loss: 0.9914, test_f1: 0.6169
 epoch: 21, train_loss: 0.6494, test_loss: 1.1621, test_f1: 0.5770
 epoch: 22, train_loss: 0.6390, test_loss: 1.1084, test_f1: 0.5468
 epoch: 23, train_loss: 0.6501, test_loss: 1.0710, test_f1: 0.6418
 epoch: 24, train_loss: 0.6177, test_loss: 1.6338, test_f1: 0.4920
 epoch: 25, train_loss: 0.6144, test_loss: 1.2615, test_f1: 0.6261
 epoch: 26, train_loss: 0.7023, test_loss: 1.0145, test_f1: 0.5283
 epoch: 27, train_loss: 0.6721, test_loss: 0.9716, test_f1: 0.6487
 epoch: 28, train_loss: 0.6350, test_loss: 0.9271, test_f1: 0.6947
 epoch: 29, train_loss: 0.6254, test_loss: 1.0091, test_f1: 0.6637
 epoch: 30, train_loss: 0.6279, test_loss: 1.0639, test_f1: 0.6525
 epoch: 31, train_loss: 0.6187, test_loss: 2.2342, test_f1: 0.4273
 epoch: 32, train_loss: 0.6353, test_loss: 1.1791, test_f1: 0.5854
 epoch: 33, train_loss: 0.5898, test_loss: 1.0834, test_f1: 0.5767
 epoch: 34, train_loss: 0.5964, test_loss: 1.2729, test_f1: 0.5861
 epoch: 35, train_loss: 0.5649, test_loss: 1.0265, test_f1: 0.6033
 epoch: 36, train_loss: 0.5937, test_loss: 1.2102, test_f1: 0.5462
 epoch: 37, train_loss: 0.5457, test_loss: 1.1230, test_f1: 0.5492
 epoch: 38, train_loss: 0.5305, test_loss: 0.9567, test_f1: 0.5866
 epoch: 39, train_loss: 0.5549, test_loss: 1.0617, test_f1: 0.6169
 epoch: 40, train_loss: 0.5643, test_loss: 1.5599, test_f1: 0.5694
 epoch: 41, train_loss: 0.5563, test_loss: 1.0106, test_f1: 0.5822
 epoch: 42, train_loss: 0.5301, test_loss: 1.2529, test_f1: 0.5541
 epoch: 43, train_loss: 0.5431, test_loss: 1.1679, test_f1: 0.5135
 epoch: 44, train_loss: 0.5468, test_loss: 0.9330, test_f1: 0.6074
 epoch: 45, train_loss: 0.5320, test_loss: 1.0833, test_f1: 0.6438
 epoch: 46, train_loss: 0.5440, test_loss: 1.0617, test_f1: 0.6095
 epoch: 47, train_loss: 0.5094, test_loss: 1.1541, test_f1: 0.5712
 epoch: 48, train_loss: 0.4688, test_loss: 0.8924, test_f1: 0.6448
 epoch: 49, train_loss: 0.4824, test_loss: 1.0360, test_f1: 0.6315
 epoch: 50, train_loss: 0.4895, test_loss: 1.0993, test_f1: 0.5630
 epoch: 51, train_loss: 0.4708, test_loss: 1.2321, test_f1: 0.5705
 epoch: 52, train_loss: 0.4187, test_loss: 1.1582, test_f1: 0.5954
 epoch: 53, train_loss: 0.4086, test_loss: 1.2470, test_f1: 0.6502
 epoch: 54, train_loss: 0.3876, test_loss: 1.0883, test_f1: 0.5940
 epoch: 55, train_loss: 0.3831, test_loss: 1.2150, test_f1: 0.6219
 epoch: 56, train_loss: 0.3730, test_loss: 1.3881, test_f1: 0.5521
 epoch: 57, train_loss: 0.3807, test_loss: 1.4221, test_f1: 0.6092
 epoch: 58, train_loss: 0.3610, test_loss: 1.2827, test_f1: 0.6398
 epoch: 59, train_loss: 0.3829, test_loss: 1.3079, test_f1: 0.5739
 epoch: 60, train_loss: 0.3357, test_loss: 1.7326, test_f1: 0.5844
 epoch: 61, train_loss: 0.3429, test_loss: 1.5800, test_f1: 0.6112
 epoch: 62, train_loss: 0.3392, test_loss: 1.9502, test_f1: 0.5864
 epoch: 63, train_loss: 0.2901, test_loss: 1.6810, test_f1: 0.6116
 epoch: 64, train_loss: 0.3221, test_loss: 1.6568, test_f1: 0.6159
 epoch: 65, train_loss: 0.3179, test_loss: 1.5864, test_f1: 0.6186
 epoch: 66, train_loss: 0.3455, test_loss: 1.7282, test_f1: 0.6180
 epoch: 67, train_loss: 0.3178, test_loss: 1.6027, test_f1: 0.6210
 epoch: 68, train_loss: 0.3184, test_loss: 2.2031, test_f1: 0.5716
 epoch: 69, train_loss: 0.2780, test_loss: 1.6729, test_f1: 0.5653
 epoch: 70, train_loss: 0.3012, test_loss: 1.8376, test_f1: 0.5875
 epoch: 71, train_loss: 0.2972, test_loss: 1.7183, test_f1: 0.6081
 epoch: 72, train_loss: 0.2949, test_loss: 1.6191, test_f1: 0.6093
 epoch: 73, train_loss: 0.2978, test_loss: 2.1776, test_f1: 0.6003
 epoch: 74, train_loss: 0.2694, test_loss: 1.8679, test_f1: 0.5682
 epoch: 75, train_loss: 0.2673, test_loss: 1.7243, test_f1: 0.6365
 epoch: 76, train_loss: 0.2586, test_loss: 2.0046, test_f1: 0.5970
 epoch: 77, train_loss: 0.2679, test_loss: 1.8131, test_f1: 0.6178
 epoch: 78, train_loss: 0.2850, test_loss: 1.8355, test_f1: 0.6037
 epoch: 79, train_loss: 0.2558, test_loss: 1.8906, test_f1: 0.5998
 epoch: 80, train_loss: 0.2886, test_loss: 1.8670, test_f1: 0.6110
 epoch: 81, train_loss: 0.2368, test_loss: 2.2002, test_f1: 0.6137
 epoch: 82, train_loss: 0.2002, test_loss: 2.4572, test_f1: 0.5897
 epoch: 83, train_loss: 0.2421, test_loss: 2.0988, test_f1: 0.6127
 epoch: 84, train_loss: 0.2576, test_loss: 1.7579, test_f1: 0.6418
 epoch: 85, train_loss: 0.2191, test_loss: 2.1629, test_f1: 0.6038
 epoch: 86, train_loss: 0.2553, test_loss: 2.0142, test_f1: 0.6302
 epoch: 87, train_loss: 0.2343, test_loss: 1.9738, test_f1: 0.6328
 epoch: 88, train_loss: 0.2175, test_loss: 2.0619, test_f1: 0.6510
 epoch: 89, train_loss: 0.2246, test_loss: 1.9053, test_f1: 0.6252
 epoch: 90, train_loss: 0.2536, test_loss: 1.9808, test_f1: 0.6231
 epoch: 91, train_loss: 0.2230, test_loss: 1.8033, test_f1: 0.6312
 epoch: 92, train_loss: 0.2357, test_loss: 2.1987, test_f1: 0.6313
 epoch: 93, train_loss: 0.2159, test_loss: 2.0111, test_f1: 0.6278
 epoch: 94, train_loss: 0.2576, test_loss: 2.0230, test_f1: 0.6313
 epoch: 95, train_loss: 0.1856, test_loss: 2.0635, test_f1: 0.6199
 epoch: 96, train_loss: 0.1503, test_loss: 2.2755, test_f1: 0.6269
 epoch: 97, train_loss: 0.1810, test_loss: 2.2161, test_f1: 0.6292
 epoch: 98, train_loss: 0.1674, test_loss: 2.0499, test_f1: 0.6379
 epoch: 99, train_loss: 0.1360, test_loss: 2.0906, test_f1: 0.6315
##################ITERATION #9 ****************************************
 epoch: 0, train_loss: 1.2028, test_loss: 1.1644, test_f1: 0.3689
 epoch: 1, train_loss: 0.9216, test_loss: 1.2013, test_f1: 0.5127
 epoch: 2, train_loss: 0.8718, test_loss: 0.9695, test_f1: 0.5775
 epoch: 3, train_loss: 0.8574, test_loss: 1.0192, test_f1: 0.5628
 epoch: 4, train_loss: 0.8607, test_loss: 1.2550, test_f1: 0.3950
 epoch: 5, train_loss: 0.8653, test_loss: 1.1809, test_f1: 0.5208
 epoch: 6, train_loss: 0.8190, test_loss: 1.4623, test_f1: 0.4286
 epoch: 7, train_loss: 0.7759, test_loss: 1.0964, test_f1: 0.5168
 epoch: 8, train_loss: 0.7555, test_loss: 0.9541, test_f1: 0.6079
 epoch: 9, train_loss: 0.7579, test_loss: 0.9209, test_f1: 0.6498
 epoch: 10, train_loss: 0.7288, test_loss: 0.9075, test_f1: 0.6153
 epoch: 11, train_loss: 0.7259, test_loss: 0.8772, test_f1: 0.6298
 epoch: 12, train_loss: 0.7033, test_loss: 0.9027, test_f1: 0.6940
 epoch: 13, train_loss: 0.7191, test_loss: 1.1883, test_f1: 0.5333
 epoch: 14, train_loss: 0.7245, test_loss: 0.9599, test_f1: 0.6415
 epoch: 15, train_loss: 0.7075, test_loss: 0.8177, test_f1: 0.6770
 epoch: 16, train_loss: 0.6953, test_loss: 0.8845, test_f1: 0.6246
 epoch: 17, train_loss: 0.7351, test_loss: 0.9517, test_f1: 0.6354
 epoch: 18, train_loss: 0.6827, test_loss: 1.0535, test_f1: 0.5811
 epoch: 19, train_loss: 0.6727, test_loss: 0.8550, test_f1: 0.6552
 epoch: 20, train_loss: 0.6510, test_loss: 1.0905, test_f1: 0.6275
 epoch: 21, train_loss: 0.6407, test_loss: 0.9598, test_f1: 0.6343
 epoch: 22, train_loss: 0.6407, test_loss: 1.3362, test_f1: 0.4744
 epoch: 23, train_loss: 0.6715, test_loss: 1.2121, test_f1: 0.5576
 epoch: 24, train_loss: 0.6458, test_loss: 0.9208, test_f1: 0.6532
 epoch: 25, train_loss: 0.6121, test_loss: 0.8698, test_f1: 0.6500
 epoch: 26, train_loss: 0.6220, test_loss: 1.2573, test_f1: 0.6175
 epoch: 27, train_loss: 0.6368, test_loss: 1.0992, test_f1: 0.6121
 epoch: 28, train_loss: 0.5994, test_loss: 1.1255, test_f1: 0.6420
 epoch: 29, train_loss: 0.6168, test_loss: 0.9077, test_f1: 0.6577
 epoch: 30, train_loss: 0.6135, test_loss: 0.9600, test_f1: 0.6014
 epoch: 31, train_loss: 0.5457, test_loss: 1.0055, test_f1: 0.6391
 epoch: 32, train_loss: 0.5589, test_loss: 1.0712, test_f1: 0.6543
 epoch: 33, train_loss: 0.5491, test_loss: 1.4391, test_f1: 0.6101
 epoch: 34, train_loss: 0.5483, test_loss: 1.0606, test_f1: 0.6481
 epoch: 35, train_loss: 0.5338, test_loss: 1.1050, test_f1: 0.6564
 epoch: 36, train_loss: 0.5358, test_loss: 1.0659, test_f1: 0.6430
 epoch: 37, train_loss: 0.5351, test_loss: 1.0914, test_f1: 0.6529
 epoch: 38, train_loss: 0.5217, test_loss: 1.0842, test_f1: 0.6099
 epoch: 39, train_loss: 0.5492, test_loss: 0.9603, test_f1: 0.5880
 epoch: 40, train_loss: 0.5784, test_loss: 1.1683, test_f1: 0.6009
 epoch: 41, train_loss: 0.5367, test_loss: 1.4244, test_f1: 0.5942
 epoch: 42, train_loss: 0.5151, test_loss: 1.1759, test_f1: 0.6199
 epoch: 43, train_loss: 0.5015, test_loss: 1.4842, test_f1: 0.6408
 epoch: 44, train_loss: 0.5216, test_loss: 1.0662, test_f1: 0.6463
 epoch: 45, train_loss: 0.4981, test_loss: 1.2040, test_f1: 0.6337
 epoch: 46, train_loss: 0.4431, test_loss: 1.0200, test_f1: 0.6340
 epoch: 47, train_loss: 0.4692, test_loss: 1.0972, test_f1: 0.6196
 epoch: 48, train_loss: 0.5070, test_loss: 1.2430, test_f1: 0.6167
 epoch: 49, train_loss: 0.4701, test_loss: 1.1721, test_f1: 0.6188
 epoch: 50, train_loss: 0.4654, test_loss: 1.1667, test_f1: 0.6370
 epoch: 51, train_loss: 0.4294, test_loss: 1.2086, test_f1: 0.6439
 epoch: 52, train_loss: 0.3924, test_loss: 1.2117, test_f1: 0.6206
 epoch: 53, train_loss: 0.3742, test_loss: 1.2641, test_f1: 0.6389
 epoch: 54, train_loss: 0.3731, test_loss: 1.2960, test_f1: 0.6391
 epoch: 55, train_loss: 0.3639, test_loss: 1.4242, test_f1: 0.6347
 epoch: 56, train_loss: 0.3685, test_loss: 1.5699, test_f1: 0.6237
 epoch: 57, train_loss: 0.4148, test_loss: 1.4659, test_f1: 0.6130
 epoch: 58, train_loss: 0.3549, test_loss: 1.6341, test_f1: 0.6029
 epoch: 59, train_loss: 0.3464, test_loss: 1.4300, test_f1: 0.5890
 epoch: 60, train_loss: 0.3314, test_loss: 1.6045, test_f1: 0.6103
 epoch: 61, train_loss: 0.3207, test_loss: 1.4391, test_f1: 0.6314
 epoch: 62, train_loss: 0.3260, test_loss: 1.2712, test_f1: 0.6522
 epoch: 63, train_loss: 0.2922, test_loss: 1.9411, test_f1: 0.4855
 epoch: 64, train_loss: 0.3222, test_loss: 1.4890, test_f1: 0.6458
 epoch: 65, train_loss: 0.3305, test_loss: 1.8298, test_f1: 0.6038
 epoch: 66, train_loss: 0.2960, test_loss: 1.4699, test_f1: 0.6486
 epoch: 67, train_loss: 0.3075, test_loss: 1.9160, test_f1: 0.6203
 epoch: 68, train_loss: 0.3186, test_loss: 1.7098, test_f1: 0.6476
 epoch: 69, train_loss: 0.2926, test_loss: 1.9613, test_f1: 0.5970
 epoch: 70, train_loss: 0.3222, test_loss: 1.5394, test_f1: 0.6485
 epoch: 71, train_loss: 0.2978, test_loss: 1.7632, test_f1: 0.5991
 epoch: 72, train_loss: 0.3018, test_loss: 1.6894, test_f1: 0.6294
 epoch: 73, train_loss: 0.2895, test_loss: 1.8242, test_f1: 0.6076
 epoch: 74, train_loss: 0.2649, test_loss: 1.9447, test_f1: 0.6135
 epoch: 75, train_loss: 0.2600, test_loss: 1.8587, test_f1: 0.6520
 epoch: 76, train_loss: 0.2616, test_loss: 1.6982, test_f1: 0.6398
 epoch: 77, train_loss: 0.2233, test_loss: 1.9647, test_f1: 0.6375
 epoch: 78, train_loss: 0.2551, test_loss: 1.8057, test_f1: 0.6654
 epoch: 79, train_loss: 0.2480, test_loss: 1.8061, test_f1: 0.6278
 epoch: 80, train_loss: 0.2511, test_loss: 1.9839, test_f1: 0.6296
 epoch: 81, train_loss: 0.2169, test_loss: 1.9661, test_f1: 0.6646
 epoch: 82, train_loss: 0.2290, test_loss: 2.1216, test_f1: 0.6332
 epoch: 83, train_loss: 0.2394, test_loss: 1.8437, test_f1: 0.6552
 epoch: 84, train_loss: 0.2133, test_loss: 2.0387, test_f1: 0.6207
 epoch: 85, train_loss: 0.2374, test_loss: 1.9200, test_f1: 0.6210
 epoch: 86, train_loss: 0.2661, test_loss: 1.7457, test_f1: 0.6700
 epoch: 87, train_loss: 0.2198, test_loss: 2.0301, test_f1: 0.6289
 epoch: 88, train_loss: 0.2407, test_loss: 1.7949, test_f1: 0.6094
 epoch: 89, train_loss: 0.1957, test_loss: 2.2847, test_f1: 0.6190
 epoch: 90, train_loss: 0.2338, test_loss: 2.0804, test_f1: 0.6025
 epoch: 91, train_loss: 0.2959, test_loss: 2.0674, test_f1: 0.6458
 epoch: 92, train_loss: 0.2092, test_loss: 2.5884, test_f1: 0.6432
 epoch: 93, train_loss: 0.2093, test_loss: 1.9113, test_f1: 0.6549
 epoch: 94, train_loss: 0.1793, test_loss: 2.3718, test_f1: 0.6506
 epoch: 95, train_loss: 0.2069, test_loss: 2.0834, test_f1: 0.6722
 epoch: 96, train_loss: 0.1668, test_loss: 2.0625, test_f1: 0.6523
 epoch: 97, train_loss: 0.1645, test_loss: 2.2827, test_f1: 0.6211
 epoch: 98, train_loss: 0.1792, test_loss: 2.2643, test_f1: 0.5996
 epoch: 99, train_loss: 0.1823, test_loss: 1.9677, test_f1: 0.6554

Training completed in 568.20 seconds
Best F1: 0.7103 at epoch 99
Mean F1 across iterations: 0.6881  0.0147
========================FINAL RESULTS================================
FEGIN weighted F1: 0.7103  0.0147
python main.py --data ltspice_demos --representation component_pin --model FEGIN --layers 2 --hiddens 128 --batch_size 64 --lr 0.01 --emb_size 512 --epochs 100 --save_appendix component_pin_L2_H128_BS64_LR0.01_E512 --no_val
-----



STDERR:
  File "main.py", line 370, in <module>
    main()
  File "main.py", line 254, in main
    dataset = dataset_class(
  File "/home/philip/projects/ltspice_examples_code_repo/Circuit-Completion-Using-GNNs/component_classification_with_link_prediction_head/evaluation/FEGIN/kernel/circuit_datasets.py", line 15, in __init__
    self.data, self.slices = torch.load(self.processed_paths[0])
  File "/home/philip/.local/lib/python3.8/site-packages/torch/serialization.py", line 1040, in load
    warnings.warn(
  File "/usr/lib/python3.8/warnings.py", line 109, in _showwarnmsg
    sw(msg.message, msg.category, msg.filename, msg.lineno,
  File "main.py", line 47, in warn_with_traceback
    traceback.print_stack(file=log)
/home/philip/projects/ltspice_examples_code_repo/Circuit-Completion-Using-GNNs/component_classification_with_link_prediction_head/evaluation/FEGIN/kernel/circuit_datasets.py:15: FutureWarning: You are using `torch.load` with `weights_only=False` (the current default value), which uses the default pickle module implicitly. It is possible to construct malicious pickle data which will execute arbitrary code during unpickling (See https://github.com/pytorch/pytorch/blob/main/SECURITY.md#untrusted-models for more details). In a future release, the default value for `weights_only` will be flipped to `True`. This limits the functions that could be executed during unpickling. Arbitrary objects will no longer be allowed to be loaded via this mode unless they are explicitly allowlisted by the user via `torch.serialization.add_safe_globals`. We recommend you start setting `weights_only=True` for any use case where you don't have full control of the loaded file. Please open an issue on GitHub for any issues related to this experimental feature.
  self.data, self.slices = torch.load(self.processed_paths[0])
