STDOUT:
Results will be saved in /home/philip/projects/ltspice_examples_code_repo/Circuit-Completion-Using-GNNs/component_classification_with_link_prediction_head/evaluation/FEGIN/results/model_FEGIN_dataset_ltspice_demos
Command line input: python main.py --data ltspice_demos --representation component_pin --model FEGIN --layers 5 --hiddens 64 --batch_size 128 --lr 0.001 --emb_size 250 --epochs 100 --save_appendix component_pin_L5_H64_BS128_LR0.001_E250 --no_val
 is saved.
-----
ltspice_demos - FEGIN
Using 5 layers, 64 hidden units, h = 2
Loading component_pin representation dataset
ENTERED
Training FEGIN on component_pin representation
Train: 1565, Test: 383
##################ITERATION #0 ****************************************
 epoch: 0, train_loss: 1.3563, test_loss: 1.3406, test_f1: 0.1365
 epoch: 1, train_loss: 1.2292, test_loss: 1.2979, test_f1: 0.3276
 epoch: 2, train_loss: 1.1599, test_loss: 1.2710, test_f1: 0.3093
 epoch: 3, train_loss: 1.1279, test_loss: 1.2340, test_f1: 0.3879
 epoch: 4, train_loss: 1.0897, test_loss: 1.1779, test_f1: 0.4380
 epoch: 5, train_loss: 1.0426, test_loss: 1.1282, test_f1: 0.4280
 epoch: 6, train_loss: 0.9901, test_loss: 1.1215, test_f1: 0.4518
 epoch: 7, train_loss: 0.9489, test_loss: 1.1056, test_f1: 0.4808
 epoch: 8, train_loss: 0.9216, test_loss: 1.0455, test_f1: 0.5357
 epoch: 9, train_loss: 0.8922, test_loss: 1.0593, test_f1: 0.5321
 epoch: 10, train_loss: 0.8673, test_loss: 1.0050, test_f1: 0.5624
 epoch: 11, train_loss: 0.8609, test_loss: 0.9768, test_f1: 0.5921
 epoch: 12, train_loss: 0.8250, test_loss: 1.0479, test_f1: 0.5228
 epoch: 13, train_loss: 0.8197, test_loss: 0.9980, test_f1: 0.5891
 epoch: 14, train_loss: 0.8007, test_loss: 1.0076, test_f1: 0.5755
 epoch: 15, train_loss: 0.7754, test_loss: 1.0068, test_f1: 0.5716
 epoch: 16, train_loss: 0.7606, test_loss: 0.9911, test_f1: 0.5785
 epoch: 17, train_loss: 0.7442, test_loss: 1.0110, test_f1: 0.5453
 epoch: 18, train_loss: 0.7226, test_loss: 0.9928, test_f1: 0.5711
 epoch: 19, train_loss: 0.7085, test_loss: 0.9859, test_f1: 0.6060
 epoch: 20, train_loss: 0.6916, test_loss: 0.9347, test_f1: 0.5723
 epoch: 21, train_loss: 0.6557, test_loss: 1.0164, test_f1: 0.5985
 epoch: 22, train_loss: 0.6595, test_loss: 1.1585, test_f1: 0.5324
 epoch: 23, train_loss: 0.6503, test_loss: 1.1188, test_f1: 0.5491
 epoch: 24, train_loss: 0.6383, test_loss: 1.1912, test_f1: 0.5280
 epoch: 25, train_loss: 0.6434, test_loss: 1.0542, test_f1: 0.5763
 epoch: 26, train_loss: 0.6135, test_loss: 1.3652, test_f1: 0.4469
 epoch: 27, train_loss: 0.6351, test_loss: 1.1068, test_f1: 0.5734
 epoch: 28, train_loss: 0.6134, test_loss: 0.9818, test_f1: 0.5786
 epoch: 29, train_loss: 0.5939, test_loss: 1.0168, test_f1: 0.5891
 epoch: 30, train_loss: 0.5745, test_loss: 1.1200, test_f1: 0.5362
 epoch: 31, train_loss: 0.5586, test_loss: 1.0639, test_f1: 0.5754
 epoch: 32, train_loss: 0.5615, test_loss: 1.1931, test_f1: 0.5367
 epoch: 33, train_loss: 0.5632, test_loss: 2.1744, test_f1: 0.3946
 epoch: 34, train_loss: 0.5728, test_loss: 1.2661, test_f1: 0.5209
 epoch: 35, train_loss: 0.5502, test_loss: 1.2312, test_f1: 0.5461
 epoch: 36, train_loss: 0.5081, test_loss: 1.1348, test_f1: 0.5396
 epoch: 37, train_loss: 0.5069, test_loss: 1.4381, test_f1: 0.5621
 epoch: 38, train_loss: 0.5219, test_loss: 1.2060, test_f1: 0.5959
 epoch: 39, train_loss: 0.4827, test_loss: 1.3865, test_f1: 0.5307
 epoch: 40, train_loss: 0.4910, test_loss: 1.4918, test_f1: 0.5705
 epoch: 41, train_loss: 0.5111, test_loss: 1.6147, test_f1: 0.4830
 epoch: 42, train_loss: 0.4978, test_loss: 1.3580, test_f1: 0.5647
 epoch: 43, train_loss: 0.4726, test_loss: 1.4634, test_f1: 0.5418
 epoch: 44, train_loss: 0.4303, test_loss: 1.2710, test_f1: 0.5591
 epoch: 45, train_loss: 0.4537, test_loss: 1.2631, test_f1: 0.5907
 epoch: 46, train_loss: 0.4551, test_loss: 1.2932, test_f1: 0.5686
 epoch: 47, train_loss: 0.4378, test_loss: 1.3850, test_f1: 0.5719
 epoch: 48, train_loss: 0.4274, test_loss: 1.2245, test_f1: 0.6169
 epoch: 49, train_loss: 0.4047, test_loss: 1.3705, test_f1: 0.5930
 epoch: 50, train_loss: 0.3960, test_loss: 1.2930, test_f1: 0.6117
 epoch: 51, train_loss: 0.3561, test_loss: 1.4182, test_f1: 0.5840
 epoch: 52, train_loss: 0.3493, test_loss: 1.2734, test_f1: 0.6107
 epoch: 53, train_loss: 0.3266, test_loss: 1.3946, test_f1: 0.6342
 epoch: 54, train_loss: 0.3188, test_loss: 1.3822, test_f1: 0.6071
 epoch: 55, train_loss: 0.3058, test_loss: 1.3205, test_f1: 0.6437
 epoch: 56, train_loss: 0.2945, test_loss: 1.5542, test_f1: 0.5796
 epoch: 57, train_loss: 0.2794, test_loss: 1.5765, test_f1: 0.5871
 epoch: 58, train_loss: 0.2711, test_loss: 1.4265, test_f1: 0.6067
 epoch: 59, train_loss: 0.2780, test_loss: 1.6216, test_f1: 0.6124
 epoch: 60, train_loss: 0.3212, test_loss: 1.7825, test_f1: 0.5908
 epoch: 61, train_loss: 0.2822, test_loss: 1.6917, test_f1: 0.6074
 epoch: 62, train_loss: 0.2658, test_loss: 1.6619, test_f1: 0.5891
 epoch: 63, train_loss: 0.2642, test_loss: 1.6749, test_f1: 0.5955
 epoch: 64, train_loss: 0.2609, test_loss: 1.5583, test_f1: 0.6527
 epoch: 65, train_loss: 0.2807, test_loss: 1.7034, test_f1: 0.5476
 epoch: 66, train_loss: 0.2564, test_loss: 1.6622, test_f1: 0.5858
 epoch: 67, train_loss: 0.2595, test_loss: 1.6572, test_f1: 0.5699
 epoch: 68, train_loss: 0.2521, test_loss: 1.8663, test_f1: 0.5648
 epoch: 69, train_loss: 0.2432, test_loss: 1.5731, test_f1: 0.6234
 epoch: 70, train_loss: 0.2585, test_loss: 1.7452, test_f1: 0.5797
 epoch: 71, train_loss: 0.2447, test_loss: 1.7398, test_f1: 0.5865
 epoch: 72, train_loss: 0.2304, test_loss: 1.7196, test_f1: 0.5901
 epoch: 73, train_loss: 0.2451, test_loss: 1.7729, test_f1: 0.6142
 epoch: 74, train_loss: 0.2216, test_loss: 1.6759, test_f1: 0.6366
 epoch: 75, train_loss: 0.1932, test_loss: 1.6529, test_f1: 0.6518
 epoch: 76, train_loss: 0.1968, test_loss: 1.7410, test_f1: 0.6275
 epoch: 77, train_loss: 0.2273, test_loss: 1.7605, test_f1: 0.5855
 epoch: 78, train_loss: 0.2058, test_loss: 1.7850, test_f1: 0.6308
 epoch: 79, train_loss: 0.1978, test_loss: 1.8079, test_f1: 0.6263
 epoch: 80, train_loss: 0.2076, test_loss: 1.9510, test_f1: 0.5993
 epoch: 81, train_loss: 0.2105, test_loss: 2.0642, test_f1: 0.6076
 epoch: 82, train_loss: 0.2063, test_loss: 2.2301, test_f1: 0.5835
 epoch: 83, train_loss: 0.2114, test_loss: 2.1010, test_f1: 0.5817
 epoch: 84, train_loss: 0.1969, test_loss: 2.1888, test_f1: 0.5575
 epoch: 85, train_loss: 0.2208, test_loss: 1.7580, test_f1: 0.6111
 epoch: 86, train_loss: 0.2277, test_loss: 1.7360, test_f1: 0.6585
 epoch: 87, train_loss: 0.2152, test_loss: 1.8511, test_f1: 0.6168
 epoch: 88, train_loss: 0.1998, test_loss: 1.7924, test_f1: 0.6413
 epoch: 89, train_loss: 0.1991, test_loss: 1.7467, test_f1: 0.6217
 epoch: 90, train_loss: 0.1953, test_loss: 1.8480, test_f1: 0.6224
 epoch: 91, train_loss: 0.1825, test_loss: 1.8615, test_f1: 0.6602
 epoch: 92, train_loss: 0.1665, test_loss: 1.9841, test_f1: 0.6050
 epoch: 93, train_loss: 0.1686, test_loss: 2.1627, test_f1: 0.6127
 epoch: 94, train_loss: 0.2144, test_loss: 2.0097, test_f1: 0.6425
 epoch: 95, train_loss: 0.1887, test_loss: 2.0308, test_f1: 0.6220
 epoch: 96, train_loss: 0.1573, test_loss: 1.8711, test_f1: 0.6372
 epoch: 97, train_loss: 0.1579, test_loss: 2.0110, test_f1: 0.6213
 epoch: 98, train_loss: 0.1632, test_loss: 2.0204, test_f1: 0.6371
 epoch: 99, train_loss: 0.1456, test_loss: 1.8575, test_f1: 0.6350
##################ITERATION #1 ****************************************
 epoch: 0, train_loss: 1.2355, test_loss: 1.3044, test_f1: 0.3017
 epoch: 1, train_loss: 1.0868, test_loss: 1.3169, test_f1: 0.3326
 epoch: 2, train_loss: 1.0055, test_loss: 1.3190, test_f1: 0.3674
 epoch: 3, train_loss: 0.9490, test_loss: 1.2829, test_f1: 0.3032
 epoch: 4, train_loss: 0.8952, test_loss: 1.1936, test_f1: 0.3853
 epoch: 5, train_loss: 0.8610, test_loss: 1.0408, test_f1: 0.5125
 epoch: 6, train_loss: 0.8277, test_loss: 1.0224, test_f1: 0.5321
 epoch: 7, train_loss: 0.8091, test_loss: 1.0079, test_f1: 0.5303
 epoch: 8, train_loss: 0.7664, test_loss: 1.0674, test_f1: 0.5076
 epoch: 9, train_loss: 0.7513, test_loss: 1.0371, test_f1: 0.5499
 epoch: 10, train_loss: 0.7267, test_loss: 1.0622, test_f1: 0.5278
 epoch: 11, train_loss: 0.6988, test_loss: 1.0499, test_f1: 0.5548
 epoch: 12, train_loss: 0.6967, test_loss: 1.0102, test_f1: 0.5520
 epoch: 13, train_loss: 0.6878, test_loss: 1.0866, test_f1: 0.5569
 epoch: 14, train_loss: 0.6727, test_loss: 1.0516, test_f1: 0.5722
 epoch: 15, train_loss: 0.6479, test_loss: 1.0160, test_f1: 0.5909
 epoch: 16, train_loss: 0.6531, test_loss: 1.0500, test_f1: 0.5756
 epoch: 17, train_loss: 0.6356, test_loss: 1.1865, test_f1: 0.5464
 epoch: 18, train_loss: 0.6513, test_loss: 1.2126, test_f1: 0.5576
 epoch: 19, train_loss: 0.6522, test_loss: 1.0989, test_f1: 0.5673
 epoch: 20, train_loss: 0.6315, test_loss: 1.1047, test_f1: 0.6105
 epoch: 21, train_loss: 0.6003, test_loss: 1.0637, test_f1: 0.6276
 epoch: 22, train_loss: 0.5789, test_loss: 1.1012, test_f1: 0.6219
 epoch: 23, train_loss: 0.5669, test_loss: 1.2177, test_f1: 0.6037
 epoch: 24, train_loss: 0.5395, test_loss: 1.2318, test_f1: 0.6184
 epoch: 25, train_loss: 0.5436, test_loss: 1.0927, test_f1: 0.6292
 epoch: 26, train_loss: 0.5449, test_loss: 1.2732, test_f1: 0.6002
 epoch: 27, train_loss: 0.5241, test_loss: 1.1783, test_f1: 0.5868
 epoch: 28, train_loss: 0.5159, test_loss: 1.1220, test_f1: 0.6073
 epoch: 29, train_loss: 0.5056, test_loss: 1.1157, test_f1: 0.6372
 epoch: 30, train_loss: 0.4729, test_loss: 1.2912, test_f1: 0.5851
 epoch: 31, train_loss: 0.4880, test_loss: 1.1652, test_f1: 0.6098
 epoch: 32, train_loss: 0.4565, test_loss: 1.1947, test_f1: 0.6196
 epoch: 33, train_loss: 0.4473, test_loss: 1.4126, test_f1: 0.6057
 epoch: 34, train_loss: 0.4348, test_loss: 1.3461, test_f1: 0.5834
 epoch: 35, train_loss: 0.4256, test_loss: 1.2210, test_f1: 0.5924
 epoch: 36, train_loss: 0.4205, test_loss: 1.1757, test_f1: 0.6451
 epoch: 37, train_loss: 0.4455, test_loss: 1.2893, test_f1: 0.5953
 epoch: 38, train_loss: 0.4330, test_loss: 1.5612, test_f1: 0.5924
 epoch: 39, train_loss: 0.4498, test_loss: 1.3922, test_f1: 0.5750
 epoch: 40, train_loss: 0.3826, test_loss: 1.4969, test_f1: 0.5741
 epoch: 41, train_loss: 0.4052, test_loss: 1.4388, test_f1: 0.6472
 epoch: 42, train_loss: 0.3811, test_loss: 1.2633, test_f1: 0.6309
 epoch: 43, train_loss: 0.3636, test_loss: 1.4948, test_f1: 0.6096
 epoch: 44, train_loss: 0.3639, test_loss: 1.5150, test_f1: 0.6000
 epoch: 45, train_loss: 0.3482, test_loss: 1.6088, test_f1: 0.6141
 epoch: 46, train_loss: 0.3497, test_loss: 1.5138, test_f1: 0.6072
 epoch: 47, train_loss: 0.3202, test_loss: 1.6984, test_f1: 0.6086
 epoch: 48, train_loss: 0.3212, test_loss: 1.9417, test_f1: 0.5760
 epoch: 49, train_loss: 0.3165, test_loss: 1.7438, test_f1: 0.6235
 epoch: 50, train_loss: 0.2865, test_loss: 1.7221, test_f1: 0.6095
 epoch: 51, train_loss: 0.2934, test_loss: 1.8596, test_f1: 0.5923
 epoch: 52, train_loss: 0.2510, test_loss: 1.8113, test_f1: 0.6016
 epoch: 53, train_loss: 0.2308, test_loss: 1.8348, test_f1: 0.6268
 epoch: 54, train_loss: 0.2169, test_loss: 1.9177, test_f1: 0.6006
 epoch: 55, train_loss: 0.2130, test_loss: 1.8642, test_f1: 0.6515
 epoch: 56, train_loss: 0.1946, test_loss: 2.0238, test_f1: 0.6048
 epoch: 57, train_loss: 0.1976, test_loss: 2.1866, test_f1: 0.6274
 epoch: 58, train_loss: 0.2060, test_loss: 2.2510, test_f1: 0.6032
 epoch: 59, train_loss: 0.2166, test_loss: 2.1657, test_f1: 0.6314
 epoch: 60, train_loss: 0.2170, test_loss: 1.9844, test_f1: 0.6023
 epoch: 61, train_loss: 0.1922, test_loss: 2.1709, test_f1: 0.6104
 epoch: 62, train_loss: 0.2072, test_loss: 2.1091, test_f1: 0.6358
 epoch: 63, train_loss: 0.1781, test_loss: 1.8880, test_f1: 0.6294
 epoch: 64, train_loss: 0.1741, test_loss: 2.1827, test_f1: 0.6342
 epoch: 65, train_loss: 0.1931, test_loss: 2.2970, test_f1: 0.6287
 epoch: 66, train_loss: 0.2015, test_loss: 2.2562, test_f1: 0.6103
 epoch: 67, train_loss: 0.1757, test_loss: 2.4631, test_f1: 0.5889
 epoch: 68, train_loss: 0.1812, test_loss: 2.4475, test_f1: 0.6413
 epoch: 69, train_loss: 0.1900, test_loss: 2.1661, test_f1: 0.6282
 epoch: 70, train_loss: 0.2089, test_loss: 2.2401, test_f1: 0.6413
 epoch: 71, train_loss: 0.1713, test_loss: 2.5192, test_f1: 0.6151
 epoch: 72, train_loss: 0.1605, test_loss: 2.0985, test_f1: 0.6391
 epoch: 73, train_loss: 0.1773, test_loss: 2.3912, test_f1: 0.6370
 epoch: 74, train_loss: 0.1944, test_loss: 2.2357, test_f1: 0.6425
 epoch: 75, train_loss: 0.1685, test_loss: 2.1037, test_f1: 0.6421
 epoch: 76, train_loss: 0.1538, test_loss: 2.1964, test_f1: 0.6208
 epoch: 77, train_loss: 0.1359, test_loss: 2.3468, test_f1: 0.6227
 epoch: 78, train_loss: 0.1519, test_loss: 2.4445, test_f1: 0.6169
 epoch: 79, train_loss: 0.1653, test_loss: 2.6780, test_f1: 0.6065
 epoch: 80, train_loss: 0.1674, test_loss: 2.5351, test_f1: 0.6507
 epoch: 81, train_loss: 0.1775, test_loss: 2.5203, test_f1: 0.5838
 epoch: 82, train_loss: 0.1688, test_loss: 2.5750, test_f1: 0.5882
 epoch: 83, train_loss: 0.1343, test_loss: 2.7179, test_f1: 0.5929
 epoch: 84, train_loss: 0.1297, test_loss: 2.6384, test_f1: 0.6378
 epoch: 85, train_loss: 0.1515, test_loss: 2.6577, test_f1: 0.5986
 epoch: 86, train_loss: 0.1259, test_loss: 2.5953, test_f1: 0.6388
 epoch: 87, train_loss: 0.1267, test_loss: 2.5737, test_f1: 0.6215
 epoch: 88, train_loss: 0.1272, test_loss: 2.6216, test_f1: 0.6397
 epoch: 89, train_loss: 0.1552, test_loss: 2.7601, test_f1: 0.6138
 epoch: 90, train_loss: 0.1180, test_loss: 2.6557, test_f1: 0.6510
 epoch: 91, train_loss: 0.1183, test_loss: 2.5248, test_f1: 0.5885
 epoch: 92, train_loss: 0.1316, test_loss: 2.6760, test_f1: 0.6096
 epoch: 93, train_loss: 0.1198, test_loss: 2.7655, test_f1: 0.6051
 epoch: 94, train_loss: 0.1178, test_loss: 2.8248, test_f1: 0.5856
 epoch: 95, train_loss: 0.1212, test_loss: 2.9817, test_f1: 0.6205
 epoch: 96, train_loss: 0.1224, test_loss: 3.0251, test_f1: 0.6204
 epoch: 97, train_loss: 0.1221, test_loss: 3.1024, test_f1: 0.6055
 epoch: 98, train_loss: 0.1267, test_loss: 3.1650, test_f1: 0.6031
 epoch: 99, train_loss: 0.1147, test_loss: 3.5338, test_f1: 0.6023
##################ITERATION #2 ****************************************
 epoch: 0, train_loss: 1.2341, test_loss: 1.3170, test_f1: 0.1987
 epoch: 1, train_loss: 1.0613, test_loss: 1.3580, test_f1: 0.1836
 epoch: 2, train_loss: 0.9764, test_loss: 1.3836, test_f1: 0.2751
 epoch: 3, train_loss: 0.9225, test_loss: 1.3579, test_f1: 0.2973
 epoch: 4, train_loss: 0.8875, test_loss: 1.0996, test_f1: 0.4967
 epoch: 5, train_loss: 0.8613, test_loss: 1.0517, test_f1: 0.5747
 epoch: 6, train_loss: 0.8221, test_loss: 1.0059, test_f1: 0.5717
 epoch: 7, train_loss: 0.8049, test_loss: 0.9484, test_f1: 0.6101
 epoch: 8, train_loss: 0.7771, test_loss: 0.9412, test_f1: 0.5638
 epoch: 9, train_loss: 0.7886, test_loss: 1.3550, test_f1: 0.4212
 epoch: 10, train_loss: 0.7564, test_loss: 1.0910, test_f1: 0.5127
 epoch: 11, train_loss: 0.7200, test_loss: 0.9736, test_f1: 0.6068
 epoch: 12, train_loss: 0.6992, test_loss: 1.0093, test_f1: 0.6037
 epoch: 13, train_loss: 0.6829, test_loss: 1.0746, test_f1: 0.5624
 epoch: 14, train_loss: 0.6588, test_loss: 0.9233, test_f1: 0.5667
 epoch: 15, train_loss: 0.6406, test_loss: 4.0008, test_f1: 0.3057
 epoch: 16, train_loss: 0.6365, test_loss: 1.0026, test_f1: 0.6075
 epoch: 17, train_loss: 0.5906, test_loss: 1.0740, test_f1: 0.5905
 epoch: 18, train_loss: 0.6227, test_loss: 1.0508, test_f1: 0.5913
 epoch: 19, train_loss: 0.5973, test_loss: 1.0670, test_f1: 0.6147
 epoch: 20, train_loss: 0.5786, test_loss: 1.0407, test_f1: 0.6231
 epoch: 21, train_loss: 0.5455, test_loss: 1.0984, test_f1: 0.5884
 epoch: 22, train_loss: 0.5357, test_loss: 1.0292, test_f1: 0.5856
 epoch: 23, train_loss: 0.5183, test_loss: 1.0520, test_f1: 0.5832
 epoch: 24, train_loss: 0.5076, test_loss: 1.1909, test_f1: 0.5896
 epoch: 25, train_loss: 0.5404, test_loss: 2.8282, test_f1: 0.3902
 epoch: 26, train_loss: 0.5112, test_loss: 1.1707, test_f1: 0.5762
 epoch: 27, train_loss: 0.4759, test_loss: 1.2986, test_f1: 0.5712
 epoch: 28, train_loss: 0.5108, test_loss: 1.3612, test_f1: 0.5827
 epoch: 29, train_loss: 0.4876, test_loss: 4.1395, test_f1: 0.3027
 epoch: 30, train_loss: 0.4821, test_loss: 1.4965, test_f1: 0.5575
 epoch: 31, train_loss: 0.4775, test_loss: 1.2548, test_f1: 0.6361
 epoch: 32, train_loss: 0.4311, test_loss: 1.2895, test_f1: 0.5806
 epoch: 33, train_loss: 0.3991, test_loss: 1.8722, test_f1: 0.4782
 epoch: 34, train_loss: 0.4041, test_loss: 1.4773, test_f1: 0.5738
 epoch: 35, train_loss: 0.4007, test_loss: 1.2973, test_f1: 0.6245
 epoch: 36, train_loss: 0.4409, test_loss: 3.5148, test_f1: 0.3451
 epoch: 37, train_loss: 0.4063, test_loss: 1.2744, test_f1: 0.6058
 epoch: 38, train_loss: 0.4348, test_loss: 1.4471, test_f1: 0.5712
 epoch: 39, train_loss: 0.3752, test_loss: 1.3437, test_f1: 0.6199
 epoch: 40, train_loss: 0.4115, test_loss: 1.8570, test_f1: 0.5345
 epoch: 41, train_loss: 0.4645, test_loss: 1.3847, test_f1: 0.5967
 epoch: 42, train_loss: 0.4364, test_loss: 1.3926, test_f1: 0.6132
 epoch: 43, train_loss: 0.3751, test_loss: 1.2862, test_f1: 0.6246
 epoch: 44, train_loss: 0.3980, test_loss: 1.5890, test_f1: 0.5959
 epoch: 45, train_loss: 0.3511, test_loss: 1.5026, test_f1: 0.6145
 epoch: 46, train_loss: 0.3850, test_loss: 1.3339, test_f1: 0.5823
 epoch: 47, train_loss: 0.3463, test_loss: 1.5143, test_f1: 0.6125
 epoch: 48, train_loss: 0.3800, test_loss: 1.6812, test_f1: 0.6047
 epoch: 49, train_loss: 0.4181, test_loss: 1.5410, test_f1: 0.6367
 epoch: 50, train_loss: 0.4144, test_loss: 1.7365, test_f1: 0.5367
 epoch: 51, train_loss: 0.3320, test_loss: 1.4654, test_f1: 0.5763
 epoch: 52, train_loss: 0.3318, test_loss: 1.6156, test_f1: 0.5945
 epoch: 53, train_loss: 0.2701, test_loss: 1.7022, test_f1: 0.5883
 epoch: 54, train_loss: 0.2687, test_loss: 1.6956, test_f1: 0.5872
 epoch: 55, train_loss: 0.2653, test_loss: 1.7216, test_f1: 0.5736
 epoch: 56, train_loss: 0.2412, test_loss: 1.7341, test_f1: 0.5902
 epoch: 57, train_loss: 0.2434, test_loss: 1.6692, test_f1: 0.5943
 epoch: 58, train_loss: 0.2264, test_loss: 1.8561, test_f1: 0.5975
 epoch: 59, train_loss: 0.2290, test_loss: 1.8236, test_f1: 0.5758
 epoch: 60, train_loss: 0.2246, test_loss: 1.8691, test_f1: 0.5772
 epoch: 61, train_loss: 0.2521, test_loss: 1.9395, test_f1: 0.6189
 epoch: 62, train_loss: 0.2237, test_loss: 1.8021, test_f1: 0.6102
 epoch: 63, train_loss: 0.2228, test_loss: 1.8294, test_f1: 0.5929
 epoch: 64, train_loss: 0.2288, test_loss: 2.0001, test_f1: 0.6238
 epoch: 65, train_loss: 0.2323, test_loss: 1.8124, test_f1: 0.5779
 epoch: 66, train_loss: 0.2259, test_loss: 1.9101, test_f1: 0.5914
 epoch: 67, train_loss: 0.2249, test_loss: 2.0197, test_f1: 0.5924
 epoch: 68, train_loss: 0.2184, test_loss: 2.0555, test_f1: 0.5909
 epoch: 69, train_loss: 0.1885, test_loss: 2.1541, test_f1: 0.5943
 epoch: 70, train_loss: 0.1927, test_loss: 2.3325, test_f1: 0.5733
 epoch: 71, train_loss: 0.1858, test_loss: 2.1251, test_f1: 0.5949
 epoch: 72, train_loss: 0.1907, test_loss: 2.1948, test_f1: 0.5893
 epoch: 73, train_loss: 0.1933, test_loss: 2.1308, test_f1: 0.5629
 epoch: 74, train_loss: 0.1952, test_loss: 2.0016, test_f1: 0.6066
 epoch: 75, train_loss: 0.2140, test_loss: 2.1273, test_f1: 0.5993
 epoch: 76, train_loss: 0.2493, test_loss: 2.0355, test_f1: 0.6025
 epoch: 77, train_loss: 0.1809, test_loss: 2.0620, test_f1: 0.6146
 epoch: 78, train_loss: 0.1787, test_loss: 1.9809, test_f1: 0.5855
 epoch: 79, train_loss: 0.2019, test_loss: 2.0075, test_f1: 0.6145
 epoch: 80, train_loss: 0.1816, test_loss: 2.2955, test_f1: 0.5871
 epoch: 81, train_loss: 0.1717, test_loss: 2.1856, test_f1: 0.6002
 epoch: 82, train_loss: 0.1573, test_loss: 2.2259, test_f1: 0.5807
 epoch: 83, train_loss: 0.1413, test_loss: 2.2082, test_f1: 0.6010
 epoch: 84, train_loss: 0.1382, test_loss: 2.2960, test_f1: 0.5907
 epoch: 85, train_loss: 0.1455, test_loss: 2.1795, test_f1: 0.5989
 epoch: 86, train_loss: 0.1347, test_loss: 2.2813, test_f1: 0.5658
 epoch: 87, train_loss: 0.1377, test_loss: 2.3700, test_f1: 0.5761
 epoch: 88, train_loss: 0.1471, test_loss: 2.5332, test_f1: 0.5774
 epoch: 89, train_loss: 0.2006, test_loss: 2.1907, test_f1: 0.6140
 epoch: 90, train_loss: 0.1865, test_loss: 2.2858, test_f1: 0.5749
 epoch: 91, train_loss: 0.1842, test_loss: 2.1643, test_f1: 0.6212
 epoch: 92, train_loss: 0.1715, test_loss: 2.2319, test_f1: 0.5603
 epoch: 93, train_loss: 0.1916, test_loss: 2.5208, test_f1: 0.5813
 epoch: 94, train_loss: 0.1404, test_loss: 2.5986, test_f1: 0.5747
 epoch: 95, train_loss: 0.1426, test_loss: 2.5590, test_f1: 0.5883
 epoch: 96, train_loss: 0.1367, test_loss: 2.6178, test_f1: 0.5860
 epoch: 97, train_loss: 0.1325, test_loss: 2.5472, test_f1: 0.5803
 epoch: 98, train_loss: 0.1356, test_loss: 2.6568, test_f1: 0.5801
 epoch: 99, train_loss: 0.1396, test_loss: 2.4264, test_f1: 0.5996
##################ITERATION #3 ****************************************
 epoch: 0, train_loss: 1.2231, test_loss: 1.3089, test_f1: 0.2976
 epoch: 1, train_loss: 1.0615, test_loss: 1.3637, test_f1: 0.2630
 epoch: 2, train_loss: 0.9931, test_loss: 1.3311, test_f1: 0.2733
 epoch: 3, train_loss: 0.9511, test_loss: 1.1921, test_f1: 0.4224
 epoch: 4, train_loss: 0.8961, test_loss: 1.0210, test_f1: 0.5829
 epoch: 5, train_loss: 0.8621, test_loss: 1.0058, test_f1: 0.5712
 epoch: 6, train_loss: 0.8567, test_loss: 0.9699, test_f1: 0.5932
 epoch: 7, train_loss: 0.8115, test_loss: 1.0086, test_f1: 0.5433
 epoch: 8, train_loss: 0.7801, test_loss: 0.9839, test_f1: 0.5850
 epoch: 9, train_loss: 0.7609, test_loss: 0.9724, test_f1: 0.6123
 epoch: 10, train_loss: 0.7405, test_loss: 0.9939, test_f1: 0.5590
 epoch: 11, train_loss: 0.7399, test_loss: 0.9938, test_f1: 0.5817
 epoch: 12, train_loss: 0.6929, test_loss: 1.0154, test_f1: 0.5907
 epoch: 13, train_loss: 0.6787, test_loss: 1.0148, test_f1: 0.5611
 epoch: 14, train_loss: 0.6766, test_loss: 0.9744, test_f1: 0.5919
 epoch: 15, train_loss: 0.6619, test_loss: 1.0971, test_f1: 0.5716
 epoch: 16, train_loss: 0.6429, test_loss: 1.0050, test_f1: 0.5790
 epoch: 17, train_loss: 0.6343, test_loss: 0.9675, test_f1: 0.6214
 epoch: 18, train_loss: 0.5907, test_loss: 1.0824, test_f1: 0.5511
 epoch: 19, train_loss: 0.6177, test_loss: 1.4499, test_f1: 0.5692
 epoch: 20, train_loss: 0.5777, test_loss: 1.1939, test_f1: 0.5459
 epoch: 21, train_loss: 0.5373, test_loss: 1.0549, test_f1: 0.6336
 epoch: 22, train_loss: 0.5158, test_loss: 1.1225, test_f1: 0.5871
 epoch: 23, train_loss: 0.5394, test_loss: 1.2177, test_f1: 0.5673
 epoch: 24, train_loss: 0.5168, test_loss: 1.2433, test_f1: 0.5914
 epoch: 25, train_loss: 0.5223, test_loss: 1.3758, test_f1: 0.5834
 epoch: 26, train_loss: 0.5037, test_loss: 1.2602, test_f1: 0.5731
 epoch: 27, train_loss: 0.4672, test_loss: 1.1620, test_f1: 0.5922
 epoch: 28, train_loss: 0.4659, test_loss: 1.3764, test_f1: 0.5826
 epoch: 29, train_loss: 0.4633, test_loss: 1.4287, test_f1: 0.5519
 epoch: 30, train_loss: 0.4699, test_loss: 1.4827, test_f1: 0.5915
 epoch: 31, train_loss: 0.4445, test_loss: 1.3651, test_f1: 0.5698
 epoch: 32, train_loss: 0.4266, test_loss: 1.2823, test_f1: 0.6148
 epoch: 33, train_loss: 0.4301, test_loss: 1.3243, test_f1: 0.6203
 epoch: 34, train_loss: 0.4085, test_loss: 1.6239, test_f1: 0.5552
 epoch: 35, train_loss: 0.4151, test_loss: 1.5765, test_f1: 0.5709
 epoch: 36, train_loss: 0.4232, test_loss: 1.2959, test_f1: 0.6242
 epoch: 37, train_loss: 0.4071, test_loss: 1.4409, test_f1: 0.5979
 epoch: 38, train_loss: 0.3631, test_loss: 1.5048, test_f1: 0.5664
 epoch: 39, train_loss: 0.3454, test_loss: 1.4611, test_f1: 0.6269
 epoch: 40, train_loss: 0.3759, test_loss: 1.6274, test_f1: 0.5980
 epoch: 41, train_loss: 0.3324, test_loss: 1.6220, test_f1: 0.5889
 epoch: 42, train_loss: 0.3508, test_loss: 1.6954, test_f1: 0.5665
 epoch: 43, train_loss: 0.3574, test_loss: 1.6259, test_f1: 0.5859
 epoch: 44, train_loss: 0.3538, test_loss: 1.6303, test_f1: 0.6082
 epoch: 45, train_loss: 0.3168, test_loss: 1.8797, test_f1: 0.5938
 epoch: 46, train_loss: 0.3152, test_loss: 1.6966, test_f1: 0.5737
 epoch: 47, train_loss: 0.3338, test_loss: 1.5049, test_f1: 0.6139
 epoch: 48, train_loss: 0.3371, test_loss: 1.4463, test_f1: 0.5999
 epoch: 49, train_loss: 0.3348, test_loss: 1.5313, test_f1: 0.6084
 epoch: 50, train_loss: 0.3038, test_loss: 1.8485, test_f1: 0.5376
 epoch: 51, train_loss: 0.2712, test_loss: 1.7826, test_f1: 0.5844
 epoch: 52, train_loss: 0.2494, test_loss: 1.7698, test_f1: 0.5779
 epoch: 53, train_loss: 0.2452, test_loss: 1.6483, test_f1: 0.5857
 epoch: 54, train_loss: 0.2266, test_loss: 1.7613, test_f1: 0.5694
 epoch: 55, train_loss: 0.2456, test_loss: 1.8310, test_f1: 0.5918
 epoch: 56, train_loss: 0.2122, test_loss: 1.7865, test_f1: 0.5941
 epoch: 57, train_loss: 0.2078, test_loss: 1.8812, test_f1: 0.5767
 epoch: 58, train_loss: 0.2038, test_loss: 1.8294, test_f1: 0.5806
 epoch: 59, train_loss: 0.1915, test_loss: 1.8749, test_f1: 0.5904
 epoch: 60, train_loss: 0.2021, test_loss: 1.8903, test_f1: 0.5883
 epoch: 61, train_loss: 0.1925, test_loss: 1.9858, test_f1: 0.5691
 epoch: 62, train_loss: 0.1842, test_loss: 1.9798, test_f1: 0.5588
 epoch: 63, train_loss: 0.1747, test_loss: 1.9223, test_f1: 0.5803
 epoch: 64, train_loss: 0.1930, test_loss: 1.9824, test_f1: 0.5744
 epoch: 65, train_loss: 0.1853, test_loss: 2.0916, test_f1: 0.5591
 epoch: 66, train_loss: 0.1671, test_loss: 2.1618, test_f1: 0.5808
 epoch: 67, train_loss: 0.1595, test_loss: 2.0738, test_f1: 0.5813
 epoch: 68, train_loss: 0.1851, test_loss: 2.0080, test_f1: 0.6048
 epoch: 69, train_loss: 0.1570, test_loss: 2.1830, test_f1: 0.5928
 epoch: 70, train_loss: 0.1853, test_loss: 2.1088, test_f1: 0.5636
 epoch: 71, train_loss: 0.1890, test_loss: 2.2160, test_f1: 0.5568
 epoch: 72, train_loss: 0.1706, test_loss: 2.1048, test_f1: 0.5734
 epoch: 73, train_loss: 0.1966, test_loss: 2.1111, test_f1: 0.5817
 epoch: 74, train_loss: 0.1951, test_loss: 2.1653, test_f1: 0.5681
 epoch: 75, train_loss: 0.2521, test_loss: 2.3463, test_f1: 0.5498
 epoch: 76, train_loss: 0.1884, test_loss: 2.0071, test_f1: 0.6087
 epoch: 77, train_loss: 0.1664, test_loss: 2.0752, test_f1: 0.5875
 epoch: 78, train_loss: 0.1667, test_loss: 2.0877, test_f1: 0.6139
 epoch: 79, train_loss: 0.1696, test_loss: 2.2066, test_f1: 0.5832
 epoch: 80, train_loss: 0.1671, test_loss: 2.2850, test_f1: 0.5595
 epoch: 81, train_loss: 0.1302, test_loss: 2.1954, test_f1: 0.5783
 epoch: 82, train_loss: 0.1549, test_loss: 2.2350, test_f1: 0.5882
 epoch: 83, train_loss: 0.1424, test_loss: 2.1602, test_f1: 0.5980
 epoch: 84, train_loss: 0.1385, test_loss: 2.3677, test_f1: 0.5653
 epoch: 85, train_loss: 0.1399, test_loss: 2.4331, test_f1: 0.5709
 epoch: 86, train_loss: 0.1231, test_loss: 2.2584, test_f1: 0.5977
 epoch: 87, train_loss: 0.1277, test_loss: 2.4272, test_f1: 0.5994
 epoch: 88, train_loss: 0.1229, test_loss: 2.2768, test_f1: 0.6286
 epoch: 89, train_loss: 0.1429, test_loss: 2.3531, test_f1: 0.5931
 epoch: 90, train_loss: 0.1366, test_loss: 2.4889, test_f1: 0.5792
 epoch: 91, train_loss: 0.1360, test_loss: 2.3277, test_f1: 0.5703
 epoch: 92, train_loss: 0.1182, test_loss: 2.5048, test_f1: 0.5902
 epoch: 93, train_loss: 0.1192, test_loss: 2.5393, test_f1: 0.5652
 epoch: 94, train_loss: 0.1046, test_loss: 2.5501, test_f1: 0.5640
 epoch: 95, train_loss: 0.1390, test_loss: 2.4986, test_f1: 0.5694
 epoch: 96, train_loss: 0.1120, test_loss: 2.5208, test_f1: 0.5828
 epoch: 97, train_loss: 0.1140, test_loss: 2.7190, test_f1: 0.5827
 epoch: 98, train_loss: 0.1365, test_loss: 2.5275, test_f1: 0.5632
 epoch: 99, train_loss: 0.1325, test_loss: 2.5711, test_f1: 0.5438
##################ITERATION #4 ****************************************
 epoch: 0, train_loss: 1.2686, test_loss: 1.3693, test_f1: 0.1513
 epoch: 1, train_loss: 1.0702, test_loss: 1.4092, test_f1: 0.1997
 epoch: 2, train_loss: 0.9790, test_loss: 1.4146, test_f1: 0.2931
 epoch: 3, train_loss: 0.9203, test_loss: 1.1653, test_f1: 0.4029
 epoch: 4, train_loss: 0.8824, test_loss: 1.0144, test_f1: 0.5347
 epoch: 5, train_loss: 0.8460, test_loss: 0.9928, test_f1: 0.5509
 epoch: 6, train_loss: 0.8095, test_loss: 1.0409, test_f1: 0.6032
 epoch: 7, train_loss: 0.7815, test_loss: 1.0731, test_f1: 0.5719
 epoch: 8, train_loss: 0.7424, test_loss: 0.9663, test_f1: 0.6076
 epoch: 9, train_loss: 0.7274, test_loss: 1.0243, test_f1: 0.5780
 epoch: 10, train_loss: 0.7084, test_loss: 1.0701, test_f1: 0.5511
 epoch: 11, train_loss: 0.7068, test_loss: 0.9974, test_f1: 0.6149
 epoch: 12, train_loss: 0.6771, test_loss: 1.0356, test_f1: 0.5904
 epoch: 13, train_loss: 0.6976, test_loss: 1.0409, test_f1: 0.5957
 epoch: 14, train_loss: 0.6637, test_loss: 1.0097, test_f1: 0.6104
 epoch: 15, train_loss: 0.6438, test_loss: 1.0553, test_f1: 0.6081
 epoch: 16, train_loss: 0.6503, test_loss: 1.1711, test_f1: 0.5915
 epoch: 17, train_loss: 0.6109, test_loss: 1.0957, test_f1: 0.5737
 epoch: 18, train_loss: 0.5863, test_loss: 1.1901, test_f1: 0.6114
 epoch: 19, train_loss: 0.6042, test_loss: 1.2928, test_f1: 0.5143
 epoch: 20, train_loss: 0.5924, test_loss: 1.2862, test_f1: 0.5587
 epoch: 21, train_loss: 0.5598, test_loss: 1.1343, test_f1: 0.5877
 epoch: 22, train_loss: 0.5702, test_loss: 1.1966, test_f1: 0.5908
 epoch: 23, train_loss: 0.5401, test_loss: 1.1964, test_f1: 0.5454
 epoch: 24, train_loss: 0.5211, test_loss: 1.1746, test_f1: 0.6278
 epoch: 25, train_loss: 0.5090, test_loss: 1.1930, test_f1: 0.5697
 epoch: 26, train_loss: 0.4832, test_loss: 1.5595, test_f1: 0.6139
 epoch: 27, train_loss: 0.4959, test_loss: 1.4793, test_f1: 0.5947
 epoch: 28, train_loss: 0.4620, test_loss: 1.6172, test_f1: 0.5082
 epoch: 29, train_loss: 0.4839, test_loss: 1.4463, test_f1: 0.5973
 epoch: 30, train_loss: 0.4855, test_loss: 1.3862, test_f1: 0.5743
 epoch: 31, train_loss: 0.4762, test_loss: 1.4955, test_f1: 0.5807
 epoch: 32, train_loss: 0.4452, test_loss: 1.3655, test_f1: 0.6060
 epoch: 33, train_loss: 0.4529, test_loss: 1.3044, test_f1: 0.5972
 epoch: 34, train_loss: 0.4468, test_loss: 1.5108, test_f1: 0.5908
 epoch: 35, train_loss: 0.4148, test_loss: 1.5346, test_f1: 0.5815
 epoch: 36, train_loss: 0.4141, test_loss: 1.4123, test_f1: 0.5785
 epoch: 37, train_loss: 0.4003, test_loss: 1.7102, test_f1: 0.6187
 epoch: 38, train_loss: 0.4211, test_loss: 1.4331, test_f1: 0.6223
 epoch: 39, train_loss: 0.4131, test_loss: 1.4396, test_f1: 0.6368
 epoch: 40, train_loss: 0.3892, test_loss: 1.6598, test_f1: 0.6163
 epoch: 41, train_loss: 0.3645, test_loss: 1.6050, test_f1: 0.6262
 epoch: 42, train_loss: 0.3544, test_loss: 1.6307, test_f1: 0.6471
 epoch: 43, train_loss: 0.3715, test_loss: 1.8500, test_f1: 0.5363
 epoch: 44, train_loss: 0.3523, test_loss: 1.4949, test_f1: 0.5890
 epoch: 45, train_loss: 0.3130, test_loss: 1.6356, test_f1: 0.6325
 epoch: 46, train_loss: 0.3381, test_loss: 1.5536, test_f1: 0.6191
 epoch: 47, train_loss: 0.3406, test_loss: 1.7299, test_f1: 0.6030
 epoch: 48, train_loss: 0.3226, test_loss: 1.6409, test_f1: 0.6089
 epoch: 49, train_loss: 0.3460, test_loss: 1.7516, test_f1: 0.5970
 epoch: 50, train_loss: 0.3562, test_loss: 1.7102, test_f1: 0.5839
 epoch: 51, train_loss: 0.3069, test_loss: 1.5929, test_f1: 0.6046
 epoch: 52, train_loss: 0.2686, test_loss: 1.6691, test_f1: 0.6268
 epoch: 53, train_loss: 0.2559, test_loss: 1.8348, test_f1: 0.6072
 epoch: 54, train_loss: 0.2289, test_loss: 1.7546, test_f1: 0.6106
 epoch: 55, train_loss: 0.2257, test_loss: 1.7847, test_f1: 0.6292
 epoch: 56, train_loss: 0.2208, test_loss: 1.8447, test_f1: 0.6045
 epoch: 57, train_loss: 0.2217, test_loss: 2.1124, test_f1: 0.6099
 epoch: 58, train_loss: 0.2107, test_loss: 2.0239, test_f1: 0.5999
 epoch: 59, train_loss: 0.2146, test_loss: 2.1499, test_f1: 0.5896
 epoch: 60, train_loss: 0.1915, test_loss: 1.8824, test_f1: 0.6009
 epoch: 61, train_loss: 0.2182, test_loss: 1.9747, test_f1: 0.5883
 epoch: 62, train_loss: 0.1959, test_loss: 1.9811, test_f1: 0.5853
 epoch: 63, train_loss: 0.2040, test_loss: 1.9697, test_f1: 0.5954
 epoch: 64, train_loss: 0.2151, test_loss: 2.1422, test_f1: 0.6068
 epoch: 65, train_loss: 0.2078, test_loss: 2.2420, test_f1: 0.6041
 epoch: 66, train_loss: 0.2177, test_loss: 1.9662, test_f1: 0.5983
 epoch: 67, train_loss: 0.2281, test_loss: 2.0624, test_f1: 0.6194
 epoch: 68, train_loss: 0.2463, test_loss: 1.8113, test_f1: 0.6012
 epoch: 69, train_loss: 0.2238, test_loss: 1.9865, test_f1: 0.5823
 epoch: 70, train_loss: 0.2060, test_loss: 2.0091, test_f1: 0.6155
 epoch: 71, train_loss: 0.1841, test_loss: 2.0323, test_f1: 0.6337
 epoch: 72, train_loss: 0.1864, test_loss: 2.2269, test_f1: 0.6213
 epoch: 73, train_loss: 0.1711, test_loss: 2.0600, test_f1: 0.5976
 epoch: 74, train_loss: 0.1742, test_loss: 2.0738, test_f1: 0.6093
 epoch: 75, train_loss: 0.1829, test_loss: 2.1453, test_f1: 0.6148
 epoch: 76, train_loss: 0.1754, test_loss: 2.2175, test_f1: 0.5922
 epoch: 77, train_loss: 0.1709, test_loss: 2.2256, test_f1: 0.5817
 epoch: 78, train_loss: 0.1580, test_loss: 2.4118, test_f1: 0.5821
 epoch: 79, train_loss: 0.1495, test_loss: 2.4711, test_f1: 0.6099
 epoch: 80, train_loss: 0.1609, test_loss: 2.0549, test_f1: 0.6098
 epoch: 81, train_loss: 0.1671, test_loss: 2.1403, test_f1: 0.5917
 epoch: 82, train_loss: 0.2015, test_loss: 2.4295, test_f1: 0.5943
 epoch: 83, train_loss: 0.1863, test_loss: 2.2615, test_f1: 0.5803
 epoch: 84, train_loss: 0.1793, test_loss: 2.2680, test_f1: 0.5772
 epoch: 85, train_loss: 0.1520, test_loss: 2.2594, test_f1: 0.6257
 epoch: 86, train_loss: 0.1523, test_loss: 2.1154, test_f1: 0.5939
 epoch: 87, train_loss: 0.1554, test_loss: 2.4102, test_f1: 0.6240
 epoch: 88, train_loss: 0.1415, test_loss: 2.4627, test_f1: 0.6018
 epoch: 89, train_loss: 0.1487, test_loss: 2.6554, test_f1: 0.5493
 epoch: 90, train_loss: 0.1863, test_loss: 2.6666, test_f1: 0.5756
 epoch: 91, train_loss: 0.1422, test_loss: 2.6549, test_f1: 0.5942
 epoch: 92, train_loss: 0.1678, test_loss: 2.3493, test_f1: 0.6168
 epoch: 93, train_loss: 0.1481, test_loss: 2.3603, test_f1: 0.6162
 epoch: 94, train_loss: 0.1435, test_loss: 2.2387, test_f1: 0.5929
 epoch: 95, train_loss: 0.1363, test_loss: 2.4263, test_f1: 0.5993
 epoch: 96, train_loss: 0.1458, test_loss: 2.8275, test_f1: 0.5757
 epoch: 97, train_loss: 0.1762, test_loss: 2.3099, test_f1: 0.6332
 epoch: 98, train_loss: 0.1550, test_loss: 2.3771, test_f1: 0.6061
 epoch: 99, train_loss: 0.1507, test_loss: 2.4590, test_f1: 0.6104
##################ITERATION #5 ****************************************
 epoch: 0, train_loss: 1.2517, test_loss: 1.3599, test_f1: 0.3155
 epoch: 1, train_loss: 1.0923, test_loss: 1.3685, test_f1: 0.3796
 epoch: 2, train_loss: 1.0043, test_loss: 1.2242, test_f1: 0.4711
 epoch: 3, train_loss: 0.9447, test_loss: 1.0592, test_f1: 0.5500
 epoch: 4, train_loss: 0.9205, test_loss: 1.0218, test_f1: 0.5438
 epoch: 5, train_loss: 0.8771, test_loss: 1.0157, test_f1: 0.5865
 epoch: 6, train_loss: 0.8402, test_loss: 1.0263, test_f1: 0.4722
 epoch: 7, train_loss: 0.8142, test_loss: 1.0174, test_f1: 0.5482
 epoch: 8, train_loss: 0.8022, test_loss: 1.0219, test_f1: 0.5332
 epoch: 9, train_loss: 0.7807, test_loss: 1.0018, test_f1: 0.5709
 epoch: 10, train_loss: 0.7781, test_loss: 1.0291, test_f1: 0.5544
 epoch: 11, train_loss: 0.7383, test_loss: 0.9799, test_f1: 0.5723
 epoch: 12, train_loss: 0.7393, test_loss: 1.0948, test_f1: 0.5264
 epoch: 13, train_loss: 0.7389, test_loss: 1.0368, test_f1: 0.4970
 epoch: 14, train_loss: 0.7224, test_loss: 1.0521, test_f1: 0.5413
 epoch: 15, train_loss: 0.6959, test_loss: 1.0205, test_f1: 0.5958
 epoch: 16, train_loss: 0.6775, test_loss: 1.0116, test_f1: 0.5591
 epoch: 17, train_loss: 0.6588, test_loss: 0.9972, test_f1: 0.5704
 epoch: 18, train_loss: 0.6475, test_loss: 1.0641, test_f1: 0.5231
 epoch: 19, train_loss: 0.6644, test_loss: 0.9729, test_f1: 0.6192
 epoch: 20, train_loss: 0.6416, test_loss: 1.0461, test_f1: 0.5970
 epoch: 21, train_loss: 0.6184, test_loss: 1.0322, test_f1: 0.5831
 epoch: 22, train_loss: 0.5974, test_loss: 0.9762, test_f1: 0.5869
 epoch: 23, train_loss: 0.5733, test_loss: 1.2181, test_f1: 0.5665
 epoch: 24, train_loss: 0.5768, test_loss: 1.1278, test_f1: 0.6429
 epoch: 25, train_loss: 0.5906, test_loss: 1.2135, test_f1: 0.5243
 epoch: 26, train_loss: 0.6179, test_loss: 1.2058, test_f1: 0.5560
 epoch: 27, train_loss: 0.6029, test_loss: 1.1297, test_f1: 0.5994
 epoch: 28, train_loss: 0.5846, test_loss: 1.2799, test_f1: 0.5722
 epoch: 29, train_loss: 0.5785, test_loss: 1.1918, test_f1: 0.5490
 epoch: 30, train_loss: 0.5464, test_loss: 1.1619, test_f1: 0.5292
 epoch: 31, train_loss: 0.5586, test_loss: 1.4821, test_f1: 0.5129
 epoch: 32, train_loss: 0.5377, test_loss: 1.2522, test_f1: 0.5915
 epoch: 33, train_loss: 0.5114, test_loss: 1.1470, test_f1: 0.5857
 epoch: 34, train_loss: 0.4956, test_loss: 1.3237, test_f1: 0.5376
 epoch: 35, train_loss: 0.5048, test_loss: 1.2533, test_f1: 0.6089
 epoch: 36, train_loss: 0.4400, test_loss: 1.3555, test_f1: 0.6026
 epoch: 37, train_loss: 0.4750, test_loss: 1.2068, test_f1: 0.6116
 epoch: 38, train_loss: 0.5045, test_loss: 1.3274, test_f1: 0.6472
 epoch: 39, train_loss: 0.4521, test_loss: 1.4609, test_f1: 0.5391
 epoch: 40, train_loss: 0.4317, test_loss: 1.1913, test_f1: 0.6389
 epoch: 41, train_loss: 0.4495, test_loss: 1.2927, test_f1: 0.5814
 epoch: 42, train_loss: 0.4410, test_loss: 1.4536, test_f1: 0.6243
 epoch: 43, train_loss: 0.4264, test_loss: 1.3883, test_f1: 0.6130
 epoch: 44, train_loss: 0.4288, test_loss: 1.4522, test_f1: 0.6078
 epoch: 45, train_loss: 0.4102, test_loss: 1.3779, test_f1: 0.6209
 epoch: 46, train_loss: 0.4332, test_loss: 1.3941, test_f1: 0.6181
 epoch: 47, train_loss: 0.4263, test_loss: 1.3365, test_f1: 0.6014
 epoch: 48, train_loss: 0.3885, test_loss: 1.4737, test_f1: 0.5480
 epoch: 49, train_loss: 0.4321, test_loss: 1.5540, test_f1: 0.5988
 epoch: 50, train_loss: 0.4107, test_loss: 1.7752, test_f1: 0.5894
 epoch: 51, train_loss: 0.3850, test_loss: 1.4169, test_f1: 0.6238
 epoch: 52, train_loss: 0.3240, test_loss: 1.3752, test_f1: 0.6429
 epoch: 53, train_loss: 0.3050, test_loss: 1.3707, test_f1: 0.6038
 epoch: 54, train_loss: 0.3001, test_loss: 1.5376, test_f1: 0.6223
 epoch: 55, train_loss: 0.2845, test_loss: 1.5137, test_f1: 0.6178
 epoch: 56, train_loss: 0.2839, test_loss: 1.5483, test_f1: 0.5933
 epoch: 57, train_loss: 0.2714, test_loss: 1.6079, test_f1: 0.5753
 epoch: 58, train_loss: 0.2542, test_loss: 1.6885, test_f1: 0.6062
 epoch: 59, train_loss: 0.2469, test_loss: 1.7624, test_f1: 0.6310
 epoch: 60, train_loss: 0.2388, test_loss: 1.7559, test_f1: 0.6324
 epoch: 61, train_loss: 0.2357, test_loss: 1.8729, test_f1: 0.6234
 epoch: 62, train_loss: 0.2526, test_loss: 1.8391, test_f1: 0.6113
 epoch: 63, train_loss: 0.2228, test_loss: 1.8965, test_f1: 0.5912
 epoch: 64, train_loss: 0.2299, test_loss: 1.9276, test_f1: 0.6218
 epoch: 65, train_loss: 0.2042, test_loss: 1.9667, test_f1: 0.6262
 epoch: 66, train_loss: 0.2084, test_loss: 1.8544, test_f1: 0.6035
 epoch: 67, train_loss: 0.2711, test_loss: 1.8943, test_f1: 0.6257
 epoch: 68, train_loss: 0.2424, test_loss: 1.8558, test_f1: 0.6082
 epoch: 69, train_loss: 0.2603, test_loss: 1.7870, test_f1: 0.5955
 epoch: 70, train_loss: 0.2463, test_loss: 1.8611, test_f1: 0.6325
 epoch: 71, train_loss: 0.2268, test_loss: 2.0460, test_f1: 0.5730
 epoch: 72, train_loss: 0.2276, test_loss: 2.0222, test_f1: 0.5840
 epoch: 73, train_loss: 0.2280, test_loss: 2.0211, test_f1: 0.5867
 epoch: 74, train_loss: 0.2266, test_loss: 2.0720, test_f1: 0.5785
 epoch: 75, train_loss: 0.1975, test_loss: 2.2646, test_f1: 0.5531
 epoch: 76, train_loss: 0.1877, test_loss: 2.2129, test_f1: 0.6038
 epoch: 77, train_loss: 0.2049, test_loss: 2.2827, test_f1: 0.6151
 epoch: 78, train_loss: 0.2015, test_loss: 2.1575, test_f1: 0.6163
 epoch: 79, train_loss: 0.1912, test_loss: 2.0607, test_f1: 0.5801
 epoch: 80, train_loss: 0.1844, test_loss: 2.1578, test_f1: 0.6293
 epoch: 81, train_loss: 0.1825, test_loss: 2.0856, test_f1: 0.6309
 epoch: 82, train_loss: 0.1539, test_loss: 2.3064, test_f1: 0.6113
 epoch: 83, train_loss: 0.1611, test_loss: 2.2021, test_f1: 0.6225
 epoch: 84, train_loss: 0.1855, test_loss: 2.1929, test_f1: 0.6086
 epoch: 85, train_loss: 0.1746, test_loss: 2.3551, test_f1: 0.6133
 epoch: 86, train_loss: 0.1897, test_loss: 2.4073, test_f1: 0.6054
 epoch: 87, train_loss: 0.1706, test_loss: 2.3612, test_f1: 0.6123
 epoch: 88, train_loss: 0.1751, test_loss: 2.2128, test_f1: 0.6208
 epoch: 89, train_loss: 0.1646, test_loss: 2.1434, test_f1: 0.6151
 epoch: 90, train_loss: 0.1647, test_loss: 2.3567, test_f1: 0.6034
 epoch: 91, train_loss: 0.2022, test_loss: 2.3165, test_f1: 0.5792
 epoch: 92, train_loss: 0.2075, test_loss: 2.3581, test_f1: 0.5930
 epoch: 93, train_loss: 0.2158, test_loss: 2.0122, test_f1: 0.6009
 epoch: 94, train_loss: 0.2115, test_loss: 2.5137, test_f1: 0.5896
 epoch: 95, train_loss: 0.1777, test_loss: 2.3462, test_f1: 0.6289
 epoch: 96, train_loss: 0.1749, test_loss: 2.4114, test_f1: 0.6103
 epoch: 97, train_loss: 0.1660, test_loss: 2.3070, test_f1: 0.6055
 epoch: 98, train_loss: 0.1708, test_loss: 2.4953, test_f1: 0.6043
 epoch: 99, train_loss: 0.1782, test_loss: 2.4807, test_f1: 0.5835
##################ITERATION #6 ****************************************
 epoch: 0, train_loss: 1.2400, test_loss: 1.3575, test_f1: 0.3013
 epoch: 1, train_loss: 1.0539, test_loss: 1.2920, test_f1: 0.2870
 epoch: 2, train_loss: 0.9507, test_loss: 1.1722, test_f1: 0.3821
 epoch: 3, train_loss: 0.9037, test_loss: 1.0642, test_f1: 0.4506
 epoch: 4, train_loss: 0.8973, test_loss: 1.0863, test_f1: 0.5321
 epoch: 5, train_loss: 0.8649, test_loss: 1.0132, test_f1: 0.5916
 epoch: 6, train_loss: 0.8401, test_loss: 1.0935, test_f1: 0.5584
 epoch: 7, train_loss: 0.8099, test_loss: 1.0390, test_f1: 0.5695
 epoch: 8, train_loss: 0.8013, test_loss: 1.1613, test_f1: 0.4914
 epoch: 9, train_loss: 0.7647, test_loss: 1.0326, test_f1: 0.5482
 epoch: 10, train_loss: 0.7278, test_loss: 1.1453, test_f1: 0.5120
 epoch: 11, train_loss: 0.7260, test_loss: 1.0816, test_f1: 0.5660
 epoch: 12, train_loss: 0.6797, test_loss: 1.0279, test_f1: 0.5721
 epoch: 13, train_loss: 0.6726, test_loss: 1.0814, test_f1: 0.5369
 epoch: 14, train_loss: 0.6875, test_loss: 1.0561, test_f1: 0.6174
 epoch: 15, train_loss: 0.6574, test_loss: 1.0431, test_f1: 0.5703
 epoch: 16, train_loss: 0.6276, test_loss: 1.2543, test_f1: 0.5290
 epoch: 17, train_loss: 0.6442, test_loss: 1.0966, test_f1: 0.5641
 epoch: 18, train_loss: 0.6082, test_loss: 1.2756, test_f1: 0.5423
 epoch: 19, train_loss: 0.6314, test_loss: 1.3710, test_f1: 0.5463
 epoch: 20, train_loss: 0.6608, test_loss: 1.3160, test_f1: 0.5132
 epoch: 21, train_loss: 0.6196, test_loss: 1.0771, test_f1: 0.5788
 epoch: 22, train_loss: 0.6308, test_loss: 1.2028, test_f1: 0.5475
 epoch: 23, train_loss: 0.5656, test_loss: 1.2673, test_f1: 0.5429
 epoch: 24, train_loss: 0.5712, test_loss: 1.1829, test_f1: 0.5834
 epoch: 25, train_loss: 0.5651, test_loss: 1.3430, test_f1: 0.5035
 epoch: 26, train_loss: 0.5965, test_loss: 1.5581, test_f1: 0.5287
 epoch: 27, train_loss: 0.5956, test_loss: 1.3714, test_f1: 0.5449
 epoch: 28, train_loss: 0.5802, test_loss: 1.4988, test_f1: 0.5221
 epoch: 29, train_loss: 0.5429, test_loss: 1.4546, test_f1: 0.5095
 epoch: 30, train_loss: 0.5409, test_loss: 1.3580, test_f1: 0.5260
 epoch: 31, train_loss: 0.5110, test_loss: 1.3585, test_f1: 0.5875
 epoch: 32, train_loss: 0.4877, test_loss: 1.5618, test_f1: 0.5119
 epoch: 33, train_loss: 0.5021, test_loss: 1.7022, test_f1: 0.4942
 epoch: 34, train_loss: 0.5019, test_loss: 1.4907, test_f1: 0.5323
 epoch: 35, train_loss: 0.4519, test_loss: 1.4885, test_f1: 0.5732
 epoch: 36, train_loss: 0.4893, test_loss: 1.7452, test_f1: 0.5417
 epoch: 37, train_loss: 0.4603, test_loss: 2.1772, test_f1: 0.5203
 epoch: 38, train_loss: 0.4322, test_loss: 1.7457, test_f1: 0.5544
 epoch: 39, train_loss: 0.4517, test_loss: 1.6701, test_f1: 0.5040
 epoch: 40, train_loss: 0.4267, test_loss: 1.8923, test_f1: 0.5341
 epoch: 41, train_loss: 0.4171, test_loss: 1.5659, test_f1: 0.5593
 epoch: 42, train_loss: 0.4141, test_loss: 1.9456, test_f1: 0.5345
 epoch: 43, train_loss: 0.4108, test_loss: 1.7726, test_f1: 0.5358
 epoch: 44, train_loss: 0.3796, test_loss: 1.8647, test_f1: 0.5292
 epoch: 45, train_loss: 0.3882, test_loss: 1.7801, test_f1: 0.5838
 epoch: 46, train_loss: 0.3819, test_loss: 1.8633, test_f1: 0.5656
 epoch: 47, train_loss: 0.3651, test_loss: 1.9652, test_f1: 0.5699
 epoch: 48, train_loss: 0.3450, test_loss: 1.6117, test_f1: 0.6001
 epoch: 49, train_loss: 0.3266, test_loss: 1.9937, test_f1: 0.5515
 epoch: 50, train_loss: 0.3478, test_loss: 1.8691, test_f1: 0.5602
 epoch: 51, train_loss: 0.3041, test_loss: 1.8176, test_f1: 0.5700
 epoch: 52, train_loss: 0.2828, test_loss: 1.7445, test_f1: 0.5996
 epoch: 53, train_loss: 0.2562, test_loss: 1.7642, test_f1: 0.5867
 epoch: 54, train_loss: 0.2462, test_loss: 1.9510, test_f1: 0.5618
 epoch: 55, train_loss: 0.2594, test_loss: 1.9607, test_f1: 0.5612
 epoch: 56, train_loss: 0.2464, test_loss: 1.9638, test_f1: 0.5902
 epoch: 57, train_loss: 0.2177, test_loss: 2.0722, test_f1: 0.5693
 epoch: 58, train_loss: 0.2060, test_loss: 2.2476, test_f1: 0.5792
 epoch: 59, train_loss: 0.2673, test_loss: 2.0675, test_f1: 0.5688
 epoch: 60, train_loss: 0.2026, test_loss: 2.1583, test_f1: 0.5415
 epoch: 61, train_loss: 0.2044, test_loss: 2.2133, test_f1: 0.5450
 epoch: 62, train_loss: 0.2304, test_loss: 2.2755, test_f1: 0.5314
 epoch: 63, train_loss: 0.2460, test_loss: 2.0860, test_f1: 0.5946
 epoch: 64, train_loss: 0.2271, test_loss: 2.1994, test_f1: 0.5546
 epoch: 65, train_loss: 0.2184, test_loss: 2.0975, test_f1: 0.5716
 epoch: 66, train_loss: 0.2147, test_loss: 2.3909, test_f1: 0.5367
 epoch: 67, train_loss: 0.2094, test_loss: 2.0704, test_f1: 0.5588
 epoch: 68, train_loss: 0.2212, test_loss: 1.9032, test_f1: 0.6147
 epoch: 69, train_loss: 0.2357, test_loss: 2.1161, test_f1: 0.6047
 epoch: 70, train_loss: 0.2133, test_loss: 2.3131, test_f1: 0.5435
 epoch: 71, train_loss: 0.2036, test_loss: 2.3069, test_f1: 0.5522
 epoch: 72, train_loss: 0.1791, test_loss: 2.3103, test_f1: 0.5542
 epoch: 73, train_loss: 0.1784, test_loss: 2.2628, test_f1: 0.6100
 epoch: 74, train_loss: 0.1696, test_loss: 2.2283, test_f1: 0.5982
 epoch: 75, train_loss: 0.1635, test_loss: 2.1374, test_f1: 0.5918
 epoch: 76, train_loss: 0.1662, test_loss: 2.3486, test_f1: 0.5897
 epoch: 77, train_loss: 0.1668, test_loss: 2.3595, test_f1: 0.5945
 epoch: 78, train_loss: 0.1801, test_loss: 2.3177, test_f1: 0.5571
 epoch: 79, train_loss: 0.1632, test_loss: 2.3381, test_f1: 0.5676
 epoch: 80, train_loss: 0.1521, test_loss: 2.1917, test_f1: 0.5724
 epoch: 81, train_loss: 0.1743, test_loss: 2.2979, test_f1: 0.5716
 epoch: 82, train_loss: 0.1871, test_loss: 2.3332, test_f1: 0.5926
 epoch: 83, train_loss: 0.1735, test_loss: 2.6103, test_f1: 0.5436
 epoch: 84, train_loss: 0.1697, test_loss: 2.3403, test_f1: 0.6055
 epoch: 85, train_loss: 0.1534, test_loss: 2.4837, test_f1: 0.5542
 epoch: 86, train_loss: 0.1709, test_loss: 2.3965, test_f1: 0.6043
 epoch: 87, train_loss: 0.1770, test_loss: 2.4608, test_f1: 0.5668
 epoch: 88, train_loss: 0.1339, test_loss: 2.5041, test_f1: 0.5586
 epoch: 89, train_loss: 0.1633, test_loss: 2.5766, test_f1: 0.5376
 epoch: 90, train_loss: 0.1706, test_loss: 2.3541, test_f1: 0.5658
 epoch: 91, train_loss: 0.1562, test_loss: 2.6033, test_f1: 0.5524
 epoch: 92, train_loss: 0.1237, test_loss: 2.4830, test_f1: 0.5669
 epoch: 93, train_loss: 0.1432, test_loss: 2.4848, test_f1: 0.5903
 epoch: 94, train_loss: 0.1712, test_loss: 2.4986, test_f1: 0.5534
 epoch: 95, train_loss: 0.1460, test_loss: 2.8297, test_f1: 0.5594
 epoch: 96, train_loss: 0.1269, test_loss: 2.5477, test_f1: 0.5635
 epoch: 97, train_loss: 0.1209, test_loss: 2.4801, test_f1: 0.5720
 epoch: 98, train_loss: 0.1490, test_loss: 2.4822, test_f1: 0.5869
 epoch: 99, train_loss: 0.1459, test_loss: 2.6179, test_f1: 0.5453
##################ITERATION #7 ****************************************
 epoch: 0, train_loss: 1.2946, test_loss: 1.3501, test_f1: 0.2979
 epoch: 1, train_loss: 1.1031, test_loss: 1.3594, test_f1: 0.2395
 epoch: 2, train_loss: 1.0059, test_loss: 1.2961, test_f1: 0.2512
 epoch: 3, train_loss: 0.9642, test_loss: 1.0975, test_f1: 0.4856
 epoch: 4, train_loss: 0.9215, test_loss: 1.1033, test_f1: 0.5257
 epoch: 5, train_loss: 0.8832, test_loss: 1.0691, test_f1: 0.5796
 epoch: 6, train_loss: 0.8550, test_loss: 1.1995, test_f1: 0.5753
 epoch: 7, train_loss: 0.8566, test_loss: 1.2324, test_f1: 0.5791
 epoch: 8, train_loss: 0.8104, test_loss: 1.2498, test_f1: 0.5193
 epoch: 9, train_loss: 0.7926, test_loss: 1.0196, test_f1: 0.5726
 epoch: 10, train_loss: 0.7796, test_loss: 1.0636, test_f1: 0.5853
 epoch: 11, train_loss: 0.7470, test_loss: 1.2305, test_f1: 0.5963
 epoch: 12, train_loss: 0.7291, test_loss: 1.0877, test_f1: 0.5744
 epoch: 13, train_loss: 0.7020, test_loss: 1.1159, test_f1: 0.6012
 epoch: 14, train_loss: 0.7110, test_loss: 1.2885, test_f1: 0.5654
 epoch: 15, train_loss: 0.7382, test_loss: 1.1758, test_f1: 0.6043
 epoch: 16, train_loss: 0.7359, test_loss: 1.1976, test_f1: 0.5640
 epoch: 17, train_loss: 0.7204, test_loss: 1.0737, test_f1: 0.5964
 epoch: 18, train_loss: 0.6779, test_loss: 1.0834, test_f1: 0.6147
 epoch: 19, train_loss: 0.6657, test_loss: 1.2953, test_f1: 0.5184
 epoch: 20, train_loss: 0.6669, test_loss: 1.1952, test_f1: 0.5483
 epoch: 21, train_loss: 0.6384, test_loss: 1.0783, test_f1: 0.6175
 epoch: 22, train_loss: 0.6559, test_loss: 1.2133, test_f1: 0.5476
 epoch: 23, train_loss: 0.6336, test_loss: 1.2258, test_f1: 0.5932
 epoch: 24, train_loss: 0.6117, test_loss: 1.2339, test_f1: 0.5608
 epoch: 25, train_loss: 0.6207, test_loss: 1.2041, test_f1: 0.5584
 epoch: 26, train_loss: 0.5765, test_loss: 1.1819, test_f1: 0.5926
 epoch: 27, train_loss: 0.5414, test_loss: 1.2407, test_f1: 0.5321
 epoch: 28, train_loss: 0.5454, test_loss: 1.2089, test_f1: 0.5936
 epoch: 29, train_loss: 0.5647, test_loss: 1.2215, test_f1: 0.5992
 epoch: 30, train_loss: 0.5298, test_loss: 1.4247, test_f1: 0.5992
 epoch: 31, train_loss: 0.5518, test_loss: 1.1237, test_f1: 0.6083
 epoch: 32, train_loss: 0.5253, test_loss: 1.1441, test_f1: 0.5786
 epoch: 33, train_loss: 0.5214, test_loss: 1.3163, test_f1: 0.6281
 epoch: 34, train_loss: 0.5171, test_loss: 1.6071, test_f1: 0.5295
 epoch: 35, train_loss: 0.5164, test_loss: 1.3861, test_f1: 0.5898
 epoch: 36, train_loss: 0.5248, test_loss: 1.4423, test_f1: 0.6010
 epoch: 37, train_loss: 0.5124, test_loss: 1.3042, test_f1: 0.5900
 epoch: 38, train_loss: 0.4935, test_loss: 1.2351, test_f1: 0.5809
 epoch: 39, train_loss: 0.4804, test_loss: 1.4293, test_f1: 0.5479
 epoch: 40, train_loss: 0.4519, test_loss: 1.3962, test_f1: 0.6190
 epoch: 41, train_loss: 0.4402, test_loss: 1.4795, test_f1: 0.6025
 epoch: 42, train_loss: 0.4237, test_loss: 1.4591, test_f1: 0.5641
 epoch: 43, train_loss: 0.4437, test_loss: 1.5238, test_f1: 0.5736
 epoch: 44, train_loss: 0.4158, test_loss: 1.3897, test_f1: 0.5938
 epoch: 45, train_loss: 0.3832, test_loss: 1.5564, test_f1: 0.6147
 epoch: 46, train_loss: 0.3889, test_loss: 1.5236, test_f1: 0.5962
 epoch: 47, train_loss: 0.3533, test_loss: 1.6882, test_f1: 0.6111
 epoch: 48, train_loss: 0.3541, test_loss: 1.5852, test_f1: 0.5783
 epoch: 49, train_loss: 0.3842, test_loss: 1.5461, test_f1: 0.5851
 epoch: 50, train_loss: 0.3691, test_loss: 1.6837, test_f1: 0.5697
 epoch: 51, train_loss: 0.3291, test_loss: 1.5218, test_f1: 0.6241
 epoch: 52, train_loss: 0.3009, test_loss: 1.5951, test_f1: 0.6129
 epoch: 53, train_loss: 0.2921, test_loss: 1.6067, test_f1: 0.5814
 epoch: 54, train_loss: 0.2931, test_loss: 1.6555, test_f1: 0.6187
 epoch: 55, train_loss: 0.2732, test_loss: 1.7611, test_f1: 0.5911
 epoch: 56, train_loss: 0.2792, test_loss: 1.8667, test_f1: 0.6203
 epoch: 57, train_loss: 0.2377, test_loss: 1.8449, test_f1: 0.6107
 epoch: 58, train_loss: 0.2677, test_loss: 1.7669, test_f1: 0.5995
 epoch: 59, train_loss: 0.2777, test_loss: 1.8031, test_f1: 0.6184
 epoch: 60, train_loss: 0.2605, test_loss: 1.5469, test_f1: 0.6205
 epoch: 61, train_loss: 0.2499, test_loss: 1.8907, test_f1: 0.6103
 epoch: 62, train_loss: 0.2412, test_loss: 1.7595, test_f1: 0.6383
 epoch: 63, train_loss: 0.2226, test_loss: 1.7543, test_f1: 0.5929
 epoch: 64, train_loss: 0.2003, test_loss: 1.8678, test_f1: 0.5986
 epoch: 65, train_loss: 0.2018, test_loss: 1.8828, test_f1: 0.6043
 epoch: 66, train_loss: 0.2108, test_loss: 1.9671, test_f1: 0.5925
 epoch: 67, train_loss: 0.2247, test_loss: 2.1193, test_f1: 0.5625
 epoch: 68, train_loss: 0.2295, test_loss: 2.1277, test_f1: 0.5667
 epoch: 69, train_loss: 0.2097, test_loss: 2.1244, test_f1: 0.5996
 epoch: 70, train_loss: 0.2037, test_loss: 2.0923, test_f1: 0.5775
 epoch: 71, train_loss: 0.2381, test_loss: 1.8443, test_f1: 0.6264
 epoch: 72, train_loss: 0.2554, test_loss: 1.9302, test_f1: 0.5971
 epoch: 73, train_loss: 0.1916, test_loss: 1.9278, test_f1: 0.6044
 epoch: 74, train_loss: 0.2000, test_loss: 2.1209, test_f1: 0.5948
 epoch: 75, train_loss: 0.2002, test_loss: 2.0479, test_f1: 0.6113
 epoch: 76, train_loss: 0.1980, test_loss: 2.1755, test_f1: 0.6134
 epoch: 77, train_loss: 0.1810, test_loss: 2.1766, test_f1: 0.5925
 epoch: 78, train_loss: 0.1767, test_loss: 2.1239, test_f1: 0.6018
 epoch: 79, train_loss: 0.1877, test_loss: 2.1680, test_f1: 0.6199
 epoch: 80, train_loss: 0.1706, test_loss: 2.0685, test_f1: 0.6311
 epoch: 81, train_loss: 0.2017, test_loss: 2.0183, test_f1: 0.5998
 epoch: 82, train_loss: 0.1637, test_loss: 2.3093, test_f1: 0.6266
 epoch: 83, train_loss: 0.1823, test_loss: 2.1670, test_f1: 0.6139
 epoch: 84, train_loss: 0.1762, test_loss: 2.1297, test_f1: 0.6328
 epoch: 85, train_loss: 0.1628, test_loss: 2.3308, test_f1: 0.5941
 epoch: 86, train_loss: 0.1701, test_loss: 2.3594, test_f1: 0.5926
 epoch: 87, train_loss: 0.1586, test_loss: 2.5765, test_f1: 0.6117
 epoch: 88, train_loss: 0.1992, test_loss: 2.5349, test_f1: 0.5936
 epoch: 89, train_loss: 0.2122, test_loss: 2.1211, test_f1: 0.6294
 epoch: 90, train_loss: 0.1702, test_loss: 2.2769, test_f1: 0.6137
 epoch: 91, train_loss: 0.1737, test_loss: 2.1090, test_f1: 0.6403
 epoch: 92, train_loss: 0.1481, test_loss: 2.2653, test_f1: 0.6043
 epoch: 93, train_loss: 0.1557, test_loss: 2.3111, test_f1: 0.6081
 epoch: 94, train_loss: 0.1815, test_loss: 2.4040, test_f1: 0.5875
 epoch: 95, train_loss: 0.1530, test_loss: 2.0460, test_f1: 0.6105
 epoch: 96, train_loss: 0.1544, test_loss: 2.2908, test_f1: 0.5893
 epoch: 97, train_loss: 0.1596, test_loss: 2.1593, test_f1: 0.6233
 epoch: 98, train_loss: 0.1466, test_loss: 2.1559, test_f1: 0.6205
 epoch: 99, train_loss: 0.1722, test_loss: 2.2342, test_f1: 0.6195
##################ITERATION #8 ****************************************
 epoch: 0, train_loss: 1.3357, test_loss: 1.3466, test_f1: 0.2687
 epoch: 1, train_loss: 1.0788, test_loss: 1.3257, test_f1: 0.2707
 epoch: 2, train_loss: 1.0183, test_loss: 1.3324, test_f1: 0.3560
 epoch: 3, train_loss: 0.9718, test_loss: 1.1602, test_f1: 0.4771
 epoch: 4, train_loss: 0.9074, test_loss: 1.1088, test_f1: 0.5122
 epoch: 5, train_loss: 0.8871, test_loss: 1.0388, test_f1: 0.5372
 epoch: 6, train_loss: 0.8568, test_loss: 1.0078, test_f1: 0.6257
 epoch: 7, train_loss: 0.8418, test_loss: 1.0390, test_f1: 0.5908
 epoch: 8, train_loss: 0.8226, test_loss: 1.0415, test_f1: 0.5652
 epoch: 9, train_loss: 0.7811, test_loss: 1.0441, test_f1: 0.5638
 epoch: 10, train_loss: 0.7861, test_loss: 1.0852, test_f1: 0.5475
 epoch: 11, train_loss: 0.7557, test_loss: 1.0654, test_f1: 0.5625
 epoch: 12, train_loss: 0.7364, test_loss: 1.1262, test_f1: 0.5540
 epoch: 13, train_loss: 0.7325, test_loss: 1.0791, test_f1: 0.5783
 epoch: 14, train_loss: 0.7160, test_loss: 1.1038, test_f1: 0.5924
 epoch: 15, train_loss: 0.7118, test_loss: 1.1002, test_f1: 0.5681
 epoch: 16, train_loss: 0.6950, test_loss: 1.0519, test_f1: 0.5587
 epoch: 17, train_loss: 0.6766, test_loss: 1.1136, test_f1: 0.5718
 epoch: 18, train_loss: 0.6401, test_loss: 1.1324, test_f1: 0.5579
 epoch: 19, train_loss: 0.6536, test_loss: 1.0395, test_f1: 0.6447
 epoch: 20, train_loss: 0.6230, test_loss: 1.0196, test_f1: 0.6377
 epoch: 21, train_loss: 0.6033, test_loss: 1.2387, test_f1: 0.5909
 epoch: 22, train_loss: 0.6025, test_loss: 1.1968, test_f1: 0.5785
 epoch: 23, train_loss: 0.5880, test_loss: 1.2272, test_f1: 0.5992
 epoch: 24, train_loss: 0.6003, test_loss: 1.1474, test_f1: 0.5840
 epoch: 25, train_loss: 0.5822, test_loss: 1.0794, test_f1: 0.6242
 epoch: 26, train_loss: 0.5832, test_loss: 1.2187, test_f1: 0.5939
 epoch: 27, train_loss: 0.5791, test_loss: 1.7223, test_f1: 0.4774
 epoch: 28, train_loss: 0.5961, test_loss: 1.4289, test_f1: 0.4836
 epoch: 29, train_loss: 0.5811, test_loss: 1.2583, test_f1: 0.6132
 epoch: 30, train_loss: 0.5366, test_loss: 1.2453, test_f1: 0.6132
 epoch: 31, train_loss: 0.5291, test_loss: 1.2917, test_f1: 0.5980
 epoch: 32, train_loss: 0.4988, test_loss: 1.2841, test_f1: 0.6184
 epoch: 33, train_loss: 0.4612, test_loss: 1.4139, test_f1: 0.5716
 epoch: 34, train_loss: 0.4823, test_loss: 1.3961, test_f1: 0.5818
 epoch: 35, train_loss: 0.5080, test_loss: 1.3667, test_f1: 0.5903
 epoch: 36, train_loss: 0.4626, test_loss: 1.4290, test_f1: 0.5679
 epoch: 37, train_loss: 0.4841, test_loss: 1.2910, test_f1: 0.6136
 epoch: 38, train_loss: 0.4530, test_loss: 1.3622, test_f1: 0.6252
 epoch: 39, train_loss: 0.4554, test_loss: 1.3891, test_f1: 0.6377
 epoch: 40, train_loss: 0.4575, test_loss: 1.4288, test_f1: 0.5866
 epoch: 41, train_loss: 0.4688, test_loss: 1.3041, test_f1: 0.6256
 epoch: 42, train_loss: 0.4109, test_loss: 1.2682, test_f1: 0.6306
 epoch: 43, train_loss: 0.4546, test_loss: 1.4894, test_f1: 0.6156
 epoch: 44, train_loss: 0.4059, test_loss: 1.4646, test_f1: 0.6121
 epoch: 45, train_loss: 0.3923, test_loss: 1.5741, test_f1: 0.5614
 epoch: 46, train_loss: 0.3943, test_loss: 1.4164, test_f1: 0.6271
 epoch: 47, train_loss: 0.3772, test_loss: 1.6191, test_f1: 0.6017
 epoch: 48, train_loss: 0.3998, test_loss: 1.4675, test_f1: 0.6388
 epoch: 49, train_loss: 0.3833, test_loss: 1.3533, test_f1: 0.6795
 epoch: 50, train_loss: 0.3850, test_loss: 1.4901, test_f1: 0.6476
 epoch: 51, train_loss: 0.3363, test_loss: 1.4842, test_f1: 0.6397
 epoch: 52, train_loss: 0.3364, test_loss: 1.5877, test_f1: 0.6144
 epoch: 53, train_loss: 0.2886, test_loss: 1.7110, test_f1: 0.6010
 epoch: 54, train_loss: 0.2606, test_loss: 1.7131, test_f1: 0.6090
 epoch: 55, train_loss: 0.2811, test_loss: 1.6477, test_f1: 0.6105
 epoch: 56, train_loss: 0.2787, test_loss: 1.7466, test_f1: 0.6030
 epoch: 57, train_loss: 0.2604, test_loss: 1.8137, test_f1: 0.6124
 epoch: 58, train_loss: 0.2531, test_loss: 1.9200, test_f1: 0.5523
 epoch: 59, train_loss: 0.2554, test_loss: 1.6841, test_f1: 0.6449
 epoch: 60, train_loss: 0.2550, test_loss: 1.7632, test_f1: 0.6156
 epoch: 61, train_loss: 0.2846, test_loss: 1.7945, test_f1: 0.6160
 epoch: 62, train_loss: 0.2680, test_loss: 1.6822, test_f1: 0.6237
 epoch: 63, train_loss: 0.2653, test_loss: 1.7690, test_f1: 0.6258
 epoch: 64, train_loss: 0.2603, test_loss: 1.7416, test_f1: 0.6135
 epoch: 65, train_loss: 0.2602, test_loss: 1.8550, test_f1: 0.6245
 epoch: 66, train_loss: 0.2411, test_loss: 1.9115, test_f1: 0.6011
 epoch: 67, train_loss: 0.2340, test_loss: 1.7409, test_f1: 0.6310
 epoch: 68, train_loss: 0.2161, test_loss: 1.8076, test_f1: 0.6398
 epoch: 69, train_loss: 0.2341, test_loss: 1.8783, test_f1: 0.6036
 epoch: 70, train_loss: 0.2234, test_loss: 1.8645, test_f1: 0.6239
 epoch: 71, train_loss: 0.2183, test_loss: 1.8650, test_f1: 0.6200
 epoch: 72, train_loss: 0.2551, test_loss: 1.8116, test_f1: 0.6378
 epoch: 73, train_loss: 0.2102, test_loss: 1.7373, test_f1: 0.6489
 epoch: 74, train_loss: 0.2136, test_loss: 1.9367, test_f1: 0.6064
 epoch: 75, train_loss: 0.2228, test_loss: 1.6639, test_f1: 0.6215
 epoch: 76, train_loss: 0.2347, test_loss: 2.3427, test_f1: 0.6058
 epoch: 77, train_loss: 0.2390, test_loss: 1.8098, test_f1: 0.5971
 epoch: 78, train_loss: 0.2311, test_loss: 2.0592, test_f1: 0.5851
 epoch: 79, train_loss: 0.2209, test_loss: 2.0269, test_f1: 0.6435
 epoch: 80, train_loss: 0.1941, test_loss: 2.0304, test_f1: 0.6088
 epoch: 81, train_loss: 0.1922, test_loss: 2.1586, test_f1: 0.5976
 epoch: 82, train_loss: 0.1976, test_loss: 2.0837, test_f1: 0.5934
 epoch: 83, train_loss: 0.1740, test_loss: 1.9688, test_f1: 0.6159
 epoch: 84, train_loss: 0.1754, test_loss: 2.0165, test_f1: 0.6180
 epoch: 85, train_loss: 0.1713, test_loss: 2.0694, test_f1: 0.6070
 epoch: 86, train_loss: 0.1834, test_loss: 2.0593, test_f1: 0.6424
 epoch: 87, train_loss: 0.2012, test_loss: 1.9992, test_f1: 0.6134
 epoch: 88, train_loss: 0.1844, test_loss: 2.1947, test_f1: 0.6096
 epoch: 89, train_loss: 0.1700, test_loss: 2.1032, test_f1: 0.6327
 epoch: 90, train_loss: 0.1668, test_loss: 1.9702, test_f1: 0.6599
 epoch: 91, train_loss: 0.1858, test_loss: 2.1502, test_f1: 0.6362
 epoch: 92, train_loss: 0.1594, test_loss: 2.1991, test_f1: 0.5824
 epoch: 93, train_loss: 0.1695, test_loss: 2.2690, test_f1: 0.5938
 epoch: 94, train_loss: 0.2025, test_loss: 2.0809, test_f1: 0.6358
 epoch: 95, train_loss: 0.1662, test_loss: 2.2367, test_f1: 0.6032
 epoch: 96, train_loss: 0.1896, test_loss: 2.2360, test_f1: 0.6381
 epoch: 97, train_loss: 0.1505, test_loss: 2.2258, test_f1: 0.6040
 epoch: 98, train_loss: 0.1643, test_loss: 2.0171, test_f1: 0.6425
 epoch: 99, train_loss: 0.1567, test_loss: 2.0514, test_f1: 0.6366
##################ITERATION #9 ****************************************
 epoch: 0, train_loss: 1.3537, test_loss: 1.4260, test_f1: 0.1365
 epoch: 1, train_loss: 1.1238, test_loss: 1.3168, test_f1: 0.3019
 epoch: 2, train_loss: 1.0735, test_loss: 1.2111, test_f1: 0.4120
 epoch: 3, train_loss: 0.9683, test_loss: 1.1827, test_f1: 0.4342
 epoch: 4, train_loss: 0.9243, test_loss: 1.0975, test_f1: 0.5377
 epoch: 5, train_loss: 0.8826, test_loss: 1.1122, test_f1: 0.5163
 epoch: 6, train_loss: 0.8617, test_loss: 1.0447, test_f1: 0.5526
 epoch: 7, train_loss: 0.8195, test_loss: 1.0714, test_f1: 0.4901
 epoch: 8, train_loss: 0.8240, test_loss: 1.0229, test_f1: 0.5732
 epoch: 9, train_loss: 0.8124, test_loss: 1.0780, test_f1: 0.5504
 epoch: 10, train_loss: 0.7886, test_loss: 1.0394, test_f1: 0.5421
 epoch: 11, train_loss: 0.7432, test_loss: 1.1012, test_f1: 0.4923
 epoch: 12, train_loss: 0.7346, test_loss: 1.1537, test_f1: 0.4944
 epoch: 13, train_loss: 0.7291, test_loss: 1.0918, test_f1: 0.5587
 epoch: 14, train_loss: 0.6950, test_loss: 1.1734, test_f1: 0.5811
 epoch: 15, train_loss: 0.6811, test_loss: 1.3399, test_f1: 0.4926
 epoch: 16, train_loss: 0.6857, test_loss: 1.0802, test_f1: 0.5423
 epoch: 17, train_loss: 0.6875, test_loss: 1.0919, test_f1: 0.5684
 epoch: 18, train_loss: 0.6360, test_loss: 1.1236, test_f1: 0.5322
 epoch: 19, train_loss: 0.6655, test_loss: 1.0097, test_f1: 0.6292
 epoch: 20, train_loss: 0.5867, test_loss: 1.1750, test_f1: 0.5743
 epoch: 21, train_loss: 0.6041, test_loss: 1.3646, test_f1: 0.5367
 epoch: 22, train_loss: 0.6164, test_loss: 1.2774, test_f1: 0.5305
 epoch: 23, train_loss: 0.5856, test_loss: 1.1854, test_f1: 0.5897
 epoch: 24, train_loss: 0.5686, test_loss: 1.2276, test_f1: 0.6013
 epoch: 25, train_loss: 0.5624, test_loss: 1.2628, test_f1: 0.5908
 epoch: 26, train_loss: 0.5449, test_loss: 1.1265, test_f1: 0.6241
 epoch: 27, train_loss: 0.5415, test_loss: 1.2539, test_f1: 0.5854
 epoch: 28, train_loss: 0.5559, test_loss: 1.1842, test_f1: 0.5912
 epoch: 29, train_loss: 0.5098, test_loss: 1.3831, test_f1: 0.5838
 epoch: 30, train_loss: 0.5454, test_loss: 1.2920, test_f1: 0.5888
 epoch: 31, train_loss: 0.5134, test_loss: 1.2261, test_f1: 0.5905
 epoch: 32, train_loss: 0.5231, test_loss: 1.4073, test_f1: 0.5490
 epoch: 33, train_loss: 0.4717, test_loss: 1.3475, test_f1: 0.5811
 epoch: 34, train_loss: 0.4731, test_loss: 1.1797, test_f1: 0.6385
 epoch: 35, train_loss: 0.4683, test_loss: 1.3337, test_f1: 0.6277
 epoch: 36, train_loss: 0.4576, test_loss: 1.3497, test_f1: 0.5985
 epoch: 37, train_loss: 0.4455, test_loss: 1.2313, test_f1: 0.6153
 epoch: 38, train_loss: 0.4453, test_loss: 1.2197, test_f1: 0.6355
 epoch: 39, train_loss: 0.4283, test_loss: 1.3415, test_f1: 0.6028
 epoch: 40, train_loss: 0.4297, test_loss: 1.3863, test_f1: 0.5867
 epoch: 41, train_loss: 0.4454, test_loss: 1.3256, test_f1: 0.6254
 epoch: 42, train_loss: 0.4351, test_loss: 1.4918, test_f1: 0.5780
 epoch: 43, train_loss: 0.4397, test_loss: 1.5387, test_f1: 0.6428
 epoch: 44, train_loss: 0.4370, test_loss: 1.3549, test_f1: 0.6056
 epoch: 45, train_loss: 0.4378, test_loss: 1.3700, test_f1: 0.6056
 epoch: 46, train_loss: 0.4253, test_loss: 1.3227, test_f1: 0.6406
 epoch: 47, train_loss: 0.4010, test_loss: 1.3670, test_f1: 0.6220
 epoch: 48, train_loss: 0.3640, test_loss: 1.5093, test_f1: 0.6072
 epoch: 49, train_loss: 0.3467, test_loss: 1.5883, test_f1: 0.6183
 epoch: 50, train_loss: 0.3261, test_loss: 1.4152, test_f1: 0.6427
 epoch: 51, train_loss: 0.3011, test_loss: 1.5951, test_f1: 0.6306
 epoch: 52, train_loss: 0.3033, test_loss: 1.5646, test_f1: 0.6458
 epoch: 53, train_loss: 0.3060, test_loss: 1.7229, test_f1: 0.6395
 epoch: 54, train_loss: 0.2854, test_loss: 1.6910, test_f1: 0.6404
 epoch: 55, train_loss: 0.2629, test_loss: 1.6047, test_f1: 0.6464
 epoch: 56, train_loss: 0.2625, test_loss: 1.4659, test_f1: 0.6481
 epoch: 57, train_loss: 0.2700, test_loss: 1.7167, test_f1: 0.6188
 epoch: 58, train_loss: 0.2491, test_loss: 1.6105, test_f1: 0.6174
 epoch: 59, train_loss: 0.2515, test_loss: 1.6011, test_f1: 0.6292
 epoch: 60, train_loss: 0.2461, test_loss: 1.8648, test_f1: 0.6143
 epoch: 61, train_loss: 0.2477, test_loss: 1.8779, test_f1: 0.6289
 epoch: 62, train_loss: 0.2481, test_loss: 1.6562, test_f1: 0.6361
 epoch: 63, train_loss: 0.2314, test_loss: 1.7100, test_f1: 0.6467
 epoch: 64, train_loss: 0.2295, test_loss: 1.6418, test_f1: 0.6210
 epoch: 65, train_loss: 0.2460, test_loss: 1.6714, test_f1: 0.6334
 epoch: 66, train_loss: 0.2507, test_loss: 1.7516, test_f1: 0.6070
 epoch: 67, train_loss: 0.2197, test_loss: 1.6868, test_f1: 0.6600
 epoch: 68, train_loss: 0.2322, test_loss: 1.8179, test_f1: 0.6376
 epoch: 69, train_loss: 0.2361, test_loss: 1.7668, test_f1: 0.6531
 epoch: 70, train_loss: 0.2214, test_loss: 1.9048, test_f1: 0.6193
 epoch: 71, train_loss: 0.2073, test_loss: 1.7047, test_f1: 0.6477
 epoch: 72, train_loss: 0.2130, test_loss: 1.6634, test_f1: 0.6285
 epoch: 73, train_loss: 0.2139, test_loss: 1.9269, test_f1: 0.6507
 epoch: 74, train_loss: 0.2029, test_loss: 1.8303, test_f1: 0.6474
 epoch: 75, train_loss: 0.2289, test_loss: 1.8498, test_f1: 0.6420
 epoch: 76, train_loss: 0.2274, test_loss: 1.9691, test_f1: 0.6275
 epoch: 77, train_loss: 0.1888, test_loss: 1.9669, test_f1: 0.6514
 epoch: 78, train_loss: 0.1729, test_loss: 1.8586, test_f1: 0.6421
 epoch: 79, train_loss: 0.1866, test_loss: 1.9517, test_f1: 0.6205
 epoch: 80, train_loss: 0.1795, test_loss: 2.0154, test_f1: 0.6402
 epoch: 81, train_loss: 0.2162, test_loss: 1.9893, test_f1: 0.6211
 epoch: 82, train_loss: 0.2072, test_loss: 2.1418, test_f1: 0.6179
 epoch: 83, train_loss: 0.2438, test_loss: 1.9502, test_f1: 0.6405
 epoch: 84, train_loss: 0.1957, test_loss: 1.8154, test_f1: 0.6573
 epoch: 85, train_loss: 0.1806, test_loss: 1.9855, test_f1: 0.6377
 epoch: 86, train_loss: 0.1752, test_loss: 1.8979, test_f1: 0.6458
 epoch: 87, train_loss: 0.1758, test_loss: 1.9279, test_f1: 0.6261
 epoch: 88, train_loss: 0.1836, test_loss: 1.8853, test_f1: 0.6097
 epoch: 89, train_loss: 0.1808, test_loss: 1.9675, test_f1: 0.6311
 epoch: 90, train_loss: 0.1603, test_loss: 1.9324, test_f1: 0.6230
 epoch: 91, train_loss: 0.1798, test_loss: 1.9677, test_f1: 0.6498
 epoch: 92, train_loss: 0.1681, test_loss: 2.0930, test_f1: 0.6074
 epoch: 93, train_loss: 0.2007, test_loss: 2.2356, test_f1: 0.6078
 epoch: 94, train_loss: 0.1748, test_loss: 2.0928, test_f1: 0.6124
 epoch: 95, train_loss: 0.1609, test_loss: 2.0370, test_f1: 0.6337
 epoch: 96, train_loss: 0.1675, test_loss: 2.0795, test_f1: 0.6237
 epoch: 97, train_loss: 0.1780, test_loss: 2.2411, test_f1: 0.6004
 epoch: 98, train_loss: 0.1977, test_loss: 2.1060, test_f1: 0.5984
 epoch: 99, train_loss: 0.1988, test_loss: 2.0257, test_f1: 0.6314

Training completed in 514.60 seconds
Best F1: 0.6795 at epoch 49
Mean F1 across iterations: 0.6474  0.0162
========================FINAL RESULTS================================
FEGIN weighted F1: 0.6795  0.0162
python main.py --data ltspice_demos --representation component_pin --model FEGIN --layers 5 --hiddens 64 --batch_size 128 --lr 0.001 --emb_size 250 --epochs 100 --save_appendix component_pin_L5_H64_BS128_LR0.001_E250 --no_val
-----



STDERR:
  File "main.py", line 370, in <module>
    main()
  File "main.py", line 254, in main
    dataset = dataset_class(
  File "/home/philip/projects/ltspice_examples_code_repo/Circuit-Completion-Using-GNNs/component_classification_with_link_prediction_head/evaluation/FEGIN/kernel/circuit_datasets.py", line 15, in __init__
    self.data, self.slices = torch.load(self.processed_paths[0])
  File "/home/philip/.local/lib/python3.8/site-packages/torch/serialization.py", line 1040, in load
    warnings.warn(
  File "/usr/lib/python3.8/warnings.py", line 109, in _showwarnmsg
    sw(msg.message, msg.category, msg.filename, msg.lineno,
  File "main.py", line 47, in warn_with_traceback
    traceback.print_stack(file=log)
/home/philip/projects/ltspice_examples_code_repo/Circuit-Completion-Using-GNNs/component_classification_with_link_prediction_head/evaluation/FEGIN/kernel/circuit_datasets.py:15: FutureWarning: You are using `torch.load` with `weights_only=False` (the current default value), which uses the default pickle module implicitly. It is possible to construct malicious pickle data which will execute arbitrary code during unpickling (See https://github.com/pytorch/pytorch/blob/main/SECURITY.md#untrusted-models for more details). In a future release, the default value for `weights_only` will be flipped to `True`. This limits the functions that could be executed during unpickling. Arbitrary objects will no longer be allowed to be loaded via this mode unless they are explicitly allowlisted by the user via `torch.serialization.add_safe_globals`. We recommend you start setting `weights_only=True` for any use case where you don't have full control of the loaded file. Please open an issue on GitHub for any issues related to this experimental feature.
  self.data, self.slices = torch.load(self.processed_paths[0])
