STDOUT:
Results will be saved in /home/philip/projects/ltspice_examples_code_repo/Circuit-Completion-Using-GNNs/component_classification_with_link_prediction_head/evaluation/FEGIN/results/model_FEGIN_dataset_ltspice_demos
Command line input: python main.py --data ltspice_demos --representation component_pin_net --model FEGIN --layers 6 --hiddens 16 --batch_size 64 --lr 0.01 --emb_size 512 --epochs 100 --save_appendix component_pin_net_L6_H16_BS64_LR0.01_E512 --no_val
 is saved.
-----
ltspice_demos - FEGIN
Using 6 layers, 16 hidden units, h = 2
Loading component_pin_net representation dataset
ENTERED
Training FEGIN on component_pin_net representation
Train: 1565, Test: 383
##################ITERATION #0 ****************************************
 epoch: 0, train_loss: 1.2486, test_loss: 1.5659, test_f1: 0.2281
 epoch: 1, train_loss: 1.0663, test_loss: 1.1914, test_f1: 0.4068
 epoch: 2, train_loss: 1.0167, test_loss: 1.1752, test_f1: 0.4306
 epoch: 3, train_loss: 1.0084, test_loss: 1.0861, test_f1: 0.4320
 epoch: 4, train_loss: 0.9927, test_loss: 1.1920, test_f1: 0.4314
 epoch: 5, train_loss: 0.9729, test_loss: 1.0532, test_f1: 0.4364
 epoch: 6, train_loss: 0.9735, test_loss: 1.0740, test_f1: 0.5125
 epoch: 7, train_loss: 0.9597, test_loss: 1.0838, test_f1: 0.4404
 epoch: 8, train_loss: 0.9627, test_loss: 1.0340, test_f1: 0.4522
 epoch: 9, train_loss: 0.9549, test_loss: 1.0859, test_f1: 0.4010
 epoch: 10, train_loss: 0.9438, test_loss: 1.1098, test_f1: 0.5168
 epoch: 11, train_loss: 0.9422, test_loss: 1.0566, test_f1: 0.5265
 epoch: 12, train_loss: 0.9461, test_loss: 1.0923, test_f1: 0.4858
 epoch: 13, train_loss: 0.9343, test_loss: 1.0795, test_f1: 0.4448
 epoch: 14, train_loss: 0.9103, test_loss: 1.0546, test_f1: 0.5426
 epoch: 15, train_loss: 0.9110, test_loss: 1.2540, test_f1: 0.4449
 epoch: 16, train_loss: 0.9071, test_loss: 1.0082, test_f1: 0.5489
 epoch: 17, train_loss: 0.8905, test_loss: 1.0004, test_f1: 0.5322
 epoch: 18, train_loss: 0.8859, test_loss: 1.0519, test_f1: 0.5026
 epoch: 19, train_loss: 0.8855, test_loss: 2.4403, test_f1: 0.3347
 epoch: 20, train_loss: 0.8797, test_loss: 1.3208, test_f1: 0.3745
 epoch: 21, train_loss: 0.9032, test_loss: 1.0748, test_f1: 0.5148
 epoch: 22, train_loss: 0.8602, test_loss: 0.9910, test_f1: 0.4986
 epoch: 23, train_loss: 0.8307, test_loss: 1.0842, test_f1: 0.5169
 epoch: 24, train_loss: 0.8540, test_loss: 1.3165, test_f1: 0.4321
 epoch: 25, train_loss: 0.8370, test_loss: 1.1741, test_f1: 0.3773
 epoch: 26, train_loss: 0.8442, test_loss: 1.0012, test_f1: 0.5278
 epoch: 27, train_loss: 0.8262, test_loss: 1.0132, test_f1: 0.4386
 epoch: 28, train_loss: 0.8462, test_loss: 1.3762, test_f1: 0.4734
 epoch: 29, train_loss: 0.8783, test_loss: 1.1487, test_f1: 0.4345
 epoch: 30, train_loss: 0.8563, test_loss: 1.1317, test_f1: 0.4889
 epoch: 31, train_loss: 0.8317, test_loss: 1.0012, test_f1: 0.5226
 epoch: 32, train_loss: 0.8083, test_loss: 0.9623, test_f1: 0.5967
 epoch: 33, train_loss: 0.8045, test_loss: 1.1267, test_f1: 0.4284
 epoch: 34, train_loss: 0.8133, test_loss: 0.9813, test_f1: 0.5455
 epoch: 35, train_loss: 0.8372, test_loss: 1.1382, test_f1: 0.5130
 epoch: 36, train_loss: 0.8211, test_loss: 1.2772, test_f1: 0.4419
 epoch: 37, train_loss: 0.8158, test_loss: 1.9987, test_f1: 0.3713
 epoch: 38, train_loss: 0.8473, test_loss: 1.2488, test_f1: 0.4966
 epoch: 39, train_loss: 0.7865, test_loss: 1.2541, test_f1: 0.4958
 epoch: 40, train_loss: 0.7893, test_loss: 0.9810, test_f1: 0.5752
 epoch: 41, train_loss: 0.7809, test_loss: 1.1060, test_f1: 0.4764
 epoch: 42, train_loss: 0.7938, test_loss: 2.9554, test_f1: 0.3350
 epoch: 43, train_loss: 0.7721, test_loss: 1.0111, test_f1: 0.5401
 epoch: 44, train_loss: 0.7811, test_loss: 1.0193, test_f1: 0.6159
 epoch: 45, train_loss: 0.8151, test_loss: 0.9994, test_f1: 0.5220
 epoch: 46, train_loss: 0.7999, test_loss: 1.0634, test_f1: 0.5335
 epoch: 47, train_loss: 0.7677, test_loss: 1.0466, test_f1: 0.5577
 epoch: 48, train_loss: 0.7609, test_loss: 1.2646, test_f1: 0.4970
 epoch: 49, train_loss: 0.7309, test_loss: 1.2284, test_f1: 0.4824
 epoch: 50, train_loss: 0.7620, test_loss: 1.0268, test_f1: 0.5933
 epoch: 51, train_loss: 0.7344, test_loss: 1.1546, test_f1: 0.5762
 epoch: 52, train_loss: 0.7176, test_loss: 1.0494, test_f1: 0.5992
 epoch: 53, train_loss: 0.7159, test_loss: 1.0005, test_f1: 0.5685
 epoch: 54, train_loss: 0.7159, test_loss: 1.0665, test_f1: 0.6106
 epoch: 55, train_loss: 0.6960, test_loss: 1.0812, test_f1: 0.5875
 epoch: 56, train_loss: 0.6928, test_loss: 1.2219, test_f1: 0.5443
 epoch: 57, train_loss: 0.7033, test_loss: 1.0209, test_f1: 0.5845
 epoch: 58, train_loss: 0.7022, test_loss: 1.5458, test_f1: 0.5786
 epoch: 59, train_loss: 0.6620, test_loss: 1.1811, test_f1: 0.5733
 epoch: 60, train_loss: 0.6868, test_loss: 1.3260, test_f1: 0.5445
 epoch: 61, train_loss: 0.6949, test_loss: 1.4974, test_f1: 0.5116
 epoch: 62, train_loss: 0.6878, test_loss: 1.2263, test_f1: 0.5979
 epoch: 63, train_loss: 0.6740, test_loss: 1.4497, test_f1: 0.5552
 epoch: 64, train_loss: 0.6541, test_loss: 1.2262, test_f1: 0.5863
 epoch: 65, train_loss: 0.6599, test_loss: 1.0264, test_f1: 0.6032
 epoch: 66, train_loss: 0.6551, test_loss: 1.0911, test_f1: 0.5721
 epoch: 67, train_loss: 0.6615, test_loss: 1.2760, test_f1: 0.5779
 epoch: 68, train_loss: 0.6780, test_loss: 1.5439, test_f1: 0.5782
 epoch: 69, train_loss: 0.6666, test_loss: 1.5168, test_f1: 0.5061
 epoch: 70, train_loss: 0.6718, test_loss: 1.2051, test_f1: 0.6169
 epoch: 71, train_loss: 0.6591, test_loss: 1.1454, test_f1: 0.6160
 epoch: 72, train_loss: 0.6325, test_loss: 1.2708, test_f1: 0.5995
 epoch: 73, train_loss: 0.6610, test_loss: 1.3494, test_f1: 0.5559
 epoch: 74, train_loss: 0.6393, test_loss: 1.3895, test_f1: 0.5736
 epoch: 75, train_loss: 0.6434, test_loss: 1.2893, test_f1: 0.6015
 epoch: 76, train_loss: 0.6514, test_loss: 1.4710, test_f1: 0.6232
 epoch: 77, train_loss: 0.6274, test_loss: 1.4497, test_f1: 0.5863
 epoch: 78, train_loss: 0.6292, test_loss: 1.2942, test_f1: 0.5918
 epoch: 79, train_loss: 0.6418, test_loss: 1.3971, test_f1: 0.5675
 epoch: 80, train_loss: 0.6370, test_loss: 1.6066, test_f1: 0.5778
 epoch: 81, train_loss: 0.5876, test_loss: 1.6004, test_f1: 0.5784
 epoch: 82, train_loss: 0.6230, test_loss: 1.3580, test_f1: 0.5966
 epoch: 83, train_loss: 0.6403, test_loss: 1.7208, test_f1: 0.5705
 epoch: 84, train_loss: 0.6294, test_loss: 1.4488, test_f1: 0.5406
 epoch: 85, train_loss: 0.6235, test_loss: 1.5131, test_f1: 0.5661
 epoch: 86, train_loss: 0.6011, test_loss: 1.3644, test_f1: 0.6333
 epoch: 87, train_loss: 0.5992, test_loss: 1.7501, test_f1: 0.5701
 epoch: 88, train_loss: 0.5993, test_loss: 1.3717, test_f1: 0.5745
 epoch: 89, train_loss: 0.6471, test_loss: 2.0146, test_f1: 0.5483
 epoch: 90, train_loss: 0.6430, test_loss: 1.3274, test_f1: 0.5845
 epoch: 91, train_loss: 0.6273, test_loss: 1.2782, test_f1: 0.6342
 epoch: 92, train_loss: 0.6026, test_loss: 1.5300, test_f1: 0.6120
 epoch: 93, train_loss: 0.6117, test_loss: 1.3959, test_f1: 0.5908
 epoch: 94, train_loss: 0.6078, test_loss: 1.5574, test_f1: 0.6150
 epoch: 95, train_loss: 0.6007, test_loss: 1.7060, test_f1: 0.6171
 epoch: 96, train_loss: 0.6254, test_loss: 1.2551, test_f1: 0.5805
 epoch: 97, train_loss: 0.6440, test_loss: 1.4216, test_f1: 0.5814
 epoch: 98, train_loss: 0.6093, test_loss: 1.5696, test_f1: 0.5824
 epoch: 99, train_loss: 0.6066, test_loss: 1.9257, test_f1: 0.5668
##################ITERATION #1 ****************************************
 epoch: 0, train_loss: 1.1748, test_loss: 1.2480, test_f1: 0.2336
 epoch: 1, train_loss: 1.0317, test_loss: 1.1375, test_f1: 0.4583
 epoch: 2, train_loss: 0.9988, test_loss: 1.0834, test_f1: 0.4526
 epoch: 3, train_loss: 0.9922, test_loss: 1.0540, test_f1: 0.5133
 epoch: 4, train_loss: 0.9577, test_loss: 1.0348, test_f1: 0.5318
 epoch: 5, train_loss: 0.9583, test_loss: 1.0193, test_f1: 0.5328
 epoch: 6, train_loss: 0.9469, test_loss: 1.0411, test_f1: 0.5560
 epoch: 7, train_loss: 0.9518, test_loss: 1.0546, test_f1: 0.5428
 epoch: 8, train_loss: 0.9430, test_loss: 1.0012, test_f1: 0.5655
 epoch: 9, train_loss: 0.9363, test_loss: 1.0353, test_f1: 0.5101
 epoch: 10, train_loss: 0.9111, test_loss: 1.0474, test_f1: 0.5180
 epoch: 11, train_loss: 0.9335, test_loss: 1.0846, test_f1: 0.5474
 epoch: 12, train_loss: 0.9134, test_loss: 1.0721, test_f1: 0.5002
 epoch: 13, train_loss: 0.9322, test_loss: 1.0380, test_f1: 0.5248
 epoch: 14, train_loss: 0.8953, test_loss: 0.9886, test_f1: 0.5614
 epoch: 15, train_loss: 0.8860, test_loss: 0.9693, test_f1: 0.5748
 epoch: 16, train_loss: 0.8927, test_loss: 1.0959, test_f1: 0.5352
 epoch: 17, train_loss: 0.8798, test_loss: 1.0053, test_f1: 0.5574
 epoch: 18, train_loss: 0.8785, test_loss: 1.0533, test_f1: 0.4494
 epoch: 19, train_loss: 0.8878, test_loss: 0.9871, test_f1: 0.5357
 epoch: 20, train_loss: 0.8773, test_loss: 0.9949, test_f1: 0.5432
 epoch: 21, train_loss: 0.8432, test_loss: 1.0062, test_f1: 0.5471
 epoch: 22, train_loss: 0.8519, test_loss: 1.0493, test_f1: 0.5273
 epoch: 23, train_loss: 0.8297, test_loss: 0.9870, test_f1: 0.5732
 epoch: 24, train_loss: 0.8163, test_loss: 1.2500, test_f1: 0.4658
 epoch: 25, train_loss: 0.8140, test_loss: 1.0325, test_f1: 0.5753
 epoch: 26, train_loss: 0.8206, test_loss: 1.5621, test_f1: 0.4018
 epoch: 27, train_loss: 0.8599, test_loss: 1.0594, test_f1: 0.5254
 epoch: 28, train_loss: 0.8502, test_loss: 1.0018, test_f1: 0.5569
 epoch: 29, train_loss: 0.8360, test_loss: 1.1559, test_f1: 0.5392
 epoch: 30, train_loss: 0.8174, test_loss: 0.9718, test_f1: 0.5728
 epoch: 31, train_loss: 0.8278, test_loss: 0.9759, test_f1: 0.5754
 epoch: 32, train_loss: 0.8141, test_loss: 0.9970, test_f1: 0.5275
 epoch: 33, train_loss: 0.8329, test_loss: 0.9733, test_f1: 0.5535
 epoch: 34, train_loss: 0.8043, test_loss: 0.9219, test_f1: 0.5620
 epoch: 35, train_loss: 0.7914, test_loss: 1.0960, test_f1: 0.5230
 epoch: 36, train_loss: 0.7968, test_loss: 0.9743, test_f1: 0.6121
 epoch: 37, train_loss: 0.8145, test_loss: 1.1340, test_f1: 0.4413
 epoch: 38, train_loss: 0.7977, test_loss: 0.9204, test_f1: 0.5958
 epoch: 39, train_loss: 0.7676, test_loss: 1.1366, test_f1: 0.5582
 epoch: 40, train_loss: 0.7862, test_loss: 1.0185, test_f1: 0.5192
 epoch: 41, train_loss: 0.7914, test_loss: 1.0055, test_f1: 0.5902
 epoch: 42, train_loss: 0.8239, test_loss: 1.0835, test_f1: 0.5480
 epoch: 43, train_loss: 0.7870, test_loss: 0.9588, test_f1: 0.5748
 epoch: 44, train_loss: 0.7717, test_loss: 1.0368, test_f1: 0.5546
 epoch: 45, train_loss: 0.7610, test_loss: 0.9022, test_f1: 0.6258
 epoch: 46, train_loss: 0.7453, test_loss: 0.9770, test_f1: 0.6153
 epoch: 47, train_loss: 0.7892, test_loss: 1.0660, test_f1: 0.4785
 epoch: 48, train_loss: 0.8384, test_loss: 0.9738, test_f1: 0.5482
 epoch: 49, train_loss: 0.8087, test_loss: 0.9738, test_f1: 0.6196
 epoch: 50, train_loss: 0.7778, test_loss: 0.9614, test_f1: 0.6111
 epoch: 51, train_loss: 0.7623, test_loss: 0.9561, test_f1: 0.5404
 epoch: 52, train_loss: 0.7496, test_loss: 0.9058, test_f1: 0.6416
 epoch: 53, train_loss: 0.7500, test_loss: 0.9630, test_f1: 0.6188
 epoch: 54, train_loss: 0.7398, test_loss: 0.9512, test_f1: 0.6491
 epoch: 55, train_loss: 0.7280, test_loss: 0.9427, test_f1: 0.6293
 epoch: 56, train_loss: 0.7263, test_loss: 0.9270, test_f1: 0.6089
 epoch: 57, train_loss: 0.7188, test_loss: 1.0113, test_f1: 0.6070
 epoch: 58, train_loss: 0.7248, test_loss: 0.9497, test_f1: 0.5632
 epoch: 59, train_loss: 0.7282, test_loss: 1.0059, test_f1: 0.5610
 epoch: 60, train_loss: 0.7030, test_loss: 0.9823, test_f1: 0.6255
 epoch: 61, train_loss: 0.6886, test_loss: 0.9367, test_f1: 0.6196
 epoch: 62, train_loss: 0.7160, test_loss: 0.9941, test_f1: 0.6285
 epoch: 63, train_loss: 0.6987, test_loss: 0.8998, test_f1: 0.6527
 epoch: 64, train_loss: 0.6853, test_loss: 1.0710, test_f1: 0.6298
 epoch: 65, train_loss: 0.6964, test_loss: 1.0886, test_f1: 0.6043
 epoch: 66, train_loss: 0.7054, test_loss: 0.9200, test_f1: 0.6588
 epoch: 67, train_loss: 0.7308, test_loss: 1.1679, test_f1: 0.5910
 epoch: 68, train_loss: 0.6991, test_loss: 0.9492, test_f1: 0.6673
 epoch: 69, train_loss: 0.7221, test_loss: 0.9796, test_f1: 0.6121
 epoch: 70, train_loss: 0.7011, test_loss: 0.9843, test_f1: 0.6190
 epoch: 71, train_loss: 0.6913, test_loss: 1.0203, test_f1: 0.6330
 epoch: 72, train_loss: 0.6925, test_loss: 0.9947, test_f1: 0.6475
 epoch: 73, train_loss: 0.7011, test_loss: 0.9094, test_f1: 0.6489
 epoch: 74, train_loss: 0.6826, test_loss: 1.0073, test_f1: 0.6426
 epoch: 75, train_loss: 0.6668, test_loss: 0.9981, test_f1: 0.6416
 epoch: 76, train_loss: 0.6753, test_loss: 0.9434, test_f1: 0.6693
 epoch: 77, train_loss: 0.6790, test_loss: 1.0293, test_f1: 0.6377
 epoch: 78, train_loss: 0.6564, test_loss: 0.9166, test_f1: 0.6506
 epoch: 79, train_loss: 0.6617, test_loss: 0.9350, test_f1: 0.6269
 epoch: 80, train_loss: 0.6661, test_loss: 1.0144, test_f1: 0.6730
 epoch: 81, train_loss: 0.6291, test_loss: 0.9556, test_f1: 0.6696
 epoch: 82, train_loss: 0.6733, test_loss: 1.0199, test_f1: 0.6077
 epoch: 83, train_loss: 0.6780, test_loss: 0.9489, test_f1: 0.6725
 epoch: 84, train_loss: 0.6680, test_loss: 0.9360, test_f1: 0.6473
 epoch: 85, train_loss: 0.6641, test_loss: 1.0324, test_f1: 0.6356
 epoch: 86, train_loss: 0.6773, test_loss: 0.9901, test_f1: 0.6409
 epoch: 87, train_loss: 0.6547, test_loss: 0.9427, test_f1: 0.6453
 epoch: 88, train_loss: 0.6484, test_loss: 1.0316, test_f1: 0.6502
 epoch: 89, train_loss: 0.6589, test_loss: 1.0196, test_f1: 0.6452
 epoch: 90, train_loss: 0.6539, test_loss: 1.1556, test_f1: 0.6196
 epoch: 91, train_loss: 0.6810, test_loss: 0.9723, test_f1: 0.6226
 epoch: 92, train_loss: 0.6430, test_loss: 1.1789, test_f1: 0.6038
 epoch: 93, train_loss: 0.6396, test_loss: 1.0647, test_f1: 0.5871
 epoch: 94, train_loss: 0.6651, test_loss: 0.9938, test_f1: 0.7010
 epoch: 95, train_loss: 0.6633, test_loss: 1.0377, test_f1: 0.6251
 epoch: 96, train_loss: 0.6544, test_loss: 0.9719, test_f1: 0.6517
 epoch: 97, train_loss: 0.6670, test_loss: 0.9898, test_f1: 0.6508
 epoch: 98, train_loss: 0.6836, test_loss: 1.0106, test_f1: 0.6175
 epoch: 99, train_loss: 0.6441, test_loss: 1.0466, test_f1: 0.6117
##################ITERATION #2 ****************************************
 epoch: 0, train_loss: 1.1460, test_loss: 1.2538, test_f1: 0.2539
 epoch: 1, train_loss: 1.0358, test_loss: 1.1148, test_f1: 0.4234
 epoch: 2, train_loss: 0.9849, test_loss: 1.1743, test_f1: 0.4344
 epoch: 3, train_loss: 0.9581, test_loss: 1.0686, test_f1: 0.5173
 epoch: 4, train_loss: 0.9598, test_loss: 1.0661, test_f1: 0.5166
 epoch: 5, train_loss: 0.9418, test_loss: 1.1085, test_f1: 0.4966
 epoch: 6, train_loss: 0.9176, test_loss: 1.0016, test_f1: 0.5578
 epoch: 7, train_loss: 0.9445, test_loss: 1.0136, test_f1: 0.5191
 epoch: 8, train_loss: 0.9158, test_loss: 1.0072, test_f1: 0.5409
 epoch: 9, train_loss: 0.9126, test_loss: 0.9968, test_f1: 0.5384
 epoch: 10, train_loss: 0.8678, test_loss: 1.0161, test_f1: 0.5585
 epoch: 11, train_loss: 0.8809, test_loss: 1.2412, test_f1: 0.3847
 epoch: 12, train_loss: 0.8631, test_loss: 0.9782, test_f1: 0.5874
 epoch: 13, train_loss: 0.8421, test_loss: 1.0157, test_f1: 0.5223
 epoch: 14, train_loss: 0.8730, test_loss: 1.2970, test_f1: 0.3611
 epoch: 15, train_loss: 0.8658, test_loss: 0.9808, test_f1: 0.5073
 epoch: 16, train_loss: 0.8441, test_loss: 1.2862, test_f1: 0.4657
 epoch: 17, train_loss: 0.8509, test_loss: 0.9525, test_f1: 0.5703
 epoch: 18, train_loss: 0.8376, test_loss: 0.9902, test_f1: 0.5261
 epoch: 19, train_loss: 0.8249, test_loss: 1.0465, test_f1: 0.5370
 epoch: 20, train_loss: 0.8120, test_loss: 1.3171, test_f1: 0.4678
 epoch: 21, train_loss: 0.8152, test_loss: 1.0829, test_f1: 0.5437
 epoch: 22, train_loss: 0.8254, test_loss: 1.2097, test_f1: 0.4529
 epoch: 23, train_loss: 0.8089, test_loss: 1.0283, test_f1: 0.5742
 epoch: 24, train_loss: 0.7898, test_loss: 1.0272, test_f1: 0.5911
 epoch: 25, train_loss: 0.7841, test_loss: 0.9992, test_f1: 0.5951
 epoch: 26, train_loss: 0.7900, test_loss: 0.9890, test_f1: 0.5793
 epoch: 27, train_loss: 0.7677, test_loss: 0.9825, test_f1: 0.5906
 epoch: 28, train_loss: 0.7782, test_loss: 1.0818, test_f1: 0.5581
 epoch: 29, train_loss: 0.7860, test_loss: 1.0371, test_f1: 0.5659
 epoch: 30, train_loss: 0.7668, test_loss: 0.9976, test_f1: 0.5776
 epoch: 31, train_loss: 0.7637, test_loss: 1.0499, test_f1: 0.5408
 epoch: 32, train_loss: 0.7770, test_loss: 1.0081, test_f1: 0.6113
 epoch: 33, train_loss: 0.7827, test_loss: 1.0096, test_f1: 0.5784
 epoch: 34, train_loss: 0.7714, test_loss: 1.0393, test_f1: 0.5489
 epoch: 35, train_loss: 0.7494, test_loss: 1.0149, test_f1: 0.5589
 epoch: 36, train_loss: 0.7476, test_loss: 1.0757, test_f1: 0.5664
 epoch: 37, train_loss: 0.7449, test_loss: 1.0966, test_f1: 0.4782
 epoch: 38, train_loss: 0.7268, test_loss: 1.0413, test_f1: 0.5804
 epoch: 39, train_loss: 0.7651, test_loss: 1.2296, test_f1: 0.4414
 epoch: 40, train_loss: 0.7674, test_loss: 1.2156, test_f1: 0.5515
 epoch: 41, train_loss: 0.7516, test_loss: 1.0741, test_f1: 0.5679
 epoch: 42, train_loss: 0.7457, test_loss: 1.0997, test_f1: 0.5541
 epoch: 43, train_loss: 0.7260, test_loss: 1.0164, test_f1: 0.5743
 epoch: 44, train_loss: 0.7524, test_loss: 1.0641, test_f1: 0.5536
 epoch: 45, train_loss: 0.7340, test_loss: 1.0657, test_f1: 0.5453
 epoch: 46, train_loss: 0.7338, test_loss: 1.0787, test_f1: 0.5530
 epoch: 47, train_loss: 0.7145, test_loss: 1.0134, test_f1: 0.5759
 epoch: 48, train_loss: 0.7108, test_loss: 1.0808, test_f1: 0.5815
 epoch: 49, train_loss: 0.7254, test_loss: 1.3772, test_f1: 0.5066
 epoch: 50, train_loss: 0.7035, test_loss: 1.0220, test_f1: 0.5957
 epoch: 51, train_loss: 0.6876, test_loss: 0.9910, test_f1: 0.6270
 epoch: 52, train_loss: 0.6710, test_loss: 1.0427, test_f1: 0.5994
 epoch: 53, train_loss: 0.6813, test_loss: 1.0194, test_f1: 0.6247
 epoch: 54, train_loss: 0.6752, test_loss: 1.0447, test_f1: 0.5935
 epoch: 55, train_loss: 0.6399, test_loss: 1.0059, test_f1: 0.6522
 epoch: 56, train_loss: 0.6465, test_loss: 1.0317, test_f1: 0.6300
 epoch: 57, train_loss: 0.6459, test_loss: 1.1162, test_f1: 0.5675
 epoch: 58, train_loss: 0.6598, test_loss: 1.0275, test_f1: 0.6147
 epoch: 59, train_loss: 0.6548, test_loss: 1.1682, test_f1: 0.5756
 epoch: 60, train_loss: 0.6444, test_loss: 1.0227, test_f1: 0.6448
 epoch: 61, train_loss: 0.6310, test_loss: 1.0405, test_f1: 0.6337
 epoch: 62, train_loss: 0.6275, test_loss: 1.1316, test_f1: 0.5593
 epoch: 63, train_loss: 0.6255, test_loss: 1.0695, test_f1: 0.6099
 epoch: 64, train_loss: 0.6112, test_loss: 1.0475, test_f1: 0.6424
 epoch: 65, train_loss: 0.6186, test_loss: 1.2807, test_f1: 0.5876
 epoch: 66, train_loss: 0.6281, test_loss: 1.0609, test_f1: 0.6114
 epoch: 67, train_loss: 0.6158, test_loss: 1.0962, test_f1: 0.6074
 epoch: 68, train_loss: 0.6172, test_loss: 1.1088, test_f1: 0.5675
 epoch: 69, train_loss: 0.6388, test_loss: 1.1782, test_f1: 0.5596
 epoch: 70, train_loss: 0.6432, test_loss: 1.2208, test_f1: 0.5771
 epoch: 71, train_loss: 0.6340, test_loss: 1.0546, test_f1: 0.6046
 epoch: 72, train_loss: 0.6274, test_loss: 1.0967, test_f1: 0.6120
 epoch: 73, train_loss: 0.6175, test_loss: 1.1161, test_f1: 0.5920
 epoch: 74, train_loss: 0.6022, test_loss: 1.2431, test_f1: 0.5660
 epoch: 75, train_loss: 0.6138, test_loss: 1.1147, test_f1: 0.5897
 epoch: 76, train_loss: 0.6258, test_loss: 1.1257, test_f1: 0.5637
 epoch: 77, train_loss: 0.6033, test_loss: 1.1397, test_f1: 0.6029
 epoch: 78, train_loss: 0.6323, test_loss: 1.2747, test_f1: 0.5584
 epoch: 79, train_loss: 0.6608, test_loss: 1.1699, test_f1: 0.5781
 epoch: 80, train_loss: 0.6276, test_loss: 1.1720, test_f1: 0.6146
 epoch: 81, train_loss: 0.6123, test_loss: 1.2137, test_f1: 0.6181
 epoch: 82, train_loss: 0.6081, test_loss: 1.1754, test_f1: 0.5953
 epoch: 83, train_loss: 0.6092, test_loss: 1.1276, test_f1: 0.6088
 epoch: 84, train_loss: 0.6096, test_loss: 1.1090, test_f1: 0.5871
 epoch: 85, train_loss: 0.6075, test_loss: 1.2582, test_f1: 0.6121
 epoch: 86, train_loss: 0.6114, test_loss: 1.1099, test_f1: 0.6555
 epoch: 87, train_loss: 0.6129, test_loss: 1.0987, test_f1: 0.6291
 epoch: 88, train_loss: 0.5701, test_loss: 1.3608, test_f1: 0.5697
 epoch: 89, train_loss: 0.5746, test_loss: 1.1819, test_f1: 0.5904
 epoch: 90, train_loss: 0.6178, test_loss: 1.1534, test_f1: 0.6371
 epoch: 91, train_loss: 0.5924, test_loss: 1.2156, test_f1: 0.5628
 epoch: 92, train_loss: 0.5826, test_loss: 1.1924, test_f1: 0.6106
 epoch: 93, train_loss: 0.5865, test_loss: 1.4154, test_f1: 0.5322
 epoch: 94, train_loss: 0.5857, test_loss: 1.1916, test_f1: 0.6162
 epoch: 95, train_loss: 0.5949, test_loss: 1.1974, test_f1: 0.6135
 epoch: 96, train_loss: 0.6036, test_loss: 1.1572, test_f1: 0.6227
 epoch: 97, train_loss: 0.6099, test_loss: 1.1185, test_f1: 0.6077
 epoch: 98, train_loss: 0.6044, test_loss: 1.0944, test_f1: 0.6174
 epoch: 99, train_loss: 0.6081, test_loss: 1.2408, test_f1: 0.6064
##################ITERATION #3 ****************************************
 epoch: 0, train_loss: 1.2033, test_loss: 1.3487, test_f1: 0.2281
 epoch: 1, train_loss: 1.0881, test_loss: 1.1777, test_f1: 0.4006
 epoch: 2, train_loss: 1.0347, test_loss: 1.1685, test_f1: 0.4242
 epoch: 3, train_loss: 1.0218, test_loss: 1.0868, test_f1: 0.4864
 epoch: 4, train_loss: 0.9900, test_loss: 1.0540, test_f1: 0.5123
 epoch: 5, train_loss: 0.9585, test_loss: 1.0430, test_f1: 0.4985
 epoch: 6, train_loss: 0.9799, test_loss: 1.1259, test_f1: 0.4610
 epoch: 7, train_loss: 0.9775, test_loss: 1.0282, test_f1: 0.5277
 epoch: 8, train_loss: 0.9580, test_loss: 1.2285, test_f1: 0.4273
 epoch: 9, train_loss: 0.9771, test_loss: 1.0806, test_f1: 0.5065
 epoch: 10, train_loss: 0.9445, test_loss: 1.0322, test_f1: 0.4891
 epoch: 11, train_loss: 0.9406, test_loss: 1.1115, test_f1: 0.4386
 epoch: 12, train_loss: 0.9397, test_loss: 1.1430, test_f1: 0.4322
 epoch: 13, train_loss: 0.9302, test_loss: 1.0205, test_f1: 0.5128
 epoch: 14, train_loss: 0.9364, test_loss: 0.9977, test_f1: 0.5800
 epoch: 15, train_loss: 0.9191, test_loss: 1.0606, test_f1: 0.5316
 epoch: 16, train_loss: 0.9138, test_loss: 0.9747, test_f1: 0.5227
 epoch: 17, train_loss: 0.9237, test_loss: 1.2569, test_f1: 0.4758
 epoch: 18, train_loss: 0.9167, test_loss: 1.4595, test_f1: 0.4766
 epoch: 19, train_loss: 0.9293, test_loss: 1.0425, test_f1: 0.5329
 epoch: 20, train_loss: 0.9023, test_loss: 1.0747, test_f1: 0.5401
 epoch: 21, train_loss: 0.8881, test_loss: 1.1006, test_f1: 0.5225
 epoch: 22, train_loss: 0.8768, test_loss: 1.1119, test_f1: 0.5459
 epoch: 23, train_loss: 0.8764, test_loss: 1.0449, test_f1: 0.5453
 epoch: 24, train_loss: 0.8748, test_loss: 1.0034, test_f1: 0.5665
 epoch: 25, train_loss: 0.8804, test_loss: 1.0821, test_f1: 0.4819
 epoch: 26, train_loss: 0.8842, test_loss: 1.1158, test_f1: 0.4867
 epoch: 27, train_loss: 0.8601, test_loss: 1.3159, test_f1: 0.5335
 epoch: 28, train_loss: 0.8719, test_loss: 1.0310, test_f1: 0.5009
 epoch: 29, train_loss: 0.8452, test_loss: 1.2815, test_f1: 0.5115
 epoch: 30, train_loss: 0.8495, test_loss: 1.0755, test_f1: 0.5459
 epoch: 31, train_loss: 0.8400, test_loss: 1.0627, test_f1: 0.5688
 epoch: 32, train_loss: 0.8473, test_loss: 1.0535, test_f1: 0.5366
 epoch: 33, train_loss: 0.8383, test_loss: 1.2089, test_f1: 0.5072
 epoch: 34, train_loss: 0.8322, test_loss: 0.9391, test_f1: 0.6086
 epoch: 35, train_loss: 0.8230, test_loss: 1.0682, test_f1: 0.5195
 epoch: 36, train_loss: 0.8166, test_loss: 1.0384, test_f1: 0.5369
 epoch: 37, train_loss: 0.8453, test_loss: 1.0573, test_f1: 0.5195
 epoch: 38, train_loss: 0.7997, test_loss: 0.9795, test_f1: 0.5794
 epoch: 39, train_loss: 0.8186, test_loss: 1.0366, test_f1: 0.6003
 epoch: 40, train_loss: 0.8032, test_loss: 0.9850, test_f1: 0.6340
 epoch: 41, train_loss: 0.7987, test_loss: 0.9221, test_f1: 0.5813
 epoch: 42, train_loss: 0.7837, test_loss: 0.9926, test_f1: 0.6108
 epoch: 43, train_loss: 0.7882, test_loss: 0.9384, test_f1: 0.6494
 epoch: 44, train_loss: 0.7898, test_loss: 1.1012, test_f1: 0.5488
 epoch: 45, train_loss: 0.8019, test_loss: 1.0230, test_f1: 0.5708
 epoch: 46, train_loss: 0.7984, test_loss: 0.9557, test_f1: 0.6129
 epoch: 47, train_loss: 0.7917, test_loss: 1.0518, test_f1: 0.5794
 epoch: 48, train_loss: 0.8015, test_loss: 1.0055, test_f1: 0.6082
 epoch: 49, train_loss: 0.7972, test_loss: 1.0594, test_f1: 0.5220
 epoch: 50, train_loss: 0.7991, test_loss: 1.0903, test_f1: 0.5541
 epoch: 51, train_loss: 0.7956, test_loss: 1.1063, test_f1: 0.5382
 epoch: 52, train_loss: 0.7577, test_loss: 0.9886, test_f1: 0.6010
 epoch: 53, train_loss: 0.7483, test_loss: 0.9804, test_f1: 0.6191
 epoch: 54, train_loss: 0.7340, test_loss: 0.9840, test_f1: 0.6418
 epoch: 55, train_loss: 0.7343, test_loss: 0.9648, test_f1: 0.6260
 epoch: 56, train_loss: 0.7205, test_loss: 0.9872, test_f1: 0.6284
 epoch: 57, train_loss: 0.7307, test_loss: 0.9453, test_f1: 0.6767
 epoch: 58, train_loss: 0.7116, test_loss: 1.2178, test_f1: 0.5389
 epoch: 59, train_loss: 0.6897, test_loss: 1.0076, test_f1: 0.6534
 epoch: 60, train_loss: 0.7073, test_loss: 1.0529, test_f1: 0.5879
 epoch: 61, train_loss: 0.7207, test_loss: 1.1255, test_f1: 0.6035
 epoch: 62, train_loss: 0.7076, test_loss: 0.9798, test_f1: 0.5527
 epoch: 63, train_loss: 0.7159, test_loss: 0.9807, test_f1: 0.6790
 epoch: 64, train_loss: 0.7103, test_loss: 0.9996, test_f1: 0.5493
 epoch: 65, train_loss: 0.7088, test_loss: 1.2457, test_f1: 0.5478
 epoch: 66, train_loss: 0.7142, test_loss: 1.0575, test_f1: 0.6135
 epoch: 67, train_loss: 0.7304, test_loss: 1.5365, test_f1: 0.5694
 epoch: 68, train_loss: 0.6982, test_loss: 0.9921, test_f1: 0.6207
 epoch: 69, train_loss: 0.6790, test_loss: 1.0498, test_f1: 0.6544
 epoch: 70, train_loss: 0.6977, test_loss: 1.1323, test_f1: 0.5506
 epoch: 71, train_loss: 0.6910, test_loss: 0.9859, test_f1: 0.5687
 epoch: 72, train_loss: 0.6972, test_loss: 1.0106, test_f1: 0.5728
 epoch: 73, train_loss: 0.6887, test_loss: 1.1244, test_f1: 0.5733
 epoch: 74, train_loss: 0.6825, test_loss: 1.0653, test_f1: 0.5999
 epoch: 75, train_loss: 0.6852, test_loss: 1.1912, test_f1: 0.5853
 epoch: 76, train_loss: 0.6859, test_loss: 1.0367, test_f1: 0.6499
 epoch: 77, train_loss: 0.7002, test_loss: 1.0307, test_f1: 0.5581
 epoch: 78, train_loss: 0.6708, test_loss: 1.0071, test_f1: 0.5861
 epoch: 79, train_loss: 0.6842, test_loss: 1.0339, test_f1: 0.5633
 epoch: 80, train_loss: 0.6519, test_loss: 0.9653, test_f1: 0.6701
 epoch: 81, train_loss: 0.6821, test_loss: 1.0761, test_f1: 0.5875
 epoch: 82, train_loss: 0.6451, test_loss: 1.3054, test_f1: 0.5347
 epoch: 83, train_loss: 0.6844, test_loss: 1.1425, test_f1: 0.5894
 epoch: 84, train_loss: 0.6606, test_loss: 1.0395, test_f1: 0.6148
 epoch: 85, train_loss: 0.6647, test_loss: 1.0225, test_f1: 0.6815
 epoch: 86, train_loss: 0.6667, test_loss: 1.0088, test_f1: 0.6398
 epoch: 87, train_loss: 0.6758, test_loss: 1.1030, test_f1: 0.6154
 epoch: 88, train_loss: 0.6775, test_loss: 1.1666, test_f1: 0.5756
 epoch: 89, train_loss: 0.6697, test_loss: 1.0966, test_f1: 0.6169
 epoch: 90, train_loss: 0.6410, test_loss: 1.0401, test_f1: 0.6290
 epoch: 91, train_loss: 0.6612, test_loss: 1.0316, test_f1: 0.6423
 epoch: 92, train_loss: 0.6599, test_loss: 1.1690, test_f1: 0.6300
 epoch: 93, train_loss: 0.6529, test_loss: 1.3999, test_f1: 0.5752
 epoch: 94, train_loss: 0.6354, test_loss: 1.5225, test_f1: 0.5763
 epoch: 95, train_loss: 0.6493, test_loss: 1.1341, test_f1: 0.5979
 epoch: 96, train_loss: 0.6470, test_loss: 1.0225, test_f1: 0.6444
 epoch: 97, train_loss: 0.6624, test_loss: 1.3397, test_f1: 0.5794
 epoch: 98, train_loss: 0.6871, test_loss: 0.9484, test_f1: 0.6525
 epoch: 99, train_loss: 0.6562, test_loss: 1.2275, test_f1: 0.5360
##################ITERATION #4 ****************************************
 epoch: 0, train_loss: 1.2189, test_loss: 1.2657, test_f1: 0.2281
 epoch: 1, train_loss: 1.0496, test_loss: 1.1956, test_f1: 0.3934
 epoch: 2, train_loss: 1.0084, test_loss: 1.0880, test_f1: 0.4146
 epoch: 3, train_loss: 0.9921, test_loss: 1.0410, test_f1: 0.4573
 epoch: 4, train_loss: 0.9748, test_loss: 1.0650, test_f1: 0.4421
 epoch: 5, train_loss: 0.9641, test_loss: 1.0411, test_f1: 0.5135
 epoch: 6, train_loss: 0.9561, test_loss: 1.0859, test_f1: 0.4723
 epoch: 7, train_loss: 0.9583, test_loss: 1.2234, test_f1: 0.5106
 epoch: 8, train_loss: 0.9405, test_loss: 1.0514, test_f1: 0.5196
 epoch: 9, train_loss: 0.9436, test_loss: 1.0468, test_f1: 0.5015
 epoch: 10, train_loss: 0.9364, test_loss: 1.0182, test_f1: 0.4684
 epoch: 11, train_loss: 0.9185, test_loss: 1.0294, test_f1: 0.4847
 epoch: 12, train_loss: 0.8992, test_loss: 0.9659, test_f1: 0.5438
 epoch: 13, train_loss: 0.9146, test_loss: 1.6024, test_f1: 0.3575
 epoch: 14, train_loss: 0.8802, test_loss: 0.9623, test_f1: 0.5794
 epoch: 15, train_loss: 0.9002, test_loss: 1.0321, test_f1: 0.5532
 epoch: 16, train_loss: 0.8931, test_loss: 1.0017, test_f1: 0.4362
 epoch: 17, train_loss: 0.8783, test_loss: 1.0992, test_f1: 0.4933
 epoch: 18, train_loss: 0.8871, test_loss: 0.9818, test_f1: 0.5248
 epoch: 19, train_loss: 0.8696, test_loss: 0.9812, test_f1: 0.5614
 epoch: 20, train_loss: 0.8438, test_loss: 1.0126, test_f1: 0.5745
 epoch: 21, train_loss: 0.8349, test_loss: 0.9639, test_f1: 0.5569
 epoch: 22, train_loss: 0.8564, test_loss: 7.4187, test_f1: 0.2303
 epoch: 23, train_loss: 0.8350, test_loss: 0.9861, test_f1: 0.4699
 epoch: 24, train_loss: 0.8561, test_loss: 1.0872, test_f1: 0.5925
 epoch: 25, train_loss: 0.8303, test_loss: 1.1518, test_f1: 0.4929
 epoch: 26, train_loss: 0.8788, test_loss: 1.0733, test_f1: 0.5319
 epoch: 27, train_loss: 0.8474, test_loss: 1.1720, test_f1: 0.5092
 epoch: 28, train_loss: 0.8683, test_loss: 0.9623, test_f1: 0.5379
 epoch: 29, train_loss: 0.8222, test_loss: 0.9771, test_f1: 0.5725
 epoch: 30, train_loss: 0.8320, test_loss: 1.1287, test_f1: 0.4661
 epoch: 31, train_loss: 0.8299, test_loss: 1.0968, test_f1: 0.4996
 epoch: 32, train_loss: 0.8009, test_loss: 0.9983, test_f1: 0.4871
 epoch: 33, train_loss: 0.7816, test_loss: 1.0815, test_f1: 0.5271
 epoch: 34, train_loss: 0.8052, test_loss: 1.3787, test_f1: 0.4505
 epoch: 35, train_loss: 0.7788, test_loss: 1.1596, test_f1: 0.5796
 epoch: 36, train_loss: 0.7666, test_loss: 1.2327, test_f1: 0.5328
 epoch: 37, train_loss: 0.7549, test_loss: 1.1480, test_f1: 0.5493
 epoch: 38, train_loss: 0.7533, test_loss: 1.0803, test_f1: 0.5641
 epoch: 39, train_loss: 0.7348, test_loss: 0.9720, test_f1: 0.5997
 epoch: 40, train_loss: 0.7879, test_loss: 1.0363, test_f1: 0.5287
 epoch: 41, train_loss: 0.7620, test_loss: 1.0925, test_f1: 0.5337
 epoch: 42, train_loss: 0.7469, test_loss: 1.0398, test_f1: 0.5831
 epoch: 43, train_loss: 0.7585, test_loss: 1.1698, test_f1: 0.6190
 epoch: 44, train_loss: 0.7262, test_loss: 1.1154, test_f1: 0.6022
 epoch: 45, train_loss: 0.7365, test_loss: 1.3607, test_f1: 0.5082
 epoch: 46, train_loss: 0.7419, test_loss: 1.4793, test_f1: 0.4300
 epoch: 47, train_loss: 0.7291, test_loss: 1.2653, test_f1: 0.4583
 epoch: 48, train_loss: 0.7361, test_loss: 1.2449, test_f1: 0.5557
 epoch: 49, train_loss: 0.7380, test_loss: 1.1188, test_f1: 0.5596
 epoch: 50, train_loss: 0.6984, test_loss: 1.0925, test_f1: 0.5093
 epoch: 51, train_loss: 0.6830, test_loss: 0.9657, test_f1: 0.6094
 epoch: 52, train_loss: 0.6594, test_loss: 0.9934, test_f1: 0.6513
 epoch: 53, train_loss: 0.6739, test_loss: 1.0129, test_f1: 0.6456
 epoch: 54, train_loss: 0.6528, test_loss: 1.0445, test_f1: 0.6169
 epoch: 55, train_loss: 0.6691, test_loss: 1.0175, test_f1: 0.6211
 epoch: 56, train_loss: 0.6370, test_loss: 1.2628, test_f1: 0.5377
 epoch: 57, train_loss: 0.6490, test_loss: 1.0991, test_f1: 0.5985
 epoch: 58, train_loss: 0.6531, test_loss: 1.0207, test_f1: 0.6297
 epoch: 59, train_loss: 0.6330, test_loss: 1.1824, test_f1: 0.5902
 epoch: 60, train_loss: 0.6233, test_loss: 1.3204, test_f1: 0.5777
 epoch: 61, train_loss: 0.6473, test_loss: 1.0162, test_f1: 0.5984
 epoch: 62, train_loss: 0.6202, test_loss: 1.2624, test_f1: 0.5780
 epoch: 63, train_loss: 0.6213, test_loss: 1.1419, test_f1: 0.5997
 epoch: 64, train_loss: 0.6181, test_loss: 1.2104, test_f1: 0.6086
 epoch: 65, train_loss: 0.6266, test_loss: 1.1784, test_f1: 0.4730
 epoch: 66, train_loss: 0.6206, test_loss: 1.2251, test_f1: 0.5873
 epoch: 67, train_loss: 0.6287, test_loss: 1.1312, test_f1: 0.6121
 epoch: 68, train_loss: 0.6499, test_loss: 1.1831, test_f1: 0.6019
 epoch: 69, train_loss: 0.6183, test_loss: 1.3018, test_f1: 0.5460
 epoch: 70, train_loss: 0.6015, test_loss: 1.2683, test_f1: 0.5804
 epoch: 71, train_loss: 0.6069, test_loss: 1.3445, test_f1: 0.5702
 epoch: 72, train_loss: 0.6055, test_loss: 1.1558, test_f1: 0.6082
 epoch: 73, train_loss: 0.5938, test_loss: 1.4951, test_f1: 0.5625
 epoch: 74, train_loss: 0.5965, test_loss: 1.6555, test_f1: 0.5726
 epoch: 75, train_loss: 0.6035, test_loss: 1.1887, test_f1: 0.6345
 epoch: 76, train_loss: 0.6077, test_loss: 1.2875, test_f1: 0.5729
 epoch: 77, train_loss: 0.6139, test_loss: 1.1211, test_f1: 0.6405
 epoch: 78, train_loss: 0.6136, test_loss: 1.1488, test_f1: 0.5903
 epoch: 79, train_loss: 0.6094, test_loss: 1.5353, test_f1: 0.5848
 epoch: 80, train_loss: 0.5900, test_loss: 1.4461, test_f1: 0.5875
 epoch: 81, train_loss: 0.5787, test_loss: 1.2813, test_f1: 0.6241
 epoch: 82, train_loss: 0.5615, test_loss: 1.3753, test_f1: 0.6118
 epoch: 83, train_loss: 0.5665, test_loss: 1.5660, test_f1: 0.5851
 epoch: 84, train_loss: 0.5927, test_loss: 1.4642, test_f1: 0.5735
 epoch: 85, train_loss: 0.5823, test_loss: 1.5669, test_f1: 0.5771
 epoch: 86, train_loss: 0.5682, test_loss: 1.5281, test_f1: 0.5706
 epoch: 87, train_loss: 0.5828, test_loss: 1.3345, test_f1: 0.5493
 epoch: 88, train_loss: 0.5874, test_loss: 1.3198, test_f1: 0.5689
 epoch: 89, train_loss: 0.5844, test_loss: 1.6235, test_f1: 0.5887
 epoch: 90, train_loss: 0.5649, test_loss: 1.5736, test_f1: 0.5721
 epoch: 91, train_loss: 0.5646, test_loss: 1.4425, test_f1: 0.5862
 epoch: 92, train_loss: 0.5872, test_loss: 1.3070, test_f1: 0.5471
 epoch: 93, train_loss: 0.5609, test_loss: 1.5838, test_f1: 0.5562
 epoch: 94, train_loss: 0.5815, test_loss: 1.4565, test_f1: 0.5985
 epoch: 95, train_loss: 0.5604, test_loss: 1.4924, test_f1: 0.5698
 epoch: 96, train_loss: 0.5709, test_loss: 1.5651, test_f1: 0.5614
 epoch: 97, train_loss: 0.5763, test_loss: 1.1533, test_f1: 0.6466
 epoch: 98, train_loss: 0.5590, test_loss: 1.6452, test_f1: 0.5730
 epoch: 99, train_loss: 0.5645, test_loss: 1.3431, test_f1: 0.6188
##################ITERATION #5 ****************************************
 epoch: 0, train_loss: 1.1756, test_loss: 1.2720, test_f1: 0.2281
 epoch: 1, train_loss: 1.0339, test_loss: 1.1323, test_f1: 0.4417
 epoch: 2, train_loss: 0.9938, test_loss: 1.0752, test_f1: 0.4494
 epoch: 3, train_loss: 0.9719, test_loss: 1.0797, test_f1: 0.4313
 epoch: 4, train_loss: 0.9557, test_loss: 1.0478, test_f1: 0.5286
 epoch: 5, train_loss: 0.9598, test_loss: 1.0059, test_f1: 0.5182
 epoch: 6, train_loss: 0.9326, test_loss: 1.0281, test_f1: 0.5030
 epoch: 7, train_loss: 0.9222, test_loss: 0.9567, test_f1: 0.5521
 epoch: 8, train_loss: 0.9356, test_loss: 1.0440, test_f1: 0.4626
 epoch: 9, train_loss: 0.9134, test_loss: 1.0406, test_f1: 0.5068
 epoch: 10, train_loss: 0.8986, test_loss: 0.9850, test_f1: 0.4835
 epoch: 11, train_loss: 0.8810, test_loss: 1.2279, test_f1: 0.4601
 epoch: 12, train_loss: 0.8984, test_loss: 1.1436, test_f1: 0.4680
 epoch: 13, train_loss: 0.9111, test_loss: 1.5201, test_f1: 0.4110
 epoch: 14, train_loss: 0.8969, test_loss: 1.6116, test_f1: 0.3015
 epoch: 15, train_loss: 0.8565, test_loss: 0.9436, test_f1: 0.5514
 epoch: 16, train_loss: 0.8519, test_loss: 1.0105, test_f1: 0.5315
 epoch: 17, train_loss: 0.8164, test_loss: 1.0751, test_f1: 0.4467
 epoch: 18, train_loss: 0.8242, test_loss: 0.9855, test_f1: 0.5832
 epoch: 19, train_loss: 0.8495, test_loss: 1.2629, test_f1: 0.4829
 epoch: 20, train_loss: 0.8264, test_loss: 0.9580, test_f1: 0.5921
 epoch: 21, train_loss: 0.8199, test_loss: 1.0766, test_f1: 0.5282
 epoch: 22, train_loss: 0.7709, test_loss: 1.0410, test_f1: 0.5672
 epoch: 23, train_loss: 0.7924, test_loss: 1.1595, test_f1: 0.4598
 epoch: 24, train_loss: 0.7965, test_loss: 1.0544, test_f1: 0.5105
 epoch: 25, train_loss: 0.7662, test_loss: 1.0148, test_f1: 0.5609
 epoch: 26, train_loss: 0.7782, test_loss: 0.9906, test_f1: 0.5744
 epoch: 27, train_loss: 0.7645, test_loss: 1.0625, test_f1: 0.5589
 epoch: 28, train_loss: 0.7934, test_loss: 1.1069, test_f1: 0.5310
 epoch: 29, train_loss: 0.8180, test_loss: 1.3076, test_f1: 0.4454
 epoch: 30, train_loss: 0.8195, test_loss: 1.3758, test_f1: 0.5108
 epoch: 31, train_loss: 0.7820, test_loss: 1.0072, test_f1: 0.5094
 epoch: 32, train_loss: 0.7555, test_loss: 1.1431, test_f1: 0.5353
 epoch: 33, train_loss: 0.7535, test_loss: 0.9686, test_f1: 0.6015
 epoch: 34, train_loss: 0.7372, test_loss: 1.1890, test_f1: 0.5112
 epoch: 35, train_loss: 0.7448, test_loss: 0.9742, test_f1: 0.5869
 epoch: 36, train_loss: 0.7423, test_loss: 1.0069, test_f1: 0.5605
 epoch: 37, train_loss: 0.7616, test_loss: 1.0059, test_f1: 0.5779
 epoch: 38, train_loss: 0.7317, test_loss: 1.0816, test_f1: 0.5113
 epoch: 39, train_loss: 0.7315, test_loss: 1.1803, test_f1: 0.5391
 epoch: 40, train_loss: 0.7344, test_loss: 1.3027, test_f1: 0.5001
 epoch: 41, train_loss: 0.7467, test_loss: 1.2295, test_f1: 0.4532
 epoch: 42, train_loss: 0.7305, test_loss: 1.0924, test_f1: 0.5125
 epoch: 43, train_loss: 0.7320, test_loss: 1.1675, test_f1: 0.5262
 epoch: 44, train_loss: 0.7289, test_loss: 1.0183, test_f1: 0.5487
 epoch: 45, train_loss: 0.7222, test_loss: 2.2232, test_f1: 0.4317
 epoch: 46, train_loss: 0.7035, test_loss: 1.0415, test_f1: 0.5664
 epoch: 47, train_loss: 0.7187, test_loss: 1.1101, test_f1: 0.5253
 epoch: 48, train_loss: 0.7364, test_loss: 1.0636, test_f1: 0.5370
 epoch: 49, train_loss: 0.7154, test_loss: 1.1035, test_f1: 0.4948
 epoch: 50, train_loss: 0.7364, test_loss: 1.9422, test_f1: 0.5333
 epoch: 51, train_loss: 0.7377, test_loss: 1.0804, test_f1: 0.5603
 epoch: 52, train_loss: 0.6783, test_loss: 1.1488, test_f1: 0.5678
 epoch: 53, train_loss: 0.6890, test_loss: 0.9712, test_f1: 0.6169
 epoch: 54, train_loss: 0.6626, test_loss: 1.1341, test_f1: 0.5647
 epoch: 55, train_loss: 0.6457, test_loss: 1.0973, test_f1: 0.5595
 epoch: 56, train_loss: 0.6584, test_loss: 1.1612, test_f1: 0.5519
 epoch: 57, train_loss: 0.6631, test_loss: 1.0809, test_f1: 0.5895
 epoch: 58, train_loss: 0.6467, test_loss: 1.1026, test_f1: 0.5751
 epoch: 59, train_loss: 0.6351, test_loss: 1.3029, test_f1: 0.5546
 epoch: 60, train_loss: 0.6358, test_loss: 1.0882, test_f1: 0.6086
 epoch: 61, train_loss: 0.6346, test_loss: 1.5540, test_f1: 0.4497
 epoch: 62, train_loss: 0.6476, test_loss: 1.0626, test_f1: 0.5798
 epoch: 63, train_loss: 0.6334, test_loss: 1.0659, test_f1: 0.5808
 epoch: 64, train_loss: 0.6319, test_loss: 1.1481, test_f1: 0.5685
 epoch: 65, train_loss: 0.6519, test_loss: 1.4804, test_f1: 0.4870
 epoch: 66, train_loss: 0.6241, test_loss: 1.1339, test_f1: 0.5845
 epoch: 67, train_loss: 0.6370, test_loss: 1.1953, test_f1: 0.5934
 epoch: 68, train_loss: 0.6179, test_loss: 1.1154, test_f1: 0.5538
 epoch: 69, train_loss: 0.6229, test_loss: 1.3147, test_f1: 0.5691
 epoch: 70, train_loss: 0.6262, test_loss: 1.0839, test_f1: 0.6287
 epoch: 71, train_loss: 0.6247, test_loss: 1.5431, test_f1: 0.5853
 epoch: 72, train_loss: 0.6230, test_loss: 1.4064, test_f1: 0.6012
 epoch: 73, train_loss: 0.6270, test_loss: 1.1320, test_f1: 0.5964
 epoch: 74, train_loss: 0.6191, test_loss: 1.2886, test_f1: 0.5450
 epoch: 75, train_loss: 0.6229, test_loss: 1.0917, test_f1: 0.5827
 epoch: 76, train_loss: 0.6132, test_loss: 1.2252, test_f1: 0.5935
 epoch: 77, train_loss: 0.5941, test_loss: 1.3057, test_f1: 0.5844
 epoch: 78, train_loss: 0.6504, test_loss: 1.2388, test_f1: 0.6217
 epoch: 79, train_loss: 0.6038, test_loss: 1.1785, test_f1: 0.6172
 epoch: 80, train_loss: 0.5958, test_loss: 1.1847, test_f1: 0.5654
 epoch: 81, train_loss: 0.5828, test_loss: 1.3380, test_f1: 0.5442
 epoch: 82, train_loss: 0.6016, test_loss: 1.1285, test_f1: 0.5539
 epoch: 83, train_loss: 0.6326, test_loss: 1.6817, test_f1: 0.5900
 epoch: 84, train_loss: 0.6057, test_loss: 1.2845, test_f1: 0.6172
 epoch: 85, train_loss: 0.6104, test_loss: 1.1099, test_f1: 0.5815
 epoch: 86, train_loss: 0.6110, test_loss: 1.3221, test_f1: 0.6134
 epoch: 87, train_loss: 0.5884, test_loss: 1.5143, test_f1: 0.5599
 epoch: 88, train_loss: 0.5852, test_loss: 1.3111, test_f1: 0.5720
 epoch: 89, train_loss: 0.5983, test_loss: 1.3487, test_f1: 0.5094
 epoch: 90, train_loss: 0.5899, test_loss: 1.2382, test_f1: 0.5603
 epoch: 91, train_loss: 0.5792, test_loss: 1.1703, test_f1: 0.5669
 epoch: 92, train_loss: 0.5956, test_loss: 1.6376, test_f1: 0.5510
 epoch: 93, train_loss: 0.6039, test_loss: 1.3236, test_f1: 0.5307
 epoch: 94, train_loss: 0.5725, test_loss: 1.3409, test_f1: 0.5762
 epoch: 95, train_loss: 0.5874, test_loss: 1.3800, test_f1: 0.6011
 epoch: 96, train_loss: 0.5599, test_loss: 1.3415, test_f1: 0.6211
 epoch: 97, train_loss: 0.5652, test_loss: 1.5133, test_f1: 0.6330
 epoch: 98, train_loss: 0.5856, test_loss: 1.2774, test_f1: 0.5819
 epoch: 99, train_loss: 0.5555, test_loss: 1.1483, test_f1: 0.5808
##################ITERATION #6 ****************************************
 epoch: 0, train_loss: 1.1754, test_loss: 1.4251, test_f1: 0.1838
 epoch: 1, train_loss: 1.0470, test_loss: 1.9779, test_f1: 0.0445
 epoch: 2, train_loss: 1.0162, test_loss: 1.0971, test_f1: 0.4596
 epoch: 3, train_loss: 1.0011, test_loss: 1.0778, test_f1: 0.4789
 epoch: 4, train_loss: 0.9687, test_loss: 1.1646, test_f1: 0.3909
 epoch: 5, train_loss: 0.9835, test_loss: 1.0684, test_f1: 0.4266
 epoch: 6, train_loss: 0.9560, test_loss: 1.0692, test_f1: 0.5096
 epoch: 7, train_loss: 0.9371, test_loss: 1.0194, test_f1: 0.5440
 epoch: 8, train_loss: 0.9156, test_loss: 1.0790, test_f1: 0.5267
 epoch: 9, train_loss: 0.8952, test_loss: 0.9941, test_f1: 0.5369
 epoch: 10, train_loss: 0.8813, test_loss: 1.1577, test_f1: 0.4761
 epoch: 11, train_loss: 0.8846, test_loss: 1.0841, test_f1: 0.5168
 epoch: 12, train_loss: 0.8640, test_loss: 1.0416, test_f1: 0.5395
 epoch: 13, train_loss: 0.8695, test_loss: 1.0218, test_f1: 0.5190
 epoch: 14, train_loss: 0.8643, test_loss: 1.0147, test_f1: 0.5142
 epoch: 15, train_loss: 0.8448, test_loss: 1.0844, test_f1: 0.4720
 epoch: 16, train_loss: 0.8340, test_loss: 1.0160, test_f1: 0.5527
 epoch: 17, train_loss: 0.8338, test_loss: 1.0238, test_f1: 0.5557
 epoch: 18, train_loss: 0.8364, test_loss: 1.0457, test_f1: 0.5176
 epoch: 19, train_loss: 0.8470, test_loss: 1.0724, test_f1: 0.5249
 epoch: 20, train_loss: 0.8292, test_loss: 1.0969, test_f1: 0.5340
 epoch: 21, train_loss: 0.8245, test_loss: 1.6076, test_f1: 0.3870
 epoch: 22, train_loss: 0.8339, test_loss: 0.9869, test_f1: 0.5009
 epoch: 23, train_loss: 0.8232, test_loss: 1.0005, test_f1: 0.5489
 epoch: 24, train_loss: 0.8100, test_loss: 1.0150, test_f1: 0.5535
 epoch: 25, train_loss: 0.7998, test_loss: 0.9867, test_f1: 0.5259
 epoch: 26, train_loss: 0.7833, test_loss: 1.0462, test_f1: 0.5459
 epoch: 27, train_loss: 0.7871, test_loss: 1.0835, test_f1: 0.5237
 epoch: 28, train_loss: 0.7983, test_loss: 1.0549, test_f1: 0.5727
 epoch: 29, train_loss: 0.7624, test_loss: 1.0412, test_f1: 0.5745
 epoch: 30, train_loss: 0.7713, test_loss: 1.0491, test_f1: 0.5168
 epoch: 31, train_loss: 0.7790, test_loss: 1.0343, test_f1: 0.5280
 epoch: 32, train_loss: 0.7659, test_loss: 1.0720, test_f1: 0.5173
 epoch: 33, train_loss: 0.7688, test_loss: 0.9562, test_f1: 0.6027
 epoch: 34, train_loss: 0.7736, test_loss: 1.1021, test_f1: 0.5322
 epoch: 35, train_loss: 0.7644, test_loss: 1.1961, test_f1: 0.5107
 epoch: 36, train_loss: 0.7471, test_loss: 1.3319, test_f1: 0.3994
 epoch: 37, train_loss: 0.7709, test_loss: 1.0734, test_f1: 0.5273
 epoch: 38, train_loss: 0.7598, test_loss: 0.9758, test_f1: 0.6040
 epoch: 39, train_loss: 0.7352, test_loss: 1.1983, test_f1: 0.5293
 epoch: 40, train_loss: 0.7372, test_loss: 1.0323, test_f1: 0.5486
 epoch: 41, train_loss: 0.7821, test_loss: 1.0411, test_f1: 0.6076
 epoch: 42, train_loss: 0.7662, test_loss: 1.2675, test_f1: 0.5039
 epoch: 43, train_loss: 0.7982, test_loss: 1.0755, test_f1: 0.5175
 epoch: 44, train_loss: 0.7666, test_loss: 1.0764, test_f1: 0.5898
 epoch: 45, train_loss: 0.7417, test_loss: 1.0126, test_f1: 0.5366
 epoch: 46, train_loss: 0.7666, test_loss: 1.0391, test_f1: 0.5175
 epoch: 47, train_loss: 0.7744, test_loss: 1.0287, test_f1: 0.5693
 epoch: 48, train_loss: 0.7500, test_loss: 1.0543, test_f1: 0.6058
 epoch: 49, train_loss: 0.7180, test_loss: 0.9934, test_f1: 0.5944
 epoch: 50, train_loss: 0.7303, test_loss: 1.1151, test_f1: 0.6005
 epoch: 51, train_loss: 0.6797, test_loss: 1.1917, test_f1: 0.5718
 epoch: 52, train_loss: 0.6938, test_loss: 1.1314, test_f1: 0.6103
 epoch: 53, train_loss: 0.6746, test_loss: 1.0855, test_f1: 0.6149
 epoch: 54, train_loss: 0.6682, test_loss: 1.1034, test_f1: 0.6134
 epoch: 55, train_loss: 0.6529, test_loss: 1.3179, test_f1: 0.5562
 epoch: 56, train_loss: 0.6648, test_loss: 1.0770, test_f1: 0.6366
 epoch: 57, train_loss: 0.6591, test_loss: 1.1477, test_f1: 0.6070
 epoch: 58, train_loss: 0.6551, test_loss: 1.1104, test_f1: 0.5949
 epoch: 59, train_loss: 0.6221, test_loss: 1.3132, test_f1: 0.5371
 epoch: 60, train_loss: 0.6181, test_loss: 1.3114, test_f1: 0.5609
 epoch: 61, train_loss: 0.6390, test_loss: 1.2319, test_f1: 0.5483
 epoch: 62, train_loss: 0.6097, test_loss: 1.2885, test_f1: 0.5743
 epoch: 63, train_loss: 0.6484, test_loss: 1.1100, test_f1: 0.6290
 epoch: 64, train_loss: 0.6183, test_loss: 1.0814, test_f1: 0.5891
 epoch: 65, train_loss: 0.6323, test_loss: 1.2019, test_f1: 0.6205
 epoch: 66, train_loss: 0.6554, test_loss: 1.1427, test_f1: 0.6304
 epoch: 67, train_loss: 0.6141, test_loss: 1.2115, test_f1: 0.6216
 epoch: 68, train_loss: 0.6241, test_loss: 1.2442, test_f1: 0.6367
 epoch: 69, train_loss: 0.6894, test_loss: 1.1397, test_f1: 0.5783
 epoch: 70, train_loss: 0.6384, test_loss: 1.4202, test_f1: 0.4706
 epoch: 71, train_loss: 0.6129, test_loss: 1.2668, test_f1: 0.5777
 epoch: 72, train_loss: 0.6166, test_loss: 1.1101, test_f1: 0.6399
 epoch: 73, train_loss: 0.6037, test_loss: 1.2409, test_f1: 0.5967
 epoch: 74, train_loss: 0.6113, test_loss: 1.7573, test_f1: 0.4762
 epoch: 75, train_loss: 0.6359, test_loss: 1.1476, test_f1: 0.6041
 epoch: 76, train_loss: 0.6151, test_loss: 1.3780, test_f1: 0.5572
 epoch: 77, train_loss: 0.6208, test_loss: 1.2002, test_f1: 0.5517
 epoch: 78, train_loss: 0.5987, test_loss: 1.3029, test_f1: 0.6272
 epoch: 79, train_loss: 0.6274, test_loss: 1.2069, test_f1: 0.5569
 epoch: 80, train_loss: 0.5865, test_loss: 1.1291, test_f1: 0.6370
 epoch: 81, train_loss: 0.5978, test_loss: 1.1478, test_f1: 0.6327
 epoch: 82, train_loss: 0.6050, test_loss: 1.1387, test_f1: 0.6097
 epoch: 83, train_loss: 0.5677, test_loss: 1.2471, test_f1: 0.6241
 epoch: 84, train_loss: 0.5909, test_loss: 1.1981, test_f1: 0.5973
 epoch: 85, train_loss: 0.5943, test_loss: 1.2417, test_f1: 0.6196
 epoch: 86, train_loss: 0.5905, test_loss: 1.2658, test_f1: 0.5759
 epoch: 87, train_loss: 0.5951, test_loss: 1.2047, test_f1: 0.6272
 epoch: 88, train_loss: 0.5802, test_loss: 1.1450, test_f1: 0.6539
 epoch: 89, train_loss: 0.5838, test_loss: 1.2319, test_f1: 0.6779
 epoch: 90, train_loss: 0.5809, test_loss: 1.2594, test_f1: 0.5392
 epoch: 91, train_loss: 0.6153, test_loss: 1.3372, test_f1: 0.6154
 epoch: 92, train_loss: 0.5781, test_loss: 1.3592, test_f1: 0.5442
 epoch: 93, train_loss: 0.5747, test_loss: 1.3369, test_f1: 0.6143
 epoch: 94, train_loss: 0.5751, test_loss: 1.1922, test_f1: 0.6454
 epoch: 95, train_loss: 0.5898, test_loss: 1.3549, test_f1: 0.5060
 epoch: 96, train_loss: 0.6102, test_loss: 1.1757, test_f1: 0.6215
 epoch: 97, train_loss: 0.5521, test_loss: 1.2050, test_f1: 0.6035
 epoch: 98, train_loss: 0.5625, test_loss: 1.2409, test_f1: 0.5816
 epoch: 99, train_loss: 0.5549, test_loss: 1.2725, test_f1: 0.6118
##################ITERATION #7 ****************************************
 epoch: 0, train_loss: 1.2240, test_loss: 1.2666, test_f1: 0.2324
 epoch: 1, train_loss: 1.0588, test_loss: 1.0873, test_f1: 0.4157
 epoch: 2, train_loss: 1.0035, test_loss: 1.0353, test_f1: 0.5257
 epoch: 3, train_loss: 0.9673, test_loss: 1.0223, test_f1: 0.5373
 epoch: 4, train_loss: 0.9597, test_loss: 1.1257, test_f1: 0.4502
 epoch: 5, train_loss: 0.9351, test_loss: 1.1049, test_f1: 0.4615
 epoch: 6, train_loss: 0.9182, test_loss: 0.9762, test_f1: 0.5506
 epoch: 7, train_loss: 0.8924, test_loss: 1.0101, test_f1: 0.4982
 epoch: 8, train_loss: 0.8776, test_loss: 0.9328, test_f1: 0.5183
 epoch: 9, train_loss: 0.8732, test_loss: 0.9895, test_f1: 0.5512
 epoch: 10, train_loss: 0.8550, test_loss: 1.0820, test_f1: 0.5112
 epoch: 11, train_loss: 0.8422, test_loss: 1.1049, test_f1: 0.5266
 epoch: 12, train_loss: 0.8312, test_loss: 1.1705, test_f1: 0.5245
 epoch: 13, train_loss: 0.8623, test_loss: 1.0134, test_f1: 0.4970
 epoch: 14, train_loss: 0.8538, test_loss: 1.0502, test_f1: 0.5580
 epoch: 15, train_loss: 0.8471, test_loss: 1.1462, test_f1: 0.5449
 epoch: 16, train_loss: 0.8367, test_loss: 1.1121, test_f1: 0.4774
 epoch: 17, train_loss: 0.8173, test_loss: 1.1677, test_f1: 0.5313
 epoch: 18, train_loss: 0.8343, test_loss: 1.0252, test_f1: 0.5439
 epoch: 19, train_loss: 0.8377, test_loss: 1.0800, test_f1: 0.5342
 epoch: 20, train_loss: 0.7999, test_loss: 0.9824, test_f1: 0.5671
 epoch: 21, train_loss: 0.8132, test_loss: 1.5689, test_f1: 0.4108
 epoch: 22, train_loss: 0.8136, test_loss: 1.3099, test_f1: 0.5025
 epoch: 23, train_loss: 0.8050, test_loss: 1.0794, test_f1: 0.5710
 epoch: 24, train_loss: 0.8140, test_loss: 1.1871, test_f1: 0.5282
 epoch: 25, train_loss: 0.8001, test_loss: 1.4110, test_f1: 0.5267
 epoch: 26, train_loss: 0.7912, test_loss: 1.2089, test_f1: 0.5557
 epoch: 27, train_loss: 0.8023, test_loss: 1.3547, test_f1: 0.4574
 epoch: 28, train_loss: 0.7965, test_loss: 1.0959, test_f1: 0.4703
 epoch: 29, train_loss: 0.7875, test_loss: 1.1712, test_f1: 0.5195
 epoch: 30, train_loss: 0.8094, test_loss: 2.0996, test_f1: 0.3866
 epoch: 31, train_loss: 0.7897, test_loss: 1.2403, test_f1: 0.5567
 epoch: 32, train_loss: 0.7976, test_loss: 1.2902, test_f1: 0.5189
 epoch: 33, train_loss: 0.7848, test_loss: 1.1569, test_f1: 0.4602
 epoch: 34, train_loss: 0.7844, test_loss: 1.3936, test_f1: 0.5565
 epoch: 35, train_loss: 0.7835, test_loss: 1.1719, test_f1: 0.5117
 epoch: 36, train_loss: 0.7707, test_loss: 1.9663, test_f1: 0.4334
 epoch: 37, train_loss: 0.7866, test_loss: 1.1709, test_f1: 0.5014
 epoch: 38, train_loss: 0.7830, test_loss: 1.6123, test_f1: 0.4975
 epoch: 39, train_loss: 0.7769, test_loss: 1.1379, test_f1: 0.5321
 epoch: 40, train_loss: 0.7770, test_loss: 0.9794, test_f1: 0.5958
 epoch: 41, train_loss: 0.7777, test_loss: 1.0398, test_f1: 0.5554
 epoch: 42, train_loss: 0.7658, test_loss: 1.2886, test_f1: 0.5382
 epoch: 43, train_loss: 0.7824, test_loss: 1.2224, test_f1: 0.4867
 epoch: 44, train_loss: 0.8244, test_loss: 2.1929, test_f1: 0.4600
 epoch: 45, train_loss: 0.7993, test_loss: 1.4905, test_f1: 0.5137
 epoch: 46, train_loss: 0.7764, test_loss: 1.1755, test_f1: 0.5297
 epoch: 47, train_loss: 0.7907, test_loss: 1.0317, test_f1: 0.5575
 epoch: 48, train_loss: 0.7610, test_loss: 1.1734, test_f1: 0.5461
 epoch: 49, train_loss: 0.7720, test_loss: 1.1484, test_f1: 0.5076
 epoch: 50, train_loss: 0.7858, test_loss: 1.2244, test_f1: 0.5344
 epoch: 51, train_loss: 0.7556, test_loss: 1.0178, test_f1: 0.6041
 epoch: 52, train_loss: 0.7390, test_loss: 1.0339, test_f1: 0.5760
 epoch: 53, train_loss: 0.7874, test_loss: 1.0532, test_f1: 0.5465
 epoch: 54, train_loss: 0.7499, test_loss: 1.0819, test_f1: 0.5617
 epoch: 55, train_loss: 0.7419, test_loss: 1.0189, test_f1: 0.5804
 epoch: 56, train_loss: 0.7226, test_loss: 1.0694, test_f1: 0.5906
 epoch: 57, train_loss: 0.7374, test_loss: 1.1131, test_f1: 0.5642
 epoch: 58, train_loss: 0.7525, test_loss: 1.2097, test_f1: 0.5575
 epoch: 59, train_loss: 0.7250, test_loss: 1.1419, test_f1: 0.5532
 epoch: 60, train_loss: 0.7186, test_loss: 1.1099, test_f1: 0.5401
 epoch: 61, train_loss: 0.7164, test_loss: 1.0288, test_f1: 0.5536
 epoch: 62, train_loss: 0.7010, test_loss: 1.1135, test_f1: 0.5461
 epoch: 63, train_loss: 0.7139, test_loss: 1.0130, test_f1: 0.5804
 epoch: 64, train_loss: 0.7188, test_loss: 1.0016, test_f1: 0.5974
 epoch: 65, train_loss: 0.7245, test_loss: 1.0189, test_f1: 0.5694
 epoch: 66, train_loss: 0.6974, test_loss: 0.9691, test_f1: 0.6223
 epoch: 67, train_loss: 0.7120, test_loss: 1.0457, test_f1: 0.5816
 epoch: 68, train_loss: 0.6920, test_loss: 1.0372, test_f1: 0.5691
 epoch: 69, train_loss: 0.6999, test_loss: 1.0102, test_f1: 0.5923
 epoch: 70, train_loss: 0.7035, test_loss: 0.9902, test_f1: 0.6088
 epoch: 71, train_loss: 0.6719, test_loss: 1.0607, test_f1: 0.5937
 epoch: 72, train_loss: 0.6761, test_loss: 0.9971, test_f1: 0.6382
 epoch: 73, train_loss: 0.6959, test_loss: 1.0398, test_f1: 0.5762
 epoch: 74, train_loss: 0.6996, test_loss: 1.0339, test_f1: 0.5703
 epoch: 75, train_loss: 0.6895, test_loss: 1.0232, test_f1: 0.5950
 epoch: 76, train_loss: 0.6919, test_loss: 1.0056, test_f1: 0.5734
 epoch: 77, train_loss: 0.6887, test_loss: 0.9829, test_f1: 0.6254
 epoch: 78, train_loss: 0.6930, test_loss: 1.2225, test_f1: 0.5596
 epoch: 79, train_loss: 0.6894, test_loss: 1.1304, test_f1: 0.5873
 epoch: 80, train_loss: 0.6960, test_loss: 0.9943, test_f1: 0.6025
 epoch: 81, train_loss: 0.6751, test_loss: 1.0992, test_f1: 0.6104
 epoch: 82, train_loss: 0.6766, test_loss: 1.1215, test_f1: 0.5892
 epoch: 83, train_loss: 0.6713, test_loss: 1.0025, test_f1: 0.6188
 epoch: 84, train_loss: 0.6807, test_loss: 1.0266, test_f1: 0.5873
 epoch: 85, train_loss: 0.6783, test_loss: 1.0039, test_f1: 0.6077
 epoch: 86, train_loss: 0.6930, test_loss: 1.0226, test_f1: 0.5927
 epoch: 87, train_loss: 0.6952, test_loss: 1.1663, test_f1: 0.5483
 epoch: 88, train_loss: 0.6708, test_loss: 1.0582, test_f1: 0.6042
 epoch: 89, train_loss: 0.6775, test_loss: 1.0464, test_f1: 0.5987
 epoch: 90, train_loss: 0.6724, test_loss: 1.0671, test_f1: 0.6070
 epoch: 91, train_loss: 0.6761, test_loss: 1.0147, test_f1: 0.6140
 epoch: 92, train_loss: 0.6645, test_loss: 1.1917, test_f1: 0.5695
 epoch: 93, train_loss: 0.6571, test_loss: 1.0401, test_f1: 0.5961
 epoch: 94, train_loss: 0.6743, test_loss: 1.0270, test_f1: 0.6080
 epoch: 95, train_loss: 0.6656, test_loss: 1.1622, test_f1: 0.5655
 epoch: 96, train_loss: 0.6649, test_loss: 1.1173, test_f1: 0.5949
 epoch: 97, train_loss: 0.6684, test_loss: 1.1894, test_f1: 0.5812
 epoch: 98, train_loss: 0.6645, test_loss: 1.0999, test_f1: 0.5887
 epoch: 99, train_loss: 0.6601, test_loss: 1.3105, test_f1: 0.5177
##################ITERATION #8 ****************************************
 epoch: 0, train_loss: 1.2509, test_loss: 1.3164, test_f1: 0.2429
 epoch: 1, train_loss: 1.0570, test_loss: 1.1087, test_f1: 0.4905
 epoch: 2, train_loss: 0.9946, test_loss: 1.0961, test_f1: 0.4209
 epoch: 3, train_loss: 0.9829, test_loss: 0.9989, test_f1: 0.5314
 epoch: 4, train_loss: 0.9520, test_loss: 1.0342, test_f1: 0.5246
 epoch: 5, train_loss: 0.9435, test_loss: 1.0106, test_f1: 0.5359
 epoch: 6, train_loss: 0.9357, test_loss: 0.9694, test_f1: 0.5340
 epoch: 7, train_loss: 0.9213, test_loss: 0.9735, test_f1: 0.5736
 epoch: 8, train_loss: 0.8909, test_loss: 1.0321, test_f1: 0.5190
 epoch: 9, train_loss: 0.9061, test_loss: 0.9783, test_f1: 0.5519
 epoch: 10, train_loss: 0.8790, test_loss: 1.0230, test_f1: 0.5340
 epoch: 11, train_loss: 0.8757, test_loss: 0.9794, test_f1: 0.5524
 epoch: 12, train_loss: 0.8609, test_loss: 0.9994, test_f1: 0.5476
 epoch: 13, train_loss: 0.8690, test_loss: 1.0349, test_f1: 0.5501
 epoch: 14, train_loss: 0.8791, test_loss: 1.0418, test_f1: 0.5459
 epoch: 15, train_loss: 0.8596, test_loss: 1.0543, test_f1: 0.5234
 epoch: 16, train_loss: 0.8465, test_loss: 1.0384, test_f1: 0.5245
 epoch: 17, train_loss: 0.8323, test_loss: 1.1173, test_f1: 0.5081
 epoch: 18, train_loss: 0.8542, test_loss: 1.4354, test_f1: 0.4858
 epoch: 19, train_loss: 0.8351, test_loss: 1.0449, test_f1: 0.5420
 epoch: 20, train_loss: 0.8257, test_loss: 1.1148, test_f1: 0.5459
 epoch: 21, train_loss: 0.8121, test_loss: 1.2265, test_f1: 0.5265
 epoch: 22, train_loss: 0.8787, test_loss: 1.0708, test_f1: 0.5226
 epoch: 23, train_loss: 0.8312, test_loss: 1.0889, test_f1: 0.5458
 epoch: 24, train_loss: 0.8081, test_loss: 1.1270, test_f1: 0.5543
 epoch: 25, train_loss: 0.8274, test_loss: 1.0617, test_f1: 0.5820
 epoch: 26, train_loss: 0.8236, test_loss: 1.1636, test_f1: 0.5366
 epoch: 27, train_loss: 0.8206, test_loss: 1.3050, test_f1: 0.4843
 epoch: 28, train_loss: 0.8011, test_loss: 1.1373, test_f1: 0.5471
 epoch: 29, train_loss: 0.8155, test_loss: 1.0413, test_f1: 0.5637
 epoch: 30, train_loss: 0.8122, test_loss: 1.0963, test_f1: 0.5541
 epoch: 31, train_loss: 0.8372, test_loss: 1.1072, test_f1: 0.5153
 epoch: 32, train_loss: 0.7906, test_loss: 1.1619, test_f1: 0.5426
 epoch: 33, train_loss: 0.7864, test_loss: 1.1079, test_f1: 0.5507
 epoch: 34, train_loss: 0.8186, test_loss: 1.0636, test_f1: 0.5198
 epoch: 35, train_loss: 0.8065, test_loss: 1.1860, test_f1: 0.5234
 epoch: 36, train_loss: 0.7886, test_loss: 1.0088, test_f1: 0.5883
 epoch: 37, train_loss: 0.7951, test_loss: 1.1243, test_f1: 0.5473
 epoch: 38, train_loss: 0.7916, test_loss: 1.0565, test_f1: 0.5494
 epoch: 39, train_loss: 0.8153, test_loss: 0.9916, test_f1: 0.5858
 epoch: 40, train_loss: 0.7856, test_loss: 1.1347, test_f1: 0.4883
 epoch: 41, train_loss: 0.7733, test_loss: 1.3668, test_f1: 0.5224
 epoch: 42, train_loss: 0.7774, test_loss: 1.2511, test_f1: 0.5231
 epoch: 43, train_loss: 0.7712, test_loss: 1.3687, test_f1: 0.5666
 epoch: 44, train_loss: 0.7584, test_loss: 1.0058, test_f1: 0.5803
 epoch: 45, train_loss: 0.7669, test_loss: 1.3396, test_f1: 0.5513
 epoch: 46, train_loss: 0.7501, test_loss: 1.0734, test_f1: 0.5478
 epoch: 47, train_loss: 0.7623, test_loss: 1.2843, test_f1: 0.4977
 epoch: 48, train_loss: 0.7918, test_loss: 1.5917, test_f1: 0.4840
 epoch: 49, train_loss: 0.8376, test_loss: 1.7248, test_f1: 0.5105
 epoch: 50, train_loss: 0.7927, test_loss: 1.2179, test_f1: 0.4687
 epoch: 51, train_loss: 0.7700, test_loss: 1.0813, test_f1: 0.5888
 epoch: 52, train_loss: 0.7521, test_loss: 1.0679, test_f1: 0.5620
 epoch: 53, train_loss: 0.7328, test_loss: 1.3756, test_f1: 0.5908
 epoch: 54, train_loss: 0.7438, test_loss: 1.1348, test_f1: 0.5597
 epoch: 55, train_loss: 0.7450, test_loss: 1.1309, test_f1: 0.5789
 epoch: 56, train_loss: 0.7432, test_loss: 1.1445, test_f1: 0.5404
 epoch: 57, train_loss: 0.7246, test_loss: 1.1459, test_f1: 0.5679
 epoch: 58, train_loss: 0.7185, test_loss: 1.2670, test_f1: 0.5262
 epoch: 59, train_loss: 0.7144, test_loss: 1.2296, test_f1: 0.5783
 epoch: 60, train_loss: 0.7236, test_loss: 1.2104, test_f1: 0.5615
 epoch: 61, train_loss: 0.7018, test_loss: 1.1557, test_f1: 0.5883
 epoch: 62, train_loss: 0.7092, test_loss: 1.2538, test_f1: 0.5560
 epoch: 63, train_loss: 0.6997, test_loss: 1.1597, test_f1: 0.5621
 epoch: 64, train_loss: 0.6955, test_loss: 1.2779, test_f1: 0.5508
 epoch: 65, train_loss: 0.6856, test_loss: 1.0927, test_f1: 0.5889
 epoch: 66, train_loss: 0.6963, test_loss: 1.1693, test_f1: 0.5647
 epoch: 67, train_loss: 0.6798, test_loss: 1.1696, test_f1: 0.5803
 epoch: 68, train_loss: 0.7081, test_loss: 1.1441, test_f1: 0.5678
 epoch: 69, train_loss: 0.7376, test_loss: 1.2004, test_f1: 0.5775
 epoch: 70, train_loss: 0.7164, test_loss: 1.3251, test_f1: 0.5260
 epoch: 71, train_loss: 0.7087, test_loss: 1.4752, test_f1: 0.5424
 epoch: 72, train_loss: 0.6798, test_loss: 1.1890, test_f1: 0.5730
 epoch: 73, train_loss: 0.6703, test_loss: 1.2126, test_f1: 0.5154
 epoch: 74, train_loss: 0.6732, test_loss: 1.2930, test_f1: 0.5436
 epoch: 75, train_loss: 0.6778, test_loss: 1.2245, test_f1: 0.5304
 epoch: 76, train_loss: 0.6702, test_loss: 1.2593, test_f1: 0.5859
 epoch: 77, train_loss: 0.6793, test_loss: 1.1466, test_f1: 0.5260
 epoch: 78, train_loss: 0.6828, test_loss: 1.2406, test_f1: 0.5619
 epoch: 79, train_loss: 0.6774, test_loss: 1.1441, test_f1: 0.5635
 epoch: 80, train_loss: 0.6750, test_loss: 1.1093, test_f1: 0.5788
 epoch: 81, train_loss: 0.6811, test_loss: 1.2129, test_f1: 0.5467
 epoch: 82, train_loss: 0.6836, test_loss: 1.1152, test_f1: 0.5676
 epoch: 83, train_loss: 0.6432, test_loss: 1.2750, test_f1: 0.5612
 epoch: 84, train_loss: 0.6825, test_loss: 1.1408, test_f1: 0.5622
 epoch: 85, train_loss: 0.6837, test_loss: 1.2863, test_f1: 0.5599
 epoch: 86, train_loss: 0.6687, test_loss: 1.1703, test_f1: 0.6002
 epoch: 87, train_loss: 0.6640, test_loss: 1.2005, test_f1: 0.5839
 epoch: 88, train_loss: 0.6561, test_loss: 1.3748, test_f1: 0.5562
 epoch: 89, train_loss: 0.6348, test_loss: 1.1275, test_f1: 0.5933
 epoch: 90, train_loss: 0.6602, test_loss: 1.4294, test_f1: 0.5390
 epoch: 91, train_loss: 0.6565, test_loss: 1.3456, test_f1: 0.5249
 epoch: 92, train_loss: 0.6516, test_loss: 1.3564, test_f1: 0.5330
 epoch: 93, train_loss: 0.6438, test_loss: 1.2060, test_f1: 0.5455
 epoch: 94, train_loss: 0.6373, test_loss: 1.4487, test_f1: 0.5227
 epoch: 95, train_loss: 0.6373, test_loss: 1.3524, test_f1: 0.5855
 epoch: 96, train_loss: 0.6549, test_loss: 1.2340, test_f1: 0.5584
 epoch: 97, train_loss: 0.6554, test_loss: 1.1465, test_f1: 0.5729
 epoch: 98, train_loss: 0.6540, test_loss: 1.3474, test_f1: 0.5738
 epoch: 99, train_loss: 0.6714, test_loss: 1.2288, test_f1: 0.5493
##################ITERATION #9 ****************************************
 epoch: 0, train_loss: 1.1839, test_loss: 1.2339, test_f1: 0.2889
 epoch: 1, train_loss: 1.0454, test_loss: 1.1553, test_f1: 0.4592
 epoch: 2, train_loss: 1.0175, test_loss: 1.1029, test_f1: 0.4705
 epoch: 3, train_loss: 1.0008, test_loss: 1.0852, test_f1: 0.4965
 epoch: 4, train_loss: 0.9619, test_loss: 1.1254, test_f1: 0.4453
 epoch: 5, train_loss: 0.9484, test_loss: 1.0000, test_f1: 0.5097
 epoch: 6, train_loss: 0.9404, test_loss: 1.0308, test_f1: 0.4803
 epoch: 7, train_loss: 0.9243, test_loss: 0.9999, test_f1: 0.5513
 epoch: 8, train_loss: 0.9110, test_loss: 1.0844, test_f1: 0.4570
 epoch: 9, train_loss: 0.9073, test_loss: 0.9814, test_f1: 0.5404
 epoch: 10, train_loss: 0.9002, test_loss: 1.0179, test_f1: 0.5295
 epoch: 11, train_loss: 0.8719, test_loss: 0.9751, test_f1: 0.5765
 epoch: 12, train_loss: 0.8911, test_loss: 0.9712, test_f1: 0.5226
 epoch: 13, train_loss: 0.8888, test_loss: 1.0514, test_f1: 0.5446
 epoch: 14, train_loss: 0.8656, test_loss: 0.9588, test_f1: 0.5695
 epoch: 15, train_loss: 0.8433, test_loss: 1.0082, test_f1: 0.4423
 epoch: 16, train_loss: 0.8477, test_loss: 0.9988, test_f1: 0.5427
 epoch: 17, train_loss: 0.8524, test_loss: 0.9921, test_f1: 0.5343
 epoch: 18, train_loss: 0.8312, test_loss: 1.0415, test_f1: 0.5803
 epoch: 19, train_loss: 0.8188, test_loss: 1.0025, test_f1: 0.5824
 epoch: 20, train_loss: 0.8238, test_loss: 0.9878, test_f1: 0.5491
 epoch: 21, train_loss: 0.7970, test_loss: 1.0408, test_f1: 0.5400
 epoch: 22, train_loss: 0.7988, test_loss: 1.0657, test_f1: 0.5008
 epoch: 23, train_loss: 0.8248, test_loss: 1.0032, test_f1: 0.5461
 epoch: 24, train_loss: 0.8221, test_loss: 1.0463, test_f1: 0.4424
 epoch: 25, train_loss: 0.7938, test_loss: 1.1536, test_f1: 0.5038
 epoch: 26, train_loss: 0.8317, test_loss: 0.9845, test_f1: 0.5497
 epoch: 27, train_loss: 0.8138, test_loss: 1.1243, test_f1: 0.4179
 epoch: 28, train_loss: 0.7965, test_loss: 1.1150, test_f1: 0.4947
 epoch: 29, train_loss: 0.8083, test_loss: 1.1786, test_f1: 0.4915
 epoch: 30, train_loss: 0.8128, test_loss: 1.2311, test_f1: 0.4949
 epoch: 31, train_loss: 0.7796, test_loss: 0.9856, test_f1: 0.5572
 epoch: 32, train_loss: 0.7674, test_loss: 0.9645, test_f1: 0.5980
 epoch: 33, train_loss: 0.7870, test_loss: 1.0012, test_f1: 0.5831
 epoch: 34, train_loss: 0.7864, test_loss: 1.0140, test_f1: 0.5521
 epoch: 35, train_loss: 0.7701, test_loss: 0.9437, test_f1: 0.5762
 epoch: 36, train_loss: 0.7557, test_loss: 0.9850, test_f1: 0.5786
 epoch: 37, train_loss: 0.7666, test_loss: 0.9695, test_f1: 0.5804
 epoch: 38, train_loss: 0.7464, test_loss: 1.0116, test_f1: 0.5942
 epoch: 39, train_loss: 0.7805, test_loss: 1.0545, test_f1: 0.5677
 epoch: 40, train_loss: 0.7438, test_loss: 1.2717, test_f1: 0.4865
 epoch: 41, train_loss: 0.7812, test_loss: 0.9884, test_f1: 0.5910
 epoch: 42, train_loss: 0.7658, test_loss: 0.9683, test_f1: 0.5728
 epoch: 43, train_loss: 0.7419, test_loss: 0.9978, test_f1: 0.6067
 epoch: 44, train_loss: 0.7473, test_loss: 1.0025, test_f1: 0.6068
 epoch: 45, train_loss: 0.7382, test_loss: 1.0510, test_f1: 0.5336
 epoch: 46, train_loss: 0.7351, test_loss: 1.0788, test_f1: 0.5529
 epoch: 47, train_loss: 0.7418, test_loss: 1.1110, test_f1: 0.5754
 epoch: 48, train_loss: 0.7189, test_loss: 1.1384, test_f1: 0.5308
 epoch: 49, train_loss: 0.7399, test_loss: 1.3571, test_f1: 0.5181
 epoch: 50, train_loss: 0.7706, test_loss: 1.0539, test_f1: 0.5816
 epoch: 51, train_loss: 0.7140, test_loss: 0.9810, test_f1: 0.6333
 epoch: 52, train_loss: 0.7164, test_loss: 0.9440, test_f1: 0.6463
 epoch: 53, train_loss: 0.7048, test_loss: 0.9677, test_f1: 0.6153
 epoch: 54, train_loss: 0.6910, test_loss: 0.9793, test_f1: 0.6091
 epoch: 55, train_loss: 0.6728, test_loss: 1.0387, test_f1: 0.5815
 epoch: 56, train_loss: 0.6755, test_loss: 1.1006, test_f1: 0.5525
 epoch: 57, train_loss: 0.6852, test_loss: 0.9947, test_f1: 0.6147
 epoch: 58, train_loss: 0.6744, test_loss: 1.1366, test_f1: 0.5383
 epoch: 59, train_loss: 0.6740, test_loss: 1.0733, test_f1: 0.5697
 epoch: 60, train_loss: 0.6877, test_loss: 1.2103, test_f1: 0.5282
 epoch: 61, train_loss: 0.6821, test_loss: 1.0429, test_f1: 0.6426
 epoch: 62, train_loss: 0.6697, test_loss: 1.1094, test_f1: 0.6180
 epoch: 63, train_loss: 0.7167, test_loss: 1.1369, test_f1: 0.5642
 epoch: 64, train_loss: 0.7162, test_loss: 1.1382, test_f1: 0.5285
 epoch: 65, train_loss: 0.6692, test_loss: 1.1291, test_f1: 0.6084
 epoch: 66, train_loss: 0.6888, test_loss: 1.0359, test_f1: 0.6066
 epoch: 67, train_loss: 0.6652, test_loss: 1.0388, test_f1: 0.6167
 epoch: 68, train_loss: 0.6653, test_loss: 1.0458, test_f1: 0.6035
 epoch: 69, train_loss: 0.6438, test_loss: 0.9774, test_f1: 0.6294
 epoch: 70, train_loss: 0.6663, test_loss: 1.0228, test_f1: 0.6035
 epoch: 71, train_loss: 0.6835, test_loss: 1.0203, test_f1: 0.5990
 epoch: 72, train_loss: 0.6759, test_loss: 1.3292, test_f1: 0.5355
 epoch: 73, train_loss: 0.6618, test_loss: 1.0921, test_f1: 0.5926
 epoch: 74, train_loss: 0.6583, test_loss: 1.1894, test_f1: 0.5776
 epoch: 75, train_loss: 0.6655, test_loss: 1.0846, test_f1: 0.6150
 epoch: 76, train_loss: 0.6580, test_loss: 1.0122, test_f1: 0.6267
 epoch: 77, train_loss: 0.6509, test_loss: 1.0372, test_f1: 0.6068
 epoch: 78, train_loss: 0.6436, test_loss: 1.0427, test_f1: 0.6078
 epoch: 79, train_loss: 0.6461, test_loss: 1.0581, test_f1: 0.6107
 epoch: 80, train_loss: 0.6454, test_loss: 1.1409, test_f1: 0.5998
 epoch: 81, train_loss: 0.6301, test_loss: 1.0414, test_f1: 0.5865
 epoch: 82, train_loss: 0.6201, test_loss: 1.0521, test_f1: 0.6031
 epoch: 83, train_loss: 0.6429, test_loss: 1.3148, test_f1: 0.5420
 epoch: 84, train_loss: 0.6288, test_loss: 1.0901, test_f1: 0.6354
 epoch: 85, train_loss: 0.6503, test_loss: 1.0995, test_f1: 0.6354
 epoch: 86, train_loss: 0.6646, test_loss: 1.0128, test_f1: 0.6185
 epoch: 87, train_loss: 0.6475, test_loss: 1.2091, test_f1: 0.6126
 epoch: 88, train_loss: 0.6378, test_loss: 1.1023, test_f1: 0.6043
 epoch: 89, train_loss: 0.6277, test_loss: 1.3546, test_f1: 0.5377
 epoch: 90, train_loss: 0.6408, test_loss: 1.0219, test_f1: 0.6354
 epoch: 91, train_loss: 0.6204, test_loss: 1.2128, test_f1: 0.5644
 epoch: 92, train_loss: 0.6360, test_loss: 1.1840, test_f1: 0.5649
 epoch: 93, train_loss: 0.6089, test_loss: 1.2427, test_f1: 0.5462
 epoch: 94, train_loss: 0.6037, test_loss: 1.2005, test_f1: 0.6349
 epoch: 95, train_loss: 0.6095, test_loss: 1.0633, test_f1: 0.6333
 epoch: 96, train_loss: 0.6282, test_loss: 1.1085, test_f1: 0.6397
 epoch: 97, train_loss: 0.6292, test_loss: 1.2226, test_f1: 0.5797
 epoch: 98, train_loss: 0.6373, test_loss: 1.1296, test_f1: 0.6234
 epoch: 99, train_loss: 0.6141, test_loss: 1.0932, test_f1: 0.6343

Training completed in 523.04 seconds
Best F1: 0.7010 at epoch 94
Mean F1 across iterations: 0.6519  0.0274
========================FINAL RESULTS================================
FEGIN weighted F1: 0.7010  0.0274
python main.py --data ltspice_demos --representation component_pin_net --model FEGIN --layers 6 --hiddens 16 --batch_size 64 --lr 0.01 --emb_size 512 --epochs 100 --save_appendix component_pin_net_L6_H16_BS64_LR0.01_E512 --no_val
-----



STDERR:
  File "main.py", line 370, in <module>
    main()
  File "main.py", line 254, in main
    dataset = dataset_class(
  File "/home/philip/projects/ltspice_examples_code_repo/Circuit-Completion-Using-GNNs/component_classification_with_link_prediction_head/evaluation/FEGIN/kernel/circuit_datasets.py", line 15, in __init__
    self.data, self.slices = torch.load(self.processed_paths[0])
  File "/home/philip/.local/lib/python3.8/site-packages/torch/serialization.py", line 1040, in load
    warnings.warn(
  File "/usr/lib/python3.8/warnings.py", line 109, in _showwarnmsg
    sw(msg.message, msg.category, msg.filename, msg.lineno,
  File "main.py", line 47, in warn_with_traceback
    traceback.print_stack(file=log)
/home/philip/projects/ltspice_examples_code_repo/Circuit-Completion-Using-GNNs/component_classification_with_link_prediction_head/evaluation/FEGIN/kernel/circuit_datasets.py:15: FutureWarning: You are using `torch.load` with `weights_only=False` (the current default value), which uses the default pickle module implicitly. It is possible to construct malicious pickle data which will execute arbitrary code during unpickling (See https://github.com/pytorch/pytorch/blob/main/SECURITY.md#untrusted-models for more details). In a future release, the default value for `weights_only` will be flipped to `True`. This limits the functions that could be executed during unpickling. Arbitrary objects will no longer be allowed to be loaded via this mode unless they are explicitly allowlisted by the user via `torch.serialization.add_safe_globals`. We recommend you start setting `weights_only=True` for any use case where you don't have full control of the loaded file. Please open an issue on GitHub for any issues related to this experimental feature.
  self.data, self.slices = torch.load(self.processed_paths[0])
