STDOUT:
Results will be saved in /home/philip/projects/ltspice_examples_code_repo/Circuit-Completion-Using-GNNs/component_classification_with_link_prediction_head/evaluation/FEGIN/results/model_FEGIN_dataset_ltspice_examples
Command line input: python main.py --data ltspice_examples --representation component_component --model FEGIN --layers 3 --hiddens 16 --batch_size 64 --lr 0.0001 --emb_size 512 --epochs 100 --save_appendix component_component_L3_H16_BS64_LR0.0001_E512 --no_val
 is saved.
-----
ltspice_examples - FEGIN
Using 3 layers, 16 hidden units, h = 2
Loading component_component representation dataset
ENTERED
Training FEGIN on component_component representation
Train: 3556, Test: 845
##################ITERATION #0 ****************************************
 epoch: 0, train_loss: 1.3631, test_loss: 1.3546, test_f1: 0.2629
 epoch: 1, train_loss: 1.3561, test_loss: 1.3489, test_f1: 0.2356
 epoch: 2, train_loss: 1.3506, test_loss: 1.3433, test_f1: 0.2276
 epoch: 3, train_loss: 1.3459, test_loss: 1.3382, test_f1: 0.2274
 epoch: 4, train_loss: 1.3403, test_loss: 1.3331, test_f1: 0.2274
 epoch: 5, train_loss: 1.3341, test_loss: 1.3292, test_f1: 0.2274
 epoch: 6, train_loss: 1.3291, test_loss: 1.3228, test_f1: 0.2274
 epoch: 7, train_loss: 1.3247, test_loss: 1.3169, test_f1: 0.2274
 epoch: 8, train_loss: 1.3190, test_loss: 1.3135, test_f1: 0.2274
 epoch: 9, train_loss: 1.3145, test_loss: 1.3084, test_f1: 0.2274
 epoch: 10, train_loss: 1.3071, test_loss: 1.3034, test_f1: 0.2274
 epoch: 11, train_loss: 1.3053, test_loss: 1.2995, test_f1: 0.2274
 epoch: 12, train_loss: 1.2980, test_loss: 1.2961, test_f1: 0.2274
 epoch: 13, train_loss: 1.2967, test_loss: 1.2925, test_f1: 0.2274
 epoch: 14, train_loss: 1.2918, test_loss: 1.2902, test_f1: 0.2274
 epoch: 15, train_loss: 1.2919, test_loss: 1.2863, test_f1: 0.2274
 epoch: 16, train_loss: 1.2880, test_loss: 1.2844, test_f1: 0.2274
 epoch: 17, train_loss: 1.2853, test_loss: 1.2816, test_f1: 0.2274
 epoch: 18, train_loss: 1.2825, test_loss: 1.2807, test_f1: 0.2274
 epoch: 19, train_loss: 1.2773, test_loss: 1.2785, test_f1: 0.2274
 epoch: 20, train_loss: 1.2778, test_loss: 1.2768, test_f1: 0.2274
 epoch: 21, train_loss: 1.2691, test_loss: 1.2745, test_f1: 0.2274
 epoch: 22, train_loss: 1.2781, test_loss: 1.2719, test_f1: 0.2274
 epoch: 23, train_loss: 1.2731, test_loss: 1.2705, test_f1: 0.2274
 epoch: 24, train_loss: 1.2696, test_loss: 1.2693, test_f1: 0.2274
 epoch: 25, train_loss: 1.2661, test_loss: 1.2660, test_f1: 0.2274
 epoch: 26, train_loss: 1.2654, test_loss: 1.2642, test_f1: 0.2274
 epoch: 27, train_loss: 1.2594, test_loss: 1.2625, test_f1: 0.2274
 epoch: 28, train_loss: 1.2600, test_loss: 1.2600, test_f1: 0.2274
 epoch: 29, train_loss: 1.2571, test_loss: 1.2561, test_f1: 0.2274
 epoch: 30, train_loss: 1.2523, test_loss: 1.2543, test_f1: 0.2274
 epoch: 31, train_loss: 1.2479, test_loss: 1.2523, test_f1: 0.2274
 epoch: 32, train_loss: 1.2501, test_loss: 1.2502, test_f1: 0.2274
 epoch: 33, train_loss: 1.2462, test_loss: 1.2465, test_f1: 0.2477
 epoch: 34, train_loss: 1.2462, test_loss: 1.2464, test_f1: 0.2684
 epoch: 35, train_loss: 1.2441, test_loss: 1.2415, test_f1: 0.3080
 epoch: 36, train_loss: 1.2406, test_loss: 1.2398, test_f1: 0.3266
 epoch: 37, train_loss: 1.2381, test_loss: 1.2372, test_f1: 0.3358
 epoch: 38, train_loss: 1.2381, test_loss: 1.2338, test_f1: 0.3362
 epoch: 39, train_loss: 1.2330, test_loss: 1.2311, test_f1: 0.3418
 epoch: 40, train_loss: 1.2321, test_loss: 1.2282, test_f1: 0.3477
 epoch: 41, train_loss: 1.2295, test_loss: 1.2279, test_f1: 0.3559
 epoch: 42, train_loss: 1.2321, test_loss: 1.2240, test_f1: 0.3545
 epoch: 43, train_loss: 1.2207, test_loss: 1.2221, test_f1: 0.3572
 epoch: 44, train_loss: 1.2267, test_loss: 1.2209, test_f1: 0.3508
 epoch: 45, train_loss: 1.2186, test_loss: 1.2177, test_f1: 0.3498
 epoch: 46, train_loss: 1.2197, test_loss: 1.2155, test_f1: 0.3480
 epoch: 47, train_loss: 1.2255, test_loss: 1.2114, test_f1: 0.3465
 epoch: 48, train_loss: 1.2182, test_loss: 1.2118, test_f1: 0.3481
 epoch: 49, train_loss: 1.2161, test_loss: 1.2106, test_f1: 0.3533
 epoch: 50, train_loss: 1.2128, test_loss: 1.2075, test_f1: 0.3471
 epoch: 51, train_loss: 1.2090, test_loss: 1.2055, test_f1: 0.3458
 epoch: 52, train_loss: 1.2099, test_loss: 1.2067, test_f1: 0.3485
 epoch: 53, train_loss: 1.2123, test_loss: 1.2058, test_f1: 0.3422
 epoch: 54, train_loss: 1.2188, test_loss: 1.2029, test_f1: 0.3460
 epoch: 55, train_loss: 1.2103, test_loss: 1.2024, test_f1: 0.3422
 epoch: 56, train_loss: 1.2062, test_loss: 1.2025, test_f1: 0.3485
 epoch: 57, train_loss: 1.2095, test_loss: 1.2019, test_f1: 0.3412
 epoch: 58, train_loss: 1.2115, test_loss: 1.2003, test_f1: 0.3439
 epoch: 59, train_loss: 1.2092, test_loss: 1.2007, test_f1: 0.3418
 epoch: 60, train_loss: 1.2076, test_loss: 1.1998, test_f1: 0.3477
 epoch: 61, train_loss: 1.2078, test_loss: 1.1978, test_f1: 0.3475
 epoch: 62, train_loss: 1.2059, test_loss: 1.1976, test_f1: 0.3438
 epoch: 63, train_loss: 1.2033, test_loss: 1.1981, test_f1: 0.3418
 epoch: 64, train_loss: 1.2075, test_loss: 1.1965, test_f1: 0.3438
 epoch: 65, train_loss: 1.2046, test_loss: 1.1968, test_f1: 0.3447
 epoch: 66, train_loss: 1.2037, test_loss: 1.1943, test_f1: 0.3455
 epoch: 67, train_loss: 1.1988, test_loss: 1.1930, test_f1: 0.3447
 epoch: 68, train_loss: 1.1987, test_loss: 1.1934, test_f1: 0.3402
 epoch: 69, train_loss: 1.2036, test_loss: 1.1927, test_f1: 0.3454
 epoch: 70, train_loss: 1.2048, test_loss: 1.1918, test_f1: 0.3493
 epoch: 71, train_loss: 1.2008, test_loss: 1.1922, test_f1: 0.3486
 epoch: 72, train_loss: 1.1969, test_loss: 1.1911, test_f1: 0.3474
 epoch: 73, train_loss: 1.1986, test_loss: 1.1913, test_f1: 0.3506
 epoch: 74, train_loss: 1.1956, test_loss: 1.1906, test_f1: 0.3464
 epoch: 75, train_loss: 1.1957, test_loss: 1.1895, test_f1: 0.3483
 epoch: 76, train_loss: 1.2005, test_loss: 1.1896, test_f1: 0.3504
 epoch: 77, train_loss: 1.1911, test_loss: 1.1892, test_f1: 0.3481
 epoch: 78, train_loss: 1.1957, test_loss: 1.1869, test_f1: 0.3470
 epoch: 79, train_loss: 1.1969, test_loss: 1.1888, test_f1: 0.3482
 epoch: 80, train_loss: 1.1972, test_loss: 1.1886, test_f1: 0.3474
 epoch: 81, train_loss: 1.1927, test_loss: 1.1862, test_f1: 0.3502
 epoch: 82, train_loss: 1.1913, test_loss: 1.1873, test_f1: 0.3450
 epoch: 83, train_loss: 1.1878, test_loss: 1.1865, test_f1: 0.3490
 epoch: 84, train_loss: 1.1924, test_loss: 1.1856, test_f1: 0.3447
 epoch: 85, train_loss: 1.1874, test_loss: 1.1857, test_f1: 0.3474
 epoch: 86, train_loss: 1.1949, test_loss: 1.1850, test_f1: 0.3479
 epoch: 87, train_loss: 1.1892, test_loss: 1.1850, test_f1: 0.3458
 epoch: 88, train_loss: 1.1860, test_loss: 1.1856, test_f1: 0.3431
 epoch: 89, train_loss: 1.1872, test_loss: 1.1842, test_f1: 0.3423
 epoch: 90, train_loss: 1.1878, test_loss: 1.1842, test_f1: 0.3424
 epoch: 91, train_loss: 1.1847, test_loss: 1.1809, test_f1: 0.3491
 epoch: 92, train_loss: 1.1791, test_loss: 1.1834, test_f1: 0.3467
 epoch: 93, train_loss: 1.1876, test_loss: 1.1820, test_f1: 0.3450
 epoch: 94, train_loss: 1.1856, test_loss: 1.1820, test_f1: 0.3384
 epoch: 95, train_loss: 1.1849, test_loss: 1.1805, test_f1: 0.3488
 epoch: 96, train_loss: 1.1840, test_loss: 1.1785, test_f1: 0.3474
 epoch: 97, train_loss: 1.1841, test_loss: 1.1792, test_f1: 0.3456
 epoch: 98, train_loss: 1.1793, test_loss: 1.1794, test_f1: 0.3424
 epoch: 99, train_loss: 1.1801, test_loss: 1.1790, test_f1: 0.3469
##################ITERATION #1 ****************************************
 epoch: 0, train_loss: 1.3205, test_loss: 1.3224, test_f1: 0.2274
 epoch: 1, train_loss: 1.3143, test_loss: 1.3166, test_f1: 0.2274
 epoch: 2, train_loss: 1.3087, test_loss: 1.3122, test_f1: 0.2274
 epoch: 3, train_loss: 1.3050, test_loss: 1.3069, test_f1: 0.2274
 epoch: 4, train_loss: 1.3017, test_loss: 1.3028, test_f1: 0.2274
 epoch: 5, train_loss: 1.2991, test_loss: 1.3001, test_f1: 0.2274
 epoch: 6, train_loss: 1.2969, test_loss: 1.2963, test_f1: 0.2274
 epoch: 7, train_loss: 1.2928, test_loss: 1.2935, test_f1: 0.2274
 epoch: 8, train_loss: 1.2920, test_loss: 1.2897, test_f1: 0.2274
 epoch: 9, train_loss: 1.2868, test_loss: 1.2859, test_f1: 0.2274
 epoch: 10, train_loss: 1.2864, test_loss: 1.2825, test_f1: 0.2274
 epoch: 11, train_loss: 1.2826, test_loss: 1.2805, test_f1: 0.2274
 epoch: 12, train_loss: 1.2804, test_loss: 1.2782, test_f1: 0.2274
 epoch: 13, train_loss: 1.2787, test_loss: 1.2759, test_f1: 0.2274
 epoch: 14, train_loss: 1.2774, test_loss: 1.2724, test_f1: 0.2274
 epoch: 15, train_loss: 1.2751, test_loss: 1.2675, test_f1: 0.2264
 epoch: 16, train_loss: 1.2727, test_loss: 1.2661, test_f1: 0.2274
 epoch: 17, train_loss: 1.2725, test_loss: 1.2632, test_f1: 0.2390
 epoch: 18, train_loss: 1.2704, test_loss: 1.2615, test_f1: 0.2264
 epoch: 19, train_loss: 1.2673, test_loss: 1.2574, test_f1: 0.2555
 epoch: 20, train_loss: 1.2675, test_loss: 1.2545, test_f1: 0.2555
 epoch: 21, train_loss: 1.2653, test_loss: 1.2512, test_f1: 0.2555
 epoch: 22, train_loss: 1.2598, test_loss: 1.2484, test_f1: 0.2555
 epoch: 23, train_loss: 1.2621, test_loss: 1.2449, test_f1: 0.2555
 epoch: 24, train_loss: 1.2592, test_loss: 1.2427, test_f1: 0.2555
 epoch: 25, train_loss: 1.2569, test_loss: 1.2411, test_f1: 0.2555
 epoch: 26, train_loss: 1.2496, test_loss: 1.2363, test_f1: 0.2690
 epoch: 27, train_loss: 1.2511, test_loss: 1.2338, test_f1: 0.2602
 epoch: 28, train_loss: 1.2466, test_loss: 1.2331, test_f1: 0.2601
 epoch: 29, train_loss: 1.2481, test_loss: 1.2286, test_f1: 0.2712
 epoch: 30, train_loss: 1.2484, test_loss: 1.2268, test_f1: 0.2728
 epoch: 31, train_loss: 1.2415, test_loss: 1.2250, test_f1: 0.2645
 epoch: 32, train_loss: 1.2432, test_loss: 1.2223, test_f1: 0.2836
 epoch: 33, train_loss: 1.2423, test_loss: 1.2218, test_f1: 0.2803
 epoch: 34, train_loss: 1.2398, test_loss: 1.2180, test_f1: 0.2862
 epoch: 35, train_loss: 1.2372, test_loss: 1.2171, test_f1: 0.3032
 epoch: 36, train_loss: 1.2372, test_loss: 1.2153, test_f1: 0.3036
 epoch: 37, train_loss: 1.2340, test_loss: 1.2131, test_f1: 0.3043
 epoch: 38, train_loss: 1.2356, test_loss: 1.2110, test_f1: 0.3166
 epoch: 39, train_loss: 1.2343, test_loss: 1.2070, test_f1: 0.3253
 epoch: 40, train_loss: 1.2312, test_loss: 1.2070, test_f1: 0.3244
 epoch: 41, train_loss: 1.2324, test_loss: 1.2059, test_f1: 0.3276
 epoch: 42, train_loss: 1.2347, test_loss: 1.2032, test_f1: 0.3279
 epoch: 43, train_loss: 1.2286, test_loss: 1.2022, test_f1: 0.3322
 epoch: 44, train_loss: 1.2275, test_loss: 1.2029, test_f1: 0.3239
 epoch: 45, train_loss: 1.2277, test_loss: 1.1998, test_f1: 0.3309
 epoch: 46, train_loss: 1.2250, test_loss: 1.2004, test_f1: 0.3312
 epoch: 47, train_loss: 1.2237, test_loss: 1.1970, test_f1: 0.3312
 epoch: 48, train_loss: 1.2211, test_loss: 1.1965, test_f1: 0.3331
 epoch: 49, train_loss: 1.2215, test_loss: 1.1949, test_f1: 0.3416
 epoch: 50, train_loss: 1.2193, test_loss: 1.1929, test_f1: 0.3416
 epoch: 51, train_loss: 1.2246, test_loss: 1.1929, test_f1: 0.3383
 epoch: 52, train_loss: 1.2186, test_loss: 1.1925, test_f1: 0.3402
 epoch: 53, train_loss: 1.2212, test_loss: 1.1906, test_f1: 0.3354
 epoch: 54, train_loss: 1.2137, test_loss: 1.1906, test_f1: 0.3401
 epoch: 55, train_loss: 1.2165, test_loss: 1.1918, test_f1: 0.3295
 epoch: 56, train_loss: 1.2168, test_loss: 1.1900, test_f1: 0.3389
 epoch: 57, train_loss: 1.2139, test_loss: 1.1891, test_f1: 0.3396
 epoch: 58, train_loss: 1.2175, test_loss: 1.1901, test_f1: 0.3400
 epoch: 59, train_loss: 1.2171, test_loss: 1.1885, test_f1: 0.3439
 epoch: 60, train_loss: 1.2146, test_loss: 1.1894, test_f1: 0.3426
 epoch: 61, train_loss: 1.2120, test_loss: 1.1864, test_f1: 0.3475
 epoch: 62, train_loss: 1.2144, test_loss: 1.1869, test_f1: 0.3474
 epoch: 63, train_loss: 1.2125, test_loss: 1.1854, test_f1: 0.3454
 epoch: 64, train_loss: 1.2101, test_loss: 1.1856, test_f1: 0.3443
 epoch: 65, train_loss: 1.2112, test_loss: 1.1865, test_f1: 0.3445
 epoch: 66, train_loss: 1.2099, test_loss: 1.1835, test_f1: 0.3447
 epoch: 67, train_loss: 1.2079, test_loss: 1.1840, test_f1: 0.3398
 epoch: 68, train_loss: 1.2130, test_loss: 1.1845, test_f1: 0.3495
 epoch: 69, train_loss: 1.2124, test_loss: 1.1854, test_f1: 0.3444
 epoch: 70, train_loss: 1.2088, test_loss: 1.1826, test_f1: 0.3473
 epoch: 71, train_loss: 1.2098, test_loss: 1.1816, test_f1: 0.3499
 epoch: 72, train_loss: 1.2069, test_loss: 1.1811, test_f1: 0.3373
 epoch: 73, train_loss: 1.2115, test_loss: 1.1804, test_f1: 0.3492
 epoch: 74, train_loss: 1.2082, test_loss: 1.1800, test_f1: 0.3492
 epoch: 75, train_loss: 1.2090, test_loss: 1.1800, test_f1: 0.3495
 epoch: 76, train_loss: 1.2105, test_loss: 1.1784, test_f1: 0.3516
 epoch: 77, train_loss: 1.2017, test_loss: 1.1802, test_f1: 0.3493
 epoch: 78, train_loss: 1.2066, test_loss: 1.1789, test_f1: 0.3482
 epoch: 79, train_loss: 1.2049, test_loss: 1.1779, test_f1: 0.3429
 epoch: 80, train_loss: 1.2002, test_loss: 1.1765, test_f1: 0.3459
 epoch: 81, train_loss: 1.1988, test_loss: 1.1760, test_f1: 0.3469
 epoch: 82, train_loss: 1.2055, test_loss: 1.1748, test_f1: 0.3506
 epoch: 83, train_loss: 1.1991, test_loss: 1.1740, test_f1: 0.3432
 epoch: 84, train_loss: 1.2029, test_loss: 1.1744, test_f1: 0.3433
 epoch: 85, train_loss: 1.1977, test_loss: 1.1746, test_f1: 0.3447
 epoch: 86, train_loss: 1.2007, test_loss: 1.1766, test_f1: 0.3442
 epoch: 87, train_loss: 1.1991, test_loss: 1.1742, test_f1: 0.3503
 epoch: 88, train_loss: 1.1975, test_loss: 1.1729, test_f1: 0.3428
 epoch: 89, train_loss: 1.1984, test_loss: 1.1728, test_f1: 0.3524
 epoch: 90, train_loss: 1.2001, test_loss: 1.1728, test_f1: 0.3445
 epoch: 91, train_loss: 1.1932, test_loss: 1.1706, test_f1: 0.3510
 epoch: 92, train_loss: 1.1940, test_loss: 1.1710, test_f1: 0.3455
 epoch: 93, train_loss: 1.1983, test_loss: 1.1698, test_f1: 0.3470
 epoch: 94, train_loss: 1.1908, test_loss: 1.1701, test_f1: 0.3455
 epoch: 95, train_loss: 1.1893, test_loss: 1.1688, test_f1: 0.3525
 epoch: 96, train_loss: 1.1907, test_loss: 1.1679, test_f1: 0.3483
 epoch: 97, train_loss: 1.1888, test_loss: 1.1691, test_f1: 0.3487
 epoch: 98, train_loss: 1.1901, test_loss: 1.1680, test_f1: 0.3513
 epoch: 99, train_loss: 1.1938, test_loss: 1.1672, test_f1: 0.3490
##################ITERATION #2 ****************************************
 epoch: 0, train_loss: 1.3084, test_loss: 1.3142, test_f1: 0.2274
 epoch: 1, train_loss: 1.3022, test_loss: 1.3073, test_f1: 0.2274
 epoch: 2, train_loss: 1.2990, test_loss: 1.3020, test_f1: 0.2274
 epoch: 3, train_loss: 1.2917, test_loss: 1.2981, test_f1: 0.2274
 epoch: 4, train_loss: 1.2886, test_loss: 1.2926, test_f1: 0.2274
 epoch: 5, train_loss: 1.2852, test_loss: 1.2877, test_f1: 0.2274
 epoch: 6, train_loss: 1.2804, test_loss: 1.2829, test_f1: 0.2274
 epoch: 7, train_loss: 1.2740, test_loss: 1.2785, test_f1: 0.2274
 epoch: 8, train_loss: 1.2751, test_loss: 1.2728, test_f1: 0.2274
 epoch: 9, train_loss: 1.2687, test_loss: 1.2683, test_f1: 0.2274
 epoch: 10, train_loss: 1.2641, test_loss: 1.2635, test_f1: 0.2274
 epoch: 11, train_loss: 1.2640, test_loss: 1.2597, test_f1: 0.2376
 epoch: 12, train_loss: 1.2579, test_loss: 1.2557, test_f1: 0.2513
 epoch: 13, train_loss: 1.2572, test_loss: 1.2513, test_f1: 0.2535
 epoch: 14, train_loss: 1.2534, test_loss: 1.2465, test_f1: 0.2652
 epoch: 15, train_loss: 1.2505, test_loss: 1.2419, test_f1: 0.2822
 epoch: 16, train_loss: 1.2498, test_loss: 1.2397, test_f1: 0.2988
 epoch: 17, train_loss: 1.2483, test_loss: 1.2352, test_f1: 0.3105
 epoch: 18, train_loss: 1.2443, test_loss: 1.2329, test_f1: 0.3087
 epoch: 19, train_loss: 1.2446, test_loss: 1.2300, test_f1: 0.3175
 epoch: 20, train_loss: 1.2340, test_loss: 1.2271, test_f1: 0.3167
 epoch: 21, train_loss: 1.2386, test_loss: 1.2235, test_f1: 0.3226
 epoch: 22, train_loss: 1.2347, test_loss: 1.2224, test_f1: 0.3256
 epoch: 23, train_loss: 1.2347, test_loss: 1.2192, test_f1: 0.3283
 epoch: 24, train_loss: 1.2337, test_loss: 1.2189, test_f1: 0.3301
 epoch: 25, train_loss: 1.2285, test_loss: 1.2150, test_f1: 0.3283
 epoch: 26, train_loss: 1.2252, test_loss: 1.2137, test_f1: 0.3289
 epoch: 27, train_loss: 1.2262, test_loss: 1.2112, test_f1: 0.3264
 epoch: 28, train_loss: 1.2246, test_loss: 1.2101, test_f1: 0.3275
 epoch: 29, train_loss: 1.2231, test_loss: 1.2087, test_f1: 0.3266
 epoch: 30, train_loss: 1.2210, test_loss: 1.2088, test_f1: 0.3284
 epoch: 31, train_loss: 1.2236, test_loss: 1.2072, test_f1: 0.3315
 epoch: 32, train_loss: 1.2175, test_loss: 1.2047, test_f1: 0.3299
 epoch: 33, train_loss: 1.2208, test_loss: 1.2024, test_f1: 0.3347
 epoch: 34, train_loss: 1.2219, test_loss: 1.2018, test_f1: 0.3304
 epoch: 35, train_loss: 1.2253, test_loss: 1.2016, test_f1: 0.3347
 epoch: 36, train_loss: 1.2163, test_loss: 1.1987, test_f1: 0.3367
 epoch: 37, train_loss: 1.2130, test_loss: 1.1990, test_f1: 0.3366
 epoch: 38, train_loss: 1.2116, test_loss: 1.1984, test_f1: 0.3375
 epoch: 39, train_loss: 1.2122, test_loss: 1.1971, test_f1: 0.3371
 epoch: 40, train_loss: 1.2112, test_loss: 1.1956, test_f1: 0.3399
 epoch: 41, train_loss: 1.2129, test_loss: 1.1946, test_f1: 0.3403
 epoch: 42, train_loss: 1.2074, test_loss: 1.1950, test_f1: 0.3394
 epoch: 43, train_loss: 1.2122, test_loss: 1.1957, test_f1: 0.3400
 epoch: 44, train_loss: 1.2086, test_loss: 1.1942, test_f1: 0.3386
 epoch: 45, train_loss: 1.2077, test_loss: 1.1929, test_f1: 0.3414
 epoch: 46, train_loss: 1.2090, test_loss: 1.1904, test_f1: 0.3401
 epoch: 47, train_loss: 1.2065, test_loss: 1.1927, test_f1: 0.3405
 epoch: 48, train_loss: 1.2052, test_loss: 1.1911, test_f1: 0.3376
 epoch: 49, train_loss: 1.2021, test_loss: 1.1921, test_f1: 0.3374
 epoch: 50, train_loss: 1.2030, test_loss: 1.1903, test_f1: 0.3408
 epoch: 51, train_loss: 1.2012, test_loss: 1.1895, test_f1: 0.3404
 epoch: 52, train_loss: 1.2048, test_loss: 1.1901, test_f1: 0.3419
 epoch: 53, train_loss: 1.1996, test_loss: 1.1902, test_f1: 0.3409
 epoch: 54, train_loss: 1.2039, test_loss: 1.1906, test_f1: 0.3422
 epoch: 55, train_loss: 1.1999, test_loss: 1.1899, test_f1: 0.3412
 epoch: 56, train_loss: 1.1971, test_loss: 1.1897, test_f1: 0.3411
 epoch: 57, train_loss: 1.1947, test_loss: 1.1893, test_f1: 0.3414
 epoch: 58, train_loss: 1.2019, test_loss: 1.1885, test_f1: 0.3463
 epoch: 59, train_loss: 1.2000, test_loss: 1.1892, test_f1: 0.3420
 epoch: 60, train_loss: 1.1907, test_loss: 1.1881, test_f1: 0.3452
 epoch: 61, train_loss: 1.1950, test_loss: 1.1884, test_f1: 0.3408
 epoch: 62, train_loss: 1.1971, test_loss: 1.1879, test_f1: 0.3412
 epoch: 63, train_loss: 1.2001, test_loss: 1.1874, test_f1: 0.3436
 epoch: 64, train_loss: 1.1953, test_loss: 1.1878, test_f1: 0.3400
 epoch: 65, train_loss: 1.1963, test_loss: 1.1878, test_f1: 0.3344
 epoch: 66, train_loss: 1.1915, test_loss: 1.1876, test_f1: 0.3453
 epoch: 67, train_loss: 1.1946, test_loss: 1.1868, test_f1: 0.3455
 epoch: 68, train_loss: 1.1960, test_loss: 1.1872, test_f1: 0.3381
 epoch: 69, train_loss: 1.1878, test_loss: 1.1854, test_f1: 0.3447
 epoch: 70, train_loss: 1.1945, test_loss: 1.1860, test_f1: 0.3435
 epoch: 71, train_loss: 1.1903, test_loss: 1.1867, test_f1: 0.3441
 epoch: 72, train_loss: 1.1865, test_loss: 1.1853, test_f1: 0.3459
 epoch: 73, train_loss: 1.1846, test_loss: 1.1860, test_f1: 0.3439
 epoch: 74, train_loss: 1.1926, test_loss: 1.1850, test_f1: 0.3471
 epoch: 75, train_loss: 1.1883, test_loss: 1.1857, test_f1: 0.3402
 epoch: 76, train_loss: 1.1928, test_loss: 1.1858, test_f1: 0.3373
 epoch: 77, train_loss: 1.1891, test_loss: 1.1854, test_f1: 0.3418
 epoch: 78, train_loss: 1.1884, test_loss: 1.1849, test_f1: 0.3361
 epoch: 79, train_loss: 1.1919, test_loss: 1.1837, test_f1: 0.3400
 epoch: 80, train_loss: 1.1857, test_loss: 1.1862, test_f1: 0.3400
 epoch: 81, train_loss: 1.1893, test_loss: 1.1862, test_f1: 0.3446
 epoch: 82, train_loss: 1.1860, test_loss: 1.1843, test_f1: 0.3445
 epoch: 83, train_loss: 1.1926, test_loss: 1.1851, test_f1: 0.3422
 epoch: 84, train_loss: 1.1860, test_loss: 1.1856, test_f1: 0.3486
 epoch: 85, train_loss: 1.1881, test_loss: 1.1854, test_f1: 0.3445
 epoch: 86, train_loss: 1.1814, test_loss: 1.1840, test_f1: 0.3465
 epoch: 87, train_loss: 1.1888, test_loss: 1.1828, test_f1: 0.3510
 epoch: 88, train_loss: 1.1857, test_loss: 1.1827, test_f1: 0.3482
 epoch: 89, train_loss: 1.1886, test_loss: 1.1857, test_f1: 0.3470
 epoch: 90, train_loss: 1.1796, test_loss: 1.1859, test_f1: 0.3465
 epoch: 91, train_loss: 1.1804, test_loss: 1.1849, test_f1: 0.3469
 epoch: 92, train_loss: 1.1826, test_loss: 1.1841, test_f1: 0.3450
 epoch: 93, train_loss: 1.1801, test_loss: 1.1847, test_f1: 0.3450
 epoch: 94, train_loss: 1.1769, test_loss: 1.1833, test_f1: 0.3461
 epoch: 95, train_loss: 1.1820, test_loss: 1.1825, test_f1: 0.3465
 epoch: 96, train_loss: 1.1783, test_loss: 1.1822, test_f1: 0.3543
 epoch: 97, train_loss: 1.1867, test_loss: 1.1844, test_f1: 0.3505
 epoch: 98, train_loss: 1.1780, test_loss: 1.1839, test_f1: 0.3523
 epoch: 99, train_loss: 1.1766, test_loss: 1.1827, test_f1: 0.3542
##################ITERATION #3 ****************************************
 epoch: 0, train_loss: 1.3107, test_loss: 1.3190, test_f1: 0.2274
 epoch: 1, train_loss: 1.3033, test_loss: 1.3117, test_f1: 0.2274
 epoch: 2, train_loss: 1.3007, test_loss: 1.3074, test_f1: 0.2274
 epoch: 3, train_loss: 1.2953, test_loss: 1.3028, test_f1: 0.2274
 epoch: 4, train_loss: 1.2945, test_loss: 1.3004, test_f1: 0.2274
 epoch: 5, train_loss: 1.2890, test_loss: 1.2962, test_f1: 0.2274
 epoch: 6, train_loss: 1.2880, test_loss: 1.2948, test_f1: 0.2274
 epoch: 7, train_loss: 1.2837, test_loss: 1.2904, test_f1: 0.2274
 epoch: 8, train_loss: 1.2790, test_loss: 1.2869, test_f1: 0.2274
 epoch: 9, train_loss: 1.2771, test_loss: 1.2827, test_f1: 0.2274
 epoch: 10, train_loss: 1.2722, test_loss: 1.2805, test_f1: 0.2274
 epoch: 11, train_loss: 1.2708, test_loss: 1.2748, test_f1: 0.2274
 epoch: 12, train_loss: 1.2625, test_loss: 1.2686, test_f1: 0.2274
 epoch: 13, train_loss: 1.2637, test_loss: 1.2677, test_f1: 0.2274
 epoch: 14, train_loss: 1.2645, test_loss: 1.2619, test_f1: 0.2274
 epoch: 15, train_loss: 1.2655, test_loss: 1.2605, test_f1: 0.2327
 epoch: 16, train_loss: 1.2552, test_loss: 1.2572, test_f1: 0.2327
 epoch: 17, train_loss: 1.2545, test_loss: 1.2545, test_f1: 0.2327
 epoch: 18, train_loss: 1.2522, test_loss: 1.2532, test_f1: 0.2376
 epoch: 19, train_loss: 1.2517, test_loss: 1.2470, test_f1: 0.2376
 epoch: 20, train_loss: 1.2491, test_loss: 1.2456, test_f1: 0.2327
 epoch: 21, train_loss: 1.2436, test_loss: 1.2401, test_f1: 0.2373
 epoch: 22, train_loss: 1.2447, test_loss: 1.2391, test_f1: 0.2377
 epoch: 23, train_loss: 1.2436, test_loss: 1.2348, test_f1: 0.2373
 epoch: 24, train_loss: 1.2407, test_loss: 1.2324, test_f1: 0.2373
 epoch: 25, train_loss: 1.2366, test_loss: 1.2327, test_f1: 0.2399
 epoch: 26, train_loss: 1.2297, test_loss: 1.2250, test_f1: 0.2491
 epoch: 27, train_loss: 1.2337, test_loss: 1.2221, test_f1: 0.2498
 epoch: 28, train_loss: 1.2295, test_loss: 1.2208, test_f1: 0.2491
 epoch: 29, train_loss: 1.2282, test_loss: 1.2154, test_f1: 0.2557
 epoch: 30, train_loss: 1.2254, test_loss: 1.2154, test_f1: 0.2578
 epoch: 31, train_loss: 1.2238, test_loss: 1.2124, test_f1: 0.2718
 epoch: 32, train_loss: 1.2170, test_loss: 1.2106, test_f1: 0.2726
 epoch: 33, train_loss: 1.2191, test_loss: 1.2087, test_f1: 0.2738
 epoch: 34, train_loss: 1.2174, test_loss: 1.2028, test_f1: 0.2732
 epoch: 35, train_loss: 1.2207, test_loss: 1.2028, test_f1: 0.2801
 epoch: 36, train_loss: 1.2123, test_loss: 1.1962, test_f1: 0.2844
 epoch: 37, train_loss: 1.2149, test_loss: 1.1983, test_f1: 0.2990
 epoch: 38, train_loss: 1.2079, test_loss: 1.1975, test_f1: 0.3035
 epoch: 39, train_loss: 1.2106, test_loss: 1.1929, test_f1: 0.3056
 epoch: 40, train_loss: 1.2088, test_loss: 1.1896, test_f1: 0.3122
 epoch: 41, train_loss: 1.2134, test_loss: 1.1840, test_f1: 0.3107
 epoch: 42, train_loss: 1.2054, test_loss: 1.1834, test_f1: 0.3292
 epoch: 43, train_loss: 1.1986, test_loss: 1.1778, test_f1: 0.3421
 epoch: 44, train_loss: 1.2032, test_loss: 1.1749, test_f1: 0.3304
 epoch: 45, train_loss: 1.2005, test_loss: 1.1796, test_f1: 0.3314
 epoch: 46, train_loss: 1.1973, test_loss: 1.1760, test_f1: 0.3552
 epoch: 47, train_loss: 1.1966, test_loss: 1.1744, test_f1: 0.3581
 epoch: 48, train_loss: 1.1881, test_loss: 1.1692, test_f1: 0.3682
 epoch: 49, train_loss: 1.1933, test_loss: 1.1718, test_f1: 0.3575
 epoch: 50, train_loss: 1.1852, test_loss: 1.1672, test_f1: 0.3738
 epoch: 51, train_loss: 1.1906, test_loss: 1.1642, test_f1: 0.3796
 epoch: 52, train_loss: 1.1842, test_loss: 1.1654, test_f1: 0.3746
 epoch: 53, train_loss: 1.1867, test_loss: 1.1608, test_f1: 0.3973
 epoch: 54, train_loss: 1.1895, test_loss: 1.1629, test_f1: 0.3692
 epoch: 55, train_loss: 1.1819, test_loss: 1.1607, test_f1: 0.3812
 epoch: 56, train_loss: 1.1832, test_loss: 1.1588, test_f1: 0.3864
 epoch: 57, train_loss: 1.1814, test_loss: 1.1584, test_f1: 0.3869
 epoch: 58, train_loss: 1.1794, test_loss: 1.1598, test_f1: 0.3810
 epoch: 59, train_loss: 1.1841, test_loss: 1.1579, test_f1: 0.3979
 epoch: 60, train_loss: 1.1798, test_loss: 1.1579, test_f1: 0.3986
 epoch: 61, train_loss: 1.1832, test_loss: 1.1581, test_f1: 0.3928
 epoch: 62, train_loss: 1.1805, test_loss: 1.1556, test_f1: 0.3964
 epoch: 63, train_loss: 1.1808, test_loss: 1.1566, test_f1: 0.3905
 epoch: 64, train_loss: 1.1760, test_loss: 1.1530, test_f1: 0.4051
 epoch: 65, train_loss: 1.1826, test_loss: 1.1549, test_f1: 0.4071
 epoch: 66, train_loss: 1.1728, test_loss: 1.1531, test_f1: 0.4036
 epoch: 67, train_loss: 1.1752, test_loss: 1.1529, test_f1: 0.4027
 epoch: 68, train_loss: 1.1661, test_loss: 1.1518, test_f1: 0.4146
 epoch: 69, train_loss: 1.1709, test_loss: 1.1521, test_f1: 0.4010
 epoch: 70, train_loss: 1.1706, test_loss: 1.1507, test_f1: 0.4040
 epoch: 71, train_loss: 1.1655, test_loss: 1.1487, test_f1: 0.4044
 epoch: 72, train_loss: 1.1683, test_loss: 1.1485, test_f1: 0.4115
 epoch: 73, train_loss: 1.1567, test_loss: 1.1438, test_f1: 0.4114
 epoch: 74, train_loss: 1.1713, test_loss: 1.1426, test_f1: 0.4157
 epoch: 75, train_loss: 1.1649, test_loss: 1.1468, test_f1: 0.4128
 epoch: 76, train_loss: 1.1710, test_loss: 1.1491, test_f1: 0.4241
 epoch: 77, train_loss: 1.1621, test_loss: 1.1416, test_f1: 0.4233
 epoch: 78, train_loss: 1.1738, test_loss: 1.1403, test_f1: 0.4229
 epoch: 79, train_loss: 1.1609, test_loss: 1.1425, test_f1: 0.4156
 epoch: 80, train_loss: 1.1605, test_loss: 1.1392, test_f1: 0.4175
 epoch: 81, train_loss: 1.1662, test_loss: 1.1395, test_f1: 0.4186
 epoch: 82, train_loss: 1.1680, test_loss: 1.1381, test_f1: 0.4262
 epoch: 83, train_loss: 1.1529, test_loss: 1.1393, test_f1: 0.4248
 epoch: 84, train_loss: 1.1649, test_loss: 1.1387, test_f1: 0.4198
 epoch: 85, train_loss: 1.1611, test_loss: 1.1392, test_f1: 0.4156
 epoch: 86, train_loss: 1.1632, test_loss: 1.1350, test_f1: 0.4198
 epoch: 87, train_loss: 1.1586, test_loss: 1.1386, test_f1: 0.4209
 epoch: 88, train_loss: 1.1608, test_loss: 1.1377, test_f1: 0.4311
 epoch: 89, train_loss: 1.1579, test_loss: 1.1352, test_f1: 0.4260
 epoch: 90, train_loss: 1.1634, test_loss: 1.1376, test_f1: 0.4219
 epoch: 91, train_loss: 1.1567, test_loss: 1.1329, test_f1: 0.4174
 epoch: 92, train_loss: 1.1568, test_loss: 1.1371, test_f1: 0.4276
 epoch: 93, train_loss: 1.1541, test_loss: 1.1320, test_f1: 0.4263
 epoch: 94, train_loss: 1.1597, test_loss: 1.1296, test_f1: 0.4240
 epoch: 95, train_loss: 1.1539, test_loss: 1.1278, test_f1: 0.4295
 epoch: 96, train_loss: 1.1508, test_loss: 1.1304, test_f1: 0.4295
 epoch: 97, train_loss: 1.1469, test_loss: 1.1314, test_f1: 0.4212
 epoch: 98, train_loss: 1.1531, test_loss: 1.1316, test_f1: 0.4241
 epoch: 99, train_loss: 1.1599, test_loss: 1.1303, test_f1: 0.4324
##################ITERATION #4 ****************************************
 epoch: 0, train_loss: 1.3065, test_loss: 1.3071, test_f1: 0.2274
 epoch: 1, train_loss: 1.3003, test_loss: 1.2975, test_f1: 0.2274
 epoch: 2, train_loss: 1.2886, test_loss: 1.2918, test_f1: 0.2274
 epoch: 3, train_loss: 1.2856, test_loss: 1.2860, test_f1: 0.2274
 epoch: 4, train_loss: 1.2848, test_loss: 1.2823, test_f1: 0.2274
 epoch: 5, train_loss: 1.2770, test_loss: 1.2795, test_f1: 0.2274
 epoch: 6, train_loss: 1.2762, test_loss: 1.2736, test_f1: 0.2274
 epoch: 7, train_loss: 1.2706, test_loss: 1.2675, test_f1: 0.2325
 epoch: 8, train_loss: 1.2692, test_loss: 1.2651, test_f1: 0.2325
 epoch: 9, train_loss: 1.2611, test_loss: 1.2614, test_f1: 0.2435
 epoch: 10, train_loss: 1.2599, test_loss: 1.2549, test_f1: 0.2605
 epoch: 11, train_loss: 1.2585, test_loss: 1.2531, test_f1: 0.2679
 epoch: 12, train_loss: 1.2504, test_loss: 1.2492, test_f1: 0.2808
 epoch: 13, train_loss: 1.2508, test_loss: 1.2449, test_f1: 0.2761
 epoch: 14, train_loss: 1.2456, test_loss: 1.2422, test_f1: 0.2988
 epoch: 15, train_loss: 1.2437, test_loss: 1.2387, test_f1: 0.3005
 epoch: 16, train_loss: 1.2435, test_loss: 1.2359, test_f1: 0.2943
 epoch: 17, train_loss: 1.2416, test_loss: 1.2337, test_f1: 0.3050
 epoch: 18, train_loss: 1.2305, test_loss: 1.2290, test_f1: 0.3160
 epoch: 19, train_loss: 1.2321, test_loss: 1.2258, test_f1: 0.3268
 epoch: 20, train_loss: 1.2327, test_loss: 1.2244, test_f1: 0.3357
 epoch: 21, train_loss: 1.2299, test_loss: 1.2172, test_f1: 0.3317
 epoch: 22, train_loss: 1.2224, test_loss: 1.2136, test_f1: 0.3390
 epoch: 23, train_loss: 1.2242, test_loss: 1.2117, test_f1: 0.3313
 epoch: 24, train_loss: 1.2179, test_loss: 1.2074, test_f1: 0.3311
 epoch: 25, train_loss: 1.2172, test_loss: 1.2055, test_f1: 0.3374
 epoch: 26, train_loss: 1.2151, test_loss: 1.2016, test_f1: 0.3464
 epoch: 27, train_loss: 1.2107, test_loss: 1.1963, test_f1: 0.3464
 epoch: 28, train_loss: 1.2087, test_loss: 1.1917, test_f1: 0.3460
 epoch: 29, train_loss: 1.2057, test_loss: 1.1901, test_f1: 0.3452
 epoch: 30, train_loss: 1.2088, test_loss: 1.1884, test_f1: 0.3467
 epoch: 31, train_loss: 1.1990, test_loss: 1.1822, test_f1: 0.3385
 epoch: 32, train_loss: 1.1968, test_loss: 1.1803, test_f1: 0.3495
 epoch: 33, train_loss: 1.1964, test_loss: 1.1749, test_f1: 0.3549
 epoch: 34, train_loss: 1.1936, test_loss: 1.1738, test_f1: 0.3534
 epoch: 35, train_loss: 1.1919, test_loss: 1.1693, test_f1: 0.3675
 epoch: 36, train_loss: 1.1935, test_loss: 1.1677, test_f1: 0.3665
 epoch: 37, train_loss: 1.1905, test_loss: 1.1643, test_f1: 0.3788
 epoch: 38, train_loss: 1.1834, test_loss: 1.1589, test_f1: 0.3764
 epoch: 39, train_loss: 1.1872, test_loss: 1.1569, test_f1: 0.3783
 epoch: 40, train_loss: 1.1792, test_loss: 1.1529, test_f1: 0.3882
 epoch: 41, train_loss: 1.1788, test_loss: 1.1492, test_f1: 0.3950
 epoch: 42, train_loss: 1.1851, test_loss: 1.1475, test_f1: 0.4055
 epoch: 43, train_loss: 1.1766, test_loss: 1.1436, test_f1: 0.4013
 epoch: 44, train_loss: 1.1746, test_loss: 1.1414, test_f1: 0.4014
 epoch: 45, train_loss: 1.1682, test_loss: 1.1385, test_f1: 0.4035
 epoch: 46, train_loss: 1.1780, test_loss: 1.1337, test_f1: 0.4137
 epoch: 47, train_loss: 1.1757, test_loss: 1.1346, test_f1: 0.4111
 epoch: 48, train_loss: 1.1690, test_loss: 1.1305, test_f1: 0.4135
 epoch: 49, train_loss: 1.1678, test_loss: 1.1313, test_f1: 0.4090
 epoch: 50, train_loss: 1.1673, test_loss: 1.1228, test_f1: 0.4106
 epoch: 51, train_loss: 1.1575, test_loss: 1.1216, test_f1: 0.4108
 epoch: 52, train_loss: 1.1577, test_loss: 1.1247, test_f1: 0.4114
 epoch: 53, train_loss: 1.1578, test_loss: 1.1235, test_f1: 0.4120
 epoch: 54, train_loss: 1.1556, test_loss: 1.1181, test_f1: 0.4181
 epoch: 55, train_loss: 1.1589, test_loss: 1.1190, test_f1: 0.4125
 epoch: 56, train_loss: 1.1611, test_loss: 1.1192, test_f1: 0.4146
 epoch: 57, train_loss: 1.1592, test_loss: 1.1167, test_f1: 0.4297
 epoch: 58, train_loss: 1.1620, test_loss: 1.1174, test_f1: 0.4148
 epoch: 59, train_loss: 1.1527, test_loss: 1.1193, test_f1: 0.4274
 epoch: 60, train_loss: 1.1541, test_loss: 1.1139, test_f1: 0.4297
 epoch: 61, train_loss: 1.1535, test_loss: 1.1116, test_f1: 0.4297
 epoch: 62, train_loss: 1.1559, test_loss: 1.1108, test_f1: 0.4286
 epoch: 63, train_loss: 1.1538, test_loss: 1.1105, test_f1: 0.4278
 epoch: 64, train_loss: 1.1523, test_loss: 1.1106, test_f1: 0.4294
 epoch: 65, train_loss: 1.1433, test_loss: 1.1086, test_f1: 0.4302
 epoch: 66, train_loss: 1.1476, test_loss: 1.1052, test_f1: 0.4288
 epoch: 67, train_loss: 1.1468, test_loss: 1.1060, test_f1: 0.4318
 epoch: 68, train_loss: 1.1511, test_loss: 1.1056, test_f1: 0.4318
 epoch: 69, train_loss: 1.1494, test_loss: 1.1060, test_f1: 0.4312
 epoch: 70, train_loss: 1.1527, test_loss: 1.1049, test_f1: 0.4308
 epoch: 71, train_loss: 1.1440, test_loss: 1.1023, test_f1: 0.4335
 epoch: 72, train_loss: 1.1487, test_loss: 1.1008, test_f1: 0.4342
 epoch: 73, train_loss: 1.1457, test_loss: 1.1045, test_f1: 0.4257
 epoch: 74, train_loss: 1.1406, test_loss: 1.1031, test_f1: 0.4349
 epoch: 75, train_loss: 1.1437, test_loss: 1.1008, test_f1: 0.4332
 epoch: 76, train_loss: 1.1380, test_loss: 1.1005, test_f1: 0.4327
 epoch: 77, train_loss: 1.1392, test_loss: 1.1017, test_f1: 0.4332
 epoch: 78, train_loss: 1.1405, test_loss: 1.0979, test_f1: 0.4303
 epoch: 79, train_loss: 1.1381, test_loss: 1.1000, test_f1: 0.4298
 epoch: 80, train_loss: 1.1448, test_loss: 1.0979, test_f1: 0.4313
 epoch: 81, train_loss: 1.1378, test_loss: 1.0960, test_f1: 0.4268
 epoch: 82, train_loss: 1.1400, test_loss: 1.0975, test_f1: 0.4349
 epoch: 83, train_loss: 1.1360, test_loss: 1.0935, test_f1: 0.4320
 epoch: 84, train_loss: 1.1367, test_loss: 1.0937, test_f1: 0.4340
 epoch: 85, train_loss: 1.1368, test_loss: 1.0929, test_f1: 0.4316
 epoch: 86, train_loss: 1.1344, test_loss: 1.0933, test_f1: 0.4351
 epoch: 87, train_loss: 1.1400, test_loss: 1.0916, test_f1: 0.4337
 epoch: 88, train_loss: 1.1338, test_loss: 1.0925, test_f1: 0.4410
 epoch: 89, train_loss: 1.1447, test_loss: 1.0900, test_f1: 0.4324
 epoch: 90, train_loss: 1.1301, test_loss: 1.0903, test_f1: 0.4373
 epoch: 91, train_loss: 1.1379, test_loss: 1.0925, test_f1: 0.4385
 epoch: 92, train_loss: 1.1302, test_loss: 1.0909, test_f1: 0.4315
 epoch: 93, train_loss: 1.1273, test_loss: 1.0864, test_f1: 0.4349
 epoch: 94, train_loss: 1.1290, test_loss: 1.0875, test_f1: 0.4372
 epoch: 95, train_loss: 1.1305, test_loss: 1.0827, test_f1: 0.4329
 epoch: 96, train_loss: 1.1339, test_loss: 1.0811, test_f1: 0.4361
 epoch: 97, train_loss: 1.1261, test_loss: 1.0841, test_f1: 0.4353
 epoch: 98, train_loss: 1.1300, test_loss: 1.0827, test_f1: 0.4390
 epoch: 99, train_loss: 1.1328, test_loss: 1.0847, test_f1: 0.4407
##################ITERATION #5 ****************************************
 epoch: 0, train_loss: 1.3036, test_loss: 1.2998, test_f1: 0.2274
 epoch: 1, train_loss: 1.2887, test_loss: 1.2866, test_f1: 0.2274
 epoch: 2, train_loss: 1.2853, test_loss: 1.2791, test_f1: 0.2276
 epoch: 3, train_loss: 1.2771, test_loss: 1.2713, test_f1: 0.2266
 epoch: 4, train_loss: 1.2699, test_loss: 1.2652, test_f1: 0.2262
 epoch: 5, train_loss: 1.2646, test_loss: 1.2589, test_f1: 0.2410
 epoch: 6, train_loss: 1.2644, test_loss: 1.2523, test_f1: 0.2550
 epoch: 7, train_loss: 1.2614, test_loss: 1.2461, test_f1: 0.2618
 epoch: 8, train_loss: 1.2551, test_loss: 1.2408, test_f1: 0.2725
 epoch: 9, train_loss: 1.2528, test_loss: 1.2390, test_f1: 0.2914
 epoch: 10, train_loss: 1.2443, test_loss: 1.2328, test_f1: 0.2973
 epoch: 11, train_loss: 1.2437, test_loss: 1.2298, test_f1: 0.3058
 epoch: 12, train_loss: 1.2437, test_loss: 1.2244, test_f1: 0.3085
 epoch: 13, train_loss: 1.2380, test_loss: 1.2226, test_f1: 0.3125
 epoch: 14, train_loss: 1.2381, test_loss: 1.2196, test_f1: 0.3155
 epoch: 15, train_loss: 1.2384, test_loss: 1.2181, test_f1: 0.3226
 epoch: 16, train_loss: 1.2326, test_loss: 1.2135, test_f1: 0.3240
 epoch: 17, train_loss: 1.2358, test_loss: 1.2123, test_f1: 0.3288
 epoch: 18, train_loss: 1.2334, test_loss: 1.2107, test_f1: 0.3366
 epoch: 19, train_loss: 1.2334, test_loss: 1.2082, test_f1: 0.3355
 epoch: 20, train_loss: 1.2272, test_loss: 1.2051, test_f1: 0.3505
 epoch: 21, train_loss: 1.2285, test_loss: 1.2057, test_f1: 0.3506
 epoch: 22, train_loss: 1.2211, test_loss: 1.2035, test_f1: 0.3569
 epoch: 23, train_loss: 1.2182, test_loss: 1.2020, test_f1: 0.3542
 epoch: 24, train_loss: 1.2225, test_loss: 1.2009, test_f1: 0.3710
 epoch: 25, train_loss: 1.2255, test_loss: 1.1982, test_f1: 0.3738
 epoch: 26, train_loss: 1.2182, test_loss: 1.1990, test_f1: 0.3605
 epoch: 27, train_loss: 1.2199, test_loss: 1.1985, test_f1: 0.3717
 epoch: 28, train_loss: 1.2116, test_loss: 1.1981, test_f1: 0.3695
 epoch: 29, train_loss: 1.2172, test_loss: 1.1964, test_f1: 0.3694
 epoch: 30, train_loss: 1.2144, test_loss: 1.1943, test_f1: 0.3638
 epoch: 31, train_loss: 1.2082, test_loss: 1.1952, test_f1: 0.3739
 epoch: 32, train_loss: 1.2101, test_loss: 1.1963, test_f1: 0.3834
 epoch: 33, train_loss: 1.2031, test_loss: 1.1932, test_f1: 0.3865
 epoch: 34, train_loss: 1.2024, test_loss: 1.1945, test_f1: 0.3860
 epoch: 35, train_loss: 1.2064, test_loss: 1.1925, test_f1: 0.3826
 epoch: 36, train_loss: 1.2053, test_loss: 1.1896, test_f1: 0.3796
 epoch: 37, train_loss: 1.2006, test_loss: 1.1913, test_f1: 0.3876
 epoch: 38, train_loss: 1.2007, test_loss: 1.1890, test_f1: 0.3838
 epoch: 39, train_loss: 1.2012, test_loss: 1.1897, test_f1: 0.3865
 epoch: 40, train_loss: 1.2033, test_loss: 1.1881, test_f1: 0.3842
 epoch: 41, train_loss: 1.2006, test_loss: 1.1863, test_f1: 0.3915
 epoch: 42, train_loss: 1.1982, test_loss: 1.1857, test_f1: 0.3892
 epoch: 43, train_loss: 1.1986, test_loss: 1.1870, test_f1: 0.3896
 epoch: 44, train_loss: 1.1985, test_loss: 1.1857, test_f1: 0.3869
 epoch: 45, train_loss: 1.1975, test_loss: 1.1829, test_f1: 0.3843
 epoch: 46, train_loss: 1.1961, test_loss: 1.1849, test_f1: 0.3840
 epoch: 47, train_loss: 1.1935, test_loss: 1.1804, test_f1: 0.3799
 epoch: 48, train_loss: 1.1926, test_loss: 1.1849, test_f1: 0.3873
 epoch: 49, train_loss: 1.1914, test_loss: 1.1824, test_f1: 0.3875
 epoch: 50, train_loss: 1.1946, test_loss: 1.1814, test_f1: 0.3890
 epoch: 51, train_loss: 1.1895, test_loss: 1.1802, test_f1: 0.3873
 epoch: 52, train_loss: 1.1971, test_loss: 1.1806, test_f1: 0.3958
 epoch: 53, train_loss: 1.1907, test_loss: 1.1785, test_f1: 0.3899
 epoch: 54, train_loss: 1.1919, test_loss: 1.1811, test_f1: 0.3890
 epoch: 55, train_loss: 1.1923, test_loss: 1.1792, test_f1: 0.3890
 epoch: 56, train_loss: 1.1864, test_loss: 1.1781, test_f1: 0.3922
 epoch: 57, train_loss: 1.1879, test_loss: 1.1780, test_f1: 0.3939
 epoch: 58, train_loss: 1.1844, test_loss: 1.1794, test_f1: 0.3920
 epoch: 59, train_loss: 1.1800, test_loss: 1.1800, test_f1: 0.3948
 epoch: 60, train_loss: 1.1814, test_loss: 1.1762, test_f1: 0.3900
 epoch: 61, train_loss: 1.1841, test_loss: 1.1753, test_f1: 0.3962
 epoch: 62, train_loss: 1.1811, test_loss: 1.1741, test_f1: 0.3920
 epoch: 63, train_loss: 1.1816, test_loss: 1.1764, test_f1: 0.3933
 epoch: 64, train_loss: 1.1851, test_loss: 1.1795, test_f1: 0.3925
 epoch: 65, train_loss: 1.1879, test_loss: 1.1756, test_f1: 0.3901
 epoch: 66, train_loss: 1.1803, test_loss: 1.1740, test_f1: 0.3901
 epoch: 67, train_loss: 1.1802, test_loss: 1.1719, test_f1: 0.3864
 epoch: 68, train_loss: 1.1782, test_loss: 1.1738, test_f1: 0.3906
 epoch: 69, train_loss: 1.1816, test_loss: 1.1712, test_f1: 0.3940
 epoch: 70, train_loss: 1.1820, test_loss: 1.1724, test_f1: 0.3943
 epoch: 71, train_loss: 1.1787, test_loss: 1.1714, test_f1: 0.3921
 epoch: 72, train_loss: 1.1804, test_loss: 1.1716, test_f1: 0.3921
 epoch: 73, train_loss: 1.1768, test_loss: 1.1714, test_f1: 0.3903
 epoch: 74, train_loss: 1.1775, test_loss: 1.1696, test_f1: 0.3936
 epoch: 75, train_loss: 1.1757, test_loss: 1.1701, test_f1: 0.3915
 epoch: 76, train_loss: 1.1752, test_loss: 1.1709, test_f1: 0.3848
 epoch: 77, train_loss: 1.1786, test_loss: 1.1712, test_f1: 0.3913
 epoch: 78, train_loss: 1.1724, test_loss: 1.1687, test_f1: 0.3933
 epoch: 79, train_loss: 1.1715, test_loss: 1.1677, test_f1: 0.3960
 epoch: 80, train_loss: 1.1752, test_loss: 1.1673, test_f1: 0.3915
 epoch: 81, train_loss: 1.1803, test_loss: 1.1661, test_f1: 0.3921
 epoch: 82, train_loss: 1.1772, test_loss: 1.1627, test_f1: 0.3860
 epoch: 83, train_loss: 1.1758, test_loss: 1.1673, test_f1: 0.3925
 epoch: 84, train_loss: 1.1772, test_loss: 1.1639, test_f1: 0.3928
 epoch: 85, train_loss: 1.1673, test_loss: 1.1632, test_f1: 0.3963
 epoch: 86, train_loss: 1.1724, test_loss: 1.1617, test_f1: 0.3971
 epoch: 87, train_loss: 1.1773, test_loss: 1.1629, test_f1: 0.3981
 epoch: 88, train_loss: 1.1727, test_loss: 1.1595, test_f1: 0.3918
 epoch: 89, train_loss: 1.1705, test_loss: 1.1616, test_f1: 0.3977
 epoch: 90, train_loss: 1.1663, test_loss: 1.1575, test_f1: 0.3976
 epoch: 91, train_loss: 1.1726, test_loss: 1.1562, test_f1: 0.4004
 epoch: 92, train_loss: 1.1648, test_loss: 1.1620, test_f1: 0.4019
 epoch: 93, train_loss: 1.1746, test_loss: 1.1581, test_f1: 0.3966
 epoch: 94, train_loss: 1.1729, test_loss: 1.1560, test_f1: 0.4030
 epoch: 95, train_loss: 1.1616, test_loss: 1.1586, test_f1: 0.4027
 epoch: 96, train_loss: 1.1643, test_loss: 1.1551, test_f1: 0.3966
 epoch: 97, train_loss: 1.1590, test_loss: 1.1562, test_f1: 0.4055
 epoch: 98, train_loss: 1.1690, test_loss: 1.1547, test_f1: 0.3992
 epoch: 99, train_loss: 1.1713, test_loss: 1.1583, test_f1: 0.4068
##################ITERATION #6 ****************************************
 epoch: 0, train_loss: 1.3053, test_loss: 1.2960, test_f1: 0.2555
 epoch: 1, train_loss: 1.2951, test_loss: 1.2873, test_f1: 0.2667
 epoch: 2, train_loss: 1.2830, test_loss: 1.2803, test_f1: 0.2719
 epoch: 3, train_loss: 1.2836, test_loss: 1.2745, test_f1: 0.2711
 epoch: 4, train_loss: 1.2773, test_loss: 1.2684, test_f1: 0.2719
 epoch: 5, train_loss: 1.2712, test_loss: 1.2649, test_f1: 0.2713
 epoch: 6, train_loss: 1.2671, test_loss: 1.2597, test_f1: 0.2713
 epoch: 7, train_loss: 1.2657, test_loss: 1.2560, test_f1: 0.2735
 epoch: 8, train_loss: 1.2646, test_loss: 1.2534, test_f1: 0.2755
 epoch: 9, train_loss: 1.2597, test_loss: 1.2486, test_f1: 0.2714
 epoch: 10, train_loss: 1.2602, test_loss: 1.2450, test_f1: 0.2756
 epoch: 11, train_loss: 1.2568, test_loss: 1.2421, test_f1: 0.2810
 epoch: 12, train_loss: 1.2538, test_loss: 1.2381, test_f1: 0.2811
 epoch: 13, train_loss: 1.2509, test_loss: 1.2358, test_f1: 0.2830
 epoch: 14, train_loss: 1.2510, test_loss: 1.2352, test_f1: 0.2830
 epoch: 15, train_loss: 1.2475, test_loss: 1.2321, test_f1: 0.2919
 epoch: 16, train_loss: 1.2479, test_loss: 1.2318, test_f1: 0.2872
 epoch: 17, train_loss: 1.2453, test_loss: 1.2317, test_f1: 0.2930
 epoch: 18, train_loss: 1.2451, test_loss: 1.2297, test_f1: 0.2945
 epoch: 19, train_loss: 1.2354, test_loss: 1.2264, test_f1: 0.2983
 epoch: 20, train_loss: 1.2433, test_loss: 1.2248, test_f1: 0.3051
 epoch: 21, train_loss: 1.2386, test_loss: 1.2209, test_f1: 0.3076
 epoch: 22, train_loss: 1.2385, test_loss: 1.2205, test_f1: 0.3076
 epoch: 23, train_loss: 1.2363, test_loss: 1.2192, test_f1: 0.3108
 epoch: 24, train_loss: 1.2341, test_loss: 1.2153, test_f1: 0.3225
 epoch: 25, train_loss: 1.2383, test_loss: 1.2149, test_f1: 0.3280
 epoch: 26, train_loss: 1.2313, test_loss: 1.2143, test_f1: 0.3316
 epoch: 27, train_loss: 1.2320, test_loss: 1.2122, test_f1: 0.3292
 epoch: 28, train_loss: 1.2268, test_loss: 1.2109, test_f1: 0.3277
 epoch: 29, train_loss: 1.2241, test_loss: 1.2107, test_f1: 0.3404
 epoch: 30, train_loss: 1.2269, test_loss: 1.2094, test_f1: 0.3478
 epoch: 31, train_loss: 1.2257, test_loss: 1.2086, test_f1: 0.3353
 epoch: 32, train_loss: 1.2249, test_loss: 1.2069, test_f1: 0.3398
 epoch: 33, train_loss: 1.2190, test_loss: 1.2032, test_f1: 0.3521
 epoch: 34, train_loss: 1.2138, test_loss: 1.2030, test_f1: 0.3497
 epoch: 35, train_loss: 1.2161, test_loss: 1.1998, test_f1: 0.3615
 epoch: 36, train_loss: 1.2191, test_loss: 1.1988, test_f1: 0.3505
 epoch: 37, train_loss: 1.2170, test_loss: 1.1988, test_f1: 0.3568
 epoch: 38, train_loss: 1.2146, test_loss: 1.1942, test_f1: 0.3472
 epoch: 39, train_loss: 1.2152, test_loss: 1.1925, test_f1: 0.3378
 epoch: 40, train_loss: 1.2086, test_loss: 1.1930, test_f1: 0.3469
 epoch: 41, train_loss: 1.2036, test_loss: 1.1889, test_f1: 0.3574
 epoch: 42, train_loss: 1.2060, test_loss: 1.1857, test_f1: 0.3549
 epoch: 43, train_loss: 1.2032, test_loss: 1.1883, test_f1: 0.3576
 epoch: 44, train_loss: 1.2024, test_loss: 1.1888, test_f1: 0.3609
 epoch: 45, train_loss: 1.1994, test_loss: 1.1855, test_f1: 0.3659
 epoch: 46, train_loss: 1.2008, test_loss: 1.1864, test_f1: 0.3588
 epoch: 47, train_loss: 1.2031, test_loss: 1.1811, test_f1: 0.3600
 epoch: 48, train_loss: 1.1916, test_loss: 1.1827, test_f1: 0.3750
 epoch: 49, train_loss: 1.1971, test_loss: 1.1808, test_f1: 0.3738
 epoch: 50, train_loss: 1.1961, test_loss: 1.1820, test_f1: 0.3573
 epoch: 51, train_loss: 1.1945, test_loss: 1.1775, test_f1: 0.3830
 epoch: 52, train_loss: 1.1927, test_loss: 1.1750, test_f1: 0.3794
 epoch: 53, train_loss: 1.1894, test_loss: 1.1773, test_f1: 0.3765
 epoch: 54, train_loss: 1.1888, test_loss: 1.1775, test_f1: 0.3788
 epoch: 55, train_loss: 1.1861, test_loss: 1.1756, test_f1: 0.3818
 epoch: 56, train_loss: 1.1907, test_loss: 1.1753, test_f1: 0.3757
 epoch: 57, train_loss: 1.1906, test_loss: 1.1760, test_f1: 0.3742
 epoch: 58, train_loss: 1.1898, test_loss: 1.1770, test_f1: 0.3741
 epoch: 59, train_loss: 1.1950, test_loss: 1.1751, test_f1: 0.3886
 epoch: 60, train_loss: 1.1840, test_loss: 1.1748, test_f1: 0.3833
 epoch: 61, train_loss: 1.1818, test_loss: 1.1745, test_f1: 0.3803
 epoch: 62, train_loss: 1.1925, test_loss: 1.1721, test_f1: 0.3811
 epoch: 63, train_loss: 1.1860, test_loss: 1.1769, test_f1: 0.3791
 epoch: 64, train_loss: 1.1838, test_loss: 1.1735, test_f1: 0.3794
 epoch: 65, train_loss: 1.1802, test_loss: 1.1719, test_f1: 0.3810
 epoch: 66, train_loss: 1.1851, test_loss: 1.1714, test_f1: 0.3804
 epoch: 67, train_loss: 1.1885, test_loss: 1.1701, test_f1: 0.3835
 epoch: 68, train_loss: 1.1814, test_loss: 1.1716, test_f1: 0.3928
 epoch: 69, train_loss: 1.1791, test_loss: 1.1710, test_f1: 0.3875
 epoch: 70, train_loss: 1.1821, test_loss: 1.1689, test_f1: 0.3793
 epoch: 71, train_loss: 1.1780, test_loss: 1.1697, test_f1: 0.3775
 epoch: 72, train_loss: 1.1808, test_loss: 1.1679, test_f1: 0.3827
 epoch: 73, train_loss: 1.1797, test_loss: 1.1657, test_f1: 0.3843
 epoch: 74, train_loss: 1.1758, test_loss: 1.1681, test_f1: 0.3823
 epoch: 75, train_loss: 1.1751, test_loss: 1.1663, test_f1: 0.3885
 epoch: 76, train_loss: 1.1792, test_loss: 1.1659, test_f1: 0.3838
 epoch: 77, train_loss: 1.1756, test_loss: 1.1655, test_f1: 0.3918
 epoch: 78, train_loss: 1.1726, test_loss: 1.1656, test_f1: 0.3887
 epoch: 79, train_loss: 1.1778, test_loss: 1.1662, test_f1: 0.3883
 epoch: 80, train_loss: 1.1850, test_loss: 1.1648, test_f1: 0.3888
 epoch: 81, train_loss: 1.1723, test_loss: 1.1658, test_f1: 0.3854
 epoch: 82, train_loss: 1.1676, test_loss: 1.1640, test_f1: 0.3897
 epoch: 83, train_loss: 1.1714, test_loss: 1.1639, test_f1: 0.3941
 epoch: 84, train_loss: 1.1761, test_loss: 1.1624, test_f1: 0.3954
 epoch: 85, train_loss: 1.1708, test_loss: 1.1628, test_f1: 0.3947
 epoch: 86, train_loss: 1.1701, test_loss: 1.1613, test_f1: 0.3887
 epoch: 87, train_loss: 1.1797, test_loss: 1.1620, test_f1: 0.3959
 epoch: 88, train_loss: 1.1729, test_loss: 1.1594, test_f1: 0.3866
 epoch: 89, train_loss: 1.1710, test_loss: 1.1579, test_f1: 0.3920
 epoch: 90, train_loss: 1.1648, test_loss: 1.1595, test_f1: 0.3923
 epoch: 91, train_loss: 1.1634, test_loss: 1.1601, test_f1: 0.3887
 epoch: 92, train_loss: 1.1640, test_loss: 1.1605, test_f1: 0.3869
 epoch: 93, train_loss: 1.1651, test_loss: 1.1569, test_f1: 0.4046
 epoch: 94, train_loss: 1.1623, test_loss: 1.1577, test_f1: 0.3953
 epoch: 95, train_loss: 1.1653, test_loss: 1.1574, test_f1: 0.3922
 epoch: 96, train_loss: 1.1632, test_loss: 1.1573, test_f1: 0.3955
 epoch: 97, train_loss: 1.1663, test_loss: 1.1540, test_f1: 0.3952
 epoch: 98, train_loss: 1.1669, test_loss: 1.1559, test_f1: 0.4002
 epoch: 99, train_loss: 1.1602, test_loss: 1.1554, test_f1: 0.3967
##################ITERATION #7 ****************************************
 epoch: 0, train_loss: 1.3206, test_loss: 1.3121, test_f1: 0.2274
 epoch: 1, train_loss: 1.3027, test_loss: 1.2959, test_f1: 0.2413
 epoch: 2, train_loss: 1.2815, test_loss: 1.2877, test_f1: 0.2346
 epoch: 3, train_loss: 1.2826, test_loss: 1.2811, test_f1: 0.2443
 epoch: 4, train_loss: 1.2806, test_loss: 1.2731, test_f1: 0.2643
 epoch: 5, train_loss: 1.2792, test_loss: 1.2664, test_f1: 0.2663
 epoch: 6, train_loss: 1.2707, test_loss: 1.2612, test_f1: 0.2828
 epoch: 7, train_loss: 1.2591, test_loss: 1.2555, test_f1: 0.2861
 epoch: 8, train_loss: 1.2688, test_loss: 1.2504, test_f1: 0.3010
 epoch: 9, train_loss: 1.2603, test_loss: 1.2496, test_f1: 0.2940
 epoch: 10, train_loss: 1.2576, test_loss: 1.2442, test_f1: 0.3025
 epoch: 11, train_loss: 1.2508, test_loss: 1.2394, test_f1: 0.2998
 epoch: 12, train_loss: 1.2506, test_loss: 1.2380, test_f1: 0.3122
 epoch: 13, train_loss: 1.2480, test_loss: 1.2333, test_f1: 0.3187
 epoch: 14, train_loss: 1.2378, test_loss: 1.2293, test_f1: 0.3254
 epoch: 15, train_loss: 1.2392, test_loss: 1.2249, test_f1: 0.3261
 epoch: 16, train_loss: 1.2371, test_loss: 1.2203, test_f1: 0.3406
 epoch: 17, train_loss: 1.2339, test_loss: 1.2203, test_f1: 0.3263
 epoch: 18, train_loss: 1.2328, test_loss: 1.2183, test_f1: 0.3218
 epoch: 19, train_loss: 1.2335, test_loss: 1.2113, test_f1: 0.3478
 epoch: 20, train_loss: 1.2248, test_loss: 1.2125, test_f1: 0.3353
 epoch: 21, train_loss: 1.2198, test_loss: 1.2091, test_f1: 0.3422
 epoch: 22, train_loss: 1.2286, test_loss: 1.2030, test_f1: 0.3415
 epoch: 23, train_loss: 1.2199, test_loss: 1.2033, test_f1: 0.3469
 epoch: 24, train_loss: 1.2162, test_loss: 1.1993, test_f1: 0.3462
 epoch: 25, train_loss: 1.2226, test_loss: 1.1964, test_f1: 0.3551
 epoch: 26, train_loss: 1.2144, test_loss: 1.1930, test_f1: 0.3526
 epoch: 27, train_loss: 1.2095, test_loss: 1.1912, test_f1: 0.3438
 epoch: 28, train_loss: 1.2073, test_loss: 1.1886, test_f1: 0.3573
 epoch: 29, train_loss: 1.2062, test_loss: 1.1850, test_f1: 0.3573
 epoch: 30, train_loss: 1.2014, test_loss: 1.1817, test_f1: 0.3509
 epoch: 31, train_loss: 1.2016, test_loss: 1.1793, test_f1: 0.3451
 epoch: 32, train_loss: 1.1987, test_loss: 1.1771, test_f1: 0.3683
 epoch: 33, train_loss: 1.2002, test_loss: 1.1739, test_f1: 0.3420
 epoch: 34, train_loss: 1.1919, test_loss: 1.1751, test_f1: 0.3408
 epoch: 35, train_loss: 1.1968, test_loss: 1.1673, test_f1: 0.3489
 epoch: 36, train_loss: 1.1841, test_loss: 1.1665, test_f1: 0.3747
 epoch: 37, train_loss: 1.1893, test_loss: 1.1626, test_f1: 0.3585
 epoch: 38, train_loss: 1.1862, test_loss: 1.1582, test_f1: 0.3491
 epoch: 39, train_loss: 1.1826, test_loss: 1.1584, test_f1: 0.3494
 epoch: 40, train_loss: 1.1764, test_loss: 1.1528, test_f1: 0.3587
 epoch: 41, train_loss: 1.1762, test_loss: 1.1504, test_f1: 0.3701
 epoch: 42, train_loss: 1.1720, test_loss: 1.1497, test_f1: 0.4031
 epoch: 43, train_loss: 1.1789, test_loss: 1.1457, test_f1: 0.3819
 epoch: 44, train_loss: 1.1678, test_loss: 1.1444, test_f1: 0.3998
 epoch: 45, train_loss: 1.1702, test_loss: 1.1408, test_f1: 0.4292
 epoch: 46, train_loss: 1.1733, test_loss: 1.1400, test_f1: 0.4323
 epoch: 47, train_loss: 1.1649, test_loss: 1.1365, test_f1: 0.4280
 epoch: 48, train_loss: 1.1605, test_loss: 1.1331, test_f1: 0.4131
 epoch: 49, train_loss: 1.1613, test_loss: 1.1327, test_f1: 0.4395
 epoch: 50, train_loss: 1.1595, test_loss: 1.1290, test_f1: 0.4356
 epoch: 51, train_loss: 1.1568, test_loss: 1.1292, test_f1: 0.4198
 epoch: 52, train_loss: 1.1676, test_loss: 1.1279, test_f1: 0.4573
 epoch: 53, train_loss: 1.1592, test_loss: 1.1255, test_f1: 0.4283
 epoch: 54, train_loss: 1.1587, test_loss: 1.1243, test_f1: 0.4504
 epoch: 55, train_loss: 1.1539, test_loss: 1.1246, test_f1: 0.4471
 epoch: 56, train_loss: 1.1585, test_loss: 1.1232, test_f1: 0.4543
 epoch: 57, train_loss: 1.1562, test_loss: 1.1240, test_f1: 0.4345
 epoch: 58, train_loss: 1.1539, test_loss: 1.1238, test_f1: 0.4305
 epoch: 59, train_loss: 1.1496, test_loss: 1.1237, test_f1: 0.4314
 epoch: 60, train_loss: 1.1517, test_loss: 1.1197, test_f1: 0.4515
 epoch: 61, train_loss: 1.1505, test_loss: 1.1176, test_f1: 0.4520
 epoch: 62, train_loss: 1.1456, test_loss: 1.1154, test_f1: 0.4428
 epoch: 63, train_loss: 1.1431, test_loss: 1.1148, test_f1: 0.4377
 epoch: 64, train_loss: 1.1508, test_loss: 1.1146, test_f1: 0.4380
 epoch: 65, train_loss: 1.1475, test_loss: 1.1158, test_f1: 0.4369
 epoch: 66, train_loss: 1.1430, test_loss: 1.1132, test_f1: 0.4544
 epoch: 67, train_loss: 1.1556, test_loss: 1.1099, test_f1: 0.4562
 epoch: 68, train_loss: 1.1444, test_loss: 1.1110, test_f1: 0.4412
 epoch: 69, train_loss: 1.1463, test_loss: 1.1060, test_f1: 0.4538
 epoch: 70, train_loss: 1.1447, test_loss: 1.1099, test_f1: 0.4403
 epoch: 71, train_loss: 1.1367, test_loss: 1.1068, test_f1: 0.4418
 epoch: 72, train_loss: 1.1450, test_loss: 1.1054, test_f1: 0.4652
 epoch: 73, train_loss: 1.1427, test_loss: 1.1055, test_f1: 0.4370
 epoch: 74, train_loss: 1.1371, test_loss: 1.1036, test_f1: 0.4533
 epoch: 75, train_loss: 1.1363, test_loss: 1.1042, test_f1: 0.4611
 epoch: 76, train_loss: 1.1426, test_loss: 1.1034, test_f1: 0.4411
 epoch: 77, train_loss: 1.1400, test_loss: 1.1025, test_f1: 0.4563
 epoch: 78, train_loss: 1.1419, test_loss: 1.1027, test_f1: 0.4729
 epoch: 79, train_loss: 1.1388, test_loss: 1.1010, test_f1: 0.4610
 epoch: 80, train_loss: 1.1413, test_loss: 1.1000, test_f1: 0.4611
 epoch: 81, train_loss: 1.1352, test_loss: 1.0986, test_f1: 0.4620
 epoch: 82, train_loss: 1.1355, test_loss: 1.0977, test_f1: 0.4643
 epoch: 83, train_loss: 1.1393, test_loss: 1.0983, test_f1: 0.4387
 epoch: 84, train_loss: 1.1361, test_loss: 1.0955, test_f1: 0.4668
 epoch: 85, train_loss: 1.1257, test_loss: 1.0956, test_f1: 0.4677
 epoch: 86, train_loss: 1.1317, test_loss: 1.0941, test_f1: 0.4485
 epoch: 87, train_loss: 1.1323, test_loss: 1.0930, test_f1: 0.4556
 epoch: 88, train_loss: 1.1360, test_loss: 1.0947, test_f1: 0.4429
 epoch: 89, train_loss: 1.1316, test_loss: 1.0930, test_f1: 0.4634
 epoch: 90, train_loss: 1.1342, test_loss: 1.0924, test_f1: 0.4753
 epoch: 91, train_loss: 1.1319, test_loss: 1.0920, test_f1: 0.4526
 epoch: 92, train_loss: 1.1286, test_loss: 1.0896, test_f1: 0.4670
 epoch: 93, train_loss: 1.1342, test_loss: 1.0933, test_f1: 0.4742
 epoch: 94, train_loss: 1.1389, test_loss: 1.0877, test_f1: 0.4666
 epoch: 95, train_loss: 1.1231, test_loss: 1.0873, test_f1: 0.4811
 epoch: 96, train_loss: 1.1396, test_loss: 1.0879, test_f1: 0.4729
 epoch: 97, train_loss: 1.1207, test_loss: 1.0909, test_f1: 0.4808
 epoch: 98, train_loss: 1.1316, test_loss: 1.0885, test_f1: 0.4699
 epoch: 99, train_loss: 1.1288, test_loss: 1.0869, test_f1: 0.4806
##################ITERATION #8 ****************************************
 epoch: 0, train_loss: 1.3430, test_loss: 1.3199, test_f1: 0.2582
 epoch: 1, train_loss: 1.3134, test_loss: 1.3004, test_f1: 0.2582
 epoch: 2, train_loss: 1.2985, test_loss: 1.2890, test_f1: 0.2579
 epoch: 3, train_loss: 1.2856, test_loss: 1.2774, test_f1: 0.2678
 epoch: 4, train_loss: 1.2808, test_loss: 1.2641, test_f1: 0.2581
 epoch: 5, train_loss: 1.2702, test_loss: 1.2564, test_f1: 0.2748
 epoch: 6, train_loss: 1.2686, test_loss: 1.2465, test_f1: 0.2778
 epoch: 7, train_loss: 1.2599, test_loss: 1.2395, test_f1: 0.2871
 epoch: 8, train_loss: 1.2579, test_loss: 1.2319, test_f1: 0.3021
 epoch: 9, train_loss: 1.2526, test_loss: 1.2269, test_f1: 0.3061
 epoch: 10, train_loss: 1.2446, test_loss: 1.2153, test_f1: 0.3137
 epoch: 11, train_loss: 1.2373, test_loss: 1.2102, test_f1: 0.3201
 epoch: 12, train_loss: 1.2327, test_loss: 1.2036, test_f1: 0.3262
 epoch: 13, train_loss: 1.2282, test_loss: 1.2005, test_f1: 0.3277
 epoch: 14, train_loss: 1.2257, test_loss: 1.1956, test_f1: 0.3333
 epoch: 15, train_loss: 1.2230, test_loss: 1.1843, test_f1: 0.3257
 epoch: 16, train_loss: 1.2170, test_loss: 1.1777, test_f1: 0.3286
 epoch: 17, train_loss: 1.2158, test_loss: 1.1739, test_f1: 0.3230
 epoch: 18, train_loss: 1.2111, test_loss: 1.1721, test_f1: 0.3289
 epoch: 19, train_loss: 1.2073, test_loss: 1.1654, test_f1: 0.3273
 epoch: 20, train_loss: 1.2069, test_loss: 1.1619, test_f1: 0.3368
 epoch: 21, train_loss: 1.1991, test_loss: 1.1575, test_f1: 0.3463
 epoch: 22, train_loss: 1.1976, test_loss: 1.1496, test_f1: 0.3650
 epoch: 23, train_loss: 1.1906, test_loss: 1.1433, test_f1: 0.3720
 epoch: 24, train_loss: 1.1934, test_loss: 1.1377, test_f1: 0.3745
 epoch: 25, train_loss: 1.1920, test_loss: 1.1349, test_f1: 0.3838
 epoch: 26, train_loss: 1.1849, test_loss: 1.1315, test_f1: 0.3837
 epoch: 27, train_loss: 1.1857, test_loss: 1.1275, test_f1: 0.3897
 epoch: 28, train_loss: 1.1830, test_loss: 1.1245, test_f1: 0.3981
 epoch: 29, train_loss: 1.1778, test_loss: 1.1240, test_f1: 0.3968
 epoch: 30, train_loss: 1.1756, test_loss: 1.1191, test_f1: 0.3946
 epoch: 31, train_loss: 1.1644, test_loss: 1.1156, test_f1: 0.4048
 epoch: 32, train_loss: 1.1611, test_loss: 1.1129, test_f1: 0.4122
 epoch: 33, train_loss: 1.1704, test_loss: 1.1087, test_f1: 0.4307
 epoch: 34, train_loss: 1.1640, test_loss: 1.1044, test_f1: 0.4376
 epoch: 35, train_loss: 1.1618, test_loss: 1.1004, test_f1: 0.4423
 epoch: 36, train_loss: 1.1645, test_loss: 1.0988, test_f1: 0.4489
 epoch: 37, train_loss: 1.1568, test_loss: 1.0962, test_f1: 0.4478
 epoch: 38, train_loss: 1.1537, test_loss: 1.0924, test_f1: 0.4519
 epoch: 39, train_loss: 1.1549, test_loss: 1.0907, test_f1: 0.4470
 epoch: 40, train_loss: 1.1500, test_loss: 1.0885, test_f1: 0.4488
 epoch: 41, train_loss: 1.1528, test_loss: 1.0894, test_f1: 0.4560
 epoch: 42, train_loss: 1.1560, test_loss: 1.0855, test_f1: 0.4595
 epoch: 43, train_loss: 1.1445, test_loss: 1.0805, test_f1: 0.4699
 epoch: 44, train_loss: 1.1486, test_loss: 1.0788, test_f1: 0.4717
 epoch: 45, train_loss: 1.1414, test_loss: 1.0761, test_f1: 0.4747
 epoch: 46, train_loss: 1.1390, test_loss: 1.0724, test_f1: 0.4805
 epoch: 47, train_loss: 1.1346, test_loss: 1.0693, test_f1: 0.4709
 epoch: 48, train_loss: 1.1350, test_loss: 1.0688, test_f1: 0.4687
 epoch: 49, train_loss: 1.1446, test_loss: 1.0661, test_f1: 0.4816
 epoch: 50, train_loss: 1.1456, test_loss: 1.0666, test_f1: 0.4662
 epoch: 51, train_loss: 1.1348, test_loss: 1.0634, test_f1: 0.4706
 epoch: 52, train_loss: 1.1367, test_loss: 1.0638, test_f1: 0.4848
 epoch: 53, train_loss: 1.1322, test_loss: 1.0649, test_f1: 0.4653
 epoch: 54, train_loss: 1.1317, test_loss: 1.0606, test_f1: 0.4737
 epoch: 55, train_loss: 1.1310, test_loss: 1.0614, test_f1: 0.4714
 epoch: 56, train_loss: 1.1262, test_loss: 1.0579, test_f1: 0.4712
 epoch: 57, train_loss: 1.1222, test_loss: 1.0554, test_f1: 0.4742
 epoch: 58, train_loss: 1.1221, test_loss: 1.0562, test_f1: 0.4749
 epoch: 59, train_loss: 1.1183, test_loss: 1.0536, test_f1: 0.4715
 epoch: 60, train_loss: 1.1216, test_loss: 1.0520, test_f1: 0.4737
 epoch: 61, train_loss: 1.1217, test_loss: 1.0511, test_f1: 0.4706
 epoch: 62, train_loss: 1.1142, test_loss: 1.0525, test_f1: 0.4723
 epoch: 63, train_loss: 1.1192, test_loss: 1.0492, test_f1: 0.4698
 epoch: 64, train_loss: 1.1219, test_loss: 1.0498, test_f1: 0.4766
 epoch: 65, train_loss: 1.1233, test_loss: 1.0479, test_f1: 0.4752
 epoch: 66, train_loss: 1.1202, test_loss: 1.0470, test_f1: 0.4754
 epoch: 67, train_loss: 1.1170, test_loss: 1.0432, test_f1: 0.4895
 epoch: 68, train_loss: 1.1108, test_loss: 1.0400, test_f1: 0.4764
 epoch: 69, train_loss: 1.1151, test_loss: 1.0431, test_f1: 0.4829
 epoch: 70, train_loss: 1.1084, test_loss: 1.0395, test_f1: 0.4909
 epoch: 71, train_loss: 1.1084, test_loss: 1.0428, test_f1: 0.4821
 epoch: 72, train_loss: 1.1076, test_loss: 1.0395, test_f1: 0.4797
 epoch: 73, train_loss: 1.1101, test_loss: 1.0366, test_f1: 0.4833
 epoch: 74, train_loss: 1.1140, test_loss: 1.0354, test_f1: 0.4834
 epoch: 75, train_loss: 1.1195, test_loss: 1.0341, test_f1: 0.4906
 epoch: 76, train_loss: 1.1040, test_loss: 1.0338, test_f1: 0.4728
 epoch: 77, train_loss: 1.1087, test_loss: 1.0337, test_f1: 0.4891
 epoch: 78, train_loss: 1.1054, test_loss: 1.0321, test_f1: 0.4862
 epoch: 79, train_loss: 1.1047, test_loss: 1.0283, test_f1: 0.4835
 epoch: 80, train_loss: 1.1091, test_loss: 1.0303, test_f1: 0.4889
 epoch: 81, train_loss: 1.1058, test_loss: 1.0251, test_f1: 0.4852
 epoch: 82, train_loss: 1.1031, test_loss: 1.0270, test_f1: 0.4935
 epoch: 83, train_loss: 1.1003, test_loss: 1.0231, test_f1: 0.4889
 epoch: 84, train_loss: 1.1093, test_loss: 1.0248, test_f1: 0.4936
 epoch: 85, train_loss: 1.1069, test_loss: 1.0247, test_f1: 0.4966
 epoch: 86, train_loss: 1.0948, test_loss: 1.0218, test_f1: 0.5021
 epoch: 87, train_loss: 1.1012, test_loss: 1.0243, test_f1: 0.4937
 epoch: 88, train_loss: 1.0984, test_loss: 1.0244, test_f1: 0.4920
 epoch: 89, train_loss: 1.1021, test_loss: 1.0245, test_f1: 0.4977
 epoch: 90, train_loss: 1.0919, test_loss: 1.0207, test_f1: 0.4925
 epoch: 91, train_loss: 1.0914, test_loss: 1.0166, test_f1: 0.4966
 epoch: 92, train_loss: 1.0963, test_loss: 1.0166, test_f1: 0.4997
 epoch: 93, train_loss: 1.0924, test_loss: 1.0172, test_f1: 0.5003
 epoch: 94, train_loss: 1.0942, test_loss: 1.0167, test_f1: 0.5012
 epoch: 95, train_loss: 1.1030, test_loss: 1.0136, test_f1: 0.4967
 epoch: 96, train_loss: 1.0953, test_loss: 1.0078, test_f1: 0.4900
 epoch: 97, train_loss: 1.0909, test_loss: 1.0140, test_f1: 0.4984
 epoch: 98, train_loss: 1.0994, test_loss: 1.0132, test_f1: 0.4797
 epoch: 99, train_loss: 1.0913, test_loss: 1.0087, test_f1: 0.4935
##################ITERATION #9 ****************************************
 epoch: 0, train_loss: 1.3392, test_loss: 1.3322, test_f1: 0.2589
 epoch: 1, train_loss: 1.3166, test_loss: 1.3236, test_f1: 0.2589
 epoch: 2, train_loss: 1.3077, test_loss: 1.3129, test_f1: 0.2589
 epoch: 3, train_loss: 1.2997, test_loss: 1.3039, test_f1: 0.2589
 epoch: 4, train_loss: 1.2888, test_loss: 1.2971, test_f1: 0.2589
 epoch: 5, train_loss: 1.2806, test_loss: 1.2896, test_f1: 0.2589
 epoch: 6, train_loss: 1.2764, test_loss: 1.2847, test_f1: 0.2589
 epoch: 7, train_loss: 1.2724, test_loss: 1.2805, test_f1: 0.2589
 epoch: 8, train_loss: 1.2679, test_loss: 1.2759, test_f1: 0.2589
 epoch: 9, train_loss: 1.2689, test_loss: 1.2687, test_f1: 0.2537
 epoch: 10, train_loss: 1.2622, test_loss: 1.2656, test_f1: 0.2689
 epoch: 11, train_loss: 1.2622, test_loss: 1.2644, test_f1: 0.2594
 epoch: 12, train_loss: 1.2599, test_loss: 1.2600, test_f1: 0.2716
 epoch: 13, train_loss: 1.2555, test_loss: 1.2574, test_f1: 0.2700
 epoch: 14, train_loss: 1.2534, test_loss: 1.2547, test_f1: 0.2837
 epoch: 15, train_loss: 1.2545, test_loss: 1.2553, test_f1: 0.2831
 epoch: 16, train_loss: 1.2535, test_loss: 1.2512, test_f1: 0.2867
 epoch: 17, train_loss: 1.2492, test_loss: 1.2488, test_f1: 0.2995
 epoch: 18, train_loss: 1.2507, test_loss: 1.2439, test_f1: 0.2792
 epoch: 19, train_loss: 1.2472, test_loss: 1.2408, test_f1: 0.2894
 epoch: 20, train_loss: 1.2459, test_loss: 1.2386, test_f1: 0.3058
 epoch: 21, train_loss: 1.2463, test_loss: 1.2374, test_f1: 0.2979
 epoch: 22, train_loss: 1.2429, test_loss: 1.2378, test_f1: 0.2967
 epoch: 23, train_loss: 1.2438, test_loss: 1.2322, test_f1: 0.2961
 epoch: 24, train_loss: 1.2399, test_loss: 1.2287, test_f1: 0.3018
 epoch: 25, train_loss: 1.2404, test_loss: 1.2277, test_f1: 0.2958
 epoch: 26, train_loss: 1.2399, test_loss: 1.2279, test_f1: 0.3060
 epoch: 27, train_loss: 1.2396, test_loss: 1.2252, test_f1: 0.3024
 epoch: 28, train_loss: 1.2326, test_loss: 1.2232, test_f1: 0.2979
 epoch: 29, train_loss: 1.2290, test_loss: 1.2229, test_f1: 0.3179
 epoch: 30, train_loss: 1.2344, test_loss: 1.2194, test_f1: 0.2979
 epoch: 31, train_loss: 1.2265, test_loss: 1.2166, test_f1: 0.3079
 epoch: 32, train_loss: 1.2312, test_loss: 1.2142, test_f1: 0.3010
 epoch: 33, train_loss: 1.2289, test_loss: 1.2121, test_f1: 0.3015
 epoch: 34, train_loss: 1.2237, test_loss: 1.2111, test_f1: 0.3125
 epoch: 35, train_loss: 1.2297, test_loss: 1.2079, test_f1: 0.3086
 epoch: 36, train_loss: 1.2252, test_loss: 1.2046, test_f1: 0.3113
 epoch: 37, train_loss: 1.2254, test_loss: 1.2067, test_f1: 0.3130
 epoch: 38, train_loss: 1.2236, test_loss: 1.2039, test_f1: 0.3160
 epoch: 39, train_loss: 1.2214, test_loss: 1.1994, test_f1: 0.3353
 epoch: 40, train_loss: 1.2204, test_loss: 1.2027, test_f1: 0.3350
 epoch: 41, train_loss: 1.2194, test_loss: 1.1955, test_f1: 0.3299
 epoch: 42, train_loss: 1.2159, test_loss: 1.1925, test_f1: 0.3258
 epoch: 43, train_loss: 1.2130, test_loss: 1.1910, test_f1: 0.3268
 epoch: 44, train_loss: 1.2137, test_loss: 1.1905, test_f1: 0.3338
 epoch: 45, train_loss: 1.2125, test_loss: 1.1872, test_f1: 0.3328
 epoch: 46, train_loss: 1.2114, test_loss: 1.1852, test_f1: 0.3296
 epoch: 47, train_loss: 1.2016, test_loss: 1.1835, test_f1: 0.3290
 epoch: 48, train_loss: 1.2063, test_loss: 1.1804, test_f1: 0.3313
 epoch: 49, train_loss: 1.2093, test_loss: 1.1832, test_f1: 0.3323
 epoch: 50, train_loss: 1.2090, test_loss: 1.1771, test_f1: 0.3312
 epoch: 51, train_loss: 1.2060, test_loss: 1.1744, test_f1: 0.3323
 epoch: 52, train_loss: 1.2087, test_loss: 1.1754, test_f1: 0.3284
 epoch: 53, train_loss: 1.2002, test_loss: 1.1729, test_f1: 0.3301
 epoch: 54, train_loss: 1.1950, test_loss: 1.1728, test_f1: 0.3330
 epoch: 55, train_loss: 1.2058, test_loss: 1.1697, test_f1: 0.3287
 epoch: 56, train_loss: 1.1985, test_loss: 1.1706, test_f1: 0.3272
 epoch: 57, train_loss: 1.1997, test_loss: 1.1701, test_f1: 0.3326
 epoch: 58, train_loss: 1.2037, test_loss: 1.1699, test_f1: 0.3346
 epoch: 59, train_loss: 1.1964, test_loss: 1.1684, test_f1: 0.3309
 epoch: 60, train_loss: 1.2054, test_loss: 1.1691, test_f1: 0.3332
 epoch: 61, train_loss: 1.1991, test_loss: 1.1671, test_f1: 0.3271
 epoch: 62, train_loss: 1.1981, test_loss: 1.1657, test_f1: 0.3332
 epoch: 63, train_loss: 1.1974, test_loss: 1.1654, test_f1: 0.3354
 epoch: 64, train_loss: 1.1919, test_loss: 1.1631, test_f1: 0.3352
 epoch: 65, train_loss: 1.1941, test_loss: 1.1651, test_f1: 0.3346
 epoch: 66, train_loss: 1.1898, test_loss: 1.1620, test_f1: 0.3382
 epoch: 67, train_loss: 1.1953, test_loss: 1.1636, test_f1: 0.3401
 epoch: 68, train_loss: 1.1986, test_loss: 1.1634, test_f1: 0.3382
 epoch: 69, train_loss: 1.1929, test_loss: 1.1597, test_f1: 0.3383
 epoch: 70, train_loss: 1.1944, test_loss: 1.1597, test_f1: 0.3410
 epoch: 71, train_loss: 1.1952, test_loss: 1.1587, test_f1: 0.3279
 epoch: 72, train_loss: 1.1969, test_loss: 1.1598, test_f1: 0.3255
 epoch: 73, train_loss: 1.1916, test_loss: 1.1609, test_f1: 0.3308
 epoch: 74, train_loss: 1.1846, test_loss: 1.1584, test_f1: 0.3292
 epoch: 75, train_loss: 1.1854, test_loss: 1.1567, test_f1: 0.3352
 epoch: 76, train_loss: 1.1859, test_loss: 1.1552, test_f1: 0.3376
 epoch: 77, train_loss: 1.1856, test_loss: 1.1514, test_f1: 0.3431
 epoch: 78, train_loss: 1.1861, test_loss: 1.1519, test_f1: 0.3391
 epoch: 79, train_loss: 1.1894, test_loss: 1.1504, test_f1: 0.3445
 epoch: 80, train_loss: 1.1824, test_loss: 1.1496, test_f1: 0.3374
 epoch: 81, train_loss: 1.1871, test_loss: 1.1515, test_f1: 0.3445
 epoch: 82, train_loss: 1.1797, test_loss: 1.1510, test_f1: 0.3410
 epoch: 83, train_loss: 1.1863, test_loss: 1.1495, test_f1: 0.3361
 epoch: 84, train_loss: 1.1841, test_loss: 1.1475, test_f1: 0.3367
 epoch: 85, train_loss: 1.1921, test_loss: 1.1470, test_f1: 0.3430
 epoch: 86, train_loss: 1.1815, test_loss: 1.1483, test_f1: 0.3368
 epoch: 87, train_loss: 1.1827, test_loss: 1.1488, test_f1: 0.3414
 epoch: 88, train_loss: 1.1879, test_loss: 1.1440, test_f1: 0.3388
 epoch: 89, train_loss: 1.1834, test_loss: 1.1439, test_f1: 0.3400
 epoch: 90, train_loss: 1.1838, test_loss: 1.1436, test_f1: 0.3498
 epoch: 91, train_loss: 1.1818, test_loss: 1.1441, test_f1: 0.3540
 epoch: 92, train_loss: 1.1830, test_loss: 1.1454, test_f1: 0.3559
 epoch: 93, train_loss: 1.1750, test_loss: 1.1412, test_f1: 0.3553
 epoch: 94, train_loss: 1.1802, test_loss: 1.1406, test_f1: 0.3596
 epoch: 95, train_loss: 1.1784, test_loss: 1.1399, test_f1: 0.3579
 epoch: 96, train_loss: 1.1789, test_loss: 1.1386, test_f1: 0.3551
 epoch: 97, train_loss: 1.1759, test_loss: 1.1409, test_f1: 0.3663
 epoch: 98, train_loss: 1.1756, test_loss: 1.1379, test_f1: 0.3629
 epoch: 99, train_loss: 1.1781, test_loss: 1.1381, test_f1: 0.3641

Training completed in 608.30 seconds
Best F1: 0.5021 at epoch 86
Mean F1 across iterations: 0.4098  0.0511
========================FINAL RESULTS================================
FEGIN weighted F1: 0.5021  0.0511
python main.py --data ltspice_examples --representation component_component --model FEGIN --layers 3 --hiddens 16 --batch_size 64 --lr 0.0001 --emb_size 512 --epochs 100 --save_appendix component_component_L3_H16_BS64_LR0.0001_E512 --no_val
-----



STDERR:
  File "main.py", line 370, in <module>
    main()
  File "main.py", line 254, in main
    dataset = dataset_class(
  File "/home/philip/projects/ltspice_examples_code_repo/Circuit-Completion-Using-GNNs/component_classification_with_link_prediction_head/evaluation/FEGIN/kernel/circuit_datasets.py", line 15, in __init__
    self.data, self.slices = torch.load(self.processed_paths[0])
  File "/home/philip/.local/lib/python3.8/site-packages/torch/serialization.py", line 1040, in load
    warnings.warn(
  File "/usr/lib/python3.8/warnings.py", line 109, in _showwarnmsg
    sw(msg.message, msg.category, msg.filename, msg.lineno,
  File "main.py", line 47, in warn_with_traceback
    traceback.print_stack(file=log)
/home/philip/projects/ltspice_examples_code_repo/Circuit-Completion-Using-GNNs/component_classification_with_link_prediction_head/evaluation/FEGIN/kernel/circuit_datasets.py:15: FutureWarning: You are using `torch.load` with `weights_only=False` (the current default value), which uses the default pickle module implicitly. It is possible to construct malicious pickle data which will execute arbitrary code during unpickling (See https://github.com/pytorch/pytorch/blob/main/SECURITY.md#untrusted-models for more details). In a future release, the default value for `weights_only` will be flipped to `True`. This limits the functions that could be executed during unpickling. Arbitrary objects will no longer be allowed to be loaded via this mode unless they are explicitly allowlisted by the user via `torch.serialization.add_safe_globals`. We recommend you start setting `weights_only=True` for any use case where you don't have full control of the loaded file. Please open an issue on GitHub for any issues related to this experimental feature.
  self.data, self.slices = torch.load(self.processed_paths[0])
