STDOUT:
Results will be saved in /home/philip/projects/ltspice_examples_code_repo/Circuit-Completion-Using-GNNs/component_classification_with_link_prediction_head/evaluation/FEGIN/results/model_FEGIN_dataset_ltspice_examples
Command line input: python main.py --data ltspice_examples --representation component_net --model FEGIN --layers 2 --hiddens 64 --batch_size 64 --lr 0.0001 --emb_size 128 --epochs 100 --save_appendix component_net_L2_H64_BS64_LR0.0001_E128 --no_val
 is saved.
-----
ltspice_examples - FEGIN
Using 2 layers, 64 hidden units, h = 2
Loading component_net representation dataset
ENTERED
Training FEGIN on component_net representation
Train: 3558, Test: 846
##################ITERATION #0 ****************************************
 epoch: 0, train_loss: 1.3604, test_loss: 1.3541, test_f1: 0.2270
 epoch: 1, train_loss: 1.3442, test_loss: 1.3421, test_f1: 0.2270
 epoch: 2, train_loss: 1.3303, test_loss: 1.3267, test_f1: 0.2270
 epoch: 3, train_loss: 1.3108, test_loss: 1.3026, test_f1: 0.2270
 epoch: 4, train_loss: 1.2851, test_loss: 1.2721, test_f1: 0.2271
 epoch: 5, train_loss: 1.2584, test_loss: 1.2465, test_f1: 0.2289
 epoch: 6, train_loss: 1.2361, test_loss: 1.2235, test_f1: 0.2677
 epoch: 7, train_loss: 1.2188, test_loss: 1.1998, test_f1: 0.3062
 epoch: 8, train_loss: 1.1944, test_loss: 1.1738, test_f1: 0.3538
 epoch: 9, train_loss: 1.1781, test_loss: 1.1470, test_f1: 0.3723
 epoch: 10, train_loss: 1.1543, test_loss: 1.1198, test_f1: 0.3974
 epoch: 11, train_loss: 1.1322, test_loss: 1.0913, test_f1: 0.4274
 epoch: 12, train_loss: 1.1065, test_loss: 1.0647, test_f1: 0.4439
 epoch: 13, train_loss: 1.0842, test_loss: 1.0408, test_f1: 0.4285
 epoch: 14, train_loss: 1.0623, test_loss: 1.0223, test_f1: 0.4403
 epoch: 15, train_loss: 1.0398, test_loss: 1.0085, test_f1: 0.4429
 epoch: 16, train_loss: 1.0247, test_loss: 0.9884, test_f1: 0.4628
 epoch: 17, train_loss: 1.0138, test_loss: 0.9742, test_f1: 0.4605
 epoch: 18, train_loss: 0.9980, test_loss: 0.9683, test_f1: 0.4664
 epoch: 19, train_loss: 0.9840, test_loss: 0.9567, test_f1: 0.4673
 epoch: 20, train_loss: 0.9766, test_loss: 0.9558, test_f1: 0.4746
 epoch: 21, train_loss: 0.9695, test_loss: 0.9542, test_f1: 0.4786
 epoch: 22, train_loss: 0.9607, test_loss: 0.9528, test_f1: 0.4712
 epoch: 23, train_loss: 0.9591, test_loss: 0.9440, test_f1: 0.4767
 epoch: 24, train_loss: 0.9485, test_loss: 0.9427, test_f1: 0.4826
 epoch: 25, train_loss: 0.9467, test_loss: 0.9311, test_f1: 0.4880
 epoch: 26, train_loss: 0.9417, test_loss: 0.9343, test_f1: 0.4898
 epoch: 27, train_loss: 0.9382, test_loss: 0.9374, test_f1: 0.4794
 epoch: 28, train_loss: 0.9303, test_loss: 0.9287, test_f1: 0.4944
 epoch: 29, train_loss: 0.9250, test_loss: 0.9318, test_f1: 0.4771
 epoch: 30, train_loss: 0.9253, test_loss: 0.9288, test_f1: 0.4856
 epoch: 31, train_loss: 0.9243, test_loss: 0.9295, test_f1: 0.4928
 epoch: 32, train_loss: 0.9213, test_loss: 0.9279, test_f1: 0.4840
 epoch: 33, train_loss: 0.9185, test_loss: 0.9192, test_f1: 0.4967
 epoch: 34, train_loss: 0.9178, test_loss: 0.9220, test_f1: 0.5089
 epoch: 35, train_loss: 0.9071, test_loss: 0.9121, test_f1: 0.5095
 epoch: 36, train_loss: 0.9133, test_loss: 0.9196, test_f1: 0.4991
 epoch: 37, train_loss: 0.8999, test_loss: 0.9062, test_f1: 0.5067
 epoch: 38, train_loss: 0.9017, test_loss: 0.9123, test_f1: 0.5167
 epoch: 39, train_loss: 0.8976, test_loss: 0.9006, test_f1: 0.5176
 epoch: 40, train_loss: 0.8923, test_loss: 0.9116, test_f1: 0.5072
 epoch: 41, train_loss: 0.8911, test_loss: 0.9162, test_f1: 0.4976
 epoch: 42, train_loss: 0.8851, test_loss: 0.8907, test_f1: 0.5263
 epoch: 43, train_loss: 0.8828, test_loss: 0.9027, test_f1: 0.5071
 epoch: 44, train_loss: 0.8768, test_loss: 0.9163, test_f1: 0.5118
 epoch: 45, train_loss: 0.8857, test_loss: 0.9005, test_f1: 0.5112
 epoch: 46, train_loss: 0.8828, test_loss: 0.9004, test_f1: 0.5095
 epoch: 47, train_loss: 0.8679, test_loss: 0.9112, test_f1: 0.5195
 epoch: 48, train_loss: 0.8729, test_loss: 0.8934, test_f1: 0.5106
 epoch: 49, train_loss: 0.8820, test_loss: 0.9191, test_f1: 0.5059
 epoch: 50, train_loss: 0.8722, test_loss: 0.9145, test_f1: 0.5126
 epoch: 51, train_loss: 0.8715, test_loss: 0.9029, test_f1: 0.5093
 epoch: 52, train_loss: 0.8560, test_loss: 0.9044, test_f1: 0.5117
 epoch: 53, train_loss: 0.8639, test_loss: 0.9029, test_f1: 0.5112
 epoch: 54, train_loss: 0.8637, test_loss: 0.8997, test_f1: 0.5103
 epoch: 55, train_loss: 0.8609, test_loss: 0.8827, test_f1: 0.5142
 epoch: 56, train_loss: 0.8581, test_loss: 0.9009, test_f1: 0.5161
 epoch: 57, train_loss: 0.8489, test_loss: 0.9029, test_f1: 0.5140
 epoch: 58, train_loss: 0.8595, test_loss: 0.9043, test_f1: 0.5139
 epoch: 59, train_loss: 0.8621, test_loss: 0.9162, test_f1: 0.5131
 epoch: 60, train_loss: 0.8585, test_loss: 0.9023, test_f1: 0.5168
 epoch: 61, train_loss: 0.8539, test_loss: 0.8942, test_f1: 0.5207
 epoch: 62, train_loss: 0.8482, test_loss: 0.8997, test_f1: 0.5200
 epoch: 63, train_loss: 0.8517, test_loss: 0.8985, test_f1: 0.5182
 epoch: 64, train_loss: 0.8586, test_loss: 0.9053, test_f1: 0.5223
 epoch: 65, train_loss: 0.8441, test_loss: 0.9050, test_f1: 0.5182
 epoch: 66, train_loss: 0.8433, test_loss: 0.9013, test_f1: 0.5250
 epoch: 67, train_loss: 0.8475, test_loss: 0.9156, test_f1: 0.5167
 epoch: 68, train_loss: 0.8502, test_loss: 0.9196, test_f1: 0.5124
 epoch: 69, train_loss: 0.8402, test_loss: 0.9189, test_f1: 0.5144
 epoch: 70, train_loss: 0.8428, test_loss: 0.9052, test_f1: 0.5185
 epoch: 71, train_loss: 0.8414, test_loss: 0.9144, test_f1: 0.5211
 epoch: 72, train_loss: 0.8419, test_loss: 0.9048, test_f1: 0.5256
 epoch: 73, train_loss: 0.8437, test_loss: 0.8948, test_f1: 0.5193
 epoch: 74, train_loss: 0.8448, test_loss: 0.9031, test_f1: 0.5246
 epoch: 75, train_loss: 0.8435, test_loss: 0.9040, test_f1: 0.5190
 epoch: 76, train_loss: 0.8388, test_loss: 0.9223, test_f1: 0.5177
 epoch: 77, train_loss: 0.8416, test_loss: 0.9010, test_f1: 0.5190
 epoch: 78, train_loss: 0.8373, test_loss: 0.9197, test_f1: 0.5174
 epoch: 79, train_loss: 0.8365, test_loss: 0.8990, test_f1: 0.5181
 epoch: 80, train_loss: 0.8324, test_loss: 0.9008, test_f1: 0.5204
 epoch: 81, train_loss: 0.8464, test_loss: 0.9080, test_f1: 0.5270
 epoch: 82, train_loss: 0.8272, test_loss: 0.9132, test_f1: 0.5221
 epoch: 83, train_loss: 0.8307, test_loss: 0.9303, test_f1: 0.5232
 epoch: 84, train_loss: 0.8335, test_loss: 0.9167, test_f1: 0.5211
 epoch: 85, train_loss: 0.8329, test_loss: 0.9042, test_f1: 0.5246
 epoch: 86, train_loss: 0.8305, test_loss: 0.9228, test_f1: 0.5170
 epoch: 87, train_loss: 0.8297, test_loss: 0.8938, test_f1: 0.5166
 epoch: 88, train_loss: 0.8233, test_loss: 0.9204, test_f1: 0.5243
 epoch: 89, train_loss: 0.8250, test_loss: 0.9047, test_f1: 0.5169
 epoch: 90, train_loss: 0.8260, test_loss: 0.9131, test_f1: 0.5237
 epoch: 91, train_loss: 0.8269, test_loss: 0.9256, test_f1: 0.5223
 epoch: 92, train_loss: 0.8318, test_loss: 0.9234, test_f1: 0.5242
 epoch: 93, train_loss: 0.8257, test_loss: 0.9066, test_f1: 0.5220
 epoch: 94, train_loss: 0.8252, test_loss: 0.9222, test_f1: 0.5242
 epoch: 95, train_loss: 0.8231, test_loss: 0.9046, test_f1: 0.5265
 epoch: 96, train_loss: 0.8192, test_loss: 0.9202, test_f1: 0.5213
 epoch: 97, train_loss: 0.8093, test_loss: 0.9309, test_f1: 0.5280
 epoch: 98, train_loss: 0.8159, test_loss: 0.9165, test_f1: 0.5304
 epoch: 99, train_loss: 0.8156, test_loss: 0.8947, test_f1: 0.5315
##################ITERATION #1 ****************************************
 epoch: 0, train_loss: 1.3086, test_loss: 1.2882, test_f1: 0.2270
 epoch: 1, train_loss: 1.2602, test_loss: 1.2371, test_f1: 0.2783
 epoch: 2, train_loss: 1.2370, test_loss: 1.2083, test_f1: 0.2892
 epoch: 3, train_loss: 1.2121, test_loss: 1.1765, test_f1: 0.3133
 epoch: 4, train_loss: 1.1845, test_loss: 1.1474, test_f1: 0.3550
 epoch: 5, train_loss: 1.1540, test_loss: 1.1158, test_f1: 0.3818
 epoch: 6, train_loss: 1.1275, test_loss: 1.0842, test_f1: 0.3736
 epoch: 7, train_loss: 1.0989, test_loss: 1.0516, test_f1: 0.3876
 epoch: 8, train_loss: 1.0691, test_loss: 1.0357, test_f1: 0.4042
 epoch: 9, train_loss: 1.0516, test_loss: 1.0160, test_f1: 0.4065
 epoch: 10, train_loss: 1.0349, test_loss: 1.0040, test_f1: 0.4314
 epoch: 11, train_loss: 1.0182, test_loss: 0.9931, test_f1: 0.4315
 epoch: 12, train_loss: 1.0079, test_loss: 0.9806, test_f1: 0.4571
 epoch: 13, train_loss: 0.9897, test_loss: 0.9721, test_f1: 0.4628
 epoch: 14, train_loss: 0.9850, test_loss: 0.9650, test_f1: 0.4614
 epoch: 15, train_loss: 0.9759, test_loss: 0.9566, test_f1: 0.4701
 epoch: 16, train_loss: 0.9745, test_loss: 0.9581, test_f1: 0.4703
 epoch: 17, train_loss: 0.9638, test_loss: 0.9494, test_f1: 0.4802
 epoch: 18, train_loss: 0.9574, test_loss: 0.9348, test_f1: 0.4982
 epoch: 19, train_loss: 0.9440, test_loss: 0.9406, test_f1: 0.5068
 epoch: 20, train_loss: 0.9394, test_loss: 0.9204, test_f1: 0.5049
 epoch: 21, train_loss: 0.9446, test_loss: 0.9230, test_f1: 0.5121
 epoch: 22, train_loss: 0.9252, test_loss: 0.9224, test_f1: 0.5170
 epoch: 23, train_loss: 0.9250, test_loss: 0.9169, test_f1: 0.5084
 epoch: 24, train_loss: 0.9185, test_loss: 0.9328, test_f1: 0.5043
 epoch: 25, train_loss: 0.9215, test_loss: 0.9133, test_f1: 0.5224
 epoch: 26, train_loss: 0.9116, test_loss: 0.9133, test_f1: 0.4999
 epoch: 27, train_loss: 0.9070, test_loss: 0.9121, test_f1: 0.5159
 epoch: 28, train_loss: 0.9035, test_loss: 0.9140, test_f1: 0.5326
 epoch: 29, train_loss: 0.8984, test_loss: 0.9031, test_f1: 0.5355
 epoch: 30, train_loss: 0.8995, test_loss: 0.9019, test_f1: 0.5198
 epoch: 31, train_loss: 0.8918, test_loss: 0.9089, test_f1: 0.5164
 epoch: 32, train_loss: 0.8984, test_loss: 0.9079, test_f1: 0.5221
 epoch: 33, train_loss: 0.8871, test_loss: 0.9110, test_f1: 0.5234
 epoch: 34, train_loss: 0.8924, test_loss: 0.9057, test_f1: 0.5274
 epoch: 35, train_loss: 0.8861, test_loss: 0.9134, test_f1: 0.5261
 epoch: 36, train_loss: 0.8775, test_loss: 0.9075, test_f1: 0.5322
 epoch: 37, train_loss: 0.8735, test_loss: 0.9000, test_f1: 0.5387
 epoch: 38, train_loss: 0.8748, test_loss: 0.9061, test_f1: 0.5290
 epoch: 39, train_loss: 0.8692, test_loss: 0.9183, test_f1: 0.5267
 epoch: 40, train_loss: 0.8593, test_loss: 0.9114, test_f1: 0.5337
 epoch: 41, train_loss: 0.8584, test_loss: 0.9060, test_f1: 0.5406
 epoch: 42, train_loss: 0.8690, test_loss: 0.9159, test_f1: 0.5335
 epoch: 43, train_loss: 0.8567, test_loss: 0.9070, test_f1: 0.5490
 epoch: 44, train_loss: 0.8603, test_loss: 0.8999, test_f1: 0.5549
 epoch: 45, train_loss: 0.8552, test_loss: 0.9013, test_f1: 0.5667
 epoch: 46, train_loss: 0.8558, test_loss: 0.9115, test_f1: 0.5313
 epoch: 47, train_loss: 0.8522, test_loss: 0.9048, test_f1: 0.5541
 epoch: 48, train_loss: 0.8570, test_loss: 0.8997, test_f1: 0.5445
 epoch: 49, train_loss: 0.8424, test_loss: 0.9156, test_f1: 0.5394
 epoch: 50, train_loss: 0.8355, test_loss: 0.9101, test_f1: 0.5661
 epoch: 51, train_loss: 0.8335, test_loss: 0.9124, test_f1: 0.5598
 epoch: 52, train_loss: 0.8404, test_loss: 0.9053, test_f1: 0.5714
 epoch: 53, train_loss: 0.8351, test_loss: 0.9056, test_f1: 0.5570
 epoch: 54, train_loss: 0.8369, test_loss: 0.9145, test_f1: 0.5520
 epoch: 55, train_loss: 0.8382, test_loss: 0.9073, test_f1: 0.5596
 epoch: 56, train_loss: 0.8287, test_loss: 0.9041, test_f1: 0.5683
 epoch: 57, train_loss: 0.8277, test_loss: 0.9061, test_f1: 0.5624
 epoch: 58, train_loss: 0.8344, test_loss: 0.9018, test_f1: 0.5759
 epoch: 59, train_loss: 0.8276, test_loss: 0.9036, test_f1: 0.5809
 epoch: 60, train_loss: 0.8231, test_loss: 0.9125, test_f1: 0.5459
 epoch: 61, train_loss: 0.8267, test_loss: 0.9097, test_f1: 0.5690
 epoch: 62, train_loss: 0.8221, test_loss: 0.9103, test_f1: 0.5555
 epoch: 63, train_loss: 0.8282, test_loss: 0.9133, test_f1: 0.5635
 epoch: 64, train_loss: 0.8186, test_loss: 0.9127, test_f1: 0.5607
 epoch: 65, train_loss: 0.8236, test_loss: 0.9068, test_f1: 0.5708
 epoch: 66, train_loss: 0.8201, test_loss: 0.9099, test_f1: 0.5689
 epoch: 67, train_loss: 0.8202, test_loss: 0.9105, test_f1: 0.5568
 epoch: 68, train_loss: 0.8219, test_loss: 0.9117, test_f1: 0.5625
 epoch: 69, train_loss: 0.8214, test_loss: 0.9101, test_f1: 0.5681
 epoch: 70, train_loss: 0.8147, test_loss: 0.9076, test_f1: 0.5702
 epoch: 71, train_loss: 0.8080, test_loss: 0.9111, test_f1: 0.5549
 epoch: 72, train_loss: 0.8095, test_loss: 0.9049, test_f1: 0.5608
 epoch: 73, train_loss: 0.8089, test_loss: 0.9183, test_f1: 0.5603
 epoch: 74, train_loss: 0.8060, test_loss: 0.9105, test_f1: 0.5617
 epoch: 75, train_loss: 0.8141, test_loss: 0.9086, test_f1: 0.5664
 epoch: 76, train_loss: 0.7997, test_loss: 0.8996, test_f1: 0.5766
 epoch: 77, train_loss: 0.8126, test_loss: 0.9058, test_f1: 0.5674
 epoch: 78, train_loss: 0.8035, test_loss: 0.9080, test_f1: 0.5684
 epoch: 79, train_loss: 0.8029, test_loss: 0.9038, test_f1: 0.5683
 epoch: 80, train_loss: 0.8078, test_loss: 0.9052, test_f1: 0.5606
 epoch: 81, train_loss: 0.7961, test_loss: 0.9071, test_f1: 0.5615
 epoch: 82, train_loss: 0.7993, test_loss: 0.9063, test_f1: 0.5704
 epoch: 83, train_loss: 0.8040, test_loss: 0.9146, test_f1: 0.5651
 epoch: 84, train_loss: 0.7931, test_loss: 0.9145, test_f1: 0.5593
 epoch: 85, train_loss: 0.8000, test_loss: 0.9137, test_f1: 0.5669
 epoch: 86, train_loss: 0.7942, test_loss: 0.9093, test_f1: 0.5709
 epoch: 87, train_loss: 0.7960, test_loss: 0.9078, test_f1: 0.5650
 epoch: 88, train_loss: 0.8029, test_loss: 0.9104, test_f1: 0.5663
 epoch: 89, train_loss: 0.7921, test_loss: 0.9078, test_f1: 0.5740
 epoch: 90, train_loss: 0.7933, test_loss: 0.9016, test_f1: 0.5947
 epoch: 91, train_loss: 0.7838, test_loss: 0.9105, test_f1: 0.5619
 epoch: 92, train_loss: 0.7964, test_loss: 0.9102, test_f1: 0.5685
 epoch: 93, train_loss: 0.7832, test_loss: 0.9081, test_f1: 0.5728
 epoch: 94, train_loss: 0.7942, test_loss: 0.9106, test_f1: 0.5905
 epoch: 95, train_loss: 0.7831, test_loss: 0.9144, test_f1: 0.5761
 epoch: 96, train_loss: 0.7890, test_loss: 0.9170, test_f1: 0.5636
 epoch: 97, train_loss: 0.7842, test_loss: 0.9181, test_f1: 0.5609
 epoch: 98, train_loss: 0.7861, test_loss: 0.9117, test_f1: 0.5730
 epoch: 99, train_loss: 0.7818, test_loss: 0.9139, test_f1: 0.5663
##################ITERATION #2 ****************************************
 epoch: 0, train_loss: 1.2871, test_loss: 1.2576, test_f1: 0.2270
 epoch: 1, train_loss: 1.2267, test_loss: 1.1822, test_f1: 0.3313
 epoch: 2, train_loss: 1.1914, test_loss: 1.1471, test_f1: 0.3392
 epoch: 3, train_loss: 1.1573, test_loss: 1.1133, test_f1: 0.3502
 epoch: 4, train_loss: 1.1254, test_loss: 1.0892, test_f1: 0.3549
 epoch: 5, train_loss: 1.0987, test_loss: 1.0629, test_f1: 0.3763
 epoch: 6, train_loss: 1.0797, test_loss: 1.0426, test_f1: 0.4036
 epoch: 7, train_loss: 1.0475, test_loss: 1.0227, test_f1: 0.4159
 epoch: 8, train_loss: 1.0378, test_loss: 1.0099, test_f1: 0.4199
 epoch: 9, train_loss: 1.0224, test_loss: 1.0026, test_f1: 0.4422
 epoch: 10, train_loss: 1.0133, test_loss: 0.9963, test_f1: 0.4490
 epoch: 11, train_loss: 1.0054, test_loss: 0.9860, test_f1: 0.4514
 epoch: 12, train_loss: 0.9993, test_loss: 0.9861, test_f1: 0.4635
 epoch: 13, train_loss: 0.9868, test_loss: 0.9760, test_f1: 0.4727
 epoch: 14, train_loss: 0.9778, test_loss: 0.9592, test_f1: 0.4799
 epoch: 15, train_loss: 0.9734, test_loss: 0.9757, test_f1: 0.4815
 epoch: 16, train_loss: 0.9705, test_loss: 0.9551, test_f1: 0.4850
 epoch: 17, train_loss: 0.9654, test_loss: 0.9506, test_f1: 0.4889
 epoch: 18, train_loss: 0.9558, test_loss: 0.9613, test_f1: 0.4897
 epoch: 19, train_loss: 0.9472, test_loss: 0.9501, test_f1: 0.4861
 epoch: 20, train_loss: 0.9437, test_loss: 0.9499, test_f1: 0.4914
 epoch: 21, train_loss: 0.9388, test_loss: 0.9390, test_f1: 0.4989
 epoch: 22, train_loss: 0.9413, test_loss: 0.9535, test_f1: 0.5032
 epoch: 23, train_loss: 0.9297, test_loss: 0.9424, test_f1: 0.4986
 epoch: 24, train_loss: 0.9277, test_loss: 0.9242, test_f1: 0.5092
 epoch: 25, train_loss: 0.9297, test_loss: 0.9236, test_f1: 0.5025
 epoch: 26, train_loss: 0.9228, test_loss: 0.9187, test_f1: 0.5176
 epoch: 27, train_loss: 0.9205, test_loss: 0.9291, test_f1: 0.5106
 epoch: 28, train_loss: 0.9181, test_loss: 0.9195, test_f1: 0.5150
 epoch: 29, train_loss: 0.9166, test_loss: 0.9204, test_f1: 0.5200
 epoch: 30, train_loss: 0.9193, test_loss: 0.9204, test_f1: 0.5230
 epoch: 31, train_loss: 0.9106, test_loss: 0.9319, test_f1: 0.5316
 epoch: 32, train_loss: 0.9050, test_loss: 0.9233, test_f1: 0.5270
 epoch: 33, train_loss: 0.9016, test_loss: 0.9246, test_f1: 0.5207
 epoch: 34, train_loss: 0.8968, test_loss: 0.8959, test_f1: 0.5337
 epoch: 35, train_loss: 0.8910, test_loss: 0.9255, test_f1: 0.5231
 epoch: 36, train_loss: 0.8909, test_loss: 0.9195, test_f1: 0.5263
 epoch: 37, train_loss: 0.8906, test_loss: 0.9035, test_f1: 0.5287
 epoch: 38, train_loss: 0.8861, test_loss: 0.9051, test_f1: 0.5248
 epoch: 39, train_loss: 0.8789, test_loss: 0.8859, test_f1: 0.5352
 epoch: 40, train_loss: 0.8831, test_loss: 0.9090, test_f1: 0.5352
 epoch: 41, train_loss: 0.8728, test_loss: 0.9049, test_f1: 0.5225
 epoch: 42, train_loss: 0.8729, test_loss: 0.8971, test_f1: 0.5307
 epoch: 43, train_loss: 0.8613, test_loss: 0.9148, test_f1: 0.5185
 epoch: 44, train_loss: 0.8686, test_loss: 0.8969, test_f1: 0.5284
 epoch: 45, train_loss: 0.8636, test_loss: 0.9221, test_f1: 0.5265
 epoch: 46, train_loss: 0.8642, test_loss: 0.8932, test_f1: 0.5427
 epoch: 47, train_loss: 0.8636, test_loss: 0.9022, test_f1: 0.5297
 epoch: 48, train_loss: 0.8602, test_loss: 0.8859, test_f1: 0.5274
 epoch: 49, train_loss: 0.8608, test_loss: 0.8915, test_f1: 0.5448
 epoch: 50, train_loss: 0.8483, test_loss: 0.8886, test_f1: 0.5447
 epoch: 51, train_loss: 0.8565, test_loss: 0.8893, test_f1: 0.5448
 epoch: 52, train_loss: 0.8438, test_loss: 0.8999, test_f1: 0.5306
 epoch: 53, train_loss: 0.8537, test_loss: 0.8852, test_f1: 0.5412
 epoch: 54, train_loss: 0.8405, test_loss: 0.8719, test_f1: 0.5420
 epoch: 55, train_loss: 0.8492, test_loss: 0.8898, test_f1: 0.5404
 epoch: 56, train_loss: 0.8320, test_loss: 0.8800, test_f1: 0.5446
 epoch: 57, train_loss: 0.8374, test_loss: 0.8776, test_f1: 0.5429
 epoch: 58, train_loss: 0.8312, test_loss: 0.9080, test_f1: 0.5342
 epoch: 59, train_loss: 0.8324, test_loss: 0.8880, test_f1: 0.5349
 epoch: 60, train_loss: 0.8258, test_loss: 0.8869, test_f1: 0.5344
 epoch: 61, train_loss: 0.8365, test_loss: 0.8825, test_f1: 0.5419
 epoch: 62, train_loss: 0.8282, test_loss: 0.8905, test_f1: 0.5349
 epoch: 63, train_loss: 0.8257, test_loss: 0.8706, test_f1: 0.5463
 epoch: 64, train_loss: 0.8293, test_loss: 0.8835, test_f1: 0.5374
 epoch: 65, train_loss: 0.8344, test_loss: 0.8727, test_f1: 0.5419
 epoch: 66, train_loss: 0.8267, test_loss: 0.8981, test_f1: 0.5318
 epoch: 67, train_loss: 0.8319, test_loss: 0.8905, test_f1: 0.5361
 epoch: 68, train_loss: 0.8342, test_loss: 0.8897, test_f1: 0.5323
 epoch: 69, train_loss: 0.8245, test_loss: 0.8919, test_f1: 0.5322
 epoch: 70, train_loss: 0.8221, test_loss: 0.8907, test_f1: 0.5415
 epoch: 71, train_loss: 0.8150, test_loss: 0.8720, test_f1: 0.5511
 epoch: 72, train_loss: 0.8232, test_loss: 0.8810, test_f1: 0.5392
 epoch: 73, train_loss: 0.8194, test_loss: 0.8953, test_f1: 0.5410
 epoch: 74, train_loss: 0.8222, test_loss: 0.8743, test_f1: 0.5316
 epoch: 75, train_loss: 0.8200, test_loss: 0.8778, test_f1: 0.5431
 epoch: 76, train_loss: 0.8186, test_loss: 0.8911, test_f1: 0.5364
 epoch: 77, train_loss: 0.8237, test_loss: 0.8951, test_f1: 0.5420
 epoch: 78, train_loss: 0.8132, test_loss: 0.8942, test_f1: 0.5351
 epoch: 79, train_loss: 0.8155, test_loss: 0.8830, test_f1: 0.5430
 epoch: 80, train_loss: 0.8062, test_loss: 0.8935, test_f1: 0.5398
 epoch: 81, train_loss: 0.8127, test_loss: 0.8597, test_f1: 0.5514
 epoch: 82, train_loss: 0.8134, test_loss: 0.8921, test_f1: 0.5418
 epoch: 83, train_loss: 0.8191, test_loss: 0.8868, test_f1: 0.5404
 epoch: 84, train_loss: 0.8113, test_loss: 0.8752, test_f1: 0.5515
 epoch: 85, train_loss: 0.8066, test_loss: 0.8904, test_f1: 0.5410
 epoch: 86, train_loss: 0.8072, test_loss: 0.8811, test_f1: 0.5451
 epoch: 87, train_loss: 0.8062, test_loss: 0.8756, test_f1: 0.5401
 epoch: 88, train_loss: 0.8035, test_loss: 0.8793, test_f1: 0.5435
 epoch: 89, train_loss: 0.8024, test_loss: 0.8907, test_f1: 0.5440
 epoch: 90, train_loss: 0.8078, test_loss: 0.8935, test_f1: 0.5453
 epoch: 91, train_loss: 0.7952, test_loss: 0.8779, test_f1: 0.5432
 epoch: 92, train_loss: 0.7944, test_loss: 0.8855, test_f1: 0.5446
 epoch: 93, train_loss: 0.7959, test_loss: 0.8689, test_f1: 0.5489
 epoch: 94, train_loss: 0.8009, test_loss: 0.9037, test_f1: 0.5412
 epoch: 95, train_loss: 0.8000, test_loss: 0.8986, test_f1: 0.5461
 epoch: 96, train_loss: 0.7936, test_loss: 0.8772, test_f1: 0.5467
 epoch: 97, train_loss: 0.7862, test_loss: 0.8780, test_f1: 0.5447
 epoch: 98, train_loss: 0.7850, test_loss: 0.8858, test_f1: 0.5458
 epoch: 99, train_loss: 0.7910, test_loss: 0.8893, test_f1: 0.5419
##################ITERATION #3 ****************************************
 epoch: 0, train_loss: 1.2622, test_loss: 1.2203, test_f1: 0.2487
 epoch: 1, train_loss: 1.1992, test_loss: 1.1606, test_f1: 0.3619
 epoch: 2, train_loss: 1.1734, test_loss: 1.1308, test_f1: 0.3908
 epoch: 3, train_loss: 1.1453, test_loss: 1.1010, test_f1: 0.4419
 epoch: 4, train_loss: 1.1255, test_loss: 1.0767, test_f1: 0.4447
 epoch: 5, train_loss: 1.0994, test_loss: 1.0572, test_f1: 0.4415
 epoch: 6, train_loss: 1.0774, test_loss: 1.0363, test_f1: 0.4474
 epoch: 7, train_loss: 1.0559, test_loss: 1.0191, test_f1: 0.4494
 epoch: 8, train_loss: 1.0456, test_loss: 1.0043, test_f1: 0.4545
 epoch: 9, train_loss: 1.0263, test_loss: 0.9957, test_f1: 0.4546
 epoch: 10, train_loss: 1.0170, test_loss: 0.9882, test_f1: 0.4595
 epoch: 11, train_loss: 1.0017, test_loss: 0.9842, test_f1: 0.4540
 epoch: 12, train_loss: 0.9924, test_loss: 0.9789, test_f1: 0.4657
 epoch: 13, train_loss: 0.9889, test_loss: 0.9690, test_f1: 0.4707
 epoch: 14, train_loss: 0.9802, test_loss: 0.9733, test_f1: 0.4655
 epoch: 15, train_loss: 0.9651, test_loss: 0.9692, test_f1: 0.4774
 epoch: 16, train_loss: 0.9650, test_loss: 0.9598, test_f1: 0.4708
 epoch: 17, train_loss: 0.9596, test_loss: 0.9611, test_f1: 0.4916
 epoch: 18, train_loss: 0.9586, test_loss: 0.9553, test_f1: 0.4919
 epoch: 19, train_loss: 0.9431, test_loss: 0.9602, test_f1: 0.4880
 epoch: 20, train_loss: 0.9420, test_loss: 0.9621, test_f1: 0.5030
 epoch: 21, train_loss: 0.9401, test_loss: 0.9634, test_f1: 0.5050
 epoch: 22, train_loss: 0.9320, test_loss: 0.9674, test_f1: 0.5138
 epoch: 23, train_loss: 0.9275, test_loss: 0.9599, test_f1: 0.5140
 epoch: 24, train_loss: 0.9190, test_loss: 0.9470, test_f1: 0.5068
 epoch: 25, train_loss: 0.9238, test_loss: 0.9606, test_f1: 0.5178
 epoch: 26, train_loss: 0.9154, test_loss: 0.9591, test_f1: 0.5303
 epoch: 27, train_loss: 0.9192, test_loss: 0.9703, test_f1: 0.5244
 epoch: 28, train_loss: 0.9114, test_loss: 0.9434, test_f1: 0.5203
 epoch: 29, train_loss: 0.9091, test_loss: 0.9382, test_f1: 0.5217
 epoch: 30, train_loss: 0.9142, test_loss: 0.9490, test_f1: 0.5251
 epoch: 31, train_loss: 0.9057, test_loss: 0.9604, test_f1: 0.5245
 epoch: 32, train_loss: 0.8893, test_loss: 0.9453, test_f1: 0.5240
 epoch: 33, train_loss: 0.8958, test_loss: 0.9429, test_f1: 0.5316
 epoch: 34, train_loss: 0.8900, test_loss: 0.9381, test_f1: 0.5249
 epoch: 35, train_loss: 0.8840, test_loss: 0.9549, test_f1: 0.5257
 epoch: 36, train_loss: 0.8736, test_loss: 0.9481, test_f1: 0.5301
 epoch: 37, train_loss: 0.8863, test_loss: 0.9396, test_f1: 0.5285
 epoch: 38, train_loss: 0.8662, test_loss: 0.9389, test_f1: 0.5240
 epoch: 39, train_loss: 0.8730, test_loss: 0.9412, test_f1: 0.5217
 epoch: 40, train_loss: 0.8722, test_loss: 0.9378, test_f1: 0.5265
 epoch: 41, train_loss: 0.8807, test_loss: 0.9424, test_f1: 0.5297
 epoch: 42, train_loss: 0.8619, test_loss: 0.9381, test_f1: 0.5082
 epoch: 43, train_loss: 0.8664, test_loss: 0.9403, test_f1: 0.5252
 epoch: 44, train_loss: 0.8578, test_loss: 0.9359, test_f1: 0.5340
 epoch: 45, train_loss: 0.8622, test_loss: 0.9413, test_f1: 0.5179
 epoch: 46, train_loss: 0.8504, test_loss: 0.9349, test_f1: 0.5273
 epoch: 47, train_loss: 0.8537, test_loss: 0.9210, test_f1: 0.5307
 epoch: 48, train_loss: 0.8461, test_loss: 0.9349, test_f1: 0.5246
 epoch: 49, train_loss: 0.8483, test_loss: 0.9422, test_f1: 0.5291
 epoch: 50, train_loss: 0.8454, test_loss: 0.9545, test_f1: 0.5164
 epoch: 51, train_loss: 0.8434, test_loss: 0.9439, test_f1: 0.5241
 epoch: 52, train_loss: 0.8333, test_loss: 0.9349, test_f1: 0.5348
 epoch: 53, train_loss: 0.8269, test_loss: 0.9530, test_f1: 0.5286
 epoch: 54, train_loss: 0.8387, test_loss: 0.9408, test_f1: 0.5249
 epoch: 55, train_loss: 0.8368, test_loss: 0.9452, test_f1: 0.5216
 epoch: 56, train_loss: 0.8210, test_loss: 0.9447, test_f1: 0.5270
 epoch: 57, train_loss: 0.8214, test_loss: 0.9408, test_f1: 0.5211
 epoch: 58, train_loss: 0.8378, test_loss: 0.9562, test_f1: 0.5144
 epoch: 59, train_loss: 0.8325, test_loss: 0.9526, test_f1: 0.5231
 epoch: 60, train_loss: 0.8327, test_loss: 0.9509, test_f1: 0.5248
 epoch: 61, train_loss: 0.8310, test_loss: 0.9680, test_f1: 0.5212
 epoch: 62, train_loss: 0.8326, test_loss: 0.9410, test_f1: 0.5282
 epoch: 63, train_loss: 0.8242, test_loss: 0.9484, test_f1: 0.5259
 epoch: 64, train_loss: 0.8266, test_loss: 0.9328, test_f1: 0.5269
 epoch: 65, train_loss: 0.8234, test_loss: 0.9464, test_f1: 0.5321
 epoch: 66, train_loss: 0.8290, test_loss: 0.9364, test_f1: 0.5291
 epoch: 67, train_loss: 0.8256, test_loss: 0.9389, test_f1: 0.5283
 epoch: 68, train_loss: 0.8210, test_loss: 0.9468, test_f1: 0.5237
 epoch: 69, train_loss: 0.8241, test_loss: 0.9405, test_f1: 0.5212
 epoch: 70, train_loss: 0.8229, test_loss: 0.9386, test_f1: 0.5221
 epoch: 71, train_loss: 0.8087, test_loss: 0.9445, test_f1: 0.5245
 epoch: 72, train_loss: 0.8168, test_loss: 0.9479, test_f1: 0.5173
 epoch: 73, train_loss: 0.8103, test_loss: 0.9421, test_f1: 0.5241
 epoch: 74, train_loss: 0.8097, test_loss: 0.9433, test_f1: 0.5236
 epoch: 75, train_loss: 0.8165, test_loss: 0.9632, test_f1: 0.5223
 epoch: 76, train_loss: 0.8095, test_loss: 0.9458, test_f1: 0.5234
 epoch: 77, train_loss: 0.8026, test_loss: 0.9452, test_f1: 0.5282
 epoch: 78, train_loss: 0.8098, test_loss: 0.9500, test_f1: 0.5204
 epoch: 79, train_loss: 0.8137, test_loss: 0.9485, test_f1: 0.5212
 epoch: 80, train_loss: 0.8087, test_loss: 0.9524, test_f1: 0.5233
 epoch: 81, train_loss: 0.8139, test_loss: 0.9370, test_f1: 0.5290
 epoch: 82, train_loss: 0.7987, test_loss: 0.9402, test_f1: 0.5182
 epoch: 83, train_loss: 0.8128, test_loss: 0.9511, test_f1: 0.5252
 epoch: 84, train_loss: 0.8111, test_loss: 0.9644, test_f1: 0.5111
 epoch: 85, train_loss: 0.8166, test_loss: 0.9462, test_f1: 0.5267
 epoch: 86, train_loss: 0.8037, test_loss: 0.9485, test_f1: 0.5181
 epoch: 87, train_loss: 0.8105, test_loss: 0.9467, test_f1: 0.5276
 epoch: 88, train_loss: 0.8020, test_loss: 0.9570, test_f1: 0.5259
 epoch: 89, train_loss: 0.7998, test_loss: 0.9526, test_f1: 0.5351
 epoch: 90, train_loss: 0.7956, test_loss: 0.9581, test_f1: 0.5202
 epoch: 91, train_loss: 0.8022, test_loss: 0.9477, test_f1: 0.5269
 epoch: 92, train_loss: 0.7955, test_loss: 0.9634, test_f1: 0.5135
 epoch: 93, train_loss: 0.8000, test_loss: 0.9520, test_f1: 0.5139
 epoch: 94, train_loss: 0.7934, test_loss: 0.9596, test_f1: 0.5134
 epoch: 95, train_loss: 0.7954, test_loss: 0.9619, test_f1: 0.5192
 epoch: 96, train_loss: 0.7975, test_loss: 0.9561, test_f1: 0.5132
 epoch: 97, train_loss: 0.7971, test_loss: 0.9531, test_f1: 0.5161
 epoch: 98, train_loss: 0.7897, test_loss: 0.9596, test_f1: 0.5170
 epoch: 99, train_loss: 0.7885, test_loss: 0.9482, test_f1: 0.5101
##################ITERATION #4 ****************************************
 epoch: 0, train_loss: 1.2553, test_loss: 1.1871, test_f1: 0.2801
 epoch: 1, train_loss: 1.1736, test_loss: 1.1127, test_f1: 0.3735
 epoch: 2, train_loss: 1.1443, test_loss: 1.0860, test_f1: 0.3956
 epoch: 3, train_loss: 1.1183, test_loss: 1.0608, test_f1: 0.4260
 epoch: 4, train_loss: 1.0959, test_loss: 1.0371, test_f1: 0.4435
 epoch: 5, train_loss: 1.0718, test_loss: 1.0247, test_f1: 0.4508
 epoch: 6, train_loss: 1.0585, test_loss: 1.0100, test_f1: 0.4633
 epoch: 7, train_loss: 1.0352, test_loss: 1.0033, test_f1: 0.4649
 epoch: 8, train_loss: 1.0135, test_loss: 0.9858, test_f1: 0.4652
 epoch: 9, train_loss: 1.0111, test_loss: 0.9761, test_f1: 0.4935
 epoch: 10, train_loss: 0.9980, test_loss: 0.9720, test_f1: 0.4809
 epoch: 11, train_loss: 0.9855, test_loss: 0.9616, test_f1: 0.4944
 epoch: 12, train_loss: 0.9770, test_loss: 0.9544, test_f1: 0.4855
 epoch: 13, train_loss: 0.9644, test_loss: 0.9506, test_f1: 0.4955
 epoch: 14, train_loss: 0.9547, test_loss: 0.9463, test_f1: 0.4914
 epoch: 15, train_loss: 0.9597, test_loss: 0.9460, test_f1: 0.5003
 epoch: 16, train_loss: 0.9441, test_loss: 0.9353, test_f1: 0.5094
 epoch: 17, train_loss: 0.9398, test_loss: 0.9366, test_f1: 0.5099
 epoch: 18, train_loss: 0.9384, test_loss: 0.9328, test_f1: 0.5057
 epoch: 19, train_loss: 0.9284, test_loss: 0.9291, test_f1: 0.5053
 epoch: 20, train_loss: 0.9257, test_loss: 0.9289, test_f1: 0.5107
 epoch: 21, train_loss: 0.9190, test_loss: 0.9246, test_f1: 0.5131
 epoch: 22, train_loss: 0.9131, test_loss: 0.9206, test_f1: 0.5336
 epoch: 23, train_loss: 0.9055, test_loss: 0.9188, test_f1: 0.5385
 epoch: 24, train_loss: 0.9050, test_loss: 0.9164, test_f1: 0.5414
 epoch: 25, train_loss: 0.8956, test_loss: 0.9305, test_f1: 0.5200
 epoch: 26, train_loss: 0.8899, test_loss: 0.9162, test_f1: 0.5427
 epoch: 27, train_loss: 0.8979, test_loss: 0.9267, test_f1: 0.5346
 epoch: 28, train_loss: 0.8877, test_loss: 0.9543, test_f1: 0.5125
 epoch: 29, train_loss: 0.8945, test_loss: 0.9251, test_f1: 0.5392
 epoch: 30, train_loss: 0.8830, test_loss: 0.9280, test_f1: 0.5182
 epoch: 31, train_loss: 0.8762, test_loss: 0.9265, test_f1: 0.5334
 epoch: 32, train_loss: 0.8732, test_loss: 0.9250, test_f1: 0.5431
 epoch: 33, train_loss: 0.8801, test_loss: 0.9308, test_f1: 0.5336
 epoch: 34, train_loss: 0.8654, test_loss: 0.9445, test_f1: 0.5187
 epoch: 35, train_loss: 0.8690, test_loss: 0.9245, test_f1: 0.5270
 epoch: 36, train_loss: 0.8624, test_loss: 0.9210, test_f1: 0.5397
 epoch: 37, train_loss: 0.8603, test_loss: 0.9285, test_f1: 0.5202
 epoch: 38, train_loss: 0.8526, test_loss: 0.9240, test_f1: 0.5345
 epoch: 39, train_loss: 0.8530, test_loss: 0.9253, test_f1: 0.5360
 epoch: 40, train_loss: 0.8575, test_loss: 0.9235, test_f1: 0.5423
 epoch: 41, train_loss: 0.8527, test_loss: 0.9177, test_f1: 0.5276
 epoch: 42, train_loss: 0.8438, test_loss: 0.9207, test_f1: 0.5451
 epoch: 43, train_loss: 0.8417, test_loss: 0.9280, test_f1: 0.5372
 epoch: 44, train_loss: 0.8330, test_loss: 0.9267, test_f1: 0.5392
 epoch: 45, train_loss: 0.8433, test_loss: 0.9212, test_f1: 0.5402
 epoch: 46, train_loss: 0.8314, test_loss: 0.9169, test_f1: 0.5331
 epoch: 47, train_loss: 0.8319, test_loss: 0.9185, test_f1: 0.5323
 epoch: 48, train_loss: 0.8278, test_loss: 0.9287, test_f1: 0.5390
 epoch: 49, train_loss: 0.8235, test_loss: 0.9002, test_f1: 0.5431
 epoch: 50, train_loss: 0.8165, test_loss: 0.9114, test_f1: 0.5501
 epoch: 51, train_loss: 0.8222, test_loss: 0.9151, test_f1: 0.5382
 epoch: 52, train_loss: 0.8262, test_loss: 0.9230, test_f1: 0.5412
 epoch: 53, train_loss: 0.8167, test_loss: 0.9119, test_f1: 0.5522
 epoch: 54, train_loss: 0.8136, test_loss: 0.9135, test_f1: 0.5460
 epoch: 55, train_loss: 0.8124, test_loss: 0.9231, test_f1: 0.5433
 epoch: 56, train_loss: 0.8061, test_loss: 0.9271, test_f1: 0.5423
 epoch: 57, train_loss: 0.8079, test_loss: 0.9329, test_f1: 0.5323
 epoch: 58, train_loss: 0.8174, test_loss: 0.9253, test_f1: 0.5495
 epoch: 59, train_loss: 0.8045, test_loss: 0.9145, test_f1: 0.5407
 epoch: 60, train_loss: 0.8066, test_loss: 0.9204, test_f1: 0.5519
 epoch: 61, train_loss: 0.8157, test_loss: 0.9224, test_f1: 0.5358
 epoch: 62, train_loss: 0.7985, test_loss: 0.9232, test_f1: 0.5344
 epoch: 63, train_loss: 0.8008, test_loss: 0.9237, test_f1: 0.5474
 epoch: 64, train_loss: 0.8026, test_loss: 0.9175, test_f1: 0.5316
 epoch: 65, train_loss: 0.8051, test_loss: 0.9210, test_f1: 0.5435
 epoch: 66, train_loss: 0.7996, test_loss: 0.9240, test_f1: 0.5437
 epoch: 67, train_loss: 0.7999, test_loss: 0.9023, test_f1: 0.5532
 epoch: 68, train_loss: 0.7928, test_loss: 0.9098, test_f1: 0.5533
 epoch: 69, train_loss: 0.8073, test_loss: 0.9161, test_f1: 0.5459
 epoch: 70, train_loss: 0.8023, test_loss: 0.9103, test_f1: 0.5506
 epoch: 71, train_loss: 0.7947, test_loss: 0.9223, test_f1: 0.5625
 epoch: 72, train_loss: 0.8024, test_loss: 0.9182, test_f1: 0.5517
 epoch: 73, train_loss: 0.7849, test_loss: 0.9201, test_f1: 0.5550
 epoch: 74, train_loss: 0.7983, test_loss: 0.9151, test_f1: 0.5564
 epoch: 75, train_loss: 0.7982, test_loss: 0.9187, test_f1: 0.5516
 epoch: 76, train_loss: 0.7886, test_loss: 0.9274, test_f1: 0.5497
 epoch: 77, train_loss: 0.7927, test_loss: 0.9304, test_f1: 0.5470
 epoch: 78, train_loss: 0.7838, test_loss: 0.9220, test_f1: 0.5442
 epoch: 79, train_loss: 0.7808, test_loss: 0.9223, test_f1: 0.5511
 epoch: 80, train_loss: 0.7794, test_loss: 0.9141, test_f1: 0.5539
 epoch: 81, train_loss: 0.7877, test_loss: 0.9376, test_f1: 0.5549
 epoch: 82, train_loss: 0.7845, test_loss: 0.9127, test_f1: 0.5474
 epoch: 83, train_loss: 0.7897, test_loss: 0.9110, test_f1: 0.5627
 epoch: 84, train_loss: 0.7832, test_loss: 0.9104, test_f1: 0.5604
 epoch: 85, train_loss: 0.7905, test_loss: 0.9062, test_f1: 0.5579
 epoch: 86, train_loss: 0.7663, test_loss: 0.9183, test_f1: 0.5635
 epoch: 87, train_loss: 0.7770, test_loss: 0.9222, test_f1: 0.5473
 epoch: 88, train_loss: 0.7766, test_loss: 0.9267, test_f1: 0.5568
 epoch: 89, train_loss: 0.7707, test_loss: 0.9308, test_f1: 0.5617
 epoch: 90, train_loss: 0.7793, test_loss: 0.9276, test_f1: 0.5464
 epoch: 91, train_loss: 0.7799, test_loss: 0.9280, test_f1: 0.5525
 epoch: 92, train_loss: 0.7785, test_loss: 0.9258, test_f1: 0.5546
 epoch: 93, train_loss: 0.7669, test_loss: 0.9204, test_f1: 0.5506
 epoch: 94, train_loss: 0.7591, test_loss: 0.9283, test_f1: 0.5612
 epoch: 95, train_loss: 0.7741, test_loss: 0.9243, test_f1: 0.5606
 epoch: 96, train_loss: 0.7663, test_loss: 0.9228, test_f1: 0.5624
 epoch: 97, train_loss: 0.7690, test_loss: 0.9246, test_f1: 0.5544
 epoch: 98, train_loss: 0.7741, test_loss: 0.9229, test_f1: 0.5643
 epoch: 99, train_loss: 0.7739, test_loss: 0.9141, test_f1: 0.5601
##################ITERATION #5 ****************************************
 epoch: 0, train_loss: 1.2903, test_loss: 1.1767, test_f1: 0.3255
 epoch: 1, train_loss: 1.1794, test_loss: 1.1174, test_f1: 0.3492
 epoch: 2, train_loss: 1.1483, test_loss: 1.0823, test_f1: 0.3722
 epoch: 3, train_loss: 1.1156, test_loss: 1.0582, test_f1: 0.3967
 epoch: 4, train_loss: 1.0929, test_loss: 1.0406, test_f1: 0.4205
 epoch: 5, train_loss: 1.0688, test_loss: 1.0309, test_f1: 0.4355
 epoch: 6, train_loss: 1.0462, test_loss: 1.0063, test_f1: 0.4446
 epoch: 7, train_loss: 1.0303, test_loss: 1.0064, test_f1: 0.4541
 epoch: 8, train_loss: 1.0247, test_loss: 0.9952, test_f1: 0.4571
 epoch: 9, train_loss: 1.0140, test_loss: 0.9867, test_f1: 0.4569
 epoch: 10, train_loss: 1.0017, test_loss: 0.9755, test_f1: 0.4590
 epoch: 11, train_loss: 0.9935, test_loss: 0.9658, test_f1: 0.4635
 epoch: 12, train_loss: 0.9807, test_loss: 0.9674, test_f1: 0.4767
 epoch: 13, train_loss: 0.9697, test_loss: 0.9648, test_f1: 0.4708
 epoch: 14, train_loss: 0.9720, test_loss: 0.9561, test_f1: 0.4778
 epoch: 15, train_loss: 0.9659, test_loss: 0.9641, test_f1: 0.4831
 epoch: 16, train_loss: 0.9599, test_loss: 0.9625, test_f1: 0.4844
 epoch: 17, train_loss: 0.9549, test_loss: 0.9554, test_f1: 0.4813
 epoch: 18, train_loss: 0.9430, test_loss: 0.9624, test_f1: 0.5000
 epoch: 19, train_loss: 0.9339, test_loss: 0.9354, test_f1: 0.5014
 epoch: 20, train_loss: 0.9366, test_loss: 0.9527, test_f1: 0.4984
 epoch: 21, train_loss: 0.9311, test_loss: 0.9354, test_f1: 0.5083
 epoch: 22, train_loss: 0.9258, test_loss: 0.9222, test_f1: 0.5046
 epoch: 23, train_loss: 0.9296, test_loss: 0.9355, test_f1: 0.5129
 epoch: 24, train_loss: 0.9185, test_loss: 0.9231, test_f1: 0.5169
 epoch: 25, train_loss: 0.9136, test_loss: 0.9307, test_f1: 0.5194
 epoch: 26, train_loss: 0.9037, test_loss: 0.9226, test_f1: 0.5238
 epoch: 27, train_loss: 0.9085, test_loss: 0.9284, test_f1: 0.5275
 epoch: 28, train_loss: 0.9046, test_loss: 0.9215, test_f1: 0.5114
 epoch: 29, train_loss: 0.9090, test_loss: 0.9268, test_f1: 0.5253
 epoch: 30, train_loss: 0.8948, test_loss: 0.9215, test_f1: 0.5164
 epoch: 31, train_loss: 0.8900, test_loss: 0.9125, test_f1: 0.5221
 epoch: 32, train_loss: 0.8909, test_loss: 0.9240, test_f1: 0.5261
 epoch: 33, train_loss: 0.8875, test_loss: 0.9210, test_f1: 0.5246
 epoch: 34, train_loss: 0.8885, test_loss: 0.9337, test_f1: 0.5229
 epoch: 35, train_loss: 0.8849, test_loss: 0.9248, test_f1: 0.5399
 epoch: 36, train_loss: 0.8823, test_loss: 0.9278, test_f1: 0.5301
 epoch: 37, train_loss: 0.8867, test_loss: 0.9495, test_f1: 0.5315
 epoch: 38, train_loss: 0.8767, test_loss: 0.9312, test_f1: 0.5443
 epoch: 39, train_loss: 0.8639, test_loss: 0.9327, test_f1: 0.5487
 epoch: 40, train_loss: 0.8703, test_loss: 0.9403, test_f1: 0.5299
 epoch: 41, train_loss: 0.8659, test_loss: 0.9255, test_f1: 0.5320
 epoch: 42, train_loss: 0.8668, test_loss: 0.9125, test_f1: 0.5473
 epoch: 43, train_loss: 0.8634, test_loss: 0.9373, test_f1: 0.5320
 epoch: 44, train_loss: 0.8539, test_loss: 0.9341, test_f1: 0.5361
 epoch: 45, train_loss: 0.8447, test_loss: 0.9250, test_f1: 0.5442
 epoch: 46, train_loss: 0.8521, test_loss: 0.9084, test_f1: 0.5387
 epoch: 47, train_loss: 0.8579, test_loss: 0.9291, test_f1: 0.5441
 epoch: 48, train_loss: 0.8407, test_loss: 0.9210, test_f1: 0.5475
 epoch: 49, train_loss: 0.8415, test_loss: 0.9345, test_f1: 0.5384
 epoch: 50, train_loss: 0.8473, test_loss: 0.9275, test_f1: 0.5466
 epoch: 51, train_loss: 0.8342, test_loss: 0.9133, test_f1: 0.5534
 epoch: 52, train_loss: 0.8406, test_loss: 0.9234, test_f1: 0.5454
 epoch: 53, train_loss: 0.8363, test_loss: 0.9218, test_f1: 0.5453
 epoch: 54, train_loss: 0.8349, test_loss: 0.9319, test_f1: 0.5639
 epoch: 55, train_loss: 0.8255, test_loss: 0.9246, test_f1: 0.5440
 epoch: 56, train_loss: 0.8391, test_loss: 0.9206, test_f1: 0.5510
 epoch: 57, train_loss: 0.8306, test_loss: 0.9235, test_f1: 0.5521
 epoch: 58, train_loss: 0.8290, test_loss: 0.9272, test_f1: 0.5527
 epoch: 59, train_loss: 0.8326, test_loss: 0.9215, test_f1: 0.5475
 epoch: 60, train_loss: 0.8283, test_loss: 0.9177, test_f1: 0.5679
 epoch: 61, train_loss: 0.8221, test_loss: 0.9100, test_f1: 0.5685
 epoch: 62, train_loss: 0.8228, test_loss: 0.9239, test_f1: 0.5659
 epoch: 63, train_loss: 0.8243, test_loss: 0.9030, test_f1: 0.5502
 epoch: 64, train_loss: 0.8344, test_loss: 0.9092, test_f1: 0.5421
 epoch: 65, train_loss: 0.8163, test_loss: 0.9104, test_f1: 0.5439
 epoch: 66, train_loss: 0.8175, test_loss: 0.9142, test_f1: 0.5620
 epoch: 67, train_loss: 0.8201, test_loss: 0.9179, test_f1: 0.5431
 epoch: 68, train_loss: 0.8100, test_loss: 0.9210, test_f1: 0.5456
 epoch: 69, train_loss: 0.8181, test_loss: 0.9203, test_f1: 0.5631
 epoch: 70, train_loss: 0.8112, test_loss: 0.9240, test_f1: 0.5666
 epoch: 71, train_loss: 0.8177, test_loss: 0.9107, test_f1: 0.5523
 epoch: 72, train_loss: 0.8237, test_loss: 0.9162, test_f1: 0.5644
 epoch: 73, train_loss: 0.8128, test_loss: 0.9245, test_f1: 0.5642
 epoch: 74, train_loss: 0.8201, test_loss: 0.9187, test_f1: 0.5529
 epoch: 75, train_loss: 0.8160, test_loss: 0.9149, test_f1: 0.5554
 epoch: 76, train_loss: 0.8057, test_loss: 0.9251, test_f1: 0.5836
 epoch: 77, train_loss: 0.8020, test_loss: 0.9183, test_f1: 0.5782
 epoch: 78, train_loss: 0.8140, test_loss: 0.9153, test_f1: 0.5629
 epoch: 79, train_loss: 0.8054, test_loss: 0.9027, test_f1: 0.5584
 epoch: 80, train_loss: 0.7998, test_loss: 0.9172, test_f1: 0.5609
 epoch: 81, train_loss: 0.8058, test_loss: 0.9047, test_f1: 0.5626
 epoch: 82, train_loss: 0.8015, test_loss: 0.9193, test_f1: 0.5648
 epoch: 83, train_loss: 0.7972, test_loss: 0.9133, test_f1: 0.5527
 epoch: 84, train_loss: 0.8002, test_loss: 0.9139, test_f1: 0.5756
 epoch: 85, train_loss: 0.8018, test_loss: 0.9042, test_f1: 0.5589
 epoch: 86, train_loss: 0.8031, test_loss: 0.8998, test_f1: 0.5734
 epoch: 87, train_loss: 0.7935, test_loss: 0.9232, test_f1: 0.5673
 epoch: 88, train_loss: 0.8080, test_loss: 0.9167, test_f1: 0.5587
 epoch: 89, train_loss: 0.8092, test_loss: 0.9128, test_f1: 0.5762
 epoch: 90, train_loss: 0.7919, test_loss: 0.9161, test_f1: 0.5675
 epoch: 91, train_loss: 0.7861, test_loss: 0.9315, test_f1: 0.5753
 epoch: 92, train_loss: 0.7894, test_loss: 0.9127, test_f1: 0.5861
 epoch: 93, train_loss: 0.7883, test_loss: 0.9122, test_f1: 0.5638
 epoch: 94, train_loss: 0.7955, test_loss: 0.9095, test_f1: 0.5699
 epoch: 95, train_loss: 0.7783, test_loss: 0.9211, test_f1: 0.5627
 epoch: 96, train_loss: 0.7980, test_loss: 0.9258, test_f1: 0.5857
 epoch: 97, train_loss: 0.7937, test_loss: 0.9150, test_f1: 0.5832
 epoch: 98, train_loss: 0.7862, test_loss: 0.9239, test_f1: 0.5724
 epoch: 99, train_loss: 0.7945, test_loss: 0.9339, test_f1: 0.5701
##################ITERATION #6 ****************************************
 epoch: 0, train_loss: 1.2738, test_loss: 1.1928, test_f1: 0.2956
 epoch: 1, train_loss: 1.1718, test_loss: 1.0814, test_f1: 0.3888
 epoch: 2, train_loss: 1.1437, test_loss: 1.0586, test_f1: 0.4100
 epoch: 3, train_loss: 1.1093, test_loss: 1.0377, test_f1: 0.4277
 epoch: 4, train_loss: 1.0823, test_loss: 1.0200, test_f1: 0.4332
 epoch: 5, train_loss: 1.0750, test_loss: 1.0094, test_f1: 0.4391
 epoch: 6, train_loss: 1.0521, test_loss: 0.9883, test_f1: 0.4452
 epoch: 7, train_loss: 1.0339, test_loss: 0.9782, test_f1: 0.4464
 epoch: 8, train_loss: 1.0215, test_loss: 0.9685, test_f1: 0.4699
 epoch: 9, train_loss: 1.0053, test_loss: 0.9583, test_f1: 0.4747
 epoch: 10, train_loss: 0.9996, test_loss: 0.9601, test_f1: 0.4794
 epoch: 11, train_loss: 0.9950, test_loss: 0.9558, test_f1: 0.4791
 epoch: 12, train_loss: 0.9901, test_loss: 0.9490, test_f1: 0.4802
 epoch: 13, train_loss: 0.9743, test_loss: 0.9423, test_f1: 0.4808
 epoch: 14, train_loss: 0.9609, test_loss: 0.9448, test_f1: 0.4877
 epoch: 15, train_loss: 0.9590, test_loss: 0.9339, test_f1: 0.4797
 epoch: 16, train_loss: 0.9505, test_loss: 0.9350, test_f1: 0.4865
 epoch: 17, train_loss: 0.9422, test_loss: 0.9226, test_f1: 0.5102
 epoch: 18, train_loss: 0.9320, test_loss: 0.9335, test_f1: 0.5168
 epoch: 19, train_loss: 0.9269, test_loss: 0.9143, test_f1: 0.5241
 epoch: 20, train_loss: 0.9244, test_loss: 0.9153, test_f1: 0.5233
 epoch: 21, train_loss: 0.9300, test_loss: 0.9228, test_f1: 0.5188
 epoch: 22, train_loss: 0.9172, test_loss: 0.9148, test_f1: 0.5107
 epoch: 23, train_loss: 0.9146, test_loss: 0.9046, test_f1: 0.5148
 epoch: 24, train_loss: 0.9098, test_loss: 0.9327, test_f1: 0.5135
 epoch: 25, train_loss: 0.9168, test_loss: 0.8861, test_f1: 0.5311
 epoch: 26, train_loss: 0.9072, test_loss: 0.8951, test_f1: 0.5222
 epoch: 27, train_loss: 0.8989, test_loss: 0.8997, test_f1: 0.5306
 epoch: 28, train_loss: 0.8896, test_loss: 0.9149, test_f1: 0.5279
 epoch: 29, train_loss: 0.8909, test_loss: 0.8979, test_f1: 0.5307
 epoch: 30, train_loss: 0.8853, test_loss: 0.9235, test_f1: 0.5168
 epoch: 31, train_loss: 0.8816, test_loss: 0.8902, test_f1: 0.5305
 epoch: 32, train_loss: 0.8900, test_loss: 0.9005, test_f1: 0.5253
 epoch: 33, train_loss: 0.8688, test_loss: 0.8867, test_f1: 0.5253
 epoch: 34, train_loss: 0.8735, test_loss: 0.9196, test_f1: 0.5341
 epoch: 35, train_loss: 0.8726, test_loss: 0.8887, test_f1: 0.5308
 epoch: 36, train_loss: 0.8727, test_loss: 0.8962, test_f1: 0.5274
 epoch: 37, train_loss: 0.8694, test_loss: 0.9060, test_f1: 0.5284
 epoch: 38, train_loss: 0.8601, test_loss: 0.9059, test_f1: 0.5285
 epoch: 39, train_loss: 0.8618, test_loss: 0.9006, test_f1: 0.5360
 epoch: 40, train_loss: 0.8562, test_loss: 0.8792, test_f1: 0.5379
 epoch: 41, train_loss: 0.8509, test_loss: 0.9004, test_f1: 0.5297
 epoch: 42, train_loss: 0.8458, test_loss: 0.8953, test_f1: 0.5322
 epoch: 43, train_loss: 0.8519, test_loss: 0.8894, test_f1: 0.5246
 epoch: 44, train_loss: 0.8461, test_loss: 0.8975, test_f1: 0.5243
 epoch: 45, train_loss: 0.8444, test_loss: 0.9048, test_f1: 0.5339
 epoch: 46, train_loss: 0.8541, test_loss: 0.8915, test_f1: 0.5317
 epoch: 47, train_loss: 0.8410, test_loss: 0.9018, test_f1: 0.5307
 epoch: 48, train_loss: 0.8389, test_loss: 0.8998, test_f1: 0.5301
 epoch: 49, train_loss: 0.8391, test_loss: 0.8974, test_f1: 0.5349
 epoch: 50, train_loss: 0.8376, test_loss: 0.9100, test_f1: 0.5362
 epoch: 51, train_loss: 0.8311, test_loss: 0.8883, test_f1: 0.5306
 epoch: 52, train_loss: 0.8303, test_loss: 0.8900, test_f1: 0.5292
 epoch: 53, train_loss: 0.8305, test_loss: 0.8961, test_f1: 0.5314
 epoch: 54, train_loss: 0.8235, test_loss: 0.9012, test_f1: 0.5311
 epoch: 55, train_loss: 0.8211, test_loss: 0.8947, test_f1: 0.5351
 epoch: 56, train_loss: 0.8241, test_loss: 0.8844, test_f1: 0.5231
 epoch: 57, train_loss: 0.8244, test_loss: 0.8867, test_f1: 0.5352
 epoch: 58, train_loss: 0.8274, test_loss: 0.9130, test_f1: 0.5290
 epoch: 59, train_loss: 0.8119, test_loss: 0.9192, test_f1: 0.5330
 epoch: 60, train_loss: 0.8242, test_loss: 0.8998, test_f1: 0.5327
 epoch: 61, train_loss: 0.8203, test_loss: 0.8925, test_f1: 0.5396
 epoch: 62, train_loss: 0.8204, test_loss: 0.8926, test_f1: 0.5335
 epoch: 63, train_loss: 0.8198, test_loss: 0.8874, test_f1: 0.5365
 epoch: 64, train_loss: 0.8165, test_loss: 0.8950, test_f1: 0.5359
 epoch: 65, train_loss: 0.8169, test_loss: 0.8941, test_f1: 0.5344
 epoch: 66, train_loss: 0.8102, test_loss: 0.9055, test_f1: 0.5398
 epoch: 67, train_loss: 0.8112, test_loss: 0.8967, test_f1: 0.5433
 epoch: 68, train_loss: 0.8105, test_loss: 0.9119, test_f1: 0.5421
 epoch: 69, train_loss: 0.8078, test_loss: 0.8848, test_f1: 0.5494
 epoch: 70, train_loss: 0.8137, test_loss: 0.9052, test_f1: 0.5360
 epoch: 71, train_loss: 0.8052, test_loss: 0.9295, test_f1: 0.5308
 epoch: 72, train_loss: 0.8159, test_loss: 0.9035, test_f1: 0.5403
 epoch: 73, train_loss: 0.8141, test_loss: 0.9175, test_f1: 0.5449
 epoch: 74, train_loss: 0.8188, test_loss: 0.9041, test_f1: 0.5470
 epoch: 75, train_loss: 0.7988, test_loss: 0.9060, test_f1: 0.5390
 epoch: 76, train_loss: 0.8023, test_loss: 0.9124, test_f1: 0.5393
 epoch: 77, train_loss: 0.8086, test_loss: 0.9006, test_f1: 0.5414
 epoch: 78, train_loss: 0.8063, test_loss: 0.9252, test_f1: 0.5342
 epoch: 79, train_loss: 0.8062, test_loss: 0.9074, test_f1: 0.5417
 epoch: 80, train_loss: 0.7988, test_loss: 0.8985, test_f1: 0.5479
 epoch: 81, train_loss: 0.7875, test_loss: 0.8933, test_f1: 0.5464
 epoch: 82, train_loss: 0.7962, test_loss: 0.9073, test_f1: 0.5472
 epoch: 83, train_loss: 0.8052, test_loss: 0.8955, test_f1: 0.5448
 epoch: 84, train_loss: 0.8007, test_loss: 0.9167, test_f1: 0.5448
 epoch: 85, train_loss: 0.8052, test_loss: 0.9110, test_f1: 0.5448
 epoch: 86, train_loss: 0.7904, test_loss: 0.9012, test_f1: 0.5472
 epoch: 87, train_loss: 0.7964, test_loss: 0.9091, test_f1: 0.5557
 epoch: 88, train_loss: 0.7929, test_loss: 0.9154, test_f1: 0.5496
 epoch: 89, train_loss: 0.7963, test_loss: 0.9005, test_f1: 0.5467
 epoch: 90, train_loss: 0.7911, test_loss: 0.9161, test_f1: 0.5463
 epoch: 91, train_loss: 0.7927, test_loss: 0.9036, test_f1: 0.5532
 epoch: 92, train_loss: 0.8004, test_loss: 0.9077, test_f1: 0.5422
 epoch: 93, train_loss: 0.7913, test_loss: 0.9101, test_f1: 0.5498
 epoch: 94, train_loss: 0.7838, test_loss: 0.9140, test_f1: 0.5510
 epoch: 95, train_loss: 0.7876, test_loss: 0.9224, test_f1: 0.5477
 epoch: 96, train_loss: 0.7888, test_loss: 0.8976, test_f1: 0.5485
 epoch: 97, train_loss: 0.7861, test_loss: 0.9013, test_f1: 0.5576
 epoch: 98, train_loss: 0.7878, test_loss: 0.9078, test_f1: 0.5576
 epoch: 99, train_loss: 0.7880, test_loss: 0.9089, test_f1: 0.5520
##################ITERATION #7 ****************************************
 epoch: 0, train_loss: 1.3194, test_loss: 1.1787, test_f1: 0.2853
 epoch: 1, train_loss: 1.1663, test_loss: 1.0953, test_f1: 0.3918
 epoch: 2, train_loss: 1.1304, test_loss: 1.0601, test_f1: 0.3959
 epoch: 3, train_loss: 1.0995, test_loss: 1.0357, test_f1: 0.3991
 epoch: 4, train_loss: 1.0734, test_loss: 1.0189, test_f1: 0.4063
 epoch: 5, train_loss: 1.0624, test_loss: 1.0025, test_f1: 0.4185
 epoch: 6, train_loss: 1.0440, test_loss: 0.9988, test_f1: 0.4165
 epoch: 7, train_loss: 1.0163, test_loss: 0.9910, test_f1: 0.4294
 epoch: 8, train_loss: 1.0128, test_loss: 0.9814, test_f1: 0.4641
 epoch: 9, train_loss: 1.0062, test_loss: 0.9816, test_f1: 0.4627
 epoch: 10, train_loss: 0.9949, test_loss: 0.9713, test_f1: 0.4852
 epoch: 11, train_loss: 0.9840, test_loss: 0.9708, test_f1: 0.4807
 epoch: 12, train_loss: 0.9741, test_loss: 0.9563, test_f1: 0.4758
 epoch: 13, train_loss: 0.9687, test_loss: 0.9449, test_f1: 0.4997
 epoch: 14, train_loss: 0.9634, test_loss: 0.9600, test_f1: 0.4994
 epoch: 15, train_loss: 0.9512, test_loss: 0.9471, test_f1: 0.5033
 epoch: 16, train_loss: 0.9513, test_loss: 0.9515, test_f1: 0.5081
 epoch: 17, train_loss: 0.9538, test_loss: 0.9520, test_f1: 0.5017
 epoch: 18, train_loss: 0.9450, test_loss: 0.9483, test_f1: 0.4996
 epoch: 19, train_loss: 0.9480, test_loss: 0.9440, test_f1: 0.5145
 epoch: 20, train_loss: 0.9365, test_loss: 0.9437, test_f1: 0.5112
 epoch: 21, train_loss: 0.9321, test_loss: 0.9483, test_f1: 0.5154
 epoch: 22, train_loss: 0.9325, test_loss: 0.9509, test_f1: 0.5074
 epoch: 23, train_loss: 0.9236, test_loss: 0.9455, test_f1: 0.5176
 epoch: 24, train_loss: 0.9247, test_loss: 0.9588, test_f1: 0.5178
 epoch: 25, train_loss: 0.9101, test_loss: 0.9438, test_f1: 0.5216
 epoch: 26, train_loss: 0.9048, test_loss: 0.9515, test_f1: 0.5153
 epoch: 27, train_loss: 0.9072, test_loss: 0.9462, test_f1: 0.5161
 epoch: 28, train_loss: 0.9078, test_loss: 0.9413, test_f1: 0.5198
 epoch: 29, train_loss: 0.9110, test_loss: 0.9444, test_f1: 0.5141
 epoch: 30, train_loss: 0.8982, test_loss: 0.9426, test_f1: 0.5174
 epoch: 31, train_loss: 0.9005, test_loss: 0.9325, test_f1: 0.5227
 epoch: 32, train_loss: 0.8966, test_loss: 0.9424, test_f1: 0.5281
 epoch: 33, train_loss: 0.8886, test_loss: 0.9439, test_f1: 0.5211
 epoch: 34, train_loss: 0.8962, test_loss: 0.9504, test_f1: 0.5177
 epoch: 35, train_loss: 0.8885, test_loss: 0.9329, test_f1: 0.5277
 epoch: 36, train_loss: 0.8800, test_loss: 0.9387, test_f1: 0.5295
 epoch: 37, train_loss: 0.8764, test_loss: 0.9296, test_f1: 0.5274
 epoch: 38, train_loss: 0.8776, test_loss: 0.9282, test_f1: 0.5234
 epoch: 39, train_loss: 0.8750, test_loss: 0.9369, test_f1: 0.5264
 epoch: 40, train_loss: 0.8745, test_loss: 0.9406, test_f1: 0.5273
 epoch: 41, train_loss: 0.8651, test_loss: 0.9425, test_f1: 0.5227
 epoch: 42, train_loss: 0.8630, test_loss: 0.9335, test_f1: 0.5291
 epoch: 43, train_loss: 0.8547, test_loss: 0.9356, test_f1: 0.5310
 epoch: 44, train_loss: 0.8721, test_loss: 0.9287, test_f1: 0.5188
 epoch: 45, train_loss: 0.8534, test_loss: 0.9313, test_f1: 0.5243
 epoch: 46, train_loss: 0.8500, test_loss: 0.9374, test_f1: 0.5217
 epoch: 47, train_loss: 0.8495, test_loss: 0.9295, test_f1: 0.5235
 epoch: 48, train_loss: 0.8427, test_loss: 0.9408, test_f1: 0.5141
 epoch: 49, train_loss: 0.8456, test_loss: 0.9333, test_f1: 0.5314
 epoch: 50, train_loss: 0.8508, test_loss: 0.9370, test_f1: 0.5241
 epoch: 51, train_loss: 0.8344, test_loss: 0.9357, test_f1: 0.5293
 epoch: 52, train_loss: 0.8412, test_loss: 0.9320, test_f1: 0.5261
 epoch: 53, train_loss: 0.8413, test_loss: 0.9352, test_f1: 0.5212
 epoch: 54, train_loss: 0.8377, test_loss: 0.9433, test_f1: 0.5250
 epoch: 55, train_loss: 0.8403, test_loss: 0.9396, test_f1: 0.5246
 epoch: 56, train_loss: 0.8372, test_loss: 0.9403, test_f1: 0.5201
 epoch: 57, train_loss: 0.8314, test_loss: 0.9360, test_f1: 0.5280
 epoch: 58, train_loss: 0.8218, test_loss: 0.9406, test_f1: 0.5249
 epoch: 59, train_loss: 0.8231, test_loss: 0.9353, test_f1: 0.5273
 epoch: 60, train_loss: 0.8260, test_loss: 0.9399, test_f1: 0.5268
 epoch: 61, train_loss: 0.8323, test_loss: 0.9470, test_f1: 0.5257
 epoch: 62, train_loss: 0.8138, test_loss: 0.9489, test_f1: 0.5290
 epoch: 63, train_loss: 0.8230, test_loss: 0.9368, test_f1: 0.5295
 epoch: 64, train_loss: 0.8182, test_loss: 0.9404, test_f1: 0.5281
 epoch: 65, train_loss: 0.8283, test_loss: 0.9487, test_f1: 0.5194
 epoch: 66, train_loss: 0.8169, test_loss: 0.9323, test_f1: 0.5229
 epoch: 67, train_loss: 0.8170, test_loss: 0.9410, test_f1: 0.5273
 epoch: 68, train_loss: 0.8223, test_loss: 0.9384, test_f1: 0.5276
 epoch: 69, train_loss: 0.8180, test_loss: 0.9399, test_f1: 0.5256
 epoch: 70, train_loss: 0.8185, test_loss: 0.9364, test_f1: 0.5287
 epoch: 71, train_loss: 0.8022, test_loss: 0.9377, test_f1: 0.5323
 epoch: 72, train_loss: 0.8065, test_loss: 0.9367, test_f1: 0.5266
 epoch: 73, train_loss: 0.8178, test_loss: 0.9405, test_f1: 0.5322
 epoch: 74, train_loss: 0.8147, test_loss: 0.9346, test_f1: 0.5281
 epoch: 75, train_loss: 0.8164, test_loss: 0.9355, test_f1: 0.5289
 epoch: 76, train_loss: 0.8044, test_loss: 0.9465, test_f1: 0.5296
 epoch: 77, train_loss: 0.8145, test_loss: 0.9414, test_f1: 0.5294
 epoch: 78, train_loss: 0.8192, test_loss: 0.9368, test_f1: 0.5282
 epoch: 79, train_loss: 0.8128, test_loss: 0.9466, test_f1: 0.5305
 epoch: 80, train_loss: 0.8080, test_loss: 0.9409, test_f1: 0.5283
 epoch: 81, train_loss: 0.8085, test_loss: 0.9468, test_f1: 0.5328
 epoch: 82, train_loss: 0.8013, test_loss: 0.9506, test_f1: 0.5329
 epoch: 83, train_loss: 0.8109, test_loss: 0.9468, test_f1: 0.5395
 epoch: 84, train_loss: 0.7998, test_loss: 0.9441, test_f1: 0.5289
 epoch: 85, train_loss: 0.8110, test_loss: 0.9461, test_f1: 0.5431
 epoch: 86, train_loss: 0.8005, test_loss: 0.9395, test_f1: 0.5421
 epoch: 87, train_loss: 0.8041, test_loss: 0.9505, test_f1: 0.5379
 epoch: 88, train_loss: 0.7934, test_loss: 0.9456, test_f1: 0.5407
 epoch: 89, train_loss: 0.7987, test_loss: 0.9483, test_f1: 0.5432
 epoch: 90, train_loss: 0.7970, test_loss: 0.9488, test_f1: 0.5353
 epoch: 91, train_loss: 0.7961, test_loss: 0.9479, test_f1: 0.5371
 epoch: 92, train_loss: 0.8009, test_loss: 0.9413, test_f1: 0.5365
 epoch: 93, train_loss: 0.7938, test_loss: 0.9444, test_f1: 0.5399
 epoch: 94, train_loss: 0.7999, test_loss: 0.9453, test_f1: 0.5410
 epoch: 95, train_loss: 0.7897, test_loss: 0.9505, test_f1: 0.5440
 epoch: 96, train_loss: 0.7980, test_loss: 0.9528, test_f1: 0.5397
 epoch: 97, train_loss: 0.7924, test_loss: 0.9490, test_f1: 0.5389
 epoch: 98, train_loss: 0.7882, test_loss: 0.9533, test_f1: 0.5428
 epoch: 99, train_loss: 0.8030, test_loss: 0.9394, test_f1: 0.5447
##################ITERATION #8 ****************************************
 epoch: 0, train_loss: 1.3198, test_loss: 1.2019, test_f1: 0.2724
 epoch: 1, train_loss: 1.1941, test_loss: 1.0968, test_f1: 0.3810
 epoch: 2, train_loss: 1.1633, test_loss: 1.0715, test_f1: 0.3868
 epoch: 3, train_loss: 1.1184, test_loss: 1.0640, test_f1: 0.4085
 epoch: 4, train_loss: 1.0929, test_loss: 1.0410, test_f1: 0.4450
 epoch: 5, train_loss: 1.0813, test_loss: 1.0286, test_f1: 0.4329
 epoch: 6, train_loss: 1.0638, test_loss: 1.0131, test_f1: 0.4369
 epoch: 7, train_loss: 1.0474, test_loss: 1.0021, test_f1: 0.4620
 epoch: 8, train_loss: 1.0401, test_loss: 0.9958, test_f1: 0.4685
 epoch: 9, train_loss: 1.0202, test_loss: 0.9933, test_f1: 0.4565
 epoch: 10, train_loss: 1.0223, test_loss: 0.9816, test_f1: 0.4623
 epoch: 11, train_loss: 1.0042, test_loss: 0.9733, test_f1: 0.4648
 epoch: 12, train_loss: 0.9985, test_loss: 0.9702, test_f1: 0.4734
 epoch: 13, train_loss: 0.9819, test_loss: 0.9616, test_f1: 0.4860
 epoch: 14, train_loss: 0.9831, test_loss: 0.9602, test_f1: 0.4849
 epoch: 15, train_loss: 0.9825, test_loss: 0.9546, test_f1: 0.4866
 epoch: 16, train_loss: 0.9759, test_loss: 0.9590, test_f1: 0.4876
 epoch: 17, train_loss: 0.9572, test_loss: 0.9486, test_f1: 0.4879
 epoch: 18, train_loss: 0.9483, test_loss: 0.9437, test_f1: 0.4908
 epoch: 19, train_loss: 0.9483, test_loss: 0.9514, test_f1: 0.4900
 epoch: 20, train_loss: 0.9422, test_loss: 0.9497, test_f1: 0.4917
 epoch: 21, train_loss: 0.9379, test_loss: 0.9470, test_f1: 0.4986
 epoch: 22, train_loss: 0.9412, test_loss: 0.9326, test_f1: 0.5072
 epoch: 23, train_loss: 0.9296, test_loss: 0.9412, test_f1: 0.5072
 epoch: 24, train_loss: 0.9258, test_loss: 0.9427, test_f1: 0.5166
 epoch: 25, train_loss: 0.9258, test_loss: 0.9406, test_f1: 0.5203
 epoch: 26, train_loss: 0.9139, test_loss: 0.9451, test_f1: 0.5183
 epoch: 27, train_loss: 0.9120, test_loss: 0.9518, test_f1: 0.5086
 epoch: 28, train_loss: 0.9140, test_loss: 0.9337, test_f1: 0.5279
 epoch: 29, train_loss: 0.9048, test_loss: 0.9216, test_f1: 0.5190
 epoch: 30, train_loss: 0.9070, test_loss: 0.9246, test_f1: 0.5317
 epoch: 31, train_loss: 0.9014, test_loss: 0.9374, test_f1: 0.5215
 epoch: 32, train_loss: 0.9110, test_loss: 0.9392, test_f1: 0.5037
 epoch: 33, train_loss: 0.8953, test_loss: 0.9268, test_f1: 0.5222
 epoch: 34, train_loss: 0.8867, test_loss: 0.9201, test_f1: 0.5231
 epoch: 35, train_loss: 0.8853, test_loss: 0.9227, test_f1: 0.5282
 epoch: 36, train_loss: 0.8866, test_loss: 0.9273, test_f1: 0.5238
 epoch: 37, train_loss: 0.8780, test_loss: 0.9283, test_f1: 0.5229
 epoch: 38, train_loss: 0.8826, test_loss: 0.9270, test_f1: 0.5198
 epoch: 39, train_loss: 0.8803, test_loss: 0.9200, test_f1: 0.5294
 epoch: 40, train_loss: 0.8766, test_loss: 0.9365, test_f1: 0.5238
 epoch: 41, train_loss: 0.8739, test_loss: 0.9023, test_f1: 0.5261
 epoch: 42, train_loss: 0.8749, test_loss: 0.9095, test_f1: 0.5295
 epoch: 43, train_loss: 0.8652, test_loss: 0.9037, test_f1: 0.5336
 epoch: 44, train_loss: 0.8605, test_loss: 0.9127, test_f1: 0.5268
 epoch: 45, train_loss: 0.8724, test_loss: 0.9079, test_f1: 0.5341
 epoch: 46, train_loss: 0.8559, test_loss: 0.9125, test_f1: 0.5382
 epoch: 47, train_loss: 0.8480, test_loss: 0.9294, test_f1: 0.5187
 epoch: 48, train_loss: 0.8509, test_loss: 0.8778, test_f1: 0.5357
 epoch: 49, train_loss: 0.8589, test_loss: 0.9007, test_f1: 0.5332
 epoch: 50, train_loss: 0.8556, test_loss: 0.8857, test_f1: 0.5333
 epoch: 51, train_loss: 0.8496, test_loss: 0.8863, test_f1: 0.5408
 epoch: 52, train_loss: 0.8472, test_loss: 0.8903, test_f1: 0.5466
 epoch: 53, train_loss: 0.8418, test_loss: 0.8984, test_f1: 0.5320
 epoch: 54, train_loss: 0.8413, test_loss: 0.9112, test_f1: 0.5327
 epoch: 55, train_loss: 0.8330, test_loss: 0.8898, test_f1: 0.5257
 epoch: 56, train_loss: 0.8474, test_loss: 0.8828, test_f1: 0.5470
 epoch: 57, train_loss: 0.8369, test_loss: 0.8982, test_f1: 0.5320
 epoch: 58, train_loss: 0.8362, test_loss: 0.8983, test_f1: 0.5275
 epoch: 59, train_loss: 0.8330, test_loss: 0.9008, test_f1: 0.5299
 epoch: 60, train_loss: 0.8294, test_loss: 0.8901, test_f1: 0.5351
 epoch: 61, train_loss: 0.8240, test_loss: 0.9097, test_f1: 0.5288
 epoch: 62, train_loss: 0.8272, test_loss: 0.9035, test_f1: 0.5259
 epoch: 63, train_loss: 0.8365, test_loss: 0.9141, test_f1: 0.5308
 epoch: 64, train_loss: 0.8265, test_loss: 0.9010, test_f1: 0.5284
 epoch: 65, train_loss: 0.8353, test_loss: 0.8985, test_f1: 0.5375
 epoch: 66, train_loss: 0.8257, test_loss: 0.8903, test_f1: 0.5145
 epoch: 67, train_loss: 0.8238, test_loss: 0.9088, test_f1: 0.5394
 epoch: 68, train_loss: 0.8229, test_loss: 0.9130, test_f1: 0.5382
 epoch: 69, train_loss: 0.8282, test_loss: 0.9070, test_f1: 0.5352
 epoch: 70, train_loss: 0.8244, test_loss: 0.8937, test_f1: 0.5402
 epoch: 71, train_loss: 0.8187, test_loss: 0.9157, test_f1: 0.5429
 epoch: 72, train_loss: 0.8178, test_loss: 0.9172, test_f1: 0.5321
 epoch: 73, train_loss: 0.8223, test_loss: 0.8916, test_f1: 0.5427
 epoch: 74, train_loss: 0.8124, test_loss: 0.8884, test_f1: 0.5301
 epoch: 75, train_loss: 0.8178, test_loss: 0.9001, test_f1: 0.5391
 epoch: 76, train_loss: 0.8126, test_loss: 0.8974, test_f1: 0.5370
 epoch: 77, train_loss: 0.8196, test_loss: 0.9031, test_f1: 0.5447
 epoch: 78, train_loss: 0.8127, test_loss: 0.8798, test_f1: 0.5443
 epoch: 79, train_loss: 0.8060, test_loss: 0.9240, test_f1: 0.5319
 epoch: 80, train_loss: 0.8060, test_loss: 0.9196, test_f1: 0.5380
 epoch: 81, train_loss: 0.8011, test_loss: 0.8981, test_f1: 0.5453
 epoch: 82, train_loss: 0.8086, test_loss: 0.8884, test_f1: 0.5428
 epoch: 83, train_loss: 0.8177, test_loss: 0.9058, test_f1: 0.5443
 epoch: 84, train_loss: 0.7957, test_loss: 0.8891, test_f1: 0.5414
 epoch: 85, train_loss: 0.8023, test_loss: 0.8913, test_f1: 0.5434
 epoch: 86, train_loss: 0.8129, test_loss: 0.8883, test_f1: 0.5419
 epoch: 87, train_loss: 0.8024, test_loss: 0.8880, test_f1: 0.5403
 epoch: 88, train_loss: 0.7974, test_loss: 0.8943, test_f1: 0.5274
 epoch: 89, train_loss: 0.8128, test_loss: 0.8982, test_f1: 0.5500
 epoch: 90, train_loss: 0.7885, test_loss: 0.8866, test_f1: 0.5277
 epoch: 91, train_loss: 0.7866, test_loss: 0.9164, test_f1: 0.5443
 epoch: 92, train_loss: 0.7908, test_loss: 0.8994, test_f1: 0.5306
 epoch: 93, train_loss: 0.7938, test_loss: 0.8931, test_f1: 0.5316
 epoch: 94, train_loss: 0.7999, test_loss: 0.8753, test_f1: 0.5389
 epoch: 95, train_loss: 0.7858, test_loss: 0.8840, test_f1: 0.5451
 epoch: 96, train_loss: 0.7880, test_loss: 0.8881, test_f1: 0.5412
 epoch: 97, train_loss: 0.7930, test_loss: 0.8949, test_f1: 0.5457
 epoch: 98, train_loss: 0.7878, test_loss: 0.9033, test_f1: 0.5368
 epoch: 99, train_loss: 0.7839, test_loss: 0.8684, test_f1: 0.5488
##################ITERATION #9 ****************************************
 epoch: 0, train_loss: 1.3509, test_loss: 1.1516, test_f1: 0.3278
 epoch: 1, train_loss: 1.1949, test_loss: 1.0897, test_f1: 0.3719
 epoch: 2, train_loss: 1.1441, test_loss: 1.0654, test_f1: 0.3889
 epoch: 3, train_loss: 1.1183, test_loss: 1.0412, test_f1: 0.4167
 epoch: 4, train_loss: 1.0864, test_loss: 1.0262, test_f1: 0.4366
 epoch: 5, train_loss: 1.0725, test_loss: 1.0173, test_f1: 0.4329
 epoch: 6, train_loss: 1.0557, test_loss: 0.9994, test_f1: 0.4388
 epoch: 7, train_loss: 1.0345, test_loss: 0.9894, test_f1: 0.4587
 epoch: 8, train_loss: 1.0288, test_loss: 0.9907, test_f1: 0.4709
 epoch: 9, train_loss: 1.0040, test_loss: 0.9974, test_f1: 0.4791
 epoch: 10, train_loss: 0.9976, test_loss: 0.9910, test_f1: 0.4708
 epoch: 11, train_loss: 0.9791, test_loss: 0.9833, test_f1: 0.4782
 epoch: 12, train_loss: 0.9807, test_loss: 0.9754, test_f1: 0.4814
 epoch: 13, train_loss: 0.9711, test_loss: 0.9718, test_f1: 0.4854
 epoch: 14, train_loss: 0.9671, test_loss: 0.9713, test_f1: 0.4833
 epoch: 15, train_loss: 0.9567, test_loss: 0.9754, test_f1: 0.4928
 epoch: 16, train_loss: 0.9488, test_loss: 0.9650, test_f1: 0.4943
 epoch: 17, train_loss: 0.9457, test_loss: 0.9549, test_f1: 0.4861
 epoch: 18, train_loss: 0.9455, test_loss: 0.9695, test_f1: 0.4856
 epoch: 19, train_loss: 0.9478, test_loss: 0.9545, test_f1: 0.5108
 epoch: 20, train_loss: 0.9374, test_loss: 0.9525, test_f1: 0.4952
 epoch: 21, train_loss: 0.9366, test_loss: 0.9467, test_f1: 0.4935
 epoch: 22, train_loss: 0.9431, test_loss: 0.9500, test_f1: 0.5007
 epoch: 23, train_loss: 0.9331, test_loss: 0.9421, test_f1: 0.5112
 epoch: 24, train_loss: 0.9222, test_loss: 0.9434, test_f1: 0.5027
 epoch: 25, train_loss: 0.9146, test_loss: 0.9388, test_f1: 0.4963
 epoch: 26, train_loss: 0.9143, test_loss: 0.9417, test_f1: 0.5160
 epoch: 27, train_loss: 0.9194, test_loss: 0.9433, test_f1: 0.5051
 epoch: 28, train_loss: 0.9166, test_loss: 0.9358, test_f1: 0.5008
 epoch: 29, train_loss: 0.9143, test_loss: 0.9429, test_f1: 0.5061
 epoch: 30, train_loss: 0.9105, test_loss: 0.9285, test_f1: 0.5168
 epoch: 31, train_loss: 0.8975, test_loss: 0.9280, test_f1: 0.5191
 epoch: 32, train_loss: 0.8887, test_loss: 0.9350, test_f1: 0.5209
 epoch: 33, train_loss: 0.8860, test_loss: 0.9304, test_f1: 0.5007
 epoch: 34, train_loss: 0.8899, test_loss: 0.9251, test_f1: 0.5350
 epoch: 35, train_loss: 0.8831, test_loss: 0.9280, test_f1: 0.5330
 epoch: 36, train_loss: 0.8867, test_loss: 0.9230, test_f1: 0.5138
 epoch: 37, train_loss: 0.8716, test_loss: 0.9162, test_f1: 0.5450
 epoch: 38, train_loss: 0.8725, test_loss: 0.9357, test_f1: 0.5228
 epoch: 39, train_loss: 0.8804, test_loss: 0.9168, test_f1: 0.5375
 epoch: 40, train_loss: 0.8644, test_loss: 0.9389, test_f1: 0.5216
 epoch: 41, train_loss: 0.8603, test_loss: 0.9152, test_f1: 0.5469
 epoch: 42, train_loss: 0.8674, test_loss: 0.9184, test_f1: 0.5539
 epoch: 43, train_loss: 0.8700, test_loss: 0.9176, test_f1: 0.5549
 epoch: 44, train_loss: 0.8470, test_loss: 0.9235, test_f1: 0.5251
 epoch: 45, train_loss: 0.8621, test_loss: 0.9071, test_f1: 0.5461
 epoch: 46, train_loss: 0.8625, test_loss: 0.9147, test_f1: 0.5464
 epoch: 47, train_loss: 0.8509, test_loss: 0.9133, test_f1: 0.5505
 epoch: 48, train_loss: 0.8447, test_loss: 0.9119, test_f1: 0.5507
 epoch: 49, train_loss: 0.8468, test_loss: 0.9076, test_f1: 0.5396
 epoch: 50, train_loss: 0.8530, test_loss: 0.9635, test_f1: 0.5086
 epoch: 51, train_loss: 0.8441, test_loss: 0.9005, test_f1: 0.5565
 epoch: 52, train_loss: 0.8272, test_loss: 0.9141, test_f1: 0.5557
 epoch: 53, train_loss: 0.8335, test_loss: 0.9108, test_f1: 0.5565
 epoch: 54, train_loss: 0.8395, test_loss: 0.9134, test_f1: 0.5611
 epoch: 55, train_loss: 0.8348, test_loss: 0.9062, test_f1: 0.5456
 epoch: 56, train_loss: 0.8302, test_loss: 0.9103, test_f1: 0.5569
 epoch: 57, train_loss: 0.8294, test_loss: 0.9091, test_f1: 0.5411
 epoch: 58, train_loss: 0.8320, test_loss: 0.9063, test_f1: 0.5512
 epoch: 59, train_loss: 0.8267, test_loss: 0.9093, test_f1: 0.5446
 epoch: 60, train_loss: 0.8336, test_loss: 0.9016, test_f1: 0.5671
 epoch: 61, train_loss: 0.8208, test_loss: 0.9078, test_f1: 0.5398
 epoch: 62, train_loss: 0.8274, test_loss: 0.9051, test_f1: 0.5679
 epoch: 63, train_loss: 0.8145, test_loss: 0.8942, test_f1: 0.5712
 epoch: 64, train_loss: 0.8140, test_loss: 0.8929, test_f1: 0.5655
 epoch: 65, train_loss: 0.8240, test_loss: 0.9055, test_f1: 0.5560
 epoch: 66, train_loss: 0.8218, test_loss: 0.9055, test_f1: 0.5614
 epoch: 67, train_loss: 0.8136, test_loss: 0.8959, test_f1: 0.5481
 epoch: 68, train_loss: 0.8199, test_loss: 0.9030, test_f1: 0.5514
 epoch: 69, train_loss: 0.8108, test_loss: 0.9054, test_f1: 0.5579
 epoch: 70, train_loss: 0.8154, test_loss: 0.8983, test_f1: 0.5507
 epoch: 71, train_loss: 0.8081, test_loss: 0.9170, test_f1: 0.5424
 epoch: 72, train_loss: 0.8153, test_loss: 0.9100, test_f1: 0.5648
 epoch: 73, train_loss: 0.8091, test_loss: 0.9193, test_f1: 0.5387
 epoch: 74, train_loss: 0.7980, test_loss: 0.9137, test_f1: 0.5661
 epoch: 75, train_loss: 0.8014, test_loss: 0.9131, test_f1: 0.5599
 epoch: 76, train_loss: 0.8013, test_loss: 0.9070, test_f1: 0.5605
 epoch: 77, train_loss: 0.8018, test_loss: 0.9051, test_f1: 0.5556
 epoch: 78, train_loss: 0.8058, test_loss: 0.9166, test_f1: 0.5472
 epoch: 79, train_loss: 0.7970, test_loss: 0.9076, test_f1: 0.5547
 epoch: 80, train_loss: 0.7998, test_loss: 0.9087, test_f1: 0.5544
 epoch: 81, train_loss: 0.7833, test_loss: 0.9109, test_f1: 0.5563
 epoch: 82, train_loss: 0.7923, test_loss: 0.9085, test_f1: 0.5524
 epoch: 83, train_loss: 0.7952, test_loss: 0.9215, test_f1: 0.5547
 epoch: 84, train_loss: 0.8044, test_loss: 0.9121, test_f1: 0.5544
 epoch: 85, train_loss: 0.7923, test_loss: 0.9057, test_f1: 0.5598
 epoch: 86, train_loss: 0.8096, test_loss: 0.9119, test_f1: 0.5581
 epoch: 87, train_loss: 0.7900, test_loss: 0.9166, test_f1: 0.5585
 epoch: 88, train_loss: 0.7934, test_loss: 0.9087, test_f1: 0.5614
 epoch: 89, train_loss: 0.7862, test_loss: 0.9110, test_f1: 0.5483
 epoch: 90, train_loss: 0.7870, test_loss: 0.9133, test_f1: 0.5526
 epoch: 91, train_loss: 0.7928, test_loss: 0.9263, test_f1: 0.5508
 epoch: 92, train_loss: 0.7849, test_loss: 0.9120, test_f1: 0.5574
 epoch: 93, train_loss: 0.7809, test_loss: 0.9214, test_f1: 0.5543
 epoch: 94, train_loss: 0.7784, test_loss: 0.9130, test_f1: 0.5587
 epoch: 95, train_loss: 0.7761, test_loss: 0.9120, test_f1: 0.5578
 epoch: 96, train_loss: 0.7860, test_loss: 0.9079, test_f1: 0.5619
 epoch: 97, train_loss: 0.7831, test_loss: 0.9215, test_f1: 0.5622
 epoch: 98, train_loss: 0.7832, test_loss: 0.9159, test_f1: 0.5623
 epoch: 99, train_loss: 0.7817, test_loss: 0.9305, test_f1: 0.5612

Training completed in 554.62 seconds
Best F1: 0.5947 at epoch 90
Mean F1 across iterations: 0.5587  0.0196
========================FINAL RESULTS================================
FEGIN weighted F1: 0.5947  0.0196
python main.py --data ltspice_examples --representation component_net --model FEGIN --layers 2 --hiddens 64 --batch_size 64 --lr 0.0001 --emb_size 128 --epochs 100 --save_appendix component_net_L2_H64_BS64_LR0.0001_E128 --no_val
-----



STDERR:
  File "main.py", line 370, in <module>
    main()
  File "main.py", line 254, in main
    dataset = dataset_class(
  File "/home/philip/projects/ltspice_examples_code_repo/Circuit-Completion-Using-GNNs/component_classification_with_link_prediction_head/evaluation/FEGIN/kernel/circuit_datasets.py", line 15, in __init__
    self.data, self.slices = torch.load(self.processed_paths[0])
  File "/home/philip/.local/lib/python3.8/site-packages/torch/serialization.py", line 1040, in load
    warnings.warn(
  File "/usr/lib/python3.8/warnings.py", line 109, in _showwarnmsg
    sw(msg.message, msg.category, msg.filename, msg.lineno,
  File "main.py", line 47, in warn_with_traceback
    traceback.print_stack(file=log)
/home/philip/projects/ltspice_examples_code_repo/Circuit-Completion-Using-GNNs/component_classification_with_link_prediction_head/evaluation/FEGIN/kernel/circuit_datasets.py:15: FutureWarning: You are using `torch.load` with `weights_only=False` (the current default value), which uses the default pickle module implicitly. It is possible to construct malicious pickle data which will execute arbitrary code during unpickling (See https://github.com/pytorch/pytorch/blob/main/SECURITY.md#untrusted-models for more details). In a future release, the default value for `weights_only` will be flipped to `True`. This limits the functions that could be executed during unpickling. Arbitrary objects will no longer be allowed to be loaded via this mode unless they are explicitly allowlisted by the user via `torch.serialization.add_safe_globals`. We recommend you start setting `weights_only=True` for any use case where you don't have full control of the loaded file. Please open an issue on GitHub for any issues related to this experimental feature.
  self.data, self.slices = torch.load(self.processed_paths[0])
