STDOUT:
Results will be saved in /home/philip/projects/ltspice_examples_code_repo/Circuit-Completion-Using-GNNs/component_classification_with_link_prediction_head/evaluation/FEGIN/results/model_FEGIN_dataset_ltspice_examples
Command line input: python main.py --data ltspice_examples --representation component_pin --model FEGIN --layers 3 --hiddens 64 --batch_size 128 --lr 0.01 --emb_size 250 --epochs 100 --save_appendix component_pin_L3_H64_BS128_LR0.01_E250 --no_val
 is saved.
-----
ltspice_examples - FEGIN
Using 3 layers, 64 hidden units, h = 2
Loading component_pin representation dataset
ENTERED
Training FEGIN on component_pin representation
Train: 3560, Test: 848
##################ITERATION #0 ****************************************
 epoch: 0, train_loss: 1.1761, test_loss: 1.3374, test_f1: 0.3563
 epoch: 1, train_loss: 1.0268, test_loss: 1.0295, test_f1: 0.4558
 epoch: 2, train_loss: 0.9826, test_loss: 1.0801, test_f1: 0.3881
 epoch: 3, train_loss: 0.9495, test_loss: 0.9477, test_f1: 0.4578
 epoch: 4, train_loss: 0.9151, test_loss: 1.0212, test_f1: 0.4830
 epoch: 5, train_loss: 0.8827, test_loss: 0.9810, test_f1: 0.4530
 epoch: 6, train_loss: 0.8804, test_loss: 0.9987, test_f1: 0.4849
 epoch: 7, train_loss: 0.8565, test_loss: 0.8751, test_f1: 0.5305
 epoch: 8, train_loss: 0.8363, test_loss: 0.9380, test_f1: 0.4937
 epoch: 9, train_loss: 0.8186, test_loss: 1.0045, test_f1: 0.4835
 epoch: 10, train_loss: 0.8120, test_loss: 0.8655, test_f1: 0.5299
 epoch: 11, train_loss: 0.7857, test_loss: 0.9634, test_f1: 0.5121
 epoch: 12, train_loss: 0.7704, test_loss: 0.9227, test_f1: 0.5806
 epoch: 13, train_loss: 0.7698, test_loss: 0.9376, test_f1: 0.5696
 epoch: 14, train_loss: 0.7533, test_loss: 0.9776, test_f1: 0.5112
 epoch: 15, train_loss: 0.7516, test_loss: 0.8847, test_f1: 0.6013
 epoch: 16, train_loss: 0.7399, test_loss: 0.9007, test_f1: 0.5673
 epoch: 17, train_loss: 0.7250, test_loss: 0.8430, test_f1: 0.5573
 epoch: 18, train_loss: 0.7282, test_loss: 0.8127, test_f1: 0.6241
 epoch: 19, train_loss: 0.6957, test_loss: 0.8488, test_f1: 0.6163
 epoch: 20, train_loss: 0.6962, test_loss: 0.9257, test_f1: 0.6329
 epoch: 21, train_loss: 0.6866, test_loss: 0.8099, test_f1: 0.6112
 epoch: 22, train_loss: 0.6960, test_loss: 0.7873, test_f1: 0.6408
 epoch: 23, train_loss: 0.6736, test_loss: 0.8746, test_f1: 0.6123
 epoch: 24, train_loss: 0.6541, test_loss: 1.0193, test_f1: 0.5962
 epoch: 25, train_loss: 0.6532, test_loss: 1.0909, test_f1: 0.5619
 epoch: 26, train_loss: 0.6557, test_loss: 0.9038, test_f1: 0.6561
 epoch: 27, train_loss: 0.6321, test_loss: 0.8562, test_f1: 0.6020
 epoch: 28, train_loss: 0.6284, test_loss: 1.0520, test_f1: 0.5347
 epoch: 29, train_loss: 0.6419, test_loss: 0.8987, test_f1: 0.6400
 epoch: 30, train_loss: 0.6311, test_loss: 0.9484, test_f1: 0.6110
 epoch: 31, train_loss: 0.6224, test_loss: 0.8069, test_f1: 0.6207
 epoch: 32, train_loss: 0.6112, test_loss: 0.9151, test_f1: 0.6188
 epoch: 33, train_loss: 0.5814, test_loss: 0.8681, test_f1: 0.5570
 epoch: 34, train_loss: 0.5926, test_loss: 0.9692, test_f1: 0.6309
 epoch: 35, train_loss: 0.5928, test_loss: 0.8931, test_f1: 0.6388
 epoch: 36, train_loss: 0.5943, test_loss: 1.3833, test_f1: 0.5380
 epoch: 37, train_loss: 0.5773, test_loss: 0.8108, test_f1: 0.6585
 epoch: 38, train_loss: 0.5996, test_loss: 1.0042, test_f1: 0.6030
 epoch: 39, train_loss: 0.5603, test_loss: 0.9077, test_f1: 0.6213
 epoch: 40, train_loss: 0.5326, test_loss: 0.8431, test_f1: 0.6361
 epoch: 41, train_loss: 0.5468, test_loss: 0.9346, test_f1: 0.6602
 epoch: 42, train_loss: 0.5465, test_loss: 0.9355, test_f1: 0.6437
 epoch: 43, train_loss: 0.5165, test_loss: 0.9263, test_f1: 0.6308
 epoch: 44, train_loss: 0.5148, test_loss: 0.8223, test_f1: 0.6416
 epoch: 45, train_loss: 0.5296, test_loss: 0.9905, test_f1: 0.6234
 epoch: 46, train_loss: 0.5140, test_loss: 0.8686, test_f1: 0.6587
 epoch: 47, train_loss: 0.5112, test_loss: 0.7255, test_f1: 0.6492
 epoch: 48, train_loss: 0.5122, test_loss: 0.7864, test_f1: 0.6681
 epoch: 49, train_loss: 0.5073, test_loss: 1.1756, test_f1: 0.5956
 epoch: 50, train_loss: 0.5120, test_loss: 1.1330, test_f1: 0.5435
 epoch: 51, train_loss: 0.4667, test_loss: 0.8770, test_f1: 0.6967
 epoch: 52, train_loss: 0.4344, test_loss: 0.7551, test_f1: 0.6839
 epoch: 53, train_loss: 0.4069, test_loss: 0.8629, test_f1: 0.6920
 epoch: 54, train_loss: 0.4195, test_loss: 0.9272, test_f1: 0.6748
 epoch: 55, train_loss: 0.3961, test_loss: 0.9720, test_f1: 0.6712
 epoch: 56, train_loss: 0.4110, test_loss: 0.9493, test_f1: 0.6678
 epoch: 57, train_loss: 0.3924, test_loss: 0.9750, test_f1: 0.6470
 epoch: 58, train_loss: 0.4087, test_loss: 0.9289, test_f1: 0.6831
 epoch: 59, train_loss: 0.3798, test_loss: 0.9421, test_f1: 0.6551
 epoch: 60, train_loss: 0.3802, test_loss: 0.9274, test_f1: 0.6718
 epoch: 61, train_loss: 0.4043, test_loss: 1.0427, test_f1: 0.6685
 epoch: 62, train_loss: 0.3812, test_loss: 1.0147, test_f1: 0.6705
 epoch: 63, train_loss: 0.3689, test_loss: 0.9389, test_f1: 0.6863
 epoch: 64, train_loss: 0.3641, test_loss: 1.0250, test_f1: 0.6643
 epoch: 65, train_loss: 0.3691, test_loss: 0.9382, test_f1: 0.6554
 epoch: 66, train_loss: 0.3605, test_loss: 1.0404, test_f1: 0.7027
 epoch: 67, train_loss: 0.3679, test_loss: 0.8917, test_f1: 0.6703
 epoch: 68, train_loss: 0.3840, test_loss: 1.0157, test_f1: 0.6824
 epoch: 69, train_loss: 0.3527, test_loss: 0.9332, test_f1: 0.6860
 epoch: 70, train_loss: 0.3701, test_loss: 1.0185, test_f1: 0.6796
 epoch: 71, train_loss: 0.3370, test_loss: 0.9911, test_f1: 0.6714
 epoch: 72, train_loss: 0.3381, test_loss: 0.9514, test_f1: 0.6806
 epoch: 73, train_loss: 0.3191, test_loss: 1.0164, test_f1: 0.6695
 epoch: 74, train_loss: 0.3246, test_loss: 1.0979, test_f1: 0.6986
 epoch: 75, train_loss: 0.3336, test_loss: 1.0661, test_f1: 0.7067
 epoch: 76, train_loss: 0.3265, test_loss: 1.1139, test_f1: 0.6759
 epoch: 77, train_loss: 0.3476, test_loss: 1.1545, test_f1: 0.6809
 epoch: 78, train_loss: 0.3141, test_loss: 1.1037, test_f1: 0.6713
 epoch: 79, train_loss: 0.3295, test_loss: 1.1735, test_f1: 0.6724
 epoch: 80, train_loss: 0.3207, test_loss: 1.1829, test_f1: 0.6582
 epoch: 81, train_loss: 0.2950, test_loss: 1.0546, test_f1: 0.6452
 epoch: 82, train_loss: 0.3237, test_loss: 1.0420, test_f1: 0.6704
 epoch: 83, train_loss: 0.3020, test_loss: 1.1183, test_f1: 0.6656
 epoch: 84, train_loss: 0.3267, test_loss: 1.2937, test_f1: 0.6429
 epoch: 85, train_loss: 0.3402, test_loss: 1.1332, test_f1: 0.6522
 epoch: 86, train_loss: 0.3234, test_loss: 1.0899, test_f1: 0.6610
 epoch: 87, train_loss: 0.3028, test_loss: 1.2110, test_f1: 0.6423
 epoch: 88, train_loss: 0.2836, test_loss: 1.2316, test_f1: 0.6528
 epoch: 89, train_loss: 0.2860, test_loss: 1.0263, test_f1: 0.6926
 epoch: 90, train_loss: 0.2897, test_loss: 1.1323, test_f1: 0.6771
 epoch: 91, train_loss: 0.3124, test_loss: 1.0602, test_f1: 0.7043
 epoch: 92, train_loss: 0.3079, test_loss: 1.2376, test_f1: 0.6677
 epoch: 93, train_loss: 0.3143, test_loss: 1.1839, test_f1: 0.6457
 epoch: 94, train_loss: 0.3018, test_loss: 1.1719, test_f1: 0.6448
 epoch: 95, train_loss: 0.2801, test_loss: 1.1398, test_f1: 0.6728
 epoch: 96, train_loss: 0.2823, test_loss: 1.2115, test_f1: 0.6745
 epoch: 97, train_loss: 0.2845, test_loss: 1.0966, test_f1: 0.6692
 epoch: 98, train_loss: 0.2792, test_loss: 1.3614, test_f1: 0.6302
 epoch: 99, train_loss: 0.2795, test_loss: 1.2842, test_f1: 0.6438
##################ITERATION #1 ****************************************
 epoch: 0, train_loss: 1.1163, test_loss: 1.1727, test_f1: 0.3530
 epoch: 1, train_loss: 1.0096, test_loss: 1.0419, test_f1: 0.4655
 epoch: 2, train_loss: 0.9652, test_loss: 1.0182, test_f1: 0.4961
 epoch: 3, train_loss: 0.9281, test_loss: 0.9641, test_f1: 0.4877
 epoch: 4, train_loss: 0.9433, test_loss: 0.9404, test_f1: 0.5402
 epoch: 5, train_loss: 0.9146, test_loss: 0.9243, test_f1: 0.5220
 epoch: 6, train_loss: 0.8944, test_loss: 1.0755, test_f1: 0.4476
 epoch: 7, train_loss: 0.8604, test_loss: 0.9857, test_f1: 0.5109
 epoch: 8, train_loss: 0.8484, test_loss: 0.9505, test_f1: 0.5382
 epoch: 9, train_loss: 0.8381, test_loss: 0.9942, test_f1: 0.5021
 epoch: 10, train_loss: 0.8342, test_loss: 0.9180, test_f1: 0.5232
 epoch: 11, train_loss: 0.8040, test_loss: 0.9567, test_f1: 0.5812
 epoch: 12, train_loss: 0.7873, test_loss: 0.9633, test_f1: 0.5709
 epoch: 13, train_loss: 0.7749, test_loss: 0.8815, test_f1: 0.5828
 epoch: 14, train_loss: 0.7700, test_loss: 0.9183, test_f1: 0.6214
 epoch: 15, train_loss: 0.7417, test_loss: 0.9260, test_f1: 0.5680
 epoch: 16, train_loss: 0.7698, test_loss: 0.9039, test_f1: 0.5884
 epoch: 17, train_loss: 0.7440, test_loss: 0.9141, test_f1: 0.5747
 epoch: 18, train_loss: 0.7341, test_loss: 0.8506, test_f1: 0.6414
 epoch: 19, train_loss: 0.7055, test_loss: 0.9444, test_f1: 0.6019
 epoch: 20, train_loss: 0.7136, test_loss: 0.9825, test_f1: 0.5610
 epoch: 21, train_loss: 0.6960, test_loss: 0.8617, test_f1: 0.5904
 epoch: 22, train_loss: 0.6795, test_loss: 0.8425, test_f1: 0.6684
 epoch: 23, train_loss: 0.6837, test_loss: 0.9657, test_f1: 0.6349
 epoch: 24, train_loss: 0.6846, test_loss: 0.9174, test_f1: 0.6303
 epoch: 25, train_loss: 0.6790, test_loss: 0.9329, test_f1: 0.6171
 epoch: 26, train_loss: 0.6419, test_loss: 0.9461, test_f1: 0.5967
 epoch: 27, train_loss: 0.6558, test_loss: 1.0666, test_f1: 0.6148
 epoch: 28, train_loss: 0.6592, test_loss: 1.0062, test_f1: 0.5986
 epoch: 29, train_loss: 0.6327, test_loss: 1.0165, test_f1: 0.6345
 epoch: 30, train_loss: 0.6395, test_loss: 1.0106, test_f1: 0.6330
 epoch: 31, train_loss: 0.6570, test_loss: 0.9418, test_f1: 0.6039
 epoch: 32, train_loss: 0.6141, test_loss: 0.9570, test_f1: 0.6310
 epoch: 33, train_loss: 0.6267, test_loss: 1.0123, test_f1: 0.6109
 epoch: 34, train_loss: 0.6322, test_loss: 0.9339, test_f1: 0.6516
 epoch: 35, train_loss: 0.5903, test_loss: 0.9160, test_f1: 0.6338
 epoch: 36, train_loss: 0.6170, test_loss: 0.8388, test_f1: 0.6478
 epoch: 37, train_loss: 0.6096, test_loss: 0.9976, test_f1: 0.6447
 epoch: 38, train_loss: 0.5800, test_loss: 0.7657, test_f1: 0.6554
 epoch: 39, train_loss: 0.6003, test_loss: 1.0746, test_f1: 0.6261
 epoch: 40, train_loss: 0.5630, test_loss: 1.1222, test_f1: 0.6324
 epoch: 41, train_loss: 0.5702, test_loss: 1.3177, test_f1: 0.6374
 epoch: 42, train_loss: 0.5744, test_loss: 1.0515, test_f1: 0.6469
 epoch: 43, train_loss: 0.5537, test_loss: 1.2028, test_f1: 0.6046
 epoch: 44, train_loss: 0.5578, test_loss: 0.9140, test_f1: 0.6431
 epoch: 45, train_loss: 0.5293, test_loss: 1.1269, test_f1: 0.6123
 epoch: 46, train_loss: 0.5363, test_loss: 0.8551, test_f1: 0.6381
 epoch: 47, train_loss: 0.5396, test_loss: 1.1314, test_f1: 0.6405
 epoch: 48, train_loss: 0.5340, test_loss: 1.1408, test_f1: 0.6616
 epoch: 49, train_loss: 0.5207, test_loss: 0.9296, test_f1: 0.6216
 epoch: 50, train_loss: 0.5204, test_loss: 1.4539, test_f1: 0.5872
 epoch: 51, train_loss: 0.4965, test_loss: 0.8592, test_f1: 0.6771
 epoch: 52, train_loss: 0.4561, test_loss: 1.0277, test_f1: 0.6801
 epoch: 53, train_loss: 0.4411, test_loss: 1.1213, test_f1: 0.6379
 epoch: 54, train_loss: 0.4463, test_loss: 1.2922, test_f1: 0.6309
 epoch: 55, train_loss: 0.4337, test_loss: 1.2369, test_f1: 0.6571
 epoch: 56, train_loss: 0.4399, test_loss: 1.1472, test_f1: 0.6427
 epoch: 57, train_loss: 0.4464, test_loss: 1.3190, test_f1: 0.6388
 epoch: 58, train_loss: 0.4255, test_loss: 1.1402, test_f1: 0.6521
 epoch: 59, train_loss: 0.4179, test_loss: 1.4336, test_f1: 0.6381
 epoch: 60, train_loss: 0.4104, test_loss: 1.1748, test_f1: 0.6783
 epoch: 61, train_loss: 0.4257, test_loss: 1.3067, test_f1: 0.6485
 epoch: 62, train_loss: 0.4003, test_loss: 1.0381, test_f1: 0.6586
 epoch: 63, train_loss: 0.4144, test_loss: 1.3496, test_f1: 0.6558
 epoch: 64, train_loss: 0.4206, test_loss: 1.1909, test_f1: 0.6556
 epoch: 65, train_loss: 0.3964, test_loss: 1.2695, test_f1: 0.6366
 epoch: 66, train_loss: 0.3928, test_loss: 1.2355, test_f1: 0.6760
 epoch: 67, train_loss: 0.4098, test_loss: 1.2768, test_f1: 0.6649
 epoch: 68, train_loss: 0.3997, test_loss: 1.3430, test_f1: 0.6279
 epoch: 69, train_loss: 0.3976, test_loss: 1.1665, test_f1: 0.6608
 epoch: 70, train_loss: 0.3647, test_loss: 1.2833, test_f1: 0.6632
 epoch: 71, train_loss: 0.3858, test_loss: 1.3234, test_f1: 0.6417
 epoch: 72, train_loss: 0.3962, test_loss: 1.1906, test_f1: 0.6629
 epoch: 73, train_loss: 0.3922, test_loss: 1.2844, test_f1: 0.6529
 epoch: 74, train_loss: 0.3791, test_loss: 1.1799, test_f1: 0.6576
 epoch: 75, train_loss: 0.3610, test_loss: 1.1530, test_f1: 0.6604
 epoch: 76, train_loss: 0.3753, test_loss: 1.2700, test_f1: 0.6458
 epoch: 77, train_loss: 0.3737, test_loss: 1.2436, test_f1: 0.6770
 epoch: 78, train_loss: 0.3681, test_loss: 1.3614, test_f1: 0.6337
 epoch: 79, train_loss: 0.3758, test_loss: 1.1672, test_f1: 0.6685
 epoch: 80, train_loss: 0.3663, test_loss: 1.2369, test_f1: 0.6459
 epoch: 81, train_loss: 0.3555, test_loss: 1.1832, test_f1: 0.6694
 epoch: 82, train_loss: 0.3671, test_loss: 1.3190, test_f1: 0.6638
 epoch: 83, train_loss: 0.3565, test_loss: 1.2003, test_f1: 0.6439
 epoch: 84, train_loss: 0.3403, test_loss: 1.3027, test_f1: 0.6466
 epoch: 85, train_loss: 0.3531, test_loss: 1.3604, test_f1: 0.6814
 epoch: 86, train_loss: 0.3605, test_loss: 1.2942, test_f1: 0.6640
 epoch: 87, train_loss: 0.3608, test_loss: 1.1475, test_f1: 0.6651
 epoch: 88, train_loss: 0.3522, test_loss: 1.3881, test_f1: 0.6618
 epoch: 89, train_loss: 0.3260, test_loss: 1.3060, test_f1: 0.6659
 epoch: 90, train_loss: 0.3407, test_loss: 1.1523, test_f1: 0.6584
 epoch: 91, train_loss: 0.3406, test_loss: 1.3326, test_f1: 0.6861
 epoch: 92, train_loss: 0.3233, test_loss: 1.7707, test_f1: 0.6390
 epoch: 93, train_loss: 0.3454, test_loss: 1.3187, test_f1: 0.6737
 epoch: 94, train_loss: 0.3261, test_loss: 1.4881, test_f1: 0.6765
 epoch: 95, train_loss: 0.3365, test_loss: 1.4387, test_f1: 0.6315
 epoch: 96, train_loss: 0.3113, test_loss: 1.3852, test_f1: 0.6352
 epoch: 97, train_loss: 0.3127, test_loss: 1.5927, test_f1: 0.6530
 epoch: 98, train_loss: 0.3384, test_loss: 1.7623, test_f1: 0.6194
 epoch: 99, train_loss: 0.3318, test_loss: 1.4453, test_f1: 0.7132
##################ITERATION #2 ****************************************
 epoch: 0, train_loss: 1.1898, test_loss: 1.0527, test_f1: 0.3627
 epoch: 1, train_loss: 1.0033, test_loss: 1.0311, test_f1: 0.4502
 epoch: 2, train_loss: 0.9276, test_loss: 1.1689, test_f1: 0.4368
 epoch: 3, train_loss: 0.9023, test_loss: 1.0079, test_f1: 0.4925
 epoch: 4, train_loss: 0.8890, test_loss: 0.9367, test_f1: 0.5152
 epoch: 5, train_loss: 0.8676, test_loss: 0.9013, test_f1: 0.5351
 epoch: 6, train_loss: 0.8501, test_loss: 1.0100, test_f1: 0.5290
 epoch: 7, train_loss: 0.8425, test_loss: 1.0492, test_f1: 0.5139
 epoch: 8, train_loss: 0.8179, test_loss: 0.9668, test_f1: 0.5399
 epoch: 9, train_loss: 0.8158, test_loss: 0.9788, test_f1: 0.4733
 epoch: 10, train_loss: 0.8023, test_loss: 1.0593, test_f1: 0.4929
 epoch: 11, train_loss: 0.7975, test_loss: 0.9217, test_f1: 0.5393
 epoch: 12, train_loss: 0.7797, test_loss: 0.8998, test_f1: 0.5464
 epoch: 13, train_loss: 0.7784, test_loss: 0.9841, test_f1: 0.5204
 epoch: 14, train_loss: 0.7633, test_loss: 1.0282, test_f1: 0.5310
 epoch: 15, train_loss: 0.7586, test_loss: 0.9688, test_f1: 0.5128
 epoch: 16, train_loss: 0.7456, test_loss: 0.9107, test_f1: 0.5322
 epoch: 17, train_loss: 0.7345, test_loss: 1.0050, test_f1: 0.5602
 epoch: 18, train_loss: 0.7288, test_loss: 1.0257, test_f1: 0.4959
 epoch: 19, train_loss: 0.7291, test_loss: 1.0168, test_f1: 0.4626
 epoch: 20, train_loss: 0.7427, test_loss: 0.8716, test_f1: 0.5991
 epoch: 21, train_loss: 0.7201, test_loss: 0.9486, test_f1: 0.6257
 epoch: 22, train_loss: 0.7059, test_loss: 0.9790, test_f1: 0.5971
 epoch: 23, train_loss: 0.6740, test_loss: 1.3153, test_f1: 0.4497
 epoch: 24, train_loss: 0.6922, test_loss: 0.9554, test_f1: 0.5598
 epoch: 25, train_loss: 0.6984, test_loss: 0.9422, test_f1: 0.5232
 epoch: 26, train_loss: 0.6912, test_loss: 0.8227, test_f1: 0.6110
 epoch: 27, train_loss: 0.6641, test_loss: 0.9719, test_f1: 0.5883
 epoch: 28, train_loss: 0.6564, test_loss: 0.9846, test_f1: 0.6137
 epoch: 29, train_loss: 0.6697, test_loss: 1.0533, test_f1: 0.5002
 epoch: 30, train_loss: 0.6823, test_loss: 0.9097, test_f1: 0.5985
 epoch: 31, train_loss: 0.6585, test_loss: 0.9115, test_f1: 0.6100
 epoch: 32, train_loss: 0.6425, test_loss: 0.8140, test_f1: 0.5945
 epoch: 33, train_loss: 0.6283, test_loss: 0.9182, test_f1: 0.6249
 epoch: 34, train_loss: 0.6258, test_loss: 0.9406, test_f1: 0.6259
 epoch: 35, train_loss: 0.6050, test_loss: 0.9780, test_f1: 0.6306
 epoch: 36, train_loss: 0.6365, test_loss: 0.9809, test_f1: 0.6035
 epoch: 37, train_loss: 0.6136, test_loss: 1.0833, test_f1: 0.5411
 epoch: 38, train_loss: 0.6146, test_loss: 1.0052, test_f1: 0.6195
 epoch: 39, train_loss: 0.6175, test_loss: 0.8923, test_f1: 0.6070
 epoch: 40, train_loss: 0.6094, test_loss: 1.0352, test_f1: 0.6135
 epoch: 41, train_loss: 0.5828, test_loss: 1.0914, test_f1: 0.6142
 epoch: 42, train_loss: 0.6141, test_loss: 1.1649, test_f1: 0.5827
 epoch: 43, train_loss: 0.5908, test_loss: 0.9878, test_f1: 0.6172
 epoch: 44, train_loss: 0.5701, test_loss: 1.0179, test_f1: 0.6310
 epoch: 45, train_loss: 0.6366, test_loss: 1.0986, test_f1: 0.6086
 epoch: 46, train_loss: 0.6123, test_loss: 0.9084, test_f1: 0.6209
 epoch: 47, train_loss: 0.6163, test_loss: 0.9592, test_f1: 0.6298
 epoch: 48, train_loss: 0.5671, test_loss: 1.0412, test_f1: 0.6291
 epoch: 49, train_loss: 0.5766, test_loss: 0.9958, test_f1: 0.6299
 epoch: 50, train_loss: 0.5556, test_loss: 1.1708, test_f1: 0.5992
 epoch: 51, train_loss: 0.5201, test_loss: 0.9790, test_f1: 0.6527
 epoch: 52, train_loss: 0.4942, test_loss: 1.0071, test_f1: 0.6447
 epoch: 53, train_loss: 0.4850, test_loss: 1.1141, test_f1: 0.6734
 epoch: 54, train_loss: 0.4746, test_loss: 0.9884, test_f1: 0.6665
 epoch: 55, train_loss: 0.4767, test_loss: 1.1000, test_f1: 0.6427
 epoch: 56, train_loss: 0.4966, test_loss: 1.0844, test_f1: 0.6745
 epoch: 57, train_loss: 0.4832, test_loss: 1.0331, test_f1: 0.6622
 epoch: 58, train_loss: 0.4843, test_loss: 1.0744, test_f1: 0.6386
 epoch: 59, train_loss: 0.4747, test_loss: 1.2302, test_f1: 0.6542
 epoch: 60, train_loss: 0.4674, test_loss: 1.0468, test_f1: 0.6676
 epoch: 61, train_loss: 0.4875, test_loss: 1.1360, test_f1: 0.6543
 epoch: 62, train_loss: 0.4523, test_loss: 1.0064, test_f1: 0.6681
 epoch: 63, train_loss: 0.4406, test_loss: 1.1214, test_f1: 0.6502
 epoch: 64, train_loss: 0.4531, test_loss: 1.1189, test_f1: 0.6504
 epoch: 65, train_loss: 0.4590, test_loss: 1.1445, test_f1: 0.6363
 epoch: 66, train_loss: 0.4507, test_loss: 1.1499, test_f1: 0.6401
 epoch: 67, train_loss: 0.4342, test_loss: 1.1026, test_f1: 0.6215
 epoch: 68, train_loss: 0.4376, test_loss: 1.2091, test_f1: 0.6486
 epoch: 69, train_loss: 0.4732, test_loss: 1.1317, test_f1: 0.6274
 epoch: 70, train_loss: 0.4439, test_loss: 1.1972, test_f1: 0.6211
 epoch: 71, train_loss: 0.4432, test_loss: 1.2156, test_f1: 0.6181
 epoch: 72, train_loss: 0.4417, test_loss: 1.1308, test_f1: 0.6352
 epoch: 73, train_loss: 0.4497, test_loss: 1.0626, test_f1: 0.6444
 epoch: 74, train_loss: 0.4195, test_loss: 1.1179, test_f1: 0.6577
 epoch: 75, train_loss: 0.4356, test_loss: 1.2227, test_f1: 0.6447
 epoch: 76, train_loss: 0.4181, test_loss: 1.2056, test_f1: 0.6441
 epoch: 77, train_loss: 0.4362, test_loss: 1.2888, test_f1: 0.6610
 epoch: 78, train_loss: 0.4115, test_loss: 1.1064, test_f1: 0.6664
 epoch: 79, train_loss: 0.3903, test_loss: 1.3134, test_f1: 0.6446
 epoch: 80, train_loss: 0.4134, test_loss: 1.2224, test_f1: 0.6479
 epoch: 81, train_loss: 0.4229, test_loss: 1.4403, test_f1: 0.6312
 epoch: 82, train_loss: 0.4117, test_loss: 1.4183, test_f1: 0.6640
 epoch: 83, train_loss: 0.4183, test_loss: 1.1422, test_f1: 0.6543
 epoch: 84, train_loss: 0.4216, test_loss: 1.2893, test_f1: 0.6600
 epoch: 85, train_loss: 0.4024, test_loss: 1.1425, test_f1: 0.6416
 epoch: 86, train_loss: 0.3882, test_loss: 1.1587, test_f1: 0.6641
 epoch: 87, train_loss: 0.3958, test_loss: 1.2920, test_f1: 0.6601
 epoch: 88, train_loss: 0.3987, test_loss: 1.2890, test_f1: 0.6491
 epoch: 89, train_loss: 0.4053, test_loss: 1.1456, test_f1: 0.6726
 epoch: 90, train_loss: 0.3879, test_loss: 1.3434, test_f1: 0.6578
 epoch: 91, train_loss: 0.3890, test_loss: 1.2811, test_f1: 0.6825
 epoch: 92, train_loss: 0.4067, test_loss: 1.4535, test_f1: 0.6235
 epoch: 93, train_loss: 0.4101, test_loss: 1.1890, test_f1: 0.6695
 epoch: 94, train_loss: 0.3605, test_loss: 1.1854, test_f1: 0.6795
 epoch: 95, train_loss: 0.3889, test_loss: 1.3811, test_f1: 0.6365
 epoch: 96, train_loss: 0.3877, test_loss: 1.1658, test_f1: 0.6454
 epoch: 97, train_loss: 0.3673, test_loss: 1.2663, test_f1: 0.6743
 epoch: 98, train_loss: 0.3602, test_loss: 1.3033, test_f1: 0.6546
 epoch: 99, train_loss: 0.3773, test_loss: 1.1608, test_f1: 0.6566
##################ITERATION #3 ****************************************
 epoch: 0, train_loss: 1.2216, test_loss: 1.1057, test_f1: 0.4656
 epoch: 1, train_loss: 0.9881, test_loss: 1.0444, test_f1: 0.4593
 epoch: 2, train_loss: 0.9521, test_loss: 0.9958, test_f1: 0.5056
 epoch: 3, train_loss: 0.9289, test_loss: 1.0093, test_f1: 0.5207
 epoch: 4, train_loss: 0.8872, test_loss: 1.0257, test_f1: 0.5514
 epoch: 5, train_loss: 0.8663, test_loss: 1.0033, test_f1: 0.5354
 epoch: 6, train_loss: 0.8440, test_loss: 0.9251, test_f1: 0.5576
 epoch: 7, train_loss: 0.8376, test_loss: 0.8633, test_f1: 0.5401
 epoch: 8, train_loss: 0.8276, test_loss: 0.9095, test_f1: 0.5022
 epoch: 9, train_loss: 0.8224, test_loss: 0.8964, test_f1: 0.5974
 epoch: 10, train_loss: 0.8129, test_loss: 0.8975, test_f1: 0.5410
 epoch: 11, train_loss: 0.7925, test_loss: 0.8996, test_f1: 0.5390
 epoch: 12, train_loss: 0.7786, test_loss: 0.8646, test_f1: 0.5648
 epoch: 13, train_loss: 0.7469, test_loss: 0.8331, test_f1: 0.6344
 epoch: 14, train_loss: 0.7489, test_loss: 0.8519, test_f1: 0.5798
 epoch: 15, train_loss: 0.7312, test_loss: 1.0257, test_f1: 0.5567
 epoch: 16, train_loss: 0.7252, test_loss: 0.8850, test_f1: 0.6124
 epoch: 17, train_loss: 0.7349, test_loss: 0.8740, test_f1: 0.5393
 epoch: 18, train_loss: 0.7222, test_loss: 0.8765, test_f1: 0.5875
 epoch: 19, train_loss: 0.7118, test_loss: 0.9913, test_f1: 0.5841
 epoch: 20, train_loss: 0.7129, test_loss: 0.9030, test_f1: 0.5592
 epoch: 21, train_loss: 0.6776, test_loss: 0.9563, test_f1: 0.5508
 epoch: 22, train_loss: 0.6897, test_loss: 0.8068, test_f1: 0.5783
 epoch: 23, train_loss: 0.6814, test_loss: 0.8781, test_f1: 0.5979
 epoch: 24, train_loss: 0.6765, test_loss: 0.8334, test_f1: 0.5960
 epoch: 25, train_loss: 0.6741, test_loss: 0.8358, test_f1: 0.6144
 epoch: 26, train_loss: 0.6684, test_loss: 0.8969, test_f1: 0.5450
 epoch: 27, train_loss: 0.6510, test_loss: 0.8699, test_f1: 0.6163
 epoch: 28, train_loss: 0.6539, test_loss: 0.8049, test_f1: 0.6171
 epoch: 29, train_loss: 0.6240, test_loss: 0.8416, test_f1: 0.6196
 epoch: 30, train_loss: 0.6317, test_loss: 0.8558, test_f1: 0.6190
 epoch: 31, train_loss: 0.6400, test_loss: 0.8997, test_f1: 0.6041
 epoch: 32, train_loss: 0.6116, test_loss: 1.1568, test_f1: 0.5679
 epoch: 33, train_loss: 0.6107, test_loss: 0.9589, test_f1: 0.5867
 epoch: 34, train_loss: 0.5965, test_loss: 1.0115, test_f1: 0.6216
 epoch: 35, train_loss: 0.5868, test_loss: 0.9540, test_f1: 0.6388
 epoch: 36, train_loss: 0.6052, test_loss: 0.9835, test_f1: 0.5623
 epoch: 37, train_loss: 0.5790, test_loss: 0.8529, test_f1: 0.6363
 epoch: 38, train_loss: 0.5891, test_loss: 0.9141, test_f1: 0.6164
 epoch: 39, train_loss: 0.5648, test_loss: 0.8846, test_f1: 0.6256
 epoch: 40, train_loss: 0.5873, test_loss: 1.0964, test_f1: 0.6129
 epoch: 41, train_loss: 0.5555, test_loss: 0.9798, test_f1: 0.6298
 epoch: 42, train_loss: 0.5391, test_loss: 1.2502, test_f1: 0.6304
 epoch: 43, train_loss: 0.5570, test_loss: 0.8344, test_f1: 0.6513
 epoch: 44, train_loss: 0.5474, test_loss: 0.9149, test_f1: 0.6030
 epoch: 45, train_loss: 0.5394, test_loss: 1.0372, test_f1: 0.5939
 epoch: 46, train_loss: 0.5516, test_loss: 1.0233, test_f1: 0.6356
 epoch: 47, train_loss: 0.5260, test_loss: 0.8482, test_f1: 0.6525
 epoch: 48, train_loss: 0.5521, test_loss: 0.7439, test_f1: 0.6510
 epoch: 49, train_loss: 0.5610, test_loss: 0.8398, test_f1: 0.6483
 epoch: 50, train_loss: 0.5312, test_loss: 0.8209, test_f1: 0.6511
 epoch: 51, train_loss: 0.4992, test_loss: 0.8112, test_f1: 0.6837
 epoch: 52, train_loss: 0.4751, test_loss: 0.9904, test_f1: 0.6311
 epoch: 53, train_loss: 0.4697, test_loss: 0.9079, test_f1: 0.6309
 epoch: 54, train_loss: 0.4605, test_loss: 0.8420, test_f1: 0.6710
 epoch: 55, train_loss: 0.4684, test_loss: 0.9354, test_f1: 0.7042
 epoch: 56, train_loss: 0.4471, test_loss: 0.9406, test_f1: 0.6640
 epoch: 57, train_loss: 0.4208, test_loss: 1.0486, test_f1: 0.6392
 epoch: 58, train_loss: 0.4590, test_loss: 1.0219, test_f1: 0.6392
 epoch: 59, train_loss: 0.4586, test_loss: 1.3842, test_f1: 0.5871
 epoch: 60, train_loss: 0.4149, test_loss: 1.2512, test_f1: 0.5950
 epoch: 61, train_loss: 0.4525, test_loss: 1.0562, test_f1: 0.6616
 epoch: 62, train_loss: 0.4135, test_loss: 1.0189, test_f1: 0.6529
 epoch: 63, train_loss: 0.4085, test_loss: 1.0312, test_f1: 0.6828
 epoch: 64, train_loss: 0.4311, test_loss: 0.9204, test_f1: 0.6724
 epoch: 65, train_loss: 0.4156, test_loss: 1.1394, test_f1: 0.6025
 epoch: 66, train_loss: 0.3911, test_loss: 1.0628, test_f1: 0.6766
 epoch: 67, train_loss: 0.4231, test_loss: 1.0290, test_f1: 0.6104
 epoch: 68, train_loss: 0.4104, test_loss: 1.0598, test_f1: 0.6717
 epoch: 69, train_loss: 0.4207, test_loss: 1.0761, test_f1: 0.6796
 epoch: 70, train_loss: 0.4112, test_loss: 1.0730, test_f1: 0.6323
 epoch: 71, train_loss: 0.4004, test_loss: 1.0530, test_f1: 0.6786
 epoch: 72, train_loss: 0.4084, test_loss: 1.0026, test_f1: 0.6359
 epoch: 73, train_loss: 0.4075, test_loss: 1.0740, test_f1: 0.6481
 epoch: 74, train_loss: 0.3902, test_loss: 0.9079, test_f1: 0.6798
 epoch: 75, train_loss: 0.3845, test_loss: 1.1261, test_f1: 0.6500
 epoch: 76, train_loss: 0.3978, test_loss: 0.8682, test_f1: 0.6636
 epoch: 77, train_loss: 0.3780, test_loss: 1.0799, test_f1: 0.6655
 epoch: 78, train_loss: 0.3695, test_loss: 1.0969, test_f1: 0.6609
 epoch: 79, train_loss: 0.3837, test_loss: 1.3222, test_f1: 0.6359
 epoch: 80, train_loss: 0.4058, test_loss: 1.1333, test_f1: 0.6339
 epoch: 81, train_loss: 0.3734, test_loss: 0.9943, test_f1: 0.6610
 epoch: 82, train_loss: 0.3753, test_loss: 1.0943, test_f1: 0.6386
 epoch: 83, train_loss: 0.3719, test_loss: 1.1344, test_f1: 0.6292
 epoch: 84, train_loss: 0.3670, test_loss: 1.1974, test_f1: 0.6392
 epoch: 85, train_loss: 0.3555, test_loss: 1.1052, test_f1: 0.6439
 epoch: 86, train_loss: 0.3430, test_loss: 1.0316, test_f1: 0.6974
 epoch: 87, train_loss: 0.3563, test_loss: 1.3245, test_f1: 0.6532
 epoch: 88, train_loss: 0.3414, test_loss: 1.4619, test_f1: 0.6198
 epoch: 89, train_loss: 0.3415, test_loss: 1.3969, test_f1: 0.6432
 epoch: 90, train_loss: 0.3667, test_loss: 1.3008, test_f1: 0.6503
 epoch: 91, train_loss: 0.3565, test_loss: 1.3517, test_f1: 0.6341
 epoch: 92, train_loss: 0.3384, test_loss: 1.1099, test_f1: 0.6674
 epoch: 93, train_loss: 0.3420, test_loss: 1.3299, test_f1: 0.6193
 epoch: 94, train_loss: 0.3579, test_loss: 1.0323, test_f1: 0.6842
 epoch: 95, train_loss: 0.3938, test_loss: 1.1009, test_f1: 0.6145
 epoch: 96, train_loss: 0.3471, test_loss: 1.1655, test_f1: 0.6422
 epoch: 97, train_loss: 0.3560, test_loss: 1.2616, test_f1: 0.6608
 epoch: 98, train_loss: 0.3623, test_loss: 0.9303, test_f1: 0.6816
 epoch: 99, train_loss: 0.3340, test_loss: 1.6463, test_f1: 0.6140
##################ITERATION #4 ****************************************
 epoch: 0, train_loss: 1.3041, test_loss: 1.0903, test_f1: 0.4080
 epoch: 1, train_loss: 1.0081, test_loss: 1.0478, test_f1: 0.4602
 epoch: 2, train_loss: 0.9491, test_loss: 1.1340, test_f1: 0.3882
 epoch: 3, train_loss: 0.9228, test_loss: 0.9790, test_f1: 0.4877
 epoch: 4, train_loss: 0.9092, test_loss: 0.9291, test_f1: 0.5318
 epoch: 5, train_loss: 0.8917, test_loss: 0.9519, test_f1: 0.4812
 epoch: 6, train_loss: 0.8729, test_loss: 0.9542, test_f1: 0.5142
 epoch: 7, train_loss: 0.8603, test_loss: 1.0356, test_f1: 0.5213
 epoch: 8, train_loss: 0.8437, test_loss: 0.8967, test_f1: 0.5259
 epoch: 9, train_loss: 0.8302, test_loss: 0.9582, test_f1: 0.4878
 epoch: 10, train_loss: 0.8357, test_loss: 0.9409, test_f1: 0.4892
 epoch: 11, train_loss: 0.8019, test_loss: 1.0028, test_f1: 0.5495
 epoch: 12, train_loss: 0.8081, test_loss: 0.8448, test_f1: 0.6020
 epoch: 13, train_loss: 0.7831, test_loss: 0.9382, test_f1: 0.5750
 epoch: 14, train_loss: 0.7707, test_loss: 0.9969, test_f1: 0.5319
 epoch: 15, train_loss: 0.7669, test_loss: 0.9113, test_f1: 0.5723
 epoch: 16, train_loss: 0.7658, test_loss: 0.9132, test_f1: 0.5481
 epoch: 17, train_loss: 0.7641, test_loss: 0.9383, test_f1: 0.5515
 epoch: 18, train_loss: 0.7426, test_loss: 0.8711, test_f1: 0.5661
 epoch: 19, train_loss: 0.7342, test_loss: 0.9547, test_f1: 0.4996
 epoch: 20, train_loss: 0.7444, test_loss: 1.0376, test_f1: 0.5366
 epoch: 21, train_loss: 0.7375, test_loss: 0.9115, test_f1: 0.5797
 epoch: 22, train_loss: 0.7635, test_loss: 0.9826, test_f1: 0.5382
 epoch: 23, train_loss: 0.7380, test_loss: 0.8385, test_f1: 0.6027
 epoch: 24, train_loss: 0.7248, test_loss: 0.9119, test_f1: 0.5448
 epoch: 25, train_loss: 0.6986, test_loss: 0.9236, test_f1: 0.6208
 epoch: 26, train_loss: 0.6790, test_loss: 0.8908, test_f1: 0.5717
 epoch: 27, train_loss: 0.6842, test_loss: 0.8606, test_f1: 0.6264
 epoch: 28, train_loss: 0.6842, test_loss: 1.1181, test_f1: 0.5258
 epoch: 29, train_loss: 0.6990, test_loss: 1.0273, test_f1: 0.5771
 epoch: 30, train_loss: 0.6523, test_loss: 1.0228, test_f1: 0.5651
 epoch: 31, train_loss: 0.6580, test_loss: 0.9275, test_f1: 0.5888
 epoch: 32, train_loss: 0.6518, test_loss: 1.0647, test_f1: 0.5875
 epoch: 33, train_loss: 0.6563, test_loss: 0.7721, test_f1: 0.6516
 epoch: 34, train_loss: 0.6535, test_loss: 0.9088, test_f1: 0.6053
 epoch: 35, train_loss: 0.6393, test_loss: 0.8147, test_f1: 0.6213
 epoch: 36, train_loss: 0.6259, test_loss: 0.8444, test_f1: 0.6020
 epoch: 37, train_loss: 0.6141, test_loss: 0.9469, test_f1: 0.6188
 epoch: 38, train_loss: 0.6142, test_loss: 0.9122, test_f1: 0.6273
 epoch: 39, train_loss: 0.5956, test_loss: 1.0752, test_f1: 0.5827
 epoch: 40, train_loss: 0.6088, test_loss: 1.0076, test_f1: 0.6268
 epoch: 41, train_loss: 0.6115, test_loss: 1.1734, test_f1: 0.5761
 epoch: 42, train_loss: 0.6214, test_loss: 0.8654, test_f1: 0.6373
 epoch: 43, train_loss: 0.5945, test_loss: 1.1273, test_f1: 0.5897
 epoch: 44, train_loss: 0.5791, test_loss: 0.9797, test_f1: 0.6385
 epoch: 45, train_loss: 0.5690, test_loss: 1.2417, test_f1: 0.5865
 epoch: 46, train_loss: 0.5745, test_loss: 1.1152, test_f1: 0.6124
 epoch: 47, train_loss: 0.5804, test_loss: 1.1691, test_f1: 0.6153
 epoch: 48, train_loss: 0.5750, test_loss: 1.2345, test_f1: 0.5724
 epoch: 49, train_loss: 0.5995, test_loss: 0.9139, test_f1: 0.6386
 epoch: 50, train_loss: 0.5419, test_loss: 1.4567, test_f1: 0.5320
 epoch: 51, train_loss: 0.5469, test_loss: 1.0172, test_f1: 0.6379
 epoch: 52, train_loss: 0.4954, test_loss: 0.9852, test_f1: 0.6452
 epoch: 53, train_loss: 0.4850, test_loss: 1.1066, test_f1: 0.6588
 epoch: 54, train_loss: 0.4965, test_loss: 1.1203, test_f1: 0.6421
 epoch: 55, train_loss: 0.4707, test_loss: 1.2530, test_f1: 0.6131
 epoch: 56, train_loss: 0.4453, test_loss: 1.1452, test_f1: 0.6641
 epoch: 57, train_loss: 0.4733, test_loss: 1.1680, test_f1: 0.6339
 epoch: 58, train_loss: 0.4484, test_loss: 1.3086, test_f1: 0.6254
 epoch: 59, train_loss: 0.4828, test_loss: 1.1776, test_f1: 0.6432
 epoch: 60, train_loss: 0.4658, test_loss: 1.2617, test_f1: 0.6392
 epoch: 61, train_loss: 0.4536, test_loss: 1.2744, test_f1: 0.6314
 epoch: 62, train_loss: 0.4701, test_loss: 1.1516, test_f1: 0.6458
 epoch: 63, train_loss: 0.4676, test_loss: 1.3745, test_f1: 0.6043
 epoch: 64, train_loss: 0.4301, test_loss: 1.2291, test_f1: 0.6443
 epoch: 65, train_loss: 0.4477, test_loss: 1.1450, test_f1: 0.6359
 epoch: 66, train_loss: 0.4567, test_loss: 1.3777, test_f1: 0.6307
 epoch: 67, train_loss: 0.4442, test_loss: 1.3144, test_f1: 0.6357
 epoch: 68, train_loss: 0.4270, test_loss: 1.2644, test_f1: 0.6307
 epoch: 69, train_loss: 0.4261, test_loss: 1.3833, test_f1: 0.6380
 epoch: 70, train_loss: 0.4097, test_loss: 1.2186, test_f1: 0.6674
 epoch: 71, train_loss: 0.4593, test_loss: 1.3570, test_f1: 0.6281
 epoch: 72, train_loss: 0.4258, test_loss: 1.3578, test_f1: 0.6155
 epoch: 73, train_loss: 0.4273, test_loss: 1.3313, test_f1: 0.6377
 epoch: 74, train_loss: 0.4060, test_loss: 1.2056, test_f1: 0.6588
 epoch: 75, train_loss: 0.4097, test_loss: 1.3213, test_f1: 0.6431
 epoch: 76, train_loss: 0.4100, test_loss: 1.2919, test_f1: 0.6402
 epoch: 77, train_loss: 0.4203, test_loss: 1.3177, test_f1: 0.6002
 epoch: 78, train_loss: 0.4325, test_loss: 1.1963, test_f1: 0.6373
 epoch: 79, train_loss: 0.4132, test_loss: 1.1676, test_f1: 0.6441
 epoch: 80, train_loss: 0.4003, test_loss: 1.3631, test_f1: 0.6589
 epoch: 81, train_loss: 0.3859, test_loss: 1.3692, test_f1: 0.6421
 epoch: 82, train_loss: 0.3878, test_loss: 1.1694, test_f1: 0.6319
 epoch: 83, train_loss: 0.4002, test_loss: 1.4559, test_f1: 0.6156
 epoch: 84, train_loss: 0.4147, test_loss: 1.2486, test_f1: 0.6494
 epoch: 85, train_loss: 0.4099, test_loss: 1.2194, test_f1: 0.6424
 epoch: 86, train_loss: 0.4030, test_loss: 1.4434, test_f1: 0.6139
 epoch: 87, train_loss: 0.3977, test_loss: 1.0634, test_f1: 0.6652
 epoch: 88, train_loss: 0.3897, test_loss: 1.5176, test_f1: 0.6459
 epoch: 89, train_loss: 0.3775, test_loss: 1.2789, test_f1: 0.6179
 epoch: 90, train_loss: 0.4029, test_loss: 1.2001, test_f1: 0.6696
 epoch: 91, train_loss: 0.3692, test_loss: 1.1620, test_f1: 0.6550
 epoch: 92, train_loss: 0.4004, test_loss: 1.3310, test_f1: 0.6759
 epoch: 93, train_loss: 0.3631, test_loss: 1.4839, test_f1: 0.6427
 epoch: 94, train_loss: 0.3490, test_loss: 1.1594, test_f1: 0.6401
 epoch: 95, train_loss: 0.3787, test_loss: 1.3227, test_f1: 0.6404
 epoch: 96, train_loss: 0.3524, test_loss: 1.4215, test_f1: 0.6407
 epoch: 97, train_loss: 0.3531, test_loss: 1.3124, test_f1: 0.6543
 epoch: 98, train_loss: 0.3698, test_loss: 1.2223, test_f1: 0.6429
 epoch: 99, train_loss: 0.3640, test_loss: 1.3573, test_f1: 0.6436
##################ITERATION #5 ****************************************
 epoch: 0, train_loss: 1.2061, test_loss: 1.1822, test_f1: 0.4158
 epoch: 1, train_loss: 1.0095, test_loss: 1.1053, test_f1: 0.4648
 epoch: 2, train_loss: 0.9948, test_loss: 1.0527, test_f1: 0.4738
 epoch: 3, train_loss: 0.9625, test_loss: 1.1233, test_f1: 0.4145
 epoch: 4, train_loss: 0.9480, test_loss: 1.0119, test_f1: 0.4415
 epoch: 5, train_loss: 0.9199, test_loss: 1.0933, test_f1: 0.4978
 epoch: 6, train_loss: 0.9193, test_loss: 1.8333, test_f1: 0.3869
 epoch: 7, train_loss: 0.8861, test_loss: 0.9815, test_f1: 0.5083
 epoch: 8, train_loss: 0.8584, test_loss: 0.9946, test_f1: 0.4572
 epoch: 9, train_loss: 0.8589, test_loss: 0.9313, test_f1: 0.5382
 epoch: 10, train_loss: 0.8545, test_loss: 1.1703, test_f1: 0.4151
 epoch: 11, train_loss: 0.8358, test_loss: 1.0874, test_f1: 0.4589
 epoch: 12, train_loss: 0.8054, test_loss: 0.9223, test_f1: 0.5317
 epoch: 13, train_loss: 0.8105, test_loss: 0.9054, test_f1: 0.5533
 epoch: 14, train_loss: 0.7890, test_loss: 1.1617, test_f1: 0.4456
 epoch: 15, train_loss: 0.8077, test_loss: 0.8366, test_f1: 0.5793
 epoch: 16, train_loss: 0.7687, test_loss: 0.8848, test_f1: 0.5326
 epoch: 17, train_loss: 0.7549, test_loss: 0.9991, test_f1: 0.5084
 epoch: 18, train_loss: 0.7420, test_loss: 0.9703, test_f1: 0.5269
 epoch: 19, train_loss: 0.7452, test_loss: 0.8905, test_f1: 0.5480
 epoch: 20, train_loss: 0.7673, test_loss: 1.2532, test_f1: 0.4973
 epoch: 21, train_loss: 0.7700, test_loss: 0.9751, test_f1: 0.5074
 epoch: 22, train_loss: 0.7535, test_loss: 0.9370, test_f1: 0.5484
 epoch: 23, train_loss: 0.7297, test_loss: 0.9345, test_f1: 0.5598
 epoch: 24, train_loss: 0.7211, test_loss: 0.8506, test_f1: 0.5937
 epoch: 25, train_loss: 0.7181, test_loss: 1.4490, test_f1: 0.4164
 epoch: 26, train_loss: 0.7033, test_loss: 0.9534, test_f1: 0.5254
 epoch: 27, train_loss: 0.6981, test_loss: 0.8156, test_f1: 0.6457
 epoch: 28, train_loss: 0.6935, test_loss: 0.8645, test_f1: 0.5619
 epoch: 29, train_loss: 0.6891, test_loss: 0.8567, test_f1: 0.6084
 epoch: 30, train_loss: 0.6776, test_loss: 0.8403, test_f1: 0.6275
 epoch: 31, train_loss: 0.6719, test_loss: 0.9315, test_f1: 0.6175
 epoch: 32, train_loss: 0.6624, test_loss: 0.9689, test_f1: 0.5836
 epoch: 33, train_loss: 0.6296, test_loss: 0.9622, test_f1: 0.5922
 epoch: 34, train_loss: 0.6680, test_loss: 0.9535, test_f1: 0.6053
 epoch: 35, train_loss: 0.6325, test_loss: 0.8312, test_f1: 0.6129
 epoch: 36, train_loss: 0.6489, test_loss: 0.8249, test_f1: 0.6037
 epoch: 37, train_loss: 0.6470, test_loss: 0.9799, test_f1: 0.6270
 epoch: 38, train_loss: 0.6445, test_loss: 0.9852, test_f1: 0.6034
 epoch: 39, train_loss: 0.6260, test_loss: 0.9282, test_f1: 0.6186
 epoch: 40, train_loss: 0.6345, test_loss: 1.1500, test_f1: 0.5648
 epoch: 41, train_loss: 0.6226, test_loss: 0.9846, test_f1: 0.5742
 epoch: 42, train_loss: 0.6153, test_loss: 0.7825, test_f1: 0.6782
 epoch: 43, train_loss: 0.6193, test_loss: 1.0219, test_f1: 0.6254
 epoch: 44, train_loss: 0.6112, test_loss: 0.8379, test_f1: 0.6358
 epoch: 45, train_loss: 0.5873, test_loss: 0.9278, test_f1: 0.6267
 epoch: 46, train_loss: 0.5901, test_loss: 1.1471, test_f1: 0.6024
 epoch: 47, train_loss: 0.5976, test_loss: 1.0949, test_f1: 0.6152
 epoch: 48, train_loss: 0.5844, test_loss: 1.2352, test_f1: 0.5583
 epoch: 49, train_loss: 0.5839, test_loss: 1.0006, test_f1: 0.6338
 epoch: 50, train_loss: 0.5540, test_loss: 0.9940, test_f1: 0.6249
 epoch: 51, train_loss: 0.5558, test_loss: 0.8929, test_f1: 0.6469
 epoch: 52, train_loss: 0.5186, test_loss: 0.9489, test_f1: 0.6691
 epoch: 53, train_loss: 0.5066, test_loss: 0.9214, test_f1: 0.6636
 epoch: 54, train_loss: 0.5040, test_loss: 1.0321, test_f1: 0.6397
 epoch: 55, train_loss: 0.4940, test_loss: 1.0678, test_f1: 0.6453
 epoch: 56, train_loss: 0.4835, test_loss: 1.0922, test_f1: 0.6376
 epoch: 57, train_loss: 0.4869, test_loss: 0.9433, test_f1: 0.6873
 epoch: 58, train_loss: 0.4969, test_loss: 1.0135, test_f1: 0.6568
 epoch: 59, train_loss: 0.4867, test_loss: 1.0420, test_f1: 0.6485
 epoch: 60, train_loss: 0.4769, test_loss: 0.9402, test_f1: 0.6888
 epoch: 61, train_loss: 0.4659, test_loss: 0.9843, test_f1: 0.6857
 epoch: 62, train_loss: 0.4772, test_loss: 0.9599, test_f1: 0.6568
 epoch: 63, train_loss: 0.4623, test_loss: 0.9808, test_f1: 0.6660
 epoch: 64, train_loss: 0.4690, test_loss: 0.9984, test_f1: 0.6739
 epoch: 65, train_loss: 0.4638, test_loss: 1.3233, test_f1: 0.6274
 epoch: 66, train_loss: 0.4621, test_loss: 0.9614, test_f1: 0.6724
 epoch: 67, train_loss: 0.4557, test_loss: 1.2712, test_f1: 0.6333
 epoch: 68, train_loss: 0.4437, test_loss: 1.0410, test_f1: 0.6650
 epoch: 69, train_loss: 0.4523, test_loss: 1.0771, test_f1: 0.6444
 epoch: 70, train_loss: 0.4317, test_loss: 1.2311, test_f1: 0.6480
 epoch: 71, train_loss: 0.4573, test_loss: 1.2054, test_f1: 0.6540
 epoch: 72, train_loss: 0.4320, test_loss: 0.9551, test_f1: 0.6955
 epoch: 73, train_loss: 0.4231, test_loss: 0.9915, test_f1: 0.6716
 epoch: 74, train_loss: 0.4359, test_loss: 1.1206, test_f1: 0.6537
 epoch: 75, train_loss: 0.4272, test_loss: 1.0962, test_f1: 0.6592
 epoch: 76, train_loss: 0.4300, test_loss: 1.1427, test_f1: 0.6478
 epoch: 77, train_loss: 0.4286, test_loss: 1.1091, test_f1: 0.6529
 epoch: 78, train_loss: 0.4311, test_loss: 1.1232, test_f1: 0.6612
 epoch: 79, train_loss: 0.4200, test_loss: 0.9906, test_f1: 0.6688
 epoch: 80, train_loss: 0.4052, test_loss: 1.2266, test_f1: 0.6692
 epoch: 81, train_loss: 0.4322, test_loss: 1.0141, test_f1: 0.6738
 epoch: 82, train_loss: 0.4245, test_loss: 1.0806, test_f1: 0.6848
 epoch: 83, train_loss: 0.4212, test_loss: 1.0133, test_f1: 0.6790
 epoch: 84, train_loss: 0.4253, test_loss: 1.3245, test_f1: 0.6213
 epoch: 85, train_loss: 0.3929, test_loss: 1.1260, test_f1: 0.6655
 epoch: 86, train_loss: 0.4187, test_loss: 1.0623, test_f1: 0.6559
 epoch: 87, train_loss: 0.4154, test_loss: 1.0083, test_f1: 0.6916
 epoch: 88, train_loss: 0.4068, test_loss: 1.0652, test_f1: 0.6799
 epoch: 89, train_loss: 0.3958, test_loss: 1.1265, test_f1: 0.6456
 epoch: 90, train_loss: 0.3998, test_loss: 1.0352, test_f1: 0.6704
 epoch: 91, train_loss: 0.4140, test_loss: 1.2397, test_f1: 0.6540
 epoch: 92, train_loss: 0.3941, test_loss: 1.4105, test_f1: 0.6299
 epoch: 93, train_loss: 0.4009, test_loss: 1.3250, test_f1: 0.6510
 epoch: 94, train_loss: 0.3806, test_loss: 1.2767, test_f1: 0.6783
 epoch: 95, train_loss: 0.3789, test_loss: 1.0774, test_f1: 0.6867
 epoch: 96, train_loss: 0.3931, test_loss: 1.3278, test_f1: 0.6427
 epoch: 97, train_loss: 0.3912, test_loss: 1.1932, test_f1: 0.6843
 epoch: 98, train_loss: 0.3574, test_loss: 1.2666, test_f1: 0.6648
 epoch: 99, train_loss: 0.3837, test_loss: 1.2454, test_f1: 0.6549
##################ITERATION #6 ****************************************
 epoch: 0, train_loss: 1.2473, test_loss: 1.1194, test_f1: 0.4506
 epoch: 1, train_loss: 0.9922, test_loss: 1.0661, test_f1: 0.4992
 epoch: 2, train_loss: 0.9452, test_loss: 1.1016, test_f1: 0.4958
 epoch: 3, train_loss: 0.9048, test_loss: 0.9977, test_f1: 0.5018
 epoch: 4, train_loss: 0.8938, test_loss: 1.0090, test_f1: 0.5283
 epoch: 5, train_loss: 0.8554, test_loss: 1.0340, test_f1: 0.4773
 epoch: 6, train_loss: 0.8483, test_loss: 0.9072, test_f1: 0.5583
 epoch: 7, train_loss: 0.8177, test_loss: 0.9541, test_f1: 0.5446
 epoch: 8, train_loss: 0.8156, test_loss: 0.9897, test_f1: 0.5505
 epoch: 9, train_loss: 0.8149, test_loss: 0.8661, test_f1: 0.6008
 epoch: 10, train_loss: 0.7760, test_loss: 0.9190, test_f1: 0.5413
 epoch: 11, train_loss: 0.7769, test_loss: 0.9125, test_f1: 0.5437
 epoch: 12, train_loss: 0.7751, test_loss: 0.8733, test_f1: 0.5905
 epoch: 13, train_loss: 0.7636, test_loss: 0.8677, test_f1: 0.5317
 epoch: 14, train_loss: 0.7379, test_loss: 0.9203, test_f1: 0.5514
 epoch: 15, train_loss: 0.7423, test_loss: 0.8039, test_f1: 0.6183
 epoch: 16, train_loss: 0.7519, test_loss: 0.9054, test_f1: 0.5971
 epoch: 17, train_loss: 0.7280, test_loss: 0.8215, test_f1: 0.5851
 epoch: 18, train_loss: 0.7103, test_loss: 0.8287, test_f1: 0.5765
 epoch: 19, train_loss: 0.7016, test_loss: 0.8689, test_f1: 0.6232
 epoch: 20, train_loss: 0.7003, test_loss: 0.9653, test_f1: 0.5572
 epoch: 21, train_loss: 0.6779, test_loss: 0.8750, test_f1: 0.5631
 epoch: 22, train_loss: 0.6839, test_loss: 0.9652, test_f1: 0.5606
 epoch: 23, train_loss: 0.6952, test_loss: 0.8849, test_f1: 0.5868
 epoch: 24, train_loss: 0.6648, test_loss: 0.8965, test_f1: 0.6082
 epoch: 25, train_loss: 0.6580, test_loss: 0.8515, test_f1: 0.6348
 epoch: 26, train_loss: 0.6542, test_loss: 0.9752, test_f1: 0.5734
 epoch: 27, train_loss: 0.6469, test_loss: 0.8702, test_f1: 0.5877
 epoch: 28, train_loss: 0.6330, test_loss: 0.8720, test_f1: 0.6267
 epoch: 29, train_loss: 0.6352, test_loss: 0.9582, test_f1: 0.6273
 epoch: 30, train_loss: 0.6211, test_loss: 0.8953, test_f1: 0.6092
 epoch: 31, train_loss: 0.6170, test_loss: 1.1464, test_f1: 0.5950
 epoch: 32, train_loss: 0.6051, test_loss: 0.9335, test_f1: 0.5840
 epoch: 33, train_loss: 0.6009, test_loss: 0.8923, test_f1: 0.6129
 epoch: 34, train_loss: 0.5967, test_loss: 0.9120, test_f1: 0.6523
 epoch: 35, train_loss: 0.5894, test_loss: 0.8495, test_f1: 0.6380
 epoch: 36, train_loss: 0.6224, test_loss: 1.0029, test_f1: 0.6128
 epoch: 37, train_loss: 0.5728, test_loss: 0.8971, test_f1: 0.6176
 epoch: 38, train_loss: 0.5962, test_loss: 0.9689, test_f1: 0.6430
 epoch: 39, train_loss: 0.5653, test_loss: 1.1374, test_f1: 0.6208
 epoch: 40, train_loss: 0.5871, test_loss: 0.9101, test_f1: 0.6547
 epoch: 41, train_loss: 0.5896, test_loss: 0.8725, test_f1: 0.6602
 epoch: 42, train_loss: 0.5809, test_loss: 1.1718, test_f1: 0.6180
 epoch: 43, train_loss: 0.5900, test_loss: 0.9475, test_f1: 0.6348
 epoch: 44, train_loss: 0.5737, test_loss: 0.9310, test_f1: 0.6413
 epoch: 45, train_loss: 0.5462, test_loss: 0.9825, test_f1: 0.6120
 epoch: 46, train_loss: 0.5291, test_loss: 1.2080, test_f1: 0.6160
 epoch: 47, train_loss: 0.5620, test_loss: 1.3238, test_f1: 0.5802
 epoch: 48, train_loss: 0.5695, test_loss: 0.9321, test_f1: 0.6685
 epoch: 49, train_loss: 0.5380, test_loss: 1.0846, test_f1: 0.6175
 epoch: 50, train_loss: 0.5269, test_loss: 0.9693, test_f1: 0.6473
 epoch: 51, train_loss: 0.4887, test_loss: 0.9669, test_f1: 0.6868
 epoch: 52, train_loss: 0.4688, test_loss: 1.0066, test_f1: 0.6669
 epoch: 53, train_loss: 0.4686, test_loss: 0.9960, test_f1: 0.6809
 epoch: 54, train_loss: 0.4631, test_loss: 0.9437, test_f1: 0.7034
 epoch: 55, train_loss: 0.4500, test_loss: 1.0055, test_f1: 0.6687
 epoch: 56, train_loss: 0.4294, test_loss: 1.0777, test_f1: 0.6630
 epoch: 57, train_loss: 0.4264, test_loss: 1.1166, test_f1: 0.6811
 epoch: 58, train_loss: 0.4361, test_loss: 1.0104, test_f1: 0.6649
 epoch: 59, train_loss: 0.4307, test_loss: 1.0195, test_f1: 0.6736
 epoch: 60, train_loss: 0.4306, test_loss: 1.0627, test_f1: 0.6486
 epoch: 61, train_loss: 0.4091, test_loss: 1.0312, test_f1: 0.6536
 epoch: 62, train_loss: 0.4241, test_loss: 1.0694, test_f1: 0.6280
 epoch: 63, train_loss: 0.4129, test_loss: 1.1183, test_f1: 0.6680
 epoch: 64, train_loss: 0.4044, test_loss: 1.2800, test_f1: 0.6286
 epoch: 65, train_loss: 0.3916, test_loss: 1.2160, test_f1: 0.6242
 epoch: 66, train_loss: 0.4107, test_loss: 1.0985, test_f1: 0.6869
 epoch: 67, train_loss: 0.4064, test_loss: 1.1694, test_f1: 0.6641
 epoch: 68, train_loss: 0.3892, test_loss: 1.1444, test_f1: 0.6828
 epoch: 69, train_loss: 0.3991, test_loss: 1.2381, test_f1: 0.6517
 epoch: 70, train_loss: 0.3892, test_loss: 1.1154, test_f1: 0.6857
 epoch: 71, train_loss: 0.3696, test_loss: 1.1427, test_f1: 0.6660
 epoch: 72, train_loss: 0.3804, test_loss: 1.1311, test_f1: 0.7044
 epoch: 73, train_loss: 0.3785, test_loss: 1.0927, test_f1: 0.6788
 epoch: 74, train_loss: 0.3838, test_loss: 1.1882, test_f1: 0.6748
 epoch: 75, train_loss: 0.4015, test_loss: 1.3433, test_f1: 0.6468
 epoch: 76, train_loss: 0.3624, test_loss: 1.3589, test_f1: 0.6315
 epoch: 77, train_loss: 0.3863, test_loss: 1.0490, test_f1: 0.7063
 epoch: 78, train_loss: 0.3547, test_loss: 1.2702, test_f1: 0.6855
 epoch: 79, train_loss: 0.3566, test_loss: 1.2647, test_f1: 0.6551
 epoch: 80, train_loss: 0.3722, test_loss: 1.2186, test_f1: 0.6668
 epoch: 81, train_loss: 0.3667, test_loss: 1.1638, test_f1: 0.6835
 epoch: 82, train_loss: 0.3446, test_loss: 1.3534, test_f1: 0.6409
 epoch: 83, train_loss: 0.3619, test_loss: 1.1552, test_f1: 0.6895
 epoch: 84, train_loss: 0.3654, test_loss: 1.1813, test_f1: 0.6832
 epoch: 85, train_loss: 0.3425, test_loss: 1.2417, test_f1: 0.6484
 epoch: 86, train_loss: 0.3640, test_loss: 1.2894, test_f1: 0.6649
 epoch: 87, train_loss: 0.3471, test_loss: 1.0401, test_f1: 0.6438
 epoch: 88, train_loss: 0.3514, test_loss: 1.3585, test_f1: 0.6315
 epoch: 89, train_loss: 0.3732, test_loss: 1.0772, test_f1: 0.6939
 epoch: 90, train_loss: 0.3276, test_loss: 1.3624, test_f1: 0.6583
 epoch: 91, train_loss: 0.3560, test_loss: 1.2487, test_f1: 0.6743
 epoch: 92, train_loss: 0.3524, test_loss: 1.1766, test_f1: 0.6653
 epoch: 93, train_loss: 0.3317, test_loss: 1.3866, test_f1: 0.6431
 epoch: 94, train_loss: 0.3310, test_loss: 1.3656, test_f1: 0.6714
 epoch: 95, train_loss: 0.3349, test_loss: 1.3367, test_f1: 0.6498
 epoch: 96, train_loss: 0.3317, test_loss: 1.1873, test_f1: 0.6929
 epoch: 97, train_loss: 0.3289, test_loss: 1.3775, test_f1: 0.6413
 epoch: 98, train_loss: 0.3285, test_loss: 1.5565, test_f1: 0.6477
 epoch: 99, train_loss: 0.3283, test_loss: 1.2821, test_f1: 0.6693
##################ITERATION #7 ****************************************
 epoch: 0, train_loss: 1.2444, test_loss: 1.1827, test_f1: 0.3127
 epoch: 1, train_loss: 1.0129, test_loss: 1.2354, test_f1: 0.4136
 epoch: 2, train_loss: 0.9731, test_loss: 1.0327, test_f1: 0.4711
 epoch: 3, train_loss: 0.9414, test_loss: 1.0704, test_f1: 0.4730
 epoch: 4, train_loss: 0.9269, test_loss: 1.1043, test_f1: 0.5028
 epoch: 5, train_loss: 0.8978, test_loss: 0.9823, test_f1: 0.5519
 epoch: 6, train_loss: 0.8842, test_loss: 0.9417, test_f1: 0.5202
 epoch: 7, train_loss: 0.8587, test_loss: 0.9842, test_f1: 0.5373
 epoch: 8, train_loss: 0.8465, test_loss: 1.0798, test_f1: 0.5466
 epoch: 9, train_loss: 0.8459, test_loss: 0.9292, test_f1: 0.5469
 epoch: 10, train_loss: 0.8806, test_loss: 0.9312, test_f1: 0.5013
 epoch: 11, train_loss: 0.8292, test_loss: 0.9612, test_f1: 0.5638
 epoch: 12, train_loss: 0.8099, test_loss: 0.9367, test_f1: 0.5721
 epoch: 13, train_loss: 0.8103, test_loss: 0.9881, test_f1: 0.5237
 epoch: 14, train_loss: 0.8010, test_loss: 0.9682, test_f1: 0.5990
 epoch: 15, train_loss: 0.7669, test_loss: 0.9345, test_f1: 0.5666
 epoch: 16, train_loss: 0.7599, test_loss: 0.9903, test_f1: 0.5688
 epoch: 17, train_loss: 0.7848, test_loss: 1.0044, test_f1: 0.5582
 epoch: 18, train_loss: 0.7545, test_loss: 0.9432, test_f1: 0.5590
 epoch: 19, train_loss: 0.7372, test_loss: 0.9622, test_f1: 0.5708
 epoch: 20, train_loss: 0.7211, test_loss: 1.0314, test_f1: 0.5886
 epoch: 21, train_loss: 0.7268, test_loss: 0.8999, test_f1: 0.6259
 epoch: 22, train_loss: 0.7133, test_loss: 0.9280, test_f1: 0.6039
 epoch: 23, train_loss: 0.7370, test_loss: 0.9660, test_f1: 0.5410
 epoch: 24, train_loss: 0.6959, test_loss: 1.0544, test_f1: 0.5854
 epoch: 25, train_loss: 0.7104, test_loss: 0.8685, test_f1: 0.6182
 epoch: 26, train_loss: 0.6721, test_loss: 1.1094, test_f1: 0.6040
 epoch: 27, train_loss: 0.6743, test_loss: 0.9605, test_f1: 0.5933
 epoch: 28, train_loss: 0.6829, test_loss: 0.9602, test_f1: 0.5930
 epoch: 29, train_loss: 0.6848, test_loss: 1.1030, test_f1: 0.5613
 epoch: 30, train_loss: 0.6424, test_loss: 0.9155, test_f1: 0.6335
 epoch: 31, train_loss: 0.6458, test_loss: 0.7781, test_f1: 0.6258
 epoch: 32, train_loss: 0.6503, test_loss: 1.1064, test_f1: 0.5924
 epoch: 33, train_loss: 0.6208, test_loss: 1.0016, test_f1: 0.6526
 epoch: 34, train_loss: 0.6225, test_loss: 0.8663, test_f1: 0.6346
 epoch: 35, train_loss: 0.6147, test_loss: 0.9464, test_f1: 0.5536
 epoch: 36, train_loss: 0.6308, test_loss: 1.1423, test_f1: 0.5713
 epoch: 37, train_loss: 0.6290, test_loss: 1.2588, test_f1: 0.5222
 epoch: 38, train_loss: 0.6434, test_loss: 0.9193, test_f1: 0.6517
 epoch: 39, train_loss: 0.6358, test_loss: 0.9178, test_f1: 0.5956
 epoch: 40, train_loss: 0.6071, test_loss: 0.9744, test_f1: 0.6052
 epoch: 41, train_loss: 0.6228, test_loss: 0.8390, test_f1: 0.6048
 epoch: 42, train_loss: 0.6129, test_loss: 0.9675, test_f1: 0.5454
 epoch: 43, train_loss: 0.5847, test_loss: 1.1790, test_f1: 0.5568
 epoch: 44, train_loss: 0.5936, test_loss: 0.9128, test_f1: 0.6854
 epoch: 45, train_loss: 0.5934, test_loss: 1.0578, test_f1: 0.6175
 epoch: 46, train_loss: 0.5622, test_loss: 0.8544, test_f1: 0.6470
 epoch: 47, train_loss: 0.5448, test_loss: 0.7944, test_f1: 0.6314
 epoch: 48, train_loss: 0.5647, test_loss: 0.9121, test_f1: 0.6347
 epoch: 49, train_loss: 0.5539, test_loss: 0.8422, test_f1: 0.6331
 epoch: 50, train_loss: 0.5443, test_loss: 0.7898, test_f1: 0.6333
 epoch: 51, train_loss: 0.5230, test_loss: 0.9703, test_f1: 0.6701
 epoch: 52, train_loss: 0.4937, test_loss: 1.0411, test_f1: 0.6446
 epoch: 53, train_loss: 0.4884, test_loss: 0.8464, test_f1: 0.6644
 epoch: 54, train_loss: 0.4671, test_loss: 0.9616, test_f1: 0.6159
 epoch: 55, train_loss: 0.4708, test_loss: 0.8719, test_f1: 0.6339
 epoch: 56, train_loss: 0.4568, test_loss: 0.9950, test_f1: 0.6042
 epoch: 57, train_loss: 0.4608, test_loss: 0.8496, test_f1: 0.6218
 epoch: 58, train_loss: 0.4670, test_loss: 0.9610, test_f1: 0.6284
 epoch: 59, train_loss: 0.4392, test_loss: 0.9423, test_f1: 0.6488
 epoch: 60, train_loss: 0.4462, test_loss: 0.9559, test_f1: 0.6659
 epoch: 61, train_loss: 0.4198, test_loss: 0.9930, test_f1: 0.6552
 epoch: 62, train_loss: 0.4501, test_loss: 1.0462, test_f1: 0.6383
 epoch: 63, train_loss: 0.4361, test_loss: 0.9173, test_f1: 0.6377
 epoch: 64, train_loss: 0.4502, test_loss: 1.0021, test_f1: 0.6875
 epoch: 65, train_loss: 0.4394, test_loss: 1.1037, test_f1: 0.6761
 epoch: 66, train_loss: 0.4414, test_loss: 1.0627, test_f1: 0.6589
 epoch: 67, train_loss: 0.4154, test_loss: 0.9734, test_f1: 0.6606
 epoch: 68, train_loss: 0.4052, test_loss: 1.1111, test_f1: 0.6606
 epoch: 69, train_loss: 0.4080, test_loss: 1.1761, test_f1: 0.6604
 epoch: 70, train_loss: 0.4090, test_loss: 1.1816, test_f1: 0.6180
 epoch: 71, train_loss: 0.4245, test_loss: 1.1485, test_f1: 0.6463
 epoch: 72, train_loss: 0.4044, test_loss: 1.1331, test_f1: 0.6499
 epoch: 73, train_loss: 0.4193, test_loss: 1.2410, test_f1: 0.6585
 epoch: 74, train_loss: 0.4227, test_loss: 1.1903, test_f1: 0.6453
 epoch: 75, train_loss: 0.4366, test_loss: 1.2548, test_f1: 0.6060
 epoch: 76, train_loss: 0.4033, test_loss: 1.0823, test_f1: 0.6710
 epoch: 77, train_loss: 0.3887, test_loss: 1.1466, test_f1: 0.6740
 epoch: 78, train_loss: 0.3873, test_loss: 1.1545, test_f1: 0.6660
 epoch: 79, train_loss: 0.4089, test_loss: 1.1373, test_f1: 0.6644
 epoch: 80, train_loss: 0.4083, test_loss: 1.2969, test_f1: 0.6622
 epoch: 81, train_loss: 0.3979, test_loss: 1.1365, test_f1: 0.6572
 epoch: 82, train_loss: 0.3857, test_loss: 1.1705, test_f1: 0.6601
 epoch: 83, train_loss: 0.3819, test_loss: 1.0997, test_f1: 0.6525
 epoch: 84, train_loss: 0.3737, test_loss: 1.1140, test_f1: 0.6722
 epoch: 85, train_loss: 0.3801, test_loss: 0.9915, test_f1: 0.6763
 epoch: 86, train_loss: 0.3726, test_loss: 1.1719, test_f1: 0.6751
 epoch: 87, train_loss: 0.3695, test_loss: 1.2793, test_f1: 0.6253
 epoch: 88, train_loss: 0.4083, test_loss: 1.2021, test_f1: 0.6512
 epoch: 89, train_loss: 0.3858, test_loss: 1.1055, test_f1: 0.6787
 epoch: 90, train_loss: 0.3824, test_loss: 1.3121, test_f1: 0.6523
 epoch: 91, train_loss: 0.3652, test_loss: 1.4673, test_f1: 0.6437
 epoch: 92, train_loss: 0.3645, test_loss: 1.2066, test_f1: 0.6253
 epoch: 93, train_loss: 0.3582, test_loss: 1.1716, test_f1: 0.6820
 epoch: 94, train_loss: 0.3560, test_loss: 1.1651, test_f1: 0.6753
 epoch: 95, train_loss: 0.3638, test_loss: 1.1271, test_f1: 0.6843
 epoch: 96, train_loss: 0.3697, test_loss: 1.1763, test_f1: 0.6690
 epoch: 97, train_loss: 0.3536, test_loss: 1.1802, test_f1: 0.6881
 epoch: 98, train_loss: 0.3346, test_loss: 1.1954, test_f1: 0.6408
 epoch: 99, train_loss: 0.3474, test_loss: 1.1796, test_f1: 0.6579
##################ITERATION #8 ****************************************
 epoch: 0, train_loss: 1.2062, test_loss: 1.1688, test_f1: 0.4003
 epoch: 1, train_loss: 0.9978, test_loss: 1.0995, test_f1: 0.4653
 epoch: 2, train_loss: 0.9491, test_loss: 1.0675, test_f1: 0.4832
 epoch: 3, train_loss: 0.9398, test_loss: 1.0530, test_f1: 0.4369
 epoch: 4, train_loss: 0.9173, test_loss: 1.0605, test_f1: 0.4770
 epoch: 5, train_loss: 0.8968, test_loss: 0.9356, test_f1: 0.5129
 epoch: 6, train_loss: 0.8647, test_loss: 0.9934, test_f1: 0.4925
 epoch: 7, train_loss: 0.8496, test_loss: 0.9907, test_f1: 0.5335
 epoch: 8, train_loss: 0.8282, test_loss: 0.9713, test_f1: 0.5191
 epoch: 9, train_loss: 0.8051, test_loss: 0.8905, test_f1: 0.5627
 epoch: 10, train_loss: 0.8179, test_loss: 0.8531, test_f1: 0.5754
 epoch: 11, train_loss: 0.7914, test_loss: 0.9178, test_f1: 0.5529
 epoch: 12, train_loss: 0.7919, test_loss: 0.9830, test_f1: 0.5460
 epoch: 13, train_loss: 0.7702, test_loss: 1.2206, test_f1: 0.5089
 epoch: 14, train_loss: 0.7894, test_loss: 1.0123, test_f1: 0.5556
 epoch: 15, train_loss: 0.7621, test_loss: 1.2223, test_f1: 0.4528
 epoch: 16, train_loss: 0.7689, test_loss: 1.1331, test_f1: 0.5826
 epoch: 17, train_loss: 0.7405, test_loss: 0.9960, test_f1: 0.4946
 epoch: 18, train_loss: 0.7172, test_loss: 1.0136, test_f1: 0.5960
 epoch: 19, train_loss: 0.7284, test_loss: 1.0862, test_f1: 0.5668
 epoch: 20, train_loss: 0.7325, test_loss: 0.9387, test_f1: 0.5653
 epoch: 21, train_loss: 0.7045, test_loss: 0.9345, test_f1: 0.6203
 epoch: 22, train_loss: 0.6975, test_loss: 0.9539, test_f1: 0.5870
 epoch: 23, train_loss: 0.7207, test_loss: 0.8865, test_f1: 0.6002
 epoch: 24, train_loss: 0.7003, test_loss: 1.1503, test_f1: 0.5546
 epoch: 25, train_loss: 0.6995, test_loss: 0.9550, test_f1: 0.6117
 epoch: 26, train_loss: 0.7004, test_loss: 1.2010, test_f1: 0.5490
 epoch: 27, train_loss: 0.6916, test_loss: 0.9327, test_f1: 0.5856
 epoch: 28, train_loss: 0.6816, test_loss: 0.9529, test_f1: 0.6243
 epoch: 29, train_loss: 0.6742, test_loss: 1.1088, test_f1: 0.5799
 epoch: 30, train_loss: 0.6784, test_loss: 0.9135, test_f1: 0.6497
 epoch: 31, train_loss: 0.6374, test_loss: 1.2430, test_f1: 0.5428
 epoch: 32, train_loss: 0.6478, test_loss: 1.0459, test_f1: 0.6290
 epoch: 33, train_loss: 0.6409, test_loss: 0.9647, test_f1: 0.6025
 epoch: 34, train_loss: 0.6528, test_loss: 0.8667, test_f1: 0.6201
 epoch: 35, train_loss: 0.6517, test_loss: 1.0068, test_f1: 0.5917
 epoch: 36, train_loss: 0.6355, test_loss: 0.8810, test_f1: 0.6635
 epoch: 37, train_loss: 0.6075, test_loss: 0.9804, test_f1: 0.6260
 epoch: 38, train_loss: 0.6123, test_loss: 0.9574, test_f1: 0.6258
 epoch: 39, train_loss: 0.6121, test_loss: 1.0978, test_f1: 0.5874
 epoch: 40, train_loss: 0.6043, test_loss: 1.0753, test_f1: 0.5544
 epoch: 41, train_loss: 0.6109, test_loss: 0.8259, test_f1: 0.6694
 epoch: 42, train_loss: 0.5826, test_loss: 1.0565, test_f1: 0.6254
 epoch: 43, train_loss: 0.5957, test_loss: 0.9927, test_f1: 0.5883
 epoch: 44, train_loss: 0.6046, test_loss: 0.9767, test_f1: 0.5945
 epoch: 45, train_loss: 0.5909, test_loss: 0.9406, test_f1: 0.6124
 epoch: 46, train_loss: 0.5726, test_loss: 0.9495, test_f1: 0.6168
 epoch: 47, train_loss: 0.5752, test_loss: 1.0865, test_f1: 0.6121
 epoch: 48, train_loss: 0.5745, test_loss: 1.0011, test_f1: 0.6054
 epoch: 49, train_loss: 0.5590, test_loss: 1.0129, test_f1: 0.6416
 epoch: 50, train_loss: 0.5683, test_loss: 0.9361, test_f1: 0.6596
 epoch: 51, train_loss: 0.5280, test_loss: 1.0358, test_f1: 0.6433
 epoch: 52, train_loss: 0.4964, test_loss: 1.0216, test_f1: 0.6330
 epoch: 53, train_loss: 0.4909, test_loss: 1.0030, test_f1: 0.6564
 epoch: 54, train_loss: 0.4882, test_loss: 1.0527, test_f1: 0.6314
 epoch: 55, train_loss: 0.4532, test_loss: 1.1039, test_f1: 0.6250
 epoch: 56, train_loss: 0.4606, test_loss: 1.0136, test_f1: 0.6362
 epoch: 57, train_loss: 0.4640, test_loss: 1.0304, test_f1: 0.6695
 epoch: 58, train_loss: 0.4568, test_loss: 0.9895, test_f1: 0.6536
 epoch: 59, train_loss: 0.4581, test_loss: 0.9955, test_f1: 0.6563
 epoch: 60, train_loss: 0.4493, test_loss: 1.1797, test_f1: 0.6254
 epoch: 61, train_loss: 0.4488, test_loss: 1.0306, test_f1: 0.6315
 epoch: 62, train_loss: 0.4495, test_loss: 1.0100, test_f1: 0.6533
 epoch: 63, train_loss: 0.4533, test_loss: 1.0399, test_f1: 0.6346
 epoch: 64, train_loss: 0.4427, test_loss: 1.0962, test_f1: 0.6274
 epoch: 65, train_loss: 0.4422, test_loss: 1.0277, test_f1: 0.6427
 epoch: 66, train_loss: 0.4482, test_loss: 1.0949, test_f1: 0.6417
 epoch: 67, train_loss: 0.4459, test_loss: 1.0231, test_f1: 0.6436
 epoch: 68, train_loss: 0.4445, test_loss: 1.1975, test_f1: 0.6507
 epoch: 69, train_loss: 0.4371, test_loss: 0.9680, test_f1: 0.6504
 epoch: 70, train_loss: 0.4249, test_loss: 1.0038, test_f1: 0.6785
 epoch: 71, train_loss: 0.4164, test_loss: 1.1056, test_f1: 0.6598
 epoch: 72, train_loss: 0.4321, test_loss: 1.1659, test_f1: 0.6153
 epoch: 73, train_loss: 0.4281, test_loss: 1.2020, test_f1: 0.6219
 epoch: 74, train_loss: 0.3989, test_loss: 1.0895, test_f1: 0.6560
 epoch: 75, train_loss: 0.4077, test_loss: 1.1669, test_f1: 0.6835
 epoch: 76, train_loss: 0.4049, test_loss: 1.0397, test_f1: 0.6376
 epoch: 77, train_loss: 0.4127, test_loss: 1.1514, test_f1: 0.6575
 epoch: 78, train_loss: 0.4225, test_loss: 1.1736, test_f1: 0.6463
 epoch: 79, train_loss: 0.4085, test_loss: 1.3350, test_f1: 0.6332
 epoch: 80, train_loss: 0.4155, test_loss: 1.1508, test_f1: 0.6788
 epoch: 81, train_loss: 0.4071, test_loss: 1.1984, test_f1: 0.6456
 epoch: 82, train_loss: 0.3892, test_loss: 1.2072, test_f1: 0.6267
 epoch: 83, train_loss: 0.4192, test_loss: 1.1597, test_f1: 0.6601
 epoch: 84, train_loss: 0.3822, test_loss: 1.1152, test_f1: 0.6620
 epoch: 85, train_loss: 0.3882, test_loss: 1.2505, test_f1: 0.6567
 epoch: 86, train_loss: 0.3921, test_loss: 1.1845, test_f1: 0.6394
 epoch: 87, train_loss: 0.3804, test_loss: 1.2077, test_f1: 0.6370
 epoch: 88, train_loss: 0.3959, test_loss: 1.2338, test_f1: 0.6647
 epoch: 89, train_loss: 0.3692, test_loss: 1.1737, test_f1: 0.6353
 epoch: 90, train_loss: 0.3523, test_loss: 1.4060, test_f1: 0.6194
 epoch: 91, train_loss: 0.3655, test_loss: 1.5607, test_f1: 0.6313
 epoch: 92, train_loss: 0.3841, test_loss: 1.3445, test_f1: 0.6403
 epoch: 93, train_loss: 0.3714, test_loss: 1.2641, test_f1: 0.6531
 epoch: 94, train_loss: 0.3761, test_loss: 1.3490, test_f1: 0.6545
 epoch: 95, train_loss: 0.3939, test_loss: 1.1523, test_f1: 0.6564
 epoch: 96, train_loss: 0.3619, test_loss: 1.4868, test_f1: 0.6509
 epoch: 97, train_loss: 0.3633, test_loss: 1.2968, test_f1: 0.6436
 epoch: 98, train_loss: 0.3468, test_loss: 1.2772, test_f1: 0.6657
 epoch: 99, train_loss: 0.3429, test_loss: 1.2770, test_f1: 0.6501
##################ITERATION #9 ****************************************
 epoch: 0, train_loss: 1.1883, test_loss: 1.1051, test_f1: 0.4338
 epoch: 1, train_loss: 1.0009, test_loss: 1.1119, test_f1: 0.4729
 epoch: 2, train_loss: 0.9655, test_loss: 1.0520, test_f1: 0.5390
 epoch: 3, train_loss: 0.9390, test_loss: 1.0022, test_f1: 0.4918
 epoch: 4, train_loss: 0.9264, test_loss: 0.9996, test_f1: 0.5514
 epoch: 5, train_loss: 0.8887, test_loss: 1.0510, test_f1: 0.4841
 epoch: 6, train_loss: 0.8893, test_loss: 1.0326, test_f1: 0.5470
 epoch: 7, train_loss: 0.8566, test_loss: 0.9761, test_f1: 0.5365
 epoch: 8, train_loss: 0.8569, test_loss: 1.1096, test_f1: 0.5468
 epoch: 9, train_loss: 0.8323, test_loss: 0.9278, test_f1: 0.5576
 epoch: 10, train_loss: 0.8198, test_loss: 1.1566, test_f1: 0.5081
 epoch: 11, train_loss: 0.8047, test_loss: 0.8391, test_f1: 0.5901
 epoch: 12, train_loss: 0.7913, test_loss: 0.9810, test_f1: 0.5377
 epoch: 13, train_loss: 0.7975, test_loss: 0.9073, test_f1: 0.5612
 epoch: 14, train_loss: 0.7769, test_loss: 0.8252, test_f1: 0.5603
 epoch: 15, train_loss: 0.7545, test_loss: 0.7999, test_f1: 0.5887
 epoch: 16, train_loss: 0.7513, test_loss: 0.9155, test_f1: 0.6030
 epoch: 17, train_loss: 0.7299, test_loss: 0.8192, test_f1: 0.6412
 epoch: 18, train_loss: 0.7158, test_loss: 0.8760, test_f1: 0.6118
 epoch: 19, train_loss: 0.7246, test_loss: 0.8733, test_f1: 0.6113
 epoch: 20, train_loss: 0.7020, test_loss: 0.8300, test_f1: 0.6002
 epoch: 21, train_loss: 0.6982, test_loss: 1.1395, test_f1: 0.4900
 epoch: 22, train_loss: 0.7019, test_loss: 0.8842, test_f1: 0.5995
 epoch: 23, train_loss: 0.6912, test_loss: 0.9277, test_f1: 0.6204
 epoch: 24, train_loss: 0.6671, test_loss: 0.9978, test_f1: 0.5586
 epoch: 25, train_loss: 0.6732, test_loss: 1.1274, test_f1: 0.5153
 epoch: 26, train_loss: 0.6912, test_loss: 0.7734, test_f1: 0.6336
 epoch: 27, train_loss: 0.6549, test_loss: 0.7849, test_f1: 0.6209
 epoch: 28, train_loss: 0.6460, test_loss: 0.8072, test_f1: 0.5823
 epoch: 29, train_loss: 0.6641, test_loss: 1.1175, test_f1: 0.5460
 epoch: 30, train_loss: 0.6460, test_loss: 0.9783, test_f1: 0.6020
 epoch: 31, train_loss: 0.6196, test_loss: 0.9294, test_f1: 0.6057
 epoch: 32, train_loss: 0.6334, test_loss: 1.0672, test_f1: 0.5910
 epoch: 33, train_loss: 0.6226, test_loss: 0.9151, test_f1: 0.6243
 epoch: 34, train_loss: 0.6103, test_loss: 1.1324, test_f1: 0.6078
 epoch: 35, train_loss: 0.6100, test_loss: 0.9023, test_f1: 0.6490
 epoch: 36, train_loss: 0.6058, test_loss: 0.7759, test_f1: 0.6481
 epoch: 37, train_loss: 0.6095, test_loss: 0.8683, test_f1: 0.6133
 epoch: 38, train_loss: 0.5811, test_loss: 1.0476, test_f1: 0.5973
 epoch: 39, train_loss: 0.6072, test_loss: 1.0336, test_f1: 0.6285
 epoch: 40, train_loss: 0.6052, test_loss: 0.9381, test_f1: 0.6216
 epoch: 41, train_loss: 0.5867, test_loss: 1.0787, test_f1: 0.6043
 epoch: 42, train_loss: 0.6113, test_loss: 0.9759, test_f1: 0.5674
 epoch: 43, train_loss: 0.5857, test_loss: 0.8731, test_f1: 0.6161
 epoch: 44, train_loss: 0.5896, test_loss: 1.0244, test_f1: 0.6289
 epoch: 45, train_loss: 0.6075, test_loss: 1.0459, test_f1: 0.6335
 epoch: 46, train_loss: 0.5706, test_loss: 1.0043, test_f1: 0.6224
 epoch: 47, train_loss: 0.5801, test_loss: 1.1302, test_f1: 0.5900
 epoch: 48, train_loss: 0.5683, test_loss: 0.8971, test_f1: 0.6516
 epoch: 49, train_loss: 0.5516, test_loss: 1.0243, test_f1: 0.6117
 epoch: 50, train_loss: 0.5645, test_loss: 0.9753, test_f1: 0.6062
 epoch: 51, train_loss: 0.5302, test_loss: 0.8965, test_f1: 0.6405
 epoch: 52, train_loss: 0.4933, test_loss: 1.0036, test_f1: 0.6194
 epoch: 53, train_loss: 0.4665, test_loss: 0.9906, test_f1: 0.6313
 epoch: 54, train_loss: 0.4827, test_loss: 0.9376, test_f1: 0.6412
 epoch: 55, train_loss: 0.4687, test_loss: 0.9235, test_f1: 0.6223
 epoch: 56, train_loss: 0.4817, test_loss: 0.9389, test_f1: 0.6389
 epoch: 57, train_loss: 0.4524, test_loss: 0.8512, test_f1: 0.6473
 epoch: 58, train_loss: 0.4539, test_loss: 1.0695, test_f1: 0.6280
 epoch: 59, train_loss: 0.4417, test_loss: 0.9577, test_f1: 0.6469
 epoch: 60, train_loss: 0.4568, test_loss: 1.0673, test_f1: 0.6328
 epoch: 61, train_loss: 0.4288, test_loss: 1.0402, test_f1: 0.6403
 epoch: 62, train_loss: 0.4338, test_loss: 0.9921, test_f1: 0.6407
 epoch: 63, train_loss: 0.4411, test_loss: 0.9824, test_f1: 0.6639
 epoch: 64, train_loss: 0.4267, test_loss: 0.9969, test_f1: 0.6164
 epoch: 65, train_loss: 0.4384, test_loss: 0.9070, test_f1: 0.6485
 epoch: 66, train_loss: 0.4312, test_loss: 1.0183, test_f1: 0.6605
 epoch: 67, train_loss: 0.4237, test_loss: 1.0328, test_f1: 0.6298
 epoch: 68, train_loss: 0.4251, test_loss: 1.0246, test_f1: 0.6206
 epoch: 69, train_loss: 0.4197, test_loss: 0.9967, test_f1: 0.6550
 epoch: 70, train_loss: 0.3996, test_loss: 1.0521, test_f1: 0.6471
 epoch: 71, train_loss: 0.3991, test_loss: 1.1674, test_f1: 0.6427
 epoch: 72, train_loss: 0.4206, test_loss: 0.9946, test_f1: 0.6614
 epoch: 73, train_loss: 0.4390, test_loss: 1.1754, test_f1: 0.6106
 epoch: 74, train_loss: 0.4257, test_loss: 0.9276, test_f1: 0.6468
 epoch: 75, train_loss: 0.4328, test_loss: 1.1016, test_f1: 0.6385
 epoch: 76, train_loss: 0.4092, test_loss: 1.0135, test_f1: 0.6488
 epoch: 77, train_loss: 0.4047, test_loss: 1.1489, test_f1: 0.6426
 epoch: 78, train_loss: 0.4162, test_loss: 1.0339, test_f1: 0.6272
 epoch: 79, train_loss: 0.4099, test_loss: 0.9855, test_f1: 0.6387
 epoch: 80, train_loss: 0.3889, test_loss: 1.1130, test_f1: 0.6847
 epoch: 81, train_loss: 0.3698, test_loss: 1.3084, test_f1: 0.6253
 epoch: 82, train_loss: 0.3971, test_loss: 1.2341, test_f1: 0.6374
 epoch: 83, train_loss: 0.4218, test_loss: 1.0651, test_f1: 0.6393
 epoch: 84, train_loss: 0.3871, test_loss: 0.9862, test_f1: 0.6292
 epoch: 85, train_loss: 0.3946, test_loss: 1.1702, test_f1: 0.6263
 epoch: 86, train_loss: 0.3844, test_loss: 1.1407, test_f1: 0.6387
 epoch: 87, train_loss: 0.3847, test_loss: 1.0552, test_f1: 0.6428
 epoch: 88, train_loss: 0.3723, test_loss: 1.2008, test_f1: 0.6507
 epoch: 89, train_loss: 0.3529, test_loss: 1.0689, test_f1: 0.6497
 epoch: 90, train_loss: 0.3634, test_loss: 1.2192, test_f1: 0.6477
 epoch: 91, train_loss: 0.3591, test_loss: 1.1263, test_f1: 0.6661
 epoch: 92, train_loss: 0.3656, test_loss: 1.2947, test_f1: 0.6341
 epoch: 93, train_loss: 0.3588, test_loss: 1.2423, test_f1: 0.6452
 epoch: 94, train_loss: 0.3633, test_loss: 1.0750, test_f1: 0.6618
 epoch: 95, train_loss: 0.3449, test_loss: 1.1956, test_f1: 0.6470
 epoch: 96, train_loss: 0.3677, test_loss: 1.2150, test_f1: 0.6602
 epoch: 97, train_loss: 0.3584, test_loss: 1.1955, test_f1: 0.6502
 epoch: 98, train_loss: 0.3505, test_loss: 1.1879, test_f1: 0.6567
 epoch: 99, train_loss: 0.3457, test_loss: 1.4086, test_f1: 0.6033

Training completed in 485.67 seconds
Best F1: 0.7132 at epoch 99
Mean F1 across iterations: 0.6941  0.0122
========================FINAL RESULTS================================
FEGIN weighted F1: 0.7132  0.0122
python main.py --data ltspice_examples --representation component_pin --model FEGIN --layers 3 --hiddens 64 --batch_size 128 --lr 0.01 --emb_size 250 --epochs 100 --save_appendix component_pin_L3_H64_BS128_LR0.01_E250 --no_val
-----



STDERR:
  File "main.py", line 370, in <module>
    main()
  File "main.py", line 254, in main
    dataset = dataset_class(
  File "/home/philip/projects/ltspice_examples_code_repo/Circuit-Completion-Using-GNNs/component_classification_with_link_prediction_head/evaluation/FEGIN/kernel/circuit_datasets.py", line 15, in __init__
    self.data, self.slices = torch.load(self.processed_paths[0])
  File "/home/philip/.local/lib/python3.8/site-packages/torch/serialization.py", line 1040, in load
    warnings.warn(
  File "/usr/lib/python3.8/warnings.py", line 109, in _showwarnmsg
    sw(msg.message, msg.category, msg.filename, msg.lineno,
  File "main.py", line 47, in warn_with_traceback
    traceback.print_stack(file=log)
/home/philip/projects/ltspice_examples_code_repo/Circuit-Completion-Using-GNNs/component_classification_with_link_prediction_head/evaluation/FEGIN/kernel/circuit_datasets.py:15: FutureWarning: You are using `torch.load` with `weights_only=False` (the current default value), which uses the default pickle module implicitly. It is possible to construct malicious pickle data which will execute arbitrary code during unpickling (See https://github.com/pytorch/pytorch/blob/main/SECURITY.md#untrusted-models for more details). In a future release, the default value for `weights_only` will be flipped to `True`. This limits the functions that could be executed during unpickling. Arbitrary objects will no longer be allowed to be loaded via this mode unless they are explicitly allowlisted by the user via `torch.serialization.add_safe_globals`. We recommend you start setting `weights_only=True` for any use case where you don't have full control of the loaded file. Please open an issue on GitHub for any issues related to this experimental feature.
  self.data, self.slices = torch.load(self.processed_paths[0])
