STDOUT:
Results will be saved in /home/philip/projects/ltspice_examples_code_repo/Circuit-Completion-Using-GNNs/component_classification_with_link_prediction_head/evaluation/FEGIN/results/model_FEGIN_dataset_ltspice_examples
Command line input: python main.py --data ltspice_examples --representation component_component --model FEGIN --layers 2 --hiddens 64 --batch_size 64 --lr 0.0001 --emb_size 128 --epochs 100 --save_appendix component_component_L2_H64_BS64_LR0.0001_E128 --no_val
 is saved.
-----
ltspice_examples - FEGIN
Using 2 layers, 64 hidden units, h = 2
Loading component_component representation dataset
ENTERED
Training FEGIN on component_component representation
Train: 3556, Test: 845
##################ITERATION #0 ****************************************
 epoch: 0, train_loss: 1.3872, test_loss: 1.3789, test_f1: 0.2515
 epoch: 1, train_loss: 1.3651, test_loss: 1.3565, test_f1: 0.2552
 epoch: 2, train_loss: 1.3445, test_loss: 1.3288, test_f1: 0.2530
 epoch: 3, train_loss: 1.3181, test_loss: 1.2956, test_f1: 0.2657
 epoch: 4, train_loss: 1.2895, test_loss: 1.2669, test_f1: 0.2610
 epoch: 5, train_loss: 1.2659, test_loss: 1.2405, test_f1: 0.3144
 epoch: 6, train_loss: 1.2451, test_loss: 1.2198, test_f1: 0.3383
 epoch: 7, train_loss: 1.2289, test_loss: 1.2008, test_f1: 0.3500
 epoch: 8, train_loss: 1.2128, test_loss: 1.1836, test_f1: 0.3471
 epoch: 9, train_loss: 1.2010, test_loss: 1.1665, test_f1: 0.3475
 epoch: 10, train_loss: 1.1872, test_loss: 1.1553, test_f1: 0.3599
 epoch: 11, train_loss: 1.1765, test_loss: 1.1434, test_f1: 0.3583
 epoch: 12, train_loss: 1.1681, test_loss: 1.1333, test_f1: 0.3707
 epoch: 13, train_loss: 1.1555, test_loss: 1.1225, test_f1: 0.3824
 epoch: 14, train_loss: 1.1479, test_loss: 1.1121, test_f1: 0.3947
 epoch: 15, train_loss: 1.1337, test_loss: 1.1036, test_f1: 0.4288
 epoch: 16, train_loss: 1.1286, test_loss: 1.0959, test_f1: 0.4317
 epoch: 17, train_loss: 1.1266, test_loss: 1.0874, test_f1: 0.4370
 epoch: 18, train_loss: 1.1143, test_loss: 1.0790, test_f1: 0.4487
 epoch: 19, train_loss: 1.1040, test_loss: 1.0706, test_f1: 0.4535
 epoch: 20, train_loss: 1.1039, test_loss: 1.0619, test_f1: 0.4511
 epoch: 21, train_loss: 1.0926, test_loss: 1.0575, test_f1: 0.4462
 epoch: 22, train_loss: 1.0811, test_loss: 1.0506, test_f1: 0.4717
 epoch: 23, train_loss: 1.0778, test_loss: 1.0425, test_f1: 0.4743
 epoch: 24, train_loss: 1.0692, test_loss: 1.0356, test_f1: 0.4720
 epoch: 25, train_loss: 1.0678, test_loss: 1.0275, test_f1: 0.4636
 epoch: 26, train_loss: 1.0599, test_loss: 1.0233, test_f1: 0.4917
 epoch: 27, train_loss: 1.0550, test_loss: 1.0164, test_f1: 0.4694
 epoch: 28, train_loss: 1.0492, test_loss: 1.0101, test_f1: 0.4763
 epoch: 29, train_loss: 1.0405, test_loss: 0.9993, test_f1: 0.4788
 epoch: 30, train_loss: 1.0342, test_loss: 0.9953, test_f1: 0.4764
 epoch: 31, train_loss: 1.0338, test_loss: 0.9925, test_f1: 0.4785
 epoch: 32, train_loss: 1.0226, test_loss: 0.9911, test_f1: 0.4931
 epoch: 33, train_loss: 1.0220, test_loss: 0.9783, test_f1: 0.4919
 epoch: 34, train_loss: 1.0110, test_loss: 0.9767, test_f1: 0.4886
 epoch: 35, train_loss: 1.0095, test_loss: 0.9772, test_f1: 0.4847
 epoch: 36, train_loss: 1.0002, test_loss: 0.9656, test_f1: 0.5089
 epoch: 37, train_loss: 0.9928, test_loss: 0.9598, test_f1: 0.5096
 epoch: 38, train_loss: 0.9891, test_loss: 0.9569, test_f1: 0.4950
 epoch: 39, train_loss: 0.9843, test_loss: 0.9610, test_f1: 0.4946
 epoch: 40, train_loss: 0.9843, test_loss: 0.9496, test_f1: 0.4909
 epoch: 41, train_loss: 0.9716, test_loss: 0.9486, test_f1: 0.4938
 epoch: 42, train_loss: 0.9740, test_loss: 0.9504, test_f1: 0.5009
 epoch: 43, train_loss: 0.9670, test_loss: 0.9432, test_f1: 0.5001
 epoch: 44, train_loss: 0.9511, test_loss: 0.9418, test_f1: 0.4880
 epoch: 45, train_loss: 0.9644, test_loss: 0.9406, test_f1: 0.4858
 epoch: 46, train_loss: 0.9451, test_loss: 0.9339, test_f1: 0.4844
 epoch: 47, train_loss: 0.9411, test_loss: 0.9259, test_f1: 0.5090
 epoch: 48, train_loss: 0.9438, test_loss: 0.9353, test_f1: 0.4952
 epoch: 49, train_loss: 0.9398, test_loss: 0.9358, test_f1: 0.5010
 epoch: 50, train_loss: 0.9356, test_loss: 0.9376, test_f1: 0.4961
 epoch: 51, train_loss: 0.9295, test_loss: 0.9294, test_f1: 0.4928
 epoch: 52, train_loss: 0.9286, test_loss: 0.9255, test_f1: 0.4989
 epoch: 53, train_loss: 0.9176, test_loss: 0.9199, test_f1: 0.5002
 epoch: 54, train_loss: 0.9197, test_loss: 0.9276, test_f1: 0.4882
 epoch: 55, train_loss: 0.9193, test_loss: 0.9227, test_f1: 0.4918
 epoch: 56, train_loss: 0.9207, test_loss: 0.9207, test_f1: 0.5120
 epoch: 57, train_loss: 0.9223, test_loss: 0.9277, test_f1: 0.5171
 epoch: 58, train_loss: 0.9111, test_loss: 0.9287, test_f1: 0.5201
 epoch: 59, train_loss: 0.9113, test_loss: 0.9265, test_f1: 0.5132
 epoch: 60, train_loss: 0.9133, test_loss: 0.9272, test_f1: 0.5018
 epoch: 61, train_loss: 0.9086, test_loss: 0.9236, test_f1: 0.5104
 epoch: 62, train_loss: 0.9162, test_loss: 0.9256, test_f1: 0.5209
 epoch: 63, train_loss: 0.9084, test_loss: 0.9311, test_f1: 0.5140
 epoch: 64, train_loss: 0.8992, test_loss: 0.9270, test_f1: 0.5170
 epoch: 65, train_loss: 0.9063, test_loss: 0.9270, test_f1: 0.5145
 epoch: 66, train_loss: 0.8954, test_loss: 0.9218, test_f1: 0.5228
 epoch: 67, train_loss: 0.8971, test_loss: 0.9233, test_f1: 0.5254
 epoch: 68, train_loss: 0.8956, test_loss: 0.9217, test_f1: 0.5166
 epoch: 69, train_loss: 0.8946, test_loss: 0.9291, test_f1: 0.5152
 epoch: 70, train_loss: 0.8990, test_loss: 0.9173, test_f1: 0.5154
 epoch: 71, train_loss: 0.8969, test_loss: 0.9240, test_f1: 0.5182
 epoch: 72, train_loss: 0.8944, test_loss: 0.9197, test_f1: 0.5167
 epoch: 73, train_loss: 0.8960, test_loss: 0.9213, test_f1: 0.5175
 epoch: 74, train_loss: 0.8841, test_loss: 0.9273, test_f1: 0.5146
 epoch: 75, train_loss: 0.8812, test_loss: 0.9248, test_f1: 0.5285
 epoch: 76, train_loss: 0.8886, test_loss: 0.9266, test_f1: 0.5257
 epoch: 77, train_loss: 0.8881, test_loss: 0.9273, test_f1: 0.5232
 epoch: 78, train_loss: 0.8881, test_loss: 0.9263, test_f1: 0.5224
 epoch: 79, train_loss: 0.8825, test_loss: 0.9264, test_f1: 0.5229
 epoch: 80, train_loss: 0.8785, test_loss: 0.9339, test_f1: 0.5164
 epoch: 81, train_loss: 0.8836, test_loss: 0.9282, test_f1: 0.5260
 epoch: 82, train_loss: 0.8811, test_loss: 0.9219, test_f1: 0.5237
 epoch: 83, train_loss: 0.8748, test_loss: 0.9297, test_f1: 0.5240
 epoch: 84, train_loss: 0.8811, test_loss: 0.9223, test_f1: 0.5235
 epoch: 85, train_loss: 0.8762, test_loss: 0.9212, test_f1: 0.5247
 epoch: 86, train_loss: 0.8730, test_loss: 0.9293, test_f1: 0.5219
 epoch: 87, train_loss: 0.8712, test_loss: 0.9262, test_f1: 0.5220
 epoch: 88, train_loss: 0.8734, test_loss: 0.9242, test_f1: 0.5202
 epoch: 89, train_loss: 0.8805, test_loss: 0.9279, test_f1: 0.5257
 epoch: 90, train_loss: 0.8703, test_loss: 0.9300, test_f1: 0.5182
 epoch: 91, train_loss: 0.8716, test_loss: 0.9285, test_f1: 0.5150
 epoch: 92, train_loss: 0.8688, test_loss: 0.9221, test_f1: 0.5281
 epoch: 93, train_loss: 0.8740, test_loss: 0.9344, test_f1: 0.5251
 epoch: 94, train_loss: 0.8685, test_loss: 0.9318, test_f1: 0.5159
 epoch: 95, train_loss: 0.8743, test_loss: 0.9277, test_f1: 0.5199
 epoch: 96, train_loss: 0.8622, test_loss: 0.9230, test_f1: 0.5222
 epoch: 97, train_loss: 0.8629, test_loss: 0.9285, test_f1: 0.5177
 epoch: 98, train_loss: 0.8643, test_loss: 0.9286, test_f1: 0.5230
 epoch: 99, train_loss: 0.8594, test_loss: 0.9232, test_f1: 0.5190
##################ITERATION #1 ****************************************
 epoch: 0, train_loss: 1.3481, test_loss: 1.3093, test_f1: 0.2274
 epoch: 1, train_loss: 1.2906, test_loss: 1.2719, test_f1: 0.2274
 epoch: 2, train_loss: 1.2644, test_loss: 1.2465, test_f1: 0.2274
 epoch: 3, train_loss: 1.2467, test_loss: 1.2277, test_f1: 0.2463
 epoch: 4, train_loss: 1.2305, test_loss: 1.2137, test_f1: 0.2513
 epoch: 5, train_loss: 1.2164, test_loss: 1.1953, test_f1: 0.2913
 epoch: 6, train_loss: 1.2071, test_loss: 1.1734, test_f1: 0.4067
 epoch: 7, train_loss: 1.1909, test_loss: 1.1602, test_f1: 0.4340
 epoch: 8, train_loss: 1.1753, test_loss: 1.1436, test_f1: 0.4237
 epoch: 9, train_loss: 1.1603, test_loss: 1.1217, test_f1: 0.4311
 epoch: 10, train_loss: 1.1450, test_loss: 1.1083, test_f1: 0.4155
 epoch: 11, train_loss: 1.1309, test_loss: 1.0915, test_f1: 0.4209
 epoch: 12, train_loss: 1.1186, test_loss: 1.0815, test_f1: 0.4258
 epoch: 13, train_loss: 1.1020, test_loss: 1.0642, test_f1: 0.4501
 epoch: 14, train_loss: 1.0955, test_loss: 1.0534, test_f1: 0.4521
 epoch: 15, train_loss: 1.0784, test_loss: 1.0384, test_f1: 0.4507
 epoch: 16, train_loss: 1.0693, test_loss: 1.0213, test_f1: 0.4664
 epoch: 17, train_loss: 1.0625, test_loss: 1.0169, test_f1: 0.4761
 epoch: 18, train_loss: 1.0542, test_loss: 1.0071, test_f1: 0.4733
 epoch: 19, train_loss: 1.0449, test_loss: 1.0070, test_f1: 0.4665
 epoch: 20, train_loss: 1.0382, test_loss: 0.9960, test_f1: 0.4899
 epoch: 21, train_loss: 1.0321, test_loss: 0.9894, test_f1: 0.4871
 epoch: 22, train_loss: 1.0328, test_loss: 0.9830, test_f1: 0.4933
 epoch: 23, train_loss: 1.0118, test_loss: 0.9755, test_f1: 0.4780
 epoch: 24, train_loss: 1.0064, test_loss: 0.9677, test_f1: 0.5080
 epoch: 25, train_loss: 1.0101, test_loss: 0.9726, test_f1: 0.4782
 epoch: 26, train_loss: 0.9948, test_loss: 0.9788, test_f1: 0.4964
 epoch: 27, train_loss: 0.9982, test_loss: 0.9648, test_f1: 0.4953
 epoch: 28, train_loss: 0.9791, test_loss: 0.9690, test_f1: 0.4919
 epoch: 29, train_loss: 0.9800, test_loss: 0.9621, test_f1: 0.5040
 epoch: 30, train_loss: 0.9782, test_loss: 0.9571, test_f1: 0.5000
 epoch: 31, train_loss: 0.9686, test_loss: 0.9636, test_f1: 0.4933
 epoch: 32, train_loss: 0.9651, test_loss: 0.9589, test_f1: 0.5068
 epoch: 33, train_loss: 0.9598, test_loss: 0.9594, test_f1: 0.5009
 epoch: 34, train_loss: 0.9597, test_loss: 0.9552, test_f1: 0.4965
 epoch: 35, train_loss: 0.9509, test_loss: 0.9747, test_f1: 0.4961
 epoch: 36, train_loss: 0.9571, test_loss: 0.9605, test_f1: 0.4882
 epoch: 37, train_loss: 0.9513, test_loss: 0.9573, test_f1: 0.5031
 epoch: 38, train_loss: 0.9325, test_loss: 0.9521, test_f1: 0.4999
 epoch: 39, train_loss: 0.9419, test_loss: 0.9487, test_f1: 0.4967
 epoch: 40, train_loss: 0.9347, test_loss: 0.9435, test_f1: 0.5007
 epoch: 41, train_loss: 0.9259, test_loss: 0.9656, test_f1: 0.4954
 epoch: 42, train_loss: 0.9249, test_loss: 0.9473, test_f1: 0.5057
 epoch: 43, train_loss: 0.9288, test_loss: 0.9422, test_f1: 0.5074
 epoch: 44, train_loss: 0.9184, test_loss: 0.9768, test_f1: 0.4980
 epoch: 45, train_loss: 0.9174, test_loss: 0.9721, test_f1: 0.5012
 epoch: 46, train_loss: 0.9180, test_loss: 0.9694, test_f1: 0.4966
 epoch: 47, train_loss: 0.9114, test_loss: 0.9715, test_f1: 0.4937
 epoch: 48, train_loss: 0.9065, test_loss: 0.9666, test_f1: 0.4940
 epoch: 49, train_loss: 0.9087, test_loss: 0.9671, test_f1: 0.5054
 epoch: 50, train_loss: 0.9080, test_loss: 0.9788, test_f1: 0.5042
 epoch: 51, train_loss: 0.9006, test_loss: 0.9647, test_f1: 0.4970
 epoch: 52, train_loss: 0.8974, test_loss: 0.9756, test_f1: 0.4946
 epoch: 53, train_loss: 0.8893, test_loss: 0.9686, test_f1: 0.4970
 epoch: 54, train_loss: 0.8898, test_loss: 0.9660, test_f1: 0.5053
 epoch: 55, train_loss: 0.8905, test_loss: 0.9678, test_f1: 0.5070
 epoch: 56, train_loss: 0.8855, test_loss: 0.9689, test_f1: 0.4983
 epoch: 57, train_loss: 0.8883, test_loss: 0.9681, test_f1: 0.4988
 epoch: 58, train_loss: 0.8869, test_loss: 0.9655, test_f1: 0.5075
 epoch: 59, train_loss: 0.8843, test_loss: 0.9741, test_f1: 0.4987
 epoch: 60, train_loss: 0.8871, test_loss: 0.9768, test_f1: 0.5032
 epoch: 61, train_loss: 0.8847, test_loss: 0.9721, test_f1: 0.5065
 epoch: 62, train_loss: 0.8832, test_loss: 0.9586, test_f1: 0.5024
 epoch: 63, train_loss: 0.8876, test_loss: 0.9759, test_f1: 0.4954
 epoch: 64, train_loss: 0.8799, test_loss: 0.9803, test_f1: 0.5116
 epoch: 65, train_loss: 0.8831, test_loss: 0.9700, test_f1: 0.4860
 epoch: 66, train_loss: 0.8775, test_loss: 0.9789, test_f1: 0.4905
 epoch: 67, train_loss: 0.8697, test_loss: 0.9694, test_f1: 0.4942
 epoch: 68, train_loss: 0.8806, test_loss: 0.9757, test_f1: 0.4960
 epoch: 69, train_loss: 0.8731, test_loss: 0.9718, test_f1: 0.4964
 epoch: 70, train_loss: 0.8737, test_loss: 0.9822, test_f1: 0.4943
 epoch: 71, train_loss: 0.8779, test_loss: 0.9854, test_f1: 0.4923
 epoch: 72, train_loss: 0.8791, test_loss: 0.9732, test_f1: 0.4958
 epoch: 73, train_loss: 0.8738, test_loss: 0.9705, test_f1: 0.5123
 epoch: 74, train_loss: 0.8696, test_loss: 0.9686, test_f1: 0.5143
 epoch: 75, train_loss: 0.8684, test_loss: 0.9752, test_f1: 0.5069
 epoch: 76, train_loss: 0.8691, test_loss: 0.9840, test_f1: 0.5111
 epoch: 77, train_loss: 0.8688, test_loss: 0.9760, test_f1: 0.5094
 epoch: 78, train_loss: 0.8694, test_loss: 0.9784, test_f1: 0.5044
 epoch: 79, train_loss: 0.8636, test_loss: 0.9898, test_f1: 0.4793
 epoch: 80, train_loss: 0.8724, test_loss: 0.9945, test_f1: 0.4973
 epoch: 81, train_loss: 0.8689, test_loss: 0.9782, test_f1: 0.5111
 epoch: 82, train_loss: 0.8628, test_loss: 0.9984, test_f1: 0.4903
 epoch: 83, train_loss: 0.8565, test_loss: 0.9889, test_f1: 0.4804
 epoch: 84, train_loss: 0.8636, test_loss: 0.9885, test_f1: 0.4931
 epoch: 85, train_loss: 0.8592, test_loss: 1.0081, test_f1: 0.5070
 epoch: 86, train_loss: 0.8580, test_loss: 0.9898, test_f1: 0.5137
 epoch: 87, train_loss: 0.8502, test_loss: 0.9952, test_f1: 0.5091
 epoch: 88, train_loss: 0.8585, test_loss: 0.9889, test_f1: 0.4842
 epoch: 89, train_loss: 0.8637, test_loss: 0.9822, test_f1: 0.5090
 epoch: 90, train_loss: 0.8507, test_loss: 0.9933, test_f1: 0.4730
 epoch: 91, train_loss: 0.8464, test_loss: 0.9840, test_f1: 0.5135
 epoch: 92, train_loss: 0.8462, test_loss: 0.9916, test_f1: 0.4973
 epoch: 93, train_loss: 0.8493, test_loss: 0.9982, test_f1: 0.5161
 epoch: 94, train_loss: 0.8548, test_loss: 0.9944, test_f1: 0.5118
 epoch: 95, train_loss: 0.8381, test_loss: 0.9959, test_f1: 0.4969
 epoch: 96, train_loss: 0.8479, test_loss: 0.9998, test_f1: 0.4952
 epoch: 97, train_loss: 0.8443, test_loss: 0.9898, test_f1: 0.4943
 epoch: 98, train_loss: 0.8475, test_loss: 0.9973, test_f1: 0.4797
 epoch: 99, train_loss: 0.8438, test_loss: 1.0014, test_f1: 0.4836
##################ITERATION #2 ****************************************
 epoch: 0, train_loss: 1.3701, test_loss: 1.3136, test_f1: 0.3288
 epoch: 1, train_loss: 1.2876, test_loss: 1.2492, test_f1: 0.3616
 epoch: 2, train_loss: 1.2626, test_loss: 1.2188, test_f1: 0.3756
 epoch: 3, train_loss: 1.2385, test_loss: 1.1971, test_f1: 0.3970
 epoch: 4, train_loss: 1.2230, test_loss: 1.1819, test_f1: 0.4177
 epoch: 5, train_loss: 1.2071, test_loss: 1.1661, test_f1: 0.4227
 epoch: 6, train_loss: 1.2010, test_loss: 1.1523, test_f1: 0.4255
 epoch: 7, train_loss: 1.1880, test_loss: 1.1375, test_f1: 0.4308
 epoch: 8, train_loss: 1.1758, test_loss: 1.1270, test_f1: 0.4293
 epoch: 9, train_loss: 1.1614, test_loss: 1.1167, test_f1: 0.4411
 epoch: 10, train_loss: 1.1462, test_loss: 1.1043, test_f1: 0.4448
 epoch: 11, train_loss: 1.1414, test_loss: 1.0918, test_f1: 0.4482
 epoch: 12, train_loss: 1.1331, test_loss: 1.0852, test_f1: 0.4510
 epoch: 13, train_loss: 1.1220, test_loss: 1.0711, test_f1: 0.4543
 epoch: 14, train_loss: 1.1145, test_loss: 1.0700, test_f1: 0.4442
 epoch: 15, train_loss: 1.1039, test_loss: 1.0550, test_f1: 0.4531
 epoch: 16, train_loss: 1.0984, test_loss: 1.0465, test_f1: 0.4516
 epoch: 17, train_loss: 1.0841, test_loss: 1.0414, test_f1: 0.4473
 epoch: 18, train_loss: 1.0770, test_loss: 1.0324, test_f1: 0.4705
 epoch: 19, train_loss: 1.0742, test_loss: 1.0233, test_f1: 0.4529
 epoch: 20, train_loss: 1.0625, test_loss: 1.0210, test_f1: 0.4651
 epoch: 21, train_loss: 1.0539, test_loss: 1.0106, test_f1: 0.4734
 epoch: 22, train_loss: 1.0512, test_loss: 1.0045, test_f1: 0.4509
 epoch: 23, train_loss: 1.0495, test_loss: 1.0017, test_f1: 0.4784
 epoch: 24, train_loss: 1.0451, test_loss: 0.9960, test_f1: 0.4905
 epoch: 25, train_loss: 1.0293, test_loss: 0.9920, test_f1: 0.4770
 epoch: 26, train_loss: 1.0264, test_loss: 0.9939, test_f1: 0.4724
 epoch: 27, train_loss: 1.0187, test_loss: 0.9878, test_f1: 0.4619
 epoch: 28, train_loss: 1.0154, test_loss: 0.9814, test_f1: 0.4834
 epoch: 29, train_loss: 1.0091, test_loss: 0.9786, test_f1: 0.4922
 epoch: 30, train_loss: 1.0055, test_loss: 0.9760, test_f1: 0.4849
 epoch: 31, train_loss: 1.0031, test_loss: 0.9717, test_f1: 0.4803
 epoch: 32, train_loss: 0.9944, test_loss: 0.9748, test_f1: 0.4894
 epoch: 33, train_loss: 0.9948, test_loss: 0.9637, test_f1: 0.4920
 epoch: 34, train_loss: 0.9781, test_loss: 0.9732, test_f1: 0.4938
 epoch: 35, train_loss: 0.9819, test_loss: 0.9656, test_f1: 0.4936
 epoch: 36, train_loss: 0.9804, test_loss: 0.9615, test_f1: 0.4697
 epoch: 37, train_loss: 0.9757, test_loss: 0.9759, test_f1: 0.4565
 epoch: 38, train_loss: 0.9685, test_loss: 0.9498, test_f1: 0.4857
 epoch: 39, train_loss: 0.9664, test_loss: 0.9583, test_f1: 0.4824
 epoch: 40, train_loss: 0.9598, test_loss: 0.9619, test_f1: 0.4992
 epoch: 41, train_loss: 0.9583, test_loss: 0.9500, test_f1: 0.5020
 epoch: 42, train_loss: 0.9536, test_loss: 0.9560, test_f1: 0.5042
 epoch: 43, train_loss: 0.9517, test_loss: 0.9598, test_f1: 0.5047
 epoch: 44, train_loss: 0.9409, test_loss: 0.9465, test_f1: 0.5115
 epoch: 45, train_loss: 0.9404, test_loss: 0.9534, test_f1: 0.4993
 epoch: 46, train_loss: 0.9351, test_loss: 0.9531, test_f1: 0.4970
 epoch: 47, train_loss: 0.9399, test_loss: 0.9462, test_f1: 0.5044
 epoch: 48, train_loss: 0.9304, test_loss: 0.9575, test_f1: 0.5007
 epoch: 49, train_loss: 0.9258, test_loss: 0.9501, test_f1: 0.5062
 epoch: 50, train_loss: 0.9241, test_loss: 0.9600, test_f1: 0.5080
 epoch: 51, train_loss: 0.9197, test_loss: 0.9593, test_f1: 0.5038
 epoch: 52, train_loss: 0.9157, test_loss: 0.9520, test_f1: 0.5122
 epoch: 53, train_loss: 0.9130, test_loss: 0.9548, test_f1: 0.5095
 epoch: 54, train_loss: 0.9133, test_loss: 0.9427, test_f1: 0.5062
 epoch: 55, train_loss: 0.9101, test_loss: 0.9460, test_f1: 0.5101
 epoch: 56, train_loss: 0.9058, test_loss: 0.9449, test_f1: 0.5115
 epoch: 57, train_loss: 0.9075, test_loss: 0.9549, test_f1: 0.5119
 epoch: 58, train_loss: 0.9058, test_loss: 0.9498, test_f1: 0.4986
 epoch: 59, train_loss: 0.9083, test_loss: 0.9539, test_f1: 0.5038
 epoch: 60, train_loss: 0.9036, test_loss: 0.9481, test_f1: 0.5066
 epoch: 61, train_loss: 0.9045, test_loss: 0.9521, test_f1: 0.5022
 epoch: 62, train_loss: 0.9067, test_loss: 0.9633, test_f1: 0.4986
 epoch: 63, train_loss: 0.8889, test_loss: 0.9508, test_f1: 0.5077
 epoch: 64, train_loss: 0.9005, test_loss: 0.9510, test_f1: 0.5151
 epoch: 65, train_loss: 0.8917, test_loss: 0.9568, test_f1: 0.5071
 epoch: 66, train_loss: 0.8959, test_loss: 0.9480, test_f1: 0.5020
 epoch: 67, train_loss: 0.8895, test_loss: 0.9575, test_f1: 0.5071
 epoch: 68, train_loss: 0.8924, test_loss: 0.9447, test_f1: 0.5009
 epoch: 69, train_loss: 0.8855, test_loss: 0.9726, test_f1: 0.4810
 epoch: 70, train_loss: 0.8905, test_loss: 0.9588, test_f1: 0.5127
 epoch: 71, train_loss: 0.8826, test_loss: 0.9456, test_f1: 0.5152
 epoch: 72, train_loss: 0.8876, test_loss: 0.9598, test_f1: 0.5130
 epoch: 73, train_loss: 0.8826, test_loss: 0.9625, test_f1: 0.5141
 epoch: 74, train_loss: 0.8770, test_loss: 0.9709, test_f1: 0.5086
 epoch: 75, train_loss: 0.8796, test_loss: 0.9493, test_f1: 0.5164
 epoch: 76, train_loss: 0.8741, test_loss: 0.9607, test_f1: 0.5088
 epoch: 77, train_loss: 0.8802, test_loss: 0.9573, test_f1: 0.5063
 epoch: 78, train_loss: 0.8739, test_loss: 0.9565, test_f1: 0.5120
 epoch: 79, train_loss: 0.8846, test_loss: 0.9663, test_f1: 0.5051
 epoch: 80, train_loss: 0.8690, test_loss: 0.9595, test_f1: 0.5073
 epoch: 81, train_loss: 0.8739, test_loss: 0.9559, test_f1: 0.5031
 epoch: 82, train_loss: 0.8683, test_loss: 0.9570, test_f1: 0.5044
 epoch: 83, train_loss: 0.8551, test_loss: 0.9635, test_f1: 0.5041
 epoch: 84, train_loss: 0.8789, test_loss: 0.9549, test_f1: 0.5087
 epoch: 85, train_loss: 0.8767, test_loss: 0.9566, test_f1: 0.5062
 epoch: 86, train_loss: 0.8640, test_loss: 0.9641, test_f1: 0.5208
 epoch: 87, train_loss: 0.8600, test_loss: 0.9545, test_f1: 0.5093
 epoch: 88, train_loss: 0.8634, test_loss: 0.9637, test_f1: 0.5198
 epoch: 89, train_loss: 0.8572, test_loss: 0.9477, test_f1: 0.5093
 epoch: 90, train_loss: 0.8588, test_loss: 0.9558, test_f1: 0.5183
 epoch: 91, train_loss: 0.8605, test_loss: 0.9611, test_f1: 0.5208
 epoch: 92, train_loss: 0.8591, test_loss: 0.9694, test_f1: 0.5216
 epoch: 93, train_loss: 0.8612, test_loss: 0.9541, test_f1: 0.5148
 epoch: 94, train_loss: 0.8613, test_loss: 0.9609, test_f1: 0.5232
 epoch: 95, train_loss: 0.8515, test_loss: 0.9824, test_f1: 0.5083
 epoch: 96, train_loss: 0.8513, test_loss: 0.9577, test_f1: 0.5148
 epoch: 97, train_loss: 0.8403, test_loss: 0.9700, test_f1: 0.5236
 epoch: 98, train_loss: 0.8557, test_loss: 0.9556, test_f1: 0.5226
 epoch: 99, train_loss: 0.8409, test_loss: 0.9643, test_f1: 0.5176
##################ITERATION #3 ****************************************
 epoch: 0, train_loss: 1.3064, test_loss: 1.2507, test_f1: 0.2670
 epoch: 1, train_loss: 1.2477, test_loss: 1.2037, test_f1: 0.3418
 epoch: 2, train_loss: 1.2255, test_loss: 1.1805, test_f1: 0.3961
 epoch: 3, train_loss: 1.2007, test_loss: 1.1610, test_f1: 0.4060
 epoch: 4, train_loss: 1.1902, test_loss: 1.1425, test_f1: 0.4226
 epoch: 5, train_loss: 1.1767, test_loss: 1.1271, test_f1: 0.4364
 epoch: 6, train_loss: 1.1633, test_loss: 1.1133, test_f1: 0.4282
 epoch: 7, train_loss: 1.1524, test_loss: 1.1013, test_f1: 0.4443
 epoch: 8, train_loss: 1.1438, test_loss: 1.0883, test_f1: 0.4185
 epoch: 9, train_loss: 1.1226, test_loss: 1.0803, test_f1: 0.4226
 epoch: 10, train_loss: 1.1243, test_loss: 1.0736, test_f1: 0.4414
 epoch: 11, train_loss: 1.1115, test_loss: 1.0676, test_f1: 0.4534
 epoch: 12, train_loss: 1.0956, test_loss: 1.0530, test_f1: 0.4540
 epoch: 13, train_loss: 1.0953, test_loss: 1.0497, test_f1: 0.4535
 epoch: 14, train_loss: 1.0843, test_loss: 1.0388, test_f1: 0.4612
 epoch: 15, train_loss: 1.0774, test_loss: 1.0321, test_f1: 0.4643
 epoch: 16, train_loss: 1.0649, test_loss: 1.0275, test_f1: 0.4676
 epoch: 17, train_loss: 1.0612, test_loss: 1.0137, test_f1: 0.4612
 epoch: 18, train_loss: 1.0568, test_loss: 1.0053, test_f1: 0.4683
 epoch: 19, train_loss: 1.0458, test_loss: 1.0047, test_f1: 0.4743
 epoch: 20, train_loss: 1.0410, test_loss: 1.0048, test_f1: 0.4707
 epoch: 21, train_loss: 1.0306, test_loss: 0.9915, test_f1: 0.4788
 epoch: 22, train_loss: 1.0266, test_loss: 0.9852, test_f1: 0.4775
 epoch: 23, train_loss: 1.0213, test_loss: 0.9865, test_f1: 0.4742
 epoch: 24, train_loss: 1.0149, test_loss: 0.9916, test_f1: 0.4582
 epoch: 25, train_loss: 1.0064, test_loss: 0.9901, test_f1: 0.4630
 epoch: 26, train_loss: 1.0004, test_loss: 0.9913, test_f1: 0.4735
 epoch: 27, train_loss: 0.9943, test_loss: 0.9869, test_f1: 0.4790
 epoch: 28, train_loss: 0.9948, test_loss: 0.9959, test_f1: 0.4784
 epoch: 29, train_loss: 0.9914, test_loss: 0.9836, test_f1: 0.4874
 epoch: 30, train_loss: 0.9850, test_loss: 0.9920, test_f1: 0.4735
 epoch: 31, train_loss: 0.9832, test_loss: 0.9794, test_f1: 0.4754
 epoch: 32, train_loss: 0.9734, test_loss: 0.9745, test_f1: 0.4767
 epoch: 33, train_loss: 0.9771, test_loss: 0.9878, test_f1: 0.4709
 epoch: 34, train_loss: 0.9602, test_loss: 0.9830, test_f1: 0.4859
 epoch: 35, train_loss: 0.9707, test_loss: 0.9901, test_f1: 0.4580
 epoch: 36, train_loss: 0.9578, test_loss: 0.9730, test_f1: 0.4844
 epoch: 37, train_loss: 0.9622, test_loss: 0.9803, test_f1: 0.4850
 epoch: 38, train_loss: 0.9509, test_loss: 0.9728, test_f1: 0.4849
 epoch: 39, train_loss: 0.9444, test_loss: 0.9832, test_f1: 0.4803
 epoch: 40, train_loss: 0.9546, test_loss: 0.9828, test_f1: 0.4896
 epoch: 41, train_loss: 0.9397, test_loss: 0.9795, test_f1: 0.4890
 epoch: 42, train_loss: 0.9419, test_loss: 0.9758, test_f1: 0.4813
 epoch: 43, train_loss: 0.9383, test_loss: 0.9734, test_f1: 0.4961
 epoch: 44, train_loss: 0.9263, test_loss: 0.9858, test_f1: 0.4781
 epoch: 45, train_loss: 0.9286, test_loss: 0.9709, test_f1: 0.4899
 epoch: 46, train_loss: 0.9200, test_loss: 0.9794, test_f1: 0.4981
 epoch: 47, train_loss: 0.9134, test_loss: 0.9669, test_f1: 0.4915
 epoch: 48, train_loss: 0.9102, test_loss: 0.9560, test_f1: 0.5043
 epoch: 49, train_loss: 0.9067, test_loss: 0.9766, test_f1: 0.5004
 epoch: 50, train_loss: 0.9056, test_loss: 0.9707, test_f1: 0.4930
 epoch: 51, train_loss: 0.9070, test_loss: 0.9741, test_f1: 0.5009
 epoch: 52, train_loss: 0.9028, test_loss: 0.9729, test_f1: 0.5020
 epoch: 53, train_loss: 0.9021, test_loss: 0.9660, test_f1: 0.5025
 epoch: 54, train_loss: 0.9073, test_loss: 0.9659, test_f1: 0.4996
 epoch: 55, train_loss: 0.8998, test_loss: 0.9714, test_f1: 0.4935
 epoch: 56, train_loss: 0.8915, test_loss: 0.9676, test_f1: 0.4921
 epoch: 57, train_loss: 0.8932, test_loss: 0.9698, test_f1: 0.5011
 epoch: 58, train_loss: 0.8989, test_loss: 0.9785, test_f1: 0.4990
 epoch: 59, train_loss: 0.8956, test_loss: 0.9660, test_f1: 0.4997
 epoch: 60, train_loss: 0.8868, test_loss: 0.9783, test_f1: 0.4953
 epoch: 61, train_loss: 0.8867, test_loss: 0.9766, test_f1: 0.4931
 epoch: 62, train_loss: 0.8867, test_loss: 0.9728, test_f1: 0.4982
 epoch: 63, train_loss: 0.8796, test_loss: 0.9752, test_f1: 0.4878
 epoch: 64, train_loss: 0.8873, test_loss: 0.9828, test_f1: 0.4909
 epoch: 65, train_loss: 0.8824, test_loss: 0.9805, test_f1: 0.4951
 epoch: 66, train_loss: 0.8823, test_loss: 0.9968, test_f1: 0.4951
 epoch: 67, train_loss: 0.8795, test_loss: 0.9779, test_f1: 0.4838
 epoch: 68, train_loss: 0.8843, test_loss: 0.9811, test_f1: 0.4915
 epoch: 69, train_loss: 0.8804, test_loss: 0.9830, test_f1: 0.4861
 epoch: 70, train_loss: 0.8676, test_loss: 0.9705, test_f1: 0.4883
 epoch: 71, train_loss: 0.8769, test_loss: 0.9801, test_f1: 0.4855
 epoch: 72, train_loss: 0.8663, test_loss: 0.9701, test_f1: 0.4869
 epoch: 73, train_loss: 0.8679, test_loss: 0.9832, test_f1: 0.4923
 epoch: 74, train_loss: 0.8715, test_loss: 0.9946, test_f1: 0.4928
 epoch: 75, train_loss: 0.8791, test_loss: 0.9961, test_f1: 0.4810
 epoch: 76, train_loss: 0.8666, test_loss: 0.9891, test_f1: 0.4798
 epoch: 77, train_loss: 0.8663, test_loss: 0.9954, test_f1: 0.4829
 epoch: 78, train_loss: 0.8654, test_loss: 1.0053, test_f1: 0.4856
 epoch: 79, train_loss: 0.8665, test_loss: 1.0039, test_f1: 0.4877
 epoch: 80, train_loss: 0.8691, test_loss: 1.0130, test_f1: 0.4850
 epoch: 81, train_loss: 0.8581, test_loss: 1.0091, test_f1: 0.4890
 epoch: 82, train_loss: 0.8653, test_loss: 1.0185, test_f1: 0.4731
 epoch: 83, train_loss: 0.8549, test_loss: 0.9961, test_f1: 0.4911
 epoch: 84, train_loss: 0.8484, test_loss: 0.9958, test_f1: 0.4811
 epoch: 85, train_loss: 0.8505, test_loss: 1.0006, test_f1: 0.4899
 epoch: 86, train_loss: 0.8508, test_loss: 0.9963, test_f1: 0.4807
 epoch: 87, train_loss: 0.8506, test_loss: 1.0145, test_f1: 0.4844
 epoch: 88, train_loss: 0.8475, test_loss: 1.0095, test_f1: 0.4824
 epoch: 89, train_loss: 0.8450, test_loss: 1.0034, test_f1: 0.4883
 epoch: 90, train_loss: 0.8494, test_loss: 1.0112, test_f1: 0.4883
 epoch: 91, train_loss: 0.8344, test_loss: 1.0140, test_f1: 0.4913
 epoch: 92, train_loss: 0.8478, test_loss: 1.0089, test_f1: 0.4891
 epoch: 93, train_loss: 0.8394, test_loss: 1.0121, test_f1: 0.4845
 epoch: 94, train_loss: 0.8309, test_loss: 1.0125, test_f1: 0.4912
 epoch: 95, train_loss: 0.8388, test_loss: 1.0058, test_f1: 0.4793
 epoch: 96, train_loss: 0.8321, test_loss: 1.0232, test_f1: 0.4801
 epoch: 97, train_loss: 0.8421, test_loss: 0.9912, test_f1: 0.4914
 epoch: 98, train_loss: 0.8359, test_loss: 1.0280, test_f1: 0.4815
 epoch: 99, train_loss: 0.8391, test_loss: 1.0220, test_f1: 0.4883
##################ITERATION #4 ****************************************
 epoch: 0, train_loss: 1.3425, test_loss: 1.2555, test_f1: 0.2397
 epoch: 1, train_loss: 1.2550, test_loss: 1.2063, test_f1: 0.3274
 epoch: 2, train_loss: 1.2445, test_loss: 1.1858, test_f1: 0.3774
 epoch: 3, train_loss: 1.2240, test_loss: 1.1662, test_f1: 0.3790
 epoch: 4, train_loss: 1.2036, test_loss: 1.1552, test_f1: 0.3812
 epoch: 5, train_loss: 1.1928, test_loss: 1.1450, test_f1: 0.3966
 epoch: 6, train_loss: 1.1793, test_loss: 1.1276, test_f1: 0.4088
 epoch: 7, train_loss: 1.1654, test_loss: 1.1187, test_f1: 0.4095
 epoch: 8, train_loss: 1.1591, test_loss: 1.1111, test_f1: 0.4392
 epoch: 9, train_loss: 1.1565, test_loss: 1.0999, test_f1: 0.4184
 epoch: 10, train_loss: 1.1470, test_loss: 1.0881, test_f1: 0.4283
 epoch: 11, train_loss: 1.1342, test_loss: 1.0801, test_f1: 0.4459
 epoch: 12, train_loss: 1.1233, test_loss: 1.0714, test_f1: 0.4410
 epoch: 13, train_loss: 1.1183, test_loss: 1.0639, test_f1: 0.4289
 epoch: 14, train_loss: 1.1070, test_loss: 1.0612, test_f1: 0.4534
 epoch: 15, train_loss: 1.0955, test_loss: 1.0604, test_f1: 0.4395
 epoch: 16, train_loss: 1.0862, test_loss: 1.0442, test_f1: 0.4528
 epoch: 17, train_loss: 1.0862, test_loss: 1.0392, test_f1: 0.4677
 epoch: 18, train_loss: 1.0703, test_loss: 1.0264, test_f1: 0.4518
 epoch: 19, train_loss: 1.0690, test_loss: 1.0265, test_f1: 0.4508
 epoch: 20, train_loss: 1.0627, test_loss: 1.0264, test_f1: 0.4501
 epoch: 21, train_loss: 1.0521, test_loss: 1.0234, test_f1: 0.4573
 epoch: 22, train_loss: 1.0576, test_loss: 1.0110, test_f1: 0.4627
 epoch: 23, train_loss: 1.0417, test_loss: 1.0016, test_f1: 0.4665
 epoch: 24, train_loss: 1.0369, test_loss: 0.9947, test_f1: 0.4699
 epoch: 25, train_loss: 1.0400, test_loss: 0.9894, test_f1: 0.4731
 epoch: 26, train_loss: 1.0302, test_loss: 0.9844, test_f1: 0.4661
 epoch: 27, train_loss: 1.0175, test_loss: 0.9755, test_f1: 0.4765
 epoch: 28, train_loss: 1.0241, test_loss: 0.9732, test_f1: 0.4762
 epoch: 29, train_loss: 1.0137, test_loss: 0.9784, test_f1: 0.4652
 epoch: 30, train_loss: 1.0102, test_loss: 0.9729, test_f1: 0.4845
 epoch: 31, train_loss: 0.9920, test_loss: 0.9652, test_f1: 0.4726
 epoch: 32, train_loss: 0.9863, test_loss: 0.9661, test_f1: 0.4729
 epoch: 33, train_loss: 0.9862, test_loss: 0.9556, test_f1: 0.4725
 epoch: 34, train_loss: 0.9846, test_loss: 0.9586, test_f1: 0.4828
 epoch: 35, train_loss: 0.9742, test_loss: 0.9560, test_f1: 0.4780
 epoch: 36, train_loss: 0.9716, test_loss: 0.9446, test_f1: 0.4846
 epoch: 37, train_loss: 0.9782, test_loss: 0.9465, test_f1: 0.4681
 epoch: 38, train_loss: 0.9696, test_loss: 0.9437, test_f1: 0.4884
 epoch: 39, train_loss: 0.9589, test_loss: 0.9295, test_f1: 0.4751
 epoch: 40, train_loss: 0.9580, test_loss: 0.9387, test_f1: 0.4804
 epoch: 41, train_loss: 0.9564, test_loss: 0.9362, test_f1: 0.4729
 epoch: 42, train_loss: 0.9471, test_loss: 0.9309, test_f1: 0.4936
 epoch: 43, train_loss: 0.9561, test_loss: 0.9350, test_f1: 0.4786
 epoch: 44, train_loss: 0.9453, test_loss: 0.9210, test_f1: 0.4775
 epoch: 45, train_loss: 0.9417, test_loss: 0.9273, test_f1: 0.4883
 epoch: 46, train_loss: 0.9388, test_loss: 0.9263, test_f1: 0.4820
 epoch: 47, train_loss: 0.9341, test_loss: 0.9249, test_f1: 0.5022
 epoch: 48, train_loss: 0.9263, test_loss: 0.9157, test_f1: 0.5056
 epoch: 49, train_loss: 0.9138, test_loss: 0.9136, test_f1: 0.5091
 epoch: 50, train_loss: 0.9303, test_loss: 0.9232, test_f1: 0.4878
 epoch: 51, train_loss: 0.9146, test_loss: 0.9204, test_f1: 0.4873
 epoch: 52, train_loss: 0.9227, test_loss: 0.9270, test_f1: 0.4833
 epoch: 53, train_loss: 0.9166, test_loss: 0.9176, test_f1: 0.5145
 epoch: 54, train_loss: 0.9227, test_loss: 0.9162, test_f1: 0.5082
 epoch: 55, train_loss: 0.9011, test_loss: 0.9198, test_f1: 0.4925
 epoch: 56, train_loss: 0.9075, test_loss: 0.9214, test_f1: 0.5058
 epoch: 57, train_loss: 0.9053, test_loss: 0.9191, test_f1: 0.5051
 epoch: 58, train_loss: 0.9138, test_loss: 0.9207, test_f1: 0.4997
 epoch: 59, train_loss: 0.8984, test_loss: 0.9179, test_f1: 0.5079
 epoch: 60, train_loss: 0.9044, test_loss: 0.9190, test_f1: 0.4983
 epoch: 61, train_loss: 0.8982, test_loss: 0.9164, test_f1: 0.4981
 epoch: 62, train_loss: 0.9057, test_loss: 0.9164, test_f1: 0.4804
 epoch: 63, train_loss: 0.9026, test_loss: 0.9295, test_f1: 0.4906
 epoch: 64, train_loss: 0.8975, test_loss: 0.9206, test_f1: 0.4796
 epoch: 65, train_loss: 0.9012, test_loss: 0.9258, test_f1: 0.5142
 epoch: 66, train_loss: 0.8889, test_loss: 0.9331, test_f1: 0.4747
 epoch: 67, train_loss: 0.8971, test_loss: 0.9199, test_f1: 0.4885
 epoch: 68, train_loss: 0.8870, test_loss: 0.9209, test_f1: 0.4977
 epoch: 69, train_loss: 0.8946, test_loss: 0.9265, test_f1: 0.5086
 epoch: 70, train_loss: 0.8820, test_loss: 0.9134, test_f1: 0.5153
 epoch: 71, train_loss: 0.8913, test_loss: 0.9249, test_f1: 0.4942
 epoch: 72, train_loss: 0.8818, test_loss: 0.9285, test_f1: 0.5036
 epoch: 73, train_loss: 0.8815, test_loss: 0.9200, test_f1: 0.4808
 epoch: 74, train_loss: 0.8818, test_loss: 0.9315, test_f1: 0.4778
 epoch: 75, train_loss: 0.8817, test_loss: 0.9209, test_f1: 0.5100
 epoch: 76, train_loss: 0.8768, test_loss: 0.9161, test_f1: 0.5037
 epoch: 77, train_loss: 0.8815, test_loss: 0.9164, test_f1: 0.5097
 epoch: 78, train_loss: 0.8823, test_loss: 0.9212, test_f1: 0.5155
 epoch: 79, train_loss: 0.8740, test_loss: 0.9252, test_f1: 0.4798
 epoch: 80, train_loss: 0.8752, test_loss: 0.9290, test_f1: 0.4861
 epoch: 81, train_loss: 0.8706, test_loss: 0.9215, test_f1: 0.4984
 epoch: 82, train_loss: 0.8790, test_loss: 0.9208, test_f1: 0.4912
 epoch: 83, train_loss: 0.8656, test_loss: 0.9337, test_f1: 0.4842
 epoch: 84, train_loss: 0.8582, test_loss: 0.9257, test_f1: 0.4899
 epoch: 85, train_loss: 0.8577, test_loss: 0.9461, test_f1: 0.4801
 epoch: 86, train_loss: 0.8638, test_loss: 0.9254, test_f1: 0.4905
 epoch: 87, train_loss: 0.8602, test_loss: 0.9224, test_f1: 0.4945
 epoch: 88, train_loss: 0.8577, test_loss: 0.9320, test_f1: 0.4881
 epoch: 89, train_loss: 0.8677, test_loss: 0.9340, test_f1: 0.4796
 epoch: 90, train_loss: 0.8668, test_loss: 0.9414, test_f1: 0.4899
 epoch: 91, train_loss: 0.8556, test_loss: 0.9429, test_f1: 0.4887
 epoch: 92, train_loss: 0.8580, test_loss: 0.9454, test_f1: 0.4886
 epoch: 93, train_loss: 0.8548, test_loss: 0.9351, test_f1: 0.4846
 epoch: 94, train_loss: 0.8508, test_loss: 0.9316, test_f1: 0.4808
 epoch: 95, train_loss: 0.8452, test_loss: 0.9563, test_f1: 0.4898
 epoch: 96, train_loss: 0.8510, test_loss: 0.9418, test_f1: 0.4834
 epoch: 97, train_loss: 0.8541, test_loss: 0.9337, test_f1: 0.4912
 epoch: 98, train_loss: 0.8507, test_loss: 0.9398, test_f1: 0.4856
 epoch: 99, train_loss: 0.8465, test_loss: 0.9432, test_f1: 0.4861
##################ITERATION #5 ****************************************
 epoch: 0, train_loss: 1.3602, test_loss: 1.2630, test_f1: 0.3059
 epoch: 1, train_loss: 1.2663, test_loss: 1.2184, test_f1: 0.3727
 epoch: 2, train_loss: 1.2403, test_loss: 1.1893, test_f1: 0.3780
 epoch: 3, train_loss: 1.2184, test_loss: 1.1676, test_f1: 0.3886
 epoch: 4, train_loss: 1.2067, test_loss: 1.1425, test_f1: 0.3978
 epoch: 5, train_loss: 1.1913, test_loss: 1.1268, test_f1: 0.4272
 epoch: 6, train_loss: 1.1648, test_loss: 1.1118, test_f1: 0.4426
 epoch: 7, train_loss: 1.1528, test_loss: 1.0929, test_f1: 0.4587
 epoch: 8, train_loss: 1.1399, test_loss: 1.0806, test_f1: 0.4530
 epoch: 9, train_loss: 1.1355, test_loss: 1.0700, test_f1: 0.4695
 epoch: 10, train_loss: 1.1155, test_loss: 1.0566, test_f1: 0.4643
 epoch: 11, train_loss: 1.1095, test_loss: 1.0495, test_f1: 0.4642
 epoch: 12, train_loss: 1.1003, test_loss: 1.0391, test_f1: 0.4576
 epoch: 13, train_loss: 1.0801, test_loss: 1.0292, test_f1: 0.4645
 epoch: 14, train_loss: 1.0834, test_loss: 1.0251, test_f1: 0.4656
 epoch: 15, train_loss: 1.0740, test_loss: 1.0223, test_f1: 0.4563
 epoch: 16, train_loss: 1.0620, test_loss: 1.0173, test_f1: 0.4599
 epoch: 17, train_loss: 1.0553, test_loss: 1.0164, test_f1: 0.4580
 epoch: 18, train_loss: 1.0482, test_loss: 1.0059, test_f1: 0.4636
 epoch: 19, train_loss: 1.0440, test_loss: 0.9984, test_f1: 0.4670
 epoch: 20, train_loss: 1.0229, test_loss: 1.0021, test_f1: 0.4618
 epoch: 21, train_loss: 1.0245, test_loss: 0.9943, test_f1: 0.4731
 epoch: 22, train_loss: 1.0207, test_loss: 0.9895, test_f1: 0.4649
 epoch: 23, train_loss: 1.0167, test_loss: 0.9877, test_f1: 0.4633
 epoch: 24, train_loss: 1.0127, test_loss: 0.9901, test_f1: 0.4614
 epoch: 25, train_loss: 0.9991, test_loss: 0.9732, test_f1: 0.4708
 epoch: 26, train_loss: 0.9937, test_loss: 0.9780, test_f1: 0.4685
 epoch: 27, train_loss: 0.9855, test_loss: 0.9759, test_f1: 0.4737
 epoch: 28, train_loss: 0.9891, test_loss: 0.9568, test_f1: 0.4764
 epoch: 29, train_loss: 0.9867, test_loss: 0.9657, test_f1: 0.4813
 epoch: 30, train_loss: 0.9829, test_loss: 0.9727, test_f1: 0.4740
 epoch: 31, train_loss: 0.9755, test_loss: 0.9596, test_f1: 0.4812
 epoch: 32, train_loss: 0.9778, test_loss: 0.9643, test_f1: 0.4810
 epoch: 33, train_loss: 0.9717, test_loss: 0.9769, test_f1: 0.4750
 epoch: 34, train_loss: 0.9556, test_loss: 0.9389, test_f1: 0.4913
 epoch: 35, train_loss: 0.9585, test_loss: 0.9663, test_f1: 0.4879
 epoch: 36, train_loss: 0.9663, test_loss: 0.9463, test_f1: 0.4868
 epoch: 37, train_loss: 0.9516, test_loss: 0.9491, test_f1: 0.4783
 epoch: 38, train_loss: 0.9556, test_loss: 0.9511, test_f1: 0.4875
 epoch: 39, train_loss: 0.9411, test_loss: 0.9497, test_f1: 0.4878
 epoch: 40, train_loss: 0.9426, test_loss: 0.9543, test_f1: 0.4858
 epoch: 41, train_loss: 0.9372, test_loss: 0.9551, test_f1: 0.4943
 epoch: 42, train_loss: 0.9405, test_loss: 0.9461, test_f1: 0.4852
 epoch: 43, train_loss: 0.9275, test_loss: 0.9540, test_f1: 0.4832
 epoch: 44, train_loss: 0.9269, test_loss: 0.9390, test_f1: 0.4865
 epoch: 45, train_loss: 0.9204, test_loss: 0.9606, test_f1: 0.4849
 epoch: 46, train_loss: 0.9283, test_loss: 0.9530, test_f1: 0.4822
 epoch: 47, train_loss: 0.9222, test_loss: 0.9336, test_f1: 0.4910
 epoch: 48, train_loss: 0.9168, test_loss: 0.9414, test_f1: 0.4901
 epoch: 49, train_loss: 0.9150, test_loss: 0.9390, test_f1: 0.4903
 epoch: 50, train_loss: 0.9167, test_loss: 0.9545, test_f1: 0.4937
 epoch: 51, train_loss: 0.9070, test_loss: 0.9534, test_f1: 0.4944
 epoch: 52, train_loss: 0.9025, test_loss: 0.9576, test_f1: 0.4910
 epoch: 53, train_loss: 0.8917, test_loss: 0.9487, test_f1: 0.4952
 epoch: 54, train_loss: 0.8923, test_loss: 0.9490, test_f1: 0.4905
 epoch: 55, train_loss: 0.8940, test_loss: 0.9548, test_f1: 0.4910
 epoch: 56, train_loss: 0.8886, test_loss: 0.9771, test_f1: 0.4890
 epoch: 57, train_loss: 0.8975, test_loss: 0.9469, test_f1: 0.4960
 epoch: 58, train_loss: 0.8888, test_loss: 0.9494, test_f1: 0.4976
 epoch: 59, train_loss: 0.8916, test_loss: 0.9695, test_f1: 0.4936
 epoch: 60, train_loss: 0.8832, test_loss: 0.9638, test_f1: 0.4943
 epoch: 61, train_loss: 0.8964, test_loss: 0.9694, test_f1: 0.4939
 epoch: 62, train_loss: 0.8810, test_loss: 0.9494, test_f1: 0.4940
 epoch: 63, train_loss: 0.8839, test_loss: 0.9887, test_f1: 0.4880
 epoch: 64, train_loss: 0.8759, test_loss: 0.9496, test_f1: 0.4968
 epoch: 65, train_loss: 0.8841, test_loss: 0.9680, test_f1: 0.4905
 epoch: 66, train_loss: 0.8808, test_loss: 0.9651, test_f1: 0.4919
 epoch: 67, train_loss: 0.8811, test_loss: 0.9579, test_f1: 0.4920
 epoch: 68, train_loss: 0.8789, test_loss: 0.9643, test_f1: 0.4941
 epoch: 69, train_loss: 0.8731, test_loss: 0.9744, test_f1: 0.4942
 epoch: 70, train_loss: 0.8773, test_loss: 0.9825, test_f1: 0.4920
 epoch: 71, train_loss: 0.8802, test_loss: 0.9619, test_f1: 0.4911
 epoch: 72, train_loss: 0.8788, test_loss: 0.9752, test_f1: 0.4934
 epoch: 73, train_loss: 0.8714, test_loss: 0.9789, test_f1: 0.4915
 epoch: 74, train_loss: 0.8711, test_loss: 0.9820, test_f1: 0.4905
 epoch: 75, train_loss: 0.8684, test_loss: 0.9671, test_f1: 0.4993
 epoch: 76, train_loss: 0.8607, test_loss: 0.9633, test_f1: 0.4923
 epoch: 77, train_loss: 0.8647, test_loss: 0.9883, test_f1: 0.4926
 epoch: 78, train_loss: 0.8578, test_loss: 0.9717, test_f1: 0.5006
 epoch: 79, train_loss: 0.8677, test_loss: 0.9867, test_f1: 0.4941
 epoch: 80, train_loss: 0.8549, test_loss: 0.9746, test_f1: 0.4999
 epoch: 81, train_loss: 0.8643, test_loss: 0.9712, test_f1: 0.4976
 epoch: 82, train_loss: 0.8577, test_loss: 0.9688, test_f1: 0.5008
 epoch: 83, train_loss: 0.8603, test_loss: 0.9698, test_f1: 0.4929
 epoch: 84, train_loss: 0.8527, test_loss: 0.9606, test_f1: 0.5082
 epoch: 85, train_loss: 0.8584, test_loss: 0.9927, test_f1: 0.4911
 epoch: 86, train_loss: 0.8558, test_loss: 0.9652, test_f1: 0.4979
 epoch: 87, train_loss: 0.8594, test_loss: 0.9845, test_f1: 0.5054
 epoch: 88, train_loss: 0.8518, test_loss: 0.9908, test_f1: 0.4934
 epoch: 89, train_loss: 0.8479, test_loss: 1.0005, test_f1: 0.5072
 epoch: 90, train_loss: 0.8514, test_loss: 0.9918, test_f1: 0.4973
 epoch: 91, train_loss: 0.8476, test_loss: 1.0061, test_f1: 0.5068
 epoch: 92, train_loss: 0.8525, test_loss: 0.9907, test_f1: 0.5028
 epoch: 93, train_loss: 0.8424, test_loss: 0.9808, test_f1: 0.5059
 epoch: 94, train_loss: 0.8439, test_loss: 0.9888, test_f1: 0.5068
 epoch: 95, train_loss: 0.8542, test_loss: 0.9637, test_f1: 0.4993
 epoch: 96, train_loss: 0.8453, test_loss: 0.9832, test_f1: 0.5163
 epoch: 97, train_loss: 0.8380, test_loss: 0.9822, test_f1: 0.4987
 epoch: 98, train_loss: 0.8507, test_loss: 0.9913, test_f1: 0.5034
 epoch: 99, train_loss: 0.8303, test_loss: 1.0122, test_f1: 0.5036
##################ITERATION #6 ****************************************
 epoch: 0, train_loss: 1.3367, test_loss: 1.2463, test_f1: 0.3256
 epoch: 1, train_loss: 1.2577, test_loss: 1.2092, test_f1: 0.4207
 epoch: 2, train_loss: 1.2327, test_loss: 1.1954, test_f1: 0.4028
 epoch: 3, train_loss: 1.2147, test_loss: 1.1750, test_f1: 0.4011
 epoch: 4, train_loss: 1.1972, test_loss: 1.1601, test_f1: 0.4357
 epoch: 5, train_loss: 1.1919, test_loss: 1.1451, test_f1: 0.4430
 epoch: 6, train_loss: 1.1702, test_loss: 1.1357, test_f1: 0.4563
 epoch: 7, train_loss: 1.1607, test_loss: 1.1198, test_f1: 0.4593
 epoch: 8, train_loss: 1.1513, test_loss: 1.1075, test_f1: 0.4691
 epoch: 9, train_loss: 1.1401, test_loss: 1.1110, test_f1: 0.4446
 epoch: 10, train_loss: 1.1306, test_loss: 1.0861, test_f1: 0.4649
 epoch: 11, train_loss: 1.1184, test_loss: 1.0846, test_f1: 0.4614
 epoch: 12, train_loss: 1.1157, test_loss: 1.0778, test_f1: 0.4563
 epoch: 13, train_loss: 1.1056, test_loss: 1.0695, test_f1: 0.4610
 epoch: 14, train_loss: 1.1047, test_loss: 1.0611, test_f1: 0.4633
 epoch: 15, train_loss: 1.0927, test_loss: 1.0461, test_f1: 0.4607
 epoch: 16, train_loss: 1.0871, test_loss: 1.0410, test_f1: 0.4552
 epoch: 17, train_loss: 1.0695, test_loss: 1.0322, test_f1: 0.4736
 epoch: 18, train_loss: 1.0673, test_loss: 1.0234, test_f1: 0.4796
 epoch: 19, train_loss: 1.0556, test_loss: 1.0273, test_f1: 0.4789
 epoch: 20, train_loss: 1.0477, test_loss: 1.0194, test_f1: 0.4721
 epoch: 21, train_loss: 1.0510, test_loss: 1.0174, test_f1: 0.4832
 epoch: 22, train_loss: 1.0386, test_loss: 1.0093, test_f1: 0.4737
 epoch: 23, train_loss: 1.0397, test_loss: 1.0113, test_f1: 0.4852
 epoch: 24, train_loss: 1.0409, test_loss: 0.9986, test_f1: 0.4801
 epoch: 25, train_loss: 1.0274, test_loss: 1.0109, test_f1: 0.4776
 epoch: 26, train_loss: 1.0184, test_loss: 0.9942, test_f1: 0.4786
 epoch: 27, train_loss: 1.0259, test_loss: 0.9960, test_f1: 0.4779
 epoch: 28, train_loss: 1.0221, test_loss: 0.9884, test_f1: 0.4830
 epoch: 29, train_loss: 1.0072, test_loss: 0.9870, test_f1: 0.4776
 epoch: 30, train_loss: 1.0112, test_loss: 0.9846, test_f1: 0.4864
 epoch: 31, train_loss: 0.9990, test_loss: 0.9875, test_f1: 0.4815
 epoch: 32, train_loss: 0.9963, test_loss: 0.9904, test_f1: 0.4786
 epoch: 33, train_loss: 0.9937, test_loss: 0.9794, test_f1: 0.4834
 epoch: 34, train_loss: 0.9923, test_loss: 0.9731, test_f1: 0.4812
 epoch: 35, train_loss: 0.9865, test_loss: 0.9825, test_f1: 0.4734
 epoch: 36, train_loss: 0.9826, test_loss: 0.9662, test_f1: 0.4831
 epoch: 37, train_loss: 0.9751, test_loss: 0.9579, test_f1: 0.4928
 epoch: 38, train_loss: 0.9712, test_loss: 0.9686, test_f1: 0.4871
 epoch: 39, train_loss: 0.9693, test_loss: 0.9514, test_f1: 0.4953
 epoch: 40, train_loss: 0.9599, test_loss: 0.9692, test_f1: 0.4907
 epoch: 41, train_loss: 0.9621, test_loss: 0.9648, test_f1: 0.4842
 epoch: 42, train_loss: 0.9610, test_loss: 0.9550, test_f1: 0.4867
 epoch: 43, train_loss: 0.9499, test_loss: 0.9531, test_f1: 0.4926
 epoch: 44, train_loss: 0.9554, test_loss: 0.9592, test_f1: 0.4966
 epoch: 45, train_loss: 0.9367, test_loss: 0.9551, test_f1: 0.4898
 epoch: 46, train_loss: 0.9375, test_loss: 0.9563, test_f1: 0.4913
 epoch: 47, train_loss: 0.9353, test_loss: 0.9487, test_f1: 0.4962
 epoch: 48, train_loss: 0.9294, test_loss: 0.9457, test_f1: 0.4878
 epoch: 49, train_loss: 0.9318, test_loss: 0.9636, test_f1: 0.4832
 epoch: 50, train_loss: 0.9395, test_loss: 0.9510, test_f1: 0.4870
 epoch: 51, train_loss: 0.9235, test_loss: 0.9521, test_f1: 0.4881
 epoch: 52, train_loss: 0.9024, test_loss: 0.9522, test_f1: 0.4875
 epoch: 53, train_loss: 0.9159, test_loss: 0.9465, test_f1: 0.4749
 epoch: 54, train_loss: 0.9127, test_loss: 0.9616, test_f1: 0.4929
 epoch: 55, train_loss: 0.9167, test_loss: 0.9508, test_f1: 0.4924
 epoch: 56, train_loss: 0.9198, test_loss: 0.9624, test_f1: 0.4836
 epoch: 57, train_loss: 0.9099, test_loss: 0.9598, test_f1: 0.4869
 epoch: 58, train_loss: 0.9078, test_loss: 0.9447, test_f1: 0.4973
 epoch: 59, train_loss: 0.8918, test_loss: 0.9492, test_f1: 0.4875
 epoch: 60, train_loss: 0.9065, test_loss: 0.9526, test_f1: 0.4837
 epoch: 61, train_loss: 0.9052, test_loss: 0.9496, test_f1: 0.4934
 epoch: 62, train_loss: 0.9014, test_loss: 0.9558, test_f1: 0.4914
 epoch: 63, train_loss: 0.8928, test_loss: 0.9570, test_f1: 0.4910
 epoch: 64, train_loss: 0.8939, test_loss: 0.9470, test_f1: 0.4965
 epoch: 65, train_loss: 0.8978, test_loss: 0.9535, test_f1: 0.5035
 epoch: 66, train_loss: 0.9016, test_loss: 0.9463, test_f1: 0.4971
 epoch: 67, train_loss: 0.9124, test_loss: 0.9713, test_f1: 0.4885
 epoch: 68, train_loss: 0.8995, test_loss: 0.9470, test_f1: 0.4934
 epoch: 69, train_loss: 0.8962, test_loss: 0.9654, test_f1: 0.4853
 epoch: 70, train_loss: 0.8823, test_loss: 0.9555, test_f1: 0.4776
 epoch: 71, train_loss: 0.8959, test_loss: 0.9504, test_f1: 0.4865
 epoch: 72, train_loss: 0.8856, test_loss: 0.9577, test_f1: 0.4842
 epoch: 73, train_loss: 0.8881, test_loss: 0.9624, test_f1: 0.4963
 epoch: 74, train_loss: 0.8817, test_loss: 0.9623, test_f1: 0.4877
 epoch: 75, train_loss: 0.8882, test_loss: 0.9535, test_f1: 0.4951
 epoch: 76, train_loss: 0.8740, test_loss: 0.9656, test_f1: 0.4869
 epoch: 77, train_loss: 0.8776, test_loss: 0.9568, test_f1: 0.4855
 epoch: 78, train_loss: 0.8870, test_loss: 0.9599, test_f1: 0.4838
 epoch: 79, train_loss: 0.8780, test_loss: 0.9556, test_f1: 0.4901
 epoch: 80, train_loss: 0.8667, test_loss: 0.9521, test_f1: 0.4839
 epoch: 81, train_loss: 0.8793, test_loss: 0.9727, test_f1: 0.4855
 epoch: 82, train_loss: 0.8759, test_loss: 0.9578, test_f1: 0.5114
 epoch: 83, train_loss: 0.8736, test_loss: 0.9697, test_f1: 0.4796
 epoch: 84, train_loss: 0.8767, test_loss: 0.9740, test_f1: 0.4959
 epoch: 85, train_loss: 0.8689, test_loss: 0.9610, test_f1: 0.4879
 epoch: 86, train_loss: 0.8695, test_loss: 0.9596, test_f1: 0.4903
 epoch: 87, train_loss: 0.8715, test_loss: 0.9595, test_f1: 0.5080
 epoch: 88, train_loss: 0.8755, test_loss: 0.9504, test_f1: 0.5090
 epoch: 89, train_loss: 0.8726, test_loss: 0.9627, test_f1: 0.5085
 epoch: 90, train_loss: 0.8714, test_loss: 0.9803, test_f1: 0.4674
 epoch: 91, train_loss: 0.8710, test_loss: 0.9696, test_f1: 0.4995
 epoch: 92, train_loss: 0.8609, test_loss: 0.9779, test_f1: 0.5055
 epoch: 93, train_loss: 0.8568, test_loss: 0.9594, test_f1: 0.5042
 epoch: 94, train_loss: 0.8762, test_loss: 0.9570, test_f1: 0.4945
 epoch: 95, train_loss: 0.8464, test_loss: 0.9662, test_f1: 0.4751
 epoch: 96, train_loss: 0.8707, test_loss: 0.9594, test_f1: 0.5106
 epoch: 97, train_loss: 0.8716, test_loss: 0.9626, test_f1: 0.4775
 epoch: 98, train_loss: 0.8606, test_loss: 0.9704, test_f1: 0.4723
 epoch: 99, train_loss: 0.8514, test_loss: 0.9674, test_f1: 0.5001
##################ITERATION #7 ****************************************
 epoch: 0, train_loss: 1.3321, test_loss: 1.2418, test_f1: 0.2921
 epoch: 1, train_loss: 1.2600, test_loss: 1.1616, test_f1: 0.4392
 epoch: 2, train_loss: 1.2227, test_loss: 1.1436, test_f1: 0.4498
 epoch: 3, train_loss: 1.1995, test_loss: 1.1278, test_f1: 0.4462
 epoch: 4, train_loss: 1.1953, test_loss: 1.1123, test_f1: 0.4556
 epoch: 5, train_loss: 1.1776, test_loss: 1.0941, test_f1: 0.4659
 epoch: 6, train_loss: 1.1660, test_loss: 1.0872, test_f1: 0.4522
 epoch: 7, train_loss: 1.1383, test_loss: 1.0728, test_f1: 0.4711
 epoch: 8, train_loss: 1.1263, test_loss: 1.0628, test_f1: 0.4692
 epoch: 9, train_loss: 1.1236, test_loss: 1.0563, test_f1: 0.4724
 epoch: 10, train_loss: 1.1112, test_loss: 1.0450, test_f1: 0.4566
 epoch: 11, train_loss: 1.0883, test_loss: 1.0376, test_f1: 0.4757
 epoch: 12, train_loss: 1.0915, test_loss: 1.0271, test_f1: 0.4850
 epoch: 13, train_loss: 1.0907, test_loss: 1.0204, test_f1: 0.4891
 epoch: 14, train_loss: 1.0754, test_loss: 1.0087, test_f1: 0.4982
 epoch: 15, train_loss: 1.0726, test_loss: 1.0056, test_f1: 0.4939
 epoch: 16, train_loss: 1.0545, test_loss: 1.0086, test_f1: 0.4936
 epoch: 17, train_loss: 1.0593, test_loss: 0.9965, test_f1: 0.4845
 epoch: 18, train_loss: 1.0406, test_loss: 0.9927, test_f1: 0.4738
 epoch: 19, train_loss: 1.0490, test_loss: 0.9879, test_f1: 0.4777
 epoch: 20, train_loss: 1.0520, test_loss: 0.9799, test_f1: 0.4845
 epoch: 21, train_loss: 1.0259, test_loss: 0.9754, test_f1: 0.4840
 epoch: 22, train_loss: 1.0314, test_loss: 0.9713, test_f1: 0.4878
 epoch: 23, train_loss: 1.0305, test_loss: 0.9682, test_f1: 0.4758
 epoch: 24, train_loss: 1.0180, test_loss: 0.9672, test_f1: 0.4747
 epoch: 25, train_loss: 1.0147, test_loss: 0.9557, test_f1: 0.4945
 epoch: 26, train_loss: 1.0046, test_loss: 0.9548, test_f1: 0.4765
 epoch: 27, train_loss: 1.0050, test_loss: 0.9551, test_f1: 0.4817
 epoch: 28, train_loss: 1.0020, test_loss: 0.9531, test_f1: 0.4895
 epoch: 29, train_loss: 0.9900, test_loss: 0.9569, test_f1: 0.4729
 epoch: 30, train_loss: 0.9897, test_loss: 0.9473, test_f1: 0.4825
 epoch: 31, train_loss: 0.9904, test_loss: 0.9447, test_f1: 0.4853
 epoch: 32, train_loss: 0.9924, test_loss: 0.9464, test_f1: 0.4740
 epoch: 33, train_loss: 0.9866, test_loss: 0.9435, test_f1: 0.4662
 epoch: 34, train_loss: 0.9817, test_loss: 0.9464, test_f1: 0.4714
 epoch: 35, train_loss: 0.9906, test_loss: 0.9392, test_f1: 0.4689
 epoch: 36, train_loss: 0.9781, test_loss: 0.9350, test_f1: 0.4693
 epoch: 37, train_loss: 0.9751, test_loss: 0.9426, test_f1: 0.4680
 epoch: 38, train_loss: 0.9682, test_loss: 0.9327, test_f1: 0.4767
 epoch: 39, train_loss: 0.9628, test_loss: 0.9259, test_f1: 0.4761
 epoch: 40, train_loss: 0.9587, test_loss: 0.9327, test_f1: 0.4893
 epoch: 41, train_loss: 0.9627, test_loss: 0.9347, test_f1: 0.4757
 epoch: 42, train_loss: 0.9521, test_loss: 0.9282, test_f1: 0.4828
 epoch: 43, train_loss: 0.9461, test_loss: 0.9372, test_f1: 0.4760
 epoch: 44, train_loss: 0.9455, test_loss: 0.9282, test_f1: 0.4926
 epoch: 45, train_loss: 0.9386, test_loss: 0.9300, test_f1: 0.4852
 epoch: 46, train_loss: 0.9429, test_loss: 0.9351, test_f1: 0.4924
 epoch: 47, train_loss: 0.9362, test_loss: 0.9347, test_f1: 0.5008
 epoch: 48, train_loss: 0.9248, test_loss: 0.9377, test_f1: 0.5039
 epoch: 49, train_loss: 0.9259, test_loss: 0.9365, test_f1: 0.4963
 epoch: 50, train_loss: 0.9250, test_loss: 0.9351, test_f1: 0.5011
 epoch: 51, train_loss: 0.9270, test_loss: 0.9343, test_f1: 0.5168
 epoch: 52, train_loss: 0.9214, test_loss: 0.9357, test_f1: 0.4947
 epoch: 53, train_loss: 0.9137, test_loss: 0.9274, test_f1: 0.5098
 epoch: 54, train_loss: 0.9263, test_loss: 0.9356, test_f1: 0.4980
 epoch: 55, train_loss: 0.9124, test_loss: 0.9345, test_f1: 0.4819
 epoch: 56, train_loss: 0.9105, test_loss: 0.9256, test_f1: 0.4883
 epoch: 57, train_loss: 0.9069, test_loss: 0.9381, test_f1: 0.4851
 epoch: 58, train_loss: 0.9084, test_loss: 0.9280, test_f1: 0.4928
 epoch: 59, train_loss: 0.9059, test_loss: 0.9426, test_f1: 0.4870
 epoch: 60, train_loss: 0.9135, test_loss: 0.9348, test_f1: 0.5064
 epoch: 61, train_loss: 0.9084, test_loss: 0.9414, test_f1: 0.5101
 epoch: 62, train_loss: 0.8934, test_loss: 0.9349, test_f1: 0.5085
 epoch: 63, train_loss: 0.9059, test_loss: 0.9397, test_f1: 0.5159
 epoch: 64, train_loss: 0.9090, test_loss: 0.9352, test_f1: 0.5145
 epoch: 65, train_loss: 0.8982, test_loss: 0.9366, test_f1: 0.4813
 epoch: 66, train_loss: 0.9026, test_loss: 0.9413, test_f1: 0.5057
 epoch: 67, train_loss: 0.8881, test_loss: 0.9390, test_f1: 0.4952
 epoch: 68, train_loss: 0.9016, test_loss: 0.9473, test_f1: 0.4990
 epoch: 69, train_loss: 0.8932, test_loss: 0.9334, test_f1: 0.5200
 epoch: 70, train_loss: 0.8924, test_loss: 0.9281, test_f1: 0.5184
 epoch: 71, train_loss: 0.8991, test_loss: 0.9347, test_f1: 0.5036
 epoch: 72, train_loss: 0.8975, test_loss: 0.9359, test_f1: 0.5184
 epoch: 73, train_loss: 0.9021, test_loss: 0.9391, test_f1: 0.5179
 epoch: 74, train_loss: 0.8842, test_loss: 0.9389, test_f1: 0.5081
 epoch: 75, train_loss: 0.8853, test_loss: 0.9358, test_f1: 0.4961
 epoch: 76, train_loss: 0.8899, test_loss: 0.9339, test_f1: 0.5062
 epoch: 77, train_loss: 0.8936, test_loss: 0.9376, test_f1: 0.5113
 epoch: 78, train_loss: 0.8776, test_loss: 0.9288, test_f1: 0.5134
 epoch: 79, train_loss: 0.8779, test_loss: 0.9342, test_f1: 0.5079
 epoch: 80, train_loss: 0.8764, test_loss: 0.9396, test_f1: 0.5157
 epoch: 81, train_loss: 0.8822, test_loss: 0.9371, test_f1: 0.4925
 epoch: 82, train_loss: 0.8796, test_loss: 0.9397, test_f1: 0.5116
 epoch: 83, train_loss: 0.8717, test_loss: 0.9454, test_f1: 0.5073
 epoch: 84, train_loss: 0.8693, test_loss: 0.9354, test_f1: 0.5083
 epoch: 85, train_loss: 0.8771, test_loss: 0.9436, test_f1: 0.5133
 epoch: 86, train_loss: 0.8706, test_loss: 0.9477, test_f1: 0.4997
 epoch: 87, train_loss: 0.8700, test_loss: 0.9508, test_f1: 0.5022
 epoch: 88, train_loss: 0.8623, test_loss: 0.9481, test_f1: 0.5067
 epoch: 89, train_loss: 0.8707, test_loss: 0.9440, test_f1: 0.5171
 epoch: 90, train_loss: 0.8649, test_loss: 0.9461, test_f1: 0.5250
 epoch: 91, train_loss: 0.8678, test_loss: 0.9563, test_f1: 0.4921
 epoch: 92, train_loss: 0.8641, test_loss: 0.9358, test_f1: 0.5175
 epoch: 93, train_loss: 0.8636, test_loss: 0.9384, test_f1: 0.5219
 epoch: 94, train_loss: 0.8727, test_loss: 0.9411, test_f1: 0.5112
 epoch: 95, train_loss: 0.8614, test_loss: 0.9461, test_f1: 0.5044
 epoch: 96, train_loss: 0.8555, test_loss: 0.9445, test_f1: 0.5232
 epoch: 97, train_loss: 0.8478, test_loss: 0.9512, test_f1: 0.5120
 epoch: 98, train_loss: 0.8582, test_loss: 0.9429, test_f1: 0.5117
 epoch: 99, train_loss: 0.8627, test_loss: 0.9443, test_f1: 0.4907
##################ITERATION #8 ****************************************
 epoch: 0, train_loss: 1.3550, test_loss: 1.2187, test_f1: 0.2545
 epoch: 1, train_loss: 1.2670, test_loss: 1.1617, test_f1: 0.3838
 epoch: 2, train_loss: 1.2505, test_loss: 1.1445, test_f1: 0.3968
 epoch: 3, train_loss: 1.2221, test_loss: 1.1363, test_f1: 0.4303
 epoch: 4, train_loss: 1.2026, test_loss: 1.1169, test_f1: 0.4378
 epoch: 5, train_loss: 1.1982, test_loss: 1.1174, test_f1: 0.4385
 epoch: 6, train_loss: 1.1728, test_loss: 1.1133, test_f1: 0.4592
 epoch: 7, train_loss: 1.1683, test_loss: 1.1060, test_f1: 0.4505
 epoch: 8, train_loss: 1.1642, test_loss: 1.0906, test_f1: 0.4648
 epoch: 9, train_loss: 1.1396, test_loss: 1.0989, test_f1: 0.4474
 epoch: 10, train_loss: 1.1345, test_loss: 1.0878, test_f1: 0.4633
 epoch: 11, train_loss: 1.1302, test_loss: 1.0812, test_f1: 0.4661
 epoch: 12, train_loss: 1.1124, test_loss: 1.0843, test_f1: 0.4361
 epoch: 13, train_loss: 1.1136, test_loss: 1.0752, test_f1: 0.4397
 epoch: 14, train_loss: 1.1055, test_loss: 1.0727, test_f1: 0.4624
 epoch: 15, train_loss: 1.0982, test_loss: 1.0678, test_f1: 0.4425
 epoch: 16, train_loss: 1.0939, test_loss: 1.0530, test_f1: 0.4639
 epoch: 17, train_loss: 1.0814, test_loss: 1.0535, test_f1: 0.4636
 epoch: 18, train_loss: 1.0844, test_loss: 1.0493, test_f1: 0.4470
 epoch: 19, train_loss: 1.0861, test_loss: 1.0479, test_f1: 0.4424
 epoch: 20, train_loss: 1.0751, test_loss: 1.0404, test_f1: 0.4584
 epoch: 21, train_loss: 1.0689, test_loss: 1.0337, test_f1: 0.4647
 epoch: 22, train_loss: 1.0687, test_loss: 1.0351, test_f1: 0.4527
 epoch: 23, train_loss: 1.0671, test_loss: 1.0318, test_f1: 0.4527
 epoch: 24, train_loss: 1.0581, test_loss: 1.0277, test_f1: 0.4619
 epoch: 25, train_loss: 1.0392, test_loss: 1.0300, test_f1: 0.4471
 epoch: 26, train_loss: 1.0429, test_loss: 1.0301, test_f1: 0.4510
 epoch: 27, train_loss: 1.0492, test_loss: 1.0211, test_f1: 0.4534
 epoch: 28, train_loss: 1.0361, test_loss: 1.0281, test_f1: 0.4468
 epoch: 29, train_loss: 1.0236, test_loss: 1.0201, test_f1: 0.4489
 epoch: 30, train_loss: 1.0283, test_loss: 1.0161, test_f1: 0.4503
 epoch: 31, train_loss: 1.0183, test_loss: 1.0186, test_f1: 0.4429
 epoch: 32, train_loss: 1.0179, test_loss: 1.0112, test_f1: 0.4564
 epoch: 33, train_loss: 1.0090, test_loss: 1.0029, test_f1: 0.4738
 epoch: 34, train_loss: 1.0055, test_loss: 1.0012, test_f1: 0.4726
 epoch: 35, train_loss: 1.0072, test_loss: 1.0116, test_f1: 0.4611
 epoch: 36, train_loss: 0.9985, test_loss: 0.9949, test_f1: 0.4678
 epoch: 37, train_loss: 0.9998, test_loss: 1.0027, test_f1: 0.4748
 epoch: 38, train_loss: 1.0018, test_loss: 0.9967, test_f1: 0.4653
 epoch: 39, train_loss: 0.9852, test_loss: 1.0149, test_f1: 0.4675
 epoch: 40, train_loss: 0.9794, test_loss: 0.9966, test_f1: 0.4701
 epoch: 41, train_loss: 0.9840, test_loss: 1.0000, test_f1: 0.4697
 epoch: 42, train_loss: 0.9810, test_loss: 0.9879, test_f1: 0.4835
 epoch: 43, train_loss: 0.9745, test_loss: 0.9931, test_f1: 0.4689
 epoch: 44, train_loss: 0.9701, test_loss: 0.9960, test_f1: 0.4759
 epoch: 45, train_loss: 0.9668, test_loss: 0.9926, test_f1: 0.4672
 epoch: 46, train_loss: 0.9616, test_loss: 0.9969, test_f1: 0.4823
 epoch: 47, train_loss: 0.9583, test_loss: 0.9931, test_f1: 0.4823
 epoch: 48, train_loss: 0.9573, test_loss: 0.9908, test_f1: 0.4875
 epoch: 49, train_loss: 0.9599, test_loss: 0.9944, test_f1: 0.4896
 epoch: 50, train_loss: 0.9359, test_loss: 0.9918, test_f1: 0.4854
 epoch: 51, train_loss: 0.9388, test_loss: 1.0034, test_f1: 0.4848
 epoch: 52, train_loss: 0.9434, test_loss: 0.9904, test_f1: 0.5045
 epoch: 53, train_loss: 0.9549, test_loss: 0.9943, test_f1: 0.4913
 epoch: 54, train_loss: 0.9446, test_loss: 0.9853, test_f1: 0.4977
 epoch: 55, train_loss: 0.9340, test_loss: 0.9984, test_f1: 0.4844
 epoch: 56, train_loss: 0.9335, test_loss: 0.9949, test_f1: 0.4834
 epoch: 57, train_loss: 0.9216, test_loss: 0.9981, test_f1: 0.5056
 epoch: 58, train_loss: 0.9271, test_loss: 0.9996, test_f1: 0.4965
 epoch: 59, train_loss: 0.9347, test_loss: 0.9946, test_f1: 0.5063
 epoch: 60, train_loss: 0.9226, test_loss: 0.9959, test_f1: 0.5048
 epoch: 61, train_loss: 0.9189, test_loss: 1.0015, test_f1: 0.4885
 epoch: 62, train_loss: 0.9257, test_loss: 0.9958, test_f1: 0.4956
 epoch: 63, train_loss: 0.9205, test_loss: 0.9963, test_f1: 0.4998
 epoch: 64, train_loss: 0.9286, test_loss: 0.9957, test_f1: 0.5010
 epoch: 65, train_loss: 0.9256, test_loss: 0.9942, test_f1: 0.5134
 epoch: 66, train_loss: 0.9039, test_loss: 0.9935, test_f1: 0.5169
 epoch: 67, train_loss: 0.9135, test_loss: 1.0094, test_f1: 0.5091
 epoch: 68, train_loss: 0.9296, test_loss: 1.0019, test_f1: 0.5057
 epoch: 69, train_loss: 0.9124, test_loss: 0.9997, test_f1: 0.5139
 epoch: 70, train_loss: 0.9086, test_loss: 1.0038, test_f1: 0.5121
 epoch: 71, train_loss: 0.9064, test_loss: 1.0101, test_f1: 0.5040
 epoch: 72, train_loss: 0.9093, test_loss: 1.0029, test_f1: 0.5017
 epoch: 73, train_loss: 0.9115, test_loss: 1.0002, test_f1: 0.5100
 epoch: 74, train_loss: 0.9098, test_loss: 0.9964, test_f1: 0.5080
 epoch: 75, train_loss: 0.8978, test_loss: 0.9977, test_f1: 0.5061
 epoch: 76, train_loss: 0.9151, test_loss: 1.0066, test_f1: 0.5069
 epoch: 77, train_loss: 0.9076, test_loss: 0.9942, test_f1: 0.5038
 epoch: 78, train_loss: 0.8989, test_loss: 0.9967, test_f1: 0.5044
 epoch: 79, train_loss: 0.9055, test_loss: 1.0081, test_f1: 0.5029
 epoch: 80, train_loss: 0.9073, test_loss: 1.0015, test_f1: 0.5039
 epoch: 81, train_loss: 0.8967, test_loss: 0.9962, test_f1: 0.5079
 epoch: 82, train_loss: 0.9034, test_loss: 1.0028, test_f1: 0.5028
 epoch: 83, train_loss: 0.8920, test_loss: 0.9998, test_f1: 0.5045
 epoch: 84, train_loss: 0.8903, test_loss: 0.9907, test_f1: 0.5095
 epoch: 85, train_loss: 0.9003, test_loss: 1.0074, test_f1: 0.5047
 epoch: 86, train_loss: 0.8948, test_loss: 1.0038, test_f1: 0.5058
 epoch: 87, train_loss: 0.8879, test_loss: 1.0008, test_f1: 0.4954
 epoch: 88, train_loss: 0.8897, test_loss: 1.0078, test_f1: 0.5103
 epoch: 89, train_loss: 0.8844, test_loss: 1.0066, test_f1: 0.5083
 epoch: 90, train_loss: 0.8940, test_loss: 0.9967, test_f1: 0.5151
 epoch: 91, train_loss: 0.8857, test_loss: 0.9991, test_f1: 0.5123
 epoch: 92, train_loss: 0.8894, test_loss: 1.0012, test_f1: 0.5080
 epoch: 93, train_loss: 0.8766, test_loss: 1.0147, test_f1: 0.5098
 epoch: 94, train_loss: 0.8847, test_loss: 1.0196, test_f1: 0.5029
 epoch: 95, train_loss: 0.8696, test_loss: 1.0178, test_f1: 0.4989
 epoch: 96, train_loss: 0.8799, test_loss: 1.0092, test_f1: 0.5121
 epoch: 97, train_loss: 0.8785, test_loss: 1.0189, test_f1: 0.5033
 epoch: 98, train_loss: 0.8835, test_loss: 1.0110, test_f1: 0.5081
 epoch: 99, train_loss: 0.8644, test_loss: 1.0122, test_f1: 0.5044
##################ITERATION #9 ****************************************
 epoch: 0, train_loss: 1.3755, test_loss: 1.2358, test_f1: 0.3534
 epoch: 1, train_loss: 1.2877, test_loss: 1.1958, test_f1: 0.3856
 epoch: 2, train_loss: 1.2491, test_loss: 1.1718, test_f1: 0.4069
 epoch: 3, train_loss: 1.2313, test_loss: 1.1595, test_f1: 0.4216
 epoch: 4, train_loss: 1.2145, test_loss: 1.1424, test_f1: 0.4367
 epoch: 5, train_loss: 1.2007, test_loss: 1.1357, test_f1: 0.4314
 epoch: 6, train_loss: 1.1764, test_loss: 1.1154, test_f1: 0.4471
 epoch: 7, train_loss: 1.1669, test_loss: 1.1219, test_f1: 0.4200
 epoch: 8, train_loss: 1.1491, test_loss: 1.0892, test_f1: 0.4377
 epoch: 9, train_loss: 1.1441, test_loss: 1.0857, test_f1: 0.4525
 epoch: 10, train_loss: 1.1366, test_loss: 1.0820, test_f1: 0.4617
 epoch: 11, train_loss: 1.1283, test_loss: 1.0734, test_f1: 0.4468
 epoch: 12, train_loss: 1.1199, test_loss: 1.0698, test_f1: 0.4279
 epoch: 13, train_loss: 1.1133, test_loss: 1.0588, test_f1: 0.4421
 epoch: 14, train_loss: 1.0996, test_loss: 1.0675, test_f1: 0.4370
 epoch: 15, train_loss: 1.1049, test_loss: 1.0592, test_f1: 0.4351
 epoch: 16, train_loss: 1.0944, test_loss: 1.0563, test_f1: 0.4187
 epoch: 17, train_loss: 1.0866, test_loss: 1.0407, test_f1: 0.4337
 epoch: 18, train_loss: 1.0839, test_loss: 1.0423, test_f1: 0.4546
 epoch: 19, train_loss: 1.0795, test_loss: 1.0334, test_f1: 0.4470
 epoch: 20, train_loss: 1.0642, test_loss: 1.0339, test_f1: 0.4389
 epoch: 21, train_loss: 1.0555, test_loss: 1.0221, test_f1: 0.4662
 epoch: 22, train_loss: 1.0585, test_loss: 1.0242, test_f1: 0.4611
 epoch: 23, train_loss: 1.0457, test_loss: 1.0071, test_f1: 0.4660
 epoch: 24, train_loss: 1.0478, test_loss: 1.0139, test_f1: 0.4693
 epoch: 25, train_loss: 1.0386, test_loss: 1.0068, test_f1: 0.4726
 epoch: 26, train_loss: 1.0383, test_loss: 1.0005, test_f1: 0.4601
 epoch: 27, train_loss: 1.0240, test_loss: 1.0033, test_f1: 0.4676
 epoch: 28, train_loss: 1.0134, test_loss: 1.0081, test_f1: 0.4712
 epoch: 29, train_loss: 1.0212, test_loss: 1.0066, test_f1: 0.4748
 epoch: 30, train_loss: 1.0112, test_loss: 0.9931, test_f1: 0.4665
 epoch: 31, train_loss: 1.0085, test_loss: 0.9977, test_f1: 0.4744
 epoch: 32, train_loss: 1.0068, test_loss: 0.9865, test_f1: 0.4716
 epoch: 33, train_loss: 0.9986, test_loss: 0.9886, test_f1: 0.4843
 epoch: 34, train_loss: 0.9943, test_loss: 0.9961, test_f1: 0.4712
 epoch: 35, train_loss: 0.9892, test_loss: 0.9882, test_f1: 0.4740
 epoch: 36, train_loss: 0.9820, test_loss: 1.0078, test_f1: 0.4654
 epoch: 37, train_loss: 0.9765, test_loss: 0.9928, test_f1: 0.4725
 epoch: 38, train_loss: 0.9809, test_loss: 0.9983, test_f1: 0.4862
 epoch: 39, train_loss: 0.9759, test_loss: 0.9782, test_f1: 0.4918
 epoch: 40, train_loss: 0.9769, test_loss: 0.9797, test_f1: 0.4900
 epoch: 41, train_loss: 0.9751, test_loss: 0.9771, test_f1: 0.4850
 epoch: 42, train_loss: 0.9587, test_loss: 1.0020, test_f1: 0.4912
 epoch: 43, train_loss: 0.9723, test_loss: 0.9953, test_f1: 0.4914
 epoch: 44, train_loss: 0.9621, test_loss: 0.9977, test_f1: 0.4687
 epoch: 45, train_loss: 0.9672, test_loss: 1.0024, test_f1: 0.4465
 epoch: 46, train_loss: 0.9518, test_loss: 0.9820, test_f1: 0.4875
 epoch: 47, train_loss: 0.9455, test_loss: 0.9837, test_f1: 0.4931
 epoch: 48, train_loss: 0.9442, test_loss: 1.0037, test_f1: 0.4772
 epoch: 49, train_loss: 0.9388, test_loss: 0.9830, test_f1: 0.4754
 epoch: 50, train_loss: 0.9428, test_loss: 0.9819, test_f1: 0.4867
 epoch: 51, train_loss: 0.9329, test_loss: 0.9789, test_f1: 0.4768
 epoch: 52, train_loss: 0.9181, test_loss: 0.9821, test_f1: 0.4833
 epoch: 53, train_loss: 0.9358, test_loss: 0.9995, test_f1: 0.4842
 epoch: 54, train_loss: 0.9225, test_loss: 0.9885, test_f1: 0.4817
 epoch: 55, train_loss: 0.9132, test_loss: 0.9858, test_f1: 0.4851
 epoch: 56, train_loss: 0.9203, test_loss: 0.9964, test_f1: 0.4819
 epoch: 57, train_loss: 0.9164, test_loss: 0.9794, test_f1: 0.4809
 epoch: 58, train_loss: 0.9137, test_loss: 0.9824, test_f1: 0.4813
 epoch: 59, train_loss: 0.9201, test_loss: 0.9826, test_f1: 0.4864
 epoch: 60, train_loss: 0.9108, test_loss: 0.9931, test_f1: 0.4832
 epoch: 61, train_loss: 0.8955, test_loss: 0.9838, test_f1: 0.4829
 epoch: 62, train_loss: 0.9169, test_loss: 0.9914, test_f1: 0.4878
 epoch: 63, train_loss: 0.9086, test_loss: 0.9858, test_f1: 0.4884
 epoch: 64, train_loss: 0.9045, test_loss: 0.9872, test_f1: 0.4867
 epoch: 65, train_loss: 0.9066, test_loss: 1.0013, test_f1: 0.4829
 epoch: 66, train_loss: 0.9033, test_loss: 0.9853, test_f1: 0.4886
 epoch: 67, train_loss: 0.9004, test_loss: 1.0008, test_f1: 0.4834
 epoch: 68, train_loss: 0.9061, test_loss: 0.9946, test_f1: 0.4918
 epoch: 69, train_loss: 0.9025, test_loss: 0.9839, test_f1: 0.4906
 epoch: 70, train_loss: 0.9030, test_loss: 1.0243, test_f1: 0.4606
 epoch: 71, train_loss: 0.8950, test_loss: 0.9919, test_f1: 0.4871
 epoch: 72, train_loss: 0.9019, test_loss: 1.0019, test_f1: 0.4875
 epoch: 73, train_loss: 0.8995, test_loss: 0.9894, test_f1: 0.4865
 epoch: 74, train_loss: 0.8940, test_loss: 0.9759, test_f1: 0.4910
 epoch: 75, train_loss: 0.8945, test_loss: 0.9956, test_f1: 0.4839
 epoch: 76, train_loss: 0.8945, test_loss: 0.9784, test_f1: 0.4877
 epoch: 77, train_loss: 0.8902, test_loss: 1.0011, test_f1: 0.4866
 epoch: 78, train_loss: 0.8929, test_loss: 0.9921, test_f1: 0.4911
 epoch: 79, train_loss: 0.8839, test_loss: 1.0011, test_f1: 0.4873
 epoch: 80, train_loss: 0.8858, test_loss: 0.9995, test_f1: 0.4828
 epoch: 81, train_loss: 0.8842, test_loss: 1.0004, test_f1: 0.4859
 epoch: 82, train_loss: 0.8842, test_loss: 1.0178, test_f1: 0.4821
 epoch: 83, train_loss: 0.8866, test_loss: 1.0055, test_f1: 0.4843
 epoch: 84, train_loss: 0.8811, test_loss: 0.9941, test_f1: 0.4883
 epoch: 85, train_loss: 0.8766, test_loss: 0.9957, test_f1: 0.4877
 epoch: 86, train_loss: 0.8904, test_loss: 1.0162, test_f1: 0.4836
 epoch: 87, train_loss: 0.8739, test_loss: 0.9808, test_f1: 0.4910
 epoch: 88, train_loss: 0.8857, test_loss: 0.9845, test_f1: 0.4913
 epoch: 89, train_loss: 0.8848, test_loss: 0.9844, test_f1: 0.4921
 epoch: 90, train_loss: 0.8780, test_loss: 0.9886, test_f1: 0.4889
 epoch: 91, train_loss: 0.8787, test_loss: 0.9883, test_f1: 0.4916
 epoch: 92, train_loss: 0.8682, test_loss: 1.0106, test_f1: 0.4856
 epoch: 93, train_loss: 0.8689, test_loss: 0.9893, test_f1: 0.4921
 epoch: 94, train_loss: 0.8658, test_loss: 0.9986, test_f1: 0.4799
 epoch: 95, train_loss: 0.8560, test_loss: 0.9905, test_f1: 0.4885
 epoch: 96, train_loss: 0.8667, test_loss: 0.9788, test_f1: 0.4922
 epoch: 97, train_loss: 0.8645, test_loss: 1.0110, test_f1: 0.4867
 epoch: 98, train_loss: 0.8654, test_loss: 0.9905, test_f1: 0.4826
 epoch: 99, train_loss: 0.8711, test_loss: 0.9773, test_f1: 0.4910

Training completed in 559.35 seconds
Best F1: 0.5285 at epoch 75
Mean F1 across iterations: 0.5151  0.0099
========================FINAL RESULTS================================
FEGIN weighted F1: 0.5285  0.0099
python main.py --data ltspice_examples --representation component_component --model FEGIN --layers 2 --hiddens 64 --batch_size 64 --lr 0.0001 --emb_size 128 --epochs 100 --save_appendix component_component_L2_H64_BS64_LR0.0001_E128 --no_val
-----



STDERR:
  File "main.py", line 370, in <module>
    main()
  File "main.py", line 254, in main
    dataset = dataset_class(
  File "/home/philip/projects/ltspice_examples_code_repo/Circuit-Completion-Using-GNNs/component_classification_with_link_prediction_head/evaluation/FEGIN/kernel/circuit_datasets.py", line 15, in __init__
    self.data, self.slices = torch.load(self.processed_paths[0])
  File "/home/philip/.local/lib/python3.8/site-packages/torch/serialization.py", line 1040, in load
    warnings.warn(
  File "/usr/lib/python3.8/warnings.py", line 109, in _showwarnmsg
    sw(msg.message, msg.category, msg.filename, msg.lineno,
  File "main.py", line 47, in warn_with_traceback
    traceback.print_stack(file=log)
/home/philip/projects/ltspice_examples_code_repo/Circuit-Completion-Using-GNNs/component_classification_with_link_prediction_head/evaluation/FEGIN/kernel/circuit_datasets.py:15: FutureWarning: You are using `torch.load` with `weights_only=False` (the current default value), which uses the default pickle module implicitly. It is possible to construct malicious pickle data which will execute arbitrary code during unpickling (See https://github.com/pytorch/pytorch/blob/main/SECURITY.md#untrusted-models for more details). In a future release, the default value for `weights_only` will be flipped to `True`. This limits the functions that could be executed during unpickling. Arbitrary objects will no longer be allowed to be loaded via this mode unless they are explicitly allowlisted by the user via `torch.serialization.add_safe_globals`. We recommend you start setting `weights_only=True` for any use case where you don't have full control of the loaded file. Please open an issue on GitHub for any issues related to this experimental feature.
  self.data, self.slices = torch.load(self.processed_paths[0])
