STDOUT:
Results will be saved in /home/philip/projects/ltspice_examples_code_repo/Circuit-Completion-Using-GNNs/component_classification_with_link_prediction_head/evaluation/FEGIN/results/model_FEGIN_dataset_ltspice_examples
Command line input: python main.py --data ltspice_examples --representation component_component --model FEGIN --layers 4 --hiddens 32 --batch_size 32 --lr 0.0001 --emb_size 250 --epochs 100 --save_appendix component_component_L4_H32_BS32_LR0.0001_E250 --no_val
 is saved.
-----
ltspice_examples - FEGIN
Using 4 layers, 32 hidden units, h = 2
Loading component_component representation dataset
ENTERED
Training FEGIN on component_component representation
Train: 3556, Test: 845
##################ITERATION #0 ****************************************
 epoch: 0, train_loss: 1.3803, test_loss: 1.3721, test_f1: 0.1604
 epoch: 1, train_loss: 1.3623, test_loss: 1.3587, test_f1: 0.2033
 epoch: 2, train_loss: 1.3460, test_loss: 1.3404, test_f1: 0.2721
 epoch: 3, train_loss: 1.3288, test_loss: 1.3187, test_f1: 0.2301
 epoch: 4, train_loss: 1.3108, test_loss: 1.3006, test_f1: 0.2274
 epoch: 5, train_loss: 1.2956, test_loss: 1.2893, test_f1: 0.2274
 epoch: 6, train_loss: 1.2818, test_loss: 1.2738, test_f1: 0.2274
 epoch: 7, train_loss: 1.2702, test_loss: 1.2600, test_f1: 0.2274
 epoch: 8, train_loss: 1.2597, test_loss: 1.2461, test_f1: 0.2274
 epoch: 9, train_loss: 1.2533, test_loss: 1.2417, test_f1: 0.2331
 epoch: 10, train_loss: 1.2414, test_loss: 1.2302, test_f1: 0.2537
 epoch: 11, train_loss: 1.2396, test_loss: 1.2283, test_f1: 0.2734
 epoch: 12, train_loss: 1.2321, test_loss: 1.2188, test_f1: 0.2843
 epoch: 13, train_loss: 1.2270, test_loss: 1.2097, test_f1: 0.2854
 epoch: 14, train_loss: 1.2224, test_loss: 1.2060, test_f1: 0.2999
 epoch: 15, train_loss: 1.2165, test_loss: 1.2000, test_f1: 0.2997
 epoch: 16, train_loss: 1.2133, test_loss: 1.1966, test_f1: 0.3004
 epoch: 17, train_loss: 1.2063, test_loss: 1.1916, test_f1: 0.3214
 epoch: 18, train_loss: 1.1982, test_loss: 1.1823, test_f1: 0.3610
 epoch: 19, train_loss: 1.1939, test_loss: 1.1792, test_f1: 0.3575
 epoch: 20, train_loss: 1.1885, test_loss: 1.1762, test_f1: 0.3583
 epoch: 21, train_loss: 1.1871, test_loss: 1.1650, test_f1: 0.3565
 epoch: 22, train_loss: 1.1813, test_loss: 1.1605, test_f1: 0.3633
 epoch: 23, train_loss: 1.1768, test_loss: 1.1519, test_f1: 0.3603
 epoch: 24, train_loss: 1.1726, test_loss: 1.1470, test_f1: 0.3642
 epoch: 25, train_loss: 1.1665, test_loss: 1.1436, test_f1: 0.3656
 epoch: 26, train_loss: 1.1604, test_loss: 1.1392, test_f1: 0.3615
 epoch: 27, train_loss: 1.1581, test_loss: 1.1330, test_f1: 0.3600
 epoch: 28, train_loss: 1.1517, test_loss: 1.1282, test_f1: 0.3698
 epoch: 29, train_loss: 1.1461, test_loss: 1.1257, test_f1: 0.4106
 epoch: 30, train_loss: 1.1535, test_loss: 1.1166, test_f1: 0.4130
 epoch: 31, train_loss: 1.1401, test_loss: 1.1146, test_f1: 0.4294
 epoch: 32, train_loss: 1.1367, test_loss: 1.1134, test_f1: 0.4296
 epoch: 33, train_loss: 1.1265, test_loss: 1.1094, test_f1: 0.4342
 epoch: 34, train_loss: 1.1326, test_loss: 1.1054, test_f1: 0.4439
 epoch: 35, train_loss: 1.1252, test_loss: 1.0992, test_f1: 0.4378
 epoch: 36, train_loss: 1.1188, test_loss: 1.0993, test_f1: 0.4392
 epoch: 37, train_loss: 1.1135, test_loss: 1.0962, test_f1: 0.4536
 epoch: 38, train_loss: 1.1118, test_loss: 1.0863, test_f1: 0.4581
 epoch: 39, train_loss: 1.1144, test_loss: 1.0836, test_f1: 0.4451
 epoch: 40, train_loss: 1.1057, test_loss: 1.0770, test_f1: 0.4499
 epoch: 41, train_loss: 1.1004, test_loss: 1.0806, test_f1: 0.4511
 epoch: 42, train_loss: 1.1046, test_loss: 1.0804, test_f1: 0.4374
 epoch: 43, train_loss: 1.1016, test_loss: 1.0786, test_f1: 0.4475
 epoch: 44, train_loss: 1.0870, test_loss: 1.0670, test_f1: 0.4571
 epoch: 45, train_loss: 1.0916, test_loss: 1.0687, test_f1: 0.4545
 epoch: 46, train_loss: 1.0870, test_loss: 1.0707, test_f1: 0.4611
 epoch: 47, train_loss: 1.0834, test_loss: 1.0710, test_f1: 0.4650
 epoch: 48, train_loss: 1.0800, test_loss: 1.0586, test_f1: 0.4773
 epoch: 49, train_loss: 1.0760, test_loss: 1.0544, test_f1: 0.4671
 epoch: 50, train_loss: 1.0722, test_loss: 1.0599, test_f1: 0.4719
 epoch: 51, train_loss: 1.0667, test_loss: 1.0625, test_f1: 0.4774
 epoch: 52, train_loss: 1.0796, test_loss: 1.0623, test_f1: 0.4604
 epoch: 53, train_loss: 1.0652, test_loss: 1.0550, test_f1: 0.4649
 epoch: 54, train_loss: 1.0620, test_loss: 1.0579, test_f1: 0.4661
 epoch: 55, train_loss: 1.0533, test_loss: 1.0547, test_f1: 0.4628
 epoch: 56, train_loss: 1.0598, test_loss: 1.0564, test_f1: 0.4669
 epoch: 57, train_loss: 1.0631, test_loss: 1.0532, test_f1: 0.4694
 epoch: 58, train_loss: 1.0567, test_loss: 1.0549, test_f1: 0.4802
 epoch: 59, train_loss: 1.0446, test_loss: 1.0570, test_f1: 0.4743
 epoch: 60, train_loss: 1.0547, test_loss: 1.0571, test_f1: 0.4653
 epoch: 61, train_loss: 1.0663, test_loss: 1.0530, test_f1: 0.4677
 epoch: 62, train_loss: 1.0461, test_loss: 1.0578, test_f1: 0.4691
 epoch: 63, train_loss: 1.0432, test_loss: 1.0460, test_f1: 0.4756
 epoch: 64, train_loss: 1.0597, test_loss: 1.0474, test_f1: 0.4738
 epoch: 65, train_loss: 1.0489, test_loss: 1.0479, test_f1: 0.4810
 epoch: 66, train_loss: 1.0475, test_loss: 1.0427, test_f1: 0.4645
 epoch: 67, train_loss: 1.0413, test_loss: 1.0474, test_f1: 0.4760
 epoch: 68, train_loss: 1.0476, test_loss: 1.0493, test_f1: 0.4738
 epoch: 69, train_loss: 1.0431, test_loss: 1.0386, test_f1: 0.4840
 epoch: 70, train_loss: 1.0518, test_loss: 1.0471, test_f1: 0.4675
 epoch: 71, train_loss: 1.0467, test_loss: 1.0487, test_f1: 0.4763
 epoch: 72, train_loss: 1.0423, test_loss: 1.0465, test_f1: 0.4679
 epoch: 73, train_loss: 1.0454, test_loss: 1.0435, test_f1: 0.4781
 epoch: 74, train_loss: 1.0479, test_loss: 1.0460, test_f1: 0.4726
 epoch: 75, train_loss: 1.0459, test_loss: 1.0463, test_f1: 0.4771
 epoch: 76, train_loss: 1.0508, test_loss: 1.0540, test_f1: 0.4795
 epoch: 77, train_loss: 1.0385, test_loss: 1.0475, test_f1: 0.4749
 epoch: 78, train_loss: 1.0365, test_loss: 1.0520, test_f1: 0.4655
 epoch: 79, train_loss: 1.0381, test_loss: 1.0438, test_f1: 0.4702
 epoch: 80, train_loss: 1.0354, test_loss: 1.0437, test_f1: 0.4790
 epoch: 81, train_loss: 1.0292, test_loss: 1.0286, test_f1: 0.4785
 epoch: 82, train_loss: 1.0339, test_loss: 1.0403, test_f1: 0.4773
 epoch: 83, train_loss: 1.0366, test_loss: 1.0462, test_f1: 0.4679
 epoch: 84, train_loss: 1.0335, test_loss: 1.0410, test_f1: 0.4740
 epoch: 85, train_loss: 1.0372, test_loss: 1.0342, test_f1: 0.4696
 epoch: 86, train_loss: 1.0359, test_loss: 1.0350, test_f1: 0.4651
 epoch: 87, train_loss: 1.0311, test_loss: 1.0447, test_f1: 0.4725
 epoch: 88, train_loss: 1.0308, test_loss: 1.0341, test_f1: 0.4707
 epoch: 89, train_loss: 1.0248, test_loss: 1.0314, test_f1: 0.4510
 epoch: 90, train_loss: 1.0239, test_loss: 1.0407, test_f1: 0.4643
 epoch: 91, train_loss: 1.0222, test_loss: 1.0477, test_f1: 0.4701
 epoch: 92, train_loss: 1.0293, test_loss: 1.0446, test_f1: 0.4579
 epoch: 93, train_loss: 1.0239, test_loss: 1.0415, test_f1: 0.4743
 epoch: 94, train_loss: 1.0302, test_loss: 1.0470, test_f1: 0.4653
 epoch: 95, train_loss: 1.0159, test_loss: 1.0408, test_f1: 0.4653
 epoch: 96, train_loss: 1.0226, test_loss: 1.0411, test_f1: 0.4805
 epoch: 97, train_loss: 1.0158, test_loss: 1.0432, test_f1: 0.4694
 epoch: 98, train_loss: 1.0164, test_loss: 1.0430, test_f1: 0.4642
 epoch: 99, train_loss: 1.0130, test_loss: 1.0433, test_f1: 0.4608
##################ITERATION #1 ****************************************
 epoch: 0, train_loss: 1.3638, test_loss: 1.3428, test_f1: 0.2788
 epoch: 1, train_loss: 1.3157, test_loss: 1.3033, test_f1: 0.2529
 epoch: 2, train_loss: 1.2922, test_loss: 1.2808, test_f1: 0.2601
 epoch: 3, train_loss: 1.2737, test_loss: 1.2609, test_f1: 0.3000
 epoch: 4, train_loss: 1.2638, test_loss: 1.2394, test_f1: 0.3151
 epoch: 5, train_loss: 1.2513, test_loss: 1.2280, test_f1: 0.3221
 epoch: 6, train_loss: 1.2433, test_loss: 1.2207, test_f1: 0.3224
 epoch: 7, train_loss: 1.2335, test_loss: 1.2104, test_f1: 0.3274
 epoch: 8, train_loss: 1.2273, test_loss: 1.2025, test_f1: 0.3420
 epoch: 9, train_loss: 1.2213, test_loss: 1.1958, test_f1: 0.3918
 epoch: 10, train_loss: 1.2168, test_loss: 1.1862, test_f1: 0.4020
 epoch: 11, train_loss: 1.2102, test_loss: 1.1852, test_f1: 0.4058
 epoch: 12, train_loss: 1.2006, test_loss: 1.1837, test_f1: 0.4046
 epoch: 13, train_loss: 1.2002, test_loss: 1.1725, test_f1: 0.4123
 epoch: 14, train_loss: 1.1932, test_loss: 1.1667, test_f1: 0.4166
 epoch: 15, train_loss: 1.1967, test_loss: 1.1550, test_f1: 0.4164
 epoch: 16, train_loss: 1.1865, test_loss: 1.1521, test_f1: 0.4189
 epoch: 17, train_loss: 1.1785, test_loss: 1.1460, test_f1: 0.4289
 epoch: 18, train_loss: 1.1840, test_loss: 1.1437, test_f1: 0.4311
 epoch: 19, train_loss: 1.1754, test_loss: 1.1338, test_f1: 0.4338
 epoch: 20, train_loss: 1.1717, test_loss: 1.1320, test_f1: 0.4193
 epoch: 21, train_loss: 1.1747, test_loss: 1.1363, test_f1: 0.4341
 epoch: 22, train_loss: 1.1651, test_loss: 1.1249, test_f1: 0.4305
 epoch: 23, train_loss: 1.1574, test_loss: 1.1296, test_f1: 0.4263
 epoch: 24, train_loss: 1.1558, test_loss: 1.1132, test_f1: 0.4236
 epoch: 25, train_loss: 1.1484, test_loss: 1.1074, test_f1: 0.4303
 epoch: 26, train_loss: 1.1518, test_loss: 1.1005, test_f1: 0.4608
 epoch: 27, train_loss: 1.1519, test_loss: 1.0979, test_f1: 0.4348
 epoch: 28, train_loss: 1.1401, test_loss: 1.0968, test_f1: 0.4326
 epoch: 29, train_loss: 1.1396, test_loss: 1.0901, test_f1: 0.4479
 epoch: 30, train_loss: 1.1355, test_loss: 1.0928, test_f1: 0.4355
 epoch: 31, train_loss: 1.1270, test_loss: 1.0817, test_f1: 0.4340
 epoch: 32, train_loss: 1.1357, test_loss: 1.0823, test_f1: 0.4757
 epoch: 33, train_loss: 1.1373, test_loss: 1.0747, test_f1: 0.4607
 epoch: 34, train_loss: 1.1204, test_loss: 1.0726, test_f1: 0.4417
 epoch: 35, train_loss: 1.1215, test_loss: 1.0795, test_f1: 0.4731
 epoch: 36, train_loss: 1.1207, test_loss: 1.0719, test_f1: 0.4431
 epoch: 37, train_loss: 1.1187, test_loss: 1.0705, test_f1: 0.4450
 epoch: 38, train_loss: 1.1121, test_loss: 1.0622, test_f1: 0.4467
 epoch: 39, train_loss: 1.1122, test_loss: 1.0613, test_f1: 0.4465
 epoch: 40, train_loss: 1.1040, test_loss: 1.0583, test_f1: 0.4492
 epoch: 41, train_loss: 1.1095, test_loss: 1.0597, test_f1: 0.4502
 epoch: 42, train_loss: 1.0997, test_loss: 1.0491, test_f1: 0.4681
 epoch: 43, train_loss: 1.0940, test_loss: 1.0515, test_f1: 0.4479
 epoch: 44, train_loss: 1.0953, test_loss: 1.0414, test_f1: 0.4490
 epoch: 45, train_loss: 1.1002, test_loss: 1.0474, test_f1: 0.4498
 epoch: 46, train_loss: 1.0932, test_loss: 1.0485, test_f1: 0.4381
 epoch: 47, train_loss: 1.0888, test_loss: 1.0471, test_f1: 0.4358
 epoch: 48, train_loss: 1.0808, test_loss: 1.0355, test_f1: 0.4543
 epoch: 49, train_loss: 1.0837, test_loss: 1.0381, test_f1: 0.4499
 epoch: 50, train_loss: 1.0740, test_loss: 1.0512, test_f1: 0.4531
 epoch: 51, train_loss: 1.0759, test_loss: 1.0420, test_f1: 0.4417
 epoch: 52, train_loss: 1.0817, test_loss: 1.0319, test_f1: 0.4449
 epoch: 53, train_loss: 1.0773, test_loss: 1.0350, test_f1: 0.4486
 epoch: 54, train_loss: 1.0774, test_loss: 1.0269, test_f1: 0.4641
 epoch: 55, train_loss: 1.0731, test_loss: 1.0326, test_f1: 0.4421
 epoch: 56, train_loss: 1.0767, test_loss: 1.0283, test_f1: 0.4448
 epoch: 57, train_loss: 1.0678, test_loss: 1.0350, test_f1: 0.4601
 epoch: 58, train_loss: 1.0696, test_loss: 1.0284, test_f1: 0.4414
 epoch: 59, train_loss: 1.0682, test_loss: 1.0301, test_f1: 0.4303
 epoch: 60, train_loss: 1.0700, test_loss: 1.0285, test_f1: 0.4346
 epoch: 61, train_loss: 1.0649, test_loss: 1.0433, test_f1: 0.4696
 epoch: 62, train_loss: 1.0597, test_loss: 1.0257, test_f1: 0.4420
 epoch: 63, train_loss: 1.0674, test_loss: 1.0378, test_f1: 0.4418
 epoch: 64, train_loss: 1.0473, test_loss: 1.0421, test_f1: 0.4479
 epoch: 65, train_loss: 1.0570, test_loss: 1.0297, test_f1: 0.4747
 epoch: 66, train_loss: 1.0604, test_loss: 1.0428, test_f1: 0.4693
 epoch: 67, train_loss: 1.0605, test_loss: 1.0316, test_f1: 0.4473
 epoch: 68, train_loss: 1.0582, test_loss: 1.0230, test_f1: 0.4498
 epoch: 69, train_loss: 1.0643, test_loss: 1.0288, test_f1: 0.4451
 epoch: 70, train_loss: 1.0622, test_loss: 1.0403, test_f1: 0.4459
 epoch: 71, train_loss: 1.0575, test_loss: 1.0320, test_f1: 0.4440
 epoch: 72, train_loss: 1.0522, test_loss: 1.0409, test_f1: 0.4534
 epoch: 73, train_loss: 1.0583, test_loss: 1.0336, test_f1: 0.4439
 epoch: 74, train_loss: 1.0624, test_loss: 1.0159, test_f1: 0.4602
 epoch: 75, train_loss: 1.0411, test_loss: 1.0293, test_f1: 0.4501
 epoch: 76, train_loss: 1.0526, test_loss: 1.0119, test_f1: 0.4444
 epoch: 77, train_loss: 1.0503, test_loss: 1.0236, test_f1: 0.4697
 epoch: 78, train_loss: 1.0485, test_loss: 1.0169, test_f1: 0.4483
 epoch: 79, train_loss: 1.0424, test_loss: 1.0146, test_f1: 0.4617
 epoch: 80, train_loss: 1.0553, test_loss: 1.0164, test_f1: 0.4487
 epoch: 81, train_loss: 1.0474, test_loss: 1.0137, test_f1: 0.4561
 epoch: 82, train_loss: 1.0466, test_loss: 1.0155, test_f1: 0.4519
 epoch: 83, train_loss: 1.0477, test_loss: 1.0163, test_f1: 0.4549
 epoch: 84, train_loss: 1.0389, test_loss: 1.0103, test_f1: 0.4712
 epoch: 85, train_loss: 1.0413, test_loss: 1.0156, test_f1: 0.4543
 epoch: 86, train_loss: 1.0397, test_loss: 1.0175, test_f1: 0.4598
 epoch: 87, train_loss: 1.0420, test_loss: 1.0051, test_f1: 0.4735
 epoch: 88, train_loss: 1.0345, test_loss: 1.0029, test_f1: 0.4725
 epoch: 89, train_loss: 1.0373, test_loss: 1.0074, test_f1: 0.4609
 epoch: 90, train_loss: 1.0339, test_loss: 1.0214, test_f1: 0.4773
 epoch: 91, train_loss: 1.0324, test_loss: 1.0028, test_f1: 0.4826
 epoch: 92, train_loss: 1.0310, test_loss: 1.0090, test_f1: 0.4708
 epoch: 93, train_loss: 1.0353, test_loss: 1.0185, test_f1: 0.4632
 epoch: 94, train_loss: 1.0347, test_loss: 1.0147, test_f1: 0.4577
 epoch: 95, train_loss: 1.0331, test_loss: 1.0151, test_f1: 0.4511
 epoch: 96, train_loss: 1.0446, test_loss: 1.0020, test_f1: 0.4617
 epoch: 97, train_loss: 1.0237, test_loss: 1.0108, test_f1: 0.4534
 epoch: 98, train_loss: 1.0291, test_loss: 1.0038, test_f1: 0.4633
 epoch: 99, train_loss: 1.0260, test_loss: 1.0035, test_f1: 0.4423
##################ITERATION #2 ****************************************
 epoch: 0, train_loss: 1.3098, test_loss: 1.2878, test_f1: 0.2839
 epoch: 1, train_loss: 1.2785, test_loss: 1.2706, test_f1: 0.2839
 epoch: 2, train_loss: 1.2660, test_loss: 1.2519, test_f1: 0.2926
 epoch: 3, train_loss: 1.2520, test_loss: 1.2363, test_f1: 0.2800
 epoch: 4, train_loss: 1.2395, test_loss: 1.2202, test_f1: 0.2891
 epoch: 5, train_loss: 1.2296, test_loss: 1.2097, test_f1: 0.2983
 epoch: 6, train_loss: 1.2223, test_loss: 1.1930, test_f1: 0.3503
 epoch: 7, train_loss: 1.2175, test_loss: 1.1870, test_f1: 0.3608
 epoch: 8, train_loss: 1.2074, test_loss: 1.1769, test_f1: 0.3843
 epoch: 9, train_loss: 1.1955, test_loss: 1.1689, test_f1: 0.3909
 epoch: 10, train_loss: 1.1911, test_loss: 1.1616, test_f1: 0.4086
 epoch: 11, train_loss: 1.1899, test_loss: 1.1566, test_f1: 0.4110
 epoch: 12, train_loss: 1.1773, test_loss: 1.1402, test_f1: 0.4359
 epoch: 13, train_loss: 1.1704, test_loss: 1.1369, test_f1: 0.4408
 epoch: 14, train_loss: 1.1676, test_loss: 1.1274, test_f1: 0.4256
 epoch: 15, train_loss: 1.1574, test_loss: 1.1231, test_f1: 0.4398
 epoch: 16, train_loss: 1.1512, test_loss: 1.1124, test_f1: 0.4493
 epoch: 17, train_loss: 1.1456, test_loss: 1.1168, test_f1: 0.4339
 epoch: 18, train_loss: 1.1420, test_loss: 1.1057, test_f1: 0.4366
 epoch: 19, train_loss: 1.1371, test_loss: 1.1055, test_f1: 0.4164
 epoch: 20, train_loss: 1.1302, test_loss: 1.0882, test_f1: 0.4505
 epoch: 21, train_loss: 1.1281, test_loss: 1.0837, test_f1: 0.4573
 epoch: 22, train_loss: 1.1243, test_loss: 1.0812, test_f1: 0.4616
 epoch: 23, train_loss: 1.1241, test_loss: 1.0846, test_f1: 0.4479
 epoch: 24, train_loss: 1.1173, test_loss: 1.0766, test_f1: 0.4451
 epoch: 25, train_loss: 1.1094, test_loss: 1.0808, test_f1: 0.4333
 epoch: 26, train_loss: 1.1105, test_loss: 1.0803, test_f1: 0.4406
 epoch: 27, train_loss: 1.1215, test_loss: 1.0647, test_f1: 0.4382
 epoch: 28, train_loss: 1.1102, test_loss: 1.0537, test_f1: 0.4550
 epoch: 29, train_loss: 1.1053, test_loss: 1.0580, test_f1: 0.4499
 epoch: 30, train_loss: 1.0874, test_loss: 1.0573, test_f1: 0.4541
 epoch: 31, train_loss: 1.0912, test_loss: 1.0561, test_f1: 0.4465
 epoch: 32, train_loss: 1.0924, test_loss: 1.0487, test_f1: 0.4543
 epoch: 33, train_loss: 1.0920, test_loss: 1.0473, test_f1: 0.4440
 epoch: 34, train_loss: 1.0841, test_loss: 1.0405, test_f1: 0.4591
 epoch: 35, train_loss: 1.0833, test_loss: 1.0569, test_f1: 0.4464
 epoch: 36, train_loss: 1.0811, test_loss: 1.0384, test_f1: 0.4474
 epoch: 37, train_loss: 1.0795, test_loss: 1.0267, test_f1: 0.4651
 epoch: 38, train_loss: 1.0667, test_loss: 1.0259, test_f1: 0.4617
 epoch: 39, train_loss: 1.0720, test_loss: 1.0398, test_f1: 0.4376
 epoch: 40, train_loss: 1.0627, test_loss: 1.0406, test_f1: 0.4450
 epoch: 41, train_loss: 1.0535, test_loss: 1.0416, test_f1: 0.4513
 epoch: 42, train_loss: 1.0670, test_loss: 1.0512, test_f1: 0.4203
 epoch: 43, train_loss: 1.0601, test_loss: 1.0448, test_f1: 0.4305
 epoch: 44, train_loss: 1.0678, test_loss: 1.0246, test_f1: 0.4462
 epoch: 45, train_loss: 1.0609, test_loss: 1.0391, test_f1: 0.4430
 epoch: 46, train_loss: 1.0623, test_loss: 1.0269, test_f1: 0.4427
 epoch: 47, train_loss: 1.0545, test_loss: 1.0113, test_f1: 0.4536
 epoch: 48, train_loss: 1.0470, test_loss: 1.0117, test_f1: 0.4504
 epoch: 49, train_loss: 1.0474, test_loss: 1.0025, test_f1: 0.4496
 epoch: 50, train_loss: 1.0442, test_loss: 1.0079, test_f1: 0.4408
 epoch: 51, train_loss: 1.0378, test_loss: 1.0025, test_f1: 0.4678
 epoch: 52, train_loss: 1.0359, test_loss: 1.0041, test_f1: 0.4635
 epoch: 53, train_loss: 1.0383, test_loss: 1.0099, test_f1: 0.4472
 epoch: 54, train_loss: 1.0420, test_loss: 1.0381, test_f1: 0.4336
 epoch: 55, train_loss: 1.0368, test_loss: 1.0138, test_f1: 0.4473
 epoch: 56, train_loss: 1.0456, test_loss: 1.0285, test_f1: 0.4356
 epoch: 57, train_loss: 1.0307, test_loss: 1.0224, test_f1: 0.4344
 epoch: 58, train_loss: 1.0399, test_loss: 1.0237, test_f1: 0.4423
 epoch: 59, train_loss: 1.0344, test_loss: 1.0540, test_f1: 0.4243
 epoch: 60, train_loss: 1.0295, test_loss: 1.0168, test_f1: 0.4398
 epoch: 61, train_loss: 1.0444, test_loss: 1.0155, test_f1: 0.4442
 epoch: 62, train_loss: 1.0328, test_loss: 1.0161, test_f1: 0.4391
 epoch: 63, train_loss: 1.0308, test_loss: 1.0100, test_f1: 0.4477
 epoch: 64, train_loss: 1.0265, test_loss: 1.0229, test_f1: 0.4401
 epoch: 65, train_loss: 1.0161, test_loss: 1.0101, test_f1: 0.4355
 epoch: 66, train_loss: 1.0175, test_loss: 1.0170, test_f1: 0.4441
 epoch: 67, train_loss: 1.0284, test_loss: 1.0245, test_f1: 0.4485
 epoch: 68, train_loss: 1.0245, test_loss: 1.0724, test_f1: 0.4270
 epoch: 69, train_loss: 1.0234, test_loss: 1.0262, test_f1: 0.4398
 epoch: 70, train_loss: 1.0340, test_loss: 1.0482, test_f1: 0.4340
 epoch: 71, train_loss: 1.0179, test_loss: 1.0315, test_f1: 0.4333
 epoch: 72, train_loss: 1.0193, test_loss: 1.0358, test_f1: 0.4408
 epoch: 73, train_loss: 1.0245, test_loss: 1.0284, test_f1: 0.4478
 epoch: 74, train_loss: 1.0095, test_loss: 1.0158, test_f1: 0.4494
 epoch: 75, train_loss: 1.0083, test_loss: 1.0020, test_f1: 0.4477
 epoch: 76, train_loss: 1.0164, test_loss: 1.0509, test_f1: 0.4444
 epoch: 77, train_loss: 1.0243, test_loss: 1.0282, test_f1: 0.4468
 epoch: 78, train_loss: 1.0106, test_loss: 1.0135, test_f1: 0.4538
 epoch: 79, train_loss: 1.0197, test_loss: 1.0091, test_f1: 0.4525
 epoch: 80, train_loss: 1.0147, test_loss: 1.0422, test_f1: 0.4402
 epoch: 81, train_loss: 1.0140, test_loss: 1.0145, test_f1: 0.4562
 epoch: 82, train_loss: 1.0152, test_loss: 1.0108, test_f1: 0.4489
 epoch: 83, train_loss: 1.0157, test_loss: 1.0290, test_f1: 0.4460
 epoch: 84, train_loss: 1.0022, test_loss: 1.0027, test_f1: 0.4534
 epoch: 85, train_loss: 1.0179, test_loss: 1.0368, test_f1: 0.4470
 epoch: 86, train_loss: 1.0054, test_loss: 1.0018, test_f1: 0.4625
 epoch: 87, train_loss: 1.0124, test_loss: 0.9937, test_f1: 0.4704
 epoch: 88, train_loss: 1.0125, test_loss: 1.0212, test_f1: 0.4532
 epoch: 89, train_loss: 1.0093, test_loss: 1.0255, test_f1: 0.4445
 epoch: 90, train_loss: 1.0117, test_loss: 1.0080, test_f1: 0.4509
 epoch: 91, train_loss: 1.0082, test_loss: 1.0335, test_f1: 0.4406
 epoch: 92, train_loss: 1.0016, test_loss: 1.0370, test_f1: 0.4562
 epoch: 93, train_loss: 1.0063, test_loss: 1.0273, test_f1: 0.4643
 epoch: 94, train_loss: 0.9974, test_loss: 1.0277, test_f1: 0.4464
 epoch: 95, train_loss: 0.9994, test_loss: 1.0459, test_f1: 0.4461
 epoch: 96, train_loss: 0.9976, test_loss: 1.0078, test_f1: 0.4414
 epoch: 97, train_loss: 0.9937, test_loss: 1.0683, test_f1: 0.4315
 epoch: 98, train_loss: 1.0033, test_loss: 1.1246, test_f1: 0.4482
 epoch: 99, train_loss: 1.0045, test_loss: 1.0099, test_f1: 0.4452
##################ITERATION #3 ****************************************
 epoch: 0, train_loss: 1.3126, test_loss: 1.2944, test_f1: 0.2327
 epoch: 1, train_loss: 1.2712, test_loss: 1.2726, test_f1: 0.2402
 epoch: 2, train_loss: 1.2598, test_loss: 1.2556, test_f1: 0.2399
 epoch: 3, train_loss: 1.2521, test_loss: 1.2456, test_f1: 0.2475
 epoch: 4, train_loss: 1.2438, test_loss: 1.2279, test_f1: 0.2547
 epoch: 5, train_loss: 1.2319, test_loss: 1.2147, test_f1: 0.2899
 epoch: 6, train_loss: 1.2238, test_loss: 1.2059, test_f1: 0.3076
 epoch: 7, train_loss: 1.2136, test_loss: 1.2022, test_f1: 0.3371
 epoch: 8, train_loss: 1.2099, test_loss: 1.1828, test_f1: 0.3707
 epoch: 9, train_loss: 1.1997, test_loss: 1.1774, test_f1: 0.3916
 epoch: 10, train_loss: 1.1980, test_loss: 1.1712, test_f1: 0.4036
 epoch: 11, train_loss: 1.1882, test_loss: 1.1630, test_f1: 0.3972
 epoch: 12, train_loss: 1.1830, test_loss: 1.1507, test_f1: 0.3995
 epoch: 13, train_loss: 1.1678, test_loss: 1.1440, test_f1: 0.4050
 epoch: 14, train_loss: 1.1714, test_loss: 1.1315, test_f1: 0.4023
 epoch: 15, train_loss: 1.1661, test_loss: 1.1497, test_f1: 0.4060
 epoch: 16, train_loss: 1.1587, test_loss: 1.1277, test_f1: 0.4078
 epoch: 17, train_loss: 1.1561, test_loss: 1.1231, test_f1: 0.4248
 epoch: 18, train_loss: 1.1547, test_loss: 1.1208, test_f1: 0.4176
 epoch: 19, train_loss: 1.1498, test_loss: 1.1070, test_f1: 0.4211
 epoch: 20, train_loss: 1.1444, test_loss: 1.1000, test_f1: 0.4302
 epoch: 21, train_loss: 1.1454, test_loss: 1.0977, test_f1: 0.4288
 epoch: 22, train_loss: 1.1394, test_loss: 1.0897, test_f1: 0.4325
 epoch: 23, train_loss: 1.1338, test_loss: 1.0921, test_f1: 0.4259
 epoch: 24, train_loss: 1.1217, test_loss: 1.0838, test_f1: 0.4297
 epoch: 25, train_loss: 1.1260, test_loss: 1.0824, test_f1: 0.4374
 epoch: 26, train_loss: 1.1280, test_loss: 1.0720, test_f1: 0.4378
 epoch: 27, train_loss: 1.1161, test_loss: 1.0688, test_f1: 0.4445
 epoch: 28, train_loss: 1.1077, test_loss: 1.0592, test_f1: 0.4383
 epoch: 29, train_loss: 1.1027, test_loss: 1.0491, test_f1: 0.4499
 epoch: 30, train_loss: 1.1096, test_loss: 1.0490, test_f1: 0.4388
 epoch: 31, train_loss: 1.0976, test_loss: 1.0502, test_f1: 0.4491
 epoch: 32, train_loss: 1.0960, test_loss: 1.0396, test_f1: 0.4580
 epoch: 33, train_loss: 1.0993, test_loss: 1.0416, test_f1: 0.4578
 epoch: 34, train_loss: 1.0868, test_loss: 1.0383, test_f1: 0.4397
 epoch: 35, train_loss: 1.0925, test_loss: 1.0217, test_f1: 0.4731
 epoch: 36, train_loss: 1.0870, test_loss: 1.0264, test_f1: 0.4469
 epoch: 37, train_loss: 1.0789, test_loss: 1.0188, test_f1: 0.4564
 epoch: 38, train_loss: 1.0785, test_loss: 1.0157, test_f1: 0.4659
 epoch: 39, train_loss: 1.0737, test_loss: 1.0098, test_f1: 0.4618
 epoch: 40, train_loss: 1.0762, test_loss: 1.0096, test_f1: 0.4537
 epoch: 41, train_loss: 1.0682, test_loss: 1.0105, test_f1: 0.4632
 epoch: 42, train_loss: 1.0622, test_loss: 1.0017, test_f1: 0.4805
 epoch: 43, train_loss: 1.0592, test_loss: 1.0131, test_f1: 0.4739
 epoch: 44, train_loss: 1.0644, test_loss: 0.9905, test_f1: 0.4741
 epoch: 45, train_loss: 1.0473, test_loss: 0.9934, test_f1: 0.4663
 epoch: 46, train_loss: 1.0472, test_loss: 1.0125, test_f1: 0.4560
 epoch: 47, train_loss: 1.0509, test_loss: 0.9874, test_f1: 0.4761
 epoch: 48, train_loss: 1.0515, test_loss: 0.9933, test_f1: 0.4606
 epoch: 49, train_loss: 1.0401, test_loss: 1.0087, test_f1: 0.4793
 epoch: 50, train_loss: 1.0399, test_loss: 1.0219, test_f1: 0.4611
 epoch: 51, train_loss: 1.0305, test_loss: 0.9913, test_f1: 0.4793
 epoch: 52, train_loss: 1.0289, test_loss: 1.0032, test_f1: 0.4685
 epoch: 53, train_loss: 1.0304, test_loss: 0.9801, test_f1: 0.4796
 epoch: 54, train_loss: 1.0368, test_loss: 0.9960, test_f1: 0.4750
 epoch: 55, train_loss: 1.0323, test_loss: 1.0818, test_f1: 0.4559
 epoch: 56, train_loss: 1.0319, test_loss: 1.0406, test_f1: 0.4681
 epoch: 57, train_loss: 1.0217, test_loss: 1.0074, test_f1: 0.4746
 epoch: 58, train_loss: 1.0219, test_loss: 1.0326, test_f1: 0.4673
 epoch: 59, train_loss: 1.0241, test_loss: 0.9729, test_f1: 0.4664
 epoch: 60, train_loss: 1.0238, test_loss: 1.1348, test_f1: 0.4522
 epoch: 61, train_loss: 1.0234, test_loss: 1.0572, test_f1: 0.4672
 epoch: 62, train_loss: 1.0207, test_loss: 1.0751, test_f1: 0.4647
 epoch: 63, train_loss: 1.0154, test_loss: 0.9898, test_f1: 0.4743
 epoch: 64, train_loss: 1.0193, test_loss: 0.9699, test_f1: 0.4840
 epoch: 65, train_loss: 1.0163, test_loss: 0.9680, test_f1: 0.5049
 epoch: 66, train_loss: 1.0079, test_loss: 1.1578, test_f1: 0.4757
 epoch: 67, train_loss: 1.0185, test_loss: 1.0050, test_f1: 0.4707
 epoch: 68, train_loss: 1.0102, test_loss: 1.2078, test_f1: 0.4710
 epoch: 69, train_loss: 1.0094, test_loss: 1.2340, test_f1: 0.4765
 epoch: 70, train_loss: 0.9993, test_loss: 1.1530, test_f1: 0.4718
 epoch: 71, train_loss: 1.0143, test_loss: 0.9967, test_f1: 0.4761
 epoch: 72, train_loss: 1.0053, test_loss: 1.0711, test_f1: 0.4783
 epoch: 73, train_loss: 1.0151, test_loss: 1.1117, test_f1: 0.4760
 epoch: 74, train_loss: 0.9993, test_loss: 0.9689, test_f1: 0.4836
 epoch: 75, train_loss: 0.9919, test_loss: 1.1096, test_f1: 0.4681
 epoch: 76, train_loss: 1.0134, test_loss: 1.0362, test_f1: 0.4678
 epoch: 77, train_loss: 1.0038, test_loss: 1.0124, test_f1: 0.4796
 epoch: 78, train_loss: 0.9991, test_loss: 0.9788, test_f1: 0.4720
 epoch: 79, train_loss: 0.9947, test_loss: 1.1211, test_f1: 0.4754
 epoch: 80, train_loss: 0.9858, test_loss: 1.0568, test_f1: 0.4767
 epoch: 81, train_loss: 0.9919, test_loss: 1.0651, test_f1: 0.4752
 epoch: 82, train_loss: 0.9950, test_loss: 0.9896, test_f1: 0.4728
 epoch: 83, train_loss: 1.0078, test_loss: 0.9474, test_f1: 0.4911
 epoch: 84, train_loss: 0.9953, test_loss: 0.9737, test_f1: 0.4805
 epoch: 85, train_loss: 1.0016, test_loss: 0.9439, test_f1: 0.4950
 epoch: 86, train_loss: 0.9824, test_loss: 0.9380, test_f1: 0.4881
 epoch: 87, train_loss: 0.9892, test_loss: 1.0529, test_f1: 0.4732
 epoch: 88, train_loss: 0.9915, test_loss: 1.0090, test_f1: 0.4701
 epoch: 89, train_loss: 0.9807, test_loss: 1.0153, test_f1: 0.4818
 epoch: 90, train_loss: 0.9898, test_loss: 1.1466, test_f1: 0.4914
 epoch: 91, train_loss: 0.9839, test_loss: 1.1638, test_f1: 0.5018
 epoch: 92, train_loss: 0.9864, test_loss: 1.0533, test_f1: 0.4821
 epoch: 93, train_loss: 0.9846, test_loss: 1.0292, test_f1: 0.4754
 epoch: 94, train_loss: 0.9856, test_loss: 1.0625, test_f1: 0.4804
 epoch: 95, train_loss: 0.9809, test_loss: 0.9918, test_f1: 0.4805
 epoch: 96, train_loss: 0.9817, test_loss: 1.1656, test_f1: 0.4970
 epoch: 97, train_loss: 0.9833, test_loss: 1.1674, test_f1: 0.4858
 epoch: 98, train_loss: 0.9821, test_loss: 1.0725, test_f1: 0.4912
 epoch: 99, train_loss: 0.9759, test_loss: 1.0449, test_f1: 0.4874
##################ITERATION #4 ****************************************
 epoch: 0, train_loss: 1.2932, test_loss: 1.2609, test_f1: 0.2614
 epoch: 1, train_loss: 1.2583, test_loss: 1.2360, test_f1: 0.2624
 epoch: 2, train_loss: 1.2467, test_loss: 1.2229, test_f1: 0.2548
 epoch: 3, train_loss: 1.2389, test_loss: 1.2114, test_f1: 0.2742
 epoch: 4, train_loss: 1.2286, test_loss: 1.2012, test_f1: 0.2936
 epoch: 5, train_loss: 1.2230, test_loss: 1.1906, test_f1: 0.3150
 epoch: 6, train_loss: 1.2155, test_loss: 1.1755, test_f1: 0.3699
 epoch: 7, train_loss: 1.2065, test_loss: 1.1673, test_f1: 0.3792
 epoch: 8, train_loss: 1.2029, test_loss: 1.1600, test_f1: 0.3914
 epoch: 9, train_loss: 1.2022, test_loss: 1.1544, test_f1: 0.4145
 epoch: 10, train_loss: 1.1896, test_loss: 1.1457, test_f1: 0.4340
 epoch: 11, train_loss: 1.1870, test_loss: 1.1419, test_f1: 0.4218
 epoch: 12, train_loss: 1.1800, test_loss: 1.1327, test_f1: 0.4243
 epoch: 13, train_loss: 1.1670, test_loss: 1.1347, test_f1: 0.4226
 epoch: 14, train_loss: 1.1664, test_loss: 1.1222, test_f1: 0.4448
 epoch: 15, train_loss: 1.1629, test_loss: 1.1118, test_f1: 0.4370
 epoch: 16, train_loss: 1.1583, test_loss: 1.1169, test_f1: 0.4385
 epoch: 17, train_loss: 1.1582, test_loss: 1.1096, test_f1: 0.4195
 epoch: 18, train_loss: 1.1465, test_loss: 1.1010, test_f1: 0.4322
 epoch: 19, train_loss: 1.1478, test_loss: 1.0983, test_f1: 0.4608
 epoch: 20, train_loss: 1.1424, test_loss: 1.0975, test_f1: 0.4605
 epoch: 21, train_loss: 1.1394, test_loss: 1.0888, test_f1: 0.4543
 epoch: 22, train_loss: 1.1327, test_loss: 1.0891, test_f1: 0.4392
 epoch: 23, train_loss: 1.1339, test_loss: 1.0830, test_f1: 0.4428
 epoch: 24, train_loss: 1.1256, test_loss: 1.0849, test_f1: 0.4410
 epoch: 25, train_loss: 1.1219, test_loss: 1.0797, test_f1: 0.4530
 epoch: 26, train_loss: 1.1068, test_loss: 1.0723, test_f1: 0.4589
 epoch: 27, train_loss: 1.1167, test_loss: 1.0794, test_f1: 0.4486
 epoch: 28, train_loss: 1.1069, test_loss: 1.0675, test_f1: 0.4640
 epoch: 29, train_loss: 1.0996, test_loss: 1.0736, test_f1: 0.4366
 epoch: 30, train_loss: 1.1038, test_loss: 1.0631, test_f1: 0.4484
 epoch: 31, train_loss: 1.1009, test_loss: 1.0674, test_f1: 0.4488
 epoch: 32, train_loss: 1.0926, test_loss: 1.0609, test_f1: 0.4490
 epoch: 33, train_loss: 1.1073, test_loss: 1.0646, test_f1: 0.4373
 epoch: 34, train_loss: 1.0837, test_loss: 1.0566, test_f1: 0.4315
 epoch: 35, train_loss: 1.0844, test_loss: 1.0479, test_f1: 0.4336
 epoch: 36, train_loss: 1.0805, test_loss: 1.0446, test_f1: 0.4308
 epoch: 37, train_loss: 1.0885, test_loss: 1.0439, test_f1: 0.4446
 epoch: 38, train_loss: 1.0779, test_loss: 1.0428, test_f1: 0.4825
 epoch: 39, train_loss: 1.0849, test_loss: 1.0365, test_f1: 0.4599
 epoch: 40, train_loss: 1.0681, test_loss: 1.0429, test_f1: 0.4480
 epoch: 41, train_loss: 1.0695, test_loss: 1.0340, test_f1: 0.4429
 epoch: 42, train_loss: 1.0751, test_loss: 1.0268, test_f1: 0.4627
 epoch: 43, train_loss: 1.0654, test_loss: 1.0298, test_f1: 0.4310
 epoch: 44, train_loss: 1.0614, test_loss: 1.0289, test_f1: 0.4609
 epoch: 45, train_loss: 1.0545, test_loss: 1.0297, test_f1: 0.4530
 epoch: 46, train_loss: 1.0486, test_loss: 1.0401, test_f1: 0.4443
 epoch: 47, train_loss: 1.0558, test_loss: 1.0302, test_f1: 0.4500
 epoch: 48, train_loss: 1.0471, test_loss: 1.0225, test_f1: 0.4280
 epoch: 49, train_loss: 1.0399, test_loss: 1.0248, test_f1: 0.4373
 epoch: 50, train_loss: 1.0429, test_loss: 1.0290, test_f1: 0.4354
 epoch: 51, train_loss: 1.0401, test_loss: 1.0282, test_f1: 0.4409
 epoch: 52, train_loss: 1.0369, test_loss: 1.0224, test_f1: 0.4421
 epoch: 53, train_loss: 1.0304, test_loss: 1.0172, test_f1: 0.4421
 epoch: 54, train_loss: 1.0316, test_loss: 1.0168, test_f1: 0.4300
 epoch: 55, train_loss: 1.0336, test_loss: 1.0313, test_f1: 0.4236
 epoch: 56, train_loss: 1.0313, test_loss: 1.0174, test_f1: 0.4533
 epoch: 57, train_loss: 1.0268, test_loss: 1.0235, test_f1: 0.4291
 epoch: 58, train_loss: 1.0354, test_loss: 1.0285, test_f1: 0.4166
 epoch: 59, train_loss: 1.0349, test_loss: 1.0185, test_f1: 0.4250
 epoch: 60, train_loss: 1.0316, test_loss: 1.0219, test_f1: 0.4340
 epoch: 61, train_loss: 1.0230, test_loss: 1.0166, test_f1: 0.4565
 epoch: 62, train_loss: 1.0233, test_loss: 1.0262, test_f1: 0.4314
 epoch: 63, train_loss: 1.0162, test_loss: 1.0077, test_f1: 0.4560
 epoch: 64, train_loss: 1.0207, test_loss: 1.0179, test_f1: 0.4350
 epoch: 65, train_loss: 1.0208, test_loss: 1.0164, test_f1: 0.4485
 epoch: 66, train_loss: 1.0215, test_loss: 1.0077, test_f1: 0.4366
 epoch: 67, train_loss: 1.0187, test_loss: 1.0043, test_f1: 0.4399
 epoch: 68, train_loss: 1.0170, test_loss: 1.0186, test_f1: 0.4267
 epoch: 69, train_loss: 1.0178, test_loss: 1.0109, test_f1: 0.4415
 epoch: 70, train_loss: 1.0225, test_loss: 1.0211, test_f1: 0.4258
 epoch: 71, train_loss: 1.0054, test_loss: 1.0183, test_f1: 0.4477
 epoch: 72, train_loss: 1.0111, test_loss: 1.0075, test_f1: 0.4572
 epoch: 73, train_loss: 1.0155, test_loss: 1.0191, test_f1: 0.4378
 epoch: 74, train_loss: 1.0124, test_loss: 1.0264, test_f1: 0.4456
 epoch: 75, train_loss: 1.0081, test_loss: 1.0078, test_f1: 0.4418
 epoch: 76, train_loss: 1.0095, test_loss: 1.0091, test_f1: 0.4365
 epoch: 77, train_loss: 1.0093, test_loss: 1.0074, test_f1: 0.4614
 epoch: 78, train_loss: 1.0156, test_loss: 1.0159, test_f1: 0.4643
 epoch: 79, train_loss: 1.0146, test_loss: 1.0195, test_f1: 0.4534
 epoch: 80, train_loss: 1.0064, test_loss: 1.0161, test_f1: 0.4369
 epoch: 81, train_loss: 1.0135, test_loss: 0.9996, test_f1: 0.4704
 epoch: 82, train_loss: 0.9982, test_loss: 1.0019, test_f1: 0.4386
 epoch: 83, train_loss: 1.0076, test_loss: 0.9858, test_f1: 0.4548
 epoch: 84, train_loss: 1.0045, test_loss: 1.0077, test_f1: 0.4509
 epoch: 85, train_loss: 1.0018, test_loss: 1.0043, test_f1: 0.4429
 epoch: 86, train_loss: 0.9992, test_loss: 1.0029, test_f1: 0.4396
 epoch: 87, train_loss: 0.9953, test_loss: 1.0188, test_f1: 0.4535
 epoch: 88, train_loss: 1.0033, test_loss: 1.0050, test_f1: 0.4588
 epoch: 89, train_loss: 0.9989, test_loss: 1.0155, test_f1: 0.4567
 epoch: 90, train_loss: 1.0050, test_loss: 1.0151, test_f1: 0.4740
 epoch: 91, train_loss: 0.9928, test_loss: 1.0143, test_f1: 0.4459
 epoch: 92, train_loss: 0.9924, test_loss: 1.0071, test_f1: 0.4499
 epoch: 93, train_loss: 0.9926, test_loss: 1.0052, test_f1: 0.4543
 epoch: 94, train_loss: 0.9942, test_loss: 1.0110, test_f1: 0.4671
 epoch: 95, train_loss: 0.9961, test_loss: 1.0071, test_f1: 0.4437
 epoch: 96, train_loss: 0.9824, test_loss: 1.0009, test_f1: 0.4771
 epoch: 97, train_loss: 0.9831, test_loss: 0.9952, test_f1: 0.4686
 epoch: 98, train_loss: 0.9817, test_loss: 1.0218, test_f1: 0.4658
 epoch: 99, train_loss: 0.9853, test_loss: 1.0206, test_f1: 0.4546
##################ITERATION #5 ****************************************
 epoch: 0, train_loss: 1.2938, test_loss: 1.2519, test_f1: 0.2343
 epoch: 1, train_loss: 1.2546, test_loss: 1.2350, test_f1: 0.3134
 epoch: 2, train_loss: 1.2385, test_loss: 1.2254, test_f1: 0.3100
 epoch: 3, train_loss: 1.2332, test_loss: 1.2082, test_f1: 0.3467
 epoch: 4, train_loss: 1.2328, test_loss: 1.2127, test_f1: 0.3710
 epoch: 5, train_loss: 1.2198, test_loss: 1.1936, test_f1: 0.3968
 epoch: 6, train_loss: 1.2130, test_loss: 1.1770, test_f1: 0.4056
 epoch: 7, train_loss: 1.2108, test_loss: 1.1714, test_f1: 0.4013
 epoch: 8, train_loss: 1.2052, test_loss: 1.1591, test_f1: 0.4285
 epoch: 9, train_loss: 1.2022, test_loss: 1.1700, test_f1: 0.4275
 epoch: 10, train_loss: 1.2029, test_loss: 1.1504, test_f1: 0.4278
 epoch: 11, train_loss: 1.1881, test_loss: 1.1491, test_f1: 0.4424
 epoch: 12, train_loss: 1.1836, test_loss: 1.1536, test_f1: 0.4437
 epoch: 13, train_loss: 1.1788, test_loss: 1.1588, test_f1: 0.4277
 epoch: 14, train_loss: 1.1784, test_loss: 1.1220, test_f1: 0.4387
 epoch: 15, train_loss: 1.1692, test_loss: 1.1178, test_f1: 0.4392
 epoch: 16, train_loss: 1.1748, test_loss: 1.1039, test_f1: 0.4648
 epoch: 17, train_loss: 1.1757, test_loss: 1.0995, test_f1: 0.4513
 epoch: 18, train_loss: 1.1630, test_loss: 1.0999, test_f1: 0.4730
 epoch: 19, train_loss: 1.1663, test_loss: 1.0954, test_f1: 0.4729
 epoch: 20, train_loss: 1.1525, test_loss: 1.0933, test_f1: 0.4676
 epoch: 21, train_loss: 1.1612, test_loss: 1.0879, test_f1: 0.4665
 epoch: 22, train_loss: 1.1530, test_loss: 1.0835, test_f1: 0.4573
 epoch: 23, train_loss: 1.1504, test_loss: 1.1067, test_f1: 0.4430
 epoch: 24, train_loss: 1.1404, test_loss: 1.0721, test_f1: 0.4657
 epoch: 25, train_loss: 1.1458, test_loss: 1.0804, test_f1: 0.4499
 epoch: 26, train_loss: 1.1303, test_loss: 1.0720, test_f1: 0.4668
 epoch: 27, train_loss: 1.1369, test_loss: 1.0755, test_f1: 0.4462
 epoch: 28, train_loss: 1.1406, test_loss: 1.0701, test_f1: 0.4593
 epoch: 29, train_loss: 1.1458, test_loss: 1.0580, test_f1: 0.4640
 epoch: 30, train_loss: 1.1287, test_loss: 1.0652, test_f1: 0.4712
 epoch: 31, train_loss: 1.1195, test_loss: 1.0497, test_f1: 0.4686
 epoch: 32, train_loss: 1.1161, test_loss: 1.0653, test_f1: 0.4386
 epoch: 33, train_loss: 1.1169, test_loss: 1.0502, test_f1: 0.4651
 epoch: 34, train_loss: 1.1083, test_loss: 1.0479, test_f1: 0.4543
 epoch: 35, train_loss: 1.1034, test_loss: 1.0436, test_f1: 0.4625
 epoch: 36, train_loss: 1.1037, test_loss: 1.0383, test_f1: 0.4682
 epoch: 37, train_loss: 1.1056, test_loss: 1.0339, test_f1: 0.4695
 epoch: 38, train_loss: 1.1090, test_loss: 1.0391, test_f1: 0.4614
 epoch: 39, train_loss: 1.1078, test_loss: 1.0276, test_f1: 0.4726
 epoch: 40, train_loss: 1.0970, test_loss: 1.0414, test_f1: 0.4647
 epoch: 41, train_loss: 1.1085, test_loss: 1.0216, test_f1: 0.4738
 epoch: 42, train_loss: 1.0879, test_loss: 1.0212, test_f1: 0.4729
 epoch: 43, train_loss: 1.0861, test_loss: 1.0252, test_f1: 0.4792
 epoch: 44, train_loss: 1.0941, test_loss: 1.0176, test_f1: 0.4768
 epoch: 45, train_loss: 1.0789, test_loss: 1.0287, test_f1: 0.4735
 epoch: 46, train_loss: 1.0805, test_loss: 1.0125, test_f1: 0.4712
 epoch: 47, train_loss: 1.0784, test_loss: 1.0148, test_f1: 0.4654
 epoch: 48, train_loss: 1.0811, test_loss: 1.0150, test_f1: 0.4639
 epoch: 49, train_loss: 1.0738, test_loss: 1.0248, test_f1: 0.4602
 epoch: 50, train_loss: 1.0670, test_loss: 1.0077, test_f1: 0.4763
 epoch: 51, train_loss: 1.0597, test_loss: 1.0110, test_f1: 0.4612
 epoch: 52, train_loss: 1.0636, test_loss: 1.0134, test_f1: 0.4655
 epoch: 53, train_loss: 1.0680, test_loss: 1.0007, test_f1: 0.4758
 epoch: 54, train_loss: 1.0707, test_loss: 1.0030, test_f1: 0.4738
 epoch: 55, train_loss: 1.0621, test_loss: 1.0083, test_f1: 0.4676
 epoch: 56, train_loss: 1.0612, test_loss: 1.0095, test_f1: 0.4706
 epoch: 57, train_loss: 1.0576, test_loss: 1.0003, test_f1: 0.4691
 epoch: 58, train_loss: 1.0636, test_loss: 1.0034, test_f1: 0.4642
 epoch: 59, train_loss: 1.0670, test_loss: 0.9973, test_f1: 0.4759
 epoch: 60, train_loss: 1.0542, test_loss: 1.0118, test_f1: 0.4768
 epoch: 61, train_loss: 1.0569, test_loss: 1.0090, test_f1: 0.4647
 epoch: 62, train_loss: 1.0541, test_loss: 1.0110, test_f1: 0.4650
 epoch: 63, train_loss: 1.0624, test_loss: 1.0072, test_f1: 0.4700
 epoch: 64, train_loss: 1.0497, test_loss: 1.0007, test_f1: 0.4640
 epoch: 65, train_loss: 1.0529, test_loss: 1.0007, test_f1: 0.4796
 epoch: 66, train_loss: 1.0568, test_loss: 1.0077, test_f1: 0.4676
 epoch: 67, train_loss: 1.0531, test_loss: 0.9925, test_f1: 0.4710
 epoch: 68, train_loss: 1.0471, test_loss: 0.9905, test_f1: 0.4822
 epoch: 69, train_loss: 1.0542, test_loss: 0.9959, test_f1: 0.4727
 epoch: 70, train_loss: 1.0470, test_loss: 0.9891, test_f1: 0.4773
 epoch: 71, train_loss: 1.0442, test_loss: 0.9973, test_f1: 0.4659
 epoch: 72, train_loss: 1.0405, test_loss: 1.0030, test_f1: 0.4793
 epoch: 73, train_loss: 1.0446, test_loss: 0.9930, test_f1: 0.4711
 epoch: 74, train_loss: 1.0373, test_loss: 0.9945, test_f1: 0.4745
 epoch: 75, train_loss: 1.0501, test_loss: 0.9892, test_f1: 0.4719
 epoch: 76, train_loss: 1.0418, test_loss: 0.9911, test_f1: 0.4652
 epoch: 77, train_loss: 1.0421, test_loss: 0.9938, test_f1: 0.4714
 epoch: 78, train_loss: 1.0408, test_loss: 1.0010, test_f1: 0.4696
 epoch: 79, train_loss: 1.0398, test_loss: 0.9872, test_f1: 0.4750
 epoch: 80, train_loss: 1.0380, test_loss: 0.9873, test_f1: 0.4727
 epoch: 81, train_loss: 1.0456, test_loss: 0.9926, test_f1: 0.4749
 epoch: 82, train_loss: 1.0416, test_loss: 0.9908, test_f1: 0.4722
 epoch: 83, train_loss: 1.0344, test_loss: 1.0083, test_f1: 0.4603
 epoch: 84, train_loss: 1.0273, test_loss: 0.9697, test_f1: 0.4850
 epoch: 85, train_loss: 1.0277, test_loss: 1.0049, test_f1: 0.4596
 epoch: 86, train_loss: 1.0254, test_loss: 0.9803, test_f1: 0.4721
 epoch: 87, train_loss: 1.0331, test_loss: 0.9804, test_f1: 0.4717
 epoch: 88, train_loss: 1.0337, test_loss: 0.9772, test_f1: 0.4827
 epoch: 89, train_loss: 1.0255, test_loss: 0.9803, test_f1: 0.4740
 epoch: 90, train_loss: 1.0328, test_loss: 0.9854, test_f1: 0.4677
 epoch: 91, train_loss: 1.0331, test_loss: 0.9882, test_f1: 0.4709
 epoch: 92, train_loss: 1.0329, test_loss: 0.9734, test_f1: 0.4842
 epoch: 93, train_loss: 1.0287, test_loss: 0.9836, test_f1: 0.4656
 epoch: 94, train_loss: 1.0241, test_loss: 0.9832, test_f1: 0.4677
 epoch: 95, train_loss: 1.0056, test_loss: 0.9840, test_f1: 0.4704
 epoch: 96, train_loss: 1.0354, test_loss: 0.9929, test_f1: 0.4773
 epoch: 97, train_loss: 1.0193, test_loss: 0.9671, test_f1: 0.4760
 epoch: 98, train_loss: 1.0273, test_loss: 0.9933, test_f1: 0.4904
 epoch: 99, train_loss: 1.0171, test_loss: 0.9806, test_f1: 0.4746
##################ITERATION #6 ****************************************
 epoch: 0, train_loss: 1.3114, test_loss: 1.2427, test_f1: 0.2594
 epoch: 1, train_loss: 1.2640, test_loss: 1.2230, test_f1: 0.2613
 epoch: 2, train_loss: 1.2506, test_loss: 1.2112, test_f1: 0.2910
 epoch: 3, train_loss: 1.2485, test_loss: 1.2020, test_f1: 0.3338
 epoch: 4, train_loss: 1.2403, test_loss: 1.1942, test_f1: 0.3568
 epoch: 5, train_loss: 1.2226, test_loss: 1.1846, test_f1: 0.3941
 epoch: 6, train_loss: 1.2225, test_loss: 1.1746, test_f1: 0.3768
 epoch: 7, train_loss: 1.2075, test_loss: 1.1731, test_f1: 0.4044
 epoch: 8, train_loss: 1.2067, test_loss: 1.1653, test_f1: 0.3931
 epoch: 9, train_loss: 1.1890, test_loss: 1.1565, test_f1: 0.4037
 epoch: 10, train_loss: 1.1994, test_loss: 1.1522, test_f1: 0.4049
 epoch: 11, train_loss: 1.1945, test_loss: 1.1524, test_f1: 0.4334
 epoch: 12, train_loss: 1.1815, test_loss: 1.1469, test_f1: 0.4368
 epoch: 13, train_loss: 1.1845, test_loss: 1.1400, test_f1: 0.4588
 epoch: 14, train_loss: 1.1790, test_loss: 1.1425, test_f1: 0.4208
 epoch: 15, train_loss: 1.1763, test_loss: 1.1337, test_f1: 0.4410
 epoch: 16, train_loss: 1.1658, test_loss: 1.1329, test_f1: 0.4367
 epoch: 17, train_loss: 1.1711, test_loss: 1.1335, test_f1: 0.4302
 epoch: 18, train_loss: 1.1526, test_loss: 1.1251, test_f1: 0.4403
 epoch: 19, train_loss: 1.1544, test_loss: 1.1155, test_f1: 0.4399
 epoch: 20, train_loss: 1.1572, test_loss: 1.1166, test_f1: 0.4235
 epoch: 21, train_loss: 1.1521, test_loss: 1.1129, test_f1: 0.4440
 epoch: 22, train_loss: 1.1499, test_loss: 1.1121, test_f1: 0.4450
 epoch: 23, train_loss: 1.1460, test_loss: 1.1002, test_f1: 0.4443
 epoch: 24, train_loss: 1.1416, test_loss: 1.1128, test_f1: 0.4313
 epoch: 25, train_loss: 1.1450, test_loss: 1.1109, test_f1: 0.4306
 epoch: 26, train_loss: 1.1395, test_loss: 1.0999, test_f1: 0.4599
 epoch: 27, train_loss: 1.1309, test_loss: 1.0954, test_f1: 0.4426
 epoch: 28, train_loss: 1.1364, test_loss: 1.0915, test_f1: 0.4605
 epoch: 29, train_loss: 1.1305, test_loss: 1.0943, test_f1: 0.4385
 epoch: 30, train_loss: 1.1223, test_loss: 1.0917, test_f1: 0.4379
 epoch: 31, train_loss: 1.1156, test_loss: 1.0849, test_f1: 0.4466
 epoch: 32, train_loss: 1.1317, test_loss: 1.0867, test_f1: 0.4552
 epoch: 33, train_loss: 1.1179, test_loss: 1.0789, test_f1: 0.4677
 epoch: 34, train_loss: 1.1098, test_loss: 1.0740, test_f1: 0.4380
 epoch: 35, train_loss: 1.1189, test_loss: 1.0666, test_f1: 0.4639
 epoch: 36, train_loss: 1.1096, test_loss: 1.0747, test_f1: 0.4588
 epoch: 37, train_loss: 1.1097, test_loss: 1.0670, test_f1: 0.4563
 epoch: 38, train_loss: 1.1020, test_loss: 1.0589, test_f1: 0.4865
 epoch: 39, train_loss: 1.0963, test_loss: 1.0611, test_f1: 0.4518
 epoch: 40, train_loss: 1.0954, test_loss: 1.0653, test_f1: 0.4607
 epoch: 41, train_loss: 1.1013, test_loss: 1.0639, test_f1: 0.4847
 epoch: 42, train_loss: 1.0974, test_loss: 1.0691, test_f1: 0.4678
 epoch: 43, train_loss: 1.0903, test_loss: 1.0525, test_f1: 0.4564
 epoch: 44, train_loss: 1.0942, test_loss: 1.0478, test_f1: 0.4487
 epoch: 45, train_loss: 1.0893, test_loss: 1.0641, test_f1: 0.4609
 epoch: 46, train_loss: 1.0781, test_loss: 1.0437, test_f1: 0.4709
 epoch: 47, train_loss: 1.0794, test_loss: 1.0336, test_f1: 0.4692
 epoch: 48, train_loss: 1.0714, test_loss: 1.0298, test_f1: 0.4707
 epoch: 49, train_loss: 1.0705, test_loss: 1.0273, test_f1: 0.4661
 epoch: 50, train_loss: 1.0700, test_loss: 1.0289, test_f1: 0.4682
 epoch: 51, train_loss: 1.0692, test_loss: 1.0383, test_f1: 0.4737
 epoch: 52, train_loss: 1.0734, test_loss: 1.0487, test_f1: 0.4645
 epoch: 53, train_loss: 1.0632, test_loss: 1.0212, test_f1: 0.4886
 epoch: 54, train_loss: 1.0636, test_loss: 1.0455, test_f1: 0.4660
 epoch: 55, train_loss: 1.0605, test_loss: 1.0351, test_f1: 0.4745
 epoch: 56, train_loss: 1.0671, test_loss: 1.0302, test_f1: 0.4732
 epoch: 57, train_loss: 1.0592, test_loss: 1.0282, test_f1: 0.4745
 epoch: 58, train_loss: 1.0618, test_loss: 1.0112, test_f1: 0.4713
 epoch: 59, train_loss: 1.0667, test_loss: 1.0209, test_f1: 0.4630
 epoch: 60, train_loss: 1.0550, test_loss: 1.0153, test_f1: 0.4745
 epoch: 61, train_loss: 1.0577, test_loss: 1.0259, test_f1: 0.4687
 epoch: 62, train_loss: 1.0585, test_loss: 1.0134, test_f1: 0.4793
 epoch: 63, train_loss: 1.0513, test_loss: 1.0209, test_f1: 0.4702
 epoch: 64, train_loss: 1.0571, test_loss: 1.0248, test_f1: 0.4630
 epoch: 65, train_loss: 1.0474, test_loss: 1.0286, test_f1: 0.4879
 epoch: 66, train_loss: 1.0506, test_loss: 1.0185, test_f1: 0.4668
 epoch: 67, train_loss: 1.0587, test_loss: 1.0147, test_f1: 0.4857
 epoch: 68, train_loss: 1.0533, test_loss: 1.0129, test_f1: 0.4816
 epoch: 69, train_loss: 1.0418, test_loss: 1.0110, test_f1: 0.4755
 epoch: 70, train_loss: 1.0549, test_loss: 1.0309, test_f1: 0.4672
 epoch: 71, train_loss: 1.0414, test_loss: 1.0406, test_f1: 0.4735
 epoch: 72, train_loss: 1.0513, test_loss: 1.0188, test_f1: 0.4776
 epoch: 73, train_loss: 1.0502, test_loss: 1.0214, test_f1: 0.4744
 epoch: 74, train_loss: 1.0461, test_loss: 1.0258, test_f1: 0.4618
 epoch: 75, train_loss: 1.0552, test_loss: 1.0102, test_f1: 0.4910
 epoch: 76, train_loss: 1.0457, test_loss: 1.0072, test_f1: 0.4815
 epoch: 77, train_loss: 1.0459, test_loss: 1.0270, test_f1: 0.4715
 epoch: 78, train_loss: 1.0417, test_loss: 1.0107, test_f1: 0.4806
 epoch: 79, train_loss: 1.0446, test_loss: 1.0139, test_f1: 0.4745
 epoch: 80, train_loss: 1.0401, test_loss: 1.0025, test_f1: 0.4757
 epoch: 81, train_loss: 1.0411, test_loss: 1.0005, test_f1: 0.4802
 epoch: 82, train_loss: 1.0371, test_loss: 1.0029, test_f1: 0.4856
 epoch: 83, train_loss: 1.0315, test_loss: 1.0146, test_f1: 0.4834
 epoch: 84, train_loss: 1.0375, test_loss: 1.0062, test_f1: 0.4742
 epoch: 85, train_loss: 1.0494, test_loss: 1.0136, test_f1: 0.4795
 epoch: 86, train_loss: 1.0364, test_loss: 1.0032, test_f1: 0.4735
 epoch: 87, train_loss: 1.0357, test_loss: 1.0067, test_f1: 0.4868
 epoch: 88, train_loss: 1.0349, test_loss: 1.0151, test_f1: 0.4892
 epoch: 89, train_loss: 1.0311, test_loss: 1.0026, test_f1: 0.4721
 epoch: 90, train_loss: 1.0347, test_loss: 1.0090, test_f1: 0.4764
 epoch: 91, train_loss: 1.0255, test_loss: 0.9943, test_f1: 0.4930
 epoch: 92, train_loss: 1.0374, test_loss: 1.0126, test_f1: 0.4894
 epoch: 93, train_loss: 1.0276, test_loss: 0.9880, test_f1: 0.4890
 epoch: 94, train_loss: 1.0285, test_loss: 0.9962, test_f1: 0.4927
 epoch: 95, train_loss: 1.0229, test_loss: 1.0057, test_f1: 0.4678
 epoch: 96, train_loss: 1.0277, test_loss: 0.9942, test_f1: 0.4800
 epoch: 97, train_loss: 1.0185, test_loss: 0.9934, test_f1: 0.4952
 epoch: 98, train_loss: 1.0206, test_loss: 0.9915, test_f1: 0.4884
 epoch: 99, train_loss: 1.0278, test_loss: 1.0067, test_f1: 0.4750
##################ITERATION #7 ****************************************
 epoch: 0, train_loss: 1.3314, test_loss: 1.3561, test_f1: 0.2640
 epoch: 1, train_loss: 1.2835, test_loss: 1.3072, test_f1: 0.2801
 epoch: 2, train_loss: 1.2705, test_loss: 1.2774, test_f1: 0.2901
 epoch: 3, train_loss: 1.2519, test_loss: 1.3269, test_f1: 0.2977
 epoch: 4, train_loss: 1.2458, test_loss: 1.2971, test_f1: 0.3049
 epoch: 5, train_loss: 1.2337, test_loss: 1.2219, test_f1: 0.3312
 epoch: 6, train_loss: 1.2368, test_loss: 1.2511, test_f1: 0.3543
 epoch: 7, train_loss: 1.2252, test_loss: 1.2030, test_f1: 0.3601
 epoch: 8, train_loss: 1.2222, test_loss: 1.2513, test_f1: 0.3704
 epoch: 9, train_loss: 1.2222, test_loss: 1.1811, test_f1: 0.3755
 epoch: 10, train_loss: 1.2147, test_loss: 1.1828, test_f1: 0.3644
 epoch: 11, train_loss: 1.2077, test_loss: 1.1851, test_f1: 0.3798
 epoch: 12, train_loss: 1.1994, test_loss: 1.2818, test_f1: 0.4000
 epoch: 13, train_loss: 1.1987, test_loss: 1.1657, test_f1: 0.4108
 epoch: 14, train_loss: 1.1901, test_loss: 1.2004, test_f1: 0.4366
 epoch: 15, train_loss: 1.1989, test_loss: 1.1584, test_f1: 0.4277
 epoch: 16, train_loss: 1.1789, test_loss: 1.1435, test_f1: 0.4264
 epoch: 17, train_loss: 1.1784, test_loss: 1.1363, test_f1: 0.4399
 epoch: 18, train_loss: 1.1787, test_loss: 1.1498, test_f1: 0.4318
 epoch: 19, train_loss: 1.1776, test_loss: 1.1673, test_f1: 0.4469
 epoch: 20, train_loss: 1.1710, test_loss: 1.1826, test_f1: 0.4471
 epoch: 21, train_loss: 1.1584, test_loss: 1.1567, test_f1: 0.4364
 epoch: 22, train_loss: 1.1649, test_loss: 1.1259, test_f1: 0.4535
 epoch: 23, train_loss: 1.1503, test_loss: 1.1757, test_f1: 0.4554
 epoch: 24, train_loss: 1.1440, test_loss: 1.1305, test_f1: 0.4608
 epoch: 25, train_loss: 1.1376, test_loss: 1.1056, test_f1: 0.4608
 epoch: 26, train_loss: 1.1524, test_loss: 1.0958, test_f1: 0.4508
 epoch: 27, train_loss: 1.1351, test_loss: 1.1066, test_f1: 0.4449
 epoch: 28, train_loss: 1.1301, test_loss: 1.0853, test_f1: 0.4678
 epoch: 29, train_loss: 1.1265, test_loss: 1.1298, test_f1: 0.4464
 epoch: 30, train_loss: 1.1235, test_loss: 1.0817, test_f1: 0.4571
 epoch: 31, train_loss: 1.1240, test_loss: 1.0765, test_f1: 0.4570
 epoch: 32, train_loss: 1.1195, test_loss: 1.0839, test_f1: 0.4549
 epoch: 33, train_loss: 1.1167, test_loss: 1.1165, test_f1: 0.4531
 epoch: 34, train_loss: 1.1098, test_loss: 1.0812, test_f1: 0.4464
 epoch: 35, train_loss: 1.1130, test_loss: 1.0896, test_f1: 0.4547
 epoch: 36, train_loss: 1.1090, test_loss: 1.1123, test_f1: 0.4551
 epoch: 37, train_loss: 1.1055, test_loss: 1.0823, test_f1: 0.4539
 epoch: 38, train_loss: 1.1091, test_loss: 1.0805, test_f1: 0.4595
 epoch: 39, train_loss: 1.1121, test_loss: 1.0879, test_f1: 0.4546
 epoch: 40, train_loss: 1.0958, test_loss: 1.0621, test_f1: 0.4457
 epoch: 41, train_loss: 1.0959, test_loss: 1.0916, test_f1: 0.4647
 epoch: 42, train_loss: 1.1007, test_loss: 1.0849, test_f1: 0.4622
 epoch: 43, train_loss: 1.0949, test_loss: 1.0835, test_f1: 0.4614
 epoch: 44, train_loss: 1.0963, test_loss: 1.0626, test_f1: 0.4654
 epoch: 45, train_loss: 1.0887, test_loss: 1.0566, test_f1: 0.4549
 epoch: 46, train_loss: 1.0841, test_loss: 1.0684, test_f1: 0.4716
 epoch: 47, train_loss: 1.0947, test_loss: 1.0580, test_f1: 0.4600
 epoch: 48, train_loss: 1.0870, test_loss: 1.0362, test_f1: 0.4644
 epoch: 49, train_loss: 1.0810, test_loss: 1.0340, test_f1: 0.4747
 epoch: 50, train_loss: 1.0756, test_loss: 1.0717, test_f1: 0.4634
 epoch: 51, train_loss: 1.0843, test_loss: 1.0707, test_f1: 0.4672
 epoch: 52, train_loss: 1.0696, test_loss: 1.0906, test_f1: 0.4731
 epoch: 53, train_loss: 1.0711, test_loss: 1.0618, test_f1: 0.4655
 epoch: 54, train_loss: 1.0806, test_loss: 1.0295, test_f1: 0.4666
 epoch: 55, train_loss: 1.0675, test_loss: 1.0469, test_f1: 0.4683
 epoch: 56, train_loss: 1.0722, test_loss: 1.0408, test_f1: 0.4656
 epoch: 57, train_loss: 1.0758, test_loss: 1.0909, test_f1: 0.4651
 epoch: 58, train_loss: 1.0539, test_loss: 1.0409, test_f1: 0.4607
 epoch: 59, train_loss: 1.0680, test_loss: 1.0451, test_f1: 0.4605
 epoch: 60, train_loss: 1.0632, test_loss: 1.0334, test_f1: 0.4695
 epoch: 61, train_loss: 1.0552, test_loss: 1.0327, test_f1: 0.4634
 epoch: 62, train_loss: 1.0544, test_loss: 1.0357, test_f1: 0.4778
 epoch: 63, train_loss: 1.0564, test_loss: 1.0320, test_f1: 0.4659
 epoch: 64, train_loss: 1.0588, test_loss: 1.0526, test_f1: 0.4630
 epoch: 65, train_loss: 1.0605, test_loss: 1.0543, test_f1: 0.4617
 epoch: 66, train_loss: 1.0568, test_loss: 1.0392, test_f1: 0.4768
 epoch: 67, train_loss: 1.0565, test_loss: 1.0710, test_f1: 0.4679
 epoch: 68, train_loss: 1.0557, test_loss: 1.0375, test_f1: 0.4742
 epoch: 69, train_loss: 1.0538, test_loss: 1.0364, test_f1: 0.4720
 epoch: 70, train_loss: 1.0633, test_loss: 1.0221, test_f1: 0.4642
 epoch: 71, train_loss: 1.0485, test_loss: 1.0142, test_f1: 0.4710
 epoch: 72, train_loss: 1.0492, test_loss: 1.0380, test_f1: 0.4718
 epoch: 73, train_loss: 1.0431, test_loss: 1.0706, test_f1: 0.4671
 epoch: 74, train_loss: 1.0476, test_loss: 1.0577, test_f1: 0.4673
 epoch: 75, train_loss: 1.0466, test_loss: 1.0416, test_f1: 0.4597
 epoch: 76, train_loss: 1.0439, test_loss: 1.0818, test_f1: 0.4616
 epoch: 77, train_loss: 1.0517, test_loss: 1.0369, test_f1: 0.4711
 epoch: 78, train_loss: 1.0364, test_loss: 1.0230, test_f1: 0.4605
 epoch: 79, train_loss: 1.0455, test_loss: 1.0468, test_f1: 0.4654
 epoch: 80, train_loss: 1.0394, test_loss: 1.0258, test_f1: 0.4678
 epoch: 81, train_loss: 1.0359, test_loss: 1.0203, test_f1: 0.4807
 epoch: 82, train_loss: 1.0551, test_loss: 1.0343, test_f1: 0.4642
 epoch: 83, train_loss: 1.0438, test_loss: 1.0234, test_f1: 0.4667
 epoch: 84, train_loss: 1.0395, test_loss: 1.0250, test_f1: 0.4851
 epoch: 85, train_loss: 1.0383, test_loss: 1.0505, test_f1: 0.4727
 epoch: 86, train_loss: 1.0365, test_loss: 1.0347, test_f1: 0.4823
 epoch: 87, train_loss: 1.0357, test_loss: 1.0241, test_f1: 0.4712
 epoch: 88, train_loss: 1.0467, test_loss: 1.0167, test_f1: 0.4667
 epoch: 89, train_loss: 1.0314, test_loss: 1.0222, test_f1: 0.4734
 epoch: 90, train_loss: 1.0385, test_loss: 1.0162, test_f1: 0.4733
 epoch: 91, train_loss: 1.0264, test_loss: 1.0460, test_f1: 0.4758
 epoch: 92, train_loss: 1.0326, test_loss: 1.0276, test_f1: 0.4819
 epoch: 93, train_loss: 1.0288, test_loss: 1.0243, test_f1: 0.4785
 epoch: 94, train_loss: 1.0345, test_loss: 1.0324, test_f1: 0.4769
 epoch: 95, train_loss: 1.0309, test_loss: 1.0302, test_f1: 0.4802
 epoch: 96, train_loss: 1.0235, test_loss: 1.0179, test_f1: 0.4732
 epoch: 97, train_loss: 1.0358, test_loss: 0.9944, test_f1: 0.4969
 epoch: 98, train_loss: 1.0229, test_loss: 1.0203, test_f1: 0.4650
 epoch: 99, train_loss: 1.0304, test_loss: 1.0291, test_f1: 0.4750
##################ITERATION #8 ****************************************
 epoch: 0, train_loss: 1.2995, test_loss: 1.2562, test_f1: 0.2995
 epoch: 1, train_loss: 1.2548, test_loss: 1.2336, test_f1: 0.3279
 epoch: 2, train_loss: 1.2486, test_loss: 1.2110, test_f1: 0.3281
 epoch: 3, train_loss: 1.2382, test_loss: 1.2034, test_f1: 0.3487
 epoch: 4, train_loss: 1.2200, test_loss: 1.1846, test_f1: 0.3728
 epoch: 5, train_loss: 1.2040, test_loss: 1.1802, test_f1: 0.4051
 epoch: 6, train_loss: 1.2081, test_loss: 1.1596, test_f1: 0.4296
 epoch: 7, train_loss: 1.2041, test_loss: 1.1513, test_f1: 0.4304
 epoch: 8, train_loss: 1.1911, test_loss: 1.1405, test_f1: 0.4228
 epoch: 9, train_loss: 1.1828, test_loss: 1.1320, test_f1: 0.4407
 epoch: 10, train_loss: 1.1767, test_loss: 1.1191, test_f1: 0.4614
 epoch: 11, train_loss: 1.1683, test_loss: 1.1215, test_f1: 0.4458
 epoch: 12, train_loss: 1.1598, test_loss: 1.1104, test_f1: 0.4284
 epoch: 13, train_loss: 1.1544, test_loss: 1.1094, test_f1: 0.4544
 epoch: 14, train_loss: 1.1506, test_loss: 1.0970, test_f1: 0.4255
 epoch: 15, train_loss: 1.1498, test_loss: 1.1015, test_f1: 0.4390
 epoch: 16, train_loss: 1.1404, test_loss: 1.0904, test_f1: 0.4466
 epoch: 17, train_loss: 1.1359, test_loss: 1.0901, test_f1: 0.4270
 epoch: 18, train_loss: 1.1347, test_loss: 1.0897, test_f1: 0.4480
 epoch: 19, train_loss: 1.1376, test_loss: 1.0807, test_f1: 0.4428
 epoch: 20, train_loss: 1.1229, test_loss: 1.0820, test_f1: 0.4395
 epoch: 21, train_loss: 1.1209, test_loss: 1.0607, test_f1: 0.4732
 epoch: 22, train_loss: 1.1157, test_loss: 1.0705, test_f1: 0.4450
 epoch: 23, train_loss: 1.1179, test_loss: 1.0671, test_f1: 0.4371
 epoch: 24, train_loss: 1.1072, test_loss: 1.0674, test_f1: 0.4377
 epoch: 25, train_loss: 1.1052, test_loss: 1.0671, test_f1: 0.4327
 epoch: 26, train_loss: 1.1077, test_loss: 1.0589, test_f1: 0.4315
 epoch: 27, train_loss: 1.0933, test_loss: 1.0592, test_f1: 0.4501
 epoch: 28, train_loss: 1.1044, test_loss: 1.0529, test_f1: 0.4328
 epoch: 29, train_loss: 1.0839, test_loss: 1.0535, test_f1: 0.4353
 epoch: 30, train_loss: 1.0874, test_loss: 1.0595, test_f1: 0.4272
 epoch: 31, train_loss: 1.0913, test_loss: 1.0481, test_f1: 0.4361
 epoch: 32, train_loss: 1.0819, test_loss: 1.0372, test_f1: 0.4485
 epoch: 33, train_loss: 1.0743, test_loss: 1.0393, test_f1: 0.4491
 epoch: 34, train_loss: 1.0771, test_loss: 1.0303, test_f1: 0.4521
 epoch: 35, train_loss: 1.0786, test_loss: 1.0228, test_f1: 0.4706
 epoch: 36, train_loss: 1.0643, test_loss: 1.0267, test_f1: 0.4792
 epoch: 37, train_loss: 1.0754, test_loss: 1.0261, test_f1: 0.4541
 epoch: 38, train_loss: 1.0695, test_loss: 1.0343, test_f1: 0.4513
 epoch: 39, train_loss: 1.0642, test_loss: 1.0275, test_f1: 0.4415
 epoch: 40, train_loss: 1.0612, test_loss: 1.0434, test_f1: 0.4302
 epoch: 41, train_loss: 1.0632, test_loss: 1.0219, test_f1: 0.4498
 epoch: 42, train_loss: 1.0533, test_loss: 1.0195, test_f1: 0.4413
 epoch: 43, train_loss: 1.0640, test_loss: 1.0105, test_f1: 0.4441
 epoch: 44, train_loss: 1.0605, test_loss: 1.0245, test_f1: 0.4398
 epoch: 45, train_loss: 1.0543, test_loss: 1.0272, test_f1: 0.4463
 epoch: 46, train_loss: 1.0496, test_loss: 0.9996, test_f1: 0.4549
 epoch: 47, train_loss: 1.0446, test_loss: 1.0167, test_f1: 0.4397
 epoch: 48, train_loss: 1.0451, test_loss: 1.0150, test_f1: 0.4550
 epoch: 49, train_loss: 1.0330, test_loss: 1.0109, test_f1: 0.4443
 epoch: 50, train_loss: 1.0377, test_loss: 1.0311, test_f1: 0.4431
 epoch: 51, train_loss: 1.0329, test_loss: 1.0221, test_f1: 0.4412
 epoch: 52, train_loss: 1.0319, test_loss: 1.0145, test_f1: 0.4414
 epoch: 53, train_loss: 1.0368, test_loss: 1.0062, test_f1: 0.4501
 epoch: 54, train_loss: 1.0259, test_loss: 1.0199, test_f1: 0.4452
 epoch: 55, train_loss: 1.0428, test_loss: 1.0057, test_f1: 0.4462
 epoch: 56, train_loss: 1.0237, test_loss: 1.0105, test_f1: 0.4469
 epoch: 57, train_loss: 1.0282, test_loss: 1.0036, test_f1: 0.4463
 epoch: 58, train_loss: 1.0187, test_loss: 1.0212, test_f1: 0.4440
 epoch: 59, train_loss: 1.0088, test_loss: 0.9998, test_f1: 0.4444
 epoch: 60, train_loss: 1.0211, test_loss: 1.0288, test_f1: 0.4377
 epoch: 61, train_loss: 1.0132, test_loss: 1.0020, test_f1: 0.4427
 epoch: 62, train_loss: 1.0210, test_loss: 1.0092, test_f1: 0.4454
 epoch: 63, train_loss: 1.0205, test_loss: 1.0217, test_f1: 0.4297
 epoch: 64, train_loss: 1.0160, test_loss: 1.0034, test_f1: 0.4432
 epoch: 65, train_loss: 1.0089, test_loss: 1.0173, test_f1: 0.4390
 epoch: 66, train_loss: 1.0172, test_loss: 0.9955, test_f1: 0.4570
 epoch: 67, train_loss: 1.0147, test_loss: 1.0046, test_f1: 0.4431
 epoch: 68, train_loss: 1.0116, test_loss: 1.0073, test_f1: 0.4426
 epoch: 69, train_loss: 1.0088, test_loss: 0.9945, test_f1: 0.4506
 epoch: 70, train_loss: 1.0122, test_loss: 0.9948, test_f1: 0.4443
 epoch: 71, train_loss: 1.0070, test_loss: 1.0038, test_f1: 0.4370
 epoch: 72, train_loss: 1.0062, test_loss: 1.0169, test_f1: 0.4355
 epoch: 73, train_loss: 1.0051, test_loss: 0.9989, test_f1: 0.4505
 epoch: 74, train_loss: 1.0121, test_loss: 0.9934, test_f1: 0.4332
 epoch: 75, train_loss: 1.0067, test_loss: 0.9923, test_f1: 0.4384
 epoch: 76, train_loss: 1.0088, test_loss: 0.9970, test_f1: 0.4395
 epoch: 77, train_loss: 0.9974, test_loss: 0.9816, test_f1: 0.4451
 epoch: 78, train_loss: 0.9999, test_loss: 0.9827, test_f1: 0.4584
 epoch: 79, train_loss: 0.9999, test_loss: 0.9970, test_f1: 0.4386
 epoch: 80, train_loss: 1.0113, test_loss: 1.0025, test_f1: 0.4441
 epoch: 81, train_loss: 0.9955, test_loss: 0.9960, test_f1: 0.4381
 epoch: 82, train_loss: 1.0012, test_loss: 0.9965, test_f1: 0.4302
 epoch: 83, train_loss: 0.9874, test_loss: 0.9896, test_f1: 0.4441
 epoch: 84, train_loss: 0.9947, test_loss: 0.9865, test_f1: 0.4441
 epoch: 85, train_loss: 0.9953, test_loss: 0.9940, test_f1: 0.4415
 epoch: 86, train_loss: 0.9883, test_loss: 0.9915, test_f1: 0.4401
 epoch: 87, train_loss: 0.9921, test_loss: 1.0094, test_f1: 0.4343
 epoch: 88, train_loss: 0.9835, test_loss: 1.0006, test_f1: 0.4414
 epoch: 89, train_loss: 0.9883, test_loss: 0.9955, test_f1: 0.4445
 epoch: 90, train_loss: 0.9927, test_loss: 1.0028, test_f1: 0.4464
 epoch: 91, train_loss: 0.9915, test_loss: 1.0016, test_f1: 0.4528
 epoch: 92, train_loss: 0.9914, test_loss: 0.9934, test_f1: 0.4429
 epoch: 93, train_loss: 0.9855, test_loss: 0.9875, test_f1: 0.4437
 epoch: 94, train_loss: 0.9846, test_loss: 0.9792, test_f1: 0.4610
 epoch: 95, train_loss: 0.9888, test_loss: 0.9883, test_f1: 0.4427
 epoch: 96, train_loss: 0.9850, test_loss: 1.0032, test_f1: 0.4398
 epoch: 97, train_loss: 0.9855, test_loss: 1.0012, test_f1: 0.4410
 epoch: 98, train_loss: 0.9782, test_loss: 1.0068, test_f1: 0.4412
 epoch: 99, train_loss: 0.9937, test_loss: 1.0238, test_f1: 0.4318
##################ITERATION #9 ****************************************
 epoch: 0, train_loss: 1.3508, test_loss: 1.2540, test_f1: 0.3020
 epoch: 1, train_loss: 1.2682, test_loss: 1.2301, test_f1: 0.3126
 epoch: 2, train_loss: 1.2481, test_loss: 1.2190, test_f1: 0.3415
 epoch: 3, train_loss: 1.2434, test_loss: 1.2028, test_f1: 0.3507
 epoch: 4, train_loss: 1.2224, test_loss: 1.1868, test_f1: 0.3841
 epoch: 5, train_loss: 1.2219, test_loss: 1.1782, test_f1: 0.3900
 epoch: 6, train_loss: 1.2117, test_loss: 1.1798, test_f1: 0.3957
 epoch: 7, train_loss: 1.2035, test_loss: 1.1611, test_f1: 0.4009
 epoch: 8, train_loss: 1.2002, test_loss: 1.1538, test_f1: 0.3982
 epoch: 9, train_loss: 1.1929, test_loss: 1.1515, test_f1: 0.3921
 epoch: 10, train_loss: 1.1935, test_loss: 1.1456, test_f1: 0.4042
 epoch: 11, train_loss: 1.1886, test_loss: 1.1372, test_f1: 0.4074
 epoch: 12, train_loss: 1.1860, test_loss: 1.1343, test_f1: 0.4057
 epoch: 13, train_loss: 1.1761, test_loss: 1.1256, test_f1: 0.4246
 epoch: 14, train_loss: 1.1747, test_loss: 1.1219, test_f1: 0.4215
 epoch: 15, train_loss: 1.1646, test_loss: 1.1173, test_f1: 0.4111
 epoch: 16, train_loss: 1.1608, test_loss: 1.1128, test_f1: 0.4190
 epoch: 17, train_loss: 1.1603, test_loss: 1.1063, test_f1: 0.4172
 epoch: 18, train_loss: 1.1526, test_loss: 1.1026, test_f1: 0.4189
 epoch: 19, train_loss: 1.1472, test_loss: 1.1046, test_f1: 0.4165
 epoch: 20, train_loss: 1.1410, test_loss: 1.0982, test_f1: 0.4203
 epoch: 21, train_loss: 1.1382, test_loss: 1.1004, test_f1: 0.4252
 epoch: 22, train_loss: 1.1320, test_loss: 1.1005, test_f1: 0.4228
 epoch: 23, train_loss: 1.1335, test_loss: 1.0934, test_f1: 0.4225
 epoch: 24, train_loss: 1.1284, test_loss: 1.0982, test_f1: 0.4322
 epoch: 25, train_loss: 1.1338, test_loss: 1.0968, test_f1: 0.4187
 epoch: 26, train_loss: 1.1308, test_loss: 1.0758, test_f1: 0.4314
 epoch: 27, train_loss: 1.1218, test_loss: 1.0691, test_f1: 0.4318
 epoch: 28, train_loss: 1.1239, test_loss: 1.0774, test_f1: 0.4282
 epoch: 29, train_loss: 1.1160, test_loss: 1.0602, test_f1: 0.4279
 epoch: 30, train_loss: 1.1128, test_loss: 1.0745, test_f1: 0.4420
 epoch: 31, train_loss: 1.1132, test_loss: 1.0669, test_f1: 0.4359
 epoch: 32, train_loss: 1.1023, test_loss: 1.0846, test_f1: 0.4327
 epoch: 33, train_loss: 1.1112, test_loss: 1.0863, test_f1: 0.4225
 epoch: 34, train_loss: 1.1006, test_loss: 1.0461, test_f1: 0.4441
 epoch: 35, train_loss: 1.1011, test_loss: 1.0590, test_f1: 0.4525
 epoch: 36, train_loss: 1.1024, test_loss: 1.0616, test_f1: 0.4263
 epoch: 37, train_loss: 1.0972, test_loss: 1.0667, test_f1: 0.4171
 epoch: 38, train_loss: 1.0825, test_loss: 1.0686, test_f1: 0.4313
 epoch: 39, train_loss: 1.0816, test_loss: 1.0580, test_f1: 0.4476
 epoch: 40, train_loss: 1.0895, test_loss: 1.0983, test_f1: 0.4318
 epoch: 41, train_loss: 1.0767, test_loss: 1.0803, test_f1: 0.4328
 epoch: 42, train_loss: 1.0821, test_loss: 1.0246, test_f1: 0.4463
 epoch: 43, train_loss: 1.0768, test_loss: 1.0398, test_f1: 0.4405
 epoch: 44, train_loss: 1.0770, test_loss: 1.0121, test_f1: 0.4454
 epoch: 45, train_loss: 1.0615, test_loss: 1.0115, test_f1: 0.4569
 epoch: 46, train_loss: 1.0655, test_loss: 1.0221, test_f1: 0.4499
 epoch: 47, train_loss: 1.0608, test_loss: 1.0495, test_f1: 0.4318
 epoch: 48, train_loss: 1.0637, test_loss: 1.0474, test_f1: 0.4338
 epoch: 49, train_loss: 1.0618, test_loss: 1.0028, test_f1: 0.4447
 epoch: 50, train_loss: 1.0510, test_loss: 1.0110, test_f1: 0.4426
 epoch: 51, train_loss: 1.0565, test_loss: 1.0514, test_f1: 0.4319
 epoch: 52, train_loss: 1.0505, test_loss: 1.0692, test_f1: 0.4395
 epoch: 53, train_loss: 1.0493, test_loss: 1.0557, test_f1: 0.4442
 epoch: 54, train_loss: 1.0480, test_loss: 1.0727, test_f1: 0.4504
 epoch: 55, train_loss: 1.0440, test_loss: 1.0592, test_f1: 0.4387
 epoch: 56, train_loss: 1.0568, test_loss: 1.0360, test_f1: 0.4384
 epoch: 57, train_loss: 1.0397, test_loss: 1.0213, test_f1: 0.4554
 epoch: 58, train_loss: 1.0310, test_loss: 1.0122, test_f1: 0.4497
 epoch: 59, train_loss: 1.0361, test_loss: 1.0140, test_f1: 0.4424
 epoch: 60, train_loss: 1.0421, test_loss: 1.0013, test_f1: 0.4395
 epoch: 61, train_loss: 1.0419, test_loss: 1.0179, test_f1: 0.4487
 epoch: 62, train_loss: 1.0347, test_loss: 1.0286, test_f1: 0.4440
 epoch: 63, train_loss: 1.0388, test_loss: 1.0024, test_f1: 0.4489
 epoch: 64, train_loss: 1.0395, test_loss: 1.0172, test_f1: 0.4481
 epoch: 65, train_loss: 1.0241, test_loss: 0.9960, test_f1: 0.4535
 epoch: 66, train_loss: 1.0347, test_loss: 0.9903, test_f1: 0.4607
 epoch: 67, train_loss: 1.0378, test_loss: 1.0198, test_f1: 0.4541
 epoch: 68, train_loss: 1.0455, test_loss: 1.0528, test_f1: 0.4451
 epoch: 69, train_loss: 1.0187, test_loss: 1.0435, test_f1: 0.4538
 epoch: 70, train_loss: 1.0286, test_loss: 1.0719, test_f1: 0.4430
 epoch: 71, train_loss: 1.0224, test_loss: 1.0923, test_f1: 0.4574
 epoch: 72, train_loss: 1.0297, test_loss: 1.0267, test_f1: 0.4510
 epoch: 73, train_loss: 1.0354, test_loss: 1.0051, test_f1: 0.4488
 epoch: 74, train_loss: 1.0099, test_loss: 1.0201, test_f1: 0.4376
 epoch: 75, train_loss: 1.0256, test_loss: 1.0543, test_f1: 0.4392
 epoch: 76, train_loss: 1.0281, test_loss: 1.0760, test_f1: 0.4443
 epoch: 77, train_loss: 1.0226, test_loss: 1.0750, test_f1: 0.4493
 epoch: 78, train_loss: 1.0216, test_loss: 1.0450, test_f1: 0.4391
 epoch: 79, train_loss: 1.0218, test_loss: 1.0160, test_f1: 0.4456
 epoch: 80, train_loss: 1.0343, test_loss: 1.0687, test_f1: 0.4417
 epoch: 81, train_loss: 1.0177, test_loss: 1.0561, test_f1: 0.4389
 epoch: 82, train_loss: 1.0144, test_loss: 1.1295, test_f1: 0.4490
 epoch: 83, train_loss: 1.0162, test_loss: 0.9967, test_f1: 0.4534
 epoch: 84, train_loss: 1.0162, test_loss: 1.0151, test_f1: 0.4471
 epoch: 85, train_loss: 1.0141, test_loss: 0.9949, test_f1: 0.4534
 epoch: 86, train_loss: 1.0110, test_loss: 1.0065, test_f1: 0.4709
 epoch: 87, train_loss: 1.0214, test_loss: 0.9815, test_f1: 0.4684
 epoch: 88, train_loss: 1.0044, test_loss: 1.0364, test_f1: 0.4461
 epoch: 89, train_loss: 1.0087, test_loss: 1.0437, test_f1: 0.4561
 epoch: 90, train_loss: 0.9987, test_loss: 1.0275, test_f1: 0.4363
 epoch: 91, train_loss: 1.0087, test_loss: 1.0302, test_f1: 0.4483
 epoch: 92, train_loss: 1.0101, test_loss: 1.0336, test_f1: 0.4603
 epoch: 93, train_loss: 1.0094, test_loss: 1.0205, test_f1: 0.4523
 epoch: 94, train_loss: 0.9976, test_loss: 1.0278, test_f1: 0.4327
 epoch: 95, train_loss: 0.9970, test_loss: 1.1275, test_f1: 0.4464
 epoch: 96, train_loss: 0.9962, test_loss: 0.9842, test_f1: 0.4612
 epoch: 97, train_loss: 0.9850, test_loss: 0.9867, test_f1: 0.4560
 epoch: 98, train_loss: 1.0123, test_loss: 0.9729, test_f1: 0.4557
 epoch: 99, train_loss: 0.9982, test_loss: 1.0230, test_f1: 0.4533

Training completed in 1105.48 seconds
Best F1: 0.5049 at epoch 65
Mean F1 across iterations: 0.4857  0.0106
========================FINAL RESULTS================================
FEGIN weighted F1: 0.5049  0.0106
python main.py --data ltspice_examples --representation component_component --model FEGIN --layers 4 --hiddens 32 --batch_size 32 --lr 0.0001 --emb_size 250 --epochs 100 --save_appendix component_component_L4_H32_BS32_LR0.0001_E250 --no_val
-----



STDERR:
  File "main.py", line 370, in <module>
    main()
  File "main.py", line 254, in main
    dataset = dataset_class(
  File "/home/philip/projects/ltspice_examples_code_repo/Circuit-Completion-Using-GNNs/component_classification_with_link_prediction_head/evaluation/FEGIN/kernel/circuit_datasets.py", line 15, in __init__
    self.data, self.slices = torch.load(self.processed_paths[0])
  File "/home/philip/.local/lib/python3.8/site-packages/torch/serialization.py", line 1040, in load
    warnings.warn(
  File "/usr/lib/python3.8/warnings.py", line 109, in _showwarnmsg
    sw(msg.message, msg.category, msg.filename, msg.lineno,
  File "main.py", line 47, in warn_with_traceback
    traceback.print_stack(file=log)
/home/philip/projects/ltspice_examples_code_repo/Circuit-Completion-Using-GNNs/component_classification_with_link_prediction_head/evaluation/FEGIN/kernel/circuit_datasets.py:15: FutureWarning: You are using `torch.load` with `weights_only=False` (the current default value), which uses the default pickle module implicitly. It is possible to construct malicious pickle data which will execute arbitrary code during unpickling (See https://github.com/pytorch/pytorch/blob/main/SECURITY.md#untrusted-models for more details). In a future release, the default value for `weights_only` will be flipped to `True`. This limits the functions that could be executed during unpickling. Arbitrary objects will no longer be allowed to be loaded via this mode unless they are explicitly allowlisted by the user via `torch.serialization.add_safe_globals`. We recommend you start setting `weights_only=True` for any use case where you don't have full control of the loaded file. Please open an issue on GitHub for any issues related to this experimental feature.
  self.data, self.slices = torch.load(self.processed_paths[0])
