STDOUT:
Results will be saved in /home/philip/projects/ltspice_examples_code_repo/Circuit-Completion-Using-GNNs/component_classification_with_link_prediction_head/evaluation/FEGIN/results/model_FEGIN_dataset_ltspice_examples
Command line input: python main.py --data ltspice_examples --representation component_component --model FEGIN --layers 6 --hiddens 32 --batch_size 256 --lr 0.0001 --emb_size 250 --epochs 100 --save_appendix component_component_L6_H32_BS256_LR0.0001_E250 --no_val
 is saved.
-----
ltspice_examples - FEGIN
Using 6 layers, 32 hidden units, h = 2
Loading component_component representation dataset
ENTERED
Training FEGIN on component_component representation
Train: 3556, Test: 845
##################ITERATION #0 ****************************************
 epoch: 0, train_loss: 1.4328, test_loss: 1.4239, test_f1: 0.1015
 epoch: 1, train_loss: 1.4289, test_loss: 1.4222, test_f1: 0.1015
 epoch: 2, train_loss: 1.4263, test_loss: 1.4205, test_f1: 0.1015
 epoch: 3, train_loss: 1.4240, test_loss: 1.4182, test_f1: 0.1011
 epoch: 4, train_loss: 1.4221, test_loss: 1.4155, test_f1: 0.1135
 epoch: 5, train_loss: 1.4192, test_loss: 1.4118, test_f1: 0.1201
 epoch: 6, train_loss: 1.4172, test_loss: 1.4093, test_f1: 0.1201
 epoch: 7, train_loss: 1.4148, test_loss: 1.4070, test_f1: 0.1201
 epoch: 8, train_loss: 1.4118, test_loss: 1.4051, test_f1: 0.1428
 epoch: 9, train_loss: 1.4098, test_loss: 1.4026, test_f1: 0.1464
 epoch: 10, train_loss: 1.4073, test_loss: 1.3998, test_f1: 0.1463
 epoch: 11, train_loss: 1.4038, test_loss: 1.3963, test_f1: 0.1463
 epoch: 12, train_loss: 1.4014, test_loss: 1.3930, test_f1: 0.1514
 epoch: 13, train_loss: 1.3975, test_loss: 1.3898, test_f1: 0.1564
 epoch: 14, train_loss: 1.3935, test_loss: 1.3852, test_f1: 0.1564
 epoch: 15, train_loss: 1.3900, test_loss: 1.3808, test_f1: 0.1580
 epoch: 16, train_loss: 1.3855, test_loss: 1.3757, test_f1: 0.1727
 epoch: 17, train_loss: 1.3794, test_loss: 1.3706, test_f1: 0.1792
 epoch: 18, train_loss: 1.3751, test_loss: 1.3648, test_f1: 0.1847
 epoch: 19, train_loss: 1.3676, test_loss: 1.3582, test_f1: 0.1837
 epoch: 20, train_loss: 1.3596, test_loss: 1.3506, test_f1: 0.1606
 epoch: 21, train_loss: 1.3529, test_loss: 1.3428, test_f1: 0.1966
 epoch: 22, train_loss: 1.3461, test_loss: 1.3348, test_f1: 0.2820
 epoch: 23, train_loss: 1.3376, test_loss: 1.3276, test_f1: 0.2972
 epoch: 24, train_loss: 1.3288, test_loss: 1.3187, test_f1: 0.3257
 epoch: 25, train_loss: 1.3193, test_loss: 1.3099, test_f1: 0.3448
 epoch: 26, train_loss: 1.3119, test_loss: 1.3017, test_f1: 0.3650
 epoch: 27, train_loss: 1.3061, test_loss: 1.2930, test_f1: 0.3417
 epoch: 28, train_loss: 1.2980, test_loss: 1.2849, test_f1: 0.3393
 epoch: 29, train_loss: 1.2869, test_loss: 1.2767, test_f1: 0.3465
 epoch: 30, train_loss: 1.2836, test_loss: 1.2699, test_f1: 0.3281
 epoch: 31, train_loss: 1.2726, test_loss: 1.2634, test_f1: 0.3243
 epoch: 32, train_loss: 1.2692, test_loss: 1.2576, test_f1: 0.3237
 epoch: 33, train_loss: 1.2667, test_loss: 1.2508, test_f1: 0.3205
 epoch: 34, train_loss: 1.2566, test_loss: 1.2451, test_f1: 0.3237
 epoch: 35, train_loss: 1.2555, test_loss: 1.2398, test_f1: 0.3232
 epoch: 36, train_loss: 1.2463, test_loss: 1.2349, test_f1: 0.3286
 epoch: 37, train_loss: 1.2428, test_loss: 1.2296, test_f1: 0.3216
 epoch: 38, train_loss: 1.2403, test_loss: 1.2243, test_f1: 0.3241
 epoch: 39, train_loss: 1.2348, test_loss: 1.2204, test_f1: 0.3225
 epoch: 40, train_loss: 1.2331, test_loss: 1.2181, test_f1: 0.3228
 epoch: 41, train_loss: 1.2280, test_loss: 1.2148, test_f1: 0.3332
 epoch: 42, train_loss: 1.2259, test_loss: 1.2101, test_f1: 0.3333
 epoch: 43, train_loss: 1.2254, test_loss: 1.2077, test_f1: 0.3377
 epoch: 44, train_loss: 1.2168, test_loss: 1.2061, test_f1: 0.3274
 epoch: 45, train_loss: 1.2110, test_loss: 1.2031, test_f1: 0.3237
 epoch: 46, train_loss: 1.2139, test_loss: 1.2002, test_f1: 0.3240
 epoch: 47, train_loss: 1.2062, test_loss: 1.1987, test_f1: 0.3269
 epoch: 48, train_loss: 1.2089, test_loss: 1.1954, test_f1: 0.3268
 epoch: 49, train_loss: 1.2063, test_loss: 1.1936, test_f1: 0.3309
 epoch: 50, train_loss: 1.1964, test_loss: 1.1907, test_f1: 0.3301
 epoch: 51, train_loss: 1.2017, test_loss: 1.1894, test_f1: 0.3318
 epoch: 52, train_loss: 1.1982, test_loss: 1.1885, test_f1: 0.3305
 epoch: 53, train_loss: 1.1935, test_loss: 1.1873, test_f1: 0.3310
 epoch: 54, train_loss: 1.1891, test_loss: 1.1872, test_f1: 0.3319
 epoch: 55, train_loss: 1.1891, test_loss: 1.1861, test_f1: 0.3332
 epoch: 56, train_loss: 1.1920, test_loss: 1.1856, test_f1: 0.3317
 epoch: 57, train_loss: 1.1919, test_loss: 1.1831, test_f1: 0.3322
 epoch: 58, train_loss: 1.1884, test_loss: 1.1823, test_f1: 0.3298
 epoch: 59, train_loss: 1.1903, test_loss: 1.1810, test_f1: 0.3298
 epoch: 60, train_loss: 1.1820, test_loss: 1.1799, test_f1: 0.3360
 epoch: 61, train_loss: 1.1836, test_loss: 1.1796, test_f1: 0.3410
 epoch: 62, train_loss: 1.1861, test_loss: 1.1780, test_f1: 0.3411
 epoch: 63, train_loss: 1.1811, test_loss: 1.1770, test_f1: 0.3355
 epoch: 64, train_loss: 1.1798, test_loss: 1.1761, test_f1: 0.3342
 epoch: 65, train_loss: 1.1798, test_loss: 1.1755, test_f1: 0.3367
 epoch: 66, train_loss: 1.1756, test_loss: 1.1745, test_f1: 0.3381
 epoch: 67, train_loss: 1.1775, test_loss: 1.1731, test_f1: 0.3393
 epoch: 68, train_loss: 1.1765, test_loss: 1.1728, test_f1: 0.3417
 epoch: 69, train_loss: 1.1736, test_loss: 1.1727, test_f1: 0.3408
 epoch: 70, train_loss: 1.1746, test_loss: 1.1722, test_f1: 0.3419
 epoch: 71, train_loss: 1.1689, test_loss: 1.1705, test_f1: 0.3432
 epoch: 72, train_loss: 1.1668, test_loss: 1.1700, test_f1: 0.3442
 epoch: 73, train_loss: 1.1672, test_loss: 1.1698, test_f1: 0.3420
 epoch: 74, train_loss: 1.1651, test_loss: 1.1689, test_f1: 0.3536
 epoch: 75, train_loss: 1.1661, test_loss: 1.1700, test_f1: 0.3567
 epoch: 76, train_loss: 1.1609, test_loss: 1.1690, test_f1: 0.3800
 epoch: 77, train_loss: 1.1585, test_loss: 1.1685, test_f1: 0.3569
 epoch: 78, train_loss: 1.1616, test_loss: 1.1685, test_f1: 0.3562
 epoch: 79, train_loss: 1.1623, test_loss: 1.1670, test_f1: 0.3538
 epoch: 80, train_loss: 1.1586, test_loss: 1.1655, test_f1: 0.3538
 epoch: 81, train_loss: 1.1590, test_loss: 1.1660, test_f1: 0.3429
 epoch: 82, train_loss: 1.1551, test_loss: 1.1655, test_f1: 0.3559
 epoch: 83, train_loss: 1.1541, test_loss: 1.1656, test_f1: 0.3726
 epoch: 84, train_loss: 1.1566, test_loss: 1.1659, test_f1: 0.3666
 epoch: 85, train_loss: 1.1497, test_loss: 1.1658, test_f1: 0.3541
 epoch: 86, train_loss: 1.1488, test_loss: 1.1652, test_f1: 0.3542
 epoch: 87, train_loss: 1.1542, test_loss: 1.1657, test_f1: 0.3566
 epoch: 88, train_loss: 1.1468, test_loss: 1.1646, test_f1: 0.3574
 epoch: 89, train_loss: 1.1464, test_loss: 1.1657, test_f1: 0.3578
 epoch: 90, train_loss: 1.1422, test_loss: 1.1623, test_f1: 0.3598
 epoch: 91, train_loss: 1.1388, test_loss: 1.1611, test_f1: 0.3707
 epoch: 92, train_loss: 1.1406, test_loss: 1.1625, test_f1: 0.3629
 epoch: 93, train_loss: 1.1442, test_loss: 1.1620, test_f1: 0.3649
 epoch: 94, train_loss: 1.1434, test_loss: 1.1588, test_f1: 0.3621
 epoch: 95, train_loss: 1.1458, test_loss: 1.1604, test_f1: 0.3583
 epoch: 96, train_loss: 1.1405, test_loss: 1.1600, test_f1: 0.3701
 epoch: 97, train_loss: 1.1378, test_loss: 1.1602, test_f1: 0.3602
 epoch: 98, train_loss: 1.1315, test_loss: 1.1606, test_f1: 0.3598
 epoch: 99, train_loss: 1.1342, test_loss: 1.1588, test_f1: 0.3671
##################ITERATION #1 ****************************************
 epoch: 0, train_loss: 1.3889, test_loss: 1.3882, test_f1: 0.1631
 epoch: 1, train_loss: 1.3829, test_loss: 1.3869, test_f1: 0.1637
 epoch: 2, train_loss: 1.3776, test_loss: 1.3823, test_f1: 0.1612
 epoch: 3, train_loss: 1.3732, test_loss: 1.3730, test_f1: 0.1886
 epoch: 4, train_loss: 1.3678, test_loss: 1.3659, test_f1: 0.2192
 epoch: 5, train_loss: 1.3618, test_loss: 1.3588, test_f1: 0.2568
 epoch: 6, train_loss: 1.3558, test_loss: 1.3509, test_f1: 0.2754
 epoch: 7, train_loss: 1.3503, test_loss: 1.3417, test_f1: 0.2629
 epoch: 8, train_loss: 1.3433, test_loss: 1.3340, test_f1: 0.2678
 epoch: 9, train_loss: 1.3350, test_loss: 1.3260, test_f1: 0.2793
 epoch: 10, train_loss: 1.3267, test_loss: 1.3185, test_f1: 0.2849
 epoch: 11, train_loss: 1.3192, test_loss: 1.3107, test_f1: 0.3008
 epoch: 12, train_loss: 1.3106, test_loss: 1.3021, test_f1: 0.3045
 epoch: 13, train_loss: 1.3037, test_loss: 1.2945, test_f1: 0.3061
 epoch: 14, train_loss: 1.2955, test_loss: 1.2873, test_f1: 0.2995
 epoch: 15, train_loss: 1.2889, test_loss: 1.2803, test_f1: 0.2897
 epoch: 16, train_loss: 1.2827, test_loss: 1.2733, test_f1: 0.2838
 epoch: 17, train_loss: 1.2730, test_loss: 1.2680, test_f1: 0.2788
 epoch: 18, train_loss: 1.2686, test_loss: 1.2626, test_f1: 0.2773
 epoch: 19, train_loss: 1.2586, test_loss: 1.2578, test_f1: 0.2737
 epoch: 20, train_loss: 1.2582, test_loss: 1.2528, test_f1: 0.2700
 epoch: 21, train_loss: 1.2501, test_loss: 1.2495, test_f1: 0.2715
 epoch: 22, train_loss: 1.2478, test_loss: 1.2455, test_f1: 0.2712
 epoch: 23, train_loss: 1.2421, test_loss: 1.2428, test_f1: 0.2688
 epoch: 24, train_loss: 1.2402, test_loss: 1.2397, test_f1: 0.2728
 epoch: 25, train_loss: 1.2420, test_loss: 1.2361, test_f1: 0.2756
 epoch: 26, train_loss: 1.2389, test_loss: 1.2334, test_f1: 0.2798
 epoch: 27, train_loss: 1.2308, test_loss: 1.2307, test_f1: 0.2865
 epoch: 28, train_loss: 1.2244, test_loss: 1.2280, test_f1: 0.2900
 epoch: 29, train_loss: 1.2225, test_loss: 1.2248, test_f1: 0.3011
 epoch: 30, train_loss: 1.2220, test_loss: 1.2223, test_f1: 0.3004
 epoch: 31, train_loss: 1.2226, test_loss: 1.2207, test_f1: 0.3147
 epoch: 32, train_loss: 1.2153, test_loss: 1.2180, test_f1: 0.3189
 epoch: 33, train_loss: 1.2139, test_loss: 1.2151, test_f1: 0.3189
 epoch: 34, train_loss: 1.2090, test_loss: 1.2124, test_f1: 0.3201
 epoch: 35, train_loss: 1.2053, test_loss: 1.2105, test_f1: 0.3255
 epoch: 36, train_loss: 1.2079, test_loss: 1.2069, test_f1: 0.3334
 epoch: 37, train_loss: 1.1999, test_loss: 1.2052, test_f1: 0.3429
 epoch: 38, train_loss: 1.1974, test_loss: 1.2031, test_f1: 0.3354
 epoch: 39, train_loss: 1.1977, test_loss: 1.1997, test_f1: 0.3411
 epoch: 40, train_loss: 1.1964, test_loss: 1.1976, test_f1: 0.3501
 epoch: 41, train_loss: 1.1925, test_loss: 1.1955, test_f1: 0.3506
 epoch: 42, train_loss: 1.1858, test_loss: 1.1913, test_f1: 0.3553
 epoch: 43, train_loss: 1.1871, test_loss: 1.1879, test_f1: 0.3569
 epoch: 44, train_loss: 1.1841, test_loss: 1.1856, test_f1: 0.3587
 epoch: 45, train_loss: 1.1781, test_loss: 1.1833, test_f1: 0.3624
 epoch: 46, train_loss: 1.1748, test_loss: 1.1827, test_f1: 0.3664
 epoch: 47, train_loss: 1.1713, test_loss: 1.1798, test_f1: 0.3711
 epoch: 48, train_loss: 1.1684, test_loss: 1.1784, test_f1: 0.3724
 epoch: 49, train_loss: 1.1632, test_loss: 1.1765, test_f1: 0.3660
 epoch: 50, train_loss: 1.1636, test_loss: 1.1722, test_f1: 0.3894
 epoch: 51, train_loss: 1.1621, test_loss: 1.1700, test_f1: 0.3894
 epoch: 52, train_loss: 1.1636, test_loss: 1.1696, test_f1: 0.3678
 epoch: 53, train_loss: 1.1630, test_loss: 1.1690, test_f1: 0.3684
 epoch: 54, train_loss: 1.1561, test_loss: 1.1668, test_f1: 0.3846
 epoch: 55, train_loss: 1.1527, test_loss: 1.1658, test_f1: 0.3903
 epoch: 56, train_loss: 1.1510, test_loss: 1.1650, test_f1: 0.3902
 epoch: 57, train_loss: 1.1556, test_loss: 1.1644, test_f1: 0.3864
 epoch: 58, train_loss: 1.1539, test_loss: 1.1644, test_f1: 0.3670
 epoch: 59, train_loss: 1.1482, test_loss: 1.1634, test_f1: 0.3715
 epoch: 60, train_loss: 1.1484, test_loss: 1.1616, test_f1: 0.3888
 epoch: 61, train_loss: 1.1489, test_loss: 1.1606, test_f1: 0.3831
 epoch: 62, train_loss: 1.1554, test_loss: 1.1610, test_f1: 0.3879
 epoch: 63, train_loss: 1.1405, test_loss: 1.1590, test_f1: 0.3936
 epoch: 64, train_loss: 1.1483, test_loss: 1.1587, test_f1: 0.3888
 epoch: 65, train_loss: 1.1427, test_loss: 1.1583, test_f1: 0.3800
 epoch: 66, train_loss: 1.1381, test_loss: 1.1578, test_f1: 0.3799
 epoch: 67, train_loss: 1.1354, test_loss: 1.1568, test_f1: 0.3825
 epoch: 68, train_loss: 1.1386, test_loss: 1.1564, test_f1: 0.3750
 epoch: 69, train_loss: 1.1349, test_loss: 1.1556, test_f1: 0.3708
 epoch: 70, train_loss: 1.1343, test_loss: 1.1535, test_f1: 0.3935
 epoch: 71, train_loss: 1.1335, test_loss: 1.1528, test_f1: 0.3908
 epoch: 72, train_loss: 1.1347, test_loss: 1.1521, test_f1: 0.3858
 epoch: 73, train_loss: 1.1275, test_loss: 1.1519, test_f1: 0.3851
 epoch: 74, train_loss: 1.1275, test_loss: 1.1507, test_f1: 0.3924
 epoch: 75, train_loss: 1.1257, test_loss: 1.1505, test_f1: 0.3778
 epoch: 76, train_loss: 1.1242, test_loss: 1.1497, test_f1: 0.3661
 epoch: 77, train_loss: 1.1218, test_loss: 1.1493, test_f1: 0.3819
 epoch: 78, train_loss: 1.1183, test_loss: 1.1485, test_f1: 0.3755
 epoch: 79, train_loss: 1.1242, test_loss: 1.1477, test_f1: 0.3708
 epoch: 80, train_loss: 1.1196, test_loss: 1.1455, test_f1: 0.3690
 epoch: 81, train_loss: 1.1166, test_loss: 1.1455, test_f1: 0.3723
 epoch: 82, train_loss: 1.1180, test_loss: 1.1460, test_f1: 0.3876
 epoch: 83, train_loss: 1.1169, test_loss: 1.1477, test_f1: 0.3875
 epoch: 84, train_loss: 1.1148, test_loss: 1.1467, test_f1: 0.3830
 epoch: 85, train_loss: 1.1120, test_loss: 1.1448, test_f1: 0.3885
 epoch: 86, train_loss: 1.1077, test_loss: 1.1449, test_f1: 0.3851
 epoch: 87, train_loss: 1.1151, test_loss: 1.1429, test_f1: 0.3920
 epoch: 88, train_loss: 1.1140, test_loss: 1.1418, test_f1: 0.3907
 epoch: 89, train_loss: 1.1095, test_loss: 1.1430, test_f1: 0.3899
 epoch: 90, train_loss: 1.1089, test_loss: 1.1430, test_f1: 0.3860
 epoch: 91, train_loss: 1.1067, test_loss: 1.1404, test_f1: 0.3900
 epoch: 92, train_loss: 1.1087, test_loss: 1.1407, test_f1: 0.3900
 epoch: 93, train_loss: 1.1073, test_loss: 1.1421, test_f1: 0.3861
 epoch: 94, train_loss: 1.1025, test_loss: 1.1417, test_f1: 0.3871
 epoch: 95, train_loss: 1.1041, test_loss: 1.1422, test_f1: 0.3991
 epoch: 96, train_loss: 1.1024, test_loss: 1.1432, test_f1: 0.3908
 epoch: 97, train_loss: 1.0970, test_loss: 1.1426, test_f1: 0.3950
 epoch: 98, train_loss: 1.1001, test_loss: 1.1407, test_f1: 0.4002
 epoch: 99, train_loss: 1.0924, test_loss: 1.1406, test_f1: 0.4026
##################ITERATION #2 ****************************************
 epoch: 0, train_loss: 1.3444, test_loss: 1.3530, test_f1: 0.2274
 epoch: 1, train_loss: 1.3351, test_loss: 1.3441, test_f1: 0.2274
 epoch: 2, train_loss: 1.3281, test_loss: 1.3372, test_f1: 0.2274
 epoch: 3, train_loss: 1.3200, test_loss: 1.3296, test_f1: 0.2274
 epoch: 4, train_loss: 1.3144, test_loss: 1.3218, test_f1: 0.2582
 epoch: 5, train_loss: 1.3081, test_loss: 1.3105, test_f1: 0.2708
 epoch: 6, train_loss: 1.3034, test_loss: 1.2984, test_f1: 0.2588
 epoch: 7, train_loss: 1.2962, test_loss: 1.2901, test_f1: 0.2769
 epoch: 8, train_loss: 1.2902, test_loss: 1.2848, test_f1: 0.2621
 epoch: 9, train_loss: 1.2844, test_loss: 1.2787, test_f1: 0.2615
 epoch: 10, train_loss: 1.2798, test_loss: 1.2736, test_f1: 0.2700
 epoch: 11, train_loss: 1.2745, test_loss: 1.2694, test_f1: 0.2863
 epoch: 12, train_loss: 1.2678, test_loss: 1.2634, test_f1: 0.2906
 epoch: 13, train_loss: 1.2628, test_loss: 1.2573, test_f1: 0.3005
 epoch: 14, train_loss: 1.2586, test_loss: 1.2528, test_f1: 0.3119
 epoch: 15, train_loss: 1.2567, test_loss: 1.2478, test_f1: 0.3120
 epoch: 16, train_loss: 1.2510, test_loss: 1.2434, test_f1: 0.3218
 epoch: 17, train_loss: 1.2444, test_loss: 1.2375, test_f1: 0.3233
 epoch: 18, train_loss: 1.2442, test_loss: 1.2334, test_f1: 0.3261
 epoch: 19, train_loss: 1.2408, test_loss: 1.2295, test_f1: 0.3280
 epoch: 20, train_loss: 1.2381, test_loss: 1.2271, test_f1: 0.3273
 epoch: 21, train_loss: 1.2330, test_loss: 1.2239, test_f1: 0.3315
 epoch: 22, train_loss: 1.2280, test_loss: 1.2206, test_f1: 0.3351
 epoch: 23, train_loss: 1.2267, test_loss: 1.2160, test_f1: 0.3377
 epoch: 24, train_loss: 1.2233, test_loss: 1.2120, test_f1: 0.3403
 epoch: 25, train_loss: 1.2238, test_loss: 1.2095, test_f1: 0.3385
 epoch: 26, train_loss: 1.2160, test_loss: 1.2079, test_f1: 0.3376
 epoch: 27, train_loss: 1.2173, test_loss: 1.2053, test_f1: 0.3410
 epoch: 28, train_loss: 1.2140, test_loss: 1.2024, test_f1: 0.3461
 epoch: 29, train_loss: 1.2091, test_loss: 1.2008, test_f1: 0.3464
 epoch: 30, train_loss: 1.2047, test_loss: 1.1989, test_f1: 0.3459
 epoch: 31, train_loss: 1.2064, test_loss: 1.1961, test_f1: 0.3458
 epoch: 32, train_loss: 1.1993, test_loss: 1.1943, test_f1: 0.3470
 epoch: 33, train_loss: 1.2046, test_loss: 1.1920, test_f1: 0.3481
 epoch: 34, train_loss: 1.1957, test_loss: 1.1897, test_f1: 0.3478
 epoch: 35, train_loss: 1.1915, test_loss: 1.1870, test_f1: 0.3466
 epoch: 36, train_loss: 1.1920, test_loss: 1.1849, test_f1: 0.3502
 epoch: 37, train_loss: 1.1929, test_loss: 1.1827, test_f1: 0.3518
 epoch: 38, train_loss: 1.1896, test_loss: 1.1811, test_f1: 0.3530
 epoch: 39, train_loss: 1.1868, test_loss: 1.1804, test_f1: 0.3485
 epoch: 40, train_loss: 1.1858, test_loss: 1.1799, test_f1: 0.3438
 epoch: 41, train_loss: 1.1854, test_loss: 1.1788, test_f1: 0.3419
 epoch: 42, train_loss: 1.1868, test_loss: 1.1776, test_f1: 0.3394
 epoch: 43, train_loss: 1.1806, test_loss: 1.1774, test_f1: 0.3423
 epoch: 44, train_loss: 1.1780, test_loss: 1.1766, test_f1: 0.3437
 epoch: 45, train_loss: 1.1728, test_loss: 1.1758, test_f1: 0.3420
 epoch: 46, train_loss: 1.1797, test_loss: 1.1735, test_f1: 0.3404
 epoch: 47, train_loss: 1.1726, test_loss: 1.1706, test_f1: 0.3362
 epoch: 48, train_loss: 1.1697, test_loss: 1.1668, test_f1: 0.3369
 epoch: 49, train_loss: 1.1709, test_loss: 1.1670, test_f1: 0.3336
 epoch: 50, train_loss: 1.1714, test_loss: 1.1672, test_f1: 0.3345
 epoch: 51, train_loss: 1.1627, test_loss: 1.1676, test_f1: 0.3331
 epoch: 52, train_loss: 1.1625, test_loss: 1.1675, test_f1: 0.3412
 epoch: 53, train_loss: 1.1579, test_loss: 1.1668, test_f1: 0.3414
 epoch: 54, train_loss: 1.1642, test_loss: 1.1668, test_f1: 0.3352
 epoch: 55, train_loss: 1.1572, test_loss: 1.1646, test_f1: 0.3394
 epoch: 56, train_loss: 1.1605, test_loss: 1.1652, test_f1: 0.3463
 epoch: 57, train_loss: 1.1602, test_loss: 1.1648, test_f1: 0.3403
 epoch: 58, train_loss: 1.1604, test_loss: 1.1641, test_f1: 0.3399
 epoch: 59, train_loss: 1.1546, test_loss: 1.1642, test_f1: 0.3392
 epoch: 60, train_loss: 1.1576, test_loss: 1.1630, test_f1: 0.3445
 epoch: 61, train_loss: 1.1524, test_loss: 1.1642, test_f1: 0.3450
 epoch: 62, train_loss: 1.1520, test_loss: 1.1643, test_f1: 0.3520
 epoch: 63, train_loss: 1.1551, test_loss: 1.1632, test_f1: 0.3410
 epoch: 64, train_loss: 1.1487, test_loss: 1.1619, test_f1: 0.3490
 epoch: 65, train_loss: 1.1472, test_loss: 1.1603, test_f1: 0.3532
 epoch: 66, train_loss: 1.1474, test_loss: 1.1612, test_f1: 0.3543
 epoch: 67, train_loss: 1.1496, test_loss: 1.1590, test_f1: 0.3557
 epoch: 68, train_loss: 1.1479, test_loss: 1.1597, test_f1: 0.3513
 epoch: 69, train_loss: 1.1430, test_loss: 1.1612, test_f1: 0.3504
 epoch: 70, train_loss: 1.1440, test_loss: 1.1599, test_f1: 0.3476
 epoch: 71, train_loss: 1.1464, test_loss: 1.1598, test_f1: 0.3463
 epoch: 72, train_loss: 1.1396, test_loss: 1.1585, test_f1: 0.3510
 epoch: 73, train_loss: 1.1458, test_loss: 1.1575, test_f1: 0.3445
 epoch: 74, train_loss: 1.1424, test_loss: 1.1575, test_f1: 0.3442
 epoch: 75, train_loss: 1.1430, test_loss: 1.1567, test_f1: 0.3489
 epoch: 76, train_loss: 1.1418, test_loss: 1.1550, test_f1: 0.3488
 epoch: 77, train_loss: 1.1347, test_loss: 1.1554, test_f1: 0.3461
 epoch: 78, train_loss: 1.1397, test_loss: 1.1569, test_f1: 0.3527
 epoch: 79, train_loss: 1.1352, test_loss: 1.1569, test_f1: 0.3517
 epoch: 80, train_loss: 1.1380, test_loss: 1.1524, test_f1: 0.3480
 epoch: 81, train_loss: 1.1358, test_loss: 1.1523, test_f1: 0.3480
 epoch: 82, train_loss: 1.1365, test_loss: 1.1521, test_f1: 0.3497
 epoch: 83, train_loss: 1.1293, test_loss: 1.1531, test_f1: 0.3471
 epoch: 84, train_loss: 1.1323, test_loss: 1.1521, test_f1: 0.3484
 epoch: 85, train_loss: 1.1282, test_loss: 1.1515, test_f1: 0.3555
 epoch: 86, train_loss: 1.1286, test_loss: 1.1519, test_f1: 0.3603
 epoch: 87, train_loss: 1.1236, test_loss: 1.1540, test_f1: 0.3501
 epoch: 88, train_loss: 1.1283, test_loss: 1.1535, test_f1: 0.3519
 epoch: 89, train_loss: 1.1237, test_loss: 1.1515, test_f1: 0.3506
 epoch: 90, train_loss: 1.1284, test_loss: 1.1517, test_f1: 0.3525
 epoch: 91, train_loss: 1.1261, test_loss: 1.1504, test_f1: 0.3515
 epoch: 92, train_loss: 1.1233, test_loss: 1.1493, test_f1: 0.3511
 epoch: 93, train_loss: 1.1232, test_loss: 1.1497, test_f1: 0.3534
 epoch: 94, train_loss: 1.1212, test_loss: 1.1499, test_f1: 0.3480
 epoch: 95, train_loss: 1.1218, test_loss: 1.1501, test_f1: 0.3589
 epoch: 96, train_loss: 1.1206, test_loss: 1.1488, test_f1: 0.3581
 epoch: 97, train_loss: 1.1211, test_loss: 1.1478, test_f1: 0.3610
 epoch: 98, train_loss: 1.1200, test_loss: 1.1462, test_f1: 0.3622
 epoch: 99, train_loss: 1.1206, test_loss: 1.1452, test_f1: 0.3628
##################ITERATION #3 ****************************************
 epoch: 0, train_loss: 1.3419, test_loss: 1.3593, test_f1: 0.2274
 epoch: 1, train_loss: 1.3307, test_loss: 1.3527, test_f1: 0.2274
 epoch: 2, train_loss: 1.3256, test_loss: 1.3404, test_f1: 0.2269
 epoch: 3, train_loss: 1.3200, test_loss: 1.3305, test_f1: 0.2329
 epoch: 4, train_loss: 1.3129, test_loss: 1.3193, test_f1: 0.2345
 epoch: 5, train_loss: 1.3094, test_loss: 1.3077, test_f1: 0.2643
 epoch: 6, train_loss: 1.3016, test_loss: 1.2984, test_f1: 0.2705
 epoch: 7, train_loss: 1.2975, test_loss: 1.2910, test_f1: 0.2755
 epoch: 8, train_loss: 1.2914, test_loss: 1.2854, test_f1: 0.2769
 epoch: 9, train_loss: 1.2856, test_loss: 1.2793, test_f1: 0.2869
 epoch: 10, train_loss: 1.2812, test_loss: 1.2719, test_f1: 0.2932
 epoch: 11, train_loss: 1.2780, test_loss: 1.2678, test_f1: 0.2820
 epoch: 12, train_loss: 1.2721, test_loss: 1.2594, test_f1: 0.2991
 epoch: 13, train_loss: 1.2665, test_loss: 1.2521, test_f1: 0.3068
 epoch: 14, train_loss: 1.2638, test_loss: 1.2462, test_f1: 0.3043
 epoch: 15, train_loss: 1.2566, test_loss: 1.2431, test_f1: 0.3190
 epoch: 16, train_loss: 1.2525, test_loss: 1.2376, test_f1: 0.3290
 epoch: 17, train_loss: 1.2485, test_loss: 1.2328, test_f1: 0.3328
 epoch: 18, train_loss: 1.2408, test_loss: 1.2283, test_f1: 0.3363
 epoch: 19, train_loss: 1.2433, test_loss: 1.2244, test_f1: 0.3354
 epoch: 20, train_loss: 1.2369, test_loss: 1.2204, test_f1: 0.3353
 epoch: 21, train_loss: 1.2343, test_loss: 1.2180, test_f1: 0.3388
 epoch: 22, train_loss: 1.2310, test_loss: 1.2148, test_f1: 0.3309
 epoch: 23, train_loss: 1.2304, test_loss: 1.2112, test_f1: 0.3299
 epoch: 24, train_loss: 1.2270, test_loss: 1.2080, test_f1: 0.3287
 epoch: 25, train_loss: 1.2218, test_loss: 1.2054, test_f1: 0.3291
 epoch: 26, train_loss: 1.2183, test_loss: 1.2031, test_f1: 0.3328
 epoch: 27, train_loss: 1.2195, test_loss: 1.2001, test_f1: 0.3352
 epoch: 28, train_loss: 1.2137, test_loss: 1.1987, test_f1: 0.3354
 epoch: 29, train_loss: 1.2116, test_loss: 1.1961, test_f1: 0.3395
 epoch: 30, train_loss: 1.2089, test_loss: 1.1939, test_f1: 0.3459
 epoch: 31, train_loss: 1.2080, test_loss: 1.1926, test_f1: 0.3558
 epoch: 32, train_loss: 1.2021, test_loss: 1.1911, test_f1: 0.3572
 epoch: 33, train_loss: 1.1949, test_loss: 1.1878, test_f1: 0.3603
 epoch: 34, train_loss: 1.2061, test_loss: 1.1843, test_f1: 0.3597
 epoch: 35, train_loss: 1.1966, test_loss: 1.1818, test_f1: 0.3573
 epoch: 36, train_loss: 1.1988, test_loss: 1.1804, test_f1: 0.3654
 epoch: 37, train_loss: 1.1895, test_loss: 1.1774, test_f1: 0.3741
 epoch: 38, train_loss: 1.1893, test_loss: 1.1771, test_f1: 0.3629
 epoch: 39, train_loss: 1.1883, test_loss: 1.1759, test_f1: 0.3649
 epoch: 40, train_loss: 1.1791, test_loss: 1.1731, test_f1: 0.3682
 epoch: 41, train_loss: 1.1841, test_loss: 1.1738, test_f1: 0.3640
 epoch: 42, train_loss: 1.1807, test_loss: 1.1694, test_f1: 0.3710
 epoch: 43, train_loss: 1.1776, test_loss: 1.1670, test_f1: 0.3645
 epoch: 44, train_loss: 1.1774, test_loss: 1.1676, test_f1: 0.3712
 epoch: 45, train_loss: 1.1631, test_loss: 1.1634, test_f1: 0.3777
 epoch: 46, train_loss: 1.1676, test_loss: 1.1628, test_f1: 0.3791
 epoch: 47, train_loss: 1.1686, test_loss: 1.1621, test_f1: 0.3763
 epoch: 48, train_loss: 1.1677, test_loss: 1.1584, test_f1: 0.3698
 epoch: 49, train_loss: 1.1620, test_loss: 1.1567, test_f1: 0.3696
 epoch: 50, train_loss: 1.1585, test_loss: 1.1536, test_f1: 0.3731
 epoch: 51, train_loss: 1.1561, test_loss: 1.1532, test_f1: 0.3743
 epoch: 52, train_loss: 1.1568, test_loss: 1.1509, test_f1: 0.3762
 epoch: 53, train_loss: 1.1561, test_loss: 1.1493, test_f1: 0.3756
 epoch: 54, train_loss: 1.1506, test_loss: 1.1499, test_f1: 0.3805
 epoch: 55, train_loss: 1.1532, test_loss: 1.1479, test_f1: 0.3762
 epoch: 56, train_loss: 1.1491, test_loss: 1.1478, test_f1: 0.3807
 epoch: 57, train_loss: 1.1504, test_loss: 1.1461, test_f1: 0.3765
 epoch: 58, train_loss: 1.1445, test_loss: 1.1451, test_f1: 0.3823
 epoch: 59, train_loss: 1.1496, test_loss: 1.1440, test_f1: 0.3835
 epoch: 60, train_loss: 1.1502, test_loss: 1.1428, test_f1: 0.3815
 epoch: 61, train_loss: 1.1462, test_loss: 1.1426, test_f1: 0.3789
 epoch: 62, train_loss: 1.1398, test_loss: 1.1423, test_f1: 0.3766
 epoch: 63, train_loss: 1.1418, test_loss: 1.1393, test_f1: 0.3846
 epoch: 64, train_loss: 1.1397, test_loss: 1.1386, test_f1: 0.3806
 epoch: 65, train_loss: 1.1394, test_loss: 1.1363, test_f1: 0.3808
 epoch: 66, train_loss: 1.1402, test_loss: 1.1371, test_f1: 0.3754
 epoch: 67, train_loss: 1.1378, test_loss: 1.1360, test_f1: 0.3790
 epoch: 68, train_loss: 1.1358, test_loss: 1.1360, test_f1: 0.3740
 epoch: 69, train_loss: 1.1359, test_loss: 1.1362, test_f1: 0.3797
 epoch: 70, train_loss: 1.1312, test_loss: 1.1340, test_f1: 0.3721
 epoch: 71, train_loss: 1.1351, test_loss: 1.1305, test_f1: 0.3792
 epoch: 72, train_loss: 1.1275, test_loss: 1.1332, test_f1: 0.3793
 epoch: 73, train_loss: 1.1355, test_loss: 1.1322, test_f1: 0.3720
 epoch: 74, train_loss: 1.1264, test_loss: 1.1299, test_f1: 0.3726
 epoch: 75, train_loss: 1.1246, test_loss: 1.1290, test_f1: 0.3730
 epoch: 76, train_loss: 1.1252, test_loss: 1.1307, test_f1: 0.3729
 epoch: 77, train_loss: 1.1299, test_loss: 1.1298, test_f1: 0.3773
 epoch: 78, train_loss: 1.1227, test_loss: 1.1308, test_f1: 0.3752
 epoch: 79, train_loss: 1.1242, test_loss: 1.1278, test_f1: 0.3761
 epoch: 80, train_loss: 1.1306, test_loss: 1.1256, test_f1: 0.3817
 epoch: 81, train_loss: 1.1201, test_loss: 1.1267, test_f1: 0.3829
 epoch: 82, train_loss: 1.1262, test_loss: 1.1242, test_f1: 0.3759
 epoch: 83, train_loss: 1.1203, test_loss: 1.1247, test_f1: 0.3746
 epoch: 84, train_loss: 1.1235, test_loss: 1.1269, test_f1: 0.3784
 epoch: 85, train_loss: 1.1183, test_loss: 1.1266, test_f1: 0.3767
 epoch: 86, train_loss: 1.1166, test_loss: 1.1292, test_f1: 0.3826
 epoch: 87, train_loss: 1.1134, test_loss: 1.1258, test_f1: 0.3799
 epoch: 88, train_loss: 1.1086, test_loss: 1.1269, test_f1: 0.3754
 epoch: 89, train_loss: 1.1118, test_loss: 1.1282, test_f1: 0.3762
 epoch: 90, train_loss: 1.1171, test_loss: 1.1340, test_f1: 0.3796
 epoch: 91, train_loss: 1.1114, test_loss: 1.1245, test_f1: 0.3818
 epoch: 92, train_loss: 1.1115, test_loss: 1.1230, test_f1: 0.3819
 epoch: 93, train_loss: 1.1078, test_loss: 1.1183, test_f1: 0.3874
 epoch: 94, train_loss: 1.1036, test_loss: 1.1207, test_f1: 0.3840
 epoch: 95, train_loss: 1.1054, test_loss: 1.1192, test_f1: 0.3942
 epoch: 96, train_loss: 1.1077, test_loss: 1.1264, test_f1: 0.4013
 epoch: 97, train_loss: 1.1002, test_loss: 1.1251, test_f1: 0.4033
 epoch: 98, train_loss: 1.1117, test_loss: 1.1198, test_f1: 0.4038
 epoch: 99, train_loss: 1.1012, test_loss: 1.1212, test_f1: 0.4052
##################ITERATION #4 ****************************************
 epoch: 0, train_loss: 1.3141, test_loss: 1.3578, test_f1: 0.2274
 epoch: 1, train_loss: 1.3022, test_loss: 1.3398, test_f1: 0.2274
 epoch: 2, train_loss: 1.2951, test_loss: 1.3213, test_f1: 0.2274
 epoch: 3, train_loss: 1.2882, test_loss: 1.3010, test_f1: 0.2390
 epoch: 4, train_loss: 1.2798, test_loss: 1.2824, test_f1: 0.2488
 epoch: 5, train_loss: 1.2727, test_loss: 1.2671, test_f1: 0.2847
 epoch: 6, train_loss: 1.2703, test_loss: 1.2597, test_f1: 0.2956
 epoch: 7, train_loss: 1.2609, test_loss: 1.2548, test_f1: 0.3015
 epoch: 8, train_loss: 1.2578, test_loss: 1.2486, test_f1: 0.2942
 epoch: 9, train_loss: 1.2518, test_loss: 1.2421, test_f1: 0.3173
 epoch: 10, train_loss: 1.2492, test_loss: 1.2364, test_f1: 0.3201
 epoch: 11, train_loss: 1.2469, test_loss: 1.2330, test_f1: 0.3117
 epoch: 12, train_loss: 1.2382, test_loss: 1.2285, test_f1: 0.3133
 epoch: 13, train_loss: 1.2329, test_loss: 1.2238, test_f1: 0.3117
 epoch: 14, train_loss: 1.2263, test_loss: 1.2178, test_f1: 0.3215
 epoch: 15, train_loss: 1.2279, test_loss: 1.2146, test_f1: 0.3146
 epoch: 16, train_loss: 1.2273, test_loss: 1.2096, test_f1: 0.3185
 epoch: 17, train_loss: 1.2211, test_loss: 1.2070, test_f1: 0.3276
 epoch: 18, train_loss: 1.2171, test_loss: 1.2043, test_f1: 0.3290
 epoch: 19, train_loss: 1.2182, test_loss: 1.2016, test_f1: 0.3305
 epoch: 20, train_loss: 1.2115, test_loss: 1.1965, test_f1: 0.3426
 epoch: 21, train_loss: 1.2097, test_loss: 1.1945, test_f1: 0.3440
 epoch: 22, train_loss: 1.2031, test_loss: 1.1933, test_f1: 0.3361
 epoch: 23, train_loss: 1.2077, test_loss: 1.1909, test_f1: 0.3350
 epoch: 24, train_loss: 1.1985, test_loss: 1.1906, test_f1: 0.3331
 epoch: 25, train_loss: 1.2013, test_loss: 1.1883, test_f1: 0.3344
 epoch: 26, train_loss: 1.1939, test_loss: 1.1860, test_f1: 0.3306
 epoch: 27, train_loss: 1.1888, test_loss: 1.1832, test_f1: 0.3306
 epoch: 28, train_loss: 1.1886, test_loss: 1.1809, test_f1: 0.3301
 epoch: 29, train_loss: 1.1887, test_loss: 1.1781, test_f1: 0.3346
 epoch: 30, train_loss: 1.1842, test_loss: 1.1763, test_f1: 0.3395
 epoch: 31, train_loss: 1.1809, test_loss: 1.1755, test_f1: 0.3424
 epoch: 32, train_loss: 1.1714, test_loss: 1.1733, test_f1: 0.3391
 epoch: 33, train_loss: 1.1749, test_loss: 1.1719, test_f1: 0.3365
 epoch: 34, train_loss: 1.1731, test_loss: 1.1692, test_f1: 0.3356
 epoch: 35, train_loss: 1.1736, test_loss: 1.1663, test_f1: 0.3356
 epoch: 36, train_loss: 1.1624, test_loss: 1.1663, test_f1: 0.3410
 epoch: 37, train_loss: 1.1619, test_loss: 1.1660, test_f1: 0.3369
 epoch: 38, train_loss: 1.1599, test_loss: 1.1636, test_f1: 0.3405
 epoch: 39, train_loss: 1.1558, test_loss: 1.1633, test_f1: 0.3390
 epoch: 40, train_loss: 1.1567, test_loss: 1.1616, test_f1: 0.3406
 epoch: 41, train_loss: 1.1462, test_loss: 1.1593, test_f1: 0.3416
 epoch: 42, train_loss: 1.1486, test_loss: 1.1606, test_f1: 0.3450
 epoch: 43, train_loss: 1.1433, test_loss: 1.1613, test_f1: 0.3467
 epoch: 44, train_loss: 1.1397, test_loss: 1.1619, test_f1: 0.3577
 epoch: 45, train_loss: 1.1362, test_loss: 1.1568, test_f1: 0.3481
 epoch: 46, train_loss: 1.1342, test_loss: 1.1535, test_f1: 0.3480
 epoch: 47, train_loss: 1.1390, test_loss: 1.1524, test_f1: 0.3513
 epoch: 48, train_loss: 1.1342, test_loss: 1.1554, test_f1: 0.3648
 epoch: 49, train_loss: 1.1230, test_loss: 1.1550, test_f1: 0.3910
 epoch: 50, train_loss: 1.1264, test_loss: 1.1539, test_f1: 0.3971
 epoch: 51, train_loss: 1.1179, test_loss: 1.1540, test_f1: 0.4092
 epoch: 52, train_loss: 1.1171, test_loss: 1.1539, test_f1: 0.4154
 epoch: 53, train_loss: 1.1189, test_loss: 1.1518, test_f1: 0.4180
 epoch: 54, train_loss: 1.1205, test_loss: 1.1505, test_f1: 0.4139
 epoch: 55, train_loss: 1.1191, test_loss: 1.1527, test_f1: 0.4232
 epoch: 56, train_loss: 1.1231, test_loss: 1.1517, test_f1: 0.4312
 epoch: 57, train_loss: 1.1143, test_loss: 1.1476, test_f1: 0.4354
 epoch: 58, train_loss: 1.1151, test_loss: 1.1481, test_f1: 0.4403
 epoch: 59, train_loss: 1.1113, test_loss: 1.1449, test_f1: 0.4402
 epoch: 60, train_loss: 1.1151, test_loss: 1.1471, test_f1: 0.4355
 epoch: 61, train_loss: 1.1088, test_loss: 1.1453, test_f1: 0.4409
 epoch: 62, train_loss: 1.1064, test_loss: 1.1456, test_f1: 0.4408
 epoch: 63, train_loss: 1.1074, test_loss: 1.1462, test_f1: 0.4400
 epoch: 64, train_loss: 1.1199, test_loss: 1.1422, test_f1: 0.4402
 epoch: 65, train_loss: 1.1081, test_loss: 1.1440, test_f1: 0.4372
 epoch: 66, train_loss: 1.1110, test_loss: 1.1463, test_f1: 0.4384
 epoch: 67, train_loss: 1.1052, test_loss: 1.1443, test_f1: 0.4323
 epoch: 68, train_loss: 1.1027, test_loss: 1.1427, test_f1: 0.4433
 epoch: 69, train_loss: 1.0990, test_loss: 1.1456, test_f1: 0.4484
 epoch: 70, train_loss: 1.1025, test_loss: 1.1471, test_f1: 0.4475
 epoch: 71, train_loss: 1.0972, test_loss: 1.1426, test_f1: 0.4434
 epoch: 72, train_loss: 1.0948, test_loss: 1.1390, test_f1: 0.4468
 epoch: 73, train_loss: 1.0913, test_loss: 1.1371, test_f1: 0.4466
 epoch: 74, train_loss: 1.0933, test_loss: 1.1392, test_f1: 0.4463
 epoch: 75, train_loss: 1.0955, test_loss: 1.1417, test_f1: 0.4434
 epoch: 76, train_loss: 1.0907, test_loss: 1.1440, test_f1: 0.4491
 epoch: 77, train_loss: 1.0958, test_loss: 1.1403, test_f1: 0.4477
 epoch: 78, train_loss: 1.0885, test_loss: 1.1394, test_f1: 0.4584
 epoch: 79, train_loss: 1.0916, test_loss: 1.1405, test_f1: 0.4570
 epoch: 80, train_loss: 1.0963, test_loss: 1.1367, test_f1: 0.4564
 epoch: 81, train_loss: 1.0922, test_loss: 1.1424, test_f1: 0.4546
 epoch: 82, train_loss: 1.0916, test_loss: 1.1383, test_f1: 0.4582
 epoch: 83, train_loss: 1.0888, test_loss: 1.1413, test_f1: 0.4561
 epoch: 84, train_loss: 1.0875, test_loss: 1.1386, test_f1: 0.4617
 epoch: 85, train_loss: 1.0848, test_loss: 1.1418, test_f1: 0.4562
 epoch: 86, train_loss: 1.0732, test_loss: 1.1376, test_f1: 0.4574
 epoch: 87, train_loss: 1.0791, test_loss: 1.1365, test_f1: 0.4623
 epoch: 88, train_loss: 1.0802, test_loss: 1.1336, test_f1: 0.4608
 epoch: 89, train_loss: 1.0813, test_loss: 1.1362, test_f1: 0.4667
 epoch: 90, train_loss: 1.0770, test_loss: 1.1355, test_f1: 0.4633
 epoch: 91, train_loss: 1.0760, test_loss: 1.1337, test_f1: 0.4632
 epoch: 92, train_loss: 1.0758, test_loss: 1.1353, test_f1: 0.4688
 epoch: 93, train_loss: 1.0732, test_loss: 1.1368, test_f1: 0.4647
 epoch: 94, train_loss: 1.0714, test_loss: 1.1341, test_f1: 0.4624
 epoch: 95, train_loss: 1.0733, test_loss: 1.1374, test_f1: 0.4606
 epoch: 96, train_loss: 1.0709, test_loss: 1.1369, test_f1: 0.4633
 epoch: 97, train_loss: 1.0623, test_loss: 1.1346, test_f1: 0.4679
 epoch: 98, train_loss: 1.0685, test_loss: 1.1350, test_f1: 0.4593
 epoch: 99, train_loss: 1.0668, test_loss: 1.1400, test_f1: 0.4641
##################ITERATION #5 ****************************************
 epoch: 0, train_loss: 1.3096, test_loss: 1.3322, test_f1: 0.2274
 epoch: 1, train_loss: 1.2931, test_loss: 1.3237, test_f1: 0.2274
 epoch: 2, train_loss: 1.2856, test_loss: 1.3106, test_f1: 0.2274
 epoch: 3, train_loss: 1.2776, test_loss: 1.2917, test_f1: 0.2269
 epoch: 4, train_loss: 1.2717, test_loss: 1.2701, test_f1: 0.2676
 epoch: 5, train_loss: 1.2651, test_loss: 1.2571, test_f1: 0.2808
 epoch: 6, train_loss: 1.2582, test_loss: 1.2451, test_f1: 0.2985
 epoch: 7, train_loss: 1.2574, test_loss: 1.2394, test_f1: 0.3097
 epoch: 8, train_loss: 1.2515, test_loss: 1.2335, test_f1: 0.3128
 epoch: 9, train_loss: 1.2460, test_loss: 1.2296, test_f1: 0.3136
 epoch: 10, train_loss: 1.2404, test_loss: 1.2228, test_f1: 0.3224
 epoch: 11, train_loss: 1.2312, test_loss: 1.2162, test_f1: 0.3241
 epoch: 12, train_loss: 1.2280, test_loss: 1.2100, test_f1: 0.3194
 epoch: 13, train_loss: 1.2268, test_loss: 1.2016, test_f1: 0.3282
 epoch: 14, train_loss: 1.2229, test_loss: 1.1986, test_f1: 0.3287
 epoch: 15, train_loss: 1.2136, test_loss: 1.1974, test_f1: 0.3423
 epoch: 16, train_loss: 1.2111, test_loss: 1.1903, test_f1: 0.3447
 epoch: 17, train_loss: 1.2082, test_loss: 1.1881, test_f1: 0.3476
 epoch: 18, train_loss: 1.2031, test_loss: 1.1845, test_f1: 0.3480
 epoch: 19, train_loss: 1.2007, test_loss: 1.1826, test_f1: 0.3423
 epoch: 20, train_loss: 1.2036, test_loss: 1.1776, test_f1: 0.3521
 epoch: 21, train_loss: 1.2004, test_loss: 1.1756, test_f1: 0.3410
 epoch: 22, train_loss: 1.1920, test_loss: 1.1715, test_f1: 0.3432
 epoch: 23, train_loss: 1.1845, test_loss: 1.1684, test_f1: 0.3523
 epoch: 24, train_loss: 1.1822, test_loss: 1.1674, test_f1: 0.3532
 epoch: 25, train_loss: 1.1868, test_loss: 1.1620, test_f1: 0.3517
 epoch: 26, train_loss: 1.1819, test_loss: 1.1594, test_f1: 0.3414
 epoch: 27, train_loss: 1.1805, test_loss: 1.1583, test_f1: 0.3525
 epoch: 28, train_loss: 1.1726, test_loss: 1.1570, test_f1: 0.3547
 epoch: 29, train_loss: 1.1794, test_loss: 1.1557, test_f1: 0.3445
 epoch: 30, train_loss: 1.1733, test_loss: 1.1546, test_f1: 0.3495
 epoch: 31, train_loss: 1.1767, test_loss: 1.1509, test_f1: 0.3581
 epoch: 32, train_loss: 1.1681, test_loss: 1.1477, test_f1: 0.3527
 epoch: 33, train_loss: 1.1706, test_loss: 1.1469, test_f1: 0.3530
 epoch: 34, train_loss: 1.1639, test_loss: 1.1475, test_f1: 0.3545
 epoch: 35, train_loss: 1.1646, test_loss: 1.1436, test_f1: 0.3521
 epoch: 36, train_loss: 1.1577, test_loss: 1.1440, test_f1: 0.3525
 epoch: 37, train_loss: 1.1580, test_loss: 1.1402, test_f1: 0.3571
 epoch: 38, train_loss: 1.1654, test_loss: 1.1385, test_f1: 0.3430
 epoch: 39, train_loss: 1.1538, test_loss: 1.1367, test_f1: 0.3518
 epoch: 40, train_loss: 1.1471, test_loss: 1.1341, test_f1: 0.3575
 epoch: 41, train_loss: 1.1539, test_loss: 1.1333, test_f1: 0.3472
 epoch: 42, train_loss: 1.1489, test_loss: 1.1302, test_f1: 0.3475
 epoch: 43, train_loss: 1.1466, test_loss: 1.1256, test_f1: 0.3472
 epoch: 44, train_loss: 1.1453, test_loss: 1.1267, test_f1: 0.3528
 epoch: 45, train_loss: 1.1483, test_loss: 1.1256, test_f1: 0.3447
 epoch: 46, train_loss: 1.1347, test_loss: 1.1231, test_f1: 0.3525
 epoch: 47, train_loss: 1.1443, test_loss: 1.1236, test_f1: 0.3444
 epoch: 48, train_loss: 1.1347, test_loss: 1.1222, test_f1: 0.3487
 epoch: 49, train_loss: 1.1392, test_loss: 1.1196, test_f1: 0.3522
 epoch: 50, train_loss: 1.1370, test_loss: 1.1201, test_f1: 0.3588
 epoch: 51, train_loss: 1.1288, test_loss: 1.1190, test_f1: 0.3567
 epoch: 52, train_loss: 1.1261, test_loss: 1.1177, test_f1: 0.3633
 epoch: 53, train_loss: 1.1300, test_loss: 1.1182, test_f1: 0.3647
 epoch: 54, train_loss: 1.1319, test_loss: 1.1179, test_f1: 0.3624
 epoch: 55, train_loss: 1.1245, test_loss: 1.1173, test_f1: 0.3651
 epoch: 56, train_loss: 1.1174, test_loss: 1.1165, test_f1: 0.3681
 epoch: 57, train_loss: 1.1280, test_loss: 1.1164, test_f1: 0.3660
 epoch: 58, train_loss: 1.1244, test_loss: 1.1152, test_f1: 0.3719
 epoch: 59, train_loss: 1.1187, test_loss: 1.1138, test_f1: 0.3745
 epoch: 60, train_loss: 1.1218, test_loss: 1.1152, test_f1: 0.3749
 epoch: 61, train_loss: 1.1173, test_loss: 1.1149, test_f1: 0.3787
 epoch: 62, train_loss: 1.1213, test_loss: 1.1140, test_f1: 0.3819
 epoch: 63, train_loss: 1.1260, test_loss: 1.1126, test_f1: 0.3760
 epoch: 64, train_loss: 1.1197, test_loss: 1.1122, test_f1: 0.3752
 epoch: 65, train_loss: 1.1056, test_loss: 1.1137, test_f1: 0.3780
 epoch: 66, train_loss: 1.1167, test_loss: 1.1139, test_f1: 0.3841
 epoch: 67, train_loss: 1.1203, test_loss: 1.1125, test_f1: 0.3847
 epoch: 68, train_loss: 1.1144, test_loss: 1.1120, test_f1: 0.3845
 epoch: 69, train_loss: 1.1059, test_loss: 1.1114, test_f1: 0.3894
 epoch: 70, train_loss: 1.1105, test_loss: 1.1107, test_f1: 0.3874
 epoch: 71, train_loss: 1.1080, test_loss: 1.1108, test_f1: 0.3860
 epoch: 72, train_loss: 1.1131, test_loss: 1.1093, test_f1: 0.3851
 epoch: 73, train_loss: 1.1105, test_loss: 1.1089, test_f1: 0.3932
 epoch: 74, train_loss: 1.1154, test_loss: 1.1090, test_f1: 0.3938
 epoch: 75, train_loss: 1.1075, test_loss: 1.1084, test_f1: 0.3913
 epoch: 76, train_loss: 1.1151, test_loss: 1.1075, test_f1: 0.3965
 epoch: 77, train_loss: 1.1036, test_loss: 1.1051, test_f1: 0.3962
 epoch: 78, train_loss: 1.1043, test_loss: 1.1051, test_f1: 0.4008
 epoch: 79, train_loss: 1.1047, test_loss: 1.1054, test_f1: 0.3945
 epoch: 80, train_loss: 1.0997, test_loss: 1.1042, test_f1: 0.4007
 epoch: 81, train_loss: 1.1013, test_loss: 1.1024, test_f1: 0.3965
 epoch: 82, train_loss: 1.1008, test_loss: 1.1035, test_f1: 0.4068
 epoch: 83, train_loss: 1.1056, test_loss: 1.1041, test_f1: 0.4034
 epoch: 84, train_loss: 1.1009, test_loss: 1.1054, test_f1: 0.4039
 epoch: 85, train_loss: 1.0952, test_loss: 1.1041, test_f1: 0.4077
 epoch: 86, train_loss: 1.0978, test_loss: 1.1071, test_f1: 0.4025
 epoch: 87, train_loss: 1.0985, test_loss: 1.1033, test_f1: 0.4103
 epoch: 88, train_loss: 1.1020, test_loss: 1.1051, test_f1: 0.4050
 epoch: 89, train_loss: 1.0939, test_loss: 1.1057, test_f1: 0.4019
 epoch: 90, train_loss: 1.0906, test_loss: 1.1008, test_f1: 0.4063
 epoch: 91, train_loss: 1.0924, test_loss: 1.1018, test_f1: 0.4074
 epoch: 92, train_loss: 1.0886, test_loss: 1.1046, test_f1: 0.4000
 epoch: 93, train_loss: 1.0872, test_loss: 1.1044, test_f1: 0.4005
 epoch: 94, train_loss: 1.0853, test_loss: 1.1034, test_f1: 0.4030
 epoch: 95, train_loss: 1.0923, test_loss: 1.0994, test_f1: 0.4116
 epoch: 96, train_loss: 1.0944, test_loss: 1.1001, test_f1: 0.4140
 epoch: 97, train_loss: 1.0829, test_loss: 1.1001, test_f1: 0.4046
 epoch: 98, train_loss: 1.0952, test_loss: 1.1001, test_f1: 0.4046
 epoch: 99, train_loss: 1.0872, test_loss: 1.1003, test_f1: 0.4095
##################ITERATION #6 ****************************************
 epoch: 0, train_loss: 1.3429, test_loss: 1.3681, test_f1: 0.2274
 epoch: 1, train_loss: 1.3221, test_loss: 1.3512, test_f1: 0.2274
 epoch: 2, train_loss: 1.3147, test_loss: 1.3383, test_f1: 0.2274
 epoch: 3, train_loss: 1.3075, test_loss: 1.3345, test_f1: 0.2274
 epoch: 4, train_loss: 1.2968, test_loss: 1.3137, test_f1: 0.2274
 epoch: 5, train_loss: 1.2889, test_loss: 1.2972, test_f1: 0.2392
 epoch: 6, train_loss: 1.2794, test_loss: 1.2825, test_f1: 0.2469
 epoch: 7, train_loss: 1.2762, test_loss: 1.2708, test_f1: 0.2781
 epoch: 8, train_loss: 1.2664, test_loss: 1.2604, test_f1: 0.2839
 epoch: 9, train_loss: 1.2595, test_loss: 1.2521, test_f1: 0.2899
 epoch: 10, train_loss: 1.2587, test_loss: 1.2455, test_f1: 0.2930
 epoch: 11, train_loss: 1.2542, test_loss: 1.2412, test_f1: 0.3085
 epoch: 12, train_loss: 1.2497, test_loss: 1.2362, test_f1: 0.3049
 epoch: 13, train_loss: 1.2418, test_loss: 1.2329, test_f1: 0.3229
 epoch: 14, train_loss: 1.2402, test_loss: 1.2279, test_f1: 0.3338
 epoch: 15, train_loss: 1.2381, test_loss: 1.2263, test_f1: 0.3364
 epoch: 16, train_loss: 1.2280, test_loss: 1.2222, test_f1: 0.3498
 epoch: 17, train_loss: 1.2267, test_loss: 1.2186, test_f1: 0.3500
 epoch: 18, train_loss: 1.2156, test_loss: 1.2146, test_f1: 0.3510
 epoch: 19, train_loss: 1.2191, test_loss: 1.2101, test_f1: 0.3529
 epoch: 20, train_loss: 1.2190, test_loss: 1.2070, test_f1: 0.3480
 epoch: 21, train_loss: 1.2113, test_loss: 1.2041, test_f1: 0.3513
 epoch: 22, train_loss: 1.2028, test_loss: 1.2017, test_f1: 0.3499
 epoch: 23, train_loss: 1.2092, test_loss: 1.1971, test_f1: 0.3541
 epoch: 24, train_loss: 1.2004, test_loss: 1.1948, test_f1: 0.3591
 epoch: 25, train_loss: 1.1937, test_loss: 1.1931, test_f1: 0.3725
 epoch: 26, train_loss: 1.1988, test_loss: 1.1922, test_f1: 0.3749
 epoch: 27, train_loss: 1.1912, test_loss: 1.1917, test_f1: 0.3699
 epoch: 28, train_loss: 1.1918, test_loss: 1.1895, test_f1: 0.3738
 epoch: 29, train_loss: 1.1941, test_loss: 1.1858, test_f1: 0.3732
 epoch: 30, train_loss: 1.1845, test_loss: 1.1823, test_f1: 0.3716
 epoch: 31, train_loss: 1.1802, test_loss: 1.1798, test_f1: 0.3779
 epoch: 32, train_loss: 1.1834, test_loss: 1.1798, test_f1: 0.3749
 epoch: 33, train_loss: 1.1815, test_loss: 1.1785, test_f1: 0.3729
 epoch: 34, train_loss: 1.1749, test_loss: 1.1753, test_f1: 0.3670
 epoch: 35, train_loss: 1.1766, test_loss: 1.1735, test_f1: 0.3564
 epoch: 36, train_loss: 1.1653, test_loss: 1.1722, test_f1: 0.3635
 epoch: 37, train_loss: 1.1685, test_loss: 1.1702, test_f1: 0.3580
 epoch: 38, train_loss: 1.1723, test_loss: 1.1679, test_f1: 0.3772
 epoch: 39, train_loss: 1.1686, test_loss: 1.1676, test_f1: 0.3770
 epoch: 40, train_loss: 1.1659, test_loss: 1.1674, test_f1: 0.3719
 epoch: 41, train_loss: 1.1602, test_loss: 1.1652, test_f1: 0.3642
 epoch: 42, train_loss: 1.1556, test_loss: 1.1635, test_f1: 0.3707
 epoch: 43, train_loss: 1.1553, test_loss: 1.1612, test_f1: 0.3719
 epoch: 44, train_loss: 1.1539, test_loss: 1.1663, test_f1: 0.3739
 epoch: 45, train_loss: 1.1539, test_loss: 1.1614, test_f1: 0.3737
 epoch: 46, train_loss: 1.1566, test_loss: 1.1649, test_f1: 0.3869
 epoch: 47, train_loss: 1.1499, test_loss: 1.1646, test_f1: 0.4028
 epoch: 48, train_loss: 1.1362, test_loss: 1.1624, test_f1: 0.4212
 epoch: 49, train_loss: 1.1434, test_loss: 1.1585, test_f1: 0.4087
 epoch: 50, train_loss: 1.1375, test_loss: 1.1586, test_f1: 0.4103
 epoch: 51, train_loss: 1.1402, test_loss: 1.1572, test_f1: 0.4104
 epoch: 52, train_loss: 1.1349, test_loss: 1.1602, test_f1: 0.4128
 epoch: 53, train_loss: 1.1390, test_loss: 1.1617, test_f1: 0.4048
 epoch: 54, train_loss: 1.1410, test_loss: 1.1615, test_f1: 0.4087
 epoch: 55, train_loss: 1.1308, test_loss: 1.1650, test_f1: 0.4022
 epoch: 56, train_loss: 1.1274, test_loss: 1.1650, test_f1: 0.4024
 epoch: 57, train_loss: 1.1279, test_loss: 1.1629, test_f1: 0.4138
 epoch: 58, train_loss: 1.1336, test_loss: 1.1647, test_f1: 0.4123
 epoch: 59, train_loss: 1.1298, test_loss: 1.1648, test_f1: 0.4186
 epoch: 60, train_loss: 1.1246, test_loss: 1.1680, test_f1: 0.4248
 epoch: 61, train_loss: 1.1254, test_loss: 1.1647, test_f1: 0.4166
 epoch: 62, train_loss: 1.1311, test_loss: 1.1649, test_f1: 0.4114
 epoch: 63, train_loss: 1.1234, test_loss: 1.1655, test_f1: 0.4134
 epoch: 64, train_loss: 1.1233, test_loss: 1.1621, test_f1: 0.4291
 epoch: 65, train_loss: 1.1155, test_loss: 1.1653, test_f1: 0.4227
 epoch: 66, train_loss: 1.1260, test_loss: 1.1669, test_f1: 0.4249
 epoch: 67, train_loss: 1.1247, test_loss: 1.1668, test_f1: 0.4207
 epoch: 68, train_loss: 1.1224, test_loss: 1.1673, test_f1: 0.4212
 epoch: 69, train_loss: 1.1189, test_loss: 1.1645, test_f1: 0.4244
 epoch: 70, train_loss: 1.1264, test_loss: 1.1689, test_f1: 0.4220
 epoch: 71, train_loss: 1.1189, test_loss: 1.1716, test_f1: 0.4308
 epoch: 72, train_loss: 1.1166, test_loss: 1.1722, test_f1: 0.4243
 epoch: 73, train_loss: 1.1075, test_loss: 1.1724, test_f1: 0.4205
 epoch: 74, train_loss: 1.1058, test_loss: 1.1714, test_f1: 0.4237
 epoch: 75, train_loss: 1.1118, test_loss: 1.1725, test_f1: 0.4336
 epoch: 76, train_loss: 1.1055, test_loss: 1.1778, test_f1: 0.4303
 epoch: 77, train_loss: 1.1104, test_loss: 1.1754, test_f1: 0.4394
 epoch: 78, train_loss: 1.1116, test_loss: 1.1707, test_f1: 0.4329
 epoch: 79, train_loss: 1.1129, test_loss: 1.1756, test_f1: 0.4415
 epoch: 80, train_loss: 1.1030, test_loss: 1.1755, test_f1: 0.4291
 epoch: 81, train_loss: 1.1003, test_loss: 1.1721, test_f1: 0.4202
 epoch: 82, train_loss: 1.1049, test_loss: 1.1730, test_f1: 0.4223
 epoch: 83, train_loss: 1.1064, test_loss: 1.1724, test_f1: 0.4405
 epoch: 84, train_loss: 1.1052, test_loss: 1.1759, test_f1: 0.4195
 epoch: 85, train_loss: 1.1045, test_loss: 1.1779, test_f1: 0.4213
 epoch: 86, train_loss: 1.0968, test_loss: 1.1790, test_f1: 0.4159
 epoch: 87, train_loss: 1.1012, test_loss: 1.1797, test_f1: 0.4170
 epoch: 88, train_loss: 1.1020, test_loss: 1.1820, test_f1: 0.4168
 epoch: 89, train_loss: 1.1036, test_loss: 1.1813, test_f1: 0.4295
 epoch: 90, train_loss: 1.0987, test_loss: 1.1812, test_f1: 0.4198
 epoch: 91, train_loss: 1.1029, test_loss: 1.1810, test_f1: 0.4167
 epoch: 92, train_loss: 1.0931, test_loss: 1.1838, test_f1: 0.4128
 epoch: 93, train_loss: 1.0964, test_loss: 1.1817, test_f1: 0.4187
 epoch: 94, train_loss: 1.0880, test_loss: 1.1834, test_f1: 0.4199
 epoch: 95, train_loss: 1.0913, test_loss: 1.1818, test_f1: 0.4224
 epoch: 96, train_loss: 1.0985, test_loss: 1.1775, test_f1: 0.4159
 epoch: 97, train_loss: 1.0962, test_loss: 1.1823, test_f1: 0.4117
 epoch: 98, train_loss: 1.0917, test_loss: 1.1859, test_f1: 0.4163
 epoch: 99, train_loss: 1.0867, test_loss: 1.1829, test_f1: 0.4181
##################ITERATION #7 ****************************************
 epoch: 0, train_loss: 1.3264, test_loss: 1.3549, test_f1: 0.2274
 epoch: 1, train_loss: 1.3042, test_loss: 1.3418, test_f1: 0.2274
 epoch: 2, train_loss: 1.2996, test_loss: 1.3249, test_f1: 0.2276
 epoch: 3, train_loss: 1.2887, test_loss: 1.2991, test_f1: 0.2393
 epoch: 4, train_loss: 1.2785, test_loss: 1.2808, test_f1: 0.2550
 epoch: 5, train_loss: 1.2718, test_loss: 1.2703, test_f1: 0.2459
 epoch: 6, train_loss: 1.2620, test_loss: 1.2619, test_f1: 0.2599
 epoch: 7, train_loss: 1.2548, test_loss: 1.2525, test_f1: 0.2829
 epoch: 8, train_loss: 1.2510, test_loss: 1.2440, test_f1: 0.2930
 epoch: 9, train_loss: 1.2369, test_loss: 1.2360, test_f1: 0.2996
 epoch: 10, train_loss: 1.2450, test_loss: 1.2309, test_f1: 0.3020
 epoch: 11, train_loss: 1.2347, test_loss: 1.2251, test_f1: 0.3075
 epoch: 12, train_loss: 1.2348, test_loss: 1.2183, test_f1: 0.3141
 epoch: 13, train_loss: 1.2306, test_loss: 1.2143, test_f1: 0.3078
 epoch: 14, train_loss: 1.2221, test_loss: 1.2086, test_f1: 0.3155
 epoch: 15, train_loss: 1.2178, test_loss: 1.2022, test_f1: 0.3285
 epoch: 16, train_loss: 1.2119, test_loss: 1.1997, test_f1: 0.3396
 epoch: 17, train_loss: 1.2129, test_loss: 1.1976, test_f1: 0.3487
 epoch: 18, train_loss: 1.2063, test_loss: 1.1937, test_f1: 0.3435
 epoch: 19, train_loss: 1.2035, test_loss: 1.1899, test_f1: 0.3436
 epoch: 20, train_loss: 1.2058, test_loss: 1.1887, test_f1: 0.3521
 epoch: 21, train_loss: 1.1984, test_loss: 1.1858, test_f1: 0.3558
 epoch: 22, train_loss: 1.1899, test_loss: 1.1836, test_f1: 0.3524
 epoch: 23, train_loss: 1.1930, test_loss: 1.1823, test_f1: 0.3520
 epoch: 24, train_loss: 1.1876, test_loss: 1.1794, test_f1: 0.3486
 epoch: 25, train_loss: 1.1856, test_loss: 1.1770, test_f1: 0.3492
 epoch: 26, train_loss: 1.1874, test_loss: 1.1744, test_f1: 0.3525
 epoch: 27, train_loss: 1.1829, test_loss: 1.1712, test_f1: 0.3493
 epoch: 28, train_loss: 1.1810, test_loss: 1.1716, test_f1: 0.3590
 epoch: 29, train_loss: 1.1769, test_loss: 1.1702, test_f1: 0.3626
 epoch: 30, train_loss: 1.1722, test_loss: 1.1685, test_f1: 0.3771
 epoch: 31, train_loss: 1.1713, test_loss: 1.1671, test_f1: 0.3786
 epoch: 32, train_loss: 1.1709, test_loss: 1.1654, test_f1: 0.3707
 epoch: 33, train_loss: 1.1670, test_loss: 1.1661, test_f1: 0.3795
 epoch: 34, train_loss: 1.1657, test_loss: 1.1629, test_f1: 0.3780
 epoch: 35, train_loss: 1.1704, test_loss: 1.1609, test_f1: 0.3754
 epoch: 36, train_loss: 1.1621, test_loss: 1.1618, test_f1: 0.3848
 epoch: 37, train_loss: 1.1569, test_loss: 1.1611, test_f1: 0.3867
 epoch: 38, train_loss: 1.1669, test_loss: 1.1594, test_f1: 0.3909
 epoch: 39, train_loss: 1.1550, test_loss: 1.1552, test_f1: 0.3736
 epoch: 40, train_loss: 1.1474, test_loss: 1.1538, test_f1: 0.3861
 epoch: 41, train_loss: 1.1544, test_loss: 1.1484, test_f1: 0.3815
 epoch: 42, train_loss: 1.1463, test_loss: 1.1520, test_f1: 0.3984
 epoch: 43, train_loss: 1.1576, test_loss: 1.1512, test_f1: 0.3884
 epoch: 44, train_loss: 1.1566, test_loss: 1.1473, test_f1: 0.3874
 epoch: 45, train_loss: 1.1490, test_loss: 1.1479, test_f1: 0.3900
 epoch: 46, train_loss: 1.1421, test_loss: 1.1465, test_f1: 0.3795
 epoch: 47, train_loss: 1.1399, test_loss: 1.1473, test_f1: 0.3723
 epoch: 48, train_loss: 1.1447, test_loss: 1.1436, test_f1: 0.3703
 epoch: 49, train_loss: 1.1329, test_loss: 1.1393, test_f1: 0.3864
 epoch: 50, train_loss: 1.1327, test_loss: 1.1368, test_f1: 0.3930
 epoch: 51, train_loss: 1.1363, test_loss: 1.1382, test_f1: 0.3965
 epoch: 52, train_loss: 1.1334, test_loss: 1.1396, test_f1: 0.3966
 epoch: 53, train_loss: 1.1336, test_loss: 1.1404, test_f1: 0.3811
 epoch: 54, train_loss: 1.1334, test_loss: 1.1367, test_f1: 0.3909
 epoch: 55, train_loss: 1.1270, test_loss: 1.1354, test_f1: 0.3983
 epoch: 56, train_loss: 1.1342, test_loss: 1.1316, test_f1: 0.3969
 epoch: 57, train_loss: 1.1318, test_loss: 1.1322, test_f1: 0.3871
 epoch: 58, train_loss: 1.1266, test_loss: 1.1309, test_f1: 0.4075
 epoch: 59, train_loss: 1.1247, test_loss: 1.1311, test_f1: 0.3962
 epoch: 60, train_loss: 1.1280, test_loss: 1.1300, test_f1: 0.4013
 epoch: 61, train_loss: 1.1315, test_loss: 1.1276, test_f1: 0.3909
 epoch: 62, train_loss: 1.1272, test_loss: 1.1290, test_f1: 0.4087
 epoch: 63, train_loss: 1.1239, test_loss: 1.1275, test_f1: 0.4116
 epoch: 64, train_loss: 1.1237, test_loss: 1.1311, test_f1: 0.4059
 epoch: 65, train_loss: 1.1143, test_loss: 1.1307, test_f1: 0.4055
 epoch: 66, train_loss: 1.1233, test_loss: 1.1305, test_f1: 0.4186
 epoch: 67, train_loss: 1.1235, test_loss: 1.1256, test_f1: 0.4123
 epoch: 68, train_loss: 1.1244, test_loss: 1.1267, test_f1: 0.4221
 epoch: 69, train_loss: 1.1137, test_loss: 1.1271, test_f1: 0.4243
 epoch: 70, train_loss: 1.1120, test_loss: 1.1280, test_f1: 0.4202
 epoch: 71, train_loss: 1.1143, test_loss: 1.1267, test_f1: 0.4127
 epoch: 72, train_loss: 1.1075, test_loss: 1.1283, test_f1: 0.4128
 epoch: 73, train_loss: 1.1098, test_loss: 1.1262, test_f1: 0.4080
 epoch: 74, train_loss: 1.1093, test_loss: 1.1226, test_f1: 0.4179
 epoch: 75, train_loss: 1.1130, test_loss: 1.1211, test_f1: 0.4188
 epoch: 76, train_loss: 1.1092, test_loss: 1.1210, test_f1: 0.4252
 epoch: 77, train_loss: 1.1060, test_loss: 1.1214, test_f1: 0.4231
 epoch: 78, train_loss: 1.1046, test_loss: 1.1211, test_f1: 0.4350
 epoch: 79, train_loss: 1.1080, test_loss: 1.1194, test_f1: 0.4435
 epoch: 80, train_loss: 1.1026, test_loss: 1.1187, test_f1: 0.4326
 epoch: 81, train_loss: 1.0979, test_loss: 1.1205, test_f1: 0.4318
 epoch: 82, train_loss: 1.1037, test_loss: 1.1203, test_f1: 0.4350
 epoch: 83, train_loss: 1.1055, test_loss: 1.1210, test_f1: 0.4324
 epoch: 84, train_loss: 1.1004, test_loss: 1.1210, test_f1: 0.4311
 epoch: 85, train_loss: 1.0974, test_loss: 1.1185, test_f1: 0.4276
 epoch: 86, train_loss: 1.1049, test_loss: 1.1147, test_f1: 0.4256
 epoch: 87, train_loss: 1.0927, test_loss: 1.1165, test_f1: 0.4296
 epoch: 88, train_loss: 1.1101, test_loss: 1.1173, test_f1: 0.4244
 epoch: 89, train_loss: 1.0963, test_loss: 1.1189, test_f1: 0.4316
 epoch: 90, train_loss: 1.1046, test_loss: 1.1176, test_f1: 0.4382
 epoch: 91, train_loss: 1.0967, test_loss: 1.1167, test_f1: 0.4362
 epoch: 92, train_loss: 1.0982, test_loss: 1.1130, test_f1: 0.4375
 epoch: 93, train_loss: 1.0906, test_loss: 1.1129, test_f1: 0.4412
 epoch: 94, train_loss: 1.0924, test_loss: 1.1116, test_f1: 0.4363
 epoch: 95, train_loss: 1.0836, test_loss: 1.1131, test_f1: 0.4373
 epoch: 96, train_loss: 1.0918, test_loss: 1.1104, test_f1: 0.4370
 epoch: 97, train_loss: 1.0973, test_loss: 1.1127, test_f1: 0.4421
 epoch: 98, train_loss: 1.0981, test_loss: 1.1132, test_f1: 0.4419
 epoch: 99, train_loss: 1.0840, test_loss: 1.1151, test_f1: 0.4434
##################ITERATION #8 ****************************************
 epoch: 0, train_loss: 1.3069, test_loss: 1.3204, test_f1: 0.2274
 epoch: 1, train_loss: 1.2943, test_loss: 1.3063, test_f1: 0.2276
 epoch: 2, train_loss: 1.2870, test_loss: 1.3012, test_f1: 0.2555
 epoch: 3, train_loss: 1.2832, test_loss: 1.2909, test_f1: 0.2395
 epoch: 4, train_loss: 1.2692, test_loss: 1.2743, test_f1: 0.2274
 epoch: 5, train_loss: 1.2662, test_loss: 1.2671, test_f1: 0.2276
 epoch: 6, train_loss: 1.2630, test_loss: 1.2665, test_f1: 0.2302
 epoch: 7, train_loss: 1.2588, test_loss: 1.2619, test_f1: 0.2307
 epoch: 8, train_loss: 1.2502, test_loss: 1.2569, test_f1: 0.2336
 epoch: 9, train_loss: 1.2466, test_loss: 1.2522, test_f1: 0.2488
 epoch: 10, train_loss: 1.2457, test_loss: 1.2470, test_f1: 0.2589
 epoch: 11, train_loss: 1.2429, test_loss: 1.2403, test_f1: 0.2611
 epoch: 12, train_loss: 1.2358, test_loss: 1.2400, test_f1: 0.2665
 epoch: 13, train_loss: 1.2348, test_loss: 1.2302, test_f1: 0.2762
 epoch: 14, train_loss: 1.2301, test_loss: 1.2271, test_f1: 0.2850
 epoch: 15, train_loss: 1.2285, test_loss: 1.2244, test_f1: 0.2937
 epoch: 16, train_loss: 1.2247, test_loss: 1.2238, test_f1: 0.2962
 epoch: 17, train_loss: 1.2213, test_loss: 1.2183, test_f1: 0.2895
 epoch: 18, train_loss: 1.2195, test_loss: 1.2146, test_f1: 0.2991
 epoch: 19, train_loss: 1.2155, test_loss: 1.2110, test_f1: 0.3108
 epoch: 20, train_loss: 1.2137, test_loss: 1.2058, test_f1: 0.3111
 epoch: 21, train_loss: 1.2104, test_loss: 1.2028, test_f1: 0.3211
 epoch: 22, train_loss: 1.2118, test_loss: 1.2017, test_f1: 0.3343
 epoch: 23, train_loss: 1.2064, test_loss: 1.2033, test_f1: 0.3296
 epoch: 24, train_loss: 1.2025, test_loss: 1.2044, test_f1: 0.3132
 epoch: 25, train_loss: 1.1999, test_loss: 1.2024, test_f1: 0.3160
 epoch: 26, train_loss: 1.2004, test_loss: 1.2008, test_f1: 0.3204
 epoch: 27, train_loss: 1.1913, test_loss: 1.2001, test_f1: 0.3239
 epoch: 28, train_loss: 1.1930, test_loss: 1.1958, test_f1: 0.3358
 epoch: 29, train_loss: 1.1884, test_loss: 1.1928, test_f1: 0.3285
 epoch: 30, train_loss: 1.1918, test_loss: 1.1905, test_f1: 0.3382
 epoch: 31, train_loss: 1.1892, test_loss: 1.1826, test_f1: 0.3365
 epoch: 32, train_loss: 1.1794, test_loss: 1.1812, test_f1: 0.3291
 epoch: 33, train_loss: 1.1839, test_loss: 1.1760, test_f1: 0.3335
 epoch: 34, train_loss: 1.1787, test_loss: 1.1797, test_f1: 0.3390
 epoch: 35, train_loss: 1.1775, test_loss: 1.1776, test_f1: 0.3358
 epoch: 36, train_loss: 1.1736, test_loss: 1.1748, test_f1: 0.3397
 epoch: 37, train_loss: 1.1766, test_loss: 1.1746, test_f1: 0.3412
 epoch: 38, train_loss: 1.1740, test_loss: 1.1690, test_f1: 0.3335
 epoch: 39, train_loss: 1.1650, test_loss: 1.1666, test_f1: 0.3339
 epoch: 40, train_loss: 1.1679, test_loss: 1.1685, test_f1: 0.3454
 epoch: 41, train_loss: 1.1572, test_loss: 1.1634, test_f1: 0.3598
 epoch: 42, train_loss: 1.1590, test_loss: 1.1675, test_f1: 0.3709
 epoch: 43, train_loss: 1.1545, test_loss: 1.1651, test_f1: 0.3763
 epoch: 44, train_loss: 1.1580, test_loss: 1.1616, test_f1: 0.3782
 epoch: 45, train_loss: 1.1583, test_loss: 1.1491, test_f1: 0.3768
 epoch: 46, train_loss: 1.1477, test_loss: 1.1585, test_f1: 0.3723
 epoch: 47, train_loss: 1.1473, test_loss: 1.1652, test_f1: 0.3715
 epoch: 48, train_loss: 1.1491, test_loss: 1.1656, test_f1: 0.3847
 epoch: 49, train_loss: 1.1367, test_loss: 1.1726, test_f1: 0.3836
 epoch: 50, train_loss: 1.1355, test_loss: 1.1729, test_f1: 0.3929
 epoch: 51, train_loss: 1.1382, test_loss: 1.1634, test_f1: 0.3887
 epoch: 52, train_loss: 1.1376, test_loss: 1.1627, test_f1: 0.3886
 epoch: 53, train_loss: 1.1316, test_loss: 1.1643, test_f1: 0.3850
 epoch: 54, train_loss: 1.1309, test_loss: 1.1654, test_f1: 0.3857
 epoch: 55, train_loss: 1.1336, test_loss: 1.1728, test_f1: 0.3890
 epoch: 56, train_loss: 1.1281, test_loss: 1.1747, test_f1: 0.4032
 epoch: 57, train_loss: 1.1330, test_loss: 1.1701, test_f1: 0.4105
 epoch: 58, train_loss: 1.1216, test_loss: 1.1651, test_f1: 0.4089
 epoch: 59, train_loss: 1.1204, test_loss: 1.1742, test_f1: 0.4180
 epoch: 60, train_loss: 1.1297, test_loss: 1.1704, test_f1: 0.4200
 epoch: 61, train_loss: 1.1237, test_loss: 1.1635, test_f1: 0.4167
 epoch: 62, train_loss: 1.1243, test_loss: 1.1613, test_f1: 0.4221
 epoch: 63, train_loss: 1.1208, test_loss: 1.1737, test_f1: 0.4121
 epoch: 64, train_loss: 1.1254, test_loss: 1.1831, test_f1: 0.4227
 epoch: 65, train_loss: 1.1151, test_loss: 1.1644, test_f1: 0.4175
 epoch: 66, train_loss: 1.1138, test_loss: 1.1764, test_f1: 0.4208
 epoch: 67, train_loss: 1.1194, test_loss: 1.1720, test_f1: 0.4150
 epoch: 68, train_loss: 1.1165, test_loss: 1.1751, test_f1: 0.4150
 epoch: 69, train_loss: 1.1134, test_loss: 1.1811, test_f1: 0.4142
 epoch: 70, train_loss: 1.1175, test_loss: 1.1751, test_f1: 0.4091
 epoch: 71, train_loss: 1.1102, test_loss: 1.1747, test_f1: 0.4121
 epoch: 72, train_loss: 1.1124, test_loss: 1.1692, test_f1: 0.4111
 epoch: 73, train_loss: 1.1088, test_loss: 1.1708, test_f1: 0.4206
 epoch: 74, train_loss: 1.1086, test_loss: 1.1802, test_f1: 0.4161
 epoch: 75, train_loss: 1.1120, test_loss: 1.1727, test_f1: 0.4146
 epoch: 76, train_loss: 1.1079, test_loss: 1.1758, test_f1: 0.4123
 epoch: 77, train_loss: 1.1002, test_loss: 1.1861, test_f1: 0.4188
 epoch: 78, train_loss: 1.1049, test_loss: 1.1840, test_f1: 0.4152
 epoch: 79, train_loss: 1.0971, test_loss: 1.1858, test_f1: 0.4063
 epoch: 80, train_loss: 1.1063, test_loss: 1.1751, test_f1: 0.4093
 epoch: 81, train_loss: 1.1080, test_loss: 1.1798, test_f1: 0.4175
 epoch: 82, train_loss: 1.1038, test_loss: 1.1818, test_f1: 0.4172
 epoch: 83, train_loss: 1.0923, test_loss: 1.1953, test_f1: 0.4179
 epoch: 84, train_loss: 1.0995, test_loss: 1.2126, test_f1: 0.4200
 epoch: 85, train_loss: 1.0961, test_loss: 1.1993, test_f1: 0.4195
 epoch: 86, train_loss: 1.0941, test_loss: 1.1956, test_f1: 0.4271
 epoch: 87, train_loss: 1.0932, test_loss: 1.1927, test_f1: 0.4199
 epoch: 88, train_loss: 1.1012, test_loss: 1.1960, test_f1: 0.4263
 epoch: 89, train_loss: 1.0900, test_loss: 1.2100, test_f1: 0.4281
 epoch: 90, train_loss: 1.0952, test_loss: 1.1907, test_f1: 0.4254
 epoch: 91, train_loss: 1.0925, test_loss: 1.1942, test_f1: 0.4206
 epoch: 92, train_loss: 1.0890, test_loss: 1.2003, test_f1: 0.4191
 epoch: 93, train_loss: 1.0880, test_loss: 1.2130, test_f1: 0.4250
 epoch: 94, train_loss: 1.0879, test_loss: 1.2349, test_f1: 0.4222
 epoch: 95, train_loss: 1.0808, test_loss: 1.2794, test_f1: 0.4246
 epoch: 96, train_loss: 1.0874, test_loss: 1.1672, test_f1: 0.4215
 epoch: 97, train_loss: 1.0829, test_loss: 1.1971, test_f1: 0.4143
 epoch: 98, train_loss: 1.0820, test_loss: 1.1917, test_f1: 0.4134
 epoch: 99, train_loss: 1.0857, test_loss: 1.1840, test_f1: 0.4241
##################ITERATION #9 ****************************************
 epoch: 0, train_loss: 1.3306, test_loss: 1.3502, test_f1: 0.2274
 epoch: 1, train_loss: 1.3083, test_loss: 1.3344, test_f1: 0.2274
 epoch: 2, train_loss: 1.2969, test_loss: 1.3012, test_f1: 0.2274
 epoch: 3, train_loss: 1.2909, test_loss: 1.2860, test_f1: 0.2274
 epoch: 4, train_loss: 1.2821, test_loss: 1.2760, test_f1: 0.2292
 epoch: 5, train_loss: 1.2737, test_loss: 1.2691, test_f1: 0.2481
 epoch: 6, train_loss: 1.2662, test_loss: 1.2589, test_f1: 0.2598
 epoch: 7, train_loss: 1.2576, test_loss: 1.2480, test_f1: 0.2747
 epoch: 8, train_loss: 1.2500, test_loss: 1.2371, test_f1: 0.2995
 epoch: 9, train_loss: 1.2424, test_loss: 1.2288, test_f1: 0.3006
 epoch: 10, train_loss: 1.2449, test_loss: 1.2201, test_f1: 0.2991
 epoch: 11, train_loss: 1.2329, test_loss: 1.2163, test_f1: 0.3054
 epoch: 12, train_loss: 1.2261, test_loss: 1.2123, test_f1: 0.3131
 epoch: 13, train_loss: 1.2278, test_loss: 1.2074, test_f1: 0.3089
 epoch: 14, train_loss: 1.2219, test_loss: 1.2016, test_f1: 0.3049
 epoch: 15, train_loss: 1.2231, test_loss: 1.1960, test_f1: 0.3092
 epoch: 16, train_loss: 1.2161, test_loss: 1.1937, test_f1: 0.3136
 epoch: 17, train_loss: 1.2124, test_loss: 1.1912, test_f1: 0.3186
 epoch: 18, train_loss: 1.2064, test_loss: 1.1880, test_f1: 0.3186
 epoch: 19, train_loss: 1.2033, test_loss: 1.1809, test_f1: 0.3207
 epoch: 20, train_loss: 1.2000, test_loss: 1.1764, test_f1: 0.3263
 epoch: 21, train_loss: 1.2048, test_loss: 1.1728, test_f1: 0.3326
 epoch: 22, train_loss: 1.1971, test_loss: 1.1701, test_f1: 0.3306
 epoch: 23, train_loss: 1.1931, test_loss: 1.1688, test_f1: 0.3349
 epoch: 24, train_loss: 1.1840, test_loss: 1.1659, test_f1: 0.3431
 epoch: 25, train_loss: 1.1886, test_loss: 1.1614, test_f1: 0.3407
 epoch: 26, train_loss: 1.1855, test_loss: 1.1584, test_f1: 0.3413
 epoch: 27, train_loss: 1.1848, test_loss: 1.1558, test_f1: 0.3466
 epoch: 28, train_loss: 1.1804, test_loss: 1.1534, test_f1: 0.3451
 epoch: 29, train_loss: 1.1746, test_loss: 1.1526, test_f1: 0.3417
 epoch: 30, train_loss: 1.1699, test_loss: 1.1472, test_f1: 0.3505
 epoch: 31, train_loss: 1.1722, test_loss: 1.1451, test_f1: 0.3532
 epoch: 32, train_loss: 1.1721, test_loss: 1.1427, test_f1: 0.3539
 epoch: 33, train_loss: 1.1627, test_loss: 1.1408, test_f1: 0.3501
 epoch: 34, train_loss: 1.1607, test_loss: 1.1404, test_f1: 0.3592
 epoch: 35, train_loss: 1.1564, test_loss: 1.1355, test_f1: 0.3604
 epoch: 36, train_loss: 1.1572, test_loss: 1.1392, test_f1: 0.3492
 epoch: 37, train_loss: 1.1590, test_loss: 1.1368, test_f1: 0.3519
 epoch: 38, train_loss: 1.1582, test_loss: 1.1344, test_f1: 0.3506
 epoch: 39, train_loss: 1.1466, test_loss: 1.1337, test_f1: 0.3548
 epoch: 40, train_loss: 1.1473, test_loss: 1.1307, test_f1: 0.3537
 epoch: 41, train_loss: 1.1470, test_loss: 1.1280, test_f1: 0.3550
 epoch: 42, train_loss: 1.1490, test_loss: 1.1274, test_f1: 0.3615
 epoch: 43, train_loss: 1.1378, test_loss: 1.1267, test_f1: 0.3648
 epoch: 44, train_loss: 1.1468, test_loss: 1.1259, test_f1: 0.3676
 epoch: 45, train_loss: 1.1323, test_loss: 1.1217, test_f1: 0.3749
 epoch: 46, train_loss: 1.1351, test_loss: 1.1229, test_f1: 0.3826
 epoch: 47, train_loss: 1.1373, test_loss: 1.1237, test_f1: 0.3764
 epoch: 48, train_loss: 1.1325, test_loss: 1.1212, test_f1: 0.3807
 epoch: 49, train_loss: 1.1308, test_loss: 1.1227, test_f1: 0.3789
 epoch: 50, train_loss: 1.1260, test_loss: 1.1203, test_f1: 0.3964
 epoch: 51, train_loss: 1.1278, test_loss: 1.1215, test_f1: 0.3963
 epoch: 52, train_loss: 1.1265, test_loss: 1.1235, test_f1: 0.3933
 epoch: 53, train_loss: 1.1223, test_loss: 1.1196, test_f1: 0.4034
 epoch: 54, train_loss: 1.1259, test_loss: 1.1163, test_f1: 0.4159
 epoch: 55, train_loss: 1.1195, test_loss: 1.1168, test_f1: 0.4164
 epoch: 56, train_loss: 1.1180, test_loss: 1.1160, test_f1: 0.4093
 epoch: 57, train_loss: 1.1195, test_loss: 1.1175, test_f1: 0.4114
 epoch: 58, train_loss: 1.1182, test_loss: 1.1173, test_f1: 0.4118
 epoch: 59, train_loss: 1.1178, test_loss: 1.1151, test_f1: 0.4113
 epoch: 60, train_loss: 1.1228, test_loss: 1.1127, test_f1: 0.4090
 epoch: 61, train_loss: 1.1187, test_loss: 1.1167, test_f1: 0.4123
 epoch: 62, train_loss: 1.1130, test_loss: 1.1126, test_f1: 0.4218
 epoch: 63, train_loss: 1.1216, test_loss: 1.1125, test_f1: 0.4139
 epoch: 64, train_loss: 1.1189, test_loss: 1.1127, test_f1: 0.4306
 epoch: 65, train_loss: 1.1109, test_loss: 1.1100, test_f1: 0.4217
 epoch: 66, train_loss: 1.1067, test_loss: 1.1099, test_f1: 0.4200
 epoch: 67, train_loss: 1.1128, test_loss: 1.1050, test_f1: 0.4271
 epoch: 68, train_loss: 1.1061, test_loss: 1.1068, test_f1: 0.4275
 epoch: 69, train_loss: 1.1096, test_loss: 1.1056, test_f1: 0.4338
 epoch: 70, train_loss: 1.1109, test_loss: 1.1063, test_f1: 0.4340
 epoch: 71, train_loss: 1.1008, test_loss: 1.1025, test_f1: 0.4366
 epoch: 72, train_loss: 1.1058, test_loss: 1.1038, test_f1: 0.4247
 epoch: 73, train_loss: 1.0979, test_loss: 1.1051, test_f1: 0.4240
 epoch: 74, train_loss: 1.0937, test_loss: 1.1007, test_f1: 0.4307
 epoch: 75, train_loss: 1.0895, test_loss: 1.1037, test_f1: 0.4271
 epoch: 76, train_loss: 1.0958, test_loss: 1.1031, test_f1: 0.4217
 epoch: 77, train_loss: 1.0965, test_loss: 1.1015, test_f1: 0.4325
 epoch: 78, train_loss: 1.0926, test_loss: 1.1001, test_f1: 0.4320
 epoch: 79, train_loss: 1.0958, test_loss: 1.1002, test_f1: 0.4355
 epoch: 80, train_loss: 1.0927, test_loss: 1.1001, test_f1: 0.4240
 epoch: 81, train_loss: 1.0933, test_loss: 1.1020, test_f1: 0.4275
 epoch: 82, train_loss: 1.0951, test_loss: 1.0996, test_f1: 0.4331
 epoch: 83, train_loss: 1.0914, test_loss: 1.1005, test_f1: 0.4258
 epoch: 84, train_loss: 1.0886, test_loss: 1.1017, test_f1: 0.4247
 epoch: 85, train_loss: 1.0902, test_loss: 1.0978, test_f1: 0.4261
 epoch: 86, train_loss: 1.0905, test_loss: 1.0974, test_f1: 0.4328
 epoch: 87, train_loss: 1.0869, test_loss: 1.0967, test_f1: 0.4291
 epoch: 88, train_loss: 1.0902, test_loss: 1.0986, test_f1: 0.4348
 epoch: 89, train_loss: 1.0928, test_loss: 1.0962, test_f1: 0.4385
 epoch: 90, train_loss: 1.0863, test_loss: 1.0970, test_f1: 0.4283
 epoch: 91, train_loss: 1.0844, test_loss: 1.0948, test_f1: 0.4280
 epoch: 92, train_loss: 1.0799, test_loss: 1.0961, test_f1: 0.4313
 epoch: 93, train_loss: 1.0885, test_loss: 1.0966, test_f1: 0.4280
 epoch: 94, train_loss: 1.0822, test_loss: 1.1001, test_f1: 0.4278
 epoch: 95, train_loss: 1.0799, test_loss: 1.0982, test_f1: 0.4169
 epoch: 96, train_loss: 1.0824, test_loss: 1.0989, test_f1: 0.4188
 epoch: 97, train_loss: 1.0788, test_loss: 1.0948, test_f1: 0.4291
 epoch: 98, train_loss: 1.0793, test_loss: 1.0933, test_f1: 0.4302
 epoch: 99, train_loss: 1.0755, test_loss: 1.0961, test_f1: 0.4300

Training completed in 424.78 seconds
Best F1: 0.4688 at epoch 92
Mean F1 across iterations: 0.4185  0.0303
========================FINAL RESULTS================================
FEGIN weighted F1: 0.4688  0.0303
python main.py --data ltspice_examples --representation component_component --model FEGIN --layers 6 --hiddens 32 --batch_size 256 --lr 0.0001 --emb_size 250 --epochs 100 --save_appendix component_component_L6_H32_BS256_LR0.0001_E250 --no_val
-----



STDERR:
  File "main.py", line 370, in <module>
    main()
  File "main.py", line 254, in main
    dataset = dataset_class(
  File "/home/philip/projects/ltspice_examples_code_repo/Circuit-Completion-Using-GNNs/component_classification_with_link_prediction_head/evaluation/FEGIN/kernel/circuit_datasets.py", line 15, in __init__
    self.data, self.slices = torch.load(self.processed_paths[0])
  File "/home/philip/.local/lib/python3.8/site-packages/torch/serialization.py", line 1040, in load
    warnings.warn(
  File "/usr/lib/python3.8/warnings.py", line 109, in _showwarnmsg
    sw(msg.message, msg.category, msg.filename, msg.lineno,
  File "main.py", line 47, in warn_with_traceback
    traceback.print_stack(file=log)
/home/philip/projects/ltspice_examples_code_repo/Circuit-Completion-Using-GNNs/component_classification_with_link_prediction_head/evaluation/FEGIN/kernel/circuit_datasets.py:15: FutureWarning: You are using `torch.load` with `weights_only=False` (the current default value), which uses the default pickle module implicitly. It is possible to construct malicious pickle data which will execute arbitrary code during unpickling (See https://github.com/pytorch/pytorch/blob/main/SECURITY.md#untrusted-models for more details). In a future release, the default value for `weights_only` will be flipped to `True`. This limits the functions that could be executed during unpickling. Arbitrary objects will no longer be allowed to be loaded via this mode unless they are explicitly allowlisted by the user via `torch.serialization.add_safe_globals`. We recommend you start setting `weights_only=True` for any use case where you don't have full control of the loaded file. Please open an issue on GitHub for any issues related to this experimental feature.
  self.data, self.slices = torch.load(self.processed_paths[0])
