STDOUT:
Results will be saved in /home/philip/projects/ltspice_examples_code_repo/Circuit-Completion-Using-GNNs/component_classification_with_link_prediction_head/evaluation/FEGIN/results/model_FEGIN_dataset_ltspice_examples
Command line input: python main.py --data ltspice_examples --representation component_pin_net --model FEGIN --layers 4 --hiddens 16 --batch_size 256 --lr 0.001 --emb_size 128 --epochs 100 --save_appendix component_pin_net_L4_H16_BS256_LR0.001_E128 --no_val
 is saved.
-----
ltspice_examples - FEGIN
Using 4 layers, 16 hidden units, h = 2
Loading component_pin_net representation dataset
ENTERED
Training FEGIN on component_pin_net representation
Train: 3558, Test: 846
##################ITERATION #0 ****************************************
 epoch: 0, train_loss: 1.4147, test_loss: 1.4126, test_f1: 0.1004
 epoch: 1, train_loss: 1.3925, test_loss: 1.3980, test_f1: 0.1004
 epoch: 2, train_loss: 1.3711, test_loss: 1.3672, test_f1: 0.1957
 epoch: 3, train_loss: 1.3431, test_loss: 1.3220, test_f1: 0.1930
 epoch: 4, train_loss: 1.3138, test_loss: 1.2802, test_f1: 0.2743
 epoch: 5, train_loss: 1.2808, test_loss: 1.2419, test_f1: 0.3268
 epoch: 6, train_loss: 1.2460, test_loss: 1.2065, test_f1: 0.2353
 epoch: 7, train_loss: 1.2147, test_loss: 1.1864, test_f1: 0.2437
 epoch: 8, train_loss: 1.1978, test_loss: 1.1684, test_f1: 0.3250
 epoch: 9, train_loss: 1.1776, test_loss: 1.1490, test_f1: 0.3264
 epoch: 10, train_loss: 1.1562, test_loss: 1.1217, test_f1: 0.3413
 epoch: 11, train_loss: 1.1420, test_loss: 1.0979, test_f1: 0.3546
 epoch: 12, train_loss: 1.1209, test_loss: 1.0721, test_f1: 0.3413
 epoch: 13, train_loss: 1.0961, test_loss: 1.0460, test_f1: 0.3523
 epoch: 14, train_loss: 1.0910, test_loss: 1.0305, test_f1: 0.3432
 epoch: 15, train_loss: 1.0613, test_loss: 1.0131, test_f1: 0.3562
 epoch: 16, train_loss: 1.0541, test_loss: 0.9947, test_f1: 0.4115
 epoch: 17, train_loss: 1.0402, test_loss: 0.9959, test_f1: 0.4064
 epoch: 18, train_loss: 1.0318, test_loss: 0.9814, test_f1: 0.4410
 epoch: 19, train_loss: 1.0186, test_loss: 0.9756, test_f1: 0.4337
 epoch: 20, train_loss: 1.0099, test_loss: 0.9580, test_f1: 0.4591
 epoch: 21, train_loss: 0.9910, test_loss: 0.9822, test_f1: 0.4458
 epoch: 22, train_loss: 0.9860, test_loss: 0.9423, test_f1: 0.4658
 epoch: 23, train_loss: 0.9740, test_loss: 0.9251, test_f1: 0.4942
 epoch: 24, train_loss: 0.9775, test_loss: 0.9351, test_f1: 0.4824
 epoch: 25, train_loss: 0.9608, test_loss: 0.9360, test_f1: 0.4779
 epoch: 26, train_loss: 0.9549, test_loss: 0.9319, test_f1: 0.4738
 epoch: 27, train_loss: 0.9479, test_loss: 0.9416, test_f1: 0.4642
 epoch: 28, train_loss: 0.9412, test_loss: 0.9403, test_f1: 0.4780
 epoch: 29, train_loss: 0.9415, test_loss: 0.9098, test_f1: 0.4837
 epoch: 30, train_loss: 0.9441, test_loss: 0.8992, test_f1: 0.4850
 epoch: 31, train_loss: 0.9353, test_loss: 0.9568, test_f1: 0.4950
 epoch: 32, train_loss: 0.9270, test_loss: 0.9790, test_f1: 0.4843
 epoch: 33, train_loss: 0.9206, test_loss: 0.9003, test_f1: 0.4982
 epoch: 34, train_loss: 0.9209, test_loss: 0.9119, test_f1: 0.4845
 epoch: 35, train_loss: 0.9219, test_loss: 0.9649, test_f1: 0.4960
 epoch: 36, train_loss: 0.9148, test_loss: 0.9244, test_f1: 0.5065
 epoch: 37, train_loss: 0.9102, test_loss: 0.9409, test_f1: 0.4901
 epoch: 38, train_loss: 0.9057, test_loss: 0.9424, test_f1: 0.4983
 epoch: 39, train_loss: 0.8920, test_loss: 0.9269, test_f1: 0.5020
 epoch: 40, train_loss: 0.8995, test_loss: 0.9897, test_f1: 0.4814
 epoch: 41, train_loss: 0.8934, test_loss: 0.9535, test_f1: 0.4996
 epoch: 42, train_loss: 0.8871, test_loss: 0.9341, test_f1: 0.5014
 epoch: 43, train_loss: 0.8818, test_loss: 0.9581, test_f1: 0.4858
 epoch: 44, train_loss: 0.8747, test_loss: 0.9326, test_f1: 0.5116
 epoch: 45, train_loss: 0.8805, test_loss: 0.9020, test_f1: 0.5091
 epoch: 46, train_loss: 0.8759, test_loss: 0.9398, test_f1: 0.5079
 epoch: 47, train_loss: 0.8776, test_loss: 0.9344, test_f1: 0.5142
 epoch: 48, train_loss: 0.8643, test_loss: 0.9216, test_f1: 0.5168
 epoch: 49, train_loss: 0.8554, test_loss: 0.9651, test_f1: 0.5102
 epoch: 50, train_loss: 0.8482, test_loss: 0.9348, test_f1: 0.4962
 epoch: 51, train_loss: 0.8473, test_loss: 0.9611, test_f1: 0.5060
 epoch: 52, train_loss: 0.8456, test_loss: 0.9472, test_f1: 0.5309
 epoch: 53, train_loss: 0.8437, test_loss: 0.9575, test_f1: 0.5112
 epoch: 54, train_loss: 0.8406, test_loss: 0.9435, test_f1: 0.5158
 epoch: 55, train_loss: 0.8438, test_loss: 0.9580, test_f1: 0.5148
 epoch: 56, train_loss: 0.8297, test_loss: 0.9764, test_f1: 0.5080
 epoch: 57, train_loss: 0.8369, test_loss: 0.9171, test_f1: 0.5149
 epoch: 58, train_loss: 0.8401, test_loss: 0.9520, test_f1: 0.5190
 epoch: 59, train_loss: 0.8359, test_loss: 0.9437, test_f1: 0.5146
 epoch: 60, train_loss: 0.8414, test_loss: 0.9512, test_f1: 0.5057
 epoch: 61, train_loss: 0.8267, test_loss: 0.9784, test_f1: 0.5110
 epoch: 62, train_loss: 0.8324, test_loss: 0.9397, test_f1: 0.5090
 epoch: 63, train_loss: 0.8272, test_loss: 0.9698, test_f1: 0.5071
 epoch: 64, train_loss: 0.8218, test_loss: 0.9378, test_f1: 0.5265
 epoch: 65, train_loss: 0.8235, test_loss: 0.9535, test_f1: 0.5143
 epoch: 66, train_loss: 0.8172, test_loss: 0.9476, test_f1: 0.5106
 epoch: 67, train_loss: 0.8225, test_loss: 0.9445, test_f1: 0.5204
 epoch: 68, train_loss: 0.8116, test_loss: 0.9557, test_f1: 0.5176
 epoch: 69, train_loss: 0.8269, test_loss: 0.9383, test_f1: 0.5125
 epoch: 70, train_loss: 0.8077, test_loss: 0.9466, test_f1: 0.5243
 epoch: 71, train_loss: 0.8224, test_loss: 0.9674, test_f1: 0.5178
 epoch: 72, train_loss: 0.8141, test_loss: 0.9447, test_f1: 0.5082
 epoch: 73, train_loss: 0.8232, test_loss: 0.9658, test_f1: 0.5166
 epoch: 74, train_loss: 0.8050, test_loss: 0.9416, test_f1: 0.5198
 epoch: 75, train_loss: 0.8036, test_loss: 0.9527, test_f1: 0.5244
 epoch: 76, train_loss: 0.7971, test_loss: 0.9439, test_f1: 0.5111
 epoch: 77, train_loss: 0.8089, test_loss: 0.9551, test_f1: 0.5178
 epoch: 78, train_loss: 0.7968, test_loss: 0.9569, test_f1: 0.5097
 epoch: 79, train_loss: 0.7945, test_loss: 0.9760, test_f1: 0.5149
 epoch: 80, train_loss: 0.7960, test_loss: 0.9707, test_f1: 0.5172
 epoch: 81, train_loss: 0.7927, test_loss: 0.9531, test_f1: 0.5273
 epoch: 82, train_loss: 0.7996, test_loss: 0.9800, test_f1: 0.5127
 epoch: 83, train_loss: 0.7897, test_loss: 0.9499, test_f1: 0.5307
 epoch: 84, train_loss: 0.7903, test_loss: 1.0084, test_f1: 0.5224
 epoch: 85, train_loss: 0.7943, test_loss: 0.9688, test_f1: 0.5292
 epoch: 86, train_loss: 0.7997, test_loss: 0.9739, test_f1: 0.5282
 epoch: 87, train_loss: 0.8048, test_loss: 0.9888, test_f1: 0.5165
 epoch: 88, train_loss: 0.7952, test_loss: 0.9734, test_f1: 0.5171
 epoch: 89, train_loss: 0.7898, test_loss: 0.9696, test_f1: 0.5201
 epoch: 90, train_loss: 0.7907, test_loss: 0.9558, test_f1: 0.5244
 epoch: 91, train_loss: 0.7783, test_loss: 0.9681, test_f1: 0.5080
 epoch: 92, train_loss: 0.7861, test_loss: 0.9707, test_f1: 0.5212
 epoch: 93, train_loss: 0.7912, test_loss: 0.9782, test_f1: 0.5166
 epoch: 94, train_loss: 0.7873, test_loss: 0.9891, test_f1: 0.5144
 epoch: 95, train_loss: 0.7780, test_loss: 0.9845, test_f1: 0.5135
 epoch: 96, train_loss: 0.7894, test_loss: 0.9725, test_f1: 0.5268
 epoch: 97, train_loss: 0.7854, test_loss: 0.9963, test_f1: 0.5140
 epoch: 98, train_loss: 0.7791, test_loss: 0.9775, test_f1: 0.5221
 epoch: 99, train_loss: 0.7720, test_loss: 0.9915, test_f1: 0.5264
##################ITERATION #1 ****************************************
 epoch: 0, train_loss: 1.3331, test_loss: 1.3406, test_f1: 0.2270
 epoch: 1, train_loss: 1.2551, test_loss: 1.3183, test_f1: 0.2270
 epoch: 2, train_loss: 1.2141, test_loss: 1.3027, test_f1: 0.2270
 epoch: 3, train_loss: 1.1704, test_loss: 1.2234, test_f1: 0.2368
 epoch: 4, train_loss: 1.1351, test_loss: 1.1225, test_f1: 0.3354
 epoch: 5, train_loss: 1.1036, test_loss: 1.0820, test_f1: 0.3460
 epoch: 6, train_loss: 1.0908, test_loss: 1.0853, test_f1: 0.3221
 epoch: 7, train_loss: 1.0699, test_loss: 1.0784, test_f1: 0.3183
 epoch: 8, train_loss: 1.0482, test_loss: 1.0583, test_f1: 0.3374
 epoch: 9, train_loss: 1.0462, test_loss: 1.0370, test_f1: 0.3494
 epoch: 10, train_loss: 1.0358, test_loss: 1.0290, test_f1: 0.3503
 epoch: 11, train_loss: 1.0281, test_loss: 1.0327, test_f1: 0.3536
 epoch: 12, train_loss: 1.0171, test_loss: 1.0321, test_f1: 0.3719
 epoch: 13, train_loss: 1.0094, test_loss: 1.0522, test_f1: 0.3808
 epoch: 14, train_loss: 1.0084, test_loss: 0.9992, test_f1: 0.3821
 epoch: 15, train_loss: 0.9986, test_loss: 1.0773, test_f1: 0.3960
 epoch: 16, train_loss: 0.9890, test_loss: 1.0106, test_f1: 0.4231
 epoch: 17, train_loss: 0.9908, test_loss: 0.9840, test_f1: 0.4633
 epoch: 18, train_loss: 0.9808, test_loss: 1.0105, test_f1: 0.4450
 epoch: 19, train_loss: 0.9690, test_loss: 1.0163, test_f1: 0.4625
 epoch: 20, train_loss: 0.9647, test_loss: 1.1047, test_f1: 0.4342
 epoch: 21, train_loss: 0.9647, test_loss: 0.9786, test_f1: 0.4630
 epoch: 22, train_loss: 0.9630, test_loss: 0.9605, test_f1: 0.5044
 epoch: 23, train_loss: 0.9539, test_loss: 0.9835, test_f1: 0.4664
 epoch: 24, train_loss: 0.9523, test_loss: 1.1562, test_f1: 0.4368
 epoch: 25, train_loss: 0.9415, test_loss: 0.9756, test_f1: 0.4677
 epoch: 26, train_loss: 0.9346, test_loss: 0.9681, test_f1: 0.4820
 epoch: 27, train_loss: 0.9363, test_loss: 0.9591, test_f1: 0.4741
 epoch: 28, train_loss: 0.9341, test_loss: 1.2353, test_f1: 0.4315
 epoch: 29, train_loss: 0.9296, test_loss: 0.9336, test_f1: 0.4886
 epoch: 30, train_loss: 0.9274, test_loss: 1.0380, test_f1: 0.4662
 epoch: 31, train_loss: 0.9175, test_loss: 0.9540, test_f1: 0.4927
 epoch: 32, train_loss: 0.9182, test_loss: 0.9753, test_f1: 0.4994
 epoch: 33, train_loss: 0.9097, test_loss: 1.0110, test_f1: 0.4771
 epoch: 34, train_loss: 0.9143, test_loss: 0.9150, test_f1: 0.5037
 epoch: 35, train_loss: 0.8988, test_loss: 1.0538, test_f1: 0.4841
 epoch: 36, train_loss: 0.9073, test_loss: 0.9572, test_f1: 0.5148
 epoch: 37, train_loss: 0.9048, test_loss: 0.9194, test_f1: 0.5007
 epoch: 38, train_loss: 0.8979, test_loss: 0.9586, test_f1: 0.5097
 epoch: 39, train_loss: 0.9112, test_loss: 0.9513, test_f1: 0.4862
 epoch: 40, train_loss: 0.9004, test_loss: 0.9298, test_f1: 0.5146
 epoch: 41, train_loss: 0.8917, test_loss: 0.9541, test_f1: 0.5164
 epoch: 42, train_loss: 0.8825, test_loss: 0.9436, test_f1: 0.5109
 epoch: 43, train_loss: 0.8852, test_loss: 0.9279, test_f1: 0.5253
 epoch: 44, train_loss: 0.8765, test_loss: 0.9118, test_f1: 0.5174
 epoch: 45, train_loss: 0.8734, test_loss: 0.9633, test_f1: 0.5013
 epoch: 46, train_loss: 0.8736, test_loss: 0.9600, test_f1: 0.5062
 epoch: 47, train_loss: 0.8786, test_loss: 1.0339, test_f1: 0.4898
 epoch: 48, train_loss: 0.8628, test_loss: 0.9596, test_f1: 0.5119
 epoch: 49, train_loss: 0.8679, test_loss: 0.9573, test_f1: 0.5214
 epoch: 50, train_loss: 0.8627, test_loss: 0.9228, test_f1: 0.5196
 epoch: 51, train_loss: 0.8534, test_loss: 0.9546, test_f1: 0.5116
 epoch: 52, train_loss: 0.8631, test_loss: 0.9290, test_f1: 0.5183
 epoch: 53, train_loss: 0.8542, test_loss: 0.9616, test_f1: 0.5119
 epoch: 54, train_loss: 0.8442, test_loss: 0.9546, test_f1: 0.5179
 epoch: 55, train_loss: 0.8541, test_loss: 0.9267, test_f1: 0.5220
 epoch: 56, train_loss: 0.8484, test_loss: 0.9483, test_f1: 0.5227
 epoch: 57, train_loss: 0.8469, test_loss: 0.9386, test_f1: 0.5309
 epoch: 58, train_loss: 0.8413, test_loss: 0.9422, test_f1: 0.5168
 epoch: 59, train_loss: 0.8348, test_loss: 0.9383, test_f1: 0.5196
 epoch: 60, train_loss: 0.8331, test_loss: 0.9501, test_f1: 0.5226
 epoch: 61, train_loss: 0.8337, test_loss: 0.9420, test_f1: 0.5165
 epoch: 62, train_loss: 0.8242, test_loss: 0.9461, test_f1: 0.5161
 epoch: 63, train_loss: 0.8303, test_loss: 0.9335, test_f1: 0.5281
 epoch: 64, train_loss: 0.8321, test_loss: 0.9595, test_f1: 0.5246
 epoch: 65, train_loss: 0.8245, test_loss: 0.9316, test_f1: 0.5259
 epoch: 66, train_loss: 0.8308, test_loss: 0.9358, test_f1: 0.5217
 epoch: 67, train_loss: 0.8216, test_loss: 0.9418, test_f1: 0.5205
 epoch: 68, train_loss: 0.8271, test_loss: 0.9706, test_f1: 0.5078
 epoch: 69, train_loss: 0.8291, test_loss: 0.9401, test_f1: 0.5259
 epoch: 70, train_loss: 0.8260, test_loss: 0.9348, test_f1: 0.5356
 epoch: 71, train_loss: 0.8224, test_loss: 0.9462, test_f1: 0.5250
 epoch: 72, train_loss: 0.8189, test_loss: 0.9430, test_f1: 0.5220
 epoch: 73, train_loss: 0.8256, test_loss: 0.9254, test_f1: 0.5184
 epoch: 74, train_loss: 0.8225, test_loss: 0.9360, test_f1: 0.5298
 epoch: 75, train_loss: 0.8181, test_loss: 0.9215, test_f1: 0.5380
 epoch: 76, train_loss: 0.8196, test_loss: 0.9297, test_f1: 0.5245
 epoch: 77, train_loss: 0.8279, test_loss: 0.9358, test_f1: 0.5208
 epoch: 78, train_loss: 0.8152, test_loss: 0.9317, test_f1: 0.5197
 epoch: 79, train_loss: 0.8051, test_loss: 0.9399, test_f1: 0.5185
 epoch: 80, train_loss: 0.8128, test_loss: 0.9403, test_f1: 0.5318
 epoch: 81, train_loss: 0.8118, test_loss: 0.9478, test_f1: 0.5285
 epoch: 82, train_loss: 0.8029, test_loss: 0.9360, test_f1: 0.5275
 epoch: 83, train_loss: 0.8109, test_loss: 0.9789, test_f1: 0.5027
 epoch: 84, train_loss: 0.8121, test_loss: 0.9496, test_f1: 0.5130
 epoch: 85, train_loss: 0.8055, test_loss: 0.9185, test_f1: 0.5296
 epoch: 86, train_loss: 0.8047, test_loss: 0.9563, test_f1: 0.5338
 epoch: 87, train_loss: 0.8034, test_loss: 0.9556, test_f1: 0.5113
 epoch: 88, train_loss: 0.8077, test_loss: 0.9440, test_f1: 0.5236
 epoch: 89, train_loss: 0.8019, test_loss: 0.9216, test_f1: 0.5379
 epoch: 90, train_loss: 0.8129, test_loss: 0.9673, test_f1: 0.5154
 epoch: 91, train_loss: 0.8085, test_loss: 0.9297, test_f1: 0.5314
 epoch: 92, train_loss: 0.7955, test_loss: 0.9432, test_f1: 0.5341
 epoch: 93, train_loss: 0.8068, test_loss: 0.9229, test_f1: 0.5285
 epoch: 94, train_loss: 0.8000, test_loss: 0.9387, test_f1: 0.5187
 epoch: 95, train_loss: 0.7912, test_loss: 0.9402, test_f1: 0.5330
 epoch: 96, train_loss: 0.7965, test_loss: 0.9395, test_f1: 0.5159
 epoch: 97, train_loss: 0.7879, test_loss: 0.9402, test_f1: 0.5231
 epoch: 98, train_loss: 0.7909, test_loss: 0.9459, test_f1: 0.5287
 epoch: 99, train_loss: 0.7867, test_loss: 0.9273, test_f1: 0.5314
##################ITERATION #2 ****************************************
 epoch: 0, train_loss: 1.3070, test_loss: 1.3240, test_f1: 0.2270
 epoch: 1, train_loss: 1.2357, test_loss: 1.3101, test_f1: 0.2270
 epoch: 2, train_loss: 1.1940, test_loss: 1.2744, test_f1: 0.2270
 epoch: 3, train_loss: 1.1576, test_loss: 1.2016, test_f1: 0.2461
 epoch: 4, train_loss: 1.1136, test_loss: 1.1125, test_f1: 0.3722
 epoch: 5, train_loss: 1.0824, test_loss: 1.0646, test_f1: 0.4138
 epoch: 6, train_loss: 1.0588, test_loss: 1.0293, test_f1: 0.4443
 epoch: 7, train_loss: 1.0344, test_loss: 1.0104, test_f1: 0.4343
 epoch: 8, train_loss: 1.0070, test_loss: 0.9902, test_f1: 0.4801
 epoch: 9, train_loss: 0.9893, test_loss: 0.9742, test_f1: 0.4677
 epoch: 10, train_loss: 0.9805, test_loss: 0.9906, test_f1: 0.4422
 epoch: 11, train_loss: 0.9890, test_loss: 0.9551, test_f1: 0.4685
 epoch: 12, train_loss: 0.9701, test_loss: 0.9424, test_f1: 0.4941
 epoch: 13, train_loss: 0.9548, test_loss: 0.9282, test_f1: 0.4910
 epoch: 14, train_loss: 0.9417, test_loss: 0.9059, test_f1: 0.5087
 epoch: 15, train_loss: 0.9411, test_loss: 0.8996, test_f1: 0.5080
 epoch: 16, train_loss: 0.9271, test_loss: 0.9055, test_f1: 0.5069
 epoch: 17, train_loss: 0.9224, test_loss: 0.8982, test_f1: 0.5056
 epoch: 18, train_loss: 0.9088, test_loss: 0.9005, test_f1: 0.5000
 epoch: 19, train_loss: 0.9213, test_loss: 0.9040, test_f1: 0.4876
 epoch: 20, train_loss: 0.9143, test_loss: 0.8998, test_f1: 0.5103
 epoch: 21, train_loss: 0.9014, test_loss: 0.9123, test_f1: 0.4869
 epoch: 22, train_loss: 0.9022, test_loss: 0.8890, test_f1: 0.5173
 epoch: 23, train_loss: 0.8969, test_loss: 1.0969, test_f1: 0.4515
 epoch: 24, train_loss: 0.9006, test_loss: 1.0899, test_f1: 0.4688
 epoch: 25, train_loss: 0.9014, test_loss: 0.8711, test_f1: 0.5193
 epoch: 26, train_loss: 0.8807, test_loss: 0.8824, test_f1: 0.5096
 epoch: 27, train_loss: 0.8777, test_loss: 0.8682, test_f1: 0.5239
 epoch: 28, train_loss: 0.8680, test_loss: 0.8643, test_f1: 0.5424
 epoch: 29, train_loss: 0.8693, test_loss: 0.8519, test_f1: 0.5393
 epoch: 30, train_loss: 0.8622, test_loss: 0.8538, test_f1: 0.5407
 epoch: 31, train_loss: 0.8606, test_loss: 0.8968, test_f1: 0.5076
 epoch: 32, train_loss: 0.8604, test_loss: 0.8601, test_f1: 0.5329
 epoch: 33, train_loss: 0.8527, test_loss: 0.8844, test_f1: 0.5174
 epoch: 34, train_loss: 0.8515, test_loss: 0.8887, test_f1: 0.5189
 epoch: 35, train_loss: 0.8686, test_loss: 0.9513, test_f1: 0.4872
 epoch: 36, train_loss: 0.8602, test_loss: 0.8635, test_f1: 0.5506
 epoch: 37, train_loss: 0.8549, test_loss: 0.8929, test_f1: 0.5182
 epoch: 38, train_loss: 0.8458, test_loss: 0.8448, test_f1: 0.5444
 epoch: 39, train_loss: 0.8382, test_loss: 0.8540, test_f1: 0.5335
 epoch: 40, train_loss: 0.8532, test_loss: 0.8426, test_f1: 0.5322
 epoch: 41, train_loss: 0.8323, test_loss: 0.8802, test_f1: 0.5186
 epoch: 42, train_loss: 0.8375, test_loss: 0.8357, test_f1: 0.5556
 epoch: 43, train_loss: 0.8324, test_loss: 0.8342, test_f1: 0.5310
 epoch: 44, train_loss: 0.8246, test_loss: 0.8427, test_f1: 0.5377
 epoch: 45, train_loss: 0.8225, test_loss: 0.8563, test_f1: 0.5470
 epoch: 46, train_loss: 0.8153, test_loss: 0.8646, test_f1: 0.5176
 epoch: 47, train_loss: 0.8202, test_loss: 0.8372, test_f1: 0.5331
 epoch: 48, train_loss: 0.8233, test_loss: 0.8994, test_f1: 0.5178
 epoch: 49, train_loss: 0.8189, test_loss: 0.8266, test_f1: 0.5403
 epoch: 50, train_loss: 0.8071, test_loss: 0.8411, test_f1: 0.5439
 epoch: 51, train_loss: 0.8048, test_loss: 0.8332, test_f1: 0.5293
 epoch: 52, train_loss: 0.8023, test_loss: 0.8337, test_f1: 0.5326
 epoch: 53, train_loss: 0.7884, test_loss: 0.8346, test_f1: 0.5571
 epoch: 54, train_loss: 0.7962, test_loss: 0.8461, test_f1: 0.5474
 epoch: 55, train_loss: 0.7910, test_loss: 0.8200, test_f1: 0.5576
 epoch: 56, train_loss: 0.7869, test_loss: 0.8243, test_f1: 0.5606
 epoch: 57, train_loss: 0.7804, test_loss: 0.8141, test_f1: 0.5673
 epoch: 58, train_loss: 0.7791, test_loss: 0.8263, test_f1: 0.5602
 epoch: 59, train_loss: 0.7780, test_loss: 0.8345, test_f1: 0.5468
 epoch: 60, train_loss: 0.7719, test_loss: 0.8338, test_f1: 0.5474
 epoch: 61, train_loss: 0.7826, test_loss: 0.8258, test_f1: 0.5494
 epoch: 62, train_loss: 0.7802, test_loss: 0.8341, test_f1: 0.5623
 epoch: 63, train_loss: 0.7741, test_loss: 0.8417, test_f1: 0.5629
 epoch: 64, train_loss: 0.7749, test_loss: 0.8447, test_f1: 0.5567
 epoch: 65, train_loss: 0.7825, test_loss: 0.8531, test_f1: 0.5575
 epoch: 66, train_loss: 0.7705, test_loss: 0.8299, test_f1: 0.5627
 epoch: 67, train_loss: 0.7713, test_loss: 0.8337, test_f1: 0.5504
 epoch: 68, train_loss: 0.7616, test_loss: 0.8408, test_f1: 0.5635
 epoch: 69, train_loss: 0.7616, test_loss: 0.8520, test_f1: 0.5464
 epoch: 70, train_loss: 0.7653, test_loss: 0.8356, test_f1: 0.5582
 epoch: 71, train_loss: 0.7581, test_loss: 0.8240, test_f1: 0.5574
 epoch: 72, train_loss: 0.7643, test_loss: 0.8227, test_f1: 0.5643
 epoch: 73, train_loss: 0.7602, test_loss: 0.8409, test_f1: 0.5617
 epoch: 74, train_loss: 0.7603, test_loss: 0.8360, test_f1: 0.5589
 epoch: 75, train_loss: 0.7589, test_loss: 0.8347, test_f1: 0.5545
 epoch: 76, train_loss: 0.7567, test_loss: 0.8827, test_f1: 0.5510
 epoch: 77, train_loss: 0.7594, test_loss: 0.8354, test_f1: 0.5672
 epoch: 78, train_loss: 0.7657, test_loss: 0.8434, test_f1: 0.5679
 epoch: 79, train_loss: 0.7478, test_loss: 0.8481, test_f1: 0.5583
 epoch: 80, train_loss: 0.7553, test_loss: 0.8424, test_f1: 0.5522
 epoch: 81, train_loss: 0.7497, test_loss: 0.8396, test_f1: 0.5490
 epoch: 82, train_loss: 0.7616, test_loss: 0.8500, test_f1: 0.5560
 epoch: 83, train_loss: 0.7524, test_loss: 0.8569, test_f1: 0.5659
 epoch: 84, train_loss: 0.7427, test_loss: 0.8448, test_f1: 0.5599
 epoch: 85, train_loss: 0.7389, test_loss: 0.8414, test_f1: 0.5723
 epoch: 86, train_loss: 0.7468, test_loss: 0.8437, test_f1: 0.5476
 epoch: 87, train_loss: 0.7447, test_loss: 0.8813, test_f1: 0.5559
 epoch: 88, train_loss: 0.7507, test_loss: 0.8336, test_f1: 0.5613
 epoch: 89, train_loss: 0.7490, test_loss: 0.8292, test_f1: 0.5626
 epoch: 90, train_loss: 0.7335, test_loss: 0.8436, test_f1: 0.5645
 epoch: 91, train_loss: 0.7405, test_loss: 0.8440, test_f1: 0.5565
 epoch: 92, train_loss: 0.7428, test_loss: 0.8362, test_f1: 0.5648
 epoch: 93, train_loss: 0.7358, test_loss: 0.8186, test_f1: 0.5756
 epoch: 94, train_loss: 0.7366, test_loss: 0.8411, test_f1: 0.5657
 epoch: 95, train_loss: 0.7293, test_loss: 0.8497, test_f1: 0.5641
 epoch: 96, train_loss: 0.7368, test_loss: 0.8295, test_f1: 0.5567
 epoch: 97, train_loss: 0.7387, test_loss: 0.8420, test_f1: 0.5658
 epoch: 98, train_loss: 0.7376, test_loss: 0.8446, test_f1: 0.5574
 epoch: 99, train_loss: 0.7315, test_loss: 0.8619, test_f1: 0.5597
##################ITERATION #3 ****************************************
 epoch: 0, train_loss: 1.3018, test_loss: 1.3425, test_f1: 0.2270
 epoch: 1, train_loss: 1.1653, test_loss: 1.3494, test_f1: 0.2270
 epoch: 2, train_loss: 1.1273, test_loss: 1.4218, test_f1: 0.2571
 epoch: 3, train_loss: 1.0900, test_loss: 1.2804, test_f1: 0.3363
 epoch: 4, train_loss: 1.0750, test_loss: 1.0482, test_f1: 0.4615
 epoch: 5, train_loss: 1.0543, test_loss: 1.0107, test_f1: 0.4717
 epoch: 6, train_loss: 1.0380, test_loss: 0.9999, test_f1: 0.4677
 epoch: 7, train_loss: 1.0321, test_loss: 0.9892, test_f1: 0.4688
 epoch: 8, train_loss: 1.0131, test_loss: 0.9767, test_f1: 0.4890
 epoch: 9, train_loss: 1.0015, test_loss: 0.9764, test_f1: 0.4815
 epoch: 10, train_loss: 0.9885, test_loss: 0.9377, test_f1: 0.5132
 epoch: 11, train_loss: 0.9867, test_loss: 0.9778, test_f1: 0.4921
 epoch: 12, train_loss: 0.9716, test_loss: 0.9334, test_f1: 0.5116
 epoch: 13, train_loss: 0.9769, test_loss: 0.9260, test_f1: 0.5201
 epoch: 14, train_loss: 0.9568, test_loss: 0.9282, test_f1: 0.5112
 epoch: 15, train_loss: 0.9575, test_loss: 0.9539, test_f1: 0.5057
 epoch: 16, train_loss: 0.9569, test_loss: 0.9264, test_f1: 0.4957
 epoch: 17, train_loss: 0.9524, test_loss: 0.9243, test_f1: 0.5138
 epoch: 18, train_loss: 0.9482, test_loss: 0.9192, test_f1: 0.5151
 epoch: 19, train_loss: 0.9424, test_loss: 0.9109, test_f1: 0.5101
 epoch: 20, train_loss: 0.9245, test_loss: 0.9169, test_f1: 0.5190
 epoch: 21, train_loss: 0.9303, test_loss: 0.9405, test_f1: 0.4966
 epoch: 22, train_loss: 0.9295, test_loss: 0.9361, test_f1: 0.4948
 epoch: 23, train_loss: 0.9204, test_loss: 0.9192, test_f1: 0.5138
 epoch: 24, train_loss: 0.9192, test_loss: 0.9080, test_f1: 0.5217
 epoch: 25, train_loss: 0.9097, test_loss: 0.9113, test_f1: 0.5369
 epoch: 26, train_loss: 0.9153, test_loss: 0.9347, test_f1: 0.5026
 epoch: 27, train_loss: 0.9020, test_loss: 0.8914, test_f1: 0.5264
 epoch: 28, train_loss: 0.8945, test_loss: 0.8788, test_f1: 0.5467
 epoch: 29, train_loss: 0.9081, test_loss: 0.8992, test_f1: 0.5164
 epoch: 30, train_loss: 0.9109, test_loss: 0.8962, test_f1: 0.5153
 epoch: 31, train_loss: 0.8990, test_loss: 1.0118, test_f1: 0.4754
 epoch: 32, train_loss: 0.8963, test_loss: 0.9418, test_f1: 0.4999
 epoch: 33, train_loss: 0.8978, test_loss: 0.8903, test_f1: 0.5301
 epoch: 34, train_loss: 0.8952, test_loss: 0.8756, test_f1: 0.5317
 epoch: 35, train_loss: 0.8893, test_loss: 0.9401, test_f1: 0.5226
 epoch: 36, train_loss: 0.8806, test_loss: 0.8795, test_f1: 0.5348
 epoch: 37, train_loss: 0.8829, test_loss: 0.8757, test_f1: 0.5367
 epoch: 38, train_loss: 0.8779, test_loss: 0.8891, test_f1: 0.5239
 epoch: 39, train_loss: 0.8938, test_loss: 0.8733, test_f1: 0.5278
 epoch: 40, train_loss: 0.8929, test_loss: 0.8760, test_f1: 0.5358
 epoch: 41, train_loss: 0.8744, test_loss: 0.8948, test_f1: 0.5240
 epoch: 42, train_loss: 0.8682, test_loss: 0.8835, test_f1: 0.5428
 epoch: 43, train_loss: 0.8731, test_loss: 0.9210, test_f1: 0.5253
 epoch: 44, train_loss: 0.8658, test_loss: 0.8867, test_f1: 0.5285
 epoch: 45, train_loss: 0.8579, test_loss: 0.9361, test_f1: 0.5221
 epoch: 46, train_loss: 0.8521, test_loss: 0.8658, test_f1: 0.5386
 epoch: 47, train_loss: 0.8631, test_loss: 0.8970, test_f1: 0.5316
 epoch: 48, train_loss: 0.8479, test_loss: 0.8658, test_f1: 0.5539
 epoch: 49, train_loss: 0.8551, test_loss: 0.8978, test_f1: 0.5283
 epoch: 50, train_loss: 0.8458, test_loss: 0.9416, test_f1: 0.5313
 epoch: 51, train_loss: 0.8525, test_loss: 0.8824, test_f1: 0.5429
 epoch: 52, train_loss: 0.8342, test_loss: 0.8853, test_f1: 0.5441
 epoch: 53, train_loss: 0.8423, test_loss: 0.8675, test_f1: 0.5458
 epoch: 54, train_loss: 0.8375, test_loss: 0.8664, test_f1: 0.5444
 epoch: 55, train_loss: 0.8351, test_loss: 0.8885, test_f1: 0.5515
 epoch: 56, train_loss: 0.8237, test_loss: 0.8552, test_f1: 0.5522
 epoch: 57, train_loss: 0.8303, test_loss: 0.8695, test_f1: 0.5577
 epoch: 58, train_loss: 0.8280, test_loss: 0.8707, test_f1: 0.5531
 epoch: 59, train_loss: 0.8202, test_loss: 0.8758, test_f1: 0.5509
 epoch: 60, train_loss: 0.8232, test_loss: 0.8598, test_f1: 0.5665
 epoch: 61, train_loss: 0.8212, test_loss: 0.8601, test_f1: 0.5571
 epoch: 62, train_loss: 0.8176, test_loss: 0.8629, test_f1: 0.5643
 epoch: 63, train_loss: 0.8152, test_loss: 0.8590, test_f1: 0.5475
 epoch: 64, train_loss: 0.8110, test_loss: 0.8622, test_f1: 0.5603
 epoch: 65, train_loss: 0.8183, test_loss: 0.8690, test_f1: 0.5592
 epoch: 66, train_loss: 0.8167, test_loss: 0.8660, test_f1: 0.5446
 epoch: 67, train_loss: 0.8053, test_loss: 0.8502, test_f1: 0.5553
 epoch: 68, train_loss: 0.8082, test_loss: 0.8526, test_f1: 0.5581
 epoch: 69, train_loss: 0.8009, test_loss: 0.8698, test_f1: 0.5573
 epoch: 70, train_loss: 0.8139, test_loss: 0.8633, test_f1: 0.5583
 epoch: 71, train_loss: 0.8088, test_loss: 0.8718, test_f1: 0.5561
 epoch: 72, train_loss: 0.8024, test_loss: 0.8590, test_f1: 0.5657
 epoch: 73, train_loss: 0.8054, test_loss: 0.9006, test_f1: 0.5643
 epoch: 74, train_loss: 0.8134, test_loss: 0.8652, test_f1: 0.5462
 epoch: 75, train_loss: 0.8092, test_loss: 0.8625, test_f1: 0.5625
 epoch: 76, train_loss: 0.8075, test_loss: 0.8745, test_f1: 0.5613
 epoch: 77, train_loss: 0.8112, test_loss: 0.8699, test_f1: 0.5539
 epoch: 78, train_loss: 0.8000, test_loss: 0.8543, test_f1: 0.5688
 epoch: 79, train_loss: 0.8098, test_loss: 0.8662, test_f1: 0.5631
 epoch: 80, train_loss: 0.7972, test_loss: 0.8515, test_f1: 0.5635
 epoch: 81, train_loss: 0.8076, test_loss: 0.8650, test_f1: 0.5633
 epoch: 82, train_loss: 0.7864, test_loss: 0.8443, test_f1: 0.5713
 epoch: 83, train_loss: 0.7902, test_loss: 0.8490, test_f1: 0.5665
 epoch: 84, train_loss: 0.7903, test_loss: 0.8520, test_f1: 0.5713
 epoch: 85, train_loss: 0.7967, test_loss: 0.8775, test_f1: 0.5712
 epoch: 86, train_loss: 0.8041, test_loss: 0.8666, test_f1: 0.5472
 epoch: 87, train_loss: 0.8013, test_loss: 0.8549, test_f1: 0.5782
 epoch: 88, train_loss: 0.7846, test_loss: 0.8456, test_f1: 0.5724
 epoch: 89, train_loss: 0.7943, test_loss: 0.8524, test_f1: 0.5630
 epoch: 90, train_loss: 0.7887, test_loss: 0.8575, test_f1: 0.5620
 epoch: 91, train_loss: 0.7851, test_loss: 0.8533, test_f1: 0.5672
 epoch: 92, train_loss: 0.7824, test_loss: 0.8448, test_f1: 0.5733
 epoch: 93, train_loss: 0.7718, test_loss: 0.8583, test_f1: 0.5608
 epoch: 94, train_loss: 0.7808, test_loss: 0.8519, test_f1: 0.5593
 epoch: 95, train_loss: 0.7912, test_loss: 0.8466, test_f1: 0.5742
 epoch: 96, train_loss: 0.7794, test_loss: 0.8596, test_f1: 0.5586
 epoch: 97, train_loss: 0.7669, test_loss: 0.8540, test_f1: 0.5681
 epoch: 98, train_loss: 0.7732, test_loss: 0.8520, test_f1: 0.5638
 epoch: 99, train_loss: 0.7760, test_loss: 0.8575, test_f1: 0.5676
##################ITERATION #4 ****************************************
 epoch: 0, train_loss: 1.4282, test_loss: 1.4218, test_f1: 0.2270
 epoch: 1, train_loss: 1.2164, test_loss: 1.3919, test_f1: 0.2270
 epoch: 2, train_loss: 1.1582, test_loss: 1.3798, test_f1: 0.2270
 epoch: 3, train_loss: 1.1256, test_loss: 1.3741, test_f1: 0.2444
 epoch: 4, train_loss: 1.0917, test_loss: 1.2646, test_f1: 0.2592
 epoch: 5, train_loss: 1.0768, test_loss: 1.0925, test_f1: 0.3821
 epoch: 6, train_loss: 1.0608, test_loss: 1.0513, test_f1: 0.3760
 epoch: 7, train_loss: 1.0543, test_loss: 1.0413, test_f1: 0.3842
 epoch: 8, train_loss: 1.0423, test_loss: 1.0365, test_f1: 0.4253
 epoch: 9, train_loss: 1.0339, test_loss: 1.0470, test_f1: 0.4233
 epoch: 10, train_loss: 1.0222, test_loss: 1.0276, test_f1: 0.4197
 epoch: 11, train_loss: 1.0106, test_loss: 0.9918, test_f1: 0.4433
 epoch: 12, train_loss: 1.0047, test_loss: 1.0475, test_f1: 0.4353
 epoch: 13, train_loss: 0.9932, test_loss: 1.0045, test_f1: 0.4372
 epoch: 14, train_loss: 0.9831, test_loss: 0.9990, test_f1: 0.4537
 epoch: 15, train_loss: 0.9753, test_loss: 1.0083, test_f1: 0.4739
 epoch: 16, train_loss: 0.9620, test_loss: 0.9965, test_f1: 0.4840
 epoch: 17, train_loss: 0.9548, test_loss: 0.9810, test_f1: 0.5003
 epoch: 18, train_loss: 0.9493, test_loss: 0.9831, test_f1: 0.4889
 epoch: 19, train_loss: 0.9405, test_loss: 0.9530, test_f1: 0.4890
 epoch: 20, train_loss: 0.9322, test_loss: 0.9659, test_f1: 0.4824
 epoch: 21, train_loss: 0.9269, test_loss: 0.9328, test_f1: 0.5003
 epoch: 22, train_loss: 0.9172, test_loss: 0.9332, test_f1: 0.4927
 epoch: 23, train_loss: 0.9158, test_loss: 0.9209, test_f1: 0.4990
 epoch: 24, train_loss: 0.9053, test_loss: 0.9221, test_f1: 0.5164
 epoch: 25, train_loss: 0.9066, test_loss: 0.9070, test_f1: 0.5088
 epoch: 26, train_loss: 0.9051, test_loss: 0.9199, test_f1: 0.4948
 epoch: 27, train_loss: 0.9002, test_loss: 0.9287, test_f1: 0.5083
 epoch: 28, train_loss: 0.8904, test_loss: 0.9080, test_f1: 0.5110
 epoch: 29, train_loss: 0.8881, test_loss: 0.9089, test_f1: 0.5203
 epoch: 30, train_loss: 0.8952, test_loss: 0.8949, test_f1: 0.5051
 epoch: 31, train_loss: 0.8815, test_loss: 0.8880, test_f1: 0.5107
 epoch: 32, train_loss: 0.8711, test_loss: 0.9180, test_f1: 0.5090
 epoch: 33, train_loss: 0.8789, test_loss: 0.9023, test_f1: 0.5221
 epoch: 34, train_loss: 0.8714, test_loss: 0.8953, test_f1: 0.5066
 epoch: 35, train_loss: 0.8770, test_loss: 0.9691, test_f1: 0.4784
 epoch: 36, train_loss: 0.8727, test_loss: 0.8988, test_f1: 0.5058
 epoch: 37, train_loss: 0.8633, test_loss: 0.9162, test_f1: 0.5199
 epoch: 38, train_loss: 0.8570, test_loss: 0.9318, test_f1: 0.5247
 epoch: 39, train_loss: 0.8587, test_loss: 0.9476, test_f1: 0.5202
 epoch: 40, train_loss: 0.8610, test_loss: 0.9901, test_f1: 0.5076
 epoch: 41, train_loss: 0.8469, test_loss: 0.9482, test_f1: 0.5153
 epoch: 42, train_loss: 0.8651, test_loss: 0.8878, test_f1: 0.5128
 epoch: 43, train_loss: 0.8567, test_loss: 0.9078, test_f1: 0.5162
 epoch: 44, train_loss: 0.8690, test_loss: 0.9211, test_f1: 0.4954
 epoch: 45, train_loss: 0.8578, test_loss: 0.9597, test_f1: 0.5019
 epoch: 46, train_loss: 0.8431, test_loss: 0.9600, test_f1: 0.5115
 epoch: 47, train_loss: 0.8419, test_loss: 0.9672, test_f1: 0.4964
 epoch: 48, train_loss: 0.8426, test_loss: 0.9162, test_f1: 0.5154
 epoch: 49, train_loss: 0.8393, test_loss: 0.9768, test_f1: 0.5081
 epoch: 50, train_loss: 0.8269, test_loss: 0.9729, test_f1: 0.5147
 epoch: 51, train_loss: 0.8351, test_loss: 0.9323, test_f1: 0.5167
 epoch: 52, train_loss: 0.8251, test_loss: 0.9608, test_f1: 0.5164
 epoch: 53, train_loss: 0.8304, test_loss: 0.9493, test_f1: 0.5171
 epoch: 54, train_loss: 0.8324, test_loss: 0.9687, test_f1: 0.5130
 epoch: 55, train_loss: 0.8205, test_loss: 0.9736, test_f1: 0.5154
 epoch: 56, train_loss: 0.8129, test_loss: 0.9541, test_f1: 0.5214
 epoch: 57, train_loss: 0.8218, test_loss: 0.9709, test_f1: 0.5167
 epoch: 58, train_loss: 0.8111, test_loss: 0.9591, test_f1: 0.5145
 epoch: 59, train_loss: 0.8186, test_loss: 0.9712, test_f1: 0.5120
 epoch: 60, train_loss: 0.8143, test_loss: 0.9701, test_f1: 0.5120
 epoch: 61, train_loss: 0.8128, test_loss: 0.9507, test_f1: 0.5216
 epoch: 62, train_loss: 0.8003, test_loss: 0.9733, test_f1: 0.5221
 epoch: 63, train_loss: 0.8048, test_loss: 0.9918, test_f1: 0.5220
 epoch: 64, train_loss: 0.8018, test_loss: 0.9468, test_f1: 0.5182
 epoch: 65, train_loss: 0.7950, test_loss: 1.0001, test_f1: 0.5087
 epoch: 66, train_loss: 0.8075, test_loss: 0.9684, test_f1: 0.5164
 epoch: 67, train_loss: 0.8091, test_loss: 0.9683, test_f1: 0.5141
 epoch: 68, train_loss: 0.7968, test_loss: 0.9848, test_f1: 0.5245
 epoch: 69, train_loss: 0.7985, test_loss: 0.9831, test_f1: 0.5147
 epoch: 70, train_loss: 0.7818, test_loss: 0.9941, test_f1: 0.5215
 epoch: 71, train_loss: 0.7793, test_loss: 0.9671, test_f1: 0.5157
 epoch: 72, train_loss: 0.7942, test_loss: 0.9675, test_f1: 0.5068
 epoch: 73, train_loss: 0.7942, test_loss: 1.0007, test_f1: 0.5234
 epoch: 74, train_loss: 0.7898, test_loss: 0.9900, test_f1: 0.5140
 epoch: 75, train_loss: 0.8025, test_loss: 0.9876, test_f1: 0.5252
 epoch: 76, train_loss: 0.7862, test_loss: 1.0159, test_f1: 0.5164
 epoch: 77, train_loss: 0.7963, test_loss: 0.9842, test_f1: 0.5203
 epoch: 78, train_loss: 0.7752, test_loss: 0.9904, test_f1: 0.5233
 epoch: 79, train_loss: 0.7879, test_loss: 0.9917, test_f1: 0.5197
 epoch: 80, train_loss: 0.7859, test_loss: 0.9937, test_f1: 0.5215
 epoch: 81, train_loss: 0.7763, test_loss: 1.0090, test_f1: 0.5018
 epoch: 82, train_loss: 0.7807, test_loss: 0.9771, test_f1: 0.5331
 epoch: 83, train_loss: 0.7845, test_loss: 0.9693, test_f1: 0.5249
 epoch: 84, train_loss: 0.7781, test_loss: 1.0035, test_f1: 0.5289
 epoch: 85, train_loss: 0.7787, test_loss: 1.0284, test_f1: 0.5235
 epoch: 86, train_loss: 0.7763, test_loss: 0.9972, test_f1: 0.5250
 epoch: 87, train_loss: 0.7804, test_loss: 1.0166, test_f1: 0.5169
 epoch: 88, train_loss: 0.7700, test_loss: 1.0601, test_f1: 0.5148
 epoch: 89, train_loss: 0.7877, test_loss: 1.0224, test_f1: 0.5297
 epoch: 90, train_loss: 0.7625, test_loss: 1.0231, test_f1: 0.5112
 epoch: 91, train_loss: 0.7790, test_loss: 0.9936, test_f1: 0.5317
 epoch: 92, train_loss: 0.7693, test_loss: 0.9839, test_f1: 0.5246
 epoch: 93, train_loss: 0.7676, test_loss: 1.0398, test_f1: 0.5116
 epoch: 94, train_loss: 0.7612, test_loss: 0.9949, test_f1: 0.5353
 epoch: 95, train_loss: 0.7655, test_loss: 1.0609, test_f1: 0.5074
 epoch: 96, train_loss: 0.7884, test_loss: 1.0033, test_f1: 0.5174
 epoch: 97, train_loss: 0.7727, test_loss: 1.0255, test_f1: 0.5233
 epoch: 98, train_loss: 0.7679, test_loss: 1.0486, test_f1: 0.4926
 epoch: 99, train_loss: 0.7651, test_loss: 1.0236, test_f1: 0.5215
##################ITERATION #5 ****************************************
 epoch: 0, train_loss: 1.2800, test_loss: 1.3566, test_f1: 0.2270
 epoch: 1, train_loss: 1.1893, test_loss: 1.3134, test_f1: 0.2270
 epoch: 2, train_loss: 1.1375, test_loss: 1.2365, test_f1: 0.2527
 epoch: 3, train_loss: 1.1104, test_loss: 1.2051, test_f1: 0.3245
 epoch: 4, train_loss: 1.0894, test_loss: 1.1569, test_f1: 0.3541
 epoch: 5, train_loss: 1.0737, test_loss: 1.1189, test_f1: 0.3570
 epoch: 6, train_loss: 1.0583, test_loss: 1.0833, test_f1: 0.4123
 epoch: 7, train_loss: 1.0407, test_loss: 1.0612, test_f1: 0.3949
 epoch: 8, train_loss: 1.0423, test_loss: 1.0643, test_f1: 0.4627
 epoch: 9, train_loss: 1.0153, test_loss: 1.0411, test_f1: 0.4702
 epoch: 10, train_loss: 1.0102, test_loss: 1.0615, test_f1: 0.4771
 epoch: 11, train_loss: 1.0091, test_loss: 1.0424, test_f1: 0.4834
 epoch: 12, train_loss: 0.9985, test_loss: 1.0313, test_f1: 0.4825
 epoch: 13, train_loss: 1.0009, test_loss: 1.0357, test_f1: 0.4938
 epoch: 14, train_loss: 0.9934, test_loss: 1.0096, test_f1: 0.4892
 epoch: 15, train_loss: 0.9853, test_loss: 0.9703, test_f1: 0.5052
 epoch: 16, train_loss: 0.9863, test_loss: 1.0520, test_f1: 0.4996
 epoch: 17, train_loss: 0.9723, test_loss: 1.0344, test_f1: 0.4918
 epoch: 18, train_loss: 0.9699, test_loss: 1.0254, test_f1: 0.4938
 epoch: 19, train_loss: 0.9630, test_loss: 1.0153, test_f1: 0.5150
 epoch: 20, train_loss: 0.9553, test_loss: 1.0074, test_f1: 0.5036
 epoch: 21, train_loss: 0.9476, test_loss: 0.9723, test_f1: 0.5179
 epoch: 22, train_loss: 0.9366, test_loss: 0.9850, test_f1: 0.5119
 epoch: 23, train_loss: 0.9416, test_loss: 1.0028, test_f1: 0.5066
 epoch: 24, train_loss: 0.9338, test_loss: 0.9995, test_f1: 0.4686
 epoch: 25, train_loss: 0.9254, test_loss: 0.9819, test_f1: 0.5067
 epoch: 26, train_loss: 0.9222, test_loss: 0.9707, test_f1: 0.5032
 epoch: 27, train_loss: 0.9206, test_loss: 0.9605, test_f1: 0.4948
 epoch: 28, train_loss: 0.9126, test_loss: 0.9801, test_f1: 0.4878
 epoch: 29, train_loss: 0.9086, test_loss: 0.9249, test_f1: 0.5004
 epoch: 30, train_loss: 0.9120, test_loss: 0.9733, test_f1: 0.5056
 epoch: 31, train_loss: 0.8946, test_loss: 0.9769, test_f1: 0.5239
 epoch: 32, train_loss: 0.9003, test_loss: 0.9508, test_f1: 0.5176
 epoch: 33, train_loss: 0.8973, test_loss: 0.9156, test_f1: 0.4933
 epoch: 34, train_loss: 0.8891, test_loss: 0.8818, test_f1: 0.5226
 epoch: 35, train_loss: 0.8742, test_loss: 0.9572, test_f1: 0.5172
 epoch: 36, train_loss: 0.8800, test_loss: 0.8701, test_f1: 0.5303
 epoch: 37, train_loss: 0.8756, test_loss: 0.9517, test_f1: 0.5439
 epoch: 38, train_loss: 0.8668, test_loss: 0.9333, test_f1: 0.5339
 epoch: 39, train_loss: 0.8665, test_loss: 0.9549, test_f1: 0.5080
 epoch: 40, train_loss: 0.8727, test_loss: 0.9978, test_f1: 0.5141
 epoch: 41, train_loss: 0.8753, test_loss: 0.8974, test_f1: 0.5114
 epoch: 42, train_loss: 0.8578, test_loss: 0.8807, test_f1: 0.5356
 epoch: 43, train_loss: 0.8486, test_loss: 0.8862, test_f1: 0.5176
 epoch: 44, train_loss: 0.8398, test_loss: 0.8773, test_f1: 0.5389
 epoch: 45, train_loss: 0.8309, test_loss: 0.9682, test_f1: 0.5146
 epoch: 46, train_loss: 0.8320, test_loss: 0.9536, test_f1: 0.5437
 epoch: 47, train_loss: 0.8312, test_loss: 0.9246, test_f1: 0.5305
 epoch: 48, train_loss: 0.8240, test_loss: 0.8843, test_f1: 0.5363
 epoch: 49, train_loss: 0.8260, test_loss: 0.8948, test_f1: 0.5343
 epoch: 50, train_loss: 0.8214, test_loss: 0.9772, test_f1: 0.5300
 epoch: 51, train_loss: 0.8057, test_loss: 0.9005, test_f1: 0.5242
 epoch: 52, train_loss: 0.8087, test_loss: 0.9228, test_f1: 0.5393
 epoch: 53, train_loss: 0.8010, test_loss: 0.9023, test_f1: 0.5486
 epoch: 54, train_loss: 0.8076, test_loss: 0.8925, test_f1: 0.5360
 epoch: 55, train_loss: 0.8091, test_loss: 0.9100, test_f1: 0.5442
 epoch: 56, train_loss: 0.7993, test_loss: 0.9166, test_f1: 0.5297
 epoch: 57, train_loss: 0.8048, test_loss: 0.9036, test_f1: 0.5293
 epoch: 58, train_loss: 0.8012, test_loss: 0.9027, test_f1: 0.5351
 epoch: 59, train_loss: 0.7987, test_loss: 0.9296, test_f1: 0.5288
 epoch: 60, train_loss: 0.7878, test_loss: 0.9036, test_f1: 0.5349
 epoch: 61, train_loss: 0.7900, test_loss: 0.9013, test_f1: 0.5270
 epoch: 62, train_loss: 0.7868, test_loss: 0.9123, test_f1: 0.5493
 epoch: 63, train_loss: 0.7868, test_loss: 0.9451, test_f1: 0.5334
 epoch: 64, train_loss: 0.7834, test_loss: 0.9066, test_f1: 0.5499
 epoch: 65, train_loss: 0.7843, test_loss: 0.9473, test_f1: 0.5284
 epoch: 66, train_loss: 0.7868, test_loss: 0.8843, test_f1: 0.5376
 epoch: 67, train_loss: 0.7837, test_loss: 0.8828, test_f1: 0.5420
 epoch: 68, train_loss: 0.7808, test_loss: 0.9018, test_f1: 0.5395
 epoch: 69, train_loss: 0.7910, test_loss: 0.8508, test_f1: 0.5426
 epoch: 70, train_loss: 0.7778, test_loss: 0.8967, test_f1: 0.5435
 epoch: 71, train_loss: 0.7843, test_loss: 0.9295, test_f1: 0.5463
 epoch: 72, train_loss: 0.7729, test_loss: 0.8705, test_f1: 0.5575
 epoch: 73, train_loss: 0.7667, test_loss: 0.9513, test_f1: 0.5313
 epoch: 74, train_loss: 0.7702, test_loss: 0.9021, test_f1: 0.5345
 epoch: 75, train_loss: 0.7746, test_loss: 0.9034, test_f1: 0.5450
 epoch: 76, train_loss: 0.7556, test_loss: 0.8789, test_f1: 0.5473
 epoch: 77, train_loss: 0.7691, test_loss: 0.8829, test_f1: 0.5436
 epoch: 78, train_loss: 0.7613, test_loss: 0.9212, test_f1: 0.5402
 epoch: 79, train_loss: 0.7678, test_loss: 0.8775, test_f1: 0.5619
 epoch: 80, train_loss: 0.7702, test_loss: 0.9989, test_f1: 0.5027
 epoch: 81, train_loss: 0.7741, test_loss: 0.9254, test_f1: 0.5352
 epoch: 82, train_loss: 0.7736, test_loss: 0.8853, test_f1: 0.5518
 epoch: 83, train_loss: 0.7708, test_loss: 0.9159, test_f1: 0.5471
 epoch: 84, train_loss: 0.7700, test_loss: 0.8815, test_f1: 0.5409
 epoch: 85, train_loss: 0.7624, test_loss: 0.8866, test_f1: 0.5450
 epoch: 86, train_loss: 0.7576, test_loss: 0.9003, test_f1: 0.5565
 epoch: 87, train_loss: 0.7536, test_loss: 0.8814, test_f1: 0.5429
 epoch: 88, train_loss: 0.7510, test_loss: 0.9075, test_f1: 0.5505
 epoch: 89, train_loss: 0.7543, test_loss: 0.9258, test_f1: 0.5591
 epoch: 90, train_loss: 0.7579, test_loss: 0.9030, test_f1: 0.5560
 epoch: 91, train_loss: 0.7630, test_loss: 0.8866, test_f1: 0.5443
 epoch: 92, train_loss: 0.7449, test_loss: 0.8821, test_f1: 0.5526
 epoch: 93, train_loss: 0.7561, test_loss: 0.8565, test_f1: 0.5653
 epoch: 94, train_loss: 0.7461, test_loss: 0.8678, test_f1: 0.5617
 epoch: 95, train_loss: 0.7504, test_loss: 0.8961, test_f1: 0.5550
 epoch: 96, train_loss: 0.7504, test_loss: 0.8822, test_f1: 0.5537
 epoch: 97, train_loss: 0.7382, test_loss: 0.8773, test_f1: 0.5604
 epoch: 98, train_loss: 0.7439, test_loss: 0.8914, test_f1: 0.5555
 epoch: 99, train_loss: 0.7424, test_loss: 0.8854, test_f1: 0.5591
##################ITERATION #6 ****************************************
 epoch: 0, train_loss: 1.2815, test_loss: 1.3275, test_f1: 0.2270
 epoch: 1, train_loss: 1.1444, test_loss: 1.3139, test_f1: 0.2270
 epoch: 2, train_loss: 1.1101, test_loss: 1.2743, test_f1: 0.2270
 epoch: 3, train_loss: 1.0677, test_loss: 1.1027, test_f1: 0.3409
 epoch: 4, train_loss: 1.0427, test_loss: 1.0307, test_f1: 0.3932
 epoch: 5, train_loss: 1.0380, test_loss: 0.9963, test_f1: 0.4408
 epoch: 6, train_loss: 1.0118, test_loss: 0.9939, test_f1: 0.4485
 epoch: 7, train_loss: 1.0042, test_loss: 0.9931, test_f1: 0.4477
 epoch: 8, train_loss: 0.9877, test_loss: 0.9703, test_f1: 0.4679
 epoch: 9, train_loss: 0.9883, test_loss: 0.9633, test_f1: 0.4708
 epoch: 10, train_loss: 0.9732, test_loss: 0.9630, test_f1: 0.4751
 epoch: 11, train_loss: 0.9734, test_loss: 0.9567, test_f1: 0.4722
 epoch: 12, train_loss: 0.9616, test_loss: 0.9592, test_f1: 0.4821
 epoch: 13, train_loss: 0.9578, test_loss: 0.9645, test_f1: 0.4655
 epoch: 14, train_loss: 0.9579, test_loss: 0.9640, test_f1: 0.4639
 epoch: 15, train_loss: 0.9571, test_loss: 0.9231, test_f1: 0.4842
 epoch: 16, train_loss: 0.9438, test_loss: 0.9418, test_f1: 0.5012
 epoch: 17, train_loss: 0.9279, test_loss: 0.9447, test_f1: 0.4677
 epoch: 18, train_loss: 0.9269, test_loss: 0.9562, test_f1: 0.5027
 epoch: 19, train_loss: 0.9179, test_loss: 0.9393, test_f1: 0.4817
 epoch: 20, train_loss: 0.9147, test_loss: 0.9377, test_f1: 0.4975
 epoch: 21, train_loss: 0.9116, test_loss: 0.9289, test_f1: 0.5144
 epoch: 22, train_loss: 0.9045, test_loss: 0.9545, test_f1: 0.4815
 epoch: 23, train_loss: 0.8897, test_loss: 0.9498, test_f1: 0.5089
 epoch: 24, train_loss: 0.8956, test_loss: 0.9457, test_f1: 0.5052
 epoch: 25, train_loss: 0.8807, test_loss: 0.9225, test_f1: 0.4964
 epoch: 26, train_loss: 0.8846, test_loss: 0.9589, test_f1: 0.5049
 epoch: 27, train_loss: 0.8806, test_loss: 1.0173, test_f1: 0.4751
 epoch: 28, train_loss: 0.8703, test_loss: 0.8820, test_f1: 0.5179
 epoch: 29, train_loss: 0.8780, test_loss: 0.9419, test_f1: 0.5065
 epoch: 30, train_loss: 0.8688, test_loss: 1.0271, test_f1: 0.4524
 epoch: 31, train_loss: 0.8583, test_loss: 0.9886, test_f1: 0.5018
 epoch: 32, train_loss: 0.8658, test_loss: 0.9254, test_f1: 0.5270
 epoch: 33, train_loss: 0.8577, test_loss: 0.9395, test_f1: 0.5082
 epoch: 34, train_loss: 0.8561, test_loss: 0.9015, test_f1: 0.5231
 epoch: 35, train_loss: 0.8521, test_loss: 0.9405, test_f1: 0.5199
 epoch: 36, train_loss: 0.8417, test_loss: 0.9503, test_f1: 0.5022
 epoch: 37, train_loss: 0.8470, test_loss: 0.9042, test_f1: 0.5425
 epoch: 38, train_loss: 0.8330, test_loss: 0.9623, test_f1: 0.4923
 epoch: 39, train_loss: 0.8284, test_loss: 0.9223, test_f1: 0.5470
 epoch: 40, train_loss: 0.8466, test_loss: 0.9292, test_f1: 0.5246
 epoch: 41, train_loss: 0.8431, test_loss: 0.9368, test_f1: 0.5260
 epoch: 42, train_loss: 0.8362, test_loss: 0.9222, test_f1: 0.5134
 epoch: 43, train_loss: 0.8269, test_loss: 1.0005, test_f1: 0.4893
 epoch: 44, train_loss: 0.8259, test_loss: 0.9253, test_f1: 0.5467
 epoch: 45, train_loss: 0.8292, test_loss: 0.9121, test_f1: 0.5481
 epoch: 46, train_loss: 0.8185, test_loss: 0.8943, test_f1: 0.5402
 epoch: 47, train_loss: 0.8198, test_loss: 0.9437, test_f1: 0.5425
 epoch: 48, train_loss: 0.8101, test_loss: 0.9416, test_f1: 0.5476
 epoch: 49, train_loss: 0.8150, test_loss: 0.9334, test_f1: 0.5536
 epoch: 50, train_loss: 0.8142, test_loss: 0.9565, test_f1: 0.5333
 epoch: 51, train_loss: 0.8005, test_loss: 0.9192, test_f1: 0.5355
 epoch: 52, train_loss: 0.8003, test_loss: 0.9219, test_f1: 0.5418
 epoch: 53, train_loss: 0.7953, test_loss: 0.9270, test_f1: 0.5562
 epoch: 54, train_loss: 0.7942, test_loss: 0.9441, test_f1: 0.5444
 epoch: 55, train_loss: 0.7949, test_loss: 0.9050, test_f1: 0.5563
 epoch: 56, train_loss: 0.7908, test_loss: 0.9042, test_f1: 0.5571
 epoch: 57, train_loss: 0.7844, test_loss: 0.9284, test_f1: 0.5472
 epoch: 58, train_loss: 0.7879, test_loss: 0.9268, test_f1: 0.5645
 epoch: 59, train_loss: 0.7863, test_loss: 0.9280, test_f1: 0.5499
 epoch: 60, train_loss: 0.7898, test_loss: 0.9024, test_f1: 0.5333
 epoch: 61, train_loss: 0.7809, test_loss: 0.9126, test_f1: 0.5415
 epoch: 62, train_loss: 0.7886, test_loss: 0.9070, test_f1: 0.5613
 epoch: 63, train_loss: 0.7863, test_loss: 0.9051, test_f1: 0.5583
 epoch: 64, train_loss: 0.7819, test_loss: 0.9043, test_f1: 0.5383
 epoch: 65, train_loss: 0.7837, test_loss: 0.8580, test_f1: 0.5531
 epoch: 66, train_loss: 0.7744, test_loss: 0.8973, test_f1: 0.5587
 epoch: 67, train_loss: 0.7768, test_loss: 0.9004, test_f1: 0.5675
 epoch: 68, train_loss: 0.7734, test_loss: 0.9066, test_f1: 0.5588
 epoch: 69, train_loss: 0.7704, test_loss: 0.8850, test_f1: 0.5183
 epoch: 70, train_loss: 0.7748, test_loss: 0.9264, test_f1: 0.5571
 epoch: 71, train_loss: 0.7667, test_loss: 0.9211, test_f1: 0.5608
 epoch: 72, train_loss: 0.7611, test_loss: 0.8557, test_f1: 0.5320
 epoch: 73, train_loss: 0.7614, test_loss: 0.8847, test_f1: 0.5373
 epoch: 74, train_loss: 0.7603, test_loss: 0.8856, test_f1: 0.5536
 epoch: 75, train_loss: 0.7657, test_loss: 0.8470, test_f1: 0.5697
 epoch: 76, train_loss: 0.7653, test_loss: 0.8768, test_f1: 0.5655
 epoch: 77, train_loss: 0.7590, test_loss: 0.8845, test_f1: 0.5589
 epoch: 78, train_loss: 0.7659, test_loss: 0.8836, test_f1: 0.5520
 epoch: 79, train_loss: 0.7637, test_loss: 0.8637, test_f1: 0.5674
 epoch: 80, train_loss: 0.7629, test_loss: 0.8703, test_f1: 0.5688
 epoch: 81, train_loss: 0.7587, test_loss: 0.9368, test_f1: 0.5650
 epoch: 82, train_loss: 0.7611, test_loss: 0.8829, test_f1: 0.5598
 epoch: 83, train_loss: 0.7568, test_loss: 0.8757, test_f1: 0.5463
 epoch: 84, train_loss: 0.7482, test_loss: 0.8691, test_f1: 0.5567
 epoch: 85, train_loss: 0.7582, test_loss: 0.9101, test_f1: 0.5738
 epoch: 86, train_loss: 0.7765, test_loss: 0.9416, test_f1: 0.5454
 epoch: 87, train_loss: 0.7617, test_loss: 0.8956, test_f1: 0.5732
 epoch: 88, train_loss: 0.7577, test_loss: 0.8773, test_f1: 0.5450
 epoch: 89, train_loss: 0.7625, test_loss: 0.9209, test_f1: 0.5636
 epoch: 90, train_loss: 0.7631, test_loss: 0.9582, test_f1: 0.5386
 epoch: 91, train_loss: 0.7593, test_loss: 0.8814, test_f1: 0.5647
 epoch: 92, train_loss: 0.7512, test_loss: 0.8935, test_f1: 0.5333
 epoch: 93, train_loss: 0.7417, test_loss: 0.8913, test_f1: 0.5710
 epoch: 94, train_loss: 0.7592, test_loss: 0.8323, test_f1: 0.5739
 epoch: 95, train_loss: 0.7474, test_loss: 0.8177, test_f1: 0.5849
 epoch: 96, train_loss: 0.7533, test_loss: 0.8744, test_f1: 0.5779
 epoch: 97, train_loss: 0.7520, test_loss: 0.8518, test_f1: 0.5781
 epoch: 98, train_loss: 0.7497, test_loss: 0.9040, test_f1: 0.5335
 epoch: 99, train_loss: 0.7430, test_loss: 0.9371, test_f1: 0.5441
##################ITERATION #7 ****************************************
 epoch: 0, train_loss: 1.5265, test_loss: 1.3145, test_f1: 0.2270
 epoch: 1, train_loss: 1.2246, test_loss: 1.3600, test_f1: 0.2271
 epoch: 2, train_loss: 1.1668, test_loss: 1.3266, test_f1: 0.2287
 epoch: 3, train_loss: 1.1453, test_loss: 1.1366, test_f1: 0.3489
 epoch: 4, train_loss: 1.1131, test_loss: 1.0627, test_f1: 0.4196
 epoch: 5, train_loss: 1.0862, test_loss: 1.0349, test_f1: 0.4392
 epoch: 6, train_loss: 1.0629, test_loss: 1.0131, test_f1: 0.4564
 epoch: 7, train_loss: 1.0513, test_loss: 1.0065, test_f1: 0.4569
 epoch: 8, train_loss: 1.0439, test_loss: 0.9986, test_f1: 0.4554
 epoch: 9, train_loss: 1.0287, test_loss: 0.9918, test_f1: 0.4559
 epoch: 10, train_loss: 1.0145, test_loss: 0.9880, test_f1: 0.4659
 epoch: 11, train_loss: 1.0079, test_loss: 0.9762, test_f1: 0.4684
 epoch: 12, train_loss: 0.9946, test_loss: 0.9868, test_f1: 0.4694
 epoch: 13, train_loss: 0.9881, test_loss: 0.9862, test_f1: 0.4708
 epoch: 14, train_loss: 0.9712, test_loss: 0.9664, test_f1: 0.4816
 epoch: 15, train_loss: 0.9617, test_loss: 0.9600, test_f1: 0.4838
 epoch: 16, train_loss: 0.9715, test_loss: 0.9696, test_f1: 0.5056
 epoch: 17, train_loss: 0.9554, test_loss: 0.9667, test_f1: 0.5024
 epoch: 18, train_loss: 0.9496, test_loss: 0.9777, test_f1: 0.5177
 epoch: 19, train_loss: 0.9381, test_loss: 0.9446, test_f1: 0.5074
 epoch: 20, train_loss: 0.9324, test_loss: 0.9569, test_f1: 0.5202
 epoch: 21, train_loss: 0.9263, test_loss: 0.9439, test_f1: 0.5249
 epoch: 22, train_loss: 0.9134, test_loss: 0.9470, test_f1: 0.5185
 epoch: 23, train_loss: 0.9148, test_loss: 0.9589, test_f1: 0.5266
 epoch: 24, train_loss: 0.9162, test_loss: 0.9452, test_f1: 0.5369
 epoch: 25, train_loss: 0.9060, test_loss: 0.9503, test_f1: 0.5119
 epoch: 26, train_loss: 0.9048, test_loss: 0.9507, test_f1: 0.5279
 epoch: 27, train_loss: 0.8919, test_loss: 0.9311, test_f1: 0.5406
 epoch: 28, train_loss: 0.8903, test_loss: 0.9251, test_f1: 0.5532
 epoch: 29, train_loss: 0.8894, test_loss: 0.9406, test_f1: 0.5415
 epoch: 30, train_loss: 0.8819, test_loss: 0.9156, test_f1: 0.5475
 epoch: 31, train_loss: 0.8753, test_loss: 0.9245, test_f1: 0.5524
 epoch: 32, train_loss: 0.8735, test_loss: 0.9322, test_f1: 0.5377
 epoch: 33, train_loss: 0.8723, test_loss: 0.9795, test_f1: 0.5079
 epoch: 34, train_loss: 0.8603, test_loss: 0.9151, test_f1: 0.5478
 epoch: 35, train_loss: 0.8727, test_loss: 0.9449, test_f1: 0.5561
 epoch: 36, train_loss: 0.8706, test_loss: 0.9324, test_f1: 0.5413
 epoch: 37, train_loss: 0.8686, test_loss: 0.9042, test_f1: 0.5568
 epoch: 38, train_loss: 0.8596, test_loss: 0.9310, test_f1: 0.5351
 epoch: 39, train_loss: 0.8584, test_loss: 0.9341, test_f1: 0.5337
 epoch: 40, train_loss: 0.8564, test_loss: 0.9689, test_f1: 0.5307
 epoch: 41, train_loss: 0.8551, test_loss: 0.9109, test_f1: 0.5284
 epoch: 42, train_loss: 0.8393, test_loss: 0.9106, test_f1: 0.5293
 epoch: 43, train_loss: 0.8491, test_loss: 0.9239, test_f1: 0.5524
 epoch: 44, train_loss: 0.8355, test_loss: 0.9497, test_f1: 0.5380
 epoch: 45, train_loss: 0.8396, test_loss: 0.9308, test_f1: 0.5456
 epoch: 46, train_loss: 0.8399, test_loss: 0.9299, test_f1: 0.5287
 epoch: 47, train_loss: 0.8370, test_loss: 0.9480, test_f1: 0.5483
 epoch: 48, train_loss: 0.8326, test_loss: 0.8916, test_f1: 0.5341
 epoch: 49, train_loss: 0.8272, test_loss: 0.9605, test_f1: 0.5151
 epoch: 50, train_loss: 0.8292, test_loss: 0.9131, test_f1: 0.5393
 epoch: 51, train_loss: 0.8190, test_loss: 0.9072, test_f1: 0.5373
 epoch: 52, train_loss: 0.8192, test_loss: 0.9069, test_f1: 0.5619
 epoch: 53, train_loss: 0.8211, test_loss: 0.9109, test_f1: 0.5594
 epoch: 54, train_loss: 0.8129, test_loss: 0.9013, test_f1: 0.5637
 epoch: 55, train_loss: 0.8079, test_loss: 0.9220, test_f1: 0.5390
 epoch: 56, train_loss: 0.8031, test_loss: 0.9059, test_f1: 0.5512
 epoch: 57, train_loss: 0.7916, test_loss: 0.9153, test_f1: 0.5560
 epoch: 58, train_loss: 0.7968, test_loss: 0.9159, test_f1: 0.5571
 epoch: 59, train_loss: 0.8006, test_loss: 0.9179, test_f1: 0.5520
 epoch: 60, train_loss: 0.8024, test_loss: 0.9123, test_f1: 0.5545
 epoch: 61, train_loss: 0.8033, test_loss: 0.9274, test_f1: 0.5485
 epoch: 62, train_loss: 0.7996, test_loss: 0.9207, test_f1: 0.5645
 epoch: 63, train_loss: 0.7939, test_loss: 0.9281, test_f1: 0.5566
 epoch: 64, train_loss: 0.7933, test_loss: 0.9027, test_f1: 0.5677
 epoch: 65, train_loss: 0.7999, test_loss: 0.9046, test_f1: 0.5537
 epoch: 66, train_loss: 0.7973, test_loss: 0.9052, test_f1: 0.5500
 epoch: 67, train_loss: 0.7944, test_loss: 0.9126, test_f1: 0.5337
 epoch: 68, train_loss: 0.8026, test_loss: 0.9288, test_f1: 0.5387
 epoch: 69, train_loss: 0.7962, test_loss: 0.9183, test_f1: 0.5416
 epoch: 70, train_loss: 0.8003, test_loss: 0.9185, test_f1: 0.5621
 epoch: 71, train_loss: 0.7872, test_loss: 0.9230, test_f1: 0.5552
 epoch: 72, train_loss: 0.7933, test_loss: 0.9308, test_f1: 0.5506
 epoch: 73, train_loss: 0.7920, test_loss: 0.9247, test_f1: 0.5369
 epoch: 74, train_loss: 0.7924, test_loss: 0.9346, test_f1: 0.5241
 epoch: 75, train_loss: 0.7923, test_loss: 0.9201, test_f1: 0.5263
 epoch: 76, train_loss: 0.7811, test_loss: 0.9138, test_f1: 0.5498
 epoch: 77, train_loss: 0.7905, test_loss: 0.9342, test_f1: 0.5296
 epoch: 78, train_loss: 0.7816, test_loss: 0.9213, test_f1: 0.5450
 epoch: 79, train_loss: 0.7871, test_loss: 0.9152, test_f1: 0.5574
 epoch: 80, train_loss: 0.7805, test_loss: 0.9482, test_f1: 0.5303
 epoch: 81, train_loss: 0.7784, test_loss: 0.9434, test_f1: 0.5423
 epoch: 82, train_loss: 0.7754, test_loss: 0.9158, test_f1: 0.5555
 epoch: 83, train_loss: 0.7788, test_loss: 0.9103, test_f1: 0.5601
 epoch: 84, train_loss: 0.7709, test_loss: 0.9247, test_f1: 0.5536
 epoch: 85, train_loss: 0.7757, test_loss: 0.9361, test_f1: 0.5212
 epoch: 86, train_loss: 0.7671, test_loss: 0.9427, test_f1: 0.5550
 epoch: 87, train_loss: 0.7665, test_loss: 0.9243, test_f1: 0.5495
 epoch: 88, train_loss: 0.7697, test_loss: 0.9494, test_f1: 0.5450
 epoch: 89, train_loss: 0.7600, test_loss: 0.9230, test_f1: 0.5513
 epoch: 90, train_loss: 0.7778, test_loss: 0.9255, test_f1: 0.5548
 epoch: 91, train_loss: 0.7628, test_loss: 0.9236, test_f1: 0.5479
 epoch: 92, train_loss: 0.7760, test_loss: 0.9392, test_f1: 0.5475
 epoch: 93, train_loss: 0.7725, test_loss: 0.9185, test_f1: 0.5479
 epoch: 94, train_loss: 0.7661, test_loss: 0.9411, test_f1: 0.5507
 epoch: 95, train_loss: 0.7801, test_loss: 0.9335, test_f1: 0.5309
 epoch: 96, train_loss: 0.7563, test_loss: 0.9201, test_f1: 0.5383
 epoch: 97, train_loss: 0.7549, test_loss: 0.9190, test_f1: 0.5513
 epoch: 98, train_loss: 0.7604, test_loss: 0.9176, test_f1: 0.5463
 epoch: 99, train_loss: 0.7560, test_loss: 0.9150, test_f1: 0.5475
##################ITERATION #8 ****************************************
 epoch: 0, train_loss: 1.4373, test_loss: 1.4674, test_f1: 0.2270
 epoch: 1, train_loss: 1.1633, test_loss: 1.3011, test_f1: 0.2270
 epoch: 2, train_loss: 1.1091, test_loss: 1.2783, test_f1: 0.3207
 epoch: 3, train_loss: 1.0764, test_loss: 1.2732, test_f1: 0.3154
 epoch: 4, train_loss: 1.0609, test_loss: 1.2052, test_f1: 0.3713
 epoch: 5, train_loss: 1.0415, test_loss: 1.1234, test_f1: 0.4351
 epoch: 6, train_loss: 1.0342, test_loss: 1.0351, test_f1: 0.4522
 epoch: 7, train_loss: 1.0255, test_loss: 1.0162, test_f1: 0.4682
 epoch: 8, train_loss: 0.9952, test_loss: 1.0087, test_f1: 0.4544
 epoch: 9, train_loss: 1.0039, test_loss: 0.9816, test_f1: 0.4697
 epoch: 10, train_loss: 0.9927, test_loss: 0.9812, test_f1: 0.4647
 epoch: 11, train_loss: 0.9909, test_loss: 0.9913, test_f1: 0.4713
 epoch: 12, train_loss: 0.9830, test_loss: 0.9676, test_f1: 0.4695
 epoch: 13, train_loss: 0.9686, test_loss: 0.9786, test_f1: 0.4629
 epoch: 14, train_loss: 0.9558, test_loss: 0.9630, test_f1: 0.4804
 epoch: 15, train_loss: 0.9588, test_loss: 0.9327, test_f1: 0.4783
 epoch: 16, train_loss: 0.9565, test_loss: 0.9292, test_f1: 0.4971
 epoch: 17, train_loss: 0.9436, test_loss: 0.9636, test_f1: 0.4652
 epoch: 18, train_loss: 0.9362, test_loss: 0.9257, test_f1: 0.4920
 epoch: 19, train_loss: 0.9327, test_loss: 0.9341, test_f1: 0.4727
 epoch: 20, train_loss: 0.9287, test_loss: 0.9547, test_f1: 0.4694
 epoch: 21, train_loss: 0.9290, test_loss: 0.9117, test_f1: 0.4820
 epoch: 22, train_loss: 0.9204, test_loss: 0.9156, test_f1: 0.5067
 epoch: 23, train_loss: 0.9108, test_loss: 0.9226, test_f1: 0.4937
 epoch: 24, train_loss: 0.9084, test_loss: 0.9078, test_f1: 0.4772
 epoch: 25, train_loss: 0.9095, test_loss: 0.9205, test_f1: 0.4943
 epoch: 26, train_loss: 0.9085, test_loss: 0.9108, test_f1: 0.4831
 epoch: 27, train_loss: 0.9001, test_loss: 1.0126, test_f1: 0.4597
 epoch: 28, train_loss: 0.8965, test_loss: 0.8966, test_f1: 0.5093
 epoch: 29, train_loss: 0.9025, test_loss: 0.8896, test_f1: 0.5096
 epoch: 30, train_loss: 0.8873, test_loss: 0.9151, test_f1: 0.5046
 epoch: 31, train_loss: 0.8863, test_loss: 0.8938, test_f1: 0.5213
 epoch: 32, train_loss: 0.8889, test_loss: 0.9975, test_f1: 0.4717
 epoch: 33, train_loss: 0.8961, test_loss: 0.8951, test_f1: 0.4986
 epoch: 34, train_loss: 0.8982, test_loss: 0.9796, test_f1: 0.4576
 epoch: 35, train_loss: 0.8830, test_loss: 0.8840, test_f1: 0.5090
 epoch: 36, train_loss: 0.8808, test_loss: 0.8828, test_f1: 0.5055
 epoch: 37, train_loss: 0.8702, test_loss: 0.9146, test_f1: 0.5035
 epoch: 38, train_loss: 0.8723, test_loss: 0.8857, test_f1: 0.5135
 epoch: 39, train_loss: 0.8721, test_loss: 0.9386, test_f1: 0.4890
 epoch: 40, train_loss: 0.8622, test_loss: 0.9166, test_f1: 0.5182
 epoch: 41, train_loss: 0.8703, test_loss: 0.9388, test_f1: 0.4975
 epoch: 42, train_loss: 0.8550, test_loss: 0.9608, test_f1: 0.4773
 epoch: 43, train_loss: 0.8514, test_loss: 0.8734, test_f1: 0.5339
 epoch: 44, train_loss: 0.8479, test_loss: 0.8907, test_f1: 0.5139
 epoch: 45, train_loss: 0.8476, test_loss: 1.0464, test_f1: 0.4757
 epoch: 46, train_loss: 0.8591, test_loss: 0.8767, test_f1: 0.5096
 epoch: 47, train_loss: 0.8429, test_loss: 0.8897, test_f1: 0.5204
 epoch: 48, train_loss: 0.8404, test_loss: 0.8705, test_f1: 0.5191
 epoch: 49, train_loss: 0.8491, test_loss: 0.9943, test_f1: 0.4874
 epoch: 50, train_loss: 0.8469, test_loss: 0.8722, test_f1: 0.5180
 epoch: 51, train_loss: 0.8354, test_loss: 0.8590, test_f1: 0.5197
 epoch: 52, train_loss: 0.8303, test_loss: 0.8682, test_f1: 0.5233
 epoch: 53, train_loss: 0.8307, test_loss: 0.8845, test_f1: 0.5052
 epoch: 54, train_loss: 0.8152, test_loss: 0.8691, test_f1: 0.5207
 epoch: 55, train_loss: 0.8246, test_loss: 0.9555, test_f1: 0.5019
 epoch: 56, train_loss: 0.8178, test_loss: 0.8879, test_f1: 0.5120
 epoch: 57, train_loss: 0.8196, test_loss: 0.9634, test_f1: 0.4971
 epoch: 58, train_loss: 0.8117, test_loss: 0.8834, test_f1: 0.5068
 epoch: 59, train_loss: 0.8179, test_loss: 0.8759, test_f1: 0.5168
 epoch: 60, train_loss: 0.8150, test_loss: 0.8282, test_f1: 0.5386
 epoch: 61, train_loss: 0.8115, test_loss: 0.8894, test_f1: 0.5091
 epoch: 62, train_loss: 0.8096, test_loss: 0.8468, test_f1: 0.5315
 epoch: 63, train_loss: 0.8247, test_loss: 0.9150, test_f1: 0.5081
 epoch: 64, train_loss: 0.8189, test_loss: 0.8329, test_f1: 0.5332
 epoch: 65, train_loss: 0.8016, test_loss: 0.8724, test_f1: 0.5196
 epoch: 66, train_loss: 0.8045, test_loss: 0.9576, test_f1: 0.5059
 epoch: 67, train_loss: 0.7940, test_loss: 0.8909, test_f1: 0.5264
 epoch: 68, train_loss: 0.7939, test_loss: 0.9231, test_f1: 0.5099
 epoch: 69, train_loss: 0.7944, test_loss: 0.8510, test_f1: 0.5276
 epoch: 70, train_loss: 0.7940, test_loss: 0.8799, test_f1: 0.5173
 epoch: 71, train_loss: 0.8091, test_loss: 0.8525, test_f1: 0.5159
 epoch: 72, train_loss: 0.8007, test_loss: 0.8730, test_f1: 0.5160
 epoch: 73, train_loss: 0.8004, test_loss: 0.8498, test_f1: 0.5385
 epoch: 74, train_loss: 0.7910, test_loss: 0.9005, test_f1: 0.5278
 epoch: 75, train_loss: 0.7888, test_loss: 0.8716, test_f1: 0.5169
 epoch: 76, train_loss: 0.7938, test_loss: 0.9020, test_f1: 0.5244
 epoch: 77, train_loss: 0.7870, test_loss: 0.9367, test_f1: 0.5136
 epoch: 78, train_loss: 0.7920, test_loss: 0.8812, test_f1: 0.5088
 epoch: 79, train_loss: 0.7930, test_loss: 0.8674, test_f1: 0.5297
 epoch: 80, train_loss: 0.7868, test_loss: 0.8386, test_f1: 0.5522
 epoch: 81, train_loss: 0.7876, test_loss: 0.9232, test_f1: 0.5292
 epoch: 82, train_loss: 0.7847, test_loss: 0.9615, test_f1: 0.5106
 epoch: 83, train_loss: 0.7809, test_loss: 0.9580, test_f1: 0.5239
 epoch: 84, train_loss: 0.7852, test_loss: 0.8693, test_f1: 0.5371
 epoch: 85, train_loss: 0.7713, test_loss: 0.8839, test_f1: 0.5089
 epoch: 86, train_loss: 0.7805, test_loss: 0.8623, test_f1: 0.5257
 epoch: 87, train_loss: 0.7813, test_loss: 0.9179, test_f1: 0.5258
 epoch: 88, train_loss: 0.7874, test_loss: 0.8964, test_f1: 0.5172
 epoch: 89, train_loss: 0.7704, test_loss: 0.8248, test_f1: 0.5556
 epoch: 90, train_loss: 0.7763, test_loss: 0.9143, test_f1: 0.5162
 epoch: 91, train_loss: 0.7844, test_loss: 0.8588, test_f1: 0.5308
 epoch: 92, train_loss: 0.7866, test_loss: 0.8920, test_f1: 0.5315
 epoch: 93, train_loss: 0.7659, test_loss: 0.9466, test_f1: 0.5178
 epoch: 94, train_loss: 0.7820, test_loss: 0.8827, test_f1: 0.5281
 epoch: 95, train_loss: 0.7706, test_loss: 0.8979, test_f1: 0.5263
 epoch: 96, train_loss: 0.7811, test_loss: 0.9693, test_f1: 0.5101
 epoch: 97, train_loss: 0.7748, test_loss: 0.8501, test_f1: 0.5429
 epoch: 98, train_loss: 0.7714, test_loss: 0.8975, test_f1: 0.5228
 epoch: 99, train_loss: 0.7646, test_loss: 0.8885, test_f1: 0.5331
##################ITERATION #9 ****************************************
 epoch: 0, train_loss: 1.3835, test_loss: 1.3693, test_f1: 0.2270
 epoch: 1, train_loss: 1.1484, test_loss: 1.3818, test_f1: 0.2270
 epoch: 2, train_loss: 1.1089, test_loss: 1.1856, test_f1: 0.2801
 epoch: 3, train_loss: 1.0680, test_loss: 1.1557, test_f1: 0.3352
 epoch: 4, train_loss: 1.0467, test_loss: 1.1080, test_f1: 0.3486
 epoch: 5, train_loss: 1.0259, test_loss: 1.0466, test_f1: 0.4088
 epoch: 6, train_loss: 1.0185, test_loss: 1.0124, test_f1: 0.4504
 epoch: 7, train_loss: 1.0048, test_loss: 1.0078, test_f1: 0.4504
 epoch: 8, train_loss: 1.0008, test_loss: 1.0284, test_f1: 0.4502
 epoch: 9, train_loss: 0.9810, test_loss: 0.9955, test_f1: 0.4604
 epoch: 10, train_loss: 0.9734, test_loss: 1.0194, test_f1: 0.4647
 epoch: 11, train_loss: 0.9632, test_loss: 0.9935, test_f1: 0.4771
 epoch: 12, train_loss: 0.9661, test_loss: 0.9952, test_f1: 0.4801
 epoch: 13, train_loss: 0.9473, test_loss: 0.9945, test_f1: 0.4800
 epoch: 14, train_loss: 0.9488, test_loss: 0.9834, test_f1: 0.5002
 epoch: 15, train_loss: 0.9371, test_loss: 0.9785, test_f1: 0.4829
 epoch: 16, train_loss: 0.9426, test_loss: 0.9895, test_f1: 0.4964
 epoch: 17, train_loss: 0.9317, test_loss: 0.9842, test_f1: 0.4893
 epoch: 18, train_loss: 0.9306, test_loss: 0.9774, test_f1: 0.4907
 epoch: 19, train_loss: 0.9248, test_loss: 0.9924, test_f1: 0.4903
 epoch: 20, train_loss: 0.9277, test_loss: 0.9906, test_f1: 0.4880
 epoch: 21, train_loss: 0.9109, test_loss: 0.9710, test_f1: 0.5203
 epoch: 22, train_loss: 0.9147, test_loss: 0.9670, test_f1: 0.4924
 epoch: 23, train_loss: 0.9082, test_loss: 0.9867, test_f1: 0.4822
 epoch: 24, train_loss: 0.9003, test_loss: 0.9729, test_f1: 0.4958
 epoch: 25, train_loss: 0.9012, test_loss: 0.9695, test_f1: 0.5017
 epoch: 26, train_loss: 0.9053, test_loss: 0.9708, test_f1: 0.5037
 epoch: 27, train_loss: 0.8933, test_loss: 0.9526, test_f1: 0.5115
 epoch: 28, train_loss: 0.8957, test_loss: 0.9699, test_f1: 0.5130
 epoch: 29, train_loss: 0.8881, test_loss: 0.9747, test_f1: 0.5267
 epoch: 30, train_loss: 0.8865, test_loss: 0.9862, test_f1: 0.4990
 epoch: 31, train_loss: 0.8870, test_loss: 0.9595, test_f1: 0.4910
 epoch: 32, train_loss: 0.8853, test_loss: 0.9702, test_f1: 0.5001
 epoch: 33, train_loss: 0.8744, test_loss: 0.9383, test_f1: 0.5221
 epoch: 34, train_loss: 0.8739, test_loss: 0.9771, test_f1: 0.5066
 epoch: 35, train_loss: 0.8744, test_loss: 0.9797, test_f1: 0.4864
 epoch: 36, train_loss: 0.8683, test_loss: 0.9720, test_f1: 0.5049
 epoch: 37, train_loss: 0.8617, test_loss: 0.9685, test_f1: 0.5133
 epoch: 38, train_loss: 0.8662, test_loss: 0.9547, test_f1: 0.5071
 epoch: 39, train_loss: 0.8761, test_loss: 0.9568, test_f1: 0.5209
 epoch: 40, train_loss: 0.8599, test_loss: 0.9860, test_f1: 0.5032
 epoch: 41, train_loss: 0.8601, test_loss: 0.9491, test_f1: 0.5091
 epoch: 42, train_loss: 0.8562, test_loss: 0.9653, test_f1: 0.5070
 epoch: 43, train_loss: 0.8619, test_loss: 0.9580, test_f1: 0.5122
 epoch: 44, train_loss: 0.8522, test_loss: 0.9603, test_f1: 0.5070
 epoch: 45, train_loss: 0.8542, test_loss: 0.8917, test_f1: 0.5367
 epoch: 46, train_loss: 0.8393, test_loss: 0.9027, test_f1: 0.5227
 epoch: 47, train_loss: 0.8432, test_loss: 0.9053, test_f1: 0.5279
 epoch: 48, train_loss: 0.8400, test_loss: 0.9474, test_f1: 0.5214
 epoch: 49, train_loss: 0.8450, test_loss: 0.9609, test_f1: 0.5129
 epoch: 50, train_loss: 0.8407, test_loss: 0.9108, test_f1: 0.5123
 epoch: 51, train_loss: 0.8358, test_loss: 0.9147, test_f1: 0.5289
 epoch: 52, train_loss: 0.8232, test_loss: 0.9368, test_f1: 0.5314
 epoch: 53, train_loss: 0.8235, test_loss: 0.9408, test_f1: 0.5311
 epoch: 54, train_loss: 0.8190, test_loss: 0.9475, test_f1: 0.5167
 epoch: 55, train_loss: 0.8272, test_loss: 0.9010, test_f1: 0.5192
 epoch: 56, train_loss: 0.8238, test_loss: 0.8931, test_f1: 0.5337
 epoch: 57, train_loss: 0.8256, test_loss: 0.9285, test_f1: 0.5222
 epoch: 58, train_loss: 0.8321, test_loss: 0.9000, test_f1: 0.5315
 epoch: 59, train_loss: 0.8242, test_loss: 0.8982, test_f1: 0.5289
 epoch: 60, train_loss: 0.8180, test_loss: 0.9202, test_f1: 0.5283
 epoch: 61, train_loss: 0.8188, test_loss: 0.8844, test_f1: 0.5382
 epoch: 62, train_loss: 0.8208, test_loss: 0.9252, test_f1: 0.5293
 epoch: 63, train_loss: 0.8226, test_loss: 0.9337, test_f1: 0.5323
 epoch: 64, train_loss: 0.8111, test_loss: 0.9123, test_f1: 0.5327
 epoch: 65, train_loss: 0.8077, test_loss: 0.9030, test_f1: 0.5296
 epoch: 66, train_loss: 0.8028, test_loss: 0.9048, test_f1: 0.5275
 epoch: 67, train_loss: 0.8168, test_loss: 0.9140, test_f1: 0.5321
 epoch: 68, train_loss: 0.8118, test_loss: 0.8824, test_f1: 0.5364
 epoch: 69, train_loss: 0.8018, test_loss: 0.8825, test_f1: 0.5456
 epoch: 70, train_loss: 0.8224, test_loss: 0.9322, test_f1: 0.5242
 epoch: 71, train_loss: 0.8069, test_loss: 0.8995, test_f1: 0.5315
 epoch: 72, train_loss: 0.8025, test_loss: 0.9089, test_f1: 0.5145
 epoch: 73, train_loss: 0.8120, test_loss: 0.9062, test_f1: 0.5368
 epoch: 74, train_loss: 0.8129, test_loss: 0.8869, test_f1: 0.5420
 epoch: 75, train_loss: 0.7978, test_loss: 0.8841, test_f1: 0.5302
 epoch: 76, train_loss: 0.8018, test_loss: 0.8547, test_f1: 0.5445
 epoch: 77, train_loss: 0.8102, test_loss: 0.9324, test_f1: 0.5158
 epoch: 78, train_loss: 0.8159, test_loss: 0.8787, test_f1: 0.5544
 epoch: 79, train_loss: 0.7980, test_loss: 0.8911, test_f1: 0.5393
 epoch: 80, train_loss: 0.8019, test_loss: 0.8675, test_f1: 0.5313
 epoch: 81, train_loss: 0.8007, test_loss: 0.8759, test_f1: 0.5443
 epoch: 82, train_loss: 0.8019, test_loss: 0.8855, test_f1: 0.5296
 epoch: 83, train_loss: 0.7861, test_loss: 0.9075, test_f1: 0.5159
 epoch: 84, train_loss: 0.7922, test_loss: 0.8656, test_f1: 0.5540
 epoch: 85, train_loss: 0.7950, test_loss: 0.8834, test_f1: 0.5398
 epoch: 86, train_loss: 0.7999, test_loss: 0.9059, test_f1: 0.5471
 epoch: 87, train_loss: 0.7985, test_loss: 0.9081, test_f1: 0.5422
 epoch: 88, train_loss: 0.7860, test_loss: 0.9156, test_f1: 0.5299
 epoch: 89, train_loss: 0.7924, test_loss: 0.8472, test_f1: 0.5457
 epoch: 90, train_loss: 0.7951, test_loss: 0.8401, test_f1: 0.5618
 epoch: 91, train_loss: 0.7958, test_loss: 0.8845, test_f1: 0.5567
 epoch: 92, train_loss: 0.7892, test_loss: 0.8462, test_f1: 0.5650
 epoch: 93, train_loss: 0.7891, test_loss: 0.8893, test_f1: 0.5486
 epoch: 94, train_loss: 0.7851, test_loss: 0.8595, test_f1: 0.5533
 epoch: 95, train_loss: 0.7840, test_loss: 0.8778, test_f1: 0.5476
 epoch: 96, train_loss: 0.7851, test_loss: 0.8554, test_f1: 0.5539
 epoch: 97, train_loss: 0.7806, test_loss: 0.8913, test_f1: 0.5429
 epoch: 98, train_loss: 0.7766, test_loss: 0.9305, test_f1: 0.5363
 epoch: 99, train_loss: 0.7847, test_loss: 0.8879, test_f1: 0.5416

Training completed in 415.93 seconds
Best F1: 0.5849 at epoch 95
Mean F1 across iterations: 0.5597  0.0181
========================FINAL RESULTS================================
FEGIN weighted F1: 0.5849  0.0181
python main.py --data ltspice_examples --representation component_pin_net --model FEGIN --layers 4 --hiddens 16 --batch_size 256 --lr 0.001 --emb_size 128 --epochs 100 --save_appendix component_pin_net_L4_H16_BS256_LR0.001_E128 --no_val
-----



STDERR:
  File "main.py", line 370, in <module>
    main()
  File "main.py", line 254, in main
    dataset = dataset_class(
  File "/home/philip/projects/ltspice_examples_code_repo/Circuit-Completion-Using-GNNs/component_classification_with_link_prediction_head/evaluation/FEGIN/kernel/circuit_datasets.py", line 15, in __init__
    self.data, self.slices = torch.load(self.processed_paths[0])
  File "/home/philip/.local/lib/python3.8/site-packages/torch/serialization.py", line 1040, in load
    warnings.warn(
  File "/usr/lib/python3.8/warnings.py", line 109, in _showwarnmsg
    sw(msg.message, msg.category, msg.filename, msg.lineno,
  File "main.py", line 47, in warn_with_traceback
    traceback.print_stack(file=log)
/home/philip/projects/ltspice_examples_code_repo/Circuit-Completion-Using-GNNs/component_classification_with_link_prediction_head/evaluation/FEGIN/kernel/circuit_datasets.py:15: FutureWarning: You are using `torch.load` with `weights_only=False` (the current default value), which uses the default pickle module implicitly. It is possible to construct malicious pickle data which will execute arbitrary code during unpickling (See https://github.com/pytorch/pytorch/blob/main/SECURITY.md#untrusted-models for more details). In a future release, the default value for `weights_only` will be flipped to `True`. This limits the functions that could be executed during unpickling. Arbitrary objects will no longer be allowed to be loaded via this mode unless they are explicitly allowlisted by the user via `torch.serialization.add_safe_globals`. We recommend you start setting `weights_only=True` for any use case where you don't have full control of the loaded file. Please open an issue on GitHub for any issues related to this experimental feature.
  self.data, self.slices = torch.load(self.processed_paths[0])
