STDOUT:
Results will be saved in /home/philip/projects/ltspice_examples_code_repo/Circuit-Completion-Using-GNNs/component_classification_with_link_prediction_head/evaluation/FEGIN/results/model_FEGIN_dataset_ltspice_demos
Command line input: python main.py --data ltspice_demos --representation component_component --model FEGIN --layers 5 --hiddens 128 --batch_size 256 --lr 0.0001 --emb_size 250 --epochs 100 --save_appendix component_component_L5_H128_BS256_LR0.0001_E250 --no_val
 is saved.
-----
ltspice_demos - FEGIN
Using 5 layers, 128 hidden units, h = 2
Loading component_component representation dataset
ENTERED
Training FEGIN on component_component representation
Train: 1565, Test: 383
##################ITERATION #0 ****************************************
 epoch: 0, train_loss: 1.3924, test_loss: 1.3877, test_f1: 0.1365
 epoch: 1, train_loss: 1.3794, test_loss: 1.3830, test_f1: 0.1365
 epoch: 2, train_loss: 1.3716, test_loss: 1.3786, test_f1: 0.1365
 epoch: 3, train_loss: 1.3643, test_loss: 1.3738, test_f1: 0.1365
 epoch: 4, train_loss: 1.3567, test_loss: 1.3673, test_f1: 0.1365
 epoch: 5, train_loss: 1.3475, test_loss: 1.3602, test_f1: 0.1420
 epoch: 6, train_loss: 1.3382, test_loss: 1.3516, test_f1: 0.1593
 epoch: 7, train_loss: 1.3276, test_loss: 1.3425, test_f1: 0.2625
 epoch: 8, train_loss: 1.3155, test_loss: 1.3331, test_f1: 0.3223
 epoch: 9, train_loss: 1.3027, test_loss: 1.3232, test_f1: 0.3315
 epoch: 10, train_loss: 1.2889, test_loss: 1.3130, test_f1: 0.3398
 epoch: 11, train_loss: 1.2762, test_loss: 1.3033, test_f1: 0.3294
 epoch: 12, train_loss: 1.2592, test_loss: 1.2950, test_f1: 0.3359
 epoch: 13, train_loss: 1.2428, test_loss: 1.2855, test_f1: 0.3555
 epoch: 14, train_loss: 1.2268, test_loss: 1.2772, test_f1: 0.3691
 epoch: 15, train_loss: 1.2107, test_loss: 1.2712, test_f1: 0.3690
 epoch: 16, train_loss: 1.1987, test_loss: 1.2589, test_f1: 0.3753
 epoch: 17, train_loss: 1.1869, test_loss: 1.2520, test_f1: 0.3857
 epoch: 18, train_loss: 1.1716, test_loss: 1.2490, test_f1: 0.3971
 epoch: 19, train_loss: 1.1605, test_loss: 1.2439, test_f1: 0.4146
 epoch: 20, train_loss: 1.1528, test_loss: 1.2398, test_f1: 0.4119
 epoch: 21, train_loss: 1.1385, test_loss: 1.2401, test_f1: 0.4309
 epoch: 22, train_loss: 1.1260, test_loss: 1.2409, test_f1: 0.4249
 epoch: 23, train_loss: 1.1211, test_loss: 1.2314, test_f1: 0.4367
 epoch: 24, train_loss: 1.1089, test_loss: 1.2242, test_f1: 0.4511
 epoch: 25, train_loss: 1.1003, test_loss: 1.2198, test_f1: 0.4459
 epoch: 26, train_loss: 1.0874, test_loss: 1.2125, test_f1: 0.4487
 epoch: 27, train_loss: 1.0797, test_loss: 1.2113, test_f1: 0.4486
 epoch: 28, train_loss: 1.0683, test_loss: 1.2131, test_f1: 0.4209
 epoch: 29, train_loss: 1.0556, test_loss: 1.2144, test_f1: 0.4293
 epoch: 30, train_loss: 1.0481, test_loss: 1.2116, test_f1: 0.4208
 epoch: 31, train_loss: 1.0365, test_loss: 1.2163, test_f1: 0.4287
 epoch: 32, train_loss: 1.0272, test_loss: 1.2151, test_f1: 0.4308
 epoch: 33, train_loss: 1.0173, test_loss: 1.2105, test_f1: 0.4326
 epoch: 34, train_loss: 1.0126, test_loss: 1.2163, test_f1: 0.4296
 epoch: 35, train_loss: 0.9985, test_loss: 1.2276, test_f1: 0.4196
 epoch: 36, train_loss: 0.9854, test_loss: 1.2213, test_f1: 0.4349
 epoch: 37, train_loss: 0.9844, test_loss: 1.2393, test_f1: 0.4248
 epoch: 38, train_loss: 0.9777, test_loss: 1.2439, test_f1: 0.4332
 epoch: 39, train_loss: 0.9622, test_loss: 1.2405, test_f1: 0.4295
 epoch: 40, train_loss: 0.9561, test_loss: 1.2364, test_f1: 0.4374
 epoch: 41, train_loss: 0.9517, test_loss: 1.2313, test_f1: 0.4410
 epoch: 42, train_loss: 0.9440, test_loss: 1.2468, test_f1: 0.4358
 epoch: 43, train_loss: 0.9357, test_loss: 1.2676, test_f1: 0.4241
 epoch: 44, train_loss: 0.9308, test_loss: 1.3178, test_f1: 0.4249
 epoch: 45, train_loss: 0.9285, test_loss: 1.2976, test_f1: 0.4342
 epoch: 46, train_loss: 0.9162, test_loss: 1.2662, test_f1: 0.4283
 epoch: 47, train_loss: 0.9138, test_loss: 1.2594, test_f1: 0.4369
 epoch: 48, train_loss: 0.9032, test_loss: 1.2675, test_f1: 0.4442
 epoch: 49, train_loss: 0.8966, test_loss: 1.2924, test_f1: 0.4421
 epoch: 50, train_loss: 0.8876, test_loss: 1.3025, test_f1: 0.4686
 epoch: 51, train_loss: 0.8854, test_loss: 1.3026, test_f1: 0.4470
 epoch: 52, train_loss: 0.8740, test_loss: 1.3312, test_f1: 0.4500
 epoch: 53, train_loss: 0.8688, test_loss: 1.3212, test_f1: 0.4544
 epoch: 54, train_loss: 0.8758, test_loss: 1.3350, test_f1: 0.4542
 epoch: 55, train_loss: 0.8628, test_loss: 1.3350, test_f1: 0.4494
 epoch: 56, train_loss: 0.8534, test_loss: 1.3340, test_f1: 0.4566
 epoch: 57, train_loss: 0.8539, test_loss: 1.3289, test_f1: 0.4617
 epoch: 58, train_loss: 0.8499, test_loss: 1.3431, test_f1: 0.4626
 epoch: 59, train_loss: 0.8503, test_loss: 1.3622, test_f1: 0.4675
 epoch: 60, train_loss: 0.8463, test_loss: 1.3522, test_f1: 0.4720
 epoch: 61, train_loss: 0.8429, test_loss: 1.3575, test_f1: 0.4854
 epoch: 62, train_loss: 0.8390, test_loss: 1.3701, test_f1: 0.4735
 epoch: 63, train_loss: 0.8346, test_loss: 1.3869, test_f1: 0.4912
 epoch: 64, train_loss: 0.8396, test_loss: 1.3942, test_f1: 0.5017
 epoch: 65, train_loss: 0.8375, test_loss: 1.3762, test_f1: 0.5058
 epoch: 66, train_loss: 0.8303, test_loss: 1.3884, test_f1: 0.5079
 epoch: 67, train_loss: 0.8170, test_loss: 1.4382, test_f1: 0.4985
 epoch: 68, train_loss: 0.8165, test_loss: 1.4124, test_f1: 0.5027
 epoch: 69, train_loss: 0.8239, test_loss: 1.3776, test_f1: 0.5070
 epoch: 70, train_loss: 0.8223, test_loss: 1.3615, test_f1: 0.5170
 epoch: 71, train_loss: 0.8134, test_loss: 1.3795, test_f1: 0.5056
 epoch: 72, train_loss: 0.8084, test_loss: 1.4021, test_f1: 0.5144
 epoch: 73, train_loss: 0.8069, test_loss: 1.4147, test_f1: 0.5229
 epoch: 74, train_loss: 0.8007, test_loss: 1.3933, test_f1: 0.5157
 epoch: 75, train_loss: 0.8049, test_loss: 1.4265, test_f1: 0.5323
 epoch: 76, train_loss: 0.7928, test_loss: 1.4457, test_f1: 0.5207
 epoch: 77, train_loss: 0.7995, test_loss: 1.4777, test_f1: 0.5164
 epoch: 78, train_loss: 0.7949, test_loss: 1.4786, test_f1: 0.5145
 epoch: 79, train_loss: 0.7938, test_loss: 1.4608, test_f1: 0.5225
 epoch: 80, train_loss: 0.7819, test_loss: 1.4644, test_f1: 0.5332
 epoch: 81, train_loss: 0.7894, test_loss: 1.4631, test_f1: 0.5325
 epoch: 82, train_loss: 0.7806, test_loss: 1.4882, test_f1: 0.5310
 epoch: 83, train_loss: 0.7862, test_loss: 1.5341, test_f1: 0.5406
 epoch: 84, train_loss: 0.7740, test_loss: 1.5180, test_f1: 0.5369
 epoch: 85, train_loss: 0.7686, test_loss: 1.4986, test_f1: 0.5309
 epoch: 86, train_loss: 0.7723, test_loss: 1.5005, test_f1: 0.5225
 epoch: 87, train_loss: 0.7684, test_loss: 1.5120, test_f1: 0.5302
 epoch: 88, train_loss: 0.7591, test_loss: 1.5319, test_f1: 0.5250
 epoch: 89, train_loss: 0.7587, test_loss: 1.5357, test_f1: 0.5320
 epoch: 90, train_loss: 0.7589, test_loss: 1.5253, test_f1: 0.5419
 epoch: 91, train_loss: 0.7576, test_loss: 1.5452, test_f1: 0.5478
 epoch: 92, train_loss: 0.7503, test_loss: 1.5513, test_f1: 0.5445
 epoch: 93, train_loss: 0.7504, test_loss: 1.5762, test_f1: 0.5448
 epoch: 94, train_loss: 0.7404, test_loss: 1.5747, test_f1: 0.5499
 epoch: 95, train_loss: 0.7433, test_loss: 1.5326, test_f1: 0.5499
 epoch: 96, train_loss: 0.7481, test_loss: 1.5347, test_f1: 0.5452
 epoch: 97, train_loss: 0.7362, test_loss: 1.5310, test_f1: 0.5301
 epoch: 98, train_loss: 0.7458, test_loss: 1.5083, test_f1: 0.5372
 epoch: 99, train_loss: 0.7298, test_loss: 1.5229, test_f1: 0.5498
##################ITERATION #1 ****************************************
 epoch: 0, train_loss: 1.3436, test_loss: 1.3697, test_f1: 0.1836
 epoch: 1, train_loss: 1.3080, test_loss: 1.3593, test_f1: 0.1888
 epoch: 2, train_loss: 1.2902, test_loss: 1.3467, test_f1: 0.3354
 epoch: 3, train_loss: 1.2691, test_loss: 1.3308, test_f1: 0.2855
 epoch: 4, train_loss: 1.2545, test_loss: 1.3161, test_f1: 0.2709
 epoch: 5, train_loss: 1.2375, test_loss: 1.3029, test_f1: 0.2919
 epoch: 6, train_loss: 1.2227, test_loss: 1.2873, test_f1: 0.2847
 epoch: 7, train_loss: 1.2081, test_loss: 1.2764, test_f1: 0.2888
 epoch: 8, train_loss: 1.1981, test_loss: 1.2725, test_f1: 0.2935
 epoch: 9, train_loss: 1.1832, test_loss: 1.2789, test_f1: 0.3325
 epoch: 10, train_loss: 1.1694, test_loss: 1.2984, test_f1: 0.3834
 epoch: 11, train_loss: 1.1627, test_loss: 1.3489, test_f1: 0.4159
 epoch: 12, train_loss: 1.1495, test_loss: 1.3832, test_f1: 0.4091
 epoch: 13, train_loss: 1.1369, test_loss: 1.3967, test_f1: 0.4218
 epoch: 14, train_loss: 1.1281, test_loss: 1.4407, test_f1: 0.4251
 epoch: 15, train_loss: 1.1199, test_loss: 1.4820, test_f1: 0.4399
 epoch: 16, train_loss: 1.1077, test_loss: 1.4015, test_f1: 0.4337
 epoch: 17, train_loss: 1.0938, test_loss: 1.3989, test_f1: 0.4407
 epoch: 18, train_loss: 1.0895, test_loss: 1.4167, test_f1: 0.4459
 epoch: 19, train_loss: 1.0718, test_loss: 1.3856, test_f1: 0.4401
 epoch: 20, train_loss: 1.0648, test_loss: 1.5363, test_f1: 0.4642
 epoch: 21, train_loss: 1.0578, test_loss: 1.6064, test_f1: 0.4573
 epoch: 22, train_loss: 1.0475, test_loss: 1.4485, test_f1: 0.4531
 epoch: 23, train_loss: 1.0342, test_loss: 1.4822, test_f1: 0.4519
 epoch: 24, train_loss: 1.0244, test_loss: 1.4955, test_f1: 0.4392
 epoch: 25, train_loss: 1.0087, test_loss: 1.6412, test_f1: 0.4631
 epoch: 26, train_loss: 1.0040, test_loss: 1.4508, test_f1: 0.4538
 epoch: 27, train_loss: 0.9918, test_loss: 1.4673, test_f1: 0.4588
 epoch: 28, train_loss: 0.9874, test_loss: 1.4144, test_f1: 0.4683
 epoch: 29, train_loss: 0.9802, test_loss: 1.3887, test_f1: 0.4704
 epoch: 30, train_loss: 0.9746, test_loss: 1.4163, test_f1: 0.4817
 epoch: 31, train_loss: 0.9618, test_loss: 1.4719, test_f1: 0.4931
 epoch: 32, train_loss: 0.9546, test_loss: 1.5651, test_f1: 0.4906
 epoch: 33, train_loss: 0.9486, test_loss: 2.2123, test_f1: 0.5057
 epoch: 34, train_loss: 0.9380, test_loss: 2.8110, test_f1: 0.5113
 epoch: 35, train_loss: 0.9262, test_loss: 2.2988, test_f1: 0.5115
 epoch: 36, train_loss: 0.9211, test_loss: 2.5041, test_f1: 0.5077
 epoch: 37, train_loss: 0.9127, test_loss: 2.2273, test_f1: 0.5054
 epoch: 38, train_loss: 0.9138, test_loss: 1.8977, test_f1: 0.5047
 epoch: 39, train_loss: 0.9065, test_loss: 2.0342, test_f1: 0.5333
 epoch: 40, train_loss: 0.8889, test_loss: 1.9820, test_f1: 0.5542
 epoch: 41, train_loss: 0.8853, test_loss: 2.0008, test_f1: 0.5513
 epoch: 42, train_loss: 0.8763, test_loss: 2.0639, test_f1: 0.5388
 epoch: 43, train_loss: 0.8705, test_loss: 2.5498, test_f1: 0.5311
 epoch: 44, train_loss: 0.8672, test_loss: 2.8172, test_f1: 0.5304
 epoch: 45, train_loss: 0.8576, test_loss: 2.3044, test_f1: 0.5490
 epoch: 46, train_loss: 0.8503, test_loss: 2.0535, test_f1: 0.5548
 epoch: 47, train_loss: 0.8426, test_loss: 1.7037, test_f1: 0.5528
 epoch: 48, train_loss: 0.8317, test_loss: 1.8345, test_f1: 0.5385
 epoch: 49, train_loss: 0.8260, test_loss: 2.0271, test_f1: 0.5563
 epoch: 50, train_loss: 0.8298, test_loss: 2.1541, test_f1: 0.5627
 epoch: 51, train_loss: 0.8096, test_loss: 2.3876, test_f1: 0.5778
 epoch: 52, train_loss: 0.8030, test_loss: 2.5773, test_f1: 0.5518
 epoch: 53, train_loss: 0.8038, test_loss: 2.7096, test_f1: 0.5388
 epoch: 54, train_loss: 0.8075, test_loss: 3.3044, test_f1: 0.5419
 epoch: 55, train_loss: 0.7971, test_loss: 2.6301, test_f1: 0.5492
 epoch: 56, train_loss: 0.7900, test_loss: 3.0510, test_f1: 0.5493
 epoch: 57, train_loss: 0.7755, test_loss: 2.7386, test_f1: 0.5313
 epoch: 58, train_loss: 0.7828, test_loss: 2.3142, test_f1: 0.5308
 epoch: 59, train_loss: 0.7773, test_loss: 2.4986, test_f1: 0.5350
 epoch: 60, train_loss: 0.7645, test_loss: 2.6104, test_f1: 0.5333
 epoch: 61, train_loss: 0.7687, test_loss: 3.4161, test_f1: 0.5505
 epoch: 62, train_loss: 0.7620, test_loss: 2.6754, test_f1: 0.5396
 epoch: 63, train_loss: 0.7505, test_loss: 2.2052, test_f1: 0.5496
 epoch: 64, train_loss: 0.7504, test_loss: 2.3844, test_f1: 0.5219
 epoch: 65, train_loss: 0.7619, test_loss: 2.1779, test_f1: 0.5581
 epoch: 66, train_loss: 0.7476, test_loss: 2.1449, test_f1: 0.5525
 epoch: 67, train_loss: 0.7372, test_loss: 2.1258, test_f1: 0.5581
 epoch: 68, train_loss: 0.7473, test_loss: 2.2429, test_f1: 0.5366
 epoch: 69, train_loss: 0.7313, test_loss: 2.3898, test_f1: 0.5396
 epoch: 70, train_loss: 0.7298, test_loss: 2.6995, test_f1: 0.5476
 epoch: 71, train_loss: 0.7322, test_loss: 2.6959, test_f1: 0.5350
 epoch: 72, train_loss: 0.7275, test_loss: 2.8717, test_f1: 0.5338
 epoch: 73, train_loss: 0.7257, test_loss: 3.2035, test_f1: 0.5323
 epoch: 74, train_loss: 0.7175, test_loss: 3.7692, test_f1: 0.5431
 epoch: 75, train_loss: 0.7197, test_loss: 2.0410, test_f1: 0.5559
 epoch: 76, train_loss: 0.7096, test_loss: 2.4685, test_f1: 0.5520
 epoch: 77, train_loss: 0.7007, test_loss: 2.2231, test_f1: 0.5555
 epoch: 78, train_loss: 0.7072, test_loss: 2.2606, test_f1: 0.5464
 epoch: 79, train_loss: 0.7037, test_loss: 2.1240, test_f1: 0.5518
 epoch: 80, train_loss: 0.7031, test_loss: 2.5219, test_f1: 0.5448
 epoch: 81, train_loss: 0.6880, test_loss: 2.3571, test_f1: 0.5544
 epoch: 82, train_loss: 0.6886, test_loss: 2.8071, test_f1: 0.5332
 epoch: 83, train_loss: 0.6855, test_loss: 3.0020, test_f1: 0.5248
 epoch: 84, train_loss: 0.6836, test_loss: 3.3069, test_f1: 0.5270
 epoch: 85, train_loss: 0.6945, test_loss: 3.4124, test_f1: 0.5306
 epoch: 86, train_loss: 0.6823, test_loss: 3.5414, test_f1: 0.5474
 epoch: 87, train_loss: 0.6831, test_loss: 3.7031, test_f1: 0.5359
 epoch: 88, train_loss: 0.6717, test_loss: 2.8288, test_f1: 0.5518
 epoch: 89, train_loss: 0.6626, test_loss: 3.1858, test_f1: 0.5566
 epoch: 90, train_loss: 0.6669, test_loss: 3.2607, test_f1: 0.5625
 epoch: 91, train_loss: 0.6671, test_loss: 3.2707, test_f1: 0.5437
 epoch: 92, train_loss: 0.6584, test_loss: 3.3786, test_f1: 0.5465
 epoch: 93, train_loss: 0.6534, test_loss: 4.2715, test_f1: 0.5314
 epoch: 94, train_loss: 0.6547, test_loss: 3.7708, test_f1: 0.5305
 epoch: 95, train_loss: 0.6398, test_loss: 3.9837, test_f1: 0.5311
 epoch: 96, train_loss: 0.6438, test_loss: 3.4822, test_f1: 0.5509
 epoch: 97, train_loss: 0.6390, test_loss: 4.2090, test_f1: 0.5483
 epoch: 98, train_loss: 0.6443, test_loss: 3.7430, test_f1: 0.5606
 epoch: 99, train_loss: 0.6313, test_loss: 4.1008, test_f1: 0.5499
##################ITERATION #2 ****************************************
 epoch: 0, train_loss: 1.3221, test_loss: 1.3623, test_f1: 0.2014
 epoch: 1, train_loss: 1.2766, test_loss: 1.3525, test_f1: 0.1881
 epoch: 2, train_loss: 1.2501, test_loss: 1.3356, test_f1: 0.3306
 epoch: 3, train_loss: 1.2323, test_loss: 1.3166, test_f1: 0.3180
 epoch: 4, train_loss: 1.2169, test_loss: 1.2982, test_f1: 0.3317
 epoch: 5, train_loss: 1.1942, test_loss: 1.2840, test_f1: 0.3290
 epoch: 6, train_loss: 1.1779, test_loss: 1.2691, test_f1: 0.3471
 epoch: 7, train_loss: 1.1630, test_loss: 1.2541, test_f1: 0.3779
 epoch: 8, train_loss: 1.1460, test_loss: 1.2346, test_f1: 0.4457
 epoch: 9, train_loss: 1.1325, test_loss: 1.2195, test_f1: 0.4845
 epoch: 10, train_loss: 1.1166, test_loss: 1.2134, test_f1: 0.4603
 epoch: 11, train_loss: 1.1068, test_loss: 1.2093, test_f1: 0.4379
 epoch: 12, train_loss: 1.0909, test_loss: 1.2002, test_f1: 0.4491
 epoch: 13, train_loss: 1.0805, test_loss: 1.1989, test_f1: 0.4408
 epoch: 14, train_loss: 1.0725, test_loss: 1.1960, test_f1: 0.4381
 epoch: 15, train_loss: 1.0619, test_loss: 1.1849, test_f1: 0.4460
 epoch: 16, train_loss: 1.0445, test_loss: 1.1802, test_f1: 0.4550
 epoch: 17, train_loss: 1.0327, test_loss: 1.1746, test_f1: 0.4573
 epoch: 18, train_loss: 1.0319, test_loss: 1.1849, test_f1: 0.4403
 epoch: 19, train_loss: 1.0192, test_loss: 1.1821, test_f1: 0.4381
 epoch: 20, train_loss: 1.0089, test_loss: 1.1739, test_f1: 0.4323
 epoch: 21, train_loss: 0.9987, test_loss: 1.1717, test_f1: 0.4626
 epoch: 22, train_loss: 0.9839, test_loss: 1.1757, test_f1: 0.4478
 epoch: 23, train_loss: 0.9823, test_loss: 1.1777, test_f1: 0.4548
 epoch: 24, train_loss: 0.9681, test_loss: 1.1705, test_f1: 0.4693
 epoch: 25, train_loss: 0.9538, test_loss: 1.1761, test_f1: 0.4586
 epoch: 26, train_loss: 0.9515, test_loss: 1.1781, test_f1: 0.4477
 epoch: 27, train_loss: 0.9490, test_loss: 1.1727, test_f1: 0.4468
 epoch: 28, train_loss: 0.9249, test_loss: 1.1833, test_f1: 0.4564
 epoch: 29, train_loss: 0.9293, test_loss: 1.1843, test_f1: 0.4536
 epoch: 30, train_loss: 0.9209, test_loss: 1.1780, test_f1: 0.4583
 epoch: 31, train_loss: 0.9111, test_loss: 1.1816, test_f1: 0.4667
 epoch: 32, train_loss: 0.9181, test_loss: 1.1925, test_f1: 0.4633
 epoch: 33, train_loss: 0.8976, test_loss: 1.1894, test_f1: 0.4841
 epoch: 34, train_loss: 0.8888, test_loss: 1.2108, test_f1: 0.4909
 epoch: 35, train_loss: 0.8865, test_loss: 1.2183, test_f1: 0.5051
 epoch: 36, train_loss: 0.8718, test_loss: 1.2108, test_f1: 0.5068
 epoch: 37, train_loss: 0.8736, test_loss: 1.2127, test_f1: 0.5021
 epoch: 38, train_loss: 0.8603, test_loss: 1.2180, test_f1: 0.5052
 epoch: 39, train_loss: 0.8580, test_loss: 1.2488, test_f1: 0.4958
 epoch: 40, train_loss: 0.8570, test_loss: 1.2651, test_f1: 0.5054
 epoch: 41, train_loss: 0.8455, test_loss: 1.2423, test_f1: 0.5084
 epoch: 42, train_loss: 0.8442, test_loss: 1.2086, test_f1: 0.4921
 epoch: 43, train_loss: 0.8222, test_loss: 1.2005, test_f1: 0.5021
 epoch: 44, train_loss: 0.8327, test_loss: 1.2314, test_f1: 0.5040
 epoch: 45, train_loss: 0.8176, test_loss: 1.2521, test_f1: 0.5022
 epoch: 46, train_loss: 0.8110, test_loss: 1.2255, test_f1: 0.5089
 epoch: 47, train_loss: 0.8086, test_loss: 1.2423, test_f1: 0.5198
 epoch: 48, train_loss: 0.8019, test_loss: 1.2537, test_f1: 0.5232
 epoch: 49, train_loss: 0.7932, test_loss: 1.2725, test_f1: 0.5279
 epoch: 50, train_loss: 0.7830, test_loss: 1.2716, test_f1: 0.5161
 epoch: 51, train_loss: 0.7703, test_loss: 1.2833, test_f1: 0.5279
 epoch: 52, train_loss: 0.7704, test_loss: 1.2904, test_f1: 0.5423
 epoch: 53, train_loss: 0.7688, test_loss: 1.2863, test_f1: 0.5321
 epoch: 54, train_loss: 0.7533, test_loss: 1.2655, test_f1: 0.5234
 epoch: 55, train_loss: 0.7599, test_loss: 1.2222, test_f1: 0.5279
 epoch: 56, train_loss: 0.7647, test_loss: 1.2136, test_f1: 0.5231
 epoch: 57, train_loss: 0.7530, test_loss: 1.2008, test_f1: 0.5418
 epoch: 58, train_loss: 0.7511, test_loss: 1.1997, test_f1: 0.5447
 epoch: 59, train_loss: 0.7499, test_loss: 1.2307, test_f1: 0.5436
 epoch: 60, train_loss: 0.7459, test_loss: 1.2674, test_f1: 0.5419
 epoch: 61, train_loss: 0.7433, test_loss: 1.2489, test_f1: 0.5385
 epoch: 62, train_loss: 0.7352, test_loss: 1.2468, test_f1: 0.5375
 epoch: 63, train_loss: 0.7295, test_loss: 1.2407, test_f1: 0.5372
 epoch: 64, train_loss: 0.7274, test_loss: 1.2292, test_f1: 0.5266
 epoch: 65, train_loss: 0.7222, test_loss: 1.2428, test_f1: 0.5317
 epoch: 66, train_loss: 0.7331, test_loss: 1.2453, test_f1: 0.5220
 epoch: 67, train_loss: 0.7195, test_loss: 1.2489, test_f1: 0.5506
 epoch: 68, train_loss: 0.7224, test_loss: 1.2617, test_f1: 0.5375
 epoch: 69, train_loss: 0.7257, test_loss: 1.2715, test_f1: 0.5392
 epoch: 70, train_loss: 0.7033, test_loss: 1.2584, test_f1: 0.5365
 epoch: 71, train_loss: 0.7015, test_loss: 1.2678, test_f1: 0.5230
 epoch: 72, train_loss: 0.7060, test_loss: 1.2848, test_f1: 0.5388
 epoch: 73, train_loss: 0.7042, test_loss: 1.3041, test_f1: 0.5416
 epoch: 74, train_loss: 0.6980, test_loss: 1.3308, test_f1: 0.5224
 epoch: 75, train_loss: 0.6973, test_loss: 1.2990, test_f1: 0.5391
 epoch: 76, train_loss: 0.6998, test_loss: 1.3092, test_f1: 0.5500
 epoch: 77, train_loss: 0.6896, test_loss: 1.3043, test_f1: 0.5379
 epoch: 78, train_loss: 0.6919, test_loss: 1.3125, test_f1: 0.5347
 epoch: 79, train_loss: 0.6829, test_loss: 1.3765, test_f1: 0.5340
 epoch: 80, train_loss: 0.6827, test_loss: 1.4217, test_f1: 0.5145
 epoch: 81, train_loss: 0.6755, test_loss: 1.4573, test_f1: 0.5162
 epoch: 82, train_loss: 0.6858, test_loss: 1.4388, test_f1: 0.5139
 epoch: 83, train_loss: 0.6734, test_loss: 1.4021, test_f1: 0.5149
 epoch: 84, train_loss: 0.6680, test_loss: 1.4013, test_f1: 0.5134
 epoch: 85, train_loss: 0.6648, test_loss: 1.4073, test_f1: 0.5396
 epoch: 86, train_loss: 0.6675, test_loss: 1.4077, test_f1: 0.5342
 epoch: 87, train_loss: 0.6622, test_loss: 1.3995, test_f1: 0.5277
 epoch: 88, train_loss: 0.6735, test_loss: 1.4232, test_f1: 0.5170
 epoch: 89, train_loss: 0.6571, test_loss: 1.3985, test_f1: 0.5114
 epoch: 90, train_loss: 0.6641, test_loss: 1.4047, test_f1: 0.5152
 epoch: 91, train_loss: 0.6619, test_loss: 1.3902, test_f1: 0.5249
 epoch: 92, train_loss: 0.6588, test_loss: 1.4097, test_f1: 0.5071
 epoch: 93, train_loss: 0.6673, test_loss: 1.4057, test_f1: 0.5017
 epoch: 94, train_loss: 0.6499, test_loss: 1.4265, test_f1: 0.5015
 epoch: 95, train_loss: 0.6443, test_loss: 1.4255, test_f1: 0.5191
 epoch: 96, train_loss: 0.6422, test_loss: 1.4329, test_f1: 0.5331
 epoch: 97, train_loss: 0.6340, test_loss: 1.4006, test_f1: 0.5331
 epoch: 98, train_loss: 0.6288, test_loss: 1.3873, test_f1: 0.5433
 epoch: 99, train_loss: 0.6373, test_loss: 1.4109, test_f1: 0.5448
##################ITERATION #3 ****************************************
 epoch: 0, train_loss: 1.2788, test_loss: 1.3492, test_f1: 0.1368
 epoch: 1, train_loss: 1.2353, test_loss: 1.3341, test_f1: 0.3250
 epoch: 2, train_loss: 1.2161, test_loss: 1.3161, test_f1: 0.3052
 epoch: 3, train_loss: 1.2001, test_loss: 1.3037, test_f1: 0.3179
 epoch: 4, train_loss: 1.1827, test_loss: 1.2921, test_f1: 0.3359
 epoch: 5, train_loss: 1.1611, test_loss: 1.2803, test_f1: 0.3569
 epoch: 6, train_loss: 1.1547, test_loss: 1.2616, test_f1: 0.3550
 epoch: 7, train_loss: 1.1322, test_loss: 1.2594, test_f1: 0.3828
 epoch: 8, train_loss: 1.1257, test_loss: 1.2607, test_f1: 0.4068
 epoch: 9, train_loss: 1.1157, test_loss: 1.2543, test_f1: 0.4375
 epoch: 10, train_loss: 1.0983, test_loss: 1.2485, test_f1: 0.4514
 epoch: 11, train_loss: 1.0918, test_loss: 1.2431, test_f1: 0.4425
 epoch: 12, train_loss: 1.0797, test_loss: 1.2498, test_f1: 0.4554
 epoch: 13, train_loss: 1.0729, test_loss: 1.2454, test_f1: 0.4529
 epoch: 14, train_loss: 1.0631, test_loss: 1.2520, test_f1: 0.4668
 epoch: 15, train_loss: 1.0597, test_loss: 1.2462, test_f1: 0.4645
 epoch: 16, train_loss: 1.0422, test_loss: 1.2382, test_f1: 0.4578
 epoch: 17, train_loss: 1.0323, test_loss: 1.2387, test_f1: 0.4611
 epoch: 18, train_loss: 1.0183, test_loss: 1.2382, test_f1: 0.4678
 epoch: 19, train_loss: 1.0172, test_loss: 1.2523, test_f1: 0.4770
 epoch: 20, train_loss: 1.0089, test_loss: 1.2392, test_f1: 0.4776
 epoch: 21, train_loss: 0.9955, test_loss: 1.2575, test_f1: 0.4865
 epoch: 22, train_loss: 0.9734, test_loss: 1.2535, test_f1: 0.4789
 epoch: 23, train_loss: 0.9749, test_loss: 1.2467, test_f1: 0.4917
 epoch: 24, train_loss: 0.9649, test_loss: 1.2576, test_f1: 0.4992
 epoch: 25, train_loss: 0.9584, test_loss: 1.2310, test_f1: 0.4990
 epoch: 26, train_loss: 0.9505, test_loss: 1.2121, test_f1: 0.4986
 epoch: 27, train_loss: 0.9353, test_loss: 1.2311, test_f1: 0.4967
 epoch: 28, train_loss: 0.9359, test_loss: 1.2484, test_f1: 0.4945
 epoch: 29, train_loss: 0.9291, test_loss: 1.2403, test_f1: 0.5108
 epoch: 30, train_loss: 0.9172, test_loss: 1.2427, test_f1: 0.5244
 epoch: 31, train_loss: 0.9081, test_loss: 1.2542, test_f1: 0.5364
 epoch: 32, train_loss: 0.9013, test_loss: 1.2336, test_f1: 0.5179
 epoch: 33, train_loss: 0.8887, test_loss: 1.2850, test_f1: 0.5421
 epoch: 34, train_loss: 0.8767, test_loss: 1.2895, test_f1: 0.5202
 epoch: 35, train_loss: 0.8788, test_loss: 1.3072, test_f1: 0.5271
 epoch: 36, train_loss: 0.8622, test_loss: 1.3102, test_f1: 0.5488
 epoch: 37, train_loss: 0.8620, test_loss: 1.3068, test_f1: 0.5560
 epoch: 38, train_loss: 0.8488, test_loss: 1.3184, test_f1: 0.5548
 epoch: 39, train_loss: 0.8308, test_loss: 1.3475, test_f1: 0.5948
 epoch: 40, train_loss: 0.8331, test_loss: 1.3943, test_f1: 0.5811
 epoch: 41, train_loss: 0.8187, test_loss: 1.3729, test_f1: 0.5628
 epoch: 42, train_loss: 0.8197, test_loss: 1.3160, test_f1: 0.5713
 epoch: 43, train_loss: 0.8018, test_loss: 1.2992, test_f1: 0.5827
 epoch: 44, train_loss: 0.7951, test_loss: 1.2953, test_f1: 0.5780
 epoch: 45, train_loss: 0.7683, test_loss: 1.2534, test_f1: 0.5669
 epoch: 46, train_loss: 0.7740, test_loss: 1.2756, test_f1: 0.5621
 epoch: 47, train_loss: 0.7593, test_loss: 1.2896, test_f1: 0.5740
 epoch: 48, train_loss: 0.7691, test_loss: 1.3120, test_f1: 0.5603
 epoch: 49, train_loss: 0.7413, test_loss: 1.3042, test_f1: 0.5641
 epoch: 50, train_loss: 0.7488, test_loss: 1.2923, test_f1: 0.5784
 epoch: 51, train_loss: 0.7436, test_loss: 1.2872, test_f1: 0.5979
 epoch: 52, train_loss: 0.7268, test_loss: 1.2988, test_f1: 0.5912
 epoch: 53, train_loss: 0.7328, test_loss: 1.3097, test_f1: 0.5846
 epoch: 54, train_loss: 0.7218, test_loss: 1.3217, test_f1: 0.5977
 epoch: 55, train_loss: 0.7100, test_loss: 1.3753, test_f1: 0.5785
 epoch: 56, train_loss: 0.7206, test_loss: 1.3357, test_f1: 0.5949
 epoch: 57, train_loss: 0.7044, test_loss: 1.3397, test_f1: 0.6205
 epoch: 58, train_loss: 0.6932, test_loss: 1.3472, test_f1: 0.6194
 epoch: 59, train_loss: 0.7047, test_loss: 1.3057, test_f1: 0.6021
 epoch: 60, train_loss: 0.6900, test_loss: 1.2880, test_f1: 0.5964
 epoch: 61, train_loss: 0.6770, test_loss: 1.2931, test_f1: 0.5930
 epoch: 62, train_loss: 0.6821, test_loss: 1.2784, test_f1: 0.5874
 epoch: 63, train_loss: 0.6824, test_loss: 1.2944, test_f1: 0.6138
 epoch: 64, train_loss: 0.6701, test_loss: 1.3043, test_f1: 0.6163
 epoch: 65, train_loss: 0.6637, test_loss: 1.3018, test_f1: 0.6162
 epoch: 66, train_loss: 0.6726, test_loss: 1.3115, test_f1: 0.6053
 epoch: 67, train_loss: 0.6670, test_loss: 1.3154, test_f1: 0.6173
 epoch: 68, train_loss: 0.6637, test_loss: 1.2974, test_f1: 0.6030
 epoch: 69, train_loss: 0.6466, test_loss: 1.3163, test_f1: 0.5999
 epoch: 70, train_loss: 0.6466, test_loss: 1.3187, test_f1: 0.5894
 epoch: 71, train_loss: 0.6368, test_loss: 1.3167, test_f1: 0.6019
 epoch: 72, train_loss: 0.6436, test_loss: 1.3047, test_f1: 0.6065
 epoch: 73, train_loss: 0.6485, test_loss: 1.3362, test_f1: 0.6087
 epoch: 74, train_loss: 0.6266, test_loss: 1.3389, test_f1: 0.5887
 epoch: 75, train_loss: 0.6332, test_loss: 1.3500, test_f1: 0.5803
 epoch: 76, train_loss: 0.6288, test_loss: 1.3700, test_f1: 0.5986
 epoch: 77, train_loss: 0.6344, test_loss: 1.3606, test_f1: 0.6047
 epoch: 78, train_loss: 0.6198, test_loss: 1.3456, test_f1: 0.6156
 epoch: 79, train_loss: 0.6337, test_loss: 1.3582, test_f1: 0.6036
 epoch: 80, train_loss: 0.6184, test_loss: 1.3792, test_f1: 0.6044
 epoch: 81, train_loss: 0.6130, test_loss: 1.3848, test_f1: 0.5847
 epoch: 82, train_loss: 0.5984, test_loss: 1.3972, test_f1: 0.5933
 epoch: 83, train_loss: 0.6093, test_loss: 1.3991, test_f1: 0.5934
 epoch: 84, train_loss: 0.6148, test_loss: 1.3994, test_f1: 0.6028
 epoch: 85, train_loss: 0.5906, test_loss: 1.3873, test_f1: 0.6041
 epoch: 86, train_loss: 0.5945, test_loss: 1.3781, test_f1: 0.6076
 epoch: 87, train_loss: 0.5870, test_loss: 1.3581, test_f1: 0.6013
 epoch: 88, train_loss: 0.5882, test_loss: 1.3821, test_f1: 0.5952
 epoch: 89, train_loss: 0.5808, test_loss: 1.3950, test_f1: 0.5725
 epoch: 90, train_loss: 0.5752, test_loss: 1.4468, test_f1: 0.5723
 epoch: 91, train_loss: 0.5687, test_loss: 1.4586, test_f1: 0.5841
 epoch: 92, train_loss: 0.5858, test_loss: 1.4319, test_f1: 0.5830
 epoch: 93, train_loss: 0.5869, test_loss: 1.4506, test_f1: 0.5946
 epoch: 94, train_loss: 0.5699, test_loss: 1.4701, test_f1: 0.5903
 epoch: 95, train_loss: 0.5841, test_loss: 1.5301, test_f1: 0.5647
 epoch: 96, train_loss: 0.5605, test_loss: 1.5327, test_f1: 0.5849
 epoch: 97, train_loss: 0.5813, test_loss: 1.5043, test_f1: 0.5718
 epoch: 98, train_loss: 0.5619, test_loss: 1.4900, test_f1: 0.5785
 epoch: 99, train_loss: 0.5638, test_loss: 1.4769, test_f1: 0.5809
##################ITERATION #4 ****************************************
 epoch: 0, train_loss: 1.3060, test_loss: 1.3548, test_f1: 0.1365
 epoch: 1, train_loss: 1.2371, test_loss: 1.3415, test_f1: 0.1738
 epoch: 2, train_loss: 1.2166, test_loss: 1.3297, test_f1: 0.3283
 epoch: 3, train_loss: 1.1962, test_loss: 1.3243, test_f1: 0.3330
 epoch: 4, train_loss: 1.1821, test_loss: 1.3128, test_f1: 0.2950
 epoch: 5, train_loss: 1.1701, test_loss: 1.3026, test_f1: 0.3322
 epoch: 6, train_loss: 1.1562, test_loss: 1.2900, test_f1: 0.3402
 epoch: 7, train_loss: 1.1447, test_loss: 1.2777, test_f1: 0.3660
 epoch: 8, train_loss: 1.1375, test_loss: 1.2920, test_f1: 0.3692
 epoch: 9, train_loss: 1.1234, test_loss: 1.2725, test_f1: 0.3680
 epoch: 10, train_loss: 1.1155, test_loss: 1.2812, test_f1: 0.3715
 epoch: 11, train_loss: 1.1082, test_loss: 1.2736, test_f1: 0.3809
 epoch: 12, train_loss: 1.0928, test_loss: 1.2875, test_f1: 0.4061
 epoch: 13, train_loss: 1.0855, test_loss: 1.3166, test_f1: 0.4184
 epoch: 14, train_loss: 1.0802, test_loss: 1.3348, test_f1: 0.4272
 epoch: 15, train_loss: 1.0667, test_loss: 1.2950, test_f1: 0.4304
 epoch: 16, train_loss: 1.0534, test_loss: 1.2902, test_f1: 0.4409
 epoch: 17, train_loss: 1.0470, test_loss: 1.3052, test_f1: 0.4368
 epoch: 18, train_loss: 1.0360, test_loss: 1.3196, test_f1: 0.4424
 epoch: 19, train_loss: 1.0317, test_loss: 1.2810, test_f1: 0.4501
 epoch: 20, train_loss: 1.0211, test_loss: 1.2608, test_f1: 0.4370
 epoch: 21, train_loss: 0.9976, test_loss: 1.2858, test_f1: 0.4447
 epoch: 22, train_loss: 1.0074, test_loss: 1.2939, test_f1: 0.4543
 epoch: 23, train_loss: 0.9947, test_loss: 1.2554, test_f1: 0.4731
 epoch: 24, train_loss: 0.9776, test_loss: 1.2506, test_f1: 0.4973
 epoch: 25, train_loss: 0.9634, test_loss: 1.2284, test_f1: 0.4839
 epoch: 26, train_loss: 0.9641, test_loss: 1.2434, test_f1: 0.4839
 epoch: 27, train_loss: 0.9537, test_loss: 1.2643, test_f1: 0.4899
 epoch: 28, train_loss: 0.9466, test_loss: 1.2620, test_f1: 0.4910
 epoch: 29, train_loss: 0.9325, test_loss: 1.2865, test_f1: 0.4931
 epoch: 30, train_loss: 0.9319, test_loss: 1.3260, test_f1: 0.4981
 epoch: 31, train_loss: 0.9307, test_loss: 1.3717, test_f1: 0.5003
 epoch: 32, train_loss: 0.9091, test_loss: 1.3894, test_f1: 0.5011
 epoch: 33, train_loss: 0.9090, test_loss: 1.3681, test_f1: 0.5008
 epoch: 34, train_loss: 0.9099, test_loss: 1.4772, test_f1: 0.5047
 epoch: 35, train_loss: 0.9006, test_loss: 1.5070, test_f1: 0.5133
 epoch: 36, train_loss: 0.9127, test_loss: 1.4731, test_f1: 0.5062
 epoch: 37, train_loss: 0.8879, test_loss: 1.4248, test_f1: 0.5064
 epoch: 38, train_loss: 0.8864, test_loss: 1.3601, test_f1: 0.5318
 epoch: 39, train_loss: 0.8729, test_loss: 1.4711, test_f1: 0.5120
 epoch: 40, train_loss: 0.8734, test_loss: 1.5105, test_f1: 0.5266
 epoch: 41, train_loss: 0.8598, test_loss: 1.5896, test_f1: 0.5329
 epoch: 42, train_loss: 0.8576, test_loss: 1.6434, test_f1: 0.5259
 epoch: 43, train_loss: 0.8472, test_loss: 1.5974, test_f1: 0.5174
 epoch: 44, train_loss: 0.8329, test_loss: 1.6458, test_f1: 0.5331
 epoch: 45, train_loss: 0.8252, test_loss: 1.6433, test_f1: 0.5174
 epoch: 46, train_loss: 0.8200, test_loss: 1.6014, test_f1: 0.5213
 epoch: 47, train_loss: 0.8134, test_loss: 1.4504, test_f1: 0.5294
 epoch: 48, train_loss: 0.7966, test_loss: 1.4297, test_f1: 0.5248
 epoch: 49, train_loss: 0.7914, test_loss: 1.4921, test_f1: 0.5360
 epoch: 50, train_loss: 0.7917, test_loss: 1.5782, test_f1: 0.5302
 epoch: 51, train_loss: 0.7850, test_loss: 1.6298, test_f1: 0.5304
 epoch: 52, train_loss: 0.7916, test_loss: 1.6668, test_f1: 0.5284
 epoch: 53, train_loss: 0.7765, test_loss: 1.6815, test_f1: 0.5329
 epoch: 54, train_loss: 0.7671, test_loss: 1.6739, test_f1: 0.5352
 epoch: 55, train_loss: 0.7638, test_loss: 1.7134, test_f1: 0.5433
 epoch: 56, train_loss: 0.7591, test_loss: 1.7907, test_f1: 0.5328
 epoch: 57, train_loss: 0.7571, test_loss: 1.6749, test_f1: 0.5353
 epoch: 58, train_loss: 0.7749, test_loss: 1.7251, test_f1: 0.5377
 epoch: 59, train_loss: 0.7649, test_loss: 1.7346, test_f1: 0.5301
 epoch: 60, train_loss: 0.7438, test_loss: 1.7790, test_f1: 0.5324
 epoch: 61, train_loss: 0.7483, test_loss: 1.7884, test_f1: 0.5348
 epoch: 62, train_loss: 0.7388, test_loss: 1.8542, test_f1: 0.5378
 epoch: 63, train_loss: 0.7479, test_loss: 1.8253, test_f1: 0.5383
 epoch: 64, train_loss: 0.7379, test_loss: 1.8664, test_f1: 0.5468
 epoch: 65, train_loss: 0.7348, test_loss: 1.8817, test_f1: 0.5567
 epoch: 66, train_loss: 0.7426, test_loss: 1.8817, test_f1: 0.5513
 epoch: 67, train_loss: 0.7242, test_loss: 1.8608, test_f1: 0.5330
 epoch: 68, train_loss: 0.7307, test_loss: 1.8113, test_f1: 0.5303
 epoch: 69, train_loss: 0.7123, test_loss: 1.7709, test_f1: 0.5437
 epoch: 70, train_loss: 0.7169, test_loss: 1.8015, test_f1: 0.5303
 epoch: 71, train_loss: 0.7187, test_loss: 1.8639, test_f1: 0.5049
 epoch: 72, train_loss: 0.7069, test_loss: 1.9071, test_f1: 0.5243
 epoch: 73, train_loss: 0.7116, test_loss: 1.9710, test_f1: 0.5591
 epoch: 74, train_loss: 0.7103, test_loss: 1.9480, test_f1: 0.5486
 epoch: 75, train_loss: 0.7140, test_loss: 2.0389, test_f1: 0.5328
 epoch: 76, train_loss: 0.7127, test_loss: 2.0569, test_f1: 0.5408
 epoch: 77, train_loss: 0.7218, test_loss: 2.0534, test_f1: 0.5466
 epoch: 78, train_loss: 0.7080, test_loss: 2.0414, test_f1: 0.5391
 epoch: 79, train_loss: 0.6876, test_loss: 2.0905, test_f1: 0.5439
 epoch: 80, train_loss: 0.7053, test_loss: 1.9260, test_f1: 0.5318
 epoch: 81, train_loss: 0.6905, test_loss: 2.0016, test_f1: 0.5238
 epoch: 82, train_loss: 0.6967, test_loss: 2.1382, test_f1: 0.5233
 epoch: 83, train_loss: 0.6885, test_loss: 2.1798, test_f1: 0.5462
 epoch: 84, train_loss: 0.6820, test_loss: 2.0464, test_f1: 0.5524
 epoch: 85, train_loss: 0.6712, test_loss: 2.0401, test_f1: 0.5258
 epoch: 86, train_loss: 0.6743, test_loss: 2.0411, test_f1: 0.5310
 epoch: 87, train_loss: 0.6718, test_loss: 2.0390, test_f1: 0.5464
 epoch: 88, train_loss: 0.6647, test_loss: 2.0562, test_f1: 0.5485
 epoch: 89, train_loss: 0.6653, test_loss: 1.9674, test_f1: 0.5462
 epoch: 90, train_loss: 0.6741, test_loss: 2.1318, test_f1: 0.5460
 epoch: 91, train_loss: 0.6780, test_loss: 2.0896, test_f1: 0.5465
 epoch: 92, train_loss: 0.6780, test_loss: 1.9951, test_f1: 0.5412
 epoch: 93, train_loss: 0.6643, test_loss: 2.1027, test_f1: 0.5435
 epoch: 94, train_loss: 0.6497, test_loss: 2.2127, test_f1: 0.5493
 epoch: 95, train_loss: 0.6491, test_loss: 2.2708, test_f1: 0.5413
 epoch: 96, train_loss: 0.6424, test_loss: 2.2417, test_f1: 0.5625
 epoch: 97, train_loss: 0.6489, test_loss: 2.1989, test_f1: 0.5543
 epoch: 98, train_loss: 0.6328, test_loss: 2.3605, test_f1: 0.5469
 epoch: 99, train_loss: 0.6446, test_loss: 2.3373, test_f1: 0.5461
##################ITERATION #5 ****************************************
 epoch: 0, train_loss: 1.2899, test_loss: 1.3352, test_f1: 0.2212
 epoch: 1, train_loss: 1.2157, test_loss: 1.3247, test_f1: 0.2800
 epoch: 2, train_loss: 1.1848, test_loss: 1.3171, test_f1: 0.2816
 epoch: 3, train_loss: 1.1695, test_loss: 1.3074, test_f1: 0.2852
 epoch: 4, train_loss: 1.1557, test_loss: 1.2949, test_f1: 0.2935
 epoch: 5, train_loss: 1.1430, test_loss: 1.2987, test_f1: 0.3276
 epoch: 6, train_loss: 1.1212, test_loss: 1.3015, test_f1: 0.3406
 epoch: 7, train_loss: 1.1221, test_loss: 1.2940, test_f1: 0.4134
 epoch: 8, train_loss: 1.1021, test_loss: 1.2831, test_f1: 0.4348
 epoch: 9, train_loss: 1.0886, test_loss: 1.2825, test_f1: 0.4414
 epoch: 10, train_loss: 1.0722, test_loss: 1.2572, test_f1: 0.4472
 epoch: 11, train_loss: 1.0729, test_loss: 1.2353, test_f1: 0.4643
 epoch: 12, train_loss: 1.0613, test_loss: 1.2260, test_f1: 0.4832
 epoch: 13, train_loss: 1.0520, test_loss: 1.2200, test_f1: 0.4890
 epoch: 14, train_loss: 1.0354, test_loss: 1.2290, test_f1: 0.4715
 epoch: 15, train_loss: 1.0345, test_loss: 1.2384, test_f1: 0.4647
 epoch: 16, train_loss: 1.0261, test_loss: 1.2388, test_f1: 0.4645
 epoch: 17, train_loss: 1.0125, test_loss: 1.2424, test_f1: 0.4758
 epoch: 18, train_loss: 1.0048, test_loss: 1.2280, test_f1: 0.4718
 epoch: 19, train_loss: 1.0010, test_loss: 1.2305, test_f1: 0.4677
 epoch: 20, train_loss: 0.9913, test_loss: 1.2557, test_f1: 0.4916
 epoch: 21, train_loss: 0.9746, test_loss: 1.2648, test_f1: 0.4867
 epoch: 22, train_loss: 0.9607, test_loss: 1.2619, test_f1: 0.4752
 epoch: 23, train_loss: 0.9608, test_loss: 1.2576, test_f1: 0.4794
 epoch: 24, train_loss: 0.9609, test_loss: 1.2563, test_f1: 0.4698
 epoch: 25, train_loss: 0.9501, test_loss: 1.2737, test_f1: 0.4650
 epoch: 26, train_loss: 0.9491, test_loss: 1.2604, test_f1: 0.4549
 epoch: 27, train_loss: 0.9353, test_loss: 1.2486, test_f1: 0.4811
 epoch: 28, train_loss: 0.9217, test_loss: 1.2450, test_f1: 0.4684
 epoch: 29, train_loss: 0.9228, test_loss: 1.2544, test_f1: 0.4686
 epoch: 30, train_loss: 0.9134, test_loss: 1.2622, test_f1: 0.4768
 epoch: 31, train_loss: 0.9175, test_loss: 1.2835, test_f1: 0.4873
 epoch: 32, train_loss: 0.9020, test_loss: 1.2948, test_f1: 0.4953
 epoch: 33, train_loss: 0.8893, test_loss: 1.3030, test_f1: 0.5231
 epoch: 34, train_loss: 0.8855, test_loss: 1.3355, test_f1: 0.5196
 epoch: 35, train_loss: 0.8854, test_loss: 1.3699, test_f1: 0.5205
 epoch: 36, train_loss: 0.8765, test_loss: 1.3734, test_f1: 0.5078
 epoch: 37, train_loss: 0.8703, test_loss: 1.2971, test_f1: 0.5043
 epoch: 38, train_loss: 0.8673, test_loss: 1.2851, test_f1: 0.5196
 epoch: 39, train_loss: 0.8493, test_loss: 1.3924, test_f1: 0.5201
 epoch: 40, train_loss: 0.8547, test_loss: 1.4112, test_f1: 0.5161
 epoch: 41, train_loss: 0.8425, test_loss: 1.3824, test_f1: 0.5145
 epoch: 42, train_loss: 0.8308, test_loss: 1.4047, test_f1: 0.5124
 epoch: 43, train_loss: 0.8329, test_loss: 1.4703, test_f1: 0.5042
 epoch: 44, train_loss: 0.8188, test_loss: 1.5077, test_f1: 0.5211
 epoch: 45, train_loss: 0.8110, test_loss: 1.4704, test_f1: 0.5222
 epoch: 46, train_loss: 0.8109, test_loss: 1.4735, test_f1: 0.5247
 epoch: 47, train_loss: 0.7980, test_loss: 1.4021, test_f1: 0.5174
 epoch: 48, train_loss: 0.7983, test_loss: 1.4491, test_f1: 0.5213
 epoch: 49, train_loss: 0.7982, test_loss: 1.4976, test_f1: 0.5194
 epoch: 50, train_loss: 0.7852, test_loss: 1.4938, test_f1: 0.5134
 epoch: 51, train_loss: 0.7804, test_loss: 1.5046, test_f1: 0.5183
 epoch: 52, train_loss: 0.7684, test_loss: 1.5084, test_f1: 0.5156
 epoch: 53, train_loss: 0.7759, test_loss: 1.4942, test_f1: 0.5227
 epoch: 54, train_loss: 0.7780, test_loss: 1.5259, test_f1: 0.5202
 epoch: 55, train_loss: 0.7479, test_loss: 1.5984, test_f1: 0.5215
 epoch: 56, train_loss: 0.7728, test_loss: 1.6372, test_f1: 0.5416
 epoch: 57, train_loss: 0.7475, test_loss: 1.6343, test_f1: 0.5224
 epoch: 58, train_loss: 0.7553, test_loss: 1.5650, test_f1: 0.5236
 epoch: 59, train_loss: 0.7512, test_loss: 1.5687, test_f1: 0.5190
 epoch: 60, train_loss: 0.7449, test_loss: 1.5180, test_f1: 0.5277
 epoch: 61, train_loss: 0.7425, test_loss: 1.5379, test_f1: 0.5214
 epoch: 62, train_loss: 0.7452, test_loss: 1.5548, test_f1: 0.5331
 epoch: 63, train_loss: 0.7400, test_loss: 1.6022, test_f1: 0.5276
 epoch: 64, train_loss: 0.7348, test_loss: 1.5932, test_f1: 0.5305
 epoch: 65, train_loss: 0.7313, test_loss: 1.5769, test_f1: 0.5262
 epoch: 66, train_loss: 0.7248, test_loss: 1.6073, test_f1: 0.5261
 epoch: 67, train_loss: 0.7299, test_loss: 1.5938, test_f1: 0.5383
 epoch: 68, train_loss: 0.7222, test_loss: 1.6063, test_f1: 0.5378
 epoch: 69, train_loss: 0.7050, test_loss: 1.6226, test_f1: 0.5328
 epoch: 70, train_loss: 0.7165, test_loss: 1.6012, test_f1: 0.5396
 epoch: 71, train_loss: 0.7082, test_loss: 1.6095, test_f1: 0.5293
 epoch: 72, train_loss: 0.7016, test_loss: 1.5846, test_f1: 0.5370
 epoch: 73, train_loss: 0.6944, test_loss: 1.5936, test_f1: 0.5282
 epoch: 74, train_loss: 0.6951, test_loss: 1.5517, test_f1: 0.5193
 epoch: 75, train_loss: 0.6987, test_loss: 1.5663, test_f1: 0.5153
 epoch: 76, train_loss: 0.6885, test_loss: 1.5952, test_f1: 0.5157
 epoch: 77, train_loss: 0.6966, test_loss: 1.6979, test_f1: 0.5179
 epoch: 78, train_loss: 0.6871, test_loss: 1.7790, test_f1: 0.5174
 epoch: 79, train_loss: 0.6922, test_loss: 1.8178, test_f1: 0.5253
 epoch: 80, train_loss: 0.6748, test_loss: 1.8093, test_f1: 0.5139
 epoch: 81, train_loss: 0.6884, test_loss: 1.8135, test_f1: 0.5241
 epoch: 82, train_loss: 0.6712, test_loss: 1.7942, test_f1: 0.5190
 epoch: 83, train_loss: 0.6754, test_loss: 1.7698, test_f1: 0.5211
 epoch: 84, train_loss: 0.6814, test_loss: 1.7390, test_f1: 0.5305
 epoch: 85, train_loss: 0.6658, test_loss: 1.8793, test_f1: 0.5406
 epoch: 86, train_loss: 0.6806, test_loss: 1.8223, test_f1: 0.5436
 epoch: 87, train_loss: 0.6608, test_loss: 1.6404, test_f1: 0.5392
 epoch: 88, train_loss: 0.6734, test_loss: 1.5762, test_f1: 0.5638
 epoch: 89, train_loss: 0.6653, test_loss: 1.5833, test_f1: 0.5338
 epoch: 90, train_loss: 0.6524, test_loss: 1.5887, test_f1: 0.5449
 epoch: 91, train_loss: 0.6347, test_loss: 1.6239, test_f1: 0.5444
 epoch: 92, train_loss: 0.6602, test_loss: 1.6563, test_f1: 0.5303
 epoch: 93, train_loss: 0.6406, test_loss: 1.6818, test_f1: 0.5251
 epoch: 94, train_loss: 0.6433, test_loss: 1.6703, test_f1: 0.5220
 epoch: 95, train_loss: 0.6552, test_loss: 1.6841, test_f1: 0.5357
 epoch: 96, train_loss: 0.6466, test_loss: 1.7158, test_f1: 0.5283
 epoch: 97, train_loss: 0.6370, test_loss: 1.7670, test_f1: 0.5404
 epoch: 98, train_loss: 0.6384, test_loss: 1.8503, test_f1: 0.5370
 epoch: 99, train_loss: 0.6387, test_loss: 1.8079, test_f1: 0.5191
##################ITERATION #6 ****************************************
 epoch: 0, train_loss: 1.2832, test_loss: 1.3716, test_f1: 0.1365
 epoch: 1, train_loss: 1.2137, test_loss: 1.3451, test_f1: 0.3240
 epoch: 2, train_loss: 1.1843, test_loss: 1.3220, test_f1: 0.3369
 epoch: 3, train_loss: 1.1701, test_loss: 1.3063, test_f1: 0.3487
 epoch: 4, train_loss: 1.1463, test_loss: 1.2984, test_f1: 0.3422
 epoch: 5, train_loss: 1.1326, test_loss: 1.3063, test_f1: 0.3582
 epoch: 6, train_loss: 1.1144, test_loss: 1.3082, test_f1: 0.4071
 epoch: 7, train_loss: 1.1045, test_loss: 1.3079, test_f1: 0.4313
 epoch: 8, train_loss: 1.0866, test_loss: 1.3125, test_f1: 0.4589
 epoch: 9, train_loss: 1.0831, test_loss: 1.2924, test_f1: 0.4621
 epoch: 10, train_loss: 1.0770, test_loss: 1.2808, test_f1: 0.4550
 epoch: 11, train_loss: 1.0651, test_loss: 1.2758, test_f1: 0.4688
 epoch: 12, train_loss: 1.0511, test_loss: 1.2744, test_f1: 0.4595
 epoch: 13, train_loss: 1.0416, test_loss: 1.2592, test_f1: 0.4606
 epoch: 14, train_loss: 1.0378, test_loss: 1.2309, test_f1: 0.4707
 epoch: 15, train_loss: 1.0212, test_loss: 1.2267, test_f1: 0.4781
 epoch: 16, train_loss: 1.0135, test_loss: 1.2497, test_f1: 0.4903
 epoch: 17, train_loss: 1.0064, test_loss: 1.2541, test_f1: 0.4917
 epoch: 18, train_loss: 0.9947, test_loss: 1.2615, test_f1: 0.5010
 epoch: 19, train_loss: 0.9884, test_loss: 1.2749, test_f1: 0.4981
 epoch: 20, train_loss: 0.9747, test_loss: 1.2910, test_f1: 0.5021
 epoch: 21, train_loss: 0.9683, test_loss: 1.2770, test_f1: 0.4949
 epoch: 22, train_loss: 0.9710, test_loss: 1.2895, test_f1: 0.5031
 epoch: 23, train_loss: 0.9525, test_loss: 1.3118, test_f1: 0.5236
 epoch: 24, train_loss: 0.9403, test_loss: 1.3268, test_f1: 0.5366
 epoch: 25, train_loss: 0.9448, test_loss: 1.3102, test_f1: 0.5345
 epoch: 26, train_loss: 0.9244, test_loss: 1.3119, test_f1: 0.5522
 epoch: 27, train_loss: 0.9266, test_loss: 1.3153, test_f1: 0.5349
 epoch: 28, train_loss: 0.9062, test_loss: 1.3314, test_f1: 0.5228
 epoch: 29, train_loss: 0.9126, test_loss: 1.3206, test_f1: 0.5367
 epoch: 30, train_loss: 0.8915, test_loss: 1.3019, test_f1: 0.5366
 epoch: 31, train_loss: 0.8907, test_loss: 1.2966, test_f1: 0.5419
 epoch: 32, train_loss: 0.8796, test_loss: 1.2770, test_f1: 0.5526
 epoch: 33, train_loss: 0.8784, test_loss: 1.2575, test_f1: 0.5523
 epoch: 34, train_loss: 0.8649, test_loss: 1.2552, test_f1: 0.5579
 epoch: 35, train_loss: 0.8651, test_loss: 1.2595, test_f1: 0.5772
 epoch: 36, train_loss: 0.8494, test_loss: 1.2969, test_f1: 0.5503
 epoch: 37, train_loss: 0.8638, test_loss: 1.3305, test_f1: 0.5585
 epoch: 38, train_loss: 0.8557, test_loss: 1.3607, test_f1: 0.5676
 epoch: 39, train_loss: 0.8376, test_loss: 1.3144, test_f1: 0.5840
 epoch: 40, train_loss: 0.8379, test_loss: 1.3206, test_f1: 0.5555
 epoch: 41, train_loss: 0.8099, test_loss: 1.2930, test_f1: 0.5690
 epoch: 42, train_loss: 0.8189, test_loss: 1.2715, test_f1: 0.5751
 epoch: 43, train_loss: 0.8152, test_loss: 1.2556, test_f1: 0.5667
 epoch: 44, train_loss: 0.8003, test_loss: 1.2650, test_f1: 0.5500
 epoch: 45, train_loss: 0.7939, test_loss: 1.3016, test_f1: 0.5500
 epoch: 46, train_loss: 0.8019, test_loss: 1.3505, test_f1: 0.5684
 epoch: 47, train_loss: 0.7814, test_loss: 1.3901, test_f1: 0.5617
 epoch: 48, train_loss: 0.7750, test_loss: 1.3490, test_f1: 0.5845
 epoch: 49, train_loss: 0.7849, test_loss: 1.3081, test_f1: 0.5637
 epoch: 50, train_loss: 0.7813, test_loss: 1.3044, test_f1: 0.5683
 epoch: 51, train_loss: 0.7621, test_loss: 1.3258, test_f1: 0.5730
 epoch: 52, train_loss: 0.7536, test_loss: 1.3446, test_f1: 0.5933
 epoch: 53, train_loss: 0.7521, test_loss: 1.3662, test_f1: 0.5817
 epoch: 54, train_loss: 0.7358, test_loss: 1.4032, test_f1: 0.5677
 epoch: 55, train_loss: 0.7295, test_loss: 1.4083, test_f1: 0.5547
 epoch: 56, train_loss: 0.7317, test_loss: 1.4126, test_f1: 0.5744
 epoch: 57, train_loss: 0.7210, test_loss: 1.4115, test_f1: 0.5682
 epoch: 58, train_loss: 0.7323, test_loss: 1.4117, test_f1: 0.5599
 epoch: 59, train_loss: 0.7356, test_loss: 1.4071, test_f1: 0.5688
 epoch: 60, train_loss: 0.7130, test_loss: 1.4115, test_f1: 0.5589
 epoch: 61, train_loss: 0.7163, test_loss: 1.4169, test_f1: 0.5579
 epoch: 62, train_loss: 0.7110, test_loss: 1.3998, test_f1: 0.5856
 epoch: 63, train_loss: 0.7100, test_loss: 1.4221, test_f1: 0.5557
 epoch: 64, train_loss: 0.7122, test_loss: 1.4280, test_f1: 0.5514
 epoch: 65, train_loss: 0.7001, test_loss: 1.4777, test_f1: 0.5296
 epoch: 66, train_loss: 0.7019, test_loss: 1.5021, test_f1: 0.5372
 epoch: 67, train_loss: 0.6965, test_loss: 1.4730, test_f1: 0.5431
 epoch: 68, train_loss: 0.7114, test_loss: 1.4378, test_f1: 0.5545
 epoch: 69, train_loss: 0.6960, test_loss: 1.4636, test_f1: 0.5426
 epoch: 70, train_loss: 0.6949, test_loss: 1.4635, test_f1: 0.5462
 epoch: 71, train_loss: 0.6784, test_loss: 1.4591, test_f1: 0.5532
 epoch: 72, train_loss: 0.6902, test_loss: 1.4696, test_f1: 0.5427
 epoch: 73, train_loss: 0.6813, test_loss: 1.4956, test_f1: 0.5317
 epoch: 74, train_loss: 0.6817, test_loss: 1.4877, test_f1: 0.5253
 epoch: 75, train_loss: 0.6789, test_loss: 1.5176, test_f1: 0.5285
 epoch: 76, train_loss: 0.7040, test_loss: 1.5122, test_f1: 0.5397
 epoch: 77, train_loss: 0.6884, test_loss: 1.5385, test_f1: 0.5291
 epoch: 78, train_loss: 0.6734, test_loss: 1.5283, test_f1: 0.5311
 epoch: 79, train_loss: 0.6704, test_loss: 1.5467, test_f1: 0.5383
 epoch: 80, train_loss: 0.6640, test_loss: 1.5318, test_f1: 0.5322
 epoch: 81, train_loss: 0.6803, test_loss: 1.4892, test_f1: 0.5107
 epoch: 82, train_loss: 0.6541, test_loss: 1.4861, test_f1: 0.5273
 epoch: 83, train_loss: 0.6551, test_loss: 1.4446, test_f1: 0.5371
 epoch: 84, train_loss: 0.6621, test_loss: 1.4776, test_f1: 0.5494
 epoch: 85, train_loss: 0.6446, test_loss: 1.4901, test_f1: 0.5511
 epoch: 86, train_loss: 0.6432, test_loss: 1.5292, test_f1: 0.5516
 epoch: 87, train_loss: 0.6532, test_loss: 1.5076, test_f1: 0.5395
 epoch: 88, train_loss: 0.6514, test_loss: 1.4914, test_f1: 0.5442
 epoch: 89, train_loss: 0.6473, test_loss: 1.5004, test_f1: 0.5434
 epoch: 90, train_loss: 0.6308, test_loss: 1.5513, test_f1: 0.5434
 epoch: 91, train_loss: 0.6244, test_loss: 1.5946, test_f1: 0.5425
 epoch: 92, train_loss: 0.6300, test_loss: 1.5809, test_f1: 0.5545
 epoch: 93, train_loss: 0.6227, test_loss: 1.6453, test_f1: 0.5470
 epoch: 94, train_loss: 0.6239, test_loss: 1.6520, test_f1: 0.5272
 epoch: 95, train_loss: 0.6180, test_loss: 1.6289, test_f1: 0.5267
 epoch: 96, train_loss: 0.6388, test_loss: 1.6308, test_f1: 0.5184
 epoch: 97, train_loss: 0.6259, test_loss: 1.6110, test_f1: 0.5163
 epoch: 98, train_loss: 0.6252, test_loss: 1.6257, test_f1: 0.5132
 epoch: 99, train_loss: 0.6142, test_loss: 1.6279, test_f1: 0.5014
##################ITERATION #7 ****************************************
 epoch: 0, train_loss: 1.2938, test_loss: 1.3339, test_f1: 0.1689
 epoch: 1, train_loss: 1.2128, test_loss: 1.3218, test_f1: 0.3071
 epoch: 2, train_loss: 1.2021, test_loss: 1.3147, test_f1: 0.3494
 epoch: 3, train_loss: 1.1800, test_loss: 1.3078, test_f1: 0.3384
 epoch: 4, train_loss: 1.1614, test_loss: 1.2892, test_f1: 0.3320
 epoch: 5, train_loss: 1.1432, test_loss: 1.2707, test_f1: 0.3534
 epoch: 6, train_loss: 1.1335, test_loss: 1.2526, test_f1: 0.3662
 epoch: 7, train_loss: 1.1233, test_loss: 1.2364, test_f1: 0.3821
 epoch: 8, train_loss: 1.1094, test_loss: 1.2258, test_f1: 0.4115
 epoch: 9, train_loss: 1.0924, test_loss: 1.2072, test_f1: 0.4656
 epoch: 10, train_loss: 1.0896, test_loss: 1.1953, test_f1: 0.4836
 epoch: 11, train_loss: 1.0728, test_loss: 1.1907, test_f1: 0.4725
 epoch: 12, train_loss: 1.0680, test_loss: 1.1862, test_f1: 0.4754
 epoch: 13, train_loss: 1.0568, test_loss: 1.1858, test_f1: 0.4740
 epoch: 14, train_loss: 1.0406, test_loss: 1.1817, test_f1: 0.4869
 epoch: 15, train_loss: 1.0333, test_loss: 1.1812, test_f1: 0.4924
 epoch: 16, train_loss: 1.0146, test_loss: 1.1810, test_f1: 0.4929
 epoch: 17, train_loss: 1.0125, test_loss: 1.1830, test_f1: 0.5030
 epoch: 18, train_loss: 1.0027, test_loss: 1.1673, test_f1: 0.5111
 epoch: 19, train_loss: 1.0029, test_loss: 1.1725, test_f1: 0.5169
 epoch: 20, train_loss: 0.9898, test_loss: 1.1707, test_f1: 0.5244
 epoch: 21, train_loss: 0.9863, test_loss: 1.1635, test_f1: 0.5195
 epoch: 22, train_loss: 0.9574, test_loss: 1.1539, test_f1: 0.5043
 epoch: 23, train_loss: 0.9670, test_loss: 1.1440, test_f1: 0.5130
 epoch: 24, train_loss: 0.9548, test_loss: 1.1393, test_f1: 0.5227
 epoch: 25, train_loss: 0.9381, test_loss: 1.1349, test_f1: 0.5330
 epoch: 26, train_loss: 0.9320, test_loss: 1.1380, test_f1: 0.5190
 epoch: 27, train_loss: 0.9226, test_loss: 1.1346, test_f1: 0.5339
 epoch: 28, train_loss: 0.9158, test_loss: 1.1371, test_f1: 0.5438
 epoch: 29, train_loss: 0.9025, test_loss: 1.1342, test_f1: 0.5509
 epoch: 30, train_loss: 0.9018, test_loss: 1.1323, test_f1: 0.5472
 epoch: 31, train_loss: 0.8863, test_loss: 1.1375, test_f1: 0.5366
 epoch: 32, train_loss: 0.8763, test_loss: 1.1340, test_f1: 0.5165
 epoch: 33, train_loss: 0.8616, test_loss: 1.1245, test_f1: 0.5307
 epoch: 34, train_loss: 0.8601, test_loss: 1.1322, test_f1: 0.5361
 epoch: 35, train_loss: 0.8501, test_loss: 1.1328, test_f1: 0.5240
 epoch: 36, train_loss: 0.8504, test_loss: 1.1626, test_f1: 0.5174
 epoch: 37, train_loss: 0.8471, test_loss: 1.1596, test_f1: 0.5362
 epoch: 38, train_loss: 0.8388, test_loss: 1.1367, test_f1: 0.5430
 epoch: 39, train_loss: 0.8322, test_loss: 1.1499, test_f1: 0.5508
 epoch: 40, train_loss: 0.8298, test_loss: 1.1553, test_f1: 0.5448
 epoch: 41, train_loss: 0.8192, test_loss: 1.1794, test_f1: 0.5367
 epoch: 42, train_loss: 0.8114, test_loss: 1.2066, test_f1: 0.5398
 epoch: 43, train_loss: 0.7982, test_loss: 1.2241, test_f1: 0.5439
 epoch: 44, train_loss: 0.8025, test_loss: 1.2207, test_f1: 0.5585
 epoch: 45, train_loss: 0.7947, test_loss: 1.1884, test_f1: 0.5344
 epoch: 46, train_loss: 0.7935, test_loss: 1.1666, test_f1: 0.5393
 epoch: 47, train_loss: 0.7751, test_loss: 1.1968, test_f1: 0.5505
 epoch: 48, train_loss: 0.7695, test_loss: 1.1987, test_f1: 0.5462
 epoch: 49, train_loss: 0.7612, test_loss: 1.1674, test_f1: 0.5518
 epoch: 50, train_loss: 0.7676, test_loss: 1.1361, test_f1: 0.5660
 epoch: 51, train_loss: 0.7490, test_loss: 1.1666, test_f1: 0.5603
 epoch: 52, train_loss: 0.7499, test_loss: 1.2066, test_f1: 0.5568
 epoch: 53, train_loss: 0.7422, test_loss: 1.2179, test_f1: 0.5454
 epoch: 54, train_loss: 0.7319, test_loss: 1.2248, test_f1: 0.5419
 epoch: 55, train_loss: 0.7276, test_loss: 1.2293, test_f1: 0.5425
 epoch: 56, train_loss: 0.7249, test_loss: 1.1863, test_f1: 0.5466
 epoch: 57, train_loss: 0.7248, test_loss: 1.1770, test_f1: 0.5472
 epoch: 58, train_loss: 0.7205, test_loss: 1.1900, test_f1: 0.5438
 epoch: 59, train_loss: 0.7326, test_loss: 1.1793, test_f1: 0.5490
 epoch: 60, train_loss: 0.7103, test_loss: 1.2052, test_f1: 0.5492
 epoch: 61, train_loss: 0.7280, test_loss: 1.1953, test_f1: 0.5442
 epoch: 62, train_loss: 0.7057, test_loss: 1.1838, test_f1: 0.5436
 epoch: 63, train_loss: 0.7148, test_loss: 1.1964, test_f1: 0.5445
 epoch: 64, train_loss: 0.6955, test_loss: 1.2266, test_f1: 0.5444
 epoch: 65, train_loss: 0.6956, test_loss: 1.2225, test_f1: 0.5443
 epoch: 66, train_loss: 0.7065, test_loss: 1.2018, test_f1: 0.5442
 epoch: 67, train_loss: 0.6899, test_loss: 1.2027, test_f1: 0.5506
 epoch: 68, train_loss: 0.7076, test_loss: 1.2007, test_f1: 0.5305
 epoch: 69, train_loss: 0.6797, test_loss: 1.2120, test_f1: 0.5308
 epoch: 70, train_loss: 0.6889, test_loss: 1.1981, test_f1: 0.5451
 epoch: 71, train_loss: 0.6745, test_loss: 1.2124, test_f1: 0.5562
 epoch: 72, train_loss: 0.6849, test_loss: 1.2280, test_f1: 0.5592
 epoch: 73, train_loss: 0.6828, test_loss: 1.2402, test_f1: 0.5509
 epoch: 74, train_loss: 0.6815, test_loss: 1.2547, test_f1: 0.5487
 epoch: 75, train_loss: 0.6669, test_loss: 1.2989, test_f1: 0.5517
 epoch: 76, train_loss: 0.6632, test_loss: 1.2781, test_f1: 0.5463
 epoch: 77, train_loss: 0.6753, test_loss: 1.2752, test_f1: 0.5451
 epoch: 78, train_loss: 0.6662, test_loss: 1.2820, test_f1: 0.5409
 epoch: 79, train_loss: 0.6525, test_loss: 1.3003, test_f1: 0.5548
 epoch: 80, train_loss: 0.6563, test_loss: 1.3217, test_f1: 0.5417
 epoch: 81, train_loss: 0.6486, test_loss: 1.3031, test_f1: 0.5161
 epoch: 82, train_loss: 0.6495, test_loss: 1.2815, test_f1: 0.5333
 epoch: 83, train_loss: 0.6619, test_loss: 1.2759, test_f1: 0.5424
 epoch: 84, train_loss: 0.6396, test_loss: 1.3137, test_f1: 0.5680
 epoch: 85, train_loss: 0.6540, test_loss: 1.3043, test_f1: 0.5794
 epoch: 86, train_loss: 0.6539, test_loss: 1.3339, test_f1: 0.5675
 epoch: 87, train_loss: 0.6549, test_loss: 1.3508, test_f1: 0.5679
 epoch: 88, train_loss: 0.6356, test_loss: 1.3722, test_f1: 0.5597
 epoch: 89, train_loss: 0.6296, test_loss: 1.3928, test_f1: 0.5503
 epoch: 90, train_loss: 0.6361, test_loss: 1.3986, test_f1: 0.5401
 epoch: 91, train_loss: 0.6329, test_loss: 1.3809, test_f1: 0.5337
 epoch: 92, train_loss: 0.6261, test_loss: 1.3542, test_f1: 0.5503
 epoch: 93, train_loss: 0.6329, test_loss: 1.3697, test_f1: 0.5372
 epoch: 94, train_loss: 0.6354, test_loss: 1.3287, test_f1: 0.5425
 epoch: 95, train_loss: 0.6153, test_loss: 1.3754, test_f1: 0.5456
 epoch: 96, train_loss: 0.6149, test_loss: 1.3723, test_f1: 0.5447
 epoch: 97, train_loss: 0.6018, test_loss: 1.3558, test_f1: 0.5415
 epoch: 98, train_loss: 0.6059, test_loss: 1.3553, test_f1: 0.5501
 epoch: 99, train_loss: 0.6053, test_loss: 1.3529, test_f1: 0.5474
##################ITERATION #8 ****************************************
 epoch: 0, train_loss: 1.2759, test_loss: 1.3489, test_f1: 0.1365
 epoch: 1, train_loss: 1.1858, test_loss: 1.3261, test_f1: 0.1365
 epoch: 2, train_loss: 1.1657, test_loss: 1.3080, test_f1: 0.2310
 epoch: 3, train_loss: 1.1467, test_loss: 1.2837, test_f1: 0.3296
 epoch: 4, train_loss: 1.1365, test_loss: 1.2669, test_f1: 0.3638
 epoch: 5, train_loss: 1.1131, test_loss: 1.2643, test_f1: 0.3874
 epoch: 6, train_loss: 1.1217, test_loss: 1.2616, test_f1: 0.4309
 epoch: 7, train_loss: 1.1088, test_loss: 1.2519, test_f1: 0.4438
 epoch: 8, train_loss: 1.0866, test_loss: 1.2489, test_f1: 0.4773
 epoch: 9, train_loss: 1.0837, test_loss: 1.2333, test_f1: 0.4725
 epoch: 10, train_loss: 1.0639, test_loss: 1.2605, test_f1: 0.4629
 epoch: 11, train_loss: 1.0697, test_loss: 1.2503, test_f1: 0.4710
 epoch: 12, train_loss: 1.0539, test_loss: 1.2357, test_f1: 0.4717
 epoch: 13, train_loss: 1.0520, test_loss: 1.2393, test_f1: 0.4711
 epoch: 14, train_loss: 1.0455, test_loss: 1.2400, test_f1: 0.4795
 epoch: 15, train_loss: 1.0320, test_loss: 1.2639, test_f1: 0.4870
 epoch: 16, train_loss: 1.0302, test_loss: 1.2754, test_f1: 0.4953
 epoch: 17, train_loss: 1.0156, test_loss: 1.2849, test_f1: 0.5218
 epoch: 18, train_loss: 1.0036, test_loss: 1.2724, test_f1: 0.5395
 epoch: 19, train_loss: 1.0080, test_loss: 1.2485, test_f1: 0.5098
 epoch: 20, train_loss: 0.9910, test_loss: 1.2738, test_f1: 0.5106
 epoch: 21, train_loss: 0.9828, test_loss: 1.2936, test_f1: 0.5333
 epoch: 22, train_loss: 0.9694, test_loss: 1.2746, test_f1: 0.5182
 epoch: 23, train_loss: 0.9668, test_loss: 1.2680, test_f1: 0.5215
 epoch: 24, train_loss: 0.9601, test_loss: 1.2481, test_f1: 0.5223
 epoch: 25, train_loss: 0.9484, test_loss: 1.2242, test_f1: 0.5217
 epoch: 26, train_loss: 0.9444, test_loss: 1.2227, test_f1: 0.5299
 epoch: 27, train_loss: 0.9488, test_loss: 1.2089, test_f1: 0.5496
 epoch: 28, train_loss: 0.9215, test_loss: 1.2116, test_f1: 0.5525
 epoch: 29, train_loss: 0.9242, test_loss: 1.2208, test_f1: 0.5443
 epoch: 30, train_loss: 0.9209, test_loss: 1.2218, test_f1: 0.5393
 epoch: 31, train_loss: 0.9159, test_loss: 1.2133, test_f1: 0.5385
 epoch: 32, train_loss: 0.9067, test_loss: 1.2104, test_f1: 0.5507
 epoch: 33, train_loss: 0.9171, test_loss: 1.2410, test_f1: 0.5480
 epoch: 34, train_loss: 0.8919, test_loss: 1.3017, test_f1: 0.5354
 epoch: 35, train_loss: 0.8785, test_loss: 1.2896, test_f1: 0.5473
 epoch: 36, train_loss: 0.8836, test_loss: 1.2518, test_f1: 0.5485
 epoch: 37, train_loss: 0.8748, test_loss: 1.2015, test_f1: 0.5475
 epoch: 38, train_loss: 0.8667, test_loss: 1.2013, test_f1: 0.5608
 epoch: 39, train_loss: 0.8533, test_loss: 1.2003, test_f1: 0.5584
 epoch: 40, train_loss: 0.8453, test_loss: 1.1862, test_f1: 0.5563
 epoch: 41, train_loss: 0.8449, test_loss: 1.2058, test_f1: 0.5349
 epoch: 42, train_loss: 0.8451, test_loss: 1.3067, test_f1: 0.5378
 epoch: 43, train_loss: 0.8343, test_loss: 1.3391, test_f1: 0.5489
 epoch: 44, train_loss: 0.8124, test_loss: 1.2686, test_f1: 0.5515
 epoch: 45, train_loss: 0.8174, test_loss: 1.2715, test_f1: 0.5634
 epoch: 46, train_loss: 0.8155, test_loss: 1.3354, test_f1: 0.5672
 epoch: 47, train_loss: 0.7894, test_loss: 1.3613, test_f1: 0.5592
 epoch: 48, train_loss: 0.7952, test_loss: 1.3594, test_f1: 0.5681
 epoch: 49, train_loss: 0.7746, test_loss: 1.3076, test_f1: 0.5598
 epoch: 50, train_loss: 0.7950, test_loss: 1.2729, test_f1: 0.5737
 epoch: 51, train_loss: 0.7697, test_loss: 1.2723, test_f1: 0.5817
 epoch: 52, train_loss: 0.7637, test_loss: 1.3244, test_f1: 0.5611
 epoch: 53, train_loss: 0.7687, test_loss: 1.3319, test_f1: 0.5713
 epoch: 54, train_loss: 0.7528, test_loss: 1.3679, test_f1: 0.5516
 epoch: 55, train_loss: 0.7582, test_loss: 1.3811, test_f1: 0.5547
 epoch: 56, train_loss: 0.7583, test_loss: 1.3918, test_f1: 0.5666
 epoch: 57, train_loss: 0.7465, test_loss: 1.3539, test_f1: 0.5625
 epoch: 58, train_loss: 0.7444, test_loss: 1.3771, test_f1: 0.5431
 epoch: 59, train_loss: 0.7336, test_loss: 1.3952, test_f1: 0.5537
 epoch: 60, train_loss: 0.7584, test_loss: 1.3918, test_f1: 0.5647
 epoch: 61, train_loss: 0.7377, test_loss: 1.3513, test_f1: 0.5794
 epoch: 62, train_loss: 0.7371, test_loss: 1.3344, test_f1: 0.5679
 epoch: 63, train_loss: 0.7422, test_loss: 1.3476, test_f1: 0.5621
 epoch: 64, train_loss: 0.7216, test_loss: 1.3242, test_f1: 0.5634
 epoch: 65, train_loss: 0.7114, test_loss: 1.3511, test_f1: 0.5761
 epoch: 66, train_loss: 0.7226, test_loss: 1.3750, test_f1: 0.5464
 epoch: 67, train_loss: 0.7242, test_loss: 1.3851, test_f1: 0.5565
 epoch: 68, train_loss: 0.7284, test_loss: 1.3939, test_f1: 0.5492
 epoch: 69, train_loss: 0.7224, test_loss: 1.3965, test_f1: 0.5504
 epoch: 70, train_loss: 0.7135, test_loss: 1.4079, test_f1: 0.5812
 epoch: 71, train_loss: 0.7025, test_loss: 1.4024, test_f1: 0.5793
 epoch: 72, train_loss: 0.6988, test_loss: 1.4087, test_f1: 0.5764
 epoch: 73, train_loss: 0.6929, test_loss: 1.4277, test_f1: 0.5642
 epoch: 74, train_loss: 0.6910, test_loss: 1.3937, test_f1: 0.5735
 epoch: 75, train_loss: 0.7002, test_loss: 1.3855, test_f1: 0.5548
 epoch: 76, train_loss: 0.6672, test_loss: 1.3758, test_f1: 0.5646
 epoch: 77, train_loss: 0.6927, test_loss: 1.3398, test_f1: 0.5587
 epoch: 78, train_loss: 0.6873, test_loss: 1.3252, test_f1: 0.5528
 epoch: 79, train_loss: 0.6899, test_loss: 1.3802, test_f1: 0.5529
 epoch: 80, train_loss: 0.6847, test_loss: 1.3988, test_f1: 0.5595
 epoch: 81, train_loss: 0.6898, test_loss: 1.3954, test_f1: 0.5645
 epoch: 82, train_loss: 0.6653, test_loss: 1.4260, test_f1: 0.5678
 epoch: 83, train_loss: 0.6703, test_loss: 1.3895, test_f1: 0.5699
 epoch: 84, train_loss: 0.6821, test_loss: 1.3792, test_f1: 0.5696
 epoch: 85, train_loss: 0.6874, test_loss: 1.3599, test_f1: 0.5805
 epoch: 86, train_loss: 0.6511, test_loss: 1.3530, test_f1: 0.5870
 epoch: 87, train_loss: 0.6732, test_loss: 1.3400, test_f1: 0.6003
 epoch: 88, train_loss: 0.6449, test_loss: 1.3174, test_f1: 0.5976
 epoch: 89, train_loss: 0.6606, test_loss: 1.3018, test_f1: 0.5846
 epoch: 90, train_loss: 0.6556, test_loss: 1.3275, test_f1: 0.5815
 epoch: 91, train_loss: 0.6437, test_loss: 1.3773, test_f1: 0.5943
 epoch: 92, train_loss: 0.6532, test_loss: 1.3589, test_f1: 0.5938
 epoch: 93, train_loss: 0.6592, test_loss: 1.4096, test_f1: 0.6072
 epoch: 94, train_loss: 0.6520, test_loss: 1.3517, test_f1: 0.6069
 epoch: 95, train_loss: 0.6559, test_loss: 1.2846, test_f1: 0.6015
 epoch: 96, train_loss: 0.6389, test_loss: 1.2681, test_f1: 0.5863
 epoch: 97, train_loss: 0.6240, test_loss: 1.3293, test_f1: 0.5858
 epoch: 98, train_loss: 0.6412, test_loss: 1.3504, test_f1: 0.5768
 epoch: 99, train_loss: 0.6271, test_loss: 1.3981, test_f1: 0.5668
##################ITERATION #9 ****************************************
 epoch: 0, train_loss: 1.2665, test_loss: 1.3445, test_f1: 0.1673
 epoch: 1, train_loss: 1.1869, test_loss: 1.3297, test_f1: 0.2811
 epoch: 2, train_loss: 1.1693, test_loss: 1.3318, test_f1: 0.2799
 epoch: 3, train_loss: 1.1419, test_loss: 1.3289, test_f1: 0.3047
 epoch: 4, train_loss: 1.1237, test_loss: 1.3155, test_f1: 0.3327
 epoch: 5, train_loss: 1.1071, test_loss: 1.3110, test_f1: 0.4020
 epoch: 6, train_loss: 1.0855, test_loss: 1.2947, test_f1: 0.4049
 epoch: 7, train_loss: 1.0576, test_loss: 1.2666, test_f1: 0.4367
 epoch: 8, train_loss: 1.0578, test_loss: 1.2408, test_f1: 0.4428
 epoch: 9, train_loss: 1.0570, test_loss: 1.2294, test_f1: 0.4629
 epoch: 10, train_loss: 1.0328, test_loss: 1.2333, test_f1: 0.4491
 epoch: 11, train_loss: 1.0315, test_loss: 1.2345, test_f1: 0.4658
 epoch: 12, train_loss: 1.0201, test_loss: 1.2683, test_f1: 0.4798
 epoch: 13, train_loss: 1.0023, test_loss: 1.2816, test_f1: 0.4754
 epoch: 14, train_loss: 0.9866, test_loss: 1.2856, test_f1: 0.4890
 epoch: 15, train_loss: 0.9871, test_loss: 1.2854, test_f1: 0.5038
 epoch: 16, train_loss: 0.9748, test_loss: 1.2946, test_f1: 0.5007
 epoch: 17, train_loss: 0.9646, test_loss: 1.2664, test_f1: 0.5275
 epoch: 18, train_loss: 0.9671, test_loss: 1.2819, test_f1: 0.5033
 epoch: 19, train_loss: 0.9465, test_loss: 1.2936, test_f1: 0.5201
 epoch: 20, train_loss: 0.9464, test_loss: 1.2988, test_f1: 0.5215
 epoch: 21, train_loss: 0.9481, test_loss: 1.3057, test_f1: 0.5280
 epoch: 22, train_loss: 0.9241, test_loss: 1.3064, test_f1: 0.5117
 epoch: 23, train_loss: 0.9372, test_loss: 1.3293, test_f1: 0.5171
 epoch: 24, train_loss: 0.9147, test_loss: 1.3567, test_f1: 0.5300
 epoch: 25, train_loss: 0.9058, test_loss: 1.3082, test_f1: 0.5358
 epoch: 26, train_loss: 0.9024, test_loss: 1.3194, test_f1: 0.5570
 epoch: 27, train_loss: 0.8889, test_loss: 1.3325, test_f1: 0.5320
 epoch: 28, train_loss: 0.8861, test_loss: 1.3241, test_f1: 0.5408
 epoch: 29, train_loss: 0.8735, test_loss: 1.3541, test_f1: 0.5392
 epoch: 30, train_loss: 0.8716, test_loss: 1.3542, test_f1: 0.5472
 epoch: 31, train_loss: 0.8633, test_loss: 1.3816, test_f1: 0.5435
 epoch: 32, train_loss: 0.8572, test_loss: 1.2920, test_f1: 0.5458
 epoch: 33, train_loss: 0.8565, test_loss: 1.2245, test_f1: 0.5488
 epoch: 34, train_loss: 0.8421, test_loss: 1.2159, test_f1: 0.5452
 epoch: 35, train_loss: 0.8380, test_loss: 1.2052, test_f1: 0.5421
 epoch: 36, train_loss: 0.8328, test_loss: 1.2914, test_f1: 0.5338
 epoch: 37, train_loss: 0.8209, test_loss: 1.3072, test_f1: 0.5324
 epoch: 38, train_loss: 0.8047, test_loss: 1.3649, test_f1: 0.5412
 epoch: 39, train_loss: 0.8128, test_loss: 1.3561, test_f1: 0.5169
 epoch: 40, train_loss: 0.8295, test_loss: 1.4238, test_f1: 0.5131
 epoch: 41, train_loss: 0.7752, test_loss: 1.4123, test_f1: 0.5225
 epoch: 42, train_loss: 0.7914, test_loss: 1.3964, test_f1: 0.5359
 epoch: 43, train_loss: 0.7893, test_loss: 1.5045, test_f1: 0.5261
 epoch: 44, train_loss: 0.7719, test_loss: 1.6490, test_f1: 0.5108
 epoch: 45, train_loss: 0.7665, test_loss: 1.5967, test_f1: 0.5057
 epoch: 46, train_loss: 0.7599, test_loss: 1.6069, test_f1: 0.4982
 epoch: 47, train_loss: 0.7553, test_loss: 1.5228, test_f1: 0.5282
 epoch: 48, train_loss: 0.7645, test_loss: 1.4741, test_f1: 0.5525
 epoch: 49, train_loss: 0.7561, test_loss: 1.4645, test_f1: 0.5169
 epoch: 50, train_loss: 0.7483, test_loss: 1.4663, test_f1: 0.5084
 epoch: 51, train_loss: 0.7518, test_loss: 1.4324, test_f1: 0.5170
 epoch: 52, train_loss: 0.7262, test_loss: 1.5134, test_f1: 0.5228
 epoch: 53, train_loss: 0.7191, test_loss: 1.5738, test_f1: 0.5260
 epoch: 54, train_loss: 0.7230, test_loss: 1.5772, test_f1: 0.5210
 epoch: 55, train_loss: 0.7083, test_loss: 1.5348, test_f1: 0.5171
 epoch: 56, train_loss: 0.7221, test_loss: 1.4237, test_f1: 0.5280
 epoch: 57, train_loss: 0.6997, test_loss: 1.3629, test_f1: 0.5221
 epoch: 58, train_loss: 0.6891, test_loss: 1.4692, test_f1: 0.5168
 epoch: 59, train_loss: 0.6950, test_loss: 1.5017, test_f1: 0.5250
 epoch: 60, train_loss: 0.7025, test_loss: 1.5040, test_f1: 0.5248
 epoch: 61, train_loss: 0.6817, test_loss: 1.5782, test_f1: 0.5375
 epoch: 62, train_loss: 0.6823, test_loss: 1.4871, test_f1: 0.5330
 epoch: 63, train_loss: 0.6754, test_loss: 1.4608, test_f1: 0.5166
 epoch: 64, train_loss: 0.6845, test_loss: 1.5647, test_f1: 0.5226
 epoch: 65, train_loss: 0.6755, test_loss: 1.6191, test_f1: 0.5196
 epoch: 66, train_loss: 0.6723, test_loss: 1.6549, test_f1: 0.5121
 epoch: 67, train_loss: 0.6680, test_loss: 1.6472, test_f1: 0.5086
 epoch: 68, train_loss: 0.6705, test_loss: 1.6077, test_f1: 0.5113
 epoch: 69, train_loss: 0.6583, test_loss: 1.5138, test_f1: 0.5277
 epoch: 70, train_loss: 0.6646, test_loss: 1.5788, test_f1: 0.5309
 epoch: 71, train_loss: 0.6768, test_loss: 1.4412, test_f1: 0.5281
 epoch: 72, train_loss: 0.6643, test_loss: 1.4027, test_f1: 0.5232
 epoch: 73, train_loss: 0.6712, test_loss: 1.3649, test_f1: 0.5323
 epoch: 74, train_loss: 0.6531, test_loss: 1.3817, test_f1: 0.5295
 epoch: 75, train_loss: 0.6521, test_loss: 1.5240, test_f1: 0.5076
 epoch: 76, train_loss: 0.6333, test_loss: 1.6445, test_f1: 0.5051
 epoch: 77, train_loss: 0.6394, test_loss: 1.6659, test_f1: 0.4935
 epoch: 78, train_loss: 0.6409, test_loss: 1.6553, test_f1: 0.4935
 epoch: 79, train_loss: 0.6338, test_loss: 1.6313, test_f1: 0.5125
 epoch: 80, train_loss: 0.6283, test_loss: 1.5617, test_f1: 0.5212
 epoch: 81, train_loss: 0.6307, test_loss: 1.5071, test_f1: 0.5264
 epoch: 82, train_loss: 0.6306, test_loss: 1.6326, test_f1: 0.5236
 epoch: 83, train_loss: 0.6342, test_loss: 1.6463, test_f1: 0.5230
 epoch: 84, train_loss: 0.6309, test_loss: 1.6971, test_f1: 0.5311
 epoch: 85, train_loss: 0.6192, test_loss: 1.7196, test_f1: 0.5200
 epoch: 86, train_loss: 0.6191, test_loss: 1.6803, test_f1: 0.5230
 epoch: 87, train_loss: 0.6238, test_loss: 1.6008, test_f1: 0.5306
 epoch: 88, train_loss: 0.6247, test_loss: 1.5818, test_f1: 0.5255
 epoch: 89, train_loss: 0.6132, test_loss: 1.6180, test_f1: 0.5132
 epoch: 90, train_loss: 0.6063, test_loss: 1.6074, test_f1: 0.5115
 epoch: 91, train_loss: 0.6095, test_loss: 1.6385, test_f1: 0.5117
 epoch: 92, train_loss: 0.6086, test_loss: 1.5338, test_f1: 0.5191
 epoch: 93, train_loss: 0.6016, test_loss: 1.5545, test_f1: 0.5275
 epoch: 94, train_loss: 0.5967, test_loss: 1.5117, test_f1: 0.5153
 epoch: 95, train_loss: 0.5982, test_loss: 1.6073, test_f1: 0.5042
 epoch: 96, train_loss: 0.5953, test_loss: 1.7149, test_f1: 0.5049
 epoch: 97, train_loss: 0.5839, test_loss: 1.7350, test_f1: 0.4990
 epoch: 98, train_loss: 0.5904, test_loss: 1.6571, test_f1: 0.5094
 epoch: 99, train_loss: 0.5896, test_loss: 1.6444, test_f1: 0.5226

Training completed in 381.82 seconds
Best F1: 0.6205 at epoch 57
Mean F1 across iterations: 0.5762  0.0230
========================FINAL RESULTS================================
FEGIN weighted F1: 0.6205  0.0230
python main.py --data ltspice_demos --representation component_component --model FEGIN --layers 5 --hiddens 128 --batch_size 256 --lr 0.0001 --emb_size 250 --epochs 100 --save_appendix component_component_L5_H128_BS256_LR0.0001_E250 --no_val
-----



STDERR:
  File "main.py", line 370, in <module>
    main()
  File "main.py", line 254, in main
    dataset = dataset_class(
  File "/home/philip/projects/ltspice_examples_code_repo/Circuit-Completion-Using-GNNs/component_classification_with_link_prediction_head/evaluation/FEGIN/kernel/circuit_datasets.py", line 15, in __init__
    self.data, self.slices = torch.load(self.processed_paths[0])
  File "/home/philip/.local/lib/python3.8/site-packages/torch/serialization.py", line 1040, in load
    warnings.warn(
  File "/usr/lib/python3.8/warnings.py", line 109, in _showwarnmsg
    sw(msg.message, msg.category, msg.filename, msg.lineno,
  File "main.py", line 47, in warn_with_traceback
    traceback.print_stack(file=log)
/home/philip/projects/ltspice_examples_code_repo/Circuit-Completion-Using-GNNs/component_classification_with_link_prediction_head/evaluation/FEGIN/kernel/circuit_datasets.py:15: FutureWarning: You are using `torch.load` with `weights_only=False` (the current default value), which uses the default pickle module implicitly. It is possible to construct malicious pickle data which will execute arbitrary code during unpickling (See https://github.com/pytorch/pytorch/blob/main/SECURITY.md#untrusted-models for more details). In a future release, the default value for `weights_only` will be flipped to `True`. This limits the functions that could be executed during unpickling. Arbitrary objects will no longer be allowed to be loaded via this mode unless they are explicitly allowlisted by the user via `torch.serialization.add_safe_globals`. We recommend you start setting `weights_only=True` for any use case where you don't have full control of the loaded file. Please open an issue on GitHub for any issues related to this experimental feature.
  self.data, self.slices = torch.load(self.processed_paths[0])
