STDOUT:
Results will be saved in /home/philip/projects/ltspice_examples_code_repo/Circuit-Completion-Using-GNNs/component_classification_with_link_prediction_head/evaluation/FEGIN/results/model_FEGIN_dataset_ltspice_examples
Command line input: python main.py --data ltspice_examples --representation component_pin_net --model FEGIN --layers 2 --hiddens 64 --batch_size 32 --lr 0.001 --emb_size 128 --epochs 100 --save_appendix component_pin_net_L2_H64_BS32_LR0.001_E128 --no_val
 is saved.
-----
ltspice_examples - FEGIN
Using 2 layers, 64 hidden units, h = 2
Loading component_pin_net representation dataset
ENTERED
Training FEGIN on component_pin_net representation
Train: 3558, Test: 846
##################ITERATION #0 ****************************************
 epoch: 0, train_loss: 1.1714, test_loss: 1.0335, test_f1: 0.4664
 epoch: 1, train_loss: 0.9959, test_loss: 0.9785, test_f1: 0.4699
 epoch: 2, train_loss: 0.9715, test_loss: 0.9175, test_f1: 0.4913
 epoch: 3, train_loss: 0.9514, test_loss: 0.9315, test_f1: 0.4905
 epoch: 4, train_loss: 0.9263, test_loss: 0.9054, test_f1: 0.5514
 epoch: 5, train_loss: 0.9119, test_loss: 0.9374, test_f1: 0.4758
 epoch: 6, train_loss: 0.8986, test_loss: 0.8379, test_f1: 0.5345
 epoch: 7, train_loss: 0.8895, test_loss: 0.8491, test_f1: 0.5601
 epoch: 8, train_loss: 0.8623, test_loss: 0.8240, test_f1: 0.5476
 epoch: 9, train_loss: 0.8474, test_loss: 0.8468, test_f1: 0.5305
 epoch: 10, train_loss: 0.8303, test_loss: 0.8298, test_f1: 0.5546
 epoch: 11, train_loss: 0.8115, test_loss: 0.8185, test_f1: 0.6126
 epoch: 12, train_loss: 0.8101, test_loss: 0.8764, test_f1: 0.5602
 epoch: 13, train_loss: 0.8046, test_loss: 0.8734, test_f1: 0.6085
 epoch: 14, train_loss: 0.7866, test_loss: 0.8312, test_f1: 0.6037
 epoch: 15, train_loss: 0.7653, test_loss: 0.7795, test_f1: 0.6215
 epoch: 16, train_loss: 0.7607, test_loss: 0.8419, test_f1: 0.5714
 epoch: 17, train_loss: 0.7657, test_loss: 0.8370, test_f1: 0.5913
 epoch: 18, train_loss: 0.7422, test_loss: 0.8347, test_f1: 0.5550
 epoch: 19, train_loss: 0.7276, test_loss: 0.8606, test_f1: 0.5865
 epoch: 20, train_loss: 0.7237, test_loss: 0.7998, test_f1: 0.6143
 epoch: 21, train_loss: 0.7095, test_loss: 0.8271, test_f1: 0.5694
 epoch: 22, train_loss: 0.7004, test_loss: 0.8317, test_f1: 0.5968
 epoch: 23, train_loss: 0.6847, test_loss: 0.8324, test_f1: 0.6146
 epoch: 24, train_loss: 0.6879, test_loss: 0.8257, test_f1: 0.6015
 epoch: 25, train_loss: 0.6717, test_loss: 0.9005, test_f1: 0.5861
 epoch: 26, train_loss: 0.6765, test_loss: 0.8526, test_f1: 0.6215
 epoch: 27, train_loss: 0.6626, test_loss: 0.8228, test_f1: 0.6164
 epoch: 28, train_loss: 0.6787, test_loss: 0.8645, test_f1: 0.6089
 epoch: 29, train_loss: 0.6522, test_loss: 0.8500, test_f1: 0.6025
 epoch: 30, train_loss: 0.6539, test_loss: 0.8101, test_f1: 0.6387
 epoch: 31, train_loss: 0.6394, test_loss: 0.8733, test_f1: 0.6594
 epoch: 32, train_loss: 0.6241, test_loss: 0.8535, test_f1: 0.6265
 epoch: 33, train_loss: 0.6156, test_loss: 0.8797, test_f1: 0.6266
 epoch: 34, train_loss: 0.6198, test_loss: 0.8469, test_f1: 0.6617
 epoch: 35, train_loss: 0.6285, test_loss: 0.8195, test_f1: 0.6623
 epoch: 36, train_loss: 0.6036, test_loss: 0.8363, test_f1: 0.6499
 epoch: 37, train_loss: 0.6059, test_loss: 0.8350, test_f1: 0.6507
 epoch: 38, train_loss: 0.6004, test_loss: 0.8361, test_f1: 0.6778
 epoch: 39, train_loss: 0.5924, test_loss: 0.8760, test_f1: 0.6576
 epoch: 40, train_loss: 0.5824, test_loss: 0.8424, test_f1: 0.6748
 epoch: 41, train_loss: 0.5851, test_loss: 0.9545, test_f1: 0.6222
 epoch: 42, train_loss: 0.6044, test_loss: 0.9027, test_f1: 0.6712
 epoch: 43, train_loss: 0.5783, test_loss: 0.9003, test_f1: 0.6691
 epoch: 44, train_loss: 0.5931, test_loss: 0.8706, test_f1: 0.6848
 epoch: 45, train_loss: 0.5653, test_loss: 0.9050, test_f1: 0.6702
 epoch: 46, train_loss: 0.5755, test_loss: 0.8838, test_f1: 0.6456
 epoch: 47, train_loss: 0.5653, test_loss: 0.8779, test_f1: 0.6574
 epoch: 48, train_loss: 0.5512, test_loss: 0.9636, test_f1: 0.6395
 epoch: 49, train_loss: 0.5452, test_loss: 0.9399, test_f1: 0.6677
 epoch: 50, train_loss: 0.5476, test_loss: 0.9053, test_f1: 0.6547
 epoch: 51, train_loss: 0.5206, test_loss: 0.9171, test_f1: 0.6687
 epoch: 52, train_loss: 0.5080, test_loss: 0.9742, test_f1: 0.6666
 epoch: 53, train_loss: 0.4998, test_loss: 1.0122, test_f1: 0.6744
 epoch: 54, train_loss: 0.4883, test_loss: 0.9867, test_f1: 0.6694
 epoch: 55, train_loss: 0.4864, test_loss: 1.0363, test_f1: 0.6746
 epoch: 56, train_loss: 0.4855, test_loss: 0.9952, test_f1: 0.6742
 epoch: 57, train_loss: 0.4789, test_loss: 1.0142, test_f1: 0.6795
 epoch: 58, train_loss: 0.4828, test_loss: 1.0037, test_f1: 0.6675
 epoch: 59, train_loss: 0.4704, test_loss: 1.1267, test_f1: 0.6510
 epoch: 60, train_loss: 0.4815, test_loss: 1.0547, test_f1: 0.6594
 epoch: 61, train_loss: 0.4759, test_loss: 1.0374, test_f1: 0.6604
 epoch: 62, train_loss: 0.4680, test_loss: 1.0611, test_f1: 0.6571
 epoch: 63, train_loss: 0.4746, test_loss: 1.0649, test_f1: 0.6507
 epoch: 64, train_loss: 0.4564, test_loss: 1.0971, test_f1: 0.6589
 epoch: 65, train_loss: 0.4554, test_loss: 1.0752, test_f1: 0.6689
 epoch: 66, train_loss: 0.4590, test_loss: 1.0172, test_f1: 0.6848
 epoch: 67, train_loss: 0.4539, test_loss: 1.0677, test_f1: 0.6805
 epoch: 68, train_loss: 0.4413, test_loss: 1.0782, test_f1: 0.6594
 epoch: 69, train_loss: 0.4473, test_loss: 1.0952, test_f1: 0.6656
 epoch: 70, train_loss: 0.4313, test_loss: 1.1129, test_f1: 0.6786
 epoch: 71, train_loss: 0.4573, test_loss: 1.1042, test_f1: 0.6628
 epoch: 72, train_loss: 0.4410, test_loss: 1.1355, test_f1: 0.6629
 epoch: 73, train_loss: 0.4416, test_loss: 1.1975, test_f1: 0.6506
 epoch: 74, train_loss: 0.4321, test_loss: 1.1188, test_f1: 0.6508
 epoch: 75, train_loss: 0.4333, test_loss: 1.1014, test_f1: 0.6533
 epoch: 76, train_loss: 0.4318, test_loss: 1.0869, test_f1: 0.6674
 epoch: 77, train_loss: 0.4169, test_loss: 1.1911, test_f1: 0.6664
 epoch: 78, train_loss: 0.4254, test_loss: 1.2029, test_f1: 0.6445
 epoch: 79, train_loss: 0.4368, test_loss: 1.2040, test_f1: 0.6532
 epoch: 80, train_loss: 0.4064, test_loss: 1.2471, test_f1: 0.6733
 epoch: 81, train_loss: 0.4163, test_loss: 1.2320, test_f1: 0.6571
 epoch: 82, train_loss: 0.4107, test_loss: 1.3131, test_f1: 0.6444
 epoch: 83, train_loss: 0.4014, test_loss: 1.2975, test_f1: 0.6528
 epoch: 84, train_loss: 0.4146, test_loss: 1.2516, test_f1: 0.6444
 epoch: 85, train_loss: 0.4067, test_loss: 1.2955, test_f1: 0.6483
 epoch: 86, train_loss: 0.4069, test_loss: 1.2766, test_f1: 0.6560
 epoch: 87, train_loss: 0.4060, test_loss: 1.2962, test_f1: 0.6607
 epoch: 88, train_loss: 0.4089, test_loss: 1.3167, test_f1: 0.6490
 epoch: 89, train_loss: 0.4066, test_loss: 1.2565, test_f1: 0.6644
 epoch: 90, train_loss: 0.4013, test_loss: 1.2753, test_f1: 0.6548
 epoch: 91, train_loss: 0.3949, test_loss: 1.3697, test_f1: 0.6405
 epoch: 92, train_loss: 0.4050, test_loss: 1.3078, test_f1: 0.6375
 epoch: 93, train_loss: 0.4104, test_loss: 1.2639, test_f1: 0.6601
 epoch: 94, train_loss: 0.3913, test_loss: 1.3226, test_f1: 0.6515
 epoch: 95, train_loss: 0.3852, test_loss: 1.3102, test_f1: 0.6490
 epoch: 96, train_loss: 0.3909, test_loss: 1.2786, test_f1: 0.6417
 epoch: 97, train_loss: 0.3809, test_loss: 1.3146, test_f1: 0.6556
 epoch: 98, train_loss: 0.4169, test_loss: 1.2995, test_f1: 0.6550
 epoch: 99, train_loss: 0.3950, test_loss: 1.3873, test_f1: 0.6526
##################ITERATION #1 ****************************************
 epoch: 0, train_loss: 1.0820, test_loss: 1.0562, test_f1: 0.4453
 epoch: 1, train_loss: 0.9696, test_loss: 0.9552, test_f1: 0.5100
 epoch: 2, train_loss: 0.9367, test_loss: 0.9900, test_f1: 0.5119
 epoch: 3, train_loss: 0.9131, test_loss: 0.9494, test_f1: 0.5199
 epoch: 4, train_loss: 0.8901, test_loss: 0.8827, test_f1: 0.5691
 epoch: 5, train_loss: 0.8759, test_loss: 0.8293, test_f1: 0.5671
 epoch: 6, train_loss: 0.8419, test_loss: 0.8346, test_f1: 0.5422
 epoch: 7, train_loss: 0.8504, test_loss: 0.8231, test_f1: 0.5575
 epoch: 8, train_loss: 0.8243, test_loss: 0.8113, test_f1: 0.5861
 epoch: 9, train_loss: 0.8114, test_loss: 0.8065, test_f1: 0.5867
 epoch: 10, train_loss: 0.8022, test_loss: 0.8042, test_f1: 0.5724
 epoch: 11, train_loss: 0.7773, test_loss: 0.8124, test_f1: 0.6006
 epoch: 12, train_loss: 0.7696, test_loss: 0.8192, test_f1: 0.6500
 epoch: 13, train_loss: 0.7650, test_loss: 0.7261, test_f1: 0.6479
 epoch: 14, train_loss: 0.7603, test_loss: 0.7256, test_f1: 0.6517
 epoch: 15, train_loss: 0.7515, test_loss: 0.7579, test_f1: 0.5986
 epoch: 16, train_loss: 0.7186, test_loss: 0.6951, test_f1: 0.6952
 epoch: 17, train_loss: 0.7191, test_loss: 0.7257, test_f1: 0.6641
 epoch: 18, train_loss: 0.7023, test_loss: 0.7801, test_f1: 0.6268
 epoch: 19, train_loss: 0.7194, test_loss: 0.6876, test_f1: 0.6763
 epoch: 20, train_loss: 0.6946, test_loss: 0.6674, test_f1: 0.6920
 epoch: 21, train_loss: 0.6996, test_loss: 0.7664, test_f1: 0.6404
 epoch: 22, train_loss: 0.6772, test_loss: 0.7668, test_f1: 0.6765
 epoch: 23, train_loss: 0.6823, test_loss: 0.7611, test_f1: 0.6491
 epoch: 24, train_loss: 0.6718, test_loss: 0.7713, test_f1: 0.6300
 epoch: 25, train_loss: 0.6787, test_loss: 0.7717, test_f1: 0.6457
 epoch: 26, train_loss: 0.6625, test_loss: 0.7042, test_f1: 0.6649
 epoch: 27, train_loss: 0.6453, test_loss: 0.8871, test_f1: 0.6166
 epoch: 28, train_loss: 0.6403, test_loss: 0.7685, test_f1: 0.6439
 epoch: 29, train_loss: 0.6418, test_loss: 0.8067, test_f1: 0.6336
 epoch: 30, train_loss: 0.6429, test_loss: 0.7762, test_f1: 0.6767
 epoch: 31, train_loss: 0.6307, test_loss: 0.7915, test_f1: 0.6479
 epoch: 32, train_loss: 0.6269, test_loss: 0.8473, test_f1: 0.6635
 epoch: 33, train_loss: 0.6246, test_loss: 0.8655, test_f1: 0.6566
 epoch: 34, train_loss: 0.6149, test_loss: 0.8330, test_f1: 0.6613
 epoch: 35, train_loss: 0.6123, test_loss: 0.7715, test_f1: 0.6992
 epoch: 36, train_loss: 0.5878, test_loss: 0.7717, test_f1: 0.6920
 epoch: 37, train_loss: 0.6027, test_loss: 0.7672, test_f1: 0.6864
 epoch: 38, train_loss: 0.6065, test_loss: 0.8237, test_f1: 0.6493
 epoch: 39, train_loss: 0.5856, test_loss: 0.8736, test_f1: 0.6690
 epoch: 40, train_loss: 0.5827, test_loss: 0.8431, test_f1: 0.6864
 epoch: 41, train_loss: 0.5580, test_loss: 0.8652, test_f1: 0.6518
 epoch: 42, train_loss: 0.5687, test_loss: 0.8070, test_f1: 0.6603
 epoch: 43, train_loss: 0.5799, test_loss: 0.7713, test_f1: 0.6539
 epoch: 44, train_loss: 0.5771, test_loss: 0.8781, test_f1: 0.6824
 epoch: 45, train_loss: 0.5487, test_loss: 0.8878, test_f1: 0.6678
 epoch: 46, train_loss: 0.5466, test_loss: 0.8411, test_f1: 0.6784
 epoch: 47, train_loss: 0.5421, test_loss: 0.8507, test_f1: 0.6672
 epoch: 48, train_loss: 0.5778, test_loss: 0.8295, test_f1: 0.6725
 epoch: 49, train_loss: 0.5597, test_loss: 0.8869, test_f1: 0.6785
 epoch: 50, train_loss: 0.5319, test_loss: 0.8974, test_f1: 0.6955
 epoch: 51, train_loss: 0.5143, test_loss: 0.8925, test_f1: 0.6582
 epoch: 52, train_loss: 0.5029, test_loss: 0.8932, test_f1: 0.6756
 epoch: 53, train_loss: 0.4730, test_loss: 0.8871, test_f1: 0.6768
 epoch: 54, train_loss: 0.4777, test_loss: 0.8768, test_f1: 0.6918
 epoch: 55, train_loss: 0.4942, test_loss: 0.9354, test_f1: 0.6723
 epoch: 56, train_loss: 0.4829, test_loss: 0.9210, test_f1: 0.6876
 epoch: 57, train_loss: 0.4652, test_loss: 0.8872, test_f1: 0.6772
 epoch: 58, train_loss: 0.4822, test_loss: 0.9249, test_f1: 0.6668
 epoch: 59, train_loss: 0.4736, test_loss: 1.0108, test_f1: 0.6527
 epoch: 60, train_loss: 0.4553, test_loss: 0.9828, test_f1: 0.6731
 epoch: 61, train_loss: 0.4654, test_loss: 0.9629, test_f1: 0.6764
 epoch: 62, train_loss: 0.4699, test_loss: 0.9713, test_f1: 0.6779
 epoch: 63, train_loss: 0.4691, test_loss: 0.9664, test_f1: 0.6680
 epoch: 64, train_loss: 0.4707, test_loss: 1.0174, test_f1: 0.6549
 epoch: 65, train_loss: 0.4497, test_loss: 1.0053, test_f1: 0.6644
 epoch: 66, train_loss: 0.4483, test_loss: 0.9525, test_f1: 0.6542
 epoch: 67, train_loss: 0.4553, test_loss: 0.9473, test_f1: 0.6551
 epoch: 68, train_loss: 0.4499, test_loss: 1.0324, test_f1: 0.6602
 epoch: 69, train_loss: 0.4462, test_loss: 1.0794, test_f1: 0.6590
 epoch: 70, train_loss: 0.4188, test_loss: 1.0055, test_f1: 0.6616
 epoch: 71, train_loss: 0.4331, test_loss: 1.0627, test_f1: 0.6616
 epoch: 72, train_loss: 0.4446, test_loss: 1.0490, test_f1: 0.6693
 epoch: 73, train_loss: 0.4367, test_loss: 1.0426, test_f1: 0.6740
 epoch: 74, train_loss: 0.4508, test_loss: 1.0352, test_f1: 0.6848
 epoch: 75, train_loss: 0.4341, test_loss: 1.0495, test_f1: 0.6654
 epoch: 76, train_loss: 0.4308, test_loss: 1.0680, test_f1: 0.6746
 epoch: 77, train_loss: 0.4222, test_loss: 1.1152, test_f1: 0.6538
 epoch: 78, train_loss: 0.4205, test_loss: 1.0346, test_f1: 0.6721
 epoch: 79, train_loss: 0.4333, test_loss: 1.1393, test_f1: 0.6613
 epoch: 80, train_loss: 0.4153, test_loss: 1.0985, test_f1: 0.6706
 epoch: 81, train_loss: 0.4076, test_loss: 1.0381, test_f1: 0.6593
 epoch: 82, train_loss: 0.4080, test_loss: 1.0547, test_f1: 0.6715
 epoch: 83, train_loss: 0.4097, test_loss: 1.1513, test_f1: 0.6630
 epoch: 84, train_loss: 0.4015, test_loss: 1.1315, test_f1: 0.6698
 epoch: 85, train_loss: 0.4194, test_loss: 1.1188, test_f1: 0.6616
 epoch: 86, train_loss: 0.4038, test_loss: 1.0311, test_f1: 0.6815
 epoch: 87, train_loss: 0.4025, test_loss: 1.0573, test_f1: 0.6821
 epoch: 88, train_loss: 0.4153, test_loss: 1.0729, test_f1: 0.6718
 epoch: 89, train_loss: 0.3993, test_loss: 1.1557, test_f1: 0.6813
 epoch: 90, train_loss: 0.3968, test_loss: 1.1540, test_f1: 0.6802
 epoch: 91, train_loss: 0.3913, test_loss: 1.1482, test_f1: 0.6694
 epoch: 92, train_loss: 0.3924, test_loss: 1.1691, test_f1: 0.6620
 epoch: 93, train_loss: 0.3860, test_loss: 1.1290, test_f1: 0.6746
 epoch: 94, train_loss: 0.3919, test_loss: 1.1042, test_f1: 0.6631
 epoch: 95, train_loss: 0.3916, test_loss: 1.1541, test_f1: 0.6655
 epoch: 96, train_loss: 0.3831, test_loss: 1.1745, test_f1: 0.6787
 epoch: 97, train_loss: 0.3850, test_loss: 1.1277, test_f1: 0.6686
 epoch: 98, train_loss: 0.3788, test_loss: 1.1594, test_f1: 0.6713
 epoch: 99, train_loss: 0.3800, test_loss: 1.1936, test_f1: 0.6803
##################ITERATION #2 ****************************************
 epoch: 0, train_loss: 1.0848, test_loss: 0.9566, test_f1: 0.4762
 epoch: 1, train_loss: 0.9706, test_loss: 0.9623, test_f1: 0.4702
 epoch: 2, train_loss: 0.9360, test_loss: 0.9112, test_f1: 0.5038
 epoch: 3, train_loss: 0.9128, test_loss: 0.8842, test_f1: 0.5944
 epoch: 4, train_loss: 0.8906, test_loss: 0.8480, test_f1: 0.5330
 epoch: 5, train_loss: 0.8851, test_loss: 0.8760, test_f1: 0.5689
 epoch: 6, train_loss: 0.8498, test_loss: 0.8365, test_f1: 0.5603
 epoch: 7, train_loss: 0.8281, test_loss: 0.8256, test_f1: 0.6018
 epoch: 8, train_loss: 0.8296, test_loss: 0.8397, test_f1: 0.5957
 epoch: 9, train_loss: 0.8077, test_loss: 0.8550, test_f1: 0.5902
 epoch: 10, train_loss: 0.7933, test_loss: 0.8440, test_f1: 0.6023
 epoch: 11, train_loss: 0.7826, test_loss: 0.7463, test_f1: 0.6067
 epoch: 12, train_loss: 0.7756, test_loss: 0.8415, test_f1: 0.6615
 epoch: 13, train_loss: 0.7623, test_loss: 0.8122, test_f1: 0.6321
 epoch: 14, train_loss: 0.7411, test_loss: 0.7588, test_f1: 0.6684
 epoch: 15, train_loss: 0.7360, test_loss: 0.8124, test_f1: 0.6312
 epoch: 16, train_loss: 0.7202, test_loss: 0.8294, test_f1: 0.6183
 epoch: 17, train_loss: 0.7114, test_loss: 0.7966, test_f1: 0.6192
 epoch: 18, train_loss: 0.7189, test_loss: 0.7400, test_f1: 0.6702
 epoch: 19, train_loss: 0.6975, test_loss: 0.7896, test_f1: 0.6766
 epoch: 20, train_loss: 0.6990, test_loss: 0.8003, test_f1: 0.6588
 epoch: 21, train_loss: 0.6909, test_loss: 0.7903, test_f1: 0.6623
 epoch: 22, train_loss: 0.6734, test_loss: 0.7730, test_f1: 0.6602
 epoch: 23, train_loss: 0.6810, test_loss: 0.7926, test_f1: 0.6548
 epoch: 24, train_loss: 0.6703, test_loss: 0.8209, test_f1: 0.6471
 epoch: 25, train_loss: 0.6612, test_loss: 0.8068, test_f1: 0.7008
 epoch: 26, train_loss: 0.6653, test_loss: 0.7728, test_f1: 0.6526
 epoch: 27, train_loss: 0.6470, test_loss: 0.7703, test_f1: 0.6734
 epoch: 28, train_loss: 0.6420, test_loss: 0.7477, test_f1: 0.6635
 epoch: 29, train_loss: 0.6411, test_loss: 0.7823, test_f1: 0.6655
 epoch: 30, train_loss: 0.6231, test_loss: 0.7704, test_f1: 0.6666
 epoch: 31, train_loss: 0.6334, test_loss: 0.7445, test_f1: 0.6641
 epoch: 32, train_loss: 0.6262, test_loss: 0.7983, test_f1: 0.6705
 epoch: 33, train_loss: 0.6308, test_loss: 0.7972, test_f1: 0.6727
 epoch: 34, train_loss: 0.6195, test_loss: 0.7556, test_f1: 0.6998
 epoch: 35, train_loss: 0.6054, test_loss: 0.8561, test_f1: 0.6596
 epoch: 36, train_loss: 0.6051, test_loss: 0.7870, test_f1: 0.6970
 epoch: 37, train_loss: 0.5907, test_loss: 0.7883, test_f1: 0.6750
 epoch: 38, train_loss: 0.5884, test_loss: 0.8245, test_f1: 0.6744
 epoch: 39, train_loss: 0.5964, test_loss: 0.8139, test_f1: 0.6959
 epoch: 40, train_loss: 0.5804, test_loss: 0.8060, test_f1: 0.6662
 epoch: 41, train_loss: 0.5807, test_loss: 0.7875, test_f1: 0.6867
 epoch: 42, train_loss: 0.5698, test_loss: 0.8299, test_f1: 0.6885
 epoch: 43, train_loss: 0.5675, test_loss: 0.8698, test_f1: 0.6966
 epoch: 44, train_loss: 0.5495, test_loss: 0.8828, test_f1: 0.7027
 epoch: 45, train_loss: 0.5607, test_loss: 0.9413, test_f1: 0.6436
 epoch: 46, train_loss: 0.5552, test_loss: 0.8891, test_f1: 0.6965
 epoch: 47, train_loss: 0.5821, test_loss: 0.9604, test_f1: 0.6537
 epoch: 48, train_loss: 0.5585, test_loss: 0.8207, test_f1: 0.6742
 epoch: 49, train_loss: 0.5403, test_loss: 0.8448, test_f1: 0.7133
 epoch: 50, train_loss: 0.5382, test_loss: 0.8616, test_f1: 0.6908
 epoch: 51, train_loss: 0.5213, test_loss: 0.8369, test_f1: 0.6773
 epoch: 52, train_loss: 0.5032, test_loss: 0.9229, test_f1: 0.6743
 epoch: 53, train_loss: 0.4951, test_loss: 0.8469, test_f1: 0.6874
 epoch: 54, train_loss: 0.4750, test_loss: 0.9334, test_f1: 0.6734
 epoch: 55, train_loss: 0.4792, test_loss: 0.9010, test_f1: 0.6794
 epoch: 56, train_loss: 0.4699, test_loss: 0.8919, test_f1: 0.6864
 epoch: 57, train_loss: 0.4791, test_loss: 0.9240, test_f1: 0.6865
 epoch: 58, train_loss: 0.4776, test_loss: 0.9056, test_f1: 0.6910
 epoch: 59, train_loss: 0.4889, test_loss: 0.8653, test_f1: 0.6691
 epoch: 60, train_loss: 0.4603, test_loss: 0.8949, test_f1: 0.6798
 epoch: 61, train_loss: 0.4644, test_loss: 0.8930, test_f1: 0.6925
 epoch: 62, train_loss: 0.4642, test_loss: 0.9305, test_f1: 0.6586
 epoch: 63, train_loss: 0.4382, test_loss: 0.9217, test_f1: 0.6893
 epoch: 64, train_loss: 0.4529, test_loss: 0.9263, test_f1: 0.7011
 epoch: 65, train_loss: 0.4588, test_loss: 1.0203, test_f1: 0.6545
 epoch: 66, train_loss: 0.4361, test_loss: 0.9480, test_f1: 0.6735
 epoch: 67, train_loss: 0.4533, test_loss: 1.0059, test_f1: 0.6910
 epoch: 68, train_loss: 0.4429, test_loss: 0.9628, test_f1: 0.6751
 epoch: 69, train_loss: 0.4471, test_loss: 0.9602, test_f1: 0.6639
 epoch: 70, train_loss: 0.4319, test_loss: 0.9594, test_f1: 0.6736
 epoch: 71, train_loss: 0.4423, test_loss: 0.9532, test_f1: 0.6763
 epoch: 72, train_loss: 0.4356, test_loss: 0.9685, test_f1: 0.6810
 epoch: 73, train_loss: 0.4310, test_loss: 1.0122, test_f1: 0.6718
 epoch: 74, train_loss: 0.4322, test_loss: 1.0226, test_f1: 0.6783
 epoch: 75, train_loss: 0.4283, test_loss: 0.9398, test_f1: 0.6780
 epoch: 76, train_loss: 0.4148, test_loss: 0.9913, test_f1: 0.6831
 epoch: 77, train_loss: 0.4209, test_loss: 0.9868, test_f1: 0.6634
 epoch: 78, train_loss: 0.4246, test_loss: 1.0282, test_f1: 0.6700
 epoch: 79, train_loss: 0.4161, test_loss: 1.0455, test_f1: 0.6771
 epoch: 80, train_loss: 0.4409, test_loss: 0.9920, test_f1: 0.6809
 epoch: 81, train_loss: 0.4160, test_loss: 0.9889, test_f1: 0.6790
 epoch: 82, train_loss: 0.4167, test_loss: 1.0205, test_f1: 0.6646
 epoch: 83, train_loss: 0.4032, test_loss: 0.9999, test_f1: 0.6836
 epoch: 84, train_loss: 0.4206, test_loss: 0.9967, test_f1: 0.6741
 epoch: 85, train_loss: 0.4184, test_loss: 1.1306, test_f1: 0.6559
 epoch: 86, train_loss: 0.4002, test_loss: 0.9932, test_f1: 0.6847
 epoch: 87, train_loss: 0.3915, test_loss: 1.0376, test_f1: 0.7323
 epoch: 88, train_loss: 0.3976, test_loss: 1.0419, test_f1: 0.6889
 epoch: 89, train_loss: 0.4018, test_loss: 1.0275, test_f1: 0.6914
 epoch: 90, train_loss: 0.3885, test_loss: 1.0107, test_f1: 0.6752
 epoch: 91, train_loss: 0.3874, test_loss: 1.0650, test_f1: 0.6646
 epoch: 92, train_loss: 0.3962, test_loss: 1.0300, test_f1: 0.6933
 epoch: 93, train_loss: 0.4096, test_loss: 1.0107, test_f1: 0.6677
 epoch: 94, train_loss: 0.3936, test_loss: 1.1108, test_f1: 0.6719
 epoch: 95, train_loss: 0.3795, test_loss: 1.0848, test_f1: 0.7057
 epoch: 96, train_loss: 0.3881, test_loss: 1.0774, test_f1: 0.6840
 epoch: 97, train_loss: 0.3893, test_loss: 1.0958, test_f1: 0.6875
 epoch: 98, train_loss: 0.3756, test_loss: 1.0891, test_f1: 0.6762
 epoch: 99, train_loss: 0.3768, test_loss: 1.0377, test_f1: 0.6975
##################ITERATION #3 ****************************************
 epoch: 0, train_loss: 1.1542, test_loss: 0.9848, test_f1: 0.5265
 epoch: 1, train_loss: 1.0029, test_loss: 0.9876, test_f1: 0.5521
 epoch: 2, train_loss: 0.9549, test_loss: 0.8737, test_f1: 0.5586
 epoch: 3, train_loss: 0.9195, test_loss: 0.8472, test_f1: 0.5435
 epoch: 4, train_loss: 0.9045, test_loss: 0.8731, test_f1: 0.5192
 epoch: 5, train_loss: 0.8862, test_loss: 0.8046, test_f1: 0.6069
 epoch: 6, train_loss: 0.8720, test_loss: 0.8196, test_f1: 0.5616
 epoch: 7, train_loss: 0.8441, test_loss: 0.8408, test_f1: 0.6190
 epoch: 8, train_loss: 0.8286, test_loss: 0.8360, test_f1: 0.6236
 epoch: 9, train_loss: 0.8152, test_loss: 0.8037, test_f1: 0.6122
 epoch: 10, train_loss: 0.8029, test_loss: 0.7912, test_f1: 0.6335
 epoch: 11, train_loss: 0.7835, test_loss: 0.7991, test_f1: 0.5744
 epoch: 12, train_loss: 0.7773, test_loss: 0.7642, test_f1: 0.6320
 epoch: 13, train_loss: 0.7789, test_loss: 0.7554, test_f1: 0.6445
 epoch: 14, train_loss: 0.7746, test_loss: 0.8325, test_f1: 0.6184
 epoch: 15, train_loss: 0.7612, test_loss: 0.7794, test_f1: 0.6765
 epoch: 16, train_loss: 0.7571, test_loss: 0.7546, test_f1: 0.6271
 epoch: 17, train_loss: 0.7289, test_loss: 0.7428, test_f1: 0.6546
 epoch: 18, train_loss: 0.7288, test_loss: 0.7437, test_f1: 0.6573
 epoch: 19, train_loss: 0.7181, test_loss: 0.7409, test_f1: 0.6520
 epoch: 20, train_loss: 0.7101, test_loss: 0.7883, test_f1: 0.6446
 epoch: 21, train_loss: 0.7084, test_loss: 0.7755, test_f1: 0.6369
 epoch: 22, train_loss: 0.6962, test_loss: 0.7375, test_f1: 0.6587
 epoch: 23, train_loss: 0.6973, test_loss: 0.7297, test_f1: 0.6411
 epoch: 24, train_loss: 0.6754, test_loss: 0.7377, test_f1: 0.6529
 epoch: 25, train_loss: 0.6853, test_loss: 0.7670, test_f1: 0.6513
 epoch: 26, train_loss: 0.6652, test_loss: 0.7618, test_f1: 0.6556
 epoch: 27, train_loss: 0.6829, test_loss: 0.7860, test_f1: 0.6572
 epoch: 28, train_loss: 0.6578, test_loss: 0.8056, test_f1: 0.6507
 epoch: 29, train_loss: 0.6598, test_loss: 0.7457, test_f1: 0.6692
 epoch: 30, train_loss: 0.6574, test_loss: 0.7962, test_f1: 0.6471
 epoch: 31, train_loss: 0.6352, test_loss: 0.7467, test_f1: 0.6892
 epoch: 32, train_loss: 0.6355, test_loss: 0.8527, test_f1: 0.6464
 epoch: 33, train_loss: 0.6417, test_loss: 0.8065, test_f1: 0.6663
 epoch: 34, train_loss: 0.6368, test_loss: 0.7627, test_f1: 0.6710
 epoch: 35, train_loss: 0.6314, test_loss: 0.7775, test_f1: 0.6422
 epoch: 36, train_loss: 0.6240, test_loss: 0.7772, test_f1: 0.6659
 epoch: 37, train_loss: 0.6120, test_loss: 0.8033, test_f1: 0.6639
 epoch: 38, train_loss: 0.6186, test_loss: 0.7900, test_f1: 0.6610
 epoch: 39, train_loss: 0.6063, test_loss: 0.8237, test_f1: 0.6568
 epoch: 40, train_loss: 0.5973, test_loss: 0.8629, test_f1: 0.6670
 epoch: 41, train_loss: 0.6143, test_loss: 0.8036, test_f1: 0.6593
 epoch: 42, train_loss: 0.6002, test_loss: 0.7985, test_f1: 0.6686
 epoch: 43, train_loss: 0.5753, test_loss: 0.8695, test_f1: 0.6466
 epoch: 44, train_loss: 0.5747, test_loss: 0.8266, test_f1: 0.6656
 epoch: 45, train_loss: 0.5786, test_loss: 0.8315, test_f1: 0.6513
 epoch: 46, train_loss: 0.5606, test_loss: 0.7974, test_f1: 0.6724
 epoch: 47, train_loss: 0.5469, test_loss: 0.8487, test_f1: 0.6669
 epoch: 48, train_loss: 0.5580, test_loss: 0.8679, test_f1: 0.6584
 epoch: 49, train_loss: 0.5470, test_loss: 0.8568, test_f1: 0.6751
 epoch: 50, train_loss: 0.5382, test_loss: 0.9222, test_f1: 0.6597
 epoch: 51, train_loss: 0.5123, test_loss: 0.8711, test_f1: 0.6732
 epoch: 52, train_loss: 0.5042, test_loss: 0.8368, test_f1: 0.6706
 epoch: 53, train_loss: 0.5277, test_loss: 0.8186, test_f1: 0.6732
 epoch: 54, train_loss: 0.4884, test_loss: 0.8690, test_f1: 0.6583
 epoch: 55, train_loss: 0.4953, test_loss: 0.8951, test_f1: 0.6738
 epoch: 56, train_loss: 0.4947, test_loss: 0.8602, test_f1: 0.6760
 epoch: 57, train_loss: 0.4814, test_loss: 0.8606, test_f1: 0.6688
 epoch: 58, train_loss: 0.4842, test_loss: 0.8107, test_f1: 0.6889
 epoch: 59, train_loss: 0.4836, test_loss: 0.8546, test_f1: 0.6864
 epoch: 60, train_loss: 0.4792, test_loss: 0.8919, test_f1: 0.6684
 epoch: 61, train_loss: 0.4713, test_loss: 0.9442, test_f1: 0.6822
 epoch: 62, train_loss: 0.4761, test_loss: 0.8710, test_f1: 0.6809
 epoch: 63, train_loss: 0.4652, test_loss: 0.8801, test_f1: 0.6758
 epoch: 64, train_loss: 0.4674, test_loss: 0.8827, test_f1: 0.6859
 epoch: 65, train_loss: 0.4510, test_loss: 0.8835, test_f1: 0.6823
 epoch: 66, train_loss: 0.4744, test_loss: 0.8686, test_f1: 0.6911
 epoch: 67, train_loss: 0.4726, test_loss: 0.9275, test_f1: 0.6890
 epoch: 68, train_loss: 0.4401, test_loss: 0.9032, test_f1: 0.6789
 epoch: 69, train_loss: 0.4485, test_loss: 0.8866, test_f1: 0.6769
 epoch: 70, train_loss: 0.4575, test_loss: 0.8911, test_f1: 0.6593
 epoch: 71, train_loss: 0.4507, test_loss: 0.8664, test_f1: 0.6838
 epoch: 72, train_loss: 0.4398, test_loss: 0.9106, test_f1: 0.6763
 epoch: 73, train_loss: 0.4600, test_loss: 0.8638, test_f1: 0.6753
 epoch: 74, train_loss: 0.4458, test_loss: 0.8070, test_f1: 0.6869
 epoch: 75, train_loss: 0.4246, test_loss: 0.9081, test_f1: 0.6736
 epoch: 76, train_loss: 0.4359, test_loss: 0.9907, test_f1: 0.6641
 epoch: 77, train_loss: 0.4505, test_loss: 0.9697, test_f1: 0.6567
 epoch: 78, train_loss: 0.4340, test_loss: 0.8678, test_f1: 0.6945
 epoch: 79, train_loss: 0.4155, test_loss: 1.0146, test_f1: 0.6747
 epoch: 80, train_loss: 0.4181, test_loss: 0.9038, test_f1: 0.6857
 epoch: 81, train_loss: 0.4328, test_loss: 0.9346, test_f1: 0.6964
 epoch: 82, train_loss: 0.4526, test_loss: 0.9126, test_f1: 0.6680
 epoch: 83, train_loss: 0.4374, test_loss: 0.8497, test_f1: 0.6866
 epoch: 84, train_loss: 0.4235, test_loss: 0.8678, test_f1: 0.6927
 epoch: 85, train_loss: 0.4103, test_loss: 0.8977, test_f1: 0.6955
 epoch: 86, train_loss: 0.4065, test_loss: 0.9724, test_f1: 0.6836
 epoch: 87, train_loss: 0.4108, test_loss: 0.9698, test_f1: 0.6742
 epoch: 88, train_loss: 0.4235, test_loss: 1.0019, test_f1: 0.6726
 epoch: 89, train_loss: 0.4062, test_loss: 0.9264, test_f1: 0.6608
 epoch: 90, train_loss: 0.3981, test_loss: 0.9970, test_f1: 0.6832
 epoch: 91, train_loss: 0.4090, test_loss: 1.0362, test_f1: 0.6779
 epoch: 92, train_loss: 0.4306, test_loss: 0.9903, test_f1: 0.6941
 epoch: 93, train_loss: 0.3997, test_loss: 1.0746, test_f1: 0.6617
 epoch: 94, train_loss: 0.3986, test_loss: 0.9342, test_f1: 0.6833
 epoch: 95, train_loss: 0.4144, test_loss: 0.9930, test_f1: 0.6796
 epoch: 96, train_loss: 0.4150, test_loss: 0.8878, test_f1: 0.6926
 epoch: 97, train_loss: 0.4033, test_loss: 1.0378, test_f1: 0.6831
 epoch: 98, train_loss: 0.3885, test_loss: 0.9674, test_f1: 0.6869
 epoch: 99, train_loss: 0.3905, test_loss: 0.9761, test_f1: 0.6789
##################ITERATION #4 ****************************************
 epoch: 0, train_loss: 1.1853, test_loss: 1.0163, test_f1: 0.5113
 epoch: 1, train_loss: 0.9892, test_loss: 0.9309, test_f1: 0.5129
 epoch: 2, train_loss: 0.9588, test_loss: 0.9186, test_f1: 0.5105
 epoch: 3, train_loss: 0.9223, test_loss: 0.8830, test_f1: 0.5416
 epoch: 4, train_loss: 0.9074, test_loss: 0.8384, test_f1: 0.5661
 epoch: 5, train_loss: 0.8871, test_loss: 0.8780, test_f1: 0.5038
 epoch: 6, train_loss: 0.8759, test_loss: 0.8096, test_f1: 0.5549
 epoch: 7, train_loss: 0.8478, test_loss: 0.8078, test_f1: 0.5732
 epoch: 8, train_loss: 0.8484, test_loss: 0.7937, test_f1: 0.5857
 epoch: 9, train_loss: 0.8278, test_loss: 0.7587, test_f1: 0.6368
 epoch: 10, train_loss: 0.8067, test_loss: 0.7905, test_f1: 0.6373
 epoch: 11, train_loss: 0.7902, test_loss: 0.7633, test_f1: 0.5940
 epoch: 12, train_loss: 0.7904, test_loss: 0.7948, test_f1: 0.6111
 epoch: 13, train_loss: 0.7807, test_loss: 0.7828, test_f1: 0.6239
 epoch: 14, train_loss: 0.7710, test_loss: 0.7538, test_f1: 0.6520
 epoch: 15, train_loss: 0.7580, test_loss: 0.7737, test_f1: 0.6419
 epoch: 16, train_loss: 0.7592, test_loss: 0.7656, test_f1: 0.6101
 epoch: 17, train_loss: 0.7414, test_loss: 0.7270, test_f1: 0.6265
 epoch: 18, train_loss: 0.7147, test_loss: 0.7562, test_f1: 0.6546
 epoch: 19, train_loss: 0.7327, test_loss: 0.7262, test_f1: 0.6421
 epoch: 20, train_loss: 0.7251, test_loss: 0.7397, test_f1: 0.6346
 epoch: 21, train_loss: 0.6932, test_loss: 0.7926, test_f1: 0.6607
 epoch: 22, train_loss: 0.7015, test_loss: 0.7581, test_f1: 0.6550
 epoch: 23, train_loss: 0.6953, test_loss: 0.7943, test_f1: 0.6499
 epoch: 24, train_loss: 0.6826, test_loss: 0.8186, test_f1: 0.6355
 epoch: 25, train_loss: 0.6774, test_loss: 0.8173, test_f1: 0.6369
 epoch: 26, train_loss: 0.6685, test_loss: 0.8415, test_f1: 0.6305
 epoch: 27, train_loss: 0.6752, test_loss: 0.8279, test_f1: 0.6485
 epoch: 28, train_loss: 0.6713, test_loss: 0.7966, test_f1: 0.6448
 epoch: 29, train_loss: 0.6574, test_loss: 0.7598, test_f1: 0.6657
 epoch: 30, train_loss: 0.6455, test_loss: 0.7612, test_f1: 0.6526
 epoch: 31, train_loss: 0.6333, test_loss: 0.8151, test_f1: 0.6383
 epoch: 32, train_loss: 0.6372, test_loss: 0.8080, test_f1: 0.6658
 epoch: 33, train_loss: 0.6584, test_loss: 0.7957, test_f1: 0.6438
 epoch: 34, train_loss: 0.6333, test_loss: 0.8092, test_f1: 0.6463
 epoch: 35, train_loss: 0.6179, test_loss: 0.8091, test_f1: 0.6391
 epoch: 36, train_loss: 0.6049, test_loss: 0.7911, test_f1: 0.6634
 epoch: 37, train_loss: 0.6197, test_loss: 0.8033, test_f1: 0.6733
 epoch: 38, train_loss: 0.6038, test_loss: 0.7825, test_f1: 0.6634
 epoch: 39, train_loss: 0.6087, test_loss: 0.8077, test_f1: 0.6507
 epoch: 40, train_loss: 0.5962, test_loss: 0.8228, test_f1: 0.6458
 epoch: 41, train_loss: 0.6004, test_loss: 0.7378, test_f1: 0.6702
 epoch: 42, train_loss: 0.5821, test_loss: 0.8079, test_f1: 0.6899
 epoch: 43, train_loss: 0.5944, test_loss: 0.7807, test_f1: 0.6280
 epoch: 44, train_loss: 0.5790, test_loss: 0.7532, test_f1: 0.6527
 epoch: 45, train_loss: 0.5867, test_loss: 0.7853, test_f1: 0.6665
 epoch: 46, train_loss: 0.5572, test_loss: 0.8217, test_f1: 0.6467
 epoch: 47, train_loss: 0.5763, test_loss: 0.7974, test_f1: 0.6446
 epoch: 48, train_loss: 0.5621, test_loss: 0.7655, test_f1: 0.6786
 epoch: 49, train_loss: 0.5571, test_loss: 0.8165, test_f1: 0.6389
 epoch: 50, train_loss: 0.5607, test_loss: 0.8603, test_f1: 0.6480
 epoch: 51, train_loss: 0.5378, test_loss: 0.8778, test_f1: 0.6636
 epoch: 52, train_loss: 0.5115, test_loss: 0.8284, test_f1: 0.6743
 epoch: 53, train_loss: 0.5036, test_loss: 0.8160, test_f1: 0.6650
 epoch: 54, train_loss: 0.4972, test_loss: 0.8506, test_f1: 0.6638
 epoch: 55, train_loss: 0.4815, test_loss: 0.8513, test_f1: 0.6708
 epoch: 56, train_loss: 0.4910, test_loss: 0.8615, test_f1: 0.6546
 epoch: 57, train_loss: 0.4662, test_loss: 0.8900, test_f1: 0.6705
 epoch: 58, train_loss: 0.4905, test_loss: 0.8822, test_f1: 0.6658
 epoch: 59, train_loss: 0.4845, test_loss: 0.9166, test_f1: 0.6681
 epoch: 60, train_loss: 0.4745, test_loss: 0.8749, test_f1: 0.6668
 epoch: 61, train_loss: 0.4751, test_loss: 0.8604, test_f1: 0.6644
 epoch: 62, train_loss: 0.4762, test_loss: 0.8818, test_f1: 0.6577
 epoch: 63, train_loss: 0.4704, test_loss: 0.9172, test_f1: 0.6700
 epoch: 64, train_loss: 0.4549, test_loss: 0.9115, test_f1: 0.6684
 epoch: 65, train_loss: 0.4668, test_loss: 0.9265, test_f1: 0.6675
 epoch: 66, train_loss: 0.4843, test_loss: 0.8928, test_f1: 0.6835
 epoch: 67, train_loss: 0.4494, test_loss: 0.8863, test_f1: 0.6759
 epoch: 68, train_loss: 0.4483, test_loss: 0.9434, test_f1: 0.6826
 epoch: 69, train_loss: 0.4351, test_loss: 0.9644, test_f1: 0.6740
 epoch: 70, train_loss: 0.4395, test_loss: 0.9070, test_f1: 0.6671
 epoch: 71, train_loss: 0.4471, test_loss: 0.9419, test_f1: 0.6638
 epoch: 72, train_loss: 0.4598, test_loss: 0.9171, test_f1: 0.6791
 epoch: 73, train_loss: 0.4521, test_loss: 0.9512, test_f1: 0.6522
 epoch: 74, train_loss: 0.4427, test_loss: 0.8877, test_f1: 0.6857
 epoch: 75, train_loss: 0.4300, test_loss: 0.9287, test_f1: 0.6724
 epoch: 76, train_loss: 0.4330, test_loss: 0.9065, test_f1: 0.6642
 epoch: 77, train_loss: 0.4363, test_loss: 0.9304, test_f1: 0.6753
 epoch: 78, train_loss: 0.4268, test_loss: 0.9361, test_f1: 0.6617
 epoch: 79, train_loss: 0.4321, test_loss: 1.0221, test_f1: 0.6812
 epoch: 80, train_loss: 0.4172, test_loss: 1.0191, test_f1: 0.6718
 epoch: 81, train_loss: 0.4304, test_loss: 1.0132, test_f1: 0.6684
 epoch: 82, train_loss: 0.4289, test_loss: 1.0256, test_f1: 0.6676
 epoch: 83, train_loss: 0.4280, test_loss: 0.9913, test_f1: 0.6866
 epoch: 84, train_loss: 0.4161, test_loss: 0.9720, test_f1: 0.6521
 epoch: 85, train_loss: 0.3977, test_loss: 0.9871, test_f1: 0.6605
 epoch: 86, train_loss: 0.4398, test_loss: 0.9340, test_f1: 0.6731
 epoch: 87, train_loss: 0.4054, test_loss: 0.9532, test_f1: 0.6686
 epoch: 88, train_loss: 0.4035, test_loss: 0.9557, test_f1: 0.6826
 epoch: 89, train_loss: 0.4085, test_loss: 0.9528, test_f1: 0.6761
 epoch: 90, train_loss: 0.4058, test_loss: 0.9543, test_f1: 0.6818
 epoch: 91, train_loss: 0.4203, test_loss: 1.0381, test_f1: 0.6735
 epoch: 92, train_loss: 0.3775, test_loss: 1.0275, test_f1: 0.6808
 epoch: 93, train_loss: 0.4106, test_loss: 0.9957, test_f1: 0.6699
 epoch: 94, train_loss: 0.4060, test_loss: 1.0078, test_f1: 0.6865
 epoch: 95, train_loss: 0.4110, test_loss: 0.9561, test_f1: 0.6661
 epoch: 96, train_loss: 0.4016, test_loss: 0.9653, test_f1: 0.6723
 epoch: 97, train_loss: 0.4134, test_loss: 0.9575, test_f1: 0.6810
 epoch: 98, train_loss: 0.3880, test_loss: 1.0476, test_f1: 0.6638
 epoch: 99, train_loss: 0.3844, test_loss: 1.0737, test_f1: 0.6715
##################ITERATION #5 ****************************************
 epoch: 0, train_loss: 1.1870, test_loss: 0.9632, test_f1: 0.5239
 epoch: 1, train_loss: 1.0006, test_loss: 0.9361, test_f1: 0.5555
 epoch: 2, train_loss: 0.9683, test_loss: 0.9213, test_f1: 0.5220
 epoch: 3, train_loss: 0.9406, test_loss: 0.8811, test_f1: 0.5439
 epoch: 4, train_loss: 0.9162, test_loss: 0.8690, test_f1: 0.5259
 epoch: 5, train_loss: 0.9116, test_loss: 0.8943, test_f1: 0.5605
 epoch: 6, train_loss: 0.8859, test_loss: 0.8408, test_f1: 0.5866
 epoch: 7, train_loss: 0.8761, test_loss: 0.8255, test_f1: 0.5862
 epoch: 8, train_loss: 0.8682, test_loss: 0.8410, test_f1: 0.5586
 epoch: 9, train_loss: 0.8536, test_loss: 0.7960, test_f1: 0.5763
 epoch: 10, train_loss: 0.8332, test_loss: 0.8355, test_f1: 0.5865
 epoch: 11, train_loss: 0.8229, test_loss: 0.8064, test_f1: 0.6190
 epoch: 12, train_loss: 0.8045, test_loss: 0.7992, test_f1: 0.6361
 epoch: 13, train_loss: 0.7818, test_loss: 0.7655, test_f1: 0.6385
 epoch: 14, train_loss: 0.7787, test_loss: 0.7351, test_f1: 0.6457
 epoch: 15, train_loss: 0.7813, test_loss: 0.8097, test_f1: 0.6360
 epoch: 16, train_loss: 0.7765, test_loss: 0.7477, test_f1: 0.6474
 epoch: 17, train_loss: 0.7469, test_loss: 0.7473, test_f1: 0.6254
 epoch: 18, train_loss: 0.7448, test_loss: 0.8010, test_f1: 0.6376
 epoch: 19, train_loss: 0.7393, test_loss: 0.7676, test_f1: 0.6017
 epoch: 20, train_loss: 0.7158, test_loss: 0.7746, test_f1: 0.6580
 epoch: 21, train_loss: 0.7209, test_loss: 0.7175, test_f1: 0.6412
 epoch: 22, train_loss: 0.7144, test_loss: 0.7697, test_f1: 0.6488
 epoch: 23, train_loss: 0.7079, test_loss: 0.7682, test_f1: 0.6388
 epoch: 24, train_loss: 0.6986, test_loss: 0.7784, test_f1: 0.6481
 epoch: 25, train_loss: 0.6689, test_loss: 0.7646, test_f1: 0.6630
 epoch: 26, train_loss: 0.6899, test_loss: 0.7448, test_f1: 0.6487
 epoch: 27, train_loss: 0.6780, test_loss: 0.7574, test_f1: 0.6730
 epoch: 28, train_loss: 0.6751, test_loss: 0.7432, test_f1: 0.6517
 epoch: 29, train_loss: 0.6622, test_loss: 0.7757, test_f1: 0.6545
 epoch: 30, train_loss: 0.6585, test_loss: 0.8086, test_f1: 0.6567
 epoch: 31, train_loss: 0.6435, test_loss: 0.7491, test_f1: 0.6796
 epoch: 32, train_loss: 0.6413, test_loss: 0.7963, test_f1: 0.6598
 epoch: 33, train_loss: 0.6406, test_loss: 0.7863, test_f1: 0.6551
 epoch: 34, train_loss: 0.6148, test_loss: 0.8415, test_f1: 0.6641
 epoch: 35, train_loss: 0.6354, test_loss: 0.8087, test_f1: 0.6476
 epoch: 36, train_loss: 0.5992, test_loss: 0.7943, test_f1: 0.6530
 epoch: 37, train_loss: 0.6079, test_loss: 0.8128, test_f1: 0.6825
 epoch: 38, train_loss: 0.6156, test_loss: 0.8208, test_f1: 0.6827
 epoch: 39, train_loss: 0.6200, test_loss: 0.8173, test_f1: 0.6679
 epoch: 40, train_loss: 0.6045, test_loss: 0.8743, test_f1: 0.6545
 epoch: 41, train_loss: 0.6071, test_loss: 0.8084, test_f1: 0.6667
 epoch: 42, train_loss: 0.5943, test_loss: 0.9424, test_f1: 0.6343
 epoch: 43, train_loss: 0.5930, test_loss: 0.7864, test_f1: 0.6743
 epoch: 44, train_loss: 0.5766, test_loss: 0.8477, test_f1: 0.6372
 epoch: 45, train_loss: 0.5765, test_loss: 0.8344, test_f1: 0.6631
 epoch: 46, train_loss: 0.5716, test_loss: 0.7977, test_f1: 0.6782
 epoch: 47, train_loss: 0.5675, test_loss: 0.7930, test_f1: 0.6964
 epoch: 48, train_loss: 0.5677, test_loss: 0.7961, test_f1: 0.6861
 epoch: 49, train_loss: 0.5621, test_loss: 0.8426, test_f1: 0.6836
 epoch: 50, train_loss: 0.5563, test_loss: 0.8849, test_f1: 0.6671
 epoch: 51, train_loss: 0.5270, test_loss: 0.8337, test_f1: 0.6795
 epoch: 52, train_loss: 0.5196, test_loss: 0.8802, test_f1: 0.6687
 epoch: 53, train_loss: 0.4951, test_loss: 0.8868, test_f1: 0.6638
 epoch: 54, train_loss: 0.5059, test_loss: 0.8608, test_f1: 0.6773
 epoch: 55, train_loss: 0.5051, test_loss: 0.8976, test_f1: 0.6486
 epoch: 56, train_loss: 0.5113, test_loss: 0.8673, test_f1: 0.6677
 epoch: 57, train_loss: 0.4766, test_loss: 0.8640, test_f1: 0.6792
 epoch: 58, train_loss: 0.4998, test_loss: 0.8713, test_f1: 0.6749
 epoch: 59, train_loss: 0.4871, test_loss: 0.8934, test_f1: 0.6800
 epoch: 60, train_loss: 0.4853, test_loss: 0.8886, test_f1: 0.6763
 epoch: 61, train_loss: 0.4819, test_loss: 0.9076, test_f1: 0.6753
 epoch: 62, train_loss: 0.4754, test_loss: 0.8870, test_f1: 0.6542
 epoch: 63, train_loss: 0.4652, test_loss: 0.8919, test_f1: 0.6842
 epoch: 64, train_loss: 0.4674, test_loss: 0.9191, test_f1: 0.6712
 epoch: 65, train_loss: 0.4759, test_loss: 0.9345, test_f1: 0.6632
 epoch: 66, train_loss: 0.4566, test_loss: 0.9074, test_f1: 0.6813
 epoch: 67, train_loss: 0.4693, test_loss: 0.8818, test_f1: 0.6624
 epoch: 68, train_loss: 0.4802, test_loss: 0.8865, test_f1: 0.6831
 epoch: 69, train_loss: 0.4690, test_loss: 0.8729, test_f1: 0.6707
 epoch: 70, train_loss: 0.4499, test_loss: 0.8901, test_f1: 0.6792
 epoch: 71, train_loss: 0.4603, test_loss: 0.9159, test_f1: 0.6785
 epoch: 72, train_loss: 0.4527, test_loss: 0.9112, test_f1: 0.6649
 epoch: 73, train_loss: 0.4423, test_loss: 0.9068, test_f1: 0.6763
 epoch: 74, train_loss: 0.4432, test_loss: 0.8832, test_f1: 0.6994
 epoch: 75, train_loss: 0.4327, test_loss: 0.9063, test_f1: 0.6640
 epoch: 76, train_loss: 0.4484, test_loss: 0.9204, test_f1: 0.6684
 epoch: 77, train_loss: 0.4482, test_loss: 0.9309, test_f1: 0.6722
 epoch: 78, train_loss: 0.4336, test_loss: 0.9328, test_f1: 0.6749
 epoch: 79, train_loss: 0.4315, test_loss: 0.9916, test_f1: 0.6822
 epoch: 80, train_loss: 0.4464, test_loss: 0.9723, test_f1: 0.6791
 epoch: 81, train_loss: 0.4282, test_loss: 0.9612, test_f1: 0.6679
 epoch: 82, train_loss: 0.4365, test_loss: 0.8757, test_f1: 0.6807
 epoch: 83, train_loss: 0.4266, test_loss: 0.8860, test_f1: 0.7036
 epoch: 84, train_loss: 0.4150, test_loss: 0.9888, test_f1: 0.6703
 epoch: 85, train_loss: 0.4283, test_loss: 0.9497, test_f1: 0.6853
 epoch: 86, train_loss: 0.4234, test_loss: 1.0212, test_f1: 0.6930
 epoch: 87, train_loss: 0.4136, test_loss: 0.9892, test_f1: 0.6775
 epoch: 88, train_loss: 0.4440, test_loss: 0.9833, test_f1: 0.6740
 epoch: 89, train_loss: 0.4256, test_loss: 0.9635, test_f1: 0.6722
 epoch: 90, train_loss: 0.4195, test_loss: 0.9105, test_f1: 0.6882
 epoch: 91, train_loss: 0.4001, test_loss: 0.9938, test_f1: 0.6786
 epoch: 92, train_loss: 0.4011, test_loss: 0.9809, test_f1: 0.6797
 epoch: 93, train_loss: 0.4129, test_loss: 1.0435, test_f1: 0.6706
 epoch: 94, train_loss: 0.4135, test_loss: 1.0118, test_f1: 0.6770
 epoch: 95, train_loss: 0.4121, test_loss: 0.9443, test_f1: 0.6760
 epoch: 96, train_loss: 0.4073, test_loss: 0.9693, test_f1: 0.6708
 epoch: 97, train_loss: 0.4001, test_loss: 0.9540, test_f1: 0.6618
 epoch: 98, train_loss: 0.3990, test_loss: 1.0146, test_f1: 0.6835
 epoch: 99, train_loss: 0.4042, test_loss: 1.0099, test_f1: 0.6647
##################ITERATION #6 ****************************************
 epoch: 0, train_loss: 1.2420, test_loss: 0.9620, test_f1: 0.5521
 epoch: 1, train_loss: 1.0065, test_loss: 0.9490, test_f1: 0.5083
 epoch: 2, train_loss: 0.9594, test_loss: 0.9349, test_f1: 0.5260
 epoch: 3, train_loss: 0.9519, test_loss: 0.9248, test_f1: 0.5492
 epoch: 4, train_loss: 0.9261, test_loss: 0.9597, test_f1: 0.5457
 epoch: 5, train_loss: 0.9081, test_loss: 0.8796, test_f1: 0.5321
 epoch: 6, train_loss: 0.8829, test_loss: 0.8788, test_f1: 0.5722
 epoch: 7, train_loss: 0.8625, test_loss: 0.8855, test_f1: 0.5681
 epoch: 8, train_loss: 0.8558, test_loss: 0.8320, test_f1: 0.5847
 epoch: 9, train_loss: 0.8336, test_loss: 0.8122, test_f1: 0.6069
 epoch: 10, train_loss: 0.8293, test_loss: 0.8541, test_f1: 0.6214
 epoch: 11, train_loss: 0.8234, test_loss: 0.8100, test_f1: 0.6176
 epoch: 12, train_loss: 0.7978, test_loss: 0.8607, test_f1: 0.6147
 epoch: 13, train_loss: 0.7988, test_loss: 0.7631, test_f1: 0.6200
 epoch: 14, train_loss: 0.7786, test_loss: 0.8300, test_f1: 0.6132
 epoch: 15, train_loss: 0.7618, test_loss: 0.7706, test_f1: 0.6176
 epoch: 16, train_loss: 0.7677, test_loss: 0.8235, test_f1: 0.6613
 epoch: 17, train_loss: 0.7578, test_loss: 0.8037, test_f1: 0.6609
 epoch: 18, train_loss: 0.7589, test_loss: 0.7922, test_f1: 0.6523
 epoch: 19, train_loss: 0.7449, test_loss: 0.7517, test_f1: 0.6408
 epoch: 20, train_loss: 0.7376, test_loss: 0.7189, test_f1: 0.6370
 epoch: 21, train_loss: 0.7330, test_loss: 0.7737, test_f1: 0.6347
 epoch: 22, train_loss: 0.7226, test_loss: 0.7912, test_f1: 0.6239
 epoch: 23, train_loss: 0.7086, test_loss: 0.8679, test_f1: 0.6122
 epoch: 24, train_loss: 0.7008, test_loss: 0.7437, test_f1: 0.6512
 epoch: 25, train_loss: 0.7050, test_loss: 0.7783, test_f1: 0.6404
 epoch: 26, train_loss: 0.6972, test_loss: 0.7904, test_f1: 0.6223
 epoch: 27, train_loss: 0.6696, test_loss: 0.7971, test_f1: 0.6337
 epoch: 28, train_loss: 0.6742, test_loss: 0.7625, test_f1: 0.6511
 epoch: 29, train_loss: 0.6682, test_loss: 0.8705, test_f1: 0.6470
 epoch: 30, train_loss: 0.6839, test_loss: 0.7969, test_f1: 0.6657
 epoch: 31, train_loss: 0.6665, test_loss: 0.7258, test_f1: 0.6202
 epoch: 32, train_loss: 0.6542, test_loss: 0.8249, test_f1: 0.6528
 epoch: 33, train_loss: 0.6469, test_loss: 0.7678, test_f1: 0.6535
 epoch: 34, train_loss: 0.6396, test_loss: 0.8243, test_f1: 0.6466
 epoch: 35, train_loss: 0.6446, test_loss: 0.7433, test_f1: 0.6539
 epoch: 36, train_loss: 0.6356, test_loss: 0.8088, test_f1: 0.6483
 epoch: 37, train_loss: 0.6524, test_loss: 0.8098, test_f1: 0.6439
 epoch: 38, train_loss: 0.6249, test_loss: 0.8613, test_f1: 0.6401
 epoch: 39, train_loss: 0.6265, test_loss: 0.8934, test_f1: 0.6542
 epoch: 40, train_loss: 0.6277, test_loss: 0.8354, test_f1: 0.6703
 epoch: 41, train_loss: 0.6186, test_loss: 0.8376, test_f1: 0.6436
 epoch: 42, train_loss: 0.6133, test_loss: 0.8516, test_f1: 0.6719
 epoch: 43, train_loss: 0.6005, test_loss: 0.8617, test_f1: 0.6519
 epoch: 44, train_loss: 0.5893, test_loss: 0.8119, test_f1: 0.6795
 epoch: 45, train_loss: 0.5960, test_loss: 0.9018, test_f1: 0.6590
 epoch: 46, train_loss: 0.5810, test_loss: 0.8562, test_f1: 0.6471
 epoch: 47, train_loss: 0.5655, test_loss: 0.8967, test_f1: 0.6619
 epoch: 48, train_loss: 0.5821, test_loss: 0.7893, test_f1: 0.6758
 epoch: 49, train_loss: 0.5690, test_loss: 0.9066, test_f1: 0.6235
 epoch: 50, train_loss: 0.5588, test_loss: 0.8954, test_f1: 0.6740
 epoch: 51, train_loss: 0.5358, test_loss: 0.9152, test_f1: 0.6669
 epoch: 52, train_loss: 0.5253, test_loss: 0.9266, test_f1: 0.6895
 epoch: 53, train_loss: 0.5252, test_loss: 0.9333, test_f1: 0.6746
 epoch: 54, train_loss: 0.5097, test_loss: 0.9526, test_f1: 0.6824
 epoch: 55, train_loss: 0.5117, test_loss: 0.9111, test_f1: 0.6911
 epoch: 56, train_loss: 0.5037, test_loss: 0.9530, test_f1: 0.6792
 epoch: 57, train_loss: 0.5043, test_loss: 0.9230, test_f1: 0.6702
 epoch: 58, train_loss: 0.4984, test_loss: 0.9032, test_f1: 0.6870
 epoch: 59, train_loss: 0.4952, test_loss: 0.9825, test_f1: 0.6713
 epoch: 60, train_loss: 0.4787, test_loss: 1.0498, test_f1: 0.6569
 epoch: 61, train_loss: 0.5070, test_loss: 0.9823, test_f1: 0.6739
 epoch: 62, train_loss: 0.4901, test_loss: 0.9408, test_f1: 0.6609
 epoch: 63, train_loss: 0.4859, test_loss: 0.9862, test_f1: 0.6711
 epoch: 64, train_loss: 0.4801, test_loss: 0.9490, test_f1: 0.6833
 epoch: 65, train_loss: 0.4731, test_loss: 0.9570, test_f1: 0.6719
 epoch: 66, train_loss: 0.4668, test_loss: 0.9727, test_f1: 0.6736
 epoch: 67, train_loss: 0.4687, test_loss: 0.9839, test_f1: 0.6551
 epoch: 68, train_loss: 0.4855, test_loss: 0.9936, test_f1: 0.6765
 epoch: 69, train_loss: 0.4641, test_loss: 1.0057, test_f1: 0.6609
 epoch: 70, train_loss: 0.4718, test_loss: 0.9668, test_f1: 0.6789
 epoch: 71, train_loss: 0.4710, test_loss: 0.9531, test_f1: 0.7115
 epoch: 72, train_loss: 0.4733, test_loss: 1.0408, test_f1: 0.6594
 epoch: 73, train_loss: 0.4617, test_loss: 1.0184, test_f1: 0.6801
 epoch: 74, train_loss: 0.4438, test_loss: 1.0334, test_f1: 0.6831
 epoch: 75, train_loss: 0.4684, test_loss: 1.0525, test_f1: 0.6768
 epoch: 76, train_loss: 0.4521, test_loss: 1.1034, test_f1: 0.6329
 epoch: 77, train_loss: 0.4527, test_loss: 1.0782, test_f1: 0.6661
 epoch: 78, train_loss: 0.4367, test_loss: 1.1359, test_f1: 0.6527
 epoch: 79, train_loss: 0.4579, test_loss: 1.0870, test_f1: 0.6546
 epoch: 80, train_loss: 0.4414, test_loss: 1.0774, test_f1: 0.6760
 epoch: 81, train_loss: 0.4230, test_loss: 1.0567, test_f1: 0.6730
 epoch: 82, train_loss: 0.4416, test_loss: 1.1708, test_f1: 0.6484
 epoch: 83, train_loss: 0.4278, test_loss: 1.0728, test_f1: 0.6652
 epoch: 84, train_loss: 0.4409, test_loss: 1.0816, test_f1: 0.6592
 epoch: 85, train_loss: 0.4193, test_loss: 1.0332, test_f1: 0.6846
 epoch: 86, train_loss: 0.4099, test_loss: 1.0917, test_f1: 0.6874
 epoch: 87, train_loss: 0.4416, test_loss: 1.0590, test_f1: 0.6681
 epoch: 88, train_loss: 0.4338, test_loss: 1.1574, test_f1: 0.6634
 epoch: 89, train_loss: 0.4269, test_loss: 1.2006, test_f1: 0.6623
 epoch: 90, train_loss: 0.4089, test_loss: 1.1875, test_f1: 0.6557
 epoch: 91, train_loss: 0.4242, test_loss: 1.1847, test_f1: 0.6709
 epoch: 92, train_loss: 0.4158, test_loss: 1.1317, test_f1: 0.6659
 epoch: 93, train_loss: 0.4237, test_loss: 1.2144, test_f1: 0.6782
 epoch: 94, train_loss: 0.4147, test_loss: 1.1526, test_f1: 0.6714
 epoch: 95, train_loss: 0.4108, test_loss: 1.2216, test_f1: 0.6817
 epoch: 96, train_loss: 0.4105, test_loss: 1.1758, test_f1: 0.6758
 epoch: 97, train_loss: 0.4222, test_loss: 1.1353, test_f1: 0.6927
 epoch: 98, train_loss: 0.4178, test_loss: 1.1523, test_f1: 0.6982
 epoch: 99, train_loss: 0.4072, test_loss: 1.2263, test_f1: 0.6801
##################ITERATION #7 ****************************************
 epoch: 0, train_loss: 1.2080, test_loss: 1.0166, test_f1: 0.5400
 epoch: 1, train_loss: 0.9752, test_loss: 0.9042, test_f1: 0.5616
 epoch: 2, train_loss: 0.9413, test_loss: 0.9050, test_f1: 0.5337
 epoch: 3, train_loss: 0.9227, test_loss: 0.8396, test_f1: 0.5376
 epoch: 4, train_loss: 0.9016, test_loss: 0.8527, test_f1: 0.5499
 epoch: 5, train_loss: 0.8754, test_loss: 0.8913, test_f1: 0.5674
 epoch: 6, train_loss: 0.8495, test_loss: 0.8181, test_f1: 0.5749
 epoch: 7, train_loss: 0.8481, test_loss: 0.8320, test_f1: 0.5844
 epoch: 8, train_loss: 0.8235, test_loss: 0.8074, test_f1: 0.5719
 epoch: 9, train_loss: 0.8255, test_loss: 0.8756, test_f1: 0.5933
 epoch: 10, train_loss: 0.8083, test_loss: 0.8198, test_f1: 0.5881
 epoch: 11, train_loss: 0.8104, test_loss: 0.8082, test_f1: 0.5763
 epoch: 12, train_loss: 0.7888, test_loss: 0.8202, test_f1: 0.6454
 epoch: 13, train_loss: 0.8012, test_loss: 0.8127, test_f1: 0.6122
 epoch: 14, train_loss: 0.7613, test_loss: 0.7446, test_f1: 0.6123
 epoch: 15, train_loss: 0.7560, test_loss: 0.8594, test_f1: 0.6156
 epoch: 16, train_loss: 0.7415, test_loss: 0.8086, test_f1: 0.6195
 epoch: 17, train_loss: 0.7461, test_loss: 0.7722, test_f1: 0.6187
 epoch: 18, train_loss: 0.7303, test_loss: 0.7454, test_f1: 0.6461
 epoch: 19, train_loss: 0.7107, test_loss: 0.8061, test_f1: 0.6186
 epoch: 20, train_loss: 0.7148, test_loss: 0.8188, test_f1: 0.6288
 epoch: 21, train_loss: 0.6990, test_loss: 0.8021, test_f1: 0.6179
 epoch: 22, train_loss: 0.7061, test_loss: 0.7655, test_f1: 0.6267
 epoch: 23, train_loss: 0.6920, test_loss: 0.7782, test_f1: 0.6524
 epoch: 24, train_loss: 0.6772, test_loss: 0.7811, test_f1: 0.6478
 epoch: 25, train_loss: 0.6759, test_loss: 0.7759, test_f1: 0.6586
 epoch: 26, train_loss: 0.6727, test_loss: 0.7417, test_f1: 0.6684
 epoch: 27, train_loss: 0.6693, test_loss: 0.7912, test_f1: 0.6429
 epoch: 28, train_loss: 0.6553, test_loss: 0.7789, test_f1: 0.6735
 epoch: 29, train_loss: 0.6714, test_loss: 0.7598, test_f1: 0.6553
 epoch: 30, train_loss: 0.6365, test_loss: 0.8084, test_f1: 0.6661
 epoch: 31, train_loss: 0.6503, test_loss: 0.7555, test_f1: 0.6626
 epoch: 32, train_loss: 0.6434, test_loss: 0.7669, test_f1: 0.6814
 epoch: 33, train_loss: 0.6384, test_loss: 0.7127, test_f1: 0.6896
 epoch: 34, train_loss: 0.6147, test_loss: 0.7464, test_f1: 0.6686
 epoch: 35, train_loss: 0.6181, test_loss: 0.8114, test_f1: 0.6489
 epoch: 36, train_loss: 0.6260, test_loss: 0.7804, test_f1: 0.6771
 epoch: 37, train_loss: 0.6181, test_loss: 0.8076, test_f1: 0.6676
 epoch: 38, train_loss: 0.6011, test_loss: 0.8059, test_f1: 0.6693
 epoch: 39, train_loss: 0.5862, test_loss: 0.8662, test_f1: 0.6572
 epoch: 40, train_loss: 0.6069, test_loss: 0.7962, test_f1: 0.6572
 epoch: 41, train_loss: 0.5969, test_loss: 0.7740, test_f1: 0.6717
 epoch: 42, train_loss: 0.5811, test_loss: 0.8388, test_f1: 0.6617
 epoch: 43, train_loss: 0.5691, test_loss: 0.8000, test_f1: 0.6582
 epoch: 44, train_loss: 0.5851, test_loss: 0.8112, test_f1: 0.6708
 epoch: 45, train_loss: 0.5665, test_loss: 0.8766, test_f1: 0.6456
 epoch: 46, train_loss: 0.5663, test_loss: 0.8820, test_f1: 0.6570
 epoch: 47, train_loss: 0.5700, test_loss: 0.9125, test_f1: 0.6629
 epoch: 48, train_loss: 0.5838, test_loss: 0.8458, test_f1: 0.6624
 epoch: 49, train_loss: 0.5361, test_loss: 0.8712, test_f1: 0.6728
 epoch: 50, train_loss: 0.5592, test_loss: 0.8494, test_f1: 0.6662
 epoch: 51, train_loss: 0.5263, test_loss: 0.8794, test_f1: 0.6671
 epoch: 52, train_loss: 0.5043, test_loss: 0.8738, test_f1: 0.6593
 epoch: 53, train_loss: 0.5106, test_loss: 0.8595, test_f1: 0.6695
 epoch: 54, train_loss: 0.5053, test_loss: 0.8604, test_f1: 0.6769
 epoch: 55, train_loss: 0.5070, test_loss: 0.8668, test_f1: 0.6577
 epoch: 56, train_loss: 0.4856, test_loss: 0.8411, test_f1: 0.6816
 epoch: 57, train_loss: 0.4985, test_loss: 0.8769, test_f1: 0.6795
 epoch: 58, train_loss: 0.4932, test_loss: 0.9301, test_f1: 0.7095
 epoch: 59, train_loss: 0.4850, test_loss: 0.8314, test_f1: 0.6772
 epoch: 60, train_loss: 0.4808, test_loss: 0.8927, test_f1: 0.6790
 epoch: 61, train_loss: 0.4839, test_loss: 0.8395, test_f1: 0.6702
 epoch: 62, train_loss: 0.4606, test_loss: 0.8954, test_f1: 0.6741
 epoch: 63, train_loss: 0.4807, test_loss: 0.8764, test_f1: 0.6613
 epoch: 64, train_loss: 0.4758, test_loss: 0.9336, test_f1: 0.6768
 epoch: 65, train_loss: 0.4554, test_loss: 0.8541, test_f1: 0.6807
 epoch: 66, train_loss: 0.4534, test_loss: 0.8955, test_f1: 0.6772
 epoch: 67, train_loss: 0.4640, test_loss: 0.8748, test_f1: 0.6853
 epoch: 68, train_loss: 0.4472, test_loss: 0.9414, test_f1: 0.6779
 epoch: 69, train_loss: 0.4420, test_loss: 0.9431, test_f1: 0.6855
 epoch: 70, train_loss: 0.4459, test_loss: 0.9494, test_f1: 0.6484
 epoch: 71, train_loss: 0.4271, test_loss: 0.9680, test_f1: 0.6542
 epoch: 72, train_loss: 0.4394, test_loss: 0.9751, test_f1: 0.6733
 epoch: 73, train_loss: 0.4283, test_loss: 0.9915, test_f1: 0.6518
 epoch: 74, train_loss: 0.4293, test_loss: 0.9671, test_f1: 0.6745
 epoch: 75, train_loss: 0.4397, test_loss: 0.9808, test_f1: 0.6631
 epoch: 76, train_loss: 0.4367, test_loss: 0.9440, test_f1: 0.6748
 epoch: 77, train_loss: 0.4347, test_loss: 0.9268, test_f1: 0.6802
 epoch: 78, train_loss: 0.4260, test_loss: 0.9948, test_f1: 0.6709
 epoch: 79, train_loss: 0.4189, test_loss: 0.9736, test_f1: 0.6422
 epoch: 80, train_loss: 0.4244, test_loss: 1.0457, test_f1: 0.6568
 epoch: 81, train_loss: 0.4061, test_loss: 1.0192, test_f1: 0.6843
 epoch: 82, train_loss: 0.4133, test_loss: 1.0420, test_f1: 0.6732
 epoch: 83, train_loss: 0.4381, test_loss: 1.0333, test_f1: 0.6780
 epoch: 84, train_loss: 0.4046, test_loss: 1.0708, test_f1: 0.6493
 epoch: 85, train_loss: 0.4271, test_loss: 1.0032, test_f1: 0.6561
 epoch: 86, train_loss: 0.4031, test_loss: 0.9952, test_f1: 0.6642
 epoch: 87, train_loss: 0.4078, test_loss: 1.0306, test_f1: 0.6656
 epoch: 88, train_loss: 0.4077, test_loss: 1.0067, test_f1: 0.6690
 epoch: 89, train_loss: 0.4029, test_loss: 1.1286, test_f1: 0.6704
 epoch: 90, train_loss: 0.4069, test_loss: 1.0655, test_f1: 0.6546
 epoch: 91, train_loss: 0.3909, test_loss: 1.0192, test_f1: 0.6672
 epoch: 92, train_loss: 0.4010, test_loss: 1.0746, test_f1: 0.6744
 epoch: 93, train_loss: 0.3898, test_loss: 1.1186, test_f1: 0.6777
 epoch: 94, train_loss: 0.3924, test_loss: 1.1158, test_f1: 0.6940
 epoch: 95, train_loss: 0.3716, test_loss: 1.0677, test_f1: 0.6805
 epoch: 96, train_loss: 0.3924, test_loss: 1.0507, test_f1: 0.6859
 epoch: 97, train_loss: 0.3830, test_loss: 1.0446, test_f1: 0.6800
 epoch: 98, train_loss: 0.3785, test_loss: 1.1120, test_f1: 0.6798
 epoch: 99, train_loss: 0.3659, test_loss: 1.1423, test_f1: 0.6719
##################ITERATION #8 ****************************************
 epoch: 0, train_loss: 1.1982, test_loss: 0.9743, test_f1: 0.4656
 epoch: 1, train_loss: 0.9848, test_loss: 0.9680, test_f1: 0.4667
 epoch: 2, train_loss: 0.9514, test_loss: 0.9529, test_f1: 0.5088
 epoch: 3, train_loss: 0.9277, test_loss: 0.9218, test_f1: 0.5141
 epoch: 4, train_loss: 0.9101, test_loss: 0.9242, test_f1: 0.5165
 epoch: 5, train_loss: 0.8982, test_loss: 0.8567, test_f1: 0.5250
 epoch: 6, train_loss: 0.8829, test_loss: 0.8863, test_f1: 0.5344
 epoch: 7, train_loss: 0.8631, test_loss: 0.8673, test_f1: 0.5833
 epoch: 8, train_loss: 0.8527, test_loss: 0.8202, test_f1: 0.5657
 epoch: 9, train_loss: 0.8350, test_loss: 0.8693, test_f1: 0.6011
 epoch: 10, train_loss: 0.8159, test_loss: 0.8747, test_f1: 0.5468
 epoch: 11, train_loss: 0.7935, test_loss: 0.8295, test_f1: 0.6147
 epoch: 12, train_loss: 0.7892, test_loss: 0.8136, test_f1: 0.6106
 epoch: 13, train_loss: 0.7945, test_loss: 0.7956, test_f1: 0.6305
 epoch: 14, train_loss: 0.7788, test_loss: 0.8369, test_f1: 0.6237
 epoch: 15, train_loss: 0.7681, test_loss: 0.8474, test_f1: 0.6378
 epoch: 16, train_loss: 0.7570, test_loss: 0.8000, test_f1: 0.6241
 epoch: 17, train_loss: 0.7565, test_loss: 0.8416, test_f1: 0.6214
 epoch: 18, train_loss: 0.7311, test_loss: 0.8111, test_f1: 0.6354
 epoch: 19, train_loss: 0.7290, test_loss: 0.8041, test_f1: 0.6453
 epoch: 20, train_loss: 0.7403, test_loss: 0.7775, test_f1: 0.6640
 epoch: 21, train_loss: 0.7233, test_loss: 0.8208, test_f1: 0.6163
 epoch: 22, train_loss: 0.7195, test_loss: 0.7949, test_f1: 0.6332
 epoch: 23, train_loss: 0.6904, test_loss: 0.7649, test_f1: 0.6443
 epoch: 24, train_loss: 0.6837, test_loss: 0.8095, test_f1: 0.6487
 epoch: 25, train_loss: 0.6770, test_loss: 0.8487, test_f1: 0.6513
 epoch: 26, train_loss: 0.6846, test_loss: 0.8189, test_f1: 0.6691
 epoch: 27, train_loss: 0.6781, test_loss: 0.7989, test_f1: 0.6170
 epoch: 28, train_loss: 0.6818, test_loss: 0.8400, test_f1: 0.6552
 epoch: 29, train_loss: 0.6752, test_loss: 0.8807, test_f1: 0.6512
 epoch: 30, train_loss: 0.6550, test_loss: 0.8505, test_f1: 0.6404
 epoch: 31, train_loss: 0.6572, test_loss: 0.8439, test_f1: 0.6329
 epoch: 32, train_loss: 0.6563, test_loss: 0.8102, test_f1: 0.6586
 epoch: 33, train_loss: 0.6263, test_loss: 0.8315, test_f1: 0.6635
 epoch: 34, train_loss: 0.6321, test_loss: 0.8925, test_f1: 0.6332
 epoch: 35, train_loss: 0.6140, test_loss: 0.8326, test_f1: 0.6563
 epoch: 36, train_loss: 0.6002, test_loss: 0.8340, test_f1: 0.6722
 epoch: 37, train_loss: 0.6001, test_loss: 0.8935, test_f1: 0.6649
 epoch: 38, train_loss: 0.6173, test_loss: 0.8116, test_f1: 0.6738
 epoch: 39, train_loss: 0.5979, test_loss: 0.8499, test_f1: 0.6832
 epoch: 40, train_loss: 0.6006, test_loss: 0.8066, test_f1: 0.6569
 epoch: 41, train_loss: 0.5846, test_loss: 0.8355, test_f1: 0.6590
 epoch: 42, train_loss: 0.6005, test_loss: 0.8077, test_f1: 0.6720
 epoch: 43, train_loss: 0.5891, test_loss: 0.8508, test_f1: 0.6523
 epoch: 44, train_loss: 0.5695, test_loss: 0.8145, test_f1: 0.6799
 epoch: 45, train_loss: 0.5680, test_loss: 0.8618, test_f1: 0.6553
 epoch: 46, train_loss: 0.5627, test_loss: 0.8997, test_f1: 0.6717
 epoch: 47, train_loss: 0.5724, test_loss: 0.8577, test_f1: 0.6724
 epoch: 48, train_loss: 0.5704, test_loss: 0.8622, test_f1: 0.6456
 epoch: 49, train_loss: 0.5561, test_loss: 0.8677, test_f1: 0.6555
 epoch: 50, train_loss: 0.5423, test_loss: 0.8141, test_f1: 0.6726
 epoch: 51, train_loss: 0.5132, test_loss: 0.8964, test_f1: 0.6778
 epoch: 52, train_loss: 0.4940, test_loss: 0.9498, test_f1: 0.6622
 epoch: 53, train_loss: 0.5024, test_loss: 0.8796, test_f1: 0.6804
 epoch: 54, train_loss: 0.4904, test_loss: 0.9033, test_f1: 0.6763
 epoch: 55, train_loss: 0.5033, test_loss: 0.8819, test_f1: 0.6890
 epoch: 56, train_loss: 0.4801, test_loss: 0.8642, test_f1: 0.6913
 epoch: 57, train_loss: 0.4784, test_loss: 0.9675, test_f1: 0.6719
 epoch: 58, train_loss: 0.4833, test_loss: 0.8381, test_f1: 0.6706
 epoch: 59, train_loss: 0.4629, test_loss: 0.8662, test_f1: 0.6866
 epoch: 60, train_loss: 0.4750, test_loss: 0.9323, test_f1: 0.6892
 epoch: 61, train_loss: 0.4695, test_loss: 0.9279, test_f1: 0.6918
 epoch: 62, train_loss: 0.4764, test_loss: 0.8939, test_f1: 0.6800
 epoch: 63, train_loss: 0.4678, test_loss: 0.8943, test_f1: 0.6952
 epoch: 64, train_loss: 0.4371, test_loss: 0.9873, test_f1: 0.6880
 epoch: 65, train_loss: 0.4543, test_loss: 0.9872, test_f1: 0.6568
 epoch: 66, train_loss: 0.4499, test_loss: 1.0162, test_f1: 0.6636
 epoch: 67, train_loss: 0.4660, test_loss: 0.9725, test_f1: 0.6658
 epoch: 68, train_loss: 0.4489, test_loss: 0.9612, test_f1: 0.6650
 epoch: 69, train_loss: 0.4475, test_loss: 0.9371, test_f1: 0.6676
 epoch: 70, train_loss: 0.4563, test_loss: 0.9560, test_f1: 0.7016
 epoch: 71, train_loss: 0.4439, test_loss: 0.9945, test_f1: 0.6722
 epoch: 72, train_loss: 0.4293, test_loss: 0.9508, test_f1: 0.6637
 epoch: 73, train_loss: 0.4299, test_loss: 1.0436, test_f1: 0.6565
 epoch: 74, train_loss: 0.4335, test_loss: 0.9730, test_f1: 0.6723
 epoch: 75, train_loss: 0.4244, test_loss: 1.0230, test_f1: 0.6756
 epoch: 76, train_loss: 0.4409, test_loss: 0.9984, test_f1: 0.6719
 epoch: 77, train_loss: 0.4314, test_loss: 1.0203, test_f1: 0.6532
 epoch: 78, train_loss: 0.4333, test_loss: 0.9727, test_f1: 0.6789
 epoch: 79, train_loss: 0.4095, test_loss: 1.0707, test_f1: 0.6583
 epoch: 80, train_loss: 0.4262, test_loss: 0.9599, test_f1: 0.6745
 epoch: 81, train_loss: 0.4124, test_loss: 1.0377, test_f1: 0.6973
 epoch: 82, train_loss: 0.4098, test_loss: 1.0631, test_f1: 0.6714
 epoch: 83, train_loss: 0.4259, test_loss: 1.0479, test_f1: 0.6585
 epoch: 84, train_loss: 0.4292, test_loss: 1.0548, test_f1: 0.6492
 epoch: 85, train_loss: 0.4113, test_loss: 1.0037, test_f1: 0.6554
 epoch: 86, train_loss: 0.4176, test_loss: 1.0120, test_f1: 0.6543
 epoch: 87, train_loss: 0.4013, test_loss: 1.0885, test_f1: 0.6459
 epoch: 88, train_loss: 0.3854, test_loss: 1.1112, test_f1: 0.6663
 epoch: 89, train_loss: 0.4006, test_loss: 0.9885, test_f1: 0.6878
 epoch: 90, train_loss: 0.4132, test_loss: 1.0970, test_f1: 0.6576
 epoch: 91, train_loss: 0.4264, test_loss: 0.9855, test_f1: 0.6688
 epoch: 92, train_loss: 0.3884, test_loss: 1.0597, test_f1: 0.6710
 epoch: 93, train_loss: 0.3864, test_loss: 1.0271, test_f1: 0.6709
 epoch: 94, train_loss: 0.4008, test_loss: 1.0371, test_f1: 0.6673
 epoch: 95, train_loss: 0.3870, test_loss: 1.1797, test_f1: 0.6348
 epoch: 96, train_loss: 0.4019, test_loss: 1.1001, test_f1: 0.6528
 epoch: 97, train_loss: 0.3957, test_loss: 1.1187, test_f1: 0.6469
 epoch: 98, train_loss: 0.3757, test_loss: 1.0663, test_f1: 0.6410
 epoch: 99, train_loss: 0.3862, test_loss: 1.1014, test_f1: 0.6613
##################ITERATION #9 ****************************************
 epoch: 0, train_loss: 1.1933, test_loss: 1.0260, test_f1: 0.4631
 epoch: 1, train_loss: 0.9911, test_loss: 0.9722, test_f1: 0.4864
 epoch: 2, train_loss: 0.9465, test_loss: 0.9229, test_f1: 0.5063
 epoch: 3, train_loss: 0.9384, test_loss: 0.9012, test_f1: 0.5256
 epoch: 4, train_loss: 0.8979, test_loss: 0.9060, test_f1: 0.5099
 epoch: 5, train_loss: 0.8999, test_loss: 0.8774, test_f1: 0.5496
 epoch: 6, train_loss: 0.8868, test_loss: 0.8819, test_f1: 0.5521
 epoch: 7, train_loss: 0.8709, test_loss: 0.8968, test_f1: 0.5574
 epoch: 8, train_loss: 0.8452, test_loss: 0.8346, test_f1: 0.5762
 epoch: 9, train_loss: 0.8415, test_loss: 0.7943, test_f1: 0.5817
 epoch: 10, train_loss: 0.8304, test_loss: 0.9089, test_f1: 0.5239
 epoch: 11, train_loss: 0.8086, test_loss: 0.8530, test_f1: 0.5721
 epoch: 12, train_loss: 0.7904, test_loss: 0.7747, test_f1: 0.6133
 epoch: 13, train_loss: 0.7836, test_loss: 0.8495, test_f1: 0.5736
 epoch: 14, train_loss: 0.7673, test_loss: 0.8449, test_f1: 0.5775
 epoch: 15, train_loss: 0.7668, test_loss: 0.7860, test_f1: 0.6091
 epoch: 16, train_loss: 0.7646, test_loss: 0.7734, test_f1: 0.6248
 epoch: 17, train_loss: 0.7499, test_loss: 0.7357, test_f1: 0.6168
 epoch: 18, train_loss: 0.7486, test_loss: 0.7647, test_f1: 0.6221
 epoch: 19, train_loss: 0.7483, test_loss: 0.7167, test_f1: 0.6360
 epoch: 20, train_loss: 0.7261, test_loss: 0.8112, test_f1: 0.6415
 epoch: 21, train_loss: 0.7085, test_loss: 0.8623, test_f1: 0.6375
 epoch: 22, train_loss: 0.7025, test_loss: 0.8281, test_f1: 0.6352
 epoch: 23, train_loss: 0.6870, test_loss: 0.7540, test_f1: 0.6443
 epoch: 24, train_loss: 0.6736, test_loss: 0.7256, test_f1: 0.6485
 epoch: 25, train_loss: 0.6752, test_loss: 0.6646, test_f1: 0.6770
 epoch: 26, train_loss: 0.6758, test_loss: 0.7759, test_f1: 0.6428
 epoch: 27, train_loss: 0.6682, test_loss: 0.7449, test_f1: 0.6678
 epoch: 28, train_loss: 0.6562, test_loss: 0.7851, test_f1: 0.6854
 epoch: 29, train_loss: 0.6585, test_loss: 0.7567, test_f1: 0.7027
 epoch: 30, train_loss: 0.6350, test_loss: 0.7643, test_f1: 0.6655
 epoch: 31, train_loss: 0.6659, test_loss: 0.7114, test_f1: 0.6642
 epoch: 32, train_loss: 0.6357, test_loss: 0.7575, test_f1: 0.6252
 epoch: 33, train_loss: 0.6408, test_loss: 0.6826, test_f1: 0.6735
 epoch: 34, train_loss: 0.6113, test_loss: 0.7584, test_f1: 0.6851
 epoch: 35, train_loss: 0.6217, test_loss: 0.7038, test_f1: 0.6971
 epoch: 36, train_loss: 0.6109, test_loss: 0.7793, test_f1: 0.6697
 epoch: 37, train_loss: 0.5860, test_loss: 0.7761, test_f1: 0.6822
 epoch: 38, train_loss: 0.6043, test_loss: 0.7261, test_f1: 0.6784
 epoch: 39, train_loss: 0.5989, test_loss: 0.7630, test_f1: 0.6822
 epoch: 40, train_loss: 0.5939, test_loss: 0.8278, test_f1: 0.6549
 epoch: 41, train_loss: 0.6225, test_loss: 0.8009, test_f1: 0.6682
 epoch: 42, train_loss: 0.5826, test_loss: 0.8210, test_f1: 0.6729
 epoch: 43, train_loss: 0.5856, test_loss: 0.8503, test_f1: 0.6539
 epoch: 44, train_loss: 0.5735, test_loss: 0.8150, test_f1: 0.6565
 epoch: 45, train_loss: 0.5614, test_loss: 0.8494, test_f1: 0.6609
 epoch: 46, train_loss: 0.5756, test_loss: 0.7976, test_f1: 0.6549
 epoch: 47, train_loss: 0.5607, test_loss: 0.8291, test_f1: 0.6958
 epoch: 48, train_loss: 0.5667, test_loss: 0.7845, test_f1: 0.6610
 epoch: 49, train_loss: 0.5632, test_loss: 0.8478, test_f1: 0.6765
 epoch: 50, train_loss: 0.5318, test_loss: 0.9486, test_f1: 0.6472
 epoch: 51, train_loss: 0.5292, test_loss: 0.8335, test_f1: 0.6975
 epoch: 52, train_loss: 0.4984, test_loss: 0.7937, test_f1: 0.6834
 epoch: 53, train_loss: 0.5182, test_loss: 0.9030, test_f1: 0.6847
 epoch: 54, train_loss: 0.5033, test_loss: 0.8286, test_f1: 0.7023
 epoch: 55, train_loss: 0.4847, test_loss: 0.8607, test_f1: 0.7002
 epoch: 56, train_loss: 0.5077, test_loss: 0.8082, test_f1: 0.6852
 epoch: 57, train_loss: 0.4795, test_loss: 0.8599, test_f1: 0.6817
 epoch: 58, train_loss: 0.4847, test_loss: 0.8158, test_f1: 0.7061
 epoch: 59, train_loss: 0.4863, test_loss: 0.8662, test_f1: 0.7156
 epoch: 60, train_loss: 0.4809, test_loss: 0.8630, test_f1: 0.6852
 epoch: 61, train_loss: 0.4740, test_loss: 0.8750, test_f1: 0.7205
 epoch: 62, train_loss: 0.4609, test_loss: 0.9180, test_f1: 0.6990
 epoch: 63, train_loss: 0.4597, test_loss: 0.8732, test_f1: 0.6947
 epoch: 64, train_loss: 0.4632, test_loss: 0.9354, test_f1: 0.7059
 epoch: 65, train_loss: 0.4467, test_loss: 0.9159, test_f1: 0.7248
 epoch: 66, train_loss: 0.4446, test_loss: 0.8725, test_f1: 0.7175
 epoch: 67, train_loss: 0.4580, test_loss: 0.9650, test_f1: 0.7008
 epoch: 68, train_loss: 0.4605, test_loss: 0.8910, test_f1: 0.7054
 epoch: 69, train_loss: 0.4437, test_loss: 0.9767, test_f1: 0.6845
 epoch: 70, train_loss: 0.4507, test_loss: 0.9091, test_f1: 0.6994
 epoch: 71, train_loss: 0.4446, test_loss: 0.9085, test_f1: 0.7095
 epoch: 72, train_loss: 0.4283, test_loss: 0.9264, test_f1: 0.6793
 epoch: 73, train_loss: 0.4361, test_loss: 0.9493, test_f1: 0.6967
 epoch: 74, train_loss: 0.4504, test_loss: 0.8532, test_f1: 0.6933
 epoch: 75, train_loss: 0.4263, test_loss: 0.8939, test_f1: 0.7127
 epoch: 76, train_loss: 0.4339, test_loss: 0.9044, test_f1: 0.6909
 epoch: 77, train_loss: 0.4402, test_loss: 0.9929, test_f1: 0.6867
 epoch: 78, train_loss: 0.4265, test_loss: 0.9821, test_f1: 0.7001
 epoch: 79, train_loss: 0.4272, test_loss: 1.0087, test_f1: 0.7007
 epoch: 80, train_loss: 0.4138, test_loss: 0.9889, test_f1: 0.6794
 epoch: 81, train_loss: 0.4297, test_loss: 0.9823, test_f1: 0.7056
 epoch: 82, train_loss: 0.4140, test_loss: 1.0006, test_f1: 0.6979
 epoch: 83, train_loss: 0.4210, test_loss: 0.9701, test_f1: 0.6908
 epoch: 84, train_loss: 0.4031, test_loss: 1.0140, test_f1: 0.6670
 epoch: 85, train_loss: 0.4172, test_loss: 1.0151, test_f1: 0.6830
 epoch: 86, train_loss: 0.4251, test_loss: 0.8911, test_f1: 0.6941
 epoch: 87, train_loss: 0.4032, test_loss: 0.9104, test_f1: 0.6917
 epoch: 88, train_loss: 0.4031, test_loss: 0.9590, test_f1: 0.7014
 epoch: 89, train_loss: 0.3908, test_loss: 1.0082, test_f1: 0.6956
 epoch: 90, train_loss: 0.4291, test_loss: 1.0466, test_f1: 0.6929
 epoch: 91, train_loss: 0.4217, test_loss: 1.0232, test_f1: 0.7012
 epoch: 92, train_loss: 0.4098, test_loss: 1.0862, test_f1: 0.6825
 epoch: 93, train_loss: 0.4126, test_loss: 1.0942, test_f1: 0.6859
 epoch: 94, train_loss: 0.3978, test_loss: 1.0455, test_f1: 0.6793
 epoch: 95, train_loss: 0.3969, test_loss: 1.0635, test_f1: 0.6856
 epoch: 96, train_loss: 0.4071, test_loss: 1.0200, test_f1: 0.7066
 epoch: 97, train_loss: 0.3771, test_loss: 1.0563, test_f1: 0.6901
 epoch: 98, train_loss: 0.3788, test_loss: 1.0406, test_f1: 0.6598
 epoch: 99, train_loss: 0.3871, test_loss: 1.0587, test_f1: 0.6868

Training completed in 812.95 seconds
Best F1: 0.7323 at epoch 87
Mean F1 across iterations: 0.7054  0.0140
========================FINAL RESULTS================================
FEGIN weighted F1: 0.7323  0.0140
python main.py --data ltspice_examples --representation component_pin_net --model FEGIN --layers 2 --hiddens 64 --batch_size 32 --lr 0.001 --emb_size 128 --epochs 100 --save_appendix component_pin_net_L2_H64_BS32_LR0.001_E128 --no_val
-----



STDERR:
  File "main.py", line 370, in <module>
    main()
  File "main.py", line 254, in main
    dataset = dataset_class(
  File "/home/philip/projects/ltspice_examples_code_repo/Circuit-Completion-Using-GNNs/component_classification_with_link_prediction_head/evaluation/FEGIN/kernel/circuit_datasets.py", line 15, in __init__
    self.data, self.slices = torch.load(self.processed_paths[0])
  File "/home/philip/.local/lib/python3.8/site-packages/torch/serialization.py", line 1040, in load
    warnings.warn(
  File "/usr/lib/python3.8/warnings.py", line 109, in _showwarnmsg
    sw(msg.message, msg.category, msg.filename, msg.lineno,
  File "main.py", line 47, in warn_with_traceback
    traceback.print_stack(file=log)
/home/philip/projects/ltspice_examples_code_repo/Circuit-Completion-Using-GNNs/component_classification_with_link_prediction_head/evaluation/FEGIN/kernel/circuit_datasets.py:15: FutureWarning: You are using `torch.load` with `weights_only=False` (the current default value), which uses the default pickle module implicitly. It is possible to construct malicious pickle data which will execute arbitrary code during unpickling (See https://github.com/pytorch/pytorch/blob/main/SECURITY.md#untrusted-models for more details). In a future release, the default value for `weights_only` will be flipped to `True`. This limits the functions that could be executed during unpickling. Arbitrary objects will no longer be allowed to be loaded via this mode unless they are explicitly allowlisted by the user via `torch.serialization.add_safe_globals`. We recommend you start setting `weights_only=True` for any use case where you don't have full control of the loaded file. Please open an issue on GitHub for any issues related to this experimental feature.
  self.data, self.slices = torch.load(self.processed_paths[0])
