STDOUT:
Results will be saved in /home/philip/projects/ltspice_examples_code_repo/Circuit-Completion-Using-GNNs/component_classification_with_link_prediction_head/evaluation/FEGIN/results/model_FEGIN_dataset_ltspice_examples
Command line input: python main.py --data ltspice_examples --representation component_pin_net --model FEGIN --layers 2 --hiddens 64 --batch_size 256 --lr 0.0001 --emb_size 250 --epochs 100 --save_appendix component_pin_net_L2_H64_BS256_LR0.0001_E250 --no_val
 is saved.
-----
ltspice_examples - FEGIN
Using 2 layers, 64 hidden units, h = 2
Loading component_pin_net representation dataset
ENTERED
Training FEGIN on component_pin_net representation
Train: 3558, Test: 846
##################ITERATION #0 ****************************************
 epoch: 0, train_loss: 1.3938, test_loss: 1.3924, test_f1: 0.1004
 epoch: 1, train_loss: 1.3854, test_loss: 1.3878, test_f1: 0.1004
 epoch: 2, train_loss: 1.3799, test_loss: 1.3824, test_f1: 0.1004
 epoch: 3, train_loss: 1.3731, test_loss: 1.3739, test_f1: 0.1162
 epoch: 4, train_loss: 1.3657, test_loss: 1.3633, test_f1: 0.1264
 epoch: 5, train_loss: 1.3557, test_loss: 1.3520, test_f1: 0.1471
 epoch: 6, train_loss: 1.3466, test_loss: 1.3395, test_f1: 0.2654
 epoch: 7, train_loss: 1.3338, test_loss: 1.3258, test_f1: 0.2777
 epoch: 8, train_loss: 1.3191, test_loss: 1.3113, test_f1: 0.2586
 epoch: 9, train_loss: 1.3049, test_loss: 1.2959, test_f1: 0.2555
 epoch: 10, train_loss: 1.2914, test_loss: 1.2800, test_f1: 0.2304
 epoch: 11, train_loss: 1.2741, test_loss: 1.2643, test_f1: 0.2302
 epoch: 12, train_loss: 1.2608, test_loss: 1.2503, test_f1: 0.2295
 epoch: 13, train_loss: 1.2504, test_loss: 1.2367, test_f1: 0.2270
 epoch: 14, train_loss: 1.2345, test_loss: 1.2237, test_f1: 0.2270
 epoch: 15, train_loss: 1.2271, test_loss: 1.2115, test_f1: 0.2270
 epoch: 16, train_loss: 1.2158, test_loss: 1.1998, test_f1: 0.2270
 epoch: 17, train_loss: 1.2086, test_loss: 1.1895, test_f1: 0.2679
 epoch: 18, train_loss: 1.1965, test_loss: 1.1791, test_f1: 0.2979
 epoch: 19, train_loss: 1.1889, test_loss: 1.1689, test_f1: 0.3155
 epoch: 20, train_loss: 1.1786, test_loss: 1.1590, test_f1: 0.3460
 epoch: 21, train_loss: 1.1732, test_loss: 1.1489, test_f1: 0.3673
 epoch: 22, train_loss: 1.1622, test_loss: 1.1386, test_f1: 0.3912
 epoch: 23, train_loss: 1.1538, test_loss: 1.1292, test_f1: 0.4076
 epoch: 24, train_loss: 1.1431, test_loss: 1.1191, test_f1: 0.4161
 epoch: 25, train_loss: 1.1345, test_loss: 1.1078, test_f1: 0.4243
 epoch: 26, train_loss: 1.1257, test_loss: 1.0975, test_f1: 0.4601
 epoch: 27, train_loss: 1.1122, test_loss: 1.0852, test_f1: 0.4577
 epoch: 28, train_loss: 1.1036, test_loss: 1.0737, test_f1: 0.4577
 epoch: 29, train_loss: 1.0920, test_loss: 1.0634, test_f1: 0.4778
 epoch: 30, train_loss: 1.0802, test_loss: 1.0532, test_f1: 0.4749
 epoch: 31, train_loss: 1.0726, test_loss: 1.0443, test_f1: 0.4768
 epoch: 32, train_loss: 1.0593, test_loss: 1.0341, test_f1: 0.4810
 epoch: 33, train_loss: 1.0567, test_loss: 1.0264, test_f1: 0.4800
 epoch: 34, train_loss: 1.0396, test_loss: 1.0196, test_f1: 0.4870
 epoch: 35, train_loss: 1.0377, test_loss: 1.0139, test_f1: 0.4853
 epoch: 36, train_loss: 1.0272, test_loss: 1.0068, test_f1: 0.4915
 epoch: 37, train_loss: 1.0180, test_loss: 1.0009, test_f1: 0.4955
 epoch: 38, train_loss: 1.0171, test_loss: 0.9982, test_f1: 0.4986
 epoch: 39, train_loss: 1.0049, test_loss: 0.9926, test_f1: 0.4975
 epoch: 40, train_loss: 1.0048, test_loss: 0.9917, test_f1: 0.4996
 epoch: 41, train_loss: 0.9966, test_loss: 0.9863, test_f1: 0.5043
 epoch: 42, train_loss: 0.9933, test_loss: 0.9831, test_f1: 0.5020
 epoch: 43, train_loss: 0.9904, test_loss: 0.9799, test_f1: 0.5041
 epoch: 44, train_loss: 0.9886, test_loss: 0.9791, test_f1: 0.5000
 epoch: 45, train_loss: 0.9858, test_loss: 0.9775, test_f1: 0.5053
 epoch: 46, train_loss: 0.9763, test_loss: 0.9715, test_f1: 0.5050
 epoch: 47, train_loss: 0.9774, test_loss: 0.9681, test_f1: 0.4953
 epoch: 48, train_loss: 0.9730, test_loss: 0.9657, test_f1: 0.5083
 epoch: 49, train_loss: 0.9757, test_loss: 0.9638, test_f1: 0.4981
 epoch: 50, train_loss: 0.9658, test_loss: 0.9688, test_f1: 0.5036
 epoch: 51, train_loss: 0.9619, test_loss: 0.9607, test_f1: 0.5061
 epoch: 52, train_loss: 0.9669, test_loss: 0.9593, test_f1: 0.5028
 epoch: 53, train_loss: 0.9637, test_loss: 0.9579, test_f1: 0.5028
 epoch: 54, train_loss: 0.9580, test_loss: 0.9573, test_f1: 0.5056
 epoch: 55, train_loss: 0.9578, test_loss: 0.9556, test_f1: 0.5066
 epoch: 56, train_loss: 0.9608, test_loss: 0.9552, test_f1: 0.5066
 epoch: 57, train_loss: 0.9561, test_loss: 0.9541, test_f1: 0.5047
 epoch: 58, train_loss: 0.9537, test_loss: 0.9526, test_f1: 0.5094
 epoch: 59, train_loss: 0.9547, test_loss: 0.9553, test_f1: 0.5051
 epoch: 60, train_loss: 0.9566, test_loss: 0.9523, test_f1: 0.5032
 epoch: 61, train_loss: 0.9527, test_loss: 0.9504, test_f1: 0.5097
 epoch: 62, train_loss: 0.9569, test_loss: 0.9523, test_f1: 0.5058
 epoch: 63, train_loss: 0.9507, test_loss: 0.9490, test_f1: 0.5169
 epoch: 64, train_loss: 0.9493, test_loss: 0.9476, test_f1: 0.5151
 epoch: 65, train_loss: 0.9485, test_loss: 0.9476, test_f1: 0.5118
 epoch: 66, train_loss: 0.9481, test_loss: 0.9499, test_f1: 0.5127
 epoch: 67, train_loss: 0.9489, test_loss: 0.9444, test_f1: 0.5143
 epoch: 68, train_loss: 0.9426, test_loss: 0.9445, test_f1: 0.5035
 epoch: 69, train_loss: 0.9457, test_loss: 0.9435, test_f1: 0.5045
 epoch: 70, train_loss: 0.9472, test_loss: 0.9434, test_f1: 0.5138
 epoch: 71, train_loss: 0.9380, test_loss: 0.9448, test_f1: 0.5135
 epoch: 72, train_loss: 0.9401, test_loss: 0.9427, test_f1: 0.5186
 epoch: 73, train_loss: 0.9392, test_loss: 0.9384, test_f1: 0.5179
 epoch: 74, train_loss: 0.9461, test_loss: 0.9372, test_f1: 0.5090
 epoch: 75, train_loss: 0.9332, test_loss: 0.9375, test_f1: 0.5024
 epoch: 76, train_loss: 0.9385, test_loss: 0.9353, test_f1: 0.5098
 epoch: 77, train_loss: 0.9345, test_loss: 0.9352, test_f1: 0.5103
 epoch: 78, train_loss: 0.9391, test_loss: 0.9332, test_f1: 0.5132
 epoch: 79, train_loss: 0.9327, test_loss: 0.9361, test_f1: 0.5075
 epoch: 80, train_loss: 0.9339, test_loss: 0.9360, test_f1: 0.5117
 epoch: 81, train_loss: 0.9275, test_loss: 0.9341, test_f1: 0.5118
 epoch: 82, train_loss: 0.9272, test_loss: 0.9331, test_f1: 0.5150
 epoch: 83, train_loss: 0.9281, test_loss: 0.9290, test_f1: 0.5095
 epoch: 84, train_loss: 0.9327, test_loss: 0.9312, test_f1: 0.5175
 epoch: 85, train_loss: 0.9309, test_loss: 0.9363, test_f1: 0.5178
 epoch: 86, train_loss: 0.9281, test_loss: 0.9316, test_f1: 0.5087
 epoch: 87, train_loss: 0.9295, test_loss: 0.9311, test_f1: 0.5147
 epoch: 88, train_loss: 0.9264, test_loss: 0.9321, test_f1: 0.5154
 epoch: 89, train_loss: 0.9225, test_loss: 0.9280, test_f1: 0.5242
 epoch: 90, train_loss: 0.9216, test_loss: 0.9295, test_f1: 0.5169
 epoch: 91, train_loss: 0.9264, test_loss: 0.9272, test_f1: 0.5166
 epoch: 92, train_loss: 0.9203, test_loss: 0.9296, test_f1: 0.5115
 epoch: 93, train_loss: 0.9147, test_loss: 0.9268, test_f1: 0.5150
 epoch: 94, train_loss: 0.9181, test_loss: 0.9265, test_f1: 0.5178
 epoch: 95, train_loss: 0.9192, test_loss: 0.9263, test_f1: 0.5144
 epoch: 96, train_loss: 0.9225, test_loss: 0.9232, test_f1: 0.5236
 epoch: 97, train_loss: 0.9135, test_loss: 0.9256, test_f1: 0.5263
 epoch: 98, train_loss: 0.9079, test_loss: 0.9208, test_f1: 0.5198
 epoch: 99, train_loss: 0.9144, test_loss: 0.9218, test_f1: 0.5223
##################ITERATION #1 ****************************************
 epoch: 0, train_loss: 1.3556, test_loss: 1.3668, test_f1: 0.1004
 epoch: 1, train_loss: 1.3351, test_loss: 1.3582, test_f1: 0.1004
 epoch: 2, train_loss: 1.3219, test_loss: 1.3467, test_f1: 0.2116
 epoch: 3, train_loss: 1.3073, test_loss: 1.3256, test_f1: 0.2520
 epoch: 4, train_loss: 1.2900, test_loss: 1.2912, test_f1: 0.2425
 epoch: 5, train_loss: 1.2745, test_loss: 1.2616, test_f1: 0.3158
 epoch: 6, train_loss: 1.2558, test_loss: 1.2370, test_f1: 0.3499
 epoch: 7, train_loss: 1.2353, test_loss: 1.2149, test_f1: 0.3403
 epoch: 8, train_loss: 1.2176, test_loss: 1.1938, test_f1: 0.3432
 epoch: 9, train_loss: 1.1999, test_loss: 1.1734, test_f1: 0.3460
 epoch: 10, train_loss: 1.1817, test_loss: 1.1540, test_f1: 0.3460
 epoch: 11, train_loss: 1.1639, test_loss: 1.1360, test_f1: 0.3460
 epoch: 12, train_loss: 1.1471, test_loss: 1.1200, test_f1: 0.3448
 epoch: 13, train_loss: 1.1313, test_loss: 1.1042, test_f1: 0.3438
 epoch: 14, train_loss: 1.1153, test_loss: 1.0905, test_f1: 0.3429
 epoch: 15, train_loss: 1.1055, test_loss: 1.0789, test_f1: 0.3428
 epoch: 16, train_loss: 1.0892, test_loss: 1.0693, test_f1: 0.3426
 epoch: 17, train_loss: 1.0829, test_loss: 1.0602, test_f1: 0.3502
 epoch: 18, train_loss: 1.0763, test_loss: 1.0519, test_f1: 0.3596
 epoch: 19, train_loss: 1.0661, test_loss: 1.0454, test_f1: 0.3626
 epoch: 20, train_loss: 1.0602, test_loss: 1.0395, test_f1: 0.3788
 epoch: 21, train_loss: 1.0533, test_loss: 1.0341, test_f1: 0.3863
 epoch: 22, train_loss: 1.0481, test_loss: 1.0291, test_f1: 0.3879
 epoch: 23, train_loss: 1.0391, test_loss: 1.0248, test_f1: 0.3994
 epoch: 24, train_loss: 1.0327, test_loss: 1.0191, test_f1: 0.4054
 epoch: 25, train_loss: 1.0296, test_loss: 1.0140, test_f1: 0.4127
 epoch: 26, train_loss: 1.0225, test_loss: 1.0096, test_f1: 0.4126
 epoch: 27, train_loss: 1.0234, test_loss: 1.0047, test_f1: 0.4139
 epoch: 28, train_loss: 1.0129, test_loss: 1.0012, test_f1: 0.4254
 epoch: 29, train_loss: 1.0073, test_loss: 0.9944, test_f1: 0.4320
 epoch: 30, train_loss: 1.0048, test_loss: 0.9908, test_f1: 0.4452
 epoch: 31, train_loss: 1.0050, test_loss: 0.9881, test_f1: 0.4464
 epoch: 32, train_loss: 1.0030, test_loss: 0.9876, test_f1: 0.4672
 epoch: 33, train_loss: 0.9928, test_loss: 0.9819, test_f1: 0.4743
 epoch: 34, train_loss: 0.9931, test_loss: 0.9797, test_f1: 0.4734
 epoch: 35, train_loss: 0.9821, test_loss: 0.9724, test_f1: 0.4768
 epoch: 36, train_loss: 0.9836, test_loss: 0.9680, test_f1: 0.4841
 epoch: 37, train_loss: 0.9816, test_loss: 0.9639, test_f1: 0.4744
 epoch: 38, train_loss: 0.9718, test_loss: 0.9602, test_f1: 0.4830
 epoch: 39, train_loss: 0.9741, test_loss: 0.9588, test_f1: 0.4869
 epoch: 40, train_loss: 0.9682, test_loss: 0.9550, test_f1: 0.4830
 epoch: 41, train_loss: 0.9646, test_loss: 0.9533, test_f1: 0.4947
 epoch: 42, train_loss: 0.9638, test_loss: 0.9511, test_f1: 0.4932
 epoch: 43, train_loss: 0.9584, test_loss: 0.9479, test_f1: 0.4912
 epoch: 44, train_loss: 0.9621, test_loss: 0.9447, test_f1: 0.5007
 epoch: 45, train_loss: 0.9557, test_loss: 0.9411, test_f1: 0.5040
 epoch: 46, train_loss: 0.9521, test_loss: 0.9371, test_f1: 0.5009
 epoch: 47, train_loss: 0.9494, test_loss: 0.9336, test_f1: 0.5044
 epoch: 48, train_loss: 0.9508, test_loss: 0.9370, test_f1: 0.5060
 epoch: 49, train_loss: 0.9462, test_loss: 0.9296, test_f1: 0.5048
 epoch: 50, train_loss: 0.9428, test_loss: 0.9289, test_f1: 0.5077
 epoch: 51, train_loss: 0.9334, test_loss: 0.9272, test_f1: 0.5087
 epoch: 52, train_loss: 0.9384, test_loss: 0.9236, test_f1: 0.5086
 epoch: 53, train_loss: 0.9338, test_loss: 0.9235, test_f1: 0.5067
 epoch: 54, train_loss: 0.9317, test_loss: 0.9241, test_f1: 0.5103
 epoch: 55, train_loss: 0.9343, test_loss: 0.9220, test_f1: 0.5102
 epoch: 56, train_loss: 0.9340, test_loss: 0.9200, test_f1: 0.5129
 epoch: 57, train_loss: 0.9276, test_loss: 0.9213, test_f1: 0.5124
 epoch: 58, train_loss: 0.9253, test_loss: 0.9209, test_f1: 0.5117
 epoch: 59, train_loss: 0.9228, test_loss: 0.9187, test_f1: 0.5118
 epoch: 60, train_loss: 0.9317, test_loss: 0.9166, test_f1: 0.5145
 epoch: 61, train_loss: 0.9283, test_loss: 0.9155, test_f1: 0.5117
 epoch: 62, train_loss: 0.9283, test_loss: 0.9126, test_f1: 0.5205
 epoch: 63, train_loss: 0.9249, test_loss: 0.9134, test_f1: 0.5112
 epoch: 64, train_loss: 0.9255, test_loss: 0.9119, test_f1: 0.5103
 epoch: 65, train_loss: 0.9219, test_loss: 0.9106, test_f1: 0.5180
 epoch: 66, train_loss: 0.9208, test_loss: 0.9111, test_f1: 0.5137
 epoch: 67, train_loss: 0.9199, test_loss: 0.9103, test_f1: 0.5118
 epoch: 68, train_loss: 0.9184, test_loss: 0.9091, test_f1: 0.5118
 epoch: 69, train_loss: 0.9146, test_loss: 0.9044, test_f1: 0.5297
 epoch: 70, train_loss: 0.9136, test_loss: 0.9050, test_f1: 0.5211
 epoch: 71, train_loss: 0.9169, test_loss: 0.9048, test_f1: 0.5221
 epoch: 72, train_loss: 0.9152, test_loss: 0.9049, test_f1: 0.5235
 epoch: 73, train_loss: 0.9078, test_loss: 0.8998, test_f1: 0.5265
 epoch: 74, train_loss: 0.9061, test_loss: 0.9020, test_f1: 0.5256
 epoch: 75, train_loss: 0.9108, test_loss: 0.9023, test_f1: 0.5263
 epoch: 76, train_loss: 0.9034, test_loss: 0.8999, test_f1: 0.5236
 epoch: 77, train_loss: 0.9085, test_loss: 0.8993, test_f1: 0.5267
 epoch: 78, train_loss: 0.8983, test_loss: 0.8987, test_f1: 0.5270
 epoch: 79, train_loss: 0.9059, test_loss: 0.8987, test_f1: 0.5211
 epoch: 80, train_loss: 0.9029, test_loss: 0.8966, test_f1: 0.5311
 epoch: 81, train_loss: 0.9008, test_loss: 0.8936, test_f1: 0.5337
 epoch: 82, train_loss: 0.8971, test_loss: 0.8925, test_f1: 0.5339
 epoch: 83, train_loss: 0.8955, test_loss: 0.8917, test_f1: 0.5372
 epoch: 84, train_loss: 0.8901, test_loss: 0.8936, test_f1: 0.5326
 epoch: 85, train_loss: 0.8939, test_loss: 0.8922, test_f1: 0.5324
 epoch: 86, train_loss: 0.8915, test_loss: 0.8902, test_f1: 0.5403
 epoch: 87, train_loss: 0.8989, test_loss: 0.8899, test_f1: 0.5323
 epoch: 88, train_loss: 0.8940, test_loss: 0.8891, test_f1: 0.5371
 epoch: 89, train_loss: 0.8852, test_loss: 0.8880, test_f1: 0.5366
 epoch: 90, train_loss: 0.8886, test_loss: 0.8868, test_f1: 0.5417
 epoch: 91, train_loss: 0.8855, test_loss: 0.8870, test_f1: 0.5375
 epoch: 92, train_loss: 0.8878, test_loss: 0.8876, test_f1: 0.5414
 epoch: 93, train_loss: 0.8831, test_loss: 0.8898, test_f1: 0.5337
 epoch: 94, train_loss: 0.8799, test_loss: 0.8838, test_f1: 0.5391
 epoch: 95, train_loss: 0.8787, test_loss: 0.8797, test_f1: 0.5360
 epoch: 96, train_loss: 0.8814, test_loss: 0.8821, test_f1: 0.5432
 epoch: 97, train_loss: 0.8772, test_loss: 0.8818, test_f1: 0.5396
 epoch: 98, train_loss: 0.8836, test_loss: 0.8815, test_f1: 0.5388
 epoch: 99, train_loss: 0.8759, test_loss: 0.8799, test_f1: 0.5425
##################ITERATION #2 ****************************************
 epoch: 0, train_loss: 1.3506, test_loss: 1.3594, test_f1: 0.2270
 epoch: 1, train_loss: 1.3228, test_loss: 1.3511, test_f1: 0.2270
 epoch: 2, train_loss: 1.3026, test_loss: 1.3340, test_f1: 0.2270
 epoch: 3, train_loss: 1.2858, test_loss: 1.3047, test_f1: 0.2527
 epoch: 4, train_loss: 1.2666, test_loss: 1.2663, test_f1: 0.3299
 epoch: 5, train_loss: 1.2448, test_loss: 1.2303, test_f1: 0.3471
 epoch: 6, train_loss: 1.2254, test_loss: 1.1990, test_f1: 0.3536
 epoch: 7, train_loss: 1.2056, test_loss: 1.1725, test_f1: 0.3441
 epoch: 8, train_loss: 1.1826, test_loss: 1.1468, test_f1: 0.3441
 epoch: 9, train_loss: 1.1654, test_loss: 1.1266, test_f1: 0.3460
 epoch: 10, train_loss: 1.1445, test_loss: 1.1087, test_f1: 0.3460
 epoch: 11, train_loss: 1.1309, test_loss: 1.0925, test_f1: 0.3460
 epoch: 12, train_loss: 1.1153, test_loss: 1.0795, test_f1: 0.3429
 epoch: 13, train_loss: 1.0987, test_loss: 1.0675, test_f1: 0.3438
 epoch: 14, train_loss: 1.0878, test_loss: 1.0585, test_f1: 0.3428
 epoch: 15, train_loss: 1.0780, test_loss: 1.0488, test_f1: 0.3468
 epoch: 16, train_loss: 1.0705, test_loss: 1.0429, test_f1: 0.3565
 epoch: 17, train_loss: 1.0596, test_loss: 1.0355, test_f1: 0.3732
 epoch: 18, train_loss: 1.0507, test_loss: 1.0322, test_f1: 0.3982
 epoch: 19, train_loss: 1.0443, test_loss: 1.0261, test_f1: 0.4009
 epoch: 20, train_loss: 1.0381, test_loss: 1.0197, test_f1: 0.4094
 epoch: 21, train_loss: 1.0335, test_loss: 1.0145, test_f1: 0.4144
 epoch: 22, train_loss: 1.0259, test_loss: 1.0129, test_f1: 0.4218
 epoch: 23, train_loss: 1.0217, test_loss: 1.0073, test_f1: 0.4304
 epoch: 24, train_loss: 1.0173, test_loss: 1.0038, test_f1: 0.4256
 epoch: 25, train_loss: 1.0108, test_loss: 0.9964, test_f1: 0.4308
 epoch: 26, train_loss: 1.0108, test_loss: 0.9919, test_f1: 0.4412
 epoch: 27, train_loss: 1.0042, test_loss: 0.9896, test_f1: 0.4373
 epoch: 28, train_loss: 0.9935, test_loss: 0.9860, test_f1: 0.4755
 epoch: 29, train_loss: 0.9912, test_loss: 0.9766, test_f1: 0.4602
 epoch: 30, train_loss: 0.9899, test_loss: 0.9740, test_f1: 0.4812
 epoch: 31, train_loss: 0.9874, test_loss: 0.9739, test_f1: 0.4818
 epoch: 32, train_loss: 0.9849, test_loss: 0.9705, test_f1: 0.4832
 epoch: 33, train_loss: 0.9736, test_loss: 0.9647, test_f1: 0.4771
 epoch: 34, train_loss: 0.9766, test_loss: 0.9569, test_f1: 0.4881
 epoch: 35, train_loss: 0.9734, test_loss: 0.9547, test_f1: 0.4883
 epoch: 36, train_loss: 0.9714, test_loss: 0.9549, test_f1: 0.4913
 epoch: 37, train_loss: 0.9680, test_loss: 0.9527, test_f1: 0.4905
 epoch: 38, train_loss: 0.9649, test_loss: 0.9534, test_f1: 0.4952
 epoch: 39, train_loss: 0.9590, test_loss: 0.9422, test_f1: 0.4903
 epoch: 40, train_loss: 0.9541, test_loss: 0.9442, test_f1: 0.4956
 epoch: 41, train_loss: 0.9504, test_loss: 0.9385, test_f1: 0.4974
 epoch: 42, train_loss: 0.9533, test_loss: 0.9462, test_f1: 0.4980
 epoch: 43, train_loss: 0.9424, test_loss: 0.9336, test_f1: 0.4968
 epoch: 44, train_loss: 0.9452, test_loss: 0.9315, test_f1: 0.4964
 epoch: 45, train_loss: 0.9395, test_loss: 0.9355, test_f1: 0.4942
 epoch: 46, train_loss: 0.9349, test_loss: 0.9270, test_f1: 0.4962
 epoch: 47, train_loss: 0.9333, test_loss: 0.9212, test_f1: 0.4958
 epoch: 48, train_loss: 0.9302, test_loss: 0.9242, test_f1: 0.5031
 epoch: 49, train_loss: 0.9293, test_loss: 0.9138, test_f1: 0.5151
 epoch: 50, train_loss: 0.9243, test_loss: 0.9077, test_f1: 0.5248
 epoch: 51, train_loss: 0.9185, test_loss: 0.9133, test_f1: 0.5064
 epoch: 52, train_loss: 0.9190, test_loss: 0.9142, test_f1: 0.5126
 epoch: 53, train_loss: 0.9169, test_loss: 0.9109, test_f1: 0.5164
 epoch: 54, train_loss: 0.9210, test_loss: 0.9120, test_f1: 0.5129
 epoch: 55, train_loss: 0.9147, test_loss: 0.9080, test_f1: 0.5089
 epoch: 56, train_loss: 0.9158, test_loss: 0.9124, test_f1: 0.5178
 epoch: 57, train_loss: 0.9108, test_loss: 0.9098, test_f1: 0.5176
 epoch: 58, train_loss: 0.9115, test_loss: 0.9057, test_f1: 0.5265
 epoch: 59, train_loss: 0.9101, test_loss: 0.9091, test_f1: 0.5197
 epoch: 60, train_loss: 0.9127, test_loss: 0.9032, test_f1: 0.5200
 epoch: 61, train_loss: 0.9110, test_loss: 0.9061, test_f1: 0.5221
 epoch: 62, train_loss: 0.8992, test_loss: 0.9018, test_f1: 0.5274
 epoch: 63, train_loss: 0.9057, test_loss: 0.9031, test_f1: 0.5195
 epoch: 64, train_loss: 0.9018, test_loss: 0.9040, test_f1: 0.5227
 epoch: 65, train_loss: 0.9037, test_loss: 0.9032, test_f1: 0.5295
 epoch: 66, train_loss: 0.8983, test_loss: 0.8968, test_f1: 0.5256
 epoch: 67, train_loss: 0.8978, test_loss: 0.8975, test_f1: 0.5281
 epoch: 68, train_loss: 0.8923, test_loss: 0.8968, test_f1: 0.5269
 epoch: 69, train_loss: 0.9006, test_loss: 0.8998, test_f1: 0.5307
 epoch: 70, train_loss: 0.8934, test_loss: 0.8918, test_f1: 0.5218
 epoch: 71, train_loss: 0.8923, test_loss: 0.8965, test_f1: 0.5342
 epoch: 72, train_loss: 0.8889, test_loss: 0.8931, test_f1: 0.5351
 epoch: 73, train_loss: 0.8884, test_loss: 0.8966, test_f1: 0.5263
 epoch: 74, train_loss: 0.8934, test_loss: 0.8914, test_f1: 0.5317
 epoch: 75, train_loss: 0.8891, test_loss: 0.8952, test_f1: 0.5290
 epoch: 76, train_loss: 0.8880, test_loss: 0.8926, test_f1: 0.5227
 epoch: 77, train_loss: 0.8871, test_loss: 0.8963, test_f1: 0.5341
 epoch: 78, train_loss: 0.8789, test_loss: 0.8920, test_f1: 0.5317
 epoch: 79, train_loss: 0.8795, test_loss: 0.8911, test_f1: 0.5326
 epoch: 80, train_loss: 0.8782, test_loss: 0.8885, test_f1: 0.5365
 epoch: 81, train_loss: 0.8776, test_loss: 0.8898, test_f1: 0.5307
 epoch: 82, train_loss: 0.8776, test_loss: 0.8905, test_f1: 0.5351
 epoch: 83, train_loss: 0.8810, test_loss: 0.8806, test_f1: 0.5265
 epoch: 84, train_loss: 0.8795, test_loss: 0.8861, test_f1: 0.5349
 epoch: 85, train_loss: 0.8745, test_loss: 0.8806, test_f1: 0.5326
 epoch: 86, train_loss: 0.8739, test_loss: 0.8855, test_f1: 0.5300
 epoch: 87, train_loss: 0.8661, test_loss: 0.8789, test_f1: 0.5299
 epoch: 88, train_loss: 0.8768, test_loss: 0.8820, test_f1: 0.5348
 epoch: 89, train_loss: 0.8684, test_loss: 0.8846, test_f1: 0.5295
 epoch: 90, train_loss: 0.8690, test_loss: 0.8789, test_f1: 0.5422
 epoch: 91, train_loss: 0.8668, test_loss: 0.8733, test_f1: 0.5370
 epoch: 92, train_loss: 0.8680, test_loss: 0.8829, test_f1: 0.5307
 epoch: 93, train_loss: 0.8648, test_loss: 0.8852, test_f1: 0.5383
 epoch: 94, train_loss: 0.8601, test_loss: 0.8821, test_f1: 0.5370
 epoch: 95, train_loss: 0.8631, test_loss: 0.8725, test_f1: 0.5342
 epoch: 96, train_loss: 0.8611, test_loss: 0.8792, test_f1: 0.5320
 epoch: 97, train_loss: 0.8607, test_loss: 0.8748, test_f1: 0.5406
 epoch: 98, train_loss: 0.8553, test_loss: 0.8753, test_f1: 0.5288
 epoch: 99, train_loss: 0.8621, test_loss: 0.8709, test_f1: 0.5419
##################ITERATION #3 ****************************************
 epoch: 0, train_loss: 1.3076, test_loss: 1.3170, test_f1: 0.2270
 epoch: 1, train_loss: 1.2737, test_loss: 1.2994, test_f1: 0.2270
 epoch: 2, train_loss: 1.2537, test_loss: 1.2723, test_f1: 0.2270
 epoch: 3, train_loss: 1.2373, test_loss: 1.2342, test_f1: 0.2270
 epoch: 4, train_loss: 1.2184, test_loss: 1.1992, test_f1: 0.3312
 epoch: 5, train_loss: 1.1966, test_loss: 1.1676, test_f1: 0.3508
 epoch: 6, train_loss: 1.1772, test_loss: 1.1406, test_f1: 0.3474
 epoch: 7, train_loss: 1.1573, test_loss: 1.1169, test_f1: 0.3478
 epoch: 8, train_loss: 1.1369, test_loss: 1.0961, test_f1: 0.3592
 epoch: 9, train_loss: 1.1144, test_loss: 1.0793, test_f1: 0.3815
 epoch: 10, train_loss: 1.0991, test_loss: 1.0632, test_f1: 0.4053
 epoch: 11, train_loss: 1.0849, test_loss: 1.0493, test_f1: 0.4110
 epoch: 12, train_loss: 1.0719, test_loss: 1.0387, test_f1: 0.4217
 epoch: 13, train_loss: 1.0573, test_loss: 1.0298, test_f1: 0.4294
 epoch: 14, train_loss: 1.0505, test_loss: 1.0216, test_f1: 0.4358
 epoch: 15, train_loss: 1.0450, test_loss: 1.0157, test_f1: 0.4333
 epoch: 16, train_loss: 1.0396, test_loss: 1.0079, test_f1: 0.4388
 epoch: 17, train_loss: 1.0276, test_loss: 1.0022, test_f1: 0.4401
 epoch: 18, train_loss: 1.0219, test_loss: 0.9966, test_f1: 0.4586
 epoch: 19, train_loss: 1.0141, test_loss: 0.9899, test_f1: 0.4667
 epoch: 20, train_loss: 1.0072, test_loss: 0.9831, test_f1: 0.4725
 epoch: 21, train_loss: 1.0044, test_loss: 0.9814, test_f1: 0.4787
 epoch: 22, train_loss: 0.9991, test_loss: 0.9768, test_f1: 0.4787
 epoch: 23, train_loss: 0.9931, test_loss: 0.9748, test_f1: 0.4896
 epoch: 24, train_loss: 0.9856, test_loss: 0.9702, test_f1: 0.4924
 epoch: 25, train_loss: 0.9851, test_loss: 0.9634, test_f1: 0.4880
 epoch: 26, train_loss: 0.9790, test_loss: 0.9601, test_f1: 0.4936
 epoch: 27, train_loss: 0.9750, test_loss: 0.9567, test_f1: 0.4957
 epoch: 28, train_loss: 0.9683, test_loss: 0.9532, test_f1: 0.4917
 epoch: 29, train_loss: 0.9674, test_loss: 0.9501, test_f1: 0.4966
 epoch: 30, train_loss: 0.9630, test_loss: 0.9467, test_f1: 0.4954
 epoch: 31, train_loss: 0.9618, test_loss: 0.9449, test_f1: 0.4900
 epoch: 32, train_loss: 0.9617, test_loss: 0.9416, test_f1: 0.4924
 epoch: 33, train_loss: 0.9487, test_loss: 0.9401, test_f1: 0.4938
 epoch: 34, train_loss: 0.9472, test_loss: 0.9342, test_f1: 0.5092
 epoch: 35, train_loss: 0.9429, test_loss: 0.9342, test_f1: 0.5126
 epoch: 36, train_loss: 0.9422, test_loss: 0.9303, test_f1: 0.5082
 epoch: 37, train_loss: 0.9409, test_loss: 0.9260, test_f1: 0.5126
 epoch: 38, train_loss: 0.9361, test_loss: 0.9255, test_f1: 0.5110
 epoch: 39, train_loss: 0.9346, test_loss: 0.9259, test_f1: 0.5116
 epoch: 40, train_loss: 0.9225, test_loss: 0.9176, test_f1: 0.5117
 epoch: 41, train_loss: 0.9249, test_loss: 0.9174, test_f1: 0.5181
 epoch: 42, train_loss: 0.9187, test_loss: 0.9095, test_f1: 0.5223
 epoch: 43, train_loss: 0.9160, test_loss: 0.9104, test_f1: 0.5242
 epoch: 44, train_loss: 0.9146, test_loss: 0.9069, test_f1: 0.5179
 epoch: 45, train_loss: 0.9200, test_loss: 0.9016, test_f1: 0.5244
 epoch: 46, train_loss: 0.9077, test_loss: 0.8948, test_f1: 0.5256
 epoch: 47, train_loss: 0.9079, test_loss: 0.8994, test_f1: 0.5191
 epoch: 48, train_loss: 0.9022, test_loss: 0.8913, test_f1: 0.5296
 epoch: 49, train_loss: 0.9035, test_loss: 0.8890, test_f1: 0.5294
 epoch: 50, train_loss: 0.9029, test_loss: 0.8834, test_f1: 0.5306
 epoch: 51, train_loss: 0.8897, test_loss: 0.8855, test_f1: 0.5182
 epoch: 52, train_loss: 0.8945, test_loss: 0.8842, test_f1: 0.5159
 epoch: 53, train_loss: 0.8880, test_loss: 0.8801, test_f1: 0.5293
 epoch: 54, train_loss: 0.8866, test_loss: 0.8785, test_f1: 0.5208
 epoch: 55, train_loss: 0.8885, test_loss: 0.8772, test_f1: 0.5328
 epoch: 56, train_loss: 0.8849, test_loss: 0.8769, test_f1: 0.5260
 epoch: 57, train_loss: 0.8869, test_loss: 0.8767, test_f1: 0.5293
 epoch: 58, train_loss: 0.8792, test_loss: 0.8770, test_f1: 0.5246
 epoch: 59, train_loss: 0.8834, test_loss: 0.8765, test_f1: 0.5303
 epoch: 60, train_loss: 0.8809, test_loss: 0.8743, test_f1: 0.5222
 epoch: 61, train_loss: 0.8791, test_loss: 0.8721, test_f1: 0.5326
 epoch: 62, train_loss: 0.8742, test_loss: 0.8729, test_f1: 0.5336
 epoch: 63, train_loss: 0.8755, test_loss: 0.8686, test_f1: 0.5349
 epoch: 64, train_loss: 0.8741, test_loss: 0.8681, test_f1: 0.5303
 epoch: 65, train_loss: 0.8685, test_loss: 0.8659, test_f1: 0.5299
 epoch: 66, train_loss: 0.8698, test_loss: 0.8667, test_f1: 0.5288
 epoch: 67, train_loss: 0.8677, test_loss: 0.8647, test_f1: 0.5279
 epoch: 68, train_loss: 0.8667, test_loss: 0.8627, test_f1: 0.5314
 epoch: 69, train_loss: 0.8698, test_loss: 0.8628, test_f1: 0.5285
 epoch: 70, train_loss: 0.8641, test_loss: 0.8617, test_f1: 0.5357
 epoch: 71, train_loss: 0.8636, test_loss: 0.8589, test_f1: 0.5313
 epoch: 72, train_loss: 0.8646, test_loss: 0.8558, test_f1: 0.5388
 epoch: 73, train_loss: 0.8613, test_loss: 0.8557, test_f1: 0.5458
 epoch: 74, train_loss: 0.8608, test_loss: 0.8568, test_f1: 0.5432
 epoch: 75, train_loss: 0.8566, test_loss: 0.8553, test_f1: 0.5395
 epoch: 76, train_loss: 0.8585, test_loss: 0.8536, test_f1: 0.5462
 epoch: 77, train_loss: 0.8597, test_loss: 0.8559, test_f1: 0.5373
 epoch: 78, train_loss: 0.8601, test_loss: 0.8544, test_f1: 0.5352
 epoch: 79, train_loss: 0.8542, test_loss: 0.8492, test_f1: 0.5546
 epoch: 80, train_loss: 0.8521, test_loss: 0.8542, test_f1: 0.5340
 epoch: 81, train_loss: 0.8525, test_loss: 0.8497, test_f1: 0.5407
 epoch: 82, train_loss: 0.8430, test_loss: 0.8487, test_f1: 0.5434
 epoch: 83, train_loss: 0.8450, test_loss: 0.8493, test_f1: 0.5378
 epoch: 84, train_loss: 0.8519, test_loss: 0.8484, test_f1: 0.5344
 epoch: 85, train_loss: 0.8459, test_loss: 0.8477, test_f1: 0.5354
 epoch: 86, train_loss: 0.8496, test_loss: 0.8488, test_f1: 0.5447
 epoch: 87, train_loss: 0.8491, test_loss: 0.8484, test_f1: 0.5466
 epoch: 88, train_loss: 0.8437, test_loss: 0.8503, test_f1: 0.5307
 epoch: 89, train_loss: 0.8481, test_loss: 0.8469, test_f1: 0.5408
 epoch: 90, train_loss: 0.8438, test_loss: 0.8448, test_f1: 0.5436
 epoch: 91, train_loss: 0.8462, test_loss: 0.8450, test_f1: 0.5404
 epoch: 92, train_loss: 0.8397, test_loss: 0.8446, test_f1: 0.5345
 epoch: 93, train_loss: 0.8337, test_loss: 0.8438, test_f1: 0.5332
 epoch: 94, train_loss: 0.8337, test_loss: 0.8409, test_f1: 0.5425
 epoch: 95, train_loss: 0.8323, test_loss: 0.8410, test_f1: 0.5446
 epoch: 96, train_loss: 0.8362, test_loss: 0.8342, test_f1: 0.5528
 epoch: 97, train_loss: 0.8355, test_loss: 0.8378, test_f1: 0.5400
 epoch: 98, train_loss: 0.8331, test_loss: 0.8360, test_f1: 0.5391
 epoch: 99, train_loss: 0.8289, test_loss: 0.8335, test_f1: 0.5437
##################ITERATION #4 ****************************************
 epoch: 0, train_loss: 1.3166, test_loss: 1.3350, test_f1: 0.2270
 epoch: 1, train_loss: 1.2811, test_loss: 1.3235, test_f1: 0.2270
 epoch: 2, train_loss: 1.2554, test_loss: 1.3011, test_f1: 0.2270
 epoch: 3, train_loss: 1.2359, test_loss: 1.2627, test_f1: 0.2320
 epoch: 4, train_loss: 1.2149, test_loss: 1.2194, test_f1: 0.3221
 epoch: 5, train_loss: 1.1980, test_loss: 1.1781, test_f1: 0.4202
 epoch: 6, train_loss: 1.1693, test_loss: 1.1435, test_f1: 0.4248
 epoch: 7, train_loss: 1.1517, test_loss: 1.1182, test_f1: 0.4273
 epoch: 8, train_loss: 1.1370, test_loss: 1.0969, test_f1: 0.4336
 epoch: 9, train_loss: 1.1172, test_loss: 1.0793, test_f1: 0.4327
 epoch: 10, train_loss: 1.1000, test_loss: 1.0647, test_f1: 0.4315
 epoch: 11, train_loss: 1.0892, test_loss: 1.0522, test_f1: 0.4308
 epoch: 12, train_loss: 1.0743, test_loss: 1.0420, test_f1: 0.4351
 epoch: 13, train_loss: 1.0678, test_loss: 1.0339, test_f1: 0.4357
 epoch: 14, train_loss: 1.0611, test_loss: 1.0271, test_f1: 0.4413
 epoch: 15, train_loss: 1.0449, test_loss: 1.0213, test_f1: 0.4369
 epoch: 16, train_loss: 1.0420, test_loss: 1.0148, test_f1: 0.4317
 epoch: 17, train_loss: 1.0287, test_loss: 1.0084, test_f1: 0.4375
 epoch: 18, train_loss: 1.0266, test_loss: 1.0034, test_f1: 0.4481
 epoch: 19, train_loss: 1.0201, test_loss: 0.9982, test_f1: 0.4532
 epoch: 20, train_loss: 1.0159, test_loss: 0.9931, test_f1: 0.4707
 epoch: 21, train_loss: 1.0111, test_loss: 0.9885, test_f1: 0.4640
 epoch: 22, train_loss: 1.0020, test_loss: 0.9843, test_f1: 0.4701
 epoch: 23, train_loss: 1.0002, test_loss: 0.9804, test_f1: 0.4780
 epoch: 24, train_loss: 0.9992, test_loss: 0.9764, test_f1: 0.4689
 epoch: 25, train_loss: 0.9879, test_loss: 0.9741, test_f1: 0.4733
 epoch: 26, train_loss: 0.9835, test_loss: 0.9684, test_f1: 0.4696
 epoch: 27, train_loss: 0.9836, test_loss: 0.9647, test_f1: 0.4733
 epoch: 28, train_loss: 0.9814, test_loss: 0.9622, test_f1: 0.4760
 epoch: 29, train_loss: 0.9757, test_loss: 0.9591, test_f1: 0.4807
 epoch: 30, train_loss: 0.9686, test_loss: 0.9568, test_f1: 0.4751
 epoch: 31, train_loss: 0.9635, test_loss: 0.9525, test_f1: 0.4882
 epoch: 32, train_loss: 0.9572, test_loss: 0.9469, test_f1: 0.4819
 epoch: 33, train_loss: 0.9598, test_loss: 0.9472, test_f1: 0.4866
 epoch: 34, train_loss: 0.9557, test_loss: 0.9429, test_f1: 0.4923
 epoch: 35, train_loss: 0.9528, test_loss: 0.9379, test_f1: 0.4832
 epoch: 36, train_loss: 0.9485, test_loss: 0.9348, test_f1: 0.4980
 epoch: 37, train_loss: 0.9470, test_loss: 0.9308, test_f1: 0.5029
 epoch: 38, train_loss: 0.9406, test_loss: 0.9282, test_f1: 0.5047
 epoch: 39, train_loss: 0.9409, test_loss: 0.9286, test_f1: 0.4942
 epoch: 40, train_loss: 0.9334, test_loss: 0.9174, test_f1: 0.4985
 epoch: 41, train_loss: 0.9291, test_loss: 0.9190, test_f1: 0.5000
 epoch: 42, train_loss: 0.9328, test_loss: 0.9144, test_f1: 0.5029
 epoch: 43, train_loss: 0.9196, test_loss: 0.9104, test_f1: 0.5001
 epoch: 44, train_loss: 0.9250, test_loss: 0.9157, test_f1: 0.4982
 epoch: 45, train_loss: 0.9197, test_loss: 0.9054, test_f1: 0.5013
 epoch: 46, train_loss: 0.9189, test_loss: 0.9063, test_f1: 0.5084
 epoch: 47, train_loss: 0.9143, test_loss: 0.9019, test_f1: 0.5041
 epoch: 48, train_loss: 0.9064, test_loss: 0.9002, test_f1: 0.5161
 epoch: 49, train_loss: 0.9102, test_loss: 0.8935, test_f1: 0.5049
 epoch: 50, train_loss: 0.9056, test_loss: 0.9003, test_f1: 0.5141
 epoch: 51, train_loss: 0.9043, test_loss: 0.8922, test_f1: 0.5071
 epoch: 52, train_loss: 0.8954, test_loss: 0.8896, test_f1: 0.5091
 epoch: 53, train_loss: 0.8930, test_loss: 0.8881, test_f1: 0.5119
 epoch: 54, train_loss: 0.8997, test_loss: 0.8873, test_f1: 0.5188
 epoch: 55, train_loss: 0.8957, test_loss: 0.8898, test_f1: 0.5156
 epoch: 56, train_loss: 0.8931, test_loss: 0.8856, test_f1: 0.5173
 epoch: 57, train_loss: 0.8896, test_loss: 0.8835, test_f1: 0.5218
 epoch: 58, train_loss: 0.8882, test_loss: 0.8826, test_f1: 0.5218
 epoch: 59, train_loss: 0.8814, test_loss: 0.8818, test_f1: 0.5149
 epoch: 60, train_loss: 0.8879, test_loss: 0.8798, test_f1: 0.5196
 epoch: 61, train_loss: 0.8830, test_loss: 0.8777, test_f1: 0.5272
 epoch: 62, train_loss: 0.8811, test_loss: 0.8763, test_f1: 0.5325
 epoch: 63, train_loss: 0.8825, test_loss: 0.8766, test_f1: 0.5224
 epoch: 64, train_loss: 0.8791, test_loss: 0.8794, test_f1: 0.5245
 epoch: 65, train_loss: 0.8834, test_loss: 0.8754, test_f1: 0.5273
 epoch: 66, train_loss: 0.8743, test_loss: 0.8753, test_f1: 0.5249
 epoch: 67, train_loss: 0.8770, test_loss: 0.8726, test_f1: 0.5254
 epoch: 68, train_loss: 0.8719, test_loss: 0.8675, test_f1: 0.5291
 epoch: 69, train_loss: 0.8723, test_loss: 0.8705, test_f1: 0.5331
 epoch: 70, train_loss: 0.8724, test_loss: 0.8686, test_f1: 0.5279
 epoch: 71, train_loss: 0.8710, test_loss: 0.8698, test_f1: 0.5311
 epoch: 72, train_loss: 0.8701, test_loss: 0.8676, test_f1: 0.5337
 epoch: 73, train_loss: 0.8659, test_loss: 0.8662, test_f1: 0.5258
 epoch: 74, train_loss: 0.8636, test_loss: 0.8640, test_f1: 0.5322
 epoch: 75, train_loss: 0.8725, test_loss: 0.8636, test_f1: 0.5399
 epoch: 76, train_loss: 0.8654, test_loss: 0.8633, test_f1: 0.5389
 epoch: 77, train_loss: 0.8612, test_loss: 0.8675, test_f1: 0.5264
 epoch: 78, train_loss: 0.8579, test_loss: 0.8589, test_f1: 0.5428
 epoch: 79, train_loss: 0.8527, test_loss: 0.8577, test_f1: 0.5357
 epoch: 80, train_loss: 0.8549, test_loss: 0.8593, test_f1: 0.5361
 epoch: 81, train_loss: 0.8525, test_loss: 0.8579, test_f1: 0.5431
 epoch: 82, train_loss: 0.8583, test_loss: 0.8565, test_f1: 0.5364
 epoch: 83, train_loss: 0.8605, test_loss: 0.8605, test_f1: 0.5558
 epoch: 84, train_loss: 0.8539, test_loss: 0.8577, test_f1: 0.5459
 epoch: 85, train_loss: 0.8514, test_loss: 0.8539, test_f1: 0.5522
 epoch: 86, train_loss: 0.8491, test_loss: 0.8591, test_f1: 0.5400
 epoch: 87, train_loss: 0.8499, test_loss: 0.8591, test_f1: 0.5482
 epoch: 88, train_loss: 0.8494, test_loss: 0.8526, test_f1: 0.5459
 epoch: 89, train_loss: 0.8567, test_loss: 0.8569, test_f1: 0.5440
 epoch: 90, train_loss: 0.8419, test_loss: 0.8525, test_f1: 0.5597
 epoch: 91, train_loss: 0.8438, test_loss: 0.8575, test_f1: 0.5440
 epoch: 92, train_loss: 0.8475, test_loss: 0.8549, test_f1: 0.5487
 epoch: 93, train_loss: 0.8455, test_loss: 0.8528, test_f1: 0.5523
 epoch: 94, train_loss: 0.8415, test_loss: 0.8527, test_f1: 0.5490
 epoch: 95, train_loss: 0.8448, test_loss: 0.8539, test_f1: 0.5562
 epoch: 96, train_loss: 0.8352, test_loss: 0.8496, test_f1: 0.5554
 epoch: 97, train_loss: 0.8417, test_loss: 0.8543, test_f1: 0.5526
 epoch: 98, train_loss: 0.8441, test_loss: 0.8536, test_f1: 0.5487
 epoch: 99, train_loss: 0.8430, test_loss: 0.8478, test_f1: 0.5638
##################ITERATION #5 ****************************************
 epoch: 0, train_loss: 1.3120, test_loss: 1.3172, test_f1: 0.2270
 epoch: 1, train_loss: 1.2513, test_loss: 1.2990, test_f1: 0.2270
 epoch: 2, train_loss: 1.2191, test_loss: 1.2631, test_f1: 0.2270
 epoch: 3, train_loss: 1.1945, test_loss: 1.2072, test_f1: 0.3068
 epoch: 4, train_loss: 1.1666, test_loss: 1.1455, test_f1: 0.3522
 epoch: 5, train_loss: 1.1370, test_loss: 1.1041, test_f1: 0.3846
 epoch: 6, train_loss: 1.1176, test_loss: 1.0806, test_f1: 0.4150
 epoch: 7, train_loss: 1.1045, test_loss: 1.0618, test_f1: 0.4280
 epoch: 8, train_loss: 1.0867, test_loss: 1.0493, test_f1: 0.4417
 epoch: 9, train_loss: 1.0756, test_loss: 1.0393, test_f1: 0.4478
 epoch: 10, train_loss: 1.0574, test_loss: 1.0298, test_f1: 0.4502
 epoch: 11, train_loss: 1.0545, test_loss: 1.0215, test_f1: 0.4475
 epoch: 12, train_loss: 1.0427, test_loss: 1.0153, test_f1: 0.4429
 epoch: 13, train_loss: 1.0284, test_loss: 1.0070, test_f1: 0.4547
 epoch: 14, train_loss: 1.0277, test_loss: 1.0008, test_f1: 0.4603
 epoch: 15, train_loss: 1.0172, test_loss: 0.9941, test_f1: 0.4665
 epoch: 16, train_loss: 1.0113, test_loss: 0.9884, test_f1: 0.4730
 epoch: 17, train_loss: 0.9986, test_loss: 0.9838, test_f1: 0.4829
 epoch: 18, train_loss: 1.0039, test_loss: 0.9799, test_f1: 0.4837
 epoch: 19, train_loss: 0.9955, test_loss: 0.9800, test_f1: 0.4859
 epoch: 20, train_loss: 0.9935, test_loss: 0.9754, test_f1: 0.4879
 epoch: 21, train_loss: 0.9847, test_loss: 0.9702, test_f1: 0.4844
 epoch: 22, train_loss: 0.9794, test_loss: 0.9686, test_f1: 0.4808
 epoch: 23, train_loss: 0.9715, test_loss: 0.9639, test_f1: 0.4862
 epoch: 24, train_loss: 0.9675, test_loss: 0.9625, test_f1: 0.4867
 epoch: 25, train_loss: 0.9658, test_loss: 0.9573, test_f1: 0.4828
 epoch: 26, train_loss: 0.9708, test_loss: 0.9524, test_f1: 0.4888
 epoch: 27, train_loss: 0.9617, test_loss: 0.9491, test_f1: 0.4861
 epoch: 28, train_loss: 0.9564, test_loss: 0.9489, test_f1: 0.4784
 epoch: 29, train_loss: 0.9488, test_loss: 0.9527, test_f1: 0.4912
 epoch: 30, train_loss: 0.9527, test_loss: 0.9470, test_f1: 0.5033
 epoch: 31, train_loss: 0.9500, test_loss: 0.9451, test_f1: 0.5002
 epoch: 32, train_loss: 0.9455, test_loss: 0.9381, test_f1: 0.5158
 epoch: 33, train_loss: 0.9408, test_loss: 0.9388, test_f1: 0.5013
 epoch: 34, train_loss: 0.9305, test_loss: 0.9389, test_f1: 0.5076
 epoch: 35, train_loss: 0.9261, test_loss: 0.9328, test_f1: 0.5141
 epoch: 36, train_loss: 0.9314, test_loss: 0.9302, test_f1: 0.5162
 epoch: 37, train_loss: 0.9270, test_loss: 0.9235, test_f1: 0.5153
 epoch: 38, train_loss: 0.9222, test_loss: 0.9245, test_f1: 0.5127
 epoch: 39, train_loss: 0.9214, test_loss: 0.9214, test_f1: 0.5196
 epoch: 40, train_loss: 0.9225, test_loss: 0.9217, test_f1: 0.5241
 epoch: 41, train_loss: 0.9102, test_loss: 0.9166, test_f1: 0.5335
 epoch: 42, train_loss: 0.9122, test_loss: 0.9118, test_f1: 0.5310
 epoch: 43, train_loss: 0.9109, test_loss: 0.9153, test_f1: 0.5259
 epoch: 44, train_loss: 0.9109, test_loss: 0.9133, test_f1: 0.5301
 epoch: 45, train_loss: 0.9051, test_loss: 0.9128, test_f1: 0.5362
 epoch: 46, train_loss: 0.8988, test_loss: 0.9120, test_f1: 0.5278
 epoch: 47, train_loss: 0.8966, test_loss: 0.9073, test_f1: 0.5278
 epoch: 48, train_loss: 0.8954, test_loss: 0.9036, test_f1: 0.5427
 epoch: 49, train_loss: 0.9014, test_loss: 0.9065, test_f1: 0.5316
 epoch: 50, train_loss: 0.8966, test_loss: 0.8992, test_f1: 0.5281
 epoch: 51, train_loss: 0.8896, test_loss: 0.9035, test_f1: 0.5316
 epoch: 52, train_loss: 0.8836, test_loss: 0.8978, test_f1: 0.5304
 epoch: 53, train_loss: 0.8815, test_loss: 0.8970, test_f1: 0.5354
 epoch: 54, train_loss: 0.8834, test_loss: 0.8973, test_f1: 0.5366
 epoch: 55, train_loss: 0.8874, test_loss: 0.9002, test_f1: 0.5311
 epoch: 56, train_loss: 0.8856, test_loss: 0.8984, test_f1: 0.5299
 epoch: 57, train_loss: 0.8852, test_loss: 0.8976, test_f1: 0.5290
 epoch: 58, train_loss: 0.8741, test_loss: 0.8981, test_f1: 0.5391
 epoch: 59, train_loss: 0.8851, test_loss: 0.8981, test_f1: 0.5398
 epoch: 60, train_loss: 0.8852, test_loss: 0.8974, test_f1: 0.5392
 epoch: 61, train_loss: 0.8773, test_loss: 0.8933, test_f1: 0.5313
 epoch: 62, train_loss: 0.8786, test_loss: 0.8889, test_f1: 0.5374
 epoch: 63, train_loss: 0.8659, test_loss: 0.8892, test_f1: 0.5359
 epoch: 64, train_loss: 0.8726, test_loss: 0.8907, test_f1: 0.5397
 epoch: 65, train_loss: 0.8761, test_loss: 0.8894, test_f1: 0.5385
 epoch: 66, train_loss: 0.8751, test_loss: 0.8906, test_f1: 0.5362
 epoch: 67, train_loss: 0.8762, test_loss: 0.8901, test_f1: 0.5430
 epoch: 68, train_loss: 0.8689, test_loss: 0.8840, test_f1: 0.5313
 epoch: 69, train_loss: 0.8714, test_loss: 0.8829, test_f1: 0.5436
 epoch: 70, train_loss: 0.8689, test_loss: 0.8815, test_f1: 0.5424
 epoch: 71, train_loss: 0.8660, test_loss: 0.8866, test_f1: 0.5369
 epoch: 72, train_loss: 0.8667, test_loss: 0.8860, test_f1: 0.5368
 epoch: 73, train_loss: 0.8623, test_loss: 0.8801, test_f1: 0.5398
 epoch: 74, train_loss: 0.8596, test_loss: 0.8780, test_f1: 0.5369
 epoch: 75, train_loss: 0.8558, test_loss: 0.8839, test_f1: 0.5354
 epoch: 76, train_loss: 0.8561, test_loss: 0.8859, test_f1: 0.5390
 epoch: 77, train_loss: 0.8614, test_loss: 0.8763, test_f1: 0.5395
 epoch: 78, train_loss: 0.8559, test_loss: 0.8793, test_f1: 0.5426
 epoch: 79, train_loss: 0.8571, test_loss: 0.8745, test_f1: 0.5412
 epoch: 80, train_loss: 0.8564, test_loss: 0.8745, test_f1: 0.5417
 epoch: 81, train_loss: 0.8600, test_loss: 0.8765, test_f1: 0.5385
 epoch: 82, train_loss: 0.8546, test_loss: 0.8779, test_f1: 0.5395
 epoch: 83, train_loss: 0.8561, test_loss: 0.8776, test_f1: 0.5396
 epoch: 84, train_loss: 0.8504, test_loss: 0.8799, test_f1: 0.5373
 epoch: 85, train_loss: 0.8521, test_loss: 0.8750, test_f1: 0.5391
 epoch: 86, train_loss: 0.8507, test_loss: 0.8751, test_f1: 0.5412
 epoch: 87, train_loss: 0.8516, test_loss: 0.8711, test_f1: 0.5461
 epoch: 88, train_loss: 0.8538, test_loss: 0.8695, test_f1: 0.5431
 epoch: 89, train_loss: 0.8431, test_loss: 0.8711, test_f1: 0.5464
 epoch: 90, train_loss: 0.8581, test_loss: 0.8726, test_f1: 0.5431
 epoch: 91, train_loss: 0.8465, test_loss: 0.8669, test_f1: 0.5427
 epoch: 92, train_loss: 0.8430, test_loss: 0.8688, test_f1: 0.5442
 epoch: 93, train_loss: 0.8377, test_loss: 0.8670, test_f1: 0.5381
 epoch: 94, train_loss: 0.8351, test_loss: 0.8664, test_f1: 0.5407
 epoch: 95, train_loss: 0.8451, test_loss: 0.8665, test_f1: 0.5417
 epoch: 96, train_loss: 0.8406, test_loss: 0.8683, test_f1: 0.5503
 epoch: 97, train_loss: 0.8344, test_loss: 0.8667, test_f1: 0.5454
 epoch: 98, train_loss: 0.8300, test_loss: 0.8669, test_f1: 0.5447
 epoch: 99, train_loss: 0.8382, test_loss: 0.8655, test_f1: 0.5500
##################ITERATION #6 ****************************************
 epoch: 0, train_loss: 1.3044, test_loss: 1.3150, test_f1: 0.2270
 epoch: 1, train_loss: 1.2321, test_loss: 1.2939, test_f1: 0.2270
 epoch: 2, train_loss: 1.2056, test_loss: 1.2296, test_f1: 0.2251
 epoch: 3, train_loss: 1.1755, test_loss: 1.1583, test_f1: 0.3344
 epoch: 4, train_loss: 1.1530, test_loss: 1.1134, test_f1: 0.4026
 epoch: 5, train_loss: 1.1269, test_loss: 1.0853, test_f1: 0.4239
 epoch: 6, train_loss: 1.1114, test_loss: 1.0624, test_f1: 0.4277
 epoch: 7, train_loss: 1.0897, test_loss: 1.0447, test_f1: 0.4299
 epoch: 8, train_loss: 1.0804, test_loss: 1.0327, test_f1: 0.4561
 epoch: 9, train_loss: 1.0664, test_loss: 1.0244, test_f1: 0.4568
 epoch: 10, train_loss: 1.0541, test_loss: 1.0176, test_f1: 0.4559
 epoch: 11, train_loss: 1.0486, test_loss: 1.0112, test_f1: 0.4605
 epoch: 12, train_loss: 1.0379, test_loss: 1.0047, test_f1: 0.4616
 epoch: 13, train_loss: 1.0326, test_loss: 0.9986, test_f1: 0.4617
 epoch: 14, train_loss: 1.0234, test_loss: 0.9969, test_f1: 0.4612
 epoch: 15, train_loss: 1.0170, test_loss: 0.9948, test_f1: 0.4727
 epoch: 16, train_loss: 1.0108, test_loss: 0.9896, test_f1: 0.4701
 epoch: 17, train_loss: 1.0111, test_loss: 0.9836, test_f1: 0.4699
 epoch: 18, train_loss: 1.0037, test_loss: 0.9828, test_f1: 0.4689
 epoch: 19, train_loss: 0.9964, test_loss: 0.9786, test_f1: 0.4808
 epoch: 20, train_loss: 0.9991, test_loss: 0.9750, test_f1: 0.4793
 epoch: 21, train_loss: 0.9981, test_loss: 0.9716, test_f1: 0.4847
 epoch: 22, train_loss: 0.9854, test_loss: 0.9678, test_f1: 0.4853
 epoch: 23, train_loss: 0.9833, test_loss: 0.9674, test_f1: 0.4837
 epoch: 24, train_loss: 0.9784, test_loss: 0.9690, test_f1: 0.4883
 epoch: 25, train_loss: 0.9734, test_loss: 0.9659, test_f1: 0.4841
 epoch: 26, train_loss: 0.9679, test_loss: 0.9596, test_f1: 0.4846
 epoch: 27, train_loss: 0.9699, test_loss: 0.9594, test_f1: 0.4901
 epoch: 28, train_loss: 0.9679, test_loss: 0.9568, test_f1: 0.4843
 epoch: 29, train_loss: 0.9658, test_loss: 0.9560, test_f1: 0.4857
 epoch: 30, train_loss: 0.9631, test_loss: 0.9539, test_f1: 0.4891
 epoch: 31, train_loss: 0.9607, test_loss: 0.9523, test_f1: 0.4887
 epoch: 32, train_loss: 0.9473, test_loss: 0.9484, test_f1: 0.4878
 epoch: 33, train_loss: 0.9469, test_loss: 0.9478, test_f1: 0.4865
 epoch: 34, train_loss: 0.9457, test_loss: 0.9411, test_f1: 0.5018
 epoch: 35, train_loss: 0.9395, test_loss: 0.9396, test_f1: 0.5047
 epoch: 36, train_loss: 0.9419, test_loss: 0.9386, test_f1: 0.4999
 epoch: 37, train_loss: 0.9355, test_loss: 0.9378, test_f1: 0.5062
 epoch: 38, train_loss: 0.9362, test_loss: 0.9323, test_f1: 0.5097
 epoch: 39, train_loss: 0.9366, test_loss: 0.9383, test_f1: 0.5147
 epoch: 40, train_loss: 0.9301, test_loss: 0.9274, test_f1: 0.5168
 epoch: 41, train_loss: 0.9233, test_loss: 0.9309, test_f1: 0.5135
 epoch: 42, train_loss: 0.9257, test_loss: 0.9267, test_f1: 0.5074
 epoch: 43, train_loss: 0.9176, test_loss: 0.9215, test_f1: 0.5149
 epoch: 44, train_loss: 0.9139, test_loss: 0.9202, test_f1: 0.5080
 epoch: 45, train_loss: 0.9160, test_loss: 0.9169, test_f1: 0.5109
 epoch: 46, train_loss: 0.9113, test_loss: 0.9169, test_f1: 0.5169
 epoch: 47, train_loss: 0.9071, test_loss: 0.9219, test_f1: 0.5381
 epoch: 48, train_loss: 0.9035, test_loss: 0.9152, test_f1: 0.5124
 epoch: 49, train_loss: 0.9110, test_loss: 0.9126, test_f1: 0.5164
 epoch: 50, train_loss: 0.9023, test_loss: 0.9218, test_f1: 0.5208
 epoch: 51, train_loss: 0.8954, test_loss: 0.9189, test_f1: 0.5272
 epoch: 52, train_loss: 0.8912, test_loss: 0.9100, test_f1: 0.5204
 epoch: 53, train_loss: 0.8947, test_loss: 0.9034, test_f1: 0.5400
 epoch: 54, train_loss: 0.8893, test_loss: 0.9029, test_f1: 0.5400
 epoch: 55, train_loss: 0.8891, test_loss: 0.9061, test_f1: 0.5331
 epoch: 56, train_loss: 0.8894, test_loss: 0.8980, test_f1: 0.5409
 epoch: 57, train_loss: 0.8930, test_loss: 0.8944, test_f1: 0.5458
 epoch: 58, train_loss: 0.8848, test_loss: 0.8981, test_f1: 0.5478
 epoch: 59, train_loss: 0.8905, test_loss: 0.9025, test_f1: 0.5284
 epoch: 60, train_loss: 0.8837, test_loss: 0.9025, test_f1: 0.5378
 epoch: 61, train_loss: 0.8850, test_loss: 0.8997, test_f1: 0.5312
 epoch: 62, train_loss: 0.8843, test_loss: 0.8967, test_f1: 0.5362
 epoch: 63, train_loss: 0.8728, test_loss: 0.8923, test_f1: 0.5449
 epoch: 64, train_loss: 0.8771, test_loss: 0.8923, test_f1: 0.5472
 epoch: 65, train_loss: 0.8729, test_loss: 0.8924, test_f1: 0.5537
 epoch: 66, train_loss: 0.8749, test_loss: 0.8896, test_f1: 0.5437
 epoch: 67, train_loss: 0.8725, test_loss: 0.8904, test_f1: 0.5505
 epoch: 68, train_loss: 0.8753, test_loss: 0.8850, test_f1: 0.5409
 epoch: 69, train_loss: 0.8752, test_loss: 0.9001, test_f1: 0.5327
 epoch: 70, train_loss: 0.8678, test_loss: 0.8873, test_f1: 0.5356
 epoch: 71, train_loss: 0.8678, test_loss: 0.8926, test_f1: 0.5431
 epoch: 72, train_loss: 0.8748, test_loss: 0.8848, test_f1: 0.5553
 epoch: 73, train_loss: 0.8687, test_loss: 0.8831, test_f1: 0.5512
 epoch: 74, train_loss: 0.8719, test_loss: 0.8917, test_f1: 0.5453
 epoch: 75, train_loss: 0.8689, test_loss: 0.8786, test_f1: 0.5358
 epoch: 76, train_loss: 0.8646, test_loss: 0.8878, test_f1: 0.5447
 epoch: 77, train_loss: 0.8644, test_loss: 0.8776, test_f1: 0.5421
 epoch: 78, train_loss: 0.8617, test_loss: 0.8845, test_f1: 0.5397
 epoch: 79, train_loss: 0.8549, test_loss: 0.8826, test_f1: 0.5461
 epoch: 80, train_loss: 0.8521, test_loss: 0.8757, test_f1: 0.5511
 epoch: 81, train_loss: 0.8566, test_loss: 0.8736, test_f1: 0.5479
 epoch: 82, train_loss: 0.8571, test_loss: 0.8729, test_f1: 0.5479
 epoch: 83, train_loss: 0.8512, test_loss: 0.8778, test_f1: 0.5413
 epoch: 84, train_loss: 0.8410, test_loss: 0.8751, test_f1: 0.5428
 epoch: 85, train_loss: 0.8520, test_loss: 0.8721, test_f1: 0.5505
 epoch: 86, train_loss: 0.8537, test_loss: 0.8775, test_f1: 0.5531
 epoch: 87, train_loss: 0.8511, test_loss: 0.8738, test_f1: 0.5481
 epoch: 88, train_loss: 0.8494, test_loss: 0.8700, test_f1: 0.5542
 epoch: 89, train_loss: 0.8490, test_loss: 0.8682, test_f1: 0.5433
 epoch: 90, train_loss: 0.8476, test_loss: 0.8708, test_f1: 0.5535
 epoch: 91, train_loss: 0.8431, test_loss: 0.8728, test_f1: 0.5552
 epoch: 92, train_loss: 0.8472, test_loss: 0.8701, test_f1: 0.5402
 epoch: 93, train_loss: 0.8411, test_loss: 0.8617, test_f1: 0.5553
 epoch: 94, train_loss: 0.8423, test_loss: 0.8720, test_f1: 0.5557
 epoch: 95, train_loss: 0.8406, test_loss: 0.8746, test_f1: 0.5556
 epoch: 96, train_loss: 0.8391, test_loss: 0.8652, test_f1: 0.5536
 epoch: 97, train_loss: 0.8376, test_loss: 0.8634, test_f1: 0.5568
 epoch: 98, train_loss: 0.8419, test_loss: 0.8741, test_f1: 0.5535
 epoch: 99, train_loss: 0.8387, test_loss: 0.8659, test_f1: 0.5588
##################ITERATION #7 ****************************************
 epoch: 0, train_loss: 1.2880, test_loss: 1.3061, test_f1: 0.2270
 epoch: 1, train_loss: 1.2226, test_loss: 1.2801, test_f1: 0.2270
 epoch: 2, train_loss: 1.1843, test_loss: 1.2377, test_f1: 0.2270
 epoch: 3, train_loss: 1.1589, test_loss: 1.1736, test_f1: 0.2314
 epoch: 4, train_loss: 1.1234, test_loss: 1.1131, test_f1: 0.4235
 epoch: 5, train_loss: 1.1040, test_loss: 1.0766, test_f1: 0.4410
 epoch: 6, train_loss: 1.0881, test_loss: 1.0550, test_f1: 0.4671
 epoch: 7, train_loss: 1.0805, test_loss: 1.0397, test_f1: 0.4723
 epoch: 8, train_loss: 1.0650, test_loss: 1.0331, test_f1: 0.4697
 epoch: 9, train_loss: 1.0485, test_loss: 1.0221, test_f1: 0.4680
 epoch: 10, train_loss: 1.0361, test_loss: 1.0166, test_f1: 0.4688
 epoch: 11, train_loss: 1.0291, test_loss: 1.0082, test_f1: 0.4738
 epoch: 12, train_loss: 1.0223, test_loss: 1.0023, test_f1: 0.4763
 epoch: 13, train_loss: 1.0142, test_loss: 0.9974, test_f1: 0.4784
 epoch: 14, train_loss: 1.0142, test_loss: 0.9922, test_f1: 0.4812
 epoch: 15, train_loss: 1.0023, test_loss: 0.9810, test_f1: 0.4823
 epoch: 16, train_loss: 0.9957, test_loss: 0.9773, test_f1: 0.4866
 epoch: 17, train_loss: 0.9902, test_loss: 0.9744, test_f1: 0.4903
 epoch: 18, train_loss: 0.9812, test_loss: 0.9678, test_f1: 0.4954
 epoch: 19, train_loss: 0.9778, test_loss: 0.9613, test_f1: 0.4898
 epoch: 20, train_loss: 0.9688, test_loss: 0.9559, test_f1: 0.4991
 epoch: 21, train_loss: 0.9681, test_loss: 0.9528, test_f1: 0.5122
 epoch: 22, train_loss: 0.9634, test_loss: 0.9517, test_f1: 0.5095
 epoch: 23, train_loss: 0.9532, test_loss: 0.9470, test_f1: 0.5217
 epoch: 24, train_loss: 0.9476, test_loss: 0.9378, test_f1: 0.5230
 epoch: 25, train_loss: 0.9455, test_loss: 0.9371, test_f1: 0.5263
 epoch: 26, train_loss: 0.9359, test_loss: 0.9325, test_f1: 0.5151
 epoch: 27, train_loss: 0.9332, test_loss: 0.9260, test_f1: 0.5381
 epoch: 28, train_loss: 0.9324, test_loss: 0.9310, test_f1: 0.5354
 epoch: 29, train_loss: 0.9277, test_loss: 0.9282, test_f1: 0.5239
 epoch: 30, train_loss: 0.9255, test_loss: 0.9293, test_f1: 0.5116
 epoch: 31, train_loss: 0.9187, test_loss: 0.9246, test_f1: 0.5297
 epoch: 32, train_loss: 0.9150, test_loss: 0.9241, test_f1: 0.5353
 epoch: 33, train_loss: 0.9072, test_loss: 0.9218, test_f1: 0.5295
 epoch: 34, train_loss: 0.9034, test_loss: 0.9215, test_f1: 0.5182
 epoch: 35, train_loss: 0.9040, test_loss: 0.9202, test_f1: 0.5363
 epoch: 36, train_loss: 0.9011, test_loss: 0.9208, test_f1: 0.5174
 epoch: 37, train_loss: 0.8956, test_loss: 0.9181, test_f1: 0.5336
 epoch: 38, train_loss: 0.8940, test_loss: 0.9142, test_f1: 0.5201
 epoch: 39, train_loss: 0.8939, test_loss: 0.9068, test_f1: 0.5328
 epoch: 40, train_loss: 0.8818, test_loss: 0.9055, test_f1: 0.5332
 epoch: 41, train_loss: 0.8833, test_loss: 0.9101, test_f1: 0.5384
 epoch: 42, train_loss: 0.8799, test_loss: 0.9128, test_f1: 0.5279
 epoch: 43, train_loss: 0.8722, test_loss: 0.9031, test_f1: 0.5367
 epoch: 44, train_loss: 0.8726, test_loss: 0.9017, test_f1: 0.5390
 epoch: 45, train_loss: 0.8632, test_loss: 0.9038, test_f1: 0.5278
 epoch: 46, train_loss: 0.8672, test_loss: 0.9013, test_f1: 0.5410
 epoch: 47, train_loss: 0.8686, test_loss: 0.8956, test_f1: 0.5465
 epoch: 48, train_loss: 0.8537, test_loss: 0.8932, test_f1: 0.5372
 epoch: 49, train_loss: 0.8587, test_loss: 0.8891, test_f1: 0.5526
 epoch: 50, train_loss: 0.8493, test_loss: 0.8934, test_f1: 0.5496
 epoch: 51, train_loss: 0.8547, test_loss: 0.8915, test_f1: 0.5447
 epoch: 52, train_loss: 0.8483, test_loss: 0.8874, test_f1: 0.5548
 epoch: 53, train_loss: 0.8512, test_loss: 0.8878, test_f1: 0.5536
 epoch: 54, train_loss: 0.8434, test_loss: 0.8932, test_f1: 0.5448
 epoch: 55, train_loss: 0.8410, test_loss: 0.8866, test_f1: 0.5475
 epoch: 56, train_loss: 0.8425, test_loss: 0.8880, test_f1: 0.5491
 epoch: 57, train_loss: 0.8369, test_loss: 0.8879, test_f1: 0.5542
 epoch: 58, train_loss: 0.8376, test_loss: 0.8809, test_f1: 0.5488
 epoch: 59, train_loss: 0.8359, test_loss: 0.8829, test_f1: 0.5461
 epoch: 60, train_loss: 0.8399, test_loss: 0.8857, test_f1: 0.5490
 epoch: 61, train_loss: 0.8371, test_loss: 0.8807, test_f1: 0.5546
 epoch: 62, train_loss: 0.8325, test_loss: 0.8780, test_f1: 0.5591
 epoch: 63, train_loss: 0.8399, test_loss: 0.8817, test_f1: 0.5576
 epoch: 64, train_loss: 0.8334, test_loss: 0.8817, test_f1: 0.5523
 epoch: 65, train_loss: 0.8301, test_loss: 0.8794, test_f1: 0.5510
 epoch: 66, train_loss: 0.8308, test_loss: 0.8772, test_f1: 0.5479
 epoch: 67, train_loss: 0.8330, test_loss: 0.8829, test_f1: 0.5473
 epoch: 68, train_loss: 0.8313, test_loss: 0.8794, test_f1: 0.5489
 epoch: 69, train_loss: 0.8252, test_loss: 0.8759, test_f1: 0.5517
 epoch: 70, train_loss: 0.8150, test_loss: 0.8751, test_f1: 0.5557
 epoch: 71, train_loss: 0.8178, test_loss: 0.8784, test_f1: 0.5523
 epoch: 72, train_loss: 0.8243, test_loss: 0.8742, test_f1: 0.5559
 epoch: 73, train_loss: 0.8170, test_loss: 0.8748, test_f1: 0.5501
 epoch: 74, train_loss: 0.8182, test_loss: 0.8804, test_f1: 0.5577
 epoch: 75, train_loss: 0.8193, test_loss: 0.8731, test_f1: 0.5597
 epoch: 76, train_loss: 0.8162, test_loss: 0.8673, test_f1: 0.5585
 epoch: 77, train_loss: 0.8138, test_loss: 0.8764, test_f1: 0.5559
 epoch: 78, train_loss: 0.8094, test_loss: 0.8743, test_f1: 0.5593
 epoch: 79, train_loss: 0.8076, test_loss: 0.8718, test_f1: 0.5624
 epoch: 80, train_loss: 0.8081, test_loss: 0.8698, test_f1: 0.5559
 epoch: 81, train_loss: 0.8076, test_loss: 0.8704, test_f1: 0.5566
 epoch: 82, train_loss: 0.8098, test_loss: 0.8676, test_f1: 0.5582
 epoch: 83, train_loss: 0.8052, test_loss: 0.8635, test_f1: 0.5552
 epoch: 84, train_loss: 0.8009, test_loss: 0.8654, test_f1: 0.5576
 epoch: 85, train_loss: 0.8014, test_loss: 0.8643, test_f1: 0.5544
 epoch: 86, train_loss: 0.8098, test_loss: 0.8679, test_f1: 0.5657
 epoch: 87, train_loss: 0.8035, test_loss: 0.8696, test_f1: 0.5588
 epoch: 88, train_loss: 0.7941, test_loss: 0.8669, test_f1: 0.5576
 epoch: 89, train_loss: 0.7952, test_loss: 0.8639, test_f1: 0.5653
 epoch: 90, train_loss: 0.8014, test_loss: 0.8646, test_f1: 0.5594
 epoch: 91, train_loss: 0.7931, test_loss: 0.8651, test_f1: 0.5640
 epoch: 92, train_loss: 0.8027, test_loss: 0.8667, test_f1: 0.5671
 epoch: 93, train_loss: 0.7938, test_loss: 0.8646, test_f1: 0.5674
 epoch: 94, train_loss: 0.7926, test_loss: 0.8655, test_f1: 0.5620
 epoch: 95, train_loss: 0.7930, test_loss: 0.8695, test_f1: 0.5577
 epoch: 96, train_loss: 0.7939, test_loss: 0.8660, test_f1: 0.5662
 epoch: 97, train_loss: 0.7932, test_loss: 0.8634, test_f1: 0.5676
 epoch: 98, train_loss: 0.7849, test_loss: 0.8643, test_f1: 0.5641
 epoch: 99, train_loss: 0.7811, test_loss: 0.8648, test_f1: 0.5654
##################ITERATION #8 ****************************************
 epoch: 0, train_loss: 1.3144, test_loss: 1.3451, test_f1: 0.2270
 epoch: 1, train_loss: 1.1943, test_loss: 1.3162, test_f1: 0.2270
 epoch: 2, train_loss: 1.1517, test_loss: 1.2428, test_f1: 0.2270
 epoch: 3, train_loss: 1.1205, test_loss: 1.1426, test_f1: 0.3116
 epoch: 4, train_loss: 1.0954, test_loss: 1.0696, test_f1: 0.3820
 epoch: 5, train_loss: 1.0815, test_loss: 1.0406, test_f1: 0.4225
 epoch: 6, train_loss: 1.0610, test_loss: 1.0291, test_f1: 0.4460
 epoch: 7, train_loss: 1.0481, test_loss: 1.0236, test_f1: 0.4511
 epoch: 8, train_loss: 1.0426, test_loss: 1.0168, test_f1: 0.4596
 epoch: 9, train_loss: 1.0377, test_loss: 1.0136, test_f1: 0.4582
 epoch: 10, train_loss: 1.0337, test_loss: 1.0075, test_f1: 0.4658
 epoch: 11, train_loss: 1.0233, test_loss: 1.0041, test_f1: 0.4677
 epoch: 12, train_loss: 1.0112, test_loss: 0.9995, test_f1: 0.4722
 epoch: 13, train_loss: 1.0106, test_loss: 0.9915, test_f1: 0.4847
 epoch: 14, train_loss: 1.0021, test_loss: 0.9868, test_f1: 0.5003
 epoch: 15, train_loss: 0.9976, test_loss: 0.9849, test_f1: 0.4935
 epoch: 16, train_loss: 0.9922, test_loss: 0.9805, test_f1: 0.5130
 epoch: 17, train_loss: 0.9883, test_loss: 0.9723, test_f1: 0.5203
 epoch: 18, train_loss: 0.9845, test_loss: 0.9687, test_f1: 0.5143
 epoch: 19, train_loss: 0.9747, test_loss: 0.9715, test_f1: 0.5178
 epoch: 20, train_loss: 0.9741, test_loss: 0.9623, test_f1: 0.5166
 epoch: 21, train_loss: 0.9751, test_loss: 0.9562, test_f1: 0.5114
 epoch: 22, train_loss: 0.9693, test_loss: 0.9543, test_f1: 0.5187
 epoch: 23, train_loss: 0.9661, test_loss: 0.9518, test_f1: 0.5237
 epoch: 24, train_loss: 0.9601, test_loss: 0.9514, test_f1: 0.5146
 epoch: 25, train_loss: 0.9500, test_loss: 0.9481, test_f1: 0.5157
 epoch: 26, train_loss: 0.9551, test_loss: 0.9495, test_f1: 0.5249
 epoch: 27, train_loss: 0.9428, test_loss: 0.9456, test_f1: 0.5196
 epoch: 28, train_loss: 0.9491, test_loss: 0.9393, test_f1: 0.5221
 epoch: 29, train_loss: 0.9444, test_loss: 0.9399, test_f1: 0.5208
 epoch: 30, train_loss: 0.9438, test_loss: 0.9365, test_f1: 0.5262
 epoch: 31, train_loss: 0.9339, test_loss: 0.9340, test_f1: 0.5368
 epoch: 32, train_loss: 0.9362, test_loss: 0.9330, test_f1: 0.5282
 epoch: 33, train_loss: 0.9320, test_loss: 0.9288, test_f1: 0.5228
 epoch: 34, train_loss: 0.9301, test_loss: 0.9282, test_f1: 0.5249
 epoch: 35, train_loss: 0.9273, test_loss: 0.9281, test_f1: 0.5238
 epoch: 36, train_loss: 0.9241, test_loss: 0.9279, test_f1: 0.5249
 epoch: 37, train_loss: 0.9151, test_loss: 0.9165, test_f1: 0.5278
 epoch: 38, train_loss: 0.9180, test_loss: 0.9171, test_f1: 0.5299
 epoch: 39, train_loss: 0.9169, test_loss: 0.9105, test_f1: 0.5294
 epoch: 40, train_loss: 0.9135, test_loss: 0.9212, test_f1: 0.5320
 epoch: 41, train_loss: 0.9060, test_loss: 0.9085, test_f1: 0.5281
 epoch: 42, train_loss: 0.9026, test_loss: 0.9112, test_f1: 0.5421
 epoch: 43, train_loss: 0.8996, test_loss: 0.9096, test_f1: 0.5394
 epoch: 44, train_loss: 0.9020, test_loss: 0.9075, test_f1: 0.5434
 epoch: 45, train_loss: 0.8957, test_loss: 0.9011, test_f1: 0.5373
 epoch: 46, train_loss: 0.8935, test_loss: 0.9012, test_f1: 0.5411
 epoch: 47, train_loss: 0.8956, test_loss: 0.8945, test_f1: 0.5367
 epoch: 48, train_loss: 0.8852, test_loss: 0.9039, test_f1: 0.5344
 epoch: 49, train_loss: 0.8821, test_loss: 0.8971, test_f1: 0.5461
 epoch: 50, train_loss: 0.8880, test_loss: 0.8986, test_f1: 0.5504
 epoch: 51, train_loss: 0.8731, test_loss: 0.8949, test_f1: 0.5405
 epoch: 52, train_loss: 0.8712, test_loss: 0.8923, test_f1: 0.5585
 epoch: 53, train_loss: 0.8736, test_loss: 0.8890, test_f1: 0.5602
 epoch: 54, train_loss: 0.8753, test_loss: 0.8875, test_f1: 0.5590
 epoch: 55, train_loss: 0.8723, test_loss: 0.8889, test_f1: 0.5464
 epoch: 56, train_loss: 0.8735, test_loss: 0.8876, test_f1: 0.5518
 epoch: 57, train_loss: 0.8746, test_loss: 0.8817, test_f1: 0.5454
 epoch: 58, train_loss: 0.8707, test_loss: 0.8855, test_f1: 0.5540
 epoch: 59, train_loss: 0.8710, test_loss: 0.8911, test_f1: 0.5506
 epoch: 60, train_loss: 0.8743, test_loss: 0.8850, test_f1: 0.5528
 epoch: 61, train_loss: 0.8669, test_loss: 0.8832, test_f1: 0.5649
 epoch: 62, train_loss: 0.8604, test_loss: 0.8859, test_f1: 0.5588
 epoch: 63, train_loss: 0.8636, test_loss: 0.8827, test_f1: 0.5544
 epoch: 64, train_loss: 0.8583, test_loss: 0.8832, test_f1: 0.5553
 epoch: 65, train_loss: 0.8673, test_loss: 0.8809, test_f1: 0.5682
 epoch: 66, train_loss: 0.8645, test_loss: 0.8830, test_f1: 0.5623
 epoch: 67, train_loss: 0.8620, test_loss: 0.8750, test_f1: 0.5603
 epoch: 68, train_loss: 0.8588, test_loss: 0.8807, test_f1: 0.5639
 epoch: 69, train_loss: 0.8566, test_loss: 0.8738, test_f1: 0.5691
 epoch: 70, train_loss: 0.8609, test_loss: 0.8759, test_f1: 0.5710
 epoch: 71, train_loss: 0.8595, test_loss: 0.8737, test_f1: 0.5701
 epoch: 72, train_loss: 0.8529, test_loss: 0.8737, test_f1: 0.5651
 epoch: 73, train_loss: 0.8486, test_loss: 0.8705, test_f1: 0.5712
 epoch: 74, train_loss: 0.8556, test_loss: 0.8793, test_f1: 0.5678
 epoch: 75, train_loss: 0.8548, test_loss: 0.8717, test_f1: 0.5598
 epoch: 76, train_loss: 0.8502, test_loss: 0.8706, test_f1: 0.5693
 epoch: 77, train_loss: 0.8478, test_loss: 0.8718, test_f1: 0.5711
 epoch: 78, train_loss: 0.8479, test_loss: 0.8710, test_f1: 0.5713
 epoch: 79, train_loss: 0.8478, test_loss: 0.8710, test_f1: 0.5666
 epoch: 80, train_loss: 0.8427, test_loss: 0.8692, test_f1: 0.5718
 epoch: 81, train_loss: 0.8430, test_loss: 0.8715, test_f1: 0.5679
 epoch: 82, train_loss: 0.8444, test_loss: 0.8699, test_f1: 0.5654
 epoch: 83, train_loss: 0.8417, test_loss: 0.8748, test_f1: 0.5725
 epoch: 84, train_loss: 0.8378, test_loss: 0.8725, test_f1: 0.5654
 epoch: 85, train_loss: 0.8375, test_loss: 0.8697, test_f1: 0.5687
 epoch: 86, train_loss: 0.8404, test_loss: 0.8686, test_f1: 0.5596
 epoch: 87, train_loss: 0.8320, test_loss: 0.8698, test_f1: 0.5666
 epoch: 88, train_loss: 0.8366, test_loss: 0.8717, test_f1: 0.5676
 epoch: 89, train_loss: 0.8316, test_loss: 0.8744, test_f1: 0.5628
 epoch: 90, train_loss: 0.8360, test_loss: 0.8671, test_f1: 0.5641
 epoch: 91, train_loss: 0.8361, test_loss: 0.8713, test_f1: 0.5718
 epoch: 92, train_loss: 0.8390, test_loss: 0.8704, test_f1: 0.5698
 epoch: 93, train_loss: 0.8376, test_loss: 0.8636, test_f1: 0.5723
 epoch: 94, train_loss: 0.8363, test_loss: 0.8703, test_f1: 0.5719
 epoch: 95, train_loss: 0.8303, test_loss: 0.8615, test_f1: 0.5718
 epoch: 96, train_loss: 0.8262, test_loss: 0.8680, test_f1: 0.5709
 epoch: 97, train_loss: 0.8244, test_loss: 0.8647, test_f1: 0.5701
 epoch: 98, train_loss: 0.8276, test_loss: 0.8640, test_f1: 0.5651
 epoch: 99, train_loss: 0.8265, test_loss: 0.8630, test_f1: 0.5738
##################ITERATION #9 ****************************************
 epoch: 0, train_loss: 1.3330, test_loss: 1.3184, test_f1: 0.2270
 epoch: 1, train_loss: 1.2241, test_loss: 1.2846, test_f1: 0.2270
 epoch: 2, train_loss: 1.1845, test_loss: 1.2403, test_f1: 0.2273
 epoch: 3, train_loss: 1.1489, test_loss: 1.1714, test_f1: 0.2855
 epoch: 4, train_loss: 1.1231, test_loss: 1.0978, test_f1: 0.3877
 epoch: 5, train_loss: 1.1063, test_loss: 1.0571, test_f1: 0.4352
 epoch: 6, train_loss: 1.0828, test_loss: 1.0352, test_f1: 0.4399
 epoch: 7, train_loss: 1.0741, test_loss: 1.0204, test_f1: 0.4332
 epoch: 8, train_loss: 1.0595, test_loss: 1.0097, test_f1: 0.4358
 epoch: 9, train_loss: 1.0554, test_loss: 1.0017, test_f1: 0.4439
 epoch: 10, train_loss: 1.0451, test_loss: 0.9944, test_f1: 0.4504
 epoch: 11, train_loss: 1.0331, test_loss: 0.9866, test_f1: 0.4594
 epoch: 12, train_loss: 1.0271, test_loss: 0.9814, test_f1: 0.4605
 epoch: 13, train_loss: 1.0182, test_loss: 0.9766, test_f1: 0.4659
 epoch: 14, train_loss: 1.0132, test_loss: 0.9731, test_f1: 0.4614
 epoch: 15, train_loss: 0.9971, test_loss: 0.9656, test_f1: 0.4770
 epoch: 16, train_loss: 1.0018, test_loss: 0.9606, test_f1: 0.4803
 epoch: 17, train_loss: 0.9929, test_loss: 0.9583, test_f1: 0.4788
 epoch: 18, train_loss: 0.9845, test_loss: 0.9545, test_f1: 0.4795
 epoch: 19, train_loss: 0.9792, test_loss: 0.9499, test_f1: 0.4792
 epoch: 20, train_loss: 0.9742, test_loss: 0.9480, test_f1: 0.4758
 epoch: 21, train_loss: 0.9666, test_loss: 0.9434, test_f1: 0.4805
 epoch: 22, train_loss: 0.9639, test_loss: 0.9416, test_f1: 0.4957
 epoch: 23, train_loss: 0.9667, test_loss: 0.9372, test_f1: 0.5029
 epoch: 24, train_loss: 0.9604, test_loss: 0.9329, test_f1: 0.5052
 epoch: 25, train_loss: 0.9530, test_loss: 0.9333, test_f1: 0.5011
 epoch: 26, train_loss: 0.9490, test_loss: 0.9275, test_f1: 0.5067
 epoch: 27, train_loss: 0.9486, test_loss: 0.9264, test_f1: 0.5104
 epoch: 28, train_loss: 0.9429, test_loss: 0.9237, test_f1: 0.5034
 epoch: 29, train_loss: 0.9418, test_loss: 0.9212, test_f1: 0.5104
 epoch: 30, train_loss: 0.9350, test_loss: 0.9167, test_f1: 0.5146
 epoch: 31, train_loss: 0.9325, test_loss: 0.9149, test_f1: 0.5138
 epoch: 32, train_loss: 0.9368, test_loss: 0.9144, test_f1: 0.5144
 epoch: 33, train_loss: 0.9255, test_loss: 0.9121, test_f1: 0.5194
 epoch: 34, train_loss: 0.9196, test_loss: 0.9084, test_f1: 0.5180
 epoch: 35, train_loss: 0.9266, test_loss: 0.9050, test_f1: 0.5185
 epoch: 36, train_loss: 0.9200, test_loss: 0.9071, test_f1: 0.5243
 epoch: 37, train_loss: 0.9183, test_loss: 0.9034, test_f1: 0.5220
 epoch: 38, train_loss: 0.9120, test_loss: 0.9061, test_f1: 0.5291
 epoch: 39, train_loss: 0.9048, test_loss: 0.9027, test_f1: 0.5325
 epoch: 40, train_loss: 0.9071, test_loss: 0.8981, test_f1: 0.5318
 epoch: 41, train_loss: 0.9049, test_loss: 0.8960, test_f1: 0.5294
 epoch: 42, train_loss: 0.9057, test_loss: 0.8937, test_f1: 0.5305
 epoch: 43, train_loss: 0.8944, test_loss: 0.8934, test_f1: 0.5432
 epoch: 44, train_loss: 0.8970, test_loss: 0.8899, test_f1: 0.5527
 epoch: 45, train_loss: 0.8916, test_loss: 0.8895, test_f1: 0.5383
 epoch: 46, train_loss: 0.8851, test_loss: 0.8866, test_f1: 0.5385
 epoch: 47, train_loss: 0.8863, test_loss: 0.8835, test_f1: 0.5394
 epoch: 48, train_loss: 0.8876, test_loss: 0.8810, test_f1: 0.5376
 epoch: 49, train_loss: 0.8779, test_loss: 0.8807, test_f1: 0.5438
 epoch: 50, train_loss: 0.8775, test_loss: 0.8781, test_f1: 0.5451
 epoch: 51, train_loss: 0.8691, test_loss: 0.8770, test_f1: 0.5542
 epoch: 52, train_loss: 0.8752, test_loss: 0.8789, test_f1: 0.5471
 epoch: 53, train_loss: 0.8721, test_loss: 0.8773, test_f1: 0.5461
 epoch: 54, train_loss: 0.8642, test_loss: 0.8749, test_f1: 0.5473
 epoch: 55, train_loss: 0.8686, test_loss: 0.8740, test_f1: 0.5542
 epoch: 56, train_loss: 0.8677, test_loss: 0.8738, test_f1: 0.5570
 epoch: 57, train_loss: 0.8727, test_loss: 0.8721, test_f1: 0.5475
 epoch: 58, train_loss: 0.8650, test_loss: 0.8734, test_f1: 0.5462
 epoch: 59, train_loss: 0.8655, test_loss: 0.8712, test_f1: 0.5531
 epoch: 60, train_loss: 0.8632, test_loss: 0.8701, test_f1: 0.5543
 epoch: 61, train_loss: 0.8604, test_loss: 0.8711, test_f1: 0.5592
 epoch: 62, train_loss: 0.8517, test_loss: 0.8713, test_f1: 0.5571
 epoch: 63, train_loss: 0.8517, test_loss: 0.8699, test_f1: 0.5618
 epoch: 64, train_loss: 0.8652, test_loss: 0.8710, test_f1: 0.5604
 epoch: 65, train_loss: 0.8492, test_loss: 0.8697, test_f1: 0.5615
 epoch: 66, train_loss: 0.8546, test_loss: 0.8679, test_f1: 0.5605
 epoch: 67, train_loss: 0.8523, test_loss: 0.8656, test_f1: 0.5644
 epoch: 68, train_loss: 0.8593, test_loss: 0.8668, test_f1: 0.5619
 epoch: 69, train_loss: 0.8530, test_loss: 0.8643, test_f1: 0.5633
 epoch: 70, train_loss: 0.8489, test_loss: 0.8674, test_f1: 0.5651
 epoch: 71, train_loss: 0.8518, test_loss: 0.8681, test_f1: 0.5662
 epoch: 72, train_loss: 0.8459, test_loss: 0.8656, test_f1: 0.5639
 epoch: 73, train_loss: 0.8400, test_loss: 0.8639, test_f1: 0.5632
 epoch: 74, train_loss: 0.8425, test_loss: 0.8621, test_f1: 0.5648
 epoch: 75, train_loss: 0.8548, test_loss: 0.8593, test_f1: 0.5691
 epoch: 76, train_loss: 0.8457, test_loss: 0.8606, test_f1: 0.5694
 epoch: 77, train_loss: 0.8422, test_loss: 0.8616, test_f1: 0.5645
 epoch: 78, train_loss: 0.8412, test_loss: 0.8627, test_f1: 0.5646
 epoch: 79, train_loss: 0.8402, test_loss: 0.8622, test_f1: 0.5655
 epoch: 80, train_loss: 0.8433, test_loss: 0.8616, test_f1: 0.5696
 epoch: 81, train_loss: 0.8402, test_loss: 0.8608, test_f1: 0.5695
 epoch: 82, train_loss: 0.8369, test_loss: 0.8626, test_f1: 0.5683
 epoch: 83, train_loss: 0.8311, test_loss: 0.8613, test_f1: 0.5685
 epoch: 84, train_loss: 0.8358, test_loss: 0.8619, test_f1: 0.5666
 epoch: 85, train_loss: 0.8347, test_loss: 0.8592, test_f1: 0.5691
 epoch: 86, train_loss: 0.8333, test_loss: 0.8596, test_f1: 0.5668
 epoch: 87, train_loss: 0.8263, test_loss: 0.8604, test_f1: 0.5661
 epoch: 88, train_loss: 0.8315, test_loss: 0.8590, test_f1: 0.5702
 epoch: 89, train_loss: 0.8300, test_loss: 0.8541, test_f1: 0.5670
 epoch: 90, train_loss: 0.8285, test_loss: 0.8541, test_f1: 0.5694
 epoch: 91, train_loss: 0.8314, test_loss: 0.8586, test_f1: 0.5717
 epoch: 92, train_loss: 0.8301, test_loss: 0.8577, test_f1: 0.5676
 epoch: 93, train_loss: 0.8272, test_loss: 0.8568, test_f1: 0.5664
 epoch: 94, train_loss: 0.8215, test_loss: 0.8543, test_f1: 0.5698
 epoch: 95, train_loss: 0.8208, test_loss: 0.8547, test_f1: 0.5689
 epoch: 96, train_loss: 0.8249, test_loss: 0.8530, test_f1: 0.5625
 epoch: 97, train_loss: 0.8293, test_loss: 0.8550, test_f1: 0.5712
 epoch: 98, train_loss: 0.8211, test_loss: 0.8588, test_f1: 0.5706
 epoch: 99, train_loss: 0.8195, test_loss: 0.8563, test_f1: 0.5703

Training completed in 410.01 seconds
Best F1: 0.5738 at epoch 99
Mean F1 across iterations: 0.5552  0.0143
========================FINAL RESULTS================================
FEGIN weighted F1: 0.5738  0.0143
python main.py --data ltspice_examples --representation component_pin_net --model FEGIN --layers 2 --hiddens 64 --batch_size 256 --lr 0.0001 --emb_size 250 --epochs 100 --save_appendix component_pin_net_L2_H64_BS256_LR0.0001_E250 --no_val
-----



STDERR:
  File "main.py", line 370, in <module>
    main()
  File "main.py", line 254, in main
    dataset = dataset_class(
  File "/home/philip/projects/ltspice_examples_code_repo/Circuit-Completion-Using-GNNs/component_classification_with_link_prediction_head/evaluation/FEGIN/kernel/circuit_datasets.py", line 15, in __init__
    self.data, self.slices = torch.load(self.processed_paths[0])
  File "/home/philip/.local/lib/python3.8/site-packages/torch/serialization.py", line 1040, in load
    warnings.warn(
  File "/usr/lib/python3.8/warnings.py", line 109, in _showwarnmsg
    sw(msg.message, msg.category, msg.filename, msg.lineno,
  File "main.py", line 47, in warn_with_traceback
    traceback.print_stack(file=log)
/home/philip/projects/ltspice_examples_code_repo/Circuit-Completion-Using-GNNs/component_classification_with_link_prediction_head/evaluation/FEGIN/kernel/circuit_datasets.py:15: FutureWarning: You are using `torch.load` with `weights_only=False` (the current default value), which uses the default pickle module implicitly. It is possible to construct malicious pickle data which will execute arbitrary code during unpickling (See https://github.com/pytorch/pytorch/blob/main/SECURITY.md#untrusted-models for more details). In a future release, the default value for `weights_only` will be flipped to `True`. This limits the functions that could be executed during unpickling. Arbitrary objects will no longer be allowed to be loaded via this mode unless they are explicitly allowlisted by the user via `torch.serialization.add_safe_globals`. We recommend you start setting `weights_only=True` for any use case where you don't have full control of the loaded file. Please open an issue on GitHub for any issues related to this experimental feature.
  self.data, self.slices = torch.load(self.processed_paths[0])
