STDOUT:
Results will be saved in /home/philip/projects/ltspice_examples_code_repo/Circuit-Completion-Using-GNNs/component_classification_with_link_prediction_head/evaluation/FEGIN/results/model_FEGIN_dataset_ltspice_demos
Command line input: python main.py --data ltspice_demos --representation component_pin_net --model FEGIN --layers 6 --hiddens 16 --batch_size 64 --lr 0.01 --emb_size 512 --epochs 100 --save_appendix component_pin_net_L6_H16_BS64_LR0.01_E512 --no_val
 is saved.
-----
ltspice_demos - FEGIN
Using 6 layers, 16 hidden units, h = 2
Loading component_pin_net representation dataset
ENTERED
Training FEGIN on component_pin_net representation
Train: 1565, Test: 383
##################ITERATION #0 ****************************************
 epoch: 0, train_loss: 1.2487, test_loss: 1.6155, test_f1: 0.1365
 epoch: 1, train_loss: 1.0755, test_loss: 1.1370, test_f1: 0.4201
 epoch: 2, train_loss: 1.0304, test_loss: 1.1853, test_f1: 0.3779
 epoch: 3, train_loss: 1.0093, test_loss: 1.2949, test_f1: 0.4231
 epoch: 4, train_loss: 1.0029, test_loss: 1.0738, test_f1: 0.4565
 epoch: 5, train_loss: 0.9867, test_loss: 1.0950, test_f1: 0.3938
 epoch: 6, train_loss: 0.9694, test_loss: 1.0716, test_f1: 0.4241
 epoch: 7, train_loss: 0.9846, test_loss: 1.0779, test_f1: 0.3997
 epoch: 8, train_loss: 0.9853, test_loss: 1.1978, test_f1: 0.4137
 epoch: 9, train_loss: 0.9625, test_loss: 1.0365, test_f1: 0.3970
 epoch: 10, train_loss: 0.9422, test_loss: 1.1031, test_f1: 0.5010
 epoch: 11, train_loss: 0.9241, test_loss: 0.9997, test_f1: 0.4424
 epoch: 12, train_loss: 0.9381, test_loss: 1.0233, test_f1: 0.5000
 epoch: 13, train_loss: 0.9200, test_loss: 1.2887, test_f1: 0.5156
 epoch: 14, train_loss: 0.8984, test_loss: 1.4196, test_f1: 0.4547
 epoch: 15, train_loss: 0.8851, test_loss: 1.0680, test_f1: 0.5465
 epoch: 16, train_loss: 0.8847, test_loss: 1.0809, test_f1: 0.5920
 epoch: 17, train_loss: 0.8770, test_loss: 1.1533, test_f1: 0.5588
 epoch: 18, train_loss: 0.8509, test_loss: 1.0460, test_f1: 0.4643
 epoch: 19, train_loss: 0.8635, test_loss: 1.3129, test_f1: 0.3975
 epoch: 20, train_loss: 0.8375, test_loss: 1.1031, test_f1: 0.5089
 epoch: 21, train_loss: 0.8203, test_loss: 1.2262, test_f1: 0.5026
 epoch: 22, train_loss: 0.8455, test_loss: 1.0791, test_f1: 0.5472
 epoch: 23, train_loss: 0.8062, test_loss: 1.3198, test_f1: 0.4897
 epoch: 24, train_loss: 0.7959, test_loss: 1.1775, test_f1: 0.4520
 epoch: 25, train_loss: 0.8155, test_loss: 1.1090, test_f1: 0.5017
 epoch: 26, train_loss: 0.7811, test_loss: 1.0909, test_f1: 0.4755
 epoch: 27, train_loss: 0.8416, test_loss: 1.2491, test_f1: 0.4950
 epoch: 28, train_loss: 0.8222, test_loss: 1.0627, test_f1: 0.5355
 epoch: 29, train_loss: 0.8167, test_loss: 1.2028, test_f1: 0.5257
 epoch: 30, train_loss: 0.7878, test_loss: 1.0512, test_f1: 0.5835
 epoch: 31, train_loss: 0.8353, test_loss: 1.4034, test_f1: 0.3846
 epoch: 32, train_loss: 0.7983, test_loss: 1.0200, test_f1: 0.5730
 epoch: 33, train_loss: 0.8016, test_loss: 1.1796, test_f1: 0.5430
 epoch: 34, train_loss: 0.7869, test_loss: 1.2600, test_f1: 0.5886
 epoch: 35, train_loss: 0.7792, test_loss: 1.0734, test_f1: 0.5539
 epoch: 36, train_loss: 0.7710, test_loss: 1.1078, test_f1: 0.5573
 epoch: 37, train_loss: 0.7675, test_loss: 1.1529, test_f1: 0.5750
 epoch: 38, train_loss: 0.7742, test_loss: 1.6023, test_f1: 0.4811
 epoch: 39, train_loss: 0.7624, test_loss: 1.2490, test_f1: 0.4797
 epoch: 40, train_loss: 0.7521, test_loss: 1.1040, test_f1: 0.5845
 epoch: 41, train_loss: 0.7270, test_loss: 1.2418, test_f1: 0.5264
 epoch: 42, train_loss: 0.7777, test_loss: 1.6817, test_f1: 0.4782
 epoch: 43, train_loss: 0.7680, test_loss: 1.4841, test_f1: 0.5591
 epoch: 44, train_loss: 0.7427, test_loss: 1.2201, test_f1: 0.5934
 epoch: 45, train_loss: 0.7595, test_loss: 1.8580, test_f1: 0.5366
 epoch: 46, train_loss: 0.7734, test_loss: 1.2550, test_f1: 0.5252
 epoch: 47, train_loss: 0.7114, test_loss: 1.2442, test_f1: 0.5584
 epoch: 48, train_loss: 0.7350, test_loss: 2.1193, test_f1: 0.4458
 epoch: 49, train_loss: 0.7336, test_loss: 1.4391, test_f1: 0.5549
 epoch: 50, train_loss: 0.7425, test_loss: 1.7221, test_f1: 0.5792
 epoch: 51, train_loss: 0.7063, test_loss: 1.8235, test_f1: 0.5387
 epoch: 52, train_loss: 0.6833, test_loss: 1.5877, test_f1: 0.5642
 epoch: 53, train_loss: 0.7045, test_loss: 1.4753, test_f1: 0.5788
 epoch: 54, train_loss: 0.6837, test_loss: 1.4302, test_f1: 0.5672
 epoch: 55, train_loss: 0.6683, test_loss: 1.3894, test_f1: 0.5958
 epoch: 56, train_loss: 0.6801, test_loss: 1.4940, test_f1: 0.5970
 epoch: 57, train_loss: 0.6553, test_loss: 1.6150, test_f1: 0.5514
 epoch: 58, train_loss: 0.6623, test_loss: 2.0760, test_f1: 0.5408
 epoch: 59, train_loss: 0.6839, test_loss: 1.2458, test_f1: 0.5867
 epoch: 60, train_loss: 0.6814, test_loss: 1.8640, test_f1: 0.5691
 epoch: 61, train_loss: 0.6546, test_loss: 1.3374, test_f1: 0.5795
 epoch: 62, train_loss: 0.6420, test_loss: 1.3548, test_f1: 0.6165
 epoch: 63, train_loss: 0.6510, test_loss: 1.7140, test_f1: 0.4893
 epoch: 64, train_loss: 0.6594, test_loss: 1.3698, test_f1: 0.5812
 epoch: 65, train_loss: 0.6599, test_loss: 1.3042, test_f1: 0.6135
 epoch: 66, train_loss: 0.6401, test_loss: 1.7784, test_f1: 0.5455
 epoch: 67, train_loss: 0.6380, test_loss: 2.1179, test_f1: 0.5322
 epoch: 68, train_loss: 0.6625, test_loss: 1.3420, test_f1: 0.5184
 epoch: 69, train_loss: 0.6464, test_loss: 1.6722, test_f1: 0.6100
 epoch: 70, train_loss: 0.6347, test_loss: 1.5625, test_f1: 0.5930
 epoch: 71, train_loss: 0.6377, test_loss: 1.8459, test_f1: 0.5695
 epoch: 72, train_loss: 0.6347, test_loss: 1.7969, test_f1: 0.5852
 epoch: 73, train_loss: 0.6588, test_loss: 1.2718, test_f1: 0.5827
 epoch: 74, train_loss: 0.6300, test_loss: 1.9848, test_f1: 0.5905
 epoch: 75, train_loss: 0.6214, test_loss: 1.7512, test_f1: 0.5768
 epoch: 76, train_loss: 0.6260, test_loss: 1.9197, test_f1: 0.5797
 epoch: 77, train_loss: 0.6335, test_loss: 1.7810, test_f1: 0.5554
 epoch: 78, train_loss: 0.6175, test_loss: 1.8750, test_f1: 0.5718
 epoch: 79, train_loss: 0.6222, test_loss: 2.0516, test_f1: 0.5414
 epoch: 80, train_loss: 0.5990, test_loss: 2.1635, test_f1: 0.5620
 epoch: 81, train_loss: 0.6041, test_loss: 2.0150, test_f1: 0.5668
 epoch: 82, train_loss: 0.6469, test_loss: 1.8197, test_f1: 0.5204
 epoch: 83, train_loss: 0.6184, test_loss: 1.8895, test_f1: 0.5675
 epoch: 84, train_loss: 0.6144, test_loss: 1.8692, test_f1: 0.5418
 epoch: 85, train_loss: 0.6264, test_loss: 1.6147, test_f1: 0.6096
 epoch: 86, train_loss: 0.6417, test_loss: 1.6948, test_f1: 0.6087
 epoch: 87, train_loss: 0.6096, test_loss: 1.8688, test_f1: 0.5792
 epoch: 88, train_loss: 0.6096, test_loss: 1.6573, test_f1: 0.6055
 epoch: 89, train_loss: 0.6217, test_loss: 1.6308, test_f1: 0.5707
 epoch: 90, train_loss: 0.6253, test_loss: 1.5757, test_f1: 0.5536
 epoch: 91, train_loss: 0.6017, test_loss: 1.9399, test_f1: 0.5770
 epoch: 92, train_loss: 0.6154, test_loss: 1.7396, test_f1: 0.5575
 epoch: 93, train_loss: 0.6284, test_loss: 2.1438, test_f1: 0.5052
 epoch: 94, train_loss: 0.5993, test_loss: 1.6255, test_f1: 0.5873
 epoch: 95, train_loss: 0.5861, test_loss: 2.1439, test_f1: 0.5568
 epoch: 96, train_loss: 0.5799, test_loss: 1.9700, test_f1: 0.5463
 epoch: 97, train_loss: 0.5911, test_loss: 1.8085, test_f1: 0.5841
 epoch: 98, train_loss: 0.5995, test_loss: 1.9955, test_f1: 0.5970
 epoch: 99, train_loss: 0.5818, test_loss: 1.8975, test_f1: 0.5724
##################ITERATION #1 ****************************************
 epoch: 0, train_loss: 1.1513, test_loss: 1.3413, test_f1: 0.2637
 epoch: 1, train_loss: 1.0284, test_loss: 1.1552, test_f1: 0.4517
 epoch: 2, train_loss: 0.9884, test_loss: 1.0603, test_f1: 0.4126
 epoch: 3, train_loss: 0.9754, test_loss: 1.0941, test_f1: 0.4992
 epoch: 4, train_loss: 0.9479, test_loss: 1.0719, test_f1: 0.5099
 epoch: 5, train_loss: 0.9583, test_loss: 1.0282, test_f1: 0.5139
 epoch: 6, train_loss: 0.9329, test_loss: 1.0260, test_f1: 0.5248
 epoch: 7, train_loss: 0.9104, test_loss: 1.0390, test_f1: 0.5064
 epoch: 8, train_loss: 0.8957, test_loss: 0.9959, test_f1: 0.4692
 epoch: 9, train_loss: 0.8889, test_loss: 1.1008, test_f1: 0.5401
 epoch: 10, train_loss: 0.8920, test_loss: 1.0325, test_f1: 0.4555
 epoch: 11, train_loss: 0.8637, test_loss: 0.9910, test_f1: 0.5361
 epoch: 12, train_loss: 0.8592, test_loss: 0.9813, test_f1: 0.5397
 epoch: 13, train_loss: 0.8566, test_loss: 0.9988, test_f1: 0.4964
 epoch: 14, train_loss: 0.8340, test_loss: 0.9866, test_f1: 0.5147
 epoch: 15, train_loss: 0.8446, test_loss: 1.1011, test_f1: 0.5687
 epoch: 16, train_loss: 0.8546, test_loss: 1.0260, test_f1: 0.5395
 epoch: 17, train_loss: 0.8548, test_loss: 0.9716, test_f1: 0.5274
 epoch: 18, train_loss: 0.8309, test_loss: 0.9840, test_f1: 0.4260
 epoch: 19, train_loss: 0.8371, test_loss: 1.0370, test_f1: 0.5438
 epoch: 20, train_loss: 0.8410, test_loss: 0.9957, test_f1: 0.5708
 epoch: 21, train_loss: 0.8263, test_loss: 0.9961, test_f1: 0.4681
 epoch: 22, train_loss: 0.8326, test_loss: 0.9643, test_f1: 0.5811
 epoch: 23, train_loss: 0.8111, test_loss: 0.9997, test_f1: 0.5579
 epoch: 24, train_loss: 0.8139, test_loss: 1.3228, test_f1: 0.4691
 epoch: 25, train_loss: 0.8216, test_loss: 1.0543, test_f1: 0.5169
 epoch: 26, train_loss: 0.7949, test_loss: 1.1743, test_f1: 0.4995
 epoch: 27, train_loss: 0.8118, test_loss: 1.1096, test_f1: 0.5233
 epoch: 28, train_loss: 0.8044, test_loss: 1.0403, test_f1: 0.4815
 epoch: 29, train_loss: 0.7924, test_loss: 1.2578, test_f1: 0.4219
 epoch: 30, train_loss: 0.8208, test_loss: 0.9388, test_f1: 0.5824
 epoch: 31, train_loss: 0.7918, test_loss: 1.0403, test_f1: 0.5393
 epoch: 32, train_loss: 0.7987, test_loss: 1.0171, test_f1: 0.5423
 epoch: 33, train_loss: 0.8142, test_loss: 1.0172, test_f1: 0.4817
 epoch: 34, train_loss: 0.7952, test_loss: 1.4686, test_f1: 0.4554
 epoch: 35, train_loss: 0.8136, test_loss: 1.6239, test_f1: 0.4645
 epoch: 36, train_loss: 0.7993, test_loss: 0.9872, test_f1: 0.5782
 epoch: 37, train_loss: 0.8033, test_loss: 1.1025, test_f1: 0.5613
 epoch: 38, train_loss: 0.7861, test_loss: 1.0284, test_f1: 0.6011
 epoch: 39, train_loss: 0.7898, test_loss: 1.1104, test_f1: 0.4217
 epoch: 40, train_loss: 0.7851, test_loss: 1.4123, test_f1: 0.4167
 epoch: 41, train_loss: 0.7790, test_loss: 1.3723, test_f1: 0.4925
 epoch: 42, train_loss: 0.7901, test_loss: 1.0122, test_f1: 0.5778
 epoch: 43, train_loss: 0.7528, test_loss: 1.1075, test_f1: 0.5454
 epoch: 44, train_loss: 0.7543, test_loss: 0.9713, test_f1: 0.5771
 epoch: 45, train_loss: 0.7584, test_loss: 0.9912, test_f1: 0.4842
 epoch: 46, train_loss: 0.7568, test_loss: 0.9768, test_f1: 0.5973
 epoch: 47, train_loss: 0.7687, test_loss: 1.0315, test_f1: 0.5635
 epoch: 48, train_loss: 0.7593, test_loss: 1.0945, test_f1: 0.5214
 epoch: 49, train_loss: 0.7570, test_loss: 1.0657, test_f1: 0.5281
 epoch: 50, train_loss: 0.7725, test_loss: 0.9967, test_f1: 0.6004
 epoch: 51, train_loss: 0.7470, test_loss: 0.9577, test_f1: 0.6153
 epoch: 52, train_loss: 0.7262, test_loss: 1.0052, test_f1: 0.5628
 epoch: 53, train_loss: 0.6959, test_loss: 0.9595, test_f1: 0.6380
 epoch: 54, train_loss: 0.7057, test_loss: 1.0498, test_f1: 0.5071
 epoch: 55, train_loss: 0.7025, test_loss: 0.9643, test_f1: 0.6217
 epoch: 56, train_loss: 0.7162, test_loss: 0.9487, test_f1: 0.6148
 epoch: 57, train_loss: 0.7349, test_loss: 0.9667, test_f1: 0.6100
 epoch: 58, train_loss: 0.7006, test_loss: 0.9533, test_f1: 0.6099
 epoch: 59, train_loss: 0.7039, test_loss: 0.9641, test_f1: 0.6601
 epoch: 60, train_loss: 0.6858, test_loss: 0.9419, test_f1: 0.6245
 epoch: 61, train_loss: 0.7000, test_loss: 0.9907, test_f1: 0.6423
 epoch: 62, train_loss: 0.6979, test_loss: 0.9780, test_f1: 0.6206
 epoch: 63, train_loss: 0.6947, test_loss: 1.1017, test_f1: 0.5477
 epoch: 64, train_loss: 0.6768, test_loss: 0.9944, test_f1: 0.5553
 epoch: 65, train_loss: 0.6939, test_loss: 0.9778, test_f1: 0.6465
 epoch: 66, train_loss: 0.6662, test_loss: 1.0289, test_f1: 0.6133
 epoch: 67, train_loss: 0.6632, test_loss: 0.9995, test_f1: 0.6346
 epoch: 68, train_loss: 0.6943, test_loss: 1.0614, test_f1: 0.6129
 epoch: 69, train_loss: 0.6762, test_loss: 1.1416, test_f1: 0.5781
 epoch: 70, train_loss: 0.6615, test_loss: 1.0167, test_f1: 0.6418
 epoch: 71, train_loss: 0.6548, test_loss: 0.9737, test_f1: 0.6002
 epoch: 72, train_loss: 0.6586, test_loss: 1.0684, test_f1: 0.5467
 epoch: 73, train_loss: 0.6670, test_loss: 1.0144, test_f1: 0.5989
 epoch: 74, train_loss: 0.6485, test_loss: 1.2620, test_f1: 0.5913
 epoch: 75, train_loss: 0.6355, test_loss: 1.0155, test_f1: 0.6442
 epoch: 76, train_loss: 0.6499, test_loss: 1.1057, test_f1: 0.5858
 epoch: 77, train_loss: 0.6653, test_loss: 1.1513, test_f1: 0.5707
 epoch: 78, train_loss: 0.6653, test_loss: 1.1128, test_f1: 0.5901
 epoch: 79, train_loss: 0.6363, test_loss: 1.0814, test_f1: 0.5732
 epoch: 80, train_loss: 0.6401, test_loss: 1.0137, test_f1: 0.6073
 epoch: 81, train_loss: 0.6417, test_loss: 1.0295, test_f1: 0.5966
 epoch: 82, train_loss: 0.6212, test_loss: 1.2359, test_f1: 0.5557
 epoch: 83, train_loss: 0.6656, test_loss: 1.0696, test_f1: 0.5547
 epoch: 84, train_loss: 0.6677, test_loss: 1.0105, test_f1: 0.6585
 epoch: 85, train_loss: 0.6291, test_loss: 1.0922, test_f1: 0.6235
 epoch: 86, train_loss: 0.6393, test_loss: 1.0751, test_f1: 0.6318
 epoch: 87, train_loss: 0.6491, test_loss: 0.9877, test_f1: 0.6503
 epoch: 88, train_loss: 0.6314, test_loss: 1.2716, test_f1: 0.6044
 epoch: 89, train_loss: 0.6291, test_loss: 1.0783, test_f1: 0.6030
 epoch: 90, train_loss: 0.6455, test_loss: 1.0396, test_f1: 0.6318
 epoch: 91, train_loss: 0.6249, test_loss: 1.1811, test_f1: 0.5907
 epoch: 92, train_loss: 0.6222, test_loss: 1.0677, test_f1: 0.6547
 epoch: 93, train_loss: 0.6039, test_loss: 1.1910, test_f1: 0.5938
 epoch: 94, train_loss: 0.6091, test_loss: 1.0886, test_f1: 0.5972
 epoch: 95, train_loss: 0.6316, test_loss: 0.9977, test_f1: 0.6401
 epoch: 96, train_loss: 0.6150, test_loss: 1.0510, test_f1: 0.6310
 epoch: 97, train_loss: 0.6249, test_loss: 1.0313, test_f1: 0.6209
 epoch: 98, train_loss: 0.6098, test_loss: 1.0066, test_f1: 0.6410
 epoch: 99, train_loss: 0.6035, test_loss: 1.0682, test_f1: 0.6170
##################ITERATION #2 ****************************************
 epoch: 0, train_loss: 1.1781, test_loss: 1.3429, test_f1: 0.2281
 epoch: 1, train_loss: 1.0261, test_loss: 1.0702, test_f1: 0.4455
 epoch: 2, train_loss: 0.9843, test_loss: 1.0639, test_f1: 0.5206
 epoch: 3, train_loss: 0.9598, test_loss: 1.1230, test_f1: 0.4470
 epoch: 4, train_loss: 0.9505, test_loss: 1.0259, test_f1: 0.5453
 epoch: 5, train_loss: 0.8984, test_loss: 0.9433, test_f1: 0.5445
 epoch: 6, train_loss: 0.8753, test_loss: 1.0494, test_f1: 0.5543
 epoch: 7, train_loss: 0.9038, test_loss: 1.3855, test_f1: 0.2596
 epoch: 8, train_loss: 0.9420, test_loss: 0.9962, test_f1: 0.4664
 epoch: 9, train_loss: 0.8952, test_loss: 1.0678, test_f1: 0.5340
 epoch: 10, train_loss: 0.8778, test_loss: 1.3230, test_f1: 0.3491
 epoch: 11, train_loss: 0.8669, test_loss: 0.9393, test_f1: 0.5739
 epoch: 12, train_loss: 0.8365, test_loss: 0.9897, test_f1: 0.5885
 epoch: 13, train_loss: 0.8576, test_loss: 0.9482, test_f1: 0.5862
 epoch: 14, train_loss: 0.8405, test_loss: 1.0386, test_f1: 0.4532
 epoch: 15, train_loss: 0.8271, test_loss: 1.2062, test_f1: 0.5102
 epoch: 16, train_loss: 0.8178, test_loss: 1.0878, test_f1: 0.4302
 epoch: 17, train_loss: 0.8539, test_loss: 0.9683, test_f1: 0.5561
 epoch: 18, train_loss: 0.8157, test_loss: 1.0043, test_f1: 0.5636
 epoch: 19, train_loss: 0.8211, test_loss: 1.2053, test_f1: 0.4419
 epoch: 20, train_loss: 0.8043, test_loss: 0.9704, test_f1: 0.5873
 epoch: 21, train_loss: 0.7966, test_loss: 1.0436, test_f1: 0.5882
 epoch: 22, train_loss: 0.8075, test_loss: 1.0908, test_f1: 0.4927
 epoch: 23, train_loss: 0.8011, test_loss: 1.0679, test_f1: 0.5647
 epoch: 24, train_loss: 0.7936, test_loss: 1.0474, test_f1: 0.5623
 epoch: 25, train_loss: 0.7855, test_loss: 1.0631, test_f1: 0.5494
 epoch: 26, train_loss: 0.7845, test_loss: 1.0082, test_f1: 0.5749
 epoch: 27, train_loss: 0.7717, test_loss: 1.0314, test_f1: 0.6120
 epoch: 28, train_loss: 0.7583, test_loss: 1.1003, test_f1: 0.4938
 epoch: 29, train_loss: 0.7823, test_loss: 1.8303, test_f1: 0.3829
 epoch: 30, train_loss: 0.7802, test_loss: 0.9502, test_f1: 0.5987
 epoch: 31, train_loss: 0.7740, test_loss: 0.9189, test_f1: 0.5921
 epoch: 32, train_loss: 0.7543, test_loss: 1.0524, test_f1: 0.5552
 epoch: 33, train_loss: 0.7761, test_loss: 1.0089, test_f1: 0.5846
 epoch: 34, train_loss: 0.7426, test_loss: 0.9972, test_f1: 0.5894
 epoch: 35, train_loss: 0.7225, test_loss: 0.9721, test_f1: 0.5778
 epoch: 36, train_loss: 0.7210, test_loss: 1.0477, test_f1: 0.5588
 epoch: 37, train_loss: 0.7180, test_loss: 0.9942, test_f1: 0.6363
 epoch: 38, train_loss: 0.7258, test_loss: 0.9272, test_f1: 0.6065
 epoch: 39, train_loss: 0.7079, test_loss: 1.0885, test_f1: 0.5779
 epoch: 40, train_loss: 0.7499, test_loss: 1.2125, test_f1: 0.4475
 epoch: 41, train_loss: 0.7213, test_loss: 0.9733, test_f1: 0.5548
 epoch: 42, train_loss: 0.7128, test_loss: 1.0921, test_f1: 0.5749
 epoch: 43, train_loss: 0.7689, test_loss: 1.2920, test_f1: 0.5270
 epoch: 44, train_loss: 0.7675, test_loss: 1.1175, test_f1: 0.5226
 epoch: 45, train_loss: 0.7626, test_loss: 0.9717, test_f1: 0.5395
 epoch: 46, train_loss: 0.7289, test_loss: 1.0338, test_f1: 0.5626
 epoch: 47, train_loss: 0.7253, test_loss: 0.9971, test_f1: 0.5521
 epoch: 48, train_loss: 0.7236, test_loss: 1.0030, test_f1: 0.5948
 epoch: 49, train_loss: 0.6983, test_loss: 1.0166, test_f1: 0.5612
 epoch: 50, train_loss: 0.6939, test_loss: 0.9797, test_f1: 0.6199
 epoch: 51, train_loss: 0.6759, test_loss: 1.0303, test_f1: 0.5758
 epoch: 52, train_loss: 0.6373, test_loss: 0.9639, test_f1: 0.5857
 epoch: 53, train_loss: 0.6592, test_loss: 1.0103, test_f1: 0.5947
 epoch: 54, train_loss: 0.6397, test_loss: 1.0108, test_f1: 0.5969
 epoch: 55, train_loss: 0.6175, test_loss: 1.0163, test_f1: 0.5676
 epoch: 56, train_loss: 0.6163, test_loss: 0.9680, test_f1: 0.6336
 epoch: 57, train_loss: 0.6119, test_loss: 1.0342, test_f1: 0.5838
 epoch: 58, train_loss: 0.6368, test_loss: 0.9904, test_f1: 0.6214
 epoch: 59, train_loss: 0.6146, test_loss: 1.0300, test_f1: 0.5734
 epoch: 60, train_loss: 0.6213, test_loss: 1.0416, test_f1: 0.5797
 epoch: 61, train_loss: 0.6249, test_loss: 0.9876, test_f1: 0.6207
 epoch: 62, train_loss: 0.6350, test_loss: 1.0567, test_f1: 0.6060
 epoch: 63, train_loss: 0.6209, test_loss: 0.9124, test_f1: 0.6304
 epoch: 64, train_loss: 0.6187, test_loss: 1.0345, test_f1: 0.6040
 epoch: 65, train_loss: 0.6164, test_loss: 1.0656, test_f1: 0.5902
 epoch: 66, train_loss: 0.6166, test_loss: 1.0107, test_f1: 0.6160
 epoch: 67, train_loss: 0.6232, test_loss: 1.0655, test_f1: 0.5892
 epoch: 68, train_loss: 0.6439, test_loss: 1.0174, test_f1: 0.5953
 epoch: 69, train_loss: 0.6117, test_loss: 1.1052, test_f1: 0.5730
 epoch: 70, train_loss: 0.5904, test_loss: 1.0753, test_f1: 0.6089
 epoch: 71, train_loss: 0.5967, test_loss: 1.0514, test_f1: 0.5885
 epoch: 72, train_loss: 0.6093, test_loss: 1.0373, test_f1: 0.5842
 epoch: 73, train_loss: 0.6028, test_loss: 1.0115, test_f1: 0.6253
 epoch: 74, train_loss: 0.5943, test_loss: 1.0197, test_f1: 0.6193
 epoch: 75, train_loss: 0.5758, test_loss: 1.0254, test_f1: 0.6125
 epoch: 76, train_loss: 0.5749, test_loss: 1.0732, test_f1: 0.5974
 epoch: 77, train_loss: 0.5792, test_loss: 1.1334, test_f1: 0.6025
 epoch: 78, train_loss: 0.6010, test_loss: 1.0192, test_f1: 0.6451
 epoch: 79, train_loss: 0.5945, test_loss: 1.2963, test_f1: 0.5482
 epoch: 80, train_loss: 0.5945, test_loss: 1.0686, test_f1: 0.6092
 epoch: 81, train_loss: 0.5675, test_loss: 1.0696, test_f1: 0.6206
 epoch: 82, train_loss: 0.5732, test_loss: 1.1257, test_f1: 0.5882
 epoch: 83, train_loss: 0.5851, test_loss: 1.0080, test_f1: 0.6127
 epoch: 84, train_loss: 0.5754, test_loss: 1.0344, test_f1: 0.6604
 epoch: 85, train_loss: 0.5767, test_loss: 1.1094, test_f1: 0.6212
 epoch: 86, train_loss: 0.5942, test_loss: 1.0361, test_f1: 0.6068
 epoch: 87, train_loss: 0.6006, test_loss: 1.1003, test_f1: 0.6260
 epoch: 88, train_loss: 0.6235, test_loss: 1.0249, test_f1: 0.6230
 epoch: 89, train_loss: 0.5677, test_loss: 1.1106, test_f1: 0.5778
 epoch: 90, train_loss: 0.5905, test_loss: 1.1319, test_f1: 0.5549
 epoch: 91, train_loss: 0.5837, test_loss: 0.9982, test_f1: 0.6332
 epoch: 92, train_loss: 0.5560, test_loss: 1.0618, test_f1: 0.6280
 epoch: 93, train_loss: 0.5760, test_loss: 1.2171, test_f1: 0.5889
 epoch: 94, train_loss: 0.5995, test_loss: 1.0489, test_f1: 0.5905
 epoch: 95, train_loss: 0.5876, test_loss: 1.1009, test_f1: 0.6431
 epoch: 96, train_loss: 0.5703, test_loss: 1.0654, test_f1: 0.6119
 epoch: 97, train_loss: 0.5522, test_loss: 1.0197, test_f1: 0.6343
 epoch: 98, train_loss: 0.5669, test_loss: 1.0836, test_f1: 0.6033
 epoch: 99, train_loss: 0.5581, test_loss: 1.0599, test_f1: 0.6383
##################ITERATION #3 ****************************************
 epoch: 0, train_loss: 1.1416, test_loss: 1.4530, test_f1: 0.1993
 epoch: 1, train_loss: 1.0334, test_loss: 1.1517, test_f1: 0.3624
 epoch: 2, train_loss: 1.0346, test_loss: 1.1009, test_f1: 0.3997
 epoch: 3, train_loss: 0.9888, test_loss: 1.0815, test_f1: 0.3875
 epoch: 4, train_loss: 0.9638, test_loss: 1.1058, test_f1: 0.4611
 epoch: 5, train_loss: 0.9489, test_loss: 1.2540, test_f1: 0.3885
 epoch: 6, train_loss: 0.9723, test_loss: 1.0961, test_f1: 0.4249
 epoch: 7, train_loss: 0.9347, test_loss: 1.0603, test_f1: 0.5283
 epoch: 8, train_loss: 0.9062, test_loss: 1.0722, test_f1: 0.5008
 epoch: 9, train_loss: 0.8830, test_loss: 1.0297, test_f1: 0.5174
 epoch: 10, train_loss: 0.8573, test_loss: 1.1920, test_f1: 0.4785
 epoch: 11, train_loss: 0.8722, test_loss: 1.0967, test_f1: 0.4941
 epoch: 12, train_loss: 0.9458, test_loss: 1.3200, test_f1: 0.3790
 epoch: 13, train_loss: 1.0268, test_loss: 1.0688, test_f1: 0.4050
 epoch: 14, train_loss: 1.0045, test_loss: 1.0567, test_f1: 0.4386
 epoch: 15, train_loss: 0.9696, test_loss: 1.1063, test_f1: 0.4659
 epoch: 16, train_loss: 0.9608, test_loss: 1.0346, test_f1: 0.5051
 epoch: 17, train_loss: 0.9545, test_loss: 1.0118, test_f1: 0.4591
 epoch: 18, train_loss: 0.9219, test_loss: 1.0750, test_f1: 0.4543
 epoch: 19, train_loss: 0.8861, test_loss: 1.0233, test_f1: 0.5353
 epoch: 20, train_loss: 0.8870, test_loss: 1.2575, test_f1: 0.3428
 epoch: 21, train_loss: 0.8733, test_loss: 1.2394, test_f1: 0.4114
 epoch: 22, train_loss: 0.8656, test_loss: 0.9624, test_f1: 0.4733
 epoch: 23, train_loss: 0.8404, test_loss: 1.0343, test_f1: 0.5386
 epoch: 24, train_loss: 0.8545, test_loss: 0.9832, test_f1: 0.5230
 epoch: 25, train_loss: 0.8363, test_loss: 1.0192, test_f1: 0.5553
 epoch: 26, train_loss: 0.8346, test_loss: 0.9443, test_f1: 0.5934
 epoch: 27, train_loss: 0.8419, test_loss: 0.9846, test_f1: 0.5724
 epoch: 28, train_loss: 0.8227, test_loss: 1.0440, test_f1: 0.5420
 epoch: 29, train_loss: 0.8334, test_loss: 1.0107, test_f1: 0.5566
 epoch: 30, train_loss: 0.8206, test_loss: 1.1595, test_f1: 0.4710
 epoch: 31, train_loss: 0.8143, test_loss: 1.0138, test_f1: 0.5114
 epoch: 32, train_loss: 0.8256, test_loss: 0.9995, test_f1: 0.4987
 epoch: 33, train_loss: 0.8301, test_loss: 1.0973, test_f1: 0.4885
 epoch: 34, train_loss: 0.8329, test_loss: 0.9729, test_f1: 0.5490
 epoch: 35, train_loss: 0.8457, test_loss: 0.9950, test_f1: 0.5214
 epoch: 36, train_loss: 0.8252, test_loss: 0.9622, test_f1: 0.4531
 epoch: 37, train_loss: 0.8205, test_loss: 0.9810, test_f1: 0.4713
 epoch: 38, train_loss: 0.8146, test_loss: 1.0324, test_f1: 0.5258
 epoch: 39, train_loss: 0.8191, test_loss: 0.9988, test_f1: 0.5513
 epoch: 40, train_loss: 0.7977, test_loss: 1.0322, test_f1: 0.4945
 epoch: 41, train_loss: 0.7972, test_loss: 0.9962, test_f1: 0.5777
 epoch: 42, train_loss: 0.7701, test_loss: 1.2272, test_f1: 0.4918
 epoch: 43, train_loss: 0.7862, test_loss: 1.0471, test_f1: 0.4591
 epoch: 44, train_loss: 0.7961, test_loss: 1.2667, test_f1: 0.5008
 epoch: 45, train_loss: 0.8051, test_loss: 1.0506, test_f1: 0.5381
 epoch: 46, train_loss: 0.8101, test_loss: 3.3685, test_f1: 0.2725
 epoch: 47, train_loss: 0.8035, test_loss: 1.2079, test_f1: 0.4883
 epoch: 48, train_loss: 0.7988, test_loss: 1.0202, test_f1: 0.6026
 epoch: 49, train_loss: 0.8033, test_loss: 0.9698, test_f1: 0.5505
 epoch: 50, train_loss: 0.7747, test_loss: 1.0418, test_f1: 0.5927
 epoch: 51, train_loss: 0.7832, test_loss: 1.0544, test_f1: 0.5532
 epoch: 52, train_loss: 0.7528, test_loss: 0.9840, test_f1: 0.6426
 epoch: 53, train_loss: 0.7530, test_loss: 1.0637, test_f1: 0.5272
 epoch: 54, train_loss: 0.7303, test_loss: 1.0163, test_f1: 0.5391
 epoch: 55, train_loss: 0.7273, test_loss: 1.0512, test_f1: 0.5827
 epoch: 56, train_loss: 0.7407, test_loss: 0.9923, test_f1: 0.6195
 epoch: 57, train_loss: 0.7445, test_loss: 1.0072, test_f1: 0.6022
 epoch: 58, train_loss: 0.7190, test_loss: 0.9797, test_f1: 0.6089
 epoch: 59, train_loss: 0.7178, test_loss: 1.0212, test_f1: 0.5846
 epoch: 60, train_loss: 0.7283, test_loss: 1.0677, test_f1: 0.5494
 epoch: 61, train_loss: 0.7313, test_loss: 1.0462, test_f1: 0.5757
 epoch: 62, train_loss: 0.7388, test_loss: 1.0491, test_f1: 0.6207
 epoch: 63, train_loss: 0.7211, test_loss: 1.1087, test_f1: 0.5657
 epoch: 64, train_loss: 0.7318, test_loss: 1.1920, test_f1: 0.4704
 epoch: 65, train_loss: 0.7266, test_loss: 1.1873, test_f1: 0.5658
 epoch: 66, train_loss: 0.7226, test_loss: 1.1788, test_f1: 0.5326
 epoch: 67, train_loss: 0.7230, test_loss: 1.0237, test_f1: 0.5542
 epoch: 68, train_loss: 0.7224, test_loss: 1.0519, test_f1: 0.5995
 epoch: 69, train_loss: 0.7081, test_loss: 1.0852, test_f1: 0.5807
 epoch: 70, train_loss: 0.7247, test_loss: 1.2292, test_f1: 0.4835
 epoch: 71, train_loss: 0.7174, test_loss: 1.0760, test_f1: 0.4968
 epoch: 72, train_loss: 0.7158, test_loss: 1.0665, test_f1: 0.5900
 epoch: 73, train_loss: 0.6869, test_loss: 1.0602, test_f1: 0.5547
 epoch: 74, train_loss: 0.6886, test_loss: 1.0549, test_f1: 0.5663
 epoch: 75, train_loss: 0.6846, test_loss: 1.0426, test_f1: 0.5836
 epoch: 76, train_loss: 0.7147, test_loss: 1.1960, test_f1: 0.5083
 epoch: 77, train_loss: 0.7333, test_loss: 1.0894, test_f1: 0.5389
 epoch: 78, train_loss: 0.7320, test_loss: 1.7173, test_f1: 0.4814
 epoch: 79, train_loss: 0.7153, test_loss: 1.0152, test_f1: 0.6153
 epoch: 80, train_loss: 0.7141, test_loss: 1.1308, test_f1: 0.5353
 epoch: 81, train_loss: 0.7118, test_loss: 1.0310, test_f1: 0.5936
 epoch: 82, train_loss: 0.6992, test_loss: 1.0498, test_f1: 0.5762
 epoch: 83, train_loss: 0.6915, test_loss: 1.0870, test_f1: 0.5651
 epoch: 84, train_loss: 0.7070, test_loss: 1.1078, test_f1: 0.5441
 epoch: 85, train_loss: 0.6882, test_loss: 1.1615, test_f1: 0.5448
 epoch: 86, train_loss: 0.7051, test_loss: 1.1911, test_f1: 0.5357
 epoch: 87, train_loss: 0.7023, test_loss: 1.0427, test_f1: 0.5596
 epoch: 88, train_loss: 0.7261, test_loss: 1.9219, test_f1: 0.4788
 epoch: 89, train_loss: 0.6745, test_loss: 1.0918, test_f1: 0.5756
 epoch: 90, train_loss: 0.6877, test_loss: 1.1095, test_f1: 0.5771
 epoch: 91, train_loss: 0.7232, test_loss: 1.0966, test_f1: 0.5486
 epoch: 92, train_loss: 0.6693, test_loss: 1.0245, test_f1: 0.6161
 epoch: 93, train_loss: 0.6872, test_loss: 1.2318, test_f1: 0.5062
 epoch: 94, train_loss: 0.7001, test_loss: 1.0578, test_f1: 0.5919
 epoch: 95, train_loss: 0.6962, test_loss: 1.0898, test_f1: 0.5392
 epoch: 96, train_loss: 0.6965, test_loss: 1.0988, test_f1: 0.5699
 epoch: 97, train_loss: 0.6732, test_loss: 1.4746, test_f1: 0.5575
 epoch: 98, train_loss: 0.6699, test_loss: 1.0643, test_f1: 0.5955
 epoch: 99, train_loss: 0.6645, test_loss: 1.1424, test_f1: 0.5425
##################ITERATION #4 ****************************************
 epoch: 0, train_loss: 1.2538, test_loss: 1.2726, test_f1: 0.3342
 epoch: 1, train_loss: 1.0646, test_loss: 1.1536, test_f1: 0.3518
 epoch: 2, train_loss: 1.0302, test_loss: 1.0859, test_f1: 0.4322
 epoch: 3, train_loss: 0.9948, test_loss: 1.0574, test_f1: 0.4834
 epoch: 4, train_loss: 0.9900, test_loss: 1.1436, test_f1: 0.4527
 epoch: 5, train_loss: 0.9739, test_loss: 1.1828, test_f1: 0.4665
 epoch: 6, train_loss: 0.9868, test_loss: 1.0497, test_f1: 0.4287
 epoch: 7, train_loss: 0.9535, test_loss: 1.0337, test_f1: 0.5604
 epoch: 8, train_loss: 0.9480, test_loss: 1.0274, test_f1: 0.5517
 epoch: 9, train_loss: 0.9446, test_loss: 1.1529, test_f1: 0.4805
 epoch: 10, train_loss: 0.9399, test_loss: 1.0139, test_f1: 0.4630
 epoch: 11, train_loss: 0.9177, test_loss: 1.1161, test_f1: 0.4623
 epoch: 12, train_loss: 0.9145, test_loss: 1.0166, test_f1: 0.5603
 epoch: 13, train_loss: 0.8920, test_loss: 1.0011, test_f1: 0.5875
 epoch: 14, train_loss: 0.8963, test_loss: 1.1228, test_f1: 0.4688
 epoch: 15, train_loss: 0.9071, test_loss: 1.0436, test_f1: 0.5066
 epoch: 16, train_loss: 0.9260, test_loss: 1.0193, test_f1: 0.5250
 epoch: 17, train_loss: 0.9044, test_loss: 1.0054, test_f1: 0.5376
 epoch: 18, train_loss: 0.8871, test_loss: 0.9843, test_f1: 0.5619
 epoch: 19, train_loss: 0.8531, test_loss: 1.2256, test_f1: 0.4193
 epoch: 20, train_loss: 0.8530, test_loss: 0.9838, test_f1: 0.5631
 epoch: 21, train_loss: 0.8464, test_loss: 1.1201, test_f1: 0.4832
 epoch: 22, train_loss: 0.8358, test_loss: 1.1323, test_f1: 0.5296
 epoch: 23, train_loss: 0.8369, test_loss: 0.9814, test_f1: 0.5844
 epoch: 24, train_loss: 0.8076, test_loss: 0.9805, test_f1: 0.5553
 epoch: 25, train_loss: 0.8163, test_loss: 1.1014, test_f1: 0.5356
 epoch: 26, train_loss: 0.8144, test_loss: 0.9856, test_f1: 0.5186
 epoch: 27, train_loss: 0.8398, test_loss: 1.0122, test_f1: 0.5340
 epoch: 28, train_loss: 0.7972, test_loss: 1.0776, test_f1: 0.4707
 epoch: 29, train_loss: 0.8204, test_loss: 0.9635, test_f1: 0.5610
 epoch: 30, train_loss: 0.7930, test_loss: 1.1550, test_f1: 0.4655
 epoch: 31, train_loss: 0.7779, test_loss: 1.0222, test_f1: 0.5751
 epoch: 32, train_loss: 0.7539, test_loss: 0.9898, test_f1: 0.5283
 epoch: 33, train_loss: 0.7546, test_loss: 1.1549, test_f1: 0.5129
 epoch: 34, train_loss: 0.7490, test_loss: 1.2583, test_f1: 0.5049
 epoch: 35, train_loss: 0.7364, test_loss: 1.0232, test_f1: 0.5807
 epoch: 36, train_loss: 0.7494, test_loss: 1.1919, test_f1: 0.5685
 epoch: 37, train_loss: 0.7753, test_loss: 1.0811, test_f1: 0.5901
 epoch: 38, train_loss: 0.7707, test_loss: 1.0703, test_f1: 0.5869
 epoch: 39, train_loss: 0.7538, test_loss: 1.0835, test_f1: 0.5669
 epoch: 40, train_loss: 0.7541, test_loss: 1.1181, test_f1: 0.5023
 epoch: 41, train_loss: 0.7275, test_loss: 1.2121, test_f1: 0.5293
 epoch: 42, train_loss: 0.7079, test_loss: 1.0506, test_f1: 0.5708
 epoch: 43, train_loss: 0.7418, test_loss: 0.9817, test_f1: 0.5871
 epoch: 44, train_loss: 0.7018, test_loss: 1.0467, test_f1: 0.5250
 epoch: 45, train_loss: 0.6939, test_loss: 1.1738, test_f1: 0.5166
 epoch: 46, train_loss: 0.7277, test_loss: 1.0947, test_f1: 0.5529
 epoch: 47, train_loss: 0.7288, test_loss: 1.0650, test_f1: 0.5348
 epoch: 48, train_loss: 0.7328, test_loss: 1.1778, test_f1: 0.4757
 epoch: 49, train_loss: 0.7160, test_loss: 1.0818, test_f1: 0.5357
 epoch: 50, train_loss: 0.6870, test_loss: 1.0540, test_f1: 0.5322
 epoch: 51, train_loss: 0.6693, test_loss: 1.0415, test_f1: 0.6165
 epoch: 52, train_loss: 0.6541, test_loss: 1.0839, test_f1: 0.5839
 epoch: 53, train_loss: 0.6548, test_loss: 1.0881, test_f1: 0.5766
 epoch: 54, train_loss: 0.6338, test_loss: 1.1325, test_f1: 0.5866
 epoch: 55, train_loss: 0.6542, test_loss: 1.0475, test_f1: 0.5749
 epoch: 56, train_loss: 0.6219, test_loss: 1.0312, test_f1: 0.6136
 epoch: 57, train_loss: 0.6143, test_loss: 1.0906, test_f1: 0.6072
 epoch: 58, train_loss: 0.6359, test_loss: 1.0021, test_f1: 0.6189
 epoch: 59, train_loss: 0.6238, test_loss: 1.0759, test_f1: 0.6034
 epoch: 60, train_loss: 0.6145, test_loss: 1.0745, test_f1: 0.6024
 epoch: 61, train_loss: 0.6342, test_loss: 1.2040, test_f1: 0.5410
 epoch: 62, train_loss: 0.6293, test_loss: 1.2666, test_f1: 0.5633
 epoch: 63, train_loss: 0.6280, test_loss: 1.2145, test_f1: 0.5919
 epoch: 64, train_loss: 0.6444, test_loss: 1.1791, test_f1: 0.5988
 epoch: 65, train_loss: 0.6253, test_loss: 1.1872, test_f1: 0.5836
 epoch: 66, train_loss: 0.6070, test_loss: 1.1541, test_f1: 0.6047
 epoch: 67, train_loss: 0.6163, test_loss: 1.2549, test_f1: 0.5711
 epoch: 68, train_loss: 0.6230, test_loss: 1.1307, test_f1: 0.5529
 epoch: 69, train_loss: 0.6185, test_loss: 1.2689, test_f1: 0.6155
 epoch: 70, train_loss: 0.5906, test_loss: 1.2970, test_f1: 0.5808
 epoch: 71, train_loss: 0.5892, test_loss: 1.1514, test_f1: 0.5806
 epoch: 72, train_loss: 0.5945, test_loss: 1.2060, test_f1: 0.6044
 epoch: 73, train_loss: 0.6027, test_loss: 1.2598, test_f1: 0.5862
 epoch: 74, train_loss: 0.5858, test_loss: 1.3392, test_f1: 0.5515
 epoch: 75, train_loss: 0.5815, test_loss: 1.1652, test_f1: 0.5773
 epoch: 76, train_loss: 0.5775, test_loss: 1.1868, test_f1: 0.6102
 epoch: 77, train_loss: 0.6117, test_loss: 1.0919, test_f1: 0.6042
 epoch: 78, train_loss: 0.6085, test_loss: 1.1951, test_f1: 0.5653
 epoch: 79, train_loss: 0.5779, test_loss: 1.4252, test_f1: 0.5796
 epoch: 80, train_loss: 0.5735, test_loss: 1.2748, test_f1: 0.5733
 epoch: 81, train_loss: 0.5679, test_loss: 1.2168, test_f1: 0.5864
 epoch: 82, train_loss: 0.5984, test_loss: 1.2562, test_f1: 0.5796
 epoch: 83, train_loss: 0.5790, test_loss: 1.0698, test_f1: 0.5962
 epoch: 84, train_loss: 0.5986, test_loss: 1.1962, test_f1: 0.6068
 epoch: 85, train_loss: 0.5851, test_loss: 1.1332, test_f1: 0.5846
 epoch: 86, train_loss: 0.5557, test_loss: 1.3434, test_f1: 0.5477
 epoch: 87, train_loss: 0.5819, test_loss: 1.1813, test_f1: 0.5682
 epoch: 88, train_loss: 0.5625, test_loss: 1.1412, test_f1: 0.6001
 epoch: 89, train_loss: 0.5486, test_loss: 1.3021, test_f1: 0.5657
 epoch: 90, train_loss: 0.5726, test_loss: 1.2112, test_f1: 0.5988
 epoch: 91, train_loss: 0.5513, test_loss: 1.3413, test_f1: 0.5496
 epoch: 92, train_loss: 0.6065, test_loss: 1.6876, test_f1: 0.5660
 epoch: 93, train_loss: 0.5777, test_loss: 1.2524, test_f1: 0.5617
 epoch: 94, train_loss: 0.5799, test_loss: 1.1950, test_f1: 0.6009
 epoch: 95, train_loss: 0.5433, test_loss: 1.3057, test_f1: 0.5818
 epoch: 96, train_loss: 0.5751, test_loss: 1.2176, test_f1: 0.5874
 epoch: 97, train_loss: 0.5671, test_loss: 1.1626, test_f1: 0.6547
 epoch: 98, train_loss: 0.5369, test_loss: 1.1895, test_f1: 0.5992
 epoch: 99, train_loss: 0.5456, test_loss: 1.2215, test_f1: 0.5966
##################ITERATION #5 ****************************************
 epoch: 0, train_loss: 1.2001, test_loss: 1.2978, test_f1: 0.2722
 epoch: 1, train_loss: 1.0218, test_loss: 1.0686, test_f1: 0.4817
 epoch: 2, train_loss: 0.9909, test_loss: 1.0306, test_f1: 0.4468
 epoch: 3, train_loss: 0.9878, test_loss: 1.0491, test_f1: 0.4306
 epoch: 4, train_loss: 0.9481, test_loss: 0.9969, test_f1: 0.5091
 epoch: 5, train_loss: 0.9511, test_loss: 1.0027, test_f1: 0.5318
 epoch: 6, train_loss: 0.9422, test_loss: 1.0830, test_f1: 0.5156
 epoch: 7, train_loss: 0.9544, test_loss: 1.0420, test_f1: 0.5329
 epoch: 8, train_loss: 0.9415, test_loss: 1.0030, test_f1: 0.5286
 epoch: 9, train_loss: 0.9463, test_loss: 1.1432, test_f1: 0.3900
 epoch: 10, train_loss: 0.9135, test_loss: 1.1168, test_f1: 0.5228
 epoch: 11, train_loss: 0.9137, test_loss: 1.1211, test_f1: 0.4728
 epoch: 12, train_loss: 0.9256, test_loss: 1.0062, test_f1: 0.5157
 epoch: 13, train_loss: 0.8686, test_loss: 1.0678, test_f1: 0.5512
 epoch: 14, train_loss: 0.8809, test_loss: 1.3404, test_f1: 0.3505
 epoch: 15, train_loss: 0.8790, test_loss: 0.9623, test_f1: 0.5989
 epoch: 16, train_loss: 0.8663, test_loss: 0.9831, test_f1: 0.5530
 epoch: 17, train_loss: 0.8876, test_loss: 1.0508, test_f1: 0.4874
 epoch: 18, train_loss: 0.8715, test_loss: 1.1722, test_f1: 0.5429
 epoch: 19, train_loss: 0.9222, test_loss: 1.0736, test_f1: 0.5480
 epoch: 20, train_loss: 0.8480, test_loss: 1.0245, test_f1: 0.5656
 epoch: 21, train_loss: 0.8524, test_loss: 1.2158, test_f1: 0.4456
 epoch: 22, train_loss: 0.8159, test_loss: 1.0045, test_f1: 0.5578
 epoch: 23, train_loss: 0.8344, test_loss: 1.3517, test_f1: 0.4990
 epoch: 24, train_loss: 0.8467, test_loss: 1.2687, test_f1: 0.4188
 epoch: 25, train_loss: 0.7984, test_loss: 1.1580, test_f1: 0.4502
 epoch: 26, train_loss: 0.8297, test_loss: 1.0378, test_f1: 0.5608
 epoch: 27, train_loss: 0.8170, test_loss: 1.0551, test_f1: 0.5698
 epoch: 28, train_loss: 0.7998, test_loss: 1.3430, test_f1: 0.5178
 epoch: 29, train_loss: 0.8040, test_loss: 1.0039, test_f1: 0.5741
 epoch: 30, train_loss: 0.8171, test_loss: 1.1395, test_f1: 0.5391
 epoch: 31, train_loss: 0.7931, test_loss: 1.3244, test_f1: 0.5210
 epoch: 32, train_loss: 0.7951, test_loss: 1.0951, test_f1: 0.5633
 epoch: 33, train_loss: 0.7865, test_loss: 2.4058, test_f1: 0.3844
 epoch: 34, train_loss: 0.7856, test_loss: 1.0466, test_f1: 0.5708
 epoch: 35, train_loss: 0.7924, test_loss: 0.9737, test_f1: 0.6195
 epoch: 36, train_loss: 0.7918, test_loss: 0.9909, test_f1: 0.5881
 epoch: 37, train_loss: 0.7912, test_loss: 0.9644, test_f1: 0.6092
 epoch: 38, train_loss: 0.7741, test_loss: 1.0087, test_f1: 0.5425
 epoch: 39, train_loss: 0.7788, test_loss: 0.9768, test_f1: 0.6080
 epoch: 40, train_loss: 0.7775, test_loss: 1.1617, test_f1: 0.5774
 epoch: 41, train_loss: 0.7582, test_loss: 1.0441, test_f1: 0.6120
 epoch: 42, train_loss: 0.7727, test_loss: 1.0357, test_f1: 0.5864
 epoch: 43, train_loss: 0.7592, test_loss: 1.0796, test_f1: 0.5772
 epoch: 44, train_loss: 0.7586, test_loss: 1.2627, test_f1: 0.5566
 epoch: 45, train_loss: 0.7618, test_loss: 0.9647, test_f1: 0.5904
 epoch: 46, train_loss: 0.7525, test_loss: 1.0280, test_f1: 0.5755
 epoch: 47, train_loss: 0.7697, test_loss: 1.0344, test_f1: 0.6306
 epoch: 48, train_loss: 0.7558, test_loss: 0.9895, test_f1: 0.5651
 epoch: 49, train_loss: 0.7356, test_loss: 1.3469, test_f1: 0.5691
 epoch: 50, train_loss: 0.8213, test_loss: 1.1275, test_f1: 0.5481
 epoch: 51, train_loss: 0.7711, test_loss: 1.0092, test_f1: 0.6111
 epoch: 52, train_loss: 0.7469, test_loss: 0.9828, test_f1: 0.6163
 epoch: 53, train_loss: 0.7264, test_loss: 1.1304, test_f1: 0.5681
 epoch: 54, train_loss: 0.7093, test_loss: 1.2876, test_f1: 0.5750
 epoch: 55, train_loss: 0.7226, test_loss: 1.1759, test_f1: 0.5876
 epoch: 56, train_loss: 0.7059, test_loss: 1.0487, test_f1: 0.6001
 epoch: 57, train_loss: 0.7010, test_loss: 1.0224, test_f1: 0.6127
 epoch: 58, train_loss: 0.7009, test_loss: 1.0130, test_f1: 0.6568
 epoch: 59, train_loss: 0.6993, test_loss: 1.1252, test_f1: 0.5774
 epoch: 60, train_loss: 0.7140, test_loss: 1.0969, test_f1: 0.6182
 epoch: 61, train_loss: 0.6907, test_loss: 1.1307, test_f1: 0.5915
 epoch: 62, train_loss: 0.6802, test_loss: 1.2524, test_f1: 0.5941
 epoch: 63, train_loss: 0.6959, test_loss: 1.0174, test_f1: 0.6118
 epoch: 64, train_loss: 0.7105, test_loss: 1.0596, test_f1: 0.6096
 epoch: 65, train_loss: 0.6820, test_loss: 1.0681, test_f1: 0.5993
 epoch: 66, train_loss: 0.6902, test_loss: 1.0252, test_f1: 0.6142
 epoch: 67, train_loss: 0.7087, test_loss: 1.0297, test_f1: 0.5779
 epoch: 68, train_loss: 0.6875, test_loss: 1.1520, test_f1: 0.6027
 epoch: 69, train_loss: 0.6946, test_loss: 1.1180, test_f1: 0.5965
 epoch: 70, train_loss: 0.6821, test_loss: 1.1806, test_f1: 0.5858
 epoch: 71, train_loss: 0.6872, test_loss: 1.1276, test_f1: 0.5908
 epoch: 72, train_loss: 0.6652, test_loss: 1.1027, test_f1: 0.6176
 epoch: 73, train_loss: 0.6770, test_loss: 1.1389, test_f1: 0.6368
 epoch: 74, train_loss: 0.6726, test_loss: 1.3557, test_f1: 0.5725
 epoch: 75, train_loss: 0.6639, test_loss: 1.0522, test_f1: 0.6251
 epoch: 76, train_loss: 0.6583, test_loss: 1.0615, test_f1: 0.5850
 epoch: 77, train_loss: 0.6520, test_loss: 1.0265, test_f1: 0.6346
 epoch: 78, train_loss: 0.6995, test_loss: 1.1875, test_f1: 0.5283
 epoch: 79, train_loss: 0.6702, test_loss: 1.0411, test_f1: 0.6541
 epoch: 80, train_loss: 0.6704, test_loss: 1.0326, test_f1: 0.6252
 epoch: 81, train_loss: 0.6678, test_loss: 0.9816, test_f1: 0.6641
 epoch: 82, train_loss: 0.6496, test_loss: 1.1201, test_f1: 0.5872
 epoch: 83, train_loss: 0.6613, test_loss: 1.0794, test_f1: 0.6254
 epoch: 84, train_loss: 0.6572, test_loss: 1.1900, test_f1: 0.6086
 epoch: 85, train_loss: 0.6483, test_loss: 1.0261, test_f1: 0.6307
 epoch: 86, train_loss: 0.6640, test_loss: 1.0476, test_f1: 0.6275
 epoch: 87, train_loss: 0.6547, test_loss: 1.0608, test_f1: 0.6128
 epoch: 88, train_loss: 0.6488, test_loss: 1.0443, test_f1: 0.6189
 epoch: 89, train_loss: 0.6398, test_loss: 1.0571, test_f1: 0.6342
 epoch: 90, train_loss: 0.6394, test_loss: 0.9801, test_f1: 0.6506
 epoch: 91, train_loss: 0.6362, test_loss: 1.1018, test_f1: 0.5748
 epoch: 92, train_loss: 0.6676, test_loss: 1.0978, test_f1: 0.6257
 epoch: 93, train_loss: 0.6373, test_loss: 1.0380, test_f1: 0.6323
 epoch: 94, train_loss: 0.6290, test_loss: 1.1571, test_f1: 0.6120
 epoch: 95, train_loss: 0.6210, test_loss: 1.1579, test_f1: 0.6116
 epoch: 96, train_loss: 0.6160, test_loss: 1.0804, test_f1: 0.6195
 epoch: 97, train_loss: 0.6101, test_loss: 1.0964, test_f1: 0.6155
 epoch: 98, train_loss: 0.6231, test_loss: 1.0698, test_f1: 0.6647
 epoch: 99, train_loss: 0.6156, test_loss: 1.0781, test_f1: 0.6282
##################ITERATION #6 ****************************************
 epoch: 0, train_loss: 1.1858, test_loss: 1.3703, test_f1: 0.2587
 epoch: 1, train_loss: 1.0083, test_loss: 1.1188, test_f1: 0.4857
 epoch: 2, train_loss: 0.9871, test_loss: 1.0626, test_f1: 0.5161
 epoch: 3, train_loss: 0.9520, test_loss: 1.1037, test_f1: 0.4644
 epoch: 4, train_loss: 0.9399, test_loss: 1.0177, test_f1: 0.4607
 epoch: 5, train_loss: 0.9115, test_loss: 1.1734, test_f1: 0.4099
 epoch: 6, train_loss: 0.8855, test_loss: 0.9933, test_f1: 0.5379
 epoch: 7, train_loss: 0.8890, test_loss: 1.2006, test_f1: 0.4729
 epoch: 8, train_loss: 0.9455, test_loss: 1.4570, test_f1: 0.4140
 epoch: 9, train_loss: 0.9050, test_loss: 1.0192, test_f1: 0.5468
 epoch: 10, train_loss: 0.8946, test_loss: 1.1335, test_f1: 0.4495
 epoch: 11, train_loss: 0.8624, test_loss: 1.0617, test_f1: 0.5463
 epoch: 12, train_loss: 0.8599, test_loss: 0.9997, test_f1: 0.5737
 epoch: 13, train_loss: 0.8432, test_loss: 1.0660, test_f1: 0.4887
 epoch: 14, train_loss: 0.8347, test_loss: 1.0202, test_f1: 0.5501
 epoch: 15, train_loss: 0.8482, test_loss: 1.4007, test_f1: 0.4329
 epoch: 16, train_loss: 0.8396, test_loss: 1.0412, test_f1: 0.5423
 epoch: 17, train_loss: 0.8234, test_loss: 1.1934, test_f1: 0.5299
 epoch: 18, train_loss: 0.8463, test_loss: 1.0018, test_f1: 0.5815
 epoch: 19, train_loss: 0.8302, test_loss: 1.0787, test_f1: 0.5231
 epoch: 20, train_loss: 0.8200, test_loss: 1.0775, test_f1: 0.5239
 epoch: 21, train_loss: 0.8072, test_loss: 1.4379, test_f1: 0.4884
 epoch: 22, train_loss: 0.8024, test_loss: 1.0211, test_f1: 0.5681
 epoch: 23, train_loss: 0.8249, test_loss: 1.2692, test_f1: 0.5152
 epoch: 24, train_loss: 0.8219, test_loss: 2.1662, test_f1: 0.4404
 epoch: 25, train_loss: 0.8117, test_loss: 1.2312, test_f1: 0.4889
 epoch: 26, train_loss: 0.8018, test_loss: 1.2409, test_f1: 0.5636
 epoch: 27, train_loss: 0.8029, test_loss: 1.0657, test_f1: 0.5062
 epoch: 28, train_loss: 0.8043, test_loss: 1.2962, test_f1: 0.4556
 epoch: 29, train_loss: 0.7695, test_loss: 1.0729, test_f1: 0.5004
 epoch: 30, train_loss: 0.7959, test_loss: 1.0519, test_f1: 0.5547
 epoch: 31, train_loss: 0.7512, test_loss: 1.2462, test_f1: 0.5286
 epoch: 32, train_loss: 0.7516, test_loss: 1.3500, test_f1: 0.5795
 epoch: 33, train_loss: 0.7730, test_loss: 1.4716, test_f1: 0.5290
 epoch: 34, train_loss: 0.7787, test_loss: 1.2013, test_f1: 0.5383
 epoch: 35, train_loss: 0.7659, test_loss: 1.1254, test_f1: 0.5605
 epoch: 36, train_loss: 0.7731, test_loss: 1.1810, test_f1: 0.5382
 epoch: 37, train_loss: 0.7490, test_loss: 0.9784, test_f1: 0.6589
 epoch: 38, train_loss: 0.7692, test_loss: 1.7264, test_f1: 0.5418
 epoch: 39, train_loss: 0.7657, test_loss: 1.4701, test_f1: 0.4938
 epoch: 40, train_loss: 0.7305, test_loss: 1.5765, test_f1: 0.5250
 epoch: 41, train_loss: 0.7392, test_loss: 1.3840, test_f1: 0.4570
 epoch: 42, train_loss: 0.7529, test_loss: 2.1515, test_f1: 0.4876
 epoch: 43, train_loss: 0.7493, test_loss: 1.3359, test_f1: 0.5332
 epoch: 44, train_loss: 0.7561, test_loss: 1.2314, test_f1: 0.5854
 epoch: 45, train_loss: 0.7260, test_loss: 1.3849, test_f1: 0.4841
 epoch: 46, train_loss: 0.7419, test_loss: 1.0918, test_f1: 0.5807
 epoch: 47, train_loss: 0.7184, test_loss: 1.0394, test_f1: 0.5628
 epoch: 48, train_loss: 0.7475, test_loss: 2.0017, test_f1: 0.4760
 epoch: 49, train_loss: 0.7397, test_loss: 1.1367, test_f1: 0.5915
 epoch: 50, train_loss: 0.7298, test_loss: 1.5251, test_f1: 0.4973
 epoch: 51, train_loss: 0.7223, test_loss: 1.3528, test_f1: 0.5733
 epoch: 52, train_loss: 0.6989, test_loss: 1.1275, test_f1: 0.5590
 epoch: 53, train_loss: 0.6738, test_loss: 1.2447, test_f1: 0.5810
 epoch: 54, train_loss: 0.6644, test_loss: 1.5675, test_f1: 0.5387
 epoch: 55, train_loss: 0.6775, test_loss: 1.2940, test_f1: 0.5838
 epoch: 56, train_loss: 0.6911, test_loss: 1.1332, test_f1: 0.6325
 epoch: 57, train_loss: 0.6458, test_loss: 1.3697, test_f1: 0.5703
 epoch: 58, train_loss: 0.6428, test_loss: 1.3523, test_f1: 0.6070
 epoch: 59, train_loss: 0.6680, test_loss: 1.2193, test_f1: 0.5754
 epoch: 60, train_loss: 0.6727, test_loss: 1.0785, test_f1: 0.6256
 epoch: 61, train_loss: 0.6440, test_loss: 1.3863, test_f1: 0.5370
 epoch: 62, train_loss: 0.6523, test_loss: 1.4387, test_f1: 0.5208
 epoch: 63, train_loss: 0.6631, test_loss: 1.2059, test_f1: 0.5179
 epoch: 64, train_loss: 0.6491, test_loss: 1.1971, test_f1: 0.6283
 epoch: 65, train_loss: 0.6233, test_loss: 1.4852, test_f1: 0.5679
 epoch: 66, train_loss: 0.6706, test_loss: 1.1817, test_f1: 0.6280
 epoch: 67, train_loss: 0.6449, test_loss: 1.3959, test_f1: 0.5331
 epoch: 68, train_loss: 0.6632, test_loss: 1.5174, test_f1: 0.6056
 epoch: 69, train_loss: 0.6426, test_loss: 1.2873, test_f1: 0.5601
 epoch: 70, train_loss: 0.6292, test_loss: 1.5058, test_f1: 0.5608
 epoch: 71, train_loss: 0.6038, test_loss: 1.4476, test_f1: 0.5984
 epoch: 72, train_loss: 0.6420, test_loss: 1.1212, test_f1: 0.6116
 epoch: 73, train_loss: 0.6312, test_loss: 1.5817, test_f1: 0.5825
 epoch: 74, train_loss: 0.6409, test_loss: 1.2291, test_f1: 0.5951
 epoch: 75, train_loss: 0.6538, test_loss: 1.4143, test_f1: 0.5683
 epoch: 76, train_loss: 0.6202, test_loss: 1.4653, test_f1: 0.5852
 epoch: 77, train_loss: 0.6470, test_loss: 1.3488, test_f1: 0.5742
 epoch: 78, train_loss: 0.6464, test_loss: 1.0523, test_f1: 0.5636
 epoch: 79, train_loss: 0.6447, test_loss: 1.2854, test_f1: 0.6116
 epoch: 80, train_loss: 0.6323, test_loss: 1.1968, test_f1: 0.6113
 epoch: 81, train_loss: 0.6337, test_loss: 1.1330, test_f1: 0.5854
 epoch: 82, train_loss: 0.6167, test_loss: 1.2269, test_f1: 0.5459
 epoch: 83, train_loss: 0.6111, test_loss: 1.1781, test_f1: 0.5991
 epoch: 84, train_loss: 0.6235, test_loss: 1.4118, test_f1: 0.5983
 epoch: 85, train_loss: 0.6321, test_loss: 1.0935, test_f1: 0.5837
 epoch: 86, train_loss: 0.6074, test_loss: 1.1749, test_f1: 0.6055
 epoch: 87, train_loss: 0.6244, test_loss: 2.0725, test_f1: 0.4870
 epoch: 88, train_loss: 0.6149, test_loss: 1.2534, test_f1: 0.5839
 epoch: 89, train_loss: 0.5952, test_loss: 1.6422, test_f1: 0.5775
 epoch: 90, train_loss: 0.6052, test_loss: 1.4891, test_f1: 0.5694
 epoch: 91, train_loss: 0.6217, test_loss: 1.3232, test_f1: 0.5518
 epoch: 92, train_loss: 0.6013, test_loss: 1.1971, test_f1: 0.5952
 epoch: 93, train_loss: 0.5829, test_loss: 1.4985, test_f1: 0.5303
 epoch: 94, train_loss: 0.5871, test_loss: 1.5348, test_f1: 0.5600
 epoch: 95, train_loss: 0.5951, test_loss: 1.2900, test_f1: 0.6156
 epoch: 96, train_loss: 0.6043, test_loss: 1.4775, test_f1: 0.5580
 epoch: 97, train_loss: 0.6107, test_loss: 1.2968, test_f1: 0.6199
 epoch: 98, train_loss: 0.5865, test_loss: 1.9448, test_f1: 0.5455
 epoch: 99, train_loss: 0.5949, test_loss: 1.8296, test_f1: 0.5406
##################ITERATION #7 ****************************************
 epoch: 0, train_loss: 1.2135, test_loss: 1.3368, test_f1: 0.2281
 epoch: 1, train_loss: 1.0294, test_loss: 1.1881, test_f1: 0.3516
 epoch: 2, train_loss: 0.9817, test_loss: 1.0531, test_f1: 0.5138
 epoch: 3, train_loss: 0.9714, test_loss: 1.0359, test_f1: 0.4724
 epoch: 4, train_loss: 0.9575, test_loss: 1.0303, test_f1: 0.4672
 epoch: 5, train_loss: 0.9440, test_loss: 1.0265, test_f1: 0.5178
 epoch: 6, train_loss: 0.9355, test_loss: 1.0215, test_f1: 0.5140
 epoch: 7, train_loss: 0.9309, test_loss: 1.1611, test_f1: 0.4771
 epoch: 8, train_loss: 0.9193, test_loss: 1.1365, test_f1: 0.4366
 epoch: 9, train_loss: 0.9111, test_loss: 1.0654, test_f1: 0.5319
 epoch: 10, train_loss: 0.9002, test_loss: 1.0232, test_f1: 0.5350
 epoch: 11, train_loss: 0.8695, test_loss: 1.0583, test_f1: 0.5756
 epoch: 12, train_loss: 0.8635, test_loss: 1.0380, test_f1: 0.5287
 epoch: 13, train_loss: 0.8346, test_loss: 0.9996, test_f1: 0.5523
 epoch: 14, train_loss: 0.8407, test_loss: 1.1592, test_f1: 0.4214
 epoch: 15, train_loss: 0.8279, test_loss: 1.3584, test_f1: 0.4638
 epoch: 16, train_loss: 0.8135, test_loss: 1.0856, test_f1: 0.5404
 epoch: 17, train_loss: 0.8645, test_loss: 1.4106, test_f1: 0.4661
 epoch: 18, train_loss: 0.8388, test_loss: 1.0591, test_f1: 0.5123
 epoch: 19, train_loss: 0.8402, test_loss: 1.0116, test_f1: 0.5674
 epoch: 20, train_loss: 0.8354, test_loss: 1.1268, test_f1: 0.5356
 epoch: 21, train_loss: 0.8326, test_loss: 1.0175, test_f1: 0.5048
 epoch: 22, train_loss: 0.8023, test_loss: 1.1336, test_f1: 0.5474
 epoch: 23, train_loss: 0.7894, test_loss: 1.0310, test_f1: 0.5650
 epoch: 24, train_loss: 0.7914, test_loss: 1.0191, test_f1: 0.5511
 epoch: 25, train_loss: 0.7785, test_loss: 0.9959, test_f1: 0.5609
 epoch: 26, train_loss: 0.7879, test_loss: 1.1022, test_f1: 0.5400
 epoch: 27, train_loss: 0.7763, test_loss: 1.0342, test_f1: 0.5254
 epoch: 28, train_loss: 0.7797, test_loss: 1.0189, test_f1: 0.5773
 epoch: 29, train_loss: 0.7736, test_loss: 1.0371, test_f1: 0.5128
 epoch: 30, train_loss: 0.7664, test_loss: 1.0611, test_f1: 0.5489
 epoch: 31, train_loss: 0.7660, test_loss: 1.2059, test_f1: 0.5110
 epoch: 32, train_loss: 0.7645, test_loss: 2.0046, test_f1: 0.4555
 epoch: 33, train_loss: 0.7581, test_loss: 1.3934, test_f1: 0.3806
 epoch: 34, train_loss: 0.7519, test_loss: 1.0955, test_f1: 0.5265
 epoch: 35, train_loss: 0.7458, test_loss: 1.0338, test_f1: 0.5862
 epoch: 36, train_loss: 0.7380, test_loss: 1.0672, test_f1: 0.5328
 epoch: 37, train_loss: 0.7525, test_loss: 0.9934, test_f1: 0.6036
 epoch: 38, train_loss: 0.7367, test_loss: 1.0449, test_f1: 0.5811
 epoch: 39, train_loss: 0.7154, test_loss: 1.1334, test_f1: 0.4880
 epoch: 40, train_loss: 0.7677, test_loss: 1.1127, test_f1: 0.5430
 epoch: 41, train_loss: 0.7379, test_loss: 1.0965, test_f1: 0.5489
 epoch: 42, train_loss: 0.7286, test_loss: 0.9875, test_f1: 0.6114
 epoch: 43, train_loss: 0.7268, test_loss: 1.1805, test_f1: 0.5678
 epoch: 44, train_loss: 0.7214, test_loss: 1.1772, test_f1: 0.5820
 epoch: 45, train_loss: 0.7189, test_loss: 1.1651, test_f1: 0.5729
 epoch: 46, train_loss: 0.7250, test_loss: 1.2579, test_f1: 0.4927
 epoch: 47, train_loss: 0.7285, test_loss: 1.0760, test_f1: 0.5965
 epoch: 48, train_loss: 0.7292, test_loss: 0.9961, test_f1: 0.6290
 epoch: 49, train_loss: 0.7152, test_loss: 1.0264, test_f1: 0.5792
 epoch: 50, train_loss: 0.7272, test_loss: 1.3164, test_f1: 0.5543
 epoch: 51, train_loss: 0.6958, test_loss: 1.0437, test_f1: 0.5893
 epoch: 52, train_loss: 0.7024, test_loss: 1.0784, test_f1: 0.6325
 epoch: 53, train_loss: 0.6700, test_loss: 1.0704, test_f1: 0.6222
 epoch: 54, train_loss: 0.6619, test_loss: 1.2449, test_f1: 0.5248
 epoch: 55, train_loss: 0.6733, test_loss: 1.0996, test_f1: 0.6034
 epoch: 56, train_loss: 0.6616, test_loss: 1.1263, test_f1: 0.5583
 epoch: 57, train_loss: 0.6615, test_loss: 1.1422, test_f1: 0.6031
 epoch: 58, train_loss: 0.6438, test_loss: 1.0646, test_f1: 0.6095
 epoch: 59, train_loss: 0.6459, test_loss: 1.1208, test_f1: 0.6010
 epoch: 60, train_loss: 0.6754, test_loss: 1.0875, test_f1: 0.5967
 epoch: 61, train_loss: 0.6734, test_loss: 1.0521, test_f1: 0.6127
 epoch: 62, train_loss: 0.6520, test_loss: 1.1035, test_f1: 0.6374
 epoch: 63, train_loss: 0.6176, test_loss: 1.1337, test_f1: 0.5964
 epoch: 64, train_loss: 0.6208, test_loss: 1.1758, test_f1: 0.5863
 epoch: 65, train_loss: 0.6480, test_loss: 1.1932, test_f1: 0.5876
 epoch: 66, train_loss: 0.6560, test_loss: 1.1638, test_f1: 0.5951
 epoch: 67, train_loss: 0.6422, test_loss: 1.2275, test_f1: 0.6236
 epoch: 68, train_loss: 0.6108, test_loss: 1.1432, test_f1: 0.6435
 epoch: 69, train_loss: 0.6253, test_loss: 1.2872, test_f1: 0.5943
 epoch: 70, train_loss: 0.6217, test_loss: 1.1875, test_f1: 0.5933
 epoch: 71, train_loss: 0.6003, test_loss: 1.2785, test_f1: 0.5760
 epoch: 72, train_loss: 0.6411, test_loss: 1.0805, test_f1: 0.6321
 epoch: 73, train_loss: 0.6184, test_loss: 1.2375, test_f1: 0.5609
 epoch: 74, train_loss: 0.5971, test_loss: 1.2939, test_f1: 0.6114
 epoch: 75, train_loss: 0.6333, test_loss: 1.1636, test_f1: 0.5960
 epoch: 76, train_loss: 0.6297, test_loss: 1.0604, test_f1: 0.5690
 epoch: 77, train_loss: 0.6210, test_loss: 1.4721, test_f1: 0.5392
 epoch: 78, train_loss: 0.5979, test_loss: 1.3430, test_f1: 0.5887
 epoch: 79, train_loss: 0.6150, test_loss: 1.1719, test_f1: 0.6172
 epoch: 80, train_loss: 0.5958, test_loss: 1.2280, test_f1: 0.5721
 epoch: 81, train_loss: 0.5918, test_loss: 1.2455, test_f1: 0.5786
 epoch: 82, train_loss: 0.6085, test_loss: 1.2665, test_f1: 0.6191
 epoch: 83, train_loss: 0.5870, test_loss: 1.2662, test_f1: 0.5809
 epoch: 84, train_loss: 0.5913, test_loss: 1.3017, test_f1: 0.6040
 epoch: 85, train_loss: 0.5885, test_loss: 1.1894, test_f1: 0.6138
 epoch: 86, train_loss: 0.5978, test_loss: 1.2775, test_f1: 0.6076
 epoch: 87, train_loss: 0.6042, test_loss: 1.2401, test_f1: 0.5974
 epoch: 88, train_loss: 0.6250, test_loss: 1.1726, test_f1: 0.6115
 epoch: 89, train_loss: 0.6131, test_loss: 1.1462, test_f1: 0.5908
 epoch: 90, train_loss: 0.5924, test_loss: 1.2319, test_f1: 0.5964
 epoch: 91, train_loss: 0.5760, test_loss: 1.4883, test_f1: 0.5709
 epoch: 92, train_loss: 0.5580, test_loss: 1.4633, test_f1: 0.5828
 epoch: 93, train_loss: 0.6006, test_loss: 1.4158, test_f1: 0.6057
 epoch: 94, train_loss: 0.5960, test_loss: 1.6273, test_f1: 0.5362
 epoch: 95, train_loss: 0.5866, test_loss: 1.2703, test_f1: 0.6017
 epoch: 96, train_loss: 0.5753, test_loss: 1.3004, test_f1: 0.5728
 epoch: 97, train_loss: 0.5982, test_loss: 1.3822, test_f1: 0.5974
 epoch: 98, train_loss: 0.5972, test_loss: 1.4812, test_f1: 0.6111
 epoch: 99, train_loss: 0.5844, test_loss: 1.3196, test_f1: 0.6162
##################ITERATION #8 ****************************************
 epoch: 0, train_loss: 1.3191, test_loss: 1.5472, test_f1: 0.1365
 epoch: 1, train_loss: 1.0512, test_loss: 1.1889, test_f1: 0.3973
 epoch: 2, train_loss: 1.0170, test_loss: 1.0792, test_f1: 0.3926
 epoch: 3, train_loss: 0.9780, test_loss: 1.0144, test_f1: 0.4499
 epoch: 4, train_loss: 0.9630, test_loss: 1.0398, test_f1: 0.4942
 epoch: 5, train_loss: 0.9591, test_loss: 1.0100, test_f1: 0.4858
 epoch: 6, train_loss: 0.9330, test_loss: 1.0126, test_f1: 0.5532
 epoch: 7, train_loss: 0.9004, test_loss: 1.0204, test_f1: 0.5475
 epoch: 8, train_loss: 0.8864, test_loss: 1.1194, test_f1: 0.4419
 epoch: 9, train_loss: 0.8620, test_loss: 1.0476, test_f1: 0.4769
 epoch: 10, train_loss: 0.8751, test_loss: 1.0945, test_f1: 0.4756
 epoch: 11, train_loss: 0.8654, test_loss: 0.9810, test_f1: 0.4736
 epoch: 12, train_loss: 0.8595, test_loss: 0.9899, test_f1: 0.4932
 epoch: 13, train_loss: 0.8671, test_loss: 0.9688, test_f1: 0.4951
 epoch: 14, train_loss: 0.8735, test_loss: 1.0219, test_f1: 0.4298
 epoch: 15, train_loss: 0.8503, test_loss: 1.0278, test_f1: 0.5437
 epoch: 16, train_loss: 0.8535, test_loss: 1.0166, test_f1: 0.4713
 epoch: 17, train_loss: 0.8253, test_loss: 0.9679, test_f1: 0.5628
 epoch: 18, train_loss: 0.8326, test_loss: 1.0690, test_f1: 0.5290
 epoch: 19, train_loss: 0.8276, test_loss: 0.9908, test_f1: 0.5636
 epoch: 20, train_loss: 0.8167, test_loss: 1.0154, test_f1: 0.5037
 epoch: 21, train_loss: 0.7956, test_loss: 1.0332, test_f1: 0.5771
 epoch: 22, train_loss: 0.8312, test_loss: 1.1793, test_f1: 0.4607
 epoch: 23, train_loss: 0.8463, test_loss: 1.0349, test_f1: 0.5177
 epoch: 24, train_loss: 0.8669, test_loss: 1.1005, test_f1: 0.4888
 epoch: 25, train_loss: 0.8428, test_loss: 0.9511, test_f1: 0.5718
 epoch: 26, train_loss: 0.8041, test_loss: 1.0641, test_f1: 0.5069
 epoch: 27, train_loss: 0.8008, test_loss: 1.0627, test_f1: 0.4347
 epoch: 28, train_loss: 0.8080, test_loss: 1.1826, test_f1: 0.4934
 epoch: 29, train_loss: 0.8104, test_loss: 1.1873, test_f1: 0.4142
 epoch: 30, train_loss: 0.7892, test_loss: 1.0358, test_f1: 0.5147
 epoch: 31, train_loss: 0.7977, test_loss: 1.1888, test_f1: 0.4748
 epoch: 32, train_loss: 0.7810, test_loss: 1.2049, test_f1: 0.5100
 epoch: 33, train_loss: 0.7726, test_loss: 1.2021, test_f1: 0.5827
 epoch: 34, train_loss: 0.7903, test_loss: 0.9954, test_f1: 0.4854
 epoch: 35, train_loss: 0.7860, test_loss: 1.2218, test_f1: 0.5366
 epoch: 36, train_loss: 0.7499, test_loss: 1.0859, test_f1: 0.4946
 epoch: 37, train_loss: 0.7680, test_loss: 1.1518, test_f1: 0.5028
 epoch: 38, train_loss: 0.7588, test_loss: 1.1404, test_f1: 0.4971
 epoch: 39, train_loss: 0.7510, test_loss: 1.0846, test_f1: 0.5095
 epoch: 40, train_loss: 0.7469, test_loss: 2.2485, test_f1: 0.3981
 epoch: 41, train_loss: 0.7616, test_loss: 1.1959, test_f1: 0.5177
 epoch: 42, train_loss: 0.7705, test_loss: 1.3711, test_f1: 0.4765
 epoch: 43, train_loss: 0.7547, test_loss: 1.2329, test_f1: 0.5793
 epoch: 44, train_loss: 0.7299, test_loss: 1.1730, test_f1: 0.5387
 epoch: 45, train_loss: 0.7519, test_loss: 1.3344, test_f1: 0.4708
 epoch: 46, train_loss: 0.7432, test_loss: 1.2303, test_f1: 0.4896
 epoch: 47, train_loss: 0.7101, test_loss: 1.3829, test_f1: 0.5833
 epoch: 48, train_loss: 0.7445, test_loss: 1.8429, test_f1: 0.5072
 epoch: 49, train_loss: 0.7538, test_loss: 1.1446, test_f1: 0.4891
 epoch: 50, train_loss: 0.7138, test_loss: 1.2802, test_f1: 0.4506
 epoch: 51, train_loss: 0.7086, test_loss: 1.2674, test_f1: 0.6014
 epoch: 52, train_loss: 0.6911, test_loss: 1.2355, test_f1: 0.5860
 epoch: 53, train_loss: 0.6778, test_loss: 1.4324, test_f1: 0.5573
 epoch: 54, train_loss: 0.6803, test_loss: 1.9021, test_f1: 0.5102
 epoch: 55, train_loss: 0.6990, test_loss: 1.2791, test_f1: 0.5651
 epoch: 56, train_loss: 0.6674, test_loss: 1.4137, test_f1: 0.5030
 epoch: 57, train_loss: 0.6759, test_loss: 1.1422, test_f1: 0.5355
 epoch: 58, train_loss: 0.6749, test_loss: 1.3857, test_f1: 0.5007
 epoch: 59, train_loss: 0.6491, test_loss: 1.5213, test_f1: 0.5274
 epoch: 60, train_loss: 0.6735, test_loss: 1.5560, test_f1: 0.5305
 epoch: 61, train_loss: 0.6648, test_loss: 1.2049, test_f1: 0.5205
 epoch: 62, train_loss: 0.6580, test_loss: 1.2741, test_f1: 0.5525
 epoch: 63, train_loss: 0.6654, test_loss: 1.1196, test_f1: 0.5821
 epoch: 64, train_loss: 0.6536, test_loss: 1.3465, test_f1: 0.4938
 epoch: 65, train_loss: 0.6372, test_loss: 1.2553, test_f1: 0.5376
 epoch: 66, train_loss: 0.6393, test_loss: 1.3552, test_f1: 0.4787
 epoch: 67, train_loss: 0.6320, test_loss: 1.5952, test_f1: 0.5211
 epoch: 68, train_loss: 0.6435, test_loss: 1.3753, test_f1: 0.5319
 epoch: 69, train_loss: 0.7199, test_loss: 1.1812, test_f1: 0.5521
 epoch: 70, train_loss: 0.6605, test_loss: 1.1743, test_f1: 0.5784
 epoch: 71, train_loss: 0.6435, test_loss: 1.3704, test_f1: 0.5411
 epoch: 72, train_loss: 0.6604, test_loss: 1.4684, test_f1: 0.5092
 epoch: 73, train_loss: 0.6386, test_loss: 1.1548, test_f1: 0.5671
 epoch: 74, train_loss: 0.6145, test_loss: 1.2859, test_f1: 0.5637
 epoch: 75, train_loss: 0.6194, test_loss: 1.2872, test_f1: 0.5460
 epoch: 76, train_loss: 0.6587, test_loss: 1.2077, test_f1: 0.5747
 epoch: 77, train_loss: 0.6881, test_loss: 1.2601, test_f1: 0.4978
 epoch: 78, train_loss: 0.6372, test_loss: 1.2853, test_f1: 0.5092
 epoch: 79, train_loss: 0.6095, test_loss: 1.2473, test_f1: 0.5253
 epoch: 80, train_loss: 0.6230, test_loss: 1.2627, test_f1: 0.5557
 epoch: 81, train_loss: 0.6264, test_loss: 1.1601, test_f1: 0.5492
 epoch: 82, train_loss: 0.6521, test_loss: 1.1420, test_f1: 0.5920
 epoch: 83, train_loss: 0.6292, test_loss: 1.3502, test_f1: 0.5399
 epoch: 84, train_loss: 0.6127, test_loss: 1.4945, test_f1: 0.4934
 epoch: 85, train_loss: 0.6151, test_loss: 1.4488, test_f1: 0.5432
 epoch: 86, train_loss: 0.6212, test_loss: 1.7465, test_f1: 0.4810
 epoch: 87, train_loss: 0.6397, test_loss: 1.2987, test_f1: 0.5230
 epoch: 88, train_loss: 0.6260, test_loss: 1.1589, test_f1: 0.6023
 epoch: 89, train_loss: 0.6205, test_loss: 1.7917, test_f1: 0.5351
 epoch: 90, train_loss: 0.5989, test_loss: 1.0770, test_f1: 0.5760
 epoch: 91, train_loss: 0.5888, test_loss: 1.2622, test_f1: 0.5964
 epoch: 92, train_loss: 0.6066, test_loss: 1.3159, test_f1: 0.5870
 epoch: 93, train_loss: 0.6140, test_loss: 1.2874, test_f1: 0.5685
 epoch: 94, train_loss: 0.6175, test_loss: 1.3472, test_f1: 0.5769
 epoch: 95, train_loss: 0.6222, test_loss: 1.3748, test_f1: 0.5340
 epoch: 96, train_loss: 0.6098, test_loss: 1.4588, test_f1: 0.5408
 epoch: 97, train_loss: 0.6141, test_loss: 1.2396, test_f1: 0.5722
 epoch: 98, train_loss: 0.6084, test_loss: 1.3016, test_f1: 0.5605
 epoch: 99, train_loss: 0.5949, test_loss: 1.6693, test_f1: 0.5282
##################ITERATION #9 ****************************************
 epoch: 0, train_loss: 1.2262, test_loss: 1.2291, test_f1: 0.2281
 epoch: 1, train_loss: 1.0411, test_loss: 1.0842, test_f1: 0.4444
 epoch: 2, train_loss: 1.0136, test_loss: 1.0503, test_f1: 0.4681
 epoch: 3, train_loss: 0.9910, test_loss: 1.1204, test_f1: 0.3911
 epoch: 4, train_loss: 0.9717, test_loss: 1.1462, test_f1: 0.4385
 epoch: 5, train_loss: 0.9646, test_loss: 1.0418, test_f1: 0.4992
 epoch: 6, train_loss: 0.9546, test_loss: 1.1040, test_f1: 0.5240
 epoch: 7, train_loss: 0.9265, test_loss: 1.0068, test_f1: 0.5133
 epoch: 8, train_loss: 0.9086, test_loss: 1.0956, test_f1: 0.4722
 epoch: 9, train_loss: 0.9298, test_loss: 0.9917, test_f1: 0.5676
 epoch: 10, train_loss: 0.8888, test_loss: 0.9964, test_f1: 0.5728
 epoch: 11, train_loss: 0.8810, test_loss: 1.0220, test_f1: 0.5361
 epoch: 12, train_loss: 0.8796, test_loss: 1.1028, test_f1: 0.4876
 epoch: 13, train_loss: 0.8651, test_loss: 1.0330, test_f1: 0.5280
 epoch: 14, train_loss: 0.8462, test_loss: 1.0331, test_f1: 0.4930
 epoch: 15, train_loss: 0.8352, test_loss: 0.9725, test_f1: 0.5762
 epoch: 16, train_loss: 0.8322, test_loss: 0.9919, test_f1: 0.5376
 epoch: 17, train_loss: 0.8318, test_loss: 1.0394, test_f1: 0.5271
 epoch: 18, train_loss: 0.8292, test_loss: 0.9825, test_f1: 0.5557
 epoch: 19, train_loss: 0.8441, test_loss: 1.1864, test_f1: 0.4556
 epoch: 20, train_loss: 0.8723, test_loss: 1.3780, test_f1: 0.4901
 epoch: 21, train_loss: 0.8062, test_loss: 0.9811, test_f1: 0.5904
 epoch: 22, train_loss: 0.8054, test_loss: 0.9866, test_f1: 0.6242
 epoch: 23, train_loss: 0.8286, test_loss: 1.0574, test_f1: 0.5040
 epoch: 24, train_loss: 0.7859, test_loss: 1.0964, test_f1: 0.5189
 epoch: 25, train_loss: 0.7800, test_loss: 0.9880, test_f1: 0.5630
 epoch: 26, train_loss: 0.7682, test_loss: 1.1254, test_f1: 0.5414
 epoch: 27, train_loss: 0.7921, test_loss: 0.9961, test_f1: 0.5880
 epoch: 28, train_loss: 0.7657, test_loss: 1.1682, test_f1: 0.5077
 epoch: 29, train_loss: 0.7566, test_loss: 1.0190, test_f1: 0.5680
 epoch: 30, train_loss: 0.7812, test_loss: 1.0781, test_f1: 0.5765
 epoch: 31, train_loss: 0.7877, test_loss: 1.0741, test_f1: 0.4883
 epoch: 32, train_loss: 0.7705, test_loss: 1.0844, test_f1: 0.5214
 epoch: 33, train_loss: 0.7639, test_loss: 1.3920, test_f1: 0.5355
 epoch: 34, train_loss: 0.7754, test_loss: 1.1789, test_f1: 0.5056
 epoch: 35, train_loss: 0.7747, test_loss: 1.1961, test_f1: 0.4787
 epoch: 36, train_loss: 0.7699, test_loss: 1.0953, test_f1: 0.5310
 epoch: 37, train_loss: 0.7486, test_loss: 1.0415, test_f1: 0.6107
 epoch: 38, train_loss: 0.7466, test_loss: 1.0208, test_f1: 0.5569
 epoch: 39, train_loss: 0.7632, test_loss: 1.0187, test_f1: 0.5962
 epoch: 40, train_loss: 0.7591, test_loss: 1.1357, test_f1: 0.5031
 epoch: 41, train_loss: 0.7526, test_loss: 1.0877, test_f1: 0.6197
 epoch: 42, train_loss: 0.7463, test_loss: 1.0575, test_f1: 0.5809
 epoch: 43, train_loss: 0.7143, test_loss: 1.1010, test_f1: 0.5177
 epoch: 44, train_loss: 0.7232, test_loss: 1.1791, test_f1: 0.4976
 epoch: 45, train_loss: 0.7510, test_loss: 1.2687, test_f1: 0.4775
 epoch: 46, train_loss: 0.7416, test_loss: 1.1637, test_f1: 0.5003
 epoch: 47, train_loss: 0.7339, test_loss: 1.1715, test_f1: 0.4632
 epoch: 48, train_loss: 0.7145, test_loss: 1.2590, test_f1: 0.4705
 epoch: 49, train_loss: 0.7150, test_loss: 1.2664, test_f1: 0.5053
 epoch: 50, train_loss: 0.7272, test_loss: 1.1619, test_f1: 0.5878
 epoch: 51, train_loss: 0.6918, test_loss: 1.0967, test_f1: 0.5655
 epoch: 52, train_loss: 0.6850, test_loss: 1.1386, test_f1: 0.6078
 epoch: 53, train_loss: 0.6616, test_loss: 1.0463, test_f1: 0.6485
 epoch: 54, train_loss: 0.6660, test_loss: 1.1223, test_f1: 0.6319
 epoch: 55, train_loss: 0.6654, test_loss: 1.1662, test_f1: 0.5685
 epoch: 56, train_loss: 0.6602, test_loss: 1.0999, test_f1: 0.5948
 epoch: 57, train_loss: 0.6577, test_loss: 1.1560, test_f1: 0.5977
 epoch: 58, train_loss: 0.6520, test_loss: 1.0993, test_f1: 0.5770
 epoch: 59, train_loss: 0.6570, test_loss: 1.2263, test_f1: 0.5388
 epoch: 60, train_loss: 0.6435, test_loss: 1.3124, test_f1: 0.5566
 epoch: 61, train_loss: 0.6386, test_loss: 1.2651, test_f1: 0.5846
 epoch: 62, train_loss: 0.6236, test_loss: 1.1870, test_f1: 0.6280
 epoch: 63, train_loss: 0.6477, test_loss: 1.1106, test_f1: 0.6379
 epoch: 64, train_loss: 0.6258, test_loss: 1.1537, test_f1: 0.5925
 epoch: 65, train_loss: 0.6336, test_loss: 1.3348, test_f1: 0.5633
 epoch: 66, train_loss: 0.6417, test_loss: 1.1867, test_f1: 0.5835
 epoch: 67, train_loss: 0.6565, test_loss: 1.2374, test_f1: 0.5830
 epoch: 68, train_loss: 0.6197, test_loss: 1.3330, test_f1: 0.5398
 epoch: 69, train_loss: 0.6213, test_loss: 1.1931, test_f1: 0.6341
 epoch: 70, train_loss: 0.6335, test_loss: 1.1250, test_f1: 0.6351
 epoch: 71, train_loss: 0.6298, test_loss: 1.9761, test_f1: 0.4607
 epoch: 72, train_loss: 0.6195, test_loss: 1.4000, test_f1: 0.5692
 epoch: 73, train_loss: 0.6162, test_loss: 1.1861, test_f1: 0.5831
 epoch: 74, train_loss: 0.6385, test_loss: 1.2932, test_f1: 0.5678
 epoch: 75, train_loss: 0.6020, test_loss: 1.3890, test_f1: 0.5419
 epoch: 76, train_loss: 0.6049, test_loss: 1.3790, test_f1: 0.5019
 epoch: 77, train_loss: 0.6425, test_loss: 1.5153, test_f1: 0.5505
 epoch: 78, train_loss: 0.6163, test_loss: 1.1799, test_f1: 0.6455
 epoch: 79, train_loss: 0.6386, test_loss: 1.0885, test_f1: 0.6380
 epoch: 80, train_loss: 0.6045, test_loss: 1.3605, test_f1: 0.5966
 epoch: 81, train_loss: 0.5905, test_loss: 1.2269, test_f1: 0.6139
 epoch: 82, train_loss: 0.6078, test_loss: 1.4510, test_f1: 0.5794
 epoch: 83, train_loss: 0.6079, test_loss: 1.4321, test_f1: 0.5880
 epoch: 84, train_loss: 0.5956, test_loss: 1.2387, test_f1: 0.6279
 epoch: 85, train_loss: 0.5914, test_loss: 1.3323, test_f1: 0.6041
 epoch: 86, train_loss: 0.5901, test_loss: 1.4302, test_f1: 0.5292
 epoch: 87, train_loss: 0.5849, test_loss: 1.3557, test_f1: 0.5654
 epoch: 88, train_loss: 0.6164, test_loss: 1.2423, test_f1: 0.6081
 epoch: 89, train_loss: 0.5592, test_loss: 1.3024, test_f1: 0.5936
 epoch: 90, train_loss: 0.6042, test_loss: 1.3227, test_f1: 0.6048
 epoch: 91, train_loss: 0.6085, test_loss: 1.3616, test_f1: 0.5442
 epoch: 92, train_loss: 0.5989, test_loss: 1.4901, test_f1: 0.5564
 epoch: 93, train_loss: 0.5586, test_loss: 1.2234, test_f1: 0.6086
 epoch: 94, train_loss: 0.5824, test_loss: 1.4923, test_f1: 0.5451
 epoch: 95, train_loss: 0.5837, test_loss: 1.3269, test_f1: 0.5886
 epoch: 96, train_loss: 0.5979, test_loss: 1.2434, test_f1: 0.6019
 epoch: 97, train_loss: 0.5950, test_loss: 1.3101, test_f1: 0.5662
 epoch: 98, train_loss: 0.5833, test_loss: 1.3868, test_f1: 0.5754
 epoch: 99, train_loss: 0.5733, test_loss: 1.2248, test_f1: 0.6079

Training completed in 737.87 seconds
Best F1: 0.6647 at epoch 98
Mean F1 across iterations: 0.6452  0.0195
========================FINAL RESULTS================================
FEGIN weighted F1: 0.6647  0.0195
python main.py --data ltspice_demos --representation component_pin_net --model FEGIN --layers 6 --hiddens 16 --batch_size 64 --lr 0.01 --emb_size 512 --epochs 100 --save_appendix component_pin_net_L6_H16_BS64_LR0.01_E512 --no_val
-----



STDERR:
  File "main.py", line 370, in <module>
    main()
  File "main.py", line 254, in main
    dataset = dataset_class(
  File "/home/philip/projects/ltspice_examples_code_repo/Circuit-Completion-Using-GNNs/component_classification_with_link_prediction_head/evaluation/FEGIN/kernel/circuit_datasets.py", line 15, in __init__
    self.data, self.slices = torch.load(self.processed_paths[0])
  File "/home/philip/.local/lib/python3.8/site-packages/torch/serialization.py", line 1040, in load
    warnings.warn(
  File "/usr/lib/python3.8/warnings.py", line 109, in _showwarnmsg
    sw(msg.message, msg.category, msg.filename, msg.lineno,
  File "main.py", line 47, in warn_with_traceback
    traceback.print_stack(file=log)
/home/philip/projects/ltspice_examples_code_repo/Circuit-Completion-Using-GNNs/component_classification_with_link_prediction_head/evaluation/FEGIN/kernel/circuit_datasets.py:15: FutureWarning: You are using `torch.load` with `weights_only=False` (the current default value), which uses the default pickle module implicitly. It is possible to construct malicious pickle data which will execute arbitrary code during unpickling (See https://github.com/pytorch/pytorch/blob/main/SECURITY.md#untrusted-models for more details). In a future release, the default value for `weights_only` will be flipped to `True`. This limits the functions that could be executed during unpickling. Arbitrary objects will no longer be allowed to be loaded via this mode unless they are explicitly allowlisted by the user via `torch.serialization.add_safe_globals`. We recommend you start setting `weights_only=True` for any use case where you don't have full control of the loaded file. Please open an issue on GitHub for any issues related to this experimental feature.
  self.data, self.slices = torch.load(self.processed_paths[0])
