STDOUT:
Results will be saved in /home/philip/projects/ltspice_examples_code_repo/Circuit-Completion-Using-GNNs/component_classification_with_link_prediction_head/evaluation/FEGIN/results/model_FEGIN_dataset_ltspice_demos
Command line input: python main.py --data ltspice_demos --representation component_component --model FEGIN --layers 2 --hiddens 64 --batch_size 32 --lr 0.0001 --emb_size 128 --epochs 100 --save_appendix component_component_L2_H64_BS32_LR0.0001_E128 --no_val
 is saved.
-----
ltspice_demos - FEGIN
Using 2 layers, 64 hidden units, h = 2
Loading component_component representation dataset
ENTERED
Training FEGIN on component_component representation
Train: 1565, Test: 383
##################ITERATION #0 ****************************************
 epoch: 0, train_loss: 1.3972, test_loss: 1.3833, test_f1: 0.1533
 epoch: 1, train_loss: 1.3734, test_loss: 1.3657, test_f1: 0.2281
 epoch: 2, train_loss: 1.3497, test_loss: 1.3453, test_f1: 0.2281
 epoch: 3, train_loss: 1.3192, test_loss: 1.3228, test_f1: 0.2697
 epoch: 4, train_loss: 1.2834, test_loss: 1.3036, test_f1: 0.2602
 epoch: 5, train_loss: 1.2514, test_loss: 1.2883, test_f1: 0.2600
 epoch: 6, train_loss: 1.2193, test_loss: 1.2795, test_f1: 0.2587
 epoch: 7, train_loss: 1.1994, test_loss: 1.2664, test_f1: 0.2600
 epoch: 8, train_loss: 1.1818, test_loss: 1.2608, test_f1: 0.2607
 epoch: 9, train_loss: 1.1765, test_loss: 1.2586, test_f1: 0.2582
 epoch: 10, train_loss: 1.1654, test_loss: 1.2534, test_f1: 0.2813
 epoch: 11, train_loss: 1.1541, test_loss: 1.2455, test_f1: 0.3759
 epoch: 12, train_loss: 1.1387, test_loss: 1.2436, test_f1: 0.4118
 epoch: 13, train_loss: 1.1326, test_loss: 1.2393, test_f1: 0.3945
 epoch: 14, train_loss: 1.1289, test_loss: 1.2280, test_f1: 0.3927
 epoch: 15, train_loss: 1.1088, test_loss: 1.2209, test_f1: 0.3944
 epoch: 16, train_loss: 1.1010, test_loss: 1.2200, test_f1: 0.3862
 epoch: 17, train_loss: 1.0867, test_loss: 1.2122, test_f1: 0.3852
 epoch: 18, train_loss: 1.0787, test_loss: 1.2035, test_f1: 0.4215
 epoch: 19, train_loss: 1.0669, test_loss: 1.2061, test_f1: 0.4115
 epoch: 20, train_loss: 1.0606, test_loss: 1.1894, test_f1: 0.3965
 epoch: 21, train_loss: 1.0532, test_loss: 1.1866, test_f1: 0.3987
 epoch: 22, train_loss: 1.0366, test_loss: 1.1943, test_f1: 0.4102
 epoch: 23, train_loss: 1.0320, test_loss: 1.1940, test_f1: 0.3936
 epoch: 24, train_loss: 1.0230, test_loss: 1.1879, test_f1: 0.4317
 epoch: 25, train_loss: 1.0167, test_loss: 1.1933, test_f1: 0.4294
 epoch: 26, train_loss: 1.0083, test_loss: 1.1835, test_f1: 0.4203
 epoch: 27, train_loss: 1.0009, test_loss: 1.2072, test_f1: 0.4272
 epoch: 28, train_loss: 0.9917, test_loss: 1.1898, test_f1: 0.4582
 epoch: 29, train_loss: 0.9908, test_loss: 1.1940, test_f1: 0.4378
 epoch: 30, train_loss: 0.9835, test_loss: 1.1999, test_f1: 0.4438
 epoch: 31, train_loss: 0.9775, test_loss: 1.2095, test_f1: 0.4751
 epoch: 32, train_loss: 0.9706, test_loss: 1.1832, test_f1: 0.4399
 epoch: 33, train_loss: 0.9720, test_loss: 1.1913, test_f1: 0.4832
 epoch: 34, train_loss: 0.9559, test_loss: 1.2227, test_f1: 0.4707
 epoch: 35, train_loss: 0.9512, test_loss: 1.2045, test_f1: 0.4814
 epoch: 36, train_loss: 0.9302, test_loss: 1.2200, test_f1: 0.4803
 epoch: 37, train_loss: 0.9387, test_loss: 1.2120, test_f1: 0.5146
 epoch: 38, train_loss: 0.9429, test_loss: 1.2023, test_f1: 0.4967
 epoch: 39, train_loss: 0.9362, test_loss: 1.2084, test_f1: 0.5040
 epoch: 40, train_loss: 0.9098, test_loss: 1.2267, test_f1: 0.5137
 epoch: 41, train_loss: 0.9131, test_loss: 1.2438, test_f1: 0.5086
 epoch: 42, train_loss: 0.9321, test_loss: 1.2366, test_f1: 0.5200
 epoch: 43, train_loss: 0.9258, test_loss: 1.2183, test_f1: 0.5182
 epoch: 44, train_loss: 0.9095, test_loss: 1.2262, test_f1: 0.4821
 epoch: 45, train_loss: 0.9049, test_loss: 1.2319, test_f1: 0.5074
 epoch: 46, train_loss: 0.8952, test_loss: 1.2494, test_f1: 0.5148
 epoch: 47, train_loss: 0.8925, test_loss: 1.3045, test_f1: 0.5092
 epoch: 48, train_loss: 0.8844, test_loss: 1.2859, test_f1: 0.4800
 epoch: 49, train_loss: 0.8849, test_loss: 1.2667, test_f1: 0.5116
 epoch: 50, train_loss: 0.8765, test_loss: 1.2767, test_f1: 0.4898
 epoch: 51, train_loss: 0.8699, test_loss: 1.3275, test_f1: 0.5013
 epoch: 52, train_loss: 0.8614, test_loss: 1.3198, test_f1: 0.4911
 epoch: 53, train_loss: 0.8605, test_loss: 1.3381, test_f1: 0.4942
 epoch: 54, train_loss: 0.8574, test_loss: 1.2909, test_f1: 0.4786
 epoch: 55, train_loss: 0.8469, test_loss: 1.3242, test_f1: 0.4914
 epoch: 56, train_loss: 0.8719, test_loss: 1.3181, test_f1: 0.4869
 epoch: 57, train_loss: 0.8354, test_loss: 1.3307, test_f1: 0.4972
 epoch: 58, train_loss: 0.8446, test_loss: 1.3337, test_f1: 0.5069
 epoch: 59, train_loss: 0.8453, test_loss: 1.2961, test_f1: 0.4958
 epoch: 60, train_loss: 0.8405, test_loss: 1.3332, test_f1: 0.4936
 epoch: 61, train_loss: 0.8437, test_loss: 1.3504, test_f1: 0.5116
 epoch: 62, train_loss: 0.8292, test_loss: 1.3709, test_f1: 0.5168
 epoch: 63, train_loss: 0.8311, test_loss: 1.3775, test_f1: 0.5092
 epoch: 64, train_loss: 0.8267, test_loss: 1.3284, test_f1: 0.4854
 epoch: 65, train_loss: 0.8335, test_loss: 1.3892, test_f1: 0.5034
 epoch: 66, train_loss: 0.8247, test_loss: 1.3803, test_f1: 0.5290
 epoch: 67, train_loss: 0.8265, test_loss: 1.3463, test_f1: 0.5093
 epoch: 68, train_loss: 0.8237, test_loss: 1.4289, test_f1: 0.5096
 epoch: 69, train_loss: 0.8319, test_loss: 1.3619, test_f1: 0.5287
 epoch: 70, train_loss: 0.8225, test_loss: 1.3948, test_f1: 0.5198
 epoch: 71, train_loss: 0.8130, test_loss: 1.3916, test_f1: 0.5153
 epoch: 72, train_loss: 0.8051, test_loss: 1.4413, test_f1: 0.5230
 epoch: 73, train_loss: 0.8171, test_loss: 1.4420, test_f1: 0.5095
 epoch: 74, train_loss: 0.8186, test_loss: 1.4331, test_f1: 0.5177
 epoch: 75, train_loss: 0.8212, test_loss: 1.4397, test_f1: 0.5157
 epoch: 76, train_loss: 0.8163, test_loss: 1.4183, test_f1: 0.5150
 epoch: 77, train_loss: 0.8066, test_loss: 1.4315, test_f1: 0.5284
 epoch: 78, train_loss: 0.8117, test_loss: 1.4506, test_f1: 0.5208
 epoch: 79, train_loss: 0.7980, test_loss: 1.4307, test_f1: 0.5126
 epoch: 80, train_loss: 0.8141, test_loss: 1.4736, test_f1: 0.5260
 epoch: 81, train_loss: 0.8101, test_loss: 1.4241, test_f1: 0.5126
 epoch: 82, train_loss: 0.7898, test_loss: 1.4289, test_f1: 0.5179
 epoch: 83, train_loss: 0.7898, test_loss: 1.4248, test_f1: 0.5009
 epoch: 84, train_loss: 0.7948, test_loss: 1.5602, test_f1: 0.5124
 epoch: 85, train_loss: 0.7948, test_loss: 1.5675, test_f1: 0.5182
 epoch: 86, train_loss: 0.7966, test_loss: 1.5413, test_f1: 0.5152
 epoch: 87, train_loss: 0.7941, test_loss: 1.6077, test_f1: 0.5154
 epoch: 88, train_loss: 0.7866, test_loss: 1.5201, test_f1: 0.5049
 epoch: 89, train_loss: 0.7813, test_loss: 1.5170, test_f1: 0.5424
 epoch: 90, train_loss: 0.7750, test_loss: 1.5346, test_f1: 0.5538
 epoch: 91, train_loss: 0.7880, test_loss: 1.6069, test_f1: 0.5213
 epoch: 92, train_loss: 0.7836, test_loss: 1.6254, test_f1: 0.5475
 epoch: 93, train_loss: 0.7821, test_loss: 1.6250, test_f1: 0.5402
 epoch: 94, train_loss: 0.7811, test_loss: 1.6102, test_f1: 0.5416
 epoch: 95, train_loss: 0.7819, test_loss: 1.6174, test_f1: 0.5372
 epoch: 96, train_loss: 0.7688, test_loss: 1.5751, test_f1: 0.5319
 epoch: 97, train_loss: 0.7749, test_loss: 1.5690, test_f1: 0.5507
 epoch: 98, train_loss: 0.7685, test_loss: 1.6090, test_f1: 0.5398
 epoch: 99, train_loss: 0.7684, test_loss: 1.6558, test_f1: 0.5423
##################ITERATION #1 ****************************************
 epoch: 0, train_loss: 1.3576, test_loss: 1.3488, test_f1: 0.2408
 epoch: 1, train_loss: 1.2791, test_loss: 1.3213, test_f1: 0.2281
 epoch: 2, train_loss: 1.2485, test_loss: 1.3099, test_f1: 0.2281
 epoch: 3, train_loss: 1.2206, test_loss: 1.2905, test_f1: 0.2281
 epoch: 4, train_loss: 1.2025, test_loss: 1.2829, test_f1: 0.2455
 epoch: 5, train_loss: 1.1872, test_loss: 1.2696, test_f1: 0.3210
 epoch: 6, train_loss: 1.1665, test_loss: 1.2532, test_f1: 0.3118
 epoch: 7, train_loss: 1.1511, test_loss: 1.2383, test_f1: 0.3554
 epoch: 8, train_loss: 1.1371, test_loss: 1.2234, test_f1: 0.3675
 epoch: 9, train_loss: 1.1203, test_loss: 1.2104, test_f1: 0.4056
 epoch: 10, train_loss: 1.1106, test_loss: 1.2056, test_f1: 0.4317
 epoch: 11, train_loss: 1.0920, test_loss: 1.1979, test_f1: 0.4595
 epoch: 12, train_loss: 1.0772, test_loss: 1.1906, test_f1: 0.4634
 epoch: 13, train_loss: 1.0607, test_loss: 1.1806, test_f1: 0.4551
 epoch: 14, train_loss: 1.0545, test_loss: 1.1741, test_f1: 0.4685
 epoch: 15, train_loss: 1.0282, test_loss: 1.1703, test_f1: 0.4768
 epoch: 16, train_loss: 1.0262, test_loss: 1.1794, test_f1: 0.5178
 epoch: 17, train_loss: 1.0188, test_loss: 1.1681, test_f1: 0.4990
 epoch: 18, train_loss: 1.0103, test_loss: 1.1756, test_f1: 0.5066
 epoch: 19, train_loss: 1.0048, test_loss: 1.1702, test_f1: 0.5063
 epoch: 20, train_loss: 0.9856, test_loss: 1.1576, test_f1: 0.5180
 epoch: 21, train_loss: 0.9789, test_loss: 1.1679, test_f1: 0.5347
 epoch: 22, train_loss: 0.9624, test_loss: 1.1541, test_f1: 0.5387
 epoch: 23, train_loss: 0.9520, test_loss: 1.1441, test_f1: 0.5069
 epoch: 24, train_loss: 0.9549, test_loss: 1.1512, test_f1: 0.5357
 epoch: 25, train_loss: 0.9470, test_loss: 1.1398, test_f1: 0.5699
 epoch: 26, train_loss: 0.9440, test_loss: 1.1329, test_f1: 0.5721
 epoch: 27, train_loss: 0.9350, test_loss: 1.1555, test_f1: 0.4970
 epoch: 28, train_loss: 0.9277, test_loss: 1.1403, test_f1: 0.5444
 epoch: 29, train_loss: 0.9293, test_loss: 1.1288, test_f1: 0.5486
 epoch: 30, train_loss: 0.9109, test_loss: 1.1357, test_f1: 0.5420
 epoch: 31, train_loss: 0.9019, test_loss: 1.1294, test_f1: 0.5507
 epoch: 32, train_loss: 0.9011, test_loss: 1.1359, test_f1: 0.5524
 epoch: 33, train_loss: 0.8945, test_loss: 1.1357, test_f1: 0.5543
 epoch: 34, train_loss: 0.8814, test_loss: 1.1160, test_f1: 0.5642
 epoch: 35, train_loss: 0.8825, test_loss: 1.1153, test_f1: 0.5327
 epoch: 36, train_loss: 0.8769, test_loss: 1.1189, test_f1: 0.5374
 epoch: 37, train_loss: 0.8717, test_loss: 1.1087, test_f1: 0.5661
 epoch: 38, train_loss: 0.8702, test_loss: 1.1192, test_f1: 0.5628
 epoch: 39, train_loss: 0.8593, test_loss: 1.1205, test_f1: 0.5738
 epoch: 40, train_loss: 0.8582, test_loss: 1.1324, test_f1: 0.5571
 epoch: 41, train_loss: 0.8387, test_loss: 1.1583, test_f1: 0.5493
 epoch: 42, train_loss: 0.8371, test_loss: 1.1394, test_f1: 0.5594
 epoch: 43, train_loss: 0.8412, test_loss: 1.1596, test_f1: 0.5786
 epoch: 44, train_loss: 0.8355, test_loss: 1.1365, test_f1: 0.5678
 epoch: 45, train_loss: 0.8317, test_loss: 1.1440, test_f1: 0.5790
 epoch: 46, train_loss: 0.8115, test_loss: 1.1631, test_f1: 0.5539
 epoch: 47, train_loss: 0.8285, test_loss: 1.1350, test_f1: 0.5734
 epoch: 48, train_loss: 0.8333, test_loss: 1.1409, test_f1: 0.5710
 epoch: 49, train_loss: 0.8036, test_loss: 1.1546, test_f1: 0.5734
 epoch: 50, train_loss: 0.8045, test_loss: 1.1582, test_f1: 0.5607
 epoch: 51, train_loss: 0.7994, test_loss: 1.1710, test_f1: 0.5768
 epoch: 52, train_loss: 0.7840, test_loss: 1.1708, test_f1: 0.5789
 epoch: 53, train_loss: 0.7964, test_loss: 1.1702, test_f1: 0.5665
 epoch: 54, train_loss: 0.7868, test_loss: 1.1616, test_f1: 0.5791
 epoch: 55, train_loss: 0.7916, test_loss: 1.1615, test_f1: 0.5900
 epoch: 56, train_loss: 0.7900, test_loss: 1.1664, test_f1: 0.5763
 epoch: 57, train_loss: 0.7717, test_loss: 1.1698, test_f1: 0.5769
 epoch: 58, train_loss: 0.7925, test_loss: 1.1713, test_f1: 0.5712
 epoch: 59, train_loss: 0.7880, test_loss: 1.1903, test_f1: 0.5761
 epoch: 60, train_loss: 0.7768, test_loss: 1.1718, test_f1: 0.5688
 epoch: 61, train_loss: 0.7818, test_loss: 1.1676, test_f1: 0.5687
 epoch: 62, train_loss: 0.7743, test_loss: 1.1687, test_f1: 0.5605
 epoch: 63, train_loss: 0.7685, test_loss: 1.1843, test_f1: 0.5587
 epoch: 64, train_loss: 0.7542, test_loss: 1.1955, test_f1: 0.5796
 epoch: 65, train_loss: 0.7696, test_loss: 1.2091, test_f1: 0.5682
 epoch: 66, train_loss: 0.7675, test_loss: 1.1818, test_f1: 0.5739
 epoch: 67, train_loss: 0.7578, test_loss: 1.2064, test_f1: 0.5824
 epoch: 68, train_loss: 0.7780, test_loss: 1.2136, test_f1: 0.5828
 epoch: 69, train_loss: 0.7643, test_loss: 1.1967, test_f1: 0.5713
 epoch: 70, train_loss: 0.7646, test_loss: 1.1922, test_f1: 0.5711
 epoch: 71, train_loss: 0.7620, test_loss: 1.2182, test_f1: 0.5560
 epoch: 72, train_loss: 0.7442, test_loss: 1.1807, test_f1: 0.5715
 epoch: 73, train_loss: 0.7674, test_loss: 1.1894, test_f1: 0.5628
 epoch: 74, train_loss: 0.7429, test_loss: 1.1808, test_f1: 0.5662
 epoch: 75, train_loss: 0.7435, test_loss: 1.1897, test_f1: 0.5872
 epoch: 76, train_loss: 0.7426, test_loss: 1.2085, test_f1: 0.5790
 epoch: 77, train_loss: 0.7536, test_loss: 1.2195, test_f1: 0.5781
 epoch: 78, train_loss: 0.7430, test_loss: 1.2131, test_f1: 0.5762
 epoch: 79, train_loss: 0.7419, test_loss: 1.2196, test_f1: 0.5688
 epoch: 80, train_loss: 0.7349, test_loss: 1.2193, test_f1: 0.5659
 epoch: 81, train_loss: 0.7408, test_loss: 1.2106, test_f1: 0.5634
 epoch: 82, train_loss: 0.7326, test_loss: 1.2246, test_f1: 0.5530
 epoch: 83, train_loss: 0.7412, test_loss: 1.2433, test_f1: 0.5633
 epoch: 84, train_loss: 0.7295, test_loss: 1.2354, test_f1: 0.5527
 epoch: 85, train_loss: 0.7396, test_loss: 1.2428, test_f1: 0.5583
 epoch: 86, train_loss: 0.7410, test_loss: 1.2329, test_f1: 0.5633
 epoch: 87, train_loss: 0.7361, test_loss: 1.2200, test_f1: 0.5707
 epoch: 88, train_loss: 0.7408, test_loss: 1.2497, test_f1: 0.5606
 epoch: 89, train_loss: 0.7242, test_loss: 1.2513, test_f1: 0.5643
 epoch: 90, train_loss: 0.7323, test_loss: 1.2323, test_f1: 0.5686
 epoch: 91, train_loss: 0.7269, test_loss: 1.2409, test_f1: 0.5555
 epoch: 92, train_loss: 0.7226, test_loss: 1.2560, test_f1: 0.5526
 epoch: 93, train_loss: 0.7096, test_loss: 1.2651, test_f1: 0.5501
 epoch: 94, train_loss: 0.7144, test_loss: 1.2487, test_f1: 0.5605
 epoch: 95, train_loss: 0.7268, test_loss: 1.2693, test_f1: 0.5689
 epoch: 96, train_loss: 0.7157, test_loss: 1.2685, test_f1: 0.5656
 epoch: 97, train_loss: 0.7156, test_loss: 1.2826, test_f1: 0.5553
 epoch: 98, train_loss: 0.7029, test_loss: 1.2763, test_f1: 0.5528
 epoch: 99, train_loss: 0.7223, test_loss: 1.2591, test_f1: 0.5628
##################ITERATION #2 ****************************************
 epoch: 0, train_loss: 1.2997, test_loss: 1.3253, test_f1: 0.2611
 epoch: 1, train_loss: 1.2336, test_loss: 1.2971, test_f1: 0.2789
 epoch: 2, train_loss: 1.2118, test_loss: 1.2836, test_f1: 0.2760
 epoch: 3, train_loss: 1.1954, test_loss: 1.2860, test_f1: 0.2920
 epoch: 4, train_loss: 1.1724, test_loss: 1.2718, test_f1: 0.3035
 epoch: 5, train_loss: 1.1615, test_loss: 1.2548, test_f1: 0.3043
 epoch: 6, train_loss: 1.1574, test_loss: 1.2418, test_f1: 0.3300
 epoch: 7, train_loss: 1.1297, test_loss: 1.2397, test_f1: 0.3637
 epoch: 8, train_loss: 1.1144, test_loss: 1.2273, test_f1: 0.3879
 epoch: 9, train_loss: 1.1061, test_loss: 1.2102, test_f1: 0.4126
 epoch: 10, train_loss: 1.0910, test_loss: 1.2069, test_f1: 0.4220
 epoch: 11, train_loss: 1.0831, test_loss: 1.1918, test_f1: 0.4501
 epoch: 12, train_loss: 1.0750, test_loss: 1.1812, test_f1: 0.4657
 epoch: 13, train_loss: 1.0536, test_loss: 1.1818, test_f1: 0.4635
 epoch: 14, train_loss: 1.0530, test_loss: 1.1791, test_f1: 0.4678
 epoch: 15, train_loss: 1.0370, test_loss: 1.1730, test_f1: 0.4725
 epoch: 16, train_loss: 1.0336, test_loss: 1.1638, test_f1: 0.4883
 epoch: 17, train_loss: 1.0117, test_loss: 1.1594, test_f1: 0.5152
 epoch: 18, train_loss: 1.0063, test_loss: 1.1617, test_f1: 0.4892
 epoch: 19, train_loss: 0.9978, test_loss: 1.1560, test_f1: 0.4782
 epoch: 20, train_loss: 0.9842, test_loss: 1.1510, test_f1: 0.5092
 epoch: 21, train_loss: 0.9931, test_loss: 1.1444, test_f1: 0.5012
 epoch: 22, train_loss: 0.9888, test_loss: 1.1539, test_f1: 0.5155
 epoch: 23, train_loss: 0.9658, test_loss: 1.1385, test_f1: 0.5068
 epoch: 24, train_loss: 0.9606, test_loss: 1.1463, test_f1: 0.5176
 epoch: 25, train_loss: 0.9579, test_loss: 1.1476, test_f1: 0.5145
 epoch: 26, train_loss: 0.9525, test_loss: 1.1389, test_f1: 0.5369
 epoch: 27, train_loss: 0.9514, test_loss: 1.1685, test_f1: 0.4816
 epoch: 28, train_loss: 0.9438, test_loss: 1.1571, test_f1: 0.4909
 epoch: 29, train_loss: 0.9287, test_loss: 1.1166, test_f1: 0.5521
 epoch: 30, train_loss: 0.9207, test_loss: 1.1350, test_f1: 0.5247
 epoch: 31, train_loss: 0.9270, test_loss: 1.1395, test_f1: 0.5243
 epoch: 32, train_loss: 0.9214, test_loss: 1.1676, test_f1: 0.5405
 epoch: 33, train_loss: 0.9161, test_loss: 1.1625, test_f1: 0.5018
 epoch: 34, train_loss: 0.8945, test_loss: 1.1795, test_f1: 0.5273
 epoch: 35, train_loss: 0.9038, test_loss: 1.1500, test_f1: 0.5428
 epoch: 36, train_loss: 0.8710, test_loss: 1.1572, test_f1: 0.5242
 epoch: 37, train_loss: 0.8894, test_loss: 1.1833, test_f1: 0.5336
 epoch: 38, train_loss: 0.8782, test_loss: 1.2495, test_f1: 0.4972
 epoch: 39, train_loss: 0.8795, test_loss: 1.2214, test_f1: 0.5030
 epoch: 40, train_loss: 0.8730, test_loss: 1.1918, test_f1: 0.5310
 epoch: 41, train_loss: 0.8684, test_loss: 1.2032, test_f1: 0.5034
 epoch: 42, train_loss: 0.8658, test_loss: 1.2125, test_f1: 0.5184
 epoch: 43, train_loss: 0.8416, test_loss: 1.2700, test_f1: 0.5123
 epoch: 44, train_loss: 0.8533, test_loss: 1.2437, test_f1: 0.5139
 epoch: 45, train_loss: 0.8403, test_loss: 1.2364, test_f1: 0.5086
 epoch: 46, train_loss: 0.8366, test_loss: 1.3024, test_f1: 0.5118
 epoch: 47, train_loss: 0.8364, test_loss: 1.2409, test_f1: 0.5229
 epoch: 48, train_loss: 0.8290, test_loss: 1.2513, test_f1: 0.5147
 epoch: 49, train_loss: 0.8361, test_loss: 1.3121, test_f1: 0.5178
 epoch: 50, train_loss: 0.8155, test_loss: 1.3136, test_f1: 0.5291
 epoch: 51, train_loss: 0.8156, test_loss: 1.3340, test_f1: 0.5304
 epoch: 52, train_loss: 0.7971, test_loss: 1.3763, test_f1: 0.5261
 epoch: 53, train_loss: 0.8075, test_loss: 1.3005, test_f1: 0.5126
 epoch: 54, train_loss: 0.8045, test_loss: 1.2545, test_f1: 0.5284
 epoch: 55, train_loss: 0.8072, test_loss: 1.2716, test_f1: 0.5240
 epoch: 56, train_loss: 0.8077, test_loss: 1.3221, test_f1: 0.5270
 epoch: 57, train_loss: 0.8086, test_loss: 1.2916, test_f1: 0.5186
 epoch: 58, train_loss: 0.8081, test_loss: 1.2991, test_f1: 0.5279
 epoch: 59, train_loss: 0.7858, test_loss: 1.3187, test_f1: 0.5304
 epoch: 60, train_loss: 0.7944, test_loss: 1.3563, test_f1: 0.5221
 epoch: 61, train_loss: 0.8075, test_loss: 1.3339, test_f1: 0.5218
 epoch: 62, train_loss: 0.7970, test_loss: 1.4509, test_f1: 0.5194
 epoch: 63, train_loss: 0.7812, test_loss: 1.3513, test_f1: 0.5336
 epoch: 64, train_loss: 0.7996, test_loss: 1.4494, test_f1: 0.5279
 epoch: 65, train_loss: 0.7882, test_loss: 1.4004, test_f1: 0.5398
 epoch: 66, train_loss: 0.7701, test_loss: 1.3677, test_f1: 0.5290
 epoch: 67, train_loss: 0.7787, test_loss: 1.5010, test_f1: 0.5412
 epoch: 68, train_loss: 0.7863, test_loss: 1.4593, test_f1: 0.5413
 epoch: 69, train_loss: 0.7754, test_loss: 1.4840, test_f1: 0.5240
 epoch: 70, train_loss: 0.7671, test_loss: 1.4837, test_f1: 0.5389
 epoch: 71, train_loss: 0.7736, test_loss: 1.4480, test_f1: 0.5418
 epoch: 72, train_loss: 0.7767, test_loss: 1.5103, test_f1: 0.5502
 epoch: 73, train_loss: 0.7827, test_loss: 1.4542, test_f1: 0.5310
 epoch: 74, train_loss: 0.7810, test_loss: 1.4901, test_f1: 0.5258
 epoch: 75, train_loss: 0.7606, test_loss: 1.3800, test_f1: 0.5352
 epoch: 76, train_loss: 0.7709, test_loss: 1.4496, test_f1: 0.5389
 epoch: 77, train_loss: 0.7712, test_loss: 1.4291, test_f1: 0.5216
 epoch: 78, train_loss: 0.7577, test_loss: 1.4498, test_f1: 0.5295
 epoch: 79, train_loss: 0.7708, test_loss: 1.4172, test_f1: 0.5563
 epoch: 80, train_loss: 0.7593, test_loss: 1.4373, test_f1: 0.5339
 epoch: 81, train_loss: 0.7410, test_loss: 1.4701, test_f1: 0.5391
 epoch: 82, train_loss: 0.7467, test_loss: 1.5149, test_f1: 0.5380
 epoch: 83, train_loss: 0.7516, test_loss: 1.4406, test_f1: 0.5365
 epoch: 84, train_loss: 0.7462, test_loss: 1.4689, test_f1: 0.5392
 epoch: 85, train_loss: 0.7500, test_loss: 1.5391, test_f1: 0.5315
 epoch: 86, train_loss: 0.7393, test_loss: 1.4663, test_f1: 0.5357
 epoch: 87, train_loss: 0.7475, test_loss: 1.4930, test_f1: 0.5397
 epoch: 88, train_loss: 0.7391, test_loss: 1.5534, test_f1: 0.5312
 epoch: 89, train_loss: 0.7384, test_loss: 1.4106, test_f1: 0.5528
 epoch: 90, train_loss: 0.7468, test_loss: 1.6131, test_f1: 0.5251
 epoch: 91, train_loss: 0.7618, test_loss: 1.5510, test_f1: 0.5367
 epoch: 92, train_loss: 0.7458, test_loss: 1.6185, test_f1: 0.5409
 epoch: 93, train_loss: 0.7430, test_loss: 1.5948, test_f1: 0.5332
 epoch: 94, train_loss: 0.7218, test_loss: 1.6810, test_f1: 0.5362
 epoch: 95, train_loss: 0.7434, test_loss: 1.5838, test_f1: 0.5385
 epoch: 96, train_loss: 0.7256, test_loss: 1.5346, test_f1: 0.5351
 epoch: 97, train_loss: 0.7179, test_loss: 1.5025, test_f1: 0.5428
 epoch: 98, train_loss: 0.7206, test_loss: 1.5325, test_f1: 0.5451
 epoch: 99, train_loss: 0.7276, test_loss: 1.5365, test_f1: 0.5342
##################ITERATION #3 ****************************************
 epoch: 0, train_loss: 1.2921, test_loss: 1.2960, test_f1: 0.2636
 epoch: 1, train_loss: 1.2035, test_loss: 1.2564, test_f1: 0.3660
 epoch: 2, train_loss: 1.1727, test_loss: 1.2279, test_f1: 0.3832
 epoch: 3, train_loss: 1.1544, test_loss: 1.2126, test_f1: 0.4007
 epoch: 4, train_loss: 1.1462, test_loss: 1.2061, test_f1: 0.4192
 epoch: 5, train_loss: 1.1246, test_loss: 1.2022, test_f1: 0.4379
 epoch: 6, train_loss: 1.1094, test_loss: 1.1951, test_f1: 0.4379
 epoch: 7, train_loss: 1.0890, test_loss: 1.1826, test_f1: 0.4438
 epoch: 8, train_loss: 1.0921, test_loss: 1.1951, test_f1: 0.4635
 epoch: 9, train_loss: 1.0719, test_loss: 1.1848, test_f1: 0.4617
 epoch: 10, train_loss: 1.0731, test_loss: 1.1776, test_f1: 0.4684
 epoch: 11, train_loss: 1.0590, test_loss: 1.1709, test_f1: 0.4611
 epoch: 12, train_loss: 1.0515, test_loss: 1.1698, test_f1: 0.4900
 epoch: 13, train_loss: 1.0277, test_loss: 1.1682, test_f1: 0.5041
 epoch: 14, train_loss: 1.0324, test_loss: 1.1516, test_f1: 0.5110
 epoch: 15, train_loss: 1.0174, test_loss: 1.1573, test_f1: 0.5046
 epoch: 16, train_loss: 1.0200, test_loss: 1.1517, test_f1: 0.5171
 epoch: 17, train_loss: 1.0173, test_loss: 1.1504, test_f1: 0.5207
 epoch: 18, train_loss: 1.0046, test_loss: 1.1465, test_f1: 0.5266
 epoch: 19, train_loss: 0.9853, test_loss: 1.1481, test_f1: 0.5300
 epoch: 20, train_loss: 0.9901, test_loss: 1.1441, test_f1: 0.5403
 epoch: 21, train_loss: 0.9844, test_loss: 1.1514, test_f1: 0.5408
 epoch: 22, train_loss: 0.9573, test_loss: 1.1449, test_f1: 0.5266
 epoch: 23, train_loss: 0.9648, test_loss: 1.1398, test_f1: 0.5286
 epoch: 24, train_loss: 0.9585, test_loss: 1.1424, test_f1: 0.5472
 epoch: 25, train_loss: 0.9486, test_loss: 1.1441, test_f1: 0.5412
 epoch: 26, train_loss: 0.9502, test_loss: 1.1354, test_f1: 0.5544
 epoch: 27, train_loss: 0.9372, test_loss: 1.1476, test_f1: 0.5377
 epoch: 28, train_loss: 0.9382, test_loss: 1.1504, test_f1: 0.5256
 epoch: 29, train_loss: 0.9298, test_loss: 1.1525, test_f1: 0.5315
 epoch: 30, train_loss: 0.9140, test_loss: 1.1427, test_f1: 0.5363
 epoch: 31, train_loss: 0.9184, test_loss: 1.1507, test_f1: 0.5382
 epoch: 32, train_loss: 0.9140, test_loss: 1.1340, test_f1: 0.5305
 epoch: 33, train_loss: 0.8936, test_loss: 1.1477, test_f1: 0.5306
 epoch: 34, train_loss: 0.8983, test_loss: 1.1395, test_f1: 0.5400
 epoch: 35, train_loss: 0.8894, test_loss: 1.1650, test_f1: 0.5460
 epoch: 36, train_loss: 0.8872, test_loss: 1.1314, test_f1: 0.5302
 epoch: 37, train_loss: 0.8863, test_loss: 1.1449, test_f1: 0.5473
 epoch: 38, train_loss: 0.8864, test_loss: 1.1466, test_f1: 0.5441
 epoch: 39, train_loss: 0.8680, test_loss: 1.2137, test_f1: 0.5180
 epoch: 40, train_loss: 0.8717, test_loss: 1.1830, test_f1: 0.5536
 epoch: 41, train_loss: 0.8451, test_loss: 1.1775, test_f1: 0.5524
 epoch: 42, train_loss: 0.8628, test_loss: 1.1767, test_f1: 0.5593
 epoch: 43, train_loss: 0.8605, test_loss: 1.2003, test_f1: 0.5599
 epoch: 44, train_loss: 0.8646, test_loss: 1.1824, test_f1: 0.5590
 epoch: 45, train_loss: 0.8528, test_loss: 1.1700, test_f1: 0.5785
 epoch: 46, train_loss: 0.8540, test_loss: 1.2251, test_f1: 0.5415
 epoch: 47, train_loss: 0.8372, test_loss: 1.2367, test_f1: 0.5258
 epoch: 48, train_loss: 0.8288, test_loss: 1.1984, test_f1: 0.5559
 epoch: 49, train_loss: 0.8426, test_loss: 1.1864, test_f1: 0.5775
 epoch: 50, train_loss: 0.8309, test_loss: 1.2095, test_f1: 0.5421
 epoch: 51, train_loss: 0.8428, test_loss: 1.1440, test_f1: 0.5992
 epoch: 52, train_loss: 0.8155, test_loss: 1.1802, test_f1: 0.5718
 epoch: 53, train_loss: 0.8223, test_loss: 1.1815, test_f1: 0.5832
 epoch: 54, train_loss: 0.8120, test_loss: 1.2012, test_f1: 0.5661
 epoch: 55, train_loss: 0.8206, test_loss: 1.2012, test_f1: 0.5615
 epoch: 56, train_loss: 0.7973, test_loss: 1.1979, test_f1: 0.5745
 epoch: 57, train_loss: 0.7956, test_loss: 1.1848, test_f1: 0.5831
 epoch: 58, train_loss: 0.8118, test_loss: 1.2399, test_f1: 0.5805
 epoch: 59, train_loss: 0.8067, test_loss: 1.2266, test_f1: 0.5728
 epoch: 60, train_loss: 0.7996, test_loss: 1.2427, test_f1: 0.5828
 epoch: 61, train_loss: 0.8024, test_loss: 1.2500, test_f1: 0.5698
 epoch: 62, train_loss: 0.7814, test_loss: 1.2341, test_f1: 0.5876
 epoch: 63, train_loss: 0.7964, test_loss: 1.2060, test_f1: 0.5694
 epoch: 64, train_loss: 0.7993, test_loss: 1.2695, test_f1: 0.5523
 epoch: 65, train_loss: 0.7919, test_loss: 1.2100, test_f1: 0.5929
 epoch: 66, train_loss: 0.7794, test_loss: 1.2428, test_f1: 0.5930
 epoch: 67, train_loss: 0.7849, test_loss: 1.2171, test_f1: 0.5800
 epoch: 68, train_loss: 0.7836, test_loss: 1.2135, test_f1: 0.5719
 epoch: 69, train_loss: 0.7819, test_loss: 1.2575, test_f1: 0.5514
 epoch: 70, train_loss: 0.7878, test_loss: 1.1944, test_f1: 0.5800
 epoch: 71, train_loss: 0.7928, test_loss: 1.2271, test_f1: 0.5747
 epoch: 72, train_loss: 0.7878, test_loss: 1.2041, test_f1: 0.5749
 epoch: 73, train_loss: 0.7905, test_loss: 1.2895, test_f1: 0.5538
 epoch: 74, train_loss: 0.7786, test_loss: 1.2413, test_f1: 0.5709
 epoch: 75, train_loss: 0.7725, test_loss: 1.2938, test_f1: 0.5311
 epoch: 76, train_loss: 0.7767, test_loss: 1.2429, test_f1: 0.5806
 epoch: 77, train_loss: 0.7871, test_loss: 1.2415, test_f1: 0.5953
 epoch: 78, train_loss: 0.7726, test_loss: 1.2359, test_f1: 0.5617
 epoch: 79, train_loss: 0.7578, test_loss: 1.2427, test_f1: 0.5645
 epoch: 80, train_loss: 0.7717, test_loss: 1.2312, test_f1: 0.5856
 epoch: 81, train_loss: 0.7527, test_loss: 1.3000, test_f1: 0.5602
 epoch: 82, train_loss: 0.7597, test_loss: 1.3790, test_f1: 0.5641
 epoch: 83, train_loss: 0.7557, test_loss: 1.2342, test_f1: 0.5784
 epoch: 84, train_loss: 0.7559, test_loss: 1.2384, test_f1: 0.5884
 epoch: 85, train_loss: 0.7587, test_loss: 1.2570, test_f1: 0.5958
 epoch: 86, train_loss: 0.7533, test_loss: 1.2665, test_f1: 0.5746
 epoch: 87, train_loss: 0.7482, test_loss: 1.2018, test_f1: 0.5906
 epoch: 88, train_loss: 0.7555, test_loss: 1.2909, test_f1: 0.5778
 epoch: 89, train_loss: 0.7657, test_loss: 1.3082, test_f1: 0.5804
 epoch: 90, train_loss: 0.7490, test_loss: 1.2436, test_f1: 0.5920
 epoch: 91, train_loss: 0.7498, test_loss: 1.2538, test_f1: 0.5721
 epoch: 92, train_loss: 0.7405, test_loss: 1.2780, test_f1: 0.5826
 epoch: 93, train_loss: 0.7439, test_loss: 1.2578, test_f1: 0.5872
 epoch: 94, train_loss: 0.7388, test_loss: 1.3255, test_f1: 0.5445
 epoch: 95, train_loss: 0.7519, test_loss: 1.2249, test_f1: 0.5925
 epoch: 96, train_loss: 0.7510, test_loss: 1.2168, test_f1: 0.5720
 epoch: 97, train_loss: 0.7509, test_loss: 1.2926, test_f1: 0.5778
 epoch: 98, train_loss: 0.7492, test_loss: 1.2632, test_f1: 0.5774
 epoch: 99, train_loss: 0.7482, test_loss: 1.2870, test_f1: 0.5665
##################ITERATION #4 ****************************************
 epoch: 0, train_loss: 1.2974, test_loss: 1.3764, test_f1: 0.2991
 epoch: 1, train_loss: 1.2310, test_loss: 1.3845, test_f1: 0.3298
 epoch: 2, train_loss: 1.2048, test_loss: 1.3525, test_f1: 0.3733
 epoch: 3, train_loss: 1.1790, test_loss: 1.3259, test_f1: 0.4191
 epoch: 4, train_loss: 1.1796, test_loss: 1.3003, test_f1: 0.4608
 epoch: 5, train_loss: 1.1494, test_loss: 1.3131, test_f1: 0.4606
 epoch: 6, train_loss: 1.1357, test_loss: 1.2806, test_f1: 0.4786
 epoch: 7, train_loss: 1.1166, test_loss: 1.2809, test_f1: 0.4922
 epoch: 8, train_loss: 1.1024, test_loss: 1.2619, test_f1: 0.5014
 epoch: 9, train_loss: 1.0933, test_loss: 1.2557, test_f1: 0.5052
 epoch: 10, train_loss: 1.0779, test_loss: 1.2199, test_f1: 0.5273
 epoch: 11, train_loss: 1.0536, test_loss: 1.2168, test_f1: 0.5298
 epoch: 12, train_loss: 1.0380, test_loss: 1.1947, test_f1: 0.5349
 epoch: 13, train_loss: 1.0314, test_loss: 1.1814, test_f1: 0.5243
 epoch: 14, train_loss: 1.0219, test_loss: 1.1685, test_f1: 0.5447
 epoch: 15, train_loss: 1.0012, test_loss: 1.1613, test_f1: 0.5093
 epoch: 16, train_loss: 1.0124, test_loss: 1.1517, test_f1: 0.5229
 epoch: 17, train_loss: 0.9940, test_loss: 1.1660, test_f1: 0.5248
 epoch: 18, train_loss: 0.9841, test_loss: 1.1616, test_f1: 0.5278
 epoch: 19, train_loss: 0.9719, test_loss: 1.1611, test_f1: 0.5448
 epoch: 20, train_loss: 0.9637, test_loss: 1.1450, test_f1: 0.5348
 epoch: 21, train_loss: 0.9735, test_loss: 1.1327, test_f1: 0.5234
 epoch: 22, train_loss: 0.9553, test_loss: 1.1412, test_f1: 0.5128
 epoch: 23, train_loss: 0.9487, test_loss: 1.1680, test_f1: 0.4887
 epoch: 24, train_loss: 0.9441, test_loss: 1.1335, test_f1: 0.5026
 epoch: 25, train_loss: 0.9291, test_loss: 1.1093, test_f1: 0.5294
 epoch: 26, train_loss: 0.9201, test_loss: 1.1501, test_f1: 0.5221
 epoch: 27, train_loss: 0.9124, test_loss: 1.1444, test_f1: 0.5263
 epoch: 28, train_loss: 0.9207, test_loss: 1.1347, test_f1: 0.5422
 epoch: 29, train_loss: 0.9036, test_loss: 1.1107, test_f1: 0.5367
 epoch: 30, train_loss: 0.8984, test_loss: 1.1279, test_f1: 0.5322
 epoch: 31, train_loss: 0.9019, test_loss: 1.0945, test_f1: 0.5529
 epoch: 32, train_loss: 0.9023, test_loss: 1.1382, test_f1: 0.5389
 epoch: 33, train_loss: 0.9018, test_loss: 1.0990, test_f1: 0.5423
 epoch: 34, train_loss: 0.8711, test_loss: 1.1495, test_f1: 0.5456
 epoch: 35, train_loss: 0.8611, test_loss: 1.1332, test_f1: 0.5146
 epoch: 36, train_loss: 0.8538, test_loss: 1.1342, test_f1: 0.5794
 epoch: 37, train_loss: 0.8675, test_loss: 1.1481, test_f1: 0.5338
 epoch: 38, train_loss: 0.8398, test_loss: 1.1115, test_f1: 0.5417
 epoch: 39, train_loss: 0.8604, test_loss: 1.1635, test_f1: 0.5490
 epoch: 40, train_loss: 0.8468, test_loss: 1.1586, test_f1: 0.5172
 epoch: 41, train_loss: 0.8506, test_loss: 1.2210, test_f1: 0.5301
 epoch: 42, train_loss: 0.8392, test_loss: 1.1730, test_f1: 0.5564
 epoch: 43, train_loss: 0.8350, test_loss: 1.2314, test_f1: 0.5346
 epoch: 44, train_loss: 0.8358, test_loss: 1.1534, test_f1: 0.5442
 epoch: 45, train_loss: 0.8362, test_loss: 1.1656, test_f1: 0.5258
 epoch: 46, train_loss: 0.8138, test_loss: 1.2545, test_f1: 0.5479
 epoch: 47, train_loss: 0.8220, test_loss: 1.2384, test_f1: 0.5737
 epoch: 48, train_loss: 0.8137, test_loss: 1.2356, test_f1: 0.5545
 epoch: 49, train_loss: 0.8151, test_loss: 1.2538, test_f1: 0.5663
 epoch: 50, train_loss: 0.8096, test_loss: 1.2907, test_f1: 0.5687
 epoch: 51, train_loss: 0.7860, test_loss: 1.2659, test_f1: 0.5672
 epoch: 52, train_loss: 0.8041, test_loss: 1.3227, test_f1: 0.5680
 epoch: 53, train_loss: 0.7833, test_loss: 1.2590, test_f1: 0.5887
 epoch: 54, train_loss: 0.7839, test_loss: 1.3097, test_f1: 0.5568
 epoch: 55, train_loss: 0.7887, test_loss: 1.2726, test_f1: 0.5813
 epoch: 56, train_loss: 0.7937, test_loss: 1.2280, test_f1: 0.5753
 epoch: 57, train_loss: 0.7934, test_loss: 1.2693, test_f1: 0.5761
 epoch: 58, train_loss: 0.7662, test_loss: 1.2895, test_f1: 0.5912
 epoch: 59, train_loss: 0.7834, test_loss: 1.2709, test_f1: 0.5814
 epoch: 60, train_loss: 0.7722, test_loss: 1.2875, test_f1: 0.5729
 epoch: 61, train_loss: 0.7880, test_loss: 1.3212, test_f1: 0.5874
 epoch: 62, train_loss: 0.7871, test_loss: 1.3551, test_f1: 0.5869
 epoch: 63, train_loss: 0.7881, test_loss: 1.3666, test_f1: 0.5763
 epoch: 64, train_loss: 0.7714, test_loss: 1.3196, test_f1: 0.5762
 epoch: 65, train_loss: 0.7746, test_loss: 1.4123, test_f1: 0.5913
 epoch: 66, train_loss: 0.7725, test_loss: 1.3743, test_f1: 0.5767
 epoch: 67, train_loss: 0.7711, test_loss: 1.3357, test_f1: 0.5759
 epoch: 68, train_loss: 0.7639, test_loss: 1.3008, test_f1: 0.5768
 epoch: 69, train_loss: 0.7609, test_loss: 1.3717, test_f1: 0.5752
 epoch: 70, train_loss: 0.7621, test_loss: 1.3323, test_f1: 0.5770
 epoch: 71, train_loss: 0.7616, test_loss: 1.3663, test_f1: 0.5806
 epoch: 72, train_loss: 0.7751, test_loss: 1.4452, test_f1: 0.5788
 epoch: 73, train_loss: 0.7591, test_loss: 1.3242, test_f1: 0.5873
 epoch: 74, train_loss: 0.7504, test_loss: 1.3614, test_f1: 0.5819
 epoch: 75, train_loss: 0.7348, test_loss: 1.4220, test_f1: 0.5768
 epoch: 76, train_loss: 0.7447, test_loss: 1.3781, test_f1: 0.5665
 epoch: 77, train_loss: 0.7510, test_loss: 1.4435, test_f1: 0.5830
 epoch: 78, train_loss: 0.7631, test_loss: 1.3683, test_f1: 0.5788
 epoch: 79, train_loss: 0.7479, test_loss: 1.3911, test_f1: 0.5752
 epoch: 80, train_loss: 0.7492, test_loss: 1.3788, test_f1: 0.5894
 epoch: 81, train_loss: 0.7564, test_loss: 1.4118, test_f1: 0.5605
 epoch: 82, train_loss: 0.7345, test_loss: 1.3487, test_f1: 0.5711
 epoch: 83, train_loss: 0.7607, test_loss: 1.4990, test_f1: 0.5959
 epoch: 84, train_loss: 0.7377, test_loss: 1.3352, test_f1: 0.5737
 epoch: 85, train_loss: 0.7297, test_loss: 1.4085, test_f1: 0.5664
 epoch: 86, train_loss: 0.7250, test_loss: 1.4388, test_f1: 0.5890
 epoch: 87, train_loss: 0.7268, test_loss: 1.3335, test_f1: 0.6031
 epoch: 88, train_loss: 0.7369, test_loss: 1.5110, test_f1: 0.5986
 epoch: 89, train_loss: 0.7302, test_loss: 1.3667, test_f1: 0.5893
 epoch: 90, train_loss: 0.7368, test_loss: 1.3743, test_f1: 0.5733
 epoch: 91, train_loss: 0.7520, test_loss: 1.3841, test_f1: 0.5675
 epoch: 92, train_loss: 0.7379, test_loss: 1.4044, test_f1: 0.5975
 epoch: 93, train_loss: 0.7294, test_loss: 1.3529, test_f1: 0.5830
 epoch: 94, train_loss: 0.7199, test_loss: 1.4205, test_f1: 0.5816
 epoch: 95, train_loss: 0.7246, test_loss: 1.5056, test_f1: 0.5868
 epoch: 96, train_loss: 0.7226, test_loss: 1.4257, test_f1: 0.5920
 epoch: 97, train_loss: 0.7331, test_loss: 1.4200, test_f1: 0.5868
 epoch: 98, train_loss: 0.7354, test_loss: 1.4077, test_f1: 0.5975
 epoch: 99, train_loss: 0.7351, test_loss: 1.4259, test_f1: 0.5682
##################ITERATION #5 ****************************************
 epoch: 0, train_loss: 1.2832, test_loss: 1.3022, test_f1: 0.3644
 epoch: 1, train_loss: 1.2350, test_loss: 1.2745, test_f1: 0.4145
 epoch: 2, train_loss: 1.1867, test_loss: 1.2592, test_f1: 0.4262
 epoch: 3, train_loss: 1.1771, test_loss: 1.2533, test_f1: 0.4603
 epoch: 4, train_loss: 1.1693, test_loss: 1.2450, test_f1: 0.4598
 epoch: 5, train_loss: 1.1391, test_loss: 1.2283, test_f1: 0.4511
 epoch: 6, train_loss: 1.1404, test_loss: 1.2353, test_f1: 0.4735
 epoch: 7, train_loss: 1.1077, test_loss: 1.2351, test_f1: 0.4758
 epoch: 8, train_loss: 1.0995, test_loss: 1.2086, test_f1: 0.4851
 epoch: 9, train_loss: 1.1018, test_loss: 1.2098, test_f1: 0.4624
 epoch: 10, train_loss: 1.0846, test_loss: 1.1983, test_f1: 0.5023
 epoch: 11, train_loss: 1.0579, test_loss: 1.1914, test_f1: 0.4987
 epoch: 12, train_loss: 1.0593, test_loss: 1.1849, test_f1: 0.5094
 epoch: 13, train_loss: 1.0567, test_loss: 1.2065, test_f1: 0.5040
 epoch: 14, train_loss: 1.0297, test_loss: 1.1834, test_f1: 0.5287
 epoch: 15, train_loss: 1.0272, test_loss: 1.2212, test_f1: 0.5116
 epoch: 16, train_loss: 1.0323, test_loss: 1.1780, test_f1: 0.5279
 epoch: 17, train_loss: 1.0099, test_loss: 1.1723, test_f1: 0.5452
 epoch: 18, train_loss: 1.0083, test_loss: 1.1877, test_f1: 0.5355
 epoch: 19, train_loss: 1.0003, test_loss: 1.2033, test_f1: 0.5367
 epoch: 20, train_loss: 0.9775, test_loss: 1.1826, test_f1: 0.5381
 epoch: 21, train_loss: 0.9957, test_loss: 1.2143, test_f1: 0.5123
 epoch: 22, train_loss: 0.9718, test_loss: 1.1753, test_f1: 0.5364
 epoch: 23, train_loss: 0.9749, test_loss: 1.1864, test_f1: 0.4994
 epoch: 24, train_loss: 0.9781, test_loss: 1.1684, test_f1: 0.5466
 epoch: 25, train_loss: 0.9543, test_loss: 1.1674, test_f1: 0.5388
 epoch: 26, train_loss: 0.9639, test_loss: 1.1839, test_f1: 0.5488
 epoch: 27, train_loss: 0.9543, test_loss: 1.1718, test_f1: 0.5320
 epoch: 28, train_loss: 0.9355, test_loss: 1.1767, test_f1: 0.5341
 epoch: 29, train_loss: 0.9201, test_loss: 1.1722, test_f1: 0.5024
 epoch: 30, train_loss: 0.9466, test_loss: 1.1798, test_f1: 0.5332
 epoch: 31, train_loss: 0.9286, test_loss: 1.2302, test_f1: 0.5076
 epoch: 32, train_loss: 0.9063, test_loss: 1.1811, test_f1: 0.5457
 epoch: 33, train_loss: 0.9156, test_loss: 1.1432, test_f1: 0.5586
 epoch: 34, train_loss: 0.9113, test_loss: 1.2031, test_f1: 0.5201
 epoch: 35, train_loss: 0.9104, test_loss: 1.1976, test_f1: 0.5372
 epoch: 36, train_loss: 0.9010, test_loss: 1.1649, test_f1: 0.5202
 epoch: 37, train_loss: 0.9001, test_loss: 1.1643, test_f1: 0.5287
 epoch: 38, train_loss: 0.8930, test_loss: 1.1711, test_f1: 0.5136
 epoch: 39, train_loss: 0.8865, test_loss: 1.2058, test_f1: 0.5147
 epoch: 40, train_loss: 0.8812, test_loss: 1.1652, test_f1: 0.5407
 epoch: 41, train_loss: 0.8630, test_loss: 1.2034, test_f1: 0.5174
 epoch: 42, train_loss: 0.8675, test_loss: 1.1771, test_f1: 0.5329
 epoch: 43, train_loss: 0.8637, test_loss: 1.2460, test_f1: 0.4817
 epoch: 44, train_loss: 0.8755, test_loss: 1.1945, test_f1: 0.5277
 epoch: 45, train_loss: 0.8609, test_loss: 1.1896, test_f1: 0.5343
 epoch: 46, train_loss: 0.8464, test_loss: 1.2026, test_f1: 0.5358
 epoch: 47, train_loss: 0.8440, test_loss: 1.2424, test_f1: 0.5180
 epoch: 48, train_loss: 0.8507, test_loss: 1.2224, test_f1: 0.5206
 epoch: 49, train_loss: 0.8344, test_loss: 1.2127, test_f1: 0.5123
 epoch: 50, train_loss: 0.8440, test_loss: 1.1850, test_f1: 0.5394
 epoch: 51, train_loss: 0.8291, test_loss: 1.2186, test_f1: 0.5204
 epoch: 52, train_loss: 0.8323, test_loss: 1.2183, test_f1: 0.5336
 epoch: 53, train_loss: 0.8215, test_loss: 1.2203, test_f1: 0.5211
 epoch: 54, train_loss: 0.8104, test_loss: 1.2375, test_f1: 0.5275
 epoch: 55, train_loss: 0.8275, test_loss: 1.2245, test_f1: 0.5093
 epoch: 56, train_loss: 0.8373, test_loss: 1.2554, test_f1: 0.4946
 epoch: 57, train_loss: 0.8111, test_loss: 1.2319, test_f1: 0.5158
 epoch: 58, train_loss: 0.7942, test_loss: 1.2657, test_f1: 0.4911
 epoch: 59, train_loss: 0.8347, test_loss: 1.2316, test_f1: 0.5264
 epoch: 60, train_loss: 0.8229, test_loss: 1.2208, test_f1: 0.5297
 epoch: 61, train_loss: 0.8134, test_loss: 1.2325, test_f1: 0.5367
 epoch: 62, train_loss: 0.7932, test_loss: 1.2430, test_f1: 0.5025
 epoch: 63, train_loss: 0.8086, test_loss: 1.2581, test_f1: 0.5112
 epoch: 64, train_loss: 0.8153, test_loss: 1.2739, test_f1: 0.5130
 epoch: 65, train_loss: 0.8170, test_loss: 1.2602, test_f1: 0.5194
 epoch: 66, train_loss: 0.8041, test_loss: 1.2573, test_f1: 0.5160
 epoch: 67, train_loss: 0.8032, test_loss: 1.2479, test_f1: 0.5237
 epoch: 68, train_loss: 0.7931, test_loss: 1.2702, test_f1: 0.5163
 epoch: 69, train_loss: 0.7984, test_loss: 1.2624, test_f1: 0.5278
 epoch: 70, train_loss: 0.7866, test_loss: 1.2510, test_f1: 0.5409
 epoch: 71, train_loss: 0.7988, test_loss: 1.2588, test_f1: 0.5474
 epoch: 72, train_loss: 0.7828, test_loss: 1.2737, test_f1: 0.5136
 epoch: 73, train_loss: 0.7805, test_loss: 1.2716, test_f1: 0.4953
 epoch: 74, train_loss: 0.7994, test_loss: 1.2489, test_f1: 0.5102
 epoch: 75, train_loss: 0.7741, test_loss: 1.2639, test_f1: 0.5278
 epoch: 76, train_loss: 0.7763, test_loss: 1.2481, test_f1: 0.5295
 epoch: 77, train_loss: 0.7724, test_loss: 1.2704, test_f1: 0.5416
 epoch: 78, train_loss: 0.7932, test_loss: 1.2643, test_f1: 0.5537
 epoch: 79, train_loss: 0.7860, test_loss: 1.2772, test_f1: 0.5174
 epoch: 80, train_loss: 0.7794, test_loss: 1.2944, test_f1: 0.5341
 epoch: 81, train_loss: 0.7728, test_loss: 1.3092, test_f1: 0.5070
 epoch: 82, train_loss: 0.7458, test_loss: 1.2664, test_f1: 0.5381
 epoch: 83, train_loss: 0.7689, test_loss: 1.2439, test_f1: 0.5346
 epoch: 84, train_loss: 0.7702, test_loss: 1.2958, test_f1: 0.5311
 epoch: 85, train_loss: 0.7789, test_loss: 1.2796, test_f1: 0.5237
 epoch: 86, train_loss: 0.7596, test_loss: 1.3173, test_f1: 0.5159
 epoch: 87, train_loss: 0.7677, test_loss: 1.3404, test_f1: 0.5059
 epoch: 88, train_loss: 0.7699, test_loss: 1.3088, test_f1: 0.5200
 epoch: 89, train_loss: 0.7655, test_loss: 1.3121, test_f1: 0.5060
 epoch: 90, train_loss: 0.7622, test_loss: 1.2802, test_f1: 0.5396
 epoch: 91, train_loss: 0.7543, test_loss: 1.2825, test_f1: 0.5372
 epoch: 92, train_loss: 0.7493, test_loss: 1.3203, test_f1: 0.5303
 epoch: 93, train_loss: 0.7508, test_loss: 1.3066, test_f1: 0.5392
 epoch: 94, train_loss: 0.7508, test_loss: 1.3114, test_f1: 0.5310
 epoch: 95, train_loss: 0.7693, test_loss: 1.3491, test_f1: 0.5277
 epoch: 96, train_loss: 0.7515, test_loss: 1.3427, test_f1: 0.5344
 epoch: 97, train_loss: 0.7741, test_loss: 1.2914, test_f1: 0.5313
 epoch: 98, train_loss: 0.7376, test_loss: 1.3033, test_f1: 0.5497
 epoch: 99, train_loss: 0.7420, test_loss: 1.3579, test_f1: 0.5272
##################ITERATION #6 ****************************************
 epoch: 0, train_loss: 1.2805, test_loss: 1.3199, test_f1: 0.3596
 epoch: 1, train_loss: 1.2144, test_loss: 1.2838, test_f1: 0.3896
 epoch: 2, train_loss: 1.1844, test_loss: 1.2785, test_f1: 0.4025
 epoch: 3, train_loss: 1.1557, test_loss: 1.2532, test_f1: 0.4629
 epoch: 4, train_loss: 1.1325, test_loss: 1.2313, test_f1: 0.4665
 epoch: 5, train_loss: 1.1092, test_loss: 1.2189, test_f1: 0.4764
 epoch: 6, train_loss: 1.1023, test_loss: 1.2180, test_f1: 0.4964
 epoch: 7, train_loss: 1.0877, test_loss: 1.1949, test_f1: 0.5098
 epoch: 8, train_loss: 1.0797, test_loss: 1.1798, test_f1: 0.5022
 epoch: 9, train_loss: 1.0549, test_loss: 1.1718, test_f1: 0.5033
 epoch: 10, train_loss: 1.0512, test_loss: 1.1801, test_f1: 0.5007
 epoch: 11, train_loss: 1.0339, test_loss: 1.1827, test_f1: 0.5040
 epoch: 12, train_loss: 1.0302, test_loss: 1.1931, test_f1: 0.5044
 epoch: 13, train_loss: 1.0260, test_loss: 1.1746, test_f1: 0.5151
 epoch: 14, train_loss: 1.0178, test_loss: 1.1634, test_f1: 0.5268
 epoch: 15, train_loss: 1.0163, test_loss: 1.1745, test_f1: 0.4940
 epoch: 16, train_loss: 1.0054, test_loss: 1.1628, test_f1: 0.4964
 epoch: 17, train_loss: 0.9859, test_loss: 1.1680, test_f1: 0.5006
 epoch: 18, train_loss: 0.9893, test_loss: 1.1642, test_f1: 0.4788
 epoch: 19, train_loss: 0.9688, test_loss: 1.1393, test_f1: 0.5289
 epoch: 20, train_loss: 0.9713, test_loss: 1.1329, test_f1: 0.5080
 epoch: 21, train_loss: 0.9689, test_loss: 1.1410, test_f1: 0.5128
 epoch: 22, train_loss: 0.9714, test_loss: 1.1315, test_f1: 0.5249
 epoch: 23, train_loss: 0.9621, test_loss: 1.1192, test_f1: 0.5324
 epoch: 24, train_loss: 0.9665, test_loss: 1.1529, test_f1: 0.5026
 epoch: 25, train_loss: 0.9596, test_loss: 1.1226, test_f1: 0.5392
 epoch: 26, train_loss: 0.9528, test_loss: 1.1255, test_f1: 0.5389
 epoch: 27, train_loss: 0.9313, test_loss: 1.1112, test_f1: 0.5348
 epoch: 28, train_loss: 0.9262, test_loss: 1.0977, test_f1: 0.5349
 epoch: 29, train_loss: 0.9133, test_loss: 1.1042, test_f1: 0.5409
 epoch: 30, train_loss: 0.9111, test_loss: 1.0856, test_f1: 0.5459
 epoch: 31, train_loss: 0.9213, test_loss: 1.0875, test_f1: 0.5234
 epoch: 32, train_loss: 0.9079, test_loss: 1.1109, test_f1: 0.5316
 epoch: 33, train_loss: 0.8993, test_loss: 1.1158, test_f1: 0.5212
 epoch: 34, train_loss: 0.9097, test_loss: 1.1055, test_f1: 0.5648
 epoch: 35, train_loss: 0.8849, test_loss: 1.0910, test_f1: 0.5416
 epoch: 36, train_loss: 0.9050, test_loss: 1.1605, test_f1: 0.5484
 epoch: 37, train_loss: 0.8755, test_loss: 1.0993, test_f1: 0.5266
 epoch: 38, train_loss: 0.8881, test_loss: 1.0902, test_f1: 0.5495
 epoch: 39, train_loss: 0.8936, test_loss: 1.0746, test_f1: 0.5653
 epoch: 40, train_loss: 0.8583, test_loss: 1.1034, test_f1: 0.5718
 epoch: 41, train_loss: 0.8654, test_loss: 1.0884, test_f1: 0.5757
 epoch: 42, train_loss: 0.8664, test_loss: 1.0691, test_f1: 0.5717
 epoch: 43, train_loss: 0.8571, test_loss: 1.1320, test_f1: 0.5534
 epoch: 44, train_loss: 0.8616, test_loss: 1.1089, test_f1: 0.5540
 epoch: 45, train_loss: 0.8471, test_loss: 1.0779, test_f1: 0.5638
 epoch: 46, train_loss: 0.8315, test_loss: 1.0960, test_f1: 0.5838
 epoch: 47, train_loss: 0.8496, test_loss: 1.0725, test_f1: 0.5948
 epoch: 48, train_loss: 0.8467, test_loss: 1.1241, test_f1: 0.5483
 epoch: 49, train_loss: 0.8433, test_loss: 1.1267, test_f1: 0.5803
 epoch: 50, train_loss: 0.8340, test_loss: 1.1534, test_f1: 0.5696
 epoch: 51, train_loss: 0.8300, test_loss: 1.2991, test_f1: 0.5653
 epoch: 52, train_loss: 0.8240, test_loss: 1.0850, test_f1: 0.5919
 epoch: 53, train_loss: 0.8232, test_loss: 1.0805, test_f1: 0.5896
 epoch: 54, train_loss: 0.8253, test_loss: 1.0770, test_f1: 0.5840
 epoch: 55, train_loss: 0.8202, test_loss: 1.0746, test_f1: 0.6037
 epoch: 56, train_loss: 0.8135, test_loss: 1.0989, test_f1: 0.5944
 epoch: 57, train_loss: 0.8030, test_loss: 1.0720, test_f1: 0.6114
 epoch: 58, train_loss: 0.8220, test_loss: 1.1069, test_f1: 0.5918
 epoch: 59, train_loss: 0.8204, test_loss: 1.2498, test_f1: 0.5825
 epoch: 60, train_loss: 0.8094, test_loss: 1.1452, test_f1: 0.5821
 epoch: 61, train_loss: 0.8038, test_loss: 1.1033, test_f1: 0.5973
 epoch: 62, train_loss: 0.8101, test_loss: 1.1077, test_f1: 0.5811
 epoch: 63, train_loss: 0.8016, test_loss: 1.0953, test_f1: 0.6006
 epoch: 64, train_loss: 0.8101, test_loss: 1.0975, test_f1: 0.5921
 epoch: 65, train_loss: 0.8058, test_loss: 1.0733, test_f1: 0.6140
 epoch: 66, train_loss: 0.7992, test_loss: 1.0944, test_f1: 0.6047
 epoch: 67, train_loss: 0.8022, test_loss: 1.1547, test_f1: 0.5857
 epoch: 68, train_loss: 0.7838, test_loss: 1.1106, test_f1: 0.6109
 epoch: 69, train_loss: 0.7961, test_loss: 1.0809, test_f1: 0.6058
 epoch: 70, train_loss: 0.7982, test_loss: 1.1083, test_f1: 0.6054
 epoch: 71, train_loss: 0.7886, test_loss: 1.1001, test_f1: 0.5966
 epoch: 72, train_loss: 0.7890, test_loss: 1.1649, test_f1: 0.5733
 epoch: 73, train_loss: 0.7840, test_loss: 1.1291, test_f1: 0.5965
 epoch: 74, train_loss: 0.7725, test_loss: 1.1541, test_f1: 0.5922
 epoch: 75, train_loss: 0.7793, test_loss: 1.0937, test_f1: 0.6087
 epoch: 76, train_loss: 0.7707, test_loss: 1.1334, test_f1: 0.5869
 epoch: 77, train_loss: 0.7889, test_loss: 1.1497, test_f1: 0.5865
 epoch: 78, train_loss: 0.7817, test_loss: 1.1261, test_f1: 0.5919
 epoch: 79, train_loss: 0.8005, test_loss: 1.1511, test_f1: 0.5948
 epoch: 80, train_loss: 0.7739, test_loss: 1.1521, test_f1: 0.5894
 epoch: 81, train_loss: 0.7757, test_loss: 1.1601, test_f1: 0.6023
 epoch: 82, train_loss: 0.7765, test_loss: 1.1657, test_f1: 0.5837
 epoch: 83, train_loss: 0.7800, test_loss: 1.1124, test_f1: 0.5892
 epoch: 84, train_loss: 0.7762, test_loss: 1.1158, test_f1: 0.6137
 epoch: 85, train_loss: 0.7559, test_loss: 1.1588, test_f1: 0.6001
 epoch: 86, train_loss: 0.7567, test_loss: 1.1487, test_f1: 0.5981
 epoch: 87, train_loss: 0.7695, test_loss: 1.2000, test_f1: 0.5856
 epoch: 88, train_loss: 0.7512, test_loss: 1.1514, test_f1: 0.6171
 epoch: 89, train_loss: 0.7584, test_loss: 1.1803, test_f1: 0.6220
 epoch: 90, train_loss: 0.7717, test_loss: 1.2763, test_f1: 0.5948
 epoch: 91, train_loss: 0.7746, test_loss: 1.2057, test_f1: 0.5867
 epoch: 92, train_loss: 0.7604, test_loss: 1.1868, test_f1: 0.5965
 epoch: 93, train_loss: 0.7608, test_loss: 1.1699, test_f1: 0.6095
 epoch: 94, train_loss: 0.7671, test_loss: 1.1769, test_f1: 0.6009
 epoch: 95, train_loss: 0.7512, test_loss: 1.2015, test_f1: 0.6040
 epoch: 96, train_loss: 0.7495, test_loss: 1.1839, test_f1: 0.5860
 epoch: 97, train_loss: 0.7506, test_loss: 1.1592, test_f1: 0.6221
 epoch: 98, train_loss: 0.7478, test_loss: 1.2364, test_f1: 0.6295
 epoch: 99, train_loss: 0.7551, test_loss: 1.1650, test_f1: 0.6324
##################ITERATION #7 ****************************************
 epoch: 0, train_loss: 1.3106, test_loss: 1.3239, test_f1: 0.3470
 epoch: 1, train_loss: 1.2195, test_loss: 1.2826, test_f1: 0.3933
 epoch: 2, train_loss: 1.2022, test_loss: 1.2973, test_f1: 0.4123
 epoch: 3, train_loss: 1.1837, test_loss: 1.2492, test_f1: 0.4521
 epoch: 4, train_loss: 1.1634, test_loss: 1.2236, test_f1: 0.4704
 epoch: 5, train_loss: 1.1432, test_loss: 1.2304, test_f1: 0.4795
 epoch: 6, train_loss: 1.1161, test_loss: 1.2052, test_f1: 0.5046
 epoch: 7, train_loss: 1.1118, test_loss: 1.1945, test_f1: 0.5179
 epoch: 8, train_loss: 1.0885, test_loss: 1.1768, test_f1: 0.5174
 epoch: 9, train_loss: 1.0761, test_loss: 1.1713, test_f1: 0.5240
 epoch: 10, train_loss: 1.0463, test_loss: 1.1602, test_f1: 0.5124
 epoch: 11, train_loss: 1.0453, test_loss: 1.1337, test_f1: 0.5529
 epoch: 12, train_loss: 1.0512, test_loss: 1.1420, test_f1: 0.5542
 epoch: 13, train_loss: 1.0379, test_loss: 1.1424, test_f1: 0.5596
 epoch: 14, train_loss: 1.0279, test_loss: 1.1323, test_f1: 0.5478
 epoch: 15, train_loss: 1.0129, test_loss: 1.1161, test_f1: 0.5485
 epoch: 16, train_loss: 0.9959, test_loss: 1.1186, test_f1: 0.5656
 epoch: 17, train_loss: 1.0119, test_loss: 1.1062, test_f1: 0.5515
 epoch: 18, train_loss: 1.0023, test_loss: 1.1021, test_f1: 0.5503
 epoch: 19, train_loss: 0.9821, test_loss: 1.0956, test_f1: 0.5531
 epoch: 20, train_loss: 0.9591, test_loss: 1.1030, test_f1: 0.5395
 epoch: 21, train_loss: 0.9571, test_loss: 1.0933, test_f1: 0.5791
 epoch: 22, train_loss: 0.9654, test_loss: 1.0862, test_f1: 0.5708
 epoch: 23, train_loss: 0.9575, test_loss: 1.0702, test_f1: 0.5633
 epoch: 24, train_loss: 0.9328, test_loss: 1.0793, test_f1: 0.5622
 epoch: 25, train_loss: 0.9514, test_loss: 1.0740, test_f1: 0.5740
 epoch: 26, train_loss: 0.9272, test_loss: 1.0943, test_f1: 0.5737
 epoch: 27, train_loss: 0.9250, test_loss: 1.0828, test_f1: 0.5923
 epoch: 28, train_loss: 0.9139, test_loss: 1.0733, test_f1: 0.5726
 epoch: 29, train_loss: 0.9144, test_loss: 1.0795, test_f1: 0.5546
 epoch: 30, train_loss: 0.9052, test_loss: 1.0498, test_f1: 0.5979
 epoch: 31, train_loss: 0.9108, test_loss: 1.0740, test_f1: 0.5924
 epoch: 32, train_loss: 0.8881, test_loss: 1.0542, test_f1: 0.5975
 epoch: 33, train_loss: 0.8826, test_loss: 1.0528, test_f1: 0.6126
 epoch: 34, train_loss: 0.8819, test_loss: 1.0570, test_f1: 0.5752
 epoch: 35, train_loss: 0.8694, test_loss: 1.0727, test_f1: 0.5930
 epoch: 36, train_loss: 0.8674, test_loss: 1.0750, test_f1: 0.5844
 epoch: 37, train_loss: 0.8688, test_loss: 1.0533, test_f1: 0.6001
 epoch: 38, train_loss: 0.8520, test_loss: 1.0419, test_f1: 0.6105
 epoch: 39, train_loss: 0.8610, test_loss: 1.0848, test_f1: 0.6190
 epoch: 40, train_loss: 0.8543, test_loss: 1.0541, test_f1: 0.6182
 epoch: 41, train_loss: 0.8610, test_loss: 1.0840, test_f1: 0.6357
 epoch: 42, train_loss: 0.8467, test_loss: 1.0462, test_f1: 0.6259
 epoch: 43, train_loss: 0.8288, test_loss: 1.0931, test_f1: 0.6265
 epoch: 44, train_loss: 0.8236, test_loss: 1.0719, test_f1: 0.5915
 epoch: 45, train_loss: 0.8134, test_loss: 1.1020, test_f1: 0.6104
 epoch: 46, train_loss: 0.8132, test_loss: 1.0567, test_f1: 0.6030
 epoch: 47, train_loss: 0.8236, test_loss: 1.1239, test_f1: 0.6012
 epoch: 48, train_loss: 0.8110, test_loss: 1.0898, test_f1: 0.6057
 epoch: 49, train_loss: 0.7915, test_loss: 1.1083, test_f1: 0.6053
 epoch: 50, train_loss: 0.7973, test_loss: 1.1044, test_f1: 0.5968
 epoch: 51, train_loss: 0.7839, test_loss: 1.0841, test_f1: 0.6078
 epoch: 52, train_loss: 0.7896, test_loss: 1.0784, test_f1: 0.5805
 epoch: 53, train_loss: 0.7853, test_loss: 1.0735, test_f1: 0.6076
 epoch: 54, train_loss: 0.7934, test_loss: 1.0950, test_f1: 0.5865
 epoch: 55, train_loss: 0.7875, test_loss: 1.0836, test_f1: 0.5986
 epoch: 56, train_loss: 0.7814, test_loss: 1.1260, test_f1: 0.5945
 epoch: 57, train_loss: 0.7790, test_loss: 1.1139, test_f1: 0.5830
 epoch: 58, train_loss: 0.7842, test_loss: 1.0745, test_f1: 0.5881
 epoch: 59, train_loss: 0.7749, test_loss: 1.1111, test_f1: 0.6016
 epoch: 60, train_loss: 0.7835, test_loss: 1.0916, test_f1: 0.5960
 epoch: 61, train_loss: 0.7706, test_loss: 1.1116, test_f1: 0.5998
 epoch: 62, train_loss: 0.7710, test_loss: 1.1457, test_f1: 0.5960
 epoch: 63, train_loss: 0.7629, test_loss: 1.1000, test_f1: 0.6092
 epoch: 64, train_loss: 0.7609, test_loss: 1.1076, test_f1: 0.6059
 epoch: 65, train_loss: 0.7762, test_loss: 1.1502, test_f1: 0.5972
 epoch: 66, train_loss: 0.7578, test_loss: 1.1078, test_f1: 0.6113
 epoch: 67, train_loss: 0.7558, test_loss: 1.1121, test_f1: 0.5907
 epoch: 68, train_loss: 0.7517, test_loss: 1.1199, test_f1: 0.6037
 epoch: 69, train_loss: 0.7474, test_loss: 1.1372, test_f1: 0.5828
 epoch: 70, train_loss: 0.7405, test_loss: 1.1386, test_f1: 0.5990
 epoch: 71, train_loss: 0.7562, test_loss: 1.1342, test_f1: 0.5857
 epoch: 72, train_loss: 0.7440, test_loss: 1.1286, test_f1: 0.6018
 epoch: 73, train_loss: 0.7585, test_loss: 1.1176, test_f1: 0.6151
 epoch: 74, train_loss: 0.7487, test_loss: 1.1516, test_f1: 0.5724
 epoch: 75, train_loss: 0.7274, test_loss: 1.1226, test_f1: 0.5896
 epoch: 76, train_loss: 0.7533, test_loss: 1.1238, test_f1: 0.5830
 epoch: 77, train_loss: 0.7280, test_loss: 1.1163, test_f1: 0.5984
 epoch: 78, train_loss: 0.7373, test_loss: 1.1732, test_f1: 0.6007
 epoch: 79, train_loss: 0.7329, test_loss: 1.1889, test_f1: 0.5593
 epoch: 80, train_loss: 0.7331, test_loss: 1.1857, test_f1: 0.5557
 epoch: 81, train_loss: 0.7261, test_loss: 1.1884, test_f1: 0.5692
 epoch: 82, train_loss: 0.7300, test_loss: 1.1544, test_f1: 0.5769
 epoch: 83, train_loss: 0.7281, test_loss: 1.1406, test_f1: 0.5938
 epoch: 84, train_loss: 0.7180, test_loss: 1.1380, test_f1: 0.5989
 epoch: 85, train_loss: 0.7336, test_loss: 1.1915, test_f1: 0.5670
 epoch: 86, train_loss: 0.7218, test_loss: 1.1561, test_f1: 0.5826
 epoch: 87, train_loss: 0.7144, test_loss: 1.2171, test_f1: 0.5792
 epoch: 88, train_loss: 0.7268, test_loss: 1.1960, test_f1: 0.5751
 epoch: 89, train_loss: 0.7089, test_loss: 1.2216, test_f1: 0.5887
 epoch: 90, train_loss: 0.7120, test_loss: 1.2229, test_f1: 0.5783
 epoch: 91, train_loss: 0.7044, test_loss: 1.2249, test_f1: 0.5890
 epoch: 92, train_loss: 0.7055, test_loss: 1.2523, test_f1: 0.5993
 epoch: 93, train_loss: 0.7041, test_loss: 1.2331, test_f1: 0.5861
 epoch: 94, train_loss: 0.7257, test_loss: 1.2218, test_f1: 0.5803
 epoch: 95, train_loss: 0.7002, test_loss: 1.2255, test_f1: 0.5875
 epoch: 96, train_loss: 0.7112, test_loss: 1.2473, test_f1: 0.5964
 epoch: 97, train_loss: 0.7077, test_loss: 1.2525, test_f1: 0.5918
 epoch: 98, train_loss: 0.7097, test_loss: 1.2687, test_f1: 0.5994
 epoch: 99, train_loss: 0.6768, test_loss: 1.2389, test_f1: 0.5962
##################ITERATION #8 ****************************************
 epoch: 0, train_loss: 1.3010, test_loss: 1.3057, test_f1: 0.3431
 epoch: 1, train_loss: 1.2250, test_loss: 1.2662, test_f1: 0.4212
 epoch: 2, train_loss: 1.2049, test_loss: 1.2618, test_f1: 0.4265
 epoch: 3, train_loss: 1.1675, test_loss: 1.2479, test_f1: 0.4443
 epoch: 4, train_loss: 1.1470, test_loss: 1.2409, test_f1: 0.4596
 epoch: 5, train_loss: 1.1353, test_loss: 1.2054, test_f1: 0.4691
 epoch: 6, train_loss: 1.1175, test_loss: 1.2063, test_f1: 0.4873
 epoch: 7, train_loss: 1.1129, test_loss: 1.1997, test_f1: 0.4983
 epoch: 8, train_loss: 1.0985, test_loss: 1.1881, test_f1: 0.5067
 epoch: 9, train_loss: 1.0749, test_loss: 1.1958, test_f1: 0.5225
 epoch: 10, train_loss: 1.0721, test_loss: 1.1772, test_f1: 0.5163
 epoch: 11, train_loss: 1.0522, test_loss: 1.2016, test_f1: 0.5301
 epoch: 12, train_loss: 1.0596, test_loss: 1.2087, test_f1: 0.5316
 epoch: 13, train_loss: 1.0395, test_loss: 1.2158, test_f1: 0.5096
 epoch: 14, train_loss: 1.0411, test_loss: 1.2074, test_f1: 0.5176
 epoch: 15, train_loss: 1.0376, test_loss: 1.2083, test_f1: 0.5276
 epoch: 16, train_loss: 1.0435, test_loss: 1.2269, test_f1: 0.5218
 epoch: 17, train_loss: 1.0003, test_loss: 1.2259, test_f1: 0.5441
 epoch: 18, train_loss: 1.0192, test_loss: 1.2020, test_f1: 0.5380
 epoch: 19, train_loss: 1.0010, test_loss: 1.2189, test_f1: 0.5278
 epoch: 20, train_loss: 0.9895, test_loss: 1.2137, test_f1: 0.5325
 epoch: 21, train_loss: 0.9888, test_loss: 1.2334, test_f1: 0.5271
 epoch: 22, train_loss: 0.9645, test_loss: 1.2477, test_f1: 0.5202
 epoch: 23, train_loss: 0.9649, test_loss: 1.2023, test_f1: 0.5482
 epoch: 24, train_loss: 0.9890, test_loss: 1.2097, test_f1: 0.5485
 epoch: 25, train_loss: 0.9480, test_loss: 1.2250, test_f1: 0.5270
 epoch: 26, train_loss: 0.9596, test_loss: 1.2533, test_f1: 0.5065
 epoch: 27, train_loss: 0.9575, test_loss: 1.2276, test_f1: 0.5163
 epoch: 28, train_loss: 0.9471, test_loss: 1.2638, test_f1: 0.4930
 epoch: 29, train_loss: 0.9391, test_loss: 1.2234, test_f1: 0.5349
 epoch: 30, train_loss: 0.9432, test_loss: 1.2599, test_f1: 0.5207
 epoch: 31, train_loss: 0.9407, test_loss: 1.2692, test_f1: 0.5313
 epoch: 32, train_loss: 0.9382, test_loss: 1.2702, test_f1: 0.5075
 epoch: 33, train_loss: 0.9193, test_loss: 1.2533, test_f1: 0.5387
 epoch: 34, train_loss: 0.9158, test_loss: 1.2447, test_f1: 0.5218
 epoch: 35, train_loss: 0.9188, test_loss: 1.2710, test_f1: 0.5300
 epoch: 36, train_loss: 0.9035, test_loss: 1.2718, test_f1: 0.5332
 epoch: 37, train_loss: 0.9040, test_loss: 1.2928, test_f1: 0.5180
 epoch: 38, train_loss: 0.8946, test_loss: 1.3021, test_f1: 0.5102
 epoch: 39, train_loss: 0.9000, test_loss: 1.2724, test_f1: 0.5229
 epoch: 40, train_loss: 0.8918, test_loss: 1.2905, test_f1: 0.5122
 epoch: 41, train_loss: 0.8821, test_loss: 1.3212, test_f1: 0.5237
 epoch: 42, train_loss: 0.9033, test_loss: 1.3028, test_f1: 0.5147
 epoch: 43, train_loss: 0.8896, test_loss: 1.3651, test_f1: 0.4992
 epoch: 44, train_loss: 0.8603, test_loss: 1.3204, test_f1: 0.5230
 epoch: 45, train_loss: 0.8637, test_loss: 1.3587, test_f1: 0.5193
 epoch: 46, train_loss: 0.8587, test_loss: 1.3401, test_f1: 0.5064
 epoch: 47, train_loss: 0.8673, test_loss: 1.3196, test_f1: 0.5125
 epoch: 48, train_loss: 0.8473, test_loss: 1.3329, test_f1: 0.5233
 epoch: 49, train_loss: 0.8668, test_loss: 1.3328, test_f1: 0.5105
 epoch: 50, train_loss: 0.8417, test_loss: 1.3910, test_f1: 0.5034
 epoch: 51, train_loss: 0.8462, test_loss: 1.4020, test_f1: 0.5236
 epoch: 52, train_loss: 0.8546, test_loss: 1.3851, test_f1: 0.5227
 epoch: 53, train_loss: 0.8322, test_loss: 1.4000, test_f1: 0.5362
 epoch: 54, train_loss: 0.8404, test_loss: 1.4234, test_f1: 0.5248
 epoch: 55, train_loss: 0.8451, test_loss: 1.4174, test_f1: 0.5183
 epoch: 56, train_loss: 0.8361, test_loss: 1.3743, test_f1: 0.5445
 epoch: 57, train_loss: 0.8410, test_loss: 1.4280, test_f1: 0.5159
 epoch: 58, train_loss: 0.8525, test_loss: 1.4057, test_f1: 0.5116
 epoch: 59, train_loss: 0.8427, test_loss: 1.4434, test_f1: 0.5329
 epoch: 60, train_loss: 0.8324, test_loss: 1.4565, test_f1: 0.5345
 epoch: 61, train_loss: 0.8174, test_loss: 1.4313, test_f1: 0.5321
 epoch: 62, train_loss: 0.8187, test_loss: 1.4155, test_f1: 0.5443
 epoch: 63, train_loss: 0.8140, test_loss: 1.3868, test_f1: 0.5543
 epoch: 64, train_loss: 0.8349, test_loss: 1.4251, test_f1: 0.5366
 epoch: 65, train_loss: 0.8124, test_loss: 1.4121, test_f1: 0.5402
 epoch: 66, train_loss: 0.8124, test_loss: 1.4180, test_f1: 0.5344
 epoch: 67, train_loss: 0.8188, test_loss: 1.4229, test_f1: 0.5156
 epoch: 68, train_loss: 0.8150, test_loss: 1.3994, test_f1: 0.5258
 epoch: 69, train_loss: 0.8347, test_loss: 1.4172, test_f1: 0.5478
 epoch: 70, train_loss: 0.8038, test_loss: 1.3951, test_f1: 0.5324
 epoch: 71, train_loss: 0.8175, test_loss: 1.4922, test_f1: 0.5419
 epoch: 72, train_loss: 0.8041, test_loss: 1.4185, test_f1: 0.5347
 epoch: 73, train_loss: 0.8091, test_loss: 1.4286, test_f1: 0.5537
 epoch: 74, train_loss: 0.8142, test_loss: 1.4191, test_f1: 0.5362
 epoch: 75, train_loss: 0.8151, test_loss: 1.4270, test_f1: 0.5365
 epoch: 76, train_loss: 0.8054, test_loss: 1.4338, test_f1: 0.5318
 epoch: 77, train_loss: 0.7939, test_loss: 1.4619, test_f1: 0.5071
 epoch: 78, train_loss: 0.8100, test_loss: 1.4371, test_f1: 0.5346
 epoch: 79, train_loss: 0.7995, test_loss: 1.4126, test_f1: 0.5199
 epoch: 80, train_loss: 0.7938, test_loss: 1.4548, test_f1: 0.5583
 epoch: 81, train_loss: 0.7966, test_loss: 1.5200, test_f1: 0.5581
 epoch: 82, train_loss: 0.7866, test_loss: 1.5819, test_f1: 0.5119
 epoch: 83, train_loss: 0.7976, test_loss: 1.5011, test_f1: 0.5602
 epoch: 84, train_loss: 0.8108, test_loss: 1.4816, test_f1: 0.5541
 epoch: 85, train_loss: 0.7996, test_loss: 1.4496, test_f1: 0.5314
 epoch: 86, train_loss: 0.7911, test_loss: 1.4379, test_f1: 0.5198
 epoch: 87, train_loss: 0.7841, test_loss: 1.5331, test_f1: 0.5455
 epoch: 88, train_loss: 0.7721, test_loss: 1.4664, test_f1: 0.5494
 epoch: 89, train_loss: 0.7832, test_loss: 1.5287, test_f1: 0.5223
 epoch: 90, train_loss: 0.7736, test_loss: 1.5701, test_f1: 0.5118
 epoch: 91, train_loss: 0.7784, test_loss: 1.5550, test_f1: 0.5377
 epoch: 92, train_loss: 0.7672, test_loss: 1.5577, test_f1: 0.5345
 epoch: 93, train_loss: 0.7705, test_loss: 1.5250, test_f1: 0.5422
 epoch: 94, train_loss: 0.7982, test_loss: 1.5244, test_f1: 0.5227
 epoch: 95, train_loss: 0.7752, test_loss: 1.6042, test_f1: 0.5249
 epoch: 96, train_loss: 0.7816, test_loss: 1.5572, test_f1: 0.5360
 epoch: 97, train_loss: 0.7646, test_loss: 1.5009, test_f1: 0.5392
 epoch: 98, train_loss: 0.7780, test_loss: 1.5248, test_f1: 0.5285
 epoch: 99, train_loss: 0.7770, test_loss: 1.6139, test_f1: 0.5343
##################ITERATION #9 ****************************************
 epoch: 0, train_loss: 1.3241, test_loss: 1.3120, test_f1: 0.3451
 epoch: 1, train_loss: 1.2294, test_loss: 1.2760, test_f1: 0.3920
 epoch: 2, train_loss: 1.1913, test_loss: 1.2676, test_f1: 0.3998
 epoch: 3, train_loss: 1.1794, test_loss: 1.2351, test_f1: 0.4549
 epoch: 4, train_loss: 1.1496, test_loss: 1.2560, test_f1: 0.4638
 epoch: 5, train_loss: 1.1305, test_loss: 1.6443, test_f1: 0.5018
 epoch: 6, train_loss: 1.1012, test_loss: 1.2035, test_f1: 0.4913
 epoch: 7, train_loss: 1.1020, test_loss: 1.3701, test_f1: 0.4968
 epoch: 8, train_loss: 1.0793, test_loss: 1.4426, test_f1: 0.5345
 epoch: 9, train_loss: 1.0642, test_loss: 1.2570, test_f1: 0.5412
 epoch: 10, train_loss: 1.0513, test_loss: 1.5130, test_f1: 0.5442
 epoch: 11, train_loss: 1.0637, test_loss: 1.1615, test_f1: 0.5788
 epoch: 12, train_loss: 1.0494, test_loss: 1.4959, test_f1: 0.5141
 epoch: 13, train_loss: 1.0538, test_loss: 1.1962, test_f1: 0.5538
 epoch: 14, train_loss: 1.0171, test_loss: 1.2945, test_f1: 0.5493
 epoch: 15, train_loss: 0.9978, test_loss: 1.3989, test_f1: 0.5584
 epoch: 16, train_loss: 0.9977, test_loss: 1.1973, test_f1: 0.5177
 epoch: 17, train_loss: 0.9970, test_loss: 1.2528, test_f1: 0.5347
 epoch: 18, train_loss: 0.9942, test_loss: 1.3455, test_f1: 0.5362
 epoch: 19, train_loss: 0.9892, test_loss: 1.7029, test_f1: 0.5432
 epoch: 20, train_loss: 0.9838, test_loss: 1.3909, test_f1: 0.5430
 epoch: 21, train_loss: 0.9806, test_loss: 1.2277, test_f1: 0.4916
 epoch: 22, train_loss: 0.9706, test_loss: 1.3513, test_f1: 0.5609
 epoch: 23, train_loss: 0.9568, test_loss: 1.3223, test_f1: 0.5381
 epoch: 24, train_loss: 0.9528, test_loss: 1.6566, test_f1: 0.5143
 epoch: 25, train_loss: 0.9486, test_loss: 1.6384, test_f1: 0.5445
 epoch: 26, train_loss: 0.9350, test_loss: 1.3106, test_f1: 0.5440
 epoch: 27, train_loss: 0.9193, test_loss: 1.5829, test_f1: 0.5441
 epoch: 28, train_loss: 0.9168, test_loss: 1.4836, test_f1: 0.5098
 epoch: 29, train_loss: 0.9143, test_loss: 1.5627, test_f1: 0.5542
 epoch: 30, train_loss: 0.9288, test_loss: 1.3825, test_f1: 0.5459
 epoch: 31, train_loss: 0.9154, test_loss: 1.3327, test_f1: 0.5069
 epoch: 32, train_loss: 0.9050, test_loss: 2.2185, test_f1: 0.5009
 epoch: 33, train_loss: 0.8860, test_loss: 1.4146, test_f1: 0.5409
 epoch: 34, train_loss: 0.8605, test_loss: 1.5464, test_f1: 0.5217
 epoch: 35, train_loss: 0.8812, test_loss: 1.6328, test_f1: 0.5016
 epoch: 36, train_loss: 0.8861, test_loss: 1.3567, test_f1: 0.5512
 epoch: 37, train_loss: 0.8816, test_loss: 1.3366, test_f1: 0.5270
 epoch: 38, train_loss: 0.8819, test_loss: 1.2500, test_f1: 0.5401
 epoch: 39, train_loss: 0.8633, test_loss: 1.6042, test_f1: 0.5357
 epoch: 40, train_loss: 0.8625, test_loss: 1.6092, test_f1: 0.5154
 epoch: 41, train_loss: 0.8668, test_loss: 1.7788, test_f1: 0.5192
 epoch: 42, train_loss: 0.8475, test_loss: 1.7001, test_f1: 0.5231
 epoch: 43, train_loss: 0.8622, test_loss: 1.7068, test_f1: 0.5372
 epoch: 44, train_loss: 0.8505, test_loss: 1.5756, test_f1: 0.5048
 epoch: 45, train_loss: 0.8447, test_loss: 1.4406, test_f1: 0.5155
 epoch: 46, train_loss: 0.8204, test_loss: 1.7016, test_f1: 0.5378
 epoch: 47, train_loss: 0.8406, test_loss: 1.6908, test_f1: 0.5253
 epoch: 48, train_loss: 0.8325, test_loss: 1.3983, test_f1: 0.5536
 epoch: 49, train_loss: 0.8180, test_loss: 1.6143, test_f1: 0.5173
 epoch: 50, train_loss: 0.8348, test_loss: 1.4299, test_f1: 0.5588
 epoch: 51, train_loss: 0.8072, test_loss: 1.9155, test_f1: 0.5329
 epoch: 52, train_loss: 0.8070, test_loss: 1.4402, test_f1: 0.5579
 epoch: 53, train_loss: 0.7904, test_loss: 1.7417, test_f1: 0.5357
 epoch: 54, train_loss: 0.8119, test_loss: 1.4044, test_f1: 0.5209
 epoch: 55, train_loss: 0.8068, test_loss: 1.4194, test_f1: 0.5332
 epoch: 56, train_loss: 0.7892, test_loss: 1.6889, test_f1: 0.5515
 epoch: 57, train_loss: 0.7950, test_loss: 1.8731, test_f1: 0.5237
 epoch: 58, train_loss: 0.7755, test_loss: 2.0615, test_f1: 0.5220
 epoch: 59, train_loss: 0.7963, test_loss: 1.5361, test_f1: 0.5215
 epoch: 60, train_loss: 0.8014, test_loss: 1.5658, test_f1: 0.5376
 epoch: 61, train_loss: 0.7916, test_loss: 1.7553, test_f1: 0.5413
 epoch: 62, train_loss: 0.7799, test_loss: 2.2300, test_f1: 0.5517
 epoch: 63, train_loss: 0.7971, test_loss: 1.4108, test_f1: 0.5434
 epoch: 64, train_loss: 0.7874, test_loss: 1.6494, test_f1: 0.5217
 epoch: 65, train_loss: 0.7821, test_loss: 1.9610, test_f1: 0.5289
 epoch: 66, train_loss: 0.7771, test_loss: 1.6663, test_f1: 0.5322
 epoch: 67, train_loss: 0.7631, test_loss: 2.1338, test_f1: 0.5254
 epoch: 68, train_loss: 0.7921, test_loss: 1.9944, test_f1: 0.5279
 epoch: 69, train_loss: 0.7893, test_loss: 1.4583, test_f1: 0.5273
 epoch: 70, train_loss: 0.7791, test_loss: 2.3334, test_f1: 0.5284
 epoch: 71, train_loss: 0.7666, test_loss: 1.6713, test_f1: 0.5395
 epoch: 72, train_loss: 0.7850, test_loss: 2.2598, test_f1: 0.5381
 epoch: 73, train_loss: 0.7791, test_loss: 2.0233, test_f1: 0.5352
 epoch: 74, train_loss: 0.7643, test_loss: 1.8250, test_f1: 0.5375
 epoch: 75, train_loss: 0.7651, test_loss: 2.7368, test_f1: 0.5134
 epoch: 76, train_loss: 0.7684, test_loss: 2.7361, test_f1: 0.5250
 epoch: 77, train_loss: 0.7640, test_loss: 1.9211, test_f1: 0.5407
 epoch: 78, train_loss: 0.7489, test_loss: 1.8422, test_f1: 0.5291
 epoch: 79, train_loss: 0.7494, test_loss: 2.5797, test_f1: 0.5317
 epoch: 80, train_loss: 0.7572, test_loss: 1.8246, test_f1: 0.5359
 epoch: 81, train_loss: 0.7601, test_loss: 2.2496, test_f1: 0.5291
 epoch: 82, train_loss: 0.7559, test_loss: 1.7111, test_f1: 0.5389
 epoch: 83, train_loss: 0.7588, test_loss: 2.2894, test_f1: 0.5371
 epoch: 84, train_loss: 0.7497, test_loss: 1.9303, test_f1: 0.5335
 epoch: 85, train_loss: 0.7480, test_loss: 2.2853, test_f1: 0.5283
 epoch: 86, train_loss: 0.7618, test_loss: 1.8529, test_f1: 0.4956
 epoch: 87, train_loss: 0.7524, test_loss: 1.8845, test_f1: 0.5489
 epoch: 88, train_loss: 0.7507, test_loss: 2.5479, test_f1: 0.5376
 epoch: 89, train_loss: 0.7462, test_loss: 2.1235, test_f1: 0.5417
 epoch: 90, train_loss: 0.7528, test_loss: 1.8796, test_f1: 0.5334
 epoch: 91, train_loss: 0.7343, test_loss: 2.3423, test_f1: 0.5396
 epoch: 92, train_loss: 0.7536, test_loss: 2.3101, test_f1: 0.5345
 epoch: 93, train_loss: 0.7285, test_loss: 1.8970, test_f1: 0.5522
 epoch: 94, train_loss: 0.7382, test_loss: 1.9709, test_f1: 0.5515
 epoch: 95, train_loss: 0.7342, test_loss: 1.9815, test_f1: 0.5469
 epoch: 96, train_loss: 0.7389, test_loss: 1.5647, test_f1: 0.5210
 epoch: 97, train_loss: 0.7429, test_loss: 2.5047, test_f1: 0.5335
 epoch: 98, train_loss: 0.7381, test_loss: 2.3007, test_f1: 0.5280
 epoch: 99, train_loss: 0.7153, test_loss: 1.7709, test_f1: 0.5194

Training completed in 1117.34 seconds
Best F1: 0.6357 at epoch 41
Mean F1 across iterations: 0.5868  0.0291
========================FINAL RESULTS================================
FEGIN weighted F1: 0.6357  0.0291
python main.py --data ltspice_demos --representation component_component --model FEGIN --layers 2 --hiddens 64 --batch_size 32 --lr 0.0001 --emb_size 128 --epochs 100 --save_appendix component_component_L2_H64_BS32_LR0.0001_E128 --no_val
-----



STDERR:
  File "main.py", line 370, in <module>
    main()
  File "main.py", line 254, in main
    dataset = dataset_class(
  File "/home/philip/projects/ltspice_examples_code_repo/Circuit-Completion-Using-GNNs/component_classification_with_link_prediction_head/evaluation/FEGIN/kernel/circuit_datasets.py", line 15, in __init__
    self.data, self.slices = torch.load(self.processed_paths[0])
  File "/home/philip/.local/lib/python3.8/site-packages/torch/serialization.py", line 1040, in load
    warnings.warn(
  File "/usr/lib/python3.8/warnings.py", line 109, in _showwarnmsg
    sw(msg.message, msg.category, msg.filename, msg.lineno,
  File "main.py", line 47, in warn_with_traceback
    traceback.print_stack(file=log)
/home/philip/projects/ltspice_examples_code_repo/Circuit-Completion-Using-GNNs/component_classification_with_link_prediction_head/evaluation/FEGIN/kernel/circuit_datasets.py:15: FutureWarning: You are using `torch.load` with `weights_only=False` (the current default value), which uses the default pickle module implicitly. It is possible to construct malicious pickle data which will execute arbitrary code during unpickling (See https://github.com/pytorch/pytorch/blob/main/SECURITY.md#untrusted-models for more details). In a future release, the default value for `weights_only` will be flipped to `True`. This limits the functions that could be executed during unpickling. Arbitrary objects will no longer be allowed to be loaded via this mode unless they are explicitly allowlisted by the user via `torch.serialization.add_safe_globals`. We recommend you start setting `weights_only=True` for any use case where you don't have full control of the loaded file. Please open an issue on GitHub for any issues related to this experimental feature.
  self.data, self.slices = torch.load(self.processed_paths[0])
