STDOUT:
Results will be saved in /home/philip/projects/ltspice_examples_code_repo/Circuit-Completion-Using-GNNs/component_classification_with_link_prediction_head/evaluation/FEGIN/results/model_FEGIN_dataset_ltspice_examples
Command line input: python main.py --data ltspice_examples --representation component_net --model FEGIN --layers 6 --hiddens 64 --batch_size 256 --lr 0.0001 --emb_size 512 --epochs 100 --save_appendix component_net_L6_H64_BS256_LR0.0001_E512 --no_val
 is saved.
-----
ltspice_examples - FEGIN
Using 6 layers, 64 hidden units, h = 2
Loading component_net representation dataset
ENTERED
Training FEGIN on component_net representation
Train: 3558, Test: 846
##################ITERATION #0 ****************************************
 epoch: 0, train_loss: 1.3994, test_loss: 1.3987, test_f1: 0.0793
 epoch: 1, train_loss: 1.3881, test_loss: 1.3938, test_f1: 0.0793
 epoch: 2, train_loss: 1.3800, test_loss: 1.3858, test_f1: 0.0793
 epoch: 3, train_loss: 1.3715, test_loss: 1.3749, test_f1: 0.0793
 epoch: 4, train_loss: 1.3605, test_loss: 1.3573, test_f1: 0.1651
 epoch: 5, train_loss: 1.3491, test_loss: 1.3405, test_f1: 0.2115
 epoch: 6, train_loss: 1.3362, test_loss: 1.3236, test_f1: 0.2279
 epoch: 7, train_loss: 1.3220, test_loss: 1.3066, test_f1: 0.2635
 epoch: 8, train_loss: 1.3077, test_loss: 1.2904, test_f1: 0.3128
 epoch: 9, train_loss: 1.2934, test_loss: 1.2755, test_f1: 0.3427
 epoch: 10, train_loss: 1.2783, test_loss: 1.2604, test_f1: 0.3338
 epoch: 11, train_loss: 1.2650, test_loss: 1.2464, test_f1: 0.3156
 epoch: 12, train_loss: 1.2522, test_loss: 1.2313, test_f1: 0.3100
 epoch: 13, train_loss: 1.2414, test_loss: 1.2204, test_f1: 0.2877
 epoch: 14, train_loss: 1.2290, test_loss: 1.2073, test_f1: 0.2866
 epoch: 15, train_loss: 1.2188, test_loss: 1.1973, test_f1: 0.2904
 epoch: 16, train_loss: 1.2118, test_loss: 1.1838, test_f1: 0.2977
 epoch: 17, train_loss: 1.2015, test_loss: 1.1758, test_f1: 0.3041
 epoch: 18, train_loss: 1.1907, test_loss: 1.1639, test_f1: 0.3155
 epoch: 19, train_loss: 1.1787, test_loss: 1.1536, test_f1: 0.3212
 epoch: 20, train_loss: 1.1668, test_loss: 1.1416, test_f1: 0.3213
 epoch: 21, train_loss: 1.1597, test_loss: 1.1316, test_f1: 0.3387
 epoch: 22, train_loss: 1.1506, test_loss: 1.1222, test_f1: 0.3636
 epoch: 23, train_loss: 1.1374, test_loss: 1.1137, test_f1: 0.3877
 epoch: 24, train_loss: 1.1271, test_loss: 1.1059, test_f1: 0.4275
 epoch: 25, train_loss: 1.1171, test_loss: 1.0910, test_f1: 0.4364
 epoch: 26, train_loss: 1.1079, test_loss: 1.0804, test_f1: 0.4540
 epoch: 27, train_loss: 1.0990, test_loss: 1.0748, test_f1: 0.4638
 epoch: 28, train_loss: 1.0837, test_loss: 1.0641, test_f1: 0.5113
 epoch: 29, train_loss: 1.0739, test_loss: 1.0581, test_f1: 0.4931
 epoch: 30, train_loss: 1.0683, test_loss: 1.0426, test_f1: 0.5198
 epoch: 31, train_loss: 1.0533, test_loss: 1.0324, test_f1: 0.5396
 epoch: 32, train_loss: 1.0484, test_loss: 1.0289, test_f1: 0.5105
 epoch: 33, train_loss: 1.0364, test_loss: 1.0161, test_f1: 0.5326
 epoch: 34, train_loss: 1.0263, test_loss: 1.0082, test_f1: 0.5260
 epoch: 35, train_loss: 1.0149, test_loss: 1.0080, test_f1: 0.5336
 epoch: 36, train_loss: 1.0033, test_loss: 0.9942, test_f1: 0.5177
 epoch: 37, train_loss: 0.9958, test_loss: 0.9883, test_f1: 0.5169
 epoch: 38, train_loss: 0.9824, test_loss: 0.9688, test_f1: 0.5374
 epoch: 39, train_loss: 0.9728, test_loss: 0.9602, test_f1: 0.5388
 epoch: 40, train_loss: 0.9665, test_loss: 0.9651, test_f1: 0.5401
 epoch: 41, train_loss: 0.9587, test_loss: 0.9494, test_f1: 0.5380
 epoch: 42, train_loss: 0.9380, test_loss: 0.9511, test_f1: 0.5347
 epoch: 43, train_loss: 0.9305, test_loss: 0.9338, test_f1: 0.5559
 epoch: 44, train_loss: 0.9243, test_loss: 0.9418, test_f1: 0.5549
 epoch: 45, train_loss: 0.9137, test_loss: 0.9325, test_f1: 0.5514
 epoch: 46, train_loss: 0.9018, test_loss: 0.9187, test_f1: 0.5451
 epoch: 47, train_loss: 0.8937, test_loss: 0.9234, test_f1: 0.5395
 epoch: 48, train_loss: 0.8915, test_loss: 0.9125, test_f1: 0.5536
 epoch: 49, train_loss: 0.8806, test_loss: 0.9292, test_f1: 0.5354
 epoch: 50, train_loss: 0.8803, test_loss: 0.9075, test_f1: 0.5547
 epoch: 51, train_loss: 0.8677, test_loss: 0.9051, test_f1: 0.5660
 epoch: 52, train_loss: 0.8616, test_loss: 0.9103, test_f1: 0.5534
 epoch: 53, train_loss: 0.8571, test_loss: 0.9031, test_f1: 0.5690
 epoch: 54, train_loss: 0.8457, test_loss: 0.9032, test_f1: 0.5545
 epoch: 55, train_loss: 0.8586, test_loss: 0.9072, test_f1: 0.5515
 epoch: 56, train_loss: 0.8449, test_loss: 0.9010, test_f1: 0.5710
 epoch: 57, train_loss: 0.8405, test_loss: 0.9058, test_f1: 0.5642
 epoch: 58, train_loss: 0.8454, test_loss: 0.9140, test_f1: 0.5521
 epoch: 59, train_loss: 0.8407, test_loss: 0.8971, test_f1: 0.5667
 epoch: 60, train_loss: 0.8410, test_loss: 0.9084, test_f1: 0.5472
 epoch: 61, train_loss: 0.8232, test_loss: 0.9005, test_f1: 0.5635
 epoch: 62, train_loss: 0.8305, test_loss: 0.9011, test_f1: 0.5660
 epoch: 63, train_loss: 0.8223, test_loss: 0.8971, test_f1: 0.5520
 epoch: 64, train_loss: 0.8209, test_loss: 0.8991, test_f1: 0.5656
 epoch: 65, train_loss: 0.8181, test_loss: 0.9069, test_f1: 0.5574
 epoch: 66, train_loss: 0.8105, test_loss: 0.9012, test_f1: 0.5601
 epoch: 67, train_loss: 0.8053, test_loss: 0.9042, test_f1: 0.5579
 epoch: 68, train_loss: 0.8067, test_loss: 0.9004, test_f1: 0.5518
 epoch: 69, train_loss: 0.8145, test_loss: 0.9017, test_f1: 0.5629
 epoch: 70, train_loss: 0.8060, test_loss: 0.8880, test_f1: 0.5718
 epoch: 71, train_loss: 0.7968, test_loss: 0.9001, test_f1: 0.5550
 epoch: 72, train_loss: 0.8054, test_loss: 0.8955, test_f1: 0.5620
 epoch: 73, train_loss: 0.7964, test_loss: 0.9091, test_f1: 0.5536
 epoch: 74, train_loss: 0.8041, test_loss: 0.9005, test_f1: 0.5543
 epoch: 75, train_loss: 0.7998, test_loss: 0.9025, test_f1: 0.5426
 epoch: 76, train_loss: 0.7899, test_loss: 0.9045, test_f1: 0.5691
 epoch: 77, train_loss: 0.8031, test_loss: 0.9093, test_f1: 0.5510
 epoch: 78, train_loss: 0.7946, test_loss: 0.9203, test_f1: 0.5496
 epoch: 79, train_loss: 0.7947, test_loss: 0.9030, test_f1: 0.5631
 epoch: 80, train_loss: 0.7798, test_loss: 0.9120, test_f1: 0.5508
 epoch: 81, train_loss: 0.7912, test_loss: 0.9101, test_f1: 0.5695
 epoch: 82, train_loss: 0.7833, test_loss: 0.8956, test_f1: 0.5804
 epoch: 83, train_loss: 0.7893, test_loss: 0.9067, test_f1: 0.5633
 epoch: 84, train_loss: 0.7795, test_loss: 0.9049, test_f1: 0.5580
 epoch: 85, train_loss: 0.7781, test_loss: 0.9056, test_f1: 0.5541
 epoch: 86, train_loss: 0.7846, test_loss: 0.8962, test_f1: 0.5632
 epoch: 87, train_loss: 0.7673, test_loss: 0.9051, test_f1: 0.5622
 epoch: 88, train_loss: 0.7775, test_loss: 0.9046, test_f1: 0.5633
 epoch: 89, train_loss: 0.7627, test_loss: 0.9050, test_f1: 0.5672
 epoch: 90, train_loss: 0.7736, test_loss: 0.9068, test_f1: 0.5623
 epoch: 91, train_loss: 0.7646, test_loss: 0.9155, test_f1: 0.5612
 epoch: 92, train_loss: 0.7622, test_loss: 0.9109, test_f1: 0.5570
 epoch: 93, train_loss: 0.7612, test_loss: 0.9079, test_f1: 0.5584
 epoch: 94, train_loss: 0.7600, test_loss: 0.9198, test_f1: 0.5524
 epoch: 95, train_loss: 0.7636, test_loss: 0.9080, test_f1: 0.5634
 epoch: 96, train_loss: 0.7604, test_loss: 0.9103, test_f1: 0.5580
 epoch: 97, train_loss: 0.7540, test_loss: 0.9240, test_f1: 0.5572
 epoch: 98, train_loss: 0.7583, test_loss: 0.9141, test_f1: 0.5622
 epoch: 99, train_loss: 0.7593, test_loss: 0.9160, test_f1: 0.5610
##################ITERATION #1 ****************************************
 epoch: 0, train_loss: 1.3571, test_loss: 1.3847, test_f1: 0.1004
 epoch: 1, train_loss: 1.3244, test_loss: 1.3688, test_f1: 0.2371
 epoch: 2, train_loss: 1.3072, test_loss: 1.3369, test_f1: 0.2434
 epoch: 3, train_loss: 1.2876, test_loss: 1.3106, test_f1: 0.2454
 epoch: 4, train_loss: 1.2667, test_loss: 1.2726, test_f1: 0.2568
 epoch: 5, train_loss: 1.2480, test_loss: 1.2395, test_f1: 0.3187
 epoch: 6, train_loss: 1.2281, test_loss: 1.2112, test_f1: 0.3675
 epoch: 7, train_loss: 1.2138, test_loss: 1.1868, test_f1: 0.3805
 epoch: 8, train_loss: 1.1959, test_loss: 1.1645, test_f1: 0.3890
 epoch: 9, train_loss: 1.1799, test_loss: 1.1448, test_f1: 0.3903
 epoch: 10, train_loss: 1.1644, test_loss: 1.1248, test_f1: 0.4054
 epoch: 11, train_loss: 1.1478, test_loss: 1.1062, test_f1: 0.4165
 epoch: 12, train_loss: 1.1338, test_loss: 1.0894, test_f1: 0.4190
 epoch: 13, train_loss: 1.1129, test_loss: 1.0704, test_f1: 0.4333
 epoch: 14, train_loss: 1.0987, test_loss: 1.0504, test_f1: 0.4467
 epoch: 15, train_loss: 1.0835, test_loss: 1.0378, test_f1: 0.4490
 epoch: 16, train_loss: 1.0756, test_loss: 1.0244, test_f1: 0.4820
 epoch: 17, train_loss: 1.0562, test_loss: 1.0111, test_f1: 0.4831
 epoch: 18, train_loss: 1.0469, test_loss: 1.0018, test_f1: 0.4948
 epoch: 19, train_loss: 1.0384, test_loss: 0.9921, test_f1: 0.4951
 epoch: 20, train_loss: 1.0183, test_loss: 0.9810, test_f1: 0.5006
 epoch: 21, train_loss: 1.0094, test_loss: 0.9841, test_f1: 0.4823
 epoch: 22, train_loss: 0.9969, test_loss: 0.9606, test_f1: 0.4958
 epoch: 23, train_loss: 0.9889, test_loss: 0.9586, test_f1: 0.5000
 epoch: 24, train_loss: 0.9683, test_loss: 0.9539, test_f1: 0.4939
 epoch: 25, train_loss: 0.9605, test_loss: 0.9445, test_f1: 0.4975
 epoch: 26, train_loss: 0.9514, test_loss: 0.9425, test_f1: 0.4920
 epoch: 27, train_loss: 0.9413, test_loss: 0.9388, test_f1: 0.5054
 epoch: 28, train_loss: 0.9281, test_loss: 0.9312, test_f1: 0.4850
 epoch: 29, train_loss: 0.9202, test_loss: 0.9295, test_f1: 0.4954
 epoch: 30, train_loss: 0.9066, test_loss: 0.9312, test_f1: 0.4937
 epoch: 31, train_loss: 0.9070, test_loss: 0.9185, test_f1: 0.4951
 epoch: 32, train_loss: 0.8979, test_loss: 0.9108, test_f1: 0.4988
 epoch: 33, train_loss: 0.8763, test_loss: 0.9036, test_f1: 0.5115
 epoch: 34, train_loss: 0.8794, test_loss: 0.9280, test_f1: 0.4948
 epoch: 35, train_loss: 0.8616, test_loss: 0.9135, test_f1: 0.5105
 epoch: 36, train_loss: 0.8617, test_loss: 0.9241, test_f1: 0.5083
 epoch: 37, train_loss: 0.8558, test_loss: 0.9103, test_f1: 0.5178
 epoch: 38, train_loss: 0.8486, test_loss: 0.9152, test_f1: 0.5127
 epoch: 39, train_loss: 0.8376, test_loss: 0.9397, test_f1: 0.5178
 epoch: 40, train_loss: 0.8345, test_loss: 0.9275, test_f1: 0.5215
 epoch: 41, train_loss: 0.8364, test_loss: 0.9271, test_f1: 0.5265
 epoch: 42, train_loss: 0.8229, test_loss: 0.9243, test_f1: 0.5188
 epoch: 43, train_loss: 0.8191, test_loss: 0.9392, test_f1: 0.5135
 epoch: 44, train_loss: 0.8153, test_loss: 0.9165, test_f1: 0.5154
 epoch: 45, train_loss: 0.8192, test_loss: 0.9420, test_f1: 0.5269
 epoch: 46, train_loss: 0.8016, test_loss: 0.9385, test_f1: 0.5314
 epoch: 47, train_loss: 0.8093, test_loss: 0.9248, test_f1: 0.5321
 epoch: 48, train_loss: 0.7992, test_loss: 0.9630, test_f1: 0.5141
 epoch: 49, train_loss: 0.7935, test_loss: 0.9279, test_f1: 0.5295
 epoch: 50, train_loss: 0.7931, test_loss: 0.9686, test_f1: 0.5202
 epoch: 51, train_loss: 0.7889, test_loss: 0.9545, test_f1: 0.5206
 epoch: 52, train_loss: 0.7778, test_loss: 0.9523, test_f1: 0.5313
 epoch: 53, train_loss: 0.7764, test_loss: 0.9503, test_f1: 0.5311
 epoch: 54, train_loss: 0.7732, test_loss: 0.9517, test_f1: 0.5318
 epoch: 55, train_loss: 0.7698, test_loss: 0.9429, test_f1: 0.5301
 epoch: 56, train_loss: 0.7711, test_loss: 0.9504, test_f1: 0.5255
 epoch: 57, train_loss: 0.7695, test_loss: 0.9540, test_f1: 0.5338
 epoch: 58, train_loss: 0.7710, test_loss: 0.9630, test_f1: 0.5325
 epoch: 59, train_loss: 0.7725, test_loss: 0.9538, test_f1: 0.5355
 epoch: 60, train_loss: 0.7638, test_loss: 0.9665, test_f1: 0.5237
 epoch: 61, train_loss: 0.7605, test_loss: 0.9661, test_f1: 0.5353
 epoch: 62, train_loss: 0.7615, test_loss: 0.9642, test_f1: 0.5386
 epoch: 63, train_loss: 0.7602, test_loss: 0.9625, test_f1: 0.5277
 epoch: 64, train_loss: 0.7623, test_loss: 0.9625, test_f1: 0.5232
 epoch: 65, train_loss: 0.7595, test_loss: 0.9657, test_f1: 0.5317
 epoch: 66, train_loss: 0.7462, test_loss: 0.9486, test_f1: 0.5279
 epoch: 67, train_loss: 0.7409, test_loss: 0.9542, test_f1: 0.5270
 epoch: 68, train_loss: 0.7493, test_loss: 0.9599, test_f1: 0.5335
 epoch: 69, train_loss: 0.7576, test_loss: 0.9659, test_f1: 0.5388
 epoch: 70, train_loss: 0.7491, test_loss: 0.9488, test_f1: 0.5481
 epoch: 71, train_loss: 0.7442, test_loss: 0.9779, test_f1: 0.5442
 epoch: 72, train_loss: 0.7441, test_loss: 0.9399, test_f1: 0.5368
 epoch: 73, train_loss: 0.7448, test_loss: 0.9314, test_f1: 0.5457
 epoch: 74, train_loss: 0.7400, test_loss: 0.9520, test_f1: 0.5441
 epoch: 75, train_loss: 0.7343, test_loss: 0.9567, test_f1: 0.5432
 epoch: 76, train_loss: 0.7428, test_loss: 0.9774, test_f1: 0.5417
 epoch: 77, train_loss: 0.7373, test_loss: 0.9737, test_f1: 0.5415
 epoch: 78, train_loss: 0.7319, test_loss: 0.9690, test_f1: 0.5453
 epoch: 79, train_loss: 0.7242, test_loss: 0.9810, test_f1: 0.5451
 epoch: 80, train_loss: 0.7286, test_loss: 0.9628, test_f1: 0.5504
 epoch: 81, train_loss: 0.7233, test_loss: 0.9736, test_f1: 0.5490
 epoch: 82, train_loss: 0.7281, test_loss: 0.9619, test_f1: 0.5529
 epoch: 83, train_loss: 0.7182, test_loss: 0.9620, test_f1: 0.5521
 epoch: 84, train_loss: 0.7293, test_loss: 0.9770, test_f1: 0.5623
 epoch: 85, train_loss: 0.7201, test_loss: 0.9731, test_f1: 0.5606
 epoch: 86, train_loss: 0.7189, test_loss: 0.9639, test_f1: 0.5597
 epoch: 87, train_loss: 0.7211, test_loss: 0.9978, test_f1: 0.5537
 epoch: 88, train_loss: 0.7277, test_loss: 0.9866, test_f1: 0.5561
 epoch: 89, train_loss: 0.7176, test_loss: 0.9822, test_f1: 0.5625
 epoch: 90, train_loss: 0.7252, test_loss: 0.9573, test_f1: 0.5637
 epoch: 91, train_loss: 0.7111, test_loss: 0.9301, test_f1: 0.5635
 epoch: 92, train_loss: 0.7062, test_loss: 0.9489, test_f1: 0.5550
 epoch: 93, train_loss: 0.7004, test_loss: 0.9406, test_f1: 0.5531
 epoch: 94, train_loss: 0.7093, test_loss: 0.9503, test_f1: 0.5593
 epoch: 95, train_loss: 0.7090, test_loss: 0.9942, test_f1: 0.5533
 epoch: 96, train_loss: 0.7169, test_loss: 0.9804, test_f1: 0.5607
 epoch: 97, train_loss: 0.7088, test_loss: 0.9562, test_f1: 0.5654
 epoch: 98, train_loss: 0.7062, test_loss: 0.9551, test_f1: 0.5622
 epoch: 99, train_loss: 0.6984, test_loss: 0.9538, test_f1: 0.5610
##################ITERATION #2 ****************************************
 epoch: 0, train_loss: 1.3068, test_loss: 1.3563, test_f1: 0.2270
 epoch: 1, train_loss: 1.2661, test_loss: 1.3221, test_f1: 0.2270
 epoch: 2, train_loss: 1.2454, test_loss: 1.2933, test_f1: 0.2270
 epoch: 3, train_loss: 1.2284, test_loss: 1.2774, test_f1: 0.2267
 epoch: 4, train_loss: 1.2103, test_loss: 1.2325, test_f1: 0.3353
 epoch: 5, train_loss: 1.1924, test_loss: 1.1922, test_f1: 0.3926
 epoch: 6, train_loss: 1.1765, test_loss: 1.1535, test_f1: 0.4237
 epoch: 7, train_loss: 1.1573, test_loss: 1.1276, test_f1: 0.4323
 epoch: 8, train_loss: 1.1402, test_loss: 1.1074, test_f1: 0.4421
 epoch: 9, train_loss: 1.1199, test_loss: 1.0888, test_f1: 0.4515
 epoch: 10, train_loss: 1.1031, test_loss: 1.0668, test_f1: 0.4520
 epoch: 11, train_loss: 1.0869, test_loss: 1.0495, test_f1: 0.4538
 epoch: 12, train_loss: 1.0737, test_loss: 1.0305, test_f1: 0.4709
 epoch: 13, train_loss: 1.0542, test_loss: 1.0212, test_f1: 0.4568
 epoch: 14, train_loss: 1.0466, test_loss: 1.0043, test_f1: 0.4666
 epoch: 15, train_loss: 1.0278, test_loss: 0.9977, test_f1: 0.4562
 epoch: 16, train_loss: 1.0154, test_loss: 0.9867, test_f1: 0.4606
 epoch: 17, train_loss: 1.0065, test_loss: 0.9727, test_f1: 0.4761
 epoch: 18, train_loss: 0.9908, test_loss: 0.9619, test_f1: 0.4841
 epoch: 19, train_loss: 0.9844, test_loss: 0.9564, test_f1: 0.5002
 epoch: 20, train_loss: 0.9751, test_loss: 0.9505, test_f1: 0.4891
 epoch: 21, train_loss: 0.9592, test_loss: 0.9429, test_f1: 0.4958
 epoch: 22, train_loss: 0.9530, test_loss: 0.9370, test_f1: 0.4900
 epoch: 23, train_loss: 0.9527, test_loss: 0.9300, test_f1: 0.4983
 epoch: 24, train_loss: 0.9363, test_loss: 0.9337, test_f1: 0.4947
 epoch: 25, train_loss: 0.9311, test_loss: 0.9358, test_f1: 0.4977
 epoch: 26, train_loss: 0.9278, test_loss: 0.9332, test_f1: 0.4928
 epoch: 27, train_loss: 0.9160, test_loss: 0.9311, test_f1: 0.4976
 epoch: 28, train_loss: 0.9103, test_loss: 0.9346, test_f1: 0.4989
 epoch: 29, train_loss: 0.9040, test_loss: 0.9262, test_f1: 0.4919
 epoch: 30, train_loss: 0.9052, test_loss: 0.9248, test_f1: 0.5072
 epoch: 31, train_loss: 0.9001, test_loss: 0.9376, test_f1: 0.5054
 epoch: 32, train_loss: 0.8811, test_loss: 0.9262, test_f1: 0.5059
 epoch: 33, train_loss: 0.8789, test_loss: 0.9313, test_f1: 0.5026
 epoch: 34, train_loss: 0.8740, test_loss: 0.9193, test_f1: 0.5110
 epoch: 35, train_loss: 0.8693, test_loss: 0.9280, test_f1: 0.5035
 epoch: 36, train_loss: 0.8691, test_loss: 0.9145, test_f1: 0.5028
 epoch: 37, train_loss: 0.8611, test_loss: 0.9367, test_f1: 0.5128
 epoch: 38, train_loss: 0.8626, test_loss: 0.9344, test_f1: 0.5062
 epoch: 39, train_loss: 0.8541, test_loss: 0.9288, test_f1: 0.5182
 epoch: 40, train_loss: 0.8545, test_loss: 0.9486, test_f1: 0.5123
 epoch: 41, train_loss: 0.8485, test_loss: 0.9394, test_f1: 0.5172
 epoch: 42, train_loss: 0.8561, test_loss: 0.9220, test_f1: 0.5208
 epoch: 43, train_loss: 0.8316, test_loss: 0.9159, test_f1: 0.5137
 epoch: 44, train_loss: 0.8283, test_loss: 0.9243, test_f1: 0.5166
 epoch: 45, train_loss: 0.8338, test_loss: 0.9500, test_f1: 0.5137
 epoch: 46, train_loss: 0.8297, test_loss: 0.9256, test_f1: 0.5142
 epoch: 47, train_loss: 0.8239, test_loss: 0.9232, test_f1: 0.5123
 epoch: 48, train_loss: 0.8167, test_loss: 0.9428, test_f1: 0.5007
 epoch: 49, train_loss: 0.8107, test_loss: 0.9348, test_f1: 0.5131
 epoch: 50, train_loss: 0.8026, test_loss: 0.9508, test_f1: 0.5086
 epoch: 51, train_loss: 0.8009, test_loss: 0.9374, test_f1: 0.5105
 epoch: 52, train_loss: 0.7940, test_loss: 0.9387, test_f1: 0.5136
 epoch: 53, train_loss: 0.8037, test_loss: 0.9379, test_f1: 0.5160
 epoch: 54, train_loss: 0.8037, test_loss: 0.9418, test_f1: 0.5201
 epoch: 55, train_loss: 0.7991, test_loss: 0.9413, test_f1: 0.5144
 epoch: 56, train_loss: 0.7910, test_loss: 0.9388, test_f1: 0.5069
 epoch: 57, train_loss: 0.7938, test_loss: 0.9421, test_f1: 0.5220
 epoch: 58, train_loss: 0.7893, test_loss: 0.9402, test_f1: 0.5166
 epoch: 59, train_loss: 0.7846, test_loss: 0.9476, test_f1: 0.5155
 epoch: 60, train_loss: 0.7829, test_loss: 0.9319, test_f1: 0.5241
 epoch: 61, train_loss: 0.7886, test_loss: 0.9481, test_f1: 0.5079
 epoch: 62, train_loss: 0.7813, test_loss: 0.9525, test_f1: 0.5222
 epoch: 63, train_loss: 0.7816, test_loss: 0.9489, test_f1: 0.5248
 epoch: 64, train_loss: 0.7774, test_loss: 0.9541, test_f1: 0.5125
 epoch: 65, train_loss: 0.7765, test_loss: 0.9516, test_f1: 0.5092
 epoch: 66, train_loss: 0.7754, test_loss: 0.9607, test_f1: 0.5182
 epoch: 67, train_loss: 0.7703, test_loss: 0.9463, test_f1: 0.5183
 epoch: 68, train_loss: 0.7662, test_loss: 0.9462, test_f1: 0.5085
 epoch: 69, train_loss: 0.7752, test_loss: 0.9493, test_f1: 0.5158
 epoch: 70, train_loss: 0.7669, test_loss: 0.9494, test_f1: 0.5180
 epoch: 71, train_loss: 0.7608, test_loss: 0.9508, test_f1: 0.5222
 epoch: 72, train_loss: 0.7692, test_loss: 0.9390, test_f1: 0.5356
 epoch: 73, train_loss: 0.7619, test_loss: 0.9543, test_f1: 0.5450
 epoch: 74, train_loss: 0.7674, test_loss: 0.9477, test_f1: 0.5250
 epoch: 75, train_loss: 0.7506, test_loss: 0.9607, test_f1: 0.5228
 epoch: 76, train_loss: 0.7550, test_loss: 0.9513, test_f1: 0.5248
 epoch: 77, train_loss: 0.7556, test_loss: 0.9517, test_f1: 0.5324
 epoch: 78, train_loss: 0.7476, test_loss: 0.9642, test_f1: 0.5233
 epoch: 79, train_loss: 0.7540, test_loss: 0.9545, test_f1: 0.5313
 epoch: 80, train_loss: 0.7503, test_loss: 0.9646, test_f1: 0.5237
 epoch: 81, train_loss: 0.7466, test_loss: 0.9537, test_f1: 0.5361
 epoch: 82, train_loss: 0.7465, test_loss: 0.9663, test_f1: 0.5278
 epoch: 83, train_loss: 0.7458, test_loss: 0.9589, test_f1: 0.5323
 epoch: 84, train_loss: 0.7476, test_loss: 0.9602, test_f1: 0.5319
 epoch: 85, train_loss: 0.7408, test_loss: 0.9655, test_f1: 0.5292
 epoch: 86, train_loss: 0.7398, test_loss: 0.9520, test_f1: 0.5302
 epoch: 87, train_loss: 0.7339, test_loss: 0.9639, test_f1: 0.5329
 epoch: 88, train_loss: 0.7376, test_loss: 0.9621, test_f1: 0.5368
 epoch: 89, train_loss: 0.7349, test_loss: 0.9748, test_f1: 0.5308
 epoch: 90, train_loss: 0.7427, test_loss: 0.9746, test_f1: 0.5384
 epoch: 91, train_loss: 0.7340, test_loss: 0.9909, test_f1: 0.5296
 epoch: 92, train_loss: 0.7385, test_loss: 0.9784, test_f1: 0.5324
 epoch: 93, train_loss: 0.7340, test_loss: 0.9761, test_f1: 0.5328
 epoch: 94, train_loss: 0.7316, test_loss: 0.9706, test_f1: 0.5263
 epoch: 95, train_loss: 0.7403, test_loss: 0.9751, test_f1: 0.5353
 epoch: 96, train_loss: 0.7274, test_loss: 0.9862, test_f1: 0.5280
 epoch: 97, train_loss: 0.7278, test_loss: 0.9720, test_f1: 0.5318
 epoch: 98, train_loss: 0.7253, test_loss: 0.9673, test_f1: 0.5376
 epoch: 99, train_loss: 0.7257, test_loss: 0.9606, test_f1: 0.5524
##################ITERATION #3 ****************************************
 epoch: 0, train_loss: 1.3294, test_loss: 1.3911, test_f1: 0.0304
 epoch: 1, train_loss: 1.2800, test_loss: 1.3766, test_f1: 0.2313
 epoch: 2, train_loss: 1.2558, test_loss: 1.3217, test_f1: 0.3207
 epoch: 3, train_loss: 1.2318, test_loss: 1.2631, test_f1: 0.3234
 epoch: 4, train_loss: 1.2169, test_loss: 1.2180, test_f1: 0.3627
 epoch: 5, train_loss: 1.1958, test_loss: 1.1826, test_f1: 0.3891
 epoch: 6, train_loss: 1.1771, test_loss: 1.1455, test_f1: 0.4131
 epoch: 7, train_loss: 1.1552, test_loss: 1.1160, test_f1: 0.4460
 epoch: 8, train_loss: 1.1449, test_loss: 1.0939, test_f1: 0.4670
 epoch: 9, train_loss: 1.1252, test_loss: 1.0790, test_f1: 0.4575
 epoch: 10, train_loss: 1.1096, test_loss: 1.0638, test_f1: 0.4649
 epoch: 11, train_loss: 1.0914, test_loss: 1.0532, test_f1: 0.4544
 epoch: 12, train_loss: 1.0763, test_loss: 1.0301, test_f1: 0.4636
 epoch: 13, train_loss: 1.0593, test_loss: 1.0185, test_f1: 0.4687
 epoch: 14, train_loss: 1.0515, test_loss: 1.0087, test_f1: 0.4723
 epoch: 15, train_loss: 1.0354, test_loss: 1.0004, test_f1: 0.4735
 epoch: 16, train_loss: 1.0210, test_loss: 0.9879, test_f1: 0.4815
 epoch: 17, train_loss: 1.0152, test_loss: 0.9841, test_f1: 0.4826
 epoch: 18, train_loss: 1.0155, test_loss: 0.9856, test_f1: 0.4755
 epoch: 19, train_loss: 0.9912, test_loss: 0.9746, test_f1: 0.4991
 epoch: 20, train_loss: 0.9769, test_loss: 0.9655, test_f1: 0.4979
 epoch: 21, train_loss: 0.9811, test_loss: 0.9640, test_f1: 0.5057
 epoch: 22, train_loss: 0.9714, test_loss: 0.9631, test_f1: 0.5019
 epoch: 23, train_loss: 0.9612, test_loss: 0.9424, test_f1: 0.5067
 epoch: 24, train_loss: 0.9517, test_loss: 0.9559, test_f1: 0.5016
 epoch: 25, train_loss: 0.9471, test_loss: 0.9519, test_f1: 0.5061
 epoch: 26, train_loss: 0.9324, test_loss: 0.9614, test_f1: 0.4986
 epoch: 27, train_loss: 0.9297, test_loss: 0.9438, test_f1: 0.5066
 epoch: 28, train_loss: 0.9210, test_loss: 0.9300, test_f1: 0.5026
 epoch: 29, train_loss: 0.9114, test_loss: 0.9455, test_f1: 0.5050
 epoch: 30, train_loss: 0.9067, test_loss: 0.9397, test_f1: 0.5084
 epoch: 31, train_loss: 0.9042, test_loss: 0.9483, test_f1: 0.5041
 epoch: 32, train_loss: 0.8931, test_loss: 0.9425, test_f1: 0.4978
 epoch: 33, train_loss: 0.8871, test_loss: 0.9414, test_f1: 0.5162
 epoch: 34, train_loss: 0.8849, test_loss: 0.9479, test_f1: 0.5082
 epoch: 35, train_loss: 0.8946, test_loss: 0.9307, test_f1: 0.5154
 epoch: 36, train_loss: 0.8783, test_loss: 0.9347, test_f1: 0.5030
 epoch: 37, train_loss: 0.8689, test_loss: 0.9566, test_f1: 0.4971
 epoch: 38, train_loss: 0.8793, test_loss: 0.9317, test_f1: 0.5057
 epoch: 39, train_loss: 0.8613, test_loss: 0.9383, test_f1: 0.5121
 epoch: 40, train_loss: 0.8651, test_loss: 0.9363, test_f1: 0.5179
 epoch: 41, train_loss: 0.8523, test_loss: 0.9396, test_f1: 0.5092
 epoch: 42, train_loss: 0.8465, test_loss: 0.9501, test_f1: 0.5072
 epoch: 43, train_loss: 0.8461, test_loss: 0.9485, test_f1: 0.5095
 epoch: 44, train_loss: 0.8349, test_loss: 0.9434, test_f1: 0.5078
 epoch: 45, train_loss: 0.8401, test_loss: 0.9533, test_f1: 0.5096
 epoch: 46, train_loss: 0.8336, test_loss: 0.9573, test_f1: 0.5024
 epoch: 47, train_loss: 0.8300, test_loss: 0.9437, test_f1: 0.5179
 epoch: 48, train_loss: 0.8267, test_loss: 0.9505, test_f1: 0.5071
 epoch: 49, train_loss: 0.8199, test_loss: 0.9482, test_f1: 0.5116
 epoch: 50, train_loss: 0.8100, test_loss: 0.9476, test_f1: 0.5129
 epoch: 51, train_loss: 0.8176, test_loss: 0.9541, test_f1: 0.5135
 epoch: 52, train_loss: 0.8081, test_loss: 0.9571, test_f1: 0.5171
 epoch: 53, train_loss: 0.8033, test_loss: 0.9500, test_f1: 0.5167
 epoch: 54, train_loss: 0.8141, test_loss: 0.9459, test_f1: 0.5165
 epoch: 55, train_loss: 0.7983, test_loss: 0.9453, test_f1: 0.5152
 epoch: 56, train_loss: 0.8038, test_loss: 0.9438, test_f1: 0.5107
 epoch: 57, train_loss: 0.8076, test_loss: 0.9591, test_f1: 0.5227
 epoch: 58, train_loss: 0.8011, test_loss: 0.9585, test_f1: 0.5235
 epoch: 59, train_loss: 0.8015, test_loss: 0.9679, test_f1: 0.5012
 epoch: 60, train_loss: 0.8005, test_loss: 0.9651, test_f1: 0.5206
 epoch: 61, train_loss: 0.7935, test_loss: 0.9668, test_f1: 0.5137
 epoch: 62, train_loss: 0.7869, test_loss: 0.9708, test_f1: 0.5072
 epoch: 63, train_loss: 0.7867, test_loss: 0.9573, test_f1: 0.5104
 epoch: 64, train_loss: 0.7883, test_loss: 0.9636, test_f1: 0.5256
 epoch: 65, train_loss: 0.7763, test_loss: 0.9727, test_f1: 0.5178
 epoch: 66, train_loss: 0.7838, test_loss: 0.9713, test_f1: 0.5259
 epoch: 67, train_loss: 0.7836, test_loss: 0.9755, test_f1: 0.5237
 epoch: 68, train_loss: 0.7873, test_loss: 0.9747, test_f1: 0.5242
 epoch: 69, train_loss: 0.7815, test_loss: 0.9745, test_f1: 0.5250
 epoch: 70, train_loss: 0.7735, test_loss: 0.9757, test_f1: 0.5314
 epoch: 71, train_loss: 0.7771, test_loss: 0.9827, test_f1: 0.5322
 epoch: 72, train_loss: 0.7671, test_loss: 0.9877, test_f1: 0.5222
 epoch: 73, train_loss: 0.7761, test_loss: 0.9987, test_f1: 0.5162
 epoch: 74, train_loss: 0.7770, test_loss: 0.9849, test_f1: 0.5172
 epoch: 75, train_loss: 0.7720, test_loss: 0.9857, test_f1: 0.5374
 epoch: 76, train_loss: 0.7693, test_loss: 0.9908, test_f1: 0.5301
 epoch: 77, train_loss: 0.7640, test_loss: 0.9821, test_f1: 0.5252
 epoch: 78, train_loss: 0.7595, test_loss: 0.9796, test_f1: 0.5314
 epoch: 79, train_loss: 0.7712, test_loss: 0.9855, test_f1: 0.5330
 epoch: 80, train_loss: 0.7642, test_loss: 0.9854, test_f1: 0.5351
 epoch: 81, train_loss: 0.7640, test_loss: 0.9837, test_f1: 0.5421
 epoch: 82, train_loss: 0.7470, test_loss: 0.9805, test_f1: 0.5371
 epoch: 83, train_loss: 0.7542, test_loss: 0.9878, test_f1: 0.5425
 epoch: 84, train_loss: 0.7456, test_loss: 0.9930, test_f1: 0.5361
 epoch: 85, train_loss: 0.7567, test_loss: 0.9794, test_f1: 0.5531
 epoch: 86, train_loss: 0.7600, test_loss: 1.0018, test_f1: 0.5379
 epoch: 87, train_loss: 0.7534, test_loss: 0.9806, test_f1: 0.5468
 epoch: 88, train_loss: 0.7610, test_loss: 0.9826, test_f1: 0.5554
 epoch: 89, train_loss: 0.7502, test_loss: 0.9856, test_f1: 0.5578
 epoch: 90, train_loss: 0.7496, test_loss: 0.9738, test_f1: 0.5556
 epoch: 91, train_loss: 0.7502, test_loss: 0.9828, test_f1: 0.5541
 epoch: 92, train_loss: 0.7450, test_loss: 0.9886, test_f1: 0.5609
 epoch: 93, train_loss: 0.7497, test_loss: 0.9930, test_f1: 0.5510
 epoch: 94, train_loss: 0.7367, test_loss: 1.0024, test_f1: 0.5537
 epoch: 95, train_loss: 0.7390, test_loss: 0.9894, test_f1: 0.5554
 epoch: 96, train_loss: 0.7514, test_loss: 0.9905, test_f1: 0.5610
 epoch: 97, train_loss: 0.7475, test_loss: 0.9977, test_f1: 0.5467
 epoch: 98, train_loss: 0.7344, test_loss: 1.0108, test_f1: 0.5524
 epoch: 99, train_loss: 0.7329, test_loss: 0.9940, test_f1: 0.5658
##################ITERATION #4 ****************************************
 epoch: 0, train_loss: 1.2932, test_loss: 1.3870, test_f1: 0.1473
 epoch: 1, train_loss: 1.2331, test_loss: 1.3659, test_f1: 0.2705
 epoch: 2, train_loss: 1.2053, test_loss: 1.3253, test_f1: 0.3363
 epoch: 3, train_loss: 1.1786, test_loss: 1.2442, test_f1: 0.4017
 epoch: 4, train_loss: 1.1649, test_loss: 1.1632, test_f1: 0.4258
 epoch: 5, train_loss: 1.1364, test_loss: 1.1143, test_f1: 0.4464
 epoch: 6, train_loss: 1.1147, test_loss: 1.0856, test_f1: 0.4493
 epoch: 7, train_loss: 1.1030, test_loss: 1.0538, test_f1: 0.4718
 epoch: 8, train_loss: 1.0879, test_loss: 1.0377, test_f1: 0.4683
 epoch: 9, train_loss: 1.0767, test_loss: 1.0168, test_f1: 0.4788
 epoch: 10, train_loss: 1.0598, test_loss: 1.0031, test_f1: 0.4753
 epoch: 11, train_loss: 1.0494, test_loss: 1.0001, test_f1: 0.4736
 epoch: 12, train_loss: 1.0390, test_loss: 0.9937, test_f1: 0.4627
 epoch: 13, train_loss: 1.0264, test_loss: 0.9780, test_f1: 0.4704
 epoch: 14, train_loss: 1.0145, test_loss: 0.9790, test_f1: 0.4709
 epoch: 15, train_loss: 1.0047, test_loss: 0.9731, test_f1: 0.4770
 epoch: 16, train_loss: 0.9914, test_loss: 0.9627, test_f1: 0.4785
 epoch: 17, train_loss: 0.9835, test_loss: 0.9460, test_f1: 0.5008
 epoch: 18, train_loss: 0.9799, test_loss: 0.9544, test_f1: 0.4898
 epoch: 19, train_loss: 0.9661, test_loss: 0.9457, test_f1: 0.4967
 epoch: 20, train_loss: 0.9657, test_loss: 0.9426, test_f1: 0.4983
 epoch: 21, train_loss: 0.9598, test_loss: 0.9499, test_f1: 0.4929
 epoch: 22, train_loss: 0.9437, test_loss: 0.9573, test_f1: 0.4712
 epoch: 23, train_loss: 0.9415, test_loss: 0.9465, test_f1: 0.5098
 epoch: 24, train_loss: 0.9245, test_loss: 0.9391, test_f1: 0.5168
 epoch: 25, train_loss: 0.9280, test_loss: 0.9373, test_f1: 0.5022
 epoch: 26, train_loss: 0.9245, test_loss: 0.9413, test_f1: 0.5056
 epoch: 27, train_loss: 0.9181, test_loss: 0.9435, test_f1: 0.5191
 epoch: 28, train_loss: 0.9105, test_loss: 0.9346, test_f1: 0.5027
 epoch: 29, train_loss: 0.9120, test_loss: 0.9363, test_f1: 0.5176
 epoch: 30, train_loss: 0.9013, test_loss: 0.9164, test_f1: 0.5222
 epoch: 31, train_loss: 0.8855, test_loss: 0.9530, test_f1: 0.5023
 epoch: 32, train_loss: 0.8990, test_loss: 0.9624, test_f1: 0.4979
 epoch: 33, train_loss: 0.8835, test_loss: 0.9251, test_f1: 0.5273
 epoch: 34, train_loss: 0.8763, test_loss: 0.9212, test_f1: 0.5205
 epoch: 35, train_loss: 0.8711, test_loss: 0.9357, test_f1: 0.5291
 epoch: 36, train_loss: 0.8591, test_loss: 0.9194, test_f1: 0.5245
 epoch: 37, train_loss: 0.8567, test_loss: 0.9183, test_f1: 0.5443
 epoch: 38, train_loss: 0.8569, test_loss: 0.9337, test_f1: 0.5229
 epoch: 39, train_loss: 0.8523, test_loss: 0.9118, test_f1: 0.5257
 epoch: 40, train_loss: 0.8553, test_loss: 0.9318, test_f1: 0.5302
 epoch: 41, train_loss: 0.8551, test_loss: 0.9402, test_f1: 0.5143
 epoch: 42, train_loss: 0.8365, test_loss: 0.9189, test_f1: 0.5195
 epoch: 43, train_loss: 0.8350, test_loss: 0.9150, test_f1: 0.5340
 epoch: 44, train_loss: 0.8308, test_loss: 0.9295, test_f1: 0.5194
 epoch: 45, train_loss: 0.8365, test_loss: 0.9333, test_f1: 0.5222
 epoch: 46, train_loss: 0.8292, test_loss: 0.9196, test_f1: 0.5389
 epoch: 47, train_loss: 0.8377, test_loss: 0.9374, test_f1: 0.5071
 epoch: 48, train_loss: 0.8191, test_loss: 0.9258, test_f1: 0.5234
 epoch: 49, train_loss: 0.8181, test_loss: 0.9195, test_f1: 0.5209
 epoch: 50, train_loss: 0.8215, test_loss: 0.9248, test_f1: 0.5300
 epoch: 51, train_loss: 0.8135, test_loss: 0.9297, test_f1: 0.5181
 epoch: 52, train_loss: 0.8072, test_loss: 0.9232, test_f1: 0.5313
 epoch: 53, train_loss: 0.8131, test_loss: 0.9168, test_f1: 0.5150
 epoch: 54, train_loss: 0.7978, test_loss: 0.9165, test_f1: 0.5371
 epoch: 55, train_loss: 0.7998, test_loss: 0.9213, test_f1: 0.5351
 epoch: 56, train_loss: 0.8018, test_loss: 0.9249, test_f1: 0.5315
 epoch: 57, train_loss: 0.7986, test_loss: 0.9284, test_f1: 0.5386
 epoch: 58, train_loss: 0.8019, test_loss: 0.9296, test_f1: 0.5318
 epoch: 59, train_loss: 0.7937, test_loss: 0.9288, test_f1: 0.5300
 epoch: 60, train_loss: 0.7916, test_loss: 0.9202, test_f1: 0.5275
 epoch: 61, train_loss: 0.7824, test_loss: 0.9194, test_f1: 0.5261
 epoch: 62, train_loss: 0.7907, test_loss: 0.9319, test_f1: 0.5261
 epoch: 63, train_loss: 0.7870, test_loss: 0.9311, test_f1: 0.5220
 epoch: 64, train_loss: 0.7847, test_loss: 0.9191, test_f1: 0.5276
 epoch: 65, train_loss: 0.7834, test_loss: 0.9277, test_f1: 0.5376
 epoch: 66, train_loss: 0.7753, test_loss: 0.9396, test_f1: 0.5312
 epoch: 67, train_loss: 0.7810, test_loss: 0.9274, test_f1: 0.5452
 epoch: 68, train_loss: 0.7698, test_loss: 0.9317, test_f1: 0.5473
 epoch: 69, train_loss: 0.7841, test_loss: 0.9267, test_f1: 0.5363
 epoch: 70, train_loss: 0.7778, test_loss: 0.9242, test_f1: 0.5396
 epoch: 71, train_loss: 0.7712, test_loss: 0.9292, test_f1: 0.5397
 epoch: 72, train_loss: 0.7690, test_loss: 0.9216, test_f1: 0.5387
 epoch: 73, train_loss: 0.7707, test_loss: 0.9407, test_f1: 0.5389
 epoch: 74, train_loss: 0.7609, test_loss: 0.9301, test_f1: 0.5293
 epoch: 75, train_loss: 0.7641, test_loss: 0.9314, test_f1: 0.5323
 epoch: 76, train_loss: 0.7637, test_loss: 0.9275, test_f1: 0.5390
 epoch: 77, train_loss: 0.7553, test_loss: 0.9185, test_f1: 0.5406
 epoch: 78, train_loss: 0.7717, test_loss: 0.9240, test_f1: 0.5287
 epoch: 79, train_loss: 0.7648, test_loss: 0.9285, test_f1: 0.5380
 epoch: 80, train_loss: 0.7627, test_loss: 0.9294, test_f1: 0.5310
 epoch: 81, train_loss: 0.7682, test_loss: 0.9281, test_f1: 0.5259
 epoch: 82, train_loss: 0.7647, test_loss: 0.9208, test_f1: 0.5404
 epoch: 83, train_loss: 0.7615, test_loss: 0.9203, test_f1: 0.5406
 epoch: 84, train_loss: 0.7564, test_loss: 0.9117, test_f1: 0.5363
 epoch: 85, train_loss: 0.7581, test_loss: 0.9157, test_f1: 0.5461
 epoch: 86, train_loss: 0.7504, test_loss: 0.9268, test_f1: 0.5337
 epoch: 87, train_loss: 0.7472, test_loss: 0.9293, test_f1: 0.5447
 epoch: 88, train_loss: 0.7496, test_loss: 0.9404, test_f1: 0.5445
 epoch: 89, train_loss: 0.7465, test_loss: 0.9258, test_f1: 0.5530
 epoch: 90, train_loss: 0.7606, test_loss: 0.9265, test_f1: 0.5508
 epoch: 91, train_loss: 0.7386, test_loss: 0.9260, test_f1: 0.5548
 epoch: 92, train_loss: 0.7353, test_loss: 0.9305, test_f1: 0.5468
 epoch: 93, train_loss: 0.7468, test_loss: 0.9289, test_f1: 0.5525
 epoch: 94, train_loss: 0.7508, test_loss: 0.9353, test_f1: 0.5568
 epoch: 95, train_loss: 0.7533, test_loss: 0.9389, test_f1: 0.5459
 epoch: 96, train_loss: 0.7368, test_loss: 0.9412, test_f1: 0.5572
 epoch: 97, train_loss: 0.7467, test_loss: 0.9220, test_f1: 0.5485
 epoch: 98, train_loss: 0.7394, test_loss: 0.9212, test_f1: 0.5612
 epoch: 99, train_loss: 0.7438, test_loss: 0.9420, test_f1: 0.5577
##################ITERATION #5 ****************************************
 epoch: 0, train_loss: 1.2815, test_loss: 1.3377, test_f1: 0.2270
 epoch: 1, train_loss: 1.2046, test_loss: 1.3127, test_f1: 0.2320
 epoch: 2, train_loss: 1.1742, test_loss: 1.2453, test_f1: 0.2887
 epoch: 3, train_loss: 1.1544, test_loss: 1.1873, test_f1: 0.3555
 epoch: 4, train_loss: 1.1311, test_loss: 1.1356, test_f1: 0.4200
 epoch: 5, train_loss: 1.1126, test_loss: 1.0900, test_f1: 0.4620
 epoch: 6, train_loss: 1.0914, test_loss: 1.0538, test_f1: 0.4628
 epoch: 7, train_loss: 1.0835, test_loss: 1.0345, test_f1: 0.4751
 epoch: 8, train_loss: 1.0703, test_loss: 1.0197, test_f1: 0.4838
 epoch: 9, train_loss: 1.0525, test_loss: 1.0002, test_f1: 0.4865
 epoch: 10, train_loss: 1.0372, test_loss: 0.9954, test_f1: 0.4927
 epoch: 11, train_loss: 1.0264, test_loss: 0.9823, test_f1: 0.5019
 epoch: 12, train_loss: 1.0104, test_loss: 0.9725, test_f1: 0.5227
 epoch: 13, train_loss: 1.0072, test_loss: 0.9658, test_f1: 0.5251
 epoch: 14, train_loss: 1.0013, test_loss: 0.9598, test_f1: 0.5263
 epoch: 15, train_loss: 0.9819, test_loss: 0.9540, test_f1: 0.5227
 epoch: 16, train_loss: 0.9790, test_loss: 0.9422, test_f1: 0.5263
 epoch: 17, train_loss: 0.9640, test_loss: 0.9379, test_f1: 0.5292
 epoch: 18, train_loss: 0.9645, test_loss: 0.9350, test_f1: 0.5256
 epoch: 19, train_loss: 0.9427, test_loss: 0.9250, test_f1: 0.5369
 epoch: 20, train_loss: 0.9384, test_loss: 0.9332, test_f1: 0.5309
 epoch: 21, train_loss: 0.9288, test_loss: 0.9270, test_f1: 0.5397
 epoch: 22, train_loss: 0.9279, test_loss: 0.9198, test_f1: 0.5374
 epoch: 23, train_loss: 0.9251, test_loss: 0.9198, test_f1: 0.5389
 epoch: 24, train_loss: 0.9212, test_loss: 0.9200, test_f1: 0.5427
 epoch: 25, train_loss: 0.9102, test_loss: 0.9268, test_f1: 0.5333
 epoch: 26, train_loss: 0.9096, test_loss: 0.9213, test_f1: 0.5386
 epoch: 27, train_loss: 0.9009, test_loss: 0.9199, test_f1: 0.5325
 epoch: 28, train_loss: 0.8971, test_loss: 0.9240, test_f1: 0.5405
 epoch: 29, train_loss: 0.8834, test_loss: 0.9175, test_f1: 0.5391
 epoch: 30, train_loss: 0.8840, test_loss: 0.9202, test_f1: 0.5330
 epoch: 31, train_loss: 0.8838, test_loss: 0.9127, test_f1: 0.5383
 epoch: 32, train_loss: 0.8716, test_loss: 0.9095, test_f1: 0.5357
 epoch: 33, train_loss: 0.8660, test_loss: 0.9096, test_f1: 0.5506
 epoch: 34, train_loss: 0.8646, test_loss: 0.9154, test_f1: 0.5477
 epoch: 35, train_loss: 0.8690, test_loss: 0.9171, test_f1: 0.5469
 epoch: 36, train_loss: 0.8670, test_loss: 0.9156, test_f1: 0.5449
 epoch: 37, train_loss: 0.8496, test_loss: 0.9103, test_f1: 0.5477
 epoch: 38, train_loss: 0.8492, test_loss: 0.9036, test_f1: 0.5581
 epoch: 39, train_loss: 0.8468, test_loss: 0.9076, test_f1: 0.5529
 epoch: 40, train_loss: 0.8405, test_loss: 0.9048, test_f1: 0.5534
 epoch: 41, train_loss: 0.8343, test_loss: 0.9065, test_f1: 0.5607
 epoch: 42, train_loss: 0.8257, test_loss: 0.9187, test_f1: 0.5479
 epoch: 43, train_loss: 0.8270, test_loss: 0.9137, test_f1: 0.5606
 epoch: 44, train_loss: 0.8271, test_loss: 0.9131, test_f1: 0.5558
 epoch: 45, train_loss: 0.8226, test_loss: 0.9095, test_f1: 0.5532
 epoch: 46, train_loss: 0.8192, test_loss: 0.9113, test_f1: 0.5554
 epoch: 47, train_loss: 0.8020, test_loss: 0.9110, test_f1: 0.5549
 epoch: 48, train_loss: 0.8060, test_loss: 0.9097, test_f1: 0.5449
 epoch: 49, train_loss: 0.8052, test_loss: 0.9027, test_f1: 0.5564
 epoch: 50, train_loss: 0.7913, test_loss: 0.9115, test_f1: 0.5507
 epoch: 51, train_loss: 0.8025, test_loss: 0.9044, test_f1: 0.5629
 epoch: 52, train_loss: 0.7877, test_loss: 0.9071, test_f1: 0.5524
 epoch: 53, train_loss: 0.7953, test_loss: 0.9125, test_f1: 0.5480
 epoch: 54, train_loss: 0.7850, test_loss: 0.9085, test_f1: 0.5542
 epoch: 55, train_loss: 0.7990, test_loss: 0.9093, test_f1: 0.5519
 epoch: 56, train_loss: 0.7816, test_loss: 0.9065, test_f1: 0.5558
 epoch: 57, train_loss: 0.7946, test_loss: 0.9102, test_f1: 0.5527
 epoch: 58, train_loss: 0.7886, test_loss: 0.9119, test_f1: 0.5530
 epoch: 59, train_loss: 0.7755, test_loss: 0.9085, test_f1: 0.5579
 epoch: 60, train_loss: 0.7754, test_loss: 0.9022, test_f1: 0.5628
 epoch: 61, train_loss: 0.7783, test_loss: 0.9005, test_f1: 0.5598
 epoch: 62, train_loss: 0.7705, test_loss: 0.9032, test_f1: 0.5565
 epoch: 63, train_loss: 0.7823, test_loss: 0.9028, test_f1: 0.5591
 epoch: 64, train_loss: 0.7709, test_loss: 0.8947, test_f1: 0.5696
 epoch: 65, train_loss: 0.7722, test_loss: 0.9013, test_f1: 0.5627
 epoch: 66, train_loss: 0.7663, test_loss: 0.8984, test_f1: 0.5634
 epoch: 67, train_loss: 0.7758, test_loss: 0.8944, test_f1: 0.5715
 epoch: 68, train_loss: 0.7633, test_loss: 0.9026, test_f1: 0.5611
 epoch: 69, train_loss: 0.7641, test_loss: 0.8980, test_f1: 0.5727
 epoch: 70, train_loss: 0.7593, test_loss: 0.9031, test_f1: 0.5724
 epoch: 71, train_loss: 0.7582, test_loss: 0.9034, test_f1: 0.5600
 epoch: 72, train_loss: 0.7531, test_loss: 0.9004, test_f1: 0.5747
 epoch: 73, train_loss: 0.7620, test_loss: 0.9000, test_f1: 0.5736
 epoch: 74, train_loss: 0.7503, test_loss: 0.9017, test_f1: 0.5687
 epoch: 75, train_loss: 0.7559, test_loss: 0.8965, test_f1: 0.5791
 epoch: 76, train_loss: 0.7467, test_loss: 0.9041, test_f1: 0.5739
 epoch: 77, train_loss: 0.7486, test_loss: 0.9087, test_f1: 0.5660
 epoch: 78, train_loss: 0.7479, test_loss: 0.9161, test_f1: 0.5651
 epoch: 79, train_loss: 0.7446, test_loss: 0.9177, test_f1: 0.5661
 epoch: 80, train_loss: 0.7566, test_loss: 0.9104, test_f1: 0.5783
 epoch: 81, train_loss: 0.7493, test_loss: 0.9045, test_f1: 0.5709
 epoch: 82, train_loss: 0.7383, test_loss: 0.9067, test_f1: 0.5752
 epoch: 83, train_loss: 0.7419, test_loss: 0.9046, test_f1: 0.5749
 epoch: 84, train_loss: 0.7487, test_loss: 0.9144, test_f1: 0.5667
 epoch: 85, train_loss: 0.7325, test_loss: 0.9163, test_f1: 0.5605
 epoch: 86, train_loss: 0.7457, test_loss: 0.9029, test_f1: 0.5756
 epoch: 87, train_loss: 0.7325, test_loss: 0.9111, test_f1: 0.5689
 epoch: 88, train_loss: 0.7348, test_loss: 0.9131, test_f1: 0.5637
 epoch: 89, train_loss: 0.7210, test_loss: 0.9117, test_f1: 0.5677
 epoch: 90, train_loss: 0.7252, test_loss: 0.9029, test_f1: 0.5853
 epoch: 91, train_loss: 0.7282, test_loss: 0.9113, test_f1: 0.5739
 epoch: 92, train_loss: 0.7315, test_loss: 0.9074, test_f1: 0.5702
 epoch: 93, train_loss: 0.7397, test_loss: 0.8940, test_f1: 0.5766
 epoch: 94, train_loss: 0.7249, test_loss: 0.9033, test_f1: 0.5733
 epoch: 95, train_loss: 0.7160, test_loss: 0.9083, test_f1: 0.5716
 epoch: 96, train_loss: 0.7122, test_loss: 0.9111, test_f1: 0.5663
 epoch: 97, train_loss: 0.7176, test_loss: 0.9070, test_f1: 0.5679
 epoch: 98, train_loss: 0.7035, test_loss: 0.9099, test_f1: 0.5696
 epoch: 99, train_loss: 0.7131, test_loss: 0.9158, test_f1: 0.5838
##################ITERATION #6 ****************************************
 epoch: 0, train_loss: 1.2666, test_loss: 1.3509, test_f1: 0.2270
 epoch: 1, train_loss: 1.2050, test_loss: 1.3755, test_f1: 0.2181
 epoch: 2, train_loss: 1.1730, test_loss: 1.3038, test_f1: 0.3062
 epoch: 3, train_loss: 1.1510, test_loss: 1.2247, test_f1: 0.3508
 epoch: 4, train_loss: 1.1263, test_loss: 1.1651, test_f1: 0.3745
 epoch: 5, train_loss: 1.1058, test_loss: 1.1396, test_f1: 0.3879
 epoch: 6, train_loss: 1.0905, test_loss: 1.0661, test_f1: 0.4588
 epoch: 7, train_loss: 1.0783, test_loss: 1.0394, test_f1: 0.4755
 epoch: 8, train_loss: 1.0619, test_loss: 1.0068, test_f1: 0.5053
 epoch: 9, train_loss: 1.0500, test_loss: 1.0101, test_f1: 0.4951
 epoch: 10, train_loss: 1.0357, test_loss: 0.9938, test_f1: 0.5058
 epoch: 11, train_loss: 1.0258, test_loss: 1.0008, test_f1: 0.5044
 epoch: 12, train_loss: 1.0132, test_loss: 0.9895, test_f1: 0.5019
 epoch: 13, train_loss: 1.0044, test_loss: 0.9846, test_f1: 0.5045
 epoch: 14, train_loss: 0.9971, test_loss: 0.9964, test_f1: 0.4802
 epoch: 15, train_loss: 0.9886, test_loss: 0.9799, test_f1: 0.5024
 epoch: 16, train_loss: 0.9734, test_loss: 0.9761, test_f1: 0.5023
 epoch: 17, train_loss: 0.9659, test_loss: 0.9738, test_f1: 0.5027
 epoch: 18, train_loss: 0.9524, test_loss: 0.9813, test_f1: 0.5023
 epoch: 19, train_loss: 0.9470, test_loss: 0.9782, test_f1: 0.5135
 epoch: 20, train_loss: 0.9482, test_loss: 0.9946, test_f1: 0.4890
 epoch: 21, train_loss: 0.9351, test_loss: 0.9751, test_f1: 0.5081
 epoch: 22, train_loss: 0.9270, test_loss: 0.9739, test_f1: 0.5000
 epoch: 23, train_loss: 0.9240, test_loss: 0.9746, test_f1: 0.5140
 epoch: 24, train_loss: 0.9238, test_loss: 1.0066, test_f1: 0.4928
 epoch: 25, train_loss: 0.9097, test_loss: 0.9629, test_f1: 0.5206
 epoch: 26, train_loss: 0.9069, test_loss: 0.9952, test_f1: 0.5016
 epoch: 27, train_loss: 0.9049, test_loss: 0.9646, test_f1: 0.5243
 epoch: 28, train_loss: 0.8929, test_loss: 0.9582, test_f1: 0.5360
 epoch: 29, train_loss: 0.8867, test_loss: 0.9793, test_f1: 0.5275
 epoch: 30, train_loss: 0.8798, test_loss: 0.9789, test_f1: 0.5243
 epoch: 31, train_loss: 0.8719, test_loss: 0.9688, test_f1: 0.5487
 epoch: 32, train_loss: 0.8815, test_loss: 0.9710, test_f1: 0.5358
 epoch: 33, train_loss: 0.8649, test_loss: 0.9698, test_f1: 0.5346
 epoch: 34, train_loss: 0.8566, test_loss: 0.9831, test_f1: 0.5307
 epoch: 35, train_loss: 0.8557, test_loss: 0.9787, test_f1: 0.5385
 epoch: 36, train_loss: 0.8577, test_loss: 0.9674, test_f1: 0.5454
 epoch: 37, train_loss: 0.8561, test_loss: 0.9660, test_f1: 0.5347
 epoch: 38, train_loss: 0.8498, test_loss: 0.9646, test_f1: 0.5477
 epoch: 39, train_loss: 0.8447, test_loss: 0.9699, test_f1: 0.5412
 epoch: 40, train_loss: 0.8308, test_loss: 0.9817, test_f1: 0.5456
 epoch: 41, train_loss: 0.8317, test_loss: 0.9758, test_f1: 0.5425
 epoch: 42, train_loss: 0.8283, test_loss: 0.9346, test_f1: 0.5657
 epoch: 43, train_loss: 0.8287, test_loss: 1.0044, test_f1: 0.5411
 epoch: 44, train_loss: 0.8234, test_loss: 0.9552, test_f1: 0.5493
 epoch: 45, train_loss: 0.8129, test_loss: 0.9739, test_f1: 0.5543
 epoch: 46, train_loss: 0.8137, test_loss: 0.9692, test_f1: 0.5580
 epoch: 47, train_loss: 0.8058, test_loss: 0.9805, test_f1: 0.5510
 epoch: 48, train_loss: 0.8068, test_loss: 0.9557, test_f1: 0.5543
 epoch: 49, train_loss: 0.8019, test_loss: 0.9803, test_f1: 0.5464
 epoch: 50, train_loss: 0.8071, test_loss: 0.9733, test_f1: 0.5617
 epoch: 51, train_loss: 0.8030, test_loss: 0.9636, test_f1: 0.5597
 epoch: 52, train_loss: 0.7917, test_loss: 0.9707, test_f1: 0.5647
 epoch: 53, train_loss: 0.7891, test_loss: 0.9661, test_f1: 0.5598
 epoch: 54, train_loss: 0.7795, test_loss: 0.9637, test_f1: 0.5633
 epoch: 55, train_loss: 0.7865, test_loss: 0.9628, test_f1: 0.5626
 epoch: 56, train_loss: 0.7728, test_loss: 0.9691, test_f1: 0.5621
 epoch: 57, train_loss: 0.7739, test_loss: 0.9694, test_f1: 0.5590
 epoch: 58, train_loss: 0.7893, test_loss: 0.9598, test_f1: 0.5664
 epoch: 59, train_loss: 0.7740, test_loss: 0.9757, test_f1: 0.5579
 epoch: 60, train_loss: 0.7693, test_loss: 0.9687, test_f1: 0.5624
 epoch: 61, train_loss: 0.7687, test_loss: 0.9677, test_f1: 0.5609
 epoch: 62, train_loss: 0.7696, test_loss: 0.9645, test_f1: 0.5647
 epoch: 63, train_loss: 0.7712, test_loss: 0.9690, test_f1: 0.5619
 epoch: 64, train_loss: 0.7584, test_loss: 0.9783, test_f1: 0.5546
 epoch: 65, train_loss: 0.7827, test_loss: 0.9667, test_f1: 0.5706
 epoch: 66, train_loss: 0.7737, test_loss: 0.9813, test_f1: 0.5559
 epoch: 67, train_loss: 0.7720, test_loss: 0.9665, test_f1: 0.5602
 epoch: 68, train_loss: 0.7684, test_loss: 0.9564, test_f1: 0.5683
 epoch: 69, train_loss: 0.7540, test_loss: 0.9756, test_f1: 0.5621
 epoch: 70, train_loss: 0.7464, test_loss: 0.9657, test_f1: 0.5662
 epoch: 71, train_loss: 0.7589, test_loss: 0.9681, test_f1: 0.5737
 epoch: 72, train_loss: 0.7526, test_loss: 0.9662, test_f1: 0.5633
 epoch: 73, train_loss: 0.7496, test_loss: 0.9789, test_f1: 0.5645
 epoch: 74, train_loss: 0.7515, test_loss: 0.9619, test_f1: 0.5750
 epoch: 75, train_loss: 0.7545, test_loss: 0.9706, test_f1: 0.5788
 epoch: 76, train_loss: 0.7453, test_loss: 0.9731, test_f1: 0.5726
 epoch: 77, train_loss: 0.7502, test_loss: 0.9718, test_f1: 0.5771
 epoch: 78, train_loss: 0.7344, test_loss: 0.9720, test_f1: 0.5744
 epoch: 79, train_loss: 0.7416, test_loss: 0.9799, test_f1: 0.5733
 epoch: 80, train_loss: 0.7228, test_loss: 0.9866, test_f1: 0.5529
 epoch: 81, train_loss: 0.7353, test_loss: 0.9756, test_f1: 0.5696
 epoch: 82, train_loss: 0.7365, test_loss: 0.9717, test_f1: 0.5801
 epoch: 83, train_loss: 0.7377, test_loss: 0.9637, test_f1: 0.5837
 epoch: 84, train_loss: 0.7375, test_loss: 0.9792, test_f1: 0.5734
 epoch: 85, train_loss: 0.7333, test_loss: 0.9766, test_f1: 0.5734
 epoch: 86, train_loss: 0.7440, test_loss: 0.9776, test_f1: 0.5755
 epoch: 87, train_loss: 0.7188, test_loss: 0.9757, test_f1: 0.5768
 epoch: 88, train_loss: 0.7345, test_loss: 0.9785, test_f1: 0.5816
 epoch: 89, train_loss: 0.7229, test_loss: 0.9739, test_f1: 0.5722
 epoch: 90, train_loss: 0.7420, test_loss: 0.9685, test_f1: 0.5779
 epoch: 91, train_loss: 0.7167, test_loss: 0.9676, test_f1: 0.5730
 epoch: 92, train_loss: 0.7134, test_loss: 0.9804, test_f1: 0.5697
 epoch: 93, train_loss: 0.7135, test_loss: 0.9793, test_f1: 0.5719
 epoch: 94, train_loss: 0.7055, test_loss: 0.9931, test_f1: 0.5753
 epoch: 95, train_loss: 0.7171, test_loss: 0.9827, test_f1: 0.5758
 epoch: 96, train_loss: 0.7165, test_loss: 0.9767, test_f1: 0.5731
 epoch: 97, train_loss: 0.7175, test_loss: 0.9846, test_f1: 0.5817
 epoch: 98, train_loss: 0.7146, test_loss: 0.9692, test_f1: 0.5811
 epoch: 99, train_loss: 0.7098, test_loss: 0.9676, test_f1: 0.5921
##################ITERATION #7 ****************************************
 epoch: 0, train_loss: 1.2985, test_loss: 1.3894, test_f1: 0.2590
 epoch: 1, train_loss: 1.2271, test_loss: 1.3481, test_f1: 0.2804
 epoch: 2, train_loss: 1.2025, test_loss: 1.2786, test_f1: 0.3058
 epoch: 3, train_loss: 1.1749, test_loss: 1.2122, test_f1: 0.3377
 epoch: 4, train_loss: 1.1492, test_loss: 1.1685, test_f1: 0.3836
 epoch: 5, train_loss: 1.1330, test_loss: 1.1376, test_f1: 0.4016
 epoch: 6, train_loss: 1.1155, test_loss: 1.1264, test_f1: 0.4123
 epoch: 7, train_loss: 1.0918, test_loss: 1.0659, test_f1: 0.4642
 epoch: 8, train_loss: 1.0774, test_loss: 1.0394, test_f1: 0.4807
 epoch: 9, train_loss: 1.0677, test_loss: 1.0244, test_f1: 0.5018
 epoch: 10, train_loss: 1.0590, test_loss: 1.0042, test_f1: 0.5065
 epoch: 11, train_loss: 1.0410, test_loss: 0.9993, test_f1: 0.4991
 epoch: 12, train_loss: 1.0358, test_loss: 0.9846, test_f1: 0.4968
 epoch: 13, train_loss: 1.0251, test_loss: 0.9782, test_f1: 0.5145
 epoch: 14, train_loss: 1.0094, test_loss: 0.9744, test_f1: 0.5167
 epoch: 15, train_loss: 0.9986, test_loss: 0.9686, test_f1: 0.5025
 epoch: 16, train_loss: 0.9901, test_loss: 0.9532, test_f1: 0.5178
 epoch: 17, train_loss: 0.9857, test_loss: 0.9413, test_f1: 0.5230
 epoch: 18, train_loss: 0.9687, test_loss: 0.9630, test_f1: 0.5081
 epoch: 19, train_loss: 0.9645, test_loss: 0.9327, test_f1: 0.5204
 epoch: 20, train_loss: 0.9506, test_loss: 0.9264, test_f1: 0.5256
 epoch: 21, train_loss: 0.9507, test_loss: 0.9203, test_f1: 0.5278
 epoch: 22, train_loss: 0.9313, test_loss: 0.9157, test_f1: 0.5224
 epoch: 23, train_loss: 0.9309, test_loss: 0.9161, test_f1: 0.5264
 epoch: 24, train_loss: 0.9168, test_loss: 0.9149, test_f1: 0.5357
 epoch: 25, train_loss: 0.9207, test_loss: 0.9123, test_f1: 0.5291
 epoch: 26, train_loss: 0.9163, test_loss: 0.9085, test_f1: 0.5294
 epoch: 27, train_loss: 0.9090, test_loss: 0.9069, test_f1: 0.5292
 epoch: 28, train_loss: 0.9010, test_loss: 0.9161, test_f1: 0.5374
 epoch: 29, train_loss: 0.8954, test_loss: 0.8961, test_f1: 0.5349
 epoch: 30, train_loss: 0.8871, test_loss: 0.9026, test_f1: 0.5150
 epoch: 31, train_loss: 0.8867, test_loss: 0.8971, test_f1: 0.5356
 epoch: 32, train_loss: 0.8730, test_loss: 0.8871, test_f1: 0.5360
 epoch: 33, train_loss: 0.8845, test_loss: 0.8955, test_f1: 0.5462
 epoch: 34, train_loss: 0.8712, test_loss: 0.8978, test_f1: 0.5419
 epoch: 35, train_loss: 0.8693, test_loss: 0.8981, test_f1: 0.5424
 epoch: 36, train_loss: 0.8564, test_loss: 0.8980, test_f1: 0.5264
 epoch: 37, train_loss: 0.8599, test_loss: 0.9015, test_f1: 0.5516
 epoch: 38, train_loss: 0.8455, test_loss: 0.8941, test_f1: 0.5381
 epoch: 39, train_loss: 0.8551, test_loss: 0.8990, test_f1: 0.5515
 epoch: 40, train_loss: 0.8539, test_loss: 0.8920, test_f1: 0.5546
 epoch: 41, train_loss: 0.8460, test_loss: 0.8976, test_f1: 0.5510
 epoch: 42, train_loss: 0.8359, test_loss: 0.8925, test_f1: 0.5549
 epoch: 43, train_loss: 0.8326, test_loss: 0.8892, test_f1: 0.5563
 epoch: 44, train_loss: 0.8361, test_loss: 0.9173, test_f1: 0.5386
 epoch: 45, train_loss: 0.8251, test_loss: 0.8886, test_f1: 0.5588
 epoch: 46, train_loss: 0.8248, test_loss: 0.8980, test_f1: 0.5596
 epoch: 47, train_loss: 0.8080, test_loss: 0.9037, test_f1: 0.5506
 epoch: 48, train_loss: 0.8110, test_loss: 0.8897, test_f1: 0.5598
 epoch: 49, train_loss: 0.8168, test_loss: 0.8949, test_f1: 0.5536
 epoch: 50, train_loss: 0.8079, test_loss: 0.8954, test_f1: 0.5546
 epoch: 51, train_loss: 0.7971, test_loss: 0.8947, test_f1: 0.5685
 epoch: 52, train_loss: 0.7910, test_loss: 0.8936, test_f1: 0.5710
 epoch: 53, train_loss: 0.7973, test_loss: 0.8911, test_f1: 0.5701
 epoch: 54, train_loss: 0.8008, test_loss: 0.8936, test_f1: 0.5790
 epoch: 55, train_loss: 0.7819, test_loss: 0.8865, test_f1: 0.5782
 epoch: 56, train_loss: 0.7846, test_loss: 0.8965, test_f1: 0.5614
 epoch: 57, train_loss: 0.7927, test_loss: 0.8862, test_f1: 0.5757
 epoch: 58, train_loss: 0.7796, test_loss: 0.8914, test_f1: 0.5774
 epoch: 59, train_loss: 0.7826, test_loss: 0.9071, test_f1: 0.5749
 epoch: 60, train_loss: 0.7813, test_loss: 0.8964, test_f1: 0.5684
 epoch: 61, train_loss: 0.7853, test_loss: 0.8996, test_f1: 0.5736
 epoch: 62, train_loss: 0.7816, test_loss: 0.8999, test_f1: 0.5773
 epoch: 63, train_loss: 0.7681, test_loss: 0.9052, test_f1: 0.5732
 epoch: 64, train_loss: 0.7798, test_loss: 0.8952, test_f1: 0.5706
 epoch: 65, train_loss: 0.7695, test_loss: 0.8975, test_f1: 0.5814
 epoch: 66, train_loss: 0.7700, test_loss: 0.9039, test_f1: 0.5775
 epoch: 67, train_loss: 0.7763, test_loss: 0.8997, test_f1: 0.5725
 epoch: 68, train_loss: 0.7710, test_loss: 0.9077, test_f1: 0.5695
 epoch: 69, train_loss: 0.7677, test_loss: 0.9038, test_f1: 0.5758
 epoch: 70, train_loss: 0.7588, test_loss: 0.9067, test_f1: 0.5814
 epoch: 71, train_loss: 0.7560, test_loss: 0.9036, test_f1: 0.5865
 epoch: 72, train_loss: 0.7612, test_loss: 0.8986, test_f1: 0.5859
 epoch: 73, train_loss: 0.7494, test_loss: 0.9079, test_f1: 0.5864
 epoch: 74, train_loss: 0.7573, test_loss: 0.9139, test_f1: 0.5653
 epoch: 75, train_loss: 0.7650, test_loss: 0.9096, test_f1: 0.5832
 epoch: 76, train_loss: 0.7589, test_loss: 0.8987, test_f1: 0.5949
 epoch: 77, train_loss: 0.7533, test_loss: 0.8925, test_f1: 0.5865
 epoch: 78, train_loss: 0.7436, test_loss: 0.8999, test_f1: 0.5772
 epoch: 79, train_loss: 0.7479, test_loss: 0.8931, test_f1: 0.5862
 epoch: 80, train_loss: 0.7530, test_loss: 0.8984, test_f1: 0.5794
 epoch: 81, train_loss: 0.7469, test_loss: 0.9039, test_f1: 0.5820
 epoch: 82, train_loss: 0.7483, test_loss: 0.9057, test_f1: 0.5769
 epoch: 83, train_loss: 0.7393, test_loss: 0.9086, test_f1: 0.5704
 epoch: 84, train_loss: 0.7482, test_loss: 0.9087, test_f1: 0.5741
 epoch: 85, train_loss: 0.7459, test_loss: 0.9058, test_f1: 0.5802
 epoch: 86, train_loss: 0.7420, test_loss: 0.9048, test_f1: 0.5832
 epoch: 87, train_loss: 0.7330, test_loss: 0.9104, test_f1: 0.5726
 epoch: 88, train_loss: 0.7448, test_loss: 0.9069, test_f1: 0.5787
 epoch: 89, train_loss: 0.7343, test_loss: 0.9125, test_f1: 0.5723
 epoch: 90, train_loss: 0.7295, test_loss: 0.9087, test_f1: 0.5705
 epoch: 91, train_loss: 0.7403, test_loss: 0.9104, test_f1: 0.5683
 epoch: 92, train_loss: 0.7362, test_loss: 0.9140, test_f1: 0.5750
 epoch: 93, train_loss: 0.7331, test_loss: 0.9114, test_f1: 0.5822
 epoch: 94, train_loss: 0.7177, test_loss: 0.9155, test_f1: 0.5816
 epoch: 95, train_loss: 0.7234, test_loss: 0.9130, test_f1: 0.5738
 epoch: 96, train_loss: 0.7199, test_loss: 0.9149, test_f1: 0.5768
 epoch: 97, train_loss: 0.7263, test_loss: 0.9210, test_f1: 0.5716
 epoch: 98, train_loss: 0.7219, test_loss: 0.9216, test_f1: 0.5748
 epoch: 99, train_loss: 0.7191, test_loss: 0.9228, test_f1: 0.5875
##################ITERATION #8 ****************************************
 epoch: 0, train_loss: 1.3396, test_loss: 1.3238, test_f1: 0.2270
 epoch: 1, train_loss: 1.2457, test_loss: 1.3597, test_f1: 0.2109
 epoch: 2, train_loss: 1.2054, test_loss: 1.3200, test_f1: 0.2560
 epoch: 3, train_loss: 1.1829, test_loss: 1.2405, test_f1: 0.3930
 epoch: 4, train_loss: 1.1618, test_loss: 1.1786, test_f1: 0.4100
 epoch: 5, train_loss: 1.1449, test_loss: 1.1140, test_f1: 0.4181
 epoch: 6, train_loss: 1.1178, test_loss: 1.0627, test_f1: 0.4724
 epoch: 7, train_loss: 1.1028, test_loss: 1.0417, test_f1: 0.4645
 epoch: 8, train_loss: 1.0800, test_loss: 1.0256, test_f1: 0.4652
 epoch: 9, train_loss: 1.0680, test_loss: 1.0039, test_f1: 0.4805
 epoch: 10, train_loss: 1.0596, test_loss: 1.0025, test_f1: 0.4646
 epoch: 11, train_loss: 1.0529, test_loss: 0.9818, test_f1: 0.4838
 epoch: 12, train_loss: 1.0338, test_loss: 0.9860, test_f1: 0.4748
 epoch: 13, train_loss: 1.0270, test_loss: 0.9591, test_f1: 0.4969
 epoch: 14, train_loss: 1.0166, test_loss: 0.9653, test_f1: 0.4806
 epoch: 15, train_loss: 1.0078, test_loss: 0.9719, test_f1: 0.4762
 epoch: 16, train_loss: 0.9998, test_loss: 0.9397, test_f1: 0.4944
 epoch: 17, train_loss: 0.9840, test_loss: 0.9370, test_f1: 0.4979
 epoch: 18, train_loss: 0.9853, test_loss: 0.9375, test_f1: 0.4975
 epoch: 19, train_loss: 0.9744, test_loss: 0.9303, test_f1: 0.4947
 epoch: 20, train_loss: 0.9646, test_loss: 0.9101, test_f1: 0.4964
 epoch: 21, train_loss: 0.9515, test_loss: 0.9207, test_f1: 0.5026
 epoch: 22, train_loss: 0.9531, test_loss: 0.9171, test_f1: 0.5029
 epoch: 23, train_loss: 0.9457, test_loss: 0.9163, test_f1: 0.5102
 epoch: 24, train_loss: 0.9345, test_loss: 0.9105, test_f1: 0.5087
 epoch: 25, train_loss: 0.9226, test_loss: 0.9237, test_f1: 0.5123
 epoch: 26, train_loss: 0.9233, test_loss: 0.9099, test_f1: 0.5163
 epoch: 27, train_loss: 0.9168, test_loss: 0.9285, test_f1: 0.5182
 epoch: 28, train_loss: 0.9138, test_loss: 0.9169, test_f1: 0.5247
 epoch: 29, train_loss: 0.9078, test_loss: 0.8969, test_f1: 0.5230
 epoch: 30, train_loss: 0.9002, test_loss: 0.8850, test_f1: 0.5333
 epoch: 31, train_loss: 0.9010, test_loss: 0.8931, test_f1: 0.5216
 epoch: 32, train_loss: 0.9020, test_loss: 0.9015, test_f1: 0.5024
 epoch: 33, train_loss: 0.8908, test_loss: 0.8941, test_f1: 0.5181
 epoch: 34, train_loss: 0.8831, test_loss: 0.8893, test_f1: 0.5191
 epoch: 35, train_loss: 0.8774, test_loss: 0.8911, test_f1: 0.5246
 epoch: 36, train_loss: 0.8730, test_loss: 0.9046, test_f1: 0.5282
 epoch: 37, train_loss: 0.8773, test_loss: 0.9083, test_f1: 0.5165
 epoch: 38, train_loss: 0.8657, test_loss: 0.8880, test_f1: 0.5273
 epoch: 39, train_loss: 0.8655, test_loss: 0.9198, test_f1: 0.5239
 epoch: 40, train_loss: 0.8586, test_loss: 0.9061, test_f1: 0.5096
 epoch: 41, train_loss: 0.8662, test_loss: 0.8922, test_f1: 0.5283
 epoch: 42, train_loss: 0.8582, test_loss: 0.9174, test_f1: 0.5227
 epoch: 43, train_loss: 0.8476, test_loss: 0.9058, test_f1: 0.5361
 epoch: 44, train_loss: 0.8614, test_loss: 0.9072, test_f1: 0.5425
 epoch: 45, train_loss: 0.8471, test_loss: 0.8729, test_f1: 0.5502
 epoch: 46, train_loss: 0.8449, test_loss: 0.8794, test_f1: 0.5537
 epoch: 47, train_loss: 0.8429, test_loss: 0.9028, test_f1: 0.5337
 epoch: 48, train_loss: 0.8320, test_loss: 0.8756, test_f1: 0.5286
 epoch: 49, train_loss: 0.8271, test_loss: 0.8902, test_f1: 0.5412
 epoch: 50, train_loss: 0.8223, test_loss: 0.8992, test_f1: 0.5397
 epoch: 51, train_loss: 0.8161, test_loss: 0.9072, test_f1: 0.5281
 epoch: 52, train_loss: 0.8194, test_loss: 0.9063, test_f1: 0.5315
 epoch: 53, train_loss: 0.8214, test_loss: 0.9155, test_f1: 0.5289
 epoch: 54, train_loss: 0.8030, test_loss: 0.8919, test_f1: 0.5288
 epoch: 55, train_loss: 0.8178, test_loss: 0.9065, test_f1: 0.5344
 epoch: 56, train_loss: 0.8105, test_loss: 0.9298, test_f1: 0.5357
 epoch: 57, train_loss: 0.8185, test_loss: 0.9119, test_f1: 0.5341
 epoch: 58, train_loss: 0.8110, test_loss: 0.8943, test_f1: 0.5385
 epoch: 59, train_loss: 0.8128, test_loss: 0.9087, test_f1: 0.5331
 epoch: 60, train_loss: 0.8048, test_loss: 0.9110, test_f1: 0.5360
 epoch: 61, train_loss: 0.8064, test_loss: 0.9056, test_f1: 0.5430
 epoch: 62, train_loss: 0.8055, test_loss: 0.9126, test_f1: 0.5440
 epoch: 63, train_loss: 0.8046, test_loss: 0.8900, test_f1: 0.5501
 epoch: 64, train_loss: 0.7992, test_loss: 0.9138, test_f1: 0.5368
 epoch: 65, train_loss: 0.7905, test_loss: 0.9084, test_f1: 0.5429
 epoch: 66, train_loss: 0.7938, test_loss: 0.9052, test_f1: 0.5413
 epoch: 67, train_loss: 0.7911, test_loss: 0.9117, test_f1: 0.5419
 epoch: 68, train_loss: 0.7935, test_loss: 0.9058, test_f1: 0.5415
 epoch: 69, train_loss: 0.7940, test_loss: 0.9173, test_f1: 0.5436
 epoch: 70, train_loss: 0.7950, test_loss: 0.9131, test_f1: 0.5515
 epoch: 71, train_loss: 0.7945, test_loss: 0.9170, test_f1: 0.5511
 epoch: 72, train_loss: 0.7922, test_loss: 0.9176, test_f1: 0.5469
 epoch: 73, train_loss: 0.7898, test_loss: 0.9176, test_f1: 0.5358
 epoch: 74, train_loss: 0.7832, test_loss: 0.9304, test_f1: 0.5429
 epoch: 75, train_loss: 0.7886, test_loss: 0.9141, test_f1: 0.5395
 epoch: 76, train_loss: 0.7898, test_loss: 0.8954, test_f1: 0.5509
 epoch: 77, train_loss: 0.7863, test_loss: 0.9151, test_f1: 0.5543
 epoch: 78, train_loss: 0.7795, test_loss: 0.9373, test_f1: 0.5458
 epoch: 79, train_loss: 0.7783, test_loss: 0.9206, test_f1: 0.5486
 epoch: 80, train_loss: 0.7775, test_loss: 0.9132, test_f1: 0.5459
 epoch: 81, train_loss: 0.7794, test_loss: 0.9066, test_f1: 0.5512
 epoch: 82, train_loss: 0.7816, test_loss: 0.9190, test_f1: 0.5435
 epoch: 83, train_loss: 0.7700, test_loss: 0.9161, test_f1: 0.5457
 epoch: 84, train_loss: 0.7774, test_loss: 0.9219, test_f1: 0.5467
 epoch: 85, train_loss: 0.7709, test_loss: 0.9318, test_f1: 0.5435
 epoch: 86, train_loss: 0.7734, test_loss: 0.9194, test_f1: 0.5472
 epoch: 87, train_loss: 0.7621, test_loss: 0.9066, test_f1: 0.5545
 epoch: 88, train_loss: 0.7666, test_loss: 0.9103, test_f1: 0.5483
 epoch: 89, train_loss: 0.7729, test_loss: 0.9226, test_f1: 0.5483
 epoch: 90, train_loss: 0.7648, test_loss: 0.9255, test_f1: 0.5526
 epoch: 91, train_loss: 0.7615, test_loss: 0.9294, test_f1: 0.5510
 epoch: 92, train_loss: 0.7709, test_loss: 0.9031, test_f1: 0.5625
 epoch: 93, train_loss: 0.7610, test_loss: 0.9219, test_f1: 0.5496
 epoch: 94, train_loss: 0.7644, test_loss: 0.9107, test_f1: 0.5556
 epoch: 95, train_loss: 0.7588, test_loss: 0.9137, test_f1: 0.5538
 epoch: 96, train_loss: 0.7583, test_loss: 0.9188, test_f1: 0.5539
 epoch: 97, train_loss: 0.7567, test_loss: 0.9076, test_f1: 0.5573
 epoch: 98, train_loss: 0.7522, test_loss: 0.9028, test_f1: 0.5554
 epoch: 99, train_loss: 0.7575, test_loss: 0.8944, test_f1: 0.5600
##################ITERATION #9 ****************************************
 epoch: 0, train_loss: 1.3066, test_loss: 1.3718, test_f1: 0.2248
 epoch: 1, train_loss: 1.2141, test_loss: 1.3081, test_f1: 0.2270
 epoch: 2, train_loss: 1.1800, test_loss: 1.2354, test_f1: 0.3440
 epoch: 3, train_loss: 1.1516, test_loss: 1.1718, test_f1: 0.3763
 epoch: 4, train_loss: 1.1327, test_loss: 1.0969, test_f1: 0.4115
 epoch: 5, train_loss: 1.1133, test_loss: 1.0594, test_f1: 0.4312
 epoch: 6, train_loss: 1.0907, test_loss: 1.0445, test_f1: 0.4508
 epoch: 7, train_loss: 1.0715, test_loss: 1.0165, test_f1: 0.4660
 epoch: 8, train_loss: 1.0705, test_loss: 1.0105, test_f1: 0.4612
 epoch: 9, train_loss: 1.0478, test_loss: 1.0012, test_f1: 0.4857
 epoch: 10, train_loss: 1.0460, test_loss: 0.9967, test_f1: 0.4818
 epoch: 11, train_loss: 1.0275, test_loss: 0.9788, test_f1: 0.4806
 epoch: 12, train_loss: 1.0218, test_loss: 0.9789, test_f1: 0.4981
 epoch: 13, train_loss: 1.0075, test_loss: 0.9721, test_f1: 0.5043
 epoch: 14, train_loss: 1.0021, test_loss: 0.9641, test_f1: 0.5119
 epoch: 15, train_loss: 0.9973, test_loss: 0.9690, test_f1: 0.4993
 epoch: 16, train_loss: 0.9906, test_loss: 0.9545, test_f1: 0.4926
 epoch: 17, train_loss: 0.9780, test_loss: 0.9494, test_f1: 0.5066
 epoch: 18, train_loss: 0.9761, test_loss: 0.9567, test_f1: 0.5066
 epoch: 19, train_loss: 0.9670, test_loss: 0.9397, test_f1: 0.5098
 epoch: 20, train_loss: 0.9571, test_loss: 0.9425, test_f1: 0.5127
 epoch: 21, train_loss: 0.9571, test_loss: 0.9427, test_f1: 0.5188
 epoch: 22, train_loss: 0.9461, test_loss: 0.9552, test_f1: 0.4980
 epoch: 23, train_loss: 0.9455, test_loss: 0.9295, test_f1: 0.5173
 epoch: 24, train_loss: 0.9414, test_loss: 0.9504, test_f1: 0.5099
 epoch: 25, train_loss: 0.9407, test_loss: 0.9350, test_f1: 0.5223
 epoch: 26, train_loss: 0.9289, test_loss: 0.9374, test_f1: 0.5205
 epoch: 27, train_loss: 0.9188, test_loss: 0.9421, test_f1: 0.5206
 epoch: 28, train_loss: 0.9112, test_loss: 0.9440, test_f1: 0.5213
 epoch: 29, train_loss: 0.9272, test_loss: 0.9366, test_f1: 0.5258
 epoch: 30, train_loss: 0.9129, test_loss: 0.9428, test_f1: 0.5231
 epoch: 31, train_loss: 0.8973, test_loss: 0.9470, test_f1: 0.5298
 epoch: 32, train_loss: 0.9026, test_loss: 0.9295, test_f1: 0.5341
 epoch: 33, train_loss: 0.8955, test_loss: 0.9461, test_f1: 0.5181
 epoch: 34, train_loss: 0.9026, test_loss: 0.9276, test_f1: 0.5335
 epoch: 35, train_loss: 0.8891, test_loss: 0.9392, test_f1: 0.5290
 epoch: 36, train_loss: 0.8681, test_loss: 0.9344, test_f1: 0.5254
 epoch: 37, train_loss: 0.8849, test_loss: 0.9188, test_f1: 0.5417
 epoch: 38, train_loss: 0.8877, test_loss: 0.9302, test_f1: 0.5207
 epoch: 39, train_loss: 0.8782, test_loss: 0.9363, test_f1: 0.5111
 epoch: 40, train_loss: 0.8639, test_loss: 0.9222, test_f1: 0.5188
 epoch: 41, train_loss: 0.8767, test_loss: 0.9451, test_f1: 0.5149
 epoch: 42, train_loss: 0.8734, test_loss: 0.9318, test_f1: 0.5287
 epoch: 43, train_loss: 0.8642, test_loss: 0.9358, test_f1: 0.5250
 epoch: 44, train_loss: 0.8565, test_loss: 0.9191, test_f1: 0.5361
 epoch: 45, train_loss: 0.8565, test_loss: 0.9158, test_f1: 0.5416
 epoch: 46, train_loss: 0.8489, test_loss: 0.9233, test_f1: 0.5380
 epoch: 47, train_loss: 0.8489, test_loss: 0.9243, test_f1: 0.5444
 epoch: 48, train_loss: 0.8569, test_loss: 0.9298, test_f1: 0.5456
 epoch: 49, train_loss: 0.8383, test_loss: 0.9300, test_f1: 0.5379
 epoch: 50, train_loss: 0.8410, test_loss: 0.9313, test_f1: 0.5360
 epoch: 51, train_loss: 0.8406, test_loss: 0.9336, test_f1: 0.5338
 epoch: 52, train_loss: 0.8225, test_loss: 0.9195, test_f1: 0.5422
 epoch: 53, train_loss: 0.8293, test_loss: 0.9300, test_f1: 0.5477
 epoch: 54, train_loss: 0.8328, test_loss: 0.9312, test_f1: 0.5485
 epoch: 55, train_loss: 0.8178, test_loss: 0.9283, test_f1: 0.5424
 epoch: 56, train_loss: 0.8119, test_loss: 0.9327, test_f1: 0.5492
 epoch: 57, train_loss: 0.8200, test_loss: 0.9288, test_f1: 0.5563
 epoch: 58, train_loss: 0.8203, test_loss: 0.9191, test_f1: 0.5574
 epoch: 59, train_loss: 0.8139, test_loss: 0.9308, test_f1: 0.5580
 epoch: 60, train_loss: 0.8179, test_loss: 0.9235, test_f1: 0.5676
 epoch: 61, train_loss: 0.8154, test_loss: 0.9154, test_f1: 0.5653
 epoch: 62, train_loss: 0.8158, test_loss: 0.9202, test_f1: 0.5678
 epoch: 63, train_loss: 0.8104, test_loss: 0.9252, test_f1: 0.5605
 epoch: 64, train_loss: 0.8125, test_loss: 0.9177, test_f1: 0.5634
 epoch: 65, train_loss: 0.8085, test_loss: 0.9226, test_f1: 0.5647
 epoch: 66, train_loss: 0.8111, test_loss: 0.9257, test_f1: 0.5578
 epoch: 67, train_loss: 0.7993, test_loss: 0.9213, test_f1: 0.5707
 epoch: 68, train_loss: 0.8039, test_loss: 0.9276, test_f1: 0.5639
 epoch: 69, train_loss: 0.7910, test_loss: 0.9197, test_f1: 0.5753
 epoch: 70, train_loss: 0.7991, test_loss: 0.9244, test_f1: 0.5839
 epoch: 71, train_loss: 0.8073, test_loss: 0.9265, test_f1: 0.5855
 epoch: 72, train_loss: 0.8011, test_loss: 0.9274, test_f1: 0.5694
 epoch: 73, train_loss: 0.8062, test_loss: 0.9181, test_f1: 0.5742
 epoch: 74, train_loss: 0.8007, test_loss: 0.9188, test_f1: 0.5701
 epoch: 75, train_loss: 0.7926, test_loss: 0.9132, test_f1: 0.5885
 epoch: 76, train_loss: 0.7997, test_loss: 0.9202, test_f1: 0.5769
 epoch: 77, train_loss: 0.7894, test_loss: 0.9251, test_f1: 0.5829
 epoch: 78, train_loss: 0.7884, test_loss: 0.9194, test_f1: 0.5812
 epoch: 79, train_loss: 0.7770, test_loss: 0.9152, test_f1: 0.5906
 epoch: 80, train_loss: 0.7766, test_loss: 0.9283, test_f1: 0.5855
 epoch: 81, train_loss: 0.7788, test_loss: 0.9363, test_f1: 0.5778
 epoch: 82, train_loss: 0.7926, test_loss: 0.9354, test_f1: 0.5843
 epoch: 83, train_loss: 0.7786, test_loss: 0.9309, test_f1: 0.5734
 epoch: 84, train_loss: 0.7857, test_loss: 0.9414, test_f1: 0.5660
 epoch: 85, train_loss: 0.7764, test_loss: 0.9314, test_f1: 0.5921
 epoch: 86, train_loss: 0.7674, test_loss: 0.9319, test_f1: 0.5896
 epoch: 87, train_loss: 0.7739, test_loss: 0.9333, test_f1: 0.5855
 epoch: 88, train_loss: 0.7695, test_loss: 0.9276, test_f1: 0.5780
 epoch: 89, train_loss: 0.7659, test_loss: 0.9287, test_f1: 0.5724
 epoch: 90, train_loss: 0.7696, test_loss: 0.9470, test_f1: 0.5706
 epoch: 91, train_loss: 0.7753, test_loss: 0.9338, test_f1: 0.5705
 epoch: 92, train_loss: 0.7738, test_loss: 0.9305, test_f1: 0.5853
 epoch: 93, train_loss: 0.7698, test_loss: 0.9338, test_f1: 0.5885
 epoch: 94, train_loss: 0.7725, test_loss: 0.9452, test_f1: 0.5868
 epoch: 95, train_loss: 0.7744, test_loss: 0.9459, test_f1: 0.5820
 epoch: 96, train_loss: 0.7684, test_loss: 0.9418, test_f1: 0.5873
 epoch: 97, train_loss: 0.7630, test_loss: 0.9465, test_f1: 0.5940
 epoch: 98, train_loss: 0.7519, test_loss: 0.9418, test_f1: 0.5907
 epoch: 99, train_loss: 0.7474, test_loss: 0.9428, test_f1: 0.5936

Training completed in 425.92 seconds
Best F1: 0.5949 at epoch 76
Mean F1 across iterations: 0.5754  0.0149
========================FINAL RESULTS================================
FEGIN weighted F1: 0.5949  0.0149
python main.py --data ltspice_examples --representation component_net --model FEGIN --layers 6 --hiddens 64 --batch_size 256 --lr 0.0001 --emb_size 512 --epochs 100 --save_appendix component_net_L6_H64_BS256_LR0.0001_E512 --no_val
-----



STDERR:
  File "main.py", line 370, in <module>
    main()
  File "main.py", line 254, in main
    dataset = dataset_class(
  File "/home/philip/projects/ltspice_examples_code_repo/Circuit-Completion-Using-GNNs/component_classification_with_link_prediction_head/evaluation/FEGIN/kernel/circuit_datasets.py", line 15, in __init__
    self.data, self.slices = torch.load(self.processed_paths[0])
  File "/home/philip/.local/lib/python3.8/site-packages/torch/serialization.py", line 1040, in load
    warnings.warn(
  File "/usr/lib/python3.8/warnings.py", line 109, in _showwarnmsg
    sw(msg.message, msg.category, msg.filename, msg.lineno,
  File "main.py", line 47, in warn_with_traceback
    traceback.print_stack(file=log)
/home/philip/projects/ltspice_examples_code_repo/Circuit-Completion-Using-GNNs/component_classification_with_link_prediction_head/evaluation/FEGIN/kernel/circuit_datasets.py:15: FutureWarning: You are using `torch.load` with `weights_only=False` (the current default value), which uses the default pickle module implicitly. It is possible to construct malicious pickle data which will execute arbitrary code during unpickling (See https://github.com/pytorch/pytorch/blob/main/SECURITY.md#untrusted-models for more details). In a future release, the default value for `weights_only` will be flipped to `True`. This limits the functions that could be executed during unpickling. Arbitrary objects will no longer be allowed to be loaded via this mode unless they are explicitly allowlisted by the user via `torch.serialization.add_safe_globals`. We recommend you start setting `weights_only=True` for any use case where you don't have full control of the loaded file. Please open an issue on GitHub for any issues related to this experimental feature.
  self.data, self.slices = torch.load(self.processed_paths[0])
