STDOUT:
Results will be saved in /home/philip/projects/ltspice_examples_code_repo/Circuit-Completion-Using-GNNs/component_classification_with_link_prediction_head/evaluation/FEGIN/results/model_FEGIN_dataset_ltspice_demos
Command line input: python main.py --data ltspice_demos --representation component_pin --model FEGIN --layers 5 --hiddens 16 --batch_size 128 --lr 0.1 --emb_size 250 --epochs 100 --save_appendix component_pin_L5_H16_BS128_LR0.1_E250 --no_val
 is saved.
-----
ltspice_demos - FEGIN
Using 5 layers, 16 hidden units, h = 2
Loading component_pin representation dataset
ENTERED
Training FEGIN on component_pin representation
Train: 1565, Test: 383
##################ITERATION #0 ****************************************
 epoch: 0, train_loss: 1.4095, test_loss: 1.3020, test_f1: 0.2281
 epoch: 1, train_loss: 1.2518, test_loss: 1.2969, test_f1: 0.2631
 epoch: 2, train_loss: 1.2530, test_loss: 1.2974, test_f1: 0.2281
 epoch: 3, train_loss: 1.2354, test_loss: 1.3178, test_f1: 0.2583
 epoch: 4, train_loss: 1.1914, test_loss: 1.2631, test_f1: 0.2441
 epoch: 5, train_loss: 1.1508, test_loss: 1.1984, test_f1: 0.3567
 epoch: 6, train_loss: 1.1350, test_loss: 1.5048, test_f1: 0.2522
 epoch: 7, train_loss: 1.1341, test_loss: 1.1507, test_f1: 0.3177
 epoch: 8, train_loss: 1.1022, test_loss: 1.8025, test_f1: 0.2632
 epoch: 9, train_loss: 1.0904, test_loss: 1.1298, test_f1: 0.3344
 epoch: 10, train_loss: 1.1005, test_loss: 1.1630, test_f1: 0.3981
 epoch: 11, train_loss: 1.0731, test_loss: 1.1480, test_f1: 0.3317
 epoch: 12, train_loss: 1.0726, test_loss: 1.1534, test_f1: 0.3884
 epoch: 13, train_loss: 1.0605, test_loss: 1.1445, test_f1: 0.3290
 epoch: 14, train_loss: 1.0654, test_loss: 1.1266, test_f1: 0.3965
 epoch: 15, train_loss: 1.0519, test_loss: 1.0980, test_f1: 0.3969
 epoch: 16, train_loss: 1.0610, test_loss: 1.1301, test_f1: 0.3824
 epoch: 17, train_loss: 1.0571, test_loss: 1.1816, test_f1: 0.3303
 epoch: 18, train_loss: 1.0808, test_loss: 1.1451, test_f1: 0.3290
 epoch: 19, train_loss: 1.0527, test_loss: 1.1593, test_f1: 0.4118
 epoch: 20, train_loss: 1.0462, test_loss: 1.1585, test_f1: 0.3979
 epoch: 21, train_loss: 1.0357, test_loss: 1.1090, test_f1: 0.3425
 epoch: 22, train_loss: 1.0469, test_loss: 1.2037, test_f1: 0.4102
 epoch: 23, train_loss: 1.0621, test_loss: 1.1432, test_f1: 0.3938
 epoch: 24, train_loss: 1.0371, test_loss: 1.2864, test_f1: 0.4056
 epoch: 25, train_loss: 1.0508, test_loss: 1.2803, test_f1: 0.2773
 epoch: 26, train_loss: 1.0440, test_loss: 2.3778, test_f1: 0.3278
 epoch: 27, train_loss: 1.0361, test_loss: 1.0988, test_f1: 0.3608
 epoch: 28, train_loss: 1.0342, test_loss: 1.0862, test_f1: 0.3552
 epoch: 29, train_loss: 1.0351, test_loss: 1.1128, test_f1: 0.3464
 epoch: 30, train_loss: 1.0361, test_loss: 1.0835, test_f1: 0.3492
 epoch: 31, train_loss: 1.0453, test_loss: 1.2067, test_f1: 0.3114
 epoch: 32, train_loss: 1.0386, test_loss: 1.1362, test_f1: 0.4071
 epoch: 33, train_loss: 1.0322, test_loss: 1.0830, test_f1: 0.3560
 epoch: 34, train_loss: 1.0388, test_loss: 1.0856, test_f1: 0.3576
 epoch: 35, train_loss: 1.0232, test_loss: 1.0976, test_f1: 0.5046
 epoch: 36, train_loss: 0.9990, test_loss: 1.1040, test_f1: 0.3738
 epoch: 37, train_loss: 0.9804, test_loss: 1.0596, test_f1: 0.4269
 epoch: 38, train_loss: 0.9626, test_loss: 1.2167, test_f1: 0.3682
 epoch: 39, train_loss: 0.9745, test_loss: 1.0514, test_f1: 0.4170
 epoch: 40, train_loss: 0.9532, test_loss: 1.1364, test_f1: 0.3904
 epoch: 41, train_loss: 0.9684, test_loss: 1.0069, test_f1: 0.4464
 epoch: 42, train_loss: 0.9552, test_loss: 1.0730, test_f1: 0.4223
 epoch: 43, train_loss: 0.9491, test_loss: 0.9963, test_f1: 0.4488
 epoch: 44, train_loss: 0.9457, test_loss: 1.0515, test_f1: 0.4351
 epoch: 45, train_loss: 0.9234, test_loss: 1.0520, test_f1: 0.4288
 epoch: 46, train_loss: 0.9406, test_loss: 1.0902, test_f1: 0.3897
 epoch: 47, train_loss: 0.9647, test_loss: 1.1113, test_f1: 0.3654
 epoch: 48, train_loss: 0.9396, test_loss: 1.2778, test_f1: 0.3702
 epoch: 49, train_loss: 0.9437, test_loss: 1.0216, test_f1: 0.4140
 epoch: 50, train_loss: 0.9479, test_loss: 0.9829, test_f1: 0.4603
 epoch: 51, train_loss: 0.9352, test_loss: 0.9555, test_f1: 0.4734
 epoch: 52, train_loss: 0.9076, test_loss: 1.0139, test_f1: 0.4490
 epoch: 53, train_loss: 0.8877, test_loss: 1.0120, test_f1: 0.4530
 epoch: 54, train_loss: 0.8736, test_loss: 1.0811, test_f1: 0.4637
 epoch: 55, train_loss: 0.9113, test_loss: 1.3285, test_f1: 0.4113
 epoch: 56, train_loss: 0.9322, test_loss: 0.9805, test_f1: 0.4534
 epoch: 57, train_loss: 0.8827, test_loss: 0.9954, test_f1: 0.4500
 epoch: 58, train_loss: 0.8532, test_loss: 1.0687, test_f1: 0.4414
 epoch: 59, train_loss: 0.8394, test_loss: 1.0037, test_f1: 0.4619
 epoch: 60, train_loss: 0.8301, test_loss: 1.0842, test_f1: 0.4528
 epoch: 61, train_loss: 0.8519, test_loss: 1.0906, test_f1: 0.4335
 epoch: 62, train_loss: 0.8939, test_loss: 0.9665, test_f1: 0.4852
 epoch: 63, train_loss: 0.9016, test_loss: 1.0712, test_f1: 0.4605
 epoch: 64, train_loss: 0.8628, test_loss: 1.0194, test_f1: 0.4435
 epoch: 65, train_loss: 0.8628, test_loss: 1.4738, test_f1: 0.4107
 epoch: 66, train_loss: 0.8714, test_loss: 1.1633, test_f1: 0.4129
 epoch: 67, train_loss: 0.9068, test_loss: 1.0109, test_f1: 0.4600
 epoch: 68, train_loss: 0.9285, test_loss: 0.9946, test_f1: 0.4617
 epoch: 69, train_loss: 0.8867, test_loss: 1.2122, test_f1: 0.4091
 epoch: 70, train_loss: 0.8968, test_loss: 1.0347, test_f1: 0.4411
 epoch: 71, train_loss: 0.9078, test_loss: 1.0562, test_f1: 0.4518
 epoch: 72, train_loss: 0.8773, test_loss: 1.0475, test_f1: 0.4477
 epoch: 73, train_loss: 0.8705, test_loss: 1.0060, test_f1: 0.4689
 epoch: 74, train_loss: 0.8598, test_loss: 1.0324, test_f1: 0.4667
 epoch: 75, train_loss: 0.8515, test_loss: 1.0282, test_f1: 0.4501
 epoch: 76, train_loss: 0.8669, test_loss: 1.0179, test_f1: 0.4579
 epoch: 77, train_loss: 0.8429, test_loss: 1.2155, test_f1: 0.4534
 epoch: 78, train_loss: 0.8702, test_loss: 1.1875, test_f1: 0.4219
 epoch: 79, train_loss: 0.8774, test_loss: 1.0921, test_f1: 0.4365
 epoch: 80, train_loss: 0.8820, test_loss: 1.0103, test_f1: 0.4509
 epoch: 81, train_loss: 0.8816, test_loss: 0.9769, test_f1: 0.4777
 epoch: 82, train_loss: 0.8786, test_loss: 0.9777, test_f1: 0.4687
 epoch: 83, train_loss: 0.8458, test_loss: 1.0084, test_f1: 0.4532
 epoch: 84, train_loss: 0.8492, test_loss: 1.1117, test_f1: 0.4261
 epoch: 85, train_loss: 0.8590, test_loss: 0.9833, test_f1: 0.4624
 epoch: 86, train_loss: 0.8560, test_loss: 1.0106, test_f1: 0.4633
 epoch: 87, train_loss: 0.8696, test_loss: 1.4124, test_f1: 0.3985
 epoch: 88, train_loss: 0.8900, test_loss: 1.0611, test_f1: 0.4432
 epoch: 89, train_loss: 0.8733, test_loss: 1.0070, test_f1: 0.4652
 epoch: 90, train_loss: 0.8589, test_loss: 0.9782, test_f1: 0.5055
 epoch: 91, train_loss: 0.8469, test_loss: 0.9963, test_f1: 0.4651
 epoch: 92, train_loss: 0.8485, test_loss: 1.0026, test_f1: 0.4688
 epoch: 93, train_loss: 0.8363, test_loss: 1.0017, test_f1: 0.4777
 epoch: 94, train_loss: 0.8344, test_loss: 0.9721, test_f1: 0.4877
 epoch: 95, train_loss: 0.8604, test_loss: 0.9966, test_f1: 0.4736
 epoch: 96, train_loss: 0.8498, test_loss: 1.1142, test_f1: 0.4886
 epoch: 97, train_loss: 0.8520, test_loss: 1.3242, test_f1: 0.4487
 epoch: 98, train_loss: 0.8544, test_loss: 0.9912, test_f1: 0.4815
 epoch: 99, train_loss: 0.8482, test_loss: 1.0504, test_f1: 0.4416
##################ITERATION #1 ****************************************
 epoch: 0, train_loss: 1.2940, test_loss: 1.3544, test_f1: 0.1365
 epoch: 1, train_loss: 1.2487, test_loss: 1.3251, test_f1: 0.2281
 epoch: 2, train_loss: 1.2510, test_loss: 1.3069, test_f1: 0.2281
 epoch: 3, train_loss: 1.2522, test_loss: 1.3061, test_f1: 0.2281
 epoch: 4, train_loss: 1.2522, test_loss: 1.3089, test_f1: 0.2281
 epoch: 5, train_loss: 1.2548, test_loss: 1.3029, test_f1: 0.2281
 epoch: 6, train_loss: 1.2538, test_loss: 1.3089, test_f1: 0.2281
 epoch: 7, train_loss: 1.2539, test_loss: 1.3085, test_f1: 0.2281
 epoch: 8, train_loss: 1.2514, test_loss: 1.3040, test_f1: 0.2281
 epoch: 9, train_loss: 1.2519, test_loss: 1.3048, test_f1: 0.2281
 epoch: 10, train_loss: 1.2551, test_loss: 1.3067, test_f1: 0.2281
 epoch: 11, train_loss: 1.2531, test_loss: 1.3059, test_f1: 0.2281
 epoch: 12, train_loss: 1.2534, test_loss: 1.3011, test_f1: 0.2281
 epoch: 13, train_loss: 1.2527, test_loss: 1.3044, test_f1: 0.2281
 epoch: 14, train_loss: 1.2532, test_loss: 1.3072, test_f1: 0.2281
 epoch: 15, train_loss: 1.2525, test_loss: 1.3056, test_f1: 0.2281
 epoch: 16, train_loss: 1.2521, test_loss: 1.3009, test_f1: 0.2281
 epoch: 17, train_loss: 1.2542, test_loss: 1.3058, test_f1: 0.2281
 epoch: 18, train_loss: 1.2521, test_loss: 1.3085, test_f1: 0.2281
 epoch: 19, train_loss: 1.2529, test_loss: 1.3062, test_f1: 0.2281
 epoch: 20, train_loss: 1.2456, test_loss: 1.2946, test_f1: 0.2281
 epoch: 21, train_loss: 1.2230, test_loss: 1.3359, test_f1: 0.2281
 epoch: 22, train_loss: 1.2289, test_loss: 1.3226, test_f1: 0.2281
 epoch: 23, train_loss: 1.2529, test_loss: 1.3091, test_f1: 0.2281
 epoch: 24, train_loss: 1.2530, test_loss: 1.3073, test_f1: 0.2281
 epoch: 25, train_loss: 1.2524, test_loss: 1.3047, test_f1: 0.2281
 epoch: 26, train_loss: 1.2531, test_loss: 1.3044, test_f1: 0.2281
 epoch: 27, train_loss: 1.2549, test_loss: 1.3058, test_f1: 0.2281
 epoch: 28, train_loss: 1.2506, test_loss: 1.3050, test_f1: 0.2281
 epoch: 29, train_loss: 1.2507, test_loss: 1.3051, test_f1: 0.2281
 epoch: 30, train_loss: 1.2498, test_loss: 1.3090, test_f1: 0.2281
 epoch: 31, train_loss: 1.2495, test_loss: 1.3028, test_f1: 0.2281
 epoch: 32, train_loss: 1.2472, test_loss: 1.3074, test_f1: 0.2281
 epoch: 33, train_loss: 1.2475, test_loss: 1.3062, test_f1: 0.2281
 epoch: 34, train_loss: 1.2513, test_loss: 1.3065, test_f1: 0.2281
 epoch: 35, train_loss: 1.2496, test_loss: 1.3062, test_f1: 0.2281
 epoch: 36, train_loss: 1.2487, test_loss: 1.3034, test_f1: 0.2281
 epoch: 37, train_loss: 1.2510, test_loss: 1.3060, test_f1: 0.2281
 epoch: 38, train_loss: 1.2480, test_loss: 1.3073, test_f1: 0.2281
 epoch: 39, train_loss: 1.2488, test_loss: 1.3016, test_f1: 0.2281
 epoch: 40, train_loss: 1.2567, test_loss: 1.3089, test_f1: 0.2281
 epoch: 41, train_loss: 1.2531, test_loss: 1.3061, test_f1: 0.2281
 epoch: 42, train_loss: 1.2562, test_loss: 1.3048, test_f1: 0.2281
 epoch: 43, train_loss: 1.2541, test_loss: 1.3058, test_f1: 0.2281
 epoch: 44, train_loss: 1.2521, test_loss: 1.3068, test_f1: 0.2281
 epoch: 45, train_loss: 1.2552, test_loss: 1.3044, test_f1: 0.2281
 epoch: 46, train_loss: 1.2542, test_loss: 1.3051, test_f1: 0.2281
 epoch: 47, train_loss: 1.2537, test_loss: 1.3026, test_f1: 0.2281
 epoch: 48, train_loss: 1.2525, test_loss: 1.3070, test_f1: 0.2281
 epoch: 49, train_loss: 1.2528, test_loss: 1.3058, test_f1: 0.2281
 epoch: 50, train_loss: 1.2518, test_loss: 1.3006, test_f1: 0.2281
 epoch: 51, train_loss: 1.2540, test_loss: 1.3029, test_f1: 0.2281
 epoch: 52, train_loss: 1.2538, test_loss: 1.3096, test_f1: 0.2281
 epoch: 53, train_loss: 1.2527, test_loss: 1.3068, test_f1: 0.2281
 epoch: 54, train_loss: 1.2525, test_loss: 1.3021, test_f1: 0.2281
 epoch: 55, train_loss: 1.2532, test_loss: 1.3028, test_f1: 0.2281
 epoch: 56, train_loss: 1.2526, test_loss: 1.3042, test_f1: 0.2281
 epoch: 57, train_loss: 1.2531, test_loss: 1.3035, test_f1: 0.2281
 epoch: 58, train_loss: 1.2528, test_loss: 1.3037, test_f1: 0.2281
 epoch: 59, train_loss: 1.2529, test_loss: 1.3040, test_f1: 0.2281
 epoch: 60, train_loss: 1.2532, test_loss: 1.3050, test_f1: 0.2281
 epoch: 61, train_loss: 1.2527, test_loss: 1.3024, test_f1: 0.2281
 epoch: 62, train_loss: 1.2522, test_loss: 1.3043, test_f1: 0.2281
 epoch: 63, train_loss: 1.2526, test_loss: 1.3039, test_f1: 0.2281
 epoch: 64, train_loss: 1.2526, test_loss: 1.3078, test_f1: 0.2281
 epoch: 65, train_loss: 1.2532, test_loss: 1.3069, test_f1: 0.2281
 epoch: 66, train_loss: 1.2524, test_loss: 1.3041, test_f1: 0.2281
 epoch: 67, train_loss: 1.2526, test_loss: 1.3050, test_f1: 0.2281
 epoch: 68, train_loss: 1.2525, test_loss: 1.3037, test_f1: 0.2281
 epoch: 69, train_loss: 1.2526, test_loss: 1.3070, test_f1: 0.2281
 epoch: 70, train_loss: 1.2526, test_loss: 1.3036, test_f1: 0.2281
 epoch: 71, train_loss: 1.2527, test_loss: 1.3046, test_f1: 0.2281
 epoch: 72, train_loss: 1.2522, test_loss: 1.3062, test_f1: 0.2281
 epoch: 73, train_loss: 1.2527, test_loss: 1.3062, test_f1: 0.2281
 epoch: 74, train_loss: 1.2523, test_loss: 1.3039, test_f1: 0.2281
 epoch: 75, train_loss: 1.2523, test_loss: 1.3031, test_f1: 0.2281
 epoch: 76, train_loss: 1.2527, test_loss: 1.3034, test_f1: 0.2281
 epoch: 77, train_loss: 1.2525, test_loss: 1.3048, test_f1: 0.2281
 epoch: 78, train_loss: 1.2524, test_loss: 1.3044, test_f1: 0.2281
 epoch: 79, train_loss: 1.2524, test_loss: 1.3040, test_f1: 0.2281
 epoch: 80, train_loss: 1.2525, test_loss: 1.3040, test_f1: 0.2281
 epoch: 81, train_loss: 1.2533, test_loss: 1.3069, test_f1: 0.2281
 epoch: 82, train_loss: 1.2529, test_loss: 1.3058, test_f1: 0.2281
 epoch: 83, train_loss: 1.2528, test_loss: 1.3058, test_f1: 0.2281
 epoch: 84, train_loss: 1.2525, test_loss: 1.3050, test_f1: 0.2281
 epoch: 85, train_loss: 1.2524, test_loss: 1.3065, test_f1: 0.2281
 epoch: 86, train_loss: 1.2521, test_loss: 1.3051, test_f1: 0.2281
 epoch: 87, train_loss: 1.2529, test_loss: 1.3064, test_f1: 0.2281
 epoch: 88, train_loss: 1.2524, test_loss: 1.3036, test_f1: 0.2281
 epoch: 89, train_loss: 1.2524, test_loss: 1.3053, test_f1: 0.2281
 epoch: 90, train_loss: 1.2525, test_loss: 1.3071, test_f1: 0.2281
 epoch: 91, train_loss: 1.2526, test_loss: 1.3044, test_f1: 0.2281
 epoch: 92, train_loss: 1.2523, test_loss: 1.3030, test_f1: 0.2281
 epoch: 93, train_loss: 1.2527, test_loss: 1.3041, test_f1: 0.2281
 epoch: 94, train_loss: 1.2527, test_loss: 1.3043, test_f1: 0.2281
 epoch: 95, train_loss: 1.2529, test_loss: 1.3062, test_f1: 0.2281
 epoch: 96, train_loss: 1.2526, test_loss: 1.3054, test_f1: 0.2281
 epoch: 97, train_loss: 1.2524, test_loss: 1.3055, test_f1: 0.2281
 epoch: 98, train_loss: 1.2524, test_loss: 1.3054, test_f1: 0.2281
 epoch: 99, train_loss: 1.2546, test_loss: 1.3039, test_f1: 0.2281
##################ITERATION #2 ****************************************
 epoch: 0, train_loss: 1.2704, test_loss: 1.3113, test_f1: 0.2281
 epoch: 1, train_loss: 1.2544, test_loss: 1.3008, test_f1: 0.2281
 epoch: 2, train_loss: 1.2545, test_loss: 1.3087, test_f1: 0.2281
 epoch: 3, train_loss: 1.2568, test_loss: 1.3015, test_f1: 0.2281
 epoch: 4, train_loss: 1.2543, test_loss: 1.3081, test_f1: 0.2281
 epoch: 5, train_loss: 1.2544, test_loss: 1.3063, test_f1: 0.2281
 epoch: 6, train_loss: 1.2522, test_loss: 1.3019, test_f1: 0.2281
 epoch: 7, train_loss: 1.2529, test_loss: 1.3043, test_f1: 0.2281
 epoch: 8, train_loss: 1.2539, test_loss: 1.3063, test_f1: 0.2281
 epoch: 9, train_loss: 1.2555, test_loss: 1.3054, test_f1: 0.2281
 epoch: 10, train_loss: 1.2562, test_loss: 1.3034, test_f1: 0.2281
 epoch: 11, train_loss: 1.2524, test_loss: 1.3050, test_f1: 0.2281
 epoch: 12, train_loss: 1.2531, test_loss: 1.3048, test_f1: 0.2281
 epoch: 13, train_loss: 1.2537, test_loss: 1.3049, test_f1: 0.2281
 epoch: 14, train_loss: 1.2529, test_loss: 1.3045, test_f1: 0.2281
 epoch: 15, train_loss: 1.2529, test_loss: 1.3055, test_f1: 0.2281
 epoch: 16, train_loss: 1.2534, test_loss: 1.3024, test_f1: 0.2281
 epoch: 17, train_loss: 1.2526, test_loss: 1.3041, test_f1: 0.2281
 epoch: 18, train_loss: 1.2551, test_loss: 1.3029, test_f1: 0.2281
 epoch: 19, train_loss: 1.2533, test_loss: 1.3043, test_f1: 0.2281
 epoch: 20, train_loss: 1.2554, test_loss: 1.3022, test_f1: 0.2281
 epoch: 21, train_loss: 1.2529, test_loss: 1.3088, test_f1: 0.2281
 epoch: 22, train_loss: 1.2538, test_loss: 1.3048, test_f1: 0.2281
 epoch: 23, train_loss: 1.2526, test_loss: 1.3038, test_f1: 0.2281
 epoch: 24, train_loss: 1.2531, test_loss: 1.3045, test_f1: 0.2281
 epoch: 25, train_loss: 1.2525, test_loss: 1.3051, test_f1: 0.2281
 epoch: 26, train_loss: 1.2533, test_loss: 1.3077, test_f1: 0.2281
 epoch: 27, train_loss: 1.2530, test_loss: 1.3044, test_f1: 0.2281
 epoch: 28, train_loss: 1.2529, test_loss: 1.3056, test_f1: 0.2281
 epoch: 29, train_loss: 1.2526, test_loss: 1.3074, test_f1: 0.2281
 epoch: 30, train_loss: 1.2557, test_loss: 1.3068, test_f1: 0.2281
 epoch: 31, train_loss: 1.2531, test_loss: 1.3038, test_f1: 0.2281
 epoch: 32, train_loss: 1.2535, test_loss: 1.3057, test_f1: 0.2281
 epoch: 33, train_loss: 1.2539, test_loss: 1.3081, test_f1: 0.2281
 epoch: 34, train_loss: 1.2522, test_loss: 1.3038, test_f1: 0.2281
 epoch: 35, train_loss: 1.2530, test_loss: 1.3039, test_f1: 0.2281
 epoch: 36, train_loss: 1.2536, test_loss: 1.3052, test_f1: 0.2281
 epoch: 37, train_loss: 1.2531, test_loss: 1.3048, test_f1: 0.2281
 epoch: 38, train_loss: 1.2538, test_loss: 1.3072, test_f1: 0.2281
 epoch: 39, train_loss: 1.2546, test_loss: 1.3064, test_f1: 0.2281
 epoch: 40, train_loss: 1.2529, test_loss: 1.3049, test_f1: 0.2281
 epoch: 41, train_loss: 1.2529, test_loss: 1.3056, test_f1: 0.2281
 epoch: 42, train_loss: 1.2529, test_loss: 1.3043, test_f1: 0.2281
 epoch: 43, train_loss: 1.2530, test_loss: 1.3051, test_f1: 0.2281
 epoch: 44, train_loss: 1.2546, test_loss: 1.3069, test_f1: 0.2281
 epoch: 45, train_loss: 1.2564, test_loss: 1.3104, test_f1: 0.2281
 epoch: 46, train_loss: 1.2555, test_loss: 1.3005, test_f1: 0.2281
 epoch: 47, train_loss: 1.2539, test_loss: 1.3043, test_f1: 0.2281
 epoch: 48, train_loss: 1.2539, test_loss: 1.3056, test_f1: 0.2281
 epoch: 49, train_loss: 1.2533, test_loss: 1.3016, test_f1: 0.2281
 epoch: 50, train_loss: 1.2537, test_loss: 1.3024, test_f1: 0.2281
 epoch: 51, train_loss: 1.2528, test_loss: 1.3050, test_f1: 0.2281
 epoch: 52, train_loss: 1.2521, test_loss: 1.3039, test_f1: 0.2281
 epoch: 53, train_loss: 1.2523, test_loss: 1.3038, test_f1: 0.2281
 epoch: 54, train_loss: 1.2526, test_loss: 1.3038, test_f1: 0.2281
 epoch: 55, train_loss: 1.2526, test_loss: 1.3040, test_f1: 0.2281
 epoch: 56, train_loss: 1.2527, test_loss: 1.3040, test_f1: 0.2281
 epoch: 57, train_loss: 1.2534, test_loss: 1.3038, test_f1: 0.2281
 epoch: 58, train_loss: 1.2524, test_loss: 1.3046, test_f1: 0.2281
 epoch: 59, train_loss: 1.2521, test_loss: 1.3065, test_f1: 0.2281
 epoch: 60, train_loss: 1.2524, test_loss: 1.3072, test_f1: 0.2281
 epoch: 61, train_loss: 1.2526, test_loss: 1.3034, test_f1: 0.2281
 epoch: 62, train_loss: 1.2524, test_loss: 1.3059, test_f1: 0.2281
 epoch: 63, train_loss: 1.2526, test_loss: 1.3055, test_f1: 0.2281
 epoch: 64, train_loss: 1.2532, test_loss: 1.3042, test_f1: 0.2281
 epoch: 65, train_loss: 1.2526, test_loss: 1.3050, test_f1: 0.2281
 epoch: 66, train_loss: 1.2532, test_loss: 1.3044, test_f1: 0.2281
 epoch: 67, train_loss: 1.2525, test_loss: 1.3053, test_f1: 0.2281
 epoch: 68, train_loss: 1.2526, test_loss: 1.3037, test_f1: 0.2281
 epoch: 69, train_loss: 1.2524, test_loss: 1.3044, test_f1: 0.2281
 epoch: 70, train_loss: 1.2528, test_loss: 1.3049, test_f1: 0.2281
 epoch: 71, train_loss: 1.2521, test_loss: 1.3054, test_f1: 0.2281
 epoch: 72, train_loss: 1.2526, test_loss: 1.3063, test_f1: 0.2281
 epoch: 73, train_loss: 1.2530, test_loss: 1.3061, test_f1: 0.2281
 epoch: 74, train_loss: 1.2537, test_loss: 1.3041, test_f1: 0.2281
 epoch: 75, train_loss: 1.2526, test_loss: 1.3039, test_f1: 0.2281
 epoch: 76, train_loss: 1.2537, test_loss: 1.3042, test_f1: 0.2281
 epoch: 77, train_loss: 1.2538, test_loss: 1.3047, test_f1: 0.2281
 epoch: 78, train_loss: 1.2529, test_loss: 1.3048, test_f1: 0.2281
 epoch: 79, train_loss: 1.2522, test_loss: 1.3063, test_f1: 0.2281
 epoch: 80, train_loss: 1.2528, test_loss: 1.3068, test_f1: 0.2281
 epoch: 81, train_loss: 1.2532, test_loss: 1.3027, test_f1: 0.2281
 epoch: 82, train_loss: 1.2525, test_loss: 1.3048, test_f1: 0.2281
 epoch: 83, train_loss: 1.2532, test_loss: 1.3029, test_f1: 0.2281
 epoch: 84, train_loss: 1.2525, test_loss: 1.3048, test_f1: 0.2281
 epoch: 85, train_loss: 1.2527, test_loss: 1.3059, test_f1: 0.2281
 epoch: 86, train_loss: 1.2526, test_loss: 1.3053, test_f1: 0.2281
 epoch: 87, train_loss: 1.2525, test_loss: 1.3028, test_f1: 0.2281
 epoch: 88, train_loss: 1.2525, test_loss: 1.3033, test_f1: 0.2281
 epoch: 89, train_loss: 1.2527, test_loss: 1.3059, test_f1: 0.2281
 epoch: 90, train_loss: 1.2521, test_loss: 1.3045, test_f1: 0.2281
 epoch: 91, train_loss: 1.2526, test_loss: 1.3051, test_f1: 0.2281
 epoch: 92, train_loss: 1.2527, test_loss: 1.3044, test_f1: 0.2281
 epoch: 93, train_loss: 1.2522, test_loss: 1.3045, test_f1: 0.2281
 epoch: 94, train_loss: 1.2525, test_loss: 1.3047, test_f1: 0.2281
 epoch: 95, train_loss: 1.2525, test_loss: 1.3047, test_f1: 0.2281
 epoch: 96, train_loss: 1.2522, test_loss: 1.3037, test_f1: 0.2281
 epoch: 97, train_loss: 1.2528, test_loss: 1.3033, test_f1: 0.2281
 epoch: 98, train_loss: 1.2527, test_loss: 1.3039, test_f1: 0.2281
 epoch: 99, train_loss: 1.2527, test_loss: 1.3047, test_f1: 0.2281
##################ITERATION #3 ****************************************
 epoch: 0, train_loss: 1.2567, test_loss: 1.3020, test_f1: 0.2281
 epoch: 1, train_loss: 1.2552, test_loss: 1.3039, test_f1: 0.2281
 epoch: 2, train_loss: 1.2532, test_loss: 1.3044, test_f1: 0.2281
 epoch: 3, train_loss: 1.2535, test_loss: 1.3055, test_f1: 0.2281
 epoch: 4, train_loss: 1.2522, test_loss: 1.3061, test_f1: 0.2281
 epoch: 5, train_loss: 1.2527, test_loss: 1.3050, test_f1: 0.2281
 epoch: 6, train_loss: 1.2530, test_loss: 1.3074, test_f1: 0.2281
 epoch: 7, train_loss: 1.2540, test_loss: 1.3055, test_f1: 0.2281
 epoch: 8, train_loss: 1.2525, test_loss: 1.3053, test_f1: 0.2281
 epoch: 9, train_loss: 1.2546, test_loss: 1.3067, test_f1: 0.2281
 epoch: 10, train_loss: 1.2532, test_loss: 1.3071, test_f1: 0.2281
 epoch: 11, train_loss: 1.2526, test_loss: 1.3037, test_f1: 0.2281
 epoch: 12, train_loss: 1.2531, test_loss: 1.3058, test_f1: 0.2281
 epoch: 13, train_loss: 1.2530, test_loss: 1.3041, test_f1: 0.2281
 epoch: 14, train_loss: 1.2552, test_loss: 1.3122, test_f1: 0.2281
 epoch: 15, train_loss: 1.2541, test_loss: 1.2996, test_f1: 0.2281
 epoch: 16, train_loss: 1.2542, test_loss: 1.3091, test_f1: 0.2281
 epoch: 17, train_loss: 1.2543, test_loss: 1.3080, test_f1: 0.2281
 epoch: 18, train_loss: 1.2527, test_loss: 1.3057, test_f1: 0.2281
 epoch: 19, train_loss: 1.2528, test_loss: 1.3026, test_f1: 0.2281
 epoch: 20, train_loss: 1.2544, test_loss: 1.3086, test_f1: 0.2281
 epoch: 21, train_loss: 1.2541, test_loss: 1.3028, test_f1: 0.2281
 epoch: 22, train_loss: 1.2548, test_loss: 1.3053, test_f1: 0.2281
 epoch: 23, train_loss: 1.2560, test_loss: 1.3054, test_f1: 0.2281
 epoch: 24, train_loss: 1.2546, test_loss: 1.3043, test_f1: 0.2281
 epoch: 25, train_loss: 1.2539, test_loss: 1.3090, test_f1: 0.2281
 epoch: 26, train_loss: 1.2531, test_loss: 1.3029, test_f1: 0.2281
 epoch: 27, train_loss: 1.2526, test_loss: 1.3063, test_f1: 0.2281
 epoch: 28, train_loss: 1.2533, test_loss: 1.3047, test_f1: 0.2281
 epoch: 29, train_loss: 1.2545, test_loss: 1.3082, test_f1: 0.2281
 epoch: 30, train_loss: 1.2530, test_loss: 1.3014, test_f1: 0.2281
 epoch: 31, train_loss: 1.2529, test_loss: 1.3076, test_f1: 0.2281
 epoch: 32, train_loss: 1.2531, test_loss: 1.3074, test_f1: 0.2281
 epoch: 33, train_loss: 1.2534, test_loss: 1.3023, test_f1: 0.2281
 epoch: 34, train_loss: 1.2525, test_loss: 1.3042, test_f1: 0.2281
 epoch: 35, train_loss: 1.2526, test_loss: 1.3075, test_f1: 0.2281
 epoch: 36, train_loss: 1.2538, test_loss: 1.3052, test_f1: 0.2281
 epoch: 37, train_loss: 1.2544, test_loss: 1.3036, test_f1: 0.2281
 epoch: 38, train_loss: 1.2530, test_loss: 1.3040, test_f1: 0.2281
 epoch: 39, train_loss: 1.2524, test_loss: 1.3065, test_f1: 0.2281
 epoch: 40, train_loss: 1.2543, test_loss: 1.3111, test_f1: 0.2281
 epoch: 41, train_loss: 1.2546, test_loss: 1.3002, test_f1: 0.2281
 epoch: 42, train_loss: 1.2534, test_loss: 1.3060, test_f1: 0.2281
 epoch: 43, train_loss: 1.2528, test_loss: 1.3054, test_f1: 0.2281
 epoch: 44, train_loss: 1.2529, test_loss: 1.3063, test_f1: 0.2281
 epoch: 45, train_loss: 1.2521, test_loss: 1.3042, test_f1: 0.2281
 epoch: 46, train_loss: 1.2527, test_loss: 1.3062, test_f1: 0.2281
 epoch: 47, train_loss: 1.2531, test_loss: 1.3071, test_f1: 0.2281
 epoch: 48, train_loss: 1.2534, test_loss: 1.3052, test_f1: 0.2281
 epoch: 49, train_loss: 1.2532, test_loss: 1.3023, test_f1: 0.2281
 epoch: 50, train_loss: 1.2529, test_loss: 1.3049, test_f1: 0.2281
 epoch: 51, train_loss: 1.2525, test_loss: 1.3069, test_f1: 0.2281
 epoch: 52, train_loss: 1.2524, test_loss: 1.3040, test_f1: 0.2281
 epoch: 53, train_loss: 1.2533, test_loss: 1.3066, test_f1: 0.2281
 epoch: 54, train_loss: 1.2525, test_loss: 1.3047, test_f1: 0.2281
 epoch: 55, train_loss: 1.2524, test_loss: 1.3045, test_f1: 0.2281
 epoch: 56, train_loss: 1.2534, test_loss: 1.3043, test_f1: 0.2281
 epoch: 57, train_loss: 1.2529, test_loss: 1.3031, test_f1: 0.2281
 epoch: 58, train_loss: 1.2530, test_loss: 1.3060, test_f1: 0.2281
 epoch: 59, train_loss: 1.2526, test_loss: 1.3049, test_f1: 0.2281
 epoch: 60, train_loss: 1.2527, test_loss: 1.3042, test_f1: 0.2281
 epoch: 61, train_loss: 1.2523, test_loss: 1.3039, test_f1: 0.2281
 epoch: 62, train_loss: 1.2526, test_loss: 1.3040, test_f1: 0.2281
 epoch: 63, train_loss: 1.2526, test_loss: 1.3064, test_f1: 0.2281
 epoch: 64, train_loss: 1.2527, test_loss: 1.3039, test_f1: 0.2281
 epoch: 65, train_loss: 1.2526, test_loss: 1.3039, test_f1: 0.2281
 epoch: 66, train_loss: 1.2527, test_loss: 1.3084, test_f1: 0.2281
 epoch: 67, train_loss: 1.2533, test_loss: 1.3085, test_f1: 0.2281
 epoch: 68, train_loss: 1.2526, test_loss: 1.3057, test_f1: 0.2281
 epoch: 69, train_loss: 1.2523, test_loss: 1.3033, test_f1: 0.2281
 epoch: 70, train_loss: 1.2526, test_loss: 1.3031, test_f1: 0.2281
 epoch: 71, train_loss: 1.2527, test_loss: 1.3048, test_f1: 0.2281
 epoch: 72, train_loss: 1.2524, test_loss: 1.3041, test_f1: 0.2281
 epoch: 73, train_loss: 1.2524, test_loss: 1.3048, test_f1: 0.2281
 epoch: 74, train_loss: 1.2530, test_loss: 1.3050, test_f1: 0.2281
 epoch: 75, train_loss: 1.2523, test_loss: 1.3054, test_f1: 0.2281
 epoch: 76, train_loss: 1.2527, test_loss: 1.3049, test_f1: 0.2281
 epoch: 77, train_loss: 1.2522, test_loss: 1.3058, test_f1: 0.2281
 epoch: 78, train_loss: 1.2526, test_loss: 1.3041, test_f1: 0.2281
 epoch: 79, train_loss: 1.2526, test_loss: 1.3033, test_f1: 0.2281
 epoch: 80, train_loss: 1.2528, test_loss: 1.3059, test_f1: 0.2281
 epoch: 81, train_loss: 1.2527, test_loss: 1.3066, test_f1: 0.2281
 epoch: 82, train_loss: 1.2524, test_loss: 1.3069, test_f1: 0.2281
 epoch: 83, train_loss: 1.2526, test_loss: 1.3042, test_f1: 0.2281
 epoch: 84, train_loss: 1.2525, test_loss: 1.3026, test_f1: 0.2281
 epoch: 85, train_loss: 1.2524, test_loss: 1.3031, test_f1: 0.2281
 epoch: 86, train_loss: 1.2523, test_loss: 1.3043, test_f1: 0.2281
 epoch: 87, train_loss: 1.2531, test_loss: 1.3050, test_f1: 0.2281
 epoch: 88, train_loss: 1.2534, test_loss: 1.3029, test_f1: 0.2281
 epoch: 89, train_loss: 1.2530, test_loss: 1.3096, test_f1: 0.2281
 epoch: 90, train_loss: 1.2528, test_loss: 1.3073, test_f1: 0.2281
 epoch: 91, train_loss: 1.2527, test_loss: 1.3041, test_f1: 0.2281
 epoch: 92, train_loss: 1.2527, test_loss: 1.3032, test_f1: 0.2281
 epoch: 93, train_loss: 1.2530, test_loss: 1.3071, test_f1: 0.2281
 epoch: 94, train_loss: 1.2534, test_loss: 1.3041, test_f1: 0.2281
 epoch: 95, train_loss: 1.2524, test_loss: 1.3064, test_f1: 0.2281
 epoch: 96, train_loss: 1.2527, test_loss: 1.3066, test_f1: 0.2281
 epoch: 97, train_loss: 1.2531, test_loss: 1.3031, test_f1: 0.2281
 epoch: 98, train_loss: 1.2531, test_loss: 1.3078, test_f1: 0.2281
 epoch: 99, train_loss: 1.2535, test_loss: 1.3041, test_f1: 0.2281
##################ITERATION #4 ****************************************
 epoch: 0, train_loss: 1.2615, test_loss: 1.3096, test_f1: 0.1365
 epoch: 1, train_loss: 1.2570, test_loss: 1.3037, test_f1: 0.2281
 epoch: 2, train_loss: 1.2538, test_loss: 1.3054, test_f1: 0.2281
 epoch: 3, train_loss: 1.2530, test_loss: 1.3061, test_f1: 0.2281
 epoch: 4, train_loss: 1.2533, test_loss: 1.3048, test_f1: 0.2281
 epoch: 5, train_loss: 1.2539, test_loss: 1.3070, test_f1: 0.2281
 epoch: 6, train_loss: 1.2544, test_loss: 1.3054, test_f1: 0.2281
 epoch: 7, train_loss: 1.2534, test_loss: 1.3055, test_f1: 0.2281
 epoch: 8, train_loss: 1.2531, test_loss: 1.3005, test_f1: 0.2281
 epoch: 9, train_loss: 1.2528, test_loss: 1.3100, test_f1: 0.2281
 epoch: 10, train_loss: 1.2536, test_loss: 1.3061, test_f1: 0.2281
 epoch: 11, train_loss: 1.2535, test_loss: 1.3037, test_f1: 0.2281
 epoch: 12, train_loss: 1.2547, test_loss: 1.3023, test_f1: 0.2281
 epoch: 13, train_loss: 1.2531, test_loss: 1.3052, test_f1: 0.2281
 epoch: 14, train_loss: 1.2539, test_loss: 1.3040, test_f1: 0.2281
 epoch: 15, train_loss: 1.2532, test_loss: 1.3075, test_f1: 0.2281
 epoch: 16, train_loss: 1.2527, test_loss: 1.3038, test_f1: 0.2281
 epoch: 17, train_loss: 1.2536, test_loss: 1.3027, test_f1: 0.2281
 epoch: 18, train_loss: 1.2527, test_loss: 1.3028, test_f1: 0.2281
 epoch: 19, train_loss: 1.2539, test_loss: 1.3059, test_f1: 0.2281
 epoch: 20, train_loss: 1.2539, test_loss: 1.3076, test_f1: 0.2281
 epoch: 21, train_loss: 1.2545, test_loss: 1.3047, test_f1: 0.2281
 epoch: 22, train_loss: 1.2532, test_loss: 1.3041, test_f1: 0.2281
 epoch: 23, train_loss: 1.2541, test_loss: 1.3062, test_f1: 0.2281
 epoch: 24, train_loss: 1.2555, test_loss: 1.3028, test_f1: 0.2281
 epoch: 25, train_loss: 1.2533, test_loss: 1.3047, test_f1: 0.2281
 epoch: 26, train_loss: 1.2534, test_loss: 1.3095, test_f1: 0.2281
 epoch: 27, train_loss: 1.2538, test_loss: 1.3043, test_f1: 0.2281
 epoch: 28, train_loss: 1.2545, test_loss: 1.3052, test_f1: 0.2281
 epoch: 29, train_loss: 1.2534, test_loss: 1.3089, test_f1: 0.2281
 epoch: 30, train_loss: 1.2543, test_loss: 1.3010, test_f1: 0.2281
 epoch: 31, train_loss: 1.2537, test_loss: 1.3054, test_f1: 0.2281
 epoch: 32, train_loss: 1.2533, test_loss: 1.3057, test_f1: 0.2281
 epoch: 33, train_loss: 1.2549, test_loss: 1.3096, test_f1: 0.2281
 epoch: 34, train_loss: 1.2527, test_loss: 1.3046, test_f1: 0.2281
 epoch: 35, train_loss: 1.2537, test_loss: 1.3016, test_f1: 0.2281
 epoch: 36, train_loss: 1.2529, test_loss: 1.3053, test_f1: 0.2281
 epoch: 37, train_loss: 1.2526, test_loss: 1.3055, test_f1: 0.2281
 epoch: 38, train_loss: 1.2530, test_loss: 1.3060, test_f1: 0.2281
 epoch: 39, train_loss: 1.2563, test_loss: 1.3079, test_f1: 0.2281
 epoch: 40, train_loss: 1.2520, test_loss: 1.3008, test_f1: 0.2281
 epoch: 41, train_loss: 1.2541, test_loss: 1.3072, test_f1: 0.2281
 epoch: 42, train_loss: 1.2545, test_loss: 1.3063, test_f1: 0.2281
 epoch: 43, train_loss: 1.2532, test_loss: 1.3025, test_f1: 0.2281
 epoch: 44, train_loss: 1.2528, test_loss: 1.3055, test_f1: 0.2281
 epoch: 45, train_loss: 1.2530, test_loss: 1.3070, test_f1: 0.2281
 epoch: 46, train_loss: 1.2534, test_loss: 1.3063, test_f1: 0.2281
 epoch: 47, train_loss: 1.2535, test_loss: 1.2995, test_f1: 0.2281
 epoch: 48, train_loss: 1.2531, test_loss: 1.3071, test_f1: 0.2281
 epoch: 49, train_loss: 1.2528, test_loss: 1.3048, test_f1: 0.2281
 epoch: 50, train_loss: 1.2529, test_loss: 1.3081, test_f1: 0.2281
 epoch: 51, train_loss: 1.2529, test_loss: 1.3077, test_f1: 0.2281
 epoch: 52, train_loss: 1.2533, test_loss: 1.3051, test_f1: 0.2281
 epoch: 53, train_loss: 1.2526, test_loss: 1.3059, test_f1: 0.2281
 epoch: 54, train_loss: 1.2533, test_loss: 1.3056, test_f1: 0.2281
 epoch: 55, train_loss: 1.2527, test_loss: 1.3052, test_f1: 0.2281
 epoch: 56, train_loss: 1.2523, test_loss: 1.3034, test_f1: 0.2281
 epoch: 57, train_loss: 1.2529, test_loss: 1.3072, test_f1: 0.2281
 epoch: 58, train_loss: 1.2528, test_loss: 1.3053, test_f1: 0.2281
 epoch: 59, train_loss: 1.2523, test_loss: 1.3061, test_f1: 0.2281
 epoch: 60, train_loss: 1.2525, test_loss: 1.3054, test_f1: 0.2281
 epoch: 61, train_loss: 1.2528, test_loss: 1.3031, test_f1: 0.2281
 epoch: 62, train_loss: 1.2526, test_loss: 1.3047, test_f1: 0.2281
 epoch: 63, train_loss: 1.2529, test_loss: 1.3062, test_f1: 0.2281
 epoch: 64, train_loss: 1.2527, test_loss: 1.3060, test_f1: 0.2281
 epoch: 65, train_loss: 1.2523, test_loss: 1.3047, test_f1: 0.2281
 epoch: 66, train_loss: 1.2525, test_loss: 1.3037, test_f1: 0.2281
 epoch: 67, train_loss: 1.2525, test_loss: 1.3034, test_f1: 0.2281
 epoch: 68, train_loss: 1.2525, test_loss: 1.3046, test_f1: 0.2281
 epoch: 69, train_loss: 1.2530, test_loss: 1.3038, test_f1: 0.2281
 epoch: 70, train_loss: 1.2521, test_loss: 1.3029, test_f1: 0.2281
 epoch: 71, train_loss: 1.2537, test_loss: 1.3022, test_f1: 0.2281
 epoch: 72, train_loss: 1.2521, test_loss: 1.3045, test_f1: 0.2281
 epoch: 73, train_loss: 1.2526, test_loss: 1.3057, test_f1: 0.2281
 epoch: 74, train_loss: 1.2524, test_loss: 1.3040, test_f1: 0.2281
 epoch: 75, train_loss: 1.2531, test_loss: 1.3030, test_f1: 0.2281
 epoch: 76, train_loss: 1.2519, test_loss: 1.3047, test_f1: 0.2281
 epoch: 77, train_loss: 1.2523, test_loss: 1.3050, test_f1: 0.2281
 epoch: 78, train_loss: 1.2533, test_loss: 1.3055, test_f1: 0.2281
 epoch: 79, train_loss: 1.2524, test_loss: 1.3041, test_f1: 0.2281
 epoch: 80, train_loss: 1.2536, test_loss: 1.3046, test_f1: 0.2281
 epoch: 81, train_loss: 1.2526, test_loss: 1.3066, test_f1: 0.2281
 epoch: 82, train_loss: 1.2531, test_loss: 1.3064, test_f1: 0.2281
 epoch: 83, train_loss: 1.2523, test_loss: 1.3031, test_f1: 0.2281
 epoch: 84, train_loss: 1.2523, test_loss: 1.3048, test_f1: 0.2281
 epoch: 85, train_loss: 1.2529, test_loss: 1.3084, test_f1: 0.2281
 epoch: 86, train_loss: 1.2525, test_loss: 1.3049, test_f1: 0.2281
 epoch: 87, train_loss: 1.2528, test_loss: 1.3046, test_f1: 0.2281
 epoch: 88, train_loss: 1.2527, test_loss: 1.3058, test_f1: 0.2281
 epoch: 89, train_loss: 1.2529, test_loss: 1.3043, test_f1: 0.2281
 epoch: 90, train_loss: 1.2526, test_loss: 1.3054, test_f1: 0.2281
 epoch: 91, train_loss: 1.2524, test_loss: 1.3046, test_f1: 0.2281
 epoch: 92, train_loss: 1.2529, test_loss: 1.3066, test_f1: 0.2281
 epoch: 93, train_loss: 1.2527, test_loss: 1.3038, test_f1: 0.2281
 epoch: 94, train_loss: 1.2527, test_loss: 1.3060, test_f1: 0.2281
 epoch: 95, train_loss: 1.2523, test_loss: 1.3029, test_f1: 0.2281
 epoch: 96, train_loss: 1.2528, test_loss: 1.3037, test_f1: 0.2281
 epoch: 97, train_loss: 1.2523, test_loss: 1.3051, test_f1: 0.2281
 epoch: 98, train_loss: 1.2537, test_loss: 1.3053, test_f1: 0.2281
 epoch: 99, train_loss: 1.2530, test_loss: 1.3034, test_f1: 0.2281
##################ITERATION #5 ****************************************
 epoch: 0, train_loss: 1.2976, test_loss: 1.3025, test_f1: 0.2281
 epoch: 1, train_loss: 1.2559, test_loss: 1.3082, test_f1: 0.2281
 epoch: 2, train_loss: 1.2532, test_loss: 1.3011, test_f1: 0.2281
 epoch: 3, train_loss: 1.2543, test_loss: 1.3035, test_f1: 0.2281
 epoch: 4, train_loss: 1.2567, test_loss: 1.3105, test_f1: 0.2281
 epoch: 5, train_loss: 1.2544, test_loss: 1.3071, test_f1: 0.2281
 epoch: 6, train_loss: 1.2531, test_loss: 1.3030, test_f1: 0.2281
 epoch: 7, train_loss: 1.2538, test_loss: 1.3027, test_f1: 0.2281
 epoch: 8, train_loss: 1.2525, test_loss: 1.3062, test_f1: 0.2281
 epoch: 9, train_loss: 1.2528, test_loss: 1.3049, test_f1: 0.2281
 epoch: 10, train_loss: 1.2553, test_loss: 1.3023, test_f1: 0.2281
 epoch: 11, train_loss: 1.2536, test_loss: 1.3077, test_f1: 0.2281
 epoch: 12, train_loss: 1.2548, test_loss: 1.3032, test_f1: 0.2281
 epoch: 13, train_loss: 1.2533, test_loss: 1.3113, test_f1: 0.2281
 epoch: 14, train_loss: 1.2534, test_loss: 1.3048, test_f1: 0.2281
 epoch: 15, train_loss: 1.2524, test_loss: 1.3030, test_f1: 0.2281
 epoch: 16, train_loss: 1.2536, test_loss: 1.3019, test_f1: 0.2281
 epoch: 17, train_loss: 1.2530, test_loss: 1.3077, test_f1: 0.2281
 epoch: 18, train_loss: 1.2536, test_loss: 1.3060, test_f1: 0.2281
 epoch: 19, train_loss: 1.2539, test_loss: 1.3051, test_f1: 0.2281
 epoch: 20, train_loss: 1.2534, test_loss: 1.3017, test_f1: 0.2281
 epoch: 21, train_loss: 1.2545, test_loss: 1.3085, test_f1: 0.2281
 epoch: 22, train_loss: 1.2540, test_loss: 1.3071, test_f1: 0.2281
 epoch: 23, train_loss: 1.2535, test_loss: 1.3017, test_f1: 0.2281
 epoch: 24, train_loss: 1.2525, test_loss: 1.3096, test_f1: 0.2281
 epoch: 25, train_loss: 1.2537, test_loss: 1.3030, test_f1: 0.2281
 epoch: 26, train_loss: 1.2553, test_loss: 1.3034, test_f1: 0.2281
 epoch: 27, train_loss: 1.2535, test_loss: 1.3044, test_f1: 0.2281
 epoch: 28, train_loss: 1.2529, test_loss: 1.3022, test_f1: 0.2281
 epoch: 29, train_loss: 1.2529, test_loss: 1.3071, test_f1: 0.2281
 epoch: 30, train_loss: 1.2536, test_loss: 1.3066, test_f1: 0.2281
 epoch: 31, train_loss: 1.2542, test_loss: 1.3031, test_f1: 0.2281
 epoch: 32, train_loss: 1.2536, test_loss: 1.3075, test_f1: 0.2281
 epoch: 33, train_loss: 1.2521, test_loss: 1.3049, test_f1: 0.2281
 epoch: 34, train_loss: 1.2543, test_loss: 1.3025, test_f1: 0.2281
 epoch: 35, train_loss: 1.2521, test_loss: 1.3062, test_f1: 0.2281
 epoch: 36, train_loss: 1.2531, test_loss: 1.3059, test_f1: 0.2281
 epoch: 37, train_loss: 1.2559, test_loss: 1.3035, test_f1: 0.2281
 epoch: 38, train_loss: 1.2546, test_loss: 1.3066, test_f1: 0.2281
 epoch: 39, train_loss: 1.2524, test_loss: 1.3076, test_f1: 0.2281
 epoch: 40, train_loss: 1.2530, test_loss: 1.3048, test_f1: 0.2281
 epoch: 41, train_loss: 1.2539, test_loss: 1.3018, test_f1: 0.2281
 epoch: 42, train_loss: 1.2531, test_loss: 1.3046, test_f1: 0.2281
 epoch: 43, train_loss: 1.2540, test_loss: 1.3054, test_f1: 0.2281
 epoch: 44, train_loss: 1.2532, test_loss: 1.3082, test_f1: 0.2281
 epoch: 45, train_loss: 1.2524, test_loss: 1.3037, test_f1: 0.2281
 epoch: 46, train_loss: 1.2528, test_loss: 1.3027, test_f1: 0.2281
 epoch: 47, train_loss: 1.2526, test_loss: 1.3066, test_f1: 0.2281
 epoch: 48, train_loss: 1.2530, test_loss: 1.3096, test_f1: 0.2281
 epoch: 49, train_loss: 1.2531, test_loss: 1.3026, test_f1: 0.2281
 epoch: 50, train_loss: 1.2574, test_loss: 1.3013, test_f1: 0.2281
 epoch: 51, train_loss: 1.2522, test_loss: 1.3063, test_f1: 0.2281
 epoch: 52, train_loss: 1.2528, test_loss: 1.3072, test_f1: 0.2281
 epoch: 53, train_loss: 1.2524, test_loss: 1.3033, test_f1: 0.2281
 epoch: 54, train_loss: 1.2521, test_loss: 1.3055, test_f1: 0.2281
 epoch: 55, train_loss: 1.2524, test_loss: 1.3064, test_f1: 0.2281
 epoch: 56, train_loss: 1.2525, test_loss: 1.3031, test_f1: 0.2281
 epoch: 57, train_loss: 1.2526, test_loss: 1.3025, test_f1: 0.2281
 epoch: 58, train_loss: 1.2526, test_loss: 1.3050, test_f1: 0.2281
 epoch: 59, train_loss: 1.2525, test_loss: 1.3042, test_f1: 0.2281
 epoch: 60, train_loss: 1.2523, test_loss: 1.3017, test_f1: 0.2281
 epoch: 61, train_loss: 1.2532, test_loss: 1.3036, test_f1: 0.2281
 epoch: 62, train_loss: 1.2536, test_loss: 1.3098, test_f1: 0.2281
 epoch: 63, train_loss: 1.2532, test_loss: 1.3038, test_f1: 0.2281
 epoch: 64, train_loss: 1.2525, test_loss: 1.3071, test_f1: 0.2281
 epoch: 65, train_loss: 1.2528, test_loss: 1.3075, test_f1: 0.2281
 epoch: 66, train_loss: 1.2527, test_loss: 1.3037, test_f1: 0.2281
 epoch: 67, train_loss: 1.2526, test_loss: 1.3031, test_f1: 0.2281
 epoch: 68, train_loss: 1.2527, test_loss: 1.3028, test_f1: 0.2281
 epoch: 69, train_loss: 1.2531, test_loss: 1.3070, test_f1: 0.2281
 epoch: 70, train_loss: 1.2522, test_loss: 1.3042, test_f1: 0.2281
 epoch: 71, train_loss: 1.2528, test_loss: 1.3018, test_f1: 0.2281
 epoch: 72, train_loss: 1.2530, test_loss: 1.3038, test_f1: 0.2281
 epoch: 73, train_loss: 1.2535, test_loss: 1.3023, test_f1: 0.2281
 epoch: 74, train_loss: 1.2527, test_loss: 1.3034, test_f1: 0.2281
 epoch: 75, train_loss: 1.2521, test_loss: 1.3049, test_f1: 0.2281
 epoch: 76, train_loss: 1.2533, test_loss: 1.3054, test_f1: 0.2281
 epoch: 77, train_loss: 1.2531, test_loss: 1.3043, test_f1: 0.2281
 epoch: 78, train_loss: 1.2525, test_loss: 1.3037, test_f1: 0.2281
 epoch: 79, train_loss: 1.2534, test_loss: 1.3078, test_f1: 0.2281
 epoch: 80, train_loss: 1.2531, test_loss: 1.3022, test_f1: 0.2281
 epoch: 81, train_loss: 1.2527, test_loss: 1.3066, test_f1: 0.2281
 epoch: 82, train_loss: 1.2527, test_loss: 1.3079, test_f1: 0.2281
 epoch: 83, train_loss: 1.2524, test_loss: 1.3039, test_f1: 0.2281
 epoch: 84, train_loss: 1.2525, test_loss: 1.3047, test_f1: 0.2281
 epoch: 85, train_loss: 1.2542, test_loss: 1.3044, test_f1: 0.2281
 epoch: 86, train_loss: 1.2530, test_loss: 1.3050, test_f1: 0.2281
 epoch: 87, train_loss: 1.2525, test_loss: 1.3044, test_f1: 0.2281
 epoch: 88, train_loss: 1.2524, test_loss: 1.3043, test_f1: 0.2281
 epoch: 89, train_loss: 1.2538, test_loss: 1.3014, test_f1: 0.2281
 epoch: 90, train_loss: 1.2529, test_loss: 1.3059, test_f1: 0.2281
 epoch: 91, train_loss: 1.2541, test_loss: 1.3056, test_f1: 0.2281
 epoch: 92, train_loss: 1.2527, test_loss: 1.3065, test_f1: 0.2281
 epoch: 93, train_loss: 1.2532, test_loss: 1.3059, test_f1: 0.2281
 epoch: 94, train_loss: 1.2529, test_loss: 1.3038, test_f1: 0.2281
 epoch: 95, train_loss: 1.2525, test_loss: 1.3054, test_f1: 0.2281
 epoch: 96, train_loss: 1.2525, test_loss: 1.3067, test_f1: 0.2281
 epoch: 97, train_loss: 1.2526, test_loss: 1.3043, test_f1: 0.2281
 epoch: 98, train_loss: 1.2525, test_loss: 1.3042, test_f1: 0.2281
 epoch: 99, train_loss: 1.2523, test_loss: 1.3056, test_f1: 0.2281
##################ITERATION #6 ****************************************
 epoch: 0, train_loss: 1.2540, test_loss: 1.3070, test_f1: 0.2281
 epoch: 1, train_loss: 1.2624, test_loss: 1.3038, test_f1: 0.2281
 epoch: 2, train_loss: 1.2530, test_loss: 1.3019, test_f1: 0.2281
 epoch: 3, train_loss: 1.2534, test_loss: 1.3037, test_f1: 0.2281
 epoch: 4, train_loss: 1.2527, test_loss: 1.3055, test_f1: 0.2281
 epoch: 5, train_loss: 1.2541, test_loss: 1.3057, test_f1: 0.2281
 epoch: 6, train_loss: 1.2533, test_loss: 1.3046, test_f1: 0.2281
 epoch: 7, train_loss: 1.2537, test_loss: 1.3063, test_f1: 0.2281
 epoch: 8, train_loss: 1.2544, test_loss: 1.3073, test_f1: 0.2281
 epoch: 9, train_loss: 1.2531, test_loss: 1.3013, test_f1: 0.2281
 epoch: 10, train_loss: 1.2541, test_loss: 1.3070, test_f1: 0.2281
 epoch: 11, train_loss: 1.2533, test_loss: 1.3022, test_f1: 0.2281
 epoch: 12, train_loss: 1.2530, test_loss: 1.3065, test_f1: 0.2281
 epoch: 13, train_loss: 1.2543, test_loss: 1.3084, test_f1: 0.2281
 epoch: 14, train_loss: 1.2534, test_loss: 1.3050, test_f1: 0.2281
 epoch: 15, train_loss: 1.2547, test_loss: 1.3012, test_f1: 0.2281
 epoch: 16, train_loss: 1.2542, test_loss: 1.3046, test_f1: 0.2281
 epoch: 17, train_loss: 1.2537, test_loss: 1.3040, test_f1: 0.2281
 epoch: 18, train_loss: 1.2531, test_loss: 1.3040, test_f1: 0.2281
 epoch: 19, train_loss: 1.2532, test_loss: 1.3023, test_f1: 0.2281
 epoch: 20, train_loss: 1.2532, test_loss: 1.3070, test_f1: 0.2281
 epoch: 21, train_loss: 1.2527, test_loss: 1.3046, test_f1: 0.2281
 epoch: 22, train_loss: 1.2557, test_loss: 1.3043, test_f1: 0.2281
 epoch: 23, train_loss: 1.2523, test_loss: 1.3083, test_f1: 0.2281
 epoch: 24, train_loss: 1.2527, test_loss: 1.3018, test_f1: 0.2281
 epoch: 25, train_loss: 1.2543, test_loss: 1.3043, test_f1: 0.2281
 epoch: 26, train_loss: 1.2556, test_loss: 1.3074, test_f1: 0.2281
 epoch: 27, train_loss: 1.2548, test_loss: 1.3011, test_f1: 0.2281
 epoch: 28, train_loss: 1.2536, test_loss: 1.3059, test_f1: 0.2281
 epoch: 29, train_loss: 1.2534, test_loss: 1.3026, test_f1: 0.2281
 epoch: 30, train_loss: 1.2560, test_loss: 1.3055, test_f1: 0.2281
 epoch: 31, train_loss: 1.2521, test_loss: 1.3045, test_f1: 0.2281
 epoch: 32, train_loss: 1.2544, test_loss: 1.3049, test_f1: 0.2281
 epoch: 33, train_loss: 1.2536, test_loss: 1.3027, test_f1: 0.2281
 epoch: 34, train_loss: 1.2591, test_loss: 1.3097, test_f1: 0.2281
 epoch: 35, train_loss: 1.2663, test_loss: 1.3070, test_f1: 0.2281
 epoch: 36, train_loss: 1.4217, test_loss: 1.3035, test_f1: 0.2281
 epoch: 37, train_loss: 1.2697, test_loss: 1.3007, test_f1: 0.2281
 epoch: 38, train_loss: 1.2531, test_loss: 1.3071, test_f1: 0.2281
 epoch: 39, train_loss: 1.2530, test_loss: 1.3030, test_f1: 0.2281
 epoch: 40, train_loss: 1.2527, test_loss: 1.3051, test_f1: 0.2281
 epoch: 41, train_loss: 1.2544, test_loss: 1.3073, test_f1: 0.2281
 epoch: 42, train_loss: 1.2534, test_loss: 1.3021, test_f1: 0.2281
 epoch: 43, train_loss: 1.2547, test_loss: 1.3099, test_f1: 0.2281
 epoch: 44, train_loss: 1.2536, test_loss: 1.3007, test_f1: 0.2281
 epoch: 45, train_loss: 1.2538, test_loss: 1.3079, test_f1: 0.2281
 epoch: 46, train_loss: 1.2537, test_loss: 1.3024, test_f1: 0.2281
 epoch: 47, train_loss: 1.2539, test_loss: 1.3074, test_f1: 0.2281
 epoch: 48, train_loss: 1.2546, test_loss: 1.3011, test_f1: 0.2281
 epoch: 49, train_loss: 1.2529, test_loss: 1.3064, test_f1: 0.2281
 epoch: 50, train_loss: 1.2553, test_loss: 1.3045, test_f1: 0.2281
 epoch: 51, train_loss: 1.2527, test_loss: 1.3048, test_f1: 0.2281
 epoch: 52, train_loss: 1.2530, test_loss: 1.3047, test_f1: 0.2281
 epoch: 53, train_loss: 1.2522, test_loss: 1.3033, test_f1: 0.2281
 epoch: 54, train_loss: 1.2525, test_loss: 1.3049, test_f1: 0.2281
 epoch: 55, train_loss: 1.2524, test_loss: 1.3059, test_f1: 0.2281
 epoch: 56, train_loss: 1.2530, test_loss: 1.3061, test_f1: 0.2281
 epoch: 57, train_loss: 1.2522, test_loss: 1.3026, test_f1: 0.2281
 epoch: 58, train_loss: 1.2523, test_loss: 1.3027, test_f1: 0.2281
 epoch: 59, train_loss: 1.2534, test_loss: 1.3038, test_f1: 0.2281
 epoch: 60, train_loss: 1.2522, test_loss: 1.3054, test_f1: 0.2281
 epoch: 61, train_loss: 1.2531, test_loss: 1.3069, test_f1: 0.2281
 epoch: 62, train_loss: 1.2524, test_loss: 1.3030, test_f1: 0.2281
 epoch: 63, train_loss: 1.2528, test_loss: 1.3034, test_f1: 0.2281
 epoch: 64, train_loss: 1.2527, test_loss: 1.3052, test_f1: 0.2281
 epoch: 65, train_loss: 1.2523, test_loss: 1.3057, test_f1: 0.2281
 epoch: 66, train_loss: 1.2526, test_loss: 1.3051, test_f1: 0.2281
 epoch: 67, train_loss: 1.2521, test_loss: 1.3042, test_f1: 0.2281
 epoch: 68, train_loss: 1.2523, test_loss: 1.3031, test_f1: 0.2281
 epoch: 69, train_loss: 1.2523, test_loss: 1.3038, test_f1: 0.2281
 epoch: 70, train_loss: 1.2526, test_loss: 1.3042, test_f1: 0.2281
 epoch: 71, train_loss: 1.2528, test_loss: 1.3042, test_f1: 0.2281
 epoch: 72, train_loss: 1.2530, test_loss: 1.3045, test_f1: 0.2281
 epoch: 73, train_loss: 1.2524, test_loss: 1.3059, test_f1: 0.2281
 epoch: 74, train_loss: 1.2524, test_loss: 1.3039, test_f1: 0.2281
 epoch: 75, train_loss: 1.2525, test_loss: 1.3033, test_f1: 0.2281
 epoch: 76, train_loss: 1.2524, test_loss: 1.3041, test_f1: 0.2281
 epoch: 77, train_loss: 1.2525, test_loss: 1.3043, test_f1: 0.2281
 epoch: 78, train_loss: 1.2523, test_loss: 1.3038, test_f1: 0.2281
 epoch: 79, train_loss: 1.2520, test_loss: 1.3056, test_f1: 0.2281
 epoch: 80, train_loss: 1.2525, test_loss: 1.3069, test_f1: 0.2281
 epoch: 81, train_loss: 1.2532, test_loss: 1.3062, test_f1: 0.2281
 epoch: 82, train_loss: 1.2533, test_loss: 1.3039, test_f1: 0.2281
 epoch: 83, train_loss: 1.2530, test_loss: 1.3062, test_f1: 0.2281
 epoch: 84, train_loss: 1.2531, test_loss: 1.3028, test_f1: 0.2281
 epoch: 85, train_loss: 1.2527, test_loss: 1.3062, test_f1: 0.2281
 epoch: 86, train_loss: 1.2542, test_loss: 1.3046, test_f1: 0.2281
 epoch: 87, train_loss: 1.2525, test_loss: 1.3041, test_f1: 0.2281
 epoch: 88, train_loss: 1.2523, test_loss: 1.3052, test_f1: 0.2281
 epoch: 89, train_loss: 1.2523, test_loss: 1.3050, test_f1: 0.2281
 epoch: 90, train_loss: 1.2531, test_loss: 1.3058, test_f1: 0.2281
 epoch: 91, train_loss: 1.2526, test_loss: 1.3044, test_f1: 0.2281
 epoch: 92, train_loss: 1.2523, test_loss: 1.3032, test_f1: 0.2281
 epoch: 93, train_loss: 1.2528, test_loss: 1.3051, test_f1: 0.2281
 epoch: 94, train_loss: 1.2523, test_loss: 1.3042, test_f1: 0.2281
 epoch: 95, train_loss: 1.2527, test_loss: 1.3059, test_f1: 0.2281
 epoch: 96, train_loss: 1.2529, test_loss: 1.3044, test_f1: 0.2281
 epoch: 97, train_loss: 1.2525, test_loss: 1.3041, test_f1: 0.2281
 epoch: 98, train_loss: 1.2529, test_loss: 1.3054, test_f1: 0.2281
 epoch: 99, train_loss: 1.2527, test_loss: 1.3036, test_f1: 0.2281
##################ITERATION #7 ****************************************
 epoch: 0, train_loss: 1.2593, test_loss: 1.2994, test_f1: 0.2281
 epoch: 1, train_loss: 1.2551, test_loss: 1.3075, test_f1: 0.2281
 epoch: 2, train_loss: 1.2533, test_loss: 1.3024, test_f1: 0.2281
 epoch: 3, train_loss: 1.2563, test_loss: 1.3007, test_f1: 0.2281
 epoch: 4, train_loss: 1.2582, test_loss: 1.3054, test_f1: 0.2281
 epoch: 5, train_loss: 1.2550, test_loss: 1.3080, test_f1: 0.2281
 epoch: 6, train_loss: 1.2534, test_loss: 1.3031, test_f1: 0.2281
 epoch: 7, train_loss: 1.2532, test_loss: 1.3061, test_f1: 0.2281
 epoch: 8, train_loss: 1.2528, test_loss: 1.3048, test_f1: 0.2281
 epoch: 9, train_loss: 1.2529, test_loss: 1.3041, test_f1: 0.2281
 epoch: 10, train_loss: 1.2529, test_loss: 1.3059, test_f1: 0.2281
 epoch: 11, train_loss: 1.2540, test_loss: 1.3034, test_f1: 0.2281
 epoch: 12, train_loss: 1.2532, test_loss: 1.3085, test_f1: 0.2281
 epoch: 13, train_loss: 1.2548, test_loss: 1.3093, test_f1: 0.2281
 epoch: 14, train_loss: 1.2540, test_loss: 1.3016, test_f1: 0.2281
 epoch: 15, train_loss: 1.2547, test_loss: 1.3041, test_f1: 0.2281
 epoch: 16, train_loss: 1.2541, test_loss: 1.3054, test_f1: 0.2281
 epoch: 17, train_loss: 1.2525, test_loss: 1.3019, test_f1: 0.2281
 epoch: 18, train_loss: 1.2534, test_loss: 1.3024, test_f1: 0.2281
 epoch: 19, train_loss: 1.2539, test_loss: 1.3065, test_f1: 0.2281
 epoch: 20, train_loss: 1.2528, test_loss: 1.3039, test_f1: 0.2281
 epoch: 21, train_loss: 1.2543, test_loss: 1.3050, test_f1: 0.2281
 epoch: 22, train_loss: 1.2528, test_loss: 1.3032, test_f1: 0.2281
 epoch: 23, train_loss: 1.2527, test_loss: 1.3036, test_f1: 0.2281
 epoch: 24, train_loss: 1.2539, test_loss: 1.3021, test_f1: 0.2281
 epoch: 25, train_loss: 1.2524, test_loss: 1.3130, test_f1: 0.2281
 epoch: 26, train_loss: 1.2537, test_loss: 1.3026, test_f1: 0.2281
 epoch: 27, train_loss: 1.2548, test_loss: 1.3039, test_f1: 0.2281
 epoch: 28, train_loss: 1.2537, test_loss: 1.3070, test_f1: 0.2281
 epoch: 29, train_loss: 1.2551, test_loss: 1.3034, test_f1: 0.2281
 epoch: 30, train_loss: 1.2526, test_loss: 1.3034, test_f1: 0.2281
 epoch: 31, train_loss: 1.2530, test_loss: 1.3077, test_f1: 0.2281
 epoch: 32, train_loss: 1.2551, test_loss: 1.3048, test_f1: 0.2281
 epoch: 33, train_loss: 1.2564, test_loss: 1.3019, test_f1: 0.2281
 epoch: 34, train_loss: 1.2526, test_loss: 1.3102, test_f1: 0.2281
 epoch: 35, train_loss: 1.2545, test_loss: 1.3060, test_f1: 0.2281
 epoch: 36, train_loss: 1.2533, test_loss: 1.3011, test_f1: 0.2281
 epoch: 37, train_loss: 1.2544, test_loss: 1.3050, test_f1: 0.2281
 epoch: 38, train_loss: 1.2537, test_loss: 1.3034, test_f1: 0.2281
 epoch: 39, train_loss: 1.2530, test_loss: 1.3038, test_f1: 0.2281
 epoch: 40, train_loss: 1.2534, test_loss: 1.3049, test_f1: 0.2281
 epoch: 41, train_loss: 1.2531, test_loss: 1.3049, test_f1: 0.2281
 epoch: 42, train_loss: 1.2532, test_loss: 1.3042, test_f1: 0.2281
 epoch: 43, train_loss: 1.2530, test_loss: 1.3052, test_f1: 0.2281
 epoch: 44, train_loss: 1.2527, test_loss: 1.3048, test_f1: 0.2281
 epoch: 45, train_loss: 1.2559, test_loss: 1.3089, test_f1: 0.2281
 epoch: 46, train_loss: 1.2545, test_loss: 1.3038, test_f1: 0.2281
 epoch: 47, train_loss: 1.2559, test_loss: 1.3025, test_f1: 0.2281
 epoch: 48, train_loss: 1.2550, test_loss: 1.3095, test_f1: 0.2281
 epoch: 49, train_loss: 1.2548, test_loss: 1.3061, test_f1: 0.2281
 epoch: 50, train_loss: 1.2536, test_loss: 1.3038, test_f1: 0.2281
 epoch: 51, train_loss: 1.2522, test_loss: 1.3060, test_f1: 0.2281
 epoch: 52, train_loss: 1.2534, test_loss: 1.3073, test_f1: 0.2281
 epoch: 53, train_loss: 1.2524, test_loss: 1.3031, test_f1: 0.2281
 epoch: 54, train_loss: 1.2527, test_loss: 1.3033, test_f1: 0.2281
 epoch: 55, train_loss: 1.2530, test_loss: 1.3043, test_f1: 0.2281
 epoch: 56, train_loss: 1.2531, test_loss: 1.3023, test_f1: 0.2281
 epoch: 57, train_loss: 1.2524, test_loss: 1.3055, test_f1: 0.2281
 epoch: 58, train_loss: 1.2529, test_loss: 1.3041, test_f1: 0.2281
 epoch: 59, train_loss: 1.2524, test_loss: 1.3058, test_f1: 0.2281
 epoch: 60, train_loss: 1.2523, test_loss: 1.3039, test_f1: 0.2281
 epoch: 61, train_loss: 1.2529, test_loss: 1.3051, test_f1: 0.2281
 epoch: 62, train_loss: 1.2531, test_loss: 1.3087, test_f1: 0.2281
 epoch: 63, train_loss: 1.2538, test_loss: 1.3050, test_f1: 0.2281
 epoch: 64, train_loss: 1.2523, test_loss: 1.3041, test_f1: 0.2281
 epoch: 65, train_loss: 1.2525, test_loss: 1.3058, test_f1: 0.2281
 epoch: 66, train_loss: 1.2525, test_loss: 1.3047, test_f1: 0.2281
 epoch: 67, train_loss: 1.2532, test_loss: 1.3027, test_f1: 0.2281
 epoch: 68, train_loss: 1.2531, test_loss: 1.3022, test_f1: 0.2281
 epoch: 69, train_loss: 1.2528, test_loss: 1.3035, test_f1: 0.2281
 epoch: 70, train_loss: 1.2525, test_loss: 1.3024, test_f1: 0.2281
 epoch: 71, train_loss: 1.2523, test_loss: 1.3049, test_f1: 0.2281
 epoch: 72, train_loss: 1.2531, test_loss: 1.3059, test_f1: 0.2281
 epoch: 73, train_loss: 1.2524, test_loss: 1.3049, test_f1: 0.2281
 epoch: 74, train_loss: 1.2529, test_loss: 1.3018, test_f1: 0.2281
 epoch: 75, train_loss: 1.2530, test_loss: 1.3034, test_f1: 0.2281
 epoch: 76, train_loss: 1.2539, test_loss: 1.3039, test_f1: 0.2281
 epoch: 77, train_loss: 1.2525, test_loss: 1.3055, test_f1: 0.2281
 epoch: 78, train_loss: 1.2539, test_loss: 1.3092, test_f1: 0.2281
 epoch: 79, train_loss: 1.2529, test_loss: 1.3058, test_f1: 0.2281
 epoch: 80, train_loss: 1.2533, test_loss: 1.3024, test_f1: 0.2281
 epoch: 81, train_loss: 1.2529, test_loss: 1.3050, test_f1: 0.2281
 epoch: 82, train_loss: 1.2525, test_loss: 1.3040, test_f1: 0.2281
 epoch: 83, train_loss: 1.2526, test_loss: 1.3043, test_f1: 0.2281
 epoch: 84, train_loss: 1.2526, test_loss: 1.3067, test_f1: 0.2281
 epoch: 85, train_loss: 1.2524, test_loss: 1.3059, test_f1: 0.2281
 epoch: 86, train_loss: 1.2523, test_loss: 1.3052, test_f1: 0.2281
 epoch: 87, train_loss: 1.2525, test_loss: 1.3040, test_f1: 0.2281
 epoch: 88, train_loss: 1.2528, test_loss: 1.3014, test_f1: 0.2281
 epoch: 89, train_loss: 1.2529, test_loss: 1.3032, test_f1: 0.2281
 epoch: 90, train_loss: 1.2523, test_loss: 1.3042, test_f1: 0.2281
 epoch: 91, train_loss: 1.2532, test_loss: 1.3044, test_f1: 0.2281
 epoch: 92, train_loss: 1.2525, test_loss: 1.3061, test_f1: 0.2281
 epoch: 93, train_loss: 1.2530, test_loss: 1.3064, test_f1: 0.2281
 epoch: 94, train_loss: 1.2523, test_loss: 1.3032, test_f1: 0.2281
 epoch: 95, train_loss: 1.2534, test_loss: 1.3060, test_f1: 0.2281
 epoch: 96, train_loss: 1.2529, test_loss: 1.3033, test_f1: 0.2281
 epoch: 97, train_loss: 1.2525, test_loss: 1.3069, test_f1: 0.2281
 epoch: 98, train_loss: 1.2530, test_loss: 1.3044, test_f1: 0.2281
 epoch: 99, train_loss: 1.2524, test_loss: 1.3067, test_f1: 0.2281
##################ITERATION #8 ****************************************
 epoch: 0, train_loss: 1.2556, test_loss: 1.3120, test_f1: 0.2281
 epoch: 1, train_loss: 1.2548, test_loss: 1.3064, test_f1: 0.2281
 epoch: 2, train_loss: 1.2527, test_loss: 1.3021, test_f1: 0.2281
 epoch: 3, train_loss: 1.2528, test_loss: 1.3063, test_f1: 0.2281
 epoch: 4, train_loss: 1.2536, test_loss: 1.3038, test_f1: 0.2281
 epoch: 5, train_loss: 1.2529, test_loss: 1.3069, test_f1: 0.2281
 epoch: 6, train_loss: 1.2534, test_loss: 1.3034, test_f1: 0.2281
 epoch: 7, train_loss: 1.2529, test_loss: 1.3075, test_f1: 0.2281
 epoch: 8, train_loss: 1.2528, test_loss: 1.3048, test_f1: 0.2281
 epoch: 9, train_loss: 1.2537, test_loss: 1.3027, test_f1: 0.2281
 epoch: 10, train_loss: 1.2531, test_loss: 1.3037, test_f1: 0.2281
 epoch: 11, train_loss: 1.2529, test_loss: 1.3067, test_f1: 0.2281
 epoch: 12, train_loss: 1.2532, test_loss: 1.3041, test_f1: 0.2281
 epoch: 13, train_loss: 1.2533, test_loss: 1.3058, test_f1: 0.2281
 epoch: 14, train_loss: 1.2553, test_loss: 1.2993, test_f1: 0.2281
 epoch: 15, train_loss: 1.2540, test_loss: 1.3053, test_f1: 0.2281
 epoch: 16, train_loss: 1.2530, test_loss: 1.3051, test_f1: 0.2281
 epoch: 17, train_loss: 1.2535, test_loss: 1.3078, test_f1: 0.2281
 epoch: 18, train_loss: 1.2537, test_loss: 1.3083, test_f1: 0.2281
 epoch: 19, train_loss: 1.2537, test_loss: 1.3009, test_f1: 0.2281
 epoch: 20, train_loss: 1.2534, test_loss: 1.3066, test_f1: 0.2281
 epoch: 21, train_loss: 1.2534, test_loss: 1.3032, test_f1: 0.2281
 epoch: 22, train_loss: 1.2534, test_loss: 1.3046, test_f1: 0.2281
 epoch: 23, train_loss: 1.2545, test_loss: 1.3040, test_f1: 0.2281
 epoch: 24, train_loss: 1.2524, test_loss: 1.3023, test_f1: 0.2281
 epoch: 25, train_loss: 1.2525, test_loss: 1.3076, test_f1: 0.2281
 epoch: 26, train_loss: 1.2541, test_loss: 1.3041, test_f1: 0.2281
 epoch: 27, train_loss: 1.2541, test_loss: 1.3052, test_f1: 0.2281
 epoch: 28, train_loss: 1.2526, test_loss: 1.3046, test_f1: 0.2281
 epoch: 29, train_loss: 1.2531, test_loss: 1.3023, test_f1: 0.2281
 epoch: 30, train_loss: 1.2532, test_loss: 1.3050, test_f1: 0.2281
 epoch: 31, train_loss: 1.2530, test_loss: 1.3056, test_f1: 0.2281
 epoch: 32, train_loss: 1.2529, test_loss: 1.3063, test_f1: 0.2281
 epoch: 33, train_loss: 1.2541, test_loss: 1.3012, test_f1: 0.2281
 epoch: 34, train_loss: 1.2534, test_loss: 1.3074, test_f1: 0.2281
 epoch: 35, train_loss: 1.2531, test_loss: 1.3058, test_f1: 0.2281
 epoch: 36, train_loss: 1.2526, test_loss: 1.3042, test_f1: 0.2281
 epoch: 37, train_loss: 1.2524, test_loss: 1.3025, test_f1: 0.2281
 epoch: 38, train_loss: 1.2537, test_loss: 1.3076, test_f1: 0.2281
 epoch: 39, train_loss: 1.2529, test_loss: 1.3033, test_f1: 0.2281
 epoch: 40, train_loss: 1.2528, test_loss: 1.3061, test_f1: 0.2281
 epoch: 41, train_loss: 1.2546, test_loss: 1.3057, test_f1: 0.2281
 epoch: 42, train_loss: 1.2537, test_loss: 1.3045, test_f1: 0.2281
 epoch: 43, train_loss: 1.2567, test_loss: 1.3048, test_f1: 0.2281
 epoch: 44, train_loss: 1.2540, test_loss: 1.3049, test_f1: 0.2281
 epoch: 45, train_loss: 1.2547, test_loss: 1.3097, test_f1: 0.2281
 epoch: 46, train_loss: 1.2533, test_loss: 1.3031, test_f1: 0.2281
 epoch: 47, train_loss: 1.2541, test_loss: 1.3047, test_f1: 0.2281
 epoch: 48, train_loss: 1.2527, test_loss: 1.3068, test_f1: 0.2281
 epoch: 49, train_loss: 1.2544, test_loss: 1.3059, test_f1: 0.2281
 epoch: 50, train_loss: 1.2533, test_loss: 1.3041, test_f1: 0.2281
 epoch: 51, train_loss: 1.2523, test_loss: 1.3042, test_f1: 0.2281
 epoch: 52, train_loss: 1.2531, test_loss: 1.3018, test_f1: 0.2281
 epoch: 53, train_loss: 1.2530, test_loss: 1.3042, test_f1: 0.2281
 epoch: 54, train_loss: 1.2526, test_loss: 1.3038, test_f1: 0.2281
 epoch: 55, train_loss: 1.2522, test_loss: 1.3043, test_f1: 0.2281
 epoch: 56, train_loss: 1.2524, test_loss: 1.3062, test_f1: 0.2281
 epoch: 57, train_loss: 1.2524, test_loss: 1.3050, test_f1: 0.2281
 epoch: 58, train_loss: 1.2526, test_loss: 1.3043, test_f1: 0.2281
 epoch: 59, train_loss: 1.2527, test_loss: 1.3042, test_f1: 0.2281
 epoch: 60, train_loss: 1.2526, test_loss: 1.3073, test_f1: 0.2281
 epoch: 61, train_loss: 1.2530, test_loss: 1.3064, test_f1: 0.2281
 epoch: 62, train_loss: 1.2521, test_loss: 1.3031, test_f1: 0.2281
 epoch: 63, train_loss: 1.2528, test_loss: 1.3028, test_f1: 0.2281
 epoch: 64, train_loss: 1.2524, test_loss: 1.3058, test_f1: 0.2281
 epoch: 65, train_loss: 1.2527, test_loss: 1.3039, test_f1: 0.2281
 epoch: 66, train_loss: 1.2525, test_loss: 1.3045, test_f1: 0.2281
 epoch: 67, train_loss: 1.2527, test_loss: 1.3087, test_f1: 0.2281
 epoch: 68, train_loss: 1.2528, test_loss: 1.3050, test_f1: 0.2281
 epoch: 69, train_loss: 1.2528, test_loss: 1.3002, test_f1: 0.2281
 epoch: 70, train_loss: 1.2528, test_loss: 1.3033, test_f1: 0.2281
 epoch: 71, train_loss: 1.2521, test_loss: 1.3056, test_f1: 0.2281
 epoch: 72, train_loss: 1.2525, test_loss: 1.3059, test_f1: 0.2281
 epoch: 73, train_loss: 1.2530, test_loss: 1.3026, test_f1: 0.2281
 epoch: 74, train_loss: 1.2522, test_loss: 1.3066, test_f1: 0.2281
 epoch: 75, train_loss: 1.2524, test_loss: 1.3081, test_f1: 0.2281
 epoch: 76, train_loss: 1.2533, test_loss: 1.3049, test_f1: 0.2281
 epoch: 77, train_loss: 1.2537, test_loss: 1.3029, test_f1: 0.2281
 epoch: 78, train_loss: 1.2527, test_loss: 1.3046, test_f1: 0.2281
 epoch: 79, train_loss: 1.2536, test_loss: 1.3101, test_f1: 0.2281
 epoch: 80, train_loss: 1.2524, test_loss: 1.3052, test_f1: 0.2281
 epoch: 81, train_loss: 1.2531, test_loss: 1.3039, test_f1: 0.2281
 epoch: 82, train_loss: 1.2522, test_loss: 1.3077, test_f1: 0.2281
 epoch: 83, train_loss: 1.2529, test_loss: 1.3073, test_f1: 0.2281
 epoch: 84, train_loss: 1.2526, test_loss: 1.3059, test_f1: 0.2281
 epoch: 85, train_loss: 1.2526, test_loss: 1.3059, test_f1: 0.2281
 epoch: 86, train_loss: 1.2524, test_loss: 1.3024, test_f1: 0.2281
 epoch: 87, train_loss: 1.2527, test_loss: 1.3041, test_f1: 0.2281
 epoch: 88, train_loss: 1.2523, test_loss: 1.3041, test_f1: 0.2281
 epoch: 89, train_loss: 1.2530, test_loss: 1.3041, test_f1: 0.2281
 epoch: 90, train_loss: 1.2531, test_loss: 1.3045, test_f1: 0.2281
 epoch: 91, train_loss: 1.2527, test_loss: 1.3078, test_f1: 0.2281
 epoch: 92, train_loss: 1.2528, test_loss: 1.3054, test_f1: 0.2281
 epoch: 93, train_loss: 1.2529, test_loss: 1.3040, test_f1: 0.2281
 epoch: 94, train_loss: 1.2542, test_loss: 1.3053, test_f1: 0.2281
 epoch: 95, train_loss: 1.2531, test_loss: 1.3063, test_f1: 0.2281
 epoch: 96, train_loss: 1.2527, test_loss: 1.3042, test_f1: 0.2281
 epoch: 97, train_loss: 1.2531, test_loss: 1.3024, test_f1: 0.2281
 epoch: 98, train_loss: 1.2528, test_loss: 1.3082, test_f1: 0.2281
 epoch: 99, train_loss: 1.2527, test_loss: 1.3061, test_f1: 0.2281
##################ITERATION #9 ****************************************
 epoch: 0, train_loss: 1.2590, test_loss: 1.3178, test_f1: 0.1365
 epoch: 1, train_loss: 1.2557, test_loss: 1.3040, test_f1: 0.2281
 epoch: 2, train_loss: 1.2553, test_loss: 1.3069, test_f1: 0.2281
 epoch: 3, train_loss: 1.2528, test_loss: 1.3033, test_f1: 0.2281
 epoch: 4, train_loss: 1.2535, test_loss: 1.3030, test_f1: 0.2281
 epoch: 5, train_loss: 1.2524, test_loss: 1.3036, test_f1: 0.2281
 epoch: 6, train_loss: 1.2542, test_loss: 1.3068, test_f1: 0.2281
 epoch: 7, train_loss: 1.2570, test_loss: 1.3039, test_f1: 0.2281
 epoch: 8, train_loss: 1.2542, test_loss: 1.3087, test_f1: 0.2281
 epoch: 9, train_loss: 1.2534, test_loss: 1.3042, test_f1: 0.2281
 epoch: 10, train_loss: 1.2526, test_loss: 1.3038, test_f1: 0.2281
 epoch: 11, train_loss: 1.2525, test_loss: 1.3035, test_f1: 0.2281
 epoch: 12, train_loss: 1.2536, test_loss: 1.3043, test_f1: 0.2281
 epoch: 13, train_loss: 1.2543, test_loss: 1.3014, test_f1: 0.2281
 epoch: 14, train_loss: 1.2544, test_loss: 1.3111, test_f1: 0.2281
 epoch: 15, train_loss: 1.2532, test_loss: 1.3036, test_f1: 0.2281
 epoch: 16, train_loss: 1.2533, test_loss: 1.3059, test_f1: 0.2281
 epoch: 17, train_loss: 1.2530, test_loss: 1.3020, test_f1: 0.2281
 epoch: 18, train_loss: 1.2530, test_loss: 1.3050, test_f1: 0.2281
 epoch: 19, train_loss: 1.2536, test_loss: 1.3046, test_f1: 0.2281
 epoch: 20, train_loss: 1.2528, test_loss: 1.3058, test_f1: 0.2281
 epoch: 21, train_loss: 1.2523, test_loss: 1.3040, test_f1: 0.2281
 epoch: 22, train_loss: 1.2527, test_loss: 1.3034, test_f1: 0.2281
 epoch: 23, train_loss: 1.2548, test_loss: 1.3029, test_f1: 0.2281
 epoch: 24, train_loss: 1.2539, test_loss: 1.3059, test_f1: 0.2281
 epoch: 25, train_loss: 1.2552, test_loss: 1.3068, test_f1: 0.2281
 epoch: 26, train_loss: 1.2538, test_loss: 1.3025, test_f1: 0.2281
 epoch: 27, train_loss: 1.2537, test_loss: 1.3077, test_f1: 0.2281
 epoch: 28, train_loss: 1.2542, test_loss: 1.3046, test_f1: 0.2281
 epoch: 29, train_loss: 1.2541, test_loss: 1.3007, test_f1: 0.2281
 epoch: 30, train_loss: 1.2534, test_loss: 1.3046, test_f1: 0.2281
 epoch: 31, train_loss: 1.2527, test_loss: 1.3074, test_f1: 0.2281
 epoch: 32, train_loss: 1.2527, test_loss: 1.3030, test_f1: 0.2281
 epoch: 33, train_loss: 1.2557, test_loss: 1.3036, test_f1: 0.2281
 epoch: 34, train_loss: 1.2539, test_loss: 1.3083, test_f1: 0.2281
 epoch: 35, train_loss: 1.2530, test_loss: 1.3029, test_f1: 0.2281
 epoch: 36, train_loss: 1.2527, test_loss: 1.3074, test_f1: 0.2281
 epoch: 37, train_loss: 1.2538, test_loss: 1.3051, test_f1: 0.2281
 epoch: 38, train_loss: 1.2529, test_loss: 1.3034, test_f1: 0.2281
 epoch: 39, train_loss: 1.2528, test_loss: 1.3060, test_f1: 0.2281
 epoch: 40, train_loss: 1.2530, test_loss: 1.3043, test_f1: 0.2281
 epoch: 41, train_loss: 1.2533, test_loss: 1.3019, test_f1: 0.2281
 epoch: 42, train_loss: 1.2538, test_loss: 1.3068, test_f1: 0.2281
 epoch: 43, train_loss: 1.2550, test_loss: 1.3048, test_f1: 0.2281
 epoch: 44, train_loss: 1.2543, test_loss: 1.3068, test_f1: 0.2281
 epoch: 45, train_loss: 1.2542, test_loss: 1.3020, test_f1: 0.2281
 epoch: 46, train_loss: 1.2531, test_loss: 1.3064, test_f1: 0.2281
 epoch: 47, train_loss: 1.2542, test_loss: 1.3036, test_f1: 0.2281
 epoch: 48, train_loss: 1.2534, test_loss: 1.3086, test_f1: 0.2281
 epoch: 49, train_loss: 1.2535, test_loss: 1.3052, test_f1: 0.2281
 epoch: 50, train_loss: 1.2536, test_loss: 1.3016, test_f1: 0.2281
 epoch: 51, train_loss: 1.2526, test_loss: 1.3056, test_f1: 0.2281
 epoch: 52, train_loss: 1.2530, test_loss: 1.3034, test_f1: 0.2281
 epoch: 53, train_loss: 1.2528, test_loss: 1.3083, test_f1: 0.2281
 epoch: 54, train_loss: 1.2527, test_loss: 1.3070, test_f1: 0.2281
 epoch: 55, train_loss: 1.2525, test_loss: 1.3037, test_f1: 0.2281
 epoch: 56, train_loss: 1.2526, test_loss: 1.3055, test_f1: 0.2281
 epoch: 57, train_loss: 1.2526, test_loss: 1.3046, test_f1: 0.2281
 epoch: 58, train_loss: 1.2528, test_loss: 1.3036, test_f1: 0.2281
 epoch: 59, train_loss: 1.2520, test_loss: 1.3050, test_f1: 0.2281
 epoch: 60, train_loss: 1.2526, test_loss: 1.3045, test_f1: 0.2281
 epoch: 61, train_loss: 1.2526, test_loss: 1.3055, test_f1: 0.2281
 epoch: 62, train_loss: 1.2529, test_loss: 1.3045, test_f1: 0.2281
 epoch: 63, train_loss: 1.2520, test_loss: 1.3023, test_f1: 0.2281
 epoch: 64, train_loss: 1.2531, test_loss: 1.3017, test_f1: 0.2281
 epoch: 65, train_loss: 1.2529, test_loss: 1.3062, test_f1: 0.2281
 epoch: 66, train_loss: 1.2521, test_loss: 1.3051, test_f1: 0.2281
 epoch: 67, train_loss: 1.2539, test_loss: 1.3047, test_f1: 0.2281
 epoch: 68, train_loss: 1.2523, test_loss: 1.3061, test_f1: 0.2281
 epoch: 69, train_loss: 1.2529, test_loss: 1.3031, test_f1: 0.2281
 epoch: 70, train_loss: 1.2531, test_loss: 1.3063, test_f1: 0.2281
 epoch: 71, train_loss: 1.2526, test_loss: 1.3070, test_f1: 0.2281
 epoch: 72, train_loss: 1.2522, test_loss: 1.3049, test_f1: 0.2281
 epoch: 73, train_loss: 1.2524, test_loss: 1.3041, test_f1: 0.2281
 epoch: 74, train_loss: 1.2525, test_loss: 1.3049, test_f1: 0.2281
 epoch: 75, train_loss: 1.2522, test_loss: 1.3058, test_f1: 0.2281
 epoch: 76, train_loss: 1.2525, test_loss: 1.3052, test_f1: 0.2281
 epoch: 77, train_loss: 1.2528, test_loss: 1.3035, test_f1: 0.2281
 epoch: 78, train_loss: 1.2523, test_loss: 1.3029, test_f1: 0.2281
 epoch: 79, train_loss: 1.2536, test_loss: 1.3032, test_f1: 0.2281
 epoch: 80, train_loss: 1.2524, test_loss: 1.3070, test_f1: 0.2281
 epoch: 81, train_loss: 1.2528, test_loss: 1.3063, test_f1: 0.2281
 epoch: 82, train_loss: 1.2523, test_loss: 1.3046, test_f1: 0.2281
 epoch: 83, train_loss: 1.2524, test_loss: 1.3046, test_f1: 0.2281
 epoch: 84, train_loss: 1.2524, test_loss: 1.3031, test_f1: 0.2281
 epoch: 85, train_loss: 1.2523, test_loss: 1.3057, test_f1: 0.2281
 epoch: 86, train_loss: 1.2538, test_loss: 1.3056, test_f1: 0.2281
 epoch: 87, train_loss: 1.2527, test_loss: 1.3078, test_f1: 0.2281
 epoch: 88, train_loss: 1.2525, test_loss: 1.3055, test_f1: 0.2281
 epoch: 89, train_loss: 1.2525, test_loss: 1.3037, test_f1: 0.2281
 epoch: 90, train_loss: 1.2523, test_loss: 1.3029, test_f1: 0.2281
 epoch: 91, train_loss: 1.2523, test_loss: 1.3045, test_f1: 0.2281
 epoch: 92, train_loss: 1.2525, test_loss: 1.3075, test_f1: 0.2281
 epoch: 93, train_loss: 1.2521, test_loss: 1.3050, test_f1: 0.2281
 epoch: 94, train_loss: 1.2534, test_loss: 1.3050, test_f1: 0.2281
 epoch: 95, train_loss: 1.2523, test_loss: 1.3063, test_f1: 0.2281
 epoch: 96, train_loss: 1.2533, test_loss: 1.3080, test_f1: 0.2281
 epoch: 97, train_loss: 1.2528, test_loss: 1.3050, test_f1: 0.2281
 epoch: 98, train_loss: 1.2527, test_loss: 1.3057, test_f1: 0.2281
 epoch: 99, train_loss: 1.2524, test_loss: 1.3023, test_f1: 0.2281

Training completed in 370.90 seconds
Best F1: 0.5055 at epoch 90
Mean F1 across iterations: 0.2558  0.0832
========================FINAL RESULTS================================
FEGIN weighted F1: 0.5055  0.0832
python main.py --data ltspice_demos --representation component_pin --model FEGIN --layers 5 --hiddens 16 --batch_size 128 --lr 0.1 --emb_size 250 --epochs 100 --save_appendix component_pin_L5_H16_BS128_LR0.1_E250 --no_val
-----



STDERR:
  File "main.py", line 370, in <module>
    main()
  File "main.py", line 254, in main
    dataset = dataset_class(
  File "/home/philip/projects/ltspice_examples_code_repo/Circuit-Completion-Using-GNNs/component_classification_with_link_prediction_head/evaluation/FEGIN/kernel/circuit_datasets.py", line 15, in __init__
    self.data, self.slices = torch.load(self.processed_paths[0])
  File "/home/philip/.local/lib/python3.8/site-packages/torch/serialization.py", line 1040, in load
    warnings.warn(
  File "/usr/lib/python3.8/warnings.py", line 109, in _showwarnmsg
    sw(msg.message, msg.category, msg.filename, msg.lineno,
  File "main.py", line 47, in warn_with_traceback
    traceback.print_stack(file=log)
/home/philip/projects/ltspice_examples_code_repo/Circuit-Completion-Using-GNNs/component_classification_with_link_prediction_head/evaluation/FEGIN/kernel/circuit_datasets.py:15: FutureWarning: You are using `torch.load` with `weights_only=False` (the current default value), which uses the default pickle module implicitly. It is possible to construct malicious pickle data which will execute arbitrary code during unpickling (See https://github.com/pytorch/pytorch/blob/main/SECURITY.md#untrusted-models for more details). In a future release, the default value for `weights_only` will be flipped to `True`. This limits the functions that could be executed during unpickling. Arbitrary objects will no longer be allowed to be loaded via this mode unless they are explicitly allowlisted by the user via `torch.serialization.add_safe_globals`. We recommend you start setting `weights_only=True` for any use case where you don't have full control of the loaded file. Please open an issue on GitHub for any issues related to this experimental feature.
  self.data, self.slices = torch.load(self.processed_paths[0])
