STDOUT:
Results will be saved in /home/philip/projects/ltspice_examples_code_repo/Circuit-Completion-Using-GNNs/component_classification_with_link_prediction_head/evaluation/FEGIN/results/model_FEGIN_dataset_ltspice_examples
Command line input: python main.py --data ltspice_examples --representation component_pin_net --model FEGIN --layers 2 --hiddens 32 --batch_size 256 --lr 0.1 --emb_size 512 --epochs 100 --save_appendix component_pin_net_L2_H32_BS256_LR0.1_E512 --no_val
 is saved.
-----
ltspice_examples - FEGIN
Using 2 layers, 32 hidden units, h = 2
Loading component_pin_net representation dataset
ENTERED
Training FEGIN on component_pin_net representation
Train: 3558, Test: 846
##################ITERATION #0 ****************************************
 epoch: 0, train_loss: 1.2996, test_loss: 6.9136, test_f1: 0.2295
 epoch: 1, train_loss: 1.1465, test_loss: 1.3048, test_f1: 0.2416
 epoch: 2, train_loss: 1.1200, test_loss: 1.1323, test_f1: 0.3408
 epoch: 3, train_loss: 1.1027, test_loss: 1.1668, test_f1: 0.3422
 epoch: 4, train_loss: 1.1237, test_loss: 1.1295, test_f1: 0.3394
 epoch: 5, train_loss: 1.1121, test_loss: 1.0978, test_f1: 0.3413
 epoch: 6, train_loss: 1.0893, test_loss: 1.0787, test_f1: 0.3422
 epoch: 7, train_loss: 1.1015, test_loss: 1.1276, test_f1: 0.3507
 epoch: 8, train_loss: 1.0966, test_loss: 1.1281, test_f1: 0.3422
 epoch: 9, train_loss: 1.0890, test_loss: 1.0969, test_f1: 0.3422
 epoch: 10, train_loss: 1.0795, test_loss: 1.0680, test_f1: 0.3422
 epoch: 11, train_loss: 1.0932, test_loss: 1.2105, test_f1: 0.2484
 epoch: 12, train_loss: 1.1125, test_loss: 1.0591, test_f1: 0.3822
 epoch: 13, train_loss: 1.0806, test_loss: 1.1198, test_f1: 0.3381
 epoch: 14, train_loss: 1.0852, test_loss: 1.1291, test_f1: 0.3283
 epoch: 15, train_loss: 1.0785, test_loss: 1.0855, test_f1: 0.3398
 epoch: 16, train_loss: 1.0841, test_loss: 1.1374, test_f1: 0.3430
 epoch: 17, train_loss: 1.0761, test_loss: 1.0339, test_f1: 0.3422
 epoch: 18, train_loss: 1.0597, test_loss: 1.0357, test_f1: 0.3469
 epoch: 19, train_loss: 1.0556, test_loss: 1.0356, test_f1: 0.3570
 epoch: 20, train_loss: 1.0448, test_loss: 1.0575, test_f1: 0.3606
 epoch: 21, train_loss: 1.0722, test_loss: 1.0510, test_f1: 0.3620
 epoch: 22, train_loss: 1.0788, test_loss: 1.0453, test_f1: 0.3481
 epoch: 23, train_loss: 1.0709, test_loss: 1.1105, test_f1: 0.3426
 epoch: 24, train_loss: 1.0679, test_loss: 1.0723, test_f1: 0.3460
 epoch: 25, train_loss: 1.0553, test_loss: 1.0568, test_f1: 0.3474
 epoch: 26, train_loss: 1.0602, test_loss: 1.0604, test_f1: 0.3444
 epoch: 27, train_loss: 1.0665, test_loss: 1.0818, test_f1: 0.3499
 epoch: 28, train_loss: 1.0644, test_loss: 1.0762, test_f1: 0.3422
 epoch: 29, train_loss: 1.0461, test_loss: 1.2857, test_f1: 0.3153
 epoch: 30, train_loss: 1.0767, test_loss: 1.0581, test_f1: 0.3422
 epoch: 31, train_loss: 1.1196, test_loss: 1.0606, test_f1: 0.3398
 epoch: 32, train_loss: 1.0654, test_loss: 1.0849, test_f1: 0.3560
 epoch: 33, train_loss: 1.0477, test_loss: 1.0498, test_f1: 0.3583
 epoch: 34, train_loss: 1.0540, test_loss: 1.1003, test_f1: 0.3422
 epoch: 35, train_loss: 1.0676, test_loss: 1.0715, test_f1: 0.3422
 epoch: 36, train_loss: 1.0621, test_loss: 1.0559, test_f1: 0.3422
 epoch: 37, train_loss: 1.0493, test_loss: 1.1643, test_f1: 0.3488
 epoch: 38, train_loss: 1.0449, test_loss: 1.0321, test_f1: 0.3441
 epoch: 39, train_loss: 1.0520, test_loss: 1.0263, test_f1: 0.3422
 epoch: 40, train_loss: 1.0343, test_loss: 1.1405, test_f1: 0.3469
 epoch: 41, train_loss: 1.0443, test_loss: 1.0194, test_f1: 0.3432
 epoch: 42, train_loss: 1.0463, test_loss: 1.0691, test_f1: 0.3631
 epoch: 43, train_loss: 1.0499, test_loss: 1.0220, test_f1: 0.3413
 epoch: 44, train_loss: 1.0396, test_loss: 1.0460, test_f1: 0.4118
 epoch: 45, train_loss: 1.0493, test_loss: 1.0886, test_f1: 0.3546
 epoch: 46, train_loss: 1.0508, test_loss: 1.0651, test_f1: 0.3422
 epoch: 47, train_loss: 1.0575, test_loss: 1.0486, test_f1: 0.4626
 epoch: 48, train_loss: 1.0463, test_loss: 1.0345, test_f1: 0.3398
 epoch: 49, train_loss: 1.0500, test_loss: 1.0387, test_f1: 0.3393
 epoch: 50, train_loss: 1.0513, test_loss: 1.1173, test_f1: 0.3422
 epoch: 51, train_loss: 1.0553, test_loss: 1.0488, test_f1: 0.3534
 epoch: 52, train_loss: 1.0581, test_loss: 1.1620, test_f1: 0.3436
 epoch: 53, train_loss: 1.0539, test_loss: 1.0850, test_f1: 0.3422
 epoch: 54, train_loss: 1.0346, test_loss: 1.1973, test_f1: 0.3412
 epoch: 55, train_loss: 1.0304, test_loss: 1.0676, test_f1: 0.3416
 epoch: 56, train_loss: 1.0155, test_loss: 1.0095, test_f1: 0.4574
 epoch: 57, train_loss: 1.0180, test_loss: 1.0298, test_f1: 0.3398
 epoch: 58, train_loss: 1.0093, test_loss: 1.0521, test_f1: 0.4745
 epoch: 59, train_loss: 1.0130, test_loss: 0.9989, test_f1: 0.4696
 epoch: 60, train_loss: 1.0215, test_loss: 1.0360, test_f1: 0.4511
 epoch: 61, train_loss: 1.0179, test_loss: 1.0247, test_f1: 0.3534
 epoch: 62, train_loss: 1.0139, test_loss: 1.0718, test_f1: 0.4550
 epoch: 63, train_loss: 1.0180, test_loss: 1.0364, test_f1: 0.4604
 epoch: 64, train_loss: 1.0092, test_loss: 1.0564, test_f1: 0.4469
 epoch: 65, train_loss: 1.0084, test_loss: 1.0556, test_f1: 0.4689
 epoch: 66, train_loss: 1.0093, test_loss: 1.0225, test_f1: 0.4738
 epoch: 67, train_loss: 1.0171, test_loss: 1.1115, test_f1: 0.3491
 epoch: 68, train_loss: 1.0021, test_loss: 1.0550, test_f1: 0.4647
 epoch: 69, train_loss: 0.9835, test_loss: 1.0782, test_f1: 0.4302
 epoch: 70, train_loss: 0.9996, test_loss: 1.1481, test_f1: 0.4749
 epoch: 71, train_loss: 1.0001, test_loss: 1.1543, test_f1: 0.4710
 epoch: 72, train_loss: 0.9932, test_loss: 1.0507, test_f1: 0.4685
 epoch: 73, train_loss: 0.9889, test_loss: 1.0179, test_f1: 0.4733
 epoch: 74, train_loss: 0.9956, test_loss: 1.0041, test_f1: 0.4719
 epoch: 75, train_loss: 0.9856, test_loss: 0.9863, test_f1: 0.4719
 epoch: 76, train_loss: 0.9882, test_loss: 0.9915, test_f1: 0.4885
 epoch: 77, train_loss: 0.9918, test_loss: 1.0405, test_f1: 0.4668
 epoch: 78, train_loss: 0.9903, test_loss: 0.9674, test_f1: 0.4909
 epoch: 79, train_loss: 0.9979, test_loss: 1.0082, test_f1: 0.4758
 epoch: 80, train_loss: 0.9925, test_loss: 1.0139, test_f1: 0.4655
 epoch: 81, train_loss: 0.9992, test_loss: 1.0340, test_f1: 0.3913
 epoch: 82, train_loss: 1.0085, test_loss: 1.0029, test_f1: 0.4303
 epoch: 83, train_loss: 0.9916, test_loss: 0.9894, test_f1: 0.4741
 epoch: 84, train_loss: 0.9971, test_loss: 0.9812, test_f1: 0.4893
 epoch: 85, train_loss: 0.9969, test_loss: 0.9913, test_f1: 0.4730
 epoch: 86, train_loss: 0.9788, test_loss: 1.0094, test_f1: 0.4623
 epoch: 87, train_loss: 0.9882, test_loss: 0.9830, test_f1: 0.4827
 epoch: 88, train_loss: 0.9988, test_loss: 1.0647, test_f1: 0.4331
 epoch: 89, train_loss: 0.9780, test_loss: 1.0528, test_f1: 0.4768
 epoch: 90, train_loss: 0.9843, test_loss: 1.0053, test_f1: 0.4784
 epoch: 91, train_loss: 0.9726, test_loss: 1.0546, test_f1: 0.4516
 epoch: 92, train_loss: 0.9612, test_loss: 0.9780, test_f1: 0.4795
 epoch: 93, train_loss: 0.9672, test_loss: 0.9834, test_f1: 0.4796
 epoch: 94, train_loss: 0.9747, test_loss: 1.0095, test_f1: 0.4765
 epoch: 95, train_loss: 0.9942, test_loss: 1.0047, test_f1: 0.4654
 epoch: 96, train_loss: 0.9872, test_loss: 0.9916, test_f1: 0.4959
 epoch: 97, train_loss: 0.9802, test_loss: 0.9855, test_f1: 0.4691
 epoch: 98, train_loss: 0.9883, test_loss: 1.0159, test_f1: 0.4859
 epoch: 99, train_loss: 0.9771, test_loss: 0.9943, test_f1: 0.4721
##################ITERATION #1 ****************************************
 epoch: 0, train_loss: 1.3091, test_loss: 1.3225, test_f1: 0.2270
 epoch: 1, train_loss: 1.3035, test_loss: 1.3151, test_f1: 0.2270
 epoch: 2, train_loss: 1.3017, test_loss: 1.3138, test_f1: 0.2270
 epoch: 3, train_loss: 1.3028, test_loss: 1.3165, test_f1: 0.2270
 epoch: 4, train_loss: 1.3017, test_loss: 1.3142, test_f1: 0.2270
 epoch: 5, train_loss: 1.3016, test_loss: 1.3156, test_f1: 0.2270
 epoch: 6, train_loss: 1.3016, test_loss: 1.3157, test_f1: 0.2270
 epoch: 7, train_loss: 1.3018, test_loss: 1.3143, test_f1: 0.2270
 epoch: 8, train_loss: 1.3022, test_loss: 1.3167, test_f1: 0.2270
 epoch: 9, train_loss: 1.3015, test_loss: 1.3147, test_f1: 0.2270
 epoch: 10, train_loss: 1.3018, test_loss: 1.3141, test_f1: 0.2270
 epoch: 11, train_loss: 1.3020, test_loss: 1.3163, test_f1: 0.2270
 epoch: 12, train_loss: 1.3031, test_loss: 1.3168, test_f1: 0.2270
 epoch: 13, train_loss: 1.3029, test_loss: 1.3145, test_f1: 0.2270
 epoch: 14, train_loss: 1.3019, test_loss: 1.3162, test_f1: 0.2270
 epoch: 15, train_loss: 1.3022, test_loss: 1.3157, test_f1: 0.2270
 epoch: 16, train_loss: 1.3019, test_loss: 1.3143, test_f1: 0.2270
 epoch: 17, train_loss: 1.3023, test_loss: 1.3158, test_f1: 0.2270
 epoch: 18, train_loss: 1.3019, test_loss: 1.3152, test_f1: 0.2270
 epoch: 19, train_loss: 1.3022, test_loss: 1.3159, test_f1: 0.2270
 epoch: 20, train_loss: 1.3017, test_loss: 1.3141, test_f1: 0.2270
 epoch: 21, train_loss: 1.3027, test_loss: 1.3140, test_f1: 0.2270
 epoch: 22, train_loss: 1.3017, test_loss: 1.3170, test_f1: 0.2270
 epoch: 23, train_loss: 1.3022, test_loss: 1.3144, test_f1: 0.2270
 epoch: 24, train_loss: 1.3023, test_loss: 1.3162, test_f1: 0.2270
 epoch: 25, train_loss: 1.3019, test_loss: 1.3152, test_f1: 0.2270
 epoch: 26, train_loss: 1.3020, test_loss: 1.3140, test_f1: 0.2270
 epoch: 27, train_loss: 1.3021, test_loss: 1.3155, test_f1: 0.2270
 epoch: 28, train_loss: 1.3019, test_loss: 1.3155, test_f1: 0.2270
 epoch: 29, train_loss: 1.3028, test_loss: 1.3152, test_f1: 0.2270
 epoch: 30, train_loss: 1.3017, test_loss: 1.3155, test_f1: 0.2270
 epoch: 31, train_loss: 1.3016, test_loss: 1.3146, test_f1: 0.2270
 epoch: 32, train_loss: 1.3021, test_loss: 1.3166, test_f1: 0.2270
 epoch: 33, train_loss: 1.3018, test_loss: 1.3150, test_f1: 0.2270
 epoch: 34, train_loss: 1.3020, test_loss: 1.3153, test_f1: 0.2270
 epoch: 35, train_loss: 1.3024, test_loss: 1.3142, test_f1: 0.2270
 epoch: 36, train_loss: 1.3024, test_loss: 1.3142, test_f1: 0.2270
 epoch: 37, train_loss: 1.3028, test_loss: 1.3147, test_f1: 0.2270
 epoch: 38, train_loss: 1.3019, test_loss: 1.3149, test_f1: 0.2270
 epoch: 39, train_loss: 1.3019, test_loss: 1.3160, test_f1: 0.2270
 epoch: 40, train_loss: 1.3018, test_loss: 1.3143, test_f1: 0.2270
 epoch: 41, train_loss: 1.3024, test_loss: 1.3178, test_f1: 0.2270
 epoch: 42, train_loss: 1.3022, test_loss: 1.3141, test_f1: 0.2270
 epoch: 43, train_loss: 1.3024, test_loss: 1.3144, test_f1: 0.2270
 epoch: 44, train_loss: 1.3020, test_loss: 1.3155, test_f1: 0.2270
 epoch: 45, train_loss: 1.3020, test_loss: 1.3144, test_f1: 0.2270
 epoch: 46, train_loss: 1.3030, test_loss: 1.3185, test_f1: 0.2270
 epoch: 47, train_loss: 1.3025, test_loss: 1.3152, test_f1: 0.2270
 epoch: 48, train_loss: 1.3018, test_loss: 1.3155, test_f1: 0.2270
 epoch: 49, train_loss: 1.3018, test_loss: 1.3147, test_f1: 0.2270
 epoch: 50, train_loss: 1.3015, test_loss: 1.3152, test_f1: 0.2270
 epoch: 51, train_loss: 1.3025, test_loss: 1.3149, test_f1: 0.2270
 epoch: 52, train_loss: 1.3017, test_loss: 1.3158, test_f1: 0.2270
 epoch: 53, train_loss: 1.3012, test_loss: 1.3153, test_f1: 0.2270
 epoch: 54, train_loss: 1.3019, test_loss: 1.3146, test_f1: 0.2270
 epoch: 55, train_loss: 1.3021, test_loss: 1.3153, test_f1: 0.2270
 epoch: 56, train_loss: 1.3020, test_loss: 1.3150, test_f1: 0.2270
 epoch: 57, train_loss: 1.3019, test_loss: 1.3154, test_f1: 0.2270
 epoch: 58, train_loss: 1.3015, test_loss: 1.3152, test_f1: 0.2270
 epoch: 59, train_loss: 1.3017, test_loss: 1.3145, test_f1: 0.2270
 epoch: 60, train_loss: 1.3019, test_loss: 1.3166, test_f1: 0.2270
 epoch: 61, train_loss: 1.3015, test_loss: 1.3141, test_f1: 0.2270
 epoch: 62, train_loss: 1.3017, test_loss: 1.3148, test_f1: 0.2270
 epoch: 63, train_loss: 1.3014, test_loss: 1.3150, test_f1: 0.2270
 epoch: 64, train_loss: 1.3016, test_loss: 1.3145, test_f1: 0.2270
 epoch: 65, train_loss: 1.3020, test_loss: 1.3158, test_f1: 0.2270
 epoch: 66, train_loss: 1.3017, test_loss: 1.3141, test_f1: 0.2270
 epoch: 67, train_loss: 1.3013, test_loss: 1.3153, test_f1: 0.2270
 epoch: 68, train_loss: 1.3018, test_loss: 1.3153, test_f1: 0.2270
 epoch: 69, train_loss: 1.3022, test_loss: 1.3147, test_f1: 0.2270
 epoch: 70, train_loss: 1.3017, test_loss: 1.3158, test_f1: 0.2270
 epoch: 71, train_loss: 1.3013, test_loss: 1.3144, test_f1: 0.2270
 epoch: 72, train_loss: 1.3016, test_loss: 1.3154, test_f1: 0.2270
 epoch: 73, train_loss: 1.3022, test_loss: 1.3146, test_f1: 0.2270
 epoch: 74, train_loss: 1.3020, test_loss: 1.3162, test_f1: 0.2270
 epoch: 75, train_loss: 1.3018, test_loss: 1.3145, test_f1: 0.2270
 epoch: 76, train_loss: 1.3015, test_loss: 1.3153, test_f1: 0.2270
 epoch: 77, train_loss: 1.3019, test_loss: 1.3156, test_f1: 0.2270
 epoch: 78, train_loss: 1.3016, test_loss: 1.3152, test_f1: 0.2270
 epoch: 79, train_loss: 1.3016, test_loss: 1.3147, test_f1: 0.2270
 epoch: 80, train_loss: 1.3016, test_loss: 1.3157, test_f1: 0.2270
 epoch: 81, train_loss: 1.3019, test_loss: 1.3142, test_f1: 0.2270
 epoch: 82, train_loss: 1.3019, test_loss: 1.3147, test_f1: 0.2270
 epoch: 83, train_loss: 1.3019, test_loss: 1.3155, test_f1: 0.2270
 epoch: 84, train_loss: 1.3014, test_loss: 1.3149, test_f1: 0.2270
 epoch: 85, train_loss: 1.3017, test_loss: 1.3151, test_f1: 0.2270
 epoch: 86, train_loss: 1.3017, test_loss: 1.3154, test_f1: 0.2270
 epoch: 87, train_loss: 1.3013, test_loss: 1.3144, test_f1: 0.2270
 epoch: 88, train_loss: 1.3018, test_loss: 1.3148, test_f1: 0.2270
 epoch: 89, train_loss: 1.3019, test_loss: 1.3154, test_f1: 0.2270
 epoch: 90, train_loss: 1.3018, test_loss: 1.3152, test_f1: 0.2270
 epoch: 91, train_loss: 1.3017, test_loss: 1.3140, test_f1: 0.2270
 epoch: 92, train_loss: 1.3018, test_loss: 1.3160, test_f1: 0.2270
 epoch: 93, train_loss: 1.3014, test_loss: 1.3150, test_f1: 0.2270
 epoch: 94, train_loss: 1.3015, test_loss: 1.3148, test_f1: 0.2270
 epoch: 95, train_loss: 1.3022, test_loss: 1.3159, test_f1: 0.2270
 epoch: 96, train_loss: 1.3016, test_loss: 1.3136, test_f1: 0.2270
 epoch: 97, train_loss: 1.3016, test_loss: 1.3157, test_f1: 0.2270
 epoch: 98, train_loss: 1.3019, test_loss: 1.3158, test_f1: 0.2270
 epoch: 99, train_loss: 1.3017, test_loss: 1.3145, test_f1: 0.2270
##################ITERATION #2 ****************************************
 epoch: 0, train_loss: 1.3064, test_loss: 1.3167, test_f1: 0.2270
 epoch: 1, train_loss: 1.3031, test_loss: 1.3169, test_f1: 0.2270
 epoch: 2, train_loss: 1.3023, test_loss: 1.3150, test_f1: 0.2270
 epoch: 3, train_loss: 1.3018, test_loss: 1.3152, test_f1: 0.2270
 epoch: 4, train_loss: 1.3020, test_loss: 1.3154, test_f1: 0.2270
 epoch: 5, train_loss: 1.3030, test_loss: 1.3163, test_f1: 0.2270
 epoch: 6, train_loss: 1.3028, test_loss: 1.3141, test_f1: 0.2270
 epoch: 7, train_loss: 1.3023, test_loss: 1.3157, test_f1: 0.2270
 epoch: 8, train_loss: 1.3018, test_loss: 1.3154, test_f1: 0.2270
 epoch: 9, train_loss: 1.3015, test_loss: 1.3147, test_f1: 0.2270
 epoch: 10, train_loss: 1.3019, test_loss: 1.3156, test_f1: 0.2270
 epoch: 11, train_loss: 1.3016, test_loss: 1.3145, test_f1: 0.2270
 epoch: 12, train_loss: 1.3024, test_loss: 1.3172, test_f1: 0.2270
 epoch: 13, train_loss: 1.3021, test_loss: 1.3151, test_f1: 0.2270
 epoch: 14, train_loss: 1.3020, test_loss: 1.3143, test_f1: 0.2270
 epoch: 15, train_loss: 1.3018, test_loss: 1.3154, test_f1: 0.2270
 epoch: 16, train_loss: 1.3022, test_loss: 1.3159, test_f1: 0.2270
 epoch: 17, train_loss: 1.3017, test_loss: 1.3143, test_f1: 0.2270
 epoch: 18, train_loss: 1.3017, test_loss: 1.3159, test_f1: 0.2270
 epoch: 19, train_loss: 1.3018, test_loss: 1.3155, test_f1: 0.2270
 epoch: 20, train_loss: 1.3019, test_loss: 1.3144, test_f1: 0.2270
 epoch: 21, train_loss: 1.3020, test_loss: 1.3156, test_f1: 0.2270
 epoch: 22, train_loss: 1.3020, test_loss: 1.3146, test_f1: 0.2270
 epoch: 23, train_loss: 1.3020, test_loss: 1.3153, test_f1: 0.2270
 epoch: 24, train_loss: 1.3021, test_loss: 1.3146, test_f1: 0.2270
 epoch: 25, train_loss: 1.3027, test_loss: 1.3149, test_f1: 0.2270
 epoch: 26, train_loss: 1.3024, test_loss: 1.3150, test_f1: 0.2270
 epoch: 27, train_loss: 1.3021, test_loss: 1.3152, test_f1: 0.2270
 epoch: 28, train_loss: 1.3023, test_loss: 1.3150, test_f1: 0.2270
 epoch: 29, train_loss: 1.3022, test_loss: 1.3154, test_f1: 0.2270
 epoch: 30, train_loss: 1.3018, test_loss: 1.3162, test_f1: 0.2270
 epoch: 31, train_loss: 1.3022, test_loss: 1.3151, test_f1: 0.2270
 epoch: 32, train_loss: 1.3018, test_loss: 1.3164, test_f1: 0.2270
 epoch: 33, train_loss: 1.3024, test_loss: 1.3134, test_f1: 0.2270
 epoch: 34, train_loss: 1.3024, test_loss: 1.3172, test_f1: 0.2270
 epoch: 35, train_loss: 1.3023, test_loss: 1.3134, test_f1: 0.2270
 epoch: 36, train_loss: 1.3027, test_loss: 1.3189, test_f1: 0.2270
 epoch: 37, train_loss: 1.3027, test_loss: 1.3137, test_f1: 0.2270
 epoch: 38, train_loss: 1.3025, test_loss: 1.3159, test_f1: 0.2270
 epoch: 39, train_loss: 1.3023, test_loss: 1.3142, test_f1: 0.2270
 epoch: 40, train_loss: 1.3049, test_loss: 1.3142, test_f1: 0.2270
 epoch: 41, train_loss: 1.3022, test_loss: 1.3150, test_f1: 0.2270
 epoch: 42, train_loss: 1.3018, test_loss: 1.3152, test_f1: 0.2270
 epoch: 43, train_loss: 1.3018, test_loss: 1.3153, test_f1: 0.2270
 epoch: 44, train_loss: 1.3024, test_loss: 1.3148, test_f1: 0.2270
 epoch: 45, train_loss: 1.3021, test_loss: 1.3151, test_f1: 0.2270
 epoch: 46, train_loss: 1.3023, test_loss: 1.3161, test_f1: 0.2270
 epoch: 47, train_loss: 1.3019, test_loss: 1.3145, test_f1: 0.2270
 epoch: 48, train_loss: 1.3017, test_loss: 1.3162, test_f1: 0.2270
 epoch: 49, train_loss: 1.3023, test_loss: 1.3144, test_f1: 0.2270
 epoch: 50, train_loss: 1.3022, test_loss: 1.3159, test_f1: 0.2270
 epoch: 51, train_loss: 1.3015, test_loss: 1.3150, test_f1: 0.2270
 epoch: 52, train_loss: 1.3017, test_loss: 1.3157, test_f1: 0.2270
 epoch: 53, train_loss: 1.3014, test_loss: 1.3149, test_f1: 0.2270
 epoch: 54, train_loss: 1.3021, test_loss: 1.3145, test_f1: 0.2270
 epoch: 55, train_loss: 1.3021, test_loss: 1.3160, test_f1: 0.2270
 epoch: 56, train_loss: 1.3020, test_loss: 1.3142, test_f1: 0.2270
 epoch: 57, train_loss: 1.3015, test_loss: 1.3161, test_f1: 0.2270
 epoch: 58, train_loss: 1.3017, test_loss: 1.3156, test_f1: 0.2270
 epoch: 59, train_loss: 1.3016, test_loss: 1.3139, test_f1: 0.2270
 epoch: 60, train_loss: 1.3015, test_loss: 1.3155, test_f1: 0.2270
 epoch: 61, train_loss: 1.3020, test_loss: 1.3161, test_f1: 0.2270
 epoch: 62, train_loss: 1.3017, test_loss: 1.3149, test_f1: 0.2270
 epoch: 63, train_loss: 1.3015, test_loss: 1.3142, test_f1: 0.2270
 epoch: 64, train_loss: 1.3020, test_loss: 1.3149, test_f1: 0.2270
 epoch: 65, train_loss: 1.3019, test_loss: 1.3165, test_f1: 0.2270
 epoch: 66, train_loss: 1.3019, test_loss: 1.3141, test_f1: 0.2270
 epoch: 67, train_loss: 1.3020, test_loss: 1.3164, test_f1: 0.2270
 epoch: 68, train_loss: 1.3017, test_loss: 1.3141, test_f1: 0.2270
 epoch: 69, train_loss: 1.3014, test_loss: 1.3156, test_f1: 0.2270
 epoch: 70, train_loss: 1.3015, test_loss: 1.3154, test_f1: 0.2270
 epoch: 71, train_loss: 1.3016, test_loss: 1.3153, test_f1: 0.2270
 epoch: 72, train_loss: 1.3015, test_loss: 1.3149, test_f1: 0.2270
 epoch: 73, train_loss: 1.3024, test_loss: 1.3152, test_f1: 0.2270
 epoch: 74, train_loss: 1.3019, test_loss: 1.3158, test_f1: 0.2270
 epoch: 75, train_loss: 1.3015, test_loss: 1.3143, test_f1: 0.2270
 epoch: 76, train_loss: 1.3014, test_loss: 1.3150, test_f1: 0.2270
 epoch: 77, train_loss: 1.3016, test_loss: 1.3155, test_f1: 0.2270
 epoch: 78, train_loss: 1.3017, test_loss: 1.3149, test_f1: 0.2270
 epoch: 79, train_loss: 1.3017, test_loss: 1.3155, test_f1: 0.2270
 epoch: 80, train_loss: 1.3015, test_loss: 1.3148, test_f1: 0.2270
 epoch: 81, train_loss: 1.3015, test_loss: 1.3156, test_f1: 0.2270
 epoch: 82, train_loss: 1.3014, test_loss: 1.3144, test_f1: 0.2270
 epoch: 83, train_loss: 1.3018, test_loss: 1.3150, test_f1: 0.2270
 epoch: 84, train_loss: 1.3016, test_loss: 1.3152, test_f1: 0.2270
 epoch: 85, train_loss: 1.3017, test_loss: 1.3151, test_f1: 0.2270
 epoch: 86, train_loss: 1.3019, test_loss: 1.3149, test_f1: 0.2270
 epoch: 87, train_loss: 1.3016, test_loss: 1.3158, test_f1: 0.2270
 epoch: 88, train_loss: 1.3018, test_loss: 1.3160, test_f1: 0.2270
 epoch: 89, train_loss: 1.3027, test_loss: 1.3138, test_f1: 0.2270
 epoch: 90, train_loss: 1.3017, test_loss: 1.3166, test_f1: 0.2270
 epoch: 91, train_loss: 1.3019, test_loss: 1.3156, test_f1: 0.2270
 epoch: 92, train_loss: 1.3014, test_loss: 1.3152, test_f1: 0.2270
 epoch: 93, train_loss: 1.3017, test_loss: 1.3149, test_f1: 0.2270
 epoch: 94, train_loss: 1.3028, test_loss: 1.3164, test_f1: 0.2270
 epoch: 95, train_loss: 1.3015, test_loss: 1.3142, test_f1: 0.2270
 epoch: 96, train_loss: 1.3024, test_loss: 1.3154, test_f1: 0.2270
 epoch: 97, train_loss: 1.3013, test_loss: 1.3144, test_f1: 0.2270
 epoch: 98, train_loss: 1.3022, test_loss: 1.3142, test_f1: 0.2270
 epoch: 99, train_loss: 1.3017, test_loss: 1.3163, test_f1: 0.2270
##################ITERATION #3 ****************************************
 epoch: 0, train_loss: 1.3091, test_loss: 1.3171, test_f1: 0.2270
 epoch: 1, train_loss: 1.3081, test_loss: 1.3152, test_f1: 0.2270
 epoch: 2, train_loss: 1.3021, test_loss: 1.3164, test_f1: 0.2270
 epoch: 3, train_loss: 1.3029, test_loss: 1.3138, test_f1: 0.2270
 epoch: 4, train_loss: 1.3024, test_loss: 1.3160, test_f1: 0.2270
 epoch: 5, train_loss: 1.3024, test_loss: 1.3160, test_f1: 0.2270
 epoch: 6, train_loss: 1.3024, test_loss: 1.3158, test_f1: 0.2270
 epoch: 7, train_loss: 1.3026, test_loss: 1.3152, test_f1: 0.2270
 epoch: 8, train_loss: 1.3027, test_loss: 1.3177, test_f1: 0.2270
 epoch: 9, train_loss: 1.3038, test_loss: 1.3143, test_f1: 0.2270
 epoch: 10, train_loss: 1.3033, test_loss: 1.3163, test_f1: 0.2270
 epoch: 11, train_loss: 1.3026, test_loss: 1.3143, test_f1: 0.2270
 epoch: 12, train_loss: 1.3015, test_loss: 1.3158, test_f1: 0.2270
 epoch: 13, train_loss: 1.3015, test_loss: 1.3148, test_f1: 0.2270
 epoch: 14, train_loss: 1.3020, test_loss: 1.3154, test_f1: 0.2270
 epoch: 15, train_loss: 1.3017, test_loss: 1.3156, test_f1: 0.2270
 epoch: 16, train_loss: 1.3023, test_loss: 1.3145, test_f1: 0.2270
 epoch: 17, train_loss: 1.3028, test_loss: 1.3162, test_f1: 0.2270
 epoch: 18, train_loss: 1.3030, test_loss: 1.3154, test_f1: 0.2270
 epoch: 19, train_loss: 1.3029, test_loss: 1.3146, test_f1: 0.2270
 epoch: 20, train_loss: 1.3024, test_loss: 1.3161, test_f1: 0.2270
 epoch: 21, train_loss: 1.3020, test_loss: 1.3157, test_f1: 0.2270
 epoch: 22, train_loss: 1.3024, test_loss: 1.3141, test_f1: 0.2270
 epoch: 23, train_loss: 1.3032, test_loss: 1.3152, test_f1: 0.2270
 epoch: 24, train_loss: 1.3026, test_loss: 1.3150, test_f1: 0.2270
 epoch: 25, train_loss: 1.3026, test_loss: 1.3161, test_f1: 0.2270
 epoch: 26, train_loss: 1.3031, test_loss: 1.3143, test_f1: 0.2270
 epoch: 27, train_loss: 1.3025, test_loss: 1.3159, test_f1: 0.2270
 epoch: 28, train_loss: 1.3019, test_loss: 1.3149, test_f1: 0.2270
 epoch: 29, train_loss: 1.3015, test_loss: 1.3163, test_f1: 0.2270
 epoch: 30, train_loss: 1.3025, test_loss: 1.3160, test_f1: 0.2270
 epoch: 31, train_loss: 1.3018, test_loss: 1.3140, test_f1: 0.2270
 epoch: 32, train_loss: 1.3025, test_loss: 1.3145, test_f1: 0.2270
 epoch: 33, train_loss: 1.3024, test_loss: 1.3153, test_f1: 0.2270
 epoch: 34, train_loss: 1.3027, test_loss: 1.3161, test_f1: 0.2270
 epoch: 35, train_loss: 1.3022, test_loss: 1.3151, test_f1: 0.2270
 epoch: 36, train_loss: 1.3018, test_loss: 1.3145, test_f1: 0.2270
 epoch: 37, train_loss: 1.3019, test_loss: 1.3153, test_f1: 0.2270
 epoch: 38, train_loss: 1.3020, test_loss: 1.3152, test_f1: 0.2270
 epoch: 39, train_loss: 1.3024, test_loss: 1.3149, test_f1: 0.2270
 epoch: 40, train_loss: 1.3024, test_loss: 1.3172, test_f1: 0.2270
 epoch: 41, train_loss: 1.3019, test_loss: 1.3151, test_f1: 0.2270
 epoch: 42, train_loss: 1.3019, test_loss: 1.3156, test_f1: 0.2270
 epoch: 43, train_loss: 1.3024, test_loss: 1.3146, test_f1: 0.2270
 epoch: 44, train_loss: 1.3023, test_loss: 1.3157, test_f1: 0.2270
 epoch: 45, train_loss: 1.3026, test_loss: 1.3136, test_f1: 0.2270
 epoch: 46, train_loss: 1.3048, test_loss: 1.3156, test_f1: 0.2270
 epoch: 47, train_loss: 1.3047, test_loss: 1.3154, test_f1: 0.2270
 epoch: 48, train_loss: 1.3024, test_loss: 1.3154, test_f1: 0.2270
 epoch: 49, train_loss: 1.3018, test_loss: 1.3168, test_f1: 0.2270
 epoch: 50, train_loss: 1.3024, test_loss: 1.3134, test_f1: 0.2270
 epoch: 51, train_loss: 1.3021, test_loss: 1.3152, test_f1: 0.2270
 epoch: 52, train_loss: 1.3014, test_loss: 1.3159, test_f1: 0.2270
 epoch: 53, train_loss: 1.3028, test_loss: 1.3142, test_f1: 0.2270
 epoch: 54, train_loss: 1.3020, test_loss: 1.3158, test_f1: 0.2270
 epoch: 55, train_loss: 1.3013, test_loss: 1.3159, test_f1: 0.2270
 epoch: 56, train_loss: 1.3017, test_loss: 1.3151, test_f1: 0.2270
 epoch: 57, train_loss: 1.3013, test_loss: 1.3155, test_f1: 0.2270
 epoch: 58, train_loss: 1.3016, test_loss: 1.3142, test_f1: 0.2270
 epoch: 59, train_loss: 1.3020, test_loss: 1.3159, test_f1: 0.2270
 epoch: 60, train_loss: 1.3017, test_loss: 1.3147, test_f1: 0.2270
 epoch: 61, train_loss: 1.3016, test_loss: 1.3148, test_f1: 0.2270
 epoch: 62, train_loss: 1.3013, test_loss: 1.3154, test_f1: 0.2270
 epoch: 63, train_loss: 1.3017, test_loss: 1.3151, test_f1: 0.2270
 epoch: 64, train_loss: 1.3020, test_loss: 1.3144, test_f1: 0.2270
 epoch: 65, train_loss: 1.3015, test_loss: 1.3158, test_f1: 0.2270
 epoch: 66, train_loss: 1.3020, test_loss: 1.3156, test_f1: 0.2270
 epoch: 67, train_loss: 1.3018, test_loss: 1.3148, test_f1: 0.2270
 epoch: 68, train_loss: 1.3019, test_loss: 1.3161, test_f1: 0.2270
 epoch: 69, train_loss: 1.3018, test_loss: 1.3143, test_f1: 0.2270
 epoch: 70, train_loss: 1.3019, test_loss: 1.3157, test_f1: 0.2270
 epoch: 71, train_loss: 1.3012, test_loss: 1.3150, test_f1: 0.2270
 epoch: 72, train_loss: 1.3017, test_loss: 1.3155, test_f1: 0.2270
 epoch: 73, train_loss: 1.3020, test_loss: 1.3142, test_f1: 0.2270
 epoch: 74, train_loss: 1.3016, test_loss: 1.3162, test_f1: 0.2270
 epoch: 75, train_loss: 1.3018, test_loss: 1.3148, test_f1: 0.2270
 epoch: 76, train_loss: 1.3015, test_loss: 1.3152, test_f1: 0.2270
 epoch: 77, train_loss: 1.3014, test_loss: 1.3149, test_f1: 0.2270
 epoch: 78, train_loss: 1.3015, test_loss: 1.3146, test_f1: 0.2270
 epoch: 79, train_loss: 1.3016, test_loss: 1.3149, test_f1: 0.2270
 epoch: 80, train_loss: 1.3017, test_loss: 1.3158, test_f1: 0.2270
 epoch: 81, train_loss: 1.3016, test_loss: 1.3155, test_f1: 0.2270
 epoch: 82, train_loss: 1.3016, test_loss: 1.3148, test_f1: 0.2270
 epoch: 83, train_loss: 1.3018, test_loss: 1.3148, test_f1: 0.2270
 epoch: 84, train_loss: 1.3017, test_loss: 1.3150, test_f1: 0.2270
 epoch: 85, train_loss: 1.3020, test_loss: 1.3147, test_f1: 0.2270
 epoch: 86, train_loss: 1.3018, test_loss: 1.3156, test_f1: 0.2270
 epoch: 87, train_loss: 1.3020, test_loss: 1.3152, test_f1: 0.2270
 epoch: 88, train_loss: 1.3015, test_loss: 1.3153, test_f1: 0.2270
 epoch: 89, train_loss: 1.3017, test_loss: 1.3151, test_f1: 0.2270
 epoch: 90, train_loss: 1.3014, test_loss: 1.3159, test_f1: 0.2270
 epoch: 91, train_loss: 1.3015, test_loss: 1.3150, test_f1: 0.2270
 epoch: 92, train_loss: 1.3017, test_loss: 1.3157, test_f1: 0.2270
 epoch: 93, train_loss: 1.3021, test_loss: 1.3142, test_f1: 0.2270
 epoch: 94, train_loss: 1.3014, test_loss: 1.3150, test_f1: 0.2270
 epoch: 95, train_loss: 1.3017, test_loss: 1.3148, test_f1: 0.2270
 epoch: 96, train_loss: 1.3016, test_loss: 1.3154, test_f1: 0.2270
 epoch: 97, train_loss: 1.3017, test_loss: 1.3152, test_f1: 0.2270
 epoch: 98, train_loss: 1.3018, test_loss: 1.3152, test_f1: 0.2270
 epoch: 99, train_loss: 1.3019, test_loss: 1.3152, test_f1: 0.2270
##################ITERATION #4 ****************************************
 epoch: 0, train_loss: 1.3049, test_loss: 1.3173, test_f1: 0.2270
 epoch: 1, train_loss: 1.3029, test_loss: 1.3150, test_f1: 0.2270
 epoch: 2, train_loss: 1.3023, test_loss: 1.3162, test_f1: 0.2270
 epoch: 3, train_loss: 1.3031, test_loss: 1.3156, test_f1: 0.2270
 epoch: 4, train_loss: 1.3018, test_loss: 1.3138, test_f1: 0.2270
 epoch: 5, train_loss: 1.3017, test_loss: 1.3161, test_f1: 0.2270
 epoch: 6, train_loss: 1.3029, test_loss: 1.3142, test_f1: 0.2270
 epoch: 7, train_loss: 1.3017, test_loss: 1.3157, test_f1: 0.2270
 epoch: 8, train_loss: 1.3022, test_loss: 1.3147, test_f1: 0.2270
 epoch: 9, train_loss: 1.3022, test_loss: 1.3151, test_f1: 0.2270
 epoch: 10, train_loss: 1.3025, test_loss: 1.3149, test_f1: 0.2270
 epoch: 11, train_loss: 1.3029, test_loss: 1.3145, test_f1: 0.2270
 epoch: 12, train_loss: 1.3028, test_loss: 1.3146, test_f1: 0.2270
 epoch: 13, train_loss: 1.3032, test_loss: 1.3162, test_f1: 0.2270
 epoch: 14, train_loss: 1.3017, test_loss: 1.3150, test_f1: 0.2270
 epoch: 15, train_loss: 1.3025, test_loss: 1.3155, test_f1: 0.2270
 epoch: 16, train_loss: 1.3017, test_loss: 1.3144, test_f1: 0.2270
 epoch: 17, train_loss: 1.3026, test_loss: 1.3158, test_f1: 0.2270
 epoch: 18, train_loss: 1.3041, test_loss: 1.3146, test_f1: 0.2270
 epoch: 19, train_loss: 1.3023, test_loss: 1.3159, test_f1: 0.2270
 epoch: 20, train_loss: 1.3023, test_loss: 1.3155, test_f1: 0.2270
 epoch: 21, train_loss: 1.3027, test_loss: 1.3144, test_f1: 0.2270
 epoch: 22, train_loss: 1.3023, test_loss: 1.3173, test_f1: 0.2270
 epoch: 23, train_loss: 1.3028, test_loss: 1.3147, test_f1: 0.2270
 epoch: 24, train_loss: 1.3024, test_loss: 1.3158, test_f1: 0.2270
 epoch: 25, train_loss: 1.3026, test_loss: 1.3142, test_f1: 0.2270
 epoch: 26, train_loss: 1.3016, test_loss: 1.3160, test_f1: 0.2270
 epoch: 27, train_loss: 1.3021, test_loss: 1.3155, test_f1: 0.2270
 epoch: 28, train_loss: 1.3022, test_loss: 1.3146, test_f1: 0.2270
 epoch: 29, train_loss: 1.3022, test_loss: 1.3152, test_f1: 0.2270
 epoch: 30, train_loss: 1.3024, test_loss: 1.3159, test_f1: 0.2270
 epoch: 31, train_loss: 1.3018, test_loss: 1.3143, test_f1: 0.2270
 epoch: 32, train_loss: 1.3014, test_loss: 1.3173, test_f1: 0.2270
 epoch: 33, train_loss: 1.3019, test_loss: 1.3138, test_f1: 0.2270
 epoch: 34, train_loss: 1.3015, test_loss: 1.3165, test_f1: 0.2270
 epoch: 35, train_loss: 1.3020, test_loss: 1.3143, test_f1: 0.2270
 epoch: 36, train_loss: 1.3020, test_loss: 1.3154, test_f1: 0.2270
 epoch: 37, train_loss: 1.3024, test_loss: 1.3138, test_f1: 0.2270
 epoch: 38, train_loss: 1.3020, test_loss: 1.3166, test_f1: 0.2270
 epoch: 39, train_loss: 1.3026, test_loss: 1.3146, test_f1: 0.2270
 epoch: 40, train_loss: 1.3028, test_loss: 1.3157, test_f1: 0.2270
 epoch: 41, train_loss: 1.3024, test_loss: 1.3152, test_f1: 0.2270
 epoch: 42, train_loss: 1.3030, test_loss: 1.3153, test_f1: 0.2270
 epoch: 43, train_loss: 1.3030, test_loss: 1.3145, test_f1: 0.2270
 epoch: 44, train_loss: 1.3032, test_loss: 1.3166, test_f1: 0.2270
 epoch: 45, train_loss: 1.3029, test_loss: 1.3148, test_f1: 0.2270
 epoch: 46, train_loss: 1.3027, test_loss: 1.3145, test_f1: 0.2270
 epoch: 47, train_loss: 1.3022, test_loss: 1.3157, test_f1: 0.2270
 epoch: 48, train_loss: 1.3024, test_loss: 1.3136, test_f1: 0.2270
 epoch: 49, train_loss: 1.3030, test_loss: 1.3165, test_f1: 0.2270
 epoch: 50, train_loss: 1.3021, test_loss: 1.3147, test_f1: 0.2270
 epoch: 51, train_loss: 1.3016, test_loss: 1.3154, test_f1: 0.2270
 epoch: 52, train_loss: 1.3014, test_loss: 1.3156, test_f1: 0.2270
 epoch: 53, train_loss: 1.3013, test_loss: 1.3147, test_f1: 0.2270
 epoch: 54, train_loss: 1.3016, test_loss: 1.3149, test_f1: 0.2270
 epoch: 55, train_loss: 1.3016, test_loss: 1.3156, test_f1: 0.2270
 epoch: 56, train_loss: 1.3013, test_loss: 1.3148, test_f1: 0.2270
 epoch: 57, train_loss: 1.3015, test_loss: 1.3152, test_f1: 0.2270
 epoch: 58, train_loss: 1.3015, test_loss: 1.3146, test_f1: 0.2270
 epoch: 59, train_loss: 1.3014, test_loss: 1.3147, test_f1: 0.2270
 epoch: 60, train_loss: 1.3015, test_loss: 1.3148, test_f1: 0.2270
 epoch: 61, train_loss: 1.3014, test_loss: 1.3154, test_f1: 0.2270
 epoch: 62, train_loss: 1.3017, test_loss: 1.3162, test_f1: 0.2270
 epoch: 63, train_loss: 1.3014, test_loss: 1.3143, test_f1: 0.2270
 epoch: 64, train_loss: 1.3014, test_loss: 1.3148, test_f1: 0.2270
 epoch: 65, train_loss: 1.3016, test_loss: 1.3151, test_f1: 0.2270
 epoch: 66, train_loss: 1.3015, test_loss: 1.3153, test_f1: 0.2270
 epoch: 67, train_loss: 1.3017, test_loss: 1.3150, test_f1: 0.2270
 epoch: 68, train_loss: 1.3017, test_loss: 1.3160, test_f1: 0.2270
 epoch: 69, train_loss: 1.3017, test_loss: 1.3140, test_f1: 0.2270
 epoch: 70, train_loss: 1.3014, test_loss: 1.3154, test_f1: 0.2270
 epoch: 71, train_loss: 1.3017, test_loss: 1.3153, test_f1: 0.2270
 epoch: 72, train_loss: 1.3013, test_loss: 1.3159, test_f1: 0.2270
 epoch: 73, train_loss: 1.3024, test_loss: 1.3154, test_f1: 0.2270
 epoch: 74, train_loss: 1.3019, test_loss: 1.3147, test_f1: 0.2270
 epoch: 75, train_loss: 1.3015, test_loss: 1.3148, test_f1: 0.2270
 epoch: 76, train_loss: 1.3016, test_loss: 1.3145, test_f1: 0.2270
 epoch: 77, train_loss: 1.3020, test_loss: 1.3160, test_f1: 0.2270
 epoch: 78, train_loss: 1.3015, test_loss: 1.3151, test_f1: 0.2270
 epoch: 79, train_loss: 1.3019, test_loss: 1.3145, test_f1: 0.2270
 epoch: 80, train_loss: 1.3014, test_loss: 1.3153, test_f1: 0.2270
 epoch: 81, train_loss: 1.3019, test_loss: 1.3163, test_f1: 0.2270
 epoch: 82, train_loss: 1.3017, test_loss: 1.3152, test_f1: 0.2270
 epoch: 83, train_loss: 1.3019, test_loss: 1.3152, test_f1: 0.2270
 epoch: 84, train_loss: 1.3014, test_loss: 1.3150, test_f1: 0.2270
 epoch: 85, train_loss: 1.3014, test_loss: 1.3151, test_f1: 0.2270
 epoch: 86, train_loss: 1.3017, test_loss: 1.3152, test_f1: 0.2270
 epoch: 87, train_loss: 1.3017, test_loss: 1.3145, test_f1: 0.2270
 epoch: 88, train_loss: 1.3014, test_loss: 1.3147, test_f1: 0.2270
 epoch: 89, train_loss: 1.3015, test_loss: 1.3157, test_f1: 0.2270
 epoch: 90, train_loss: 1.3017, test_loss: 1.3152, test_f1: 0.2270
 epoch: 91, train_loss: 1.3014, test_loss: 1.3146, test_f1: 0.2270
 epoch: 92, train_loss: 1.3023, test_loss: 1.3156, test_f1: 0.2270
 epoch: 93, train_loss: 1.3020, test_loss: 1.3150, test_f1: 0.2270
 epoch: 94, train_loss: 1.3019, test_loss: 1.3148, test_f1: 0.2270
 epoch: 95, train_loss: 1.3015, test_loss: 1.3159, test_f1: 0.2270
 epoch: 96, train_loss: 1.3017, test_loss: 1.3150, test_f1: 0.2270
 epoch: 97, train_loss: 1.3017, test_loss: 1.3140, test_f1: 0.2270
 epoch: 98, train_loss: 1.3022, test_loss: 1.3159, test_f1: 0.2270
 epoch: 99, train_loss: 1.3014, test_loss: 1.3149, test_f1: 0.2270
##################ITERATION #5 ****************************************
 epoch: 0, train_loss: 1.3045, test_loss: 1.3195, test_f1: 0.2270
 epoch: 1, train_loss: 1.3036, test_loss: 1.3161, test_f1: 0.2270
 epoch: 2, train_loss: 1.3023, test_loss: 1.3143, test_f1: 0.2270
 epoch: 3, train_loss: 1.3019, test_loss: 1.3153, test_f1: 0.2270
 epoch: 4, train_loss: 1.3024, test_loss: 1.3160, test_f1: 0.2270
 epoch: 5, train_loss: 1.3018, test_loss: 1.3152, test_f1: 0.2270
 epoch: 6, train_loss: 1.3024, test_loss: 1.3172, test_f1: 0.2270
 epoch: 7, train_loss: 1.3030, test_loss: 1.3146, test_f1: 0.2270
 epoch: 8, train_loss: 1.3026, test_loss: 1.3142, test_f1: 0.2270
 epoch: 9, train_loss: 1.3015, test_loss: 1.3152, test_f1: 0.2270
 epoch: 10, train_loss: 1.3025, test_loss: 1.3163, test_f1: 0.2270
 epoch: 11, train_loss: 1.3020, test_loss: 1.3142, test_f1: 0.2270
 epoch: 12, train_loss: 1.3018, test_loss: 1.3159, test_f1: 0.2270
 epoch: 13, train_loss: 1.3023, test_loss: 1.3151, test_f1: 0.2270
 epoch: 14, train_loss: 1.3023, test_loss: 1.3144, test_f1: 0.2270
 epoch: 15, train_loss: 1.3027, test_loss: 1.3160, test_f1: 0.2270
 epoch: 16, train_loss: 1.3029, test_loss: 1.3166, test_f1: 0.2270
 epoch: 17, train_loss: 1.3020, test_loss: 1.3146, test_f1: 0.2270
 epoch: 18, train_loss: 1.3015, test_loss: 1.3157, test_f1: 0.2270
 epoch: 19, train_loss: 1.3014, test_loss: 1.3145, test_f1: 0.2270
 epoch: 20, train_loss: 1.3016, test_loss: 1.3157, test_f1: 0.2270
 epoch: 21, train_loss: 1.3019, test_loss: 1.3142, test_f1: 0.2270
 epoch: 22, train_loss: 1.3027, test_loss: 1.3150, test_f1: 0.2270
 epoch: 23, train_loss: 1.3022, test_loss: 1.3156, test_f1: 0.2270
 epoch: 24, train_loss: 1.3018, test_loss: 1.3146, test_f1: 0.2270
 epoch: 25, train_loss: 1.3018, test_loss: 1.3167, test_f1: 0.2270
 epoch: 26, train_loss: 1.3024, test_loss: 1.3152, test_f1: 0.2270
 epoch: 27, train_loss: 1.3021, test_loss: 1.3159, test_f1: 0.2270
 epoch: 28, train_loss: 1.3026, test_loss: 1.3140, test_f1: 0.2270
 epoch: 29, train_loss: 1.3029, test_loss: 1.3153, test_f1: 0.2270
 epoch: 30, train_loss: 1.3021, test_loss: 1.3161, test_f1: 0.2270
 epoch: 31, train_loss: 1.3030, test_loss: 1.3141, test_f1: 0.2270
 epoch: 32, train_loss: 1.3032, test_loss: 1.3175, test_f1: 0.2270
 epoch: 33, train_loss: 1.3026, test_loss: 1.3155, test_f1: 0.2270
 epoch: 34, train_loss: 1.3023, test_loss: 1.3151, test_f1: 0.2270
 epoch: 35, train_loss: 1.3024, test_loss: 1.3152, test_f1: 0.2270
 epoch: 36, train_loss: 1.3019, test_loss: 1.3162, test_f1: 0.2270
 epoch: 37, train_loss: 1.3023, test_loss: 1.3157, test_f1: 0.2270
 epoch: 38, train_loss: 1.3031, test_loss: 1.3139, test_f1: 0.2270
 epoch: 39, train_loss: 1.3018, test_loss: 1.3169, test_f1: 0.2270
 epoch: 40, train_loss: 1.3035, test_loss: 1.3160, test_f1: 0.2270
 epoch: 41, train_loss: 1.3026, test_loss: 1.3146, test_f1: 0.2270
 epoch: 42, train_loss: 1.3019, test_loss: 1.3149, test_f1: 0.2270
 epoch: 43, train_loss: 1.3018, test_loss: 1.3153, test_f1: 0.2270
 epoch: 44, train_loss: 1.3019, test_loss: 1.3156, test_f1: 0.2270
 epoch: 45, train_loss: 1.3021, test_loss: 1.3150, test_f1: 0.2270
 epoch: 46, train_loss: 1.3027, test_loss: 1.3147, test_f1: 0.2270
 epoch: 47, train_loss: 1.3025, test_loss: 1.3154, test_f1: 0.2270
 epoch: 48, train_loss: 1.3021, test_loss: 1.3143, test_f1: 0.2270
 epoch: 49, train_loss: 1.3027, test_loss: 1.3145, test_f1: 0.2270
 epoch: 50, train_loss: 1.3021, test_loss: 1.3159, test_f1: 0.2270
 epoch: 51, train_loss: 1.3017, test_loss: 1.3153, test_f1: 0.2270
 epoch: 52, train_loss: 1.3016, test_loss: 1.3147, test_f1: 0.2270
 epoch: 53, train_loss: 1.3017, test_loss: 1.3156, test_f1: 0.2270
 epoch: 54, train_loss: 1.3015, test_loss: 1.3150, test_f1: 0.2270
 epoch: 55, train_loss: 1.3016, test_loss: 1.3155, test_f1: 0.2270
 epoch: 56, train_loss: 1.3017, test_loss: 1.3149, test_f1: 0.2270
 epoch: 57, train_loss: 1.3018, test_loss: 1.3142, test_f1: 0.2270
 epoch: 58, train_loss: 1.3016, test_loss: 1.3160, test_f1: 0.2270
 epoch: 59, train_loss: 1.3024, test_loss: 1.3140, test_f1: 0.2270
 epoch: 60, train_loss: 1.3015, test_loss: 1.3156, test_f1: 0.2270
 epoch: 61, train_loss: 1.3014, test_loss: 1.3152, test_f1: 0.2270
 epoch: 62, train_loss: 1.3019, test_loss: 1.3157, test_f1: 0.2270
 epoch: 63, train_loss: 1.3018, test_loss: 1.3143, test_f1: 0.2270
 epoch: 64, train_loss: 1.3014, test_loss: 1.3156, test_f1: 0.2270
 epoch: 65, train_loss: 1.3014, test_loss: 1.3149, test_f1: 0.2270
 epoch: 66, train_loss: 1.3018, test_loss: 1.3145, test_f1: 0.2270
 epoch: 67, train_loss: 1.3016, test_loss: 1.3152, test_f1: 0.2270
 epoch: 68, train_loss: 1.3018, test_loss: 1.3153, test_f1: 0.2270
 epoch: 69, train_loss: 1.3015, test_loss: 1.3151, test_f1: 0.2270
 epoch: 70, train_loss: 1.3016, test_loss: 1.3145, test_f1: 0.2270
 epoch: 71, train_loss: 1.3015, test_loss: 1.3156, test_f1: 0.2270
 epoch: 72, train_loss: 1.3014, test_loss: 1.3145, test_f1: 0.2270
 epoch: 73, train_loss: 1.3018, test_loss: 1.3156, test_f1: 0.2270
 epoch: 74, train_loss: 1.3016, test_loss: 1.3151, test_f1: 0.2270
 epoch: 75, train_loss: 1.3016, test_loss: 1.3151, test_f1: 0.2270
 epoch: 76, train_loss: 1.3016, test_loss: 1.3150, test_f1: 0.2270
 epoch: 77, train_loss: 1.3018, test_loss: 1.3152, test_f1: 0.2270
 epoch: 78, train_loss: 1.3017, test_loss: 1.3147, test_f1: 0.2270
 epoch: 79, train_loss: 1.3023, test_loss: 1.3153, test_f1: 0.2270
 epoch: 80, train_loss: 1.3017, test_loss: 1.3152, test_f1: 0.2270
 epoch: 81, train_loss: 1.3015, test_loss: 1.3149, test_f1: 0.2270
 epoch: 82, train_loss: 1.3015, test_loss: 1.3155, test_f1: 0.2270
 epoch: 83, train_loss: 1.3015, test_loss: 1.3146, test_f1: 0.2270
 epoch: 84, train_loss: 1.3021, test_loss: 1.3150, test_f1: 0.2270
 epoch: 85, train_loss: 1.3021, test_loss: 1.3147, test_f1: 0.2270
 epoch: 86, train_loss: 1.3017, test_loss: 1.3155, test_f1: 0.2270
 epoch: 87, train_loss: 1.3016, test_loss: 1.3147, test_f1: 0.2270
 epoch: 88, train_loss: 1.3015, test_loss: 1.3151, test_f1: 0.2270
 epoch: 89, train_loss: 1.3015, test_loss: 1.3150, test_f1: 0.2270
 epoch: 90, train_loss: 1.3022, test_loss: 1.3148, test_f1: 0.2270
 epoch: 91, train_loss: 1.3014, test_loss: 1.3146, test_f1: 0.2270
 epoch: 92, train_loss: 1.3021, test_loss: 1.3155, test_f1: 0.2270
 epoch: 93, train_loss: 1.3020, test_loss: 1.3145, test_f1: 0.2270
 epoch: 94, train_loss: 1.3015, test_loss: 1.3158, test_f1: 0.2270
 epoch: 95, train_loss: 1.3019, test_loss: 1.3158, test_f1: 0.2270
 epoch: 96, train_loss: 1.3016, test_loss: 1.3149, test_f1: 0.2270
 epoch: 97, train_loss: 1.3013, test_loss: 1.3153, test_f1: 0.2270
 epoch: 98, train_loss: 1.3018, test_loss: 1.3150, test_f1: 0.2270
 epoch: 99, train_loss: 1.3022, test_loss: 1.3154, test_f1: 0.2270
##################ITERATION #6 ****************************************
 epoch: 0, train_loss: 1.3034, test_loss: 1.3175, test_f1: 0.2270
 epoch: 1, train_loss: 1.3040, test_loss: 1.3149, test_f1: 0.2270
 epoch: 2, train_loss: 1.3033, test_loss: 1.3143, test_f1: 0.2270
 epoch: 3, train_loss: 1.3031, test_loss: 1.3168, test_f1: 0.2270
 epoch: 4, train_loss: 1.3018, test_loss: 1.3150, test_f1: 0.2270
 epoch: 5, train_loss: 1.3017, test_loss: 1.3149, test_f1: 0.2270
 epoch: 6, train_loss: 1.3019, test_loss: 1.3150, test_f1: 0.2270
 epoch: 7, train_loss: 1.3026, test_loss: 1.3161, test_f1: 0.2270
 epoch: 8, train_loss: 1.3026, test_loss: 1.3151, test_f1: 0.2270
 epoch: 9, train_loss: 1.3021, test_loss: 1.3156, test_f1: 0.2270
 epoch: 10, train_loss: 1.3016, test_loss: 1.3149, test_f1: 0.2270
 epoch: 11, train_loss: 1.3026, test_loss: 1.3172, test_f1: 0.2270
 epoch: 12, train_loss: 1.3025, test_loss: 1.3150, test_f1: 0.2270
 epoch: 13, train_loss: 1.3016, test_loss: 1.3146, test_f1: 0.2270
 epoch: 14, train_loss: 1.3024, test_loss: 1.3164, test_f1: 0.2270
 epoch: 15, train_loss: 1.3018, test_loss: 1.3144, test_f1: 0.2270
 epoch: 16, train_loss: 1.3027, test_loss: 1.3179, test_f1: 0.2270
 epoch: 17, train_loss: 1.3019, test_loss: 1.3143, test_f1: 0.2270
 epoch: 18, train_loss: 1.3024, test_loss: 1.3157, test_f1: 0.2270
 epoch: 19, train_loss: 1.3023, test_loss: 1.3156, test_f1: 0.2270
 epoch: 20, train_loss: 1.3019, test_loss: 1.3142, test_f1: 0.2270
 epoch: 21, train_loss: 1.3022, test_loss: 1.3150, test_f1: 0.2270
 epoch: 22, train_loss: 1.3024, test_loss: 1.3151, test_f1: 0.2270
 epoch: 23, train_loss: 1.3023, test_loss: 1.3148, test_f1: 0.2270
 epoch: 24, train_loss: 1.3024, test_loss: 1.3172, test_f1: 0.2270
 epoch: 25, train_loss: 1.3022, test_loss: 1.3142, test_f1: 0.2270
 epoch: 26, train_loss: 1.3027, test_loss: 1.3153, test_f1: 0.2270
 epoch: 27, train_loss: 1.3018, test_loss: 1.3151, test_f1: 0.2270
 epoch: 28, train_loss: 1.3024, test_loss: 1.3157, test_f1: 0.2270
 epoch: 29, train_loss: 1.3020, test_loss: 1.3146, test_f1: 0.2270
 epoch: 30, train_loss: 1.3028, test_loss: 1.3167, test_f1: 0.2270
 epoch: 31, train_loss: 1.3023, test_loss: 1.3156, test_f1: 0.2270
 epoch: 32, train_loss: 1.3023, test_loss: 1.3153, test_f1: 0.2270
 epoch: 33, train_loss: 1.3024, test_loss: 1.3146, test_f1: 0.2270
 epoch: 34, train_loss: 1.3030, test_loss: 1.3158, test_f1: 0.2270
 epoch: 35, train_loss: 1.3034, test_loss: 1.3144, test_f1: 0.2270
 epoch: 36, train_loss: 1.3037, test_loss: 1.3163, test_f1: 0.2270
 epoch: 37, train_loss: 1.3021, test_loss: 1.3144, test_f1: 0.2270
 epoch: 38, train_loss: 1.3022, test_loss: 1.3155, test_f1: 0.2270
 epoch: 39, train_loss: 1.3018, test_loss: 1.3151, test_f1: 0.2270
 epoch: 40, train_loss: 1.3028, test_loss: 1.3166, test_f1: 0.2270
 epoch: 41, train_loss: 1.3033, test_loss: 1.3143, test_f1: 0.2270
 epoch: 42, train_loss: 1.3032, test_loss: 1.3168, test_f1: 0.2270
 epoch: 43, train_loss: 1.3026, test_loss: 1.3166, test_f1: 0.2270
 epoch: 44, train_loss: 1.3026, test_loss: 1.3153, test_f1: 0.2270
 epoch: 45, train_loss: 1.3022, test_loss: 1.3170, test_f1: 0.2270
 epoch: 46, train_loss: 1.3022, test_loss: 1.3150, test_f1: 0.2270
 epoch: 47, train_loss: 1.3027, test_loss: 1.3169, test_f1: 0.2270
 epoch: 48, train_loss: 1.3026, test_loss: 1.3146, test_f1: 0.2270
 epoch: 49, train_loss: 1.3019, test_loss: 1.3144, test_f1: 0.2270
 epoch: 50, train_loss: 1.3028, test_loss: 1.3153, test_f1: 0.2270
 epoch: 51, train_loss: 1.3018, test_loss: 1.3150, test_f1: 0.2270
 epoch: 52, train_loss: 1.3016, test_loss: 1.3141, test_f1: 0.2270
 epoch: 53, train_loss: 1.3016, test_loss: 1.3157, test_f1: 0.2270
 epoch: 54, train_loss: 1.3017, test_loss: 1.3146, test_f1: 0.2270
 epoch: 55, train_loss: 1.3016, test_loss: 1.3149, test_f1: 0.2270
 epoch: 56, train_loss: 1.3018, test_loss: 1.3152, test_f1: 0.2270
 epoch: 57, train_loss: 1.3017, test_loss: 1.3146, test_f1: 0.2270
 epoch: 58, train_loss: 1.3016, test_loss: 1.3158, test_f1: 0.2270
 epoch: 59, train_loss: 1.3017, test_loss: 1.3150, test_f1: 0.2270
 epoch: 60, train_loss: 1.3014, test_loss: 1.3156, test_f1: 0.2270
 epoch: 61, train_loss: 1.3018, test_loss: 1.3158, test_f1: 0.2270
 epoch: 62, train_loss: 1.3014, test_loss: 1.3142, test_f1: 0.2270
 epoch: 63, train_loss: 1.3016, test_loss: 1.3150, test_f1: 0.2270
 epoch: 64, train_loss: 1.3016, test_loss: 1.3150, test_f1: 0.2270
 epoch: 65, train_loss: 1.3014, test_loss: 1.3151, test_f1: 0.2270
 epoch: 66, train_loss: 1.3015, test_loss: 1.3155, test_f1: 0.2270
 epoch: 67, train_loss: 1.3017, test_loss: 1.3149, test_f1: 0.2270
 epoch: 68, train_loss: 1.3016, test_loss: 1.3155, test_f1: 0.2270
 epoch: 69, train_loss: 1.3014, test_loss: 1.3148, test_f1: 0.2270
 epoch: 70, train_loss: 1.3016, test_loss: 1.3147, test_f1: 0.2270
 epoch: 71, train_loss: 1.3017, test_loss: 1.3153, test_f1: 0.2270
 epoch: 72, train_loss: 1.3016, test_loss: 1.3153, test_f1: 0.2270
 epoch: 73, train_loss: 1.3015, test_loss: 1.3150, test_f1: 0.2270
 epoch: 74, train_loss: 1.3018, test_loss: 1.3155, test_f1: 0.2270
 epoch: 75, train_loss: 1.3016, test_loss: 1.3145, test_f1: 0.2270
 epoch: 76, train_loss: 1.3016, test_loss: 1.3155, test_f1: 0.2270
 epoch: 77, train_loss: 1.3021, test_loss: 1.3149, test_f1: 0.2270
 epoch: 78, train_loss: 1.3015, test_loss: 1.3153, test_f1: 0.2270
 epoch: 79, train_loss: 1.3014, test_loss: 1.3155, test_f1: 0.2270
 epoch: 80, train_loss: 1.3020, test_loss: 1.3143, test_f1: 0.2270
 epoch: 81, train_loss: 1.3015, test_loss: 1.3151, test_f1: 0.2270
 epoch: 82, train_loss: 1.3015, test_loss: 1.3151, test_f1: 0.2270
 epoch: 83, train_loss: 1.3016, test_loss: 1.3148, test_f1: 0.2270
 epoch: 84, train_loss: 1.3016, test_loss: 1.3149, test_f1: 0.2270
 epoch: 85, train_loss: 1.3014, test_loss: 1.3152, test_f1: 0.2270
 epoch: 86, train_loss: 1.3017, test_loss: 1.3151, test_f1: 0.2270
 epoch: 87, train_loss: 1.3017, test_loss: 1.3145, test_f1: 0.2270
 epoch: 88, train_loss: 1.3013, test_loss: 1.3156, test_f1: 0.2270
 epoch: 89, train_loss: 1.3020, test_loss: 1.3166, test_f1: 0.2270
 epoch: 90, train_loss: 1.3019, test_loss: 1.3142, test_f1: 0.2270
 epoch: 91, train_loss: 1.3016, test_loss: 1.3155, test_f1: 0.2270
 epoch: 92, train_loss: 1.3016, test_loss: 1.3153, test_f1: 0.2270
 epoch: 93, train_loss: 1.3016, test_loss: 1.3143, test_f1: 0.2270
 epoch: 94, train_loss: 1.3019, test_loss: 1.3161, test_f1: 0.2270
 epoch: 95, train_loss: 1.3014, test_loss: 1.3148, test_f1: 0.2270
 epoch: 96, train_loss: 1.3017, test_loss: 1.3145, test_f1: 0.2270
 epoch: 97, train_loss: 1.3017, test_loss: 1.3151, test_f1: 0.2270
 epoch: 98, train_loss: 1.3014, test_loss: 1.3156, test_f1: 0.2270
 epoch: 99, train_loss: 1.3018, test_loss: 1.3148, test_f1: 0.2270
##################ITERATION #7 ****************************************
 epoch: 0, train_loss: 1.3037, test_loss: 1.3185, test_f1: 0.2270
 epoch: 1, train_loss: 1.3037, test_loss: 1.3185, test_f1: 0.2270
 epoch: 2, train_loss: 1.3018, test_loss: 1.3138, test_f1: 0.2270
 epoch: 3, train_loss: 1.3016, test_loss: 1.3161, test_f1: 0.2270
 epoch: 4, train_loss: 1.3018, test_loss: 1.3156, test_f1: 0.2270
 epoch: 5, train_loss: 1.3023, test_loss: 1.3140, test_f1: 0.2270
 epoch: 6, train_loss: 1.3029, test_loss: 1.3149, test_f1: 0.2270
 epoch: 7, train_loss: 1.3034, test_loss: 1.3145, test_f1: 0.2270
 epoch: 8, train_loss: 1.3022, test_loss: 1.3163, test_f1: 0.2270
 epoch: 9, train_loss: 1.3018, test_loss: 1.3145, test_f1: 0.2270
 epoch: 10, train_loss: 1.3015, test_loss: 1.3152, test_f1: 0.2270
 epoch: 11, train_loss: 1.3021, test_loss: 1.3147, test_f1: 0.2270
 epoch: 12, train_loss: 1.3020, test_loss: 1.3160, test_f1: 0.2270
 epoch: 13, train_loss: 1.3023, test_loss: 1.3149, test_f1: 0.2270
 epoch: 14, train_loss: 1.3021, test_loss: 1.3144, test_f1: 0.2270
 epoch: 15, train_loss: 1.3021, test_loss: 1.3176, test_f1: 0.2270
 epoch: 16, train_loss: 1.3029, test_loss: 1.3150, test_f1: 0.2270
 epoch: 17, train_loss: 1.3018, test_loss: 1.3149, test_f1: 0.2270
 epoch: 18, train_loss: 1.3021, test_loss: 1.3156, test_f1: 0.2270
 epoch: 19, train_loss: 1.3016, test_loss: 1.3144, test_f1: 0.2270
 epoch: 20, train_loss: 1.3025, test_loss: 1.3151, test_f1: 0.2270
 epoch: 21, train_loss: 1.3037, test_loss: 1.3156, test_f1: 0.2270
 epoch: 22, train_loss: 1.3028, test_loss: 1.3147, test_f1: 0.2270
 epoch: 23, train_loss: 1.3024, test_loss: 1.3157, test_f1: 0.2270
 epoch: 24, train_loss: 1.3021, test_loss: 1.3162, test_f1: 0.2270
 epoch: 25, train_loss: 1.3023, test_loss: 1.3143, test_f1: 0.2270
 epoch: 26, train_loss: 1.3019, test_loss: 1.3156, test_f1: 0.2270
 epoch: 27, train_loss: 1.3022, test_loss: 1.3151, test_f1: 0.2270
 epoch: 28, train_loss: 1.3028, test_loss: 1.3170, test_f1: 0.2270
 epoch: 29, train_loss: 1.3025, test_loss: 1.3144, test_f1: 0.2270
 epoch: 30, train_loss: 1.3027, test_loss: 1.3145, test_f1: 0.2270
 epoch: 31, train_loss: 1.3020, test_loss: 1.3156, test_f1: 0.2270
 epoch: 32, train_loss: 1.3030, test_loss: 1.3141, test_f1: 0.2270
 epoch: 33, train_loss: 1.3024, test_loss: 1.3151, test_f1: 0.2270
 epoch: 34, train_loss: 1.3024, test_loss: 1.3148, test_f1: 0.2270
 epoch: 35, train_loss: 1.3028, test_loss: 1.3137, test_f1: 0.2270
 epoch: 36, train_loss: 1.3053, test_loss: 1.3161, test_f1: 0.2270
 epoch: 37, train_loss: 1.3042, test_loss: 1.3156, test_f1: 0.2270
 epoch: 38, train_loss: 1.3015, test_loss: 1.3158, test_f1: 0.2270
 epoch: 39, train_loss: 1.3025, test_loss: 1.3150, test_f1: 0.2270
 epoch: 40, train_loss: 1.3020, test_loss: 1.3162, test_f1: 0.2270
 epoch: 41, train_loss: 1.3022, test_loss: 1.3154, test_f1: 0.2270
 epoch: 42, train_loss: 1.3025, test_loss: 1.3159, test_f1: 0.2270
 epoch: 43, train_loss: 1.3021, test_loss: 1.3158, test_f1: 0.2270
 epoch: 44, train_loss: 1.3016, test_loss: 1.3157, test_f1: 0.2270
 epoch: 45, train_loss: 1.3020, test_loss: 1.3158, test_f1: 0.2270
 epoch: 46, train_loss: 1.3017, test_loss: 1.3148, test_f1: 0.2270
 epoch: 47, train_loss: 1.3025, test_loss: 1.3162, test_f1: 0.2270
 epoch: 48, train_loss: 1.3014, test_loss: 1.3151, test_f1: 0.2270
 epoch: 49, train_loss: 1.3023, test_loss: 1.3144, test_f1: 0.2270
 epoch: 50, train_loss: 1.3020, test_loss: 1.3159, test_f1: 0.2270
 epoch: 51, train_loss: 1.3015, test_loss: 1.3151, test_f1: 0.2270
 epoch: 52, train_loss: 1.3016, test_loss: 1.3146, test_f1: 0.2270
 epoch: 53, train_loss: 1.3020, test_loss: 1.3151, test_f1: 0.2270
 epoch: 54, train_loss: 1.3018, test_loss: 1.3154, test_f1: 0.2270
 epoch: 55, train_loss: 1.3017, test_loss: 1.3155, test_f1: 0.2270
 epoch: 56, train_loss: 1.3015, test_loss: 1.3148, test_f1: 0.2270
 epoch: 57, train_loss: 1.3018, test_loss: 1.3145, test_f1: 0.2270
 epoch: 58, train_loss: 1.3017, test_loss: 1.3156, test_f1: 0.2270
 epoch: 59, train_loss: 1.3014, test_loss: 1.3141, test_f1: 0.2270
 epoch: 60, train_loss: 1.3013, test_loss: 1.3150, test_f1: 0.2270
 epoch: 61, train_loss: 1.3022, test_loss: 1.3156, test_f1: 0.2270
 epoch: 62, train_loss: 1.3017, test_loss: 1.3147, test_f1: 0.2270
 epoch: 63, train_loss: 1.3020, test_loss: 1.3153, test_f1: 0.2270
 epoch: 64, train_loss: 1.3020, test_loss: 1.3160, test_f1: 0.2270
 epoch: 65, train_loss: 1.3015, test_loss: 1.3146, test_f1: 0.2270
 epoch: 66, train_loss: 1.3016, test_loss: 1.3146, test_f1: 0.2270
 epoch: 67, train_loss: 1.3016, test_loss: 1.3155, test_f1: 0.2270
 epoch: 68, train_loss: 1.3016, test_loss: 1.3151, test_f1: 0.2270
 epoch: 69, train_loss: 1.3014, test_loss: 1.3152, test_f1: 0.2270
 epoch: 70, train_loss: 1.3018, test_loss: 1.3143, test_f1: 0.2270
 epoch: 71, train_loss: 1.3022, test_loss: 1.3159, test_f1: 0.2270
 epoch: 72, train_loss: 1.3015, test_loss: 1.3145, test_f1: 0.2270
 epoch: 73, train_loss: 1.3015, test_loss: 1.3148, test_f1: 0.2270
 epoch: 74, train_loss: 1.3015, test_loss: 1.3153, test_f1: 0.2270
 epoch: 75, train_loss: 1.3017, test_loss: 1.3155, test_f1: 0.2270
 epoch: 76, train_loss: 1.3016, test_loss: 1.3148, test_f1: 0.2270
 epoch: 77, train_loss: 1.3015, test_loss: 1.3147, test_f1: 0.2270
 epoch: 78, train_loss: 1.3018, test_loss: 1.3145, test_f1: 0.2270
 epoch: 79, train_loss: 1.3012, test_loss: 1.3158, test_f1: 0.2270
 epoch: 80, train_loss: 1.3017, test_loss: 1.3158, test_f1: 0.2270
 epoch: 81, train_loss: 1.3016, test_loss: 1.3144, test_f1: 0.2270
 epoch: 82, train_loss: 1.3016, test_loss: 1.3156, test_f1: 0.2270
 epoch: 83, train_loss: 1.3018, test_loss: 1.3143, test_f1: 0.2270
 epoch: 84, train_loss: 1.3015, test_loss: 1.3155, test_f1: 0.2270
 epoch: 85, train_loss: 1.3016, test_loss: 1.3163, test_f1: 0.2270
 epoch: 86, train_loss: 1.3018, test_loss: 1.3149, test_f1: 0.2270
 epoch: 87, train_loss: 1.3015, test_loss: 1.3156, test_f1: 0.2270
 epoch: 88, train_loss: 1.3019, test_loss: 1.3148, test_f1: 0.2270
 epoch: 89, train_loss: 1.3018, test_loss: 1.3155, test_f1: 0.2270
 epoch: 90, train_loss: 1.3016, test_loss: 1.3148, test_f1: 0.2270
 epoch: 91, train_loss: 1.3017, test_loss: 1.3147, test_f1: 0.2270
 epoch: 92, train_loss: 1.3013, test_loss: 1.3154, test_f1: 0.2270
 epoch: 93, train_loss: 1.3022, test_loss: 1.3157, test_f1: 0.2270
 epoch: 94, train_loss: 1.3020, test_loss: 1.3145, test_f1: 0.2270
 epoch: 95, train_loss: 1.3017, test_loss: 1.3155, test_f1: 0.2270
 epoch: 96, train_loss: 1.3020, test_loss: 1.3141, test_f1: 0.2270
 epoch: 97, train_loss: 1.3018, test_loss: 1.3161, test_f1: 0.2270
 epoch: 98, train_loss: 1.3015, test_loss: 1.3154, test_f1: 0.2270
 epoch: 99, train_loss: 1.3016, test_loss: 1.3149, test_f1: 0.2270
##################ITERATION #8 ****************************************
 epoch: 0, train_loss: 1.3047, test_loss: 1.3157, test_f1: 0.2270
 epoch: 1, train_loss: 1.3028, test_loss: 1.3144, test_f1: 0.2270
 epoch: 2, train_loss: 1.3019, test_loss: 1.3149, test_f1: 0.2270
 epoch: 3, train_loss: 1.3020, test_loss: 1.3147, test_f1: 0.2270
 epoch: 4, train_loss: 1.3029, test_loss: 1.3172, test_f1: 0.2270
 epoch: 5, train_loss: 1.3040, test_loss: 1.3142, test_f1: 0.2270
 epoch: 6, train_loss: 1.3031, test_loss: 1.3158, test_f1: 0.2270
 epoch: 7, train_loss: 1.3025, test_loss: 1.3152, test_f1: 0.2270
 epoch: 8, train_loss: 1.3020, test_loss: 1.3167, test_f1: 0.2270
 epoch: 9, train_loss: 1.3020, test_loss: 1.3147, test_f1: 0.2270
 epoch: 10, train_loss: 1.3030, test_loss: 1.3163, test_f1: 0.2270
 epoch: 11, train_loss: 1.3037, test_loss: 1.3140, test_f1: 0.2270
 epoch: 12, train_loss: 1.3024, test_loss: 1.3159, test_f1: 0.2270
 epoch: 13, train_loss: 1.3021, test_loss: 1.3159, test_f1: 0.2270
 epoch: 14, train_loss: 1.3016, test_loss: 1.3143, test_f1: 0.2270
 epoch: 15, train_loss: 1.3021, test_loss: 1.3157, test_f1: 0.2270
 epoch: 16, train_loss: 1.3031, test_loss: 1.3157, test_f1: 0.2270
 epoch: 17, train_loss: 1.3018, test_loss: 1.3156, test_f1: 0.2270
 epoch: 18, train_loss: 1.3025, test_loss: 1.3155, test_f1: 0.2270
 epoch: 19, train_loss: 1.3024, test_loss: 1.3154, test_f1: 0.2270
 epoch: 20, train_loss: 1.3027, test_loss: 1.3139, test_f1: 0.2270
 epoch: 21, train_loss: 1.3022, test_loss: 1.3155, test_f1: 0.2270
 epoch: 22, train_loss: 1.3025, test_loss: 1.3153, test_f1: 0.2270
 epoch: 23, train_loss: 1.3017, test_loss: 1.3156, test_f1: 0.2270
 epoch: 24, train_loss: 1.3019, test_loss: 1.3150, test_f1: 0.2270
 epoch: 25, train_loss: 1.3018, test_loss: 1.3158, test_f1: 0.2270
 epoch: 26, train_loss: 1.3020, test_loss: 1.3146, test_f1: 0.2270
 epoch: 27, train_loss: 1.3021, test_loss: 1.3156, test_f1: 0.2270
 epoch: 28, train_loss: 1.3023, test_loss: 1.3153, test_f1: 0.2270
 epoch: 29, train_loss: 1.3017, test_loss: 1.3156, test_f1: 0.2270
 epoch: 30, train_loss: 1.3017, test_loss: 1.3148, test_f1: 0.2270
 epoch: 31, train_loss: 1.3017, test_loss: 1.3155, test_f1: 0.2270
 epoch: 32, train_loss: 1.3018, test_loss: 1.3159, test_f1: 0.2270
 epoch: 33, train_loss: 1.3021, test_loss: 1.3142, test_f1: 0.2270
 epoch: 34, train_loss: 1.3020, test_loss: 1.3159, test_f1: 0.2270
 epoch: 35, train_loss: 1.3023, test_loss: 1.3148, test_f1: 0.2270
 epoch: 36, train_loss: 1.3021, test_loss: 1.3150, test_f1: 0.2270
 epoch: 37, train_loss: 1.3020, test_loss: 1.3159, test_f1: 0.2270
 epoch: 38, train_loss: 1.3021, test_loss: 1.3159, test_f1: 0.2270
 epoch: 39, train_loss: 1.3018, test_loss: 1.3153, test_f1: 0.2270
 epoch: 40, train_loss: 1.3019, test_loss: 1.3160, test_f1: 0.2270
 epoch: 41, train_loss: 1.3026, test_loss: 1.3147, test_f1: 0.2270
 epoch: 42, train_loss: 1.3020, test_loss: 1.3165, test_f1: 0.2270
 epoch: 43, train_loss: 1.3015, test_loss: 1.3140, test_f1: 0.2270
 epoch: 44, train_loss: 1.3023, test_loss: 1.3145, test_f1: 0.2270
 epoch: 45, train_loss: 1.3015, test_loss: 1.3164, test_f1: 0.2270
 epoch: 46, train_loss: 1.3031, test_loss: 1.3152, test_f1: 0.2270
 epoch: 47, train_loss: 1.3022, test_loss: 1.3153, test_f1: 0.2270
 epoch: 48, train_loss: 1.3021, test_loss: 1.3141, test_f1: 0.2270
 epoch: 49, train_loss: 1.3018, test_loss: 1.3162, test_f1: 0.2270
 epoch: 50, train_loss: 1.3019, test_loss: 1.3141, test_f1: 0.2270
 epoch: 51, train_loss: 1.3018, test_loss: 1.3147, test_f1: 0.2270
 epoch: 52, train_loss: 1.3016, test_loss: 1.3158, test_f1: 0.2270
 epoch: 53, train_loss: 1.3020, test_loss: 1.3148, test_f1: 0.2270
 epoch: 54, train_loss: 1.3012, test_loss: 1.3159, test_f1: 0.2270
 epoch: 55, train_loss: 1.3022, test_loss: 1.3148, test_f1: 0.2270
 epoch: 56, train_loss: 1.3022, test_loss: 1.3159, test_f1: 0.2270
 epoch: 57, train_loss: 1.3027, test_loss: 1.3151, test_f1: 0.2270
 epoch: 58, train_loss: 1.3018, test_loss: 1.3160, test_f1: 0.2270
 epoch: 59, train_loss: 1.3017, test_loss: 1.3150, test_f1: 0.2270
 epoch: 60, train_loss: 1.3018, test_loss: 1.3144, test_f1: 0.2270
 epoch: 61, train_loss: 1.3012, test_loss: 1.3153, test_f1: 0.2270
 epoch: 62, train_loss: 1.3014, test_loss: 1.3155, test_f1: 0.2270
 epoch: 63, train_loss: 1.3013, test_loss: 1.3149, test_f1: 0.2270
 epoch: 64, train_loss: 1.3019, test_loss: 1.3147, test_f1: 0.2270
 epoch: 65, train_loss: 1.3018, test_loss: 1.3152, test_f1: 0.2270
 epoch: 66, train_loss: 1.3018, test_loss: 1.3154, test_f1: 0.2270
 epoch: 67, train_loss: 1.3014, test_loss: 1.3150, test_f1: 0.2270
 epoch: 68, train_loss: 1.3017, test_loss: 1.3153, test_f1: 0.2270
 epoch: 69, train_loss: 1.3019, test_loss: 1.3150, test_f1: 0.2270
 epoch: 70, train_loss: 1.3015, test_loss: 1.3152, test_f1: 0.2270
 epoch: 71, train_loss: 1.3017, test_loss: 1.3152, test_f1: 0.2270
 epoch: 72, train_loss: 1.3018, test_loss: 1.3149, test_f1: 0.2270
 epoch: 73, train_loss: 1.3015, test_loss: 1.3143, test_f1: 0.2270
 epoch: 74, train_loss: 1.3021, test_loss: 1.3160, test_f1: 0.2270
 epoch: 75, train_loss: 1.3017, test_loss: 1.3145, test_f1: 0.2270
 epoch: 76, train_loss: 1.3018, test_loss: 1.3148, test_f1: 0.2270
 epoch: 77, train_loss: 1.3014, test_loss: 1.3159, test_f1: 0.2270
 epoch: 78, train_loss: 1.3014, test_loss: 1.3148, test_f1: 0.2270
 epoch: 79, train_loss: 1.3016, test_loss: 1.3148, test_f1: 0.2270
 epoch: 80, train_loss: 1.3017, test_loss: 1.3162, test_f1: 0.2270
 epoch: 81, train_loss: 1.3020, test_loss: 1.3141, test_f1: 0.2270
 epoch: 82, train_loss: 1.3015, test_loss: 1.3153, test_f1: 0.2270
 epoch: 83, train_loss: 1.3022, test_loss: 1.3146, test_f1: 0.2270
 epoch: 84, train_loss: 1.3019, test_loss: 1.3159, test_f1: 0.2270
 epoch: 85, train_loss: 1.3016, test_loss: 1.3147, test_f1: 0.2270
 epoch: 86, train_loss: 1.3024, test_loss: 1.3158, test_f1: 0.2270
 epoch: 87, train_loss: 1.3017, test_loss: 1.3149, test_f1: 0.2270
 epoch: 88, train_loss: 1.3017, test_loss: 1.3150, test_f1: 0.2270
 epoch: 89, train_loss: 1.3017, test_loss: 1.3150, test_f1: 0.2270
 epoch: 90, train_loss: 1.3017, test_loss: 1.3152, test_f1: 0.2270
 epoch: 91, train_loss: 1.3015, test_loss: 1.3151, test_f1: 0.2270
 epoch: 92, train_loss: 1.3016, test_loss: 1.3151, test_f1: 0.2270
 epoch: 93, train_loss: 1.3017, test_loss: 1.3146, test_f1: 0.2270
 epoch: 94, train_loss: 1.3017, test_loss: 1.3150, test_f1: 0.2270
 epoch: 95, train_loss: 1.3018, test_loss: 1.3166, test_f1: 0.2270
 epoch: 96, train_loss: 1.3014, test_loss: 1.3145, test_f1: 0.2270
 epoch: 97, train_loss: 1.3014, test_loss: 1.3152, test_f1: 0.2270
 epoch: 98, train_loss: 1.3019, test_loss: 1.3151, test_f1: 0.2270
 epoch: 99, train_loss: 1.3015, test_loss: 1.3141, test_f1: 0.2270
##################ITERATION #9 ****************************************
 epoch: 0, train_loss: 1.3036, test_loss: 1.3176, test_f1: 0.2270
 epoch: 1, train_loss: 1.3030, test_loss: 1.3166, test_f1: 0.2270
 epoch: 2, train_loss: 1.3025, test_loss: 1.3163, test_f1: 0.2270
 epoch: 3, train_loss: 1.3022, test_loss: 1.3143, test_f1: 0.2270
 epoch: 4, train_loss: 1.3021, test_loss: 1.3151, test_f1: 0.2270
 epoch: 5, train_loss: 1.3020, test_loss: 1.3150, test_f1: 0.2270
 epoch: 6, train_loss: 1.3022, test_loss: 1.3156, test_f1: 0.2270
 epoch: 7, train_loss: 1.3018, test_loss: 1.3141, test_f1: 0.2270
 epoch: 8, train_loss: 1.3019, test_loss: 1.3160, test_f1: 0.2270
 epoch: 9, train_loss: 1.3017, test_loss: 1.3143, test_f1: 0.2270
 epoch: 10, train_loss: 1.3027, test_loss: 1.3150, test_f1: 0.2270
 epoch: 11, train_loss: 1.3023, test_loss: 1.3164, test_f1: 0.2270
 epoch: 12, train_loss: 1.3018, test_loss: 1.3154, test_f1: 0.2270
 epoch: 13, train_loss: 1.3014, test_loss: 1.3155, test_f1: 0.2270
 epoch: 14, train_loss: 1.3018, test_loss: 1.3153, test_f1: 0.2270
 epoch: 15, train_loss: 1.3018, test_loss: 1.3143, test_f1: 0.2270
 epoch: 16, train_loss: 1.3025, test_loss: 1.3152, test_f1: 0.2270
 epoch: 17, train_loss: 1.3026, test_loss: 1.3161, test_f1: 0.2270
 epoch: 18, train_loss: 1.3030, test_loss: 1.3144, test_f1: 0.2270
 epoch: 19, train_loss: 1.3055, test_loss: 1.3184, test_f1: 0.2270
 epoch: 20, train_loss: 1.3026, test_loss: 1.3153, test_f1: 0.2270
 epoch: 21, train_loss: 1.3017, test_loss: 1.3149, test_f1: 0.2270
 epoch: 22, train_loss: 1.3018, test_loss: 1.3163, test_f1: 0.2270
 epoch: 23, train_loss: 1.3027, test_loss: 1.3168, test_f1: 0.2270
 epoch: 24, train_loss: 1.3028, test_loss: 1.3159, test_f1: 0.2270
 epoch: 25, train_loss: 1.3017, test_loss: 1.3150, test_f1: 0.2270
 epoch: 26, train_loss: 1.3020, test_loss: 1.3149, test_f1: 0.2270
 epoch: 27, train_loss: 1.3019, test_loss: 1.3151, test_f1: 0.2270
 epoch: 28, train_loss: 1.3023, test_loss: 1.3161, test_f1: 0.2270
 epoch: 29, train_loss: 1.3029, test_loss: 1.3134, test_f1: 0.2270
 epoch: 30, train_loss: 1.3027, test_loss: 1.3159, test_f1: 0.2270
 epoch: 31, train_loss: 1.3020, test_loss: 1.3150, test_f1: 0.2270
 epoch: 32, train_loss: 1.3023, test_loss: 1.3146, test_f1: 0.2270
 epoch: 33, train_loss: 1.3029, test_loss: 1.3181, test_f1: 0.2270
 epoch: 34, train_loss: 1.3027, test_loss: 1.3142, test_f1: 0.2270
 epoch: 35, train_loss: 1.3026, test_loss: 1.3151, test_f1: 0.2270
 epoch: 36, train_loss: 1.3018, test_loss: 1.3147, test_f1: 0.2270
 epoch: 37, train_loss: 1.3019, test_loss: 1.3152, test_f1: 0.2270
 epoch: 38, train_loss: 1.3029, test_loss: 1.3146, test_f1: 0.2270
 epoch: 39, train_loss: 1.3018, test_loss: 1.3146, test_f1: 0.2270
 epoch: 40, train_loss: 1.3019, test_loss: 1.3154, test_f1: 0.2270
 epoch: 41, train_loss: 1.3025, test_loss: 1.3173, test_f1: 0.2270
 epoch: 42, train_loss: 1.3024, test_loss: 1.3143, test_f1: 0.2270
 epoch: 43, train_loss: 1.3020, test_loss: 1.3151, test_f1: 0.2270
 epoch: 44, train_loss: 1.3023, test_loss: 1.3145, test_f1: 0.2270
 epoch: 45, train_loss: 1.3027, test_loss: 1.3165, test_f1: 0.2270
 epoch: 46, train_loss: 1.3021, test_loss: 1.3162, test_f1: 0.2270
 epoch: 47, train_loss: 1.3019, test_loss: 1.3149, test_f1: 0.2270
 epoch: 48, train_loss: 1.3018, test_loss: 1.3154, test_f1: 0.2270
 epoch: 49, train_loss: 1.3019, test_loss: 1.3146, test_f1: 0.2270
 epoch: 50, train_loss: 1.3022, test_loss: 1.3155, test_f1: 0.2270
 epoch: 51, train_loss: 1.3013, test_loss: 1.3145, test_f1: 0.2270
 epoch: 52, train_loss: 1.3016, test_loss: 1.3151, test_f1: 0.2270
 epoch: 53, train_loss: 1.3017, test_loss: 1.3155, test_f1: 0.2270
 epoch: 54, train_loss: 1.3019, test_loss: 1.3145, test_f1: 0.2270
 epoch: 55, train_loss: 1.3024, test_loss: 1.3157, test_f1: 0.2270
 epoch: 56, train_loss: 1.3016, test_loss: 1.3142, test_f1: 0.2270
 epoch: 57, train_loss: 1.3020, test_loss: 1.3154, test_f1: 0.2270
 epoch: 58, train_loss: 1.3013, test_loss: 1.3150, test_f1: 0.2270
 epoch: 59, train_loss: 1.3016, test_loss: 1.3163, test_f1: 0.2270
 epoch: 60, train_loss: 1.3017, test_loss: 1.3144, test_f1: 0.2270
 epoch: 61, train_loss: 1.3016, test_loss: 1.3152, test_f1: 0.2270
 epoch: 62, train_loss: 1.3017, test_loss: 1.3154, test_f1: 0.2270
 epoch: 63, train_loss: 1.3016, test_loss: 1.3147, test_f1: 0.2270
 epoch: 64, train_loss: 1.3021, test_loss: 1.3144, test_f1: 0.2270
 epoch: 65, train_loss: 1.3014, test_loss: 1.3154, test_f1: 0.2270
 epoch: 66, train_loss: 1.3016, test_loss: 1.3151, test_f1: 0.2270
 epoch: 67, train_loss: 1.3018, test_loss: 1.3153, test_f1: 0.2270
 epoch: 68, train_loss: 1.3017, test_loss: 1.3156, test_f1: 0.2270
 epoch: 69, train_loss: 1.3017, test_loss: 1.3160, test_f1: 0.2270
 epoch: 70, train_loss: 1.3014, test_loss: 1.3141, test_f1: 0.2270
 epoch: 71, train_loss: 1.3019, test_loss: 1.3151, test_f1: 0.2270
 epoch: 72, train_loss: 1.3023, test_loss: 1.3159, test_f1: 0.2270
 epoch: 73, train_loss: 1.3014, test_loss: 1.3140, test_f1: 0.2270
 epoch: 74, train_loss: 1.3023, test_loss: 1.3154, test_f1: 0.2270
 epoch: 75, train_loss: 1.3016, test_loss: 1.3153, test_f1: 0.2270
 epoch: 76, train_loss: 1.3015, test_loss: 1.3144, test_f1: 0.2270
 epoch: 77, train_loss: 1.3018, test_loss: 1.3163, test_f1: 0.2270
 epoch: 78, train_loss: 1.3014, test_loss: 1.3152, test_f1: 0.2270
 epoch: 79, train_loss: 1.3015, test_loss: 1.3149, test_f1: 0.2270
 epoch: 80, train_loss: 1.3018, test_loss: 1.3151, test_f1: 0.2270
 epoch: 81, train_loss: 1.3020, test_loss: 1.3154, test_f1: 0.2270
 epoch: 82, train_loss: 1.3016, test_loss: 1.3157, test_f1: 0.2270
 epoch: 83, train_loss: 1.3015, test_loss: 1.3144, test_f1: 0.2270
 epoch: 84, train_loss: 1.3017, test_loss: 1.3159, test_f1: 0.2270
 epoch: 85, train_loss: 1.3019, test_loss: 1.3142, test_f1: 0.2270
 epoch: 86, train_loss: 1.3017, test_loss: 1.3158, test_f1: 0.2270
 epoch: 87, train_loss: 1.3016, test_loss: 1.3149, test_f1: 0.2270
 epoch: 88, train_loss: 1.3014, test_loss: 1.3151, test_f1: 0.2270
 epoch: 89, train_loss: 1.3019, test_loss: 1.3141, test_f1: 0.2270
 epoch: 90, train_loss: 1.3018, test_loss: 1.3157, test_f1: 0.2270
 epoch: 91, train_loss: 1.3018, test_loss: 1.3152, test_f1: 0.2270
 epoch: 92, train_loss: 1.3022, test_loss: 1.3160, test_f1: 0.2270
 epoch: 93, train_loss: 1.3015, test_loss: 1.3139, test_f1: 0.2270
 epoch: 94, train_loss: 1.3017, test_loss: 1.3149, test_f1: 0.2270
 epoch: 95, train_loss: 1.3015, test_loss: 1.3158, test_f1: 0.2270
 epoch: 96, train_loss: 1.3023, test_loss: 1.3146, test_f1: 0.2270
 epoch: 97, train_loss: 1.3019, test_loss: 1.3151, test_f1: 0.2270
 epoch: 98, train_loss: 1.3016, test_loss: 1.3148, test_f1: 0.2270
 epoch: 99, train_loss: 1.3016, test_loss: 1.3160, test_f1: 0.2270

Training completed in 635.88 seconds
Best F1: 0.4959 at epoch 96
Mean F1 across iterations: 0.2538  0.0807
========================FINAL RESULTS================================
FEGIN weighted F1: 0.4959  0.0807
python main.py --data ltspice_examples --representation component_pin_net --model FEGIN --layers 2 --hiddens 32 --batch_size 256 --lr 0.1 --emb_size 512 --epochs 100 --save_appendix component_pin_net_L2_H32_BS256_LR0.1_E512 --no_val
-----



STDERR:
  File "main.py", line 370, in <module>
    main()
  File "main.py", line 254, in main
    dataset = dataset_class(
  File "/home/philip/projects/ltspice_examples_code_repo/Circuit-Completion-Using-GNNs/component_classification_with_link_prediction_head/evaluation/FEGIN/kernel/circuit_datasets.py", line 15, in __init__
    self.data, self.slices = torch.load(self.processed_paths[0])
  File "/home/philip/.local/lib/python3.8/site-packages/torch/serialization.py", line 1040, in load
    warnings.warn(
  File "/usr/lib/python3.8/warnings.py", line 109, in _showwarnmsg
    sw(msg.message, msg.category, msg.filename, msg.lineno,
  File "main.py", line 47, in warn_with_traceback
    traceback.print_stack(file=log)
/home/philip/projects/ltspice_examples_code_repo/Circuit-Completion-Using-GNNs/component_classification_with_link_prediction_head/evaluation/FEGIN/kernel/circuit_datasets.py:15: FutureWarning: You are using `torch.load` with `weights_only=False` (the current default value), which uses the default pickle module implicitly. It is possible to construct malicious pickle data which will execute arbitrary code during unpickling (See https://github.com/pytorch/pytorch/blob/main/SECURITY.md#untrusted-models for more details). In a future release, the default value for `weights_only` will be flipped to `True`. This limits the functions that could be executed during unpickling. Arbitrary objects will no longer be allowed to be loaded via this mode unless they are explicitly allowlisted by the user via `torch.serialization.add_safe_globals`. We recommend you start setting `weights_only=True` for any use case where you don't have full control of the loaded file. Please open an issue on GitHub for any issues related to this experimental feature.
  self.data, self.slices = torch.load(self.processed_paths[0])
