STDOUT:
Results will be saved in /home/philip/projects/ltspice_examples_code_repo/Circuit-Completion-Using-GNNs/component_classification_with_link_prediction_head/evaluation/FEGIN/results/model_FEGIN_dataset_ltspice_examples
Command line input: python main.py --data ltspice_examples --representation component_net --model FEGIN --layers 2 --hiddens 128 --batch_size 64 --lr 0.0001 --emb_size 128 --epochs 100 --save_appendix component_net_L2_H128_BS64_LR0.0001_E128 --no_val
 is saved.
-----
ltspice_examples - FEGIN
Using 2 layers, 128 hidden units, h = 2
Loading component_net representation dataset
ENTERED
Training FEGIN on component_net representation
Train: 3558, Test: 846
##################ITERATION #0 ****************************************
 epoch: 0, train_loss: 1.3556, test_loss: 1.3344, test_f1: 0.2270
 epoch: 1, train_loss: 1.2907, test_loss: 1.2709, test_f1: 0.2270
 epoch: 2, train_loss: 1.2499, test_loss: 1.2251, test_f1: 0.2611
 epoch: 3, train_loss: 1.2118, test_loss: 1.1777, test_f1: 0.2996
 epoch: 4, train_loss: 1.1706, test_loss: 1.1223, test_f1: 0.3754
 epoch: 5, train_loss: 1.1235, test_loss: 1.0681, test_f1: 0.4274
 epoch: 6, train_loss: 1.0688, test_loss: 1.0266, test_f1: 0.4556
 epoch: 7, train_loss: 1.0254, test_loss: 0.9931, test_f1: 0.4568
 epoch: 8, train_loss: 0.9973, test_loss: 0.9710, test_f1: 0.4730
 epoch: 9, train_loss: 0.9763, test_loss: 0.9554, test_f1: 0.4843
 epoch: 10, train_loss: 0.9606, test_loss: 0.9440, test_f1: 0.4907
 epoch: 11, train_loss: 0.9487, test_loss: 0.9344, test_f1: 0.5035
 epoch: 12, train_loss: 0.9357, test_loss: 0.9313, test_f1: 0.4868
 epoch: 13, train_loss: 0.9255, test_loss: 0.9295, test_f1: 0.5310
 epoch: 14, train_loss: 0.9182, test_loss: 0.9370, test_f1: 0.4973
 epoch: 15, train_loss: 0.9180, test_loss: 0.9393, test_f1: 0.5138
 epoch: 16, train_loss: 0.9010, test_loss: 0.9354, test_f1: 0.4981
 epoch: 17, train_loss: 0.8996, test_loss: 0.9357, test_f1: 0.5176
 epoch: 18, train_loss: 0.8893, test_loss: 0.9420, test_f1: 0.5224
 epoch: 19, train_loss: 0.8903, test_loss: 0.9266, test_f1: 0.5177
 epoch: 20, train_loss: 0.8708, test_loss: 0.9193, test_f1: 0.5253
 epoch: 21, train_loss: 0.8718, test_loss: 0.9091, test_f1: 0.5347
 epoch: 22, train_loss: 0.8548, test_loss: 0.9068, test_f1: 0.5335
 epoch: 23, train_loss: 0.8542, test_loss: 0.8917, test_f1: 0.5389
 epoch: 24, train_loss: 0.8533, test_loss: 0.9439, test_f1: 0.5265
 epoch: 25, train_loss: 0.8399, test_loss: 0.9104, test_f1: 0.5266
 epoch: 26, train_loss: 0.8313, test_loss: 0.9235, test_f1: 0.5251
 epoch: 27, train_loss: 0.8302, test_loss: 0.9051, test_f1: 0.5449
 epoch: 28, train_loss: 0.8305, test_loss: 0.9042, test_f1: 0.5352
 epoch: 29, train_loss: 0.8161, test_loss: 0.9256, test_f1: 0.5333
 epoch: 30, train_loss: 0.8127, test_loss: 0.9219, test_f1: 0.5331
 epoch: 31, train_loss: 0.8055, test_loss: 0.9011, test_f1: 0.5494
 epoch: 32, train_loss: 0.8017, test_loss: 0.9328, test_f1: 0.5374
 epoch: 33, train_loss: 0.7961, test_loss: 0.9107, test_f1: 0.5295
 epoch: 34, train_loss: 0.7936, test_loss: 0.8839, test_f1: 0.5535
 epoch: 35, train_loss: 0.7929, test_loss: 0.9150, test_f1: 0.5351
 epoch: 36, train_loss: 0.7842, test_loss: 0.9287, test_f1: 0.5425
 epoch: 37, train_loss: 0.7818, test_loss: 0.9161, test_f1: 0.5328
 epoch: 38, train_loss: 0.7698, test_loss: 0.9333, test_f1: 0.5306
 epoch: 39, train_loss: 0.7711, test_loss: 0.9362, test_f1: 0.5585
 epoch: 40, train_loss: 0.7649, test_loss: 0.9222, test_f1: 0.5615
 epoch: 41, train_loss: 0.7687, test_loss: 0.9404, test_f1: 0.5277
 epoch: 42, train_loss: 0.7613, test_loss: 0.9240, test_f1: 0.5397
 epoch: 43, train_loss: 0.7579, test_loss: 0.9244, test_f1: 0.5350
 epoch: 44, train_loss: 0.7533, test_loss: 0.9360, test_f1: 0.5177
 epoch: 45, train_loss: 0.7521, test_loss: 0.9140, test_f1: 0.5531
 epoch: 46, train_loss: 0.7397, test_loss: 0.9121, test_f1: 0.5549
 epoch: 47, train_loss: 0.7419, test_loss: 0.9116, test_f1: 0.5674
 epoch: 48, train_loss: 0.7404, test_loss: 0.9334, test_f1: 0.5481
 epoch: 49, train_loss: 0.7399, test_loss: 0.9183, test_f1: 0.5508
 epoch: 50, train_loss: 0.7260, test_loss: 0.8972, test_f1: 0.5817
 epoch: 51, train_loss: 0.7199, test_loss: 0.9049, test_f1: 0.5717
 epoch: 52, train_loss: 0.7152, test_loss: 0.9090, test_f1: 0.5582
 epoch: 53, train_loss: 0.7079, test_loss: 0.9109, test_f1: 0.5673
 epoch: 54, train_loss: 0.7045, test_loss: 0.9241, test_f1: 0.5762
 epoch: 55, train_loss: 0.7141, test_loss: 0.9175, test_f1: 0.5701
 epoch: 56, train_loss: 0.7044, test_loss: 0.9293, test_f1: 0.5718
 epoch: 57, train_loss: 0.7082, test_loss: 0.9143, test_f1: 0.5730
 epoch: 58, train_loss: 0.6955, test_loss: 0.9201, test_f1: 0.5662
 epoch: 59, train_loss: 0.7017, test_loss: 0.9266, test_f1: 0.5630
 epoch: 60, train_loss: 0.7087, test_loss: 0.9429, test_f1: 0.5656
 epoch: 61, train_loss: 0.7014, test_loss: 0.9430, test_f1: 0.5707
 epoch: 62, train_loss: 0.6826, test_loss: 0.9225, test_f1: 0.5942
 epoch: 63, train_loss: 0.6976, test_loss: 0.9286, test_f1: 0.5792
 epoch: 64, train_loss: 0.6914, test_loss: 0.9571, test_f1: 0.5655
 epoch: 65, train_loss: 0.6896, test_loss: 0.9293, test_f1: 0.5826
 epoch: 66, train_loss: 0.6804, test_loss: 0.9337, test_f1: 0.6114
 epoch: 67, train_loss: 0.6826, test_loss: 0.9257, test_f1: 0.6046
 epoch: 68, train_loss: 0.6808, test_loss: 0.9536, test_f1: 0.5733
 epoch: 69, train_loss: 0.6834, test_loss: 0.9357, test_f1: 0.6019
 epoch: 70, train_loss: 0.6615, test_loss: 0.9593, test_f1: 0.6006
 epoch: 71, train_loss: 0.6775, test_loss: 0.9410, test_f1: 0.5829
 epoch: 72, train_loss: 0.6742, test_loss: 0.9365, test_f1: 0.6143
 epoch: 73, train_loss: 0.6797, test_loss: 0.9330, test_f1: 0.6058
 epoch: 74, train_loss: 0.6679, test_loss: 0.9340, test_f1: 0.6047
 epoch: 75, train_loss: 0.6697, test_loss: 0.9562, test_f1: 0.6159
 epoch: 76, train_loss: 0.6670, test_loss: 0.9244, test_f1: 0.6159
 epoch: 77, train_loss: 0.6698, test_loss: 0.9427, test_f1: 0.6096
 epoch: 78, train_loss: 0.6638, test_loss: 0.9621, test_f1: 0.5969
 epoch: 79, train_loss: 0.6575, test_loss: 0.9243, test_f1: 0.6289
 epoch: 80, train_loss: 0.6746, test_loss: 0.9664, test_f1: 0.5824
 epoch: 81, train_loss: 0.6579, test_loss: 0.9406, test_f1: 0.6094
 epoch: 82, train_loss: 0.6606, test_loss: 0.9507, test_f1: 0.6112
 epoch: 83, train_loss: 0.6625, test_loss: 0.9246, test_f1: 0.6279
 epoch: 84, train_loss: 0.6564, test_loss: 0.9280, test_f1: 0.6056
 epoch: 85, train_loss: 0.6472, test_loss: 0.9209, test_f1: 0.6258
 epoch: 86, train_loss: 0.6515, test_loss: 0.9433, test_f1: 0.6210
 epoch: 87, train_loss: 0.6493, test_loss: 0.9405, test_f1: 0.6094
 epoch: 88, train_loss: 0.6557, test_loss: 0.9524, test_f1: 0.6124
 epoch: 89, train_loss: 0.6521, test_loss: 0.9457, test_f1: 0.6181
 epoch: 90, train_loss: 0.6501, test_loss: 0.9293, test_f1: 0.6230
 epoch: 91, train_loss: 0.6338, test_loss: 0.9547, test_f1: 0.6034
 epoch: 92, train_loss: 0.6566, test_loss: 0.9454, test_f1: 0.6299
 epoch: 93, train_loss: 0.6489, test_loss: 0.9770, test_f1: 0.6184
 epoch: 94, train_loss: 0.6417, test_loss: 0.9607, test_f1: 0.6177
 epoch: 95, train_loss: 0.6403, test_loss: 0.9345, test_f1: 0.6294
 epoch: 96, train_loss: 0.6474, test_loss: 0.9508, test_f1: 0.6106
 epoch: 97, train_loss: 0.6479, test_loss: 0.9470, test_f1: 0.6192
 epoch: 98, train_loss: 0.6336, test_loss: 0.9656, test_f1: 0.6070
 epoch: 99, train_loss: 0.6256, test_loss: 0.9570, test_f1: 0.6063
##################ITERATION #1 ****************************************
 epoch: 0, train_loss: 1.2721, test_loss: 1.2297, test_f1: 0.2631
 epoch: 1, train_loss: 1.1720, test_loss: 1.1228, test_f1: 0.4090
 epoch: 2, train_loss: 1.1204, test_loss: 1.0634, test_f1: 0.4490
 epoch: 3, train_loss: 1.0721, test_loss: 1.0157, test_f1: 0.4731
 epoch: 4, train_loss: 1.0299, test_loss: 0.9761, test_f1: 0.4918
 epoch: 5, train_loss: 1.0017, test_loss: 0.9459, test_f1: 0.4839
 epoch: 6, train_loss: 0.9619, test_loss: 0.9531, test_f1: 0.4982
 epoch: 7, train_loss: 0.9552, test_loss: 0.9334, test_f1: 0.5059
 epoch: 8, train_loss: 0.9377, test_loss: 0.9234, test_f1: 0.5188
 epoch: 9, train_loss: 0.9321, test_loss: 0.9266, test_f1: 0.5082
 epoch: 10, train_loss: 0.9132, test_loss: 0.9049, test_f1: 0.5275
 epoch: 11, train_loss: 0.9009, test_loss: 0.8690, test_f1: 0.5332
 epoch: 12, train_loss: 0.8979, test_loss: 0.8757, test_f1: 0.5371
 epoch: 13, train_loss: 0.8823, test_loss: 0.8839, test_f1: 0.5397
 epoch: 14, train_loss: 0.8772, test_loss: 0.8838, test_f1: 0.5330
 epoch: 15, train_loss: 0.8661, test_loss: 0.8953, test_f1: 0.5285
 epoch: 16, train_loss: 0.8662, test_loss: 0.8846, test_f1: 0.5438
 epoch: 17, train_loss: 0.8577, test_loss: 0.8635, test_f1: 0.5391
 epoch: 18, train_loss: 0.8460, test_loss: 0.8872, test_f1: 0.5594
 epoch: 19, train_loss: 0.8420, test_loss: 0.8560, test_f1: 0.5683
 epoch: 20, train_loss: 0.8365, test_loss: 0.8706, test_f1: 0.5386
 epoch: 21, train_loss: 0.8381, test_loss: 0.8577, test_f1: 0.5526
 epoch: 22, train_loss: 0.8234, test_loss: 0.8707, test_f1: 0.5550
 epoch: 23, train_loss: 0.8265, test_loss: 0.8576, test_f1: 0.5520
 epoch: 24, train_loss: 0.8157, test_loss: 0.8496, test_f1: 0.5492
 epoch: 25, train_loss: 0.8110, test_loss: 0.8587, test_f1: 0.5522
 epoch: 26, train_loss: 0.7998, test_loss: 0.8741, test_f1: 0.5418
 epoch: 27, train_loss: 0.8034, test_loss: 0.8695, test_f1: 0.5412
 epoch: 28, train_loss: 0.8009, test_loss: 0.8407, test_f1: 0.5505
 epoch: 29, train_loss: 0.7949, test_loss: 0.8797, test_f1: 0.5462
 epoch: 30, train_loss: 0.7863, test_loss: 0.8568, test_f1: 0.5599
 epoch: 31, train_loss: 0.7822, test_loss: 0.8472, test_f1: 0.5551
 epoch: 32, train_loss: 0.7804, test_loss: 0.8422, test_f1: 0.5489
 epoch: 33, train_loss: 0.7741, test_loss: 0.8573, test_f1: 0.5620
 epoch: 34, train_loss: 0.7635, test_loss: 0.8745, test_f1: 0.5493
 epoch: 35, train_loss: 0.7619, test_loss: 0.8869, test_f1: 0.5554
 epoch: 36, train_loss: 0.7588, test_loss: 0.8736, test_f1: 0.5859
 epoch: 37, train_loss: 0.7442, test_loss: 0.8494, test_f1: 0.5917
 epoch: 38, train_loss: 0.7542, test_loss: 0.8835, test_f1: 0.5616
 epoch: 39, train_loss: 0.7449, test_loss: 0.8628, test_f1: 0.5850
 epoch: 40, train_loss: 0.7352, test_loss: 0.8641, test_f1: 0.5793
 epoch: 41, train_loss: 0.7304, test_loss: 0.8669, test_f1: 0.5705
 epoch: 42, train_loss: 0.7447, test_loss: 0.8506, test_f1: 0.5627
 epoch: 43, train_loss: 0.7265, test_loss: 0.8791, test_f1: 0.5713
 epoch: 44, train_loss: 0.7128, test_loss: 0.8637, test_f1: 0.5738
 epoch: 45, train_loss: 0.7236, test_loss: 0.8745, test_f1: 0.5947
 epoch: 46, train_loss: 0.7232, test_loss: 0.8682, test_f1: 0.6014
 epoch: 47, train_loss: 0.7189, test_loss: 0.8536, test_f1: 0.5885
 epoch: 48, train_loss: 0.7170, test_loss: 0.8494, test_f1: 0.6372
 epoch: 49, train_loss: 0.7064, test_loss: 0.8714, test_f1: 0.5875
 epoch: 50, train_loss: 0.6986, test_loss: 0.8613, test_f1: 0.6300
 epoch: 51, train_loss: 0.6916, test_loss: 0.8798, test_f1: 0.6165
 epoch: 52, train_loss: 0.6829, test_loss: 0.8700, test_f1: 0.6263
 epoch: 53, train_loss: 0.6863, test_loss: 0.8559, test_f1: 0.6398
 epoch: 54, train_loss: 0.6767, test_loss: 0.8868, test_f1: 0.6217
 epoch: 55, train_loss: 0.6857, test_loss: 0.8791, test_f1: 0.6074
 epoch: 56, train_loss: 0.6736, test_loss: 0.8718, test_f1: 0.6556
 epoch: 57, train_loss: 0.6682, test_loss: 0.8917, test_f1: 0.5955
 epoch: 58, train_loss: 0.6662, test_loss: 0.8528, test_f1: 0.6583
 epoch: 59, train_loss: 0.6668, test_loss: 0.8905, test_f1: 0.6183
 epoch: 60, train_loss: 0.6596, test_loss: 0.8550, test_f1: 0.6205
 epoch: 61, train_loss: 0.6647, test_loss: 0.9007, test_f1: 0.6415
 epoch: 62, train_loss: 0.6575, test_loss: 0.8649, test_f1: 0.6269
 epoch: 63, train_loss: 0.6554, test_loss: 0.8599, test_f1: 0.6285
 epoch: 64, train_loss: 0.6600, test_loss: 0.8629, test_f1: 0.6314
 epoch: 65, train_loss: 0.6542, test_loss: 0.8791, test_f1: 0.6108
 epoch: 66, train_loss: 0.6493, test_loss: 0.8840, test_f1: 0.6450
 epoch: 67, train_loss: 0.6547, test_loss: 0.8809, test_f1: 0.6202
 epoch: 68, train_loss: 0.6426, test_loss: 0.8781, test_f1: 0.6414
 epoch: 69, train_loss: 0.6416, test_loss: 0.8837, test_f1: 0.6100
 epoch: 70, train_loss: 0.6359, test_loss: 0.8732, test_f1: 0.6142
 epoch: 71, train_loss: 0.6459, test_loss: 0.8811, test_f1: 0.6371
 epoch: 72, train_loss: 0.6306, test_loss: 0.8878, test_f1: 0.6264
 epoch: 73, train_loss: 0.6335, test_loss: 0.8897, test_f1: 0.6400
 epoch: 74, train_loss: 0.6395, test_loss: 0.9011, test_f1: 0.6569
 epoch: 75, train_loss: 0.6326, test_loss: 0.8794, test_f1: 0.6448
 epoch: 76, train_loss: 0.6340, test_loss: 0.9151, test_f1: 0.6176
 epoch: 77, train_loss: 0.6179, test_loss: 0.8895, test_f1: 0.6214
 epoch: 78, train_loss: 0.6284, test_loss: 0.9051, test_f1: 0.6341
 epoch: 79, train_loss: 0.6291, test_loss: 0.8976, test_f1: 0.6176
 epoch: 80, train_loss: 0.6235, test_loss: 0.9062, test_f1: 0.6174
 epoch: 81, train_loss: 0.6253, test_loss: 0.8895, test_f1: 0.6218
 epoch: 82, train_loss: 0.6323, test_loss: 0.8965, test_f1: 0.6414
 epoch: 83, train_loss: 0.6163, test_loss: 0.9029, test_f1: 0.6362
 epoch: 84, train_loss: 0.6176, test_loss: 0.8882, test_f1: 0.6281
 epoch: 85, train_loss: 0.6189, test_loss: 0.9161, test_f1: 0.6418
 epoch: 86, train_loss: 0.6232, test_loss: 0.9239, test_f1: 0.6178
 epoch: 87, train_loss: 0.6142, test_loss: 0.8911, test_f1: 0.6598
 epoch: 88, train_loss: 0.6098, test_loss: 0.9109, test_f1: 0.6265
 epoch: 89, train_loss: 0.6075, test_loss: 0.8929, test_f1: 0.6507
 epoch: 90, train_loss: 0.6020, test_loss: 0.9106, test_f1: 0.6462
 epoch: 91, train_loss: 0.6151, test_loss: 0.9356, test_f1: 0.6614
 epoch: 92, train_loss: 0.5964, test_loss: 0.9290, test_f1: 0.6504
 epoch: 93, train_loss: 0.6058, test_loss: 0.9231, test_f1: 0.6503
 epoch: 94, train_loss: 0.5990, test_loss: 0.9350, test_f1: 0.6132
 epoch: 95, train_loss: 0.5967, test_loss: 0.9321, test_f1: 0.6544
 epoch: 96, train_loss: 0.5997, test_loss: 0.9157, test_f1: 0.6506
 epoch: 97, train_loss: 0.5886, test_loss: 0.9244, test_f1: 0.6331
 epoch: 98, train_loss: 0.5851, test_loss: 0.9644, test_f1: 0.6126
 epoch: 99, train_loss: 0.5875, test_loss: 0.9240, test_f1: 0.6439
##################ITERATION #2 ****************************************
 epoch: 0, train_loss: 1.2300, test_loss: 1.1706, test_f1: 0.3547
 epoch: 1, train_loss: 1.1202, test_loss: 1.0618, test_f1: 0.4530
 epoch: 2, train_loss: 1.0644, test_loss: 1.0141, test_f1: 0.4631
 epoch: 3, train_loss: 1.0222, test_loss: 0.9777, test_f1: 0.4918
 epoch: 4, train_loss: 0.9958, test_loss: 0.9460, test_f1: 0.4931
 epoch: 5, train_loss: 0.9699, test_loss: 0.9412, test_f1: 0.5294
 epoch: 6, train_loss: 0.9438, test_loss: 0.9192, test_f1: 0.5346
 epoch: 7, train_loss: 0.9363, test_loss: 0.9075, test_f1: 0.5459
 epoch: 8, train_loss: 0.9190, test_loss: 0.9057, test_f1: 0.5161
 epoch: 9, train_loss: 0.9085, test_loss: 0.9032, test_f1: 0.5449
 epoch: 10, train_loss: 0.8995, test_loss: 0.8876, test_f1: 0.5643
 epoch: 11, train_loss: 0.8925, test_loss: 0.8851, test_f1: 0.5649
 epoch: 12, train_loss: 0.8804, test_loss: 0.8995, test_f1: 0.5351
 epoch: 13, train_loss: 0.8740, test_loss: 0.8833, test_f1: 0.5672
 epoch: 14, train_loss: 0.8612, test_loss: 0.8710, test_f1: 0.5593
 epoch: 15, train_loss: 0.8496, test_loss: 0.9078, test_f1: 0.5626
 epoch: 16, train_loss: 0.8449, test_loss: 0.9042, test_f1: 0.5454
 epoch: 17, train_loss: 0.8371, test_loss: 0.8775, test_f1: 0.5920
 epoch: 18, train_loss: 0.8419, test_loss: 0.8884, test_f1: 0.5596
 epoch: 19, train_loss: 0.8270, test_loss: 0.8996, test_f1: 0.5662
 epoch: 20, train_loss: 0.8206, test_loss: 0.8894, test_f1: 0.5434
 epoch: 21, train_loss: 0.8086, test_loss: 0.8926, test_f1: 0.5692
 epoch: 22, train_loss: 0.8121, test_loss: 0.9077, test_f1: 0.5419
 epoch: 23, train_loss: 0.7962, test_loss: 0.8889, test_f1: 0.5344
 epoch: 24, train_loss: 0.7962, test_loss: 0.9006, test_f1: 0.5420
 epoch: 25, train_loss: 0.7957, test_loss: 0.8982, test_f1: 0.5551
 epoch: 26, train_loss: 0.7831, test_loss: 0.8648, test_f1: 0.5843
 epoch: 27, train_loss: 0.7767, test_loss: 0.9202, test_f1: 0.5587
 epoch: 28, train_loss: 0.7792, test_loss: 0.9584, test_f1: 0.5437
 epoch: 29, train_loss: 0.7726, test_loss: 0.9133, test_f1: 0.5540
 epoch: 30, train_loss: 0.7687, test_loss: 0.9262, test_f1: 0.5486
 epoch: 31, train_loss: 0.7594, test_loss: 0.9214, test_f1: 0.5669
 epoch: 32, train_loss: 0.7591, test_loss: 0.8888, test_f1: 0.5899
 epoch: 33, train_loss: 0.7433, test_loss: 0.9173, test_f1: 0.5749
 epoch: 34, train_loss: 0.7425, test_loss: 0.8991, test_f1: 0.6130
 epoch: 35, train_loss: 0.7458, test_loss: 0.9117, test_f1: 0.5762
 epoch: 36, train_loss: 0.7345, test_loss: 0.9223, test_f1: 0.5866
 epoch: 37, train_loss: 0.7364, test_loss: 0.8867, test_f1: 0.5972
 epoch: 38, train_loss: 0.7272, test_loss: 0.9278, test_f1: 0.5923
 epoch: 39, train_loss: 0.7188, test_loss: 0.9127, test_f1: 0.5802
 epoch: 40, train_loss: 0.7194, test_loss: 0.9062, test_f1: 0.5952
 epoch: 41, train_loss: 0.7199, test_loss: 0.9197, test_f1: 0.5884
 epoch: 42, train_loss: 0.7058, test_loss: 0.8888, test_f1: 0.6145
 epoch: 43, train_loss: 0.7069, test_loss: 0.8977, test_f1: 0.6068
 epoch: 44, train_loss: 0.7066, test_loss: 0.9169, test_f1: 0.6061
 epoch: 45, train_loss: 0.7057, test_loss: 0.9352, test_f1: 0.5887
 epoch: 46, train_loss: 0.7016, test_loss: 0.9265, test_f1: 0.6082
 epoch: 47, train_loss: 0.6943, test_loss: 0.8834, test_f1: 0.6189
 epoch: 48, train_loss: 0.7013, test_loss: 0.9052, test_f1: 0.6099
 epoch: 49, train_loss: 0.6814, test_loss: 0.9136, test_f1: 0.6097
 epoch: 50, train_loss: 0.6912, test_loss: 0.9159, test_f1: 0.6054
 epoch: 51, train_loss: 0.6664, test_loss: 0.8963, test_f1: 0.6249
 epoch: 52, train_loss: 0.6684, test_loss: 0.8959, test_f1: 0.6244
 epoch: 53, train_loss: 0.6616, test_loss: 0.9166, test_f1: 0.6078
 epoch: 54, train_loss: 0.6554, test_loss: 0.9063, test_f1: 0.6273
 epoch: 55, train_loss: 0.6521, test_loss: 0.9331, test_f1: 0.6214
 epoch: 56, train_loss: 0.6540, test_loss: 0.9152, test_f1: 0.6291
 epoch: 57, train_loss: 0.6568, test_loss: 0.9028, test_f1: 0.6367
 epoch: 58, train_loss: 0.6536, test_loss: 0.9209, test_f1: 0.6333
 epoch: 59, train_loss: 0.6509, test_loss: 0.9207, test_f1: 0.6251
 epoch: 60, train_loss: 0.6562, test_loss: 0.9404, test_f1: 0.6149
 epoch: 61, train_loss: 0.6467, test_loss: 0.9190, test_f1: 0.6138
 epoch: 62, train_loss: 0.6325, test_loss: 0.9541, test_f1: 0.6164
 epoch: 63, train_loss: 0.6416, test_loss: 0.9408, test_f1: 0.6189
 epoch: 64, train_loss: 0.6399, test_loss: 0.9095, test_f1: 0.6384
 epoch: 65, train_loss: 0.6374, test_loss: 0.9132, test_f1: 0.6300
 epoch: 66, train_loss: 0.6328, test_loss: 0.9347, test_f1: 0.6148
 epoch: 67, train_loss: 0.6351, test_loss: 0.9227, test_f1: 0.6314
 epoch: 68, train_loss: 0.6309, test_loss: 0.9395, test_f1: 0.6385
 epoch: 69, train_loss: 0.6376, test_loss: 0.9421, test_f1: 0.6212
 epoch: 70, train_loss: 0.6271, test_loss: 0.9454, test_f1: 0.6479
 epoch: 71, train_loss: 0.6236, test_loss: 0.9583, test_f1: 0.6249
 epoch: 72, train_loss: 0.6221, test_loss: 0.9505, test_f1: 0.6612
 epoch: 73, train_loss: 0.6277, test_loss: 0.9570, test_f1: 0.6397
 epoch: 74, train_loss: 0.6213, test_loss: 0.9810, test_f1: 0.6420
 epoch: 75, train_loss: 0.6218, test_loss: 0.9441, test_f1: 0.6486
 epoch: 76, train_loss: 0.6137, test_loss: 0.9570, test_f1: 0.6454
 epoch: 77, train_loss: 0.6127, test_loss: 0.9506, test_f1: 0.6620
 epoch: 78, train_loss: 0.6114, test_loss: 0.9680, test_f1: 0.6494
 epoch: 79, train_loss: 0.6011, test_loss: 0.9538, test_f1: 0.6557
 epoch: 80, train_loss: 0.6061, test_loss: 0.9424, test_f1: 0.6471
 epoch: 81, train_loss: 0.6075, test_loss: 0.9680, test_f1: 0.6431
 epoch: 82, train_loss: 0.6040, test_loss: 0.9704, test_f1: 0.6461
 epoch: 83, train_loss: 0.6095, test_loss: 0.9671, test_f1: 0.6565
 epoch: 84, train_loss: 0.6050, test_loss: 0.9556, test_f1: 0.6648
 epoch: 85, train_loss: 0.6015, test_loss: 0.9863, test_f1: 0.6471
 epoch: 86, train_loss: 0.5881, test_loss: 0.9698, test_f1: 0.6311
 epoch: 87, train_loss: 0.5935, test_loss: 0.9752, test_f1: 0.6607
 epoch: 88, train_loss: 0.6052, test_loss: 0.9818, test_f1: 0.6409
 epoch: 89, train_loss: 0.5971, test_loss: 0.9522, test_f1: 0.6670
 epoch: 90, train_loss: 0.5939, test_loss: 0.9725, test_f1: 0.6627
 epoch: 91, train_loss: 0.5910, test_loss: 0.9851, test_f1: 0.6472
 epoch: 92, train_loss: 0.5855, test_loss: 0.9727, test_f1: 0.6662
 epoch: 93, train_loss: 0.5874, test_loss: 0.9879, test_f1: 0.6620
 epoch: 94, train_loss: 0.5967, test_loss: 0.9755, test_f1: 0.6705
 epoch: 95, train_loss: 0.5740, test_loss: 0.9892, test_f1: 0.6541
 epoch: 96, train_loss: 0.5992, test_loss: 1.0040, test_f1: 0.6501
 epoch: 97, train_loss: 0.5882, test_loss: 0.9780, test_f1: 0.6686
 epoch: 98, train_loss: 0.5714, test_loss: 0.9831, test_f1: 0.6481
 epoch: 99, train_loss: 0.5704, test_loss: 0.9799, test_f1: 0.6715
##################ITERATION #3 ****************************************
 epoch: 0, train_loss: 1.2075, test_loss: 1.1301, test_f1: 0.3679
 epoch: 1, train_loss: 1.0842, test_loss: 1.0106, test_f1: 0.4893
 epoch: 2, train_loss: 1.0434, test_loss: 0.9940, test_f1: 0.4989
 epoch: 3, train_loss: 1.0002, test_loss: 0.9683, test_f1: 0.5073
 epoch: 4, train_loss: 0.9766, test_loss: 0.9486, test_f1: 0.5105
 epoch: 5, train_loss: 0.9649, test_loss: 0.9463, test_f1: 0.5264
 epoch: 6, train_loss: 0.9444, test_loss: 0.9316, test_f1: 0.5318
 epoch: 7, train_loss: 0.9351, test_loss: 0.9172, test_f1: 0.5517
 epoch: 8, train_loss: 0.9143, test_loss: 0.9061, test_f1: 0.5566
 epoch: 9, train_loss: 0.9037, test_loss: 0.9052, test_f1: 0.5409
 epoch: 10, train_loss: 0.9014, test_loss: 0.8969, test_f1: 0.5530
 epoch: 11, train_loss: 0.8794, test_loss: 0.9030, test_f1: 0.5570
 epoch: 12, train_loss: 0.8754, test_loss: 0.9017, test_f1: 0.5587
 epoch: 13, train_loss: 0.8665, test_loss: 0.8809, test_f1: 0.5631
 epoch: 14, train_loss: 0.8644, test_loss: 0.9044, test_f1: 0.5530
 epoch: 15, train_loss: 0.8540, test_loss: 0.8946, test_f1: 0.5531
 epoch: 16, train_loss: 0.8455, test_loss: 0.9069, test_f1: 0.5458
 epoch: 17, train_loss: 0.8438, test_loss: 0.9045, test_f1: 0.5369
 epoch: 18, train_loss: 0.8313, test_loss: 0.9052, test_f1: 0.5475
 epoch: 19, train_loss: 0.8292, test_loss: 0.8831, test_f1: 0.5544
 epoch: 20, train_loss: 0.8225, test_loss: 0.8915, test_f1: 0.5412
 epoch: 21, train_loss: 0.8083, test_loss: 0.9011, test_f1: 0.5420
 epoch: 22, train_loss: 0.8133, test_loss: 0.9075, test_f1: 0.5490
 epoch: 23, train_loss: 0.8078, test_loss: 0.8879, test_f1: 0.5413
 epoch: 24, train_loss: 0.8009, test_loss: 0.9012, test_f1: 0.5453
 epoch: 25, train_loss: 0.7940, test_loss: 0.8977, test_f1: 0.5564
 epoch: 26, train_loss: 0.7944, test_loss: 0.8987, test_f1: 0.5480
 epoch: 27, train_loss: 0.7814, test_loss: 0.8964, test_f1: 0.5626
 epoch: 28, train_loss: 0.7788, test_loss: 0.9202, test_f1: 0.6001
 epoch: 29, train_loss: 0.7695, test_loss: 0.9129, test_f1: 0.5659
 epoch: 30, train_loss: 0.7572, test_loss: 0.9016, test_f1: 0.5709
 epoch: 31, train_loss: 0.7584, test_loss: 0.9317, test_f1: 0.5510
 epoch: 32, train_loss: 0.7670, test_loss: 0.9101, test_f1: 0.5640
 epoch: 33, train_loss: 0.7429, test_loss: 0.9146, test_f1: 0.5906
 epoch: 34, train_loss: 0.7398, test_loss: 0.9061, test_f1: 0.5801
 epoch: 35, train_loss: 0.7461, test_loss: 0.9199, test_f1: 0.5693
 epoch: 36, train_loss: 0.7395, test_loss: 0.9276, test_f1: 0.5913
 epoch: 37, train_loss: 0.7376, test_loss: 0.9135, test_f1: 0.5957
 epoch: 38, train_loss: 0.7310, test_loss: 0.9347, test_f1: 0.5868
 epoch: 39, train_loss: 0.7198, test_loss: 0.9274, test_f1: 0.5637
 epoch: 40, train_loss: 0.7313, test_loss: 0.9287, test_f1: 0.5704
 epoch: 41, train_loss: 0.7251, test_loss: 0.9097, test_f1: 0.6209
 epoch: 42, train_loss: 0.7155, test_loss: 0.9473, test_f1: 0.6002
 epoch: 43, train_loss: 0.7135, test_loss: 0.9432, test_f1: 0.6085
 epoch: 44, train_loss: 0.7006, test_loss: 0.9094, test_f1: 0.6143
 epoch: 45, train_loss: 0.7091, test_loss: 0.9431, test_f1: 0.5992
 epoch: 46, train_loss: 0.6826, test_loss: 0.9552, test_f1: 0.6241
 epoch: 47, train_loss: 0.6920, test_loss: 0.9331, test_f1: 0.6155
 epoch: 48, train_loss: 0.6880, test_loss: 0.9644, test_f1: 0.6119
 epoch: 49, train_loss: 0.6842, test_loss: 0.9536, test_f1: 0.6121
 epoch: 50, train_loss: 0.6771, test_loss: 0.9511, test_f1: 0.5988
 epoch: 51, train_loss: 0.6808, test_loss: 0.9504, test_f1: 0.6096
 epoch: 52, train_loss: 0.6742, test_loss: 0.9657, test_f1: 0.6055
 epoch: 53, train_loss: 0.6644, test_loss: 0.9599, test_f1: 0.6046
 epoch: 54, train_loss: 0.6704, test_loss: 0.9627, test_f1: 0.5989
 epoch: 55, train_loss: 0.6671, test_loss: 0.9448, test_f1: 0.5992
 epoch: 56, train_loss: 0.6650, test_loss: 0.9540, test_f1: 0.6170
 epoch: 57, train_loss: 0.6459, test_loss: 0.9668, test_f1: 0.6084
 epoch: 58, train_loss: 0.6512, test_loss: 0.9516, test_f1: 0.6187
 epoch: 59, train_loss: 0.6594, test_loss: 0.9801, test_f1: 0.6184
 epoch: 60, train_loss: 0.6531, test_loss: 0.9647, test_f1: 0.6071
 epoch: 61, train_loss: 0.6602, test_loss: 0.9544, test_f1: 0.6126
 epoch: 62, train_loss: 0.6480, test_loss: 0.9372, test_f1: 0.6182
 epoch: 63, train_loss: 0.6520, test_loss: 0.9693, test_f1: 0.6280
 epoch: 64, train_loss: 0.6446, test_loss: 0.9581, test_f1: 0.6613
 epoch: 65, train_loss: 0.6411, test_loss: 0.9591, test_f1: 0.6504
 epoch: 66, train_loss: 0.6466, test_loss: 0.9757, test_f1: 0.6384
 epoch: 67, train_loss: 0.6442, test_loss: 0.9730, test_f1: 0.6224
 epoch: 68, train_loss: 0.6447, test_loss: 0.9895, test_f1: 0.6333
 epoch: 69, train_loss: 0.6315, test_loss: 0.9737, test_f1: 0.6336
 epoch: 70, train_loss: 0.6365, test_loss: 0.9872, test_f1: 0.6491
 epoch: 71, train_loss: 0.6252, test_loss: 0.9813, test_f1: 0.6382
 epoch: 72, train_loss: 0.6409, test_loss: 0.9957, test_f1: 0.6200
 epoch: 73, train_loss: 0.6394, test_loss: 1.0050, test_f1: 0.6314
 epoch: 74, train_loss: 0.6255, test_loss: 0.9984, test_f1: 0.6268
 epoch: 75, train_loss: 0.6275, test_loss: 0.9796, test_f1: 0.6343
 epoch: 76, train_loss: 0.6320, test_loss: 0.9806, test_f1: 0.6504
 epoch: 77, train_loss: 0.6180, test_loss: 0.9863, test_f1: 0.6417
 epoch: 78, train_loss: 0.6143, test_loss: 0.9780, test_f1: 0.6409
 epoch: 79, train_loss: 0.6122, test_loss: 0.9805, test_f1: 0.6127
 epoch: 80, train_loss: 0.6244, test_loss: 1.0003, test_f1: 0.6551
 epoch: 81, train_loss: 0.6217, test_loss: 0.9671, test_f1: 0.6547
 epoch: 82, train_loss: 0.6116, test_loss: 0.9817, test_f1: 0.6456
 epoch: 83, train_loss: 0.6135, test_loss: 0.9812, test_f1: 0.6449
 epoch: 84, train_loss: 0.6058, test_loss: 0.9939, test_f1: 0.6623
 epoch: 85, train_loss: 0.6215, test_loss: 1.0087, test_f1: 0.6476
 epoch: 86, train_loss: 0.6040, test_loss: 0.9913, test_f1: 0.6365
 epoch: 87, train_loss: 0.5946, test_loss: 1.0046, test_f1: 0.6602
 epoch: 88, train_loss: 0.5975, test_loss: 0.9885, test_f1: 0.6639
 epoch: 89, train_loss: 0.6012, test_loss: 1.0019, test_f1: 0.6631
 epoch: 90, train_loss: 0.6049, test_loss: 0.9864, test_f1: 0.6578
 epoch: 91, train_loss: 0.5988, test_loss: 0.9786, test_f1: 0.6417
 epoch: 92, train_loss: 0.6048, test_loss: 1.0066, test_f1: 0.6520
 epoch: 93, train_loss: 0.5942, test_loss: 0.9973, test_f1: 0.6605
 epoch: 94, train_loss: 0.5946, test_loss: 1.0072, test_f1: 0.6602
 epoch: 95, train_loss: 0.5953, test_loss: 1.0132, test_f1: 0.6729
 epoch: 96, train_loss: 0.6059, test_loss: 1.0099, test_f1: 0.6426
 epoch: 97, train_loss: 0.5910, test_loss: 1.0167, test_f1: 0.6623
 epoch: 98, train_loss: 0.5917, test_loss: 1.0194, test_f1: 0.6387
 epoch: 99, train_loss: 0.5805, test_loss: 1.0114, test_f1: 0.6535
##################ITERATION #4 ****************************************
 epoch: 0, train_loss: 1.2252, test_loss: 1.1189, test_f1: 0.4261
 epoch: 1, train_loss: 1.0979, test_loss: 1.0114, test_f1: 0.4838
 epoch: 2, train_loss: 1.0633, test_loss: 0.9769, test_f1: 0.4782
 epoch: 3, train_loss: 1.0359, test_loss: 0.9577, test_f1: 0.4783
 epoch: 4, train_loss: 1.0086, test_loss: 0.9467, test_f1: 0.5016
 epoch: 5, train_loss: 0.9859, test_loss: 0.9372, test_f1: 0.5294
 epoch: 6, train_loss: 0.9884, test_loss: 0.9314, test_f1: 0.5254
 epoch: 7, train_loss: 0.9553, test_loss: 0.9199, test_f1: 0.4921
 epoch: 8, train_loss: 0.9376, test_loss: 0.9130, test_f1: 0.5179
 epoch: 9, train_loss: 0.9210, test_loss: 0.8998, test_f1: 0.5219
 epoch: 10, train_loss: 0.9166, test_loss: 0.8933, test_f1: 0.5322
 epoch: 11, train_loss: 0.9138, test_loss: 0.9066, test_f1: 0.5490
 epoch: 12, train_loss: 0.9044, test_loss: 0.8918, test_f1: 0.5574
 epoch: 13, train_loss: 0.8942, test_loss: 0.9019, test_f1: 0.5358
 epoch: 14, train_loss: 0.8872, test_loss: 0.9067, test_f1: 0.5399
 epoch: 15, train_loss: 0.8739, test_loss: 0.8866, test_f1: 0.5328
 epoch: 16, train_loss: 0.8742, test_loss: 0.8767, test_f1: 0.5405
 epoch: 17, train_loss: 0.8538, test_loss: 0.8831, test_f1: 0.5296
 epoch: 18, train_loss: 0.8610, test_loss: 0.8874, test_f1: 0.5386
 epoch: 19, train_loss: 0.8534, test_loss: 0.8840, test_f1: 0.5301
 epoch: 20, train_loss: 0.8381, test_loss: 0.8726, test_f1: 0.5578
 epoch: 21, train_loss: 0.8318, test_loss: 0.8754, test_f1: 0.5469
 epoch: 22, train_loss: 0.8247, test_loss: 0.8725, test_f1: 0.5596
 epoch: 23, train_loss: 0.8187, test_loss: 0.8775, test_f1: 0.5465
 epoch: 24, train_loss: 0.8105, test_loss: 0.8693, test_f1: 0.5418
 epoch: 25, train_loss: 0.8157, test_loss: 0.8628, test_f1: 0.5525
 epoch: 26, train_loss: 0.8130, test_loss: 0.8689, test_f1: 0.5655
 epoch: 27, train_loss: 0.7889, test_loss: 0.8808, test_f1: 0.5391
 epoch: 28, train_loss: 0.7900, test_loss: 0.9121, test_f1: 0.5563
 epoch: 29, train_loss: 0.7938, test_loss: 0.8735, test_f1: 0.5557
 epoch: 30, train_loss: 0.7835, test_loss: 0.8737, test_f1: 0.5657
 epoch: 31, train_loss: 0.7809, test_loss: 0.8760, test_f1: 0.5633
 epoch: 32, train_loss: 0.7791, test_loss: 0.8811, test_f1: 0.5717
 epoch: 33, train_loss: 0.7710, test_loss: 0.8703, test_f1: 0.5530
 epoch: 34, train_loss: 0.7694, test_loss: 0.9029, test_f1: 0.5719
 epoch: 35, train_loss: 0.7484, test_loss: 0.8795, test_f1: 0.5627
 epoch: 36, train_loss: 0.7558, test_loss: 0.8849, test_f1: 0.5492
 epoch: 37, train_loss: 0.7559, test_loss: 0.8763, test_f1: 0.5691
 epoch: 38, train_loss: 0.7556, test_loss: 0.8838, test_f1: 0.5602
 epoch: 39, train_loss: 0.7431, test_loss: 0.9160, test_f1: 0.5785
 epoch: 40, train_loss: 0.7426, test_loss: 0.8903, test_f1: 0.5668
 epoch: 41, train_loss: 0.7333, test_loss: 0.8661, test_f1: 0.5681
 epoch: 42, train_loss: 0.7406, test_loss: 0.9111, test_f1: 0.5723
 epoch: 43, train_loss: 0.7329, test_loss: 0.9044, test_f1: 0.5620
 epoch: 44, train_loss: 0.7258, test_loss: 0.8969, test_f1: 0.6046
 epoch: 45, train_loss: 0.7173, test_loss: 0.9229, test_f1: 0.5850
 epoch: 46, train_loss: 0.7075, test_loss: 0.8926, test_f1: 0.6091
 epoch: 47, train_loss: 0.6983, test_loss: 0.9029, test_f1: 0.5749
 epoch: 48, train_loss: 0.7013, test_loss: 0.9017, test_f1: 0.5957
 epoch: 49, train_loss: 0.7096, test_loss: 0.8771, test_f1: 0.6050
 epoch: 50, train_loss: 0.7030, test_loss: 0.8927, test_f1: 0.6129
 epoch: 51, train_loss: 0.6991, test_loss: 0.9006, test_f1: 0.5933
 epoch: 52, train_loss: 0.6843, test_loss: 0.8839, test_f1: 0.6235
 epoch: 53, train_loss: 0.6837, test_loss: 0.9024, test_f1: 0.6054
 epoch: 54, train_loss: 0.6677, test_loss: 0.9086, test_f1: 0.6076
 epoch: 55, train_loss: 0.6777, test_loss: 0.9126, test_f1: 0.6156
 epoch: 56, train_loss: 0.6837, test_loss: 0.8841, test_f1: 0.6056
 epoch: 57, train_loss: 0.6681, test_loss: 0.9018, test_f1: 0.6121
 epoch: 58, train_loss: 0.6606, test_loss: 0.8906, test_f1: 0.6093
 epoch: 59, train_loss: 0.6602, test_loss: 0.9042, test_f1: 0.6112
 epoch: 60, train_loss: 0.6674, test_loss: 0.9144, test_f1: 0.5998
 epoch: 61, train_loss: 0.6676, test_loss: 0.9247, test_f1: 0.6067
 epoch: 62, train_loss: 0.6627, test_loss: 0.8913, test_f1: 0.6127
 epoch: 63, train_loss: 0.6635, test_loss: 0.9028, test_f1: 0.6238
 epoch: 64, train_loss: 0.6589, test_loss: 0.9190, test_f1: 0.6148
 epoch: 65, train_loss: 0.6610, test_loss: 0.9126, test_f1: 0.6082
 epoch: 66, train_loss: 0.6660, test_loss: 0.9205, test_f1: 0.6075
 epoch: 67, train_loss: 0.6473, test_loss: 0.9350, test_f1: 0.6156
 epoch: 68, train_loss: 0.6422, test_loss: 0.9313, test_f1: 0.6196
 epoch: 69, train_loss: 0.6467, test_loss: 0.9326, test_f1: 0.6144
 epoch: 70, train_loss: 0.6449, test_loss: 0.9325, test_f1: 0.6108
 epoch: 71, train_loss: 0.6473, test_loss: 0.9375, test_f1: 0.6169
 epoch: 72, train_loss: 0.6423, test_loss: 0.9345, test_f1: 0.6213
 epoch: 73, train_loss: 0.6364, test_loss: 0.9383, test_f1: 0.6180
 epoch: 74, train_loss: 0.6452, test_loss: 0.9256, test_f1: 0.6303
 epoch: 75, train_loss: 0.6390, test_loss: 0.9161, test_f1: 0.6248
 epoch: 76, train_loss: 0.6398, test_loss: 0.9400, test_f1: 0.6311
 epoch: 77, train_loss: 0.6350, test_loss: 0.9235, test_f1: 0.6363
 epoch: 78, train_loss: 0.6294, test_loss: 0.9332, test_f1: 0.6142
 epoch: 79, train_loss: 0.6269, test_loss: 0.9424, test_f1: 0.6203
 epoch: 80, train_loss: 0.6197, test_loss: 0.9318, test_f1: 0.6267
 epoch: 81, train_loss: 0.6189, test_loss: 0.9337, test_f1: 0.6335
 epoch: 82, train_loss: 0.6276, test_loss: 0.9258, test_f1: 0.6293
 epoch: 83, train_loss: 0.6144, test_loss: 0.9195, test_f1: 0.6338
 epoch: 84, train_loss: 0.6167, test_loss: 0.9293, test_f1: 0.6425
 epoch: 85, train_loss: 0.6072, test_loss: 0.9536, test_f1: 0.6212
 epoch: 86, train_loss: 0.6207, test_loss: 0.9428, test_f1: 0.6254
 epoch: 87, train_loss: 0.6263, test_loss: 0.9439, test_f1: 0.6371
 epoch: 88, train_loss: 0.6060, test_loss: 0.9667, test_f1: 0.6135
 epoch: 89, train_loss: 0.6058, test_loss: 0.9701, test_f1: 0.6288
 epoch: 90, train_loss: 0.6023, test_loss: 0.9489, test_f1: 0.6472
 epoch: 91, train_loss: 0.6174, test_loss: 0.9396, test_f1: 0.6292
 epoch: 92, train_loss: 0.6064, test_loss: 0.9733, test_f1: 0.6338
 epoch: 93, train_loss: 0.6157, test_loss: 0.9513, test_f1: 0.6346
 epoch: 94, train_loss: 0.5945, test_loss: 0.9570, test_f1: 0.6366
 epoch: 95, train_loss: 0.5939, test_loss: 0.9712, test_f1: 0.6236
 epoch: 96, train_loss: 0.5969, test_loss: 0.9681, test_f1: 0.6317
 epoch: 97, train_loss: 0.5837, test_loss: 0.9733, test_f1: 0.6385
 epoch: 98, train_loss: 0.5940, test_loss: 0.9757, test_f1: 0.6450
 epoch: 99, train_loss: 0.5960, test_loss: 0.9855, test_f1: 0.6421
##################ITERATION #5 ****************************************
 epoch: 0, train_loss: 1.2405, test_loss: 1.0748, test_f1: 0.4494
 epoch: 1, train_loss: 1.0945, test_loss: 1.0025, test_f1: 0.4713
 epoch: 2, train_loss: 1.0565, test_loss: 0.9770, test_f1: 0.5058
 epoch: 3, train_loss: 1.0084, test_loss: 0.9591, test_f1: 0.4944
 epoch: 4, train_loss: 0.9848, test_loss: 0.9491, test_f1: 0.4813
 epoch: 5, train_loss: 0.9797, test_loss: 0.9323, test_f1: 0.5268
 epoch: 6, train_loss: 0.9604, test_loss: 0.9409, test_f1: 0.5032
 epoch: 7, train_loss: 0.9425, test_loss: 0.9266, test_f1: 0.5156
 epoch: 8, train_loss: 0.9287, test_loss: 0.9340, test_f1: 0.4988
 epoch: 9, train_loss: 0.9272, test_loss: 0.9226, test_f1: 0.5146
 epoch: 10, train_loss: 0.9098, test_loss: 0.9195, test_f1: 0.5255
 epoch: 11, train_loss: 0.9118, test_loss: 0.9229, test_f1: 0.5370
 epoch: 12, train_loss: 0.8951, test_loss: 0.9166, test_f1: 0.5221
 epoch: 13, train_loss: 0.8882, test_loss: 0.9166, test_f1: 0.5259
 epoch: 14, train_loss: 0.8750, test_loss: 0.9065, test_f1: 0.5366
 epoch: 15, train_loss: 0.8630, test_loss: 0.9024, test_f1: 0.5439
 epoch: 16, train_loss: 0.8587, test_loss: 0.9300, test_f1: 0.5347
 epoch: 17, train_loss: 0.8489, test_loss: 0.9122, test_f1: 0.5445
 epoch: 18, train_loss: 0.8401, test_loss: 0.9271, test_f1: 0.5563
 epoch: 19, train_loss: 0.8380, test_loss: 0.9049, test_f1: 0.5704
 epoch: 20, train_loss: 0.8421, test_loss: 0.9096, test_f1: 0.5491
 epoch: 21, train_loss: 0.8228, test_loss: 0.9221, test_f1: 0.5406
 epoch: 22, train_loss: 0.8262, test_loss: 0.9207, test_f1: 0.5631
 epoch: 23, train_loss: 0.8209, test_loss: 0.9125, test_f1: 0.5653
 epoch: 24, train_loss: 0.8063, test_loss: 0.9072, test_f1: 0.5630
 epoch: 25, train_loss: 0.7995, test_loss: 0.9226, test_f1: 0.5463
 epoch: 26, train_loss: 0.7951, test_loss: 0.9226, test_f1: 0.5490
 epoch: 27, train_loss: 0.8098, test_loss: 0.9289, test_f1: 0.5642
 epoch: 28, train_loss: 0.7888, test_loss: 0.9327, test_f1: 0.5594
 epoch: 29, train_loss: 0.7814, test_loss: 0.9074, test_f1: 0.5778
 epoch: 30, train_loss: 0.7728, test_loss: 0.9183, test_f1: 0.5514
 epoch: 31, train_loss: 0.7755, test_loss: 0.9028, test_f1: 0.6027
 epoch: 32, train_loss: 0.7660, test_loss: 0.9228, test_f1: 0.5672
 epoch: 33, train_loss: 0.7646, test_loss: 0.9165, test_f1: 0.5547
 epoch: 34, train_loss: 0.7580, test_loss: 0.9198, test_f1: 0.5712
 epoch: 35, train_loss: 0.7598, test_loss: 0.9086, test_f1: 0.5796
 epoch: 36, train_loss: 0.7566, test_loss: 0.9112, test_f1: 0.5838
 epoch: 37, train_loss: 0.7581, test_loss: 0.9128, test_f1: 0.6016
 epoch: 38, train_loss: 0.7391, test_loss: 0.9225, test_f1: 0.5944
 epoch: 39, train_loss: 0.7415, test_loss: 0.9151, test_f1: 0.5747
 epoch: 40, train_loss: 0.7326, test_loss: 0.9124, test_f1: 0.5759
 epoch: 41, train_loss: 0.7335, test_loss: 0.8944, test_f1: 0.5845
 epoch: 42, train_loss: 0.7265, test_loss: 0.9774, test_f1: 0.5479
 epoch: 43, train_loss: 0.7193, test_loss: 0.9262, test_f1: 0.5739
 epoch: 44, train_loss: 0.7086, test_loss: 0.9497, test_f1: 0.5948
 epoch: 45, train_loss: 0.7190, test_loss: 0.9253, test_f1: 0.5796
 epoch: 46, train_loss: 0.7105, test_loss: 0.9204, test_f1: 0.6090
 epoch: 47, train_loss: 0.6980, test_loss: 0.9233, test_f1: 0.6202
 epoch: 48, train_loss: 0.6883, test_loss: 0.9253, test_f1: 0.6015
 epoch: 49, train_loss: 0.6926, test_loss: 0.9592, test_f1: 0.5949
 epoch: 50, train_loss: 0.6922, test_loss: 0.9254, test_f1: 0.6129
 epoch: 51, train_loss: 0.6805, test_loss: 0.9381, test_f1: 0.6166
 epoch: 52, train_loss: 0.6846, test_loss: 0.9432, test_f1: 0.5984
 epoch: 53, train_loss: 0.6703, test_loss: 0.9385, test_f1: 0.6150
 epoch: 54, train_loss: 0.6693, test_loss: 0.9349, test_f1: 0.6157
 epoch: 55, train_loss: 0.6713, test_loss: 0.9458, test_f1: 0.6069
 epoch: 56, train_loss: 0.6715, test_loss: 0.9511, test_f1: 0.6156
 epoch: 57, train_loss: 0.6666, test_loss: 0.9228, test_f1: 0.6204
 epoch: 58, train_loss: 0.6548, test_loss: 0.9280, test_f1: 0.6048
 epoch: 59, train_loss: 0.6578, test_loss: 0.9330, test_f1: 0.6228
 epoch: 60, train_loss: 0.6534, test_loss: 0.9336, test_f1: 0.6194
 epoch: 61, train_loss: 0.6546, test_loss: 0.9396, test_f1: 0.6322
 epoch: 62, train_loss: 0.6440, test_loss: 0.9594, test_f1: 0.6011
 epoch: 63, train_loss: 0.6586, test_loss: 0.9528, test_f1: 0.6148
 epoch: 64, train_loss: 0.6466, test_loss: 0.9414, test_f1: 0.6146
 epoch: 65, train_loss: 0.6407, test_loss: 0.9468, test_f1: 0.6281
 epoch: 66, train_loss: 0.6474, test_loss: 0.9266, test_f1: 0.6314
 epoch: 67, train_loss: 0.6387, test_loss: 0.9618, test_f1: 0.6118
 epoch: 68, train_loss: 0.6433, test_loss: 0.9520, test_f1: 0.6190
 epoch: 69, train_loss: 0.6437, test_loss: 0.9415, test_f1: 0.6301
 epoch: 70, train_loss: 0.6334, test_loss: 0.9485, test_f1: 0.6250
 epoch: 71, train_loss: 0.6467, test_loss: 0.9452, test_f1: 0.6493
 epoch: 72, train_loss: 0.6302, test_loss: 0.9779, test_f1: 0.6223
 epoch: 73, train_loss: 0.6389, test_loss: 0.9594, test_f1: 0.6129
 epoch: 74, train_loss: 0.6449, test_loss: 0.9476, test_f1: 0.6550
 epoch: 75, train_loss: 0.6233, test_loss: 0.9922, test_f1: 0.6232
 epoch: 76, train_loss: 0.6327, test_loss: 0.9618, test_f1: 0.6351
 epoch: 77, train_loss: 0.6261, test_loss: 0.9795, test_f1: 0.6255
 epoch: 78, train_loss: 0.6321, test_loss: 0.9766, test_f1: 0.6315
 epoch: 79, train_loss: 0.6476, test_loss: 0.9696, test_f1: 0.6290
 epoch: 80, train_loss: 0.6142, test_loss: 0.9706, test_f1: 0.6399
 epoch: 81, train_loss: 0.6196, test_loss: 0.9814, test_f1: 0.6310
 epoch: 82, train_loss: 0.6138, test_loss: 0.9711, test_f1: 0.6199
 epoch: 83, train_loss: 0.6147, test_loss: 0.9693, test_f1: 0.6299
 epoch: 84, train_loss: 0.6196, test_loss: 0.9999, test_f1: 0.6210
 epoch: 85, train_loss: 0.6153, test_loss: 0.9822, test_f1: 0.6193
 epoch: 86, train_loss: 0.6151, test_loss: 0.9912, test_f1: 0.6180
 epoch: 87, train_loss: 0.6172, test_loss: 1.0059, test_f1: 0.6229
 epoch: 88, train_loss: 0.6080, test_loss: 0.9950, test_f1: 0.6199
 epoch: 89, train_loss: 0.6033, test_loss: 0.9744, test_f1: 0.6298
 epoch: 90, train_loss: 0.6087, test_loss: 0.9950, test_f1: 0.6160
 epoch: 91, train_loss: 0.5971, test_loss: 0.9990, test_f1: 0.6196
 epoch: 92, train_loss: 0.6072, test_loss: 0.9808, test_f1: 0.6276
 epoch: 93, train_loss: 0.6075, test_loss: 0.9739, test_f1: 0.6379
 epoch: 94, train_loss: 0.6010, test_loss: 0.9874, test_f1: 0.6293
 epoch: 95, train_loss: 0.6013, test_loss: 0.9994, test_f1: 0.6294
 epoch: 96, train_loss: 0.6122, test_loss: 0.9853, test_f1: 0.6315
 epoch: 97, train_loss: 0.5897, test_loss: 1.0122, test_f1: 0.6344
 epoch: 98, train_loss: 0.5996, test_loss: 0.9953, test_f1: 0.6308
 epoch: 99, train_loss: 0.5925, test_loss: 0.9982, test_f1: 0.6337
##################ITERATION #6 ****************************************
 epoch: 0, train_loss: 1.2380, test_loss: 1.0749, test_f1: 0.4260
 epoch: 1, train_loss: 1.0860, test_loss: 0.9853, test_f1: 0.4749
 epoch: 2, train_loss: 1.0547, test_loss: 0.9592, test_f1: 0.4944
 epoch: 3, train_loss: 1.0253, test_loss: 0.9411, test_f1: 0.4920
 epoch: 4, train_loss: 0.9916, test_loss: 0.9298, test_f1: 0.5020
 epoch: 5, train_loss: 0.9716, test_loss: 0.9398, test_f1: 0.5255
 epoch: 6, train_loss: 0.9587, test_loss: 0.9255, test_f1: 0.5136
 epoch: 7, train_loss: 0.9340, test_loss: 0.9074, test_f1: 0.5187
 epoch: 8, train_loss: 0.9435, test_loss: 0.9148, test_f1: 0.5199
 epoch: 9, train_loss: 0.9171, test_loss: 0.9225, test_f1: 0.5328
 epoch: 10, train_loss: 0.9183, test_loss: 0.9041, test_f1: 0.5034
 epoch: 11, train_loss: 0.9082, test_loss: 0.9169, test_f1: 0.5348
 epoch: 12, train_loss: 0.8923, test_loss: 0.9028, test_f1: 0.5358
 epoch: 13, train_loss: 0.8912, test_loss: 0.9241, test_f1: 0.5267
 epoch: 14, train_loss: 0.8889, test_loss: 0.9118, test_f1: 0.5183
 epoch: 15, train_loss: 0.8684, test_loss: 0.9036, test_f1: 0.5251
 epoch: 16, train_loss: 0.8615, test_loss: 0.8994, test_f1: 0.5340
 epoch: 17, train_loss: 0.8612, test_loss: 0.8861, test_f1: 0.5623
 epoch: 18, train_loss: 0.8500, test_loss: 0.9172, test_f1: 0.5297
 epoch: 19, train_loss: 0.8516, test_loss: 0.8914, test_f1: 0.5361
 epoch: 20, train_loss: 0.8448, test_loss: 0.8872, test_f1: 0.5352
 epoch: 21, train_loss: 0.8409, test_loss: 0.8897, test_f1: 0.5661
 epoch: 22, train_loss: 0.8218, test_loss: 0.9006, test_f1: 0.5573
 epoch: 23, train_loss: 0.8153, test_loss: 0.9138, test_f1: 0.5359
 epoch: 24, train_loss: 0.8235, test_loss: 0.9077, test_f1: 0.5521
 epoch: 25, train_loss: 0.8197, test_loss: 0.8924, test_f1: 0.5578
 epoch: 26, train_loss: 0.8107, test_loss: 0.8934, test_f1: 0.5505
 epoch: 27, train_loss: 0.7915, test_loss: 0.8905, test_f1: 0.5655
 epoch: 28, train_loss: 0.7960, test_loss: 0.8989, test_f1: 0.5545
 epoch: 29, train_loss: 0.7952, test_loss: 0.9206, test_f1: 0.5532
 epoch: 30, train_loss: 0.7924, test_loss: 0.9001, test_f1: 0.5722
 epoch: 31, train_loss: 0.7732, test_loss: 0.8981, test_f1: 0.5622
 epoch: 32, train_loss: 0.7873, test_loss: 0.9017, test_f1: 0.5768
 epoch: 33, train_loss: 0.7755, test_loss: 0.9001, test_f1: 0.5859
 epoch: 34, train_loss: 0.7645, test_loss: 0.8988, test_f1: 0.5949
 epoch: 35, train_loss: 0.7579, test_loss: 0.9280, test_f1: 0.5623
 epoch: 36, train_loss: 0.7575, test_loss: 0.9211, test_f1: 0.5920
 epoch: 37, train_loss: 0.7578, test_loss: 0.9320, test_f1: 0.5584
 epoch: 38, train_loss: 0.7579, test_loss: 0.9442, test_f1: 0.5778
 epoch: 39, train_loss: 0.7419, test_loss: 0.9179, test_f1: 0.5732
 epoch: 40, train_loss: 0.7395, test_loss: 0.9050, test_f1: 0.5960
 epoch: 41, train_loss: 0.7345, test_loss: 0.8941, test_f1: 0.5957
 epoch: 42, train_loss: 0.7298, test_loss: 0.9524, test_f1: 0.5694
 epoch: 43, train_loss: 0.7236, test_loss: 0.9136, test_f1: 0.5705
 epoch: 44, train_loss: 0.7274, test_loss: 0.9238, test_f1: 0.6019
 epoch: 45, train_loss: 0.7234, test_loss: 0.9432, test_f1: 0.5834
 epoch: 46, train_loss: 0.7177, test_loss: 0.9434, test_f1: 0.5782
 epoch: 47, train_loss: 0.7174, test_loss: 0.9226, test_f1: 0.5894
 epoch: 48, train_loss: 0.7040, test_loss: 0.9289, test_f1: 0.5774
 epoch: 49, train_loss: 0.7033, test_loss: 0.9092, test_f1: 0.6218
 epoch: 50, train_loss: 0.7006, test_loss: 0.9452, test_f1: 0.5881
 epoch: 51, train_loss: 0.6885, test_loss: 0.9132, test_f1: 0.6015
 epoch: 52, train_loss: 0.6802, test_loss: 0.9349, test_f1: 0.6137
 epoch: 53, train_loss: 0.6775, test_loss: 0.9478, test_f1: 0.6122
 epoch: 54, train_loss: 0.6804, test_loss: 0.9443, test_f1: 0.6084
 epoch: 55, train_loss: 0.6743, test_loss: 0.9333, test_f1: 0.6028
 epoch: 56, train_loss: 0.6723, test_loss: 0.9219, test_f1: 0.6226
 epoch: 57, train_loss: 0.6666, test_loss: 0.9281, test_f1: 0.6084
 epoch: 58, train_loss: 0.6785, test_loss: 0.9306, test_f1: 0.5939
 epoch: 59, train_loss: 0.6688, test_loss: 0.9509, test_f1: 0.6242
 epoch: 60, train_loss: 0.6728, test_loss: 0.9570, test_f1: 0.6062
 epoch: 61, train_loss: 0.6608, test_loss: 0.9447, test_f1: 0.6000
 epoch: 62, train_loss: 0.6623, test_loss: 0.9281, test_f1: 0.6144
 epoch: 63, train_loss: 0.6514, test_loss: 0.9504, test_f1: 0.6112
 epoch: 64, train_loss: 0.6556, test_loss: 0.9423, test_f1: 0.6263
 epoch: 65, train_loss: 0.6582, test_loss: 0.9452, test_f1: 0.6272
 epoch: 66, train_loss: 0.6487, test_loss: 0.9570, test_f1: 0.6058
 epoch: 67, train_loss: 0.6511, test_loss: 0.9376, test_f1: 0.6165
 epoch: 68, train_loss: 0.6528, test_loss: 0.9554, test_f1: 0.5975
 epoch: 69, train_loss: 0.6529, test_loss: 0.9349, test_f1: 0.6342
 epoch: 70, train_loss: 0.6523, test_loss: 0.9611, test_f1: 0.6197
 epoch: 71, train_loss: 0.6493, test_loss: 0.9511, test_f1: 0.6231
 epoch: 72, train_loss: 0.6421, test_loss: 0.9411, test_f1: 0.6199
 epoch: 73, train_loss: 0.6448, test_loss: 0.9615, test_f1: 0.6175
 epoch: 74, train_loss: 0.6332, test_loss: 0.9574, test_f1: 0.6115
 epoch: 75, train_loss: 0.6386, test_loss: 0.9562, test_f1: 0.6193
 epoch: 76, train_loss: 0.6204, test_loss: 0.9576, test_f1: 0.6204
 epoch: 77, train_loss: 0.6313, test_loss: 0.9728, test_f1: 0.6077
 epoch: 78, train_loss: 0.6247, test_loss: 0.9741, test_f1: 0.6229
 epoch: 79, train_loss: 0.6223, test_loss: 0.9630, test_f1: 0.6160
 epoch: 80, train_loss: 0.6360, test_loss: 0.9652, test_f1: 0.6299
 epoch: 81, train_loss: 0.6165, test_loss: 0.9646, test_f1: 0.6190
 epoch: 82, train_loss: 0.6271, test_loss: 0.9577, test_f1: 0.6271
 epoch: 83, train_loss: 0.6176, test_loss: 0.9502, test_f1: 0.6124
 epoch: 84, train_loss: 0.6163, test_loss: 0.9718, test_f1: 0.6085
 epoch: 85, train_loss: 0.6246, test_loss: 0.9668, test_f1: 0.6276
 epoch: 86, train_loss: 0.6187, test_loss: 0.9654, test_f1: 0.6063
 epoch: 87, train_loss: 0.6202, test_loss: 0.9533, test_f1: 0.6366
 epoch: 88, train_loss: 0.6240, test_loss: 0.9725, test_f1: 0.6294
 epoch: 89, train_loss: 0.6066, test_loss: 0.9687, test_f1: 0.6235
 epoch: 90, train_loss: 0.6032, test_loss: 0.9590, test_f1: 0.6297
 epoch: 91, train_loss: 0.6056, test_loss: 1.0003, test_f1: 0.6197
 epoch: 92, train_loss: 0.6054, test_loss: 0.9746, test_f1: 0.6290
 epoch: 93, train_loss: 0.5967, test_loss: 0.9697, test_f1: 0.6141
 epoch: 94, train_loss: 0.6015, test_loss: 0.9662, test_f1: 0.6299
 epoch: 95, train_loss: 0.6037, test_loss: 0.9765, test_f1: 0.6458
 epoch: 96, train_loss: 0.5992, test_loss: 1.0023, test_f1: 0.6216
 epoch: 97, train_loss: 0.5898, test_loss: 0.9670, test_f1: 0.6367
 epoch: 98, train_loss: 0.5913, test_loss: 0.9939, test_f1: 0.6191
 epoch: 99, train_loss: 0.5878, test_loss: 0.9881, test_f1: 0.6371
##################ITERATION #7 ****************************************
 epoch: 0, train_loss: 1.3107, test_loss: 1.1138, test_f1: 0.4206
 epoch: 1, train_loss: 1.1343, test_loss: 0.9886, test_f1: 0.5162
 epoch: 2, train_loss: 1.0683, test_loss: 0.9679, test_f1: 0.5276
 epoch: 3, train_loss: 1.0368, test_loss: 0.9420, test_f1: 0.5361
 epoch: 4, train_loss: 1.0036, test_loss: 0.9279, test_f1: 0.5400
 epoch: 5, train_loss: 0.9827, test_loss: 0.9187, test_f1: 0.5437
 epoch: 6, train_loss: 0.9708, test_loss: 0.8945, test_f1: 0.5364
 epoch: 7, train_loss: 0.9573, test_loss: 0.9257, test_f1: 0.5499
 epoch: 8, train_loss: 0.9421, test_loss: 0.9080, test_f1: 0.5431
 epoch: 9, train_loss: 0.9301, test_loss: 0.8802, test_f1: 0.5565
 epoch: 10, train_loss: 0.9206, test_loss: 0.9127, test_f1: 0.5672
 epoch: 11, train_loss: 0.9112, test_loss: 0.8841, test_f1: 0.5635
 epoch: 12, train_loss: 0.9048, test_loss: 0.8986, test_f1: 0.5563
 epoch: 13, train_loss: 0.9027, test_loss: 0.9005, test_f1: 0.5707
 epoch: 14, train_loss: 0.8865, test_loss: 0.9136, test_f1: 0.5828
 epoch: 15, train_loss: 0.8711, test_loss: 0.8917, test_f1: 0.5508
 epoch: 16, train_loss: 0.8615, test_loss: 0.9002, test_f1: 0.5532
 epoch: 17, train_loss: 0.8646, test_loss: 0.9331, test_f1: 0.5539
 epoch: 18, train_loss: 0.8592, test_loss: 0.9001, test_f1: 0.5829
 epoch: 19, train_loss: 0.8548, test_loss: 0.9158, test_f1: 0.5681
 epoch: 20, train_loss: 0.8439, test_loss: 0.8977, test_f1: 0.5718
 epoch: 21, train_loss: 0.8416, test_loss: 0.8958, test_f1: 0.5821
 epoch: 22, train_loss: 0.8387, test_loss: 0.8886, test_f1: 0.5966
 epoch: 23, train_loss: 0.8331, test_loss: 0.8755, test_f1: 0.5898
 epoch: 24, train_loss: 0.8252, test_loss: 0.8899, test_f1: 0.6047
 epoch: 25, train_loss: 0.8231, test_loss: 0.8890, test_f1: 0.5851
 epoch: 26, train_loss: 0.8164, test_loss: 0.8838, test_f1: 0.5679
 epoch: 27, train_loss: 0.8044, test_loss: 0.9150, test_f1: 0.5994
 epoch: 28, train_loss: 0.8076, test_loss: 0.8918, test_f1: 0.5966
 epoch: 29, train_loss: 0.8086, test_loss: 0.8977, test_f1: 0.6226
 epoch: 30, train_loss: 0.7947, test_loss: 0.8902, test_f1: 0.5874
 epoch: 31, train_loss: 0.7901, test_loss: 0.9159, test_f1: 0.6012
 epoch: 32, train_loss: 0.7865, test_loss: 0.8946, test_f1: 0.5954
 epoch: 33, train_loss: 0.7877, test_loss: 0.9011, test_f1: 0.5914
 epoch: 34, train_loss: 0.7752, test_loss: 0.8893, test_f1: 0.6109
 epoch: 35, train_loss: 0.7694, test_loss: 0.9283, test_f1: 0.5983
 epoch: 36, train_loss: 0.7721, test_loss: 0.9284, test_f1: 0.5917
 epoch: 37, train_loss: 0.7555, test_loss: 0.9479, test_f1: 0.6076
 epoch: 38, train_loss: 0.7542, test_loss: 0.9270, test_f1: 0.6155
 epoch: 39, train_loss: 0.7605, test_loss: 0.9211, test_f1: 0.6211
 epoch: 40, train_loss: 0.7497, test_loss: 0.8875, test_f1: 0.6219
 epoch: 41, train_loss: 0.7382, test_loss: 0.9148, test_f1: 0.6076
 epoch: 42, train_loss: 0.7373, test_loss: 0.9192, test_f1: 0.6211
 epoch: 43, train_loss: 0.7449, test_loss: 0.9322, test_f1: 0.6115
 epoch: 44, train_loss: 0.7431, test_loss: 0.9127, test_f1: 0.6090
 epoch: 45, train_loss: 0.7326, test_loss: 0.9122, test_f1: 0.6277
 epoch: 46, train_loss: 0.7293, test_loss: 0.9206, test_f1: 0.6101
 epoch: 47, train_loss: 0.7230, test_loss: 0.9354, test_f1: 0.6105
 epoch: 48, train_loss: 0.7206, test_loss: 0.9564, test_f1: 0.6003
 epoch: 49, train_loss: 0.7051, test_loss: 0.9391, test_f1: 0.6165
 epoch: 50, train_loss: 0.6996, test_loss: 0.9160, test_f1: 0.6225
 epoch: 51, train_loss: 0.7041, test_loss: 0.9165, test_f1: 0.6114
 epoch: 52, train_loss: 0.6968, test_loss: 0.9260, test_f1: 0.5987
 epoch: 53, train_loss: 0.6963, test_loss: 0.9090, test_f1: 0.6195
 epoch: 54, train_loss: 0.7026, test_loss: 0.9605, test_f1: 0.6274
 epoch: 55, train_loss: 0.6932, test_loss: 0.9350, test_f1: 0.6071
 epoch: 56, train_loss: 0.6902, test_loss: 0.9528, test_f1: 0.6234
 epoch: 57, train_loss: 0.6844, test_loss: 0.9488, test_f1: 0.6143
 epoch: 58, train_loss: 0.6764, test_loss: 0.9344, test_f1: 0.6300
 epoch: 59, train_loss: 0.6801, test_loss: 0.9285, test_f1: 0.6344
 epoch: 60, train_loss: 0.6791, test_loss: 0.9415, test_f1: 0.6189
 epoch: 61, train_loss: 0.6711, test_loss: 0.9464, test_f1: 0.6234
 epoch: 62, train_loss: 0.6652, test_loss: 0.9703, test_f1: 0.6319
 epoch: 63, train_loss: 0.6706, test_loss: 0.9483, test_f1: 0.6265
 epoch: 64, train_loss: 0.6680, test_loss: 0.9656, test_f1: 0.6271
 epoch: 65, train_loss: 0.6704, test_loss: 0.9438, test_f1: 0.6371
 epoch: 66, train_loss: 0.6733, test_loss: 0.9316, test_f1: 0.6407
 epoch: 67, train_loss: 0.6642, test_loss: 0.9326, test_f1: 0.6369
 epoch: 68, train_loss: 0.6686, test_loss: 0.9362, test_f1: 0.6434
 epoch: 69, train_loss: 0.6534, test_loss: 0.9378, test_f1: 0.6259
 epoch: 70, train_loss: 0.6589, test_loss: 0.9477, test_f1: 0.6301
 epoch: 71, train_loss: 0.6551, test_loss: 0.9550, test_f1: 0.6252
 epoch: 72, train_loss: 0.6500, test_loss: 0.9521, test_f1: 0.6353
 epoch: 73, train_loss: 0.6539, test_loss: 0.9665, test_f1: 0.6376
 epoch: 74, train_loss: 0.6456, test_loss: 0.9610, test_f1: 0.6400
 epoch: 75, train_loss: 0.6392, test_loss: 0.9458, test_f1: 0.6526
 epoch: 76, train_loss: 0.6369, test_loss: 0.9707, test_f1: 0.6519
 epoch: 77, train_loss: 0.6413, test_loss: 0.9643, test_f1: 0.6287
 epoch: 78, train_loss: 0.6391, test_loss: 0.9674, test_f1: 0.6359
 epoch: 79, train_loss: 0.6372, test_loss: 0.9536, test_f1: 0.6521
 epoch: 80, train_loss: 0.6381, test_loss: 0.9678, test_f1: 0.6213
 epoch: 81, train_loss: 0.6267, test_loss: 0.9537, test_f1: 0.6527
 epoch: 82, train_loss: 0.6363, test_loss: 0.9687, test_f1: 0.6412
 epoch: 83, train_loss: 0.6235, test_loss: 0.9653, test_f1: 0.6501
 epoch: 84, train_loss: 0.6190, test_loss: 0.9860, test_f1: 0.6460
 epoch: 85, train_loss: 0.6317, test_loss: 0.9709, test_f1: 0.6592
 epoch: 86, train_loss: 0.6274, test_loss: 0.9741, test_f1: 0.6273
 epoch: 87, train_loss: 0.6243, test_loss: 0.9643, test_f1: 0.6489
 epoch: 88, train_loss: 0.6197, test_loss: 0.9943, test_f1: 0.6249
 epoch: 89, train_loss: 0.6282, test_loss: 0.9895, test_f1: 0.6262
 epoch: 90, train_loss: 0.6205, test_loss: 0.9684, test_f1: 0.6339
 epoch: 91, train_loss: 0.6184, test_loss: 0.9749, test_f1: 0.6378
 epoch: 92, train_loss: 0.6162, test_loss: 0.9716, test_f1: 0.6416
 epoch: 93, train_loss: 0.6010, test_loss: 0.9854, test_f1: 0.6327
 epoch: 94, train_loss: 0.6100, test_loss: 0.9763, test_f1: 0.6476
 epoch: 95, train_loss: 0.6037, test_loss: 1.0065, test_f1: 0.6460
 epoch: 96, train_loss: 0.6095, test_loss: 0.9820, test_f1: 0.6315
 epoch: 97, train_loss: 0.6119, test_loss: 0.9884, test_f1: 0.6352
 epoch: 98, train_loss: 0.6100, test_loss: 1.0026, test_f1: 0.6376
 epoch: 99, train_loss: 0.6102, test_loss: 0.9856, test_f1: 0.6496
##################ITERATION #8 ****************************************
 epoch: 0, train_loss: 1.2651, test_loss: 1.0549, test_f1: 0.4415
 epoch: 1, train_loss: 1.1268, test_loss: 1.0179, test_f1: 0.4800
 epoch: 2, train_loss: 1.0757, test_loss: 0.9894, test_f1: 0.4906
 epoch: 3, train_loss: 1.0492, test_loss: 0.9806, test_f1: 0.4833
 epoch: 4, train_loss: 1.0196, test_loss: 0.9751, test_f1: 0.5271
 epoch: 5, train_loss: 1.0041, test_loss: 0.9669, test_f1: 0.5005
 epoch: 6, train_loss: 0.9781, test_loss: 0.9568, test_f1: 0.5059
 epoch: 7, train_loss: 0.9756, test_loss: 0.9406, test_f1: 0.5360
 epoch: 8, train_loss: 0.9468, test_loss: 0.9406, test_f1: 0.5695
 epoch: 9, train_loss: 0.9351, test_loss: 0.9344, test_f1: 0.5316
 epoch: 10, train_loss: 0.9252, test_loss: 0.9246, test_f1: 0.5335
 epoch: 11, train_loss: 0.9216, test_loss: 0.9176, test_f1: 0.5557
 epoch: 12, train_loss: 0.9122, test_loss: 0.9233, test_f1: 0.5579
 epoch: 13, train_loss: 0.8907, test_loss: 0.9132, test_f1: 0.5564
 epoch: 14, train_loss: 0.8979, test_loss: 0.9080, test_f1: 0.5724
 epoch: 15, train_loss: 0.8768, test_loss: 0.9106, test_f1: 0.5727
 epoch: 16, train_loss: 0.8839, test_loss: 0.8886, test_f1: 0.5836
 epoch: 17, train_loss: 0.8585, test_loss: 0.9140, test_f1: 0.5727
 epoch: 18, train_loss: 0.8677, test_loss: 0.8905, test_f1: 0.5888
 epoch: 19, train_loss: 0.8562, test_loss: 0.8939, test_f1: 0.6017
 epoch: 20, train_loss: 0.8402, test_loss: 0.8955, test_f1: 0.5868
 epoch: 21, train_loss: 0.8416, test_loss: 0.9003, test_f1: 0.6047
 epoch: 22, train_loss: 0.8212, test_loss: 0.8677, test_f1: 0.6001
 epoch: 23, train_loss: 0.8275, test_loss: 0.9027, test_f1: 0.5912
 epoch: 24, train_loss: 0.8299, test_loss: 0.8832, test_f1: 0.5831
 epoch: 25, train_loss: 0.8163, test_loss: 0.8754, test_f1: 0.5837
 epoch: 26, train_loss: 0.8068, test_loss: 0.8823, test_f1: 0.5889
 epoch: 27, train_loss: 0.8023, test_loss: 0.8650, test_f1: 0.6181
 epoch: 28, train_loss: 0.8064, test_loss: 0.8705, test_f1: 0.6019
 epoch: 29, train_loss: 0.7939, test_loss: 0.8902, test_f1: 0.5964
 epoch: 30, train_loss: 0.7877, test_loss: 0.8723, test_f1: 0.6276
 epoch: 31, train_loss: 0.7779, test_loss: 0.8566, test_f1: 0.6149
 epoch: 32, train_loss: 0.7789, test_loss: 0.8687, test_f1: 0.6047
 epoch: 33, train_loss: 0.7674, test_loss: 0.8804, test_f1: 0.5924
 epoch: 34, train_loss: 0.7648, test_loss: 0.8754, test_f1: 0.6328
 epoch: 35, train_loss: 0.7654, test_loss: 0.8793, test_f1: 0.6124
 epoch: 36, train_loss: 0.7527, test_loss: 0.8985, test_f1: 0.6043
 epoch: 37, train_loss: 0.7576, test_loss: 0.8834, test_f1: 0.5890
 epoch: 38, train_loss: 0.7519, test_loss: 0.9020, test_f1: 0.6043
 epoch: 39, train_loss: 0.7383, test_loss: 0.9069, test_f1: 0.5855
 epoch: 40, train_loss: 0.7391, test_loss: 0.8916, test_f1: 0.6338
 epoch: 41, train_loss: 0.7569, test_loss: 0.8924, test_f1: 0.5935
 epoch: 42, train_loss: 0.7377, test_loss: 0.8891, test_f1: 0.6253
 epoch: 43, train_loss: 0.7249, test_loss: 0.9266, test_f1: 0.6209
 epoch: 44, train_loss: 0.7226, test_loss: 0.8976, test_f1: 0.5991
 epoch: 45, train_loss: 0.7245, test_loss: 0.9185, test_f1: 0.5978
 epoch: 46, train_loss: 0.7195, test_loss: 0.9040, test_f1: 0.6384
 epoch: 47, train_loss: 0.7159, test_loss: 0.9283, test_f1: 0.6113
 epoch: 48, train_loss: 0.7076, test_loss: 0.9119, test_f1: 0.6187
 epoch: 49, train_loss: 0.7120, test_loss: 0.9317, test_f1: 0.6253
 epoch: 50, train_loss: 0.7072, test_loss: 0.9121, test_f1: 0.6157
 epoch: 51, train_loss: 0.6988, test_loss: 0.9255, test_f1: 0.6075
 epoch: 52, train_loss: 0.6878, test_loss: 0.9235, test_f1: 0.6096
 epoch: 53, train_loss: 0.6933, test_loss: 0.9238, test_f1: 0.5972
 epoch: 54, train_loss: 0.6851, test_loss: 0.9329, test_f1: 0.6112
 epoch: 55, train_loss: 0.6863, test_loss: 0.9058, test_f1: 0.6502
 epoch: 56, train_loss: 0.6859, test_loss: 0.9343, test_f1: 0.6087
 epoch: 57, train_loss: 0.6824, test_loss: 0.9337, test_f1: 0.6078
 epoch: 58, train_loss: 0.6659, test_loss: 0.9227, test_f1: 0.6290
 epoch: 59, train_loss: 0.6719, test_loss: 0.9295, test_f1: 0.6206
 epoch: 60, train_loss: 0.6727, test_loss: 0.9270, test_f1: 0.5982
 epoch: 61, train_loss: 0.6710, test_loss: 0.9307, test_f1: 0.6266
 epoch: 62, train_loss: 0.6738, test_loss: 0.9215, test_f1: 0.5910
 epoch: 63, train_loss: 0.6646, test_loss: 0.9251, test_f1: 0.6330
 epoch: 64, train_loss: 0.6630, test_loss: 0.9330, test_f1: 0.6234
 epoch: 65, train_loss: 0.6595, test_loss: 0.9377, test_f1: 0.6429
 epoch: 66, train_loss: 0.6660, test_loss: 0.9307, test_f1: 0.6218
 epoch: 67, train_loss: 0.6587, test_loss: 0.9409, test_f1: 0.6328
 epoch: 68, train_loss: 0.6614, test_loss: 0.9260, test_f1: 0.6415
 epoch: 69, train_loss: 0.6648, test_loss: 0.9230, test_f1: 0.6503
 epoch: 70, train_loss: 0.6487, test_loss: 0.9224, test_f1: 0.6424
 epoch: 71, train_loss: 0.6481, test_loss: 0.9309, test_f1: 0.6185
 epoch: 72, train_loss: 0.6520, test_loss: 0.9403, test_f1: 0.6378
 epoch: 73, train_loss: 0.6444, test_loss: 0.9531, test_f1: 0.6230
 epoch: 74, train_loss: 0.6435, test_loss: 0.9628, test_f1: 0.6304
 epoch: 75, train_loss: 0.6556, test_loss: 0.9500, test_f1: 0.6137
 epoch: 76, train_loss: 0.6444, test_loss: 0.9360, test_f1: 0.6393
 epoch: 77, train_loss: 0.6403, test_loss: 0.9374, test_f1: 0.6454
 epoch: 78, train_loss: 0.6376, test_loss: 0.9581, test_f1: 0.6417
 epoch: 79, train_loss: 0.6342, test_loss: 0.9207, test_f1: 0.6349
 epoch: 80, train_loss: 0.6375, test_loss: 0.9422, test_f1: 0.6364
 epoch: 81, train_loss: 0.6369, test_loss: 0.9463, test_f1: 0.6405
 epoch: 82, train_loss: 0.6304, test_loss: 0.9397, test_f1: 0.6445
 epoch: 83, train_loss: 0.6394, test_loss: 0.9410, test_f1: 0.6399
 epoch: 84, train_loss: 0.6303, test_loss: 0.9388, test_f1: 0.6299
 epoch: 85, train_loss: 0.6372, test_loss: 0.9354, test_f1: 0.6470
 epoch: 86, train_loss: 0.6141, test_loss: 0.9240, test_f1: 0.6275
 epoch: 87, train_loss: 0.6250, test_loss: 0.9386, test_f1: 0.6530
 epoch: 88, train_loss: 0.6247, test_loss: 0.9481, test_f1: 0.6689
 epoch: 89, train_loss: 0.6240, test_loss: 0.9476, test_f1: 0.6340
 epoch: 90, train_loss: 0.6163, test_loss: 0.9437, test_f1: 0.6342
 epoch: 91, train_loss: 0.6045, test_loss: 0.9411, test_f1: 0.6507
 epoch: 92, train_loss: 0.6262, test_loss: 0.9421, test_f1: 0.6513
 epoch: 93, train_loss: 0.6120, test_loss: 0.9281, test_f1: 0.6548
 epoch: 94, train_loss: 0.6250, test_loss: 0.9492, test_f1: 0.6331
 epoch: 95, train_loss: 0.6083, test_loss: 0.9589, test_f1: 0.6294
 epoch: 96, train_loss: 0.6030, test_loss: 0.9694, test_f1: 0.6420
 epoch: 97, train_loss: 0.6172, test_loss: 0.9694, test_f1: 0.6353
 epoch: 98, train_loss: 0.5958, test_loss: 1.0003, test_f1: 0.6291
 epoch: 99, train_loss: 0.6000, test_loss: 0.9728, test_f1: 0.6502
##################ITERATION #9 ****************************************
 epoch: 0, train_loss: 1.3155, test_loss: 1.0793, test_f1: 0.4178
 epoch: 1, train_loss: 1.1195, test_loss: 0.9936, test_f1: 0.4622
 epoch: 2, train_loss: 1.0851, test_loss: 0.9932, test_f1: 0.4746
 epoch: 3, train_loss: 1.0428, test_loss: 0.9741, test_f1: 0.4870
 epoch: 4, train_loss: 1.0118, test_loss: 0.9506, test_f1: 0.4950
 epoch: 5, train_loss: 0.9886, test_loss: 0.9402, test_f1: 0.5064
 epoch: 6, train_loss: 0.9754, test_loss: 0.9332, test_f1: 0.5093
 epoch: 7, train_loss: 0.9651, test_loss: 0.9320, test_f1: 0.4889
 epoch: 8, train_loss: 0.9473, test_loss: 0.9198, test_f1: 0.5117
 epoch: 9, train_loss: 0.9319, test_loss: 0.9220, test_f1: 0.5184
 epoch: 10, train_loss: 0.9203, test_loss: 0.9217, test_f1: 0.5118
 epoch: 11, train_loss: 0.9190, test_loss: 0.9084, test_f1: 0.5369
 epoch: 12, train_loss: 0.9124, test_loss: 0.8972, test_f1: 0.5513
 epoch: 13, train_loss: 0.9085, test_loss: 0.9101, test_f1: 0.5380
 epoch: 14, train_loss: 0.8873, test_loss: 0.9149, test_f1: 0.5587
 epoch: 15, train_loss: 0.8845, test_loss: 0.8919, test_f1: 0.5625
 epoch: 16, train_loss: 0.8810, test_loss: 0.8988, test_f1: 0.5640
 epoch: 17, train_loss: 0.8697, test_loss: 0.9201, test_f1: 0.5429
 epoch: 18, train_loss: 0.8620, test_loss: 0.8981, test_f1: 0.5574
 epoch: 19, train_loss: 0.8520, test_loss: 0.8893, test_f1: 0.5507
 epoch: 20, train_loss: 0.8361, test_loss: 0.9035, test_f1: 0.5496
 epoch: 21, train_loss: 0.8310, test_loss: 0.8805, test_f1: 0.5647
 epoch: 22, train_loss: 0.8252, test_loss: 0.9021, test_f1: 0.5881
 epoch: 23, train_loss: 0.8275, test_loss: 0.8892, test_f1: 0.5768
 epoch: 24, train_loss: 0.8262, test_loss: 0.8645, test_f1: 0.5701
 epoch: 25, train_loss: 0.8177, test_loss: 0.9000, test_f1: 0.5756
 epoch: 26, train_loss: 0.8176, test_loss: 0.8900, test_f1: 0.5792
 epoch: 27, train_loss: 0.8021, test_loss: 0.8717, test_f1: 0.5578
 epoch: 28, train_loss: 0.8078, test_loss: 0.8763, test_f1: 0.5883
 epoch: 29, train_loss: 0.7892, test_loss: 0.8821, test_f1: 0.5890
 epoch: 30, train_loss: 0.7926, test_loss: 0.8711, test_f1: 0.5872
 epoch: 31, train_loss: 0.7807, test_loss: 0.8679, test_f1: 0.6135
 epoch: 32, train_loss: 0.7828, test_loss: 0.8787, test_f1: 0.6071
 epoch: 33, train_loss: 0.7772, test_loss: 0.8602, test_f1: 0.6107
 epoch: 34, train_loss: 0.7655, test_loss: 0.8524, test_f1: 0.5998
 epoch: 35, train_loss: 0.7663, test_loss: 0.8647, test_f1: 0.5782
 epoch: 36, train_loss: 0.7619, test_loss: 0.8809, test_f1: 0.6021
 epoch: 37, train_loss: 0.7688, test_loss: 0.8812, test_f1: 0.5974
 epoch: 38, train_loss: 0.7540, test_loss: 0.8926, test_f1: 0.5814
 epoch: 39, train_loss: 0.7528, test_loss: 0.8623, test_f1: 0.6202
 epoch: 40, train_loss: 0.7428, test_loss: 0.8846, test_f1: 0.6089
 epoch: 41, train_loss: 0.7376, test_loss: 0.9040, test_f1: 0.5883
 epoch: 42, train_loss: 0.7491, test_loss: 0.8985, test_f1: 0.6015
 epoch: 43, train_loss: 0.7330, test_loss: 0.8847, test_f1: 0.6143
 epoch: 44, train_loss: 0.7253, test_loss: 0.9003, test_f1: 0.5931
 epoch: 45, train_loss: 0.7288, test_loss: 0.8834, test_f1: 0.6212
 epoch: 46, train_loss: 0.7210, test_loss: 0.8766, test_f1: 0.5956
 epoch: 47, train_loss: 0.7209, test_loss: 0.9082, test_f1: 0.6181
 epoch: 48, train_loss: 0.7240, test_loss: 0.9362, test_f1: 0.5871
 epoch: 49, train_loss: 0.7043, test_loss: 0.8983, test_f1: 0.6159
 epoch: 50, train_loss: 0.7129, test_loss: 0.8798, test_f1: 0.6254
 epoch: 51, train_loss: 0.7113, test_loss: 0.8913, test_f1: 0.6106
 epoch: 52, train_loss: 0.7019, test_loss: 0.9063, test_f1: 0.5923
 epoch: 53, train_loss: 0.6923, test_loss: 0.8960, test_f1: 0.6116
 epoch: 54, train_loss: 0.6870, test_loss: 0.8942, test_f1: 0.6251
 epoch: 55, train_loss: 0.6942, test_loss: 0.9060, test_f1: 0.6020
 epoch: 56, train_loss: 0.6944, test_loss: 0.8967, test_f1: 0.5974
 epoch: 57, train_loss: 0.6895, test_loss: 0.8853, test_f1: 0.5962
 epoch: 58, train_loss: 0.6857, test_loss: 0.8819, test_f1: 0.6157
 epoch: 59, train_loss: 0.6795, test_loss: 0.8958, test_f1: 0.5917
 epoch: 60, train_loss: 0.6858, test_loss: 0.8879, test_f1: 0.6028
 epoch: 61, train_loss: 0.6798, test_loss: 0.8992, test_f1: 0.6202
 epoch: 62, train_loss: 0.6726, test_loss: 0.8923, test_f1: 0.6495
 epoch: 63, train_loss: 0.6802, test_loss: 0.9006, test_f1: 0.6104
 epoch: 64, train_loss: 0.6719, test_loss: 0.8878, test_f1: 0.6280
 epoch: 65, train_loss: 0.6895, test_loss: 0.8973, test_f1: 0.6168
 epoch: 66, train_loss: 0.6602, test_loss: 0.8948, test_f1: 0.6296
 epoch: 67, train_loss: 0.6696, test_loss: 0.8829, test_f1: 0.6069
 epoch: 68, train_loss: 0.6684, test_loss: 0.9000, test_f1: 0.6298
 epoch: 69, train_loss: 0.6744, test_loss: 0.8973, test_f1: 0.6231
 epoch: 70, train_loss: 0.6559, test_loss: 0.8996, test_f1: 0.6028
 epoch: 71, train_loss: 0.6584, test_loss: 0.8870, test_f1: 0.6140
 epoch: 72, train_loss: 0.6623, test_loss: 0.9022, test_f1: 0.6091
 epoch: 73, train_loss: 0.6602, test_loss: 0.9150, test_f1: 0.6123
 epoch: 74, train_loss: 0.6574, test_loss: 0.9035, test_f1: 0.5940
 epoch: 75, train_loss: 0.6546, test_loss: 0.9044, test_f1: 0.6060
 epoch: 76, train_loss: 0.6531, test_loss: 0.9165, test_f1: 0.5921
 epoch: 77, train_loss: 0.6526, test_loss: 0.9223, test_f1: 0.6026
 epoch: 78, train_loss: 0.6393, test_loss: 0.9158, test_f1: 0.6013
 epoch: 79, train_loss: 0.6478, test_loss: 0.9197, test_f1: 0.5995
 epoch: 80, train_loss: 0.6431, test_loss: 0.8986, test_f1: 0.6061
 epoch: 81, train_loss: 0.6414, test_loss: 0.9171, test_f1: 0.6089
 epoch: 82, train_loss: 0.6519, test_loss: 0.9213, test_f1: 0.6080
 epoch: 83, train_loss: 0.6458, test_loss: 0.9142, test_f1: 0.6215
 epoch: 84, train_loss: 0.6364, test_loss: 0.9239, test_f1: 0.6053
 epoch: 85, train_loss: 0.6335, test_loss: 0.9201, test_f1: 0.6096
 epoch: 86, train_loss: 0.6448, test_loss: 0.9011, test_f1: 0.6109
 epoch: 87, train_loss: 0.6422, test_loss: 0.9057, test_f1: 0.6364
 epoch: 88, train_loss: 0.6262, test_loss: 0.9002, test_f1: 0.6072
 epoch: 89, train_loss: 0.6393, test_loss: 0.9251, test_f1: 0.6025
 epoch: 90, train_loss: 0.6301, test_loss: 0.9269, test_f1: 0.6103
 epoch: 91, train_loss: 0.6269, test_loss: 0.9266, test_f1: 0.6438
 epoch: 92, train_loss: 0.6327, test_loss: 0.9270, test_f1: 0.6236
 epoch: 93, train_loss: 0.6277, test_loss: 0.9250, test_f1: 0.6285
 epoch: 94, train_loss: 0.6272, test_loss: 0.9300, test_f1: 0.6127
 epoch: 95, train_loss: 0.6302, test_loss: 0.9607, test_f1: 0.6053
 epoch: 96, train_loss: 0.6222, test_loss: 0.9064, test_f1: 0.6436
 epoch: 97, train_loss: 0.6192, test_loss: 0.9285, test_f1: 0.6311
 epoch: 98, train_loss: 0.6058, test_loss: 0.9263, test_f1: 0.6179
 epoch: 99, train_loss: 0.6110, test_loss: 0.9303, test_f1: 0.6292

Training completed in 558.63 seconds
Best F1: 0.6729 at epoch 95
Mean F1 across iterations: 0.6561  0.0128
========================FINAL RESULTS================================
FEGIN weighted F1: 0.6729  0.0128
python main.py --data ltspice_examples --representation component_net --model FEGIN --layers 2 --hiddens 128 --batch_size 64 --lr 0.0001 --emb_size 128 --epochs 100 --save_appendix component_net_L2_H128_BS64_LR0.0001_E128 --no_val
-----



STDERR:
  File "main.py", line 370, in <module>
    main()
  File "main.py", line 254, in main
    dataset = dataset_class(
  File "/home/philip/projects/ltspice_examples_code_repo/Circuit-Completion-Using-GNNs/component_classification_with_link_prediction_head/evaluation/FEGIN/kernel/circuit_datasets.py", line 15, in __init__
    self.data, self.slices = torch.load(self.processed_paths[0])
  File "/home/philip/.local/lib/python3.8/site-packages/torch/serialization.py", line 1040, in load
    warnings.warn(
  File "/usr/lib/python3.8/warnings.py", line 109, in _showwarnmsg
    sw(msg.message, msg.category, msg.filename, msg.lineno,
  File "main.py", line 47, in warn_with_traceback
    traceback.print_stack(file=log)
/home/philip/projects/ltspice_examples_code_repo/Circuit-Completion-Using-GNNs/component_classification_with_link_prediction_head/evaluation/FEGIN/kernel/circuit_datasets.py:15: FutureWarning: You are using `torch.load` with `weights_only=False` (the current default value), which uses the default pickle module implicitly. It is possible to construct malicious pickle data which will execute arbitrary code during unpickling (See https://github.com/pytorch/pytorch/blob/main/SECURITY.md#untrusted-models for more details). In a future release, the default value for `weights_only` will be flipped to `True`. This limits the functions that could be executed during unpickling. Arbitrary objects will no longer be allowed to be loaded via this mode unless they are explicitly allowlisted by the user via `torch.serialization.add_safe_globals`. We recommend you start setting `weights_only=True` for any use case where you don't have full control of the loaded file. Please open an issue on GitHub for any issues related to this experimental feature.
  self.data, self.slices = torch.load(self.processed_paths[0])
