STDOUT:
Results will be saved in /home/philip/projects/ltspice_examples_code_repo/Circuit-Completion-Using-GNNs/component_classification_with_link_prediction_head/evaluation/FEGIN/results/model_FEGIN_dataset_ltspice_examples
Command line input: python main.py --data ltspice_examples --representation component_pin --model FEGIN --layers 6 --hiddens 32 --batch_size 64 --lr 0.01 --emb_size 250 --epochs 100 --save_appendix component_pin_L6_H32_BS64_LR0.01_E250 --no_val
 is saved.
-----
ltspice_examples - FEGIN
Using 6 layers, 32 hidden units, h = 2
Loading component_pin representation dataset
ENTERED
Training FEGIN on component_pin representation
Train: 3560, Test: 848
##################ITERATION #0 ****************************************
 epoch: 0, train_loss: 1.1681, test_loss: 2.2164, test_f1: 0.2577
 epoch: 1, train_loss: 1.0253, test_loss: 1.0211, test_f1: 0.4734
 epoch: 2, train_loss: 0.9707, test_loss: 1.0679, test_f1: 0.4888
 epoch: 3, train_loss: 0.9528, test_loss: 1.1994, test_f1: 0.3959
 epoch: 4, train_loss: 0.9415, test_loss: 1.0358, test_f1: 0.5206
 epoch: 5, train_loss: 0.9019, test_loss: 0.9234, test_f1: 0.5093
 epoch: 6, train_loss: 0.9113, test_loss: 0.9385, test_f1: 0.5240
 epoch: 7, train_loss: 0.8819, test_loss: 0.9063, test_f1: 0.4696
 epoch: 8, train_loss: 0.8854, test_loss: 0.9527, test_f1: 0.5208
 epoch: 9, train_loss: 0.8684, test_loss: 0.8952, test_f1: 0.5258
 epoch: 10, train_loss: 0.8634, test_loss: 0.8712, test_f1: 0.5441
 epoch: 11, train_loss: 0.8552, test_loss: 0.8889, test_f1: 0.5144
 epoch: 12, train_loss: 0.8551, test_loss: 0.8644, test_f1: 0.6157
 epoch: 13, train_loss: 0.8502, test_loss: 0.9168, test_f1: 0.5245
 epoch: 14, train_loss: 0.8482, test_loss: 0.8843, test_f1: 0.5226
 epoch: 15, train_loss: 0.8262, test_loss: 0.9392, test_f1: 0.5354
 epoch: 16, train_loss: 0.8210, test_loss: 0.9632, test_f1: 0.5139
 epoch: 17, train_loss: 0.8297, test_loss: 0.8752, test_f1: 0.5112
 epoch: 18, train_loss: 0.8174, test_loss: 1.0871, test_f1: 0.4841
 epoch: 19, train_loss: 0.8367, test_loss: 0.8033, test_f1: 0.5536
 epoch: 20, train_loss: 0.8268, test_loss: 0.9322, test_f1: 0.5379
 epoch: 21, train_loss: 0.8217, test_loss: 0.8875, test_f1: 0.5112
 epoch: 22, train_loss: 0.8026, test_loss: 0.8063, test_f1: 0.5690
 epoch: 23, train_loss: 0.8011, test_loss: 0.8820, test_f1: 0.6059
 epoch: 24, train_loss: 0.8017, test_loss: 0.8460, test_f1: 0.5391
 epoch: 25, train_loss: 0.7904, test_loss: 0.8713, test_f1: 0.5899
 epoch: 26, train_loss: 0.7800, test_loss: 0.8838, test_f1: 0.5459
 epoch: 27, train_loss: 0.7737, test_loss: 0.8793, test_f1: 0.5978
 epoch: 28, train_loss: 0.7875, test_loss: 0.9006, test_f1: 0.5579
 epoch: 29, train_loss: 0.7776, test_loss: 0.8328, test_f1: 0.5447
 epoch: 30, train_loss: 0.7629, test_loss: 0.8555, test_f1: 0.5561
 epoch: 31, train_loss: 0.7609, test_loss: 0.8437, test_f1: 0.6132
 epoch: 32, train_loss: 0.7731, test_loss: 0.7895, test_f1: 0.5628
 epoch: 33, train_loss: 0.7407, test_loss: 0.8992, test_f1: 0.5431
 epoch: 34, train_loss: 0.7585, test_loss: 0.8957, test_f1: 0.5919
 epoch: 35, train_loss: 0.7489, test_loss: 0.8708, test_f1: 0.6017
 epoch: 36, train_loss: 0.7698, test_loss: 0.8754, test_f1: 0.5660
 epoch: 37, train_loss: 0.7616, test_loss: 0.8655, test_f1: 0.6030
 epoch: 38, train_loss: 0.7540, test_loss: 0.8168, test_f1: 0.5995
 epoch: 39, train_loss: 0.7375, test_loss: 0.8759, test_f1: 0.5681
 epoch: 40, train_loss: 0.7448, test_loss: 0.9405, test_f1: 0.5861
 epoch: 41, train_loss: 0.7513, test_loss: 0.8251, test_f1: 0.5849
 epoch: 42, train_loss: 0.7429, test_loss: 0.8206, test_f1: 0.6199
 epoch: 43, train_loss: 0.7394, test_loss: 0.7733, test_f1: 0.5799
 epoch: 44, train_loss: 0.7224, test_loss: 1.0221, test_f1: 0.5485
 epoch: 45, train_loss: 0.7301, test_loss: 0.8438, test_f1: 0.5634
 epoch: 46, train_loss: 0.7217, test_loss: 3.6820, test_f1: 0.5469
 epoch: 47, train_loss: 0.7268, test_loss: 0.9369, test_f1: 0.5682
 epoch: 48, train_loss: 0.7267, test_loss: 0.9141, test_f1: 0.5674
 epoch: 49, train_loss: 0.7304, test_loss: 0.7572, test_f1: 0.5844
 epoch: 50, train_loss: 0.7121, test_loss: 0.9168, test_f1: 0.5732
 epoch: 51, train_loss: 0.6964, test_loss: 0.9216, test_f1: 0.6114
 epoch: 52, train_loss: 0.6759, test_loss: 0.8840, test_f1: 0.6578
 epoch: 53, train_loss: 0.6660, test_loss: 0.9196, test_f1: 0.5946
 epoch: 54, train_loss: 0.6523, test_loss: 0.9153, test_f1: 0.6232
 epoch: 55, train_loss: 0.6567, test_loss: 0.8697, test_f1: 0.5901
 epoch: 56, train_loss: 0.6463, test_loss: 0.8636, test_f1: 0.6355
 epoch: 57, train_loss: 0.6386, test_loss: 0.9019, test_f1: 0.5947
 epoch: 58, train_loss: 0.6383, test_loss: 0.8507, test_f1: 0.6357
 epoch: 59, train_loss: 0.6425, test_loss: 0.8536, test_f1: 0.6164
 epoch: 60, train_loss: 0.6354, test_loss: 0.8746, test_f1: 0.6557
 epoch: 61, train_loss: 0.6384, test_loss: 0.8547, test_f1: 0.6546
 epoch: 62, train_loss: 0.6229, test_loss: 0.8985, test_f1: 0.6410
 epoch: 63, train_loss: 0.6292, test_loss: 0.8451, test_f1: 0.6458
 epoch: 64, train_loss: 0.6259, test_loss: 0.9935, test_f1: 0.5897
 epoch: 65, train_loss: 0.6313, test_loss: 0.8721, test_f1: 0.6675
 epoch: 66, train_loss: 0.6225, test_loss: 0.8842, test_f1: 0.6475
 epoch: 67, train_loss: 0.6408, test_loss: 0.8526, test_f1: 0.6671
 epoch: 68, train_loss: 0.6226, test_loss: 0.9291, test_f1: 0.6506
 epoch: 69, train_loss: 0.6182, test_loss: 0.9372, test_f1: 0.6568
 epoch: 70, train_loss: 0.6023, test_loss: 0.9244, test_f1: 0.6561
 epoch: 71, train_loss: 0.6278, test_loss: 0.8639, test_f1: 0.6016
 epoch: 72, train_loss: 0.6196, test_loss: 0.8521, test_f1: 0.6605
 epoch: 73, train_loss: 0.6003, test_loss: 0.9689, test_f1: 0.6496
 epoch: 74, train_loss: 0.6197, test_loss: 0.8864, test_f1: 0.6494
 epoch: 75, train_loss: 0.6116, test_loss: 0.8746, test_f1: 0.6714
 epoch: 76, train_loss: 0.6221, test_loss: 0.8322, test_f1: 0.6931
 epoch: 77, train_loss: 0.5959, test_loss: 0.8619, test_f1: 0.6539
 epoch: 78, train_loss: 0.6261, test_loss: 0.9103, test_f1: 0.6575
 epoch: 79, train_loss: 0.5911, test_loss: 0.9321, test_f1: 0.6488
 epoch: 80, train_loss: 0.5957, test_loss: 0.8500, test_f1: 0.6638
 epoch: 81, train_loss: 0.5974, test_loss: 0.8535, test_f1: 0.6789
 epoch: 82, train_loss: 0.5859, test_loss: 0.8624, test_f1: 0.6722
 epoch: 83, train_loss: 0.5752, test_loss: 0.9093, test_f1: 0.6775
 epoch: 84, train_loss: 0.5754, test_loss: 0.9041, test_f1: 0.6671
 epoch: 85, train_loss: 0.5808, test_loss: 0.8855, test_f1: 0.6825
 epoch: 86, train_loss: 0.5754, test_loss: 0.8809, test_f1: 0.6689
 epoch: 87, train_loss: 0.5886, test_loss: 0.8335, test_f1: 0.6736
 epoch: 88, train_loss: 0.5791, test_loss: 0.9144, test_f1: 0.6620
 epoch: 89, train_loss: 0.5828, test_loss: 0.8171, test_f1: 0.6664
 epoch: 90, train_loss: 0.5757, test_loss: 0.8888, test_f1: 0.6683
 epoch: 91, train_loss: 0.5736, test_loss: 0.8521, test_f1: 0.6503
 epoch: 92, train_loss: 0.5532, test_loss: 0.7739, test_f1: 0.6818
 epoch: 93, train_loss: 0.5674, test_loss: 0.8611, test_f1: 0.6842
 epoch: 94, train_loss: 0.5660, test_loss: 0.8804, test_f1: 0.7043
 epoch: 95, train_loss: 0.5617, test_loss: 0.8572, test_f1: 0.6729
 epoch: 96, train_loss: 0.5469, test_loss: 0.8299, test_f1: 0.6778
 epoch: 97, train_loss: 0.5469, test_loss: 0.7977, test_f1: 0.6691
 epoch: 98, train_loss: 0.5539, test_loss: 0.7886, test_f1: 0.6790
 epoch: 99, train_loss: 0.5673, test_loss: 1.0206, test_f1: 0.6671
##################ITERATION #1 ****************************************
 epoch: 0, train_loss: 1.1260, test_loss: 1.1270, test_f1: 0.3407
 epoch: 1, train_loss: 1.0315, test_loss: 1.0837, test_f1: 0.3938
 epoch: 2, train_loss: 1.0041, test_loss: 0.9677, test_f1: 0.4632
 epoch: 3, train_loss: 0.9910, test_loss: 1.0474, test_f1: 0.4126
 epoch: 4, train_loss: 0.9712, test_loss: 1.0278, test_f1: 0.4001
 epoch: 5, train_loss: 0.9564, test_loss: 1.0264, test_f1: 0.5128
 epoch: 6, train_loss: 0.9473, test_loss: 1.0592, test_f1: 0.5028
 epoch: 7, train_loss: 0.9247, test_loss: 1.0532, test_f1: 0.4387
 epoch: 8, train_loss: 0.9040, test_loss: 1.0458, test_f1: 0.4767
 epoch: 9, train_loss: 0.8602, test_loss: 0.9475, test_f1: 0.5772
 epoch: 10, train_loss: 0.8649, test_loss: 0.9577, test_f1: 0.4799
 epoch: 11, train_loss: 0.8667, test_loss: 1.1508, test_f1: 0.4388
 epoch: 12, train_loss: 0.8612, test_loss: 0.9548, test_f1: 0.4738
 epoch: 13, train_loss: 0.8526, test_loss: 0.9155, test_f1: 0.5004
 epoch: 14, train_loss: 0.8268, test_loss: 0.9365, test_f1: 0.5826
 epoch: 15, train_loss: 0.8379, test_loss: 1.0503, test_f1: 0.5552
 epoch: 16, train_loss: 0.8223, test_loss: 0.9347, test_f1: 0.5716
 epoch: 17, train_loss: 0.8260, test_loss: 1.0958, test_f1: 0.5566
 epoch: 18, train_loss: 0.8273, test_loss: 0.8953, test_f1: 0.5918
 epoch: 19, train_loss: 0.7971, test_loss: 0.9095, test_f1: 0.5562
 epoch: 20, train_loss: 0.7881, test_loss: 1.2339, test_f1: 0.4997
 epoch: 21, train_loss: 0.8009, test_loss: 1.0360, test_f1: 0.5124
 epoch: 22, train_loss: 0.7941, test_loss: 0.8603, test_f1: 0.5891
 epoch: 23, train_loss: 0.7746, test_loss: 0.8970, test_f1: 0.6376
 epoch: 24, train_loss: 0.7714, test_loss: 1.0550, test_f1: 0.5490
 epoch: 25, train_loss: 0.7718, test_loss: 0.9936, test_f1: 0.5649
 epoch: 26, train_loss: 0.7646, test_loss: 0.9296, test_f1: 0.6243
 epoch: 27, train_loss: 0.7615, test_loss: 0.9863, test_f1: 0.5920
 epoch: 28, train_loss: 0.7534, test_loss: 0.9998, test_f1: 0.5647
 epoch: 29, train_loss: 0.7491, test_loss: 0.9991, test_f1: 0.5803
 epoch: 30, train_loss: 0.7416, test_loss: 1.0074, test_f1: 0.5674
 epoch: 31, train_loss: 0.7238, test_loss: 1.0183, test_f1: 0.6281
 epoch: 32, train_loss: 0.7560, test_loss: 0.9205, test_f1: 0.6437
 epoch: 33, train_loss: 0.7235, test_loss: 0.9372, test_f1: 0.6229
 epoch: 34, train_loss: 0.7355, test_loss: 1.0174, test_f1: 0.6125
 epoch: 35, train_loss: 0.7118, test_loss: 0.8627, test_f1: 0.6375
 epoch: 36, train_loss: 0.7047, test_loss: 1.0319, test_f1: 0.5933
 epoch: 37, train_loss: 0.7081, test_loss: 0.9557, test_f1: 0.6031
 epoch: 38, train_loss: 0.7116, test_loss: 1.0777, test_f1: 0.6164
 epoch: 39, train_loss: 0.7090, test_loss: 0.8936, test_f1: 0.6459
 epoch: 40, train_loss: 0.7005, test_loss: 1.0847, test_f1: 0.6239
 epoch: 41, train_loss: 0.7060, test_loss: 1.0379, test_f1: 0.6094
 epoch: 42, train_loss: 0.7003, test_loss: 1.1040, test_f1: 0.5724
 epoch: 43, train_loss: 0.6992, test_loss: 1.0808, test_f1: 0.6129
 epoch: 44, train_loss: 0.7116, test_loss: 1.0614, test_f1: 0.6219
 epoch: 45, train_loss: 0.6990, test_loss: 0.9078, test_f1: 0.6074
 epoch: 46, train_loss: 0.6992, test_loss: 1.0720, test_f1: 0.5645
 epoch: 47, train_loss: 0.6809, test_loss: 0.8256, test_f1: 0.6297
 epoch: 48, train_loss: 0.6643, test_loss: 1.0325, test_f1: 0.5856
 epoch: 49, train_loss: 0.6705, test_loss: 1.0260, test_f1: 0.5841
 epoch: 50, train_loss: 0.6842, test_loss: 0.9690, test_f1: 0.6506
 epoch: 51, train_loss: 0.6446, test_loss: 1.0090, test_f1: 0.6251
 epoch: 52, train_loss: 0.6237, test_loss: 0.9990, test_f1: 0.6495
 epoch: 53, train_loss: 0.6251, test_loss: 1.0262, test_f1: 0.6221
 epoch: 54, train_loss: 0.6067, test_loss: 1.0689, test_f1: 0.6078
 epoch: 55, train_loss: 0.5987, test_loss: 1.0059, test_f1: 0.6382
 epoch: 56, train_loss: 0.6047, test_loss: 1.0704, test_f1: 0.5961
 epoch: 57, train_loss: 0.5954, test_loss: 0.9396, test_f1: 0.6249
 epoch: 58, train_loss: 0.5924, test_loss: 1.0312, test_f1: 0.6434
 epoch: 59, train_loss: 0.5828, test_loss: 1.0249, test_f1: 0.6304
 epoch: 60, train_loss: 0.5697, test_loss: 0.9857, test_f1: 0.6339
 epoch: 61, train_loss: 0.5833, test_loss: 1.0060, test_f1: 0.6293
 epoch: 62, train_loss: 0.5824, test_loss: 1.1393, test_f1: 0.6567
 epoch: 63, train_loss: 0.5942, test_loss: 1.1324, test_f1: 0.6337
 epoch: 64, train_loss: 0.5800, test_loss: 1.1428, test_f1: 0.6080
 epoch: 65, train_loss: 0.5686, test_loss: 1.0367, test_f1: 0.6267
 epoch: 66, train_loss: 0.5760, test_loss: 1.1638, test_f1: 0.6275
 epoch: 67, train_loss: 0.5695, test_loss: 1.0772, test_f1: 0.6214
 epoch: 68, train_loss: 0.5621, test_loss: 0.9565, test_f1: 0.6725
 epoch: 69, train_loss: 0.5696, test_loss: 1.1595, test_f1: 0.6235
 epoch: 70, train_loss: 0.5682, test_loss: 1.2195, test_f1: 0.6261
 epoch: 71, train_loss: 0.5776, test_loss: 1.2483, test_f1: 0.6129
 epoch: 72, train_loss: 0.5547, test_loss: 1.1743, test_f1: 0.6311
 epoch: 73, train_loss: 0.5486, test_loss: 1.2726, test_f1: 0.5835
 epoch: 74, train_loss: 0.5774, test_loss: 1.1941, test_f1: 0.6366
 epoch: 75, train_loss: 0.5511, test_loss: 1.1285, test_f1: 0.6463
 epoch: 76, train_loss: 0.5425, test_loss: 1.1526, test_f1: 0.6259
 epoch: 77, train_loss: 0.5458, test_loss: 1.0928, test_f1: 0.6606
 epoch: 78, train_loss: 0.5440, test_loss: 1.1969, test_f1: 0.6201
 epoch: 79, train_loss: 0.5438, test_loss: 1.1374, test_f1: 0.6416
 epoch: 80, train_loss: 0.5492, test_loss: 1.1538, test_f1: 0.6391
 epoch: 81, train_loss: 0.5379, test_loss: 1.0299, test_f1: 0.6450
 epoch: 82, train_loss: 0.5373, test_loss: 1.3293, test_f1: 0.6039
 epoch: 83, train_loss: 0.5424, test_loss: 1.1853, test_f1: 0.6402
 epoch: 84, train_loss: 0.5392, test_loss: 1.2792, test_f1: 0.6187
 epoch: 85, train_loss: 0.5338, test_loss: 1.2783, test_f1: 0.6242
 epoch: 86, train_loss: 0.5417, test_loss: 1.1978, test_f1: 0.6451
 epoch: 87, train_loss: 0.5290, test_loss: 1.1429, test_f1: 0.6410
 epoch: 88, train_loss: 0.5441, test_loss: 1.1882, test_f1: 0.6591
 epoch: 89, train_loss: 0.5286, test_loss: 1.1816, test_f1: 0.6031
 epoch: 90, train_loss: 0.5381, test_loss: 1.2230, test_f1: 0.5996
 epoch: 91, train_loss: 0.5158, test_loss: 1.1842, test_f1: 0.6360
 epoch: 92, train_loss: 0.5510, test_loss: 1.1402, test_f1: 0.6384
 epoch: 93, train_loss: 0.5022, test_loss: 1.1728, test_f1: 0.6499
 epoch: 94, train_loss: 0.5260, test_loss: 1.2774, test_f1: 0.6203
 epoch: 95, train_loss: 0.5151, test_loss: 1.3052, test_f1: 0.6015
 epoch: 96, train_loss: 0.5252, test_loss: 1.0968, test_f1: 0.6537
 epoch: 97, train_loss: 0.5030, test_loss: 1.2604, test_f1: 0.6305
 epoch: 98, train_loss: 0.5121, test_loss: 1.2175, test_f1: 0.6337
 epoch: 99, train_loss: 0.5076, test_loss: 1.1760, test_f1: 0.6219
##################ITERATION #2 ****************************************
 epoch: 0, train_loss: 1.1358, test_loss: 1.1102, test_f1: 0.4897
 epoch: 1, train_loss: 1.0235, test_loss: 1.0187, test_f1: 0.4949
 epoch: 2, train_loss: 0.9611, test_loss: 0.9486, test_f1: 0.5109
 epoch: 3, train_loss: 0.9551, test_loss: 0.9651, test_f1: 0.5157
 epoch: 4, train_loss: 0.9441, test_loss: 0.8870, test_f1: 0.5746
 epoch: 5, train_loss: 0.9298, test_loss: 0.9719, test_f1: 0.5014
 epoch: 6, train_loss: 0.9211, test_loss: 1.0238, test_f1: 0.5247
 epoch: 7, train_loss: 0.9210, test_loss: 0.9199, test_f1: 0.5359
 epoch: 8, train_loss: 0.8853, test_loss: 0.8748, test_f1: 0.5496
 epoch: 9, train_loss: 0.8979, test_loss: 0.9275, test_f1: 0.5293
 epoch: 10, train_loss: 0.8690, test_loss: 0.9167, test_f1: 0.5070
 epoch: 11, train_loss: 0.8645, test_loss: 0.9524, test_f1: 0.5118
 epoch: 12, train_loss: 0.8659, test_loss: 1.0319, test_f1: 0.5026
 epoch: 13, train_loss: 0.8568, test_loss: 0.8779, test_f1: 0.5316
 epoch: 14, train_loss: 0.8349, test_loss: 0.8518, test_f1: 0.5513
 epoch: 15, train_loss: 0.8315, test_loss: 0.9171, test_f1: 0.5306
 epoch: 16, train_loss: 0.8085, test_loss: 0.9254, test_f1: 0.5842
 epoch: 17, train_loss: 0.8168, test_loss: 0.9872, test_f1: 0.4934
 epoch: 18, train_loss: 0.8138, test_loss: 1.0709, test_f1: 0.5294
 epoch: 19, train_loss: 0.8157, test_loss: 0.9301, test_f1: 0.5285
 epoch: 20, train_loss: 0.8095, test_loss: 0.8379, test_f1: 0.5693
 epoch: 21, train_loss: 0.7992, test_loss: 0.8552, test_f1: 0.5939
 epoch: 22, train_loss: 0.8078, test_loss: 0.8204, test_f1: 0.5954
 epoch: 23, train_loss: 0.7894, test_loss: 1.0151, test_f1: 0.4693
 epoch: 24, train_loss: 0.7960, test_loss: 0.9016, test_f1: 0.5932
 epoch: 25, train_loss: 0.7737, test_loss: 0.8396, test_f1: 0.5546
 epoch: 26, train_loss: 0.7689, test_loss: 0.8110, test_f1: 0.5552
 epoch: 27, train_loss: 0.7798, test_loss: 0.8481, test_f1: 0.5670
 epoch: 28, train_loss: 0.7749, test_loss: 1.0571, test_f1: 0.5188
 epoch: 29, train_loss: 0.7782, test_loss: 0.8067, test_f1: 0.5635
 epoch: 30, train_loss: 0.7657, test_loss: 0.8340, test_f1: 0.5786
 epoch: 31, train_loss: 0.7520, test_loss: 0.8140, test_f1: 0.5637
 epoch: 32, train_loss: 0.7595, test_loss: 0.8494, test_f1: 0.6122
 epoch: 33, train_loss: 0.7816, test_loss: 0.8041, test_f1: 0.5856
 epoch: 34, train_loss: 0.7682, test_loss: 1.0570, test_f1: 0.5993
 epoch: 35, train_loss: 0.7534, test_loss: 0.9493, test_f1: 0.5594
 epoch: 36, train_loss: 0.7408, test_loss: 1.0227, test_f1: 0.5544
 epoch: 37, train_loss: 0.7469, test_loss: 0.8391, test_f1: 0.6459
 epoch: 38, train_loss: 0.7337, test_loss: 0.9885, test_f1: 0.5654
 epoch: 39, train_loss: 0.7381, test_loss: 0.8780, test_f1: 0.5581
 epoch: 40, train_loss: 0.7301, test_loss: 0.9135, test_f1: 0.6324
 epoch: 41, train_loss: 0.7462, test_loss: 0.8580, test_f1: 0.6201
 epoch: 42, train_loss: 0.7127, test_loss: 0.8823, test_f1: 0.6279
 epoch: 43, train_loss: 0.7382, test_loss: 0.9144, test_f1: 0.5317
 epoch: 44, train_loss: 0.7251, test_loss: 0.8103, test_f1: 0.6202
 epoch: 45, train_loss: 0.7127, test_loss: 0.9254, test_f1: 0.5682
 epoch: 46, train_loss: 0.7119, test_loss: 0.8630, test_f1: 0.5720
 epoch: 47, train_loss: 0.7323, test_loss: 0.8931, test_f1: 0.5925
 epoch: 48, train_loss: 0.7252, test_loss: 0.9287, test_f1: 0.6102
 epoch: 49, train_loss: 0.7046, test_loss: 0.8517, test_f1: 0.5673
 epoch: 50, train_loss: 0.7251, test_loss: 0.7659, test_f1: 0.6495
 epoch: 51, train_loss: 0.6575, test_loss: 0.8055, test_f1: 0.6371
 epoch: 52, train_loss: 0.6606, test_loss: 0.7927, test_f1: 0.6796
 epoch: 53, train_loss: 0.6534, test_loss: 0.8268, test_f1: 0.6527
 epoch: 54, train_loss: 0.6490, test_loss: 0.8639, test_f1: 0.6228
 epoch: 55, train_loss: 0.6448, test_loss: 0.8591, test_f1: 0.6474
 epoch: 56, train_loss: 0.6361, test_loss: 0.9003, test_f1: 0.6386
 epoch: 57, train_loss: 0.6532, test_loss: 0.8107, test_f1: 0.6201
 epoch: 58, train_loss: 0.6331, test_loss: 0.8294, test_f1: 0.6251
 epoch: 59, train_loss: 0.6268, test_loss: 0.8897, test_f1: 0.6059
 epoch: 60, train_loss: 0.6457, test_loss: 1.0634, test_f1: 0.5950
 epoch: 61, train_loss: 0.6349, test_loss: 0.9733, test_f1: 0.5912
 epoch: 62, train_loss: 0.6392, test_loss: 0.8118, test_f1: 0.6269
 epoch: 63, train_loss: 0.6331, test_loss: 0.9469, test_f1: 0.6077
 epoch: 64, train_loss: 0.6036, test_loss: 0.8286, test_f1: 0.6000
 epoch: 65, train_loss: 0.6159, test_loss: 0.9452, test_f1: 0.5904
 epoch: 66, train_loss: 0.6164, test_loss: 0.9605, test_f1: 0.6231
 epoch: 67, train_loss: 0.6037, test_loss: 0.9524, test_f1: 0.5933
 epoch: 68, train_loss: 0.6261, test_loss: 1.0461, test_f1: 0.6221
 epoch: 69, train_loss: 0.6128, test_loss: 0.9737, test_f1: 0.5995
 epoch: 70, train_loss: 0.6094, test_loss: 0.8603, test_f1: 0.6039
 epoch: 71, train_loss: 0.6174, test_loss: 0.9770, test_f1: 0.6255
 epoch: 72, train_loss: 0.5978, test_loss: 0.9453, test_f1: 0.6366
 epoch: 73, train_loss: 0.6035, test_loss: 1.0149, test_f1: 0.6209
 epoch: 74, train_loss: 0.6076, test_loss: 0.9338, test_f1: 0.6222
 epoch: 75, train_loss: 0.5993, test_loss: 0.8553, test_f1: 0.6368
 epoch: 76, train_loss: 0.6017, test_loss: 1.0793, test_f1: 0.6279
 epoch: 77, train_loss: 0.5961, test_loss: 0.8655, test_f1: 0.6522
 epoch: 78, train_loss: 0.5885, test_loss: 0.9128, test_f1: 0.6422
 epoch: 79, train_loss: 0.5965, test_loss: 1.1669, test_f1: 0.6196
 epoch: 80, train_loss: 0.5876, test_loss: 0.8644, test_f1: 0.6233
 epoch: 81, train_loss: 0.5824, test_loss: 0.9855, test_f1: 0.6221
 epoch: 82, train_loss: 0.5853, test_loss: 0.9684, test_f1: 0.6387
 epoch: 83, train_loss: 0.5862, test_loss: 1.0211, test_f1: 0.6110
 epoch: 84, train_loss: 0.5887, test_loss: 1.3129, test_f1: 0.5922
 epoch: 85, train_loss: 0.5755, test_loss: 1.0685, test_f1: 0.6099
 epoch: 86, train_loss: 0.5578, test_loss: 1.1359, test_f1: 0.6679
 epoch: 87, train_loss: 0.5626, test_loss: 1.2832, test_f1: 0.5987
 epoch: 88, train_loss: 0.5727, test_loss: 1.0659, test_f1: 0.6283
 epoch: 89, train_loss: 0.5720, test_loss: 1.0085, test_f1: 0.6395
 epoch: 90, train_loss: 0.5866, test_loss: 1.0255, test_f1: 0.6489
 epoch: 91, train_loss: 0.5811, test_loss: 1.0974, test_f1: 0.6259
 epoch: 92, train_loss: 0.5718, test_loss: 1.0968, test_f1: 0.6319
 epoch: 93, train_loss: 0.5793, test_loss: 0.9444, test_f1: 0.6400
 epoch: 94, train_loss: 0.5778, test_loss: 1.0991, test_f1: 0.6233
 epoch: 95, train_loss: 0.5461, test_loss: 1.0781, test_f1: 0.6446
 epoch: 96, train_loss: 0.5544, test_loss: 1.1341, test_f1: 0.6370
 epoch: 97, train_loss: 0.5593, test_loss: 0.9958, test_f1: 0.6550
 epoch: 98, train_loss: 0.5567, test_loss: 0.8881, test_f1: 0.6336
 epoch: 99, train_loss: 0.5543, test_loss: 1.1331, test_f1: 0.6077
##################ITERATION #3 ****************************************
 epoch: 0, train_loss: 1.1743, test_loss: 1.1160, test_f1: 0.3914
 epoch: 1, train_loss: 1.0451, test_loss: 1.0308, test_f1: 0.4544
 epoch: 2, train_loss: 0.9955, test_loss: 1.0314, test_f1: 0.4705
 epoch: 3, train_loss: 0.9789, test_loss: 1.0125, test_f1: 0.4891
 epoch: 4, train_loss: 0.9724, test_loss: 1.0148, test_f1: 0.4660
 epoch: 5, train_loss: 0.9467, test_loss: 1.1750, test_f1: 0.4040
 epoch: 6, train_loss: 0.9373, test_loss: 0.9766, test_f1: 0.5022
 epoch: 7, train_loss: 0.9120, test_loss: 0.9600, test_f1: 0.5704
 epoch: 8, train_loss: 0.9135, test_loss: 1.2908, test_f1: 0.3874
 epoch: 9, train_loss: 0.9005, test_loss: 0.9285, test_f1: 0.5471
 epoch: 10, train_loss: 0.8773, test_loss: 0.9943, test_f1: 0.5055
 epoch: 11, train_loss: 0.8662, test_loss: 1.0901, test_f1: 0.4938
 epoch: 12, train_loss: 0.8601, test_loss: 1.1376, test_f1: 0.4884
 epoch: 13, train_loss: 0.8686, test_loss: 0.9072, test_f1: 0.5311
 epoch: 14, train_loss: 0.8580, test_loss: 0.9905, test_f1: 0.5143
 epoch: 15, train_loss: 0.8458, test_loss: 0.9576, test_f1: 0.5295
 epoch: 16, train_loss: 0.8437, test_loss: 0.9921, test_f1: 0.4959
 epoch: 17, train_loss: 0.8537, test_loss: 0.9519, test_f1: 0.5197
 epoch: 18, train_loss: 0.8278, test_loss: 1.0556, test_f1: 0.4829
 epoch: 19, train_loss: 0.8198, test_loss: 0.9085, test_f1: 0.5714
 epoch: 20, train_loss: 0.8229, test_loss: 0.9172, test_f1: 0.5240
 epoch: 21, train_loss: 0.8283, test_loss: 0.9292, test_f1: 0.5293
 epoch: 22, train_loss: 0.8278, test_loss: 0.8998, test_f1: 0.5111
 epoch: 23, train_loss: 0.8241, test_loss: 0.9390, test_f1: 0.5237
 epoch: 24, train_loss: 0.8286, test_loss: 0.9541, test_f1: 0.5468
 epoch: 25, train_loss: 0.8358, test_loss: 0.9334, test_f1: 0.5640
 epoch: 26, train_loss: 0.8092, test_loss: 0.9871, test_f1: 0.5867
 epoch: 27, train_loss: 0.8034, test_loss: 1.0462, test_f1: 0.5412
 epoch: 28, train_loss: 0.8092, test_loss: 0.9109, test_f1: 0.5356
 epoch: 29, train_loss: 0.7950, test_loss: 1.0339, test_f1: 0.5142
 epoch: 30, train_loss: 0.7881, test_loss: 0.8845, test_f1: 0.5431
 epoch: 31, train_loss: 0.7902, test_loss: 0.9679, test_f1: 0.5445
 epoch: 32, train_loss: 0.7776, test_loss: 1.0675, test_f1: 0.5096
 epoch: 33, train_loss: 0.7806, test_loss: 0.8944, test_f1: 0.5552
 epoch: 34, train_loss: 0.7707, test_loss: 0.9326, test_f1: 0.5211
 epoch: 35, train_loss: 0.7761, test_loss: 0.9044, test_f1: 0.5454
 epoch: 36, train_loss: 0.7578, test_loss: 0.8707, test_f1: 0.6363
 epoch: 37, train_loss: 0.7743, test_loss: 0.8825, test_f1: 0.5992
 epoch: 38, train_loss: 0.7700, test_loss: 0.9524, test_f1: 0.5416
 epoch: 39, train_loss: 0.7623, test_loss: 0.9512, test_f1: 0.5336
 epoch: 40, train_loss: 0.7620, test_loss: 0.9079, test_f1: 0.5470
 epoch: 41, train_loss: 0.7618, test_loss: 0.9421, test_f1: 0.5815
 epoch: 42, train_loss: 0.7671, test_loss: 0.8396, test_f1: 0.5812
 epoch: 43, train_loss: 0.7181, test_loss: 0.8624, test_f1: 0.5639
 epoch: 44, train_loss: 0.7463, test_loss: 1.0484, test_f1: 0.5076
 epoch: 45, train_loss: 0.7445, test_loss: 0.9048, test_f1: 0.5755
 epoch: 46, train_loss: 0.7248, test_loss: 0.8997, test_f1: 0.5983
 epoch: 47, train_loss: 0.7196, test_loss: 0.9323, test_f1: 0.5861
 epoch: 48, train_loss: 0.7387, test_loss: 0.9090, test_f1: 0.6157
 epoch: 49, train_loss: 0.7402, test_loss: 0.8758, test_f1: 0.6108
 epoch: 50, train_loss: 0.7340, test_loss: 0.9480, test_f1: 0.5930
 epoch: 51, train_loss: 0.6871, test_loss: 0.9473, test_f1: 0.5830
 epoch: 52, train_loss: 0.6840, test_loss: 0.8856, test_f1: 0.5777
 epoch: 53, train_loss: 0.6707, test_loss: 0.9105, test_f1: 0.6016
 epoch: 54, train_loss: 0.6790, test_loss: 0.8657, test_f1: 0.6181
 epoch: 55, train_loss: 0.6694, test_loss: 0.9566, test_f1: 0.5642
 epoch: 56, train_loss: 0.6402, test_loss: 1.0861, test_f1: 0.5836
 epoch: 57, train_loss: 0.6533, test_loss: 1.0234, test_f1: 0.6099
 epoch: 58, train_loss: 0.6623, test_loss: 0.8995, test_f1: 0.5802
 epoch: 59, train_loss: 0.6564, test_loss: 0.9685, test_f1: 0.6260
 epoch: 60, train_loss: 0.6533, test_loss: 0.8408, test_f1: 0.5845
 epoch: 61, train_loss: 0.6797, test_loss: 0.8974, test_f1: 0.5552
 epoch: 62, train_loss: 0.6585, test_loss: 0.9805, test_f1: 0.5829
 epoch: 63, train_loss: 0.6320, test_loss: 0.9062, test_f1: 0.6084
 epoch: 64, train_loss: 0.6563, test_loss: 0.9942, test_f1: 0.5568
 epoch: 65, train_loss: 0.6314, test_loss: 0.9709, test_f1: 0.6101
 epoch: 66, train_loss: 0.6532, test_loss: 0.8851, test_f1: 0.5910
 epoch: 67, train_loss: 0.6308, test_loss: 0.9392, test_f1: 0.5847
 epoch: 68, train_loss: 0.6273, test_loss: 0.9404, test_f1: 0.5699
 epoch: 69, train_loss: 0.6230, test_loss: 0.9310, test_f1: 0.5889
 epoch: 70, train_loss: 0.6287, test_loss: 0.8894, test_f1: 0.6189
 epoch: 71, train_loss: 0.6171, test_loss: 1.0055, test_f1: 0.5878
 epoch: 72, train_loss: 0.6288, test_loss: 0.9754, test_f1: 0.5719
 epoch: 73, train_loss: 0.6262, test_loss: 0.8966, test_f1: 0.6368
 epoch: 74, train_loss: 0.6218, test_loss: 0.9304, test_f1: 0.6339
 epoch: 75, train_loss: 0.6055, test_loss: 0.8623, test_f1: 0.6211
 epoch: 76, train_loss: 0.6252, test_loss: 0.9587, test_f1: 0.5877
 epoch: 77, train_loss: 0.6225, test_loss: 0.9463, test_f1: 0.5969
 epoch: 78, train_loss: 0.6179, test_loss: 1.0114, test_f1: 0.6193
 epoch: 79, train_loss: 0.5852, test_loss: 0.9588, test_f1: 0.6142
 epoch: 80, train_loss: 0.6075, test_loss: 0.9799, test_f1: 0.6136
 epoch: 81, train_loss: 0.6104, test_loss: 0.9553, test_f1: 0.6286
 epoch: 82, train_loss: 0.6084, test_loss: 1.0777, test_f1: 0.5757
 epoch: 83, train_loss: 0.6011, test_loss: 0.9817, test_f1: 0.6113
 epoch: 84, train_loss: 0.6063, test_loss: 1.0071, test_f1: 0.5967
 epoch: 85, train_loss: 0.6081, test_loss: 1.0195, test_f1: 0.5907
 epoch: 86, train_loss: 0.5987, test_loss: 0.9762, test_f1: 0.6234
 epoch: 87, train_loss: 0.5950, test_loss: 1.0001, test_f1: 0.5906
 epoch: 88, train_loss: 0.6053, test_loss: 0.9314, test_f1: 0.6382
 epoch: 89, train_loss: 0.5783, test_loss: 0.9190, test_f1: 0.6648
 epoch: 90, train_loss: 0.5864, test_loss: 0.9435, test_f1: 0.6111
 epoch: 91, train_loss: 0.5938, test_loss: 1.1131, test_f1: 0.6205
 epoch: 92, train_loss: 0.5939, test_loss: 0.9451, test_f1: 0.5978
 epoch: 93, train_loss: 0.5938, test_loss: 1.0309, test_f1: 0.6032
 epoch: 94, train_loss: 0.5885, test_loss: 1.0215, test_f1: 0.5948
 epoch: 95, train_loss: 0.5831, test_loss: 0.9216, test_f1: 0.6320
 epoch: 96, train_loss: 0.5918, test_loss: 0.9492, test_f1: 0.6216
 epoch: 97, train_loss: 0.5993, test_loss: 0.9595, test_f1: 0.6216
 epoch: 98, train_loss: 0.5789, test_loss: 0.9822, test_f1: 0.6198
 epoch: 99, train_loss: 0.5687, test_loss: 0.9787, test_f1: 0.6182
##################ITERATION #4 ****************************************
 epoch: 0, train_loss: 1.1632, test_loss: 1.0623, test_f1: 0.4357
 epoch: 1, train_loss: 1.0469, test_loss: 1.0542, test_f1: 0.4340
 epoch: 2, train_loss: 1.0040, test_loss: 1.0485, test_f1: 0.4469
 epoch: 3, train_loss: 0.9998, test_loss: 1.0802, test_f1: 0.4846
 epoch: 4, train_loss: 0.9905, test_loss: 1.0217, test_f1: 0.4793
 epoch: 5, train_loss: 0.9436, test_loss: 0.9962, test_f1: 0.4787
 epoch: 6, train_loss: 0.9341, test_loss: 1.0275, test_f1: 0.5098
 epoch: 7, train_loss: 0.9500, test_loss: 0.9741, test_f1: 0.5460
 epoch: 8, train_loss: 0.9238, test_loss: 0.9188, test_f1: 0.4592
 epoch: 9, train_loss: 0.9033, test_loss: 0.9683, test_f1: 0.5035
 epoch: 10, train_loss: 0.9105, test_loss: 0.9501, test_f1: 0.5222
 epoch: 11, train_loss: 0.8951, test_loss: 0.9678, test_f1: 0.5017
 epoch: 12, train_loss: 0.8746, test_loss: 0.9084, test_f1: 0.5140
 epoch: 13, train_loss: 0.8576, test_loss: 1.0210, test_f1: 0.4702
 epoch: 14, train_loss: 0.8689, test_loss: 1.0340, test_f1: 0.5654
 epoch: 15, train_loss: 0.8661, test_loss: 0.9635, test_f1: 0.4942
 epoch: 16, train_loss: 0.8739, test_loss: 0.9220, test_f1: 0.6068
 epoch: 17, train_loss: 0.8483, test_loss: 0.9563, test_f1: 0.5137
 epoch: 18, train_loss: 0.8439, test_loss: 0.9239, test_f1: 0.5247
 epoch: 19, train_loss: 0.8252, test_loss: 0.8590, test_f1: 0.5551
 epoch: 20, train_loss: 0.8083, test_loss: 0.9647, test_f1: 0.5389
 epoch: 21, train_loss: 0.8096, test_loss: 0.9191, test_f1: 0.5404
 epoch: 22, train_loss: 0.7880, test_loss: 0.8865, test_f1: 0.5580
 epoch: 23, train_loss: 0.7909, test_loss: 0.8976, test_f1: 0.5357
 epoch: 24, train_loss: 0.7903, test_loss: 0.9752, test_f1: 0.5176
 epoch: 25, train_loss: 0.7888, test_loss: 0.9157, test_f1: 0.6151
 epoch: 26, train_loss: 0.7842, test_loss: 0.8584, test_f1: 0.5667
 epoch: 27, train_loss: 0.7863, test_loss: 0.9437, test_f1: 0.5507
 epoch: 28, train_loss: 0.7679, test_loss: 0.9262, test_f1: 0.5430
 epoch: 29, train_loss: 0.7894, test_loss: 0.8806, test_f1: 0.5734
 epoch: 30, train_loss: 0.7661, test_loss: 0.8925, test_f1: 0.6286
 epoch: 31, train_loss: 0.7499, test_loss: 1.0082, test_f1: 0.5959
 epoch: 32, train_loss: 0.7440, test_loss: 0.8948, test_f1: 0.6026
 epoch: 33, train_loss: 0.7596, test_loss: 1.0219, test_f1: 0.6305
 epoch: 34, train_loss: 0.7376, test_loss: 0.9287, test_f1: 0.6123
 epoch: 35, train_loss: 0.7439, test_loss: 0.9561, test_f1: 0.6359
 epoch: 36, train_loss: 0.7356, test_loss: 0.8795, test_f1: 0.5912
 epoch: 37, train_loss: 0.7538, test_loss: 0.8746, test_f1: 0.6244
 epoch: 38, train_loss: 0.7437, test_loss: 0.9555, test_f1: 0.5637
 epoch: 39, train_loss: 0.7040, test_loss: 0.9532, test_f1: 0.5969
 epoch: 40, train_loss: 0.7157, test_loss: 0.9570, test_f1: 0.6147
 epoch: 41, train_loss: 0.7121, test_loss: 0.9042, test_f1: 0.6127
 epoch: 42, train_loss: 0.7511, test_loss: 1.0037, test_f1: 0.5879
 epoch: 43, train_loss: 0.7267, test_loss: 1.0413, test_f1: 0.5626
 epoch: 44, train_loss: 0.7244, test_loss: 0.9293, test_f1: 0.6117
 epoch: 45, train_loss: 0.7202, test_loss: 1.0445, test_f1: 0.5807
 epoch: 46, train_loss: 0.7212, test_loss: 0.9797, test_f1: 0.5811
 epoch: 47, train_loss: 0.7097, test_loss: 0.8090, test_f1: 0.6375
 epoch: 48, train_loss: 0.7157, test_loss: 0.8903, test_f1: 0.6103
 epoch: 49, train_loss: 0.6979, test_loss: 0.9790, test_f1: 0.5721
 epoch: 50, train_loss: 0.6837, test_loss: 0.9594, test_f1: 0.5815
 epoch: 51, train_loss: 0.6720, test_loss: 0.9946, test_f1: 0.6104
 epoch: 52, train_loss: 0.6565, test_loss: 0.8962, test_f1: 0.6249
 epoch: 53, train_loss: 0.6323, test_loss: 1.0889, test_f1: 0.5753
 epoch: 54, train_loss: 0.6187, test_loss: 0.8881, test_f1: 0.6189
 epoch: 55, train_loss: 0.6280, test_loss: 0.9655, test_f1: 0.6074
 epoch: 56, train_loss: 0.6128, test_loss: 0.9712, test_f1: 0.5945
 epoch: 57, train_loss: 0.6209, test_loss: 0.9663, test_f1: 0.6039
 epoch: 58, train_loss: 0.6280, test_loss: 0.9125, test_f1: 0.6296
 epoch: 59, train_loss: 0.6116, test_loss: 0.9796, test_f1: 0.6050
 epoch: 60, train_loss: 0.6232, test_loss: 0.9273, test_f1: 0.6124
 epoch: 61, train_loss: 0.6073, test_loss: 0.9808, test_f1: 0.6086
 epoch: 62, train_loss: 0.6124, test_loss: 0.9585, test_f1: 0.6146
 epoch: 63, train_loss: 0.6182, test_loss: 0.9803, test_f1: 0.6002
 epoch: 64, train_loss: 0.6059, test_loss: 0.9715, test_f1: 0.6128
 epoch: 65, train_loss: 0.5778, test_loss: 0.9699, test_f1: 0.6323
 epoch: 66, train_loss: 0.5831, test_loss: 1.0300, test_f1: 0.6113
 epoch: 67, train_loss: 0.5767, test_loss: 1.0268, test_f1: 0.5983
 epoch: 68, train_loss: 0.5934, test_loss: 0.9551, test_f1: 0.6045
 epoch: 69, train_loss: 0.6070, test_loss: 0.9468, test_f1: 0.6068
 epoch: 70, train_loss: 0.5949, test_loss: 0.9733, test_f1: 0.6206
 epoch: 71, train_loss: 0.5775, test_loss: 1.0033, test_f1: 0.6245
 epoch: 72, train_loss: 0.5897, test_loss: 1.0297, test_f1: 0.6042
 epoch: 73, train_loss: 0.5674, test_loss: 1.0172, test_f1: 0.6252
 epoch: 74, train_loss: 0.5891, test_loss: 1.0670, test_f1: 0.6304
 epoch: 75, train_loss: 0.5892, test_loss: 0.9281, test_f1: 0.6160
 epoch: 76, train_loss: 0.5807, test_loss: 1.1193, test_f1: 0.6018
 epoch: 77, train_loss: 0.5853, test_loss: 1.1279, test_f1: 0.6006
 epoch: 78, train_loss: 0.5899, test_loss: 0.9651, test_f1: 0.6286
 epoch: 79, train_loss: 0.5903, test_loss: 1.0164, test_f1: 0.6036
 epoch: 80, train_loss: 0.5843, test_loss: 0.9194, test_f1: 0.6249
 epoch: 81, train_loss: 0.5610, test_loss: 0.8991, test_f1: 0.6182
 epoch: 82, train_loss: 0.5547, test_loss: 1.0052, test_f1: 0.6120
 epoch: 83, train_loss: 0.5964, test_loss: 1.0106, test_f1: 0.6037
 epoch: 84, train_loss: 0.5791, test_loss: 0.9898, test_f1: 0.5849
 epoch: 85, train_loss: 0.5581, test_loss: 1.0137, test_f1: 0.6158
 epoch: 86, train_loss: 0.5533, test_loss: 1.0077, test_f1: 0.6022
 epoch: 87, train_loss: 0.5705, test_loss: 1.0436, test_f1: 0.6140
 epoch: 88, train_loss: 0.5494, test_loss: 1.0880, test_f1: 0.6065
 epoch: 89, train_loss: 0.5479, test_loss: 1.1040, test_f1: 0.5945
 epoch: 90, train_loss: 0.5531, test_loss: 1.0231, test_f1: 0.6109
 epoch: 91, train_loss: 0.5442, test_loss: 1.0615, test_f1: 0.6101
 epoch: 92, train_loss: 0.5489, test_loss: 1.1877, test_f1: 0.6112
 epoch: 93, train_loss: 0.5264, test_loss: 1.2057, test_f1: 0.6150
 epoch: 94, train_loss: 0.5442, test_loss: 1.2933, test_f1: 0.6094
 epoch: 95, train_loss: 0.5605, test_loss: 1.1534, test_f1: 0.6052
 epoch: 96, train_loss: 0.5453, test_loss: 1.0146, test_f1: 0.6093
 epoch: 97, train_loss: 0.5443, test_loss: 1.0585, test_f1: 0.6080
 epoch: 98, train_loss: 0.5400, test_loss: 1.1484, test_f1: 0.5989
 epoch: 99, train_loss: 0.5183, test_loss: 1.0995, test_f1: 0.5928
##################ITERATION #5 ****************************************
 epoch: 0, train_loss: 1.1626, test_loss: 2.6204, test_f1: 0.2381
 epoch: 1, train_loss: 1.0341, test_loss: 1.0662, test_f1: 0.4903
 epoch: 2, train_loss: 0.9758, test_loss: 0.9877, test_f1: 0.5113
 epoch: 3, train_loss: 0.9623, test_loss: 1.0339, test_f1: 0.5059
 epoch: 4, train_loss: 0.9545, test_loss: 1.0117, test_f1: 0.4764
 epoch: 5, train_loss: 0.9337, test_loss: 1.2178, test_f1: 0.4789
 epoch: 6, train_loss: 0.9301, test_loss: 1.0986, test_f1: 0.5454
 epoch: 7, train_loss: 0.9103, test_loss: 0.9852, test_f1: 0.4981
 epoch: 8, train_loss: 0.8969, test_loss: 0.9984, test_f1: 0.5203
 epoch: 9, train_loss: 0.8823, test_loss: 1.0450, test_f1: 0.4573
 epoch: 10, train_loss: 0.9004, test_loss: 1.0455, test_f1: 0.4888
 epoch: 11, train_loss: 0.8674, test_loss: 0.9741, test_f1: 0.5444
 epoch: 12, train_loss: 0.8692, test_loss: 0.9479, test_f1: 0.5601
 epoch: 13, train_loss: 0.8636, test_loss: 0.8977, test_f1: 0.5066
 epoch: 14, train_loss: 0.8632, test_loss: 0.8974, test_f1: 0.5476
 epoch: 15, train_loss: 0.8518, test_loss: 1.2828, test_f1: 0.4543
 epoch: 16, train_loss: 0.8433, test_loss: 0.9485, test_f1: 0.5074
 epoch: 17, train_loss: 0.8627, test_loss: 0.8790, test_f1: 0.5230
 epoch: 18, train_loss: 0.8360, test_loss: 0.8772, test_f1: 0.5575
 epoch: 19, train_loss: 0.8148, test_loss: 0.9197, test_f1: 0.5337
 epoch: 20, train_loss: 0.8181, test_loss: 0.8977, test_f1: 0.5617
 epoch: 21, train_loss: 0.8268, test_loss: 0.9337, test_f1: 0.5512
 epoch: 22, train_loss: 0.8049, test_loss: 0.9247, test_f1: 0.5349
 epoch: 23, train_loss: 0.7991, test_loss: 0.9299, test_f1: 0.5324
 epoch: 24, train_loss: 0.8346, test_loss: 1.1357, test_f1: 0.4908
 epoch: 25, train_loss: 0.8277, test_loss: 0.9491, test_f1: 0.5263
 epoch: 26, train_loss: 0.7765, test_loss: 1.0039, test_f1: 0.5603
 epoch: 27, train_loss: 0.7882, test_loss: 0.9334, test_f1: 0.5535
 epoch: 28, train_loss: 0.7887, test_loss: 0.9014, test_f1: 0.5368
 epoch: 29, train_loss: 0.7989, test_loss: 0.9185, test_f1: 0.5600
 epoch: 30, train_loss: 0.7788, test_loss: 0.8936, test_f1: 0.5465
 epoch: 31, train_loss: 0.8072, test_loss: 0.8989, test_f1: 0.5574
 epoch: 32, train_loss: 0.7824, test_loss: 0.9026, test_f1: 0.5513
 epoch: 33, train_loss: 0.7655, test_loss: 0.9390, test_f1: 0.5619
 epoch: 34, train_loss: 0.7708, test_loss: 0.7973, test_f1: 0.5934
 epoch: 35, train_loss: 0.7809, test_loss: 0.9150, test_f1: 0.5743
 epoch: 36, train_loss: 0.7744, test_loss: 0.9546, test_f1: 0.5557
 epoch: 37, train_loss: 0.7461, test_loss: 0.9147, test_f1: 0.5732
 epoch: 38, train_loss: 0.7442, test_loss: 0.8786, test_f1: 0.5739
 epoch: 39, train_loss: 0.7690, test_loss: 0.8848, test_f1: 0.5592
 epoch: 40, train_loss: 0.7706, test_loss: 1.0140, test_f1: 0.5232
 epoch: 41, train_loss: 0.7439, test_loss: 0.8798, test_f1: 0.6176
 epoch: 42, train_loss: 0.7335, test_loss: 0.8890, test_f1: 0.6089
 epoch: 43, train_loss: 0.7289, test_loss: 0.8922, test_f1: 0.6240
 epoch: 44, train_loss: 0.7369, test_loss: 0.9298, test_f1: 0.5672
 epoch: 45, train_loss: 0.7241, test_loss: 0.8812, test_f1: 0.6034
 epoch: 46, train_loss: 0.7335, test_loss: 0.8842, test_f1: 0.6447
 epoch: 47, train_loss: 0.7244, test_loss: 0.9770, test_f1: 0.6053
 epoch: 48, train_loss: 0.7282, test_loss: 1.0020, test_f1: 0.5603
 epoch: 49, train_loss: 0.7224, test_loss: 0.8874, test_f1: 0.6011
 epoch: 50, train_loss: 0.7080, test_loss: 0.9670, test_f1: 0.5811
 epoch: 51, train_loss: 0.6879, test_loss: 0.8677, test_f1: 0.6309
 epoch: 52, train_loss: 0.6687, test_loss: 0.8566, test_f1: 0.6153
 epoch: 53, train_loss: 0.6598, test_loss: 0.8628, test_f1: 0.6319
 epoch: 54, train_loss: 0.6621, test_loss: 0.9008, test_f1: 0.5947
 epoch: 55, train_loss: 0.6701, test_loss: 0.8470, test_f1: 0.6209
 epoch: 56, train_loss: 0.6593, test_loss: 0.8810, test_f1: 0.6194
 epoch: 57, train_loss: 0.6601, test_loss: 0.8531, test_f1: 0.5968
 epoch: 58, train_loss: 0.6454, test_loss: 0.9252, test_f1: 0.5522
 epoch: 59, train_loss: 0.6545, test_loss: 0.8498, test_f1: 0.6371
 epoch: 60, train_loss: 0.6462, test_loss: 0.9302, test_f1: 0.6180
 epoch: 61, train_loss: 0.6518, test_loss: 0.8975, test_f1: 0.6239
 epoch: 62, train_loss: 0.6296, test_loss: 0.8655, test_f1: 0.6401
 epoch: 63, train_loss: 0.6410, test_loss: 0.8784, test_f1: 0.6403
 epoch: 64, train_loss: 0.6315, test_loss: 0.8730, test_f1: 0.6384
 epoch: 65, train_loss: 0.6503, test_loss: 0.8950, test_f1: 0.6076
 epoch: 66, train_loss: 0.6195, test_loss: 0.8487, test_f1: 0.6549
 epoch: 67, train_loss: 0.6246, test_loss: 0.8596, test_f1: 0.6186
 epoch: 68, train_loss: 0.6418, test_loss: 0.8713, test_f1: 0.6006
 epoch: 69, train_loss: 0.6331, test_loss: 0.9008, test_f1: 0.6353
 epoch: 70, train_loss: 0.6262, test_loss: 0.9565, test_f1: 0.6055
 epoch: 71, train_loss: 0.6525, test_loss: 0.9058, test_f1: 0.6482
 epoch: 72, train_loss: 0.6271, test_loss: 0.9035, test_f1: 0.6286
 epoch: 73, train_loss: 0.6389, test_loss: 0.9295, test_f1: 0.6285
 epoch: 74, train_loss: 0.6236, test_loss: 0.8930, test_f1: 0.6005
 epoch: 75, train_loss: 0.6195, test_loss: 0.9189, test_f1: 0.5942
 epoch: 76, train_loss: 0.6289, test_loss: 0.8896, test_f1: 0.6417
 epoch: 77, train_loss: 0.6375, test_loss: 0.8573, test_f1: 0.5995
 epoch: 78, train_loss: 0.6218, test_loss: 0.8646, test_f1: 0.6605
 epoch: 79, train_loss: 0.6245, test_loss: 0.9217, test_f1: 0.5889
 epoch: 80, train_loss: 0.6116, test_loss: 1.0024, test_f1: 0.5779
 epoch: 81, train_loss: 0.6623, test_loss: 0.8949, test_f1: 0.6201
 epoch: 82, train_loss: 0.6189, test_loss: 0.8706, test_f1: 0.6072
 epoch: 83, train_loss: 0.6061, test_loss: 0.9121, test_f1: 0.6037
 epoch: 84, train_loss: 0.6163, test_loss: 0.8524, test_f1: 0.6429
 epoch: 85, train_loss: 0.5984, test_loss: 0.8739, test_f1: 0.6491
 epoch: 86, train_loss: 0.6110, test_loss: 0.9109, test_f1: 0.5886
 epoch: 87, train_loss: 0.5851, test_loss: 0.8625, test_f1: 0.6533
 epoch: 88, train_loss: 0.5799, test_loss: 0.8636, test_f1: 0.6541
 epoch: 89, train_loss: 0.5940, test_loss: 0.9066, test_f1: 0.6104
 epoch: 90, train_loss: 0.6046, test_loss: 0.9329, test_f1: 0.6168
 epoch: 91, train_loss: 0.5872, test_loss: 0.9841, test_f1: 0.5916
 epoch: 92, train_loss: 0.5871, test_loss: 0.9713, test_f1: 0.6216
 epoch: 93, train_loss: 0.6099, test_loss: 0.8618, test_f1: 0.6272
 epoch: 94, train_loss: 0.5692, test_loss: 0.9945, test_f1: 0.6213
 epoch: 95, train_loss: 0.5899, test_loss: 0.9258, test_f1: 0.6520
 epoch: 96, train_loss: 0.5817, test_loss: 0.9283, test_f1: 0.6535
 epoch: 97, train_loss: 0.5909, test_loss: 0.9303, test_f1: 0.6590
 epoch: 98, train_loss: 0.5632, test_loss: 0.9470, test_f1: 0.6525
 epoch: 99, train_loss: 0.5628, test_loss: 0.9149, test_f1: 0.6297
##################ITERATION #6 ****************************************
 epoch: 0, train_loss: 1.1440, test_loss: 1.0050, test_f1: 0.4773
 epoch: 1, train_loss: 1.0173, test_loss: 1.0559, test_f1: 0.4486
 epoch: 2, train_loss: 0.9990, test_loss: 0.9743, test_f1: 0.4657
 epoch: 3, train_loss: 0.9765, test_loss: 0.9510, test_f1: 0.4963
 epoch: 4, train_loss: 0.9558, test_loss: 1.0255, test_f1: 0.5255
 epoch: 5, train_loss: 0.9456, test_loss: 0.9262, test_f1: 0.4772
 epoch: 6, train_loss: 0.9228, test_loss: 0.9827, test_f1: 0.4804
 epoch: 7, train_loss: 0.9228, test_loss: 0.9911, test_f1: 0.4551
 epoch: 8, train_loss: 0.8909, test_loss: 0.9644, test_f1: 0.4825
 epoch: 9, train_loss: 0.9017, test_loss: 0.9502, test_f1: 0.5125
 epoch: 10, train_loss: 0.8819, test_loss: 1.0133, test_f1: 0.4613
 epoch: 11, train_loss: 0.8783, test_loss: 0.8909, test_f1: 0.5347
 epoch: 12, train_loss: 0.8624, test_loss: 0.9708, test_f1: 0.4914
 epoch: 13, train_loss: 0.8698, test_loss: 0.9082, test_f1: 0.5520
 epoch: 14, train_loss: 0.8475, test_loss: 0.8483, test_f1: 0.5595
 epoch: 15, train_loss: 0.8429, test_loss: 0.8724, test_f1: 0.5133
 epoch: 16, train_loss: 0.8519, test_loss: 0.9235, test_f1: 0.5003
 epoch: 17, train_loss: 0.8451, test_loss: 0.8628, test_f1: 0.5665
 epoch: 18, train_loss: 0.8325, test_loss: 0.9235, test_f1: 0.5292
 epoch: 19, train_loss: 0.8454, test_loss: 0.9947, test_f1: 0.4689
 epoch: 20, train_loss: 0.8410, test_loss: 0.9844, test_f1: 0.4872
 epoch: 21, train_loss: 0.8184, test_loss: 0.9562, test_f1: 0.5296
 epoch: 22, train_loss: 0.8138, test_loss: 0.8643, test_f1: 0.5390
 epoch: 23, train_loss: 0.8121, test_loss: 0.9067, test_f1: 0.5645
 epoch: 24, train_loss: 0.7894, test_loss: 0.8973, test_f1: 0.5624
 epoch: 25, train_loss: 0.8083, test_loss: 0.9686, test_f1: 0.5406
 epoch: 26, train_loss: 0.8026, test_loss: 0.9103, test_f1: 0.5402
 epoch: 27, train_loss: 0.7813, test_loss: 1.1475, test_f1: 0.5017
 epoch: 28, train_loss: 0.8062, test_loss: 0.9295, test_f1: 0.5407
 epoch: 29, train_loss: 0.7736, test_loss: 1.0126, test_f1: 0.5259
 epoch: 30, train_loss: 0.8018, test_loss: 0.9484, test_f1: 0.5257
 epoch: 31, train_loss: 0.7794, test_loss: 0.9037, test_f1: 0.5321
 epoch: 32, train_loss: 0.7790, test_loss: 0.9338, test_f1: 0.5281
 epoch: 33, train_loss: 0.7816, test_loss: 0.8706, test_f1: 0.5523
 epoch: 34, train_loss: 0.7743, test_loss: 0.8897, test_f1: 0.5611
 epoch: 35, train_loss: 0.7610, test_loss: 0.8808, test_f1: 0.5236
 epoch: 36, train_loss: 0.7765, test_loss: 0.8931, test_f1: 0.6157
 epoch: 37, train_loss: 0.7724, test_loss: 0.8561, test_f1: 0.5591
 epoch: 38, train_loss: 0.7650, test_loss: 1.0147, test_f1: 0.5248
 epoch: 39, train_loss: 0.7633, test_loss: 0.8737, test_f1: 0.6066
 epoch: 40, train_loss: 0.7552, test_loss: 0.8641, test_f1: 0.5707
 epoch: 41, train_loss: 0.7349, test_loss: 0.9373, test_f1: 0.5507
 epoch: 42, train_loss: 0.7531, test_loss: 0.9349, test_f1: 0.5757
 epoch: 43, train_loss: 0.7460, test_loss: 0.8480, test_f1: 0.5948
 epoch: 44, train_loss: 0.7426, test_loss: 1.0094, test_f1: 0.5396
 epoch: 45, train_loss: 0.7390, test_loss: 0.7809, test_f1: 0.5978
 epoch: 46, train_loss: 0.7392, test_loss: 0.8614, test_f1: 0.5725
 epoch: 47, train_loss: 0.7087, test_loss: 0.9626, test_f1: 0.5600
 epoch: 48, train_loss: 0.7274, test_loss: 0.9434, test_f1: 0.5695
 epoch: 49, train_loss: 0.7202, test_loss: 0.9657, test_f1: 0.5449
 epoch: 50, train_loss: 0.7010, test_loss: 0.8701, test_f1: 0.6118
 epoch: 51, train_loss: 0.6882, test_loss: 0.8181, test_f1: 0.5955
 epoch: 52, train_loss: 0.6648, test_loss: 0.8381, test_f1: 0.6210
 epoch: 53, train_loss: 0.6625, test_loss: 0.8283, test_f1: 0.5921
 epoch: 54, train_loss: 0.6667, test_loss: 0.7894, test_f1: 0.5913
 epoch: 55, train_loss: 0.6526, test_loss: 0.8518, test_f1: 0.5854
 epoch: 56, train_loss: 0.6583, test_loss: 0.8360, test_f1: 0.5841
 epoch: 57, train_loss: 0.6579, test_loss: 0.7984, test_f1: 0.5816
 epoch: 58, train_loss: 0.6494, test_loss: 0.8603, test_f1: 0.5830
 epoch: 59, train_loss: 0.6654, test_loss: 0.8984, test_f1: 0.6169
 epoch: 60, train_loss: 0.6318, test_loss: 0.8810, test_f1: 0.6042
 epoch: 61, train_loss: 0.6436, test_loss: 0.8016, test_f1: 0.6061
 epoch: 62, train_loss: 0.6538, test_loss: 0.8789, test_f1: 0.5837
 epoch: 63, train_loss: 0.6460, test_loss: 0.8380, test_f1: 0.5853
 epoch: 64, train_loss: 0.6282, test_loss: 0.8309, test_f1: 0.6202
 epoch: 65, train_loss: 0.6340, test_loss: 0.8327, test_f1: 0.6253
 epoch: 66, train_loss: 0.6349, test_loss: 0.8398, test_f1: 0.6354
 epoch: 67, train_loss: 0.6347, test_loss: 0.7816, test_f1: 0.6083
 epoch: 68, train_loss: 0.6180, test_loss: 0.8729, test_f1: 0.5930
 epoch: 69, train_loss: 0.6380, test_loss: 0.8158, test_f1: 0.6046
 epoch: 70, train_loss: 0.6144, test_loss: 0.9828, test_f1: 0.5954
 epoch: 71, train_loss: 0.6132, test_loss: 0.8197, test_f1: 0.6255
 epoch: 72, train_loss: 0.6324, test_loss: 0.8783, test_f1: 0.6019
 epoch: 73, train_loss: 0.6246, test_loss: 0.9006, test_f1: 0.5643
 epoch: 74, train_loss: 0.6224, test_loss: 0.9038, test_f1: 0.6174
 epoch: 75, train_loss: 0.6233, test_loss: 0.8644, test_f1: 0.5610
 epoch: 76, train_loss: 0.6138, test_loss: 0.8322, test_f1: 0.6016
 epoch: 77, train_loss: 0.6193, test_loss: 0.7472, test_f1: 0.6306
 epoch: 78, train_loss: 0.6105, test_loss: 0.9668, test_f1: 0.5705
 epoch: 79, train_loss: 0.6146, test_loss: 0.7715, test_f1: 0.6173
 epoch: 80, train_loss: 0.6297, test_loss: 0.7704, test_f1: 0.6109
 epoch: 81, train_loss: 0.6081, test_loss: 0.9107, test_f1: 0.6037
 epoch: 82, train_loss: 0.6314, test_loss: 0.7435, test_f1: 0.6420
 epoch: 83, train_loss: 0.5899, test_loss: 0.7617, test_f1: 0.6168
 epoch: 84, train_loss: 0.6056, test_loss: 0.8075, test_f1: 0.6094
 epoch: 85, train_loss: 0.6130, test_loss: 0.8385, test_f1: 0.6080
 epoch: 86, train_loss: 0.6086, test_loss: 0.7993, test_f1: 0.5860
 epoch: 87, train_loss: 0.5990, test_loss: 0.7679, test_f1: 0.6186
 epoch: 88, train_loss: 0.5990, test_loss: 0.8067, test_f1: 0.6320
 epoch: 89, train_loss: 0.5909, test_loss: 0.8110, test_f1: 0.6293
 epoch: 90, train_loss: 0.5973, test_loss: 0.8419, test_f1: 0.5945
 epoch: 91, train_loss: 0.5953, test_loss: 0.9146, test_f1: 0.5948
 epoch: 92, train_loss: 0.5794, test_loss: 0.8269, test_f1: 0.6209
 epoch: 93, train_loss: 0.5931, test_loss: 0.8772, test_f1: 0.6067
 epoch: 94, train_loss: 0.5837, test_loss: 0.8365, test_f1: 0.6085
 epoch: 95, train_loss: 0.5858, test_loss: 0.8847, test_f1: 0.6116
 epoch: 96, train_loss: 0.5786, test_loss: 0.8850, test_f1: 0.5782
 epoch: 97, train_loss: 0.5823, test_loss: 0.8551, test_f1: 0.6334
 epoch: 98, train_loss: 0.5939, test_loss: 0.9048, test_f1: 0.6076
 epoch: 99, train_loss: 0.5802, test_loss: 0.9298, test_f1: 0.6068
##################ITERATION #7 ****************************************
 epoch: 0, train_loss: 1.1794, test_loss: 1.2228, test_f1: 0.3705
 epoch: 1, train_loss: 1.0411, test_loss: 1.0252, test_f1: 0.4751
 epoch: 2, train_loss: 1.0216, test_loss: 1.0018, test_f1: 0.4830
 epoch: 3, train_loss: 0.9994, test_loss: 1.0070, test_f1: 0.4678
 epoch: 4, train_loss: 0.9685, test_loss: 0.9694, test_f1: 0.5390
 epoch: 5, train_loss: 0.9680, test_loss: 1.0036, test_f1: 0.5072
 epoch: 6, train_loss: 0.9403, test_loss: 1.0168, test_f1: 0.5261
 epoch: 7, train_loss: 0.9263, test_loss: 1.0201, test_f1: 0.5085
 epoch: 8, train_loss: 0.9339, test_loss: 0.9917, test_f1: 0.5102
 epoch: 9, train_loss: 0.9125, test_loss: 0.8948, test_f1: 0.5667
 epoch: 10, train_loss: 0.8978, test_loss: 0.8777, test_f1: 0.5593
 epoch: 11, train_loss: 0.8973, test_loss: 0.9790, test_f1: 0.4819
 epoch: 12, train_loss: 0.9005, test_loss: 0.9160, test_f1: 0.5526
 epoch: 13, train_loss: 0.8514, test_loss: 0.9898, test_f1: 0.4971
 epoch: 14, train_loss: 0.8697, test_loss: 0.9572, test_f1: 0.4947
 epoch: 15, train_loss: 0.8466, test_loss: 0.9933, test_f1: 0.4998
 epoch: 16, train_loss: 0.8368, test_loss: 0.9361, test_f1: 0.5534
 epoch: 17, train_loss: 0.8485, test_loss: 1.0109, test_f1: 0.4421
 epoch: 18, train_loss: 0.8637, test_loss: 0.9209, test_f1: 0.5319
 epoch: 19, train_loss: 0.8228, test_loss: 0.9039, test_f1: 0.5433
 epoch: 20, train_loss: 0.7971, test_loss: 0.9120, test_f1: 0.5212
 epoch: 21, train_loss: 0.7922, test_loss: 0.9477, test_f1: 0.5360
 epoch: 22, train_loss: 0.8014, test_loss: 0.9140, test_f1: 0.5446
 epoch: 23, train_loss: 0.8079, test_loss: 0.9019, test_f1: 0.5686
 epoch: 24, train_loss: 0.7995, test_loss: 0.8681, test_f1: 0.6092
 epoch: 25, train_loss: 0.8036, test_loss: 1.2279, test_f1: 0.5221
 epoch: 26, train_loss: 0.8074, test_loss: 0.9339, test_f1: 0.5374
 epoch: 27, train_loss: 0.8017, test_loss: 1.0353, test_f1: 0.4834
 epoch: 28, train_loss: 0.7892, test_loss: 0.9301, test_f1: 0.4969
 epoch: 29, train_loss: 0.7739, test_loss: 0.8310, test_f1: 0.5847
 epoch: 30, train_loss: 0.7680, test_loss: 0.9384, test_f1: 0.5296
 epoch: 31, train_loss: 0.7953, test_loss: 0.9403, test_f1: 0.5441
 epoch: 32, train_loss: 0.7969, test_loss: 1.0643, test_f1: 0.5489
 epoch: 33, train_loss: 0.7810, test_loss: 1.0164, test_f1: 0.5114
 epoch: 34, train_loss: 0.7780, test_loss: 0.8650, test_f1: 0.6052
 epoch: 35, train_loss: 0.7508, test_loss: 0.8654, test_f1: 0.6117
 epoch: 36, train_loss: 0.7636, test_loss: 0.8671, test_f1: 0.5844
 epoch: 37, train_loss: 0.7895, test_loss: 0.8812, test_f1: 0.5927
 epoch: 38, train_loss: 0.7594, test_loss: 0.8612, test_f1: 0.5733
 epoch: 39, train_loss: 0.7620, test_loss: 1.0762, test_f1: 0.5263
 epoch: 40, train_loss: 0.7565, test_loss: 0.9313, test_f1: 0.5539
 epoch: 41, train_loss: 0.7567, test_loss: 0.8837, test_f1: 0.5925
 epoch: 42, train_loss: 0.7454, test_loss: 1.4363, test_f1: 0.4386
 epoch: 43, train_loss: 0.7441, test_loss: 0.8547, test_f1: 0.5409
 epoch: 44, train_loss: 0.7633, test_loss: 0.8842, test_f1: 0.5718
 epoch: 45, train_loss: 0.7918, test_loss: 0.9973, test_f1: 0.4781
 epoch: 46, train_loss: 0.7647, test_loss: 0.9330, test_f1: 0.6032
 epoch: 47, train_loss: 0.7451, test_loss: 0.8899, test_f1: 0.5478
 epoch: 48, train_loss: 0.7445, test_loss: 0.8594, test_f1: 0.5460
 epoch: 49, train_loss: 0.7961, test_loss: 0.8348, test_f1: 0.5378
 epoch: 50, train_loss: 0.7534, test_loss: 0.8506, test_f1: 0.5615
 epoch: 51, train_loss: 0.7124, test_loss: 0.8731, test_f1: 0.5436
 epoch: 52, train_loss: 0.7115, test_loss: 0.8506, test_f1: 0.6352
 epoch: 53, train_loss: 0.6968, test_loss: 0.8634, test_f1: 0.5570
 epoch: 54, train_loss: 0.6945, test_loss: 0.8515, test_f1: 0.5906
 epoch: 55, train_loss: 0.6844, test_loss: 0.8699, test_f1: 0.6123
 epoch: 56, train_loss: 0.6779, test_loss: 0.8859, test_f1: 0.6390
 epoch: 57, train_loss: 0.6920, test_loss: 0.8488, test_f1: 0.5867
 epoch: 58, train_loss: 0.6861, test_loss: 0.8897, test_f1: 0.6251
 epoch: 59, train_loss: 0.6659, test_loss: 0.8613, test_f1: 0.6264
 epoch: 60, train_loss: 0.6709, test_loss: 0.8294, test_f1: 0.6096
 epoch: 61, train_loss: 0.6606, test_loss: 0.9032, test_f1: 0.5975
 epoch: 62, train_loss: 0.6634, test_loss: 0.8612, test_f1: 0.6045
 epoch: 63, train_loss: 0.6644, test_loss: 1.0264, test_f1: 0.5484
 epoch: 64, train_loss: 0.6547, test_loss: 0.8924, test_f1: 0.5954
 epoch: 65, train_loss: 0.6391, test_loss: 0.9021, test_f1: 0.5860
 epoch: 66, train_loss: 0.6385, test_loss: 0.8783, test_f1: 0.5980
 epoch: 67, train_loss: 0.6457, test_loss: 0.8671, test_f1: 0.5995
 epoch: 68, train_loss: 0.6459, test_loss: 0.9809, test_f1: 0.5749
 epoch: 69, train_loss: 0.6689, test_loss: 0.9006, test_f1: 0.5916
 epoch: 70, train_loss: 0.6430, test_loss: 0.8460, test_f1: 0.6361
 epoch: 71, train_loss: 0.6382, test_loss: 0.9080, test_f1: 0.5970
 epoch: 72, train_loss: 0.6354, test_loss: 0.9039, test_f1: 0.6095
 epoch: 73, train_loss: 0.6313, test_loss: 0.8607, test_f1: 0.5994
 epoch: 74, train_loss: 0.6330, test_loss: 0.8112, test_f1: 0.6343
 epoch: 75, train_loss: 0.6181, test_loss: 0.8690, test_f1: 0.6244
 epoch: 76, train_loss: 0.6449, test_loss: 0.8294, test_f1: 0.6109
 epoch: 77, train_loss: 0.6197, test_loss: 0.8946, test_f1: 0.6335
 epoch: 78, train_loss: 0.6182, test_loss: 0.8756, test_f1: 0.6059
 epoch: 79, train_loss: 0.6170, test_loss: 0.8602, test_f1: 0.6024
 epoch: 80, train_loss: 0.6247, test_loss: 0.8308, test_f1: 0.6142
 epoch: 81, train_loss: 0.6236, test_loss: 0.8984, test_f1: 0.6212
 epoch: 82, train_loss: 0.6134, test_loss: 0.8419, test_f1: 0.6302
 epoch: 83, train_loss: 0.6112, test_loss: 0.8875, test_f1: 0.5963
 epoch: 84, train_loss: 0.6146, test_loss: 0.8068, test_f1: 0.6477
 epoch: 85, train_loss: 0.6064, test_loss: 0.8402, test_f1: 0.5902
 epoch: 86, train_loss: 0.6145, test_loss: 0.8930, test_f1: 0.6194
 epoch: 87, train_loss: 0.6193, test_loss: 0.8837, test_f1: 0.6383
 epoch: 88, train_loss: 0.6130, test_loss: 0.9025, test_f1: 0.6462
 epoch: 89, train_loss: 0.5990, test_loss: 0.8636, test_f1: 0.6254
 epoch: 90, train_loss: 0.5957, test_loss: 0.8549, test_f1: 0.6445
 epoch: 91, train_loss: 0.5911, test_loss: 0.8626, test_f1: 0.6205
 epoch: 92, train_loss: 0.6015, test_loss: 0.8141, test_f1: 0.6216
 epoch: 93, train_loss: 0.5916, test_loss: 0.8590, test_f1: 0.6181
 epoch: 94, train_loss: 0.5970, test_loss: 0.8407, test_f1: 0.6622
 epoch: 95, train_loss: 0.5753, test_loss: 0.9680, test_f1: 0.6034
 epoch: 96, train_loss: 0.5839, test_loss: 0.8488, test_f1: 0.6265
 epoch: 97, train_loss: 0.6013, test_loss: 0.9356, test_f1: 0.5913
 epoch: 98, train_loss: 0.5759, test_loss: 0.8596, test_f1: 0.6139
 epoch: 99, train_loss: 0.5622, test_loss: 0.8762, test_f1: 0.6197
##################ITERATION #8 ****************************************
 epoch: 0, train_loss: 1.1323, test_loss: 1.1298, test_f1: 0.3692
 epoch: 1, train_loss: 1.0509, test_loss: 1.1503, test_f1: 0.4119
 epoch: 2, train_loss: 1.0245, test_loss: 1.0846, test_f1: 0.4568
 epoch: 3, train_loss: 0.9882, test_loss: 1.0190, test_f1: 0.4747
 epoch: 4, train_loss: 0.9764, test_loss: 0.9947, test_f1: 0.4644
 epoch: 5, train_loss: 0.9700, test_loss: 0.9630, test_f1: 0.5072
 epoch: 6, train_loss: 0.9475, test_loss: 0.9964, test_f1: 0.5253
 epoch: 7, train_loss: 0.9300, test_loss: 0.9582, test_f1: 0.5267
 epoch: 8, train_loss: 0.9192, test_loss: 0.9074, test_f1: 0.5003
 epoch: 9, train_loss: 0.9161, test_loss: 1.0764, test_f1: 0.4793
 epoch: 10, train_loss: 0.8940, test_loss: 1.0311, test_f1: 0.5093
 epoch: 11, train_loss: 0.8999, test_loss: 1.0326, test_f1: 0.5043
 epoch: 12, train_loss: 0.8906, test_loss: 0.8988, test_f1: 0.5209
 epoch: 13, train_loss: 0.8621, test_loss: 0.9643, test_f1: 0.5085
 epoch: 14, train_loss: 0.8653, test_loss: 0.9392, test_f1: 0.5189
 epoch: 15, train_loss: 0.8506, test_loss: 0.9132, test_f1: 0.5278
 epoch: 16, train_loss: 0.8551, test_loss: 1.0056, test_f1: 0.5142
 epoch: 17, train_loss: 0.8410, test_loss: 0.9404, test_f1: 0.5159
 epoch: 18, train_loss: 0.8377, test_loss: 0.8881, test_f1: 0.5454
 epoch: 19, train_loss: 0.8298, test_loss: 0.9339, test_f1: 0.5169
 epoch: 20, train_loss: 0.8209, test_loss: 1.0042, test_f1: 0.5220
 epoch: 21, train_loss: 0.8244, test_loss: 0.9330, test_f1: 0.5983
 epoch: 22, train_loss: 0.8431, test_loss: 0.9891, test_f1: 0.4991
 epoch: 23, train_loss: 0.8389, test_loss: 0.8873, test_f1: 0.5341
 epoch: 24, train_loss: 0.8187, test_loss: 0.9347, test_f1: 0.5455
 epoch: 25, train_loss: 0.7965, test_loss: 0.9167, test_f1: 0.5349
 epoch: 26, train_loss: 0.8034, test_loss: 0.9645, test_f1: 0.5257
 epoch: 27, train_loss: 0.7965, test_loss: 0.8667, test_f1: 0.5731
 epoch: 28, train_loss: 0.7959, test_loss: 1.0426, test_f1: 0.5197
 epoch: 29, train_loss: 0.7679, test_loss: 0.8874, test_f1: 0.5599
 epoch: 30, train_loss: 0.7650, test_loss: 0.8916, test_f1: 0.4942
 epoch: 31, train_loss: 0.7792, test_loss: 1.0867, test_f1: 0.5799
 epoch: 32, train_loss: 0.7731, test_loss: 0.8069, test_f1: 0.5576
 epoch: 33, train_loss: 0.7775, test_loss: 0.9035, test_f1: 0.6100
 epoch: 34, train_loss: 0.7516, test_loss: 0.9792, test_f1: 0.5616
 epoch: 35, train_loss: 0.7840, test_loss: 0.8871, test_f1: 0.5446
 epoch: 36, train_loss: 0.7613, test_loss: 0.9545, test_f1: 0.5786
 epoch: 37, train_loss: 0.7568, test_loss: 0.8468, test_f1: 0.5282
 epoch: 38, train_loss: 0.7600, test_loss: 0.8507, test_f1: 0.5461
 epoch: 39, train_loss: 0.7373, test_loss: 0.7716, test_f1: 0.5734
 epoch: 40, train_loss: 0.7421, test_loss: 1.0237, test_f1: 0.5707
 epoch: 41, train_loss: 0.7299, test_loss: 0.8584, test_f1: 0.5576
 epoch: 42, train_loss: 0.7501, test_loss: 0.9342, test_f1: 0.5879
 epoch: 43, train_loss: 0.7199, test_loss: 0.8325, test_f1: 0.5477
 epoch: 44, train_loss: 0.7194, test_loss: 0.8347, test_f1: 0.5465
 epoch: 45, train_loss: 0.7407, test_loss: 0.8154, test_f1: 0.5620
 epoch: 46, train_loss: 0.7257, test_loss: 0.8749, test_f1: 0.5245
 epoch: 47, train_loss: 0.7264, test_loss: 0.8003, test_f1: 0.6008
 epoch: 48, train_loss: 0.7241, test_loss: 0.8730, test_f1: 0.5632
 epoch: 49, train_loss: 0.7143, test_loss: 0.8758, test_f1: 0.5423
 epoch: 50, train_loss: 0.7274, test_loss: 0.7916, test_f1: 0.5526
 epoch: 51, train_loss: 0.7018, test_loss: 0.8753, test_f1: 0.6095
 epoch: 52, train_loss: 0.6844, test_loss: 0.8398, test_f1: 0.5814
 epoch: 53, train_loss: 0.6821, test_loss: 0.8500, test_f1: 0.6035
 epoch: 54, train_loss: 0.6867, test_loss: 0.8756, test_f1: 0.6483
 epoch: 55, train_loss: 0.6654, test_loss: 0.8456, test_f1: 0.6404
 epoch: 56, train_loss: 0.6613, test_loss: 0.9407, test_f1: 0.6281
 epoch: 57, train_loss: 0.6664, test_loss: 0.8339, test_f1: 0.6241
 epoch: 58, train_loss: 0.6599, test_loss: 0.8842, test_f1: 0.6387
 epoch: 59, train_loss: 0.6409, test_loss: 0.8742, test_f1: 0.6410
 epoch: 60, train_loss: 0.6444, test_loss: 0.8826, test_f1: 0.6473
 epoch: 61, train_loss: 0.6596, test_loss: 0.8504, test_f1: 0.6417
 epoch: 62, train_loss: 0.6519, test_loss: 0.9049, test_f1: 0.5968
 epoch: 63, train_loss: 0.6479, test_loss: 0.8488, test_f1: 0.6143
 epoch: 64, train_loss: 0.6432, test_loss: 0.9233, test_f1: 0.6508
 epoch: 65, train_loss: 0.6526, test_loss: 0.8839, test_f1: 0.6391
 epoch: 66, train_loss: 0.6374, test_loss: 0.8381, test_f1: 0.6431
 epoch: 67, train_loss: 0.6240, test_loss: 0.9107, test_f1: 0.6382
 epoch: 68, train_loss: 0.6316, test_loss: 0.8745, test_f1: 0.6468
 epoch: 69, train_loss: 0.6349, test_loss: 0.8915, test_f1: 0.6449
 epoch: 70, train_loss: 0.6225, test_loss: 0.8865, test_f1: 0.5882
 epoch: 71, train_loss: 0.6410, test_loss: 0.8489, test_f1: 0.6443
 epoch: 72, train_loss: 0.6209, test_loss: 0.8787, test_f1: 0.6498
 epoch: 73, train_loss: 0.6069, test_loss: 0.9838, test_f1: 0.6445
 epoch: 74, train_loss: 0.6038, test_loss: 0.8486, test_f1: 0.6213
 epoch: 75, train_loss: 0.6185, test_loss: 0.8796, test_f1: 0.6486
 epoch: 76, train_loss: 0.6213, test_loss: 0.8576, test_f1: 0.6169
 epoch: 77, train_loss: 0.6049, test_loss: 0.8495, test_f1: 0.6552
 epoch: 78, train_loss: 0.5993, test_loss: 0.8475, test_f1: 0.5829
 epoch: 79, train_loss: 0.6371, test_loss: 0.8869, test_f1: 0.6642
 epoch: 80, train_loss: 0.6061, test_loss: 0.8303, test_f1: 0.6130
 epoch: 81, train_loss: 0.6030, test_loss: 0.8316, test_f1: 0.6799
 epoch: 82, train_loss: 0.6070, test_loss: 0.9304, test_f1: 0.6413
 epoch: 83, train_loss: 0.5928, test_loss: 0.8663, test_f1: 0.6346
 epoch: 84, train_loss: 0.5991, test_loss: 0.9324, test_f1: 0.6311
 epoch: 85, train_loss: 0.5993, test_loss: 0.9180, test_f1: 0.6360
 epoch: 86, train_loss: 0.5876, test_loss: 0.9035, test_f1: 0.6465
 epoch: 87, train_loss: 0.5859, test_loss: 0.9323, test_f1: 0.6495
 epoch: 88, train_loss: 0.5864, test_loss: 0.9262, test_f1: 0.6679
 epoch: 89, train_loss: 0.5853, test_loss: 0.8272, test_f1: 0.6687
 epoch: 90, train_loss: 0.5843, test_loss: 0.9874, test_f1: 0.6269
 epoch: 91, train_loss: 0.5899, test_loss: 0.9378, test_f1: 0.6193
 epoch: 92, train_loss: 0.5723, test_loss: 0.9918, test_f1: 0.6275
 epoch: 93, train_loss: 0.5838, test_loss: 0.9379, test_f1: 0.6628
 epoch: 94, train_loss: 0.5759, test_loss: 0.8617, test_f1: 0.6354
 epoch: 95, train_loss: 0.5783, test_loss: 1.0312, test_f1: 0.6058
 epoch: 96, train_loss: 0.5740, test_loss: 0.9622, test_f1: 0.6685
 epoch: 97, train_loss: 0.5694, test_loss: 0.9153, test_f1: 0.6703
 epoch: 98, train_loss: 0.5660, test_loss: 0.9714, test_f1: 0.6456
 epoch: 99, train_loss: 0.5697, test_loss: 0.9554, test_f1: 0.6388
##################ITERATION #9 ****************************************
 epoch: 0, train_loss: 1.1427, test_loss: 1.1114, test_f1: 0.3729
 epoch: 1, train_loss: 1.0349, test_loss: 1.1368, test_f1: 0.3817
 epoch: 2, train_loss: 0.9946, test_loss: 1.0204, test_f1: 0.4335
 epoch: 3, train_loss: 0.9789, test_loss: 1.1069, test_f1: 0.3997
 epoch: 4, train_loss: 0.9717, test_loss: 1.0885, test_f1: 0.4753
 epoch: 5, train_loss: 0.9619, test_loss: 1.0610, test_f1: 0.4611
 epoch: 6, train_loss: 0.9437, test_loss: 1.0877, test_f1: 0.4250
 epoch: 7, train_loss: 0.9297, test_loss: 1.1121, test_f1: 0.4781
 epoch: 8, train_loss: 0.9266, test_loss: 1.0153, test_f1: 0.4588
 epoch: 9, train_loss: 0.8962, test_loss: 1.0406, test_f1: 0.4605
 epoch: 10, train_loss: 0.9153, test_loss: 0.9906, test_f1: 0.5012
 epoch: 11, train_loss: 0.9018, test_loss: 1.1852, test_f1: 0.4747
 epoch: 12, train_loss: 0.8791, test_loss: 1.0290, test_f1: 0.4804
 epoch: 13, train_loss: 0.8730, test_loss: 0.9236, test_f1: 0.5444
 epoch: 14, train_loss: 0.8663, test_loss: 0.9243, test_f1: 0.5578
 epoch: 15, train_loss: 0.8497, test_loss: 1.0818, test_f1: 0.4590
 epoch: 16, train_loss: 0.8411, test_loss: 0.8899, test_f1: 0.5414
 epoch: 17, train_loss: 0.8285, test_loss: 0.9225, test_f1: 0.5096
 epoch: 18, train_loss: 0.8713, test_loss: 1.0485, test_f1: 0.4886
 epoch: 19, train_loss: 0.8235, test_loss: 0.9779, test_f1: 0.5382
 epoch: 20, train_loss: 0.8314, test_loss: 0.9559, test_f1: 0.5171
 epoch: 21, train_loss: 0.8205, test_loss: 0.8995, test_f1: 0.5522
 epoch: 22, train_loss: 0.8114, test_loss: 0.9031, test_f1: 0.5261
 epoch: 23, train_loss: 0.7981, test_loss: 0.9746, test_f1: 0.5028
 epoch: 24, train_loss: 0.7905, test_loss: 0.9225, test_f1: 0.5469
 epoch: 25, train_loss: 0.7837, test_loss: 0.9529, test_f1: 0.4934
 epoch: 26, train_loss: 0.7969, test_loss: 1.0874, test_f1: 0.5091
 epoch: 27, train_loss: 0.7746, test_loss: 0.9401, test_f1: 0.5539
 epoch: 28, train_loss: 0.7621, test_loss: 0.8982, test_f1: 0.5403
 epoch: 29, train_loss: 0.7682, test_loss: 0.9678, test_f1: 0.5580
 epoch: 30, train_loss: 0.7644, test_loss: 1.0555, test_f1: 0.5655
 epoch: 31, train_loss: 0.7954, test_loss: 0.9525, test_f1: 0.4772
 epoch: 32, train_loss: 0.7651, test_loss: 0.8706, test_f1: 0.5916
 epoch: 33, train_loss: 0.7515, test_loss: 0.8499, test_f1: 0.5632
 epoch: 34, train_loss: 0.7422, test_loss: 0.8487, test_f1: 0.5982
 epoch: 35, train_loss: 0.7340, test_loss: 0.9344, test_f1: 0.5321
 epoch: 36, train_loss: 0.7461, test_loss: 0.8614, test_f1: 0.5916
 epoch: 37, train_loss: 0.7332, test_loss: 0.8542, test_f1: 0.5885
 epoch: 38, train_loss: 0.7410, test_loss: 0.9483, test_f1: 0.5356
 epoch: 39, train_loss: 0.7311, test_loss: 0.8826, test_f1: 0.5693
 epoch: 40, train_loss: 0.7196, test_loss: 0.8630, test_f1: 0.6313
 epoch: 41, train_loss: 0.7219, test_loss: 0.8585, test_f1: 0.6058
 epoch: 42, train_loss: 0.7131, test_loss: 0.8235, test_f1: 0.5810
 epoch: 43, train_loss: 0.7101, test_loss: 0.9117, test_f1: 0.5751
 epoch: 44, train_loss: 0.7101, test_loss: 0.8933, test_f1: 0.5700
 epoch: 45, train_loss: 0.7123, test_loss: 0.9582, test_f1: 0.5384
 epoch: 46, train_loss: 0.7030, test_loss: 0.8474, test_f1: 0.6029
 epoch: 47, train_loss: 0.6986, test_loss: 0.8102, test_f1: 0.6283
 epoch: 48, train_loss: 0.6873, test_loss: 0.9509, test_f1: 0.5441
 epoch: 49, train_loss: 0.6875, test_loss: 0.8631, test_f1: 0.5494
 epoch: 50, train_loss: 0.7051, test_loss: 0.9579, test_f1: 0.5330
 epoch: 51, train_loss: 0.6577, test_loss: 0.8353, test_f1: 0.5817
 epoch: 52, train_loss: 0.6565, test_loss: 0.7989, test_f1: 0.5866
 epoch: 53, train_loss: 0.6636, test_loss: 0.8096, test_f1: 0.5796
 epoch: 54, train_loss: 0.6405, test_loss: 0.8041, test_f1: 0.6094
 epoch: 55, train_loss: 0.6428, test_loss: 0.7836, test_f1: 0.6019
 epoch: 56, train_loss: 0.6384, test_loss: 0.7803, test_f1: 0.6009
 epoch: 57, train_loss: 0.6537, test_loss: 0.7772, test_f1: 0.6443
 epoch: 58, train_loss: 0.6184, test_loss: 0.7972, test_f1: 0.6383
 epoch: 59, train_loss: 0.6019, test_loss: 0.8425, test_f1: 0.6234
 epoch: 60, train_loss: 0.6458, test_loss: 0.8362, test_f1: 0.6169
 epoch: 61, train_loss: 0.6159, test_loss: 0.8385, test_f1: 0.6141
 epoch: 62, train_loss: 0.6252, test_loss: 0.8009, test_f1: 0.6397
 epoch: 63, train_loss: 0.6229, test_loss: 0.7842, test_f1: 0.6614
 epoch: 64, train_loss: 0.6235, test_loss: 0.8123, test_f1: 0.5894
 epoch: 65, train_loss: 0.6135, test_loss: 0.8379, test_f1: 0.6148
 epoch: 66, train_loss: 0.6058, test_loss: 0.7996, test_f1: 0.6429
 epoch: 67, train_loss: 0.6086, test_loss: 0.8645, test_f1: 0.6407
 epoch: 68, train_loss: 0.5973, test_loss: 0.7975, test_f1: 0.6404
 epoch: 69, train_loss: 0.6250, test_loss: 0.8208, test_f1: 0.6425
 epoch: 70, train_loss: 0.6028, test_loss: 0.8353, test_f1: 0.6228
 epoch: 71, train_loss: 0.6073, test_loss: 0.8165, test_f1: 0.6068
 epoch: 72, train_loss: 0.5967, test_loss: 0.8393, test_f1: 0.6572
 epoch: 73, train_loss: 0.5910, test_loss: 0.8273, test_f1: 0.6735
 epoch: 74, train_loss: 0.5874, test_loss: 0.8077, test_f1: 0.6457
 epoch: 75, train_loss: 0.5976, test_loss: 0.7613, test_f1: 0.6405
 epoch: 76, train_loss: 0.5746, test_loss: 0.8048, test_f1: 0.6587
 epoch: 77, train_loss: 0.5782, test_loss: 0.7806, test_f1: 0.6550
 epoch: 78, train_loss: 0.5888, test_loss: 0.7804, test_f1: 0.6524
 epoch: 79, train_loss: 0.5978, test_loss: 0.8116, test_f1: 0.6528
 epoch: 80, train_loss: 0.5800, test_loss: 0.8173, test_f1: 0.6726
 epoch: 81, train_loss: 0.5892, test_loss: 0.8755, test_f1: 0.6155
 epoch: 82, train_loss: 0.5858, test_loss: 0.7932, test_f1: 0.6653
 epoch: 83, train_loss: 0.5559, test_loss: 0.8195, test_f1: 0.6543
 epoch: 84, train_loss: 0.5827, test_loss: 0.8373, test_f1: 0.6553
 epoch: 85, train_loss: 0.5574, test_loss: 0.8693, test_f1: 0.6314
 epoch: 86, train_loss: 0.5779, test_loss: 0.8104, test_f1: 0.6816
 epoch: 87, train_loss: 0.5775, test_loss: 0.7884, test_f1: 0.6433
 epoch: 88, train_loss: 0.5683, test_loss: 0.8245, test_f1: 0.6701
 epoch: 89, train_loss: 0.5695, test_loss: 0.7169, test_f1: 0.6701
 epoch: 90, train_loss: 0.5435, test_loss: 0.8242, test_f1: 0.6383
 epoch: 91, train_loss: 0.5749, test_loss: 0.8282, test_f1: 0.6359
 epoch: 92, train_loss: 0.5685, test_loss: 0.9058, test_f1: 0.6388
 epoch: 93, train_loss: 0.5667, test_loss: 0.8425, test_f1: 0.6646
 epoch: 94, train_loss: 0.5657, test_loss: 0.8793, test_f1: 0.6450
 epoch: 95, train_loss: 0.5667, test_loss: 0.8327, test_f1: 0.6435
 epoch: 96, train_loss: 0.5584, test_loss: 0.8133, test_f1: 0.6722
 epoch: 97, train_loss: 0.5512, test_loss: 0.8152, test_f1: 0.6652
 epoch: 98, train_loss: 0.5456, test_loss: 0.8693, test_f1: 0.6452
 epoch: 99, train_loss: 0.5551, test_loss: 0.7884, test_f1: 0.6630

Training completed in 844.25 seconds
Best F1: 0.7043 at epoch 94
Mean F1 across iterations: 0.6685  0.0187
========================FINAL RESULTS================================
FEGIN weighted F1: 0.7043  0.0187
python main.py --data ltspice_examples --representation component_pin --model FEGIN --layers 6 --hiddens 32 --batch_size 64 --lr 0.01 --emb_size 250 --epochs 100 --save_appendix component_pin_L6_H32_BS64_LR0.01_E250 --no_val
-----



STDERR:
  File "main.py", line 370, in <module>
    main()
  File "main.py", line 254, in main
    dataset = dataset_class(
  File "/home/philip/projects/ltspice_examples_code_repo/Circuit-Completion-Using-GNNs/component_classification_with_link_prediction_head/evaluation/FEGIN/kernel/circuit_datasets.py", line 15, in __init__
    self.data, self.slices = torch.load(self.processed_paths[0])
  File "/home/philip/.local/lib/python3.8/site-packages/torch/serialization.py", line 1040, in load
    warnings.warn(
  File "/usr/lib/python3.8/warnings.py", line 109, in _showwarnmsg
    sw(msg.message, msg.category, msg.filename, msg.lineno,
  File "main.py", line 47, in warn_with_traceback
    traceback.print_stack(file=log)
/home/philip/projects/ltspice_examples_code_repo/Circuit-Completion-Using-GNNs/component_classification_with_link_prediction_head/evaluation/FEGIN/kernel/circuit_datasets.py:15: FutureWarning: You are using `torch.load` with `weights_only=False` (the current default value), which uses the default pickle module implicitly. It is possible to construct malicious pickle data which will execute arbitrary code during unpickling (See https://github.com/pytorch/pytorch/blob/main/SECURITY.md#untrusted-models for more details). In a future release, the default value for `weights_only` will be flipped to `True`. This limits the functions that could be executed during unpickling. Arbitrary objects will no longer be allowed to be loaded via this mode unless they are explicitly allowlisted by the user via `torch.serialization.add_safe_globals`. We recommend you start setting `weights_only=True` for any use case where you don't have full control of the loaded file. Please open an issue on GitHub for any issues related to this experimental feature.
  self.data, self.slices = torch.load(self.processed_paths[0])
