STDOUT:
Results will be saved in /home/philip/projects/ltspice_examples_code_repo/Circuit-Completion-Using-GNNs/component_classification_with_link_prediction_head/evaluation/FEGIN/results/model_FEGIN_dataset_ltspice_examples
Command line input: python main.py --data ltspice_examples --representation component_net --model FEGIN --layers 5 --hiddens 32 --batch_size 64 --lr 0.01 --emb_size 512 --epochs 100 --save_appendix component_net_L5_H32_BS64_LR0.01_E512 --no_val
 is saved.
-----
ltspice_examples - FEGIN
Using 5 layers, 32 hidden units, h = 2
Loading component_net representation dataset
ENTERED
Training FEGIN on component_net representation
Train: 3558, Test: 846
##################ITERATION #0 ****************************************
 epoch: 0, train_loss: 1.2281, test_loss: 1.0942, test_f1: 0.4564
 epoch: 1, train_loss: 1.0768, test_loss: 1.1189, test_f1: 0.5050
 epoch: 2, train_loss: 1.0277, test_loss: 0.9941, test_f1: 0.4706
 epoch: 3, train_loss: 1.0091, test_loss: 1.0247, test_f1: 0.4554
 epoch: 4, train_loss: 1.0079, test_loss: 1.0154, test_f1: 0.5094
 epoch: 5, train_loss: 0.9937, test_loss: 0.9795, test_f1: 0.4694
 epoch: 6, train_loss: 0.9819, test_loss: 1.0556, test_f1: 0.4591
 epoch: 7, train_loss: 0.9793, test_loss: 0.9424, test_f1: 0.4848
 epoch: 8, train_loss: 0.9647, test_loss: 0.9926, test_f1: 0.4807
 epoch: 9, train_loss: 0.9486, test_loss: 0.9588, test_f1: 0.4789
 epoch: 10, train_loss: 0.9488, test_loss: 1.0188, test_f1: 0.4991
 epoch: 11, train_loss: 0.9391, test_loss: 0.9674, test_f1: 0.5116
 epoch: 12, train_loss: 0.9325, test_loss: 0.8952, test_f1: 0.5225
 epoch: 13, train_loss: 0.9340, test_loss: 0.9410, test_f1: 0.4874
 epoch: 14, train_loss: 0.9298, test_loss: 0.9323, test_f1: 0.5267
 epoch: 15, train_loss: 0.9185, test_loss: 1.0538, test_f1: 0.5015
 epoch: 16, train_loss: 0.9108, test_loss: 1.0177, test_f1: 0.5244
 epoch: 17, train_loss: 0.8962, test_loss: 0.9632, test_f1: 0.5319
 epoch: 18, train_loss: 0.9004, test_loss: 1.0101, test_f1: 0.5116
 epoch: 19, train_loss: 0.9011, test_loss: 1.0067, test_f1: 0.5146
 epoch: 20, train_loss: 0.8960, test_loss: 1.0387, test_f1: 0.5055
 epoch: 21, train_loss: 0.9023, test_loss: 1.0258, test_f1: 0.4930
 epoch: 22, train_loss: 0.9015, test_loss: 0.9816, test_f1: 0.5545
 epoch: 23, train_loss: 0.8716, test_loss: 1.0623, test_f1: 0.5037
 epoch: 24, train_loss: 0.8719, test_loss: 1.0215, test_f1: 0.5024
 epoch: 25, train_loss: 0.8864, test_loss: 1.0669, test_f1: 0.5243
 epoch: 26, train_loss: 0.8881, test_loss: 1.1283, test_f1: 0.4882
 epoch: 27, train_loss: 0.8594, test_loss: 1.0512, test_f1: 0.5304
 epoch: 28, train_loss: 0.8800, test_loss: 0.9887, test_f1: 0.4784
 epoch: 29, train_loss: 0.8625, test_loss: 1.0945, test_f1: 0.5085
 epoch: 30, train_loss: 0.8528, test_loss: 1.1163, test_f1: 0.4853
 epoch: 31, train_loss: 0.8676, test_loss: 1.0450, test_f1: 0.5291
 epoch: 32, train_loss: 0.8535, test_loss: 1.1384, test_f1: 0.5361
 epoch: 33, train_loss: 0.8502, test_loss: 1.0910, test_f1: 0.5400
 epoch: 34, train_loss: 0.8464, test_loss: 1.1289, test_f1: 0.5153
 epoch: 35, train_loss: 0.8419, test_loss: 1.1834, test_f1: 0.4963
 epoch: 36, train_loss: 0.8313, test_loss: 1.1529, test_f1: 0.5220
 epoch: 37, train_loss: 0.8275, test_loss: 1.1558, test_f1: 0.5168
 epoch: 38, train_loss: 0.8266, test_loss: 1.1573, test_f1: 0.5410
 epoch: 39, train_loss: 0.8280, test_loss: 1.2986, test_f1: 0.5311
 epoch: 40, train_loss: 0.8206, test_loss: 1.2389, test_f1: 0.5033
 epoch: 41, train_loss: 0.8291, test_loss: 1.1636, test_f1: 0.5430
 epoch: 42, train_loss: 0.8114, test_loss: 1.1394, test_f1: 0.5543
 epoch: 43, train_loss: 0.8182, test_loss: 1.0951, test_f1: 0.5449
 epoch: 44, train_loss: 0.8089, test_loss: 1.1203, test_f1: 0.5362
 epoch: 45, train_loss: 0.7979, test_loss: 1.2418, test_f1: 0.5405
 epoch: 46, train_loss: 0.8128, test_loss: 1.0985, test_f1: 0.5273
 epoch: 47, train_loss: 0.8037, test_loss: 1.1790, test_f1: 0.5495
 epoch: 48, train_loss: 0.7944, test_loss: 1.2758, test_f1: 0.5338
 epoch: 49, train_loss: 0.8065, test_loss: 1.1480, test_f1: 0.5683
 epoch: 50, train_loss: 0.7915, test_loss: 1.1766, test_f1: 0.5588
 epoch: 51, train_loss: 0.7735, test_loss: 1.2463, test_f1: 0.5687
 epoch: 52, train_loss: 0.7632, test_loss: 1.2020, test_f1: 0.5830
 epoch: 53, train_loss: 0.7566, test_loss: 1.1995, test_f1: 0.5686
 epoch: 54, train_loss: 0.7463, test_loss: 1.2399, test_f1: 0.5593
 epoch: 55, train_loss: 0.7413, test_loss: 1.2321, test_f1: 0.5850
 epoch: 56, train_loss: 0.7346, test_loss: 1.2460, test_f1: 0.5886
 epoch: 57, train_loss: 0.7234, test_loss: 1.2300, test_f1: 0.5669
 epoch: 58, train_loss: 0.7432, test_loss: 1.2762, test_f1: 0.5807
 epoch: 59, train_loss: 0.7231, test_loss: 1.3277, test_f1: 0.5988
 epoch: 60, train_loss: 0.7305, test_loss: 1.1867, test_f1: 0.5820
 epoch: 61, train_loss: 0.7268, test_loss: 1.3054, test_f1: 0.5718
 epoch: 62, train_loss: 0.7107, test_loss: 1.3138, test_f1: 0.6375
 epoch: 63, train_loss: 0.7165, test_loss: 1.4215, test_f1: 0.5948
 epoch: 64, train_loss: 0.7196, test_loss: 1.4022, test_f1: 0.6155
 epoch: 65, train_loss: 0.7113, test_loss: 1.3863, test_f1: 0.6183
 epoch: 66, train_loss: 0.7097, test_loss: 1.3623, test_f1: 0.6230
 epoch: 67, train_loss: 0.7115, test_loss: 1.3961, test_f1: 0.6426
 epoch: 68, train_loss: 0.7116, test_loss: 1.3434, test_f1: 0.6356
 epoch: 69, train_loss: 0.7002, test_loss: 1.3115, test_f1: 0.6192
 epoch: 70, train_loss: 0.7017, test_loss: 1.3394, test_f1: 0.6323
 epoch: 71, train_loss: 0.7116, test_loss: 1.3470, test_f1: 0.6329
 epoch: 72, train_loss: 0.7050, test_loss: 1.3516, test_f1: 0.6278
 epoch: 73, train_loss: 0.6887, test_loss: 1.3453, test_f1: 0.6241
 epoch: 74, train_loss: 0.7080, test_loss: 1.3049, test_f1: 0.5872
 epoch: 75, train_loss: 0.7008, test_loss: 1.2290, test_f1: 0.6035
 epoch: 76, train_loss: 0.7174, test_loss: 1.2791, test_f1: 0.6030
 epoch: 77, train_loss: 0.6870, test_loss: 1.2754, test_f1: 0.5905
 epoch: 78, train_loss: 0.6778, test_loss: 1.3709, test_f1: 0.6022
 epoch: 79, train_loss: 0.6923, test_loss: 1.3913, test_f1: 0.6147
 epoch: 80, train_loss: 0.6762, test_loss: 1.3366, test_f1: 0.6193
 epoch: 81, train_loss: 0.6816, test_loss: 1.2687, test_f1: 0.5925
 epoch: 82, train_loss: 0.6771, test_loss: 1.1998, test_f1: 0.6016
 epoch: 83, train_loss: 0.6841, test_loss: 1.2939, test_f1: 0.6180
 epoch: 84, train_loss: 0.6771, test_loss: 1.3327, test_f1: 0.6126
 epoch: 85, train_loss: 0.6669, test_loss: 1.2455, test_f1: 0.6305
 epoch: 86, train_loss: 0.6683, test_loss: 1.3003, test_f1: 0.6100
 epoch: 87, train_loss: 0.6782, test_loss: 1.3193, test_f1: 0.5910
 epoch: 88, train_loss: 0.6691, test_loss: 1.4014, test_f1: 0.6425
 epoch: 89, train_loss: 0.6701, test_loss: 1.2399, test_f1: 0.6238
 epoch: 90, train_loss: 0.6589, test_loss: 1.4047, test_f1: 0.6202
 epoch: 91, train_loss: 0.6540, test_loss: 1.3085, test_f1: 0.6151
 epoch: 92, train_loss: 0.6777, test_loss: 1.3102, test_f1: 0.6135
 epoch: 93, train_loss: 0.6542, test_loss: 1.2910, test_f1: 0.6361
 epoch: 94, train_loss: 0.6623, test_loss: 1.3706, test_f1: 0.6165
 epoch: 95, train_loss: 0.6467, test_loss: 1.2750, test_f1: 0.6243
 epoch: 96, train_loss: 0.6412, test_loss: 1.2714, test_f1: 0.6269
 epoch: 97, train_loss: 0.6473, test_loss: 1.3579, test_f1: 0.6507
 epoch: 98, train_loss: 0.6342, test_loss: 1.2897, test_f1: 0.6365
 epoch: 99, train_loss: 0.6373, test_loss: 1.3294, test_f1: 0.6107
##################ITERATION #1 ****************************************
 epoch: 0, train_loss: 1.1598, test_loss: 1.0461, test_f1: 0.4332
 epoch: 1, train_loss: 1.0211, test_loss: 1.0417, test_f1: 0.4540
 epoch: 2, train_loss: 0.9814, test_loss: 1.0549, test_f1: 0.4751
 epoch: 3, train_loss: 0.9823, test_loss: 1.0136, test_f1: 0.4489
 epoch: 4, train_loss: 0.9535, test_loss: 1.0239, test_f1: 0.5172
 epoch: 5, train_loss: 0.9500, test_loss: 0.9832, test_f1: 0.4702
 epoch: 6, train_loss: 0.9508, test_loss: 1.0126, test_f1: 0.4686
 epoch: 7, train_loss: 0.9297, test_loss: 1.0042, test_f1: 0.5092
 epoch: 8, train_loss: 0.9273, test_loss: 0.9319, test_f1: 0.4757
 epoch: 9, train_loss: 0.9204, test_loss: 0.9747, test_f1: 0.5364
 epoch: 10, train_loss: 0.8962, test_loss: 0.9650, test_f1: 0.4981
 epoch: 11, train_loss: 0.9041, test_loss: 1.0072, test_f1: 0.4944
 epoch: 12, train_loss: 0.8957, test_loss: 1.0179, test_f1: 0.4966
 epoch: 13, train_loss: 0.8848, test_loss: 0.9734, test_f1: 0.4968
 epoch: 14, train_loss: 0.8822, test_loss: 0.9580, test_f1: 0.5012
 epoch: 15, train_loss: 0.8739, test_loss: 1.0581, test_f1: 0.4823
 epoch: 16, train_loss: 0.8646, test_loss: 0.9989, test_f1: 0.5046
 epoch: 17, train_loss: 0.8591, test_loss: 1.0446, test_f1: 0.5050
 epoch: 18, train_loss: 0.8413, test_loss: 0.9465, test_f1: 0.5493
 epoch: 19, train_loss: 0.8534, test_loss: 1.0468, test_f1: 0.4992
 epoch: 20, train_loss: 0.8501, test_loss: 0.9905, test_f1: 0.5329
 epoch: 21, train_loss: 0.8279, test_loss: 1.0428, test_f1: 0.5246
 epoch: 22, train_loss: 0.8424, test_loss: 1.0005, test_f1: 0.5641
 epoch: 23, train_loss: 0.8352, test_loss: 0.9379, test_f1: 0.5611
 epoch: 24, train_loss: 0.8199, test_loss: 1.0143, test_f1: 0.5602
 epoch: 25, train_loss: 0.8151, test_loss: 0.9328, test_f1: 0.5472
 epoch: 26, train_loss: 0.8048, test_loss: 0.9408, test_f1: 0.5343
 epoch: 27, train_loss: 0.8240, test_loss: 0.8479, test_f1: 0.5610
 epoch: 28, train_loss: 0.8500, test_loss: 0.9421, test_f1: 0.5504
 epoch: 29, train_loss: 0.8009, test_loss: 0.9286, test_f1: 0.5555
 epoch: 30, train_loss: 0.8024, test_loss: 0.9270, test_f1: 0.5442
 epoch: 31, train_loss: 0.7939, test_loss: 0.8592, test_f1: 0.5663
 epoch: 32, train_loss: 0.7995, test_loss: 0.9753, test_f1: 0.5519
 epoch: 33, train_loss: 0.8026, test_loss: 0.9813, test_f1: 0.5504
 epoch: 34, train_loss: 0.8059, test_loss: 0.9215, test_f1: 0.5637
 epoch: 35, train_loss: 0.7864, test_loss: 0.9002, test_f1: 0.5835
 epoch: 36, train_loss: 0.7866, test_loss: 0.9790, test_f1: 0.5878
 epoch: 37, train_loss: 0.7872, test_loss: 0.9779, test_f1: 0.5380
 epoch: 38, train_loss: 0.7808, test_loss: 1.1317, test_f1: 0.5546
 epoch: 39, train_loss: 0.7656, test_loss: 0.9402, test_f1: 0.5932
 epoch: 40, train_loss: 0.7788, test_loss: 0.9768, test_f1: 0.5425
 epoch: 41, train_loss: 0.7605, test_loss: 1.1009, test_f1: 0.5973
 epoch: 42, train_loss: 0.7505, test_loss: 1.0438, test_f1: 0.5835
 epoch: 43, train_loss: 0.7648, test_loss: 0.9329, test_f1: 0.5499
 epoch: 44, train_loss: 0.7553, test_loss: 1.0539, test_f1: 0.5860
 epoch: 45, train_loss: 0.7806, test_loss: 0.9733, test_f1: 0.6028
 epoch: 46, train_loss: 0.7448, test_loss: 0.9416, test_f1: 0.5588
 epoch: 47, train_loss: 0.7468, test_loss: 0.9834, test_f1: 0.5783
 epoch: 48, train_loss: 0.7386, test_loss: 0.8739, test_f1: 0.6186
 epoch: 49, train_loss: 0.7418, test_loss: 0.9188, test_f1: 0.5934
 epoch: 50, train_loss: 0.7428, test_loss: 0.9443, test_f1: 0.6140
 epoch: 51, train_loss: 0.7241, test_loss: 0.8838, test_f1: 0.6331
 epoch: 52, train_loss: 0.7062, test_loss: 0.9002, test_f1: 0.6306
 epoch: 53, train_loss: 0.6886, test_loss: 0.9524, test_f1: 0.6383
 epoch: 54, train_loss: 0.6882, test_loss: 0.9643, test_f1: 0.6247
 epoch: 55, train_loss: 0.6967, test_loss: 0.9450, test_f1: 0.6256
 epoch: 56, train_loss: 0.6861, test_loss: 0.9402, test_f1: 0.6251
 epoch: 57, train_loss: 0.7041, test_loss: 0.9872, test_f1: 0.6247
 epoch: 58, train_loss: 0.6771, test_loss: 0.9120, test_f1: 0.6308
 epoch: 59, train_loss: 0.6794, test_loss: 0.9342, test_f1: 0.6295
 epoch: 60, train_loss: 0.6621, test_loss: 0.9599, test_f1: 0.6402
 epoch: 61, train_loss: 0.6808, test_loss: 0.9741, test_f1: 0.6238
 epoch: 62, train_loss: 0.6695, test_loss: 0.9365, test_f1: 0.6386
 epoch: 63, train_loss: 0.6603, test_loss: 0.9718, test_f1: 0.6382
 epoch: 64, train_loss: 0.6552, test_loss: 1.0221, test_f1: 0.6497
 epoch: 65, train_loss: 0.6688, test_loss: 0.9676, test_f1: 0.6249
 epoch: 66, train_loss: 0.6688, test_loss: 0.9420, test_f1: 0.6110
 epoch: 67, train_loss: 0.6782, test_loss: 0.9859, test_f1: 0.6379
 epoch: 68, train_loss: 0.6641, test_loss: 0.9660, test_f1: 0.6277
 epoch: 69, train_loss: 0.6504, test_loss: 0.9954, test_f1: 0.6518
 epoch: 70, train_loss: 0.6624, test_loss: 1.0453, test_f1: 0.6376
 epoch: 71, train_loss: 0.6606, test_loss: 1.0184, test_f1: 0.6426
 epoch: 72, train_loss: 0.6657, test_loss: 1.0009, test_f1: 0.6545
 epoch: 73, train_loss: 0.6407, test_loss: 0.9699, test_f1: 0.6116
 epoch: 74, train_loss: 0.6498, test_loss: 1.0269, test_f1: 0.6274
 epoch: 75, train_loss: 0.6515, test_loss: 1.0048, test_f1: 0.6331
 epoch: 76, train_loss: 0.6401, test_loss: 1.0146, test_f1: 0.6153
 epoch: 77, train_loss: 0.6484, test_loss: 0.9906, test_f1: 0.6317
 epoch: 78, train_loss: 0.6340, test_loss: 1.0557, test_f1: 0.6342
 epoch: 79, train_loss: 0.6379, test_loss: 1.0092, test_f1: 0.6466
 epoch: 80, train_loss: 0.6493, test_loss: 1.0601, test_f1: 0.6315
 epoch: 81, train_loss: 0.6415, test_loss: 1.0029, test_f1: 0.6534
 epoch: 82, train_loss: 0.6301, test_loss: 1.0368, test_f1: 0.6635
 epoch: 83, train_loss: 0.6406, test_loss: 1.0618, test_f1: 0.6510
 epoch: 84, train_loss: 0.6380, test_loss: 0.9943, test_f1: 0.6447
 epoch: 85, train_loss: 0.6226, test_loss: 1.0592, test_f1: 0.6557
 epoch: 86, train_loss: 0.6224, test_loss: 0.9864, test_f1: 0.6520
 epoch: 87, train_loss: 0.6309, test_loss: 0.9649, test_f1: 0.6294
 epoch: 88, train_loss: 0.6189, test_loss: 1.0301, test_f1: 0.6428
 epoch: 89, train_loss: 0.6132, test_loss: 1.0448, test_f1: 0.6365
 epoch: 90, train_loss: 0.6119, test_loss: 1.0692, test_f1: 0.6462
 epoch: 91, train_loss: 0.6280, test_loss: 1.0219, test_f1: 0.6347
 epoch: 92, train_loss: 0.6341, test_loss: 0.9920, test_f1: 0.6949
 epoch: 93, train_loss: 0.6186, test_loss: 1.0570, test_f1: 0.6476
 epoch: 94, train_loss: 0.6168, test_loss: 1.0704, test_f1: 0.6470
 epoch: 95, train_loss: 0.6105, test_loss: 1.0477, test_f1: 0.6485
 epoch: 96, train_loss: 0.6110, test_loss: 1.0261, test_f1: 0.6449
 epoch: 97, train_loss: 0.6002, test_loss: 1.0889, test_f1: 0.6384
 epoch: 98, train_loss: 0.5954, test_loss: 1.0407, test_f1: 0.6725
 epoch: 99, train_loss: 0.5874, test_loss: 1.0349, test_f1: 0.6601
##################ITERATION #2 ****************************************
 epoch: 0, train_loss: 1.1561, test_loss: 1.0758, test_f1: 0.3959
 epoch: 1, train_loss: 1.0128, test_loss: 1.0674, test_f1: 0.4928
 epoch: 2, train_loss: 0.9895, test_loss: 1.0401, test_f1: 0.4517
 epoch: 3, train_loss: 0.9833, test_loss: 1.0696, test_f1: 0.5047
 epoch: 4, train_loss: 0.9727, test_loss: 0.9690, test_f1: 0.5234
 epoch: 5, train_loss: 0.9582, test_loss: 1.0180, test_f1: 0.4638
 epoch: 6, train_loss: 0.9529, test_loss: 0.9662, test_f1: 0.4830
 epoch: 7, train_loss: 0.9449, test_loss: 0.9670, test_f1: 0.4942
 epoch: 8, train_loss: 0.9371, test_loss: 0.9493, test_f1: 0.5533
 epoch: 9, train_loss: 0.9188, test_loss: 0.9441, test_f1: 0.5576
 epoch: 10, train_loss: 0.9320, test_loss: 0.9968, test_f1: 0.4918
 epoch: 11, train_loss: 0.9118, test_loss: 1.0159, test_f1: 0.5452
 epoch: 12, train_loss: 0.9131, test_loss: 1.0073, test_f1: 0.4780
 epoch: 13, train_loss: 0.8990, test_loss: 0.9130, test_f1: 0.5234
 epoch: 14, train_loss: 0.9000, test_loss: 0.9865, test_f1: 0.5191
 epoch: 15, train_loss: 0.8976, test_loss: 0.9645, test_f1: 0.4919
 epoch: 16, train_loss: 0.9004, test_loss: 0.9898, test_f1: 0.4995
 epoch: 17, train_loss: 0.8985, test_loss: 0.9848, test_f1: 0.5036
 epoch: 18, train_loss: 0.8785, test_loss: 0.9294, test_f1: 0.4877
 epoch: 19, train_loss: 0.8752, test_loss: 0.8893, test_f1: 0.5728
 epoch: 20, train_loss: 0.8615, test_loss: 0.9159, test_f1: 0.5221
 epoch: 21, train_loss: 0.8664, test_loss: 0.9352, test_f1: 0.5536
 epoch: 22, train_loss: 0.8729, test_loss: 0.9466, test_f1: 0.5726
 epoch: 23, train_loss: 0.8599, test_loss: 0.9673, test_f1: 0.5572
 epoch: 24, train_loss: 0.8550, test_loss: 0.9539, test_f1: 0.5310
 epoch: 25, train_loss: 0.8587, test_loss: 0.8863, test_f1: 0.5721
 epoch: 26, train_loss: 0.8453, test_loss: 0.9202, test_f1: 0.5504
 epoch: 27, train_loss: 0.8456, test_loss: 1.0799, test_f1: 0.4767
 epoch: 28, train_loss: 0.8377, test_loss: 0.9952, test_f1: 0.5761
 epoch: 29, train_loss: 0.8411, test_loss: 1.0255, test_f1: 0.5033
 epoch: 30, train_loss: 0.8257, test_loss: 0.9854, test_f1: 0.5649
 epoch: 31, train_loss: 0.8298, test_loss: 1.0349, test_f1: 0.4864
 epoch: 32, train_loss: 0.8308, test_loss: 0.9236, test_f1: 0.5544
 epoch: 33, train_loss: 0.8226, test_loss: 0.9607, test_f1: 0.5699
 epoch: 34, train_loss: 0.8115, test_loss: 0.9665, test_f1: 0.5840
 epoch: 35, train_loss: 0.8205, test_loss: 0.9419, test_f1: 0.5779
 epoch: 36, train_loss: 0.8138, test_loss: 0.9903, test_f1: 0.5389
 epoch: 37, train_loss: 0.8114, test_loss: 1.1218, test_f1: 0.5725
 epoch: 38, train_loss: 0.8201, test_loss: 1.1152, test_f1: 0.5533
 epoch: 39, train_loss: 0.8010, test_loss: 1.0565, test_f1: 0.5518
 epoch: 40, train_loss: 0.8051, test_loss: 1.0062, test_f1: 0.5879
 epoch: 41, train_loss: 0.7992, test_loss: 1.1200, test_f1: 0.5791
 epoch: 42, train_loss: 0.8039, test_loss: 0.9873, test_f1: 0.5695
 epoch: 43, train_loss: 0.7924, test_loss: 1.1111, test_f1: 0.5428
 epoch: 44, train_loss: 0.7789, test_loss: 1.1518, test_f1: 0.5171
 epoch: 45, train_loss: 0.8132, test_loss: 0.9829, test_f1: 0.5657
 epoch: 46, train_loss: 0.7782, test_loss: 1.0176, test_f1: 0.5627
 epoch: 47, train_loss: 0.7772, test_loss: 0.9987, test_f1: 0.5593
 epoch: 48, train_loss: 0.8022, test_loss: 1.0037, test_f1: 0.6250
 epoch: 49, train_loss: 0.7902, test_loss: 1.0365, test_f1: 0.5254
 epoch: 50, train_loss: 0.7692, test_loss: 0.9882, test_f1: 0.5759
 epoch: 51, train_loss: 0.7509, test_loss: 1.0081, test_f1: 0.6084
 epoch: 52, train_loss: 0.7350, test_loss: 0.9604, test_f1: 0.6113
 epoch: 53, train_loss: 0.7300, test_loss: 0.9705, test_f1: 0.5923
 epoch: 54, train_loss: 0.7195, test_loss: 1.0271, test_f1: 0.5857
 epoch: 55, train_loss: 0.7109, test_loss: 1.0301, test_f1: 0.6055
 epoch: 56, train_loss: 0.7175, test_loss: 1.0448, test_f1: 0.6197
 epoch: 57, train_loss: 0.7069, test_loss: 1.1008, test_f1: 0.5983
 epoch: 58, train_loss: 0.7092, test_loss: 1.0142, test_f1: 0.5677
 epoch: 59, train_loss: 0.7027, test_loss: 1.0328, test_f1: 0.6288
 epoch: 60, train_loss: 0.6984, test_loss: 1.0757, test_f1: 0.6278
 epoch: 61, train_loss: 0.7104, test_loss: 1.0883, test_f1: 0.6418
 epoch: 62, train_loss: 0.6950, test_loss: 1.0690, test_f1: 0.6258
 epoch: 63, train_loss: 0.6910, test_loss: 1.1128, test_f1: 0.6069
 epoch: 64, train_loss: 0.7058, test_loss: 1.1148, test_f1: 0.6142
 epoch: 65, train_loss: 0.6932, test_loss: 1.0680, test_f1: 0.6224
 epoch: 66, train_loss: 0.6962, test_loss: 0.9974, test_f1: 0.6324
 epoch: 67, train_loss: 0.6743, test_loss: 1.1141, test_f1: 0.6364
 epoch: 68, train_loss: 0.6749, test_loss: 1.0718, test_f1: 0.6572
 epoch: 69, train_loss: 0.6859, test_loss: 1.1151, test_f1: 0.6153
 epoch: 70, train_loss: 0.6770, test_loss: 1.1569, test_f1: 0.6313
 epoch: 71, train_loss: 0.6722, test_loss: 1.1040, test_f1: 0.6631
 epoch: 72, train_loss: 0.6854, test_loss: 1.0600, test_f1: 0.6208
 epoch: 73, train_loss: 0.6763, test_loss: 1.1210, test_f1: 0.6293
 epoch: 74, train_loss: 0.6905, test_loss: 1.0641, test_f1: 0.6142
 epoch: 75, train_loss: 0.6757, test_loss: 1.0832, test_f1: 0.5912
 epoch: 76, train_loss: 0.6773, test_loss: 1.1184, test_f1: 0.5834
 epoch: 77, train_loss: 0.6730, test_loss: 1.1721, test_f1: 0.6008
 epoch: 78, train_loss: 0.6651, test_loss: 1.0988, test_f1: 0.6191
 epoch: 79, train_loss: 0.6500, test_loss: 1.2470, test_f1: 0.6074
 epoch: 80, train_loss: 0.6671, test_loss: 1.1167, test_f1: 0.6525
 epoch: 81, train_loss: 0.6561, test_loss: 1.2019, test_f1: 0.6052
 epoch: 82, train_loss: 0.6465, test_loss: 1.1527, test_f1: 0.6239
 epoch: 83, train_loss: 0.6476, test_loss: 1.1164, test_f1: 0.5710
 epoch: 84, train_loss: 0.6768, test_loss: 1.0662, test_f1: 0.6429
 epoch: 85, train_loss: 0.6345, test_loss: 1.0963, test_f1: 0.6603
 epoch: 86, train_loss: 0.6426, test_loss: 1.1690, test_f1: 0.6091
 epoch: 87, train_loss: 0.6487, test_loss: 1.1439, test_f1: 0.6512
 epoch: 88, train_loss: 0.6323, test_loss: 1.1726, test_f1: 0.6261
 epoch: 89, train_loss: 0.6278, test_loss: 1.2368, test_f1: 0.6085
 epoch: 90, train_loss: 0.6524, test_loss: 1.2450, test_f1: 0.6190
 epoch: 91, train_loss: 0.6236, test_loss: 1.1816, test_f1: 0.5863
 epoch: 92, train_loss: 0.6441, test_loss: 1.0968, test_f1: 0.6451
 epoch: 93, train_loss: 0.6285, test_loss: 1.1438, test_f1: 0.6338
 epoch: 94, train_loss: 0.6191, test_loss: 1.2252, test_f1: 0.6336
 epoch: 95, train_loss: 0.6297, test_loss: 1.1332, test_f1: 0.6084
 epoch: 96, train_loss: 0.6183, test_loss: 1.0948, test_f1: 0.6500
 epoch: 97, train_loss: 0.6481, test_loss: 1.1258, test_f1: 0.6163
 epoch: 98, train_loss: 0.6513, test_loss: 1.2216, test_f1: 0.5937
 epoch: 99, train_loss: 0.6042, test_loss: 1.2903, test_f1: 0.6310
##################ITERATION #3 ****************************************
 epoch: 0, train_loss: 1.2002, test_loss: 1.0568, test_f1: 0.4576
 epoch: 1, train_loss: 1.0177, test_loss: 0.9685, test_f1: 0.4475
 epoch: 2, train_loss: 0.9922, test_loss: 0.9708, test_f1: 0.4556
 epoch: 3, train_loss: 0.9781, test_loss: 0.9888, test_f1: 0.4838
 epoch: 4, train_loss: 0.9759, test_loss: 1.0767, test_f1: 0.4086
 epoch: 5, train_loss: 0.9536, test_loss: 0.9940, test_f1: 0.4898
 epoch: 6, train_loss: 0.9481, test_loss: 0.9767, test_f1: 0.4982
 epoch: 7, train_loss: 0.9363, test_loss: 0.9585, test_f1: 0.5016
 epoch: 8, train_loss: 0.9376, test_loss: 0.9267, test_f1: 0.5331
 epoch: 9, train_loss: 0.9504, test_loss: 0.9368, test_f1: 0.5155
 epoch: 10, train_loss: 0.9228, test_loss: 0.9821, test_f1: 0.5050
 epoch: 11, train_loss: 0.9153, test_loss: 0.9018, test_f1: 0.5025
 epoch: 12, train_loss: 0.9050, test_loss: 1.0034, test_f1: 0.4828
 epoch: 13, train_loss: 0.9073, test_loss: 0.9485, test_f1: 0.5128
 epoch: 14, train_loss: 0.8827, test_loss: 0.9502, test_f1: 0.5056
 epoch: 15, train_loss: 0.8762, test_loss: 0.9756, test_f1: 0.5170
 epoch: 16, train_loss: 0.8993, test_loss: 1.0139, test_f1: 0.5171
 epoch: 17, train_loss: 0.8785, test_loss: 0.9346, test_f1: 0.5555
 epoch: 18, train_loss: 0.8760, test_loss: 1.0249, test_f1: 0.4991
 epoch: 19, train_loss: 0.8915, test_loss: 0.9827, test_f1: 0.5433
 epoch: 20, train_loss: 0.9139, test_loss: 0.9784, test_f1: 0.5029
 epoch: 21, train_loss: 0.9000, test_loss: 0.9562, test_f1: 0.4935
 epoch: 22, train_loss: 0.8899, test_loss: 0.9689, test_f1: 0.5338
 epoch: 23, train_loss: 0.8752, test_loss: 0.9725, test_f1: 0.5171
 epoch: 24, train_loss: 0.8779, test_loss: 0.9418, test_f1: 0.5579
 epoch: 25, train_loss: 0.8768, test_loss: 0.9666, test_f1: 0.5388
 epoch: 26, train_loss: 0.8541, test_loss: 0.9910, test_f1: 0.5685
 epoch: 27, train_loss: 0.8434, test_loss: 0.9821, test_f1: 0.5481
 epoch: 28, train_loss: 0.8555, test_loss: 0.9485, test_f1: 0.5098
 epoch: 29, train_loss: 0.8396, test_loss: 0.9684, test_f1: 0.5137
 epoch: 30, train_loss: 0.8314, test_loss: 0.9391, test_f1: 0.5760
 epoch: 31, train_loss: 0.8247, test_loss: 0.9210, test_f1: 0.5693
 epoch: 32, train_loss: 0.8163, test_loss: 1.0426, test_f1: 0.5175
 epoch: 33, train_loss: 0.8381, test_loss: 0.9692, test_f1: 0.5977
 epoch: 34, train_loss: 0.7982, test_loss: 0.9605, test_f1: 0.5668
 epoch: 35, train_loss: 0.8001, test_loss: 0.9706, test_f1: 0.5826
 epoch: 36, train_loss: 0.8065, test_loss: 0.9523, test_f1: 0.6034
 epoch: 37, train_loss: 0.7922, test_loss: 0.9857, test_f1: 0.5789
 epoch: 38, train_loss: 0.7952, test_loss: 0.9449, test_f1: 0.5983
 epoch: 39, train_loss: 0.8059, test_loss: 0.9881, test_f1: 0.5633
 epoch: 40, train_loss: 0.7926, test_loss: 0.9083, test_f1: 0.5726
 epoch: 41, train_loss: 0.7997, test_loss: 1.0575, test_f1: 0.5782
 epoch: 42, train_loss: 0.7752, test_loss: 0.9113, test_f1: 0.5789
 epoch: 43, train_loss: 0.7770, test_loss: 0.8994, test_f1: 0.6384
 epoch: 44, train_loss: 0.7741, test_loss: 0.9910, test_f1: 0.5663
 epoch: 45, train_loss: 0.7715, test_loss: 0.9191, test_f1: 0.6182
 epoch: 46, train_loss: 0.7646, test_loss: 0.9901, test_f1: 0.5771
 epoch: 47, train_loss: 0.7787, test_loss: 0.8675, test_f1: 0.5971
 epoch: 48, train_loss: 0.7553, test_loss: 0.8569, test_f1: 0.6054
 epoch: 49, train_loss: 0.7521, test_loss: 0.9421, test_f1: 0.6215
 epoch: 50, train_loss: 0.7755, test_loss: 0.9081, test_f1: 0.5889
 epoch: 51, train_loss: 0.7483, test_loss: 0.8839, test_f1: 0.6280
 epoch: 52, train_loss: 0.7210, test_loss: 0.9144, test_f1: 0.6481
 epoch: 53, train_loss: 0.7055, test_loss: 0.9281, test_f1: 0.6426
 epoch: 54, train_loss: 0.7001, test_loss: 0.9363, test_f1: 0.6364
 epoch: 55, train_loss: 0.6931, test_loss: 0.9707, test_f1: 0.6292
 epoch: 56, train_loss: 0.6913, test_loss: 1.0002, test_f1: 0.6427
 epoch: 57, train_loss: 0.6927, test_loss: 0.9826, test_f1: 0.6331
 epoch: 58, train_loss: 0.6985, test_loss: 0.9920, test_f1: 0.6368
 epoch: 59, train_loss: 0.6961, test_loss: 0.9584, test_f1: 0.6380
 epoch: 60, train_loss: 0.6701, test_loss: 1.0046, test_f1: 0.6276
 epoch: 61, train_loss: 0.6766, test_loss: 1.0967, test_f1: 0.5915
 epoch: 62, train_loss: 0.6708, test_loss: 0.9595, test_f1: 0.6131
 epoch: 63, train_loss: 0.6870, test_loss: 1.0277, test_f1: 0.6166
 epoch: 64, train_loss: 0.6680, test_loss: 1.0880, test_f1: 0.6192
 epoch: 65, train_loss: 0.6905, test_loss: 1.0841, test_f1: 0.6250
 epoch: 66, train_loss: 0.6730, test_loss: 1.0094, test_f1: 0.6314
 epoch: 67, train_loss: 0.6715, test_loss: 0.9457, test_f1: 0.6266
 epoch: 68, train_loss: 0.6699, test_loss: 0.9671, test_f1: 0.6318
 epoch: 69, train_loss: 0.6614, test_loss: 1.0378, test_f1: 0.6330
 epoch: 70, train_loss: 0.6721, test_loss: 0.9749, test_f1: 0.6258
 epoch: 71, train_loss: 0.6666, test_loss: 0.9180, test_f1: 0.6277
 epoch: 72, train_loss: 0.6819, test_loss: 1.0548, test_f1: 0.6149
 epoch: 73, train_loss: 0.6697, test_loss: 1.1053, test_f1: 0.5961
 epoch: 74, train_loss: 0.6626, test_loss: 1.0110, test_f1: 0.6388
 epoch: 75, train_loss: 0.6673, test_loss: 1.0196, test_f1: 0.6363
 epoch: 76, train_loss: 0.6519, test_loss: 1.0763, test_f1: 0.6237
 epoch: 77, train_loss: 0.6811, test_loss: 1.0403, test_f1: 0.6379
 epoch: 78, train_loss: 0.6727, test_loss: 0.9924, test_f1: 0.6405
 epoch: 79, train_loss: 0.6401, test_loss: 1.0153, test_f1: 0.6240
 epoch: 80, train_loss: 0.6483, test_loss: 1.0828, test_f1: 0.6560
 epoch: 81, train_loss: 0.6431, test_loss: 0.9919, test_f1: 0.6458
 epoch: 82, train_loss: 0.6449, test_loss: 0.9672, test_f1: 0.6502
 epoch: 83, train_loss: 0.6434, test_loss: 1.1906, test_f1: 0.6476
 epoch: 84, train_loss: 0.6450, test_loss: 1.0329, test_f1: 0.6329
 epoch: 85, train_loss: 0.6593, test_loss: 1.0903, test_f1: 0.6189
 epoch: 86, train_loss: 0.6381, test_loss: 1.0997, test_f1: 0.6271
 epoch: 87, train_loss: 0.6376, test_loss: 1.0255, test_f1: 0.6438
 epoch: 88, train_loss: 0.6365, test_loss: 1.1419, test_f1: 0.6186
 epoch: 89, train_loss: 0.6406, test_loss: 1.0701, test_f1: 0.6188
 epoch: 90, train_loss: 0.6329, test_loss: 1.0179, test_f1: 0.6349
 epoch: 91, train_loss: 0.6260, test_loss: 1.1217, test_f1: 0.6222
 epoch: 92, train_loss: 0.6200, test_loss: 1.0017, test_f1: 0.6359
 epoch: 93, train_loss: 0.6323, test_loss: 1.0549, test_f1: 0.6359
 epoch: 94, train_loss: 0.6355, test_loss: 1.0252, test_f1: 0.6517
 epoch: 95, train_loss: 0.6204, test_loss: 1.0443, test_f1: 0.6306
 epoch: 96, train_loss: 0.6327, test_loss: 1.0230, test_f1: 0.6546
 epoch: 97, train_loss: 0.6240, test_loss: 1.0052, test_f1: 0.6357
 epoch: 98, train_loss: 0.6262, test_loss: 1.0715, test_f1: 0.6312
 epoch: 99, train_loss: 0.6236, test_loss: 1.0695, test_f1: 0.6310
##################ITERATION #4 ****************************************
 epoch: 0, train_loss: 1.1988, test_loss: 1.1595, test_f1: 0.3585
 epoch: 1, train_loss: 1.0498, test_loss: 1.1416, test_f1: 0.4429
 epoch: 2, train_loss: 0.9959, test_loss: 1.0302, test_f1: 0.4301
 epoch: 3, train_loss: 0.9916, test_loss: 1.0175, test_f1: 0.4644
 epoch: 4, train_loss: 0.9631, test_loss: 1.0797, test_f1: 0.4684
 epoch: 5, train_loss: 0.9559, test_loss: 1.0562, test_f1: 0.4539
 epoch: 6, train_loss: 0.9656, test_loss: 0.9941, test_f1: 0.5098
 epoch: 7, train_loss: 0.9386, test_loss: 1.0474, test_f1: 0.5313
 epoch: 8, train_loss: 0.9234, test_loss: 1.0266, test_f1: 0.4851
 epoch: 9, train_loss: 0.9191, test_loss: 1.2468, test_f1: 0.4526
 epoch: 10, train_loss: 0.9359, test_loss: 0.9616, test_f1: 0.5083
 epoch: 11, train_loss: 0.9109, test_loss: 0.9532, test_f1: 0.5146
 epoch: 12, train_loss: 0.9014, test_loss: 0.9939, test_f1: 0.5146
 epoch: 13, train_loss: 0.8957, test_loss: 1.0165, test_f1: 0.5401
 epoch: 14, train_loss: 0.8834, test_loss: 1.0974, test_f1: 0.5196
 epoch: 15, train_loss: 0.8919, test_loss: 0.9935, test_f1: 0.5301
 epoch: 16, train_loss: 0.8920, test_loss: 1.0314, test_f1: 0.5214
 epoch: 17, train_loss: 0.8860, test_loss: 0.9689, test_f1: 0.5290
 epoch: 18, train_loss: 0.8626, test_loss: 1.1019, test_f1: 0.5210
 epoch: 19, train_loss: 0.8544, test_loss: 1.1327, test_f1: 0.5511
 epoch: 20, train_loss: 0.8453, test_loss: 1.0342, test_f1: 0.5135
 epoch: 21, train_loss: 0.8553, test_loss: 1.0236, test_f1: 0.5210
 epoch: 22, train_loss: 0.8425, test_loss: 1.0939, test_f1: 0.5490
 epoch: 23, train_loss: 0.8444, test_loss: 1.0881, test_f1: 0.4872
 epoch: 24, train_loss: 0.8496, test_loss: 0.9884, test_f1: 0.5008
 epoch: 25, train_loss: 0.8454, test_loss: 1.0070, test_f1: 0.5272
 epoch: 26, train_loss: 0.8622, test_loss: 1.0492, test_f1: 0.4945
 epoch: 27, train_loss: 0.8490, test_loss: 0.9929, test_f1: 0.5154
 epoch: 28, train_loss: 0.8337, test_loss: 0.9685, test_f1: 0.5484
 epoch: 29, train_loss: 0.8258, test_loss: 1.0610, test_f1: 0.5392
 epoch: 30, train_loss: 0.8288, test_loss: 0.9433, test_f1: 0.5431
 epoch: 31, train_loss: 0.7941, test_loss: 0.9862, test_f1: 0.5749
 epoch: 32, train_loss: 0.8134, test_loss: 1.1731, test_f1: 0.5291
 epoch: 33, train_loss: 0.8242, test_loss: 1.1083, test_f1: 0.5161
 epoch: 34, train_loss: 0.8013, test_loss: 1.0092, test_f1: 0.5376
 epoch: 35, train_loss: 0.8216, test_loss: 1.0488, test_f1: 0.5838
 epoch: 36, train_loss: 0.7950, test_loss: 1.1638, test_f1: 0.5463
 epoch: 37, train_loss: 0.7894, test_loss: 1.0224, test_f1: 0.5781
 epoch: 38, train_loss: 0.7785, test_loss: 1.0349, test_f1: 0.5973
 epoch: 39, train_loss: 0.8004, test_loss: 1.0727, test_f1: 0.5463
 epoch: 40, train_loss: 0.8217, test_loss: 1.1014, test_f1: 0.5265
 epoch: 41, train_loss: 0.8018, test_loss: 1.1841, test_f1: 0.5642
 epoch: 42, train_loss: 0.7870, test_loss: 1.0313, test_f1: 0.5908
 epoch: 43, train_loss: 0.7931, test_loss: 0.9881, test_f1: 0.5452
 epoch: 44, train_loss: 0.7828, test_loss: 1.0499, test_f1: 0.6094
 epoch: 45, train_loss: 0.7656, test_loss: 1.2994, test_f1: 0.5547
 epoch: 46, train_loss: 0.7842, test_loss: 1.0213, test_f1: 0.5657
 epoch: 47, train_loss: 0.7501, test_loss: 1.0204, test_f1: 0.5828
 epoch: 48, train_loss: 0.7680, test_loss: 0.9925, test_f1: 0.5702
 epoch: 49, train_loss: 0.7700, test_loss: 0.9295, test_f1: 0.6061
 epoch: 50, train_loss: 0.7645, test_loss: 1.0729, test_f1: 0.5808
 epoch: 51, train_loss: 0.7459, test_loss: 1.0433, test_f1: 0.6028
 epoch: 52, train_loss: 0.7188, test_loss: 1.1516, test_f1: 0.6003
 epoch: 53, train_loss: 0.7198, test_loss: 1.1143, test_f1: 0.6142
 epoch: 54, train_loss: 0.7120, test_loss: 0.9985, test_f1: 0.6267
 epoch: 55, train_loss: 0.7055, test_loss: 1.0642, test_f1: 0.6380
 epoch: 56, train_loss: 0.7080, test_loss: 1.0407, test_f1: 0.6168
 epoch: 57, train_loss: 0.7065, test_loss: 1.1183, test_f1: 0.6181
 epoch: 58, train_loss: 0.7080, test_loss: 1.1496, test_f1: 0.5897
 epoch: 59, train_loss: 0.7038, test_loss: 1.0677, test_f1: 0.6005
 epoch: 60, train_loss: 0.6874, test_loss: 1.0959, test_f1: 0.6065
 epoch: 61, train_loss: 0.6925, test_loss: 1.0373, test_f1: 0.6078
 epoch: 62, train_loss: 0.6881, test_loss: 1.1499, test_f1: 0.6013
 epoch: 63, train_loss: 0.6914, test_loss: 1.0241, test_f1: 0.6290
 epoch: 64, train_loss: 0.6813, test_loss: 1.0747, test_f1: 0.6000
 epoch: 65, train_loss: 0.6794, test_loss: 1.0798, test_f1: 0.6010
 epoch: 66, train_loss: 0.6772, test_loss: 1.0778, test_f1: 0.6013
 epoch: 67, train_loss: 0.6937, test_loss: 1.1766, test_f1: 0.6355
 epoch: 68, train_loss: 0.6763, test_loss: 1.0659, test_f1: 0.6184
 epoch: 69, train_loss: 0.6839, test_loss: 1.1266, test_f1: 0.6569
 epoch: 70, train_loss: 0.6741, test_loss: 1.0881, test_f1: 0.5944
 epoch: 71, train_loss: 0.6750, test_loss: 1.1676, test_f1: 0.6155
 epoch: 72, train_loss: 0.6799, test_loss: 1.2024, test_f1: 0.6015
 epoch: 73, train_loss: 0.6717, test_loss: 1.0628, test_f1: 0.6127
 epoch: 74, train_loss: 0.6634, test_loss: 1.1290, test_f1: 0.5700
 epoch: 75, train_loss: 0.6595, test_loss: 1.1107, test_f1: 0.6095
 epoch: 76, train_loss: 0.6562, test_loss: 1.1447, test_f1: 0.6284
 epoch: 77, train_loss: 0.6479, test_loss: 1.1353, test_f1: 0.6286
 epoch: 78, train_loss: 0.6551, test_loss: 1.1533, test_f1: 0.6325
 epoch: 79, train_loss: 0.6575, test_loss: 1.1078, test_f1: 0.6451
 epoch: 80, train_loss: 0.6663, test_loss: 1.1130, test_f1: 0.6065
 epoch: 81, train_loss: 0.6586, test_loss: 1.1474, test_f1: 0.6075
 epoch: 82, train_loss: 0.6522, test_loss: 1.1693, test_f1: 0.6445
 epoch: 83, train_loss: 0.6711, test_loss: 1.1387, test_f1: 0.6164
 epoch: 84, train_loss: 0.6672, test_loss: 1.2249, test_f1: 0.5989
 epoch: 85, train_loss: 0.6497, test_loss: 1.1942, test_f1: 0.6192
 epoch: 86, train_loss: 0.6574, test_loss: 1.1600, test_f1: 0.6053
 epoch: 87, train_loss: 0.6429, test_loss: 1.1624, test_f1: 0.6184
 epoch: 88, train_loss: 0.6541, test_loss: 1.2052, test_f1: 0.6185
 epoch: 89, train_loss: 0.6432, test_loss: 1.1275, test_f1: 0.6142
 epoch: 90, train_loss: 0.6445, test_loss: 1.0451, test_f1: 0.6378
 epoch: 91, train_loss: 0.6490, test_loss: 1.0897, test_f1: 0.6187
 epoch: 92, train_loss: 0.6346, test_loss: 1.1202, test_f1: 0.6319
 epoch: 93, train_loss: 0.6306, test_loss: 1.1582, test_f1: 0.6157
 epoch: 94, train_loss: 0.6316, test_loss: 1.1201, test_f1: 0.6585
 epoch: 95, train_loss: 0.6280, test_loss: 1.1712, test_f1: 0.6251
 epoch: 96, train_loss: 0.6220, test_loss: 1.1627, test_f1: 0.6540
 epoch: 97, train_loss: 0.6267, test_loss: 1.2430, test_f1: 0.6564
 epoch: 98, train_loss: 0.6256, test_loss: 1.1525, test_f1: 0.6475
 epoch: 99, train_loss: 0.6428, test_loss: 1.1044, test_f1: 0.6357
##################ITERATION #5 ****************************************
 epoch: 0, train_loss: 1.1902, test_loss: 1.0540, test_f1: 0.4203
 epoch: 1, train_loss: 1.0206, test_loss: 1.0639, test_f1: 0.4473
 epoch: 2, train_loss: 0.9916, test_loss: 1.0226, test_f1: 0.4553
 epoch: 3, train_loss: 0.9967, test_loss: 0.9834, test_f1: 0.4653
 epoch: 4, train_loss: 0.9692, test_loss: 0.9586, test_f1: 0.4522
 epoch: 5, train_loss: 0.9691, test_loss: 1.0030, test_f1: 0.5221
 epoch: 6, train_loss: 0.9428, test_loss: 0.9972, test_f1: 0.4798
 epoch: 7, train_loss: 0.9478, test_loss: 0.9851, test_f1: 0.4759
 epoch: 8, train_loss: 0.9377, test_loss: 0.9662, test_f1: 0.5345
 epoch: 9, train_loss: 0.9300, test_loss: 0.9829, test_f1: 0.5120
 epoch: 10, train_loss: 0.9173, test_loss: 0.9538, test_f1: 0.5421
 epoch: 11, train_loss: 0.9085, test_loss: 1.0039, test_f1: 0.4963
 epoch: 12, train_loss: 0.9142, test_loss: 0.9568, test_f1: 0.5279
 epoch: 13, train_loss: 0.9053, test_loss: 1.0082, test_f1: 0.4824
 epoch: 14, train_loss: 0.9069, test_loss: 0.8847, test_f1: 0.5008
 epoch: 15, train_loss: 0.9006, test_loss: 0.9895, test_f1: 0.4914
 epoch: 16, train_loss: 0.8881, test_loss: 0.8720, test_f1: 0.5125
 epoch: 17, train_loss: 0.8893, test_loss: 0.9244, test_f1: 0.5139
 epoch: 18, train_loss: 0.8726, test_loss: 1.0332, test_f1: 0.5069
 epoch: 19, train_loss: 0.8695, test_loss: 0.8709, test_f1: 0.5232
 epoch: 20, train_loss: 0.8579, test_loss: 0.9796, test_f1: 0.5823
 epoch: 21, train_loss: 0.8721, test_loss: 0.9428, test_f1: 0.5019
 epoch: 22, train_loss: 0.8681, test_loss: 0.9050, test_f1: 0.5187
 epoch: 23, train_loss: 0.8567, test_loss: 0.8972, test_f1: 0.5376
 epoch: 24, train_loss: 0.8496, test_loss: 0.9427, test_f1: 0.5318
 epoch: 25, train_loss: 0.8500, test_loss: 0.9178, test_f1: 0.5271
 epoch: 26, train_loss: 0.8559, test_loss: 1.0128, test_f1: 0.5523
 epoch: 27, train_loss: 0.8392, test_loss: 0.8798, test_f1: 0.5403
 epoch: 28, train_loss: 0.8430, test_loss: 1.0553, test_f1: 0.5187
 epoch: 29, train_loss: 0.8382, test_loss: 1.0385, test_f1: 0.5118
 epoch: 30, train_loss: 0.8276, test_loss: 0.9746, test_f1: 0.5154
 epoch: 31, train_loss: 0.8188, test_loss: 0.9462, test_f1: 0.5639
 epoch: 32, train_loss: 0.8236, test_loss: 0.9917, test_f1: 0.5908
 epoch: 33, train_loss: 0.8217, test_loss: 1.0607, test_f1: 0.4839
 epoch: 34, train_loss: 0.8299, test_loss: 0.9453, test_f1: 0.5489
 epoch: 35, train_loss: 0.8207, test_loss: 0.9261, test_f1: 0.5762
 epoch: 36, train_loss: 0.8166, test_loss: 0.9912, test_f1: 0.5376
 epoch: 37, train_loss: 0.7915, test_loss: 0.8748, test_f1: 0.5304
 epoch: 38, train_loss: 0.8057, test_loss: 0.8997, test_f1: 0.5857
 epoch: 39, train_loss: 0.7972, test_loss: 0.9147, test_f1: 0.5657
 epoch: 40, train_loss: 0.8209, test_loss: 1.0838, test_f1: 0.5049
 epoch: 41, train_loss: 0.8074, test_loss: 0.9253, test_f1: 0.5598
 epoch: 42, train_loss: 0.7846, test_loss: 0.9701, test_f1: 0.5489
 epoch: 43, train_loss: 0.7759, test_loss: 1.0263, test_f1: 0.5901
 epoch: 44, train_loss: 0.7721, test_loss: 1.0060, test_f1: 0.5481
 epoch: 45, train_loss: 0.7783, test_loss: 1.0572, test_f1: 0.5407
 epoch: 46, train_loss: 0.7752, test_loss: 1.0064, test_f1: 0.5895
 epoch: 47, train_loss: 0.7615, test_loss: 0.9295, test_f1: 0.6326
 epoch: 48, train_loss: 0.7552, test_loss: 0.9163, test_f1: 0.5799
 epoch: 49, train_loss: 0.7397, test_loss: 0.9905, test_f1: 0.5845
 epoch: 50, train_loss: 0.7691, test_loss: 0.9886, test_f1: 0.5405
 epoch: 51, train_loss: 0.7343, test_loss: 0.9656, test_f1: 0.6113
 epoch: 52, train_loss: 0.7183, test_loss: 0.9787, test_f1: 0.6308
 epoch: 53, train_loss: 0.7105, test_loss: 0.9635, test_f1: 0.5879
 epoch: 54, train_loss: 0.7140, test_loss: 0.9295, test_f1: 0.6461
 epoch: 55, train_loss: 0.7178, test_loss: 1.0556, test_f1: 0.6405
 epoch: 56, train_loss: 0.7083, test_loss: 0.9365, test_f1: 0.6054
 epoch: 57, train_loss: 0.7098, test_loss: 0.9532, test_f1: 0.6305
 epoch: 58, train_loss: 0.6908, test_loss: 1.0037, test_f1: 0.5696
 epoch: 59, train_loss: 0.6922, test_loss: 0.9944, test_f1: 0.6089
 epoch: 60, train_loss: 0.6871, test_loss: 0.9761, test_f1: 0.6274
 epoch: 61, train_loss: 0.6858, test_loss: 1.0428, test_f1: 0.5733
 epoch: 62, train_loss: 0.6869, test_loss: 0.9790, test_f1: 0.6301
 epoch: 63, train_loss: 0.6773, test_loss: 0.9805, test_f1: 0.6353
 epoch: 64, train_loss: 0.6831, test_loss: 1.0034, test_f1: 0.6142
 epoch: 65, train_loss: 0.6817, test_loss: 1.0522, test_f1: 0.6321
 epoch: 66, train_loss: 0.6715, test_loss: 1.0068, test_f1: 0.6082
 epoch: 67, train_loss: 0.6830, test_loss: 1.1013, test_f1: 0.6154
 epoch: 68, train_loss: 0.6761, test_loss: 0.9271, test_f1: 0.6054
 epoch: 69, train_loss: 0.6516, test_loss: 1.0425, test_f1: 0.6167
 epoch: 70, train_loss: 0.6752, test_loss: 1.0445, test_f1: 0.6144
 epoch: 71, train_loss: 0.6651, test_loss: 1.0423, test_f1: 0.6124
 epoch: 72, train_loss: 0.6606, test_loss: 1.0301, test_f1: 0.6567
 epoch: 73, train_loss: 0.6582, test_loss: 0.9945, test_f1: 0.6258
 epoch: 74, train_loss: 0.6640, test_loss: 0.9800, test_f1: 0.6698
 epoch: 75, train_loss: 0.6603, test_loss: 1.0845, test_f1: 0.6466
 epoch: 76, train_loss: 0.6791, test_loss: 1.0129, test_f1: 0.6658
 epoch: 77, train_loss: 0.6661, test_loss: 1.0647, test_f1: 0.5889
 epoch: 78, train_loss: 0.6484, test_loss: 1.0448, test_f1: 0.6576
 epoch: 79, train_loss: 0.6425, test_loss: 1.0479, test_f1: 0.6440
 epoch: 80, train_loss: 0.6575, test_loss: 1.0623, test_f1: 0.6199
 epoch: 81, train_loss: 0.6549, test_loss: 1.0139, test_f1: 0.6080
 epoch: 82, train_loss: 0.6639, test_loss: 1.0593, test_f1: 0.5886
 epoch: 83, train_loss: 0.6460, test_loss: 1.0621, test_f1: 0.6718
 epoch: 84, train_loss: 0.6456, test_loss: 1.0904, test_f1: 0.6103
 epoch: 85, train_loss: 0.6248, test_loss: 0.9877, test_f1: 0.6289
 epoch: 86, train_loss: 0.6435, test_loss: 1.0447, test_f1: 0.6626
 epoch: 87, train_loss: 0.6451, test_loss: 1.0036, test_f1: 0.6828
 epoch: 88, train_loss: 0.6388, test_loss: 0.9758, test_f1: 0.6598
 epoch: 89, train_loss: 0.6492, test_loss: 1.0266, test_f1: 0.6691
 epoch: 90, train_loss: 0.6562, test_loss: 1.0606, test_f1: 0.6575
 epoch: 91, train_loss: 0.6253, test_loss: 1.0798, test_f1: 0.6399
 epoch: 92, train_loss: 0.6281, test_loss: 1.0414, test_f1: 0.6229
 epoch: 93, train_loss: 0.6176, test_loss: 1.0211, test_f1: 0.6538
 epoch: 94, train_loss: 0.6179, test_loss: 1.0623, test_f1: 0.6366
 epoch: 95, train_loss: 0.6400, test_loss: 1.0507, test_f1: 0.6605
 epoch: 96, train_loss: 0.6335, test_loss: 1.0529, test_f1: 0.6374
 epoch: 97, train_loss: 0.6217, test_loss: 1.0552, test_f1: 0.6269
 epoch: 98, train_loss: 0.6150, test_loss: 1.0852, test_f1: 0.6289
 epoch: 99, train_loss: 0.6287, test_loss: 1.0747, test_f1: 0.6561
##################ITERATION #6 ****************************************
 epoch: 0, train_loss: 1.2176, test_loss: 1.1828, test_f1: 0.4046
 epoch: 1, train_loss: 1.0417, test_loss: 1.0170, test_f1: 0.4450
 epoch: 2, train_loss: 1.0031, test_loss: 1.0167, test_f1: 0.4933
 epoch: 3, train_loss: 0.9880, test_loss: 0.9745, test_f1: 0.4713
 epoch: 4, train_loss: 0.9723, test_loss: 0.9653, test_f1: 0.5091
 epoch: 5, train_loss: 0.9516, test_loss: 0.9547, test_f1: 0.5188
 epoch: 6, train_loss: 0.9508, test_loss: 0.9502, test_f1: 0.5248
 epoch: 7, train_loss: 0.9413, test_loss: 0.9895, test_f1: 0.4796
 epoch: 8, train_loss: 0.9570, test_loss: 0.9726, test_f1: 0.4992
 epoch: 9, train_loss: 0.9329, test_loss: 0.9461, test_f1: 0.5200
 epoch: 10, train_loss: 0.9082, test_loss: 1.0413, test_f1: 0.5594
 epoch: 11, train_loss: 0.9024, test_loss: 0.9786, test_f1: 0.5079
 epoch: 12, train_loss: 0.8962, test_loss: 1.0073, test_f1: 0.5522
 epoch: 13, train_loss: 0.8907, test_loss: 0.9508, test_f1: 0.4966
 epoch: 14, train_loss: 0.8882, test_loss: 1.0275, test_f1: 0.5035
 epoch: 15, train_loss: 0.9151, test_loss: 1.0894, test_f1: 0.4803
 epoch: 16, train_loss: 0.9241, test_loss: 1.0042, test_f1: 0.4965
 epoch: 17, train_loss: 0.8983, test_loss: 0.9902, test_f1: 0.4929
 epoch: 18, train_loss: 0.8992, test_loss: 1.0425, test_f1: 0.4863
 epoch: 19, train_loss: 0.8929, test_loss: 1.0036, test_f1: 0.5072
 epoch: 20, train_loss: 0.8827, test_loss: 1.0017, test_f1: 0.5019
 epoch: 21, train_loss: 0.8733, test_loss: 0.9900, test_f1: 0.5288
 epoch: 22, train_loss: 0.8598, test_loss: 1.0457, test_f1: 0.5122
 epoch: 23, train_loss: 0.8767, test_loss: 1.0241, test_f1: 0.5189
 epoch: 24, train_loss: 0.8626, test_loss: 1.0011, test_f1: 0.5224
 epoch: 25, train_loss: 0.8517, test_loss: 1.0152, test_f1: 0.5706
 epoch: 26, train_loss: 0.8636, test_loss: 0.9978, test_f1: 0.4903
 epoch: 27, train_loss: 0.8536, test_loss: 0.9918, test_f1: 0.5467
 epoch: 28, train_loss: 0.8566, test_loss: 1.0280, test_f1: 0.5149
 epoch: 29, train_loss: 0.8540, test_loss: 1.0807, test_f1: 0.5006
 epoch: 30, train_loss: 0.8340, test_loss: 1.0559, test_f1: 0.5663
 epoch: 31, train_loss: 0.8358, test_loss: 0.9814, test_f1: 0.5234
 epoch: 32, train_loss: 0.8403, test_loss: 1.0356, test_f1: 0.5236
 epoch: 33, train_loss: 0.8367, test_loss: 0.9709, test_f1: 0.5051
 epoch: 34, train_loss: 0.8293, test_loss: 1.0206, test_f1: 0.5243
 epoch: 35, train_loss: 0.8334, test_loss: 1.0121, test_f1: 0.5045
 epoch: 36, train_loss: 0.8218, test_loss: 1.0988, test_f1: 0.5288
 epoch: 37, train_loss: 0.8162, test_loss: 1.0581, test_f1: 0.5321
 epoch: 38, train_loss: 0.8241, test_loss: 0.9818, test_f1: 0.5500
 epoch: 39, train_loss: 0.8164, test_loss: 0.9963, test_f1: 0.5862
 epoch: 40, train_loss: 0.7993, test_loss: 0.9640, test_f1: 0.5408
 epoch: 41, train_loss: 0.8129, test_loss: 1.0139, test_f1: 0.5341
 epoch: 42, train_loss: 0.8055, test_loss: 0.9491, test_f1: 0.5432
 epoch: 43, train_loss: 0.8123, test_loss: 0.9768, test_f1: 0.5491
 epoch: 44, train_loss: 0.8043, test_loss: 1.0111, test_f1: 0.5395
 epoch: 45, train_loss: 0.7973, test_loss: 1.0401, test_f1: 0.5597
 epoch: 46, train_loss: 0.7874, test_loss: 0.9692, test_f1: 0.5754
 epoch: 47, train_loss: 0.7932, test_loss: 0.9219, test_f1: 0.5866
 epoch: 48, train_loss: 0.7851, test_loss: 1.0133, test_f1: 0.5885
 epoch: 49, train_loss: 0.7992, test_loss: 0.9434, test_f1: 0.5671
 epoch: 50, train_loss: 0.7912, test_loss: 1.0462, test_f1: 0.5479
 epoch: 51, train_loss: 0.7476, test_loss: 0.9892, test_f1: 0.5668
 epoch: 52, train_loss: 0.7398, test_loss: 0.9609, test_f1: 0.6039
 epoch: 53, train_loss: 0.7456, test_loss: 0.9670, test_f1: 0.5495
 epoch: 54, train_loss: 0.7346, test_loss: 0.9959, test_f1: 0.5688
 epoch: 55, train_loss: 0.7238, test_loss: 0.9900, test_f1: 0.5932
 epoch: 56, train_loss: 0.7279, test_loss: 0.9796, test_f1: 0.6040
 epoch: 57, train_loss: 0.7309, test_loss: 1.0721, test_f1: 0.5602
 epoch: 58, train_loss: 0.7233, test_loss: 0.9850, test_f1: 0.6156
 epoch: 59, train_loss: 0.7281, test_loss: 0.9559, test_f1: 0.5912
 epoch: 60, train_loss: 0.7302, test_loss: 0.9905, test_f1: 0.5904
 epoch: 61, train_loss: 0.7185, test_loss: 0.9483, test_f1: 0.6406
 epoch: 62, train_loss: 0.7036, test_loss: 0.9745, test_f1: 0.6244
 epoch: 63, train_loss: 0.7175, test_loss: 0.9654, test_f1: 0.6543
 epoch: 64, train_loss: 0.7133, test_loss: 1.0101, test_f1: 0.6276
 epoch: 65, train_loss: 0.7070, test_loss: 0.9350, test_f1: 0.5967
 epoch: 66, train_loss: 0.6934, test_loss: 0.9688, test_f1: 0.6140
 epoch: 67, train_loss: 0.6852, test_loss: 1.0045, test_f1: 0.6319
 epoch: 68, train_loss: 0.6935, test_loss: 1.0403, test_f1: 0.6181
 epoch: 69, train_loss: 0.7010, test_loss: 1.0651, test_f1: 0.6208
 epoch: 70, train_loss: 0.7024, test_loss: 0.9547, test_f1: 0.6246
 epoch: 71, train_loss: 0.7076, test_loss: 1.0042, test_f1: 0.6002
 epoch: 72, train_loss: 0.6998, test_loss: 1.0131, test_f1: 0.5864
 epoch: 73, train_loss: 0.7042, test_loss: 1.0016, test_f1: 0.5959
 epoch: 74, train_loss: 0.6865, test_loss: 1.1073, test_f1: 0.5922
 epoch: 75, train_loss: 0.6949, test_loss: 1.0229, test_f1: 0.5697
 epoch: 76, train_loss: 0.7085, test_loss: 1.0413, test_f1: 0.6131
 epoch: 77, train_loss: 0.6894, test_loss: 0.9907, test_f1: 0.6030
 epoch: 78, train_loss: 0.6750, test_loss: 0.9840, test_f1: 0.5929
 epoch: 79, train_loss: 0.6919, test_loss: 0.9713, test_f1: 0.6100
 epoch: 80, train_loss: 0.6865, test_loss: 1.0019, test_f1: 0.5788
 epoch: 81, train_loss: 0.6853, test_loss: 0.9944, test_f1: 0.6185
 epoch: 82, train_loss: 0.6739, test_loss: 1.0364, test_f1: 0.5861
 epoch: 83, train_loss: 0.6868, test_loss: 1.0908, test_f1: 0.6428
 epoch: 84, train_loss: 0.6736, test_loss: 1.0992, test_f1: 0.6127
 epoch: 85, train_loss: 0.6682, test_loss: 1.0094, test_f1: 0.6070
 epoch: 86, train_loss: 0.6888, test_loss: 1.0150, test_f1: 0.6133
 epoch: 87, train_loss: 0.6715, test_loss: 1.0408, test_f1: 0.6361
 epoch: 88, train_loss: 0.6718, test_loss: 1.0061, test_f1: 0.6155
 epoch: 89, train_loss: 0.6705, test_loss: 1.1066, test_f1: 0.6243
 epoch: 90, train_loss: 0.6715, test_loss: 0.9602, test_f1: 0.6146
 epoch: 91, train_loss: 0.6702, test_loss: 1.0813, test_f1: 0.6202
 epoch: 92, train_loss: 0.6607, test_loss: 1.0192, test_f1: 0.6334
 epoch: 93, train_loss: 0.6662, test_loss: 1.0396, test_f1: 0.6104
 epoch: 94, train_loss: 0.6637, test_loss: 1.0862, test_f1: 0.6127
 epoch: 95, train_loss: 0.6492, test_loss: 1.0724, test_f1: 0.6247
 epoch: 96, train_loss: 0.6441, test_loss: 0.9797, test_f1: 0.6172
 epoch: 97, train_loss: 0.6498, test_loss: 1.0836, test_f1: 0.6173
 epoch: 98, train_loss: 0.6438, test_loss: 1.0999, test_f1: 0.6093
 epoch: 99, train_loss: 0.6504, test_loss: 1.0148, test_f1: 0.6677
##################ITERATION #7 ****************************************
 epoch: 0, train_loss: 1.1863, test_loss: 1.0446, test_f1: 0.4336
 epoch: 1, train_loss: 1.0258, test_loss: 1.0244, test_f1: 0.4468
 epoch: 2, train_loss: 0.9944, test_loss: 1.0020, test_f1: 0.4730
 epoch: 3, train_loss: 0.9696, test_loss: 0.9518, test_f1: 0.4809
 epoch: 4, train_loss: 0.9649, test_loss: 1.0413, test_f1: 0.4589
 epoch: 5, train_loss: 0.9654, test_loss: 0.9548, test_f1: 0.4902
 epoch: 6, train_loss: 0.9462, test_loss: 0.9755, test_f1: 0.4759
 epoch: 7, train_loss: 0.9417, test_loss: 1.0105, test_f1: 0.4944
 epoch: 8, train_loss: 0.9487, test_loss: 0.9436, test_f1: 0.5036
 epoch: 9, train_loss: 0.9395, test_loss: 0.9716, test_f1: 0.4974
 epoch: 10, train_loss: 0.9141, test_loss: 0.9496, test_f1: 0.4953
 epoch: 11, train_loss: 0.9113, test_loss: 1.0305, test_f1: 0.4779
 epoch: 12, train_loss: 0.9088, test_loss: 0.9882, test_f1: 0.4723
 epoch: 13, train_loss: 0.8912, test_loss: 0.9812, test_f1: 0.4890
 epoch: 14, train_loss: 0.9098, test_loss: 1.0879, test_f1: 0.4296
 epoch: 15, train_loss: 0.9095, test_loss: 0.9932, test_f1: 0.5066
 epoch: 16, train_loss: 0.9116, test_loss: 1.0762, test_f1: 0.4874
 epoch: 17, train_loss: 0.9154, test_loss: 0.9515, test_f1: 0.5123
 epoch: 18, train_loss: 0.8900, test_loss: 0.9732, test_f1: 0.5029
 epoch: 19, train_loss: 0.8736, test_loss: 0.9715, test_f1: 0.5015
 epoch: 20, train_loss: 0.8626, test_loss: 1.0090, test_f1: 0.4807
 epoch: 21, train_loss: 0.8693, test_loss: 0.9882, test_f1: 0.5063
 epoch: 22, train_loss: 0.8628, test_loss: 0.9881, test_f1: 0.5210
 epoch: 23, train_loss: 0.8606, test_loss: 0.9927, test_f1: 0.5281
 epoch: 24, train_loss: 0.8593, test_loss: 1.0355, test_f1: 0.4886
 epoch: 25, train_loss: 0.8490, test_loss: 0.9418, test_f1: 0.5951
 epoch: 26, train_loss: 0.8396, test_loss: 0.9773, test_f1: 0.5276
 epoch: 27, train_loss: 0.8286, test_loss: 1.0199, test_f1: 0.5208
 epoch: 28, train_loss: 0.8312, test_loss: 0.9541, test_f1: 0.5772
 epoch: 29, train_loss: 0.8283, test_loss: 0.9373, test_f1: 0.5775
 epoch: 30, train_loss: 0.8218, test_loss: 0.9726, test_f1: 0.5674
 epoch: 31, train_loss: 0.8145, test_loss: 0.9337, test_f1: 0.5853
 epoch: 32, train_loss: 0.8241, test_loss: 0.9310, test_f1: 0.6133
 epoch: 33, train_loss: 0.8119, test_loss: 0.8878, test_f1: 0.6022
 epoch: 34, train_loss: 0.8053, test_loss: 0.9921, test_f1: 0.5656
 epoch: 35, train_loss: 0.8057, test_loss: 0.9297, test_f1: 0.5994
 epoch: 36, train_loss: 0.8026, test_loss: 0.9652, test_f1: 0.6145
 epoch: 37, train_loss: 0.7999, test_loss: 0.9564, test_f1: 0.5906
 epoch: 38, train_loss: 0.7895, test_loss: 0.9317, test_f1: 0.5838
 epoch: 39, train_loss: 0.7850, test_loss: 0.9312, test_f1: 0.6090
 epoch: 40, train_loss: 0.7869, test_loss: 0.9943, test_f1: 0.5969
 epoch: 41, train_loss: 0.7804, test_loss: 0.8853, test_f1: 0.6166
 epoch: 42, train_loss: 0.7673, test_loss: 0.9109, test_f1: 0.6483
 epoch: 43, train_loss: 0.7806, test_loss: 0.9046, test_f1: 0.5919
 epoch: 44, train_loss: 0.7581, test_loss: 0.8685, test_f1: 0.6348
 epoch: 45, train_loss: 0.7825, test_loss: 0.8849, test_f1: 0.6097
 epoch: 46, train_loss: 0.7871, test_loss: 0.9198, test_f1: 0.6195
 epoch: 47, train_loss: 0.7735, test_loss: 1.0756, test_f1: 0.6204
 epoch: 48, train_loss: 0.7709, test_loss: 0.9267, test_f1: 0.5924
 epoch: 49, train_loss: 0.7593, test_loss: 0.8750, test_f1: 0.6310
 epoch: 50, train_loss: 0.7456, test_loss: 0.9302, test_f1: 0.6254
 epoch: 51, train_loss: 0.7288, test_loss: 0.9094, test_f1: 0.6519
 epoch: 52, train_loss: 0.7246, test_loss: 0.9332, test_f1: 0.6448
 epoch: 53, train_loss: 0.7052, test_loss: 1.0183, test_f1: 0.5998
 epoch: 54, train_loss: 0.7062, test_loss: 0.9211, test_f1: 0.6420
 epoch: 55, train_loss: 0.6996, test_loss: 0.9282, test_f1: 0.6403
 epoch: 56, train_loss: 0.7047, test_loss: 0.9086, test_f1: 0.6215
 epoch: 57, train_loss: 0.6993, test_loss: 0.9149, test_f1: 0.6443
 epoch: 58, train_loss: 0.7140, test_loss: 0.9123, test_f1: 0.6332
 epoch: 59, train_loss: 0.7028, test_loss: 0.9366, test_f1: 0.6483
 epoch: 60, train_loss: 0.7040, test_loss: 1.0477, test_f1: 0.6261
 epoch: 61, train_loss: 0.7027, test_loss: 0.9021, test_f1: 0.6077
 epoch: 62, train_loss: 0.6997, test_loss: 0.9022, test_f1: 0.6254
 epoch: 63, train_loss: 0.6958, test_loss: 1.0043, test_f1: 0.6137
 epoch: 64, train_loss: 0.6893, test_loss: 1.0040, test_f1: 0.6299
 epoch: 65, train_loss: 0.6948, test_loss: 0.9820, test_f1: 0.6313
 epoch: 66, train_loss: 0.6913, test_loss: 1.0210, test_f1: 0.6336
 epoch: 67, train_loss: 0.6857, test_loss: 0.9349, test_f1: 0.6360
 epoch: 68, train_loss: 0.6773, test_loss: 0.9948, test_f1: 0.6155
 epoch: 69, train_loss: 0.6662, test_loss: 0.9730, test_f1: 0.6341
 epoch: 70, train_loss: 0.6723, test_loss: 1.0261, test_f1: 0.6494
 epoch: 71, train_loss: 0.6663, test_loss: 1.0378, test_f1: 0.6457
 epoch: 72, train_loss: 0.6890, test_loss: 0.9826, test_f1: 0.6167
 epoch: 73, train_loss: 0.6829, test_loss: 0.9788, test_f1: 0.6705
 epoch: 74, train_loss: 0.6704, test_loss: 1.0136, test_f1: 0.6224
 epoch: 75, train_loss: 0.6694, test_loss: 1.0393, test_f1: 0.5923
 epoch: 76, train_loss: 0.6816, test_loss: 0.9658, test_f1: 0.6388
 epoch: 77, train_loss: 0.6707, test_loss: 0.9369, test_f1: 0.6483
 epoch: 78, train_loss: 0.6674, test_loss: 0.9582, test_f1: 0.6300
 epoch: 79, train_loss: 0.6593, test_loss: 1.0098, test_f1: 0.6662
 epoch: 80, train_loss: 0.6557, test_loss: 1.0160, test_f1: 0.6639
 epoch: 81, train_loss: 0.6514, test_loss: 1.0330, test_f1: 0.6587
 epoch: 82, train_loss: 0.6336, test_loss: 0.9556, test_f1: 0.6524
 epoch: 83, train_loss: 0.6514, test_loss: 1.0074, test_f1: 0.6688
 epoch: 84, train_loss: 0.6476, test_loss: 0.9918, test_f1: 0.6387
 epoch: 85, train_loss: 0.6509, test_loss: 1.0038, test_f1: 0.6810
 epoch: 86, train_loss: 0.6600, test_loss: 1.0367, test_f1: 0.6715
 epoch: 87, train_loss: 0.6343, test_loss: 0.9065, test_f1: 0.6345
 epoch: 88, train_loss: 0.6408, test_loss: 0.9681, test_f1: 0.6521
 epoch: 89, train_loss: 0.6556, test_loss: 1.0407, test_f1: 0.6457
 epoch: 90, train_loss: 0.6532, test_loss: 0.9610, test_f1: 0.6333
 epoch: 91, train_loss: 0.6539, test_loss: 1.0409, test_f1: 0.6313
 epoch: 92, train_loss: 0.6394, test_loss: 0.9568, test_f1: 0.6409
 epoch: 93, train_loss: 0.6395, test_loss: 1.0815, test_f1: 0.6230
 epoch: 94, train_loss: 0.6323, test_loss: 0.9415, test_f1: 0.6730
 epoch: 95, train_loss: 0.6421, test_loss: 0.9877, test_f1: 0.6652
 epoch: 96, train_loss: 0.6342, test_loss: 1.0160, test_f1: 0.6787
 epoch: 97, train_loss: 0.6338, test_loss: 0.9584, test_f1: 0.6398
 epoch: 98, train_loss: 0.6192, test_loss: 0.9708, test_f1: 0.6695
 epoch: 99, train_loss: 0.6271, test_loss: 0.9690, test_f1: 0.6933
##################ITERATION #8 ****************************************
 epoch: 0, train_loss: 1.1834, test_loss: 1.0666, test_f1: 0.4545
 epoch: 1, train_loss: 1.0426, test_loss: 1.1824, test_f1: 0.4842
 epoch: 2, train_loss: 0.9821, test_loss: 1.0492, test_f1: 0.4752
 epoch: 3, train_loss: 0.9829, test_loss: 1.0189, test_f1: 0.4846
 epoch: 4, train_loss: 0.9586, test_loss: 0.9892, test_f1: 0.5163
 epoch: 5, train_loss: 0.9545, test_loss: 0.9624, test_f1: 0.4847
 epoch: 6, train_loss: 0.9477, test_loss: 0.9844, test_f1: 0.5074
 epoch: 7, train_loss: 0.9465, test_loss: 0.9720, test_f1: 0.5115
 epoch: 8, train_loss: 0.9331, test_loss: 0.9297, test_f1: 0.4974
 epoch: 9, train_loss: 0.9456, test_loss: 1.0040, test_f1: 0.4942
 epoch: 10, train_loss: 0.9325, test_loss: 0.9858, test_f1: 0.4901
 epoch: 11, train_loss: 0.9182, test_loss: 0.9611, test_f1: 0.4624
 epoch: 12, train_loss: 0.9088, test_loss: 0.9907, test_f1: 0.4995
 epoch: 13, train_loss: 0.9021, test_loss: 0.9523, test_f1: 0.5094
 epoch: 14, train_loss: 0.8947, test_loss: 0.9842, test_f1: 0.5272
 epoch: 15, train_loss: 0.8968, test_loss: 0.9148, test_f1: 0.5653
 epoch: 16, train_loss: 0.8981, test_loss: 0.9437, test_f1: 0.5190
 epoch: 17, train_loss: 0.8749, test_loss: 0.9571, test_f1: 0.5261
 epoch: 18, train_loss: 0.8717, test_loss: 0.9640, test_f1: 0.5331
 epoch: 19, train_loss: 0.8655, test_loss: 0.9527, test_f1: 0.5355
 epoch: 20, train_loss: 0.8553, test_loss: 1.0763, test_f1: 0.5069
 epoch: 21, train_loss: 0.8670, test_loss: 0.9301, test_f1: 0.5485
 epoch: 22, train_loss: 0.8682, test_loss: 1.0279, test_f1: 0.5505
 epoch: 23, train_loss: 0.8516, test_loss: 0.9316, test_f1: 0.5574
 epoch: 24, train_loss: 0.8452, test_loss: 0.9330, test_f1: 0.5881
 epoch: 25, train_loss: 0.8440, test_loss: 0.9324, test_f1: 0.5660
 epoch: 26, train_loss: 0.8329, test_loss: 0.9628, test_f1: 0.5664
 epoch: 27, train_loss: 0.8197, test_loss: 0.9704, test_f1: 0.5462
 epoch: 28, train_loss: 0.8318, test_loss: 0.9452, test_f1: 0.5697
 epoch: 29, train_loss: 0.8265, test_loss: 0.9506, test_f1: 0.5275
 epoch: 30, train_loss: 0.8115, test_loss: 0.9898, test_f1: 0.5616
 epoch: 31, train_loss: 0.8217, test_loss: 0.9113, test_f1: 0.5965
 epoch: 32, train_loss: 0.8362, test_loss: 0.9166, test_f1: 0.5448
 epoch: 33, train_loss: 0.8082, test_loss: 0.8705, test_f1: 0.5168
 epoch: 34, train_loss: 0.8143, test_loss: 0.9639, test_f1: 0.5373
 epoch: 35, train_loss: 0.8025, test_loss: 0.9313, test_f1: 0.5723
 epoch: 36, train_loss: 0.7882, test_loss: 0.8946, test_f1: 0.5755
 epoch: 37, train_loss: 0.7928, test_loss: 1.0894, test_f1: 0.5657
 epoch: 38, train_loss: 0.7928, test_loss: 0.9305, test_f1: 0.6086
 epoch: 39, train_loss: 0.8058, test_loss: 0.8874, test_f1: 0.6141
 epoch: 40, train_loss: 0.7927, test_loss: 0.8527, test_f1: 0.5611
 epoch: 41, train_loss: 0.7821, test_loss: 0.8865, test_f1: 0.5513
 epoch: 42, train_loss: 0.7800, test_loss: 0.9652, test_f1: 0.5679
 epoch: 43, train_loss: 0.7803, test_loss: 0.9779, test_f1: 0.5461
 epoch: 44, train_loss: 0.8157, test_loss: 0.9548, test_f1: 0.5856
 epoch: 45, train_loss: 0.8104, test_loss: 0.8558, test_f1: 0.5927
 epoch: 46, train_loss: 0.7719, test_loss: 0.8882, test_f1: 0.6311
 epoch: 47, train_loss: 0.7761, test_loss: 0.9499, test_f1: 0.5532
 epoch: 48, train_loss: 0.7646, test_loss: 0.9834, test_f1: 0.5877
 epoch: 49, train_loss: 0.7654, test_loss: 0.8907, test_f1: 0.5935
 epoch: 50, train_loss: 0.7655, test_loss: 0.9434, test_f1: 0.5808
 epoch: 51, train_loss: 0.7397, test_loss: 0.8585, test_f1: 0.6130
 epoch: 52, train_loss: 0.7233, test_loss: 0.8849, test_f1: 0.5957
 epoch: 53, train_loss: 0.7085, test_loss: 0.9193, test_f1: 0.5991
 epoch: 54, train_loss: 0.7109, test_loss: 0.9074, test_f1: 0.6178
 epoch: 55, train_loss: 0.7111, test_loss: 0.8587, test_f1: 0.6510
 epoch: 56, train_loss: 0.6963, test_loss: 0.8946, test_f1: 0.6182
 epoch: 57, train_loss: 0.6952, test_loss: 0.9012, test_f1: 0.5809
 epoch: 58, train_loss: 0.6879, test_loss: 0.9450, test_f1: 0.6058
 epoch: 59, train_loss: 0.6919, test_loss: 0.8440, test_f1: 0.6457
 epoch: 60, train_loss: 0.6993, test_loss: 1.0149, test_f1: 0.5571
 epoch: 61, train_loss: 0.7078, test_loss: 0.8242, test_f1: 0.6594
 epoch: 62, train_loss: 0.6749, test_loss: 0.8650, test_f1: 0.6105
 epoch: 63, train_loss: 0.6698, test_loss: 0.8547, test_f1: 0.6322
 epoch: 64, train_loss: 0.6916, test_loss: 0.8565, test_f1: 0.6333
 epoch: 65, train_loss: 0.6881, test_loss: 0.8532, test_f1: 0.6462
 epoch: 66, train_loss: 0.6750, test_loss: 0.8925, test_f1: 0.5986
 epoch: 67, train_loss: 0.6723, test_loss: 0.8979, test_f1: 0.6104
 epoch: 68, train_loss: 0.6769, test_loss: 0.8756, test_f1: 0.6309
 epoch: 69, train_loss: 0.6634, test_loss: 0.8461, test_f1: 0.6560
 epoch: 70, train_loss: 0.6685, test_loss: 0.8819, test_f1: 0.6509
 epoch: 71, train_loss: 0.6720, test_loss: 0.8933, test_f1: 0.6407
 epoch: 72, train_loss: 0.6638, test_loss: 0.8851, test_f1: 0.6596
 epoch: 73, train_loss: 0.6605, test_loss: 0.9482, test_f1: 0.6180
 epoch: 74, train_loss: 0.6465, test_loss: 0.9745, test_f1: 0.6085
 epoch: 75, train_loss: 0.6553, test_loss: 0.8835, test_f1: 0.6271
 epoch: 76, train_loss: 0.6784, test_loss: 0.8806, test_f1: 0.6530
 epoch: 77, train_loss: 0.6463, test_loss: 0.9253, test_f1: 0.6390
 epoch: 78, train_loss: 0.6556, test_loss: 0.8714, test_f1: 0.6313
 epoch: 79, train_loss: 0.6585, test_loss: 0.9004, test_f1: 0.6580
 epoch: 80, train_loss: 0.6561, test_loss: 0.9181, test_f1: 0.6439
 epoch: 81, train_loss: 0.6456, test_loss: 0.9090, test_f1: 0.6500
 epoch: 82, train_loss: 0.6268, test_loss: 0.8981, test_f1: 0.6505
 epoch: 83, train_loss: 0.6514, test_loss: 0.9648, test_f1: 0.6390
 epoch: 84, train_loss: 0.6528, test_loss: 0.8945, test_f1: 0.6644
 epoch: 85, train_loss: 0.6424, test_loss: 0.9006, test_f1: 0.6381
 epoch: 86, train_loss: 0.6393, test_loss: 0.8891, test_f1: 0.6359
 epoch: 87, train_loss: 0.6323, test_loss: 0.8849, test_f1: 0.6805
 epoch: 88, train_loss: 0.6544, test_loss: 0.9497, test_f1: 0.6124
 epoch: 89, train_loss: 0.6388, test_loss: 0.8891, test_f1: 0.6542
 epoch: 90, train_loss: 0.6392, test_loss: 0.9436, test_f1: 0.6107
 epoch: 91, train_loss: 0.6238, test_loss: 0.9164, test_f1: 0.6408
 epoch: 92, train_loss: 0.6633, test_loss: 0.8796, test_f1: 0.6319
 epoch: 93, train_loss: 0.6288, test_loss: 0.8628, test_f1: 0.6688
 epoch: 94, train_loss: 0.6303, test_loss: 0.8890, test_f1: 0.6546
 epoch: 95, train_loss: 0.6284, test_loss: 0.9129, test_f1: 0.6447
 epoch: 96, train_loss: 0.6355, test_loss: 0.9298, test_f1: 0.6428
 epoch: 97, train_loss: 0.6197, test_loss: 0.9462, test_f1: 0.6365
 epoch: 98, train_loss: 0.6312, test_loss: 0.9768, test_f1: 0.6400
 epoch: 99, train_loss: 0.6163, test_loss: 0.9366, test_f1: 0.6128
##################ITERATION #9 ****************************************
 epoch: 0, train_loss: 1.1674, test_loss: 1.0890, test_f1: 0.4562
 epoch: 1, train_loss: 1.0214, test_loss: 1.0108, test_f1: 0.4973
 epoch: 2, train_loss: 1.0121, test_loss: 0.9722, test_f1: 0.5156
 epoch: 3, train_loss: 0.9843, test_loss: 1.0370, test_f1: 0.4975
 epoch: 4, train_loss: 0.9630, test_loss: 0.9790, test_f1: 0.4746
 epoch: 5, train_loss: 0.9628, test_loss: 1.0888, test_f1: 0.4850
 epoch: 6, train_loss: 0.9506, test_loss: 0.9796, test_f1: 0.5250
 epoch: 7, train_loss: 0.9497, test_loss: 0.9394, test_f1: 0.5274
 epoch: 8, train_loss: 0.9516, test_loss: 1.0376, test_f1: 0.4443
 epoch: 9, train_loss: 0.9257, test_loss: 0.9350, test_f1: 0.4840
 epoch: 10, train_loss: 0.9303, test_loss: 0.9788, test_f1: 0.4482
 epoch: 11, train_loss: 0.9141, test_loss: 0.9424, test_f1: 0.5032
 epoch: 12, train_loss: 0.9136, test_loss: 0.9577, test_f1: 0.5546
 epoch: 13, train_loss: 0.9216, test_loss: 0.9651, test_f1: 0.4968
 epoch: 14, train_loss: 0.8928, test_loss: 0.9187, test_f1: 0.4989
 epoch: 15, train_loss: 0.8823, test_loss: 0.9056, test_f1: 0.5497
 epoch: 16, train_loss: 0.8860, test_loss: 0.9525, test_f1: 0.5065
 epoch: 17, train_loss: 0.8858, test_loss: 0.9297, test_f1: 0.5588
 epoch: 18, train_loss: 0.8799, test_loss: 0.9376, test_f1: 0.5189
 epoch: 19, train_loss: 0.8659, test_loss: 0.9495, test_f1: 0.5126
 epoch: 20, train_loss: 0.8769, test_loss: 0.9735, test_f1: 0.5293
 epoch: 21, train_loss: 0.8764, test_loss: 0.9781, test_f1: 0.5220
 epoch: 22, train_loss: 0.8769, test_loss: 0.9372, test_f1: 0.5680
 epoch: 23, train_loss: 0.8780, test_loss: 0.9074, test_f1: 0.5258
 epoch: 24, train_loss: 0.8829, test_loss: 0.9233, test_f1: 0.5207
 epoch: 25, train_loss: 0.8540, test_loss: 0.9628, test_f1: 0.5142
 epoch: 26, train_loss: 0.8859, test_loss: 0.9238, test_f1: 0.5220
 epoch: 27, train_loss: 0.8660, test_loss: 0.8770, test_f1: 0.5826
 epoch: 28, train_loss: 0.8631, test_loss: 0.9359, test_f1: 0.5211
 epoch: 29, train_loss: 0.8468, test_loss: 0.8669, test_f1: 0.5118
 epoch: 30, train_loss: 0.8291, test_loss: 0.9258, test_f1: 0.5497
 epoch: 31, train_loss: 0.8322, test_loss: 0.8833, test_f1: 0.5535
 epoch: 32, train_loss: 0.8366, test_loss: 0.9192, test_f1: 0.5300
 epoch: 33, train_loss: 0.8317, test_loss: 0.8853, test_f1: 0.5353
 epoch: 34, train_loss: 0.8128, test_loss: 0.9574, test_f1: 0.5574
 epoch: 35, train_loss: 0.8343, test_loss: 0.9180, test_f1: 0.5371
 epoch: 36, train_loss: 0.8198, test_loss: 0.9909, test_f1: 0.5915
 epoch: 37, train_loss: 0.8119, test_loss: 0.9124, test_f1: 0.5362
 epoch: 38, train_loss: 0.8174, test_loss: 0.9312, test_f1: 0.5481
 epoch: 39, train_loss: 0.8200, test_loss: 0.8751, test_f1: 0.5625
 epoch: 40, train_loss: 0.8067, test_loss: 0.8566, test_f1: 0.5725
 epoch: 41, train_loss: 0.8155, test_loss: 0.9513, test_f1: 0.5855
 epoch: 42, train_loss: 0.8110, test_loss: 0.8439, test_f1: 0.5865
 epoch: 43, train_loss: 0.7949, test_loss: 0.9316, test_f1: 0.6167
 epoch: 44, train_loss: 0.7969, test_loss: 0.8718, test_f1: 0.5963
 epoch: 45, train_loss: 0.8072, test_loss: 0.9320, test_f1: 0.6223
 epoch: 46, train_loss: 0.7835, test_loss: 0.9268, test_f1: 0.5925
 epoch: 47, train_loss: 0.7903, test_loss: 0.9542, test_f1: 0.5870
 epoch: 48, train_loss: 0.7850, test_loss: 1.0069, test_f1: 0.5862
 epoch: 49, train_loss: 0.7785, test_loss: 0.9453, test_f1: 0.6096
 epoch: 50, train_loss: 0.7920, test_loss: 0.9063, test_f1: 0.6248
 epoch: 51, train_loss: 0.7583, test_loss: 0.9257, test_f1: 0.6451
 epoch: 52, train_loss: 0.7300, test_loss: 0.8884, test_f1: 0.6066
 epoch: 53, train_loss: 0.7433, test_loss: 0.8998, test_f1: 0.6139
 epoch: 54, train_loss: 0.7322, test_loss: 0.9053, test_f1: 0.6478
 epoch: 55, train_loss: 0.7141, test_loss: 0.8918, test_f1: 0.6185
 epoch: 56, train_loss: 0.7200, test_loss: 0.9705, test_f1: 0.6343
 epoch: 57, train_loss: 0.7060, test_loss: 0.9624, test_f1: 0.6527
 epoch: 58, train_loss: 0.7253, test_loss: 0.9341, test_f1: 0.6184
 epoch: 59, train_loss: 0.7146, test_loss: 0.9839, test_f1: 0.6432
 epoch: 60, train_loss: 0.7227, test_loss: 0.9915, test_f1: 0.6271
 epoch: 61, train_loss: 0.7065, test_loss: 1.0172, test_f1: 0.6114
 epoch: 62, train_loss: 0.7035, test_loss: 0.9735, test_f1: 0.6226
 epoch: 63, train_loss: 0.6948, test_loss: 0.9933, test_f1: 0.6403
 epoch: 64, train_loss: 0.6991, test_loss: 0.9976, test_f1: 0.6183
 epoch: 65, train_loss: 0.6945, test_loss: 1.0824, test_f1: 0.6246
 epoch: 66, train_loss: 0.6906, test_loss: 0.9035, test_f1: 0.6457
 epoch: 67, train_loss: 0.7059, test_loss: 1.0135, test_f1: 0.6210
 epoch: 68, train_loss: 0.6782, test_loss: 0.9903, test_f1: 0.6322
 epoch: 69, train_loss: 0.6977, test_loss: 1.0033, test_f1: 0.6164
 epoch: 70, train_loss: 0.6712, test_loss: 0.8947, test_f1: 0.6304
 epoch: 71, train_loss: 0.6821, test_loss: 0.9593, test_f1: 0.6382
 epoch: 72, train_loss: 0.6996, test_loss: 0.9370, test_f1: 0.6511
 epoch: 73, train_loss: 0.6561, test_loss: 1.0523, test_f1: 0.6272
 epoch: 74, train_loss: 0.6725, test_loss: 1.0121, test_f1: 0.6233
 epoch: 75, train_loss: 0.6897, test_loss: 1.0352, test_f1: 0.6191
 epoch: 76, train_loss: 0.6689, test_loss: 1.0354, test_f1: 0.6314
 epoch: 77, train_loss: 0.6650, test_loss: 1.0351, test_f1: 0.6408
 epoch: 78, train_loss: 0.6813, test_loss: 0.8700, test_f1: 0.6129
 epoch: 79, train_loss: 0.6666, test_loss: 1.0924, test_f1: 0.5865
 epoch: 80, train_loss: 0.6761, test_loss: 1.1003, test_f1: 0.6310
 epoch: 81, train_loss: 0.6679, test_loss: 0.9869, test_f1: 0.6668
 epoch: 82, train_loss: 0.6439, test_loss: 1.0748, test_f1: 0.6482
 epoch: 83, train_loss: 0.6508, test_loss: 0.9854, test_f1: 0.6426
 epoch: 84, train_loss: 0.6613, test_loss: 1.1282, test_f1: 0.6436
 epoch: 85, train_loss: 0.6577, test_loss: 1.0283, test_f1: 0.6270
 epoch: 86, train_loss: 0.6552, test_loss: 1.0180, test_f1: 0.5999
 epoch: 87, train_loss: 0.6535, test_loss: 1.0924, test_f1: 0.6397
 epoch: 88, train_loss: 0.6546, test_loss: 0.9963, test_f1: 0.6294
 epoch: 89, train_loss: 0.6797, test_loss: 1.0606, test_f1: 0.6382
 epoch: 90, train_loss: 0.6551, test_loss: 0.9865, test_f1: 0.6219
 epoch: 91, train_loss: 0.6655, test_loss: 0.9497, test_f1: 0.6697
 epoch: 92, train_loss: 0.6626, test_loss: 0.9977, test_f1: 0.6422
 epoch: 93, train_loss: 0.6552, test_loss: 1.0930, test_f1: 0.6453
 epoch: 94, train_loss: 0.6448, test_loss: 0.9941, test_f1: 0.6411
 epoch: 95, train_loss: 0.6363, test_loss: 1.0693, test_f1: 0.6650
 epoch: 96, train_loss: 0.6406, test_loss: 1.1352, test_f1: 0.5866
 epoch: 97, train_loss: 0.6593, test_loss: 1.1465, test_f1: 0.5955
 epoch: 98, train_loss: 0.6450, test_loss: 1.0336, test_f1: 0.6206
 epoch: 99, train_loss: 0.6374, test_loss: 0.9855, test_f1: 0.6155

Training completed in 739.31 seconds
Best F1: 0.6949 at epoch 92
Mean F1 across iterations: 0.6717  0.0147
========================FINAL RESULTS================================
FEGIN weighted F1: 0.6949  0.0147
python main.py --data ltspice_examples --representation component_net --model FEGIN --layers 5 --hiddens 32 --batch_size 64 --lr 0.01 --emb_size 512 --epochs 100 --save_appendix component_net_L5_H32_BS64_LR0.01_E512 --no_val
-----



STDERR:
  File "main.py", line 370, in <module>
    main()
  File "main.py", line 254, in main
    dataset = dataset_class(
  File "/home/philip/projects/ltspice_examples_code_repo/Circuit-Completion-Using-GNNs/component_classification_with_link_prediction_head/evaluation/FEGIN/kernel/circuit_datasets.py", line 15, in __init__
    self.data, self.slices = torch.load(self.processed_paths[0])
  File "/home/philip/.local/lib/python3.8/site-packages/torch/serialization.py", line 1040, in load
    warnings.warn(
  File "/usr/lib/python3.8/warnings.py", line 109, in _showwarnmsg
    sw(msg.message, msg.category, msg.filename, msg.lineno,
  File "main.py", line 47, in warn_with_traceback
    traceback.print_stack(file=log)
/home/philip/projects/ltspice_examples_code_repo/Circuit-Completion-Using-GNNs/component_classification_with_link_prediction_head/evaluation/FEGIN/kernel/circuit_datasets.py:15: FutureWarning: You are using `torch.load` with `weights_only=False` (the current default value), which uses the default pickle module implicitly. It is possible to construct malicious pickle data which will execute arbitrary code during unpickling (See https://github.com/pytorch/pytorch/blob/main/SECURITY.md#untrusted-models for more details). In a future release, the default value for `weights_only` will be flipped to `True`. This limits the functions that could be executed during unpickling. Arbitrary objects will no longer be allowed to be loaded via this mode unless they are explicitly allowlisted by the user via `torch.serialization.add_safe_globals`. We recommend you start setting `weights_only=True` for any use case where you don't have full control of the loaded file. Please open an issue on GitHub for any issues related to this experimental feature.
  self.data, self.slices = torch.load(self.processed_paths[0])
