STDOUT:
Results will be saved in /home/philip/projects/ltspice_examples_code_repo/Circuit-Completion-Using-GNNs/component_classification_with_link_prediction_head/evaluation/FEGIN/results/model_FEGIN_dataset_ltspice_examples
Command line input: python main.py --data ltspice_examples --representation component_pin_net --model FEGIN --layers 4 --hiddens 128 --batch_size 32 --lr 0.0001 --emb_size 512 --epochs 100 --save_appendix component_pin_net_L4_H128_BS32_LR0.0001_E512 --no_val
 is saved.
-----
ltspice_examples - FEGIN
Using 4 layers, 128 hidden units, h = 2
Loading component_pin_net representation dataset
ENTERED
Training FEGIN on component_pin_net representation
Train: 3558, Test: 846
##################ITERATION #0 ****************************************
 epoch: 0, train_loss: 1.3054, test_loss: 1.1728, test_f1: 0.3073
 epoch: 1, train_loss: 1.1433, test_loss: 1.0660, test_f1: 0.3430
 epoch: 2, train_loss: 1.0642, test_loss: 1.0423, test_f1: 0.3476
 epoch: 3, train_loss: 1.0300, test_loss: 1.0210, test_f1: 0.4436
 epoch: 4, train_loss: 1.0009, test_loss: 0.9991, test_f1: 0.4695
 epoch: 5, train_loss: 0.9788, test_loss: 0.9655, test_f1: 0.5156
 epoch: 6, train_loss: 0.9618, test_loss: 0.9463, test_f1: 0.5050
 epoch: 7, train_loss: 0.9360, test_loss: 0.9223, test_f1: 0.5207
 epoch: 8, train_loss: 0.9087, test_loss: 0.9079, test_f1: 0.5264
 epoch: 9, train_loss: 0.9052, test_loss: 0.9185, test_f1: 0.5226
 epoch: 10, train_loss: 0.8956, test_loss: 0.8949, test_f1: 0.5116
 epoch: 11, train_loss: 0.8920, test_loss: 0.9070, test_f1: 0.5376
 epoch: 12, train_loss: 0.8659, test_loss: 0.8646, test_f1: 0.5522
 epoch: 13, train_loss: 0.8681, test_loss: 0.8519, test_f1: 0.5539
 epoch: 14, train_loss: 0.8533, test_loss: 0.8765, test_f1: 0.5303
 epoch: 15, train_loss: 0.8340, test_loss: 0.8828, test_f1: 0.5175
 epoch: 16, train_loss: 0.8383, test_loss: 0.8700, test_f1: 0.5265
 epoch: 17, train_loss: 0.8246, test_loss: 0.8539, test_f1: 0.5686
 epoch: 18, train_loss: 0.8137, test_loss: 0.8759, test_f1: 0.5409
 epoch: 19, train_loss: 0.8086, test_loss: 0.8331, test_f1: 0.5548
 epoch: 20, train_loss: 0.8097, test_loss: 0.8516, test_f1: 0.5359
 epoch: 21, train_loss: 0.7971, test_loss: 0.8748, test_f1: 0.5667
 epoch: 22, train_loss: 0.7847, test_loss: 0.8122, test_f1: 0.5651
 epoch: 23, train_loss: 0.7796, test_loss: 0.8274, test_f1: 0.5778
 epoch: 24, train_loss: 0.7652, test_loss: 0.8156, test_f1: 0.5558
 epoch: 25, train_loss: 0.7577, test_loss: 0.8153, test_f1: 0.5730
 epoch: 26, train_loss: 0.7501, test_loss: 0.8037, test_f1: 0.5734
 epoch: 27, train_loss: 0.7489, test_loss: 0.8497, test_f1: 0.5695
 epoch: 28, train_loss: 0.7457, test_loss: 0.8249, test_f1: 0.5500
 epoch: 29, train_loss: 0.7400, test_loss: 0.7910, test_f1: 0.5595
 epoch: 30, train_loss: 0.7312, test_loss: 0.8291, test_f1: 0.5743
 epoch: 31, train_loss: 0.7290, test_loss: 0.8096, test_f1: 0.5863
 epoch: 32, train_loss: 0.7066, test_loss: 0.8455, test_f1: 0.5748
 epoch: 33, train_loss: 0.7136, test_loss: 0.8349, test_f1: 0.5900
 epoch: 34, train_loss: 0.7020, test_loss: 0.7799, test_f1: 0.6226
 epoch: 35, train_loss: 0.6971, test_loss: 0.7837, test_f1: 0.5963
 epoch: 36, train_loss: 0.6857, test_loss: 0.8123, test_f1: 0.6074
 epoch: 37, train_loss: 0.6809, test_loss: 0.8687, test_f1: 0.5952
 epoch: 38, train_loss: 0.6795, test_loss: 0.8281, test_f1: 0.6103
 epoch: 39, train_loss: 0.6759, test_loss: 0.8238, test_f1: 0.6158
 epoch: 40, train_loss: 0.6790, test_loss: 0.8482, test_f1: 0.5624
 epoch: 41, train_loss: 0.6592, test_loss: 0.8241, test_f1: 0.6167
 epoch: 42, train_loss: 0.6569, test_loss: 0.8321, test_f1: 0.6267
 epoch: 43, train_loss: 0.6525, test_loss: 0.8678, test_f1: 0.6149
 epoch: 44, train_loss: 0.6425, test_loss: 0.9015, test_f1: 0.6099
 epoch: 45, train_loss: 0.6371, test_loss: 0.7786, test_f1: 0.6558
 epoch: 46, train_loss: 0.6447, test_loss: 0.8616, test_f1: 0.6273
 epoch: 47, train_loss: 0.6353, test_loss: 0.8059, test_f1: 0.6351
 epoch: 48, train_loss: 0.6268, test_loss: 0.8388, test_f1: 0.6206
 epoch: 49, train_loss: 0.6234, test_loss: 0.8656, test_f1: 0.6283
 epoch: 50, train_loss: 0.6101, test_loss: 0.8779, test_f1: 0.6390
 epoch: 51, train_loss: 0.6004, test_loss: 0.9553, test_f1: 0.6286
 epoch: 52, train_loss: 0.5956, test_loss: 0.8621, test_f1: 0.6302
 epoch: 53, train_loss: 0.5754, test_loss: 0.8559, test_f1: 0.6239
 epoch: 54, train_loss: 0.5794, test_loss: 0.9028, test_f1: 0.6287
 epoch: 55, train_loss: 0.5770, test_loss: 0.8967, test_f1: 0.6379
 epoch: 56, train_loss: 0.5830, test_loss: 0.8292, test_f1: 0.6372
 epoch: 57, train_loss: 0.5740, test_loss: 0.8125, test_f1: 0.6599
 epoch: 58, train_loss: 0.5655, test_loss: 0.8343, test_f1: 0.6441
 epoch: 59, train_loss: 0.5575, test_loss: 0.9128, test_f1: 0.6200
 epoch: 60, train_loss: 0.5661, test_loss: 0.8615, test_f1: 0.6477
 epoch: 61, train_loss: 0.5662, test_loss: 0.8851, test_f1: 0.6180
 epoch: 62, train_loss: 0.5649, test_loss: 0.8375, test_f1: 0.6433
 epoch: 63, train_loss: 0.5504, test_loss: 0.8268, test_f1: 0.6450
 epoch: 64, train_loss: 0.5504, test_loss: 0.8810, test_f1: 0.6541
 epoch: 65, train_loss: 0.5462, test_loss: 0.9613, test_f1: 0.6403
 epoch: 66, train_loss: 0.5564, test_loss: 0.8792, test_f1: 0.6434
 epoch: 67, train_loss: 0.5419, test_loss: 0.9400, test_f1: 0.6143
 epoch: 68, train_loss: 0.5312, test_loss: 0.9217, test_f1: 0.6280
 epoch: 69, train_loss: 0.5373, test_loss: 0.9686, test_f1: 0.6450
 epoch: 70, train_loss: 0.5413, test_loss: 1.0108, test_f1: 0.6384
 epoch: 71, train_loss: 0.5382, test_loss: 1.0227, test_f1: 0.6407
 epoch: 72, train_loss: 0.5384, test_loss: 0.9650, test_f1: 0.6403
 epoch: 73, train_loss: 0.5294, test_loss: 0.9316, test_f1: 0.6409
 epoch: 74, train_loss: 0.5277, test_loss: 1.0229, test_f1: 0.6433
 epoch: 75, train_loss: 0.5211, test_loss: 1.0042, test_f1: 0.6570
 epoch: 76, train_loss: 0.5355, test_loss: 0.9666, test_f1: 0.6476
 epoch: 77, train_loss: 0.5169, test_loss: 0.9748, test_f1: 0.6408
 epoch: 78, train_loss: 0.5135, test_loss: 0.9723, test_f1: 0.6494
 epoch: 79, train_loss: 0.5183, test_loss: 1.0239, test_f1: 0.6442
 epoch: 80, train_loss: 0.5082, test_loss: 0.9417, test_f1: 0.6403
 epoch: 81, train_loss: 0.5147, test_loss: 0.9673, test_f1: 0.6379
 epoch: 82, train_loss: 0.5115, test_loss: 1.0093, test_f1: 0.6428
 epoch: 83, train_loss: 0.5007, test_loss: 0.9290, test_f1: 0.6436
 epoch: 84, train_loss: 0.4951, test_loss: 1.0290, test_f1: 0.6527
 epoch: 85, train_loss: 0.4986, test_loss: 1.0181, test_f1: 0.6490
 epoch: 86, train_loss: 0.5006, test_loss: 1.0048, test_f1: 0.6518
 epoch: 87, train_loss: 0.5030, test_loss: 0.9986, test_f1: 0.6533
 epoch: 88, train_loss: 0.4933, test_loss: 1.0041, test_f1: 0.6512
 epoch: 89, train_loss: 0.4892, test_loss: 1.0939, test_f1: 0.6383
 epoch: 90, train_loss: 0.4963, test_loss: 1.0852, test_f1: 0.6348
 epoch: 91, train_loss: 0.4822, test_loss: 1.0625, test_f1: 0.6697
 epoch: 92, train_loss: 0.4675, test_loss: 1.0170, test_f1: 0.6435
 epoch: 93, train_loss: 0.4809, test_loss: 1.0261, test_f1: 0.6579
 epoch: 94, train_loss: 0.4734, test_loss: 1.0340, test_f1: 0.6502
 epoch: 95, train_loss: 0.4732, test_loss: 1.0989, test_f1: 0.6569
 epoch: 96, train_loss: 0.4724, test_loss: 1.1000, test_f1: 0.6423
 epoch: 97, train_loss: 0.4686, test_loss: 1.1139, test_f1: 0.6458
 epoch: 98, train_loss: 0.4694, test_loss: 1.1307, test_f1: 0.6538
 epoch: 99, train_loss: 0.4574, test_loss: 1.0254, test_f1: 0.6594
##################ITERATION #1 ****************************************
 epoch: 0, train_loss: 1.1667, test_loss: 1.0233, test_f1: 0.4541
 epoch: 1, train_loss: 1.0097, test_loss: 0.9907, test_f1: 0.4641
 epoch: 2, train_loss: 0.9789, test_loss: 0.9695, test_f1: 0.5076
 epoch: 3, train_loss: 0.9519, test_loss: 0.9486, test_f1: 0.5083
 epoch: 4, train_loss: 0.9322, test_loss: 0.9351, test_f1: 0.5403
 epoch: 5, train_loss: 0.9105, test_loss: 0.9345, test_f1: 0.5218
 epoch: 6, train_loss: 0.9019, test_loss: 0.9401, test_f1: 0.5228
 epoch: 7, train_loss: 0.8962, test_loss: 0.9152, test_f1: 0.5419
 epoch: 8, train_loss: 0.8650, test_loss: 0.9185, test_f1: 0.5463
 epoch: 9, train_loss: 0.8583, test_loss: 0.8974, test_f1: 0.5316
 epoch: 10, train_loss: 0.8478, test_loss: 0.8849, test_f1: 0.5537
 epoch: 11, train_loss: 0.8336, test_loss: 0.8585, test_f1: 0.5587
 epoch: 12, train_loss: 0.8279, test_loss: 0.8717, test_f1: 0.5331
 epoch: 13, train_loss: 0.8165, test_loss: 0.8153, test_f1: 0.5617
 epoch: 14, train_loss: 0.7971, test_loss: 0.8078, test_f1: 0.5635
 epoch: 15, train_loss: 0.7895, test_loss: 0.8155, test_f1: 0.6077
 epoch: 16, train_loss: 0.7868, test_loss: 0.8244, test_f1: 0.5689
 epoch: 17, train_loss: 0.7697, test_loss: 0.7944, test_f1: 0.5987
 epoch: 18, train_loss: 0.7615, test_loss: 0.8185, test_f1: 0.5845
 epoch: 19, train_loss: 0.7527, test_loss: 0.7854, test_f1: 0.5838
 epoch: 20, train_loss: 0.7375, test_loss: 0.7567, test_f1: 0.5912
 epoch: 21, train_loss: 0.7311, test_loss: 0.8407, test_f1: 0.6094
 epoch: 22, train_loss: 0.7278, test_loss: 0.8100, test_f1: 0.6274
 epoch: 23, train_loss: 0.7202, test_loss: 0.8088, test_f1: 0.6447
 epoch: 24, train_loss: 0.7144, test_loss: 0.8181, test_f1: 0.5972
 epoch: 25, train_loss: 0.7215, test_loss: 0.8163, test_f1: 0.5923
 epoch: 26, train_loss: 0.6988, test_loss: 0.8602, test_f1: 0.6075
 epoch: 27, train_loss: 0.6894, test_loss: 0.7882, test_f1: 0.5892
 epoch: 28, train_loss: 0.6791, test_loss: 0.8011, test_f1: 0.6008
 epoch: 29, train_loss: 0.6778, test_loss: 0.8235, test_f1: 0.6439
 epoch: 30, train_loss: 0.6535, test_loss: 0.7433, test_f1: 0.6227
 epoch: 31, train_loss: 0.6620, test_loss: 0.8028, test_f1: 0.6555
 epoch: 32, train_loss: 0.6526, test_loss: 0.7878, test_f1: 0.6236
 epoch: 33, train_loss: 0.6511, test_loss: 0.7691, test_f1: 0.6191
 epoch: 34, train_loss: 0.6432, test_loss: 0.7757, test_f1: 0.6357
 epoch: 35, train_loss: 0.6279, test_loss: 0.7911, test_f1: 0.6289
 epoch: 36, train_loss: 0.6170, test_loss: 0.8106, test_f1: 0.6445
 epoch: 37, train_loss: 0.6246, test_loss: 0.7546, test_f1: 0.6417
 epoch: 38, train_loss: 0.6041, test_loss: 0.8595, test_f1: 0.6241
 epoch: 39, train_loss: 0.6199, test_loss: 0.8627, test_f1: 0.6351
 epoch: 40, train_loss: 0.5984, test_loss: 0.7818, test_f1: 0.6351
 epoch: 41, train_loss: 0.5864, test_loss: 0.9054, test_f1: 0.6403
 epoch: 42, train_loss: 0.6041, test_loss: 0.7874, test_f1: 0.6219
 epoch: 43, train_loss: 0.5845, test_loss: 0.8688, test_f1: 0.6511
 epoch: 44, train_loss: 0.5758, test_loss: 0.8643, test_f1: 0.6460
 epoch: 45, train_loss: 0.5708, test_loss: 0.7862, test_f1: 0.6570
 epoch: 46, train_loss: 0.5724, test_loss: 0.9035, test_f1: 0.6450
 epoch: 47, train_loss: 0.5648, test_loss: 0.8523, test_f1: 0.6374
 epoch: 48, train_loss: 0.5612, test_loss: 0.9130, test_f1: 0.6197
 epoch: 49, train_loss: 0.5569, test_loss: 0.8891, test_f1: 0.6497
 epoch: 50, train_loss: 0.5489, test_loss: 0.9912, test_f1: 0.6178
 epoch: 51, train_loss: 0.5399, test_loss: 0.9434, test_f1: 0.6417
 epoch: 52, train_loss: 0.5227, test_loss: 0.9469, test_f1: 0.6492
 epoch: 53, train_loss: 0.5226, test_loss: 0.9343, test_f1: 0.6359
 epoch: 54, train_loss: 0.5111, test_loss: 0.9764, test_f1: 0.6386
 epoch: 55, train_loss: 0.5121, test_loss: 1.0006, test_f1: 0.6468
 epoch: 56, train_loss: 0.5130, test_loss: 0.9351, test_f1: 0.6412
 epoch: 57, train_loss: 0.4986, test_loss: 0.9580, test_f1: 0.6475
 epoch: 58, train_loss: 0.4906, test_loss: 0.9461, test_f1: 0.6482
 epoch: 59, train_loss: 0.5003, test_loss: 1.0264, test_f1: 0.6408
 epoch: 60, train_loss: 0.4849, test_loss: 0.9595, test_f1: 0.6337
 epoch: 61, train_loss: 0.4847, test_loss: 0.9580, test_f1: 0.6580
 epoch: 62, train_loss: 0.4837, test_loss: 1.0513, test_f1: 0.6407
 epoch: 63, train_loss: 0.4847, test_loss: 0.9698, test_f1: 0.6578
 epoch: 64, train_loss: 0.4872, test_loss: 1.0344, test_f1: 0.6353
 epoch: 65, train_loss: 0.4601, test_loss: 1.0492, test_f1: 0.6307
 epoch: 66, train_loss: 0.4855, test_loss: 1.0036, test_f1: 0.6256
 epoch: 67, train_loss: 0.4751, test_loss: 0.9996, test_f1: 0.6515
 epoch: 68, train_loss: 0.4799, test_loss: 1.0910, test_f1: 0.6340
 epoch: 69, train_loss: 0.4571, test_loss: 1.0905, test_f1: 0.6436
 epoch: 70, train_loss: 0.4615, test_loss: 1.0868, test_f1: 0.6327
 epoch: 71, train_loss: 0.4711, test_loss: 1.1031, test_f1: 0.6481
 epoch: 72, train_loss: 0.4672, test_loss: 1.0833, test_f1: 0.6444
 epoch: 73, train_loss: 0.4669, test_loss: 1.0780, test_f1: 0.6448
 epoch: 74, train_loss: 0.4545, test_loss: 1.2158, test_f1: 0.6304
 epoch: 75, train_loss: 0.4641, test_loss: 1.1763, test_f1: 0.6444
 epoch: 76, train_loss: 0.4550, test_loss: 1.1331, test_f1: 0.6399
 epoch: 77, train_loss: 0.4574, test_loss: 1.1739, test_f1: 0.6393
 epoch: 78, train_loss: 0.4456, test_loss: 1.1381, test_f1: 0.6392
 epoch: 79, train_loss: 0.4398, test_loss: 1.1733, test_f1: 0.6463
 epoch: 80, train_loss: 0.4325, test_loss: 1.1661, test_f1: 0.6417
 epoch: 81, train_loss: 0.4365, test_loss: 1.1753, test_f1: 0.6326
 epoch: 82, train_loss: 0.4386, test_loss: 1.1675, test_f1: 0.6369
 epoch: 83, train_loss: 0.4354, test_loss: 1.1310, test_f1: 0.6271
 epoch: 84, train_loss: 0.4253, test_loss: 1.2475, test_f1: 0.6334
 epoch: 85, train_loss: 0.4354, test_loss: 1.1930, test_f1: 0.6364
 epoch: 86, train_loss: 0.4277, test_loss: 1.2114, test_f1: 0.6474
 epoch: 87, train_loss: 0.4292, test_loss: 1.2494, test_f1: 0.6426
 epoch: 88, train_loss: 0.4147, test_loss: 1.2240, test_f1: 0.6461
 epoch: 89, train_loss: 0.4175, test_loss: 1.3357, test_f1: 0.6220
 epoch: 90, train_loss: 0.4203, test_loss: 1.2272, test_f1: 0.6473
 epoch: 91, train_loss: 0.4180, test_loss: 1.2527, test_f1: 0.6408
 epoch: 92, train_loss: 0.4148, test_loss: 1.1668, test_f1: 0.6514
 epoch: 93, train_loss: 0.4117, test_loss: 1.2005, test_f1: 0.6470
 epoch: 94, train_loss: 0.4079, test_loss: 1.2343, test_f1: 0.6444
 epoch: 95, train_loss: 0.4201, test_loss: 1.2547, test_f1: 0.6385
 epoch: 96, train_loss: 0.4151, test_loss: 1.3223, test_f1: 0.6329
 epoch: 97, train_loss: 0.4019, test_loss: 1.3418, test_f1: 0.6369
 epoch: 98, train_loss: 0.4044, test_loss: 1.3396, test_f1: 0.6351
 epoch: 99, train_loss: 0.3983, test_loss: 1.3019, test_f1: 0.6506
##################ITERATION #2 ****************************************
 epoch: 0, train_loss: 1.1225, test_loss: 1.0201, test_f1: 0.4905
 epoch: 1, train_loss: 0.9988, test_loss: 0.9655, test_f1: 0.5167
 epoch: 2, train_loss: 0.9607, test_loss: 0.9334, test_f1: 0.5331
 epoch: 3, train_loss: 0.9370, test_loss: 0.9259, test_f1: 0.5505
 epoch: 4, train_loss: 0.9215, test_loss: 0.8849, test_f1: 0.5543
 epoch: 5, train_loss: 0.8993, test_loss: 0.8784, test_f1: 0.5447
 epoch: 6, train_loss: 0.8798, test_loss: 0.8633, test_f1: 0.5487
 epoch: 7, train_loss: 0.8622, test_loss: 0.8357, test_f1: 0.5708
 epoch: 8, train_loss: 0.8525, test_loss: 0.8483, test_f1: 0.5633
 epoch: 9, train_loss: 0.8457, test_loss: 0.8252, test_f1: 0.5650
 epoch: 10, train_loss: 0.8304, test_loss: 0.8276, test_f1: 0.5677
 epoch: 11, train_loss: 0.8133, test_loss: 0.8215, test_f1: 0.5835
 epoch: 12, train_loss: 0.8149, test_loss: 0.8279, test_f1: 0.5813
 epoch: 13, train_loss: 0.8085, test_loss: 0.8156, test_f1: 0.5684
 epoch: 14, train_loss: 0.7748, test_loss: 0.7957, test_f1: 0.6072
 epoch: 15, train_loss: 0.7693, test_loss: 0.8116, test_f1: 0.5835
 epoch: 16, train_loss: 0.7716, test_loss: 0.7747, test_f1: 0.6025
 epoch: 17, train_loss: 0.7587, test_loss: 0.7592, test_f1: 0.6046
 epoch: 18, train_loss: 0.7340, test_loss: 0.8034, test_f1: 0.5862
 epoch: 19, train_loss: 0.7371, test_loss: 0.7828, test_f1: 0.6117
 epoch: 20, train_loss: 0.7293, test_loss: 0.7519, test_f1: 0.5956
 epoch: 21, train_loss: 0.7203, test_loss: 0.7706, test_f1: 0.6238
 epoch: 22, train_loss: 0.7129, test_loss: 0.7992, test_f1: 0.5888
 epoch: 23, train_loss: 0.6999, test_loss: 0.7948, test_f1: 0.6185
 epoch: 24, train_loss: 0.6962, test_loss: 0.7744, test_f1: 0.6267
 epoch: 25, train_loss: 0.6864, test_loss: 0.7800, test_f1: 0.6073
 epoch: 26, train_loss: 0.6752, test_loss: 0.7866, test_f1: 0.6471
 epoch: 27, train_loss: 0.6718, test_loss: 0.7712, test_f1: 0.6577
 epoch: 28, train_loss: 0.6643, test_loss: 0.8224, test_f1: 0.6022
 epoch: 29, train_loss: 0.6401, test_loss: 0.8026, test_f1: 0.6006
 epoch: 30, train_loss: 0.6557, test_loss: 0.7654, test_f1: 0.6318
 epoch: 31, train_loss: 0.6337, test_loss: 0.8215, test_f1: 0.6190
 epoch: 32, train_loss: 0.6300, test_loss: 0.8055, test_f1: 0.6014
 epoch: 33, train_loss: 0.6215, test_loss: 0.8166, test_f1: 0.6661
 epoch: 34, train_loss: 0.6294, test_loss: 0.7765, test_f1: 0.6313
 epoch: 35, train_loss: 0.6043, test_loss: 0.7947, test_f1: 0.6215
 epoch: 36, train_loss: 0.6098, test_loss: 0.8042, test_f1: 0.6268
 epoch: 37, train_loss: 0.6037, test_loss: 0.8248, test_f1: 0.6288
 epoch: 38, train_loss: 0.5933, test_loss: 0.8103, test_f1: 0.6372
 epoch: 39, train_loss: 0.5840, test_loss: 0.8371, test_f1: 0.6124
 epoch: 40, train_loss: 0.5869, test_loss: 0.8081, test_f1: 0.6230
 epoch: 41, train_loss: 0.5838, test_loss: 0.7916, test_f1: 0.6452
 epoch: 42, train_loss: 0.5674, test_loss: 0.7605, test_f1: 0.6701
 epoch: 43, train_loss: 0.5636, test_loss: 0.8306, test_f1: 0.6213
 epoch: 44, train_loss: 0.5479, test_loss: 0.8875, test_f1: 0.6234
 epoch: 45, train_loss: 0.5626, test_loss: 0.8409, test_f1: 0.6117
 epoch: 46, train_loss: 0.5434, test_loss: 0.7817, test_f1: 0.6472
 epoch: 47, train_loss: 0.5278, test_loss: 0.7874, test_f1: 0.6498
 epoch: 48, train_loss: 0.5433, test_loss: 0.8542, test_f1: 0.6364
 epoch: 49, train_loss: 0.5280, test_loss: 0.8391, test_f1: 0.6292
 epoch: 50, train_loss: 0.5278, test_loss: 0.8825, test_f1: 0.6323
 epoch: 51, train_loss: 0.5042, test_loss: 0.8642, test_f1: 0.6180
 epoch: 52, train_loss: 0.5096, test_loss: 0.8884, test_f1: 0.6318
 epoch: 53, train_loss: 0.4883, test_loss: 0.9031, test_f1: 0.6360
 epoch: 54, train_loss: 0.4736, test_loss: 0.9288, test_f1: 0.6404
 epoch: 55, train_loss: 0.4745, test_loss: 0.8518, test_f1: 0.6455
 epoch: 56, train_loss: 0.4640, test_loss: 0.9295, test_f1: 0.6338
 epoch: 57, train_loss: 0.4824, test_loss: 0.9163, test_f1: 0.6290
 epoch: 58, train_loss: 0.4759, test_loss: 0.9724, test_f1: 0.6361
 epoch: 59, train_loss: 0.4627, test_loss: 0.9405, test_f1: 0.6182
 epoch: 60, train_loss: 0.4599, test_loss: 0.9273, test_f1: 0.6221
 epoch: 61, train_loss: 0.4530, test_loss: 0.9567, test_f1: 0.6547
 epoch: 62, train_loss: 0.4608, test_loss: 0.9510, test_f1: 0.6446
 epoch: 63, train_loss: 0.4502, test_loss: 0.9405, test_f1: 0.6444
 epoch: 64, train_loss: 0.4447, test_loss: 0.9637, test_f1: 0.6480
 epoch: 65, train_loss: 0.4508, test_loss: 1.0465, test_f1: 0.6050
 epoch: 66, train_loss: 0.4531, test_loss: 0.9893, test_f1: 0.6382
 epoch: 67, train_loss: 0.4497, test_loss: 1.0099, test_f1: 0.6307
 epoch: 68, train_loss: 0.4376, test_loss: 1.0130, test_f1: 0.6225
 epoch: 69, train_loss: 0.4380, test_loss: 0.9849, test_f1: 0.6365
 epoch: 70, train_loss: 0.4349, test_loss: 0.9553, test_f1: 0.6379
 epoch: 71, train_loss: 0.4307, test_loss: 0.9814, test_f1: 0.6364
 epoch: 72, train_loss: 0.4391, test_loss: 0.9772, test_f1: 0.6385
 epoch: 73, train_loss: 0.4318, test_loss: 1.0613, test_f1: 0.6293
 epoch: 74, train_loss: 0.4351, test_loss: 1.0291, test_f1: 0.6505
 epoch: 75, train_loss: 0.4201, test_loss: 1.0505, test_f1: 0.6639
 epoch: 76, train_loss: 0.4071, test_loss: 1.0225, test_f1: 0.6399
 epoch: 77, train_loss: 0.4199, test_loss: 1.0665, test_f1: 0.6439
 epoch: 78, train_loss: 0.4087, test_loss: 1.0738, test_f1: 0.6339
 epoch: 79, train_loss: 0.4181, test_loss: 1.1231, test_f1: 0.6219
 epoch: 80, train_loss: 0.3981, test_loss: 1.0233, test_f1: 0.6609
 epoch: 81, train_loss: 0.3916, test_loss: 1.0957, test_f1: 0.6382
 epoch: 82, train_loss: 0.4101, test_loss: 1.0583, test_f1: 0.6422
 epoch: 83, train_loss: 0.3974, test_loss: 1.1427, test_f1: 0.6167
 epoch: 84, train_loss: 0.4141, test_loss: 1.1204, test_f1: 0.6336
 epoch: 85, train_loss: 0.3956, test_loss: 1.1051, test_f1: 0.6163
 epoch: 86, train_loss: 0.3938, test_loss: 1.0659, test_f1: 0.6270
 epoch: 87, train_loss: 0.4004, test_loss: 1.1361, test_f1: 0.6627
 epoch: 88, train_loss: 0.3775, test_loss: 1.1235, test_f1: 0.6496
 epoch: 89, train_loss: 0.3647, test_loss: 1.1703, test_f1: 0.6377
 epoch: 90, train_loss: 0.3767, test_loss: 1.1380, test_f1: 0.6402
 epoch: 91, train_loss: 0.3799, test_loss: 1.2068, test_f1: 0.6402
 epoch: 92, train_loss: 0.3804, test_loss: 1.1937, test_f1: 0.6296
 epoch: 93, train_loss: 0.3872, test_loss: 1.1958, test_f1: 0.6437
 epoch: 94, train_loss: 0.3710, test_loss: 1.1361, test_f1: 0.6595
 epoch: 95, train_loss: 0.3699, test_loss: 1.1153, test_f1: 0.6426
 epoch: 96, train_loss: 0.3603, test_loss: 1.1642, test_f1: 0.6199
 epoch: 97, train_loss: 0.3704, test_loss: 1.2411, test_f1: 0.6528
 epoch: 98, train_loss: 0.3646, test_loss: 1.1410, test_f1: 0.6313
 epoch: 99, train_loss: 0.3524, test_loss: 1.2385, test_f1: 0.6316
##################ITERATION #3 ****************************************
 epoch: 0, train_loss: 1.1015, test_loss: 0.9776, test_f1: 0.5176
 epoch: 1, train_loss: 0.9821, test_loss: 0.9519, test_f1: 0.5446
 epoch: 2, train_loss: 0.9621, test_loss: 0.9169, test_f1: 0.5246
 epoch: 3, train_loss: 0.9380, test_loss: 0.9023, test_f1: 0.5378
 epoch: 4, train_loss: 0.9112, test_loss: 0.8898, test_f1: 0.5543
 epoch: 5, train_loss: 0.8968, test_loss: 0.8704, test_f1: 0.5578
 epoch: 6, train_loss: 0.8692, test_loss: 0.8622, test_f1: 0.5502
 epoch: 7, train_loss: 0.8691, test_loss: 0.8430, test_f1: 0.5477
 epoch: 8, train_loss: 0.8497, test_loss: 0.8155, test_f1: 0.5634
 epoch: 9, train_loss: 0.8288, test_loss: 0.8085, test_f1: 0.5838
 epoch: 10, train_loss: 0.8273, test_loss: 0.8321, test_f1: 0.5924
 epoch: 11, train_loss: 0.8115, test_loss: 0.7947, test_f1: 0.5935
 epoch: 12, train_loss: 0.7846, test_loss: 0.7943, test_f1: 0.6182
 epoch: 13, train_loss: 0.7880, test_loss: 0.7694, test_f1: 0.6269
 epoch: 14, train_loss: 0.7765, test_loss: 0.7327, test_f1: 0.6236
 epoch: 15, train_loss: 0.7801, test_loss: 0.7328, test_f1: 0.6556
 epoch: 16, train_loss: 0.7535, test_loss: 0.7401, test_f1: 0.6524
 epoch: 17, train_loss: 0.7525, test_loss: 0.7704, test_f1: 0.6567
 epoch: 18, train_loss: 0.7356, test_loss: 0.7402, test_f1: 0.6344
 epoch: 19, train_loss: 0.7255, test_loss: 0.7110, test_f1: 0.6590
 epoch: 20, train_loss: 0.7091, test_loss: 0.6944, test_f1: 0.6812
 epoch: 21, train_loss: 0.6997, test_loss: 0.7088, test_f1: 0.6805
 epoch: 22, train_loss: 0.6863, test_loss: 0.7293, test_f1: 0.6570
 epoch: 23, train_loss: 0.6917, test_loss: 0.7133, test_f1: 0.6550
 epoch: 24, train_loss: 0.6854, test_loss: 0.7061, test_f1: 0.6571
 epoch: 25, train_loss: 0.6693, test_loss: 0.7096, test_f1: 0.6706
 epoch: 26, train_loss: 0.6670, test_loss: 0.7080, test_f1: 0.6611
 epoch: 27, train_loss: 0.6579, test_loss: 0.7248, test_f1: 0.6542
 epoch: 28, train_loss: 0.6491, test_loss: 0.7153, test_f1: 0.6665
 epoch: 29, train_loss: 0.6412, test_loss: 0.7001, test_f1: 0.6600
 epoch: 30, train_loss: 0.6306, test_loss: 0.7510, test_f1: 0.6498
 epoch: 31, train_loss: 0.6258, test_loss: 0.7470, test_f1: 0.6404
 epoch: 32, train_loss: 0.6133, test_loss: 0.7976, test_f1: 0.6313
 epoch: 33, train_loss: 0.6059, test_loss: 0.7159, test_f1: 0.6804
 epoch: 34, train_loss: 0.6017, test_loss: 0.7906, test_f1: 0.6544
 epoch: 35, train_loss: 0.5940, test_loss: 0.8477, test_f1: 0.6163
 epoch: 36, train_loss: 0.5815, test_loss: 0.7737, test_f1: 0.6671
 epoch: 37, train_loss: 0.5795, test_loss: 0.8509, test_f1: 0.6227
 epoch: 38, train_loss: 0.5785, test_loss: 0.7449, test_f1: 0.6617
 epoch: 39, train_loss: 0.5722, test_loss: 0.8084, test_f1: 0.6471
 epoch: 40, train_loss: 0.5638, test_loss: 0.8233, test_f1: 0.6336
 epoch: 41, train_loss: 0.5629, test_loss: 0.8616, test_f1: 0.6286
 epoch: 42, train_loss: 0.5586, test_loss: 0.7912, test_f1: 0.6720
 epoch: 43, train_loss: 0.5498, test_loss: 0.7799, test_f1: 0.6625
 epoch: 44, train_loss: 0.5372, test_loss: 0.8108, test_f1: 0.6696
 epoch: 45, train_loss: 0.5254, test_loss: 0.8170, test_f1: 0.6670
 epoch: 46, train_loss: 0.5160, test_loss: 0.7995, test_f1: 0.6531
 epoch: 47, train_loss: 0.5208, test_loss: 0.8418, test_f1: 0.6567
 epoch: 48, train_loss: 0.5292, test_loss: 0.8816, test_f1: 0.6601
 epoch: 49, train_loss: 0.5169, test_loss: 0.8986, test_f1: 0.6625
 epoch: 50, train_loss: 0.5131, test_loss: 0.9199, test_f1: 0.6588
 epoch: 51, train_loss: 0.4941, test_loss: 0.8817, test_f1: 0.6702
 epoch: 52, train_loss: 0.4688, test_loss: 0.8813, test_f1: 0.6813
 epoch: 53, train_loss: 0.4761, test_loss: 0.9377, test_f1: 0.6585
 epoch: 54, train_loss: 0.4603, test_loss: 0.9172, test_f1: 0.6567
 epoch: 55, train_loss: 0.4499, test_loss: 0.9459, test_f1: 0.6520
 epoch: 56, train_loss: 0.4612, test_loss: 0.9381, test_f1: 0.6667
 epoch: 57, train_loss: 0.4529, test_loss: 0.9403, test_f1: 0.6780
 epoch: 58, train_loss: 0.4540, test_loss: 0.9776, test_f1: 0.6707
 epoch: 59, train_loss: 0.4496, test_loss: 0.9498, test_f1: 0.6824
 epoch: 60, train_loss: 0.4431, test_loss: 0.9600, test_f1: 0.6885
 epoch: 61, train_loss: 0.4471, test_loss: 0.9740, test_f1: 0.6674
 epoch: 62, train_loss: 0.4346, test_loss: 0.9865, test_f1: 0.6787
 epoch: 63, train_loss: 0.4311, test_loss: 0.9514, test_f1: 0.6731
 epoch: 64, train_loss: 0.4421, test_loss: 0.9863, test_f1: 0.6853
 epoch: 65, train_loss: 0.4311, test_loss: 1.0103, test_f1: 0.6566
 epoch: 66, train_loss: 0.4311, test_loss: 0.9744, test_f1: 0.6665
 epoch: 67, train_loss: 0.4199, test_loss: 1.0450, test_f1: 0.6640
 epoch: 68, train_loss: 0.4120, test_loss: 1.0288, test_f1: 0.6711
 epoch: 69, train_loss: 0.4228, test_loss: 1.0294, test_f1: 0.6820
 epoch: 70, train_loss: 0.4017, test_loss: 1.0777, test_f1: 0.6670
 epoch: 71, train_loss: 0.4143, test_loss: 1.0397, test_f1: 0.6738
 epoch: 72, train_loss: 0.4277, test_loss: 1.0849, test_f1: 0.6461
 epoch: 73, train_loss: 0.4090, test_loss: 1.1270, test_f1: 0.6635
 epoch: 74, train_loss: 0.3946, test_loss: 1.1166, test_f1: 0.6771
 epoch: 75, train_loss: 0.3963, test_loss: 1.0466, test_f1: 0.6742
 epoch: 76, train_loss: 0.4047, test_loss: 1.1021, test_f1: 0.6730
 epoch: 77, train_loss: 0.4011, test_loss: 1.1626, test_f1: 0.6649
 epoch: 78, train_loss: 0.3977, test_loss: 1.1775, test_f1: 0.6586
 epoch: 79, train_loss: 0.4017, test_loss: 1.1368, test_f1: 0.6888
 epoch: 80, train_loss: 0.3738, test_loss: 1.1435, test_f1: 0.6571
 epoch: 81, train_loss: 0.3874, test_loss: 1.1818, test_f1: 0.6529
 epoch: 82, train_loss: 0.3973, test_loss: 1.1714, test_f1: 0.6781
 epoch: 83, train_loss: 0.3688, test_loss: 1.1298, test_f1: 0.6712
 epoch: 84, train_loss: 0.3813, test_loss: 1.1992, test_f1: 0.6798
 epoch: 85, train_loss: 0.3774, test_loss: 1.1898, test_f1: 0.6759
 epoch: 86, train_loss: 0.3651, test_loss: 1.1863, test_f1: 0.6959
 epoch: 87, train_loss: 0.3638, test_loss: 1.2408, test_f1: 0.6707
 epoch: 88, train_loss: 0.3684, test_loss: 1.2685, test_f1: 0.6785
 epoch: 89, train_loss: 0.3729, test_loss: 1.2535, test_f1: 0.6763
 epoch: 90, train_loss: 0.3574, test_loss: 1.2934, test_f1: 0.6565
 epoch: 91, train_loss: 0.3687, test_loss: 1.2409, test_f1: 0.6728
 epoch: 92, train_loss: 0.3564, test_loss: 1.2603, test_f1: 0.6605
 epoch: 93, train_loss: 0.3655, test_loss: 1.3503, test_f1: 0.6637
 epoch: 94, train_loss: 0.3674, test_loss: 1.2035, test_f1: 0.6830
 epoch: 95, train_loss: 0.3562, test_loss: 1.2308, test_f1: 0.6578
 epoch: 96, train_loss: 0.3410, test_loss: 1.3205, test_f1: 0.6607
 epoch: 97, train_loss: 0.3429, test_loss: 1.2779, test_f1: 0.6711
 epoch: 98, train_loss: 0.3420, test_loss: 1.2444, test_f1: 0.6854
 epoch: 99, train_loss: 0.3409, test_loss: 1.3193, test_f1: 0.6423
##################ITERATION #4 ****************************************
 epoch: 0, train_loss: 1.1158, test_loss: 0.9767, test_f1: 0.4935
 epoch: 1, train_loss: 0.9908, test_loss: 0.9408, test_f1: 0.4966
 epoch: 2, train_loss: 0.9671, test_loss: 0.9129, test_f1: 0.5031
 epoch: 3, train_loss: 0.9341, test_loss: 0.9168, test_f1: 0.5158
 epoch: 4, train_loss: 0.9200, test_loss: 0.8749, test_f1: 0.5386
 epoch: 5, train_loss: 0.8975, test_loss: 0.8893, test_f1: 0.5689
 epoch: 6, train_loss: 0.8877, test_loss: 0.8585, test_f1: 0.5620
 epoch: 7, train_loss: 0.8652, test_loss: 0.8607, test_f1: 0.5690
 epoch: 8, train_loss: 0.8524, test_loss: 0.8799, test_f1: 0.5717
 epoch: 9, train_loss: 0.8487, test_loss: 0.8470, test_f1: 0.6086
 epoch: 10, train_loss: 0.8219, test_loss: 0.8168, test_f1: 0.5799
 epoch: 11, train_loss: 0.8081, test_loss: 0.8234, test_f1: 0.5807
 epoch: 12, train_loss: 0.7969, test_loss: 0.8207, test_f1: 0.5717
 epoch: 13, train_loss: 0.7879, test_loss: 0.7875, test_f1: 0.6059
 epoch: 14, train_loss: 0.7753, test_loss: 0.7971, test_f1: 0.5998
 epoch: 15, train_loss: 0.7570, test_loss: 0.8104, test_f1: 0.6084
 epoch: 16, train_loss: 0.7580, test_loss: 0.7889, test_f1: 0.5977
 epoch: 17, train_loss: 0.7503, test_loss: 0.7907, test_f1: 0.6133
 epoch: 18, train_loss: 0.7283, test_loss: 0.7521, test_f1: 0.6839
 epoch: 19, train_loss: 0.7311, test_loss: 0.7495, test_f1: 0.6680
 epoch: 20, train_loss: 0.7233, test_loss: 0.7680, test_f1: 0.6452
 epoch: 21, train_loss: 0.6941, test_loss: 0.7665, test_f1: 0.6318
 epoch: 22, train_loss: 0.6902, test_loss: 0.7348, test_f1: 0.6529
 epoch: 23, train_loss: 0.6730, test_loss: 0.7084, test_f1: 0.6695
 epoch: 24, train_loss: 0.6839, test_loss: 0.7322, test_f1: 0.6280
 epoch: 25, train_loss: 0.6631, test_loss: 0.7316, test_f1: 0.6302
 epoch: 26, train_loss: 0.6649, test_loss: 0.8060, test_f1: 0.6108
 epoch: 27, train_loss: 0.6534, test_loss: 0.7828, test_f1: 0.6136
 epoch: 28, train_loss: 0.6488, test_loss: 0.7520, test_f1: 0.6331
 epoch: 29, train_loss: 0.6289, test_loss: 0.7442, test_f1: 0.6403
 epoch: 30, train_loss: 0.6277, test_loss: 0.7283, test_f1: 0.6620
 epoch: 31, train_loss: 0.6164, test_loss: 0.7539, test_f1: 0.6737
 epoch: 32, train_loss: 0.6143, test_loss: 0.7493, test_f1: 0.6656
 epoch: 33, train_loss: 0.6185, test_loss: 0.6837, test_f1: 0.6943
 epoch: 34, train_loss: 0.5993, test_loss: 0.7879, test_f1: 0.6309
 epoch: 35, train_loss: 0.5854, test_loss: 0.7702, test_f1: 0.6886
 epoch: 36, train_loss: 0.5936, test_loss: 0.7897, test_f1: 0.6728
 epoch: 37, train_loss: 0.5740, test_loss: 0.7333, test_f1: 0.6789
 epoch: 38, train_loss: 0.5805, test_loss: 0.7395, test_f1: 0.6666
 epoch: 39, train_loss: 0.5674, test_loss: 0.7246, test_f1: 0.6772
 epoch: 40, train_loss: 0.5692, test_loss: 0.8400, test_f1: 0.6380
 epoch: 41, train_loss: 0.5492, test_loss: 0.7434, test_f1: 0.6698
 epoch: 42, train_loss: 0.5581, test_loss: 0.8308, test_f1: 0.6322
 epoch: 43, train_loss: 0.5508, test_loss: 0.8324, test_f1: 0.6483
 epoch: 44, train_loss: 0.5416, test_loss: 0.9469, test_f1: 0.6322
 epoch: 45, train_loss: 0.5509, test_loss: 0.8152, test_f1: 0.6356
 epoch: 46, train_loss: 0.5305, test_loss: 0.8443, test_f1: 0.6500
 epoch: 47, train_loss: 0.5239, test_loss: 0.8535, test_f1: 0.6562
 epoch: 48, train_loss: 0.5130, test_loss: 0.8117, test_f1: 0.6520
 epoch: 49, train_loss: 0.5171, test_loss: 0.8222, test_f1: 0.6248
 epoch: 50, train_loss: 0.5219, test_loss: 0.9099, test_f1: 0.6419
 epoch: 51, train_loss: 0.4866, test_loss: 0.8004, test_f1: 0.6700
 epoch: 52, train_loss: 0.4808, test_loss: 0.8836, test_f1: 0.6396
 epoch: 53, train_loss: 0.4754, test_loss: 0.8358, test_f1: 0.6699
 epoch: 54, train_loss: 0.4854, test_loss: 0.8846, test_f1: 0.6458
 epoch: 55, train_loss: 0.4524, test_loss: 0.8200, test_f1: 0.6559
 epoch: 56, train_loss: 0.4582, test_loss: 0.9140, test_f1: 0.6517
 epoch: 57, train_loss: 0.4640, test_loss: 0.8873, test_f1: 0.6543
 epoch: 58, train_loss: 0.4554, test_loss: 0.8820, test_f1: 0.6416
 epoch: 59, train_loss: 0.4495, test_loss: 0.9110, test_f1: 0.6440
 epoch: 60, train_loss: 0.4513, test_loss: 0.8350, test_f1: 0.6546
 epoch: 61, train_loss: 0.4535, test_loss: 0.9374, test_f1: 0.6482
 epoch: 62, train_loss: 0.4482, test_loss: 0.9188, test_f1: 0.6297
 epoch: 63, train_loss: 0.4360, test_loss: 0.9421, test_f1: 0.6589
 epoch: 64, train_loss: 0.4256, test_loss: 0.9281, test_f1: 0.6384
 epoch: 65, train_loss: 0.4250, test_loss: 0.9468, test_f1: 0.6529
 epoch: 66, train_loss: 0.4234, test_loss: 0.9877, test_f1: 0.6605
 epoch: 67, train_loss: 0.4168, test_loss: 0.9491, test_f1: 0.6391
 epoch: 68, train_loss: 0.4202, test_loss: 1.0322, test_f1: 0.6366
 epoch: 69, train_loss: 0.4299, test_loss: 1.1020, test_f1: 0.6480
 epoch: 70, train_loss: 0.4212, test_loss: 1.0539, test_f1: 0.6562
 epoch: 71, train_loss: 0.4209, test_loss: 0.9112, test_f1: 0.6495
 epoch: 72, train_loss: 0.4133, test_loss: 1.0367, test_f1: 0.6631
 epoch: 73, train_loss: 0.4148, test_loss: 0.9956, test_f1: 0.6644
 epoch: 74, train_loss: 0.4018, test_loss: 1.0691, test_f1: 0.6649
 epoch: 75, train_loss: 0.4047, test_loss: 1.0762, test_f1: 0.6424
 epoch: 76, train_loss: 0.4031, test_loss: 0.9287, test_f1: 0.6703
 epoch: 77, train_loss: 0.4162, test_loss: 1.0218, test_f1: 0.6635
 epoch: 78, train_loss: 0.4036, test_loss: 1.0167, test_f1: 0.6259
 epoch: 79, train_loss: 0.4019, test_loss: 1.1095, test_f1: 0.6491
 epoch: 80, train_loss: 0.3855, test_loss: 1.0558, test_f1: 0.6523
 epoch: 81, train_loss: 0.3974, test_loss: 1.0925, test_f1: 0.6512
 epoch: 82, train_loss: 0.3923, test_loss: 1.1439, test_f1: 0.6409
 epoch: 83, train_loss: 0.3800, test_loss: 1.0453, test_f1: 0.6531
 epoch: 84, train_loss: 0.3828, test_loss: 1.1957, test_f1: 0.6503
 epoch: 85, train_loss: 0.3892, test_loss: 1.1159, test_f1: 0.6553
 epoch: 86, train_loss: 0.3627, test_loss: 1.1666, test_f1: 0.6330
 epoch: 87, train_loss: 0.3768, test_loss: 1.1384, test_f1: 0.6650
 epoch: 88, train_loss: 0.3496, test_loss: 1.0841, test_f1: 0.6509
 epoch: 89, train_loss: 0.3712, test_loss: 1.3030, test_f1: 0.6433
 epoch: 90, train_loss: 0.3716, test_loss: 1.2419, test_f1: 0.6619
 epoch: 91, train_loss: 0.3798, test_loss: 1.1820, test_f1: 0.6497
 epoch: 92, train_loss: 0.3763, test_loss: 1.1687, test_f1: 0.6464
 epoch: 93, train_loss: 0.3708, test_loss: 1.2819, test_f1: 0.6574
 epoch: 94, train_loss: 0.3637, test_loss: 1.2423, test_f1: 0.6618
 epoch: 95, train_loss: 0.3682, test_loss: 1.2111, test_f1: 0.6462
 epoch: 96, train_loss: 0.3509, test_loss: 1.2856, test_f1: 0.6398
 epoch: 97, train_loss: 0.3411, test_loss: 1.2598, test_f1: 0.6580
 epoch: 98, train_loss: 0.3525, test_loss: 1.0839, test_f1: 0.6649
 epoch: 99, train_loss: 0.3400, test_loss: 1.2637, test_f1: 0.6588
##################ITERATION #5 ****************************************
 epoch: 0, train_loss: 1.1753, test_loss: 0.9883, test_f1: 0.4942
 epoch: 1, train_loss: 1.0108, test_loss: 0.9586, test_f1: 0.5184
 epoch: 2, train_loss: 0.9689, test_loss: 0.9227, test_f1: 0.5099
 epoch: 3, train_loss: 0.9446, test_loss: 0.9259, test_f1: 0.5082
 epoch: 4, train_loss: 0.9301, test_loss: 0.8874, test_f1: 0.5240
 epoch: 5, train_loss: 0.9060, test_loss: 0.8744, test_f1: 0.5495
 epoch: 6, train_loss: 0.8971, test_loss: 0.8294, test_f1: 0.5609
 epoch: 7, train_loss: 0.8769, test_loss: 0.8167, test_f1: 0.5470
 epoch: 8, train_loss: 0.8581, test_loss: 0.8034, test_f1: 0.5815
 epoch: 9, train_loss: 0.8489, test_loss: 0.7966, test_f1: 0.5961
 epoch: 10, train_loss: 0.8398, test_loss: 0.8583, test_f1: 0.5559
 epoch: 11, train_loss: 0.8241, test_loss: 0.7900, test_f1: 0.5877
 epoch: 12, train_loss: 0.8217, test_loss: 0.8160, test_f1: 0.5998
 epoch: 13, train_loss: 0.7973, test_loss: 0.7744, test_f1: 0.6125
 epoch: 14, train_loss: 0.7899, test_loss: 0.8093, test_f1: 0.5863
 epoch: 15, train_loss: 0.7909, test_loss: 0.7971, test_f1: 0.6281
 epoch: 16, train_loss: 0.7824, test_loss: 0.8046, test_f1: 0.5983
 epoch: 17, train_loss: 0.7632, test_loss: 0.8157, test_f1: 0.6004
 epoch: 18, train_loss: 0.7453, test_loss: 0.7549, test_f1: 0.6436
 epoch: 19, train_loss: 0.7322, test_loss: 0.7404, test_f1: 0.6256
 epoch: 20, train_loss: 0.7342, test_loss: 0.7773, test_f1: 0.6350
 epoch: 21, train_loss: 0.7331, test_loss: 0.7853, test_f1: 0.6193
 epoch: 22, train_loss: 0.7128, test_loss: 0.7614, test_f1: 0.6407
 epoch: 23, train_loss: 0.7130, test_loss: 0.7269, test_f1: 0.6777
 epoch: 24, train_loss: 0.6937, test_loss: 0.7417, test_f1: 0.6037
 epoch: 25, train_loss: 0.6925, test_loss: 0.7376, test_f1: 0.6480
 epoch: 26, train_loss: 0.6870, test_loss: 0.7142, test_f1: 0.6621
 epoch: 27, train_loss: 0.6791, test_loss: 0.7440, test_f1: 0.6427
 epoch: 28, train_loss: 0.6606, test_loss: 0.7544, test_f1: 0.6437
 epoch: 29, train_loss: 0.6653, test_loss: 0.7347, test_f1: 0.6488
 epoch: 30, train_loss: 0.6572, test_loss: 0.7615, test_f1: 0.6273
 epoch: 31, train_loss: 0.6351, test_loss: 0.7524, test_f1: 0.6416
 epoch: 32, train_loss: 0.6393, test_loss: 0.8721, test_f1: 0.6403
 epoch: 33, train_loss: 0.6395, test_loss: 0.7669, test_f1: 0.6380
 epoch: 34, train_loss: 0.6206, test_loss: 0.8699, test_f1: 0.6282
 epoch: 35, train_loss: 0.6374, test_loss: 0.7874, test_f1: 0.6427
 epoch: 36, train_loss: 0.6110, test_loss: 0.7567, test_f1: 0.6388
 epoch: 37, train_loss: 0.6052, test_loss: 0.8472, test_f1: 0.6299
 epoch: 38, train_loss: 0.5918, test_loss: 0.8964, test_f1: 0.6070
 epoch: 39, train_loss: 0.5923, test_loss: 0.8157, test_f1: 0.6348
 epoch: 40, train_loss: 0.5898, test_loss: 0.8156, test_f1: 0.6261
 epoch: 41, train_loss: 0.5747, test_loss: 0.8602, test_f1: 0.6614
 epoch: 42, train_loss: 0.5725, test_loss: 0.8113, test_f1: 0.6588
 epoch: 43, train_loss: 0.5718, test_loss: 0.7892, test_f1: 0.6504
 epoch: 44, train_loss: 0.5718, test_loss: 0.8676, test_f1: 0.6551
 epoch: 45, train_loss: 0.5598, test_loss: 0.8235, test_f1: 0.6329
 epoch: 46, train_loss: 0.5524, test_loss: 0.9222, test_f1: 0.6527
 epoch: 47, train_loss: 0.5620, test_loss: 0.9043, test_f1: 0.6449
 epoch: 48, train_loss: 0.5461, test_loss: 0.8735, test_f1: 0.6530
 epoch: 49, train_loss: 0.5287, test_loss: 1.0456, test_f1: 0.6217
 epoch: 50, train_loss: 0.5408, test_loss: 0.8876, test_f1: 0.6337
 epoch: 51, train_loss: 0.5157, test_loss: 0.9264, test_f1: 0.6455
 epoch: 52, train_loss: 0.5044, test_loss: 0.9432, test_f1: 0.6496
 epoch: 53, train_loss: 0.4858, test_loss: 0.9567, test_f1: 0.6315
 epoch: 54, train_loss: 0.4945, test_loss: 1.0448, test_f1: 0.6443
 epoch: 55, train_loss: 0.5014, test_loss: 0.9285, test_f1: 0.6492
 epoch: 56, train_loss: 0.4957, test_loss: 1.0209, test_f1: 0.6401
 epoch: 57, train_loss: 0.4928, test_loss: 0.9580, test_f1: 0.6468
 epoch: 58, train_loss: 0.4817, test_loss: 0.9758, test_f1: 0.6566
 epoch: 59, train_loss: 0.4750, test_loss: 0.9672, test_f1: 0.6598
 epoch: 60, train_loss: 0.4665, test_loss: 1.0417, test_f1: 0.6516
 epoch: 61, train_loss: 0.4681, test_loss: 1.0202, test_f1: 0.6398
 epoch: 62, train_loss: 0.4732, test_loss: 0.9333, test_f1: 0.6572
 epoch: 63, train_loss: 0.4494, test_loss: 0.9642, test_f1: 0.6355
 epoch: 64, train_loss: 0.4472, test_loss: 0.9765, test_f1: 0.6523
 epoch: 65, train_loss: 0.4580, test_loss: 1.0266, test_f1: 0.6551
 epoch: 66, train_loss: 0.4434, test_loss: 1.0028, test_f1: 0.6557
 epoch: 67, train_loss: 0.4418, test_loss: 0.9831, test_f1: 0.6533
 epoch: 68, train_loss: 0.4369, test_loss: 1.0620, test_f1: 0.6559
 epoch: 69, train_loss: 0.4295, test_loss: 1.0356, test_f1: 0.6452
 epoch: 70, train_loss: 0.4456, test_loss: 1.0134, test_f1: 0.6527
 epoch: 71, train_loss: 0.4426, test_loss: 1.0041, test_f1: 0.6544
 epoch: 72, train_loss: 0.4391, test_loss: 1.1377, test_f1: 0.6398
 epoch: 73, train_loss: 0.4329, test_loss: 1.1815, test_f1: 0.6412
 epoch: 74, train_loss: 0.4372, test_loss: 1.0488, test_f1: 0.6436
 epoch: 75, train_loss: 0.4238, test_loss: 1.1790, test_f1: 0.6523
 epoch: 76, train_loss: 0.4230, test_loss: 1.1538, test_f1: 0.6549
 epoch: 77, train_loss: 0.4145, test_loss: 1.1545, test_f1: 0.6607
 epoch: 78, train_loss: 0.4125, test_loss: 1.2004, test_f1: 0.6313
 epoch: 79, train_loss: 0.4112, test_loss: 1.2568, test_f1: 0.6616
 epoch: 80, train_loss: 0.4067, test_loss: 1.1867, test_f1: 0.6564
 epoch: 81, train_loss: 0.3966, test_loss: 1.2043, test_f1: 0.6581
 epoch: 82, train_loss: 0.4043, test_loss: 1.1716, test_f1: 0.6491
 epoch: 83, train_loss: 0.4030, test_loss: 1.1822, test_f1: 0.6530
 epoch: 84, train_loss: 0.3931, test_loss: 1.2377, test_f1: 0.6591
 epoch: 85, train_loss: 0.3987, test_loss: 1.2184, test_f1: 0.6529
 epoch: 86, train_loss: 0.4085, test_loss: 1.2569, test_f1: 0.6495
 epoch: 87, train_loss: 0.3917, test_loss: 1.2592, test_f1: 0.6684
 epoch: 88, train_loss: 0.3863, test_loss: 1.0889, test_f1: 0.6846
 epoch: 89, train_loss: 0.3842, test_loss: 1.2063, test_f1: 0.6766
 epoch: 90, train_loss: 0.3851, test_loss: 1.2817, test_f1: 0.6614
 epoch: 91, train_loss: 0.3658, test_loss: 1.2474, test_f1: 0.6475
 epoch: 92, train_loss: 0.3941, test_loss: 1.2272, test_f1: 0.6490
 epoch: 93, train_loss: 0.3691, test_loss: 1.2492, test_f1: 0.6465
 epoch: 94, train_loss: 0.3647, test_loss: 1.2822, test_f1: 0.6561
 epoch: 95, train_loss: 0.3743, test_loss: 1.3051, test_f1: 0.6757
 epoch: 96, train_loss: 0.3673, test_loss: 1.4056, test_f1: 0.6632
 epoch: 97, train_loss: 0.3651, test_loss: 1.3640, test_f1: 0.6497
 epoch: 98, train_loss: 0.3656, test_loss: 1.3817, test_f1: 0.6664
 epoch: 99, train_loss: 0.3554, test_loss: 1.4276, test_f1: 0.6569
##################ITERATION #6 ****************************************
 epoch: 0, train_loss: 1.1756, test_loss: 0.9937, test_f1: 0.5069
 epoch: 1, train_loss: 1.0166, test_loss: 0.9297, test_f1: 0.4960
 epoch: 2, train_loss: 0.9813, test_loss: 0.9161, test_f1: 0.5109
 epoch: 3, train_loss: 0.9678, test_loss: 0.8999, test_f1: 0.5110
 epoch: 4, train_loss: 0.9446, test_loss: 0.8729, test_f1: 0.5366
 epoch: 5, train_loss: 0.9113, test_loss: 0.8535, test_f1: 0.5342
 epoch: 6, train_loss: 0.8967, test_loss: 0.8439, test_f1: 0.5449
 epoch: 7, train_loss: 0.8857, test_loss: 0.8428, test_f1: 0.5386
 epoch: 8, train_loss: 0.8650, test_loss: 0.8385, test_f1: 0.5733
 epoch: 9, train_loss: 0.8599, test_loss: 0.8297, test_f1: 0.5386
 epoch: 10, train_loss: 0.8455, test_loss: 0.8066, test_f1: 0.5611
 epoch: 11, train_loss: 0.8268, test_loss: 0.7918, test_f1: 0.6006
 epoch: 12, train_loss: 0.8103, test_loss: 0.8220, test_f1: 0.5865
 epoch: 13, train_loss: 0.7998, test_loss: 0.7799, test_f1: 0.5832
 epoch: 14, train_loss: 0.7938, test_loss: 0.7824, test_f1: 0.5965
 epoch: 15, train_loss: 0.7840, test_loss: 0.8067, test_f1: 0.5736
 epoch: 16, train_loss: 0.7616, test_loss: 0.7598, test_f1: 0.6293
 epoch: 17, train_loss: 0.7703, test_loss: 0.7709, test_f1: 0.6309
 epoch: 18, train_loss: 0.7490, test_loss: 0.7708, test_f1: 0.6218
 epoch: 19, train_loss: 0.7488, test_loss: 0.7989, test_f1: 0.6034
 epoch: 20, train_loss: 0.7459, test_loss: 0.7604, test_f1: 0.6437
 epoch: 21, train_loss: 0.7274, test_loss: 0.7703, test_f1: 0.6113
 epoch: 22, train_loss: 0.7220, test_loss: 0.8235, test_f1: 0.5796
 epoch: 23, train_loss: 0.7188, test_loss: 0.7557, test_f1: 0.6386
 epoch: 24, train_loss: 0.6999, test_loss: 0.7870, test_f1: 0.5950
 epoch: 25, train_loss: 0.7078, test_loss: 0.7576, test_f1: 0.6311
 epoch: 26, train_loss: 0.6873, test_loss: 0.7468, test_f1: 0.6371
 epoch: 27, train_loss: 0.6827, test_loss: 0.7463, test_f1: 0.6347
 epoch: 28, train_loss: 0.6882, test_loss: 0.7926, test_f1: 0.6083
 epoch: 29, train_loss: 0.6552, test_loss: 0.7637, test_f1: 0.6278
 epoch: 30, train_loss: 0.6749, test_loss: 0.7993, test_f1: 0.6389
 epoch: 31, train_loss: 0.6475, test_loss: 0.7352, test_f1: 0.6356
 epoch: 32, train_loss: 0.6595, test_loss: 0.7521, test_f1: 0.6387
 epoch: 33, train_loss: 0.6452, test_loss: 0.7641, test_f1: 0.6634
 epoch: 34, train_loss: 0.6237, test_loss: 0.7618, test_f1: 0.6615
 epoch: 35, train_loss: 0.6403, test_loss: 0.7580, test_f1: 0.6484
 epoch: 36, train_loss: 0.6230, test_loss: 0.7975, test_f1: 0.6604
 epoch: 37, train_loss: 0.6255, test_loss: 0.7761, test_f1: 0.6485
 epoch: 38, train_loss: 0.6036, test_loss: 0.7862, test_f1: 0.6566
 epoch: 39, train_loss: 0.6067, test_loss: 0.7665, test_f1: 0.6284
 epoch: 40, train_loss: 0.5959, test_loss: 0.7559, test_f1: 0.6477
 epoch: 41, train_loss: 0.5832, test_loss: 0.8185, test_f1: 0.6500
 epoch: 42, train_loss: 0.6047, test_loss: 0.8550, test_f1: 0.6274
 epoch: 43, train_loss: 0.5856, test_loss: 0.8255, test_f1: 0.6251
 epoch: 44, train_loss: 0.5873, test_loss: 0.8471, test_f1: 0.6507
 epoch: 45, train_loss: 0.5695, test_loss: 0.8547, test_f1: 0.6350
 epoch: 46, train_loss: 0.5627, test_loss: 0.8505, test_f1: 0.6170
 epoch: 47, train_loss: 0.5518, test_loss: 0.8635, test_f1: 0.6285
 epoch: 48, train_loss: 0.5655, test_loss: 0.8574, test_f1: 0.6287
 epoch: 49, train_loss: 0.5521, test_loss: 0.9327, test_f1: 0.6527
 epoch: 50, train_loss: 0.5536, test_loss: 0.8699, test_f1: 0.6197
 epoch: 51, train_loss: 0.5220, test_loss: 0.8845, test_f1: 0.6290
 epoch: 52, train_loss: 0.5250, test_loss: 0.8804, test_f1: 0.6466
 epoch: 53, train_loss: 0.5258, test_loss: 0.8937, test_f1: 0.6403
 epoch: 54, train_loss: 0.4911, test_loss: 0.9282, test_f1: 0.6387
 epoch: 55, train_loss: 0.4932, test_loss: 0.9111, test_f1: 0.6363
 epoch: 56, train_loss: 0.4951, test_loss: 0.8926, test_f1: 0.6466
 epoch: 57, train_loss: 0.4944, test_loss: 0.8629, test_f1: 0.6476
 epoch: 58, train_loss: 0.4847, test_loss: 0.8915, test_f1: 0.6466
 epoch: 59, train_loss: 0.4785, test_loss: 0.8910, test_f1: 0.6462
 epoch: 60, train_loss: 0.4870, test_loss: 0.8776, test_f1: 0.6486
 epoch: 61, train_loss: 0.4585, test_loss: 0.9467, test_f1: 0.6288
 epoch: 62, train_loss: 0.4847, test_loss: 0.9188, test_f1: 0.6344
 epoch: 63, train_loss: 0.4808, test_loss: 0.9147, test_f1: 0.6470
 epoch: 64, train_loss: 0.4514, test_loss: 0.9373, test_f1: 0.6358
 epoch: 65, train_loss: 0.4732, test_loss: 0.9070, test_f1: 0.6333
 epoch: 66, train_loss: 0.4688, test_loss: 0.9915, test_f1: 0.6357
 epoch: 67, train_loss: 0.4686, test_loss: 0.9552, test_f1: 0.6422
 epoch: 68, train_loss: 0.4545, test_loss: 0.9703, test_f1: 0.6420
 epoch: 69, train_loss: 0.4598, test_loss: 1.0008, test_f1: 0.6367
 epoch: 70, train_loss: 0.4415, test_loss: 0.9789, test_f1: 0.6436
 epoch: 71, train_loss: 0.4320, test_loss: 0.9868, test_f1: 0.6408
 epoch: 72, train_loss: 0.4364, test_loss: 1.0020, test_f1: 0.6530
 epoch: 73, train_loss: 0.4446, test_loss: 0.9967, test_f1: 0.6341
 epoch: 74, train_loss: 0.4500, test_loss: 1.0507, test_f1: 0.6338
 epoch: 75, train_loss: 0.4371, test_loss: 1.0551, test_f1: 0.6353
 epoch: 76, train_loss: 0.4367, test_loss: 1.0266, test_f1: 0.6407
 epoch: 77, train_loss: 0.4417, test_loss: 0.9860, test_f1: 0.6450
 epoch: 78, train_loss: 0.4369, test_loss: 1.0282, test_f1: 0.6471
 epoch: 79, train_loss: 0.4335, test_loss: 1.0414, test_f1: 0.6484
 epoch: 80, train_loss: 0.4205, test_loss: 1.0588, test_f1: 0.6410
 epoch: 81, train_loss: 0.4340, test_loss: 1.0699, test_f1: 0.6606
 epoch: 82, train_loss: 0.4117, test_loss: 1.1288, test_f1: 0.6329
 epoch: 83, train_loss: 0.4184, test_loss: 1.1426, test_f1: 0.6587
 epoch: 84, train_loss: 0.4130, test_loss: 1.1367, test_f1: 0.6419
 epoch: 85, train_loss: 0.4145, test_loss: 1.2021, test_f1: 0.6299
 epoch: 86, train_loss: 0.3952, test_loss: 1.1849, test_f1: 0.6483
 epoch: 87, train_loss: 0.4137, test_loss: 1.1403, test_f1: 0.6349
 epoch: 88, train_loss: 0.4073, test_loss: 1.1881, test_f1: 0.6481
 epoch: 89, train_loss: 0.4077, test_loss: 1.1414, test_f1: 0.6567
 epoch: 90, train_loss: 0.4084, test_loss: 1.1623, test_f1: 0.6394
 epoch: 91, train_loss: 0.3923, test_loss: 1.2498, test_f1: 0.6420
 epoch: 92, train_loss: 0.4097, test_loss: 1.2709, test_f1: 0.6635
 epoch: 93, train_loss: 0.3851, test_loss: 1.2629, test_f1: 0.6494
 epoch: 94, train_loss: 0.3959, test_loss: 1.1738, test_f1: 0.6584
 epoch: 95, train_loss: 0.3669, test_loss: 1.3089, test_f1: 0.6461
 epoch: 96, train_loss: 0.3846, test_loss: 1.2956, test_f1: 0.6536
 epoch: 97, train_loss: 0.3888, test_loss: 1.2293, test_f1: 0.6474
 epoch: 98, train_loss: 0.3813, test_loss: 1.2498, test_f1: 0.6493
 epoch: 99, train_loss: 0.3655, test_loss: 1.3174, test_f1: 0.6433
##################ITERATION #7 ****************************************
 epoch: 0, train_loss: 1.1544, test_loss: 0.9626, test_f1: 0.4977
 epoch: 1, train_loss: 1.0219, test_loss: 0.9508, test_f1: 0.5115
 epoch: 2, train_loss: 0.9843, test_loss: 0.9285, test_f1: 0.5027
 epoch: 3, train_loss: 0.9516, test_loss: 0.9026, test_f1: 0.5453
 epoch: 4, train_loss: 0.9153, test_loss: 0.8985, test_f1: 0.5582
 epoch: 5, train_loss: 0.8949, test_loss: 0.8790, test_f1: 0.5640
 epoch: 6, train_loss: 0.8943, test_loss: 0.8359, test_f1: 0.5511
 epoch: 7, train_loss: 0.8596, test_loss: 0.8608, test_f1: 0.5540
 epoch: 8, train_loss: 0.8479, test_loss: 0.8244, test_f1: 0.5678
 epoch: 9, train_loss: 0.8447, test_loss: 0.8380, test_f1: 0.5814
 epoch: 10, train_loss: 0.8277, test_loss: 0.8746, test_f1: 0.5614
 epoch: 11, train_loss: 0.8181, test_loss: 0.8403, test_f1: 0.5546
 epoch: 12, train_loss: 0.8009, test_loss: 0.8079, test_f1: 0.5794
 epoch: 13, train_loss: 0.7865, test_loss: 0.8175, test_f1: 0.5731
 epoch: 14, train_loss: 0.7759, test_loss: 0.8439, test_f1: 0.6081
 epoch: 15, train_loss: 0.7690, test_loss: 0.8547, test_f1: 0.5986
 epoch: 16, train_loss: 0.7607, test_loss: 0.8190, test_f1: 0.6112
 epoch: 17, train_loss: 0.7599, test_loss: 0.8300, test_f1: 0.6212
 epoch: 18, train_loss: 0.7415, test_loss: 0.8000, test_f1: 0.5898
 epoch: 19, train_loss: 0.7330, test_loss: 0.7797, test_f1: 0.6250
 epoch: 20, train_loss: 0.7204, test_loss: 0.7469, test_f1: 0.6250
 epoch: 21, train_loss: 0.7125, test_loss: 0.7606, test_f1: 0.6388
 epoch: 22, train_loss: 0.7091, test_loss: 0.7890, test_f1: 0.6215
 epoch: 23, train_loss: 0.7015, test_loss: 0.7625, test_f1: 0.6253
 epoch: 24, train_loss: 0.6877, test_loss: 0.7438, test_f1: 0.6264
 epoch: 25, train_loss: 0.6863, test_loss: 0.8042, test_f1: 0.6177
 epoch: 26, train_loss: 0.6823, test_loss: 0.7718, test_f1: 0.6593
 epoch: 27, train_loss: 0.6636, test_loss: 0.7468, test_f1: 0.6238
 epoch: 28, train_loss: 0.6657, test_loss: 0.8311, test_f1: 0.6190
 epoch: 29, train_loss: 0.6585, test_loss: 0.8484, test_f1: 0.6483
 epoch: 30, train_loss: 0.6457, test_loss: 0.8585, test_f1: 0.6222
 epoch: 31, train_loss: 0.6480, test_loss: 0.8031, test_f1: 0.6396
 epoch: 32, train_loss: 0.6303, test_loss: 0.7781, test_f1: 0.6302
 epoch: 33, train_loss: 0.6341, test_loss: 0.8327, test_f1: 0.6615
 epoch: 34, train_loss: 0.6227, test_loss: 0.8209, test_f1: 0.6247
 epoch: 35, train_loss: 0.6194, test_loss: 0.7831, test_f1: 0.6480
 epoch: 36, train_loss: 0.6167, test_loss: 0.8042, test_f1: 0.6284
 epoch: 37, train_loss: 0.6069, test_loss: 0.8694, test_f1: 0.6474
 epoch: 38, train_loss: 0.6003, test_loss: 0.7710, test_f1: 0.6548
 epoch: 39, train_loss: 0.5847, test_loss: 0.8460, test_f1: 0.6300
 epoch: 40, train_loss: 0.5852, test_loss: 0.8542, test_f1: 0.6580
 epoch: 41, train_loss: 0.5869, test_loss: 0.8850, test_f1: 0.6725
 epoch: 42, train_loss: 0.5715, test_loss: 0.8670, test_f1: 0.6492
 epoch: 43, train_loss: 0.5826, test_loss: 0.9022, test_f1: 0.6395
 epoch: 44, train_loss: 0.5623, test_loss: 0.8955, test_f1: 0.6563
 epoch: 45, train_loss: 0.5564, test_loss: 0.8666, test_f1: 0.6497
 epoch: 46, train_loss: 0.5442, test_loss: 0.8002, test_f1: 0.6624
 epoch: 47, train_loss: 0.5419, test_loss: 0.8795, test_f1: 0.6493
 epoch: 48, train_loss: 0.5368, test_loss: 0.9414, test_f1: 0.6458
 epoch: 49, train_loss: 0.5314, test_loss: 0.9546, test_f1: 0.6594
 epoch: 50, train_loss: 0.5394, test_loss: 0.9285, test_f1: 0.6612
 epoch: 51, train_loss: 0.5213, test_loss: 0.9431, test_f1: 0.6572
 epoch: 52, train_loss: 0.4935, test_loss: 0.9468, test_f1: 0.6575
 epoch: 53, train_loss: 0.4911, test_loss: 1.0013, test_f1: 0.6760
 epoch: 54, train_loss: 0.5022, test_loss: 0.9627, test_f1: 0.6696
 epoch: 55, train_loss: 0.4818, test_loss: 1.0092, test_f1: 0.6664
 epoch: 56, train_loss: 0.4821, test_loss: 0.9899, test_f1: 0.6630
 epoch: 57, train_loss: 0.4715, test_loss: 1.0316, test_f1: 0.6704
 epoch: 58, train_loss: 0.4739, test_loss: 1.0129, test_f1: 0.6672
 epoch: 59, train_loss: 0.4648, test_loss: 1.0003, test_f1: 0.6767
 epoch: 60, train_loss: 0.4735, test_loss: 1.0239, test_f1: 0.6810
 epoch: 61, train_loss: 0.4547, test_loss: 0.9833, test_f1: 0.6667
 epoch: 62, train_loss: 0.4602, test_loss: 1.0107, test_f1: 0.6616
 epoch: 63, train_loss: 0.4638, test_loss: 1.0707, test_f1: 0.6618
 epoch: 64, train_loss: 0.4590, test_loss: 1.0565, test_f1: 0.6485
 epoch: 65, train_loss: 0.4439, test_loss: 1.0835, test_f1: 0.6610
 epoch: 66, train_loss: 0.4480, test_loss: 1.1525, test_f1: 0.6522
 epoch: 67, train_loss: 0.4583, test_loss: 1.0684, test_f1: 0.6504
 epoch: 68, train_loss: 0.4417, test_loss: 1.0333, test_f1: 0.6453
 epoch: 69, train_loss: 0.4467, test_loss: 1.0985, test_f1: 0.6563
 epoch: 70, train_loss: 0.4439, test_loss: 1.0060, test_f1: 0.6677
 epoch: 71, train_loss: 0.4213, test_loss: 1.1826, test_f1: 0.6581
 epoch: 72, train_loss: 0.4402, test_loss: 1.1548, test_f1: 0.6622
 epoch: 73, train_loss: 0.4341, test_loss: 1.0453, test_f1: 0.6892
 epoch: 74, train_loss: 0.4231, test_loss: 1.1654, test_f1: 0.6438
 epoch: 75, train_loss: 0.4165, test_loss: 1.0869, test_f1: 0.6733
 epoch: 76, train_loss: 0.4184, test_loss: 1.1840, test_f1: 0.6564
 epoch: 77, train_loss: 0.4108, test_loss: 1.1423, test_f1: 0.6615
 epoch: 78, train_loss: 0.4087, test_loss: 1.1967, test_f1: 0.6620
 epoch: 79, train_loss: 0.4057, test_loss: 1.1695, test_f1: 0.6476
 epoch: 80, train_loss: 0.4037, test_loss: 1.1892, test_f1: 0.6644
 epoch: 81, train_loss: 0.4087, test_loss: 1.2173, test_f1: 0.6648
 epoch: 82, train_loss: 0.3911, test_loss: 1.1853, test_f1: 0.6632
 epoch: 83, train_loss: 0.3853, test_loss: 1.1676, test_f1: 0.6758
 epoch: 84, train_loss: 0.3967, test_loss: 1.2670, test_f1: 0.6657
 epoch: 85, train_loss: 0.3868, test_loss: 1.2698, test_f1: 0.6627
 epoch: 86, train_loss: 0.3880, test_loss: 1.2816, test_f1: 0.6635
 epoch: 87, train_loss: 0.3897, test_loss: 1.3092, test_f1: 0.6444
 epoch: 88, train_loss: 0.3921, test_loss: 1.1417, test_f1: 0.6765
 epoch: 89, train_loss: 0.3912, test_loss: 1.2829, test_f1: 0.6601
 epoch: 90, train_loss: 0.3871, test_loss: 1.2130, test_f1: 0.6509
 epoch: 91, train_loss: 0.3742, test_loss: 1.2309, test_f1: 0.6598
 epoch: 92, train_loss: 0.3866, test_loss: 1.2891, test_f1: 0.6609
 epoch: 93, train_loss: 0.3612, test_loss: 1.3133, test_f1: 0.6481
 epoch: 94, train_loss: 0.3635, test_loss: 1.3465, test_f1: 0.6531
 epoch: 95, train_loss: 0.3697, test_loss: 1.3152, test_f1: 0.6690
 epoch: 96, train_loss: 0.3613, test_loss: 1.2732, test_f1: 0.6591
 epoch: 97, train_loss: 0.3693, test_loss: 1.3951, test_f1: 0.6644
 epoch: 98, train_loss: 0.3690, test_loss: 1.4040, test_f1: 0.6450
 epoch: 99, train_loss: 0.3549, test_loss: 1.3379, test_f1: 0.6858
##################ITERATION #8 ****************************************
 epoch: 0, train_loss: 1.2187, test_loss: 1.0125, test_f1: 0.4977
 epoch: 1, train_loss: 1.0297, test_loss: 0.9598, test_f1: 0.5229
 epoch: 2, train_loss: 0.9852, test_loss: 0.9370, test_f1: 0.4959
 epoch: 3, train_loss: 0.9623, test_loss: 0.9245, test_f1: 0.5098
 epoch: 4, train_loss: 0.9406, test_loss: 0.9069, test_f1: 0.5285
 epoch: 5, train_loss: 0.9077, test_loss: 0.8880, test_f1: 0.5508
 epoch: 6, train_loss: 0.9198, test_loss: 0.8957, test_f1: 0.5503
 epoch: 7, train_loss: 0.8869, test_loss: 0.8742, test_f1: 0.5686
 epoch: 8, train_loss: 0.8774, test_loss: 0.8424, test_f1: 0.5657
 epoch: 9, train_loss: 0.8712, test_loss: 0.8508, test_f1: 0.5617
 epoch: 10, train_loss: 0.8398, test_loss: 0.8470, test_f1: 0.5328
 epoch: 11, train_loss: 0.8280, test_loss: 0.8183, test_f1: 0.5711
 epoch: 12, train_loss: 0.8277, test_loss: 0.8208, test_f1: 0.5667
 epoch: 13, train_loss: 0.8165, test_loss: 0.8068, test_f1: 0.5860
 epoch: 14, train_loss: 0.8138, test_loss: 0.7866, test_f1: 0.5812
 epoch: 15, train_loss: 0.7813, test_loss: 0.7884, test_f1: 0.5887
 epoch: 16, train_loss: 0.7867, test_loss: 0.7659, test_f1: 0.6052
 epoch: 17, train_loss: 0.7915, test_loss: 0.7766, test_f1: 0.5883
 epoch: 18, train_loss: 0.7739, test_loss: 0.7820, test_f1: 0.5941
 epoch: 19, train_loss: 0.7731, test_loss: 0.7693, test_f1: 0.5962
 epoch: 20, train_loss: 0.7629, test_loss: 0.7707, test_f1: 0.5946
 epoch: 21, train_loss: 0.7448, test_loss: 0.7663, test_f1: 0.6128
 epoch: 22, train_loss: 0.7298, test_loss: 0.7768, test_f1: 0.5972
 epoch: 23, train_loss: 0.7398, test_loss: 0.7516, test_f1: 0.6350
 epoch: 24, train_loss: 0.7304, test_loss: 0.7337, test_f1: 0.6584
 epoch: 25, train_loss: 0.7278, test_loss: 0.7232, test_f1: 0.6344
 epoch: 26, train_loss: 0.7087, test_loss: 0.7397, test_f1: 0.6278
 epoch: 27, train_loss: 0.7118, test_loss: 0.7424, test_f1: 0.6339
 epoch: 28, train_loss: 0.6978, test_loss: 0.7524, test_f1: 0.6365
 epoch: 29, train_loss: 0.6923, test_loss: 0.7444, test_f1: 0.6261
 epoch: 30, train_loss: 0.6903, test_loss: 0.7483, test_f1: 0.6315
 epoch: 31, train_loss: 0.6806, test_loss: 0.7549, test_f1: 0.6566
 epoch: 32, train_loss: 0.6698, test_loss: 0.7334, test_f1: 0.6508
 epoch: 33, train_loss: 0.6835, test_loss: 0.7474, test_f1: 0.6610
 epoch: 34, train_loss: 0.6580, test_loss: 0.7350, test_f1: 0.6455
 epoch: 35, train_loss: 0.6401, test_loss: 0.7533, test_f1: 0.6439
 epoch: 36, train_loss: 0.6358, test_loss: 0.7352, test_f1: 0.6611
 epoch: 37, train_loss: 0.6464, test_loss: 0.7285, test_f1: 0.6574
 epoch: 38, train_loss: 0.6499, test_loss: 0.7456, test_f1: 0.6748
 epoch: 39, train_loss: 0.6280, test_loss: 0.7191, test_f1: 0.6797
 epoch: 40, train_loss: 0.6325, test_loss: 0.7350, test_f1: 0.6471
 epoch: 41, train_loss: 0.6063, test_loss: 0.7592, test_f1: 0.6410
 epoch: 42, train_loss: 0.6152, test_loss: 0.7476, test_f1: 0.6670
 epoch: 43, train_loss: 0.5990, test_loss: 0.7430, test_f1: 0.6885
 epoch: 44, train_loss: 0.6183, test_loss: 0.7632, test_f1: 0.6544
 epoch: 45, train_loss: 0.6035, test_loss: 0.7596, test_f1: 0.6514
 epoch: 46, train_loss: 0.5966, test_loss: 0.7780, test_f1: 0.6703
 epoch: 47, train_loss: 0.5802, test_loss: 0.7748, test_f1: 0.6475
 epoch: 48, train_loss: 0.5818, test_loss: 0.7652, test_f1: 0.6448
 epoch: 49, train_loss: 0.5836, test_loss: 0.7501, test_f1: 0.6643
 epoch: 50, train_loss: 0.5622, test_loss: 0.7847, test_f1: 0.6646
 epoch: 51, train_loss: 0.5569, test_loss: 0.7591, test_f1: 0.6850
 epoch: 52, train_loss: 0.5459, test_loss: 0.7611, test_f1: 0.6608
 epoch: 53, train_loss: 0.5380, test_loss: 0.7811, test_f1: 0.6403
 epoch: 54, train_loss: 0.5131, test_loss: 0.8134, test_f1: 0.6419
 epoch: 55, train_loss: 0.5363, test_loss: 0.8335, test_f1: 0.6445
 epoch: 56, train_loss: 0.5297, test_loss: 0.8054, test_f1: 0.6379
 epoch: 57, train_loss: 0.5199, test_loss: 0.7741, test_f1: 0.6597
 epoch: 58, train_loss: 0.5161, test_loss: 0.7841, test_f1: 0.6513
 epoch: 59, train_loss: 0.5110, test_loss: 0.8401, test_f1: 0.6641
 epoch: 60, train_loss: 0.5164, test_loss: 0.7925, test_f1: 0.6791
 epoch: 61, train_loss: 0.5072, test_loss: 0.7736, test_f1: 0.6589
 epoch: 62, train_loss: 0.5000, test_loss: 0.8562, test_f1: 0.6370
 epoch: 63, train_loss: 0.5030, test_loss: 0.8028, test_f1: 0.6584
 epoch: 64, train_loss: 0.4883, test_loss: 0.8051, test_f1: 0.6762
 epoch: 65, train_loss: 0.4914, test_loss: 0.8496, test_f1: 0.6443
 epoch: 66, train_loss: 0.4977, test_loss: 0.8801, test_f1: 0.6453
 epoch: 67, train_loss: 0.4794, test_loss: 0.8688, test_f1: 0.6508
 epoch: 68, train_loss: 0.4822, test_loss: 0.8725, test_f1: 0.6570
 epoch: 69, train_loss: 0.4804, test_loss: 0.9053, test_f1: 0.6483
 epoch: 70, train_loss: 0.4765, test_loss: 0.8910, test_f1: 0.6423
 epoch: 71, train_loss: 0.4658, test_loss: 0.8711, test_f1: 0.6453
 epoch: 72, train_loss: 0.4644, test_loss: 0.8347, test_f1: 0.6438
 epoch: 73, train_loss: 0.4715, test_loss: 0.9094, test_f1: 0.6501
 epoch: 74, train_loss: 0.4539, test_loss: 0.9360, test_f1: 0.6354
 epoch: 75, train_loss: 0.4569, test_loss: 0.8677, test_f1: 0.6556
 epoch: 76, train_loss: 0.4559, test_loss: 0.8764, test_f1: 0.6486
 epoch: 77, train_loss: 0.4589, test_loss: 0.8665, test_f1: 0.6572
 epoch: 78, train_loss: 0.4464, test_loss: 0.9095, test_f1: 0.6549
 epoch: 79, train_loss: 0.4444, test_loss: 0.9488, test_f1: 0.6634
 epoch: 80, train_loss: 0.4446, test_loss: 0.9509, test_f1: 0.6514
 epoch: 81, train_loss: 0.4441, test_loss: 0.8719, test_f1: 0.6510
 epoch: 82, train_loss: 0.4291, test_loss: 0.9345, test_f1: 0.6551
 epoch: 83, train_loss: 0.4521, test_loss: 0.8896, test_f1: 0.6712
 epoch: 84, train_loss: 0.4424, test_loss: 0.9489, test_f1: 0.6515
 epoch: 85, train_loss: 0.4352, test_loss: 0.9065, test_f1: 0.6564
 epoch: 86, train_loss: 0.4336, test_loss: 0.9553, test_f1: 0.6479
 epoch: 87, train_loss: 0.4353, test_loss: 0.9063, test_f1: 0.6780
 epoch: 88, train_loss: 0.4158, test_loss: 0.9244, test_f1: 0.6531
 epoch: 89, train_loss: 0.4316, test_loss: 0.9157, test_f1: 0.6675
 epoch: 90, train_loss: 0.4227, test_loss: 0.9570, test_f1: 0.6506
 epoch: 91, train_loss: 0.4167, test_loss: 0.9917, test_f1: 0.6504
 epoch: 92, train_loss: 0.4172, test_loss: 0.9996, test_f1: 0.6640
 epoch: 93, train_loss: 0.4180, test_loss: 0.9912, test_f1: 0.6678
 epoch: 94, train_loss: 0.4133, test_loss: 1.1010, test_f1: 0.6630
 epoch: 95, train_loss: 0.4037, test_loss: 1.0928, test_f1: 0.6493
 epoch: 96, train_loss: 0.4178, test_loss: 0.9872, test_f1: 0.6543
 epoch: 97, train_loss: 0.4097, test_loss: 1.0069, test_f1: 0.6599
 epoch: 98, train_loss: 0.4015, test_loss: 1.0623, test_f1: 0.6506
 epoch: 99, train_loss: 0.3951, test_loss: 0.9908, test_f1: 0.6707
##################ITERATION #9 ****************************************
 epoch: 0, train_loss: 1.2737, test_loss: 0.9589, test_f1: 0.4767
 epoch: 1, train_loss: 1.0531, test_loss: 0.9910, test_f1: 0.4975
 epoch: 2, train_loss: 0.9950, test_loss: 0.9645, test_f1: 0.5132
 epoch: 3, train_loss: 0.9581, test_loss: 0.9425, test_f1: 0.5313
 epoch: 4, train_loss: 0.9329, test_loss: 0.9711, test_f1: 0.5215
 epoch: 5, train_loss: 0.9143, test_loss: 0.9471, test_f1: 0.5072
 epoch: 6, train_loss: 0.9016, test_loss: 0.8942, test_f1: 0.5566
 epoch: 7, train_loss: 0.9055, test_loss: 0.9190, test_f1: 0.5613
 epoch: 8, train_loss: 0.8584, test_loss: 0.9030, test_f1: 0.5412
 epoch: 9, train_loss: 0.8552, test_loss: 0.8916, test_f1: 0.6031
 epoch: 10, train_loss: 0.8405, test_loss: 0.8399, test_f1: 0.5648
 epoch: 11, train_loss: 0.8247, test_loss: 0.8544, test_f1: 0.5617
 epoch: 12, train_loss: 0.8186, test_loss: 0.8261, test_f1: 0.6013
 epoch: 13, train_loss: 0.8045, test_loss: 0.7989, test_f1: 0.5878
 epoch: 14, train_loss: 0.7969, test_loss: 0.8121, test_f1: 0.5937
 epoch: 15, train_loss: 0.8026, test_loss: 0.8050, test_f1: 0.6116
 epoch: 16, train_loss: 0.7944, test_loss: 0.7955, test_f1: 0.6348
 epoch: 17, train_loss: 0.7653, test_loss: 0.7876, test_f1: 0.6289
 epoch: 18, train_loss: 0.7578, test_loss: 0.7834, test_f1: 0.6329
 epoch: 19, train_loss: 0.7537, test_loss: 0.7786, test_f1: 0.6434
 epoch: 20, train_loss: 0.7453, test_loss: 0.8277, test_f1: 0.6403
 epoch: 21, train_loss: 0.7256, test_loss: 0.7898, test_f1: 0.6557
 epoch: 22, train_loss: 0.7239, test_loss: 0.7942, test_f1: 0.6227
 epoch: 23, train_loss: 0.7122, test_loss: 0.7952, test_f1: 0.6238
 epoch: 24, train_loss: 0.7180, test_loss: 0.7983, test_f1: 0.6436
 epoch: 25, train_loss: 0.6964, test_loss: 0.8560, test_f1: 0.6045
 epoch: 26, train_loss: 0.6933, test_loss: 0.8655, test_f1: 0.6213
 epoch: 27, train_loss: 0.6954, test_loss: 0.8557, test_f1: 0.6087
 epoch: 28, train_loss: 0.6757, test_loss: 0.8054, test_f1: 0.6397
 epoch: 29, train_loss: 0.6671, test_loss: 0.7904, test_f1: 0.6496
 epoch: 30, train_loss: 0.6717, test_loss: 0.7612, test_f1: 0.6484
 epoch: 31, train_loss: 0.6723, test_loss: 0.8585, test_f1: 0.6299
 epoch: 32, train_loss: 0.6627, test_loss: 0.8328, test_f1: 0.6310
 epoch: 33, train_loss: 0.6518, test_loss: 0.8792, test_f1: 0.6254
 epoch: 34, train_loss: 0.6499, test_loss: 0.8388, test_f1: 0.6311
 epoch: 35, train_loss: 0.6521, test_loss: 0.8402, test_f1: 0.6165
 epoch: 36, train_loss: 0.6445, test_loss: 0.8712, test_f1: 0.6477
 epoch: 37, train_loss: 0.6390, test_loss: 0.8745, test_f1: 0.6463
 epoch: 38, train_loss: 0.6254, test_loss: 0.8413, test_f1: 0.6202
 epoch: 39, train_loss: 0.6148, test_loss: 0.9007, test_f1: 0.6341
 epoch: 40, train_loss: 0.5956, test_loss: 0.8798, test_f1: 0.6393
 epoch: 41, train_loss: 0.6115, test_loss: 0.9591, test_f1: 0.6174
 epoch: 42, train_loss: 0.6189, test_loss: 0.9134, test_f1: 0.6579
 epoch: 43, train_loss: 0.5843, test_loss: 0.8774, test_f1: 0.6774
 epoch: 44, train_loss: 0.5884, test_loss: 0.9363, test_f1: 0.6543
 epoch: 45, train_loss: 0.5834, test_loss: 0.9185, test_f1: 0.6425
 epoch: 46, train_loss: 0.5719, test_loss: 0.9824, test_f1: 0.6387
 epoch: 47, train_loss: 0.5629, test_loss: 0.9733, test_f1: 0.6245
 epoch: 48, train_loss: 0.5777, test_loss: 0.9243, test_f1: 0.6303
 epoch: 49, train_loss: 0.5653, test_loss: 0.9716, test_f1: 0.6208
 epoch: 50, train_loss: 0.5536, test_loss: 0.9270, test_f1: 0.6456
 epoch: 51, train_loss: 0.5315, test_loss: 0.9727, test_f1: 0.6429
 epoch: 52, train_loss: 0.5275, test_loss: 0.9570, test_f1: 0.6374
 epoch: 53, train_loss: 0.5142, test_loss: 0.9782, test_f1: 0.6492
 epoch: 54, train_loss: 0.5063, test_loss: 1.0266, test_f1: 0.6252
 epoch: 55, train_loss: 0.5011, test_loss: 1.0329, test_f1: 0.6487
 epoch: 56, train_loss: 0.5135, test_loss: 1.0143, test_f1: 0.6301
 epoch: 57, train_loss: 0.4851, test_loss: 0.9980, test_f1: 0.6428
 epoch: 58, train_loss: 0.4943, test_loss: 1.1146, test_f1: 0.6210
 epoch: 59, train_loss: 0.4864, test_loss: 1.0906, test_f1: 0.6280
 epoch: 60, train_loss: 0.5036, test_loss: 1.0808, test_f1: 0.6342
 epoch: 61, train_loss: 0.4779, test_loss: 1.0679, test_f1: 0.6364
 epoch: 62, train_loss: 0.4958, test_loss: 1.1130, test_f1: 0.6392
 epoch: 63, train_loss: 0.4658, test_loss: 1.0880, test_f1: 0.6392
 epoch: 64, train_loss: 0.4736, test_loss: 1.1028, test_f1: 0.6424
 epoch: 65, train_loss: 0.4778, test_loss: 1.1063, test_f1: 0.6325
 epoch: 66, train_loss: 0.4567, test_loss: 1.0719, test_f1: 0.6345
 epoch: 67, train_loss: 0.4806, test_loss: 1.0730, test_f1: 0.6408
 epoch: 68, train_loss: 0.4642, test_loss: 1.0612, test_f1: 0.6483
 epoch: 69, train_loss: 0.4724, test_loss: 1.0790, test_f1: 0.6416
 epoch: 70, train_loss: 0.4680, test_loss: 1.1635, test_f1: 0.6414
 epoch: 71, train_loss: 0.4693, test_loss: 1.1569, test_f1: 0.6375
 epoch: 72, train_loss: 0.4437, test_loss: 1.1571, test_f1: 0.6359
 epoch: 73, train_loss: 0.4488, test_loss: 1.1725, test_f1: 0.6402
 epoch: 74, train_loss: 0.4490, test_loss: 1.1674, test_f1: 0.6660
 epoch: 75, train_loss: 0.4550, test_loss: 1.1078, test_f1: 0.6433
 epoch: 76, train_loss: 0.4421, test_loss: 1.2099, test_f1: 0.6388
 epoch: 77, train_loss: 0.4329, test_loss: 1.2043, test_f1: 0.6466
 epoch: 78, train_loss: 0.4357, test_loss: 1.2462, test_f1: 0.6301
 epoch: 79, train_loss: 0.4295, test_loss: 1.1273, test_f1: 0.6484
 epoch: 80, train_loss: 0.4466, test_loss: 1.1635, test_f1: 0.6506
 epoch: 81, train_loss: 0.4263, test_loss: 1.1454, test_f1: 0.6413
 epoch: 82, train_loss: 0.4411, test_loss: 1.2294, test_f1: 0.6163
 epoch: 83, train_loss: 0.4208, test_loss: 1.2024, test_f1: 0.6493
 epoch: 84, train_loss: 0.4332, test_loss: 1.2070, test_f1: 0.6491
 epoch: 85, train_loss: 0.4334, test_loss: 1.2087, test_f1: 0.6308
 epoch: 86, train_loss: 0.4229, test_loss: 1.1837, test_f1: 0.6295
 epoch: 87, train_loss: 0.4030, test_loss: 1.2764, test_f1: 0.6307
 epoch: 88, train_loss: 0.4146, test_loss: 1.2969, test_f1: 0.6492
 epoch: 89, train_loss: 0.4110, test_loss: 1.2682, test_f1: 0.6383
 epoch: 90, train_loss: 0.4105, test_loss: 1.2801, test_f1: 0.6444
 epoch: 91, train_loss: 0.4038, test_loss: 1.2743, test_f1: 0.6517
 epoch: 92, train_loss: 0.4042, test_loss: 1.2371, test_f1: 0.6528
 epoch: 93, train_loss: 0.3956, test_loss: 1.2415, test_f1: 0.6403
 epoch: 94, train_loss: 0.3947, test_loss: 1.2727, test_f1: 0.6415
 epoch: 95, train_loss: 0.3949, test_loss: 1.2581, test_f1: 0.6523
 epoch: 96, train_loss: 0.3894, test_loss: 1.3399, test_f1: 0.6392
 epoch: 97, train_loss: 0.3925, test_loss: 1.2958, test_f1: 0.6413
 epoch: 98, train_loss: 0.3881, test_loss: 1.2831, test_f1: 0.6408
 epoch: 99, train_loss: 0.3832, test_loss: 1.4177, test_f1: 0.6391

Training completed in 1196.57 seconds
Best F1: 0.6959 at epoch 86
Mean F1 across iterations: 0.6791  0.0126
========================FINAL RESULTS================================
FEGIN weighted F1: 0.6959  0.0126
python main.py --data ltspice_examples --representation component_pin_net --model FEGIN --layers 4 --hiddens 128 --batch_size 32 --lr 0.0001 --emb_size 512 --epochs 100 --save_appendix component_pin_net_L4_H128_BS32_LR0.0001_E512 --no_val
-----



STDERR:
  File "main.py", line 370, in <module>
    main()
  File "main.py", line 254, in main
    dataset = dataset_class(
  File "/home/philip/projects/ltspice_examples_code_repo/Circuit-Completion-Using-GNNs/component_classification_with_link_prediction_head/evaluation/FEGIN/kernel/circuit_datasets.py", line 15, in __init__
    self.data, self.slices = torch.load(self.processed_paths[0])
  File "/home/philip/.local/lib/python3.8/site-packages/torch/serialization.py", line 1040, in load
    warnings.warn(
  File "/usr/lib/python3.8/warnings.py", line 109, in _showwarnmsg
    sw(msg.message, msg.category, msg.filename, msg.lineno,
  File "main.py", line 47, in warn_with_traceback
    traceback.print_stack(file=log)
/home/philip/projects/ltspice_examples_code_repo/Circuit-Completion-Using-GNNs/component_classification_with_link_prediction_head/evaluation/FEGIN/kernel/circuit_datasets.py:15: FutureWarning: You are using `torch.load` with `weights_only=False` (the current default value), which uses the default pickle module implicitly. It is possible to construct malicious pickle data which will execute arbitrary code during unpickling (See https://github.com/pytorch/pytorch/blob/main/SECURITY.md#untrusted-models for more details). In a future release, the default value for `weights_only` will be flipped to `True`. This limits the functions that could be executed during unpickling. Arbitrary objects will no longer be allowed to be loaded via this mode unless they are explicitly allowlisted by the user via `torch.serialization.add_safe_globals`. We recommend you start setting `weights_only=True` for any use case where you don't have full control of the loaded file. Please open an issue on GitHub for any issues related to this experimental feature.
  self.data, self.slices = torch.load(self.processed_paths[0])
