STDOUT:
Results will be saved in /home/philip/projects/ltspice_examples_code_repo/Circuit-Completion-Using-GNNs/component_classification_with_link_prediction_head/evaluation/FEGIN/results/model_FEGIN_dataset_ltspice_examples
Command line input: python main.py --data ltspice_examples --representation component_pin --model FEGIN --layers 6 --hiddens 32 --batch_size 32 --lr 0.01 --emb_size 512 --epochs 100 --save_appendix component_pin_L6_H32_BS32_LR0.01_E512 --no_val
 is saved.
-----
ltspice_examples - FEGIN
Using 6 layers, 32 hidden units, h = 2
Loading component_pin representation dataset
ENTERED
Training FEGIN on component_pin representation
Train: 3560, Test: 848
##################ITERATION #0 ****************************************
 epoch: 0, train_loss: 1.1785, test_loss: 1.2796, test_f1: 0.3717
 epoch: 1, train_loss: 1.0623, test_loss: 1.0266, test_f1: 0.3431
 epoch: 2, train_loss: 1.0433, test_loss: 1.0937, test_f1: 0.4366
 epoch: 3, train_loss: 1.0075, test_loss: 1.0036, test_f1: 0.5139
 epoch: 4, train_loss: 0.9733, test_loss: 1.1023, test_f1: 0.4646
 epoch: 5, train_loss: 0.9573, test_loss: 1.0209, test_f1: 0.4433
 epoch: 6, train_loss: 0.9597, test_loss: 0.9835, test_f1: 0.4657
 epoch: 7, train_loss: 0.9332, test_loss: 0.9574, test_f1: 0.4947
 epoch: 8, train_loss: 0.9218, test_loss: 0.9116, test_f1: 0.4902
 epoch: 9, train_loss: 0.9159, test_loss: 0.9968, test_f1: 0.4587
 epoch: 10, train_loss: 0.9176, test_loss: 1.0621, test_f1: 0.4348
 epoch: 11, train_loss: 0.9127, test_loss: 0.9398, test_f1: 0.5092
 epoch: 12, train_loss: 0.8978, test_loss: 0.9218, test_f1: 0.5500
 epoch: 13, train_loss: 0.9082, test_loss: 0.9789, test_f1: 0.5577
 epoch: 14, train_loss: 0.8818, test_loss: 0.8503, test_f1: 0.5508
 epoch: 15, train_loss: 0.8674, test_loss: 0.8564, test_f1: 0.5455
 epoch: 16, train_loss: 0.8683, test_loss: 0.8943, test_f1: 0.4791
 epoch: 17, train_loss: 0.8837, test_loss: 0.8642, test_f1: 0.5583
 epoch: 18, train_loss: 0.8587, test_loss: 0.8657, test_f1: 0.4936
 epoch: 19, train_loss: 0.8611, test_loss: 0.7975, test_f1: 0.5364
 epoch: 20, train_loss: 0.8478, test_loss: 0.8663, test_f1: 0.5273
 epoch: 21, train_loss: 0.8434, test_loss: 0.9532, test_f1: 0.5023
 epoch: 22, train_loss: 0.8395, test_loss: 0.8638, test_f1: 0.5587
 epoch: 23, train_loss: 0.8339, test_loss: 0.8415, test_f1: 0.5428
 epoch: 24, train_loss: 0.8302, test_loss: 0.8742, test_f1: 0.5261
 epoch: 25, train_loss: 0.8230, test_loss: 0.8512, test_f1: 0.5541
 epoch: 26, train_loss: 0.8185, test_loss: 0.7786, test_f1: 0.5429
 epoch: 27, train_loss: 0.7933, test_loss: 0.7603, test_f1: 0.5785
 epoch: 28, train_loss: 0.8108, test_loss: 1.0446, test_f1: 0.4844
 epoch: 29, train_loss: 0.7979, test_loss: 0.7668, test_f1: 0.5941
 epoch: 30, train_loss: 0.7994, test_loss: 0.8081, test_f1: 0.5441
 epoch: 31, train_loss: 0.7857, test_loss: 0.8216, test_f1: 0.5342
 epoch: 32, train_loss: 0.8060, test_loss: 0.7672, test_f1: 0.5550
 epoch: 33, train_loss: 0.7762, test_loss: 0.7975, test_f1: 0.5741
 epoch: 34, train_loss: 0.7705, test_loss: 0.8245, test_f1: 0.5540
 epoch: 35, train_loss: 0.8163, test_loss: 0.9110, test_f1: 0.5583
 epoch: 36, train_loss: 0.7896, test_loss: 0.9444, test_f1: 0.5578
 epoch: 37, train_loss: 0.7784, test_loss: 0.7701, test_f1: 0.5881
 epoch: 38, train_loss: 0.7786, test_loss: 0.8020, test_f1: 0.5773
 epoch: 39, train_loss: 0.7718, test_loss: 0.8203, test_f1: 0.6134
 epoch: 40, train_loss: 0.7706, test_loss: 0.9968, test_f1: 0.5108
 epoch: 41, train_loss: 0.7749, test_loss: 0.7905, test_f1: 0.5690
 epoch: 42, train_loss: 0.7477, test_loss: 0.7261, test_f1: 0.5752
 epoch: 43, train_loss: 0.7561, test_loss: 0.7951, test_f1: 0.5365
 epoch: 44, train_loss: 0.7572, test_loss: 0.7832, test_f1: 0.5625
 epoch: 45, train_loss: 0.7437, test_loss: 0.8665, test_f1: 0.5396
 epoch: 46, train_loss: 0.7540, test_loss: 0.7674, test_f1: 0.5697
 epoch: 47, train_loss: 0.7474, test_loss: 0.7892, test_f1: 0.5836
 epoch: 48, train_loss: 0.7474, test_loss: 0.7927, test_f1: 0.5903
 epoch: 49, train_loss: 0.7444, test_loss: 0.8052, test_f1: 0.6044
 epoch: 50, train_loss: 0.7243, test_loss: 0.7865, test_f1: 0.6154
 epoch: 51, train_loss: 0.7073, test_loss: 0.7762, test_f1: 0.5981
 epoch: 52, train_loss: 0.6849, test_loss: 0.7337, test_f1: 0.6575
 epoch: 53, train_loss: 0.6871, test_loss: 0.7631, test_f1: 0.6380
 epoch: 54, train_loss: 0.6807, test_loss: 0.7650, test_f1: 0.6325
 epoch: 55, train_loss: 0.6765, test_loss: 0.7845, test_f1: 0.6470
 epoch: 56, train_loss: 0.6777, test_loss: 0.7657, test_f1: 0.6611
 epoch: 57, train_loss: 0.6783, test_loss: 0.7512, test_f1: 0.6371
 epoch: 58, train_loss: 0.6697, test_loss: 0.8068, test_f1: 0.6623
 epoch: 59, train_loss: 0.6725, test_loss: 0.7979, test_f1: 0.6430
 epoch: 60, train_loss: 0.6593, test_loss: 0.9121, test_f1: 0.6399
 epoch: 61, train_loss: 0.6605, test_loss: 0.7926, test_f1: 0.6449
 epoch: 62, train_loss: 0.6644, test_loss: 0.7373, test_f1: 0.6776
 epoch: 63, train_loss: 0.6564, test_loss: 0.7443, test_f1: 0.6430
 epoch: 64, train_loss: 0.6589, test_loss: 0.7830, test_f1: 0.6601
 epoch: 65, train_loss: 0.6467, test_loss: 0.7645, test_f1: 0.6361
 epoch: 66, train_loss: 0.6575, test_loss: 0.7068, test_f1: 0.6433
 epoch: 67, train_loss: 0.6321, test_loss: 0.7300, test_f1: 0.6632
 epoch: 68, train_loss: 0.6442, test_loss: 0.7396, test_f1: 0.6616
 epoch: 69, train_loss: 0.6425, test_loss: 0.7682, test_f1: 0.6349
 epoch: 70, train_loss: 0.6382, test_loss: 0.7288, test_f1: 0.6877
 epoch: 71, train_loss: 0.6276, test_loss: 0.7746, test_f1: 0.6221
 epoch: 72, train_loss: 0.6345, test_loss: 0.6964, test_f1: 0.6650
 epoch: 73, train_loss: 0.6347, test_loss: 0.7069, test_f1: 0.6610
 epoch: 74, train_loss: 0.6245, test_loss: 0.6886, test_f1: 0.6772
 epoch: 75, train_loss: 0.6242, test_loss: 0.7673, test_f1: 0.6345
 epoch: 76, train_loss: 0.6316, test_loss: 0.8064, test_f1: 0.6462
 epoch: 77, train_loss: 0.6402, test_loss: 0.7218, test_f1: 0.6345
 epoch: 78, train_loss: 0.6305, test_loss: 0.7375, test_f1: 0.6713
 epoch: 79, train_loss: 0.6315, test_loss: 0.7470, test_f1: 0.6471
 epoch: 80, train_loss: 0.6149, test_loss: 0.7735, test_f1: 0.6598
 epoch: 81, train_loss: 0.6160, test_loss: 0.7180, test_f1: 0.6550
 epoch: 82, train_loss: 0.6134, test_loss: 0.7925, test_f1: 0.6830
 epoch: 83, train_loss: 0.6256, test_loss: 0.7210, test_f1: 0.6462
 epoch: 84, train_loss: 0.6239, test_loss: 0.6933, test_f1: 0.6651
 epoch: 85, train_loss: 0.6010, test_loss: 0.7784, test_f1: 0.6558
 epoch: 86, train_loss: 0.5987, test_loss: 0.7636, test_f1: 0.6559
 epoch: 87, train_loss: 0.6154, test_loss: 0.7327, test_f1: 0.6748
 epoch: 88, train_loss: 0.6115, test_loss: 0.8168, test_f1: 0.6430
 epoch: 89, train_loss: 0.6079, test_loss: 0.8288, test_f1: 0.6704
 epoch: 90, train_loss: 0.5839, test_loss: 0.8017, test_f1: 0.6801
 epoch: 91, train_loss: 0.5985, test_loss: 0.8046, test_f1: 0.6450
 epoch: 92, train_loss: 0.5841, test_loss: 0.7209, test_f1: 0.6917
 epoch: 93, train_loss: 0.5967, test_loss: 0.7121, test_f1: 0.6769
 epoch: 94, train_loss: 0.6932, test_loss: 0.6933, test_f1: 0.6679
 epoch: 95, train_loss: 0.6163, test_loss: 0.6864, test_f1: 0.6728
 epoch: 96, train_loss: 0.6004, test_loss: 0.7031, test_f1: 0.6485
 epoch: 97, train_loss: 0.6009, test_loss: 0.7493, test_f1: 0.6774
 epoch: 98, train_loss: 0.5862, test_loss: 0.7159, test_f1: 0.6767
 epoch: 99, train_loss: 0.5941, test_loss: 0.6782, test_f1: 0.6765
##################ITERATION #1 ****************************************
 epoch: 0, train_loss: 1.1243, test_loss: 1.0764, test_f1: 0.4267
 epoch: 1, train_loss: 1.0206, test_loss: 1.1953, test_f1: 0.4000
 epoch: 2, train_loss: 0.9740, test_loss: 1.1269, test_f1: 0.4415
 epoch: 3, train_loss: 0.9844, test_loss: 0.9124, test_f1: 0.4981
 epoch: 4, train_loss: 0.9387, test_loss: 0.8727, test_f1: 0.4867
 epoch: 5, train_loss: 0.9396, test_loss: 0.8758, test_f1: 0.5082
 epoch: 6, train_loss: 0.9162, test_loss: 0.9436, test_f1: 0.5058
 epoch: 7, train_loss: 0.9335, test_loss: 1.0444, test_f1: 0.4425
 epoch: 8, train_loss: 0.9195, test_loss: 0.8705, test_f1: 0.5810
 epoch: 9, train_loss: 0.9166, test_loss: 0.9400, test_f1: 0.5256
 epoch: 10, train_loss: 0.8798, test_loss: 0.9874, test_f1: 0.4764
 epoch: 11, train_loss: 0.9131, test_loss: 0.8739, test_f1: 0.5110
 epoch: 12, train_loss: 0.8866, test_loss: 0.8259, test_f1: 0.5252
 epoch: 13, train_loss: 0.8832, test_loss: 0.8770, test_f1: 0.5168
 epoch: 14, train_loss: 0.8864, test_loss: 0.8478, test_f1: 0.5294
 epoch: 15, train_loss: 0.8767, test_loss: 0.9188, test_f1: 0.5208
 epoch: 16, train_loss: 0.8675, test_loss: 0.8194, test_f1: 0.5363
 epoch: 17, train_loss: 0.8690, test_loss: 0.8666, test_f1: 0.5323
 epoch: 18, train_loss: 0.8808, test_loss: 0.8179, test_f1: 0.6135
 epoch: 19, train_loss: 0.8622, test_loss: 0.8478, test_f1: 0.5661
 epoch: 20, train_loss: 0.8689, test_loss: 0.9226, test_f1: 0.5109
 epoch: 21, train_loss: 0.8584, test_loss: 0.9205, test_f1: 0.5369
 epoch: 22, train_loss: 0.8523, test_loss: 0.8085, test_f1: 0.5186
 epoch: 23, train_loss: 0.8323, test_loss: 0.8266, test_f1: 0.5769
 epoch: 24, train_loss: 0.8379, test_loss: 0.8971, test_f1: 0.5527
 epoch: 25, train_loss: 0.8409, test_loss: 0.8656, test_f1: 0.5532
 epoch: 26, train_loss: 0.8340, test_loss: 0.8748, test_f1: 0.5436
 epoch: 27, train_loss: 0.8483, test_loss: 0.8658, test_f1: 0.5418
 epoch: 28, train_loss: 0.8349, test_loss: 0.8556, test_f1: 0.5476
 epoch: 29, train_loss: 0.8293, test_loss: 0.8355, test_f1: 0.5523
 epoch: 30, train_loss: 0.8344, test_loss: 0.9501, test_f1: 0.4920
 epoch: 31, train_loss: 0.8303, test_loss: 0.8026, test_f1: 0.5392
 epoch: 32, train_loss: 0.8330, test_loss: 0.8164, test_f1: 0.5670
 epoch: 33, train_loss: 0.8073, test_loss: 0.8865, test_f1: 0.5980
 epoch: 34, train_loss: 0.8202, test_loss: 0.7995, test_f1: 0.5783
 epoch: 35, train_loss: 0.8243, test_loss: 0.9229, test_f1: 0.5296
 epoch: 36, train_loss: 0.8186, test_loss: 0.9420, test_f1: 0.5380
 epoch: 37, train_loss: 0.7975, test_loss: 0.8461, test_f1: 0.5864
 epoch: 38, train_loss: 0.8246, test_loss: 0.8230, test_f1: 0.6132
 epoch: 39, train_loss: 0.8018, test_loss: 0.8405, test_f1: 0.5843
 epoch: 40, train_loss: 0.7990, test_loss: 0.8706, test_f1: 0.5498
 epoch: 41, train_loss: 0.7924, test_loss: 0.8377, test_f1: 0.5443
 epoch: 42, train_loss: 0.8015, test_loss: 0.9407, test_f1: 0.5345
 epoch: 43, train_loss: 0.8145, test_loss: 0.7673, test_f1: 0.6271
 epoch: 44, train_loss: 0.7889, test_loss: 0.8681, test_f1: 0.5184
 epoch: 45, train_loss: 0.7912, test_loss: 0.8395, test_f1: 0.5302
 epoch: 46, train_loss: 0.7943, test_loss: 0.8228, test_f1: 0.5634
 epoch: 47, train_loss: 0.7768, test_loss: 0.7968, test_f1: 0.5539
 epoch: 48, train_loss: 0.7713, test_loss: 0.8808, test_f1: 0.6027
 epoch: 49, train_loss: 0.7780, test_loss: 0.8363, test_f1: 0.5658
 epoch: 50, train_loss: 0.7818, test_loss: 0.8595, test_f1: 0.5478
 epoch: 51, train_loss: 0.7533, test_loss: 0.8298, test_f1: 0.5653
 epoch: 52, train_loss: 0.7439, test_loss: 0.7752, test_f1: 0.5640
 epoch: 53, train_loss: 0.7350, test_loss: 0.7779, test_f1: 0.5943
 epoch: 54, train_loss: 0.7288, test_loss: 0.8092, test_f1: 0.5728
 epoch: 55, train_loss: 0.7223, test_loss: 0.8237, test_f1: 0.5651
 epoch: 56, train_loss: 0.7104, test_loss: 0.8249, test_f1: 0.5648
 epoch: 57, train_loss: 0.7245, test_loss: 0.8715, test_f1: 0.5433
 epoch: 58, train_loss: 0.7268, test_loss: 0.7755, test_f1: 0.5928
 epoch: 59, train_loss: 0.7214, test_loss: 0.7850, test_f1: 0.5694
 epoch: 60, train_loss: 0.7078, test_loss: 0.8330, test_f1: 0.6053
 epoch: 61, train_loss: 0.7025, test_loss: 0.8107, test_f1: 0.5626
 epoch: 62, train_loss: 0.7104, test_loss: 0.8617, test_f1: 0.5647
 epoch: 63, train_loss: 0.6973, test_loss: 0.7974, test_f1: 0.6028
 epoch: 64, train_loss: 0.7068, test_loss: 0.8647, test_f1: 0.5676
 epoch: 65, train_loss: 0.6906, test_loss: 0.7619, test_f1: 0.6126
 epoch: 66, train_loss: 0.7125, test_loss: 0.8195, test_f1: 0.5879
 epoch: 67, train_loss: 0.6899, test_loss: 0.8390, test_f1: 0.5749
 epoch: 68, train_loss: 0.6842, test_loss: 0.7706, test_f1: 0.5764
 epoch: 69, train_loss: 0.6997, test_loss: 0.7756, test_f1: 0.5997
 epoch: 70, train_loss: 0.6881, test_loss: 0.8628, test_f1: 0.5769
 epoch: 71, train_loss: 0.6899, test_loss: 0.9416, test_f1: 0.5689
 epoch: 72, train_loss: 0.6840, test_loss: 0.8559, test_f1: 0.5632
 epoch: 73, train_loss: 0.6936, test_loss: 0.8971, test_f1: 0.5858
 epoch: 74, train_loss: 0.6924, test_loss: 0.8171, test_f1: 0.5904
 epoch: 75, train_loss: 0.6815, test_loss: 0.7660, test_f1: 0.6172
 epoch: 76, train_loss: 0.6962, test_loss: 0.7953, test_f1: 0.5956
 epoch: 77, train_loss: 0.6875, test_loss: 0.8313, test_f1: 0.5899
 epoch: 78, train_loss: 0.6795, test_loss: 0.8413, test_f1: 0.5940
 epoch: 79, train_loss: 0.6793, test_loss: 0.9450, test_f1: 0.5824
 epoch: 80, train_loss: 0.6797, test_loss: 0.8358, test_f1: 0.5769
 epoch: 81, train_loss: 0.6679, test_loss: 0.7504, test_f1: 0.6073
 epoch: 82, train_loss: 0.6723, test_loss: 0.7911, test_f1: 0.6476
 epoch: 83, train_loss: 0.6733, test_loss: 0.7497, test_f1: 0.6735
 epoch: 84, train_loss: 0.6812, test_loss: 0.7485, test_f1: 0.6087
 epoch: 85, train_loss: 0.6726, test_loss: 0.8560, test_f1: 0.6084
 epoch: 86, train_loss: 0.6526, test_loss: 0.7229, test_f1: 0.5992
 epoch: 87, train_loss: 0.6742, test_loss: 0.8238, test_f1: 0.5901
 epoch: 88, train_loss: 0.6832, test_loss: 0.7931, test_f1: 0.5972
 epoch: 89, train_loss: 0.6596, test_loss: 0.8038, test_f1: 0.5844
 epoch: 90, train_loss: 0.6781, test_loss: 0.7647, test_f1: 0.6030
 epoch: 91, train_loss: 0.6644, test_loss: 0.8139, test_f1: 0.6118
 epoch: 92, train_loss: 0.6433, test_loss: 0.8773, test_f1: 0.5918
 epoch: 93, train_loss: 0.6593, test_loss: 0.8145, test_f1: 0.6088
 epoch: 94, train_loss: 0.6466, test_loss: 0.9338, test_f1: 0.5673
 epoch: 95, train_loss: 0.6562, test_loss: 0.9510, test_f1: 0.5790
 epoch: 96, train_loss: 0.6576, test_loss: 0.7956, test_f1: 0.6212
 epoch: 97, train_loss: 0.6466, test_loss: 0.9484, test_f1: 0.5945
 epoch: 98, train_loss: 0.6416, test_loss: 0.9759, test_f1: 0.6421
 epoch: 99, train_loss: 0.6596, test_loss: 0.9145, test_f1: 0.6157
##################ITERATION #2 ****************************************
 epoch: 0, train_loss: 1.1349, test_loss: 1.1936, test_f1: 0.3396
 epoch: 1, train_loss: 1.0574, test_loss: 1.1313, test_f1: 0.4078
 epoch: 2, train_loss: 1.0279, test_loss: 1.1007, test_f1: 0.4801
 epoch: 3, train_loss: 1.0059, test_loss: 1.0075, test_f1: 0.4936
 epoch: 4, train_loss: 0.9889, test_loss: 0.9582, test_f1: 0.5128
 epoch: 5, train_loss: 0.9594, test_loss: 1.0180, test_f1: 0.4726
 epoch: 6, train_loss: 0.9580, test_loss: 0.9540, test_f1: 0.5045
 epoch: 7, train_loss: 0.9330, test_loss: 0.9043, test_f1: 0.5149
 epoch: 8, train_loss: 0.9126, test_loss: 0.9881, test_f1: 0.4719
 epoch: 9, train_loss: 0.9224, test_loss: 0.9708, test_f1: 0.5271
 epoch: 10, train_loss: 0.9082, test_loss: 0.8729, test_f1: 0.5391
 epoch: 11, train_loss: 0.9082, test_loss: 0.9282, test_f1: 0.5174
 epoch: 12, train_loss: 0.8886, test_loss: 0.8844, test_f1: 0.5352
 epoch: 13, train_loss: 0.8795, test_loss: 0.9726, test_f1: 0.5064
 epoch: 14, train_loss: 0.8903, test_loss: 1.0201, test_f1: 0.4596
 epoch: 15, train_loss: 0.8821, test_loss: 0.9300, test_f1: 0.5203
 epoch: 16, train_loss: 0.8643, test_loss: 0.9085, test_f1: 0.5385
 epoch: 17, train_loss: 0.8674, test_loss: 0.8733, test_f1: 0.5117
 epoch: 18, train_loss: 0.8542, test_loss: 1.0440, test_f1: 0.5554
 epoch: 19, train_loss: 0.8421, test_loss: 1.1771, test_f1: 0.5296
 epoch: 20, train_loss: 0.8384, test_loss: 0.8519, test_f1: 0.5417
 epoch: 21, train_loss: 0.8485, test_loss: 0.8671, test_f1: 0.5615
 epoch: 22, train_loss: 0.8505, test_loss: 0.9624, test_f1: 0.5020
 epoch: 23, train_loss: 0.8389, test_loss: 0.9597, test_f1: 0.5218
 epoch: 24, train_loss: 0.8241, test_loss: 0.9472, test_f1: 0.5449
 epoch: 25, train_loss: 0.8230, test_loss: 0.9886, test_f1: 0.5107
 epoch: 26, train_loss: 0.8248, test_loss: 0.8402, test_f1: 0.5614
 epoch: 27, train_loss: 0.8400, test_loss: 0.9233, test_f1: 0.4982
 epoch: 28, train_loss: 0.8452, test_loss: 1.0157, test_f1: 0.5355
 epoch: 29, train_loss: 0.8317, test_loss: 1.1907, test_f1: 0.5532
 epoch: 30, train_loss: 0.8215, test_loss: 0.9277, test_f1: 0.5596
 epoch: 31, train_loss: 0.8013, test_loss: 1.0883, test_f1: 0.5020
 epoch: 32, train_loss: 0.8027, test_loss: 0.9875, test_f1: 0.5330
 epoch: 33, train_loss: 0.7995, test_loss: 1.0071, test_f1: 0.5242
 epoch: 34, train_loss: 0.7963, test_loss: 0.9691, test_f1: 0.5598
 epoch: 35, train_loss: 0.8013, test_loss: 0.9722, test_f1: 0.5525
 epoch: 36, train_loss: 0.7874, test_loss: 0.9956, test_f1: 0.5688
 epoch: 37, train_loss: 0.8007, test_loss: 0.9971, test_f1: 0.5174
 epoch: 38, train_loss: 0.7969, test_loss: 1.0362, test_f1: 0.5294
 epoch: 39, train_loss: 0.7870, test_loss: 0.8705, test_f1: 0.5830
 epoch: 40, train_loss: 0.7823, test_loss: 0.9202, test_f1: 0.5854
 epoch: 41, train_loss: 0.7815, test_loss: 0.8609, test_f1: 0.5946
 epoch: 42, train_loss: 0.7821, test_loss: 0.9880, test_f1: 0.5639
 epoch: 43, train_loss: 0.7709, test_loss: 0.9692, test_f1: 0.5260
 epoch: 44, train_loss: 0.7843, test_loss: 0.9752, test_f1: 0.5630
 epoch: 45, train_loss: 0.7563, test_loss: 0.9807, test_f1: 0.5812
 epoch: 46, train_loss: 0.7844, test_loss: 0.8757, test_f1: 0.5650
 epoch: 47, train_loss: 0.7725, test_loss: 0.9610, test_f1: 0.5749
 epoch: 48, train_loss: 0.7597, test_loss: 0.9289, test_f1: 0.5621
 epoch: 49, train_loss: 0.7785, test_loss: 0.9650, test_f1: 0.5453
 epoch: 50, train_loss: 0.7676, test_loss: 0.9894, test_f1: 0.5932
 epoch: 51, train_loss: 0.7241, test_loss: 0.9108, test_f1: 0.5563
 epoch: 52, train_loss: 0.7153, test_loss: 0.9233, test_f1: 0.5689
 epoch: 53, train_loss: 0.7150, test_loss: 0.9290, test_f1: 0.5734
 epoch: 54, train_loss: 0.7137, test_loss: 0.8755, test_f1: 0.5883
 epoch: 55, train_loss: 0.7029, test_loss: 0.9778, test_f1: 0.5531
 epoch: 56, train_loss: 0.7131, test_loss: 0.9200, test_f1: 0.5529
 epoch: 57, train_loss: 0.7095, test_loss: 0.9318, test_f1: 0.5925
 epoch: 58, train_loss: 0.6989, test_loss: 0.8858, test_f1: 0.6180
 epoch: 59, train_loss: 0.6861, test_loss: 0.9363, test_f1: 0.5689
 epoch: 60, train_loss: 0.6965, test_loss: 0.9836, test_f1: 0.5753
 epoch: 61, train_loss: 0.6872, test_loss: 1.0429, test_f1: 0.5630
 epoch: 62, train_loss: 0.6913, test_loss: 0.8630, test_f1: 0.5982
 epoch: 63, train_loss: 0.6822, test_loss: 0.9225, test_f1: 0.6252
 epoch: 64, train_loss: 0.6711, test_loss: 0.9053, test_f1: 0.6195
 epoch: 65, train_loss: 0.6815, test_loss: 0.9121, test_f1: 0.5826
 epoch: 66, train_loss: 0.6836, test_loss: 0.8467, test_f1: 0.6382
 epoch: 67, train_loss: 0.6734, test_loss: 0.9704, test_f1: 0.5932
 epoch: 68, train_loss: 0.6691, test_loss: 0.9395, test_f1: 0.5968
 epoch: 69, train_loss: 0.6664, test_loss: 0.9569, test_f1: 0.5932
 epoch: 70, train_loss: 0.6712, test_loss: 0.8881, test_f1: 0.6001
 epoch: 71, train_loss: 0.6503, test_loss: 0.8750, test_f1: 0.6457
 epoch: 72, train_loss: 0.6706, test_loss: 0.9337, test_f1: 0.6246
 epoch: 73, train_loss: 0.6672, test_loss: 0.9429, test_f1: 0.6354
 epoch: 74, train_loss: 0.6552, test_loss: 0.9221, test_f1: 0.6194
 epoch: 75, train_loss: 0.6558, test_loss: 0.8969, test_f1: 0.6213
 epoch: 76, train_loss: 0.6636, test_loss: 0.9383, test_f1: 0.6082
 epoch: 77, train_loss: 0.6515, test_loss: 1.0178, test_f1: 0.6179
 epoch: 78, train_loss: 0.6734, test_loss: 0.8159, test_f1: 0.6516
 epoch: 79, train_loss: 0.6463, test_loss: 0.9123, test_f1: 0.6661
 epoch: 80, train_loss: 0.6530, test_loss: 0.9305, test_f1: 0.6347
 epoch: 81, train_loss: 0.6489, test_loss: 0.8950, test_f1: 0.6370
 epoch: 82, train_loss: 0.6530, test_loss: 0.9481, test_f1: 0.6373
 epoch: 83, train_loss: 0.6363, test_loss: 0.8820, test_f1: 0.6348
 epoch: 84, train_loss: 0.6457, test_loss: 0.9319, test_f1: 0.6280
 epoch: 85, train_loss: 0.6410, test_loss: 0.9238, test_f1: 0.6345
 epoch: 86, train_loss: 0.6332, test_loss: 0.8825, test_f1: 0.6114
 epoch: 87, train_loss: 0.6286, test_loss: 0.9043, test_f1: 0.6649
 epoch: 88, train_loss: 0.6233, test_loss: 0.8329, test_f1: 0.6424
 epoch: 89, train_loss: 0.6367, test_loss: 0.8083, test_f1: 0.6402
 epoch: 90, train_loss: 0.6237, test_loss: 0.9016, test_f1: 0.6524
 epoch: 91, train_loss: 0.6564, test_loss: 0.8701, test_f1: 0.6463
 epoch: 92, train_loss: 0.6331, test_loss: 0.9486, test_f1: 0.6110
 epoch: 93, train_loss: 0.6236, test_loss: 0.8527, test_f1: 0.6318
 epoch: 94, train_loss: 0.6465, test_loss: 0.9159, test_f1: 0.6227
 epoch: 95, train_loss: 0.6170, test_loss: 0.8867, test_f1: 0.6255
 epoch: 96, train_loss: 0.6312, test_loss: 0.9032, test_f1: 0.6376
 epoch: 97, train_loss: 0.6137, test_loss: 0.8650, test_f1: 0.6349
 epoch: 98, train_loss: 0.6261, test_loss: 0.9264, test_f1: 0.6303
 epoch: 99, train_loss: 0.6345, test_loss: 0.8610, test_f1: 0.6165
##################ITERATION #3 ****************************************
 epoch: 0, train_loss: 1.1474, test_loss: 1.2442, test_f1: 0.3192
 epoch: 1, train_loss: 1.0506, test_loss: 1.3060, test_f1: 0.3370
 epoch: 2, train_loss: 1.0203, test_loss: 1.0603, test_f1: 0.4926
 epoch: 3, train_loss: 1.0109, test_loss: 0.9822, test_f1: 0.4693
 epoch: 4, train_loss: 0.9901, test_loss: 1.6578, test_f1: 0.3099
 epoch: 5, train_loss: 0.9665, test_loss: 1.0672, test_f1: 0.4673
 epoch: 6, train_loss: 0.9687, test_loss: 0.9992, test_f1: 0.4734
 epoch: 7, train_loss: 0.9546, test_loss: 0.9163, test_f1: 0.5194
 epoch: 8, train_loss: 0.9328, test_loss: 0.9496, test_f1: 0.4933
 epoch: 9, train_loss: 0.9340, test_loss: 0.9734, test_f1: 0.4889
 epoch: 10, train_loss: 0.9108, test_loss: 1.0150, test_f1: 0.4424
 epoch: 11, train_loss: 0.8991, test_loss: 0.9130, test_f1: 0.5314
 epoch: 12, train_loss: 0.9150, test_loss: 1.1161, test_f1: 0.4501
 epoch: 13, train_loss: 0.9188, test_loss: 0.8987, test_f1: 0.5279
 epoch: 14, train_loss: 0.8906, test_loss: 0.9222, test_f1: 0.5179
 epoch: 15, train_loss: 0.8747, test_loss: 0.9698, test_f1: 0.4667
 epoch: 16, train_loss: 0.8620, test_loss: 0.8934, test_f1: 0.5150
 epoch: 17, train_loss: 0.8986, test_loss: 0.9004, test_f1: 0.5055
 epoch: 18, train_loss: 0.8789, test_loss: 1.0769, test_f1: 0.4617
 epoch: 19, train_loss: 0.8637, test_loss: 0.9561, test_f1: 0.5324
 epoch: 20, train_loss: 0.8605, test_loss: 1.0011, test_f1: 0.5093
 epoch: 21, train_loss: 0.8704, test_loss: 0.9419, test_f1: 0.5239
 epoch: 22, train_loss: 0.8573, test_loss: 0.9458, test_f1: 0.5277
 epoch: 23, train_loss: 0.8510, test_loss: 1.1669, test_f1: 0.4924
 epoch: 24, train_loss: 0.8352, test_loss: 0.8806, test_f1: 0.5148
 epoch: 25, train_loss: 0.8208, test_loss: 0.9030, test_f1: 0.5876
 epoch: 26, train_loss: 0.8219, test_loss: 1.0048, test_f1: 0.4864
 epoch: 27, train_loss: 0.8395, test_loss: 0.9429, test_f1: 0.5376
 epoch: 28, train_loss: 0.8139, test_loss: 0.8773, test_f1: 0.5482
 epoch: 29, train_loss: 0.8308, test_loss: 0.9234, test_f1: 0.5183
 epoch: 30, train_loss: 0.8211, test_loss: 0.9460, test_f1: 0.5312
 epoch: 31, train_loss: 0.8091, test_loss: 0.8513, test_f1: 0.5518
 epoch: 32, train_loss: 0.7993, test_loss: 0.9115, test_f1: 0.5456
 epoch: 33, train_loss: 0.8126, test_loss: 0.9424, test_f1: 0.5265
 epoch: 34, train_loss: 0.8181, test_loss: 0.8706, test_f1: 0.5777
 epoch: 35, train_loss: 0.8003, test_loss: 0.9073, test_f1: 0.5658
 epoch: 36, train_loss: 0.7950, test_loss: 1.0077, test_f1: 0.5438
 epoch: 37, train_loss: 0.7990, test_loss: 0.9416, test_f1: 0.5230
 epoch: 38, train_loss: 0.7958, test_loss: 0.9213, test_f1: 0.5292
 epoch: 39, train_loss: 0.7690, test_loss: 0.8677, test_f1: 0.5598
 epoch: 40, train_loss: 0.7878, test_loss: 0.8199, test_f1: 0.5679
 epoch: 41, train_loss: 0.7707, test_loss: 0.8172, test_f1: 0.5869
 epoch: 42, train_loss: 0.7730, test_loss: 0.8984, test_f1: 0.5589
 epoch: 43, train_loss: 0.7845, test_loss: 0.8695, test_f1: 0.5673
 epoch: 44, train_loss: 0.7468, test_loss: 0.8838, test_f1: 0.5629
 epoch: 45, train_loss: 0.7771, test_loss: 0.8115, test_f1: 0.5577
 epoch: 46, train_loss: 0.7596, test_loss: 0.8183, test_f1: 0.6203
 epoch: 47, train_loss: 0.7571, test_loss: 0.8775, test_f1: 0.5718
 epoch: 48, train_loss: 0.7570, test_loss: 0.8792, test_f1: 0.6010
 epoch: 49, train_loss: 0.7699, test_loss: 0.9552, test_f1: 0.6066
 epoch: 50, train_loss: 0.7563, test_loss: 1.0046, test_f1: 0.5969
 epoch: 51, train_loss: 0.7361, test_loss: 0.8920, test_f1: 0.5841
 epoch: 52, train_loss: 0.7337, test_loss: 0.8681, test_f1: 0.6132
 epoch: 53, train_loss: 0.7303, test_loss: 0.8237, test_f1: 0.5599
 epoch: 54, train_loss: 0.7155, test_loss: 0.7961, test_f1: 0.5625
 epoch: 55, train_loss: 0.7109, test_loss: 0.8792, test_f1: 0.5723
 epoch: 56, train_loss: 0.7061, test_loss: 0.8348, test_f1: 0.5978
 epoch: 57, train_loss: 0.7007, test_loss: 0.8327, test_f1: 0.5609
 epoch: 58, train_loss: 0.7122, test_loss: 0.9084, test_f1: 0.5392
 epoch: 59, train_loss: 0.7031, test_loss: 0.8178, test_f1: 0.6007
 epoch: 60, train_loss: 0.6984, test_loss: 0.8406, test_f1: 0.5812
 epoch: 61, train_loss: 0.7056, test_loss: 0.8714, test_f1: 0.5763
 epoch: 62, train_loss: 0.6839, test_loss: 1.0087, test_f1: 0.5646
 epoch: 63, train_loss: 0.6955, test_loss: 0.9168, test_f1: 0.6011
 epoch: 64, train_loss: 0.6852, test_loss: 0.9029, test_f1: 0.6213
 epoch: 65, train_loss: 0.6905, test_loss: 0.8552, test_f1: 0.5949
 epoch: 66, train_loss: 0.6799, test_loss: 0.9344, test_f1: 0.5711
 epoch: 67, train_loss: 0.6758, test_loss: 0.8543, test_f1: 0.5925
 epoch: 68, train_loss: 0.6947, test_loss: 0.8127, test_f1: 0.6114
 epoch: 69, train_loss: 0.6850, test_loss: 0.9025, test_f1: 0.5829
 epoch: 70, train_loss: 0.6827, test_loss: 0.8549, test_f1: 0.6040
 epoch: 71, train_loss: 0.6692, test_loss: 0.7946, test_f1: 0.6242
 epoch: 72, train_loss: 0.6722, test_loss: 0.8384, test_f1: 0.6044
 epoch: 73, train_loss: 0.6738, test_loss: 0.8672, test_f1: 0.5919
 epoch: 74, train_loss: 0.6647, test_loss: 0.8133, test_f1: 0.6259
 epoch: 75, train_loss: 0.6613, test_loss: 0.8234, test_f1: 0.6136
 epoch: 76, train_loss: 0.6554, test_loss: 0.8253, test_f1: 0.5813
 epoch: 77, train_loss: 0.6807, test_loss: 0.7895, test_f1: 0.5934
 epoch: 78, train_loss: 0.6597, test_loss: 0.8811, test_f1: 0.6133
 epoch: 79, train_loss: 0.6518, test_loss: 0.8512, test_f1: 0.6160
 epoch: 80, train_loss: 0.6523, test_loss: 0.8931, test_f1: 0.5785
 epoch: 81, train_loss: 0.6556, test_loss: 0.8624, test_f1: 0.6081
 epoch: 82, train_loss: 0.6552, test_loss: 0.8298, test_f1: 0.5818
 epoch: 83, train_loss: 0.6420, test_loss: 0.8877, test_f1: 0.5464
 epoch: 84, train_loss: 0.6618, test_loss: 0.8839, test_f1: 0.5974
 epoch: 85, train_loss: 0.6537, test_loss: 0.8101, test_f1: 0.6000
 epoch: 86, train_loss: 0.6554, test_loss: 0.8257, test_f1: 0.5981
 epoch: 87, train_loss: 0.6450, test_loss: 0.8255, test_f1: 0.5645
 epoch: 88, train_loss: 0.6558, test_loss: 0.9263, test_f1: 0.6430
 epoch: 89, train_loss: 0.6497, test_loss: 0.8410, test_f1: 0.6350
 epoch: 90, train_loss: 0.6457, test_loss: 0.9101, test_f1: 0.5919
 epoch: 91, train_loss: 0.6338, test_loss: 0.9758, test_f1: 0.6324
 epoch: 92, train_loss: 0.6504, test_loss: 0.9232, test_f1: 0.5893
 epoch: 93, train_loss: 0.6313, test_loss: 0.9209, test_f1: 0.6028
 epoch: 94, train_loss: 0.6271, test_loss: 0.8831, test_f1: 0.6334
 epoch: 95, train_loss: 0.6426, test_loss: 0.8875, test_f1: 0.5960
 epoch: 96, train_loss: 0.6347, test_loss: 0.8582, test_f1: 0.6266
 epoch: 97, train_loss: 0.6361, test_loss: 0.8764, test_f1: 0.6007
 epoch: 98, train_loss: 0.6340, test_loss: 0.8619, test_f1: 0.6019
 epoch: 99, train_loss: 0.6366, test_loss: 0.8787, test_f1: 0.6415
##################ITERATION #4 ****************************************
 epoch: 0, train_loss: 1.1594, test_loss: 1.1127, test_f1: 0.4698
 epoch: 1, train_loss: 1.0479, test_loss: 1.0665, test_f1: 0.4558
 epoch: 2, train_loss: 1.0184, test_loss: 0.9722, test_f1: 0.4857
 epoch: 3, train_loss: 1.0121, test_loss: 0.9820, test_f1: 0.4764
 epoch: 4, train_loss: 0.9984, test_loss: 0.9556, test_f1: 0.5196
 epoch: 5, train_loss: 0.9756, test_loss: 0.9207, test_f1: 0.5234
 epoch: 6, train_loss: 0.9620, test_loss: 1.0051, test_f1: 0.4797
 epoch: 7, train_loss: 0.9508, test_loss: 1.0452, test_f1: 0.5006
 epoch: 8, train_loss: 0.9466, test_loss: 0.9840, test_f1: 0.4577
 epoch: 9, train_loss: 0.9131, test_loss: 0.9588, test_f1: 0.4584
 epoch: 10, train_loss: 0.9284, test_loss: 0.9738, test_f1: 0.4755
 epoch: 11, train_loss: 0.9137, test_loss: 0.9843, test_f1: 0.4662
 epoch: 12, train_loss: 0.8982, test_loss: 1.0612, test_f1: 0.4636
 epoch: 13, train_loss: 0.8771, test_loss: 0.8652, test_f1: 0.5282
 epoch: 14, train_loss: 0.8903, test_loss: 1.0212, test_f1: 0.4961
 epoch: 15, train_loss: 0.8808, test_loss: 0.8939, test_f1: 0.5028
 epoch: 16, train_loss: 0.8806, test_loss: 1.0331, test_f1: 0.5003
 epoch: 17, train_loss: 0.8589, test_loss: 0.9661, test_f1: 0.5056
 epoch: 18, train_loss: 0.8726, test_loss: 0.9672, test_f1: 0.5104
 epoch: 19, train_loss: 0.8661, test_loss: 0.8971, test_f1: 0.5238
 epoch: 20, train_loss: 0.8430, test_loss: 0.9744, test_f1: 0.5142
 epoch: 21, train_loss: 0.8471, test_loss: 0.8347, test_f1: 0.5353
 epoch: 22, train_loss: 0.8456, test_loss: 0.9208, test_f1: 0.5229
 epoch: 23, train_loss: 0.8242, test_loss: 0.9715, test_f1: 0.5097
 epoch: 24, train_loss: 0.8503, test_loss: 0.9375, test_f1: 0.5170
 epoch: 25, train_loss: 0.8177, test_loss: 0.9724, test_f1: 0.5378
 epoch: 26, train_loss: 0.8473, test_loss: 0.9865, test_f1: 0.5000
 epoch: 27, train_loss: 0.8200, test_loss: 0.9303, test_f1: 0.5242
 epoch: 28, train_loss: 0.8364, test_loss: 0.9487, test_f1: 0.5505
 epoch: 29, train_loss: 0.8056, test_loss: 0.9511, test_f1: 0.5180
 epoch: 30, train_loss: 0.8229, test_loss: 0.8360, test_f1: 0.5395
 epoch: 31, train_loss: 0.8070, test_loss: 0.9195, test_f1: 0.5369
 epoch: 32, train_loss: 0.8134, test_loss: 0.9077, test_f1: 0.5367
 epoch: 33, train_loss: 0.8001, test_loss: 0.8152, test_f1: 0.5799
 epoch: 34, train_loss: 0.8198, test_loss: 0.9707, test_f1: 0.5110
 epoch: 35, train_loss: 0.8057, test_loss: 0.9278, test_f1: 0.5249
 epoch: 36, train_loss: 0.7958, test_loss: 0.8538, test_f1: 0.5498
 epoch: 37, train_loss: 0.7867, test_loss: 0.8439, test_f1: 0.5336
 epoch: 38, train_loss: 0.8046, test_loss: 1.0265, test_f1: 0.5191
 epoch: 39, train_loss: 0.7893, test_loss: 0.9681, test_f1: 0.5190
 epoch: 40, train_loss: 0.7878, test_loss: 0.8539, test_f1: 0.5502
 epoch: 41, train_loss: 0.7900, test_loss: 0.9321, test_f1: 0.5212
 epoch: 42, train_loss: 0.7960, test_loss: 0.8995, test_f1: 0.5622
 epoch: 43, train_loss: 0.7923, test_loss: 0.9014, test_f1: 0.5403
 epoch: 44, train_loss: 0.7881, test_loss: 0.9021, test_f1: 0.5226
 epoch: 45, train_loss: 0.7865, test_loss: 1.0881, test_f1: 0.4994
 epoch: 46, train_loss: 0.7782, test_loss: 0.9918, test_f1: 0.4956
 epoch: 47, train_loss: 0.7812, test_loss: 0.9055, test_f1: 0.5624
 epoch: 48, train_loss: 0.7648, test_loss: 0.8994, test_f1: 0.5277
 epoch: 49, train_loss: 0.7708, test_loss: 0.9761, test_f1: 0.5266
 epoch: 50, train_loss: 0.7731, test_loss: 0.9295, test_f1: 0.5070
 epoch: 51, train_loss: 0.7464, test_loss: 0.9891, test_f1: 0.5510
 epoch: 52, train_loss: 0.7349, test_loss: 1.0445, test_f1: 0.5965
 epoch: 53, train_loss: 0.7196, test_loss: 1.0169, test_f1: 0.5411
 epoch: 54, train_loss: 0.7223, test_loss: 0.9392, test_f1: 0.5734
 epoch: 55, train_loss: 0.7291, test_loss: 0.9670, test_f1: 0.5470
 epoch: 56, train_loss: 0.7255, test_loss: 0.9304, test_f1: 0.5271
 epoch: 57, train_loss: 0.7082, test_loss: 0.9022, test_f1: 0.6460
 epoch: 58, train_loss: 0.7037, test_loss: 0.9165, test_f1: 0.5814
 epoch: 59, train_loss: 0.7037, test_loss: 0.9146, test_f1: 0.6247
 epoch: 60, train_loss: 0.7005, test_loss: 1.0185, test_f1: 0.5371
 epoch: 61, train_loss: 0.6993, test_loss: 0.9753, test_f1: 0.5728
 epoch: 62, train_loss: 0.7137, test_loss: 0.9543, test_f1: 0.5868
 epoch: 63, train_loss: 0.6858, test_loss: 0.9215, test_f1: 0.5593
 epoch: 64, train_loss: 0.7031, test_loss: 0.9431, test_f1: 0.5698
 epoch: 65, train_loss: 0.6763, test_loss: 0.9738, test_f1: 0.5968
 epoch: 66, train_loss: 0.6848, test_loss: 0.9747, test_f1: 0.5765
 epoch: 67, train_loss: 0.6884, test_loss: 0.9489, test_f1: 0.5317
 epoch: 68, train_loss: 0.6807, test_loss: 1.0579, test_f1: 0.5963
 epoch: 69, train_loss: 0.6982, test_loss: 0.9298, test_f1: 0.5851
 epoch: 70, train_loss: 0.7318, test_loss: 0.9256, test_f1: 0.5517
 epoch: 71, train_loss: 0.6764, test_loss: 0.9551, test_f1: 0.5938
 epoch: 72, train_loss: 0.6764, test_loss: 0.9313, test_f1: 0.6063
 epoch: 73, train_loss: 0.6941, test_loss: 0.9325, test_f1: 0.5420
 epoch: 74, train_loss: 0.6824, test_loss: 0.9546, test_f1: 0.6037
 epoch: 75, train_loss: 0.6727, test_loss: 0.9397, test_f1: 0.5654
 epoch: 76, train_loss: 0.6716, test_loss: 0.9630, test_f1: 0.5597
 epoch: 77, train_loss: 0.7002, test_loss: 0.9078, test_f1: 0.6043
 epoch: 78, train_loss: 0.6774, test_loss: 0.9304, test_f1: 0.5946
 epoch: 79, train_loss: 0.6749, test_loss: 0.9506, test_f1: 0.5834
 epoch: 80, train_loss: 0.6693, test_loss: 0.9318, test_f1: 0.5541
 epoch: 81, train_loss: 0.6577, test_loss: 0.9425, test_f1: 0.6094
 epoch: 82, train_loss: 0.6638, test_loss: 0.9368, test_f1: 0.6020
 epoch: 83, train_loss: 0.6640, test_loss: 0.9629, test_f1: 0.6063
 epoch: 84, train_loss: 0.6679, test_loss: 0.9244, test_f1: 0.6073
 epoch: 85, train_loss: 0.6572, test_loss: 0.9380, test_f1: 0.5968
 epoch: 86, train_loss: 0.6591, test_loss: 0.9660, test_f1: 0.6291
 epoch: 87, train_loss: 0.6833, test_loss: 0.9808, test_f1: 0.5884
 epoch: 88, train_loss: 0.6724, test_loss: 0.9624, test_f1: 0.6417
 epoch: 89, train_loss: 0.6501, test_loss: 0.9928, test_f1: 0.6307
 epoch: 90, train_loss: 0.6688, test_loss: 0.9520, test_f1: 0.5712
 epoch: 91, train_loss: 0.6512, test_loss: 0.9861, test_f1: 0.5842
 epoch: 92, train_loss: 0.6602, test_loss: 0.9916, test_f1: 0.6027
 epoch: 93, train_loss: 0.6547, test_loss: 1.0196, test_f1: 0.5709
 epoch: 94, train_loss: 0.6535, test_loss: 0.9335, test_f1: 0.6145
 epoch: 95, train_loss: 0.6697, test_loss: 1.0219, test_f1: 0.5772
 epoch: 96, train_loss: 0.6528, test_loss: 0.9853, test_f1: 0.5879
 epoch: 97, train_loss: 0.6536, test_loss: 1.0282, test_f1: 0.5630
 epoch: 98, train_loss: 0.6724, test_loss: 0.9189, test_f1: 0.5780
 epoch: 99, train_loss: 0.6440, test_loss: 0.9616, test_f1: 0.5854
##################ITERATION #5 ****************************************
 epoch: 0, train_loss: 1.1361, test_loss: 1.3255, test_f1: 0.4100
 epoch: 1, train_loss: 1.0354, test_loss: 1.0189, test_f1: 0.4826
 epoch: 2, train_loss: 0.9899, test_loss: 0.9860, test_f1: 0.5131
 epoch: 3, train_loss: 0.9736, test_loss: 0.9454, test_f1: 0.5207
 epoch: 4, train_loss: 0.9557, test_loss: 1.0507, test_f1: 0.4756
 epoch: 5, train_loss: 0.9402, test_loss: 0.9661, test_f1: 0.4901
 epoch: 6, train_loss: 0.9362, test_loss: 1.1634, test_f1: 0.4561
 epoch: 7, train_loss: 0.9386, test_loss: 0.9669, test_f1: 0.5498
 epoch: 8, train_loss: 0.9168, test_loss: 0.9726, test_f1: 0.4977
 epoch: 9, train_loss: 0.9260, test_loss: 0.8763, test_f1: 0.5385
 epoch: 10, train_loss: 0.9098, test_loss: 0.9525, test_f1: 0.5031
 epoch: 11, train_loss: 0.9018, test_loss: 0.9305, test_f1: 0.5298
 epoch: 12, train_loss: 0.8894, test_loss: 1.0263, test_f1: 0.4922
 epoch: 13, train_loss: 0.8994, test_loss: 0.9654, test_f1: 0.5240
 epoch: 14, train_loss: 0.8930, test_loss: 0.8505, test_f1: 0.5380
 epoch: 15, train_loss: 0.8746, test_loss: 1.0420, test_f1: 0.5208
 epoch: 16, train_loss: 0.8740, test_loss: 0.9046, test_f1: 0.5437
 epoch: 17, train_loss: 0.8585, test_loss: 0.9271, test_f1: 0.5451
 epoch: 18, train_loss: 0.8487, test_loss: 0.8906, test_f1: 0.5457
 epoch: 19, train_loss: 0.8640, test_loss: 0.9384, test_f1: 0.4993
 epoch: 20, train_loss: 0.8580, test_loss: 0.9196, test_f1: 0.5254
 epoch: 21, train_loss: 0.8401, test_loss: 0.9210, test_f1: 0.5291
 epoch: 22, train_loss: 0.8217, test_loss: 0.8964, test_f1: 0.5454
 epoch: 23, train_loss: 0.8307, test_loss: 1.1363, test_f1: 0.4977
 epoch: 24, train_loss: 0.8235, test_loss: 0.9153, test_f1: 0.5076
 epoch: 25, train_loss: 0.8117, test_loss: 0.9707, test_f1: 0.5218
 epoch: 26, train_loss: 0.8049, test_loss: 1.0228, test_f1: 0.5732
 epoch: 27, train_loss: 0.8201, test_loss: 1.0287, test_f1: 0.5172
 epoch: 28, train_loss: 0.8007, test_loss: 0.9663, test_f1: 0.5351
 epoch: 29, train_loss: 0.8011, test_loss: 0.9433, test_f1: 0.5438
 epoch: 30, train_loss: 0.8109, test_loss: 0.9198, test_f1: 0.5505
 epoch: 31, train_loss: 0.7944, test_loss: 1.0100, test_f1: 0.5123
 epoch: 32, train_loss: 0.8386, test_loss: 0.9488, test_f1: 0.5591
 epoch: 33, train_loss: 0.8111, test_loss: 0.8884, test_f1: 0.5578
 epoch: 34, train_loss: 0.8107, test_loss: 0.9151, test_f1: 0.5412
 epoch: 35, train_loss: 0.7685, test_loss: 0.9408, test_f1: 0.5426
 epoch: 36, train_loss: 0.8087, test_loss: 0.9398, test_f1: 0.5417
 epoch: 37, train_loss: 0.7825, test_loss: 0.9497, test_f1: 0.5187
 epoch: 38, train_loss: 0.8253, test_loss: 1.3854, test_f1: 0.3427
 epoch: 39, train_loss: 0.9548, test_loss: 1.0155, test_f1: 0.5012
 epoch: 40, train_loss: 0.8912, test_loss: 0.9352, test_f1: 0.5165
 epoch: 41, train_loss: 0.8767, test_loss: 0.9902, test_f1: 0.5092
 epoch: 42, train_loss: 0.8820, test_loss: 0.9216, test_f1: 0.5216
 epoch: 43, train_loss: 0.8439, test_loss: 0.9550, test_f1: 0.5618
 epoch: 44, train_loss: 0.8425, test_loss: 0.9299, test_f1: 0.5374
 epoch: 45, train_loss: 0.8443, test_loss: 0.9689, test_f1: 0.5586
 epoch: 46, train_loss: 0.8035, test_loss: 0.9458, test_f1: 0.5730
 epoch: 47, train_loss: 0.8265, test_loss: 0.9956, test_f1: 0.5405
 epoch: 48, train_loss: 0.8131, test_loss: 0.9444, test_f1: 0.5501
 epoch: 49, train_loss: 0.8246, test_loss: 0.9361, test_f1: 0.5381
 epoch: 50, train_loss: 0.7998, test_loss: 1.0050, test_f1: 0.5055
 epoch: 51, train_loss: 0.7731, test_loss: 0.9421, test_f1: 0.5643
 epoch: 52, train_loss: 0.7584, test_loss: 0.9154, test_f1: 0.5510
 epoch: 53, train_loss: 0.7435, test_loss: 0.9817, test_f1: 0.5477
 epoch: 54, train_loss: 0.7573, test_loss: 0.9927, test_f1: 0.5535
 epoch: 55, train_loss: 0.7479, test_loss: 0.9789, test_f1: 0.5443
 epoch: 56, train_loss: 0.7354, test_loss: 0.9366, test_f1: 0.5952
 epoch: 57, train_loss: 0.7440, test_loss: 0.9451, test_f1: 0.5494
 epoch: 58, train_loss: 0.7284, test_loss: 0.9405, test_f1: 0.5812
 epoch: 59, train_loss: 0.7459, test_loss: 0.9389, test_f1: 0.5608
 epoch: 60, train_loss: 0.7279, test_loss: 0.9294, test_f1: 0.5549
 epoch: 61, train_loss: 0.7354, test_loss: 0.9453, test_f1: 0.5684
 epoch: 62, train_loss: 0.7240, test_loss: 0.9575, test_f1: 0.5962
 epoch: 63, train_loss: 0.7303, test_loss: 1.0222, test_f1: 0.6011
 epoch: 64, train_loss: 0.7128, test_loss: 0.9739, test_f1: 0.5994
 epoch: 65, train_loss: 0.7263, test_loss: 1.0462, test_f1: 0.5586
 epoch: 66, train_loss: 0.7089, test_loss: 1.0344, test_f1: 0.5882
 epoch: 67, train_loss: 0.7099, test_loss: 0.9999, test_f1: 0.5939
 epoch: 68, train_loss: 0.7105, test_loss: 0.9875, test_f1: 0.6016
 epoch: 69, train_loss: 0.6977, test_loss: 0.9962, test_f1: 0.6148
 epoch: 70, train_loss: 0.7024, test_loss: 1.0011, test_f1: 0.5815
 epoch: 71, train_loss: 0.7050, test_loss: 1.0545, test_f1: 0.5953
 epoch: 72, train_loss: 0.6985, test_loss: 1.0489, test_f1: 0.6116
 epoch: 73, train_loss: 0.6969, test_loss: 0.9893, test_f1: 0.6005
 epoch: 74, train_loss: 0.7035, test_loss: 0.9728, test_f1: 0.5602
 epoch: 75, train_loss: 0.6976, test_loss: 0.9873, test_f1: 0.5482
 epoch: 76, train_loss: 0.6812, test_loss: 1.0508, test_f1: 0.5762
 epoch: 77, train_loss: 0.6996, test_loss: 0.9805, test_f1: 0.5648
 epoch: 78, train_loss: 0.6838, test_loss: 0.9983, test_f1: 0.6178
 epoch: 79, train_loss: 0.6971, test_loss: 0.9536, test_f1: 0.5825
 epoch: 80, train_loss: 0.6922, test_loss: 0.9311, test_f1: 0.5708
 epoch: 81, train_loss: 0.6930, test_loss: 1.0027, test_f1: 0.5732
 epoch: 82, train_loss: 0.6962, test_loss: 1.0408, test_f1: 0.5783
 epoch: 83, train_loss: 0.6947, test_loss: 1.0633, test_f1: 0.5722
 epoch: 84, train_loss: 0.6973, test_loss: 1.0802, test_f1: 0.6073
 epoch: 85, train_loss: 0.6857, test_loss: 1.0724, test_f1: 0.5985
 epoch: 86, train_loss: 0.6894, test_loss: 0.9683, test_f1: 0.5815
 epoch: 87, train_loss: 0.6795, test_loss: 1.0361, test_f1: 0.6126
 epoch: 88, train_loss: 0.6778, test_loss: 1.0862, test_f1: 0.5812
 epoch: 89, train_loss: 0.6609, test_loss: 1.0476, test_f1: 0.5959
 epoch: 90, train_loss: 0.6789, test_loss: 1.0363, test_f1: 0.5536
 epoch: 91, train_loss: 0.6706, test_loss: 1.0608, test_f1: 0.5957
 epoch: 92, train_loss: 0.6753, test_loss: 1.0902, test_f1: 0.6133
 epoch: 93, train_loss: 0.6766, test_loss: 1.0481, test_f1: 0.5842
 epoch: 94, train_loss: 0.6644, test_loss: 0.9889, test_f1: 0.6230
 epoch: 95, train_loss: 0.6713, test_loss: 0.9903, test_f1: 0.6232
 epoch: 96, train_loss: 0.6757, test_loss: 1.0899, test_f1: 0.5842
 epoch: 97, train_loss: 0.6771, test_loss: 1.0179, test_f1: 0.6061
 epoch: 98, train_loss: 0.6665, test_loss: 1.0582, test_f1: 0.5869
 epoch: 99, train_loss: 0.6575, test_loss: 0.9667, test_f1: 0.6094
##################ITERATION #6 ****************************************
 epoch: 0, train_loss: 1.1138, test_loss: 1.0582, test_f1: 0.4543
 epoch: 1, train_loss: 1.0240, test_loss: 1.0248, test_f1: 0.4564
 epoch: 2, train_loss: 0.9875, test_loss: 1.1718, test_f1: 0.4177
 epoch: 3, train_loss: 0.9718, test_loss: 0.9894, test_f1: 0.4585
 epoch: 4, train_loss: 0.9460, test_loss: 1.0004, test_f1: 0.4888
 epoch: 5, train_loss: 0.9424, test_loss: 1.0162, test_f1: 0.4886
 epoch: 6, train_loss: 0.9170, test_loss: 0.9438, test_f1: 0.4951
 epoch: 7, train_loss: 0.9092, test_loss: 0.9304, test_f1: 0.5272
 epoch: 8, train_loss: 0.8929, test_loss: 1.0854, test_f1: 0.5026
 epoch: 9, train_loss: 0.8972, test_loss: 0.9373, test_f1: 0.5233
 epoch: 10, train_loss: 0.8874, test_loss: 0.9174, test_f1: 0.5245
 epoch: 11, train_loss: 0.8719, test_loss: 0.9319, test_f1: 0.5423
 epoch: 12, train_loss: 0.8634, test_loss: 0.9445, test_f1: 0.5712
 epoch: 13, train_loss: 0.8744, test_loss: 0.8994, test_f1: 0.6024
 epoch: 14, train_loss: 0.8610, test_loss: 1.1528, test_f1: 0.4600
 epoch: 15, train_loss: 0.8450, test_loss: 0.8503, test_f1: 0.5513
 epoch: 16, train_loss: 0.8578, test_loss: 0.9452, test_f1: 0.5124
 epoch: 17, train_loss: 0.8145, test_loss: 0.8759, test_f1: 0.5440
 epoch: 18, train_loss: 0.8220, test_loss: 0.9784, test_f1: 0.5325
 epoch: 19, train_loss: 0.8388, test_loss: 0.9022, test_f1: 0.5378
 epoch: 20, train_loss: 0.8113, test_loss: 0.8982, test_f1: 0.5413
 epoch: 21, train_loss: 0.8188, test_loss: 1.1065, test_f1: 0.4267
 epoch: 22, train_loss: 0.8217, test_loss: 0.8592, test_f1: 0.5691
 epoch: 23, train_loss: 0.8091, test_loss: 0.9332, test_f1: 0.5753
 epoch: 24, train_loss: 0.8092, test_loss: 0.8779, test_f1: 0.5904
 epoch: 25, train_loss: 0.7928, test_loss: 0.9033, test_f1: 0.5789
 epoch: 26, train_loss: 0.7887, test_loss: 0.9247, test_f1: 0.5936
 epoch: 27, train_loss: 0.8002, test_loss: 0.9616, test_f1: 0.5521
 epoch: 28, train_loss: 0.7903, test_loss: 0.8987, test_f1: 0.5814
 epoch: 29, train_loss: 0.7626, test_loss: 0.8905, test_f1: 0.5935
 epoch: 30, train_loss: 0.7650, test_loss: 0.8714, test_f1: 0.5831
 epoch: 31, train_loss: 0.7600, test_loss: 0.9083, test_f1: 0.5532
 epoch: 32, train_loss: 0.7574, test_loss: 0.8095, test_f1: 0.6265
 epoch: 33, train_loss: 0.7595, test_loss: 0.8425, test_f1: 0.6114
 epoch: 34, train_loss: 0.7806, test_loss: 0.8626, test_f1: 0.5736
 epoch: 35, train_loss: 0.7482, test_loss: 0.7711, test_f1: 0.5829
 epoch: 36, train_loss: 0.7612, test_loss: 0.8754, test_f1: 0.5605
 epoch: 37, train_loss: 0.7681, test_loss: 0.8668, test_f1: 0.6246
 epoch: 38, train_loss: 0.7412, test_loss: 0.9167, test_f1: 0.5578
 epoch: 39, train_loss: 0.7420, test_loss: 0.8957, test_f1: 0.5958
 epoch: 40, train_loss: 0.7178, test_loss: 0.8307, test_f1: 0.5812
 epoch: 41, train_loss: 0.7329, test_loss: 0.9069, test_f1: 0.6328
 epoch: 42, train_loss: 0.7462, test_loss: 0.9017, test_f1: 0.5733
 epoch: 43, train_loss: 0.7301, test_loss: 0.8740, test_f1: 0.6119
 epoch: 44, train_loss: 0.7321, test_loss: 0.8675, test_f1: 0.5969
 epoch: 45, train_loss: 0.7402, test_loss: 0.7771, test_f1: 0.5737
 epoch: 46, train_loss: 0.7399, test_loss: 0.9439, test_f1: 0.6101
 epoch: 47, train_loss: 0.7179, test_loss: 0.9494, test_f1: 0.6166
 epoch: 48, train_loss: 0.7227, test_loss: 0.9769, test_f1: 0.5821
 epoch: 49, train_loss: 0.7213, test_loss: 0.8221, test_f1: 0.5937
 epoch: 50, train_loss: 0.7248, test_loss: 0.9308, test_f1: 0.5957
 epoch: 51, train_loss: 0.6842, test_loss: 0.8603, test_f1: 0.6366
 epoch: 52, train_loss: 0.6760, test_loss: 0.8759, test_f1: 0.6437
 epoch: 53, train_loss: 0.6762, test_loss: 0.8910, test_f1: 0.6390
 epoch: 54, train_loss: 0.6600, test_loss: 0.8838, test_f1: 0.6432
 epoch: 55, train_loss: 0.6519, test_loss: 0.8786, test_f1: 0.6593
 epoch: 56, train_loss: 0.6509, test_loss: 0.8824, test_f1: 0.6211
 epoch: 57, train_loss: 0.6562, test_loss: 0.9166, test_f1: 0.6428
 epoch: 58, train_loss: 0.6561, test_loss: 0.8322, test_f1: 0.6616
 epoch: 59, train_loss: 0.6433, test_loss: 0.8875, test_f1: 0.6370
 epoch: 60, train_loss: 0.6442, test_loss: 0.9099, test_f1: 0.6536
 epoch: 61, train_loss: 0.6440, test_loss: 0.8811, test_f1: 0.6557
 epoch: 62, train_loss: 0.6353, test_loss: 0.8976, test_f1: 0.6425
 epoch: 63, train_loss: 0.6327, test_loss: 0.9572, test_f1: 0.6520
 epoch: 64, train_loss: 0.6402, test_loss: 0.8298, test_f1: 0.6430
 epoch: 65, train_loss: 0.6357, test_loss: 0.9565, test_f1: 0.6568
 epoch: 66, train_loss: 0.6402, test_loss: 0.8495, test_f1: 0.6556
 epoch: 67, train_loss: 0.6343, test_loss: 0.8422, test_f1: 0.6576
 epoch: 68, train_loss: 0.6219, test_loss: 0.9167, test_f1: 0.6293
 epoch: 69, train_loss: 0.6150, test_loss: 1.0202, test_f1: 0.6160
 epoch: 70, train_loss: 0.6412, test_loss: 0.8630, test_f1: 0.6338
 epoch: 71, train_loss: 0.6295, test_loss: 0.8825, test_f1: 0.6418
 epoch: 72, train_loss: 0.6172, test_loss: 0.8482, test_f1: 0.6572
 epoch: 73, train_loss: 0.6212, test_loss: 0.8808, test_f1: 0.6610
 epoch: 74, train_loss: 0.6345, test_loss: 0.9401, test_f1: 0.6634
 epoch: 75, train_loss: 0.6176, test_loss: 0.8786, test_f1: 0.6780
 epoch: 76, train_loss: 0.6339, test_loss: 0.9036, test_f1: 0.6375
 epoch: 77, train_loss: 0.6384, test_loss: 0.8924, test_f1: 0.6497
 epoch: 78, train_loss: 0.6172, test_loss: 0.9311, test_f1: 0.6385
 epoch: 79, train_loss: 0.6527, test_loss: 0.8332, test_f1: 0.6565
 epoch: 80, train_loss: 0.6167, test_loss: 0.9244, test_f1: 0.6681
 epoch: 81, train_loss: 0.6027, test_loss: 0.9404, test_f1: 0.6250
 epoch: 82, train_loss: 0.6202, test_loss: 0.9026, test_f1: 0.6633
 epoch: 83, train_loss: 0.5962, test_loss: 0.9338, test_f1: 0.6573
 epoch: 84, train_loss: 0.6088, test_loss: 0.9753, test_f1: 0.6652
 epoch: 85, train_loss: 0.6233, test_loss: 0.9513, test_f1: 0.6391
 epoch: 86, train_loss: 0.6067, test_loss: 0.9846, test_f1: 0.6523
 epoch: 87, train_loss: 0.6091, test_loss: 0.8874, test_f1: 0.6529
 epoch: 88, train_loss: 0.5861, test_loss: 0.9420, test_f1: 0.6430
 epoch: 89, train_loss: 0.5915, test_loss: 0.9698, test_f1: 0.6456
 epoch: 90, train_loss: 0.6078, test_loss: 1.0557, test_f1: 0.6363
 epoch: 91, train_loss: 0.5966, test_loss: 0.9343, test_f1: 0.6369
 epoch: 92, train_loss: 0.5873, test_loss: 1.0212, test_f1: 0.6365
 epoch: 93, train_loss: 0.5890, test_loss: 0.9575, test_f1: 0.6479
 epoch: 94, train_loss: 0.5995, test_loss: 0.9895, test_f1: 0.6532
 epoch: 95, train_loss: 0.5874, test_loss: 0.9916, test_f1: 0.6163
 epoch: 96, train_loss: 0.5976, test_loss: 1.0534, test_f1: 0.6582
 epoch: 97, train_loss: 0.5857, test_loss: 0.9430, test_f1: 0.6318
 epoch: 98, train_loss: 0.5685, test_loss: 0.9609, test_f1: 0.6521
 epoch: 99, train_loss: 0.5780, test_loss: 0.9442, test_f1: 0.6538
##################ITERATION #7 ****************************************
 epoch: 0, train_loss: 1.1490, test_loss: 1.1102, test_f1: 0.4035
 epoch: 1, train_loss: 1.0171, test_loss: 1.0797, test_f1: 0.4401
 epoch: 2, train_loss: 1.0247, test_loss: 1.0129, test_f1: 0.4641
 epoch: 3, train_loss: 1.0066, test_loss: 0.9875, test_f1: 0.5319
 epoch: 4, train_loss: 0.9880, test_loss: 1.0300, test_f1: 0.5232
 epoch: 5, train_loss: 0.9870, test_loss: 1.1034, test_f1: 0.4272
 epoch: 6, train_loss: 0.9644, test_loss: 1.2221, test_f1: 0.4231
 epoch: 7, train_loss: 0.9587, test_loss: 0.9809, test_f1: 0.4743
 epoch: 8, train_loss: 0.9343, test_loss: 0.9780, test_f1: 0.4795
 epoch: 9, train_loss: 0.9427, test_loss: 0.9468, test_f1: 0.5120
 epoch: 10, train_loss: 0.9252, test_loss: 0.8858, test_f1: 0.5241
 epoch: 11, train_loss: 0.9226, test_loss: 0.9595, test_f1: 0.5143
 epoch: 12, train_loss: 0.9286, test_loss: 0.9765, test_f1: 0.4965
 epoch: 13, train_loss: 0.9022, test_loss: 0.9386, test_f1: 0.4770
 epoch: 14, train_loss: 0.8981, test_loss: 0.9528, test_f1: 0.5038
 epoch: 15, train_loss: 0.8977, test_loss: 0.9136, test_f1: 0.5098
 epoch: 16, train_loss: 0.8971, test_loss: 0.9538, test_f1: 0.5135
 epoch: 17, train_loss: 0.8873, test_loss: 0.9949, test_f1: 0.4716
 epoch: 18, train_loss: 0.8895, test_loss: 0.8653, test_f1: 0.4948
 epoch: 19, train_loss: 0.8694, test_loss: 0.9400, test_f1: 0.5322
 epoch: 20, train_loss: 0.8621, test_loss: 0.8480, test_f1: 0.5365
 epoch: 21, train_loss: 0.8780, test_loss: 0.9254, test_f1: 0.5248
 epoch: 22, train_loss: 0.8546, test_loss: 0.9244, test_f1: 0.5614
 epoch: 23, train_loss: 0.8587, test_loss: 0.8859, test_f1: 0.5316
 epoch: 24, train_loss: 0.8533, test_loss: 0.9120, test_f1: 0.5295
 epoch: 25, train_loss: 0.8527, test_loss: 0.9260, test_f1: 0.5496
 epoch: 26, train_loss: 0.8535, test_loss: 0.9075, test_f1: 0.5247
 epoch: 27, train_loss: 0.8510, test_loss: 0.9801, test_f1: 0.5353
 epoch: 28, train_loss: 0.8487, test_loss: 0.9522, test_f1: 0.5400
 epoch: 29, train_loss: 0.8370, test_loss: 0.8651, test_f1: 0.5517
 epoch: 30, train_loss: 0.8246, test_loss: 0.9288, test_f1: 0.5386
 epoch: 31, train_loss: 0.8193, test_loss: 0.9634, test_f1: 0.5294
 epoch: 32, train_loss: 0.8218, test_loss: 0.9408, test_f1: 0.5344
 epoch: 33, train_loss: 0.8162, test_loss: 0.8601, test_f1: 0.5656
 epoch: 34, train_loss: 0.8214, test_loss: 1.0403, test_f1: 0.5188
 epoch: 35, train_loss: 0.8115, test_loss: 0.9184, test_f1: 0.5583
 epoch: 36, train_loss: 0.8029, test_loss: 0.9252, test_f1: 0.5579
 epoch: 37, train_loss: 0.8040, test_loss: 0.9128, test_f1: 0.5538
 epoch: 38, train_loss: 0.8168, test_loss: 0.8681, test_f1: 0.5253
 epoch: 39, train_loss: 0.8072, test_loss: 0.9463, test_f1: 0.5441
 epoch: 40, train_loss: 0.7973, test_loss: 1.3426, test_f1: 0.4881
 epoch: 41, train_loss: 0.8168, test_loss: 0.8750, test_f1: 0.6141
 epoch: 42, train_loss: 0.8001, test_loss: 0.9186, test_f1: 0.5116
 epoch: 43, train_loss: 0.7916, test_loss: 1.0347, test_f1: 0.4977
 epoch: 44, train_loss: 0.7890, test_loss: 0.8679, test_f1: 0.5585
 epoch: 45, train_loss: 0.7834, test_loss: 0.9201, test_f1: 0.5856
 epoch: 46, train_loss: 0.7862, test_loss: 0.8562, test_f1: 0.5763
 epoch: 47, train_loss: 0.7876, test_loss: 0.8732, test_f1: 0.5449
 epoch: 48, train_loss: 0.7759, test_loss: 0.8461, test_f1: 0.5573
 epoch: 49, train_loss: 0.7814, test_loss: 0.8467, test_f1: 0.5591
 epoch: 50, train_loss: 0.7807, test_loss: 0.9524, test_f1: 0.5334
 epoch: 51, train_loss: 0.7489, test_loss: 0.8529, test_f1: 0.5799
 epoch: 52, train_loss: 0.7524, test_loss: 0.8997, test_f1: 0.5989
 epoch: 53, train_loss: 0.7369, test_loss: 0.8309, test_f1: 0.6064
 epoch: 54, train_loss: 0.7238, test_loss: 0.8499, test_f1: 0.5738
 epoch: 55, train_loss: 0.7437, test_loss: 0.9107, test_f1: 0.6031
 epoch: 56, train_loss: 0.7202, test_loss: 0.8395, test_f1: 0.5725
 epoch: 57, train_loss: 0.7195, test_loss: 0.8498, test_f1: 0.5721
 epoch: 58, train_loss: 0.7218, test_loss: 0.8379, test_f1: 0.6049
 epoch: 59, train_loss: 0.7157, test_loss: 0.8949, test_f1: 0.6038
 epoch: 60, train_loss: 0.7093, test_loss: 0.8969, test_f1: 0.6045
 epoch: 61, train_loss: 0.7131, test_loss: 0.8190, test_f1: 0.6150
 epoch: 62, train_loss: 0.7100, test_loss: 0.8965, test_f1: 0.5744
 epoch: 63, train_loss: 0.7026, test_loss: 0.8576, test_f1: 0.5607
 epoch: 64, train_loss: 0.6960, test_loss: 0.8948, test_f1: 0.5951
 epoch: 65, train_loss: 0.7123, test_loss: 0.8485, test_f1: 0.5971
 epoch: 66, train_loss: 0.7100, test_loss: 0.8251, test_f1: 0.5832
 epoch: 67, train_loss: 0.7160, test_loss: 0.9194, test_f1: 0.5792
 epoch: 68, train_loss: 0.7033, test_loss: 0.9474, test_f1: 0.5610
 epoch: 69, train_loss: 0.7026, test_loss: 0.8416, test_f1: 0.6057
 epoch: 70, train_loss: 0.6954, test_loss: 0.8669, test_f1: 0.5985
 epoch: 71, train_loss: 0.7012, test_loss: 0.7981, test_f1: 0.6014
 epoch: 72, train_loss: 0.7091, test_loss: 0.8598, test_f1: 0.6110
 epoch: 73, train_loss: 0.6882, test_loss: 0.8692, test_f1: 0.5772
 epoch: 74, train_loss: 0.6909, test_loss: 0.8555, test_f1: 0.5939
 epoch: 75, train_loss: 0.6899, test_loss: 0.8962, test_f1: 0.6403
 epoch: 76, train_loss: 0.7085, test_loss: 0.8356, test_f1: 0.6108
 epoch: 77, train_loss: 0.6791, test_loss: 0.8820, test_f1: 0.5746
 epoch: 78, train_loss: 0.6977, test_loss: 0.9502, test_f1: 0.6286
 epoch: 79, train_loss: 0.6837, test_loss: 0.8709, test_f1: 0.5668
 epoch: 80, train_loss: 0.6848, test_loss: 0.9678, test_f1: 0.5982
 epoch: 81, train_loss: 0.6793, test_loss: 0.8808, test_f1: 0.5956
 epoch: 82, train_loss: 0.6747, test_loss: 0.8731, test_f1: 0.5868
 epoch: 83, train_loss: 0.6768, test_loss: 0.9949, test_f1: 0.5454
 epoch: 84, train_loss: 0.6741, test_loss: 0.8524, test_f1: 0.6044
 epoch: 85, train_loss: 0.6984, test_loss: 0.8461, test_f1: 0.6132
 epoch: 86, train_loss: 0.6802, test_loss: 0.8382, test_f1: 0.6230
 epoch: 87, train_loss: 0.6885, test_loss: 0.8371, test_f1: 0.6078
 epoch: 88, train_loss: 0.6804, test_loss: 0.9078, test_f1: 0.5830
 epoch: 89, train_loss: 0.6716, test_loss: 0.8995, test_f1: 0.5769
 epoch: 90, train_loss: 0.6676, test_loss: 0.8667, test_f1: 0.5784
 epoch: 91, train_loss: 0.6607, test_loss: 0.8639, test_f1: 0.5992
 epoch: 92, train_loss: 0.6714, test_loss: 0.9092, test_f1: 0.5886
 epoch: 93, train_loss: 0.6783, test_loss: 0.9169, test_f1: 0.5520
 epoch: 94, train_loss: 0.6503, test_loss: 0.8271, test_f1: 0.5920
 epoch: 95, train_loss: 0.6584, test_loss: 0.8490, test_f1: 0.6256
 epoch: 96, train_loss: 0.6564, test_loss: 0.8766, test_f1: 0.5947
 epoch: 97, train_loss: 0.6564, test_loss: 0.9434, test_f1: 0.5940
 epoch: 98, train_loss: 0.6619, test_loss: 0.9477, test_f1: 0.6110
 epoch: 99, train_loss: 0.6493, test_loss: 0.9356, test_f1: 0.5966
##################ITERATION #8 ****************************************
 epoch: 0, train_loss: 1.1602, test_loss: 1.1215, test_f1: 0.3831
 epoch: 1, train_loss: 1.0674, test_loss: 1.1016, test_f1: 0.4135
 epoch: 2, train_loss: 1.0423, test_loss: 1.1958, test_f1: 0.3366
 epoch: 3, train_loss: 1.0179, test_loss: 1.0645, test_f1: 0.4551
 epoch: 4, train_loss: 1.0064, test_loss: 1.0561, test_f1: 0.5052
 epoch: 5, train_loss: 0.9873, test_loss: 1.0623, test_f1: 0.4608
 epoch: 6, train_loss: 0.9760, test_loss: 1.0784, test_f1: 0.4726
 epoch: 7, train_loss: 0.9561, test_loss: 0.9738, test_f1: 0.5201
 epoch: 8, train_loss: 0.9304, test_loss: 0.9377, test_f1: 0.4687
 epoch: 9, train_loss: 0.9213, test_loss: 1.2953, test_f1: 0.4275
 epoch: 10, train_loss: 0.9037, test_loss: 0.9272, test_f1: 0.5048
 epoch: 11, train_loss: 0.9234, test_loss: 0.9072, test_f1: 0.5309
 epoch: 12, train_loss: 0.9019, test_loss: 0.8489, test_f1: 0.5258
 epoch: 13, train_loss: 0.8847, test_loss: 1.0583, test_f1: 0.4778
 epoch: 14, train_loss: 0.8757, test_loss: 1.0040, test_f1: 0.4537
 epoch: 15, train_loss: 0.8890, test_loss: 1.0758, test_f1: 0.4909
 epoch: 16, train_loss: 0.8615, test_loss: 0.9181, test_f1: 0.4672
 epoch: 17, train_loss: 0.8703, test_loss: 0.9272, test_f1: 0.5030
 epoch: 18, train_loss: 0.8590, test_loss: 0.9389, test_f1: 0.5139
 epoch: 19, train_loss: 0.8535, test_loss: 0.8987, test_f1: 0.5324
 epoch: 20, train_loss: 0.8635, test_loss: 0.8745, test_f1: 0.5292
 epoch: 21, train_loss: 0.8529, test_loss: 0.8628, test_f1: 0.5424
 epoch: 22, train_loss: 0.8633, test_loss: 0.8640, test_f1: 0.5503
 epoch: 23, train_loss: 0.8411, test_loss: 0.9185, test_f1: 0.5085
 epoch: 24, train_loss: 0.8485, test_loss: 0.8724, test_f1: 0.5450
 epoch: 25, train_loss: 0.8319, test_loss: 0.9132, test_f1: 0.5277
 epoch: 26, train_loss: 0.8345, test_loss: 0.8553, test_f1: 0.5239
 epoch: 27, train_loss: 0.8163, test_loss: 0.8745, test_f1: 0.5832
 epoch: 28, train_loss: 0.8243, test_loss: 0.9496, test_f1: 0.5072
 epoch: 29, train_loss: 0.8160, test_loss: 0.8212, test_f1: 0.5354
 epoch: 30, train_loss: 0.8076, test_loss: 0.8927, test_f1: 0.5585
 epoch: 31, train_loss: 0.8103, test_loss: 0.8358, test_f1: 0.5635
 epoch: 32, train_loss: 0.8211, test_loss: 0.8478, test_f1: 0.5491
 epoch: 33, train_loss: 0.8103, test_loss: 0.9061, test_f1: 0.5487
 epoch: 34, train_loss: 0.7817, test_loss: 0.8459, test_f1: 0.5542
 epoch: 35, train_loss: 0.7903, test_loss: 0.8691, test_f1: 0.5288
 epoch: 36, train_loss: 0.7910, test_loss: 0.8675, test_f1: 0.5960
 epoch: 37, train_loss: 0.7919, test_loss: 0.8017, test_f1: 0.5951
 epoch: 38, train_loss: 0.7748, test_loss: 0.8604, test_f1: 0.5486
 epoch: 39, train_loss: 0.7715, test_loss: 0.8630, test_f1: 0.5162
 epoch: 40, train_loss: 0.7721, test_loss: 0.9192, test_f1: 0.4939
 epoch: 41, train_loss: 0.7811, test_loss: 0.8081, test_f1: 0.6078
 epoch: 42, train_loss: 0.7857, test_loss: 0.8449, test_f1: 0.6088
 epoch: 43, train_loss: 0.7681, test_loss: 0.8824, test_f1: 0.5184
 epoch: 44, train_loss: 0.7691, test_loss: 0.8331, test_f1: 0.5294
 epoch: 45, train_loss: 0.7765, test_loss: 0.8494, test_f1: 0.5469
 epoch: 46, train_loss: 0.7676, test_loss: 0.8420, test_f1: 0.5309
 epoch: 47, train_loss: 0.7962, test_loss: 0.8556, test_f1: 0.5482
 epoch: 48, train_loss: 0.7531, test_loss: 0.8118, test_f1: 0.5633
 epoch: 49, train_loss: 0.7583, test_loss: 0.7993, test_f1: 0.5545
 epoch: 50, train_loss: 0.7746, test_loss: 0.8606, test_f1: 0.5376
 epoch: 51, train_loss: 0.7498, test_loss: 0.7552, test_f1: 0.5811
 epoch: 52, train_loss: 0.7175, test_loss: 0.8359, test_f1: 0.5488
 epoch: 53, train_loss: 0.7180, test_loss: 0.8372, test_f1: 0.6122
 epoch: 54, train_loss: 0.7236, test_loss: 0.8100, test_f1: 0.5708
 epoch: 55, train_loss: 0.7125, test_loss: 0.7812, test_f1: 0.5985
 epoch: 56, train_loss: 0.7034, test_loss: 0.8506, test_f1: 0.5672
 epoch: 57, train_loss: 0.7128, test_loss: 0.8382, test_f1: 0.5719
 epoch: 58, train_loss: 0.7050, test_loss: 0.7929, test_f1: 0.6073
 epoch: 59, train_loss: 0.7120, test_loss: 0.8222, test_f1: 0.5644
 epoch: 60, train_loss: 0.6936, test_loss: 0.8380, test_f1: 0.5528
 epoch: 61, train_loss: 0.6938, test_loss: 0.8149, test_f1: 0.5979
 epoch: 62, train_loss: 0.6879, test_loss: 0.8448, test_f1: 0.5832
 epoch: 63, train_loss: 0.6900, test_loss: 0.7724, test_f1: 0.5959
 epoch: 64, train_loss: 0.6815, test_loss: 0.7839, test_f1: 0.6187
 epoch: 65, train_loss: 0.6713, test_loss: 0.8206, test_f1: 0.5711
 epoch: 66, train_loss: 0.7155, test_loss: 0.8007, test_f1: 0.6234
 epoch: 67, train_loss: 0.6927, test_loss: 0.8428, test_f1: 0.5817
 epoch: 68, train_loss: 0.6842, test_loss: 0.7471, test_f1: 0.6097
 epoch: 69, train_loss: 0.6870, test_loss: 0.7764, test_f1: 0.6049
 epoch: 70, train_loss: 0.6840, test_loss: 0.8696, test_f1: 0.5631
 epoch: 71, train_loss: 0.6815, test_loss: 0.8346, test_f1: 0.6054
 epoch: 72, train_loss: 0.6728, test_loss: 0.8324, test_f1: 0.6323
 epoch: 73, train_loss: 0.6821, test_loss: 0.7873, test_f1: 0.6056
 epoch: 74, train_loss: 0.6713, test_loss: 0.8339, test_f1: 0.5590
 epoch: 75, train_loss: 0.6633, test_loss: 0.8809, test_f1: 0.6223
 epoch: 76, train_loss: 0.6636, test_loss: 0.8541, test_f1: 0.6083
 epoch: 77, train_loss: 0.6607, test_loss: 0.7989, test_f1: 0.6060
 epoch: 78, train_loss: 0.6689, test_loss: 0.7860, test_f1: 0.5983
 epoch: 79, train_loss: 0.6652, test_loss: 0.8232, test_f1: 0.6315
 epoch: 80, train_loss: 0.6677, test_loss: 0.8284, test_f1: 0.6183
 epoch: 81, train_loss: 0.6643, test_loss: 0.8344, test_f1: 0.5952
 epoch: 82, train_loss: 0.6557, test_loss: 0.8138, test_f1: 0.5968
 epoch: 83, train_loss: 0.6477, test_loss: 0.8105, test_f1: 0.6409
 epoch: 84, train_loss: 0.6620, test_loss: 0.7940, test_f1: 0.6199
 epoch: 85, train_loss: 0.6589, test_loss: 0.7989, test_f1: 0.6299
 epoch: 86, train_loss: 0.6561, test_loss: 0.8696, test_f1: 0.5991
 epoch: 87, train_loss: 0.6547, test_loss: 0.8767, test_f1: 0.6002
 epoch: 88, train_loss: 0.6372, test_loss: 0.7704, test_f1: 0.6295
 epoch: 89, train_loss: 0.6232, test_loss: 0.8373, test_f1: 0.5797
 epoch: 90, train_loss: 0.6493, test_loss: 0.7824, test_f1: 0.6191
 epoch: 91, train_loss: 0.6504, test_loss: 0.7927, test_f1: 0.5622
 epoch: 92, train_loss: 0.6275, test_loss: 0.7763, test_f1: 0.6050
 epoch: 93, train_loss: 0.6627, test_loss: 0.8626, test_f1: 0.5791
 epoch: 94, train_loss: 0.6379, test_loss: 0.7732, test_f1: 0.6040
 epoch: 95, train_loss: 0.6349, test_loss: 0.8533, test_f1: 0.6063
 epoch: 96, train_loss: 0.6350, test_loss: 0.8490, test_f1: 0.5845
 epoch: 97, train_loss: 0.6413, test_loss: 0.8171, test_f1: 0.6498
 epoch: 98, train_loss: 0.6405, test_loss: 0.7814, test_f1: 0.6296
 epoch: 99, train_loss: 0.6322, test_loss: 0.7909, test_f1: 0.5808
##################ITERATION #9 ****************************************
 epoch: 0, train_loss: 1.1416, test_loss: 1.4166, test_f1: 0.3183
 epoch: 1, train_loss: 1.0600, test_loss: 1.1070, test_f1: 0.4062
 epoch: 2, train_loss: 1.0049, test_loss: 1.0191, test_f1: 0.5220
 epoch: 3, train_loss: 0.9749, test_loss: 1.1969, test_f1: 0.4666
 epoch: 4, train_loss: 0.9585, test_loss: 0.9935, test_f1: 0.5147
 epoch: 5, train_loss: 0.9512, test_loss: 1.0769, test_f1: 0.4171
 epoch: 6, train_loss: 0.9235, test_loss: 1.0713, test_f1: 0.4575
 epoch: 7, train_loss: 0.9074, test_loss: 1.0684, test_f1: 0.4396
 epoch: 8, train_loss: 0.9076, test_loss: 0.9821, test_f1: 0.4968
 epoch: 9, train_loss: 0.8892, test_loss: 0.9654, test_f1: 0.5208
 epoch: 10, train_loss: 0.8954, test_loss: 1.0363, test_f1: 0.4625
 epoch: 11, train_loss: 0.8829, test_loss: 0.9138, test_f1: 0.5361
 epoch: 12, train_loss: 0.8672, test_loss: 0.9448, test_f1: 0.5125
 epoch: 13, train_loss: 0.8795, test_loss: 0.8839, test_f1: 0.5457
 epoch: 14, train_loss: 0.8610, test_loss: 0.9580, test_f1: 0.5139
 epoch: 15, train_loss: 0.8425, test_loss: 1.0015, test_f1: 0.4890
 epoch: 16, train_loss: 0.8557, test_loss: 0.8947, test_f1: 0.5337
 epoch: 17, train_loss: 0.8485, test_loss: 0.8816, test_f1: 0.5344
 epoch: 18, train_loss: 0.8451, test_loss: 0.9218, test_f1: 0.4994
 epoch: 19, train_loss: 0.8337, test_loss: 1.0483, test_f1: 0.4645
 epoch: 20, train_loss: 0.8329, test_loss: 0.9313, test_f1: 0.5374
 epoch: 21, train_loss: 0.8282, test_loss: 1.0681, test_f1: 0.4451
 epoch: 22, train_loss: 0.8194, test_loss: 0.9048, test_f1: 0.5594
 epoch: 23, train_loss: 0.8266, test_loss: 0.9917, test_f1: 0.5009
 epoch: 24, train_loss: 0.8268, test_loss: 0.9134, test_f1: 0.5346
 epoch: 25, train_loss: 0.8189, test_loss: 0.8569, test_f1: 0.5409
 epoch: 26, train_loss: 0.8129, test_loss: 0.9246, test_f1: 0.5364
 epoch: 27, train_loss: 0.7855, test_loss: 1.0162, test_f1: 0.5049
 epoch: 28, train_loss: 0.8146, test_loss: 0.9537, test_f1: 0.5633
 epoch: 29, train_loss: 0.7960, test_loss: 0.9793, test_f1: 0.5560
 epoch: 30, train_loss: 0.7846, test_loss: 1.0491, test_f1: 0.5320
 epoch: 31, train_loss: 0.8011, test_loss: 0.9464, test_f1: 0.5222
 epoch: 32, train_loss: 0.7840, test_loss: 0.9288, test_f1: 0.5050
 epoch: 33, train_loss: 0.7942, test_loss: 0.9348, test_f1: 0.5436
 epoch: 34, train_loss: 0.7712, test_loss: 1.0001, test_f1: 0.5525
 epoch: 35, train_loss: 0.8012, test_loss: 0.9273, test_f1: 0.5505
 epoch: 36, train_loss: 0.8062, test_loss: 0.8509, test_f1: 0.5543
 epoch: 37, train_loss: 0.7669, test_loss: 0.9496, test_f1: 0.5375
 epoch: 38, train_loss: 0.7639, test_loss: 0.9572, test_f1: 0.5536
 epoch: 39, train_loss: 0.7663, test_loss: 0.9053, test_f1: 0.5500
 epoch: 40, train_loss: 0.7707, test_loss: 0.9419, test_f1: 0.6057
 epoch: 41, train_loss: 0.7837, test_loss: 0.9522, test_f1: 0.5333
 epoch: 42, train_loss: 0.7747, test_loss: 0.8940, test_f1: 0.5572
 epoch: 43, train_loss: 0.7711, test_loss: 0.8767, test_f1: 0.5917
 epoch: 44, train_loss: 0.7701, test_loss: 0.9029, test_f1: 0.5535
 epoch: 45, train_loss: 0.7666, test_loss: 0.8896, test_f1: 0.5499
 epoch: 46, train_loss: 0.7530, test_loss: 0.9585, test_f1: 0.5360
 epoch: 47, train_loss: 0.7434, test_loss: 0.9620, test_f1: 0.6093
 epoch: 48, train_loss: 0.7512, test_loss: 1.0547, test_f1: 0.5104
 epoch: 49, train_loss: 0.7582, test_loss: 0.9145, test_f1: 0.5691
 epoch: 50, train_loss: 0.7583, test_loss: 1.0225, test_f1: 0.4957
 epoch: 51, train_loss: 0.7216, test_loss: 0.8536, test_f1: 0.5999
 epoch: 52, train_loss: 0.7077, test_loss: 0.8526, test_f1: 0.6188
 epoch: 53, train_loss: 0.6975, test_loss: 0.8790, test_f1: 0.6200
 epoch: 54, train_loss: 0.6984, test_loss: 0.9169, test_f1: 0.6180
 epoch: 55, train_loss: 0.6938, test_loss: 0.9042, test_f1: 0.6246
 epoch: 56, train_loss: 0.7095, test_loss: 0.8840, test_f1: 0.6254
 epoch: 57, train_loss: 0.6928, test_loss: 0.8693, test_f1: 0.6067
 epoch: 58, train_loss: 0.6980, test_loss: 0.8976, test_f1: 0.6231
 epoch: 59, train_loss: 0.6927, test_loss: 0.9363, test_f1: 0.5893
 epoch: 60, train_loss: 0.6870, test_loss: 0.8543, test_f1: 0.6283
 epoch: 61, train_loss: 0.6824, test_loss: 0.8998, test_f1: 0.6314
 epoch: 62, train_loss: 0.6911, test_loss: 0.8842, test_f1: 0.5988
 epoch: 63, train_loss: 0.6774, test_loss: 0.8759, test_f1: 0.6315
 epoch: 64, train_loss: 0.6713, test_loss: 0.9216, test_f1: 0.5810
 epoch: 65, train_loss: 0.6798, test_loss: 0.8881, test_f1: 0.6404
 epoch: 66, train_loss: 0.6638, test_loss: 0.9519, test_f1: 0.6276
 epoch: 67, train_loss: 0.7303, test_loss: 0.8767, test_f1: 0.6259
 epoch: 68, train_loss: 0.6913, test_loss: 0.9002, test_f1: 0.6404
 epoch: 69, train_loss: 0.6927, test_loss: 0.9185, test_f1: 0.6321
 epoch: 70, train_loss: 0.6803, test_loss: 0.8780, test_f1: 0.6377
 epoch: 71, train_loss: 0.6774, test_loss: 0.8343, test_f1: 0.6382
 epoch: 72, train_loss: 0.6715, test_loss: 0.9017, test_f1: 0.6589
 epoch: 73, train_loss: 0.6580, test_loss: 0.8738, test_f1: 0.6330
 epoch: 74, train_loss: 0.6537, test_loss: 0.8798, test_f1: 0.6105
 epoch: 75, train_loss: 0.6615, test_loss: 0.8934, test_f1: 0.6027
 epoch: 76, train_loss: 0.6630, test_loss: 0.8433, test_f1: 0.6384
 epoch: 77, train_loss: 0.6582, test_loss: 0.8386, test_f1: 0.6148
 epoch: 78, train_loss: 0.6579, test_loss: 0.9020, test_f1: 0.6095
 epoch: 79, train_loss: 0.6842, test_loss: 0.8326, test_f1: 0.6209
 epoch: 80, train_loss: 0.6653, test_loss: 0.8998, test_f1: 0.6227
 epoch: 81, train_loss: 0.6636, test_loss: 0.8867, test_f1: 0.6245
 epoch: 82, train_loss: 0.6555, test_loss: 0.9161, test_f1: 0.6149
 epoch: 83, train_loss: 0.6481, test_loss: 0.8921, test_f1: 0.6263
 epoch: 84, train_loss: 0.6467, test_loss: 0.8694, test_f1: 0.6441
 epoch: 85, train_loss: 0.6520, test_loss: 0.8527, test_f1: 0.6544
 epoch: 86, train_loss: 0.6371, test_loss: 0.8685, test_f1: 0.6342
 epoch: 87, train_loss: 0.6544, test_loss: 0.8586, test_f1: 0.6428
 epoch: 88, train_loss: 0.6537, test_loss: 0.8669, test_f1: 0.6430
 epoch: 89, train_loss: 0.6466, test_loss: 0.8539, test_f1: 0.6399
 epoch: 90, train_loss: 0.6572, test_loss: 0.8913, test_f1: 0.6163
 epoch: 91, train_loss: 0.6377, test_loss: 0.9427, test_f1: 0.6175
 epoch: 92, train_loss: 0.6360, test_loss: 0.9238, test_f1: 0.6278
 epoch: 93, train_loss: 0.6333, test_loss: 0.9228, test_f1: 0.6385
 epoch: 94, train_loss: 0.6310, test_loss: 0.9523, test_f1: 0.6217
 epoch: 95, train_loss: 0.6293, test_loss: 0.8918, test_f1: 0.6302
 epoch: 96, train_loss: 0.6356, test_loss: 0.8958, test_f1: 0.6512
 epoch: 97, train_loss: 0.6431, test_loss: 0.9041, test_f1: 0.6459
 epoch: 98, train_loss: 0.6296, test_loss: 0.8788, test_f1: 0.6467
 epoch: 99, train_loss: 0.6433, test_loss: 0.9018, test_f1: 0.6446

Training completed in 1423.49 seconds
Best F1: 0.6917 at epoch 92
Mean F1 across iterations: 0.6570  0.0195
========================FINAL RESULTS================================
FEGIN weighted F1: 0.6917  0.0195
python main.py --data ltspice_examples --representation component_pin --model FEGIN --layers 6 --hiddens 32 --batch_size 32 --lr 0.01 --emb_size 512 --epochs 100 --save_appendix component_pin_L6_H32_BS32_LR0.01_E512 --no_val
-----



STDERR:
  File "main.py", line 370, in <module>
    main()
  File "main.py", line 254, in main
    dataset = dataset_class(
  File "/home/philip/projects/ltspice_examples_code_repo/Circuit-Completion-Using-GNNs/component_classification_with_link_prediction_head/evaluation/FEGIN/kernel/circuit_datasets.py", line 15, in __init__
    self.data, self.slices = torch.load(self.processed_paths[0])
  File "/home/philip/.local/lib/python3.8/site-packages/torch/serialization.py", line 1040, in load
    warnings.warn(
  File "/usr/lib/python3.8/warnings.py", line 109, in _showwarnmsg
    sw(msg.message, msg.category, msg.filename, msg.lineno,
  File "main.py", line 47, in warn_with_traceback
    traceback.print_stack(file=log)
/home/philip/projects/ltspice_examples_code_repo/Circuit-Completion-Using-GNNs/component_classification_with_link_prediction_head/evaluation/FEGIN/kernel/circuit_datasets.py:15: FutureWarning: You are using `torch.load` with `weights_only=False` (the current default value), which uses the default pickle module implicitly. It is possible to construct malicious pickle data which will execute arbitrary code during unpickling (See https://github.com/pytorch/pytorch/blob/main/SECURITY.md#untrusted-models for more details). In a future release, the default value for `weights_only` will be flipped to `True`. This limits the functions that could be executed during unpickling. Arbitrary objects will no longer be allowed to be loaded via this mode unless they are explicitly allowlisted by the user via `torch.serialization.add_safe_globals`. We recommend you start setting `weights_only=True` for any use case where you don't have full control of the loaded file. Please open an issue on GitHub for any issues related to this experimental feature.
  self.data, self.slices = torch.load(self.processed_paths[0])
