STDOUT:
Results will be saved in /home/philip/projects/ltspice_examples_code_repo/Circuit-Completion-Using-GNNs/component_classification_with_link_prediction_head/evaluation/FEGIN/results/model_FEGIN_dataset_ltspice_examples
Command line input: python main.py --data ltspice_examples --representation component_pin_net --model FEGIN --layers 2 --hiddens 64 --batch_size 256 --lr 0.0001 --emb_size 512 --epochs 100 --save_appendix component_pin_net_L2_H64_BS256_LR0.0001_E512 --no_val
 is saved.
-----
ltspice_examples - FEGIN
Using 2 layers, 64 hidden units, h = 2
Loading component_pin_net representation dataset
ENTERED
Training FEGIN on component_pin_net representation
Train: 3558, Test: 846
##################ITERATION #0 ****************************************
 epoch: 0, train_loss: 1.3938, test_loss: 1.3924, test_f1: 0.1004
 epoch: 1, train_loss: 1.3854, test_loss: 1.3878, test_f1: 0.1004
 epoch: 2, train_loss: 1.3799, test_loss: 1.3824, test_f1: 0.1004
 epoch: 3, train_loss: 1.3731, test_loss: 1.3739, test_f1: 0.1162
 epoch: 4, train_loss: 1.3657, test_loss: 1.3633, test_f1: 0.1264
 epoch: 5, train_loss: 1.3557, test_loss: 1.3520, test_f1: 0.1471
 epoch: 6, train_loss: 1.3466, test_loss: 1.3394, test_f1: 0.2647
 epoch: 7, train_loss: 1.3338, test_loss: 1.3258, test_f1: 0.2789
 epoch: 8, train_loss: 1.3191, test_loss: 1.3113, test_f1: 0.2586
 epoch: 9, train_loss: 1.3049, test_loss: 1.2960, test_f1: 0.2555
 epoch: 10, train_loss: 1.2914, test_loss: 1.2800, test_f1: 0.2304
 epoch: 11, train_loss: 1.2741, test_loss: 1.2644, test_f1: 0.2302
 epoch: 12, train_loss: 1.2608, test_loss: 1.2503, test_f1: 0.2295
 epoch: 13, train_loss: 1.2504, test_loss: 1.2369, test_f1: 0.2270
 epoch: 14, train_loss: 1.2345, test_loss: 1.2236, test_f1: 0.2270
 epoch: 15, train_loss: 1.2271, test_loss: 1.2116, test_f1: 0.2270
 epoch: 16, train_loss: 1.2159, test_loss: 1.1998, test_f1: 0.2270
 epoch: 17, train_loss: 1.2087, test_loss: 1.1894, test_f1: 0.2679
 epoch: 18, train_loss: 1.1966, test_loss: 1.1792, test_f1: 0.2979
 epoch: 19, train_loss: 1.1889, test_loss: 1.1689, test_f1: 0.3155
 epoch: 20, train_loss: 1.1786, test_loss: 1.1591, test_f1: 0.3474
 epoch: 21, train_loss: 1.1732, test_loss: 1.1489, test_f1: 0.3708
 epoch: 22, train_loss: 1.1622, test_loss: 1.1387, test_f1: 0.3912
 epoch: 23, train_loss: 1.1538, test_loss: 1.1294, test_f1: 0.3990
 epoch: 24, train_loss: 1.1431, test_loss: 1.1191, test_f1: 0.4219
 epoch: 25, train_loss: 1.1345, test_loss: 1.1078, test_f1: 0.4316
 epoch: 26, train_loss: 1.1259, test_loss: 1.0974, test_f1: 0.4582
 epoch: 27, train_loss: 1.1124, test_loss: 1.0850, test_f1: 0.4577
 epoch: 28, train_loss: 1.1037, test_loss: 1.0735, test_f1: 0.4631
 epoch: 29, train_loss: 1.0921, test_loss: 1.0634, test_f1: 0.4750
 epoch: 30, train_loss: 1.0803, test_loss: 1.0531, test_f1: 0.4766
 epoch: 31, train_loss: 1.0726, test_loss: 1.0445, test_f1: 0.4773
 epoch: 32, train_loss: 1.0594, test_loss: 1.0342, test_f1: 0.4798
 epoch: 33, train_loss: 1.0568, test_loss: 1.0261, test_f1: 0.4826
 epoch: 34, train_loss: 1.0396, test_loss: 1.0196, test_f1: 0.4859
 epoch: 35, train_loss: 1.0378, test_loss: 1.0140, test_f1: 0.4869
 epoch: 36, train_loss: 1.0271, test_loss: 1.0067, test_f1: 0.4930
 epoch: 37, train_loss: 1.0179, test_loss: 1.0004, test_f1: 0.4930
 epoch: 38, train_loss: 1.0170, test_loss: 0.9976, test_f1: 0.4975
 epoch: 39, train_loss: 1.0049, test_loss: 0.9925, test_f1: 0.4979
 epoch: 40, train_loss: 1.0047, test_loss: 0.9921, test_f1: 0.4984
 epoch: 41, train_loss: 0.9966, test_loss: 0.9860, test_f1: 0.5046
 epoch: 42, train_loss: 0.9934, test_loss: 0.9825, test_f1: 0.5048
 epoch: 43, train_loss: 0.9904, test_loss: 0.9800, test_f1: 0.5008
 epoch: 44, train_loss: 0.9889, test_loss: 0.9797, test_f1: 0.5031
 epoch: 45, train_loss: 0.9860, test_loss: 0.9780, test_f1: 0.5071
 epoch: 46, train_loss: 0.9765, test_loss: 0.9718, test_f1: 0.5126
 epoch: 47, train_loss: 0.9774, test_loss: 0.9683, test_f1: 0.4953
 epoch: 48, train_loss: 0.9732, test_loss: 0.9658, test_f1: 0.5109
 epoch: 49, train_loss: 0.9758, test_loss: 0.9651, test_f1: 0.4978
 epoch: 50, train_loss: 0.9660, test_loss: 0.9696, test_f1: 0.5044
 epoch: 51, train_loss: 0.9622, test_loss: 0.9614, test_f1: 0.5121
 epoch: 52, train_loss: 0.9671, test_loss: 0.9594, test_f1: 0.5141
 epoch: 53, train_loss: 0.9639, test_loss: 0.9582, test_f1: 0.5088
 epoch: 54, train_loss: 0.9583, test_loss: 0.9575, test_f1: 0.5149
 epoch: 55, train_loss: 0.9581, test_loss: 0.9563, test_f1: 0.5120
 epoch: 56, train_loss: 0.9608, test_loss: 0.9565, test_f1: 0.5159
 epoch: 57, train_loss: 0.9564, test_loss: 0.9553, test_f1: 0.5110
 epoch: 58, train_loss: 0.9539, test_loss: 0.9537, test_f1: 0.5147
 epoch: 59, train_loss: 0.9548, test_loss: 0.9559, test_f1: 0.5116
 epoch: 60, train_loss: 0.9569, test_loss: 0.9528, test_f1: 0.5068
 epoch: 61, train_loss: 0.9530, test_loss: 0.9507, test_f1: 0.5097
 epoch: 62, train_loss: 0.9571, test_loss: 0.9531, test_f1: 0.5069
 epoch: 63, train_loss: 0.9508, test_loss: 0.9490, test_f1: 0.5129
 epoch: 64, train_loss: 0.9496, test_loss: 0.9477, test_f1: 0.5112
 epoch: 65, train_loss: 0.9488, test_loss: 0.9474, test_f1: 0.5159
 epoch: 66, train_loss: 0.9482, test_loss: 0.9504, test_f1: 0.5066
 epoch: 67, train_loss: 0.9490, test_loss: 0.9446, test_f1: 0.5229
 epoch: 68, train_loss: 0.9428, test_loss: 0.9451, test_f1: 0.5099
 epoch: 69, train_loss: 0.9459, test_loss: 0.9432, test_f1: 0.5058
 epoch: 70, train_loss: 0.9474, test_loss: 0.9431, test_f1: 0.5212
 epoch: 71, train_loss: 0.9383, test_loss: 0.9442, test_f1: 0.5143
 epoch: 72, train_loss: 0.9404, test_loss: 0.9423, test_f1: 0.5209
 epoch: 73, train_loss: 0.9393, test_loss: 0.9387, test_f1: 0.5179
 epoch: 74, train_loss: 0.9461, test_loss: 0.9375, test_f1: 0.5160
 epoch: 75, train_loss: 0.9334, test_loss: 0.9378, test_f1: 0.5036
 epoch: 76, train_loss: 0.9385, test_loss: 0.9362, test_f1: 0.5129
 epoch: 77, train_loss: 0.9349, test_loss: 0.9362, test_f1: 0.5098
 epoch: 78, train_loss: 0.9392, test_loss: 0.9329, test_f1: 0.5164
 epoch: 79, train_loss: 0.9331, test_loss: 0.9359, test_f1: 0.5126
 epoch: 80, train_loss: 0.9340, test_loss: 0.9359, test_f1: 0.5123
 epoch: 81, train_loss: 0.9278, test_loss: 0.9335, test_f1: 0.5114
 epoch: 82, train_loss: 0.9273, test_loss: 0.9327, test_f1: 0.5123
 epoch: 83, train_loss: 0.9286, test_loss: 0.9302, test_f1: 0.5098
 epoch: 84, train_loss: 0.9334, test_loss: 0.9319, test_f1: 0.5221
 epoch: 85, train_loss: 0.9313, test_loss: 0.9352, test_f1: 0.5281
 epoch: 86, train_loss: 0.9284, test_loss: 0.9316, test_f1: 0.5213
 epoch: 87, train_loss: 0.9301, test_loss: 0.9319, test_f1: 0.5245
 epoch: 88, train_loss: 0.9268, test_loss: 0.9323, test_f1: 0.5119
 epoch: 89, train_loss: 0.9226, test_loss: 0.9293, test_f1: 0.5332
 epoch: 90, train_loss: 0.9216, test_loss: 0.9296, test_f1: 0.5175
 epoch: 91, train_loss: 0.9267, test_loss: 0.9271, test_f1: 0.5254
 epoch: 92, train_loss: 0.9209, test_loss: 0.9310, test_f1: 0.5164
 epoch: 93, train_loss: 0.9151, test_loss: 0.9284, test_f1: 0.5171
 epoch: 94, train_loss: 0.9183, test_loss: 0.9258, test_f1: 0.5231
 epoch: 95, train_loss: 0.9193, test_loss: 0.9265, test_f1: 0.5237
 epoch: 96, train_loss: 0.9228, test_loss: 0.9242, test_f1: 0.5275
 epoch: 97, train_loss: 0.9141, test_loss: 0.9254, test_f1: 0.5333
 epoch: 98, train_loss: 0.9079, test_loss: 0.9216, test_f1: 0.5280
 epoch: 99, train_loss: 0.9148, test_loss: 0.9231, test_f1: 0.5257
##################ITERATION #1 ****************************************
 epoch: 0, train_loss: 1.3556, test_loss: 1.3668, test_f1: 0.1004
 epoch: 1, train_loss: 1.3352, test_loss: 1.3582, test_f1: 0.1004
 epoch: 2, train_loss: 1.3219, test_loss: 1.3466, test_f1: 0.2120
 epoch: 3, train_loss: 1.3072, test_loss: 1.3254, test_f1: 0.2489
 epoch: 4, train_loss: 1.2900, test_loss: 1.2908, test_f1: 0.2445
 epoch: 5, train_loss: 1.2744, test_loss: 1.2614, test_f1: 0.3158
 epoch: 6, train_loss: 1.2557, test_loss: 1.2369, test_f1: 0.3509
 epoch: 7, train_loss: 1.2352, test_loss: 1.2148, test_f1: 0.3403
 epoch: 8, train_loss: 1.2175, test_loss: 1.1937, test_f1: 0.3432
 epoch: 9, train_loss: 1.1998, test_loss: 1.1733, test_f1: 0.3460
 epoch: 10, train_loss: 1.1816, test_loss: 1.1538, test_f1: 0.3460
 epoch: 11, train_loss: 1.1638, test_loss: 1.1358, test_f1: 0.3460
 epoch: 12, train_loss: 1.1470, test_loss: 1.1199, test_f1: 0.3448
 epoch: 13, train_loss: 1.1312, test_loss: 1.1042, test_f1: 0.3438
 epoch: 14, train_loss: 1.1151, test_loss: 1.0898, test_f1: 0.3429
 epoch: 15, train_loss: 1.1053, test_loss: 1.0786, test_f1: 0.3428
 epoch: 16, train_loss: 1.0890, test_loss: 1.0691, test_f1: 0.3451
 epoch: 17, train_loss: 1.0826, test_loss: 1.0601, test_f1: 0.3522
 epoch: 18, train_loss: 1.0760, test_loss: 1.0517, test_f1: 0.3596
 epoch: 19, train_loss: 1.0657, test_loss: 1.0453, test_f1: 0.3637
 epoch: 20, train_loss: 1.0598, test_loss: 1.0391, test_f1: 0.3801
 epoch: 21, train_loss: 1.0529, test_loss: 1.0336, test_f1: 0.3863
 epoch: 22, train_loss: 1.0477, test_loss: 1.0287, test_f1: 0.3899
 epoch: 23, train_loss: 1.0388, test_loss: 1.0247, test_f1: 0.4035
 epoch: 24, train_loss: 1.0322, test_loss: 1.0188, test_f1: 0.4073
 epoch: 25, train_loss: 1.0291, test_loss: 1.0137, test_f1: 0.4119
 epoch: 26, train_loss: 1.0221, test_loss: 1.0094, test_f1: 0.4126
 epoch: 27, train_loss: 1.0228, test_loss: 1.0041, test_f1: 0.4113
 epoch: 28, train_loss: 1.0126, test_loss: 1.0004, test_f1: 0.4252
 epoch: 29, train_loss: 1.0069, test_loss: 0.9940, test_f1: 0.4337
 epoch: 30, train_loss: 1.0046, test_loss: 0.9909, test_f1: 0.4489
 epoch: 31, train_loss: 1.0048, test_loss: 0.9881, test_f1: 0.4462
 epoch: 32, train_loss: 1.0027, test_loss: 0.9878, test_f1: 0.4632
 epoch: 33, train_loss: 0.9927, test_loss: 0.9816, test_f1: 0.4695
 epoch: 34, train_loss: 0.9930, test_loss: 0.9797, test_f1: 0.4715
 epoch: 35, train_loss: 0.9820, test_loss: 0.9730, test_f1: 0.4787
 epoch: 36, train_loss: 0.9834, test_loss: 0.9675, test_f1: 0.4844
 epoch: 37, train_loss: 0.9816, test_loss: 0.9637, test_f1: 0.4782
 epoch: 38, train_loss: 0.9717, test_loss: 0.9609, test_f1: 0.4829
 epoch: 39, train_loss: 0.9744, test_loss: 0.9596, test_f1: 0.4859
 epoch: 40, train_loss: 0.9684, test_loss: 0.9547, test_f1: 0.4878
 epoch: 41, train_loss: 0.9648, test_loss: 0.9531, test_f1: 0.4947
 epoch: 42, train_loss: 0.9639, test_loss: 0.9521, test_f1: 0.4906
 epoch: 43, train_loss: 0.9586, test_loss: 0.9479, test_f1: 0.4910
 epoch: 44, train_loss: 0.9621, test_loss: 0.9448, test_f1: 0.4981
 epoch: 45, train_loss: 0.9557, test_loss: 0.9403, test_f1: 0.5013
 epoch: 46, train_loss: 0.9518, test_loss: 0.9365, test_f1: 0.4997
 epoch: 47, train_loss: 0.9493, test_loss: 0.9344, test_f1: 0.4963
 epoch: 48, train_loss: 0.9509, test_loss: 0.9366, test_f1: 0.5046
 epoch: 49, train_loss: 0.9462, test_loss: 0.9306, test_f1: 0.5048
 epoch: 50, train_loss: 0.9428, test_loss: 0.9303, test_f1: 0.5105
 epoch: 51, train_loss: 0.9335, test_loss: 0.9285, test_f1: 0.5085
 epoch: 52, train_loss: 0.9385, test_loss: 0.9233, test_f1: 0.5161
 epoch: 53, train_loss: 0.9340, test_loss: 0.9236, test_f1: 0.5057
 epoch: 54, train_loss: 0.9319, test_loss: 0.9247, test_f1: 0.5079
 epoch: 55, train_loss: 0.9344, test_loss: 0.9230, test_f1: 0.5102
 epoch: 56, train_loss: 0.9343, test_loss: 0.9199, test_f1: 0.5171
 epoch: 57, train_loss: 0.9279, test_loss: 0.9212, test_f1: 0.5114
 epoch: 58, train_loss: 0.9251, test_loss: 0.9209, test_f1: 0.5132
 epoch: 59, train_loss: 0.9230, test_loss: 0.9191, test_f1: 0.5104
 epoch: 60, train_loss: 0.9319, test_loss: 0.9168, test_f1: 0.5150
 epoch: 61, train_loss: 0.9283, test_loss: 0.9152, test_f1: 0.5222
 epoch: 62, train_loss: 0.9283, test_loss: 0.9132, test_f1: 0.5258
 epoch: 63, train_loss: 0.9248, test_loss: 0.9138, test_f1: 0.5207
 epoch: 64, train_loss: 0.9256, test_loss: 0.9117, test_f1: 0.5230
 epoch: 65, train_loss: 0.9218, test_loss: 0.9106, test_f1: 0.5210
 epoch: 66, train_loss: 0.9202, test_loss: 0.9103, test_f1: 0.5233
 epoch: 67, train_loss: 0.9196, test_loss: 0.9107, test_f1: 0.5182
 epoch: 68, train_loss: 0.9182, test_loss: 0.9093, test_f1: 0.5160
 epoch: 69, train_loss: 0.9139, test_loss: 0.9047, test_f1: 0.5295
 epoch: 70, train_loss: 0.9135, test_loss: 0.9054, test_f1: 0.5295
 epoch: 71, train_loss: 0.9166, test_loss: 0.9040, test_f1: 0.5262
 epoch: 72, train_loss: 0.9150, test_loss: 0.9050, test_f1: 0.5285
 epoch: 73, train_loss: 0.9083, test_loss: 0.9002, test_f1: 0.5244
 epoch: 74, train_loss: 0.9068, test_loss: 0.9034, test_f1: 0.5232
 epoch: 75, train_loss: 0.9109, test_loss: 0.9054, test_f1: 0.5200
 epoch: 76, train_loss: 0.9037, test_loss: 0.9012, test_f1: 0.5299
 epoch: 77, train_loss: 0.9080, test_loss: 0.9005, test_f1: 0.5330
 epoch: 78, train_loss: 0.8974, test_loss: 0.9000, test_f1: 0.5303
 epoch: 79, train_loss: 0.9063, test_loss: 0.8988, test_f1: 0.5268
 epoch: 80, train_loss: 0.9019, test_loss: 0.8966, test_f1: 0.5339
 epoch: 81, train_loss: 0.9005, test_loss: 0.8955, test_f1: 0.5349
 epoch: 82, train_loss: 0.8967, test_loss: 0.8943, test_f1: 0.5357
 epoch: 83, train_loss: 0.8951, test_loss: 0.8927, test_f1: 0.5387
 epoch: 84, train_loss: 0.8900, test_loss: 0.8933, test_f1: 0.5377
 epoch: 85, train_loss: 0.8936, test_loss: 0.8933, test_f1: 0.5332
 epoch: 86, train_loss: 0.8910, test_loss: 0.8928, test_f1: 0.5295
 epoch: 87, train_loss: 0.8980, test_loss: 0.8911, test_f1: 0.5357
 epoch: 88, train_loss: 0.8941, test_loss: 0.8893, test_f1: 0.5396
 epoch: 89, train_loss: 0.8847, test_loss: 0.8881, test_f1: 0.5378
 epoch: 90, train_loss: 0.8885, test_loss: 0.8866, test_f1: 0.5407
 epoch: 91, train_loss: 0.8848, test_loss: 0.8896, test_f1: 0.5380
 epoch: 92, train_loss: 0.8874, test_loss: 0.8890, test_f1: 0.5414
 epoch: 93, train_loss: 0.8832, test_loss: 0.8909, test_f1: 0.5370
 epoch: 94, train_loss: 0.8796, test_loss: 0.8863, test_f1: 0.5391
 epoch: 95, train_loss: 0.8778, test_loss: 0.8805, test_f1: 0.5422
 epoch: 96, train_loss: 0.8808, test_loss: 0.8833, test_f1: 0.5417
 epoch: 97, train_loss: 0.8769, test_loss: 0.8830, test_f1: 0.5398
 epoch: 98, train_loss: 0.8831, test_loss: 0.8825, test_f1: 0.5425
 epoch: 99, train_loss: 0.8759, test_loss: 0.8812, test_f1: 0.5386
##################ITERATION #2 ****************************************
 epoch: 0, train_loss: 1.3505, test_loss: 1.3593, test_f1: 0.2270
 epoch: 1, train_loss: 1.3228, test_loss: 1.3510, test_f1: 0.2270
 epoch: 2, train_loss: 1.3025, test_loss: 1.3341, test_f1: 0.2270
 epoch: 3, train_loss: 1.2857, test_loss: 1.3048, test_f1: 0.2549
 epoch: 4, train_loss: 1.2665, test_loss: 1.2666, test_f1: 0.3312
 epoch: 5, train_loss: 1.2446, test_loss: 1.2305, test_f1: 0.3499
 epoch: 6, train_loss: 1.2253, test_loss: 1.1992, test_f1: 0.3493
 epoch: 7, train_loss: 1.2052, test_loss: 1.1725, test_f1: 0.3441
 epoch: 8, train_loss: 1.1822, test_loss: 1.1470, test_f1: 0.3441
 epoch: 9, train_loss: 1.1650, test_loss: 1.1265, test_f1: 0.3460
 epoch: 10, train_loss: 1.1441, test_loss: 1.1084, test_f1: 0.3460
 epoch: 11, train_loss: 1.1306, test_loss: 1.0923, test_f1: 0.3460
 epoch: 12, train_loss: 1.1150, test_loss: 1.0788, test_f1: 0.3438
 epoch: 13, train_loss: 1.0984, test_loss: 1.0669, test_f1: 0.3448
 epoch: 14, train_loss: 1.0877, test_loss: 1.0577, test_f1: 0.3438
 epoch: 15, train_loss: 1.0781, test_loss: 1.0482, test_f1: 0.3468
 epoch: 16, train_loss: 1.0706, test_loss: 1.0422, test_f1: 0.3591
 epoch: 17, train_loss: 1.0599, test_loss: 1.0337, test_f1: 0.3729
 epoch: 18, train_loss: 1.0509, test_loss: 1.0300, test_f1: 0.3941
 epoch: 19, train_loss: 1.0445, test_loss: 1.0240, test_f1: 0.4066
 epoch: 20, train_loss: 1.0384, test_loss: 1.0179, test_f1: 0.4047
 epoch: 21, train_loss: 1.0337, test_loss: 1.0121, test_f1: 0.4160
 epoch: 22, train_loss: 1.0260, test_loss: 1.0096, test_f1: 0.4253
 epoch: 23, train_loss: 1.0217, test_loss: 1.0049, test_f1: 0.4245
 epoch: 24, train_loss: 1.0174, test_loss: 1.0006, test_f1: 0.4263
 epoch: 25, train_loss: 1.0109, test_loss: 0.9951, test_f1: 0.4294
 epoch: 26, train_loss: 1.0109, test_loss: 0.9882, test_f1: 0.4361
 epoch: 27, train_loss: 1.0041, test_loss: 0.9850, test_f1: 0.4375
 epoch: 28, train_loss: 0.9935, test_loss: 0.9808, test_f1: 0.4676
 epoch: 29, train_loss: 0.9909, test_loss: 0.9733, test_f1: 0.4617
 epoch: 30, train_loss: 0.9899, test_loss: 0.9692, test_f1: 0.4725
 epoch: 31, train_loss: 0.9870, test_loss: 0.9707, test_f1: 0.4787
 epoch: 32, train_loss: 0.9845, test_loss: 0.9627, test_f1: 0.4811
 epoch: 33, train_loss: 0.9730, test_loss: 0.9617, test_f1: 0.4799
 epoch: 34, train_loss: 0.9761, test_loss: 0.9563, test_f1: 0.4836
 epoch: 35, train_loss: 0.9728, test_loss: 0.9508, test_f1: 0.4820
 epoch: 36, train_loss: 0.9709, test_loss: 0.9482, test_f1: 0.4853
 epoch: 37, train_loss: 0.9673, test_loss: 0.9482, test_f1: 0.4857
 epoch: 38, train_loss: 0.9643, test_loss: 0.9477, test_f1: 0.4890
 epoch: 39, train_loss: 0.9586, test_loss: 0.9407, test_f1: 0.4873
 epoch: 40, train_loss: 0.9538, test_loss: 0.9375, test_f1: 0.4918
 epoch: 41, train_loss: 0.9504, test_loss: 0.9352, test_f1: 0.4890
 epoch: 42, train_loss: 0.9538, test_loss: 0.9326, test_f1: 0.4906
 epoch: 43, train_loss: 0.9435, test_loss: 0.9282, test_f1: 0.4916
 epoch: 44, train_loss: 0.9459, test_loss: 0.9289, test_f1: 0.4942
 epoch: 45, train_loss: 0.9402, test_loss: 0.9274, test_f1: 0.4932
 epoch: 46, train_loss: 0.9358, test_loss: 0.9260, test_f1: 0.4884
 epoch: 47, train_loss: 0.9342, test_loss: 0.9172, test_f1: 0.5052
 epoch: 48, train_loss: 0.9309, test_loss: 0.9193, test_f1: 0.4957
 epoch: 49, train_loss: 0.9305, test_loss: 0.9129, test_f1: 0.5134
 epoch: 50, train_loss: 0.9256, test_loss: 0.9136, test_f1: 0.5086
 epoch: 51, train_loss: 0.9203, test_loss: 0.9100, test_f1: 0.5172
 epoch: 52, train_loss: 0.9210, test_loss: 0.9093, test_f1: 0.5129
 epoch: 53, train_loss: 0.9192, test_loss: 0.9086, test_f1: 0.5135
 epoch: 54, train_loss: 0.9224, test_loss: 0.9078, test_f1: 0.5170
 epoch: 55, train_loss: 0.9160, test_loss: 0.9083, test_f1: 0.5054
 epoch: 56, train_loss: 0.9177, test_loss: 0.9099, test_f1: 0.5142
 epoch: 57, train_loss: 0.9133, test_loss: 0.9047, test_f1: 0.5127
 epoch: 58, train_loss: 0.9141, test_loss: 0.9033, test_f1: 0.5210
 epoch: 59, train_loss: 0.9119, test_loss: 0.9019, test_f1: 0.5227
 epoch: 60, train_loss: 0.9152, test_loss: 0.9044, test_f1: 0.5174
 epoch: 61, train_loss: 0.9133, test_loss: 0.9025, test_f1: 0.5247
 epoch: 62, train_loss: 0.9015, test_loss: 0.9002, test_f1: 0.5268
 epoch: 63, train_loss: 0.9077, test_loss: 0.9005, test_f1: 0.5235
 epoch: 64, train_loss: 0.9040, test_loss: 0.8992, test_f1: 0.5268
 epoch: 65, train_loss: 0.9065, test_loss: 0.9000, test_f1: 0.5248
 epoch: 66, train_loss: 0.9010, test_loss: 0.8965, test_f1: 0.5274
 epoch: 67, train_loss: 0.8999, test_loss: 0.8961, test_f1: 0.5284
 epoch: 68, train_loss: 0.8946, test_loss: 0.8956, test_f1: 0.5296
 epoch: 69, train_loss: 0.9025, test_loss: 0.8957, test_f1: 0.5306
 epoch: 70, train_loss: 0.8961, test_loss: 0.8903, test_f1: 0.5251
 epoch: 71, train_loss: 0.8944, test_loss: 0.8945, test_f1: 0.5304
 epoch: 72, train_loss: 0.8918, test_loss: 0.8907, test_f1: 0.5305
 epoch: 73, train_loss: 0.8916, test_loss: 0.8936, test_f1: 0.5376
 epoch: 74, train_loss: 0.8953, test_loss: 0.8900, test_f1: 0.5337
 epoch: 75, train_loss: 0.8926, test_loss: 0.8909, test_f1: 0.5333
 epoch: 76, train_loss: 0.8902, test_loss: 0.8875, test_f1: 0.5278
 epoch: 77, train_loss: 0.8890, test_loss: 0.8936, test_f1: 0.5371
 epoch: 78, train_loss: 0.8807, test_loss: 0.8867, test_f1: 0.5277
 epoch: 79, train_loss: 0.8830, test_loss: 0.8834, test_f1: 0.5299
 epoch: 80, train_loss: 0.8813, test_loss: 0.8853, test_f1: 0.5375
 epoch: 81, train_loss: 0.8806, test_loss: 0.8804, test_f1: 0.5289
 epoch: 82, train_loss: 0.8802, test_loss: 0.8836, test_f1: 0.5401
 epoch: 83, train_loss: 0.8836, test_loss: 0.8769, test_f1: 0.5330
 epoch: 84, train_loss: 0.8819, test_loss: 0.8771, test_f1: 0.5417
 epoch: 85, train_loss: 0.8767, test_loss: 0.8791, test_f1: 0.5320
 epoch: 86, train_loss: 0.8770, test_loss: 0.8777, test_f1: 0.5301
 epoch: 87, train_loss: 0.8690, test_loss: 0.8748, test_f1: 0.5455
 epoch: 88, train_loss: 0.8797, test_loss: 0.8755, test_f1: 0.5333
 epoch: 89, train_loss: 0.8717, test_loss: 0.8757, test_f1: 0.5355
 epoch: 90, train_loss: 0.8713, test_loss: 0.8719, test_f1: 0.5456
 epoch: 91, train_loss: 0.8689, test_loss: 0.8709, test_f1: 0.5453
 epoch: 92, train_loss: 0.8706, test_loss: 0.8750, test_f1: 0.5443
 epoch: 93, train_loss: 0.8675, test_loss: 0.8777, test_f1: 0.5509
 epoch: 94, train_loss: 0.8618, test_loss: 0.8765, test_f1: 0.5446
 epoch: 95, train_loss: 0.8661, test_loss: 0.8682, test_f1: 0.5457
 epoch: 96, train_loss: 0.8640, test_loss: 0.8708, test_f1: 0.5365
 epoch: 97, train_loss: 0.8635, test_loss: 0.8708, test_f1: 0.5367
 epoch: 98, train_loss: 0.8572, test_loss: 0.8665, test_f1: 0.5405
 epoch: 99, train_loss: 0.8638, test_loss: 0.8658, test_f1: 0.5536
##################ITERATION #3 ****************************************
 epoch: 0, train_loss: 1.3077, test_loss: 1.3171, test_f1: 0.2270
 epoch: 1, train_loss: 1.2740, test_loss: 1.2995, test_f1: 0.2270
 epoch: 2, train_loss: 1.2540, test_loss: 1.2725, test_f1: 0.2270
 epoch: 3, train_loss: 1.2376, test_loss: 1.2346, test_f1: 0.2270
 epoch: 4, train_loss: 1.2188, test_loss: 1.1997, test_f1: 0.3275
 epoch: 5, train_loss: 1.1971, test_loss: 1.1680, test_f1: 0.3548
 epoch: 6, train_loss: 1.1777, test_loss: 1.1411, test_f1: 0.3474
 epoch: 7, train_loss: 1.1577, test_loss: 1.1171, test_f1: 0.3488
 epoch: 8, train_loss: 1.1373, test_loss: 1.0962, test_f1: 0.3634
 epoch: 9, train_loss: 1.1148, test_loss: 1.0794, test_f1: 0.3887
 epoch: 10, train_loss: 1.0994, test_loss: 1.0638, test_f1: 0.4003
 epoch: 11, train_loss: 1.0852, test_loss: 1.0496, test_f1: 0.4148
 epoch: 12, train_loss: 1.0723, test_loss: 1.0386, test_f1: 0.4218
 epoch: 13, train_loss: 1.0576, test_loss: 1.0298, test_f1: 0.4260
 epoch: 14, train_loss: 1.0508, test_loss: 1.0208, test_f1: 0.4344
 epoch: 15, train_loss: 1.0452, test_loss: 1.0144, test_f1: 0.4335
 epoch: 16, train_loss: 1.0397, test_loss: 1.0073, test_f1: 0.4380
 epoch: 17, train_loss: 1.0277, test_loss: 1.0013, test_f1: 0.4401
 epoch: 18, train_loss: 1.0220, test_loss: 0.9961, test_f1: 0.4587
 epoch: 19, train_loss: 1.0142, test_loss: 0.9899, test_f1: 0.4641
 epoch: 20, train_loss: 1.0074, test_loss: 0.9834, test_f1: 0.4658
 epoch: 21, train_loss: 1.0046, test_loss: 0.9813, test_f1: 0.4786
 epoch: 22, train_loss: 0.9992, test_loss: 0.9767, test_f1: 0.4745
 epoch: 23, train_loss: 0.9933, test_loss: 0.9746, test_f1: 0.4796
 epoch: 24, train_loss: 0.9858, test_loss: 0.9712, test_f1: 0.4860
 epoch: 25, train_loss: 0.9852, test_loss: 0.9634, test_f1: 0.4899
 epoch: 26, train_loss: 0.9792, test_loss: 0.9600, test_f1: 0.4928
 epoch: 27, train_loss: 0.9749, test_loss: 0.9569, test_f1: 0.4922
 epoch: 28, train_loss: 0.9684, test_loss: 0.9537, test_f1: 0.4910
 epoch: 29, train_loss: 0.9673, test_loss: 0.9504, test_f1: 0.4954
 epoch: 30, train_loss: 0.9628, test_loss: 0.9459, test_f1: 0.4987
 epoch: 31, train_loss: 0.9617, test_loss: 0.9436, test_f1: 0.4899
 epoch: 32, train_loss: 0.9617, test_loss: 0.9419, test_f1: 0.4940
 epoch: 33, train_loss: 0.9486, test_loss: 0.9409, test_f1: 0.4938
 epoch: 34, train_loss: 0.9469, test_loss: 0.9337, test_f1: 0.5100
 epoch: 35, train_loss: 0.9428, test_loss: 0.9330, test_f1: 0.5116
 epoch: 36, train_loss: 0.9416, test_loss: 0.9301, test_f1: 0.5051
 epoch: 37, train_loss: 0.9403, test_loss: 0.9262, test_f1: 0.5147
 epoch: 38, train_loss: 0.9359, test_loss: 0.9258, test_f1: 0.5155
 epoch: 39, train_loss: 0.9343, test_loss: 0.9247, test_f1: 0.5163
 epoch: 40, train_loss: 0.9219, test_loss: 0.9177, test_f1: 0.5131
 epoch: 41, train_loss: 0.9238, test_loss: 0.9176, test_f1: 0.5190
 epoch: 42, train_loss: 0.9178, test_loss: 0.9102, test_f1: 0.5205
 epoch: 43, train_loss: 0.9151, test_loss: 0.9108, test_f1: 0.5205
 epoch: 44, train_loss: 0.9138, test_loss: 0.9071, test_f1: 0.5202
 epoch: 45, train_loss: 0.9186, test_loss: 0.9042, test_f1: 0.5224
 epoch: 46, train_loss: 0.9070, test_loss: 0.8993, test_f1: 0.5242
 epoch: 47, train_loss: 0.9073, test_loss: 0.9017, test_f1: 0.5169
 epoch: 48, train_loss: 0.9013, test_loss: 0.8921, test_f1: 0.5308
 epoch: 49, train_loss: 0.9026, test_loss: 0.8892, test_f1: 0.5207
 epoch: 50, train_loss: 0.9019, test_loss: 0.8830, test_f1: 0.5248
 epoch: 51, train_loss: 0.8892, test_loss: 0.8849, test_f1: 0.5208
 epoch: 52, train_loss: 0.8938, test_loss: 0.8829, test_f1: 0.5183
 epoch: 53, train_loss: 0.8872, test_loss: 0.8791, test_f1: 0.5219
 epoch: 54, train_loss: 0.8859, test_loss: 0.8779, test_f1: 0.5228
 epoch: 55, train_loss: 0.8875, test_loss: 0.8756, test_f1: 0.5280
 epoch: 56, train_loss: 0.8842, test_loss: 0.8764, test_f1: 0.5291
 epoch: 57, train_loss: 0.8862, test_loss: 0.8773, test_f1: 0.5254
 epoch: 58, train_loss: 0.8785, test_loss: 0.8763, test_f1: 0.5251
 epoch: 59, train_loss: 0.8829, test_loss: 0.8763, test_f1: 0.5279
 epoch: 60, train_loss: 0.8803, test_loss: 0.8732, test_f1: 0.5214
 epoch: 61, train_loss: 0.8789, test_loss: 0.8720, test_f1: 0.5312
 epoch: 62, train_loss: 0.8737, test_loss: 0.8726, test_f1: 0.5304
 epoch: 63, train_loss: 0.8747, test_loss: 0.8693, test_f1: 0.5301
 epoch: 64, train_loss: 0.8731, test_loss: 0.8676, test_f1: 0.5294
 epoch: 65, train_loss: 0.8677, test_loss: 0.8672, test_f1: 0.5283
 epoch: 66, train_loss: 0.8694, test_loss: 0.8666, test_f1: 0.5287
 epoch: 67, train_loss: 0.8668, test_loss: 0.8648, test_f1: 0.5236
 epoch: 68, train_loss: 0.8667, test_loss: 0.8631, test_f1: 0.5269
 epoch: 69, train_loss: 0.8691, test_loss: 0.8646, test_f1: 0.5282
 epoch: 70, train_loss: 0.8636, test_loss: 0.8629, test_f1: 0.5359
 epoch: 71, train_loss: 0.8624, test_loss: 0.8596, test_f1: 0.5265
 epoch: 72, train_loss: 0.8643, test_loss: 0.8583, test_f1: 0.5290
 epoch: 73, train_loss: 0.8603, test_loss: 0.8578, test_f1: 0.5404
 epoch: 74, train_loss: 0.8607, test_loss: 0.8591, test_f1: 0.5354
 epoch: 75, train_loss: 0.8558, test_loss: 0.8565, test_f1: 0.5352
 epoch: 76, train_loss: 0.8579, test_loss: 0.8568, test_f1: 0.5385
 epoch: 77, train_loss: 0.8590, test_loss: 0.8580, test_f1: 0.5359
 epoch: 78, train_loss: 0.8599, test_loss: 0.8577, test_f1: 0.5316
 epoch: 79, train_loss: 0.8537, test_loss: 0.8510, test_f1: 0.5407
 epoch: 80, train_loss: 0.8521, test_loss: 0.8561, test_f1: 0.5321
 epoch: 81, train_loss: 0.8511, test_loss: 0.8530, test_f1: 0.5357
 epoch: 82, train_loss: 0.8421, test_loss: 0.8526, test_f1: 0.5335
 epoch: 83, train_loss: 0.8444, test_loss: 0.8527, test_f1: 0.5322
 epoch: 84, train_loss: 0.8513, test_loss: 0.8494, test_f1: 0.5336
 epoch: 85, train_loss: 0.8454, test_loss: 0.8501, test_f1: 0.5357
 epoch: 86, train_loss: 0.8487, test_loss: 0.8516, test_f1: 0.5435
 epoch: 87, train_loss: 0.8491, test_loss: 0.8505, test_f1: 0.5464
 epoch: 88, train_loss: 0.8434, test_loss: 0.8515, test_f1: 0.5297
 epoch: 89, train_loss: 0.8480, test_loss: 0.8480, test_f1: 0.5373
 epoch: 90, train_loss: 0.8438, test_loss: 0.8464, test_f1: 0.5447
 epoch: 91, train_loss: 0.8459, test_loss: 0.8466, test_f1: 0.5336
 epoch: 92, train_loss: 0.8391, test_loss: 0.8465, test_f1: 0.5331
 epoch: 93, train_loss: 0.8340, test_loss: 0.8452, test_f1: 0.5339
 epoch: 94, train_loss: 0.8331, test_loss: 0.8425, test_f1: 0.5449
 epoch: 95, train_loss: 0.8322, test_loss: 0.8428, test_f1: 0.5392
 epoch: 96, train_loss: 0.8359, test_loss: 0.8376, test_f1: 0.5446
 epoch: 97, train_loss: 0.8359, test_loss: 0.8401, test_f1: 0.5390
 epoch: 98, train_loss: 0.8320, test_loss: 0.8392, test_f1: 0.5299
 epoch: 99, train_loss: 0.8286, test_loss: 0.8369, test_f1: 0.5348
##################ITERATION #4 ****************************************
 epoch: 0, train_loss: 1.3167, test_loss: 1.3351, test_f1: 0.2270
 epoch: 1, train_loss: 1.2814, test_loss: 1.3237, test_f1: 0.2270
 epoch: 2, train_loss: 1.2558, test_loss: 1.3014, test_f1: 0.2270
 epoch: 3, train_loss: 1.2364, test_loss: 1.2631, test_f1: 0.2320
 epoch: 4, train_loss: 1.2153, test_loss: 1.2203, test_f1: 0.3256
 epoch: 5, train_loss: 1.1986, test_loss: 1.1791, test_f1: 0.4221
 epoch: 6, train_loss: 1.1696, test_loss: 1.1444, test_f1: 0.4247
 epoch: 7, train_loss: 1.1522, test_loss: 1.1182, test_f1: 0.4273
 epoch: 8, train_loss: 1.1368, test_loss: 1.0969, test_f1: 0.4327
 epoch: 9, train_loss: 1.1173, test_loss: 1.0800, test_f1: 0.4301
 epoch: 10, train_loss: 1.1002, test_loss: 1.0659, test_f1: 0.4335
 epoch: 11, train_loss: 1.0895, test_loss: 1.0532, test_f1: 0.4285
 epoch: 12, train_loss: 1.0746, test_loss: 1.0432, test_f1: 0.4313
 epoch: 13, train_loss: 1.0682, test_loss: 1.0348, test_f1: 0.4357
 epoch: 14, train_loss: 1.0616, test_loss: 1.0277, test_f1: 0.4443
 epoch: 15, train_loss: 1.0453, test_loss: 1.0221, test_f1: 0.4378
 epoch: 16, train_loss: 1.0423, test_loss: 1.0155, test_f1: 0.4359
 epoch: 17, train_loss: 1.0294, test_loss: 1.0093, test_f1: 0.4399
 epoch: 18, train_loss: 1.0274, test_loss: 1.0046, test_f1: 0.4481
 epoch: 19, train_loss: 1.0210, test_loss: 0.9990, test_f1: 0.4526
 epoch: 20, train_loss: 1.0172, test_loss: 0.9950, test_f1: 0.4667
 epoch: 21, train_loss: 1.0125, test_loss: 0.9900, test_f1: 0.4680
 epoch: 22, train_loss: 1.0035, test_loss: 0.9853, test_f1: 0.4673
 epoch: 23, train_loss: 1.0016, test_loss: 0.9825, test_f1: 0.4720
 epoch: 24, train_loss: 1.0003, test_loss: 0.9781, test_f1: 0.4747
 epoch: 25, train_loss: 0.9892, test_loss: 0.9761, test_f1: 0.4702
 epoch: 26, train_loss: 0.9854, test_loss: 0.9708, test_f1: 0.4841
 epoch: 27, train_loss: 0.9851, test_loss: 0.9682, test_f1: 0.4767
 epoch: 28, train_loss: 0.9835, test_loss: 0.9664, test_f1: 0.4724
 epoch: 29, train_loss: 0.9777, test_loss: 0.9632, test_f1: 0.4800
 epoch: 30, train_loss: 0.9703, test_loss: 0.9617, test_f1: 0.4829
 epoch: 31, train_loss: 0.9656, test_loss: 0.9595, test_f1: 0.4884
 epoch: 32, train_loss: 0.9590, test_loss: 0.9521, test_f1: 0.4841
 epoch: 33, train_loss: 0.9619, test_loss: 0.9534, test_f1: 0.4877
 epoch: 34, train_loss: 0.9578, test_loss: 0.9505, test_f1: 0.4879
 epoch: 35, train_loss: 0.9551, test_loss: 0.9456, test_f1: 0.4854
 epoch: 36, train_loss: 0.9504, test_loss: 0.9416, test_f1: 0.4892
 epoch: 37, train_loss: 0.9492, test_loss: 0.9385, test_f1: 0.5009
 epoch: 38, train_loss: 0.9427, test_loss: 0.9379, test_f1: 0.5015
 epoch: 39, train_loss: 0.9428, test_loss: 0.9352, test_f1: 0.4995
 epoch: 40, train_loss: 0.9361, test_loss: 0.9256, test_f1: 0.5003
 epoch: 41, train_loss: 0.9322, test_loss: 0.9272, test_f1: 0.5047
 epoch: 42, train_loss: 0.9354, test_loss: 0.9220, test_f1: 0.5034
 epoch: 43, train_loss: 0.9223, test_loss: 0.9187, test_f1: 0.4990
 epoch: 44, train_loss: 0.9272, test_loss: 0.9220, test_f1: 0.4978
 epoch: 45, train_loss: 0.9224, test_loss: 0.9194, test_f1: 0.4997
 epoch: 46, train_loss: 0.9213, test_loss: 0.9151, test_f1: 0.5044
 epoch: 47, train_loss: 0.9160, test_loss: 0.9113, test_f1: 0.5054
 epoch: 48, train_loss: 0.9084, test_loss: 0.9071, test_f1: 0.5136
 epoch: 49, train_loss: 0.9126, test_loss: 0.9034, test_f1: 0.5061
 epoch: 50, train_loss: 0.9088, test_loss: 0.9137, test_f1: 0.5163
 epoch: 51, train_loss: 0.9075, test_loss: 0.9006, test_f1: 0.5082
 epoch: 52, train_loss: 0.8990, test_loss: 0.8965, test_f1: 0.5058
 epoch: 53, train_loss: 0.8953, test_loss: 0.8968, test_f1: 0.5107
 epoch: 54, train_loss: 0.9018, test_loss: 0.8953, test_f1: 0.5234
 epoch: 55, train_loss: 0.8987, test_loss: 0.8960, test_f1: 0.5186
 epoch: 56, train_loss: 0.8953, test_loss: 0.8969, test_f1: 0.5293
 epoch: 57, train_loss: 0.8920, test_loss: 0.8925, test_f1: 0.5232
 epoch: 58, train_loss: 0.8917, test_loss: 0.8916, test_f1: 0.5337
 epoch: 59, train_loss: 0.8844, test_loss: 0.8872, test_f1: 0.5176
 epoch: 60, train_loss: 0.8899, test_loss: 0.8879, test_f1: 0.5331
 epoch: 61, train_loss: 0.8860, test_loss: 0.8860, test_f1: 0.5306
 epoch: 62, train_loss: 0.8841, test_loss: 0.8835, test_f1: 0.5350
 epoch: 63, train_loss: 0.8854, test_loss: 0.8815, test_f1: 0.5289
 epoch: 64, train_loss: 0.8825, test_loss: 0.8852, test_f1: 0.5386
 epoch: 65, train_loss: 0.8862, test_loss: 0.8846, test_f1: 0.5361
 epoch: 66, train_loss: 0.8778, test_loss: 0.8818, test_f1: 0.5382
 epoch: 67, train_loss: 0.8801, test_loss: 0.8801, test_f1: 0.5405
 epoch: 68, train_loss: 0.8753, test_loss: 0.8767, test_f1: 0.5369
 epoch: 69, train_loss: 0.8769, test_loss: 0.8769, test_f1: 0.5409
 epoch: 70, train_loss: 0.8753, test_loss: 0.8749, test_f1: 0.5469
 epoch: 71, train_loss: 0.8739, test_loss: 0.8749, test_f1: 0.5420
 epoch: 72, train_loss: 0.8732, test_loss: 0.8743, test_f1: 0.5374
 epoch: 73, train_loss: 0.8702, test_loss: 0.8720, test_f1: 0.5363
 epoch: 74, train_loss: 0.8667, test_loss: 0.8707, test_f1: 0.5397
 epoch: 75, train_loss: 0.8752, test_loss: 0.8702, test_f1: 0.5482
 epoch: 76, train_loss: 0.8676, test_loss: 0.8696, test_f1: 0.5516
 epoch: 77, train_loss: 0.8652, test_loss: 0.8713, test_f1: 0.5489
 epoch: 78, train_loss: 0.8617, test_loss: 0.8684, test_f1: 0.5459
 epoch: 79, train_loss: 0.8564, test_loss: 0.8647, test_f1: 0.5544
 epoch: 80, train_loss: 0.8591, test_loss: 0.8677, test_f1: 0.5481
 epoch: 81, train_loss: 0.8555, test_loss: 0.8659, test_f1: 0.5494
 epoch: 82, train_loss: 0.8616, test_loss: 0.8636, test_f1: 0.5519
 epoch: 83, train_loss: 0.8643, test_loss: 0.8663, test_f1: 0.5539
 epoch: 84, train_loss: 0.8561, test_loss: 0.8663, test_f1: 0.5594
 epoch: 85, train_loss: 0.8541, test_loss: 0.8637, test_f1: 0.5589
 epoch: 86, train_loss: 0.8526, test_loss: 0.8643, test_f1: 0.5515
 epoch: 87, train_loss: 0.8522, test_loss: 0.8658, test_f1: 0.5583
 epoch: 88, train_loss: 0.8539, test_loss: 0.8646, test_f1: 0.5599
 epoch: 89, train_loss: 0.8597, test_loss: 0.8686, test_f1: 0.5491
 epoch: 90, train_loss: 0.8465, test_loss: 0.8586, test_f1: 0.5598
 epoch: 91, train_loss: 0.8475, test_loss: 0.8614, test_f1: 0.5524
 epoch: 92, train_loss: 0.8526, test_loss: 0.8600, test_f1: 0.5620
 epoch: 93, train_loss: 0.8494, test_loss: 0.8613, test_f1: 0.5650
 epoch: 94, train_loss: 0.8472, test_loss: 0.8603, test_f1: 0.5536
 epoch: 95, train_loss: 0.8469, test_loss: 0.8621, test_f1: 0.5595
 epoch: 96, train_loss: 0.8395, test_loss: 0.8566, test_f1: 0.5633
 epoch: 97, train_loss: 0.8449, test_loss: 0.8558, test_f1: 0.5562
 epoch: 98, train_loss: 0.8482, test_loss: 0.8597, test_f1: 0.5554
 epoch: 99, train_loss: 0.8456, test_loss: 0.8557, test_f1: 0.5613
##################ITERATION #5 ****************************************
 epoch: 0, train_loss: 1.3119, test_loss: 1.3173, test_f1: 0.2270
 epoch: 1, train_loss: 1.2515, test_loss: 1.2993, test_f1: 0.2270
 epoch: 2, train_loss: 1.2195, test_loss: 1.2636, test_f1: 0.2270
 epoch: 3, train_loss: 1.1951, test_loss: 1.2076, test_f1: 0.3068
 epoch: 4, train_loss: 1.1671, test_loss: 1.1462, test_f1: 0.3497
 epoch: 5, train_loss: 1.1378, test_loss: 1.1045, test_f1: 0.3833
 epoch: 6, train_loss: 1.1184, test_loss: 1.0806, test_f1: 0.4140
 epoch: 7, train_loss: 1.1048, test_loss: 1.0621, test_f1: 0.4257
 epoch: 8, train_loss: 1.0873, test_loss: 1.0490, test_f1: 0.4375
 epoch: 9, train_loss: 1.0764, test_loss: 1.0390, test_f1: 0.4497
 epoch: 10, train_loss: 1.0577, test_loss: 1.0294, test_f1: 0.4506
 epoch: 11, train_loss: 1.0548, test_loss: 1.0214, test_f1: 0.4405
 epoch: 12, train_loss: 1.0431, test_loss: 1.0161, test_f1: 0.4432
 epoch: 13, train_loss: 1.0289, test_loss: 1.0072, test_f1: 0.4561
 epoch: 14, train_loss: 1.0283, test_loss: 1.0009, test_f1: 0.4599
 epoch: 15, train_loss: 1.0175, test_loss: 0.9925, test_f1: 0.4673
 epoch: 16, train_loss: 1.0115, test_loss: 0.9868, test_f1: 0.4750
 epoch: 17, train_loss: 0.9993, test_loss: 0.9836, test_f1: 0.4793
 epoch: 18, train_loss: 1.0032, test_loss: 0.9775, test_f1: 0.4828
 epoch: 19, train_loss: 0.9940, test_loss: 0.9767, test_f1: 0.4871
 epoch: 20, train_loss: 0.9927, test_loss: 0.9730, test_f1: 0.4863
 epoch: 21, train_loss: 0.9840, test_loss: 0.9675, test_f1: 0.4838
 epoch: 22, train_loss: 0.9787, test_loss: 0.9660, test_f1: 0.4759
 epoch: 23, train_loss: 0.9705, test_loss: 0.9601, test_f1: 0.4870
 epoch: 24, train_loss: 0.9661, test_loss: 0.9587, test_f1: 0.4851
 epoch: 25, train_loss: 0.9650, test_loss: 0.9535, test_f1: 0.4808
 epoch: 26, train_loss: 0.9715, test_loss: 0.9513, test_f1: 0.4849
 epoch: 27, train_loss: 0.9611, test_loss: 0.9491, test_f1: 0.4852
 epoch: 28, train_loss: 0.9567, test_loss: 0.9480, test_f1: 0.4881
 epoch: 29, train_loss: 0.9495, test_loss: 0.9501, test_f1: 0.5037
 epoch: 30, train_loss: 0.9531, test_loss: 0.9430, test_f1: 0.5045
 epoch: 31, train_loss: 0.9501, test_loss: 0.9414, test_f1: 0.5007
 epoch: 32, train_loss: 0.9464, test_loss: 0.9364, test_f1: 0.5113
 epoch: 33, train_loss: 0.9414, test_loss: 0.9380, test_f1: 0.4991
 epoch: 34, train_loss: 0.9317, test_loss: 0.9329, test_f1: 0.5075
 epoch: 35, train_loss: 0.9273, test_loss: 0.9292, test_f1: 0.5112
 epoch: 36, train_loss: 0.9326, test_loss: 0.9265, test_f1: 0.5047
 epoch: 37, train_loss: 0.9284, test_loss: 0.9198, test_f1: 0.5217
 epoch: 38, train_loss: 0.9232, test_loss: 0.9194, test_f1: 0.5210
 epoch: 39, train_loss: 0.9218, test_loss: 0.9172, test_f1: 0.5186
 epoch: 40, train_loss: 0.9244, test_loss: 0.9196, test_f1: 0.5122
 epoch: 41, train_loss: 0.9107, test_loss: 0.9144, test_f1: 0.5216
 epoch: 42, train_loss: 0.9128, test_loss: 0.9064, test_f1: 0.5300
 epoch: 43, train_loss: 0.9116, test_loss: 0.9095, test_f1: 0.5297
 epoch: 44, train_loss: 0.9109, test_loss: 0.9088, test_f1: 0.5255
 epoch: 45, train_loss: 0.9071, test_loss: 0.9087, test_f1: 0.5235
 epoch: 46, train_loss: 0.8986, test_loss: 0.9079, test_f1: 0.5250
 epoch: 47, train_loss: 0.8979, test_loss: 0.9006, test_f1: 0.5258
 epoch: 48, train_loss: 0.8962, test_loss: 0.8985, test_f1: 0.5371
 epoch: 49, train_loss: 0.9003, test_loss: 0.9019, test_f1: 0.5244
 epoch: 50, train_loss: 0.8956, test_loss: 0.8950, test_f1: 0.5258
 epoch: 51, train_loss: 0.8908, test_loss: 0.8971, test_f1: 0.5249
 epoch: 52, train_loss: 0.8837, test_loss: 0.8941, test_f1: 0.5267
 epoch: 53, train_loss: 0.8827, test_loss: 0.8922, test_f1: 0.5311
 epoch: 54, train_loss: 0.8846, test_loss: 0.8913, test_f1: 0.5323
 epoch: 55, train_loss: 0.8883, test_loss: 0.8954, test_f1: 0.5308
 epoch: 56, train_loss: 0.8859, test_loss: 0.8917, test_f1: 0.5249
 epoch: 57, train_loss: 0.8845, test_loss: 0.8926, test_f1: 0.5238
 epoch: 58, train_loss: 0.8745, test_loss: 0.8922, test_f1: 0.5282
 epoch: 59, train_loss: 0.8847, test_loss: 0.8931, test_f1: 0.5290
 epoch: 60, train_loss: 0.8860, test_loss: 0.8911, test_f1: 0.5267
 epoch: 61, train_loss: 0.8785, test_loss: 0.8888, test_f1: 0.5268
 epoch: 62, train_loss: 0.8796, test_loss: 0.8848, test_f1: 0.5305
 epoch: 63, train_loss: 0.8663, test_loss: 0.8839, test_f1: 0.5308
 epoch: 64, train_loss: 0.8734, test_loss: 0.8855, test_f1: 0.5354
 epoch: 65, train_loss: 0.8760, test_loss: 0.8856, test_f1: 0.5304
 epoch: 66, train_loss: 0.8760, test_loss: 0.8839, test_f1: 0.5354
 epoch: 67, train_loss: 0.8742, test_loss: 0.8848, test_f1: 0.5419
 epoch: 68, train_loss: 0.8698, test_loss: 0.8812, test_f1: 0.5350
 epoch: 69, train_loss: 0.8705, test_loss: 0.8800, test_f1: 0.5385
 epoch: 70, train_loss: 0.8694, test_loss: 0.8781, test_f1: 0.5351
 epoch: 71, train_loss: 0.8677, test_loss: 0.8812, test_f1: 0.5338
 epoch: 72, train_loss: 0.8669, test_loss: 0.8810, test_f1: 0.5394
 epoch: 73, train_loss: 0.8632, test_loss: 0.8765, test_f1: 0.5422
 epoch: 74, train_loss: 0.8599, test_loss: 0.8758, test_f1: 0.5340
 epoch: 75, train_loss: 0.8566, test_loss: 0.8823, test_f1: 0.5336
 epoch: 76, train_loss: 0.8579, test_loss: 0.8836, test_f1: 0.5402
 epoch: 77, train_loss: 0.8601, test_loss: 0.8742, test_f1: 0.5363
 epoch: 78, train_loss: 0.8572, test_loss: 0.8750, test_f1: 0.5361
 epoch: 79, train_loss: 0.8590, test_loss: 0.8748, test_f1: 0.5436
 epoch: 80, train_loss: 0.8565, test_loss: 0.8749, test_f1: 0.5419
 epoch: 81, train_loss: 0.8632, test_loss: 0.8711, test_f1: 0.5432
 epoch: 82, train_loss: 0.8537, test_loss: 0.8744, test_f1: 0.5403
 epoch: 83, train_loss: 0.8558, test_loss: 0.8724, test_f1: 0.5397
 epoch: 84, train_loss: 0.8502, test_loss: 0.8733, test_f1: 0.5419
 epoch: 85, train_loss: 0.8532, test_loss: 0.8679, test_f1: 0.5406
 epoch: 86, train_loss: 0.8510, test_loss: 0.8689, test_f1: 0.5409
 epoch: 87, train_loss: 0.8526, test_loss: 0.8655, test_f1: 0.5442
 epoch: 88, train_loss: 0.8537, test_loss: 0.8628, test_f1: 0.5428
 epoch: 89, train_loss: 0.8452, test_loss: 0.8652, test_f1: 0.5426
 epoch: 90, train_loss: 0.8577, test_loss: 0.8691, test_f1: 0.5426
 epoch: 91, train_loss: 0.8490, test_loss: 0.8649, test_f1: 0.5443
 epoch: 92, train_loss: 0.8426, test_loss: 0.8670, test_f1: 0.5439
 epoch: 93, train_loss: 0.8385, test_loss: 0.8625, test_f1: 0.5424
 epoch: 94, train_loss: 0.8363, test_loss: 0.8606, test_f1: 0.5438
 epoch: 95, train_loss: 0.8459, test_loss: 0.8570, test_f1: 0.5497
 epoch: 96, train_loss: 0.8417, test_loss: 0.8637, test_f1: 0.5438
 epoch: 97, train_loss: 0.8372, test_loss: 0.8643, test_f1: 0.5439
 epoch: 98, train_loss: 0.8315, test_loss: 0.8631, test_f1: 0.5447
 epoch: 99, train_loss: 0.8360, test_loss: 0.8583, test_f1: 0.5506
##################ITERATION #6 ****************************************
 epoch: 0, train_loss: 1.3040, test_loss: 1.3142, test_f1: 0.2270
 epoch: 1, train_loss: 1.2320, test_loss: 1.2933, test_f1: 0.2270
 epoch: 2, train_loss: 1.2057, test_loss: 1.2300, test_f1: 0.2251
 epoch: 3, train_loss: 1.1758, test_loss: 1.1591, test_f1: 0.3378
 epoch: 4, train_loss: 1.1536, test_loss: 1.1141, test_f1: 0.4050
 epoch: 5, train_loss: 1.1276, test_loss: 1.0858, test_f1: 0.4244
 epoch: 6, train_loss: 1.1120, test_loss: 1.0624, test_f1: 0.4287
 epoch: 7, train_loss: 1.0903, test_loss: 1.0448, test_f1: 0.4276
 epoch: 8, train_loss: 1.0810, test_loss: 1.0324, test_f1: 0.4513
 epoch: 9, train_loss: 1.0662, test_loss: 1.0244, test_f1: 0.4539
 epoch: 10, train_loss: 1.0542, test_loss: 1.0176, test_f1: 0.4525
 epoch: 11, train_loss: 1.0485, test_loss: 1.0112, test_f1: 0.4615
 epoch: 12, train_loss: 1.0377, test_loss: 1.0049, test_f1: 0.4648
 epoch: 13, train_loss: 1.0323, test_loss: 0.9989, test_f1: 0.4627
 epoch: 14, train_loss: 1.0229, test_loss: 0.9971, test_f1: 0.4627
 epoch: 15, train_loss: 1.0167, test_loss: 0.9938, test_f1: 0.4714
 epoch: 16, train_loss: 1.0104, test_loss: 0.9882, test_f1: 0.4679
 epoch: 17, train_loss: 1.0105, test_loss: 0.9834, test_f1: 0.4730
 epoch: 18, train_loss: 1.0033, test_loss: 0.9824, test_f1: 0.4730
 epoch: 19, train_loss: 0.9960, test_loss: 0.9784, test_f1: 0.4796
 epoch: 20, train_loss: 0.9986, test_loss: 0.9755, test_f1: 0.4793
 epoch: 21, train_loss: 0.9982, test_loss: 0.9722, test_f1: 0.4820
 epoch: 22, train_loss: 0.9850, test_loss: 0.9676, test_f1: 0.4841
 epoch: 23, train_loss: 0.9825, test_loss: 0.9668, test_f1: 0.4833
 epoch: 24, train_loss: 0.9785, test_loss: 0.9679, test_f1: 0.4893
 epoch: 25, train_loss: 0.9734, test_loss: 0.9651, test_f1: 0.4880
 epoch: 26, train_loss: 0.9679, test_loss: 0.9582, test_f1: 0.4858
 epoch: 27, train_loss: 0.9696, test_loss: 0.9575, test_f1: 0.4908
 epoch: 28, train_loss: 0.9683, test_loss: 0.9550, test_f1: 0.4945
 epoch: 29, train_loss: 0.9666, test_loss: 0.9538, test_f1: 0.4961
 epoch: 30, train_loss: 0.9632, test_loss: 0.9516, test_f1: 0.4975
 epoch: 31, train_loss: 0.9613, test_loss: 0.9512, test_f1: 0.4870
 epoch: 32, train_loss: 0.9479, test_loss: 0.9488, test_f1: 0.4939
 epoch: 33, train_loss: 0.9473, test_loss: 0.9497, test_f1: 0.4898
 epoch: 34, train_loss: 0.9455, test_loss: 0.9408, test_f1: 0.5043
 epoch: 35, train_loss: 0.9392, test_loss: 0.9419, test_f1: 0.5053
 epoch: 36, train_loss: 0.9421, test_loss: 0.9404, test_f1: 0.4924
 epoch: 37, train_loss: 0.9352, test_loss: 0.9407, test_f1: 0.5055
 epoch: 38, train_loss: 0.9357, test_loss: 0.9292, test_f1: 0.4979
 epoch: 39, train_loss: 0.9358, test_loss: 0.9392, test_f1: 0.5110
 epoch: 40, train_loss: 0.9305, test_loss: 0.9265, test_f1: 0.5144
 epoch: 41, train_loss: 0.9230, test_loss: 0.9300, test_f1: 0.5230
 epoch: 42, train_loss: 0.9259, test_loss: 0.9255, test_f1: 0.4982
 epoch: 43, train_loss: 0.9183, test_loss: 0.9234, test_f1: 0.5201
 epoch: 44, train_loss: 0.9141, test_loss: 0.9163, test_f1: 0.5168
 epoch: 45, train_loss: 0.9158, test_loss: 0.9176, test_f1: 0.5174
 epoch: 46, train_loss: 0.9110, test_loss: 0.9069, test_f1: 0.5363
 epoch: 47, train_loss: 0.9074, test_loss: 0.9197, test_f1: 0.5393
 epoch: 48, train_loss: 0.9035, test_loss: 0.9096, test_f1: 0.5152
 epoch: 49, train_loss: 0.9098, test_loss: 0.9111, test_f1: 0.5324
 epoch: 50, train_loss: 0.9018, test_loss: 0.9191, test_f1: 0.5379
 epoch: 51, train_loss: 0.8956, test_loss: 0.9158, test_f1: 0.5405
 epoch: 52, train_loss: 0.8913, test_loss: 0.9071, test_f1: 0.5330
 epoch: 53, train_loss: 0.8939, test_loss: 0.9041, test_f1: 0.5392
 epoch: 54, train_loss: 0.8886, test_loss: 0.9007, test_f1: 0.5430
 epoch: 55, train_loss: 0.8880, test_loss: 0.9068, test_f1: 0.5417
 epoch: 56, train_loss: 0.8887, test_loss: 0.8973, test_f1: 0.5449
 epoch: 57, train_loss: 0.8927, test_loss: 0.8919, test_f1: 0.5440
 epoch: 58, train_loss: 0.8845, test_loss: 0.8960, test_f1: 0.5481
 epoch: 59, train_loss: 0.8899, test_loss: 0.9038, test_f1: 0.5469
 epoch: 60, train_loss: 0.8835, test_loss: 0.9016, test_f1: 0.5514
 epoch: 61, train_loss: 0.8837, test_loss: 0.8976, test_f1: 0.5441
 epoch: 62, train_loss: 0.8839, test_loss: 0.8955, test_f1: 0.5522
 epoch: 63, train_loss: 0.8720, test_loss: 0.8917, test_f1: 0.5494
 epoch: 64, train_loss: 0.8767, test_loss: 0.8914, test_f1: 0.5533
 epoch: 65, train_loss: 0.8726, test_loss: 0.8933, test_f1: 0.5563
 epoch: 66, train_loss: 0.8744, test_loss: 0.8908, test_f1: 0.5508
 epoch: 67, train_loss: 0.8712, test_loss: 0.8902, test_f1: 0.5497
 epoch: 68, train_loss: 0.8746, test_loss: 0.8871, test_f1: 0.5559
 epoch: 69, train_loss: 0.8752, test_loss: 0.8981, test_f1: 0.5421
 epoch: 70, train_loss: 0.8672, test_loss: 0.8857, test_f1: 0.5484
 epoch: 71, train_loss: 0.8662, test_loss: 0.8910, test_f1: 0.5580
 epoch: 72, train_loss: 0.8735, test_loss: 0.8836, test_f1: 0.5572
 epoch: 73, train_loss: 0.8688, test_loss: 0.8820, test_f1: 0.5584
 epoch: 74, train_loss: 0.8717, test_loss: 0.8900, test_f1: 0.5592
 epoch: 75, train_loss: 0.8673, test_loss: 0.8781, test_f1: 0.5425
 epoch: 76, train_loss: 0.8635, test_loss: 0.8867, test_f1: 0.5582
 epoch: 77, train_loss: 0.8635, test_loss: 0.8765, test_f1: 0.5591
 epoch: 78, train_loss: 0.8605, test_loss: 0.8874, test_f1: 0.5498
 epoch: 79, train_loss: 0.8543, test_loss: 0.8785, test_f1: 0.5525
 epoch: 80, train_loss: 0.8514, test_loss: 0.8774, test_f1: 0.5605
 epoch: 81, train_loss: 0.8546, test_loss: 0.8712, test_f1: 0.5609
 epoch: 82, train_loss: 0.8554, test_loss: 0.8723, test_f1: 0.5609
 epoch: 83, train_loss: 0.8495, test_loss: 0.8782, test_f1: 0.5635
 epoch: 84, train_loss: 0.8402, test_loss: 0.8741, test_f1: 0.5556
 epoch: 85, train_loss: 0.8509, test_loss: 0.8731, test_f1: 0.5590
 epoch: 86, train_loss: 0.8530, test_loss: 0.8775, test_f1: 0.5572
 epoch: 87, train_loss: 0.8496, test_loss: 0.8731, test_f1: 0.5563
 epoch: 88, train_loss: 0.8476, test_loss: 0.8674, test_f1: 0.5638
 epoch: 89, train_loss: 0.8474, test_loss: 0.8683, test_f1: 0.5605
 epoch: 90, train_loss: 0.8461, test_loss: 0.8664, test_f1: 0.5631
 epoch: 91, train_loss: 0.8416, test_loss: 0.8700, test_f1: 0.5642
 epoch: 92, train_loss: 0.8449, test_loss: 0.8655, test_f1: 0.5610
 epoch: 93, train_loss: 0.8398, test_loss: 0.8639, test_f1: 0.5635
 epoch: 94, train_loss: 0.8411, test_loss: 0.8698, test_f1: 0.5699
 epoch: 95, train_loss: 0.8394, test_loss: 0.8731, test_f1: 0.5724
 epoch: 96, train_loss: 0.8379, test_loss: 0.8675, test_f1: 0.5571
 epoch: 97, train_loss: 0.8355, test_loss: 0.8659, test_f1: 0.5579
 epoch: 98, train_loss: 0.8414, test_loss: 0.8748, test_f1: 0.5608
 epoch: 99, train_loss: 0.8380, test_loss: 0.8691, test_f1: 0.5704
##################ITERATION #7 ****************************************
 epoch: 0, train_loss: 1.2886, test_loss: 1.3066, test_f1: 0.2270
 epoch: 1, train_loss: 1.2234, test_loss: 1.2808, test_f1: 0.2270
 epoch: 2, train_loss: 1.1852, test_loss: 1.2384, test_f1: 0.2270
 epoch: 3, train_loss: 1.1596, test_loss: 1.1743, test_f1: 0.2338
 epoch: 4, train_loss: 1.1240, test_loss: 1.1137, test_f1: 0.4235
 epoch: 5, train_loss: 1.1046, test_loss: 1.0772, test_f1: 0.4410
 epoch: 6, train_loss: 1.0887, test_loss: 1.0553, test_f1: 0.4640
 epoch: 7, train_loss: 1.0808, test_loss: 1.0404, test_f1: 0.4667
 epoch: 8, train_loss: 1.0658, test_loss: 1.0339, test_f1: 0.4703
 epoch: 9, train_loss: 1.0489, test_loss: 1.0227, test_f1: 0.4714
 epoch: 10, train_loss: 1.0368, test_loss: 1.0173, test_f1: 0.4685
 epoch: 11, train_loss: 1.0295, test_loss: 1.0088, test_f1: 0.4760
 epoch: 12, train_loss: 1.0230, test_loss: 1.0024, test_f1: 0.4776
 epoch: 13, train_loss: 1.0146, test_loss: 0.9985, test_f1: 0.4790
 epoch: 14, train_loss: 1.0145, test_loss: 0.9925, test_f1: 0.4775
 epoch: 15, train_loss: 1.0024, test_loss: 0.9801, test_f1: 0.4814
 epoch: 16, train_loss: 0.9954, test_loss: 0.9776, test_f1: 0.4867
 epoch: 17, train_loss: 0.9903, test_loss: 0.9728, test_f1: 0.4906
 epoch: 18, train_loss: 0.9812, test_loss: 0.9683, test_f1: 0.5002
 epoch: 19, train_loss: 0.9775, test_loss: 0.9639, test_f1: 0.4898
 epoch: 20, train_loss: 0.9679, test_loss: 0.9577, test_f1: 0.5126
 epoch: 21, train_loss: 0.9671, test_loss: 0.9519, test_f1: 0.5181
 epoch: 22, train_loss: 0.9620, test_loss: 0.9514, test_f1: 0.5037
 epoch: 23, train_loss: 0.9520, test_loss: 0.9452, test_f1: 0.5264
 epoch: 24, train_loss: 0.9464, test_loss: 0.9344, test_f1: 0.5225
 epoch: 25, train_loss: 0.9445, test_loss: 0.9385, test_f1: 0.5232
 epoch: 26, train_loss: 0.9350, test_loss: 0.9341, test_f1: 0.5131
 epoch: 27, train_loss: 0.9324, test_loss: 0.9271, test_f1: 0.5323
 epoch: 28, train_loss: 0.9312, test_loss: 0.9308, test_f1: 0.5304
 epoch: 29, train_loss: 0.9270, test_loss: 0.9289, test_f1: 0.5145
 epoch: 30, train_loss: 0.9249, test_loss: 0.9287, test_f1: 0.5144
 epoch: 31, train_loss: 0.9179, test_loss: 0.9224, test_f1: 0.5248
 epoch: 32, train_loss: 0.9139, test_loss: 0.9232, test_f1: 0.5186
 epoch: 33, train_loss: 0.9065, test_loss: 0.9176, test_f1: 0.5204
 epoch: 34, train_loss: 0.9026, test_loss: 0.9171, test_f1: 0.5161
 epoch: 35, train_loss: 0.9044, test_loss: 0.9144, test_f1: 0.5310
 epoch: 36, train_loss: 0.9013, test_loss: 0.9168, test_f1: 0.5220
 epoch: 37, train_loss: 0.8954, test_loss: 0.9167, test_f1: 0.5303
 epoch: 38, train_loss: 0.8950, test_loss: 0.9098, test_f1: 0.5193
 epoch: 39, train_loss: 0.8948, test_loss: 0.9076, test_f1: 0.5367
 epoch: 40, train_loss: 0.8818, test_loss: 0.9026, test_f1: 0.5296
 epoch: 41, train_loss: 0.8841, test_loss: 0.9065, test_f1: 0.5463
 epoch: 42, train_loss: 0.8815, test_loss: 0.9057, test_f1: 0.5330
 epoch: 43, train_loss: 0.8735, test_loss: 0.9034, test_f1: 0.5481
 epoch: 44, train_loss: 0.8743, test_loss: 0.9021, test_f1: 0.5418
 epoch: 45, train_loss: 0.8649, test_loss: 0.9056, test_f1: 0.5302
 epoch: 46, train_loss: 0.8683, test_loss: 0.8947, test_f1: 0.5484
 epoch: 47, train_loss: 0.8705, test_loss: 0.8995, test_f1: 0.5497
 epoch: 48, train_loss: 0.8558, test_loss: 0.8963, test_f1: 0.5415
 epoch: 49, train_loss: 0.8610, test_loss: 0.9034, test_f1: 0.5528
 epoch: 50, train_loss: 0.8533, test_loss: 0.8967, test_f1: 0.5529
 epoch: 51, train_loss: 0.8572, test_loss: 0.8930, test_f1: 0.5531
 epoch: 52, train_loss: 0.8513, test_loss: 0.8911, test_f1: 0.5560
 epoch: 53, train_loss: 0.8546, test_loss: 0.8897, test_f1: 0.5565
 epoch: 54, train_loss: 0.8454, test_loss: 0.8925, test_f1: 0.5507
 epoch: 55, train_loss: 0.8438, test_loss: 0.8866, test_f1: 0.5523
 epoch: 56, train_loss: 0.8443, test_loss: 0.8859, test_f1: 0.5525
 epoch: 57, train_loss: 0.8403, test_loss: 0.8840, test_f1: 0.5570
 epoch: 58, train_loss: 0.8402, test_loss: 0.8806, test_f1: 0.5560
 epoch: 59, train_loss: 0.8377, test_loss: 0.8829, test_f1: 0.5554
 epoch: 60, train_loss: 0.8424, test_loss: 0.8847, test_f1: 0.5503
 epoch: 61, train_loss: 0.8388, test_loss: 0.8820, test_f1: 0.5538
 epoch: 62, train_loss: 0.8350, test_loss: 0.8792, test_f1: 0.5553
 epoch: 63, train_loss: 0.8419, test_loss: 0.8784, test_f1: 0.5581
 epoch: 64, train_loss: 0.8352, test_loss: 0.8781, test_f1: 0.5543
 epoch: 65, train_loss: 0.8320, test_loss: 0.8765, test_f1: 0.5558
 epoch: 66, train_loss: 0.8324, test_loss: 0.8745, test_f1: 0.5545
 epoch: 67, train_loss: 0.8345, test_loss: 0.8794, test_f1: 0.5576
 epoch: 68, train_loss: 0.8328, test_loss: 0.8798, test_f1: 0.5581
 epoch: 69, train_loss: 0.8269, test_loss: 0.8801, test_f1: 0.5524
 epoch: 70, train_loss: 0.8163, test_loss: 0.8741, test_f1: 0.5577
 epoch: 71, train_loss: 0.8189, test_loss: 0.8756, test_f1: 0.5598
 epoch: 72, train_loss: 0.8256, test_loss: 0.8736, test_f1: 0.5570
 epoch: 73, train_loss: 0.8195, test_loss: 0.8753, test_f1: 0.5567
 epoch: 74, train_loss: 0.8200, test_loss: 0.8807, test_f1: 0.5607
 epoch: 75, train_loss: 0.8202, test_loss: 0.8751, test_f1: 0.5578
 epoch: 76, train_loss: 0.8179, test_loss: 0.8723, test_f1: 0.5604
 epoch: 77, train_loss: 0.8150, test_loss: 0.8744, test_f1: 0.5563
 epoch: 78, train_loss: 0.8106, test_loss: 0.8722, test_f1: 0.5621
 epoch: 79, train_loss: 0.8097, test_loss: 0.8708, test_f1: 0.5606
 epoch: 80, train_loss: 0.8089, test_loss: 0.8684, test_f1: 0.5583
 epoch: 81, train_loss: 0.8088, test_loss: 0.8700, test_f1: 0.5563
 epoch: 82, train_loss: 0.8115, test_loss: 0.8683, test_f1: 0.5607
 epoch: 83, train_loss: 0.8069, test_loss: 0.8635, test_f1: 0.5577
 epoch: 84, train_loss: 0.8012, test_loss: 0.8655, test_f1: 0.5575
 epoch: 85, train_loss: 0.8035, test_loss: 0.8635, test_f1: 0.5530
 epoch: 86, train_loss: 0.8105, test_loss: 0.8672, test_f1: 0.5674
 epoch: 87, train_loss: 0.8040, test_loss: 0.8655, test_f1: 0.5627
 epoch: 88, train_loss: 0.7955, test_loss: 0.8617, test_f1: 0.5622
 epoch: 89, train_loss: 0.7958, test_loss: 0.8648, test_f1: 0.5585
 epoch: 90, train_loss: 0.8038, test_loss: 0.8600, test_f1: 0.5579
 epoch: 91, train_loss: 0.7940, test_loss: 0.8608, test_f1: 0.5622
 epoch: 92, train_loss: 0.8042, test_loss: 0.8627, test_f1: 0.5630
 epoch: 93, train_loss: 0.7953, test_loss: 0.8604, test_f1: 0.5621
 epoch: 94, train_loss: 0.7937, test_loss: 0.8618, test_f1: 0.5651
 epoch: 95, train_loss: 0.7937, test_loss: 0.8674, test_f1: 0.5651
 epoch: 96, train_loss: 0.7944, test_loss: 0.8616, test_f1: 0.5666
 epoch: 97, train_loss: 0.7934, test_loss: 0.8612, test_f1: 0.5653
 epoch: 98, train_loss: 0.7854, test_loss: 0.8638, test_f1: 0.5701
 epoch: 99, train_loss: 0.7815, test_loss: 0.8657, test_f1: 0.5650
##################ITERATION #8 ****************************************
 epoch: 0, train_loss: 1.3158, test_loss: 1.3450, test_f1: 0.2270
 epoch: 1, train_loss: 1.1960, test_loss: 1.3162, test_f1: 0.2270
 epoch: 2, train_loss: 1.1535, test_loss: 1.2439, test_f1: 0.2270
 epoch: 3, train_loss: 1.1223, test_loss: 1.1448, test_f1: 0.3073
 epoch: 4, train_loss: 1.0968, test_loss: 1.0705, test_f1: 0.3843
 epoch: 5, train_loss: 1.0824, test_loss: 1.0408, test_f1: 0.4214
 epoch: 6, train_loss: 1.0616, test_loss: 1.0290, test_f1: 0.4379
 epoch: 7, train_loss: 1.0483, test_loss: 1.0233, test_f1: 0.4534
 epoch: 8, train_loss: 1.0425, test_loss: 1.0160, test_f1: 0.4544
 epoch: 9, train_loss: 1.0376, test_loss: 1.0125, test_f1: 0.4576
 epoch: 10, train_loss: 1.0334, test_loss: 1.0062, test_f1: 0.4702
 epoch: 11, train_loss: 1.0227, test_loss: 1.0021, test_f1: 0.4690
 epoch: 12, train_loss: 1.0105, test_loss: 0.9969, test_f1: 0.4786
 epoch: 13, train_loss: 1.0101, test_loss: 0.9892, test_f1: 0.4875
 epoch: 14, train_loss: 1.0015, test_loss: 0.9844, test_f1: 0.4869
 epoch: 15, train_loss: 0.9969, test_loss: 0.9827, test_f1: 0.4851
 epoch: 16, train_loss: 0.9914, test_loss: 0.9784, test_f1: 0.5112
 epoch: 17, train_loss: 0.9876, test_loss: 0.9708, test_f1: 0.5177
 epoch: 18, train_loss: 0.9832, test_loss: 0.9677, test_f1: 0.5130
 epoch: 19, train_loss: 0.9732, test_loss: 0.9714, test_f1: 0.5152
 epoch: 20, train_loss: 0.9736, test_loss: 0.9623, test_f1: 0.5112
 epoch: 21, train_loss: 0.9739, test_loss: 0.9562, test_f1: 0.5112
 epoch: 22, train_loss: 0.9686, test_loss: 0.9561, test_f1: 0.5164
 epoch: 23, train_loss: 0.9652, test_loss: 0.9524, test_f1: 0.5190
 epoch: 24, train_loss: 0.9598, test_loss: 0.9516, test_f1: 0.5135
 epoch: 25, train_loss: 0.9493, test_loss: 0.9467, test_f1: 0.5169
 epoch: 26, train_loss: 0.9549, test_loss: 0.9492, test_f1: 0.5211
 epoch: 27, train_loss: 0.9423, test_loss: 0.9450, test_f1: 0.5173
 epoch: 28, train_loss: 0.9491, test_loss: 0.9403, test_f1: 0.5207
 epoch: 29, train_loss: 0.9443, test_loss: 0.9394, test_f1: 0.5244
 epoch: 30, train_loss: 0.9432, test_loss: 0.9360, test_f1: 0.5229
 epoch: 31, train_loss: 0.9335, test_loss: 0.9329, test_f1: 0.5269
 epoch: 32, train_loss: 0.9354, test_loss: 0.9310, test_f1: 0.5265
 epoch: 33, train_loss: 0.9312, test_loss: 0.9296, test_f1: 0.5193
 epoch: 34, train_loss: 0.9297, test_loss: 0.9254, test_f1: 0.5239
 epoch: 35, train_loss: 0.9274, test_loss: 0.9237, test_f1: 0.5253
 epoch: 36, train_loss: 0.9238, test_loss: 0.9261, test_f1: 0.5262
 epoch: 37, train_loss: 0.9145, test_loss: 0.9120, test_f1: 0.5288
 epoch: 38, train_loss: 0.9172, test_loss: 0.9116, test_f1: 0.5263
 epoch: 39, train_loss: 0.9162, test_loss: 0.9077, test_f1: 0.5340
 epoch: 40, train_loss: 0.9136, test_loss: 0.9174, test_f1: 0.5285
 epoch: 41, train_loss: 0.9055, test_loss: 0.9038, test_f1: 0.5281
 epoch: 42, train_loss: 0.9021, test_loss: 0.9074, test_f1: 0.5396
 epoch: 43, train_loss: 0.8992, test_loss: 0.9050, test_f1: 0.5359
 epoch: 44, train_loss: 0.9014, test_loss: 0.9044, test_f1: 0.5349
 epoch: 45, train_loss: 0.8945, test_loss: 0.8926, test_f1: 0.5399
 epoch: 46, train_loss: 0.8927, test_loss: 0.8967, test_f1: 0.5429
 epoch: 47, train_loss: 0.8954, test_loss: 0.8906, test_f1: 0.5340
 epoch: 48, train_loss: 0.8843, test_loss: 0.8939, test_f1: 0.5329
 epoch: 49, train_loss: 0.8817, test_loss: 0.8939, test_f1: 0.5417
 epoch: 50, train_loss: 0.8868, test_loss: 0.8919, test_f1: 0.5439
 epoch: 51, train_loss: 0.8723, test_loss: 0.8941, test_f1: 0.5355
 epoch: 52, train_loss: 0.8703, test_loss: 0.8934, test_f1: 0.5420
 epoch: 53, train_loss: 0.8730, test_loss: 0.8855, test_f1: 0.5441
 epoch: 54, train_loss: 0.8749, test_loss: 0.8841, test_f1: 0.5439
 epoch: 55, train_loss: 0.8715, test_loss: 0.8858, test_f1: 0.5381
 epoch: 56, train_loss: 0.8734, test_loss: 0.8854, test_f1: 0.5578
 epoch: 57, train_loss: 0.8731, test_loss: 0.8804, test_f1: 0.5473
 epoch: 58, train_loss: 0.8701, test_loss: 0.8845, test_f1: 0.5445
 epoch: 59, train_loss: 0.8707, test_loss: 0.8881, test_f1: 0.5474
 epoch: 60, train_loss: 0.8729, test_loss: 0.8827, test_f1: 0.5559
 epoch: 61, train_loss: 0.8665, test_loss: 0.8817, test_f1: 0.5498
 epoch: 62, train_loss: 0.8601, test_loss: 0.8801, test_f1: 0.5486
 epoch: 63, train_loss: 0.8637, test_loss: 0.8802, test_f1: 0.5535
 epoch: 64, train_loss: 0.8576, test_loss: 0.8816, test_f1: 0.5535
 epoch: 65, train_loss: 0.8676, test_loss: 0.8802, test_f1: 0.5511
 epoch: 66, train_loss: 0.8644, test_loss: 0.8798, test_f1: 0.5484
 epoch: 67, train_loss: 0.8618, test_loss: 0.8760, test_f1: 0.5560
 epoch: 68, train_loss: 0.8588, test_loss: 0.8803, test_f1: 0.5573
 epoch: 69, train_loss: 0.8564, test_loss: 0.8733, test_f1: 0.5566
 epoch: 70, train_loss: 0.8615, test_loss: 0.8769, test_f1: 0.5587
 epoch: 71, train_loss: 0.8586, test_loss: 0.8735, test_f1: 0.5586
 epoch: 72, train_loss: 0.8518, test_loss: 0.8743, test_f1: 0.5531
 epoch: 73, train_loss: 0.8489, test_loss: 0.8692, test_f1: 0.5580
 epoch: 74, train_loss: 0.8559, test_loss: 0.8755, test_f1: 0.5581
 epoch: 75, train_loss: 0.8545, test_loss: 0.8745, test_f1: 0.5600
 epoch: 76, train_loss: 0.8511, test_loss: 0.8710, test_f1: 0.5667
 epoch: 77, train_loss: 0.8485, test_loss: 0.8687, test_f1: 0.5659
 epoch: 78, train_loss: 0.8483, test_loss: 0.8707, test_f1: 0.5637
 epoch: 79, train_loss: 0.8475, test_loss: 0.8732, test_f1: 0.5663
 epoch: 80, train_loss: 0.8429, test_loss: 0.8704, test_f1: 0.5539
 epoch: 81, train_loss: 0.8434, test_loss: 0.8711, test_f1: 0.5666
 epoch: 82, train_loss: 0.8440, test_loss: 0.8702, test_f1: 0.5652
 epoch: 83, train_loss: 0.8426, test_loss: 0.8733, test_f1: 0.5650
 epoch: 84, train_loss: 0.8385, test_loss: 0.8736, test_f1: 0.5687
 epoch: 85, train_loss: 0.8383, test_loss: 0.8749, test_f1: 0.5687
 epoch: 86, train_loss: 0.8397, test_loss: 0.8656, test_f1: 0.5705
 epoch: 87, train_loss: 0.8321, test_loss: 0.8717, test_f1: 0.5674
 epoch: 88, train_loss: 0.8370, test_loss: 0.8726, test_f1: 0.5672
 epoch: 89, train_loss: 0.8320, test_loss: 0.8759, test_f1: 0.5613
 epoch: 90, train_loss: 0.8352, test_loss: 0.8671, test_f1: 0.5665
 epoch: 91, train_loss: 0.8365, test_loss: 0.8693, test_f1: 0.5688
 epoch: 92, train_loss: 0.8387, test_loss: 0.8716, test_f1: 0.5721
 epoch: 93, train_loss: 0.8369, test_loss: 0.8678, test_f1: 0.5700
 epoch: 94, train_loss: 0.8360, test_loss: 0.8676, test_f1: 0.5689
 epoch: 95, train_loss: 0.8305, test_loss: 0.8647, test_f1: 0.5692
 epoch: 96, train_loss: 0.8264, test_loss: 0.8680, test_f1: 0.5716
 epoch: 97, train_loss: 0.8255, test_loss: 0.8689, test_f1: 0.5709
 epoch: 98, train_loss: 0.8294, test_loss: 0.8680, test_f1: 0.5705
 epoch: 99, train_loss: 0.8271, test_loss: 0.8670, test_f1: 0.5677
##################ITERATION #9 ****************************************
 epoch: 0, train_loss: 1.3331, test_loss: 1.3179, test_f1: 0.2270
 epoch: 1, train_loss: 1.2244, test_loss: 1.2845, test_f1: 0.2270
 epoch: 2, train_loss: 1.1851, test_loss: 1.2401, test_f1: 0.2270
 epoch: 3, train_loss: 1.1490, test_loss: 1.1715, test_f1: 0.2753
 epoch: 4, train_loss: 1.1236, test_loss: 1.0981, test_f1: 0.3794
 epoch: 5, train_loss: 1.1062, test_loss: 1.0572, test_f1: 0.4317
 epoch: 6, train_loss: 1.0830, test_loss: 1.0357, test_f1: 0.4348
 epoch: 7, train_loss: 1.0749, test_loss: 1.0215, test_f1: 0.4292
 epoch: 8, train_loss: 1.0600, test_loss: 1.0110, test_f1: 0.4376
 epoch: 9, train_loss: 1.0557, test_loss: 1.0029, test_f1: 0.4396
 epoch: 10, train_loss: 1.0453, test_loss: 0.9955, test_f1: 0.4443
 epoch: 11, train_loss: 1.0331, test_loss: 0.9872, test_f1: 0.4563
 epoch: 12, train_loss: 1.0272, test_loss: 0.9817, test_f1: 0.4581
 epoch: 13, train_loss: 1.0187, test_loss: 0.9763, test_f1: 0.4647
 epoch: 14, train_loss: 1.0132, test_loss: 0.9728, test_f1: 0.4617
 epoch: 15, train_loss: 0.9973, test_loss: 0.9654, test_f1: 0.4763
 epoch: 16, train_loss: 1.0014, test_loss: 0.9607, test_f1: 0.4813
 epoch: 17, train_loss: 0.9926, test_loss: 0.9585, test_f1: 0.4769
 epoch: 18, train_loss: 0.9846, test_loss: 0.9541, test_f1: 0.4820
 epoch: 19, train_loss: 0.9791, test_loss: 0.9492, test_f1: 0.4784
 epoch: 20, train_loss: 0.9742, test_loss: 0.9492, test_f1: 0.4789
 epoch: 21, train_loss: 0.9668, test_loss: 0.9448, test_f1: 0.4822
 epoch: 22, train_loss: 0.9644, test_loss: 0.9424, test_f1: 0.4846
 epoch: 23, train_loss: 0.9662, test_loss: 0.9390, test_f1: 0.4957
 epoch: 24, train_loss: 0.9610, test_loss: 0.9349, test_f1: 0.5015
 epoch: 25, train_loss: 0.9533, test_loss: 0.9358, test_f1: 0.4898
 epoch: 26, train_loss: 0.9502, test_loss: 0.9301, test_f1: 0.5037
 epoch: 27, train_loss: 0.9496, test_loss: 0.9283, test_f1: 0.5118
 epoch: 28, train_loss: 0.9439, test_loss: 0.9254, test_f1: 0.5004
 epoch: 29, train_loss: 0.9432, test_loss: 0.9227, test_f1: 0.5121
 epoch: 30, train_loss: 0.9365, test_loss: 0.9187, test_f1: 0.5166
 epoch: 31, train_loss: 0.9341, test_loss: 0.9175, test_f1: 0.5176
 epoch: 32, train_loss: 0.9384, test_loss: 0.9157, test_f1: 0.5173
 epoch: 33, train_loss: 0.9276, test_loss: 0.9138, test_f1: 0.5237
 epoch: 34, train_loss: 0.9207, test_loss: 0.9099, test_f1: 0.5216
 epoch: 35, train_loss: 0.9278, test_loss: 0.9050, test_f1: 0.5221
 epoch: 36, train_loss: 0.9211, test_loss: 0.9067, test_f1: 0.5257
 epoch: 37, train_loss: 0.9196, test_loss: 0.9020, test_f1: 0.5251
 epoch: 38, train_loss: 0.9129, test_loss: 0.9043, test_f1: 0.5292
 epoch: 39, train_loss: 0.9062, test_loss: 0.9015, test_f1: 0.5314
 epoch: 40, train_loss: 0.9086, test_loss: 0.8992, test_f1: 0.5322
 epoch: 41, train_loss: 0.9071, test_loss: 0.8939, test_f1: 0.5275
 epoch: 42, train_loss: 0.9059, test_loss: 0.8931, test_f1: 0.5345
 epoch: 43, train_loss: 0.8957, test_loss: 0.8936, test_f1: 0.5348
 epoch: 44, train_loss: 0.8986, test_loss: 0.8901, test_f1: 0.5437
 epoch: 45, train_loss: 0.8934, test_loss: 0.8879, test_f1: 0.5417
 epoch: 46, train_loss: 0.8864, test_loss: 0.8874, test_f1: 0.5459
 epoch: 47, train_loss: 0.8878, test_loss: 0.8837, test_f1: 0.5412
 epoch: 48, train_loss: 0.8911, test_loss: 0.8821, test_f1: 0.5413
 epoch: 49, train_loss: 0.8792, test_loss: 0.8813, test_f1: 0.5438
 epoch: 50, train_loss: 0.8781, test_loss: 0.8798, test_f1: 0.5492
 epoch: 51, train_loss: 0.8707, test_loss: 0.8779, test_f1: 0.5471
 epoch: 52, train_loss: 0.8757, test_loss: 0.8787, test_f1: 0.5482
 epoch: 53, train_loss: 0.8742, test_loss: 0.8779, test_f1: 0.5493
 epoch: 54, train_loss: 0.8667, test_loss: 0.8759, test_f1: 0.5494
 epoch: 55, train_loss: 0.8706, test_loss: 0.8763, test_f1: 0.5484
 epoch: 56, train_loss: 0.8685, test_loss: 0.8749, test_f1: 0.5531
 epoch: 57, train_loss: 0.8735, test_loss: 0.8740, test_f1: 0.5544
 epoch: 58, train_loss: 0.8664, test_loss: 0.8754, test_f1: 0.5519
 epoch: 59, train_loss: 0.8683, test_loss: 0.8736, test_f1: 0.5483
 epoch: 60, train_loss: 0.8655, test_loss: 0.8723, test_f1: 0.5504
 epoch: 61, train_loss: 0.8614, test_loss: 0.8723, test_f1: 0.5532
 epoch: 62, train_loss: 0.8538, test_loss: 0.8713, test_f1: 0.5535
 epoch: 63, train_loss: 0.8540, test_loss: 0.8705, test_f1: 0.5615
 epoch: 64, train_loss: 0.8659, test_loss: 0.8716, test_f1: 0.5594
 epoch: 65, train_loss: 0.8504, test_loss: 0.8713, test_f1: 0.5617
 epoch: 66, train_loss: 0.8562, test_loss: 0.8698, test_f1: 0.5554
 epoch: 67, train_loss: 0.8536, test_loss: 0.8670, test_f1: 0.5619
 epoch: 68, train_loss: 0.8598, test_loss: 0.8688, test_f1: 0.5631
 epoch: 69, train_loss: 0.8558, test_loss: 0.8668, test_f1: 0.5506
 epoch: 70, train_loss: 0.8506, test_loss: 0.8696, test_f1: 0.5588
 epoch: 71, train_loss: 0.8534, test_loss: 0.8712, test_f1: 0.5634
 epoch: 72, train_loss: 0.8472, test_loss: 0.8690, test_f1: 0.5636
 epoch: 73, train_loss: 0.8413, test_loss: 0.8669, test_f1: 0.5612
 epoch: 74, train_loss: 0.8461, test_loss: 0.8653, test_f1: 0.5607
 epoch: 75, train_loss: 0.8560, test_loss: 0.8629, test_f1: 0.5665
 epoch: 76, train_loss: 0.8480, test_loss: 0.8638, test_f1: 0.5584
 epoch: 77, train_loss: 0.8447, test_loss: 0.8633, test_f1: 0.5623
 epoch: 78, train_loss: 0.8442, test_loss: 0.8651, test_f1: 0.5623
 epoch: 79, train_loss: 0.8411, test_loss: 0.8652, test_f1: 0.5581
 epoch: 80, train_loss: 0.8450, test_loss: 0.8635, test_f1: 0.5641
 epoch: 81, train_loss: 0.8431, test_loss: 0.8628, test_f1: 0.5642
 epoch: 82, train_loss: 0.8376, test_loss: 0.8648, test_f1: 0.5643
 epoch: 83, train_loss: 0.8329, test_loss: 0.8634, test_f1: 0.5616
 epoch: 84, train_loss: 0.8380, test_loss: 0.8647, test_f1: 0.5561
 epoch: 85, train_loss: 0.8369, test_loss: 0.8634, test_f1: 0.5590
 epoch: 86, train_loss: 0.8353, test_loss: 0.8634, test_f1: 0.5561
 epoch: 87, train_loss: 0.8282, test_loss: 0.8632, test_f1: 0.5591
 epoch: 88, train_loss: 0.8323, test_loss: 0.8611, test_f1: 0.5614
 epoch: 89, train_loss: 0.8322, test_loss: 0.8573, test_f1: 0.5612
 epoch: 90, train_loss: 0.8314, test_loss: 0.8577, test_f1: 0.5655
 epoch: 91, train_loss: 0.8335, test_loss: 0.8603, test_f1: 0.5614
 epoch: 92, train_loss: 0.8325, test_loss: 0.8591, test_f1: 0.5629
 epoch: 93, train_loss: 0.8293, test_loss: 0.8590, test_f1: 0.5559
 epoch: 94, train_loss: 0.8220, test_loss: 0.8588, test_f1: 0.5664
 epoch: 95, train_loss: 0.8228, test_loss: 0.8599, test_f1: 0.5646
 epoch: 96, train_loss: 0.8273, test_loss: 0.8587, test_f1: 0.5614
 epoch: 97, train_loss: 0.8312, test_loss: 0.8588, test_f1: 0.5594
 epoch: 98, train_loss: 0.8238, test_loss: 0.8619, test_f1: 0.5609
 epoch: 99, train_loss: 0.8194, test_loss: 0.8610, test_f1: 0.5654

Training completed in 405.43 seconds
Best F1: 0.5724 at epoch 95
Mean F1 across iterations: 0.5573  0.0131
========================FINAL RESULTS================================
FEGIN weighted F1: 0.5724  0.0131
python main.py --data ltspice_examples --representation component_pin_net --model FEGIN --layers 2 --hiddens 64 --batch_size 256 --lr 0.0001 --emb_size 512 --epochs 100 --save_appendix component_pin_net_L2_H64_BS256_LR0.0001_E512 --no_val
-----



STDERR:
  File "main.py", line 370, in <module>
    main()
  File "main.py", line 254, in main
    dataset = dataset_class(
  File "/home/philip/projects/ltspice_examples_code_repo/Circuit-Completion-Using-GNNs/component_classification_with_link_prediction_head/evaluation/FEGIN/kernel/circuit_datasets.py", line 15, in __init__
    self.data, self.slices = torch.load(self.processed_paths[0])
  File "/home/philip/.local/lib/python3.8/site-packages/torch/serialization.py", line 1040, in load
    warnings.warn(
  File "/usr/lib/python3.8/warnings.py", line 109, in _showwarnmsg
    sw(msg.message, msg.category, msg.filename, msg.lineno,
  File "main.py", line 47, in warn_with_traceback
    traceback.print_stack(file=log)
/home/philip/projects/ltspice_examples_code_repo/Circuit-Completion-Using-GNNs/component_classification_with_link_prediction_head/evaluation/FEGIN/kernel/circuit_datasets.py:15: FutureWarning: You are using `torch.load` with `weights_only=False` (the current default value), which uses the default pickle module implicitly. It is possible to construct malicious pickle data which will execute arbitrary code during unpickling (See https://github.com/pytorch/pytorch/blob/main/SECURITY.md#untrusted-models for more details). In a future release, the default value for `weights_only` will be flipped to `True`. This limits the functions that could be executed during unpickling. Arbitrary objects will no longer be allowed to be loaded via this mode unless they are explicitly allowlisted by the user via `torch.serialization.add_safe_globals`. We recommend you start setting `weights_only=True` for any use case where you don't have full control of the loaded file. Please open an issue on GitHub for any issues related to this experimental feature.
  self.data, self.slices = torch.load(self.processed_paths[0])
