STDOUT:
Results will be saved in /home/philip/projects/ltspice_examples_code_repo/Circuit-Completion-Using-GNNs/component_classification_with_link_prediction_head/evaluation/FEGIN/results/model_FEGIN_dataset_ltspice_examples
Command line input: python main.py --data ltspice_examples --representation component_net --model FEGIN --layers 4 --hiddens 128 --batch_size 256 --lr 0.001 --emb_size 128 --epochs 100 --save_appendix component_net_L4_H128_BS256_LR0.001_E128 --no_val
 is saved.
-----
ltspice_examples - FEGIN
Using 4 layers, 128 hidden units, h = 2
Loading component_net representation dataset
ENTERED
Training FEGIN on component_net representation
Train: 3558, Test: 846
##################ITERATION #0 ****************************************
 epoch: 0, train_loss: 1.2782, test_loss: 1.3299, test_f1: 0.2270
 epoch: 1, train_loss: 1.1508, test_loss: 1.2580, test_f1: 0.2741
 epoch: 2, train_loss: 1.0660, test_loss: 1.1317, test_f1: 0.4487
 epoch: 3, train_loss: 0.9786, test_loss: 1.0191, test_f1: 0.4868
 epoch: 4, train_loss: 0.9249, test_loss: 0.9357, test_f1: 0.5224
 epoch: 5, train_loss: 0.9048, test_loss: 0.9568, test_f1: 0.5013
 epoch: 6, train_loss: 0.8768, test_loss: 0.9438, test_f1: 0.4948
 epoch: 7, train_loss: 0.8449, test_loss: 0.9443, test_f1: 0.5530
 epoch: 8, train_loss: 0.8234, test_loss: 0.9352, test_f1: 0.5259
 epoch: 9, train_loss: 0.8177, test_loss: 0.8997, test_f1: 0.5495
 epoch: 10, train_loss: 0.7916, test_loss: 0.9241, test_f1: 0.5362
 epoch: 11, train_loss: 0.7912, test_loss: 0.9532, test_f1: 0.5706
 epoch: 12, train_loss: 0.7925, test_loss: 0.9751, test_f1: 0.5913
 epoch: 13, train_loss: 0.7719, test_loss: 0.9443, test_f1: 0.5847
 epoch: 14, train_loss: 0.7418, test_loss: 0.9340, test_f1: 0.5935
 epoch: 15, train_loss: 0.7376, test_loss: 0.9023, test_f1: 0.5880
 epoch: 16, train_loss: 0.7305, test_loss: 0.8957, test_f1: 0.6252
 epoch: 17, train_loss: 0.6970, test_loss: 0.8885, test_f1: 0.6184
 epoch: 18, train_loss: 0.6933, test_loss: 0.9351, test_f1: 0.6161
 epoch: 19, train_loss: 0.6744, test_loss: 0.9158, test_f1: 0.6030
 epoch: 20, train_loss: 0.6738, test_loss: 0.8536, test_f1: 0.6597
 epoch: 21, train_loss: 0.6535, test_loss: 0.9746, test_f1: 0.5978
 epoch: 22, train_loss: 0.6488, test_loss: 0.9024, test_f1: 0.6403
 epoch: 23, train_loss: 0.6287, test_loss: 0.9559, test_f1: 0.5976
 epoch: 24, train_loss: 0.6034, test_loss: 0.9547, test_f1: 0.6162
 epoch: 25, train_loss: 0.5898, test_loss: 1.0435, test_f1: 0.6106
 epoch: 26, train_loss: 0.5859, test_loss: 0.9572, test_f1: 0.6200
 epoch: 27, train_loss: 0.5660, test_loss: 1.0036, test_f1: 0.6275
 epoch: 28, train_loss: 0.5308, test_loss: 0.9548, test_f1: 0.6129
 epoch: 29, train_loss: 0.5597, test_loss: 0.9291, test_f1: 0.6298
 epoch: 30, train_loss: 0.5551, test_loss: 0.9390, test_f1: 0.6078
 epoch: 31, train_loss: 0.5373, test_loss: 1.0539, test_f1: 0.6115
 epoch: 32, train_loss: 0.5153, test_loss: 0.9741, test_f1: 0.6212
 epoch: 33, train_loss: 0.4905, test_loss: 0.9871, test_f1: 0.6507
 epoch: 34, train_loss: 0.4902, test_loss: 1.0720, test_f1: 0.6068
 epoch: 35, train_loss: 0.5007, test_loss: 1.0949, test_f1: 0.5908
 epoch: 36, train_loss: 0.5085, test_loss: 1.0579, test_f1: 0.6265
 epoch: 37, train_loss: 0.4423, test_loss: 1.0925, test_f1: 0.6109
 epoch: 38, train_loss: 0.4356, test_loss: 1.0847, test_f1: 0.6236
 epoch: 39, train_loss: 0.4544, test_loss: 1.1013, test_f1: 0.6396
 epoch: 40, train_loss: 0.4300, test_loss: 1.0273, test_f1: 0.6319
 epoch: 41, train_loss: 0.4199, test_loss: 1.2185, test_f1: 0.5935
 epoch: 42, train_loss: 0.4067, test_loss: 1.1875, test_f1: 0.6345
 epoch: 43, train_loss: 0.4276, test_loss: 1.1492, test_f1: 0.6558
 epoch: 44, train_loss: 0.4007, test_loss: 1.1392, test_f1: 0.6003
 epoch: 45, train_loss: 0.3842, test_loss: 1.1460, test_f1: 0.6232
 epoch: 46, train_loss: 0.3835, test_loss: 1.2030, test_f1: 0.6319
 epoch: 47, train_loss: 0.3756, test_loss: 1.2648, test_f1: 0.6241
 epoch: 48, train_loss: 0.3475, test_loss: 1.1716, test_f1: 0.6667
 epoch: 49, train_loss: 0.3358, test_loss: 1.2591, test_f1: 0.6186
 epoch: 50, train_loss: 0.3519, test_loss: 1.3917, test_f1: 0.6331
 epoch: 51, train_loss: 0.2960, test_loss: 1.3383, test_f1: 0.6345
 epoch: 52, train_loss: 0.2869, test_loss: 1.3143, test_f1: 0.6485
 epoch: 53, train_loss: 0.2790, test_loss: 1.4050, test_f1: 0.6568
 epoch: 54, train_loss: 0.2589, test_loss: 1.4694, test_f1: 0.6455
 epoch: 55, train_loss: 0.2570, test_loss: 1.4735, test_f1: 0.6395
 epoch: 56, train_loss: 0.2574, test_loss: 1.4535, test_f1: 0.6133
 epoch: 57, train_loss: 0.2429, test_loss: 1.4938, test_f1: 0.6644
 epoch: 58, train_loss: 0.2324, test_loss: 1.5691, test_f1: 0.6341
 epoch: 59, train_loss: 0.2450, test_loss: 1.5833, test_f1: 0.6433
 epoch: 60, train_loss: 0.2341, test_loss: 1.5546, test_f1: 0.6401
 epoch: 61, train_loss: 0.2097, test_loss: 1.6488, test_f1: 0.6433
 epoch: 62, train_loss: 0.2324, test_loss: 1.6016, test_f1: 0.6220
 epoch: 63, train_loss: 0.2181, test_loss: 1.9190, test_f1: 0.6299
 epoch: 64, train_loss: 0.2298, test_loss: 1.8326, test_f1: 0.6407
 epoch: 65, train_loss: 0.2257, test_loss: 1.7426, test_f1: 0.6255
 epoch: 66, train_loss: 0.2185, test_loss: 1.6743, test_f1: 0.6557
 epoch: 67, train_loss: 0.2088, test_loss: 1.7692, test_f1: 0.6291
 epoch: 68, train_loss: 0.2034, test_loss: 1.6654, test_f1: 0.6251
 epoch: 69, train_loss: 0.1953, test_loss: 1.8942, test_f1: 0.6537
 epoch: 70, train_loss: 0.1950, test_loss: 1.8271, test_f1: 0.6439
 epoch: 71, train_loss: 0.1961, test_loss: 1.9449, test_f1: 0.6254
 epoch: 72, train_loss: 0.1844, test_loss: 1.9909, test_f1: 0.6418
 epoch: 73, train_loss: 0.1925, test_loss: 1.9594, test_f1: 0.6267
 epoch: 74, train_loss: 0.1863, test_loss: 1.9294, test_f1: 0.6106
 epoch: 75, train_loss: 0.1730, test_loss: 2.0455, test_f1: 0.6256
 epoch: 76, train_loss: 0.1743, test_loss: 1.9522, test_f1: 0.6238
 epoch: 77, train_loss: 0.1845, test_loss: 1.9222, test_f1: 0.6326
 epoch: 78, train_loss: 0.1904, test_loss: 2.0884, test_f1: 0.6082
 epoch: 79, train_loss: 0.1781, test_loss: 1.9307, test_f1: 0.6449
 epoch: 80, train_loss: 0.1833, test_loss: 1.9730, test_f1: 0.6365
 epoch: 81, train_loss: 0.1683, test_loss: 2.0588, test_f1: 0.6204
 epoch: 82, train_loss: 0.1731, test_loss: 2.2058, test_f1: 0.6179
 epoch: 83, train_loss: 0.1692, test_loss: 2.0392, test_f1: 0.6305
 epoch: 84, train_loss: 0.1862, test_loss: 2.2636, test_f1: 0.6133
 epoch: 85, train_loss: 0.2016, test_loss: 2.2741, test_f1: 0.6191
 epoch: 86, train_loss: 0.1807, test_loss: 2.1952, test_f1: 0.6302
 epoch: 87, train_loss: 0.1573, test_loss: 1.9055, test_f1: 0.6675
 epoch: 88, train_loss: 0.1579, test_loss: 2.1509, test_f1: 0.6298
 epoch: 89, train_loss: 0.1513, test_loss: 2.3825, test_f1: 0.6153
 epoch: 90, train_loss: 0.1613, test_loss: 2.3335, test_f1: 0.6388
 epoch: 91, train_loss: 0.1729, test_loss: 2.2024, test_f1: 0.6182
 epoch: 92, train_loss: 0.1755, test_loss: 2.3665, test_f1: 0.6272
 epoch: 93, train_loss: 0.1782, test_loss: 2.1944, test_f1: 0.6117
 epoch: 94, train_loss: 0.1707, test_loss: 2.0832, test_f1: 0.6337
 epoch: 95, train_loss: 0.1659, test_loss: 2.1794, test_f1: 0.6205
 epoch: 96, train_loss: 0.1497, test_loss: 2.5430, test_f1: 0.6187
 epoch: 97, train_loss: 0.1565, test_loss: 2.2529, test_f1: 0.6490
 epoch: 98, train_loss: 0.1543, test_loss: 2.5764, test_f1: 0.6175
 epoch: 99, train_loss: 0.1493, test_loss: 2.3014, test_f1: 0.6223
##################ITERATION #1 ****************************************
 epoch: 0, train_loss: 1.1610, test_loss: 1.2490, test_f1: 0.2270
 epoch: 1, train_loss: 1.0021, test_loss: 1.1268, test_f1: 0.3436
 epoch: 2, train_loss: 0.9370, test_loss: 1.0225, test_f1: 0.4148
 epoch: 3, train_loss: 0.8983, test_loss: 0.9424, test_f1: 0.5327
 epoch: 4, train_loss: 0.8690, test_loss: 1.0294, test_f1: 0.4939
 epoch: 5, train_loss: 0.8677, test_loss: 0.9748, test_f1: 0.4849
 epoch: 6, train_loss: 0.8362, test_loss: 0.8700, test_f1: 0.6048
 epoch: 7, train_loss: 0.8185, test_loss: 0.9161, test_f1: 0.5574
 epoch: 8, train_loss: 0.7911, test_loss: 1.0006, test_f1: 0.5637
 epoch: 9, train_loss: 0.7803, test_loss: 0.9101, test_f1: 0.5845
 epoch: 10, train_loss: 0.7595, test_loss: 0.9442, test_f1: 0.5795
 epoch: 11, train_loss: 0.7342, test_loss: 0.9366, test_f1: 0.5368
 epoch: 12, train_loss: 0.7295, test_loss: 0.8947, test_f1: 0.5735
 epoch: 13, train_loss: 0.7145, test_loss: 0.9490, test_f1: 0.5974
 epoch: 14, train_loss: 0.7103, test_loss: 1.1080, test_f1: 0.4966
 epoch: 15, train_loss: 0.6863, test_loss: 0.9766, test_f1: 0.5800
 epoch: 16, train_loss: 0.6796, test_loss: 0.9388, test_f1: 0.6073
 epoch: 17, train_loss: 0.6745, test_loss: 0.9761, test_f1: 0.5863
 epoch: 18, train_loss: 0.6539, test_loss: 0.9184, test_f1: 0.6134
 epoch: 19, train_loss: 0.6299, test_loss: 0.9702, test_f1: 0.6082
 epoch: 20, train_loss: 0.6260, test_loss: 1.0242, test_f1: 0.5755
 epoch: 21, train_loss: 0.6103, test_loss: 0.9988, test_f1: 0.5797
 epoch: 22, train_loss: 0.5942, test_loss: 0.9725, test_f1: 0.6298
 epoch: 23, train_loss: 0.6046, test_loss: 0.9784, test_f1: 0.6182
 epoch: 24, train_loss: 0.5845, test_loss: 0.9704, test_f1: 0.6066
 epoch: 25, train_loss: 0.5625, test_loss: 0.9855, test_f1: 0.6301
 epoch: 26, train_loss: 0.5658, test_loss: 0.9957, test_f1: 0.6226
 epoch: 27, train_loss: 0.5231, test_loss: 1.0359, test_f1: 0.6251
 epoch: 28, train_loss: 0.5470, test_loss: 1.0354, test_f1: 0.6022
 epoch: 29, train_loss: 0.5244, test_loss: 1.0537, test_f1: 0.5778
 epoch: 30, train_loss: 0.5022, test_loss: 0.9976, test_f1: 0.6236
 epoch: 31, train_loss: 0.4685, test_loss: 1.0299, test_f1: 0.6447
 epoch: 32, train_loss: 0.4685, test_loss: 1.0927, test_f1: 0.6377
 epoch: 33, train_loss: 0.4519, test_loss: 1.4298, test_f1: 0.5718
 epoch: 34, train_loss: 0.4549, test_loss: 1.1850, test_f1: 0.6079
 epoch: 35, train_loss: 0.4657, test_loss: 1.3801, test_f1: 0.5909
 epoch: 36, train_loss: 0.4414, test_loss: 1.1937, test_f1: 0.6343
 epoch: 37, train_loss: 0.4145, test_loss: 1.2305, test_f1: 0.6511
 epoch: 38, train_loss: 0.4028, test_loss: 1.2125, test_f1: 0.6014
 epoch: 39, train_loss: 0.4174, test_loss: 1.1089, test_f1: 0.6322
 epoch: 40, train_loss: 0.4142, test_loss: 1.2409, test_f1: 0.6037
 epoch: 41, train_loss: 0.4017, test_loss: 1.2328, test_f1: 0.6279
 epoch: 42, train_loss: 0.3871, test_loss: 1.1946, test_f1: 0.6468
 epoch: 43, train_loss: 0.3804, test_loss: 1.2492, test_f1: 0.6186
 epoch: 44, train_loss: 0.3816, test_loss: 1.3260, test_f1: 0.5935
 epoch: 45, train_loss: 0.3533, test_loss: 1.1788, test_f1: 0.6524
 epoch: 46, train_loss: 0.3444, test_loss: 1.2851, test_f1: 0.6596
 epoch: 47, train_loss: 0.3469, test_loss: 1.3073, test_f1: 0.6424
 epoch: 48, train_loss: 0.3402, test_loss: 1.2830, test_f1: 0.6456
 epoch: 49, train_loss: 0.3215, test_loss: 1.3270, test_f1: 0.6661
 epoch: 50, train_loss: 0.3047, test_loss: 1.4124, test_f1: 0.6549
 epoch: 51, train_loss: 0.2803, test_loss: 1.4224, test_f1: 0.6457
 epoch: 52, train_loss: 0.2482, test_loss: 1.5030, test_f1: 0.6505
 epoch: 53, train_loss: 0.2419, test_loss: 1.4364, test_f1: 0.6451
 epoch: 54, train_loss: 0.2401, test_loss: 1.5720, test_f1: 0.6349
 epoch: 55, train_loss: 0.2252, test_loss: 1.5962, test_f1: 0.6478
 epoch: 56, train_loss: 0.2232, test_loss: 1.5728, test_f1: 0.6706
 epoch: 57, train_loss: 0.2077, test_loss: 1.6486, test_f1: 0.6491
 epoch: 58, train_loss: 0.2227, test_loss: 1.7708, test_f1: 0.6133
 epoch: 59, train_loss: 0.2113, test_loss: 1.6056, test_f1: 0.6574
 epoch: 60, train_loss: 0.2135, test_loss: 1.6899, test_f1: 0.6500
 epoch: 61, train_loss: 0.1995, test_loss: 1.7086, test_f1: 0.6378
 epoch: 62, train_loss: 0.2010, test_loss: 1.9388, test_f1: 0.5981
 epoch: 63, train_loss: 0.2128, test_loss: 1.7894, test_f1: 0.6330
 epoch: 64, train_loss: 0.2018, test_loss: 1.6060, test_f1: 0.6825
 epoch: 65, train_loss: 0.2070, test_loss: 1.8374, test_f1: 0.5719
 epoch: 66, train_loss: 0.2024, test_loss: 1.8522, test_f1: 0.6479
 epoch: 67, train_loss: 0.2048, test_loss: 1.8070, test_f1: 0.6456
 epoch: 68, train_loss: 0.1882, test_loss: 1.8957, test_f1: 0.6338
 epoch: 69, train_loss: 0.1857, test_loss: 1.8773, test_f1: 0.6446
 epoch: 70, train_loss: 0.2070, test_loss: 1.8155, test_f1: 0.6488
 epoch: 71, train_loss: 0.2080, test_loss: 1.9719, test_f1: 0.6253
 epoch: 72, train_loss: 0.1828, test_loss: 1.8403, test_f1: 0.6285
 epoch: 73, train_loss: 0.1763, test_loss: 1.9535, test_f1: 0.6390
 epoch: 74, train_loss: 0.1907, test_loss: 2.0820, test_f1: 0.6220
 epoch: 75, train_loss: 0.1761, test_loss: 2.0427, test_f1: 0.6154
 epoch: 76, train_loss: 0.1708, test_loss: 1.8691, test_f1: 0.6258
 epoch: 77, train_loss: 0.1636, test_loss: 2.0566, test_f1: 0.6216
 epoch: 78, train_loss: 0.1634, test_loss: 2.1704, test_f1: 0.6396
 epoch: 79, train_loss: 0.1633, test_loss: 2.1648, test_f1: 0.6107
 epoch: 80, train_loss: 0.1777, test_loss: 1.9887, test_f1: 0.6730
 epoch: 81, train_loss: 0.1677, test_loss: 2.0259, test_f1: 0.6249
 epoch: 82, train_loss: 0.1569, test_loss: 2.0806, test_f1: 0.6284
 epoch: 83, train_loss: 0.1537, test_loss: 2.3845, test_f1: 0.6045
 epoch: 84, train_loss: 0.1621, test_loss: 2.1781, test_f1: 0.6230
 epoch: 85, train_loss: 0.1483, test_loss: 2.2698, test_f1: 0.6308
 epoch: 86, train_loss: 0.1619, test_loss: 2.2248, test_f1: 0.6325
 epoch: 87, train_loss: 0.1460, test_loss: 2.0955, test_f1: 0.6288
 epoch: 88, train_loss: 0.1410, test_loss: 2.1044, test_f1: 0.6377
 epoch: 89, train_loss: 0.1563, test_loss: 2.1741, test_f1: 0.6263
 epoch: 90, train_loss: 0.1409, test_loss: 2.4007, test_f1: 0.6029
 epoch: 91, train_loss: 0.1442, test_loss: 2.3652, test_f1: 0.6159
 epoch: 92, train_loss: 0.1386, test_loss: 2.3808, test_f1: 0.6052
 epoch: 93, train_loss: 0.1529, test_loss: 2.4589, test_f1: 0.6359
 epoch: 94, train_loss: 0.1437, test_loss: 2.1774, test_f1: 0.6531
 epoch: 95, train_loss: 0.1407, test_loss: 2.2656, test_f1: 0.6165
 epoch: 96, train_loss: 0.1411, test_loss: 2.6274, test_f1: 0.6245
 epoch: 97, train_loss: 0.1321, test_loss: 2.6174, test_f1: 0.6192
 epoch: 98, train_loss: 0.1309, test_loss: 2.5205, test_f1: 0.6128
 epoch: 99, train_loss: 0.1263, test_loss: 2.6357, test_f1: 0.6018
##################ITERATION #2 ****************************************
 epoch: 0, train_loss: 1.2052, test_loss: 1.2489, test_f1: 0.3287
 epoch: 1, train_loss: 1.0325, test_loss: 1.1390, test_f1: 0.3404
 epoch: 2, train_loss: 0.9585, test_loss: 1.0401, test_f1: 0.4014
 epoch: 3, train_loss: 0.9131, test_loss: 0.9723, test_f1: 0.4798
 epoch: 4, train_loss: 0.8880, test_loss: 0.9201, test_f1: 0.5276
 epoch: 5, train_loss: 0.8609, test_loss: 0.9208, test_f1: 0.5733
 epoch: 6, train_loss: 0.8292, test_loss: 0.9171, test_f1: 0.5808
 epoch: 7, train_loss: 0.8245, test_loss: 0.9266, test_f1: 0.5696
 epoch: 8, train_loss: 0.8041, test_loss: 0.9937, test_f1: 0.5166
 epoch: 9, train_loss: 0.7934, test_loss: 0.9840, test_f1: 0.5618
 epoch: 10, train_loss: 0.7784, test_loss: 1.0119, test_f1: 0.5527
 epoch: 11, train_loss: 0.7679, test_loss: 0.9558, test_f1: 0.5664
 epoch: 12, train_loss: 0.7498, test_loss: 0.9826, test_f1: 0.5820
 epoch: 13, train_loss: 0.7509, test_loss: 0.9785, test_f1: 0.4963
 epoch: 14, train_loss: 0.7329, test_loss: 0.9914, test_f1: 0.5774
 epoch: 15, train_loss: 0.7096, test_loss: 0.9528, test_f1: 0.5708
 epoch: 16, train_loss: 0.6940, test_loss: 0.9165, test_f1: 0.6190
 epoch: 17, train_loss: 0.6832, test_loss: 0.9822, test_f1: 0.5846
 epoch: 18, train_loss: 0.6947, test_loss: 0.9414, test_f1: 0.5851
 epoch: 19, train_loss: 0.6802, test_loss: 0.9972, test_f1: 0.5751
 epoch: 20, train_loss: 0.6430, test_loss: 1.0595, test_f1: 0.5292
 epoch: 21, train_loss: 0.6356, test_loss: 0.9735, test_f1: 0.6169
 epoch: 22, train_loss: 0.6268, test_loss: 0.9434, test_f1: 0.6329
 epoch: 23, train_loss: 0.5874, test_loss: 0.9470, test_f1: 0.6584
 epoch: 24, train_loss: 0.6194, test_loss: 0.9711, test_f1: 0.6221
 epoch: 25, train_loss: 0.6078, test_loss: 0.9680, test_f1: 0.6395
 epoch: 26, train_loss: 0.6084, test_loss: 0.9707, test_f1: 0.5956
 epoch: 27, train_loss: 0.5600, test_loss: 0.9496, test_f1: 0.6452
 epoch: 28, train_loss: 0.5454, test_loss: 1.0036, test_f1: 0.6338
 epoch: 29, train_loss: 0.5362, test_loss: 1.0103, test_f1: 0.6526
 epoch: 30, train_loss: 0.5210, test_loss: 1.1043, test_f1: 0.6371
 epoch: 31, train_loss: 0.5379, test_loss: 1.3884, test_f1: 0.5572
 epoch: 32, train_loss: 0.5165, test_loss: 1.1106, test_f1: 0.6544
 epoch: 33, train_loss: 0.5109, test_loss: 1.1535, test_f1: 0.6250
 epoch: 34, train_loss: 0.5161, test_loss: 1.1438, test_f1: 0.6035
 epoch: 35, train_loss: 0.4876, test_loss: 1.0754, test_f1: 0.6452
 epoch: 36, train_loss: 0.4779, test_loss: 1.2096, test_f1: 0.6533
 epoch: 37, train_loss: 0.4828, test_loss: 1.1276, test_f1: 0.6133
 epoch: 38, train_loss: 0.4722, test_loss: 1.1374, test_f1: 0.6382
 epoch: 39, train_loss: 0.4565, test_loss: 1.1948, test_f1: 0.6045
 epoch: 40, train_loss: 0.4343, test_loss: 1.2379, test_f1: 0.6142
 epoch: 41, train_loss: 0.4430, test_loss: 1.1587, test_f1: 0.6455
 epoch: 42, train_loss: 0.4143, test_loss: 1.2686, test_f1: 0.6396
 epoch: 43, train_loss: 0.3996, test_loss: 1.2451, test_f1: 0.6257
 epoch: 44, train_loss: 0.4015, test_loss: 1.3119, test_f1: 0.6122
 epoch: 45, train_loss: 0.4138, test_loss: 1.4056, test_f1: 0.6283
 epoch: 46, train_loss: 0.3998, test_loss: 1.4008, test_f1: 0.6382
 epoch: 47, train_loss: 0.3575, test_loss: 1.3047, test_f1: 0.6505
 epoch: 48, train_loss: 0.3717, test_loss: 1.3980, test_f1: 0.6205
 epoch: 49, train_loss: 0.3736, test_loss: 1.2283, test_f1: 0.6585
 epoch: 50, train_loss: 0.3616, test_loss: 1.4069, test_f1: 0.6307
 epoch: 51, train_loss: 0.3379, test_loss: 1.2967, test_f1: 0.6487
 epoch: 52, train_loss: 0.3008, test_loss: 1.4283, test_f1: 0.6361
 epoch: 53, train_loss: 0.2716, test_loss: 1.3891, test_f1: 0.6379
 epoch: 54, train_loss: 0.2629, test_loss: 1.5542, test_f1: 0.6316
 epoch: 55, train_loss: 0.2576, test_loss: 1.5423, test_f1: 0.6241
 epoch: 56, train_loss: 0.2506, test_loss: 1.4774, test_f1: 0.6233
 epoch: 57, train_loss: 0.2411, test_loss: 1.6686, test_f1: 0.6145
 epoch: 58, train_loss: 0.2403, test_loss: 1.5425, test_f1: 0.6278
 epoch: 59, train_loss: 0.2485, test_loss: 1.5844, test_f1: 0.6265
 epoch: 60, train_loss: 0.2347, test_loss: 1.6408, test_f1: 0.6328
 epoch: 61, train_loss: 0.2496, test_loss: 1.5719, test_f1: 0.6576
 epoch: 62, train_loss: 0.2331, test_loss: 1.6040, test_f1: 0.6212
 epoch: 63, train_loss: 0.2215, test_loss: 1.5923, test_f1: 0.6349
 epoch: 64, train_loss: 0.2165, test_loss: 1.7286, test_f1: 0.6463
 epoch: 65, train_loss: 0.2509, test_loss: 1.7716, test_f1: 0.6227
 epoch: 66, train_loss: 0.2244, test_loss: 1.7261, test_f1: 0.6306
 epoch: 67, train_loss: 0.2303, test_loss: 1.5839, test_f1: 0.6377
 epoch: 68, train_loss: 0.2292, test_loss: 1.6745, test_f1: 0.6286
 epoch: 69, train_loss: 0.2066, test_loss: 1.7061, test_f1: 0.6213
 epoch: 70, train_loss: 0.2052, test_loss: 1.7312, test_f1: 0.6538
 epoch: 71, train_loss: 0.1929, test_loss: 1.7796, test_f1: 0.6189
 epoch: 72, train_loss: 0.1944, test_loss: 1.9052, test_f1: 0.6240
 epoch: 73, train_loss: 0.1898, test_loss: 1.8442, test_f1: 0.6200
 epoch: 74, train_loss: 0.1977, test_loss: 1.8969, test_f1: 0.6317
 epoch: 75, train_loss: 0.1892, test_loss: 1.7619, test_f1: 0.6102
 epoch: 76, train_loss: 0.1821, test_loss: 1.6799, test_f1: 0.6257
 epoch: 77, train_loss: 0.1768, test_loss: 1.9174, test_f1: 0.6123
 epoch: 78, train_loss: 0.1666, test_loss: 1.7836, test_f1: 0.6559
 epoch: 79, train_loss: 0.1777, test_loss: 1.9754, test_f1: 0.6288
 epoch: 80, train_loss: 0.1903, test_loss: 1.8501, test_f1: 0.6355
 epoch: 81, train_loss: 0.1851, test_loss: 1.8929, test_f1: 0.6256
 epoch: 82, train_loss: 0.1705, test_loss: 2.0591, test_f1: 0.6164
 epoch: 83, train_loss: 0.1852, test_loss: 1.8845, test_f1: 0.6372
 epoch: 84, train_loss: 0.1904, test_loss: 2.1782, test_f1: 0.6216
 epoch: 85, train_loss: 0.1829, test_loss: 1.8718, test_f1: 0.6357
 epoch: 86, train_loss: 0.1794, test_loss: 2.1086, test_f1: 0.6220
 epoch: 87, train_loss: 0.1859, test_loss: 1.9653, test_f1: 0.6202
 epoch: 88, train_loss: 0.1933, test_loss: 2.0201, test_f1: 0.6007
 epoch: 89, train_loss: 0.1706, test_loss: 1.8396, test_f1: 0.6310
 epoch: 90, train_loss: 0.1686, test_loss: 1.9732, test_f1: 0.6465
 epoch: 91, train_loss: 0.1434, test_loss: 1.9252, test_f1: 0.6413
 epoch: 92, train_loss: 0.1498, test_loss: 2.2157, test_f1: 0.6056
 epoch: 93, train_loss: 0.1538, test_loss: 2.0817, test_f1: 0.6255
 epoch: 94, train_loss: 0.1643, test_loss: 2.0917, test_f1: 0.6288
 epoch: 95, train_loss: 0.1482, test_loss: 2.2526, test_f1: 0.6443
 epoch: 96, train_loss: 0.1498, test_loss: 2.1355, test_f1: 0.6227
 epoch: 97, train_loss: 0.1611, test_loss: 2.0688, test_f1: 0.6395
 epoch: 98, train_loss: 0.1693, test_loss: 2.1345, test_f1: 0.6262
 epoch: 99, train_loss: 0.1583, test_loss: 2.2954, test_f1: 0.6218
##################ITERATION #3 ****************************************
 epoch: 0, train_loss: 1.2845, test_loss: 1.2478, test_f1: 0.2819
 epoch: 1, train_loss: 1.0188, test_loss: 1.1236, test_f1: 0.3707
 epoch: 2, train_loss: 0.9554, test_loss: 1.0030, test_f1: 0.4207
 epoch: 3, train_loss: 0.9175, test_loss: 0.9157, test_f1: 0.4715
 epoch: 4, train_loss: 0.8716, test_loss: 0.9171, test_f1: 0.5637
 epoch: 5, train_loss: 0.8438, test_loss: 0.9068, test_f1: 0.5099
 epoch: 6, train_loss: 0.8307, test_loss: 0.9959, test_f1: 0.5152
 epoch: 7, train_loss: 0.8279, test_loss: 0.8862, test_f1: 0.5513
 epoch: 8, train_loss: 0.8134, test_loss: 0.9739, test_f1: 0.5491
 epoch: 9, train_loss: 0.7964, test_loss: 0.9284, test_f1: 0.5764
 epoch: 10, train_loss: 0.7664, test_loss: 0.8644, test_f1: 0.5718
 epoch: 11, train_loss: 0.7614, test_loss: 0.9761, test_f1: 0.6017
 epoch: 12, train_loss: 0.7542, test_loss: 0.9116, test_f1: 0.5773
 epoch: 13, train_loss: 0.7447, test_loss: 0.8753, test_f1: 0.5922
 epoch: 14, train_loss: 0.7073, test_loss: 0.9006, test_f1: 0.6568
 epoch: 15, train_loss: 0.7157, test_loss: 0.9363, test_f1: 0.6181
 epoch: 16, train_loss: 0.6844, test_loss: 1.0461, test_f1: 0.5493
 epoch: 17, train_loss: 0.6761, test_loss: 0.9728, test_f1: 0.5984
 epoch: 18, train_loss: 0.6600, test_loss: 0.9938, test_f1: 0.5876
 epoch: 19, train_loss: 0.6363, test_loss: 0.9340, test_f1: 0.6152
 epoch: 20, train_loss: 0.6428, test_loss: 0.8943, test_f1: 0.6100
 epoch: 21, train_loss: 0.6427, test_loss: 0.9841, test_f1: 0.6307
 epoch: 22, train_loss: 0.6237, test_loss: 0.9635, test_f1: 0.5830
 epoch: 23, train_loss: 0.6122, test_loss: 1.0303, test_f1: 0.5983
 epoch: 24, train_loss: 0.5949, test_loss: 0.9644, test_f1: 0.6631
 epoch: 25, train_loss: 0.5717, test_loss: 1.0107, test_f1: 0.6104
 epoch: 26, train_loss: 0.5609, test_loss: 0.9988, test_f1: 0.6370
 epoch: 27, train_loss: 0.5461, test_loss: 1.0619, test_f1: 0.6044
 epoch: 28, train_loss: 0.5526, test_loss: 1.1799, test_f1: 0.5981
 epoch: 29, train_loss: 0.5377, test_loss: 1.0350, test_f1: 0.6655
 epoch: 30, train_loss: 0.5111, test_loss: 1.0559, test_f1: 0.6357
 epoch: 31, train_loss: 0.5093, test_loss: 1.1109, test_f1: 0.6259
 epoch: 32, train_loss: 0.4866, test_loss: 1.0996, test_f1: 0.6411
 epoch: 33, train_loss: 0.4727, test_loss: 1.1033, test_f1: 0.6311
 epoch: 34, train_loss: 0.4842, test_loss: 1.1415, test_f1: 0.6199
 epoch: 35, train_loss: 0.4651, test_loss: 1.1615, test_f1: 0.6173
 epoch: 36, train_loss: 0.4621, test_loss: 1.2917, test_f1: 0.6090
 epoch: 37, train_loss: 0.4687, test_loss: 1.3499, test_f1: 0.5890
 epoch: 38, train_loss: 0.4643, test_loss: 1.4432, test_f1: 0.5944
 epoch: 39, train_loss: 0.4440, test_loss: 1.2022, test_f1: 0.6542
 epoch: 40, train_loss: 0.4320, test_loss: 1.1861, test_f1: 0.6371
 epoch: 41, train_loss: 0.4278, test_loss: 1.1228, test_f1: 0.6899
 epoch: 42, train_loss: 0.3900, test_loss: 1.2665, test_f1: 0.6448
 epoch: 43, train_loss: 0.3958, test_loss: 1.4158, test_f1: 0.6252
 epoch: 44, train_loss: 0.3902, test_loss: 1.3548, test_f1: 0.6446
 epoch: 45, train_loss: 0.3769, test_loss: 1.3542, test_f1: 0.6368
 epoch: 46, train_loss: 0.3624, test_loss: 1.3799, test_f1: 0.6909
 epoch: 47, train_loss: 0.3647, test_loss: 1.4418, test_f1: 0.6301
 epoch: 48, train_loss: 0.3620, test_loss: 1.5358, test_f1: 0.6268
 epoch: 49, train_loss: 0.3640, test_loss: 1.4132, test_f1: 0.6135
 epoch: 50, train_loss: 0.3547, test_loss: 1.3509, test_f1: 0.6206
 epoch: 51, train_loss: 0.3301, test_loss: 1.3089, test_f1: 0.6854
 epoch: 52, train_loss: 0.2900, test_loss: 1.3783, test_f1: 0.6423
 epoch: 53, train_loss: 0.2792, test_loss: 1.4762, test_f1: 0.6383
 epoch: 54, train_loss: 0.2690, test_loss: 1.4871, test_f1: 0.6741
 epoch: 55, train_loss: 0.2507, test_loss: 1.5566, test_f1: 0.6678
 epoch: 56, train_loss: 0.2501, test_loss: 1.5603, test_f1: 0.6592
 epoch: 57, train_loss: 0.2381, test_loss: 1.5852, test_f1: 0.6674
 epoch: 58, train_loss: 0.2319, test_loss: 1.7722, test_f1: 0.6244
 epoch: 59, train_loss: 0.2349, test_loss: 1.8335, test_f1: 0.5968
 epoch: 60, train_loss: 0.2397, test_loss: 1.6609, test_f1: 0.6581
 epoch: 61, train_loss: 0.2220, test_loss: 1.7221, test_f1: 0.6446
 epoch: 62, train_loss: 0.2352, test_loss: 1.7619, test_f1: 0.6659
 epoch: 63, train_loss: 0.2309, test_loss: 1.7370, test_f1: 0.6431
 epoch: 64, train_loss: 0.2327, test_loss: 1.7289, test_f1: 0.6464
 epoch: 65, train_loss: 0.2120, test_loss: 1.8690, test_f1: 0.6197
 epoch: 66, train_loss: 0.2103, test_loss: 1.7977, test_f1: 0.6569
 epoch: 67, train_loss: 0.2197, test_loss: 1.7762, test_f1: 0.6695
 epoch: 68, train_loss: 0.2406, test_loss: 1.8696, test_f1: 0.6370
 epoch: 69, train_loss: 0.1938, test_loss: 1.9518, test_f1: 0.6541
 epoch: 70, train_loss: 0.2077, test_loss: 1.8692, test_f1: 0.6495
 epoch: 71, train_loss: 0.1960, test_loss: 1.9692, test_f1: 0.6135
 epoch: 72, train_loss: 0.1928, test_loss: 1.9347, test_f1: 0.6298
 epoch: 73, train_loss: 0.1995, test_loss: 2.0322, test_f1: 0.6622
 epoch: 74, train_loss: 0.1981, test_loss: 1.8791, test_f1: 0.6578
 epoch: 75, train_loss: 0.2060, test_loss: 2.0463, test_f1: 0.6331
 epoch: 76, train_loss: 0.1894, test_loss: 1.9383, test_f1: 0.6576
 epoch: 77, train_loss: 0.1780, test_loss: 2.0939, test_f1: 0.6404
 epoch: 78, train_loss: 0.1820, test_loss: 1.9617, test_f1: 0.6316
 epoch: 79, train_loss: 0.2048, test_loss: 2.1458, test_f1: 0.6075
 epoch: 80, train_loss: 0.1900, test_loss: 1.9699, test_f1: 0.6633
 epoch: 81, train_loss: 0.1877, test_loss: 1.8893, test_f1: 0.6640
 epoch: 82, train_loss: 0.2018, test_loss: 2.1397, test_f1: 0.6311
 epoch: 83, train_loss: 0.1858, test_loss: 2.1140, test_f1: 0.6176
 epoch: 84, train_loss: 0.1835, test_loss: 2.1612, test_f1: 0.6228
 epoch: 85, train_loss: 0.1654, test_loss: 2.1252, test_f1: 0.6513
 epoch: 86, train_loss: 0.1493, test_loss: 2.2621, test_f1: 0.6256
 epoch: 87, train_loss: 0.1606, test_loss: 2.1563, test_f1: 0.6435
 epoch: 88, train_loss: 0.1729, test_loss: 2.2328, test_f1: 0.6422
 epoch: 89, train_loss: 0.1749, test_loss: 2.3943, test_f1: 0.6336
 epoch: 90, train_loss: 0.1596, test_loss: 2.1158, test_f1: 0.6310
 epoch: 91, train_loss: 0.1778, test_loss: 2.2269, test_f1: 0.6745
 epoch: 92, train_loss: 0.1703, test_loss: 2.2554, test_f1: 0.6468
 epoch: 93, train_loss: 0.1593, test_loss: 2.2886, test_f1: 0.6273
 epoch: 94, train_loss: 0.1629, test_loss: 2.2918, test_f1: 0.6218
 epoch: 95, train_loss: 0.1642, test_loss: 2.2465, test_f1: 0.6391
 epoch: 96, train_loss: 0.1550, test_loss: 2.1663, test_f1: 0.6290
 epoch: 97, train_loss: 0.1484, test_loss: 2.3725, test_f1: 0.6398
 epoch: 98, train_loss: 0.1513, test_loss: 2.2632, test_f1: 0.6371
 epoch: 99, train_loss: 0.1374, test_loss: 2.3727, test_f1: 0.6617
##################ITERATION #4 ****************************************
 epoch: 0, train_loss: 1.3036, test_loss: 1.2514, test_f1: 0.2270
 epoch: 1, train_loss: 1.0558, test_loss: 1.1963, test_f1: 0.2595
 epoch: 2, train_loss: 0.9564, test_loss: 1.1294, test_f1: 0.4347
 epoch: 3, train_loss: 0.9235, test_loss: 0.9764, test_f1: 0.4902
 epoch: 4, train_loss: 0.9011, test_loss: 0.9335, test_f1: 0.4871
 epoch: 5, train_loss: 0.8674, test_loss: 0.9534, test_f1: 0.5035
 epoch: 6, train_loss: 0.8466, test_loss: 0.9079, test_f1: 0.5400
 epoch: 7, train_loss: 0.8322, test_loss: 0.9071, test_f1: 0.5621
 epoch: 8, train_loss: 0.8216, test_loss: 0.9662, test_f1: 0.5357
 epoch: 9, train_loss: 0.7914, test_loss: 0.8818, test_f1: 0.5740
 epoch: 10, train_loss: 0.7807, test_loss: 0.9633, test_f1: 0.5701
 epoch: 11, train_loss: 0.7802, test_loss: 0.9599, test_f1: 0.5469
 epoch: 12, train_loss: 0.7758, test_loss: 0.9276, test_f1: 0.5741
 epoch: 13, train_loss: 0.7341, test_loss: 0.9339, test_f1: 0.5731
 epoch: 14, train_loss: 0.7122, test_loss: 0.9916, test_f1: 0.5747
 epoch: 15, train_loss: 0.7199, test_loss: 0.9343, test_f1: 0.5966
 epoch: 16, train_loss: 0.7065, test_loss: 0.8940, test_f1: 0.6029
 epoch: 17, train_loss: 0.6889, test_loss: 0.9835, test_f1: 0.6218
 epoch: 18, train_loss: 0.6827, test_loss: 1.0624, test_f1: 0.6027
 epoch: 19, train_loss: 0.6694, test_loss: 0.9569, test_f1: 0.5995
 epoch: 20, train_loss: 0.6516, test_loss: 0.9241, test_f1: 0.5964
 epoch: 21, train_loss: 0.6489, test_loss: 0.9214, test_f1: 0.5989
 epoch: 22, train_loss: 0.6423, test_loss: 0.9799, test_f1: 0.6058
 epoch: 23, train_loss: 0.6269, test_loss: 1.0550, test_f1: 0.5788
 epoch: 24, train_loss: 0.6160, test_loss: 0.9547, test_f1: 0.6611
 epoch: 25, train_loss: 0.6040, test_loss: 1.0833, test_f1: 0.5528
 epoch: 26, train_loss: 0.5918, test_loss: 0.9523, test_f1: 0.6230
 epoch: 27, train_loss: 0.5933, test_loss: 1.0826, test_f1: 0.5961
 epoch: 28, train_loss: 0.5916, test_loss: 1.0342, test_f1: 0.6329
 epoch: 29, train_loss: 0.5702, test_loss: 0.9817, test_f1: 0.6339
 epoch: 30, train_loss: 0.5577, test_loss: 0.9982, test_f1: 0.6575
 epoch: 31, train_loss: 0.5323, test_loss: 1.0392, test_f1: 0.6246
 epoch: 32, train_loss: 0.5360, test_loss: 1.1311, test_f1: 0.5628
 epoch: 33, train_loss: 0.5345, test_loss: 1.0173, test_f1: 0.6311
 epoch: 34, train_loss: 0.5227, test_loss: 1.0372, test_f1: 0.6514
 epoch: 35, train_loss: 0.4937, test_loss: 1.0029, test_f1: 0.6567
 epoch: 36, train_loss: 0.4732, test_loss: 1.1318, test_f1: 0.6399
 epoch: 37, train_loss: 0.4893, test_loss: 1.1537, test_f1: 0.6375
 epoch: 38, train_loss: 0.4795, test_loss: 1.1766, test_f1: 0.6189
 epoch: 39, train_loss: 0.4440, test_loss: 1.1513, test_f1: 0.6599
 epoch: 40, train_loss: 0.4361, test_loss: 1.2157, test_f1: 0.6203
 epoch: 41, train_loss: 0.4348, test_loss: 1.2374, test_f1: 0.6338
 epoch: 42, train_loss: 0.4508, test_loss: 1.1237, test_f1: 0.6309
 epoch: 43, train_loss: 0.4405, test_loss: 1.1168, test_f1: 0.6334
 epoch: 44, train_loss: 0.4468, test_loss: 1.1421, test_f1: 0.6616
 epoch: 45, train_loss: 0.4017, test_loss: 1.3867, test_f1: 0.6220
 epoch: 46, train_loss: 0.4017, test_loss: 1.2106, test_f1: 0.6315
 epoch: 47, train_loss: 0.3976, test_loss: 1.2864, test_f1: 0.6123
 epoch: 48, train_loss: 0.3997, test_loss: 1.2189, test_f1: 0.6316
 epoch: 49, train_loss: 0.3834, test_loss: 1.4633, test_f1: 0.6068
 epoch: 50, train_loss: 0.3941, test_loss: 1.2158, test_f1: 0.6345
 epoch: 51, train_loss: 0.3518, test_loss: 1.2566, test_f1: 0.6321
 epoch: 52, train_loss: 0.3037, test_loss: 1.2940, test_f1: 0.6608
 epoch: 53, train_loss: 0.2968, test_loss: 1.3458, test_f1: 0.6475
 epoch: 54, train_loss: 0.2945, test_loss: 1.3629, test_f1: 0.6371
 epoch: 55, train_loss: 0.2823, test_loss: 1.3220, test_f1: 0.6477
 epoch: 56, train_loss: 0.2814, test_loss: 1.3153, test_f1: 0.6586
 epoch: 57, train_loss: 0.2699, test_loss: 1.4752, test_f1: 0.6536
 epoch: 58, train_loss: 0.2676, test_loss: 1.4391, test_f1: 0.6659
 epoch: 59, train_loss: 0.2653, test_loss: 1.5098, test_f1: 0.6572
 epoch: 60, train_loss: 0.2553, test_loss: 1.5093, test_f1: 0.6381
 epoch: 61, train_loss: 0.2492, test_loss: 1.5144, test_f1: 0.6472
 epoch: 62, train_loss: 0.2499, test_loss: 1.5772, test_f1: 0.6507
 epoch: 63, train_loss: 0.2472, test_loss: 1.6004, test_f1: 0.6292
 epoch: 64, train_loss: 0.2483, test_loss: 1.6067, test_f1: 0.6441
 epoch: 65, train_loss: 0.2443, test_loss: 1.4611, test_f1: 0.6508
 epoch: 66, train_loss: 0.2204, test_loss: 1.6769, test_f1: 0.6410
 epoch: 67, train_loss: 0.2361, test_loss: 1.6003, test_f1: 0.6390
 epoch: 68, train_loss: 0.2370, test_loss: 1.7609, test_f1: 0.6180
 epoch: 69, train_loss: 0.2342, test_loss: 1.6780, test_f1: 0.6618
 epoch: 70, train_loss: 0.2173, test_loss: 1.7326, test_f1: 0.6461
 epoch: 71, train_loss: 0.2132, test_loss: 1.6863, test_f1: 0.6554
 epoch: 72, train_loss: 0.2112, test_loss: 1.8321, test_f1: 0.6360
 epoch: 73, train_loss: 0.2177, test_loss: 1.9106, test_f1: 0.6501
 epoch: 74, train_loss: 0.2192, test_loss: 1.7951, test_f1: 0.6298
 epoch: 75, train_loss: 0.2115, test_loss: 1.9581, test_f1: 0.6443
 epoch: 76, train_loss: 0.2020, test_loss: 1.8118, test_f1: 0.6594
 epoch: 77, train_loss: 0.2134, test_loss: 2.0993, test_f1: 0.6100
 epoch: 78, train_loss: 0.2060, test_loss: 1.8573, test_f1: 0.6578
 epoch: 79, train_loss: 0.1982, test_loss: 1.8420, test_f1: 0.6437
 epoch: 80, train_loss: 0.2017, test_loss: 1.8190, test_f1: 0.6627
 epoch: 81, train_loss: 0.2050, test_loss: 1.7115, test_f1: 0.6556
 epoch: 82, train_loss: 0.1947, test_loss: 1.8190, test_f1: 0.6442
 epoch: 83, train_loss: 0.1795, test_loss: 2.0812, test_f1: 0.6248
 epoch: 84, train_loss: 0.1951, test_loss: 1.9535, test_f1: 0.6103
 epoch: 85, train_loss: 0.1844, test_loss: 1.8248, test_f1: 0.6437
 epoch: 86, train_loss: 0.1862, test_loss: 2.0171, test_f1: 0.6466
 epoch: 87, train_loss: 0.2057, test_loss: 2.2166, test_f1: 0.6380
 epoch: 88, train_loss: 0.1900, test_loss: 1.8673, test_f1: 0.6625
 epoch: 89, train_loss: 0.1831, test_loss: 1.9789, test_f1: 0.6340
 epoch: 90, train_loss: 0.1821, test_loss: 2.0737, test_f1: 0.6381
 epoch: 91, train_loss: 0.1861, test_loss: 2.0448, test_f1: 0.6465
 epoch: 92, train_loss: 0.1781, test_loss: 2.1512, test_f1: 0.6346
 epoch: 93, train_loss: 0.1735, test_loss: 2.0795, test_f1: 0.6506
 epoch: 94, train_loss: 0.1797, test_loss: 2.0200, test_f1: 0.6193
 epoch: 95, train_loss: 0.1725, test_loss: 2.1738, test_f1: 0.6496
 epoch: 96, train_loss: 0.1693, test_loss: 2.1958, test_f1: 0.6428
 epoch: 97, train_loss: 0.1543, test_loss: 2.3177, test_f1: 0.6353
 epoch: 98, train_loss: 0.1836, test_loss: 2.0459, test_f1: 0.6606
 epoch: 99, train_loss: 0.1815, test_loss: 1.8783, test_f1: 0.6435
##################ITERATION #5 ****************************************
 epoch: 0, train_loss: 1.4823, test_loss: 1.3918, test_f1: 0.2270
 epoch: 1, train_loss: 1.0905, test_loss: 1.2406, test_f1: 0.2619
 epoch: 2, train_loss: 1.0090, test_loss: 1.0920, test_f1: 0.4055
 epoch: 3, train_loss: 0.9581, test_loss: 0.9647, test_f1: 0.4485
 epoch: 4, train_loss: 0.9187, test_loss: 0.9026, test_f1: 0.4579
 epoch: 5, train_loss: 0.9054, test_loss: 0.9137, test_f1: 0.5129
 epoch: 6, train_loss: 0.8774, test_loss: 0.9488, test_f1: 0.5180
 epoch: 7, train_loss: 0.8375, test_loss: 0.8965, test_f1: 0.5314
 epoch: 8, train_loss: 0.8171, test_loss: 0.9201, test_f1: 0.5280
 epoch: 9, train_loss: 0.8273, test_loss: 0.9387, test_f1: 0.5505
 epoch: 10, train_loss: 0.7980, test_loss: 0.8999, test_f1: 0.5650
 epoch: 11, train_loss: 0.7807, test_loss: 0.9341, test_f1: 0.5744
 epoch: 12, train_loss: 0.7634, test_loss: 0.9264, test_f1: 0.5893
 epoch: 13, train_loss: 0.7647, test_loss: 0.9035, test_f1: 0.5608
 epoch: 14, train_loss: 0.7565, test_loss: 0.8547, test_f1: 0.6077
 epoch: 15, train_loss: 0.7371, test_loss: 0.9523, test_f1: 0.5452
 epoch: 16, train_loss: 0.7438, test_loss: 0.8877, test_f1: 0.5516
 epoch: 17, train_loss: 0.7359, test_loss: 1.0716, test_f1: 0.5482
 epoch: 18, train_loss: 0.7263, test_loss: 0.9921, test_f1: 0.5650
 epoch: 19, train_loss: 0.7049, test_loss: 0.9903, test_f1: 0.5887
 epoch: 20, train_loss: 0.6908, test_loss: 0.9319, test_f1: 0.6179
 epoch: 21, train_loss: 0.6754, test_loss: 0.9137, test_f1: 0.6173
 epoch: 22, train_loss: 0.6626, test_loss: 0.9413, test_f1: 0.5930
 epoch: 23, train_loss: 0.6706, test_loss: 0.9701, test_f1: 0.5866
 epoch: 24, train_loss: 0.6545, test_loss: 0.9726, test_f1: 0.6066
 epoch: 25, train_loss: 0.6436, test_loss: 0.8805, test_f1: 0.6354
 epoch: 26, train_loss: 0.6276, test_loss: 0.9901, test_f1: 0.5975
 epoch: 27, train_loss: 0.6339, test_loss: 0.8999, test_f1: 0.5956
 epoch: 28, train_loss: 0.5887, test_loss: 0.9724, test_f1: 0.6139
 epoch: 29, train_loss: 0.5939, test_loss: 0.9784, test_f1: 0.5994
 epoch: 30, train_loss: 0.5974, test_loss: 1.1328, test_f1: 0.5757
 epoch: 31, train_loss: 0.5819, test_loss: 1.0306, test_f1: 0.6033
 epoch: 32, train_loss: 0.5574, test_loss: 0.9333, test_f1: 0.6310
 epoch: 33, train_loss: 0.5480, test_loss: 0.9823, test_f1: 0.6333
 epoch: 34, train_loss: 0.5447, test_loss: 1.0709, test_f1: 0.5815
 epoch: 35, train_loss: 0.5426, test_loss: 1.0054, test_f1: 0.6423
 epoch: 36, train_loss: 0.5321, test_loss: 1.1005, test_f1: 0.5945
 epoch: 37, train_loss: 0.5209, test_loss: 0.9709, test_f1: 0.6354
 epoch: 38, train_loss: 0.4968, test_loss: 1.0460, test_f1: 0.6303
 epoch: 39, train_loss: 0.4944, test_loss: 1.1870, test_f1: 0.5976
 epoch: 40, train_loss: 0.4915, test_loss: 1.1884, test_f1: 0.5990
 epoch: 41, train_loss: 0.5111, test_loss: 1.0848, test_f1: 0.6209
 epoch: 42, train_loss: 0.4953, test_loss: 1.0898, test_f1: 0.5987
 epoch: 43, train_loss: 0.4994, test_loss: 1.1401, test_f1: 0.6180
 epoch: 44, train_loss: 0.4718, test_loss: 1.0992, test_f1: 0.5929
 epoch: 45, train_loss: 0.4411, test_loss: 1.1907, test_f1: 0.6119
 epoch: 46, train_loss: 0.4416, test_loss: 1.1871, test_f1: 0.6494
 epoch: 47, train_loss: 0.4293, test_loss: 1.0884, test_f1: 0.6278
 epoch: 48, train_loss: 0.4392, test_loss: 1.1551, test_f1: 0.6440
 epoch: 49, train_loss: 0.4185, test_loss: 1.2884, test_f1: 0.6024
 epoch: 50, train_loss: 0.4161, test_loss: 1.2895, test_f1: 0.6043
 epoch: 51, train_loss: 0.3804, test_loss: 1.1776, test_f1: 0.6156
 epoch: 52, train_loss: 0.3492, test_loss: 1.2085, test_f1: 0.6333
 epoch: 53, train_loss: 0.3302, test_loss: 1.2614, test_f1: 0.6447
 epoch: 54, train_loss: 0.3265, test_loss: 1.3092, test_f1: 0.6392
 epoch: 55, train_loss: 0.3188, test_loss: 1.2850, test_f1: 0.6589
 epoch: 56, train_loss: 0.3135, test_loss: 1.2330, test_f1: 0.6589
 epoch: 57, train_loss: 0.2954, test_loss: 1.3993, test_f1: 0.6125
 epoch: 58, train_loss: 0.2916, test_loss: 1.3935, test_f1: 0.6154
 epoch: 59, train_loss: 0.3011, test_loss: 1.4976, test_f1: 0.6380
 epoch: 60, train_loss: 0.3054, test_loss: 1.3295, test_f1: 0.6345
 epoch: 61, train_loss: 0.2827, test_loss: 1.4039, test_f1: 0.6231
 epoch: 62, train_loss: 0.2819, test_loss: 1.3141, test_f1: 0.6470
 epoch: 63, train_loss: 0.2788, test_loss: 1.3952, test_f1: 0.6436
 epoch: 64, train_loss: 0.2827, test_loss: 1.4575, test_f1: 0.6330
 epoch: 65, train_loss: 0.2776, test_loss: 1.6171, test_f1: 0.6196
 epoch: 66, train_loss: 0.2782, test_loss: 1.4538, test_f1: 0.6439
 epoch: 67, train_loss: 0.2914, test_loss: 1.4520, test_f1: 0.6417
 epoch: 68, train_loss: 0.2688, test_loss: 1.4807, test_f1: 0.6268
 epoch: 69, train_loss: 0.2586, test_loss: 1.5197, test_f1: 0.6378
 epoch: 70, train_loss: 0.2591, test_loss: 1.4918, test_f1: 0.6362
 epoch: 71, train_loss: 0.2451, test_loss: 1.5198, test_f1: 0.6585
 epoch: 72, train_loss: 0.2519, test_loss: 1.5225, test_f1: 0.6490
 epoch: 73, train_loss: 0.2646, test_loss: 1.4974, test_f1: 0.6277
 epoch: 74, train_loss: 0.2478, test_loss: 1.5854, test_f1: 0.6270
 epoch: 75, train_loss: 0.2528, test_loss: 1.6064, test_f1: 0.6445
 epoch: 76, train_loss: 0.2513, test_loss: 1.7321, test_f1: 0.6146
 epoch: 77, train_loss: 0.2433, test_loss: 1.5862, test_f1: 0.6535
 epoch: 78, train_loss: 0.2349, test_loss: 1.6416, test_f1: 0.6048
 epoch: 79, train_loss: 0.2334, test_loss: 1.5753, test_f1: 0.6432
 epoch: 80, train_loss: 0.2269, test_loss: 1.6375, test_f1: 0.6412
 epoch: 81, train_loss: 0.2224, test_loss: 1.5094, test_f1: 0.6641
 epoch: 82, train_loss: 0.2194, test_loss: 1.7138, test_f1: 0.6261
 epoch: 83, train_loss: 0.2255, test_loss: 1.6664, test_f1: 0.6381
 epoch: 84, train_loss: 0.2232, test_loss: 1.7516, test_f1: 0.6224
 epoch: 85, train_loss: 0.2191, test_loss: 1.7796, test_f1: 0.6237
 epoch: 86, train_loss: 0.2134, test_loss: 1.5600, test_f1: 0.6448
 epoch: 87, train_loss: 0.2105, test_loss: 1.7248, test_f1: 0.6473
 epoch: 88, train_loss: 0.2104, test_loss: 1.6631, test_f1: 0.6370
 epoch: 89, train_loss: 0.2152, test_loss: 1.6773, test_f1: 0.6487
 epoch: 90, train_loss: 0.1967, test_loss: 1.7232, test_f1: 0.6573
 epoch: 91, train_loss: 0.2081, test_loss: 1.8692, test_f1: 0.5989
 epoch: 92, train_loss: 0.2090, test_loss: 1.7555, test_f1: 0.6370
 epoch: 93, train_loss: 0.2108, test_loss: 1.7344, test_f1: 0.6307
 epoch: 94, train_loss: 0.1953, test_loss: 1.6372, test_f1: 0.6473
 epoch: 95, train_loss: 0.1914, test_loss: 1.7613, test_f1: 0.6226
 epoch: 96, train_loss: 0.1827, test_loss: 1.9024, test_f1: 0.6358
 epoch: 97, train_loss: 0.1926, test_loss: 1.7914, test_f1: 0.6099
 epoch: 98, train_loss: 0.1988, test_loss: 2.0395, test_f1: 0.6228
 epoch: 99, train_loss: 0.2042, test_loss: 1.9169, test_f1: 0.5999
##################ITERATION #6 ****************************************
 epoch: 0, train_loss: 1.5918, test_loss: 1.3159, test_f1: 0.2416
 epoch: 1, train_loss: 1.0740, test_loss: 1.1661, test_f1: 0.3563
 epoch: 2, train_loss: 0.9828, test_loss: 1.0548, test_f1: 0.3720
 epoch: 3, train_loss: 0.9409, test_loss: 1.0308, test_f1: 0.3843
 epoch: 4, train_loss: 0.9025, test_loss: 0.9961, test_f1: 0.4365
 epoch: 5, train_loss: 0.8681, test_loss: 0.9405, test_f1: 0.4856
 epoch: 6, train_loss: 0.8534, test_loss: 0.8831, test_f1: 0.5459
 epoch: 7, train_loss: 0.8520, test_loss: 0.9348, test_f1: 0.5145
 epoch: 8, train_loss: 0.8283, test_loss: 0.9010, test_f1: 0.5456
 epoch: 9, train_loss: 0.8067, test_loss: 0.9529, test_f1: 0.5243
 epoch: 10, train_loss: 0.7820, test_loss: 0.9441, test_f1: 0.5335
 epoch: 11, train_loss: 0.7652, test_loss: 0.9432, test_f1: 0.5403
 epoch: 12, train_loss: 0.7647, test_loss: 0.9361, test_f1: 0.5896
 epoch: 13, train_loss: 0.7486, test_loss: 0.9225, test_f1: 0.5303
 epoch: 14, train_loss: 0.7683, test_loss: 0.8905, test_f1: 0.5934
 epoch: 15, train_loss: 0.7440, test_loss: 0.9070, test_f1: 0.5964
 epoch: 16, train_loss: 0.7182, test_loss: 0.9058, test_f1: 0.5689
 epoch: 17, train_loss: 0.7164, test_loss: 0.9163, test_f1: 0.5344
 epoch: 18, train_loss: 0.7093, test_loss: 0.9350, test_f1: 0.5742
 epoch: 19, train_loss: 0.6914, test_loss: 0.9795, test_f1: 0.6058
 epoch: 20, train_loss: 0.6891, test_loss: 1.0050, test_f1: 0.5527
 epoch: 21, train_loss: 0.6853, test_loss: 0.9859, test_f1: 0.5821
 epoch: 22, train_loss: 0.6722, test_loss: 0.9513, test_f1: 0.5826
 epoch: 23, train_loss: 0.6613, test_loss: 0.9781, test_f1: 0.5954
 epoch: 24, train_loss: 0.6460, test_loss: 0.9259, test_f1: 0.6037
 epoch: 25, train_loss: 0.6417, test_loss: 1.0054, test_f1: 0.6063
 epoch: 26, train_loss: 0.6414, test_loss: 1.0309, test_f1: 0.5737
 epoch: 27, train_loss: 0.6257, test_loss: 0.9894, test_f1: 0.5801
 epoch: 28, train_loss: 0.6006, test_loss: 1.0192, test_f1: 0.5925
 epoch: 29, train_loss: 0.6007, test_loss: 1.0043, test_f1: 0.6190
 epoch: 30, train_loss: 0.5790, test_loss: 0.9309, test_f1: 0.6555
 epoch: 31, train_loss: 0.5729, test_loss: 1.0123, test_f1: 0.6051
 epoch: 32, train_loss: 0.5687, test_loss: 1.0318, test_f1: 0.6219
 epoch: 33, train_loss: 0.5678, test_loss: 0.9872, test_f1: 0.5967
 epoch: 34, train_loss: 0.5378, test_loss: 1.0397, test_f1: 0.5925
 epoch: 35, train_loss: 0.5427, test_loss: 1.1126, test_f1: 0.6154
 epoch: 36, train_loss: 0.5742, test_loss: 1.0559, test_f1: 0.6024
 epoch: 37, train_loss: 0.5418, test_loss: 1.0432, test_f1: 0.6301
 epoch: 38, train_loss: 0.5177, test_loss: 1.1497, test_f1: 0.6207
 epoch: 39, train_loss: 0.5106, test_loss: 1.0400, test_f1: 0.6235
 epoch: 40, train_loss: 0.4774, test_loss: 1.1267, test_f1: 0.6272
 epoch: 41, train_loss: 0.4853, test_loss: 1.0828, test_f1: 0.5997
 epoch: 42, train_loss: 0.4733, test_loss: 1.0976, test_f1: 0.6162
 epoch: 43, train_loss: 0.4708, test_loss: 1.1661, test_f1: 0.6040
 epoch: 44, train_loss: 0.4899, test_loss: 1.1429, test_f1: 0.6179
 epoch: 45, train_loss: 0.4659, test_loss: 1.2256, test_f1: 0.5895
 epoch: 46, train_loss: 0.4511, test_loss: 1.1429, test_f1: 0.6170
 epoch: 47, train_loss: 0.4446, test_loss: 1.1392, test_f1: 0.6137
 epoch: 48, train_loss: 0.4526, test_loss: 1.1311, test_f1: 0.6410
 epoch: 49, train_loss: 0.4305, test_loss: 1.1583, test_f1: 0.5972
 epoch: 50, train_loss: 0.4302, test_loss: 1.1772, test_f1: 0.6238
 epoch: 51, train_loss: 0.3871, test_loss: 1.1630, test_f1: 0.6458
 epoch: 52, train_loss: 0.3548, test_loss: 1.1592, test_f1: 0.6300
 epoch: 53, train_loss: 0.3362, test_loss: 1.1572, test_f1: 0.6563
 epoch: 54, train_loss: 0.3308, test_loss: 1.2498, test_f1: 0.6622
 epoch: 55, train_loss: 0.3317, test_loss: 1.2346, test_f1: 0.6393
 epoch: 56, train_loss: 0.3182, test_loss: 1.2827, test_f1: 0.6009
 epoch: 57, train_loss: 0.3134, test_loss: 1.3212, test_f1: 0.6428
 epoch: 58, train_loss: 0.2940, test_loss: 1.2913, test_f1: 0.6269
 epoch: 59, train_loss: 0.2961, test_loss: 1.3392, test_f1: 0.6493
 epoch: 60, train_loss: 0.3143, test_loss: 1.2543, test_f1: 0.6069
 epoch: 61, train_loss: 0.2869, test_loss: 1.3347, test_f1: 0.6315
 epoch: 62, train_loss: 0.2751, test_loss: 1.4145, test_f1: 0.6304
 epoch: 63, train_loss: 0.2909, test_loss: 1.3857, test_f1: 0.6473
 epoch: 64, train_loss: 0.2928, test_loss: 1.3262, test_f1: 0.6177
 epoch: 65, train_loss: 0.2674, test_loss: 1.3817, test_f1: 0.6277
 epoch: 66, train_loss: 0.2659, test_loss: 1.4260, test_f1: 0.6284
 epoch: 67, train_loss: 0.2738, test_loss: 1.6395, test_f1: 0.6134
 epoch: 68, train_loss: 0.2848, test_loss: 1.3352, test_f1: 0.6624
 epoch: 69, train_loss: 0.2736, test_loss: 1.4510, test_f1: 0.6412
 epoch: 70, train_loss: 0.2584, test_loss: 1.5394, test_f1: 0.6337
 epoch: 71, train_loss: 0.2371, test_loss: 1.4213, test_f1: 0.6367
 epoch: 72, train_loss: 0.2485, test_loss: 1.5059, test_f1: 0.6404
 epoch: 73, train_loss: 0.2308, test_loss: 1.6247, test_f1: 0.6128
 epoch: 74, train_loss: 0.2417, test_loss: 1.5448, test_f1: 0.6452
 epoch: 75, train_loss: 0.2195, test_loss: 1.6303, test_f1: 0.6323
 epoch: 76, train_loss: 0.2354, test_loss: 1.6749, test_f1: 0.6161
 epoch: 77, train_loss: 0.2355, test_loss: 1.6072, test_f1: 0.6188
 epoch: 78, train_loss: 0.2252, test_loss: 1.6188, test_f1: 0.6300
 epoch: 79, train_loss: 0.2333, test_loss: 1.6164, test_f1: 0.6185
 epoch: 80, train_loss: 0.2309, test_loss: 1.7693, test_f1: 0.6120
 epoch: 81, train_loss: 0.2435, test_loss: 1.6015, test_f1: 0.6241
 epoch: 82, train_loss: 0.2467, test_loss: 1.5165, test_f1: 0.6408
 epoch: 83, train_loss: 0.2501, test_loss: 1.5129, test_f1: 0.6298
 epoch: 84, train_loss: 0.2272, test_loss: 1.5597, test_f1: 0.6349
 epoch: 85, train_loss: 0.2084, test_loss: 1.7457, test_f1: 0.6038
 epoch: 86, train_loss: 0.1967, test_loss: 1.6282, test_f1: 0.6273
 epoch: 87, train_loss: 0.2038, test_loss: 1.7059, test_f1: 0.6200
 epoch: 88, train_loss: 0.2056, test_loss: 1.7877, test_f1: 0.6236
 epoch: 89, train_loss: 0.2037, test_loss: 1.7742, test_f1: 0.6218
 epoch: 90, train_loss: 0.1922, test_loss: 1.7476, test_f1: 0.6256
 epoch: 91, train_loss: 0.2010, test_loss: 1.6028, test_f1: 0.6280
 epoch: 92, train_loss: 0.1952, test_loss: 1.7362, test_f1: 0.6284
 epoch: 93, train_loss: 0.1790, test_loss: 1.8043, test_f1: 0.6317
 epoch: 94, train_loss: 0.1874, test_loss: 1.9037, test_f1: 0.5876
 epoch: 95, train_loss: 0.1943, test_loss: 1.7557, test_f1: 0.6323
 epoch: 96, train_loss: 0.1997, test_loss: 1.7264, test_f1: 0.6292
 epoch: 97, train_loss: 0.1905, test_loss: 1.7980, test_f1: 0.6173
 epoch: 98, train_loss: 0.2017, test_loss: 1.9280, test_f1: 0.5958
 epoch: 99, train_loss: 0.2094, test_loss: 1.6803, test_f1: 0.6220
##################ITERATION #7 ****************************************
 epoch: 0, train_loss: 1.6274, test_loss: 1.2715, test_f1: 0.2416
 epoch: 1, train_loss: 1.0809, test_loss: 1.1329, test_f1: 0.3431
 epoch: 2, train_loss: 0.9827, test_loss: 1.0386, test_f1: 0.3728
 epoch: 3, train_loss: 0.9479, test_loss: 1.0187, test_f1: 0.4405
 epoch: 4, train_loss: 0.9114, test_loss: 0.9888, test_f1: 0.4704
 epoch: 5, train_loss: 0.9015, test_loss: 0.9811, test_f1: 0.4852
 epoch: 6, train_loss: 0.8756, test_loss: 0.9358, test_f1: 0.4903
 epoch: 7, train_loss: 0.8439, test_loss: 0.9144, test_f1: 0.5456
 epoch: 8, train_loss: 0.8415, test_loss: 0.9622, test_f1: 0.5399
 epoch: 9, train_loss: 0.8128, test_loss: 0.9093, test_f1: 0.5595
 epoch: 10, train_loss: 0.7936, test_loss: 0.9632, test_f1: 0.5014
 epoch: 11, train_loss: 0.7913, test_loss: 1.0616, test_f1: 0.5169
 epoch: 12, train_loss: 0.7784, test_loss: 0.9333, test_f1: 0.5509
 epoch: 13, train_loss: 0.7584, test_loss: 0.9297, test_f1: 0.5789
 epoch: 14, train_loss: 0.7627, test_loss: 0.9715, test_f1: 0.5549
 epoch: 15, train_loss: 0.7491, test_loss: 0.8881, test_f1: 0.5811
 epoch: 16, train_loss: 0.7409, test_loss: 0.9873, test_f1: 0.5706
 epoch: 17, train_loss: 0.7258, test_loss: 0.9286, test_f1: 0.6085
 epoch: 18, train_loss: 0.7211, test_loss: 0.9458, test_f1: 0.5960
 epoch: 19, train_loss: 0.7217, test_loss: 1.0278, test_f1: 0.5561
 epoch: 20, train_loss: 0.7120, test_loss: 0.9416, test_f1: 0.5781
 epoch: 21, train_loss: 0.6943, test_loss: 0.9597, test_f1: 0.5754
 epoch: 22, train_loss: 0.6882, test_loss: 0.9455, test_f1: 0.6089
 epoch: 23, train_loss: 0.6609, test_loss: 1.0019, test_f1: 0.5669
 epoch: 24, train_loss: 0.6456, test_loss: 0.9762, test_f1: 0.6107
 epoch: 25, train_loss: 0.6395, test_loss: 1.0131, test_f1: 0.5789
 epoch: 26, train_loss: 0.6473, test_loss: 1.0381, test_f1: 0.5570
 epoch: 27, train_loss: 0.6533, test_loss: 0.9253, test_f1: 0.6209
 epoch: 28, train_loss: 0.6297, test_loss: 0.9661, test_f1: 0.6414
 epoch: 29, train_loss: 0.6229, test_loss: 1.0782, test_f1: 0.5689
 epoch: 30, train_loss: 0.6419, test_loss: 1.0185, test_f1: 0.5954
 epoch: 31, train_loss: 0.5973, test_loss: 1.0248, test_f1: 0.5672
 epoch: 32, train_loss: 0.5818, test_loss: 0.9895, test_f1: 0.6414
 epoch: 33, train_loss: 0.5697, test_loss: 1.0183, test_f1: 0.6124
 epoch: 34, train_loss: 0.5469, test_loss: 0.9834, test_f1: 0.6481
 epoch: 35, train_loss: 0.5438, test_loss: 1.0369, test_f1: 0.6005
 epoch: 36, train_loss: 0.5407, test_loss: 1.0601, test_f1: 0.6306
 epoch: 37, train_loss: 0.5256, test_loss: 1.0058, test_f1: 0.6700
 epoch: 38, train_loss: 0.5296, test_loss: 1.2661, test_f1: 0.6152
 epoch: 39, train_loss: 0.5225, test_loss: 1.0682, test_f1: 0.6345
 epoch: 40, train_loss: 0.4993, test_loss: 1.0763, test_f1: 0.6090
 epoch: 41, train_loss: 0.4989, test_loss: 1.0788, test_f1: 0.6307
 epoch: 42, train_loss: 0.4823, test_loss: 1.1552, test_f1: 0.5905
 epoch: 43, train_loss: 0.4763, test_loss: 1.1910, test_f1: 0.5982
 epoch: 44, train_loss: 0.4779, test_loss: 1.0957, test_f1: 0.6608
 epoch: 45, train_loss: 0.4668, test_loss: 1.1789, test_f1: 0.6140
 epoch: 46, train_loss: 0.4314, test_loss: 1.0713, test_f1: 0.6432
 epoch: 47, train_loss: 0.4497, test_loss: 1.1064, test_f1: 0.6329
 epoch: 48, train_loss: 0.4291, test_loss: 1.0531, test_f1: 0.6686
 epoch: 49, train_loss: 0.4241, test_loss: 1.1920, test_f1: 0.6420
 epoch: 50, train_loss: 0.4027, test_loss: 1.1735, test_f1: 0.6423
 epoch: 51, train_loss: 0.3842, test_loss: 1.1377, test_f1: 0.6459
 epoch: 52, train_loss: 0.3649, test_loss: 1.2307, test_f1: 0.6566
 epoch: 53, train_loss: 0.3233, test_loss: 1.2650, test_f1: 0.6649
 epoch: 54, train_loss: 0.3208, test_loss: 1.1845, test_f1: 0.6791
 epoch: 55, train_loss: 0.3167, test_loss: 1.2549, test_f1: 0.6578
 epoch: 56, train_loss: 0.3081, test_loss: 1.2982, test_f1: 0.6690
 epoch: 57, train_loss: 0.3016, test_loss: 1.3208, test_f1: 0.6605
 epoch: 58, train_loss: 0.2989, test_loss: 1.3866, test_f1: 0.6499
 epoch: 59, train_loss: 0.2923, test_loss: 1.3181, test_f1: 0.6501
 epoch: 60, train_loss: 0.2793, test_loss: 1.3959, test_f1: 0.6273
 epoch: 61, train_loss: 0.2833, test_loss: 1.4683, test_f1: 0.6335
 epoch: 62, train_loss: 0.2860, test_loss: 1.3305, test_f1: 0.6616
 epoch: 63, train_loss: 0.2773, test_loss: 1.3405, test_f1: 0.6424
 epoch: 64, train_loss: 0.2936, test_loss: 1.4314, test_f1: 0.6254
 epoch: 65, train_loss: 0.2799, test_loss: 1.3699, test_f1: 0.6598
 epoch: 66, train_loss: 0.2764, test_loss: 1.2987, test_f1: 0.6588
 epoch: 67, train_loss: 0.2566, test_loss: 1.3802, test_f1: 0.6457
 epoch: 68, train_loss: 0.2481, test_loss: 1.5804, test_f1: 0.6255
 epoch: 69, train_loss: 0.2759, test_loss: 1.4517, test_f1: 0.6437
 epoch: 70, train_loss: 0.2630, test_loss: 1.4199, test_f1: 0.6673
 epoch: 71, train_loss: 0.2509, test_loss: 1.5208, test_f1: 0.6170
 epoch: 72, train_loss: 0.2492, test_loss: 1.5997, test_f1: 0.6355
 epoch: 73, train_loss: 0.2382, test_loss: 1.5721, test_f1: 0.6461
 epoch: 74, train_loss: 0.2385, test_loss: 1.5420, test_f1: 0.6419
 epoch: 75, train_loss: 0.2322, test_loss: 1.4940, test_f1: 0.6552
 epoch: 76, train_loss: 0.2169, test_loss: 1.5729, test_f1: 0.6511
 epoch: 77, train_loss: 0.2181, test_loss: 1.5424, test_f1: 0.6292
 epoch: 78, train_loss: 0.2136, test_loss: 1.7205, test_f1: 0.6228
 epoch: 79, train_loss: 0.2266, test_loss: 1.6529, test_f1: 0.6532
 epoch: 80, train_loss: 0.2295, test_loss: 1.6957, test_f1: 0.6171
 epoch: 81, train_loss: 0.2252, test_loss: 1.6857, test_f1: 0.6129
 epoch: 82, train_loss: 0.2258, test_loss: 1.6441, test_f1: 0.6357
 epoch: 83, train_loss: 0.2241, test_loss: 1.6596, test_f1: 0.6561
 epoch: 84, train_loss: 0.2176, test_loss: 1.8063, test_f1: 0.6455
 epoch: 85, train_loss: 0.2287, test_loss: 1.5804, test_f1: 0.6567
 epoch: 86, train_loss: 0.2239, test_loss: 1.6191, test_f1: 0.6446
 epoch: 87, train_loss: 0.2153, test_loss: 1.8576, test_f1: 0.6344
 epoch: 88, train_loss: 0.1992, test_loss: 1.7023, test_f1: 0.6258
 epoch: 89, train_loss: 0.2011, test_loss: 1.8389, test_f1: 0.6299
 epoch: 90, train_loss: 0.2157, test_loss: 1.7470, test_f1: 0.6348
 epoch: 91, train_loss: 0.1923, test_loss: 1.7175, test_f1: 0.6347
 epoch: 92, train_loss: 0.1916, test_loss: 1.8946, test_f1: 0.6179
 epoch: 93, train_loss: 0.1983, test_loss: 1.7371, test_f1: 0.6454
 epoch: 94, train_loss: 0.1913, test_loss: 1.7304, test_f1: 0.6420
 epoch: 95, train_loss: 0.1981, test_loss: 1.8218, test_f1: 0.6079
 epoch: 96, train_loss: 0.1915, test_loss: 2.0239, test_f1: 0.6001
 epoch: 97, train_loss: 0.1850, test_loss: 1.7273, test_f1: 0.6236
 epoch: 98, train_loss: 0.1853, test_loss: 1.8613, test_f1: 0.6337
 epoch: 99, train_loss: 0.1826, test_loss: 1.7880, test_f1: 0.6372
##################ITERATION #8 ****************************************
 epoch: 0, train_loss: 1.7642, test_loss: 1.3104, test_f1: 0.2270
 epoch: 1, train_loss: 1.0982, test_loss: 1.1764, test_f1: 0.3000
 epoch: 2, train_loss: 0.9708, test_loss: 1.0599, test_f1: 0.4139
 epoch: 3, train_loss: 0.9377, test_loss: 1.0074, test_f1: 0.4751
 epoch: 4, train_loss: 0.9069, test_loss: 0.9806, test_f1: 0.4610
 epoch: 5, train_loss: 0.8784, test_loss: 0.9633, test_f1: 0.4828
 epoch: 6, train_loss: 0.8442, test_loss: 0.9295, test_f1: 0.5320
 epoch: 7, train_loss: 0.8316, test_loss: 0.9381, test_f1: 0.5380
 epoch: 8, train_loss: 0.8149, test_loss: 0.9427, test_f1: 0.5256
 epoch: 9, train_loss: 0.8018, test_loss: 0.9303, test_f1: 0.5633
 epoch: 10, train_loss: 0.7947, test_loss: 0.9666, test_f1: 0.5480
 epoch: 11, train_loss: 0.7551, test_loss: 0.9414, test_f1: 0.5369
 epoch: 12, train_loss: 0.7572, test_loss: 0.9799, test_f1: 0.5656
 epoch: 13, train_loss: 0.7579, test_loss: 0.9905, test_f1: 0.5878
 epoch: 14, train_loss: 0.7550, test_loss: 0.9414, test_f1: 0.5641
 epoch: 15, train_loss: 0.7153, test_loss: 0.9602, test_f1: 0.5540
 epoch: 16, train_loss: 0.7208, test_loss: 0.9323, test_f1: 0.5816
 epoch: 17, train_loss: 0.7111, test_loss: 0.9207, test_f1: 0.5682
 epoch: 18, train_loss: 0.6982, test_loss: 0.9899, test_f1: 0.5783
 epoch: 19, train_loss: 0.6656, test_loss: 0.9511, test_f1: 0.5791
 epoch: 20, train_loss: 0.6782, test_loss: 1.0285, test_f1: 0.5716
 epoch: 21, train_loss: 0.6538, test_loss: 0.9855, test_f1: 0.5801
 epoch: 22, train_loss: 0.6640, test_loss: 0.9968, test_f1: 0.5247
 epoch: 23, train_loss: 0.6631, test_loss: 0.9658, test_f1: 0.6013
 epoch: 24, train_loss: 0.6215, test_loss: 1.0466, test_f1: 0.5753
 epoch: 25, train_loss: 0.6240, test_loss: 1.0206, test_f1: 0.6068
 epoch: 26, train_loss: 0.6366, test_loss: 0.9339, test_f1: 0.6318
 epoch: 27, train_loss: 0.6121, test_loss: 0.9702, test_f1: 0.5910
 epoch: 28, train_loss: 0.5906, test_loss: 1.0384, test_f1: 0.5734
 epoch: 29, train_loss: 0.5936, test_loss: 1.0452, test_f1: 0.6119
 epoch: 30, train_loss: 0.5964, test_loss: 1.0105, test_f1: 0.6034
 epoch: 31, train_loss: 0.5703, test_loss: 1.0956, test_f1: 0.5804
 epoch: 32, train_loss: 0.5626, test_loss: 1.0001, test_f1: 0.5943
 epoch: 33, train_loss: 0.5727, test_loss: 1.0702, test_f1: 0.5949
 epoch: 34, train_loss: 0.5486, test_loss: 1.0846, test_f1: 0.5906
 epoch: 35, train_loss: 0.5441, test_loss: 1.0336, test_f1: 0.6268
 epoch: 36, train_loss: 0.5041, test_loss: 1.0210, test_f1: 0.6333
 epoch: 37, train_loss: 0.5012, test_loss: 1.0096, test_f1: 0.6301
 epoch: 38, train_loss: 0.5045, test_loss: 1.1564, test_f1: 0.5819
 epoch: 39, train_loss: 0.5194, test_loss: 1.1521, test_f1: 0.6128
 epoch: 40, train_loss: 0.4869, test_loss: 1.1201, test_f1: 0.6202
 epoch: 41, train_loss: 0.4913, test_loss: 1.0186, test_f1: 0.6130
 epoch: 42, train_loss: 0.4693, test_loss: 1.1462, test_f1: 0.6315
 epoch: 43, train_loss: 0.4665, test_loss: 1.0321, test_f1: 0.6295
 epoch: 44, train_loss: 0.4441, test_loss: 1.1097, test_f1: 0.6141
 epoch: 45, train_loss: 0.4867, test_loss: 1.1437, test_f1: 0.5917
 epoch: 46, train_loss: 0.5032, test_loss: 1.1767, test_f1: 0.6024
 epoch: 47, train_loss: 0.4516, test_loss: 1.1948, test_f1: 0.6347
 epoch: 48, train_loss: 0.4408, test_loss: 1.2695, test_f1: 0.6112
 epoch: 49, train_loss: 0.4215, test_loss: 1.2985, test_f1: 0.5946
 epoch: 50, train_loss: 0.4178, test_loss: 1.2128, test_f1: 0.6134
 epoch: 51, train_loss: 0.3913, test_loss: 1.2072, test_f1: 0.6424
 epoch: 52, train_loss: 0.3673, test_loss: 1.2603, test_f1: 0.6367
 epoch: 53, train_loss: 0.3327, test_loss: 1.3573, test_f1: 0.6403
 epoch: 54, train_loss: 0.3380, test_loss: 1.3178, test_f1: 0.6349
 epoch: 55, train_loss: 0.3431, test_loss: 1.3137, test_f1: 0.6513
 epoch: 56, train_loss: 0.3101, test_loss: 1.3045, test_f1: 0.6536
 epoch: 57, train_loss: 0.3208, test_loss: 1.3965, test_f1: 0.6345
 epoch: 58, train_loss: 0.3027, test_loss: 1.4141, test_f1: 0.6457
 epoch: 59, train_loss: 0.2925, test_loss: 1.4514, test_f1: 0.6375
 epoch: 60, train_loss: 0.3107, test_loss: 1.4413, test_f1: 0.6440
 epoch: 61, train_loss: 0.2974, test_loss: 1.3978, test_f1: 0.6320
 epoch: 62, train_loss: 0.2933, test_loss: 1.3850, test_f1: 0.6516
 epoch: 63, train_loss: 0.2817, test_loss: 1.3484, test_f1: 0.6403
 epoch: 64, train_loss: 0.2860, test_loss: 1.5377, test_f1: 0.6105
 epoch: 65, train_loss: 0.2763, test_loss: 1.4288, test_f1: 0.6324
 epoch: 66, train_loss: 0.2865, test_loss: 1.5098, test_f1: 0.6244
 epoch: 67, train_loss: 0.2925, test_loss: 1.5105, test_f1: 0.6321
 epoch: 68, train_loss: 0.2744, test_loss: 1.5065, test_f1: 0.6136
 epoch: 69, train_loss: 0.2849, test_loss: 1.4745, test_f1: 0.6395
 epoch: 70, train_loss: 0.2679, test_loss: 1.6135, test_f1: 0.5962
 epoch: 71, train_loss: 0.2732, test_loss: 1.5453, test_f1: 0.6294
 epoch: 72, train_loss: 0.2555, test_loss: 1.5104, test_f1: 0.6436
 epoch: 73, train_loss: 0.2487, test_loss: 1.5868, test_f1: 0.6539
 epoch: 74, train_loss: 0.2518, test_loss: 1.5219, test_f1: 0.6364
 epoch: 75, train_loss: 0.2480, test_loss: 1.5955, test_f1: 0.6288
 epoch: 76, train_loss: 0.2432, test_loss: 1.8165, test_f1: 0.6136
 epoch: 77, train_loss: 0.2538, test_loss: 1.6569, test_f1: 0.6432
 epoch: 78, train_loss: 0.2446, test_loss: 1.5378, test_f1: 0.6297
 epoch: 79, train_loss: 0.2461, test_loss: 1.7092, test_f1: 0.6436
 epoch: 80, train_loss: 0.2436, test_loss: 1.6067, test_f1: 0.6299
 epoch: 81, train_loss: 0.2512, test_loss: 1.6366, test_f1: 0.6273
 epoch: 82, train_loss: 0.2597, test_loss: 1.6845, test_f1: 0.6241
 epoch: 83, train_loss: 0.2544, test_loss: 1.7195, test_f1: 0.6246
 epoch: 84, train_loss: 0.2212, test_loss: 1.6574, test_f1: 0.6356
 epoch: 85, train_loss: 0.2133, test_loss: 1.5839, test_f1: 0.6355
 epoch: 86, train_loss: 0.2121, test_loss: 1.6929, test_f1: 0.6287
 epoch: 87, train_loss: 0.2283, test_loss: 1.7893, test_f1: 0.6352
 epoch: 88, train_loss: 0.2311, test_loss: 1.8917, test_f1: 0.6098
 epoch: 89, train_loss: 0.2238, test_loss: 1.6987, test_f1: 0.6349
 epoch: 90, train_loss: 0.2248, test_loss: 1.7339, test_f1: 0.6398
 epoch: 91, train_loss: 0.2057, test_loss: 1.7395, test_f1: 0.6343
 epoch: 92, train_loss: 0.2213, test_loss: 1.7234, test_f1: 0.6159
 epoch: 93, train_loss: 0.2182, test_loss: 1.8048, test_f1: 0.6261
 epoch: 94, train_loss: 0.2194, test_loss: 1.7843, test_f1: 0.6080
 epoch: 95, train_loss: 0.2164, test_loss: 1.8225, test_f1: 0.6308
 epoch: 96, train_loss: 0.2007, test_loss: 1.8235, test_f1: 0.6283
 epoch: 97, train_loss: 0.2057, test_loss: 1.7534, test_f1: 0.6170
 epoch: 98, train_loss: 0.1863, test_loss: 1.9117, test_f1: 0.6183
 epoch: 99, train_loss: 0.2157, test_loss: 1.7314, test_f1: 0.6193
##################ITERATION #9 ****************************************
 epoch: 0, train_loss: 1.6704, test_loss: 1.5401, test_f1: 0.2270
 epoch: 1, train_loss: 1.1048, test_loss: 1.1276, test_f1: 0.3239
 epoch: 2, train_loss: 0.9894, test_loss: 1.0181, test_f1: 0.3867
 epoch: 3, train_loss: 0.9534, test_loss: 0.9869, test_f1: 0.4354
 epoch: 4, train_loss: 0.9175, test_loss: 0.9972, test_f1: 0.4534
 epoch: 5, train_loss: 0.8836, test_loss: 0.9716, test_f1: 0.4882
 epoch: 6, train_loss: 0.8634, test_loss: 0.9493, test_f1: 0.5064
 epoch: 7, train_loss: 0.8371, test_loss: 0.9626, test_f1: 0.5180
 epoch: 8, train_loss: 0.8157, test_loss: 0.9965, test_f1: 0.5216
 epoch: 9, train_loss: 0.8055, test_loss: 0.9898, test_f1: 0.5149
 epoch: 10, train_loss: 0.7981, test_loss: 0.9532, test_f1: 0.5401
 epoch: 11, train_loss: 0.7830, test_loss: 0.9862, test_f1: 0.5344
 epoch: 12, train_loss: 0.7677, test_loss: 0.9308, test_f1: 0.5628
 epoch: 13, train_loss: 0.7523, test_loss: 0.9289, test_f1: 0.5535
 epoch: 14, train_loss: 0.7410, test_loss: 0.9655, test_f1: 0.5566
 epoch: 15, train_loss: 0.7326, test_loss: 0.9650, test_f1: 0.5630
 epoch: 16, train_loss: 0.7150, test_loss: 0.9942, test_f1: 0.5635
 epoch: 17, train_loss: 0.7124, test_loss: 1.0190, test_f1: 0.5815
 epoch: 18, train_loss: 0.7235, test_loss: 1.0104, test_f1: 0.5656
 epoch: 19, train_loss: 0.6961, test_loss: 1.1142, test_f1: 0.5733
 epoch: 20, train_loss: 0.6860, test_loss: 1.0330, test_f1: 0.5912
 epoch: 21, train_loss: 0.6803, test_loss: 1.0646, test_f1: 0.5771
 epoch: 22, train_loss: 0.6689, test_loss: 1.0393, test_f1: 0.5776
 epoch: 23, train_loss: 0.6670, test_loss: 1.0045, test_f1: 0.5874
 epoch: 24, train_loss: 0.6620, test_loss: 1.0168, test_f1: 0.5853
 epoch: 25, train_loss: 0.6456, test_loss: 1.0579, test_f1: 0.6118
 epoch: 26, train_loss: 0.6186, test_loss: 0.9957, test_f1: 0.6203
 epoch: 27, train_loss: 0.6091, test_loss: 1.0466, test_f1: 0.6170
 epoch: 28, train_loss: 0.6346, test_loss: 1.1130, test_f1: 0.5827
 epoch: 29, train_loss: 0.6019, test_loss: 1.0474, test_f1: 0.6167
 epoch: 30, train_loss: 0.6053, test_loss: 1.0609, test_f1: 0.6010
 epoch: 31, train_loss: 0.5682, test_loss: 1.0791, test_f1: 0.6095
 epoch: 32, train_loss: 0.5753, test_loss: 1.2098, test_f1: 0.5966
 epoch: 33, train_loss: 0.5784, test_loss: 1.1070, test_f1: 0.5984
 epoch: 34, train_loss: 0.5650, test_loss: 1.0628, test_f1: 0.6342
 epoch: 35, train_loss: 0.5629, test_loss: 1.1005, test_f1: 0.5927
 epoch: 36, train_loss: 0.5858, test_loss: 1.2171, test_f1: 0.5712
 epoch: 37, train_loss: 0.5621, test_loss: 1.1326, test_f1: 0.6455
 epoch: 38, train_loss: 0.5236, test_loss: 1.1307, test_f1: 0.6127
 epoch: 39, train_loss: 0.5416, test_loss: 1.1958, test_f1: 0.5966
 epoch: 40, train_loss: 0.5298, test_loss: 1.1920, test_f1: 0.6167
 epoch: 41, train_loss: 0.5194, test_loss: 1.2205, test_f1: 0.6183
 epoch: 42, train_loss: 0.4819, test_loss: 1.1908, test_f1: 0.6113
 epoch: 43, train_loss: 0.4829, test_loss: 1.2237, test_f1: 0.6334
 epoch: 44, train_loss: 0.4967, test_loss: 1.1189, test_f1: 0.6507
 epoch: 45, train_loss: 0.4560, test_loss: 1.3450, test_f1: 0.6139
 epoch: 46, train_loss: 0.4580, test_loss: 1.2787, test_f1: 0.6200
 epoch: 47, train_loss: 0.4568, test_loss: 1.1612, test_f1: 0.6372
 epoch: 48, train_loss: 0.4440, test_loss: 1.2456, test_f1: 0.6457
 epoch: 49, train_loss: 0.4386, test_loss: 1.2543, test_f1: 0.6296
 epoch: 50, train_loss: 0.4551, test_loss: 1.3343, test_f1: 0.6036
 epoch: 51, train_loss: 0.4159, test_loss: 1.2394, test_f1: 0.6657
 epoch: 52, train_loss: 0.3754, test_loss: 1.2529, test_f1: 0.6537
 epoch: 53, train_loss: 0.3681, test_loss: 1.4519, test_f1: 0.6079
 epoch: 54, train_loss: 0.3667, test_loss: 1.4392, test_f1: 0.6142
 epoch: 55, train_loss: 0.3518, test_loss: 1.3878, test_f1: 0.6302
 epoch: 56, train_loss: 0.3401, test_loss: 1.4733, test_f1: 0.6372
 epoch: 57, train_loss: 0.3294, test_loss: 1.4821, test_f1: 0.6252
 epoch: 58, train_loss: 0.3232, test_loss: 1.4525, test_f1: 0.6358
 epoch: 59, train_loss: 0.3229, test_loss: 1.4416, test_f1: 0.6216
 epoch: 60, train_loss: 0.3034, test_loss: 1.5521, test_f1: 0.6227
 epoch: 61, train_loss: 0.3308, test_loss: 1.5470, test_f1: 0.6489
 epoch: 62, train_loss: 0.3173, test_loss: 1.3996, test_f1: 0.6397
 epoch: 63, train_loss: 0.3024, test_loss: 1.4906, test_f1: 0.6313
 epoch: 64, train_loss: 0.2931, test_loss: 1.4974, test_f1: 0.6426
 epoch: 65, train_loss: 0.2959, test_loss: 1.5653, test_f1: 0.6452
 epoch: 66, train_loss: 0.2914, test_loss: 1.5693, test_f1: 0.6471
 epoch: 67, train_loss: 0.2841, test_loss: 1.5474, test_f1: 0.6501
 epoch: 68, train_loss: 0.2943, test_loss: 1.7596, test_f1: 0.6263
 epoch: 69, train_loss: 0.2850, test_loss: 1.7178, test_f1: 0.6066
 epoch: 70, train_loss: 0.2832, test_loss: 1.5962, test_f1: 0.6361
 epoch: 71, train_loss: 0.2776, test_loss: 1.7167, test_f1: 0.6334
 epoch: 72, train_loss: 0.2643, test_loss: 1.6300, test_f1: 0.6298
 epoch: 73, train_loss: 0.2574, test_loss: 1.8092, test_f1: 0.6209
 epoch: 74, train_loss: 0.2689, test_loss: 1.6407, test_f1: 0.6385
 epoch: 75, train_loss: 0.2733, test_loss: 1.7682, test_f1: 0.6176
 epoch: 76, train_loss: 0.2852, test_loss: 1.7337, test_f1: 0.6297
 epoch: 77, train_loss: 0.2572, test_loss: 1.7054, test_f1: 0.6260
 epoch: 78, train_loss: 0.2511, test_loss: 1.6484, test_f1: 0.6499
 epoch: 79, train_loss: 0.2500, test_loss: 1.7047, test_f1: 0.6479
 epoch: 80, train_loss: 0.2501, test_loss: 1.8047, test_f1: 0.6498
 epoch: 81, train_loss: 0.2348, test_loss: 1.7784, test_f1: 0.6293
 epoch: 82, train_loss: 0.2393, test_loss: 1.7436, test_f1: 0.6267
 epoch: 83, train_loss: 0.2464, test_loss: 1.6664, test_f1: 0.6513
 epoch: 84, train_loss: 0.2348, test_loss: 1.6998, test_f1: 0.6333
 epoch: 85, train_loss: 0.2353, test_loss: 1.7381, test_f1: 0.6376
 epoch: 86, train_loss: 0.2355, test_loss: 1.9450, test_f1: 0.6112
 epoch: 87, train_loss: 0.2238, test_loss: 1.9064, test_f1: 0.6201
 epoch: 88, train_loss: 0.2293, test_loss: 1.9502, test_f1: 0.6398
 epoch: 89, train_loss: 0.2285, test_loss: 1.9182, test_f1: 0.6404
 epoch: 90, train_loss: 0.2287, test_loss: 1.9289, test_f1: 0.6208
 epoch: 91, train_loss: 0.2255, test_loss: 1.8926, test_f1: 0.6357
 epoch: 92, train_loss: 0.2137, test_loss: 1.9278, test_f1: 0.6428
 epoch: 93, train_loss: 0.2265, test_loss: 1.8976, test_f1: 0.6221
 epoch: 94, train_loss: 0.2305, test_loss: 1.7914, test_f1: 0.6278
 epoch: 95, train_loss: 0.2568, test_loss: 1.9461, test_f1: 0.6145
 epoch: 96, train_loss: 0.2392, test_loss: 1.9785, test_f1: 0.6080
 epoch: 97, train_loss: 0.2316, test_loss: 1.8562, test_f1: 0.6336
 epoch: 98, train_loss: 0.2274, test_loss: 1.9188, test_f1: 0.6300
 epoch: 99, train_loss: 0.2157, test_loss: 1.9930, test_f1: 0.6280

Training completed in 419.57 seconds
Best F1: 0.6909 at epoch 46
Mean F1 across iterations: 0.6691  0.0109
========================FINAL RESULTS================================
FEGIN weighted F1: 0.6909  0.0109
python main.py --data ltspice_examples --representation component_net --model FEGIN --layers 4 --hiddens 128 --batch_size 256 --lr 0.001 --emb_size 128 --epochs 100 --save_appendix component_net_L4_H128_BS256_LR0.001_E128 --no_val
-----



STDERR:
  File "main.py", line 370, in <module>
    main()
  File "main.py", line 254, in main
    dataset = dataset_class(
  File "/home/philip/projects/ltspice_examples_code_repo/Circuit-Completion-Using-GNNs/component_classification_with_link_prediction_head/evaluation/FEGIN/kernel/circuit_datasets.py", line 15, in __init__
    self.data, self.slices = torch.load(self.processed_paths[0])
  File "/home/philip/.local/lib/python3.8/site-packages/torch/serialization.py", line 1040, in load
    warnings.warn(
  File "/usr/lib/python3.8/warnings.py", line 109, in _showwarnmsg
    sw(msg.message, msg.category, msg.filename, msg.lineno,
  File "main.py", line 47, in warn_with_traceback
    traceback.print_stack(file=log)
/home/philip/projects/ltspice_examples_code_repo/Circuit-Completion-Using-GNNs/component_classification_with_link_prediction_head/evaluation/FEGIN/kernel/circuit_datasets.py:15: FutureWarning: You are using `torch.load` with `weights_only=False` (the current default value), which uses the default pickle module implicitly. It is possible to construct malicious pickle data which will execute arbitrary code during unpickling (See https://github.com/pytorch/pytorch/blob/main/SECURITY.md#untrusted-models for more details). In a future release, the default value for `weights_only` will be flipped to `True`. This limits the functions that could be executed during unpickling. Arbitrary objects will no longer be allowed to be loaded via this mode unless they are explicitly allowlisted by the user via `torch.serialization.add_safe_globals`. We recommend you start setting `weights_only=True` for any use case where you don't have full control of the loaded file. Please open an issue on GitHub for any issues related to this experimental feature.
  self.data, self.slices = torch.load(self.processed_paths[0])
