STDOUT:
Results will be saved in /home/philip/projects/llm_inference_code_repo/Circuit-Completion-Using-GNNs/component_classification_with_link_prediction_head/evaluation/FEGIN/results/model_FEGIN_dataset_ltspice_examples
Command line input: python main.py --data ltspice_examples --representation component_component --model FEGIN --layers 5 --hiddens 128 --batch_size 256 --lr 0.001 --emb_size 250 --epochs 100 --save_appendix component_component_L5_H128_BS256_LR0.001_E250 --no_val
 is saved.
-----
ltspice_examples - FEGIN
Using 5 layers, 128 hidden units, h = 2
Loading component_component representation dataset
ENTERED
Training FEGIN on component_component representation
Train: 3556, Test: 845
##################ITERATION #0 ****************************************
 epoch: 0, train_loss: 1.3071, test_loss: 1.2723, test_f1: 0.2589
 epoch: 1, train_loss: 1.1865, test_loss: 1.1912, test_f1: 0.3655
 epoch: 2, train_loss: 1.1154, test_loss: 1.0937, test_f1: 0.4503
 epoch: 3, train_loss: 1.0638, test_loss: 1.0658, test_f1: 0.4673
 epoch: 4, train_loss: 1.0190, test_loss: 1.0009, test_f1: 0.4966
 epoch: 5, train_loss: 0.9855, test_loss: 0.9960, test_f1: 0.5187
 epoch: 6, train_loss: 0.9645, test_loss: 1.0010, test_f1: 0.4712
 epoch: 7, train_loss: 0.9375, test_loss: 1.0001, test_f1: 0.5012
 epoch: 8, train_loss: 0.9020, test_loss: 1.1096, test_f1: 0.4785
 epoch: 9, train_loss: 0.8806, test_loss: 1.0018, test_f1: 0.5257
 epoch: 10, train_loss: 0.8600, test_loss: 1.0463, test_f1: 0.4918
 epoch: 11, train_loss: 0.8467, test_loss: 1.0472, test_f1: 0.4867
 epoch: 12, train_loss: 0.8241, test_loss: 1.0192, test_f1: 0.5496
 epoch: 13, train_loss: 0.8033, test_loss: 1.0787, test_f1: 0.5011
 epoch: 14, train_loss: 0.7891, test_loss: 1.1662, test_f1: 0.4732
 epoch: 15, train_loss: 0.7813, test_loss: 1.0600, test_f1: 0.5566
 epoch: 16, train_loss: 0.7372, test_loss: 1.1720, test_f1: 0.5292
 epoch: 17, train_loss: 0.7359, test_loss: 1.2590, test_f1: 0.4988
 epoch: 18, train_loss: 0.7301, test_loss: 1.1357, test_f1: 0.5028
 epoch: 19, train_loss: 0.7114, test_loss: 1.2993, test_f1: 0.4853
 epoch: 20, train_loss: 0.7080, test_loss: 1.3050, test_f1: 0.5044
 epoch: 21, train_loss: 0.6854, test_loss: 1.1770, test_f1: 0.5390
 epoch: 22, train_loss: 0.6756, test_loss: 1.3215, test_f1: 0.5205
 epoch: 23, train_loss: 0.6620, test_loss: 1.2616, test_f1: 0.5295
 epoch: 24, train_loss: 0.6436, test_loss: 1.3184, test_f1: 0.5362
 epoch: 25, train_loss: 0.6187, test_loss: 1.5840, test_f1: 0.5120
 epoch: 26, train_loss: 0.6398, test_loss: 1.4295, test_f1: 0.5103
 epoch: 27, train_loss: 0.6156, test_loss: 1.2968, test_f1: 0.5360
 epoch: 28, train_loss: 0.5728, test_loss: 1.2884, test_f1: 0.5473
 epoch: 29, train_loss: 0.5813, test_loss: 1.5070, test_f1: 0.5350
 epoch: 30, train_loss: 0.5629, test_loss: 1.5252, test_f1: 0.5265
 epoch: 31, train_loss: 0.5490, test_loss: 1.4560, test_f1: 0.5395
 epoch: 32, train_loss: 0.5522, test_loss: 1.7683, test_f1: 0.5078
 epoch: 33, train_loss: 0.5397, test_loss: 1.5788, test_f1: 0.5127
 epoch: 34, train_loss: 0.5434, test_loss: 1.4567, test_f1: 0.5382
 epoch: 35, train_loss: 0.5405, test_loss: 1.5663, test_f1: 0.5259
 epoch: 36, train_loss: 0.5214, test_loss: 1.5531, test_f1: 0.5135
 epoch: 37, train_loss: 0.5430, test_loss: 1.6276, test_f1: 0.5139
 epoch: 38, train_loss: 0.5317, test_loss: 1.4670, test_f1: 0.5241
 epoch: 39, train_loss: 0.4812, test_loss: 1.6280, test_f1: 0.5316
 epoch: 40, train_loss: 0.4715, test_loss: 1.8728, test_f1: 0.5249
 epoch: 41, train_loss: 0.4449, test_loss: 1.4830, test_f1: 0.5427
 epoch: 42, train_loss: 0.4504, test_loss: 1.8367, test_f1: 0.5321
 epoch: 43, train_loss: 0.4645, test_loss: 1.6340, test_f1: 0.5453
 epoch: 44, train_loss: 0.4375, test_loss: 1.8671, test_f1: 0.5192
 epoch: 45, train_loss: 0.4388, test_loss: 1.8660, test_f1: 0.5405
 epoch: 46, train_loss: 0.4541, test_loss: 1.7392, test_f1: 0.5298
 epoch: 47, train_loss: 0.4317, test_loss: 1.7397, test_f1: 0.5587
 epoch: 48, train_loss: 0.4184, test_loss: 1.8553, test_f1: 0.5192
 epoch: 49, train_loss: 0.4262, test_loss: 1.7864, test_f1: 0.5100
 epoch: 50, train_loss: 0.4123, test_loss: 1.9084, test_f1: 0.5364
 epoch: 51, train_loss: 0.3681, test_loss: 1.7886, test_f1: 0.5579
 epoch: 52, train_loss: 0.3413, test_loss: 2.0065, test_f1: 0.5332
 epoch: 53, train_loss: 0.3143, test_loss: 2.1106, test_f1: 0.5475
 epoch: 54, train_loss: 0.2979, test_loss: 2.1025, test_f1: 0.5438
 epoch: 55, train_loss: 0.2821, test_loss: 2.0924, test_f1: 0.5655
 epoch: 56, train_loss: 0.2994, test_loss: 2.3617, test_f1: 0.5280
 epoch: 57, train_loss: 0.3086, test_loss: 2.0933, test_f1: 0.5601
 epoch: 58, train_loss: 0.3075, test_loss: 2.3280, test_f1: 0.5388
 epoch: 59, train_loss: 0.2928, test_loss: 2.2905, test_f1: 0.5415
 epoch: 60, train_loss: 0.2915, test_loss: 2.3348, test_f1: 0.5070
 epoch: 61, train_loss: 0.2558, test_loss: 2.2840, test_f1: 0.5131
 epoch: 62, train_loss: 0.2607, test_loss: 2.3953, test_f1: 0.5413
 epoch: 63, train_loss: 0.2673, test_loss: 2.5275, test_f1: 0.5000
 epoch: 64, train_loss: 0.2681, test_loss: 2.3838, test_f1: 0.5384
 epoch: 65, train_loss: 0.2563, test_loss: 2.3098, test_f1: 0.5374
 epoch: 66, train_loss: 0.2450, test_loss: 2.2689, test_f1: 0.5451
 epoch: 67, train_loss: 0.2482, test_loss: 2.5526, test_f1: 0.5328
 epoch: 68, train_loss: 0.2469, test_loss: 2.4044, test_f1: 0.5402
 epoch: 69, train_loss: 0.2489, test_loss: 2.5045, test_f1: 0.5044
 epoch: 70, train_loss: 0.2385, test_loss: 2.4550, test_f1: 0.5348
 epoch: 71, train_loss: 0.2415, test_loss: 2.5093, test_f1: 0.5296
 epoch: 72, train_loss: 0.2227, test_loss: 2.3841, test_f1: 0.5199
 epoch: 73, train_loss: 0.2398, test_loss: 2.7408, test_f1: 0.5134
 epoch: 74, train_loss: 0.2292, test_loss: 2.3974, test_f1: 0.5419
 epoch: 75, train_loss: 0.2250, test_loss: 2.7820, test_f1: 0.5272
 epoch: 76, train_loss: 0.2184, test_loss: 2.6394, test_f1: 0.5554
 epoch: 77, train_loss: 0.2149, test_loss: 2.7955, test_f1: 0.5090
 epoch: 78, train_loss: 0.2331, test_loss: 2.7965, test_f1: 0.5151
 epoch: 79, train_loss: 0.2220, test_loss: 2.7913, test_f1: 0.5482
 epoch: 80, train_loss: 0.2157, test_loss: 2.5849, test_f1: 0.5356
 epoch: 81, train_loss: 0.2146, test_loss: 2.9307, test_f1: 0.5133
 epoch: 82, train_loss: 0.2063, test_loss: 2.9169, test_f1: 0.5414
 epoch: 83, train_loss: 0.1971, test_loss: 2.8207, test_f1: 0.5354
 epoch: 84, train_loss: 0.2060, test_loss: 2.8840, test_f1: 0.5513
 epoch: 85, train_loss: 0.2156, test_loss: 2.7265, test_f1: 0.5488
 epoch: 86, train_loss: 0.2042, test_loss: 2.9022, test_f1: 0.5297
 epoch: 87, train_loss: 0.2097, test_loss: 2.8586, test_f1: 0.5470
 epoch: 88, train_loss: 0.2156, test_loss: 3.0722, test_f1: 0.5181
 epoch: 89, train_loss: 0.2006, test_loss: 2.6558, test_f1: 0.5308
 epoch: 90, train_loss: 0.2003, test_loss: 2.8327, test_f1: 0.5251
 epoch: 91, train_loss: 0.1910, test_loss: 2.8421, test_f1: 0.5502
 epoch: 92, train_loss: 0.1716, test_loss: 2.8519, test_f1: 0.5409
 epoch: 93, train_loss: 0.1880, test_loss: 3.0314, test_f1: 0.5293
 epoch: 94, train_loss: 0.1769, test_loss: 3.0916, test_f1: 0.5212
 epoch: 95, train_loss: 0.1974, test_loss: 3.1466, test_f1: 0.5307
 epoch: 96, train_loss: 0.1854, test_loss: 3.0665, test_f1: 0.5297
 epoch: 97, train_loss: 0.1823, test_loss: 2.8190, test_f1: 0.5380
 epoch: 98, train_loss: 0.1796, test_loss: 2.9474, test_f1: 0.5587
 epoch: 99, train_loss: 0.1876, test_loss: 2.8962, test_f1: 0.5468
##################ITERATION #1 ****************************************
 epoch: 0, train_loss: 1.2504, test_loss: 1.2632, test_f1: 0.2274
 epoch: 1, train_loss: 1.1427, test_loss: 1.1697, test_f1: 0.3411
 epoch: 2, train_loss: 1.0826, test_loss: 1.0722, test_f1: 0.4374
 epoch: 3, train_loss: 1.0158, test_loss: 1.0301, test_f1: 0.4844
 epoch: 4, train_loss: 0.9804, test_loss: 1.0022, test_f1: 0.4617
 epoch: 5, train_loss: 0.9356, test_loss: 0.9438, test_f1: 0.5182
 epoch: 6, train_loss: 0.9090, test_loss: 1.0347, test_f1: 0.5079
 epoch: 7, train_loss: 0.8986, test_loss: 1.0229, test_f1: 0.4607
 epoch: 8, train_loss: 0.8351, test_loss: 1.0878, test_f1: 0.4800
 epoch: 9, train_loss: 0.8454, test_loss: 1.1466, test_f1: 0.5111
 epoch: 10, train_loss: 0.8106, test_loss: 1.0770, test_f1: 0.5220
 epoch: 11, train_loss: 0.7950, test_loss: 1.1301, test_f1: 0.5362
 epoch: 12, train_loss: 0.7802, test_loss: 1.2308, test_f1: 0.4945
 epoch: 13, train_loss: 0.7866, test_loss: 1.1818, test_f1: 0.4852
 epoch: 14, train_loss: 0.7705, test_loss: 1.2095, test_f1: 0.5198
 epoch: 15, train_loss: 0.7522, test_loss: 1.0895, test_f1: 0.5030
 epoch: 16, train_loss: 0.7194, test_loss: 1.1718, test_f1: 0.5320
 epoch: 17, train_loss: 0.6993, test_loss: 1.4877, test_f1: 0.4683
 epoch: 18, train_loss: 0.6863, test_loss: 1.3040, test_f1: 0.5106
 epoch: 19, train_loss: 0.6852, test_loss: 1.2961, test_f1: 0.5181
 epoch: 20, train_loss: 0.6591, test_loss: 1.1998, test_f1: 0.5270
 epoch: 21, train_loss: 0.6660, test_loss: 1.3701, test_f1: 0.5323
 epoch: 22, train_loss: 0.6376, test_loss: 1.3102, test_f1: 0.4856
 epoch: 23, train_loss: 0.6455, test_loss: 1.5390, test_f1: 0.5080
 epoch: 24, train_loss: 0.6569, test_loss: 1.3408, test_f1: 0.5090
 epoch: 25, train_loss: 0.5953, test_loss: 1.4637, test_f1: 0.5474
 epoch: 26, train_loss: 0.5798, test_loss: 1.6130, test_f1: 0.5116
 epoch: 27, train_loss: 0.5754, test_loss: 1.4784, test_f1: 0.5314
 epoch: 28, train_loss: 0.5733, test_loss: 1.8972, test_f1: 0.4705
 epoch: 29, train_loss: 0.5662, test_loss: 1.4285, test_f1: 0.4991
 epoch: 30, train_loss: 0.5623, test_loss: 1.5963, test_f1: 0.5400
 epoch: 31, train_loss: 0.5499, test_loss: 1.6980, test_f1: 0.5274
 epoch: 32, train_loss: 0.5342, test_loss: 1.5804, test_f1: 0.5192
 epoch: 33, train_loss: 0.5287, test_loss: 1.5392, test_f1: 0.5564
 epoch: 34, train_loss: 0.4843, test_loss: 1.6408, test_f1: 0.5312
 epoch: 35, train_loss: 0.5086, test_loss: 1.6609, test_f1: 0.4866
 epoch: 36, train_loss: 0.5277, test_loss: 1.7455, test_f1: 0.5156
 epoch: 37, train_loss: 0.4803, test_loss: 1.6206, test_f1: 0.5726
 epoch: 38, train_loss: 0.4788, test_loss: 1.7765, test_f1: 0.5225
 epoch: 39, train_loss: 0.4513, test_loss: 1.8501, test_f1: 0.4964
 epoch: 40, train_loss: 0.4635, test_loss: 1.8257, test_f1: 0.5278
 epoch: 41, train_loss: 0.4555, test_loss: 1.9354, test_f1: 0.5406
 epoch: 42, train_loss: 0.4748, test_loss: 1.7554, test_f1: 0.5056
 epoch: 43, train_loss: 0.4245, test_loss: 1.7843, test_f1: 0.5202
 epoch: 44, train_loss: 0.4332, test_loss: 1.9412, test_f1: 0.5388
 epoch: 45, train_loss: 0.4322, test_loss: 1.8756, test_f1: 0.5338
 epoch: 46, train_loss: 0.4345, test_loss: 2.2598, test_f1: 0.4996
 epoch: 47, train_loss: 0.4140, test_loss: 2.1476, test_f1: 0.5329
 epoch: 48, train_loss: 0.4047, test_loss: 1.7313, test_f1: 0.5379
 epoch: 49, train_loss: 0.3923, test_loss: 1.8011, test_f1: 0.5554
 epoch: 50, train_loss: 0.4026, test_loss: 1.9085, test_f1: 0.5370
 epoch: 51, train_loss: 0.3551, test_loss: 1.8510, test_f1: 0.5575
 epoch: 52, train_loss: 0.3089, test_loss: 1.9905, test_f1: 0.5468
 epoch: 53, train_loss: 0.3106, test_loss: 2.1024, test_f1: 0.5576
 epoch: 54, train_loss: 0.2926, test_loss: 2.1445, test_f1: 0.5458
 epoch: 55, train_loss: 0.2710, test_loss: 2.2292, test_f1: 0.5463
 epoch: 56, train_loss: 0.2616, test_loss: 2.3488, test_f1: 0.5416
 epoch: 57, train_loss: 0.2577, test_loss: 2.3725, test_f1: 0.5443
 epoch: 58, train_loss: 0.2610, test_loss: 2.2751, test_f1: 0.5581
 epoch: 59, train_loss: 0.2518, test_loss: 2.4062, test_f1: 0.5547
 epoch: 60, train_loss: 0.2696, test_loss: 2.5371, test_f1: 0.5255
 epoch: 61, train_loss: 0.2454, test_loss: 2.3964, test_f1: 0.5392
 epoch: 62, train_loss: 0.2716, test_loss: 2.4200, test_f1: 0.5529
 epoch: 63, train_loss: 0.2575, test_loss: 2.5432, test_f1: 0.5540
 epoch: 64, train_loss: 0.2577, test_loss: 2.4929, test_f1: 0.5577
 epoch: 65, train_loss: 0.2520, test_loss: 2.6170, test_f1: 0.5321
 epoch: 66, train_loss: 0.2335, test_loss: 2.4939, test_f1: 0.5502
 epoch: 67, train_loss: 0.2373, test_loss: 2.3944, test_f1: 0.5576
 epoch: 68, train_loss: 0.2405, test_loss: 2.5579, test_f1: 0.5420
 epoch: 69, train_loss: 0.2491, test_loss: 2.5080, test_f1: 0.5426
 epoch: 70, train_loss: 0.2404, test_loss: 2.5023, test_f1: 0.5425
 epoch: 71, train_loss: 0.2294, test_loss: 2.5032, test_f1: 0.5569
 epoch: 72, train_loss: 0.2141, test_loss: 2.7435, test_f1: 0.5357
 epoch: 73, train_loss: 0.2255, test_loss: 2.6381, test_f1: 0.5486
 epoch: 74, train_loss: 0.2037, test_loss: 2.5894, test_f1: 0.5514
 epoch: 75, train_loss: 0.1916, test_loss: 2.7761, test_f1: 0.5414
 epoch: 76, train_loss: 0.1931, test_loss: 2.7361, test_f1: 0.5610
 epoch: 77, train_loss: 0.2252, test_loss: 2.8706, test_f1: 0.5457
 epoch: 78, train_loss: 0.2168, test_loss: 2.9844, test_f1: 0.5488
 epoch: 79, train_loss: 0.2188, test_loss: 2.9421, test_f1: 0.5376
 epoch: 80, train_loss: 0.1998, test_loss: 2.8379, test_f1: 0.5434
 epoch: 81, train_loss: 0.2073, test_loss: 2.9273, test_f1: 0.5260
 epoch: 82, train_loss: 0.2094, test_loss: 2.9617, test_f1: 0.5366
 epoch: 83, train_loss: 0.2020, test_loss: 2.9149, test_f1: 0.5390
 epoch: 84, train_loss: 0.2099, test_loss: 2.9944, test_f1: 0.5450
 epoch: 85, train_loss: 0.1950, test_loss: 2.9656, test_f1: 0.5388
 epoch: 86, train_loss: 0.1804, test_loss: 2.9491, test_f1: 0.5449
 epoch: 87, train_loss: 0.1817, test_loss: 3.0099, test_f1: 0.5429
 epoch: 88, train_loss: 0.1804, test_loss: 2.9020, test_f1: 0.5452
 epoch: 89, train_loss: 0.1962, test_loss: 3.0097, test_f1: 0.5453
 epoch: 90, train_loss: 0.1917, test_loss: 2.8474, test_f1: 0.5355
 epoch: 91, train_loss: 0.2137, test_loss: 3.3367, test_f1: 0.5278
 epoch: 92, train_loss: 0.1900, test_loss: 3.3593, test_f1: 0.5019
 epoch: 93, train_loss: 0.1673, test_loss: 3.2420, test_f1: 0.5286
 epoch: 94, train_loss: 0.1952, test_loss: 3.1204, test_f1: 0.5289
 epoch: 95, train_loss: 0.1919, test_loss: 3.0167, test_f1: 0.5282
 epoch: 96, train_loss: 0.1747, test_loss: 2.9476, test_f1: 0.5284
 epoch: 97, train_loss: 0.1627, test_loss: 3.0443, test_f1: 0.5338
 epoch: 98, train_loss: 0.1628, test_loss: 3.2166, test_f1: 0.5452
 epoch: 99, train_loss: 0.1720, test_loss: 3.0532, test_f1: 0.5307
##################ITERATION #2 ****************************************
 epoch: 0, train_loss: 1.2621, test_loss: 1.2847, test_f1: 0.3163
 epoch: 1, train_loss: 1.1355, test_loss: 1.1824, test_f1: 0.4017
 epoch: 2, train_loss: 1.0973, test_loss: 1.0867, test_f1: 0.4901
 epoch: 3, train_loss: 1.0357, test_loss: 1.0478, test_f1: 0.4686
 epoch: 4, train_loss: 1.0120, test_loss: 1.0424, test_f1: 0.4593
 epoch: 5, train_loss: 0.9622, test_loss: 1.0012, test_f1: 0.5098
 epoch: 6, train_loss: 0.9319, test_loss: 1.0108, test_f1: 0.5060
 epoch: 7, train_loss: 0.9012, test_loss: 1.0647, test_f1: 0.5025
 epoch: 8, train_loss: 0.9068, test_loss: 1.0079, test_f1: 0.5237
 epoch: 9, train_loss: 0.8793, test_loss: 1.0161, test_f1: 0.5207
 epoch: 10, train_loss: 0.8531, test_loss: 1.0155, test_f1: 0.4943
 epoch: 11, train_loss: 0.8298, test_loss: 0.9556, test_f1: 0.5517
 epoch: 12, train_loss: 0.8239, test_loss: 1.0565, test_f1: 0.5167
 epoch: 13, train_loss: 0.8174, test_loss: 1.1676, test_f1: 0.5107
 epoch: 14, train_loss: 0.7637, test_loss: 1.1828, test_f1: 0.5298
 epoch: 15, train_loss: 0.7490, test_loss: 1.1220, test_f1: 0.4996
 epoch: 16, train_loss: 0.7254, test_loss: 1.1180, test_f1: 0.5334
 epoch: 17, train_loss: 0.7339, test_loss: 1.1416, test_f1: 0.5406
 epoch: 18, train_loss: 0.7250, test_loss: 1.2200, test_f1: 0.4925
 epoch: 19, train_loss: 0.7057, test_loss: 1.1785, test_f1: 0.5051
 epoch: 20, train_loss: 0.6849, test_loss: 1.3718, test_f1: 0.5101
 epoch: 21, train_loss: 0.6859, test_loss: 1.2665, test_f1: 0.5186
 epoch: 22, train_loss: 0.6614, test_loss: 1.2828, test_f1: 0.4993
 epoch: 23, train_loss: 0.6384, test_loss: 1.2837, test_f1: 0.5078
 epoch: 24, train_loss: 0.6464, test_loss: 1.2803, test_f1: 0.5026
 epoch: 25, train_loss: 0.6435, test_loss: 1.3614, test_f1: 0.5059
 epoch: 26, train_loss: 0.6264, test_loss: 1.3539, test_f1: 0.5147
 epoch: 27, train_loss: 0.6042, test_loss: 1.3843, test_f1: 0.5165
 epoch: 28, train_loss: 0.5953, test_loss: 1.6012, test_f1: 0.5255
 epoch: 29, train_loss: 0.5926, test_loss: 1.3206, test_f1: 0.5393
 epoch: 30, train_loss: 0.5705, test_loss: 1.4001, test_f1: 0.5335
 epoch: 31, train_loss: 0.5547, test_loss: 1.4360, test_f1: 0.5304
 epoch: 32, train_loss: 0.5310, test_loss: 1.3824, test_f1: 0.5183
 epoch: 33, train_loss: 0.5266, test_loss: 1.5302, test_f1: 0.5159
 epoch: 34, train_loss: 0.5010, test_loss: 1.4983, test_f1: 0.5552
 epoch: 35, train_loss: 0.5017, test_loss: 1.8387, test_f1: 0.5144
 epoch: 36, train_loss: 0.4966, test_loss: 1.4645, test_f1: 0.5265
 epoch: 37, train_loss: 0.5067, test_loss: 1.6212, test_f1: 0.5085
 epoch: 38, train_loss: 0.5396, test_loss: 1.6556, test_f1: 0.5225
 epoch: 39, train_loss: 0.5115, test_loss: 1.4722, test_f1: 0.5036
 epoch: 40, train_loss: 0.4661, test_loss: 1.6534, test_f1: 0.5436
 epoch: 41, train_loss: 0.4408, test_loss: 1.9054, test_f1: 0.4632
 epoch: 42, train_loss: 0.4430, test_loss: 1.7919, test_f1: 0.5487
 epoch: 43, train_loss: 0.4437, test_loss: 1.7721, test_f1: 0.4938
 epoch: 44, train_loss: 0.4479, test_loss: 1.7829, test_f1: 0.5405
 epoch: 45, train_loss: 0.4303, test_loss: 1.8143, test_f1: 0.5090
 epoch: 46, train_loss: 0.4121, test_loss: 1.8499, test_f1: 0.5071
 epoch: 47, train_loss: 0.4168, test_loss: 1.9666, test_f1: 0.5107
 epoch: 48, train_loss: 0.4400, test_loss: 2.0341, test_f1: 0.4669
 epoch: 49, train_loss: 0.4332, test_loss: 2.1103, test_f1: 0.5131
 epoch: 50, train_loss: 0.4244, test_loss: 1.8502, test_f1: 0.5262
 epoch: 51, train_loss: 0.3724, test_loss: 1.9045, test_f1: 0.5227
 epoch: 52, train_loss: 0.3303, test_loss: 1.7951, test_f1: 0.5196
 epoch: 53, train_loss: 0.3099, test_loss: 2.1996, test_f1: 0.5081
 epoch: 54, train_loss: 0.2972, test_loss: 2.1318, test_f1: 0.5291
 epoch: 55, train_loss: 0.2923, test_loss: 2.0855, test_f1: 0.5480
 epoch: 56, train_loss: 0.2897, test_loss: 2.0771, test_f1: 0.5284
 epoch: 57, train_loss: 0.2898, test_loss: 2.2710, test_f1: 0.4970
 epoch: 58, train_loss: 0.2927, test_loss: 2.2814, test_f1: 0.5140
 epoch: 59, train_loss: 0.2708, test_loss: 2.2675, test_f1: 0.5020
 epoch: 60, train_loss: 0.2942, test_loss: 2.4569, test_f1: 0.5241
 epoch: 61, train_loss: 0.2897, test_loss: 2.2657, test_f1: 0.5328
 epoch: 62, train_loss: 0.2677, test_loss: 2.2594, test_f1: 0.5187
 epoch: 63, train_loss: 0.2884, test_loss: 2.3137, test_f1: 0.5381
 epoch: 64, train_loss: 0.2695, test_loss: 2.4703, test_f1: 0.4924
 epoch: 65, train_loss: 0.2607, test_loss: 2.4138, test_f1: 0.5011
 epoch: 66, train_loss: 0.2700, test_loss: 2.2124, test_f1: 0.5308
 epoch: 67, train_loss: 0.2674, test_loss: 2.4752, test_f1: 0.5321
 epoch: 68, train_loss: 0.2366, test_loss: 2.3523, test_f1: 0.5331
 epoch: 69, train_loss: 0.2432, test_loss: 2.4329, test_f1: 0.5266
 epoch: 70, train_loss: 0.2380, test_loss: 2.6778, test_f1: 0.5141
 epoch: 71, train_loss: 0.2445, test_loss: 2.5290, test_f1: 0.5132
 epoch: 72, train_loss: 0.2568, test_loss: 2.3778, test_f1: 0.5376
 epoch: 73, train_loss: 0.2418, test_loss: 2.4284, test_f1: 0.5093
 epoch: 74, train_loss: 0.2268, test_loss: 2.6163, test_f1: 0.5137
 epoch: 75, train_loss: 0.2214, test_loss: 2.9540, test_f1: 0.4965
 epoch: 76, train_loss: 0.2361, test_loss: 2.6638, test_f1: 0.5272
 epoch: 77, train_loss: 0.2436, test_loss: 2.4539, test_f1: 0.4989
 epoch: 78, train_loss: 0.2375, test_loss: 2.4040, test_f1: 0.5537
 epoch: 79, train_loss: 0.2221, test_loss: 2.9607, test_f1: 0.4984
 epoch: 80, train_loss: 0.2201, test_loss: 2.6466, test_f1: 0.5234
 epoch: 81, train_loss: 0.2200, test_loss: 2.5580, test_f1: 0.5189
 epoch: 82, train_loss: 0.2204, test_loss: 2.5230, test_f1: 0.5310
 epoch: 83, train_loss: 0.2334, test_loss: 2.7380, test_f1: 0.5099
 epoch: 84, train_loss: 0.2076, test_loss: 2.6330, test_f1: 0.5316
 epoch: 85, train_loss: 0.2116, test_loss: 2.6315, test_f1: 0.5375
 epoch: 86, train_loss: 0.2245, test_loss: 2.9829, test_f1: 0.5084
 epoch: 87, train_loss: 0.2256, test_loss: 2.6529, test_f1: 0.5126
 epoch: 88, train_loss: 0.2206, test_loss: 2.9335, test_f1: 0.5140
 epoch: 89, train_loss: 0.2121, test_loss: 2.6472, test_f1: 0.5166
 epoch: 90, train_loss: 0.2203, test_loss: 2.4867, test_f1: 0.5452
 epoch: 91, train_loss: 0.1895, test_loss: 2.7694, test_f1: 0.5250
 epoch: 92, train_loss: 0.2014, test_loss: 2.6139, test_f1: 0.5212
 epoch: 93, train_loss: 0.2020, test_loss: 2.5510, test_f1: 0.5648
 epoch: 94, train_loss: 0.1899, test_loss: 2.8642, test_f1: 0.4893
 epoch: 95, train_loss: 0.1840, test_loss: 2.8185, test_f1: 0.5345
 epoch: 96, train_loss: 0.1889, test_loss: 2.8310, test_f1: 0.5349
 epoch: 97, train_loss: 0.2029, test_loss: 2.9567, test_f1: 0.5385
 epoch: 98, train_loss: 0.1758, test_loss: 2.9791, test_f1: 0.4997
 epoch: 99, train_loss: 0.1800, test_loss: 2.9673, test_f1: 0.5300
##################ITERATION #3 ****************************************
 epoch: 0, train_loss: 1.3084, test_loss: 1.3023, test_f1: 0.2747
 epoch: 1, train_loss: 1.1607, test_loss: 1.2394, test_f1: 0.3496
 epoch: 2, train_loss: 1.1032, test_loss: 1.1351, test_f1: 0.4366
 epoch: 3, train_loss: 1.0411, test_loss: 1.0440, test_f1: 0.4394
 epoch: 4, train_loss: 1.0041, test_loss: 1.0139, test_f1: 0.4867
 epoch: 5, train_loss: 0.9927, test_loss: 1.0408, test_f1: 0.4693
 epoch: 6, train_loss: 0.9344, test_loss: 1.0019, test_f1: 0.5034
 epoch: 7, train_loss: 0.9257, test_loss: 1.0487, test_f1: 0.4894
 epoch: 8, train_loss: 0.9154, test_loss: 0.9893, test_f1: 0.5243
 epoch: 9, train_loss: 0.8750, test_loss: 1.0358, test_f1: 0.5135
 epoch: 10, train_loss: 0.8682, test_loss: 1.0514, test_f1: 0.5055
 epoch: 11, train_loss: 0.8420, test_loss: 1.0328, test_f1: 0.5252
 epoch: 12, train_loss: 0.8435, test_loss: 1.1483, test_f1: 0.4961
 epoch: 13, train_loss: 0.8241, test_loss: 1.1012, test_f1: 0.5118
 epoch: 14, train_loss: 0.7731, test_loss: 1.2426, test_f1: 0.4850
 epoch: 15, train_loss: 0.7511, test_loss: 1.3295, test_f1: 0.4918
 epoch: 16, train_loss: 0.7564, test_loss: 1.2214, test_f1: 0.5242
 epoch: 17, train_loss: 0.7641, test_loss: 1.1673, test_f1: 0.5405
 epoch: 18, train_loss: 0.7295, test_loss: 1.1493, test_f1: 0.5133
 epoch: 19, train_loss: 0.7141, test_loss: 1.3324, test_f1: 0.5211
 epoch: 20, train_loss: 0.7154, test_loss: 1.5410, test_f1: 0.5104
 epoch: 21, train_loss: 0.6962, test_loss: 1.1874, test_f1: 0.5678
 epoch: 22, train_loss: 0.6602, test_loss: 1.2464, test_f1: 0.5191
 epoch: 23, train_loss: 0.6574, test_loss: 1.4915, test_f1: 0.4900
 epoch: 24, train_loss: 0.6535, test_loss: 1.4572, test_f1: 0.4954
 epoch: 25, train_loss: 0.6311, test_loss: 1.3588, test_f1: 0.5298
 epoch: 26, train_loss: 0.6245, test_loss: 1.5158, test_f1: 0.5173
 epoch: 27, train_loss: 0.6231, test_loss: 1.2768, test_f1: 0.5181
 epoch: 28, train_loss: 0.6045, test_loss: 1.4929, test_f1: 0.5059
 epoch: 29, train_loss: 0.5913, test_loss: 1.4714, test_f1: 0.5237
 epoch: 30, train_loss: 0.5808, test_loss: 1.4736, test_f1: 0.5308
 epoch: 31, train_loss: 0.5858, test_loss: 1.3256, test_f1: 0.5444
 epoch: 32, train_loss: 0.5744, test_loss: 1.5033, test_f1: 0.5201
 epoch: 33, train_loss: 0.5436, test_loss: 1.4618, test_f1: 0.5206
 epoch: 34, train_loss: 0.5448, test_loss: 1.5325, test_f1: 0.5171
 epoch: 35, train_loss: 0.5646, test_loss: 1.6326, test_f1: 0.5450
 epoch: 36, train_loss: 0.5313, test_loss: 1.5423, test_f1: 0.5314
 epoch: 37, train_loss: 0.5319, test_loss: 1.6729, test_f1: 0.5162
 epoch: 38, train_loss: 0.5262, test_loss: 1.7762, test_f1: 0.5242
 epoch: 39, train_loss: 0.4941, test_loss: 1.6379, test_f1: 0.5218
 epoch: 40, train_loss: 0.5132, test_loss: 1.6224, test_f1: 0.5355
 epoch: 41, train_loss: 0.5002, test_loss: 1.7005, test_f1: 0.5121
 epoch: 42, train_loss: 0.5118, test_loss: 1.8498, test_f1: 0.5046
 epoch: 43, train_loss: 0.4875, test_loss: 1.5273, test_f1: 0.5463
 epoch: 44, train_loss: 0.4827, test_loss: 1.6153, test_f1: 0.5640
 epoch: 45, train_loss: 0.4698, test_loss: 1.7896, test_f1: 0.5088
 epoch: 46, train_loss: 0.4543, test_loss: 1.8077, test_f1: 0.5408
 epoch: 47, train_loss: 0.4596, test_loss: 1.8477, test_f1: 0.4967
 epoch: 48, train_loss: 0.4618, test_loss: 1.5954, test_f1: 0.5278
 epoch: 49, train_loss: 0.4385, test_loss: 1.8885, test_f1: 0.5209
 epoch: 50, train_loss: 0.4619, test_loss: 2.0111, test_f1: 0.5275
 epoch: 51, train_loss: 0.4099, test_loss: 1.9104, test_f1: 0.5445
 epoch: 52, train_loss: 0.3535, test_loss: 1.7493, test_f1: 0.5418
 epoch: 53, train_loss: 0.3335, test_loss: 1.9662, test_f1: 0.5378
 epoch: 54, train_loss: 0.3295, test_loss: 2.1274, test_f1: 0.5328
 epoch: 55, train_loss: 0.3218, test_loss: 2.1550, test_f1: 0.5040
 epoch: 56, train_loss: 0.3102, test_loss: 2.2040, test_f1: 0.5239
 epoch: 57, train_loss: 0.3106, test_loss: 2.1152, test_f1: 0.5435
 epoch: 58, train_loss: 0.3340, test_loss: 2.1497, test_f1: 0.5255
 epoch: 59, train_loss: 0.3071, test_loss: 2.2003, test_f1: 0.5099
 epoch: 60, train_loss: 0.2999, test_loss: 2.3902, test_f1: 0.5215
 epoch: 61, train_loss: 0.2846, test_loss: 2.2710, test_f1: 0.5084
 epoch: 62, train_loss: 0.2856, test_loss: 2.5563, test_f1: 0.5098
 epoch: 63, train_loss: 0.2742, test_loss: 2.3637, test_f1: 0.5231
 epoch: 64, train_loss: 0.3030, test_loss: 2.4016, test_f1: 0.5252
 epoch: 65, train_loss: 0.2930, test_loss: 2.4818, test_f1: 0.5059
 epoch: 66, train_loss: 0.2801, test_loss: 2.4001, test_f1: 0.5475
 epoch: 67, train_loss: 0.2645, test_loss: 2.4831, test_f1: 0.5178
 epoch: 68, train_loss: 0.2561, test_loss: 2.4809, test_f1: 0.5022
 epoch: 69, train_loss: 0.2418, test_loss: 2.7100, test_f1: 0.5157
 epoch: 70, train_loss: 0.2699, test_loss: 2.5484, test_f1: 0.5120
 epoch: 71, train_loss: 0.2638, test_loss: 2.4965, test_f1: 0.5196
 epoch: 72, train_loss: 0.2444, test_loss: 2.7567, test_f1: 0.5148
 epoch: 73, train_loss: 0.2486, test_loss: 2.7038, test_f1: 0.5148
 epoch: 74, train_loss: 0.2592, test_loss: 2.9083, test_f1: 0.4909
 epoch: 75, train_loss: 0.2665, test_loss: 2.7410, test_f1: 0.5271
 epoch: 76, train_loss: 0.2449, test_loss: 2.7957, test_f1: 0.5129
 epoch: 77, train_loss: 0.2507, test_loss: 2.8340, test_f1: 0.5146
 epoch: 78, train_loss: 0.2413, test_loss: 2.9841, test_f1: 0.4968
 epoch: 79, train_loss: 0.2446, test_loss: 2.8738, test_f1: 0.4949
 epoch: 80, train_loss: 0.2281, test_loss: 2.7797, test_f1: 0.5266
 epoch: 81, train_loss: 0.2411, test_loss: 2.8971, test_f1: 0.5241
 epoch: 82, train_loss: 0.2442, test_loss: 2.7948, test_f1: 0.5247
 epoch: 83, train_loss: 0.2439, test_loss: 2.7154, test_f1: 0.5135
 epoch: 84, train_loss: 0.2371, test_loss: 2.7663, test_f1: 0.5051
 epoch: 85, train_loss: 0.2157, test_loss: 2.6818, test_f1: 0.4912
 epoch: 86, train_loss: 0.2164, test_loss: 2.9511, test_f1: 0.4902
 epoch: 87, train_loss: 0.2087, test_loss: 2.8184, test_f1: 0.5101
 epoch: 88, train_loss: 0.2153, test_loss: 3.3076, test_f1: 0.5083
 epoch: 89, train_loss: 0.2084, test_loss: 2.9160, test_f1: 0.5183
 epoch: 90, train_loss: 0.2104, test_loss: 2.7522, test_f1: 0.5267
 epoch: 91, train_loss: 0.2251, test_loss: 2.7528, test_f1: 0.5222
 epoch: 92, train_loss: 0.2149, test_loss: 2.9694, test_f1: 0.4887
 epoch: 93, train_loss: 0.2219, test_loss: 3.1508, test_f1: 0.4834
 epoch: 94, train_loss: 0.2170, test_loss: 2.9110, test_f1: 0.5172
 epoch: 95, train_loss: 0.2026, test_loss: 3.0677, test_f1: 0.5055
 epoch: 96, train_loss: 0.2065, test_loss: 3.2859, test_f1: 0.5093
 epoch: 97, train_loss: 0.1933, test_loss: 2.9295, test_f1: 0.4977
 epoch: 98, train_loss: 0.1948, test_loss: 3.0618, test_f1: 0.4922
 epoch: 99, train_loss: 0.1823, test_loss: 3.2335, test_f1: 0.5083
##################ITERATION #4 ****************************************
 epoch: 0, train_loss: 1.3702, test_loss: 1.3060, test_f1: 0.3293
 epoch: 1, train_loss: 1.1928, test_loss: 1.2022, test_f1: 0.3328
 epoch: 2, train_loss: 1.1040, test_loss: 1.1115, test_f1: 0.4573
 epoch: 3, train_loss: 1.0603, test_loss: 1.0615, test_f1: 0.4654
 epoch: 4, train_loss: 1.0178, test_loss: 1.0241, test_f1: 0.4661
 epoch: 5, train_loss: 0.9818, test_loss: 1.0208, test_f1: 0.5024
 epoch: 6, train_loss: 0.9374, test_loss: 1.0249, test_f1: 0.4901
 epoch: 7, train_loss: 0.9298, test_loss: 1.0561, test_f1: 0.5210
 epoch: 8, train_loss: 0.9071, test_loss: 1.0917, test_f1: 0.4715
 epoch: 9, train_loss: 0.8833, test_loss: 1.0351, test_f1: 0.5056
 epoch: 10, train_loss: 0.8554, test_loss: 1.0404, test_f1: 0.4904
 epoch: 11, train_loss: 0.8225, test_loss: 1.0081, test_f1: 0.4984
 epoch: 12, train_loss: 0.8135, test_loss: 1.2239, test_f1: 0.4787
 epoch: 13, train_loss: 0.7946, test_loss: 1.1236, test_f1: 0.5270
 epoch: 14, train_loss: 0.7752, test_loss: 1.1506, test_f1: 0.4935
 epoch: 15, train_loss: 0.7644, test_loss: 1.1728, test_f1: 0.5048
 epoch: 16, train_loss: 0.7699, test_loss: 1.2419, test_f1: 0.5066
 epoch: 17, train_loss: 0.7317, test_loss: 1.1086, test_f1: 0.5197
 epoch: 18, train_loss: 0.7261, test_loss: 1.2928, test_f1: 0.5138
 epoch: 19, train_loss: 0.7115, test_loss: 1.2623, test_f1: 0.5096
 epoch: 20, train_loss: 0.6977, test_loss: 1.3087, test_f1: 0.5229
 epoch: 21, train_loss: 0.6759, test_loss: 1.2461, test_f1: 0.5635
 epoch: 22, train_loss: 0.6609, test_loss: 1.2261, test_f1: 0.5266
 epoch: 23, train_loss: 0.6486, test_loss: 1.2798, test_f1: 0.5442
 epoch: 24, train_loss: 0.6388, test_loss: 1.3737, test_f1: 0.5163
 epoch: 25, train_loss: 0.6522, test_loss: 1.2606, test_f1: 0.5219
 epoch: 26, train_loss: 0.6248, test_loss: 1.4147, test_f1: 0.5459
 epoch: 27, train_loss: 0.6155, test_loss: 1.4330, test_f1: 0.5152
 epoch: 28, train_loss: 0.5898, test_loss: 1.4384, test_f1: 0.5310
 epoch: 29, train_loss: 0.5852, test_loss: 1.4156, test_f1: 0.5380
 epoch: 30, train_loss: 0.5788, test_loss: 1.4458, test_f1: 0.5362
 epoch: 31, train_loss: 0.5645, test_loss: 1.5452, test_f1: 0.5253
 epoch: 32, train_loss: 0.5398, test_loss: 1.4839, test_f1: 0.5149
 epoch: 33, train_loss: 0.5425, test_loss: 1.5525, test_f1: 0.5331
 epoch: 34, train_loss: 0.5336, test_loss: 1.6347, test_f1: 0.5140
 epoch: 35, train_loss: 0.5192, test_loss: 1.7085, test_f1: 0.5205
 epoch: 36, train_loss: 0.5099, test_loss: 1.7616, test_f1: 0.5260
 epoch: 37, train_loss: 0.5122, test_loss: 1.6333, test_f1: 0.5203
 epoch: 38, train_loss: 0.4778, test_loss: 1.7632, test_f1: 0.5150
 epoch: 39, train_loss: 0.4757, test_loss: 1.7984, test_f1: 0.5502
 epoch: 40, train_loss: 0.4941, test_loss: 1.6176, test_f1: 0.5127
 epoch: 41, train_loss: 0.4647, test_loss: 1.8414, test_f1: 0.5013
 epoch: 42, train_loss: 0.4686, test_loss: 2.1224, test_f1: 0.4830
 epoch: 43, train_loss: 0.4978, test_loss: 1.8437, test_f1: 0.5299
 epoch: 44, train_loss: 0.4814, test_loss: 1.6174, test_f1: 0.5228
 epoch: 45, train_loss: 0.4498, test_loss: 1.7405, test_f1: 0.5351
 epoch: 46, train_loss: 0.4320, test_loss: 1.6666, test_f1: 0.5532
 epoch: 47, train_loss: 0.4360, test_loss: 1.8260, test_f1: 0.5388
 epoch: 48, train_loss: 0.4382, test_loss: 1.9673, test_f1: 0.5262
 epoch: 49, train_loss: 0.4182, test_loss: 1.8028, test_f1: 0.5174
 epoch: 50, train_loss: 0.4112, test_loss: 1.9436, test_f1: 0.5286
 epoch: 51, train_loss: 0.3825, test_loss: 1.9549, test_f1: 0.5538
 epoch: 52, train_loss: 0.3520, test_loss: 1.8807, test_f1: 0.5304
 epoch: 53, train_loss: 0.3220, test_loss: 2.1498, test_f1: 0.5637
 epoch: 54, train_loss: 0.3073, test_loss: 2.1492, test_f1: 0.5269
 epoch: 55, train_loss: 0.3102, test_loss: 2.2141, test_f1: 0.5336
 epoch: 56, train_loss: 0.2905, test_loss: 2.2453, test_f1: 0.5380
 epoch: 57, train_loss: 0.2893, test_loss: 2.2947, test_f1: 0.5547
 epoch: 58, train_loss: 0.2920, test_loss: 2.5590, test_f1: 0.5292
 epoch: 59, train_loss: 0.2981, test_loss: 2.2210, test_f1: 0.5538
 epoch: 60, train_loss: 0.2924, test_loss: 2.1509, test_f1: 0.5491
 epoch: 61, train_loss: 0.2694, test_loss: 2.4194, test_f1: 0.5110
 epoch: 62, train_loss: 0.2760, test_loss: 2.4398, test_f1: 0.5278
 epoch: 63, train_loss: 0.2745, test_loss: 2.4837, test_f1: 0.5403
 epoch: 64, train_loss: 0.2687, test_loss: 2.4949, test_f1: 0.5314
 epoch: 65, train_loss: 0.2841, test_loss: 2.5139, test_f1: 0.5194
 epoch: 66, train_loss: 0.2556, test_loss: 2.5174, test_f1: 0.5370
 epoch: 67, train_loss: 0.2542, test_loss: 2.5756, test_f1: 0.5343
 epoch: 68, train_loss: 0.2646, test_loss: 2.7130, test_f1: 0.5303
 epoch: 69, train_loss: 0.2502, test_loss: 2.3579, test_f1: 0.5307
 epoch: 70, train_loss: 0.2521, test_loss: 2.4537, test_f1: 0.5362
 epoch: 71, train_loss: 0.2474, test_loss: 2.8287, test_f1: 0.5151
 epoch: 72, train_loss: 0.2457, test_loss: 2.4926, test_f1: 0.5441
 epoch: 73, train_loss: 0.2669, test_loss: 2.5002, test_f1: 0.5362
 epoch: 74, train_loss: 0.2466, test_loss: 2.4551, test_f1: 0.5460
 epoch: 75, train_loss: 0.2284, test_loss: 2.5377, test_f1: 0.5546
 epoch: 76, train_loss: 0.2165, test_loss: 2.6536, test_f1: 0.5449
 epoch: 77, train_loss: 0.2287, test_loss: 2.8907, test_f1: 0.5476
 epoch: 78, train_loss: 0.2360, test_loss: 2.7838, test_f1: 0.5097
 epoch: 79, train_loss: 0.2283, test_loss: 2.9736, test_f1: 0.5261
 epoch: 80, train_loss: 0.2293, test_loss: 3.1796, test_f1: 0.5155
 epoch: 81, train_loss: 0.2391, test_loss: 2.8871, test_f1: 0.5354
 epoch: 82, train_loss: 0.2286, test_loss: 2.8214, test_f1: 0.5277
 epoch: 83, train_loss: 0.2268, test_loss: 2.8469, test_f1: 0.5568
 epoch: 84, train_loss: 0.2288, test_loss: 2.6920, test_f1: 0.5405
 epoch: 85, train_loss: 0.2151, test_loss: 2.6441, test_f1: 0.5380
 epoch: 86, train_loss: 0.2236, test_loss: 2.7981, test_f1: 0.5279
 epoch: 87, train_loss: 0.2248, test_loss: 2.7325, test_f1: 0.5338
 epoch: 88, train_loss: 0.2144, test_loss: 2.9728, test_f1: 0.5076
 epoch: 89, train_loss: 0.2070, test_loss: 2.8059, test_f1: 0.5486
 epoch: 90, train_loss: 0.1975, test_loss: 2.8755, test_f1: 0.5118
 epoch: 91, train_loss: 0.2094, test_loss: 3.0995, test_f1: 0.5304
 epoch: 92, train_loss: 0.2124, test_loss: 3.0945, test_f1: 0.5499
 epoch: 93, train_loss: 0.2183, test_loss: 2.8210, test_f1: 0.5234
 epoch: 94, train_loss: 0.2271, test_loss: 2.8704, test_f1: 0.5383
 epoch: 95, train_loss: 0.2152, test_loss: 2.8229, test_f1: 0.5354
 epoch: 96, train_loss: 0.2173, test_loss: 2.9475, test_f1: 0.5281
 epoch: 97, train_loss: 0.1962, test_loss: 2.7977, test_f1: 0.5524
 epoch: 98, train_loss: 0.1982, test_loss: 2.9638, test_f1: 0.5474
 epoch: 99, train_loss: 0.1877, test_loss: 2.9817, test_f1: 0.5423
##################ITERATION #5 ****************************************
 epoch: 0, train_loss: 1.4438, test_loss: 1.2959, test_f1: 0.3994
 epoch: 1, train_loss: 1.2257, test_loss: 1.2052, test_f1: 0.4594
 epoch: 2, train_loss: 1.1505, test_loss: 1.1143, test_f1: 0.4393
 epoch: 3, train_loss: 1.0762, test_loss: 1.0569, test_f1: 0.4483
 epoch: 4, train_loss: 1.0571, test_loss: 1.0263, test_f1: 0.4813
 epoch: 5, train_loss: 1.0348, test_loss: 1.0230, test_f1: 0.4729
 epoch: 6, train_loss: 0.9754, test_loss: 1.0124, test_f1: 0.5038
 epoch: 7, train_loss: 0.9440, test_loss: 1.0096, test_f1: 0.4907
 epoch: 8, train_loss: 0.9292, test_loss: 1.1083, test_f1: 0.4810
 epoch: 9, train_loss: 0.9051, test_loss: 1.0209, test_f1: 0.4857
 epoch: 10, train_loss: 0.8819, test_loss: 1.0402, test_f1: 0.5105
 epoch: 11, train_loss: 0.8677, test_loss: 1.0148, test_f1: 0.5104
 epoch: 12, train_loss: 0.8511, test_loss: 1.0841, test_f1: 0.5078
 epoch: 13, train_loss: 0.8294, test_loss: 1.0578, test_f1: 0.5064
 epoch: 14, train_loss: 0.8067, test_loss: 1.1308, test_f1: 0.4929
 epoch: 15, train_loss: 0.8002, test_loss: 1.1152, test_f1: 0.5290
 epoch: 16, train_loss: 0.7858, test_loss: 1.1965, test_f1: 0.4890
 epoch: 17, train_loss: 0.7769, test_loss: 1.0880, test_f1: 0.4875
 epoch: 18, train_loss: 0.7569, test_loss: 1.1695, test_f1: 0.5129
 epoch: 19, train_loss: 0.7396, test_loss: 1.0489, test_f1: 0.5527
 epoch: 20, train_loss: 0.7350, test_loss: 1.2542, test_f1: 0.5026
 epoch: 21, train_loss: 0.7082, test_loss: 1.1764, test_f1: 0.5167
 epoch: 22, train_loss: 0.6729, test_loss: 1.2074, test_f1: 0.5285
 epoch: 23, train_loss: 0.6559, test_loss: 1.3808, test_f1: 0.5105
 epoch: 24, train_loss: 0.6403, test_loss: 1.3522, test_f1: 0.4998
 epoch: 25, train_loss: 0.6701, test_loss: 1.3062, test_f1: 0.5319
 epoch: 26, train_loss: 0.6466, test_loss: 1.3207, test_f1: 0.4946
 epoch: 27, train_loss: 0.6339, test_loss: 1.4361, test_f1: 0.5013
 epoch: 28, train_loss: 0.6051, test_loss: 1.4743, test_f1: 0.5176
 epoch: 29, train_loss: 0.5912, test_loss: 1.3923, test_f1: 0.5211
 epoch: 30, train_loss: 0.5909, test_loss: 1.4596, test_f1: 0.5411
 epoch: 31, train_loss: 0.6091, test_loss: 1.3754, test_f1: 0.5147
 epoch: 32, train_loss: 0.5869, test_loss: 1.6486, test_f1: 0.4701
 epoch: 33, train_loss: 0.5681, test_loss: 1.5144, test_f1: 0.5154
 epoch: 34, train_loss: 0.5586, test_loss: 1.5214, test_f1: 0.5033
 epoch: 35, train_loss: 0.5709, test_loss: 1.5413, test_f1: 0.5477
 epoch: 36, train_loss: 0.5364, test_loss: 1.5297, test_f1: 0.4966
 epoch: 37, train_loss: 0.5163, test_loss: 1.7905, test_f1: 0.4987
 epoch: 38, train_loss: 0.4829, test_loss: 1.4833, test_f1: 0.5320
 epoch: 39, train_loss: 0.4957, test_loss: 1.7731, test_f1: 0.5014
 epoch: 40, train_loss: 0.5089, test_loss: 1.6490, test_f1: 0.4806
 epoch: 41, train_loss: 0.5514, test_loss: 1.6714, test_f1: 0.5112
 epoch: 42, train_loss: 0.5203, test_loss: 1.4502, test_f1: 0.5266
 epoch: 43, train_loss: 0.4866, test_loss: 1.8375, test_f1: 0.4959
 epoch: 44, train_loss: 0.4663, test_loss: 1.8649, test_f1: 0.5399
 epoch: 45, train_loss: 0.4497, test_loss: 1.7741, test_f1: 0.5159
 epoch: 46, train_loss: 0.4535, test_loss: 1.7131, test_f1: 0.5230
 epoch: 47, train_loss: 0.4583, test_loss: 1.9308, test_f1: 0.5356
 epoch: 48, train_loss: 0.4496, test_loss: 1.8961, test_f1: 0.4943
 epoch: 49, train_loss: 0.4413, test_loss: 2.0316, test_f1: 0.5264
 epoch: 50, train_loss: 0.4278, test_loss: 1.9646, test_f1: 0.4972
 epoch: 51, train_loss: 0.3842, test_loss: 1.9008, test_f1: 0.5384
 epoch: 52, train_loss: 0.3423, test_loss: 1.9873, test_f1: 0.5307
 epoch: 53, train_loss: 0.3365, test_loss: 2.0900, test_f1: 0.5148
 epoch: 54, train_loss: 0.3173, test_loss: 2.3018, test_f1: 0.5115
 epoch: 55, train_loss: 0.3076, test_loss: 2.2324, test_f1: 0.5368
 epoch: 56, train_loss: 0.3134, test_loss: 2.2081, test_f1: 0.5023
 epoch: 57, train_loss: 0.3060, test_loss: 2.1943, test_f1: 0.5298
 epoch: 58, train_loss: 0.2876, test_loss: 2.3414, test_f1: 0.5256
 epoch: 59, train_loss: 0.2897, test_loss: 2.2438, test_f1: 0.5444
 epoch: 60, train_loss: 0.2950, test_loss: 2.5094, test_f1: 0.5198
 epoch: 61, train_loss: 0.2925, test_loss: 2.3633, test_f1: 0.5265
 epoch: 62, train_loss: 0.3016, test_loss: 2.3637, test_f1: 0.5274
 epoch: 63, train_loss: 0.2930, test_loss: 2.2011, test_f1: 0.5413
 epoch: 64, train_loss: 0.2737, test_loss: 2.4191, test_f1: 0.5385
 epoch: 65, train_loss: 0.2717, test_loss: 2.4361, test_f1: 0.5255
 epoch: 66, train_loss: 0.2638, test_loss: 2.5226, test_f1: 0.5368
 epoch: 67, train_loss: 0.2797, test_loss: 2.5508, test_f1: 0.5249
 epoch: 68, train_loss: 0.2703, test_loss: 2.6103, test_f1: 0.5051
 epoch: 69, train_loss: 0.2783, test_loss: 2.6342, test_f1: 0.5261
 epoch: 70, train_loss: 0.2727, test_loss: 2.2098, test_f1: 0.5354
 epoch: 71, train_loss: 0.2667, test_loss: 2.5960, test_f1: 0.5235
 epoch: 72, train_loss: 0.2512, test_loss: 2.5979, test_f1: 0.5490
 epoch: 73, train_loss: 0.2478, test_loss: 2.4886, test_f1: 0.5298
 epoch: 74, train_loss: 0.2375, test_loss: 2.5952, test_f1: 0.5268
 epoch: 75, train_loss: 0.2620, test_loss: 2.5718, test_f1: 0.5336
 epoch: 76, train_loss: 0.2326, test_loss: 2.6365, test_f1: 0.5339
 epoch: 77, train_loss: 0.2587, test_loss: 2.6435, test_f1: 0.5265
 epoch: 78, train_loss: 0.2471, test_loss: 2.7168, test_f1: 0.5441
 epoch: 79, train_loss: 0.2316, test_loss: 2.6387, test_f1: 0.5319
 epoch: 80, train_loss: 0.2413, test_loss: 2.7231, test_f1: 0.5103
 epoch: 81, train_loss: 0.2408, test_loss: 2.8994, test_f1: 0.5169
 epoch: 82, train_loss: 0.2362, test_loss: 2.7544, test_f1: 0.5281
 epoch: 83, train_loss: 0.2220, test_loss: 2.7831, test_f1: 0.5280
 epoch: 84, train_loss: 0.2074, test_loss: 2.6123, test_f1: 0.5489
 epoch: 85, train_loss: 0.1999, test_loss: 2.7289, test_f1: 0.5314
 epoch: 86, train_loss: 0.2011, test_loss: 2.8840, test_f1: 0.5459
 epoch: 87, train_loss: 0.2064, test_loss: 2.8980, test_f1: 0.5372
 epoch: 88, train_loss: 0.2120, test_loss: 3.0370, test_f1: 0.5220
 epoch: 89, train_loss: 0.2293, test_loss: 2.9273, test_f1: 0.5314
 epoch: 90, train_loss: 0.2414, test_loss: 2.6759, test_f1: 0.5352
 epoch: 91, train_loss: 0.2325, test_loss: 2.7850, test_f1: 0.5428
 epoch: 92, train_loss: 0.2137, test_loss: 2.6760, test_f1: 0.5232
 epoch: 93, train_loss: 0.2140, test_loss: 2.7804, test_f1: 0.5299
 epoch: 94, train_loss: 0.1871, test_loss: 2.7495, test_f1: 0.5351
 epoch: 95, train_loss: 0.1985, test_loss: 3.1151, test_f1: 0.5376
 epoch: 96, train_loss: 0.1991, test_loss: 2.8130, test_f1: 0.5378
 epoch: 97, train_loss: 0.2060, test_loss: 3.1148, test_f1: 0.5461
 epoch: 98, train_loss: 0.2000, test_loss: 3.0780, test_f1: 0.5225
 epoch: 99, train_loss: 0.2011, test_loss: 2.9654, test_f1: 0.5392
##################ITERATION #6 ****************************************
 epoch: 0, train_loss: 1.4929, test_loss: 1.2362, test_f1: 0.3564
 epoch: 1, train_loss: 1.2048, test_loss: 1.1742, test_f1: 0.4509
 epoch: 2, train_loss: 1.1237, test_loss: 1.0890, test_f1: 0.5053
 epoch: 3, train_loss: 1.0638, test_loss: 1.0565, test_f1: 0.4398
 epoch: 4, train_loss: 1.0211, test_loss: 1.0127, test_f1: 0.4928
 epoch: 5, train_loss: 0.9846, test_loss: 1.0105, test_f1: 0.4808
 epoch: 6, train_loss: 0.9776, test_loss: 1.0248, test_f1: 0.4790
 epoch: 7, train_loss: 0.9340, test_loss: 0.9892, test_f1: 0.4920
 epoch: 8, train_loss: 0.9159, test_loss: 1.0184, test_f1: 0.5308
 epoch: 9, train_loss: 0.8877, test_loss: 1.0663, test_f1: 0.5225
 epoch: 10, train_loss: 0.8672, test_loss: 1.0130, test_f1: 0.5268
 epoch: 11, train_loss: 0.8412, test_loss: 0.9763, test_f1: 0.5194
 epoch: 12, train_loss: 0.8055, test_loss: 1.0662, test_f1: 0.5223
 epoch: 13, train_loss: 0.8111, test_loss: 1.0365, test_f1: 0.5296
 epoch: 14, train_loss: 0.7905, test_loss: 1.1127, test_f1: 0.5289
 epoch: 15, train_loss: 0.7795, test_loss: 1.0408, test_f1: 0.5366
 epoch: 16, train_loss: 0.7683, test_loss: 1.1008, test_f1: 0.5055
 epoch: 17, train_loss: 0.7397, test_loss: 1.1603, test_f1: 0.5281
 epoch: 18, train_loss: 0.7361, test_loss: 1.1673, test_f1: 0.4924
 epoch: 19, train_loss: 0.7004, test_loss: 1.2334, test_f1: 0.5287
 epoch: 20, train_loss: 0.7137, test_loss: 1.2334, test_f1: 0.5209
 epoch: 21, train_loss: 0.6889, test_loss: 1.2097, test_f1: 0.5368
 epoch: 22, train_loss: 0.6767, test_loss: 1.1938, test_f1: 0.5441
 epoch: 23, train_loss: 0.6665, test_loss: 1.1917, test_f1: 0.5234
 epoch: 24, train_loss: 0.6842, test_loss: 1.1851, test_f1: 0.5503
 epoch: 25, train_loss: 0.6563, test_loss: 1.4208, test_f1: 0.5242
 epoch: 26, train_loss: 0.6364, test_loss: 1.1904, test_f1: 0.5409
 epoch: 27, train_loss: 0.6434, test_loss: 1.1102, test_f1: 0.5767
 epoch: 28, train_loss: 0.6025, test_loss: 1.2652, test_f1: 0.5604
 epoch: 29, train_loss: 0.6048, test_loss: 1.4279, test_f1: 0.5139
 epoch: 30, train_loss: 0.5905, test_loss: 1.2952, test_f1: 0.5354
 epoch: 31, train_loss: 0.5807, test_loss: 1.3261, test_f1: 0.5746
 epoch: 32, train_loss: 0.6006, test_loss: 1.3914, test_f1: 0.5299
 epoch: 33, train_loss: 0.5823, test_loss: 1.3606, test_f1: 0.5552
 epoch: 34, train_loss: 0.5476, test_loss: 1.4235, test_f1: 0.5384
 epoch: 35, train_loss: 0.5484, test_loss: 1.3547, test_f1: 0.5748
 epoch: 36, train_loss: 0.5475, test_loss: 1.6752, test_f1: 0.4982
 epoch: 37, train_loss: 0.5407, test_loss: 1.4375, test_f1: 0.5578
 epoch: 38, train_loss: 0.5233, test_loss: 1.3359, test_f1: 0.5477
 epoch: 39, train_loss: 0.5131, test_loss: 1.5302, test_f1: 0.5216
 epoch: 40, train_loss: 0.4988, test_loss: 1.6432, test_f1: 0.5540
 epoch: 41, train_loss: 0.4909, test_loss: 1.3972, test_f1: 0.5630
 epoch: 42, train_loss: 0.5091, test_loss: 1.6260, test_f1: 0.5384
 epoch: 43, train_loss: 0.5154, test_loss: 1.4451, test_f1: 0.5436
 epoch: 44, train_loss: 0.4788, test_loss: 1.5094, test_f1: 0.5753
 epoch: 45, train_loss: 0.4565, test_loss: 1.6654, test_f1: 0.5491
 epoch: 46, train_loss: 0.4539, test_loss: 1.4980, test_f1: 0.5679
 epoch: 47, train_loss: 0.4399, test_loss: 1.6816, test_f1: 0.5569
 epoch: 48, train_loss: 0.4815, test_loss: 1.5515, test_f1: 0.5179
 epoch: 49, train_loss: 0.4642, test_loss: 1.5325, test_f1: 0.5456
 epoch: 50, train_loss: 0.4290, test_loss: 1.6988, test_f1: 0.5445
 epoch: 51, train_loss: 0.3943, test_loss: 1.6152, test_f1: 0.5597
 epoch: 52, train_loss: 0.3713, test_loss: 1.7592, test_f1: 0.5457
 epoch: 53, train_loss: 0.3562, test_loss: 1.7719, test_f1: 0.5514
 epoch: 54, train_loss: 0.3462, test_loss: 1.7773, test_f1: 0.5537
 epoch: 55, train_loss: 0.3401, test_loss: 1.7998, test_f1: 0.5604
 epoch: 56, train_loss: 0.3352, test_loss: 1.8216, test_f1: 0.5661
 epoch: 57, train_loss: 0.3257, test_loss: 1.8339, test_f1: 0.5312
 epoch: 58, train_loss: 0.3266, test_loss: 1.8669, test_f1: 0.5625
 epoch: 59, train_loss: 0.3157, test_loss: 2.0160, test_f1: 0.5468
 epoch: 60, train_loss: 0.3081, test_loss: 2.1172, test_f1: 0.5334
 epoch: 61, train_loss: 0.3198, test_loss: 1.8863, test_f1: 0.5365
 epoch: 62, train_loss: 0.3096, test_loss: 2.0873, test_f1: 0.5254
 epoch: 63, train_loss: 0.3183, test_loss: 1.9597, test_f1: 0.5626
 epoch: 64, train_loss: 0.3177, test_loss: 2.0320, test_f1: 0.5567
 epoch: 65, train_loss: 0.3059, test_loss: 2.0876, test_f1: 0.5329
 epoch: 66, train_loss: 0.3126, test_loss: 2.0670, test_f1: 0.5631
 epoch: 67, train_loss: 0.2865, test_loss: 1.9189, test_f1: 0.5451
 epoch: 68, train_loss: 0.2779, test_loss: 2.1797, test_f1: 0.5545
 epoch: 69, train_loss: 0.2763, test_loss: 2.1265, test_f1: 0.5431
 epoch: 70, train_loss: 0.2638, test_loss: 2.1863, test_f1: 0.5455
 epoch: 71, train_loss: 0.2604, test_loss: 2.2798, test_f1: 0.5544
 epoch: 72, train_loss: 0.2616, test_loss: 2.2256, test_f1: 0.5490
 epoch: 73, train_loss: 0.2871, test_loss: 2.1511, test_f1: 0.5688
 epoch: 74, train_loss: 0.2642, test_loss: 2.4264, test_f1: 0.5348
 epoch: 75, train_loss: 0.2715, test_loss: 2.2300, test_f1: 0.5655
 epoch: 76, train_loss: 0.2687, test_loss: 2.3514, test_f1: 0.5260
 epoch: 77, train_loss: 0.2561, test_loss: 2.2848, test_f1: 0.5701
 epoch: 78, train_loss: 0.2647, test_loss: 2.3358, test_f1: 0.5247
 epoch: 79, train_loss: 0.2721, test_loss: 2.2315, test_f1: 0.5517
 epoch: 80, train_loss: 0.2615, test_loss: 2.2261, test_f1: 0.5484
 epoch: 81, train_loss: 0.2451, test_loss: 2.2840, test_f1: 0.5683
 epoch: 82, train_loss: 0.2439, test_loss: 2.3523, test_f1: 0.5492
 epoch: 83, train_loss: 0.2469, test_loss: 2.4604, test_f1: 0.5573
 epoch: 84, train_loss: 0.2444, test_loss: 2.3417, test_f1: 0.5541
 epoch: 85, train_loss: 0.2527, test_loss: 2.5525, test_f1: 0.5198
 epoch: 86, train_loss: 0.2550, test_loss: 2.3585, test_f1: 0.5549
 epoch: 87, train_loss: 0.2511, test_loss: 2.3635, test_f1: 0.5571
 epoch: 88, train_loss: 0.2562, test_loss: 2.2964, test_f1: 0.5380
 epoch: 89, train_loss: 0.2375, test_loss: 2.3354, test_f1: 0.5692
 epoch: 90, train_loss: 0.2331, test_loss: 2.3981, test_f1: 0.5485
 epoch: 91, train_loss: 0.2361, test_loss: 2.5260, test_f1: 0.5258
 epoch: 92, train_loss: 0.2437, test_loss: 2.3244, test_f1: 0.5632
 epoch: 93, train_loss: 0.2253, test_loss: 2.4286, test_f1: 0.5514
 epoch: 94, train_loss: 0.2163, test_loss: 2.6225, test_f1: 0.5390
 epoch: 95, train_loss: 0.2069, test_loss: 2.4765, test_f1: 0.5567
 epoch: 96, train_loss: 0.2108, test_loss: 2.5338, test_f1: 0.5678
 epoch: 97, train_loss: 0.2110, test_loss: 2.6028, test_f1: 0.5389
 epoch: 98, train_loss: 0.1983, test_loss: 2.6068, test_f1: 0.5463
 epoch: 99, train_loss: 0.2043, test_loss: 2.4761, test_f1: 0.5646
##################ITERATION #7 ****************************************
 epoch: 0, train_loss: 1.4899, test_loss: 1.3032, test_f1: 0.2763
 epoch: 1, train_loss: 1.2143, test_loss: 1.2071, test_f1: 0.3289
 epoch: 2, train_loss: 1.1323, test_loss: 1.1201, test_f1: 0.4123
 epoch: 3, train_loss: 1.0886, test_loss: 1.0934, test_f1: 0.4144
 epoch: 4, train_loss: 1.0238, test_loss: 1.0187, test_f1: 0.4839
 epoch: 5, train_loss: 0.9926, test_loss: 0.9924, test_f1: 0.4929
 epoch: 6, train_loss: 0.9687, test_loss: 1.0526, test_f1: 0.4733
 epoch: 7, train_loss: 0.9319, test_loss: 0.9527, test_f1: 0.5099
 epoch: 8, train_loss: 0.9274, test_loss: 1.0399, test_f1: 0.4928
 epoch: 9, train_loss: 0.8949, test_loss: 1.0587, test_f1: 0.4764
 epoch: 10, train_loss: 0.8504, test_loss: 0.9773, test_f1: 0.5060
 epoch: 11, train_loss: 0.8426, test_loss: 0.9910, test_f1: 0.4870
 epoch: 12, train_loss: 0.8331, test_loss: 0.9699, test_f1: 0.5238
 epoch: 13, train_loss: 0.8221, test_loss: 0.9404, test_f1: 0.5450
 epoch: 14, train_loss: 0.7864, test_loss: 1.0426, test_f1: 0.5184
 epoch: 15, train_loss: 0.7674, test_loss: 1.0435, test_f1: 0.5068
 epoch: 16, train_loss: 0.7570, test_loss: 1.0117, test_f1: 0.5371
 epoch: 17, train_loss: 0.7721, test_loss: 1.1009, test_f1: 0.4981
 epoch: 18, train_loss: 0.7748, test_loss: 0.9555, test_f1: 0.5514
 epoch: 19, train_loss: 0.7391, test_loss: 0.9981, test_f1: 0.5433
 epoch: 20, train_loss: 0.7007, test_loss: 1.0735, test_f1: 0.5526
 epoch: 21, train_loss: 0.6979, test_loss: 1.0865, test_f1: 0.5411
 epoch: 22, train_loss: 0.7075, test_loss: 1.0677, test_f1: 0.5414
 epoch: 23, train_loss: 0.6831, test_loss: 1.1483, test_f1: 0.5294
 epoch: 24, train_loss: 0.6621, test_loss: 1.2355, test_f1: 0.5085
 epoch: 25, train_loss: 0.6532, test_loss: 1.2813, test_f1: 0.5260
 epoch: 26, train_loss: 0.6604, test_loss: 1.2973, test_f1: 0.5288
 epoch: 27, train_loss: 0.6195, test_loss: 1.2061, test_f1: 0.5355
 epoch: 28, train_loss: 0.6238, test_loss: 1.2423, test_f1: 0.5478
 epoch: 29, train_loss: 0.6101, test_loss: 1.4336, test_f1: 0.4953
 epoch: 30, train_loss: 0.5888, test_loss: 1.2042, test_f1: 0.5541
 epoch: 31, train_loss: 0.5629, test_loss: 1.2332, test_f1: 0.5432
 epoch: 32, train_loss: 0.5816, test_loss: 1.3996, test_f1: 0.5218
 epoch: 33, train_loss: 0.6188, test_loss: 1.3459, test_f1: 0.5185
 epoch: 34, train_loss: 0.5610, test_loss: 1.3507, test_f1: 0.5276
 epoch: 35, train_loss: 0.5519, test_loss: 1.4039, test_f1: 0.5199
 epoch: 36, train_loss: 0.5665, test_loss: 1.4357, test_f1: 0.5381
 epoch: 37, train_loss: 0.5434, test_loss: 1.4213, test_f1: 0.5339
 epoch: 38, train_loss: 0.5183, test_loss: 1.4031, test_f1: 0.4924
 epoch: 39, train_loss: 0.5066, test_loss: 1.7277, test_f1: 0.5212
 epoch: 40, train_loss: 0.5222, test_loss: 1.3134, test_f1: 0.5245
 epoch: 41, train_loss: 0.4967, test_loss: 1.5941, test_f1: 0.5293
 epoch: 42, train_loss: 0.5081, test_loss: 1.3292, test_f1: 0.5498
 epoch: 43, train_loss: 0.4728, test_loss: 1.6984, test_f1: 0.5227
 epoch: 44, train_loss: 0.4495, test_loss: 1.5793, test_f1: 0.4911
 epoch: 45, train_loss: 0.4722, test_loss: 1.6252, test_f1: 0.5390
 epoch: 46, train_loss: 0.4707, test_loss: 1.5348, test_f1: 0.5365
 epoch: 47, train_loss: 0.4750, test_loss: 1.6302, test_f1: 0.5549
 epoch: 48, train_loss: 0.4371, test_loss: 1.4752, test_f1: 0.5696
 epoch: 49, train_loss: 0.4323, test_loss: 1.9122, test_f1: 0.5158
 epoch: 50, train_loss: 0.4228, test_loss: 1.8772, test_f1: 0.5311
 epoch: 51, train_loss: 0.3905, test_loss: 1.6862, test_f1: 0.5441
 epoch: 52, train_loss: 0.3546, test_loss: 1.7440, test_f1: 0.5433
 epoch: 53, train_loss: 0.3339, test_loss: 1.8551, test_f1: 0.5136
 epoch: 54, train_loss: 0.3224, test_loss: 1.9866, test_f1: 0.5251
 epoch: 55, train_loss: 0.3155, test_loss: 1.8487, test_f1: 0.5405
 epoch: 56, train_loss: 0.3303, test_loss: 2.0914, test_f1: 0.5216
 epoch: 57, train_loss: 0.3224, test_loss: 2.0680, test_f1: 0.5395
 epoch: 58, train_loss: 0.3252, test_loss: 2.0215, test_f1: 0.5158
 epoch: 59, train_loss: 0.3095, test_loss: 1.7279, test_f1: 0.5545
 epoch: 60, train_loss: 0.2947, test_loss: 1.9587, test_f1: 0.5245
 epoch: 61, train_loss: 0.3038, test_loss: 2.1402, test_f1: 0.5232
 epoch: 62, train_loss: 0.2967, test_loss: 1.9458, test_f1: 0.5295
 epoch: 63, train_loss: 0.2958, test_loss: 2.1792, test_f1: 0.5172
 epoch: 64, train_loss: 0.2849, test_loss: 1.9654, test_f1: 0.5283
 epoch: 65, train_loss: 0.2652, test_loss: 2.0975, test_f1: 0.5268
 epoch: 66, train_loss: 0.2703, test_loss: 2.1023, test_f1: 0.5077
 epoch: 67, train_loss: 0.2700, test_loss: 2.2126, test_f1: 0.5246
 epoch: 68, train_loss: 0.2688, test_loss: 2.2299, test_f1: 0.5224
 epoch: 69, train_loss: 0.2680, test_loss: 2.1937, test_f1: 0.5325
 epoch: 70, train_loss: 0.2673, test_loss: 2.2527, test_f1: 0.5330
 epoch: 71, train_loss: 0.2676, test_loss: 2.2322, test_f1: 0.5130
 epoch: 72, train_loss: 0.2637, test_loss: 2.1453, test_f1: 0.5393
 epoch: 73, train_loss: 0.2774, test_loss: 2.0350, test_f1: 0.5505
 epoch: 74, train_loss: 0.2559, test_loss: 2.2907, test_f1: 0.5078
 epoch: 75, train_loss: 0.2500, test_loss: 2.2822, test_f1: 0.5308
 epoch: 76, train_loss: 0.2554, test_loss: 2.2380, test_f1: 0.5456
 epoch: 77, train_loss: 0.2513, test_loss: 2.3086, test_f1: 0.5612
 epoch: 78, train_loss: 0.2443, test_loss: 2.1485, test_f1: 0.5447
 epoch: 79, train_loss: 0.2873, test_loss: 2.3096, test_f1: 0.5438
 epoch: 80, train_loss: 0.2640, test_loss: 2.1993, test_f1: 0.5235
 epoch: 81, train_loss: 0.2432, test_loss: 2.3646, test_f1: 0.5348
 epoch: 82, train_loss: 0.2450, test_loss: 2.1994, test_f1: 0.5403
 epoch: 83, train_loss: 0.2479, test_loss: 2.1821, test_f1: 0.5255
 epoch: 84, train_loss: 0.2251, test_loss: 2.2876, test_f1: 0.5574
 epoch: 85, train_loss: 0.2243, test_loss: 2.4553, test_f1: 0.5286
 epoch: 86, train_loss: 0.2293, test_loss: 2.4390, test_f1: 0.5206
 epoch: 87, train_loss: 0.2097, test_loss: 2.4706, test_f1: 0.5214
 epoch: 88, train_loss: 0.1953, test_loss: 2.3624, test_f1: 0.5380
 epoch: 89, train_loss: 0.1801, test_loss: 2.6438, test_f1: 0.5428
 epoch: 90, train_loss: 0.2084, test_loss: 2.4248, test_f1: 0.5494
 epoch: 91, train_loss: 0.2182, test_loss: 2.5551, test_f1: 0.5121
 epoch: 92, train_loss: 0.2292, test_loss: 2.5877, test_f1: 0.5454
 epoch: 93, train_loss: 0.2327, test_loss: 2.4999, test_f1: 0.5214
 epoch: 94, train_loss: 0.2111, test_loss: 2.3231, test_f1: 0.5396
 epoch: 95, train_loss: 0.1936, test_loss: 2.6039, test_f1: 0.5221
 epoch: 96, train_loss: 0.2110, test_loss: 2.6014, test_f1: 0.5244
 epoch: 97, train_loss: 0.1787, test_loss: 2.4671, test_f1: 0.5203
 epoch: 98, train_loss: 0.2196, test_loss: 2.5900, test_f1: 0.5479
 epoch: 99, train_loss: 0.2014, test_loss: 2.4757, test_f1: 0.5257
##################ITERATION #8 ****************************************
 epoch: 0, train_loss: 1.5968, test_loss: 1.3592, test_f1: 0.2729
 epoch: 1, train_loss: 1.2529, test_loss: 1.1982, test_f1: 0.4971
 epoch: 2, train_loss: 1.1248, test_loss: 1.1184, test_f1: 0.4638
 epoch: 3, train_loss: 1.0616, test_loss: 1.0592, test_f1: 0.4505
 epoch: 4, train_loss: 1.0279, test_loss: 1.0099, test_f1: 0.4916
 epoch: 5, train_loss: 0.9940, test_loss: 0.9979, test_f1: 0.4796
 epoch: 6, train_loss: 0.9701, test_loss: 0.9920, test_f1: 0.4601
 epoch: 7, train_loss: 0.9366, test_loss: 0.9865, test_f1: 0.4865
 epoch: 8, train_loss: 0.9059, test_loss: 0.9780, test_f1: 0.4866
 epoch: 9, train_loss: 0.8923, test_loss: 0.9679, test_f1: 0.5106
 epoch: 10, train_loss: 0.8600, test_loss: 1.0228, test_f1: 0.4913
 epoch: 11, train_loss: 0.8421, test_loss: 0.9699, test_f1: 0.5049
 epoch: 12, train_loss: 0.8260, test_loss: 0.9894, test_f1: 0.4956
 epoch: 13, train_loss: 0.8004, test_loss: 1.1110, test_f1: 0.4925
 epoch: 14, train_loss: 0.7796, test_loss: 1.0804, test_f1: 0.4979
 epoch: 15, train_loss: 0.8017, test_loss: 1.0567, test_f1: 0.5270
 epoch: 16, train_loss: 0.7839, test_loss: 1.0741, test_f1: 0.4980
 epoch: 17, train_loss: 0.7626, test_loss: 1.0721, test_f1: 0.4945
 epoch: 18, train_loss: 0.7485, test_loss: 1.0893, test_f1: 0.5151
 epoch: 19, train_loss: 0.7488, test_loss: 1.1238, test_f1: 0.5283
 epoch: 20, train_loss: 0.7452, test_loss: 1.2739, test_f1: 0.5244
 epoch: 21, train_loss: 0.7178, test_loss: 1.0718, test_f1: 0.5548
 epoch: 22, train_loss: 0.7042, test_loss: 1.0841, test_f1: 0.5462
 epoch: 23, train_loss: 0.6825, test_loss: 1.2057, test_f1: 0.5488
 epoch: 24, train_loss: 0.6656, test_loss: 1.1410, test_f1: 0.5547
 epoch: 25, train_loss: 0.6414, test_loss: 1.2071, test_f1: 0.5341
 epoch: 26, train_loss: 0.6539, test_loss: 1.1809, test_f1: 0.5373
 epoch: 27, train_loss: 0.6710, test_loss: 1.1149, test_f1: 0.5398
 epoch: 28, train_loss: 0.6562, test_loss: 1.2836, test_f1: 0.5384
 epoch: 29, train_loss: 0.6356, test_loss: 1.1541, test_f1: 0.5427
 epoch: 30, train_loss: 0.5808, test_loss: 1.2673, test_f1: 0.5177
 epoch: 31, train_loss: 0.5894, test_loss: 1.2534, test_f1: 0.5302
 epoch: 32, train_loss: 0.6030, test_loss: 1.3029, test_f1: 0.5748
 epoch: 33, train_loss: 0.5839, test_loss: 1.4343, test_f1: 0.4923
 epoch: 34, train_loss: 0.5819, test_loss: 1.3676, test_f1: 0.5450
 epoch: 35, train_loss: 0.5559, test_loss: 1.3702, test_f1: 0.5339
 epoch: 36, train_loss: 0.5358, test_loss: 1.3941, test_f1: 0.5542
 epoch: 37, train_loss: 0.5491, test_loss: 1.3491, test_f1: 0.5378
 epoch: 38, train_loss: 0.5142, test_loss: 1.3743, test_f1: 0.5685
 epoch: 39, train_loss: 0.5131, test_loss: 1.4600, test_f1: 0.5201
 epoch: 40, train_loss: 0.5033, test_loss: 1.4898, test_f1: 0.5305
 epoch: 41, train_loss: 0.4985, test_loss: 1.3641, test_f1: 0.5435
 epoch: 42, train_loss: 0.4771, test_loss: 1.5725, test_f1: 0.5107
 epoch: 43, train_loss: 0.4842, test_loss: 1.4048, test_f1: 0.5422
 epoch: 44, train_loss: 0.4818, test_loss: 1.5016, test_f1: 0.5462
 epoch: 45, train_loss: 0.4656, test_loss: 1.5470, test_f1: 0.5662
 epoch: 46, train_loss: 0.4482, test_loss: 1.6357, test_f1: 0.5440
 epoch: 47, train_loss: 0.4617, test_loss: 1.5189, test_f1: 0.5470
 epoch: 48, train_loss: 0.4784, test_loss: 1.5242, test_f1: 0.5559
 epoch: 49, train_loss: 0.4796, test_loss: 1.6166, test_f1: 0.5569
 epoch: 50, train_loss: 0.4539, test_loss: 1.5583, test_f1: 0.5529
 epoch: 51, train_loss: 0.4123, test_loss: 1.6736, test_f1: 0.5565
 epoch: 52, train_loss: 0.3926, test_loss: 1.6238, test_f1: 0.5940
 epoch: 53, train_loss: 0.3747, test_loss: 1.6556, test_f1: 0.5602
 epoch: 54, train_loss: 0.3493, test_loss: 1.7300, test_f1: 0.5674
 epoch: 55, train_loss: 0.3344, test_loss: 1.7351, test_f1: 0.5699
 epoch: 56, train_loss: 0.3249, test_loss: 1.7064, test_f1: 0.5820
 epoch: 57, train_loss: 0.3304, test_loss: 1.8244, test_f1: 0.5555
 epoch: 58, train_loss: 0.3227, test_loss: 1.8778, test_f1: 0.5619
 epoch: 59, train_loss: 0.3101, test_loss: 1.9498, test_f1: 0.5553
 epoch: 60, train_loss: 0.3186, test_loss: 1.7830, test_f1: 0.5504
 epoch: 61, train_loss: 0.2957, test_loss: 1.8180, test_f1: 0.5621
 epoch: 62, train_loss: 0.2803, test_loss: 1.9892, test_f1: 0.5489
 epoch: 63, train_loss: 0.3101, test_loss: 1.9227, test_f1: 0.5374
 epoch: 64, train_loss: 0.3213, test_loss: 1.9181, test_f1: 0.5612
 epoch: 65, train_loss: 0.3046, test_loss: 1.9208, test_f1: 0.5525
 epoch: 66, train_loss: 0.3096, test_loss: 1.9527, test_f1: 0.5616
 epoch: 67, train_loss: 0.3041, test_loss: 1.9022, test_f1: 0.5637
 epoch: 68, train_loss: 0.2971, test_loss: 2.0570, test_f1: 0.5621
 epoch: 69, train_loss: 0.2949, test_loss: 2.0129, test_f1: 0.5451
 epoch: 70, train_loss: 0.2588, test_loss: 1.9919, test_f1: 0.5518
 epoch: 71, train_loss: 0.2667, test_loss: 2.0729, test_f1: 0.5788
 epoch: 72, train_loss: 0.2605, test_loss: 2.2244, test_f1: 0.5454
 epoch: 73, train_loss: 0.2630, test_loss: 2.1056, test_f1: 0.5646
 epoch: 74, train_loss: 0.2626, test_loss: 2.2284, test_f1: 0.5464
 epoch: 75, train_loss: 0.2733, test_loss: 2.1179, test_f1: 0.5622
 epoch: 76, train_loss: 0.2468, test_loss: 2.1242, test_f1: 0.5613
 epoch: 77, train_loss: 0.2520, test_loss: 2.2568, test_f1: 0.5359
 epoch: 78, train_loss: 0.2363, test_loss: 2.1279, test_f1: 0.5731
 epoch: 79, train_loss: 0.2333, test_loss: 2.2602, test_f1: 0.5512
 epoch: 80, train_loss: 0.2400, test_loss: 2.2211, test_f1: 0.5716
 epoch: 81, train_loss: 0.2626, test_loss: 2.1290, test_f1: 0.5717
 epoch: 82, train_loss: 0.3108, test_loss: 2.3111, test_f1: 0.5309
 epoch: 83, train_loss: 0.2677, test_loss: 2.1675, test_f1: 0.5473
 epoch: 84, train_loss: 0.2608, test_loss: 2.2104, test_f1: 0.5809
 epoch: 85, train_loss: 0.2362, test_loss: 2.2271, test_f1: 0.5450
 epoch: 86, train_loss: 0.2292, test_loss: 2.2564, test_f1: 0.5629
 epoch: 87, train_loss: 0.2469, test_loss: 2.5267, test_f1: 0.5346
 epoch: 88, train_loss: 0.2418, test_loss: 2.4348, test_f1: 0.5419
 epoch: 89, train_loss: 0.2338, test_loss: 2.3166, test_f1: 0.6042
 epoch: 90, train_loss: 0.2357, test_loss: 2.2835, test_f1: 0.5542
 epoch: 91, train_loss: 0.2393, test_loss: 2.3523, test_f1: 0.5561
 epoch: 92, train_loss: 0.2395, test_loss: 2.3477, test_f1: 0.5754
 epoch: 93, train_loss: 0.2272, test_loss: 2.5785, test_f1: 0.5572
 epoch: 94, train_loss: 0.2277, test_loss: 2.4228, test_f1: 0.5597
 epoch: 95, train_loss: 0.2283, test_loss: 2.5299, test_f1: 0.5503
 epoch: 96, train_loss: 0.2106, test_loss: 2.4368, test_f1: 0.5642
 epoch: 97, train_loss: 0.2275, test_loss: 2.5914, test_f1: 0.5543
 epoch: 98, train_loss: 0.2147, test_loss: 2.3026, test_f1: 0.5529
 epoch: 99, train_loss: 0.2226, test_loss: 2.4588, test_f1: 0.5610
##################ITERATION #9 ****************************************
 epoch: 0, train_loss: 1.4971, test_loss: 1.3325, test_f1: 0.2336
 epoch: 1, train_loss: 1.2037, test_loss: 1.2346, test_f1: 0.3527
 epoch: 2, train_loss: 1.1230, test_loss: 1.1156, test_f1: 0.4095
 epoch: 3, train_loss: 1.0777, test_loss: 1.0582, test_f1: 0.4482
 epoch: 4, train_loss: 1.0365, test_loss: 1.0228, test_f1: 0.4583
 epoch: 5, train_loss: 1.0069, test_loss: 1.0013, test_f1: 0.4777
 epoch: 6, train_loss: 0.9811, test_loss: 0.9800, test_f1: 0.4966
 epoch: 7, train_loss: 0.9591, test_loss: 1.0042, test_f1: 0.4675
 epoch: 8, train_loss: 0.9302, test_loss: 0.9431, test_f1: 0.5306
 epoch: 9, train_loss: 0.9069, test_loss: 0.9979, test_f1: 0.4904
 epoch: 10, train_loss: 0.9083, test_loss: 0.9232, test_f1: 0.5137
 epoch: 11, train_loss: 0.8764, test_loss: 0.9754, test_f1: 0.5129
 epoch: 12, train_loss: 0.8685, test_loss: 0.9806, test_f1: 0.5032
 epoch: 13, train_loss: 0.8357, test_loss: 1.1506, test_f1: 0.4942
 epoch: 14, train_loss: 0.8310, test_loss: 0.9567, test_f1: 0.5417
 epoch: 15, train_loss: 0.8082, test_loss: 1.0220, test_f1: 0.5228
 epoch: 16, train_loss: 0.7902, test_loss: 1.0202, test_f1: 0.4948
 epoch: 17, train_loss: 0.7640, test_loss: 1.0754, test_f1: 0.5484
 epoch: 18, train_loss: 0.7758, test_loss: 1.0674, test_f1: 0.5222
 epoch: 19, train_loss: 0.7607, test_loss: 1.0070, test_f1: 0.5444
 epoch: 20, train_loss: 0.7496, test_loss: 1.0700, test_f1: 0.5391
 epoch: 21, train_loss: 0.7501, test_loss: 1.1382, test_f1: 0.4948
 epoch: 22, train_loss: 0.7091, test_loss: 1.0912, test_f1: 0.5144
 epoch: 23, train_loss: 0.7051, test_loss: 1.0114, test_f1: 0.5600
 epoch: 24, train_loss: 0.6946, test_loss: 1.0745, test_f1: 0.5267
 epoch: 25, train_loss: 0.6803, test_loss: 1.2756, test_f1: 0.4984
 epoch: 26, train_loss: 0.6786, test_loss: 1.1126, test_f1: 0.5481
 epoch: 27, train_loss: 0.6523, test_loss: 1.1001, test_f1: 0.5613
 epoch: 28, train_loss: 0.6560, test_loss: 1.1587, test_f1: 0.5365
 epoch: 29, train_loss: 0.6508, test_loss: 1.1910, test_f1: 0.5325
 epoch: 30, train_loss: 0.6098, test_loss: 1.1893, test_f1: 0.5667
 epoch: 31, train_loss: 0.6037, test_loss: 1.2930, test_f1: 0.5104
 epoch: 32, train_loss: 0.6020, test_loss: 1.2643, test_f1: 0.5294
 epoch: 33, train_loss: 0.5953, test_loss: 1.2766, test_f1: 0.5361
 epoch: 34, train_loss: 0.5845, test_loss: 1.3606, test_f1: 0.5633
 epoch: 35, train_loss: 0.5736, test_loss: 1.2888, test_f1: 0.5542
 epoch: 36, train_loss: 0.5436, test_loss: 1.4312, test_f1: 0.4994
 epoch: 37, train_loss: 0.5706, test_loss: 1.4417, test_f1: 0.5223
 epoch: 38, train_loss: 0.5577, test_loss: 1.2611, test_f1: 0.5688
 epoch: 39, train_loss: 0.5623, test_loss: 1.2894, test_f1: 0.5626
 epoch: 40, train_loss: 0.5514, test_loss: 1.3867, test_f1: 0.5431
 epoch: 41, train_loss: 0.5534, test_loss: 1.3638, test_f1: 0.5152
 epoch: 42, train_loss: 0.5535, test_loss: 1.2691, test_f1: 0.5480
 epoch: 43, train_loss: 0.5350, test_loss: 1.6014, test_f1: 0.5102
 epoch: 44, train_loss: 0.5135, test_loss: 1.3512, test_f1: 0.5512
 epoch: 45, train_loss: 0.5077, test_loss: 1.4980, test_f1: 0.5204
 epoch: 46, train_loss: 0.4920, test_loss: 1.4435, test_f1: 0.5325
 epoch: 47, train_loss: 0.5014, test_loss: 1.5354, test_f1: 0.5304
 epoch: 48, train_loss: 0.5084, test_loss: 1.3976, test_f1: 0.5545
 epoch: 49, train_loss: 0.4656, test_loss: 1.6248, test_f1: 0.5132
 epoch: 50, train_loss: 0.4592, test_loss: 1.3933, test_f1: 0.5754
 epoch: 51, train_loss: 0.4265, test_loss: 1.3586, test_f1: 0.5811
 epoch: 52, train_loss: 0.3947, test_loss: 1.7801, test_f1: 0.5329
 epoch: 53, train_loss: 0.3460, test_loss: 1.6147, test_f1: 0.5612
 epoch: 54, train_loss: 0.3521, test_loss: 1.7544, test_f1: 0.5521
 epoch: 55, train_loss: 0.3497, test_loss: 1.7515, test_f1: 0.5470
 epoch: 56, train_loss: 0.3581, test_loss: 1.7728, test_f1: 0.5539
 epoch: 57, train_loss: 0.3453, test_loss: 1.6898, test_f1: 0.5669
 epoch: 58, train_loss: 0.3673, test_loss: 1.7092, test_f1: 0.5524
 epoch: 59, train_loss: 0.3267, test_loss: 1.7901, test_f1: 0.5391
 epoch: 60, train_loss: 0.3344, test_loss: 1.9442, test_f1: 0.5524
 epoch: 61, train_loss: 0.3160, test_loss: 1.9157, test_f1: 0.5631
 epoch: 62, train_loss: 0.3459, test_loss: 1.9529, test_f1: 0.5221
 epoch: 63, train_loss: 0.3521, test_loss: 1.8862, test_f1: 0.5427
 epoch: 64, train_loss: 0.3457, test_loss: 1.9797, test_f1: 0.5457
 epoch: 65, train_loss: 0.3260, test_loss: 1.7366, test_f1: 0.5561
 epoch: 66, train_loss: 0.3197, test_loss: 1.8774, test_f1: 0.5565
 epoch: 67, train_loss: 0.3305, test_loss: 1.9263, test_f1: 0.5546
 epoch: 68, train_loss: 0.3132, test_loss: 1.8839, test_f1: 0.5486
 epoch: 69, train_loss: 0.2974, test_loss: 2.0136, test_f1: 0.5448
 epoch: 70, train_loss: 0.3018, test_loss: 1.8776, test_f1: 0.5650
 epoch: 71, train_loss: 0.2994, test_loss: 2.0629, test_f1: 0.5410
 epoch: 72, train_loss: 0.2865, test_loss: 2.0751, test_f1: 0.5407
 epoch: 73, train_loss: 0.2861, test_loss: 1.9144, test_f1: 0.5429
 epoch: 74, train_loss: 0.2820, test_loss: 1.9639, test_f1: 0.5807
 epoch: 75, train_loss: 0.3027, test_loss: 2.0375, test_f1: 0.5546
 epoch: 76, train_loss: 0.2766, test_loss: 1.9631, test_f1: 0.5611
 epoch: 77, train_loss: 0.2716, test_loss: 2.0682, test_f1: 0.5382
 epoch: 78, train_loss: 0.2590, test_loss: 2.0491, test_f1: 0.5418
 epoch: 79, train_loss: 0.2751, test_loss: 2.0029, test_f1: 0.5632
 epoch: 80, train_loss: 0.2665, test_loss: 2.1582, test_f1: 0.5541
 epoch: 81, train_loss: 0.2659, test_loss: 2.1981, test_f1: 0.5311
 epoch: 82, train_loss: 0.2732, test_loss: 1.9965, test_f1: 0.5332
 epoch: 83, train_loss: 0.2684, test_loss: 2.3401, test_f1: 0.5313
 epoch: 84, train_loss: 0.3080, test_loss: 2.0075, test_f1: 0.5635
 epoch: 85, train_loss: 0.2750, test_loss: 2.1428, test_f1: 0.5204
 epoch: 86, train_loss: 0.2775, test_loss: 1.9490, test_f1: 0.5582
 epoch: 87, train_loss: 0.2441, test_loss: 2.1951, test_f1: 0.5361
 epoch: 88, train_loss: 0.2478, test_loss: 2.3008, test_f1: 0.5506
 epoch: 89, train_loss: 0.2413, test_loss: 2.2055, test_f1: 0.5425
 epoch: 90, train_loss: 0.2318, test_loss: 2.2565, test_f1: 0.5471
 epoch: 91, train_loss: 0.2439, test_loss: 2.2735, test_f1: 0.5476
 epoch: 92, train_loss: 0.2458, test_loss: 2.4343, test_f1: 0.5162
 epoch: 93, train_loss: 0.2328, test_loss: 2.1959, test_f1: 0.5507
 epoch: 94, train_loss: 0.2309, test_loss: 2.2170, test_f1: 0.5837
 epoch: 95, train_loss: 0.2208, test_loss: 2.3113, test_f1: 0.5519
 epoch: 96, train_loss: 0.2260, test_loss: 2.4034, test_f1: 0.5508
 epoch: 97, train_loss: 0.2342, test_loss: 2.3837, test_f1: 0.5537
 epoch: 98, train_loss: 0.2165, test_loss: 2.4941, test_f1: 0.5407
 epoch: 99, train_loss: 0.2255, test_loss: 2.4129, test_f1: 0.5602

Training completed in 726.60 seconds
Best F1: 0.6042 at epoch 89
Mean F1 across iterations: 0.5721  0.0133
========================FINAL RESULTS================================
FEGIN weighted F1: 0.6042  0.0133
python main.py --data ltspice_examples --representation component_component --model FEGIN --layers 5 --hiddens 128 --batch_size 256 --lr 0.001 --emb_size 250 --epochs 100 --save_appendix component_component_L5_H128_BS256_LR0.001_E250 --no_val
-----



STDERR:
  File "main.py", line 370, in <module>
    main()
  File "main.py", line 254, in main
    dataset = dataset_class(
  File "/home/philip/projects/llm_inference_code_repo/Circuit-Completion-Using-GNNs/component_classification_with_link_prediction_head/evaluation/FEGIN/kernel/circuit_datasets.py", line 15, in __init__
    self.data, self.slices = torch.load(self.processed_paths[0])
  File "/home/philip/.local/lib/python3.8/site-packages/torch/serialization.py", line 1040, in load
    warnings.warn(
  File "/usr/lib/python3.8/warnings.py", line 109, in _showwarnmsg
    sw(msg.message, msg.category, msg.filename, msg.lineno,
  File "main.py", line 47, in warn_with_traceback
    traceback.print_stack(file=log)
/home/philip/projects/llm_inference_code_repo/Circuit-Completion-Using-GNNs/component_classification_with_link_prediction_head/evaluation/FEGIN/kernel/circuit_datasets.py:15: FutureWarning: You are using `torch.load` with `weights_only=False` (the current default value), which uses the default pickle module implicitly. It is possible to construct malicious pickle data which will execute arbitrary code during unpickling (See https://github.com/pytorch/pytorch/blob/main/SECURITY.md#untrusted-models for more details). In a future release, the default value for `weights_only` will be flipped to `True`. This limits the functions that could be executed during unpickling. Arbitrary objects will no longer be allowed to be loaded via this mode unless they are explicitly allowlisted by the user via `torch.serialization.add_safe_globals`. We recommend you start setting `weights_only=True` for any use case where you don't have full control of the loaded file. Please open an issue on GitHub for any issues related to this experimental feature.
  self.data, self.slices = torch.load(self.processed_paths[0])
