STDOUT:
Results will be saved in /home/philip/projects/ltspice_examples_code_repo/Circuit-Completion-Using-GNNs/component_classification_with_link_prediction_head/evaluation/FEGIN/results/model_FEGIN_dataset_ltspice_examples
Command line input: python main.py --data ltspice_examples --representation component_pin --model FEGIN --layers 3 --hiddens 128 --batch_size 64 --lr 0.01 --emb_size 512 --epochs 100 --save_appendix component_pin_L3_H128_BS64_LR0.01_E512 --no_val
 is saved.
-----
ltspice_examples - FEGIN
Using 3 layers, 128 hidden units, h = 2
Loading component_pin representation dataset
ENTERED
Training FEGIN on component_pin representation
Train: 3560, Test: 848
##################ITERATION #0 ****************************************
 epoch: 0, train_loss: 1.1245, test_loss: 1.2528, test_f1: 0.4730
 epoch: 1, train_loss: 0.9937, test_loss: 0.9794, test_f1: 0.5017
 epoch: 2, train_loss: 0.9477, test_loss: 0.9681, test_f1: 0.5134
 epoch: 3, train_loss: 0.9110, test_loss: 0.9641, test_f1: 0.5092
 epoch: 4, train_loss: 0.8759, test_loss: 0.9772, test_f1: 0.4932
 epoch: 5, train_loss: 0.8908, test_loss: 0.9533, test_f1: 0.5381
 epoch: 6, train_loss: 0.8597, test_loss: 0.8319, test_f1: 0.5234
 epoch: 7, train_loss: 0.8482, test_loss: 0.9050, test_f1: 0.5573
 epoch: 8, train_loss: 0.8071, test_loss: 0.9620, test_f1: 0.5177
 epoch: 9, train_loss: 0.8227, test_loss: 1.2005, test_f1: 0.4526
 epoch: 10, train_loss: 0.8030, test_loss: 0.8711, test_f1: 0.5191
 epoch: 11, train_loss: 0.8150, test_loss: 0.7790, test_f1: 0.5798
 epoch: 12, train_loss: 0.7868, test_loss: 0.8659, test_f1: 0.5216
 epoch: 13, train_loss: 0.7517, test_loss: 0.7696, test_f1: 0.5792
 epoch: 14, train_loss: 0.7522, test_loss: 0.7972, test_f1: 0.5520
 epoch: 15, train_loss: 0.7476, test_loss: 0.8877, test_f1: 0.5357
 epoch: 16, train_loss: 0.7395, test_loss: 0.9027, test_f1: 0.5489
 epoch: 17, train_loss: 0.7253, test_loss: 0.8078, test_f1: 0.5248
 epoch: 18, train_loss: 0.6962, test_loss: 0.7477, test_f1: 0.5639
 epoch: 19, train_loss: 0.7014, test_loss: 0.8567, test_f1: 0.5950
 epoch: 20, train_loss: 0.7017, test_loss: 0.8650, test_f1: 0.5927
 epoch: 21, train_loss: 0.7284, test_loss: 0.8636, test_f1: 0.5592
 epoch: 22, train_loss: 0.6914, test_loss: 0.8983, test_f1: 0.6006
 epoch: 23, train_loss: 0.6691, test_loss: 1.0021, test_f1: 0.5735
 epoch: 24, train_loss: 0.6760, test_loss: 0.7826, test_f1: 0.5906
 epoch: 25, train_loss: 0.6658, test_loss: 0.9080, test_f1: 0.5538
 epoch: 26, train_loss: 0.6620, test_loss: 0.7799, test_f1: 0.6249
 epoch: 27, train_loss: 0.6795, test_loss: 0.7465, test_f1: 0.5969
 epoch: 28, train_loss: 0.6609, test_loss: 0.7475, test_f1: 0.6595
 epoch: 29, train_loss: 0.6546, test_loss: 0.7787, test_f1: 0.6168
 epoch: 30, train_loss: 0.6189, test_loss: 0.7095, test_f1: 0.5950
 epoch: 31, train_loss: 0.6142, test_loss: 0.7497, test_f1: 0.6481
 epoch: 32, train_loss: 0.6424, test_loss: 0.9169, test_f1: 0.5666
 epoch: 33, train_loss: 0.6006, test_loss: 0.7360, test_f1: 0.5851
 epoch: 34, train_loss: 0.6183, test_loss: 0.7283, test_f1: 0.6766
 epoch: 35, train_loss: 0.6032, test_loss: 0.7704, test_f1: 0.5931
 epoch: 36, train_loss: 0.6010, test_loss: 0.8659, test_f1: 0.6231
 epoch: 37, train_loss: 0.5944, test_loss: 0.7447, test_f1: 0.5946
 epoch: 38, train_loss: 0.5846, test_loss: 1.0646, test_f1: 0.6136
 epoch: 39, train_loss: 0.5649, test_loss: 0.8400, test_f1: 0.6669
 epoch: 40, train_loss: 0.5749, test_loss: 0.7840, test_f1: 0.6552
 epoch: 41, train_loss: 0.5443, test_loss: 0.7569, test_f1: 0.6734
 epoch: 42, train_loss: 0.5728, test_loss: 0.9464, test_f1: 0.5900
 epoch: 43, train_loss: 0.5698, test_loss: 0.8348, test_f1: 0.6397
 epoch: 44, train_loss: 0.5771, test_loss: 0.8354, test_f1: 0.6634
 epoch: 45, train_loss: 0.5469, test_loss: 0.8435, test_f1: 0.6768
 epoch: 46, train_loss: 0.5332, test_loss: 0.7739, test_f1: 0.7014
 epoch: 47, train_loss: 0.5234, test_loss: 0.8945, test_f1: 0.7027
 epoch: 48, train_loss: 0.5436, test_loss: 0.7402, test_f1: 0.6637
 epoch: 49, train_loss: 0.5034, test_loss: 0.7726, test_f1: 0.7207
 epoch: 50, train_loss: 0.5237, test_loss: 0.8626, test_f1: 0.6554
 epoch: 51, train_loss: 0.4649, test_loss: 0.9674, test_f1: 0.6614
 epoch: 52, train_loss: 0.4570, test_loss: 0.7265, test_f1: 0.7089
 epoch: 53, train_loss: 0.4434, test_loss: 0.8191, test_f1: 0.6974
 epoch: 54, train_loss: 0.4260, test_loss: 0.8066, test_f1: 0.7007
 epoch: 55, train_loss: 0.4304, test_loss: 0.7848, test_f1: 0.7011
 epoch: 56, train_loss: 0.4349, test_loss: 0.7252, test_f1: 0.6994
 epoch: 57, train_loss: 0.4078, test_loss: 0.7989, test_f1: 0.6662
 epoch: 58, train_loss: 0.3911, test_loss: 0.7818, test_f1: 0.7018
 epoch: 59, train_loss: 0.4013, test_loss: 0.8285, test_f1: 0.7254
 epoch: 60, train_loss: 0.3854, test_loss: 0.8711, test_f1: 0.7117
 epoch: 61, train_loss: 0.3987, test_loss: 0.8735, test_f1: 0.7020
 epoch: 62, train_loss: 0.4143, test_loss: 0.8874, test_f1: 0.6790
 epoch: 63, train_loss: 0.3956, test_loss: 0.9685, test_f1: 0.7006
 epoch: 64, train_loss: 0.3906, test_loss: 0.7902, test_f1: 0.6755
 epoch: 65, train_loss: 0.3832, test_loss: 0.7521, test_f1: 0.7262
 epoch: 66, train_loss: 0.3822, test_loss: 0.9521, test_f1: 0.6983
 epoch: 67, train_loss: 0.3629, test_loss: 0.7526, test_f1: 0.7089
 epoch: 68, train_loss: 0.3809, test_loss: 0.8391, test_f1: 0.6945
 epoch: 69, train_loss: 0.3686, test_loss: 0.8463, test_f1: 0.7372
 epoch: 70, train_loss: 0.3553, test_loss: 0.9139, test_f1: 0.7041
 epoch: 71, train_loss: 0.3455, test_loss: 0.9518, test_f1: 0.7083
 epoch: 72, train_loss: 0.3623, test_loss: 0.8798, test_f1: 0.7082
 epoch: 73, train_loss: 0.3690, test_loss: 0.8568, test_f1: 0.7078
 epoch: 74, train_loss: 0.3437, test_loss: 0.9221, test_f1: 0.7266
 epoch: 75, train_loss: 0.3542, test_loss: 0.8837, test_f1: 0.7044
 epoch: 76, train_loss: 0.3400, test_loss: 0.7504, test_f1: 0.7261
 epoch: 77, train_loss: 0.3393, test_loss: 0.8195, test_f1: 0.6980
 epoch: 78, train_loss: 0.3141, test_loss: 0.8365, test_f1: 0.7149
 epoch: 79, train_loss: 0.3392, test_loss: 0.8677, test_f1: 0.7374
 epoch: 80, train_loss: 0.3391, test_loss: 0.8859, test_f1: 0.7275
 epoch: 81, train_loss: 0.3195, test_loss: 0.8243, test_f1: 0.7498
 epoch: 82, train_loss: 0.3059, test_loss: 0.8711, test_f1: 0.7105
 epoch: 83, train_loss: 0.2949, test_loss: 0.8421, test_f1: 0.7136
 epoch: 84, train_loss: 0.3124, test_loss: 0.9928, test_f1: 0.7167
 epoch: 85, train_loss: 0.2952, test_loss: 0.8255, test_f1: 0.7231
 epoch: 86, train_loss: 0.3174, test_loss: 0.9422, test_f1: 0.7302
 epoch: 87, train_loss: 0.3076, test_loss: 0.9155, test_f1: 0.7158
 epoch: 88, train_loss: 0.2930, test_loss: 1.0055, test_f1: 0.6950
 epoch: 89, train_loss: 0.3007, test_loss: 0.9588, test_f1: 0.6955
 epoch: 90, train_loss: 0.3076, test_loss: 0.9304, test_f1: 0.7204
 epoch: 91, train_loss: 0.3235, test_loss: 0.9771, test_f1: 0.6691
 epoch: 92, train_loss: 0.2940, test_loss: 0.9367, test_f1: 0.7049
 epoch: 93, train_loss: 0.3120, test_loss: 0.9215, test_f1: 0.6906
 epoch: 94, train_loss: 0.3053, test_loss: 0.9907, test_f1: 0.7166
 epoch: 95, train_loss: 0.2747, test_loss: 0.9510, test_f1: 0.7470
 epoch: 96, train_loss: 0.2717, test_loss: 0.8807, test_f1: 0.7397
 epoch: 97, train_loss: 0.2819, test_loss: 0.8871, test_f1: 0.7463
 epoch: 98, train_loss: 0.3056, test_loss: 0.8034, test_f1: 0.7247
 epoch: 99, train_loss: 0.2608, test_loss: 1.0486, test_f1: 0.7154
##################ITERATION #1 ****************************************
 epoch: 0, train_loss: 1.1556, test_loss: 1.1116, test_f1: 0.3466
 epoch: 1, train_loss: 1.0176, test_loss: 0.9519, test_f1: 0.4739
 epoch: 2, train_loss: 1.0096, test_loss: 0.9939, test_f1: 0.4872
 epoch: 3, train_loss: 0.9520, test_loss: 0.9680, test_f1: 0.4619
 epoch: 4, train_loss: 0.9256, test_loss: 0.9229, test_f1: 0.4745
 epoch: 5, train_loss: 0.9150, test_loss: 0.9118, test_f1: 0.5307
 epoch: 6, train_loss: 0.9001, test_loss: 1.0169, test_f1: 0.4533
 epoch: 7, train_loss: 0.8723, test_loss: 0.9129, test_f1: 0.5461
 epoch: 8, train_loss: 0.8491, test_loss: 0.9788, test_f1: 0.5094
 epoch: 9, train_loss: 0.8481, test_loss: 0.8538, test_f1: 0.5181
 epoch: 10, train_loss: 0.8324, test_loss: 0.8542, test_f1: 0.5327
 epoch: 11, train_loss: 0.8139, test_loss: 0.8105, test_f1: 0.5556
 epoch: 12, train_loss: 0.7961, test_loss: 0.9547, test_f1: 0.5013
 epoch: 13, train_loss: 0.7944, test_loss: 0.8966, test_f1: 0.5155
 epoch: 14, train_loss: 0.7871, test_loss: 0.9752, test_f1: 0.5129
 epoch: 15, train_loss: 0.7729, test_loss: 0.8126, test_f1: 0.5675
 epoch: 16, train_loss: 0.7515, test_loss: 1.0479, test_f1: 0.4935
 epoch: 17, train_loss: 0.7528, test_loss: 0.8206, test_f1: 0.5692
 epoch: 18, train_loss: 0.7451, test_loss: 1.0623, test_f1: 0.5506
 epoch: 19, train_loss: 0.7505, test_loss: 0.8648, test_f1: 0.5939
 epoch: 20, train_loss: 0.7299, test_loss: 0.9862, test_f1: 0.5962
 epoch: 21, train_loss: 0.7162, test_loss: 0.9546, test_f1: 0.5880
 epoch: 22, train_loss: 0.7095, test_loss: 0.8768, test_f1: 0.5837
 epoch: 23, train_loss: 0.7088, test_loss: 0.8655, test_f1: 0.6121
 epoch: 24, train_loss: 0.6862, test_loss: 0.9252, test_f1: 0.5683
 epoch: 25, train_loss: 0.6927, test_loss: 0.8688, test_f1: 0.5743
 epoch: 26, train_loss: 0.6995, test_loss: 0.8050, test_f1: 0.5823
 epoch: 27, train_loss: 0.6814, test_loss: 0.9193, test_f1: 0.5995
 epoch: 28, train_loss: 0.6906, test_loss: 0.8949, test_f1: 0.5826
 epoch: 29, train_loss: 0.6976, test_loss: 0.8763, test_f1: 0.5903
 epoch: 30, train_loss: 0.6744, test_loss: 1.1420, test_f1: 0.6177
 epoch: 31, train_loss: 0.6665, test_loss: 1.1037, test_f1: 0.5987
 epoch: 32, train_loss: 0.6708, test_loss: 1.0074, test_f1: 0.5301
 epoch: 33, train_loss: 0.6574, test_loss: 0.9890, test_f1: 0.5955
 epoch: 34, train_loss: 0.6677, test_loss: 0.9342, test_f1: 0.5622
 epoch: 35, train_loss: 0.6663, test_loss: 0.7906, test_f1: 0.6451
 epoch: 36, train_loss: 0.6261, test_loss: 0.8748, test_f1: 0.5833
 epoch: 37, train_loss: 0.6214, test_loss: 0.9543, test_f1: 0.5992
 epoch: 38, train_loss: 0.6354, test_loss: 1.1001, test_f1: 0.5569
 epoch: 39, train_loss: 0.6272, test_loss: 0.7752, test_f1: 0.6174
 epoch: 40, train_loss: 0.6033, test_loss: 0.9692, test_f1: 0.6122
 epoch: 41, train_loss: 0.6106, test_loss: 0.8753, test_f1: 0.6051
 epoch: 42, train_loss: 0.5988, test_loss: 0.8299, test_f1: 0.6133
 epoch: 43, train_loss: 0.5900, test_loss: 0.8036, test_f1: 0.6466
 epoch: 44, train_loss: 0.5891, test_loss: 0.9218, test_f1: 0.6087
 epoch: 45, train_loss: 0.5687, test_loss: 0.8420, test_f1: 0.5936
 epoch: 46, train_loss: 0.5801, test_loss: 0.9186, test_f1: 0.5698
 epoch: 47, train_loss: 0.5697, test_loss: 0.9442, test_f1: 0.6083
 epoch: 48, train_loss: 0.5496, test_loss: 0.9990, test_f1: 0.6293
 epoch: 49, train_loss: 0.5839, test_loss: 0.9818, test_f1: 0.6191
 epoch: 50, train_loss: 0.5759, test_loss: 1.0479, test_f1: 0.6180
 epoch: 51, train_loss: 0.5243, test_loss: 0.8663, test_f1: 0.6406
 epoch: 52, train_loss: 0.4964, test_loss: 0.9154, test_f1: 0.6694
 epoch: 53, train_loss: 0.4804, test_loss: 0.9713, test_f1: 0.6666
 epoch: 54, train_loss: 0.4646, test_loss: 1.0202, test_f1: 0.6577
 epoch: 55, train_loss: 0.4647, test_loss: 0.8533, test_f1: 0.6798
 epoch: 56, train_loss: 0.4446, test_loss: 1.0795, test_f1: 0.6264
 epoch: 57, train_loss: 0.4418, test_loss: 1.0834, test_f1: 0.6373
 epoch: 58, train_loss: 0.4383, test_loss: 1.2593, test_f1: 0.6345
 epoch: 59, train_loss: 0.4260, test_loss: 1.2357, test_f1: 0.6415
 epoch: 60, train_loss: 0.4285, test_loss: 1.1082, test_f1: 0.6874
 epoch: 61, train_loss: 0.4272, test_loss: 0.9575, test_f1: 0.6592
 epoch: 62, train_loss: 0.4359, test_loss: 1.1227, test_f1: 0.6759
 epoch: 63, train_loss: 0.4233, test_loss: 1.1451, test_f1: 0.6782
 epoch: 64, train_loss: 0.4161, test_loss: 1.1639, test_f1: 0.6848
 epoch: 65, train_loss: 0.3895, test_loss: 1.2578, test_f1: 0.6644
 epoch: 66, train_loss: 0.3938, test_loss: 1.3735, test_f1: 0.6733
 epoch: 67, train_loss: 0.4049, test_loss: 1.0180, test_f1: 0.6672
 epoch: 68, train_loss: 0.3865, test_loss: 1.1157, test_f1: 0.6397
 epoch: 69, train_loss: 0.3958, test_loss: 1.1920, test_f1: 0.6506
 epoch: 70, train_loss: 0.3672, test_loss: 1.3175, test_f1: 0.6473
 epoch: 71, train_loss: 0.3809, test_loss: 1.2671, test_f1: 0.6635
 epoch: 72, train_loss: 0.3805, test_loss: 1.4810, test_f1: 0.6345
 epoch: 73, train_loss: 0.3642, test_loss: 1.1641, test_f1: 0.6910
 epoch: 74, train_loss: 0.3694, test_loss: 0.9213, test_f1: 0.6919
 epoch: 75, train_loss: 0.3739, test_loss: 1.1355, test_f1: 0.6666
 epoch: 76, train_loss: 0.3488, test_loss: 0.9217, test_f1: 0.6903
 epoch: 77, train_loss: 0.3584, test_loss: 0.9904, test_f1: 0.6788
 epoch: 78, train_loss: 0.3636, test_loss: 0.9941, test_f1: 0.6744
 epoch: 79, train_loss: 0.3493, test_loss: 1.1711, test_f1: 0.6208
 epoch: 80, train_loss: 0.3398, test_loss: 0.9974, test_f1: 0.6497
 epoch: 81, train_loss: 0.3472, test_loss: 1.1738, test_f1: 0.6443
 epoch: 82, train_loss: 0.3337, test_loss: 1.2662, test_f1: 0.6807
 epoch: 83, train_loss: 0.3304, test_loss: 1.2387, test_f1: 0.6775
 epoch: 84, train_loss: 0.3540, test_loss: 0.9495, test_f1: 0.6928
 epoch: 85, train_loss: 0.3191, test_loss: 0.9568, test_f1: 0.6597
 epoch: 86, train_loss: 0.3667, test_loss: 0.9406, test_f1: 0.6757
 epoch: 87, train_loss: 0.3222, test_loss: 0.9636, test_f1: 0.7172
 epoch: 88, train_loss: 0.3260, test_loss: 0.8379, test_f1: 0.6969
 epoch: 89, train_loss: 0.3243, test_loss: 0.9647, test_f1: 0.6647
 epoch: 90, train_loss: 0.3189, test_loss: 0.8854, test_f1: 0.7006
 epoch: 91, train_loss: 0.3046, test_loss: 1.1371, test_f1: 0.6885
 epoch: 92, train_loss: 0.3089, test_loss: 1.0510, test_f1: 0.6792
 epoch: 93, train_loss: 0.2973, test_loss: 1.1053, test_f1: 0.6964
 epoch: 94, train_loss: 0.2943, test_loss: 1.1628, test_f1: 0.6611
 epoch: 95, train_loss: 0.3122, test_loss: 1.1399, test_f1: 0.6778
 epoch: 96, train_loss: 0.2755, test_loss: 1.1522, test_f1: 0.6627
 epoch: 97, train_loss: 0.3203, test_loss: 1.2672, test_f1: 0.6541
 epoch: 98, train_loss: 0.3100, test_loss: 1.1230, test_f1: 0.6710
 epoch: 99, train_loss: 0.2925, test_loss: 1.0487, test_f1: 0.7065
##################ITERATION #2 ****************************************
 epoch: 0, train_loss: 1.1680, test_loss: 1.0523, test_f1: 0.4476
 epoch: 1, train_loss: 1.0072, test_loss: 1.0762, test_f1: 0.3947
 epoch: 2, train_loss: 0.9757, test_loss: 1.4965, test_f1: 0.3641
 epoch: 3, train_loss: 0.9390, test_loss: 0.9875, test_f1: 0.4683
 epoch: 4, train_loss: 0.9345, test_loss: 0.9522, test_f1: 0.5025
 epoch: 5, train_loss: 0.9074, test_loss: 1.0041, test_f1: 0.5319
 epoch: 6, train_loss: 0.8964, test_loss: 0.9571, test_f1: 0.5355
 epoch: 7, train_loss: 0.8706, test_loss: 1.0149, test_f1: 0.4965
 epoch: 8, train_loss: 0.8565, test_loss: 0.9820, test_f1: 0.4820
 epoch: 9, train_loss: 0.8525, test_loss: 0.9313, test_f1: 0.5271
 epoch: 10, train_loss: 0.8451, test_loss: 0.9202, test_f1: 0.5314
 epoch: 11, train_loss: 0.8243, test_loss: 0.8860, test_f1: 0.5944
 epoch: 12, train_loss: 0.8148, test_loss: 1.0838, test_f1: 0.5204
 epoch: 13, train_loss: 0.8149, test_loss: 0.9070, test_f1: 0.5891
 epoch: 14, train_loss: 0.8082, test_loss: 0.9978, test_f1: 0.5249
 epoch: 15, train_loss: 0.8004, test_loss: 0.8610, test_f1: 0.5375
 epoch: 16, train_loss: 0.7678, test_loss: 1.0258, test_f1: 0.4927
 epoch: 17, train_loss: 0.7684, test_loss: 1.0154, test_f1: 0.5161
 epoch: 18, train_loss: 0.7693, test_loss: 1.0964, test_f1: 0.5276
 epoch: 19, train_loss: 0.7557, test_loss: 0.9922, test_f1: 0.5755
 epoch: 20, train_loss: 0.7471, test_loss: 0.8045, test_f1: 0.5608
 epoch: 21, train_loss: 0.7497, test_loss: 0.8795, test_f1: 0.6268
 epoch: 22, train_loss: 0.7404, test_loss: 0.8507, test_f1: 0.5214
 epoch: 23, train_loss: 0.7264, test_loss: 0.9787, test_f1: 0.6085
 epoch: 24, train_loss: 0.7064, test_loss: 1.1483, test_f1: 0.5556
 epoch: 25, train_loss: 0.7305, test_loss: 0.8280, test_f1: 0.6198
 epoch: 26, train_loss: 0.7035, test_loss: 0.9905, test_f1: 0.5358
 epoch: 27, train_loss: 0.6949, test_loss: 0.9192, test_f1: 0.4835
 epoch: 28, train_loss: 0.6894, test_loss: 0.8141, test_f1: 0.5738
 epoch: 29, train_loss: 0.6930, test_loss: 0.8823, test_f1: 0.6385
 epoch: 30, train_loss: 0.6868, test_loss: 0.8153, test_f1: 0.6356
 epoch: 31, train_loss: 0.6761, test_loss: 0.8214, test_f1: 0.6508
 epoch: 32, train_loss: 0.6474, test_loss: 0.7401, test_f1: 0.6290
 epoch: 33, train_loss: 0.6511, test_loss: 0.7583, test_f1: 0.6182
 epoch: 34, train_loss: 0.6477, test_loss: 0.8230, test_f1: 0.5907
 epoch: 35, train_loss: 0.6396, test_loss: 0.7312, test_f1: 0.6479
 epoch: 36, train_loss: 0.6318, test_loss: 0.8195, test_f1: 0.6240
 epoch: 37, train_loss: 0.6281, test_loss: 0.7969, test_f1: 0.6165
 epoch: 38, train_loss: 0.6165, test_loss: 0.7354, test_f1: 0.5941
 epoch: 39, train_loss: 0.6203, test_loss: 0.8230, test_f1: 0.6630
 epoch: 40, train_loss: 0.6145, test_loss: 0.6853, test_f1: 0.6245
 epoch: 41, train_loss: 0.6069, test_loss: 0.8494, test_f1: 0.6126
 epoch: 42, train_loss: 0.6097, test_loss: 0.7134, test_f1: 0.6231
 epoch: 43, train_loss: 0.6171, test_loss: 0.8553, test_f1: 0.5745
 epoch: 44, train_loss: 0.6039, test_loss: 0.8581, test_f1: 0.6175
 epoch: 45, train_loss: 0.5995, test_loss: 0.8372, test_f1: 0.6199
 epoch: 46, train_loss: 0.5758, test_loss: 0.7379, test_f1: 0.6632
 epoch: 47, train_loss: 0.5970, test_loss: 0.8780, test_f1: 0.6492
 epoch: 48, train_loss: 0.5657, test_loss: 0.9343, test_f1: 0.5943
 epoch: 49, train_loss: 0.5824, test_loss: 0.8313, test_f1: 0.6461
 epoch: 50, train_loss: 0.5780, test_loss: 0.8356, test_f1: 0.6273
 epoch: 51, train_loss: 0.5197, test_loss: 0.8334, test_f1: 0.6366
 epoch: 52, train_loss: 0.4973, test_loss: 0.8411, test_f1: 0.6571
 epoch: 53, train_loss: 0.5027, test_loss: 0.7625, test_f1: 0.6594
 epoch: 54, train_loss: 0.4739, test_loss: 0.9214, test_f1: 0.6588
 epoch: 55, train_loss: 0.4708, test_loss: 0.8533, test_f1: 0.6715
 epoch: 56, train_loss: 0.4745, test_loss: 0.7665, test_f1: 0.6738
 epoch: 57, train_loss: 0.4599, test_loss: 0.8227, test_f1: 0.6870
 epoch: 58, train_loss: 0.4549, test_loss: 0.8566, test_f1: 0.6618
 epoch: 59, train_loss: 0.4539, test_loss: 0.8014, test_f1: 0.6799
 epoch: 60, train_loss: 0.4365, test_loss: 0.8568, test_f1: 0.6750
 epoch: 61, train_loss: 0.4409, test_loss: 0.8120, test_f1: 0.6803
 epoch: 62, train_loss: 0.4246, test_loss: 0.7646, test_f1: 0.6956
 epoch: 63, train_loss: 0.4238, test_loss: 0.8968, test_f1: 0.6630
 epoch: 64, train_loss: 0.4391, test_loss: 1.0252, test_f1: 0.6605
 epoch: 65, train_loss: 0.4301, test_loss: 0.9736, test_f1: 0.6566
 epoch: 66, train_loss: 0.4104, test_loss: 0.9608, test_f1: 0.6711
 epoch: 67, train_loss: 0.4106, test_loss: 0.7506, test_f1: 0.6771
 epoch: 68, train_loss: 0.4363, test_loss: 0.8526, test_f1: 0.6500
 epoch: 69, train_loss: 0.4025, test_loss: 0.8782, test_f1: 0.6573
 epoch: 70, train_loss: 0.4181, test_loss: 0.7902, test_f1: 0.6848
 epoch: 71, train_loss: 0.3991, test_loss: 0.8182, test_f1: 0.6621
 epoch: 72, train_loss: 0.3951, test_loss: 0.8794, test_f1: 0.6775
 epoch: 73, train_loss: 0.3780, test_loss: 0.8281, test_f1: 0.6774
 epoch: 74, train_loss: 0.4001, test_loss: 0.7852, test_f1: 0.7044
 epoch: 75, train_loss: 0.3775, test_loss: 0.8838, test_f1: 0.6594
 epoch: 76, train_loss: 0.3773, test_loss: 0.7877, test_f1: 0.6749
 epoch: 77, train_loss: 0.3932, test_loss: 0.7954, test_f1: 0.6825
 epoch: 78, train_loss: 0.3707, test_loss: 0.7955, test_f1: 0.6655
 epoch: 79, train_loss: 0.3880, test_loss: 0.8887, test_f1: 0.6852
 epoch: 80, train_loss: 0.3850, test_loss: 0.8246, test_f1: 0.6676
 epoch: 81, train_loss: 0.3857, test_loss: 0.7735, test_f1: 0.6845
 epoch: 82, train_loss: 0.3580, test_loss: 0.7505, test_f1: 0.7062
 epoch: 83, train_loss: 0.3772, test_loss: 0.9348, test_f1: 0.6619
 epoch: 84, train_loss: 0.3553, test_loss: 0.7308, test_f1: 0.6844
 epoch: 85, train_loss: 0.3531, test_loss: 0.8771, test_f1: 0.6480
 epoch: 86, train_loss: 0.3575, test_loss: 0.7735, test_f1: 0.6781
 epoch: 87, train_loss: 0.3501, test_loss: 0.8743, test_f1: 0.6581
 epoch: 88, train_loss: 0.3641, test_loss: 0.9312, test_f1: 0.6627
 epoch: 89, train_loss: 0.3420, test_loss: 0.7661, test_f1: 0.6938
 epoch: 90, train_loss: 0.3382, test_loss: 0.8169, test_f1: 0.6922
 epoch: 91, train_loss: 0.3414, test_loss: 0.8100, test_f1: 0.6816
 epoch: 92, train_loss: 0.3293, test_loss: 0.8380, test_f1: 0.6876
 epoch: 93, train_loss: 0.3440, test_loss: 0.9551, test_f1: 0.6650
 epoch: 94, train_loss: 0.3093, test_loss: 0.9166, test_f1: 0.6865
 epoch: 95, train_loss: 0.3146, test_loss: 0.8886, test_f1: 0.7007
 epoch: 96, train_loss: 0.3102, test_loss: 0.8239, test_f1: 0.7159
 epoch: 97, train_loss: 0.3191, test_loss: 0.8296, test_f1: 0.6944
 epoch: 98, train_loss: 0.3298, test_loss: 0.8611, test_f1: 0.6865
 epoch: 99, train_loss: 0.2995, test_loss: 0.9221, test_f1: 0.6839
##################ITERATION #3 ****************************************
 epoch: 0, train_loss: 1.1681, test_loss: 1.5062, test_f1: 0.2921
 epoch: 1, train_loss: 0.9910, test_loss: 1.1860, test_f1: 0.4139
 epoch: 2, train_loss: 0.9401, test_loss: 0.9839, test_f1: 0.4898
 epoch: 3, train_loss: 0.9361, test_loss: 1.0205, test_f1: 0.4695
 epoch: 4, train_loss: 0.9105, test_loss: 0.9066, test_f1: 0.5071
 epoch: 5, train_loss: 0.8959, test_loss: 0.9372, test_f1: 0.5333
 epoch: 6, train_loss: 0.8975, test_loss: 0.9663, test_f1: 0.5322
 epoch: 7, train_loss: 0.8775, test_loss: 0.9819, test_f1: 0.5352
 epoch: 8, train_loss: 0.8652, test_loss: 0.8986, test_f1: 0.5475
 epoch: 9, train_loss: 0.8458, test_loss: 0.9306, test_f1: 0.4913
 epoch: 10, train_loss: 0.8267, test_loss: 0.8304, test_f1: 0.5301
 epoch: 11, train_loss: 0.8390, test_loss: 1.0084, test_f1: 0.5947
 epoch: 12, train_loss: 0.8103, test_loss: 0.8978, test_f1: 0.5644
 epoch: 13, train_loss: 0.8093, test_loss: 0.8838, test_f1: 0.5509
 epoch: 14, train_loss: 0.8163, test_loss: 0.8392, test_f1: 0.5235
 epoch: 15, train_loss: 0.7898, test_loss: 0.9156, test_f1: 0.5765
 epoch: 16, train_loss: 0.7904, test_loss: 0.9960, test_f1: 0.5316
 epoch: 17, train_loss: 0.7807, test_loss: 0.9740, test_f1: 0.5309
 epoch: 18, train_loss: 0.7846, test_loss: 0.9056, test_f1: 0.6039
 epoch: 19, train_loss: 0.7701, test_loss: 0.7884, test_f1: 0.5735
 epoch: 20, train_loss: 0.7595, test_loss: 0.8501, test_f1: 0.6308
 epoch: 21, train_loss: 0.7271, test_loss: 0.9297, test_f1: 0.5599
 epoch: 22, train_loss: 0.7412, test_loss: 0.7807, test_f1: 0.5982
 epoch: 23, train_loss: 0.7091, test_loss: 0.7859, test_f1: 0.6483
 epoch: 24, train_loss: 0.7335, test_loss: 0.8390, test_f1: 0.5530
 epoch: 25, train_loss: 0.7197, test_loss: 0.8938, test_f1: 0.6685
 epoch: 26, train_loss: 0.6908, test_loss: 0.8735, test_f1: 0.6062
 epoch: 27, train_loss: 0.6891, test_loss: 0.9460, test_f1: 0.5921
 epoch: 28, train_loss: 0.6871, test_loss: 0.8520, test_f1: 0.5868
 epoch: 29, train_loss: 0.6717, test_loss: 1.0710, test_f1: 0.4974
 epoch: 30, train_loss: 0.6722, test_loss: 0.8953, test_f1: 0.5816
 epoch: 31, train_loss: 0.6510, test_loss: 0.8876, test_f1: 0.5948
 epoch: 32, train_loss: 0.6739, test_loss: 0.8431, test_f1: 0.6641
 epoch: 33, train_loss: 0.6398, test_loss: 0.8276, test_f1: 0.5923
 epoch: 34, train_loss: 0.6793, test_loss: 0.9967, test_f1: 0.5502
 epoch: 35, train_loss: 0.6550, test_loss: 0.7478, test_f1: 0.6420
 epoch: 36, train_loss: 0.6376, test_loss: 0.9268, test_f1: 0.6150
 epoch: 37, train_loss: 0.6049, test_loss: 0.8368, test_f1: 0.6344
 epoch: 38, train_loss: 0.6066, test_loss: 0.9107, test_f1: 0.6130
 epoch: 39, train_loss: 0.6212, test_loss: 0.8543, test_f1: 0.5654
 epoch: 40, train_loss: 0.6140, test_loss: 0.7189, test_f1: 0.6608
 epoch: 41, train_loss: 0.5778, test_loss: 0.7230, test_f1: 0.6733
 epoch: 42, train_loss: 0.6059, test_loss: 0.8383, test_f1: 0.6034
 epoch: 43, train_loss: 0.5810, test_loss: 0.9336, test_f1: 0.6743
 epoch: 44, train_loss: 0.6058, test_loss: 0.7558, test_f1: 0.6232
 epoch: 45, train_loss: 0.5980, test_loss: 0.8549, test_f1: 0.6421
 epoch: 46, train_loss: 0.5589, test_loss: 0.6789, test_f1: 0.6750
 epoch: 47, train_loss: 0.5638, test_loss: 0.8762, test_f1: 0.6328
 epoch: 48, train_loss: 0.5671, test_loss: 1.0092, test_f1: 0.6498
 epoch: 49, train_loss: 0.5510, test_loss: 1.0147, test_f1: 0.5719
 epoch: 50, train_loss: 0.5726, test_loss: 0.8469, test_f1: 0.6210
 epoch: 51, train_loss: 0.5147, test_loss: 0.7497, test_f1: 0.6750
 epoch: 52, train_loss: 0.4810, test_loss: 0.8391, test_f1: 0.6573
 epoch: 53, train_loss: 0.4726, test_loss: 0.8047, test_f1: 0.6813
 epoch: 54, train_loss: 0.4498, test_loss: 0.9091, test_f1: 0.6620
 epoch: 55, train_loss: 0.4685, test_loss: 0.8188, test_f1: 0.6710
 epoch: 56, train_loss: 0.4505, test_loss: 0.8257, test_f1: 0.6864
 epoch: 57, train_loss: 0.4281, test_loss: 0.9743, test_f1: 0.6589
 epoch: 58, train_loss: 0.4306, test_loss: 0.9053, test_f1: 0.6900
 epoch: 59, train_loss: 0.4213, test_loss: 0.8055, test_f1: 0.7094
 epoch: 60, train_loss: 0.4201, test_loss: 0.9330, test_f1: 0.6495
 epoch: 61, train_loss: 0.4209, test_loss: 0.8511, test_f1: 0.6842
 epoch: 62, train_loss: 0.4079, test_loss: 0.8606, test_f1: 0.6900
 epoch: 63, train_loss: 0.4184, test_loss: 1.0089, test_f1: 0.6659
 epoch: 64, train_loss: 0.4272, test_loss: 0.8279, test_f1: 0.6519
 epoch: 65, train_loss: 0.3939, test_loss: 0.7437, test_f1: 0.6953
 epoch: 66, train_loss: 0.4077, test_loss: 0.8097, test_f1: 0.6966
 epoch: 67, train_loss: 0.3958, test_loss: 0.8780, test_f1: 0.6929
 epoch: 68, train_loss: 0.3985, test_loss: 0.9521, test_f1: 0.6718
 epoch: 69, train_loss: 0.4060, test_loss: 0.7840, test_f1: 0.6910
 epoch: 70, train_loss: 0.3917, test_loss: 0.9499, test_f1: 0.6750
 epoch: 71, train_loss: 0.3856, test_loss: 0.8927, test_f1: 0.6943
 epoch: 72, train_loss: 0.3719, test_loss: 0.8574, test_f1: 0.6779
 epoch: 73, train_loss: 0.3735, test_loss: 1.0519, test_f1: 0.6656
 epoch: 74, train_loss: 0.3712, test_loss: 0.9613, test_f1: 0.6931
 epoch: 75, train_loss: 0.3878, test_loss: 0.8863, test_f1: 0.6858
 epoch: 76, train_loss: 0.3666, test_loss: 0.9909, test_f1: 0.6745
 epoch: 77, train_loss: 0.3422, test_loss: 0.8600, test_f1: 0.7033
 epoch: 78, train_loss: 0.3497, test_loss: 1.1583, test_f1: 0.6065
 epoch: 79, train_loss: 0.3722, test_loss: 0.9639, test_f1: 0.6753
 epoch: 80, train_loss: 0.3555, test_loss: 1.0007, test_f1: 0.6852
 epoch: 81, train_loss: 0.3464, test_loss: 0.9809, test_f1: 0.6940
 epoch: 82, train_loss: 0.3456, test_loss: 1.0380, test_f1: 0.6728
 epoch: 83, train_loss: 0.3613, test_loss: 1.0086, test_f1: 0.6934
 epoch: 84, train_loss: 0.3412, test_loss: 0.7972, test_f1: 0.7236
 epoch: 85, train_loss: 0.3380, test_loss: 0.9543, test_f1: 0.6836
 epoch: 86, train_loss: 0.3567, test_loss: 0.9354, test_f1: 0.7160
 epoch: 87, train_loss: 0.3268, test_loss: 0.8979, test_f1: 0.6669
 epoch: 88, train_loss: 0.3284, test_loss: 0.9089, test_f1: 0.6991
 epoch: 89, train_loss: 0.3345, test_loss: 1.0617, test_f1: 0.6863
 epoch: 90, train_loss: 0.3426, test_loss: 1.0148, test_f1: 0.6678
 epoch: 91, train_loss: 0.3142, test_loss: 1.1081, test_f1: 0.6672
 epoch: 92, train_loss: 0.3184, test_loss: 1.0783, test_f1: 0.6786
 epoch: 93, train_loss: 0.3151, test_loss: 1.0056, test_f1: 0.6650
 epoch: 94, train_loss: 0.3102, test_loss: 1.1130, test_f1: 0.7072
 epoch: 95, train_loss: 0.3062, test_loss: 1.1594, test_f1: 0.6692
 epoch: 96, train_loss: 0.3013, test_loss: 1.3287, test_f1: 0.6527
 epoch: 97, train_loss: 0.3415, test_loss: 1.0284, test_f1: 0.7118
 epoch: 98, train_loss: 0.3154, test_loss: 1.1198, test_f1: 0.6868
 epoch: 99, train_loss: 0.3186, test_loss: 1.1214, test_f1: 0.6828
##################ITERATION #4 ****************************************
 epoch: 0, train_loss: 1.1966, test_loss: 1.0138, test_f1: 0.4325
 epoch: 1, train_loss: 0.9859, test_loss: 0.9391, test_f1: 0.4686
 epoch: 2, train_loss: 0.9507, test_loss: 0.9496, test_f1: 0.4868
 epoch: 3, train_loss: 0.9338, test_loss: 0.9708, test_f1: 0.5028
 epoch: 4, train_loss: 0.8982, test_loss: 0.9146, test_f1: 0.5024
 epoch: 5, train_loss: 0.8712, test_loss: 0.8982, test_f1: 0.5130
 epoch: 6, train_loss: 0.8725, test_loss: 0.9125, test_f1: 0.4716
 epoch: 7, train_loss: 0.8566, test_loss: 0.9452, test_f1: 0.4810
 epoch: 8, train_loss: 0.8462, test_loss: 0.8495, test_f1: 0.5334
 epoch: 9, train_loss: 0.8383, test_loss: 0.9571, test_f1: 0.4752
 epoch: 10, train_loss: 0.8179, test_loss: 1.1343, test_f1: 0.4702
 epoch: 11, train_loss: 0.8186, test_loss: 0.8065, test_f1: 0.5602
 epoch: 12, train_loss: 0.8107, test_loss: 0.9406, test_f1: 0.5199
 epoch: 13, train_loss: 0.7933, test_loss: 0.8418, test_f1: 0.5661
 epoch: 14, train_loss: 0.7936, test_loss: 0.8893, test_f1: 0.5912
 epoch: 15, train_loss: 0.7801, test_loss: 0.8766, test_f1: 0.5608
 epoch: 16, train_loss: 0.7714, test_loss: 0.7704, test_f1: 0.5866
 epoch: 17, train_loss: 0.7580, test_loss: 1.5906, test_f1: 0.4827
 epoch: 18, train_loss: 0.7399, test_loss: 1.0747, test_f1: 0.5627
 epoch: 19, train_loss: 0.7566, test_loss: 0.8104, test_f1: 0.6130
 epoch: 20, train_loss: 0.7271, test_loss: 0.7761, test_f1: 0.5737
 epoch: 21, train_loss: 0.7501, test_loss: 0.7642, test_f1: 0.6064
 epoch: 22, train_loss: 0.7248, test_loss: 0.8544, test_f1: 0.5963
 epoch: 23, train_loss: 0.6925, test_loss: 0.8609, test_f1: 0.5935
 epoch: 24, train_loss: 0.6981, test_loss: 0.8803, test_f1: 0.5213
 epoch: 25, train_loss: 0.7125, test_loss: 0.9039, test_f1: 0.5857
 epoch: 26, train_loss: 0.6966, test_loss: 0.8005, test_f1: 0.5817
 epoch: 27, train_loss: 0.6934, test_loss: 0.8168, test_f1: 0.6230
 epoch: 28, train_loss: 0.6803, test_loss: 0.9488, test_f1: 0.5751
 epoch: 29, train_loss: 0.6901, test_loss: 0.9068, test_f1: 0.6095
 epoch: 30, train_loss: 0.6752, test_loss: 0.8667, test_f1: 0.6439
 epoch: 31, train_loss: 0.6590, test_loss: 0.8427, test_f1: 0.5903
 epoch: 32, train_loss: 0.6388, test_loss: 0.9350, test_f1: 0.5801
 epoch: 33, train_loss: 0.6659, test_loss: 0.9654, test_f1: 0.6149
 epoch: 34, train_loss: 0.7339, test_loss: 0.9501, test_f1: 0.5753
 epoch: 35, train_loss: 0.6715, test_loss: 0.7746, test_f1: 0.6348
 epoch: 36, train_loss: 0.6543, test_loss: 1.0772, test_f1: 0.5528
 epoch: 37, train_loss: 0.6603, test_loss: 0.9468, test_f1: 0.6134
 epoch: 38, train_loss: 0.6456, test_loss: 0.8024, test_f1: 0.6170
 epoch: 39, train_loss: 0.6216, test_loss: 0.7766, test_f1: 0.6143
 epoch: 40, train_loss: 0.6177, test_loss: 1.0076, test_f1: 0.5636
 epoch: 41, train_loss: 0.6147, test_loss: 0.8054, test_f1: 0.6055
 epoch: 42, train_loss: 0.6124, test_loss: 0.9904, test_f1: 0.5951
 epoch: 43, train_loss: 0.5945, test_loss: 0.8766, test_f1: 0.6261
 epoch: 44, train_loss: 0.5788, test_loss: 0.8315, test_f1: 0.6515
 epoch: 45, train_loss: 0.5970, test_loss: 1.0019, test_f1: 0.6182
 epoch: 46, train_loss: 0.5571, test_loss: 1.1244, test_f1: 0.6445
 epoch: 47, train_loss: 0.5770, test_loss: 0.8371, test_f1: 0.6096
 epoch: 48, train_loss: 0.5929, test_loss: 0.9754, test_f1: 0.5839
 epoch: 49, train_loss: 0.5886, test_loss: 1.2008, test_f1: 0.5908
 epoch: 50, train_loss: 0.5691, test_loss: 0.9857, test_f1: 0.6384
 epoch: 51, train_loss: 0.5150, test_loss: 1.0964, test_f1: 0.6048
 epoch: 52, train_loss: 0.5078, test_loss: 1.0769, test_f1: 0.6587
 epoch: 53, train_loss: 0.4696, test_loss: 1.0043, test_f1: 0.6378
 epoch: 54, train_loss: 0.4714, test_loss: 0.9859, test_f1: 0.6500
 epoch: 55, train_loss: 0.4760, test_loss: 1.0001, test_f1: 0.6382
 epoch: 56, train_loss: 0.4629, test_loss: 1.1603, test_f1: 0.6557
 epoch: 57, train_loss: 0.4470, test_loss: 1.0519, test_f1: 0.6751
 epoch: 58, train_loss: 0.4604, test_loss: 0.9325, test_f1: 0.6641
 epoch: 59, train_loss: 0.4403, test_loss: 1.1758, test_f1: 0.6422
 epoch: 60, train_loss: 0.4297, test_loss: 0.9848, test_f1: 0.6829
 epoch: 61, train_loss: 0.4568, test_loss: 1.1247, test_f1: 0.6481
 epoch: 62, train_loss: 0.4394, test_loss: 1.2132, test_f1: 0.6810
 epoch: 63, train_loss: 0.4319, test_loss: 1.1553, test_f1: 0.6531
 epoch: 64, train_loss: 0.4227, test_loss: 0.9587, test_f1: 0.6450
 epoch: 65, train_loss: 0.4279, test_loss: 1.0556, test_f1: 0.6610
 epoch: 66, train_loss: 0.4164, test_loss: 1.1556, test_f1: 0.6308
 epoch: 67, train_loss: 0.3995, test_loss: 1.1704, test_f1: 0.6558
 epoch: 68, train_loss: 0.4259, test_loss: 1.1932, test_f1: 0.6320
 epoch: 69, train_loss: 0.4210, test_loss: 1.0993, test_f1: 0.6885
 epoch: 70, train_loss: 0.4077, test_loss: 1.1922, test_f1: 0.6414
 epoch: 71, train_loss: 0.4157, test_loss: 1.0994, test_f1: 0.6314
 epoch: 72, train_loss: 0.4028, test_loss: 1.1664, test_f1: 0.6718
 epoch: 73, train_loss: 0.3989, test_loss: 0.9902, test_f1: 0.6761
 epoch: 74, train_loss: 0.3957, test_loss: 0.9255, test_f1: 0.7081
 epoch: 75, train_loss: 0.3928, test_loss: 1.0325, test_f1: 0.6400
 epoch: 76, train_loss: 0.3968, test_loss: 1.0654, test_f1: 0.6741
 epoch: 77, train_loss: 0.3808, test_loss: 1.2323, test_f1: 0.6686
 epoch: 78, train_loss: 0.3680, test_loss: 1.1955, test_f1: 0.6617
 epoch: 79, train_loss: 0.3676, test_loss: 1.2656, test_f1: 0.6656
 epoch: 80, train_loss: 0.3700, test_loss: 1.1192, test_f1: 0.6539
 epoch: 81, train_loss: 0.3670, test_loss: 1.1161, test_f1: 0.6635
 epoch: 82, train_loss: 0.3503, test_loss: 1.1105, test_f1: 0.6921
 epoch: 83, train_loss: 0.3519, test_loss: 1.2235, test_f1: 0.6535
 epoch: 84, train_loss: 0.3794, test_loss: 1.1865, test_f1: 0.6490
 epoch: 85, train_loss: 0.3411, test_loss: 1.2017, test_f1: 0.6769
 epoch: 86, train_loss: 0.3362, test_loss: 1.2830, test_f1: 0.6732
 epoch: 87, train_loss: 0.3210, test_loss: 1.2448, test_f1: 0.6037
 epoch: 88, train_loss: 0.3343, test_loss: 1.3512, test_f1: 0.6457
 epoch: 89, train_loss: 0.3510, test_loss: 1.0795, test_f1: 0.6702
 epoch: 90, train_loss: 0.3179, test_loss: 1.2620, test_f1: 0.6367
 epoch: 91, train_loss: 0.3601, test_loss: 1.0794, test_f1: 0.6328
 epoch: 92, train_loss: 0.3180, test_loss: 1.0826, test_f1: 0.7115
 epoch: 93, train_loss: 0.3227, test_loss: 1.0955, test_f1: 0.6498
 epoch: 94, train_loss: 0.3296, test_loss: 1.1372, test_f1: 0.6734
 epoch: 95, train_loss: 0.3865, test_loss: 1.2075, test_f1: 0.6545
 epoch: 96, train_loss: 0.3195, test_loss: 1.2616, test_f1: 0.6969
 epoch: 97, train_loss: 0.3247, test_loss: 1.1958, test_f1: 0.6409
 epoch: 98, train_loss: 0.3286, test_loss: 1.0703, test_f1: 0.6750
 epoch: 99, train_loss: 0.2839, test_loss: 1.1601, test_f1: 0.6824
##################ITERATION #5 ****************************************
 epoch: 0, train_loss: 1.2678, test_loss: 1.2802, test_f1: 0.3399
 epoch: 1, train_loss: 1.0405, test_loss: 1.0388, test_f1: 0.5168
 epoch: 2, train_loss: 0.9864, test_loss: 0.9465, test_f1: 0.4772
 epoch: 3, train_loss: 0.9728, test_loss: 1.0584, test_f1: 0.4823
 epoch: 4, train_loss: 0.9336, test_loss: 1.0375, test_f1: 0.4268
 epoch: 5, train_loss: 0.9271, test_loss: 1.0033, test_f1: 0.5007
 epoch: 6, train_loss: 0.9056, test_loss: 0.9846, test_f1: 0.5226
 epoch: 7, train_loss: 0.8832, test_loss: 0.9293, test_f1: 0.4974
 epoch: 8, train_loss: 0.8782, test_loss: 1.0121, test_f1: 0.5180
 epoch: 9, train_loss: 0.8891, test_loss: 1.0028, test_f1: 0.4582
 epoch: 10, train_loss: 0.8725, test_loss: 1.0016, test_f1: 0.4830
 epoch: 11, train_loss: 0.8641, test_loss: 0.9850, test_f1: 0.5639
 epoch: 12, train_loss: 0.8491, test_loss: 1.1359, test_f1: 0.5206
 epoch: 13, train_loss: 0.8268, test_loss: 0.8608, test_f1: 0.4841
 epoch: 14, train_loss: 0.8196, test_loss: 0.9185, test_f1: 0.5286
 epoch: 15, train_loss: 0.8010, test_loss: 0.9357, test_f1: 0.5494
 epoch: 16, train_loss: 0.7978, test_loss: 0.8520, test_f1: 0.6113
 epoch: 17, train_loss: 0.7859, test_loss: 1.1764, test_f1: 0.5542
 epoch: 18, train_loss: 0.8146, test_loss: 0.8759, test_f1: 0.6052
 epoch: 19, train_loss: 0.7763, test_loss: 0.8739, test_f1: 0.5345
 epoch: 20, train_loss: 0.7716, test_loss: 0.8555, test_f1: 0.6109
 epoch: 21, train_loss: 0.7501, test_loss: 1.0055, test_f1: 0.5134
 epoch: 22, train_loss: 0.7347, test_loss: 0.9248, test_f1: 0.5483
 epoch: 23, train_loss: 0.7446, test_loss: 0.9717, test_f1: 0.5407
 epoch: 24, train_loss: 0.7420, test_loss: 0.8017, test_f1: 0.6028
 epoch: 25, train_loss: 0.7189, test_loss: 1.0098, test_f1: 0.5671
 epoch: 26, train_loss: 0.7132, test_loss: 0.8064, test_f1: 0.6359
 epoch: 27, train_loss: 0.7009, test_loss: 0.9023, test_f1: 0.5743
 epoch: 28, train_loss: 0.7186, test_loss: 0.9068, test_f1: 0.5851
 epoch: 29, train_loss: 0.7035, test_loss: 1.0201, test_f1: 0.6183
 epoch: 30, train_loss: 0.6828, test_loss: 0.8544, test_f1: 0.5946
 epoch: 31, train_loss: 0.6995, test_loss: 0.9306, test_f1: 0.5598
 epoch: 32, train_loss: 0.6793, test_loss: 1.0548, test_f1: 0.5617
 epoch: 33, train_loss: 0.6866, test_loss: 0.8932, test_f1: 0.5767
 epoch: 34, train_loss: 0.6726, test_loss: 0.8609, test_f1: 0.5869
 epoch: 35, train_loss: 0.6524, test_loss: 1.2594, test_f1: 0.5704
 epoch: 36, train_loss: 0.6504, test_loss: 0.7329, test_f1: 0.6084
 epoch: 37, train_loss: 0.6684, test_loss: 0.9788, test_f1: 0.5944
 epoch: 38, train_loss: 0.6509, test_loss: 0.9108, test_f1: 0.5450
 epoch: 39, train_loss: 0.6410, test_loss: 0.8936, test_f1: 0.5655
 epoch: 40, train_loss: 0.6396, test_loss: 0.9135, test_f1: 0.6314
 epoch: 41, train_loss: 0.6317, test_loss: 0.9657, test_f1: 0.6314
 epoch: 42, train_loss: 0.6125, test_loss: 0.8190, test_f1: 0.5955
 epoch: 43, train_loss: 0.6298, test_loss: 0.7356, test_f1: 0.6237
 epoch: 44, train_loss: 0.6066, test_loss: 0.7738, test_f1: 0.6271
 epoch: 45, train_loss: 0.5927, test_loss: 0.8175, test_f1: 0.6490
 epoch: 46, train_loss: 0.6188, test_loss: 0.8616, test_f1: 0.6625
 epoch: 47, train_loss: 0.6083, test_loss: 0.9690, test_f1: 0.6471
 epoch: 48, train_loss: 0.5860, test_loss: 0.9097, test_f1: 0.5307
 epoch: 49, train_loss: 0.5998, test_loss: 0.8746, test_f1: 0.5970
 epoch: 50, train_loss: 0.5673, test_loss: 0.9037, test_f1: 0.6528
 epoch: 51, train_loss: 0.5293, test_loss: 0.8742, test_f1: 0.6416
 epoch: 52, train_loss: 0.5197, test_loss: 0.7826, test_f1: 0.6279
 epoch: 53, train_loss: 0.4937, test_loss: 0.9616, test_f1: 0.6389
 epoch: 54, train_loss: 0.5149, test_loss: 0.9905, test_f1: 0.6602
 epoch: 55, train_loss: 0.4882, test_loss: 1.0825, test_f1: 0.6664
 epoch: 56, train_loss: 0.4978, test_loss: 1.1239, test_f1: 0.6386
 epoch: 57, train_loss: 0.4941, test_loss: 1.1516, test_f1: 0.6861
 epoch: 58, train_loss: 0.4791, test_loss: 1.2004, test_f1: 0.6560
 epoch: 59, train_loss: 0.4618, test_loss: 1.2206, test_f1: 0.6884
 epoch: 60, train_loss: 0.4839, test_loss: 1.1584, test_f1: 0.6663
 epoch: 61, train_loss: 0.4738, test_loss: 1.0254, test_f1: 0.6781
 epoch: 62, train_loss: 0.4580, test_loss: 1.1777, test_f1: 0.6572
 epoch: 63, train_loss: 0.4433, test_loss: 1.1426, test_f1: 0.6519
 epoch: 64, train_loss: 0.4513, test_loss: 1.1900, test_f1: 0.6334
 epoch: 65, train_loss: 0.4417, test_loss: 1.1407, test_f1: 0.6583
 epoch: 66, train_loss: 0.4273, test_loss: 1.3246, test_f1: 0.6875
 epoch: 67, train_loss: 0.4294, test_loss: 1.2772, test_f1: 0.6707
 epoch: 68, train_loss: 0.4349, test_loss: 1.2172, test_f1: 0.6476
 epoch: 69, train_loss: 0.4147, test_loss: 1.3195, test_f1: 0.6585
 epoch: 70, train_loss: 0.4337, test_loss: 1.3278, test_f1: 0.6517
 epoch: 71, train_loss: 0.4280, test_loss: 1.3353, test_f1: 0.6769
 epoch: 72, train_loss: 0.4040, test_loss: 1.4823, test_f1: 0.6738
 epoch: 73, train_loss: 0.3966, test_loss: 1.6066, test_f1: 0.6556
 epoch: 74, train_loss: 0.4111, test_loss: 1.6041, test_f1: 0.6103
 epoch: 75, train_loss: 0.3922, test_loss: 1.4321, test_f1: 0.6707
 epoch: 76, train_loss: 0.4193, test_loss: 1.2805, test_f1: 0.6625
 epoch: 77, train_loss: 0.3963, test_loss: 1.2659, test_f1: 0.6794
 epoch: 78, train_loss: 0.4195, test_loss: 1.3846, test_f1: 0.6619
 epoch: 79, train_loss: 0.3853, test_loss: 1.3369, test_f1: 0.6742
 epoch: 80, train_loss: 0.4099, test_loss: 1.2675, test_f1: 0.6698
 epoch: 81, train_loss: 0.3817, test_loss: 1.0457, test_f1: 0.6869
 epoch: 82, train_loss: 0.3847, test_loss: 1.2602, test_f1: 0.6529
 epoch: 83, train_loss: 0.3791, test_loss: 1.3695, test_f1: 0.6434
 epoch: 84, train_loss: 0.3821, test_loss: 1.6143, test_f1: 0.6055
 epoch: 85, train_loss: 0.3776, test_loss: 1.3786, test_f1: 0.6783
 epoch: 86, train_loss: 0.3592, test_loss: 1.5269, test_f1: 0.6264
 epoch: 87, train_loss: 0.4082, test_loss: 1.2593, test_f1: 0.6866
 epoch: 88, train_loss: 0.3971, test_loss: 1.4399, test_f1: 0.6710
 epoch: 89, train_loss: 0.3730, test_loss: 1.6203, test_f1: 0.6051
 epoch: 90, train_loss: 0.3514, test_loss: 1.4409, test_f1: 0.6661
 epoch: 91, train_loss: 0.3569, test_loss: 1.2071, test_f1: 0.6843
 epoch: 92, train_loss: 0.3367, test_loss: 1.2992, test_f1: 0.6930
 epoch: 93, train_loss: 0.3421, test_loss: 1.2743, test_f1: 0.6962
 epoch: 94, train_loss: 0.3490, test_loss: 1.4053, test_f1: 0.6592
 epoch: 95, train_loss: 0.3297, test_loss: 1.3278, test_f1: 0.6915
 epoch: 96, train_loss: 0.3286, test_loss: 1.5926, test_f1: 0.6509
 epoch: 97, train_loss: 0.3498, test_loss: 1.2774, test_f1: 0.6758
 epoch: 98, train_loss: 0.3376, test_loss: 1.3232, test_f1: 0.6975
 epoch: 99, train_loss: 0.3135, test_loss: 1.4789, test_f1: 0.6738
##################ITERATION #6 ****************************************
 epoch: 0, train_loss: 1.2045, test_loss: 1.0586, test_f1: 0.5223
 epoch: 1, train_loss: 1.0097, test_loss: 1.0026, test_f1: 0.5308
 epoch: 2, train_loss: 0.9688, test_loss: 1.0371, test_f1: 0.4828
 epoch: 3, train_loss: 0.9402, test_loss: 1.0225, test_f1: 0.4901
 epoch: 4, train_loss: 0.9250, test_loss: 1.0048, test_f1: 0.5341
 epoch: 5, train_loss: 0.9209, test_loss: 1.0839, test_f1: 0.4616
 epoch: 6, train_loss: 0.9279, test_loss: 1.0445, test_f1: 0.5044
 epoch: 7, train_loss: 0.9119, test_loss: 0.9324, test_f1: 0.5000
 epoch: 8, train_loss: 0.8954, test_loss: 0.9078, test_f1: 0.4626
 epoch: 9, train_loss: 0.8571, test_loss: 0.9615, test_f1: 0.5538
 epoch: 10, train_loss: 0.8767, test_loss: 1.0059, test_f1: 0.4865
 epoch: 11, train_loss: 0.8590, test_loss: 1.0657, test_f1: 0.4975
 epoch: 12, train_loss: 0.8643, test_loss: 1.0925, test_f1: 0.5214
 epoch: 13, train_loss: 0.8726, test_loss: 1.1616, test_f1: 0.5181
 epoch: 14, train_loss: 0.8559, test_loss: 0.8929, test_f1: 0.5442
 epoch: 15, train_loss: 0.8334, test_loss: 0.8254, test_f1: 0.5887
 epoch: 16, train_loss: 0.8174, test_loss: 1.0515, test_f1: 0.5817
 epoch: 17, train_loss: 0.8123, test_loss: 0.9192, test_f1: 0.5327
 epoch: 18, train_loss: 0.7899, test_loss: 1.0232, test_f1: 0.5443
 epoch: 19, train_loss: 0.7877, test_loss: 0.9729, test_f1: 0.5405
 epoch: 20, train_loss: 0.7890, test_loss: 0.8103, test_f1: 0.6055
 epoch: 21, train_loss: 0.7790, test_loss: 1.0254, test_f1: 0.5630
 epoch: 22, train_loss: 0.7460, test_loss: 0.8232, test_f1: 0.6474
 epoch: 23, train_loss: 0.7690, test_loss: 0.7754, test_f1: 0.5768
 epoch: 24, train_loss: 0.7682, test_loss: 0.8471, test_f1: 0.5708
 epoch: 25, train_loss: 0.7390, test_loss: 0.8188, test_f1: 0.6145
 epoch: 26, train_loss: 0.7294, test_loss: 1.0591, test_f1: 0.5944
 epoch: 27, train_loss: 0.7274, test_loss: 1.0173, test_f1: 0.6236
 epoch: 28, train_loss: 0.7189, test_loss: 0.8911, test_f1: 0.6207
 epoch: 29, train_loss: 0.7179, test_loss: 0.9847, test_f1: 0.6157
 epoch: 30, train_loss: 0.7205, test_loss: 0.9313, test_f1: 0.5610
 epoch: 31, train_loss: 0.6917, test_loss: 0.9611, test_f1: 0.5574
 epoch: 32, train_loss: 0.6932, test_loss: 0.9757, test_f1: 0.6649
 epoch: 33, train_loss: 0.6900, test_loss: 0.9680, test_f1: 0.6231
 epoch: 34, train_loss: 0.6809, test_loss: 1.1046, test_f1: 0.6315
 epoch: 35, train_loss: 0.6814, test_loss: 1.0263, test_f1: 0.6367
 epoch: 36, train_loss: 0.6586, test_loss: 1.0128, test_f1: 0.6177
 epoch: 37, train_loss: 0.6519, test_loss: 0.8782, test_f1: 0.6292
 epoch: 38, train_loss: 0.6465, test_loss: 0.8481, test_f1: 0.6260
 epoch: 39, train_loss: 0.6313, test_loss: 0.8850, test_f1: 0.5993
 epoch: 40, train_loss: 0.6768, test_loss: 1.1152, test_f1: 0.5914
 epoch: 41, train_loss: 0.6570, test_loss: 1.0107, test_f1: 0.6155
 epoch: 42, train_loss: 0.6356, test_loss: 0.9684, test_f1: 0.6079
 epoch: 43, train_loss: 0.6285, test_loss: 1.0028, test_f1: 0.5959
 epoch: 44, train_loss: 0.6177, test_loss: 1.0507, test_f1: 0.6499
 epoch: 45, train_loss: 0.6084, test_loss: 0.9636, test_f1: 0.6624
 epoch: 46, train_loss: 0.5914, test_loss: 1.1593, test_f1: 0.6405
 epoch: 47, train_loss: 0.5870, test_loss: 0.8888, test_f1: 0.6309
 epoch: 48, train_loss: 0.6015, test_loss: 1.1337, test_f1: 0.6795
 epoch: 49, train_loss: 0.6034, test_loss: 1.2589, test_f1: 0.5412
 epoch: 50, train_loss: 0.6174, test_loss: 1.0343, test_f1: 0.6395
 epoch: 51, train_loss: 0.5431, test_loss: 1.0128, test_f1: 0.6795
 epoch: 52, train_loss: 0.5049, test_loss: 1.4703, test_f1: 0.5130
 epoch: 53, train_loss: 0.5027, test_loss: 1.1157, test_f1: 0.6737
 epoch: 54, train_loss: 0.4956, test_loss: 1.1354, test_f1: 0.6335
 epoch: 55, train_loss: 0.5139, test_loss: 1.0239, test_f1: 0.6610
 epoch: 56, train_loss: 0.4793, test_loss: 1.0449, test_f1: 0.6877
 epoch: 57, train_loss: 0.4839, test_loss: 1.0847, test_f1: 0.6762
 epoch: 58, train_loss: 0.4660, test_loss: 1.0926, test_f1: 0.6759
 epoch: 59, train_loss: 0.4658, test_loss: 0.9994, test_f1: 0.6878
 epoch: 60, train_loss: 0.4550, test_loss: 0.9762, test_f1: 0.7017
 epoch: 61, train_loss: 0.4495, test_loss: 1.2082, test_f1: 0.6776
 epoch: 62, train_loss: 0.4769, test_loss: 1.0905, test_f1: 0.6934
 epoch: 63, train_loss: 0.4497, test_loss: 1.1350, test_f1: 0.6649
 epoch: 64, train_loss: 0.4316, test_loss: 1.3006, test_f1: 0.6565
 epoch: 65, train_loss: 0.4486, test_loss: 1.1092, test_f1: 0.6553
 epoch: 66, train_loss: 0.4443, test_loss: 1.3282, test_f1: 0.6333
 epoch: 67, train_loss: 0.4422, test_loss: 1.1706, test_f1: 0.6345
 epoch: 68, train_loss: 0.4499, test_loss: 1.2057, test_f1: 0.6530
 epoch: 69, train_loss: 0.4164, test_loss: 1.0952, test_f1: 0.6539
 epoch: 70, train_loss: 0.4370, test_loss: 1.2516, test_f1: 0.6489
 epoch: 71, train_loss: 0.4130, test_loss: 1.0922, test_f1: 0.6797
 epoch: 72, train_loss: 0.4277, test_loss: 0.9834, test_f1: 0.6486
 epoch: 73, train_loss: 0.3970, test_loss: 1.0047, test_f1: 0.6751
 epoch: 74, train_loss: 0.4164, test_loss: 1.0122, test_f1: 0.6798
 epoch: 75, train_loss: 0.3872, test_loss: 1.1575, test_f1: 0.6711
 epoch: 76, train_loss: 0.4084, test_loss: 1.4416, test_f1: 0.6109
 epoch: 77, train_loss: 0.3864, test_loss: 1.1132, test_f1: 0.6557
 epoch: 78, train_loss: 0.4014, test_loss: 1.0182, test_f1: 0.6928
 epoch: 79, train_loss: 0.3906, test_loss: 1.2035, test_f1: 0.6534
 epoch: 80, train_loss: 0.3873, test_loss: 1.1451, test_f1: 0.6690
 epoch: 81, train_loss: 0.3881, test_loss: 1.0628, test_f1: 0.6765
 epoch: 82, train_loss: 0.3833, test_loss: 1.1766, test_f1: 0.6596
 epoch: 83, train_loss: 0.4008, test_loss: 1.2912, test_f1: 0.6851
 epoch: 84, train_loss: 0.3668, test_loss: 1.1847, test_f1: 0.6921
 epoch: 85, train_loss: 0.3661, test_loss: 1.3261, test_f1: 0.6597
 epoch: 86, train_loss: 0.3799, test_loss: 1.2556, test_f1: 0.6743
 epoch: 87, train_loss: 0.3558, test_loss: 1.2491, test_f1: 0.6902
 epoch: 88, train_loss: 0.3467, test_loss: 1.0308, test_f1: 0.6848
 epoch: 89, train_loss: 0.3466, test_loss: 1.2902, test_f1: 0.6537
 epoch: 90, train_loss: 0.3599, test_loss: 1.3024, test_f1: 0.6754
 epoch: 91, train_loss: 0.3479, test_loss: 1.1721, test_f1: 0.6802
 epoch: 92, train_loss: 0.3445, test_loss: 1.2040, test_f1: 0.6862
 epoch: 93, train_loss: 0.3353, test_loss: 1.1622, test_f1: 0.6734
 epoch: 94, train_loss: 0.3474, test_loss: 1.2042, test_f1: 0.6741
 epoch: 95, train_loss: 0.3168, test_loss: 1.5159, test_f1: 0.6637
 epoch: 96, train_loss: 0.3882, test_loss: 1.1741, test_f1: 0.6534
 epoch: 97, train_loss: 0.3398, test_loss: 1.3366, test_f1: 0.6627
 epoch: 98, train_loss: 0.3186, test_loss: 1.1356, test_f1: 0.6932
 epoch: 99, train_loss: 0.3319, test_loss: 1.2663, test_f1: 0.6742
##################ITERATION #7 ****************************************
 epoch: 0, train_loss: 1.2702, test_loss: 1.1536, test_f1: 0.4287
 epoch: 1, train_loss: 1.0154, test_loss: 1.2338, test_f1: 0.3511
 epoch: 2, train_loss: 0.9929, test_loss: 1.4364, test_f1: 0.3358
 epoch: 3, train_loss: 0.9567, test_loss: 1.0636, test_f1: 0.5041
 epoch: 4, train_loss: 0.9313, test_loss: 1.0470, test_f1: 0.4479
 epoch: 5, train_loss: 0.9271, test_loss: 0.9899, test_f1: 0.4488
 epoch: 6, train_loss: 0.8876, test_loss: 0.9329, test_f1: 0.5088
 epoch: 7, train_loss: 0.8716, test_loss: 0.9346, test_f1: 0.5573
 epoch: 8, train_loss: 0.8632, test_loss: 0.9610, test_f1: 0.5431
 epoch: 9, train_loss: 0.8666, test_loss: 0.9707, test_f1: 0.5055
 epoch: 10, train_loss: 0.8378, test_loss: 0.9556, test_f1: 0.4981
 epoch: 11, train_loss: 0.8358, test_loss: 0.8740, test_f1: 0.5279
 epoch: 12, train_loss: 0.8014, test_loss: 0.8589, test_f1: 0.5592
 epoch: 13, train_loss: 0.8208, test_loss: 1.0093, test_f1: 0.5267
 epoch: 14, train_loss: 0.7896, test_loss: 0.8099, test_f1: 0.6082
 epoch: 15, train_loss: 0.7957, test_loss: 0.8299, test_f1: 0.5637
 epoch: 16, train_loss: 0.7574, test_loss: 0.8319, test_f1: 0.5578
 epoch: 17, train_loss: 0.7749, test_loss: 0.8626, test_f1: 0.5389
 epoch: 18, train_loss: 0.7682, test_loss: 0.8967, test_f1: 0.5263
 epoch: 19, train_loss: 0.7543, test_loss: 1.1248, test_f1: 0.4763
 epoch: 20, train_loss: 0.7472, test_loss: 0.9209, test_f1: 0.5809
 epoch: 21, train_loss: 0.7271, test_loss: 0.9638, test_f1: 0.5562
 epoch: 22, train_loss: 0.7611, test_loss: 0.9242, test_f1: 0.5815
 epoch: 23, train_loss: 0.7163, test_loss: 0.8206, test_f1: 0.6208
 epoch: 24, train_loss: 0.7146, test_loss: 1.0166, test_f1: 0.5658
 epoch: 25, train_loss: 0.7010, test_loss: 0.8386, test_f1: 0.6222
 epoch: 26, train_loss: 0.7095, test_loss: 0.9754, test_f1: 0.5927
 epoch: 27, train_loss: 0.6984, test_loss: 0.8193, test_f1: 0.6538
 epoch: 28, train_loss: 0.6935, test_loss: 0.9503, test_f1: 0.6033
 epoch: 29, train_loss: 0.6829, test_loss: 0.7557, test_f1: 0.6306
 epoch: 30, train_loss: 0.6740, test_loss: 0.8323, test_f1: 0.5968
 epoch: 31, train_loss: 0.6796, test_loss: 0.9759, test_f1: 0.5779
 epoch: 32, train_loss: 0.6707, test_loss: 1.0018, test_f1: 0.6067
 epoch: 33, train_loss: 0.6912, test_loss: 1.1878, test_f1: 0.5033
 epoch: 34, train_loss: 0.6629, test_loss: 1.0192, test_f1: 0.5936
 epoch: 35, train_loss: 0.6528, test_loss: 0.8742, test_f1: 0.5951
 epoch: 36, train_loss: 0.6565, test_loss: 0.8474, test_f1: 0.6358
 epoch: 37, train_loss: 0.6111, test_loss: 0.8460, test_f1: 0.6298
 epoch: 38, train_loss: 0.6333, test_loss: 0.8550, test_f1: 0.6401
 epoch: 39, train_loss: 0.6010, test_loss: 0.9801, test_f1: 0.6268
 epoch: 40, train_loss: 0.6134, test_loss: 1.1558, test_f1: 0.5791
 epoch: 41, train_loss: 0.6207, test_loss: 1.3788, test_f1: 0.5830
 epoch: 42, train_loss: 0.6440, test_loss: 0.8740, test_f1: 0.5803
 epoch: 43, train_loss: 0.6521, test_loss: 0.9260, test_f1: 0.6190
 epoch: 44, train_loss: 0.6126, test_loss: 0.8291, test_f1: 0.6002
 epoch: 45, train_loss: 0.5978, test_loss: 0.8746, test_f1: 0.5799
 epoch: 46, train_loss: 0.5912, test_loss: 0.7799, test_f1: 0.6670
 epoch: 47, train_loss: 0.5800, test_loss: 0.8624, test_f1: 0.6339
 epoch: 48, train_loss: 0.5871, test_loss: 0.9323, test_f1: 0.5827
 epoch: 49, train_loss: 0.5684, test_loss: 0.8791, test_f1: 0.6799
 epoch: 50, train_loss: 0.5856, test_loss: 0.9245, test_f1: 0.6604
 epoch: 51, train_loss: 0.5446, test_loss: 0.9398, test_f1: 0.6353
 epoch: 52, train_loss: 0.5018, test_loss: 1.0394, test_f1: 0.6333
 epoch: 53, train_loss: 0.4847, test_loss: 0.8926, test_f1: 0.6633
 epoch: 54, train_loss: 0.4819, test_loss: 0.8902, test_f1: 0.6491
 epoch: 55, train_loss: 0.4726, test_loss: 0.9739, test_f1: 0.6415
 epoch: 56, train_loss: 0.4724, test_loss: 0.9773, test_f1: 0.6518
 epoch: 57, train_loss: 0.4576, test_loss: 0.9681, test_f1: 0.6498
 epoch: 58, train_loss: 0.4377, test_loss: 1.1653, test_f1: 0.6451
 epoch: 59, train_loss: 0.4452, test_loss: 1.0026, test_f1: 0.6553
 epoch: 60, train_loss: 0.4440, test_loss: 0.9758, test_f1: 0.6756
 epoch: 61, train_loss: 0.4450, test_loss: 1.0644, test_f1: 0.6895
 epoch: 62, train_loss: 0.4475, test_loss: 0.9571, test_f1: 0.6522
 epoch: 63, train_loss: 0.4287, test_loss: 0.8041, test_f1: 0.6786
 epoch: 64, train_loss: 0.4169, test_loss: 0.8891, test_f1: 0.6624
 epoch: 65, train_loss: 0.4288, test_loss: 0.9151, test_f1: 0.6782
 epoch: 66, train_loss: 0.4152, test_loss: 0.8773, test_f1: 0.6754
 epoch: 67, train_loss: 0.4344, test_loss: 0.7733, test_f1: 0.6607
 epoch: 68, train_loss: 0.4078, test_loss: 0.9614, test_f1: 0.6707
 epoch: 69, train_loss: 0.4190, test_loss: 1.0391, test_f1: 0.6298
 epoch: 70, train_loss: 0.3849, test_loss: 1.0564, test_f1: 0.6418
 epoch: 71, train_loss: 0.3954, test_loss: 0.9816, test_f1: 0.6597
 epoch: 72, train_loss: 0.3737, test_loss: 1.1598, test_f1: 0.6457
 epoch: 73, train_loss: 0.3766, test_loss: 1.0729, test_f1: 0.6482
 epoch: 74, train_loss: 0.3973, test_loss: 0.9336, test_f1: 0.6544
 epoch: 75, train_loss: 0.4006, test_loss: 0.9895, test_f1: 0.6851
 epoch: 76, train_loss: 0.4521, test_loss: 0.9440, test_f1: 0.6444
 epoch: 77, train_loss: 0.3936, test_loss: 0.9738, test_f1: 0.6694
 epoch: 78, train_loss: 0.3981, test_loss: 1.0153, test_f1: 0.6384
 epoch: 79, train_loss: 0.4006, test_loss: 0.9925, test_f1: 0.6483
 epoch: 80, train_loss: 0.3644, test_loss: 1.0095, test_f1: 0.6697
 epoch: 81, train_loss: 0.3471, test_loss: 1.0039, test_f1: 0.6701
 epoch: 82, train_loss: 0.3675, test_loss: 1.0458, test_f1: 0.6608
 epoch: 83, train_loss: 0.3608, test_loss: 0.9157, test_f1: 0.6720
 epoch: 84, train_loss: 0.3839, test_loss: 1.0834, test_f1: 0.6739
 epoch: 85, train_loss: 0.3746, test_loss: 1.2888, test_f1: 0.6660
 epoch: 86, train_loss: 0.3521, test_loss: 1.3335, test_f1: 0.6354
 epoch: 87, train_loss: 0.3422, test_loss: 1.0803, test_f1: 0.6617
 epoch: 88, train_loss: 0.3606, test_loss: 1.2269, test_f1: 0.6607
 epoch: 89, train_loss: 0.3526, test_loss: 1.0487, test_f1: 0.6697
 epoch: 90, train_loss: 0.3314, test_loss: 1.1310, test_f1: 0.6691
 epoch: 91, train_loss: 0.3627, test_loss: 1.0931, test_f1: 0.6767
 epoch: 92, train_loss: 0.3514, test_loss: 1.1996, test_f1: 0.6593
 epoch: 93, train_loss: 0.3374, test_loss: 1.2192, test_f1: 0.6629
 epoch: 94, train_loss: 0.3337, test_loss: 1.2222, test_f1: 0.6554
 epoch: 95, train_loss: 0.3464, test_loss: 1.1059, test_f1: 0.6726
 epoch: 96, train_loss: 0.3307, test_loss: 1.2507, test_f1: 0.6596
 epoch: 97, train_loss: 0.3321, test_loss: 1.3185, test_f1: 0.6464
 epoch: 98, train_loss: 0.3249, test_loss: 1.2394, test_f1: 0.6652
 epoch: 99, train_loss: 0.3291, test_loss: 1.2509, test_f1: 0.6606
##################ITERATION #8 ****************************************
 epoch: 0, train_loss: 1.2084, test_loss: 1.0994, test_f1: 0.4125
 epoch: 1, train_loss: 0.9890, test_loss: 1.0670, test_f1: 0.4561
 epoch: 2, train_loss: 0.9778, test_loss: 0.9708, test_f1: 0.4461
 epoch: 3, train_loss: 0.9510, test_loss: 1.0910, test_f1: 0.4439
 epoch: 4, train_loss: 0.9282, test_loss: 0.9887, test_f1: 0.4409
 epoch: 5, train_loss: 0.9062, test_loss: 0.9532, test_f1: 0.4733
 epoch: 6, train_loss: 0.8818, test_loss: 0.9746, test_f1: 0.4856
 epoch: 7, train_loss: 0.8778, test_loss: 1.0188, test_f1: 0.4411
 epoch: 8, train_loss: 0.8660, test_loss: 0.9343, test_f1: 0.5423
 epoch: 9, train_loss: 0.8540, test_loss: 1.0325, test_f1: 0.4815
 epoch: 10, train_loss: 0.8484, test_loss: 0.8949, test_f1: 0.5286
 epoch: 11, train_loss: 0.8152, test_loss: 0.8173, test_f1: 0.5497
 epoch: 12, train_loss: 0.8323, test_loss: 0.8843, test_f1: 0.5629
 epoch: 13, train_loss: 0.7888, test_loss: 0.8406, test_f1: 0.5629
 epoch: 14, train_loss: 0.8023, test_loss: 0.8529, test_f1: 0.5880
 epoch: 15, train_loss: 0.7772, test_loss: 1.0299, test_f1: 0.5457
 epoch: 16, train_loss: 0.7777, test_loss: 0.9698, test_f1: 0.5404
 epoch: 17, train_loss: 0.7931, test_loss: 2.1443, test_f1: 0.2774
 epoch: 18, train_loss: 0.7641, test_loss: 0.8842, test_f1: 0.5345
 epoch: 19, train_loss: 0.7566, test_loss: 0.9973, test_f1: 0.5557
 epoch: 20, train_loss: 0.7520, test_loss: 0.9443, test_f1: 0.5926
 epoch: 21, train_loss: 0.7367, test_loss: 1.0357, test_f1: 0.5116
 epoch: 22, train_loss: 0.7281, test_loss: 0.9140, test_f1: 0.5821
 epoch: 23, train_loss: 0.7609, test_loss: 0.7972, test_f1: 0.6254
 epoch: 24, train_loss: 0.7095, test_loss: 0.8858, test_f1: 0.5767
 epoch: 25, train_loss: 0.7116, test_loss: 0.9038, test_f1: 0.5710
 epoch: 26, train_loss: 0.6898, test_loss: 0.8253, test_f1: 0.6252
 epoch: 27, train_loss: 0.7009, test_loss: 0.8721, test_f1: 0.5991
 epoch: 28, train_loss: 0.6954, test_loss: 0.9054, test_f1: 0.5397
 epoch: 29, train_loss: 0.6822, test_loss: 0.9358, test_f1: 0.6052
 epoch: 30, train_loss: 0.6629, test_loss: 1.0349, test_f1: 0.5685
 epoch: 31, train_loss: 0.6620, test_loss: 0.9450, test_f1: 0.5876
 epoch: 32, train_loss: 0.6730, test_loss: 1.0622, test_f1: 0.5628
 epoch: 33, train_loss: 0.6692, test_loss: 0.8799, test_f1: 0.6070
 epoch: 34, train_loss: 0.6323, test_loss: 0.8860, test_f1: 0.6143
 epoch: 35, train_loss: 0.6427, test_loss: 0.9576, test_f1: 0.5986
 epoch: 36, train_loss: 0.6292, test_loss: 0.9069, test_f1: 0.6256
 epoch: 37, train_loss: 0.6224, test_loss: 1.0061, test_f1: 0.5921
 epoch: 38, train_loss: 0.6253, test_loss: 1.0036, test_f1: 0.6453
 epoch: 39, train_loss: 0.5963, test_loss: 0.9861, test_f1: 0.6223
 epoch: 40, train_loss: 0.6264, test_loss: 0.7768, test_f1: 0.6276
 epoch: 41, train_loss: 0.6270, test_loss: 0.8835, test_f1: 0.6316
 epoch: 42, train_loss: 0.6074, test_loss: 0.9347, test_f1: 0.6563
 epoch: 43, train_loss: 0.5975, test_loss: 0.8264, test_f1: 0.6159
 epoch: 44, train_loss: 0.5760, test_loss: 1.0451, test_f1: 0.5943
 epoch: 45, train_loss: 0.5945, test_loss: 0.9801, test_f1: 0.6149
 epoch: 46, train_loss: 0.5707, test_loss: 1.4643, test_f1: 0.5959
 epoch: 47, train_loss: 0.6048, test_loss: 0.9887, test_f1: 0.6311
 epoch: 48, train_loss: 0.5524, test_loss: 1.0087, test_f1: 0.6289
 epoch: 49, train_loss: 0.5534, test_loss: 1.0595, test_f1: 0.6217
 epoch: 50, train_loss: 0.5416, test_loss: 1.1319, test_f1: 0.6176
 epoch: 51, train_loss: 0.4832, test_loss: 1.0938, test_f1: 0.6659
 epoch: 52, train_loss: 0.4820, test_loss: 0.9666, test_f1: 0.6545
 epoch: 53, train_loss: 0.4686, test_loss: 1.0765, test_f1: 0.6471
 epoch: 54, train_loss: 0.4544, test_loss: 1.1612, test_f1: 0.6414
 epoch: 55, train_loss: 0.4427, test_loss: 1.0569, test_f1: 0.6769
 epoch: 56, train_loss: 0.4264, test_loss: 1.0187, test_f1: 0.6798
 epoch: 57, train_loss: 0.4263, test_loss: 1.0707, test_f1: 0.6429
 epoch: 58, train_loss: 0.4438, test_loss: 0.9170, test_f1: 0.6594
 epoch: 59, train_loss: 0.4258, test_loss: 1.0989, test_f1: 0.6685
 epoch: 60, train_loss: 0.4236, test_loss: 1.3427, test_f1: 0.6332
 epoch: 61, train_loss: 0.4276, test_loss: 1.2351, test_f1: 0.6530
 epoch: 62, train_loss: 0.3999, test_loss: 1.2097, test_f1: 0.6801
 epoch: 63, train_loss: 0.4319, test_loss: 1.2147, test_f1: 0.6509
 epoch: 64, train_loss: 0.3902, test_loss: 1.2331, test_f1: 0.6639
 epoch: 65, train_loss: 0.3916, test_loss: 1.2763, test_f1: 0.6552
 epoch: 66, train_loss: 0.4136, test_loss: 1.0808, test_f1: 0.6371
 epoch: 67, train_loss: 0.3888, test_loss: 1.2685, test_f1: 0.6535
 epoch: 68, train_loss: 0.4125, test_loss: 1.1507, test_f1: 0.6598
 epoch: 69, train_loss: 0.4124, test_loss: 1.0848, test_f1: 0.6419
 epoch: 70, train_loss: 0.3718, test_loss: 0.9916, test_f1: 0.6570
 epoch: 71, train_loss: 0.3893, test_loss: 1.1989, test_f1: 0.6277
 epoch: 72, train_loss: 0.3811, test_loss: 1.1868, test_f1: 0.6454
 epoch: 73, train_loss: 0.3568, test_loss: 1.2607, test_f1: 0.6306
 epoch: 74, train_loss: 0.3785, test_loss: 1.2259, test_f1: 0.6639
 epoch: 75, train_loss: 0.3533, test_loss: 1.1116, test_f1: 0.6531
 epoch: 76, train_loss: 0.3716, test_loss: 1.1829, test_f1: 0.6685
 epoch: 77, train_loss: 0.3696, test_loss: 1.4171, test_f1: 0.6675
 epoch: 78, train_loss: 0.3564, test_loss: 1.1651, test_f1: 0.6552
 epoch: 79, train_loss: 0.3480, test_loss: 1.3696, test_f1: 0.6514
 epoch: 80, train_loss: 0.3298, test_loss: 1.4518, test_f1: 0.6193
 epoch: 81, train_loss: 0.3611, test_loss: 1.2188, test_f1: 0.6550
 epoch: 82, train_loss: 0.3445, test_loss: 1.3564, test_f1: 0.6324
 epoch: 83, train_loss: 0.3316, test_loss: 1.3242, test_f1: 0.6456
 epoch: 84, train_loss: 0.3261, test_loss: 1.2619, test_f1: 0.6767
 epoch: 85, train_loss: 0.3217, test_loss: 1.4035, test_f1: 0.6450
 epoch: 86, train_loss: 0.3204, test_loss: 1.1953, test_f1: 0.6723
 epoch: 87, train_loss: 0.3213, test_loss: 1.3795, test_f1: 0.7057
 epoch: 88, train_loss: 0.3433, test_loss: 1.3856, test_f1: 0.6605
 epoch: 89, train_loss: 0.3189, test_loss: 1.2939, test_f1: 0.6647
 epoch: 90, train_loss: 0.3355, test_loss: 1.4049, test_f1: 0.6181
 epoch: 91, train_loss: 0.3294, test_loss: 1.2263, test_f1: 0.6504
 epoch: 92, train_loss: 0.3147, test_loss: 1.2612, test_f1: 0.6478
 epoch: 93, train_loss: 0.3188, test_loss: 1.2341, test_f1: 0.6417
 epoch: 94, train_loss: 0.3094, test_loss: 1.2791, test_f1: 0.6533
 epoch: 95, train_loss: 0.2902, test_loss: 1.3310, test_f1: 0.6749
 epoch: 96, train_loss: 0.2901, test_loss: 1.3743, test_f1: 0.6534
 epoch: 97, train_loss: 0.3059, test_loss: 1.3361, test_f1: 0.6626
 epoch: 98, train_loss: 0.3172, test_loss: 1.2234, test_f1: 0.6362
 epoch: 99, train_loss: 0.2968, test_loss: 1.1952, test_f1: 0.6786
##################ITERATION #9 ****************************************
 epoch: 0, train_loss: 1.2704, test_loss: 1.3076, test_f1: 0.3889
 epoch: 1, train_loss: 1.0287, test_loss: 1.0109, test_f1: 0.3767
 epoch: 2, train_loss: 0.9748, test_loss: 0.9848, test_f1: 0.4637
 epoch: 3, train_loss: 0.9822, test_loss: 0.9938, test_f1: 0.5071
 epoch: 4, train_loss: 0.9566, test_loss: 1.0534, test_f1: 0.4290
 epoch: 5, train_loss: 0.9348, test_loss: 1.0637, test_f1: 0.4684
 epoch: 6, train_loss: 0.9330, test_loss: 1.0770, test_f1: 0.4198
 epoch: 7, train_loss: 0.8926, test_loss: 1.0376, test_f1: 0.4810
 epoch: 8, train_loss: 0.8897, test_loss: 1.0470, test_f1: 0.4831
 epoch: 9, train_loss: 0.8988, test_loss: 0.9629, test_f1: 0.5119
 epoch: 10, train_loss: 0.8679, test_loss: 0.9895, test_f1: 0.5149
 epoch: 11, train_loss: 0.8548, test_loss: 0.9468, test_f1: 0.5249
 epoch: 12, train_loss: 0.8395, test_loss: 0.9467, test_f1: 0.5570
 epoch: 13, train_loss: 0.8263, test_loss: 0.9131, test_f1: 0.5859
 epoch: 14, train_loss: 0.8130, test_loss: 1.0569, test_f1: 0.5351
 epoch: 15, train_loss: 0.8231, test_loss: 0.8398, test_f1: 0.5500
 epoch: 16, train_loss: 0.8061, test_loss: 0.9809, test_f1: 0.5255
 epoch: 17, train_loss: 0.7951, test_loss: 1.0004, test_f1: 0.5184
 epoch: 18, train_loss: 0.8032, test_loss: 0.8042, test_f1: 0.5345
 epoch: 19, train_loss: 0.7893, test_loss: 0.9196, test_f1: 0.5864
 epoch: 20, train_loss: 0.7579, test_loss: 1.0049, test_f1: 0.5591
 epoch: 21, train_loss: 0.7821, test_loss: 0.9555, test_f1: 0.5754
 epoch: 22, train_loss: 0.7547, test_loss: 0.8982, test_f1: 0.5631
 epoch: 23, train_loss: 0.7429, test_loss: 0.8811, test_f1: 0.5563
 epoch: 24, train_loss: 0.7395, test_loss: 1.1785, test_f1: 0.4922
 epoch: 25, train_loss: 0.7254, test_loss: 1.0918, test_f1: 0.5554
 epoch: 26, train_loss: 0.7177, test_loss: 0.8785, test_f1: 0.5853
 epoch: 27, train_loss: 0.7220, test_loss: 0.9169, test_f1: 0.5550
 epoch: 28, train_loss: 0.7199, test_loss: 0.8021, test_f1: 0.6201
 epoch: 29, train_loss: 0.7143, test_loss: 0.8983, test_f1: 0.5653
 epoch: 30, train_loss: 0.7089, test_loss: 0.8548, test_f1: 0.6083
 epoch: 31, train_loss: 0.7252, test_loss: 0.9433, test_f1: 0.5709
 epoch: 32, train_loss: 0.6927, test_loss: 0.9279, test_f1: 0.6067
 epoch: 33, train_loss: 0.6698, test_loss: 0.8215, test_f1: 0.5906
 epoch: 34, train_loss: 0.6743, test_loss: 0.7483, test_f1: 0.5725
 epoch: 35, train_loss: 0.6787, test_loss: 1.0445, test_f1: 0.6146
 epoch: 36, train_loss: 0.6782, test_loss: 0.8061, test_f1: 0.5864
 epoch: 37, train_loss: 0.6872, test_loss: 1.0247, test_f1: 0.6144
 epoch: 38, train_loss: 0.6680, test_loss: 1.0511, test_f1: 0.6262
 epoch: 39, train_loss: 0.6346, test_loss: 1.1157, test_f1: 0.6362
 epoch: 40, train_loss: 0.6518, test_loss: 0.9374, test_f1: 0.6610
 epoch: 41, train_loss: 0.6362, test_loss: 1.2335, test_f1: 0.6273
 epoch: 42, train_loss: 0.6328, test_loss: 0.9825, test_f1: 0.6370
 epoch: 43, train_loss: 0.6236, test_loss: 0.8507, test_f1: 0.6506
 epoch: 44, train_loss: 0.6520, test_loss: 0.8445, test_f1: 0.6071
 epoch: 45, train_loss: 0.6121, test_loss: 0.8708, test_f1: 0.6942
 epoch: 46, train_loss: 0.6092, test_loss: 0.8637, test_f1: 0.6267
 epoch: 47, train_loss: 0.6179, test_loss: 1.1265, test_f1: 0.6371
 epoch: 48, train_loss: 0.6060, test_loss: 0.9951, test_f1: 0.6033
 epoch: 49, train_loss: 0.6137, test_loss: 0.8126, test_f1: 0.6188
 epoch: 50, train_loss: 0.6254, test_loss: 0.9654, test_f1: 0.6307
 epoch: 51, train_loss: 0.5563, test_loss: 0.9119, test_f1: 0.6991
 epoch: 52, train_loss: 0.5341, test_loss: 0.9072, test_f1: 0.6517
 epoch: 53, train_loss: 0.5154, test_loss: 0.9642, test_f1: 0.6809
 epoch: 54, train_loss: 0.5089, test_loss: 0.9757, test_f1: 0.6312
 epoch: 55, train_loss: 0.4979, test_loss: 1.1179, test_f1: 0.6515
 epoch: 56, train_loss: 0.5073, test_loss: 1.0497, test_f1: 0.6527
 epoch: 57, train_loss: 0.4992, test_loss: 1.1371, test_f1: 0.6390
 epoch: 58, train_loss: 0.4908, test_loss: 1.1462, test_f1: 0.6580
 epoch: 59, train_loss: 0.4887, test_loss: 1.1552, test_f1: 0.6505
 epoch: 60, train_loss: 0.4742, test_loss: 1.1665, test_f1: 0.6513
 epoch: 61, train_loss: 0.4742, test_loss: 1.0547, test_f1: 0.6768
 epoch: 62, train_loss: 0.4829, test_loss: 1.2056, test_f1: 0.6672
 epoch: 63, train_loss: 0.4559, test_loss: 0.9635, test_f1: 0.6503
 epoch: 64, train_loss: 0.4783, test_loss: 1.3976, test_f1: 0.6553
 epoch: 65, train_loss: 0.4740, test_loss: 1.3493, test_f1: 0.6700
 epoch: 66, train_loss: 0.4475, test_loss: 1.1116, test_f1: 0.6735
 epoch: 67, train_loss: 0.4595, test_loss: 0.9958, test_f1: 0.6594
 epoch: 68, train_loss: 0.4555, test_loss: 1.3918, test_f1: 0.6692
 epoch: 69, train_loss: 0.4399, test_loss: 1.1770, test_f1: 0.6232
 epoch: 70, train_loss: 0.4407, test_loss: 1.1241, test_f1: 0.6554
 epoch: 71, train_loss: 0.4412, test_loss: 0.8736, test_f1: 0.6699
 epoch: 72, train_loss: 0.4362, test_loss: 1.0119, test_f1: 0.6932
 epoch: 73, train_loss: 0.4224, test_loss: 1.2136, test_f1: 0.6665
 epoch: 74, train_loss: 0.4197, test_loss: 1.2704, test_f1: 0.6714
 epoch: 75, train_loss: 0.4126, test_loss: 1.1342, test_f1: 0.6857
 epoch: 76, train_loss: 0.4202, test_loss: 1.1923, test_f1: 0.6605
 epoch: 77, train_loss: 0.4199, test_loss: 1.1742, test_f1: 0.6702
 epoch: 78, train_loss: 0.3909, test_loss: 1.4010, test_f1: 0.6360
 epoch: 79, train_loss: 0.3851, test_loss: 1.1431, test_f1: 0.6900
 epoch: 80, train_loss: 0.3825, test_loss: 1.2571, test_f1: 0.6346
 epoch: 81, train_loss: 0.4100, test_loss: 1.1243, test_f1: 0.6700
 epoch: 82, train_loss: 0.4017, test_loss: 1.1521, test_f1: 0.6783
 epoch: 83, train_loss: 0.4043, test_loss: 1.2102, test_f1: 0.6496
 epoch: 84, train_loss: 0.3963, test_loss: 1.0787, test_f1: 0.6568
 epoch: 85, train_loss: 0.3908, test_loss: 1.3313, test_f1: 0.6482
 epoch: 86, train_loss: 0.3829, test_loss: 1.0655, test_f1: 0.6681
 epoch: 87, train_loss: 0.4018, test_loss: 1.1487, test_f1: 0.6772
 epoch: 88, train_loss: 0.3893, test_loss: 1.2733, test_f1: 0.6722
 epoch: 89, train_loss: 0.3800, test_loss: 1.1221, test_f1: 0.6599
 epoch: 90, train_loss: 0.3532, test_loss: 1.1267, test_f1: 0.6747
 epoch: 91, train_loss: 0.3578, test_loss: 1.1639, test_f1: 0.6746
 epoch: 92, train_loss: 0.3542, test_loss: 0.9872, test_f1: 0.6573
 epoch: 93, train_loss: 0.3902, test_loss: 1.0615, test_f1: 0.6723
 epoch: 94, train_loss: 0.3537, test_loss: 1.1517, test_f1: 0.6716
 epoch: 95, train_loss: 0.3479, test_loss: 1.2385, test_f1: 0.6850
 epoch: 96, train_loss: 0.3351, test_loss: 1.3784, test_f1: 0.6573
 epoch: 97, train_loss: 0.3604, test_loss: 1.2804, test_f1: 0.6442
 epoch: 98, train_loss: 0.3400, test_loss: 1.3249, test_f1: 0.6691
 epoch: 99, train_loss: 0.3500, test_loss: 1.1140, test_f1: 0.6747

Training completed in 655.32 seconds
Best F1: 0.7498 at epoch 81
Mean F1 across iterations: 0.7111  0.0162
========================FINAL RESULTS================================
FEGIN weighted F1: 0.7498  0.0162
python main.py --data ltspice_examples --representation component_pin --model FEGIN --layers 3 --hiddens 128 --batch_size 64 --lr 0.01 --emb_size 512 --epochs 100 --save_appendix component_pin_L3_H128_BS64_LR0.01_E512 --no_val
-----



STDERR:
  File "main.py", line 370, in <module>
    main()
  File "main.py", line 254, in main
    dataset = dataset_class(
  File "/home/philip/projects/ltspice_examples_code_repo/Circuit-Completion-Using-GNNs/component_classification_with_link_prediction_head/evaluation/FEGIN/kernel/circuit_datasets.py", line 15, in __init__
    self.data, self.slices = torch.load(self.processed_paths[0])
  File "/home/philip/.local/lib/python3.8/site-packages/torch/serialization.py", line 1040, in load
    warnings.warn(
  File "/usr/lib/python3.8/warnings.py", line 109, in _showwarnmsg
    sw(msg.message, msg.category, msg.filename, msg.lineno,
  File "main.py", line 47, in warn_with_traceback
    traceback.print_stack(file=log)
/home/philip/projects/ltspice_examples_code_repo/Circuit-Completion-Using-GNNs/component_classification_with_link_prediction_head/evaluation/FEGIN/kernel/circuit_datasets.py:15: FutureWarning: You are using `torch.load` with `weights_only=False` (the current default value), which uses the default pickle module implicitly. It is possible to construct malicious pickle data which will execute arbitrary code during unpickling (See https://github.com/pytorch/pytorch/blob/main/SECURITY.md#untrusted-models for more details). In a future release, the default value for `weights_only` will be flipped to `True`. This limits the functions that could be executed during unpickling. Arbitrary objects will no longer be allowed to be loaded via this mode unless they are explicitly allowlisted by the user via `torch.serialization.add_safe_globals`. We recommend you start setting `weights_only=True` for any use case where you don't have full control of the loaded file. Please open an issue on GitHub for any issues related to this experimental feature.
  self.data, self.slices = torch.load(self.processed_paths[0])
