STDOUT:
Results will be saved in /home/philip/projects/ltspice_examples_code_repo/Circuit-Completion-Using-GNNs/component_classification_with_link_prediction_head/evaluation/FEGIN/results/model_FEGIN_dataset_ltspice_examples
Command line input: python main.py --data ltspice_examples --representation component_net --model FEGIN --layers 4 --hiddens 16 --batch_size 64 --lr 0.01 --emb_size 250 --epochs 100 --save_appendix component_net_L4_H16_BS64_LR0.01_E250 --no_val
 is saved.
-----
ltspice_examples - FEGIN
Using 4 layers, 16 hidden units, h = 2
Loading component_net representation dataset
ENTERED
Training FEGIN on component_net representation
Train: 3558, Test: 846
##################ITERATION #0 ****************************************
 epoch: 0, train_loss: 1.2919, test_loss: 1.1808, test_f1: 0.3301
 epoch: 1, train_loss: 1.1320, test_loss: 1.1018, test_f1: 0.3469
 epoch: 2, train_loss: 1.0709, test_loss: 1.1290, test_f1: 0.3939
 epoch: 3, train_loss: 1.0695, test_loss: 1.1898, test_f1: 0.3548
 epoch: 4, train_loss: 1.0327, test_loss: 1.1703, test_f1: 0.4533
 epoch: 5, train_loss: 1.0096, test_loss: 1.1425, test_f1: 0.4909
 epoch: 6, train_loss: 1.0007, test_loss: 1.1365, test_f1: 0.5017
 epoch: 7, train_loss: 1.0051, test_loss: 1.1932, test_f1: 0.4738
 epoch: 8, train_loss: 1.0078, test_loss: 1.0428, test_f1: 0.4277
 epoch: 9, train_loss: 1.0012, test_loss: 1.0306, test_f1: 0.5083
 epoch: 10, train_loss: 0.9908, test_loss: 0.9677, test_f1: 0.4639
 epoch: 11, train_loss: 0.9799, test_loss: 1.0014, test_f1: 0.4917
 epoch: 12, train_loss: 0.9706, test_loss: 1.1390, test_f1: 0.4768
 epoch: 13, train_loss: 0.9582, test_loss: 1.0250, test_f1: 0.4701
 epoch: 14, train_loss: 0.9649, test_loss: 1.0331, test_f1: 0.4677
 epoch: 15, train_loss: 0.9442, test_loss: 1.0274, test_f1: 0.5172
 epoch: 16, train_loss: 0.9429, test_loss: 1.0851, test_f1: 0.5220
 epoch: 17, train_loss: 0.9556, test_loss: 1.1467, test_f1: 0.3753
 epoch: 18, train_loss: 0.9376, test_loss: 1.0660, test_f1: 0.4868
 epoch: 19, train_loss: 0.9381, test_loss: 1.0226, test_f1: 0.4882
 epoch: 20, train_loss: 0.9372, test_loss: 1.0095, test_f1: 0.5142
 epoch: 21, train_loss: 0.9255, test_loss: 1.0884, test_f1: 0.4373
 epoch: 22, train_loss: 0.9298, test_loss: 1.0160, test_f1: 0.4616
 epoch: 23, train_loss: 0.9301, test_loss: 1.0576, test_f1: 0.4766
 epoch: 24, train_loss: 0.9149, test_loss: 1.0409, test_f1: 0.5071
 epoch: 25, train_loss: 0.9164, test_loss: 1.1235, test_f1: 0.4550
 epoch: 26, train_loss: 0.9109, test_loss: 1.0225, test_f1: 0.4834
 epoch: 27, train_loss: 0.9181, test_loss: 1.0656, test_f1: 0.4768
 epoch: 28, train_loss: 0.9076, test_loss: 1.0339, test_f1: 0.5635
 epoch: 29, train_loss: 0.9059, test_loss: 1.0533, test_f1: 0.4977
 epoch: 30, train_loss: 0.8958, test_loss: 1.0778, test_f1: 0.4941
 epoch: 31, train_loss: 0.8887, test_loss: 1.0654, test_f1: 0.4647
 epoch: 32, train_loss: 0.8919, test_loss: 1.0316, test_f1: 0.5039
 epoch: 33, train_loss: 0.8961, test_loss: 1.0456, test_f1: 0.5596
 epoch: 34, train_loss: 0.8806, test_loss: 0.9757, test_f1: 0.5059
 epoch: 35, train_loss: 0.8873, test_loss: 1.0279, test_f1: 0.4805
 epoch: 36, train_loss: 0.8912, test_loss: 1.0722, test_f1: 0.5131
 epoch: 37, train_loss: 0.8874, test_loss: 1.0455, test_f1: 0.4964
 epoch: 38, train_loss: 0.8915, test_loss: 0.9875, test_f1: 0.5066
 epoch: 39, train_loss: 0.8814, test_loss: 0.9807, test_f1: 0.5161
 epoch: 40, train_loss: 0.8761, test_loss: 1.0446, test_f1: 0.5101
 epoch: 41, train_loss: 0.8843, test_loss: 1.0876, test_f1: 0.4959
 epoch: 42, train_loss: 0.8769, test_loss: 1.0145, test_f1: 0.4994
 epoch: 43, train_loss: 0.8589, test_loss: 0.9822, test_f1: 0.5045
 epoch: 44, train_loss: 0.8716, test_loss: 1.0137, test_f1: 0.4965
 epoch: 45, train_loss: 0.8715, test_loss: 1.0368, test_f1: 0.5127
 epoch: 46, train_loss: 0.8712, test_loss: 1.0562, test_f1: 0.5115
 epoch: 47, train_loss: 0.8688, test_loss: 1.0124, test_f1: 0.5213
 epoch: 48, train_loss: 0.8597, test_loss: 1.0891, test_f1: 0.5014
 epoch: 49, train_loss: 0.8664, test_loss: 1.0186, test_f1: 0.5039
 epoch: 50, train_loss: 0.8583, test_loss: 0.9680, test_f1: 0.5087
 epoch: 51, train_loss: 0.8451, test_loss: 1.0484, test_f1: 0.5136
 epoch: 52, train_loss: 0.8238, test_loss: 1.0532, test_f1: 0.5596
 epoch: 53, train_loss: 0.8369, test_loss: 1.0410, test_f1: 0.5249
 epoch: 54, train_loss: 0.8358, test_loss: 1.0507, test_f1: 0.5264
 epoch: 55, train_loss: 0.8265, test_loss: 1.0755, test_f1: 0.5251
 epoch: 56, train_loss: 0.8272, test_loss: 1.0102, test_f1: 0.5275
 epoch: 57, train_loss: 0.8224, test_loss: 1.0556, test_f1: 0.5283
 epoch: 58, train_loss: 0.8229, test_loss: 1.0536, test_f1: 0.5240
 epoch: 59, train_loss: 0.8143, test_loss: 1.0879, test_f1: 0.5421
 epoch: 60, train_loss: 0.8222, test_loss: 1.0484, test_f1: 0.5300
 epoch: 61, train_loss: 0.8200, test_loss: 1.0427, test_f1: 0.5254
 epoch: 62, train_loss: 0.8053, test_loss: 1.0558, test_f1: 0.5320
 epoch: 63, train_loss: 0.8143, test_loss: 1.0587, test_f1: 0.5536
 epoch: 64, train_loss: 0.8019, test_loss: 1.1051, test_f1: 0.5256
 epoch: 65, train_loss: 0.8056, test_loss: 1.0781, test_f1: 0.5184
 epoch: 66, train_loss: 0.8095, test_loss: 1.0740, test_f1: 0.5288
 epoch: 67, train_loss: 0.8053, test_loss: 1.1184, test_f1: 0.5353
 epoch: 68, train_loss: 0.8016, test_loss: 1.1372, test_f1: 0.5404
 epoch: 69, train_loss: 0.8073, test_loss: 1.0766, test_f1: 0.5392
 epoch: 70, train_loss: 0.8092, test_loss: 1.1138, test_f1: 0.5408
 epoch: 71, train_loss: 0.8131, test_loss: 1.0253, test_f1: 0.5564
 epoch: 72, train_loss: 0.7980, test_loss: 1.0645, test_f1: 0.5482
 epoch: 73, train_loss: 0.8120, test_loss: 1.1189, test_f1: 0.5459
 epoch: 74, train_loss: 0.7914, test_loss: 1.1118, test_f1: 0.5482
 epoch: 75, train_loss: 0.7918, test_loss: 1.0781, test_f1: 0.5574
 epoch: 76, train_loss: 0.7884, test_loss: 1.0371, test_f1: 0.5583
 epoch: 77, train_loss: 0.7906, test_loss: 1.0540, test_f1: 0.5579
 epoch: 78, train_loss: 0.7956, test_loss: 1.0499, test_f1: 0.5474
 epoch: 79, train_loss: 0.7913, test_loss: 1.0337, test_f1: 0.5757
 epoch: 80, train_loss: 0.7867, test_loss: 1.0599, test_f1: 0.5820
 epoch: 81, train_loss: 0.7999, test_loss: 1.0592, test_f1: 0.5363
 epoch: 82, train_loss: 0.8101, test_loss: 1.0243, test_f1: 0.5604
 epoch: 83, train_loss: 0.7945, test_loss: 1.0581, test_f1: 0.5624
 epoch: 84, train_loss: 0.8001, test_loss: 1.0518, test_f1: 0.5642
 epoch: 85, train_loss: 0.7916, test_loss: 1.0771, test_f1: 0.6073
 epoch: 86, train_loss: 0.7885, test_loss: 1.0175, test_f1: 0.5880
 epoch: 87, train_loss: 0.7837, test_loss: 0.9938, test_f1: 0.5748
 epoch: 88, train_loss: 0.7796, test_loss: 1.0400, test_f1: 0.5455
 epoch: 89, train_loss: 0.7767, test_loss: 1.0332, test_f1: 0.5671
 epoch: 90, train_loss: 0.7849, test_loss: 1.0350, test_f1: 0.5569
 epoch: 91, train_loss: 0.7761, test_loss: 1.0538, test_f1: 0.5784
 epoch: 92, train_loss: 0.7828, test_loss: 1.0110, test_f1: 0.5754
 epoch: 93, train_loss: 0.7594, test_loss: 1.0611, test_f1: 0.5685
 epoch: 94, train_loss: 0.7722, test_loss: 0.9919, test_f1: 0.5400
 epoch: 95, train_loss: 0.7613, test_loss: 1.0735, test_f1: 0.5548
 epoch: 96, train_loss: 0.7731, test_loss: 1.0576, test_f1: 0.5734
 epoch: 97, train_loss: 0.7887, test_loss: 1.0084, test_f1: 0.5741
 epoch: 98, train_loss: 0.7702, test_loss: 1.0198, test_f1: 0.5896
 epoch: 99, train_loss: 0.7711, test_loss: 1.0312, test_f1: 0.5749
##################ITERATION #1 ****************************************
 epoch: 0, train_loss: 1.1886, test_loss: 1.0995, test_f1: 0.3656
 epoch: 1, train_loss: 1.0647, test_loss: 1.0568, test_f1: 0.4522
 epoch: 2, train_loss: 1.0354, test_loss: 1.0012, test_f1: 0.4906
 epoch: 3, train_loss: 1.0136, test_loss: 0.9862, test_f1: 0.5196
 epoch: 4, train_loss: 1.0015, test_loss: 0.9989, test_f1: 0.4439
 epoch: 5, train_loss: 0.9966, test_loss: 1.0021, test_f1: 0.4540
 epoch: 6, train_loss: 0.9742, test_loss: 1.0000, test_f1: 0.4669
 epoch: 7, train_loss: 0.9712, test_loss: 1.1183, test_f1: 0.3774
 epoch: 8, train_loss: 0.9763, test_loss: 0.9838, test_f1: 0.4895
 epoch: 9, train_loss: 0.9617, test_loss: 0.9813, test_f1: 0.4973
 epoch: 10, train_loss: 0.9422, test_loss: 1.0266, test_f1: 0.4094
 epoch: 11, train_loss: 0.9589, test_loss: 0.9347, test_f1: 0.5096
 epoch: 12, train_loss: 0.9390, test_loss: 1.0302, test_f1: 0.4757
 epoch: 13, train_loss: 0.9433, test_loss: 0.9460, test_f1: 0.4738
 epoch: 14, train_loss: 0.9559, test_loss: 1.0197, test_f1: 0.4427
 epoch: 15, train_loss: 0.9413, test_loss: 0.9589, test_f1: 0.4860
 epoch: 16, train_loss: 0.9438, test_loss: 0.9408, test_f1: 0.4907
 epoch: 17, train_loss: 0.9195, test_loss: 0.9610, test_f1: 0.4996
 epoch: 18, train_loss: 0.9177, test_loss: 0.9883, test_f1: 0.5316
 epoch: 19, train_loss: 0.9250, test_loss: 0.9772, test_f1: 0.4808
 epoch: 20, train_loss: 0.9451, test_loss: 1.0159, test_f1: 0.4671
 epoch: 21, train_loss: 0.9284, test_loss: 0.9550, test_f1: 0.4913
 epoch: 22, train_loss: 0.9216, test_loss: 1.0128, test_f1: 0.4961
 epoch: 23, train_loss: 0.9236, test_loss: 0.9448, test_f1: 0.4942
 epoch: 24, train_loss: 0.9185, test_loss: 0.9568, test_f1: 0.4851
 epoch: 25, train_loss: 0.9154, test_loss: 0.9720, test_f1: 0.5074
 epoch: 26, train_loss: 0.9300, test_loss: 1.0157, test_f1: 0.5103
 epoch: 27, train_loss: 0.9170, test_loss: 1.0120, test_f1: 0.5044
 epoch: 28, train_loss: 0.9070, test_loss: 0.9713, test_f1: 0.5088
 epoch: 29, train_loss: 0.9063, test_loss: 0.9862, test_f1: 0.4718
 epoch: 30, train_loss: 0.9035, test_loss: 0.9862, test_f1: 0.5579
 epoch: 31, train_loss: 0.8918, test_loss: 0.9578, test_f1: 0.5257
 epoch: 32, train_loss: 0.8828, test_loss: 0.9874, test_f1: 0.5177
 epoch: 33, train_loss: 0.8990, test_loss: 0.9017, test_f1: 0.5676
 epoch: 34, train_loss: 0.8954, test_loss: 0.9170, test_f1: 0.5439
 epoch: 35, train_loss: 0.8916, test_loss: 0.9749, test_f1: 0.5213
 epoch: 36, train_loss: 0.8923, test_loss: 0.9682, test_f1: 0.5213
 epoch: 37, train_loss: 0.8938, test_loss: 0.9847, test_f1: 0.5020
 epoch: 38, train_loss: 0.8799, test_loss: 0.9737, test_f1: 0.5137
 epoch: 39, train_loss: 0.8943, test_loss: 1.0372, test_f1: 0.5265
 epoch: 40, train_loss: 0.8782, test_loss: 0.9201, test_f1: 0.5608
 epoch: 41, train_loss: 0.8809, test_loss: 0.9982, test_f1: 0.5141
 epoch: 42, train_loss: 0.8863, test_loss: 1.0066, test_f1: 0.5141
 epoch: 43, train_loss: 0.8787, test_loss: 0.9955, test_f1: 0.5304
 epoch: 44, train_loss: 0.8770, test_loss: 0.9698, test_f1: 0.5335
 epoch: 45, train_loss: 0.8821, test_loss: 0.9998, test_f1: 0.5093
 epoch: 46, train_loss: 0.8624, test_loss: 1.0282, test_f1: 0.5114
 epoch: 47, train_loss: 0.8785, test_loss: 0.9015, test_f1: 0.5182
 epoch: 48, train_loss: 0.8741, test_loss: 0.9859, test_f1: 0.5302
 epoch: 49, train_loss: 0.8730, test_loss: 1.0148, test_f1: 0.5073
 epoch: 50, train_loss: 0.8556, test_loss: 0.9674, test_f1: 0.5368
 epoch: 51, train_loss: 0.8502, test_loss: 1.0136, test_f1: 0.5103
 epoch: 52, train_loss: 0.8294, test_loss: 1.0205, test_f1: 0.5290
 epoch: 53, train_loss: 0.8193, test_loss: 1.0104, test_f1: 0.5411
 epoch: 54, train_loss: 0.8335, test_loss: 1.0444, test_f1: 0.5161
 epoch: 55, train_loss: 0.8336, test_loss: 1.0615, test_f1: 0.5216
 epoch: 56, train_loss: 0.8293, test_loss: 1.0010, test_f1: 0.5254
 epoch: 57, train_loss: 0.8358, test_loss: 1.0223, test_f1: 0.5324
 epoch: 58, train_loss: 0.8313, test_loss: 1.0197, test_f1: 0.5273
 epoch: 59, train_loss: 0.8192, test_loss: 1.0270, test_f1: 0.5204
 epoch: 60, train_loss: 0.8104, test_loss: 1.0526, test_f1: 0.5253
 epoch: 61, train_loss: 0.8190, test_loss: 1.0226, test_f1: 0.5456
 epoch: 62, train_loss: 0.8193, test_loss: 1.0285, test_f1: 0.5383
 epoch: 63, train_loss: 0.8226, test_loss: 1.0460, test_f1: 0.5216
 epoch: 64, train_loss: 0.8232, test_loss: 1.0202, test_f1: 0.5509
 epoch: 65, train_loss: 0.8239, test_loss: 1.0388, test_f1: 0.5591
 epoch: 66, train_loss: 0.8158, test_loss: 1.0668, test_f1: 0.5342
 epoch: 67, train_loss: 0.8208, test_loss: 1.0373, test_f1: 0.5333
 epoch: 68, train_loss: 0.8040, test_loss: 1.0266, test_f1: 0.5339
 epoch: 69, train_loss: 0.7999, test_loss: 1.0633, test_f1: 0.5358
 epoch: 70, train_loss: 0.8191, test_loss: 1.0073, test_f1: 0.5638
 epoch: 71, train_loss: 0.8118, test_loss: 1.0435, test_f1: 0.5212
 epoch: 72, train_loss: 0.8013, test_loss: 0.9936, test_f1: 0.5385
 epoch: 73, train_loss: 0.8010, test_loss: 1.0359, test_f1: 0.5585
 epoch: 74, train_loss: 0.8066, test_loss: 1.0470, test_f1: 0.5368
 epoch: 75, train_loss: 0.7887, test_loss: 1.0808, test_f1: 0.5126
 epoch: 76, train_loss: 0.8122, test_loss: 1.0490, test_f1: 0.5229
 epoch: 77, train_loss: 0.7808, test_loss: 1.0450, test_f1: 0.5337
 epoch: 78, train_loss: 0.7982, test_loss: 1.0150, test_f1: 0.5644
 epoch: 79, train_loss: 0.7930, test_loss: 0.9662, test_f1: 0.5548
 epoch: 80, train_loss: 0.7908, test_loss: 1.0638, test_f1: 0.5580
 epoch: 81, train_loss: 0.7991, test_loss: 1.1127, test_f1: 0.5308
 epoch: 82, train_loss: 0.8042, test_loss: 1.0605, test_f1: 0.5173
 epoch: 83, train_loss: 0.7921, test_loss: 1.0193, test_f1: 0.5108
 epoch: 84, train_loss: 0.7941, test_loss: 1.0137, test_f1: 0.5549
 epoch: 85, train_loss: 0.7913, test_loss: 1.0470, test_f1: 0.5398
 epoch: 86, train_loss: 0.7953, test_loss: 0.9863, test_f1: 0.5491
 epoch: 87, train_loss: 0.7899, test_loss: 1.0219, test_f1: 0.5301
 epoch: 88, train_loss: 0.7827, test_loss: 1.0414, test_f1: 0.5607
 epoch: 89, train_loss: 0.7814, test_loss: 1.0280, test_f1: 0.5456
 epoch: 90, train_loss: 0.7920, test_loss: 0.9682, test_f1: 0.5542
 epoch: 91, train_loss: 0.7687, test_loss: 1.0180, test_f1: 0.5674
 epoch: 92, train_loss: 0.7852, test_loss: 1.0184, test_f1: 0.5434
 epoch: 93, train_loss: 0.7811, test_loss: 1.0347, test_f1: 0.5380
 epoch: 94, train_loss: 0.7778, test_loss: 1.0676, test_f1: 0.5471
 epoch: 95, train_loss: 0.7933, test_loss: 1.0485, test_f1: 0.5397
 epoch: 96, train_loss: 0.7687, test_loss: 1.0607, test_f1: 0.5364
 epoch: 97, train_loss: 0.7908, test_loss: 1.0339, test_f1: 0.5522
 epoch: 98, train_loss: 0.7635, test_loss: 1.0247, test_f1: 0.5546
 epoch: 99, train_loss: 0.7838, test_loss: 1.0475, test_f1: 0.5636
##################ITERATION #2 ****************************************
 epoch: 0, train_loss: 1.2018, test_loss: 1.0901, test_f1: 0.3545
 epoch: 1, train_loss: 1.0787, test_loss: 1.1228, test_f1: 0.3942
 epoch: 2, train_loss: 1.0288, test_loss: 1.0849, test_f1: 0.4174
 epoch: 3, train_loss: 1.0088, test_loss: 1.0721, test_f1: 0.4689
 epoch: 4, train_loss: 0.9962, test_loss: 1.0352, test_f1: 0.4571
 epoch: 5, train_loss: 0.9880, test_loss: 1.1430, test_f1: 0.4278
 epoch: 6, train_loss: 0.9765, test_loss: 0.9665, test_f1: 0.4719
 epoch: 7, train_loss: 0.9643, test_loss: 0.9998, test_f1: 0.4950
 epoch: 8, train_loss: 0.9619, test_loss: 1.0190, test_f1: 0.5036
 epoch: 9, train_loss: 0.9645, test_loss: 0.9646, test_f1: 0.5064
 epoch: 10, train_loss: 0.9734, test_loss: 0.9921, test_f1: 0.5062
 epoch: 11, train_loss: 0.9633, test_loss: 1.0193, test_f1: 0.4645
 epoch: 12, train_loss: 0.9540, test_loss: 0.9662, test_f1: 0.4828
 epoch: 13, train_loss: 0.9692, test_loss: 1.0103, test_f1: 0.4648
 epoch: 14, train_loss: 0.9473, test_loss: 0.9935, test_f1: 0.4555
 epoch: 15, train_loss: 0.9491, test_loss: 1.1104, test_f1: 0.4463
 epoch: 16, train_loss: 0.9418, test_loss: 0.9579, test_f1: 0.4912
 epoch: 17, train_loss: 0.9317, test_loss: 0.9668, test_f1: 0.5597
 epoch: 18, train_loss: 0.9192, test_loss: 0.9601, test_f1: 0.4947
 epoch: 19, train_loss: 0.9236, test_loss: 0.9785, test_f1: 0.5139
 epoch: 20, train_loss: 0.9201, test_loss: 0.9472, test_f1: 0.5112
 epoch: 21, train_loss: 0.9254, test_loss: 0.9698, test_f1: 0.4656
 epoch: 22, train_loss: 0.9242, test_loss: 1.0046, test_f1: 0.4861
 epoch: 23, train_loss: 0.9112, test_loss: 0.9695, test_f1: 0.5121
 epoch: 24, train_loss: 0.9095, test_loss: 0.9717, test_f1: 0.5004
 epoch: 25, train_loss: 0.9064, test_loss: 1.0497, test_f1: 0.4492
 epoch: 26, train_loss: 0.8973, test_loss: 0.9830, test_f1: 0.5289
 epoch: 27, train_loss: 0.9184, test_loss: 0.9381, test_f1: 0.5170
 epoch: 28, train_loss: 0.9018, test_loss: 0.9179, test_f1: 0.5218
 epoch: 29, train_loss: 0.8994, test_loss: 0.9508, test_f1: 0.5359
 epoch: 30, train_loss: 0.8981, test_loss: 0.9273, test_f1: 0.5266
 epoch: 31, train_loss: 0.9191, test_loss: 0.9365, test_f1: 0.4982
 epoch: 32, train_loss: 0.9006, test_loss: 0.9635, test_f1: 0.5026
 epoch: 33, train_loss: 0.8973, test_loss: 1.0358, test_f1: 0.4990
 epoch: 34, train_loss: 0.9128, test_loss: 1.0763, test_f1: 0.5067
 epoch: 35, train_loss: 0.9126, test_loss: 0.9296, test_f1: 0.5442
 epoch: 36, train_loss: 0.8970, test_loss: 1.0222, test_f1: 0.4709
 epoch: 37, train_loss: 0.8937, test_loss: 0.9339, test_f1: 0.5257
 epoch: 38, train_loss: 0.8897, test_loss: 0.9988, test_f1: 0.5215
 epoch: 39, train_loss: 0.8948, test_loss: 0.9944, test_f1: 0.4498
 epoch: 40, train_loss: 0.8787, test_loss: 0.9444, test_f1: 0.5436
 epoch: 41, train_loss: 0.8846, test_loss: 0.9575, test_f1: 0.4892
 epoch: 42, train_loss: 0.8916, test_loss: 0.9569, test_f1: 0.5198
 epoch: 43, train_loss: 0.8815, test_loss: 0.9469, test_f1: 0.5286
 epoch: 44, train_loss: 0.8694, test_loss: 0.9825, test_f1: 0.5003
 epoch: 45, train_loss: 0.8774, test_loss: 0.9428, test_f1: 0.5466
 epoch: 46, train_loss: 0.8703, test_loss: 0.9597, test_f1: 0.5176
 epoch: 47, train_loss: 0.8787, test_loss: 0.9648, test_f1: 0.5179
 epoch: 48, train_loss: 0.8716, test_loss: 0.9183, test_f1: 0.5510
 epoch: 49, train_loss: 0.8676, test_loss: 0.9313, test_f1: 0.5005
 epoch: 50, train_loss: 0.8710, test_loss: 0.9512, test_f1: 0.4883
 epoch: 51, train_loss: 0.8519, test_loss: 0.9475, test_f1: 0.5454
 epoch: 52, train_loss: 0.8417, test_loss: 0.9449, test_f1: 0.5305
 epoch: 53, train_loss: 0.8302, test_loss: 0.9630, test_f1: 0.5393
 epoch: 54, train_loss: 0.8266, test_loss: 0.9470, test_f1: 0.5030
 epoch: 55, train_loss: 0.8336, test_loss: 0.9598, test_f1: 0.5036
 epoch: 56, train_loss: 0.8303, test_loss: 0.9272, test_f1: 0.5311
 epoch: 57, train_loss: 0.8316, test_loss: 0.9347, test_f1: 0.5528
 epoch: 58, train_loss: 0.8208, test_loss: 0.9553, test_f1: 0.4997
 epoch: 59, train_loss: 0.8290, test_loss: 0.9455, test_f1: 0.5121
 epoch: 60, train_loss: 0.8299, test_loss: 0.9783, test_f1: 0.4751
 epoch: 61, train_loss: 0.8288, test_loss: 0.9629, test_f1: 0.5287
 epoch: 62, train_loss: 0.8297, test_loss: 0.9322, test_f1: 0.5329
 epoch: 63, train_loss: 0.8274, test_loss: 0.9482, test_f1: 0.5302
 epoch: 64, train_loss: 0.8199, test_loss: 0.9285, test_f1: 0.5294
 epoch: 65, train_loss: 0.8119, test_loss: 0.9135, test_f1: 0.5808
 epoch: 66, train_loss: 0.8177, test_loss: 0.9345, test_f1: 0.5946
 epoch: 67, train_loss: 0.8222, test_loss: 0.9470, test_f1: 0.5077
 epoch: 68, train_loss: 0.8124, test_loss: 0.9431, test_f1: 0.5205
 epoch: 69, train_loss: 0.8064, test_loss: 1.0638, test_f1: 0.4576
 epoch: 70, train_loss: 0.8202, test_loss: 0.9389, test_f1: 0.6008
 epoch: 71, train_loss: 0.8200, test_loss: 0.9472, test_f1: 0.5529
 epoch: 72, train_loss: 0.8017, test_loss: 0.9112, test_f1: 0.6014
 epoch: 73, train_loss: 0.8048, test_loss: 0.9237, test_f1: 0.5724
 epoch: 74, train_loss: 0.8044, test_loss: 0.9166, test_f1: 0.5258
 epoch: 75, train_loss: 0.8061, test_loss: 0.9080, test_f1: 0.5376
 epoch: 76, train_loss: 0.8087, test_loss: 0.9297, test_f1: 0.5197
 epoch: 77, train_loss: 0.7864, test_loss: 0.9215, test_f1: 0.5904
 epoch: 78, train_loss: 0.7900, test_loss: 1.0371, test_f1: 0.5148
 epoch: 79, train_loss: 0.8081, test_loss: 0.9109, test_f1: 0.5609
 epoch: 80, train_loss: 0.7886, test_loss: 0.8972, test_f1: 0.5937
 epoch: 81, train_loss: 0.8003, test_loss: 0.9825, test_f1: 0.5298
 epoch: 82, train_loss: 0.7838, test_loss: 0.9402, test_f1: 0.5462
 epoch: 83, train_loss: 0.7770, test_loss: 0.9187, test_f1: 0.5805
 epoch: 84, train_loss: 0.7984, test_loss: 0.9047, test_f1: 0.5774
 epoch: 85, train_loss: 0.7897, test_loss: 0.9152, test_f1: 0.5509
 epoch: 86, train_loss: 0.7969, test_loss: 0.9205, test_f1: 0.5803
 epoch: 87, train_loss: 0.7884, test_loss: 0.9123, test_f1: 0.5898
 epoch: 88, train_loss: 0.7908, test_loss: 0.9357, test_f1: 0.5229
 epoch: 89, train_loss: 0.7822, test_loss: 0.9369, test_f1: 0.5192
 epoch: 90, train_loss: 0.7677, test_loss: 0.9286, test_f1: 0.5775
 epoch: 91, train_loss: 0.7779, test_loss: 0.9300, test_f1: 0.5672
 epoch: 92, train_loss: 0.7795, test_loss: 0.9018, test_f1: 0.5711
 epoch: 93, train_loss: 0.7697, test_loss: 0.9226, test_f1: 0.5173
 epoch: 94, train_loss: 0.7745, test_loss: 0.9731, test_f1: 0.5028
 epoch: 95, train_loss: 0.7748, test_loss: 0.8976, test_f1: 0.5600
 epoch: 96, train_loss: 0.7719, test_loss: 0.8854, test_f1: 0.5524
 epoch: 97, train_loss: 0.7805, test_loss: 0.9196, test_f1: 0.5862
 epoch: 98, train_loss: 0.7730, test_loss: 0.9480, test_f1: 0.5649
 epoch: 99, train_loss: 0.7734, test_loss: 0.9229, test_f1: 0.5559
##################ITERATION #3 ****************************************
 epoch: 0, train_loss: 1.1588, test_loss: 1.0720, test_f1: 0.3968
 epoch: 1, train_loss: 1.0334, test_loss: 1.0277, test_f1: 0.4680
 epoch: 2, train_loss: 1.0029, test_loss: 1.0401, test_f1: 0.4565
 epoch: 3, train_loss: 0.9964, test_loss: 0.9669, test_f1: 0.4728
 epoch: 4, train_loss: 0.9706, test_loss: 0.9982, test_f1: 0.4565
 epoch: 5, train_loss: 0.9658, test_loss: 1.0069, test_f1: 0.4827
 epoch: 6, train_loss: 0.9566, test_loss: 1.0101, test_f1: 0.4697
 epoch: 7, train_loss: 0.9409, test_loss: 0.9704, test_f1: 0.4911
 epoch: 8, train_loss: 0.9246, test_loss: 0.9949, test_f1: 0.4950
 epoch: 9, train_loss: 0.9084, test_loss: 0.9541, test_f1: 0.5119
 epoch: 10, train_loss: 0.9412, test_loss: 0.9438, test_f1: 0.4911
 epoch: 11, train_loss: 0.9168, test_loss: 0.9147, test_f1: 0.5164
 epoch: 12, train_loss: 0.9219, test_loss: 1.0310, test_f1: 0.5188
 epoch: 13, train_loss: 0.8973, test_loss: 1.0120, test_f1: 0.5018
 epoch: 14, train_loss: 0.9085, test_loss: 0.9549, test_f1: 0.5069
 epoch: 15, train_loss: 0.8933, test_loss: 0.9359, test_f1: 0.4920
 epoch: 16, train_loss: 0.9051, test_loss: 0.9357, test_f1: 0.4917
 epoch: 17, train_loss: 0.8908, test_loss: 0.9304, test_f1: 0.5449
 epoch: 18, train_loss: 0.8949, test_loss: 0.9218, test_f1: 0.5077
 epoch: 19, train_loss: 0.8746, test_loss: 0.9226, test_f1: 0.5144
 epoch: 20, train_loss: 0.8856, test_loss: 0.9641, test_f1: 0.5318
 epoch: 21, train_loss: 0.8962, test_loss: 0.9179, test_f1: 0.4928
 epoch: 22, train_loss: 0.8816, test_loss: 0.9555, test_f1: 0.5093
 epoch: 23, train_loss: 0.8775, test_loss: 0.9368, test_f1: 0.5236
 epoch: 24, train_loss: 0.8740, test_loss: 0.9412, test_f1: 0.5195
 epoch: 25, train_loss: 0.8797, test_loss: 0.9760, test_f1: 0.4992
 epoch: 26, train_loss: 0.8636, test_loss: 0.9417, test_f1: 0.5186
 epoch: 27, train_loss: 0.8429, test_loss: 0.9760, test_f1: 0.4938
 epoch: 28, train_loss: 0.8579, test_loss: 0.9762, test_f1: 0.5119
 epoch: 29, train_loss: 0.8642, test_loss: 0.9021, test_f1: 0.5100
 epoch: 30, train_loss: 0.8509, test_loss: 0.9126, test_f1: 0.5760
 epoch: 31, train_loss: 0.8476, test_loss: 0.9184, test_f1: 0.5280
 epoch: 32, train_loss: 0.8411, test_loss: 0.9611, test_f1: 0.4988
 epoch: 33, train_loss: 0.8304, test_loss: 0.8893, test_f1: 0.5516
 epoch: 34, train_loss: 0.8334, test_loss: 0.8554, test_f1: 0.5776
 epoch: 35, train_loss: 0.8370, test_loss: 0.8823, test_f1: 0.5424
 epoch: 36, train_loss: 0.8285, test_loss: 0.8843, test_f1: 0.5181
 epoch: 37, train_loss: 0.8338, test_loss: 0.9068, test_f1: 0.5416
 epoch: 38, train_loss: 0.8256, test_loss: 0.9146, test_f1: 0.5364
 epoch: 39, train_loss: 0.8301, test_loss: 0.8997, test_f1: 0.5375
 epoch: 40, train_loss: 0.8262, test_loss: 0.8916, test_f1: 0.5892
 epoch: 41, train_loss: 0.8208, test_loss: 0.9018, test_f1: 0.5175
 epoch: 42, train_loss: 0.8205, test_loss: 0.8927, test_f1: 0.5368
 epoch: 43, train_loss: 0.8215, test_loss: 0.8753, test_f1: 0.5472
 epoch: 44, train_loss: 0.8189, test_loss: 0.8744, test_f1: 0.5910
 epoch: 45, train_loss: 0.8030, test_loss: 0.9169, test_f1: 0.5181
 epoch: 46, train_loss: 0.8342, test_loss: 0.8697, test_f1: 0.5544
 epoch: 47, train_loss: 0.8401, test_loss: 0.8983, test_f1: 0.5324
 epoch: 48, train_loss: 0.8122, test_loss: 0.8765, test_f1: 0.5700
 epoch: 49, train_loss: 0.8024, test_loss: 0.8969, test_f1: 0.5510
 epoch: 50, train_loss: 0.8204, test_loss: 0.8988, test_f1: 0.5343
 epoch: 51, train_loss: 0.7817, test_loss: 0.8929, test_f1: 0.5392
 epoch: 52, train_loss: 0.7906, test_loss: 0.8854, test_f1: 0.5637
 epoch: 53, train_loss: 0.7850, test_loss: 0.8753, test_f1: 0.5420
 epoch: 54, train_loss: 0.7790, test_loss: 0.8735, test_f1: 0.5757
 epoch: 55, train_loss: 0.7841, test_loss: 0.9014, test_f1: 0.5473
 epoch: 56, train_loss: 0.7724, test_loss: 0.8844, test_f1: 0.5520
 epoch: 57, train_loss: 0.7739, test_loss: 0.8917, test_f1: 0.5598
 epoch: 58, train_loss: 0.7576, test_loss: 0.8787, test_f1: 0.5817
 epoch: 59, train_loss: 0.7662, test_loss: 0.8760, test_f1: 0.5670
 epoch: 60, train_loss: 0.7623, test_loss: 0.8736, test_f1: 0.5997
 epoch: 61, train_loss: 0.7656, test_loss: 0.8851, test_f1: 0.5967
 epoch: 62, train_loss: 0.7507, test_loss: 0.8922, test_f1: 0.5962
 epoch: 63, train_loss: 0.7705, test_loss: 0.8836, test_f1: 0.5597
 epoch: 64, train_loss: 0.7593, test_loss: 0.9028, test_f1: 0.5807
 epoch: 65, train_loss: 0.7532, test_loss: 0.8884, test_f1: 0.6037
 epoch: 66, train_loss: 0.7565, test_loss: 0.8719, test_f1: 0.5707
 epoch: 67, train_loss: 0.7492, test_loss: 0.8731, test_f1: 0.5849
 epoch: 68, train_loss: 0.7500, test_loss: 0.8750, test_f1: 0.6052
 epoch: 69, train_loss: 0.7636, test_loss: 0.8909, test_f1: 0.5878
 epoch: 70, train_loss: 0.7458, test_loss: 0.8836, test_f1: 0.6112
 epoch: 71, train_loss: 0.7416, test_loss: 0.8568, test_f1: 0.5968
 epoch: 72, train_loss: 0.7414, test_loss: 0.8745, test_f1: 0.6334
 epoch: 73, train_loss: 0.7453, test_loss: 0.8735, test_f1: 0.6132
 epoch: 74, train_loss: 0.7557, test_loss: 0.8903, test_f1: 0.5994
 epoch: 75, train_loss: 0.7468, test_loss: 0.8819, test_f1: 0.6191
 epoch: 76, train_loss: 0.7374, test_loss: 0.8452, test_f1: 0.6061
 epoch: 77, train_loss: 0.7461, test_loss: 0.9087, test_f1: 0.6028
 epoch: 78, train_loss: 0.7521, test_loss: 0.8631, test_f1: 0.6286
 epoch: 79, train_loss: 0.7439, test_loss: 0.8678, test_f1: 0.6158
 epoch: 80, train_loss: 0.7510, test_loss: 0.8610, test_f1: 0.6149
 epoch: 81, train_loss: 0.7426, test_loss: 0.8841, test_f1: 0.5730
 epoch: 82, train_loss: 0.7581, test_loss: 0.8591, test_f1: 0.6100
 epoch: 83, train_loss: 0.7341, test_loss: 0.8623, test_f1: 0.5731
 epoch: 84, train_loss: 0.7431, test_loss: 0.8750, test_f1: 0.5625
 epoch: 85, train_loss: 0.7306, test_loss: 0.8852, test_f1: 0.5715
 epoch: 86, train_loss: 0.7362, test_loss: 0.8751, test_f1: 0.6162
 epoch: 87, train_loss: 0.7264, test_loss: 0.8603, test_f1: 0.5858
 epoch: 88, train_loss: 0.7218, test_loss: 0.8748, test_f1: 0.6123
 epoch: 89, train_loss: 0.7181, test_loss: 0.8490, test_f1: 0.6295
 epoch: 90, train_loss: 0.7445, test_loss: 0.8522, test_f1: 0.6354
 epoch: 91, train_loss: 0.7360, test_loss: 0.8563, test_f1: 0.6076
 epoch: 92, train_loss: 0.7326, test_loss: 0.8478, test_f1: 0.6073
 epoch: 93, train_loss: 0.7161, test_loss: 0.8686, test_f1: 0.6272
 epoch: 94, train_loss: 0.7161, test_loss: 0.8953, test_f1: 0.6009
 epoch: 95, train_loss: 0.7270, test_loss: 0.8438, test_f1: 0.6035
 epoch: 96, train_loss: 0.7176, test_loss: 0.8552, test_f1: 0.6159
 epoch: 97, train_loss: 0.7291, test_loss: 0.8535, test_f1: 0.6220
 epoch: 98, train_loss: 0.7276, test_loss: 0.8607, test_f1: 0.6018
 epoch: 99, train_loss: 0.7386, test_loss: 0.8458, test_f1: 0.6080
##################ITERATION #4 ****************************************
 epoch: 0, train_loss: 1.2284, test_loss: 1.0584, test_f1: 0.4548
 epoch: 1, train_loss: 1.0603, test_loss: 1.0717, test_f1: 0.4565
 epoch: 2, train_loss: 1.0155, test_loss: 1.0145, test_f1: 0.4536
 epoch: 3, train_loss: 0.9915, test_loss: 1.0038, test_f1: 0.4922
 epoch: 4, train_loss: 0.9766, test_loss: 1.0227, test_f1: 0.4794
 epoch: 5, train_loss: 0.9654, test_loss: 1.0616, test_f1: 0.4447
 epoch: 6, train_loss: 0.9656, test_loss: 1.0239, test_f1: 0.4799
 epoch: 7, train_loss: 0.9700, test_loss: 1.0327, test_f1: 0.4828
 epoch: 8, train_loss: 0.9425, test_loss: 1.0144, test_f1: 0.4957
 epoch: 9, train_loss: 0.9372, test_loss: 1.1054, test_f1: 0.4558
 epoch: 10, train_loss: 0.9285, test_loss: 0.9365, test_f1: 0.5039
 epoch: 11, train_loss: 0.9295, test_loss: 1.1828, test_f1: 0.4641
 epoch: 12, train_loss: 0.9279, test_loss: 0.9938, test_f1: 0.5228
 epoch: 13, train_loss: 0.9215, test_loss: 0.9924, test_f1: 0.5103
 epoch: 14, train_loss: 0.9185, test_loss: 1.0052, test_f1: 0.5009
 epoch: 15, train_loss: 0.9183, test_loss: 0.9827, test_f1: 0.5191
 epoch: 16, train_loss: 0.9110, test_loss: 0.9600, test_f1: 0.5456
 epoch: 17, train_loss: 0.8994, test_loss: 0.9827, test_f1: 0.5115
 epoch: 18, train_loss: 0.9207, test_loss: 0.9936, test_f1: 0.5060
 epoch: 19, train_loss: 0.9046, test_loss: 1.0367, test_f1: 0.4888
 epoch: 20, train_loss: 0.9019, test_loss: 0.9806, test_f1: 0.5582
 epoch: 21, train_loss: 0.9020, test_loss: 0.9978, test_f1: 0.5190
 epoch: 22, train_loss: 0.9021, test_loss: 0.9685, test_f1: 0.5266
 epoch: 23, train_loss: 0.8982, test_loss: 1.0162, test_f1: 0.5255
 epoch: 24, train_loss: 0.9067, test_loss: 0.9873, test_f1: 0.5314
 epoch: 25, train_loss: 0.8977, test_loss: 0.9486, test_f1: 0.5162
 epoch: 26, train_loss: 0.8984, test_loss: 0.9851, test_f1: 0.4973
 epoch: 27, train_loss: 0.9023, test_loss: 0.9511, test_f1: 0.5230
 epoch: 28, train_loss: 0.8847, test_loss: 0.9493, test_f1: 0.5046
 epoch: 29, train_loss: 0.8883, test_loss: 1.0034, test_f1: 0.5178
 epoch: 30, train_loss: 0.8797, test_loss: 1.0543, test_f1: 0.4967
 epoch: 31, train_loss: 0.8792, test_loss: 1.0040, test_f1: 0.5122
 epoch: 32, train_loss: 0.8886, test_loss: 0.9711, test_f1: 0.5216
 epoch: 33, train_loss: 0.8894, test_loss: 1.0116, test_f1: 0.5068
 epoch: 34, train_loss: 0.8773, test_loss: 0.9646, test_f1: 0.5440
 epoch: 35, train_loss: 0.8852, test_loss: 0.9737, test_f1: 0.5315
 epoch: 36, train_loss: 0.8765, test_loss: 0.9317, test_f1: 0.5621
 epoch: 37, train_loss: 0.8834, test_loss: 0.9524, test_f1: 0.5404
 epoch: 38, train_loss: 0.8782, test_loss: 1.0083, test_f1: 0.5290
 epoch: 39, train_loss: 0.8824, test_loss: 0.9464, test_f1: 0.5196
 epoch: 40, train_loss: 0.8944, test_loss: 0.9648, test_f1: 0.5603
 epoch: 41, train_loss: 0.8641, test_loss: 0.9612, test_f1: 0.5858
 epoch: 42, train_loss: 0.8599, test_loss: 0.9633, test_f1: 0.5087
 epoch: 43, train_loss: 0.8823, test_loss: 0.9528, test_f1: 0.5186
 epoch: 44, train_loss: 0.8677, test_loss: 0.9151, test_f1: 0.5131
 epoch: 45, train_loss: 0.8821, test_loss: 0.9587, test_f1: 0.4923
 epoch: 46, train_loss: 0.8679, test_loss: 0.9859, test_f1: 0.5432
 epoch: 47, train_loss: 0.8604, test_loss: 0.9439, test_f1: 0.5596
 epoch: 48, train_loss: 0.8604, test_loss: 0.9244, test_f1: 0.5752
 epoch: 49, train_loss: 0.8512, test_loss: 0.9514, test_f1: 0.5208
 epoch: 50, train_loss: 0.8677, test_loss: 0.9462, test_f1: 0.5005
 epoch: 51, train_loss: 0.8430, test_loss: 0.9211, test_f1: 0.5266
 epoch: 52, train_loss: 0.8342, test_loss: 0.9346, test_f1: 0.5383
 epoch: 53, train_loss: 0.8219, test_loss: 0.9271, test_f1: 0.5928
 epoch: 54, train_loss: 0.8251, test_loss: 0.9322, test_f1: 0.6164
 epoch: 55, train_loss: 0.8289, test_loss: 0.9300, test_f1: 0.5889
 epoch: 56, train_loss: 0.8205, test_loss: 0.9342, test_f1: 0.5993
 epoch: 57, train_loss: 0.8188, test_loss: 0.9408, test_f1: 0.5516
 epoch: 58, train_loss: 0.8072, test_loss: 0.9400, test_f1: 0.5487
 epoch: 59, train_loss: 0.8214, test_loss: 0.9221, test_f1: 0.5993
 epoch: 60, train_loss: 0.8197, test_loss: 0.9319, test_f1: 0.5977
 epoch: 61, train_loss: 0.8101, test_loss: 0.9312, test_f1: 0.5657
 epoch: 62, train_loss: 0.8088, test_loss: 0.9440, test_f1: 0.6019
 epoch: 63, train_loss: 0.8041, test_loss: 0.9385, test_f1: 0.5992
 epoch: 64, train_loss: 0.8074, test_loss: 0.9367, test_f1: 0.5776
 epoch: 65, train_loss: 0.8051, test_loss: 0.9111, test_f1: 0.6221
 epoch: 66, train_loss: 0.8015, test_loss: 0.8926, test_f1: 0.6148
 epoch: 67, train_loss: 0.8007, test_loss: 0.9229, test_f1: 0.5971
 epoch: 68, train_loss: 0.8077, test_loss: 0.9278, test_f1: 0.5791
 epoch: 69, train_loss: 0.8040, test_loss: 0.9217, test_f1: 0.6047
 epoch: 70, train_loss: 0.8033, test_loss: 0.9163, test_f1: 0.5858
 epoch: 71, train_loss: 0.7876, test_loss: 0.9083, test_f1: 0.6140
 epoch: 72, train_loss: 0.8027, test_loss: 0.9230, test_f1: 0.6104
 epoch: 73, train_loss: 0.8082, test_loss: 0.9332, test_f1: 0.6040
 epoch: 74, train_loss: 0.7949, test_loss: 0.9048, test_f1: 0.6246
 epoch: 75, train_loss: 0.7860, test_loss: 0.9233, test_f1: 0.6060
 epoch: 76, train_loss: 0.8011, test_loss: 0.9549, test_f1: 0.6200
 epoch: 77, train_loss: 0.8128, test_loss: 0.9057, test_f1: 0.6117
 epoch: 78, train_loss: 0.7950, test_loss: 0.9226, test_f1: 0.5860
 epoch: 79, train_loss: 0.8015, test_loss: 0.9384, test_f1: 0.5701
 epoch: 80, train_loss: 0.8002, test_loss: 0.8977, test_f1: 0.6191
 epoch: 81, train_loss: 0.7841, test_loss: 0.9290, test_f1: 0.6142
 epoch: 82, train_loss: 0.7823, test_loss: 0.9152, test_f1: 0.6029
 epoch: 83, train_loss: 0.7893, test_loss: 0.9427, test_f1: 0.6020
 epoch: 84, train_loss: 0.7760, test_loss: 0.9260, test_f1: 0.6160
 epoch: 85, train_loss: 0.7943, test_loss: 0.9455, test_f1: 0.6002
 epoch: 86, train_loss: 0.7899, test_loss: 0.9128, test_f1: 0.6023
 epoch: 87, train_loss: 0.7881, test_loss: 0.9003, test_f1: 0.5937
 epoch: 88, train_loss: 0.7805, test_loss: 0.9211, test_f1: 0.6128
 epoch: 89, train_loss: 0.7755, test_loss: 0.9066, test_f1: 0.6223
 epoch: 90, train_loss: 0.7773, test_loss: 0.9248, test_f1: 0.6032
 epoch: 91, train_loss: 0.7632, test_loss: 0.9206, test_f1: 0.6265
 epoch: 92, train_loss: 0.7687, test_loss: 0.9153, test_f1: 0.6206
 epoch: 93, train_loss: 0.7716, test_loss: 0.9243, test_f1: 0.6259
 epoch: 94, train_loss: 0.7649, test_loss: 0.9472, test_f1: 0.6195
 epoch: 95, train_loss: 0.7832, test_loss: 0.9312, test_f1: 0.6362
 epoch: 96, train_loss: 0.7773, test_loss: 0.9308, test_f1: 0.6136
 epoch: 97, train_loss: 0.7660, test_loss: 0.9183, test_f1: 0.6335
 epoch: 98, train_loss: 0.7641, test_loss: 0.9137, test_f1: 0.6161
 epoch: 99, train_loss: 0.7770, test_loss: 0.9440, test_f1: 0.6073
##################ITERATION #5 ****************************************
 epoch: 0, train_loss: 1.2069, test_loss: 1.1154, test_f1: 0.4109
 epoch: 1, train_loss: 1.0571, test_loss: 0.9981, test_f1: 0.4899
 epoch: 2, train_loss: 1.0201, test_loss: 0.9767, test_f1: 0.4604
 epoch: 3, train_loss: 0.9962, test_loss: 1.0207, test_f1: 0.4261
 epoch: 4, train_loss: 0.9827, test_loss: 0.9835, test_f1: 0.4674
 epoch: 5, train_loss: 0.9690, test_loss: 0.9331, test_f1: 0.5060
 epoch: 6, train_loss: 0.9707, test_loss: 1.0135, test_f1: 0.5158
 epoch: 7, train_loss: 0.9560, test_loss: 0.9906, test_f1: 0.4826
 epoch: 8, train_loss: 0.9543, test_loss: 0.9830, test_f1: 0.5079
 epoch: 9, train_loss: 0.9439, test_loss: 1.1007, test_f1: 0.4389
 epoch: 10, train_loss: 0.9321, test_loss: 0.9270, test_f1: 0.5031
 epoch: 11, train_loss: 0.9276, test_loss: 0.9656, test_f1: 0.5352
 epoch: 12, train_loss: 0.9215, test_loss: 0.9972, test_f1: 0.5020
 epoch: 13, train_loss: 0.9198, test_loss: 0.9010, test_f1: 0.5109
 epoch: 14, train_loss: 0.9334, test_loss: 1.0103, test_f1: 0.4854
 epoch: 15, train_loss: 0.9109, test_loss: 0.9951, test_f1: 0.5161
 epoch: 16, train_loss: 0.9153, test_loss: 0.9790, test_f1: 0.5188
 epoch: 17, train_loss: 0.9007, test_loss: 0.9448, test_f1: 0.5244
 epoch: 18, train_loss: 0.8971, test_loss: 0.9439, test_f1: 0.5386
 epoch: 19, train_loss: 0.9135, test_loss: 0.8928, test_f1: 0.5204
 epoch: 20, train_loss: 0.9034, test_loss: 0.9720, test_f1: 0.5274
 epoch: 21, train_loss: 0.9177, test_loss: 0.9802, test_f1: 0.5272
 epoch: 22, train_loss: 0.9002, test_loss: 1.0012, test_f1: 0.5394
 epoch: 23, train_loss: 0.9069, test_loss: 1.1038, test_f1: 0.4677
 epoch: 24, train_loss: 0.8928, test_loss: 0.9827, test_f1: 0.5257
 epoch: 25, train_loss: 0.8880, test_loss: 0.9738, test_f1: 0.4965
 epoch: 26, train_loss: 0.8801, test_loss: 0.9495, test_f1: 0.5382
 epoch: 27, train_loss: 0.8901, test_loss: 0.9834, test_f1: 0.5064
 epoch: 28, train_loss: 0.8829, test_loss: 0.9704, test_f1: 0.5229
 epoch: 29, train_loss: 0.8711, test_loss: 0.9793, test_f1: 0.5453
 epoch: 30, train_loss: 0.8767, test_loss: 0.9903, test_f1: 0.5093
 epoch: 31, train_loss: 0.8728, test_loss: 1.1319, test_f1: 0.4763
 epoch: 32, train_loss: 0.8777, test_loss: 0.9413, test_f1: 0.5592
 epoch: 33, train_loss: 0.8717, test_loss: 0.9965, test_f1: 0.5290
 epoch: 34, train_loss: 0.8702, test_loss: 0.9475, test_f1: 0.5378
 epoch: 35, train_loss: 0.8625, test_loss: 0.9398, test_f1: 0.5382
 epoch: 36, train_loss: 0.8653, test_loss: 0.9446, test_f1: 0.5372
 epoch: 37, train_loss: 0.8788, test_loss: 0.9952, test_f1: 0.5018
 epoch: 38, train_loss: 0.8568, test_loss: 0.9794, test_f1: 0.5329
 epoch: 39, train_loss: 0.8509, test_loss: 0.9762, test_f1: 0.5180
 epoch: 40, train_loss: 0.8510, test_loss: 0.9073, test_f1: 0.5490
 epoch: 41, train_loss: 0.8599, test_loss: 0.9235, test_f1: 0.5097
 epoch: 42, train_loss: 0.8447, test_loss: 0.9626, test_f1: 0.5348
 epoch: 43, train_loss: 0.8484, test_loss: 0.9459, test_f1: 0.5180
 epoch: 44, train_loss: 0.8559, test_loss: 0.9596, test_f1: 0.5443
 epoch: 45, train_loss: 0.8358, test_loss: 0.9523, test_f1: 0.5163
 epoch: 46, train_loss: 0.8486, test_loss: 0.9345, test_f1: 0.5744
 epoch: 47, train_loss: 0.8471, test_loss: 0.9330, test_f1: 0.5455
 epoch: 48, train_loss: 0.8512, test_loss: 0.9600, test_f1: 0.5197
 epoch: 49, train_loss: 0.8501, test_loss: 1.0631, test_f1: 0.4734
 epoch: 50, train_loss: 0.8820, test_loss: 0.9528, test_f1: 0.5446
 epoch: 51, train_loss: 0.8448, test_loss: 0.9133, test_f1: 0.5578
 epoch: 52, train_loss: 0.8192, test_loss: 0.9139, test_f1: 0.5804
 epoch: 53, train_loss: 0.8170, test_loss: 0.9576, test_f1: 0.5605
 epoch: 54, train_loss: 0.8117, test_loss: 0.9121, test_f1: 0.5934
 epoch: 55, train_loss: 0.8114, test_loss: 0.9425, test_f1: 0.5790
 epoch: 56, train_loss: 0.8040, test_loss: 0.9186, test_f1: 0.5697
 epoch: 57, train_loss: 0.7999, test_loss: 0.9181, test_f1: 0.5666
 epoch: 58, train_loss: 0.8108, test_loss: 0.9143, test_f1: 0.5934
 epoch: 59, train_loss: 0.8006, test_loss: 0.9352, test_f1: 0.5830
 epoch: 60, train_loss: 0.8141, test_loss: 0.9266, test_f1: 0.5973
 epoch: 61, train_loss: 0.8008, test_loss: 0.8867, test_f1: 0.6057
 epoch: 62, train_loss: 0.7944, test_loss: 0.9219, test_f1: 0.5835
 epoch: 63, train_loss: 0.8012, test_loss: 0.9206, test_f1: 0.6115
 epoch: 64, train_loss: 0.8089, test_loss: 1.0055, test_f1: 0.5137
 epoch: 65, train_loss: 0.7978, test_loss: 0.9245, test_f1: 0.5806
 epoch: 66, train_loss: 0.8005, test_loss: 0.9057, test_f1: 0.6159
 epoch: 67, train_loss: 0.7923, test_loss: 0.9227, test_f1: 0.6034
 epoch: 68, train_loss: 0.8064, test_loss: 0.9597, test_f1: 0.5352
 epoch: 69, train_loss: 0.7903, test_loss: 0.9355, test_f1: 0.6157
 epoch: 70, train_loss: 0.7937, test_loss: 0.9107, test_f1: 0.6233
 epoch: 71, train_loss: 0.7790, test_loss: 0.9779, test_f1: 0.5971
 epoch: 72, train_loss: 0.8012, test_loss: 0.9190, test_f1: 0.6020
 epoch: 73, train_loss: 0.7874, test_loss: 0.9320, test_f1: 0.6247
 epoch: 74, train_loss: 0.7891, test_loss: 0.9385, test_f1: 0.5485
 epoch: 75, train_loss: 0.7812, test_loss: 0.9147, test_f1: 0.6013
 epoch: 76, train_loss: 0.7902, test_loss: 0.9456, test_f1: 0.5558
 epoch: 77, train_loss: 0.7788, test_loss: 0.9219, test_f1: 0.6401
 epoch: 78, train_loss: 0.7917, test_loss: 0.9510, test_f1: 0.5663
 epoch: 79, train_loss: 0.7681, test_loss: 0.8968, test_f1: 0.6250
 epoch: 80, train_loss: 0.7815, test_loss: 0.9226, test_f1: 0.6304
 epoch: 81, train_loss: 0.7876, test_loss: 0.8921, test_f1: 0.5775
 epoch: 82, train_loss: 0.7922, test_loss: 0.9347, test_f1: 0.5638
 epoch: 83, train_loss: 0.7837, test_loss: 0.9250, test_f1: 0.5920
 epoch: 84, train_loss: 0.7741, test_loss: 0.9295, test_f1: 0.6001
 epoch: 85, train_loss: 0.7887, test_loss: 0.9065, test_f1: 0.6136
 epoch: 86, train_loss: 0.7691, test_loss: 0.9082, test_f1: 0.6053
 epoch: 87, train_loss: 0.7879, test_loss: 0.9065, test_f1: 0.6115
 epoch: 88, train_loss: 0.7676, test_loss: 0.9383, test_f1: 0.5817
 epoch: 89, train_loss: 0.7725, test_loss: 0.9559, test_f1: 0.5942
 epoch: 90, train_loss: 0.7692, test_loss: 0.9246, test_f1: 0.6314
 epoch: 91, train_loss: 0.7706, test_loss: 0.9103, test_f1: 0.5974
 epoch: 92, train_loss: 0.7686, test_loss: 0.9173, test_f1: 0.6269
 epoch: 93, train_loss: 0.7678, test_loss: 0.8926, test_f1: 0.6255
 epoch: 94, train_loss: 0.7746, test_loss: 0.9185, test_f1: 0.5840
 epoch: 95, train_loss: 0.7650, test_loss: 0.9365, test_f1: 0.5786
 epoch: 96, train_loss: 0.7671, test_loss: 0.8947, test_f1: 0.6365
 epoch: 97, train_loss: 0.7704, test_loss: 0.9721, test_f1: 0.5653
 epoch: 98, train_loss: 0.7623, test_loss: 0.9138, test_f1: 0.6194
 epoch: 99, train_loss: 0.7586, test_loss: 0.9207, test_f1: 0.6222
##################ITERATION #6 ****************************************
 epoch: 0, train_loss: 1.1933, test_loss: 1.0707, test_f1: 0.4223
 epoch: 1, train_loss: 1.0478, test_loss: 1.0377, test_f1: 0.3889
 epoch: 2, train_loss: 1.0191, test_loss: 1.0920, test_f1: 0.4566
 epoch: 3, train_loss: 0.9986, test_loss: 1.0245, test_f1: 0.4819
 epoch: 4, train_loss: 0.9953, test_loss: 1.0749, test_f1: 0.4716
 epoch: 5, train_loss: 0.9952, test_loss: 1.0482, test_f1: 0.4801
 epoch: 6, train_loss: 0.9809, test_loss: 1.0515, test_f1: 0.4801
 epoch: 7, train_loss: 0.9674, test_loss: 1.0840, test_f1: 0.4931
 epoch: 8, train_loss: 0.9729, test_loss: 1.0346, test_f1: 0.4958
 epoch: 9, train_loss: 0.9636, test_loss: 1.0326, test_f1: 0.4845
 epoch: 10, train_loss: 0.9484, test_loss: 1.0335, test_f1: 0.5244
 epoch: 11, train_loss: 0.9556, test_loss: 1.0560, test_f1: 0.4838
 epoch: 12, train_loss: 0.9397, test_loss: 1.0129, test_f1: 0.4761
 epoch: 13, train_loss: 0.9500, test_loss: 1.0474, test_f1: 0.4828
 epoch: 14, train_loss: 0.9364, test_loss: 1.0045, test_f1: 0.4706
 epoch: 15, train_loss: 0.9437, test_loss: 0.9660, test_f1: 0.4952
 epoch: 16, train_loss: 0.9224, test_loss: 1.0387, test_f1: 0.4868
 epoch: 17, train_loss: 0.9244, test_loss: 1.0016, test_f1: 0.4910
 epoch: 18, train_loss: 0.9276, test_loss: 0.9754, test_f1: 0.4960
 epoch: 19, train_loss: 0.9209, test_loss: 1.1014, test_f1: 0.4760
 epoch: 20, train_loss: 0.9358, test_loss: 0.9788, test_f1: 0.4932
 epoch: 21, train_loss: 0.9185, test_loss: 1.0332, test_f1: 0.4870
 epoch: 22, train_loss: 0.9227, test_loss: 0.9848, test_f1: 0.4996
 epoch: 23, train_loss: 0.9058, test_loss: 0.9772, test_f1: 0.4890
 epoch: 24, train_loss: 0.9138, test_loss: 1.0359, test_f1: 0.5110
 epoch: 25, train_loss: 0.9153, test_loss: 0.9323, test_f1: 0.5046
 epoch: 26, train_loss: 0.9020, test_loss: 1.0446, test_f1: 0.4856
 epoch: 27, train_loss: 0.9171, test_loss: 0.9743, test_f1: 0.5008
 epoch: 28, train_loss: 0.8905, test_loss: 0.9658, test_f1: 0.4999
 epoch: 29, train_loss: 0.8879, test_loss: 0.9503, test_f1: 0.5085
 epoch: 30, train_loss: 0.8888, test_loss: 0.9189, test_f1: 0.4864
 epoch: 31, train_loss: 0.8879, test_loss: 0.9864, test_f1: 0.4931
 epoch: 32, train_loss: 0.8859, test_loss: 0.9731, test_f1: 0.4996
 epoch: 33, train_loss: 0.8741, test_loss: 0.9491, test_f1: 0.5282
 epoch: 34, train_loss: 0.8826, test_loss: 0.9590, test_f1: 0.5115
 epoch: 35, train_loss: 0.8969, test_loss: 0.9559, test_f1: 0.5466
 epoch: 36, train_loss: 0.8750, test_loss: 0.9474, test_f1: 0.5269
 epoch: 37, train_loss: 0.8682, test_loss: 0.9948, test_f1: 0.5212
 epoch: 38, train_loss: 0.8764, test_loss: 0.9867, test_f1: 0.5092
 epoch: 39, train_loss: 0.8773, test_loss: 0.9657, test_f1: 0.5352
 epoch: 40, train_loss: 0.8614, test_loss: 0.9766, test_f1: 0.5152
 epoch: 41, train_loss: 0.8591, test_loss: 1.0041, test_f1: 0.5275
 epoch: 42, train_loss: 0.8618, test_loss: 0.9445, test_f1: 0.5084
 epoch: 43, train_loss: 0.8545, test_loss: 0.9809, test_f1: 0.5005
 epoch: 44, train_loss: 0.8606, test_loss: 0.9239, test_f1: 0.5564
 epoch: 45, train_loss: 0.8563, test_loss: 0.9740, test_f1: 0.5379
 epoch: 46, train_loss: 0.8505, test_loss: 0.9340, test_f1: 0.5252
 epoch: 47, train_loss: 0.8663, test_loss: 0.9116, test_f1: 0.4977
 epoch: 48, train_loss: 0.8601, test_loss: 0.9114, test_f1: 0.5376
 epoch: 49, train_loss: 0.8423, test_loss: 0.9328, test_f1: 0.5358
 epoch: 50, train_loss: 0.8433, test_loss: 0.9036, test_f1: 0.5507
 epoch: 51, train_loss: 0.8222, test_loss: 0.9243, test_f1: 0.5306
 epoch: 52, train_loss: 0.8095, test_loss: 0.9066, test_f1: 0.5462
 epoch: 53, train_loss: 0.8213, test_loss: 0.9122, test_f1: 0.5306
 epoch: 54, train_loss: 0.8057, test_loss: 0.9005, test_f1: 0.5553
 epoch: 55, train_loss: 0.8132, test_loss: 0.9273, test_f1: 0.5217
 epoch: 56, train_loss: 0.8045, test_loss: 0.9153, test_f1: 0.5287
 epoch: 57, train_loss: 0.7886, test_loss: 0.9193, test_f1: 0.5532
 epoch: 58, train_loss: 0.8138, test_loss: 0.9370, test_f1: 0.5502
 epoch: 59, train_loss: 0.8055, test_loss: 0.9303, test_f1: 0.5405
 epoch: 60, train_loss: 0.8139, test_loss: 0.9645, test_f1: 0.5772
 epoch: 61, train_loss: 0.7985, test_loss: 0.9457, test_f1: 0.5226
 epoch: 62, train_loss: 0.7852, test_loss: 0.9048, test_f1: 0.5748
 epoch: 63, train_loss: 0.7930, test_loss: 0.9832, test_f1: 0.5384
 epoch: 64, train_loss: 0.7933, test_loss: 0.9255, test_f1: 0.5501
 epoch: 65, train_loss: 0.8036, test_loss: 0.8847, test_f1: 0.5310
 epoch: 66, train_loss: 0.7982, test_loss: 0.9590, test_f1: 0.5247
 epoch: 67, train_loss: 0.7943, test_loss: 0.8887, test_f1: 0.5482
 epoch: 68, train_loss: 0.7948, test_loss: 0.9433, test_f1: 0.5506
 epoch: 69, train_loss: 0.7929, test_loss: 0.9105, test_f1: 0.5414
 epoch: 70, train_loss: 0.7890, test_loss: 0.9403, test_f1: 0.5768
 epoch: 71, train_loss: 0.7855, test_loss: 0.9780, test_f1: 0.5472
 epoch: 72, train_loss: 0.7927, test_loss: 0.9594, test_f1: 0.5460
 epoch: 73, train_loss: 0.7756, test_loss: 0.9232, test_f1: 0.5537
 epoch: 74, train_loss: 0.7745, test_loss: 0.9197, test_f1: 0.5649
 epoch: 75, train_loss: 0.7828, test_loss: 0.9323, test_f1: 0.5432
 epoch: 76, train_loss: 0.7766, test_loss: 0.9033, test_f1: 0.5823
 epoch: 77, train_loss: 0.7805, test_loss: 0.9282, test_f1: 0.5452
 epoch: 78, train_loss: 0.7904, test_loss: 0.9038, test_f1: 0.5417
 epoch: 79, train_loss: 0.7821, test_loss: 0.9116, test_f1: 0.5578
 epoch: 80, train_loss: 0.7707, test_loss: 0.9015, test_f1: 0.5391
 epoch: 81, train_loss: 0.7725, test_loss: 0.9240, test_f1: 0.5379
 epoch: 82, train_loss: 0.7837, test_loss: 0.9195, test_f1: 0.5554
 epoch: 83, train_loss: 0.7698, test_loss: 0.9034, test_f1: 0.5817
 epoch: 84, train_loss: 0.7766, test_loss: 0.9222, test_f1: 0.5686
 epoch: 85, train_loss: 0.7761, test_loss: 0.9195, test_f1: 0.5483
 epoch: 86, train_loss: 0.7727, test_loss: 0.9647, test_f1: 0.5232
 epoch: 87, train_loss: 0.7937, test_loss: 0.9114, test_f1: 0.5637
 epoch: 88, train_loss: 0.7695, test_loss: 0.9289, test_f1: 0.5577
 epoch: 89, train_loss: 0.7698, test_loss: 0.9190, test_f1: 0.5685
 epoch: 90, train_loss: 0.7654, test_loss: 0.9070, test_f1: 0.5557
 epoch: 91, train_loss: 0.7689, test_loss: 0.9209, test_f1: 0.5867
 epoch: 92, train_loss: 0.7561, test_loss: 0.9125, test_f1: 0.5733
 epoch: 93, train_loss: 0.7636, test_loss: 0.9153, test_f1: 0.5817
 epoch: 94, train_loss: 0.7648, test_loss: 0.8928, test_f1: 0.5839
 epoch: 95, train_loss: 0.7655, test_loss: 0.9268, test_f1: 0.5806
 epoch: 96, train_loss: 0.7591, test_loss: 0.9065, test_f1: 0.5771
 epoch: 97, train_loss: 0.7392, test_loss: 0.9124, test_f1: 0.5842
 epoch: 98, train_loss: 0.7562, test_loss: 0.9210, test_f1: 0.6107
 epoch: 99, train_loss: 0.7478, test_loss: 0.9333, test_f1: 0.5522
##################ITERATION #7 ****************************************
 epoch: 0, train_loss: 1.2514, test_loss: 1.1331, test_f1: 0.3763
 epoch: 1, train_loss: 1.0637, test_loss: 1.0661, test_f1: 0.4778
 epoch: 2, train_loss: 1.0332, test_loss: 1.1694, test_f1: 0.4022
 epoch: 3, train_loss: 1.0191, test_loss: 1.0825, test_f1: 0.4416
 epoch: 4, train_loss: 1.0026, test_loss: 1.0698, test_f1: 0.4265
 epoch: 5, train_loss: 0.9865, test_loss: 0.9712, test_f1: 0.4622
 epoch: 6, train_loss: 0.9750, test_loss: 1.0251, test_f1: 0.4999
 epoch: 7, train_loss: 0.9841, test_loss: 1.0086, test_f1: 0.4811
 epoch: 8, train_loss: 0.9596, test_loss: 0.9676, test_f1: 0.4663
 epoch: 9, train_loss: 0.9515, test_loss: 1.0664, test_f1: 0.4927
 epoch: 10, train_loss: 0.9520, test_loss: 1.0040, test_f1: 0.4414
 epoch: 11, train_loss: 0.9484, test_loss: 1.0299, test_f1: 0.4432
 epoch: 12, train_loss: 0.9386, test_loss: 0.9705, test_f1: 0.4958
 epoch: 13, train_loss: 0.9348, test_loss: 1.0495, test_f1: 0.4940
 epoch: 14, train_loss: 0.9219, test_loss: 0.9974, test_f1: 0.5086
 epoch: 15, train_loss: 0.9339, test_loss: 1.0090, test_f1: 0.5028
 epoch: 16, train_loss: 0.9199, test_loss: 1.0211, test_f1: 0.4708
 epoch: 17, train_loss: 0.9077, test_loss: 0.9771, test_f1: 0.4954
 epoch: 18, train_loss: 0.8901, test_loss: 1.0490, test_f1: 0.5285
 epoch: 19, train_loss: 0.8929, test_loss: 0.9924, test_f1: 0.5169
 epoch: 20, train_loss: 0.9052, test_loss: 0.9661, test_f1: 0.5228
 epoch: 21, train_loss: 0.8913, test_loss: 1.0601, test_f1: 0.5344
 epoch: 22, train_loss: 0.8919, test_loss: 0.9720, test_f1: 0.5143
 epoch: 23, train_loss: 0.8882, test_loss: 1.0127, test_f1: 0.5543
 epoch: 24, train_loss: 0.8765, test_loss: 0.9648, test_f1: 0.5701
 epoch: 25, train_loss: 0.8702, test_loss: 0.9723, test_f1: 0.5004
 epoch: 26, train_loss: 0.8775, test_loss: 0.9322, test_f1: 0.5534
 epoch: 27, train_loss: 0.8523, test_loss: 0.9686, test_f1: 0.5150
 epoch: 28, train_loss: 0.8733, test_loss: 0.9356, test_f1: 0.5622
 epoch: 29, train_loss: 0.8540, test_loss: 0.9434, test_f1: 0.5768
 epoch: 30, train_loss: 0.8530, test_loss: 0.9887, test_f1: 0.4996
 epoch: 31, train_loss: 0.8686, test_loss: 0.9887, test_f1: 0.5068
 epoch: 32, train_loss: 0.8389, test_loss: 1.0037, test_f1: 0.4986
 epoch: 33, train_loss: 0.8422, test_loss: 0.9819, test_f1: 0.5223
 epoch: 34, train_loss: 0.8487, test_loss: 1.0068, test_f1: 0.5323
 epoch: 35, train_loss: 0.8513, test_loss: 0.9999, test_f1: 0.5234
 epoch: 36, train_loss: 0.8697, test_loss: 0.9882, test_f1: 0.5139
 epoch: 37, train_loss: 0.8291, test_loss: 0.9789, test_f1: 0.5536
 epoch: 38, train_loss: 0.8385, test_loss: 1.0405, test_f1: 0.4900
 epoch: 39, train_loss: 0.8449, test_loss: 0.9799, test_f1: 0.5481
 epoch: 40, train_loss: 0.8373, test_loss: 0.9579, test_f1: 0.5520
 epoch: 41, train_loss: 0.8305, test_loss: 1.0209, test_f1: 0.5262
 epoch: 42, train_loss: 0.8461, test_loss: 0.9467, test_f1: 0.5521
 epoch: 43, train_loss: 0.8279, test_loss: 0.9550, test_f1: 0.5772
 epoch: 44, train_loss: 0.8217, test_loss: 1.0421, test_f1: 0.5380
 epoch: 45, train_loss: 0.8394, test_loss: 0.9730, test_f1: 0.5277
 epoch: 46, train_loss: 0.8218, test_loss: 1.0013, test_f1: 0.5738
 epoch: 47, train_loss: 0.8144, test_loss: 0.9855, test_f1: 0.6259
 epoch: 48, train_loss: 0.8276, test_loss: 0.9655, test_f1: 0.5451
 epoch: 49, train_loss: 0.8117, test_loss: 1.0290, test_f1: 0.5160
 epoch: 50, train_loss: 0.8236, test_loss: 1.0226, test_f1: 0.5734
 epoch: 51, train_loss: 0.7970, test_loss: 0.9658, test_f1: 0.5981
 epoch: 52, train_loss: 0.7806, test_loss: 0.9558, test_f1: 0.5599
 epoch: 53, train_loss: 0.7817, test_loss: 0.9694, test_f1: 0.5521
 epoch: 54, train_loss: 0.7668, test_loss: 1.0055, test_f1: 0.5872
 epoch: 55, train_loss: 0.7802, test_loss: 0.9863, test_f1: 0.5654
 epoch: 56, train_loss: 0.7523, test_loss: 1.0423, test_f1: 0.5577
 epoch: 57, train_loss: 0.7632, test_loss: 0.9626, test_f1: 0.5516
 epoch: 58, train_loss: 0.7516, test_loss: 0.9920, test_f1: 0.5795
 epoch: 59, train_loss: 0.7710, test_loss: 0.9517, test_f1: 0.5884
 epoch: 60, train_loss: 0.7634, test_loss: 0.9755, test_f1: 0.5930
 epoch: 61, train_loss: 0.7745, test_loss: 0.9975, test_f1: 0.5606
 epoch: 62, train_loss: 0.7554, test_loss: 1.0043, test_f1: 0.5998
 epoch: 63, train_loss: 0.7654, test_loss: 0.9626, test_f1: 0.5581
 epoch: 64, train_loss: 0.7607, test_loss: 0.9774, test_f1: 0.6037
 epoch: 65, train_loss: 0.7487, test_loss: 1.0017, test_f1: 0.5904
 epoch: 66, train_loss: 0.7764, test_loss: 1.0057, test_f1: 0.5870
 epoch: 67, train_loss: 0.7400, test_loss: 0.9776, test_f1: 0.5449
 epoch: 68, train_loss: 0.7482, test_loss: 1.0445, test_f1: 0.5940
 epoch: 69, train_loss: 0.7591, test_loss: 1.0060, test_f1: 0.5957
 epoch: 70, train_loss: 0.7469, test_loss: 1.0753, test_f1: 0.5940
 epoch: 71, train_loss: 0.7488, test_loss: 0.9907, test_f1: 0.5957
 epoch: 72, train_loss: 0.7485, test_loss: 1.0072, test_f1: 0.5751
 epoch: 73, train_loss: 0.7339, test_loss: 1.0047, test_f1: 0.5651
 epoch: 74, train_loss: 0.7370, test_loss: 1.0438, test_f1: 0.5735
 epoch: 75, train_loss: 0.7419, test_loss: 0.9361, test_f1: 0.6338
 epoch: 76, train_loss: 0.7419, test_loss: 0.9616, test_f1: 0.6261
 epoch: 77, train_loss: 0.7332, test_loss: 0.9859, test_f1: 0.6147
 epoch: 78, train_loss: 0.7276, test_loss: 0.9867, test_f1: 0.6309
 epoch: 79, train_loss: 0.7399, test_loss: 1.0222, test_f1: 0.5796
 epoch: 80, train_loss: 0.7390, test_loss: 0.9807, test_f1: 0.6230
 epoch: 81, train_loss: 0.7318, test_loss: 1.0337, test_f1: 0.6008
 epoch: 82, train_loss: 0.7513, test_loss: 1.0498, test_f1: 0.5970
 epoch: 83, train_loss: 0.7510, test_loss: 0.9956, test_f1: 0.6298
 epoch: 84, train_loss: 0.7379, test_loss: 0.9587, test_f1: 0.6045
 epoch: 85, train_loss: 0.7250, test_loss: 0.9680, test_f1: 0.6311
 epoch: 86, train_loss: 0.7278, test_loss: 0.9447, test_f1: 0.6212
 epoch: 87, train_loss: 0.7450, test_loss: 1.0581, test_f1: 0.5529
 epoch: 88, train_loss: 0.7293, test_loss: 1.0243, test_f1: 0.6507
 epoch: 89, train_loss: 0.7311, test_loss: 1.0104, test_f1: 0.6237
 epoch: 90, train_loss: 0.7218, test_loss: 1.0445, test_f1: 0.5953
 epoch: 91, train_loss: 0.7336, test_loss: 0.9576, test_f1: 0.6316
 epoch: 92, train_loss: 0.7402, test_loss: 1.0005, test_f1: 0.6455
 epoch: 93, train_loss: 0.7285, test_loss: 0.9807, test_f1: 0.5918
 epoch: 94, train_loss: 0.7158, test_loss: 0.9694, test_f1: 0.6204
 epoch: 95, train_loss: 0.7152, test_loss: 0.9797, test_f1: 0.6054
 epoch: 96, train_loss: 0.7111, test_loss: 1.0211, test_f1: 0.5980
 epoch: 97, train_loss: 0.7268, test_loss: 1.0142, test_f1: 0.6291
 epoch: 98, train_loss: 0.7211, test_loss: 1.0605, test_f1: 0.6381
 epoch: 99, train_loss: 0.7231, test_loss: 0.9972, test_f1: 0.6396
##################ITERATION #8 ****************************************
 epoch: 0, train_loss: 1.2237, test_loss: 1.0919, test_f1: 0.4196
 epoch: 1, train_loss: 1.0624, test_loss: 1.0848, test_f1: 0.4302
 epoch: 2, train_loss: 1.0206, test_loss: 1.0828, test_f1: 0.4366
 epoch: 3, train_loss: 1.0081, test_loss: 0.9620, test_f1: 0.4747
 epoch: 4, train_loss: 0.9879, test_loss: 1.0301, test_f1: 0.4453
 epoch: 5, train_loss: 0.9848, test_loss: 1.0277, test_f1: 0.4840
 epoch: 6, train_loss: 0.9769, test_loss: 0.9840, test_f1: 0.5364
 epoch: 7, train_loss: 0.9751, test_loss: 1.0030, test_f1: 0.5055
 epoch: 8, train_loss: 0.9618, test_loss: 0.9224, test_f1: 0.5050
 epoch: 9, train_loss: 0.9583, test_loss: 0.9841, test_f1: 0.4917
 epoch: 10, train_loss: 0.9491, test_loss: 0.9280, test_f1: 0.5344
 epoch: 11, train_loss: 0.9221, test_loss: 1.0192, test_f1: 0.4877
 epoch: 12, train_loss: 0.9286, test_loss: 0.9919, test_f1: 0.5052
 epoch: 13, train_loss: 0.9274, test_loss: 0.9236, test_f1: 0.4927
 epoch: 14, train_loss: 0.9116, test_loss: 0.9101, test_f1: 0.5027
 epoch: 15, train_loss: 0.9061, test_loss: 0.9589, test_f1: 0.4963
 epoch: 16, train_loss: 0.8974, test_loss: 0.9287, test_f1: 0.4782
 epoch: 17, train_loss: 0.9108, test_loss: 1.0436, test_f1: 0.4450
 epoch: 18, train_loss: 0.9181, test_loss: 0.9354, test_f1: 0.5222
 epoch: 19, train_loss: 0.9071, test_loss: 0.9304, test_f1: 0.5368
 epoch: 20, train_loss: 0.8986, test_loss: 0.9198, test_f1: 0.5375
 epoch: 21, train_loss: 0.8770, test_loss: 0.9610, test_f1: 0.5452
 epoch: 22, train_loss: 0.8822, test_loss: 0.9308, test_f1: 0.5360
 epoch: 23, train_loss: 0.8856, test_loss: 0.9633, test_f1: 0.5307
 epoch: 24, train_loss: 0.8844, test_loss: 0.9424, test_f1: 0.5584
 epoch: 25, train_loss: 0.8670, test_loss: 0.9251, test_f1: 0.5389
 epoch: 26, train_loss: 0.8689, test_loss: 1.0089, test_f1: 0.5140
 epoch: 27, train_loss: 0.8786, test_loss: 0.9591, test_f1: 0.5171
 epoch: 28, train_loss: 0.8734, test_loss: 0.9165, test_f1: 0.5584
 epoch: 29, train_loss: 0.8514, test_loss: 0.9290, test_f1: 0.5438
 epoch: 30, train_loss: 0.8586, test_loss: 0.9005, test_f1: 0.5490
 epoch: 31, train_loss: 0.8366, test_loss: 0.9205, test_f1: 0.5408
 epoch: 32, train_loss: 0.8572, test_loss: 0.9319, test_f1: 0.5632
 epoch: 33, train_loss: 0.8589, test_loss: 0.9874, test_f1: 0.5271
 epoch: 34, train_loss: 0.8429, test_loss: 0.9143, test_f1: 0.5552
 epoch: 35, train_loss: 0.8361, test_loss: 0.8839, test_f1: 0.5236
 epoch: 36, train_loss: 0.8374, test_loss: 0.9310, test_f1: 0.5565
 epoch: 37, train_loss: 0.8413, test_loss: 0.8970, test_f1: 0.5901
 epoch: 38, train_loss: 0.8336, test_loss: 0.9366, test_f1: 0.5766
 epoch: 39, train_loss: 0.8286, test_loss: 0.9042, test_f1: 0.6114
 epoch: 40, train_loss: 0.8195, test_loss: 0.8934, test_f1: 0.5852
 epoch: 41, train_loss: 0.8369, test_loss: 0.9568, test_f1: 0.5044
 epoch: 42, train_loss: 0.8223, test_loss: 0.8809, test_f1: 0.5693
 epoch: 43, train_loss: 0.8156, test_loss: 0.8230, test_f1: 0.5618
 epoch: 44, train_loss: 0.8138, test_loss: 0.9740, test_f1: 0.4967
 epoch: 45, train_loss: 0.8154, test_loss: 0.9049, test_f1: 0.5506
 epoch: 46, train_loss: 0.8180, test_loss: 0.8683, test_f1: 0.5444
 epoch: 47, train_loss: 0.8118, test_loss: 0.9019, test_f1: 0.5530
 epoch: 48, train_loss: 0.8334, test_loss: 0.8507, test_f1: 0.6223
 epoch: 49, train_loss: 0.8120, test_loss: 0.8473, test_f1: 0.5680
 epoch: 50, train_loss: 0.8191, test_loss: 0.8985, test_f1: 0.5939
 epoch: 51, train_loss: 0.7898, test_loss: 0.8365, test_f1: 0.6157
 epoch: 52, train_loss: 0.7804, test_loss: 0.8398, test_f1: 0.6481
 epoch: 53, train_loss: 0.7893, test_loss: 0.8563, test_f1: 0.5651
 epoch: 54, train_loss: 0.7870, test_loss: 0.8244, test_f1: 0.6333
 epoch: 55, train_loss: 0.7713, test_loss: 0.8616, test_f1: 0.5979
 epoch: 56, train_loss: 0.7641, test_loss: 0.8694, test_f1: 0.6081
 epoch: 57, train_loss: 0.7692, test_loss: 0.8287, test_f1: 0.6241
 epoch: 58, train_loss: 0.7615, test_loss: 0.8307, test_f1: 0.6217
 epoch: 59, train_loss: 0.7630, test_loss: 0.8511, test_f1: 0.5935
 epoch: 60, train_loss: 0.7495, test_loss: 0.8373, test_f1: 0.6270
 epoch: 61, train_loss: 0.7564, test_loss: 0.7926, test_f1: 0.6279
 epoch: 62, train_loss: 0.7586, test_loss: 0.8206, test_f1: 0.6110
 epoch: 63, train_loss: 0.7671, test_loss: 0.8549, test_f1: 0.6261
 epoch: 64, train_loss: 0.7649, test_loss: 0.8154, test_f1: 0.6258
 epoch: 65, train_loss: 0.7619, test_loss: 0.8604, test_f1: 0.6107
 epoch: 66, train_loss: 0.7576, test_loss: 0.8553, test_f1: 0.5871
 epoch: 67, train_loss: 0.7465, test_loss: 0.8557, test_f1: 0.5994
 epoch: 68, train_loss: 0.7538, test_loss: 0.8532, test_f1: 0.6114
 epoch: 69, train_loss: 0.7457, test_loss: 0.8490, test_f1: 0.6108
 epoch: 70, train_loss: 0.7541, test_loss: 0.8504, test_f1: 0.6189
 epoch: 71, train_loss: 0.7457, test_loss: 0.8665, test_f1: 0.5748
 epoch: 72, train_loss: 0.7551, test_loss: 0.8407, test_f1: 0.6245
 epoch: 73, train_loss: 0.7420, test_loss: 0.8561, test_f1: 0.6232
 epoch: 74, train_loss: 0.7521, test_loss: 0.8603, test_f1: 0.6088
 epoch: 75, train_loss: 0.7439, test_loss: 0.8265, test_f1: 0.6284
 epoch: 76, train_loss: 0.7361, test_loss: 0.8369, test_f1: 0.6311
 epoch: 77, train_loss: 0.7459, test_loss: 0.8289, test_f1: 0.6325
 epoch: 78, train_loss: 0.7511, test_loss: 0.8718, test_f1: 0.6138
 epoch: 79, train_loss: 0.7556, test_loss: 0.8363, test_f1: 0.6264
 epoch: 80, train_loss: 0.7516, test_loss: 0.8496, test_f1: 0.6196
 epoch: 81, train_loss: 0.7365, test_loss: 0.8542, test_f1: 0.6243
 epoch: 82, train_loss: 0.7405, test_loss: 0.8344, test_f1: 0.6572
 epoch: 83, train_loss: 0.7338, test_loss: 0.8380, test_f1: 0.6313
 epoch: 84, train_loss: 0.7397, test_loss: 0.8527, test_f1: 0.6449
 epoch: 85, train_loss: 0.7404, test_loss: 0.8423, test_f1: 0.6585
 epoch: 86, train_loss: 0.7390, test_loss: 0.8352, test_f1: 0.6330
 epoch: 87, train_loss: 0.7331, test_loss: 0.8259, test_f1: 0.6344
 epoch: 88, train_loss: 0.7320, test_loss: 0.8492, test_f1: 0.6513
 epoch: 89, train_loss: 0.7272, test_loss: 0.8467, test_f1: 0.6221
 epoch: 90, train_loss: 0.7416, test_loss: 0.8366, test_f1: 0.6335
 epoch: 91, train_loss: 0.7240, test_loss: 0.8096, test_f1: 0.6704
 epoch: 92, train_loss: 0.7254, test_loss: 0.8326, test_f1: 0.6568
 epoch: 93, train_loss: 0.7300, test_loss: 0.9078, test_f1: 0.6029
 epoch: 94, train_loss: 0.7414, test_loss: 0.9302, test_f1: 0.5833
 epoch: 95, train_loss: 0.7406, test_loss: 0.8530, test_f1: 0.6259
 epoch: 96, train_loss: 0.7261, test_loss: 0.8182, test_f1: 0.6239
 epoch: 97, train_loss: 0.7213, test_loss: 0.8327, test_f1: 0.5991
 epoch: 98, train_loss: 0.7396, test_loss: 0.8548, test_f1: 0.6255
 epoch: 99, train_loss: 0.7287, test_loss: 0.8021, test_f1: 0.6354
##################ITERATION #9 ****************************************
 epoch: 0, train_loss: 1.2519, test_loss: 1.2753, test_f1: 0.2642
 epoch: 1, train_loss: 1.0816, test_loss: 0.9991, test_f1: 0.4625
 epoch: 2, train_loss: 1.0288, test_loss: 1.0055, test_f1: 0.4745
 epoch: 3, train_loss: 0.9973, test_loss: 0.9890, test_f1: 0.4625
 epoch: 4, train_loss: 0.9870, test_loss: 0.9726, test_f1: 0.4734
 epoch: 5, train_loss: 0.9820, test_loss: 1.0268, test_f1: 0.4850
 epoch: 6, train_loss: 0.9730, test_loss: 0.9228, test_f1: 0.5113
 epoch: 7, train_loss: 0.9783, test_loss: 0.9522, test_f1: 0.4992
 epoch: 8, train_loss: 0.9520, test_loss: 0.9580, test_f1: 0.4752
 epoch: 9, train_loss: 0.9451, test_loss: 0.9829, test_f1: 0.4684
 epoch: 10, train_loss: 0.9388, test_loss: 0.9697, test_f1: 0.4876
 epoch: 11, train_loss: 0.9426, test_loss: 0.9454, test_f1: 0.4765
 epoch: 12, train_loss: 0.9341, test_loss: 0.9673, test_f1: 0.5117
 epoch: 13, train_loss: 0.9388, test_loss: 0.9205, test_f1: 0.4963
 epoch: 14, train_loss: 0.9307, test_loss: 0.9941, test_f1: 0.4538
 epoch: 15, train_loss: 0.9157, test_loss: 0.9382, test_f1: 0.5206
 epoch: 16, train_loss: 0.9217, test_loss: 0.9564, test_f1: 0.4756
 epoch: 17, train_loss: 0.9110, test_loss: 1.0035, test_f1: 0.5233
 epoch: 18, train_loss: 0.9121, test_loss: 1.0559, test_f1: 0.4628
 epoch: 19, train_loss: 0.9071, test_loss: 0.8912, test_f1: 0.5555
 epoch: 20, train_loss: 0.9089, test_loss: 0.9836, test_f1: 0.5100
 epoch: 21, train_loss: 0.9060, test_loss: 0.9704, test_f1: 0.5356
 epoch: 22, train_loss: 0.8997, test_loss: 0.9732, test_f1: 0.5119
 epoch: 23, train_loss: 0.8869, test_loss: 0.9857, test_f1: 0.4997
 epoch: 24, train_loss: 0.9039, test_loss: 0.9676, test_f1: 0.5484
 epoch: 25, train_loss: 0.8957, test_loss: 0.9118, test_f1: 0.5255
 epoch: 26, train_loss: 0.8834, test_loss: 0.9594, test_f1: 0.4981
 epoch: 27, train_loss: 0.8773, test_loss: 0.9383, test_f1: 0.5306
 epoch: 28, train_loss: 0.8697, test_loss: 0.9975, test_f1: 0.5745
 epoch: 29, train_loss: 0.8799, test_loss: 1.0432, test_f1: 0.4722
 epoch: 30, train_loss: 0.8738, test_loss: 1.0017, test_f1: 0.4900
 epoch: 31, train_loss: 0.8721, test_loss: 0.9557, test_f1: 0.4971
 epoch: 32, train_loss: 0.8675, test_loss: 0.9875, test_f1: 0.4848
 epoch: 33, train_loss: 0.8610, test_loss: 1.0835, test_f1: 0.5256
 epoch: 34, train_loss: 0.8704, test_loss: 0.9857, test_f1: 0.4838
 epoch: 35, train_loss: 0.8536, test_loss: 0.9991, test_f1: 0.5549
 epoch: 36, train_loss: 0.8684, test_loss: 1.2735, test_f1: 0.4477
 epoch: 37, train_loss: 0.8809, test_loss: 0.9514, test_f1: 0.5030
 epoch: 38, train_loss: 0.8619, test_loss: 1.0493, test_f1: 0.4706
 epoch: 39, train_loss: 0.8613, test_loss: 0.9591, test_f1: 0.4940
 epoch: 40, train_loss: 0.8500, test_loss: 0.9684, test_f1: 0.5145
 epoch: 41, train_loss: 0.8553, test_loss: 0.9711, test_f1: 0.5326
 epoch: 42, train_loss: 0.8435, test_loss: 0.9227, test_f1: 0.5650
 epoch: 43, train_loss: 0.8477, test_loss: 0.9579, test_f1: 0.5680
 epoch: 44, train_loss: 0.8489, test_loss: 0.9096, test_f1: 0.5475
 epoch: 45, train_loss: 0.8543, test_loss: 0.9953, test_f1: 0.5039
 epoch: 46, train_loss: 0.8466, test_loss: 1.0660, test_f1: 0.5389
 epoch: 47, train_loss: 0.8376, test_loss: 1.0421, test_f1: 0.4975
 epoch: 48, train_loss: 0.8552, test_loss: 0.9662, test_f1: 0.4893
 epoch: 49, train_loss: 0.8421, test_loss: 0.9744, test_f1: 0.5344
 epoch: 50, train_loss: 0.8365, test_loss: 0.9285, test_f1: 0.5624
 epoch: 51, train_loss: 0.8194, test_loss: 0.9287, test_f1: 0.5736
 epoch: 52, train_loss: 0.8165, test_loss: 0.9179, test_f1: 0.5851
 epoch: 53, train_loss: 0.8140, test_loss: 0.9089, test_f1: 0.5330
 epoch: 54, train_loss: 0.8082, test_loss: 0.9572, test_f1: 0.5464
 epoch: 55, train_loss: 0.7958, test_loss: 0.9985, test_f1: 0.5563
 epoch: 56, train_loss: 0.8085, test_loss: 0.9513, test_f1: 0.5301
 epoch: 57, train_loss: 0.8057, test_loss: 0.9577, test_f1: 0.5358
 epoch: 58, train_loss: 0.7762, test_loss: 0.9648, test_f1: 0.5495
 epoch: 59, train_loss: 0.8071, test_loss: 0.9521, test_f1: 0.5296
 epoch: 60, train_loss: 0.7993, test_loss: 0.9511, test_f1: 0.5448
 epoch: 61, train_loss: 0.7886, test_loss: 0.9461, test_f1: 0.5426
 epoch: 62, train_loss: 0.7887, test_loss: 0.9552, test_f1: 0.5516
 epoch: 63, train_loss: 0.7966, test_loss: 1.0301, test_f1: 0.5025
 epoch: 64, train_loss: 0.7955, test_loss: 0.9618, test_f1: 0.5630
 epoch: 65, train_loss: 0.7928, test_loss: 0.9690, test_f1: 0.5594
 epoch: 66, train_loss: 0.8013, test_loss: 0.9798, test_f1: 0.5829
 epoch: 67, train_loss: 0.7876, test_loss: 0.9708, test_f1: 0.5553
 epoch: 68, train_loss: 0.7980, test_loss: 0.9675, test_f1: 0.5266
 epoch: 69, train_loss: 0.8053, test_loss: 0.9591, test_f1: 0.5649
 epoch: 70, train_loss: 0.7840, test_loss: 0.9795, test_f1: 0.5588
 epoch: 71, train_loss: 0.7808, test_loss: 0.9065, test_f1: 0.5588
 epoch: 72, train_loss: 0.7833, test_loss: 0.9502, test_f1: 0.5519
 epoch: 73, train_loss: 0.7823, test_loss: 0.9558, test_f1: 0.5384
 epoch: 74, train_loss: 0.7727, test_loss: 1.0070, test_f1: 0.5057
 epoch: 75, train_loss: 0.7896, test_loss: 0.9588, test_f1: 0.5391
 epoch: 76, train_loss: 0.7852, test_loss: 0.9537, test_f1: 0.5595
 epoch: 77, train_loss: 0.7842, test_loss: 0.9324, test_f1: 0.5744
 epoch: 78, train_loss: 0.7745, test_loss: 0.9986, test_f1: 0.5333
 epoch: 79, train_loss: 0.7742, test_loss: 0.9226, test_f1: 0.5729
 epoch: 80, train_loss: 0.7827, test_loss: 1.0026, test_f1: 0.5591
 epoch: 81, train_loss: 0.7807, test_loss: 0.9638, test_f1: 0.5816
 epoch: 82, train_loss: 0.7852, test_loss: 0.9203, test_f1: 0.5854
 epoch: 83, train_loss: 0.7799, test_loss: 0.9296, test_f1: 0.6017
 epoch: 84, train_loss: 0.7879, test_loss: 0.9346, test_f1: 0.5532
 epoch: 85, train_loss: 0.7677, test_loss: 0.9682, test_f1: 0.5620
 epoch: 86, train_loss: 0.7684, test_loss: 0.9463, test_f1: 0.5749
 epoch: 87, train_loss: 0.7724, test_loss: 0.9252, test_f1: 0.5670
 epoch: 88, train_loss: 0.7754, test_loss: 0.9376, test_f1: 0.5939
 epoch: 89, train_loss: 0.7662, test_loss: 0.9653, test_f1: 0.5879
 epoch: 90, train_loss: 0.7691, test_loss: 0.9420, test_f1: 0.5801
 epoch: 91, train_loss: 0.7769, test_loss: 0.9988, test_f1: 0.5106
 epoch: 92, train_loss: 0.7824, test_loss: 0.9344, test_f1: 0.5952
 epoch: 93, train_loss: 0.7634, test_loss: 0.9780, test_f1: 0.5761
 epoch: 94, train_loss: 0.7557, test_loss: 0.9495, test_f1: 0.5862
 epoch: 95, train_loss: 0.7754, test_loss: 0.9387, test_f1: 0.6055
 epoch: 96, train_loss: 0.7609, test_loss: 0.9325, test_f1: 0.5683
 epoch: 97, train_loss: 0.7782, test_loss: 0.9136, test_f1: 0.6068
 epoch: 98, train_loss: 0.7573, test_loss: 0.9433, test_f1: 0.5865
 epoch: 99, train_loss: 0.7623, test_loss: 0.9971, test_f1: 0.5273

Training completed in 668.71 seconds
Best F1: 0.6704 at epoch 91
Mean F1 across iterations: 0.6227  0.0280
========================FINAL RESULTS================================
FEGIN weighted F1: 0.6704  0.0280
python main.py --data ltspice_examples --representation component_net --model FEGIN --layers 4 --hiddens 16 --batch_size 64 --lr 0.01 --emb_size 250 --epochs 100 --save_appendix component_net_L4_H16_BS64_LR0.01_E250 --no_val
-----



STDERR:
  File "main.py", line 370, in <module>
    main()
  File "main.py", line 254, in main
    dataset = dataset_class(
  File "/home/philip/projects/ltspice_examples_code_repo/Circuit-Completion-Using-GNNs/component_classification_with_link_prediction_head/evaluation/FEGIN/kernel/circuit_datasets.py", line 15, in __init__
    self.data, self.slices = torch.load(self.processed_paths[0])
  File "/home/philip/.local/lib/python3.8/site-packages/torch/serialization.py", line 1040, in load
    warnings.warn(
  File "/usr/lib/python3.8/warnings.py", line 109, in _showwarnmsg
    sw(msg.message, msg.category, msg.filename, msg.lineno,
  File "main.py", line 47, in warn_with_traceback
    traceback.print_stack(file=log)
/home/philip/projects/ltspice_examples_code_repo/Circuit-Completion-Using-GNNs/component_classification_with_link_prediction_head/evaluation/FEGIN/kernel/circuit_datasets.py:15: FutureWarning: You are using `torch.load` with `weights_only=False` (the current default value), which uses the default pickle module implicitly. It is possible to construct malicious pickle data which will execute arbitrary code during unpickling (See https://github.com/pytorch/pytorch/blob/main/SECURITY.md#untrusted-models for more details). In a future release, the default value for `weights_only` will be flipped to `True`. This limits the functions that could be executed during unpickling. Arbitrary objects will no longer be allowed to be loaded via this mode unless they are explicitly allowlisted by the user via `torch.serialization.add_safe_globals`. We recommend you start setting `weights_only=True` for any use case where you don't have full control of the loaded file. Please open an issue on GitHub for any issues related to this experimental feature.
  self.data, self.slices = torch.load(self.processed_paths[0])
