STDOUT:
Results will be saved in /home/philip/projects/ltspice_examples_code_repo/Circuit-Completion-Using-GNNs/component_classification_with_link_prediction_head/evaluation/FEGIN/results/model_FEGIN_dataset_ltspice_examples
Command line input: python main.py --data ltspice_examples --representation component_net --model FEGIN --layers 2 --hiddens 128 --batch_size 64 --lr 0.0001 --emb_size 128 --epochs 100 --save_appendix component_net_L2_H128_BS64_LR0.0001_E128 --no_val
 is saved.
-----
ltspice_examples - FEGIN
Using 2 layers, 128 hidden units, h = 2
Loading component_net representation dataset
ENTERED
Training FEGIN on component_net representation
Train: 3558, Test: 846
##################ITERATION #0 ****************************************
 epoch: 0, train_loss: 1.3556, test_loss: 1.3346, test_f1: 0.2270
 epoch: 1, train_loss: 1.2908, test_loss: 1.2710, test_f1: 0.2270
 epoch: 2, train_loss: 1.2497, test_loss: 1.2256, test_f1: 0.2611
 epoch: 3, train_loss: 1.2116, test_loss: 1.1776, test_f1: 0.2996
 epoch: 4, train_loss: 1.1704, test_loss: 1.1219, test_f1: 0.3765
 epoch: 5, train_loss: 1.1245, test_loss: 1.0702, test_f1: 0.4334
 epoch: 6, train_loss: 1.0718, test_loss: 1.0308, test_f1: 0.4439
 epoch: 7, train_loss: 1.0282, test_loss: 0.9944, test_f1: 0.4587
 epoch: 8, train_loss: 0.9980, test_loss: 0.9709, test_f1: 0.4673
 epoch: 9, train_loss: 0.9764, test_loss: 0.9587, test_f1: 0.4821
 epoch: 10, train_loss: 0.9603, test_loss: 0.9459, test_f1: 0.4761
 epoch: 11, train_loss: 0.9481, test_loss: 0.9389, test_f1: 0.5029
 epoch: 12, train_loss: 0.9358, test_loss: 0.9271, test_f1: 0.4863
 epoch: 13, train_loss: 0.9258, test_loss: 0.9269, test_f1: 0.5005
 epoch: 14, train_loss: 0.9192, test_loss: 0.9344, test_f1: 0.4971
 epoch: 15, train_loss: 0.9162, test_loss: 0.9364, test_f1: 0.5114
 epoch: 16, train_loss: 0.9006, test_loss: 0.9254, test_f1: 0.5125
 epoch: 17, train_loss: 0.8992, test_loss: 0.9298, test_f1: 0.5146
 epoch: 18, train_loss: 0.8901, test_loss: 0.9221, test_f1: 0.5227
 epoch: 19, train_loss: 0.8894, test_loss: 0.9138, test_f1: 0.5312
 epoch: 20, train_loss: 0.8709, test_loss: 0.9202, test_f1: 0.5127
 epoch: 21, train_loss: 0.8701, test_loss: 0.9047, test_f1: 0.5312
 epoch: 22, train_loss: 0.8539, test_loss: 0.8966, test_f1: 0.5317
 epoch: 23, train_loss: 0.8535, test_loss: 0.8838, test_f1: 0.5351
 epoch: 24, train_loss: 0.8521, test_loss: 0.9264, test_f1: 0.5198
 epoch: 25, train_loss: 0.8376, test_loss: 0.8932, test_f1: 0.5358
 epoch: 26, train_loss: 0.8287, test_loss: 0.8913, test_f1: 0.5264
 epoch: 27, train_loss: 0.8306, test_loss: 0.9060, test_f1: 0.5250
 epoch: 28, train_loss: 0.8296, test_loss: 0.8925, test_f1: 0.5301
 epoch: 29, train_loss: 0.8173, test_loss: 0.9490, test_f1: 0.5326
 epoch: 30, train_loss: 0.8105, test_loss: 0.9205, test_f1: 0.5288
 epoch: 31, train_loss: 0.8060, test_loss: 0.9086, test_f1: 0.5387
 epoch: 32, train_loss: 0.7974, test_loss: 0.9362, test_f1: 0.5198
 epoch: 33, train_loss: 0.7934, test_loss: 0.9094, test_f1: 0.5373
 epoch: 34, train_loss: 0.7915, test_loss: 0.8737, test_f1: 0.5505
 epoch: 35, train_loss: 0.7934, test_loss: 0.9138, test_f1: 0.5359
 epoch: 36, train_loss: 0.7848, test_loss: 0.9402, test_f1: 0.5392
 epoch: 37, train_loss: 0.7849, test_loss: 0.9176, test_f1: 0.5460
 epoch: 38, train_loss: 0.7685, test_loss: 0.9624, test_f1: 0.5299
 epoch: 39, train_loss: 0.7756, test_loss: 0.9185, test_f1: 0.5507
 epoch: 40, train_loss: 0.7651, test_loss: 0.9365, test_f1: 0.5419
 epoch: 41, train_loss: 0.7611, test_loss: 0.9270, test_f1: 0.5431
 epoch: 42, train_loss: 0.7588, test_loss: 0.9404, test_f1: 0.5365
 epoch: 43, train_loss: 0.7584, test_loss: 0.9164, test_f1: 0.5452
 epoch: 44, train_loss: 0.7499, test_loss: 0.9396, test_f1: 0.5242
 epoch: 45, train_loss: 0.7483, test_loss: 0.9123, test_f1: 0.5588
 epoch: 46, train_loss: 0.7387, test_loss: 0.9533, test_f1: 0.5329
 epoch: 47, train_loss: 0.7391, test_loss: 0.9051, test_f1: 0.5794
 epoch: 48, train_loss: 0.7405, test_loss: 0.9219, test_f1: 0.5540
 epoch: 49, train_loss: 0.7383, test_loss: 0.9151, test_f1: 0.5626
 epoch: 50, train_loss: 0.7223, test_loss: 0.9048, test_f1: 0.5822
 epoch: 51, train_loss: 0.7176, test_loss: 0.9000, test_f1: 0.5863
 epoch: 52, train_loss: 0.7153, test_loss: 0.9135, test_f1: 0.5717
 epoch: 53, train_loss: 0.7071, test_loss: 0.9186, test_f1: 0.5837
 epoch: 54, train_loss: 0.7025, test_loss: 0.9283, test_f1: 0.5729
 epoch: 55, train_loss: 0.7114, test_loss: 0.9102, test_f1: 0.5752
 epoch: 56, train_loss: 0.6973, test_loss: 0.9094, test_f1: 0.5878
 epoch: 57, train_loss: 0.7073, test_loss: 0.9131, test_f1: 0.5803
 epoch: 58, train_loss: 0.6940, test_loss: 0.9169, test_f1: 0.5963
 epoch: 59, train_loss: 0.7028, test_loss: 0.9301, test_f1: 0.5690
 epoch: 60, train_loss: 0.7050, test_loss: 0.9388, test_f1: 0.5817
 epoch: 61, train_loss: 0.6979, test_loss: 0.9257, test_f1: 0.5848
 epoch: 62, train_loss: 0.6849, test_loss: 0.9313, test_f1: 0.5852
 epoch: 63, train_loss: 0.6942, test_loss: 0.9351, test_f1: 0.5882
 epoch: 64, train_loss: 0.6857, test_loss: 0.9202, test_f1: 0.5876
 epoch: 65, train_loss: 0.6841, test_loss: 0.9256, test_f1: 0.5871
 epoch: 66, train_loss: 0.6774, test_loss: 0.9432, test_f1: 0.6004
 epoch: 67, train_loss: 0.6792, test_loss: 0.9176, test_f1: 0.6024
 epoch: 68, train_loss: 0.6767, test_loss: 0.9485, test_f1: 0.5915
 epoch: 69, train_loss: 0.6787, test_loss: 0.9281, test_f1: 0.5942
 epoch: 70, train_loss: 0.6637, test_loss: 0.9304, test_f1: 0.5989
 epoch: 71, train_loss: 0.6723, test_loss: 0.9269, test_f1: 0.5876
 epoch: 72, train_loss: 0.6737, test_loss: 0.9367, test_f1: 0.5983
 epoch: 73, train_loss: 0.6817, test_loss: 0.9188, test_f1: 0.6051
 epoch: 74, train_loss: 0.6630, test_loss: 0.9235, test_f1: 0.5922
 epoch: 75, train_loss: 0.6694, test_loss: 0.9434, test_f1: 0.6157
 epoch: 76, train_loss: 0.6669, test_loss: 0.9295, test_f1: 0.6186
 epoch: 77, train_loss: 0.6718, test_loss: 0.9497, test_f1: 0.6057
 epoch: 78, train_loss: 0.6578, test_loss: 0.9471, test_f1: 0.5927
 epoch: 79, train_loss: 0.6571, test_loss: 0.9472, test_f1: 0.6043
 epoch: 80, train_loss: 0.6705, test_loss: 0.9450, test_f1: 0.6059
 epoch: 81, train_loss: 0.6600, test_loss: 0.9276, test_f1: 0.6195
 epoch: 82, train_loss: 0.6509, test_loss: 0.9454, test_f1: 0.6250
 epoch: 83, train_loss: 0.6587, test_loss: 0.9197, test_f1: 0.6176
 epoch: 84, train_loss: 0.6564, test_loss: 0.9177, test_f1: 0.6061
 epoch: 85, train_loss: 0.6425, test_loss: 0.9310, test_f1: 0.6172
 epoch: 86, train_loss: 0.6530, test_loss: 0.9345, test_f1: 0.6255
 epoch: 87, train_loss: 0.6457, test_loss: 0.9279, test_f1: 0.6163
 epoch: 88, train_loss: 0.6527, test_loss: 0.9442, test_f1: 0.6146
 epoch: 89, train_loss: 0.6487, test_loss: 0.9526, test_f1: 0.6173
 epoch: 90, train_loss: 0.6479, test_loss: 0.9382, test_f1: 0.6281
 epoch: 91, train_loss: 0.6277, test_loss: 0.9435, test_f1: 0.6293
 epoch: 92, train_loss: 0.6538, test_loss: 0.9558, test_f1: 0.6230
 epoch: 93, train_loss: 0.6478, test_loss: 0.9466, test_f1: 0.6340
 epoch: 94, train_loss: 0.6381, test_loss: 0.9480, test_f1: 0.6146
 epoch: 95, train_loss: 0.6392, test_loss: 0.9333, test_f1: 0.6328
 epoch: 96, train_loss: 0.6458, test_loss: 0.9361, test_f1: 0.6106
 epoch: 97, train_loss: 0.6410, test_loss: 0.9526, test_f1: 0.6333
 epoch: 98, train_loss: 0.6233, test_loss: 0.9597, test_f1: 0.6154
 epoch: 99, train_loss: 0.6207, test_loss: 0.9533, test_f1: 0.6149
##################ITERATION #1 ****************************************
 epoch: 0, train_loss: 1.2717, test_loss: 1.2302, test_f1: 0.2651
 epoch: 1, train_loss: 1.1719, test_loss: 1.1220, test_f1: 0.4106
 epoch: 2, train_loss: 1.1197, test_loss: 1.0632, test_f1: 0.4374
 epoch: 3, train_loss: 1.0714, test_loss: 1.0154, test_f1: 0.4843
 epoch: 4, train_loss: 1.0294, test_loss: 0.9776, test_f1: 0.4895
 epoch: 5, train_loss: 1.0030, test_loss: 0.9517, test_f1: 0.4909
 epoch: 6, train_loss: 0.9616, test_loss: 0.9522, test_f1: 0.4938
 epoch: 7, train_loss: 0.9544, test_loss: 0.9395, test_f1: 0.4986
 epoch: 8, train_loss: 0.9378, test_loss: 0.9219, test_f1: 0.5089
 epoch: 9, train_loss: 0.9326, test_loss: 0.9169, test_f1: 0.5038
 epoch: 10, train_loss: 0.9122, test_loss: 0.9005, test_f1: 0.5336
 epoch: 11, train_loss: 0.9014, test_loss: 0.8731, test_f1: 0.5343
 epoch: 12, train_loss: 0.8965, test_loss: 0.8868, test_f1: 0.5477
 epoch: 13, train_loss: 0.8834, test_loss: 0.8890, test_f1: 0.5406
 epoch: 14, train_loss: 0.8802, test_loss: 0.8768, test_f1: 0.5370
 epoch: 15, train_loss: 0.8689, test_loss: 0.9048, test_f1: 0.5289
 epoch: 16, train_loss: 0.8702, test_loss: 0.8901, test_f1: 0.5432
 epoch: 17, train_loss: 0.8560, test_loss: 0.8618, test_f1: 0.5410
 epoch: 18, train_loss: 0.8490, test_loss: 0.8818, test_f1: 0.5342
 epoch: 19, train_loss: 0.8422, test_loss: 0.8633, test_f1: 0.5370
 epoch: 20, train_loss: 0.8374, test_loss: 0.8548, test_f1: 0.5402
 epoch: 21, train_loss: 0.8397, test_loss: 0.8567, test_f1: 0.5552
 epoch: 22, train_loss: 0.8264, test_loss: 0.8794, test_f1: 0.5656
 epoch: 23, train_loss: 0.8260, test_loss: 0.8545, test_f1: 0.5483
 epoch: 24, train_loss: 0.8147, test_loss: 0.8569, test_f1: 0.5547
 epoch: 25, train_loss: 0.8105, test_loss: 0.8831, test_f1: 0.5482
 epoch: 26, train_loss: 0.8035, test_loss: 0.8713, test_f1: 0.5536
 epoch: 27, train_loss: 0.8040, test_loss: 0.8809, test_f1: 0.5441
 epoch: 28, train_loss: 0.8023, test_loss: 0.8576, test_f1: 0.5518
 epoch: 29, train_loss: 0.7948, test_loss: 0.8779, test_f1: 0.5337
 epoch: 30, train_loss: 0.7844, test_loss: 0.8692, test_f1: 0.5472
 epoch: 31, train_loss: 0.7837, test_loss: 0.8734, test_f1: 0.5514
 epoch: 32, train_loss: 0.7822, test_loss: 0.8677, test_f1: 0.5351
 epoch: 33, train_loss: 0.7739, test_loss: 0.8713, test_f1: 0.5625
 epoch: 34, train_loss: 0.7593, test_loss: 0.8932, test_f1: 0.5510
 epoch: 35, train_loss: 0.7593, test_loss: 0.8836, test_f1: 0.5530
 epoch: 36, train_loss: 0.7595, test_loss: 0.8685, test_f1: 0.5732
 epoch: 37, train_loss: 0.7446, test_loss: 0.8844, test_f1: 0.5739
 epoch: 38, train_loss: 0.7533, test_loss: 0.8867, test_f1: 0.5623
 epoch: 39, train_loss: 0.7428, test_loss: 0.8711, test_f1: 0.5759
 epoch: 40, train_loss: 0.7313, test_loss: 0.8746, test_f1: 0.5792
 epoch: 41, train_loss: 0.7335, test_loss: 0.8982, test_f1: 0.5566
 epoch: 42, train_loss: 0.7401, test_loss: 0.8546, test_f1: 0.5594
 epoch: 43, train_loss: 0.7233, test_loss: 0.8913, test_f1: 0.5585
 epoch: 44, train_loss: 0.7099, test_loss: 0.8936, test_f1: 0.5730
 epoch: 45, train_loss: 0.7276, test_loss: 0.8973, test_f1: 0.6097
 epoch: 46, train_loss: 0.7203, test_loss: 0.8928, test_f1: 0.5724
 epoch: 47, train_loss: 0.7179, test_loss: 0.8826, test_f1: 0.5831
 epoch: 48, train_loss: 0.7135, test_loss: 0.8802, test_f1: 0.5867
 epoch: 49, train_loss: 0.7050, test_loss: 0.8915, test_f1: 0.5743
 epoch: 50, train_loss: 0.6997, test_loss: 0.8897, test_f1: 0.5895
 epoch: 51, train_loss: 0.6857, test_loss: 0.9041, test_f1: 0.5842
 epoch: 52, train_loss: 0.6806, test_loss: 0.8947, test_f1: 0.6079
 epoch: 53, train_loss: 0.6852, test_loss: 0.8906, test_f1: 0.6022
 epoch: 54, train_loss: 0.6757, test_loss: 0.9018, test_f1: 0.5987
 epoch: 55, train_loss: 0.6778, test_loss: 0.8968, test_f1: 0.5796
 epoch: 56, train_loss: 0.6687, test_loss: 0.8951, test_f1: 0.6054
 epoch: 57, train_loss: 0.6663, test_loss: 0.9210, test_f1: 0.5765
 epoch: 58, train_loss: 0.6607, test_loss: 0.8783, test_f1: 0.6009
 epoch: 59, train_loss: 0.6655, test_loss: 0.9312, test_f1: 0.6024
 epoch: 60, train_loss: 0.6602, test_loss: 0.8867, test_f1: 0.6014
 epoch: 61, train_loss: 0.6612, test_loss: 0.9195, test_f1: 0.5945
 epoch: 62, train_loss: 0.6547, test_loss: 0.9060, test_f1: 0.5876
 epoch: 63, train_loss: 0.6540, test_loss: 0.8973, test_f1: 0.6050
 epoch: 64, train_loss: 0.6574, test_loss: 0.8895, test_f1: 0.5956
 epoch: 65, train_loss: 0.6532, test_loss: 0.9090, test_f1: 0.5933
 epoch: 66, train_loss: 0.6485, test_loss: 0.9098, test_f1: 0.6103
 epoch: 67, train_loss: 0.6512, test_loss: 0.9019, test_f1: 0.5998
 epoch: 68, train_loss: 0.6414, test_loss: 0.9120, test_f1: 0.6166
 epoch: 69, train_loss: 0.6413, test_loss: 0.9142, test_f1: 0.6071
 epoch: 70, train_loss: 0.6319, test_loss: 0.9212, test_f1: 0.5891
 epoch: 71, train_loss: 0.6436, test_loss: 0.9204, test_f1: 0.6064
 epoch: 72, train_loss: 0.6289, test_loss: 0.9284, test_f1: 0.5900
 epoch: 73, train_loss: 0.6252, test_loss: 0.9126, test_f1: 0.6080
 epoch: 74, train_loss: 0.6351, test_loss: 0.9204, test_f1: 0.6199
 epoch: 75, train_loss: 0.6279, test_loss: 0.9104, test_f1: 0.6140
 epoch: 76, train_loss: 0.6315, test_loss: 0.9248, test_f1: 0.6294
 epoch: 77, train_loss: 0.6193, test_loss: 0.9192, test_f1: 0.6108
 epoch: 78, train_loss: 0.6241, test_loss: 0.9387, test_f1: 0.6119
 epoch: 79, train_loss: 0.6252, test_loss: 0.9141, test_f1: 0.6149
 epoch: 80, train_loss: 0.6221, test_loss: 0.9278, test_f1: 0.6120
 epoch: 81, train_loss: 0.6223, test_loss: 0.9155, test_f1: 0.6192
 epoch: 82, train_loss: 0.6305, test_loss: 0.9175, test_f1: 0.6292
 epoch: 83, train_loss: 0.6176, test_loss: 0.9302, test_f1: 0.6239
 epoch: 84, train_loss: 0.6163, test_loss: 0.9257, test_f1: 0.6149
 epoch: 85, train_loss: 0.6138, test_loss: 0.9447, test_f1: 0.6382
 epoch: 86, train_loss: 0.6204, test_loss: 0.9574, test_f1: 0.6190
 epoch: 87, train_loss: 0.6126, test_loss: 0.9321, test_f1: 0.6208
 epoch: 88, train_loss: 0.6071, test_loss: 0.9468, test_f1: 0.5986
 epoch: 89, train_loss: 0.6089, test_loss: 0.9359, test_f1: 0.6232
 epoch: 90, train_loss: 0.5985, test_loss: 0.9505, test_f1: 0.6205
 epoch: 91, train_loss: 0.6162, test_loss: 0.9457, test_f1: 0.6345
 epoch: 92, train_loss: 0.5909, test_loss: 0.9593, test_f1: 0.6240
 epoch: 93, train_loss: 0.5998, test_loss: 0.9283, test_f1: 0.6330
 epoch: 94, train_loss: 0.5985, test_loss: 0.9475, test_f1: 0.6206
 epoch: 95, train_loss: 0.5954, test_loss: 0.9703, test_f1: 0.6255
 epoch: 96, train_loss: 0.6023, test_loss: 0.9504, test_f1: 0.6087
 epoch: 97, train_loss: 0.5851, test_loss: 0.9387, test_f1: 0.6224
 epoch: 98, train_loss: 0.5829, test_loss: 0.9579, test_f1: 0.6363
 epoch: 99, train_loss: 0.5871, test_loss: 0.9471, test_f1: 0.6294
##################ITERATION #2 ****************************************
 epoch: 0, train_loss: 1.2299, test_loss: 1.1703, test_f1: 0.3512
 epoch: 1, train_loss: 1.1172, test_loss: 1.0588, test_f1: 0.4570
 epoch: 2, train_loss: 1.0644, test_loss: 1.0091, test_f1: 0.4586
 epoch: 3, train_loss: 1.0208, test_loss: 0.9833, test_f1: 0.4883
 epoch: 4, train_loss: 0.9967, test_loss: 0.9523, test_f1: 0.4774
 epoch: 5, train_loss: 0.9716, test_loss: 0.9464, test_f1: 0.5167
 epoch: 6, train_loss: 0.9459, test_loss: 0.9209, test_f1: 0.5246
 epoch: 7, train_loss: 0.9403, test_loss: 0.9144, test_f1: 0.5356
 epoch: 8, train_loss: 0.9246, test_loss: 0.9153, test_f1: 0.5322
 epoch: 9, train_loss: 0.9109, test_loss: 0.9087, test_f1: 0.5400
 epoch: 10, train_loss: 0.9035, test_loss: 0.8975, test_f1: 0.5544
 epoch: 11, train_loss: 0.8958, test_loss: 0.8919, test_f1: 0.5502
 epoch: 12, train_loss: 0.8825, test_loss: 0.8909, test_f1: 0.5386
 epoch: 13, train_loss: 0.8749, test_loss: 0.8890, test_f1: 0.5592
 epoch: 14, train_loss: 0.8648, test_loss: 0.8734, test_f1: 0.5556
 epoch: 15, train_loss: 0.8558, test_loss: 0.9053, test_f1: 0.5406
 epoch: 16, train_loss: 0.8481, test_loss: 0.8890, test_f1: 0.5516
 epoch: 17, train_loss: 0.8435, test_loss: 0.8789, test_f1: 0.5671
 epoch: 18, train_loss: 0.8430, test_loss: 0.8791, test_f1: 0.5673
 epoch: 19, train_loss: 0.8318, test_loss: 0.8887, test_f1: 0.5581
 epoch: 20, train_loss: 0.8276, test_loss: 0.8827, test_f1: 0.5657
 epoch: 21, train_loss: 0.8122, test_loss: 0.8879, test_f1: 0.5661
 epoch: 22, train_loss: 0.8115, test_loss: 0.8830, test_f1: 0.5471
 epoch: 23, train_loss: 0.8007, test_loss: 0.8755, test_f1: 0.5555
 epoch: 24, train_loss: 0.7975, test_loss: 0.8859, test_f1: 0.5450
 epoch: 25, train_loss: 0.7993, test_loss: 0.9032, test_f1: 0.5562
 epoch: 26, train_loss: 0.7893, test_loss: 0.8757, test_f1: 0.5851
 epoch: 27, train_loss: 0.7825, test_loss: 0.8997, test_f1: 0.5593
 epoch: 28, train_loss: 0.7801, test_loss: 0.9356, test_f1: 0.5490
 epoch: 29, train_loss: 0.7707, test_loss: 0.9048, test_f1: 0.5508
 epoch: 30, train_loss: 0.7729, test_loss: 0.8992, test_f1: 0.5624
 epoch: 31, train_loss: 0.7569, test_loss: 0.9036, test_f1: 0.5713
 epoch: 32, train_loss: 0.7590, test_loss: 0.8679, test_f1: 0.5929
 epoch: 33, train_loss: 0.7487, test_loss: 0.8905, test_f1: 0.5539
 epoch: 34, train_loss: 0.7498, test_loss: 0.8995, test_f1: 0.5651
 epoch: 35, train_loss: 0.7484, test_loss: 0.9203, test_f1: 0.5684
 epoch: 36, train_loss: 0.7397, test_loss: 0.8856, test_f1: 0.5641
 epoch: 37, train_loss: 0.7397, test_loss: 0.9078, test_f1: 0.5675
 epoch: 38, train_loss: 0.7273, test_loss: 0.9154, test_f1: 0.5715
 epoch: 39, train_loss: 0.7234, test_loss: 0.8942, test_f1: 0.5765
 epoch: 40, train_loss: 0.7259, test_loss: 0.8785, test_f1: 0.5944
 epoch: 41, train_loss: 0.7235, test_loss: 0.8984, test_f1: 0.5780
 epoch: 42, train_loss: 0.7082, test_loss: 0.8816, test_f1: 0.5928
 epoch: 43, train_loss: 0.7086, test_loss: 0.8982, test_f1: 0.5882
 epoch: 44, train_loss: 0.7019, test_loss: 0.8918, test_f1: 0.6027
 epoch: 45, train_loss: 0.7031, test_loss: 0.9186, test_f1: 0.5929
 epoch: 46, train_loss: 0.6961, test_loss: 0.8789, test_f1: 0.5889
 epoch: 47, train_loss: 0.6921, test_loss: 0.9361, test_f1: 0.5836
 epoch: 48, train_loss: 0.6897, test_loss: 0.9287, test_f1: 0.5758
 epoch: 49, train_loss: 0.6795, test_loss: 0.9780, test_f1: 0.5799
 epoch: 50, train_loss: 0.6830, test_loss: 0.8966, test_f1: 0.6166
 epoch: 51, train_loss: 0.6625, test_loss: 0.9027, test_f1: 0.6089
 epoch: 52, train_loss: 0.6697, test_loss: 0.9132, test_f1: 0.6145
 epoch: 53, train_loss: 0.6559, test_loss: 0.9238, test_f1: 0.5936
 epoch: 54, train_loss: 0.6544, test_loss: 0.9025, test_f1: 0.6037
 epoch: 55, train_loss: 0.6501, test_loss: 0.9168, test_f1: 0.6159
 epoch: 56, train_loss: 0.6546, test_loss: 0.9038, test_f1: 0.6196
 epoch: 57, train_loss: 0.6520, test_loss: 0.9090, test_f1: 0.6357
 epoch: 58, train_loss: 0.6494, test_loss: 0.9127, test_f1: 0.6230
 epoch: 59, train_loss: 0.6487, test_loss: 0.9398, test_f1: 0.6049
 epoch: 60, train_loss: 0.6578, test_loss: 0.9356, test_f1: 0.6101
 epoch: 61, train_loss: 0.6432, test_loss: 0.9317, test_f1: 0.6131
 epoch: 62, train_loss: 0.6356, test_loss: 0.9440, test_f1: 0.5946
 epoch: 63, train_loss: 0.6328, test_loss: 0.9432, test_f1: 0.5939
 epoch: 64, train_loss: 0.6397, test_loss: 0.9040, test_f1: 0.6451
 epoch: 65, train_loss: 0.6326, test_loss: 0.9438, test_f1: 0.6237
 epoch: 66, train_loss: 0.6346, test_loss: 0.9651, test_f1: 0.6051
 epoch: 67, train_loss: 0.6317, test_loss: 0.9089, test_f1: 0.6218
 epoch: 68, train_loss: 0.6342, test_loss: 0.9571, test_f1: 0.6016
 epoch: 69, train_loss: 0.6356, test_loss: 0.9430, test_f1: 0.6209
 epoch: 70, train_loss: 0.6232, test_loss: 0.9244, test_f1: 0.6148
 epoch: 71, train_loss: 0.6160, test_loss: 0.9383, test_f1: 0.6140
 epoch: 72, train_loss: 0.6174, test_loss: 0.9432, test_f1: 0.6091
 epoch: 73, train_loss: 0.6249, test_loss: 0.9717, test_f1: 0.6123
 epoch: 74, train_loss: 0.6209, test_loss: 0.9814, test_f1: 0.6060
 epoch: 75, train_loss: 0.6243, test_loss: 0.9356, test_f1: 0.6439
 epoch: 76, train_loss: 0.6073, test_loss: 0.9431, test_f1: 0.6441
 epoch: 77, train_loss: 0.6023, test_loss: 0.9571, test_f1: 0.6235
 epoch: 78, train_loss: 0.6005, test_loss: 0.9542, test_f1: 0.6285
 epoch: 79, train_loss: 0.6054, test_loss: 0.9655, test_f1: 0.6430
 epoch: 80, train_loss: 0.6021, test_loss: 0.9490, test_f1: 0.6227
 epoch: 81, train_loss: 0.6069, test_loss: 0.9790, test_f1: 0.6383
 epoch: 82, train_loss: 0.6002, test_loss: 0.9847, test_f1: 0.5976
 epoch: 83, train_loss: 0.6064, test_loss: 0.9890, test_f1: 0.6151
 epoch: 84, train_loss: 0.5980, test_loss: 0.9618, test_f1: 0.6456
 epoch: 85, train_loss: 0.6025, test_loss: 1.0010, test_f1: 0.6009
 epoch: 86, train_loss: 0.5819, test_loss: 1.0092, test_f1: 0.6252
 epoch: 87, train_loss: 0.5979, test_loss: 0.9832, test_f1: 0.6325
 epoch: 88, train_loss: 0.5998, test_loss: 0.9785, test_f1: 0.6264
 epoch: 89, train_loss: 0.5931, test_loss: 0.9606, test_f1: 0.6422
 epoch: 90, train_loss: 0.5890, test_loss: 0.9760, test_f1: 0.6401
 epoch: 91, train_loss: 0.5802, test_loss: 1.0036, test_f1: 0.6374
 epoch: 92, train_loss: 0.5888, test_loss: 0.9849, test_f1: 0.6228
 epoch: 93, train_loss: 0.5771, test_loss: 0.9934, test_f1: 0.6412
 epoch: 94, train_loss: 0.5999, test_loss: 0.9781, test_f1: 0.6489
 epoch: 95, train_loss: 0.5748, test_loss: 0.9974, test_f1: 0.6330
 epoch: 96, train_loss: 0.5900, test_loss: 1.0207, test_f1: 0.6340
 epoch: 97, train_loss: 0.5858, test_loss: 0.9826, test_f1: 0.6231
 epoch: 98, train_loss: 0.5718, test_loss: 1.0107, test_f1: 0.6289
 epoch: 99, train_loss: 0.5711, test_loss: 0.9892, test_f1: 0.6368
##################ITERATION #3 ****************************************
 epoch: 0, train_loss: 1.2087, test_loss: 1.1260, test_f1: 0.3727
 epoch: 1, train_loss: 1.0838, test_loss: 1.0100, test_f1: 0.4869
 epoch: 2, train_loss: 1.0429, test_loss: 0.9880, test_f1: 0.4980
 epoch: 3, train_loss: 0.9992, test_loss: 0.9619, test_f1: 0.5092
 epoch: 4, train_loss: 0.9757, test_loss: 0.9383, test_f1: 0.5097
 epoch: 5, train_loss: 0.9632, test_loss: 0.9406, test_f1: 0.5281
 epoch: 6, train_loss: 0.9420, test_loss: 0.9296, test_f1: 0.5355
 epoch: 7, train_loss: 0.9368, test_loss: 0.9153, test_f1: 0.5473
 epoch: 8, train_loss: 0.9131, test_loss: 0.9072, test_f1: 0.5504
 epoch: 9, train_loss: 0.9017, test_loss: 0.9029, test_f1: 0.5440
 epoch: 10, train_loss: 0.8997, test_loss: 0.8963, test_f1: 0.5441
 epoch: 11, train_loss: 0.8793, test_loss: 0.9055, test_f1: 0.5529
 epoch: 12, train_loss: 0.8762, test_loss: 0.8923, test_f1: 0.5446
 epoch: 13, train_loss: 0.8658, test_loss: 0.8953, test_f1: 0.5407
 epoch: 14, train_loss: 0.8649, test_loss: 0.8923, test_f1: 0.5508
 epoch: 15, train_loss: 0.8544, test_loss: 0.9028, test_f1: 0.5446
 epoch: 16, train_loss: 0.8424, test_loss: 0.8983, test_f1: 0.5551
 epoch: 17, train_loss: 0.8439, test_loss: 0.8944, test_f1: 0.5358
 epoch: 18, train_loss: 0.8342, test_loss: 0.9125, test_f1: 0.5405
 epoch: 19, train_loss: 0.8310, test_loss: 0.8783, test_f1: 0.5435
 epoch: 20, train_loss: 0.8212, test_loss: 0.8954, test_f1: 0.5312
 epoch: 21, train_loss: 0.8088, test_loss: 0.9015, test_f1: 0.5417
 epoch: 22, train_loss: 0.8132, test_loss: 0.9033, test_f1: 0.5342
 epoch: 23, train_loss: 0.8092, test_loss: 0.8876, test_f1: 0.5437
 epoch: 24, train_loss: 0.7994, test_loss: 0.9199, test_f1: 0.5308
 epoch: 25, train_loss: 0.7934, test_loss: 0.8921, test_f1: 0.5482
 epoch: 26, train_loss: 0.7895, test_loss: 0.9043, test_f1: 0.5538
 epoch: 27, train_loss: 0.7822, test_loss: 0.9062, test_f1: 0.5678
 epoch: 28, train_loss: 0.7814, test_loss: 0.9287, test_f1: 0.5776
 epoch: 29, train_loss: 0.7717, test_loss: 0.8967, test_f1: 0.5911
 epoch: 30, train_loss: 0.7552, test_loss: 0.9081, test_f1: 0.5787
 epoch: 31, train_loss: 0.7557, test_loss: 0.9276, test_f1: 0.5571
 epoch: 32, train_loss: 0.7688, test_loss: 0.9333, test_f1: 0.5684
 epoch: 33, train_loss: 0.7454, test_loss: 0.9197, test_f1: 0.5779
 epoch: 34, train_loss: 0.7405, test_loss: 0.8911, test_f1: 0.5836
 epoch: 35, train_loss: 0.7441, test_loss: 0.9248, test_f1: 0.5713
 epoch: 36, train_loss: 0.7431, test_loss: 0.9360, test_f1: 0.5796
 epoch: 37, train_loss: 0.7350, test_loss: 0.9306, test_f1: 0.5920
 epoch: 38, train_loss: 0.7387, test_loss: 0.9559, test_f1: 0.5788
 epoch: 39, train_loss: 0.7210, test_loss: 0.9324, test_f1: 0.5550
 epoch: 40, train_loss: 0.7297, test_loss: 0.9313, test_f1: 0.5767
 epoch: 41, train_loss: 0.7234, test_loss: 0.9259, test_f1: 0.6007
 epoch: 42, train_loss: 0.7121, test_loss: 0.9615, test_f1: 0.5996
 epoch: 43, train_loss: 0.7091, test_loss: 0.9333, test_f1: 0.6098
 epoch: 44, train_loss: 0.6988, test_loss: 0.9466, test_f1: 0.5987
 epoch: 45, train_loss: 0.7073, test_loss: 0.9564, test_f1: 0.5977
 epoch: 46, train_loss: 0.6802, test_loss: 0.9591, test_f1: 0.5849
 epoch: 47, train_loss: 0.6872, test_loss: 0.9479, test_f1: 0.6244
 epoch: 48, train_loss: 0.6848, test_loss: 0.9622, test_f1: 0.6116
 epoch: 49, train_loss: 0.6851, test_loss: 0.9710, test_f1: 0.6150
 epoch: 50, train_loss: 0.6851, test_loss: 0.9539, test_f1: 0.5817
 epoch: 51, train_loss: 0.6735, test_loss: 0.9482, test_f1: 0.6225
 epoch: 52, train_loss: 0.6732, test_loss: 0.9755, test_f1: 0.6122
 epoch: 53, train_loss: 0.6591, test_loss: 0.9593, test_f1: 0.6073
 epoch: 54, train_loss: 0.6620, test_loss: 0.9794, test_f1: 0.5921
 epoch: 55, train_loss: 0.6632, test_loss: 0.9578, test_f1: 0.6111
 epoch: 56, train_loss: 0.6578, test_loss: 0.9633, test_f1: 0.6014
 epoch: 57, train_loss: 0.6482, test_loss: 0.9736, test_f1: 0.6159
 epoch: 58, train_loss: 0.6501, test_loss: 0.9640, test_f1: 0.6069
 epoch: 59, train_loss: 0.6529, test_loss: 0.9852, test_f1: 0.6072
 epoch: 60, train_loss: 0.6517, test_loss: 1.0009, test_f1: 0.5970
 epoch: 61, train_loss: 0.6567, test_loss: 0.9692, test_f1: 0.6141
 epoch: 62, train_loss: 0.6473, test_loss: 0.9580, test_f1: 0.6090
 epoch: 63, train_loss: 0.6465, test_loss: 0.9841, test_f1: 0.6178
 epoch: 64, train_loss: 0.6393, test_loss: 0.9831, test_f1: 0.6114
 epoch: 65, train_loss: 0.6358, test_loss: 0.9732, test_f1: 0.6163
 epoch: 66, train_loss: 0.6357, test_loss: 0.9652, test_f1: 0.5982
 epoch: 67, train_loss: 0.6472, test_loss: 0.9729, test_f1: 0.6164
 epoch: 68, train_loss: 0.6385, test_loss: 0.9839, test_f1: 0.6069
 epoch: 69, train_loss: 0.6293, test_loss: 0.9840, test_f1: 0.6071
 epoch: 70, train_loss: 0.6289, test_loss: 0.9935, test_f1: 0.6171
 epoch: 71, train_loss: 0.6264, test_loss: 0.9932, test_f1: 0.6143
 epoch: 72, train_loss: 0.6392, test_loss: 1.0031, test_f1: 0.6171
 epoch: 73, train_loss: 0.6354, test_loss: 1.0025, test_f1: 0.6119
 epoch: 74, train_loss: 0.6279, test_loss: 0.9912, test_f1: 0.6208
 epoch: 75, train_loss: 0.6188, test_loss: 0.9869, test_f1: 0.6173
 epoch: 76, train_loss: 0.6307, test_loss: 0.9993, test_f1: 0.6250
 epoch: 77, train_loss: 0.6149, test_loss: 0.9954, test_f1: 0.6202
 epoch: 78, train_loss: 0.6101, test_loss: 0.9968, test_f1: 0.6228
 epoch: 79, train_loss: 0.6113, test_loss: 0.9875, test_f1: 0.6082
 epoch: 80, train_loss: 0.6141, test_loss: 1.0014, test_f1: 0.6291
 epoch: 81, train_loss: 0.6195, test_loss: 0.9974, test_f1: 0.6129
 epoch: 82, train_loss: 0.6034, test_loss: 0.9808, test_f1: 0.6183
 epoch: 83, train_loss: 0.6079, test_loss: 0.9907, test_f1: 0.6378
 epoch: 84, train_loss: 0.6045, test_loss: 1.0086, test_f1: 0.6286
 epoch: 85, train_loss: 0.6195, test_loss: 1.0043, test_f1: 0.6392
 epoch: 86, train_loss: 0.6033, test_loss: 0.9948, test_f1: 0.6303
 epoch: 87, train_loss: 0.5900, test_loss: 1.0130, test_f1: 0.6322
 epoch: 88, train_loss: 0.5922, test_loss: 1.0042, test_f1: 0.6483
 epoch: 89, train_loss: 0.6025, test_loss: 1.0340, test_f1: 0.6507
 epoch: 90, train_loss: 0.6097, test_loss: 1.0125, test_f1: 0.6280
 epoch: 91, train_loss: 0.5937, test_loss: 1.0031, test_f1: 0.6361
 epoch: 92, train_loss: 0.5982, test_loss: 1.0271, test_f1: 0.6356
 epoch: 93, train_loss: 0.5919, test_loss: 1.0024, test_f1: 0.6462
 epoch: 94, train_loss: 0.5895, test_loss: 1.0070, test_f1: 0.6403
 epoch: 95, train_loss: 0.5937, test_loss: 1.0336, test_f1: 0.6504
 epoch: 96, train_loss: 0.5994, test_loss: 1.0492, test_f1: 0.6439
 epoch: 97, train_loss: 0.5887, test_loss: 1.0099, test_f1: 0.6380
 epoch: 98, train_loss: 0.5855, test_loss: 1.0247, test_f1: 0.6226
 epoch: 99, train_loss: 0.5782, test_loss: 1.0095, test_f1: 0.6430
##################ITERATION #4 ****************************************
 epoch: 0, train_loss: 1.2255, test_loss: 1.1162, test_f1: 0.4299
 epoch: 1, train_loss: 1.1005, test_loss: 1.0096, test_f1: 0.4877
 epoch: 2, train_loss: 1.0615, test_loss: 0.9758, test_f1: 0.4993
 epoch: 3, train_loss: 1.0372, test_loss: 0.9573, test_f1: 0.4748
 epoch: 4, train_loss: 1.0049, test_loss: 0.9488, test_f1: 0.4987
 epoch: 5, train_loss: 0.9844, test_loss: 0.9345, test_f1: 0.5159
 epoch: 6, train_loss: 0.9863, test_loss: 0.9290, test_f1: 0.5139
 epoch: 7, train_loss: 0.9573, test_loss: 0.9242, test_f1: 0.5000
 epoch: 8, train_loss: 0.9405, test_loss: 0.9091, test_f1: 0.5271
 epoch: 9, train_loss: 0.9222, test_loss: 0.9037, test_f1: 0.5389
 epoch: 10, train_loss: 0.9154, test_loss: 0.9069, test_f1: 0.5179
 epoch: 11, train_loss: 0.9111, test_loss: 0.9056, test_f1: 0.5349
 epoch: 12, train_loss: 0.9031, test_loss: 0.8988, test_f1: 0.5474
 epoch: 13, train_loss: 0.8923, test_loss: 0.9010, test_f1: 0.5510
 epoch: 14, train_loss: 0.8870, test_loss: 0.9001, test_f1: 0.5442
 epoch: 15, train_loss: 0.8762, test_loss: 0.8991, test_f1: 0.5430
 epoch: 16, train_loss: 0.8741, test_loss: 0.8790, test_f1: 0.5378
 epoch: 17, train_loss: 0.8544, test_loss: 0.8874, test_f1: 0.5371
 epoch: 18, train_loss: 0.8605, test_loss: 0.8892, test_f1: 0.5322
 epoch: 19, train_loss: 0.8524, test_loss: 0.8696, test_f1: 0.5371
 epoch: 20, train_loss: 0.8388, test_loss: 0.8754, test_f1: 0.5510
 epoch: 21, train_loss: 0.8297, test_loss: 0.8757, test_f1: 0.5410
 epoch: 22, train_loss: 0.8248, test_loss: 0.8876, test_f1: 0.5668
 epoch: 23, train_loss: 0.8196, test_loss: 0.8981, test_f1: 0.5588
 epoch: 24, train_loss: 0.8089, test_loss: 0.8863, test_f1: 0.5696
 epoch: 25, train_loss: 0.8162, test_loss: 0.8779, test_f1: 0.5842
 epoch: 26, train_loss: 0.8181, test_loss: 0.8767, test_f1: 0.5452
 epoch: 27, train_loss: 0.7913, test_loss: 0.8924, test_f1: 0.5430
 epoch: 28, train_loss: 0.7907, test_loss: 0.9137, test_f1: 0.5500
 epoch: 29, train_loss: 0.7947, test_loss: 0.8898, test_f1: 0.5503
 epoch: 30, train_loss: 0.7812, test_loss: 0.8902, test_f1: 0.5566
 epoch: 31, train_loss: 0.7832, test_loss: 0.8835, test_f1: 0.5577
 epoch: 32, train_loss: 0.7834, test_loss: 0.8980, test_f1: 0.5730
 epoch: 33, train_loss: 0.7642, test_loss: 0.8775, test_f1: 0.5714
 epoch: 34, train_loss: 0.7700, test_loss: 0.9184, test_f1: 0.5391
 epoch: 35, train_loss: 0.7490, test_loss: 0.8780, test_f1: 0.5774
 epoch: 36, train_loss: 0.7528, test_loss: 0.8756, test_f1: 0.5717
 epoch: 37, train_loss: 0.7541, test_loss: 0.8784, test_f1: 0.5844
 epoch: 38, train_loss: 0.7514, test_loss: 0.9066, test_f1: 0.5924
 epoch: 39, train_loss: 0.7407, test_loss: 0.9137, test_f1: 0.5586
 epoch: 40, train_loss: 0.7428, test_loss: 0.9270, test_f1: 0.5397
 epoch: 41, train_loss: 0.7366, test_loss: 0.8924, test_f1: 0.5684
 epoch: 42, train_loss: 0.7435, test_loss: 0.9006, test_f1: 0.5764
 epoch: 43, train_loss: 0.7411, test_loss: 0.9356, test_f1: 0.5486
 epoch: 44, train_loss: 0.7195, test_loss: 0.8884, test_f1: 0.6062
 epoch: 45, train_loss: 0.7172, test_loss: 0.9420, test_f1: 0.5689
 epoch: 46, train_loss: 0.7059, test_loss: 0.9203, test_f1: 0.5815
 epoch: 47, train_loss: 0.6986, test_loss: 0.9260, test_f1: 0.5786
 epoch: 48, train_loss: 0.7006, test_loss: 0.9082, test_f1: 0.6149
 epoch: 49, train_loss: 0.7124, test_loss: 0.9016, test_f1: 0.6130
 epoch: 50, train_loss: 0.6968, test_loss: 0.9101, test_f1: 0.6290
 epoch: 51, train_loss: 0.6902, test_loss: 0.9218, test_f1: 0.6116
 epoch: 52, train_loss: 0.6863, test_loss: 0.9140, test_f1: 0.6234
 epoch: 53, train_loss: 0.6790, test_loss: 0.9252, test_f1: 0.6199
 epoch: 54, train_loss: 0.6712, test_loss: 0.9181, test_f1: 0.6259
 epoch: 55, train_loss: 0.6756, test_loss: 0.9244, test_f1: 0.6145
 epoch: 56, train_loss: 0.6905, test_loss: 0.9124, test_f1: 0.6221
 epoch: 57, train_loss: 0.6682, test_loss: 0.9111, test_f1: 0.6219
 epoch: 58, train_loss: 0.6723, test_loss: 0.9030, test_f1: 0.6237
 epoch: 59, train_loss: 0.6552, test_loss: 0.9150, test_f1: 0.6214
 epoch: 60, train_loss: 0.6705, test_loss: 0.9378, test_f1: 0.6066
 epoch: 61, train_loss: 0.6619, test_loss: 0.9430, test_f1: 0.6131
 epoch: 62, train_loss: 0.6613, test_loss: 0.9322, test_f1: 0.6243
 epoch: 63, train_loss: 0.6614, test_loss: 0.9358, test_f1: 0.6210
 epoch: 64, train_loss: 0.6591, test_loss: 0.9370, test_f1: 0.6150
 epoch: 65, train_loss: 0.6620, test_loss: 0.9404, test_f1: 0.6251
 epoch: 66, train_loss: 0.6613, test_loss: 0.9438, test_f1: 0.6046
 epoch: 67, train_loss: 0.6456, test_loss: 0.9604, test_f1: 0.6087
 epoch: 68, train_loss: 0.6460, test_loss: 0.9630, test_f1: 0.6210
 epoch: 69, train_loss: 0.6403, test_loss: 0.9582, test_f1: 0.6094
 epoch: 70, train_loss: 0.6505, test_loss: 0.9489, test_f1: 0.6176
 epoch: 71, train_loss: 0.6521, test_loss: 0.9620, test_f1: 0.6332
 epoch: 72, train_loss: 0.6457, test_loss: 0.9648, test_f1: 0.6195
 epoch: 73, train_loss: 0.6437, test_loss: 0.9777, test_f1: 0.6108
 epoch: 74, train_loss: 0.6451, test_loss: 0.9635, test_f1: 0.6306
 epoch: 75, train_loss: 0.6400, test_loss: 0.9615, test_f1: 0.6003
 epoch: 76, train_loss: 0.6357, test_loss: 0.9783, test_f1: 0.6352
 epoch: 77, train_loss: 0.6377, test_loss: 0.9678, test_f1: 0.6262
 epoch: 78, train_loss: 0.6373, test_loss: 0.9615, test_f1: 0.6293
 epoch: 79, train_loss: 0.6250, test_loss: 0.9900, test_f1: 0.6264
 epoch: 80, train_loss: 0.6224, test_loss: 0.9816, test_f1: 0.6338
 epoch: 81, train_loss: 0.6268, test_loss: 0.9564, test_f1: 0.6430
 epoch: 82, train_loss: 0.6285, test_loss: 0.9812, test_f1: 0.6243
 epoch: 83, train_loss: 0.6270, test_loss: 0.9763, test_f1: 0.6298
 epoch: 84, train_loss: 0.6170, test_loss: 0.9735, test_f1: 0.6350
 epoch: 85, train_loss: 0.6084, test_loss: 0.9787, test_f1: 0.6321
 epoch: 86, train_loss: 0.6242, test_loss: 1.0004, test_f1: 0.6285
 epoch: 87, train_loss: 0.6279, test_loss: 0.9736, test_f1: 0.6445
 epoch: 88, train_loss: 0.6018, test_loss: 1.0145, test_f1: 0.6338
 epoch: 89, train_loss: 0.6060, test_loss: 0.9910, test_f1: 0.6446
 epoch: 90, train_loss: 0.6075, test_loss: 0.9976, test_f1: 0.6343
 epoch: 91, train_loss: 0.6214, test_loss: 0.9906, test_f1: 0.6423
 epoch: 92, train_loss: 0.6078, test_loss: 1.0233, test_f1: 0.6416
 epoch: 93, train_loss: 0.6153, test_loss: 0.9899, test_f1: 0.6308
 epoch: 94, train_loss: 0.6013, test_loss: 1.0071, test_f1: 0.6253
 epoch: 95, train_loss: 0.6055, test_loss: 1.0301, test_f1: 0.6353
 epoch: 96, train_loss: 0.5955, test_loss: 1.0237, test_f1: 0.6360
 epoch: 97, train_loss: 0.5897, test_loss: 1.0067, test_f1: 0.6390
 epoch: 98, train_loss: 0.5932, test_loss: 0.9961, test_f1: 0.6475
 epoch: 99, train_loss: 0.5917, test_loss: 1.0351, test_f1: 0.6289
##################ITERATION #5 ****************************************
 epoch: 0, train_loss: 1.2329, test_loss: 1.0729, test_f1: 0.4402
 epoch: 1, train_loss: 1.0906, test_loss: 1.0025, test_f1: 0.4703
 epoch: 2, train_loss: 1.0552, test_loss: 0.9790, test_f1: 0.5081
 epoch: 3, train_loss: 1.0068, test_loss: 0.9699, test_f1: 0.4883
 epoch: 4, train_loss: 0.9858, test_loss: 0.9547, test_f1: 0.4946
 epoch: 5, train_loss: 0.9796, test_loss: 0.9401, test_f1: 0.4979
 epoch: 6, train_loss: 0.9588, test_loss: 0.9481, test_f1: 0.5060
 epoch: 7, train_loss: 0.9400, test_loss: 0.9410, test_f1: 0.5365
 epoch: 8, train_loss: 0.9323, test_loss: 0.9378, test_f1: 0.5166
 epoch: 9, train_loss: 0.9241, test_loss: 0.9273, test_f1: 0.5391
 epoch: 10, train_loss: 0.9122, test_loss: 0.9250, test_f1: 0.5286
 epoch: 11, train_loss: 0.9157, test_loss: 0.9270, test_f1: 0.5454
 epoch: 12, train_loss: 0.8969, test_loss: 0.9211, test_f1: 0.5100
 epoch: 13, train_loss: 0.8894, test_loss: 0.9189, test_f1: 0.5376
 epoch: 14, train_loss: 0.8775, test_loss: 0.9060, test_f1: 0.5440
 epoch: 15, train_loss: 0.8644, test_loss: 0.9069, test_f1: 0.5333
 epoch: 16, train_loss: 0.8611, test_loss: 0.9205, test_f1: 0.5195
 epoch: 17, train_loss: 0.8530, test_loss: 0.8990, test_f1: 0.5451
 epoch: 18, train_loss: 0.8472, test_loss: 0.9186, test_f1: 0.5660
 epoch: 19, train_loss: 0.8423, test_loss: 0.8978, test_f1: 0.5673
 epoch: 20, train_loss: 0.8388, test_loss: 0.9061, test_f1: 0.5393
 epoch: 21, train_loss: 0.8294, test_loss: 0.8965, test_f1: 0.5590
 epoch: 22, train_loss: 0.8235, test_loss: 0.9175, test_f1: 0.5717
 epoch: 23, train_loss: 0.8178, test_loss: 0.9016, test_f1: 0.5735
 epoch: 24, train_loss: 0.8023, test_loss: 0.9110, test_f1: 0.5676
 epoch: 25, train_loss: 0.7989, test_loss: 0.9115, test_f1: 0.5760
 epoch: 26, train_loss: 0.7967, test_loss: 0.9218, test_f1: 0.5553
 epoch: 27, train_loss: 0.8094, test_loss: 0.9409, test_f1: 0.5644
 epoch: 28, train_loss: 0.7851, test_loss: 0.9318, test_f1: 0.5867
 epoch: 29, train_loss: 0.7793, test_loss: 0.9154, test_f1: 0.5702
 epoch: 30, train_loss: 0.7708, test_loss: 0.9353, test_f1: 0.5587
 epoch: 31, train_loss: 0.7685, test_loss: 0.9136, test_f1: 0.5819
 epoch: 32, train_loss: 0.7653, test_loss: 0.9234, test_f1: 0.6035
 epoch: 33, train_loss: 0.7622, test_loss: 0.9198, test_f1: 0.5653
 epoch: 34, train_loss: 0.7551, test_loss: 0.9183, test_f1: 0.5876
 epoch: 35, train_loss: 0.7586, test_loss: 0.9168, test_f1: 0.5906
 epoch: 36, train_loss: 0.7499, test_loss: 0.9222, test_f1: 0.5926
 epoch: 37, train_loss: 0.7508, test_loss: 0.9201, test_f1: 0.6073
 epoch: 38, train_loss: 0.7390, test_loss: 0.9167, test_f1: 0.5999
 epoch: 39, train_loss: 0.7372, test_loss: 0.9238, test_f1: 0.5831
 epoch: 40, train_loss: 0.7228, test_loss: 0.9448, test_f1: 0.5885
 epoch: 41, train_loss: 0.7268, test_loss: 0.9304, test_f1: 0.5884
 epoch: 42, train_loss: 0.7265, test_loss: 0.9634, test_f1: 0.5761
 epoch: 43, train_loss: 0.7183, test_loss: 0.9199, test_f1: 0.6215
 epoch: 44, train_loss: 0.7106, test_loss: 0.9509, test_f1: 0.6200
 epoch: 45, train_loss: 0.7119, test_loss: 0.9276, test_f1: 0.6143
 epoch: 46, train_loss: 0.7017, test_loss: 0.9391, test_f1: 0.6119
 epoch: 47, train_loss: 0.6937, test_loss: 0.9530, test_f1: 0.6085
 epoch: 48, train_loss: 0.6865, test_loss: 0.9369, test_f1: 0.6087
 epoch: 49, train_loss: 0.6934, test_loss: 1.0032, test_f1: 0.5859
 epoch: 50, train_loss: 0.6870, test_loss: 0.9303, test_f1: 0.6085
 epoch: 51, train_loss: 0.6762, test_loss: 0.9348, test_f1: 0.6328
 epoch: 52, train_loss: 0.6751, test_loss: 0.9625, test_f1: 0.6159
 epoch: 53, train_loss: 0.6656, test_loss: 0.9494, test_f1: 0.6014
 epoch: 54, train_loss: 0.6704, test_loss: 0.9553, test_f1: 0.6024
 epoch: 55, train_loss: 0.6642, test_loss: 0.9437, test_f1: 0.6265
 epoch: 56, train_loss: 0.6652, test_loss: 0.9551, test_f1: 0.6208
 epoch: 57, train_loss: 0.6646, test_loss: 0.9308, test_f1: 0.6358
 epoch: 58, train_loss: 0.6510, test_loss: 0.9732, test_f1: 0.5981
 epoch: 59, train_loss: 0.6581, test_loss: 0.9568, test_f1: 0.6071
 epoch: 60, train_loss: 0.6453, test_loss: 0.9646, test_f1: 0.6151
 epoch: 61, train_loss: 0.6572, test_loss: 0.9583, test_f1: 0.6050
 epoch: 62, train_loss: 0.6424, test_loss: 0.9645, test_f1: 0.6167
 epoch: 63, train_loss: 0.6547, test_loss: 0.9576, test_f1: 0.6270
 epoch: 64, train_loss: 0.6410, test_loss: 0.9578, test_f1: 0.6054
 epoch: 65, train_loss: 0.6383, test_loss: 0.9482, test_f1: 0.6190
 epoch: 66, train_loss: 0.6400, test_loss: 0.9485, test_f1: 0.6396
 epoch: 67, train_loss: 0.6358, test_loss: 0.9763, test_f1: 0.6225
 epoch: 68, train_loss: 0.6399, test_loss: 0.9696, test_f1: 0.6210
 epoch: 69, train_loss: 0.6314, test_loss: 0.9718, test_f1: 0.6137
 epoch: 70, train_loss: 0.6279, test_loss: 0.9666, test_f1: 0.6227
 epoch: 71, train_loss: 0.6387, test_loss: 0.9623, test_f1: 0.6359
 epoch: 72, train_loss: 0.6218, test_loss: 1.0165, test_f1: 0.6087
 epoch: 73, train_loss: 0.6363, test_loss: 0.9968, test_f1: 0.6216
 epoch: 74, train_loss: 0.6427, test_loss: 1.0053, test_f1: 0.6199
 epoch: 75, train_loss: 0.6193, test_loss: 1.0065, test_f1: 0.6285
 epoch: 76, train_loss: 0.6270, test_loss: 0.9922, test_f1: 0.6270
 epoch: 77, train_loss: 0.6191, test_loss: 1.0058, test_f1: 0.6281
 epoch: 78, train_loss: 0.6267, test_loss: 1.0114, test_f1: 0.6205
 epoch: 79, train_loss: 0.6398, test_loss: 1.0219, test_f1: 0.6119
 epoch: 80, train_loss: 0.6129, test_loss: 0.9947, test_f1: 0.6355
 epoch: 81, train_loss: 0.6174, test_loss: 1.0023, test_f1: 0.6242
 epoch: 82, train_loss: 0.6122, test_loss: 1.0146, test_f1: 0.6310
 epoch: 83, train_loss: 0.6074, test_loss: 1.0150, test_f1: 0.6268
 epoch: 84, train_loss: 0.6047, test_loss: 1.0460, test_f1: 0.6079
 epoch: 85, train_loss: 0.6122, test_loss: 1.0125, test_f1: 0.6232
 epoch: 86, train_loss: 0.6095, test_loss: 1.0404, test_f1: 0.6153
 epoch: 87, train_loss: 0.6067, test_loss: 1.0620, test_f1: 0.6205
 epoch: 88, train_loss: 0.6071, test_loss: 1.0512, test_f1: 0.6292
 epoch: 89, train_loss: 0.5958, test_loss: 1.0258, test_f1: 0.6287
 epoch: 90, train_loss: 0.5985, test_loss: 1.0241, test_f1: 0.6196
 epoch: 91, train_loss: 0.5945, test_loss: 1.0581, test_f1: 0.6181
 epoch: 92, train_loss: 0.5948, test_loss: 1.0434, test_f1: 0.6238
 epoch: 93, train_loss: 0.5934, test_loss: 1.0110, test_f1: 0.6209
 epoch: 94, train_loss: 0.5891, test_loss: 1.0498, test_f1: 0.6307
 epoch: 95, train_loss: 0.5953, test_loss: 1.0786, test_f1: 0.6130
 epoch: 96, train_loss: 0.5977, test_loss: 1.0127, test_f1: 0.6438
 epoch: 97, train_loss: 0.5791, test_loss: 1.0541, test_f1: 0.6262
 epoch: 98, train_loss: 0.5902, test_loss: 1.0347, test_f1: 0.6344
 epoch: 99, train_loss: 0.5931, test_loss: 1.0425, test_f1: 0.6474
##################ITERATION #6 ****************************************
 epoch: 0, train_loss: 1.2340, test_loss: 1.0783, test_f1: 0.4314
 epoch: 1, train_loss: 1.0857, test_loss: 0.9844, test_f1: 0.4904
 epoch: 2, train_loss: 1.0549, test_loss: 0.9620, test_f1: 0.4945
 epoch: 3, train_loss: 1.0249, test_loss: 0.9477, test_f1: 0.5049
 epoch: 4, train_loss: 0.9960, test_loss: 0.9302, test_f1: 0.5071
 epoch: 5, train_loss: 0.9716, test_loss: 0.9436, test_f1: 0.5300
 epoch: 6, train_loss: 0.9631, test_loss: 0.9221, test_f1: 0.5239
 epoch: 7, train_loss: 0.9366, test_loss: 0.9163, test_f1: 0.5488
 epoch: 8, train_loss: 0.9481, test_loss: 0.9074, test_f1: 0.5301
 epoch: 9, train_loss: 0.9200, test_loss: 0.9104, test_f1: 0.5579
 epoch: 10, train_loss: 0.9223, test_loss: 0.8992, test_f1: 0.5221
 epoch: 11, train_loss: 0.9143, test_loss: 0.9067, test_f1: 0.5331
 epoch: 12, train_loss: 0.8989, test_loss: 0.9005, test_f1: 0.5352
 epoch: 13, train_loss: 0.8949, test_loss: 0.9052, test_f1: 0.5319
 epoch: 14, train_loss: 0.8924, test_loss: 0.8956, test_f1: 0.5295
 epoch: 15, train_loss: 0.8731, test_loss: 0.8927, test_f1: 0.5312
 epoch: 16, train_loss: 0.8660, test_loss: 0.8854, test_f1: 0.5310
 epoch: 17, train_loss: 0.8644, test_loss: 0.8808, test_f1: 0.5480
 epoch: 18, train_loss: 0.8533, test_loss: 0.8913, test_f1: 0.5432
 epoch: 19, train_loss: 0.8544, test_loss: 0.8605, test_f1: 0.5409
 epoch: 20, train_loss: 0.8460, test_loss: 0.8554, test_f1: 0.5422
 epoch: 21, train_loss: 0.8466, test_loss: 0.8571, test_f1: 0.5572
 epoch: 22, train_loss: 0.8301, test_loss: 0.8701, test_f1: 0.5501
 epoch: 23, train_loss: 0.8218, test_loss: 0.8784, test_f1: 0.5548
 epoch: 24, train_loss: 0.8207, test_loss: 0.8912, test_f1: 0.5491
 epoch: 25, train_loss: 0.8245, test_loss: 0.8757, test_f1: 0.5400
 epoch: 26, train_loss: 0.8141, test_loss: 0.8575, test_f1: 0.5622
 epoch: 27, train_loss: 0.7956, test_loss: 0.8524, test_f1: 0.5606
 epoch: 28, train_loss: 0.7992, test_loss: 0.8849, test_f1: 0.5503
 epoch: 29, train_loss: 0.7943, test_loss: 0.9047, test_f1: 0.5591
 epoch: 30, train_loss: 0.7916, test_loss: 0.8646, test_f1: 0.5643
 epoch: 31, train_loss: 0.7741, test_loss: 0.8770, test_f1: 0.5757
 epoch: 32, train_loss: 0.7887, test_loss: 0.8699, test_f1: 0.5837
 epoch: 33, train_loss: 0.7730, test_loss: 0.8688, test_f1: 0.5778
 epoch: 34, train_loss: 0.7679, test_loss: 0.8704, test_f1: 0.5850
 epoch: 35, train_loss: 0.7660, test_loss: 0.8945, test_f1: 0.5836
 epoch: 36, train_loss: 0.7655, test_loss: 0.9047, test_f1: 0.5836
 epoch: 37, train_loss: 0.7615, test_loss: 0.9027, test_f1: 0.5581
 epoch: 38, train_loss: 0.7551, test_loss: 0.9067, test_f1: 0.5952
 epoch: 39, train_loss: 0.7499, test_loss: 0.8938, test_f1: 0.5976
 epoch: 40, train_loss: 0.7489, test_loss: 0.8707, test_f1: 0.5895
 epoch: 41, train_loss: 0.7378, test_loss: 0.8916, test_f1: 0.5977
 epoch: 42, train_loss: 0.7397, test_loss: 0.9200, test_f1: 0.5729
 epoch: 43, train_loss: 0.7174, test_loss: 0.9111, test_f1: 0.5754
 epoch: 44, train_loss: 0.7333, test_loss: 0.9015, test_f1: 0.5829
 epoch: 45, train_loss: 0.7239, test_loss: 0.9147, test_f1: 0.6006
 epoch: 46, train_loss: 0.7268, test_loss: 0.9221, test_f1: 0.5764
 epoch: 47, train_loss: 0.7203, test_loss: 0.9108, test_f1: 0.5859
 epoch: 48, train_loss: 0.7064, test_loss: 0.9135, test_f1: 0.5950
 epoch: 49, train_loss: 0.7077, test_loss: 0.8925, test_f1: 0.6019
 epoch: 50, train_loss: 0.7050, test_loss: 0.8903, test_f1: 0.6102
 epoch: 51, train_loss: 0.6953, test_loss: 0.8931, test_f1: 0.6081
 epoch: 52, train_loss: 0.6903, test_loss: 0.9086, test_f1: 0.6133
 epoch: 53, train_loss: 0.6836, test_loss: 0.9158, test_f1: 0.6212
 epoch: 54, train_loss: 0.6782, test_loss: 0.9048, test_f1: 0.6206
 epoch: 55, train_loss: 0.6769, test_loss: 0.9014, test_f1: 0.6146
 epoch: 56, train_loss: 0.6760, test_loss: 0.9046, test_f1: 0.6235
 epoch: 57, train_loss: 0.6672, test_loss: 0.9148, test_f1: 0.6107
 epoch: 58, train_loss: 0.6831, test_loss: 0.9061, test_f1: 0.6021
 epoch: 59, train_loss: 0.6738, test_loss: 0.9297, test_f1: 0.6036
 epoch: 60, train_loss: 0.6789, test_loss: 0.9245, test_f1: 0.6142
 epoch: 61, train_loss: 0.6697, test_loss: 0.9235, test_f1: 0.6194
 epoch: 62, train_loss: 0.6611, test_loss: 0.8987, test_f1: 0.6046
 epoch: 63, train_loss: 0.6519, test_loss: 0.9160, test_f1: 0.6131
 epoch: 64, train_loss: 0.6585, test_loss: 0.9320, test_f1: 0.6105
 epoch: 65, train_loss: 0.6584, test_loss: 0.9275, test_f1: 0.6150
 epoch: 66, train_loss: 0.6475, test_loss: 0.9203, test_f1: 0.6157
 epoch: 67, train_loss: 0.6517, test_loss: 0.9129, test_f1: 0.6084
 epoch: 68, train_loss: 0.6486, test_loss: 0.9123, test_f1: 0.6112
 epoch: 69, train_loss: 0.6484, test_loss: 0.9232, test_f1: 0.6177
 epoch: 70, train_loss: 0.6541, test_loss: 0.9347, test_f1: 0.6121
 epoch: 71, train_loss: 0.6481, test_loss: 0.9319, test_f1: 0.6183
 epoch: 72, train_loss: 0.6392, test_loss: 0.9328, test_f1: 0.6213
 epoch: 73, train_loss: 0.6421, test_loss: 0.9442, test_f1: 0.6103
 epoch: 74, train_loss: 0.6294, test_loss: 0.9232, test_f1: 0.6067
 epoch: 75, train_loss: 0.6358, test_loss: 0.9475, test_f1: 0.6239
 epoch: 76, train_loss: 0.6225, test_loss: 0.9292, test_f1: 0.6120
 epoch: 77, train_loss: 0.6293, test_loss: 0.9527, test_f1: 0.6268
 epoch: 78, train_loss: 0.6208, test_loss: 0.9538, test_f1: 0.6163
 epoch: 79, train_loss: 0.6222, test_loss: 0.9448, test_f1: 0.6079
 epoch: 80, train_loss: 0.6374, test_loss: 0.9239, test_f1: 0.6090
 epoch: 81, train_loss: 0.6120, test_loss: 0.9567, test_f1: 0.6160
 epoch: 82, train_loss: 0.6240, test_loss: 0.9362, test_f1: 0.6085
 epoch: 83, train_loss: 0.6160, test_loss: 0.9398, test_f1: 0.6193
 epoch: 84, train_loss: 0.6114, test_loss: 0.9566, test_f1: 0.6027
 epoch: 85, train_loss: 0.6238, test_loss: 0.9403, test_f1: 0.6162
 epoch: 86, train_loss: 0.6170, test_loss: 0.9471, test_f1: 0.6238
 epoch: 87, train_loss: 0.6165, test_loss: 0.9434, test_f1: 0.6126
 epoch: 88, train_loss: 0.6190, test_loss: 0.9529, test_f1: 0.6192
 epoch: 89, train_loss: 0.5984, test_loss: 0.9371, test_f1: 0.6209
 epoch: 90, train_loss: 0.6006, test_loss: 0.9455, test_f1: 0.6278
 epoch: 91, train_loss: 0.6081, test_loss: 0.9787, test_f1: 0.6159
 epoch: 92, train_loss: 0.6027, test_loss: 0.9661, test_f1: 0.6147
 epoch: 93, train_loss: 0.5980, test_loss: 0.9471, test_f1: 0.6249
 epoch: 94, train_loss: 0.6004, test_loss: 0.9460, test_f1: 0.6074
 epoch: 95, train_loss: 0.6036, test_loss: 0.9375, test_f1: 0.6188
 epoch: 96, train_loss: 0.5901, test_loss: 0.9575, test_f1: 0.6265
 epoch: 97, train_loss: 0.5907, test_loss: 0.9456, test_f1: 0.6140
 epoch: 98, train_loss: 0.5933, test_loss: 0.9606, test_f1: 0.6207
 epoch: 99, train_loss: 0.5823, test_loss: 0.9490, test_f1: 0.6275
##################ITERATION #7 ****************************************
 epoch: 0, train_loss: 1.3133, test_loss: 1.1193, test_f1: 0.3862
 epoch: 1, train_loss: 1.1368, test_loss: 0.9848, test_f1: 0.5110
 epoch: 2, train_loss: 1.0724, test_loss: 0.9581, test_f1: 0.5189
 epoch: 3, train_loss: 1.0406, test_loss: 0.9457, test_f1: 0.5056
 epoch: 4, train_loss: 1.0074, test_loss: 0.9322, test_f1: 0.5376
 epoch: 5, train_loss: 0.9890, test_loss: 0.9175, test_f1: 0.5442
 epoch: 6, train_loss: 0.9750, test_loss: 0.8940, test_f1: 0.5368
 epoch: 7, train_loss: 0.9609, test_loss: 0.9141, test_f1: 0.5422
 epoch: 8, train_loss: 0.9442, test_loss: 0.9137, test_f1: 0.5353
 epoch: 9, train_loss: 0.9320, test_loss: 0.8956, test_f1: 0.5617
 epoch: 10, train_loss: 0.9238, test_loss: 0.9210, test_f1: 0.5563
 epoch: 11, train_loss: 0.9113, test_loss: 0.8810, test_f1: 0.5606
 epoch: 12, train_loss: 0.9078, test_loss: 0.8977, test_f1: 0.5656
 epoch: 13, train_loss: 0.9030, test_loss: 0.8938, test_f1: 0.5580
 epoch: 14, train_loss: 0.8914, test_loss: 0.9225, test_f1: 0.5529
 epoch: 15, train_loss: 0.8706, test_loss: 0.8898, test_f1: 0.5535
 epoch: 16, train_loss: 0.8622, test_loss: 0.8980, test_f1: 0.5523
 epoch: 17, train_loss: 0.8663, test_loss: 0.9356, test_f1: 0.5507
 epoch: 18, train_loss: 0.8566, test_loss: 0.9085, test_f1: 0.5551
 epoch: 19, train_loss: 0.8514, test_loss: 0.9202, test_f1: 0.5337
 epoch: 20, train_loss: 0.8455, test_loss: 0.8963, test_f1: 0.5891
 epoch: 21, train_loss: 0.8387, test_loss: 0.9075, test_f1: 0.5583
 epoch: 22, train_loss: 0.8330, test_loss: 0.8913, test_f1: 0.5526
 epoch: 23, train_loss: 0.8339, test_loss: 0.8789, test_f1: 0.5991
 epoch: 24, train_loss: 0.8187, test_loss: 0.9096, test_f1: 0.5955
 epoch: 25, train_loss: 0.8274, test_loss: 0.9142, test_f1: 0.5971
 epoch: 26, train_loss: 0.8186, test_loss: 0.9020, test_f1: 0.5713
 epoch: 27, train_loss: 0.8037, test_loss: 0.9121, test_f1: 0.5945
 epoch: 28, train_loss: 0.8025, test_loss: 0.9067, test_f1: 0.5880
 epoch: 29, train_loss: 0.8012, test_loss: 0.9067, test_f1: 0.5954
 epoch: 30, train_loss: 0.7914, test_loss: 0.9026, test_f1: 0.5959
 epoch: 31, train_loss: 0.7855, test_loss: 0.9141, test_f1: 0.5998
 epoch: 32, train_loss: 0.7814, test_loss: 0.9008, test_f1: 0.5895
 epoch: 33, train_loss: 0.7857, test_loss: 0.8888, test_f1: 0.5808
 epoch: 34, train_loss: 0.7746, test_loss: 0.9045, test_f1: 0.5805
 epoch: 35, train_loss: 0.7687, test_loss: 0.9121, test_f1: 0.5893
 epoch: 36, train_loss: 0.7668, test_loss: 0.9422, test_f1: 0.5884
 epoch: 37, train_loss: 0.7524, test_loss: 0.9619, test_f1: 0.5785
 epoch: 38, train_loss: 0.7532, test_loss: 0.8998, test_f1: 0.6122
 epoch: 39, train_loss: 0.7589, test_loss: 0.9238, test_f1: 0.6145
 epoch: 40, train_loss: 0.7520, test_loss: 0.8847, test_f1: 0.5907
 epoch: 41, train_loss: 0.7334, test_loss: 0.9056, test_f1: 0.5867
 epoch: 42, train_loss: 0.7415, test_loss: 0.9189, test_f1: 0.5839
 epoch: 43, train_loss: 0.7405, test_loss: 0.9301, test_f1: 0.5940
 epoch: 44, train_loss: 0.7455, test_loss: 0.9217, test_f1: 0.6064
 epoch: 45, train_loss: 0.7322, test_loss: 0.9175, test_f1: 0.6070
 epoch: 46, train_loss: 0.7321, test_loss: 0.9317, test_f1: 0.5721
 epoch: 47, train_loss: 0.7238, test_loss: 0.9175, test_f1: 0.6164
 epoch: 48, train_loss: 0.7161, test_loss: 0.9362, test_f1: 0.5954
 epoch: 49, train_loss: 0.7024, test_loss: 0.9226, test_f1: 0.5844
 epoch: 50, train_loss: 0.6977, test_loss: 0.9160, test_f1: 0.5880
 epoch: 51, train_loss: 0.7043, test_loss: 0.9164, test_f1: 0.6042
 epoch: 52, train_loss: 0.6975, test_loss: 0.9294, test_f1: 0.5992
 epoch: 53, train_loss: 0.6936, test_loss: 0.9107, test_f1: 0.6014
 epoch: 54, train_loss: 0.7021, test_loss: 0.9480, test_f1: 0.5962
 epoch: 55, train_loss: 0.6936, test_loss: 0.9370, test_f1: 0.5970
 epoch: 56, train_loss: 0.6923, test_loss: 0.9453, test_f1: 0.6113
 epoch: 57, train_loss: 0.6826, test_loss: 0.9406, test_f1: 0.5969
 epoch: 58, train_loss: 0.6789, test_loss: 0.9419, test_f1: 0.6065
 epoch: 59, train_loss: 0.6846, test_loss: 0.9353, test_f1: 0.6057
 epoch: 60, train_loss: 0.6803, test_loss: 0.9601, test_f1: 0.5852
 epoch: 61, train_loss: 0.6731, test_loss: 0.9333, test_f1: 0.6179
 epoch: 62, train_loss: 0.6714, test_loss: 0.9550, test_f1: 0.5890
 epoch: 63, train_loss: 0.6715, test_loss: 0.9659, test_f1: 0.5959
 epoch: 64, train_loss: 0.6773, test_loss: 0.9413, test_f1: 0.6159
 epoch: 65, train_loss: 0.6747, test_loss: 0.9346, test_f1: 0.6106
 epoch: 66, train_loss: 0.6682, test_loss: 0.9274, test_f1: 0.6205
 epoch: 67, train_loss: 0.6637, test_loss: 0.9396, test_f1: 0.6072
 epoch: 68, train_loss: 0.6715, test_loss: 0.9379, test_f1: 0.6222
 epoch: 69, train_loss: 0.6572, test_loss: 0.9414, test_f1: 0.6187
 epoch: 70, train_loss: 0.6641, test_loss: 0.9596, test_f1: 0.6243
 epoch: 71, train_loss: 0.6558, test_loss: 0.9676, test_f1: 0.6186
 epoch: 72, train_loss: 0.6490, test_loss: 0.9595, test_f1: 0.6097
 epoch: 73, train_loss: 0.6603, test_loss: 0.9706, test_f1: 0.6301
 epoch: 74, train_loss: 0.6502, test_loss: 0.9568, test_f1: 0.6217
 epoch: 75, train_loss: 0.6485, test_loss: 0.9551, test_f1: 0.6096
 epoch: 76, train_loss: 0.6339, test_loss: 0.9676, test_f1: 0.6477
 epoch: 77, train_loss: 0.6506, test_loss: 0.9608, test_f1: 0.6232
 epoch: 78, train_loss: 0.6449, test_loss: 0.9672, test_f1: 0.6195
 epoch: 79, train_loss: 0.6458, test_loss: 0.9599, test_f1: 0.6587
 epoch: 80, train_loss: 0.6394, test_loss: 0.9755, test_f1: 0.6255
 epoch: 81, train_loss: 0.6403, test_loss: 0.9604, test_f1: 0.6306
 epoch: 82, train_loss: 0.6411, test_loss: 0.9810, test_f1: 0.6185
 epoch: 83, train_loss: 0.6309, test_loss: 0.9749, test_f1: 0.6309
 epoch: 84, train_loss: 0.6227, test_loss: 0.9917, test_f1: 0.6338
 epoch: 85, train_loss: 0.6308, test_loss: 0.9785, test_f1: 0.6285
 epoch: 86, train_loss: 0.6350, test_loss: 0.9841, test_f1: 0.6318
 epoch: 87, train_loss: 0.6257, test_loss: 0.9740, test_f1: 0.6323
 epoch: 88, train_loss: 0.6273, test_loss: 1.0094, test_f1: 0.6304
 epoch: 89, train_loss: 0.6324, test_loss: 1.0155, test_f1: 0.6294
 epoch: 90, train_loss: 0.6276, test_loss: 0.9785, test_f1: 0.6310
 epoch: 91, train_loss: 0.6182, test_loss: 0.9690, test_f1: 0.6541
 epoch: 92, train_loss: 0.6207, test_loss: 0.9965, test_f1: 0.6254
 epoch: 93, train_loss: 0.6002, test_loss: 1.0035, test_f1: 0.6304
 epoch: 94, train_loss: 0.6143, test_loss: 0.9936, test_f1: 0.6406
 epoch: 95, train_loss: 0.6066, test_loss: 1.0113, test_f1: 0.6430
 epoch: 96, train_loss: 0.6133, test_loss: 1.0061, test_f1: 0.6121
 epoch: 97, train_loss: 0.6124, test_loss: 1.0092, test_f1: 0.6180
 epoch: 98, train_loss: 0.6144, test_loss: 1.0193, test_f1: 0.6189
 epoch: 99, train_loss: 0.6115, test_loss: 0.9905, test_f1: 0.6385
##################ITERATION #8 ****************************************
 epoch: 0, train_loss: 1.2707, test_loss: 1.0549, test_f1: 0.4526
 epoch: 1, train_loss: 1.1222, test_loss: 1.0186, test_f1: 0.4764
 epoch: 2, train_loss: 1.0761, test_loss: 0.9896, test_f1: 0.4934
 epoch: 3, train_loss: 1.0488, test_loss: 0.9831, test_f1: 0.4972
 epoch: 4, train_loss: 1.0166, test_loss: 0.9790, test_f1: 0.5171
 epoch: 5, train_loss: 1.0017, test_loss: 0.9569, test_f1: 0.5227
 epoch: 6, train_loss: 0.9722, test_loss: 0.9423, test_f1: 0.5053
 epoch: 7, train_loss: 0.9692, test_loss: 0.9304, test_f1: 0.5232
 epoch: 8, train_loss: 0.9477, test_loss: 0.9378, test_f1: 0.5352
 epoch: 9, train_loss: 0.9328, test_loss: 0.9134, test_f1: 0.5166
 epoch: 10, train_loss: 0.9219, test_loss: 0.9187, test_f1: 0.5335
 epoch: 11, train_loss: 0.9200, test_loss: 0.9211, test_f1: 0.5352
 epoch: 12, train_loss: 0.9118, test_loss: 0.9104, test_f1: 0.5638
 epoch: 13, train_loss: 0.8890, test_loss: 0.9046, test_f1: 0.5271
 epoch: 14, train_loss: 0.8923, test_loss: 0.9116, test_f1: 0.5310
 epoch: 15, train_loss: 0.8731, test_loss: 0.9263, test_f1: 0.5579
 epoch: 16, train_loss: 0.8776, test_loss: 0.8946, test_f1: 0.5609
 epoch: 17, train_loss: 0.8585, test_loss: 0.9086, test_f1: 0.5534
 epoch: 18, train_loss: 0.8601, test_loss: 0.8963, test_f1: 0.5651
 epoch: 19, train_loss: 0.8519, test_loss: 0.8975, test_f1: 0.5629
 epoch: 20, train_loss: 0.8360, test_loss: 0.8995, test_f1: 0.5872
 epoch: 21, train_loss: 0.8408, test_loss: 0.9089, test_f1: 0.5753
 epoch: 22, train_loss: 0.8218, test_loss: 0.8978, test_f1: 0.5899
 epoch: 23, train_loss: 0.8261, test_loss: 0.9059, test_f1: 0.5825
 epoch: 24, train_loss: 0.8311, test_loss: 0.9006, test_f1: 0.5896
 epoch: 25, train_loss: 0.8199, test_loss: 0.8714, test_f1: 0.5719
 epoch: 26, train_loss: 0.8074, test_loss: 0.9035, test_f1: 0.5619
 epoch: 27, train_loss: 0.7994, test_loss: 0.8941, test_f1: 0.5832
 epoch: 28, train_loss: 0.8048, test_loss: 0.9100, test_f1: 0.5915
 epoch: 29, train_loss: 0.7978, test_loss: 0.9239, test_f1: 0.5931
 epoch: 30, train_loss: 0.7901, test_loss: 0.9110, test_f1: 0.6071
 epoch: 31, train_loss: 0.7805, test_loss: 0.8980, test_f1: 0.5806
 epoch: 32, train_loss: 0.7893, test_loss: 0.8868, test_f1: 0.5864
 epoch: 33, train_loss: 0.7686, test_loss: 0.9316, test_f1: 0.5851
 epoch: 34, train_loss: 0.7697, test_loss: 0.9199, test_f1: 0.6092
 epoch: 35, train_loss: 0.7727, test_loss: 0.9180, test_f1: 0.5818
 epoch: 36, train_loss: 0.7575, test_loss: 0.9333, test_f1: 0.5983
 epoch: 37, train_loss: 0.7664, test_loss: 0.8802, test_f1: 0.5897
 epoch: 38, train_loss: 0.7570, test_loss: 0.9454, test_f1: 0.6001
 epoch: 39, train_loss: 0.7467, test_loss: 0.9269, test_f1: 0.5914
 epoch: 40, train_loss: 0.7390, test_loss: 0.9193, test_f1: 0.6185
 epoch: 41, train_loss: 0.7698, test_loss: 0.9058, test_f1: 0.5808
 epoch: 42, train_loss: 0.7517, test_loss: 0.9085, test_f1: 0.5935
 epoch: 43, train_loss: 0.7243, test_loss: 0.9185, test_f1: 0.6127
 epoch: 44, train_loss: 0.7287, test_loss: 0.9230, test_f1: 0.6005
 epoch: 45, train_loss: 0.7241, test_loss: 0.9103, test_f1: 0.6060
 epoch: 46, train_loss: 0.7335, test_loss: 0.9199, test_f1: 0.6284
 epoch: 47, train_loss: 0.7105, test_loss: 0.9176, test_f1: 0.6230
 epoch: 48, train_loss: 0.7102, test_loss: 0.9408, test_f1: 0.6242
 epoch: 49, train_loss: 0.7207, test_loss: 0.9501, test_f1: 0.6251
 epoch: 50, train_loss: 0.7109, test_loss: 0.9343, test_f1: 0.5916
 epoch: 51, train_loss: 0.7036, test_loss: 0.9272, test_f1: 0.6151
 epoch: 52, train_loss: 0.6993, test_loss: 0.9371, test_f1: 0.6010
 epoch: 53, train_loss: 0.7046, test_loss: 0.9252, test_f1: 0.6064
 epoch: 54, train_loss: 0.6929, test_loss: 0.9434, test_f1: 0.6107
 epoch: 55, train_loss: 0.6951, test_loss: 0.9297, test_f1: 0.6292
 epoch: 56, train_loss: 0.6917, test_loss: 0.9557, test_f1: 0.6234
 epoch: 57, train_loss: 0.6901, test_loss: 0.9281, test_f1: 0.6236
 epoch: 58, train_loss: 0.6749, test_loss: 0.9393, test_f1: 0.6287
 epoch: 59, train_loss: 0.6812, test_loss: 0.9358, test_f1: 0.6077
 epoch: 60, train_loss: 0.6773, test_loss: 0.9577, test_f1: 0.6049
 epoch: 61, train_loss: 0.6743, test_loss: 0.9387, test_f1: 0.6357
 epoch: 62, train_loss: 0.6726, test_loss: 0.9426, test_f1: 0.6158
 epoch: 63, train_loss: 0.6720, test_loss: 0.9541, test_f1: 0.6085
 epoch: 64, train_loss: 0.6680, test_loss: 0.9525, test_f1: 0.6194
 epoch: 65, train_loss: 0.6678, test_loss: 0.9502, test_f1: 0.6504
 epoch: 66, train_loss: 0.6782, test_loss: 0.9253, test_f1: 0.6468
 epoch: 67, train_loss: 0.6678, test_loss: 0.9512, test_f1: 0.6532
 epoch: 68, train_loss: 0.6660, test_loss: 0.9354, test_f1: 0.6458
 epoch: 69, train_loss: 0.6726, test_loss: 0.9598, test_f1: 0.6441
 epoch: 70, train_loss: 0.6544, test_loss: 0.9493, test_f1: 0.6267
 epoch: 71, train_loss: 0.6550, test_loss: 0.9494, test_f1: 0.6290
 epoch: 72, train_loss: 0.6574, test_loss: 0.9391, test_f1: 0.6360
 epoch: 73, train_loss: 0.6522, test_loss: 0.9340, test_f1: 0.6287
 epoch: 74, train_loss: 0.6468, test_loss: 0.9489, test_f1: 0.6393
 epoch: 75, train_loss: 0.6627, test_loss: 0.9467, test_f1: 0.6195
 epoch: 76, train_loss: 0.6499, test_loss: 0.9402, test_f1: 0.6463
 epoch: 77, train_loss: 0.6575, test_loss: 0.9269, test_f1: 0.6554
 epoch: 78, train_loss: 0.6471, test_loss: 0.9404, test_f1: 0.6676
 epoch: 79, train_loss: 0.6441, test_loss: 0.9580, test_f1: 0.6392
 epoch: 80, train_loss: 0.6495, test_loss: 0.9447, test_f1: 0.6389
 epoch: 81, train_loss: 0.6479, test_loss: 0.9464, test_f1: 0.6444
 epoch: 82, train_loss: 0.6451, test_loss: 0.9701, test_f1: 0.6358
 epoch: 83, train_loss: 0.6507, test_loss: 0.9603, test_f1: 0.6435
 epoch: 84, train_loss: 0.6418, test_loss: 0.9570, test_f1: 0.6369
 epoch: 85, train_loss: 0.6388, test_loss: 0.9410, test_f1: 0.6541
 epoch: 86, train_loss: 0.6315, test_loss: 0.9530, test_f1: 0.6208
 epoch: 87, train_loss: 0.6306, test_loss: 0.9514, test_f1: 0.6383
 epoch: 88, train_loss: 0.6316, test_loss: 0.9832, test_f1: 0.6572
 epoch: 89, train_loss: 0.6228, test_loss: 0.9626, test_f1: 0.6334
 epoch: 90, train_loss: 0.6208, test_loss: 0.9650, test_f1: 0.6465
 epoch: 91, train_loss: 0.6106, test_loss: 0.9770, test_f1: 0.6742
 epoch: 92, train_loss: 0.6360, test_loss: 0.9703, test_f1: 0.6529
 epoch: 93, train_loss: 0.6196, test_loss: 0.9859, test_f1: 0.6583
 epoch: 94, train_loss: 0.6269, test_loss: 0.9578, test_f1: 0.6511
 epoch: 95, train_loss: 0.6242, test_loss: 0.9526, test_f1: 0.6277
 epoch: 96, train_loss: 0.6119, test_loss: 0.9785, test_f1: 0.6660
 epoch: 97, train_loss: 0.6216, test_loss: 0.9999, test_f1: 0.6510
 epoch: 98, train_loss: 0.6053, test_loss: 1.0149, test_f1: 0.6393
 epoch: 99, train_loss: 0.6088, test_loss: 0.9789, test_f1: 0.6613
##################ITERATION #9 ****************************************
 epoch: 0, train_loss: 1.3169, test_loss: 1.0838, test_f1: 0.4123
 epoch: 1, train_loss: 1.1183, test_loss: 0.9969, test_f1: 0.4786
 epoch: 2, train_loss: 1.0869, test_loss: 0.9934, test_f1: 0.4684
 epoch: 3, train_loss: 1.0438, test_loss: 0.9706, test_f1: 0.4644
 epoch: 4, train_loss: 1.0115, test_loss: 0.9598, test_f1: 0.4772
 epoch: 5, train_loss: 0.9896, test_loss: 0.9524, test_f1: 0.5126
 epoch: 6, train_loss: 0.9789, test_loss: 0.9382, test_f1: 0.4972
 epoch: 7, train_loss: 0.9679, test_loss: 0.9270, test_f1: 0.4999
 epoch: 8, train_loss: 0.9534, test_loss: 0.9322, test_f1: 0.5110
 epoch: 9, train_loss: 0.9405, test_loss: 0.9277, test_f1: 0.5238
 epoch: 10, train_loss: 0.9218, test_loss: 0.9238, test_f1: 0.5217
 epoch: 11, train_loss: 0.9181, test_loss: 0.9202, test_f1: 0.5378
 epoch: 12, train_loss: 0.9150, test_loss: 0.9133, test_f1: 0.5379
 epoch: 13, train_loss: 0.9103, test_loss: 0.9014, test_f1: 0.5411
 epoch: 14, train_loss: 0.8916, test_loss: 0.9123, test_f1: 0.5441
 epoch: 15, train_loss: 0.8811, test_loss: 0.8992, test_f1: 0.5455
 epoch: 16, train_loss: 0.8814, test_loss: 0.8998, test_f1: 0.5418
 epoch: 17, train_loss: 0.8638, test_loss: 0.9211, test_f1: 0.5144
 epoch: 18, train_loss: 0.8661, test_loss: 0.9134, test_f1: 0.5378
 epoch: 19, train_loss: 0.8514, test_loss: 0.8834, test_f1: 0.5299
 epoch: 20, train_loss: 0.8382, test_loss: 0.8876, test_f1: 0.5412
 epoch: 21, train_loss: 0.8253, test_loss: 0.8963, test_f1: 0.5437
 epoch: 22, train_loss: 0.8270, test_loss: 0.8962, test_f1: 0.5496
 epoch: 23, train_loss: 0.8256, test_loss: 0.8777, test_f1: 0.5672
 epoch: 24, train_loss: 0.8255, test_loss: 0.8707, test_f1: 0.5669
 epoch: 25, train_loss: 0.8180, test_loss: 0.8996, test_f1: 0.5572
 epoch: 26, train_loss: 0.8162, test_loss: 0.8915, test_f1: 0.5450
 epoch: 27, train_loss: 0.7961, test_loss: 0.8861, test_f1: 0.5440
 epoch: 28, train_loss: 0.8027, test_loss: 0.8750, test_f1: 0.5662
 epoch: 29, train_loss: 0.7889, test_loss: 0.8813, test_f1: 0.5682
 epoch: 30, train_loss: 0.7889, test_loss: 0.8687, test_f1: 0.5812
 epoch: 31, train_loss: 0.7803, test_loss: 0.8793, test_f1: 0.5972
 epoch: 32, train_loss: 0.7820, test_loss: 0.9046, test_f1: 0.5555
 epoch: 33, train_loss: 0.7778, test_loss: 0.8843, test_f1: 0.5747
 epoch: 34, train_loss: 0.7675, test_loss: 0.8586, test_f1: 0.5813
 epoch: 35, train_loss: 0.7700, test_loss: 0.9030, test_f1: 0.5588
 epoch: 36, train_loss: 0.7602, test_loss: 0.9004, test_f1: 0.5839
 epoch: 37, train_loss: 0.7636, test_loss: 0.8865, test_f1: 0.5767
 epoch: 38, train_loss: 0.7588, test_loss: 0.8966, test_f1: 0.5707
 epoch: 39, train_loss: 0.7530, test_loss: 0.8940, test_f1: 0.5564
 epoch: 40, train_loss: 0.7481, test_loss: 0.8858, test_f1: 0.5631
 epoch: 41, train_loss: 0.7431, test_loss: 0.9271, test_f1: 0.5700
 epoch: 42, train_loss: 0.7425, test_loss: 0.9148, test_f1: 0.5738
 epoch: 43, train_loss: 0.7284, test_loss: 0.8996, test_f1: 0.5907
 epoch: 44, train_loss: 0.7227, test_loss: 0.9137, test_f1: 0.5739
 epoch: 45, train_loss: 0.7322, test_loss: 0.9137, test_f1: 0.5822
 epoch: 46, train_loss: 0.7198, test_loss: 0.8686, test_f1: 0.6065
 epoch: 47, train_loss: 0.7203, test_loss: 0.9133, test_f1: 0.5899
 epoch: 48, train_loss: 0.7274, test_loss: 0.9258, test_f1: 0.5712
 epoch: 49, train_loss: 0.7077, test_loss: 0.9113, test_f1: 0.5897
 epoch: 50, train_loss: 0.7148, test_loss: 0.8993, test_f1: 0.6252
 epoch: 51, train_loss: 0.7110, test_loss: 0.9035, test_f1: 0.5968
 epoch: 52, train_loss: 0.6969, test_loss: 0.9226, test_f1: 0.6005
 epoch: 53, train_loss: 0.6903, test_loss: 0.9144, test_f1: 0.5861
 epoch: 54, train_loss: 0.6890, test_loss: 0.9208, test_f1: 0.6119
 epoch: 55, train_loss: 0.6982, test_loss: 0.9037, test_f1: 0.6155
 epoch: 56, train_loss: 0.6912, test_loss: 0.9298, test_f1: 0.5917
 epoch: 57, train_loss: 0.6903, test_loss: 0.9147, test_f1: 0.5918
 epoch: 58, train_loss: 0.6763, test_loss: 0.9134, test_f1: 0.6061
 epoch: 59, train_loss: 0.6789, test_loss: 0.9096, test_f1: 0.5936
 epoch: 60, train_loss: 0.6833, test_loss: 0.9053, test_f1: 0.6050
 epoch: 61, train_loss: 0.6846, test_loss: 0.9362, test_f1: 0.5932
 epoch: 62, train_loss: 0.6734, test_loss: 0.9242, test_f1: 0.6223
 epoch: 63, train_loss: 0.6830, test_loss: 0.9127, test_f1: 0.6289
 epoch: 64, train_loss: 0.6784, test_loss: 0.9059, test_f1: 0.6125
 epoch: 65, train_loss: 0.6843, test_loss: 0.9287, test_f1: 0.6186
 epoch: 66, train_loss: 0.6659, test_loss: 0.9228, test_f1: 0.6186
 epoch: 67, train_loss: 0.6672, test_loss: 0.9055, test_f1: 0.6402
 epoch: 68, train_loss: 0.6700, test_loss: 0.9179, test_f1: 0.6204
 epoch: 69, train_loss: 0.6700, test_loss: 0.9089, test_f1: 0.6064
 epoch: 70, train_loss: 0.6493, test_loss: 0.9280, test_f1: 0.6202
 epoch: 71, train_loss: 0.6579, test_loss: 0.9020, test_f1: 0.6122
 epoch: 72, train_loss: 0.6582, test_loss: 0.9344, test_f1: 0.5864
 epoch: 73, train_loss: 0.6669, test_loss: 0.9252, test_f1: 0.5966
 epoch: 74, train_loss: 0.6561, test_loss: 0.9316, test_f1: 0.5988
 epoch: 75, train_loss: 0.6578, test_loss: 0.9301, test_f1: 0.6002
 epoch: 76, train_loss: 0.6451, test_loss: 0.9265, test_f1: 0.6000
 epoch: 77, train_loss: 0.6535, test_loss: 0.9315, test_f1: 0.6045
 epoch: 78, train_loss: 0.6444, test_loss: 0.9288, test_f1: 0.6146
 epoch: 79, train_loss: 0.6470, test_loss: 0.9360, test_f1: 0.6080
 epoch: 80, train_loss: 0.6380, test_loss: 0.9283, test_f1: 0.6109
 epoch: 81, train_loss: 0.6388, test_loss: 0.9287, test_f1: 0.6200
 epoch: 82, train_loss: 0.6507, test_loss: 0.9257, test_f1: 0.6289
 epoch: 83, train_loss: 0.6385, test_loss: 0.9367, test_f1: 0.6186
 epoch: 84, train_loss: 0.6411, test_loss: 0.9315, test_f1: 0.6233
 epoch: 85, train_loss: 0.6392, test_loss: 0.9447, test_f1: 0.6142
 epoch: 86, train_loss: 0.6390, test_loss: 0.9203, test_f1: 0.6261
 epoch: 87, train_loss: 0.6382, test_loss: 0.9208, test_f1: 0.6563
 epoch: 88, train_loss: 0.6303, test_loss: 0.9142, test_f1: 0.6324
 epoch: 89, train_loss: 0.6343, test_loss: 0.9307, test_f1: 0.6132
 epoch: 90, train_loss: 0.6294, test_loss: 0.9410, test_f1: 0.6144
 epoch: 91, train_loss: 0.6267, test_loss: 0.9573, test_f1: 0.6141
 epoch: 92, train_loss: 0.6216, test_loss: 0.9646, test_f1: 0.6191
 epoch: 93, train_loss: 0.6329, test_loss: 0.9338, test_f1: 0.6245
 epoch: 94, train_loss: 0.6229, test_loss: 0.9479, test_f1: 0.6090
 epoch: 95, train_loss: 0.6284, test_loss: 0.9542, test_f1: 0.6030
 epoch: 96, train_loss: 0.6209, test_loss: 0.9375, test_f1: 0.6032
 epoch: 97, train_loss: 0.6139, test_loss: 0.9389, test_f1: 0.6040
 epoch: 98, train_loss: 0.6049, test_loss: 0.9405, test_f1: 0.6233
 epoch: 99, train_loss: 0.6199, test_loss: 0.9434, test_f1: 0.6137

Training completed in 560.70 seconds
Best F1: 0.6742 at epoch 91
Mean F1 across iterations: 0.6484  0.0126
========================FINAL RESULTS================================
FEGIN weighted F1: 0.6742  0.0126
python main.py --data ltspice_examples --representation component_net --model FEGIN --layers 2 --hiddens 128 --batch_size 64 --lr 0.0001 --emb_size 128 --epochs 100 --save_appendix component_net_L2_H128_BS64_LR0.0001_E128 --no_val
-----



STDERR:
  File "main.py", line 370, in <module>
    main()
  File "main.py", line 254, in main
    dataset = dataset_class(
  File "/home/philip/projects/ltspice_examples_code_repo/Circuit-Completion-Using-GNNs/component_classification_with_link_prediction_head/evaluation/FEGIN/kernel/circuit_datasets.py", line 15, in __init__
    self.data, self.slices = torch.load(self.processed_paths[0])
  File "/home/philip/.local/lib/python3.8/site-packages/torch/serialization.py", line 1040, in load
    warnings.warn(
  File "/usr/lib/python3.8/warnings.py", line 109, in _showwarnmsg
    sw(msg.message, msg.category, msg.filename, msg.lineno,
  File "main.py", line 47, in warn_with_traceback
    traceback.print_stack(file=log)
/home/philip/projects/ltspice_examples_code_repo/Circuit-Completion-Using-GNNs/component_classification_with_link_prediction_head/evaluation/FEGIN/kernel/circuit_datasets.py:15: FutureWarning: You are using `torch.load` with `weights_only=False` (the current default value), which uses the default pickle module implicitly. It is possible to construct malicious pickle data which will execute arbitrary code during unpickling (See https://github.com/pytorch/pytorch/blob/main/SECURITY.md#untrusted-models for more details). In a future release, the default value for `weights_only` will be flipped to `True`. This limits the functions that could be executed during unpickling. Arbitrary objects will no longer be allowed to be loaded via this mode unless they are explicitly allowlisted by the user via `torch.serialization.add_safe_globals`. We recommend you start setting `weights_only=True` for any use case where you don't have full control of the loaded file. Please open an issue on GitHub for any issues related to this experimental feature.
  self.data, self.slices = torch.load(self.processed_paths[0])
