STDOUT:
Results will be saved in /home/philip/projects/ltspice_examples_code_repo/Circuit-Completion-Using-GNNs/component_classification_with_link_prediction_head/evaluation/FEGIN/results/model_FEGIN_dataset_ltspice_examples
Command line input: python main.py --data ltspice_examples --representation component_net --model FEGIN --layers 6 --hiddens 64 --batch_size 256 --lr 0.0001 --emb_size 512 --epochs 100 --save_appendix component_net_L6_H64_BS256_LR0.0001_E512 --no_val
 is saved.
-----
ltspice_examples - FEGIN
Using 6 layers, 64 hidden units, h = 2
Loading component_net representation dataset
ENTERED
Training FEGIN on component_net representation
Train: 3558, Test: 846
##################ITERATION #0 ****************************************
 epoch: 0, train_loss: 1.3994, test_loss: 1.3987, test_f1: 0.0793
 epoch: 1, train_loss: 1.3881, test_loss: 1.3938, test_f1: 0.0793
 epoch: 2, train_loss: 1.3800, test_loss: 1.3858, test_f1: 0.0793
 epoch: 3, train_loss: 1.3715, test_loss: 1.3748, test_f1: 0.0793
 epoch: 4, train_loss: 1.3605, test_loss: 1.3574, test_f1: 0.1651
 epoch: 5, train_loss: 1.3490, test_loss: 1.3404, test_f1: 0.2115
 epoch: 6, train_loss: 1.3362, test_loss: 1.3237, test_f1: 0.2276
 epoch: 7, train_loss: 1.3219, test_loss: 1.3067, test_f1: 0.2590
 epoch: 8, train_loss: 1.3076, test_loss: 1.2901, test_f1: 0.3191
 epoch: 9, train_loss: 1.2933, test_loss: 1.2752, test_f1: 0.3456
 epoch: 10, train_loss: 1.2782, test_loss: 1.2611, test_f1: 0.3333
 epoch: 11, train_loss: 1.2647, test_loss: 1.2458, test_f1: 0.3194
 epoch: 12, train_loss: 1.2519, test_loss: 1.2308, test_f1: 0.3151
 epoch: 13, train_loss: 1.2411, test_loss: 1.2199, test_f1: 0.2789
 epoch: 14, train_loss: 1.2288, test_loss: 1.2063, test_f1: 0.2904
 epoch: 15, train_loss: 1.2186, test_loss: 1.1964, test_f1: 0.2904
 epoch: 16, train_loss: 1.2116, test_loss: 1.1834, test_f1: 0.2995
 epoch: 17, train_loss: 1.2012, test_loss: 1.1764, test_f1: 0.3059
 epoch: 18, train_loss: 1.1902, test_loss: 1.1633, test_f1: 0.3178
 epoch: 19, train_loss: 1.1783, test_loss: 1.1540, test_f1: 0.3210
 epoch: 20, train_loss: 1.1664, test_loss: 1.1432, test_f1: 0.3276
 epoch: 21, train_loss: 1.1589, test_loss: 1.1323, test_f1: 0.3403
 epoch: 22, train_loss: 1.1500, test_loss: 1.1245, test_f1: 0.3540
 epoch: 23, train_loss: 1.1370, test_loss: 1.1136, test_f1: 0.3852
 epoch: 24, train_loss: 1.1255, test_loss: 1.1047, test_f1: 0.4381
 epoch: 25, train_loss: 1.1153, test_loss: 1.0915, test_f1: 0.4349
 epoch: 26, train_loss: 1.1059, test_loss: 1.0814, test_f1: 0.4702
 epoch: 27, train_loss: 1.0976, test_loss: 1.0753, test_f1: 0.4538
 epoch: 28, train_loss: 1.0830, test_loss: 1.0665, test_f1: 0.5012
 epoch: 29, train_loss: 1.0724, test_loss: 1.0602, test_f1: 0.4927
 epoch: 30, train_loss: 1.0658, test_loss: 1.0463, test_f1: 0.5303
 epoch: 31, train_loss: 1.0511, test_loss: 1.0402, test_f1: 0.5378
 epoch: 32, train_loss: 1.0476, test_loss: 1.0268, test_f1: 0.5183
 epoch: 33, train_loss: 1.0337, test_loss: 1.0188, test_f1: 0.5308
 epoch: 34, train_loss: 1.0247, test_loss: 1.0082, test_f1: 0.5291
 epoch: 35, train_loss: 1.0123, test_loss: 1.0010, test_f1: 0.5283
 epoch: 36, train_loss: 1.0012, test_loss: 0.9943, test_f1: 0.5157
 epoch: 37, train_loss: 0.9947, test_loss: 0.9899, test_f1: 0.5202
 epoch: 38, train_loss: 0.9833, test_loss: 0.9760, test_f1: 0.5225
 epoch: 39, train_loss: 0.9712, test_loss: 0.9625, test_f1: 0.5333
 epoch: 40, train_loss: 0.9649, test_loss: 0.9599, test_f1: 0.5396
 epoch: 41, train_loss: 0.9598, test_loss: 0.9461, test_f1: 0.5409
 epoch: 42, train_loss: 0.9374, test_loss: 0.9440, test_f1: 0.5380
 epoch: 43, train_loss: 0.9281, test_loss: 0.9370, test_f1: 0.5561
 epoch: 44, train_loss: 0.9208, test_loss: 0.9343, test_f1: 0.5485
 epoch: 45, train_loss: 0.9117, test_loss: 0.9160, test_f1: 0.5596
 epoch: 46, train_loss: 0.9001, test_loss: 0.9091, test_f1: 0.5637
 epoch: 47, train_loss: 0.8942, test_loss: 0.9165, test_f1: 0.5429
 epoch: 48, train_loss: 0.8886, test_loss: 0.8996, test_f1: 0.5629
 epoch: 49, train_loss: 0.8782, test_loss: 0.9270, test_f1: 0.5418
 epoch: 50, train_loss: 0.8828, test_loss: 0.8975, test_f1: 0.5671
 epoch: 51, train_loss: 0.8687, test_loss: 0.8946, test_f1: 0.5724
 epoch: 52, train_loss: 0.8625, test_loss: 0.8988, test_f1: 0.5684
 epoch: 53, train_loss: 0.8576, test_loss: 0.8883, test_f1: 0.5746
 epoch: 54, train_loss: 0.8469, test_loss: 0.8869, test_f1: 0.5704
 epoch: 55, train_loss: 0.8594, test_loss: 0.8890, test_f1: 0.5799
 epoch: 56, train_loss: 0.8443, test_loss: 0.8907, test_f1: 0.5631
 epoch: 57, train_loss: 0.8409, test_loss: 0.8916, test_f1: 0.5605
 epoch: 58, train_loss: 0.8428, test_loss: 0.8909, test_f1: 0.5700
 epoch: 59, train_loss: 0.8409, test_loss: 0.8867, test_f1: 0.5769
 epoch: 60, train_loss: 0.8422, test_loss: 0.8931, test_f1: 0.5759
 epoch: 61, train_loss: 0.8207, test_loss: 0.8865, test_f1: 0.5801
 epoch: 62, train_loss: 0.8326, test_loss: 0.8823, test_f1: 0.5838
 epoch: 63, train_loss: 0.8246, test_loss: 0.8907, test_f1: 0.5787
 epoch: 64, train_loss: 0.8195, test_loss: 0.8846, test_f1: 0.5765
 epoch: 65, train_loss: 0.8205, test_loss: 0.8814, test_f1: 0.5820
 epoch: 66, train_loss: 0.8136, test_loss: 0.8815, test_f1: 0.5830
 epoch: 67, train_loss: 0.8056, test_loss: 0.8839, test_f1: 0.5803
 epoch: 68, train_loss: 0.8105, test_loss: 0.8786, test_f1: 0.5725
 epoch: 69, train_loss: 0.8155, test_loss: 0.8873, test_f1: 0.5580
 epoch: 70, train_loss: 0.8086, test_loss: 0.8788, test_f1: 0.5730
 epoch: 71, train_loss: 0.7974, test_loss: 0.8827, test_f1: 0.5758
 epoch: 72, train_loss: 0.8075, test_loss: 0.8729, test_f1: 0.5727
 epoch: 73, train_loss: 0.7976, test_loss: 0.8830, test_f1: 0.5483
 epoch: 74, train_loss: 0.8033, test_loss: 0.8841, test_f1: 0.5603
 epoch: 75, train_loss: 0.8018, test_loss: 0.8879, test_f1: 0.5504
 epoch: 76, train_loss: 0.7917, test_loss: 0.8829, test_f1: 0.5834
 epoch: 77, train_loss: 0.8075, test_loss: 0.8893, test_f1: 0.5728
 epoch: 78, train_loss: 0.8001, test_loss: 0.8938, test_f1: 0.5503
 epoch: 79, train_loss: 0.7992, test_loss: 0.8831, test_f1: 0.5596
 epoch: 80, train_loss: 0.7820, test_loss: 0.8904, test_f1: 0.5419
 epoch: 81, train_loss: 0.7873, test_loss: 0.8847, test_f1: 0.5625
 epoch: 82, train_loss: 0.7846, test_loss: 0.8741, test_f1: 0.5645
 epoch: 83, train_loss: 0.7886, test_loss: 0.8826, test_f1: 0.5562
 epoch: 84, train_loss: 0.7794, test_loss: 0.8866, test_f1: 0.5627
 epoch: 85, train_loss: 0.7828, test_loss: 0.8900, test_f1: 0.5620
 epoch: 86, train_loss: 0.7861, test_loss: 0.8670, test_f1: 0.5473
 epoch: 87, train_loss: 0.7711, test_loss: 0.8833, test_f1: 0.5636
 epoch: 88, train_loss: 0.7813, test_loss: 0.8913, test_f1: 0.5558
 epoch: 89, train_loss: 0.7672, test_loss: 0.8931, test_f1: 0.5538
 epoch: 90, train_loss: 0.7788, test_loss: 0.8917, test_f1: 0.5534
 epoch: 91, train_loss: 0.7685, test_loss: 0.8908, test_f1: 0.5473
 epoch: 92, train_loss: 0.7641, test_loss: 0.8923, test_f1: 0.5469
 epoch: 93, train_loss: 0.7611, test_loss: 0.8934, test_f1: 0.5632
 epoch: 94, train_loss: 0.7633, test_loss: 0.8966, test_f1: 0.5553
 epoch: 95, train_loss: 0.7673, test_loss: 0.8948, test_f1: 0.5572
 epoch: 96, train_loss: 0.7596, test_loss: 0.8980, test_f1: 0.5590
 epoch: 97, train_loss: 0.7596, test_loss: 0.9005, test_f1: 0.5517
 epoch: 98, train_loss: 0.7607, test_loss: 0.9028, test_f1: 0.5482
 epoch: 99, train_loss: 0.7601, test_loss: 0.8924, test_f1: 0.5564
##################ITERATION #1 ****************************************
 epoch: 0, train_loss: 1.3578, test_loss: 1.3850, test_f1: 0.1004
 epoch: 1, train_loss: 1.3252, test_loss: 1.3691, test_f1: 0.2400
 epoch: 2, train_loss: 1.3077, test_loss: 1.3370, test_f1: 0.2578
 epoch: 3, train_loss: 1.2888, test_loss: 1.3111, test_f1: 0.2567
 epoch: 4, train_loss: 1.2679, test_loss: 1.2751, test_f1: 0.2587
 epoch: 5, train_loss: 1.2498, test_loss: 1.2399, test_f1: 0.3290
 epoch: 6, train_loss: 1.2305, test_loss: 1.2100, test_f1: 0.3631
 epoch: 7, train_loss: 1.2159, test_loss: 1.1876, test_f1: 0.3772
 epoch: 8, train_loss: 1.1978, test_loss: 1.1651, test_f1: 0.3915
 epoch: 9, train_loss: 1.1827, test_loss: 1.1493, test_f1: 0.3905
 epoch: 10, train_loss: 1.1654, test_loss: 1.1248, test_f1: 0.4138
 epoch: 11, train_loss: 1.1472, test_loss: 1.1068, test_f1: 0.4200
 epoch: 12, train_loss: 1.1338, test_loss: 1.0956, test_f1: 0.4121
 epoch: 13, train_loss: 1.1140, test_loss: 1.0712, test_f1: 0.4356
 epoch: 14, train_loss: 1.1012, test_loss: 1.0553, test_f1: 0.4457
 epoch: 15, train_loss: 1.0846, test_loss: 1.0404, test_f1: 0.4476
 epoch: 16, train_loss: 1.0773, test_loss: 1.0280, test_f1: 0.4858
 epoch: 17, train_loss: 1.0585, test_loss: 1.0136, test_f1: 0.4799
 epoch: 18, train_loss: 1.0467, test_loss: 1.0035, test_f1: 0.4942
 epoch: 19, train_loss: 1.0370, test_loss: 0.9939, test_f1: 0.4977
 epoch: 20, train_loss: 1.0182, test_loss: 0.9858, test_f1: 0.4860
 epoch: 21, train_loss: 1.0086, test_loss: 0.9766, test_f1: 0.4915
 epoch: 22, train_loss: 0.9958, test_loss: 0.9630, test_f1: 0.4952
 epoch: 23, train_loss: 0.9873, test_loss: 0.9570, test_f1: 0.4875
 epoch: 24, train_loss: 0.9691, test_loss: 0.9514, test_f1: 0.4950
 epoch: 25, train_loss: 0.9616, test_loss: 0.9460, test_f1: 0.4943
 epoch: 26, train_loss: 0.9499, test_loss: 0.9417, test_f1: 0.5024
 epoch: 27, train_loss: 0.9394, test_loss: 0.9350, test_f1: 0.4902
 epoch: 28, train_loss: 0.9305, test_loss: 0.9330, test_f1: 0.5013
 epoch: 29, train_loss: 0.9245, test_loss: 0.9347, test_f1: 0.5062
 epoch: 30, train_loss: 0.9062, test_loss: 0.9279, test_f1: 0.5173
 epoch: 31, train_loss: 0.9068, test_loss: 0.9178, test_f1: 0.5103
 epoch: 32, train_loss: 0.8962, test_loss: 0.9193, test_f1: 0.5181
 epoch: 33, train_loss: 0.8763, test_loss: 0.9026, test_f1: 0.5128
 epoch: 34, train_loss: 0.8858, test_loss: 0.9183, test_f1: 0.5198
 epoch: 35, train_loss: 0.8673, test_loss: 0.9117, test_f1: 0.5204
 epoch: 36, train_loss: 0.8644, test_loss: 0.9114, test_f1: 0.5133
 epoch: 37, train_loss: 0.8618, test_loss: 0.9167, test_f1: 0.5322
 epoch: 38, train_loss: 0.8543, test_loss: 0.9100, test_f1: 0.5309
 epoch: 39, train_loss: 0.8470, test_loss: 0.9159, test_f1: 0.5302
 epoch: 40, train_loss: 0.8439, test_loss: 0.9237, test_f1: 0.5228
 epoch: 41, train_loss: 0.8435, test_loss: 0.9058, test_f1: 0.5275
 epoch: 42, train_loss: 0.8289, test_loss: 0.9271, test_f1: 0.5164
 epoch: 43, train_loss: 0.8228, test_loss: 0.9140, test_f1: 0.5268
 epoch: 44, train_loss: 0.8149, test_loss: 0.9062, test_f1: 0.5318
 epoch: 45, train_loss: 0.8250, test_loss: 0.9117, test_f1: 0.5250
 epoch: 46, train_loss: 0.8050, test_loss: 0.9085, test_f1: 0.5255
 epoch: 47, train_loss: 0.8117, test_loss: 0.9161, test_f1: 0.5302
 epoch: 48, train_loss: 0.7982, test_loss: 0.9165, test_f1: 0.5427
 epoch: 49, train_loss: 0.7974, test_loss: 0.9106, test_f1: 0.5395
 epoch: 50, train_loss: 0.7969, test_loss: 0.9241, test_f1: 0.5375
 epoch: 51, train_loss: 0.7909, test_loss: 0.9209, test_f1: 0.5472
 epoch: 52, train_loss: 0.7791, test_loss: 0.9209, test_f1: 0.5363
 epoch: 53, train_loss: 0.7813, test_loss: 0.9245, test_f1: 0.5310
 epoch: 54, train_loss: 0.7722, test_loss: 0.9195, test_f1: 0.5429
 epoch: 55, train_loss: 0.7718, test_loss: 0.9148, test_f1: 0.5490
 epoch: 56, train_loss: 0.7756, test_loss: 0.9258, test_f1: 0.5418
 epoch: 57, train_loss: 0.7722, test_loss: 0.9284, test_f1: 0.5420
 epoch: 58, train_loss: 0.7754, test_loss: 0.9270, test_f1: 0.5446
 epoch: 59, train_loss: 0.7669, test_loss: 0.9173, test_f1: 0.5405
 epoch: 60, train_loss: 0.7658, test_loss: 0.9323, test_f1: 0.5370
 epoch: 61, train_loss: 0.7664, test_loss: 0.9374, test_f1: 0.5472
 epoch: 62, train_loss: 0.7624, test_loss: 0.9238, test_f1: 0.5472
 epoch: 63, train_loss: 0.7647, test_loss: 0.9258, test_f1: 0.5490
 epoch: 64, train_loss: 0.7649, test_loss: 0.9260, test_f1: 0.5542
 epoch: 65, train_loss: 0.7571, test_loss: 0.9352, test_f1: 0.5527
 epoch: 66, train_loss: 0.7443, test_loss: 0.9360, test_f1: 0.5454
 epoch: 67, train_loss: 0.7450, test_loss: 0.9261, test_f1: 0.5469
 epoch: 68, train_loss: 0.7558, test_loss: 0.9358, test_f1: 0.5545
 epoch: 69, train_loss: 0.7558, test_loss: 0.9344, test_f1: 0.5513
 epoch: 70, train_loss: 0.7450, test_loss: 0.9324, test_f1: 0.5508
 epoch: 71, train_loss: 0.7462, test_loss: 0.9338, test_f1: 0.5410
 epoch: 72, train_loss: 0.7527, test_loss: 0.9425, test_f1: 0.5376
 epoch: 73, train_loss: 0.7444, test_loss: 0.9453, test_f1: 0.5398
 epoch: 74, train_loss: 0.7441, test_loss: 0.9416, test_f1: 0.5437
 epoch: 75, train_loss: 0.7428, test_loss: 0.9361, test_f1: 0.5634
 epoch: 76, train_loss: 0.7473, test_loss: 0.9268, test_f1: 0.5626
 epoch: 77, train_loss: 0.7378, test_loss: 0.9367, test_f1: 0.5514
 epoch: 78, train_loss: 0.7303, test_loss: 0.9429, test_f1: 0.5487
 epoch: 79, train_loss: 0.7303, test_loss: 0.9498, test_f1: 0.5394
 epoch: 80, train_loss: 0.7302, test_loss: 0.9301, test_f1: 0.5517
 epoch: 81, train_loss: 0.7246, test_loss: 0.9279, test_f1: 0.5458
 epoch: 82, train_loss: 0.7382, test_loss: 0.9302, test_f1: 0.5534
 epoch: 83, train_loss: 0.7205, test_loss: 0.9497, test_f1: 0.5581
 epoch: 84, train_loss: 0.7304, test_loss: 0.9404, test_f1: 0.5636
 epoch: 85, train_loss: 0.7191, test_loss: 0.9499, test_f1: 0.5468
 epoch: 86, train_loss: 0.7240, test_loss: 0.9476, test_f1: 0.5666
 epoch: 87, train_loss: 0.7229, test_loss: 0.9612, test_f1: 0.5599
 epoch: 88, train_loss: 0.7249, test_loss: 0.9819, test_f1: 0.5377
 epoch: 89, train_loss: 0.7248, test_loss: 0.9328, test_f1: 0.5565
 epoch: 90, train_loss: 0.7249, test_loss: 0.9357, test_f1: 0.5576
 epoch: 91, train_loss: 0.7136, test_loss: 0.9510, test_f1: 0.5569
 epoch: 92, train_loss: 0.7133, test_loss: 0.9668, test_f1: 0.5534
 epoch: 93, train_loss: 0.7031, test_loss: 0.9475, test_f1: 0.5576
 epoch: 94, train_loss: 0.7116, test_loss: 0.9439, test_f1: 0.5649
 epoch: 95, train_loss: 0.7096, test_loss: 0.9781, test_f1: 0.5534
 epoch: 96, train_loss: 0.7156, test_loss: 0.9420, test_f1: 0.5673
 epoch: 97, train_loss: 0.7059, test_loss: 0.9502, test_f1: 0.5654
 epoch: 98, train_loss: 0.7029, test_loss: 0.9519, test_f1: 0.5640
 epoch: 99, train_loss: 0.7068, test_loss: 0.9480, test_f1: 0.5768
##################ITERATION #2 ****************************************
 epoch: 0, train_loss: 1.3071, test_loss: 1.3567, test_f1: 0.2270
 epoch: 1, train_loss: 1.2670, test_loss: 1.3230, test_f1: 0.2270
 epoch: 2, train_loss: 1.2461, test_loss: 1.2961, test_f1: 0.2270
 epoch: 3, train_loss: 1.2281, test_loss: 1.2783, test_f1: 0.2270
 epoch: 4, train_loss: 1.2099, test_loss: 1.2319, test_f1: 0.3148
 epoch: 5, train_loss: 1.1922, test_loss: 1.1919, test_f1: 0.3854
 epoch: 6, train_loss: 1.1750, test_loss: 1.1510, test_f1: 0.4126
 epoch: 7, train_loss: 1.1567, test_loss: 1.1264, test_f1: 0.4279
 epoch: 8, train_loss: 1.1396, test_loss: 1.1034, test_f1: 0.4376
 epoch: 9, train_loss: 1.1175, test_loss: 1.0853, test_f1: 0.4426
 epoch: 10, train_loss: 1.1001, test_loss: 1.0619, test_f1: 0.4490
 epoch: 11, train_loss: 1.0844, test_loss: 1.0473, test_f1: 0.4540
 epoch: 12, train_loss: 1.0717, test_loss: 1.0268, test_f1: 0.4634
 epoch: 13, train_loss: 1.0536, test_loss: 1.0174, test_f1: 0.4554
 epoch: 14, train_loss: 1.0447, test_loss: 1.0000, test_f1: 0.4798
 epoch: 15, train_loss: 1.0240, test_loss: 0.9926, test_f1: 0.4759
 epoch: 16, train_loss: 1.0137, test_loss: 0.9767, test_f1: 0.4917
 epoch: 17, train_loss: 1.0029, test_loss: 0.9680, test_f1: 0.4891
 epoch: 18, train_loss: 0.9909, test_loss: 0.9583, test_f1: 0.4871
 epoch: 19, train_loss: 0.9817, test_loss: 0.9590, test_f1: 0.4902
 epoch: 20, train_loss: 0.9715, test_loss: 0.9440, test_f1: 0.4918
 epoch: 21, train_loss: 0.9549, test_loss: 0.9416, test_f1: 0.4950
 epoch: 22, train_loss: 0.9481, test_loss: 0.9320, test_f1: 0.4880
 epoch: 23, train_loss: 0.9499, test_loss: 0.9334, test_f1: 0.5065
 epoch: 24, train_loss: 0.9335, test_loss: 0.9199, test_f1: 0.5086
 epoch: 25, train_loss: 0.9280, test_loss: 0.9313, test_f1: 0.5045
 epoch: 26, train_loss: 0.9223, test_loss: 0.9379, test_f1: 0.4898
 epoch: 27, train_loss: 0.9121, test_loss: 0.9317, test_f1: 0.4969
 epoch: 28, train_loss: 0.9095, test_loss: 0.9386, test_f1: 0.5090
 epoch: 29, train_loss: 0.9049, test_loss: 0.9282, test_f1: 0.5069
 epoch: 30, train_loss: 0.9038, test_loss: 0.9112, test_f1: 0.5197
 epoch: 31, train_loss: 0.8928, test_loss: 0.9335, test_f1: 0.5086
 epoch: 32, train_loss: 0.8768, test_loss: 0.9298, test_f1: 0.5183
 epoch: 33, train_loss: 0.8788, test_loss: 0.9277, test_f1: 0.5114
 epoch: 34, train_loss: 0.8706, test_loss: 0.9396, test_f1: 0.5099
 epoch: 35, train_loss: 0.8647, test_loss: 0.9240, test_f1: 0.5073
 epoch: 36, train_loss: 0.8680, test_loss: 0.9098, test_f1: 0.5241
 epoch: 37, train_loss: 0.8577, test_loss: 0.9244, test_f1: 0.5289
 epoch: 38, train_loss: 0.8591, test_loss: 0.9284, test_f1: 0.5139
 epoch: 39, train_loss: 0.8529, test_loss: 0.9288, test_f1: 0.5108
 epoch: 40, train_loss: 0.8521, test_loss: 0.9240, test_f1: 0.5059
 epoch: 41, train_loss: 0.8469, test_loss: 0.9360, test_f1: 0.5279
 epoch: 42, train_loss: 0.8531, test_loss: 0.9306, test_f1: 0.5070
 epoch: 43, train_loss: 0.8285, test_loss: 0.9211, test_f1: 0.5282
 epoch: 44, train_loss: 0.8253, test_loss: 0.9161, test_f1: 0.5171
 epoch: 45, train_loss: 0.8272, test_loss: 0.9349, test_f1: 0.5104
 epoch: 46, train_loss: 0.8256, test_loss: 0.9271, test_f1: 0.5097
 epoch: 47, train_loss: 0.8196, test_loss: 0.9472, test_f1: 0.5114
 epoch: 48, train_loss: 0.8121, test_loss: 0.9436, test_f1: 0.5076
 epoch: 49, train_loss: 0.8066, test_loss: 0.9464, test_f1: 0.5138
 epoch: 50, train_loss: 0.7995, test_loss: 0.9391, test_f1: 0.5330
 epoch: 51, train_loss: 0.7943, test_loss: 0.9392, test_f1: 0.5265
 epoch: 52, train_loss: 0.7908, test_loss: 0.9347, test_f1: 0.5325
 epoch: 53, train_loss: 0.7966, test_loss: 0.9403, test_f1: 0.5256
 epoch: 54, train_loss: 0.7986, test_loss: 0.9437, test_f1: 0.5183
 epoch: 55, train_loss: 0.7947, test_loss: 0.9514, test_f1: 0.5049
 epoch: 56, train_loss: 0.7875, test_loss: 0.9671, test_f1: 0.5277
 epoch: 57, train_loss: 0.7885, test_loss: 0.9481, test_f1: 0.5283
 epoch: 58, train_loss: 0.7850, test_loss: 0.9414, test_f1: 0.5390
 epoch: 59, train_loss: 0.7817, test_loss: 0.9401, test_f1: 0.5284
 epoch: 60, train_loss: 0.7796, test_loss: 0.9384, test_f1: 0.5307
 epoch: 61, train_loss: 0.7864, test_loss: 0.9414, test_f1: 0.5222
 epoch: 62, train_loss: 0.7779, test_loss: 0.9516, test_f1: 0.5231
 epoch: 63, train_loss: 0.7753, test_loss: 0.9583, test_f1: 0.5278
 epoch: 64, train_loss: 0.7754, test_loss: 0.9613, test_f1: 0.5245
 epoch: 65, train_loss: 0.7732, test_loss: 0.9593, test_f1: 0.5324
 epoch: 66, train_loss: 0.7684, test_loss: 0.9430, test_f1: 0.5336
 epoch: 67, train_loss: 0.7636, test_loss: 0.9467, test_f1: 0.5296
 epoch: 68, train_loss: 0.7594, test_loss: 0.9371, test_f1: 0.5239
 epoch: 69, train_loss: 0.7703, test_loss: 0.9645, test_f1: 0.5268
 epoch: 70, train_loss: 0.7648, test_loss: 0.9574, test_f1: 0.5308
 epoch: 71, train_loss: 0.7598, test_loss: 0.9510, test_f1: 0.5362
 epoch: 72, train_loss: 0.7626, test_loss: 0.9508, test_f1: 0.5286
 epoch: 73, train_loss: 0.7612, test_loss: 0.9594, test_f1: 0.5248
 epoch: 74, train_loss: 0.7625, test_loss: 0.9705, test_f1: 0.5199
 epoch: 75, train_loss: 0.7520, test_loss: 0.9581, test_f1: 0.5253
 epoch: 76, train_loss: 0.7522, test_loss: 0.9465, test_f1: 0.5259
 epoch: 77, train_loss: 0.7537, test_loss: 0.9608, test_f1: 0.5205
 epoch: 78, train_loss: 0.7418, test_loss: 0.9564, test_f1: 0.5247
 epoch: 79, train_loss: 0.7501, test_loss: 0.9517, test_f1: 0.5142
 epoch: 80, train_loss: 0.7444, test_loss: 0.9625, test_f1: 0.5266
 epoch: 81, train_loss: 0.7410, test_loss: 0.9501, test_f1: 0.5262
 epoch: 82, train_loss: 0.7490, test_loss: 0.9709, test_f1: 0.5260
 epoch: 83, train_loss: 0.7429, test_loss: 0.9526, test_f1: 0.5230
 epoch: 84, train_loss: 0.7456, test_loss: 0.9638, test_f1: 0.5288
 epoch: 85, train_loss: 0.7344, test_loss: 0.9613, test_f1: 0.5250
 epoch: 86, train_loss: 0.7440, test_loss: 0.9790, test_f1: 0.5321
 epoch: 87, train_loss: 0.7299, test_loss: 0.9639, test_f1: 0.5271
 epoch: 88, train_loss: 0.7365, test_loss: 0.9655, test_f1: 0.5298
 epoch: 89, train_loss: 0.7366, test_loss: 0.9818, test_f1: 0.5244
 epoch: 90, train_loss: 0.7377, test_loss: 0.9751, test_f1: 0.5282
 epoch: 91, train_loss: 0.7339, test_loss: 0.9875, test_f1: 0.5242
 epoch: 92, train_loss: 0.7331, test_loss: 0.9717, test_f1: 0.5246
 epoch: 93, train_loss: 0.7351, test_loss: 0.9754, test_f1: 0.5344
 epoch: 94, train_loss: 0.7250, test_loss: 0.9744, test_f1: 0.5561
 epoch: 95, train_loss: 0.7342, test_loss: 0.9743, test_f1: 0.5343
 epoch: 96, train_loss: 0.7290, test_loss: 0.9670, test_f1: 0.5360
 epoch: 97, train_loss: 0.7244, test_loss: 0.9683, test_f1: 0.5412
 epoch: 98, train_loss: 0.7311, test_loss: 0.9681, test_f1: 0.5267
 epoch: 99, train_loss: 0.7292, test_loss: 0.9838, test_f1: 0.5286
##################ITERATION #3 ****************************************
 epoch: 0, train_loss: 1.3299, test_loss: 1.3907, test_f1: 0.0302
 epoch: 1, train_loss: 1.2804, test_loss: 1.3749, test_f1: 0.2411
 epoch: 2, train_loss: 1.2574, test_loss: 1.3167, test_f1: 0.3172
 epoch: 3, train_loss: 1.2338, test_loss: 1.2647, test_f1: 0.3231
 epoch: 4, train_loss: 1.2191, test_loss: 1.2231, test_f1: 0.3473
 epoch: 5, train_loss: 1.1993, test_loss: 1.1929, test_f1: 0.3873
 epoch: 6, train_loss: 1.1809, test_loss: 1.1546, test_f1: 0.4136
 epoch: 7, train_loss: 1.1587, test_loss: 1.1176, test_f1: 0.4416
 epoch: 8, train_loss: 1.1466, test_loss: 1.0965, test_f1: 0.4520
 epoch: 9, train_loss: 1.1282, test_loss: 1.0823, test_f1: 0.4477
 epoch: 10, train_loss: 1.1127, test_loss: 1.0671, test_f1: 0.4577
 epoch: 11, train_loss: 1.0944, test_loss: 1.0504, test_f1: 0.4708
 epoch: 12, train_loss: 1.0765, test_loss: 1.0364, test_f1: 0.4730
 epoch: 13, train_loss: 1.0626, test_loss: 1.0245, test_f1: 0.4709
 epoch: 14, train_loss: 1.0532, test_loss: 1.0089, test_f1: 0.4801
 epoch: 15, train_loss: 1.0385, test_loss: 1.0055, test_f1: 0.4758
 epoch: 16, train_loss: 1.0263, test_loss: 1.0008, test_f1: 0.4873
 epoch: 17, train_loss: 1.0218, test_loss: 0.9873, test_f1: 0.4844
 epoch: 18, train_loss: 1.0164, test_loss: 0.9903, test_f1: 0.4885
 epoch: 19, train_loss: 0.9992, test_loss: 0.9830, test_f1: 0.4783
 epoch: 20, train_loss: 0.9807, test_loss: 0.9709, test_f1: 0.5028
 epoch: 21, train_loss: 0.9868, test_loss: 0.9706, test_f1: 0.4968
 epoch: 22, train_loss: 0.9755, test_loss: 0.9601, test_f1: 0.5040
 epoch: 23, train_loss: 0.9687, test_loss: 0.9538, test_f1: 0.5104
 epoch: 24, train_loss: 0.9569, test_loss: 0.9541, test_f1: 0.5068
 epoch: 25, train_loss: 0.9485, test_loss: 0.9475, test_f1: 0.4950
 epoch: 26, train_loss: 0.9399, test_loss: 0.9574, test_f1: 0.5096
 epoch: 27, train_loss: 0.9342, test_loss: 0.9411, test_f1: 0.5104
 epoch: 28, train_loss: 0.9253, test_loss: 0.9344, test_f1: 0.5100
 epoch: 29, train_loss: 0.9138, test_loss: 0.9425, test_f1: 0.5076
 epoch: 30, train_loss: 0.9106, test_loss: 0.9388, test_f1: 0.5036
 epoch: 31, train_loss: 0.9081, test_loss: 0.9301, test_f1: 0.5125
 epoch: 32, train_loss: 0.8994, test_loss: 0.9338, test_f1: 0.5147
 epoch: 33, train_loss: 0.8896, test_loss: 0.9232, test_f1: 0.5201
 epoch: 34, train_loss: 0.8937, test_loss: 0.9414, test_f1: 0.5061
 epoch: 35, train_loss: 0.8938, test_loss: 0.9156, test_f1: 0.5230
 epoch: 36, train_loss: 0.8841, test_loss: 0.9174, test_f1: 0.5126
 epoch: 37, train_loss: 0.8698, test_loss: 0.9328, test_f1: 0.5019
 epoch: 38, train_loss: 0.8842, test_loss: 0.9283, test_f1: 0.5139
 epoch: 39, train_loss: 0.8669, test_loss: 0.9354, test_f1: 0.5163
 epoch: 40, train_loss: 0.8678, test_loss: 0.9273, test_f1: 0.5209
 epoch: 41, train_loss: 0.8534, test_loss: 0.9234, test_f1: 0.5123
 epoch: 42, train_loss: 0.8480, test_loss: 0.9290, test_f1: 0.5091
 epoch: 43, train_loss: 0.8479, test_loss: 0.9328, test_f1: 0.5211
 epoch: 44, train_loss: 0.8400, test_loss: 0.9032, test_f1: 0.5135
 epoch: 45, train_loss: 0.8410, test_loss: 0.9221, test_f1: 0.5146
 epoch: 46, train_loss: 0.8410, test_loss: 0.9408, test_f1: 0.5175
 epoch: 47, train_loss: 0.8347, test_loss: 0.9090, test_f1: 0.5314
 epoch: 48, train_loss: 0.8288, test_loss: 0.9011, test_f1: 0.5272
 epoch: 49, train_loss: 0.8270, test_loss: 0.9204, test_f1: 0.5210
 epoch: 50, train_loss: 0.8142, test_loss: 0.9170, test_f1: 0.5295
 epoch: 51, train_loss: 0.8183, test_loss: 0.9210, test_f1: 0.5215
 epoch: 52, train_loss: 0.8120, test_loss: 0.9223, test_f1: 0.5191
 epoch: 53, train_loss: 0.8078, test_loss: 0.9190, test_f1: 0.5224
 epoch: 54, train_loss: 0.8188, test_loss: 0.9200, test_f1: 0.5248
 epoch: 55, train_loss: 0.8006, test_loss: 0.9175, test_f1: 0.5225
 epoch: 56, train_loss: 0.8069, test_loss: 0.9063, test_f1: 0.5246
 epoch: 57, train_loss: 0.8082, test_loss: 0.9146, test_f1: 0.5242
 epoch: 58, train_loss: 0.8013, test_loss: 0.9167, test_f1: 0.5227
 epoch: 59, train_loss: 0.8052, test_loss: 0.9264, test_f1: 0.5235
 epoch: 60, train_loss: 0.8025, test_loss: 0.9179, test_f1: 0.5207
 epoch: 61, train_loss: 0.7963, test_loss: 0.9181, test_f1: 0.5208
 epoch: 62, train_loss: 0.7930, test_loss: 0.9175, test_f1: 0.5205
 epoch: 63, train_loss: 0.7912, test_loss: 0.9120, test_f1: 0.5249
 epoch: 64, train_loss: 0.7936, test_loss: 0.9166, test_f1: 0.5240
 epoch: 65, train_loss: 0.7834, test_loss: 0.9228, test_f1: 0.5269
 epoch: 66, train_loss: 0.7829, test_loss: 0.9294, test_f1: 0.5286
 epoch: 67, train_loss: 0.7794, test_loss: 0.9263, test_f1: 0.5197
 epoch: 68, train_loss: 0.7892, test_loss: 0.9203, test_f1: 0.5247
 epoch: 69, train_loss: 0.7825, test_loss: 0.9197, test_f1: 0.5180
 epoch: 70, train_loss: 0.7727, test_loss: 0.9150, test_f1: 0.5281
 epoch: 71, train_loss: 0.7832, test_loss: 0.9238, test_f1: 0.5282
 epoch: 72, train_loss: 0.7709, test_loss: 0.9082, test_f1: 0.5281
 epoch: 73, train_loss: 0.7789, test_loss: 0.9157, test_f1: 0.5275
 epoch: 74, train_loss: 0.7818, test_loss: 0.9315, test_f1: 0.5188
 epoch: 75, train_loss: 0.7661, test_loss: 0.9340, test_f1: 0.5226
 epoch: 76, train_loss: 0.7684, test_loss: 0.9233, test_f1: 0.5304
 epoch: 77, train_loss: 0.7606, test_loss: 0.9169, test_f1: 0.5350
 epoch: 78, train_loss: 0.7638, test_loss: 0.9228, test_f1: 0.5279
 epoch: 79, train_loss: 0.7692, test_loss: 0.9230, test_f1: 0.5309
 epoch: 80, train_loss: 0.7652, test_loss: 0.9218, test_f1: 0.5287
 epoch: 81, train_loss: 0.7667, test_loss: 0.9191, test_f1: 0.5316
 epoch: 82, train_loss: 0.7544, test_loss: 0.9232, test_f1: 0.5296
 epoch: 83, train_loss: 0.7531, test_loss: 0.9351, test_f1: 0.5277
 epoch: 84, train_loss: 0.7499, test_loss: 0.9346, test_f1: 0.5234
 epoch: 85, train_loss: 0.7562, test_loss: 0.9211, test_f1: 0.5290
 epoch: 86, train_loss: 0.7641, test_loss: 0.9298, test_f1: 0.5266
 epoch: 87, train_loss: 0.7543, test_loss: 0.9282, test_f1: 0.5222
 epoch: 88, train_loss: 0.7538, test_loss: 0.9227, test_f1: 0.5271
 epoch: 89, train_loss: 0.7530, test_loss: 0.9236, test_f1: 0.5257
 epoch: 90, train_loss: 0.7529, test_loss: 0.9262, test_f1: 0.5295
 epoch: 91, train_loss: 0.7488, test_loss: 0.9309, test_f1: 0.5225
 epoch: 92, train_loss: 0.7476, test_loss: 0.9388, test_f1: 0.5305
 epoch: 93, train_loss: 0.7512, test_loss: 0.9319, test_f1: 0.5321
 epoch: 94, train_loss: 0.7403, test_loss: 0.9481, test_f1: 0.5244
 epoch: 95, train_loss: 0.7429, test_loss: 0.9460, test_f1: 0.5349
 epoch: 96, train_loss: 0.7496, test_loss: 0.9309, test_f1: 0.5414
 epoch: 97, train_loss: 0.7509, test_loss: 0.9457, test_f1: 0.5355
 epoch: 98, train_loss: 0.7391, test_loss: 0.9532, test_f1: 0.5341
 epoch: 99, train_loss: 0.7339, test_loss: 0.9407, test_f1: 0.5317
##################ITERATION #4 ****************************************
 epoch: 0, train_loss: 1.2932, test_loss: 1.3858, test_f1: 0.2060
 epoch: 1, train_loss: 1.2312, test_loss: 1.3659, test_f1: 0.2695
 epoch: 2, train_loss: 1.2053, test_loss: 1.3303, test_f1: 0.3197
 epoch: 3, train_loss: 1.1798, test_loss: 1.2464, test_f1: 0.3962
 epoch: 4, train_loss: 1.1646, test_loss: 1.1679, test_f1: 0.4107
 epoch: 5, train_loss: 1.1380, test_loss: 1.1227, test_f1: 0.4322
 epoch: 6, train_loss: 1.1147, test_loss: 1.0903, test_f1: 0.4388
 epoch: 7, train_loss: 1.1047, test_loss: 1.0667, test_f1: 0.4406
 epoch: 8, train_loss: 1.0904, test_loss: 1.0375, test_f1: 0.4697
 epoch: 9, train_loss: 1.0792, test_loss: 1.0199, test_f1: 0.4708
 epoch: 10, train_loss: 1.0598, test_loss: 1.0087, test_f1: 0.4731
 epoch: 11, train_loss: 1.0508, test_loss: 1.0077, test_f1: 0.4564
 epoch: 12, train_loss: 1.0428, test_loss: 1.0060, test_f1: 0.4520
 epoch: 13, train_loss: 1.0295, test_loss: 0.9851, test_f1: 0.4654
 epoch: 14, train_loss: 1.0163, test_loss: 0.9843, test_f1: 0.4603
 epoch: 15, train_loss: 1.0055, test_loss: 0.9816, test_f1: 0.4611
 epoch: 16, train_loss: 0.9914, test_loss: 0.9646, test_f1: 0.4934
 epoch: 17, train_loss: 0.9818, test_loss: 0.9562, test_f1: 0.5031
 epoch: 18, train_loss: 0.9837, test_loss: 0.9694, test_f1: 0.4875
 epoch: 19, train_loss: 0.9699, test_loss: 0.9454, test_f1: 0.5058
 epoch: 20, train_loss: 0.9692, test_loss: 0.9544, test_f1: 0.4957
 epoch: 21, train_loss: 0.9636, test_loss: 0.9496, test_f1: 0.5049
 epoch: 22, train_loss: 0.9451, test_loss: 0.9459, test_f1: 0.5091
 epoch: 23, train_loss: 0.9445, test_loss: 0.9387, test_f1: 0.5027
 epoch: 24, train_loss: 0.9253, test_loss: 0.9390, test_f1: 0.5285
 epoch: 25, train_loss: 0.9304, test_loss: 0.9445, test_f1: 0.5136
 epoch: 26, train_loss: 0.9273, test_loss: 0.9213, test_f1: 0.5264
 epoch: 27, train_loss: 0.9203, test_loss: 0.9364, test_f1: 0.5106
 epoch: 28, train_loss: 0.9103, test_loss: 0.9244, test_f1: 0.5203
 epoch: 29, train_loss: 0.9077, test_loss: 0.9237, test_f1: 0.5280
 epoch: 30, train_loss: 0.9036, test_loss: 0.9127, test_f1: 0.5245
 epoch: 31, train_loss: 0.8856, test_loss: 0.9470, test_f1: 0.5181
 epoch: 32, train_loss: 0.9003, test_loss: 0.9207, test_f1: 0.5318
 epoch: 33, train_loss: 0.8849, test_loss: 0.9385, test_f1: 0.5071
 epoch: 34, train_loss: 0.8783, test_loss: 0.9172, test_f1: 0.5339
 epoch: 35, train_loss: 0.8710, test_loss: 0.9331, test_f1: 0.5237
 epoch: 36, train_loss: 0.8615, test_loss: 0.9168, test_f1: 0.5336
 epoch: 37, train_loss: 0.8606, test_loss: 0.9219, test_f1: 0.5277
 epoch: 38, train_loss: 0.8644, test_loss: 0.9454, test_f1: 0.4973
 epoch: 39, train_loss: 0.8513, test_loss: 0.9173, test_f1: 0.5405
 epoch: 40, train_loss: 0.8583, test_loss: 0.9410, test_f1: 0.5358
 epoch: 41, train_loss: 0.8550, test_loss: 0.9324, test_f1: 0.5343
 epoch: 42, train_loss: 0.8445, test_loss: 0.9262, test_f1: 0.5271
 epoch: 43, train_loss: 0.8416, test_loss: 0.9250, test_f1: 0.5322
 epoch: 44, train_loss: 0.8360, test_loss: 0.9111, test_f1: 0.5359
 epoch: 45, train_loss: 0.8389, test_loss: 0.9343, test_f1: 0.5438
 epoch: 46, train_loss: 0.8334, test_loss: 0.9210, test_f1: 0.5261
 epoch: 47, train_loss: 0.8337, test_loss: 0.9480, test_f1: 0.5253
 epoch: 48, train_loss: 0.8257, test_loss: 0.9311, test_f1: 0.5469
 epoch: 49, train_loss: 0.8238, test_loss: 0.9097, test_f1: 0.5369
 epoch: 50, train_loss: 0.8212, test_loss: 0.9464, test_f1: 0.5232
 epoch: 51, train_loss: 0.8151, test_loss: 0.9271, test_f1: 0.5405
 epoch: 52, train_loss: 0.8084, test_loss: 0.9276, test_f1: 0.5380
 epoch: 53, train_loss: 0.8082, test_loss: 0.9230, test_f1: 0.5309
 epoch: 54, train_loss: 0.8002, test_loss: 0.9442, test_f1: 0.5354
 epoch: 55, train_loss: 0.7975, test_loss: 0.9281, test_f1: 0.5396
 epoch: 56, train_loss: 0.7964, test_loss: 0.9272, test_f1: 0.5351
 epoch: 57, train_loss: 0.8005, test_loss: 0.9296, test_f1: 0.5332
 epoch: 58, train_loss: 0.8016, test_loss: 0.9359, test_f1: 0.5382
 epoch: 59, train_loss: 0.7972, test_loss: 0.9267, test_f1: 0.5483
 epoch: 60, train_loss: 0.7961, test_loss: 0.9325, test_f1: 0.5360
 epoch: 61, train_loss: 0.7872, test_loss: 0.9388, test_f1: 0.5446
 epoch: 62, train_loss: 0.7962, test_loss: 0.9259, test_f1: 0.5394
 epoch: 63, train_loss: 0.7905, test_loss: 0.9411, test_f1: 0.5437
 epoch: 64, train_loss: 0.7892, test_loss: 0.9385, test_f1: 0.5491
 epoch: 65, train_loss: 0.7836, test_loss: 0.9440, test_f1: 0.5395
 epoch: 66, train_loss: 0.7811, test_loss: 0.9384, test_f1: 0.5449
 epoch: 67, train_loss: 0.7812, test_loss: 0.9367, test_f1: 0.5372
 epoch: 68, train_loss: 0.7724, test_loss: 0.9291, test_f1: 0.5339
 epoch: 69, train_loss: 0.7817, test_loss: 0.9346, test_f1: 0.5438
 epoch: 70, train_loss: 0.7777, test_loss: 0.9287, test_f1: 0.5402
 epoch: 71, train_loss: 0.7736, test_loss: 0.9488, test_f1: 0.5471
 epoch: 72, train_loss: 0.7728, test_loss: 0.9314, test_f1: 0.5473
 epoch: 73, train_loss: 0.7756, test_loss: 0.9505, test_f1: 0.5480
 epoch: 74, train_loss: 0.7682, test_loss: 0.9289, test_f1: 0.5438
 epoch: 75, train_loss: 0.7658, test_loss: 0.9420, test_f1: 0.5467
 epoch: 76, train_loss: 0.7671, test_loss: 0.9406, test_f1: 0.5481
 epoch: 77, train_loss: 0.7589, test_loss: 0.9194, test_f1: 0.5444
 epoch: 78, train_loss: 0.7725, test_loss: 0.9399, test_f1: 0.5532
 epoch: 79, train_loss: 0.7665, test_loss: 0.9588, test_f1: 0.5484
 epoch: 80, train_loss: 0.7626, test_loss: 0.9474, test_f1: 0.5566
 epoch: 81, train_loss: 0.7731, test_loss: 0.9369, test_f1: 0.5544
 epoch: 82, train_loss: 0.7617, test_loss: 0.9347, test_f1: 0.5446
 epoch: 83, train_loss: 0.7555, test_loss: 0.9386, test_f1: 0.5583
 epoch: 84, train_loss: 0.7584, test_loss: 0.9499, test_f1: 0.5527
 epoch: 85, train_loss: 0.7606, test_loss: 0.9691, test_f1: 0.5448
 epoch: 86, train_loss: 0.7542, test_loss: 0.9476, test_f1: 0.5552
 epoch: 87, train_loss: 0.7472, test_loss: 0.9350, test_f1: 0.5512
 epoch: 88, train_loss: 0.7514, test_loss: 0.9518, test_f1: 0.5480
 epoch: 89, train_loss: 0.7492, test_loss: 0.9350, test_f1: 0.5598
 epoch: 90, train_loss: 0.7648, test_loss: 0.9404, test_f1: 0.5524
 epoch: 91, train_loss: 0.7443, test_loss: 0.9558, test_f1: 0.5507
 epoch: 92, train_loss: 0.7424, test_loss: 0.9550, test_f1: 0.5466
 epoch: 93, train_loss: 0.7499, test_loss: 0.9429, test_f1: 0.5578
 epoch: 94, train_loss: 0.7580, test_loss: 0.9656, test_f1: 0.5523
 epoch: 95, train_loss: 0.7577, test_loss: 0.9377, test_f1: 0.5558
 epoch: 96, train_loss: 0.7421, test_loss: 0.9589, test_f1: 0.5569
 epoch: 97, train_loss: 0.7471, test_loss: 0.9473, test_f1: 0.5511
 epoch: 98, train_loss: 0.7380, test_loss: 0.9507, test_f1: 0.5684
 epoch: 99, train_loss: 0.7421, test_loss: 0.9567, test_f1: 0.5558
##################ITERATION #5 ****************************************
 epoch: 0, train_loss: 1.2797, test_loss: 1.3362, test_f1: 0.2270
 epoch: 1, train_loss: 1.2044, test_loss: 1.3119, test_f1: 0.2295
 epoch: 2, train_loss: 1.1748, test_loss: 1.2474, test_f1: 0.2852
 epoch: 3, train_loss: 1.1529, test_loss: 1.1904, test_f1: 0.3727
 epoch: 4, train_loss: 1.1291, test_loss: 1.1395, test_f1: 0.4293
 epoch: 5, train_loss: 1.1119, test_loss: 1.0868, test_f1: 0.4746
 epoch: 6, train_loss: 1.0902, test_loss: 1.0521, test_f1: 0.4775
 epoch: 7, train_loss: 1.0820, test_loss: 1.0356, test_f1: 0.4671
 epoch: 8, train_loss: 1.0704, test_loss: 1.0191, test_f1: 0.4786
 epoch: 9, train_loss: 1.0528, test_loss: 1.0025, test_f1: 0.4914
 epoch: 10, train_loss: 1.0372, test_loss: 0.9927, test_f1: 0.4935
 epoch: 11, train_loss: 1.0280, test_loss: 0.9856, test_f1: 0.4857
 epoch: 12, train_loss: 1.0125, test_loss: 0.9740, test_f1: 0.4984
 epoch: 13, train_loss: 1.0086, test_loss: 0.9665, test_f1: 0.5029
 epoch: 14, train_loss: 1.0019, test_loss: 0.9590, test_f1: 0.5017
 epoch: 15, train_loss: 0.9825, test_loss: 0.9491, test_f1: 0.5153
 epoch: 16, train_loss: 0.9797, test_loss: 0.9428, test_f1: 0.5107
 epoch: 17, train_loss: 0.9656, test_loss: 0.9387, test_f1: 0.5228
 epoch: 18, train_loss: 0.9651, test_loss: 0.9348, test_f1: 0.5472
 epoch: 19, train_loss: 0.9428, test_loss: 0.9267, test_f1: 0.5572
 epoch: 20, train_loss: 0.9391, test_loss: 0.9326, test_f1: 0.5394
 epoch: 21, train_loss: 0.9310, test_loss: 0.9271, test_f1: 0.5389
 epoch: 22, train_loss: 0.9275, test_loss: 0.9215, test_f1: 0.5275
 epoch: 23, train_loss: 0.9244, test_loss: 0.9174, test_f1: 0.5326
 epoch: 24, train_loss: 0.9227, test_loss: 0.9209, test_f1: 0.5310
 epoch: 25, train_loss: 0.9094, test_loss: 0.9196, test_f1: 0.5308
 epoch: 26, train_loss: 0.9093, test_loss: 0.9124, test_f1: 0.5491
 epoch: 27, train_loss: 0.9031, test_loss: 0.9156, test_f1: 0.5404
 epoch: 28, train_loss: 0.8971, test_loss: 0.9214, test_f1: 0.5414
 epoch: 29, train_loss: 0.8838, test_loss: 0.9282, test_f1: 0.5278
 epoch: 30, train_loss: 0.8853, test_loss: 0.9227, test_f1: 0.5316
 epoch: 31, train_loss: 0.8841, test_loss: 0.9081, test_f1: 0.5354
 epoch: 32, train_loss: 0.8706, test_loss: 0.9086, test_f1: 0.5429
 epoch: 33, train_loss: 0.8657, test_loss: 0.9155, test_f1: 0.5423
 epoch: 34, train_loss: 0.8669, test_loss: 0.9162, test_f1: 0.5366
 epoch: 35, train_loss: 0.8675, test_loss: 0.9149, test_f1: 0.5428
 epoch: 36, train_loss: 0.8677, test_loss: 0.9261, test_f1: 0.5193
 epoch: 37, train_loss: 0.8535, test_loss: 0.9144, test_f1: 0.5316
 epoch: 38, train_loss: 0.8526, test_loss: 0.9080, test_f1: 0.5435
 epoch: 39, train_loss: 0.8499, test_loss: 0.9069, test_f1: 0.5384
 epoch: 40, train_loss: 0.8401, test_loss: 0.9065, test_f1: 0.5400
 epoch: 41, train_loss: 0.8341, test_loss: 0.9023, test_f1: 0.5463
 epoch: 42, train_loss: 0.8281, test_loss: 0.9062, test_f1: 0.5522
 epoch: 43, train_loss: 0.8274, test_loss: 0.9164, test_f1: 0.5364
 epoch: 44, train_loss: 0.8236, test_loss: 0.9181, test_f1: 0.5429
 epoch: 45, train_loss: 0.8179, test_loss: 0.9160, test_f1: 0.5415
 epoch: 46, train_loss: 0.8197, test_loss: 0.9139, test_f1: 0.5218
 epoch: 47, train_loss: 0.8021, test_loss: 0.9189, test_f1: 0.5418
 epoch: 48, train_loss: 0.8074, test_loss: 0.9095, test_f1: 0.5386
 epoch: 49, train_loss: 0.8062, test_loss: 0.9218, test_f1: 0.5226
 epoch: 50, train_loss: 0.7916, test_loss: 0.9292, test_f1: 0.5214
 epoch: 51, train_loss: 0.8035, test_loss: 0.9229, test_f1: 0.5385
 epoch: 52, train_loss: 0.7901, test_loss: 0.9260, test_f1: 0.5338
 epoch: 53, train_loss: 0.7972, test_loss: 0.9244, test_f1: 0.5255
 epoch: 54, train_loss: 0.7798, test_loss: 0.9135, test_f1: 0.5377
 epoch: 55, train_loss: 0.7964, test_loss: 0.9119, test_f1: 0.5416
 epoch: 56, train_loss: 0.7774, test_loss: 0.9115, test_f1: 0.5408
 epoch: 57, train_loss: 0.7917, test_loss: 0.9142, test_f1: 0.5359
 epoch: 58, train_loss: 0.7863, test_loss: 0.9139, test_f1: 0.5303
 epoch: 59, train_loss: 0.7741, test_loss: 0.9163, test_f1: 0.5511
 epoch: 60, train_loss: 0.7760, test_loss: 0.9148, test_f1: 0.5530
 epoch: 61, train_loss: 0.7763, test_loss: 0.9134, test_f1: 0.5476
 epoch: 62, train_loss: 0.7662, test_loss: 0.9050, test_f1: 0.5613
 epoch: 63, train_loss: 0.7851, test_loss: 0.9198, test_f1: 0.5478
 epoch: 64, train_loss: 0.7733, test_loss: 0.9174, test_f1: 0.5384
 epoch: 65, train_loss: 0.7716, test_loss: 0.9182, test_f1: 0.5376
 epoch: 66, train_loss: 0.7654, test_loss: 0.9126, test_f1: 0.5433
 epoch: 67, train_loss: 0.7735, test_loss: 0.9119, test_f1: 0.5553
 epoch: 68, train_loss: 0.7613, test_loss: 0.9160, test_f1: 0.5537
 epoch: 69, train_loss: 0.7622, test_loss: 0.9181, test_f1: 0.5562
 epoch: 70, train_loss: 0.7594, test_loss: 0.9180, test_f1: 0.5392
 epoch: 71, train_loss: 0.7559, test_loss: 0.9361, test_f1: 0.5432
 epoch: 72, train_loss: 0.7478, test_loss: 0.9253, test_f1: 0.5392
 epoch: 73, train_loss: 0.7621, test_loss: 0.9292, test_f1: 0.5448
 epoch: 74, train_loss: 0.7520, test_loss: 0.9336, test_f1: 0.5468
 epoch: 75, train_loss: 0.7562, test_loss: 0.9317, test_f1: 0.5627
 epoch: 76, train_loss: 0.7422, test_loss: 0.9232, test_f1: 0.5434
 epoch: 77, train_loss: 0.7440, test_loss: 0.9276, test_f1: 0.5506
 epoch: 78, train_loss: 0.7454, test_loss: 0.9300, test_f1: 0.5464
 epoch: 79, train_loss: 0.7413, test_loss: 0.9310, test_f1: 0.5548
 epoch: 80, train_loss: 0.7494, test_loss: 0.9287, test_f1: 0.5505
 epoch: 81, train_loss: 0.7468, test_loss: 0.9280, test_f1: 0.5571
 epoch: 82, train_loss: 0.7362, test_loss: 0.9347, test_f1: 0.5535
 epoch: 83, train_loss: 0.7410, test_loss: 0.9273, test_f1: 0.5575
 epoch: 84, train_loss: 0.7467, test_loss: 0.9441, test_f1: 0.5527
 epoch: 85, train_loss: 0.7316, test_loss: 0.9417, test_f1: 0.5576
 epoch: 86, train_loss: 0.7392, test_loss: 0.9479, test_f1: 0.5454
 epoch: 87, train_loss: 0.7315, test_loss: 0.9545, test_f1: 0.5362
 epoch: 88, train_loss: 0.7384, test_loss: 0.9452, test_f1: 0.5428
 epoch: 89, train_loss: 0.7183, test_loss: 0.9417, test_f1: 0.5485
 epoch: 90, train_loss: 0.7260, test_loss: 0.9415, test_f1: 0.5470
 epoch: 91, train_loss: 0.7245, test_loss: 0.9340, test_f1: 0.5692
 epoch: 92, train_loss: 0.7297, test_loss: 0.9333, test_f1: 0.5607
 epoch: 93, train_loss: 0.7328, test_loss: 0.9310, test_f1: 0.5540
 epoch: 94, train_loss: 0.7224, test_loss: 0.9349, test_f1: 0.5578
 epoch: 95, train_loss: 0.7160, test_loss: 0.9297, test_f1: 0.5601
 epoch: 96, train_loss: 0.7108, test_loss: 0.9377, test_f1: 0.5495
 epoch: 97, train_loss: 0.7182, test_loss: 0.9410, test_f1: 0.5707
 epoch: 98, train_loss: 0.7074, test_loss: 0.9581, test_f1: 0.5719
 epoch: 99, train_loss: 0.7116, test_loss: 0.9403, test_f1: 0.5753
##################ITERATION #6 ****************************************
 epoch: 0, train_loss: 1.2676, test_loss: 1.3518, test_f1: 0.2270
 epoch: 1, train_loss: 1.2049, test_loss: 1.3745, test_f1: 0.2245
 epoch: 2, train_loss: 1.1734, test_loss: 1.2976, test_f1: 0.3012
 epoch: 3, train_loss: 1.1527, test_loss: 1.2194, test_f1: 0.3519
 epoch: 4, train_loss: 1.1260, test_loss: 1.1643, test_f1: 0.3768
 epoch: 5, train_loss: 1.1058, test_loss: 1.1410, test_f1: 0.3975
 epoch: 6, train_loss: 1.0916, test_loss: 1.0705, test_f1: 0.4643
 epoch: 7, train_loss: 1.0776, test_loss: 1.0417, test_f1: 0.4883
 epoch: 8, train_loss: 1.0621, test_loss: 1.0076, test_f1: 0.5003
 epoch: 9, train_loss: 1.0463, test_loss: 1.0058, test_f1: 0.5055
 epoch: 10, train_loss: 1.0368, test_loss: 0.9902, test_f1: 0.5070
 epoch: 11, train_loss: 1.0240, test_loss: 0.9934, test_f1: 0.5147
 epoch: 12, train_loss: 1.0117, test_loss: 0.9905, test_f1: 0.5067
 epoch: 13, train_loss: 1.0042, test_loss: 0.9846, test_f1: 0.5063
 epoch: 14, train_loss: 0.9950, test_loss: 0.9957, test_f1: 0.4904
 epoch: 15, train_loss: 0.9854, test_loss: 0.9735, test_f1: 0.5098
 epoch: 16, train_loss: 0.9710, test_loss: 0.9975, test_f1: 0.4821
 epoch: 17, train_loss: 0.9655, test_loss: 0.9800, test_f1: 0.5187
 epoch: 18, train_loss: 0.9519, test_loss: 0.9567, test_f1: 0.5246
 epoch: 19, train_loss: 0.9458, test_loss: 0.9737, test_f1: 0.5116
 epoch: 20, train_loss: 0.9482, test_loss: 0.9702, test_f1: 0.5187
 epoch: 21, train_loss: 0.9373, test_loss: 0.9735, test_f1: 0.5038
 epoch: 22, train_loss: 0.9292, test_loss: 0.9667, test_f1: 0.5055
 epoch: 23, train_loss: 0.9223, test_loss: 0.9755, test_f1: 0.5074
 epoch: 24, train_loss: 0.9242, test_loss: 0.9752, test_f1: 0.5144
 epoch: 25, train_loss: 0.9133, test_loss: 0.9627, test_f1: 0.5224
 epoch: 26, train_loss: 0.9063, test_loss: 0.9743, test_f1: 0.5194
 epoch: 27, train_loss: 0.9041, test_loss: 0.9641, test_f1: 0.5284
 epoch: 28, train_loss: 0.8944, test_loss: 0.9425, test_f1: 0.5470
 epoch: 29, train_loss: 0.8889, test_loss: 0.9521, test_f1: 0.5324
 epoch: 30, train_loss: 0.8798, test_loss: 0.9482, test_f1: 0.5426
 epoch: 31, train_loss: 0.8733, test_loss: 0.9765, test_f1: 0.5230
 epoch: 32, train_loss: 0.8901, test_loss: 0.9725, test_f1: 0.5125
 epoch: 33, train_loss: 0.8702, test_loss: 0.9785, test_f1: 0.5053
 epoch: 34, train_loss: 0.8592, test_loss: 0.9575, test_f1: 0.5417
 epoch: 35, train_loss: 0.8628, test_loss: 0.9861, test_f1: 0.5308
 epoch: 36, train_loss: 0.8599, test_loss: 0.9616, test_f1: 0.5306
 epoch: 37, train_loss: 0.8538, test_loss: 0.9639, test_f1: 0.5306
 epoch: 38, train_loss: 0.8560, test_loss: 0.9487, test_f1: 0.5378
 epoch: 39, train_loss: 0.8474, test_loss: 0.9610, test_f1: 0.5413
 epoch: 40, train_loss: 0.8357, test_loss: 0.9714, test_f1: 0.5379
 epoch: 41, train_loss: 0.8372, test_loss: 0.9831, test_f1: 0.5255
 epoch: 42, train_loss: 0.8239, test_loss: 0.9677, test_f1: 0.5401
 epoch: 43, train_loss: 0.8261, test_loss: 0.9713, test_f1: 0.5254
 epoch: 44, train_loss: 0.8215, test_loss: 0.9585, test_f1: 0.5353
 epoch: 45, train_loss: 0.8161, test_loss: 1.0071, test_f1: 0.5218
 epoch: 46, train_loss: 0.8192, test_loss: 0.9684, test_f1: 0.5463
 epoch: 47, train_loss: 0.8047, test_loss: 0.9619, test_f1: 0.5380
 epoch: 48, train_loss: 0.8059, test_loss: 0.9809, test_f1: 0.5462
 epoch: 49, train_loss: 0.8047, test_loss: 0.9558, test_f1: 0.5546
 epoch: 50, train_loss: 0.8015, test_loss: 0.9780, test_f1: 0.5449
 epoch: 51, train_loss: 0.8013, test_loss: 0.9788, test_f1: 0.5428
 epoch: 52, train_loss: 0.7937, test_loss: 0.9766, test_f1: 0.5535
 epoch: 53, train_loss: 0.7852, test_loss: 0.9698, test_f1: 0.5530
 epoch: 54, train_loss: 0.7843, test_loss: 0.9842, test_f1: 0.5452
 epoch: 55, train_loss: 0.7871, test_loss: 0.9730, test_f1: 0.5498
 epoch: 56, train_loss: 0.7716, test_loss: 0.9689, test_f1: 0.5594
 epoch: 57, train_loss: 0.7811, test_loss: 0.9750, test_f1: 0.5589
 epoch: 58, train_loss: 0.7872, test_loss: 0.9751, test_f1: 0.5581
 epoch: 59, train_loss: 0.7766, test_loss: 0.9873, test_f1: 0.5486
 epoch: 60, train_loss: 0.7698, test_loss: 0.9779, test_f1: 0.5597
 epoch: 61, train_loss: 0.7627, test_loss: 0.9771, test_f1: 0.5616
 epoch: 62, train_loss: 0.7721, test_loss: 0.9868, test_f1: 0.5561
 epoch: 63, train_loss: 0.7677, test_loss: 0.9905, test_f1: 0.5539
 epoch: 64, train_loss: 0.7535, test_loss: 0.9789, test_f1: 0.5644
 epoch: 65, train_loss: 0.7747, test_loss: 0.9813, test_f1: 0.5714
 epoch: 66, train_loss: 0.7754, test_loss: 0.9749, test_f1: 0.5590
 epoch: 67, train_loss: 0.7648, test_loss: 0.9880, test_f1: 0.5483
 epoch: 68, train_loss: 0.7690, test_loss: 0.9749, test_f1: 0.5553
 epoch: 69, train_loss: 0.7552, test_loss: 0.9962, test_f1: 0.5639
 epoch: 70, train_loss: 0.7481, test_loss: 0.9784, test_f1: 0.5543
 epoch: 71, train_loss: 0.7532, test_loss: 0.9834, test_f1: 0.5527
 epoch: 72, train_loss: 0.7538, test_loss: 0.9815, test_f1: 0.5548
 epoch: 73, train_loss: 0.7444, test_loss: 0.9845, test_f1: 0.5607
 epoch: 74, train_loss: 0.7460, test_loss: 0.9793, test_f1: 0.5630
 epoch: 75, train_loss: 0.7431, test_loss: 0.9799, test_f1: 0.5578
 epoch: 76, train_loss: 0.7398, test_loss: 0.9829, test_f1: 0.5619
 epoch: 77, train_loss: 0.7512, test_loss: 1.0027, test_f1: 0.5523
 epoch: 78, train_loss: 0.7344, test_loss: 0.9934, test_f1: 0.5550
 epoch: 79, train_loss: 0.7376, test_loss: 0.9856, test_f1: 0.5636
 epoch: 80, train_loss: 0.7260, test_loss: 0.9989, test_f1: 0.5541
 epoch: 81, train_loss: 0.7375, test_loss: 0.9876, test_f1: 0.5771
 epoch: 82, train_loss: 0.7339, test_loss: 0.9982, test_f1: 0.5616
 epoch: 83, train_loss: 0.7396, test_loss: 0.9911, test_f1: 0.5629
 epoch: 84, train_loss: 0.7389, test_loss: 0.9895, test_f1: 0.5670
 epoch: 85, train_loss: 0.7294, test_loss: 0.9814, test_f1: 0.5700
 epoch: 86, train_loss: 0.7395, test_loss: 0.9936, test_f1: 0.5760
 epoch: 87, train_loss: 0.7157, test_loss: 0.9940, test_f1: 0.5587
 epoch: 88, train_loss: 0.7271, test_loss: 0.9880, test_f1: 0.5766
 epoch: 89, train_loss: 0.7149, test_loss: 0.9832, test_f1: 0.5673
 epoch: 90, train_loss: 0.7354, test_loss: 0.9927, test_f1: 0.5693
 epoch: 91, train_loss: 0.7132, test_loss: 1.0062, test_f1: 0.5635
 epoch: 92, train_loss: 0.7124, test_loss: 1.0076, test_f1: 0.5718
 epoch: 93, train_loss: 0.7206, test_loss: 0.9867, test_f1: 0.5650
 epoch: 94, train_loss: 0.7015, test_loss: 0.9960, test_f1: 0.5753
 epoch: 95, train_loss: 0.7223, test_loss: 0.9962, test_f1: 0.5655
 epoch: 96, train_loss: 0.7132, test_loss: 0.9975, test_f1: 0.5878
 epoch: 97, train_loss: 0.7199, test_loss: 0.9978, test_f1: 0.5793
 epoch: 98, train_loss: 0.7208, test_loss: 0.9984, test_f1: 0.5709
 epoch: 99, train_loss: 0.7066, test_loss: 0.9930, test_f1: 0.5708
##################ITERATION #7 ****************************************
 epoch: 0, train_loss: 1.3010, test_loss: 1.3904, test_f1: 0.2574
 epoch: 1, train_loss: 1.2291, test_loss: 1.3510, test_f1: 0.2813
 epoch: 2, train_loss: 1.2057, test_loss: 1.2795, test_f1: 0.3133
 epoch: 3, train_loss: 1.1768, test_loss: 1.2157, test_f1: 0.3462
 epoch: 4, train_loss: 1.1523, test_loss: 1.1694, test_f1: 0.3840
 epoch: 5, train_loss: 1.1315, test_loss: 1.1433, test_f1: 0.3958
 epoch: 6, train_loss: 1.1158, test_loss: 1.1326, test_f1: 0.3962
 epoch: 7, train_loss: 1.0925, test_loss: 1.0561, test_f1: 0.4835
 epoch: 8, train_loss: 1.0778, test_loss: 1.0291, test_f1: 0.5152
 epoch: 9, train_loss: 1.0651, test_loss: 1.0221, test_f1: 0.5127
 epoch: 10, train_loss: 1.0582, test_loss: 0.9948, test_f1: 0.5251
 epoch: 11, train_loss: 1.0406, test_loss: 0.9856, test_f1: 0.5238
 epoch: 12, train_loss: 1.0316, test_loss: 0.9792, test_f1: 0.5284
 epoch: 13, train_loss: 1.0251, test_loss: 0.9756, test_f1: 0.5119
 epoch: 14, train_loss: 1.0085, test_loss: 0.9562, test_f1: 0.5342
 epoch: 15, train_loss: 0.9949, test_loss: 0.9556, test_f1: 0.5166
 epoch: 16, train_loss: 0.9900, test_loss: 0.9529, test_f1: 0.5249
 epoch: 17, train_loss: 0.9857, test_loss: 0.9428, test_f1: 0.5257
 epoch: 18, train_loss: 0.9669, test_loss: 0.9438, test_f1: 0.5295
 epoch: 19, train_loss: 0.9678, test_loss: 0.9262, test_f1: 0.5490
 epoch: 20, train_loss: 0.9503, test_loss: 0.9231, test_f1: 0.5381
 epoch: 21, train_loss: 0.9496, test_loss: 0.9157, test_f1: 0.5384
 epoch: 22, train_loss: 0.9349, test_loss: 0.9319, test_f1: 0.5307
 epoch: 23, train_loss: 0.9321, test_loss: 0.9168, test_f1: 0.5305
 epoch: 24, train_loss: 0.9236, test_loss: 0.9181, test_f1: 0.5290
 epoch: 25, train_loss: 0.9187, test_loss: 0.9122, test_f1: 0.5354
 epoch: 26, train_loss: 0.9148, test_loss: 0.8994, test_f1: 0.5400
 epoch: 27, train_loss: 0.9069, test_loss: 0.8951, test_f1: 0.5410
 epoch: 28, train_loss: 0.9055, test_loss: 0.8973, test_f1: 0.5475
 epoch: 29, train_loss: 0.8924, test_loss: 0.8877, test_f1: 0.5501
 epoch: 30, train_loss: 0.8914, test_loss: 0.9031, test_f1: 0.5342
 epoch: 31, train_loss: 0.8891, test_loss: 0.8841, test_f1: 0.5628
 epoch: 32, train_loss: 0.8715, test_loss: 0.8910, test_f1: 0.5586
 epoch: 33, train_loss: 0.8798, test_loss: 0.8881, test_f1: 0.5513
 epoch: 34, train_loss: 0.8775, test_loss: 0.8787, test_f1: 0.5487
 epoch: 35, train_loss: 0.8654, test_loss: 0.9075, test_f1: 0.5269
 epoch: 36, train_loss: 0.8591, test_loss: 0.8871, test_f1: 0.5578
 epoch: 37, train_loss: 0.8621, test_loss: 0.8903, test_f1: 0.5592
 epoch: 38, train_loss: 0.8492, test_loss: 0.8765, test_f1: 0.5558
 epoch: 39, train_loss: 0.8532, test_loss: 0.8861, test_f1: 0.5693
 epoch: 40, train_loss: 0.8519, test_loss: 0.8769, test_f1: 0.5744
 epoch: 41, train_loss: 0.8461, test_loss: 0.8820, test_f1: 0.5572
 epoch: 42, train_loss: 0.8372, test_loss: 0.8905, test_f1: 0.5621
 epoch: 43, train_loss: 0.8371, test_loss: 0.8771, test_f1: 0.5602
 epoch: 44, train_loss: 0.8395, test_loss: 0.8794, test_f1: 0.5580
 epoch: 45, train_loss: 0.8210, test_loss: 0.8679, test_f1: 0.5637
 epoch: 46, train_loss: 0.8250, test_loss: 0.8882, test_f1: 0.5564
 epoch: 47, train_loss: 0.8087, test_loss: 0.8884, test_f1: 0.5549
 epoch: 48, train_loss: 0.8161, test_loss: 0.8646, test_f1: 0.5679
 epoch: 49, train_loss: 0.8126, test_loss: 0.8740, test_f1: 0.5594
 epoch: 50, train_loss: 0.8075, test_loss: 0.8879, test_f1: 0.5645
 epoch: 51, train_loss: 0.7966, test_loss: 0.8759, test_f1: 0.5808
 epoch: 52, train_loss: 0.7949, test_loss: 0.8673, test_f1: 0.5696
 epoch: 53, train_loss: 0.7950, test_loss: 0.8689, test_f1: 0.5649
 epoch: 54, train_loss: 0.7944, test_loss: 0.8667, test_f1: 0.5737
 epoch: 55, train_loss: 0.7761, test_loss: 0.8647, test_f1: 0.5789
 epoch: 56, train_loss: 0.7826, test_loss: 0.8720, test_f1: 0.5748
 epoch: 57, train_loss: 0.7929, test_loss: 0.8697, test_f1: 0.5792
 epoch: 58, train_loss: 0.7846, test_loss: 0.8854, test_f1: 0.5670
 epoch: 59, train_loss: 0.7839, test_loss: 0.8777, test_f1: 0.5639
 epoch: 60, train_loss: 0.7835, test_loss: 0.8767, test_f1: 0.5720
 epoch: 61, train_loss: 0.7827, test_loss: 0.8707, test_f1: 0.5666
 epoch: 62, train_loss: 0.7814, test_loss: 0.8820, test_f1: 0.5654
 epoch: 63, train_loss: 0.7751, test_loss: 0.8722, test_f1: 0.5819
 epoch: 64, train_loss: 0.7789, test_loss: 0.8694, test_f1: 0.5810
 epoch: 65, train_loss: 0.7636, test_loss: 0.8729, test_f1: 0.5848
 epoch: 66, train_loss: 0.7751, test_loss: 0.8686, test_f1: 0.5802
 epoch: 67, train_loss: 0.7718, test_loss: 0.8685, test_f1: 0.5622
 epoch: 68, train_loss: 0.7715, test_loss: 0.8674, test_f1: 0.5860
 epoch: 69, train_loss: 0.7715, test_loss: 0.8661, test_f1: 0.5926
 epoch: 70, train_loss: 0.7600, test_loss: 0.8716, test_f1: 0.5921
 epoch: 71, train_loss: 0.7614, test_loss: 0.8788, test_f1: 0.5795
 epoch: 72, train_loss: 0.7598, test_loss: 0.8727, test_f1: 0.5913
 epoch: 73, train_loss: 0.7526, test_loss: 0.8735, test_f1: 0.6013
 epoch: 74, train_loss: 0.7532, test_loss: 0.8696, test_f1: 0.5893
 epoch: 75, train_loss: 0.7660, test_loss: 0.8736, test_f1: 0.5930
 epoch: 76, train_loss: 0.7559, test_loss: 0.8721, test_f1: 0.5885
 epoch: 77, train_loss: 0.7541, test_loss: 0.8702, test_f1: 0.5892
 epoch: 78, train_loss: 0.7458, test_loss: 0.8620, test_f1: 0.5958
 epoch: 79, train_loss: 0.7527, test_loss: 0.8702, test_f1: 0.5888
 epoch: 80, train_loss: 0.7503, test_loss: 0.8673, test_f1: 0.6119
 epoch: 81, train_loss: 0.7463, test_loss: 0.8722, test_f1: 0.5939
 epoch: 82, train_loss: 0.7465, test_loss: 0.8764, test_f1: 0.5871
 epoch: 83, train_loss: 0.7397, test_loss: 0.8755, test_f1: 0.5875
 epoch: 84, train_loss: 0.7485, test_loss: 0.8705, test_f1: 0.5920
 epoch: 85, train_loss: 0.7436, test_loss: 0.8708, test_f1: 0.5994
 epoch: 86, train_loss: 0.7424, test_loss: 0.8578, test_f1: 0.5981
 epoch: 87, train_loss: 0.7356, test_loss: 0.8631, test_f1: 0.6160
 epoch: 88, train_loss: 0.7385, test_loss: 0.8667, test_f1: 0.6183
 epoch: 89, train_loss: 0.7333, test_loss: 0.8593, test_f1: 0.6165
 epoch: 90, train_loss: 0.7293, test_loss: 0.8520, test_f1: 0.6163
 epoch: 91, train_loss: 0.7380, test_loss: 0.8631, test_f1: 0.6103
 epoch: 92, train_loss: 0.7394, test_loss: 0.8680, test_f1: 0.6043
 epoch: 93, train_loss: 0.7352, test_loss: 0.8642, test_f1: 0.6141
 epoch: 94, train_loss: 0.7198, test_loss: 0.8600, test_f1: 0.6246
 epoch: 95, train_loss: 0.7235, test_loss: 0.8602, test_f1: 0.6142
 epoch: 96, train_loss: 0.7213, test_loss: 0.8738, test_f1: 0.6061
 epoch: 97, train_loss: 0.7269, test_loss: 0.8715, test_f1: 0.6192
 epoch: 98, train_loss: 0.7245, test_loss: 0.8793, test_f1: 0.6089
 epoch: 99, train_loss: 0.7226, test_loss: 0.8751, test_f1: 0.6129
##################ITERATION #8 ****************************************
 epoch: 0, train_loss: 1.3363, test_loss: 1.3255, test_f1: 0.2270
 epoch: 1, train_loss: 1.2467, test_loss: 1.3585, test_f1: 0.2134
 epoch: 2, train_loss: 1.2016, test_loss: 1.3107, test_f1: 0.2928
 epoch: 3, train_loss: 1.1833, test_loss: 1.2216, test_f1: 0.3893
 epoch: 4, train_loss: 1.1625, test_loss: 1.1561, test_f1: 0.4260
 epoch: 5, train_loss: 1.1460, test_loss: 1.1058, test_f1: 0.4478
 epoch: 6, train_loss: 1.1214, test_loss: 1.0687, test_f1: 0.4507
 epoch: 7, train_loss: 1.1056, test_loss: 1.0479, test_f1: 0.4641
 epoch: 8, train_loss: 1.0848, test_loss: 1.0327, test_f1: 0.4572
 epoch: 9, train_loss: 1.0757, test_loss: 1.0074, test_f1: 0.4845
 epoch: 10, train_loss: 1.0688, test_loss: 1.0010, test_f1: 0.4606
 epoch: 11, train_loss: 1.0560, test_loss: 0.9837, test_f1: 0.4837
 epoch: 12, train_loss: 1.0380, test_loss: 0.9778, test_f1: 0.4865
 epoch: 13, train_loss: 1.0311, test_loss: 0.9615, test_f1: 0.4988
 epoch: 14, train_loss: 1.0215, test_loss: 0.9514, test_f1: 0.5080
 epoch: 15, train_loss: 1.0070, test_loss: 0.9540, test_f1: 0.4932
 epoch: 16, train_loss: 0.9989, test_loss: 0.9425, test_f1: 0.4867
 epoch: 17, train_loss: 0.9811, test_loss: 0.9334, test_f1: 0.4917
 epoch: 18, train_loss: 0.9783, test_loss: 0.9382, test_f1: 0.4886
 epoch: 19, train_loss: 0.9725, test_loss: 0.9200, test_f1: 0.4891
 epoch: 20, train_loss: 0.9636, test_loss: 0.9136, test_f1: 0.4987
 epoch: 21, train_loss: 0.9496, test_loss: 0.9152, test_f1: 0.5082
 epoch: 22, train_loss: 0.9478, test_loss: 0.9038, test_f1: 0.4996
 epoch: 23, train_loss: 0.9442, test_loss: 0.9185, test_f1: 0.4975
 epoch: 24, train_loss: 0.9316, test_loss: 0.9032, test_f1: 0.5084
 epoch: 25, train_loss: 0.9230, test_loss: 0.9144, test_f1: 0.5079
 epoch: 26, train_loss: 0.9206, test_loss: 0.9024, test_f1: 0.5248
 epoch: 27, train_loss: 0.9096, test_loss: 0.9082, test_f1: 0.5161
 epoch: 28, train_loss: 0.9072, test_loss: 0.9138, test_f1: 0.5170
 epoch: 29, train_loss: 0.9059, test_loss: 0.8931, test_f1: 0.5260
 epoch: 30, train_loss: 0.8998, test_loss: 0.8779, test_f1: 0.5265
 epoch: 31, train_loss: 0.8979, test_loss: 0.9059, test_f1: 0.5209
 epoch: 32, train_loss: 0.8982, test_loss: 0.9049, test_f1: 0.5322
 epoch: 33, train_loss: 0.8900, test_loss: 0.9091, test_f1: 0.5328
 epoch: 34, train_loss: 0.8838, test_loss: 0.9126, test_f1: 0.5414
 epoch: 35, train_loss: 0.8739, test_loss: 0.8992, test_f1: 0.5369
 epoch: 36, train_loss: 0.8659, test_loss: 0.8975, test_f1: 0.5411
 epoch: 37, train_loss: 0.8785, test_loss: 0.9057, test_f1: 0.5404
 epoch: 38, train_loss: 0.8645, test_loss: 0.8996, test_f1: 0.5519
 epoch: 39, train_loss: 0.8601, test_loss: 0.9128, test_f1: 0.5502
 epoch: 40, train_loss: 0.8610, test_loss: 0.9319, test_f1: 0.5456
 epoch: 41, train_loss: 0.8620, test_loss: 0.9065, test_f1: 0.5367
 epoch: 42, train_loss: 0.8503, test_loss: 0.9226, test_f1: 0.5375
 epoch: 43, train_loss: 0.8433, test_loss: 0.9137, test_f1: 0.5343
 epoch: 44, train_loss: 0.8607, test_loss: 0.9125, test_f1: 0.5379
 epoch: 45, train_loss: 0.8402, test_loss: 0.9160, test_f1: 0.5339
 epoch: 46, train_loss: 0.8379, test_loss: 0.8997, test_f1: 0.5353
 epoch: 47, train_loss: 0.8352, test_loss: 0.9089, test_f1: 0.5335
 epoch: 48, train_loss: 0.8258, test_loss: 0.9036, test_f1: 0.5466
 epoch: 49, train_loss: 0.8232, test_loss: 0.9077, test_f1: 0.5441
 epoch: 50, train_loss: 0.8178, test_loss: 0.9053, test_f1: 0.5481
 epoch: 51, train_loss: 0.8108, test_loss: 0.9177, test_f1: 0.5351
 epoch: 52, train_loss: 0.8154, test_loss: 0.9154, test_f1: 0.5374
 epoch: 53, train_loss: 0.8133, test_loss: 0.9231, test_f1: 0.5370
 epoch: 54, train_loss: 0.7945, test_loss: 0.9211, test_f1: 0.5438
 epoch: 55, train_loss: 0.8155, test_loss: 0.9269, test_f1: 0.5406
 epoch: 56, train_loss: 0.8108, test_loss: 0.9183, test_f1: 0.5452
 epoch: 57, train_loss: 0.8098, test_loss: 0.9140, test_f1: 0.5479
 epoch: 58, train_loss: 0.7991, test_loss: 0.9167, test_f1: 0.5578
 epoch: 59, train_loss: 0.8086, test_loss: 0.9133, test_f1: 0.5523
 epoch: 60, train_loss: 0.7972, test_loss: 0.9132, test_f1: 0.5547
 epoch: 61, train_loss: 0.7997, test_loss: 0.9180, test_f1: 0.5469
 epoch: 62, train_loss: 0.8010, test_loss: 0.9163, test_f1: 0.5552
 epoch: 63, train_loss: 0.7915, test_loss: 0.9174, test_f1: 0.5523
 epoch: 64, train_loss: 0.7936, test_loss: 0.9276, test_f1: 0.5403
 epoch: 65, train_loss: 0.7870, test_loss: 0.9188, test_f1: 0.5593
 epoch: 66, train_loss: 0.7821, test_loss: 0.9247, test_f1: 0.5419
 epoch: 67, train_loss: 0.7863, test_loss: 0.9297, test_f1: 0.5429
 epoch: 68, train_loss: 0.7879, test_loss: 0.9193, test_f1: 0.5603
 epoch: 69, train_loss: 0.7865, test_loss: 0.9236, test_f1: 0.5559
 epoch: 70, train_loss: 0.7811, test_loss: 0.9162, test_f1: 0.5577
 epoch: 71, train_loss: 0.7852, test_loss: 0.9161, test_f1: 0.5634
 epoch: 72, train_loss: 0.7775, test_loss: 0.9167, test_f1: 0.5574
 epoch: 73, train_loss: 0.7852, test_loss: 0.9283, test_f1: 0.5655
 epoch: 74, train_loss: 0.7768, test_loss: 0.9418, test_f1: 0.5558
 epoch: 75, train_loss: 0.7760, test_loss: 0.9208, test_f1: 0.5647
 epoch: 76, train_loss: 0.7814, test_loss: 0.9177, test_f1: 0.5682
 epoch: 77, train_loss: 0.7853, test_loss: 0.9287, test_f1: 0.5615
 epoch: 78, train_loss: 0.7697, test_loss: 0.9315, test_f1: 0.5603
 epoch: 79, train_loss: 0.7694, test_loss: 0.9250, test_f1: 0.5629
 epoch: 80, train_loss: 0.7682, test_loss: 0.9285, test_f1: 0.5615
 epoch: 81, train_loss: 0.7719, test_loss: 0.9172, test_f1: 0.5580
 epoch: 82, train_loss: 0.7682, test_loss: 0.9250, test_f1: 0.5676
 epoch: 83, train_loss: 0.7640, test_loss: 0.9321, test_f1: 0.5571
 epoch: 84, train_loss: 0.7734, test_loss: 0.9379, test_f1: 0.5536
 epoch: 85, train_loss: 0.7624, test_loss: 0.9308, test_f1: 0.5548
 epoch: 86, train_loss: 0.7660, test_loss: 0.9312, test_f1: 0.5588
 epoch: 87, train_loss: 0.7531, test_loss: 0.9408, test_f1: 0.5528
 epoch: 88, train_loss: 0.7573, test_loss: 0.9282, test_f1: 0.5575
 epoch: 89, train_loss: 0.7690, test_loss: 0.9324, test_f1: 0.5552
 epoch: 90, train_loss: 0.7518, test_loss: 0.9255, test_f1: 0.5796
 epoch: 91, train_loss: 0.7527, test_loss: 0.9372, test_f1: 0.5664
 epoch: 92, train_loss: 0.7606, test_loss: 0.9208, test_f1: 0.5657
 epoch: 93, train_loss: 0.7511, test_loss: 0.9272, test_f1: 0.5738
 epoch: 94, train_loss: 0.7473, test_loss: 0.9329, test_f1: 0.5744
 epoch: 95, train_loss: 0.7474, test_loss: 0.9246, test_f1: 0.5756
 epoch: 96, train_loss: 0.7414, test_loss: 0.9313, test_f1: 0.5664
 epoch: 97, train_loss: 0.7449, test_loss: 0.9309, test_f1: 0.5818
 epoch: 98, train_loss: 0.7436, test_loss: 0.9337, test_f1: 0.5703
 epoch: 99, train_loss: 0.7394, test_loss: 0.9229, test_f1: 0.5738
##################ITERATION #9 ****************************************
 epoch: 0, train_loss: 1.3049, test_loss: 1.3707, test_f1: 0.2248
 epoch: 1, train_loss: 1.2109, test_loss: 1.3095, test_f1: 0.2270
 epoch: 2, train_loss: 1.1809, test_loss: 1.2375, test_f1: 0.3531
 epoch: 3, train_loss: 1.1472, test_loss: 1.1761, test_f1: 0.3739
 epoch: 4, train_loss: 1.1322, test_loss: 1.0963, test_f1: 0.4089
 epoch: 5, train_loss: 1.1111, test_loss: 1.0545, test_f1: 0.4351
 epoch: 6, train_loss: 1.0883, test_loss: 1.0357, test_f1: 0.4423
 epoch: 7, train_loss: 1.0699, test_loss: 1.0185, test_f1: 0.4594
 epoch: 8, train_loss: 1.0642, test_loss: 1.0168, test_f1: 0.4542
 epoch: 9, train_loss: 1.0464, test_loss: 1.0054, test_f1: 0.4702
 epoch: 10, train_loss: 1.0423, test_loss: 0.9941, test_f1: 0.4545
 epoch: 11, train_loss: 1.0228, test_loss: 0.9833, test_f1: 0.4769
 epoch: 12, train_loss: 1.0157, test_loss: 0.9744, test_f1: 0.4827
 epoch: 13, train_loss: 1.0028, test_loss: 0.9689, test_f1: 0.4868
 epoch: 14, train_loss: 0.9996, test_loss: 0.9648, test_f1: 0.4894
 epoch: 15, train_loss: 0.9901, test_loss: 0.9691, test_f1: 0.4805
 epoch: 16, train_loss: 0.9850, test_loss: 0.9465, test_f1: 0.5032
 epoch: 17, train_loss: 0.9698, test_loss: 0.9507, test_f1: 0.4932
 epoch: 18, train_loss: 0.9671, test_loss: 0.9506, test_f1: 0.4869
 epoch: 19, train_loss: 0.9589, test_loss: 0.9365, test_f1: 0.5049
 epoch: 20, train_loss: 0.9513, test_loss: 0.9431, test_f1: 0.4985
 epoch: 21, train_loss: 0.9532, test_loss: 0.9336, test_f1: 0.5183
 epoch: 22, train_loss: 0.9443, test_loss: 0.9416, test_f1: 0.5104
 epoch: 23, train_loss: 0.9385, test_loss: 0.9313, test_f1: 0.5223
 epoch: 24, train_loss: 0.9350, test_loss: 0.9499, test_f1: 0.5019
 epoch: 25, train_loss: 0.9323, test_loss: 0.9274, test_f1: 0.5162
 epoch: 26, train_loss: 0.9214, test_loss: 0.9250, test_f1: 0.5324
 epoch: 27, train_loss: 0.9132, test_loss: 0.9319, test_f1: 0.5131
 epoch: 28, train_loss: 0.9063, test_loss: 0.9305, test_f1: 0.5214
 epoch: 29, train_loss: 0.9200, test_loss: 0.9274, test_f1: 0.5288
 epoch: 30, train_loss: 0.9061, test_loss: 0.9348, test_f1: 0.5276
 epoch: 31, train_loss: 0.8862, test_loss: 0.9350, test_f1: 0.5233
 epoch: 32, train_loss: 0.8940, test_loss: 0.9360, test_f1: 0.5218
 epoch: 33, train_loss: 0.8875, test_loss: 0.9288, test_f1: 0.5287
 epoch: 34, train_loss: 0.8910, test_loss: 0.9234, test_f1: 0.5385
 epoch: 35, train_loss: 0.8792, test_loss: 0.9194, test_f1: 0.5377
 epoch: 36, train_loss: 0.8622, test_loss: 0.9239, test_f1: 0.5331
 epoch: 37, train_loss: 0.8753, test_loss: 0.9176, test_f1: 0.5297
 epoch: 38, train_loss: 0.8808, test_loss: 0.9287, test_f1: 0.5339
 epoch: 39, train_loss: 0.8685, test_loss: 0.9316, test_f1: 0.5266
 epoch: 40, train_loss: 0.8553, test_loss: 0.9160, test_f1: 0.5413
 epoch: 41, train_loss: 0.8649, test_loss: 0.9238, test_f1: 0.5340
 epoch: 42, train_loss: 0.8651, test_loss: 0.9166, test_f1: 0.5433
 epoch: 43, train_loss: 0.8508, test_loss: 0.9329, test_f1: 0.5333
 epoch: 44, train_loss: 0.8425, test_loss: 0.9186, test_f1: 0.5382
 epoch: 45, train_loss: 0.8474, test_loss: 0.9225, test_f1: 0.5330
 epoch: 46, train_loss: 0.8367, test_loss: 0.9199, test_f1: 0.5369
 epoch: 47, train_loss: 0.8378, test_loss: 0.9369, test_f1: 0.5287
 epoch: 48, train_loss: 0.8409, test_loss: 0.9259, test_f1: 0.5338
 epoch: 49, train_loss: 0.8261, test_loss: 0.9241, test_f1: 0.5448
 epoch: 50, train_loss: 0.8412, test_loss: 0.9146, test_f1: 0.5440
 epoch: 51, train_loss: 0.8287, test_loss: 0.9162, test_f1: 0.5419
 epoch: 52, train_loss: 0.8134, test_loss: 0.9124, test_f1: 0.5476
 epoch: 53, train_loss: 0.8136, test_loss: 0.9241, test_f1: 0.5409
 epoch: 54, train_loss: 0.8225, test_loss: 0.9320, test_f1: 0.5467
 epoch: 55, train_loss: 0.8098, test_loss: 0.9318, test_f1: 0.5393
 epoch: 56, train_loss: 0.8028, test_loss: 0.9385, test_f1: 0.5440
 epoch: 57, train_loss: 0.8117, test_loss: 0.9330, test_f1: 0.5425
 epoch: 58, train_loss: 0.8068, test_loss: 0.9246, test_f1: 0.5511
 epoch: 59, train_loss: 0.8035, test_loss: 0.9328, test_f1: 0.5472
 epoch: 60, train_loss: 0.8102, test_loss: 0.9253, test_f1: 0.5506
 epoch: 61, train_loss: 0.8048, test_loss: 0.9192, test_f1: 0.5471
 epoch: 62, train_loss: 0.8064, test_loss: 0.9247, test_f1: 0.5570
 epoch: 63, train_loss: 0.7998, test_loss: 0.9277, test_f1: 0.5579
 epoch: 64, train_loss: 0.8023, test_loss: 0.9177, test_f1: 0.5599
 epoch: 65, train_loss: 0.8015, test_loss: 0.9348, test_f1: 0.5465
 epoch: 66, train_loss: 0.8007, test_loss: 0.9217, test_f1: 0.5529
 epoch: 67, train_loss: 0.7924, test_loss: 0.9241, test_f1: 0.5482
 epoch: 68, train_loss: 0.7962, test_loss: 0.9352, test_f1: 0.5431
 epoch: 69, train_loss: 0.7823, test_loss: 0.9325, test_f1: 0.5546
 epoch: 70, train_loss: 0.7851, test_loss: 0.9281, test_f1: 0.5557
 epoch: 71, train_loss: 0.7980, test_loss: 0.9327, test_f1: 0.5459
 epoch: 72, train_loss: 0.7939, test_loss: 0.9241, test_f1: 0.5525
 epoch: 73, train_loss: 0.7977, test_loss: 0.9279, test_f1: 0.5503
 epoch: 74, train_loss: 0.7919, test_loss: 0.9281, test_f1: 0.5471
 epoch: 75, train_loss: 0.7837, test_loss: 0.9263, test_f1: 0.5486
 epoch: 76, train_loss: 0.7908, test_loss: 0.9360, test_f1: 0.5588
 epoch: 77, train_loss: 0.7801, test_loss: 0.9492, test_f1: 0.5565
 epoch: 78, train_loss: 0.7817, test_loss: 0.9324, test_f1: 0.5586
 epoch: 79, train_loss: 0.7669, test_loss: 0.9269, test_f1: 0.5577
 epoch: 80, train_loss: 0.7683, test_loss: 0.9239, test_f1: 0.5587
 epoch: 81, train_loss: 0.7709, test_loss: 0.9368, test_f1: 0.5544
 epoch: 82, train_loss: 0.7840, test_loss: 0.9382, test_f1: 0.5578
 epoch: 83, train_loss: 0.7704, test_loss: 0.9331, test_f1: 0.5550
 epoch: 84, train_loss: 0.7739, test_loss: 0.9394, test_f1: 0.5609
 epoch: 85, train_loss: 0.7680, test_loss: 0.9246, test_f1: 0.5550
 epoch: 86, train_loss: 0.7593, test_loss: 0.9246, test_f1: 0.5594
 epoch: 87, train_loss: 0.7689, test_loss: 0.9411, test_f1: 0.5582
 epoch: 88, train_loss: 0.7566, test_loss: 0.9435, test_f1: 0.5486
 epoch: 89, train_loss: 0.7583, test_loss: 0.9395, test_f1: 0.5562
 epoch: 90, train_loss: 0.7562, test_loss: 0.9373, test_f1: 0.5517
 epoch: 91, train_loss: 0.7643, test_loss: 0.9418, test_f1: 0.5622
 epoch: 92, train_loss: 0.7648, test_loss: 0.9367, test_f1: 0.5622
 epoch: 93, train_loss: 0.7533, test_loss: 0.9402, test_f1: 0.5604
 epoch: 94, train_loss: 0.7592, test_loss: 0.9456, test_f1: 0.5610
 epoch: 95, train_loss: 0.7651, test_loss: 0.9313, test_f1: 0.5584
 epoch: 96, train_loss: 0.7575, test_loss: 0.9458, test_f1: 0.5614
 epoch: 97, train_loss: 0.7545, test_loss: 0.9481, test_f1: 0.5656
 epoch: 98, train_loss: 0.7410, test_loss: 0.9455, test_f1: 0.5664
 epoch: 99, train_loss: 0.7407, test_loss: 0.9374, test_f1: 0.5615

Training completed in 430.98 seconds
Best F1: 0.6246 at epoch 94
Mean F1 across iterations: 0.5762  0.0208
========================FINAL RESULTS================================
FEGIN weighted F1: 0.6246  0.0208
python main.py --data ltspice_examples --representation component_net --model FEGIN --layers 6 --hiddens 64 --batch_size 256 --lr 0.0001 --emb_size 512 --epochs 100 --save_appendix component_net_L6_H64_BS256_LR0.0001_E512 --no_val
-----



STDERR:
  File "main.py", line 370, in <module>
    main()
  File "main.py", line 254, in main
    dataset = dataset_class(
  File "/home/philip/projects/ltspice_examples_code_repo/Circuit-Completion-Using-GNNs/component_classification_with_link_prediction_head/evaluation/FEGIN/kernel/circuit_datasets.py", line 15, in __init__
    self.data, self.slices = torch.load(self.processed_paths[0])
  File "/home/philip/.local/lib/python3.8/site-packages/torch/serialization.py", line 1040, in load
    warnings.warn(
  File "/usr/lib/python3.8/warnings.py", line 109, in _showwarnmsg
    sw(msg.message, msg.category, msg.filename, msg.lineno,
  File "main.py", line 47, in warn_with_traceback
    traceback.print_stack(file=log)
/home/philip/projects/ltspice_examples_code_repo/Circuit-Completion-Using-GNNs/component_classification_with_link_prediction_head/evaluation/FEGIN/kernel/circuit_datasets.py:15: FutureWarning: You are using `torch.load` with `weights_only=False` (the current default value), which uses the default pickle module implicitly. It is possible to construct malicious pickle data which will execute arbitrary code during unpickling (See https://github.com/pytorch/pytorch/blob/main/SECURITY.md#untrusted-models for more details). In a future release, the default value for `weights_only` will be flipped to `True`. This limits the functions that could be executed during unpickling. Arbitrary objects will no longer be allowed to be loaded via this mode unless they are explicitly allowlisted by the user via `torch.serialization.add_safe_globals`. We recommend you start setting `weights_only=True` for any use case where you don't have full control of the loaded file. Please open an issue on GitHub for any issues related to this experimental feature.
  self.data, self.slices = torch.load(self.processed_paths[0])
