STDOUT:
Results will be saved in /home/philip/projects/ltspice_examples_code_repo/Circuit-Completion-Using-GNNs/component_classification_with_link_prediction_head/evaluation/FEGIN/results/model_FEGIN_dataset_ltspice_demos
Command line input: python main.py --data ltspice_demos --representation component_pin_net --model FEGIN --layers 6 --hiddens 64 --batch_size 64 --lr 0.001 --emb_size 512 --epochs 100 --save_appendix component_pin_net_L6_H64_BS64_LR0.001_E512 --no_val
 is saved.
-----
ltspice_demos - FEGIN
Using 6 layers, 64 hidden units, h = 2
Loading component_pin_net representation dataset
ENTERED
Training FEGIN on component_pin_net representation
Train: 1565, Test: 383
##################ITERATION #0 ****************************************
 epoch: 0, train_loss: 1.2779, test_loss: 1.3376, test_f1: 0.2281
 epoch: 1, train_loss: 1.1405, test_loss: 1.2461, test_f1: 0.3614
 epoch: 2, train_loss: 1.0950, test_loss: 1.1587, test_f1: 0.4048
 epoch: 3, train_loss: 1.0305, test_loss: 1.1393, test_f1: 0.4437
 epoch: 4, train_loss: 0.9902, test_loss: 1.0660, test_f1: 0.4945
 epoch: 5, train_loss: 0.9694, test_loss: 1.0679, test_f1: 0.4255
 epoch: 6, train_loss: 0.9400, test_loss: 1.0154, test_f1: 0.5542
 epoch: 7, train_loss: 0.9142, test_loss: 1.0464, test_f1: 0.5214
 epoch: 8, train_loss: 0.8937, test_loss: 0.9963, test_f1: 0.5057
 epoch: 9, train_loss: 0.8653, test_loss: 1.0087, test_f1: 0.5356
 epoch: 10, train_loss: 0.8567, test_loss: 1.0557, test_f1: 0.5302
 epoch: 11, train_loss: 0.8158, test_loss: 0.9738, test_f1: 0.5768
 epoch: 12, train_loss: 0.7947, test_loss: 1.0541, test_f1: 0.5853
 epoch: 13, train_loss: 0.7767, test_loss: 1.0034, test_f1: 0.6079
 epoch: 14, train_loss: 0.7248, test_loss: 0.9928, test_f1: 0.5937
 epoch: 15, train_loss: 0.7487, test_loss: 0.9548, test_f1: 0.6054
 epoch: 16, train_loss: 0.7367, test_loss: 1.0276, test_f1: 0.5647
 epoch: 17, train_loss: 0.7116, test_loss: 1.0833, test_f1: 0.5554
 epoch: 18, train_loss: 0.7054, test_loss: 0.9861, test_f1: 0.5657
 epoch: 19, train_loss: 0.6697, test_loss: 1.0545, test_f1: 0.6188
 epoch: 20, train_loss: 0.6675, test_loss: 1.0163, test_f1: 0.5708
 epoch: 21, train_loss: 0.6462, test_loss: 1.0541, test_f1: 0.5748
 epoch: 22, train_loss: 0.6193, test_loss: 1.1747, test_f1: 0.5695
 epoch: 23, train_loss: 0.5979, test_loss: 1.0267, test_f1: 0.6532
 epoch: 24, train_loss: 0.6055, test_loss: 1.0876, test_f1: 0.5933
 epoch: 25, train_loss: 0.5695, test_loss: 1.3075, test_f1: 0.5194
 epoch: 26, train_loss: 0.5772, test_loss: 1.1087, test_f1: 0.6352
 epoch: 27, train_loss: 0.5858, test_loss: 1.0781, test_f1: 0.6315
 epoch: 28, train_loss: 0.5547, test_loss: 1.0739, test_f1: 0.6374
 epoch: 29, train_loss: 0.5255, test_loss: 1.1547, test_f1: 0.6090
 epoch: 30, train_loss: 0.5422, test_loss: 1.2164, test_f1: 0.6335
 epoch: 31, train_loss: 0.4982, test_loss: 1.2009, test_f1: 0.6359
 epoch: 32, train_loss: 0.5016, test_loss: 1.3338, test_f1: 0.6153
 epoch: 33, train_loss: 0.5188, test_loss: 1.1902, test_f1: 0.6593
 epoch: 34, train_loss: 0.4615, test_loss: 1.2507, test_f1: 0.6172
 epoch: 35, train_loss: 0.4776, test_loss: 1.2282, test_f1: 0.6504
 epoch: 36, train_loss: 0.4890, test_loss: 1.3002, test_f1: 0.6477
 epoch: 37, train_loss: 0.4608, test_loss: 1.3754, test_f1: 0.5872
 epoch: 38, train_loss: 0.4855, test_loss: 1.2265, test_f1: 0.6495
 epoch: 39, train_loss: 0.4532, test_loss: 1.4877, test_f1: 0.5613
 epoch: 40, train_loss: 0.4339, test_loss: 1.3297, test_f1: 0.6434
 epoch: 41, train_loss: 0.4017, test_loss: 1.4182, test_f1: 0.6096
 epoch: 42, train_loss: 0.3798, test_loss: 1.3874, test_f1: 0.6326
 epoch: 43, train_loss: 0.4247, test_loss: 1.5123, test_f1: 0.5797
 epoch: 44, train_loss: 0.4056, test_loss: 1.5335, test_f1: 0.6291
 epoch: 45, train_loss: 0.3763, test_loss: 1.4045, test_f1: 0.6142
 epoch: 46, train_loss: 0.3527, test_loss: 1.5147, test_f1: 0.6402
 epoch: 47, train_loss: 0.3916, test_loss: 1.7286, test_f1: 0.6223
 epoch: 48, train_loss: 0.3423, test_loss: 1.4599, test_f1: 0.6253
 epoch: 49, train_loss: 0.3564, test_loss: 1.8885, test_f1: 0.6150
 epoch: 50, train_loss: 0.3549, test_loss: 1.7949, test_f1: 0.6223
 epoch: 51, train_loss: 0.2969, test_loss: 1.7266, test_f1: 0.6396
 epoch: 52, train_loss: 0.2853, test_loss: 1.7118, test_f1: 0.6246
 epoch: 53, train_loss: 0.2588, test_loss: 1.8016, test_f1: 0.6397
 epoch: 54, train_loss: 0.2376, test_loss: 1.9530, test_f1: 0.5959
 epoch: 55, train_loss: 0.2426, test_loss: 1.8713, test_f1: 0.6486
 epoch: 56, train_loss: 0.2391, test_loss: 1.9671, test_f1: 0.5977
 epoch: 57, train_loss: 0.2311, test_loss: 1.9295, test_f1: 0.6326
 epoch: 58, train_loss: 0.2256, test_loss: 2.1055, test_f1: 0.6129
 epoch: 59, train_loss: 0.2209, test_loss: 2.1296, test_f1: 0.6011
 epoch: 60, train_loss: 0.1888, test_loss: 2.3175, test_f1: 0.5915
 epoch: 61, train_loss: 0.2005, test_loss: 2.3111, test_f1: 0.6241
 epoch: 62, train_loss: 0.1989, test_loss: 2.3184, test_f1: 0.6014
 epoch: 63, train_loss: 0.1975, test_loss: 2.3405, test_f1: 0.6384
 epoch: 64, train_loss: 0.2007, test_loss: 2.4206, test_f1: 0.6000
 epoch: 65, train_loss: 0.1783, test_loss: 2.4487, test_f1: 0.6207
 epoch: 66, train_loss: 0.1771, test_loss: 2.5868, test_f1: 0.5976
 epoch: 67, train_loss: 0.1744, test_loss: 2.5267, test_f1: 0.6156
 epoch: 68, train_loss: 0.1685, test_loss: 2.5651, test_f1: 0.6101
 epoch: 69, train_loss: 0.1701, test_loss: 2.6220, test_f1: 0.6156
 epoch: 70, train_loss: 0.1758, test_loss: 2.6131, test_f1: 0.6005
 epoch: 71, train_loss: 0.1752, test_loss: 2.8192, test_f1: 0.6127
 epoch: 72, train_loss: 0.1649, test_loss: 2.5734, test_f1: 0.6102
 epoch: 73, train_loss: 0.1397, test_loss: 2.8866, test_f1: 0.6317
 epoch: 74, train_loss: 0.1564, test_loss: 2.8706, test_f1: 0.6097
 epoch: 75, train_loss: 0.1714, test_loss: 2.7909, test_f1: 0.5807
 epoch: 76, train_loss: 0.1804, test_loss: 2.8493, test_f1: 0.5783
 epoch: 77, train_loss: 0.1824, test_loss: 2.8365, test_f1: 0.5721
 epoch: 78, train_loss: 0.1412, test_loss: 2.7843, test_f1: 0.5923
 epoch: 79, train_loss: 0.1223, test_loss: 2.8971, test_f1: 0.5834
 epoch: 80, train_loss: 0.1406, test_loss: 2.9195, test_f1: 0.6239
 epoch: 81, train_loss: 0.1250, test_loss: 3.0019, test_f1: 0.6068
 epoch: 82, train_loss: 0.1287, test_loss: 3.0977, test_f1: 0.5867
 epoch: 83, train_loss: 0.1332, test_loss: 2.9262, test_f1: 0.6166
 epoch: 84, train_loss: 0.1144, test_loss: 3.0439, test_f1: 0.6063
 epoch: 85, train_loss: 0.1291, test_loss: 3.0588, test_f1: 0.5989
 epoch: 86, train_loss: 0.1356, test_loss: 3.0630, test_f1: 0.6044
 epoch: 87, train_loss: 0.1154, test_loss: 3.0551, test_f1: 0.6014
 epoch: 88, train_loss: 0.1258, test_loss: 3.3275, test_f1: 0.5739
 epoch: 89, train_loss: 0.1509, test_loss: 3.1834, test_f1: 0.5873
 epoch: 90, train_loss: 0.1412, test_loss: 2.8860, test_f1: 0.6007
 epoch: 91, train_loss: 0.1598, test_loss: 3.0422, test_f1: 0.5945
 epoch: 92, train_loss: 0.1270, test_loss: 3.2362, test_f1: 0.5885
 epoch: 93, train_loss: 0.1153, test_loss: 3.1853, test_f1: 0.5867
 epoch: 94, train_loss: 0.1416, test_loss: 3.1316, test_f1: 0.6181
 epoch: 95, train_loss: 0.1320, test_loss: 3.3169, test_f1: 0.6111
 epoch: 96, train_loss: 0.1662, test_loss: 3.1846, test_f1: 0.6084
 epoch: 97, train_loss: 0.1337, test_loss: 3.1226, test_f1: 0.6069
 epoch: 98, train_loss: 0.1303, test_loss: 3.2582, test_f1: 0.6094
 epoch: 99, train_loss: 0.1148, test_loss: 3.0087, test_f1: 0.6090
##################ITERATION #1 ****************************************
 epoch: 0, train_loss: 1.1640, test_loss: 1.3068, test_f1: 0.2597
 epoch: 1, train_loss: 0.9980, test_loss: 1.1973, test_f1: 0.3456
 epoch: 2, train_loss: 0.9656, test_loss: 1.0463, test_f1: 0.5042
 epoch: 3, train_loss: 0.9399, test_loss: 1.0156, test_f1: 0.5320
 epoch: 4, train_loss: 0.9281, test_loss: 1.0446, test_f1: 0.5114
 epoch: 5, train_loss: 0.8925, test_loss: 1.0196, test_f1: 0.5049
 epoch: 6, train_loss: 0.8795, test_loss: 1.0704, test_f1: 0.5659
 epoch: 7, train_loss: 0.8536, test_loss: 1.0582, test_f1: 0.5400
 epoch: 8, train_loss: 0.8411, test_loss: 1.0649, test_f1: 0.5153
 epoch: 9, train_loss: 0.8132, test_loss: 1.0830, test_f1: 0.5810
 epoch: 10, train_loss: 0.7805, test_loss: 1.0707, test_f1: 0.5575
 epoch: 11, train_loss: 0.7998, test_loss: 1.0381, test_f1: 0.5704
 epoch: 12, train_loss: 0.7612, test_loss: 1.1115, test_f1: 0.5512
 epoch: 13, train_loss: 0.7238, test_loss: 1.1255, test_f1: 0.5833
 epoch: 14, train_loss: 0.7043, test_loss: 1.1341, test_f1: 0.5928
 epoch: 15, train_loss: 0.6790, test_loss: 1.1459, test_f1: 0.6092
 epoch: 16, train_loss: 0.6603, test_loss: 1.1685, test_f1: 0.6064
 epoch: 17, train_loss: 0.6682, test_loss: 1.1279, test_f1: 0.5644
 epoch: 18, train_loss: 0.6391, test_loss: 1.1580, test_f1: 0.6076
 epoch: 19, train_loss: 0.6254, test_loss: 1.2335, test_f1: 0.6036
 epoch: 20, train_loss: 0.6279, test_loss: 1.1656, test_f1: 0.6036
 epoch: 21, train_loss: 0.5887, test_loss: 1.2425, test_f1: 0.5979
 epoch: 22, train_loss: 0.5780, test_loss: 1.3003, test_f1: 0.6022
 epoch: 23, train_loss: 0.5664, test_loss: 1.2614, test_f1: 0.6234
 epoch: 24, train_loss: 0.5634, test_loss: 1.1834, test_f1: 0.6010
 epoch: 25, train_loss: 0.5263, test_loss: 1.1840, test_f1: 0.6083
 epoch: 26, train_loss: 0.5215, test_loss: 1.3141, test_f1: 0.6346
 epoch: 27, train_loss: 0.5379, test_loss: 1.3880, test_f1: 0.6196
 epoch: 28, train_loss: 0.5028, test_loss: 1.3562, test_f1: 0.6232
 epoch: 29, train_loss: 0.4940, test_loss: 1.4447, test_f1: 0.5827
 epoch: 30, train_loss: 0.4748, test_loss: 1.4121, test_f1: 0.5941
 epoch: 31, train_loss: 0.4532, test_loss: 1.4460, test_f1: 0.6191
 epoch: 32, train_loss: 0.4730, test_loss: 1.4305, test_f1: 0.6136
 epoch: 33, train_loss: 0.4627, test_loss: 1.4744, test_f1: 0.6180
 epoch: 34, train_loss: 0.4589, test_loss: 1.4969, test_f1: 0.6100
 epoch: 35, train_loss: 0.4408, test_loss: 1.5597, test_f1: 0.5840
 epoch: 36, train_loss: 0.4204, test_loss: 1.5159, test_f1: 0.6150
 epoch: 37, train_loss: 0.4094, test_loss: 1.6204, test_f1: 0.6063
 epoch: 38, train_loss: 0.3815, test_loss: 1.5786, test_f1: 0.6098
 epoch: 39, train_loss: 0.3747, test_loss: 1.5330, test_f1: 0.6265
 epoch: 40, train_loss: 0.3976, test_loss: 1.6132, test_f1: 0.6365
 epoch: 41, train_loss: 0.3919, test_loss: 1.5134, test_f1: 0.6371
 epoch: 42, train_loss: 0.3865, test_loss: 1.8201, test_f1: 0.5645
 epoch: 43, train_loss: 0.3423, test_loss: 1.6653, test_f1: 0.6099
 epoch: 44, train_loss: 0.3557, test_loss: 1.8271, test_f1: 0.6117
 epoch: 45, train_loss: 0.3751, test_loss: 1.6945, test_f1: 0.5817
 epoch: 46, train_loss: 0.3529, test_loss: 2.1320, test_f1: 0.6275
 epoch: 47, train_loss: 0.3342, test_loss: 1.8636, test_f1: 0.6165
 epoch: 48, train_loss: 0.3339, test_loss: 1.9615, test_f1: 0.5031
 epoch: 49, train_loss: 0.3361, test_loss: 1.8497, test_f1: 0.6265
 epoch: 50, train_loss: 0.3058, test_loss: 2.0881, test_f1: 0.6094
 epoch: 51, train_loss: 0.2671, test_loss: 2.1061, test_f1: 0.5481
 epoch: 52, train_loss: 0.2206, test_loss: 2.0451, test_f1: 0.5998
 epoch: 53, train_loss: 0.2316, test_loss: 2.0910, test_f1: 0.5987
 epoch: 54, train_loss: 0.2182, test_loss: 2.1874, test_f1: 0.6012
 epoch: 55, train_loss: 0.1928, test_loss: 2.2703, test_f1: 0.5819
 epoch: 56, train_loss: 0.2203, test_loss: 2.1969, test_f1: 0.6157
 epoch: 57, train_loss: 0.1920, test_loss: 2.2651, test_f1: 0.5973
 epoch: 58, train_loss: 0.2053, test_loss: 2.4297, test_f1: 0.5999
 epoch: 59, train_loss: 0.2006, test_loss: 2.2660, test_f1: 0.5863
 epoch: 60, train_loss: 0.1867, test_loss: 2.3568, test_f1: 0.5965
 epoch: 61, train_loss: 0.1696, test_loss: 2.4852, test_f1: 0.5714
 epoch: 62, train_loss: 0.1941, test_loss: 2.4626, test_f1: 0.5818
 epoch: 63, train_loss: 0.2182, test_loss: 2.4495, test_f1: 0.6068
 epoch: 64, train_loss: 0.1815, test_loss: 2.4407, test_f1: 0.6148
 epoch: 65, train_loss: 0.1771, test_loss: 2.4898, test_f1: 0.5938
 epoch: 66, train_loss: 0.1660, test_loss: 2.6226, test_f1: 0.6142
 epoch: 67, train_loss: 0.1580, test_loss: 2.8094, test_f1: 0.5875
 epoch: 68, train_loss: 0.1486, test_loss: 2.8438, test_f1: 0.5843
 epoch: 69, train_loss: 0.1418, test_loss: 2.7332, test_f1: 0.5941
 epoch: 70, train_loss: 0.1829, test_loss: 2.9038, test_f1: 0.5912
 epoch: 71, train_loss: 0.1774, test_loss: 2.8285, test_f1: 0.5994
 epoch: 72, train_loss: 0.1547, test_loss: 2.7697, test_f1: 0.5647
 epoch: 73, train_loss: 0.1699, test_loss: 2.6296, test_f1: 0.5968
 epoch: 74, train_loss: 0.1550, test_loss: 2.5316, test_f1: 0.6074
 epoch: 75, train_loss: 0.1358, test_loss: 2.5949, test_f1: 0.6067
 epoch: 76, train_loss: 0.1309, test_loss: 2.9105, test_f1: 0.5995
 epoch: 77, train_loss: 0.1291, test_loss: 2.8040, test_f1: 0.6063
 epoch: 78, train_loss: 0.1526, test_loss: 3.0413, test_f1: 0.5956
 epoch: 79, train_loss: 0.1281, test_loss: 3.0440, test_f1: 0.5745
 epoch: 80, train_loss: 0.1709, test_loss: 2.8778, test_f1: 0.6000
 epoch: 81, train_loss: 0.1729, test_loss: 2.9433, test_f1: 0.5810
 epoch: 82, train_loss: 0.1525, test_loss: 2.9070, test_f1: 0.5830
 epoch: 83, train_loss: 0.1407, test_loss: 2.9379, test_f1: 0.5961
 epoch: 84, train_loss: 0.1361, test_loss: 2.8974, test_f1: 0.6121
 epoch: 85, train_loss: 0.1471, test_loss: 2.9271, test_f1: 0.6151
 epoch: 86, train_loss: 0.1223, test_loss: 2.9625, test_f1: 0.6203
 epoch: 87, train_loss: 0.1213, test_loss: 3.2299, test_f1: 0.5925
 epoch: 88, train_loss: 0.1215, test_loss: 3.1187, test_f1: 0.5930
 epoch: 89, train_loss: 0.1001, test_loss: 3.2610, test_f1: 0.6121
 epoch: 90, train_loss: 0.1007, test_loss: 3.4413, test_f1: 0.5780
 epoch: 91, train_loss: 0.1051, test_loss: 3.2472, test_f1: 0.5770
 epoch: 92, train_loss: 0.1253, test_loss: 3.3536, test_f1: 0.5853
 epoch: 93, train_loss: 0.1469, test_loss: 3.6111, test_f1: 0.5988
 epoch: 94, train_loss: 0.1587, test_loss: 3.2201, test_f1: 0.5843
 epoch: 95, train_loss: 0.1568, test_loss: 3.4274, test_f1: 0.5756
 epoch: 96, train_loss: 0.1475, test_loss: 3.4489, test_f1: 0.5960
 epoch: 97, train_loss: 0.1327, test_loss: 3.2657, test_f1: 0.5950
 epoch: 98, train_loss: 0.1245, test_loss: 3.2222, test_f1: 0.6087
 epoch: 99, train_loss: 0.1199, test_loss: 3.2156, test_f1: 0.5814
##################ITERATION #2 ****************************************
 epoch: 0, train_loss: 1.1577, test_loss: 1.3185, test_f1: 0.2398
 epoch: 1, train_loss: 1.0166, test_loss: 1.2068, test_f1: 0.4080
 epoch: 2, train_loss: 0.9599, test_loss: 1.1088, test_f1: 0.4414
 epoch: 3, train_loss: 0.9413, test_loss: 1.0548, test_f1: 0.5207
 epoch: 4, train_loss: 0.9202, test_loss: 1.0556, test_f1: 0.4956
 epoch: 5, train_loss: 0.8932, test_loss: 1.0349, test_f1: 0.5698
 epoch: 6, train_loss: 0.8645, test_loss: 1.0506, test_f1: 0.5524
 epoch: 7, train_loss: 0.8525, test_loss: 1.1022, test_f1: 0.5199
 epoch: 8, train_loss: 0.8157, test_loss: 1.0672, test_f1: 0.5093
 epoch: 9, train_loss: 0.8101, test_loss: 1.0392, test_f1: 0.5411
 epoch: 10, train_loss: 0.7936, test_loss: 1.1270, test_f1: 0.5149
 epoch: 11, train_loss: 0.7694, test_loss: 1.0515, test_f1: 0.5286
 epoch: 12, train_loss: 0.7262, test_loss: 1.0984, test_f1: 0.5422
 epoch: 13, train_loss: 0.7175, test_loss: 1.1546, test_f1: 0.5134
 epoch: 14, train_loss: 0.7061, test_loss: 1.0909, test_f1: 0.5864
 epoch: 15, train_loss: 0.6972, test_loss: 1.0473, test_f1: 0.5790
 epoch: 16, train_loss: 0.6680, test_loss: 1.0586, test_f1: 0.5629
 epoch: 17, train_loss: 0.6459, test_loss: 1.1340, test_f1: 0.5535
 epoch: 18, train_loss: 0.6611, test_loss: 1.1326, test_f1: 0.5366
 epoch: 19, train_loss: 0.6192, test_loss: 1.1507, test_f1: 0.6160
 epoch: 20, train_loss: 0.5913, test_loss: 1.2081, test_f1: 0.5764
 epoch: 21, train_loss: 0.5888, test_loss: 1.2930, test_f1: 0.5993
 epoch: 22, train_loss: 0.5752, test_loss: 1.1178, test_f1: 0.6135
 epoch: 23, train_loss: 0.5508, test_loss: 1.2412, test_f1: 0.6080
 epoch: 24, train_loss: 0.5344, test_loss: 1.3852, test_f1: 0.5892
 epoch: 25, train_loss: 0.5485, test_loss: 1.3159, test_f1: 0.5810
 epoch: 26, train_loss: 0.5451, test_loss: 1.2748, test_f1: 0.6324
 epoch: 27, train_loss: 0.5349, test_loss: 1.3063, test_f1: 0.6206
 epoch: 28, train_loss: 0.5322, test_loss: 1.2317, test_f1: 0.5942
 epoch: 29, train_loss: 0.5147, test_loss: 1.3627, test_f1: 0.6005
 epoch: 30, train_loss: 0.4948, test_loss: 1.3483, test_f1: 0.6036
 epoch: 31, train_loss: 0.4911, test_loss: 1.3375, test_f1: 0.5815
 epoch: 32, train_loss: 0.4736, test_loss: 1.4504, test_f1: 0.6001
 epoch: 33, train_loss: 0.4736, test_loss: 1.4257, test_f1: 0.6083
 epoch: 34, train_loss: 0.4683, test_loss: 1.4464, test_f1: 0.6196
 epoch: 35, train_loss: 0.4516, test_loss: 1.5774, test_f1: 0.5817
 epoch: 36, train_loss: 0.4176, test_loss: 1.5411, test_f1: 0.6148
 epoch: 37, train_loss: 0.4392, test_loss: 1.4394, test_f1: 0.5895
 epoch: 38, train_loss: 0.4177, test_loss: 1.6282, test_f1: 0.6415
 epoch: 39, train_loss: 0.4124, test_loss: 1.6557, test_f1: 0.6048
 epoch: 40, train_loss: 0.3956, test_loss: 1.4932, test_f1: 0.5998
 epoch: 41, train_loss: 0.3995, test_loss: 1.8248, test_f1: 0.5890
 epoch: 42, train_loss: 0.4005, test_loss: 1.6229, test_f1: 0.6196
 epoch: 43, train_loss: 0.4039, test_loss: 1.5247, test_f1: 0.6009
 epoch: 44, train_loss: 0.4318, test_loss: 1.6641, test_f1: 0.5622
 epoch: 45, train_loss: 0.4098, test_loss: 1.5170, test_f1: 0.6309
 epoch: 46, train_loss: 0.3778, test_loss: 1.6872, test_f1: 0.5880
 epoch: 47, train_loss: 0.3736, test_loss: 1.6383, test_f1: 0.6121
 epoch: 48, train_loss: 0.3573, test_loss: 1.6508, test_f1: 0.6053
 epoch: 49, train_loss: 0.3604, test_loss: 1.7383, test_f1: 0.6005
 epoch: 50, train_loss: 0.3121, test_loss: 1.9269, test_f1: 0.5641
 epoch: 51, train_loss: 0.2799, test_loss: 1.8704, test_f1: 0.6081
 epoch: 52, train_loss: 0.2724, test_loss: 1.8619, test_f1: 0.6149
 epoch: 53, train_loss: 0.2644, test_loss: 1.8753, test_f1: 0.6279
 epoch: 54, train_loss: 0.2514, test_loss: 1.9422, test_f1: 0.6182
 epoch: 55, train_loss: 0.2108, test_loss: 2.0209, test_f1: 0.5970
 epoch: 56, train_loss: 0.2430, test_loss: 2.0498, test_f1: 0.5978
 epoch: 57, train_loss: 0.2649, test_loss: 2.0560, test_f1: 0.5947
 epoch: 58, train_loss: 0.2382, test_loss: 2.0521, test_f1: 0.6057
 epoch: 59, train_loss: 0.2101, test_loss: 2.2002, test_f1: 0.6138
 epoch: 60, train_loss: 0.2038, test_loss: 2.3121, test_f1: 0.5974
 epoch: 61, train_loss: 0.2078, test_loss: 2.2548, test_f1: 0.6129
 epoch: 62, train_loss: 0.2412, test_loss: 2.2679, test_f1: 0.6022
 epoch: 63, train_loss: 0.2047, test_loss: 2.1965, test_f1: 0.6363
 epoch: 64, train_loss: 0.1799, test_loss: 2.2843, test_f1: 0.6113
 epoch: 65, train_loss: 0.1874, test_loss: 2.2472, test_f1: 0.6178
 epoch: 66, train_loss: 0.1913, test_loss: 2.5054, test_f1: 0.6033
 epoch: 67, train_loss: 0.1991, test_loss: 2.3635, test_f1: 0.6153
 epoch: 68, train_loss: 0.1571, test_loss: 2.3115, test_f1: 0.6008
 epoch: 69, train_loss: 0.1682, test_loss: 2.5394, test_f1: 0.6174
 epoch: 70, train_loss: 0.1588, test_loss: 2.6908, test_f1: 0.5825
 epoch: 71, train_loss: 0.1855, test_loss: 2.5754, test_f1: 0.5749
 epoch: 72, train_loss: 0.1806, test_loss: 2.5730, test_f1: 0.5943
 epoch: 73, train_loss: 0.1957, test_loss: 2.5413, test_f1: 0.6022
 epoch: 74, train_loss: 0.1801, test_loss: 2.4926, test_f1: 0.5945
 epoch: 75, train_loss: 0.1897, test_loss: 2.6909, test_f1: 0.6117
 epoch: 76, train_loss: 0.1811, test_loss: 2.6475, test_f1: 0.5676
 epoch: 77, train_loss: 0.1732, test_loss: 2.6327, test_f1: 0.5993
 epoch: 78, train_loss: 0.1604, test_loss: 2.5654, test_f1: 0.5715
 epoch: 79, train_loss: 0.1407, test_loss: 2.5240, test_f1: 0.6163
 epoch: 80, train_loss: 0.1564, test_loss: 2.7361, test_f1: 0.6130
 epoch: 81, train_loss: 0.1472, test_loss: 2.8046, test_f1: 0.5558
 epoch: 82, train_loss: 0.1514, test_loss: 2.9715, test_f1: 0.5724
 epoch: 83, train_loss: 0.1446, test_loss: 2.7023, test_f1: 0.6094
 epoch: 84, train_loss: 0.1360, test_loss: 3.0363, test_f1: 0.6144
 epoch: 85, train_loss: 0.1374, test_loss: 2.8134, test_f1: 0.5972
 epoch: 86, train_loss: 0.1369, test_loss: 2.9199, test_f1: 0.6088
 epoch: 87, train_loss: 0.1561, test_loss: 2.9257, test_f1: 0.5749
 epoch: 88, train_loss: 0.1403, test_loss: 2.9585, test_f1: 0.5989
 epoch: 89, train_loss: 0.1320, test_loss: 3.0923, test_f1: 0.5960
 epoch: 90, train_loss: 0.1412, test_loss: 2.9073, test_f1: 0.6155
 epoch: 91, train_loss: 0.1609, test_loss: 2.8204, test_f1: 0.5909
 epoch: 92, train_loss: 0.1533, test_loss: 3.0345, test_f1: 0.5929
 epoch: 93, train_loss: 0.1339, test_loss: 3.0367, test_f1: 0.6183
 epoch: 94, train_loss: 0.1089, test_loss: 3.0459, test_f1: 0.6290
 epoch: 95, train_loss: 0.1234, test_loss: 2.9666, test_f1: 0.5703
 epoch: 96, train_loss: 0.1198, test_loss: 3.0423, test_f1: 0.6098
 epoch: 97, train_loss: 0.1087, test_loss: 3.1141, test_f1: 0.6125
 epoch: 98, train_loss: 0.1091, test_loss: 3.2008, test_f1: 0.6028
 epoch: 99, train_loss: 0.1227, test_loss: 3.3894, test_f1: 0.5832
##################ITERATION #3 ****************************************
 epoch: 0, train_loss: 1.1948, test_loss: 1.4137, test_f1: 0.1365
 epoch: 1, train_loss: 1.0098, test_loss: 1.2844, test_f1: 0.2762
 epoch: 2, train_loss: 0.9654, test_loss: 1.0939, test_f1: 0.4615
 epoch: 3, train_loss: 0.9241, test_loss: 1.0422, test_f1: 0.4942
 epoch: 4, train_loss: 0.8954, test_loss: 1.0727, test_f1: 0.5474
 epoch: 5, train_loss: 0.8614, test_loss: 1.0817, test_f1: 0.5494
 epoch: 6, train_loss: 0.8366, test_loss: 1.0448, test_f1: 0.5684
 epoch: 7, train_loss: 0.7952, test_loss: 1.0665, test_f1: 0.5972
 epoch: 8, train_loss: 0.8124, test_loss: 1.0787, test_f1: 0.5225
 epoch: 9, train_loss: 0.7695, test_loss: 1.0839, test_f1: 0.5642
 epoch: 10, train_loss: 0.7614, test_loss: 1.0932, test_f1: 0.5442
 epoch: 11, train_loss: 0.7406, test_loss: 1.0242, test_f1: 0.5998
 epoch: 12, train_loss: 0.7135, test_loss: 1.0798, test_f1: 0.5760
 epoch: 13, train_loss: 0.6957, test_loss: 1.0384, test_f1: 0.6258
 epoch: 14, train_loss: 0.7115, test_loss: 1.1226, test_f1: 0.5786
 epoch: 15, train_loss: 0.6813, test_loss: 1.1249, test_f1: 0.5561
 epoch: 16, train_loss: 0.6618, test_loss: 1.1520, test_f1: 0.5974
 epoch: 17, train_loss: 0.6398, test_loss: 1.1941, test_f1: 0.6007
 epoch: 18, train_loss: 0.6029, test_loss: 1.1996, test_f1: 0.6236
 epoch: 19, train_loss: 0.5983, test_loss: 1.1696, test_f1: 0.5922
 epoch: 20, train_loss: 0.6036, test_loss: 1.2753, test_f1: 0.6446
 epoch: 21, train_loss: 0.5722, test_loss: 1.1776, test_f1: 0.5991
 epoch: 22, train_loss: 0.5546, test_loss: 1.3038, test_f1: 0.6147
 epoch: 23, train_loss: 0.5561, test_loss: 1.2467, test_f1: 0.5796
 epoch: 24, train_loss: 0.5533, test_loss: 1.1808, test_f1: 0.6188
 epoch: 25, train_loss: 0.5305, test_loss: 1.3320, test_f1: 0.6073
 epoch: 26, train_loss: 0.5101, test_loss: 1.4135, test_f1: 0.6134
 epoch: 27, train_loss: 0.5045, test_loss: 1.3188, test_f1: 0.5971
 epoch: 28, train_loss: 0.5118, test_loss: 1.3162, test_f1: 0.5872
 epoch: 29, train_loss: 0.4763, test_loss: 1.3605, test_f1: 0.6185
 epoch: 30, train_loss: 0.4853, test_loss: 1.3712, test_f1: 0.6198
 epoch: 31, train_loss: 0.4824, test_loss: 1.3294, test_f1: 0.6067
 epoch: 32, train_loss: 0.4615, test_loss: 1.3750, test_f1: 0.6322
 epoch: 33, train_loss: 0.4433, test_loss: 1.4584, test_f1: 0.6133
 epoch: 34, train_loss: 0.4591, test_loss: 1.4344, test_f1: 0.5701
 epoch: 35, train_loss: 0.4383, test_loss: 1.4795, test_f1: 0.6384
 epoch: 36, train_loss: 0.4049, test_loss: 1.4658, test_f1: 0.6147
 epoch: 37, train_loss: 0.4252, test_loss: 1.4445, test_f1: 0.6227
 epoch: 38, train_loss: 0.3659, test_loss: 1.4791, test_f1: 0.6273
 epoch: 39, train_loss: 0.3547, test_loss: 1.7498, test_f1: 0.6024
 epoch: 40, train_loss: 0.3912, test_loss: 1.5072, test_f1: 0.6211
 epoch: 41, train_loss: 0.3834, test_loss: 1.4812, test_f1: 0.6258
 epoch: 42, train_loss: 0.3696, test_loss: 1.5410, test_f1: 0.6318
 epoch: 43, train_loss: 0.3430, test_loss: 1.7889, test_f1: 0.6332
 epoch: 44, train_loss: 0.3505, test_loss: 1.8084, test_f1: 0.6476
 epoch: 45, train_loss: 0.3828, test_loss: 1.6821, test_f1: 0.6262
 epoch: 46, train_loss: 0.3334, test_loss: 1.6513, test_f1: 0.6016
 epoch: 47, train_loss: 0.3564, test_loss: 1.6710, test_f1: 0.5778
 epoch: 48, train_loss: 0.3236, test_loss: 1.8153, test_f1: 0.5920
 epoch: 49, train_loss: 0.3221, test_loss: 1.7323, test_f1: 0.6027
 epoch: 50, train_loss: 0.3437, test_loss: 1.7357, test_f1: 0.6159
 epoch: 51, train_loss: 0.2815, test_loss: 1.8353, test_f1: 0.6062
 epoch: 52, train_loss: 0.2493, test_loss: 1.7823, test_f1: 0.6220
 epoch: 53, train_loss: 0.2387, test_loss: 1.9114, test_f1: 0.6037
 epoch: 54, train_loss: 0.2348, test_loss: 2.0520, test_f1: 0.6432
 epoch: 55, train_loss: 0.2198, test_loss: 2.0785, test_f1: 0.6091
 epoch: 56, train_loss: 0.2205, test_loss: 1.9503, test_f1: 0.6101
 epoch: 57, train_loss: 0.2190, test_loss: 2.1276, test_f1: 0.6027
 epoch: 58, train_loss: 0.2127, test_loss: 2.1571, test_f1: 0.6067
 epoch: 59, train_loss: 0.2220, test_loss: 2.2468, test_f1: 0.6163
 epoch: 60, train_loss: 0.1940, test_loss: 2.2330, test_f1: 0.6206
 epoch: 61, train_loss: 0.2130, test_loss: 2.1445, test_f1: 0.6149
 epoch: 62, train_loss: 0.2198, test_loss: 2.1231, test_f1: 0.6187
 epoch: 63, train_loss: 0.2141, test_loss: 2.1954, test_f1: 0.5930
 epoch: 64, train_loss: 0.1877, test_loss: 2.4689, test_f1: 0.6029
 epoch: 65, train_loss: 0.1919, test_loss: 2.3961, test_f1: 0.6069
 epoch: 66, train_loss: 0.1745, test_loss: 2.4256, test_f1: 0.5966
 epoch: 67, train_loss: 0.1730, test_loss: 2.3972, test_f1: 0.6191
 epoch: 68, train_loss: 0.2157, test_loss: 2.1941, test_f1: 0.5979
 epoch: 69, train_loss: 0.2009, test_loss: 2.4866, test_f1: 0.5977
 epoch: 70, train_loss: 0.1738, test_loss: 2.3270, test_f1: 0.5925
 epoch: 71, train_loss: 0.2052, test_loss: 2.5499, test_f1: 0.5964
 epoch: 72, train_loss: 0.1744, test_loss: 2.5129, test_f1: 0.5929
 epoch: 73, train_loss: 0.1636, test_loss: 2.5060, test_f1: 0.6067
 epoch: 74, train_loss: 0.2199, test_loss: 2.6000, test_f1: 0.5770
 epoch: 75, train_loss: 0.1752, test_loss: 2.3859, test_f1: 0.6078
 epoch: 76, train_loss: 0.1795, test_loss: 2.4036, test_f1: 0.5993
 epoch: 77, train_loss: 0.1734, test_loss: 2.4443, test_f1: 0.6032
 epoch: 78, train_loss: 0.1842, test_loss: 2.4094, test_f1: 0.6163
 epoch: 79, train_loss: 0.1688, test_loss: 2.6103, test_f1: 0.5965
 epoch: 80, train_loss: 0.1558, test_loss: 2.5682, test_f1: 0.6147
 epoch: 81, train_loss: 0.1529, test_loss: 2.6505, test_f1: 0.5895
 epoch: 82, train_loss: 0.1524, test_loss: 2.7825, test_f1: 0.6128
 epoch: 83, train_loss: 0.1700, test_loss: 2.6622, test_f1: 0.5968
 epoch: 84, train_loss: 0.1488, test_loss: 2.6916, test_f1: 0.6174
 epoch: 85, train_loss: 0.1398, test_loss: 2.5026, test_f1: 0.6296
 epoch: 86, train_loss: 0.1568, test_loss: 2.8728, test_f1: 0.6014
 epoch: 87, train_loss: 0.1438, test_loss: 2.7868, test_f1: 0.5981
 epoch: 88, train_loss: 0.1375, test_loss: 2.8712, test_f1: 0.5963
 epoch: 89, train_loss: 0.1457, test_loss: 2.7714, test_f1: 0.5977
 epoch: 90, train_loss: 0.1436, test_loss: 2.8108, test_f1: 0.6140
 epoch: 91, train_loss: 0.1462, test_loss: 3.1586, test_f1: 0.5911
 epoch: 92, train_loss: 0.1437, test_loss: 3.0502, test_f1: 0.5703
 epoch: 93, train_loss: 0.1532, test_loss: 2.9950, test_f1: 0.5959
 epoch: 94, train_loss: 0.1429, test_loss: 2.9475, test_f1: 0.6090
 epoch: 95, train_loss: 0.1395, test_loss: 3.0178, test_f1: 0.6224
 epoch: 96, train_loss: 0.1451, test_loss: 3.0416, test_f1: 0.5808
 epoch: 97, train_loss: 0.1279, test_loss: 3.0417, test_f1: 0.5995
 epoch: 98, train_loss: 0.1432, test_loss: 3.2479, test_f1: 0.5892
 epoch: 99, train_loss: 0.1402, test_loss: 3.0293, test_f1: 0.5899
##################ITERATION #4 ****************************************
 epoch: 0, train_loss: 1.2211, test_loss: 1.4030, test_f1: 0.2281
 epoch: 1, train_loss: 1.0171, test_loss: 1.2055, test_f1: 0.4207
 epoch: 2, train_loss: 0.9579, test_loss: 1.1083, test_f1: 0.4984
 epoch: 3, train_loss: 0.9143, test_loss: 1.0056, test_f1: 0.5583
 epoch: 4, train_loss: 0.9130, test_loss: 1.0239, test_f1: 0.5658
 epoch: 5, train_loss: 0.8784, test_loss: 1.0313, test_f1: 0.5945
 epoch: 6, train_loss: 0.8396, test_loss: 1.0279, test_f1: 0.5504
 epoch: 7, train_loss: 0.8252, test_loss: 1.0326, test_f1: 0.5979
 epoch: 8, train_loss: 0.8428, test_loss: 1.0251, test_f1: 0.5968
 epoch: 9, train_loss: 0.7982, test_loss: 1.0302, test_f1: 0.6063
 epoch: 10, train_loss: 0.7818, test_loss: 0.9937, test_f1: 0.6136
 epoch: 11, train_loss: 0.7427, test_loss: 1.0118, test_f1: 0.5514
 epoch: 12, train_loss: 0.7277, test_loss: 1.0225, test_f1: 0.6410
 epoch: 13, train_loss: 0.6989, test_loss: 1.0481, test_f1: 0.5752
 epoch: 14, train_loss: 0.7077, test_loss: 1.1245, test_f1: 0.5661
 epoch: 15, train_loss: 0.6700, test_loss: 1.0744, test_f1: 0.6130
 epoch: 16, train_loss: 0.6643, test_loss: 1.0563, test_f1: 0.5673
 epoch: 17, train_loss: 0.6135, test_loss: 1.0960, test_f1: 0.5739
 epoch: 18, train_loss: 0.6261, test_loss: 1.0759, test_f1: 0.6226
 epoch: 19, train_loss: 0.6359, test_loss: 1.1272, test_f1: 0.6139
 epoch: 20, train_loss: 0.6071, test_loss: 1.1748, test_f1: 0.6034
 epoch: 21, train_loss: 0.5969, test_loss: 1.1337, test_f1: 0.6095
 epoch: 22, train_loss: 0.5889, test_loss: 1.2320, test_f1: 0.5896
 epoch: 23, train_loss: 0.5616, test_loss: 1.2019, test_f1: 0.6394
 epoch: 24, train_loss: 0.5295, test_loss: 1.2919, test_f1: 0.6398
 epoch: 25, train_loss: 0.5269, test_loss: 1.3957, test_f1: 0.6041
 epoch: 26, train_loss: 0.5486, test_loss: 1.3223, test_f1: 0.5930
 epoch: 27, train_loss: 0.5396, test_loss: 1.2968, test_f1: 0.6458
 epoch: 28, train_loss: 0.5020, test_loss: 1.3844, test_f1: 0.6080
 epoch: 29, train_loss: 0.4899, test_loss: 1.2584, test_f1: 0.6368
 epoch: 30, train_loss: 0.4957, test_loss: 1.3270, test_f1: 0.6180
 epoch: 31, train_loss: 0.4780, test_loss: 1.4086, test_f1: 0.6155
 epoch: 32, train_loss: 0.4586, test_loss: 1.4650, test_f1: 0.6071
 epoch: 33, train_loss: 0.4645, test_loss: 1.5967, test_f1: 0.5820
 epoch: 34, train_loss: 0.4293, test_loss: 1.4781, test_f1: 0.6152
 epoch: 35, train_loss: 0.4179, test_loss: 1.5610, test_f1: 0.5982
 epoch: 36, train_loss: 0.4030, test_loss: 1.6695, test_f1: 0.5930
 epoch: 37, train_loss: 0.4172, test_loss: 1.7282, test_f1: 0.6045
 epoch: 38, train_loss: 0.4060, test_loss: 1.5891, test_f1: 0.6177
 epoch: 39, train_loss: 0.3925, test_loss: 1.6874, test_f1: 0.6101
 epoch: 40, train_loss: 0.3696, test_loss: 1.6512, test_f1: 0.5971
 epoch: 41, train_loss: 0.3929, test_loss: 1.9559, test_f1: 0.5778
 epoch: 42, train_loss: 0.3847, test_loss: 1.8217, test_f1: 0.6251
 epoch: 43, train_loss: 0.3755, test_loss: 1.7922, test_f1: 0.6477
 epoch: 44, train_loss: 0.3658, test_loss: 1.8013, test_f1: 0.6139
 epoch: 45, train_loss: 0.3586, test_loss: 1.8114, test_f1: 0.6194
 epoch: 46, train_loss: 0.3269, test_loss: 1.8469, test_f1: 0.5919
 epoch: 47, train_loss: 0.3684, test_loss: 2.1613, test_f1: 0.5529
 epoch: 48, train_loss: 0.4022, test_loss: 1.7677, test_f1: 0.5765
 epoch: 49, train_loss: 0.3593, test_loss: 1.7392, test_f1: 0.5976
 epoch: 50, train_loss: 0.3515, test_loss: 1.8038, test_f1: 0.5922
 epoch: 51, train_loss: 0.2676, test_loss: 1.8107, test_f1: 0.6433
 epoch: 52, train_loss: 0.2611, test_loss: 1.9473, test_f1: 0.6448
 epoch: 53, train_loss: 0.2365, test_loss: 1.9688, test_f1: 0.6137
 epoch: 54, train_loss: 0.2338, test_loss: 2.0688, test_f1: 0.6363
 epoch: 55, train_loss: 0.2366, test_loss: 2.2304, test_f1: 0.5896
 epoch: 56, train_loss: 0.2131, test_loss: 2.2272, test_f1: 0.5912
 epoch: 57, train_loss: 0.2073, test_loss: 2.2620, test_f1: 0.6108
 epoch: 58, train_loss: 0.2024, test_loss: 2.2666, test_f1: 0.6048
 epoch: 59, train_loss: 0.2016, test_loss: 2.2821, test_f1: 0.6139
 epoch: 60, train_loss: 0.2024, test_loss: 2.3209, test_f1: 0.6076
 epoch: 61, train_loss: 0.1962, test_loss: 2.4684, test_f1: 0.5905
 epoch: 62, train_loss: 0.2037, test_loss: 2.2198, test_f1: 0.6376
 epoch: 63, train_loss: 0.1778, test_loss: 2.4085, test_f1: 0.6139
 epoch: 64, train_loss: 0.1836, test_loss: 2.4963, test_f1: 0.5847
 epoch: 65, train_loss: 0.1714, test_loss: 2.5422, test_f1: 0.6110
 epoch: 66, train_loss: 0.1857, test_loss: 2.5891, test_f1: 0.5954
 epoch: 67, train_loss: 0.1747, test_loss: 2.4338, test_f1: 0.6030
 epoch: 68, train_loss: 0.1928, test_loss: 2.4742, test_f1: 0.6331
 epoch: 69, train_loss: 0.1968, test_loss: 2.6976, test_f1: 0.5898
 epoch: 70, train_loss: 0.1887, test_loss: 2.4813, test_f1: 0.5774
 epoch: 71, train_loss: 0.2079, test_loss: 2.4486, test_f1: 0.5680
 epoch: 72, train_loss: 0.1801, test_loss: 2.6220, test_f1: 0.6123
 epoch: 73, train_loss: 0.1757, test_loss: 2.6124, test_f1: 0.5870
 epoch: 74, train_loss: 0.1711, test_loss: 2.7087, test_f1: 0.5808
 epoch: 75, train_loss: 0.1607, test_loss: 2.6885, test_f1: 0.6097
 epoch: 76, train_loss: 0.1508, test_loss: 2.6669, test_f1: 0.5953
 epoch: 77, train_loss: 0.1546, test_loss: 2.7986, test_f1: 0.6041
 epoch: 78, train_loss: 0.1690, test_loss: 2.5393, test_f1: 0.6013
 epoch: 79, train_loss: 0.1583, test_loss: 2.6187, test_f1: 0.6012
 epoch: 80, train_loss: 0.1470, test_loss: 2.8459, test_f1: 0.5707
 epoch: 81, train_loss: 0.1767, test_loss: 2.8347, test_f1: 0.5937
 epoch: 82, train_loss: 0.1481, test_loss: 2.9388, test_f1: 0.6028
 epoch: 83, train_loss: 0.1401, test_loss: 2.7714, test_f1: 0.6016
 epoch: 84, train_loss: 0.1322, test_loss: 2.8678, test_f1: 0.5823
 epoch: 85, train_loss: 0.1607, test_loss: 2.6268, test_f1: 0.6113
 epoch: 86, train_loss: 0.1412, test_loss: 2.9548, test_f1: 0.5736
 epoch: 87, train_loss: 0.1427, test_loss: 2.9627, test_f1: 0.5736
 epoch: 88, train_loss: 0.1411, test_loss: 3.1257, test_f1: 0.5910
 epoch: 89, train_loss: 0.1203, test_loss: 2.9084, test_f1: 0.5858
 epoch: 90, train_loss: 0.1291, test_loss: 2.8225, test_f1: 0.5910
 epoch: 91, train_loss: 0.1112, test_loss: 3.1344, test_f1: 0.5863
 epoch: 92, train_loss: 0.1430, test_loss: 3.0253, test_f1: 0.5891
 epoch: 93, train_loss: 0.1273, test_loss: 2.9660, test_f1: 0.6097
 epoch: 94, train_loss: 0.1062, test_loss: 3.1433, test_f1: 0.5757
 epoch: 95, train_loss: 0.1449, test_loss: 3.3247, test_f1: 0.5860
 epoch: 96, train_loss: 0.1536, test_loss: 2.9219, test_f1: 0.5964
 epoch: 97, train_loss: 0.1303, test_loss: 3.0879, test_f1: 0.5810
 epoch: 98, train_loss: 0.1114, test_loss: 3.2991, test_f1: 0.5968
 epoch: 99, train_loss: 0.1301, test_loss: 3.3085, test_f1: 0.5674
##################ITERATION #5 ****************************************
 epoch: 0, train_loss: 1.2262, test_loss: 1.2540, test_f1: 0.2768
 epoch: 1, train_loss: 1.0163, test_loss: 1.6913, test_f1: 0.1409
 epoch: 2, train_loss: 0.9552, test_loss: 1.0976, test_f1: 0.4785
 epoch: 3, train_loss: 0.9044, test_loss: 1.0148, test_f1: 0.5734
 epoch: 4, train_loss: 0.8941, test_loss: 1.0175, test_f1: 0.5429
 epoch: 5, train_loss: 0.8540, test_loss: 1.0343, test_f1: 0.5741
 epoch: 6, train_loss: 0.8269, test_loss: 1.0533, test_f1: 0.4776
 epoch: 7, train_loss: 0.8114, test_loss: 1.0894, test_f1: 0.5265
 epoch: 8, train_loss: 0.7848, test_loss: 1.0539, test_f1: 0.5844
 epoch: 9, train_loss: 0.7619, test_loss: 1.1671, test_f1: 0.5397
 epoch: 10, train_loss: 0.7364, test_loss: 1.0839, test_f1: 0.5342
 epoch: 11, train_loss: 0.7304, test_loss: 1.0420, test_f1: 0.5920
 epoch: 12, train_loss: 0.7222, test_loss: 1.0731, test_f1: 0.5967
 epoch: 13, train_loss: 0.6968, test_loss: 1.2034, test_f1: 0.5289
 epoch: 14, train_loss: 0.6606, test_loss: 1.2076, test_f1: 0.5505
 epoch: 15, train_loss: 0.6626, test_loss: 1.1815, test_f1: 0.5542
 epoch: 16, train_loss: 0.6518, test_loss: 1.2295, test_f1: 0.4833
 epoch: 17, train_loss: 0.6151, test_loss: 1.2745, test_f1: 0.5488
 epoch: 18, train_loss: 0.6160, test_loss: 1.2239, test_f1: 0.5390
 epoch: 19, train_loss: 0.6083, test_loss: 1.1973, test_f1: 0.5585
 epoch: 20, train_loss: 0.5694, test_loss: 1.2562, test_f1: 0.5607
 epoch: 21, train_loss: 0.5549, test_loss: 1.2459, test_f1: 0.5743
 epoch: 22, train_loss: 0.5787, test_loss: 1.2036, test_f1: 0.5797
 epoch: 23, train_loss: 0.5701, test_loss: 1.3630, test_f1: 0.5948
 epoch: 24, train_loss: 0.5488, test_loss: 1.2621, test_f1: 0.5939
 epoch: 25, train_loss: 0.5405, test_loss: 1.2598, test_f1: 0.5817
 epoch: 26, train_loss: 0.5260, test_loss: 1.3535, test_f1: 0.5855
 epoch: 27, train_loss: 0.5133, test_loss: 1.2744, test_f1: 0.6220
 epoch: 28, train_loss: 0.4763, test_loss: 1.3589, test_f1: 0.5699
 epoch: 29, train_loss: 0.4975, test_loss: 1.3380, test_f1: 0.5752
 epoch: 30, train_loss: 0.4943, test_loss: 1.4345, test_f1: 0.5881
 epoch: 31, train_loss: 0.4841, test_loss: 1.3597, test_f1: 0.6245
 epoch: 32, train_loss: 0.4661, test_loss: 1.3714, test_f1: 0.6315
 epoch: 33, train_loss: 0.4518, test_loss: 1.5382, test_f1: 0.5894
 epoch: 34, train_loss: 0.4337, test_loss: 1.4941, test_f1: 0.6207
 epoch: 35, train_loss: 0.4488, test_loss: 1.5726, test_f1: 0.6140
 epoch: 36, train_loss: 0.4386, test_loss: 1.4652, test_f1: 0.5820
 epoch: 37, train_loss: 0.4032, test_loss: 1.6027, test_f1: 0.5814
 epoch: 38, train_loss: 0.4197, test_loss: 1.4160, test_f1: 0.6440
 epoch: 39, train_loss: 0.4323, test_loss: 1.5166, test_f1: 0.6475
 epoch: 40, train_loss: 0.4288, test_loss: 1.7806, test_f1: 0.5317
 epoch: 41, train_loss: 0.3953, test_loss: 1.7637, test_f1: 0.5970
 epoch: 42, train_loss: 0.4075, test_loss: 1.4868, test_f1: 0.6329
 epoch: 43, train_loss: 0.3759, test_loss: 1.9281, test_f1: 0.5685
 epoch: 44, train_loss: 0.4171, test_loss: 1.6678, test_f1: 0.6056
 epoch: 45, train_loss: 0.3840, test_loss: 1.6140, test_f1: 0.5820
 epoch: 46, train_loss: 0.3646, test_loss: 1.6199, test_f1: 0.6364
 epoch: 47, train_loss: 0.3450, test_loss: 1.6634, test_f1: 0.6236
 epoch: 48, train_loss: 0.3254, test_loss: 1.8899, test_f1: 0.5704
 epoch: 49, train_loss: 0.3512, test_loss: 1.8413, test_f1: 0.5942
 epoch: 50, train_loss: 0.3199, test_loss: 1.9336, test_f1: 0.5885
 epoch: 51, train_loss: 0.2760, test_loss: 1.8567, test_f1: 0.6046
 epoch: 52, train_loss: 0.2531, test_loss: 1.8871, test_f1: 0.5957
 epoch: 53, train_loss: 0.2362, test_loss: 1.9734, test_f1: 0.6075
 epoch: 54, train_loss: 0.2478, test_loss: 1.9787, test_f1: 0.6346
 epoch: 55, train_loss: 0.2293, test_loss: 2.1065, test_f1: 0.6186
 epoch: 56, train_loss: 0.2175, test_loss: 2.1044, test_f1: 0.6427
 epoch: 57, train_loss: 0.1947, test_loss: 2.1015, test_f1: 0.6354
 epoch: 58, train_loss: 0.2179, test_loss: 2.2467, test_f1: 0.5959
 epoch: 59, train_loss: 0.2070, test_loss: 2.3205, test_f1: 0.6164
 epoch: 60, train_loss: 0.2043, test_loss: 2.2184, test_f1: 0.6142
 epoch: 61, train_loss: 0.2264, test_loss: 2.2296, test_f1: 0.6093
 epoch: 62, train_loss: 0.2048, test_loss: 2.3901, test_f1: 0.6092
 epoch: 63, train_loss: 0.2000, test_loss: 2.3247, test_f1: 0.6089
 epoch: 64, train_loss: 0.2104, test_loss: 2.3031, test_f1: 0.6291
 epoch: 65, train_loss: 0.2019, test_loss: 2.4784, test_f1: 0.6128
 epoch: 66, train_loss: 0.1813, test_loss: 2.4959, test_f1: 0.5957
 epoch: 67, train_loss: 0.1893, test_loss: 2.5806, test_f1: 0.6079
 epoch: 68, train_loss: 0.1921, test_loss: 2.3521, test_f1: 0.6062
 epoch: 69, train_loss: 0.1833, test_loss: 2.4890, test_f1: 0.6174
 epoch: 70, train_loss: 0.1790, test_loss: 2.5833, test_f1: 0.5958
 epoch: 71, train_loss: 0.1652, test_loss: 2.6149, test_f1: 0.5986
 epoch: 72, train_loss: 0.1798, test_loss: 2.5930, test_f1: 0.6293
 epoch: 73, train_loss: 0.1995, test_loss: 2.7115, test_f1: 0.5865
 epoch: 74, train_loss: 0.1685, test_loss: 2.4966, test_f1: 0.6392
 epoch: 75, train_loss: 0.1718, test_loss: 2.6539, test_f1: 0.5787
 epoch: 76, train_loss: 0.1792, test_loss: 2.4327, test_f1: 0.6159
 epoch: 77, train_loss: 0.1772, test_loss: 2.7239, test_f1: 0.6170
 epoch: 78, train_loss: 0.1742, test_loss: 2.8839, test_f1: 0.5905
 epoch: 79, train_loss: 0.1636, test_loss: 2.5967, test_f1: 0.6032
 epoch: 80, train_loss: 0.1716, test_loss: 2.6776, test_f1: 0.6011
 epoch: 81, train_loss: 0.1420, test_loss: 2.6510, test_f1: 0.5893
 epoch: 82, train_loss: 0.1416, test_loss: 2.6419, test_f1: 0.6124
 epoch: 83, train_loss: 0.1456, test_loss: 3.0134, test_f1: 0.5848
 epoch: 84, train_loss: 0.1553, test_loss: 2.9810, test_f1: 0.6155
 epoch: 85, train_loss: 0.1444, test_loss: 3.0773, test_f1: 0.6203
 epoch: 86, train_loss: 0.1415, test_loss: 2.9092, test_f1: 0.5800
 epoch: 87, train_loss: 0.1480, test_loss: 2.9658, test_f1: 0.5735
 epoch: 88, train_loss: 0.1954, test_loss: 3.1320, test_f1: 0.5928
 epoch: 89, train_loss: 0.1723, test_loss: 3.1187, test_f1: 0.5848
 epoch: 90, train_loss: 0.1422, test_loss: 2.8862, test_f1: 0.6070
 epoch: 91, train_loss: 0.1287, test_loss: 3.0131, test_f1: 0.6034
 epoch: 92, train_loss: 0.1279, test_loss: 3.0648, test_f1: 0.5648
 epoch: 93, train_loss: 0.1381, test_loss: 3.1712, test_f1: 0.6072
 epoch: 94, train_loss: 0.1463, test_loss: 3.2546, test_f1: 0.5612
 epoch: 95, train_loss: 0.1483, test_loss: 3.1081, test_f1: 0.6129
 epoch: 96, train_loss: 0.1067, test_loss: 3.1355, test_f1: 0.6038
 epoch: 97, train_loss: 0.1071, test_loss: 3.2391, test_f1: 0.5843
 epoch: 98, train_loss: 0.1166, test_loss: 3.3333, test_f1: 0.5911
 epoch: 99, train_loss: 0.1145, test_loss: 3.4860, test_f1: 0.5839
##################ITERATION #6 ****************************************
 epoch: 0, train_loss: 1.3097, test_loss: 1.4061, test_f1: 0.1749
 epoch: 1, train_loss: 1.0867, test_loss: 1.2739, test_f1: 0.3725
 epoch: 2, train_loss: 1.0282, test_loss: 1.1350, test_f1: 0.3659
 epoch: 3, train_loss: 0.9743, test_loss: 1.0381, test_f1: 0.5181
 epoch: 4, train_loss: 0.9314, test_loss: 1.0660, test_f1: 0.4735
 epoch: 5, train_loss: 0.9101, test_loss: 1.0547, test_f1: 0.5143
 epoch: 6, train_loss: 0.8895, test_loss: 1.0190, test_f1: 0.5348
 epoch: 7, train_loss: 0.8644, test_loss: 1.0669, test_f1: 0.5218
 epoch: 8, train_loss: 0.8439, test_loss: 1.0686, test_f1: 0.5252
 epoch: 9, train_loss: 0.8203, test_loss: 1.0735, test_f1: 0.5252
 epoch: 10, train_loss: 0.8103, test_loss: 1.1005, test_f1: 0.4805
 epoch: 11, train_loss: 0.8077, test_loss: 1.1128, test_f1: 0.4955
 epoch: 12, train_loss: 0.7954, test_loss: 1.0472, test_f1: 0.5446
 epoch: 13, train_loss: 0.7425, test_loss: 1.1301, test_f1: 0.5231
 epoch: 14, train_loss: 0.7335, test_loss: 1.1458, test_f1: 0.5597
 epoch: 15, train_loss: 0.7012, test_loss: 1.1560, test_f1: 0.5128
 epoch: 16, train_loss: 0.7309, test_loss: 1.1128, test_f1: 0.5695
 epoch: 17, train_loss: 0.7089, test_loss: 1.1662, test_f1: 0.5170
 epoch: 18, train_loss: 0.7386, test_loss: 1.1427, test_f1: 0.5325
 epoch: 19, train_loss: 0.7057, test_loss: 1.1225, test_f1: 0.5357
 epoch: 20, train_loss: 0.6620, test_loss: 1.1687, test_f1: 0.5492
 epoch: 21, train_loss: 0.6611, test_loss: 1.1559, test_f1: 0.5365
 epoch: 22, train_loss: 0.6278, test_loss: 1.2233, test_f1: 0.5971
 epoch: 23, train_loss: 0.6220, test_loss: 1.1411, test_f1: 0.6081
 epoch: 24, train_loss: 0.5975, test_loss: 1.1689, test_f1: 0.6058
 epoch: 25, train_loss: 0.5720, test_loss: 1.2258, test_f1: 0.5738
 epoch: 26, train_loss: 0.6165, test_loss: 1.2453, test_f1: 0.5558
 epoch: 27, train_loss: 0.5740, test_loss: 1.3006, test_f1: 0.5766
 epoch: 28, train_loss: 0.5497, test_loss: 1.4270, test_f1: 0.6176
 epoch: 29, train_loss: 0.5565, test_loss: 1.2738, test_f1: 0.5505
 epoch: 30, train_loss: 0.5560, test_loss: 1.3983, test_f1: 0.6069
 epoch: 31, train_loss: 0.5309, test_loss: 1.2982, test_f1: 0.5577
 epoch: 32, train_loss: 0.5258, test_loss: 1.2620, test_f1: 0.5990
 epoch: 33, train_loss: 0.5350, test_loss: 1.3189, test_f1: 0.5712
 epoch: 34, train_loss: 0.4977, test_loss: 1.3815, test_f1: 0.6170
 epoch: 35, train_loss: 0.5020, test_loss: 1.5610, test_f1: 0.4946
 epoch: 36, train_loss: 0.4921, test_loss: 1.4672, test_f1: 0.6084
 epoch: 37, train_loss: 0.5003, test_loss: 1.4995, test_f1: 0.5582
 epoch: 38, train_loss: 0.4906, test_loss: 1.3822, test_f1: 0.6267
 epoch: 39, train_loss: 0.4450, test_loss: 1.4205, test_f1: 0.5730
 epoch: 40, train_loss: 0.4387, test_loss: 1.6388, test_f1: 0.6249
 epoch: 41, train_loss: 0.4609, test_loss: 1.5374, test_f1: 0.5539
 epoch: 42, train_loss: 0.4471, test_loss: 1.4785, test_f1: 0.6189
 epoch: 43, train_loss: 0.4250, test_loss: 1.5204, test_f1: 0.5457
 epoch: 44, train_loss: 0.4274, test_loss: 1.6584, test_f1: 0.5639
 epoch: 45, train_loss: 0.4001, test_loss: 1.6251, test_f1: 0.6041
 epoch: 46, train_loss: 0.3968, test_loss: 1.6734, test_f1: 0.5745
 epoch: 47, train_loss: 0.4080, test_loss: 1.7221, test_f1: 0.5839
 epoch: 48, train_loss: 0.4021, test_loss: 1.5530, test_f1: 0.5954
 epoch: 49, train_loss: 0.3737, test_loss: 1.7072, test_f1: 0.6105
 epoch: 50, train_loss: 0.3836, test_loss: 1.7369, test_f1: 0.5655
 epoch: 51, train_loss: 0.3389, test_loss: 1.7622, test_f1: 0.5700
 epoch: 52, train_loss: 0.3107, test_loss: 1.8778, test_f1: 0.5859
 epoch: 53, train_loss: 0.2973, test_loss: 1.8962, test_f1: 0.5755
 epoch: 54, train_loss: 0.3050, test_loss: 1.9577, test_f1: 0.5784
 epoch: 55, train_loss: 0.2683, test_loss: 1.9210, test_f1: 0.5842
 epoch: 56, train_loss: 0.2758, test_loss: 1.9627, test_f1: 0.5621
 epoch: 57, train_loss: 0.2789, test_loss: 2.0384, test_f1: 0.5731
 epoch: 58, train_loss: 0.2737, test_loss: 2.0273, test_f1: 0.5927
 epoch: 59, train_loss: 0.2806, test_loss: 2.0743, test_f1: 0.5828
 epoch: 60, train_loss: 0.2620, test_loss: 1.9790, test_f1: 0.5797
 epoch: 61, train_loss: 0.2367, test_loss: 2.1312, test_f1: 0.5472
 epoch: 62, train_loss: 0.2498, test_loss: 2.1682, test_f1: 0.5541
 epoch: 63, train_loss: 0.2480, test_loss: 2.2626, test_f1: 0.5819
 epoch: 64, train_loss: 0.2050, test_loss: 2.2594, test_f1: 0.5715
 epoch: 65, train_loss: 0.2141, test_loss: 2.1944, test_f1: 0.5652
 epoch: 66, train_loss: 0.2271, test_loss: 2.1955, test_f1: 0.5565
 epoch: 67, train_loss: 0.2274, test_loss: 2.0837, test_f1: 0.5763
 epoch: 68, train_loss: 0.2270, test_loss: 2.1297, test_f1: 0.6193
 epoch: 69, train_loss: 0.2231, test_loss: 2.3225, test_f1: 0.5722
 epoch: 70, train_loss: 0.2171, test_loss: 2.1778, test_f1: 0.5986
 epoch: 71, train_loss: 0.2176, test_loss: 2.2823, test_f1: 0.5901
 epoch: 72, train_loss: 0.2428, test_loss: 2.3622, test_f1: 0.5857
 epoch: 73, train_loss: 0.2288, test_loss: 2.2237, test_f1: 0.5951
 epoch: 74, train_loss: 0.2043, test_loss: 2.2974, test_f1: 0.5648
 epoch: 75, train_loss: 0.2341, test_loss: 2.3719, test_f1: 0.5813
 epoch: 76, train_loss: 0.1975, test_loss: 2.5247, test_f1: 0.5611
 epoch: 77, train_loss: 0.1986, test_loss: 2.4703, test_f1: 0.5889
 epoch: 78, train_loss: 0.1890, test_loss: 2.4931, test_f1: 0.5725
 epoch: 79, train_loss: 0.2125, test_loss: 2.3579, test_f1: 0.5641
 epoch: 80, train_loss: 0.2366, test_loss: 2.4961, test_f1: 0.5482
 epoch: 81, train_loss: 0.2053, test_loss: 2.4783, test_f1: 0.5648
 epoch: 82, train_loss: 0.2093, test_loss: 2.3135, test_f1: 0.6086
 epoch: 83, train_loss: 0.1948, test_loss: 2.3560, test_f1: 0.6176
 epoch: 84, train_loss: 0.2148, test_loss: 2.5808, test_f1: 0.5887
 epoch: 85, train_loss: 0.1980, test_loss: 2.5448, test_f1: 0.5844
 epoch: 86, train_loss: 0.1760, test_loss: 2.5379, test_f1: 0.5552
 epoch: 87, train_loss: 0.1729, test_loss: 2.4025, test_f1: 0.5932
 epoch: 88, train_loss: 0.1630, test_loss: 2.6548, test_f1: 0.5771
 epoch: 89, train_loss: 0.1754, test_loss: 2.6813, test_f1: 0.5819
 epoch: 90, train_loss: 0.2038, test_loss: 2.7226, test_f1: 0.5637
 epoch: 91, train_loss: 0.1853, test_loss: 2.5979, test_f1: 0.5621
 epoch: 92, train_loss: 0.2158, test_loss: 2.5228, test_f1: 0.6088
 epoch: 93, train_loss: 0.2006, test_loss: 2.7041, test_f1: 0.5520
 epoch: 94, train_loss: 0.1823, test_loss: 2.5633, test_f1: 0.5943
 epoch: 95, train_loss: 0.1912, test_loss: 2.4968, test_f1: 0.5911
 epoch: 96, train_loss: 0.1800, test_loss: 2.6612, test_f1: 0.6014
 epoch: 97, train_loss: 0.1555, test_loss: 2.5671, test_f1: 0.6025
 epoch: 98, train_loss: 0.1547, test_loss: 2.7087, test_f1: 0.5813
 epoch: 99, train_loss: 0.1600, test_loss: 2.8868, test_f1: 0.5599
##################ITERATION #7 ****************************************
 epoch: 0, train_loss: 1.4094, test_loss: 1.3826, test_f1: 0.2334
 epoch: 1, train_loss: 1.0814, test_loss: 1.9813, test_f1: 0.1247
 epoch: 2, train_loss: 0.9978, test_loss: 1.1356, test_f1: 0.4392
 epoch: 3, train_loss: 0.9550, test_loss: 1.0559, test_f1: 0.5184
 epoch: 4, train_loss: 0.9085, test_loss: 1.0983, test_f1: 0.5121
 epoch: 5, train_loss: 0.8813, test_loss: 1.1265, test_f1: 0.5587
 epoch: 6, train_loss: 0.8758, test_loss: 1.0492, test_f1: 0.5495
 epoch: 7, train_loss: 0.8223, test_loss: 1.0140, test_f1: 0.5510
 epoch: 8, train_loss: 0.7883, test_loss: 0.9886, test_f1: 0.5941
 epoch: 9, train_loss: 0.7515, test_loss: 1.0291, test_f1: 0.5410
 epoch: 10, train_loss: 0.7257, test_loss: 1.0233, test_f1: 0.5980
 epoch: 11, train_loss: 0.7298, test_loss: 1.0571, test_f1: 0.5528
 epoch: 12, train_loss: 0.7215, test_loss: 1.1929, test_f1: 0.5257
 epoch: 13, train_loss: 0.6924, test_loss: 1.0595, test_f1: 0.6182
 epoch: 14, train_loss: 0.6349, test_loss: 1.1303, test_f1: 0.6204
 epoch: 15, train_loss: 0.6219, test_loss: 1.2045, test_f1: 0.5484
 epoch: 16, train_loss: 0.6472, test_loss: 1.2458, test_f1: 0.5242
 epoch: 17, train_loss: 0.6468, test_loss: 1.1053, test_f1: 0.6158
 epoch: 18, train_loss: 0.6075, test_loss: 1.1892, test_f1: 0.5674
 epoch: 19, train_loss: 0.5883, test_loss: 1.2600, test_f1: 0.5477
 epoch: 20, train_loss: 0.5950, test_loss: 1.2012, test_f1: 0.5996
 epoch: 21, train_loss: 0.5749, test_loss: 1.2831, test_f1: 0.5726
 epoch: 22, train_loss: 0.5371, test_loss: 1.1815, test_f1: 0.5882
 epoch: 23, train_loss: 0.5506, test_loss: 1.2911, test_f1: 0.5782
 epoch: 24, train_loss: 0.5336, test_loss: 1.4557, test_f1: 0.5985
 epoch: 25, train_loss: 0.5078, test_loss: 1.3186, test_f1: 0.5768
 epoch: 26, train_loss: 0.5193, test_loss: 1.3247, test_f1: 0.6017
 epoch: 27, train_loss: 0.5119, test_loss: 1.3630, test_f1: 0.6076
 epoch: 28, train_loss: 0.4711, test_loss: 1.2582, test_f1: 0.6307
 epoch: 29, train_loss: 0.4696, test_loss: 1.4007, test_f1: 0.5989
 epoch: 30, train_loss: 0.4728, test_loss: 1.4856, test_f1: 0.6071
 epoch: 31, train_loss: 0.4550, test_loss: 1.4121, test_f1: 0.5864
 epoch: 32, train_loss: 0.4526, test_loss: 1.6035, test_f1: 0.6087
 epoch: 33, train_loss: 0.4672, test_loss: 1.5656, test_f1: 0.5527
 epoch: 34, train_loss: 0.4295, test_loss: 1.5401, test_f1: 0.5517
 epoch: 35, train_loss: 0.4358, test_loss: 1.5099, test_f1: 0.5621
 epoch: 36, train_loss: 0.4026, test_loss: 1.5724, test_f1: 0.5749
 epoch: 37, train_loss: 0.3943, test_loss: 1.5917, test_f1: 0.5827
 epoch: 38, train_loss: 0.3654, test_loss: 1.5464, test_f1: 0.5763
 epoch: 39, train_loss: 0.3871, test_loss: 1.7337, test_f1: 0.5908
 epoch: 40, train_loss: 0.3723, test_loss: 1.8384, test_f1: 0.5624
 epoch: 41, train_loss: 0.3983, test_loss: 1.7127, test_f1: 0.6086
 epoch: 42, train_loss: 0.3726, test_loss: 1.8590, test_f1: 0.5489
 epoch: 43, train_loss: 0.3636, test_loss: 1.7677, test_f1: 0.6045
 epoch: 44, train_loss: 0.3612, test_loss: 1.7321, test_f1: 0.5804
 epoch: 45, train_loss: 0.3281, test_loss: 1.6778, test_f1: 0.6213
 epoch: 46, train_loss: 0.3361, test_loss: 2.0997, test_f1: 0.5664
 epoch: 47, train_loss: 0.3552, test_loss: 1.7699, test_f1: 0.5980
 epoch: 48, train_loss: 0.2941, test_loss: 1.7567, test_f1: 0.6153
 epoch: 49, train_loss: 0.2796, test_loss: 1.9225, test_f1: 0.5916
 epoch: 50, train_loss: 0.3039, test_loss: 2.0000, test_f1: 0.5731
 epoch: 51, train_loss: 0.2984, test_loss: 2.0331, test_f1: 0.5551
 epoch: 52, train_loss: 0.2346, test_loss: 2.0483, test_f1: 0.5726
 epoch: 53, train_loss: 0.2475, test_loss: 2.1009, test_f1: 0.5762
 epoch: 54, train_loss: 0.2322, test_loss: 2.0496, test_f1: 0.5688
 epoch: 55, train_loss: 0.2070, test_loss: 2.0501, test_f1: 0.5760
 epoch: 56, train_loss: 0.1949, test_loss: 2.1010, test_f1: 0.5586
 epoch: 57, train_loss: 0.1971, test_loss: 2.1723, test_f1: 0.5575
 epoch: 58, train_loss: 0.1919, test_loss: 2.3787, test_f1: 0.5693
 epoch: 59, train_loss: 0.1760, test_loss: 2.2620, test_f1: 0.5757
 epoch: 60, train_loss: 0.1902, test_loss: 2.2552, test_f1: 0.5717
 epoch: 61, train_loss: 0.2015, test_loss: 2.4917, test_f1: 0.5478
 epoch: 62, train_loss: 0.1982, test_loss: 2.1800, test_f1: 0.5962
 epoch: 63, train_loss: 0.1834, test_loss: 2.3116, test_f1: 0.5893
 epoch: 64, train_loss: 0.1841, test_loss: 2.4971, test_f1: 0.5428
 epoch: 65, train_loss: 0.1849, test_loss: 2.3993, test_f1: 0.5895
 epoch: 66, train_loss: 0.1834, test_loss: 2.3874, test_f1: 0.5851
 epoch: 67, train_loss: 0.1771, test_loss: 2.4093, test_f1: 0.5800
 epoch: 68, train_loss: 0.1866, test_loss: 2.4875, test_f1: 0.5712
 epoch: 69, train_loss: 0.1794, test_loss: 2.5814, test_f1: 0.5561
 epoch: 70, train_loss: 0.1988, test_loss: 2.5719, test_f1: 0.5843
 epoch: 71, train_loss: 0.1863, test_loss: 2.5991, test_f1: 0.5745
 epoch: 72, train_loss: 0.1939, test_loss: 2.5147, test_f1: 0.5837
 epoch: 73, train_loss: 0.1595, test_loss: 2.4092, test_f1: 0.5763
 epoch: 74, train_loss: 0.1608, test_loss: 2.9131, test_f1: 0.5531
 epoch: 75, train_loss: 0.1545, test_loss: 2.5638, test_f1: 0.5730
 epoch: 76, train_loss: 0.1725, test_loss: 2.6506, test_f1: 0.5668
 epoch: 77, train_loss: 0.1457, test_loss: 2.8185, test_f1: 0.5472
 epoch: 78, train_loss: 0.1703, test_loss: 2.7393, test_f1: 0.5600
 epoch: 79, train_loss: 0.1632, test_loss: 2.7573, test_f1: 0.5875
 epoch: 80, train_loss: 0.1750, test_loss: 2.7952, test_f1: 0.5617
 epoch: 81, train_loss: 0.1454, test_loss: 2.7490, test_f1: 0.5724
 epoch: 82, train_loss: 0.1461, test_loss: 2.8748, test_f1: 0.5578
 epoch: 83, train_loss: 0.1380, test_loss: 2.8082, test_f1: 0.5702
 epoch: 84, train_loss: 0.1534, test_loss: 2.9020, test_f1: 0.6079
 epoch: 85, train_loss: 0.2068, test_loss: 2.7565, test_f1: 0.5558
 epoch: 86, train_loss: 0.1653, test_loss: 2.8881, test_f1: 0.5440
 epoch: 87, train_loss: 0.1414, test_loss: 2.8711, test_f1: 0.5841
 epoch: 88, train_loss: 0.1372, test_loss: 2.9212, test_f1: 0.5742
 epoch: 89, train_loss: 0.1618, test_loss: 2.8378, test_f1: 0.5470
 epoch: 90, train_loss: 0.1263, test_loss: 3.0476, test_f1: 0.5519
 epoch: 91, train_loss: 0.1433, test_loss: 2.9974, test_f1: 0.5764
 epoch: 92, train_loss: 0.1361, test_loss: 3.0494, test_f1: 0.5395
 epoch: 93, train_loss: 0.1482, test_loss: 3.2559, test_f1: 0.5568
 epoch: 94, train_loss: 0.1288, test_loss: 3.1009, test_f1: 0.5411
 epoch: 95, train_loss: 0.1405, test_loss: 2.9866, test_f1: 0.5698
 epoch: 96, train_loss: 0.1605, test_loss: 3.1827, test_f1: 0.5587
 epoch: 97, train_loss: 0.1115, test_loss: 3.1182, test_f1: 0.5671
 epoch: 98, train_loss: 0.1371, test_loss: 3.1746, test_f1: 0.5667
 epoch: 99, train_loss: 0.1357, test_loss: 2.8769, test_f1: 0.5826
##################ITERATION #8 ****************************************
 epoch: 0, train_loss: 1.4379, test_loss: 1.5101, test_f1: 0.2710
 epoch: 1, train_loss: 1.1581, test_loss: 1.3228, test_f1: 0.4203
 epoch: 2, train_loss: 1.0187, test_loss: 1.1505, test_f1: 0.4844
 epoch: 3, train_loss: 0.9992, test_loss: 1.0863, test_f1: 0.5549
 epoch: 4, train_loss: 0.9415, test_loss: 1.0781, test_f1: 0.5079
 epoch: 5, train_loss: 0.9304, test_loss: 1.0448, test_f1: 0.5703
 epoch: 6, train_loss: 0.8727, test_loss: 1.0875, test_f1: 0.5401
 epoch: 7, train_loss: 0.8683, test_loss: 1.0856, test_f1: 0.5760
 epoch: 8, train_loss: 0.8474, test_loss: 1.0201, test_f1: 0.6012
 epoch: 9, train_loss: 0.8109, test_loss: 1.0626, test_f1: 0.5755
 epoch: 10, train_loss: 0.8065, test_loss: 1.0567, test_f1: 0.5343
 epoch: 11, train_loss: 0.7935, test_loss: 0.9720, test_f1: 0.6055
 epoch: 12, train_loss: 0.7699, test_loss: 1.0761, test_f1: 0.5566
 epoch: 13, train_loss: 0.7420, test_loss: 1.0478, test_f1: 0.5901
 epoch: 14, train_loss: 0.7504, test_loss: 1.0576, test_f1: 0.5980
 epoch: 15, train_loss: 0.7067, test_loss: 1.0685, test_f1: 0.5838
 epoch: 16, train_loss: 0.7089, test_loss: 1.0207, test_f1: 0.6139
 epoch: 17, train_loss: 0.6963, test_loss: 1.1044, test_f1: 0.5958
 epoch: 18, train_loss: 0.6694, test_loss: 1.0610, test_f1: 0.5862
 epoch: 19, train_loss: 0.6807, test_loss: 1.1158, test_f1: 0.5946
 epoch: 20, train_loss: 0.6574, test_loss: 1.0669, test_f1: 0.6523
 epoch: 21, train_loss: 0.6627, test_loss: 1.1410, test_f1: 0.6105
 epoch: 22, train_loss: 0.6041, test_loss: 1.1376, test_f1: 0.5833
 epoch: 23, train_loss: 0.5952, test_loss: 1.2470, test_f1: 0.5673
 epoch: 24, train_loss: 0.6210, test_loss: 1.0923, test_f1: 0.6596
 epoch: 25, train_loss: 0.5823, test_loss: 1.1310, test_f1: 0.6238
 epoch: 26, train_loss: 0.5761, test_loss: 1.1724, test_f1: 0.6410
 epoch: 27, train_loss: 0.5527, test_loss: 1.1314, test_f1: 0.6536
 epoch: 28, train_loss: 0.5388, test_loss: 1.0976, test_f1: 0.6399
 epoch: 29, train_loss: 0.5201, test_loss: 1.1845, test_f1: 0.6215
 epoch: 30, train_loss: 0.5198, test_loss: 1.2312, test_f1: 0.6348
 epoch: 31, train_loss: 0.5482, test_loss: 1.2062, test_f1: 0.6464
 epoch: 32, train_loss: 0.5264, test_loss: 1.1788, test_f1: 0.6638
 epoch: 33, train_loss: 0.5209, test_loss: 1.2327, test_f1: 0.6688
 epoch: 34, train_loss: 0.5076, test_loss: 1.3151, test_f1: 0.6387
 epoch: 35, train_loss: 0.4814, test_loss: 1.2322, test_f1: 0.6385
 epoch: 36, train_loss: 0.4874, test_loss: 1.2599, test_f1: 0.5986
 epoch: 37, train_loss: 0.4955, test_loss: 1.2883, test_f1: 0.6504
 epoch: 38, train_loss: 0.4678, test_loss: 1.2158, test_f1: 0.6332
 epoch: 39, train_loss: 0.4867, test_loss: 1.3839, test_f1: 0.6283
 epoch: 40, train_loss: 0.4547, test_loss: 1.3462, test_f1: 0.6409
 epoch: 41, train_loss: 0.4394, test_loss: 1.3860, test_f1: 0.6140
 epoch: 42, train_loss: 0.4337, test_loss: 1.3775, test_f1: 0.6196
 epoch: 43, train_loss: 0.4542, test_loss: 1.3561, test_f1: 0.6224
 epoch: 44, train_loss: 0.3882, test_loss: 1.3531, test_f1: 0.6376
 epoch: 45, train_loss: 0.3926, test_loss: 1.5403, test_f1: 0.6308
 epoch: 46, train_loss: 0.3818, test_loss: 1.5697, test_f1: 0.5491
 epoch: 47, train_loss: 0.3963, test_loss: 1.4319, test_f1: 0.6358
 epoch: 48, train_loss: 0.3962, test_loss: 1.3940, test_f1: 0.6098
 epoch: 49, train_loss: 0.3886, test_loss: 1.5158, test_f1: 0.6324
 epoch: 50, train_loss: 0.3961, test_loss: 1.4417, test_f1: 0.6336
 epoch: 51, train_loss: 0.3392, test_loss: 1.5078, test_f1: 0.6057
 epoch: 52, train_loss: 0.2925, test_loss: 1.5755, test_f1: 0.6473
 epoch: 53, train_loss: 0.2732, test_loss: 1.6538, test_f1: 0.6291
 epoch: 54, train_loss: 0.2963, test_loss: 1.5418, test_f1: 0.6280
 epoch: 55, train_loss: 0.2897, test_loss: 1.6176, test_f1: 0.6424
 epoch: 56, train_loss: 0.2804, test_loss: 1.6636, test_f1: 0.6093
 epoch: 57, train_loss: 0.2603, test_loss: 1.7082, test_f1: 0.6094
 epoch: 58, train_loss: 0.2797, test_loss: 1.6371, test_f1: 0.6274
 epoch: 59, train_loss: 0.2702, test_loss: 1.7301, test_f1: 0.6084
 epoch: 60, train_loss: 0.2740, test_loss: 1.6946, test_f1: 0.6129
 epoch: 61, train_loss: 0.2648, test_loss: 1.7924, test_f1: 0.6014
 epoch: 62, train_loss: 0.2604, test_loss: 1.8119, test_f1: 0.6137
 epoch: 63, train_loss: 0.2431, test_loss: 1.7510, test_f1: 0.5899
 epoch: 64, train_loss: 0.2373, test_loss: 1.8135, test_f1: 0.6231
 epoch: 65, train_loss: 0.2083, test_loss: 1.7707, test_f1: 0.6096
 epoch: 66, train_loss: 0.2025, test_loss: 1.8665, test_f1: 0.6268
 epoch: 67, train_loss: 0.1946, test_loss: 1.8632, test_f1: 0.6075
 epoch: 68, train_loss: 0.1847, test_loss: 2.0176, test_f1: 0.6193
 epoch: 69, train_loss: 0.1898, test_loss: 1.9236, test_f1: 0.6399
 epoch: 70, train_loss: 0.2177, test_loss: 2.0550, test_f1: 0.5912
 epoch: 71, train_loss: 0.2448, test_loss: 1.8422, test_f1: 0.6338
 epoch: 72, train_loss: 0.2178, test_loss: 1.8861, test_f1: 0.6119
 epoch: 73, train_loss: 0.2178, test_loss: 2.0873, test_f1: 0.5990
 epoch: 74, train_loss: 0.2105, test_loss: 2.1115, test_f1: 0.5756
 epoch: 75, train_loss: 0.2303, test_loss: 1.9803, test_f1: 0.6346
 epoch: 76, train_loss: 0.2245, test_loss: 1.9665, test_f1: 0.6142
 epoch: 77, train_loss: 0.2490, test_loss: 2.0926, test_f1: 0.6061
 epoch: 78, train_loss: 0.2138, test_loss: 2.0342, test_f1: 0.5988
 epoch: 79, train_loss: 0.1831, test_loss: 1.9814, test_f1: 0.6051
 epoch: 80, train_loss: 0.1811, test_loss: 2.1926, test_f1: 0.6069
 epoch: 81, train_loss: 0.1581, test_loss: 2.1532, test_f1: 0.5922
 epoch: 82, train_loss: 0.1804, test_loss: 2.2632, test_f1: 0.5772
 epoch: 83, train_loss: 0.2067, test_loss: 2.2384, test_f1: 0.5960
 epoch: 84, train_loss: 0.1872, test_loss: 2.0808, test_f1: 0.6025
 epoch: 85, train_loss: 0.1976, test_loss: 2.1959, test_f1: 0.5928
 epoch: 86, train_loss: 0.1737, test_loss: 2.2550, test_f1: 0.5712
 epoch: 87, train_loss: 0.1813, test_loss: 2.1071, test_f1: 0.5930
 epoch: 88, train_loss: 0.1656, test_loss: 2.2344, test_f1: 0.5439
 epoch: 89, train_loss: 0.1769, test_loss: 2.2443, test_f1: 0.5712
 epoch: 90, train_loss: 0.1690, test_loss: 2.3244, test_f1: 0.5906
 epoch: 91, train_loss: 0.1591, test_loss: 2.3384, test_f1: 0.5715
 epoch: 92, train_loss: 0.1581, test_loss: 2.2240, test_f1: 0.5816
 epoch: 93, train_loss: 0.1796, test_loss: 2.3798, test_f1: 0.5793
 epoch: 94, train_loss: 0.1951, test_loss: 2.4738, test_f1: 0.6107
 epoch: 95, train_loss: 0.1830, test_loss: 2.3772, test_f1: 0.5850
 epoch: 96, train_loss: 0.1695, test_loss: 2.3234, test_f1: 0.6104
 epoch: 97, train_loss: 0.1900, test_loss: 2.5808, test_f1: 0.5575
 epoch: 98, train_loss: 0.1481, test_loss: 2.3323, test_f1: 0.6001
 epoch: 99, train_loss: 0.1611, test_loss: 2.2214, test_f1: 0.5894
##################ITERATION #9 ****************************************
 epoch: 0, train_loss: 1.4788, test_loss: 1.2842, test_f1: 0.2722
 epoch: 1, train_loss: 1.1166, test_loss: 1.3482, test_f1: 0.2804
 epoch: 2, train_loss: 1.0253, test_loss: 1.1546, test_f1: 0.4371
 epoch: 3, train_loss: 0.9806, test_loss: 1.1374, test_f1: 0.5287
 epoch: 4, train_loss: 0.9589, test_loss: 1.1020, test_f1: 0.5153
 epoch: 5, train_loss: 0.9104, test_loss: 1.1185, test_f1: 0.4951
 epoch: 6, train_loss: 0.9207, test_loss: 1.1506, test_f1: 0.5418
 epoch: 7, train_loss: 0.8797, test_loss: 1.0800, test_f1: 0.5020
 epoch: 8, train_loss: 0.8296, test_loss: 1.0882, test_f1: 0.5273
 epoch: 9, train_loss: 0.8496, test_loss: 1.0943, test_f1: 0.5358
 epoch: 10, train_loss: 0.8079, test_loss: 1.0741, test_f1: 0.5635
 epoch: 11, train_loss: 0.7776, test_loss: 1.0642, test_f1: 0.5569
 epoch: 12, train_loss: 0.7569, test_loss: 1.1035, test_f1: 0.5436
 epoch: 13, train_loss: 0.7364, test_loss: 1.1500, test_f1: 0.5935
 epoch: 14, train_loss: 0.7216, test_loss: 1.0599, test_f1: 0.5943
 epoch: 15, train_loss: 0.7019, test_loss: 1.1330, test_f1: 0.5705
 epoch: 16, train_loss: 0.7213, test_loss: 1.1169, test_f1: 0.6069
 epoch: 17, train_loss: 0.6990, test_loss: 1.0683, test_f1: 0.5899
 epoch: 18, train_loss: 0.6655, test_loss: 1.1251, test_f1: 0.5762
 epoch: 19, train_loss: 0.6704, test_loss: 1.0779, test_f1: 0.6010
 epoch: 20, train_loss: 0.6481, test_loss: 1.1265, test_f1: 0.6224
 epoch: 21, train_loss: 0.6296, test_loss: 1.1431, test_f1: 0.6191
 epoch: 22, train_loss: 0.6289, test_loss: 1.1723, test_f1: 0.5660
 epoch: 23, train_loss: 0.6188, test_loss: 1.1242, test_f1: 0.6156
 epoch: 24, train_loss: 0.6351, test_loss: 1.1364, test_f1: 0.6039
 epoch: 25, train_loss: 0.5855, test_loss: 1.1435, test_f1: 0.6149
 epoch: 26, train_loss: 0.5612, test_loss: 1.3126, test_f1: 0.5555
 epoch: 27, train_loss: 0.5764, test_loss: 1.2415, test_f1: 0.5990
 epoch: 28, train_loss: 0.5438, test_loss: 1.2658, test_f1: 0.6027
 epoch: 29, train_loss: 0.5137, test_loss: 1.2671, test_f1: 0.6025
 epoch: 30, train_loss: 0.5180, test_loss: 1.2567, test_f1: 0.5737
 epoch: 31, train_loss: 0.5440, test_loss: 1.2841, test_f1: 0.6222
 epoch: 32, train_loss: 0.5290, test_loss: 1.2643, test_f1: 0.6012
 epoch: 33, train_loss: 0.4907, test_loss: 1.3192, test_f1: 0.6518
 epoch: 34, train_loss: 0.5179, test_loss: 1.3285, test_f1: 0.6288
 epoch: 35, train_loss: 0.5070, test_loss: 1.3692, test_f1: 0.5873
 epoch: 36, train_loss: 0.4851, test_loss: 1.3078, test_f1: 0.6180
 epoch: 37, train_loss: 0.4974, test_loss: 1.3606, test_f1: 0.6076
 epoch: 38, train_loss: 0.4958, test_loss: 1.3182, test_f1: 0.6131
 epoch: 39, train_loss: 0.4568, test_loss: 1.3798, test_f1: 0.6332
 epoch: 40, train_loss: 0.4541, test_loss: 1.5532, test_f1: 0.6112
 epoch: 41, train_loss: 0.4368, test_loss: 1.5007, test_f1: 0.6063
 epoch: 42, train_loss: 0.4616, test_loss: 1.5029, test_f1: 0.5781
 epoch: 43, train_loss: 0.4386, test_loss: 1.4390, test_f1: 0.6316
 epoch: 44, train_loss: 0.4060, test_loss: 1.4371, test_f1: 0.6395
 epoch: 45, train_loss: 0.3791, test_loss: 1.5421, test_f1: 0.6062
 epoch: 46, train_loss: 0.3839, test_loss: 1.5805, test_f1: 0.6523
 epoch: 47, train_loss: 0.4249, test_loss: 1.5378, test_f1: 0.6191
 epoch: 48, train_loss: 0.3397, test_loss: 1.7502, test_f1: 0.5886
 epoch: 49, train_loss: 0.3801, test_loss: 1.7901, test_f1: 0.5803
 epoch: 50, train_loss: 0.3513, test_loss: 1.6872, test_f1: 0.6138
 epoch: 51, train_loss: 0.3405, test_loss: 1.6065, test_f1: 0.6399
 epoch: 52, train_loss: 0.3092, test_loss: 1.6431, test_f1: 0.6363
 epoch: 53, train_loss: 0.2948, test_loss: 1.6884, test_f1: 0.6351
 epoch: 54, train_loss: 0.2824, test_loss: 1.7443, test_f1: 0.6443
 epoch: 55, train_loss: 0.2693, test_loss: 1.7165, test_f1: 0.6333
 epoch: 56, train_loss: 0.2418, test_loss: 1.7694, test_f1: 0.6386
 epoch: 57, train_loss: 0.2667, test_loss: 1.8312, test_f1: 0.6253
 epoch: 58, train_loss: 0.2576, test_loss: 1.7616, test_f1: 0.6722
 epoch: 59, train_loss: 0.2649, test_loss: 1.8698, test_f1: 0.6305
 epoch: 60, train_loss: 0.2376, test_loss: 1.7861, test_f1: 0.6592
 epoch: 61, train_loss: 0.2430, test_loss: 1.9019, test_f1: 0.6326
 epoch: 62, train_loss: 0.2344, test_loss: 1.9783, test_f1: 0.6338
 epoch: 63, train_loss: 0.2384, test_loss: 1.9157, test_f1: 0.6250
 epoch: 64, train_loss: 0.2254, test_loss: 2.0178, test_f1: 0.6173
 epoch: 65, train_loss: 0.2414, test_loss: 1.9409, test_f1: 0.6236
 epoch: 66, train_loss: 0.2339, test_loss: 1.9997, test_f1: 0.6186
 epoch: 67, train_loss: 0.2275, test_loss: 2.0194, test_f1: 0.6262
 epoch: 68, train_loss: 0.2458, test_loss: 2.0317, test_f1: 0.6035
 epoch: 69, train_loss: 0.2587, test_loss: 2.0372, test_f1: 0.6171
 epoch: 70, train_loss: 0.2157, test_loss: 2.0077, test_f1: 0.6365
 epoch: 71, train_loss: 0.2033, test_loss: 2.0989, test_f1: 0.6243
 epoch: 72, train_loss: 0.2220, test_loss: 2.0644, test_f1: 0.6255
 epoch: 73, train_loss: 0.2140, test_loss: 2.2064, test_f1: 0.6007
 epoch: 74, train_loss: 0.2008, test_loss: 2.0800, test_f1: 0.6220
 epoch: 75, train_loss: 0.2188, test_loss: 2.1560, test_f1: 0.6105
 epoch: 76, train_loss: 0.2124, test_loss: 2.1685, test_f1: 0.6188
 epoch: 77, train_loss: 0.2093, test_loss: 2.2240, test_f1: 0.6168
 epoch: 78, train_loss: 0.1842, test_loss: 2.2153, test_f1: 0.6211
 epoch: 79, train_loss: 0.2032, test_loss: 2.2274, test_f1: 0.5997
 epoch: 80, train_loss: 0.2089, test_loss: 2.2024, test_f1: 0.6293
 epoch: 81, train_loss: 0.1860, test_loss: 2.2548, test_f1: 0.6178
 epoch: 82, train_loss: 0.1783, test_loss: 2.2723, test_f1: 0.6240
 epoch: 83, train_loss: 0.1805, test_loss: 2.2154, test_f1: 0.6272
 epoch: 84, train_loss: 0.1715, test_loss: 2.2158, test_f1: 0.6316
 epoch: 85, train_loss: 0.1942, test_loss: 2.2010, test_f1: 0.6241
 epoch: 86, train_loss: 0.1822, test_loss: 2.5423, test_f1: 0.5977
 epoch: 87, train_loss: 0.1811, test_loss: 2.4712, test_f1: 0.5975
 epoch: 88, train_loss: 0.1998, test_loss: 2.5137, test_f1: 0.6149
 epoch: 89, train_loss: 0.1572, test_loss: 2.4099, test_f1: 0.6011
 epoch: 90, train_loss: 0.1567, test_loss: 2.4618, test_f1: 0.6222
 epoch: 91, train_loss: 0.1583, test_loss: 2.4151, test_f1: 0.6326
 epoch: 92, train_loss: 0.1777, test_loss: 2.4683, test_f1: 0.6309
 epoch: 93, train_loss: 0.1764, test_loss: 2.5300, test_f1: 0.6264
 epoch: 94, train_loss: 0.1677, test_loss: 2.5174, test_f1: 0.6095
 epoch: 95, train_loss: 0.1627, test_loss: 2.6163, test_f1: 0.6118
 epoch: 96, train_loss: 0.1336, test_loss: 2.5966, test_f1: 0.6149
 epoch: 97, train_loss: 0.1412, test_loss: 2.5542, test_f1: 0.6025
 epoch: 98, train_loss: 0.1671, test_loss: 2.5998, test_f1: 0.6062
 epoch: 99, train_loss: 0.1538, test_loss: 2.7154, test_f1: 0.5999

Training completed in 553.48 seconds
Best F1: 0.6722 at epoch 58
Mean F1 across iterations: 0.6479  0.0144
========================FINAL RESULTS================================
FEGIN weighted F1: 0.6722  0.0144
python main.py --data ltspice_demos --representation component_pin_net --model FEGIN --layers 6 --hiddens 64 --batch_size 64 --lr 0.001 --emb_size 512 --epochs 100 --save_appendix component_pin_net_L6_H64_BS64_LR0.001_E512 --no_val
-----



STDERR:
  File "main.py", line 370, in <module>
    main()
  File "main.py", line 254, in main
    dataset = dataset_class(
  File "/home/philip/projects/ltspice_examples_code_repo/Circuit-Completion-Using-GNNs/component_classification_with_link_prediction_head/evaluation/FEGIN/kernel/circuit_datasets.py", line 15, in __init__
    self.data, self.slices = torch.load(self.processed_paths[0])
  File "/home/philip/.local/lib/python3.8/site-packages/torch/serialization.py", line 1040, in load
    warnings.warn(
  File "/usr/lib/python3.8/warnings.py", line 109, in _showwarnmsg
    sw(msg.message, msg.category, msg.filename, msg.lineno,
  File "main.py", line 47, in warn_with_traceback
    traceback.print_stack(file=log)
/home/philip/projects/ltspice_examples_code_repo/Circuit-Completion-Using-GNNs/component_classification_with_link_prediction_head/evaluation/FEGIN/kernel/circuit_datasets.py:15: FutureWarning: You are using `torch.load` with `weights_only=False` (the current default value), which uses the default pickle module implicitly. It is possible to construct malicious pickle data which will execute arbitrary code during unpickling (See https://github.com/pytorch/pytorch/blob/main/SECURITY.md#untrusted-models for more details). In a future release, the default value for `weights_only` will be flipped to `True`. This limits the functions that could be executed during unpickling. Arbitrary objects will no longer be allowed to be loaded via this mode unless they are explicitly allowlisted by the user via `torch.serialization.add_safe_globals`. We recommend you start setting `weights_only=True` for any use case where you don't have full control of the loaded file. Please open an issue on GitHub for any issues related to this experimental feature.
  self.data, self.slices = torch.load(self.processed_paths[0])
