STDOUT:
Results will be saved in /home/philip/projects/ltspice_examples_code_repo/Circuit-Completion-Using-GNNs/component_classification_with_link_prediction_head/evaluation/FEGIN/results/model_FEGIN_dataset_ltspice_demos
Command line input: python main.py --data ltspice_demos --representation component_component --model FEGIN --layers 2 --hiddens 64 --batch_size 32 --lr 0.0001 --emb_size 128 --epochs 100 --save_appendix component_component_L2_H64_BS32_LR0.0001_E128 --no_val
 is saved.
-----
ltspice_demos - FEGIN
Using 2 layers, 64 hidden units, h = 2
Loading component_component representation dataset
ENTERED
Training FEGIN on component_component representation
Train: 1565, Test: 383
##################ITERATION #0 ****************************************
 epoch: 0, train_loss: 1.3972, test_loss: 1.3833, test_f1: 0.1533
 epoch: 1, train_loss: 1.3734, test_loss: 1.3657, test_f1: 0.2281
 epoch: 2, train_loss: 1.3497, test_loss: 1.3453, test_f1: 0.2281
 epoch: 3, train_loss: 1.3192, test_loss: 1.3228, test_f1: 0.2697
 epoch: 4, train_loss: 1.2834, test_loss: 1.3036, test_f1: 0.2602
 epoch: 5, train_loss: 1.2514, test_loss: 1.2883, test_f1: 0.2600
 epoch: 6, train_loss: 1.2193, test_loss: 1.2795, test_f1: 0.2587
 epoch: 7, train_loss: 1.1994, test_loss: 1.2664, test_f1: 0.2600
 epoch: 8, train_loss: 1.1818, test_loss: 1.2610, test_f1: 0.2607
 epoch: 9, train_loss: 1.1765, test_loss: 1.2583, test_f1: 0.2582
 epoch: 10, train_loss: 1.1654, test_loss: 1.2531, test_f1: 0.2813
 epoch: 11, train_loss: 1.1541, test_loss: 1.2442, test_f1: 0.3788
 epoch: 12, train_loss: 1.1387, test_loss: 1.2432, test_f1: 0.4118
 epoch: 13, train_loss: 1.1327, test_loss: 1.2387, test_f1: 0.3945
 epoch: 14, train_loss: 1.1288, test_loss: 1.2285, test_f1: 0.3927
 epoch: 15, train_loss: 1.1088, test_loss: 1.2207, test_f1: 0.3944
 epoch: 16, train_loss: 1.1008, test_loss: 1.2203, test_f1: 0.3809
 epoch: 17, train_loss: 1.0866, test_loss: 1.2120, test_f1: 0.3852
 epoch: 18, train_loss: 1.0787, test_loss: 1.2027, test_f1: 0.4215
 epoch: 19, train_loss: 1.0670, test_loss: 1.2062, test_f1: 0.4215
 epoch: 20, train_loss: 1.0607, test_loss: 1.1886, test_f1: 0.3900
 epoch: 21, train_loss: 1.0530, test_loss: 1.1889, test_f1: 0.4009
 epoch: 22, train_loss: 1.0367, test_loss: 1.1933, test_f1: 0.4102
 epoch: 23, train_loss: 1.0320, test_loss: 1.1922, test_f1: 0.4006
 epoch: 24, train_loss: 1.0233, test_loss: 1.1899, test_f1: 0.4194
 epoch: 25, train_loss: 1.0166, test_loss: 1.1958, test_f1: 0.4317
 epoch: 26, train_loss: 1.0084, test_loss: 1.1838, test_f1: 0.4149
 epoch: 27, train_loss: 1.0009, test_loss: 1.2071, test_f1: 0.4314
 epoch: 28, train_loss: 0.9915, test_loss: 1.1985, test_f1: 0.4557
 epoch: 29, train_loss: 0.9911, test_loss: 1.2023, test_f1: 0.4395
 epoch: 30, train_loss: 0.9833, test_loss: 1.2025, test_f1: 0.4513
 epoch: 31, train_loss: 0.9782, test_loss: 1.2157, test_f1: 0.4801
 epoch: 32, train_loss: 0.9711, test_loss: 1.1862, test_f1: 0.4467
 epoch: 33, train_loss: 0.9724, test_loss: 1.1933, test_f1: 0.4757
 epoch: 34, train_loss: 0.9566, test_loss: 1.2250, test_f1: 0.4688
 epoch: 35, train_loss: 0.9517, test_loss: 1.2048, test_f1: 0.4804
 epoch: 36, train_loss: 0.9299, test_loss: 1.2313, test_f1: 0.4775
 epoch: 37, train_loss: 0.9392, test_loss: 1.2170, test_f1: 0.5069
 epoch: 38, train_loss: 0.9436, test_loss: 1.2038, test_f1: 0.5088
 epoch: 39, train_loss: 0.9350, test_loss: 1.2052, test_f1: 0.4949
 epoch: 40, train_loss: 0.9104, test_loss: 1.2224, test_f1: 0.5311
 epoch: 41, train_loss: 0.9132, test_loss: 1.2384, test_f1: 0.4952
 epoch: 42, train_loss: 0.9314, test_loss: 1.2318, test_f1: 0.5056
 epoch: 43, train_loss: 0.9260, test_loss: 1.2095, test_f1: 0.5203
 epoch: 44, train_loss: 0.9099, test_loss: 1.2110, test_f1: 0.4955
 epoch: 45, train_loss: 0.9056, test_loss: 1.2262, test_f1: 0.5143
 epoch: 46, train_loss: 0.8958, test_loss: 1.2358, test_f1: 0.5175
 epoch: 47, train_loss: 0.8925, test_loss: 1.2880, test_f1: 0.5298
 epoch: 48, train_loss: 0.8845, test_loss: 1.2577, test_f1: 0.4736
 epoch: 49, train_loss: 0.8853, test_loss: 1.2584, test_f1: 0.5198
 epoch: 50, train_loss: 0.8773, test_loss: 1.2547, test_f1: 0.4892
 epoch: 51, train_loss: 0.8716, test_loss: 1.3090, test_f1: 0.4961
 epoch: 52, train_loss: 0.8622, test_loss: 1.2967, test_f1: 0.4914
 epoch: 53, train_loss: 0.8603, test_loss: 1.3181, test_f1: 0.4937
 epoch: 54, train_loss: 0.8586, test_loss: 1.2747, test_f1: 0.4786
 epoch: 55, train_loss: 0.8477, test_loss: 1.3103, test_f1: 0.5030
 epoch: 56, train_loss: 0.8724, test_loss: 1.3047, test_f1: 0.4882
 epoch: 57, train_loss: 0.8352, test_loss: 1.3159, test_f1: 0.5114
 epoch: 58, train_loss: 0.8453, test_loss: 1.3264, test_f1: 0.5095
 epoch: 59, train_loss: 0.8469, test_loss: 1.2901, test_f1: 0.4964
 epoch: 60, train_loss: 0.8404, test_loss: 1.3203, test_f1: 0.4910
 epoch: 61, train_loss: 0.8429, test_loss: 1.3289, test_f1: 0.5171
 epoch: 62, train_loss: 0.8280, test_loss: 1.3372, test_f1: 0.5117
 epoch: 63, train_loss: 0.8308, test_loss: 1.3456, test_f1: 0.5039
 epoch: 64, train_loss: 0.8272, test_loss: 1.3125, test_f1: 0.4949
 epoch: 65, train_loss: 0.8327, test_loss: 1.3499, test_f1: 0.5091
 epoch: 66, train_loss: 0.8255, test_loss: 1.3479, test_f1: 0.5315
 epoch: 67, train_loss: 0.8268, test_loss: 1.3126, test_f1: 0.5146
 epoch: 68, train_loss: 0.8231, test_loss: 1.3651, test_f1: 0.4906
 epoch: 69, train_loss: 0.8312, test_loss: 1.3332, test_f1: 0.5286
 epoch: 70, train_loss: 0.8229, test_loss: 1.3432, test_f1: 0.5151
 epoch: 71, train_loss: 0.8122, test_loss: 1.3406, test_f1: 0.5124
 epoch: 72, train_loss: 0.8054, test_loss: 1.3869, test_f1: 0.5155
 epoch: 73, train_loss: 0.8171, test_loss: 1.3835, test_f1: 0.5043
 epoch: 74, train_loss: 0.8190, test_loss: 1.3785, test_f1: 0.5098
 epoch: 75, train_loss: 0.8207, test_loss: 1.3610, test_f1: 0.5123
 epoch: 76, train_loss: 0.8154, test_loss: 1.3619, test_f1: 0.5040
 epoch: 77, train_loss: 0.8055, test_loss: 1.3664, test_f1: 0.5233
 epoch: 78, train_loss: 0.8116, test_loss: 1.3955, test_f1: 0.5095
 epoch: 79, train_loss: 0.7980, test_loss: 1.3721, test_f1: 0.5144
 epoch: 80, train_loss: 0.8139, test_loss: 1.4006, test_f1: 0.5314
 epoch: 81, train_loss: 0.8097, test_loss: 1.3513, test_f1: 0.5253
 epoch: 82, train_loss: 0.7897, test_loss: 1.3427, test_f1: 0.5168
 epoch: 83, train_loss: 0.7901, test_loss: 1.3441, test_f1: 0.5067
 epoch: 84, train_loss: 0.7953, test_loss: 1.4582, test_f1: 0.5247
 epoch: 85, train_loss: 0.7935, test_loss: 1.4794, test_f1: 0.5169
 epoch: 86, train_loss: 0.7961, test_loss: 1.4356, test_f1: 0.5018
 epoch: 87, train_loss: 0.7929, test_loss: 1.5230, test_f1: 0.5272
 epoch: 88, train_loss: 0.7865, test_loss: 1.4403, test_f1: 0.5250
 epoch: 89, train_loss: 0.7799, test_loss: 1.4361, test_f1: 0.5363
 epoch: 90, train_loss: 0.7736, test_loss: 1.4628, test_f1: 0.5403
 epoch: 91, train_loss: 0.7869, test_loss: 1.5429, test_f1: 0.5282
 epoch: 92, train_loss: 0.7837, test_loss: 1.5484, test_f1: 0.5448
 epoch: 93, train_loss: 0.7810, test_loss: 1.5559, test_f1: 0.5420
 epoch: 94, train_loss: 0.7819, test_loss: 1.5185, test_f1: 0.5416
 epoch: 95, train_loss: 0.7835, test_loss: 1.5476, test_f1: 0.5447
 epoch: 96, train_loss: 0.7702, test_loss: 1.4652, test_f1: 0.5338
 epoch: 97, train_loss: 0.7720, test_loss: 1.4639, test_f1: 0.5531
 epoch: 98, train_loss: 0.7683, test_loss: 1.5064, test_f1: 0.5579
 epoch: 99, train_loss: 0.7693, test_loss: 1.5412, test_f1: 0.5488
##################ITERATION #1 ****************************************
 epoch: 0, train_loss: 1.3580, test_loss: 1.3485, test_f1: 0.2415
 epoch: 1, train_loss: 1.2796, test_loss: 1.3200, test_f1: 0.2281
 epoch: 2, train_loss: 1.2487, test_loss: 1.3104, test_f1: 0.2281
 epoch: 3, train_loss: 1.2207, test_loss: 1.2924, test_f1: 0.2281
 epoch: 4, train_loss: 1.2027, test_loss: 1.2860, test_f1: 0.2302
 epoch: 5, train_loss: 1.1876, test_loss: 1.2724, test_f1: 0.3180
 epoch: 6, train_loss: 1.1670, test_loss: 1.2607, test_f1: 0.3132
 epoch: 7, train_loss: 1.1518, test_loss: 1.2409, test_f1: 0.3552
 epoch: 8, train_loss: 1.1379, test_loss: 1.2265, test_f1: 0.3688
 epoch: 9, train_loss: 1.1208, test_loss: 1.2128, test_f1: 0.4153
 epoch: 10, train_loss: 1.1111, test_loss: 1.2079, test_f1: 0.4517
 epoch: 11, train_loss: 1.0919, test_loss: 1.1963, test_f1: 0.4602
 epoch: 12, train_loss: 1.0773, test_loss: 1.1914, test_f1: 0.4785
 epoch: 13, train_loss: 1.0618, test_loss: 1.1804, test_f1: 0.4837
 epoch: 14, train_loss: 1.0554, test_loss: 1.1779, test_f1: 0.4457
 epoch: 15, train_loss: 1.0291, test_loss: 1.1722, test_f1: 0.4958
 epoch: 16, train_loss: 1.0256, test_loss: 1.1774, test_f1: 0.5136
 epoch: 17, train_loss: 1.0184, test_loss: 1.1691, test_f1: 0.5094
 epoch: 18, train_loss: 1.0101, test_loss: 1.1773, test_f1: 0.4950
 epoch: 19, train_loss: 1.0033, test_loss: 1.1643, test_f1: 0.5449
 epoch: 20, train_loss: 0.9860, test_loss: 1.1565, test_f1: 0.5047
 epoch: 21, train_loss: 0.9786, test_loss: 1.1698, test_f1: 0.5228
 epoch: 22, train_loss: 0.9627, test_loss: 1.1553, test_f1: 0.5197
 epoch: 23, train_loss: 0.9509, test_loss: 1.1473, test_f1: 0.5282
 epoch: 24, train_loss: 0.9540, test_loss: 1.1552, test_f1: 0.5436
 epoch: 25, train_loss: 0.9461, test_loss: 1.1434, test_f1: 0.5752
 epoch: 26, train_loss: 0.9443, test_loss: 1.1369, test_f1: 0.5793
 epoch: 27, train_loss: 0.9361, test_loss: 1.1608, test_f1: 0.5015
 epoch: 28, train_loss: 0.9269, test_loss: 1.1468, test_f1: 0.5572
 epoch: 29, train_loss: 0.9285, test_loss: 1.1390, test_f1: 0.5393
 epoch: 30, train_loss: 0.9119, test_loss: 1.1343, test_f1: 0.5567
 epoch: 31, train_loss: 0.9033, test_loss: 1.1324, test_f1: 0.5592
 epoch: 32, train_loss: 0.9006, test_loss: 1.1391, test_f1: 0.5501
 epoch: 33, train_loss: 0.8963, test_loss: 1.1369, test_f1: 0.5567
 epoch: 34, train_loss: 0.8826, test_loss: 1.1238, test_f1: 0.5715
 epoch: 35, train_loss: 0.8843, test_loss: 1.1223, test_f1: 0.5333
 epoch: 36, train_loss: 0.8801, test_loss: 1.1159, test_f1: 0.5536
 epoch: 37, train_loss: 0.8725, test_loss: 1.1136, test_f1: 0.5724
 epoch: 38, train_loss: 0.8696, test_loss: 1.1320, test_f1: 0.5760
 epoch: 39, train_loss: 0.8638, test_loss: 1.1291, test_f1: 0.5840
 epoch: 40, train_loss: 0.8603, test_loss: 1.1410, test_f1: 0.5744
 epoch: 41, train_loss: 0.8411, test_loss: 1.1646, test_f1: 0.5646
 epoch: 42, train_loss: 0.8384, test_loss: 1.1531, test_f1: 0.5633
 epoch: 43, train_loss: 0.8425, test_loss: 1.1585, test_f1: 0.5753
 epoch: 44, train_loss: 0.8370, test_loss: 1.1468, test_f1: 0.5654
 epoch: 45, train_loss: 0.8351, test_loss: 1.1527, test_f1: 0.5761
 epoch: 46, train_loss: 0.8115, test_loss: 1.1627, test_f1: 0.5628
 epoch: 47, train_loss: 0.8306, test_loss: 1.1427, test_f1: 0.5813
 epoch: 48, train_loss: 0.8360, test_loss: 1.1558, test_f1: 0.5653
 epoch: 49, train_loss: 0.8059, test_loss: 1.1661, test_f1: 0.5767
 epoch: 50, train_loss: 0.8069, test_loss: 1.1637, test_f1: 0.5685
 epoch: 51, train_loss: 0.8018, test_loss: 1.1766, test_f1: 0.5715
 epoch: 52, train_loss: 0.7854, test_loss: 1.1795, test_f1: 0.5846
 epoch: 53, train_loss: 0.7978, test_loss: 1.1785, test_f1: 0.5688
 epoch: 54, train_loss: 0.7899, test_loss: 1.1760, test_f1: 0.5738
 epoch: 55, train_loss: 0.7928, test_loss: 1.1794, test_f1: 0.5745
 epoch: 56, train_loss: 0.7891, test_loss: 1.1770, test_f1: 0.5792
 epoch: 57, train_loss: 0.7727, test_loss: 1.1837, test_f1: 0.5719
 epoch: 58, train_loss: 0.7928, test_loss: 1.1851, test_f1: 0.5765
 epoch: 59, train_loss: 0.7868, test_loss: 1.2009, test_f1: 0.5734
 epoch: 60, train_loss: 0.7785, test_loss: 1.1899, test_f1: 0.5765
 epoch: 61, train_loss: 0.7828, test_loss: 1.1839, test_f1: 0.5875
 epoch: 62, train_loss: 0.7755, test_loss: 1.1879, test_f1: 0.5662
 epoch: 63, train_loss: 0.7714, test_loss: 1.1983, test_f1: 0.5636
 epoch: 64, train_loss: 0.7570, test_loss: 1.2041, test_f1: 0.5823
 epoch: 65, train_loss: 0.7698, test_loss: 1.2242, test_f1: 0.5736
 epoch: 66, train_loss: 0.7666, test_loss: 1.1991, test_f1: 0.5739
 epoch: 67, train_loss: 0.7577, test_loss: 1.2279, test_f1: 0.5662
 epoch: 68, train_loss: 0.7815, test_loss: 1.2288, test_f1: 0.5821
 epoch: 69, train_loss: 0.7685, test_loss: 1.2146, test_f1: 0.5844
 epoch: 70, train_loss: 0.7672, test_loss: 1.2177, test_f1: 0.5551
 epoch: 71, train_loss: 0.7605, test_loss: 1.2407, test_f1: 0.5717
 epoch: 72, train_loss: 0.7431, test_loss: 1.2088, test_f1: 0.5716
 epoch: 73, train_loss: 0.7683, test_loss: 1.2111, test_f1: 0.5578
 epoch: 74, train_loss: 0.7466, test_loss: 1.2046, test_f1: 0.5661
 epoch: 75, train_loss: 0.7465, test_loss: 1.2165, test_f1: 0.5765
 epoch: 76, train_loss: 0.7447, test_loss: 1.2291, test_f1: 0.5710
 epoch: 77, train_loss: 0.7506, test_loss: 1.2402, test_f1: 0.5705
 epoch: 78, train_loss: 0.7443, test_loss: 1.2325, test_f1: 0.5710
 epoch: 79, train_loss: 0.7438, test_loss: 1.2409, test_f1: 0.5660
 epoch: 80, train_loss: 0.7358, test_loss: 1.2440, test_f1: 0.5712
 epoch: 81, train_loss: 0.7439, test_loss: 1.2435, test_f1: 0.5739
 epoch: 82, train_loss: 0.7343, test_loss: 1.2621, test_f1: 0.5635
 epoch: 83, train_loss: 0.7456, test_loss: 1.2730, test_f1: 0.5686
 epoch: 84, train_loss: 0.7328, test_loss: 1.2588, test_f1: 0.5817
 epoch: 85, train_loss: 0.7428, test_loss: 1.2648, test_f1: 0.5662
 epoch: 86, train_loss: 0.7436, test_loss: 1.2599, test_f1: 0.5605
 epoch: 87, train_loss: 0.7387, test_loss: 1.2477, test_f1: 0.5736
 epoch: 88, train_loss: 0.7406, test_loss: 1.2724, test_f1: 0.5632
 epoch: 89, train_loss: 0.7266, test_loss: 1.2685, test_f1: 0.5639
 epoch: 90, train_loss: 0.7341, test_loss: 1.2518, test_f1: 0.5637
 epoch: 91, train_loss: 0.7317, test_loss: 1.2656, test_f1: 0.5734
 epoch: 92, train_loss: 0.7238, test_loss: 1.2674, test_f1: 0.5658
 epoch: 93, train_loss: 0.7121, test_loss: 1.2803, test_f1: 0.5688
 epoch: 94, train_loss: 0.7156, test_loss: 1.2745, test_f1: 0.5688
 epoch: 95, train_loss: 0.7277, test_loss: 1.2996, test_f1: 0.5717
 epoch: 96, train_loss: 0.7134, test_loss: 1.2951, test_f1: 0.5630
 epoch: 97, train_loss: 0.7144, test_loss: 1.3144, test_f1: 0.5607
 epoch: 98, train_loss: 0.7029, test_loss: 1.3036, test_f1: 0.5398
 epoch: 99, train_loss: 0.7283, test_loss: 1.2750, test_f1: 0.5708
##################ITERATION #2 ****************************************
 epoch: 0, train_loss: 1.3002, test_loss: 1.3258, test_f1: 0.2609
 epoch: 1, train_loss: 1.2336, test_loss: 1.2972, test_f1: 0.2797
 epoch: 2, train_loss: 1.2120, test_loss: 1.2832, test_f1: 0.2642
 epoch: 3, train_loss: 1.1954, test_loss: 1.2864, test_f1: 0.2876
 epoch: 4, train_loss: 1.1724, test_loss: 1.2729, test_f1: 0.3074
 epoch: 5, train_loss: 1.1614, test_loss: 1.2547, test_f1: 0.3028
 epoch: 6, train_loss: 1.1568, test_loss: 1.2439, test_f1: 0.3325
 epoch: 7, train_loss: 1.1305, test_loss: 1.2407, test_f1: 0.3760
 epoch: 8, train_loss: 1.1140, test_loss: 1.2266, test_f1: 0.4017
 epoch: 9, train_loss: 1.1056, test_loss: 1.2103, test_f1: 0.4117
 epoch: 10, train_loss: 1.0902, test_loss: 1.2065, test_f1: 0.4189
 epoch: 11, train_loss: 1.0833, test_loss: 1.1894, test_f1: 0.4529
 epoch: 12, train_loss: 1.0752, test_loss: 1.1796, test_f1: 0.4684
 epoch: 13, train_loss: 1.0531, test_loss: 1.1803, test_f1: 0.4736
 epoch: 14, train_loss: 1.0516, test_loss: 1.1743, test_f1: 0.4677
 epoch: 15, train_loss: 1.0365, test_loss: 1.1696, test_f1: 0.4926
 epoch: 16, train_loss: 1.0343, test_loss: 1.1585, test_f1: 0.4996
 epoch: 17, train_loss: 1.0124, test_loss: 1.1558, test_f1: 0.5149
 epoch: 18, train_loss: 1.0078, test_loss: 1.1622, test_f1: 0.4977
 epoch: 19, train_loss: 0.9997, test_loss: 1.1586, test_f1: 0.5014
 epoch: 20, train_loss: 0.9835, test_loss: 1.1567, test_f1: 0.5258
 epoch: 21, train_loss: 0.9917, test_loss: 1.1469, test_f1: 0.5224
 epoch: 22, train_loss: 0.9900, test_loss: 1.1661, test_f1: 0.4917
 epoch: 23, train_loss: 0.9668, test_loss: 1.1354, test_f1: 0.5508
 epoch: 24, train_loss: 0.9601, test_loss: 1.1524, test_f1: 0.5194
 epoch: 25, train_loss: 0.9564, test_loss: 1.1503, test_f1: 0.5164
 epoch: 26, train_loss: 0.9522, test_loss: 1.1499, test_f1: 0.5228
 epoch: 27, train_loss: 0.9530, test_loss: 1.1600, test_f1: 0.5383
 epoch: 28, train_loss: 0.9427, test_loss: 1.1589, test_f1: 0.5161
 epoch: 29, train_loss: 0.9260, test_loss: 1.1249, test_f1: 0.5252
 epoch: 30, train_loss: 0.9191, test_loss: 1.1411, test_f1: 0.5426
 epoch: 31, train_loss: 0.9275, test_loss: 1.1773, test_f1: 0.5212
 epoch: 32, train_loss: 0.9194, test_loss: 1.1795, test_f1: 0.5253
 epoch: 33, train_loss: 0.9146, test_loss: 1.1797, test_f1: 0.5091
 epoch: 34, train_loss: 0.8928, test_loss: 1.1878, test_f1: 0.5162
 epoch: 35, train_loss: 0.9046, test_loss: 1.1843, test_f1: 0.5164
 epoch: 36, train_loss: 0.8713, test_loss: 1.1745, test_f1: 0.5209
 epoch: 37, train_loss: 0.8887, test_loss: 1.1848, test_f1: 0.5191
 epoch: 38, train_loss: 0.8793, test_loss: 1.2149, test_f1: 0.5054
 epoch: 39, train_loss: 0.8767, test_loss: 1.2276, test_f1: 0.4820
 epoch: 40, train_loss: 0.8699, test_loss: 1.1975, test_f1: 0.5151
 epoch: 41, train_loss: 0.8710, test_loss: 1.2026, test_f1: 0.5107
 epoch: 42, train_loss: 0.8668, test_loss: 1.2185, test_f1: 0.5332
 epoch: 43, train_loss: 0.8404, test_loss: 1.2584, test_f1: 0.5017
 epoch: 44, train_loss: 0.8491, test_loss: 1.2465, test_f1: 0.4984
 epoch: 45, train_loss: 0.8391, test_loss: 1.2285, test_f1: 0.5063
 epoch: 46, train_loss: 0.8350, test_loss: 1.3158, test_f1: 0.5019
 epoch: 47, train_loss: 0.8345, test_loss: 1.2676, test_f1: 0.5091
 epoch: 48, train_loss: 0.8258, test_loss: 1.3334, test_f1: 0.5056
 epoch: 49, train_loss: 0.8344, test_loss: 1.4181, test_f1: 0.5230
 epoch: 50, train_loss: 0.8157, test_loss: 1.3343, test_f1: 0.5150
 epoch: 51, train_loss: 0.8145, test_loss: 1.3189, test_f1: 0.5184
 epoch: 52, train_loss: 0.7916, test_loss: 1.3816, test_f1: 0.5043
 epoch: 53, train_loss: 0.8056, test_loss: 1.3214, test_f1: 0.4948
 epoch: 54, train_loss: 0.8008, test_loss: 1.3022, test_f1: 0.5186
 epoch: 55, train_loss: 0.8093, test_loss: 1.3209, test_f1: 0.5107
 epoch: 56, train_loss: 0.8087, test_loss: 1.3874, test_f1: 0.5168
 epoch: 57, train_loss: 0.8069, test_loss: 1.3190, test_f1: 0.5224
 epoch: 58, train_loss: 0.8075, test_loss: 1.3569, test_f1: 0.5227
 epoch: 59, train_loss: 0.7836, test_loss: 1.3859, test_f1: 0.5302
 epoch: 60, train_loss: 0.7909, test_loss: 1.3937, test_f1: 0.5269
 epoch: 61, train_loss: 0.8056, test_loss: 1.4126, test_f1: 0.5210
 epoch: 62, train_loss: 0.7942, test_loss: 1.5429, test_f1: 0.5047
 epoch: 63, train_loss: 0.7796, test_loss: 1.4018, test_f1: 0.5189
 epoch: 64, train_loss: 0.8007, test_loss: 1.5486, test_f1: 0.5054
 epoch: 65, train_loss: 0.7877, test_loss: 1.4524, test_f1: 0.5331
 epoch: 66, train_loss: 0.7679, test_loss: 1.5065, test_f1: 0.5267
 epoch: 67, train_loss: 0.7797, test_loss: 1.6610, test_f1: 0.5228
 epoch: 68, train_loss: 0.7830, test_loss: 1.5544, test_f1: 0.5321
 epoch: 69, train_loss: 0.7708, test_loss: 1.6661, test_f1: 0.5138
 epoch: 70, train_loss: 0.7668, test_loss: 1.6473, test_f1: 0.5297
 epoch: 71, train_loss: 0.7705, test_loss: 1.6746, test_f1: 0.5238
 epoch: 72, train_loss: 0.7746, test_loss: 1.7611, test_f1: 0.5322
 epoch: 73, train_loss: 0.7805, test_loss: 1.5863, test_f1: 0.5191
 epoch: 74, train_loss: 0.7773, test_loss: 1.7099, test_f1: 0.5146
 epoch: 75, train_loss: 0.7592, test_loss: 1.5235, test_f1: 0.5266
 epoch: 76, train_loss: 0.7681, test_loss: 1.5818, test_f1: 0.5251
 epoch: 77, train_loss: 0.7716, test_loss: 1.5711, test_f1: 0.5306
 epoch: 78, train_loss: 0.7579, test_loss: 1.5976, test_f1: 0.5328
 epoch: 79, train_loss: 0.7724, test_loss: 1.6154, test_f1: 0.5401
 epoch: 80, train_loss: 0.7582, test_loss: 1.6711, test_f1: 0.5338
 epoch: 81, train_loss: 0.7399, test_loss: 1.6676, test_f1: 0.5353
 epoch: 82, train_loss: 0.7445, test_loss: 1.6979, test_f1: 0.5451
 epoch: 83, train_loss: 0.7509, test_loss: 1.6029, test_f1: 0.5281
 epoch: 84, train_loss: 0.7459, test_loss: 1.7174, test_f1: 0.5413
 epoch: 85, train_loss: 0.7470, test_loss: 1.7673, test_f1: 0.5298
 epoch: 86, train_loss: 0.7345, test_loss: 1.6744, test_f1: 0.5331
 epoch: 87, train_loss: 0.7458, test_loss: 1.7368, test_f1: 0.5255
 epoch: 88, train_loss: 0.7361, test_loss: 1.8234, test_f1: 0.5271
 epoch: 89, train_loss: 0.7352, test_loss: 1.5254, test_f1: 0.5517
 epoch: 90, train_loss: 0.7441, test_loss: 1.8411, test_f1: 0.5301
 epoch: 91, train_loss: 0.7595, test_loss: 1.8763, test_f1: 0.5389
 epoch: 92, train_loss: 0.7408, test_loss: 1.9067, test_f1: 0.5394
 epoch: 93, train_loss: 0.7438, test_loss: 1.9691, test_f1: 0.5260
 epoch: 94, train_loss: 0.7214, test_loss: 1.9382, test_f1: 0.5436
 epoch: 95, train_loss: 0.7425, test_loss: 1.8913, test_f1: 0.5412
 epoch: 96, train_loss: 0.7235, test_loss: 1.7449, test_f1: 0.5356
 epoch: 97, train_loss: 0.7201, test_loss: 1.6904, test_f1: 0.5538
 epoch: 98, train_loss: 0.7216, test_loss: 1.7282, test_f1: 0.5550
 epoch: 99, train_loss: 0.7236, test_loss: 1.7883, test_f1: 0.5324
##################ITERATION #3 ****************************************
 epoch: 0, train_loss: 1.2926, test_loss: 1.2968, test_f1: 0.2549
 epoch: 1, train_loss: 1.2037, test_loss: 1.2581, test_f1: 0.3526
 epoch: 2, train_loss: 1.1731, test_loss: 1.2315, test_f1: 0.3799
 epoch: 3, train_loss: 1.1548, test_loss: 1.2139, test_f1: 0.3866
 epoch: 4, train_loss: 1.1463, test_loss: 1.2092, test_f1: 0.4222
 epoch: 5, train_loss: 1.1257, test_loss: 1.2063, test_f1: 0.4255
 epoch: 6, train_loss: 1.1090, test_loss: 1.1986, test_f1: 0.4383
 epoch: 7, train_loss: 1.0896, test_loss: 1.1869, test_f1: 0.4436
 epoch: 8, train_loss: 1.0935, test_loss: 1.1969, test_f1: 0.4657
 epoch: 9, train_loss: 1.0728, test_loss: 1.1873, test_f1: 0.4524
 epoch: 10, train_loss: 1.0732, test_loss: 1.1807, test_f1: 0.4662
 epoch: 11, train_loss: 1.0591, test_loss: 1.1738, test_f1: 0.4645
 epoch: 12, train_loss: 1.0522, test_loss: 1.1718, test_f1: 0.4799
 epoch: 13, train_loss: 1.0290, test_loss: 1.1731, test_f1: 0.4924
 epoch: 14, train_loss: 1.0324, test_loss: 1.1591, test_f1: 0.5023
 epoch: 15, train_loss: 1.0186, test_loss: 1.1644, test_f1: 0.4875
 epoch: 16, train_loss: 1.0213, test_loss: 1.1576, test_f1: 0.5318
 epoch: 17, train_loss: 1.0175, test_loss: 1.1556, test_f1: 0.5257
 epoch: 18, train_loss: 1.0056, test_loss: 1.1519, test_f1: 0.5327
 epoch: 19, train_loss: 0.9862, test_loss: 1.1593, test_f1: 0.5296
 epoch: 20, train_loss: 0.9921, test_loss: 1.1472, test_f1: 0.5405
 epoch: 21, train_loss: 0.9859, test_loss: 1.1587, test_f1: 0.5308
 epoch: 22, train_loss: 0.9582, test_loss: 1.1548, test_f1: 0.5220
 epoch: 23, train_loss: 0.9638, test_loss: 1.1514, test_f1: 0.5106
 epoch: 24, train_loss: 0.9594, test_loss: 1.1352, test_f1: 0.5362
 epoch: 25, train_loss: 0.9533, test_loss: 1.1384, test_f1: 0.5382
 epoch: 26, train_loss: 0.9512, test_loss: 1.1449, test_f1: 0.5299
 epoch: 27, train_loss: 0.9387, test_loss: 1.1617, test_f1: 0.5275
 epoch: 28, train_loss: 0.9406, test_loss: 1.1578, test_f1: 0.5208
 epoch: 29, train_loss: 0.9314, test_loss: 1.1753, test_f1: 0.5358
 epoch: 30, train_loss: 0.9173, test_loss: 1.1340, test_f1: 0.5475
 epoch: 31, train_loss: 0.9206, test_loss: 1.1535, test_f1: 0.5292
 epoch: 32, train_loss: 0.9170, test_loss: 1.1378, test_f1: 0.5414
 epoch: 33, train_loss: 0.8938, test_loss: 1.1518, test_f1: 0.5248
 epoch: 34, train_loss: 0.9029, test_loss: 1.1325, test_f1: 0.5402
 epoch: 35, train_loss: 0.8912, test_loss: 1.1651, test_f1: 0.5402
 epoch: 36, train_loss: 0.8868, test_loss: 1.1389, test_f1: 0.5672
 epoch: 37, train_loss: 0.8891, test_loss: 1.1566, test_f1: 0.5520
 epoch: 38, train_loss: 0.8870, test_loss: 1.1556, test_f1: 0.5651
 epoch: 39, train_loss: 0.8710, test_loss: 1.2217, test_f1: 0.5591
 epoch: 40, train_loss: 0.8736, test_loss: 1.1912, test_f1: 0.5640
 epoch: 41, train_loss: 0.8449, test_loss: 1.1860, test_f1: 0.5655
 epoch: 42, train_loss: 0.8662, test_loss: 1.1858, test_f1: 0.5723
 epoch: 43, train_loss: 0.8601, test_loss: 1.2109, test_f1: 0.5841
 epoch: 44, train_loss: 0.8686, test_loss: 1.2000, test_f1: 0.5756
 epoch: 45, train_loss: 0.8548, test_loss: 1.1798, test_f1: 0.5699
 epoch: 46, train_loss: 0.8524, test_loss: 1.2551, test_f1: 0.5677
 epoch: 47, train_loss: 0.8391, test_loss: 1.2506, test_f1: 0.5605
 epoch: 48, train_loss: 0.8301, test_loss: 1.1974, test_f1: 0.5743
 epoch: 49, train_loss: 0.8458, test_loss: 1.1801, test_f1: 0.5674
 epoch: 50, train_loss: 0.8357, test_loss: 1.2087, test_f1: 0.5632
 epoch: 51, train_loss: 0.8422, test_loss: 1.1429, test_f1: 0.5886
 epoch: 52, train_loss: 0.8143, test_loss: 1.1894, test_f1: 0.5620
 epoch: 53, train_loss: 0.8207, test_loss: 1.2184, test_f1: 0.5805
 epoch: 54, train_loss: 0.8085, test_loss: 1.2288, test_f1: 0.5591
 epoch: 55, train_loss: 0.8201, test_loss: 1.2462, test_f1: 0.5599
 epoch: 56, train_loss: 0.7963, test_loss: 1.2171, test_f1: 0.5647
 epoch: 57, train_loss: 0.7944, test_loss: 1.2266, test_f1: 0.5776
 epoch: 58, train_loss: 0.8125, test_loss: 1.2604, test_f1: 0.5679
 epoch: 59, train_loss: 0.8059, test_loss: 1.2637, test_f1: 0.5641
 epoch: 60, train_loss: 0.8030, test_loss: 1.2904, test_f1: 0.5682
 epoch: 61, train_loss: 0.8039, test_loss: 1.2956, test_f1: 0.5585
 epoch: 62, train_loss: 0.7815, test_loss: 1.2584, test_f1: 0.5780
 epoch: 63, train_loss: 0.7954, test_loss: 1.2470, test_f1: 0.5674
 epoch: 64, train_loss: 0.8013, test_loss: 1.3086, test_f1: 0.5503
 epoch: 65, train_loss: 0.7901, test_loss: 1.2507, test_f1: 0.5782
 epoch: 66, train_loss: 0.7773, test_loss: 1.2974, test_f1: 0.5629
 epoch: 67, train_loss: 0.7864, test_loss: 1.2583, test_f1: 0.5649
 epoch: 68, train_loss: 0.7820, test_loss: 1.2557, test_f1: 0.5738
 epoch: 69, train_loss: 0.7827, test_loss: 1.3402, test_f1: 0.5597
 epoch: 70, train_loss: 0.7834, test_loss: 1.2688, test_f1: 0.5659
 epoch: 71, train_loss: 0.7921, test_loss: 1.2729, test_f1: 0.5710
 epoch: 72, train_loss: 0.7886, test_loss: 1.2880, test_f1: 0.5550
 epoch: 73, train_loss: 0.7910, test_loss: 1.3401, test_f1: 0.5597
 epoch: 74, train_loss: 0.7786, test_loss: 1.3103, test_f1: 0.5529
 epoch: 75, train_loss: 0.7685, test_loss: 1.3513, test_f1: 0.5421
 epoch: 76, train_loss: 0.7725, test_loss: 1.3318, test_f1: 0.5589
 epoch: 77, train_loss: 0.7866, test_loss: 1.2735, test_f1: 0.5810
 epoch: 78, train_loss: 0.7735, test_loss: 1.2931, test_f1: 0.5646
 epoch: 79, train_loss: 0.7601, test_loss: 1.3320, test_f1: 0.5734
 epoch: 80, train_loss: 0.7682, test_loss: 1.3087, test_f1: 0.5695
 epoch: 81, train_loss: 0.7523, test_loss: 1.3569, test_f1: 0.5658
 epoch: 82, train_loss: 0.7591, test_loss: 1.4537, test_f1: 0.5625
 epoch: 83, train_loss: 0.7583, test_loss: 1.3256, test_f1: 0.5644
 epoch: 84, train_loss: 0.7571, test_loss: 1.2821, test_f1: 0.5726
 epoch: 85, train_loss: 0.7563, test_loss: 1.3058, test_f1: 0.5839
 epoch: 86, train_loss: 0.7559, test_loss: 1.3652, test_f1: 0.5730
 epoch: 87, train_loss: 0.7457, test_loss: 1.2514, test_f1: 0.5677
 epoch: 88, train_loss: 0.7526, test_loss: 1.4204, test_f1: 0.5678
 epoch: 89, train_loss: 0.7641, test_loss: 1.3892, test_f1: 0.5714
 epoch: 90, train_loss: 0.7523, test_loss: 1.3177, test_f1: 0.5591
 epoch: 91, train_loss: 0.7548, test_loss: 1.3309, test_f1: 0.5550
 epoch: 92, train_loss: 0.7412, test_loss: 1.3958, test_f1: 0.5788
 epoch: 93, train_loss: 0.7421, test_loss: 1.3987, test_f1: 0.5659
 epoch: 94, train_loss: 0.7351, test_loss: 1.4605, test_f1: 0.5513
 epoch: 95, train_loss: 0.7519, test_loss: 1.3759, test_f1: 0.5663
 epoch: 96, train_loss: 0.7475, test_loss: 1.3211, test_f1: 0.5586
 epoch: 97, train_loss: 0.7478, test_loss: 1.4511, test_f1: 0.5642
 epoch: 98, train_loss: 0.7497, test_loss: 1.4406, test_f1: 0.5570
 epoch: 99, train_loss: 0.7459, test_loss: 1.4140, test_f1: 0.5696
##################ITERATION #4 ****************************************
 epoch: 0, train_loss: 1.2964, test_loss: 1.3745, test_f1: 0.3067
 epoch: 1, train_loss: 1.2311, test_loss: 1.3810, test_f1: 0.3509
 epoch: 2, train_loss: 1.2048, test_loss: 1.3467, test_f1: 0.3937
 epoch: 3, train_loss: 1.1786, test_loss: 1.3183, test_f1: 0.4282
 epoch: 4, train_loss: 1.1781, test_loss: 1.2944, test_f1: 0.4479
 epoch: 5, train_loss: 1.1480, test_loss: 1.3012, test_f1: 0.4789
 epoch: 6, train_loss: 1.1341, test_loss: 1.2719, test_f1: 0.4865
 epoch: 7, train_loss: 1.1154, test_loss: 1.2704, test_f1: 0.4778
 epoch: 8, train_loss: 1.0992, test_loss: 1.2484, test_f1: 0.4913
 epoch: 9, train_loss: 1.0916, test_loss: 1.2447, test_f1: 0.4956
 epoch: 10, train_loss: 1.0772, test_loss: 1.2092, test_f1: 0.5198
 epoch: 11, train_loss: 1.0527, test_loss: 1.2136, test_f1: 0.5036
 epoch: 12, train_loss: 1.0376, test_loss: 1.1897, test_f1: 0.5221
 epoch: 13, train_loss: 1.0315, test_loss: 1.1890, test_f1: 0.5121
 epoch: 14, train_loss: 1.0200, test_loss: 1.1769, test_f1: 0.5145
 epoch: 15, train_loss: 1.0032, test_loss: 1.1758, test_f1: 0.4971
 epoch: 16, train_loss: 1.0119, test_loss: 1.1861, test_f1: 0.4988
 epoch: 17, train_loss: 0.9947, test_loss: 1.1711, test_f1: 0.5158
 epoch: 18, train_loss: 0.9832, test_loss: 1.1855, test_f1: 0.4874
 epoch: 19, train_loss: 0.9722, test_loss: 1.1551, test_f1: 0.5338
 epoch: 20, train_loss: 0.9615, test_loss: 1.1745, test_f1: 0.5418
 epoch: 21, train_loss: 0.9769, test_loss: 1.1879, test_f1: 0.5345
 epoch: 22, train_loss: 0.9545, test_loss: 1.1762, test_f1: 0.5219
 epoch: 23, train_loss: 0.9474, test_loss: 1.1913, test_f1: 0.4873
 epoch: 24, train_loss: 0.9434, test_loss: 1.1570, test_f1: 0.5092
 epoch: 25, train_loss: 0.9287, test_loss: 1.1854, test_f1: 0.5191
 epoch: 26, train_loss: 0.9177, test_loss: 1.1964, test_f1: 0.5215
 epoch: 27, train_loss: 0.9100, test_loss: 1.1821, test_f1: 0.5270
 epoch: 28, train_loss: 0.9196, test_loss: 1.1974, test_f1: 0.5339
 epoch: 29, train_loss: 0.9021, test_loss: 1.1756, test_f1: 0.5313
 epoch: 30, train_loss: 0.8952, test_loss: 1.1997, test_f1: 0.5470
 epoch: 31, train_loss: 0.9053, test_loss: 1.1971, test_f1: 0.5391
 epoch: 32, train_loss: 0.9010, test_loss: 1.2427, test_f1: 0.5242
 epoch: 33, train_loss: 0.9000, test_loss: 1.2166, test_f1: 0.5039
 epoch: 34, train_loss: 0.8692, test_loss: 1.2306, test_f1: 0.5370
 epoch: 35, train_loss: 0.8616, test_loss: 1.2608, test_f1: 0.5064
 epoch: 36, train_loss: 0.8553, test_loss: 1.2184, test_f1: 0.5618
 epoch: 37, train_loss: 0.8694, test_loss: 1.2261, test_f1: 0.5191
 epoch: 38, train_loss: 0.8375, test_loss: 1.1610, test_f1: 0.5583
 epoch: 39, train_loss: 0.8593, test_loss: 1.2391, test_f1: 0.5649
 epoch: 40, train_loss: 0.8455, test_loss: 1.2348, test_f1: 0.5187
 epoch: 41, train_loss: 0.8506, test_loss: 1.2701, test_f1: 0.5440
 epoch: 42, train_loss: 0.8374, test_loss: 1.2134, test_f1: 0.5515
 epoch: 43, train_loss: 0.8334, test_loss: 1.2589, test_f1: 0.5358
 epoch: 44, train_loss: 0.8387, test_loss: 1.1832, test_f1: 0.5403
 epoch: 45, train_loss: 0.8357, test_loss: 1.1754, test_f1: 0.5527
 epoch: 46, train_loss: 0.8154, test_loss: 1.2731, test_f1: 0.5450
 epoch: 47, train_loss: 0.8252, test_loss: 1.2565, test_f1: 0.5663
 epoch: 48, train_loss: 0.8126, test_loss: 1.2475, test_f1: 0.5806
 epoch: 49, train_loss: 0.8211, test_loss: 1.2561, test_f1: 0.5436
 epoch: 50, train_loss: 0.8069, test_loss: 1.2987, test_f1: 0.5491
 epoch: 51, train_loss: 0.7881, test_loss: 1.2533, test_f1: 0.5565
 epoch: 52, train_loss: 0.8008, test_loss: 1.3264, test_f1: 0.5556
 epoch: 53, train_loss: 0.7864, test_loss: 1.2569, test_f1: 0.5811
 epoch: 54, train_loss: 0.7852, test_loss: 1.3062, test_f1: 0.5497
 epoch: 55, train_loss: 0.7851, test_loss: 1.2747, test_f1: 0.5650
 epoch: 56, train_loss: 0.8013, test_loss: 1.2819, test_f1: 0.5602
 epoch: 57, train_loss: 0.7930, test_loss: 1.3064, test_f1: 0.5702
 epoch: 58, train_loss: 0.7627, test_loss: 1.3211, test_f1: 0.5714
 epoch: 59, train_loss: 0.7897, test_loss: 1.2336, test_f1: 0.5693
 epoch: 60, train_loss: 0.7772, test_loss: 1.2796, test_f1: 0.5616
 epoch: 61, train_loss: 0.7849, test_loss: 1.2732, test_f1: 0.5675
 epoch: 62, train_loss: 0.7879, test_loss: 1.3066, test_f1: 0.5585
 epoch: 63, train_loss: 0.7893, test_loss: 1.3286, test_f1: 0.5510
 epoch: 64, train_loss: 0.7758, test_loss: 1.3142, test_f1: 0.5645
 epoch: 65, train_loss: 0.7810, test_loss: 1.3826, test_f1: 0.5686
 epoch: 66, train_loss: 0.7749, test_loss: 1.3710, test_f1: 0.5652
 epoch: 67, train_loss: 0.7721, test_loss: 1.2964, test_f1: 0.5590
 epoch: 68, train_loss: 0.7650, test_loss: 1.3101, test_f1: 0.5497
 epoch: 69, train_loss: 0.7640, test_loss: 1.3618, test_f1: 0.5622
 epoch: 70, train_loss: 0.7680, test_loss: 1.3208, test_f1: 0.5597
 epoch: 71, train_loss: 0.7690, test_loss: 1.3216, test_f1: 0.5725
 epoch: 72, train_loss: 0.7763, test_loss: 1.4129, test_f1: 0.5726
 epoch: 73, train_loss: 0.7548, test_loss: 1.3178, test_f1: 0.5785
 epoch: 74, train_loss: 0.7484, test_loss: 1.3628, test_f1: 0.5625
 epoch: 75, train_loss: 0.7384, test_loss: 1.4235, test_f1: 0.5573
 epoch: 76, train_loss: 0.7462, test_loss: 1.3748, test_f1: 0.5708
 epoch: 77, train_loss: 0.7525, test_loss: 1.4351, test_f1: 0.5628
 epoch: 78, train_loss: 0.7600, test_loss: 1.3775, test_f1: 0.5609
 epoch: 79, train_loss: 0.7487, test_loss: 1.3783, test_f1: 0.5646
 epoch: 80, train_loss: 0.7524, test_loss: 1.3822, test_f1: 0.5684
 epoch: 81, train_loss: 0.7557, test_loss: 1.4019, test_f1: 0.5494
 epoch: 82, train_loss: 0.7367, test_loss: 1.3704, test_f1: 0.5755
 epoch: 83, train_loss: 0.7648, test_loss: 1.4617, test_f1: 0.5692
 epoch: 84, train_loss: 0.7414, test_loss: 1.3436, test_f1: 0.5820
 epoch: 85, train_loss: 0.7360, test_loss: 1.4224, test_f1: 0.5673
 epoch: 86, train_loss: 0.7333, test_loss: 1.4334, test_f1: 0.5661
 epoch: 87, train_loss: 0.7301, test_loss: 1.3436, test_f1: 0.5794
 epoch: 88, train_loss: 0.7365, test_loss: 1.4989, test_f1: 0.5819
 epoch: 89, train_loss: 0.7324, test_loss: 1.3764, test_f1: 0.5740
 epoch: 90, train_loss: 0.7345, test_loss: 1.3984, test_f1: 0.5851
 epoch: 91, train_loss: 0.7523, test_loss: 1.3767, test_f1: 0.5700
 epoch: 92, train_loss: 0.7404, test_loss: 1.3990, test_f1: 0.5840
 epoch: 93, train_loss: 0.7290, test_loss: 1.3444, test_f1: 0.5728
 epoch: 94, train_loss: 0.7273, test_loss: 1.4092, test_f1: 0.5772
 epoch: 95, train_loss: 0.7247, test_loss: 1.4901, test_f1: 0.5764
 epoch: 96, train_loss: 0.7269, test_loss: 1.3795, test_f1: 0.5837
 epoch: 97, train_loss: 0.7361, test_loss: 1.4233, test_f1: 0.5884
 epoch: 98, train_loss: 0.7400, test_loss: 1.3935, test_f1: 0.5798
 epoch: 99, train_loss: 0.7367, test_loss: 1.4407, test_f1: 0.5717
##################ITERATION #5 ****************************************
 epoch: 0, train_loss: 1.2825, test_loss: 1.3023, test_f1: 0.3663
 epoch: 1, train_loss: 1.2336, test_loss: 1.2748, test_f1: 0.3840
 epoch: 2, train_loss: 1.1849, test_loss: 1.2616, test_f1: 0.4335
 epoch: 3, train_loss: 1.1757, test_loss: 1.2494, test_f1: 0.4490
 epoch: 4, train_loss: 1.1666, test_loss: 1.2477, test_f1: 0.4456
 epoch: 5, train_loss: 1.1385, test_loss: 1.2277, test_f1: 0.4648
 epoch: 6, train_loss: 1.1421, test_loss: 1.2353, test_f1: 0.4476
 epoch: 7, train_loss: 1.1072, test_loss: 1.2219, test_f1: 0.4750
 epoch: 8, train_loss: 1.1009, test_loss: 1.2059, test_f1: 0.4747
 epoch: 9, train_loss: 1.1017, test_loss: 1.2042, test_f1: 0.4678
 epoch: 10, train_loss: 1.0846, test_loss: 1.1991, test_f1: 0.4994
 epoch: 11, train_loss: 1.0546, test_loss: 1.1814, test_f1: 0.5193
 epoch: 12, train_loss: 1.0615, test_loss: 1.1780, test_f1: 0.4994
 epoch: 13, train_loss: 1.0557, test_loss: 1.2014, test_f1: 0.5190
 epoch: 14, train_loss: 1.0270, test_loss: 1.1732, test_f1: 0.5143
 epoch: 15, train_loss: 1.0298, test_loss: 1.2060, test_f1: 0.5162
 epoch: 16, train_loss: 1.0342, test_loss: 1.1696, test_f1: 0.5166
 epoch: 17, train_loss: 1.0127, test_loss: 1.1734, test_f1: 0.5591
 epoch: 18, train_loss: 1.0108, test_loss: 1.1699, test_f1: 0.5362
 epoch: 19, train_loss: 1.0021, test_loss: 1.1809, test_f1: 0.5336
 epoch: 20, train_loss: 0.9797, test_loss: 1.1571, test_f1: 0.5738
 epoch: 21, train_loss: 0.9975, test_loss: 1.1879, test_f1: 0.5159
 epoch: 22, train_loss: 0.9747, test_loss: 1.1729, test_f1: 0.5334
 epoch: 23, train_loss: 0.9772, test_loss: 1.1651, test_f1: 0.5098
 epoch: 24, train_loss: 0.9784, test_loss: 1.1536, test_f1: 0.5261
 epoch: 25, train_loss: 0.9574, test_loss: 1.1581, test_f1: 0.5458
 epoch: 26, train_loss: 0.9684, test_loss: 1.1584, test_f1: 0.5383
 epoch: 27, train_loss: 0.9550, test_loss: 1.1569, test_f1: 0.5393
 epoch: 28, train_loss: 0.9357, test_loss: 1.1636, test_f1: 0.5236
 epoch: 29, train_loss: 0.9227, test_loss: 1.1635, test_f1: 0.5111
 epoch: 30, train_loss: 0.9512, test_loss: 1.1737, test_f1: 0.5151
 epoch: 31, train_loss: 0.9343, test_loss: 1.2139, test_f1: 0.5131
 epoch: 32, train_loss: 0.9086, test_loss: 1.1613, test_f1: 0.5310
 epoch: 33, train_loss: 0.9208, test_loss: 1.1528, test_f1: 0.5337
 epoch: 34, train_loss: 0.9114, test_loss: 1.2003, test_f1: 0.5137
 epoch: 35, train_loss: 0.9161, test_loss: 1.1703, test_f1: 0.5316
 epoch: 36, train_loss: 0.9077, test_loss: 1.1512, test_f1: 0.5271
 epoch: 37, train_loss: 0.9042, test_loss: 1.1622, test_f1: 0.5271
 epoch: 38, train_loss: 0.8976, test_loss: 1.1830, test_f1: 0.5275
 epoch: 39, train_loss: 0.8886, test_loss: 1.2041, test_f1: 0.5152
 epoch: 40, train_loss: 0.8899, test_loss: 1.1556, test_f1: 0.5450
 epoch: 41, train_loss: 0.8699, test_loss: 1.2091, test_f1: 0.5235
 epoch: 42, train_loss: 0.8777, test_loss: 1.2050, test_f1: 0.5367
 epoch: 43, train_loss: 0.8656, test_loss: 1.2398, test_f1: 0.4875
 epoch: 44, train_loss: 0.8802, test_loss: 1.2189, test_f1: 0.5090
 epoch: 45, train_loss: 0.8627, test_loss: 1.1924, test_f1: 0.5517
 epoch: 46, train_loss: 0.8523, test_loss: 1.2086, test_f1: 0.5473
 epoch: 47, train_loss: 0.8481, test_loss: 1.2484, test_f1: 0.5140
 epoch: 48, train_loss: 0.8558, test_loss: 1.2305, test_f1: 0.5385
 epoch: 49, train_loss: 0.8393, test_loss: 1.2592, test_f1: 0.5141
 epoch: 50, train_loss: 0.8496, test_loss: 1.1932, test_f1: 0.5420
 epoch: 51, train_loss: 0.8394, test_loss: 1.2174, test_f1: 0.5326
 epoch: 52, train_loss: 0.8450, test_loss: 1.2257, test_f1: 0.5300
 epoch: 53, train_loss: 0.8235, test_loss: 1.2320, test_f1: 0.5321
 epoch: 54, train_loss: 0.8177, test_loss: 1.2332, test_f1: 0.5327
 epoch: 55, train_loss: 0.8337, test_loss: 1.2270, test_f1: 0.5401
 epoch: 56, train_loss: 0.8417, test_loss: 1.2646, test_f1: 0.5232
 epoch: 57, train_loss: 0.8218, test_loss: 1.2416, test_f1: 0.5376
 epoch: 58, train_loss: 0.8029, test_loss: 1.2923, test_f1: 0.5077
 epoch: 59, train_loss: 0.8401, test_loss: 1.2371, test_f1: 0.5296
 epoch: 60, train_loss: 0.8322, test_loss: 1.2398, test_f1: 0.5426
 epoch: 61, train_loss: 0.8193, test_loss: 1.2627, test_f1: 0.5398
 epoch: 62, train_loss: 0.7969, test_loss: 1.2670, test_f1: 0.4997
 epoch: 63, train_loss: 0.8202, test_loss: 1.2612, test_f1: 0.5224
 epoch: 64, train_loss: 0.8250, test_loss: 1.2538, test_f1: 0.5225
 epoch: 65, train_loss: 0.8219, test_loss: 1.2501, test_f1: 0.5142
 epoch: 66, train_loss: 0.8100, test_loss: 1.2501, test_f1: 0.5242
 epoch: 67, train_loss: 0.8097, test_loss: 1.2252, test_f1: 0.5340
 epoch: 68, train_loss: 0.8049, test_loss: 1.2689, test_f1: 0.5103
 epoch: 69, train_loss: 0.8076, test_loss: 1.2663, test_f1: 0.5532
 epoch: 70, train_loss: 0.7911, test_loss: 1.2551, test_f1: 0.5627
 epoch: 71, train_loss: 0.8012, test_loss: 1.2538, test_f1: 0.5519
 epoch: 72, train_loss: 0.7873, test_loss: 1.2653, test_f1: 0.5267
 epoch: 73, train_loss: 0.7888, test_loss: 1.2648, test_f1: 0.5230
 epoch: 74, train_loss: 0.8090, test_loss: 1.2602, test_f1: 0.5133
 epoch: 75, train_loss: 0.7844, test_loss: 1.2745, test_f1: 0.5424
 epoch: 76, train_loss: 0.7850, test_loss: 1.2668, test_f1: 0.5604
 epoch: 77, train_loss: 0.7827, test_loss: 1.2926, test_f1: 0.5366
 epoch: 78, train_loss: 0.8018, test_loss: 1.2674, test_f1: 0.5554
 epoch: 79, train_loss: 0.8012, test_loss: 1.2864, test_f1: 0.5291
 epoch: 80, train_loss: 0.7868, test_loss: 1.2780, test_f1: 0.5551
 epoch: 81, train_loss: 0.7730, test_loss: 1.2892, test_f1: 0.5210
 epoch: 82, train_loss: 0.7519, test_loss: 1.2515, test_f1: 0.5523
 epoch: 83, train_loss: 0.7783, test_loss: 1.2369, test_f1: 0.5708
 epoch: 84, train_loss: 0.7798, test_loss: 1.2856, test_f1: 0.5501
 epoch: 85, train_loss: 0.7847, test_loss: 1.2864, test_f1: 0.5385
 epoch: 86, train_loss: 0.7684, test_loss: 1.3254, test_f1: 0.5306
 epoch: 87, train_loss: 0.7782, test_loss: 1.3332, test_f1: 0.5120
 epoch: 88, train_loss: 0.7742, test_loss: 1.3111, test_f1: 0.5350
 epoch: 89, train_loss: 0.7759, test_loss: 1.3013, test_f1: 0.5216
 epoch: 90, train_loss: 0.7687, test_loss: 1.2635, test_f1: 0.5497
 epoch: 91, train_loss: 0.7602, test_loss: 1.2782, test_f1: 0.5475
 epoch: 92, train_loss: 0.7602, test_loss: 1.3212, test_f1: 0.5156
 epoch: 93, train_loss: 0.7616, test_loss: 1.3074, test_f1: 0.5497
 epoch: 94, train_loss: 0.7541, test_loss: 1.3094, test_f1: 0.5549
 epoch: 95, train_loss: 0.7735, test_loss: 1.3284, test_f1: 0.5338
 epoch: 96, train_loss: 0.7589, test_loss: 1.3266, test_f1: 0.5419
 epoch: 97, train_loss: 0.7797, test_loss: 1.2952, test_f1: 0.5387
 epoch: 98, train_loss: 0.7532, test_loss: 1.3072, test_f1: 0.5600
 epoch: 99, train_loss: 0.7500, test_loss: 1.3651, test_f1: 0.5520
##################ITERATION #6 ****************************************
 epoch: 0, train_loss: 1.2816, test_loss: 1.3186, test_f1: 0.3596
 epoch: 1, train_loss: 1.2141, test_loss: 1.3061, test_f1: 0.3725
 epoch: 2, train_loss: 1.1858, test_loss: 1.2814, test_f1: 0.3953
 epoch: 3, train_loss: 1.1565, test_loss: 1.2546, test_f1: 0.4305
 epoch: 4, train_loss: 1.1337, test_loss: 1.2393, test_f1: 0.4614
 epoch: 5, train_loss: 1.1109, test_loss: 1.2114, test_f1: 0.4542
 epoch: 6, train_loss: 1.1031, test_loss: 1.2120, test_f1: 0.4866
 epoch: 7, train_loss: 1.0898, test_loss: 1.1915, test_f1: 0.5030
 epoch: 8, train_loss: 1.0802, test_loss: 1.1873, test_f1: 0.4827
 epoch: 9, train_loss: 1.0578, test_loss: 1.1814, test_f1: 0.4967
 epoch: 10, train_loss: 1.0507, test_loss: 1.1857, test_f1: 0.5083
 epoch: 11, train_loss: 1.0370, test_loss: 1.1957, test_f1: 0.5207
 epoch: 12, train_loss: 1.0296, test_loss: 1.2209, test_f1: 0.5175
 epoch: 13, train_loss: 1.0269, test_loss: 1.1879, test_f1: 0.5315
 epoch: 14, train_loss: 1.0215, test_loss: 1.1839, test_f1: 0.5399
 epoch: 15, train_loss: 1.0181, test_loss: 1.1725, test_f1: 0.4938
 epoch: 16, train_loss: 1.0084, test_loss: 1.1735, test_f1: 0.5174
 epoch: 17, train_loss: 0.9886, test_loss: 1.1985, test_f1: 0.4999
 epoch: 18, train_loss: 0.9879, test_loss: 1.1725, test_f1: 0.4853
 epoch: 19, train_loss: 0.9663, test_loss: 1.1454, test_f1: 0.5311
 epoch: 20, train_loss: 0.9716, test_loss: 1.1272, test_f1: 0.5248
 epoch: 21, train_loss: 0.9745, test_loss: 1.1572, test_f1: 0.5107
 epoch: 22, train_loss: 0.9749, test_loss: 1.1466, test_f1: 0.5128
 epoch: 23, train_loss: 0.9650, test_loss: 1.1272, test_f1: 0.5105
 epoch: 24, train_loss: 0.9616, test_loss: 1.1712, test_f1: 0.5207
 epoch: 25, train_loss: 0.9577, test_loss: 1.1616, test_f1: 0.5270
 epoch: 26, train_loss: 0.9521, test_loss: 1.1612, test_f1: 0.5392
 epoch: 27, train_loss: 0.9305, test_loss: 1.1341, test_f1: 0.5280
 epoch: 28, train_loss: 0.9288, test_loss: 1.1132, test_f1: 0.5388
 epoch: 29, train_loss: 0.9122, test_loss: 1.1343, test_f1: 0.5085
 epoch: 30, train_loss: 0.9078, test_loss: 1.1289, test_f1: 0.5297
 epoch: 31, train_loss: 0.9226, test_loss: 1.1115, test_f1: 0.5412
 epoch: 32, train_loss: 0.9102, test_loss: 1.1187, test_f1: 0.5559
 epoch: 33, train_loss: 0.8997, test_loss: 1.1121, test_f1: 0.5419
 epoch: 34, train_loss: 0.9146, test_loss: 1.1118, test_f1: 0.5566
 epoch: 35, train_loss: 0.8929, test_loss: 1.0967, test_f1: 0.5749
 epoch: 36, train_loss: 0.9126, test_loss: 1.1394, test_f1: 0.5662
 epoch: 37, train_loss: 0.8754, test_loss: 1.1282, test_f1: 0.5417
 epoch: 38, train_loss: 0.8894, test_loss: 1.0708, test_f1: 0.5592
 epoch: 39, train_loss: 0.8916, test_loss: 1.0914, test_f1: 0.5751
 epoch: 40, train_loss: 0.8616, test_loss: 1.1059, test_f1: 0.5774
 epoch: 41, train_loss: 0.8655, test_loss: 1.0840, test_f1: 0.5663
 epoch: 42, train_loss: 0.8654, test_loss: 1.1448, test_f1: 0.5555
 epoch: 43, train_loss: 0.8569, test_loss: 1.1725, test_f1: 0.5487
 epoch: 44, train_loss: 0.8576, test_loss: 1.1555, test_f1: 0.5683
 epoch: 45, train_loss: 0.8468, test_loss: 1.1444, test_f1: 0.5708
 epoch: 46, train_loss: 0.8315, test_loss: 1.1159, test_f1: 0.5772
 epoch: 47, train_loss: 0.8551, test_loss: 1.1209, test_f1: 0.5893
 epoch: 48, train_loss: 0.8476, test_loss: 1.1792, test_f1: 0.5403
 epoch: 49, train_loss: 0.8428, test_loss: 1.1554, test_f1: 0.5686
 epoch: 50, train_loss: 0.8354, test_loss: 1.2156, test_f1: 0.5569
 epoch: 51, train_loss: 0.8323, test_loss: 1.2624, test_f1: 0.5619
 epoch: 52, train_loss: 0.8218, test_loss: 1.1335, test_f1: 0.5766
 epoch: 53, train_loss: 0.8209, test_loss: 1.1229, test_f1: 0.5694
 epoch: 54, train_loss: 0.8278, test_loss: 1.1268, test_f1: 0.5764
 epoch: 55, train_loss: 0.8178, test_loss: 1.1134, test_f1: 0.5696
 epoch: 56, train_loss: 0.8131, test_loss: 1.1363, test_f1: 0.5761
 epoch: 57, train_loss: 0.8009, test_loss: 1.1248, test_f1: 0.5897
 epoch: 58, train_loss: 0.8142, test_loss: 1.1375, test_f1: 0.5721
 epoch: 59, train_loss: 0.8248, test_loss: 1.2184, test_f1: 0.5738
 epoch: 60, train_loss: 0.8175, test_loss: 1.1686, test_f1: 0.5739
 epoch: 61, train_loss: 0.8028, test_loss: 1.1469, test_f1: 0.5719
 epoch: 62, train_loss: 0.8118, test_loss: 1.1444, test_f1: 0.5977
 epoch: 63, train_loss: 0.7976, test_loss: 1.1285, test_f1: 0.5794
 epoch: 64, train_loss: 0.8031, test_loss: 1.1328, test_f1: 0.5798
 epoch: 65, train_loss: 0.8016, test_loss: 1.1161, test_f1: 0.5790
 epoch: 66, train_loss: 0.7986, test_loss: 1.1368, test_f1: 0.5844
 epoch: 67, train_loss: 0.7972, test_loss: 1.1538, test_f1: 0.5820
 epoch: 68, train_loss: 0.7856, test_loss: 1.1289, test_f1: 0.5893
 epoch: 69, train_loss: 0.7936, test_loss: 1.1290, test_f1: 0.5795
 epoch: 70, train_loss: 0.8034, test_loss: 1.1421, test_f1: 0.5949
 epoch: 71, train_loss: 0.7849, test_loss: 1.1353, test_f1: 0.5738
 epoch: 72, train_loss: 0.7854, test_loss: 1.1848, test_f1: 0.5773
 epoch: 73, train_loss: 0.7881, test_loss: 1.1453, test_f1: 0.5831
 epoch: 74, train_loss: 0.7720, test_loss: 1.1800, test_f1: 0.5772
 epoch: 75, train_loss: 0.7787, test_loss: 1.1193, test_f1: 0.5742
 epoch: 76, train_loss: 0.7680, test_loss: 1.1604, test_f1: 0.5879
 epoch: 77, train_loss: 0.7916, test_loss: 1.1762, test_f1: 0.5720
 epoch: 78, train_loss: 0.7830, test_loss: 1.1542, test_f1: 0.5941
 epoch: 79, train_loss: 0.7983, test_loss: 1.1858, test_f1: 0.5904
 epoch: 80, train_loss: 0.7725, test_loss: 1.1729, test_f1: 0.5810
 epoch: 81, train_loss: 0.7706, test_loss: 1.2033, test_f1: 0.5833
 epoch: 82, train_loss: 0.7737, test_loss: 1.1753, test_f1: 0.5966
 epoch: 83, train_loss: 0.7842, test_loss: 1.1505, test_f1: 0.5923
 epoch: 84, train_loss: 0.7798, test_loss: 1.1475, test_f1: 0.5953
 epoch: 85, train_loss: 0.7529, test_loss: 1.1819, test_f1: 0.5857
 epoch: 86, train_loss: 0.7464, test_loss: 1.1617, test_f1: 0.5918
 epoch: 87, train_loss: 0.7674, test_loss: 1.2127, test_f1: 0.5865
 epoch: 88, train_loss: 0.7534, test_loss: 1.1674, test_f1: 0.5943
 epoch: 89, train_loss: 0.7573, test_loss: 1.1612, test_f1: 0.5879
 epoch: 90, train_loss: 0.7661, test_loss: 1.2352, test_f1: 0.6056
 epoch: 91, train_loss: 0.7689, test_loss: 1.2048, test_f1: 0.5893
 epoch: 92, train_loss: 0.7584, test_loss: 1.1580, test_f1: 0.5837
 epoch: 93, train_loss: 0.7618, test_loss: 1.2161, test_f1: 0.5872
 epoch: 94, train_loss: 0.7616, test_loss: 1.1770, test_f1: 0.5835
 epoch: 95, train_loss: 0.7512, test_loss: 1.1885, test_f1: 0.5889
 epoch: 96, train_loss: 0.7477, test_loss: 1.1710, test_f1: 0.5862
 epoch: 97, train_loss: 0.7451, test_loss: 1.1692, test_f1: 0.5939
 epoch: 98, train_loss: 0.7396, test_loss: 1.2280, test_f1: 0.5994
 epoch: 99, train_loss: 0.7520, test_loss: 1.1891, test_f1: 0.5953
##################ITERATION #7 ****************************************
 epoch: 0, train_loss: 1.3099, test_loss: 1.3231, test_f1: 0.3507
 epoch: 1, train_loss: 1.2187, test_loss: 1.2805, test_f1: 0.3789
 epoch: 2, train_loss: 1.2027, test_loss: 1.2939, test_f1: 0.4040
 epoch: 3, train_loss: 1.1834, test_loss: 1.2450, test_f1: 0.4562
 epoch: 4, train_loss: 1.1632, test_loss: 1.2215, test_f1: 0.4816
 epoch: 5, train_loss: 1.1450, test_loss: 1.2343, test_f1: 0.4743
 epoch: 6, train_loss: 1.1133, test_loss: 1.1989, test_f1: 0.5128
 epoch: 7, train_loss: 1.1128, test_loss: 1.1883, test_f1: 0.5135
 epoch: 8, train_loss: 1.0864, test_loss: 1.1676, test_f1: 0.5227
 epoch: 9, train_loss: 1.0759, test_loss: 1.1649, test_f1: 0.5280
 epoch: 10, train_loss: 1.0480, test_loss: 1.1492, test_f1: 0.5363
 epoch: 11, train_loss: 1.0440, test_loss: 1.1277, test_f1: 0.5692
 epoch: 12, train_loss: 1.0526, test_loss: 1.1449, test_f1: 0.5577
 epoch: 13, train_loss: 1.0376, test_loss: 1.1431, test_f1: 0.5611
 epoch: 14, train_loss: 1.0285, test_loss: 1.1272, test_f1: 0.5492
 epoch: 15, train_loss: 1.0138, test_loss: 1.1089, test_f1: 0.5504
 epoch: 16, train_loss: 0.9955, test_loss: 1.1076, test_f1: 0.5627
 epoch: 17, train_loss: 1.0081, test_loss: 1.1056, test_f1: 0.5615
 epoch: 18, train_loss: 0.9989, test_loss: 1.1043, test_f1: 0.5422
 epoch: 19, train_loss: 0.9772, test_loss: 1.0948, test_f1: 0.5688
 epoch: 20, train_loss: 0.9572, test_loss: 1.1043, test_f1: 0.5563
 epoch: 21, train_loss: 0.9552, test_loss: 1.0919, test_f1: 0.5713
 epoch: 22, train_loss: 0.9676, test_loss: 1.0800, test_f1: 0.5653
 epoch: 23, train_loss: 0.9552, test_loss: 1.0647, test_f1: 0.5660
 epoch: 24, train_loss: 0.9323, test_loss: 1.0822, test_f1: 0.5614
 epoch: 25, train_loss: 0.9532, test_loss: 1.0679, test_f1: 0.5894
 epoch: 26, train_loss: 0.9265, test_loss: 1.0784, test_f1: 0.5787
 epoch: 27, train_loss: 0.9216, test_loss: 1.0695, test_f1: 0.5737
 epoch: 28, train_loss: 0.9171, test_loss: 1.0620, test_f1: 0.5784
 epoch: 29, train_loss: 0.9133, test_loss: 1.0695, test_f1: 0.5554
 epoch: 30, train_loss: 0.9060, test_loss: 1.0525, test_f1: 0.5815
 epoch: 31, train_loss: 0.9122, test_loss: 1.0747, test_f1: 0.5759
 epoch: 32, train_loss: 0.8842, test_loss: 1.0562, test_f1: 0.5736
 epoch: 33, train_loss: 0.8804, test_loss: 1.0650, test_f1: 0.5746
 epoch: 34, train_loss: 0.8832, test_loss: 1.0699, test_f1: 0.5687
 epoch: 35, train_loss: 0.8702, test_loss: 1.0738, test_f1: 0.5842
 epoch: 36, train_loss: 0.8706, test_loss: 1.0733, test_f1: 0.5754
 epoch: 37, train_loss: 0.8682, test_loss: 1.0584, test_f1: 0.6017
 epoch: 38, train_loss: 0.8546, test_loss: 1.0499, test_f1: 0.5964
 epoch: 39, train_loss: 0.8621, test_loss: 1.0951, test_f1: 0.6187
 epoch: 40, train_loss: 0.8556, test_loss: 1.0511, test_f1: 0.6257
 epoch: 41, train_loss: 0.8602, test_loss: 1.0740, test_f1: 0.6259
 epoch: 42, train_loss: 0.8446, test_loss: 1.0641, test_f1: 0.6132
 epoch: 43, train_loss: 0.8344, test_loss: 1.0974, test_f1: 0.6082
 epoch: 44, train_loss: 0.8234, test_loss: 1.0721, test_f1: 0.6076
 epoch: 45, train_loss: 0.8119, test_loss: 1.0991, test_f1: 0.6019
 epoch: 46, train_loss: 0.8186, test_loss: 1.0733, test_f1: 0.6124
 epoch: 47, train_loss: 0.8235, test_loss: 1.1312, test_f1: 0.5959
 epoch: 48, train_loss: 0.8083, test_loss: 1.0783, test_f1: 0.6165
 epoch: 49, train_loss: 0.7893, test_loss: 1.1033, test_f1: 0.6078
 epoch: 50, train_loss: 0.7974, test_loss: 1.0916, test_f1: 0.5769
 epoch: 51, train_loss: 0.7813, test_loss: 1.0781, test_f1: 0.5949
 epoch: 52, train_loss: 0.7869, test_loss: 1.0777, test_f1: 0.5614
 epoch: 53, train_loss: 0.7873, test_loss: 1.0836, test_f1: 0.5850
 epoch: 54, train_loss: 0.7891, test_loss: 1.1032, test_f1: 0.5873
 epoch: 55, train_loss: 0.7847, test_loss: 1.0910, test_f1: 0.5955
 epoch: 56, train_loss: 0.7823, test_loss: 1.1479, test_f1: 0.5756
 epoch: 57, train_loss: 0.7782, test_loss: 1.1409, test_f1: 0.5881
 epoch: 58, train_loss: 0.7836, test_loss: 1.1082, test_f1: 0.5645
 epoch: 59, train_loss: 0.7733, test_loss: 1.1418, test_f1: 0.5782
 epoch: 60, train_loss: 0.7870, test_loss: 1.1150, test_f1: 0.5950
 epoch: 61, train_loss: 0.7742, test_loss: 1.1392, test_f1: 0.5892
 epoch: 62, train_loss: 0.7700, test_loss: 1.1567, test_f1: 0.5980
 epoch: 63, train_loss: 0.7660, test_loss: 1.1281, test_f1: 0.5824
 epoch: 64, train_loss: 0.7596, test_loss: 1.1313, test_f1: 0.6056
 epoch: 65, train_loss: 0.7766, test_loss: 1.1784, test_f1: 0.5784
 epoch: 66, train_loss: 0.7540, test_loss: 1.1380, test_f1: 0.5691
 epoch: 67, train_loss: 0.7599, test_loss: 1.1370, test_f1: 0.5727
 epoch: 68, train_loss: 0.7585, test_loss: 1.1497, test_f1: 0.5652
 epoch: 69, train_loss: 0.7492, test_loss: 1.1655, test_f1: 0.5517
 epoch: 70, train_loss: 0.7397, test_loss: 1.1660, test_f1: 0.5889
 epoch: 71, train_loss: 0.7527, test_loss: 1.1681, test_f1: 0.5618
 epoch: 72, train_loss: 0.7435, test_loss: 1.1701, test_f1: 0.5807
 epoch: 73, train_loss: 0.7587, test_loss: 1.1576, test_f1: 0.5810
 epoch: 74, train_loss: 0.7501, test_loss: 1.1813, test_f1: 0.5759
 epoch: 75, train_loss: 0.7291, test_loss: 1.1595, test_f1: 0.5518
 epoch: 76, train_loss: 0.7535, test_loss: 1.1595, test_f1: 0.5722
 epoch: 77, train_loss: 0.7291, test_loss: 1.1624, test_f1: 0.5645
 epoch: 78, train_loss: 0.7393, test_loss: 1.2225, test_f1: 0.5646
 epoch: 79, train_loss: 0.7381, test_loss: 1.2545, test_f1: 0.5626
 epoch: 80, train_loss: 0.7339, test_loss: 1.2428, test_f1: 0.5367
 epoch: 81, train_loss: 0.7232, test_loss: 1.2244, test_f1: 0.5647
 epoch: 82, train_loss: 0.7279, test_loss: 1.2002, test_f1: 0.5518
 epoch: 83, train_loss: 0.7321, test_loss: 1.1911, test_f1: 0.5417
 epoch: 84, train_loss: 0.7160, test_loss: 1.1858, test_f1: 0.5807
 epoch: 85, train_loss: 0.7357, test_loss: 1.2160, test_f1: 0.5590
 epoch: 86, train_loss: 0.7210, test_loss: 1.1912, test_f1: 0.5565
 epoch: 87, train_loss: 0.7138, test_loss: 1.2556, test_f1: 0.5570
 epoch: 88, train_loss: 0.7281, test_loss: 1.2360, test_f1: 0.5389
 epoch: 89, train_loss: 0.7123, test_loss: 1.2442, test_f1: 0.5799
 epoch: 90, train_loss: 0.7148, test_loss: 1.2488, test_f1: 0.5588
 epoch: 91, train_loss: 0.7079, test_loss: 1.2547, test_f1: 0.5614
 epoch: 92, train_loss: 0.7054, test_loss: 1.2864, test_f1: 0.5719
 epoch: 93, train_loss: 0.7083, test_loss: 1.2606, test_f1: 0.5753
 epoch: 94, train_loss: 0.7234, test_loss: 1.2564, test_f1: 0.5623
 epoch: 95, train_loss: 0.7048, test_loss: 1.2600, test_f1: 0.5739
 epoch: 96, train_loss: 0.7100, test_loss: 1.2801, test_f1: 0.5762
 epoch: 97, train_loss: 0.7109, test_loss: 1.3077, test_f1: 0.5651
 epoch: 98, train_loss: 0.7063, test_loss: 1.3024, test_f1: 0.5750
 epoch: 99, train_loss: 0.6795, test_loss: 1.2695, test_f1: 0.5771
##################ITERATION #8 ****************************************
 epoch: 0, train_loss: 1.3017, test_loss: 1.3060, test_f1: 0.3538
 epoch: 1, train_loss: 1.2249, test_loss: 1.2695, test_f1: 0.4215
 epoch: 2, train_loss: 1.2050, test_loss: 1.2700, test_f1: 0.4389
 epoch: 3, train_loss: 1.1696, test_loss: 1.2534, test_f1: 0.4507
 epoch: 4, train_loss: 1.1473, test_loss: 1.2497, test_f1: 0.4627
 epoch: 5, train_loss: 1.1369, test_loss: 1.2110, test_f1: 0.4509
 epoch: 6, train_loss: 1.1199, test_loss: 1.1996, test_f1: 0.4857
 epoch: 7, train_loss: 1.1144, test_loss: 1.2008, test_f1: 0.4958
 epoch: 8, train_loss: 1.0999, test_loss: 1.1886, test_f1: 0.4924
 epoch: 9, train_loss: 1.0778, test_loss: 1.1970, test_f1: 0.5050
 epoch: 10, train_loss: 1.0723, test_loss: 1.1792, test_f1: 0.5161
 epoch: 11, train_loss: 1.0519, test_loss: 1.1911, test_f1: 0.4992
 epoch: 12, train_loss: 1.0632, test_loss: 1.1925, test_f1: 0.5307
 epoch: 13, train_loss: 1.0421, test_loss: 1.2150, test_f1: 0.5007
 epoch: 14, train_loss: 1.0432, test_loss: 1.1952, test_f1: 0.5376
 epoch: 15, train_loss: 1.0381, test_loss: 1.2081, test_f1: 0.5265
 epoch: 16, train_loss: 1.0442, test_loss: 1.2298, test_f1: 0.5500
 epoch: 17, train_loss: 1.0069, test_loss: 1.2260, test_f1: 0.5347
 epoch: 18, train_loss: 1.0209, test_loss: 1.2052, test_f1: 0.5585
 epoch: 19, train_loss: 1.0045, test_loss: 1.2014, test_f1: 0.5341
 epoch: 20, train_loss: 0.9902, test_loss: 1.2112, test_f1: 0.5401
 epoch: 21, train_loss: 0.9907, test_loss: 1.2227, test_f1: 0.5152
 epoch: 22, train_loss: 0.9671, test_loss: 1.2273, test_f1: 0.5427
 epoch: 23, train_loss: 0.9616, test_loss: 1.2010, test_f1: 0.5324
 epoch: 24, train_loss: 0.9913, test_loss: 1.2034, test_f1: 0.5534
 epoch: 25, train_loss: 0.9478, test_loss: 1.2227, test_f1: 0.5312
 epoch: 26, train_loss: 0.9594, test_loss: 1.2331, test_f1: 0.5152
 epoch: 27, train_loss: 0.9589, test_loss: 1.2150, test_f1: 0.5288
 epoch: 28, train_loss: 0.9502, test_loss: 1.2527, test_f1: 0.5107
 epoch: 29, train_loss: 0.9410, test_loss: 1.2216, test_f1: 0.5593
 epoch: 30, train_loss: 0.9446, test_loss: 1.2492, test_f1: 0.5297
 epoch: 31, train_loss: 0.9409, test_loss: 1.2590, test_f1: 0.5340
 epoch: 32, train_loss: 0.9394, test_loss: 1.2547, test_f1: 0.5528
 epoch: 33, train_loss: 0.9203, test_loss: 1.2491, test_f1: 0.5445
 epoch: 34, train_loss: 0.9149, test_loss: 1.2570, test_f1: 0.5484
 epoch: 35, train_loss: 0.9191, test_loss: 1.2711, test_f1: 0.5435
 epoch: 36, train_loss: 0.9069, test_loss: 1.2827, test_f1: 0.5460
 epoch: 37, train_loss: 0.9066, test_loss: 1.2928, test_f1: 0.5164
 epoch: 38, train_loss: 0.8991, test_loss: 1.3015, test_f1: 0.5214
 epoch: 39, train_loss: 0.9023, test_loss: 1.3011, test_f1: 0.5244
 epoch: 40, train_loss: 0.8958, test_loss: 1.2905, test_f1: 0.5186
 epoch: 41, train_loss: 0.8884, test_loss: 1.3453, test_f1: 0.5221
 epoch: 42, train_loss: 0.9028, test_loss: 1.3142, test_f1: 0.5207
 epoch: 43, train_loss: 0.8955, test_loss: 1.3588, test_f1: 0.5245
 epoch: 44, train_loss: 0.8636, test_loss: 1.3122, test_f1: 0.5237
 epoch: 45, train_loss: 0.8731, test_loss: 1.3396, test_f1: 0.5419
 epoch: 46, train_loss: 0.8614, test_loss: 1.3361, test_f1: 0.5241
 epoch: 47, train_loss: 0.8706, test_loss: 1.3029, test_f1: 0.5345
 epoch: 48, train_loss: 0.8530, test_loss: 1.2911, test_f1: 0.5495
 epoch: 49, train_loss: 0.8738, test_loss: 1.2867, test_f1: 0.5412
 epoch: 50, train_loss: 0.8466, test_loss: 1.3462, test_f1: 0.5218
 epoch: 51, train_loss: 0.8494, test_loss: 1.3518, test_f1: 0.5363
 epoch: 52, train_loss: 0.8596, test_loss: 1.3508, test_f1: 0.5406
 epoch: 53, train_loss: 0.8397, test_loss: 1.3609, test_f1: 0.5437
 epoch: 54, train_loss: 0.8484, test_loss: 1.3874, test_f1: 0.5623
 epoch: 55, train_loss: 0.8525, test_loss: 1.3825, test_f1: 0.5512
 epoch: 56, train_loss: 0.8448, test_loss: 1.3456, test_f1: 0.5585
 epoch: 57, train_loss: 0.8454, test_loss: 1.3847, test_f1: 0.5396
 epoch: 58, train_loss: 0.8593, test_loss: 1.3814, test_f1: 0.5552
 epoch: 59, train_loss: 0.8465, test_loss: 1.4052, test_f1: 0.5644
 epoch: 60, train_loss: 0.8427, test_loss: 1.4102, test_f1: 0.5527
 epoch: 61, train_loss: 0.8278, test_loss: 1.4171, test_f1: 0.5373
 epoch: 62, train_loss: 0.8268, test_loss: 1.4207, test_f1: 0.5524
 epoch: 63, train_loss: 0.8275, test_loss: 1.3591, test_f1: 0.5599
 epoch: 64, train_loss: 0.8399, test_loss: 1.3949, test_f1: 0.5549
 epoch: 65, train_loss: 0.8178, test_loss: 1.3807, test_f1: 0.5420
 epoch: 66, train_loss: 0.8161, test_loss: 1.3972, test_f1: 0.5451
 epoch: 67, train_loss: 0.8242, test_loss: 1.3936, test_f1: 0.5091
 epoch: 68, train_loss: 0.8254, test_loss: 1.3833, test_f1: 0.5425
 epoch: 69, train_loss: 0.8434, test_loss: 1.3873, test_f1: 0.5447
 epoch: 70, train_loss: 0.8136, test_loss: 1.3600, test_f1: 0.5483
 epoch: 71, train_loss: 0.8270, test_loss: 1.4272, test_f1: 0.5604
 epoch: 72, train_loss: 0.8120, test_loss: 1.3860, test_f1: 0.5477
 epoch: 73, train_loss: 0.8163, test_loss: 1.4073, test_f1: 0.5373
 epoch: 74, train_loss: 0.8219, test_loss: 1.4033, test_f1: 0.5446
 epoch: 75, train_loss: 0.8247, test_loss: 1.3963, test_f1: 0.5420
 epoch: 76, train_loss: 0.8120, test_loss: 1.4157, test_f1: 0.5374
 epoch: 77, train_loss: 0.8056, test_loss: 1.4344, test_f1: 0.5328
 epoch: 78, train_loss: 0.8195, test_loss: 1.4040, test_f1: 0.5384
 epoch: 79, train_loss: 0.8084, test_loss: 1.3760, test_f1: 0.5342
 epoch: 80, train_loss: 0.8001, test_loss: 1.4177, test_f1: 0.5496
 epoch: 81, train_loss: 0.7987, test_loss: 1.4438, test_f1: 0.5578
 epoch: 82, train_loss: 0.7970, test_loss: 1.4943, test_f1: 0.5284
 epoch: 83, train_loss: 0.8059, test_loss: 1.4555, test_f1: 0.5683
 epoch: 84, train_loss: 0.8219, test_loss: 1.4242, test_f1: 0.5468
 epoch: 85, train_loss: 0.8104, test_loss: 1.4044, test_f1: 0.5445
 epoch: 86, train_loss: 0.8004, test_loss: 1.4025, test_f1: 0.5322
 epoch: 87, train_loss: 0.7963, test_loss: 1.4837, test_f1: 0.5226
 epoch: 88, train_loss: 0.7830, test_loss: 1.4121, test_f1: 0.5500
 epoch: 89, train_loss: 0.7920, test_loss: 1.4593, test_f1: 0.5389
 epoch: 90, train_loss: 0.7828, test_loss: 1.4959, test_f1: 0.5332
 epoch: 91, train_loss: 0.7884, test_loss: 1.4768, test_f1: 0.5454
 epoch: 92, train_loss: 0.7852, test_loss: 1.4829, test_f1: 0.5353
 epoch: 93, train_loss: 0.7795, test_loss: 1.4646, test_f1: 0.5471
 epoch: 94, train_loss: 0.8103, test_loss: 1.4664, test_f1: 0.5184
 epoch: 95, train_loss: 0.7840, test_loss: 1.5113, test_f1: 0.5400
 epoch: 96, train_loss: 0.7898, test_loss: 1.4820, test_f1: 0.5562
 epoch: 97, train_loss: 0.7707, test_loss: 1.4559, test_f1: 0.5526
 epoch: 98, train_loss: 0.7878, test_loss: 1.4384, test_f1: 0.5506
 epoch: 99, train_loss: 0.7886, test_loss: 1.5074, test_f1: 0.5528
##################ITERATION #9 ****************************************
 epoch: 0, train_loss: 1.3188, test_loss: 1.3107, test_f1: 0.3514
 epoch: 1, train_loss: 1.2291, test_loss: 1.2761, test_f1: 0.3833
 epoch: 2, train_loss: 1.1915, test_loss: 1.2602, test_f1: 0.3935
 epoch: 3, train_loss: 1.1771, test_loss: 1.2438, test_f1: 0.4594
 epoch: 4, train_loss: 1.1493, test_loss: 1.5140, test_f1: 0.4668
 epoch: 5, train_loss: 1.1310, test_loss: 1.8778, test_f1: 0.5003
 epoch: 6, train_loss: 1.0995, test_loss: 1.3024, test_f1: 0.4926
 epoch: 7, train_loss: 1.0991, test_loss: 1.4955, test_f1: 0.5230
 epoch: 8, train_loss: 1.0769, test_loss: 1.4502, test_f1: 0.5374
 epoch: 9, train_loss: 1.0634, test_loss: 1.4132, test_f1: 0.5429
 epoch: 10, train_loss: 1.0524, test_loss: 1.4364, test_f1: 0.5489
 epoch: 11, train_loss: 1.0651, test_loss: 1.1612, test_f1: 0.5861
 epoch: 12, train_loss: 1.0510, test_loss: 1.2855, test_f1: 0.5269
 epoch: 13, train_loss: 1.0548, test_loss: 1.4223, test_f1: 0.5373
 epoch: 14, train_loss: 1.0130, test_loss: 1.6113, test_f1: 0.5431
 epoch: 15, train_loss: 0.9960, test_loss: 1.4997, test_f1: 0.5439
 epoch: 16, train_loss: 0.9965, test_loss: 1.2153, test_f1: 0.5355
 epoch: 17, train_loss: 0.9985, test_loss: 1.1695, test_f1: 0.5401
 epoch: 18, train_loss: 0.9955, test_loss: 1.3006, test_f1: 0.5471
 epoch: 19, train_loss: 0.9882, test_loss: 1.2784, test_f1: 0.5634
 epoch: 20, train_loss: 0.9845, test_loss: 1.1753, test_f1: 0.5563
 epoch: 21, train_loss: 0.9806, test_loss: 1.1762, test_f1: 0.5110
 epoch: 22, train_loss: 0.9679, test_loss: 1.4777, test_f1: 0.5574
 epoch: 23, train_loss: 0.9593, test_loss: 1.3110, test_f1: 0.5674
 epoch: 24, train_loss: 0.9510, test_loss: 1.5323, test_f1: 0.5302
 epoch: 25, train_loss: 0.9480, test_loss: 1.5386, test_f1: 0.5391
 epoch: 26, train_loss: 0.9306, test_loss: 1.2691, test_f1: 0.5510
 epoch: 27, train_loss: 0.9215, test_loss: 1.4798, test_f1: 0.5471
 epoch: 28, train_loss: 0.9173, test_loss: 1.5534, test_f1: 0.5243
 epoch: 29, train_loss: 0.9142, test_loss: 1.5485, test_f1: 0.5614
 epoch: 30, train_loss: 0.9276, test_loss: 1.3928, test_f1: 0.5534
 epoch: 31, train_loss: 0.9197, test_loss: 1.3514, test_f1: 0.5206
 epoch: 32, train_loss: 0.9054, test_loss: 2.1609, test_f1: 0.5179
 epoch: 33, train_loss: 0.8851, test_loss: 1.3960, test_f1: 0.5631
 epoch: 34, train_loss: 0.8614, test_loss: 1.6290, test_f1: 0.5418
 epoch: 35, train_loss: 0.8873, test_loss: 1.6595, test_f1: 0.5177
 epoch: 36, train_loss: 0.8877, test_loss: 1.3062, test_f1: 0.5589
 epoch: 37, train_loss: 0.8838, test_loss: 1.2619, test_f1: 0.5344
 epoch: 38, train_loss: 0.8840, test_loss: 1.2520, test_f1: 0.5551
 epoch: 39, train_loss: 0.8662, test_loss: 1.6992, test_f1: 0.5292
 epoch: 40, train_loss: 0.8647, test_loss: 1.5460, test_f1: 0.5275
 epoch: 41, train_loss: 0.8686, test_loss: 2.1469, test_f1: 0.5112
 epoch: 42, train_loss: 0.8459, test_loss: 1.7555, test_f1: 0.5140
 epoch: 43, train_loss: 0.8610, test_loss: 1.8610, test_f1: 0.5326
 epoch: 44, train_loss: 0.8522, test_loss: 1.6262, test_f1: 0.5195
 epoch: 45, train_loss: 0.8445, test_loss: 1.6080, test_f1: 0.5187
 epoch: 46, train_loss: 0.8199, test_loss: 1.8386, test_f1: 0.5593
 epoch: 47, train_loss: 0.8366, test_loss: 1.6775, test_f1: 0.5415
 epoch: 48, train_loss: 0.8300, test_loss: 1.4694, test_f1: 0.5406
 epoch: 49, train_loss: 0.8186, test_loss: 1.7863, test_f1: 0.5512
 epoch: 50, train_loss: 0.8300, test_loss: 1.4420, test_f1: 0.5461
 epoch: 51, train_loss: 0.8095, test_loss: 1.4945, test_f1: 0.5375
 epoch: 52, train_loss: 0.8062, test_loss: 1.4484, test_f1: 0.5538
 epoch: 53, train_loss: 0.7910, test_loss: 1.6991, test_f1: 0.5452
 epoch: 54, train_loss: 0.8144, test_loss: 1.4452, test_f1: 0.5257
 epoch: 55, train_loss: 0.8086, test_loss: 1.3766, test_f1: 0.5429
 epoch: 56, train_loss: 0.7891, test_loss: 1.7540, test_f1: 0.5607
 epoch: 57, train_loss: 0.7948, test_loss: 1.9959, test_f1: 0.5340
 epoch: 58, train_loss: 0.7779, test_loss: 1.9389, test_f1: 0.5185
 epoch: 59, train_loss: 0.7941, test_loss: 1.5387, test_f1: 0.5395
 epoch: 60, train_loss: 0.8052, test_loss: 1.4590, test_f1: 0.5503
 epoch: 61, train_loss: 0.7917, test_loss: 1.6849, test_f1: 0.5534
 epoch: 62, train_loss: 0.7823, test_loss: 2.1303, test_f1: 0.5505
 epoch: 63, train_loss: 0.7982, test_loss: 1.3414, test_f1: 0.5671
 epoch: 64, train_loss: 0.7894, test_loss: 1.4921, test_f1: 0.5297
 epoch: 65, train_loss: 0.7799, test_loss: 1.7397, test_f1: 0.5652
 epoch: 66, train_loss: 0.7747, test_loss: 1.5777, test_f1: 0.5504
 epoch: 67, train_loss: 0.7621, test_loss: 1.7852, test_f1: 0.5407
 epoch: 68, train_loss: 0.7937, test_loss: 1.9261, test_f1: 0.5400
 epoch: 69, train_loss: 0.7878, test_loss: 1.4329, test_f1: 0.5265
 epoch: 70, train_loss: 0.7846, test_loss: 2.2778, test_f1: 0.5570
 epoch: 71, train_loss: 0.7629, test_loss: 1.6327, test_f1: 0.5620
 epoch: 72, train_loss: 0.7828, test_loss: 2.1063, test_f1: 0.5649
 epoch: 73, train_loss: 0.7804, test_loss: 1.8366, test_f1: 0.5454
 epoch: 74, train_loss: 0.7644, test_loss: 1.7307, test_f1: 0.5434
 epoch: 75, train_loss: 0.7607, test_loss: 2.2236, test_f1: 0.5321
 epoch: 76, train_loss: 0.7693, test_loss: 2.4951, test_f1: 0.5326
 epoch: 77, train_loss: 0.7604, test_loss: 1.7310, test_f1: 0.5422
 epoch: 78, train_loss: 0.7530, test_loss: 1.7921, test_f1: 0.5344
 epoch: 79, train_loss: 0.7483, test_loss: 2.5266, test_f1: 0.5278
 epoch: 80, train_loss: 0.7576, test_loss: 1.8375, test_f1: 0.5532
 epoch: 81, train_loss: 0.7606, test_loss: 1.9727, test_f1: 0.5436
 epoch: 82, train_loss: 0.7581, test_loss: 1.7645, test_f1: 0.5606
 epoch: 83, train_loss: 0.7621, test_loss: 2.2056, test_f1: 0.5666
 epoch: 84, train_loss: 0.7510, test_loss: 1.7610, test_f1: 0.5433
 epoch: 85, train_loss: 0.7490, test_loss: 2.1297, test_f1: 0.5576
 epoch: 86, train_loss: 0.7619, test_loss: 1.7629, test_f1: 0.5377
 epoch: 87, train_loss: 0.7502, test_loss: 1.8495, test_f1: 0.5617
 epoch: 88, train_loss: 0.7488, test_loss: 2.4521, test_f1: 0.5621
 epoch: 89, train_loss: 0.7468, test_loss: 2.0128, test_f1: 0.5470
 epoch: 90, train_loss: 0.7529, test_loss: 1.9450, test_f1: 0.5329
 epoch: 91, train_loss: 0.7362, test_loss: 2.1688, test_f1: 0.5603
 epoch: 92, train_loss: 0.7525, test_loss: 2.1921, test_f1: 0.5662
 epoch: 93, train_loss: 0.7306, test_loss: 1.8320, test_f1: 0.5725
 epoch: 94, train_loss: 0.7378, test_loss: 1.6780, test_f1: 0.5678
 epoch: 95, train_loss: 0.7366, test_loss: 1.8972, test_f1: 0.5600
 epoch: 96, train_loss: 0.7396, test_loss: 1.4553, test_f1: 0.5490
 epoch: 97, train_loss: 0.7435, test_loss: 1.8693, test_f1: 0.5459
 epoch: 98, train_loss: 0.7399, test_loss: 2.0145, test_f1: 0.5568
 epoch: 99, train_loss: 0.7164, test_loss: 1.5752, test_f1: 0.5488

Training completed in 501.98 seconds
Best F1: 0.6259 at epoch 41
Mean F1 across iterations: 0.5837  0.0204
========================FINAL RESULTS================================
FEGIN weighted F1: 0.6259  0.0204
python main.py --data ltspice_demos --representation component_component --model FEGIN --layers 2 --hiddens 64 --batch_size 32 --lr 0.0001 --emb_size 128 --epochs 100 --save_appendix component_component_L2_H64_BS32_LR0.0001_E128 --no_val
-----



STDERR:
  File "main.py", line 370, in <module>
    main()
  File "main.py", line 254, in main
    dataset = dataset_class(
  File "/home/philip/projects/ltspice_examples_code_repo/Circuit-Completion-Using-GNNs/component_classification_with_link_prediction_head/evaluation/FEGIN/kernel/circuit_datasets.py", line 15, in __init__
    self.data, self.slices = torch.load(self.processed_paths[0])
  File "/home/philip/.local/lib/python3.8/site-packages/torch/serialization.py", line 1040, in load
    warnings.warn(
  File "/usr/lib/python3.8/warnings.py", line 109, in _showwarnmsg
    sw(msg.message, msg.category, msg.filename, msg.lineno,
  File "main.py", line 47, in warn_with_traceback
    traceback.print_stack(file=log)
/home/philip/projects/ltspice_examples_code_repo/Circuit-Completion-Using-GNNs/component_classification_with_link_prediction_head/evaluation/FEGIN/kernel/circuit_datasets.py:15: FutureWarning: You are using `torch.load` with `weights_only=False` (the current default value), which uses the default pickle module implicitly. It is possible to construct malicious pickle data which will execute arbitrary code during unpickling (See https://github.com/pytorch/pytorch/blob/main/SECURITY.md#untrusted-models for more details). In a future release, the default value for `weights_only` will be flipped to `True`. This limits the functions that could be executed during unpickling. Arbitrary objects will no longer be allowed to be loaded via this mode unless they are explicitly allowlisted by the user via `torch.serialization.add_safe_globals`. We recommend you start setting `weights_only=True` for any use case where you don't have full control of the loaded file. Please open an issue on GitHub for any issues related to this experimental feature.
  self.data, self.slices = torch.load(self.processed_paths[0])
