STDOUT:
Results will be saved in /home/philip/projects/llm_inference_code_repo/Circuit-Completion-Using-GNNs/component_classification_with_link_prediction_head/evaluation/FEGIN/results/model_FEGIN_dataset_ltspice_examples
Command line input: python main.py --data ltspice_examples --representation component_net --model FEGIN --layers 3 --hiddens 16 --batch_size 256 --lr 0.01 --emb_size 250 --epochs 100 --save_appendix component_net_L3_H16_BS256_LR0.01_E250 --no_val
 is saved.
-----
ltspice_examples - FEGIN
Using 3 layers, 16 hidden units, h = 2
Loading component_net representation dataset
ENTERED
Training FEGIN on component_net representation
Train: 3558, Test: 846
##################ITERATION #0 ****************************************
 epoch: 0, train_loss: 1.2914, test_loss: 1.3159, test_f1: 0.2392
 epoch: 1, train_loss: 1.2138, test_loss: 1.2654, test_f1: 0.2270
 epoch: 2, train_loss: 1.1835, test_loss: 1.1700, test_f1: 0.2464
 epoch: 3, train_loss: 1.1380, test_loss: 1.1010, test_f1: 0.4164
 epoch: 4, train_loss: 1.0885, test_loss: 1.0157, test_f1: 0.4677
 epoch: 5, train_loss: 1.0438, test_loss: 1.0179, test_f1: 0.4768
 epoch: 6, train_loss: 1.0088, test_loss: 0.9970, test_f1: 0.5291
 epoch: 7, train_loss: 0.9764, test_loss: 0.9584, test_f1: 0.5071
 epoch: 8, train_loss: 0.9685, test_loss: 0.9418, test_f1: 0.5136
 epoch: 9, train_loss: 0.9623, test_loss: 0.9630, test_f1: 0.4800
 epoch: 10, train_loss: 0.9465, test_loss: 0.9479, test_f1: 0.5440
 epoch: 11, train_loss: 0.9253, test_loss: 1.0255, test_f1: 0.4886
 epoch: 12, train_loss: 0.9131, test_loss: 1.0860, test_f1: 0.4550
 epoch: 13, train_loss: 0.9115, test_loss: 0.9757, test_f1: 0.4823
 epoch: 14, train_loss: 0.9329, test_loss: 0.9274, test_f1: 0.5233
 epoch: 15, train_loss: 0.9271, test_loss: 1.0238, test_f1: 0.4903
 epoch: 16, train_loss: 0.9120, test_loss: 0.9097, test_f1: 0.5262
 epoch: 17, train_loss: 0.9048, test_loss: 0.9537, test_f1: 0.5270
 epoch: 18, train_loss: 0.9197, test_loss: 0.8931, test_f1: 0.5264
 epoch: 19, train_loss: 0.9041, test_loss: 0.9487, test_f1: 0.4859
 epoch: 20, train_loss: 0.8888, test_loss: 0.9809, test_f1: 0.5355
 epoch: 21, train_loss: 0.8808, test_loss: 1.0239, test_f1: 0.5563
 epoch: 22, train_loss: 0.8757, test_loss: 1.0816, test_f1: 0.4929
 epoch: 23, train_loss: 0.8805, test_loss: 0.9989, test_f1: 0.5052
 epoch: 24, train_loss: 0.8694, test_loss: 0.9427, test_f1: 0.5105
 epoch: 25, train_loss: 0.8657, test_loss: 1.0114, test_f1: 0.5510
 epoch: 26, train_loss: 0.8514, test_loss: 1.0916, test_f1: 0.5078
 epoch: 27, train_loss: 0.8711, test_loss: 1.0422, test_f1: 0.5261
 epoch: 28, train_loss: 0.8586, test_loss: 1.0145, test_f1: 0.5107
 epoch: 29, train_loss: 0.8578, test_loss: 1.0468, test_f1: 0.4953
 epoch: 30, train_loss: 0.8547, test_loss: 1.0587, test_f1: 0.5029
 epoch: 31, train_loss: 0.8451, test_loss: 1.0311, test_f1: 0.5164
 epoch: 32, train_loss: 0.8534, test_loss: 1.0747, test_f1: 0.4988
 epoch: 33, train_loss: 0.8285, test_loss: 1.1017, test_f1: 0.4804
 epoch: 34, train_loss: 0.8303, test_loss: 1.0980, test_f1: 0.5242
 epoch: 35, train_loss: 0.8328, test_loss: 1.2855, test_f1: 0.5080
 epoch: 36, train_loss: 0.8333, test_loss: 1.3422, test_f1: 0.4715
 epoch: 37, train_loss: 0.8312, test_loss: 1.0979, test_f1: 0.5245
 epoch: 38, train_loss: 0.8306, test_loss: 1.1699, test_f1: 0.4994
 epoch: 39, train_loss: 0.8404, test_loss: 1.0723, test_f1: 0.5813
 epoch: 40, train_loss: 0.8285, test_loss: 1.0091, test_f1: 0.5552
 epoch: 41, train_loss: 0.8110, test_loss: 0.9850, test_f1: 0.5612
 epoch: 42, train_loss: 0.8225, test_loss: 1.1637, test_f1: 0.5108
 epoch: 43, train_loss: 0.8015, test_loss: 0.9885, test_f1: 0.5437
 epoch: 44, train_loss: 0.8053, test_loss: 1.0856, test_f1: 0.5152
 epoch: 45, train_loss: 0.8154, test_loss: 1.0722, test_f1: 0.5707
 epoch: 46, train_loss: 0.8109, test_loss: 1.1093, test_f1: 0.5467
 epoch: 47, train_loss: 0.7941, test_loss: 0.9446, test_f1: 0.5312
 epoch: 48, train_loss: 0.7957, test_loss: 1.1708, test_f1: 0.5327
 epoch: 49, train_loss: 0.8086, test_loss: 1.2024, test_f1: 0.5593
 epoch: 50, train_loss: 0.8004, test_loss: 1.3026, test_f1: 0.5307
 epoch: 51, train_loss: 0.7743, test_loss: 1.1560, test_f1: 0.5518
 epoch: 52, train_loss: 0.7845, test_loss: 1.2060, test_f1: 0.5366
 epoch: 53, train_loss: 0.7775, test_loss: 1.1570, test_f1: 0.5432
 epoch: 54, train_loss: 0.7711, test_loss: 1.1391, test_f1: 0.5336
 epoch: 55, train_loss: 0.7714, test_loss: 1.2380, test_f1: 0.5259
 epoch: 56, train_loss: 0.7613, test_loss: 1.2015, test_f1: 0.5472
 epoch: 57, train_loss: 0.7518, test_loss: 1.2318, test_f1: 0.5352
 epoch: 58, train_loss: 0.7604, test_loss: 1.2773, test_f1: 0.5544
 epoch: 59, train_loss: 0.7652, test_loss: 1.1102, test_f1: 0.5529
 epoch: 60, train_loss: 0.7587, test_loss: 1.2287, test_f1: 0.5481
 epoch: 61, train_loss: 0.7548, test_loss: 1.2146, test_f1: 0.5402
 epoch: 62, train_loss: 0.7514, test_loss: 1.1465, test_f1: 0.5729
 epoch: 63, train_loss: 0.7498, test_loss: 1.2309, test_f1: 0.5386
 epoch: 64, train_loss: 0.7540, test_loss: 1.2413, test_f1: 0.5753
 epoch: 65, train_loss: 0.7566, test_loss: 1.2008, test_f1: 0.5399
 epoch: 66, train_loss: 0.7502, test_loss: 1.2021, test_f1: 0.5768
 epoch: 67, train_loss: 0.7465, test_loss: 1.3036, test_f1: 0.5392
 epoch: 68, train_loss: 0.7560, test_loss: 1.1489, test_f1: 0.5451
 epoch: 69, train_loss: 0.7593, test_loss: 1.2290, test_f1: 0.5502
 epoch: 70, train_loss: 0.7579, test_loss: 1.3006, test_f1: 0.5562
 epoch: 71, train_loss: 0.7436, test_loss: 1.2574, test_f1: 0.5452
 epoch: 72, train_loss: 0.7392, test_loss: 1.3456, test_f1: 0.5459
 epoch: 73, train_loss: 0.7479, test_loss: 1.3158, test_f1: 0.5460
 epoch: 74, train_loss: 0.7267, test_loss: 1.4047, test_f1: 0.5416
 epoch: 75, train_loss: 0.7402, test_loss: 1.2872, test_f1: 0.5718
 epoch: 76, train_loss: 0.7325, test_loss: 1.3029, test_f1: 0.5469
 epoch: 77, train_loss: 0.7289, test_loss: 1.1595, test_f1: 0.5853
 epoch: 78, train_loss: 0.7307, test_loss: 1.2478, test_f1: 0.5462
 epoch: 79, train_loss: 0.7290, test_loss: 1.2320, test_f1: 0.5557
 epoch: 80, train_loss: 0.7293, test_loss: 1.4006, test_f1: 0.5458
 epoch: 81, train_loss: 0.7508, test_loss: 1.3181, test_f1: 0.5727
 epoch: 82, train_loss: 0.7399, test_loss: 1.3578, test_f1: 0.5647
 epoch: 83, train_loss: 0.7279, test_loss: 1.2925, test_f1: 0.5429
 epoch: 84, train_loss: 0.7196, test_loss: 1.4221, test_f1: 0.5649
 epoch: 85, train_loss: 0.7182, test_loss: 1.3303, test_f1: 0.5577
 epoch: 86, train_loss: 0.7168, test_loss: 1.4144, test_f1: 0.5581
 epoch: 87, train_loss: 0.7216, test_loss: 1.4183, test_f1: 0.5368
 epoch: 88, train_loss: 0.7164, test_loss: 1.2575, test_f1: 0.5660
 epoch: 89, train_loss: 0.7189, test_loss: 1.4168, test_f1: 0.5465
 epoch: 90, train_loss: 0.7270, test_loss: 1.2320, test_f1: 0.5712
 epoch: 91, train_loss: 0.7327, test_loss: 1.2890, test_f1: 0.5704
 epoch: 92, train_loss: 0.7157, test_loss: 1.3080, test_f1: 0.6016
 epoch: 93, train_loss: 0.7239, test_loss: 1.5286, test_f1: 0.5543
 epoch: 94, train_loss: 0.7246, test_loss: 1.3022, test_f1: 0.5760
 epoch: 95, train_loss: 0.7201, test_loss: 1.3772, test_f1: 0.5566
 epoch: 96, train_loss: 0.7326, test_loss: 1.3592, test_f1: 0.5702
 epoch: 97, train_loss: 0.7167, test_loss: 1.4954, test_f1: 0.5475
 epoch: 98, train_loss: 0.7124, test_loss: 1.3446, test_f1: 0.5727
 epoch: 99, train_loss: 0.7157, test_loss: 1.4217, test_f1: 0.5594
##################ITERATION #1 ****************************************
 epoch: 0, train_loss: 1.2562, test_loss: 1.2846, test_f1: 0.2270
 epoch: 1, train_loss: 1.1545, test_loss: 1.1927, test_f1: 0.2439
 epoch: 2, train_loss: 1.0829, test_loss: 1.1132, test_f1: 0.3542
 epoch: 3, train_loss: 1.0427, test_loss: 1.0933, test_f1: 0.4398
 epoch: 4, train_loss: 1.0207, test_loss: 1.0328, test_f1: 0.4386
 epoch: 5, train_loss: 1.0036, test_loss: 1.0690, test_f1: 0.4128
 epoch: 6, train_loss: 0.9919, test_loss: 1.1802, test_f1: 0.3728
 epoch: 7, train_loss: 0.9734, test_loss: 1.0900, test_f1: 0.4842
 epoch: 8, train_loss: 0.9617, test_loss: 1.0119, test_f1: 0.5393
 epoch: 9, train_loss: 0.9559, test_loss: 1.0277, test_f1: 0.5146
 epoch: 10, train_loss: 0.9406, test_loss: 1.1094, test_f1: 0.4140
 epoch: 11, train_loss: 0.9348, test_loss: 1.1076, test_f1: 0.5105
 epoch: 12, train_loss: 0.9405, test_loss: 1.0878, test_f1: 0.4921
 epoch: 13, train_loss: 0.9193, test_loss: 1.0406, test_f1: 0.4585
 epoch: 14, train_loss: 0.9167, test_loss: 0.9369, test_f1: 0.5588
 epoch: 15, train_loss: 0.9037, test_loss: 1.0131, test_f1: 0.5434
 epoch: 16, train_loss: 0.9096, test_loss: 1.1259, test_f1: 0.5294
 epoch: 17, train_loss: 0.8928, test_loss: 0.9770, test_f1: 0.4857
 epoch: 18, train_loss: 0.8910, test_loss: 0.9714, test_f1: 0.5049
 epoch: 19, train_loss: 0.8794, test_loss: 1.1091, test_f1: 0.4474
 epoch: 20, train_loss: 0.8885, test_loss: 1.0347, test_f1: 0.5078
 epoch: 21, train_loss: 0.8730, test_loss: 1.0060, test_f1: 0.5523
 epoch: 22, train_loss: 0.8691, test_loss: 0.9901, test_f1: 0.4807
 epoch: 23, train_loss: 0.8658, test_loss: 0.9359, test_f1: 0.5180
 epoch: 24, train_loss: 0.8699, test_loss: 0.9415, test_f1: 0.5260
 epoch: 25, train_loss: 0.8579, test_loss: 0.9498, test_f1: 0.5457
 epoch: 26, train_loss: 0.8597, test_loss: 1.0462, test_f1: 0.5194
 epoch: 27, train_loss: 0.8485, test_loss: 1.0136, test_f1: 0.5754
 epoch: 28, train_loss: 0.8493, test_loss: 1.0663, test_f1: 0.5494
 epoch: 29, train_loss: 0.8618, test_loss: 1.0273, test_f1: 0.5421
 epoch: 30, train_loss: 0.8291, test_loss: 1.0525, test_f1: 0.5163
 epoch: 31, train_loss: 0.8398, test_loss: 1.0534, test_f1: 0.5765
 epoch: 32, train_loss: 0.8374, test_loss: 1.1369, test_f1: 0.5064
 epoch: 33, train_loss: 0.8436, test_loss: 1.0495, test_f1: 0.5479
 epoch: 34, train_loss: 0.8424, test_loss: 0.9626, test_f1: 0.5729
 epoch: 35, train_loss: 0.8309, test_loss: 1.0606, test_f1: 0.5531
 epoch: 36, train_loss: 0.8300, test_loss: 1.0012, test_f1: 0.5445
 epoch: 37, train_loss: 0.8140, test_loss: 1.0851, test_f1: 0.4666
 epoch: 38, train_loss: 0.8125, test_loss: 1.0145, test_f1: 0.5382
 epoch: 39, train_loss: 0.8227, test_loss: 0.9849, test_f1: 0.5620
 epoch: 40, train_loss: 0.8056, test_loss: 0.9734, test_f1: 0.5856
 epoch: 41, train_loss: 0.8208, test_loss: 1.0039, test_f1: 0.5476
 epoch: 42, train_loss: 0.8218, test_loss: 1.0190, test_f1: 0.5325
 epoch: 43, train_loss: 0.7927, test_loss: 0.9575, test_f1: 0.5618
 epoch: 44, train_loss: 0.7954, test_loss: 1.0228, test_f1: 0.5584
 epoch: 45, train_loss: 0.7889, test_loss: 0.9272, test_f1: 0.5861
 epoch: 46, train_loss: 0.7765, test_loss: 0.9891, test_f1: 0.6215
 epoch: 47, train_loss: 0.7917, test_loss: 0.9713, test_f1: 0.5529
 epoch: 48, train_loss: 0.7921, test_loss: 0.9674, test_f1: 0.5740
 epoch: 49, train_loss: 0.7974, test_loss: 0.9939, test_f1: 0.5916
 epoch: 50, train_loss: 0.7850, test_loss: 1.1647, test_f1: 0.5346
 epoch: 51, train_loss: 0.7720, test_loss: 0.9761, test_f1: 0.5960
 epoch: 52, train_loss: 0.7577, test_loss: 0.9636, test_f1: 0.6235
 epoch: 53, train_loss: 0.7524, test_loss: 0.9838, test_f1: 0.6057
 epoch: 54, train_loss: 0.7409, test_loss: 0.9598, test_f1: 0.6336
 epoch: 55, train_loss: 0.7346, test_loss: 0.9786, test_f1: 0.5911
 epoch: 56, train_loss: 0.7511, test_loss: 0.9792, test_f1: 0.5887
 epoch: 57, train_loss: 0.7301, test_loss: 0.9496, test_f1: 0.6068
 epoch: 58, train_loss: 0.7173, test_loss: 0.9527, test_f1: 0.6286
 epoch: 59, train_loss: 0.7290, test_loss: 1.0128, test_f1: 0.5891
 epoch: 60, train_loss: 0.7294, test_loss: 1.0153, test_f1: 0.5839
 epoch: 61, train_loss: 0.7125, test_loss: 1.0084, test_f1: 0.6168
 epoch: 62, train_loss: 0.7080, test_loss: 1.0496, test_f1: 0.5866
 epoch: 63, train_loss: 0.7175, test_loss: 0.9949, test_f1: 0.6012
 epoch: 64, train_loss: 0.7217, test_loss: 1.0086, test_f1: 0.6392
 epoch: 65, train_loss: 0.7212, test_loss: 0.9813, test_f1: 0.6461
 epoch: 66, train_loss: 0.7167, test_loss: 1.0034, test_f1: 0.6357
 epoch: 67, train_loss: 0.7185, test_loss: 1.2319, test_f1: 0.5299
 epoch: 68, train_loss: 0.7201, test_loss: 0.9945, test_f1: 0.6156
 epoch: 69, train_loss: 0.7177, test_loss: 1.1438, test_f1: 0.5623
 epoch: 70, train_loss: 0.7107, test_loss: 1.0163, test_f1: 0.6206
 epoch: 71, train_loss: 0.7256, test_loss: 1.0022, test_f1: 0.6151
 epoch: 72, train_loss: 0.6947, test_loss: 1.0012, test_f1: 0.6134
 epoch: 73, train_loss: 0.6994, test_loss: 0.9733, test_f1: 0.6342
 epoch: 74, train_loss: 0.7127, test_loss: 1.0153, test_f1: 0.6099
 epoch: 75, train_loss: 0.7106, test_loss: 0.9578, test_f1: 0.6167
 epoch: 76, train_loss: 0.7028, test_loss: 0.9891, test_f1: 0.6370
 epoch: 77, train_loss: 0.6923, test_loss: 1.0975, test_f1: 0.5771
 epoch: 78, train_loss: 0.6922, test_loss: 1.0143, test_f1: 0.6135
 epoch: 79, train_loss: 0.6910, test_loss: 1.1120, test_f1: 0.5957
 epoch: 80, train_loss: 0.7040, test_loss: 0.9580, test_f1: 0.6286
 epoch: 81, train_loss: 0.6907, test_loss: 0.9902, test_f1: 0.6068
 epoch: 82, train_loss: 0.6894, test_loss: 1.0134, test_f1: 0.6206
 epoch: 83, train_loss: 0.6886, test_loss: 0.9245, test_f1: 0.6613
 epoch: 84, train_loss: 0.6773, test_loss: 1.1047, test_f1: 0.6253
 epoch: 85, train_loss: 0.6744, test_loss: 1.0153, test_f1: 0.6386
 epoch: 86, train_loss: 0.6834, test_loss: 1.0035, test_f1: 0.6292
 epoch: 87, train_loss: 0.6962, test_loss: 1.0501, test_f1: 0.6170
 epoch: 88, train_loss: 0.6946, test_loss: 1.1735, test_f1: 0.5725
 epoch: 89, train_loss: 0.7283, test_loss: 0.9902, test_f1: 0.5994
 epoch: 90, train_loss: 0.7154, test_loss: 0.9675, test_f1: 0.6123
 epoch: 91, train_loss: 0.6999, test_loss: 0.9541, test_f1: 0.6805
 epoch: 92, train_loss: 0.6867, test_loss: 0.9829, test_f1: 0.6315
 epoch: 93, train_loss: 0.6746, test_loss: 1.0206, test_f1: 0.6205
 epoch: 94, train_loss: 0.6603, test_loss: 1.0393, test_f1: 0.6182
 epoch: 95, train_loss: 0.6526, test_loss: 1.1750, test_f1: 0.6105
 epoch: 96, train_loss: 0.6706, test_loss: 1.0350, test_f1: 0.6311
 epoch: 97, train_loss: 0.6726, test_loss: 1.0628, test_f1: 0.6434
 epoch: 98, train_loss: 0.6830, test_loss: 1.0870, test_f1: 0.6165
 epoch: 99, train_loss: 0.6803, test_loss: 1.0123, test_f1: 0.6653
##################ITERATION #2 ****************************************
 epoch: 0, train_loss: 1.4061, test_loss: 1.3306, test_f1: 0.2270
 epoch: 1, train_loss: 1.2151, test_loss: 1.3063, test_f1: 0.2270
 epoch: 2, train_loss: 1.1787, test_loss: 1.2610, test_f1: 0.2751
 epoch: 3, train_loss: 1.1375, test_loss: 1.2181, test_f1: 0.3820
 epoch: 4, train_loss: 1.1010, test_loss: 1.0707, test_f1: 0.4419
 epoch: 5, train_loss: 1.0591, test_loss: 1.0012, test_f1: 0.4738
 epoch: 6, train_loss: 1.0235, test_loss: 1.0030, test_f1: 0.4749
 epoch: 7, train_loss: 0.9935, test_loss: 0.9823, test_f1: 0.4660
 epoch: 8, train_loss: 0.9905, test_loss: 1.0006, test_f1: 0.5006
 epoch: 9, train_loss: 0.9779, test_loss: 1.0075, test_f1: 0.4969
 epoch: 10, train_loss: 0.9708, test_loss: 0.9542, test_f1: 0.4972
 epoch: 11, train_loss: 0.9495, test_loss: 1.0473, test_f1: 0.4716
 epoch: 12, train_loss: 0.9625, test_loss: 0.9637, test_f1: 0.4997
 epoch: 13, train_loss: 0.9376, test_loss: 0.9978, test_f1: 0.4851
 epoch: 14, train_loss: 0.9309, test_loss: 0.9963, test_f1: 0.5014
 epoch: 15, train_loss: 0.9333, test_loss: 0.9967, test_f1: 0.4699
 epoch: 16, train_loss: 0.9238, test_loss: 1.0012, test_f1: 0.4930
 epoch: 17, train_loss: 0.9191, test_loss: 0.9458, test_f1: 0.4982
 epoch: 18, train_loss: 0.9144, test_loss: 1.0654, test_f1: 0.4753
 epoch: 19, train_loss: 0.9053, test_loss: 0.9694, test_f1: 0.5158
 epoch: 20, train_loss: 0.9013, test_loss: 0.9736, test_f1: 0.5111
 epoch: 21, train_loss: 0.9029, test_loss: 0.9504, test_f1: 0.5204
 epoch: 22, train_loss: 0.8924, test_loss: 1.0160, test_f1: 0.5128
 epoch: 23, train_loss: 0.8898, test_loss: 0.9516, test_f1: 0.5003
 epoch: 24, train_loss: 0.8817, test_loss: 0.9548, test_f1: 0.5130
 epoch: 25, train_loss: 0.8688, test_loss: 1.0039, test_f1: 0.5057
 epoch: 26, train_loss: 0.8782, test_loss: 0.9621, test_f1: 0.5208
 epoch: 27, train_loss: 0.8648, test_loss: 0.9634, test_f1: 0.5283
 epoch: 28, train_loss: 0.8581, test_loss: 0.9712, test_f1: 0.5157
 epoch: 29, train_loss: 0.8623, test_loss: 1.0683, test_f1: 0.4640
 epoch: 30, train_loss: 0.8524, test_loss: 1.0753, test_f1: 0.5090
 epoch: 31, train_loss: 0.8495, test_loss: 0.9547, test_f1: 0.5242
 epoch: 32, train_loss: 0.8526, test_loss: 0.9728, test_f1: 0.4969
 epoch: 33, train_loss: 0.8512, test_loss: 1.0015, test_f1: 0.5303
 epoch: 34, train_loss: 0.8459, test_loss: 0.9519, test_f1: 0.5360
 epoch: 35, train_loss: 0.8447, test_loss: 0.9487, test_f1: 0.5424
 epoch: 36, train_loss: 0.8179, test_loss: 0.9730, test_f1: 0.5282
 epoch: 37, train_loss: 0.8309, test_loss: 0.9343, test_f1: 0.5414
 epoch: 38, train_loss: 0.8469, test_loss: 1.0119, test_f1: 0.5133
 epoch: 39, train_loss: 0.8402, test_loss: 0.9964, test_f1: 0.4975
 epoch: 40, train_loss: 0.8383, test_loss: 1.0396, test_f1: 0.5239
 epoch: 41, train_loss: 0.8288, test_loss: 0.9680, test_f1: 0.5121
 epoch: 42, train_loss: 0.8351, test_loss: 1.0926, test_f1: 0.5053
 epoch: 43, train_loss: 0.8286, test_loss: 0.9773, test_f1: 0.5417
 epoch: 44, train_loss: 0.8180, test_loss: 1.0009, test_f1: 0.5487
 epoch: 45, train_loss: 0.8441, test_loss: 0.9239, test_f1: 0.5187
 epoch: 46, train_loss: 0.8203, test_loss: 0.9614, test_f1: 0.5301
 epoch: 47, train_loss: 0.8327, test_loss: 1.0425, test_f1: 0.5079
 epoch: 48, train_loss: 0.8216, test_loss: 0.9815, test_f1: 0.5449
 epoch: 49, train_loss: 0.8145, test_loss: 0.9708, test_f1: 0.5199
 epoch: 50, train_loss: 0.8153, test_loss: 1.0648, test_f1: 0.5187
 epoch: 51, train_loss: 0.8187, test_loss: 0.9949, test_f1: 0.5299
 epoch: 52, train_loss: 0.7939, test_loss: 0.9547, test_f1: 0.5570
 epoch: 53, train_loss: 0.7953, test_loss: 0.9619, test_f1: 0.5591
 epoch: 54, train_loss: 0.7901, test_loss: 0.9609, test_f1: 0.5683
 epoch: 55, train_loss: 0.7965, test_loss: 0.9719, test_f1: 0.5315
 epoch: 56, train_loss: 0.7725, test_loss: 1.0131, test_f1: 0.5442
 epoch: 57, train_loss: 0.7816, test_loss: 0.9656, test_f1: 0.5800
 epoch: 58, train_loss: 0.7700, test_loss: 0.9519, test_f1: 0.5463
 epoch: 59, train_loss: 0.7698, test_loss: 1.0262, test_f1: 0.5227
 epoch: 60, train_loss: 0.7643, test_loss: 0.9701, test_f1: 0.5863
 epoch: 61, train_loss: 0.7842, test_loss: 0.9764, test_f1: 0.5634
 epoch: 62, train_loss: 0.7851, test_loss: 0.9572, test_f1: 0.5810
 epoch: 63, train_loss: 0.7719, test_loss: 0.9924, test_f1: 0.5414
 epoch: 64, train_loss: 0.7656, test_loss: 0.9921, test_f1: 0.5715
 epoch: 65, train_loss: 0.7605, test_loss: 0.9682, test_f1: 0.5702
 epoch: 66, train_loss: 0.7695, test_loss: 0.9725, test_f1: 0.5615
 epoch: 67, train_loss: 0.7613, test_loss: 0.9518, test_f1: 0.5688
 epoch: 68, train_loss: 0.7512, test_loss: 0.9829, test_f1: 0.5636
 epoch: 69, train_loss: 0.7566, test_loss: 0.9773, test_f1: 0.5540
 epoch: 70, train_loss: 0.7469, test_loss: 0.9356, test_f1: 0.5728
 epoch: 71, train_loss: 0.7547, test_loss: 0.9302, test_f1: 0.5796
 epoch: 72, train_loss: 0.7538, test_loss: 0.9739, test_f1: 0.5691
 epoch: 73, train_loss: 0.7571, test_loss: 0.9827, test_f1: 0.5744
 epoch: 74, train_loss: 0.7599, test_loss: 0.9556, test_f1: 0.5575
 epoch: 75, train_loss: 0.7465, test_loss: 1.0343, test_f1: 0.5760
 epoch: 76, train_loss: 0.7599, test_loss: 0.9554, test_f1: 0.5543
 epoch: 77, train_loss: 0.7368, test_loss: 0.9584, test_f1: 0.6008
 epoch: 78, train_loss: 0.7630, test_loss: 1.0103, test_f1: 0.5430
 epoch: 79, train_loss: 0.7584, test_loss: 0.9959, test_f1: 0.5796
 epoch: 80, train_loss: 0.7399, test_loss: 0.9556, test_f1: 0.5423
 epoch: 81, train_loss: 0.7442, test_loss: 0.9517, test_f1: 0.5810
 epoch: 82, train_loss: 0.7409, test_loss: 0.9864, test_f1: 0.5638
 epoch: 83, train_loss: 0.7525, test_loss: 1.0067, test_f1: 0.5570
 epoch: 84, train_loss: 0.7476, test_loss: 0.9512, test_f1: 0.5700
 epoch: 85, train_loss: 0.7428, test_loss: 0.9677, test_f1: 0.5529
 epoch: 86, train_loss: 0.7426, test_loss: 0.9623, test_f1: 0.6055
 epoch: 87, train_loss: 0.7253, test_loss: 0.9584, test_f1: 0.5789
 epoch: 88, train_loss: 0.7341, test_loss: 1.0234, test_f1: 0.5453
 epoch: 89, train_loss: 0.7354, test_loss: 0.9883, test_f1: 0.5821
 epoch: 90, train_loss: 0.7312, test_loss: 1.0272, test_f1: 0.5646
 epoch: 91, train_loss: 0.7443, test_loss: 0.9904, test_f1: 0.5605
 epoch: 92, train_loss: 0.7439, test_loss: 1.0241, test_f1: 0.5547
 epoch: 93, train_loss: 0.7511, test_loss: 0.9618, test_f1: 0.5866
 epoch: 94, train_loss: 0.7279, test_loss: 0.9719, test_f1: 0.5826
 epoch: 95, train_loss: 0.7323, test_loss: 0.9773, test_f1: 0.5857
 epoch: 96, train_loss: 0.7477, test_loss: 0.9982, test_f1: 0.5740
 epoch: 97, train_loss: 0.7262, test_loss: 0.9749, test_f1: 0.5904
 epoch: 98, train_loss: 0.7332, test_loss: 1.0492, test_f1: 0.5370
 epoch: 99, train_loss: 0.7402, test_loss: 1.0414, test_f1: 0.5992
##################ITERATION #3 ****************************************
 epoch: 0, train_loss: 1.3517, test_loss: 1.3407, test_f1: 0.2270
 epoch: 1, train_loss: 1.1215, test_loss: 1.1461, test_f1: 0.3467
 epoch: 2, train_loss: 1.0737, test_loss: 1.0546, test_f1: 0.3614
 epoch: 3, train_loss: 1.0386, test_loss: 1.0231, test_f1: 0.4216
 epoch: 4, train_loss: 1.0026, test_loss: 1.0096, test_f1: 0.4823
 epoch: 5, train_loss: 0.9949, test_loss: 0.9921, test_f1: 0.4986
 epoch: 6, train_loss: 0.9825, test_loss: 1.0371, test_f1: 0.4511
 epoch: 7, train_loss: 0.9711, test_loss: 1.0045, test_f1: 0.4906
 epoch: 8, train_loss: 0.9491, test_loss: 0.9955, test_f1: 0.5068
 epoch: 9, train_loss: 0.9464, test_loss: 0.9930, test_f1: 0.4987
 epoch: 10, train_loss: 0.9355, test_loss: 0.9887, test_f1: 0.5222
 epoch: 11, train_loss: 0.9360, test_loss: 0.9968, test_f1: 0.5063
 epoch: 12, train_loss: 0.9265, test_loss: 1.0906, test_f1: 0.4621
 epoch: 13, train_loss: 0.9321, test_loss: 0.9886, test_f1: 0.5272
 epoch: 14, train_loss: 0.9195, test_loss: 0.9885, test_f1: 0.5064
 epoch: 15, train_loss: 0.9018, test_loss: 1.0062, test_f1: 0.5058
 epoch: 16, train_loss: 0.9099, test_loss: 0.9716, test_f1: 0.5221
 epoch: 17, train_loss: 0.9061, test_loss: 0.9988, test_f1: 0.4970
 epoch: 18, train_loss: 0.8965, test_loss: 1.0035, test_f1: 0.4947
 epoch: 19, train_loss: 0.8987, test_loss: 1.0000, test_f1: 0.5160
 epoch: 20, train_loss: 0.9106, test_loss: 1.0185, test_f1: 0.4900
 epoch: 21, train_loss: 0.8837, test_loss: 0.9871, test_f1: 0.5424
 epoch: 22, train_loss: 0.8761, test_loss: 0.9632, test_f1: 0.5210
 epoch: 23, train_loss: 0.8773, test_loss: 1.0341, test_f1: 0.5159
 epoch: 24, train_loss: 0.8771, test_loss: 1.0048, test_f1: 0.4838
 epoch: 25, train_loss: 0.8752, test_loss: 0.9810, test_f1: 0.5583
 epoch: 26, train_loss: 0.8734, test_loss: 1.0192, test_f1: 0.4835
 epoch: 27, train_loss: 0.8780, test_loss: 0.9865, test_f1: 0.5425
 epoch: 28, train_loss: 0.8798, test_loss: 0.9775, test_f1: 0.5113
 epoch: 29, train_loss: 0.8667, test_loss: 0.9592, test_f1: 0.5531
 epoch: 30, train_loss: 0.8729, test_loss: 1.0041, test_f1: 0.5068
 epoch: 31, train_loss: 0.8633, test_loss: 0.9583, test_f1: 0.5353
 epoch: 32, train_loss: 0.8550, test_loss: 0.9709, test_f1: 0.5437
 epoch: 33, train_loss: 0.8485, test_loss: 0.9562, test_f1: 0.5093
 epoch: 34, train_loss: 0.8437, test_loss: 0.9721, test_f1: 0.5379
 epoch: 35, train_loss: 0.8378, test_loss: 1.0202, test_f1: 0.5348
 epoch: 36, train_loss: 0.8337, test_loss: 0.9608, test_f1: 0.5333
 epoch: 37, train_loss: 0.8461, test_loss: 0.9903, test_f1: 0.5070
 epoch: 38, train_loss: 0.8357, test_loss: 1.0240, test_f1: 0.5021
 epoch: 39, train_loss: 0.8312, test_loss: 0.9556, test_f1: 0.5240
 epoch: 40, train_loss: 0.8401, test_loss: 0.9965, test_f1: 0.4967
 epoch: 41, train_loss: 0.8321, test_loss: 1.0194, test_f1: 0.5169
 epoch: 42, train_loss: 0.8214, test_loss: 1.0109, test_f1: 0.5336
 epoch: 43, train_loss: 0.8228, test_loss: 0.9937, test_f1: 0.5064
 epoch: 44, train_loss: 0.8204, test_loss: 0.9782, test_f1: 0.5195
 epoch: 45, train_loss: 0.8108, test_loss: 0.9345, test_f1: 0.5361
 epoch: 46, train_loss: 0.8015, test_loss: 0.9656, test_f1: 0.5163
 epoch: 47, train_loss: 0.8217, test_loss: 0.9820, test_f1: 0.5218
 epoch: 48, train_loss: 0.8259, test_loss: 0.9286, test_f1: 0.5374
 epoch: 49, train_loss: 0.8086, test_loss: 0.9562, test_f1: 0.5186
 epoch: 50, train_loss: 0.8139, test_loss: 0.9668, test_f1: 0.5340
 epoch: 51, train_loss: 0.7859, test_loss: 0.9208, test_f1: 0.5414
 epoch: 52, train_loss: 0.7864, test_loss: 0.9379, test_f1: 0.5556
 epoch: 53, train_loss: 0.7735, test_loss: 0.9685, test_f1: 0.5462
 epoch: 54, train_loss: 0.7763, test_loss: 0.9663, test_f1: 0.5328
 epoch: 55, train_loss: 0.7738, test_loss: 0.9822, test_f1: 0.5502
 epoch: 56, train_loss: 0.7724, test_loss: 0.9563, test_f1: 0.5455
 epoch: 57, train_loss: 0.7637, test_loss: 1.0041, test_f1: 0.5291
 epoch: 58, train_loss: 0.7497, test_loss: 0.9484, test_f1: 0.5473
 epoch: 59, train_loss: 0.7596, test_loss: 0.9814, test_f1: 0.5414
 epoch: 60, train_loss: 0.7557, test_loss: 0.9489, test_f1: 0.5540
 epoch: 61, train_loss: 0.7656, test_loss: 0.9779, test_f1: 0.5467
 epoch: 62, train_loss: 0.7423, test_loss: 1.0117, test_f1: 0.5303
 epoch: 63, train_loss: 0.7613, test_loss: 0.9774, test_f1: 0.5513
 epoch: 64, train_loss: 0.7476, test_loss: 0.9727, test_f1: 0.5441
 epoch: 65, train_loss: 0.7457, test_loss: 0.9613, test_f1: 0.5429
 epoch: 66, train_loss: 0.7475, test_loss: 1.0334, test_f1: 0.5421
 epoch: 67, train_loss: 0.7480, test_loss: 0.9663, test_f1: 0.5502
 epoch: 68, train_loss: 0.7339, test_loss: 0.9655, test_f1: 0.5382
 epoch: 69, train_loss: 0.7454, test_loss: 0.9665, test_f1: 0.5491
 epoch: 70, train_loss: 0.7426, test_loss: 1.0376, test_f1: 0.5299
 epoch: 71, train_loss: 0.7251, test_loss: 1.0027, test_f1: 0.5487
 epoch: 72, train_loss: 0.7334, test_loss: 0.9973, test_f1: 0.5589
 epoch: 73, train_loss: 0.7235, test_loss: 0.9970, test_f1: 0.5519
 epoch: 74, train_loss: 0.7431, test_loss: 1.0006, test_f1: 0.5426
 epoch: 75, train_loss: 0.7413, test_loss: 0.9831, test_f1: 0.5495
 epoch: 76, train_loss: 0.7254, test_loss: 1.0260, test_f1: 0.5895
 epoch: 77, train_loss: 0.7260, test_loss: 0.9894, test_f1: 0.5648
 epoch: 78, train_loss: 0.7245, test_loss: 1.0277, test_f1: 0.5704
 epoch: 79, train_loss: 0.7220, test_loss: 1.0064, test_f1: 0.5454
 epoch: 80, train_loss: 0.7201, test_loss: 0.9763, test_f1: 0.5678
 epoch: 81, train_loss: 0.7132, test_loss: 0.9923, test_f1: 0.5629
 epoch: 82, train_loss: 0.7164, test_loss: 1.0058, test_f1: 0.5588
 epoch: 83, train_loss: 0.7228, test_loss: 0.9744, test_f1: 0.5514
 epoch: 84, train_loss: 0.7106, test_loss: 0.9899, test_f1: 0.5477
 epoch: 85, train_loss: 0.7243, test_loss: 0.9920, test_f1: 0.5593
 epoch: 86, train_loss: 0.7192, test_loss: 1.0119, test_f1: 0.5363
 epoch: 87, train_loss: 0.7043, test_loss: 0.9413, test_f1: 0.5646
 epoch: 88, train_loss: 0.7362, test_loss: 0.9960, test_f1: 0.5438
 epoch: 89, train_loss: 0.7061, test_loss: 1.0760, test_f1: 0.5729
 epoch: 90, train_loss: 0.7280, test_loss: 1.0269, test_f1: 0.5717
 epoch: 91, train_loss: 0.7183, test_loss: 0.9945, test_f1: 0.5694
 epoch: 92, train_loss: 0.7049, test_loss: 1.0210, test_f1: 0.5983
 epoch: 93, train_loss: 0.6889, test_loss: 1.0255, test_f1: 0.5714
 epoch: 94, train_loss: 0.6841, test_loss: 1.0198, test_f1: 0.5911
 epoch: 95, train_loss: 0.7232, test_loss: 1.0192, test_f1: 0.5628
 epoch: 96, train_loss: 0.7162, test_loss: 1.1504, test_f1: 0.6062
 epoch: 97, train_loss: 0.7132, test_loss: 1.0577, test_f1: 0.5541
 epoch: 98, train_loss: 0.7077, test_loss: 1.0383, test_f1: 0.5638
 epoch: 99, train_loss: 0.7088, test_loss: 1.0359, test_f1: 0.5750
##################ITERATION #4 ****************************************
 epoch: 0, train_loss: 1.4906, test_loss: 1.2787, test_f1: 0.2270
 epoch: 1, train_loss: 1.1983, test_loss: 1.2062, test_f1: 0.2270
 epoch: 2, train_loss: 1.1329, test_loss: 1.1158, test_f1: 0.3746
 epoch: 3, train_loss: 1.0710, test_loss: 1.0399, test_f1: 0.4289
 epoch: 4, train_loss: 1.0475, test_loss: 1.0411, test_f1: 0.4281
 epoch: 5, train_loss: 1.0158, test_loss: 1.0569, test_f1: 0.4741
 epoch: 6, train_loss: 0.9981, test_loss: 1.0189, test_f1: 0.4733
 epoch: 7, train_loss: 0.9915, test_loss: 0.9944, test_f1: 0.4559
 epoch: 8, train_loss: 1.0105, test_loss: 1.0334, test_f1: 0.4407
 epoch: 9, train_loss: 0.9802, test_loss: 0.9580, test_f1: 0.4686
 epoch: 10, train_loss: 0.9647, test_loss: 0.9491, test_f1: 0.4884
 epoch: 11, train_loss: 0.9573, test_loss: 1.0759, test_f1: 0.4718
 epoch: 12, train_loss: 0.9590, test_loss: 0.8980, test_f1: 0.4974
 epoch: 13, train_loss: 0.9394, test_loss: 1.0276, test_f1: 0.4787
 epoch: 14, train_loss: 0.9463, test_loss: 0.9563, test_f1: 0.4988
 epoch: 15, train_loss: 0.9191, test_loss: 0.9159, test_f1: 0.5386
 epoch: 16, train_loss: 0.9375, test_loss: 1.0115, test_f1: 0.4766
 epoch: 17, train_loss: 0.9308, test_loss: 0.9481, test_f1: 0.4770
 epoch: 18, train_loss: 0.9116, test_loss: 0.9366, test_f1: 0.4966
 epoch: 19, train_loss: 0.9052, test_loss: 0.9377, test_f1: 0.5410
 epoch: 20, train_loss: 0.9011, test_loss: 1.1074, test_f1: 0.4507
 epoch: 21, train_loss: 0.9057, test_loss: 0.9118, test_f1: 0.5186
 epoch: 22, train_loss: 0.8989, test_loss: 0.9304, test_f1: 0.5334
 epoch: 23, train_loss: 0.8953, test_loss: 1.0596, test_f1: 0.4888
 epoch: 24, train_loss: 0.8818, test_loss: 1.0243, test_f1: 0.4362
 epoch: 25, train_loss: 0.8902, test_loss: 1.0868, test_f1: 0.4550
 epoch: 26, train_loss: 0.8845, test_loss: 0.9826, test_f1: 0.5242
 epoch: 27, train_loss: 0.8814, test_loss: 0.9576, test_f1: 0.5271
 epoch: 28, train_loss: 0.8758, test_loss: 1.0036, test_f1: 0.5504
 epoch: 29, train_loss: 0.8737, test_loss: 0.9559, test_f1: 0.5369
 epoch: 30, train_loss: 0.8692, test_loss: 1.1302, test_f1: 0.4871
 epoch: 31, train_loss: 0.8610, test_loss: 1.0085, test_f1: 0.4550
 epoch: 32, train_loss: 0.8658, test_loss: 0.9916, test_f1: 0.5224
 epoch: 33, train_loss: 0.8703, test_loss: 0.9914, test_f1: 0.5607
 epoch: 34, train_loss: 0.8556, test_loss: 0.9631, test_f1: 0.5443
 epoch: 35, train_loss: 0.8516, test_loss: 0.9516, test_f1: 0.5337
 epoch: 36, train_loss: 0.8488, test_loss: 1.1013, test_f1: 0.4843
 epoch: 37, train_loss: 0.8478, test_loss: 0.9550, test_f1: 0.5149
 epoch: 38, train_loss: 0.8472, test_loss: 0.9875, test_f1: 0.5137
 epoch: 39, train_loss: 0.8407, test_loss: 0.9764, test_f1: 0.5469
 epoch: 40, train_loss: 0.8419, test_loss: 0.9466, test_f1: 0.5540
 epoch: 41, train_loss: 0.8335, test_loss: 0.9476, test_f1: 0.5472
 epoch: 42, train_loss: 0.8256, test_loss: 0.9480, test_f1: 0.5137
 epoch: 43, train_loss: 0.8275, test_loss: 1.0309, test_f1: 0.5033
 epoch: 44, train_loss: 0.8437, test_loss: 0.9558, test_f1: 0.5830
 epoch: 45, train_loss: 0.8222, test_loss: 0.9620, test_f1: 0.5561
 epoch: 46, train_loss: 0.8134, test_loss: 0.9539, test_f1: 0.5328
 epoch: 47, train_loss: 0.8226, test_loss: 1.0002, test_f1: 0.5502
 epoch: 48, train_loss: 0.8387, test_loss: 0.9544, test_f1: 0.5318
 epoch: 49, train_loss: 0.8230, test_loss: 0.9903, test_f1: 0.5363
 epoch: 50, train_loss: 0.8050, test_loss: 1.0213, test_f1: 0.5391
 epoch: 51, train_loss: 0.7771, test_loss: 0.8988, test_f1: 0.5958
 epoch: 52, train_loss: 0.7843, test_loss: 0.9043, test_f1: 0.5950
 epoch: 53, train_loss: 0.7660, test_loss: 0.9212, test_f1: 0.5765
 epoch: 54, train_loss: 0.7700, test_loss: 0.9179, test_f1: 0.5807
 epoch: 55, train_loss: 0.7579, test_loss: 0.9016, test_f1: 0.5966
 epoch: 56, train_loss: 0.7659, test_loss: 0.9086, test_f1: 0.5646
 epoch: 57, train_loss: 0.7614, test_loss: 0.9513, test_f1: 0.5764
 epoch: 58, train_loss: 0.7565, test_loss: 0.9072, test_f1: 0.5824
 epoch: 59, train_loss: 0.7570, test_loss: 0.9213, test_f1: 0.5782
 epoch: 60, train_loss: 0.7510, test_loss: 0.9572, test_f1: 0.5634
 epoch: 61, train_loss: 0.7543, test_loss: 0.9452, test_f1: 0.6016
 epoch: 62, train_loss: 0.7697, test_loss: 0.9725, test_f1: 0.5426
 epoch: 63, train_loss: 0.7662, test_loss: 0.9028, test_f1: 0.5889
 epoch: 64, train_loss: 0.7555, test_loss: 0.9100, test_f1: 0.5692
 epoch: 65, train_loss: 0.7617, test_loss: 0.9454, test_f1: 0.6104
 epoch: 66, train_loss: 0.7487, test_loss: 1.0143, test_f1: 0.5338
 epoch: 67, train_loss: 0.7535, test_loss: 0.9111, test_f1: 0.6081
 epoch: 68, train_loss: 0.7530, test_loss: 0.9134, test_f1: 0.5645
 epoch: 69, train_loss: 0.7429, test_loss: 0.9180, test_f1: 0.5877
 epoch: 70, train_loss: 0.7508, test_loss: 0.9136, test_f1: 0.6188
 epoch: 71, train_loss: 0.7436, test_loss: 0.9354, test_f1: 0.5863
 epoch: 72, train_loss: 0.7427, test_loss: 0.9518, test_f1: 0.5806
 epoch: 73, train_loss: 0.7401, test_loss: 0.8928, test_f1: 0.6144
 epoch: 74, train_loss: 0.7355, test_loss: 0.9148, test_f1: 0.6205
 epoch: 75, train_loss: 0.7301, test_loss: 0.9398, test_f1: 0.5689
 epoch: 76, train_loss: 0.7462, test_loss: 0.9943, test_f1: 0.5645
 epoch: 77, train_loss: 0.7461, test_loss: 0.9246, test_f1: 0.6273
 epoch: 78, train_loss: 0.7358, test_loss: 0.8882, test_f1: 0.5909
 epoch: 79, train_loss: 0.7254, test_loss: 0.8867, test_f1: 0.5961
 epoch: 80, train_loss: 0.7212, test_loss: 0.8828, test_f1: 0.6052
 epoch: 81, train_loss: 0.7176, test_loss: 0.9078, test_f1: 0.6074
 epoch: 82, train_loss: 0.7186, test_loss: 0.9528, test_f1: 0.5773
 epoch: 83, train_loss: 0.7113, test_loss: 0.9323, test_f1: 0.6159
 epoch: 84, train_loss: 0.7309, test_loss: 0.9124, test_f1: 0.5530
 epoch: 85, train_loss: 0.7213, test_loss: 0.9445, test_f1: 0.5841
 epoch: 86, train_loss: 0.7345, test_loss: 0.9511, test_f1: 0.6275
 epoch: 87, train_loss: 0.7284, test_loss: 0.9882, test_f1: 0.6131
 epoch: 88, train_loss: 0.7224, test_loss: 0.9133, test_f1: 0.6004
 epoch: 89, train_loss: 0.7294, test_loss: 0.9073, test_f1: 0.6273
 epoch: 90, train_loss: 0.7234, test_loss: 0.9047, test_f1: 0.6159
 epoch: 91, train_loss: 0.7114, test_loss: 0.9728, test_f1: 0.5895
 epoch: 92, train_loss: 0.7268, test_loss: 0.9163, test_f1: 0.6147
 epoch: 93, train_loss: 0.7163, test_loss: 0.8893, test_f1: 0.6130
 epoch: 94, train_loss: 0.7163, test_loss: 0.9246, test_f1: 0.5941
 epoch: 95, train_loss: 0.7138, test_loss: 0.9473, test_f1: 0.6337
 epoch: 96, train_loss: 0.7239, test_loss: 0.9118, test_f1: 0.5907
 epoch: 97, train_loss: 0.7079, test_loss: 0.9236, test_f1: 0.5909
 epoch: 98, train_loss: 0.7130, test_loss: 0.8868, test_f1: 0.6513
 epoch: 99, train_loss: 0.7047, test_loss: 0.9834, test_f1: 0.5700
##################ITERATION #5 ****************************************
 epoch: 0, train_loss: 1.4131, test_loss: 1.2781, test_f1: 0.2838
 epoch: 1, train_loss: 1.1231, test_loss: 1.1386, test_f1: 0.3824
 epoch: 2, train_loss: 1.0721, test_loss: 1.1000, test_f1: 0.4589
 epoch: 3, train_loss: 1.0486, test_loss: 1.0574, test_f1: 0.4781
 epoch: 4, train_loss: 1.0388, test_loss: 1.0282, test_f1: 0.4214
 epoch: 5, train_loss: 1.0098, test_loss: 1.0011, test_f1: 0.4572
 epoch: 6, train_loss: 1.0039, test_loss: 0.9810, test_f1: 0.4957
 epoch: 7, train_loss: 0.9780, test_loss: 1.0922, test_f1: 0.4046
 epoch: 8, train_loss: 0.9685, test_loss: 1.0165, test_f1: 0.4879
 epoch: 9, train_loss: 0.9669, test_loss: 1.0059, test_f1: 0.4553
 epoch: 10, train_loss: 0.9687, test_loss: 1.0007, test_f1: 0.4845
 epoch: 11, train_loss: 0.9471, test_loss: 1.0464, test_f1: 0.4442
 epoch: 12, train_loss: 0.9277, test_loss: 1.0084, test_f1: 0.4752
 epoch: 13, train_loss: 0.9335, test_loss: 0.8906, test_f1: 0.5023
 epoch: 14, train_loss: 0.9212, test_loss: 1.0419, test_f1: 0.4978
 epoch: 15, train_loss: 0.9242, test_loss: 1.0620, test_f1: 0.4388
 epoch: 16, train_loss: 0.9183, test_loss: 1.0040, test_f1: 0.4765
 epoch: 17, train_loss: 0.9117, test_loss: 0.9894, test_f1: 0.4697
 epoch: 18, train_loss: 0.9083, test_loss: 0.9793, test_f1: 0.4921
 epoch: 19, train_loss: 0.9173, test_loss: 0.9753, test_f1: 0.4441
 epoch: 20, train_loss: 0.8999, test_loss: 0.9249, test_f1: 0.5444
 epoch: 21, train_loss: 0.8947, test_loss: 0.9445, test_f1: 0.5080
 epoch: 22, train_loss: 0.8846, test_loss: 1.1146, test_f1: 0.4197
 epoch: 23, train_loss: 0.8965, test_loss: 0.9963, test_f1: 0.4802
 epoch: 24, train_loss: 0.8832, test_loss: 1.1547, test_f1: 0.4733
 epoch: 25, train_loss: 0.8736, test_loss: 0.9495, test_f1: 0.5541
 epoch: 26, train_loss: 0.8840, test_loss: 0.9490, test_f1: 0.5146
 epoch: 27, train_loss: 0.8841, test_loss: 0.9275, test_f1: 0.4948
 epoch: 28, train_loss: 0.8708, test_loss: 0.8623, test_f1: 0.5493
 epoch: 29, train_loss: 0.8635, test_loss: 0.9584, test_f1: 0.4633
 epoch: 30, train_loss: 0.8681, test_loss: 0.9219, test_f1: 0.5441
 epoch: 31, train_loss: 0.8604, test_loss: 0.9762, test_f1: 0.5288
 epoch: 32, train_loss: 0.8461, test_loss: 0.8943, test_f1: 0.5284
 epoch: 33, train_loss: 0.8702, test_loss: 0.9436, test_f1: 0.5197
 epoch: 34, train_loss: 0.8481, test_loss: 0.9820, test_f1: 0.4553
 epoch: 35, train_loss: 0.8537, test_loss: 1.1368, test_f1: 0.4739
 epoch: 36, train_loss: 0.8514, test_loss: 0.9058, test_f1: 0.5370
 epoch: 37, train_loss: 0.8513, test_loss: 0.9708, test_f1: 0.5034
 epoch: 38, train_loss: 0.8388, test_loss: 0.9700, test_f1: 0.5171
 epoch: 39, train_loss: 0.8476, test_loss: 0.8907, test_f1: 0.5458
 epoch: 40, train_loss: 0.8342, test_loss: 0.8802, test_f1: 0.5495
 epoch: 41, train_loss: 0.8304, test_loss: 0.9265, test_f1: 0.5339
 epoch: 42, train_loss: 0.8439, test_loss: 0.9320, test_f1: 0.5666
 epoch: 43, train_loss: 0.8377, test_loss: 0.8595, test_f1: 0.5239
 epoch: 44, train_loss: 0.8516, test_loss: 1.1480, test_f1: 0.4553
 epoch: 45, train_loss: 0.8356, test_loss: 0.9662, test_f1: 0.5005
 epoch: 46, train_loss: 0.8335, test_loss: 0.9185, test_f1: 0.5269
 epoch: 47, train_loss: 0.8223, test_loss: 0.9689, test_f1: 0.5258
 epoch: 48, train_loss: 0.8336, test_loss: 1.0162, test_f1: 0.4960
 epoch: 49, train_loss: 0.8348, test_loss: 0.9243, test_f1: 0.5228
 epoch: 50, train_loss: 0.8203, test_loss: 0.9443, test_f1: 0.5375
 epoch: 51, train_loss: 0.8004, test_loss: 0.8556, test_f1: 0.5356
 epoch: 52, train_loss: 0.7875, test_loss: 0.8715, test_f1: 0.5609
 epoch: 53, train_loss: 0.7854, test_loss: 0.8634, test_f1: 0.5611
 epoch: 54, train_loss: 0.7873, test_loss: 0.9189, test_f1: 0.5408
 epoch: 55, train_loss: 0.7912, test_loss: 0.8778, test_f1: 0.5496
 epoch: 56, train_loss: 0.7880, test_loss: 0.8670, test_f1: 0.5562
 epoch: 57, train_loss: 0.7848, test_loss: 0.9183, test_f1: 0.5525
 epoch: 58, train_loss: 0.7982, test_loss: 1.0058, test_f1: 0.5462
 epoch: 59, train_loss: 0.7873, test_loss: 0.8708, test_f1: 0.5584
 epoch: 60, train_loss: 0.7749, test_loss: 0.9103, test_f1: 0.5454
 epoch: 61, train_loss: 0.7937, test_loss: 0.8967, test_f1: 0.5742
 epoch: 62, train_loss: 0.7929, test_loss: 0.9367, test_f1: 0.5383
 epoch: 63, train_loss: 0.7715, test_loss: 0.8762, test_f1: 0.5903
 epoch: 64, train_loss: 0.7707, test_loss: 0.9770, test_f1: 0.5099
 epoch: 65, train_loss: 0.7778, test_loss: 0.9217, test_f1: 0.5397
 epoch: 66, train_loss: 0.7662, test_loss: 0.8879, test_f1: 0.5797
 epoch: 67, train_loss: 0.7559, test_loss: 0.9070, test_f1: 0.5935
 epoch: 68, train_loss: 0.7613, test_loss: 0.9233, test_f1: 0.5751
 epoch: 69, train_loss: 0.7631, test_loss: 0.9313, test_f1: 0.5679
 epoch: 70, train_loss: 0.7770, test_loss: 0.9018, test_f1: 0.5819
 epoch: 71, train_loss: 0.7646, test_loss: 0.9537, test_f1: 0.5520
 epoch: 72, train_loss: 0.7712, test_loss: 0.9189, test_f1: 0.5550
 epoch: 73, train_loss: 0.7623, test_loss: 0.9708, test_f1: 0.5352
 epoch: 74, train_loss: 0.7704, test_loss: 0.9047, test_f1: 0.5794
 epoch: 75, train_loss: 0.7554, test_loss: 0.9486, test_f1: 0.5361
 epoch: 76, train_loss: 0.7632, test_loss: 0.9610, test_f1: 0.5406
 epoch: 77, train_loss: 0.7746, test_loss: 0.9512, test_f1: 0.5745
 epoch: 78, train_loss: 0.7618, test_loss: 1.0436, test_f1: 0.4931
 epoch: 79, train_loss: 0.7652, test_loss: 0.9449, test_f1: 0.5543
 epoch: 80, train_loss: 0.7498, test_loss: 0.9069, test_f1: 0.5906
 epoch: 81, train_loss: 0.7505, test_loss: 0.9314, test_f1: 0.5644
 epoch: 82, train_loss: 0.7514, test_loss: 0.9900, test_f1: 0.5520
 epoch: 83, train_loss: 0.7509, test_loss: 0.9004, test_f1: 0.5577
 epoch: 84, train_loss: 0.7602, test_loss: 0.8660, test_f1: 0.5698
 epoch: 85, train_loss: 0.7522, test_loss: 0.9520, test_f1: 0.5602
 epoch: 86, train_loss: 0.7716, test_loss: 0.9146, test_f1: 0.5878
 epoch: 87, train_loss: 0.7669, test_loss: 0.9232, test_f1: 0.5793
 epoch: 88, train_loss: 0.7377, test_loss: 0.8738, test_f1: 0.5658
 epoch: 89, train_loss: 0.7529, test_loss: 0.9383, test_f1: 0.5637
 epoch: 90, train_loss: 0.7440, test_loss: 0.9412, test_f1: 0.5709
 epoch: 91, train_loss: 0.7416, test_loss: 0.8739, test_f1: 0.5671
 epoch: 92, train_loss: 0.7407, test_loss: 0.9810, test_f1: 0.5415
 epoch: 93, train_loss: 0.7362, test_loss: 0.9540, test_f1: 0.5755
 epoch: 94, train_loss: 0.7413, test_loss: 0.9208, test_f1: 0.5542
 epoch: 95, train_loss: 0.7361, test_loss: 0.8886, test_f1: 0.5965
 epoch: 96, train_loss: 0.7454, test_loss: 0.9447, test_f1: 0.5513
 epoch: 97, train_loss: 0.7383, test_loss: 0.9600, test_f1: 0.5650
 epoch: 98, train_loss: 0.7599, test_loss: 0.9066, test_f1: 0.5561
 epoch: 99, train_loss: 0.7471, test_loss: 0.9390, test_f1: 0.5638
##################ITERATION #6 ****************************************
 epoch: 0, train_loss: 1.3165, test_loss: 1.3748, test_f1: 0.2270
 epoch: 1, train_loss: 1.1025, test_loss: 1.1913, test_f1: 0.2738
 epoch: 2, train_loss: 1.0535, test_loss: 1.0715, test_f1: 0.3647
 epoch: 3, train_loss: 1.0247, test_loss: 1.0780, test_f1: 0.4066
 epoch: 4, train_loss: 1.0079, test_loss: 1.0362, test_f1: 0.4380
 epoch: 5, train_loss: 0.9842, test_loss: 1.0451, test_f1: 0.4696
 epoch: 6, train_loss: 0.9783, test_loss: 1.0156, test_f1: 0.4579
 epoch: 7, train_loss: 0.9688, test_loss: 0.9987, test_f1: 0.4864
 epoch: 8, train_loss: 0.9613, test_loss: 0.9549, test_f1: 0.5000
 epoch: 9, train_loss: 0.9643, test_loss: 1.1983, test_f1: 0.3881
 epoch: 10, train_loss: 0.9898, test_loss: 1.4452, test_f1: 0.3684
 epoch: 11, train_loss: 0.9586, test_loss: 1.0838, test_f1: 0.4852
 epoch: 12, train_loss: 0.9524, test_loss: 1.0480, test_f1: 0.4500
 epoch: 13, train_loss: 0.9380, test_loss: 0.9830, test_f1: 0.4728
 epoch: 14, train_loss: 0.9374, test_loss: 0.9443, test_f1: 0.4895
 epoch: 15, train_loss: 0.9331, test_loss: 0.9663, test_f1: 0.5128
 epoch: 16, train_loss: 0.9238, test_loss: 0.9294, test_f1: 0.5040
 epoch: 17, train_loss: 0.9343, test_loss: 0.9696, test_f1: 0.5081
 epoch: 18, train_loss: 0.9347, test_loss: 0.9190, test_f1: 0.5099
 epoch: 19, train_loss: 0.9262, test_loss: 0.9353, test_f1: 0.5052
 epoch: 20, train_loss: 0.9105, test_loss: 0.9933, test_f1: 0.4813
 epoch: 21, train_loss: 0.9052, test_loss: 0.9075, test_f1: 0.5298
 epoch: 22, train_loss: 0.8972, test_loss: 0.9153, test_f1: 0.5065
 epoch: 23, train_loss: 0.9024, test_loss: 0.9408, test_f1: 0.5027
 epoch: 24, train_loss: 0.8976, test_loss: 0.9410, test_f1: 0.4860
 epoch: 25, train_loss: 0.8937, test_loss: 1.0713, test_f1: 0.4751
 epoch: 26, train_loss: 0.8869, test_loss: 0.9705, test_f1: 0.5070
 epoch: 27, train_loss: 0.8886, test_loss: 0.9405, test_f1: 0.4834
 epoch: 28, train_loss: 0.8881, test_loss: 0.9490, test_f1: 0.4892
 epoch: 29, train_loss: 0.8794, test_loss: 0.9607, test_f1: 0.5108
 epoch: 30, train_loss: 0.8754, test_loss: 0.9253, test_f1: 0.5207
 epoch: 31, train_loss: 0.8779, test_loss: 0.9317, test_f1: 0.5045
 epoch: 32, train_loss: 0.8662, test_loss: 0.8962, test_f1: 0.5498
 epoch: 33, train_loss: 0.8682, test_loss: 0.9453, test_f1: 0.5123
 epoch: 34, train_loss: 0.8648, test_loss: 0.9435, test_f1: 0.5148
 epoch: 35, train_loss: 0.8554, test_loss: 0.9165, test_f1: 0.5078
 epoch: 36, train_loss: 0.8575, test_loss: 0.9232, test_f1: 0.5142
 epoch: 37, train_loss: 0.8637, test_loss: 0.9677, test_f1: 0.5292
 epoch: 38, train_loss: 0.8637, test_loss: 0.9343, test_f1: 0.5132
 epoch: 39, train_loss: 0.8772, test_loss: 0.9206, test_f1: 0.5132
 epoch: 40, train_loss: 0.8653, test_loss: 0.9415, test_f1: 0.5209
 epoch: 41, train_loss: 0.8566, test_loss: 0.9550, test_f1: 0.5340
 epoch: 42, train_loss: 0.8501, test_loss: 0.9620, test_f1: 0.5034
 epoch: 43, train_loss: 0.8452, test_loss: 0.8899, test_f1: 0.5414
 epoch: 44, train_loss: 0.8440, test_loss: 0.9301, test_f1: 0.5112
 epoch: 45, train_loss: 0.8249, test_loss: 0.9589, test_f1: 0.5276
 epoch: 46, train_loss: 0.8465, test_loss: 0.9101, test_f1: 0.5244
 epoch: 47, train_loss: 0.8397, test_loss: 0.9002, test_f1: 0.5680
 epoch: 48, train_loss: 0.8400, test_loss: 0.9269, test_f1: 0.5499
 epoch: 49, train_loss: 0.8397, test_loss: 0.9822, test_f1: 0.5029
 epoch: 50, train_loss: 0.8305, test_loss: 0.9315, test_f1: 0.5419
 epoch: 51, train_loss: 0.8385, test_loss: 0.9020, test_f1: 0.5292
 epoch: 52, train_loss: 0.8206, test_loss: 0.9460, test_f1: 0.5254
 epoch: 53, train_loss: 0.8040, test_loss: 0.9287, test_f1: 0.5360
 epoch: 54, train_loss: 0.8057, test_loss: 0.9076, test_f1: 0.5318
 epoch: 55, train_loss: 0.8004, test_loss: 0.9078, test_f1: 0.5377
 epoch: 56, train_loss: 0.8043, test_loss: 0.9389, test_f1: 0.5406
 epoch: 57, train_loss: 0.8073, test_loss: 0.8837, test_f1: 0.5515
 epoch: 58, train_loss: 0.8008, test_loss: 0.9414, test_f1: 0.5246
 epoch: 59, train_loss: 0.7909, test_loss: 0.9475, test_f1: 0.5050
 epoch: 60, train_loss: 0.7994, test_loss: 0.9199, test_f1: 0.5585
 epoch: 61, train_loss: 0.7829, test_loss: 0.9454, test_f1: 0.5452
 epoch: 62, train_loss: 0.7893, test_loss: 0.9482, test_f1: 0.5488
 epoch: 63, train_loss: 0.7862, test_loss: 0.9248, test_f1: 0.5455
 epoch: 64, train_loss: 0.7685, test_loss: 0.9093, test_f1: 0.5435
 epoch: 65, train_loss: 0.7829, test_loss: 0.9880, test_f1: 0.5574
 epoch: 66, train_loss: 0.7952, test_loss: 0.9516, test_f1: 0.5280
 epoch: 67, train_loss: 0.7778, test_loss: 0.9621, test_f1: 0.5595
 epoch: 68, train_loss: 0.7778, test_loss: 0.9261, test_f1: 0.5683
 epoch: 69, train_loss: 0.7686, test_loss: 0.9293, test_f1: 0.5335
 epoch: 70, train_loss: 0.7819, test_loss: 0.9052, test_f1: 0.5680
 epoch: 71, train_loss: 0.7761, test_loss: 0.9124, test_f1: 0.5694
 epoch: 72, train_loss: 0.7650, test_loss: 1.0007, test_f1: 0.5216
 epoch: 73, train_loss: 0.7763, test_loss: 0.8765, test_f1: 0.5634
 epoch: 74, train_loss: 0.7661, test_loss: 0.9433, test_f1: 0.5812
 epoch: 75, train_loss: 0.7498, test_loss: 0.9236, test_f1: 0.5752
 epoch: 76, train_loss: 0.7700, test_loss: 0.9283, test_f1: 0.5765
 epoch: 77, train_loss: 0.7542, test_loss: 0.9590, test_f1: 0.5325
 epoch: 78, train_loss: 0.7424, test_loss: 0.9251, test_f1: 0.5621
 epoch: 79, train_loss: 0.7527, test_loss: 0.8974, test_f1: 0.5806
 epoch: 80, train_loss: 0.7436, test_loss: 0.9347, test_f1: 0.5945
 epoch: 81, train_loss: 0.7422, test_loss: 0.9896, test_f1: 0.5590
 epoch: 82, train_loss: 0.7489, test_loss: 0.9010, test_f1: 0.5947
 epoch: 83, train_loss: 0.7500, test_loss: 0.9860, test_f1: 0.5746
 epoch: 84, train_loss: 0.7453, test_loss: 0.9148, test_f1: 0.5921
 epoch: 85, train_loss: 0.7529, test_loss: 0.9501, test_f1: 0.5710
 epoch: 86, train_loss: 0.7528, test_loss: 0.9263, test_f1: 0.5843
 epoch: 87, train_loss: 0.7390, test_loss: 0.9183, test_f1: 0.5705
 epoch: 88, train_loss: 0.7397, test_loss: 0.9719, test_f1: 0.5917
 epoch: 89, train_loss: 0.7458, test_loss: 0.8773, test_f1: 0.6063
 epoch: 90, train_loss: 0.7602, test_loss: 0.9032, test_f1: 0.5838
 epoch: 91, train_loss: 0.7410, test_loss: 0.9856, test_f1: 0.5715
 epoch: 92, train_loss: 0.7318, test_loss: 1.0260, test_f1: 0.5422
 epoch: 93, train_loss: 0.7447, test_loss: 0.9256, test_f1: 0.5624
 epoch: 94, train_loss: 0.7514, test_loss: 0.9622, test_f1: 0.5984
 epoch: 95, train_loss: 0.7344, test_loss: 0.9283, test_f1: 0.5612
 epoch: 96, train_loss: 0.7414, test_loss: 0.9443, test_f1: 0.5946
 epoch: 97, train_loss: 0.7267, test_loss: 0.9402, test_f1: 0.5982
 epoch: 98, train_loss: 0.7136, test_loss: 0.9327, test_f1: 0.5963
 epoch: 99, train_loss: 0.7417, test_loss: 0.9105, test_f1: 0.6024
##################ITERATION #7 ****************************************
 epoch: 0, train_loss: 1.4017, test_loss: 1.2924, test_f1: 0.2270
 epoch: 1, train_loss: 1.1465, test_loss: 1.1610, test_f1: 0.3295
 epoch: 2, train_loss: 1.0709, test_loss: 1.0325, test_f1: 0.4189
 epoch: 3, train_loss: 1.0384, test_loss: 0.9960, test_f1: 0.4278
 epoch: 4, train_loss: 1.0229, test_loss: 1.0017, test_f1: 0.4660
 epoch: 5, train_loss: 1.0126, test_loss: 1.0184, test_f1: 0.4325
 epoch: 6, train_loss: 1.0051, test_loss: 1.0014, test_f1: 0.4743
 epoch: 7, train_loss: 0.9768, test_loss: 1.0377, test_f1: 0.4582
 epoch: 8, train_loss: 0.9577, test_loss: 1.0050, test_f1: 0.4832
 epoch: 9, train_loss: 0.9462, test_loss: 1.0410, test_f1: 0.4543
 epoch: 10, train_loss: 0.9448, test_loss: 1.0026, test_f1: 0.4871
 epoch: 11, train_loss: 0.9479, test_loss: 0.9854, test_f1: 0.4825
 epoch: 12, train_loss: 0.9338, test_loss: 0.9716, test_f1: 0.4604
 epoch: 13, train_loss: 0.9159, test_loss: 0.9557, test_f1: 0.4749
 epoch: 14, train_loss: 0.9128, test_loss: 0.9969, test_f1: 0.5255
 epoch: 15, train_loss: 0.9112, test_loss: 0.9890, test_f1: 0.4987
 epoch: 16, train_loss: 0.9131, test_loss: 0.9697, test_f1: 0.5030
 epoch: 17, train_loss: 0.9076, test_loss: 0.9765, test_f1: 0.5360
 epoch: 18, train_loss: 0.9034, test_loss: 0.9547, test_f1: 0.4935
 epoch: 19, train_loss: 0.8995, test_loss: 0.9543, test_f1: 0.4944
 epoch: 20, train_loss: 0.8842, test_loss: 1.1117, test_f1: 0.4409
 epoch: 21, train_loss: 0.8753, test_loss: 0.9426, test_f1: 0.5333
 epoch: 22, train_loss: 0.8767, test_loss: 1.0454, test_f1: 0.4728
 epoch: 23, train_loss: 0.8827, test_loss: 0.9199, test_f1: 0.5317
 epoch: 24, train_loss: 0.8534, test_loss: 0.9303, test_f1: 0.5190
 epoch: 25, train_loss: 0.8655, test_loss: 0.9620, test_f1: 0.5238
 epoch: 26, train_loss: 0.8503, test_loss: 0.9176, test_f1: 0.5258
 epoch: 27, train_loss: 0.8530, test_loss: 0.9425, test_f1: 0.5259
 epoch: 28, train_loss: 0.8507, test_loss: 1.0079, test_f1: 0.4999
 epoch: 29, train_loss: 0.8554, test_loss: 1.0068, test_f1: 0.4970
 epoch: 30, train_loss: 0.8662, test_loss: 0.9839, test_f1: 0.4907
 epoch: 31, train_loss: 0.8483, test_loss: 0.8959, test_f1: 0.5218
 epoch: 32, train_loss: 0.8426, test_loss: 0.9133, test_f1: 0.5377
 epoch: 33, train_loss: 0.8309, test_loss: 0.8861, test_f1: 0.5218
 epoch: 34, train_loss: 0.8210, test_loss: 0.8805, test_f1: 0.5268
 epoch: 35, train_loss: 0.8283, test_loss: 0.8675, test_f1: 0.5274
 epoch: 36, train_loss: 0.8231, test_loss: 0.8887, test_f1: 0.5758
 epoch: 37, train_loss: 0.8276, test_loss: 0.9406, test_f1: 0.5121
 epoch: 38, train_loss: 0.8140, test_loss: 0.8964, test_f1: 0.5528
 epoch: 39, train_loss: 0.8198, test_loss: 0.8959, test_f1: 0.5525
 epoch: 40, train_loss: 0.8064, test_loss: 0.9186, test_f1: 0.5151
 epoch: 41, train_loss: 0.8111, test_loss: 0.9435, test_f1: 0.5031
 epoch: 42, train_loss: 0.8033, test_loss: 0.9032, test_f1: 0.5646
 epoch: 43, train_loss: 0.8162, test_loss: 1.0270, test_f1: 0.5130
 epoch: 44, train_loss: 0.8000, test_loss: 0.9041, test_f1: 0.5917
 epoch: 45, train_loss: 0.7985, test_loss: 0.9430, test_f1: 0.5453
 epoch: 46, train_loss: 0.8045, test_loss: 0.9248, test_f1: 0.5339
 epoch: 47, train_loss: 0.7794, test_loss: 0.8981, test_f1: 0.5770
 epoch: 48, train_loss: 0.7945, test_loss: 0.9304, test_f1: 0.5547
 epoch: 49, train_loss: 0.7703, test_loss: 1.0129, test_f1: 0.5356
 epoch: 50, train_loss: 0.7889, test_loss: 1.3639, test_f1: 0.5060
 epoch: 51, train_loss: 0.7839, test_loss: 0.9122, test_f1: 0.5846
 epoch: 52, train_loss: 0.7603, test_loss: 0.8843, test_f1: 0.6153
 epoch: 53, train_loss: 0.7556, test_loss: 0.8965, test_f1: 0.5801
 epoch: 54, train_loss: 0.7528, test_loss: 0.8812, test_f1: 0.6323
 epoch: 55, train_loss: 0.7358, test_loss: 0.8953, test_f1: 0.6034
 epoch: 56, train_loss: 0.7386, test_loss: 0.9054, test_f1: 0.6436
 epoch: 57, train_loss: 0.7381, test_loss: 0.8960, test_f1: 0.5946
 epoch: 58, train_loss: 0.7432, test_loss: 0.9112, test_f1: 0.6219
 epoch: 59, train_loss: 0.7542, test_loss: 0.9233, test_f1: 0.5738
 epoch: 60, train_loss: 0.7485, test_loss: 0.8992, test_f1: 0.5753
 epoch: 61, train_loss: 0.7331, test_loss: 0.9178, test_f1: 0.5954
 epoch: 62, train_loss: 0.7310, test_loss: 0.8920, test_f1: 0.6176
 epoch: 63, train_loss: 0.7293, test_loss: 0.9257, test_f1: 0.6134
 epoch: 64, train_loss: 0.7305, test_loss: 0.8805, test_f1: 0.5933
 epoch: 65, train_loss: 0.7433, test_loss: 0.8531, test_f1: 0.5889
 epoch: 66, train_loss: 0.7296, test_loss: 0.9838, test_f1: 0.6044
 epoch: 67, train_loss: 0.7240, test_loss: 0.9335, test_f1: 0.5751
 epoch: 68, train_loss: 0.7286, test_loss: 0.8868, test_f1: 0.6113
 epoch: 69, train_loss: 0.7167, test_loss: 0.9231, test_f1: 0.6092
 epoch: 70, train_loss: 0.7165, test_loss: 0.8648, test_f1: 0.6325
 epoch: 71, train_loss: 0.7231, test_loss: 0.9804, test_f1: 0.6089
 epoch: 72, train_loss: 0.7200, test_loss: 0.9429, test_f1: 0.5812
 epoch: 73, train_loss: 0.7225, test_loss: 0.9179, test_f1: 0.5914
 epoch: 74, train_loss: 0.7235, test_loss: 0.8651, test_f1: 0.6385
 epoch: 75, train_loss: 0.7127, test_loss: 0.8771, test_f1: 0.6210
 epoch: 76, train_loss: 0.7038, test_loss: 0.9081, test_f1: 0.6320
 epoch: 77, train_loss: 0.7195, test_loss: 0.8428, test_f1: 0.6007
 epoch: 78, train_loss: 0.7092, test_loss: 0.8555, test_f1: 0.6085
 epoch: 79, train_loss: 0.7053, test_loss: 0.8762, test_f1: 0.6148
 epoch: 80, train_loss: 0.6924, test_loss: 0.9046, test_f1: 0.6104
 epoch: 81, train_loss: 0.6994, test_loss: 0.9412, test_f1: 0.6173
 epoch: 82, train_loss: 0.7064, test_loss: 0.9120, test_f1: 0.5948
 epoch: 83, train_loss: 0.7138, test_loss: 0.9248, test_f1: 0.6030
 epoch: 84, train_loss: 0.6888, test_loss: 0.8587, test_f1: 0.5998
 epoch: 85, train_loss: 0.6952, test_loss: 0.8506, test_f1: 0.6324
 epoch: 86, train_loss: 0.7033, test_loss: 0.9501, test_f1: 0.6084
 epoch: 87, train_loss: 0.7085, test_loss: 0.8965, test_f1: 0.6054
 epoch: 88, train_loss: 0.6946, test_loss: 0.8603, test_f1: 0.6251
 epoch: 89, train_loss: 0.6961, test_loss: 0.9376, test_f1: 0.6036
 epoch: 90, train_loss: 0.7047, test_loss: 0.9434, test_f1: 0.5820
 epoch: 91, train_loss: 0.6919, test_loss: 0.8274, test_f1: 0.6221
 epoch: 92, train_loss: 0.7030, test_loss: 0.9030, test_f1: 0.5836
 epoch: 93, train_loss: 0.6912, test_loss: 0.9206, test_f1: 0.5969
 epoch: 94, train_loss: 0.6808, test_loss: 0.9094, test_f1: 0.5919
 epoch: 95, train_loss: 0.6925, test_loss: 0.9273, test_f1: 0.5794
 epoch: 96, train_loss: 0.6951, test_loss: 0.8616, test_f1: 0.6196
 epoch: 97, train_loss: 0.6845, test_loss: 0.9249, test_f1: 0.5892
 epoch: 98, train_loss: 0.6876, test_loss: 0.9002, test_f1: 0.6208
 epoch: 99, train_loss: 0.6948, test_loss: 0.9854, test_f1: 0.6186
##################ITERATION #8 ****************************************
 epoch: 0, train_loss: 1.4508, test_loss: 1.4158, test_f1: 0.2270
 epoch: 1, train_loss: 1.1741, test_loss: 1.3407, test_f1: 0.2270
 epoch: 2, train_loss: 1.1367, test_loss: 1.2021, test_f1: 0.2764
 epoch: 3, train_loss: 1.0854, test_loss: 1.1099, test_f1: 0.3380
 epoch: 4, train_loss: 1.0426, test_loss: 1.1089, test_f1: 0.3973
 epoch: 5, train_loss: 1.0310, test_loss: 1.0573, test_f1: 0.4231
 epoch: 6, train_loss: 0.9982, test_loss: 1.0695, test_f1: 0.4270
 epoch: 7, train_loss: 0.9912, test_loss: 0.9757, test_f1: 0.4628
 epoch: 8, train_loss: 0.9736, test_loss: 0.9965, test_f1: 0.4692
 epoch: 9, train_loss: 0.9598, test_loss: 1.1058, test_f1: 0.4642
 epoch: 10, train_loss: 0.9495, test_loss: 0.9673, test_f1: 0.4653
 epoch: 11, train_loss: 0.9478, test_loss: 1.1743, test_f1: 0.4097
 epoch: 12, train_loss: 0.9406, test_loss: 1.0182, test_f1: 0.5094
 epoch: 13, train_loss: 0.9322, test_loss: 1.0458, test_f1: 0.4714
 epoch: 14, train_loss: 0.9275, test_loss: 1.0856, test_f1: 0.4677
 epoch: 15, train_loss: 0.9070, test_loss: 1.0154, test_f1: 0.4647
 epoch: 16, train_loss: 0.9052, test_loss: 0.9763, test_f1: 0.5209
 epoch: 17, train_loss: 0.8899, test_loss: 1.2399, test_f1: 0.4401
 epoch: 18, train_loss: 0.8954, test_loss: 1.0743, test_f1: 0.4565
 epoch: 19, train_loss: 0.8932, test_loss: 1.0086, test_f1: 0.4862
 epoch: 20, train_loss: 0.8923, test_loss: 1.0451, test_f1: 0.4801
 epoch: 21, train_loss: 0.9015, test_loss: 1.0545, test_f1: 0.4689
 epoch: 22, train_loss: 0.8961, test_loss: 1.0563, test_f1: 0.4649
 epoch: 23, train_loss: 0.8974, test_loss: 1.0341, test_f1: 0.4753
 epoch: 24, train_loss: 0.8887, test_loss: 0.9573, test_f1: 0.4933
 epoch: 25, train_loss: 0.8775, test_loss: 0.9919, test_f1: 0.4984
 epoch: 26, train_loss: 0.8769, test_loss: 1.0584, test_f1: 0.4664
 epoch: 27, train_loss: 0.8701, test_loss: 0.9541, test_f1: 0.5366
 epoch: 28, train_loss: 0.8728, test_loss: 1.0859, test_f1: 0.4785
 epoch: 29, train_loss: 0.8701, test_loss: 0.9536, test_f1: 0.5037
 epoch: 30, train_loss: 0.8616, test_loss: 0.8803, test_f1: 0.5298
 epoch: 31, train_loss: 0.8664, test_loss: 1.0342, test_f1: 0.4978
 epoch: 32, train_loss: 0.8657, test_loss: 0.9464, test_f1: 0.4972
 epoch: 33, train_loss: 0.8510, test_loss: 0.9089, test_f1: 0.5429
 epoch: 34, train_loss: 0.8568, test_loss: 0.9375, test_f1: 0.4928
 epoch: 35, train_loss: 0.8342, test_loss: 0.9058, test_f1: 0.5276
 epoch: 36, train_loss: 0.8450, test_loss: 1.0299, test_f1: 0.4893
 epoch: 37, train_loss: 0.8553, test_loss: 1.0478, test_f1: 0.4853
 epoch: 38, train_loss: 0.8631, test_loss: 0.8796, test_f1: 0.5250
 epoch: 39, train_loss: 0.8449, test_loss: 1.1064, test_f1: 0.4676
 epoch: 40, train_loss: 0.8356, test_loss: 1.1026, test_f1: 0.4774
 epoch: 41, train_loss: 0.8381, test_loss: 0.9830, test_f1: 0.5143
 epoch: 42, train_loss: 0.8534, test_loss: 1.0350, test_f1: 0.4618
 epoch: 43, train_loss: 0.8393, test_loss: 0.9244, test_f1: 0.5115
 epoch: 44, train_loss: 0.8468, test_loss: 1.0194, test_f1: 0.4895
 epoch: 45, train_loss: 0.8506, test_loss: 1.0639, test_f1: 0.5024
 epoch: 46, train_loss: 0.8428, test_loss: 0.9671, test_f1: 0.5075
 epoch: 47, train_loss: 0.8296, test_loss: 0.9272, test_f1: 0.5088
 epoch: 48, train_loss: 0.8417, test_loss: 0.9661, test_f1: 0.5138
 epoch: 49, train_loss: 0.8294, test_loss: 0.9469, test_f1: 0.5246
 epoch: 50, train_loss: 0.8235, test_loss: 0.9610, test_f1: 0.5154
 epoch: 51, train_loss: 0.8119, test_loss: 0.9410, test_f1: 0.5484
 epoch: 52, train_loss: 0.8055, test_loss: 0.9062, test_f1: 0.5197
 epoch: 53, train_loss: 0.7920, test_loss: 0.8992, test_f1: 0.5404
 epoch: 54, train_loss: 0.7870, test_loss: 0.9189, test_f1: 0.5276
 epoch: 55, train_loss: 0.7961, test_loss: 1.0355, test_f1: 0.5102
 epoch: 56, train_loss: 0.7841, test_loss: 0.9506, test_f1: 0.5318
 epoch: 57, train_loss: 0.7804, test_loss: 0.9421, test_f1: 0.5498
 epoch: 58, train_loss: 0.7710, test_loss: 1.0237, test_f1: 0.5257
 epoch: 59, train_loss: 0.7807, test_loss: 0.9498, test_f1: 0.5630
 epoch: 60, train_loss: 0.7845, test_loss: 0.9808, test_f1: 0.5093
 epoch: 61, train_loss: 0.7783, test_loss: 0.9808, test_f1: 0.5199
 epoch: 62, train_loss: 0.7735, test_loss: 0.9419, test_f1: 0.5343
 epoch: 63, train_loss: 0.7855, test_loss: 0.9852, test_f1: 0.5399
 epoch: 64, train_loss: 0.7827, test_loss: 0.9765, test_f1: 0.5455
 epoch: 65, train_loss: 0.7756, test_loss: 0.9356, test_f1: 0.5724
 epoch: 66, train_loss: 0.7773, test_loss: 0.9611, test_f1: 0.5507
 epoch: 67, train_loss: 0.7723, test_loss: 0.9710, test_f1: 0.5239
 epoch: 68, train_loss: 0.7686, test_loss: 0.9097, test_f1: 0.5531
 epoch: 69, train_loss: 0.7560, test_loss: 1.1070, test_f1: 0.5039
 epoch: 70, train_loss: 0.7608, test_loss: 0.9363, test_f1: 0.5613
 epoch: 71, train_loss: 0.7784, test_loss: 0.9935, test_f1: 0.5165
 epoch: 72, train_loss: 0.7682, test_loss: 0.9895, test_f1: 0.5530
 epoch: 73, train_loss: 0.7737, test_loss: 0.9318, test_f1: 0.5252
 epoch: 74, train_loss: 0.7701, test_loss: 0.9708, test_f1: 0.5247
 epoch: 75, train_loss: 0.7699, test_loss: 0.9362, test_f1: 0.5464
 epoch: 76, train_loss: 0.7721, test_loss: 1.0026, test_f1: 0.5211
 epoch: 77, train_loss: 0.7587, test_loss: 0.9766, test_f1: 0.5510
 epoch: 78, train_loss: 0.7526, test_loss: 1.0280, test_f1: 0.5459
 epoch: 79, train_loss: 0.7580, test_loss: 0.9470, test_f1: 0.5806
 epoch: 80, train_loss: 0.7373, test_loss: 0.9436, test_f1: 0.5429
 epoch: 81, train_loss: 0.7470, test_loss: 1.0360, test_f1: 0.5119
 epoch: 82, train_loss: 0.7461, test_loss: 1.0122, test_f1: 0.5416
 epoch: 83, train_loss: 0.7484, test_loss: 1.0356, test_f1: 0.5348
 epoch: 84, train_loss: 0.7492, test_loss: 0.9586, test_f1: 0.5575
 epoch: 85, train_loss: 0.7430, test_loss: 0.9795, test_f1: 0.5570
 epoch: 86, train_loss: 0.7478, test_loss: 0.9568, test_f1: 0.5557
 epoch: 87, train_loss: 0.7313, test_loss: 0.9372, test_f1: 0.5720
 epoch: 88, train_loss: 0.7334, test_loss: 1.0112, test_f1: 0.5664
 epoch: 89, train_loss: 0.7408, test_loss: 1.0369, test_f1: 0.5598
 epoch: 90, train_loss: 0.7366, test_loss: 0.9583, test_f1: 0.5834
 epoch: 91, train_loss: 0.7218, test_loss: 1.0192, test_f1: 0.5681
 epoch: 92, train_loss: 0.7442, test_loss: 1.1089, test_f1: 0.5450
 epoch: 93, train_loss: 0.7560, test_loss: 0.9718, test_f1: 0.5396
 epoch: 94, train_loss: 0.7614, test_loss: 0.9864, test_f1: 0.5380
 epoch: 95, train_loss: 0.7426, test_loss: 1.0016, test_f1: 0.5772
 epoch: 96, train_loss: 0.7439, test_loss: 1.0631, test_f1: 0.5383
 epoch: 97, train_loss: 0.7453, test_loss: 1.0132, test_f1: 0.5700
 epoch: 98, train_loss: 0.7408, test_loss: 0.9676, test_f1: 0.5607
 epoch: 99, train_loss: 0.7354, test_loss: 0.9973, test_f1: 0.5619
##################ITERATION #9 ****************************************
 epoch: 0, train_loss: 1.3650, test_loss: 1.3702, test_f1: 0.2270
 epoch: 1, train_loss: 1.0987, test_loss: 1.2259, test_f1: 0.2320
 epoch: 2, train_loss: 1.0505, test_loss: 1.1155, test_f1: 0.3583
 epoch: 3, train_loss: 1.0177, test_loss: 1.0675, test_f1: 0.4251
 epoch: 4, train_loss: 0.9848, test_loss: 1.0234, test_f1: 0.4130
 epoch: 5, train_loss: 0.9669, test_loss: 0.9831, test_f1: 0.4652
 epoch: 6, train_loss: 0.9565, test_loss: 1.0248, test_f1: 0.4389
 epoch: 7, train_loss: 0.9577, test_loss: 0.9575, test_f1: 0.4908
 epoch: 8, train_loss: 0.9475, test_loss: 0.9212, test_f1: 0.5259
 epoch: 9, train_loss: 0.9352, test_loss: 0.9577, test_f1: 0.4668
 epoch: 10, train_loss: 0.9201, test_loss: 0.9117, test_f1: 0.5441
 epoch: 11, train_loss: 0.9175, test_loss: 1.0567, test_f1: 0.4437
 epoch: 12, train_loss: 0.9246, test_loss: 0.8953, test_f1: 0.5196
 epoch: 13, train_loss: 0.9128, test_loss: 0.9044, test_f1: 0.5069
 epoch: 14, train_loss: 0.9117, test_loss: 0.9498, test_f1: 0.5284
 epoch: 15, train_loss: 0.9047, test_loss: 0.9627, test_f1: 0.4725
 epoch: 16, train_loss: 0.8946, test_loss: 0.8953, test_f1: 0.4930
 epoch: 17, train_loss: 0.9074, test_loss: 0.9383, test_f1: 0.4892
 epoch: 18, train_loss: 0.8902, test_loss: 0.9125, test_f1: 0.5064
 epoch: 19, train_loss: 0.8911, test_loss: 0.9093, test_f1: 0.5046
 epoch: 20, train_loss: 0.8795, test_loss: 0.9486, test_f1: 0.5260
 epoch: 21, train_loss: 0.8795, test_loss: 0.9493, test_f1: 0.5125
 epoch: 22, train_loss: 0.8768, test_loss: 0.8807, test_f1: 0.5156
 epoch: 23, train_loss: 0.8600, test_loss: 0.9190, test_f1: 0.5522
 epoch: 24, train_loss: 0.8463, test_loss: 0.8735, test_f1: 0.5168
 epoch: 25, train_loss: 0.8822, test_loss: 1.1447, test_f1: 0.4590
 epoch: 26, train_loss: 0.8799, test_loss: 0.8935, test_f1: 0.5396
 epoch: 27, train_loss: 0.8653, test_loss: 0.8949, test_f1: 0.5097
 epoch: 28, train_loss: 0.8467, test_loss: 0.8600, test_f1: 0.5202
 epoch: 29, train_loss: 0.8369, test_loss: 0.9000, test_f1: 0.5304
 epoch: 30, train_loss: 0.8351, test_loss: 0.9261, test_f1: 0.5408
 epoch: 31, train_loss: 0.8265, test_loss: 0.9186, test_f1: 0.5684
 epoch: 32, train_loss: 0.8247, test_loss: 0.9327, test_f1: 0.5007
 epoch: 33, train_loss: 0.8197, test_loss: 0.9472, test_f1: 0.5035
 epoch: 34, train_loss: 0.8306, test_loss: 0.9085, test_f1: 0.5469
 epoch: 35, train_loss: 0.8242, test_loss: 0.9012, test_f1: 0.5261
 epoch: 36, train_loss: 0.8343, test_loss: 0.9237, test_f1: 0.5472
 epoch: 37, train_loss: 0.8065, test_loss: 0.9181, test_f1: 0.5419
 epoch: 38, train_loss: 0.8036, test_loss: 1.0192, test_f1: 0.4916
 epoch: 39, train_loss: 0.8141, test_loss: 0.9188, test_f1: 0.5645
 epoch: 40, train_loss: 0.8096, test_loss: 0.9354, test_f1: 0.5165
 epoch: 41, train_loss: 0.8028, test_loss: 0.9399, test_f1: 0.5430
 epoch: 42, train_loss: 0.7971, test_loss: 0.8960, test_f1: 0.5413
 epoch: 43, train_loss: 0.7945, test_loss: 0.9211, test_f1: 0.5662
 epoch: 44, train_loss: 0.8013, test_loss: 0.9600, test_f1: 0.5043
 epoch: 45, train_loss: 0.7884, test_loss: 0.8891, test_f1: 0.5769
 epoch: 46, train_loss: 0.7644, test_loss: 0.9747, test_f1: 0.5280
 epoch: 47, train_loss: 0.7836, test_loss: 0.9011, test_f1: 0.5984
 epoch: 48, train_loss: 0.7838, test_loss: 0.9186, test_f1: 0.5586
 epoch: 49, train_loss: 0.7956, test_loss: 0.9644, test_f1: 0.5856
 epoch: 50, train_loss: 0.7917, test_loss: 1.0188, test_f1: 0.5350
 epoch: 51, train_loss: 0.7931, test_loss: 0.8880, test_f1: 0.5738
 epoch: 52, train_loss: 0.7498, test_loss: 0.8941, test_f1: 0.5659
 epoch: 53, train_loss: 0.7468, test_loss: 0.9361, test_f1: 0.5617
 epoch: 54, train_loss: 0.7223, test_loss: 0.9019, test_f1: 0.5706
 epoch: 55, train_loss: 0.7333, test_loss: 0.9156, test_f1: 0.5713
 epoch: 56, train_loss: 0.7206, test_loss: 0.9374, test_f1: 0.5803
 epoch: 57, train_loss: 0.7331, test_loss: 0.9107, test_f1: 0.5934
 epoch: 58, train_loss: 0.7195, test_loss: 0.9654, test_f1: 0.5419
 epoch: 59, train_loss: 0.7252, test_loss: 0.9384, test_f1: 0.5901
 epoch: 60, train_loss: 0.7354, test_loss: 0.9696, test_f1: 0.5697
 epoch: 61, train_loss: 0.7292, test_loss: 0.9723, test_f1: 0.5649
 epoch: 62, train_loss: 0.7159, test_loss: 0.9227, test_f1: 0.5792
 epoch: 63, train_loss: 0.7197, test_loss: 0.9792, test_f1: 0.5792
 epoch: 64, train_loss: 0.7152, test_loss: 0.9137, test_f1: 0.5727
 epoch: 65, train_loss: 0.7176, test_loss: 0.9555, test_f1: 0.5490
 epoch: 66, train_loss: 0.7175, test_loss: 0.9898, test_f1: 0.5821
 epoch: 67, train_loss: 0.7319, test_loss: 0.9407, test_f1: 0.5957
 epoch: 68, train_loss: 0.7092, test_loss: 0.9791, test_f1: 0.5722
 epoch: 69, train_loss: 0.7205, test_loss: 0.9327, test_f1: 0.5759
 epoch: 70, train_loss: 0.7191, test_loss: 0.9718, test_f1: 0.5662
 epoch: 71, train_loss: 0.6984, test_loss: 0.9190, test_f1: 0.6027
 epoch: 72, train_loss: 0.7135, test_loss: 0.9372, test_f1: 0.5903
 epoch: 73, train_loss: 0.7002, test_loss: 0.9387, test_f1: 0.5814
 epoch: 74, train_loss: 0.7086, test_loss: 0.9346, test_f1: 0.6051
 epoch: 75, train_loss: 0.6912, test_loss: 1.0231, test_f1: 0.5829
 epoch: 76, train_loss: 0.6995, test_loss: 0.9240, test_f1: 0.6062
 epoch: 77, train_loss: 0.6996, test_loss: 0.9871, test_f1: 0.5906
 epoch: 78, train_loss: 0.7041, test_loss: 0.9823, test_f1: 0.5895
 epoch: 79, train_loss: 0.6833, test_loss: 1.0109, test_f1: 0.5739
 epoch: 80, train_loss: 0.6990, test_loss: 0.9797, test_f1: 0.5886
 epoch: 81, train_loss: 0.7055, test_loss: 1.0158, test_f1: 0.5866
 epoch: 82, train_loss: 0.6987, test_loss: 0.9857, test_f1: 0.6034
 epoch: 83, train_loss: 0.6982, test_loss: 0.9502, test_f1: 0.6036
 epoch: 84, train_loss: 0.6843, test_loss: 0.9303, test_f1: 0.6005
 epoch: 85, train_loss: 0.6807, test_loss: 0.9044, test_f1: 0.6349
 epoch: 86, train_loss: 0.6751, test_loss: 0.9715, test_f1: 0.5810
 epoch: 87, train_loss: 0.6833, test_loss: 0.9163, test_f1: 0.6028
 epoch: 88, train_loss: 0.6817, test_loss: 0.9574, test_f1: 0.5811
 epoch: 89, train_loss: 0.6914, test_loss: 0.9791, test_f1: 0.5831
 epoch: 90, train_loss: 0.6954, test_loss: 0.9195, test_f1: 0.5821
 epoch: 91, train_loss: 0.6968, test_loss: 0.9055, test_f1: 0.6035
 epoch: 92, train_loss: 0.6900, test_loss: 0.9675, test_f1: 0.5733
 epoch: 93, train_loss: 0.6980, test_loss: 0.9391, test_f1: 0.6307
 epoch: 94, train_loss: 0.6914, test_loss: 0.9075, test_f1: 0.5981
 epoch: 95, train_loss: 0.6778, test_loss: 0.9481, test_f1: 0.6014
 epoch: 96, train_loss: 0.6883, test_loss: 0.9568, test_f1: 0.5860
 epoch: 97, train_loss: 0.7018, test_loss: 0.9253, test_f1: 0.6251
 epoch: 98, train_loss: 0.6858, test_loss: 0.9156, test_f1: 0.6103
 epoch: 99, train_loss: 0.7037, test_loss: 0.9299, test_f1: 0.6339

Training completed in 491.65 seconds
Best F1: 0.6805 at epoch 91
Mean F1 across iterations: 0.6210  0.0287
========================FINAL RESULTS================================
FEGIN weighted F1: 0.6805  0.0287
python main.py --data ltspice_examples --representation component_net --model FEGIN --layers 3 --hiddens 16 --batch_size 256 --lr 0.01 --emb_size 250 --epochs 100 --save_appendix component_net_L3_H16_BS256_LR0.01_E250 --no_val
-----



STDERR:
  File "main.py", line 370, in <module>
    main()
  File "main.py", line 254, in main
    dataset = dataset_class(
  File "/home/philip/projects/llm_inference_code_repo/Circuit-Completion-Using-GNNs/component_classification_with_link_prediction_head/evaluation/FEGIN/kernel/circuit_datasets.py", line 15, in __init__
    self.data, self.slices = torch.load(self.processed_paths[0])
  File "/home/philip/.local/lib/python3.8/site-packages/torch/serialization.py", line 1040, in load
    warnings.warn(
  File "/usr/lib/python3.8/warnings.py", line 109, in _showwarnmsg
    sw(msg.message, msg.category, msg.filename, msg.lineno,
  File "main.py", line 47, in warn_with_traceback
    traceback.print_stack(file=log)
/home/philip/projects/llm_inference_code_repo/Circuit-Completion-Using-GNNs/component_classification_with_link_prediction_head/evaluation/FEGIN/kernel/circuit_datasets.py:15: FutureWarning: You are using `torch.load` with `weights_only=False` (the current default value), which uses the default pickle module implicitly. It is possible to construct malicious pickle data which will execute arbitrary code during unpickling (See https://github.com/pytorch/pytorch/blob/main/SECURITY.md#untrusted-models for more details). In a future release, the default value for `weights_only` will be flipped to `True`. This limits the functions that could be executed during unpickling. Arbitrary objects will no longer be allowed to be loaded via this mode unless they are explicitly allowlisted by the user via `torch.serialization.add_safe_globals`. We recommend you start setting `weights_only=True` for any use case where you don't have full control of the loaded file. Please open an issue on GitHub for any issues related to this experimental feature.
  self.data, self.slices = torch.load(self.processed_paths[0])
