STDOUT:
Results will be saved in /home/philip/projects/ltspice_examples_code_repo/Circuit-Completion-Using-GNNs/component_classification_with_link_prediction_head/evaluation/FEGIN/results/model_FEGIN_dataset_ltspice_examples
Command line input: python main.py --data ltspice_examples --representation component_component --model FEGIN --layers 3 --hiddens 16 --batch_size 256 --lr 0.001 --emb_size 128 --epochs 100 --save_appendix component_component_L3_H16_BS256_LR0.001_E128 --no_val
 is saved.
-----
ltspice_examples - FEGIN
Using 3 layers, 16 hidden units, h = 2
Loading component_component representation dataset
ENTERED
Training FEGIN on component_component representation
Train: 3556, Test: 845
##################ITERATION #0 ****************************************
 epoch: 0, train_loss: 1.3529, test_loss: 1.3466, test_f1: 0.2274
 epoch: 1, train_loss: 1.3288, test_loss: 1.3299, test_f1: 0.2274
 epoch: 2, train_loss: 1.3120, test_loss: 1.3086, test_f1: 0.2274
 epoch: 3, train_loss: 1.2965, test_loss: 1.2915, test_f1: 0.2274
 epoch: 4, train_loss: 1.2840, test_loss: 1.2821, test_f1: 0.2274
 epoch: 5, train_loss: 1.2761, test_loss: 1.2745, test_f1: 0.2274
 epoch: 6, train_loss: 1.2615, test_loss: 1.2633, test_f1: 0.2274
 epoch: 7, train_loss: 1.2526, test_loss: 1.2493, test_f1: 0.3042
 epoch: 8, train_loss: 1.2460, test_loss: 1.2376, test_f1: 0.3454
 epoch: 9, train_loss: 1.2367, test_loss: 1.2267, test_f1: 0.3494
 epoch: 10, train_loss: 1.2345, test_loss: 1.2220, test_f1: 0.3359
 epoch: 11, train_loss: 1.2206, test_loss: 1.2118, test_f1: 0.3387
 epoch: 12, train_loss: 1.2128, test_loss: 1.2053, test_f1: 0.3369
 epoch: 13, train_loss: 1.2024, test_loss: 1.1991, test_f1: 0.3405
 epoch: 14, train_loss: 1.1978, test_loss: 1.1964, test_f1: 0.3366
 epoch: 15, train_loss: 1.1929, test_loss: 1.1889, test_f1: 0.3565
 epoch: 16, train_loss: 1.1925, test_loss: 1.1797, test_f1: 0.3491
 epoch: 17, train_loss: 1.1803, test_loss: 1.1749, test_f1: 0.3504
 epoch: 18, train_loss: 1.1700, test_loss: 1.1710, test_f1: 0.3482
 epoch: 19, train_loss: 1.1705, test_loss: 1.1676, test_f1: 0.3495
 epoch: 20, train_loss: 1.1635, test_loss: 1.1675, test_f1: 0.3419
 epoch: 21, train_loss: 1.1586, test_loss: 1.1540, test_f1: 0.3446
 epoch: 22, train_loss: 1.1487, test_loss: 1.1513, test_f1: 0.3453
 epoch: 23, train_loss: 1.1461, test_loss: 1.1607, test_f1: 0.3489
 epoch: 24, train_loss: 1.1453, test_loss: 1.1483, test_f1: 0.3497
 epoch: 25, train_loss: 1.1302, test_loss: 1.1437, test_f1: 0.3946
 epoch: 26, train_loss: 1.1232, test_loss: 1.1360, test_f1: 0.4159
 epoch: 27, train_loss: 1.1190, test_loss: 1.1314, test_f1: 0.4228
 epoch: 28, train_loss: 1.1190, test_loss: 1.1312, test_f1: 0.4292
 epoch: 29, train_loss: 1.1083, test_loss: 1.1247, test_f1: 0.4305
 epoch: 30, train_loss: 1.1012, test_loss: 1.1184, test_f1: 0.4341
 epoch: 31, train_loss: 1.0962, test_loss: 1.1102, test_f1: 0.4329
 epoch: 32, train_loss: 1.0879, test_loss: 1.0953, test_f1: 0.4389
 epoch: 33, train_loss: 1.0723, test_loss: 1.1003, test_f1: 0.4346
 epoch: 34, train_loss: 1.0798, test_loss: 1.0942, test_f1: 0.4307
 epoch: 35, train_loss: 1.0804, test_loss: 1.0836, test_f1: 0.4370
 epoch: 36, train_loss: 1.0692, test_loss: 1.0767, test_f1: 0.4386
 epoch: 37, train_loss: 1.0608, test_loss: 1.0745, test_f1: 0.4407
 epoch: 38, train_loss: 1.0547, test_loss: 1.0649, test_f1: 0.4372
 epoch: 39, train_loss: 1.0453, test_loss: 1.0591, test_f1: 0.4484
 epoch: 40, train_loss: 1.0338, test_loss: 1.0530, test_f1: 0.4534
 epoch: 41, train_loss: 1.0337, test_loss: 1.0488, test_f1: 0.4441
 epoch: 42, train_loss: 1.0359, test_loss: 1.0432, test_f1: 0.4683
 epoch: 43, train_loss: 1.0301, test_loss: 1.0518, test_f1: 0.4595
 epoch: 44, train_loss: 1.0188, test_loss: 1.0540, test_f1: 0.4520
 epoch: 45, train_loss: 1.0126, test_loss: 1.0322, test_f1: 0.4789
 epoch: 46, train_loss: 1.0185, test_loss: 1.0384, test_f1: 0.4870
 epoch: 47, train_loss: 1.0022, test_loss: 1.0265, test_f1: 0.4691
 epoch: 48, train_loss: 1.0084, test_loss: 1.0288, test_f1: 0.4370
 epoch: 49, train_loss: 1.0007, test_loss: 1.0047, test_f1: 0.4960
 epoch: 50, train_loss: 0.9943, test_loss: 1.0297, test_f1: 0.4780
 epoch: 51, train_loss: 0.9873, test_loss: 1.0072, test_f1: 0.5004
 epoch: 52, train_loss: 0.9843, test_loss: 1.0020, test_f1: 0.5061
 epoch: 53, train_loss: 0.9821, test_loss: 1.0129, test_f1: 0.5033
 epoch: 54, train_loss: 0.9678, test_loss: 1.0023, test_f1: 0.5018
 epoch: 55, train_loss: 0.9728, test_loss: 1.0046, test_f1: 0.4888
 epoch: 56, train_loss: 0.9772, test_loss: 1.0090, test_f1: 0.4944
 epoch: 57, train_loss: 0.9753, test_loss: 1.0023, test_f1: 0.5045
 epoch: 58, train_loss: 0.9691, test_loss: 0.9927, test_f1: 0.5119
 epoch: 59, train_loss: 0.9654, test_loss: 0.9964, test_f1: 0.5106
 epoch: 60, train_loss: 0.9708, test_loss: 1.0005, test_f1: 0.5065
 epoch: 61, train_loss: 0.9554, test_loss: 0.9912, test_f1: 0.5148
 epoch: 62, train_loss: 0.9659, test_loss: 0.9864, test_f1: 0.5081
 epoch: 63, train_loss: 0.9562, test_loss: 0.9990, test_f1: 0.5072
 epoch: 64, train_loss: 0.9567, test_loss: 0.9882, test_f1: 0.5129
 epoch: 65, train_loss: 0.9551, test_loss: 0.9863, test_f1: 0.5177
 epoch: 66, train_loss: 0.9561, test_loss: 0.9865, test_f1: 0.5146
 epoch: 67, train_loss: 0.9534, test_loss: 0.9866, test_f1: 0.5178
 epoch: 68, train_loss: 0.9534, test_loss: 0.9854, test_f1: 0.5115
 epoch: 69, train_loss: 0.9527, test_loss: 0.9867, test_f1: 0.5221
 epoch: 70, train_loss: 0.9582, test_loss: 0.9895, test_f1: 0.5208
 epoch: 71, train_loss: 0.9460, test_loss: 0.9838, test_f1: 0.5126
 epoch: 72, train_loss: 0.9417, test_loss: 0.9843, test_f1: 0.5103
 epoch: 73, train_loss: 0.9468, test_loss: 0.9941, test_f1: 0.5185
 epoch: 74, train_loss: 0.9414, test_loss: 0.9792, test_f1: 0.5367
 epoch: 75, train_loss: 0.9378, test_loss: 0.9921, test_f1: 0.5143
 epoch: 76, train_loss: 0.9444, test_loss: 0.9823, test_f1: 0.5093
 epoch: 77, train_loss: 0.9428, test_loss: 0.9729, test_f1: 0.5300
 epoch: 78, train_loss: 0.9398, test_loss: 0.9667, test_f1: 0.5212
 epoch: 79, train_loss: 0.9293, test_loss: 0.9766, test_f1: 0.5254
 epoch: 80, train_loss: 0.9227, test_loss: 0.9757, test_f1: 0.5202
 epoch: 81, train_loss: 0.9343, test_loss: 0.9870, test_f1: 0.5182
 epoch: 82, train_loss: 0.9291, test_loss: 0.9836, test_f1: 0.5230
 epoch: 83, train_loss: 0.9271, test_loss: 0.9800, test_f1: 0.5310
 epoch: 84, train_loss: 0.9330, test_loss: 0.9739, test_f1: 0.5240
 epoch: 85, train_loss: 0.9225, test_loss: 0.9969, test_f1: 0.5131
 epoch: 86, train_loss: 0.9210, test_loss: 0.9844, test_f1: 0.5175
 epoch: 87, train_loss: 0.9203, test_loss: 0.9723, test_f1: 0.5252
 epoch: 88, train_loss: 0.9242, test_loss: 0.9711, test_f1: 0.5180
 epoch: 89, train_loss: 0.9144, test_loss: 0.9858, test_f1: 0.5140
 epoch: 90, train_loss: 0.9184, test_loss: 0.9874, test_f1: 0.5193
 epoch: 91, train_loss: 0.9168, test_loss: 0.9715, test_f1: 0.5345
 epoch: 92, train_loss: 0.9135, test_loss: 0.9878, test_f1: 0.5180
 epoch: 93, train_loss: 0.9093, test_loss: 0.9850, test_f1: 0.5009
 epoch: 94, train_loss: 0.9056, test_loss: 0.9808, test_f1: 0.5351
 epoch: 95, train_loss: 0.9108, test_loss: 0.9767, test_f1: 0.5231
 epoch: 96, train_loss: 0.9086, test_loss: 0.9761, test_f1: 0.5237
 epoch: 97, train_loss: 0.9069, test_loss: 0.9863, test_f1: 0.5099
 epoch: 98, train_loss: 0.9136, test_loss: 0.9945, test_f1: 0.5116
 epoch: 99, train_loss: 0.9005, test_loss: 0.9842, test_f1: 0.5058
##################ITERATION #1 ****************************************
 epoch: 0, train_loss: 1.3789, test_loss: 1.3784, test_f1: 0.2274
 epoch: 1, train_loss: 1.3294, test_loss: 1.3485, test_f1: 0.2274
 epoch: 2, train_loss: 1.3023, test_loss: 1.3056, test_f1: 0.2555
 epoch: 3, train_loss: 1.2851, test_loss: 1.2774, test_f1: 0.2555
 epoch: 4, train_loss: 1.2663, test_loss: 1.2598, test_f1: 0.2555
 epoch: 5, train_loss: 1.2554, test_loss: 1.2416, test_f1: 0.2621
 epoch: 6, train_loss: 1.2365, test_loss: 1.2218, test_f1: 0.3077
 epoch: 7, train_loss: 1.2301, test_loss: 1.2079, test_f1: 0.3224
 epoch: 8, train_loss: 1.2184, test_loss: 1.1988, test_f1: 0.3348
 epoch: 9, train_loss: 1.2091, test_loss: 1.1863, test_f1: 0.3402
 epoch: 10, train_loss: 1.1996, test_loss: 1.1790, test_f1: 0.3607
 epoch: 11, train_loss: 1.1919, test_loss: 1.1665, test_f1: 0.3986
 epoch: 12, train_loss: 1.1856, test_loss: 1.1610, test_f1: 0.3785
 epoch: 13, train_loss: 1.1806, test_loss: 1.1533, test_f1: 0.4013
 epoch: 14, train_loss: 1.1727, test_loss: 1.1557, test_f1: 0.4046
 epoch: 15, train_loss: 1.1721, test_loss: 1.1525, test_f1: 0.4036
 epoch: 16, train_loss: 1.1616, test_loss: 1.1498, test_f1: 0.4013
 epoch: 17, train_loss: 1.1551, test_loss: 1.1428, test_f1: 0.4064
 epoch: 18, train_loss: 1.1527, test_loss: 1.1407, test_f1: 0.4024
 epoch: 19, train_loss: 1.1447, test_loss: 1.1393, test_f1: 0.4153
 epoch: 20, train_loss: 1.1421, test_loss: 1.1279, test_f1: 0.4174
 epoch: 21, train_loss: 1.1315, test_loss: 1.1263, test_f1: 0.4369
 epoch: 22, train_loss: 1.1265, test_loss: 1.1191, test_f1: 0.4335
 epoch: 23, train_loss: 1.1270, test_loss: 1.1205, test_f1: 0.4381
 epoch: 24, train_loss: 1.1244, test_loss: 1.1143, test_f1: 0.4392
 epoch: 25, train_loss: 1.1169, test_loss: 1.1028, test_f1: 0.4469
 epoch: 26, train_loss: 1.1061, test_loss: 1.1143, test_f1: 0.4407
 epoch: 27, train_loss: 1.1077, test_loss: 1.1022, test_f1: 0.4496
 epoch: 28, train_loss: 1.1031, test_loss: 1.1151, test_f1: 0.4475
 epoch: 29, train_loss: 1.0959, test_loss: 1.0848, test_f1: 0.4607
 epoch: 30, train_loss: 1.0879, test_loss: 1.1374, test_f1: 0.4331
 epoch: 31, train_loss: 1.0892, test_loss: 1.0701, test_f1: 0.4685
 epoch: 32, train_loss: 1.0892, test_loss: 1.0659, test_f1: 0.4626
 epoch: 33, train_loss: 1.0830, test_loss: 1.0674, test_f1: 0.4534
 epoch: 34, train_loss: 1.0674, test_loss: 1.0644, test_f1: 0.4550
 epoch: 35, train_loss: 1.0708, test_loss: 1.0761, test_f1: 0.4386
 epoch: 36, train_loss: 1.0624, test_loss: 1.0992, test_f1: 0.4538
 epoch: 37, train_loss: 1.0735, test_loss: 1.0655, test_f1: 0.4587
 epoch: 38, train_loss: 1.0532, test_loss: 1.0632, test_f1: 0.4611
 epoch: 39, train_loss: 1.0576, test_loss: 1.0659, test_f1: 0.4491
 epoch: 40, train_loss: 1.0504, test_loss: 1.0705, test_f1: 0.4562
 epoch: 41, train_loss: 1.0428, test_loss: 1.0589, test_f1: 0.4511
 epoch: 42, train_loss: 1.0391, test_loss: 1.0816, test_f1: 0.4226
 epoch: 43, train_loss: 1.0335, test_loss: 1.0448, test_f1: 0.4629
 epoch: 44, train_loss: 1.0331, test_loss: 1.0707, test_f1: 0.4501
 epoch: 45, train_loss: 1.0398, test_loss: 1.0393, test_f1: 0.4556
 epoch: 46, train_loss: 1.0410, test_loss: 1.0657, test_f1: 0.4540
 epoch: 47, train_loss: 1.0274, test_loss: 1.0593, test_f1: 0.4352
 epoch: 48, train_loss: 1.0187, test_loss: 1.0684, test_f1: 0.4508
 epoch: 49, train_loss: 1.0212, test_loss: 1.0595, test_f1: 0.4433
 epoch: 50, train_loss: 1.0118, test_loss: 1.0272, test_f1: 0.4639
 epoch: 51, train_loss: 1.0120, test_loss: 1.0447, test_f1: 0.4477
 epoch: 52, train_loss: 1.0085, test_loss: 1.0194, test_f1: 0.4491
 epoch: 53, train_loss: 1.0007, test_loss: 1.0458, test_f1: 0.4384
 epoch: 54, train_loss: 0.9999, test_loss: 1.0267, test_f1: 0.4588
 epoch: 55, train_loss: 1.0044, test_loss: 1.0275, test_f1: 0.4549
 epoch: 56, train_loss: 1.0160, test_loss: 1.0289, test_f1: 0.4490
 epoch: 57, train_loss: 1.0077, test_loss: 1.0349, test_f1: 0.4531
 epoch: 58, train_loss: 0.9968, test_loss: 1.0136, test_f1: 0.4644
 epoch: 59, train_loss: 0.9944, test_loss: 1.0234, test_f1: 0.4600
 epoch: 60, train_loss: 0.9965, test_loss: 1.0195, test_f1: 0.4607
 epoch: 61, train_loss: 0.9961, test_loss: 1.0254, test_f1: 0.4654
 epoch: 62, train_loss: 0.9886, test_loss: 1.0225, test_f1: 0.4578
 epoch: 63, train_loss: 0.9871, test_loss: 1.0365, test_f1: 0.4629
 epoch: 64, train_loss: 0.9948, test_loss: 1.0168, test_f1: 0.4531
 epoch: 65, train_loss: 0.9904, test_loss: 1.0145, test_f1: 0.4694
 epoch: 66, train_loss: 0.9915, test_loss: 1.0311, test_f1: 0.4619
 epoch: 67, train_loss: 0.9927, test_loss: 1.0234, test_f1: 0.4537
 epoch: 68, train_loss: 0.9923, test_loss: 1.0152, test_f1: 0.4633
 epoch: 69, train_loss: 0.9827, test_loss: 1.0150, test_f1: 0.4646
 epoch: 70, train_loss: 0.9791, test_loss: 1.0291, test_f1: 0.4653
 epoch: 71, train_loss: 0.9777, test_loss: 1.0254, test_f1: 0.4562
 epoch: 72, train_loss: 0.9739, test_loss: 1.0333, test_f1: 0.4668
 epoch: 73, train_loss: 0.9844, test_loss: 1.0178, test_f1: 0.4705
 epoch: 74, train_loss: 0.9751, test_loss: 1.0313, test_f1: 0.4742
 epoch: 75, train_loss: 0.9695, test_loss: 1.0215, test_f1: 0.4898
 epoch: 76, train_loss: 0.9695, test_loss: 1.0242, test_f1: 0.4753
 epoch: 77, train_loss: 0.9741, test_loss: 1.0278, test_f1: 0.4794
 epoch: 78, train_loss: 0.9746, test_loss: 1.0274, test_f1: 0.4906
 epoch: 79, train_loss: 0.9765, test_loss: 1.0267, test_f1: 0.4737
 epoch: 80, train_loss: 0.9650, test_loss: 1.0304, test_f1: 0.4840
 epoch: 81, train_loss: 0.9747, test_loss: 1.0154, test_f1: 0.4760
 epoch: 82, train_loss: 0.9667, test_loss: 1.0483, test_f1: 0.4721
 epoch: 83, train_loss: 0.9727, test_loss: 1.0338, test_f1: 0.4754
 epoch: 84, train_loss: 0.9624, test_loss: 1.0259, test_f1: 0.4692
 epoch: 85, train_loss: 0.9588, test_loss: 1.0137, test_f1: 0.4904
 epoch: 86, train_loss: 0.9621, test_loss: 1.0090, test_f1: 0.4782
 epoch: 87, train_loss: 0.9691, test_loss: 1.0318, test_f1: 0.4836
 epoch: 88, train_loss: 0.9766, test_loss: 1.0293, test_f1: 0.4724
 epoch: 89, train_loss: 0.9598, test_loss: 1.0433, test_f1: 0.4701
 epoch: 90, train_loss: 0.9634, test_loss: 1.0168, test_f1: 0.4808
 epoch: 91, train_loss: 0.9587, test_loss: 1.0204, test_f1: 0.4848
 epoch: 92, train_loss: 0.9641, test_loss: 1.0355, test_f1: 0.4788
 epoch: 93, train_loss: 0.9525, test_loss: 1.0256, test_f1: 0.4804
 epoch: 94, train_loss: 0.9492, test_loss: 1.0165, test_f1: 0.4827
 epoch: 95, train_loss: 0.9498, test_loss: 1.0296, test_f1: 0.4843
 epoch: 96, train_loss: 0.9522, test_loss: 1.0288, test_f1: 0.4801
 epoch: 97, train_loss: 0.9600, test_loss: 1.0077, test_f1: 0.4789
 epoch: 98, train_loss: 0.9567, test_loss: 1.0318, test_f1: 0.4823
 epoch: 99, train_loss: 0.9494, test_loss: 0.9991, test_f1: 0.4884
##################ITERATION #2 ****************************************
 epoch: 0, train_loss: 1.3410, test_loss: 1.3315, test_f1: 0.2274
 epoch: 1, train_loss: 1.2935, test_loss: 1.3061, test_f1: 0.2274
 epoch: 2, train_loss: 1.2724, test_loss: 1.2805, test_f1: 0.2274
 epoch: 3, train_loss: 1.2607, test_loss: 1.2540, test_f1: 0.2274
 epoch: 4, train_loss: 1.2556, test_loss: 1.2377, test_f1: 0.2618
 epoch: 5, train_loss: 1.2388, test_loss: 1.2261, test_f1: 0.2742
 epoch: 6, train_loss: 1.2359, test_loss: 1.2158, test_f1: 0.2803
 epoch: 7, train_loss: 1.2258, test_loss: 1.2064, test_f1: 0.3235
 epoch: 8, train_loss: 1.2200, test_loss: 1.2016, test_f1: 0.3287
 epoch: 9, train_loss: 1.2113, test_loss: 1.1918, test_f1: 0.3248
 epoch: 10, train_loss: 1.2041, test_loss: 1.1718, test_f1: 0.3588
 epoch: 11, train_loss: 1.2005, test_loss: 1.2013, test_f1: 0.3680
 epoch: 12, train_loss: 1.1935, test_loss: 1.1611, test_f1: 0.3983
 epoch: 13, train_loss: 1.1893, test_loss: 1.1637, test_f1: 0.4175
 epoch: 14, train_loss: 1.1796, test_loss: 1.1438, test_f1: 0.4317
 epoch: 15, train_loss: 1.1679, test_loss: 1.1397, test_f1: 0.4328
 epoch: 16, train_loss: 1.1627, test_loss: 1.1342, test_f1: 0.4387
 epoch: 17, train_loss: 1.1518, test_loss: 1.1330, test_f1: 0.4375
 epoch: 18, train_loss: 1.1552, test_loss: 1.1203, test_f1: 0.4280
 epoch: 19, train_loss: 1.1518, test_loss: 1.1165, test_f1: 0.4339
 epoch: 20, train_loss: 1.1435, test_loss: 1.1112, test_f1: 0.4492
 epoch: 21, train_loss: 1.1408, test_loss: 1.1041, test_f1: 0.4275
 epoch: 22, train_loss: 1.1291, test_loss: 1.0945, test_f1: 0.4423
 epoch: 23, train_loss: 1.1243, test_loss: 1.0947, test_f1: 0.4244
 epoch: 24, train_loss: 1.1255, test_loss: 1.0996, test_f1: 0.4168
 epoch: 25, train_loss: 1.1182, test_loss: 1.1065, test_f1: 0.4119
 epoch: 26, train_loss: 1.1150, test_loss: 1.1074, test_f1: 0.4298
 epoch: 27, train_loss: 1.1059, test_loss: 1.0735, test_f1: 0.4438
 epoch: 28, train_loss: 1.0998, test_loss: 1.0892, test_f1: 0.4257
 epoch: 29, train_loss: 1.0938, test_loss: 1.0721, test_f1: 0.4504
 epoch: 30, train_loss: 1.0804, test_loss: 1.0542, test_f1: 0.4550
 epoch: 31, train_loss: 1.0825, test_loss: 1.0593, test_f1: 0.4317
 epoch: 32, train_loss: 1.0774, test_loss: 1.0562, test_f1: 0.4551
 epoch: 33, train_loss: 1.0754, test_loss: 1.0464, test_f1: 0.4589
 epoch: 34, train_loss: 1.0704, test_loss: 1.0447, test_f1: 0.4514
 epoch: 35, train_loss: 1.0656, test_loss: 1.0429, test_f1: 0.4456
 epoch: 36, train_loss: 1.0583, test_loss: 1.0149, test_f1: 0.4661
 epoch: 37, train_loss: 1.0606, test_loss: 1.0319, test_f1: 0.4524
 epoch: 38, train_loss: 1.0434, test_loss: 1.0177, test_f1: 0.4721
 epoch: 39, train_loss: 1.0527, test_loss: 1.0321, test_f1: 0.4577
 epoch: 40, train_loss: 1.0435, test_loss: 1.0169, test_f1: 0.4876
 epoch: 41, train_loss: 1.0468, test_loss: 0.9994, test_f1: 0.4836
 epoch: 42, train_loss: 1.0353, test_loss: 1.0214, test_f1: 0.4617
 epoch: 43, train_loss: 1.0254, test_loss: 0.9960, test_f1: 0.4750
 epoch: 44, train_loss: 1.0174, test_loss: 0.9913, test_f1: 0.4699
 epoch: 45, train_loss: 1.0264, test_loss: 0.9888, test_f1: 0.4808
 epoch: 46, train_loss: 1.0289, test_loss: 0.9838, test_f1: 0.4974
 epoch: 47, train_loss: 1.0202, test_loss: 0.9969, test_f1: 0.4788
 epoch: 48, train_loss: 1.0087, test_loss: 1.0032, test_f1: 0.4882
 epoch: 49, train_loss: 1.0100, test_loss: 0.9845, test_f1: 0.4887
 epoch: 50, train_loss: 1.0050, test_loss: 0.9954, test_f1: 0.5014
 epoch: 51, train_loss: 1.0160, test_loss: 0.9800, test_f1: 0.4892
 epoch: 52, train_loss: 0.9967, test_loss: 0.9810, test_f1: 0.4938
 epoch: 53, train_loss: 0.9951, test_loss: 0.9916, test_f1: 0.4941
 epoch: 54, train_loss: 0.9921, test_loss: 0.9758, test_f1: 0.4905
 epoch: 55, train_loss: 0.9908, test_loss: 0.9864, test_f1: 0.5098
 epoch: 56, train_loss: 0.9936, test_loss: 0.9835, test_f1: 0.4960
 epoch: 57, train_loss: 0.9788, test_loss: 0.9893, test_f1: 0.4861
 epoch: 58, train_loss: 0.9895, test_loss: 0.9856, test_f1: 0.4861
 epoch: 59, train_loss: 0.9900, test_loss: 0.9837, test_f1: 0.4948
 epoch: 60, train_loss: 0.9897, test_loss: 0.9894, test_f1: 0.5051
 epoch: 61, train_loss: 0.9791, test_loss: 0.9843, test_f1: 0.4985
 epoch: 62, train_loss: 0.9761, test_loss: 0.9840, test_f1: 0.4938
 epoch: 63, train_loss: 0.9680, test_loss: 0.9804, test_f1: 0.5034
 epoch: 64, train_loss: 0.9729, test_loss: 0.9857, test_f1: 0.4900
 epoch: 65, train_loss: 0.9839, test_loss: 0.9800, test_f1: 0.4950
 epoch: 66, train_loss: 0.9710, test_loss: 0.9813, test_f1: 0.4961
 epoch: 67, train_loss: 0.9850, test_loss: 0.9870, test_f1: 0.5067
 epoch: 68, train_loss: 0.9639, test_loss: 0.9847, test_f1: 0.4989
 epoch: 69, train_loss: 0.9632, test_loss: 0.9938, test_f1: 0.4838
 epoch: 70, train_loss: 0.9710, test_loss: 0.9931, test_f1: 0.4950
 epoch: 71, train_loss: 0.9688, test_loss: 0.9888, test_f1: 0.4923
 epoch: 72, train_loss: 0.9610, test_loss: 0.9887, test_f1: 0.4996
 epoch: 73, train_loss: 0.9670, test_loss: 0.9894, test_f1: 0.5003
 epoch: 74, train_loss: 0.9608, test_loss: 0.9849, test_f1: 0.4979
 epoch: 75, train_loss: 0.9606, test_loss: 0.9887, test_f1: 0.4969
 epoch: 76, train_loss: 0.9664, test_loss: 1.0030, test_f1: 0.5081
 epoch: 77, train_loss: 0.9606, test_loss: 0.9897, test_f1: 0.4997
 epoch: 78, train_loss: 0.9608, test_loss: 0.9949, test_f1: 0.4985
 epoch: 79, train_loss: 0.9630, test_loss: 1.0064, test_f1: 0.4887
 epoch: 80, train_loss: 0.9534, test_loss: 0.9926, test_f1: 0.4901
 epoch: 81, train_loss: 0.9574, test_loss: 0.9885, test_f1: 0.4994
 epoch: 82, train_loss: 0.9539, test_loss: 0.9945, test_f1: 0.4903
 epoch: 83, train_loss: 0.9544, test_loss: 0.9935, test_f1: 0.4963
 epoch: 84, train_loss: 0.9513, test_loss: 1.0048, test_f1: 0.5107
 epoch: 85, train_loss: 0.9527, test_loss: 1.0005, test_f1: 0.4934
 epoch: 86, train_loss: 0.9494, test_loss: 1.0024, test_f1: 0.4902
 epoch: 87, train_loss: 0.9447, test_loss: 0.9900, test_f1: 0.4953
 epoch: 88, train_loss: 0.9486, test_loss: 0.9990, test_f1: 0.4932
 epoch: 89, train_loss: 0.9449, test_loss: 0.9903, test_f1: 0.4953
 epoch: 90, train_loss: 0.9486, test_loss: 0.9929, test_f1: 0.4932
 epoch: 91, train_loss: 0.9475, test_loss: 1.0068, test_f1: 0.4985
 epoch: 92, train_loss: 0.9441, test_loss: 1.0068, test_f1: 0.4895
 epoch: 93, train_loss: 0.9396, test_loss: 1.0149, test_f1: 0.4858
 epoch: 94, train_loss: 0.9362, test_loss: 1.0083, test_f1: 0.4851
 epoch: 95, train_loss: 0.9389, test_loss: 1.0074, test_f1: 0.4856
 epoch: 96, train_loss: 0.9403, test_loss: 0.9992, test_f1: 0.4883
 epoch: 97, train_loss: 0.9409, test_loss: 1.0104, test_f1: 0.4963
 epoch: 98, train_loss: 0.9414, test_loss: 0.9979, test_f1: 0.4962
 epoch: 99, train_loss: 0.9305, test_loss: 1.0032, test_f1: 0.4861
##################ITERATION #3 ****************************************
 epoch: 0, train_loss: 1.4571, test_loss: 1.4386, test_f1: 0.2344
 epoch: 1, train_loss: 1.3241, test_loss: 1.3548, test_f1: 0.2299
 epoch: 2, train_loss: 1.3027, test_loss: 1.3148, test_f1: 0.2274
 epoch: 3, train_loss: 1.2816, test_loss: 1.2854, test_f1: 0.2274
 epoch: 4, train_loss: 1.2731, test_loss: 1.2622, test_f1: 0.2274
 epoch: 5, train_loss: 1.2588, test_loss: 1.2412, test_f1: 0.2468
 epoch: 6, train_loss: 1.2437, test_loss: 1.2268, test_f1: 0.2657
 epoch: 7, train_loss: 1.2417, test_loss: 1.2086, test_f1: 0.3147
 epoch: 8, train_loss: 1.2266, test_loss: 1.1996, test_f1: 0.3235
 epoch: 9, train_loss: 1.2205, test_loss: 1.1862, test_f1: 0.3356
 epoch: 10, train_loss: 1.2130, test_loss: 1.1762, test_f1: 0.3325
 epoch: 11, train_loss: 1.2031, test_loss: 1.1680, test_f1: 0.3396
 epoch: 12, train_loss: 1.1947, test_loss: 1.1625, test_f1: 0.3448
 epoch: 13, train_loss: 1.1942, test_loss: 1.1611, test_f1: 0.3544
 epoch: 14, train_loss: 1.1736, test_loss: 1.1437, test_f1: 0.3860
 epoch: 15, train_loss: 1.1721, test_loss: 1.1449, test_f1: 0.3946
 epoch: 16, train_loss: 1.1695, test_loss: 1.1302, test_f1: 0.4045
 epoch: 17, train_loss: 1.1546, test_loss: 1.1184, test_f1: 0.3926
 epoch: 18, train_loss: 1.1438, test_loss: 1.1133, test_f1: 0.3977
 epoch: 19, train_loss: 1.1485, test_loss: 1.1082, test_f1: 0.4073
 epoch: 20, train_loss: 1.1397, test_loss: 1.1235, test_f1: 0.4064
 epoch: 21, train_loss: 1.1266, test_loss: 1.1727, test_f1: 0.4117
 epoch: 22, train_loss: 1.1268, test_loss: 1.0939, test_f1: 0.4136
 epoch: 23, train_loss: 1.1198, test_loss: 1.0819, test_f1: 0.4082
 epoch: 24, train_loss: 1.1121, test_loss: 1.1401, test_f1: 0.4101
 epoch: 25, train_loss: 1.1050, test_loss: 1.0790, test_f1: 0.4114
 epoch: 26, train_loss: 1.0983, test_loss: 1.0736, test_f1: 0.4130
 epoch: 27, train_loss: 1.0993, test_loss: 1.1282, test_f1: 0.4100
 epoch: 28, train_loss: 1.0861, test_loss: 1.0638, test_f1: 0.4126
 epoch: 29, train_loss: 1.0889, test_loss: 1.0621, test_f1: 0.4064
 epoch: 30, train_loss: 1.0723, test_loss: 1.0548, test_f1: 0.4254
 epoch: 31, train_loss: 1.0806, test_loss: 1.0474, test_f1: 0.4229
 epoch: 32, train_loss: 1.0704, test_loss: 1.0557, test_f1: 0.4158
 epoch: 33, train_loss: 1.0671, test_loss: 1.1249, test_f1: 0.4154
 epoch: 34, train_loss: 1.0608, test_loss: 1.0477, test_f1: 0.4197
 epoch: 35, train_loss: 1.0574, test_loss: 1.0393, test_f1: 0.4234
 epoch: 36, train_loss: 1.0453, test_loss: 1.0225, test_f1: 0.4444
 epoch: 37, train_loss: 1.0419, test_loss: 1.0341, test_f1: 0.4254
 epoch: 38, train_loss: 1.0384, test_loss: 1.0581, test_f1: 0.4360
 epoch: 39, train_loss: 1.0360, test_loss: 1.0425, test_f1: 0.4396
 epoch: 40, train_loss: 1.0384, test_loss: 1.0114, test_f1: 0.4478
 epoch: 41, train_loss: 1.0248, test_loss: 1.0266, test_f1: 0.4382
 epoch: 42, train_loss: 1.0242, test_loss: 1.0379, test_f1: 0.4464
 epoch: 43, train_loss: 1.0183, test_loss: 1.0241, test_f1: 0.4649
 epoch: 44, train_loss: 1.0160, test_loss: 1.0162, test_f1: 0.4570
 epoch: 45, train_loss: 1.0120, test_loss: 1.1091, test_f1: 0.4452
 epoch: 46, train_loss: 1.0153, test_loss: 1.0195, test_f1: 0.4455
 epoch: 47, train_loss: 1.0133, test_loss: 1.0083, test_f1: 0.4702
 epoch: 48, train_loss: 1.0030, test_loss: 1.0158, test_f1: 0.4726
 epoch: 49, train_loss: 0.9994, test_loss: 1.0247, test_f1: 0.4700
 epoch: 50, train_loss: 0.9986, test_loss: 0.9962, test_f1: 0.4648
 epoch: 51, train_loss: 0.9958, test_loss: 1.0278, test_f1: 0.4453
 epoch: 52, train_loss: 0.9883, test_loss: 1.0266, test_f1: 0.4588
 epoch: 53, train_loss: 0.9862, test_loss: 1.0330, test_f1: 0.4636
 epoch: 54, train_loss: 0.9921, test_loss: 1.0274, test_f1: 0.4643
 epoch: 55, train_loss: 0.9852, test_loss: 1.0240, test_f1: 0.4668
 epoch: 56, train_loss: 0.9819, test_loss: 1.0416, test_f1: 0.4676
 epoch: 57, train_loss: 0.9806, test_loss: 1.0258, test_f1: 0.4632
 epoch: 58, train_loss: 0.9777, test_loss: 1.0317, test_f1: 0.4669
 epoch: 59, train_loss: 0.9711, test_loss: 1.0337, test_f1: 0.4683
 epoch: 60, train_loss: 0.9775, test_loss: 1.0371, test_f1: 0.4623
 epoch: 61, train_loss: 0.9658, test_loss: 1.0434, test_f1: 0.4669
 epoch: 62, train_loss: 0.9707, test_loss: 1.0196, test_f1: 0.4739
 epoch: 63, train_loss: 0.9625, test_loss: 1.0221, test_f1: 0.4681
 epoch: 64, train_loss: 0.9720, test_loss: 1.0178, test_f1: 0.4689
 epoch: 65, train_loss: 0.9670, test_loss: 1.0493, test_f1: 0.4690
 epoch: 66, train_loss: 0.9695, test_loss: 1.0366, test_f1: 0.4723
 epoch: 67, train_loss: 0.9671, test_loss: 1.0330, test_f1: 0.4603
 epoch: 68, train_loss: 0.9520, test_loss: 1.0357, test_f1: 0.4767
 epoch: 69, train_loss: 0.9590, test_loss: 1.0283, test_f1: 0.4648
 epoch: 70, train_loss: 0.9580, test_loss: 1.0476, test_f1: 0.4736
 epoch: 71, train_loss: 0.9636, test_loss: 1.0491, test_f1: 0.4730
 epoch: 72, train_loss: 0.9616, test_loss: 1.0466, test_f1: 0.4623
 epoch: 73, train_loss: 0.9439, test_loss: 1.0539, test_f1: 0.4687
 epoch: 74, train_loss: 0.9532, test_loss: 1.0521, test_f1: 0.4794
 epoch: 75, train_loss: 0.9571, test_loss: 1.0407, test_f1: 0.4658
 epoch: 76, train_loss: 0.9438, test_loss: 1.0515, test_f1: 0.4671
 epoch: 77, train_loss: 0.9502, test_loss: 1.0423, test_f1: 0.4908
 epoch: 78, train_loss: 0.9516, test_loss: 1.0445, test_f1: 0.4719
 epoch: 79, train_loss: 0.9613, test_loss: 1.0386, test_f1: 0.4768
 epoch: 80, train_loss: 0.9488, test_loss: 1.0356, test_f1: 0.4722
 epoch: 81, train_loss: 0.9453, test_loss: 1.0419, test_f1: 0.4753
 epoch: 82, train_loss: 0.9437, test_loss: 1.0369, test_f1: 0.4791
 epoch: 83, train_loss: 0.9536, test_loss: 1.0350, test_f1: 0.4700
 epoch: 84, train_loss: 0.9398, test_loss: 1.0500, test_f1: 0.4814
 epoch: 85, train_loss: 0.9424, test_loss: 1.0436, test_f1: 0.4756
 epoch: 86, train_loss: 0.9415, test_loss: 1.0524, test_f1: 0.4835
 epoch: 87, train_loss: 0.9402, test_loss: 1.0528, test_f1: 0.4798
 epoch: 88, train_loss: 0.9295, test_loss: 1.0601, test_f1: 0.4807
 epoch: 89, train_loss: 0.9305, test_loss: 1.0464, test_f1: 0.4813
 epoch: 90, train_loss: 0.9329, test_loss: 1.0554, test_f1: 0.4657
 epoch: 91, train_loss: 0.9388, test_loss: 1.0519, test_f1: 0.4602
 epoch: 92, train_loss: 0.9304, test_loss: 1.0607, test_f1: 0.4718
 epoch: 93, train_loss: 0.9365, test_loss: 1.0540, test_f1: 0.4837
 epoch: 94, train_loss: 0.9332, test_loss: 1.0622, test_f1: 0.4879
 epoch: 95, train_loss: 0.9264, test_loss: 1.0530, test_f1: 0.4860
 epoch: 96, train_loss: 0.9289, test_loss: 1.0555, test_f1: 0.4839
 epoch: 97, train_loss: 0.9281, test_loss: 1.0469, test_f1: 0.4758
 epoch: 98, train_loss: 0.9261, test_loss: 1.0378, test_f1: 0.4836
 epoch: 99, train_loss: 0.9263, test_loss: 1.0489, test_f1: 0.4876
##################ITERATION #4 ****************************************
 epoch: 0, train_loss: 1.3517, test_loss: 1.3174, test_f1: 0.2274
 epoch: 1, train_loss: 1.2863, test_loss: 1.2889, test_f1: 0.2274
 epoch: 2, train_loss: 1.2667, test_loss: 1.2586, test_f1: 0.2497
 epoch: 3, train_loss: 1.2459, test_loss: 1.2279, test_f1: 0.2869
 epoch: 4, train_loss: 1.2386, test_loss: 1.2144, test_f1: 0.2773
 epoch: 5, train_loss: 1.2335, test_loss: 1.2053, test_f1: 0.2883
 epoch: 6, train_loss: 1.2224, test_loss: 1.1948, test_f1: 0.3038
 epoch: 7, train_loss: 1.2112, test_loss: 1.1826, test_f1: 0.3213
 epoch: 8, train_loss: 1.2074, test_loss: 1.1751, test_f1: 0.3750
 epoch: 9, train_loss: 1.2042, test_loss: 1.1629, test_f1: 0.4087
 epoch: 10, train_loss: 1.1899, test_loss: 1.1508, test_f1: 0.4294
 epoch: 11, train_loss: 1.1795, test_loss: 1.1409, test_f1: 0.4403
 epoch: 12, train_loss: 1.1770, test_loss: 1.1330, test_f1: 0.4233
 epoch: 13, train_loss: 1.1601, test_loss: 1.1194, test_f1: 0.4312
 epoch: 14, train_loss: 1.1487, test_loss: 1.1102, test_f1: 0.4368
 epoch: 15, train_loss: 1.1489, test_loss: 1.1073, test_f1: 0.4430
 epoch: 16, train_loss: 1.1449, test_loss: 1.0921, test_f1: 0.4529
 epoch: 17, train_loss: 1.1330, test_loss: 1.0841, test_f1: 0.4515
 epoch: 18, train_loss: 1.1251, test_loss: 1.0732, test_f1: 0.4503
 epoch: 19, train_loss: 1.1290, test_loss: 1.0668, test_f1: 0.4570
 epoch: 20, train_loss: 1.1159, test_loss: 1.0610, test_f1: 0.4517
 epoch: 21, train_loss: 1.1052, test_loss: 1.0593, test_f1: 0.4386
 epoch: 22, train_loss: 1.1001, test_loss: 1.0545, test_f1: 0.4507
 epoch: 23, train_loss: 1.0856, test_loss: 1.0437, test_f1: 0.4555
 epoch: 24, train_loss: 1.0861, test_loss: 1.0419, test_f1: 0.4573
 epoch: 25, train_loss: 1.0837, test_loss: 1.0325, test_f1: 0.4678
 epoch: 26, train_loss: 1.0650, test_loss: 1.0340, test_f1: 0.4625
 epoch: 27, train_loss: 1.0634, test_loss: 1.0275, test_f1: 0.4568
 epoch: 28, train_loss: 1.0664, test_loss: 1.0185, test_f1: 0.4607
 epoch: 29, train_loss: 1.0575, test_loss: 1.0248, test_f1: 0.4513
 epoch: 30, train_loss: 1.0586, test_loss: 1.0124, test_f1: 0.4573
 epoch: 31, train_loss: 1.0443, test_loss: 1.0129, test_f1: 0.4729
 epoch: 32, train_loss: 1.0451, test_loss: 1.0059, test_f1: 0.4640
 epoch: 33, train_loss: 1.0323, test_loss: 1.0068, test_f1: 0.4636
 epoch: 34, train_loss: 1.0397, test_loss: 1.0024, test_f1: 0.4620
 epoch: 35, train_loss: 1.0236, test_loss: 0.9933, test_f1: 0.4748
 epoch: 36, train_loss: 1.0300, test_loss: 0.9897, test_f1: 0.4715
 epoch: 37, train_loss: 1.0290, test_loss: 0.9932, test_f1: 0.4639
 epoch: 38, train_loss: 1.0092, test_loss: 0.9916, test_f1: 0.4632
 epoch: 39, train_loss: 1.0191, test_loss: 0.9877, test_f1: 0.4600
 epoch: 40, train_loss: 1.0098, test_loss: 0.9808, test_f1: 0.4651
 epoch: 41, train_loss: 1.0073, test_loss: 0.9842, test_f1: 0.4676
 epoch: 42, train_loss: 1.0033, test_loss: 0.9831, test_f1: 0.4670
 epoch: 43, train_loss: 1.0081, test_loss: 0.9781, test_f1: 0.4747
 epoch: 44, train_loss: 1.0001, test_loss: 0.9805, test_f1: 0.4721
 epoch: 45, train_loss: 0.9969, test_loss: 0.9805, test_f1: 0.4728
 epoch: 46, train_loss: 0.9869, test_loss: 0.9672, test_f1: 0.4840
 epoch: 47, train_loss: 0.9924, test_loss: 0.9667, test_f1: 0.4929
 epoch: 48, train_loss: 0.9921, test_loss: 0.9531, test_f1: 0.4808
 epoch: 49, train_loss: 0.9849, test_loss: 0.9795, test_f1: 0.4704
 epoch: 50, train_loss: 0.9795, test_loss: 0.9772, test_f1: 0.4813
 epoch: 51, train_loss: 0.9798, test_loss: 0.9706, test_f1: 0.4773
 epoch: 52, train_loss: 0.9746, test_loss: 0.9713, test_f1: 0.4830
 epoch: 53, train_loss: 0.9818, test_loss: 0.9747, test_f1: 0.4732
 epoch: 54, train_loss: 0.9842, test_loss: 0.9711, test_f1: 0.4672
 epoch: 55, train_loss: 0.9709, test_loss: 0.9676, test_f1: 0.4778
 epoch: 56, train_loss: 0.9628, test_loss: 0.9705, test_f1: 0.4664
 epoch: 57, train_loss: 0.9684, test_loss: 0.9727, test_f1: 0.4858
 epoch: 58, train_loss: 0.9628, test_loss: 0.9695, test_f1: 0.4768
 epoch: 59, train_loss: 0.9636, test_loss: 0.9701, test_f1: 0.4776
 epoch: 60, train_loss: 0.9635, test_loss: 0.9715, test_f1: 0.4828
 epoch: 61, train_loss: 0.9640, test_loss: 0.9755, test_f1: 0.4769
 epoch: 62, train_loss: 0.9572, test_loss: 0.9800, test_f1: 0.4750
 epoch: 63, train_loss: 0.9656, test_loss: 0.9697, test_f1: 0.4804
 epoch: 64, train_loss: 0.9592, test_loss: 0.9644, test_f1: 0.4659
 epoch: 65, train_loss: 0.9624, test_loss: 0.9767, test_f1: 0.4740
 epoch: 66, train_loss: 0.9579, test_loss: 0.9833, test_f1: 0.4730
 epoch: 67, train_loss: 0.9571, test_loss: 0.9733, test_f1: 0.4823
 epoch: 68, train_loss: 0.9596, test_loss: 0.9660, test_f1: 0.4833
 epoch: 69, train_loss: 0.9517, test_loss: 0.9705, test_f1: 0.4798
 epoch: 70, train_loss: 0.9511, test_loss: 0.9625, test_f1: 0.4825
 epoch: 71, train_loss: 0.9450, test_loss: 0.9546, test_f1: 0.4855
 epoch: 72, train_loss: 0.9558, test_loss: 0.9632, test_f1: 0.4802
 epoch: 73, train_loss: 0.9482, test_loss: 0.9665, test_f1: 0.4847
 epoch: 74, train_loss: 0.9488, test_loss: 0.9540, test_f1: 0.4898
 epoch: 75, train_loss: 0.9390, test_loss: 0.9669, test_f1: 0.5166
 epoch: 76, train_loss: 0.9405, test_loss: 0.9584, test_f1: 0.4896
 epoch: 77, train_loss: 0.9571, test_loss: 0.9569, test_f1: 0.4997
 epoch: 78, train_loss: 0.9406, test_loss: 0.9531, test_f1: 0.5121
 epoch: 79, train_loss: 0.9509, test_loss: 0.9520, test_f1: 0.5064
 epoch: 80, train_loss: 0.9401, test_loss: 0.9523, test_f1: 0.4858
 epoch: 81, train_loss: 0.9524, test_loss: 0.9770, test_f1: 0.4991
 epoch: 82, train_loss: 0.9397, test_loss: 0.9604, test_f1: 0.5023
 epoch: 83, train_loss: 0.9504, test_loss: 0.9621, test_f1: 0.4992
 epoch: 84, train_loss: 0.9363, test_loss: 0.9728, test_f1: 0.5056
 epoch: 85, train_loss: 0.9327, test_loss: 0.9606, test_f1: 0.5033
 epoch: 86, train_loss: 0.9364, test_loss: 0.9567, test_f1: 0.5104
 epoch: 87, train_loss: 0.9282, test_loss: 0.9543, test_f1: 0.5112
 epoch: 88, train_loss: 0.9327, test_loss: 0.9616, test_f1: 0.5064
 epoch: 89, train_loss: 0.9358, test_loss: 0.9605, test_f1: 0.5047
 epoch: 90, train_loss: 0.9359, test_loss: 0.9578, test_f1: 0.5127
 epoch: 91, train_loss: 0.9331, test_loss: 0.9672, test_f1: 0.4866
 epoch: 92, train_loss: 0.9245, test_loss: 0.9632, test_f1: 0.4978
 epoch: 93, train_loss: 0.9313, test_loss: 0.9598, test_f1: 0.5098
 epoch: 94, train_loss: 0.9216, test_loss: 0.9550, test_f1: 0.5145
 epoch: 95, train_loss: 0.9266, test_loss: 0.9667, test_f1: 0.5041
 epoch: 96, train_loss: 0.9289, test_loss: 0.9469, test_f1: 0.5117
 epoch: 97, train_loss: 0.9307, test_loss: 0.9680, test_f1: 0.5000
 epoch: 98, train_loss: 0.9249, test_loss: 0.9633, test_f1: 0.4935
 epoch: 99, train_loss: 0.9285, test_loss: 0.9666, test_f1: 0.4873
##################ITERATION #5 ****************************************
 epoch: 0, train_loss: 1.3586, test_loss: 1.3260, test_f1: 0.2274
 epoch: 1, train_loss: 1.2888, test_loss: 1.3114, test_f1: 0.2301
 epoch: 2, train_loss: 1.2745, test_loss: 1.2896, test_f1: 0.2630
 epoch: 3, train_loss: 1.2522, test_loss: 1.2537, test_f1: 0.2681
 epoch: 4, train_loss: 1.2408, test_loss: 1.2301, test_f1: 0.2841
 epoch: 5, train_loss: 1.2360, test_loss: 1.2038, test_f1: 0.3091
 epoch: 6, train_loss: 1.2250, test_loss: 1.1888, test_f1: 0.3070
 epoch: 7, train_loss: 1.2089, test_loss: 1.1749, test_f1: 0.3512
 epoch: 8, train_loss: 1.2078, test_loss: 1.1669, test_f1: 0.3884
 epoch: 9, train_loss: 1.1960, test_loss: 1.1575, test_f1: 0.3895
 epoch: 10, train_loss: 1.1905, test_loss: 1.1501, test_f1: 0.3902
 epoch: 11, train_loss: 1.1775, test_loss: 1.1500, test_f1: 0.3879
 epoch: 12, train_loss: 1.1713, test_loss: 1.1367, test_f1: 0.4018
 epoch: 13, train_loss: 1.1630, test_loss: 1.1351, test_f1: 0.4054
 epoch: 14, train_loss: 1.1571, test_loss: 1.1357, test_f1: 0.4078
 epoch: 15, train_loss: 1.1497, test_loss: 1.1317, test_f1: 0.3977
 epoch: 16, train_loss: 1.1379, test_loss: 1.1306, test_f1: 0.4143
 epoch: 17, train_loss: 1.1398, test_loss: 1.1207, test_f1: 0.4107
 epoch: 18, train_loss: 1.1383, test_loss: 1.1159, test_f1: 0.4259
 epoch: 19, train_loss: 1.1231, test_loss: 1.1235, test_f1: 0.4147
 epoch: 20, train_loss: 1.1193, test_loss: 1.1105, test_f1: 0.4174
 epoch: 21, train_loss: 1.1174, test_loss: 1.1035, test_f1: 0.4227
 epoch: 22, train_loss: 1.1118, test_loss: 1.0965, test_f1: 0.4193
 epoch: 23, train_loss: 1.1114, test_loss: 1.1006, test_f1: 0.4262
 epoch: 24, train_loss: 1.1100, test_loss: 1.0918, test_f1: 0.4254
 epoch: 25, train_loss: 1.1091, test_loss: 1.0868, test_f1: 0.4306
 epoch: 26, train_loss: 1.0970, test_loss: 1.0937, test_f1: 0.4271
 epoch: 27, train_loss: 1.0948, test_loss: 1.0896, test_f1: 0.4288
 epoch: 28, train_loss: 1.0976, test_loss: 1.0802, test_f1: 0.4292
 epoch: 29, train_loss: 1.0898, test_loss: 1.0826, test_f1: 0.4440
 epoch: 30, train_loss: 1.0716, test_loss: 1.0749, test_f1: 0.4453
 epoch: 31, train_loss: 1.0733, test_loss: 1.0780, test_f1: 0.4348
 epoch: 32, train_loss: 1.0718, test_loss: 1.0740, test_f1: 0.4365
 epoch: 33, train_loss: 1.0622, test_loss: 1.0757, test_f1: 0.4379
 epoch: 34, train_loss: 1.0728, test_loss: 1.0810, test_f1: 0.4273
 epoch: 35, train_loss: 1.0595, test_loss: 1.0568, test_f1: 0.4410
 epoch: 36, train_loss: 1.0561, test_loss: 1.0578, test_f1: 0.4434
 epoch: 37, train_loss: 1.0467, test_loss: 1.0698, test_f1: 0.4329
 epoch: 38, train_loss: 1.0520, test_loss: 1.0594, test_f1: 0.4308
 epoch: 39, train_loss: 1.0520, test_loss: 1.0508, test_f1: 0.4436
 epoch: 40, train_loss: 1.0394, test_loss: 1.0590, test_f1: 0.4468
 epoch: 41, train_loss: 1.0343, test_loss: 1.0595, test_f1: 0.4424
 epoch: 42, train_loss: 1.0363, test_loss: 1.0544, test_f1: 0.4568
 epoch: 43, train_loss: 1.0267, test_loss: 1.0578, test_f1: 0.4242
 epoch: 44, train_loss: 1.0259, test_loss: 1.0492, test_f1: 0.4485
 epoch: 45, train_loss: 1.0263, test_loss: 1.0327, test_f1: 0.4347
 epoch: 46, train_loss: 1.0299, test_loss: 1.0350, test_f1: 0.4400
 epoch: 47, train_loss: 1.0227, test_loss: 1.0426, test_f1: 0.4492
 epoch: 48, train_loss: 1.0102, test_loss: 1.0441, test_f1: 0.4456
 epoch: 49, train_loss: 1.0191, test_loss: 1.0341, test_f1: 0.4472
 epoch: 50, train_loss: 1.0156, test_loss: 1.0238, test_f1: 0.4493
 epoch: 51, train_loss: 1.0158, test_loss: 1.0294, test_f1: 0.4507
 epoch: 52, train_loss: 1.0031, test_loss: 1.0265, test_f1: 0.4614
 epoch: 53, train_loss: 1.0003, test_loss: 1.0264, test_f1: 0.4592
 epoch: 54, train_loss: 1.0045, test_loss: 1.0328, test_f1: 0.4585
 epoch: 55, train_loss: 0.9913, test_loss: 1.0277, test_f1: 0.4622
 epoch: 56, train_loss: 0.9893, test_loss: 1.0324, test_f1: 0.4552
 epoch: 57, train_loss: 0.9840, test_loss: 1.0275, test_f1: 0.4567
 epoch: 58, train_loss: 0.9869, test_loss: 1.0247, test_f1: 0.4660
 epoch: 59, train_loss: 0.9937, test_loss: 1.0194, test_f1: 0.4639
 epoch: 60, train_loss: 0.9876, test_loss: 1.0263, test_f1: 0.4655
 epoch: 61, train_loss: 0.9953, test_loss: 1.0319, test_f1: 0.4604
 epoch: 62, train_loss: 0.9789, test_loss: 1.0279, test_f1: 0.4654
 epoch: 63, train_loss: 0.9956, test_loss: 1.0400, test_f1: 0.4618
 epoch: 64, train_loss: 0.9823, test_loss: 1.0291, test_f1: 0.4534
 epoch: 65, train_loss: 0.9767, test_loss: 1.0455, test_f1: 0.4634
 epoch: 66, train_loss: 0.9766, test_loss: 1.0497, test_f1: 0.4633
 epoch: 67, train_loss: 0.9716, test_loss: 1.0382, test_f1: 0.4604
 epoch: 68, train_loss: 0.9715, test_loss: 1.0393, test_f1: 0.4559
 epoch: 69, train_loss: 0.9727, test_loss: 1.0263, test_f1: 0.4711
 epoch: 70, train_loss: 0.9671, test_loss: 1.0443, test_f1: 0.4662
 epoch: 71, train_loss: 0.9669, test_loss: 1.0438, test_f1: 0.4564
 epoch: 72, train_loss: 0.9704, test_loss: 1.0448, test_f1: 0.4687
 epoch: 73, train_loss: 0.9510, test_loss: 1.0394, test_f1: 0.4715
 epoch: 74, train_loss: 0.9605, test_loss: 1.0406, test_f1: 0.4753
 epoch: 75, train_loss: 0.9636, test_loss: 1.0457, test_f1: 0.4678
 epoch: 76, train_loss: 0.9664, test_loss: 1.0404, test_f1: 0.4679
 epoch: 77, train_loss: 0.9624, test_loss: 1.0449, test_f1: 0.4696
 epoch: 78, train_loss: 0.9590, test_loss: 1.0358, test_f1: 0.4659
 epoch: 79, train_loss: 0.9445, test_loss: 1.0292, test_f1: 0.4668
 epoch: 80, train_loss: 0.9507, test_loss: 1.0315, test_f1: 0.4663
 epoch: 81, train_loss: 0.9495, test_loss: 1.0162, test_f1: 0.4686
 epoch: 82, train_loss: 0.9606, test_loss: 1.0329, test_f1: 0.4642
 epoch: 83, train_loss: 0.9507, test_loss: 1.0230, test_f1: 0.4678
 epoch: 84, train_loss: 0.9503, test_loss: 1.0293, test_f1: 0.4766
 epoch: 85, train_loss: 0.9501, test_loss: 1.0195, test_f1: 0.4697
 epoch: 86, train_loss: 0.9456, test_loss: 1.0188, test_f1: 0.4627
 epoch: 87, train_loss: 0.9544, test_loss: 1.0233, test_f1: 0.4679
 epoch: 88, train_loss: 0.9507, test_loss: 1.0514, test_f1: 0.4694
 epoch: 89, train_loss: 0.9396, test_loss: 1.0480, test_f1: 0.4754
 epoch: 90, train_loss: 0.9409, test_loss: 1.0668, test_f1: 0.4687
 epoch: 91, train_loss: 0.9408, test_loss: 1.0686, test_f1: 0.4720
 epoch: 92, train_loss: 0.9399, test_loss: 1.0446, test_f1: 0.4733
 epoch: 93, train_loss: 0.9310, test_loss: 1.0508, test_f1: 0.4808
 epoch: 94, train_loss: 0.9364, test_loss: 1.0437, test_f1: 0.4755
 epoch: 95, train_loss: 0.9331, test_loss: 1.0369, test_f1: 0.4776
 epoch: 96, train_loss: 0.9422, test_loss: 1.0366, test_f1: 0.4729
 epoch: 97, train_loss: 0.9316, test_loss: 1.0458, test_f1: 0.4728
 epoch: 98, train_loss: 0.9312, test_loss: 1.0384, test_f1: 0.4721
 epoch: 99, train_loss: 0.9414, test_loss: 1.0226, test_f1: 0.4726
##################ITERATION #6 ****************************************
 epoch: 0, train_loss: 1.5503, test_loss: 1.3961, test_f1: 0.2269
 epoch: 1, train_loss: 1.3503, test_loss: 1.3615, test_f1: 0.2274
 epoch: 2, train_loss: 1.3227, test_loss: 1.3091, test_f1: 0.2274
 epoch: 3, train_loss: 1.2916, test_loss: 1.2828, test_f1: 0.2274
 epoch: 4, train_loss: 1.2827, test_loss: 1.2617, test_f1: 0.2484
 epoch: 5, train_loss: 1.2630, test_loss: 1.2465, test_f1: 0.2620
 epoch: 6, train_loss: 1.2541, test_loss: 1.2392, test_f1: 0.2719
 epoch: 7, train_loss: 1.2529, test_loss: 1.2284, test_f1: 0.3034
 epoch: 8, train_loss: 1.2497, test_loss: 1.2224, test_f1: 0.3058
 epoch: 9, train_loss: 1.2438, test_loss: 1.2177, test_f1: 0.3035
 epoch: 10, train_loss: 1.2301, test_loss: 1.2126, test_f1: 0.3335
 epoch: 11, train_loss: 1.2373, test_loss: 1.2064, test_f1: 0.3317
 epoch: 12, train_loss: 1.2186, test_loss: 1.2011, test_f1: 0.3354
 epoch: 13, train_loss: 1.2240, test_loss: 1.1958, test_f1: 0.3532
 epoch: 14, train_loss: 1.2095, test_loss: 1.1876, test_f1: 0.3559
 epoch: 15, train_loss: 1.2035, test_loss: 1.1853, test_f1: 0.3761
 epoch: 16, train_loss: 1.2014, test_loss: 1.1788, test_f1: 0.3812
 epoch: 17, train_loss: 1.1981, test_loss: 1.1750, test_f1: 0.3810
 epoch: 18, train_loss: 1.1973, test_loss: 1.1725, test_f1: 0.3886
 epoch: 19, train_loss: 1.1976, test_loss: 1.1708, test_f1: 0.3950
 epoch: 20, train_loss: 1.1882, test_loss: 1.1648, test_f1: 0.3915
 epoch: 21, train_loss: 1.1836, test_loss: 1.1621, test_f1: 0.3956
 epoch: 22, train_loss: 1.1872, test_loss: 1.1625, test_f1: 0.4013
 epoch: 23, train_loss: 1.1772, test_loss: 1.1567, test_f1: 0.4099
 epoch: 24, train_loss: 1.1719, test_loss: 1.1522, test_f1: 0.4032
 epoch: 25, train_loss: 1.1719, test_loss: 1.1406, test_f1: 0.4166
 epoch: 26, train_loss: 1.1614, test_loss: 1.1470, test_f1: 0.4162
 epoch: 27, train_loss: 1.1612, test_loss: 1.1277, test_f1: 0.4299
 epoch: 28, train_loss: 1.1689, test_loss: 1.1440, test_f1: 0.4233
 epoch: 29, train_loss: 1.1535, test_loss: 1.1266, test_f1: 0.4307
 epoch: 30, train_loss: 1.1400, test_loss: 1.1451, test_f1: 0.4265
 epoch: 31, train_loss: 1.1342, test_loss: 1.1173, test_f1: 0.4314
 epoch: 32, train_loss: 1.1430, test_loss: 1.1037, test_f1: 0.4293
 epoch: 33, train_loss: 1.1242, test_loss: 1.1171, test_f1: 0.4247
 epoch: 34, train_loss: 1.1226, test_loss: 1.0920, test_f1: 0.4404
 epoch: 35, train_loss: 1.1226, test_loss: 1.0939, test_f1: 0.4382
 epoch: 36, train_loss: 1.1150, test_loss: 1.0883, test_f1: 0.4477
 epoch: 37, train_loss: 1.1234, test_loss: 1.0805, test_f1: 0.4337
 epoch: 38, train_loss: 1.1059, test_loss: 1.0751, test_f1: 0.4439
 epoch: 39, train_loss: 1.0978, test_loss: 1.0795, test_f1: 0.4586
 epoch: 40, train_loss: 1.1018, test_loss: 1.0731, test_f1: 0.4296
 epoch: 41, train_loss: 1.0842, test_loss: 1.0721, test_f1: 0.4528
 epoch: 42, train_loss: 1.0947, test_loss: 1.0434, test_f1: 0.4768
 epoch: 43, train_loss: 1.0796, test_loss: 1.0520, test_f1: 0.4581
 epoch: 44, train_loss: 1.0779, test_loss: 1.0734, test_f1: 0.4645
 epoch: 45, train_loss: 1.0785, test_loss: 1.0808, test_f1: 0.4597
 epoch: 46, train_loss: 1.0783, test_loss: 1.0728, test_f1: 0.4773
 epoch: 47, train_loss: 1.0685, test_loss: 1.0165, test_f1: 0.4834
 epoch: 48, train_loss: 1.0553, test_loss: 1.0570, test_f1: 0.4566
 epoch: 49, train_loss: 1.0537, test_loss: 1.0506, test_f1: 0.4590
 epoch: 50, train_loss: 1.0501, test_loss: 1.0021, test_f1: 0.4821
 epoch: 51, train_loss: 1.0434, test_loss: 1.0049, test_f1: 0.4762
 epoch: 52, train_loss: 1.0454, test_loss: 1.0033, test_f1: 0.4732
 epoch: 53, train_loss: 1.0444, test_loss: 0.9998, test_f1: 0.4862
 epoch: 54, train_loss: 1.0294, test_loss: 0.9910, test_f1: 0.4887
 epoch: 55, train_loss: 1.0361, test_loss: 0.9902, test_f1: 0.4806
 epoch: 56, train_loss: 1.0312, test_loss: 0.9888, test_f1: 0.4824
 epoch: 57, train_loss: 1.0270, test_loss: 0.9982, test_f1: 0.4778
 epoch: 58, train_loss: 1.0238, test_loss: 1.0008, test_f1: 0.4879
 epoch: 59, train_loss: 1.0251, test_loss: 0.9852, test_f1: 0.4856
 epoch: 60, train_loss: 1.0200, test_loss: 0.9865, test_f1: 0.4865
 epoch: 61, train_loss: 1.0203, test_loss: 0.9833, test_f1: 0.4852
 epoch: 62, train_loss: 1.0162, test_loss: 0.9792, test_f1: 0.4861
 epoch: 63, train_loss: 1.0139, test_loss: 0.9812, test_f1: 0.4805
 epoch: 64, train_loss: 1.0271, test_loss: 0.9916, test_f1: 0.4637
 epoch: 65, train_loss: 1.0147, test_loss: 0.9923, test_f1: 0.4661
 epoch: 66, train_loss: 1.0071, test_loss: 0.9776, test_f1: 0.4775
 epoch: 67, train_loss: 1.0001, test_loss: 0.9875, test_f1: 0.4701
 epoch: 68, train_loss: 1.0018, test_loss: 0.9738, test_f1: 0.4731
 epoch: 69, train_loss: 1.0096, test_loss: 0.9806, test_f1: 0.4819
 epoch: 70, train_loss: 0.9941, test_loss: 0.9732, test_f1: 0.4765
 epoch: 71, train_loss: 0.9884, test_loss: 0.9672, test_f1: 0.4761
 epoch: 72, train_loss: 1.0020, test_loss: 0.9726, test_f1: 0.4807
 epoch: 73, train_loss: 1.0002, test_loss: 0.9698, test_f1: 0.4808
 epoch: 74, train_loss: 0.9957, test_loss: 0.9724, test_f1: 0.4902
 epoch: 75, train_loss: 1.0000, test_loss: 0.9812, test_f1: 0.4882
 epoch: 76, train_loss: 0.9940, test_loss: 0.9723, test_f1: 0.4778
 epoch: 77, train_loss: 0.9874, test_loss: 0.9737, test_f1: 0.4834
 epoch: 78, train_loss: 0.9899, test_loss: 0.9718, test_f1: 0.4780
 epoch: 79, train_loss: 0.9870, test_loss: 0.9685, test_f1: 0.4853
 epoch: 80, train_loss: 0.9863, test_loss: 0.9714, test_f1: 0.4765
 epoch: 81, train_loss: 0.9841, test_loss: 0.9816, test_f1: 0.4652
 epoch: 82, train_loss: 0.9760, test_loss: 0.9718, test_f1: 0.4845
 epoch: 83, train_loss: 0.9736, test_loss: 0.9680, test_f1: 0.4801
 epoch: 84, train_loss: 0.9821, test_loss: 0.9657, test_f1: 0.4790
 epoch: 85, train_loss: 0.9668, test_loss: 0.9757, test_f1: 0.4818
 epoch: 86, train_loss: 0.9717, test_loss: 0.9773, test_f1: 0.4861
 epoch: 87, train_loss: 0.9772, test_loss: 0.9659, test_f1: 0.4887
 epoch: 88, train_loss: 0.9719, test_loss: 0.9711, test_f1: 0.4837
 epoch: 89, train_loss: 0.9742, test_loss: 0.9790, test_f1: 0.4877
 epoch: 90, train_loss: 0.9686, test_loss: 0.9791, test_f1: 0.4806
 epoch: 91, train_loss: 0.9707, test_loss: 0.9752, test_f1: 0.4912
 epoch: 92, train_loss: 0.9651, test_loss: 0.9771, test_f1: 0.4849
 epoch: 93, train_loss: 0.9617, test_loss: 0.9790, test_f1: 0.4839
 epoch: 94, train_loss: 0.9657, test_loss: 0.9693, test_f1: 0.4856
 epoch: 95, train_loss: 0.9571, test_loss: 0.9673, test_f1: 0.4921
 epoch: 96, train_loss: 0.9580, test_loss: 0.9693, test_f1: 0.4861
 epoch: 97, train_loss: 0.9555, test_loss: 0.9752, test_f1: 0.4867
 epoch: 98, train_loss: 0.9576, test_loss: 0.9656, test_f1: 0.4860
 epoch: 99, train_loss: 0.9574, test_loss: 0.9725, test_f1: 0.4891
##################ITERATION #7 ****************************************
 epoch: 0, train_loss: 1.3360, test_loss: 1.3208, test_f1: 0.2274
 epoch: 1, train_loss: 1.2759, test_loss: 1.2778, test_f1: 0.2274
 epoch: 2, train_loss: 1.2574, test_loss: 1.2569, test_f1: 0.2631
 epoch: 3, train_loss: 1.2441, test_loss: 1.2256, test_f1: 0.2649
 epoch: 4, train_loss: 1.2449, test_loss: 1.2168, test_f1: 0.2748
 epoch: 5, train_loss: 1.2349, test_loss: 1.2025, test_f1: 0.3178
 epoch: 6, train_loss: 1.2318, test_loss: 1.1950, test_f1: 0.3458
 epoch: 7, train_loss: 1.2202, test_loss: 1.1808, test_f1: 0.3570
 epoch: 8, train_loss: 1.2164, test_loss: 1.1809, test_f1: 0.3797
 epoch: 9, train_loss: 1.2022, test_loss: 1.1715, test_f1: 0.3690
 epoch: 10, train_loss: 1.1956, test_loss: 1.1634, test_f1: 0.3675
 epoch: 11, train_loss: 1.1895, test_loss: 1.1598, test_f1: 0.3656
 epoch: 12, train_loss: 1.1880, test_loss: 1.1518, test_f1: 0.3657
 epoch: 13, train_loss: 1.1719, test_loss: 1.1433, test_f1: 0.3815
 epoch: 14, train_loss: 1.1848, test_loss: 1.1359, test_f1: 0.3779
 epoch: 15, train_loss: 1.1764, test_loss: 1.1266, test_f1: 0.3891
 epoch: 16, train_loss: 1.1670, test_loss: 1.1207, test_f1: 0.3918
 epoch: 17, train_loss: 1.1528, test_loss: 1.1198, test_f1: 0.3927
 epoch: 18, train_loss: 1.1506, test_loss: 1.1296, test_f1: 0.3892
 epoch: 19, train_loss: 1.1466, test_loss: 1.0998, test_f1: 0.4178
 epoch: 20, train_loss: 1.1431, test_loss: 1.1046, test_f1: 0.4006
 epoch: 21, train_loss: 1.1413, test_loss: 1.0792, test_f1: 0.4086
 epoch: 22, train_loss: 1.1318, test_loss: 1.0797, test_f1: 0.4348
 epoch: 23, train_loss: 1.1281, test_loss: 1.0775, test_f1: 0.4164
 epoch: 24, train_loss: 1.1208, test_loss: 1.0748, test_f1: 0.4339
 epoch: 25, train_loss: 1.1219, test_loss: 1.0574, test_f1: 0.4438
 epoch: 26, train_loss: 1.1139, test_loss: 1.0549, test_f1: 0.4340
 epoch: 27, train_loss: 1.1027, test_loss: 1.0553, test_f1: 0.4403
 epoch: 28, train_loss: 1.0959, test_loss: 1.0518, test_f1: 0.4365
 epoch: 29, train_loss: 1.0948, test_loss: 1.0646, test_f1: 0.4172
 epoch: 30, train_loss: 1.0879, test_loss: 1.0432, test_f1: 0.4253
 epoch: 31, train_loss: 1.0891, test_loss: 1.0499, test_f1: 0.4535
 epoch: 32, train_loss: 1.0739, test_loss: 1.0279, test_f1: 0.4489
 epoch: 33, train_loss: 1.0775, test_loss: 1.0281, test_f1: 0.4427
 epoch: 34, train_loss: 1.0679, test_loss: 1.0217, test_f1: 0.4600
 epoch: 35, train_loss: 1.0636, test_loss: 1.0494, test_f1: 0.4456
 epoch: 36, train_loss: 1.0560, test_loss: 1.0104, test_f1: 0.4658
 epoch: 37, train_loss: 1.0537, test_loss: 1.0225, test_f1: 0.4546
 epoch: 38, train_loss: 1.0497, test_loss: 1.0133, test_f1: 0.4660
 epoch: 39, train_loss: 1.0433, test_loss: 0.9970, test_f1: 0.4705
 epoch: 40, train_loss: 1.0348, test_loss: 1.0090, test_f1: 0.4710
 epoch: 41, train_loss: 1.0471, test_loss: 1.0086, test_f1: 0.4517
 epoch: 42, train_loss: 1.0379, test_loss: 1.0029, test_f1: 0.4650
 epoch: 43, train_loss: 1.0337, test_loss: 0.9971, test_f1: 0.4604
 epoch: 44, train_loss: 1.0398, test_loss: 1.0066, test_f1: 0.4615
 epoch: 45, train_loss: 1.0204, test_loss: 1.0161, test_f1: 0.4482
 epoch: 46, train_loss: 1.0262, test_loss: 0.9896, test_f1: 0.4612
 epoch: 47, train_loss: 1.0219, test_loss: 1.0248, test_f1: 0.4553
 epoch: 48, train_loss: 1.0082, test_loss: 0.9955, test_f1: 0.4522
 epoch: 49, train_loss: 1.0027, test_loss: 0.9927, test_f1: 0.4622
 epoch: 50, train_loss: 1.0176, test_loss: 0.9835, test_f1: 0.4530
 epoch: 51, train_loss: 1.0033, test_loss: 0.9879, test_f1: 0.4596
 epoch: 52, train_loss: 0.9947, test_loss: 1.0100, test_f1: 0.4395
 epoch: 53, train_loss: 0.9959, test_loss: 0.9916, test_f1: 0.4646
 epoch: 54, train_loss: 0.9851, test_loss: 0.9768, test_f1: 0.4604
 epoch: 55, train_loss: 0.9872, test_loss: 0.9840, test_f1: 0.4510
 epoch: 56, train_loss: 1.0014, test_loss: 1.0110, test_f1: 0.4508
 epoch: 57, train_loss: 0.9810, test_loss: 1.0020, test_f1: 0.4477
 epoch: 58, train_loss: 0.9837, test_loss: 0.9814, test_f1: 0.4618
 epoch: 59, train_loss: 0.9789, test_loss: 0.9995, test_f1: 0.4649
 epoch: 60, train_loss: 0.9951, test_loss: 0.9730, test_f1: 0.4664
 epoch: 61, train_loss: 0.9807, test_loss: 0.9721, test_f1: 0.4754
 epoch: 62, train_loss: 0.9690, test_loss: 1.0144, test_f1: 0.4549
 epoch: 63, train_loss: 0.9735, test_loss: 0.9868, test_f1: 0.4645
 epoch: 64, train_loss: 0.9684, test_loss: 0.9895, test_f1: 0.4610
 epoch: 65, train_loss: 0.9640, test_loss: 0.9838, test_f1: 0.4558
 epoch: 66, train_loss: 0.9712, test_loss: 0.9879, test_f1: 0.4581
 epoch: 67, train_loss: 0.9566, test_loss: 1.0211, test_f1: 0.4777
 epoch: 68, train_loss: 0.9617, test_loss: 1.0020, test_f1: 0.4650
 epoch: 69, train_loss: 0.9619, test_loss: 0.9961, test_f1: 0.4582
 epoch: 70, train_loss: 0.9571, test_loss: 1.0011, test_f1: 0.4576
 epoch: 71, train_loss: 0.9571, test_loss: 0.9805, test_f1: 0.4681
 epoch: 72, train_loss: 0.9557, test_loss: 0.9761, test_f1: 0.4648
 epoch: 73, train_loss: 0.9538, test_loss: 0.9708, test_f1: 0.4878
 epoch: 74, train_loss: 0.9575, test_loss: 0.9883, test_f1: 0.4874
 epoch: 75, train_loss: 0.9527, test_loss: 0.9848, test_f1: 0.4643
 epoch: 76, train_loss: 0.9584, test_loss: 0.9615, test_f1: 0.4784
 epoch: 77, train_loss: 0.9476, test_loss: 1.0004, test_f1: 0.4826
 epoch: 78, train_loss: 0.9454, test_loss: 1.0096, test_f1: 0.4887
 epoch: 79, train_loss: 0.9438, test_loss: 0.9608, test_f1: 0.4822
 epoch: 80, train_loss: 0.9414, test_loss: 0.9930, test_f1: 0.4745
 epoch: 81, train_loss: 0.9422, test_loss: 1.0126, test_f1: 0.4646
 epoch: 82, train_loss: 0.9503, test_loss: 0.9834, test_f1: 0.5046
 epoch: 83, train_loss: 0.9364, test_loss: 0.9660, test_f1: 0.4668
 epoch: 84, train_loss: 0.9391, test_loss: 0.9829, test_f1: 0.4752
 epoch: 85, train_loss: 0.9359, test_loss: 0.9966, test_f1: 0.4843
 epoch: 86, train_loss: 0.9407, test_loss: 1.0105, test_f1: 0.4803
 epoch: 87, train_loss: 0.9325, test_loss: 1.0243, test_f1: 0.4584
 epoch: 88, train_loss: 0.9436, test_loss: 0.9841, test_f1: 0.5138
 epoch: 89, train_loss: 0.9392, test_loss: 0.9882, test_f1: 0.4902
 epoch: 90, train_loss: 0.9328, test_loss: 1.0327, test_f1: 0.4597
 epoch: 91, train_loss: 0.9394, test_loss: 0.9937, test_f1: 0.4567
 epoch: 92, train_loss: 0.9362, test_loss: 1.0477, test_f1: 0.4705
 epoch: 93, train_loss: 0.9431, test_loss: 1.0163, test_f1: 0.4584
 epoch: 94, train_loss: 0.9146, test_loss: 1.0162, test_f1: 0.4697
 epoch: 95, train_loss: 0.9307, test_loss: 0.9894, test_f1: 0.4698
 epoch: 96, train_loss: 0.9254, test_loss: 1.0057, test_f1: 0.4687
 epoch: 97, train_loss: 0.9276, test_loss: 0.9997, test_f1: 0.4673
 epoch: 98, train_loss: 0.9252, test_loss: 1.0009, test_f1: 0.4571
 epoch: 99, train_loss: 0.9218, test_loss: 1.0339, test_f1: 0.4532
##################ITERATION #8 ****************************************
 epoch: 0, train_loss: 1.3639, test_loss: 1.3319, test_f1: 0.2274
 epoch: 1, train_loss: 1.3041, test_loss: 1.3002, test_f1: 0.2274
 epoch: 2, train_loss: 1.2717, test_loss: 1.2633, test_f1: 0.2269
 epoch: 3, train_loss: 1.2608, test_loss: 1.2369, test_f1: 0.2489
 epoch: 4, train_loss: 1.2382, test_loss: 1.2176, test_f1: 0.2957
 epoch: 5, train_loss: 1.2401, test_loss: 1.1993, test_f1: 0.3161
 epoch: 6, train_loss: 1.2249, test_loss: 1.1794, test_f1: 0.3487
 epoch: 7, train_loss: 1.2074, test_loss: 1.1684, test_f1: 0.3501
 epoch: 8, train_loss: 1.1999, test_loss: 1.1547, test_f1: 0.3626
 epoch: 9, train_loss: 1.1929, test_loss: 1.1450, test_f1: 0.3707
 epoch: 10, train_loss: 1.1834, test_loss: 1.1291, test_f1: 0.3748
 epoch: 11, train_loss: 1.1646, test_loss: 1.1172, test_f1: 0.3859
 epoch: 12, train_loss: 1.1650, test_loss: 1.1153, test_f1: 0.3945
 epoch: 13, train_loss: 1.1607, test_loss: 1.1047, test_f1: 0.3991
 epoch: 14, train_loss: 1.1546, test_loss: 1.0948, test_f1: 0.4091
 epoch: 15, train_loss: 1.1414, test_loss: 1.0919, test_f1: 0.4276
 epoch: 16, train_loss: 1.1365, test_loss: 1.0850, test_f1: 0.4175
 epoch: 17, train_loss: 1.1332, test_loss: 1.0800, test_f1: 0.4159
 epoch: 18, train_loss: 1.1250, test_loss: 1.0730, test_f1: 0.4265
 epoch: 19, train_loss: 1.1209, test_loss: 1.0682, test_f1: 0.4355
 epoch: 20, train_loss: 1.1121, test_loss: 1.0693, test_f1: 0.4298
 epoch: 21, train_loss: 1.1101, test_loss: 1.0583, test_f1: 0.4412
 epoch: 22, train_loss: 1.0961, test_loss: 1.0518, test_f1: 0.4351
 epoch: 23, train_loss: 1.1047, test_loss: 1.0402, test_f1: 0.4501
 epoch: 24, train_loss: 1.0884, test_loss: 1.0542, test_f1: 0.4437
 epoch: 25, train_loss: 1.0766, test_loss: 1.0321, test_f1: 0.4518
 epoch: 26, train_loss: 1.0760, test_loss: 1.0260, test_f1: 0.4564
 epoch: 27, train_loss: 1.0742, test_loss: 1.0260, test_f1: 0.4502
 epoch: 28, train_loss: 1.0670, test_loss: 1.0305, test_f1: 0.4474
 epoch: 29, train_loss: 1.0710, test_loss: 1.0226, test_f1: 0.4603
 epoch: 30, train_loss: 1.0635, test_loss: 1.0439, test_f1: 0.4403
 epoch: 31, train_loss: 1.0568, test_loss: 1.0148, test_f1: 0.4613
 epoch: 32, train_loss: 1.0545, test_loss: 1.0314, test_f1: 0.4520
 epoch: 33, train_loss: 1.0517, test_loss: 1.0218, test_f1: 0.4611
 epoch: 34, train_loss: 1.0399, test_loss: 1.0309, test_f1: 0.4673
 epoch: 35, train_loss: 1.0368, test_loss: 1.0100, test_f1: 0.4728
 epoch: 36, train_loss: 1.0356, test_loss: 1.0409, test_f1: 0.4742
 epoch: 37, train_loss: 1.0293, test_loss: 1.1258, test_f1: 0.4579
 epoch: 38, train_loss: 1.0228, test_loss: 1.0217, test_f1: 0.4598
 epoch: 39, train_loss: 1.0175, test_loss: 1.0179, test_f1: 0.4637
 epoch: 40, train_loss: 1.0141, test_loss: 1.0182, test_f1: 0.4722
 epoch: 41, train_loss: 1.0053, test_loss: 1.0629, test_f1: 0.4650
 epoch: 42, train_loss: 1.0008, test_loss: 1.0391, test_f1: 0.4886
 epoch: 43, train_loss: 1.0017, test_loss: 1.0425, test_f1: 0.4896
 epoch: 44, train_loss: 1.0010, test_loss: 1.0386, test_f1: 0.4714
 epoch: 45, train_loss: 1.0011, test_loss: 1.0405, test_f1: 0.4881
 epoch: 46, train_loss: 0.9940, test_loss: 1.0314, test_f1: 0.4822
 epoch: 47, train_loss: 0.9889, test_loss: 1.0275, test_f1: 0.4811
 epoch: 48, train_loss: 0.9863, test_loss: 1.0248, test_f1: 0.4831
 epoch: 49, train_loss: 0.9766, test_loss: 1.0898, test_f1: 0.4644
 epoch: 50, train_loss: 0.9738, test_loss: 1.0290, test_f1: 0.4790
 epoch: 51, train_loss: 0.9699, test_loss: 1.0475, test_f1: 0.4731
 epoch: 52, train_loss: 0.9632, test_loss: 1.0406, test_f1: 0.4856
 epoch: 53, train_loss: 0.9520, test_loss: 1.0401, test_f1: 0.4839
 epoch: 54, train_loss: 0.9695, test_loss: 1.0510, test_f1: 0.4830
 epoch: 55, train_loss: 0.9604, test_loss: 1.0533, test_f1: 0.4840
 epoch: 56, train_loss: 0.9728, test_loss: 1.0406, test_f1: 0.4758
 epoch: 57, train_loss: 0.9654, test_loss: 1.0596, test_f1: 0.4731
 epoch: 58, train_loss: 0.9507, test_loss: 1.0639, test_f1: 0.4695
 epoch: 59, train_loss: 0.9556, test_loss: 1.0360, test_f1: 0.4699
 epoch: 60, train_loss: 0.9512, test_loss: 1.0624, test_f1: 0.4677
 epoch: 61, train_loss: 0.9545, test_loss: 1.0520, test_f1: 0.4778
 epoch: 62, train_loss: 0.9435, test_loss: 1.0559, test_f1: 0.4816
 epoch: 63, train_loss: 0.9416, test_loss: 1.0655, test_f1: 0.4668
 epoch: 64, train_loss: 0.9482, test_loss: 1.0598, test_f1: 0.4756
 epoch: 65, train_loss: 0.9475, test_loss: 1.0597, test_f1: 0.4828
 epoch: 66, train_loss: 0.9472, test_loss: 1.0591, test_f1: 0.4781
 epoch: 67, train_loss: 0.9385, test_loss: 1.0552, test_f1: 0.4881
 epoch: 68, train_loss: 0.9419, test_loss: 1.0506, test_f1: 0.4822
 epoch: 69, train_loss: 0.9416, test_loss: 1.0598, test_f1: 0.4739
 epoch: 70, train_loss: 0.9347, test_loss: 1.0658, test_f1: 0.4831
 epoch: 71, train_loss: 0.9331, test_loss: 1.0633, test_f1: 0.4889
 epoch: 72, train_loss: 0.9295, test_loss: 1.0673, test_f1: 0.4712
 epoch: 73, train_loss: 0.9351, test_loss: 1.0598, test_f1: 0.4814
 epoch: 74, train_loss: 0.9236, test_loss: 1.0557, test_f1: 0.4884
 epoch: 75, train_loss: 0.9293, test_loss: 1.0478, test_f1: 0.4846
 epoch: 76, train_loss: 0.9314, test_loss: 1.0759, test_f1: 0.4798
 epoch: 77, train_loss: 0.9262, test_loss: 1.0600, test_f1: 0.4680
 epoch: 78, train_loss: 0.9303, test_loss: 1.0652, test_f1: 0.4774
 epoch: 79, train_loss: 0.9331, test_loss: 1.0437, test_f1: 0.4867
 epoch: 80, train_loss: 0.9307, test_loss: 1.0590, test_f1: 0.4763
 epoch: 81, train_loss: 0.9235, test_loss: 1.0716, test_f1: 0.4817
 epoch: 82, train_loss: 0.9192, test_loss: 1.0739, test_f1: 0.4662
 epoch: 83, train_loss: 0.9085, test_loss: 1.0963, test_f1: 0.4619
 epoch: 84, train_loss: 0.9159, test_loss: 1.0615, test_f1: 0.4787
 epoch: 85, train_loss: 0.9113, test_loss: 1.0692, test_f1: 0.4795
 epoch: 86, train_loss: 0.9071, test_loss: 1.0827, test_f1: 0.4801
 epoch: 87, train_loss: 0.9106, test_loss: 1.0831, test_f1: 0.4756
 epoch: 88, train_loss: 0.9088, test_loss: 1.0983, test_f1: 0.4610
 epoch: 89, train_loss: 0.9185, test_loss: 1.0870, test_f1: 0.4679
 epoch: 90, train_loss: 0.9162, test_loss: 1.0748, test_f1: 0.4803
 epoch: 91, train_loss: 0.9112, test_loss: 1.0779, test_f1: 0.4799
 epoch: 92, train_loss: 0.8955, test_loss: 1.0914, test_f1: 0.4715
 epoch: 93, train_loss: 0.9102, test_loss: 1.0996, test_f1: 0.4724
 epoch: 94, train_loss: 0.8983, test_loss: 1.0710, test_f1: 0.4820
 epoch: 95, train_loss: 0.9141, test_loss: 1.0864, test_f1: 0.4805
 epoch: 96, train_loss: 0.9141, test_loss: 1.1211, test_f1: 0.4675
 epoch: 97, train_loss: 0.8978, test_loss: 1.1120, test_f1: 0.4753
 epoch: 98, train_loss: 0.8861, test_loss: 1.1030, test_f1: 0.4772
 epoch: 99, train_loss: 0.9078, test_loss: 1.1051, test_f1: 0.4788
##################ITERATION #9 ****************************************
 epoch: 0, train_loss: 1.5157, test_loss: 1.2922, test_f1: 0.2274
 epoch: 1, train_loss: 1.3202, test_loss: 1.2747, test_f1: 0.2300
 epoch: 2, train_loss: 1.2832, test_loss: 1.2614, test_f1: 0.2399
 epoch: 3, train_loss: 1.2683, test_loss: 1.2464, test_f1: 0.2378
 epoch: 4, train_loss: 1.2533, test_loss: 1.2292, test_f1: 0.2509
 epoch: 5, train_loss: 1.2318, test_loss: 1.2138, test_f1: 0.2823
 epoch: 6, train_loss: 1.2325, test_loss: 1.2005, test_f1: 0.3179
 epoch: 7, train_loss: 1.2264, test_loss: 1.1897, test_f1: 0.3243
 epoch: 8, train_loss: 1.2206, test_loss: 1.1815, test_f1: 0.3442
 epoch: 9, train_loss: 1.2142, test_loss: 1.1776, test_f1: 0.3620
 epoch: 10, train_loss: 1.2142, test_loss: 1.1681, test_f1: 0.3751
 epoch: 11, train_loss: 1.2048, test_loss: 1.1603, test_f1: 0.3774
 epoch: 12, train_loss: 1.1933, test_loss: 1.1542, test_f1: 0.3898
 epoch: 13, train_loss: 1.1836, test_loss: 1.1478, test_f1: 0.3777
 epoch: 14, train_loss: 1.1740, test_loss: 1.1386, test_f1: 0.4100
 epoch: 15, train_loss: 1.1720, test_loss: 1.1297, test_f1: 0.4197
 epoch: 16, train_loss: 1.1624, test_loss: 1.1223, test_f1: 0.4131
 epoch: 17, train_loss: 1.1627, test_loss: 1.1160, test_f1: 0.4147
 epoch: 18, train_loss: 1.1570, test_loss: 1.1109, test_f1: 0.4280
 epoch: 19, train_loss: 1.1408, test_loss: 1.1072, test_f1: 0.4076
 epoch: 20, train_loss: 1.1439, test_loss: 1.1002, test_f1: 0.4169
 epoch: 21, train_loss: 1.1394, test_loss: 1.0914, test_f1: 0.4305
 epoch: 22, train_loss: 1.1387, test_loss: 1.0853, test_f1: 0.4341
 epoch: 23, train_loss: 1.1207, test_loss: 1.0770, test_f1: 0.4308
 epoch: 24, train_loss: 1.1257, test_loss: 1.0713, test_f1: 0.4301
 epoch: 25, train_loss: 1.1213, test_loss: 1.0635, test_f1: 0.4358
 epoch: 26, train_loss: 1.1144, test_loss: 1.0599, test_f1: 0.4422
 epoch: 27, train_loss: 1.1058, test_loss: 1.0549, test_f1: 0.4408
 epoch: 28, train_loss: 1.1021, test_loss: 1.0518, test_f1: 0.4427
 epoch: 29, train_loss: 1.0962, test_loss: 1.0481, test_f1: 0.4407
 epoch: 30, train_loss: 1.0924, test_loss: 1.0426, test_f1: 0.4460
 epoch: 31, train_loss: 1.0962, test_loss: 1.0369, test_f1: 0.4440
 epoch: 32, train_loss: 1.0830, test_loss: 1.0357, test_f1: 0.4488
 epoch: 33, train_loss: 1.0830, test_loss: 1.0210, test_f1: 0.4528
 epoch: 34, train_loss: 1.0708, test_loss: 1.0171, test_f1: 0.4438
 epoch: 35, train_loss: 1.0722, test_loss: 1.0169, test_f1: 0.4548
 epoch: 36, train_loss: 1.0669, test_loss: 1.0073, test_f1: 0.4600
 epoch: 37, train_loss: 1.0665, test_loss: 1.0020, test_f1: 0.4670
 epoch: 38, train_loss: 1.0652, test_loss: 1.0003, test_f1: 0.4820
 epoch: 39, train_loss: 1.0478, test_loss: 0.9973, test_f1: 0.4708
 epoch: 40, train_loss: 1.0500, test_loss: 0.9966, test_f1: 0.4527
 epoch: 41, train_loss: 1.0523, test_loss: 0.9880, test_f1: 0.4641
 epoch: 42, train_loss: 1.0425, test_loss: 0.9859, test_f1: 0.4706
 epoch: 43, train_loss: 1.0412, test_loss: 0.9829, test_f1: 0.4723
 epoch: 44, train_loss: 1.0293, test_loss: 0.9778, test_f1: 0.4783
 epoch: 45, train_loss: 1.0262, test_loss: 0.9737, test_f1: 0.4816
 epoch: 46, train_loss: 1.0134, test_loss: 0.9712, test_f1: 0.4692
 epoch: 47, train_loss: 1.0127, test_loss: 0.9595, test_f1: 0.4838
 epoch: 48, train_loss: 1.0145, test_loss: 0.9722, test_f1: 0.4889
 epoch: 49, train_loss: 1.0249, test_loss: 0.9657, test_f1: 0.4672
 epoch: 50, train_loss: 1.0121, test_loss: 0.9542, test_f1: 0.4854
 epoch: 51, train_loss: 1.0040, test_loss: 0.9526, test_f1: 0.4840
 epoch: 52, train_loss: 1.0038, test_loss: 0.9531, test_f1: 0.4803
 epoch: 53, train_loss: 1.0029, test_loss: 0.9507, test_f1: 0.4869
 epoch: 54, train_loss: 1.0020, test_loss: 0.9502, test_f1: 0.4735
 epoch: 55, train_loss: 0.9908, test_loss: 0.9503, test_f1: 0.4811
 epoch: 56, train_loss: 0.9901, test_loss: 0.9517, test_f1: 0.4771
 epoch: 57, train_loss: 0.9907, test_loss: 0.9613, test_f1: 0.4822
 epoch: 58, train_loss: 0.9822, test_loss: 0.9544, test_f1: 0.4772
 epoch: 59, train_loss: 0.9903, test_loss: 0.9496, test_f1: 0.4829
 epoch: 60, train_loss: 0.9868, test_loss: 0.9669, test_f1: 0.4833
 epoch: 61, train_loss: 0.9727, test_loss: 0.9532, test_f1: 0.4797
 epoch: 62, train_loss: 0.9771, test_loss: 0.9678, test_f1: 0.4797
 epoch: 63, train_loss: 0.9791, test_loss: 0.9688, test_f1: 0.4821
 epoch: 64, train_loss: 0.9831, test_loss: 0.9731, test_f1: 0.4847
 epoch: 65, train_loss: 0.9752, test_loss: 0.9613, test_f1: 0.4887
 epoch: 66, train_loss: 0.9740, test_loss: 0.9595, test_f1: 0.4887
 epoch: 67, train_loss: 0.9682, test_loss: 0.9669, test_f1: 0.4852
 epoch: 68, train_loss: 0.9662, test_loss: 0.9713, test_f1: 0.4895
 epoch: 69, train_loss: 0.9642, test_loss: 0.9711, test_f1: 0.4863
 epoch: 70, train_loss: 0.9627, test_loss: 0.9969, test_f1: 0.4812
 epoch: 71, train_loss: 0.9592, test_loss: 0.9760, test_f1: 0.4848
 epoch: 72, train_loss: 0.9628, test_loss: 0.9892, test_f1: 0.4869
 epoch: 73, train_loss: 0.9491, test_loss: 0.9997, test_f1: 0.4884
 epoch: 74, train_loss: 0.9591, test_loss: 0.9971, test_f1: 0.4852
 epoch: 75, train_loss: 0.9588, test_loss: 0.9916, test_f1: 0.4879
 epoch: 76, train_loss: 0.9561, test_loss: 0.9972, test_f1: 0.4779
 epoch: 77, train_loss: 0.9530, test_loss: 1.0012, test_f1: 0.4792
 epoch: 78, train_loss: 0.9529, test_loss: 1.0012, test_f1: 0.4842
 epoch: 79, train_loss: 0.9535, test_loss: 1.0161, test_f1: 0.4865
 epoch: 80, train_loss: 0.9498, test_loss: 0.9954, test_f1: 0.4798
 epoch: 81, train_loss: 0.9478, test_loss: 1.0020, test_f1: 0.4878
 epoch: 82, train_loss: 0.9394, test_loss: 0.9958, test_f1: 0.4910
 epoch: 83, train_loss: 0.9474, test_loss: 1.0129, test_f1: 0.4925
 epoch: 84, train_loss: 0.9486, test_loss: 0.9944, test_f1: 0.4865
 epoch: 85, train_loss: 0.9406, test_loss: 1.0045, test_f1: 0.4860
 epoch: 86, train_loss: 0.9422, test_loss: 1.0077, test_f1: 0.4884
 epoch: 87, train_loss: 0.9278, test_loss: 1.0039, test_f1: 0.4844
 epoch: 88, train_loss: 0.9391, test_loss: 1.0227, test_f1: 0.4783
 epoch: 89, train_loss: 0.9302, test_loss: 1.0158, test_f1: 0.4836
 epoch: 90, train_loss: 0.9223, test_loss: 1.0102, test_f1: 0.4844
 epoch: 91, train_loss: 0.9388, test_loss: 1.0045, test_f1: 0.4813
 epoch: 92, train_loss: 0.9303, test_loss: 1.0169, test_f1: 0.4892
 epoch: 93, train_loss: 0.9256, test_loss: 1.0125, test_f1: 0.4801
 epoch: 94, train_loss: 0.9177, test_loss: 1.0092, test_f1: 0.4927
 epoch: 95, train_loss: 0.9367, test_loss: 1.0035, test_f1: 0.4859
 epoch: 96, train_loss: 0.9220, test_loss: 1.0172, test_f1: 0.4849
 epoch: 97, train_loss: 0.9257, test_loss: 1.0328, test_f1: 0.4879
 epoch: 98, train_loss: 0.9316, test_loss: 0.9889, test_f1: 0.4842
 epoch: 99, train_loss: 0.9198, test_loss: 1.0244, test_f1: 0.4818

Training completed in 377.42 seconds
Best F1: 0.5367 at epoch 74
Mean F1 across iterations: 0.5014  0.0164
========================FINAL RESULTS================================
FEGIN weighted F1: 0.5367  0.0164
python main.py --data ltspice_examples --representation component_component --model FEGIN --layers 3 --hiddens 16 --batch_size 256 --lr 0.001 --emb_size 128 --epochs 100 --save_appendix component_component_L3_H16_BS256_LR0.001_E128 --no_val
-----



STDERR:
  File "main.py", line 370, in <module>
    main()
  File "main.py", line 254, in main
    dataset = dataset_class(
  File "/home/philip/projects/ltspice_examples_code_repo/Circuit-Completion-Using-GNNs/component_classification_with_link_prediction_head/evaluation/FEGIN/kernel/circuit_datasets.py", line 15, in __init__
    self.data, self.slices = torch.load(self.processed_paths[0])
  File "/home/philip/.local/lib/python3.8/site-packages/torch/serialization.py", line 1040, in load
    warnings.warn(
  File "/usr/lib/python3.8/warnings.py", line 109, in _showwarnmsg
    sw(msg.message, msg.category, msg.filename, msg.lineno,
  File "main.py", line 47, in warn_with_traceback
    traceback.print_stack(file=log)
/home/philip/projects/ltspice_examples_code_repo/Circuit-Completion-Using-GNNs/component_classification_with_link_prediction_head/evaluation/FEGIN/kernel/circuit_datasets.py:15: FutureWarning: You are using `torch.load` with `weights_only=False` (the current default value), which uses the default pickle module implicitly. It is possible to construct malicious pickle data which will execute arbitrary code during unpickling (See https://github.com/pytorch/pytorch/blob/main/SECURITY.md#untrusted-models for more details). In a future release, the default value for `weights_only` will be flipped to `True`. This limits the functions that could be executed during unpickling. Arbitrary objects will no longer be allowed to be loaded via this mode unless they are explicitly allowlisted by the user via `torch.serialization.add_safe_globals`. We recommend you start setting `weights_only=True` for any use case where you don't have full control of the loaded file. Please open an issue on GitHub for any issues related to this experimental feature.
  self.data, self.slices = torch.load(self.processed_paths[0])
