STDOUT:
Results will be saved in /home/philip/projects/ltspice_examples_code_repo/Circuit-Completion-Using-GNNs/component_classification_with_link_prediction_head/evaluation/FEGIN/results/model_FEGIN_dataset_ltspice_examples
Command line input: python main.py --data ltspice_examples --representation component_pin --model FEGIN --layers 5 --hiddens 16 --batch_size 256 --lr 0.001 --emb_size 128 --epochs 100 --save_appendix component_pin_L5_H16_BS256_LR0.001_E128 --no_val
 is saved.
-----
ltspice_examples - FEGIN
Using 5 layers, 16 hidden units, h = 2
Loading component_pin representation dataset
ENTERED
Training FEGIN on component_pin representation
Train: 3560, Test: 848
##################ITERATION #0 ****************************************
 epoch: 0, train_loss: 1.4368, test_loss: 1.4214, test_f1: 0.1017
 epoch: 1, train_loss: 1.4145, test_loss: 1.4059, test_f1: 0.1017
 epoch: 2, train_loss: 1.3941, test_loss: 1.3843, test_f1: 0.1017
 epoch: 3, train_loss: 1.3658, test_loss: 1.3535, test_f1: 0.2093
 epoch: 4, train_loss: 1.3373, test_loss: 1.3246, test_f1: 0.2427
 epoch: 5, train_loss: 1.3117, test_loss: 1.3004, test_f1: 0.2517
 epoch: 6, train_loss: 1.2929, test_loss: 1.2714, test_f1: 0.2312
 epoch: 7, train_loss: 1.2638, test_loss: 1.2460, test_f1: 0.2260
 epoch: 8, train_loss: 1.2371, test_loss: 1.2135, test_f1: 0.2557
 epoch: 9, train_loss: 1.2041, test_loss: 1.1807, test_f1: 0.3804
 epoch: 10, train_loss: 1.1822, test_loss: 1.1376, test_f1: 0.3980
 epoch: 11, train_loss: 1.1470, test_loss: 1.1051, test_f1: 0.3959
 epoch: 12, train_loss: 1.1171, test_loss: 1.1026, test_f1: 0.3755
 epoch: 13, train_loss: 1.0947, test_loss: 1.0884, test_f1: 0.3983
 epoch: 14, train_loss: 1.0894, test_loss: 1.2317, test_f1: 0.3422
 epoch: 15, train_loss: 1.0861, test_loss: 1.0676, test_f1: 0.3911
 epoch: 16, train_loss: 1.0750, test_loss: 1.1810, test_f1: 0.3524
 epoch: 17, train_loss: 1.0656, test_loss: 1.0363, test_f1: 0.3640
 epoch: 18, train_loss: 1.0530, test_loss: 1.0298, test_f1: 0.3744
 epoch: 19, train_loss: 1.0404, test_loss: 1.0329, test_f1: 0.3766
 epoch: 20, train_loss: 1.0324, test_loss: 1.0263, test_f1: 0.4240
 epoch: 21, train_loss: 1.0249, test_loss: 1.0166, test_f1: 0.4050
 epoch: 22, train_loss: 1.0172, test_loss: 1.0159, test_f1: 0.4585
 epoch: 23, train_loss: 1.0181, test_loss: 1.0620, test_f1: 0.4628
 epoch: 24, train_loss: 1.0170, test_loss: 1.1217, test_f1: 0.3940
 epoch: 25, train_loss: 1.0113, test_loss: 1.0354, test_f1: 0.4538
 epoch: 26, train_loss: 0.9917, test_loss: 1.1506, test_f1: 0.4413
 epoch: 27, train_loss: 0.9883, test_loss: 1.0489, test_f1: 0.4375
 epoch: 28, train_loss: 0.9811, test_loss: 1.0076, test_f1: 0.4573
 epoch: 29, train_loss: 0.9800, test_loss: 1.0451, test_f1: 0.5061
 epoch: 30, train_loss: 0.9791, test_loss: 1.0116, test_f1: 0.4693
 epoch: 31, train_loss: 0.9588, test_loss: 1.0440, test_f1: 0.4560
 epoch: 32, train_loss: 0.9615, test_loss: 1.0174, test_f1: 0.5018
 epoch: 33, train_loss: 0.9518, test_loss: 1.0497, test_f1: 0.4827
 epoch: 34, train_loss: 0.9596, test_loss: 1.1819, test_f1: 0.4631
 epoch: 35, train_loss: 0.9651, test_loss: 1.0043, test_f1: 0.4883
 epoch: 36, train_loss: 0.9433, test_loss: 1.0037, test_f1: 0.5102
 epoch: 37, train_loss: 0.9392, test_loss: 1.0340, test_f1: 0.4750
 epoch: 38, train_loss: 0.9379, test_loss: 1.0748, test_f1: 0.4857
 epoch: 39, train_loss: 0.9264, test_loss: 1.0371, test_f1: 0.5021
 epoch: 40, train_loss: 0.9303, test_loss: 1.0261, test_f1: 0.4662
 epoch: 41, train_loss: 0.9153, test_loss: 0.9911, test_f1: 0.5110
 epoch: 42, train_loss: 0.9142, test_loss: 1.0710, test_f1: 0.4651
 epoch: 43, train_loss: 0.9069, test_loss: 0.9605, test_f1: 0.4965
 epoch: 44, train_loss: 0.9054, test_loss: 0.9437, test_f1: 0.5265
 epoch: 45, train_loss: 0.8979, test_loss: 1.0448, test_f1: 0.4910
 epoch: 46, train_loss: 0.8979, test_loss: 0.9686, test_f1: 0.5263
 epoch: 47, train_loss: 0.8910, test_loss: 0.9164, test_f1: 0.5133
 epoch: 48, train_loss: 0.8845, test_loss: 0.9917, test_f1: 0.4991
 epoch: 49, train_loss: 0.8764, test_loss: 0.9490, test_f1: 0.5124
 epoch: 50, train_loss: 0.8793, test_loss: 1.0412, test_f1: 0.5136
 epoch: 51, train_loss: 0.8742, test_loss: 1.0449, test_f1: 0.5013
 epoch: 52, train_loss: 0.8617, test_loss: 0.9370, test_f1: 0.5259
 epoch: 53, train_loss: 0.8606, test_loss: 0.9519, test_f1: 0.5293
 epoch: 54, train_loss: 0.8638, test_loss: 0.9546, test_f1: 0.5348
 epoch: 55, train_loss: 0.8541, test_loss: 0.9584, test_f1: 0.5315
 epoch: 56, train_loss: 0.8517, test_loss: 0.9494, test_f1: 0.5366
 epoch: 57, train_loss: 0.8557, test_loss: 0.9655, test_f1: 0.5259
 epoch: 58, train_loss: 0.8399, test_loss: 0.9694, test_f1: 0.5402
 epoch: 59, train_loss: 0.8463, test_loss: 0.9706, test_f1: 0.5225
 epoch: 60, train_loss: 0.8435, test_loss: 0.9561, test_f1: 0.5313
 epoch: 61, train_loss: 0.8407, test_loss: 1.0224, test_f1: 0.5196
 epoch: 62, train_loss: 0.8327, test_loss: 0.9626, test_f1: 0.5109
 epoch: 63, train_loss: 0.8275, test_loss: 0.9783, test_f1: 0.5196
 epoch: 64, train_loss: 0.8358, test_loss: 0.9882, test_f1: 0.5281
 epoch: 65, train_loss: 0.8401, test_loss: 0.9838, test_f1: 0.5108
 epoch: 66, train_loss: 0.8298, test_loss: 0.9717, test_f1: 0.5162
 epoch: 67, train_loss: 0.8244, test_loss: 0.9652, test_f1: 0.5432
 epoch: 68, train_loss: 0.8246, test_loss: 0.9680, test_f1: 0.5186
 epoch: 69, train_loss: 0.8178, test_loss: 0.9671, test_f1: 0.5447
 epoch: 70, train_loss: 0.8183, test_loss: 0.9755, test_f1: 0.5079
 epoch: 71, train_loss: 0.8222, test_loss: 0.9865, test_f1: 0.5183
 epoch: 72, train_loss: 0.8142, test_loss: 0.9953, test_f1: 0.5220
 epoch: 73, train_loss: 0.8165, test_loss: 0.9660, test_f1: 0.5226
 epoch: 74, train_loss: 0.8071, test_loss: 0.9662, test_f1: 0.5180
 epoch: 75, train_loss: 0.8104, test_loss: 0.9602, test_f1: 0.5094
 epoch: 76, train_loss: 0.8061, test_loss: 0.9834, test_f1: 0.5106
 epoch: 77, train_loss: 0.8045, test_loss: 0.9474, test_f1: 0.5213
 epoch: 78, train_loss: 0.7989, test_loss: 1.0086, test_f1: 0.5193
 epoch: 79, train_loss: 0.7992, test_loss: 0.9784, test_f1: 0.5149
 epoch: 80, train_loss: 0.7986, test_loss: 0.9620, test_f1: 0.5338
 epoch: 81, train_loss: 0.7977, test_loss: 0.9762, test_f1: 0.5263
 epoch: 82, train_loss: 0.7990, test_loss: 0.9768, test_f1: 0.5405
 epoch: 83, train_loss: 0.8007, test_loss: 0.9788, test_f1: 0.5217
 epoch: 84, train_loss: 0.7864, test_loss: 0.9697, test_f1: 0.5063
 epoch: 85, train_loss: 0.7912, test_loss: 0.9933, test_f1: 0.5323
 epoch: 86, train_loss: 0.7946, test_loss: 0.9930, test_f1: 0.5067
 epoch: 87, train_loss: 0.7805, test_loss: 0.9674, test_f1: 0.5352
 epoch: 88, train_loss: 0.7744, test_loss: 0.9677, test_f1: 0.5362
 epoch: 89, train_loss: 0.7824, test_loss: 0.9715, test_f1: 0.5469
 epoch: 90, train_loss: 0.7842, test_loss: 0.9658, test_f1: 0.5450
 epoch: 91, train_loss: 0.7778, test_loss: 0.9582, test_f1: 0.5298
 epoch: 92, train_loss: 0.7771, test_loss: 0.9643, test_f1: 0.5204
 epoch: 93, train_loss: 0.7773, test_loss: 0.9584, test_f1: 0.5223
 epoch: 94, train_loss: 0.8011, test_loss: 0.9770, test_f1: 0.5330
 epoch: 95, train_loss: 0.7788, test_loss: 0.9721, test_f1: 0.5361
 epoch: 96, train_loss: 0.7714, test_loss: 0.9950, test_f1: 0.5168
 epoch: 97, train_loss: 0.7666, test_loss: 0.9906, test_f1: 0.5203
 epoch: 98, train_loss: 0.7778, test_loss: 0.9889, test_f1: 0.5305
 epoch: 99, train_loss: 0.7728, test_loss: 0.9586, test_f1: 0.5273
##################ITERATION #1 ****************************************
 epoch: 0, train_loss: 1.3458, test_loss: 1.3480, test_f1: 0.1017
 epoch: 1, train_loss: 1.2785, test_loss: 1.3249, test_f1: 0.2453
 epoch: 2, train_loss: 1.2333, test_loss: 1.2722, test_f1: 0.2260
 epoch: 3, train_loss: 1.1936, test_loss: 1.1851, test_f1: 0.3365
 epoch: 4, train_loss: 1.1570, test_loss: 1.1315, test_f1: 0.3353
 epoch: 5, train_loss: 1.1237, test_loss: 1.1212, test_f1: 0.3171
 epoch: 6, train_loss: 1.0941, test_loss: 1.0957, test_f1: 0.3226
 epoch: 7, train_loss: 1.0734, test_loss: 1.0863, test_f1: 0.3400
 epoch: 8, train_loss: 1.0541, test_loss: 1.1060, test_f1: 0.3303
 epoch: 9, train_loss: 1.0403, test_loss: 1.0965, test_f1: 0.3297
 epoch: 10, train_loss: 1.0247, test_loss: 1.0586, test_f1: 0.4320
 epoch: 11, train_loss: 1.0253, test_loss: 1.0586, test_f1: 0.4330
 epoch: 12, train_loss: 1.0113, test_loss: 1.0599, test_f1: 0.4430
 epoch: 13, train_loss: 1.0108, test_loss: 1.0692, test_f1: 0.4532
 epoch: 14, train_loss: 1.0065, test_loss: 1.0661, test_f1: 0.4462
 epoch: 15, train_loss: 0.9882, test_loss: 1.1018, test_f1: 0.4503
 epoch: 16, train_loss: 0.9821, test_loss: 1.0595, test_f1: 0.4505
 epoch: 17, train_loss: 0.9824, test_loss: 1.0416, test_f1: 0.4557
 epoch: 18, train_loss: 0.9654, test_loss: 1.0717, test_f1: 0.4595
 epoch: 19, train_loss: 0.9654, test_loss: 1.0835, test_f1: 0.4482
 epoch: 20, train_loss: 0.9590, test_loss: 1.0747, test_f1: 0.4523
 epoch: 21, train_loss: 0.9550, test_loss: 1.0827, test_f1: 0.4582
 epoch: 22, train_loss: 0.9528, test_loss: 1.0787, test_f1: 0.4756
 epoch: 23, train_loss: 0.9565, test_loss: 1.1065, test_f1: 0.4606
 epoch: 24, train_loss: 0.9469, test_loss: 1.0938, test_f1: 0.4742
 epoch: 25, train_loss: 0.9539, test_loss: 1.0485, test_f1: 0.4831
 epoch: 26, train_loss: 0.9480, test_loss: 1.0316, test_f1: 0.4945
 epoch: 27, train_loss: 0.9455, test_loss: 1.0387, test_f1: 0.4952
 epoch: 28, train_loss: 0.9290, test_loss: 1.0523, test_f1: 0.4826
 epoch: 29, train_loss: 0.9233, test_loss: 1.1507, test_f1: 0.4732
 epoch: 30, train_loss: 0.9220, test_loss: 1.0383, test_f1: 0.4863
 epoch: 31, train_loss: 0.9165, test_loss: 1.0825, test_f1: 0.4693
 epoch: 32, train_loss: 0.9256, test_loss: 1.0479, test_f1: 0.4958
 epoch: 33, train_loss: 0.9082, test_loss: 1.1068, test_f1: 0.4845
 epoch: 34, train_loss: 0.9212, test_loss: 1.0884, test_f1: 0.4755
 epoch: 35, train_loss: 0.9182, test_loss: 1.1924, test_f1: 0.4666
 epoch: 36, train_loss: 0.9094, test_loss: 1.0387, test_f1: 0.4676
 epoch: 37, train_loss: 0.8973, test_loss: 1.0836, test_f1: 0.4805
 epoch: 38, train_loss: 0.9014, test_loss: 1.0577, test_f1: 0.4900
 epoch: 39, train_loss: 0.8944, test_loss: 1.0582, test_f1: 0.4736
 epoch: 40, train_loss: 0.9019, test_loss: 1.0518, test_f1: 0.4721
 epoch: 41, train_loss: 0.8903, test_loss: 1.1545, test_f1: 0.4859
 epoch: 42, train_loss: 0.8866, test_loss: 1.0303, test_f1: 0.4852
 epoch: 43, train_loss: 0.8873, test_loss: 1.0719, test_f1: 0.5059
 epoch: 44, train_loss: 0.8862, test_loss: 1.0815, test_f1: 0.4965
 epoch: 45, train_loss: 0.8953, test_loss: 1.3005, test_f1: 0.4516
 epoch: 46, train_loss: 0.8964, test_loss: 1.0299, test_f1: 0.4730
 epoch: 47, train_loss: 0.8734, test_loss: 1.0243, test_f1: 0.4826
 epoch: 48, train_loss: 0.8749, test_loss: 1.0697, test_f1: 0.4628
 epoch: 49, train_loss: 0.8715, test_loss: 1.1382, test_f1: 0.4889
 epoch: 50, train_loss: 0.8585, test_loss: 1.1819, test_f1: 0.4797
 epoch: 51, train_loss: 0.8589, test_loss: 1.1418, test_f1: 0.4956
 epoch: 52, train_loss: 0.8495, test_loss: 1.0552, test_f1: 0.4774
 epoch: 53, train_loss: 0.8478, test_loss: 1.0470, test_f1: 0.4942
 epoch: 54, train_loss: 0.8414, test_loss: 1.1179, test_f1: 0.4957
 epoch: 55, train_loss: 0.8527, test_loss: 1.0521, test_f1: 0.4936
 epoch: 56, train_loss: 0.8501, test_loss: 1.1103, test_f1: 0.4772
 epoch: 57, train_loss: 0.8524, test_loss: 1.0349, test_f1: 0.4981
 epoch: 58, train_loss: 0.8353, test_loss: 1.1257, test_f1: 0.4789
 epoch: 59, train_loss: 0.8352, test_loss: 1.1076, test_f1: 0.4850
 epoch: 60, train_loss: 0.8389, test_loss: 1.0596, test_f1: 0.4704
 epoch: 61, train_loss: 0.8402, test_loss: 1.0566, test_f1: 0.4988
 epoch: 62, train_loss: 0.8444, test_loss: 1.1219, test_f1: 0.4956
 epoch: 63, train_loss: 0.8338, test_loss: 1.0548, test_f1: 0.4841
 epoch: 64, train_loss: 0.8325, test_loss: 1.1400, test_f1: 0.4927
 epoch: 65, train_loss: 0.8384, test_loss: 1.0542, test_f1: 0.5051
 epoch: 66, train_loss: 0.8285, test_loss: 1.1176, test_f1: 0.5010
 epoch: 67, train_loss: 0.8324, test_loss: 1.0569, test_f1: 0.4816
 epoch: 68, train_loss: 0.8328, test_loss: 1.0382, test_f1: 0.4842
 epoch: 69, train_loss: 0.8168, test_loss: 1.0936, test_f1: 0.4757
 epoch: 70, train_loss: 0.8159, test_loss: 1.1152, test_f1: 0.4882
 epoch: 71, train_loss: 0.8157, test_loss: 1.1078, test_f1: 0.4843
 epoch: 72, train_loss: 0.8238, test_loss: 1.0713, test_f1: 0.4877
 epoch: 73, train_loss: 0.8164, test_loss: 1.0987, test_f1: 0.4917
 epoch: 74, train_loss: 0.8269, test_loss: 1.0789, test_f1: 0.4822
 epoch: 75, train_loss: 0.8178, test_loss: 1.1219, test_f1: 0.4871
 epoch: 76, train_loss: 0.8149, test_loss: 1.0403, test_f1: 0.4795
 epoch: 77, train_loss: 0.8166, test_loss: 1.0816, test_f1: 0.4975
 epoch: 78, train_loss: 0.8250, test_loss: 1.0795, test_f1: 0.4798
 epoch: 79, train_loss: 0.8191, test_loss: 1.0919, test_f1: 0.4744
 epoch: 80, train_loss: 0.8157, test_loss: 1.0701, test_f1: 0.4999
 epoch: 81, train_loss: 0.8101, test_loss: 1.0787, test_f1: 0.5027
 epoch: 82, train_loss: 0.8029, test_loss: 1.1092, test_f1: 0.4928
 epoch: 83, train_loss: 0.8047, test_loss: 1.1630, test_f1: 0.4999
 epoch: 84, train_loss: 0.7978, test_loss: 1.0806, test_f1: 0.5196
 epoch: 85, train_loss: 0.7965, test_loss: 1.1519, test_f1: 0.5095
 epoch: 86, train_loss: 0.8080, test_loss: 1.0592, test_f1: 0.4838
 epoch: 87, train_loss: 0.7985, test_loss: 1.1010, test_f1: 0.4904
 epoch: 88, train_loss: 0.7933, test_loss: 1.1899, test_f1: 0.5050
 epoch: 89, train_loss: 0.7937, test_loss: 1.1076, test_f1: 0.4995
 epoch: 90, train_loss: 0.7999, test_loss: 1.1162, test_f1: 0.4896
 epoch: 91, train_loss: 0.7996, test_loss: 1.0735, test_f1: 0.5239
 epoch: 92, train_loss: 0.7997, test_loss: 1.0773, test_f1: 0.5059
 epoch: 93, train_loss: 0.7957, test_loss: 1.1752, test_f1: 0.4804
 epoch: 94, train_loss: 0.7932, test_loss: 1.1751, test_f1: 0.4840
 epoch: 95, train_loss: 0.7883, test_loss: 1.0974, test_f1: 0.4933
 epoch: 96, train_loss: 0.7897, test_loss: 1.0831, test_f1: 0.4820
 epoch: 97, train_loss: 0.7917, test_loss: 1.1216, test_f1: 0.4817
 epoch: 98, train_loss: 0.7925, test_loss: 1.1253, test_f1: 0.4925
 epoch: 99, train_loss: 0.7918, test_loss: 1.1536, test_f1: 0.4910
##################ITERATION #2 ****************************************
 epoch: 0, train_loss: 1.3205, test_loss: 1.3288, test_f1: 0.2260
 epoch: 1, train_loss: 1.2505, test_loss: 1.3105, test_f1: 0.2260
 epoch: 2, train_loss: 1.2026, test_loss: 1.2559, test_f1: 0.2260
 epoch: 3, train_loss: 1.1486, test_loss: 1.1327, test_f1: 0.3522
 epoch: 4, train_loss: 1.1074, test_loss: 1.0722, test_f1: 0.3971
 epoch: 5, train_loss: 1.0761, test_loss: 1.0491, test_f1: 0.4478
 epoch: 6, train_loss: 1.0563, test_loss: 1.0176, test_f1: 0.4599
 epoch: 7, train_loss: 1.0394, test_loss: 1.0063, test_f1: 0.4707
 epoch: 8, train_loss: 1.0215, test_loss: 0.9910, test_f1: 0.4472
 epoch: 9, train_loss: 1.0081, test_loss: 0.9878, test_f1: 0.4785
 epoch: 10, train_loss: 0.9978, test_loss: 0.9997, test_f1: 0.4860
 epoch: 11, train_loss: 0.9944, test_loss: 1.0107, test_f1: 0.4586
 epoch: 12, train_loss: 0.9750, test_loss: 0.9750, test_f1: 0.4695
 epoch: 13, train_loss: 0.9678, test_loss: 0.9731, test_f1: 0.5008
 epoch: 14, train_loss: 0.9604, test_loss: 0.9604, test_f1: 0.4983
 epoch: 15, train_loss: 0.9487, test_loss: 0.9502, test_f1: 0.5021
 epoch: 16, train_loss: 0.9355, test_loss: 0.9712, test_f1: 0.4901
 epoch: 17, train_loss: 0.9295, test_loss: 0.9304, test_f1: 0.5037
 epoch: 18, train_loss: 0.9360, test_loss: 1.0279, test_f1: 0.4716
 epoch: 19, train_loss: 0.9215, test_loss: 0.9325, test_f1: 0.5041
 epoch: 20, train_loss: 0.9075, test_loss: 0.9350, test_f1: 0.5240
 epoch: 21, train_loss: 0.9090, test_loss: 0.8912, test_f1: 0.5235
 epoch: 22, train_loss: 0.8916, test_loss: 0.9249, test_f1: 0.4945
 epoch: 23, train_loss: 0.8846, test_loss: 0.9297, test_f1: 0.4934
 epoch: 24, train_loss: 0.8908, test_loss: 0.8990, test_f1: 0.5096
 epoch: 25, train_loss: 0.8845, test_loss: 0.9084, test_f1: 0.5169
 epoch: 26, train_loss: 0.8757, test_loss: 0.9064, test_f1: 0.5206
 epoch: 27, train_loss: 0.8785, test_loss: 0.8751, test_f1: 0.5294
 epoch: 28, train_loss: 0.8602, test_loss: 0.8571, test_f1: 0.5279
 epoch: 29, train_loss: 0.8544, test_loss: 0.8798, test_f1: 0.5258
 epoch: 30, train_loss: 0.8575, test_loss: 0.9305, test_f1: 0.5148
 epoch: 31, train_loss: 0.8496, test_loss: 0.9245, test_f1: 0.5161
 epoch: 32, train_loss: 0.8423, test_loss: 0.8948, test_f1: 0.5187
 epoch: 33, train_loss: 0.8400, test_loss: 0.8734, test_f1: 0.5458
 epoch: 34, train_loss: 0.8407, test_loss: 0.8899, test_f1: 0.5201
 epoch: 35, train_loss: 0.8284, test_loss: 0.8872, test_f1: 0.5294
 epoch: 36, train_loss: 0.8276, test_loss: 0.9619, test_f1: 0.5205
 epoch: 37, train_loss: 0.8303, test_loss: 0.8930, test_f1: 0.5285
 epoch: 38, train_loss: 0.8280, test_loss: 0.9014, test_f1: 0.5444
 epoch: 39, train_loss: 0.8229, test_loss: 0.8910, test_f1: 0.5247
 epoch: 40, train_loss: 0.8166, test_loss: 0.9112, test_f1: 0.5235
 epoch: 41, train_loss: 0.8124, test_loss: 0.9063, test_f1: 0.5093
 epoch: 42, train_loss: 0.8190, test_loss: 0.8977, test_f1: 0.5400
 epoch: 43, train_loss: 0.8118, test_loss: 0.8995, test_f1: 0.5349
 epoch: 44, train_loss: 0.8013, test_loss: 0.9165, test_f1: 0.5327
 epoch: 45, train_loss: 0.7987, test_loss: 0.9147, test_f1: 0.5341
 epoch: 46, train_loss: 0.8049, test_loss: 0.9041, test_f1: 0.5483
 epoch: 47, train_loss: 0.7931, test_loss: 0.9378, test_f1: 0.5202
 epoch: 48, train_loss: 0.7882, test_loss: 0.8860, test_f1: 0.5276
 epoch: 49, train_loss: 0.8020, test_loss: 0.9337, test_f1: 0.5299
 epoch: 50, train_loss: 0.7858, test_loss: 0.9065, test_f1: 0.5315
 epoch: 51, train_loss: 0.7705, test_loss: 0.9291, test_f1: 0.5395
 epoch: 52, train_loss: 0.7783, test_loss: 0.9087, test_f1: 0.5360
 epoch: 53, train_loss: 0.7725, test_loss: 0.8992, test_f1: 0.5350
 epoch: 54, train_loss: 0.7860, test_loss: 0.8975, test_f1: 0.5388
 epoch: 55, train_loss: 0.7717, test_loss: 0.9047, test_f1: 0.5495
 epoch: 56, train_loss: 0.7634, test_loss: 0.9132, test_f1: 0.5420
 epoch: 57, train_loss: 0.7664, test_loss: 0.9055, test_f1: 0.5330
 epoch: 58, train_loss: 0.7559, test_loss: 0.9055, test_f1: 0.5321
 epoch: 59, train_loss: 0.7648, test_loss: 0.9074, test_f1: 0.5291
 epoch: 60, train_loss: 0.7508, test_loss: 0.9209, test_f1: 0.5342
 epoch: 61, train_loss: 0.7626, test_loss: 0.8980, test_f1: 0.5408
 epoch: 62, train_loss: 0.7443, test_loss: 0.9265, test_f1: 0.5335
 epoch: 63, train_loss: 0.7470, test_loss: 0.9281, test_f1: 0.5460
 epoch: 64, train_loss: 0.7539, test_loss: 0.9108, test_f1: 0.5394
 epoch: 65, train_loss: 0.7558, test_loss: 0.9094, test_f1: 0.5552
 epoch: 66, train_loss: 0.7558, test_loss: 0.8869, test_f1: 0.5530
 epoch: 67, train_loss: 0.7632, test_loss: 0.9223, test_f1: 0.5519
 epoch: 68, train_loss: 0.7517, test_loss: 0.8987, test_f1: 0.5546
 epoch: 69, train_loss: 0.7506, test_loss: 0.9010, test_f1: 0.5523
 epoch: 70, train_loss: 0.7521, test_loss: 0.8995, test_f1: 0.5444
 epoch: 71, train_loss: 0.7546, test_loss: 0.9125, test_f1: 0.5485
 epoch: 72, train_loss: 0.7404, test_loss: 0.9200, test_f1: 0.5459
 epoch: 73, train_loss: 0.7439, test_loss: 0.9238, test_f1: 0.5472
 epoch: 74, train_loss: 0.7416, test_loss: 0.9130, test_f1: 0.5511
 epoch: 75, train_loss: 0.7535, test_loss: 0.8937, test_f1: 0.5602
 epoch: 76, train_loss: 0.7233, test_loss: 0.8992, test_f1: 0.5559
 epoch: 77, train_loss: 0.7405, test_loss: 0.8949, test_f1: 0.5595
 epoch: 78, train_loss: 0.7278, test_loss: 0.9184, test_f1: 0.5336
 epoch: 79, train_loss: 0.7331, test_loss: 0.9231, test_f1: 0.5403
 epoch: 80, train_loss: 0.7289, test_loss: 0.9077, test_f1: 0.5463
 epoch: 81, train_loss: 0.7317, test_loss: 0.9156, test_f1: 0.5448
 epoch: 82, train_loss: 0.7389, test_loss: 0.8984, test_f1: 0.5532
 epoch: 83, train_loss: 0.7339, test_loss: 0.9147, test_f1: 0.5558
 epoch: 84, train_loss: 0.7322, test_loss: 0.9015, test_f1: 0.5392
 epoch: 85, train_loss: 0.7423, test_loss: 0.9100, test_f1: 0.5365
 epoch: 86, train_loss: 0.7281, test_loss: 0.9006, test_f1: 0.5562
 epoch: 87, train_loss: 0.7334, test_loss: 0.9377, test_f1: 0.5455
 epoch: 88, train_loss: 0.7254, test_loss: 0.9514, test_f1: 0.5320
 epoch: 89, train_loss: 0.7125, test_loss: 0.9523, test_f1: 0.5354
 epoch: 90, train_loss: 0.7248, test_loss: 0.9662, test_f1: 0.5396
 epoch: 91, train_loss: 0.7324, test_loss: 0.9561, test_f1: 0.5463
 epoch: 92, train_loss: 0.7225, test_loss: 0.9366, test_f1: 0.5549
 epoch: 93, train_loss: 0.7230, test_loss: 0.9335, test_f1: 0.5649
 epoch: 94, train_loss: 0.7231, test_loss: 0.9325, test_f1: 0.5671
 epoch: 95, train_loss: 0.7211, test_loss: 0.9403, test_f1: 0.5471
 epoch: 96, train_loss: 0.7232, test_loss: 0.9314, test_f1: 0.5432
 epoch: 97, train_loss: 0.7158, test_loss: 0.9294, test_f1: 0.5481
 epoch: 98, train_loss: 0.7130, test_loss: 0.9476, test_f1: 0.5443
 epoch: 99, train_loss: 0.7227, test_loss: 0.9628, test_f1: 0.5353
##################ITERATION #3 ****************************************
 epoch: 0, train_loss: 1.2864, test_loss: 1.3086, test_f1: 0.2260
 epoch: 1, train_loss: 1.2198, test_loss: 1.2865, test_f1: 0.2260
 epoch: 2, train_loss: 1.1889, test_loss: 1.2728, test_f1: 0.2260
 epoch: 3, train_loss: 1.1543, test_loss: 1.1981, test_f1: 0.2429
 epoch: 4, train_loss: 1.1227, test_loss: 1.0973, test_f1: 0.3521
 epoch: 5, train_loss: 1.0992, test_loss: 1.0693, test_f1: 0.3513
 epoch: 6, train_loss: 1.0788, test_loss: 1.0691, test_f1: 0.3394
 epoch: 7, train_loss: 1.0660, test_loss: 1.0539, test_f1: 0.3441
 epoch: 8, train_loss: 1.0561, test_loss: 1.0435, test_f1: 0.3541
 epoch: 9, train_loss: 1.0387, test_loss: 1.0470, test_f1: 0.3544
 epoch: 10, train_loss: 1.0322, test_loss: 1.0461, test_f1: 0.3536
 epoch: 11, train_loss: 1.0191, test_loss: 1.0643, test_f1: 0.3569
 epoch: 12, train_loss: 1.0136, test_loss: 1.0383, test_f1: 0.3695
 epoch: 13, train_loss: 1.0101, test_loss: 1.0510, test_f1: 0.4057
 epoch: 14, train_loss: 1.0015, test_loss: 1.0285, test_f1: 0.4063
 epoch: 15, train_loss: 0.9905, test_loss: 1.0390, test_f1: 0.4402
 epoch: 16, train_loss: 0.9823, test_loss: 1.1003, test_f1: 0.4079
 epoch: 17, train_loss: 0.9785, test_loss: 1.0273, test_f1: 0.4444
 epoch: 18, train_loss: 0.9713, test_loss: 1.0615, test_f1: 0.4592
 epoch: 19, train_loss: 0.9624, test_loss: 1.0259, test_f1: 0.4447
 epoch: 20, train_loss: 0.9633, test_loss: 1.0148, test_f1: 0.4629
 epoch: 21, train_loss: 0.9610, test_loss: 1.0566, test_f1: 0.4497
 epoch: 22, train_loss: 0.9478, test_loss: 1.0007, test_f1: 0.4696
 epoch: 23, train_loss: 0.9470, test_loss: 1.0330, test_f1: 0.4532
 epoch: 24, train_loss: 0.9398, test_loss: 1.0014, test_f1: 0.4885
 epoch: 25, train_loss: 0.9331, test_loss: 0.9920, test_f1: 0.4879
 epoch: 26, train_loss: 0.9334, test_loss: 1.0408, test_f1: 0.4512
 epoch: 27, train_loss: 0.9234, test_loss: 1.0297, test_f1: 0.4799
 epoch: 28, train_loss: 0.9185, test_loss: 0.9888, test_f1: 0.4886
 epoch: 29, train_loss: 0.9233, test_loss: 0.9884, test_f1: 0.4848
 epoch: 30, train_loss: 0.9045, test_loss: 1.0044, test_f1: 0.4870
 epoch: 31, train_loss: 0.9120, test_loss: 0.9969, test_f1: 0.4934
 epoch: 32, train_loss: 0.9109, test_loss: 1.0488, test_f1: 0.4655
 epoch: 33, train_loss: 0.9016, test_loss: 0.9953, test_f1: 0.4872
 epoch: 34, train_loss: 0.8907, test_loss: 1.0100, test_f1: 0.4808
 epoch: 35, train_loss: 0.9039, test_loss: 1.0016, test_f1: 0.4947
 epoch: 36, train_loss: 0.8965, test_loss: 1.0622, test_f1: 0.4769
 epoch: 37, train_loss: 0.8880, test_loss: 1.0106, test_f1: 0.4810
 epoch: 38, train_loss: 0.8878, test_loss: 1.0640, test_f1: 0.4847
 epoch: 39, train_loss: 0.8832, test_loss: 1.0141, test_f1: 0.4985
 epoch: 40, train_loss: 0.8786, test_loss: 1.0045, test_f1: 0.4943
 epoch: 41, train_loss: 0.8766, test_loss: 1.0384, test_f1: 0.5065
 epoch: 42, train_loss: 0.8709, test_loss: 1.0139, test_f1: 0.4809
 epoch: 43, train_loss: 0.8789, test_loss: 1.0126, test_f1: 0.4982
 epoch: 44, train_loss: 0.8653, test_loss: 1.0508, test_f1: 0.4985
 epoch: 45, train_loss: 0.8660, test_loss: 1.0167, test_f1: 0.5024
 epoch: 46, train_loss: 0.8609, test_loss: 1.0105, test_f1: 0.5008
 epoch: 47, train_loss: 0.8635, test_loss: 0.9954, test_f1: 0.5014
 epoch: 48, train_loss: 0.8647, test_loss: 0.9977, test_f1: 0.5262
 epoch: 49, train_loss: 0.8522, test_loss: 1.0284, test_f1: 0.4803
 epoch: 50, train_loss: 0.8894, test_loss: 0.9817, test_f1: 0.5267
 epoch: 51, train_loss: 0.8575, test_loss: 1.0049, test_f1: 0.5276
 epoch: 52, train_loss: 0.8553, test_loss: 1.0132, test_f1: 0.4972
 epoch: 53, train_loss: 0.8498, test_loss: 1.0056, test_f1: 0.5064
 epoch: 54, train_loss: 0.8452, test_loss: 1.0325, test_f1: 0.5208
 epoch: 55, train_loss: 0.8388, test_loss: 1.0013, test_f1: 0.5231
 epoch: 56, train_loss: 0.8465, test_loss: 1.0140, test_f1: 0.5262
 epoch: 57, train_loss: 0.8354, test_loss: 0.9913, test_f1: 0.5261
 epoch: 58, train_loss: 0.8338, test_loss: 1.0045, test_f1: 0.5233
 epoch: 59, train_loss: 0.8306, test_loss: 0.9990, test_f1: 0.5211
 epoch: 60, train_loss: 0.8423, test_loss: 0.9783, test_f1: 0.5330
 epoch: 61, train_loss: 0.8199, test_loss: 1.0097, test_f1: 0.5160
 epoch: 62, train_loss: 0.8206, test_loss: 0.9946, test_f1: 0.5389
 epoch: 63, train_loss: 0.8230, test_loss: 1.0067, test_f1: 0.5135
 epoch: 64, train_loss: 0.8343, test_loss: 1.0107, test_f1: 0.5124
 epoch: 65, train_loss: 0.8269, test_loss: 0.9976, test_f1: 0.5288
 epoch: 66, train_loss: 0.8221, test_loss: 1.0034, test_f1: 0.5242
 epoch: 67, train_loss: 0.8182, test_loss: 0.9986, test_f1: 0.5104
 epoch: 68, train_loss: 0.8168, test_loss: 1.0089, test_f1: 0.5314
 epoch: 69, train_loss: 0.8146, test_loss: 0.9838, test_f1: 0.5180
 epoch: 70, train_loss: 0.8166, test_loss: 1.0025, test_f1: 0.5199
 epoch: 71, train_loss: 0.8043, test_loss: 1.0134, test_f1: 0.5348
 epoch: 72, train_loss: 0.8096, test_loss: 0.9963, test_f1: 0.5254
 epoch: 73, train_loss: 0.8107, test_loss: 1.0313, test_f1: 0.5270
 epoch: 74, train_loss: 0.8062, test_loss: 0.9880, test_f1: 0.5453
 epoch: 75, train_loss: 0.8052, test_loss: 1.0105, test_f1: 0.5261
 epoch: 76, train_loss: 0.8012, test_loss: 1.0083, test_f1: 0.5125
 epoch: 77, train_loss: 0.8023, test_loss: 1.0056, test_f1: 0.5255
 epoch: 78, train_loss: 0.8068, test_loss: 1.0007, test_f1: 0.5177
 epoch: 79, train_loss: 0.8060, test_loss: 1.0113, test_f1: 0.5201
 epoch: 80, train_loss: 0.7932, test_loss: 1.0156, test_f1: 0.5283
 epoch: 81, train_loss: 0.7978, test_loss: 0.9927, test_f1: 0.5460
 epoch: 82, train_loss: 0.8020, test_loss: 1.0210, test_f1: 0.5207
 epoch: 83, train_loss: 0.8010, test_loss: 1.0099, test_f1: 0.5257
 epoch: 84, train_loss: 0.8070, test_loss: 1.0365, test_f1: 0.5170
 epoch: 85, train_loss: 0.7976, test_loss: 0.9803, test_f1: 0.5392
 epoch: 86, train_loss: 0.7824, test_loss: 1.0006, test_f1: 0.5425
 epoch: 87, train_loss: 0.7921, test_loss: 1.0024, test_f1: 0.5283
 epoch: 88, train_loss: 0.7794, test_loss: 1.0096, test_f1: 0.5303
 epoch: 89, train_loss: 0.7998, test_loss: 1.0390, test_f1: 0.5240
 epoch: 90, train_loss: 0.7818, test_loss: 1.0289, test_f1: 0.5210
 epoch: 91, train_loss: 0.7942, test_loss: 1.0145, test_f1: 0.5229
 epoch: 92, train_loss: 0.7786, test_loss: 1.0057, test_f1: 0.5318
 epoch: 93, train_loss: 0.7863, test_loss: 1.0037, test_f1: 0.5352
 epoch: 94, train_loss: 0.7737, test_loss: 1.0204, test_f1: 0.5280
 epoch: 95, train_loss: 0.7879, test_loss: 1.0158, test_f1: 0.5357
 epoch: 96, train_loss: 0.7908, test_loss: 1.0109, test_f1: 0.5314
 epoch: 97, train_loss: 0.7738, test_loss: 1.0129, test_f1: 0.5226
 epoch: 98, train_loss: 0.7689, test_loss: 1.0088, test_f1: 0.5315
 epoch: 99, train_loss: 0.7802, test_loss: 1.0099, test_f1: 0.5404
##################ITERATION #4 ****************************************
 epoch: 0, train_loss: 1.2922, test_loss: 1.3348, test_f1: 0.2260
 epoch: 1, train_loss: 1.2206, test_loss: 1.3256, test_f1: 0.2260
 epoch: 2, train_loss: 1.1889, test_loss: 1.3098, test_f1: 0.2260
 epoch: 3, train_loss: 1.1530, test_loss: 1.2410, test_f1: 0.2260
 epoch: 4, train_loss: 1.1247, test_loss: 1.1347, test_f1: 0.3136
 epoch: 5, train_loss: 1.1072, test_loss: 1.0832, test_f1: 0.3534
 epoch: 6, train_loss: 1.0871, test_loss: 1.0528, test_f1: 0.3651
 epoch: 7, train_loss: 1.0656, test_loss: 1.0635, test_f1: 0.3686
 epoch: 8, train_loss: 1.0489, test_loss: 1.0507, test_f1: 0.3784
 epoch: 9, train_loss: 1.0403, test_loss: 1.0855, test_f1: 0.3537
 epoch: 10, train_loss: 1.0320, test_loss: 1.0635, test_f1: 0.3847
 epoch: 11, train_loss: 1.0188, test_loss: 1.0635, test_f1: 0.3969
 epoch: 12, train_loss: 1.0139, test_loss: 1.0529, test_f1: 0.4397
 epoch: 13, train_loss: 1.0070, test_loss: 1.0532, test_f1: 0.4313
 epoch: 14, train_loss: 1.0082, test_loss: 1.1043, test_f1: 0.4152
 epoch: 15, train_loss: 1.0030, test_loss: 1.0763, test_f1: 0.4194
 epoch: 16, train_loss: 0.9946, test_loss: 1.0759, test_f1: 0.4312
 epoch: 17, train_loss: 0.9898, test_loss: 1.0471, test_f1: 0.4523
 epoch: 18, train_loss: 0.9826, test_loss: 1.0440, test_f1: 0.4538
 epoch: 19, train_loss: 0.9765, test_loss: 1.0588, test_f1: 0.4501
 epoch: 20, train_loss: 0.9651, test_loss: 1.0491, test_f1: 0.4557
 epoch: 21, train_loss: 0.9626, test_loss: 1.0265, test_f1: 0.4702
 epoch: 22, train_loss: 0.9627, test_loss: 1.0121, test_f1: 0.4782
 epoch: 23, train_loss: 0.9639, test_loss: 1.0480, test_f1: 0.4617
 epoch: 24, train_loss: 0.9539, test_loss: 1.0333, test_f1: 0.4670
 epoch: 25, train_loss: 0.9392, test_loss: 1.0487, test_f1: 0.4560
 epoch: 26, train_loss: 0.9382, test_loss: 1.0163, test_f1: 0.4695
 epoch: 27, train_loss: 0.9342, test_loss: 1.0697, test_f1: 0.4610
 epoch: 28, train_loss: 0.9233, test_loss: 1.0138, test_f1: 0.4780
 epoch: 29, train_loss: 0.9363, test_loss: 1.0273, test_f1: 0.4671
 epoch: 30, train_loss: 0.9266, test_loss: 1.1052, test_f1: 0.4441
 epoch: 31, train_loss: 0.9207, test_loss: 1.0184, test_f1: 0.4807
 epoch: 32, train_loss: 0.9185, test_loss: 1.0378, test_f1: 0.4568
 epoch: 33, train_loss: 0.9039, test_loss: 1.0520, test_f1: 0.4627
 epoch: 34, train_loss: 0.9073, test_loss: 1.0413, test_f1: 0.4798
 epoch: 35, train_loss: 0.8959, test_loss: 1.0203, test_f1: 0.4844
 epoch: 36, train_loss: 0.8951, test_loss: 1.0366, test_f1: 0.4982
 epoch: 37, train_loss: 0.8937, test_loss: 1.0199, test_f1: 0.4899
 epoch: 38, train_loss: 0.8920, test_loss: 1.0319, test_f1: 0.4872
 epoch: 39, train_loss: 0.8910, test_loss: 1.0186, test_f1: 0.4985
 epoch: 40, train_loss: 0.8820, test_loss: 1.0985, test_f1: 0.4681
 epoch: 41, train_loss: 0.8782, test_loss: 1.0753, test_f1: 0.4851
 epoch: 42, train_loss: 0.8842, test_loss: 0.9911, test_f1: 0.4987
 epoch: 43, train_loss: 0.8838, test_loss: 1.0123, test_f1: 0.4918
 epoch: 44, train_loss: 0.8852, test_loss: 1.0332, test_f1: 0.4936
 epoch: 45, train_loss: 0.8774, test_loss: 1.0030, test_f1: 0.5022
 epoch: 46, train_loss: 0.8621, test_loss: 1.0940, test_f1: 0.4760
 epoch: 47, train_loss: 0.8629, test_loss: 1.0035, test_f1: 0.5119
 epoch: 48, train_loss: 0.8530, test_loss: 1.0867, test_f1: 0.4594
 epoch: 49, train_loss: 0.8426, test_loss: 1.0095, test_f1: 0.5067
 epoch: 50, train_loss: 0.8512, test_loss: 1.0018, test_f1: 0.5053
 epoch: 51, train_loss: 0.8504, test_loss: 1.0222, test_f1: 0.5050
 epoch: 52, train_loss: 0.8388, test_loss: 1.0573, test_f1: 0.4805
 epoch: 53, train_loss: 0.8357, test_loss: 1.0249, test_f1: 0.4818
 epoch: 54, train_loss: 0.8368, test_loss: 1.0153, test_f1: 0.5054
 epoch: 55, train_loss: 0.8304, test_loss: 1.0142, test_f1: 0.5074
 epoch: 56, train_loss: 0.8206, test_loss: 0.9869, test_f1: 0.5066
 epoch: 57, train_loss: 0.8342, test_loss: 0.9969, test_f1: 0.5039
 epoch: 58, train_loss: 0.8229, test_loss: 0.9968, test_f1: 0.5133
 epoch: 59, train_loss: 0.8220, test_loss: 1.0169, test_f1: 0.5056
 epoch: 60, train_loss: 0.8207, test_loss: 1.0092, test_f1: 0.5192
 epoch: 61, train_loss: 0.8260, test_loss: 0.9832, test_f1: 0.5177
 epoch: 62, train_loss: 0.8240, test_loss: 0.9958, test_f1: 0.5196
 epoch: 63, train_loss: 0.8278, test_loss: 1.0076, test_f1: 0.5160
 epoch: 64, train_loss: 0.8263, test_loss: 1.0105, test_f1: 0.4900
 epoch: 65, train_loss: 0.8150, test_loss: 1.0141, test_f1: 0.4998
 epoch: 66, train_loss: 0.8270, test_loss: 1.0455, test_f1: 0.4878
 epoch: 67, train_loss: 0.8172, test_loss: 1.0535, test_f1: 0.4973
 epoch: 68, train_loss: 0.8189, test_loss: 1.0218, test_f1: 0.4972
 epoch: 69, train_loss: 0.8153, test_loss: 0.9930, test_f1: 0.5059
 epoch: 70, train_loss: 0.8145, test_loss: 1.0061, test_f1: 0.5032
 epoch: 71, train_loss: 0.8007, test_loss: 1.0216, test_f1: 0.5099
 epoch: 72, train_loss: 0.8247, test_loss: 1.0355, test_f1: 0.4888
 epoch: 73, train_loss: 0.8067, test_loss: 1.0413, test_f1: 0.4802
 epoch: 74, train_loss: 0.8040, test_loss: 1.0159, test_f1: 0.5109
 epoch: 75, train_loss: 0.8117, test_loss: 1.0644, test_f1: 0.4995
 epoch: 76, train_loss: 0.8138, test_loss: 0.9930, test_f1: 0.5152
 epoch: 77, train_loss: 0.7931, test_loss: 1.0129, test_f1: 0.5112
 epoch: 78, train_loss: 0.7954, test_loss: 1.0594, test_f1: 0.4971
 epoch: 79, train_loss: 0.8070, test_loss: 1.0354, test_f1: 0.4964
 epoch: 80, train_loss: 0.7987, test_loss: 1.0154, test_f1: 0.5074
 epoch: 81, train_loss: 0.7986, test_loss: 1.0610, test_f1: 0.5045
 epoch: 82, train_loss: 0.7898, test_loss: 1.0974, test_f1: 0.4830
 epoch: 83, train_loss: 0.7914, test_loss: 1.0515, test_f1: 0.5035
 epoch: 84, train_loss: 0.8054, test_loss: 1.0417, test_f1: 0.5078
 epoch: 85, train_loss: 0.7768, test_loss: 1.0379, test_f1: 0.4981
 epoch: 86, train_loss: 0.7907, test_loss: 1.0428, test_f1: 0.5094
 epoch: 87, train_loss: 0.7859, test_loss: 1.0240, test_f1: 0.5208
 epoch: 88, train_loss: 0.7875, test_loss: 1.0936, test_f1: 0.4820
 epoch: 89, train_loss: 0.8031, test_loss: 1.0278, test_f1: 0.4954
 epoch: 90, train_loss: 0.7792, test_loss: 1.0081, test_f1: 0.5131
 epoch: 91, train_loss: 0.7944, test_loss: 1.0525, test_f1: 0.4864
 epoch: 92, train_loss: 0.7819, test_loss: 1.0798, test_f1: 0.4965
 epoch: 93, train_loss: 0.7773, test_loss: 1.0612, test_f1: 0.4915
 epoch: 94, train_loss: 0.7818, test_loss: 1.0623, test_f1: 0.4850
 epoch: 95, train_loss: 0.7725, test_loss: 1.0603, test_f1: 0.5020
 epoch: 96, train_loss: 0.7704, test_loss: 1.0918, test_f1: 0.4808
 epoch: 97, train_loss: 0.7724, test_loss: 1.1289, test_f1: 0.4743
 epoch: 98, train_loss: 0.7747, test_loss: 1.1235, test_f1: 0.4774
 epoch: 99, train_loss: 0.7789, test_loss: 1.0921, test_f1: 0.4968
##################ITERATION #5 ****************************************
 epoch: 0, train_loss: 1.2768, test_loss: 1.2868, test_f1: 0.2260
 epoch: 1, train_loss: 1.2138, test_loss: 1.2583, test_f1: 0.2260
 epoch: 2, train_loss: 1.1707, test_loss: 1.2361, test_f1: 0.3196
 epoch: 3, train_loss: 1.1352, test_loss: 1.1800, test_f1: 0.3448
 epoch: 4, train_loss: 1.1053, test_loss: 1.1008, test_f1: 0.3863
 epoch: 5, train_loss: 1.0675, test_loss: 1.0519, test_f1: 0.4261
 epoch: 6, train_loss: 1.0619, test_loss: 1.0028, test_f1: 0.4349
 epoch: 7, train_loss: 1.0379, test_loss: 0.9923, test_f1: 0.4360
 epoch: 8, train_loss: 1.0238, test_loss: 0.9874, test_f1: 0.4312
 epoch: 9, train_loss: 1.0190, test_loss: 1.0132, test_f1: 0.4107
 epoch: 10, train_loss: 1.0079, test_loss: 1.0042, test_f1: 0.4530
 epoch: 11, train_loss: 0.9910, test_loss: 1.1032, test_f1: 0.4105
 epoch: 12, train_loss: 0.9853, test_loss: 1.0060, test_f1: 0.4837
 epoch: 13, train_loss: 0.9756, test_loss: 0.9758, test_f1: 0.4825
 epoch: 14, train_loss: 0.9647, test_loss: 1.0217, test_f1: 0.5128
 epoch: 15, train_loss: 0.9651, test_loss: 0.9733, test_f1: 0.4927
 epoch: 16, train_loss: 0.9406, test_loss: 1.0153, test_f1: 0.4915
 epoch: 17, train_loss: 0.9363, test_loss: 0.9623, test_f1: 0.5228
 epoch: 18, train_loss: 0.9380, test_loss: 0.9699, test_f1: 0.5123
 epoch: 19, train_loss: 0.9224, test_loss: 0.9670, test_f1: 0.5107
 epoch: 20, train_loss: 0.9296, test_loss: 0.9795, test_f1: 0.5104
 epoch: 21, train_loss: 0.9233, test_loss: 1.0011, test_f1: 0.4843
 epoch: 22, train_loss: 0.9119, test_loss: 0.9442, test_f1: 0.5234
 epoch: 23, train_loss: 0.9028, test_loss: 0.9439, test_f1: 0.5175
 epoch: 24, train_loss: 0.8996, test_loss: 0.9477, test_f1: 0.4995
 epoch: 25, train_loss: 0.9012, test_loss: 0.9645, test_f1: 0.5005
 epoch: 26, train_loss: 0.8935, test_loss: 0.9861, test_f1: 0.5092
 epoch: 27, train_loss: 0.8934, test_loss: 0.9699, test_f1: 0.4972
 epoch: 28, train_loss: 0.8872, test_loss: 0.9892, test_f1: 0.5009
 epoch: 29, train_loss: 0.8815, test_loss: 0.9329, test_f1: 0.5252
 epoch: 30, train_loss: 0.8740, test_loss: 0.9619, test_f1: 0.5010
 epoch: 31, train_loss: 0.8749, test_loss: 0.9824, test_f1: 0.4997
 epoch: 32, train_loss: 0.8615, test_loss: 0.9764, test_f1: 0.4959
 epoch: 33, train_loss: 0.8554, test_loss: 0.9384, test_f1: 0.5269
 epoch: 34, train_loss: 0.8622, test_loss: 0.9745, test_f1: 0.5235
 epoch: 35, train_loss: 0.8627, test_loss: 1.1589, test_f1: 0.4433
 epoch: 36, train_loss: 0.8690, test_loss: 0.9339, test_f1: 0.5285
 epoch: 37, train_loss: 0.8569, test_loss: 0.9681, test_f1: 0.5109
 epoch: 38, train_loss: 0.8551, test_loss: 0.9353, test_f1: 0.5102
 epoch: 39, train_loss: 0.8401, test_loss: 0.9976, test_f1: 0.4897
 epoch: 40, train_loss: 0.8441, test_loss: 0.9299, test_f1: 0.5129
 epoch: 41, train_loss: 0.8488, test_loss: 0.9375, test_f1: 0.5216
 epoch: 42, train_loss: 0.8447, test_loss: 0.9921, test_f1: 0.5159
 epoch: 43, train_loss: 0.8373, test_loss: 0.9291, test_f1: 0.5275
 epoch: 44, train_loss: 0.8299, test_loss: 0.9181, test_f1: 0.5336
 epoch: 45, train_loss: 0.8306, test_loss: 0.9157, test_f1: 0.5226
 epoch: 46, train_loss: 0.8263, test_loss: 0.9178, test_f1: 0.5135
 epoch: 47, train_loss: 0.8216, test_loss: 0.9601, test_f1: 0.5263
 epoch: 48, train_loss: 0.8127, test_loss: 0.9690, test_f1: 0.5312
 epoch: 49, train_loss: 0.8050, test_loss: 0.8883, test_f1: 0.5500
 epoch: 50, train_loss: 0.8079, test_loss: 0.9200, test_f1: 0.5302
 epoch: 51, train_loss: 0.8176, test_loss: 0.9285, test_f1: 0.5251
 epoch: 52, train_loss: 0.8046, test_loss: 0.9190, test_f1: 0.5295
 epoch: 53, train_loss: 0.8100, test_loss: 0.9513, test_f1: 0.5304
 epoch: 54, train_loss: 0.8092, test_loss: 0.9213, test_f1: 0.5355
 epoch: 55, train_loss: 0.7960, test_loss: 0.9168, test_f1: 0.5474
 epoch: 56, train_loss: 0.7939, test_loss: 0.9392, test_f1: 0.5252
 epoch: 57, train_loss: 0.8009, test_loss: 0.9158, test_f1: 0.5416
 epoch: 58, train_loss: 0.8110, test_loss: 0.9434, test_f1: 0.5289
 epoch: 59, train_loss: 0.8014, test_loss: 0.9037, test_f1: 0.5186
 epoch: 60, train_loss: 0.7985, test_loss: 0.9067, test_f1: 0.5130
 epoch: 61, train_loss: 0.7864, test_loss: 0.9080, test_f1: 0.5327
 epoch: 62, train_loss: 0.7927, test_loss: 0.9309, test_f1: 0.5136
 epoch: 63, train_loss: 0.7953, test_loss: 0.9086, test_f1: 0.5337
 epoch: 64, train_loss: 0.7849, test_loss: 0.9109, test_f1: 0.5334
 epoch: 65, train_loss: 0.7868, test_loss: 0.9373, test_f1: 0.5197
 epoch: 66, train_loss: 0.7919, test_loss: 1.0088, test_f1: 0.5105
 epoch: 67, train_loss: 0.7932, test_loss: 0.9096, test_f1: 0.5340
 epoch: 68, train_loss: 0.7802, test_loss: 0.8857, test_f1: 0.5409
 epoch: 69, train_loss: 0.7859, test_loss: 0.8943, test_f1: 0.5418
 epoch: 70, train_loss: 0.7922, test_loss: 0.9131, test_f1: 0.5387
 epoch: 71, train_loss: 0.7816, test_loss: 0.9018, test_f1: 0.5512
 epoch: 72, train_loss: 0.7889, test_loss: 0.8878, test_f1: 0.5474
 epoch: 73, train_loss: 0.7893, test_loss: 0.9185, test_f1: 0.5343
 epoch: 74, train_loss: 0.7953, test_loss: 0.9262, test_f1: 0.5321
 epoch: 75, train_loss: 0.7894, test_loss: 0.9051, test_f1: 0.5242
 epoch: 76, train_loss: 0.7854, test_loss: 0.8885, test_f1: 0.5441
 epoch: 77, train_loss: 0.7672, test_loss: 0.8759, test_f1: 0.5406
 epoch: 78, train_loss: 0.7756, test_loss: 0.8950, test_f1: 0.5410
 epoch: 79, train_loss: 0.7788, test_loss: 0.9255, test_f1: 0.5380
 epoch: 80, train_loss: 0.7733, test_loss: 0.9008, test_f1: 0.5343
 epoch: 81, train_loss: 0.7737, test_loss: 0.9582, test_f1: 0.5208
 epoch: 82, train_loss: 0.7699, test_loss: 0.9086, test_f1: 0.5374
 epoch: 83, train_loss: 0.7819, test_loss: 0.8767, test_f1: 0.5392
 epoch: 84, train_loss: 0.7709, test_loss: 0.9417, test_f1: 0.5210
 epoch: 85, train_loss: 0.7647, test_loss: 0.9078, test_f1: 0.5418
 epoch: 86, train_loss: 0.7665, test_loss: 0.8829, test_f1: 0.5353
 epoch: 87, train_loss: 0.7618, test_loss: 0.9178, test_f1: 0.5233
 epoch: 88, train_loss: 0.7718, test_loss: 0.8917, test_f1: 0.5402
 epoch: 89, train_loss: 0.7711, test_loss: 0.8943, test_f1: 0.5399
 epoch: 90, train_loss: 0.7657, test_loss: 0.9099, test_f1: 0.5320
 epoch: 91, train_loss: 0.7630, test_loss: 0.9070, test_f1: 0.5445
 epoch: 92, train_loss: 0.7669, test_loss: 0.9066, test_f1: 0.5418
 epoch: 93, train_loss: 0.7615, test_loss: 0.9080, test_f1: 0.5250
 epoch: 94, train_loss: 0.7564, test_loss: 0.9583, test_f1: 0.5262
 epoch: 95, train_loss: 0.7649, test_loss: 0.9519, test_f1: 0.5201
 epoch: 96, train_loss: 0.7691, test_loss: 0.9528, test_f1: 0.5082
 epoch: 97, train_loss: 0.7632, test_loss: 0.9242, test_f1: 0.5331
 epoch: 98, train_loss: 0.7709, test_loss: 0.9232, test_f1: 0.5223
 epoch: 99, train_loss: 0.7612, test_loss: 0.9346, test_f1: 0.5368
##################ITERATION #6 ****************************************
 epoch: 0, train_loss: 1.5115, test_loss: 1.4108, test_f1: 0.2262
 epoch: 1, train_loss: 1.3399, test_loss: 1.3593, test_f1: 0.2571
 epoch: 2, train_loss: 1.2650, test_loss: 1.3018, test_f1: 0.2540
 epoch: 3, train_loss: 1.2275, test_loss: 1.2260, test_f1: 0.2260
 epoch: 4, train_loss: 1.1745, test_loss: 1.1636, test_f1: 0.2686
 epoch: 5, train_loss: 1.1346, test_loss: 1.0936, test_f1: 0.3785
 epoch: 6, train_loss: 1.1085, test_loss: 1.0486, test_f1: 0.4120
 epoch: 7, train_loss: 1.0742, test_loss: 1.0307, test_f1: 0.4240
 epoch: 8, train_loss: 1.0464, test_loss: 1.0160, test_f1: 0.4464
 epoch: 9, train_loss: 1.0316, test_loss: 0.9998, test_f1: 0.4646
 epoch: 10, train_loss: 1.0250, test_loss: 0.9876, test_f1: 0.4475
 epoch: 11, train_loss: 1.0117, test_loss: 1.0796, test_f1: 0.4449
 epoch: 12, train_loss: 0.9926, test_loss: 1.0063, test_f1: 0.4544
 epoch: 13, train_loss: 0.9885, test_loss: 1.1156, test_f1: 0.4331
 epoch: 14, train_loss: 0.9784, test_loss: 0.9797, test_f1: 0.4790
 epoch: 15, train_loss: 0.9636, test_loss: 0.9791, test_f1: 0.4415
 epoch: 16, train_loss: 0.9693, test_loss: 0.9671, test_f1: 0.4783
 epoch: 17, train_loss: 0.9591, test_loss: 1.0064, test_f1: 0.4506
 epoch: 18, train_loss: 0.9547, test_loss: 0.9731, test_f1: 0.4798
 epoch: 19, train_loss: 0.9547, test_loss: 0.9886, test_f1: 0.4780
 epoch: 20, train_loss: 0.9381, test_loss: 0.9530, test_f1: 0.4881
 epoch: 21, train_loss: 0.9373, test_loss: 0.9912, test_f1: 0.4849
 epoch: 22, train_loss: 0.9394, test_loss: 1.0176, test_f1: 0.4541
 epoch: 23, train_loss: 0.9355, test_loss: 0.9597, test_f1: 0.4926
 epoch: 24, train_loss: 0.9343, test_loss: 0.9732, test_f1: 0.4684
 epoch: 25, train_loss: 0.9258, test_loss: 0.9465, test_f1: 0.4862
 epoch: 26, train_loss: 0.9194, test_loss: 1.0070, test_f1: 0.4733
 epoch: 27, train_loss: 0.9238, test_loss: 0.9576, test_f1: 0.4835
 epoch: 28, train_loss: 0.9148, test_loss: 0.9532, test_f1: 0.4994
 epoch: 29, train_loss: 0.9186, test_loss: 0.9425, test_f1: 0.5048
 epoch: 30, train_loss: 0.9146, test_loss: 0.9548, test_f1: 0.4939
 epoch: 31, train_loss: 0.8976, test_loss: 0.9434, test_f1: 0.4865
 epoch: 32, train_loss: 0.9085, test_loss: 0.9326, test_f1: 0.5077
 epoch: 33, train_loss: 0.9062, test_loss: 1.0070, test_f1: 0.4848
 epoch: 34, train_loss: 0.8979, test_loss: 0.9393, test_f1: 0.5051
 epoch: 35, train_loss: 0.8973, test_loss: 1.0372, test_f1: 0.4908
 epoch: 36, train_loss: 0.8891, test_loss: 0.9329, test_f1: 0.5068
 epoch: 37, train_loss: 0.8820, test_loss: 1.0438, test_f1: 0.4923
 epoch: 38, train_loss: 0.8737, test_loss: 0.9457, test_f1: 0.5078
 epoch: 39, train_loss: 0.8871, test_loss: 1.0691, test_f1: 0.5005
 epoch: 40, train_loss: 0.8811, test_loss: 0.9664, test_f1: 0.4915
 epoch: 41, train_loss: 0.8756, test_loss: 0.9415, test_f1: 0.5016
 epoch: 42, train_loss: 0.8799, test_loss: 0.9390, test_f1: 0.5062
 epoch: 43, train_loss: 0.8728, test_loss: 0.9363, test_f1: 0.5062
 epoch: 44, train_loss: 0.8668, test_loss: 0.9387, test_f1: 0.4957
 epoch: 45, train_loss: 0.8664, test_loss: 0.9374, test_f1: 0.4946
 epoch: 46, train_loss: 0.8647, test_loss: 0.9341, test_f1: 0.5115
 epoch: 47, train_loss: 0.8581, test_loss: 0.9690, test_f1: 0.5208
 epoch: 48, train_loss: 0.8523, test_loss: 0.9222, test_f1: 0.5174
 epoch: 49, train_loss: 0.8487, test_loss: 0.9161, test_f1: 0.5208
 epoch: 50, train_loss: 0.8479, test_loss: 1.0058, test_f1: 0.5144
 epoch: 51, train_loss: 0.8488, test_loss: 0.9374, test_f1: 0.5189
 epoch: 52, train_loss: 0.8370, test_loss: 0.9439, test_f1: 0.5368
 epoch: 53, train_loss: 0.8325, test_loss: 0.9119, test_f1: 0.5313
 epoch: 54, train_loss: 0.8389, test_loss: 0.9276, test_f1: 0.5225
 epoch: 55, train_loss: 0.8224, test_loss: 0.9292, test_f1: 0.5234
 epoch: 56, train_loss: 0.8301, test_loss: 0.9465, test_f1: 0.5336
 epoch: 57, train_loss: 0.8176, test_loss: 0.9207, test_f1: 0.5098
 epoch: 58, train_loss: 0.8166, test_loss: 0.9452, test_f1: 0.5279
 epoch: 59, train_loss: 0.8153, test_loss: 0.9100, test_f1: 0.5347
 epoch: 60, train_loss: 0.8260, test_loss: 0.9193, test_f1: 0.5510
 epoch: 61, train_loss: 0.8210, test_loss: 0.9238, test_f1: 0.5241
 epoch: 62, train_loss: 0.8212, test_loss: 0.9102, test_f1: 0.5393
 epoch: 63, train_loss: 0.8145, test_loss: 0.9108, test_f1: 0.5312
 epoch: 64, train_loss: 0.8210, test_loss: 0.9457, test_f1: 0.5416
 epoch: 65, train_loss: 0.8072, test_loss: 0.9210, test_f1: 0.5442
 epoch: 66, train_loss: 0.8200, test_loss: 0.9276, test_f1: 0.5414
 epoch: 67, train_loss: 0.8119, test_loss: 0.8987, test_f1: 0.5368
 epoch: 68, train_loss: 0.8069, test_loss: 0.9935, test_f1: 0.5239
 epoch: 69, train_loss: 0.8105, test_loss: 0.9115, test_f1: 0.5300
 epoch: 70, train_loss: 0.8148, test_loss: 0.9134, test_f1: 0.5431
 epoch: 71, train_loss: 0.8044, test_loss: 0.9351, test_f1: 0.5454
 epoch: 72, train_loss: 0.8035, test_loss: 0.9033, test_f1: 0.5420
 epoch: 73, train_loss: 0.8051, test_loss: 0.9270, test_f1: 0.5308
 epoch: 74, train_loss: 0.7970, test_loss: 0.9015, test_f1: 0.5475
 epoch: 75, train_loss: 0.7883, test_loss: 0.9208, test_f1: 0.5222
 epoch: 76, train_loss: 0.8015, test_loss: 0.9234, test_f1: 0.5425
 epoch: 77, train_loss: 0.7943, test_loss: 0.9150, test_f1: 0.5494
 epoch: 78, train_loss: 0.8000, test_loss: 0.8960, test_f1: 0.5324
 epoch: 79, train_loss: 0.7941, test_loss: 1.0009, test_f1: 0.5030
 epoch: 80, train_loss: 0.8026, test_loss: 0.9328, test_f1: 0.5381
 epoch: 81, train_loss: 0.7858, test_loss: 0.9266, test_f1: 0.5194
 epoch: 82, train_loss: 0.7909, test_loss: 0.9071, test_f1: 0.5302
 epoch: 83, train_loss: 0.7821, test_loss: 0.9170, test_f1: 0.5318
 epoch: 84, train_loss: 0.7892, test_loss: 0.9015, test_f1: 0.5501
 epoch: 85, train_loss: 0.7872, test_loss: 0.8980, test_f1: 0.5429
 epoch: 86, train_loss: 0.7743, test_loss: 0.9122, test_f1: 0.5343
 epoch: 87, train_loss: 0.7810, test_loss: 0.9466, test_f1: 0.5453
 epoch: 88, train_loss: 0.7823, test_loss: 0.9105, test_f1: 0.5425
 epoch: 89, train_loss: 0.7796, test_loss: 0.9137, test_f1: 0.5466
 epoch: 90, train_loss: 0.7717, test_loss: 0.9010, test_f1: 0.5337
 epoch: 91, train_loss: 0.7743, test_loss: 0.9124, test_f1: 0.5450
 epoch: 92, train_loss: 0.7713, test_loss: 0.9199, test_f1: 0.5485
 epoch: 93, train_loss: 0.7702, test_loss: 0.9199, test_f1: 0.5229
 epoch: 94, train_loss: 0.7655, test_loss: 0.9043, test_f1: 0.5437
 epoch: 95, train_loss: 0.7720, test_loss: 0.9255, test_f1: 0.5318
 epoch: 96, train_loss: 0.7661, test_loss: 0.9252, test_f1: 0.5387
 epoch: 97, train_loss: 0.7851, test_loss: 0.9500, test_f1: 0.5247
 epoch: 98, train_loss: 0.7698, test_loss: 0.8848, test_f1: 0.5578
 epoch: 99, train_loss: 0.7628, test_loss: 0.8919, test_f1: 0.5394
##################ITERATION #7 ****************************************
 epoch: 0, train_loss: 1.3479, test_loss: 1.3598, test_f1: 0.2260
 epoch: 1, train_loss: 1.2652, test_loss: 1.3266, test_f1: 0.2260
 epoch: 2, train_loss: 1.2325, test_loss: 1.2507, test_f1: 0.2361
 epoch: 3, train_loss: 1.2070, test_loss: 1.2108, test_f1: 0.2604
 epoch: 4, train_loss: 1.1723, test_loss: 1.1337, test_f1: 0.4088
 epoch: 5, train_loss: 1.1344, test_loss: 1.0860, test_f1: 0.4341
 epoch: 6, train_loss: 1.0982, test_loss: 1.0564, test_f1: 0.4323
 epoch: 7, train_loss: 1.0796, test_loss: 1.0444, test_f1: 0.4433
 epoch: 8, train_loss: 1.0671, test_loss: 1.0439, test_f1: 0.4399
 epoch: 9, train_loss: 1.0468, test_loss: 1.0122, test_f1: 0.4453
 epoch: 10, train_loss: 1.0346, test_loss: 1.0138, test_f1: 0.4311
 epoch: 11, train_loss: 1.0383, test_loss: 1.0557, test_f1: 0.4341
 epoch: 12, train_loss: 1.0254, test_loss: 1.0135, test_f1: 0.4418
 epoch: 13, train_loss: 1.0089, test_loss: 1.0229, test_f1: 0.4534
 epoch: 14, train_loss: 0.9991, test_loss: 1.0194, test_f1: 0.4380
 epoch: 15, train_loss: 0.9891, test_loss: 0.9804, test_f1: 0.4991
 epoch: 16, train_loss: 0.9909, test_loss: 0.9670, test_f1: 0.5041
 epoch: 17, train_loss: 0.9802, test_loss: 1.0628, test_f1: 0.4693
 epoch: 18, train_loss: 0.9583, test_loss: 0.9908, test_f1: 0.4777
 epoch: 19, train_loss: 0.9537, test_loss: 0.9731, test_f1: 0.4875
 epoch: 20, train_loss: 0.9541, test_loss: 1.0043, test_f1: 0.4655
 epoch: 21, train_loss: 0.9422, test_loss: 0.9603, test_f1: 0.4812
 epoch: 22, train_loss: 0.9450, test_loss: 0.9488, test_f1: 0.5159
 epoch: 23, train_loss: 0.9293, test_loss: 0.9796, test_f1: 0.4967
 epoch: 24, train_loss: 0.9278, test_loss: 0.9519, test_f1: 0.5210
 epoch: 25, train_loss: 0.9267, test_loss: 1.0098, test_f1: 0.4678
 epoch: 26, train_loss: 0.9130, test_loss: 0.9612, test_f1: 0.4923
 epoch: 27, train_loss: 0.9160, test_loss: 0.9567, test_f1: 0.4985
 epoch: 28, train_loss: 0.9124, test_loss: 0.9484, test_f1: 0.5183
 epoch: 29, train_loss: 0.9099, test_loss: 0.9577, test_f1: 0.4990
 epoch: 30, train_loss: 0.8902, test_loss: 0.9611, test_f1: 0.5484
 epoch: 31, train_loss: 0.9002, test_loss: 0.9690, test_f1: 0.5122
 epoch: 32, train_loss: 0.8924, test_loss: 1.0611, test_f1: 0.4937
 epoch: 33, train_loss: 0.8844, test_loss: 1.0042, test_f1: 0.5131
 epoch: 34, train_loss: 0.8636, test_loss: 0.9577, test_f1: 0.5360
 epoch: 35, train_loss: 0.8736, test_loss: 0.9936, test_f1: 0.5051
 epoch: 36, train_loss: 0.8764, test_loss: 0.9520, test_f1: 0.5260
 epoch: 37, train_loss: 0.8577, test_loss: 0.9355, test_f1: 0.5431
 epoch: 38, train_loss: 0.8634, test_loss: 0.9652, test_f1: 0.5398
 epoch: 39, train_loss: 0.8562, test_loss: 1.0269, test_f1: 0.4972
 epoch: 40, train_loss: 0.8612, test_loss: 0.9461, test_f1: 0.5152
 epoch: 41, train_loss: 0.8546, test_loss: 0.9615, test_f1: 0.5267
 epoch: 42, train_loss: 0.8627, test_loss: 1.0093, test_f1: 0.5388
 epoch: 43, train_loss: 0.8471, test_loss: 0.9492, test_f1: 0.5331
 epoch: 44, train_loss: 0.8399, test_loss: 0.9909, test_f1: 0.4928
 epoch: 45, train_loss: 0.8431, test_loss: 0.9639, test_f1: 0.5169
 epoch: 46, train_loss: 0.8305, test_loss: 0.9549, test_f1: 0.5224
 epoch: 47, train_loss: 0.8306, test_loss: 0.9193, test_f1: 0.5339
 epoch: 48, train_loss: 0.8199, test_loss: 0.9648, test_f1: 0.5286
 epoch: 49, train_loss: 0.8192, test_loss: 0.9617, test_f1: 0.5116
 epoch: 50, train_loss: 0.8172, test_loss: 0.9648, test_f1: 0.5272
 epoch: 51, train_loss: 0.8146, test_loss: 0.9584, test_f1: 0.5345
 epoch: 52, train_loss: 0.8072, test_loss: 0.9448, test_f1: 0.5361
 epoch: 53, train_loss: 0.8111, test_loss: 0.9469, test_f1: 0.5434
 epoch: 54, train_loss: 0.8082, test_loss: 0.9663, test_f1: 0.5218
 epoch: 55, train_loss: 0.8006, test_loss: 0.9954, test_f1: 0.5262
 epoch: 56, train_loss: 0.8032, test_loss: 0.9588, test_f1: 0.5170
 epoch: 57, train_loss: 0.8043, test_loss: 0.9530, test_f1: 0.5388
 epoch: 58, train_loss: 0.7974, test_loss: 0.9439, test_f1: 0.5257
 epoch: 59, train_loss: 0.8052, test_loss: 0.9476, test_f1: 0.5461
 epoch: 60, train_loss: 0.7937, test_loss: 0.9555, test_f1: 0.5141
 epoch: 61, train_loss: 0.7999, test_loss: 0.9448, test_f1: 0.5300
 epoch: 62, train_loss: 0.7895, test_loss: 0.9475, test_f1: 0.5409
 epoch: 63, train_loss: 0.7877, test_loss: 0.9694, test_f1: 0.5365
 epoch: 64, train_loss: 0.7922, test_loss: 0.9562, test_f1: 0.5439
 epoch: 65, train_loss: 0.7828, test_loss: 0.9583, test_f1: 0.5394
 epoch: 66, train_loss: 0.7817, test_loss: 0.9576, test_f1: 0.5263
 epoch: 67, train_loss: 0.7857, test_loss: 0.9705, test_f1: 0.5228
 epoch: 68, train_loss: 0.7790, test_loss: 0.9752, test_f1: 0.5188
 epoch: 69, train_loss: 0.7884, test_loss: 1.0087, test_f1: 0.5249
 epoch: 70, train_loss: 0.7830, test_loss: 0.9813, test_f1: 0.5154
 epoch: 71, train_loss: 0.7819, test_loss: 0.9462, test_f1: 0.5306
 epoch: 72, train_loss: 0.7780, test_loss: 0.9709, test_f1: 0.5331
 epoch: 73, train_loss: 0.7755, test_loss: 0.9875, test_f1: 0.5219
 epoch: 74, train_loss: 0.7795, test_loss: 0.9584, test_f1: 0.5425
 epoch: 75, train_loss: 0.7682, test_loss: 0.9592, test_f1: 0.5414
 epoch: 76, train_loss: 0.7834, test_loss: 0.9781, test_f1: 0.5388
 epoch: 77, train_loss: 0.7716, test_loss: 0.9629, test_f1: 0.5234
 epoch: 78, train_loss: 0.7751, test_loss: 0.9628, test_f1: 0.5457
 epoch: 79, train_loss: 0.7615, test_loss: 0.9344, test_f1: 0.5535
 epoch: 80, train_loss: 0.7650, test_loss: 0.9453, test_f1: 0.5266
 epoch: 81, train_loss: 0.7705, test_loss: 0.9817, test_f1: 0.5325
 epoch: 82, train_loss: 0.7746, test_loss: 0.9951, test_f1: 0.5142
 epoch: 83, train_loss: 0.7580, test_loss: 0.9734, test_f1: 0.5256
 epoch: 84, train_loss: 0.7651, test_loss: 0.9791, test_f1: 0.5278
 epoch: 85, train_loss: 0.7578, test_loss: 0.9595, test_f1: 0.5382
 epoch: 86, train_loss: 0.7569, test_loss: 0.9863, test_f1: 0.5448
 epoch: 87, train_loss: 0.7611, test_loss: 0.9794, test_f1: 0.5205
 epoch: 88, train_loss: 0.7690, test_loss: 1.0130, test_f1: 0.5280
 epoch: 89, train_loss: 0.7806, test_loss: 0.9734, test_f1: 0.5198
 epoch: 90, train_loss: 0.7621, test_loss: 0.9773, test_f1: 0.5403
 epoch: 91, train_loss: 0.7753, test_loss: 0.9732, test_f1: 0.5352
 epoch: 92, train_loss: 0.7587, test_loss: 0.9790, test_f1: 0.5284
 epoch: 93, train_loss: 0.7551, test_loss: 0.9895, test_f1: 0.5288
 epoch: 94, train_loss: 0.7531, test_loss: 0.9747, test_f1: 0.5349
 epoch: 95, train_loss: 0.7425, test_loss: 0.9818, test_f1: 0.5244
 epoch: 96, train_loss: 0.7546, test_loss: 0.9956, test_f1: 0.5356
 epoch: 97, train_loss: 0.7461, test_loss: 0.9967, test_f1: 0.5274
 epoch: 98, train_loss: 0.7513, test_loss: 0.9856, test_f1: 0.5325
 epoch: 99, train_loss: 0.7473, test_loss: 0.9779, test_f1: 0.5483
##################ITERATION #8 ****************************************
 epoch: 0, train_loss: 1.3848, test_loss: 1.3541, test_f1: 0.2260
 epoch: 1, train_loss: 1.2177, test_loss: 1.3150, test_f1: 0.2286
 epoch: 2, train_loss: 1.1695, test_loss: 1.2631, test_f1: 0.2488
 epoch: 3, train_loss: 1.1315, test_loss: 1.1161, test_f1: 0.4086
 epoch: 4, train_loss: 1.1107, test_loss: 1.0861, test_f1: 0.4163
 epoch: 5, train_loss: 1.0864, test_loss: 1.0714, test_f1: 0.4210
 epoch: 6, train_loss: 1.0657, test_loss: 1.0664, test_f1: 0.4304
 epoch: 7, train_loss: 1.0526, test_loss: 1.0663, test_f1: 0.4276
 epoch: 8, train_loss: 1.0370, test_loss: 1.0631, test_f1: 0.4491
 epoch: 9, train_loss: 1.0393, test_loss: 1.0609, test_f1: 0.4390
 epoch: 10, train_loss: 1.0284, test_loss: 1.0610, test_f1: 0.4342
 epoch: 11, train_loss: 1.0323, test_loss: 1.0742, test_f1: 0.4549
 epoch: 12, train_loss: 1.0281, test_loss: 1.0713, test_f1: 0.4417
 epoch: 13, train_loss: 1.0087, test_loss: 1.0730, test_f1: 0.4322
 epoch: 14, train_loss: 1.0115, test_loss: 1.0597, test_f1: 0.4620
 epoch: 15, train_loss: 1.0029, test_loss: 1.0648, test_f1: 0.4602
 epoch: 16, train_loss: 0.9961, test_loss: 1.0713, test_f1: 0.4567
 epoch: 17, train_loss: 0.9890, test_loss: 1.0835, test_f1: 0.4605
 epoch: 18, train_loss: 0.9861, test_loss: 1.0738, test_f1: 0.4802
 epoch: 19, train_loss: 0.9782, test_loss: 1.0642, test_f1: 0.4659
 epoch: 20, train_loss: 0.9726, test_loss: 1.0645, test_f1: 0.4901
 epoch: 21, train_loss: 0.9725, test_loss: 1.0605, test_f1: 0.4935
 epoch: 22, train_loss: 0.9741, test_loss: 1.0529, test_f1: 0.4812
 epoch: 23, train_loss: 0.9729, test_loss: 1.0507, test_f1: 0.4677
 epoch: 24, train_loss: 0.9654, test_loss: 1.0433, test_f1: 0.4901
 epoch: 25, train_loss: 0.9576, test_loss: 1.0716, test_f1: 0.5065
 epoch: 26, train_loss: 0.9513, test_loss: 1.0544, test_f1: 0.4752
 epoch: 27, train_loss: 0.9410, test_loss: 1.0492, test_f1: 0.4812
 epoch: 28, train_loss: 0.9456, test_loss: 1.0531, test_f1: 0.4936
 epoch: 29, train_loss: 0.9342, test_loss: 1.0699, test_f1: 0.4870
 epoch: 30, train_loss: 0.9363, test_loss: 1.0572, test_f1: 0.4625
 epoch: 31, train_loss: 0.9234, test_loss: 1.0366, test_f1: 0.4999
 epoch: 32, train_loss: 0.9251, test_loss: 1.0726, test_f1: 0.4840
 epoch: 33, train_loss: 0.9256, test_loss: 1.0677, test_f1: 0.4649
 epoch: 34, train_loss: 0.9272, test_loss: 1.0446, test_f1: 0.5031
 epoch: 35, train_loss: 0.9265, test_loss: 1.0325, test_f1: 0.4891
 epoch: 36, train_loss: 0.9212, test_loss: 1.1039, test_f1: 0.4704
 epoch: 37, train_loss: 0.9214, test_loss: 1.0376, test_f1: 0.4793
 epoch: 38, train_loss: 0.9139, test_loss: 1.0221, test_f1: 0.4976
 epoch: 39, train_loss: 0.9134, test_loss: 1.0486, test_f1: 0.5041
 epoch: 40, train_loss: 0.9011, test_loss: 1.0272, test_f1: 0.4956
 epoch: 41, train_loss: 0.9116, test_loss: 1.0434, test_f1: 0.5029
 epoch: 42, train_loss: 0.8980, test_loss: 1.0632, test_f1: 0.4944
 epoch: 43, train_loss: 0.8979, test_loss: 1.0531, test_f1: 0.5135
 epoch: 44, train_loss: 0.8963, test_loss: 1.0172, test_f1: 0.5060
 epoch: 45, train_loss: 0.8843, test_loss: 1.0404, test_f1: 0.5034
 epoch: 46, train_loss: 0.8887, test_loss: 1.0111, test_f1: 0.5176
 epoch: 47, train_loss: 0.8991, test_loss: 1.0870, test_f1: 0.4834
 epoch: 48, train_loss: 0.8944, test_loss: 1.1103, test_f1: 0.4932
 epoch: 49, train_loss: 0.8776, test_loss: 1.0362, test_f1: 0.5303
 epoch: 50, train_loss: 0.8735, test_loss: 1.0426, test_f1: 0.5177
 epoch: 51, train_loss: 0.8620, test_loss: 1.0452, test_f1: 0.5117
 epoch: 52, train_loss: 0.8603, test_loss: 1.0239, test_f1: 0.5320
 epoch: 53, train_loss: 0.8675, test_loss: 1.0543, test_f1: 0.5121
 epoch: 54, train_loss: 0.8553, test_loss: 1.0219, test_f1: 0.5274
 epoch: 55, train_loss: 0.8659, test_loss: 1.0184, test_f1: 0.5313
 epoch: 56, train_loss: 0.8594, test_loss: 1.0619, test_f1: 0.5100
 epoch: 57, train_loss: 0.8570, test_loss: 1.0525, test_f1: 0.5092
 epoch: 58, train_loss: 0.8590, test_loss: 1.0191, test_f1: 0.5358
 epoch: 59, train_loss: 0.8539, test_loss: 1.0223, test_f1: 0.5090
 epoch: 60, train_loss: 0.8528, test_loss: 1.0207, test_f1: 0.5314
 epoch: 61, train_loss: 0.8443, test_loss: 1.0199, test_f1: 0.5421
 epoch: 62, train_loss: 0.8446, test_loss: 1.0301, test_f1: 0.5312
 epoch: 63, train_loss: 0.8437, test_loss: 1.0445, test_f1: 0.5058
 epoch: 64, train_loss: 0.8438, test_loss: 1.0234, test_f1: 0.5390
 epoch: 65, train_loss: 0.8406, test_loss: 1.0841, test_f1: 0.4985
 epoch: 66, train_loss: 0.8480, test_loss: 1.0707, test_f1: 0.5093
 epoch: 67, train_loss: 0.8475, test_loss: 1.0151, test_f1: 0.5336
 epoch: 68, train_loss: 0.8463, test_loss: 1.0087, test_f1: 0.5224
 epoch: 69, train_loss: 0.8397, test_loss: 1.0124, test_f1: 0.5205
 epoch: 70, train_loss: 0.8476, test_loss: 1.0381, test_f1: 0.5245
 epoch: 71, train_loss: 0.8462, test_loss: 1.0007, test_f1: 0.5242
 epoch: 72, train_loss: 0.8369, test_loss: 1.0182, test_f1: 0.5322
 epoch: 73, train_loss: 0.8227, test_loss: 1.0298, test_f1: 0.5215
 epoch: 74, train_loss: 0.8277, test_loss: 1.0361, test_f1: 0.5254
 epoch: 75, train_loss: 0.8351, test_loss: 1.0314, test_f1: 0.5246
 epoch: 76, train_loss: 0.8353, test_loss: 1.0366, test_f1: 0.5313
 epoch: 77, train_loss: 0.8284, test_loss: 1.0096, test_f1: 0.5305
 epoch: 78, train_loss: 0.8277, test_loss: 1.0256, test_f1: 0.5262
 epoch: 79, train_loss: 0.8330, test_loss: 1.0139, test_f1: 0.5346
 epoch: 80, train_loss: 0.8238, test_loss: 1.0713, test_f1: 0.5056
 epoch: 81, train_loss: 0.8163, test_loss: 1.0266, test_f1: 0.5278
 epoch: 82, train_loss: 0.8232, test_loss: 1.0152, test_f1: 0.5238
 epoch: 83, train_loss: 0.8175, test_loss: 1.0023, test_f1: 0.5368
 epoch: 84, train_loss: 0.8123, test_loss: 1.0026, test_f1: 0.5321
 epoch: 85, train_loss: 0.8244, test_loss: 1.0331, test_f1: 0.5161
 epoch: 86, train_loss: 0.8052, test_loss: 1.0228, test_f1: 0.5267
 epoch: 87, train_loss: 0.8153, test_loss: 1.0315, test_f1: 0.5288
 epoch: 88, train_loss: 0.8188, test_loss: 1.0320, test_f1: 0.5277
 epoch: 89, train_loss: 0.8067, test_loss: 1.0271, test_f1: 0.5236
 epoch: 90, train_loss: 0.8011, test_loss: 1.0324, test_f1: 0.5302
 epoch: 91, train_loss: 0.8126, test_loss: 1.0365, test_f1: 0.5189
 epoch: 92, train_loss: 0.8200, test_loss: 1.0116, test_f1: 0.5263
 epoch: 93, train_loss: 0.8217, test_loss: 1.0122, test_f1: 0.5192
 epoch: 94, train_loss: 0.8171, test_loss: 1.0779, test_f1: 0.5146
 epoch: 95, train_loss: 0.8050, test_loss: 1.0249, test_f1: 0.5175
 epoch: 96, train_loss: 0.8122, test_loss: 0.9876, test_f1: 0.5374
 epoch: 97, train_loss: 0.8025, test_loss: 1.0369, test_f1: 0.5158
 epoch: 98, train_loss: 0.8081, test_loss: 1.0259, test_f1: 0.5253
 epoch: 99, train_loss: 0.7940, test_loss: 1.0081, test_f1: 0.5242
##################ITERATION #9 ****************************************
 epoch: 0, train_loss: 1.3732, test_loss: 1.3211, test_f1: 0.2260
 epoch: 1, train_loss: 1.1740, test_loss: 1.2427, test_f1: 0.2260
 epoch: 2, train_loss: 1.1185, test_loss: 1.1369, test_f1: 0.3352
 epoch: 3, train_loss: 1.0859, test_loss: 1.0696, test_f1: 0.3634
 epoch: 4, train_loss: 1.0773, test_loss: 1.0686, test_f1: 0.3647
 epoch: 5, train_loss: 1.0555, test_loss: 1.0670, test_f1: 0.4004
 epoch: 6, train_loss: 1.0452, test_loss: 1.0643, test_f1: 0.4290
 epoch: 7, train_loss: 1.0324, test_loss: 1.0484, test_f1: 0.4302
 epoch: 8, train_loss: 1.0253, test_loss: 1.0466, test_f1: 0.4462
 epoch: 9, train_loss: 1.0197, test_loss: 1.0420, test_f1: 0.4815
 epoch: 10, train_loss: 1.0027, test_loss: 1.0544, test_f1: 0.4623
 epoch: 11, train_loss: 1.0024, test_loss: 1.0214, test_f1: 0.4682
 epoch: 12, train_loss: 0.9903, test_loss: 1.0178, test_f1: 0.4839
 epoch: 13, train_loss: 0.9902, test_loss: 1.0232, test_f1: 0.4863
 epoch: 14, train_loss: 0.9764, test_loss: 1.0290, test_f1: 0.4615
 epoch: 15, train_loss: 0.9798, test_loss: 1.0235, test_f1: 0.4588
 epoch: 16, train_loss: 0.9674, test_loss: 1.0376, test_f1: 0.4773
 epoch: 17, train_loss: 0.9678, test_loss: 0.9938, test_f1: 0.4665
 epoch: 18, train_loss: 0.9575, test_loss: 1.0285, test_f1: 0.4908
 epoch: 19, train_loss: 0.9474, test_loss: 1.0327, test_f1: 0.5086
 epoch: 20, train_loss: 0.9590, test_loss: 1.0301, test_f1: 0.4733
 epoch: 21, train_loss: 0.9470, test_loss: 1.0344, test_f1: 0.4915
 epoch: 22, train_loss: 0.9358, test_loss: 1.0482, test_f1: 0.4875
 epoch: 23, train_loss: 0.9531, test_loss: 1.0158, test_f1: 0.4870
 epoch: 24, train_loss: 0.9299, test_loss: 1.0252, test_f1: 0.4943
 epoch: 25, train_loss: 0.9289, test_loss: 1.0018, test_f1: 0.5086
 epoch: 26, train_loss: 0.9297, test_loss: 1.0734, test_f1: 0.4870
 epoch: 27, train_loss: 0.9320, test_loss: 1.0176, test_f1: 0.5095
 epoch: 28, train_loss: 0.9193, test_loss: 1.0122, test_f1: 0.5126
 epoch: 29, train_loss: 0.9132, test_loss: 1.0048, test_f1: 0.5124
 epoch: 30, train_loss: 0.9129, test_loss: 0.9836, test_f1: 0.5289
 epoch: 31, train_loss: 0.9089, test_loss: 0.9999, test_f1: 0.4804
 epoch: 32, train_loss: 0.8933, test_loss: 0.9901, test_f1: 0.5321
 epoch: 33, train_loss: 0.9084, test_loss: 0.9965, test_f1: 0.5243
 epoch: 34, train_loss: 0.8983, test_loss: 0.9811, test_f1: 0.5340
 epoch: 35, train_loss: 0.9049, test_loss: 1.0410, test_f1: 0.5232
 epoch: 36, train_loss: 0.8812, test_loss: 0.9577, test_f1: 0.5363
 epoch: 37, train_loss: 0.8851, test_loss: 0.9823, test_f1: 0.5193
 epoch: 38, train_loss: 0.8738, test_loss: 1.0081, test_f1: 0.5377
 epoch: 39, train_loss: 0.8822, test_loss: 1.0507, test_f1: 0.5096
 epoch: 40, train_loss: 0.8631, test_loss: 1.0025, test_f1: 0.5250
 epoch: 41, train_loss: 0.8809, test_loss: 1.0264, test_f1: 0.5339
 epoch: 42, train_loss: 0.8630, test_loss: 0.9981, test_f1: 0.5340
 epoch: 43, train_loss: 0.8819, test_loss: 0.9874, test_f1: 0.5379
 epoch: 44, train_loss: 0.8644, test_loss: 0.9813, test_f1: 0.5306
 epoch: 45, train_loss: 0.8650, test_loss: 0.9680, test_f1: 0.5487
 epoch: 46, train_loss: 0.8679, test_loss: 0.9636, test_f1: 0.5521
 epoch: 47, train_loss: 0.8619, test_loss: 0.9600, test_f1: 0.5450
 epoch: 48, train_loss: 0.8483, test_loss: 1.0561, test_f1: 0.5196
 epoch: 49, train_loss: 0.8522, test_loss: 0.9980, test_f1: 0.5564
 epoch: 50, train_loss: 0.8587, test_loss: 0.9882, test_f1: 0.5571
 epoch: 51, train_loss: 0.8495, test_loss: 0.9709, test_f1: 0.5382
 epoch: 52, train_loss: 0.8303, test_loss: 1.0170, test_f1: 0.5353
 epoch: 53, train_loss: 0.8379, test_loss: 0.9985, test_f1: 0.5398
 epoch: 54, train_loss: 0.8377, test_loss: 0.9902, test_f1: 0.5326
 epoch: 55, train_loss: 0.8299, test_loss: 0.9989, test_f1: 0.5389
 epoch: 56, train_loss: 0.8334, test_loss: 1.0216, test_f1: 0.5363
 epoch: 57, train_loss: 0.8263, test_loss: 0.9799, test_f1: 0.5435
 epoch: 58, train_loss: 0.8240, test_loss: 1.0001, test_f1: 0.5454
 epoch: 59, train_loss: 0.8204, test_loss: 0.9965, test_f1: 0.5370
 epoch: 60, train_loss: 0.8419, test_loss: 0.9799, test_f1: 0.5421
 epoch: 61, train_loss: 0.8325, test_loss: 1.0110, test_f1: 0.5502
 epoch: 62, train_loss: 0.8241, test_loss: 0.9861, test_f1: 0.5420
 epoch: 63, train_loss: 0.8273, test_loss: 1.0053, test_f1: 0.5461
 epoch: 64, train_loss: 0.8219, test_loss: 0.9897, test_f1: 0.5403
 epoch: 65, train_loss: 0.8141, test_loss: 0.9849, test_f1: 0.5469
 epoch: 66, train_loss: 0.8247, test_loss: 0.9919, test_f1: 0.5413
 epoch: 67, train_loss: 0.8240, test_loss: 1.0140, test_f1: 0.5367
 epoch: 68, train_loss: 0.8142, test_loss: 0.9863, test_f1: 0.5288
 epoch: 69, train_loss: 0.8133, test_loss: 1.0093, test_f1: 0.5444
 epoch: 70, train_loss: 0.8104, test_loss: 1.0413, test_f1: 0.5291
 epoch: 71, train_loss: 0.8205, test_loss: 1.0048, test_f1: 0.5384
 epoch: 72, train_loss: 0.8149, test_loss: 1.0224, test_f1: 0.5421
 epoch: 73, train_loss: 0.8125, test_loss: 1.0470, test_f1: 0.5358
 epoch: 74, train_loss: 0.8106, test_loss: 1.0266, test_f1: 0.5354
 epoch: 75, train_loss: 0.8035, test_loss: 1.0444, test_f1: 0.5294
 epoch: 76, train_loss: 0.7986, test_loss: 1.0245, test_f1: 0.5312
 epoch: 77, train_loss: 0.7948, test_loss: 1.0157, test_f1: 0.5385
 epoch: 78, train_loss: 0.8029, test_loss: 1.0237, test_f1: 0.5402
 epoch: 79, train_loss: 0.7966, test_loss: 1.0327, test_f1: 0.5442
 epoch: 80, train_loss: 0.7959, test_loss: 1.0402, test_f1: 0.5444
 epoch: 81, train_loss: 0.8073, test_loss: 1.0406, test_f1: 0.5327
 epoch: 82, train_loss: 0.8051, test_loss: 1.0382, test_f1: 0.5290
 epoch: 83, train_loss: 0.8043, test_loss: 1.0515, test_f1: 0.5211
 epoch: 84, train_loss: 0.8021, test_loss: 1.0821, test_f1: 0.5222
 epoch: 85, train_loss: 0.7898, test_loss: 1.0250, test_f1: 0.5301
 epoch: 86, train_loss: 0.7886, test_loss: 1.0629, test_f1: 0.5414
 epoch: 87, train_loss: 0.7931, test_loss: 1.0581, test_f1: 0.5327
 epoch: 88, train_loss: 0.7890, test_loss: 1.0656, test_f1: 0.5321
 epoch: 89, train_loss: 0.7724, test_loss: 1.0508, test_f1: 0.5388
 epoch: 90, train_loss: 0.7852, test_loss: 1.0408, test_f1: 0.5368
 epoch: 91, train_loss: 0.7823, test_loss: 1.0668, test_f1: 0.5348
 epoch: 92, train_loss: 0.7849, test_loss: 1.0569, test_f1: 0.5292
 epoch: 93, train_loss: 0.7831, test_loss: 1.0560, test_f1: 0.5330
 epoch: 94, train_loss: 0.7738, test_loss: 1.0284, test_f1: 0.5443
 epoch: 95, train_loss: 0.7763, test_loss: 1.0525, test_f1: 0.5367
 epoch: 96, train_loss: 0.7786, test_loss: 1.0343, test_f1: 0.5445
 epoch: 97, train_loss: 0.7835, test_loss: 1.0926, test_f1: 0.5319
 epoch: 98, train_loss: 0.7940, test_loss: 1.0072, test_f1: 0.5507
 epoch: 99, train_loss: 0.7727, test_loss: 1.0178, test_f1: 0.5466

Training completed in 428.58 seconds
Best F1: 0.5671 at epoch 94
Mean F1 across iterations: 0.5466  0.0139
========================FINAL RESULTS================================
FEGIN weighted F1: 0.5671  0.0139
python main.py --data ltspice_examples --representation component_pin --model FEGIN --layers 5 --hiddens 16 --batch_size 256 --lr 0.001 --emb_size 128 --epochs 100 --save_appendix component_pin_L5_H16_BS256_LR0.001_E128 --no_val
-----



STDERR:
  File "main.py", line 370, in <module>
    main()
  File "main.py", line 254, in main
    dataset = dataset_class(
  File "/home/philip/projects/ltspice_examples_code_repo/Circuit-Completion-Using-GNNs/component_classification_with_link_prediction_head/evaluation/FEGIN/kernel/circuit_datasets.py", line 15, in __init__
    self.data, self.slices = torch.load(self.processed_paths[0])
  File "/home/philip/.local/lib/python3.8/site-packages/torch/serialization.py", line 1040, in load
    warnings.warn(
  File "/usr/lib/python3.8/warnings.py", line 109, in _showwarnmsg
    sw(msg.message, msg.category, msg.filename, msg.lineno,
  File "main.py", line 47, in warn_with_traceback
    traceback.print_stack(file=log)
/home/philip/projects/ltspice_examples_code_repo/Circuit-Completion-Using-GNNs/component_classification_with_link_prediction_head/evaluation/FEGIN/kernel/circuit_datasets.py:15: FutureWarning: You are using `torch.load` with `weights_only=False` (the current default value), which uses the default pickle module implicitly. It is possible to construct malicious pickle data which will execute arbitrary code during unpickling (See https://github.com/pytorch/pytorch/blob/main/SECURITY.md#untrusted-models for more details). In a future release, the default value for `weights_only` will be flipped to `True`. This limits the functions that could be executed during unpickling. Arbitrary objects will no longer be allowed to be loaded via this mode unless they are explicitly allowlisted by the user via `torch.serialization.add_safe_globals`. We recommend you start setting `weights_only=True` for any use case where you don't have full control of the loaded file. Please open an issue on GitHub for any issues related to this experimental feature.
  self.data, self.slices = torch.load(self.processed_paths[0])
