STDOUT:
Results will be saved in /home/philip/projects/ltspice_examples_code_repo/Circuit-Completion-Using-GNNs/component_classification_with_link_prediction_head/evaluation/FEGIN/results/model_FEGIN_dataset_ltspice_demos
Command line input: python main.py --data ltspice_demos --representation component_pin_net --model FEGIN --layers 4 --hiddens 16 --batch_size 256 --lr 0.001 --emb_size 128 --epochs 100 --save_appendix component_pin_net_L4_H16_BS256_LR0.001_E128 --no_val
 is saved.
-----
ltspice_demos - FEGIN
Using 4 layers, 16 hidden units, h = 2
Loading component_pin_net representation dataset
ENTERED
Training FEGIN on component_pin_net representation
Train: 1565, Test: 383
##################ITERATION #0 ****************************************
 epoch: 0, train_loss: 1.4598, test_loss: 1.4423, test_f1: 0.0507
 epoch: 1, train_loss: 1.4429, test_loss: 1.4350, test_f1: 0.0507
 epoch: 2, train_loss: 1.4280, test_loss: 1.4257, test_f1: 0.0507
 epoch: 3, train_loss: 1.4143, test_loss: 1.4102, test_f1: 0.0507
 epoch: 4, train_loss: 1.3951, test_loss: 1.3940, test_f1: 0.1815
 epoch: 5, train_loss: 1.3757, test_loss: 1.3784, test_f1: 0.1507
 epoch: 6, train_loss: 1.3528, test_loss: 1.3619, test_f1: 0.1603
 epoch: 7, train_loss: 1.3243, test_loss: 1.3426, test_f1: 0.1672
 epoch: 8, train_loss: 1.2980, test_loss: 1.3231, test_f1: 0.1365
 epoch: 9, train_loss: 1.2766, test_loss: 1.3071, test_f1: 0.1365
 epoch: 10, train_loss: 1.2607, test_loss: 1.2969, test_f1: 0.1365
 epoch: 11, train_loss: 1.2445, test_loss: 1.2873, test_f1: 0.1365
 epoch: 12, train_loss: 1.2319, test_loss: 1.2733, test_f1: 0.1365
 epoch: 13, train_loss: 1.2114, test_loss: 1.2627, test_f1: 0.1379
 epoch: 14, train_loss: 1.1994, test_loss: 1.2522, test_f1: 0.1494
 epoch: 15, train_loss: 1.1829, test_loss: 1.2444, test_f1: 0.2259
 epoch: 16, train_loss: 1.1788, test_loss: 1.2386, test_f1: 0.3463
 epoch: 17, train_loss: 1.1667, test_loss: 1.2302, test_f1: 0.3409
 epoch: 18, train_loss: 1.1589, test_loss: 1.2187, test_f1: 0.3567
 epoch: 19, train_loss: 1.1524, test_loss: 1.2155, test_f1: 0.3636
 epoch: 20, train_loss: 1.1399, test_loss: 1.2265, test_f1: 0.3469
 epoch: 21, train_loss: 1.1355, test_loss: 1.2299, test_f1: 0.3411
 epoch: 22, train_loss: 1.1252, test_loss: 1.2156, test_f1: 0.3495
 epoch: 23, train_loss: 1.1158, test_loss: 1.2165, test_f1: 0.3925
 epoch: 24, train_loss: 1.1167, test_loss: 1.2031, test_f1: 0.4262
 epoch: 25, train_loss: 1.1057, test_loss: 1.1989, test_f1: 0.4417
 epoch: 26, train_loss: 1.1048, test_loss: 1.1961, test_f1: 0.4560
 epoch: 27, train_loss: 1.1061, test_loss: 1.1966, test_f1: 0.4613
 epoch: 28, train_loss: 1.0915, test_loss: 1.1895, test_f1: 0.4575
 epoch: 29, train_loss: 1.0979, test_loss: 1.1856, test_f1: 0.4217
 epoch: 30, train_loss: 1.0886, test_loss: 1.1943, test_f1: 0.4441
 epoch: 31, train_loss: 1.0844, test_loss: 1.1890, test_f1: 0.4448
 epoch: 32, train_loss: 1.0850, test_loss: 1.1848, test_f1: 0.4428
 epoch: 33, train_loss: 1.0696, test_loss: 1.1931, test_f1: 0.4499
 epoch: 34, train_loss: 1.0700, test_loss: 1.1803, test_f1: 0.4417
 epoch: 35, train_loss: 1.0667, test_loss: 1.1713, test_f1: 0.4472
 epoch: 36, train_loss: 1.0543, test_loss: 1.1706, test_f1: 0.4398
 epoch: 37, train_loss: 1.0612, test_loss: 1.1848, test_f1: 0.4333
 epoch: 38, train_loss: 1.0550, test_loss: 1.2275, test_f1: 0.4487
 epoch: 39, train_loss: 1.0485, test_loss: 1.2084, test_f1: 0.4574
 epoch: 40, train_loss: 1.0525, test_loss: 1.1636, test_f1: 0.4355
 epoch: 41, train_loss: 1.0460, test_loss: 1.1649, test_f1: 0.4478
 epoch: 42, train_loss: 1.0456, test_loss: 1.1421, test_f1: 0.4458
 epoch: 43, train_loss: 1.0376, test_loss: 1.1816, test_f1: 0.4031
 epoch: 44, train_loss: 1.0390, test_loss: 1.1454, test_f1: 0.4306
 epoch: 45, train_loss: 1.0292, test_loss: 1.1851, test_f1: 0.4526
 epoch: 46, train_loss: 1.0177, test_loss: 1.1643, test_f1: 0.4381
 epoch: 47, train_loss: 1.0226, test_loss: 1.1489, test_f1: 0.4251
 epoch: 48, train_loss: 1.0207, test_loss: 1.1411, test_f1: 0.4400
 epoch: 49, train_loss: 1.0128, test_loss: 1.1485, test_f1: 0.4430
 epoch: 50, train_loss: 1.0018, test_loss: 1.1680, test_f1: 0.4526
 epoch: 51, train_loss: 1.0000, test_loss: 1.1359, test_f1: 0.4469
 epoch: 52, train_loss: 1.0057, test_loss: 1.1386, test_f1: 0.4502
 epoch: 53, train_loss: 0.9997, test_loss: 1.1181, test_f1: 0.4438
 epoch: 54, train_loss: 0.9926, test_loss: 1.1181, test_f1: 0.4463
 epoch: 55, train_loss: 0.9882, test_loss: 1.1200, test_f1: 0.4443
 epoch: 56, train_loss: 0.9888, test_loss: 1.1208, test_f1: 0.4472
 epoch: 57, train_loss: 0.9963, test_loss: 1.1211, test_f1: 0.4447
 epoch: 58, train_loss: 0.9839, test_loss: 1.1221, test_f1: 0.4452
 epoch: 59, train_loss: 0.9858, test_loss: 1.1197, test_f1: 0.4476
 epoch: 60, train_loss: 0.9760, test_loss: 1.1229, test_f1: 0.4552
 epoch: 61, train_loss: 0.9823, test_loss: 1.1157, test_f1: 0.4472
 epoch: 62, train_loss: 0.9884, test_loss: 1.1061, test_f1: 0.4406
 epoch: 63, train_loss: 0.9706, test_loss: 1.1244, test_f1: 0.4484
 epoch: 64, train_loss: 0.9722, test_loss: 1.1261, test_f1: 0.4508
 epoch: 65, train_loss: 0.9677, test_loss: 1.1177, test_f1: 0.4472
 epoch: 66, train_loss: 0.9741, test_loss: 1.1234, test_f1: 0.4438
 epoch: 67, train_loss: 0.9673, test_loss: 1.1053, test_f1: 0.4423
 epoch: 68, train_loss: 0.9715, test_loss: 1.0934, test_f1: 0.4443
 epoch: 69, train_loss: 0.9708, test_loss: 1.1121, test_f1: 0.4495
 epoch: 70, train_loss: 0.9639, test_loss: 1.1169, test_f1: 0.4495
 epoch: 71, train_loss: 0.9547, test_loss: 1.1188, test_f1: 0.4553
 epoch: 72, train_loss: 0.9642, test_loss: 1.1545, test_f1: 0.4553
 epoch: 73, train_loss: 0.9533, test_loss: 1.1531, test_f1: 0.4623
 epoch: 74, train_loss: 0.9577, test_loss: 1.1284, test_f1: 0.4371
 epoch: 75, train_loss: 0.9617, test_loss: 1.1209, test_f1: 0.4416
 epoch: 76, train_loss: 0.9588, test_loss: 1.1108, test_f1: 0.4355
 epoch: 77, train_loss: 0.9537, test_loss: 1.0918, test_f1: 0.4495
 epoch: 78, train_loss: 0.9551, test_loss: 1.1006, test_f1: 0.4388
 epoch: 79, train_loss: 0.9528, test_loss: 1.1258, test_f1: 0.4597
 epoch: 80, train_loss: 0.9575, test_loss: 1.1077, test_f1: 0.4461
 epoch: 81, train_loss: 0.9513, test_loss: 1.1356, test_f1: 0.4435
 epoch: 82, train_loss: 0.9576, test_loss: 1.1395, test_f1: 0.4431
 epoch: 83, train_loss: 0.9417, test_loss: 1.1075, test_f1: 0.4355
 epoch: 84, train_loss: 0.9525, test_loss: 1.1231, test_f1: 0.4076
 epoch: 85, train_loss: 0.9533, test_loss: 1.1098, test_f1: 0.4402
 epoch: 86, train_loss: 0.9537, test_loss: 1.1570, test_f1: 0.4512
 epoch: 87, train_loss: 0.9463, test_loss: 1.1314, test_f1: 0.4444
 epoch: 88, train_loss: 0.9398, test_loss: 1.1117, test_f1: 0.4504
 epoch: 89, train_loss: 0.9493, test_loss: 1.1253, test_f1: 0.4486
 epoch: 90, train_loss: 0.9381, test_loss: 1.1202, test_f1: 0.4497
 epoch: 91, train_loss: 0.9360, test_loss: 1.1229, test_f1: 0.4489
 epoch: 92, train_loss: 0.9491, test_loss: 1.1108, test_f1: 0.4419
 epoch: 93, train_loss: 0.9426, test_loss: 1.0938, test_f1: 0.4295
 epoch: 94, train_loss: 0.9470, test_loss: 1.1564, test_f1: 0.3986
 epoch: 95, train_loss: 0.9290, test_loss: 1.0969, test_f1: 0.4349
 epoch: 96, train_loss: 0.9332, test_loss: 1.1231, test_f1: 0.4411
 epoch: 97, train_loss: 0.9387, test_loss: 1.1419, test_f1: 0.4449
 epoch: 98, train_loss: 0.9290, test_loss: 1.1196, test_f1: 0.4425
 epoch: 99, train_loss: 0.9372, test_loss: 1.0927, test_f1: 0.4549
##################ITERATION #1 ****************************************
 epoch: 0, train_loss: 1.4415, test_loss: 1.4321, test_f1: 0.0301
 epoch: 1, train_loss: 1.3664, test_loss: 1.4074, test_f1: 0.0301
 epoch: 2, train_loss: 1.3221, test_loss: 1.3711, test_f1: 0.2281
 epoch: 3, train_loss: 1.2788, test_loss: 1.3368, test_f1: 0.2281
 epoch: 4, train_loss: 1.2383, test_loss: 1.3158, test_f1: 0.2281
 epoch: 5, train_loss: 1.2134, test_loss: 1.3006, test_f1: 0.2281
 epoch: 6, train_loss: 1.1844, test_loss: 1.2897, test_f1: 0.2281
 epoch: 7, train_loss: 1.1662, test_loss: 1.2796, test_f1: 0.2583
 epoch: 8, train_loss: 1.1501, test_loss: 1.2683, test_f1: 0.2881
 epoch: 9, train_loss: 1.1443, test_loss: 1.2598, test_f1: 0.3620
 epoch: 10, train_loss: 1.1381, test_loss: 1.2513, test_f1: 0.3679
 epoch: 11, train_loss: 1.1276, test_loss: 1.2301, test_f1: 0.3789
 epoch: 12, train_loss: 1.1205, test_loss: 1.2096, test_f1: 0.3815
 epoch: 13, train_loss: 1.1220, test_loss: 1.2005, test_f1: 0.4151
 epoch: 14, train_loss: 1.1119, test_loss: 1.1967, test_f1: 0.4298
 epoch: 15, train_loss: 1.1013, test_loss: 1.1949, test_f1: 0.4247
 epoch: 16, train_loss: 1.1001, test_loss: 1.1947, test_f1: 0.4321
 epoch: 17, train_loss: 1.0983, test_loss: 1.1946, test_f1: 0.4299
 epoch: 18, train_loss: 1.0896, test_loss: 1.1847, test_f1: 0.4270
 epoch: 19, train_loss: 1.0905, test_loss: 1.1826, test_f1: 0.4142
 epoch: 20, train_loss: 1.0828, test_loss: 1.1839, test_f1: 0.4285
 epoch: 21, train_loss: 1.0786, test_loss: 1.1769, test_f1: 0.4089
 epoch: 22, train_loss: 1.0741, test_loss: 1.1762, test_f1: 0.3786
 epoch: 23, train_loss: 1.0638, test_loss: 1.1800, test_f1: 0.3699
 epoch: 24, train_loss: 1.0624, test_loss: 1.1762, test_f1: 0.4005
 epoch: 25, train_loss: 1.0610, test_loss: 1.1681, test_f1: 0.4005
 epoch: 26, train_loss: 1.0589, test_loss: 1.1616, test_f1: 0.4124
 epoch: 27, train_loss: 1.0516, test_loss: 1.1659, test_f1: 0.4074
 epoch: 28, train_loss: 1.0448, test_loss: 1.1868, test_f1: 0.4162
 epoch: 29, train_loss: 1.0357, test_loss: 1.1874, test_f1: 0.4162
 epoch: 30, train_loss: 1.0412, test_loss: 1.1687, test_f1: 0.4156
 epoch: 31, train_loss: 1.0316, test_loss: 1.1599, test_f1: 0.4126
 epoch: 32, train_loss: 1.0308, test_loss: 1.1705, test_f1: 0.4160
 epoch: 33, train_loss: 1.0141, test_loss: 1.1840, test_f1: 0.4160
 epoch: 34, train_loss: 1.0153, test_loss: 1.1492, test_f1: 0.4082
 epoch: 35, train_loss: 1.0187, test_loss: 1.1899, test_f1: 0.4275
 epoch: 36, train_loss: 1.0254, test_loss: 1.1486, test_f1: 0.4065
 epoch: 37, train_loss: 1.0212, test_loss: 1.1602, test_f1: 0.4114
 epoch: 38, train_loss: 0.9971, test_loss: 1.1581, test_f1: 0.4196
 epoch: 39, train_loss: 1.0074, test_loss: 1.1627, test_f1: 0.4231
 epoch: 40, train_loss: 1.0000, test_loss: 1.1866, test_f1: 0.4336
 epoch: 41, train_loss: 0.9924, test_loss: 1.1808, test_f1: 0.4172
 epoch: 42, train_loss: 0.9956, test_loss: 1.1811, test_f1: 0.4361
 epoch: 43, train_loss: 1.0056, test_loss: 1.1803, test_f1: 0.4132
 epoch: 44, train_loss: 1.0033, test_loss: 1.1562, test_f1: 0.4085
 epoch: 45, train_loss: 0.9924, test_loss: 1.1562, test_f1: 0.4054
 epoch: 46, train_loss: 0.9900, test_loss: 1.1647, test_f1: 0.4167
 epoch: 47, train_loss: 0.9774, test_loss: 1.1781, test_f1: 0.4138
 epoch: 48, train_loss: 0.9897, test_loss: 1.1824, test_f1: 0.4241
 epoch: 49, train_loss: 0.9700, test_loss: 1.1660, test_f1: 0.4203
 epoch: 50, train_loss: 0.9757, test_loss: 1.1708, test_f1: 0.4176
 epoch: 51, train_loss: 0.9694, test_loss: 1.1744, test_f1: 0.4111
 epoch: 52, train_loss: 0.9713, test_loss: 1.1694, test_f1: 0.4035
 epoch: 53, train_loss: 0.9668, test_loss: 1.1634, test_f1: 0.4059
 epoch: 54, train_loss: 0.9697, test_loss: 1.1652, test_f1: 0.4088
 epoch: 55, train_loss: 0.9636, test_loss: 1.1770, test_f1: 0.4132
 epoch: 56, train_loss: 0.9651, test_loss: 1.1825, test_f1: 0.4114
 epoch: 57, train_loss: 0.9650, test_loss: 1.1862, test_f1: 0.4111
 epoch: 58, train_loss: 0.9595, test_loss: 1.1847, test_f1: 0.4107
 epoch: 59, train_loss: 0.9578, test_loss: 1.1799, test_f1: 0.4107
 epoch: 60, train_loss: 0.9601, test_loss: 1.1809, test_f1: 0.4107
 epoch: 61, train_loss: 0.9472, test_loss: 1.1928, test_f1: 0.4114
 epoch: 62, train_loss: 0.9584, test_loss: 1.1989, test_f1: 0.4114
 epoch: 63, train_loss: 0.9606, test_loss: 1.1803, test_f1: 0.4104
 epoch: 64, train_loss: 0.9476, test_loss: 1.1792, test_f1: 0.4115
 epoch: 65, train_loss: 0.9430, test_loss: 1.1899, test_f1: 0.4164
 epoch: 66, train_loss: 0.9430, test_loss: 1.1693, test_f1: 0.4118
 epoch: 67, train_loss: 0.9558, test_loss: 1.1920, test_f1: 0.4245
 epoch: 68, train_loss: 0.9518, test_loss: 1.1842, test_f1: 0.4350
 epoch: 69, train_loss: 0.9487, test_loss: 1.1789, test_f1: 0.4354
 epoch: 70, train_loss: 0.9576, test_loss: 1.1821, test_f1: 0.4409
 epoch: 71, train_loss: 0.9492, test_loss: 1.1879, test_f1: 0.4475
 epoch: 72, train_loss: 0.9500, test_loss: 1.2046, test_f1: 0.4453
 epoch: 73, train_loss: 0.9368, test_loss: 1.1986, test_f1: 0.4433
 epoch: 74, train_loss: 0.9416, test_loss: 1.1775, test_f1: 0.4526
 epoch: 75, train_loss: 0.9354, test_loss: 1.1640, test_f1: 0.4498
 epoch: 76, train_loss: 0.9426, test_loss: 1.1664, test_f1: 0.4501
 epoch: 77, train_loss: 0.9395, test_loss: 1.1806, test_f1: 0.4538
 epoch: 78, train_loss: 0.9345, test_loss: 1.1669, test_f1: 0.4480
 epoch: 79, train_loss: 0.9424, test_loss: 1.1649, test_f1: 0.4473
 epoch: 80, train_loss: 0.9346, test_loss: 1.1519, test_f1: 0.4538
 epoch: 81, train_loss: 0.9465, test_loss: 1.1652, test_f1: 0.4377
 epoch: 82, train_loss: 0.9461, test_loss: 1.1913, test_f1: 0.4565
 epoch: 83, train_loss: 0.9410, test_loss: 1.1846, test_f1: 0.4544
 epoch: 84, train_loss: 0.9441, test_loss: 1.1778, test_f1: 0.4547
 epoch: 85, train_loss: 0.9301, test_loss: 1.1550, test_f1: 0.4523
 epoch: 86, train_loss: 0.9330, test_loss: 1.1588, test_f1: 0.4542
 epoch: 87, train_loss: 0.9309, test_loss: 1.1757, test_f1: 0.4569
 epoch: 88, train_loss: 0.9280, test_loss: 1.1837, test_f1: 0.4621
 epoch: 89, train_loss: 0.9375, test_loss: 1.1835, test_f1: 0.4596
 epoch: 90, train_loss: 0.9367, test_loss: 1.1721, test_f1: 0.4596
 epoch: 91, train_loss: 0.9269, test_loss: 1.1651, test_f1: 0.4677
 epoch: 92, train_loss: 0.9196, test_loss: 1.1585, test_f1: 0.4730
 epoch: 93, train_loss: 0.9188, test_loss: 1.1662, test_f1: 0.4795
 epoch: 94, train_loss: 0.9242, test_loss: 1.1764, test_f1: 0.4756
 epoch: 95, train_loss: 0.9273, test_loss: 1.1822, test_f1: 0.4719
 epoch: 96, train_loss: 0.9273, test_loss: 1.2059, test_f1: 0.4641
 epoch: 97, train_loss: 0.9261, test_loss: 1.2070, test_f1: 0.4778
 epoch: 98, train_loss: 0.9239, test_loss: 1.2044, test_f1: 0.4888
 epoch: 99, train_loss: 0.9179, test_loss: 1.1926, test_f1: 0.4795
##################ITERATION #2 ****************************************
 epoch: 0, train_loss: 1.3681, test_loss: 1.3921, test_f1: 0.0300
 epoch: 1, train_loss: 1.2729, test_loss: 1.3671, test_f1: 0.2281
 epoch: 2, train_loss: 1.2351, test_loss: 1.3533, test_f1: 0.2281
 epoch: 3, train_loss: 1.2029, test_loss: 1.3389, test_f1: 0.2281
 epoch: 4, train_loss: 1.1782, test_loss: 1.3119, test_f1: 0.2491
 epoch: 5, train_loss: 1.1692, test_loss: 1.2912, test_f1: 0.2889
 epoch: 6, train_loss: 1.1537, test_loss: 1.2767, test_f1: 0.2946
 epoch: 7, train_loss: 1.1288, test_loss: 1.2540, test_f1: 0.3001
 epoch: 8, train_loss: 1.1127, test_loss: 1.2321, test_f1: 0.3060
 epoch: 9, train_loss: 1.1142, test_loss: 1.2014, test_f1: 0.3159
 epoch: 10, train_loss: 1.1036, test_loss: 1.1829, test_f1: 0.3407
 epoch: 11, train_loss: 1.0981, test_loss: 1.1700, test_f1: 0.3342
 epoch: 12, train_loss: 1.0874, test_loss: 1.1626, test_f1: 0.3338
 epoch: 13, train_loss: 1.0732, test_loss: 1.1558, test_f1: 0.3909
 epoch: 14, train_loss: 1.0734, test_loss: 1.1572, test_f1: 0.4080
 epoch: 15, train_loss: 1.0669, test_loss: 1.1398, test_f1: 0.4070
 epoch: 16, train_loss: 1.0710, test_loss: 1.1377, test_f1: 0.4065
 epoch: 17, train_loss: 1.0570, test_loss: 1.1402, test_f1: 0.4292
 epoch: 18, train_loss: 1.0574, test_loss: 1.1297, test_f1: 0.4453
 epoch: 19, train_loss: 1.0454, test_loss: 1.1341, test_f1: 0.4509
 epoch: 20, train_loss: 1.0449, test_loss: 1.1342, test_f1: 0.4109
 epoch: 21, train_loss: 1.0473, test_loss: 1.1212, test_f1: 0.4186
 epoch: 22, train_loss: 1.0282, test_loss: 1.1328, test_f1: 0.4135
 epoch: 23, train_loss: 1.0237, test_loss: 1.1350, test_f1: 0.4155
 epoch: 24, train_loss: 1.0249, test_loss: 1.1255, test_f1: 0.4235
 epoch: 25, train_loss: 1.0212, test_loss: 1.1244, test_f1: 0.4194
 epoch: 26, train_loss: 1.0041, test_loss: 1.1299, test_f1: 0.4323
 epoch: 27, train_loss: 1.0103, test_loss: 1.1244, test_f1: 0.4351
 epoch: 28, train_loss: 1.0056, test_loss: 1.1498, test_f1: 0.4359
 epoch: 29, train_loss: 1.0036, test_loss: 1.1205, test_f1: 0.4397
 epoch: 30, train_loss: 1.0065, test_loss: 1.1111, test_f1: 0.4514
 epoch: 31, train_loss: 0.9914, test_loss: 1.1295, test_f1: 0.4542
 epoch: 32, train_loss: 0.9892, test_loss: 1.1042, test_f1: 0.4471
 epoch: 33, train_loss: 0.9901, test_loss: 1.0979, test_f1: 0.4121
 epoch: 34, train_loss: 0.9908, test_loss: 1.1234, test_f1: 0.4342
 epoch: 35, train_loss: 0.9840, test_loss: 1.1191, test_f1: 0.4061
 epoch: 36, train_loss: 0.9835, test_loss: 1.1437, test_f1: 0.4098
 epoch: 37, train_loss: 0.9828, test_loss: 1.1650, test_f1: 0.4220
 epoch: 38, train_loss: 0.9780, test_loss: 1.1070, test_f1: 0.4173
 epoch: 39, train_loss: 0.9802, test_loss: 1.1577, test_f1: 0.4359
 epoch: 40, train_loss: 0.9632, test_loss: 1.1336, test_f1: 0.4384
 epoch: 41, train_loss: 0.9743, test_loss: 1.1051, test_f1: 0.4240
 epoch: 42, train_loss: 0.9731, test_loss: 1.1441, test_f1: 0.4248
 epoch: 43, train_loss: 0.9703, test_loss: 1.1151, test_f1: 0.4162
 epoch: 44, train_loss: 0.9590, test_loss: 1.1216, test_f1: 0.4115
 epoch: 45, train_loss: 0.9501, test_loss: 1.1331, test_f1: 0.4291
 epoch: 46, train_loss: 0.9564, test_loss: 1.0994, test_f1: 0.4189
 epoch: 47, train_loss: 0.9487, test_loss: 1.1190, test_f1: 0.4187
 epoch: 48, train_loss: 0.9450, test_loss: 1.1136, test_f1: 0.4196
 epoch: 49, train_loss: 0.9569, test_loss: 1.1508, test_f1: 0.4251
 epoch: 50, train_loss: 0.9537, test_loss: 1.1612, test_f1: 0.4372
 epoch: 51, train_loss: 0.9545, test_loss: 1.1446, test_f1: 0.4619
 epoch: 52, train_loss: 0.9514, test_loss: 1.1606, test_f1: 0.4602
 epoch: 53, train_loss: 0.9438, test_loss: 1.1102, test_f1: 0.4518
 epoch: 54, train_loss: 0.9424, test_loss: 1.0897, test_f1: 0.4558
 epoch: 55, train_loss: 0.9369, test_loss: 1.1107, test_f1: 0.4574
 epoch: 56, train_loss: 0.9394, test_loss: 1.1145, test_f1: 0.4585
 epoch: 57, train_loss: 0.9416, test_loss: 1.1171, test_f1: 0.4649
 epoch: 58, train_loss: 0.9435, test_loss: 1.1256, test_f1: 0.4568
 epoch: 59, train_loss: 0.9371, test_loss: 1.1181, test_f1: 0.4508
 epoch: 60, train_loss: 0.9333, test_loss: 1.1134, test_f1: 0.4226
 epoch: 61, train_loss: 0.9275, test_loss: 1.1169, test_f1: 0.4473
 epoch: 62, train_loss: 0.9295, test_loss: 1.1328, test_f1: 0.4661
 epoch: 63, train_loss: 0.9423, test_loss: 1.1478, test_f1: 0.4615
 epoch: 64, train_loss: 0.9263, test_loss: 1.1115, test_f1: 0.4456
 epoch: 65, train_loss: 0.9372, test_loss: 1.1284, test_f1: 0.4370
 epoch: 66, train_loss: 0.9303, test_loss: 1.1369, test_f1: 0.4447
 epoch: 67, train_loss: 0.9243, test_loss: 1.1441, test_f1: 0.4511
 epoch: 68, train_loss: 0.9438, test_loss: 1.0848, test_f1: 0.4221
 epoch: 69, train_loss: 0.9467, test_loss: 1.0754, test_f1: 0.4230
 epoch: 70, train_loss: 0.9480, test_loss: 1.1046, test_f1: 0.4674
 epoch: 71, train_loss: 0.9422, test_loss: 1.1248, test_f1: 0.4906
 epoch: 72, train_loss: 0.9358, test_loss: 1.1264, test_f1: 0.4511
 epoch: 73, train_loss: 0.9342, test_loss: 1.1584, test_f1: 0.4549
 epoch: 74, train_loss: 0.9316, test_loss: 1.1840, test_f1: 0.4876
 epoch: 75, train_loss: 0.9246, test_loss: 1.1477, test_f1: 0.4771
 epoch: 76, train_loss: 0.9236, test_loss: 1.1774, test_f1: 0.4549
 epoch: 77, train_loss: 0.9334, test_loss: 1.1294, test_f1: 0.4447
 epoch: 78, train_loss: 0.9292, test_loss: 1.1188, test_f1: 0.4461
 epoch: 79, train_loss: 0.9296, test_loss: 1.1580, test_f1: 0.4609
 epoch: 80, train_loss: 0.9327, test_loss: 1.1357, test_f1: 0.4556
 epoch: 81, train_loss: 0.9119, test_loss: 1.1357, test_f1: 0.4611
 epoch: 82, train_loss: 0.9191, test_loss: 1.1204, test_f1: 0.4543
 epoch: 83, train_loss: 0.9225, test_loss: 1.1842, test_f1: 0.4713
 epoch: 84, train_loss: 0.9170, test_loss: 1.1457, test_f1: 0.4640
 epoch: 85, train_loss: 0.9142, test_loss: 1.1710, test_f1: 0.4749
 epoch: 86, train_loss: 0.9145, test_loss: 1.2105, test_f1: 0.4840
 epoch: 87, train_loss: 0.9127, test_loss: 1.1827, test_f1: 0.4583
 epoch: 88, train_loss: 0.9188, test_loss: 1.1515, test_f1: 0.4542
 epoch: 89, train_loss: 0.9173, test_loss: 1.1604, test_f1: 0.4836
 epoch: 90, train_loss: 0.9116, test_loss: 1.1707, test_f1: 0.4885
 epoch: 91, train_loss: 0.9125, test_loss: 1.1065, test_f1: 0.4620
 epoch: 92, train_loss: 0.9050, test_loss: 1.1462, test_f1: 0.4903
 epoch: 93, train_loss: 0.9043, test_loss: 1.1376, test_f1: 0.4817
 epoch: 94, train_loss: 0.8965, test_loss: 1.1405, test_f1: 0.4756
 epoch: 95, train_loss: 0.9019, test_loss: 1.1559, test_f1: 0.4759
 epoch: 96, train_loss: 0.8879, test_loss: 1.1535, test_f1: 0.4690
 epoch: 97, train_loss: 0.9063, test_loss: 1.1700, test_f1: 0.5001
 epoch: 98, train_loss: 0.9027, test_loss: 1.1729, test_f1: 0.5025
 epoch: 99, train_loss: 0.9070, test_loss: 1.1123, test_f1: 0.4966
##################ITERATION #3 ****************************************
 epoch: 0, train_loss: 1.3002, test_loss: 1.3215, test_f1: 0.2281
 epoch: 1, train_loss: 1.2272, test_loss: 1.3078, test_f1: 0.2281
 epoch: 2, train_loss: 1.2108, test_loss: 1.2994, test_f1: 0.2281
 epoch: 3, train_loss: 1.1819, test_loss: 1.2922, test_f1: 0.2281
 epoch: 4, train_loss: 1.1693, test_loss: 1.2818, test_f1: 0.2281
 epoch: 5, train_loss: 1.1498, test_loss: 1.2673, test_f1: 0.2281
 epoch: 6, train_loss: 1.1339, test_loss: 1.2515, test_f1: 0.2281
 epoch: 7, train_loss: 1.1290, test_loss: 1.2367, test_f1: 0.2410
 epoch: 8, train_loss: 1.1214, test_loss: 1.2128, test_f1: 0.2816
 epoch: 9, train_loss: 1.1107, test_loss: 1.1937, test_f1: 0.3331
 epoch: 10, train_loss: 1.1030, test_loss: 1.1817, test_f1: 0.3516
 epoch: 11, train_loss: 1.1027, test_loss: 1.1672, test_f1: 0.3741
 epoch: 12, train_loss: 1.1008, test_loss: 1.1568, test_f1: 0.3537
 epoch: 13, train_loss: 1.0829, test_loss: 1.1477, test_f1: 0.3560
 epoch: 14, train_loss: 1.0777, test_loss: 1.1460, test_f1: 0.3860
 epoch: 15, train_loss: 1.0684, test_loss: 1.1504, test_f1: 0.3986
 epoch: 16, train_loss: 1.0526, test_loss: 1.1479, test_f1: 0.4421
 epoch: 17, train_loss: 1.0441, test_loss: 1.1617, test_f1: 0.4200
 epoch: 18, train_loss: 1.0409, test_loss: 1.1337, test_f1: 0.4488
 epoch: 19, train_loss: 1.0233, test_loss: 1.1322, test_f1: 0.4512
 epoch: 20, train_loss: 1.0279, test_loss: 1.1366, test_f1: 0.4250
 epoch: 21, train_loss: 1.0119, test_loss: 1.1379, test_f1: 0.4396
 epoch: 22, train_loss: 1.0106, test_loss: 1.1447, test_f1: 0.4254
 epoch: 23, train_loss: 1.0107, test_loss: 1.1143, test_f1: 0.3917
 epoch: 24, train_loss: 1.0067, test_loss: 1.1274, test_f1: 0.4437
 epoch: 25, train_loss: 0.9969, test_loss: 1.1388, test_f1: 0.4331
 epoch: 26, train_loss: 0.9947, test_loss: 1.1216, test_f1: 0.4428
 epoch: 27, train_loss: 0.9922, test_loss: 1.1468, test_f1: 0.4373
 epoch: 28, train_loss: 0.9760, test_loss: 1.1460, test_f1: 0.4275
 epoch: 29, train_loss: 0.9843, test_loss: 1.1297, test_f1: 0.4519
 epoch: 30, train_loss: 0.9903, test_loss: 1.1018, test_f1: 0.4499
 epoch: 31, train_loss: 0.9792, test_loss: 1.1100, test_f1: 0.4561
 epoch: 32, train_loss: 0.9883, test_loss: 1.2118, test_f1: 0.4164
 epoch: 33, train_loss: 0.9880, test_loss: 1.2057, test_f1: 0.4195
 epoch: 34, train_loss: 0.9805, test_loss: 1.1628, test_f1: 0.4270
 epoch: 35, train_loss: 0.9756, test_loss: 1.1321, test_f1: 0.4375
 epoch: 36, train_loss: 0.9746, test_loss: 1.1136, test_f1: 0.4423
 epoch: 37, train_loss: 0.9782, test_loss: 1.1304, test_f1: 0.4433
 epoch: 38, train_loss: 0.9599, test_loss: 1.0930, test_f1: 0.4478
 epoch: 39, train_loss: 0.9669, test_loss: 1.0800, test_f1: 0.4687
 epoch: 40, train_loss: 0.9602, test_loss: 1.0820, test_f1: 0.4743
 epoch: 41, train_loss: 0.9657, test_loss: 1.0924, test_f1: 0.4518
 epoch: 42, train_loss: 0.9551, test_loss: 1.0914, test_f1: 0.4614
 epoch: 43, train_loss: 0.9476, test_loss: 1.0735, test_f1: 0.4761
 epoch: 44, train_loss: 0.9377, test_loss: 1.0684, test_f1: 0.4774
 epoch: 45, train_loss: 0.9350, test_loss: 1.0543, test_f1: 0.4484
 epoch: 46, train_loss: 0.9381, test_loss: 1.0631, test_f1: 0.4615
 epoch: 47, train_loss: 0.9362, test_loss: 1.0704, test_f1: 0.4680
 epoch: 48, train_loss: 0.9326, test_loss: 1.0853, test_f1: 0.4739
 epoch: 49, train_loss: 0.9390, test_loss: 1.0995, test_f1: 0.4683
 epoch: 50, train_loss: 0.9247, test_loss: 1.1160, test_f1: 0.4629
 epoch: 51, train_loss: 0.9238, test_loss: 1.0824, test_f1: 0.4696
 epoch: 52, train_loss: 0.9240, test_loss: 1.0719, test_f1: 0.4660
 epoch: 53, train_loss: 0.9288, test_loss: 1.0699, test_f1: 0.4702
 epoch: 54, train_loss: 0.9200, test_loss: 1.0746, test_f1: 0.4682
 epoch: 55, train_loss: 0.9278, test_loss: 1.0817, test_f1: 0.4546
 epoch: 56, train_loss: 0.9139, test_loss: 1.0833, test_f1: 0.4564
 epoch: 57, train_loss: 0.9127, test_loss: 1.0869, test_f1: 0.4460
 epoch: 58, train_loss: 0.9139, test_loss: 1.0816, test_f1: 0.4540
 epoch: 59, train_loss: 0.9138, test_loss: 1.0866, test_f1: 0.4523
 epoch: 60, train_loss: 0.9184, test_loss: 1.1034, test_f1: 0.4681
 epoch: 61, train_loss: 0.9112, test_loss: 1.1069, test_f1: 0.4525
 epoch: 62, train_loss: 0.9132, test_loss: 1.0914, test_f1: 0.4502
 epoch: 63, train_loss: 0.9146, test_loss: 1.0776, test_f1: 0.4654
 epoch: 64, train_loss: 0.9199, test_loss: 1.0751, test_f1: 0.4517
 epoch: 65, train_loss: 0.9048, test_loss: 1.0911, test_f1: 0.4354
 epoch: 66, train_loss: 0.8997, test_loss: 1.0785, test_f1: 0.4604
 epoch: 67, train_loss: 0.9096, test_loss: 1.0754, test_f1: 0.4566
 epoch: 68, train_loss: 0.9026, test_loss: 1.0973, test_f1: 0.4301
 epoch: 69, train_loss: 0.9041, test_loss: 1.0752, test_f1: 0.4391
 epoch: 70, train_loss: 0.9064, test_loss: 1.0665, test_f1: 0.4290
 epoch: 71, train_loss: 0.9229, test_loss: 1.0811, test_f1: 0.4516
 epoch: 72, train_loss: 0.9075, test_loss: 1.1063, test_f1: 0.4732
 epoch: 73, train_loss: 0.9088, test_loss: 1.1023, test_f1: 0.4609
 epoch: 74, train_loss: 0.9085, test_loss: 1.0745, test_f1: 0.4428
 epoch: 75, train_loss: 0.9161, test_loss: 1.0715, test_f1: 0.4486
 epoch: 76, train_loss: 0.9027, test_loss: 1.0628, test_f1: 0.4615
 epoch: 77, train_loss: 0.9073, test_loss: 1.0447, test_f1: 0.4535
 epoch: 78, train_loss: 0.9016, test_loss: 1.0536, test_f1: 0.4609
 epoch: 79, train_loss: 0.9024, test_loss: 1.0896, test_f1: 0.4721
 epoch: 80, train_loss: 0.8964, test_loss: 1.1010, test_f1: 0.4590
 epoch: 81, train_loss: 0.8964, test_loss: 1.1020, test_f1: 0.4722
 epoch: 82, train_loss: 0.8906, test_loss: 1.1078, test_f1: 0.4719
 epoch: 83, train_loss: 0.8889, test_loss: 1.0817, test_f1: 0.5104
 epoch: 84, train_loss: 0.8873, test_loss: 1.0949, test_f1: 0.5139
 epoch: 85, train_loss: 0.8917, test_loss: 1.0590, test_f1: 0.5193
 epoch: 86, train_loss: 0.8858, test_loss: 1.0585, test_f1: 0.5146
 epoch: 87, train_loss: 0.8955, test_loss: 1.0579, test_f1: 0.5114
 epoch: 88, train_loss: 0.8791, test_loss: 1.0738, test_f1: 0.5163
 epoch: 89, train_loss: 0.8929, test_loss: 1.0618, test_f1: 0.5136
 epoch: 90, train_loss: 0.8837, test_loss: 1.0582, test_f1: 0.5121
 epoch: 91, train_loss: 0.8793, test_loss: 1.0600, test_f1: 0.5198
 epoch: 92, train_loss: 0.8803, test_loss: 1.0664, test_f1: 0.5368
 epoch: 93, train_loss: 0.8894, test_loss: 1.0787, test_f1: 0.5387
 epoch: 94, train_loss: 0.8728, test_loss: 1.0659, test_f1: 0.5351
 epoch: 95, train_loss: 0.8701, test_loss: 1.0542, test_f1: 0.5351
 epoch: 96, train_loss: 0.8730, test_loss: 1.0628, test_f1: 0.5424
 epoch: 97, train_loss: 0.8827, test_loss: 1.0777, test_f1: 0.5541
 epoch: 98, train_loss: 0.8619, test_loss: 1.0670, test_f1: 0.5387
 epoch: 99, train_loss: 0.8744, test_loss: 1.0571, test_f1: 0.5411
##################ITERATION #4 ****************************************
 epoch: 0, train_loss: 1.2666, test_loss: 1.3149, test_f1: 0.2281
 epoch: 1, train_loss: 1.1957, test_loss: 1.3034, test_f1: 0.2281
 epoch: 2, train_loss: 1.1796, test_loss: 1.2999, test_f1: 0.2281
 epoch: 3, train_loss: 1.1609, test_loss: 1.3065, test_f1: 0.2281
 epoch: 4, train_loss: 1.1478, test_loss: 1.3211, test_f1: 0.2281
 epoch: 5, train_loss: 1.1384, test_loss: 1.3034, test_f1: 0.2281
 epoch: 6, train_loss: 1.1361, test_loss: 1.2710, test_f1: 0.2281
 epoch: 7, train_loss: 1.1276, test_loss: 1.2410, test_f1: 0.2336
 epoch: 8, train_loss: 1.1162, test_loss: 1.2196, test_f1: 0.2842
 epoch: 9, train_loss: 1.1104, test_loss: 1.2029, test_f1: 0.3686
 epoch: 10, train_loss: 1.1005, test_loss: 1.1836, test_f1: 0.3921
 epoch: 11, train_loss: 1.0989, test_loss: 1.1754, test_f1: 0.3923
 epoch: 12, train_loss: 1.0845, test_loss: 1.1733, test_f1: 0.4350
 epoch: 13, train_loss: 1.0735, test_loss: 1.1772, test_f1: 0.4339
 epoch: 14, train_loss: 1.0864, test_loss: 1.1861, test_f1: 0.4294
 epoch: 15, train_loss: 1.0597, test_loss: 1.1655, test_f1: 0.4357
 epoch: 16, train_loss: 1.0559, test_loss: 1.1567, test_f1: 0.4342
 epoch: 17, train_loss: 1.0545, test_loss: 1.1673, test_f1: 0.4296
 epoch: 18, train_loss: 1.0539, test_loss: 1.1489, test_f1: 0.4325
 epoch: 19, train_loss: 1.0435, test_loss: 1.1289, test_f1: 0.4405
 epoch: 20, train_loss: 1.0434, test_loss: 1.1412, test_f1: 0.4306
 epoch: 21, train_loss: 1.0326, test_loss: 1.1435, test_f1: 0.4280
 epoch: 22, train_loss: 1.0322, test_loss: 1.1431, test_f1: 0.4282
 epoch: 23, train_loss: 1.0264, test_loss: 1.1439, test_f1: 0.4392
 epoch: 24, train_loss: 1.0294, test_loss: 1.1473, test_f1: 0.4258
 epoch: 25, train_loss: 1.0280, test_loss: 1.1293, test_f1: 0.4226
 epoch: 26, train_loss: 1.0226, test_loss: 1.1251, test_f1: 0.4307
 epoch: 27, train_loss: 1.0140, test_loss: 1.1244, test_f1: 0.4307
 epoch: 28, train_loss: 1.0076, test_loss: 1.1182, test_f1: 0.4312
 epoch: 29, train_loss: 1.0162, test_loss: 1.1206, test_f1: 0.4322
 epoch: 30, train_loss: 1.0093, test_loss: 1.1194, test_f1: 0.4337
 epoch: 31, train_loss: 1.0001, test_loss: 1.1267, test_f1: 0.4284
 epoch: 32, train_loss: 1.0050, test_loss: 1.1367, test_f1: 0.4146
 epoch: 33, train_loss: 1.0129, test_loss: 1.1208, test_f1: 0.4200
 epoch: 34, train_loss: 1.0056, test_loss: 1.1276, test_f1: 0.4308
 epoch: 35, train_loss: 1.0051, test_loss: 1.1290, test_f1: 0.4362
 epoch: 36, train_loss: 0.9841, test_loss: 1.1287, test_f1: 0.4380
 epoch: 37, train_loss: 0.9968, test_loss: 1.1125, test_f1: 0.4412
 epoch: 38, train_loss: 0.9900, test_loss: 1.1173, test_f1: 0.4263
 epoch: 39, train_loss: 0.9889, test_loss: 1.1537, test_f1: 0.4392
 epoch: 40, train_loss: 0.9891, test_loss: 1.1329, test_f1: 0.4329
 epoch: 41, train_loss: 0.9956, test_loss: 1.1359, test_f1: 0.4300
 epoch: 42, train_loss: 0.9916, test_loss: 1.1358, test_f1: 0.4277
 epoch: 43, train_loss: 0.9882, test_loss: 1.1238, test_f1: 0.4235
 epoch: 44, train_loss: 0.9723, test_loss: 1.1152, test_f1: 0.4288
 epoch: 45, train_loss: 0.9875, test_loss: 1.1052, test_f1: 0.4243
 epoch: 46, train_loss: 0.9755, test_loss: 1.1126, test_f1: 0.4260
 epoch: 47, train_loss: 0.9846, test_loss: 1.1220, test_f1: 0.4320
 epoch: 48, train_loss: 0.9789, test_loss: 1.1058, test_f1: 0.4299
 epoch: 49, train_loss: 0.9752, test_loss: 1.1200, test_f1: 0.4174
 epoch: 50, train_loss: 0.9684, test_loss: 1.1803, test_f1: 0.3948
 epoch: 51, train_loss: 0.9679, test_loss: 1.1310, test_f1: 0.4089
 epoch: 52, train_loss: 0.9705, test_loss: 1.1054, test_f1: 0.4244
 epoch: 53, train_loss: 0.9747, test_loss: 1.0901, test_f1: 0.4373
 epoch: 54, train_loss: 0.9683, test_loss: 1.1043, test_f1: 0.4606
 epoch: 55, train_loss: 0.9695, test_loss: 1.1396, test_f1: 0.4496
 epoch: 56, train_loss: 0.9662, test_loss: 1.1784, test_f1: 0.4432
 epoch: 57, train_loss: 0.9698, test_loss: 1.1361, test_f1: 0.4296
 epoch: 58, train_loss: 0.9609, test_loss: 1.1136, test_f1: 0.4295
 epoch: 59, train_loss: 0.9645, test_loss: 1.1169, test_f1: 0.4362
 epoch: 60, train_loss: 0.9634, test_loss: 1.1209, test_f1: 0.4237
 epoch: 61, train_loss: 0.9554, test_loss: 1.1249, test_f1: 0.4259
 epoch: 62, train_loss: 0.9637, test_loss: 1.1131, test_f1: 0.4265
 epoch: 63, train_loss: 0.9645, test_loss: 1.0964, test_f1: 0.4417
 epoch: 64, train_loss: 0.9539, test_loss: 1.1121, test_f1: 0.4434
 epoch: 65, train_loss: 0.9510, test_loss: 1.1052, test_f1: 0.4380
 epoch: 66, train_loss: 0.9589, test_loss: 1.1143, test_f1: 0.4459
 epoch: 67, train_loss: 0.9529, test_loss: 1.1173, test_f1: 0.4318
 epoch: 68, train_loss: 0.9520, test_loss: 1.1260, test_f1: 0.4353
 epoch: 69, train_loss: 0.9526, test_loss: 1.1000, test_f1: 0.4362
 epoch: 70, train_loss: 0.9525, test_loss: 1.0967, test_f1: 0.4362
 epoch: 71, train_loss: 0.9480, test_loss: 1.1357, test_f1: 0.4258
 epoch: 72, train_loss: 0.9467, test_loss: 1.1159, test_f1: 0.4310
 epoch: 73, train_loss: 0.9427, test_loss: 1.1033, test_f1: 0.4216
 epoch: 74, train_loss: 0.9644, test_loss: 1.1346, test_f1: 0.4178
 epoch: 75, train_loss: 0.9474, test_loss: 1.1195, test_f1: 0.4330
 epoch: 76, train_loss: 0.9633, test_loss: 1.1232, test_f1: 0.4369
 epoch: 77, train_loss: 0.9405, test_loss: 1.1151, test_f1: 0.4404
 epoch: 78, train_loss: 0.9377, test_loss: 1.1157, test_f1: 0.4395
 epoch: 79, train_loss: 0.9401, test_loss: 1.1084, test_f1: 0.4514
 epoch: 80, train_loss: 0.9372, test_loss: 1.1290, test_f1: 0.4437
 epoch: 81, train_loss: 0.9508, test_loss: 1.1136, test_f1: 0.4313
 epoch: 82, train_loss: 0.9453, test_loss: 1.1076, test_f1: 0.4434
 epoch: 83, train_loss: 0.9388, test_loss: 1.1393, test_f1: 0.4207
 epoch: 84, train_loss: 0.9425, test_loss: 1.1611, test_f1: 0.4125
 epoch: 85, train_loss: 0.9295, test_loss: 1.1034, test_f1: 0.4335
 epoch: 86, train_loss: 0.9470, test_loss: 1.0798, test_f1: 0.4391
 epoch: 87, train_loss: 0.9375, test_loss: 1.0857, test_f1: 0.4424
 epoch: 88, train_loss: 0.9381, test_loss: 1.0667, test_f1: 0.4252
 epoch: 89, train_loss: 0.9397, test_loss: 1.1070, test_f1: 0.4437
 epoch: 90, train_loss: 0.9415, test_loss: 1.1388, test_f1: 0.4405
 epoch: 91, train_loss: 0.9434, test_loss: 1.1152, test_f1: 0.4303
 epoch: 92, train_loss: 0.9415, test_loss: 1.0937, test_f1: 0.4246
 epoch: 93, train_loss: 0.9418, test_loss: 1.1010, test_f1: 0.4303
 epoch: 94, train_loss: 0.9346, test_loss: 1.0931, test_f1: 0.4361
 epoch: 95, train_loss: 0.9382, test_loss: 1.0934, test_f1: 0.4331
 epoch: 96, train_loss: 0.9458, test_loss: 1.1082, test_f1: 0.4299
 epoch: 97, train_loss: 0.9250, test_loss: 1.0877, test_f1: 0.4370
 epoch: 98, train_loss: 0.9265, test_loss: 1.0837, test_f1: 0.4358
 epoch: 99, train_loss: 0.9342, test_loss: 1.1068, test_f1: 0.4343
##################ITERATION #5 ****************************************
 epoch: 0, train_loss: 1.2813, test_loss: 1.3126, test_f1: 0.2281
 epoch: 1, train_loss: 1.1971, test_loss: 1.3115, test_f1: 0.2281
 epoch: 2, train_loss: 1.1704, test_loss: 1.2961, test_f1: 0.2281
 epoch: 3, train_loss: 1.1406, test_loss: 1.2876, test_f1: 0.2281
 epoch: 4, train_loss: 1.1366, test_loss: 1.2707, test_f1: 0.2281
 epoch: 5, train_loss: 1.1196, test_loss: 1.2445, test_f1: 0.3057
 epoch: 6, train_loss: 1.1090, test_loss: 1.2136, test_f1: 0.3078
 epoch: 7, train_loss: 1.1001, test_loss: 1.1849, test_f1: 0.3190
 epoch: 8, train_loss: 1.0928, test_loss: 1.1786, test_f1: 0.3577
 epoch: 9, train_loss: 1.0863, test_loss: 1.1693, test_f1: 0.3662
 epoch: 10, train_loss: 1.0704, test_loss: 1.1562, test_f1: 0.3704
 epoch: 11, train_loss: 1.0626, test_loss: 1.1520, test_f1: 0.3731
 epoch: 12, train_loss: 1.0515, test_loss: 1.1369, test_f1: 0.3809
 epoch: 13, train_loss: 1.0623, test_loss: 1.1303, test_f1: 0.3869
 epoch: 14, train_loss: 1.0489, test_loss: 1.1441, test_f1: 0.3993
 epoch: 15, train_loss: 1.0488, test_loss: 1.1697, test_f1: 0.3945
 epoch: 16, train_loss: 1.0457, test_loss: 1.1352, test_f1: 0.3971
 epoch: 17, train_loss: 1.0429, test_loss: 1.1108, test_f1: 0.4339
 epoch: 18, train_loss: 1.0300, test_loss: 1.1323, test_f1: 0.4167
 epoch: 19, train_loss: 1.0253, test_loss: 1.1319, test_f1: 0.4221
 epoch: 20, train_loss: 1.0278, test_loss: 1.1137, test_f1: 0.4319
 epoch: 21, train_loss: 1.0258, test_loss: 1.0926, test_f1: 0.4166
 epoch: 22, train_loss: 1.0238, test_loss: 1.1030, test_f1: 0.4181
 epoch: 23, train_loss: 1.0142, test_loss: 1.1405, test_f1: 0.4225
 epoch: 24, train_loss: 1.0100, test_loss: 1.1343, test_f1: 0.4226
 epoch: 25, train_loss: 0.9980, test_loss: 1.1156, test_f1: 0.4178
 epoch: 26, train_loss: 1.0069, test_loss: 1.1109, test_f1: 0.4197
 epoch: 27, train_loss: 0.9990, test_loss: 1.1055, test_f1: 0.4250
 epoch: 28, train_loss: 0.9954, test_loss: 1.1043, test_f1: 0.4295
 epoch: 29, train_loss: 0.9870, test_loss: 1.1053, test_f1: 0.4390
 epoch: 30, train_loss: 0.9985, test_loss: 1.1101, test_f1: 0.4120
 epoch: 31, train_loss: 0.9988, test_loss: 1.1241, test_f1: 0.4301
 epoch: 32, train_loss: 0.9998, test_loss: 1.1066, test_f1: 0.4195
 epoch: 33, train_loss: 0.9882, test_loss: 1.1107, test_f1: 0.4315
 epoch: 34, train_loss: 0.9858, test_loss: 1.1198, test_f1: 0.4441
 epoch: 35, train_loss: 0.9889, test_loss: 1.0759, test_f1: 0.4077
 epoch: 36, train_loss: 0.9751, test_loss: 1.0955, test_f1: 0.4229
 epoch: 37, train_loss: 0.9765, test_loss: 1.1132, test_f1: 0.4187
 epoch: 38, train_loss: 0.9766, test_loss: 1.0833, test_f1: 0.4316
 epoch: 39, train_loss: 0.9743, test_loss: 1.0755, test_f1: 0.4385
 epoch: 40, train_loss: 0.9762, test_loss: 1.0987, test_f1: 0.4406
 epoch: 41, train_loss: 0.9780, test_loss: 1.1367, test_f1: 0.4303
 epoch: 42, train_loss: 0.9638, test_loss: 1.1555, test_f1: 0.4146
 epoch: 43, train_loss: 0.9572, test_loss: 1.1038, test_f1: 0.4524
 epoch: 44, train_loss: 0.9563, test_loss: 1.2318, test_f1: 0.3855
 epoch: 45, train_loss: 0.9644, test_loss: 1.2289, test_f1: 0.3774
 epoch: 46, train_loss: 0.9691, test_loss: 1.0927, test_f1: 0.4175
 epoch: 47, train_loss: 0.9626, test_loss: 1.0792, test_f1: 0.4334
 epoch: 48, train_loss: 0.9556, test_loss: 1.0704, test_f1: 0.4571
 epoch: 49, train_loss: 0.9503, test_loss: 1.0832, test_f1: 0.4552
 epoch: 50, train_loss: 0.9560, test_loss: 1.1294, test_f1: 0.4606
 epoch: 51, train_loss: 0.9390, test_loss: 1.1401, test_f1: 0.4489
 epoch: 52, train_loss: 0.9411, test_loss: 1.1379, test_f1: 0.4523
 epoch: 53, train_loss: 0.9451, test_loss: 1.1319, test_f1: 0.4573
 epoch: 54, train_loss: 0.9382, test_loss: 1.1329, test_f1: 0.4565
 epoch: 55, train_loss: 0.9332, test_loss: 1.1245, test_f1: 0.4675
 epoch: 56, train_loss: 0.9399, test_loss: 1.1074, test_f1: 0.4619
 epoch: 57, train_loss: 0.9350, test_loss: 1.0979, test_f1: 0.4446
 epoch: 58, train_loss: 0.9412, test_loss: 1.0644, test_f1: 0.4678
 epoch: 59, train_loss: 0.9351, test_loss: 1.0618, test_f1: 0.4498
 epoch: 60, train_loss: 0.9345, test_loss: 1.0465, test_f1: 0.4649
 epoch: 61, train_loss: 0.9340, test_loss: 1.0309, test_f1: 0.4644
 epoch: 62, train_loss: 0.9546, test_loss: 1.0612, test_f1: 0.4582
 epoch: 63, train_loss: 0.9355, test_loss: 1.0729, test_f1: 0.4638
 epoch: 64, train_loss: 0.9306, test_loss: 1.0809, test_f1: 0.4657
 epoch: 65, train_loss: 0.9355, test_loss: 1.0623, test_f1: 0.4438
 epoch: 66, train_loss: 0.9238, test_loss: 1.0654, test_f1: 0.4653
 epoch: 67, train_loss: 0.9224, test_loss: 1.0603, test_f1: 0.4695
 epoch: 68, train_loss: 0.9267, test_loss: 1.0498, test_f1: 0.4585
 epoch: 69, train_loss: 0.9166, test_loss: 1.0657, test_f1: 0.4499
 epoch: 70, train_loss: 0.9157, test_loss: 1.0725, test_f1: 0.4520
 epoch: 71, train_loss: 0.9207, test_loss: 1.0812, test_f1: 0.4499
 epoch: 72, train_loss: 0.9174, test_loss: 1.0468, test_f1: 0.4576
 epoch: 73, train_loss: 0.9200, test_loss: 1.0619, test_f1: 0.4513
 epoch: 74, train_loss: 0.9156, test_loss: 1.0550, test_f1: 0.4564
 epoch: 75, train_loss: 0.9141, test_loss: 1.0416, test_f1: 0.4459
 epoch: 76, train_loss: 0.9068, test_loss: 1.0555, test_f1: 0.4533
 epoch: 77, train_loss: 0.9165, test_loss: 1.0760, test_f1: 0.4427
 epoch: 78, train_loss: 0.9166, test_loss: 1.0570, test_f1: 0.4616
 epoch: 79, train_loss: 0.9072, test_loss: 1.0697, test_f1: 0.4514
 epoch: 80, train_loss: 0.8994, test_loss: 1.0734, test_f1: 0.4419
 epoch: 81, train_loss: 0.9184, test_loss: 1.0917, test_f1: 0.4355
 epoch: 82, train_loss: 0.9101, test_loss: 1.0619, test_f1: 0.4682
 epoch: 83, train_loss: 0.9165, test_loss: 1.0571, test_f1: 0.4734
 epoch: 84, train_loss: 0.9092, test_loss: 1.0420, test_f1: 0.4900
 epoch: 85, train_loss: 0.8986, test_loss: 1.0573, test_f1: 0.4795
 epoch: 86, train_loss: 0.9019, test_loss: 1.0831, test_f1: 0.4742
 epoch: 87, train_loss: 0.9098, test_loss: 1.0458, test_f1: 0.5181
 epoch: 88, train_loss: 0.8993, test_loss: 1.0619, test_f1: 0.4920
 epoch: 89, train_loss: 0.9076, test_loss: 1.1169, test_f1: 0.4598
 epoch: 90, train_loss: 0.8986, test_loss: 1.0394, test_f1: 0.4718
 epoch: 91, train_loss: 0.8991, test_loss: 1.0645, test_f1: 0.4770
 epoch: 92, train_loss: 0.8914, test_loss: 1.1073, test_f1: 0.4785
 epoch: 93, train_loss: 0.9062, test_loss: 1.0868, test_f1: 0.4878
 epoch: 94, train_loss: 0.9036, test_loss: 1.1024, test_f1: 0.4831
 epoch: 95, train_loss: 0.9063, test_loss: 1.1217, test_f1: 0.4891
 epoch: 96, train_loss: 0.9009, test_loss: 1.1332, test_f1: 0.4877
 epoch: 97, train_loss: 0.8867, test_loss: 1.1376, test_f1: 0.4945
 epoch: 98, train_loss: 0.8838, test_loss: 1.1069, test_f1: 0.5075
 epoch: 99, train_loss: 0.8863, test_loss: 1.0808, test_f1: 0.5018
##################ITERATION #6 ****************************************
 epoch: 0, train_loss: 1.3851, test_loss: 1.3616, test_f1: 0.2281
 epoch: 1, train_loss: 1.2070, test_loss: 1.3321, test_f1: 0.2281
 epoch: 2, train_loss: 1.1470, test_loss: 1.3091, test_f1: 0.2281
 epoch: 3, train_loss: 1.1117, test_loss: 1.3062, test_f1: 0.2281
 epoch: 4, train_loss: 1.0904, test_loss: 1.3601, test_f1: 0.2281
 epoch: 5, train_loss: 1.0679, test_loss: 1.4363, test_f1: 0.2336
 epoch: 6, train_loss: 1.0574, test_loss: 1.4102, test_f1: 0.2933
 epoch: 7, train_loss: 1.0609, test_loss: 1.3167, test_f1: 0.3566
 epoch: 8, train_loss: 1.0415, test_loss: 1.2108, test_f1: 0.3594
 epoch: 9, train_loss: 1.0340, test_loss: 1.1686, test_f1: 0.3552
 epoch: 10, train_loss: 1.0330, test_loss: 1.1429, test_f1: 0.3705
 epoch: 11, train_loss: 1.0201, test_loss: 1.1244, test_f1: 0.3764
 epoch: 12, train_loss: 1.0192, test_loss: 1.1015, test_f1: 0.3786
 epoch: 13, train_loss: 1.0119, test_loss: 1.1053, test_f1: 0.3792
 epoch: 14, train_loss: 1.0150, test_loss: 1.1088, test_f1: 0.3770
 epoch: 15, train_loss: 1.0085, test_loss: 1.0904, test_f1: 0.3782
 epoch: 16, train_loss: 0.9966, test_loss: 1.1086, test_f1: 0.3889
 epoch: 17, train_loss: 0.9939, test_loss: 1.0884, test_f1: 0.3847
 epoch: 18, train_loss: 0.9921, test_loss: 1.0753, test_f1: 0.4178
 epoch: 19, train_loss: 0.9955, test_loss: 1.1209, test_f1: 0.4383
 epoch: 20, train_loss: 0.9883, test_loss: 1.1260, test_f1: 0.4539
 epoch: 21, train_loss: 0.9903, test_loss: 1.0824, test_f1: 0.4327
 epoch: 22, train_loss: 1.0000, test_loss: 1.1075, test_f1: 0.4463
 epoch: 23, train_loss: 0.9850, test_loss: 1.1168, test_f1: 0.4411
 epoch: 24, train_loss: 0.9771, test_loss: 1.0768, test_f1: 0.3894
 epoch: 25, train_loss: 0.9856, test_loss: 1.0689, test_f1: 0.4476
 epoch: 26, train_loss: 0.9783, test_loss: 1.0696, test_f1: 0.4502
 epoch: 27, train_loss: 0.9700, test_loss: 1.0545, test_f1: 0.4498
 epoch: 28, train_loss: 0.9795, test_loss: 1.0635, test_f1: 0.4561
 epoch: 29, train_loss: 0.9684, test_loss: 1.0764, test_f1: 0.4620
 epoch: 30, train_loss: 0.9611, test_loss: 1.1090, test_f1: 0.4566
 epoch: 31, train_loss: 0.9569, test_loss: 1.0834, test_f1: 0.4585
 epoch: 32, train_loss: 0.9657, test_loss: 1.0863, test_f1: 0.4498
 epoch: 33, train_loss: 0.9577, test_loss: 1.0834, test_f1: 0.4535
 epoch: 34, train_loss: 0.9588, test_loss: 1.0537, test_f1: 0.4568
 epoch: 35, train_loss: 0.9632, test_loss: 1.0556, test_f1: 0.4484
 epoch: 36, train_loss: 0.9582, test_loss: 1.0796, test_f1: 0.4441
 epoch: 37, train_loss: 0.9545, test_loss: 1.0464, test_f1: 0.4576
 epoch: 38, train_loss: 0.9568, test_loss: 1.0441, test_f1: 0.4500
 epoch: 39, train_loss: 0.9553, test_loss: 1.0614, test_f1: 0.4501
 epoch: 40, train_loss: 0.9418, test_loss: 1.0926, test_f1: 0.4568
 epoch: 41, train_loss: 0.9478, test_loss: 1.0936, test_f1: 0.4764
 epoch: 42, train_loss: 0.9455, test_loss: 1.0660, test_f1: 0.4605
 epoch: 43, train_loss: 0.9367, test_loss: 1.0731, test_f1: 0.4702
 epoch: 44, train_loss: 0.9449, test_loss: 1.1441, test_f1: 0.4489
 epoch: 45, train_loss: 0.9490, test_loss: 1.0819, test_f1: 0.4805
 epoch: 46, train_loss: 0.9392, test_loss: 1.0262, test_f1: 0.4649
 epoch: 47, train_loss: 0.9529, test_loss: 1.0436, test_f1: 0.4748
 epoch: 48, train_loss: 0.9428, test_loss: 1.0503, test_f1: 0.4888
 epoch: 49, train_loss: 0.9352, test_loss: 1.0144, test_f1: 0.5122
 epoch: 50, train_loss: 0.9372, test_loss: 1.0156, test_f1: 0.5066
 epoch: 51, train_loss: 0.9330, test_loss: 1.0322, test_f1: 0.5156
 epoch: 52, train_loss: 0.9325, test_loss: 1.0334, test_f1: 0.5296
 epoch: 53, train_loss: 0.9275, test_loss: 1.0350, test_f1: 0.5002
 epoch: 54, train_loss: 0.9321, test_loss: 1.0401, test_f1: 0.5122
 epoch: 55, train_loss: 0.9234, test_loss: 1.0364, test_f1: 0.5078
 epoch: 56, train_loss: 0.9239, test_loss: 1.0387, test_f1: 0.5078
 epoch: 57, train_loss: 0.9194, test_loss: 1.0360, test_f1: 0.5196
 epoch: 58, train_loss: 0.9164, test_loss: 1.0398, test_f1: 0.5261
 epoch: 59, train_loss: 0.9231, test_loss: 1.0387, test_f1: 0.5340
 epoch: 60, train_loss: 0.9215, test_loss: 1.0026, test_f1: 0.5239
 epoch: 61, train_loss: 0.9268, test_loss: 1.0153, test_f1: 0.5131
 epoch: 62, train_loss: 0.9123, test_loss: 1.0417, test_f1: 0.5294
 epoch: 63, train_loss: 0.9285, test_loss: 1.0370, test_f1: 0.5221
 epoch: 64, train_loss: 0.9091, test_loss: 1.0440, test_f1: 0.5405
 epoch: 65, train_loss: 0.9159, test_loss: 1.0621, test_f1: 0.5409
 epoch: 66, train_loss: 0.9238, test_loss: 1.0694, test_f1: 0.5275
 epoch: 67, train_loss: 0.9020, test_loss: 1.0353, test_f1: 0.5236
 epoch: 68, train_loss: 0.9274, test_loss: 1.0287, test_f1: 0.5161
 epoch: 69, train_loss: 0.9130, test_loss: 1.0322, test_f1: 0.5158
 epoch: 70, train_loss: 0.9059, test_loss: 1.0400, test_f1: 0.5125
 epoch: 71, train_loss: 0.9207, test_loss: 1.0336, test_f1: 0.5075
 epoch: 72, train_loss: 0.9093, test_loss: 1.0302, test_f1: 0.5065
 epoch: 73, train_loss: 0.9098, test_loss: 1.0281, test_f1: 0.5136
 epoch: 74, train_loss: 0.9157, test_loss: 1.0240, test_f1: 0.5038
 epoch: 75, train_loss: 0.9050, test_loss: 1.0162, test_f1: 0.4890
 epoch: 76, train_loss: 0.9081, test_loss: 1.0252, test_f1: 0.5212
 epoch: 77, train_loss: 0.9065, test_loss: 1.0413, test_f1: 0.5102
 epoch: 78, train_loss: 0.9028, test_loss: 1.0515, test_f1: 0.5107
 epoch: 79, train_loss: 0.8946, test_loss: 1.0608, test_f1: 0.5223
 epoch: 80, train_loss: 0.8975, test_loss: 1.0420, test_f1: 0.5140
 epoch: 81, train_loss: 0.9029, test_loss: 1.0465, test_f1: 0.5206
 epoch: 82, train_loss: 0.9125, test_loss: 1.0865, test_f1: 0.5104
 epoch: 83, train_loss: 0.9093, test_loss: 1.0649, test_f1: 0.5154
 epoch: 84, train_loss: 0.9099, test_loss: 1.0307, test_f1: 0.5357
 epoch: 85, train_loss: 0.9033, test_loss: 1.0290, test_f1: 0.5265
 epoch: 86, train_loss: 0.9034, test_loss: 1.0468, test_f1: 0.4995
 epoch: 87, train_loss: 0.8977, test_loss: 1.0319, test_f1: 0.5202
 epoch: 88, train_loss: 0.8993, test_loss: 1.0446, test_f1: 0.5211
 epoch: 89, train_loss: 0.9046, test_loss: 1.0536, test_f1: 0.5367
 epoch: 90, train_loss: 0.8972, test_loss: 1.0576, test_f1: 0.5261
 epoch: 91, train_loss: 0.8949, test_loss: 1.0613, test_f1: 0.5046
 epoch: 92, train_loss: 0.9055, test_loss: 1.0544, test_f1: 0.5022
 epoch: 93, train_loss: 0.9001, test_loss: 1.0389, test_f1: 0.5311
 epoch: 94, train_loss: 0.8911, test_loss: 1.0339, test_f1: 0.5337
 epoch: 95, train_loss: 0.8996, test_loss: 1.0427, test_f1: 0.5158
 epoch: 96, train_loss: 0.8944, test_loss: 1.0460, test_f1: 0.5191
 epoch: 97, train_loss: 0.8968, test_loss: 1.0574, test_f1: 0.5129
 epoch: 98, train_loss: 0.8918, test_loss: 1.0579, test_f1: 0.5164
 epoch: 99, train_loss: 0.8940, test_loss: 1.0463, test_f1: 0.5443
##################ITERATION #7 ****************************************
 epoch: 0, train_loss: 1.2662, test_loss: 1.3162, test_f1: 0.2281
 epoch: 1, train_loss: 1.1813, test_loss: 1.3217, test_f1: 0.2281
 epoch: 2, train_loss: 1.1530, test_loss: 1.3428, test_f1: 0.2281
 epoch: 3, train_loss: 1.1293, test_loss: 1.3727, test_f1: 0.2281
 epoch: 4, train_loss: 1.1136, test_loss: 1.3946, test_f1: 0.2281
 epoch: 5, train_loss: 1.1052, test_loss: 1.3942, test_f1: 0.3155
 epoch: 6, train_loss: 1.0780, test_loss: 1.3709, test_f1: 0.3038
 epoch: 7, train_loss: 1.0690, test_loss: 1.3301, test_f1: 0.3246
 epoch: 8, train_loss: 1.0524, test_loss: 1.2741, test_f1: 0.3484
 epoch: 9, train_loss: 1.0488, test_loss: 1.2021, test_f1: 0.3994
 epoch: 10, train_loss: 1.0431, test_loss: 1.1470, test_f1: 0.4229
 epoch: 11, train_loss: 1.0401, test_loss: 1.1317, test_f1: 0.4288
 epoch: 12, train_loss: 1.0317, test_loss: 1.1030, test_f1: 0.4229
 epoch: 13, train_loss: 1.0131, test_loss: 1.0893, test_f1: 0.4229
 epoch: 14, train_loss: 1.0193, test_loss: 1.0937, test_f1: 0.4298
 epoch: 15, train_loss: 1.0079, test_loss: 1.0886, test_f1: 0.4408
 epoch: 16, train_loss: 1.0052, test_loss: 1.0772, test_f1: 0.4469
 epoch: 17, train_loss: 0.9979, test_loss: 1.0722, test_f1: 0.4439
 epoch: 18, train_loss: 0.9837, test_loss: 1.0730, test_f1: 0.4493
 epoch: 19, train_loss: 0.9944, test_loss: 1.0785, test_f1: 0.4368
 epoch: 20, train_loss: 0.9858, test_loss: 1.0730, test_f1: 0.4514
 epoch: 21, train_loss: 0.9732, test_loss: 1.0705, test_f1: 0.4387
 epoch: 22, train_loss: 0.9761, test_loss: 1.0634, test_f1: 0.4454
 epoch: 23, train_loss: 0.9688, test_loss: 1.0663, test_f1: 0.4410
 epoch: 24, train_loss: 0.9674, test_loss: 1.0644, test_f1: 0.4439
 epoch: 25, train_loss: 0.9672, test_loss: 1.0655, test_f1: 0.4661
 epoch: 26, train_loss: 0.9656, test_loss: 1.0691, test_f1: 0.4542
 epoch: 27, train_loss: 0.9577, test_loss: 1.0765, test_f1: 0.4460
 epoch: 28, train_loss: 0.9576, test_loss: 1.0729, test_f1: 0.4486
 epoch: 29, train_loss: 0.9636, test_loss: 1.0679, test_f1: 0.4670
 epoch: 30, train_loss: 0.9544, test_loss: 1.0617, test_f1: 0.4517
 epoch: 31, train_loss: 0.9485, test_loss: 1.0787, test_f1: 0.4417
 epoch: 32, train_loss: 0.9411, test_loss: 1.0569, test_f1: 0.4270
 epoch: 33, train_loss: 0.9571, test_loss: 1.0502, test_f1: 0.4637
 epoch: 34, train_loss: 0.9375, test_loss: 1.0420, test_f1: 0.4713
 epoch: 35, train_loss: 0.9535, test_loss: 1.0467, test_f1: 0.4634
 epoch: 36, train_loss: 0.9454, test_loss: 1.0424, test_f1: 0.4601
 epoch: 37, train_loss: 0.9399, test_loss: 1.0282, test_f1: 0.4620
 epoch: 38, train_loss: 0.9345, test_loss: 1.0246, test_f1: 0.4655
 epoch: 39, train_loss: 0.9338, test_loss: 1.0242, test_f1: 0.4769
 epoch: 40, train_loss: 0.9185, test_loss: 1.0277, test_f1: 0.4501
 epoch: 41, train_loss: 0.9233, test_loss: 1.0259, test_f1: 0.4710
 epoch: 42, train_loss: 0.9175, test_loss: 1.0248, test_f1: 0.5026
 epoch: 43, train_loss: 0.9270, test_loss: 1.0238, test_f1: 0.5233
 epoch: 44, train_loss: 0.9178, test_loss: 1.0294, test_f1: 0.5102
 epoch: 45, train_loss: 0.9079, test_loss: 1.0623, test_f1: 0.5046
 epoch: 46, train_loss: 0.9158, test_loss: 1.0267, test_f1: 0.5485
 epoch: 47, train_loss: 0.9128, test_loss: 1.0255, test_f1: 0.5236
 epoch: 48, train_loss: 0.9152, test_loss: 1.0312, test_f1: 0.5088
 epoch: 49, train_loss: 0.9031, test_loss: 1.0209, test_f1: 0.5098
 epoch: 50, train_loss: 0.9038, test_loss: 1.0146, test_f1: 0.5099
 epoch: 51, train_loss: 0.8989, test_loss: 1.0142, test_f1: 0.5184
 epoch: 52, train_loss: 0.8998, test_loss: 1.0097, test_f1: 0.5266
 epoch: 53, train_loss: 0.8940, test_loss: 1.0097, test_f1: 0.5333
 epoch: 54, train_loss: 0.8919, test_loss: 1.0124, test_f1: 0.5350
 epoch: 55, train_loss: 0.8896, test_loss: 1.0145, test_f1: 0.5283
 epoch: 56, train_loss: 0.8935, test_loss: 1.0167, test_f1: 0.5438
 epoch: 57, train_loss: 0.9105, test_loss: 1.0184, test_f1: 0.5381
 epoch: 58, train_loss: 0.8875, test_loss: 1.0211, test_f1: 0.5469
 epoch: 59, train_loss: 0.8974, test_loss: 1.0227, test_f1: 0.5422
 epoch: 60, train_loss: 0.8997, test_loss: 1.0331, test_f1: 0.5308
 epoch: 61, train_loss: 0.8953, test_loss: 1.0140, test_f1: 0.5446
 epoch: 62, train_loss: 0.8959, test_loss: 1.0155, test_f1: 0.5445
 epoch: 63, train_loss: 0.8953, test_loss: 1.0184, test_f1: 0.5457
 epoch: 64, train_loss: 0.8835, test_loss: 1.0103, test_f1: 0.5466
 epoch: 65, train_loss: 0.8787, test_loss: 1.0086, test_f1: 0.5471
 epoch: 66, train_loss: 0.8809, test_loss: 1.0197, test_f1: 0.5368
 epoch: 67, train_loss: 0.8861, test_loss: 1.0106, test_f1: 0.5427
 epoch: 68, train_loss: 0.8679, test_loss: 1.0187, test_f1: 0.5502
 epoch: 69, train_loss: 0.8711, test_loss: 1.0320, test_f1: 0.5390
 epoch: 70, train_loss: 0.8741, test_loss: 1.0269, test_f1: 0.5469
 epoch: 71, train_loss: 0.8803, test_loss: 1.0104, test_f1: 0.5503
 epoch: 72, train_loss: 0.8758, test_loss: 1.0084, test_f1: 0.5557
 epoch: 73, train_loss: 0.8609, test_loss: 1.0174, test_f1: 0.5522
 epoch: 74, train_loss: 0.8672, test_loss: 1.0129, test_f1: 0.5551
 epoch: 75, train_loss: 0.8625, test_loss: 1.0054, test_f1: 0.5599
 epoch: 76, train_loss: 0.8641, test_loss: 1.0053, test_f1: 0.5624
 epoch: 77, train_loss: 0.8684, test_loss: 1.0038, test_f1: 0.5648
 epoch: 78, train_loss: 0.8648, test_loss: 1.0008, test_f1: 0.5591
 epoch: 79, train_loss: 0.8600, test_loss: 1.0085, test_f1: 0.5540
 epoch: 80, train_loss: 0.8654, test_loss: 1.0080, test_f1: 0.5580
 epoch: 81, train_loss: 0.8779, test_loss: 1.0077, test_f1: 0.5534
 epoch: 82, train_loss: 0.8688, test_loss: 1.0109, test_f1: 0.5439
 epoch: 83, train_loss: 0.8702, test_loss: 1.0032, test_f1: 0.5514
 epoch: 84, train_loss: 0.8625, test_loss: 1.0038, test_f1: 0.5538
 epoch: 85, train_loss: 0.8609, test_loss: 1.0054, test_f1: 0.5560
 epoch: 86, train_loss: 0.8580, test_loss: 0.9952, test_f1: 0.5539
 epoch: 87, train_loss: 0.8529, test_loss: 0.9922, test_f1: 0.5563
 epoch: 88, train_loss: 0.8598, test_loss: 0.9974, test_f1: 0.5572
 epoch: 89, train_loss: 0.8511, test_loss: 0.9959, test_f1: 0.5604
 epoch: 90, train_loss: 0.8482, test_loss: 1.0015, test_f1: 0.5556
 epoch: 91, train_loss: 0.8499, test_loss: 1.0054, test_f1: 0.5586
 epoch: 92, train_loss: 0.8583, test_loss: 1.0068, test_f1: 0.5560
 epoch: 93, train_loss: 0.8546, test_loss: 1.0145, test_f1: 0.5576
 epoch: 94, train_loss: 0.8476, test_loss: 1.0165, test_f1: 0.5515
 epoch: 95, train_loss: 0.8446, test_loss: 0.9996, test_f1: 0.5489
 epoch: 96, train_loss: 0.8495, test_loss: 0.9889, test_f1: 0.5574
 epoch: 97, train_loss: 0.8418, test_loss: 1.0093, test_f1: 0.5372
 epoch: 98, train_loss: 0.8576, test_loss: 0.9902, test_f1: 0.5666
 epoch: 99, train_loss: 0.8437, test_loss: 0.9874, test_f1: 0.5694
##################ITERATION #8 ****************************************
 epoch: 0, train_loss: 1.3549, test_loss: 1.3305, test_f1: 0.2281
 epoch: 1, train_loss: 1.2247, test_loss: 1.3099, test_f1: 0.2281
 epoch: 2, train_loss: 1.1805, test_loss: 1.2971, test_f1: 0.2281
 epoch: 3, train_loss: 1.1459, test_loss: 1.2834, test_f1: 0.2281
 epoch: 4, train_loss: 1.1346, test_loss: 1.2721, test_f1: 0.3370
 epoch: 5, train_loss: 1.0913, test_loss: 1.2424, test_f1: 0.3087
 epoch: 6, train_loss: 1.0792, test_loss: 1.2067, test_f1: 0.2945
 epoch: 7, train_loss: 1.0663, test_loss: 1.1629, test_f1: 0.3218
 epoch: 8, train_loss: 1.0541, test_loss: 1.1225, test_f1: 0.4370
 epoch: 9, train_loss: 1.0425, test_loss: 1.1091, test_f1: 0.4465
 epoch: 10, train_loss: 1.0310, test_loss: 1.1027, test_f1: 0.4491
 epoch: 11, train_loss: 1.0363, test_loss: 1.1098, test_f1: 0.4249
 epoch: 12, train_loss: 1.0180, test_loss: 1.1042, test_f1: 0.4371
 epoch: 13, train_loss: 1.0244, test_loss: 1.1107, test_f1: 0.4320
 epoch: 14, train_loss: 1.0073, test_loss: 1.1215, test_f1: 0.4100
 epoch: 15, train_loss: 1.0065, test_loss: 1.1254, test_f1: 0.4052
 epoch: 16, train_loss: 1.0000, test_loss: 1.1149, test_f1: 0.4309
 epoch: 17, train_loss: 0.9964, test_loss: 1.1044, test_f1: 0.3980
 epoch: 18, train_loss: 1.0055, test_loss: 1.0943, test_f1: 0.4139
 epoch: 19, train_loss: 0.9788, test_loss: 1.1054, test_f1: 0.4374
 epoch: 20, train_loss: 0.9895, test_loss: 1.1081, test_f1: 0.4299
 epoch: 21, train_loss: 0.9779, test_loss: 1.1199, test_f1: 0.4367
 epoch: 22, train_loss: 0.9736, test_loss: 1.1136, test_f1: 0.4381
 epoch: 23, train_loss: 0.9731, test_loss: 1.1037, test_f1: 0.4420
 epoch: 24, train_loss: 0.9620, test_loss: 1.1062, test_f1: 0.4431
 epoch: 25, train_loss: 0.9625, test_loss: 1.1136, test_f1: 0.4481
 epoch: 26, train_loss: 0.9611, test_loss: 1.1054, test_f1: 0.4460
 epoch: 27, train_loss: 0.9608, test_loss: 1.1126, test_f1: 0.4410
 epoch: 28, train_loss: 0.9668, test_loss: 1.1035, test_f1: 0.4340
 epoch: 29, train_loss: 0.9646, test_loss: 1.0949, test_f1: 0.4512
 epoch: 30, train_loss: 0.9470, test_loss: 1.1063, test_f1: 0.4297
 epoch: 31, train_loss: 0.9520, test_loss: 1.1221, test_f1: 0.4634
 epoch: 32, train_loss: 0.9454, test_loss: 1.1233, test_f1: 0.4602
 epoch: 33, train_loss: 0.9324, test_loss: 1.1210, test_f1: 0.4836
 epoch: 34, train_loss: 0.9356, test_loss: 1.1283, test_f1: 0.4919
 epoch: 35, train_loss: 0.9305, test_loss: 1.1143, test_f1: 0.5077
 epoch: 36, train_loss: 0.9267, test_loss: 1.1101, test_f1: 0.5025
 epoch: 37, train_loss: 0.9185, test_loss: 1.1576, test_f1: 0.5017
 epoch: 38, train_loss: 0.9246, test_loss: 1.1710, test_f1: 0.4763
 epoch: 39, train_loss: 0.9181, test_loss: 1.1394, test_f1: 0.4936
 epoch: 40, train_loss: 0.9216, test_loss: 1.0881, test_f1: 0.5027
 epoch: 41, train_loss: 0.9205, test_loss: 1.1142, test_f1: 0.4998
 epoch: 42, train_loss: 0.9177, test_loss: 1.1109, test_f1: 0.5104
 epoch: 43, train_loss: 0.9213, test_loss: 1.1157, test_f1: 0.5088
 epoch: 44, train_loss: 0.9085, test_loss: 1.1029, test_f1: 0.4947
 epoch: 45, train_loss: 0.9107, test_loss: 1.0632, test_f1: 0.5361
 epoch: 46, train_loss: 0.9203, test_loss: 1.0517, test_f1: 0.5485
 epoch: 47, train_loss: 0.9240, test_loss: 1.1176, test_f1: 0.4980
 epoch: 48, train_loss: 0.9065, test_loss: 1.1494, test_f1: 0.5110
 epoch: 49, train_loss: 0.9123, test_loss: 1.0565, test_f1: 0.5205
 epoch: 50, train_loss: 0.9033, test_loss: 1.0542, test_f1: 0.5536
 epoch: 51, train_loss: 0.9061, test_loss: 1.0500, test_f1: 0.5285
 epoch: 52, train_loss: 0.9021, test_loss: 1.0557, test_f1: 0.5342
 epoch: 53, train_loss: 0.9074, test_loss: 1.0495, test_f1: 0.5472
 epoch: 54, train_loss: 0.8876, test_loss: 1.0631, test_f1: 0.5249
 epoch: 55, train_loss: 0.8901, test_loss: 1.0748, test_f1: 0.5008
 epoch: 56, train_loss: 0.8883, test_loss: 1.0823, test_f1: 0.4993
 epoch: 57, train_loss: 0.8895, test_loss: 1.0770, test_f1: 0.5010
 epoch: 58, train_loss: 0.8777, test_loss: 1.0696, test_f1: 0.5274
 epoch: 59, train_loss: 0.8955, test_loss: 1.0578, test_f1: 0.5359
 epoch: 60, train_loss: 0.8730, test_loss: 1.0514, test_f1: 0.5091
 epoch: 61, train_loss: 0.8783, test_loss: 1.0630, test_f1: 0.4963
 epoch: 62, train_loss: 0.8715, test_loss: 1.1091, test_f1: 0.4708
 epoch: 63, train_loss: 0.8650, test_loss: 1.0984, test_f1: 0.5329
 epoch: 64, train_loss: 0.8738, test_loss: 1.0813, test_f1: 0.5447
 epoch: 65, train_loss: 0.8551, test_loss: 1.0851, test_f1: 0.5206
 epoch: 66, train_loss: 0.8629, test_loss: 1.0735, test_f1: 0.5082
 epoch: 67, train_loss: 0.8642, test_loss: 1.0745, test_f1: 0.5466
 epoch: 68, train_loss: 0.8643, test_loss: 1.0611, test_f1: 0.5558
 epoch: 69, train_loss: 0.8587, test_loss: 1.0670, test_f1: 0.5557
 epoch: 70, train_loss: 0.8548, test_loss: 1.0372, test_f1: 0.5416
 epoch: 71, train_loss: 0.8668, test_loss: 1.0116, test_f1: 0.5745
 epoch: 72, train_loss: 0.8537, test_loss: 1.0426, test_f1: 0.5532
 epoch: 73, train_loss: 0.8513, test_loss: 1.0689, test_f1: 0.5721
 epoch: 74, train_loss: 0.8480, test_loss: 1.0502, test_f1: 0.5781
 epoch: 75, train_loss: 0.8409, test_loss: 1.0516, test_f1: 0.5690
 epoch: 76, train_loss: 0.8553, test_loss: 1.0563, test_f1: 0.5818
 epoch: 77, train_loss: 0.8418, test_loss: 1.0578, test_f1: 0.5620
 epoch: 78, train_loss: 0.8447, test_loss: 1.0574, test_f1: 0.5751
 epoch: 79, train_loss: 0.8363, test_loss: 1.0568, test_f1: 0.5604
 epoch: 80, train_loss: 0.8408, test_loss: 1.0483, test_f1: 0.5636
 epoch: 81, train_loss: 0.8305, test_loss: 1.0400, test_f1: 0.5826
 epoch: 82, train_loss: 0.8331, test_loss: 1.0459, test_f1: 0.5593
 epoch: 83, train_loss: 0.8296, test_loss: 1.0340, test_f1: 0.5777
 epoch: 84, train_loss: 0.8383, test_loss: 1.0369, test_f1: 0.5828
 epoch: 85, train_loss: 0.8336, test_loss: 1.0569, test_f1: 0.5667
 epoch: 86, train_loss: 0.8340, test_loss: 1.0493, test_f1: 0.5747
 epoch: 87, train_loss: 0.8237, test_loss: 1.0192, test_f1: 0.5926
 epoch: 88, train_loss: 0.8253, test_loss: 1.0174, test_f1: 0.5873
 epoch: 89, train_loss: 0.8260, test_loss: 1.0360, test_f1: 0.5678
 epoch: 90, train_loss: 0.8243, test_loss: 1.0444, test_f1: 0.5778
 epoch: 91, train_loss: 0.8171, test_loss: 1.0367, test_f1: 0.6025
 epoch: 92, train_loss: 0.8099, test_loss: 1.0464, test_f1: 0.6034
 epoch: 93, train_loss: 0.8097, test_loss: 1.0335, test_f1: 0.5967
 epoch: 94, train_loss: 0.8173, test_loss: 1.0327, test_f1: 0.5848
 epoch: 95, train_loss: 0.8093, test_loss: 1.0095, test_f1: 0.5764
 epoch: 96, train_loss: 0.8257, test_loss: 0.9994, test_f1: 0.5825
 epoch: 97, train_loss: 0.8235, test_loss: 1.0453, test_f1: 0.5626
 epoch: 98, train_loss: 0.8139, test_loss: 1.0200, test_f1: 0.5854
 epoch: 99, train_loss: 0.8081, test_loss: 1.0265, test_f1: 0.6047
##################ITERATION #9 ****************************************
 epoch: 0, train_loss: 1.5346, test_loss: 1.3595, test_f1: 0.2281
 epoch: 1, train_loss: 1.2458, test_loss: 1.3179, test_f1: 0.2281
 epoch: 2, train_loss: 1.1970, test_loss: 1.2965, test_f1: 0.2281
 epoch: 3, train_loss: 1.1446, test_loss: 1.3364, test_f1: 0.2281
 epoch: 4, train_loss: 1.1284, test_loss: 1.3819, test_f1: 0.2281
 epoch: 5, train_loss: 1.1098, test_loss: 1.3777, test_f1: 0.2801
 epoch: 6, train_loss: 1.0887, test_loss: 1.3324, test_f1: 0.2818
 epoch: 7, train_loss: 1.0859, test_loss: 1.2655, test_f1: 0.2812
 epoch: 8, train_loss: 1.0729, test_loss: 1.2029, test_f1: 0.3443
 epoch: 9, train_loss: 1.0577, test_loss: 1.1590, test_f1: 0.3966
 epoch: 10, train_loss: 1.0537, test_loss: 1.1279, test_f1: 0.4314
 epoch: 11, train_loss: 1.0465, test_loss: 1.1069, test_f1: 0.4164
 epoch: 12, train_loss: 1.0360, test_loss: 1.0891, test_f1: 0.4111
 epoch: 13, train_loss: 1.0272, test_loss: 1.0792, test_f1: 0.4184
 epoch: 14, train_loss: 1.0294, test_loss: 1.0717, test_f1: 0.4189
 epoch: 15, train_loss: 1.0148, test_loss: 1.0714, test_f1: 0.4229
 epoch: 16, train_loss: 1.0220, test_loss: 1.0720, test_f1: 0.4277
 epoch: 17, train_loss: 1.0035, test_loss: 1.0853, test_f1: 0.4158
 epoch: 18, train_loss: 1.0085, test_loss: 1.0736, test_f1: 0.4238
 epoch: 19, train_loss: 0.9940, test_loss: 1.0698, test_f1: 0.4379
 epoch: 20, train_loss: 0.9972, test_loss: 1.0668, test_f1: 0.4483
 epoch: 21, train_loss: 0.9823, test_loss: 1.0696, test_f1: 0.4328
 epoch: 22, train_loss: 0.9912, test_loss: 1.0760, test_f1: 0.4608
 epoch: 23, train_loss: 0.9717, test_loss: 1.0812, test_f1: 0.4427
 epoch: 24, train_loss: 0.9931, test_loss: 1.0787, test_f1: 0.4311
 epoch: 25, train_loss: 0.9862, test_loss: 1.0659, test_f1: 0.4373
 epoch: 26, train_loss: 0.9757, test_loss: 1.0727, test_f1: 0.4435
 epoch: 27, train_loss: 0.9688, test_loss: 1.0721, test_f1: 0.4517
 epoch: 28, train_loss: 0.9802, test_loss: 1.0910, test_f1: 0.4262
 epoch: 29, train_loss: 0.9754, test_loss: 1.0806, test_f1: 0.4429
 epoch: 30, train_loss: 0.9684, test_loss: 1.0729, test_f1: 0.4356
 epoch: 31, train_loss: 0.9580, test_loss: 1.0777, test_f1: 0.4548
 epoch: 32, train_loss: 0.9658, test_loss: 1.0714, test_f1: 0.4559
 epoch: 33, train_loss: 0.9564, test_loss: 1.0713, test_f1: 0.4372
 epoch: 34, train_loss: 0.9580, test_loss: 1.0624, test_f1: 0.4408
 epoch: 35, train_loss: 0.9534, test_loss: 1.0554, test_f1: 0.4362
 epoch: 36, train_loss: 0.9404, test_loss: 1.0592, test_f1: 0.4629
 epoch: 37, train_loss: 0.9455, test_loss: 1.0572, test_f1: 0.4498
 epoch: 38, train_loss: 0.9425, test_loss: 1.0599, test_f1: 0.4496
 epoch: 39, train_loss: 0.9486, test_loss: 1.0827, test_f1: 0.4700
 epoch: 40, train_loss: 0.9491, test_loss: 1.0963, test_f1: 0.4675
 epoch: 41, train_loss: 0.9411, test_loss: 1.0856, test_f1: 0.4665
 epoch: 42, train_loss: 0.9399, test_loss: 1.0806, test_f1: 0.4832
 epoch: 43, train_loss: 0.9406, test_loss: 1.0650, test_f1: 0.4777
 epoch: 44, train_loss: 0.9324, test_loss: 1.0850, test_f1: 0.4696
 epoch: 45, train_loss: 0.9218, test_loss: 1.0832, test_f1: 0.4754
 epoch: 46, train_loss: 0.9339, test_loss: 1.0905, test_f1: 0.4822
 epoch: 47, train_loss: 0.9180, test_loss: 1.0671, test_f1: 0.4811
 epoch: 48, train_loss: 0.9216, test_loss: 1.0568, test_f1: 0.4869
 epoch: 49, train_loss: 0.9189, test_loss: 1.0593, test_f1: 0.5000
 epoch: 50, train_loss: 0.9186, test_loss: 1.0620, test_f1: 0.4887
 epoch: 51, train_loss: 0.9227, test_loss: 1.0743, test_f1: 0.4987
 epoch: 52, train_loss: 0.9233, test_loss: 1.0916, test_f1: 0.4967
 epoch: 53, train_loss: 0.9180, test_loss: 1.0750, test_f1: 0.5128
 epoch: 54, train_loss: 0.9127, test_loss: 1.0636, test_f1: 0.5110
 epoch: 55, train_loss: 0.9130, test_loss: 1.0490, test_f1: 0.5196
 epoch: 56, train_loss: 0.9102, test_loss: 1.0428, test_f1: 0.5230
 epoch: 57, train_loss: 0.9051, test_loss: 1.0441, test_f1: 0.4986
 epoch: 58, train_loss: 0.9012, test_loss: 1.0504, test_f1: 0.4952
 epoch: 59, train_loss: 0.9039, test_loss: 1.0610, test_f1: 0.5062
 epoch: 60, train_loss: 0.8944, test_loss: 1.0614, test_f1: 0.5126
 epoch: 61, train_loss: 0.9027, test_loss: 1.0678, test_f1: 0.4901
 epoch: 62, train_loss: 0.9017, test_loss: 1.0595, test_f1: 0.5022
 epoch: 63, train_loss: 0.8886, test_loss: 1.0506, test_f1: 0.5007
 epoch: 64, train_loss: 0.8897, test_loss: 1.0597, test_f1: 0.5095
 epoch: 65, train_loss: 0.8988, test_loss: 1.0610, test_f1: 0.5203
 epoch: 66, train_loss: 0.8994, test_loss: 1.0582, test_f1: 0.5168
 epoch: 67, train_loss: 0.8949, test_loss: 1.0483, test_f1: 0.5229
 epoch: 68, train_loss: 0.9001, test_loss: 1.0520, test_f1: 0.5258
 epoch: 69, train_loss: 0.8922, test_loss: 1.0419, test_f1: 0.5309
 epoch: 70, train_loss: 0.8916, test_loss: 1.0458, test_f1: 0.5482
 epoch: 71, train_loss: 0.8834, test_loss: 1.0623, test_f1: 0.5324
 epoch: 72, train_loss: 0.8792, test_loss: 1.0505, test_f1: 0.5184
 epoch: 73, train_loss: 0.8707, test_loss: 1.0429, test_f1: 0.5374
 epoch: 74, train_loss: 0.8842, test_loss: 1.0432, test_f1: 0.5485
 epoch: 75, train_loss: 0.8808, test_loss: 1.0477, test_f1: 0.5436
 epoch: 76, train_loss: 0.8768, test_loss: 1.0459, test_f1: 0.5575
 epoch: 77, train_loss: 0.8788, test_loss: 1.0487, test_f1: 0.5582
 epoch: 78, train_loss: 0.8823, test_loss: 1.0314, test_f1: 0.5471
 epoch: 79, train_loss: 0.8787, test_loss: 1.0469, test_f1: 0.5427
 epoch: 80, train_loss: 0.8783, test_loss: 1.0311, test_f1: 0.5472
 epoch: 81, train_loss: 0.8861, test_loss: 1.0411, test_f1: 0.5626
 epoch: 82, train_loss: 0.8749, test_loss: 1.0523, test_f1: 0.5363
 epoch: 83, train_loss: 0.8897, test_loss: 1.0367, test_f1: 0.5515
 epoch: 84, train_loss: 0.8964, test_loss: 1.0559, test_f1: 0.5359
 epoch: 85, train_loss: 0.8886, test_loss: 1.0654, test_f1: 0.5346
 epoch: 86, train_loss: 0.8921, test_loss: 1.0711, test_f1: 0.5569
 epoch: 87, train_loss: 0.8810, test_loss: 1.0818, test_f1: 0.5903
 epoch: 88, train_loss: 0.8595, test_loss: 1.0460, test_f1: 0.5776
 epoch: 89, train_loss: 0.8595, test_loss: 1.0376, test_f1: 0.5582
 epoch: 90, train_loss: 0.8796, test_loss: 1.0490, test_f1: 0.5454
 epoch: 91, train_loss: 0.8826, test_loss: 1.0537, test_f1: 0.5537
 epoch: 92, train_loss: 0.8897, test_loss: 1.0724, test_f1: 0.5354
 epoch: 93, train_loss: 0.8910, test_loss: 1.0591, test_f1: 0.5536
 epoch: 94, train_loss: 0.8767, test_loss: 1.0647, test_f1: 0.5536
 epoch: 95, train_loss: 0.8706, test_loss: 1.0580, test_f1: 0.5404
 epoch: 96, train_loss: 0.8716, test_loss: 1.0607, test_f1: 0.5459
 epoch: 97, train_loss: 0.8897, test_loss: 1.0807, test_f1: 0.5345
 epoch: 98, train_loss: 0.8667, test_loss: 1.0513, test_f1: 0.5410
 epoch: 99, train_loss: 0.8639, test_loss: 1.0467, test_f1: 0.5223

Training completed in 308.24 seconds
Best F1: 0.6047 at epoch 99
Mean F1 across iterations: 0.5295  0.0485
========================FINAL RESULTS================================
FEGIN weighted F1: 0.6047  0.0485
python main.py --data ltspice_demos --representation component_pin_net --model FEGIN --layers 4 --hiddens 16 --batch_size 256 --lr 0.001 --emb_size 128 --epochs 100 --save_appendix component_pin_net_L4_H16_BS256_LR0.001_E128 --no_val
-----



STDERR:
  File "main.py", line 370, in <module>
    main()
  File "main.py", line 254, in main
    dataset = dataset_class(
  File "/home/philip/projects/ltspice_examples_code_repo/Circuit-Completion-Using-GNNs/component_classification_with_link_prediction_head/evaluation/FEGIN/kernel/circuit_datasets.py", line 15, in __init__
    self.data, self.slices = torch.load(self.processed_paths[0])
  File "/home/philip/.local/lib/python3.8/site-packages/torch/serialization.py", line 1040, in load
    warnings.warn(
  File "/usr/lib/python3.8/warnings.py", line 109, in _showwarnmsg
    sw(msg.message, msg.category, msg.filename, msg.lineno,
  File "main.py", line 47, in warn_with_traceback
    traceback.print_stack(file=log)
/home/philip/projects/ltspice_examples_code_repo/Circuit-Completion-Using-GNNs/component_classification_with_link_prediction_head/evaluation/FEGIN/kernel/circuit_datasets.py:15: FutureWarning: You are using `torch.load` with `weights_only=False` (the current default value), which uses the default pickle module implicitly. It is possible to construct malicious pickle data which will execute arbitrary code during unpickling (See https://github.com/pytorch/pytorch/blob/main/SECURITY.md#untrusted-models for more details). In a future release, the default value for `weights_only` will be flipped to `True`. This limits the functions that could be executed during unpickling. Arbitrary objects will no longer be allowed to be loaded via this mode unless they are explicitly allowlisted by the user via `torch.serialization.add_safe_globals`. We recommend you start setting `weights_only=True` for any use case where you don't have full control of the loaded file. Please open an issue on GitHub for any issues related to this experimental feature.
  self.data, self.slices = torch.load(self.processed_paths[0])
