STDOUT:
Results will be saved in /home/philip/projects/ltspice_examples_code_repo/Circuit-Completion-Using-GNNs/component_classification_with_link_prediction_head/evaluation/FEGIN/results/model_FEGIN_dataset_ltspice_demos
Command line input: python main.py --data ltspice_demos --representation component_component --model FEGIN --layers 2 --hiddens 128 --batch_size 256 --lr 0.0001 --emb_size 128 --epochs 100 --save_appendix component_component_L2_H128_BS256_LR0.0001_E128 --no_val
 is saved.
-----
ltspice_demos - FEGIN
Using 2 layers, 128 hidden units, h = 2
Loading component_component representation dataset
ENTERED
Training FEGIN on component_component representation
Train: 1565, Test: 383
##################ITERATION #0 ****************************************
 epoch: 0, train_loss: 1.3788, test_loss: 1.3778, test_f1: 0.2281
 epoch: 1, train_loss: 1.3667, test_loss: 1.3746, test_f1: 0.2281
 epoch: 2, train_loss: 1.3594, test_loss: 1.3705, test_f1: 0.2281
 epoch: 3, train_loss: 1.3531, test_loss: 1.3655, test_f1: 0.2281
 epoch: 4, train_loss: 1.3455, test_loss: 1.3593, test_f1: 0.2281
 epoch: 5, train_loss: 1.3383, test_loss: 1.3522, test_f1: 0.2281
 epoch: 6, train_loss: 1.3299, test_loss: 1.3442, test_f1: 0.2281
 epoch: 7, train_loss: 1.3205, test_loss: 1.3352, test_f1: 0.2281
 epoch: 8, train_loss: 1.3115, test_loss: 1.3266, test_f1: 0.2281
 epoch: 9, train_loss: 1.3014, test_loss: 1.3176, test_f1: 0.2281
 epoch: 10, train_loss: 1.2894, test_loss: 1.3089, test_f1: 0.2281
 epoch: 11, train_loss: 1.2786, test_loss: 1.3017, test_f1: 0.2281
 epoch: 12, train_loss: 1.2645, test_loss: 1.2945, test_f1: 0.2281
 epoch: 13, train_loss: 1.2546, test_loss: 1.2877, test_f1: 0.2281
 epoch: 14, train_loss: 1.2411, test_loss: 1.2820, test_f1: 0.2281
 epoch: 15, train_loss: 1.2294, test_loss: 1.2761, test_f1: 0.2281
 epoch: 16, train_loss: 1.2204, test_loss: 1.2705, test_f1: 0.2281
 epoch: 17, train_loss: 1.2111, test_loss: 1.2653, test_f1: 0.2281
 epoch: 18, train_loss: 1.2036, test_loss: 1.2627, test_f1: 0.2281
 epoch: 19, train_loss: 1.1953, test_loss: 1.2576, test_f1: 0.2654
 epoch: 20, train_loss: 1.1840, test_loss: 1.2531, test_f1: 0.2587
 epoch: 21, train_loss: 1.1776, test_loss: 1.2504, test_f1: 0.2587
 epoch: 22, train_loss: 1.1688, test_loss: 1.2479, test_f1: 0.2587
 epoch: 23, train_loss: 1.1605, test_loss: 1.2417, test_f1: 0.2587
 epoch: 24, train_loss: 1.1571, test_loss: 1.2388, test_f1: 0.2587
 epoch: 25, train_loss: 1.1522, test_loss: 1.2385, test_f1: 0.2573
 epoch: 26, train_loss: 1.1464, test_loss: 1.2313, test_f1: 0.2587
 epoch: 27, train_loss: 1.1395, test_loss: 1.2290, test_f1: 0.2587
 epoch: 28, train_loss: 1.1315, test_loss: 1.2225, test_f1: 0.2801
 epoch: 29, train_loss: 1.1252, test_loss: 1.2195, test_f1: 0.2948
 epoch: 30, train_loss: 1.1209, test_loss: 1.2135, test_f1: 0.3126
 epoch: 31, train_loss: 1.1185, test_loss: 1.2085, test_f1: 0.3148
 epoch: 32, train_loss: 1.1113, test_loss: 1.2080, test_f1: 0.3344
 epoch: 33, train_loss: 1.1062, test_loss: 1.2067, test_f1: 0.3631
 epoch: 34, train_loss: 1.0952, test_loss: 1.2002, test_f1: 0.3661
 epoch: 35, train_loss: 1.0902, test_loss: 1.1963, test_f1: 0.3623
 epoch: 36, train_loss: 1.0881, test_loss: 1.1896, test_f1: 0.3599
 epoch: 37, train_loss: 1.0772, test_loss: 1.1872, test_f1: 0.3582
 epoch: 38, train_loss: 1.0725, test_loss: 1.1819, test_f1: 0.3560
 epoch: 39, train_loss: 1.0648, test_loss: 1.1826, test_f1: 0.3713
 epoch: 40, train_loss: 1.0610, test_loss: 1.1817, test_f1: 0.3630
 epoch: 41, train_loss: 1.0525, test_loss: 1.1793, test_f1: 0.4073
 epoch: 42, train_loss: 1.0489, test_loss: 1.1713, test_f1: 0.3756
 epoch: 43, train_loss: 1.0405, test_loss: 1.1677, test_f1: 0.3699
 epoch: 44, train_loss: 1.0335, test_loss: 1.1632, test_f1: 0.3930
 epoch: 45, train_loss: 1.0250, test_loss: 1.1647, test_f1: 0.3891
 epoch: 46, train_loss: 1.0157, test_loss: 1.1620, test_f1: 0.4036
 epoch: 47, train_loss: 1.0062, test_loss: 1.1595, test_f1: 0.3984
 epoch: 48, train_loss: 0.9975, test_loss: 1.1523, test_f1: 0.4079
 epoch: 49, train_loss: 0.9906, test_loss: 1.1471, test_f1: 0.4131
 epoch: 50, train_loss: 0.9814, test_loss: 1.1476, test_f1: 0.4255
 epoch: 51, train_loss: 0.9833, test_loss: 1.1523, test_f1: 0.4185
 epoch: 52, train_loss: 0.9724, test_loss: 1.1565, test_f1: 0.3991
 epoch: 53, train_loss: 0.9656, test_loss: 1.1560, test_f1: 0.4275
 epoch: 54, train_loss: 0.9623, test_loss: 1.1492, test_f1: 0.4155
 epoch: 55, train_loss: 0.9585, test_loss: 1.1499, test_f1: 0.4350
 epoch: 56, train_loss: 0.9507, test_loss: 1.1494, test_f1: 0.4399
 epoch: 57, train_loss: 0.9532, test_loss: 1.1496, test_f1: 0.4500
 epoch: 58, train_loss: 0.9541, test_loss: 1.1500, test_f1: 0.4448
 epoch: 59, train_loss: 0.9441, test_loss: 1.1542, test_f1: 0.4357
 epoch: 60, train_loss: 0.9372, test_loss: 1.1527, test_f1: 0.4337
 epoch: 61, train_loss: 0.9348, test_loss: 1.1562, test_f1: 0.4549
 epoch: 62, train_loss: 0.9333, test_loss: 1.1509, test_f1: 0.4734
 epoch: 63, train_loss: 0.9267, test_loss: 1.1511, test_f1: 0.4844
 epoch: 64, train_loss: 0.9225, test_loss: 1.1598, test_f1: 0.4736
 epoch: 65, train_loss: 0.9205, test_loss: 1.1608, test_f1: 0.4814
 epoch: 66, train_loss: 0.9200, test_loss: 1.1577, test_f1: 0.4739
 epoch: 67, train_loss: 0.9216, test_loss: 1.1609, test_f1: 0.4769
 epoch: 68, train_loss: 0.9109, test_loss: 1.1653, test_f1: 0.4813
 epoch: 69, train_loss: 0.9169, test_loss: 1.1597, test_f1: 0.4871
 epoch: 70, train_loss: 0.9035, test_loss: 1.1597, test_f1: 0.4970
 epoch: 71, train_loss: 0.9009, test_loss: 1.1561, test_f1: 0.5063
 epoch: 72, train_loss: 0.8983, test_loss: 1.1574, test_f1: 0.5007
 epoch: 73, train_loss: 0.9019, test_loss: 1.1670, test_f1: 0.5177
 epoch: 74, train_loss: 0.8969, test_loss: 1.1738, test_f1: 0.5089
 epoch: 75, train_loss: 0.8902, test_loss: 1.1703, test_f1: 0.5059
 epoch: 76, train_loss: 0.8848, test_loss: 1.1739, test_f1: 0.5021
 epoch: 77, train_loss: 0.8824, test_loss: 1.1708, test_f1: 0.5120
 epoch: 78, train_loss: 0.8772, test_loss: 1.1700, test_f1: 0.5092
 epoch: 79, train_loss: 0.8812, test_loss: 1.1678, test_f1: 0.5102
 epoch: 80, train_loss: 0.8757, test_loss: 1.1691, test_f1: 0.5117
 epoch: 81, train_loss: 0.8704, test_loss: 1.1701, test_f1: 0.5041
 epoch: 82, train_loss: 0.8629, test_loss: 1.1620, test_f1: 0.5086
 epoch: 83, train_loss: 0.8661, test_loss: 1.1748, test_f1: 0.5039
 epoch: 84, train_loss: 0.8674, test_loss: 1.1782, test_f1: 0.5090
 epoch: 85, train_loss: 0.8654, test_loss: 1.1872, test_f1: 0.5021
 epoch: 86, train_loss: 0.8604, test_loss: 1.1809, test_f1: 0.4924
 epoch: 87, train_loss: 0.8508, test_loss: 1.1799, test_f1: 0.4915
 epoch: 88, train_loss: 0.8543, test_loss: 1.1732, test_f1: 0.4872
 epoch: 89, train_loss: 0.8468, test_loss: 1.1814, test_f1: 0.4934
 epoch: 90, train_loss: 0.8457, test_loss: 1.1941, test_f1: 0.5044
 epoch: 91, train_loss: 0.8358, test_loss: 1.1951, test_f1: 0.5100
 epoch: 92, train_loss: 0.8360, test_loss: 1.1982, test_f1: 0.5272
 epoch: 93, train_loss: 0.8325, test_loss: 1.1988, test_f1: 0.5133
 epoch: 94, train_loss: 0.8328, test_loss: 1.1984, test_f1: 0.5152
 epoch: 95, train_loss: 0.8308, test_loss: 1.1919, test_f1: 0.5229
 epoch: 96, train_loss: 0.8289, test_loss: 1.1978, test_f1: 0.5236
 epoch: 97, train_loss: 0.8319, test_loss: 1.2038, test_f1: 0.5196
 epoch: 98, train_loss: 0.8254, test_loss: 1.2078, test_f1: 0.5163
 epoch: 99, train_loss: 0.8168, test_loss: 1.2149, test_f1: 0.5008
##################ITERATION #1 ****************************************
 epoch: 0, train_loss: 1.3466, test_loss: 1.3563, test_f1: 0.2281
 epoch: 1, train_loss: 1.3170, test_loss: 1.3514, test_f1: 0.2281
 epoch: 2, train_loss: 1.3036, test_loss: 1.3428, test_f1: 0.2281
 epoch: 3, train_loss: 1.2903, test_loss: 1.3328, test_f1: 0.2281
 epoch: 4, train_loss: 1.2754, test_loss: 1.3240, test_f1: 0.2281
 epoch: 5, train_loss: 1.2641, test_loss: 1.3159, test_f1: 0.2281
 epoch: 6, train_loss: 1.2528, test_loss: 1.3066, test_f1: 0.2281
 epoch: 7, train_loss: 1.2403, test_loss: 1.3009, test_f1: 0.2281
 epoch: 8, train_loss: 1.2273, test_loss: 1.2911, test_f1: 0.2281
 epoch: 9, train_loss: 1.2146, test_loss: 1.2855, test_f1: 0.2281
 epoch: 10, train_loss: 1.2082, test_loss: 1.2787, test_f1: 0.2281
 epoch: 11, train_loss: 1.2023, test_loss: 1.2755, test_f1: 0.2396
 epoch: 12, train_loss: 1.1912, test_loss: 1.2744, test_f1: 0.2489
 epoch: 13, train_loss: 1.1850, test_loss: 1.2724, test_f1: 0.2931
 epoch: 14, train_loss: 1.1767, test_loss: 1.2670, test_f1: 0.3062
 epoch: 15, train_loss: 1.1660, test_loss: 1.2599, test_f1: 0.3062
 epoch: 16, train_loss: 1.1573, test_loss: 1.2555, test_f1: 0.3222
 epoch: 17, train_loss: 1.1482, test_loss: 1.2508, test_f1: 0.3341
 epoch: 18, train_loss: 1.1388, test_loss: 1.2411, test_f1: 0.3466
 epoch: 19, train_loss: 1.1269, test_loss: 1.2358, test_f1: 0.3435
 epoch: 20, train_loss: 1.1198, test_loss: 1.2296, test_f1: 0.3401
 epoch: 21, train_loss: 1.1139, test_loss: 1.2240, test_f1: 0.3333
 epoch: 22, train_loss: 1.1061, test_loss: 1.2199, test_f1: 0.3279
 epoch: 23, train_loss: 1.0995, test_loss: 1.2178, test_f1: 0.3209
 epoch: 24, train_loss: 1.0872, test_loss: 1.2128, test_f1: 0.3270
 epoch: 25, train_loss: 1.0767, test_loss: 1.2086, test_f1: 0.3300
 epoch: 26, train_loss: 1.0702, test_loss: 1.2023, test_f1: 0.3425
 epoch: 27, train_loss: 1.0618, test_loss: 1.1969, test_f1: 0.3512
 epoch: 28, train_loss: 1.0518, test_loss: 1.1937, test_f1: 0.3520
 epoch: 29, train_loss: 1.0407, test_loss: 1.1905, test_f1: 0.3547
 epoch: 30, train_loss: 1.0441, test_loss: 1.1925, test_f1: 0.3710
 epoch: 31, train_loss: 1.0249, test_loss: 1.1897, test_f1: 0.3821
 epoch: 32, train_loss: 1.0144, test_loss: 1.1818, test_f1: 0.4107
 epoch: 33, train_loss: 1.0098, test_loss: 1.1820, test_f1: 0.4138
 epoch: 34, train_loss: 1.0024, test_loss: 1.1799, test_f1: 0.4095
 epoch: 35, train_loss: 0.9974, test_loss: 1.1745, test_f1: 0.4204
 epoch: 36, train_loss: 0.9958, test_loss: 1.1733, test_f1: 0.4467
 epoch: 37, train_loss: 0.9845, test_loss: 1.1714, test_f1: 0.4649
 epoch: 38, train_loss: 0.9697, test_loss: 1.1673, test_f1: 0.4595
 epoch: 39, train_loss: 0.9735, test_loss: 1.1587, test_f1: 0.4693
 epoch: 40, train_loss: 0.9552, test_loss: 1.1544, test_f1: 0.4660
 epoch: 41, train_loss: 0.9554, test_loss: 1.1469, test_f1: 0.4905
 epoch: 42, train_loss: 0.9459, test_loss: 1.1453, test_f1: 0.4848
 epoch: 43, train_loss: 0.9361, test_loss: 1.1455, test_f1: 0.4982
 epoch: 44, train_loss: 0.9215, test_loss: 1.1432, test_f1: 0.5003
 epoch: 45, train_loss: 0.9229, test_loss: 1.1450, test_f1: 0.5322
 epoch: 46, train_loss: 0.9197, test_loss: 1.1449, test_f1: 0.5598
 epoch: 47, train_loss: 0.9135, test_loss: 1.1369, test_f1: 0.5505
 epoch: 48, train_loss: 0.9067, test_loss: 1.1331, test_f1: 0.5605
 epoch: 49, train_loss: 0.8935, test_loss: 1.1309, test_f1: 0.5575
 epoch: 50, train_loss: 0.8818, test_loss: 1.1322, test_f1: 0.5453
 epoch: 51, train_loss: 0.8808, test_loss: 1.1266, test_f1: 0.5505
 epoch: 52, train_loss: 0.8764, test_loss: 1.1252, test_f1: 0.5560
 epoch: 53, train_loss: 0.8759, test_loss: 1.1220, test_f1: 0.5612
 epoch: 54, train_loss: 0.8675, test_loss: 1.1190, test_f1: 0.5437
 epoch: 55, train_loss: 0.8612, test_loss: 1.1207, test_f1: 0.5440
 epoch: 56, train_loss: 0.8614, test_loss: 1.1251, test_f1: 0.5436
 epoch: 57, train_loss: 0.8612, test_loss: 1.1297, test_f1: 0.5555
 epoch: 58, train_loss: 0.8578, test_loss: 1.1225, test_f1: 0.5587
 epoch: 59, train_loss: 0.8545, test_loss: 1.1239, test_f1: 0.5618
 epoch: 60, train_loss: 0.8446, test_loss: 1.1191, test_f1: 0.5538
 epoch: 61, train_loss: 0.8451, test_loss: 1.1219, test_f1: 0.5538
 epoch: 62, train_loss: 0.8521, test_loss: 1.1183, test_f1: 0.5543
 epoch: 63, train_loss: 0.8419, test_loss: 1.1166, test_f1: 0.5604
 epoch: 64, train_loss: 0.8441, test_loss: 1.1133, test_f1: 0.5671
 epoch: 65, train_loss: 0.8375, test_loss: 1.1136, test_f1: 0.5534
 epoch: 66, train_loss: 0.8317, test_loss: 1.1134, test_f1: 0.5556
 epoch: 67, train_loss: 0.8360, test_loss: 1.1138, test_f1: 0.5641
 epoch: 68, train_loss: 0.8254, test_loss: 1.1043, test_f1: 0.5887
 epoch: 69, train_loss: 0.8253, test_loss: 1.1067, test_f1: 0.5890
 epoch: 70, train_loss: 0.8260, test_loss: 1.1100, test_f1: 0.5895
 epoch: 71, train_loss: 0.8183, test_loss: 1.1170, test_f1: 0.5793
 epoch: 72, train_loss: 0.8190, test_loss: 1.1105, test_f1: 0.5860
 epoch: 73, train_loss: 0.8144, test_loss: 1.1152, test_f1: 0.5894
 epoch: 74, train_loss: 0.8097, test_loss: 1.1144, test_f1: 0.5683
 epoch: 75, train_loss: 0.8141, test_loss: 1.1213, test_f1: 0.5704
 epoch: 76, train_loss: 0.8138, test_loss: 1.1208, test_f1: 0.5894
 epoch: 77, train_loss: 0.8023, test_loss: 1.1118, test_f1: 0.5792
 epoch: 78, train_loss: 0.7935, test_loss: 1.1104, test_f1: 0.5551
 epoch: 79, train_loss: 0.7994, test_loss: 1.1212, test_f1: 0.5907
 epoch: 80, train_loss: 0.7982, test_loss: 1.1199, test_f1: 0.5856
 epoch: 81, train_loss: 0.7946, test_loss: 1.1193, test_f1: 0.5752
 epoch: 82, train_loss: 0.7919, test_loss: 1.1182, test_f1: 0.5683
 epoch: 83, train_loss: 0.7832, test_loss: 1.1252, test_f1: 0.5599
 epoch: 84, train_loss: 0.7826, test_loss: 1.1297, test_f1: 0.5513
 epoch: 85, train_loss: 0.7857, test_loss: 1.1258, test_f1: 0.5811
 epoch: 86, train_loss: 0.7841, test_loss: 1.1199, test_f1: 0.5792
 epoch: 87, train_loss: 0.7737, test_loss: 1.1233, test_f1: 0.5660
 epoch: 88, train_loss: 0.7739, test_loss: 1.1285, test_f1: 0.5440
 epoch: 89, train_loss: 0.7702, test_loss: 1.1436, test_f1: 0.5475
 epoch: 90, train_loss: 0.7769, test_loss: 1.1439, test_f1: 0.5591
 epoch: 91, train_loss: 0.7778, test_loss: 1.1368, test_f1: 0.5508
 epoch: 92, train_loss: 0.7696, test_loss: 1.1359, test_f1: 0.5607
 epoch: 93, train_loss: 0.7702, test_loss: 1.1320, test_f1: 0.5593
 epoch: 94, train_loss: 0.7618, test_loss: 1.1335, test_f1: 0.5628
 epoch: 95, train_loss: 0.7650, test_loss: 1.1376, test_f1: 0.5588
 epoch: 96, train_loss: 0.7536, test_loss: 1.1452, test_f1: 0.5613
 epoch: 97, train_loss: 0.7486, test_loss: 1.1425, test_f1: 0.5854
 epoch: 98, train_loss: 0.7519, test_loss: 1.1395, test_f1: 0.5830
 epoch: 99, train_loss: 0.7484, test_loss: 1.1427, test_f1: 0.5782
##################ITERATION #2 ****************************************
 epoch: 0, train_loss: 1.3209, test_loss: 1.3446, test_f1: 0.2329
 epoch: 1, train_loss: 1.2818, test_loss: 1.3437, test_f1: 0.2354
 epoch: 2, train_loss: 1.2686, test_loss: 1.3370, test_f1: 0.2316
 epoch: 3, train_loss: 1.2499, test_loss: 1.3302, test_f1: 0.2366
 epoch: 4, train_loss: 1.2361, test_loss: 1.3207, test_f1: 0.2332
 epoch: 5, train_loss: 1.2214, test_loss: 1.3082, test_f1: 0.2841
 epoch: 6, train_loss: 1.2087, test_loss: 1.2931, test_f1: 0.3181
 epoch: 7, train_loss: 1.1920, test_loss: 1.2759, test_f1: 0.3447
 epoch: 8, train_loss: 1.1843, test_loss: 1.2646, test_f1: 0.3567
 epoch: 9, train_loss: 1.1723, test_loss: 1.2459, test_f1: 0.3360
 epoch: 10, train_loss: 1.1587, test_loss: 1.2374, test_f1: 0.3534
 epoch: 11, train_loss: 1.1511, test_loss: 1.2291, test_f1: 0.3597
 epoch: 12, train_loss: 1.1363, test_loss: 1.2252, test_f1: 0.4231
 epoch: 13, train_loss: 1.1261, test_loss: 1.2152, test_f1: 0.4224
 epoch: 14, train_loss: 1.1146, test_loss: 1.2103, test_f1: 0.4144
 epoch: 15, train_loss: 1.1066, test_loss: 1.2004, test_f1: 0.4144
 epoch: 16, train_loss: 1.0908, test_loss: 1.1939, test_f1: 0.4152
 epoch: 17, train_loss: 1.0851, test_loss: 1.1888, test_f1: 0.4278
 epoch: 18, train_loss: 1.0706, test_loss: 1.1879, test_f1: 0.4271
 epoch: 19, train_loss: 1.0722, test_loss: 1.1832, test_f1: 0.4556
 epoch: 20, train_loss: 1.0602, test_loss: 1.1813, test_f1: 0.4463
 epoch: 21, train_loss: 1.0556, test_loss: 1.1730, test_f1: 0.4478
 epoch: 22, train_loss: 1.0416, test_loss: 1.1680, test_f1: 0.4688
 epoch: 23, train_loss: 1.0351, test_loss: 1.1635, test_f1: 0.4745
 epoch: 24, train_loss: 1.0258, test_loss: 1.1578, test_f1: 0.4837
 epoch: 25, train_loss: 1.0185, test_loss: 1.1497, test_f1: 0.4941
 epoch: 26, train_loss: 1.0171, test_loss: 1.1446, test_f1: 0.5011
 epoch: 27, train_loss: 1.0081, test_loss: 1.1401, test_f1: 0.5203
 epoch: 28, train_loss: 1.0040, test_loss: 1.1344, test_f1: 0.5061
 epoch: 29, train_loss: 0.9951, test_loss: 1.1382, test_f1: 0.4946
 epoch: 30, train_loss: 0.9842, test_loss: 1.1336, test_f1: 0.4993
 epoch: 31, train_loss: 0.9812, test_loss: 1.1373, test_f1: 0.5021
 epoch: 32, train_loss: 0.9648, test_loss: 1.1294, test_f1: 0.5064
 epoch: 33, train_loss: 0.9637, test_loss: 1.1322, test_f1: 0.5126
 epoch: 34, train_loss: 0.9592, test_loss: 1.1348, test_f1: 0.5127
 epoch: 35, train_loss: 0.9598, test_loss: 1.1242, test_f1: 0.5415
 epoch: 36, train_loss: 0.9477, test_loss: 1.1184, test_f1: 0.5333
 epoch: 37, train_loss: 0.9411, test_loss: 1.1113, test_f1: 0.5303
 epoch: 38, train_loss: 0.9388, test_loss: 1.1054, test_f1: 0.5338
 epoch: 39, train_loss: 0.9287, test_loss: 1.1001, test_f1: 0.5266
 epoch: 40, train_loss: 0.9181, test_loss: 1.1023, test_f1: 0.5195
 epoch: 41, train_loss: 0.9214, test_loss: 1.1063, test_f1: 0.5193
 epoch: 42, train_loss: 0.9150, test_loss: 1.1002, test_f1: 0.5444
 epoch: 43, train_loss: 0.9080, test_loss: 1.0987, test_f1: 0.5330
 epoch: 44, train_loss: 0.9077, test_loss: 1.1005, test_f1: 0.5362
 epoch: 45, train_loss: 0.9012, test_loss: 1.1066, test_f1: 0.5411
 epoch: 46, train_loss: 0.8945, test_loss: 1.1018, test_f1: 0.5323
 epoch: 47, train_loss: 0.8859, test_loss: 1.0955, test_f1: 0.5380
 epoch: 48, train_loss: 0.8825, test_loss: 1.0928, test_f1: 0.5372
 epoch: 49, train_loss: 0.8728, test_loss: 1.0868, test_f1: 0.5381
 epoch: 50, train_loss: 0.8710, test_loss: 1.0770, test_f1: 0.5364
 epoch: 51, train_loss: 0.8734, test_loss: 1.0834, test_f1: 0.5435
 epoch: 52, train_loss: 0.8668, test_loss: 1.0786, test_f1: 0.5487
 epoch: 53, train_loss: 0.8648, test_loss: 1.0841, test_f1: 0.5404
 epoch: 54, train_loss: 0.8548, test_loss: 1.0855, test_f1: 0.5473
 epoch: 55, train_loss: 0.8632, test_loss: 1.0901, test_f1: 0.5477
 epoch: 56, train_loss: 0.8594, test_loss: 1.0867, test_f1: 0.5544
 epoch: 57, train_loss: 0.8497, test_loss: 1.0872, test_f1: 0.5493
 epoch: 58, train_loss: 0.8549, test_loss: 1.0912, test_f1: 0.5563
 epoch: 59, train_loss: 0.8422, test_loss: 1.0894, test_f1: 0.5467
 epoch: 60, train_loss: 0.8516, test_loss: 1.0893, test_f1: 0.5572
 epoch: 61, train_loss: 0.8475, test_loss: 1.0837, test_f1: 0.5490
 epoch: 62, train_loss: 0.8465, test_loss: 1.0820, test_f1: 0.5526
 epoch: 63, train_loss: 0.8382, test_loss: 1.0847, test_f1: 0.5476
 epoch: 64, train_loss: 0.8449, test_loss: 1.0806, test_f1: 0.5480
 epoch: 65, train_loss: 0.8391, test_loss: 1.0960, test_f1: 0.5429
 epoch: 66, train_loss: 0.8374, test_loss: 1.0858, test_f1: 0.5350
 epoch: 67, train_loss: 0.8305, test_loss: 1.0906, test_f1: 0.5325
 epoch: 68, train_loss: 0.8365, test_loss: 1.0993, test_f1: 0.5397
 epoch: 69, train_loss: 0.8289, test_loss: 1.0994, test_f1: 0.5400
 epoch: 70, train_loss: 0.8269, test_loss: 1.1037, test_f1: 0.5402
 epoch: 71, train_loss: 0.8255, test_loss: 1.0883, test_f1: 0.5401
 epoch: 72, train_loss: 0.8168, test_loss: 1.0830, test_f1: 0.5503
 epoch: 73, train_loss: 0.8183, test_loss: 1.0726, test_f1: 0.5532
 epoch: 74, train_loss: 0.8221, test_loss: 1.0753, test_f1: 0.5562
 epoch: 75, train_loss: 0.8174, test_loss: 1.0861, test_f1: 0.5613
 epoch: 76, train_loss: 0.8228, test_loss: 1.0829, test_f1: 0.5457
 epoch: 77, train_loss: 0.8125, test_loss: 1.1071, test_f1: 0.5450
 epoch: 78, train_loss: 0.8101, test_loss: 1.1070, test_f1: 0.5398
 epoch: 79, train_loss: 0.8114, test_loss: 1.1170, test_f1: 0.5475
 epoch: 80, train_loss: 0.7989, test_loss: 1.1074, test_f1: 0.5350
 epoch: 81, train_loss: 0.8019, test_loss: 1.0956, test_f1: 0.5428
 epoch: 82, train_loss: 0.8039, test_loss: 1.0841, test_f1: 0.5480
 epoch: 83, train_loss: 0.8078, test_loss: 1.0874, test_f1: 0.5483
 epoch: 84, train_loss: 0.8027, test_loss: 1.0935, test_f1: 0.5500
 epoch: 85, train_loss: 0.7957, test_loss: 1.0896, test_f1: 0.5533
 epoch: 86, train_loss: 0.7880, test_loss: 1.0813, test_f1: 0.5629
 epoch: 87, train_loss: 0.7935, test_loss: 1.0807, test_f1: 0.5506
 epoch: 88, train_loss: 0.7996, test_loss: 1.0830, test_f1: 0.5603
 epoch: 89, train_loss: 0.7937, test_loss: 1.0870, test_f1: 0.5578
 epoch: 90, train_loss: 0.7820, test_loss: 1.0863, test_f1: 0.5553
 epoch: 91, train_loss: 0.7864, test_loss: 1.0981, test_f1: 0.5552
 epoch: 92, train_loss: 0.7722, test_loss: 1.0979, test_f1: 0.5634
 epoch: 93, train_loss: 0.7769, test_loss: 1.0984, test_f1: 0.5692
 epoch: 94, train_loss: 0.7774, test_loss: 1.0970, test_f1: 0.5621
 epoch: 95, train_loss: 0.7782, test_loss: 1.0863, test_f1: 0.5799
 epoch: 96, train_loss: 0.7736, test_loss: 1.0975, test_f1: 0.5799
 epoch: 97, train_loss: 0.7766, test_loss: 1.0917, test_f1: 0.5799
 epoch: 98, train_loss: 0.7684, test_loss: 1.1215, test_f1: 0.5734
 epoch: 99, train_loss: 0.7629, test_loss: 1.1190, test_f1: 0.5703
##################ITERATION #3 ****************************************
 epoch: 0, train_loss: 1.2935, test_loss: 1.3245, test_f1: 0.3582
 epoch: 1, train_loss: 1.2536, test_loss: 1.3255, test_f1: 0.3136
 epoch: 2, train_loss: 1.2359, test_loss: 1.3213, test_f1: 0.2958
 epoch: 3, train_loss: 1.2194, test_loss: 1.3112, test_f1: 0.3041
 epoch: 4, train_loss: 1.2143, test_loss: 1.2980, test_f1: 0.3343
 epoch: 5, train_loss: 1.1977, test_loss: 1.2852, test_f1: 0.3439
 epoch: 6, train_loss: 1.1883, test_loss: 1.2691, test_f1: 0.3565
 epoch: 7, train_loss: 1.1799, test_loss: 1.2562, test_f1: 0.4031
 epoch: 8, train_loss: 1.1707, test_loss: 1.2439, test_f1: 0.4339
 epoch: 9, train_loss: 1.1625, test_loss: 1.2332, test_f1: 0.4568
 epoch: 10, train_loss: 1.1488, test_loss: 1.2251, test_f1: 0.4444
 epoch: 11, train_loss: 1.1397, test_loss: 1.2229, test_f1: 0.4369
 epoch: 12, train_loss: 1.1275, test_loss: 1.2145, test_f1: 0.4288
 epoch: 13, train_loss: 1.1162, test_loss: 1.2009, test_f1: 0.4431
 epoch: 14, train_loss: 1.1054, test_loss: 1.1973, test_f1: 0.4294
 epoch: 15, train_loss: 1.0966, test_loss: 1.1851, test_f1: 0.4434
 epoch: 16, train_loss: 1.0880, test_loss: 1.1865, test_f1: 0.4461
 epoch: 17, train_loss: 1.0829, test_loss: 1.1779, test_f1: 0.4650
 epoch: 18, train_loss: 1.0636, test_loss: 1.1563, test_f1: 0.4760
 epoch: 19, train_loss: 1.0579, test_loss: 1.1530, test_f1: 0.4538
 epoch: 20, train_loss: 1.0510, test_loss: 1.1492, test_f1: 0.4519
 epoch: 21, train_loss: 1.0387, test_loss: 1.1485, test_f1: 0.4545
 epoch: 22, train_loss: 1.0397, test_loss: 1.1414, test_f1: 0.4722
 epoch: 23, train_loss: 1.0294, test_loss: 1.1339, test_f1: 0.4859
 epoch: 24, train_loss: 1.0211, test_loss: 1.1378, test_f1: 0.4887
 epoch: 25, train_loss: 1.0170, test_loss: 1.1415, test_f1: 0.5007
 epoch: 26, train_loss: 1.0101, test_loss: 1.1385, test_f1: 0.4983
 epoch: 27, train_loss: 0.9876, test_loss: 1.1253, test_f1: 0.5064
 epoch: 28, train_loss: 0.9894, test_loss: 1.1233, test_f1: 0.5054
 epoch: 29, train_loss: 0.9794, test_loss: 1.1251, test_f1: 0.5158
 epoch: 30, train_loss: 0.9791, test_loss: 1.1245, test_f1: 0.5136
 epoch: 31, train_loss: 0.9649, test_loss: 1.1212, test_f1: 0.5245
 epoch: 32, train_loss: 0.9723, test_loss: 1.1134, test_f1: 0.5178
 epoch: 33, train_loss: 0.9677, test_loss: 1.1130, test_f1: 0.5054
 epoch: 34, train_loss: 0.9516, test_loss: 1.1170, test_f1: 0.4927
 epoch: 35, train_loss: 0.9465, test_loss: 1.1175, test_f1: 0.5020
 epoch: 36, train_loss: 0.9396, test_loss: 1.1191, test_f1: 0.4919
 epoch: 37, train_loss: 0.9449, test_loss: 1.1171, test_f1: 0.5055
 epoch: 38, train_loss: 0.9283, test_loss: 1.1150, test_f1: 0.5108
 epoch: 39, train_loss: 0.9230, test_loss: 1.1054, test_f1: 0.5067
 epoch: 40, train_loss: 0.9156, test_loss: 1.1131, test_f1: 0.4982
 epoch: 41, train_loss: 0.9167, test_loss: 1.1158, test_f1: 0.5260
 epoch: 42, train_loss: 0.9048, test_loss: 1.1132, test_f1: 0.5342
 epoch: 43, train_loss: 0.8984, test_loss: 1.1149, test_f1: 0.5203
 epoch: 44, train_loss: 0.8962, test_loss: 1.1205, test_f1: 0.5399
 epoch: 45, train_loss: 0.8827, test_loss: 1.1239, test_f1: 0.5426
 epoch: 46, train_loss: 0.8914, test_loss: 1.1220, test_f1: 0.5379
 epoch: 47, train_loss: 0.8751, test_loss: 1.1200, test_f1: 0.5328
 epoch: 48, train_loss: 0.8786, test_loss: 1.1194, test_f1: 0.5483
 epoch: 49, train_loss: 0.8670, test_loss: 1.1101, test_f1: 0.5483
 epoch: 50, train_loss: 0.8601, test_loss: 1.1109, test_f1: 0.5510
 epoch: 51, train_loss: 0.8655, test_loss: 1.1176, test_f1: 0.5537
 epoch: 52, train_loss: 0.8587, test_loss: 1.1183, test_f1: 0.5458
 epoch: 53, train_loss: 0.8522, test_loss: 1.1240, test_f1: 0.5375
 epoch: 54, train_loss: 0.8510, test_loss: 1.1274, test_f1: 0.5290
 epoch: 55, train_loss: 0.8552, test_loss: 1.1230, test_f1: 0.5345
 epoch: 56, train_loss: 0.8447, test_loss: 1.1133, test_f1: 0.5428
 epoch: 57, train_loss: 0.8384, test_loss: 1.1075, test_f1: 0.5456
 epoch: 58, train_loss: 0.8404, test_loss: 1.1067, test_f1: 0.5454
 epoch: 59, train_loss: 0.8368, test_loss: 1.1080, test_f1: 0.5534
 epoch: 60, train_loss: 0.8367, test_loss: 1.1173, test_f1: 0.5488
 epoch: 61, train_loss: 0.8328, test_loss: 1.1126, test_f1: 0.5583
 epoch: 62, train_loss: 0.8331, test_loss: 1.1103, test_f1: 0.5610
 epoch: 63, train_loss: 0.8336, test_loss: 1.1135, test_f1: 0.5538
 epoch: 64, train_loss: 0.8150, test_loss: 1.1182, test_f1: 0.5547
 epoch: 65, train_loss: 0.8314, test_loss: 1.1168, test_f1: 0.5538
 epoch: 66, train_loss: 0.8219, test_loss: 1.1045, test_f1: 0.5567
 epoch: 67, train_loss: 0.8224, test_loss: 1.1075, test_f1: 0.5514
 epoch: 68, train_loss: 0.8104, test_loss: 1.1107, test_f1: 0.5538
 epoch: 69, train_loss: 0.8206, test_loss: 1.1163, test_f1: 0.5511
 epoch: 70, train_loss: 0.8109, test_loss: 1.1208, test_f1: 0.5355
 epoch: 71, train_loss: 0.8043, test_loss: 1.1202, test_f1: 0.5405
 epoch: 72, train_loss: 0.8010, test_loss: 1.1193, test_f1: 0.5475
 epoch: 73, train_loss: 0.8071, test_loss: 1.1178, test_f1: 0.5505
 epoch: 74, train_loss: 0.8063, test_loss: 1.1189, test_f1: 0.5481
 epoch: 75, train_loss: 0.8008, test_loss: 1.1190, test_f1: 0.5508
 epoch: 76, train_loss: 0.8169, test_loss: 1.1123, test_f1: 0.5666
 epoch: 77, train_loss: 0.8005, test_loss: 1.1203, test_f1: 0.5537
 epoch: 78, train_loss: 0.7997, test_loss: 1.1233, test_f1: 0.5509
 epoch: 79, train_loss: 0.7942, test_loss: 1.1259, test_f1: 0.5569
 epoch: 80, train_loss: 0.7812, test_loss: 1.1193, test_f1: 0.5644
 epoch: 81, train_loss: 0.7898, test_loss: 1.1196, test_f1: 0.5643
 epoch: 82, train_loss: 0.7843, test_loss: 1.1256, test_f1: 0.5536
 epoch: 83, train_loss: 0.7853, test_loss: 1.1299, test_f1: 0.5532
 epoch: 84, train_loss: 0.7812, test_loss: 1.1309, test_f1: 0.5511
 epoch: 85, train_loss: 0.7783, test_loss: 1.1384, test_f1: 0.5491
 epoch: 86, train_loss: 0.7739, test_loss: 1.1431, test_f1: 0.5469
 epoch: 87, train_loss: 0.7787, test_loss: 1.1383, test_f1: 0.5553
 epoch: 88, train_loss: 0.7783, test_loss: 1.1338, test_f1: 0.5451
 epoch: 89, train_loss: 0.7644, test_loss: 1.1407, test_f1: 0.5473
 epoch: 90, train_loss: 0.7776, test_loss: 1.1419, test_f1: 0.5422
 epoch: 91, train_loss: 0.7787, test_loss: 1.1267, test_f1: 0.5467
 epoch: 92, train_loss: 0.7764, test_loss: 1.1211, test_f1: 0.5638
 epoch: 93, train_loss: 0.7555, test_loss: 1.1275, test_f1: 0.5535
 epoch: 94, train_loss: 0.7483, test_loss: 1.1283, test_f1: 0.5529
 epoch: 95, train_loss: 0.7625, test_loss: 1.1393, test_f1: 0.5457
 epoch: 96, train_loss: 0.7495, test_loss: 1.1452, test_f1: 0.5521
 epoch: 97, train_loss: 0.7424, test_loss: 1.1420, test_f1: 0.5651
 epoch: 98, train_loss: 0.7603, test_loss: 1.1430, test_f1: 0.5764
 epoch: 99, train_loss: 0.7482, test_loss: 1.1444, test_f1: 0.5705
##################ITERATION #4 ****************************************
 epoch: 0, train_loss: 1.2802, test_loss: 1.3471, test_f1: 0.1394
 epoch: 1, train_loss: 1.2345, test_loss: 1.3344, test_f1: 0.2677
 epoch: 2, train_loss: 1.2146, test_loss: 1.3213, test_f1: 0.3388
 epoch: 3, train_loss: 1.1971, test_loss: 1.3067, test_f1: 0.3429
 epoch: 4, train_loss: 1.1683, test_loss: 1.2869, test_f1: 0.3466
 epoch: 5, train_loss: 1.1601, test_loss: 1.2708, test_f1: 0.3919
 epoch: 6, train_loss: 1.1502, test_loss: 1.2455, test_f1: 0.4430
 epoch: 7, train_loss: 1.1392, test_loss: 1.2261, test_f1: 0.4533
 epoch: 8, train_loss: 1.1119, test_loss: 1.2111, test_f1: 0.4519
 epoch: 9, train_loss: 1.1100, test_loss: 1.1959, test_f1: 0.4721
 epoch: 10, train_loss: 1.0892, test_loss: 1.1824, test_f1: 0.4768
 epoch: 11, train_loss: 1.0727, test_loss: 1.1676, test_f1: 0.4851
 epoch: 12, train_loss: 1.0715, test_loss: 1.1684, test_f1: 0.4922
 epoch: 13, train_loss: 1.0693, test_loss: 1.1607, test_f1: 0.4954
 epoch: 14, train_loss: 1.0485, test_loss: 1.1580, test_f1: 0.4686
 epoch: 15, train_loss: 1.0360, test_loss: 1.1541, test_f1: 0.4760
 epoch: 16, train_loss: 1.0359, test_loss: 1.1514, test_f1: 0.4658
 epoch: 17, train_loss: 1.0234, test_loss: 1.1489, test_f1: 0.4817
 epoch: 18, train_loss: 1.0064, test_loss: 1.1421, test_f1: 0.4845
 epoch: 19, train_loss: 1.0011, test_loss: 1.1351, test_f1: 0.4871
 epoch: 20, train_loss: 0.9953, test_loss: 1.1351, test_f1: 0.4878
 epoch: 21, train_loss: 0.9946, test_loss: 1.1351, test_f1: 0.4878
 epoch: 22, train_loss: 0.9888, test_loss: 1.1319, test_f1: 0.5078
 epoch: 23, train_loss: 0.9760, test_loss: 1.1220, test_f1: 0.5370
 epoch: 24, train_loss: 0.9649, test_loss: 1.1254, test_f1: 0.5475
 epoch: 25, train_loss: 0.9641, test_loss: 1.1205, test_f1: 0.5423
 epoch: 26, train_loss: 0.9608, test_loss: 1.1215, test_f1: 0.5188
 epoch: 27, train_loss: 0.9406, test_loss: 1.1274, test_f1: 0.5412
 epoch: 28, train_loss: 0.9362, test_loss: 1.1400, test_f1: 0.5225
 epoch: 29, train_loss: 0.9286, test_loss: 1.1537, test_f1: 0.5380
 epoch: 30, train_loss: 0.9254, test_loss: 1.1524, test_f1: 0.5303
 epoch: 31, train_loss: 0.9214, test_loss: 1.1383, test_f1: 0.5557
 epoch: 32, train_loss: 0.9258, test_loss: 1.1314, test_f1: 0.5473
 epoch: 33, train_loss: 0.9125, test_loss: 1.1258, test_f1: 0.5406
 epoch: 34, train_loss: 0.9010, test_loss: 1.1308, test_f1: 0.5377
 epoch: 35, train_loss: 0.8988, test_loss: 1.1363, test_f1: 0.5329
 epoch: 36, train_loss: 0.8922, test_loss: 1.1264, test_f1: 0.5421
 epoch: 37, train_loss: 0.8885, test_loss: 1.1216, test_f1: 0.5574
 epoch: 38, train_loss: 0.8803, test_loss: 1.1311, test_f1: 0.5699
 epoch: 39, train_loss: 0.8735, test_loss: 1.1230, test_f1: 0.5553
 epoch: 40, train_loss: 0.8773, test_loss: 1.1207, test_f1: 0.5476
 epoch: 41, train_loss: 0.8656, test_loss: 1.1257, test_f1: 0.5507
 epoch: 42, train_loss: 0.8561, test_loss: 1.1385, test_f1: 0.5359
 epoch: 43, train_loss: 0.8539, test_loss: 1.1329, test_f1: 0.5638
 epoch: 44, train_loss: 0.8592, test_loss: 1.1157, test_f1: 0.5778
 epoch: 45, train_loss: 0.8472, test_loss: 1.1219, test_f1: 0.5594
 epoch: 46, train_loss: 0.8304, test_loss: 1.1365, test_f1: 0.5457
 epoch: 47, train_loss: 0.8370, test_loss: 1.1550, test_f1: 0.5602
 epoch: 48, train_loss: 0.8227, test_loss: 1.1772, test_f1: 0.5486
 epoch: 49, train_loss: 0.8326, test_loss: 1.1633, test_f1: 0.5510
 epoch: 50, train_loss: 0.8329, test_loss: 1.1516, test_f1: 0.5455
 epoch: 51, train_loss: 0.8182, test_loss: 1.1756, test_f1: 0.5039
 epoch: 52, train_loss: 0.8246, test_loss: 1.1773, test_f1: 0.5169
 epoch: 53, train_loss: 0.8067, test_loss: 1.1746, test_f1: 0.5122
 epoch: 54, train_loss: 0.8060, test_loss: 1.1719, test_f1: 0.5189
 epoch: 55, train_loss: 0.7981, test_loss: 1.1697, test_f1: 0.5076
 epoch: 56, train_loss: 0.8039, test_loss: 1.1677, test_f1: 0.5241
 epoch: 57, train_loss: 0.7971, test_loss: 1.1655, test_f1: 0.5535
 epoch: 58, train_loss: 0.8056, test_loss: 1.1671, test_f1: 0.5282
 epoch: 59, train_loss: 0.8081, test_loss: 1.1578, test_f1: 0.5284
 epoch: 60, train_loss: 0.7950, test_loss: 1.1632, test_f1: 0.5231
 epoch: 61, train_loss: 0.8043, test_loss: 1.1692, test_f1: 0.5303
 epoch: 62, train_loss: 0.7894, test_loss: 1.1682, test_f1: 0.5536
 epoch: 63, train_loss: 0.7762, test_loss: 1.1656, test_f1: 0.5537
 epoch: 64, train_loss: 0.7905, test_loss: 1.1689, test_f1: 0.5554
 epoch: 65, train_loss: 0.7939, test_loss: 1.1745, test_f1: 0.5495
 epoch: 66, train_loss: 0.7824, test_loss: 1.1557, test_f1: 0.5546
 epoch: 67, train_loss: 0.7852, test_loss: 1.1629, test_f1: 0.5366
 epoch: 68, train_loss: 0.7806, test_loss: 1.1704, test_f1: 0.5517
 epoch: 69, train_loss: 0.7705, test_loss: 1.1670, test_f1: 0.5601
 epoch: 70, train_loss: 0.7714, test_loss: 1.1817, test_f1: 0.5571
 epoch: 71, train_loss: 0.7602, test_loss: 1.1956, test_f1: 0.5238
 epoch: 72, train_loss: 0.7822, test_loss: 1.1844, test_f1: 0.5418
 epoch: 73, train_loss: 0.7644, test_loss: 1.1968, test_f1: 0.5179
 epoch: 74, train_loss: 0.7652, test_loss: 1.1954, test_f1: 0.5218
 epoch: 75, train_loss: 0.7650, test_loss: 1.1756, test_f1: 0.5657
 epoch: 76, train_loss: 0.7666, test_loss: 1.1690, test_f1: 0.5646
 epoch: 77, train_loss: 0.7618, test_loss: 1.1789, test_f1: 0.5443
 epoch: 78, train_loss: 0.7586, test_loss: 1.1770, test_f1: 0.5291
 epoch: 79, train_loss: 0.7546, test_loss: 1.1974, test_f1: 0.5229
 epoch: 80, train_loss: 0.7601, test_loss: 1.1836, test_f1: 0.5628
 epoch: 81, train_loss: 0.7618, test_loss: 1.1891, test_f1: 0.5677
 epoch: 82, train_loss: 0.7511, test_loss: 1.2003, test_f1: 0.5658
 epoch: 83, train_loss: 0.7458, test_loss: 1.2002, test_f1: 0.5794
 epoch: 84, train_loss: 0.7440, test_loss: 1.2007, test_f1: 0.5735
 epoch: 85, train_loss: 0.7458, test_loss: 1.2003, test_f1: 0.5649
 epoch: 86, train_loss: 0.7425, test_loss: 1.2147, test_f1: 0.5677
 epoch: 87, train_loss: 0.7391, test_loss: 1.1957, test_f1: 0.5689
 epoch: 88, train_loss: 0.7368, test_loss: 1.1897, test_f1: 0.5686
 epoch: 89, train_loss: 0.7325, test_loss: 1.2103, test_f1: 0.5563
 epoch: 90, train_loss: 0.7408, test_loss: 1.2243, test_f1: 0.5278
 epoch: 91, train_loss: 0.7347, test_loss: 1.2246, test_f1: 0.5445
 epoch: 92, train_loss: 0.7368, test_loss: 1.2335, test_f1: 0.5423
 epoch: 93, train_loss: 0.7264, test_loss: 1.2388, test_f1: 0.5514
 epoch: 94, train_loss: 0.7244, test_loss: 1.2251, test_f1: 0.5439
 epoch: 95, train_loss: 0.7328, test_loss: 1.2092, test_f1: 0.5712
 epoch: 96, train_loss: 0.7296, test_loss: 1.2095, test_f1: 0.5610
 epoch: 97, train_loss: 0.7362, test_loss: 1.2174, test_f1: 0.5562
 epoch: 98, train_loss: 0.7268, test_loss: 1.2211, test_f1: 0.5631
 epoch: 99, train_loss: 0.7171, test_loss: 1.2636, test_f1: 0.5350
##################ITERATION #5 ****************************************
 epoch: 0, train_loss: 1.2752, test_loss: 1.3336, test_f1: 0.2410
 epoch: 1, train_loss: 1.2306, test_loss: 1.3291, test_f1: 0.3305
 epoch: 2, train_loss: 1.2158, test_loss: 1.3272, test_f1: 0.3313
 epoch: 3, train_loss: 1.1972, test_loss: 1.3281, test_f1: 0.3453
 epoch: 4, train_loss: 1.1789, test_loss: 1.3249, test_f1: 0.3594
 epoch: 5, train_loss: 1.1705, test_loss: 1.3095, test_f1: 0.4021
 epoch: 6, train_loss: 1.1551, test_loss: 1.2855, test_f1: 0.4223
 epoch: 7, train_loss: 1.1384, test_loss: 1.2640, test_f1: 0.4170
 epoch: 8, train_loss: 1.1300, test_loss: 1.2416, test_f1: 0.4252
 epoch: 9, train_loss: 1.1105, test_loss: 1.2248, test_f1: 0.4161
 epoch: 10, train_loss: 1.1031, test_loss: 1.2178, test_f1: 0.4026
 epoch: 11, train_loss: 1.1031, test_loss: 1.2105, test_f1: 0.4292
 epoch: 12, train_loss: 1.0893, test_loss: 1.2081, test_f1: 0.4346
 epoch: 13, train_loss: 1.0699, test_loss: 1.2077, test_f1: 0.4271
 epoch: 14, train_loss: 1.0582, test_loss: 1.2073, test_f1: 0.4395
 epoch: 15, train_loss: 1.0658, test_loss: 1.2146, test_f1: 0.4417
 epoch: 16, train_loss: 1.0461, test_loss: 1.2176, test_f1: 0.4550
 epoch: 17, train_loss: 1.0327, test_loss: 1.2094, test_f1: 0.4619
 epoch: 18, train_loss: 1.0223, test_loss: 1.2023, test_f1: 0.4701
 epoch: 19, train_loss: 1.0135, test_loss: 1.2053, test_f1: 0.4752
 epoch: 20, train_loss: 1.0118, test_loss: 1.2231, test_f1: 0.4758
 epoch: 21, train_loss: 1.0066, test_loss: 1.2264, test_f1: 0.4740
 epoch: 22, train_loss: 0.9998, test_loss: 1.2306, test_f1: 0.4936
 epoch: 23, train_loss: 0.9943, test_loss: 1.2354, test_f1: 0.5002
 epoch: 24, train_loss: 0.9772, test_loss: 1.2345, test_f1: 0.4976
 epoch: 25, train_loss: 0.9700, test_loss: 1.2408, test_f1: 0.4876
 epoch: 26, train_loss: 0.9676, test_loss: 1.2549, test_f1: 0.4977
 epoch: 27, train_loss: 0.9632, test_loss: 1.2429, test_f1: 0.5243
 epoch: 28, train_loss: 0.9421, test_loss: 1.2419, test_f1: 0.5193
 epoch: 29, train_loss: 0.9514, test_loss: 1.2454, test_f1: 0.5191
 epoch: 30, train_loss: 0.9376, test_loss: 1.2613, test_f1: 0.5172
 epoch: 31, train_loss: 0.9348, test_loss: 1.2406, test_f1: 0.5153
 epoch: 32, train_loss: 0.9339, test_loss: 1.2364, test_f1: 0.5259
 epoch: 33, train_loss: 0.9243, test_loss: 1.2572, test_f1: 0.5152
 epoch: 34, train_loss: 0.9168, test_loss: 1.2773, test_f1: 0.4951
 epoch: 35, train_loss: 0.9166, test_loss: 1.3012, test_f1: 0.5039
 epoch: 36, train_loss: 0.9152, test_loss: 1.3027, test_f1: 0.5046
 epoch: 37, train_loss: 0.9037, test_loss: 1.2783, test_f1: 0.5251
 epoch: 38, train_loss: 0.8971, test_loss: 1.2700, test_f1: 0.5367
 epoch: 39, train_loss: 0.8915, test_loss: 1.2669, test_f1: 0.5412
 epoch: 40, train_loss: 0.8879, test_loss: 1.2879, test_f1: 0.5223
 epoch: 41, train_loss: 0.8761, test_loss: 1.2978, test_f1: 0.5044
 epoch: 42, train_loss: 0.8775, test_loss: 1.3051, test_f1: 0.5196
 epoch: 43, train_loss: 0.8691, test_loss: 1.2759, test_f1: 0.5213
 epoch: 44, train_loss: 0.8554, test_loss: 1.2911, test_f1: 0.5229
 epoch: 45, train_loss: 0.8600, test_loss: 1.3090, test_f1: 0.5178
 epoch: 46, train_loss: 0.8504, test_loss: 1.3232, test_f1: 0.4993
 epoch: 47, train_loss: 0.8505, test_loss: 1.3115, test_f1: 0.5126
 epoch: 48, train_loss: 0.8426, test_loss: 1.3260, test_f1: 0.5224
 epoch: 49, train_loss: 0.8411, test_loss: 1.3430, test_f1: 0.4936
 epoch: 50, train_loss: 0.8425, test_loss: 1.3385, test_f1: 0.5186
 epoch: 51, train_loss: 0.8366, test_loss: 1.3390, test_f1: 0.5199
 epoch: 52, train_loss: 0.8331, test_loss: 1.3464, test_f1: 0.5131
 epoch: 53, train_loss: 0.8143, test_loss: 1.3517, test_f1: 0.5115
 epoch: 54, train_loss: 0.8241, test_loss: 1.3461, test_f1: 0.5338
 epoch: 55, train_loss: 0.8289, test_loss: 1.3332, test_f1: 0.5352
 epoch: 56, train_loss: 0.8273, test_loss: 1.3447, test_f1: 0.5217
 epoch: 57, train_loss: 0.8160, test_loss: 1.3495, test_f1: 0.5369
 epoch: 58, train_loss: 0.8188, test_loss: 1.3533, test_f1: 0.5351
 epoch: 59, train_loss: 0.8115, test_loss: 1.3654, test_f1: 0.5155
 epoch: 60, train_loss: 0.8093, test_loss: 1.3617, test_f1: 0.5250
 epoch: 61, train_loss: 0.8026, test_loss: 1.3401, test_f1: 0.5320
 epoch: 62, train_loss: 0.8072, test_loss: 1.3378, test_f1: 0.5388
 epoch: 63, train_loss: 0.8007, test_loss: 1.3466, test_f1: 0.5299
 epoch: 64, train_loss: 0.7909, test_loss: 1.3582, test_f1: 0.5326
 epoch: 65, train_loss: 0.7975, test_loss: 1.3636, test_f1: 0.5329
 epoch: 66, train_loss: 0.8004, test_loss: 1.3654, test_f1: 0.5344
 epoch: 67, train_loss: 0.7939, test_loss: 1.3665, test_f1: 0.5143
 epoch: 68, train_loss: 0.7883, test_loss: 1.3684, test_f1: 0.5173
 epoch: 69, train_loss: 0.7842, test_loss: 1.3761, test_f1: 0.5132
 epoch: 70, train_loss: 0.7872, test_loss: 1.3789, test_f1: 0.5106
 epoch: 71, train_loss: 0.7780, test_loss: 1.3672, test_f1: 0.5131
 epoch: 72, train_loss: 0.7853, test_loss: 1.3908, test_f1: 0.5104
 epoch: 73, train_loss: 0.7749, test_loss: 1.3839, test_f1: 0.5351
 epoch: 74, train_loss: 0.7740, test_loss: 1.3939, test_f1: 0.5305
 epoch: 75, train_loss: 0.7800, test_loss: 1.3828, test_f1: 0.5404
 epoch: 76, train_loss: 0.7727, test_loss: 1.3898, test_f1: 0.5511
 epoch: 77, train_loss: 0.7761, test_loss: 1.3879, test_f1: 0.5565
 epoch: 78, train_loss: 0.7727, test_loss: 1.4048, test_f1: 0.5407
 epoch: 79, train_loss: 0.7633, test_loss: 1.4095, test_f1: 0.5255
 epoch: 80, train_loss: 0.7695, test_loss: 1.4009, test_f1: 0.5285
 epoch: 81, train_loss: 0.7635, test_loss: 1.4026, test_f1: 0.5478
 epoch: 82, train_loss: 0.7592, test_loss: 1.3735, test_f1: 0.5543
 epoch: 83, train_loss: 0.7577, test_loss: 1.3937, test_f1: 0.5565
 epoch: 84, train_loss: 0.7585, test_loss: 1.4021, test_f1: 0.5417
 epoch: 85, train_loss: 0.7631, test_loss: 1.4455, test_f1: 0.5088
 epoch: 86, train_loss: 0.7518, test_loss: 1.4355, test_f1: 0.5390
 epoch: 87, train_loss: 0.7472, test_loss: 1.4472, test_f1: 0.5357
 epoch: 88, train_loss: 0.7527, test_loss: 1.4230, test_f1: 0.5442
 epoch: 89, train_loss: 0.7528, test_loss: 1.4198, test_f1: 0.5436
 epoch: 90, train_loss: 0.7482, test_loss: 1.4448, test_f1: 0.5465
 epoch: 91, train_loss: 0.7531, test_loss: 1.4824, test_f1: 0.5271
 epoch: 92, train_loss: 0.7507, test_loss: 1.4733, test_f1: 0.5217
 epoch: 93, train_loss: 0.7366, test_loss: 1.4714, test_f1: 0.5408
 epoch: 94, train_loss: 0.7357, test_loss: 1.4582, test_f1: 0.5404
 epoch: 95, train_loss: 0.7299, test_loss: 1.4284, test_f1: 0.5431
 epoch: 96, train_loss: 0.7231, test_loss: 1.4385, test_f1: 0.5534
 epoch: 97, train_loss: 0.7300, test_loss: 1.4560, test_f1: 0.5510
 epoch: 98, train_loss: 0.7224, test_loss: 1.4656, test_f1: 0.5539
 epoch: 99, train_loss: 0.7269, test_loss: 1.4553, test_f1: 0.5495
##################ITERATION #6 ****************************************
 epoch: 0, train_loss: 1.2913, test_loss: 1.3351, test_f1: 0.3021
 epoch: 1, train_loss: 1.2252, test_loss: 1.3349, test_f1: 0.3412
 epoch: 2, train_loss: 1.2153, test_loss: 1.3307, test_f1: 0.3468
 epoch: 3, train_loss: 1.1910, test_loss: 1.3310, test_f1: 0.3528
 epoch: 4, train_loss: 1.1738, test_loss: 1.3232, test_f1: 0.3181
 epoch: 5, train_loss: 1.1562, test_loss: 1.3119, test_f1: 0.3049
 epoch: 6, train_loss: 1.1481, test_loss: 1.3005, test_f1: 0.3505
 epoch: 7, train_loss: 1.1300, test_loss: 1.2766, test_f1: 0.3856
 epoch: 8, train_loss: 1.1161, test_loss: 1.2516, test_f1: 0.4027
 epoch: 9, train_loss: 1.1183, test_loss: 1.2343, test_f1: 0.4164
 epoch: 10, train_loss: 1.1096, test_loss: 1.2186, test_f1: 0.4341
 epoch: 11, train_loss: 1.0919, test_loss: 1.1980, test_f1: 0.4268
 epoch: 12, train_loss: 1.0954, test_loss: 1.1866, test_f1: 0.4509
 epoch: 13, train_loss: 1.0732, test_loss: 1.1861, test_f1: 0.4786
 epoch: 14, train_loss: 1.0666, test_loss: 1.1804, test_f1: 0.4773
 epoch: 15, train_loss: 1.0582, test_loss: 1.1728, test_f1: 0.4585
 epoch: 16, train_loss: 1.0463, test_loss: 1.1748, test_f1: 0.4612
 epoch: 17, train_loss: 1.0315, test_loss: 1.1817, test_f1: 0.4556
 epoch: 18, train_loss: 1.0264, test_loss: 1.1797, test_f1: 0.4739
 epoch: 19, train_loss: 1.0280, test_loss: 1.1720, test_f1: 0.4899
 epoch: 20, train_loss: 1.0097, test_loss: 1.1721, test_f1: 0.4960
 epoch: 21, train_loss: 1.0005, test_loss: 1.1834, test_f1: 0.4908
 epoch: 22, train_loss: 1.0038, test_loss: 1.1914, test_f1: 0.4785
 epoch: 23, train_loss: 0.9841, test_loss: 1.1922, test_f1: 0.4782
 epoch: 24, train_loss: 0.9762, test_loss: 1.2035, test_f1: 0.4794
 epoch: 25, train_loss: 0.9790, test_loss: 1.2111, test_f1: 0.4942
 epoch: 26, train_loss: 0.9648, test_loss: 1.2253, test_f1: 0.5025
 epoch: 27, train_loss: 0.9503, test_loss: 1.2188, test_f1: 0.5044
 epoch: 28, train_loss: 0.9354, test_loss: 1.2152, test_f1: 0.5040
 epoch: 29, train_loss: 0.9437, test_loss: 1.1802, test_f1: 0.5086
 epoch: 30, train_loss: 0.9333, test_loss: 1.1840, test_f1: 0.5052
 epoch: 31, train_loss: 0.9353, test_loss: 1.1925, test_f1: 0.5079
 epoch: 32, train_loss: 0.9252, test_loss: 1.2129, test_f1: 0.5133
 epoch: 33, train_loss: 0.9115, test_loss: 1.2057, test_f1: 0.5112
 epoch: 34, train_loss: 0.9129, test_loss: 1.1858, test_f1: 0.5091
 epoch: 35, train_loss: 0.8989, test_loss: 1.1881, test_f1: 0.5106
 epoch: 36, train_loss: 0.9053, test_loss: 1.2289, test_f1: 0.5235
 epoch: 37, train_loss: 0.8840, test_loss: 1.2155, test_f1: 0.5160
 epoch: 38, train_loss: 0.8824, test_loss: 1.2188, test_f1: 0.5151
 epoch: 39, train_loss: 0.8834, test_loss: 1.2286, test_f1: 0.5123
 epoch: 40, train_loss: 0.8905, test_loss: 1.2609, test_f1: 0.5081
 epoch: 41, train_loss: 0.8619, test_loss: 1.2716, test_f1: 0.5209
 epoch: 42, train_loss: 0.8646, test_loss: 1.2801, test_f1: 0.5130
 epoch: 43, train_loss: 0.8622, test_loss: 1.2916, test_f1: 0.5270
 epoch: 44, train_loss: 0.8602, test_loss: 1.3555, test_f1: 0.5014
 epoch: 45, train_loss: 0.8407, test_loss: 1.2991, test_f1: 0.5304
 epoch: 46, train_loss: 0.8470, test_loss: 1.2493, test_f1: 0.5338
 epoch: 47, train_loss: 0.8425, test_loss: 1.2323, test_f1: 0.5306
 epoch: 48, train_loss: 0.8355, test_loss: 1.2376, test_f1: 0.5301
 epoch: 49, train_loss: 0.8464, test_loss: 1.2492, test_f1: 0.5282
 epoch: 50, train_loss: 0.8314, test_loss: 1.2553, test_f1: 0.5422
 epoch: 51, train_loss: 0.8275, test_loss: 1.2834, test_f1: 0.5356
 epoch: 52, train_loss: 0.8205, test_loss: 1.3333, test_f1: 0.5269
 epoch: 53, train_loss: 0.8123, test_loss: 1.3361, test_f1: 0.5395
 epoch: 54, train_loss: 0.8105, test_loss: 1.3446, test_f1: 0.5374
 epoch: 55, train_loss: 0.8189, test_loss: 1.2755, test_f1: 0.5124
 epoch: 56, train_loss: 0.8097, test_loss: 1.2928, test_f1: 0.5181
 epoch: 57, train_loss: 0.7998, test_loss: 1.2972, test_f1: 0.5298
 epoch: 58, train_loss: 0.7963, test_loss: 1.3146, test_f1: 0.5380
 epoch: 59, train_loss: 0.8003, test_loss: 1.3747, test_f1: 0.5254
 epoch: 60, train_loss: 0.8006, test_loss: 1.3236, test_f1: 0.5401
 epoch: 61, train_loss: 0.8042, test_loss: 1.3326, test_f1: 0.5380
 epoch: 62, train_loss: 0.7935, test_loss: 1.3448, test_f1: 0.5380
 epoch: 63, train_loss: 0.7958, test_loss: 1.3462, test_f1: 0.5521
 epoch: 64, train_loss: 0.7941, test_loss: 1.3485, test_f1: 0.5514
 epoch: 65, train_loss: 0.7829, test_loss: 1.3378, test_f1: 0.5355
 epoch: 66, train_loss: 0.7832, test_loss: 1.3346, test_f1: 0.5250
 epoch: 67, train_loss: 0.7917, test_loss: 1.3657, test_f1: 0.5307
 epoch: 68, train_loss: 0.7852, test_loss: 1.3840, test_f1: 0.5409
 epoch: 69, train_loss: 0.7702, test_loss: 1.3492, test_f1: 0.5332
 epoch: 70, train_loss: 0.7796, test_loss: 1.3333, test_f1: 0.5224
 epoch: 71, train_loss: 0.7623, test_loss: 1.3111, test_f1: 0.5224
 epoch: 72, train_loss: 0.7694, test_loss: 1.3331, test_f1: 0.5255
 epoch: 73, train_loss: 0.7728, test_loss: 1.3333, test_f1: 0.5329
 epoch: 74, train_loss: 0.7647, test_loss: 1.3583, test_f1: 0.5281
 epoch: 75, train_loss: 0.7706, test_loss: 1.3589, test_f1: 0.5356
 epoch: 76, train_loss: 0.7751, test_loss: 1.3339, test_f1: 0.5272
 epoch: 77, train_loss: 0.7633, test_loss: 1.2886, test_f1: 0.5282
 epoch: 78, train_loss: 0.7674, test_loss: 1.2930, test_f1: 0.5153
 epoch: 79, train_loss: 0.7481, test_loss: 1.3116, test_f1: 0.5093
 epoch: 80, train_loss: 0.7627, test_loss: 1.4045, test_f1: 0.5122
 epoch: 81, train_loss: 0.7524, test_loss: 1.4145, test_f1: 0.5114
 epoch: 82, train_loss: 0.7555, test_loss: 1.3685, test_f1: 0.5343
 epoch: 83, train_loss: 0.7508, test_loss: 1.3717, test_f1: 0.5230
 epoch: 84, train_loss: 0.7494, test_loss: 1.3776, test_f1: 0.5181
 epoch: 85, train_loss: 0.7424, test_loss: 1.4491, test_f1: 0.5124
 epoch: 86, train_loss: 0.7476, test_loss: 1.5451, test_f1: 0.5285
 epoch: 87, train_loss: 0.7441, test_loss: 1.4560, test_f1: 0.5232
 epoch: 88, train_loss: 0.7497, test_loss: 1.4388, test_f1: 0.5165
 epoch: 89, train_loss: 0.7419, test_loss: 1.4653, test_f1: 0.5279
 epoch: 90, train_loss: 0.7469, test_loss: 1.4749, test_f1: 0.5260
 epoch: 91, train_loss: 0.7357, test_loss: 1.4354, test_f1: 0.5161
 epoch: 92, train_loss: 0.7338, test_loss: 1.4714, test_f1: 0.5062
 epoch: 93, train_loss: 0.7302, test_loss: 1.4880, test_f1: 0.5037
 epoch: 94, train_loss: 0.7260, test_loss: 1.4732, test_f1: 0.5114
 epoch: 95, train_loss: 0.7342, test_loss: 1.5038, test_f1: 0.5334
 epoch: 96, train_loss: 0.7200, test_loss: 1.4930, test_f1: 0.5277
 epoch: 97, train_loss: 0.7217, test_loss: 1.4568, test_f1: 0.5171
 epoch: 98, train_loss: 0.7263, test_loss: 1.4626, test_f1: 0.5246
 epoch: 99, train_loss: 0.7202, test_loss: 1.4677, test_f1: 0.5283
##################ITERATION #7 ****************************************
 epoch: 0, train_loss: 1.2932, test_loss: 1.3291, test_f1: 0.2605
 epoch: 1, train_loss: 1.2124, test_loss: 1.3210, test_f1: 0.3094
 epoch: 2, train_loss: 1.1931, test_loss: 1.3089, test_f1: 0.3345
 epoch: 3, train_loss: 1.1686, test_loss: 1.2931, test_f1: 0.3592
 epoch: 4, train_loss: 1.1528, test_loss: 1.2757, test_f1: 0.4037
 epoch: 5, train_loss: 1.1240, test_loss: 1.2550, test_f1: 0.4337
 epoch: 6, train_loss: 1.1233, test_loss: 1.2304, test_f1: 0.4376
 epoch: 7, train_loss: 1.1092, test_loss: 1.2100, test_f1: 0.4680
 epoch: 8, train_loss: 1.0873, test_loss: 1.1934, test_f1: 0.4773
 epoch: 9, train_loss: 1.0757, test_loss: 1.1808, test_f1: 0.4856
 epoch: 10, train_loss: 1.0552, test_loss: 1.1717, test_f1: 0.4846
 epoch: 11, train_loss: 1.0512, test_loss: 1.1626, test_f1: 0.4875
 epoch: 12, train_loss: 1.0403, test_loss: 1.1629, test_f1: 0.4922
 epoch: 13, train_loss: 1.0324, test_loss: 1.1585, test_f1: 0.4985
 epoch: 14, train_loss: 1.0251, test_loss: 1.1612, test_f1: 0.5114
 epoch: 15, train_loss: 1.0117, test_loss: 1.1642, test_f1: 0.5186
 epoch: 16, train_loss: 1.0001, test_loss: 1.1683, test_f1: 0.5066
 epoch: 17, train_loss: 1.0029, test_loss: 1.1770, test_f1: 0.4941
 epoch: 18, train_loss: 0.9827, test_loss: 1.1853, test_f1: 0.5162
 epoch: 19, train_loss: 0.9731, test_loss: 1.1849, test_f1: 0.5354
 epoch: 20, train_loss: 0.9798, test_loss: 1.1787, test_f1: 0.5488
 epoch: 21, train_loss: 0.9597, test_loss: 1.1742, test_f1: 0.5456
 epoch: 22, train_loss: 0.9671, test_loss: 1.1721, test_f1: 0.5348
 epoch: 23, train_loss: 0.9549, test_loss: 1.1754, test_f1: 0.5180
 epoch: 24, train_loss: 0.9367, test_loss: 1.1787, test_f1: 0.5232
 epoch: 25, train_loss: 0.9385, test_loss: 1.1871, test_f1: 0.5069
 epoch: 26, train_loss: 0.9314, test_loss: 1.1879, test_f1: 0.5436
 epoch: 27, train_loss: 0.9282, test_loss: 1.1811, test_f1: 0.5909
 epoch: 28, train_loss: 0.9158, test_loss: 1.1700, test_f1: 0.5822
 epoch: 29, train_loss: 0.9151, test_loss: 1.1544, test_f1: 0.5790
 epoch: 30, train_loss: 0.9057, test_loss: 1.1520, test_f1: 0.5676
 epoch: 31, train_loss: 0.9122, test_loss: 1.1709, test_f1: 0.5441
 epoch: 32, train_loss: 0.9043, test_loss: 1.1745, test_f1: 0.5545
 epoch: 33, train_loss: 0.8780, test_loss: 1.1561, test_f1: 0.5767
 epoch: 34, train_loss: 0.8818, test_loss: 1.1522, test_f1: 0.5561
 epoch: 35, train_loss: 0.8840, test_loss: 1.1481, test_f1: 0.5649
 epoch: 36, train_loss: 0.8649, test_loss: 1.1465, test_f1: 0.5611
 epoch: 37, train_loss: 0.8676, test_loss: 1.1461, test_f1: 0.5507
 epoch: 38, train_loss: 0.8600, test_loss: 1.1409, test_f1: 0.5646
 epoch: 39, train_loss: 0.8507, test_loss: 1.1431, test_f1: 0.5693
 epoch: 40, train_loss: 0.8483, test_loss: 1.1625, test_f1: 0.5600
 epoch: 41, train_loss: 0.8378, test_loss: 1.1806, test_f1: 0.5608
 epoch: 42, train_loss: 0.8529, test_loss: 1.1863, test_f1: 0.5758
 epoch: 43, train_loss: 0.8539, test_loss: 1.1789, test_f1: 0.5562
 epoch: 44, train_loss: 0.8298, test_loss: 1.1888, test_f1: 0.5641
 epoch: 45, train_loss: 0.8355, test_loss: 1.2127, test_f1: 0.5688
 epoch: 46, train_loss: 0.8214, test_loss: 1.2378, test_f1: 0.5560
 epoch: 47, train_loss: 0.8139, test_loss: 1.2235, test_f1: 0.5557
 epoch: 48, train_loss: 0.8224, test_loss: 1.1863, test_f1: 0.5474
 epoch: 49, train_loss: 0.8161, test_loss: 1.2011, test_f1: 0.5505
 epoch: 50, train_loss: 0.8173, test_loss: 1.2128, test_f1: 0.5491
 epoch: 51, train_loss: 0.7971, test_loss: 1.2030, test_f1: 0.5520
 epoch: 52, train_loss: 0.8157, test_loss: 1.2170, test_f1: 0.5605
 epoch: 53, train_loss: 0.7971, test_loss: 1.2446, test_f1: 0.5685
 epoch: 54, train_loss: 0.7897, test_loss: 1.2647, test_f1: 0.5561
 epoch: 55, train_loss: 0.7999, test_loss: 1.2517, test_f1: 0.5634
 epoch: 56, train_loss: 0.7942, test_loss: 1.2545, test_f1: 0.5638
 epoch: 57, train_loss: 0.7920, test_loss: 1.2457, test_f1: 0.5680
 epoch: 58, train_loss: 0.7841, test_loss: 1.2501, test_f1: 0.5673
 epoch: 59, train_loss: 0.7921, test_loss: 1.2449, test_f1: 0.5673
 epoch: 60, train_loss: 0.7818, test_loss: 1.2541, test_f1: 0.5678
 epoch: 61, train_loss: 0.7865, test_loss: 1.2653, test_f1: 0.5315
 epoch: 62, train_loss: 0.7766, test_loss: 1.2379, test_f1: 0.5623
 epoch: 63, train_loss: 0.7869, test_loss: 1.2329, test_f1: 0.5681
 epoch: 64, train_loss: 0.7751, test_loss: 1.2416, test_f1: 0.5637
 epoch: 65, train_loss: 0.7797, test_loss: 1.2499, test_f1: 0.5606
 epoch: 66, train_loss: 0.7715, test_loss: 1.2419, test_f1: 0.5604
 epoch: 67, train_loss: 0.7698, test_loss: 1.2570, test_f1: 0.5693
 epoch: 68, train_loss: 0.7652, test_loss: 1.2756, test_f1: 0.5584
 epoch: 69, train_loss: 0.7617, test_loss: 1.2945, test_f1: 0.5555
 epoch: 70, train_loss: 0.7570, test_loss: 1.2878, test_f1: 0.5641
 epoch: 71, train_loss: 0.7643, test_loss: 1.2716, test_f1: 0.5649
 epoch: 72, train_loss: 0.7593, test_loss: 1.2434, test_f1: 0.5629
 epoch: 73, train_loss: 0.7649, test_loss: 1.2400, test_f1: 0.5736
 epoch: 74, train_loss: 0.7567, test_loss: 1.2473, test_f1: 0.5595
 epoch: 75, train_loss: 0.7432, test_loss: 1.2477, test_f1: 0.5503
 epoch: 76, train_loss: 0.7601, test_loss: 1.2563, test_f1: 0.5552
 epoch: 77, train_loss: 0.7531, test_loss: 1.2694, test_f1: 0.5574
 epoch: 78, train_loss: 0.7493, test_loss: 1.2628, test_f1: 0.5562
 epoch: 79, train_loss: 0.7564, test_loss: 1.2541, test_f1: 0.5681
 epoch: 80, train_loss: 0.7499, test_loss: 1.2492, test_f1: 0.5589
 epoch: 81, train_loss: 0.7447, test_loss: 1.2475, test_f1: 0.5624
 epoch: 82, train_loss: 0.7340, test_loss: 1.2530, test_f1: 0.5600
 epoch: 83, train_loss: 0.7478, test_loss: 1.2657, test_f1: 0.5651
 epoch: 84, train_loss: 0.7385, test_loss: 1.2838, test_f1: 0.5551
 epoch: 85, train_loss: 0.7449, test_loss: 1.2940, test_f1: 0.5577
 epoch: 86, train_loss: 0.7419, test_loss: 1.2641, test_f1: 0.5689
 epoch: 87, train_loss: 0.7207, test_loss: 1.2776, test_f1: 0.5600
 epoch: 88, train_loss: 0.7296, test_loss: 1.2908, test_f1: 0.5483
 epoch: 89, train_loss: 0.7298, test_loss: 1.2831, test_f1: 0.5621
 epoch: 90, train_loss: 0.7165, test_loss: 1.2842, test_f1: 0.5611
 epoch: 91, train_loss: 0.7173, test_loss: 1.3017, test_f1: 0.5622
 epoch: 92, train_loss: 0.7119, test_loss: 1.2833, test_f1: 0.5562
 epoch: 93, train_loss: 0.7133, test_loss: 1.2848, test_f1: 0.5450
 epoch: 94, train_loss: 0.7379, test_loss: 1.2818, test_f1: 0.5461
 epoch: 95, train_loss: 0.7077, test_loss: 1.2859, test_f1: 0.5586
 epoch: 96, train_loss: 0.7096, test_loss: 1.2969, test_f1: 0.5749
 epoch: 97, train_loss: 0.7225, test_loss: 1.3278, test_f1: 0.5653
 epoch: 98, train_loss: 0.7158, test_loss: 1.3511, test_f1: 0.5666
 epoch: 99, train_loss: 0.7166, test_loss: 1.3544, test_f1: 0.5685
##################ITERATION #8 ****************************************
 epoch: 0, train_loss: 1.2530, test_loss: 1.3529, test_f1: 0.1836
 epoch: 1, train_loss: 1.1951, test_loss: 1.3340, test_f1: 0.2140
 epoch: 2, train_loss: 1.1708, test_loss: 1.3193, test_f1: 0.2927
 epoch: 3, train_loss: 1.1474, test_loss: 1.2979, test_f1: 0.3507
 epoch: 4, train_loss: 1.1305, test_loss: 1.2685, test_f1: 0.4180
 epoch: 5, train_loss: 1.1278, test_loss: 1.2384, test_f1: 0.4458
 epoch: 6, train_loss: 1.1109, test_loss: 1.2120, test_f1: 0.4450
 epoch: 7, train_loss: 1.0925, test_loss: 1.1858, test_f1: 0.4599
 epoch: 8, train_loss: 1.0786, test_loss: 1.1794, test_f1: 0.4456
 epoch: 9, train_loss: 1.0536, test_loss: 1.1715, test_f1: 0.4563
 epoch: 10, train_loss: 1.0478, test_loss: 1.1698, test_f1: 0.4793
 epoch: 11, train_loss: 1.0354, test_loss: 1.1739, test_f1: 0.5036
 epoch: 12, train_loss: 1.0382, test_loss: 1.1753, test_f1: 0.5001
 epoch: 13, train_loss: 1.0347, test_loss: 1.1626, test_f1: 0.5139
 epoch: 14, train_loss: 1.0142, test_loss: 1.1429, test_f1: 0.5075
 epoch: 15, train_loss: 1.0127, test_loss: 1.1361, test_f1: 0.5139
 epoch: 16, train_loss: 1.0021, test_loss: 1.1369, test_f1: 0.5114
 epoch: 17, train_loss: 0.9875, test_loss: 1.1340, test_f1: 0.5093
 epoch: 18, train_loss: 0.9818, test_loss: 1.1470, test_f1: 0.4947
 epoch: 19, train_loss: 0.9874, test_loss: 1.1642, test_f1: 0.4880
 epoch: 20, train_loss: 0.9566, test_loss: 1.1646, test_f1: 0.4983
 epoch: 21, train_loss: 0.9699, test_loss: 1.1574, test_f1: 0.5144
 epoch: 22, train_loss: 0.9602, test_loss: 1.1501, test_f1: 0.5120
 epoch: 23, train_loss: 0.9546, test_loss: 1.1435, test_f1: 0.5096
 epoch: 24, train_loss: 0.9486, test_loss: 1.1505, test_f1: 0.4913
 epoch: 25, train_loss: 0.9368, test_loss: 1.1488, test_f1: 0.4933
 epoch: 26, train_loss: 0.9348, test_loss: 1.1468, test_f1: 0.5020
 epoch: 27, train_loss: 0.9342, test_loss: 1.1559, test_f1: 0.5181
 epoch: 28, train_loss: 0.9217, test_loss: 1.1630, test_f1: 0.5235
 epoch: 29, train_loss: 0.9305, test_loss: 1.1693, test_f1: 0.5292
 epoch: 30, train_loss: 0.9177, test_loss: 1.1827, test_f1: 0.5090
 epoch: 31, train_loss: 0.9207, test_loss: 1.1869, test_f1: 0.4934
 epoch: 32, train_loss: 0.8961, test_loss: 1.2154, test_f1: 0.4925
 epoch: 33, train_loss: 0.8996, test_loss: 1.1965, test_f1: 0.4909
 epoch: 34, train_loss: 0.9031, test_loss: 1.2016, test_f1: 0.4703
 epoch: 35, train_loss: 0.8982, test_loss: 1.2116, test_f1: 0.4779
 epoch: 36, train_loss: 0.8822, test_loss: 1.2085, test_f1: 0.4869
 epoch: 37, train_loss: 0.8874, test_loss: 1.1849, test_f1: 0.5006
 epoch: 38, train_loss: 0.8850, test_loss: 1.2060, test_f1: 0.5031
 epoch: 39, train_loss: 0.8694, test_loss: 1.2270, test_f1: 0.5034
 epoch: 40, train_loss: 0.8664, test_loss: 1.2287, test_f1: 0.4961
 epoch: 41, train_loss: 0.8667, test_loss: 1.2284, test_f1: 0.5067
 epoch: 42, train_loss: 0.8614, test_loss: 1.2259, test_f1: 0.5143
 epoch: 43, train_loss: 0.8704, test_loss: 1.2313, test_f1: 0.5141
 epoch: 44, train_loss: 0.8671, test_loss: 1.2840, test_f1: 0.4812
 epoch: 45, train_loss: 0.8467, test_loss: 1.2684, test_f1: 0.4858
 epoch: 46, train_loss: 0.8518, test_loss: 1.2481, test_f1: 0.4894
 epoch: 47, train_loss: 0.8482, test_loss: 1.2318, test_f1: 0.5075
 epoch: 48, train_loss: 0.8321, test_loss: 1.2382, test_f1: 0.5162
 epoch: 49, train_loss: 0.8415, test_loss: 1.2104, test_f1: 0.5302
 epoch: 50, train_loss: 0.8283, test_loss: 1.2105, test_f1: 0.5362
 epoch: 51, train_loss: 0.8365, test_loss: 1.2304, test_f1: 0.5330
 epoch: 52, train_loss: 0.8292, test_loss: 1.2423, test_f1: 0.5298
 epoch: 53, train_loss: 0.8343, test_loss: 1.2580, test_f1: 0.5196
 epoch: 54, train_loss: 0.8180, test_loss: 1.2563, test_f1: 0.5304
 epoch: 55, train_loss: 0.8280, test_loss: 1.2551, test_f1: 0.5277
 epoch: 56, train_loss: 0.8150, test_loss: 1.2687, test_f1: 0.5114
 epoch: 57, train_loss: 0.8234, test_loss: 1.2618, test_f1: 0.5038
 epoch: 58, train_loss: 0.8248, test_loss: 1.2926, test_f1: 0.4932
 epoch: 59, train_loss: 0.8210, test_loss: 1.2718, test_f1: 0.5109
 epoch: 60, train_loss: 0.8098, test_loss: 1.2919, test_f1: 0.5246
 epoch: 61, train_loss: 0.8082, test_loss: 1.2832, test_f1: 0.5274
 epoch: 62, train_loss: 0.8063, test_loss: 1.2891, test_f1: 0.5252
 epoch: 63, train_loss: 0.8162, test_loss: 1.2791, test_f1: 0.5165
 epoch: 64, train_loss: 0.7989, test_loss: 1.2780, test_f1: 0.5252
 epoch: 65, train_loss: 0.8078, test_loss: 1.2691, test_f1: 0.5226
 epoch: 66, train_loss: 0.8045, test_loss: 1.3015, test_f1: 0.5063
 epoch: 67, train_loss: 0.8070, test_loss: 1.3012, test_f1: 0.5200
 epoch: 68, train_loss: 0.8011, test_loss: 1.2937, test_f1: 0.5111
 epoch: 69, train_loss: 0.7934, test_loss: 1.3050, test_f1: 0.5305
 epoch: 70, train_loss: 0.7953, test_loss: 1.2823, test_f1: 0.5329
 epoch: 71, train_loss: 0.7909, test_loss: 1.2862, test_f1: 0.5403
 epoch: 72, train_loss: 0.7861, test_loss: 1.2771, test_f1: 0.5383
 epoch: 73, train_loss: 0.8031, test_loss: 1.2858, test_f1: 0.5226
 epoch: 74, train_loss: 0.7839, test_loss: 1.2898, test_f1: 0.5253
 epoch: 75, train_loss: 0.7941, test_loss: 1.2951, test_f1: 0.5351
 epoch: 76, train_loss: 0.7858, test_loss: 1.2819, test_f1: 0.5322
 epoch: 77, train_loss: 0.8057, test_loss: 1.2901, test_f1: 0.5194
 epoch: 78, train_loss: 0.7822, test_loss: 1.3136, test_f1: 0.5193
 epoch: 79, train_loss: 0.7807, test_loss: 1.3592, test_f1: 0.5035
 epoch: 80, train_loss: 0.7922, test_loss: 1.3776, test_f1: 0.4996
 epoch: 81, train_loss: 0.7849, test_loss: 1.3551, test_f1: 0.5131
 epoch: 82, train_loss: 0.7683, test_loss: 1.3508, test_f1: 0.5194
 epoch: 83, train_loss: 0.7569, test_loss: 1.3464, test_f1: 0.5248
 epoch: 84, train_loss: 0.7652, test_loss: 1.3279, test_f1: 0.5216
 epoch: 85, train_loss: 0.7740, test_loss: 1.3153, test_f1: 0.5345
 epoch: 86, train_loss: 0.7642, test_loss: 1.3280, test_f1: 0.5455
 epoch: 87, train_loss: 0.7738, test_loss: 1.3251, test_f1: 0.5484
 epoch: 88, train_loss: 0.7677, test_loss: 1.3466, test_f1: 0.5440
 epoch: 89, train_loss: 0.7704, test_loss: 1.3227, test_f1: 0.5484
 epoch: 90, train_loss: 0.7616, test_loss: 1.3302, test_f1: 0.5457
 epoch: 91, train_loss: 0.7560, test_loss: 1.3302, test_f1: 0.5419
 epoch: 92, train_loss: 0.7575, test_loss: 1.3365, test_f1: 0.5504
 epoch: 93, train_loss: 0.7656, test_loss: 1.3624, test_f1: 0.5448
 epoch: 94, train_loss: 0.7547, test_loss: 1.3626, test_f1: 0.5558
 epoch: 95, train_loss: 0.7657, test_loss: 1.3848, test_f1: 0.5375
 epoch: 96, train_loss: 0.7685, test_loss: 1.3422, test_f1: 0.5533
 epoch: 97, train_loss: 0.7428, test_loss: 1.3443, test_f1: 0.5477
 epoch: 98, train_loss: 0.7594, test_loss: 1.3795, test_f1: 0.5421
 epoch: 99, train_loss: 0.7546, test_loss: 1.3862, test_f1: 0.5294
##################ITERATION #9 ****************************************
 epoch: 0, train_loss: 1.2376, test_loss: 1.3311, test_f1: 0.2417
 epoch: 1, train_loss: 1.1864, test_loss: 1.3366, test_f1: 0.2964
 epoch: 2, train_loss: 1.1686, test_loss: 1.3315, test_f1: 0.3179
 epoch: 3, train_loss: 1.1553, test_loss: 1.3220, test_f1: 0.3501
 epoch: 4, train_loss: 1.1305, test_loss: 1.3060, test_f1: 0.4062
 epoch: 5, train_loss: 1.1103, test_loss: 1.2813, test_f1: 0.4098
 epoch: 6, train_loss: 1.1184, test_loss: 1.2624, test_f1: 0.4112
 epoch: 7, train_loss: 1.0947, test_loss: 1.2461, test_f1: 0.4319
 epoch: 8, train_loss: 1.0854, test_loss: 1.2348, test_f1: 0.4598
 epoch: 9, train_loss: 1.0743, test_loss: 1.2332, test_f1: 0.4747
 epoch: 10, train_loss: 1.0565, test_loss: 1.2302, test_f1: 0.4798
 epoch: 11, train_loss: 1.0663, test_loss: 1.2347, test_f1: 0.4740
 epoch: 12, train_loss: 1.0459, test_loss: 1.2212, test_f1: 0.4928
 epoch: 13, train_loss: 1.0285, test_loss: 1.2141, test_f1: 0.5118
 epoch: 14, train_loss: 1.0270, test_loss: 1.2050, test_f1: 0.5164
 epoch: 15, train_loss: 1.0274, test_loss: 1.2025, test_f1: 0.5159
 epoch: 16, train_loss: 1.0180, test_loss: 1.2038, test_f1: 0.5151
 epoch: 17, train_loss: 1.0054, test_loss: 1.2075, test_f1: 0.5229
 epoch: 18, train_loss: 1.0023, test_loss: 1.2204, test_f1: 0.5143
 epoch: 19, train_loss: 0.9954, test_loss: 1.2309, test_f1: 0.5325
 epoch: 20, train_loss: 0.9814, test_loss: 1.2343, test_f1: 0.5624
 epoch: 21, train_loss: 0.9886, test_loss: 1.2356, test_f1: 0.5570
 epoch: 22, train_loss: 0.9661, test_loss: 1.2315, test_f1: 0.5433
 epoch: 23, train_loss: 0.9553, test_loss: 1.2105, test_f1: 0.5438
 epoch: 24, train_loss: 0.9539, test_loss: 1.2214, test_f1: 0.5544
 epoch: 25, train_loss: 0.9436, test_loss: 1.2220, test_f1: 0.5516
 epoch: 26, train_loss: 0.9458, test_loss: 1.2169, test_f1: 0.5563
 epoch: 27, train_loss: 0.9394, test_loss: 1.2302, test_f1: 0.5585
 epoch: 28, train_loss: 0.9448, test_loss: 1.2163, test_f1: 0.5667
 epoch: 29, train_loss: 0.9319, test_loss: 1.2334, test_f1: 0.5539
 epoch: 30, train_loss: 0.9228, test_loss: 1.2226, test_f1: 0.5615
 epoch: 31, train_loss: 0.9329, test_loss: 1.2251, test_f1: 0.5664
 epoch: 32, train_loss: 0.9040, test_loss: 1.2360, test_f1: 0.5177
 epoch: 33, train_loss: 0.9101, test_loss: 1.2146, test_f1: 0.5330
 epoch: 34, train_loss: 0.9079, test_loss: 1.2790, test_f1: 0.5145
 epoch: 35, train_loss: 0.8963, test_loss: 1.2729, test_f1: 0.5132
 epoch: 36, train_loss: 0.9011, test_loss: 1.2881, test_f1: 0.5326
 epoch: 37, train_loss: 0.8730, test_loss: 1.3178, test_f1: 0.5268
 epoch: 38, train_loss: 0.8861, test_loss: 1.2843, test_f1: 0.5189
 epoch: 39, train_loss: 0.8805, test_loss: 1.2256, test_f1: 0.5455
 epoch: 40, train_loss: 0.8757, test_loss: 1.2449, test_f1: 0.5230
 epoch: 41, train_loss: 0.8725, test_loss: 1.2501, test_f1: 0.5254
 epoch: 42, train_loss: 0.8673, test_loss: 1.2789, test_f1: 0.5160
 epoch: 43, train_loss: 0.8538, test_loss: 1.3057, test_f1: 0.5160
 epoch: 44, train_loss: 0.8534, test_loss: 1.2804, test_f1: 0.5257
 epoch: 45, train_loss: 0.8459, test_loss: 1.2619, test_f1: 0.5542
 epoch: 46, train_loss: 0.8542, test_loss: 1.2551, test_f1: 0.5309
 epoch: 47, train_loss: 0.8440, test_loss: 1.2792, test_f1: 0.5092
 epoch: 48, train_loss: 0.8355, test_loss: 1.2991, test_f1: 0.5326
 epoch: 49, train_loss: 0.8495, test_loss: 1.2876, test_f1: 0.5367
 epoch: 50, train_loss: 0.8332, test_loss: 1.3304, test_f1: 0.4994
 epoch: 51, train_loss: 0.8337, test_loss: 1.3713, test_f1: 0.5063
 epoch: 52, train_loss: 0.8258, test_loss: 1.4055, test_f1: 0.5184
 epoch: 53, train_loss: 0.8272, test_loss: 1.4043, test_f1: 0.5180
 epoch: 54, train_loss: 0.8315, test_loss: 1.3669, test_f1: 0.5118
 epoch: 55, train_loss: 0.8140, test_loss: 1.3841, test_f1: 0.5201
 epoch: 56, train_loss: 0.8344, test_loss: 1.3692, test_f1: 0.5207
 epoch: 57, train_loss: 0.8173, test_loss: 1.3662, test_f1: 0.5070
 epoch: 58, train_loss: 0.8144, test_loss: 1.3519, test_f1: 0.5292
 epoch: 59, train_loss: 0.8118, test_loss: 1.3401, test_f1: 0.5484
 epoch: 60, train_loss: 0.8009, test_loss: 1.3068, test_f1: 0.5512
 epoch: 61, train_loss: 0.8075, test_loss: 1.3143, test_f1: 0.5238
 epoch: 62, train_loss: 0.8004, test_loss: 1.3112, test_f1: 0.5054
 epoch: 63, train_loss: 0.7956, test_loss: 1.2806, test_f1: 0.5078
 epoch: 64, train_loss: 0.8102, test_loss: 1.3246, test_f1: 0.5084
 epoch: 65, train_loss: 0.7903, test_loss: 1.3331, test_f1: 0.4890
 epoch: 66, train_loss: 0.8061, test_loss: 1.3456, test_f1: 0.4954
 epoch: 67, train_loss: 0.7990, test_loss: 1.3462, test_f1: 0.5122
 epoch: 68, train_loss: 0.7851, test_loss: 1.3589, test_f1: 0.5487
 epoch: 69, train_loss: 0.7867, test_loss: 1.3437, test_f1: 0.5422
 epoch: 70, train_loss: 0.7881, test_loss: 1.3701, test_f1: 0.5110
 epoch: 71, train_loss: 0.7907, test_loss: 1.3741, test_f1: 0.5108
 epoch: 72, train_loss: 0.7925, test_loss: 1.3291, test_f1: 0.5167
 epoch: 73, train_loss: 0.7833, test_loss: 1.3460, test_f1: 0.4936
 epoch: 74, train_loss: 0.7883, test_loss: 1.3485, test_f1: 0.5049
 epoch: 75, train_loss: 0.7917, test_loss: 1.3451, test_f1: 0.5406
 epoch: 76, train_loss: 0.7782, test_loss: 1.3207, test_f1: 0.5344
 epoch: 77, train_loss: 0.7842, test_loss: 1.3643, test_f1: 0.5221
 epoch: 78, train_loss: 0.7798, test_loss: 1.3415, test_f1: 0.5272
 epoch: 79, train_loss: 0.7630, test_loss: 1.3666, test_f1: 0.5359
 epoch: 80, train_loss: 0.7727, test_loss: 1.3129, test_f1: 0.5260
 epoch: 81, train_loss: 0.7662, test_loss: 1.3193, test_f1: 0.5080
 epoch: 82, train_loss: 0.7750, test_loss: 1.3830, test_f1: 0.5044
 epoch: 83, train_loss: 0.7615, test_loss: 1.3548, test_f1: 0.5260
 epoch: 84, train_loss: 0.7615, test_loss: 1.3753, test_f1: 0.5236
 epoch: 85, train_loss: 0.7560, test_loss: 1.3553, test_f1: 0.5402
 epoch: 86, train_loss: 0.7655, test_loss: 1.3718, test_f1: 0.5400
 epoch: 87, train_loss: 0.7576, test_loss: 1.3940, test_f1: 0.5160
 epoch: 88, train_loss: 0.7634, test_loss: 1.4249, test_f1: 0.5191
 epoch: 89, train_loss: 0.7629, test_loss: 1.3960, test_f1: 0.5178
 epoch: 90, train_loss: 0.7605, test_loss: 1.3695, test_f1: 0.5348
 epoch: 91, train_loss: 0.7632, test_loss: 1.3627, test_f1: 0.5276
 epoch: 92, train_loss: 0.7460, test_loss: 1.3595, test_f1: 0.5083
 epoch: 93, train_loss: 0.7545, test_loss: 1.3588, test_f1: 0.4922
 epoch: 94, train_loss: 0.7551, test_loss: 1.3782, test_f1: 0.5145
 epoch: 95, train_loss: 0.7483, test_loss: 1.4176, test_f1: 0.4877
 epoch: 96, train_loss: 0.7420, test_loss: 1.3704, test_f1: 0.5356
 epoch: 97, train_loss: 0.7395, test_loss: 1.3915, test_f1: 0.5607
 epoch: 98, train_loss: 0.7345, test_loss: 1.3505, test_f1: 0.5412
 epoch: 99, train_loss: 0.7445, test_loss: 1.4019, test_f1: 0.5291

Training completed in 327.58 seconds
Best F1: 0.5909 at epoch 27
Mean F1 across iterations: 0.5676  0.0189
========================FINAL RESULTS================================
FEGIN weighted F1: 0.5909  0.0189
python main.py --data ltspice_demos --representation component_component --model FEGIN --layers 2 --hiddens 128 --batch_size 256 --lr 0.0001 --emb_size 128 --epochs 100 --save_appendix component_component_L2_H128_BS256_LR0.0001_E128 --no_val
-----



STDERR:
  File "main.py", line 370, in <module>
    main()
  File "main.py", line 254, in main
    dataset = dataset_class(
  File "/home/philip/projects/ltspice_examples_code_repo/Circuit-Completion-Using-GNNs/component_classification_with_link_prediction_head/evaluation/FEGIN/kernel/circuit_datasets.py", line 15, in __init__
    self.data, self.slices = torch.load(self.processed_paths[0])
  File "/home/philip/.local/lib/python3.8/site-packages/torch/serialization.py", line 1040, in load
    warnings.warn(
  File "/usr/lib/python3.8/warnings.py", line 109, in _showwarnmsg
    sw(msg.message, msg.category, msg.filename, msg.lineno,
  File "main.py", line 47, in warn_with_traceback
    traceback.print_stack(file=log)
/home/philip/projects/ltspice_examples_code_repo/Circuit-Completion-Using-GNNs/component_classification_with_link_prediction_head/evaluation/FEGIN/kernel/circuit_datasets.py:15: FutureWarning: You are using `torch.load` with `weights_only=False` (the current default value), which uses the default pickle module implicitly. It is possible to construct malicious pickle data which will execute arbitrary code during unpickling (See https://github.com/pytorch/pytorch/blob/main/SECURITY.md#untrusted-models for more details). In a future release, the default value for `weights_only` will be flipped to `True`. This limits the functions that could be executed during unpickling. Arbitrary objects will no longer be allowed to be loaded via this mode unless they are explicitly allowlisted by the user via `torch.serialization.add_safe_globals`. We recommend you start setting `weights_only=True` for any use case where you don't have full control of the loaded file. Please open an issue on GitHub for any issues related to this experimental feature.
  self.data, self.slices = torch.load(self.processed_paths[0])
