STDOUT:
Results will be saved in /home/philip/projects/ltspice_examples_code_repo/Circuit-Completion-Using-GNNs/component_classification_with_link_prediction_head/evaluation/FEGIN/results/model_FEGIN_dataset_ltspice_examples
Command line input: python main.py --data ltspice_examples --representation component_component --model FEGIN --layers 5 --hiddens 16 --batch_size 128 --lr 0.001 --emb_size 128 --epochs 100 --save_appendix component_component_L5_H16_BS128_LR0.001_E128 --no_val
 is saved.
-----
ltspice_examples - FEGIN
Using 5 layers, 16 hidden units, h = 2
Loading component_component representation dataset
Loading component_component representation data...
Loaded 4401 examples (component_component)
saving path: data/processed/ltspice_examples_component_component_processed.pt
ENTERED
Training FEGIN on component_component representation
Train: 3556, Test: 845
##################ITERATION #0 ****************************************
 epoch: 0, train_loss: 1.3935, test_loss: 1.3672, test_f1: 0.2220
 epoch: 1, train_loss: 1.3379, test_loss: 1.3258, test_f1: 0.2274
 epoch: 2, train_loss: 1.3098, test_loss: 1.3065, test_f1: 0.2274
 epoch: 3, train_loss: 1.2913, test_loss: 1.2867, test_f1: 0.2274
 epoch: 4, train_loss: 1.2747, test_loss: 1.2706, test_f1: 0.2274
 epoch: 5, train_loss: 1.2617, test_loss: 1.2555, test_f1: 0.2274
 epoch: 6, train_loss: 1.2513, test_loss: 1.2465, test_f1: 0.2274
 epoch: 7, train_loss: 1.2411, test_loss: 1.2292, test_f1: 0.2274
 epoch: 8, train_loss: 1.2326, test_loss: 1.2140, test_f1: 0.2274
 epoch: 9, train_loss: 1.2147, test_loss: 1.2025, test_f1: 0.2898
 epoch: 10, train_loss: 1.2080, test_loss: 1.1831, test_f1: 0.4105
 epoch: 11, train_loss: 1.1953, test_loss: 1.1708, test_f1: 0.4146
 epoch: 12, train_loss: 1.1847, test_loss: 1.1546, test_f1: 0.4464
 epoch: 13, train_loss: 1.1789, test_loss: 1.1449, test_f1: 0.4357
 epoch: 14, train_loss: 1.1765, test_loss: 1.1398, test_f1: 0.4417
 epoch: 15, train_loss: 1.1643, test_loss: 1.1196, test_f1: 0.4642
 epoch: 16, train_loss: 1.1534, test_loss: 1.1141, test_f1: 0.4681
 epoch: 17, train_loss: 1.1458, test_loss: 1.1076, test_f1: 0.4633
 epoch: 18, train_loss: 1.1341, test_loss: 1.0983, test_f1: 0.4536
 epoch: 19, train_loss: 1.1214, test_loss: 1.0924, test_f1: 0.4472
 epoch: 20, train_loss: 1.1305, test_loss: 1.0843, test_f1: 0.4695
 epoch: 21, train_loss: 1.1186, test_loss: 1.0778, test_f1: 0.4760
 epoch: 22, train_loss: 1.1041, test_loss: 1.0819, test_f1: 0.4585
 epoch: 23, train_loss: 1.0978, test_loss: 1.0708, test_f1: 0.4499
 epoch: 24, train_loss: 1.0807, test_loss: 1.0516, test_f1: 0.4510
 epoch: 25, train_loss: 1.0905, test_loss: 1.0614, test_f1: 0.4473
 epoch: 26, train_loss: 1.0629, test_loss: 1.0450, test_f1: 0.4431
 epoch: 27, train_loss: 1.0699, test_loss: 1.0419, test_f1: 0.4394
 epoch: 28, train_loss: 1.0652, test_loss: 1.0690, test_f1: 0.4660
 epoch: 29, train_loss: 1.0602, test_loss: 1.0266, test_f1: 0.4859
 epoch: 30, train_loss: 1.0520, test_loss: 1.0376, test_f1: 0.4761
 epoch: 31, train_loss: 1.0349, test_loss: 1.0259, test_f1: 0.4725
 epoch: 32, train_loss: 1.0252, test_loss: 1.0116, test_f1: 0.4939
 epoch: 33, train_loss: 1.0251, test_loss: 1.0133, test_f1: 0.4665
 epoch: 34, train_loss: 1.0302, test_loss: 1.0240, test_f1: 0.4609
 epoch: 35, train_loss: 1.0091, test_loss: 1.0040, test_f1: 0.4626
 epoch: 36, train_loss: 0.9977, test_loss: 1.0070, test_f1: 0.4744
 epoch: 37, train_loss: 1.0065, test_loss: 1.0080, test_f1: 0.4456
 epoch: 38, train_loss: 0.9949, test_loss: 1.0036, test_f1: 0.4593
 epoch: 39, train_loss: 1.0030, test_loss: 0.9994, test_f1: 0.4713
 epoch: 40, train_loss: 0.9792, test_loss: 0.9965, test_f1: 0.4931
 epoch: 41, train_loss: 0.9712, test_loss: 1.0013, test_f1: 0.4906
 epoch: 42, train_loss: 0.9845, test_loss: 1.0184, test_f1: 0.4592
 epoch: 43, train_loss: 0.9792, test_loss: 0.9707, test_f1: 0.4902
 epoch: 44, train_loss: 0.9793, test_loss: 0.9590, test_f1: 0.4853
 epoch: 45, train_loss: 0.9626, test_loss: 0.9884, test_f1: 0.4735
 epoch: 46, train_loss: 0.9543, test_loss: 1.0160, test_f1: 0.4558
 epoch: 47, train_loss: 0.9468, test_loss: 1.0043, test_f1: 0.4680
 epoch: 48, train_loss: 0.9569, test_loss: 0.9935, test_f1: 0.4835
 epoch: 49, train_loss: 0.9479, test_loss: 1.0335, test_f1: 0.4586
 epoch: 50, train_loss: 0.9379, test_loss: 1.0469, test_f1: 0.4670
 epoch: 51, train_loss: 0.9318, test_loss: 1.0070, test_f1: 0.4830
 epoch: 52, train_loss: 0.9280, test_loss: 1.0090, test_f1: 0.4880
 epoch: 53, train_loss: 0.9347, test_loss: 1.0187, test_f1: 0.4648
 epoch: 54, train_loss: 0.9281, test_loss: 1.0298, test_f1: 0.4414
 epoch: 55, train_loss: 0.9362, test_loss: 1.0135, test_f1: 0.4571
 epoch: 56, train_loss: 0.9155, test_loss: 1.0231, test_f1: 0.4608
 epoch: 57, train_loss: 0.9193, test_loss: 1.0346, test_f1: 0.4713
 epoch: 58, train_loss: 0.9217, test_loss: 1.0349, test_f1: 0.4550
 epoch: 59, train_loss: 0.9056, test_loss: 1.0214, test_f1: 0.4629
 epoch: 60, train_loss: 0.9138, test_loss: 1.0431, test_f1: 0.4645
 epoch: 61, train_loss: 0.9100, test_loss: 1.0590, test_f1: 0.4484
 epoch: 62, train_loss: 0.9054, test_loss: 1.0152, test_f1: 0.4684
 epoch: 63, train_loss: 0.9086, test_loss: 1.0037, test_f1: 0.4676
 epoch: 64, train_loss: 0.9092, test_loss: 0.9965, test_f1: 0.4782
 epoch: 65, train_loss: 0.9072, test_loss: 1.0269, test_f1: 0.4703
 epoch: 66, train_loss: 0.9016, test_loss: 1.0195, test_f1: 0.4649
 epoch: 67, train_loss: 0.8948, test_loss: 0.9927, test_f1: 0.4829
 epoch: 68, train_loss: 0.8992, test_loss: 1.0178, test_f1: 0.4719
 epoch: 69, train_loss: 0.9065, test_loss: 1.0622, test_f1: 0.4622
 epoch: 70, train_loss: 0.8907, test_loss: 1.0947, test_f1: 0.4341
 epoch: 71, train_loss: 0.8980, test_loss: 1.0371, test_f1: 0.4512
 epoch: 72, train_loss: 0.9048, test_loss: 1.0086, test_f1: 0.4809
 epoch: 73, train_loss: 0.8921, test_loss: 1.0584, test_f1: 0.4786
 epoch: 74, train_loss: 0.8973, test_loss: 1.0349, test_f1: 0.4688
 epoch: 75, train_loss: 0.8854, test_loss: 1.0232, test_f1: 0.4635
 epoch: 76, train_loss: 0.8945, test_loss: 1.0009, test_f1: 0.4757
 epoch: 77, train_loss: 0.8950, test_loss: 1.0228, test_f1: 0.4548
 epoch: 78, train_loss: 0.8953, test_loss: 1.0669, test_f1: 0.4645
 epoch: 79, train_loss: 0.8910, test_loss: 1.0307, test_f1: 0.4623
 epoch: 80, train_loss: 0.8900, test_loss: 1.0254, test_f1: 0.4644
 epoch: 81, train_loss: 0.8838, test_loss: 1.0268, test_f1: 0.4589
 epoch: 82, train_loss: 0.8884, test_loss: 1.0422, test_f1: 0.4685
 epoch: 83, train_loss: 0.8976, test_loss: 1.0144, test_f1: 0.4659
 epoch: 84, train_loss: 0.8677, test_loss: 1.0592, test_f1: 0.4404
 epoch: 85, train_loss: 0.8683, test_loss: 1.0481, test_f1: 0.4670
 epoch: 86, train_loss: 0.8857, test_loss: 1.0781, test_f1: 0.4529
 epoch: 87, train_loss: 0.8828, test_loss: 1.0653, test_f1: 0.4613
 epoch: 88, train_loss: 0.8809, test_loss: 1.0427, test_f1: 0.4640
 epoch: 89, train_loss: 0.8833, test_loss: 1.0721, test_f1: 0.4487
 epoch: 90, train_loss: 0.8745, test_loss: 1.0416, test_f1: 0.4632
 epoch: 91, train_loss: 0.8749, test_loss: 1.1122, test_f1: 0.4369
 epoch: 92, train_loss: 0.8576, test_loss: 1.0717, test_f1: 0.4688
 epoch: 93, train_loss: 0.8681, test_loss: 1.0154, test_f1: 0.4649
 epoch: 94, train_loss: 0.8554, test_loss: 1.0500, test_f1: 0.4660
 epoch: 95, train_loss: 0.8652, test_loss: 1.0946, test_f1: 0.4594
 epoch: 96, train_loss: 0.8715, test_loss: 1.0474, test_f1: 0.4574
 epoch: 97, train_loss: 0.8650, test_loss: 1.0156, test_f1: 0.4734
 epoch: 98, train_loss: 0.8600, test_loss: 1.0522, test_f1: 0.4527
 epoch: 99, train_loss: 0.8744, test_loss: 1.0785, test_f1: 0.4674
##################ITERATION #1 ****************************************
 epoch: 0, train_loss: 1.3262, test_loss: 1.3056, test_f1: 0.2274
 epoch: 1, train_loss: 1.2829, test_loss: 1.2837, test_f1: 0.2274
 epoch: 2, train_loss: 1.2678, test_loss: 1.2594, test_f1: 0.2300
 epoch: 3, train_loss: 1.2521, test_loss: 1.2423, test_f1: 0.2900
 epoch: 4, train_loss: 1.2464, test_loss: 1.2317, test_f1: 0.2918
 epoch: 5, train_loss: 1.2336, test_loss: 1.2225, test_f1: 0.2891
 epoch: 6, train_loss: 1.2318, test_loss: 1.2168, test_f1: 0.2767
 epoch: 7, train_loss: 1.2238, test_loss: 1.2112, test_f1: 0.2776
 epoch: 8, train_loss: 1.2107, test_loss: 1.1892, test_f1: 0.3659
 epoch: 9, train_loss: 1.2063, test_loss: 1.1765, test_f1: 0.3918
 epoch: 10, train_loss: 1.1899, test_loss: 1.1606, test_f1: 0.3925
 epoch: 11, train_loss: 1.1828, test_loss: 1.1505, test_f1: 0.4102
 epoch: 12, train_loss: 1.1687, test_loss: 1.1515, test_f1: 0.4166
 epoch: 13, train_loss: 1.1681, test_loss: 1.1399, test_f1: 0.4232
 epoch: 14, train_loss: 1.1544, test_loss: 1.1291, test_f1: 0.4286
 epoch: 15, train_loss: 1.1487, test_loss: 1.1155, test_f1: 0.4294
 epoch: 16, train_loss: 1.1358, test_loss: 1.1393, test_f1: 0.4072
 epoch: 17, train_loss: 1.1210, test_loss: 1.1066, test_f1: 0.4060
 epoch: 18, train_loss: 1.1210, test_loss: 1.0959, test_f1: 0.4266
 epoch: 19, train_loss: 1.1275, test_loss: 1.0758, test_f1: 0.4359
 epoch: 20, train_loss: 1.1140, test_loss: 1.0808, test_f1: 0.4343
 epoch: 21, train_loss: 1.0971, test_loss: 1.0869, test_f1: 0.4240
 epoch: 22, train_loss: 1.0968, test_loss: 1.0625, test_f1: 0.4349
 epoch: 23, train_loss: 1.0867, test_loss: 1.0978, test_f1: 0.4224
 epoch: 24, train_loss: 1.0857, test_loss: 1.0560, test_f1: 0.4408
 epoch: 25, train_loss: 1.0841, test_loss: 1.0959, test_f1: 0.4235
 epoch: 26, train_loss: 1.0766, test_loss: 1.0493, test_f1: 0.4398
 epoch: 27, train_loss: 1.0711, test_loss: 1.0877, test_f1: 0.4416
 epoch: 28, train_loss: 1.0837, test_loss: 1.0452, test_f1: 0.4286
 epoch: 29, train_loss: 1.0633, test_loss: 1.0547, test_f1: 0.4452
 epoch: 30, train_loss: 1.0618, test_loss: 1.0210, test_f1: 0.4582
 epoch: 31, train_loss: 1.0621, test_loss: 1.0308, test_f1: 0.4612
 epoch: 32, train_loss: 1.0572, test_loss: 1.0460, test_f1: 0.4426
 epoch: 33, train_loss: 1.0468, test_loss: 1.0969, test_f1: 0.4306
 epoch: 34, train_loss: 1.0543, test_loss: 1.0248, test_f1: 0.4714
 epoch: 35, train_loss: 1.0387, test_loss: 1.0455, test_f1: 0.4461
 epoch: 36, train_loss: 1.0355, test_loss: 1.0516, test_f1: 0.4413
 epoch: 37, train_loss: 1.0375, test_loss: 1.0134, test_f1: 0.4716
 epoch: 38, train_loss: 1.0290, test_loss: 1.0115, test_f1: 0.4721
 epoch: 39, train_loss: 1.0225, test_loss: 0.9796, test_f1: 0.5014
 epoch: 40, train_loss: 1.0249, test_loss: 0.9943, test_f1: 0.4850
 epoch: 41, train_loss: 1.0200, test_loss: 0.9825, test_f1: 0.4872
 epoch: 42, train_loss: 1.0198, test_loss: 0.9999, test_f1: 0.4733
 epoch: 43, train_loss: 1.0249, test_loss: 1.0279, test_f1: 0.4448
 epoch: 44, train_loss: 1.0067, test_loss: 1.0274, test_f1: 0.4619
 epoch: 45, train_loss: 1.0154, test_loss: 0.9915, test_f1: 0.4669
 epoch: 46, train_loss: 1.0060, test_loss: 0.9693, test_f1: 0.5031
 epoch: 47, train_loss: 0.9982, test_loss: 0.9820, test_f1: 0.4776
 epoch: 48, train_loss: 0.9933, test_loss: 0.9604, test_f1: 0.4947
 epoch: 49, train_loss: 1.0072, test_loss: 0.9656, test_f1: 0.5007
 epoch: 50, train_loss: 0.9994, test_loss: 0.9640, test_f1: 0.4992
 epoch: 51, train_loss: 0.9956, test_loss: 0.9569, test_f1: 0.5012
 epoch: 52, train_loss: 0.9801, test_loss: 0.9565, test_f1: 0.5078
 epoch: 53, train_loss: 0.9768, test_loss: 0.9602, test_f1: 0.5015
 epoch: 54, train_loss: 0.9834, test_loss: 0.9481, test_f1: 0.5039
 epoch: 55, train_loss: 0.9743, test_loss: 0.9459, test_f1: 0.5103
 epoch: 56, train_loss: 0.9778, test_loss: 0.9659, test_f1: 0.4918
 epoch: 57, train_loss: 0.9849, test_loss: 0.9657, test_f1: 0.4869
 epoch: 58, train_loss: 0.9712, test_loss: 0.9573, test_f1: 0.5015
 epoch: 59, train_loss: 0.9661, test_loss: 0.9510, test_f1: 0.4961
 epoch: 60, train_loss: 0.9772, test_loss: 0.9646, test_f1: 0.4920
 epoch: 61, train_loss: 0.9816, test_loss: 0.9647, test_f1: 0.4976
 epoch: 62, train_loss: 0.9628, test_loss: 0.9717, test_f1: 0.4914
 epoch: 63, train_loss: 0.9605, test_loss: 0.9641, test_f1: 0.4922
 epoch: 64, train_loss: 0.9708, test_loss: 0.9645, test_f1: 0.4978
 epoch: 65, train_loss: 0.9693, test_loss: 0.9778, test_f1: 0.4903
 epoch: 66, train_loss: 0.9569, test_loss: 0.9662, test_f1: 0.5040
 epoch: 67, train_loss: 0.9735, test_loss: 0.9521, test_f1: 0.5026
 epoch: 68, train_loss: 0.9685, test_loss: 0.9975, test_f1: 0.4895
 epoch: 69, train_loss: 0.9661, test_loss: 0.9748, test_f1: 0.4883
 epoch: 70, train_loss: 0.9543, test_loss: 0.9667, test_f1: 0.4911
 epoch: 71, train_loss: 0.9532, test_loss: 0.9522, test_f1: 0.4989
 epoch: 72, train_loss: 0.9522, test_loss: 0.9650, test_f1: 0.4884
 epoch: 73, train_loss: 0.9537, test_loss: 0.9867, test_f1: 0.4912
 epoch: 74, train_loss: 0.9457, test_loss: 0.9709, test_f1: 0.4922
 epoch: 75, train_loss: 0.9608, test_loss: 0.9624, test_f1: 0.4887
 epoch: 76, train_loss: 0.9599, test_loss: 0.9632, test_f1: 0.4804
 epoch: 77, train_loss: 0.9469, test_loss: 0.9670, test_f1: 0.4767
 epoch: 78, train_loss: 0.9540, test_loss: 0.9659, test_f1: 0.4949
 epoch: 79, train_loss: 0.9455, test_loss: 0.9557, test_f1: 0.4841
 epoch: 80, train_loss: 0.9357, test_loss: 0.9576, test_f1: 0.4922
 epoch: 81, train_loss: 0.9458, test_loss: 0.9830, test_f1: 0.4910
 epoch: 82, train_loss: 0.9482, test_loss: 0.9483, test_f1: 0.4974
 epoch: 83, train_loss: 0.9396, test_loss: 0.9548, test_f1: 0.4690
 epoch: 84, train_loss: 0.9469, test_loss: 0.9649, test_f1: 0.4749
 epoch: 85, train_loss: 0.9344, test_loss: 0.9590, test_f1: 0.4801
 epoch: 86, train_loss: 0.9458, test_loss: 0.9633, test_f1: 0.4924
 epoch: 87, train_loss: 0.9358, test_loss: 0.9575, test_f1: 0.4935
 epoch: 88, train_loss: 0.9389, test_loss: 0.9704, test_f1: 0.4888
 epoch: 89, train_loss: 0.9317, test_loss: 0.9714, test_f1: 0.5000
 epoch: 90, train_loss: 0.9301, test_loss: 0.9608, test_f1: 0.4952
 epoch: 91, train_loss: 0.9353, test_loss: 0.9863, test_f1: 0.4771
 epoch: 92, train_loss: 0.9382, test_loss: 0.9461, test_f1: 0.5008
 epoch: 93, train_loss: 0.9355, test_loss: 0.9590, test_f1: 0.4894
 epoch: 94, train_loss: 0.9308, test_loss: 0.9712, test_f1: 0.4907
 epoch: 95, train_loss: 0.9401, test_loss: 0.9736, test_f1: 0.4845
 epoch: 96, train_loss: 0.9275, test_loss: 0.9666, test_f1: 0.4730
 epoch: 97, train_loss: 0.9322, test_loss: 0.9637, test_f1: 0.4995
 epoch: 98, train_loss: 0.9340, test_loss: 0.9767, test_f1: 0.4751
 epoch: 99, train_loss: 0.9269, test_loss: 0.9582, test_f1: 0.4935
##################ITERATION #2 ****************************************
 epoch: 0, train_loss: 1.3809, test_loss: 1.3095, test_f1: 0.2274
 epoch: 1, train_loss: 1.2791, test_loss: 1.2586, test_f1: 0.2390
 epoch: 2, train_loss: 1.2582, test_loss: 1.2279, test_f1: 0.2557
 epoch: 3, train_loss: 1.2465, test_loss: 1.2138, test_f1: 0.2703
 epoch: 4, train_loss: 1.2400, test_loss: 1.2030, test_f1: 0.2704
 epoch: 5, train_loss: 1.2331, test_loss: 1.2009, test_f1: 0.2782
 epoch: 6, train_loss: 1.2215, test_loss: 1.1989, test_f1: 0.2945
 epoch: 7, train_loss: 1.2178, test_loss: 1.1936, test_f1: 0.3010
 epoch: 8, train_loss: 1.2117, test_loss: 1.1867, test_f1: 0.3165
 epoch: 9, train_loss: 1.1987, test_loss: 1.1828, test_f1: 0.3361
 epoch: 10, train_loss: 1.1959, test_loss: 1.1785, test_f1: 0.3283
 epoch: 11, train_loss: 1.1898, test_loss: 1.1749, test_f1: 0.3677
 epoch: 12, train_loss: 1.1820, test_loss: 1.1740, test_f1: 0.3702
 epoch: 13, train_loss: 1.1847, test_loss: 1.1783, test_f1: 0.3852
 epoch: 14, train_loss: 1.1721, test_loss: 1.1732, test_f1: 0.3762
 epoch: 15, train_loss: 1.1713, test_loss: 1.1615, test_f1: 0.3930
 epoch: 16, train_loss: 1.1584, test_loss: 1.1443, test_f1: 0.3890
 epoch: 17, train_loss: 1.1400, test_loss: 1.1434, test_f1: 0.3925
 epoch: 18, train_loss: 1.1412, test_loss: 1.1339, test_f1: 0.4048
 epoch: 19, train_loss: 1.1434, test_loss: 1.1117, test_f1: 0.4230
 epoch: 20, train_loss: 1.1378, test_loss: 1.1124, test_f1: 0.4034
 epoch: 21, train_loss: 1.1207, test_loss: 1.1223, test_f1: 0.4250
 epoch: 22, train_loss: 1.1052, test_loss: 1.0813, test_f1: 0.4241
 epoch: 23, train_loss: 1.1074, test_loss: 1.0895, test_f1: 0.4217
 epoch: 24, train_loss: 1.1086, test_loss: 1.0945, test_f1: 0.4170
 epoch: 25, train_loss: 1.0974, test_loss: 1.0760, test_f1: 0.4432
 epoch: 26, train_loss: 1.0828, test_loss: 1.0577, test_f1: 0.4620
 epoch: 27, train_loss: 1.0842, test_loss: 1.0784, test_f1: 0.4293
 epoch: 28, train_loss: 1.0748, test_loss: 1.0717, test_f1: 0.4286
 epoch: 29, train_loss: 1.0663, test_loss: 1.0475, test_f1: 0.4422
 epoch: 30, train_loss: 1.0612, test_loss: 1.0496, test_f1: 0.4443
 epoch: 31, train_loss: 1.0570, test_loss: 1.0405, test_f1: 0.4464
 epoch: 32, train_loss: 1.0556, test_loss: 1.0342, test_f1: 0.4500
 epoch: 33, train_loss: 1.0503, test_loss: 1.0458, test_f1: 0.4397
 epoch: 34, train_loss: 1.0510, test_loss: 1.0379, test_f1: 0.4398
 epoch: 35, train_loss: 1.0248, test_loss: 1.0435, test_f1: 0.4620
 epoch: 36, train_loss: 1.0367, test_loss: 1.0286, test_f1: 0.4402
 epoch: 37, train_loss: 1.0311, test_loss: 1.0292, test_f1: 0.4501
 epoch: 38, train_loss: 1.0179, test_loss: 1.0311, test_f1: 0.4384
 epoch: 39, train_loss: 1.0290, test_loss: 1.0147, test_f1: 0.4540
 epoch: 40, train_loss: 1.0169, test_loss: 1.0403, test_f1: 0.4420
 epoch: 41, train_loss: 1.0157, test_loss: 1.0155, test_f1: 0.4619
 epoch: 42, train_loss: 1.0043, test_loss: 1.0188, test_f1: 0.4525
 epoch: 43, train_loss: 1.0077, test_loss: 1.0196, test_f1: 0.4691
 epoch: 44, train_loss: 0.9959, test_loss: 1.0124, test_f1: 0.4404
 epoch: 45, train_loss: 0.9941, test_loss: 1.0520, test_f1: 0.4484
 epoch: 46, train_loss: 0.9869, test_loss: 0.9989, test_f1: 0.4618
 epoch: 47, train_loss: 0.9929, test_loss: 0.9911, test_f1: 0.4644
 epoch: 48, train_loss: 1.0003, test_loss: 0.9997, test_f1: 0.4915
 epoch: 49, train_loss: 0.9818, test_loss: 1.0355, test_f1: 0.4486
 epoch: 50, train_loss: 0.9811, test_loss: 0.9989, test_f1: 0.4798
 epoch: 51, train_loss: 0.9742, test_loss: 1.0070, test_f1: 0.4643
 epoch: 52, train_loss: 0.9630, test_loss: 0.9935, test_f1: 0.4668
 epoch: 53, train_loss: 0.9528, test_loss: 1.0046, test_f1: 0.4687
 epoch: 54, train_loss: 0.9628, test_loss: 1.0082, test_f1: 0.4789
 epoch: 55, train_loss: 0.9599, test_loss: 1.0068, test_f1: 0.4749
 epoch: 56, train_loss: 0.9513, test_loss: 1.0207, test_f1: 0.4792
 epoch: 57, train_loss: 0.9522, test_loss: 1.0328, test_f1: 0.4898
 epoch: 58, train_loss: 0.9535, test_loss: 1.0247, test_f1: 0.4689
 epoch: 59, train_loss: 0.9596, test_loss: 1.0315, test_f1: 0.4771
 epoch: 60, train_loss: 0.9417, test_loss: 1.0239, test_f1: 0.4724
 epoch: 61, train_loss: 0.9472, test_loss: 1.0157, test_f1: 0.4859
 epoch: 62, train_loss: 0.9418, test_loss: 1.0221, test_f1: 0.4777
 epoch: 63, train_loss: 0.9497, test_loss: 1.0107, test_f1: 0.4800
 epoch: 64, train_loss: 0.9326, test_loss: 1.0051, test_f1: 0.4766
 epoch: 65, train_loss: 0.9327, test_loss: 1.0156, test_f1: 0.4877
 epoch: 66, train_loss: 0.9207, test_loss: 1.0041, test_f1: 0.4865
 epoch: 67, train_loss: 0.9259, test_loss: 0.9974, test_f1: 0.4796
 epoch: 68, train_loss: 0.9430, test_loss: 1.0120, test_f1: 0.4787
 epoch: 69, train_loss: 0.9284, test_loss: 1.0201, test_f1: 0.4734
 epoch: 70, train_loss: 0.9386, test_loss: 1.0234, test_f1: 0.4881
 epoch: 71, train_loss: 0.9427, test_loss: 1.0084, test_f1: 0.4827
 epoch: 72, train_loss: 0.9285, test_loss: 1.0009, test_f1: 0.4891
 epoch: 73, train_loss: 0.9312, test_loss: 1.0433, test_f1: 0.4748
 epoch: 74, train_loss: 0.9337, test_loss: 1.0092, test_f1: 0.4780
 epoch: 75, train_loss: 0.9351, test_loss: 1.0329, test_f1: 0.4828
 epoch: 76, train_loss: 0.9275, test_loss: 1.0383, test_f1: 0.4835
 epoch: 77, train_loss: 0.9285, test_loss: 1.0242, test_f1: 0.4913
 epoch: 78, train_loss: 0.9209, test_loss: 1.0245, test_f1: 0.4740
 epoch: 79, train_loss: 0.9255, test_loss: 1.0277, test_f1: 0.4866
 epoch: 80, train_loss: 0.9320, test_loss: 1.0278, test_f1: 0.4834
 epoch: 81, train_loss: 0.9173, test_loss: 1.0327, test_f1: 0.4841
 epoch: 82, train_loss: 0.9152, test_loss: 1.0354, test_f1: 0.4893
 epoch: 83, train_loss: 0.9167, test_loss: 1.0380, test_f1: 0.4887
 epoch: 84, train_loss: 0.9193, test_loss: 1.0472, test_f1: 0.4950
 epoch: 85, train_loss: 0.9205, test_loss: 1.0533, test_f1: 0.4961
 epoch: 86, train_loss: 0.9153, test_loss: 1.0512, test_f1: 0.4873
 epoch: 87, train_loss: 0.9000, test_loss: 1.0328, test_f1: 0.5049
 epoch: 88, train_loss: 0.9180, test_loss: 1.0320, test_f1: 0.4756
 epoch: 89, train_loss: 0.9006, test_loss: 1.0482, test_f1: 0.4892
 epoch: 90, train_loss: 0.8864, test_loss: 1.0482, test_f1: 0.4922
 epoch: 91, train_loss: 0.9109, test_loss: 1.0436, test_f1: 0.4846
 epoch: 92, train_loss: 0.9159, test_loss: 1.0302, test_f1: 0.4756
 epoch: 93, train_loss: 0.8938, test_loss: 1.0436, test_f1: 0.4883
 epoch: 94, train_loss: 0.8918, test_loss: 1.0641, test_f1: 0.4818
 epoch: 95, train_loss: 0.8882, test_loss: 1.0181, test_f1: 0.4808
 epoch: 96, train_loss: 0.8944, test_loss: 1.0381, test_f1: 0.5101
 epoch: 97, train_loss: 0.8992, test_loss: 1.0586, test_f1: 0.4876
 epoch: 98, train_loss: 0.8807, test_loss: 1.0426, test_f1: 0.4907
 epoch: 99, train_loss: 0.8893, test_loss: 1.0523, test_f1: 0.4778
##################ITERATION #3 ****************************************
 epoch: 0, train_loss: 1.5318, test_loss: 1.2978, test_f1: 0.2869
 epoch: 1, train_loss: 1.3023, test_loss: 1.2837, test_f1: 0.2589
 epoch: 2, train_loss: 1.2674, test_loss: 1.2614, test_f1: 0.2635
 epoch: 3, train_loss: 1.2589, test_loss: 1.2346, test_f1: 0.2697
 epoch: 4, train_loss: 1.2508, test_loss: 1.2221, test_f1: 0.2944
 epoch: 5, train_loss: 1.2377, test_loss: 1.2123, test_f1: 0.3096
 epoch: 6, train_loss: 1.2316, test_loss: 1.1955, test_f1: 0.3246
 epoch: 7, train_loss: 1.2191, test_loss: 1.1933, test_f1: 0.3119
 epoch: 8, train_loss: 1.2067, test_loss: 1.1780, test_f1: 0.3525
 epoch: 9, train_loss: 1.2090, test_loss: 1.1770, test_f1: 0.3520
 epoch: 10, train_loss: 1.1950, test_loss: 1.1650, test_f1: 0.3879
 epoch: 11, train_loss: 1.1840, test_loss: 1.1563, test_f1: 0.3584
 epoch: 12, train_loss: 1.1895, test_loss: 1.1534, test_f1: 0.4017
 epoch: 13, train_loss: 1.1697, test_loss: 1.1405, test_f1: 0.4095
 epoch: 14, train_loss: 1.1749, test_loss: 1.1354, test_f1: 0.4041
 epoch: 15, train_loss: 1.1716, test_loss: 1.1223, test_f1: 0.4172
 epoch: 16, train_loss: 1.1569, test_loss: 1.1147, test_f1: 0.4074
 epoch: 17, train_loss: 1.1524, test_loss: 1.1209, test_f1: 0.4001
 epoch: 18, train_loss: 1.1339, test_loss: 1.1119, test_f1: 0.4082
 epoch: 19, train_loss: 1.1395, test_loss: 1.1129, test_f1: 0.4329
 epoch: 20, train_loss: 1.1264, test_loss: 1.0918, test_f1: 0.4103
 epoch: 21, train_loss: 1.1185, test_loss: 1.0835, test_f1: 0.4289
 epoch: 22, train_loss: 1.1116, test_loss: 1.0694, test_f1: 0.4402
 epoch: 23, train_loss: 1.1026, test_loss: 1.0874, test_f1: 0.4395
 epoch: 24, train_loss: 1.0872, test_loss: 1.0725, test_f1: 0.4437
 epoch: 25, train_loss: 1.0888, test_loss: 1.0667, test_f1: 0.4454
 epoch: 26, train_loss: 1.0948, test_loss: 1.0602, test_f1: 0.4539
 epoch: 27, train_loss: 1.0790, test_loss: 1.0705, test_f1: 0.4396
 epoch: 28, train_loss: 1.0830, test_loss: 1.0553, test_f1: 0.4417
 epoch: 29, train_loss: 1.0597, test_loss: 1.0640, test_f1: 0.4310
 epoch: 30, train_loss: 1.0582, test_loss: 1.0250, test_f1: 0.4642
 epoch: 31, train_loss: 1.0482, test_loss: 1.0320, test_f1: 0.4574
 epoch: 32, train_loss: 1.0435, test_loss: 1.0187, test_f1: 0.4526
 epoch: 33, train_loss: 1.0360, test_loss: 1.0526, test_f1: 0.4836
 epoch: 34, train_loss: 1.0382, test_loss: 1.0457, test_f1: 0.4587
 epoch: 35, train_loss: 1.0337, test_loss: 1.0539, test_f1: 0.4633
 epoch: 36, train_loss: 1.0325, test_loss: 1.0474, test_f1: 0.4811
 epoch: 37, train_loss: 1.0220, test_loss: 1.0495, test_f1: 0.4938
 epoch: 38, train_loss: 1.0365, test_loss: 1.0402, test_f1: 0.4621
 epoch: 39, train_loss: 1.0219, test_loss: 1.0315, test_f1: 0.4664
 epoch: 40, train_loss: 1.0084, test_loss: 1.0433, test_f1: 0.4921
 epoch: 41, train_loss: 1.0108, test_loss: 1.0424, test_f1: 0.4605
 epoch: 42, train_loss: 1.0226, test_loss: 1.0560, test_f1: 0.4744
 epoch: 43, train_loss: 1.0119, test_loss: 1.0338, test_f1: 0.4725
 epoch: 44, train_loss: 0.9962, test_loss: 1.0641, test_f1: 0.4886
 epoch: 45, train_loss: 0.9952, test_loss: 1.0438, test_f1: 0.4677
 epoch: 46, train_loss: 0.9998, test_loss: 1.0984, test_f1: 0.4636
 epoch: 47, train_loss: 0.9913, test_loss: 1.0571, test_f1: 0.4845
 epoch: 48, train_loss: 0.9908, test_loss: 1.0511, test_f1: 0.4684
 epoch: 49, train_loss: 0.9873, test_loss: 1.0814, test_f1: 0.4714
 epoch: 50, train_loss: 0.9800, test_loss: 1.0806, test_f1: 0.5088
 epoch: 51, train_loss: 0.9760, test_loss: 1.0716, test_f1: 0.4793
 epoch: 52, train_loss: 0.9588, test_loss: 1.0666, test_f1: 0.4871
 epoch: 53, train_loss: 0.9625, test_loss: 1.0537, test_f1: 0.4685
 epoch: 54, train_loss: 0.9516, test_loss: 1.0548, test_f1: 0.4887
 epoch: 55, train_loss: 0.9530, test_loss: 1.0481, test_f1: 0.4893
 epoch: 56, train_loss: 0.9578, test_loss: 1.0729, test_f1: 0.4940
 epoch: 57, train_loss: 0.9570, test_loss: 1.0718, test_f1: 0.4822
 epoch: 58, train_loss: 0.9582, test_loss: 1.0738, test_f1: 0.5248
 epoch: 59, train_loss: 0.9540, test_loss: 1.0584, test_f1: 0.5099
 epoch: 60, train_loss: 0.9405, test_loss: 1.0754, test_f1: 0.5137
 epoch: 61, train_loss: 0.9477, test_loss: 1.0703, test_f1: 0.4777
 epoch: 62, train_loss: 0.9443, test_loss: 1.0790, test_f1: 0.5096
 epoch: 63, train_loss: 0.9575, test_loss: 1.0633, test_f1: 0.4874
 epoch: 64, train_loss: 0.9370, test_loss: 1.0855, test_f1: 0.5100
 epoch: 65, train_loss: 0.9416, test_loss: 1.1197, test_f1: 0.4611
 epoch: 66, train_loss: 0.9345, test_loss: 1.0674, test_f1: 0.4805
 epoch: 67, train_loss: 0.9398, test_loss: 1.0891, test_f1: 0.5026
 epoch: 68, train_loss: 0.9311, test_loss: 1.0880, test_f1: 0.4919
 epoch: 69, train_loss: 0.9261, test_loss: 1.0803, test_f1: 0.5058
 epoch: 70, train_loss: 0.9182, test_loss: 1.0748, test_f1: 0.4843
 epoch: 71, train_loss: 0.9289, test_loss: 1.0668, test_f1: 0.4820
 epoch: 72, train_loss: 0.9331, test_loss: 1.0705, test_f1: 0.4923
 epoch: 73, train_loss: 0.9342, test_loss: 1.1199, test_f1: 0.4978
 epoch: 74, train_loss: 0.9294, test_loss: 1.0896, test_f1: 0.4965
 epoch: 75, train_loss: 0.9299, test_loss: 1.0868, test_f1: 0.4923
 epoch: 76, train_loss: 0.9358, test_loss: 1.0863, test_f1: 0.4994
 epoch: 77, train_loss: 0.9273, test_loss: 1.0882, test_f1: 0.4978
 epoch: 78, train_loss: 0.9124, test_loss: 1.0518, test_f1: 0.4955
 epoch: 79, train_loss: 0.9243, test_loss: 1.1349, test_f1: 0.4695
 epoch: 80, train_loss: 0.9151, test_loss: 1.0777, test_f1: 0.4943
 epoch: 81, train_loss: 0.9131, test_loss: 1.0795, test_f1: 0.4864
 epoch: 82, train_loss: 0.9137, test_loss: 1.1096, test_f1: 0.5115
 epoch: 83, train_loss: 0.9185, test_loss: 1.0828, test_f1: 0.4804
 epoch: 84, train_loss: 0.9067, test_loss: 1.1311, test_f1: 0.4947
 epoch: 85, train_loss: 0.9301, test_loss: 1.0908, test_f1: 0.4966
 epoch: 86, train_loss: 0.9086, test_loss: 1.1042, test_f1: 0.5084
 epoch: 87, train_loss: 0.9098, test_loss: 1.0978, test_f1: 0.5209
 epoch: 88, train_loss: 0.9157, test_loss: 1.1120, test_f1: 0.5010
 epoch: 89, train_loss: 0.9137, test_loss: 1.0973, test_f1: 0.4922
 epoch: 90, train_loss: 0.9097, test_loss: 1.1235, test_f1: 0.5144
 epoch: 91, train_loss: 0.9082, test_loss: 1.1033, test_f1: 0.4724
 epoch: 92, train_loss: 0.8987, test_loss: 1.1122, test_f1: 0.4808
 epoch: 93, train_loss: 0.8992, test_loss: 1.1174, test_f1: 0.5094
 epoch: 94, train_loss: 0.9051, test_loss: 1.1137, test_f1: 0.4958
 epoch: 95, train_loss: 0.8939, test_loss: 1.0663, test_f1: 0.5143
 epoch: 96, train_loss: 0.8981, test_loss: 1.1388, test_f1: 0.4957
 epoch: 97, train_loss: 0.8941, test_loss: 1.1325, test_f1: 0.4831
 epoch: 98, train_loss: 0.8970, test_loss: 1.1036, test_f1: 0.5074
 epoch: 99, train_loss: 0.8876, test_loss: 1.1248, test_f1: 0.5062
##################ITERATION #4 ****************************************
 epoch: 0, train_loss: 1.3396, test_loss: 1.2712, test_f1: 0.2274
 epoch: 1, train_loss: 1.2611, test_loss: 1.2234, test_f1: 0.2786
 epoch: 2, train_loss: 1.2421, test_loss: 1.1868, test_f1: 0.3132
 epoch: 3, train_loss: 1.2191, test_loss: 1.1700, test_f1: 0.3621
 epoch: 4, train_loss: 1.2000, test_loss: 1.1452, test_f1: 0.3791
 epoch: 5, train_loss: 1.1826, test_loss: 1.1278, test_f1: 0.3788
 epoch: 6, train_loss: 1.1863, test_loss: 1.1316, test_f1: 0.3854
 epoch: 7, train_loss: 1.1613, test_loss: 1.1117, test_f1: 0.3980
 epoch: 8, train_loss: 1.1516, test_loss: 1.1008, test_f1: 0.4047
 epoch: 9, train_loss: 1.1431, test_loss: 1.0913, test_f1: 0.4172
 epoch: 10, train_loss: 1.1302, test_loss: 1.0848, test_f1: 0.4073
 epoch: 11, train_loss: 1.1272, test_loss: 1.0697, test_f1: 0.4248
 epoch: 12, train_loss: 1.1215, test_loss: 1.0714, test_f1: 0.4325
 epoch: 13, train_loss: 1.1025, test_loss: 1.0499, test_f1: 0.4308
 epoch: 14, train_loss: 1.1003, test_loss: 1.0393, test_f1: 0.4359
 epoch: 15, train_loss: 1.0955, test_loss: 1.0327, test_f1: 0.4408
 epoch: 16, train_loss: 1.0945, test_loss: 1.0302, test_f1: 0.4291
 epoch: 17, train_loss: 1.0775, test_loss: 1.0293, test_f1: 0.4458
 epoch: 18, train_loss: 1.0682, test_loss: 1.0174, test_f1: 0.4370
 epoch: 19, train_loss: 1.0627, test_loss: 1.0280, test_f1: 0.4365
 epoch: 20, train_loss: 1.0574, test_loss: 1.0025, test_f1: 0.4474
 epoch: 21, train_loss: 1.0493, test_loss: 0.9998, test_f1: 0.4248
 epoch: 22, train_loss: 1.0414, test_loss: 0.9994, test_f1: 0.4440
 epoch: 23, train_loss: 1.0334, test_loss: 1.0089, test_f1: 0.4602
 epoch: 24, train_loss: 1.0450, test_loss: 0.9951, test_f1: 0.4586
 epoch: 25, train_loss: 1.0320, test_loss: 1.0141, test_f1: 0.4437
 epoch: 26, train_loss: 1.0353, test_loss: 0.9932, test_f1: 0.4420
 epoch: 27, train_loss: 1.0142, test_loss: 1.0141, test_f1: 0.4456
 epoch: 28, train_loss: 1.0344, test_loss: 0.9930, test_f1: 0.4492
 epoch: 29, train_loss: 1.0222, test_loss: 0.9755, test_f1: 0.4607
 epoch: 30, train_loss: 1.0024, test_loss: 0.9990, test_f1: 0.4546
 epoch: 31, train_loss: 1.0118, test_loss: 0.9864, test_f1: 0.4577
 epoch: 32, train_loss: 0.9971, test_loss: 0.9648, test_f1: 0.4686
 epoch: 33, train_loss: 0.9878, test_loss: 0.9890, test_f1: 0.4614
 epoch: 34, train_loss: 0.9885, test_loss: 0.9735, test_f1: 0.4514
 epoch: 35, train_loss: 0.9887, test_loss: 0.9952, test_f1: 0.4650
 epoch: 36, train_loss: 0.9868, test_loss: 0.9832, test_f1: 0.4702
 epoch: 37, train_loss: 1.0026, test_loss: 0.9791, test_f1: 0.4429
 epoch: 38, train_loss: 0.9889, test_loss: 0.9591, test_f1: 0.4559
 epoch: 39, train_loss: 0.9694, test_loss: 0.9630, test_f1: 0.4796
 epoch: 40, train_loss: 0.9610, test_loss: 0.9770, test_f1: 0.4759
 epoch: 41, train_loss: 0.9633, test_loss: 0.9544, test_f1: 0.4624
 epoch: 42, train_loss: 0.9594, test_loss: 0.9540, test_f1: 0.4834
 epoch: 43, train_loss: 0.9684, test_loss: 0.9866, test_f1: 0.4668
 epoch: 44, train_loss: 0.9633, test_loss: 1.0151, test_f1: 0.4380
 epoch: 45, train_loss: 0.9579, test_loss: 1.0022, test_f1: 0.4637
 epoch: 46, train_loss: 0.9611, test_loss: 0.9512, test_f1: 0.4847
 epoch: 47, train_loss: 0.9440, test_loss: 1.0115, test_f1: 0.4646
 epoch: 48, train_loss: 0.9595, test_loss: 0.9847, test_f1: 0.4727
 epoch: 49, train_loss: 0.9494, test_loss: 0.9507, test_f1: 0.4817
 epoch: 50, train_loss: 0.9391, test_loss: 1.0141, test_f1: 0.4587
 epoch: 51, train_loss: 0.9205, test_loss: 0.9604, test_f1: 0.4625
 epoch: 52, train_loss: 0.9231, test_loss: 0.9946, test_f1: 0.4562
 epoch: 53, train_loss: 0.9241, test_loss: 0.9648, test_f1: 0.4867
 epoch: 54, train_loss: 0.9253, test_loss: 0.9455, test_f1: 0.4765
 epoch: 55, train_loss: 0.9219, test_loss: 0.9529, test_f1: 0.4697
 epoch: 56, train_loss: 0.9284, test_loss: 0.9737, test_f1: 0.4680
 epoch: 57, train_loss: 0.9102, test_loss: 0.9642, test_f1: 0.4808
 epoch: 58, train_loss: 0.9240, test_loss: 0.9547, test_f1: 0.4838
 epoch: 59, train_loss: 0.9073, test_loss: 0.9719, test_f1: 0.4890
 epoch: 60, train_loss: 0.9093, test_loss: 0.9844, test_f1: 0.4789
 epoch: 61, train_loss: 0.9118, test_loss: 0.9821, test_f1: 0.4880
 epoch: 62, train_loss: 0.9176, test_loss: 0.9537, test_f1: 0.4773
 epoch: 63, train_loss: 0.9054, test_loss: 0.9861, test_f1: 0.4883
 epoch: 64, train_loss: 0.8919, test_loss: 0.9666, test_f1: 0.4670
 epoch: 65, train_loss: 0.9049, test_loss: 0.9906, test_f1: 0.4775
 epoch: 66, train_loss: 0.8993, test_loss: 0.9582, test_f1: 0.4769
 epoch: 67, train_loss: 0.8961, test_loss: 0.9725, test_f1: 0.4829
 epoch: 68, train_loss: 0.8937, test_loss: 0.9607, test_f1: 0.4777
 epoch: 69, train_loss: 0.9019, test_loss: 0.9555, test_f1: 0.4849
 epoch: 70, train_loss: 0.8969, test_loss: 0.9894, test_f1: 0.4817
 epoch: 71, train_loss: 0.9038, test_loss: 0.9533, test_f1: 0.4743
 epoch: 72, train_loss: 0.8971, test_loss: 0.9784, test_f1: 0.4637
 epoch: 73, train_loss: 0.8955, test_loss: 0.9692, test_f1: 0.4736
 epoch: 74, train_loss: 0.8898, test_loss: 0.9498, test_f1: 0.4949
 epoch: 75, train_loss: 0.8855, test_loss: 0.9763, test_f1: 0.4907
 epoch: 76, train_loss: 0.8807, test_loss: 0.9812, test_f1: 0.4758
 epoch: 77, train_loss: 0.8961, test_loss: 0.9676, test_f1: 0.4780
 epoch: 78, train_loss: 0.8882, test_loss: 0.9867, test_f1: 0.4892
 epoch: 79, train_loss: 0.8829, test_loss: 0.9644, test_f1: 0.4732
 epoch: 80, train_loss: 0.8926, test_loss: 0.9548, test_f1: 0.4889
 epoch: 81, train_loss: 0.8797, test_loss: 0.9859, test_f1: 0.4782
 epoch: 82, train_loss: 0.8777, test_loss: 0.9656, test_f1: 0.4906
 epoch: 83, train_loss: 0.8738, test_loss: 0.9607, test_f1: 0.4936
 epoch: 84, train_loss: 0.8787, test_loss: 0.9651, test_f1: 0.4916
 epoch: 85, train_loss: 0.8816, test_loss: 0.9993, test_f1: 0.4833
 epoch: 86, train_loss: 0.8814, test_loss: 0.9368, test_f1: 0.4994
 epoch: 87, train_loss: 0.8673, test_loss: 1.0069, test_f1: 0.4893
 epoch: 88, train_loss: 0.8659, test_loss: 0.9678, test_f1: 0.4995
 epoch: 89, train_loss: 0.8677, test_loss: 0.9615, test_f1: 0.5012
 epoch: 90, train_loss: 0.8721, test_loss: 0.9753, test_f1: 0.4944
 epoch: 91, train_loss: 0.8519, test_loss: 0.9722, test_f1: 0.4643
 epoch: 92, train_loss: 0.8686, test_loss: 0.9951, test_f1: 0.4724
 epoch: 93, train_loss: 0.8710, test_loss: 0.9906, test_f1: 0.4914
 epoch: 94, train_loss: 0.8665, test_loss: 0.9890, test_f1: 0.4698
 epoch: 95, train_loss: 0.8730, test_loss: 0.9916, test_f1: 0.4824
 epoch: 96, train_loss: 0.8683, test_loss: 1.0037, test_f1: 0.4963
 epoch: 97, train_loss: 0.8628, test_loss: 0.9924, test_f1: 0.5021
 epoch: 98, train_loss: 0.8475, test_loss: 0.9799, test_f1: 0.4924
 epoch: 99, train_loss: 0.8668, test_loss: 0.9990, test_f1: 0.4906
##################ITERATION #5 ****************************************
 epoch: 0, train_loss: 1.4452, test_loss: 1.3272, test_f1: 0.2417
 epoch: 1, train_loss: 1.3112, test_loss: 1.2510, test_f1: 0.2918
 epoch: 2, train_loss: 1.2731, test_loss: 1.2289, test_f1: 0.2972
 epoch: 3, train_loss: 1.2481, test_loss: 1.1989, test_f1: 0.3047
 epoch: 4, train_loss: 1.2364, test_loss: 1.1955, test_f1: 0.3426
 epoch: 5, train_loss: 1.2223, test_loss: 1.1824, test_f1: 0.3136
 epoch: 6, train_loss: 1.2212, test_loss: 1.1706, test_f1: 0.3364
 epoch: 7, train_loss: 1.2206, test_loss: 1.1629, test_f1: 0.3331
 epoch: 8, train_loss: 1.2029, test_loss: 1.1509, test_f1: 0.3530
 epoch: 9, train_loss: 1.1946, test_loss: 1.1427, test_f1: 0.3399
 epoch: 10, train_loss: 1.1956, test_loss: 1.1344, test_f1: 0.3730
 epoch: 11, train_loss: 1.1797, test_loss: 1.1298, test_f1: 0.4120
 epoch: 12, train_loss: 1.1723, test_loss: 1.1216, test_f1: 0.4174
 epoch: 13, train_loss: 1.1649, test_loss: 1.1119, test_f1: 0.3979
 epoch: 14, train_loss: 1.1643, test_loss: 1.1055, test_f1: 0.3972
 epoch: 15, train_loss: 1.1552, test_loss: 1.0948, test_f1: 0.4075
 epoch: 16, train_loss: 1.1472, test_loss: 1.0903, test_f1: 0.4310
 epoch: 17, train_loss: 1.1470, test_loss: 1.0812, test_f1: 0.4218
 epoch: 18, train_loss: 1.1357, test_loss: 1.0714, test_f1: 0.4331
 epoch: 19, train_loss: 1.1320, test_loss: 1.0608, test_f1: 0.4322
 epoch: 20, train_loss: 1.1215, test_loss: 1.0540, test_f1: 0.4313
 epoch: 21, train_loss: 1.1149, test_loss: 1.0465, test_f1: 0.4375
 epoch: 22, train_loss: 1.1192, test_loss: 1.0288, test_f1: 0.4452
 epoch: 23, train_loss: 1.1061, test_loss: 1.0337, test_f1: 0.4447
 epoch: 24, train_loss: 1.0953, test_loss: 1.0157, test_f1: 0.4505
 epoch: 25, train_loss: 1.0896, test_loss: 1.0101, test_f1: 0.4743
 epoch: 26, train_loss: 1.0893, test_loss: 1.0075, test_f1: 0.4820
 epoch: 27, train_loss: 1.0867, test_loss: 1.0059, test_f1: 0.4724
 epoch: 28, train_loss: 1.0749, test_loss: 0.9878, test_f1: 0.5038
 epoch: 29, train_loss: 1.0714, test_loss: 0.9902, test_f1: 0.4696
 epoch: 30, train_loss: 1.0680, test_loss: 0.9772, test_f1: 0.4812
 epoch: 31, train_loss: 1.0555, test_loss: 0.9613, test_f1: 0.4822
 epoch: 32, train_loss: 1.0540, test_loss: 0.9655, test_f1: 0.4636
 epoch: 33, train_loss: 1.0547, test_loss: 0.9560, test_f1: 0.4966
 epoch: 34, train_loss: 1.0473, test_loss: 0.9522, test_f1: 0.4833
 epoch: 35, train_loss: 1.0445, test_loss: 0.9743, test_f1: 0.4772
 epoch: 36, train_loss: 1.0273, test_loss: 0.9453, test_f1: 0.4827
 epoch: 37, train_loss: 1.0353, test_loss: 0.9486, test_f1: 0.4863
 epoch: 38, train_loss: 1.0148, test_loss: 0.9508, test_f1: 0.4746
 epoch: 39, train_loss: 1.0158, test_loss: 0.9496, test_f1: 0.4702
 epoch: 40, train_loss: 1.0183, test_loss: 0.9543, test_f1: 0.4926
 epoch: 41, train_loss: 1.0153, test_loss: 0.9332, test_f1: 0.5165
 epoch: 42, train_loss: 1.0199, test_loss: 0.9441, test_f1: 0.5002
 epoch: 43, train_loss: 1.0038, test_loss: 0.9362, test_f1: 0.5050
 epoch: 44, train_loss: 0.9955, test_loss: 0.9171, test_f1: 0.5245
 epoch: 45, train_loss: 1.0001, test_loss: 0.9329, test_f1: 0.4995
 epoch: 46, train_loss: 0.9965, test_loss: 0.9482, test_f1: 0.4892
 epoch: 47, train_loss: 0.9887, test_loss: 0.9582, test_f1: 0.5070
 epoch: 48, train_loss: 0.9909, test_loss: 0.9232, test_f1: 0.4981
 epoch: 49, train_loss: 0.9847, test_loss: 0.9129, test_f1: 0.4821
 epoch: 50, train_loss: 0.9814, test_loss: 0.9239, test_f1: 0.5136
 epoch: 51, train_loss: 0.9786, test_loss: 0.9063, test_f1: 0.5034
 epoch: 52, train_loss: 0.9670, test_loss: 0.9088, test_f1: 0.4911
 epoch: 53, train_loss: 0.9627, test_loss: 0.9168, test_f1: 0.4869
 epoch: 54, train_loss: 0.9622, test_loss: 0.9113, test_f1: 0.4929
 epoch: 55, train_loss: 0.9631, test_loss: 0.9183, test_f1: 0.5145
 epoch: 56, train_loss: 0.9555, test_loss: 0.9219, test_f1: 0.5255
 epoch: 57, train_loss: 0.9586, test_loss: 0.9029, test_f1: 0.5052
 epoch: 58, train_loss: 0.9581, test_loss: 0.9272, test_f1: 0.4812
 epoch: 59, train_loss: 0.9550, test_loss: 0.9093, test_f1: 0.4920
 epoch: 60, train_loss: 0.9522, test_loss: 0.9164, test_f1: 0.4901
 epoch: 61, train_loss: 0.9511, test_loss: 0.9204, test_f1: 0.4934
 epoch: 62, train_loss: 0.9521, test_loss: 0.9082, test_f1: 0.5292
 epoch: 63, train_loss: 0.9512, test_loss: 0.9131, test_f1: 0.5088
 epoch: 64, train_loss: 0.9353, test_loss: 0.9251, test_f1: 0.4939
 epoch: 65, train_loss: 0.9473, test_loss: 0.9084, test_f1: 0.5011
 epoch: 66, train_loss: 0.9375, test_loss: 0.9184, test_f1: 0.4929
 epoch: 67, train_loss: 0.9362, test_loss: 0.9238, test_f1: 0.4894
 epoch: 68, train_loss: 0.9468, test_loss: 0.9167, test_f1: 0.5005
 epoch: 69, train_loss: 0.9423, test_loss: 0.9098, test_f1: 0.4993
 epoch: 70, train_loss: 0.9395, test_loss: 0.9125, test_f1: 0.5036
 epoch: 71, train_loss: 0.9412, test_loss: 0.9171, test_f1: 0.4976
 epoch: 72, train_loss: 0.9301, test_loss: 0.8895, test_f1: 0.5254
 epoch: 73, train_loss: 0.9315, test_loss: 0.9284, test_f1: 0.5061
 epoch: 74, train_loss: 0.9236, test_loss: 0.9187, test_f1: 0.4961
 epoch: 75, train_loss: 0.9286, test_loss: 0.9009, test_f1: 0.5069
 epoch: 76, train_loss: 0.9261, test_loss: 0.9152, test_f1: 0.5019
 epoch: 77, train_loss: 0.9290, test_loss: 0.9097, test_f1: 0.5028
 epoch: 78, train_loss: 0.9211, test_loss: 0.9233, test_f1: 0.4961
 epoch: 79, train_loss: 0.9241, test_loss: 0.9107, test_f1: 0.4857
 epoch: 80, train_loss: 0.9273, test_loss: 0.9107, test_f1: 0.5073
 epoch: 81, train_loss: 0.9255, test_loss: 0.9009, test_f1: 0.5142
 epoch: 82, train_loss: 0.9242, test_loss: 0.9019, test_f1: 0.5066
 epoch: 83, train_loss: 0.9127, test_loss: 0.9153, test_f1: 0.4976
 epoch: 84, train_loss: 0.9123, test_loss: 0.9108, test_f1: 0.4942
 epoch: 85, train_loss: 0.9085, test_loss: 0.9140, test_f1: 0.5056
 epoch: 86, train_loss: 0.9074, test_loss: 0.9097, test_f1: 0.5075
 epoch: 87, train_loss: 0.9110, test_loss: 0.9189, test_f1: 0.4886
 epoch: 88, train_loss: 0.9059, test_loss: 0.9183, test_f1: 0.5186
 epoch: 89, train_loss: 0.9017, test_loss: 0.9244, test_f1: 0.4953
 epoch: 90, train_loss: 0.9010, test_loss: 0.9000, test_f1: 0.5294
 epoch: 91, train_loss: 0.9078, test_loss: 0.9237, test_f1: 0.5032
 epoch: 92, train_loss: 0.9116, test_loss: 0.9115, test_f1: 0.5054
 epoch: 93, train_loss: 0.9044, test_loss: 0.9160, test_f1: 0.5188
 epoch: 94, train_loss: 0.9111, test_loss: 0.9064, test_f1: 0.5312
 epoch: 95, train_loss: 0.9030, test_loss: 0.9194, test_f1: 0.5093
 epoch: 96, train_loss: 0.9002, test_loss: 0.9170, test_f1: 0.5095
 epoch: 97, train_loss: 0.9002, test_loss: 0.9270, test_f1: 0.5031
 epoch: 98, train_loss: 0.8933, test_loss: 0.9225, test_f1: 0.4913
 epoch: 99, train_loss: 0.8972, test_loss: 0.9078, test_f1: 0.5147
##################ITERATION #6 ****************************************
 epoch: 0, train_loss: 1.4481, test_loss: 1.2851, test_f1: 0.2555
 epoch: 1, train_loss: 1.2766, test_loss: 1.2371, test_f1: 0.3178
 epoch: 2, train_loss: 1.2491, test_loss: 1.2140, test_f1: 0.3621
 epoch: 3, train_loss: 1.2236, test_loss: 1.1982, test_f1: 0.3693
 epoch: 4, train_loss: 1.2229, test_loss: 1.1893, test_f1: 0.3822
 epoch: 5, train_loss: 1.2032, test_loss: 1.1801, test_f1: 0.4089
 epoch: 6, train_loss: 1.1958, test_loss: 1.1678, test_f1: 0.4136
 epoch: 7, train_loss: 1.1890, test_loss: 1.1518, test_f1: 0.4074
 epoch: 8, train_loss: 1.1858, test_loss: 1.1438, test_f1: 0.4401
 epoch: 9, train_loss: 1.1788, test_loss: 1.1337, test_f1: 0.4482
 epoch: 10, train_loss: 1.1561, test_loss: 1.1179, test_f1: 0.4257
 epoch: 11, train_loss: 1.1605, test_loss: 1.1217, test_f1: 0.4088
 epoch: 12, train_loss: 1.1452, test_loss: 1.1070, test_f1: 0.4330
 epoch: 13, train_loss: 1.1267, test_loss: 1.0895, test_f1: 0.4184
 epoch: 14, train_loss: 1.1288, test_loss: 1.0868, test_f1: 0.4543
 epoch: 15, train_loss: 1.1197, test_loss: 1.0704, test_f1: 0.4752
 epoch: 16, train_loss: 1.1161, test_loss: 1.0837, test_f1: 0.4363
 epoch: 17, train_loss: 1.1022, test_loss: 1.0554, test_f1: 0.4304
 epoch: 18, train_loss: 1.0973, test_loss: 1.0556, test_f1: 0.4421
 epoch: 19, train_loss: 1.0932, test_loss: 1.0429, test_f1: 0.4414
 epoch: 20, train_loss: 1.0813, test_loss: 1.0391, test_f1: 0.4841
 epoch: 21, train_loss: 1.0803, test_loss: 1.0320, test_f1: 0.4510
 epoch: 22, train_loss: 1.0663, test_loss: 1.0328, test_f1: 0.4563
 epoch: 23, train_loss: 1.0552, test_loss: 1.0243, test_f1: 0.4532
 epoch: 24, train_loss: 1.0537, test_loss: 1.0303, test_f1: 0.4756
 epoch: 25, train_loss: 1.0552, test_loss: 1.0180, test_f1: 0.4762
 epoch: 26, train_loss: 1.0351, test_loss: 1.0173, test_f1: 0.4651
 epoch: 27, train_loss: 1.0395, test_loss: 1.0067, test_f1: 0.4847
 epoch: 28, train_loss: 1.0351, test_loss: 0.9991, test_f1: 0.4740
 epoch: 29, train_loss: 1.0387, test_loss: 0.9964, test_f1: 0.4751
 epoch: 30, train_loss: 1.0184, test_loss: 0.9895, test_f1: 0.4772
 epoch: 31, train_loss: 1.0139, test_loss: 0.9944, test_f1: 0.4808
 epoch: 32, train_loss: 0.9989, test_loss: 1.0005, test_f1: 0.4746
 epoch: 33, train_loss: 1.0005, test_loss: 0.9818, test_f1: 0.4891
 epoch: 34, train_loss: 0.9961, test_loss: 1.0084, test_f1: 0.4930
 epoch: 35, train_loss: 0.9933, test_loss: 1.0004, test_f1: 0.4777
 epoch: 36, train_loss: 0.9865, test_loss: 0.9911, test_f1: 0.5070
 epoch: 37, train_loss: 0.9898, test_loss: 0.9944, test_f1: 0.4906
 epoch: 38, train_loss: 0.9880, test_loss: 0.9881, test_f1: 0.4903
 epoch: 39, train_loss: 0.9907, test_loss: 0.9945, test_f1: 0.4750
 epoch: 40, train_loss: 0.9708, test_loss: 0.9934, test_f1: 0.4885
 epoch: 41, train_loss: 0.9779, test_loss: 0.9861, test_f1: 0.4900
 epoch: 42, train_loss: 0.9645, test_loss: 0.9885, test_f1: 0.4948
 epoch: 43, train_loss: 0.9662, test_loss: 0.9891, test_f1: 0.4886
 epoch: 44, train_loss: 0.9641, test_loss: 0.9826, test_f1: 0.4715
 epoch: 45, train_loss: 0.9599, test_loss: 0.9725, test_f1: 0.4826
 epoch: 46, train_loss: 0.9658, test_loss: 0.9926, test_f1: 0.5010
 epoch: 47, train_loss: 0.9408, test_loss: 1.0009, test_f1: 0.4887
 epoch: 48, train_loss: 0.9594, test_loss: 0.9688, test_f1: 0.5166
 epoch: 49, train_loss: 0.9454, test_loss: 0.9752, test_f1: 0.5088
 epoch: 50, train_loss: 0.9518, test_loss: 0.9799, test_f1: 0.4963
 epoch: 51, train_loss: 0.9347, test_loss: 0.9683, test_f1: 0.4958
 epoch: 52, train_loss: 0.9340, test_loss: 0.9736, test_f1: 0.4843
 epoch: 53, train_loss: 0.9351, test_loss: 0.9848, test_f1: 0.4963
 epoch: 54, train_loss: 0.9376, test_loss: 0.9750, test_f1: 0.5079
 epoch: 55, train_loss: 0.9265, test_loss: 0.9626, test_f1: 0.4916
 epoch: 56, train_loss: 0.9286, test_loss: 0.9629, test_f1: 0.5005
 epoch: 57, train_loss: 0.9253, test_loss: 0.9605, test_f1: 0.4819
 epoch: 58, train_loss: 0.9276, test_loss: 0.9576, test_f1: 0.5042
 epoch: 59, train_loss: 0.9159, test_loss: 0.9798, test_f1: 0.4926
 epoch: 60, train_loss: 0.9266, test_loss: 0.9575, test_f1: 0.5036
 epoch: 61, train_loss: 0.9281, test_loss: 0.9701, test_f1: 0.5019
 epoch: 62, train_loss: 0.9323, test_loss: 0.9564, test_f1: 0.5042
 epoch: 63, train_loss: 0.9211, test_loss: 0.9649, test_f1: 0.4896
 epoch: 64, train_loss: 0.9160, test_loss: 0.9497, test_f1: 0.5126
 epoch: 65, train_loss: 0.9113, test_loss: 0.9462, test_f1: 0.4984
 epoch: 66, train_loss: 0.9142, test_loss: 0.9547, test_f1: 0.5024
 epoch: 67, train_loss: 0.9214, test_loss: 0.9647, test_f1: 0.5212
 epoch: 68, train_loss: 0.9250, test_loss: 0.9700, test_f1: 0.5117
 epoch: 69, train_loss: 0.9137, test_loss: 0.9663, test_f1: 0.4995
 epoch: 70, train_loss: 0.9180, test_loss: 0.9687, test_f1: 0.4951
 epoch: 71, train_loss: 0.9098, test_loss: 0.9828, test_f1: 0.4955
 epoch: 72, train_loss: 0.9090, test_loss: 0.9745, test_f1: 0.4919
 epoch: 73, train_loss: 0.9030, test_loss: 0.9789, test_f1: 0.5083
 epoch: 74, train_loss: 0.9019, test_loss: 1.0297, test_f1: 0.4776
 epoch: 75, train_loss: 0.9047, test_loss: 0.9816, test_f1: 0.4982
 epoch: 76, train_loss: 0.9019, test_loss: 0.9556, test_f1: 0.5161
 epoch: 77, train_loss: 0.8997, test_loss: 0.9719, test_f1: 0.5071
 epoch: 78, train_loss: 0.8951, test_loss: 0.9727, test_f1: 0.5049
 epoch: 79, train_loss: 0.8924, test_loss: 0.9578, test_f1: 0.4998
 epoch: 80, train_loss: 0.9047, test_loss: 0.9741, test_f1: 0.5008
 epoch: 81, train_loss: 0.9047, test_loss: 0.9798, test_f1: 0.4877
 epoch: 82, train_loss: 0.9044, test_loss: 0.9895, test_f1: 0.5034
 epoch: 83, train_loss: 0.8941, test_loss: 0.9645, test_f1: 0.5141
 epoch: 84, train_loss: 0.8958, test_loss: 1.0008, test_f1: 0.5009
 epoch: 85, train_loss: 0.8988, test_loss: 0.9978, test_f1: 0.4976
 epoch: 86, train_loss: 0.8956, test_loss: 0.9364, test_f1: 0.5148
 epoch: 87, train_loss: 0.8985, test_loss: 0.9721, test_f1: 0.5138
 epoch: 88, train_loss: 0.8931, test_loss: 0.9893, test_f1: 0.5001
 epoch: 89, train_loss: 0.8789, test_loss: 0.9927, test_f1: 0.4885
 epoch: 90, train_loss: 0.8862, test_loss: 0.9745, test_f1: 0.4940
 epoch: 91, train_loss: 0.8966, test_loss: 0.9959, test_f1: 0.4891
 epoch: 92, train_loss: 0.8856, test_loss: 0.9806, test_f1: 0.4948
 epoch: 93, train_loss: 0.8889, test_loss: 0.9828, test_f1: 0.4901
 epoch: 94, train_loss: 0.9030, test_loss: 0.9920, test_f1: 0.4937
 epoch: 95, train_loss: 0.8774, test_loss: 0.9923, test_f1: 0.4955
 epoch: 96, train_loss: 0.8786, test_loss: 0.9856, test_f1: 0.5047
 epoch: 97, train_loss: 0.8740, test_loss: 0.9754, test_f1: 0.5005
 epoch: 98, train_loss: 0.8833, test_loss: 0.9622, test_f1: 0.5044
 epoch: 99, train_loss: 0.8819, test_loss: 0.9931, test_f1: 0.4926
##################ITERATION #7 ****************************************
 epoch: 0, train_loss: 1.4290, test_loss: 1.2759, test_f1: 0.2351
 epoch: 1, train_loss: 1.2637, test_loss: 1.2032, test_f1: 0.3094
 epoch: 2, train_loss: 1.2453, test_loss: 1.1745, test_f1: 0.3857
 epoch: 3, train_loss: 1.2159, test_loss: 1.1474, test_f1: 0.4464
 epoch: 4, train_loss: 1.1979, test_loss: 1.1456, test_f1: 0.4321
 epoch: 5, train_loss: 1.1868, test_loss: 1.1403, test_f1: 0.4285
 epoch: 6, train_loss: 1.1698, test_loss: 1.1250, test_f1: 0.4458
 epoch: 7, train_loss: 1.1550, test_loss: 1.0839, test_f1: 0.4727
 epoch: 8, train_loss: 1.1496, test_loss: 1.0794, test_f1: 0.4570
 epoch: 9, train_loss: 1.1409, test_loss: 1.1049, test_f1: 0.4604
 epoch: 10, train_loss: 1.1332, test_loss: 1.0692, test_f1: 0.4669
 epoch: 11, train_loss: 1.1235, test_loss: 1.0947, test_f1: 0.4605
 epoch: 12, train_loss: 1.1314, test_loss: 1.0447, test_f1: 0.4871
 epoch: 13, train_loss: 1.1134, test_loss: 1.0414, test_f1: 0.4690
 epoch: 14, train_loss: 1.1034, test_loss: 1.0432, test_f1: 0.4602
 epoch: 15, train_loss: 1.1014, test_loss: 1.0295, test_f1: 0.4684
 epoch: 16, train_loss: 1.0920, test_loss: 1.0278, test_f1: 0.4697
 epoch: 17, train_loss: 1.0751, test_loss: 1.0066, test_f1: 0.4819
 epoch: 18, train_loss: 1.0765, test_loss: 0.9938, test_f1: 0.4722
 epoch: 19, train_loss: 1.0699, test_loss: 0.9892, test_f1: 0.4740
 epoch: 20, train_loss: 1.0603, test_loss: 0.9881, test_f1: 0.4768
 epoch: 21, train_loss: 1.0624, test_loss: 0.9830, test_f1: 0.4547
 epoch: 22, train_loss: 1.0585, test_loss: 0.9816, test_f1: 0.4707
 epoch: 23, train_loss: 1.0593, test_loss: 0.9997, test_f1: 0.4631
 epoch: 24, train_loss: 1.0385, test_loss: 0.9715, test_f1: 0.4623
 epoch: 25, train_loss: 1.0407, test_loss: 0.9865, test_f1: 0.4631
 epoch: 26, train_loss: 1.0355, test_loss: 0.9654, test_f1: 0.4627
 epoch: 27, train_loss: 1.0251, test_loss: 0.9634, test_f1: 0.4726
 epoch: 28, train_loss: 1.0249, test_loss: 0.9721, test_f1: 0.4787
 epoch: 29, train_loss: 1.0150, test_loss: 0.9595, test_f1: 0.4650
 epoch: 30, train_loss: 1.0203, test_loss: 0.9570, test_f1: 0.4643
 epoch: 31, train_loss: 1.0176, test_loss: 0.9732, test_f1: 0.4644
 epoch: 32, train_loss: 1.0142, test_loss: 0.9506, test_f1: 0.4695
 epoch: 33, train_loss: 1.0063, test_loss: 0.9384, test_f1: 0.4723
 epoch: 34, train_loss: 1.0044, test_loss: 0.9404, test_f1: 0.4596
 epoch: 35, train_loss: 1.0042, test_loss: 0.9577, test_f1: 0.4515
 epoch: 36, train_loss: 1.0112, test_loss: 0.9516, test_f1: 0.4886
 epoch: 37, train_loss: 0.9956, test_loss: 0.9555, test_f1: 0.4539
 epoch: 38, train_loss: 0.9938, test_loss: 0.9480, test_f1: 0.4661
 epoch: 39, train_loss: 0.9982, test_loss: 0.9343, test_f1: 0.4720
 epoch: 40, train_loss: 0.9927, test_loss: 0.9418, test_f1: 0.4655
 epoch: 41, train_loss: 0.9889, test_loss: 0.9466, test_f1: 0.4697
 epoch: 42, train_loss: 0.9724, test_loss: 0.9309, test_f1: 0.4813
 epoch: 43, train_loss: 0.9730, test_loss: 0.9393, test_f1: 0.4646
 epoch: 44, train_loss: 0.9817, test_loss: 0.9439, test_f1: 0.4639
 epoch: 45, train_loss: 0.9848, test_loss: 0.9529, test_f1: 0.4644
 epoch: 46, train_loss: 0.9892, test_loss: 0.9371, test_f1: 0.4805
 epoch: 47, train_loss: 0.9655, test_loss: 0.9197, test_f1: 0.4635
 epoch: 48, train_loss: 0.9656, test_loss: 0.9353, test_f1: 0.4785
 epoch: 49, train_loss: 0.9610, test_loss: 0.9354, test_f1: 0.4869
 epoch: 50, train_loss: 0.9625, test_loss: 0.9287, test_f1: 0.4662
 epoch: 51, train_loss: 0.9562, test_loss: 0.9245, test_f1: 0.4730
 epoch: 52, train_loss: 0.9505, test_loss: 0.9315, test_f1: 0.4779
 epoch: 53, train_loss: 0.9628, test_loss: 0.9342, test_f1: 0.4947
 epoch: 54, train_loss: 0.9497, test_loss: 0.9320, test_f1: 0.4604
 epoch: 55, train_loss: 0.9529, test_loss: 0.9441, test_f1: 0.4808
 epoch: 56, train_loss: 0.9538, test_loss: 0.9385, test_f1: 0.4685
 epoch: 57, train_loss: 0.9498, test_loss: 0.9359, test_f1: 0.4635
 epoch: 58, train_loss: 0.9439, test_loss: 0.9500, test_f1: 0.4762
 epoch: 59, train_loss: 0.9426, test_loss: 0.9499, test_f1: 0.5042
 epoch: 60, train_loss: 0.9465, test_loss: 0.9409, test_f1: 0.4677
 epoch: 61, train_loss: 0.9475, test_loss: 0.9529, test_f1: 0.4767
 epoch: 62, train_loss: 0.9392, test_loss: 0.9315, test_f1: 0.4791
 epoch: 63, train_loss: 0.9393, test_loss: 0.9428, test_f1: 0.4733
 epoch: 64, train_loss: 0.9400, test_loss: 0.9325, test_f1: 0.4912
 epoch: 65, train_loss: 0.9460, test_loss: 0.9369, test_f1: 0.4903
 epoch: 66, train_loss: 0.9302, test_loss: 0.9511, test_f1: 0.4876
 epoch: 67, train_loss: 0.9280, test_loss: 0.9549, test_f1: 0.4920
 epoch: 68, train_loss: 0.9309, test_loss: 0.9459, test_f1: 0.4860
 epoch: 69, train_loss: 0.9329, test_loss: 0.9527, test_f1: 0.4924
 epoch: 70, train_loss: 0.9308, test_loss: 0.9444, test_f1: 0.4829
 epoch: 71, train_loss: 0.9269, test_loss: 0.9581, test_f1: 0.5002
 epoch: 72, train_loss: 0.9305, test_loss: 0.9679, test_f1: 0.4801
 epoch: 73, train_loss: 0.9244, test_loss: 0.9643, test_f1: 0.4855
 epoch: 74, train_loss: 0.9236, test_loss: 0.9602, test_f1: 0.4903
 epoch: 75, train_loss: 0.9248, test_loss: 0.9482, test_f1: 0.4858
 epoch: 76, train_loss: 0.9289, test_loss: 0.9440, test_f1: 0.4864
 epoch: 77, train_loss: 0.9199, test_loss: 0.9489, test_f1: 0.4988
 epoch: 78, train_loss: 0.9239, test_loss: 0.9476, test_f1: 0.4828
 epoch: 79, train_loss: 0.9269, test_loss: 0.9573, test_f1: 0.4843
 epoch: 80, train_loss: 0.9285, test_loss: 0.9645, test_f1: 0.4729
 epoch: 81, train_loss: 0.9269, test_loss: 0.9646, test_f1: 0.4828
 epoch: 82, train_loss: 0.9332, test_loss: 0.9481, test_f1: 0.4873
 epoch: 83, train_loss: 0.9213, test_loss: 0.9529, test_f1: 0.4792
 epoch: 84, train_loss: 0.9184, test_loss: 0.9692, test_f1: 0.4912
 epoch: 85, train_loss: 0.9111, test_loss: 0.9576, test_f1: 0.4992
 epoch: 86, train_loss: 0.9264, test_loss: 0.9667, test_f1: 0.4643
 epoch: 87, train_loss: 0.9129, test_loss: 0.9589, test_f1: 0.4859
 epoch: 88, train_loss: 0.9116, test_loss: 0.9550, test_f1: 0.4931
 epoch: 89, train_loss: 0.9108, test_loss: 0.9670, test_f1: 0.4853
 epoch: 90, train_loss: 0.9117, test_loss: 0.9739, test_f1: 0.4767
 epoch: 91, train_loss: 0.9112, test_loss: 0.9808, test_f1: 0.4807
 epoch: 92, train_loss: 0.9094, test_loss: 0.9697, test_f1: 0.4781
 epoch: 93, train_loss: 0.9047, test_loss: 1.0057, test_f1: 0.4815
 epoch: 94, train_loss: 0.9286, test_loss: 0.9673, test_f1: 0.4913
 epoch: 95, train_loss: 0.9101, test_loss: 0.9869, test_f1: 0.4796
 epoch: 96, train_loss: 0.9073, test_loss: 0.9638, test_f1: 0.4936
 epoch: 97, train_loss: 0.9077, test_loss: 0.9768, test_f1: 0.4749
 epoch: 98, train_loss: 0.9023, test_loss: 0.9876, test_f1: 0.4969
 epoch: 99, train_loss: 0.9094, test_loss: 0.9794, test_f1: 0.5103
##################ITERATION #8 ****************************************
 epoch: 0, train_loss: 1.5106, test_loss: 1.3210, test_f1: 0.2278
 epoch: 1, train_loss: 1.2930, test_loss: 1.2677, test_f1: 0.2782
 epoch: 2, train_loss: 1.2764, test_loss: 1.2353, test_f1: 0.3253
 epoch: 3, train_loss: 1.2489, test_loss: 1.2239, test_f1: 0.2958
 epoch: 4, train_loss: 1.2378, test_loss: 1.2087, test_f1: 0.3501
 epoch: 5, train_loss: 1.2144, test_loss: 1.1974, test_f1: 0.3591
 epoch: 6, train_loss: 1.2056, test_loss: 1.1865, test_f1: 0.3930
 epoch: 7, train_loss: 1.2087, test_loss: 1.1829, test_f1: 0.3583
 epoch: 8, train_loss: 1.2028, test_loss: 1.1668, test_f1: 0.3922
 epoch: 9, train_loss: 1.1909, test_loss: 1.1633, test_f1: 0.4045
 epoch: 10, train_loss: 1.1800, test_loss: 1.1504, test_f1: 0.3812
 epoch: 11, train_loss: 1.1735, test_loss: 1.1410, test_f1: 0.3943
 epoch: 12, train_loss: 1.1721, test_loss: 1.1222, test_f1: 0.4070
 epoch: 13, train_loss: 1.1486, test_loss: 1.1162, test_f1: 0.4187
 epoch: 14, train_loss: 1.1567, test_loss: 1.1176, test_f1: 0.4240
 epoch: 15, train_loss: 1.1458, test_loss: 1.0961, test_f1: 0.4389
 epoch: 16, train_loss: 1.1358, test_loss: 1.0970, test_f1: 0.4541
 epoch: 17, train_loss: 1.1359, test_loss: 1.0872, test_f1: 0.4317
 epoch: 18, train_loss: 1.1182, test_loss: 1.0875, test_f1: 0.4519
 epoch: 19, train_loss: 1.1122, test_loss: 1.0564, test_f1: 0.4303
 epoch: 20, train_loss: 1.1085, test_loss: 1.0604, test_f1: 0.4324
 epoch: 21, train_loss: 1.0962, test_loss: 1.0518, test_f1: 0.4373
 epoch: 22, train_loss: 1.0869, test_loss: 1.0445, test_f1: 0.4448
 epoch: 23, train_loss: 1.0704, test_loss: 1.0281, test_f1: 0.4569
 epoch: 24, train_loss: 1.0780, test_loss: 1.0142, test_f1: 0.4643
 epoch: 25, train_loss: 1.0697, test_loss: 1.0012, test_f1: 0.4617
 epoch: 26, train_loss: 1.0552, test_loss: 1.0131, test_f1: 0.4770
 epoch: 27, train_loss: 1.0486, test_loss: 1.0298, test_f1: 0.4568
 epoch: 28, train_loss: 1.0504, test_loss: 0.9876, test_f1: 0.4798
 epoch: 29, train_loss: 1.0384, test_loss: 0.9944, test_f1: 0.4867
 epoch: 30, train_loss: 1.0386, test_loss: 1.0133, test_f1: 0.4612
 epoch: 31, train_loss: 1.0269, test_loss: 0.9830, test_f1: 0.4772
 epoch: 32, train_loss: 1.0216, test_loss: 0.9809, test_f1: 0.4672
 epoch: 33, train_loss: 1.0179, test_loss: 0.9798, test_f1: 0.4739
 epoch: 34, train_loss: 1.0052, test_loss: 0.9691, test_f1: 0.4712
 epoch: 35, train_loss: 1.0024, test_loss: 0.9804, test_f1: 0.4908
 epoch: 36, train_loss: 1.0006, test_loss: 1.0014, test_f1: 0.4843
 epoch: 37, train_loss: 1.0132, test_loss: 0.9678, test_f1: 0.4981
 epoch: 38, train_loss: 0.9945, test_loss: 0.9593, test_f1: 0.4791
 epoch: 39, train_loss: 0.9870, test_loss: 0.9722, test_f1: 0.4790
 epoch: 40, train_loss: 0.9896, test_loss: 0.9902, test_f1: 0.4929
 epoch: 41, train_loss: 0.9895, test_loss: 1.0006, test_f1: 0.4818
 epoch: 42, train_loss: 0.9811, test_loss: 0.9794, test_f1: 0.4821
 epoch: 43, train_loss: 0.9789, test_loss: 0.9896, test_f1: 0.4875
 epoch: 44, train_loss: 0.9694, test_loss: 0.9966, test_f1: 0.4883
 epoch: 45, train_loss: 0.9730, test_loss: 1.0047, test_f1: 0.4932
 epoch: 46, train_loss: 0.9594, test_loss: 0.9635, test_f1: 0.4837
 epoch: 47, train_loss: 0.9624, test_loss: 1.0116, test_f1: 0.4899
 epoch: 48, train_loss: 0.9523, test_loss: 1.0433, test_f1: 0.4853
 epoch: 49, train_loss: 0.9431, test_loss: 1.0113, test_f1: 0.5026
 epoch: 50, train_loss: 0.9508, test_loss: 1.0106, test_f1: 0.5074
 epoch: 51, train_loss: 0.9387, test_loss: 1.0057, test_f1: 0.5109
 epoch: 52, train_loss: 0.9294, test_loss: 1.0192, test_f1: 0.4885
 epoch: 53, train_loss: 0.9291, test_loss: 1.0190, test_f1: 0.4992
 epoch: 54, train_loss: 0.9312, test_loss: 1.0164, test_f1: 0.4937
 epoch: 55, train_loss: 0.9165, test_loss: 1.0270, test_f1: 0.4989
 epoch: 56, train_loss: 0.9250, test_loss: 1.0233, test_f1: 0.4964
 epoch: 57, train_loss: 0.9216, test_loss: 1.0205, test_f1: 0.4947
 epoch: 58, train_loss: 0.9244, test_loss: 0.9925, test_f1: 0.5097
 epoch: 59, train_loss: 0.9133, test_loss: 1.0207, test_f1: 0.5046
 epoch: 60, train_loss: 0.9212, test_loss: 1.0282, test_f1: 0.5045
 epoch: 61, train_loss: 0.9216, test_loss: 1.0034, test_f1: 0.5057
 epoch: 62, train_loss: 0.9012, test_loss: 1.0485, test_f1: 0.4805
 epoch: 63, train_loss: 0.9112, test_loss: 1.0306, test_f1: 0.4984
 epoch: 64, train_loss: 0.9016, test_loss: 1.0283, test_f1: 0.5096
 epoch: 65, train_loss: 0.9116, test_loss: 1.0376, test_f1: 0.5068
 epoch: 66, train_loss: 0.9105, test_loss: 1.0346, test_f1: 0.5052
 epoch: 67, train_loss: 0.9106, test_loss: 1.0180, test_f1: 0.5152
 epoch: 68, train_loss: 0.8993, test_loss: 1.0286, test_f1: 0.4931
 epoch: 69, train_loss: 0.8932, test_loss: 1.0518, test_f1: 0.4967
 epoch: 70, train_loss: 0.8945, test_loss: 1.0485, test_f1: 0.4951
 epoch: 71, train_loss: 0.8952, test_loss: 1.0026, test_f1: 0.5070
 epoch: 72, train_loss: 0.8978, test_loss: 1.0454, test_f1: 0.4988
 epoch: 73, train_loss: 0.8983, test_loss: 1.0162, test_f1: 0.4924
 epoch: 74, train_loss: 0.8905, test_loss: 1.0406, test_f1: 0.5127
 epoch: 75, train_loss: 0.8985, test_loss: 1.0440, test_f1: 0.5064
 epoch: 76, train_loss: 0.9020, test_loss: 1.0497, test_f1: 0.4984
 epoch: 77, train_loss: 0.8848, test_loss: 1.0397, test_f1: 0.5083
 epoch: 78, train_loss: 0.8947, test_loss: 1.0534, test_f1: 0.4995
 epoch: 79, train_loss: 0.8906, test_loss: 1.0666, test_f1: 0.4993
 epoch: 80, train_loss: 0.8831, test_loss: 1.0109, test_f1: 0.5154
 epoch: 81, train_loss: 0.8782, test_loss: 1.0487, test_f1: 0.4987
 epoch: 82, train_loss: 0.8986, test_loss: 1.0840, test_f1: 0.5105
 epoch: 83, train_loss: 0.8910, test_loss: 1.0337, test_f1: 0.5155
 epoch: 84, train_loss: 0.8881, test_loss: 1.0434, test_f1: 0.5062
 epoch: 85, train_loss: 0.8737, test_loss: 1.0340, test_f1: 0.5074
 epoch: 86, train_loss: 0.8808, test_loss: 1.0718, test_f1: 0.5044
 epoch: 87, train_loss: 0.8831, test_loss: 1.0676, test_f1: 0.4955
 epoch: 88, train_loss: 0.8741, test_loss: 1.0618, test_f1: 0.5016
 epoch: 89, train_loss: 0.8857, test_loss: 1.0581, test_f1: 0.5070
 epoch: 90, train_loss: 0.8693, test_loss: 1.0680, test_f1: 0.5163
 epoch: 91, train_loss: 0.8855, test_loss: 1.0556, test_f1: 0.4947
 epoch: 92, train_loss: 0.8765, test_loss: 1.0673, test_f1: 0.5026
 epoch: 93, train_loss: 0.8820, test_loss: 1.0658, test_f1: 0.5013
 epoch: 94, train_loss: 0.8765, test_loss: 1.0461, test_f1: 0.5107
 epoch: 95, train_loss: 0.8596, test_loss: 1.0492, test_f1: 0.5117
 epoch: 96, train_loss: 0.8703, test_loss: 1.0551, test_f1: 0.5020
 epoch: 97, train_loss: 0.8600, test_loss: 1.0847, test_f1: 0.4967
 epoch: 98, train_loss: 0.8646, test_loss: 1.0604, test_f1: 0.5057
 epoch: 99, train_loss: 0.8597, test_loss: 1.0545, test_f1: 0.4951
##################ITERATION #9 ****************************************
 epoch: 0, train_loss: 1.5515, test_loss: 1.3403, test_f1: 0.2741
 epoch: 1, train_loss: 1.3371, test_loss: 1.2628, test_f1: 0.3682
 epoch: 2, train_loss: 1.2788, test_loss: 1.2162, test_f1: 0.3722
 epoch: 3, train_loss: 1.2485, test_loss: 1.1864, test_f1: 0.3664
 epoch: 4, train_loss: 1.2300, test_loss: 1.1704, test_f1: 0.3693
 epoch: 5, train_loss: 1.2118, test_loss: 1.1506, test_f1: 0.3674
 epoch: 6, train_loss: 1.1977, test_loss: 1.1502, test_f1: 0.3532
 epoch: 7, train_loss: 1.1934, test_loss: 1.1446, test_f1: 0.3570
 epoch: 8, train_loss: 1.1857, test_loss: 1.1285, test_f1: 0.3612
 epoch: 9, train_loss: 1.1734, test_loss: 1.1191, test_f1: 0.3523
 epoch: 10, train_loss: 1.1548, test_loss: 1.1070, test_f1: 0.3806
 epoch: 11, train_loss: 1.1595, test_loss: 1.0983, test_f1: 0.3938
 epoch: 12, train_loss: 1.1466, test_loss: 1.0968, test_f1: 0.3903
 epoch: 13, train_loss: 1.1499, test_loss: 1.0969, test_f1: 0.3807
 epoch: 14, train_loss: 1.1447, test_loss: 1.0893, test_f1: 0.3864
 epoch: 15, train_loss: 1.1362, test_loss: 1.0906, test_f1: 0.3946
 epoch: 16, train_loss: 1.1342, test_loss: 1.0871, test_f1: 0.4023
 epoch: 17, train_loss: 1.1302, test_loss: 1.0700, test_f1: 0.3986
 epoch: 18, train_loss: 1.1181, test_loss: 1.0644, test_f1: 0.4285
 epoch: 19, train_loss: 1.1151, test_loss: 1.0667, test_f1: 0.3995
 epoch: 20, train_loss: 1.1124, test_loss: 1.0578, test_f1: 0.4233
 epoch: 21, train_loss: 1.1063, test_loss: 1.0706, test_f1: 0.4135
 epoch: 22, train_loss: 1.1108, test_loss: 1.0551, test_f1: 0.4224
 epoch: 23, train_loss: 1.1102, test_loss: 1.0644, test_f1: 0.4149
 epoch: 24, train_loss: 1.0972, test_loss: 1.0615, test_f1: 0.4014
 epoch: 25, train_loss: 1.0877, test_loss: 1.0502, test_f1: 0.4295
 epoch: 26, train_loss: 1.0973, test_loss: 1.0502, test_f1: 0.4204
 epoch: 27, train_loss: 1.0820, test_loss: 1.0535, test_f1: 0.4255
 epoch: 28, train_loss: 1.0855, test_loss: 1.0472, test_f1: 0.4360
 epoch: 29, train_loss: 1.0863, test_loss: 1.0360, test_f1: 0.4477
 epoch: 30, train_loss: 1.0824, test_loss: 1.0348, test_f1: 0.4122
 epoch: 31, train_loss: 1.0749, test_loss: 1.0370, test_f1: 0.4382
 epoch: 32, train_loss: 1.0778, test_loss: 1.0321, test_f1: 0.4312
 epoch: 33, train_loss: 1.0744, test_loss: 1.0415, test_f1: 0.4429
 epoch: 34, train_loss: 1.0647, test_loss: 1.0244, test_f1: 0.4468
 epoch: 35, train_loss: 1.0601, test_loss: 1.0177, test_f1: 0.4523
 epoch: 36, train_loss: 1.0549, test_loss: 1.0290, test_f1: 0.4684
 epoch: 37, train_loss: 1.0548, test_loss: 1.0143, test_f1: 0.4638
 epoch: 38, train_loss: 1.0609, test_loss: 1.0096, test_f1: 0.4562
 epoch: 39, train_loss: 1.0465, test_loss: 1.0047, test_f1: 0.4768
 epoch: 40, train_loss: 1.0401, test_loss: 1.0239, test_f1: 0.4811
 epoch: 41, train_loss: 1.0424, test_loss: 1.0223, test_f1: 0.4730
 epoch: 42, train_loss: 1.0421, test_loss: 1.0027, test_f1: 0.4794
 epoch: 43, train_loss: 1.0327, test_loss: 1.0041, test_f1: 0.4797
 epoch: 44, train_loss: 1.0378, test_loss: 1.0022, test_f1: 0.4763
 epoch: 45, train_loss: 1.0333, test_loss: 0.9854, test_f1: 0.4761
 epoch: 46, train_loss: 1.0268, test_loss: 0.9900, test_f1: 0.4849
 epoch: 47, train_loss: 1.0231, test_loss: 1.0061, test_f1: 0.4774
 epoch: 48, train_loss: 1.0244, test_loss: 0.9978, test_f1: 0.4701
 epoch: 49, train_loss: 1.0151, test_loss: 0.9953, test_f1: 0.4900
 epoch: 50, train_loss: 1.0184, test_loss: 0.9903, test_f1: 0.4695
 epoch: 51, train_loss: 1.0102, test_loss: 0.9801, test_f1: 0.4767
 epoch: 52, train_loss: 1.0017, test_loss: 1.0004, test_f1: 0.4820
 epoch: 53, train_loss: 1.0082, test_loss: 0.9868, test_f1: 0.4861
 epoch: 54, train_loss: 1.0023, test_loss: 0.9846, test_f1: 0.4848
 epoch: 55, train_loss: 0.9953, test_loss: 0.9879, test_f1: 0.4865
 epoch: 56, train_loss: 0.9975, test_loss: 0.9703, test_f1: 0.4982
 epoch: 57, train_loss: 1.0013, test_loss: 0.9988, test_f1: 0.4866
 epoch: 58, train_loss: 1.0114, test_loss: 0.9705, test_f1: 0.5026
 epoch: 59, train_loss: 0.9914, test_loss: 0.9992, test_f1: 0.4767
 epoch: 60, train_loss: 0.9879, test_loss: 0.9971, test_f1: 0.4807
 epoch: 61, train_loss: 0.9856, test_loss: 1.0002, test_f1: 0.4975
 epoch: 62, train_loss: 0.9852, test_loss: 0.9828, test_f1: 0.4822
 epoch: 63, train_loss: 0.9841, test_loss: 0.9821, test_f1: 0.4766
 epoch: 64, train_loss: 0.9799, test_loss: 0.9941, test_f1: 0.4774
 epoch: 65, train_loss: 0.9831, test_loss: 0.9811, test_f1: 0.4831
 epoch: 66, train_loss: 0.9743, test_loss: 0.9863, test_f1: 0.4906
 epoch: 67, train_loss: 0.9751, test_loss: 0.9717, test_f1: 0.4882
 epoch: 68, train_loss: 0.9607, test_loss: 0.9663, test_f1: 0.4940
 epoch: 69, train_loss: 0.9760, test_loss: 0.9849, test_f1: 0.4911
 epoch: 70, train_loss: 0.9707, test_loss: 0.9639, test_f1: 0.5123
 epoch: 71, train_loss: 0.9785, test_loss: 0.9761, test_f1: 0.4905
 epoch: 72, train_loss: 0.9655, test_loss: 0.9833, test_f1: 0.5033
 epoch: 73, train_loss: 0.9722, test_loss: 0.9686, test_f1: 0.4942
 epoch: 74, train_loss: 0.9810, test_loss: 0.9839, test_f1: 0.4948
 epoch: 75, train_loss: 0.9649, test_loss: 0.9940, test_f1: 0.4779
 epoch: 76, train_loss: 0.9772, test_loss: 0.9653, test_f1: 0.5042
 epoch: 77, train_loss: 0.9585, test_loss: 0.9804, test_f1: 0.4897
 epoch: 78, train_loss: 0.9513, test_loss: 0.9781, test_f1: 0.4889
 epoch: 79, train_loss: 0.9699, test_loss: 0.9762, test_f1: 0.4945
 epoch: 80, train_loss: 0.9591, test_loss: 0.9696, test_f1: 0.4961
 epoch: 81, train_loss: 0.9491, test_loss: 0.9878, test_f1: 0.4821
 epoch: 82, train_loss: 0.9621, test_loss: 0.9724, test_f1: 0.4873
 epoch: 83, train_loss: 0.9507, test_loss: 0.9813, test_f1: 0.4941
 epoch: 84, train_loss: 0.9483, test_loss: 0.9618, test_f1: 0.4920
 epoch: 85, train_loss: 0.9516, test_loss: 0.9768, test_f1: 0.4893
 epoch: 86, train_loss: 0.9449, test_loss: 0.9926, test_f1: 0.4878
 epoch: 87, train_loss: 0.9522, test_loss: 0.9790, test_f1: 0.4905
 epoch: 88, train_loss: 0.9441, test_loss: 0.9819, test_f1: 0.4966
 epoch: 89, train_loss: 0.9513, test_loss: 0.9688, test_f1: 0.4969
 epoch: 90, train_loss: 0.9564, test_loss: 0.9731, test_f1: 0.5075
 epoch: 91, train_loss: 0.9470, test_loss: 0.9917, test_f1: 0.4902
 epoch: 92, train_loss: 0.9478, test_loss: 0.9832, test_f1: 0.5017
 epoch: 93, train_loss: 0.9418, test_loss: 0.9825, test_f1: 0.4908
 epoch: 94, train_loss: 0.9513, test_loss: 0.9701, test_f1: 0.4935
 epoch: 95, train_loss: 0.9353, test_loss: 0.9944, test_f1: 0.4928
 epoch: 96, train_loss: 0.9398, test_loss: 0.9717, test_f1: 0.4883
 epoch: 97, train_loss: 0.9338, test_loss: 0.9817, test_f1: 0.4759
 epoch: 98, train_loss: 0.9342, test_loss: 0.9763, test_f1: 0.4885
 epoch: 99, train_loss: 0.9452, test_loss: 0.9930, test_f1: 0.5034

Training completed in 523.62 seconds
Best F1: 0.5312 at epoch 94
Mean F1 across iterations: 0.5133  0.0103
========================FINAL RESULTS================================
FEGIN weighted F1: 0.5312  0.0103
python main.py --data ltspice_examples --representation component_component --model FEGIN --layers 5 --hiddens 16 --batch_size 128 --lr 0.001 --emb_size 128 --epochs 100 --save_appendix component_component_L5_H16_BS128_LR0.001_E128 --no_val
-----



STDERR:
Processing...
Done!
  File "main.py", line 370, in <module>
    main()
  File "main.py", line 254, in main
    dataset = dataset_class(
  File "/home/philip/projects/ltspice_examples_code_repo/Circuit-Completion-Using-GNNs/component_classification_with_link_prediction_head/evaluation/FEGIN/kernel/circuit_datasets.py", line 15, in __init__
    self.data, self.slices = torch.load(self.processed_paths[0])
  File "/home/philip/.local/lib/python3.8/site-packages/torch/serialization.py", line 1040, in load
    warnings.warn(
  File "/usr/lib/python3.8/warnings.py", line 109, in _showwarnmsg
    sw(msg.message, msg.category, msg.filename, msg.lineno,
  File "main.py", line 47, in warn_with_traceback
    traceback.print_stack(file=log)
/home/philip/projects/ltspice_examples_code_repo/Circuit-Completion-Using-GNNs/component_classification_with_link_prediction_head/evaluation/FEGIN/kernel/circuit_datasets.py:15: FutureWarning: You are using `torch.load` with `weights_only=False` (the current default value), which uses the default pickle module implicitly. It is possible to construct malicious pickle data which will execute arbitrary code during unpickling (See https://github.com/pytorch/pytorch/blob/main/SECURITY.md#untrusted-models for more details). In a future release, the default value for `weights_only` will be flipped to `True`. This limits the functions that could be executed during unpickling. Arbitrary objects will no longer be allowed to be loaded via this mode unless they are explicitly allowlisted by the user via `torch.serialization.add_safe_globals`. We recommend you start setting `weights_only=True` for any use case where you don't have full control of the loaded file. Please open an issue on GitHub for any issues related to this experimental feature.
  self.data, self.slices = torch.load(self.processed_paths[0])
