STDOUT:
Results will be saved in /home/philip/projects/ltspice_examples_code_repo/Circuit-Completion-Using-GNNs/component_classification_with_link_prediction_head/evaluation/FEGIN/results/model_FEGIN_dataset_ltspice_demos
Command line input: python main.py --data ltspice_demos --representation component_pin --model FEGIN --layers 3 --hiddens 64 --batch_size 64 --lr 0.001 --emb_size 250 --epochs 100 --save_appendix component_pin_L3_H64_BS64_LR0.001_E250 --no_val
 is saved.
-----
ltspice_demos - FEGIN
Using 3 layers, 64 hidden units, h = 2
Loading component_pin representation dataset
ENTERED
Training FEGIN on component_pin representation
Train: 1565, Test: 383
##################ITERATION #0 ****************************************
 epoch: 0, train_loss: 1.3132, test_loss: 1.3037, test_f1: 0.2655
 epoch: 1, train_loss: 1.1778, test_loss: 1.2483, test_f1: 0.3480
 epoch: 2, train_loss: 1.1341, test_loss: 1.1983, test_f1: 0.4458
 epoch: 3, train_loss: 1.0811, test_loss: 1.1456, test_f1: 0.4658
 epoch: 4, train_loss: 1.0055, test_loss: 1.0838, test_f1: 0.4541
 epoch: 5, train_loss: 0.9632, test_loss: 1.0366, test_f1: 0.5076
 epoch: 6, train_loss: 0.9236, test_loss: 1.0133, test_f1: 0.5577
 epoch: 7, train_loss: 0.8755, test_loss: 1.0538, test_f1: 0.5567
 epoch: 8, train_loss: 0.8586, test_loss: 1.0078, test_f1: 0.5927
 epoch: 9, train_loss: 0.8316, test_loss: 0.9843, test_f1: 0.5833
 epoch: 10, train_loss: 0.8103, test_loss: 1.0163, test_f1: 0.5693
 epoch: 11, train_loss: 0.7740, test_loss: 0.9973, test_f1: 0.5770
 epoch: 12, train_loss: 0.7606, test_loss: 0.9573, test_f1: 0.6229
 epoch: 13, train_loss: 0.7429, test_loss: 0.9458, test_f1: 0.6087
 epoch: 14, train_loss: 0.7146, test_loss: 0.9409, test_f1: 0.5989
 epoch: 15, train_loss: 0.6839, test_loss: 1.0825, test_f1: 0.5383
 epoch: 16, train_loss: 0.6792, test_loss: 1.1017, test_f1: 0.5599
 epoch: 17, train_loss: 0.6642, test_loss: 1.0290, test_f1: 0.5448
 epoch: 18, train_loss: 0.6519, test_loss: 1.1233, test_f1: 0.5246
 epoch: 19, train_loss: 0.6300, test_loss: 1.0288, test_f1: 0.5855
 epoch: 20, train_loss: 0.6133, test_loss: 1.0870, test_f1: 0.5950
 epoch: 21, train_loss: 0.6205, test_loss: 1.1164, test_f1: 0.5714
 epoch: 22, train_loss: 0.6049, test_loss: 1.0757, test_f1: 0.5863
 epoch: 23, train_loss: 0.5705, test_loss: 1.0628, test_f1: 0.6039
 epoch: 24, train_loss: 0.5708, test_loss: 1.1507, test_f1: 0.5395
 epoch: 25, train_loss: 0.5917, test_loss: 1.3200, test_f1: 0.5616
 epoch: 26, train_loss: 0.5751, test_loss: 1.1681, test_f1: 0.5186
 epoch: 27, train_loss: 0.5355, test_loss: 1.2172, test_f1: 0.5672
 epoch: 28, train_loss: 0.5343, test_loss: 1.3169, test_f1: 0.5509
 epoch: 29, train_loss: 0.5434, test_loss: 1.1900, test_f1: 0.5840
 epoch: 30, train_loss: 0.5190, test_loss: 1.1328, test_f1: 0.5800
 epoch: 31, train_loss: 0.4918, test_loss: 1.2937, test_f1: 0.5758
 epoch: 32, train_loss: 0.5046, test_loss: 1.3098, test_f1: 0.5447
 epoch: 33, train_loss: 0.4913, test_loss: 1.2064, test_f1: 0.6640
 epoch: 34, train_loss: 0.5030, test_loss: 1.2327, test_f1: 0.5820
 epoch: 35, train_loss: 0.4469, test_loss: 1.3668, test_f1: 0.6320
 epoch: 36, train_loss: 0.4388, test_loss: 1.5134, test_f1: 0.6256
 epoch: 37, train_loss: 0.4310, test_loss: 1.5866, test_f1: 0.5524
 epoch: 38, train_loss: 0.4214, test_loss: 1.3018, test_f1: 0.6499
 epoch: 39, train_loss: 0.4275, test_loss: 1.5333, test_f1: 0.5402
 epoch: 40, train_loss: 0.4158, test_loss: 1.5025, test_f1: 0.5788
 epoch: 41, train_loss: 0.4142, test_loss: 1.5362, test_f1: 0.5619
 epoch: 42, train_loss: 0.3977, test_loss: 1.4131, test_f1: 0.6207
 epoch: 43, train_loss: 0.3922, test_loss: 1.5562, test_f1: 0.5595
 epoch: 44, train_loss: 0.3941, test_loss: 1.5074, test_f1: 0.6215
 epoch: 45, train_loss: 0.3672, test_loss: 1.6911, test_f1: 0.5747
 epoch: 46, train_loss: 0.3459, test_loss: 1.6174, test_f1: 0.5749
 epoch: 47, train_loss: 0.3314, test_loss: 1.5367, test_f1: 0.6132
 epoch: 48, train_loss: 0.3183, test_loss: 1.6944, test_f1: 0.6165
 epoch: 49, train_loss: 0.3313, test_loss: 1.6218, test_f1: 0.5578
 epoch: 50, train_loss: 0.3154, test_loss: 1.6380, test_f1: 0.6393
 epoch: 51, train_loss: 0.2764, test_loss: 1.5303, test_f1: 0.6228
 epoch: 52, train_loss: 0.2636, test_loss: 1.6568, test_f1: 0.5819
 epoch: 53, train_loss: 0.2434, test_loss: 1.7995, test_f1: 0.5998
 epoch: 54, train_loss: 0.2211, test_loss: 1.7898, test_f1: 0.6225
 epoch: 55, train_loss: 0.2100, test_loss: 1.7899, test_f1: 0.6015
 epoch: 56, train_loss: 0.2208, test_loss: 1.7121, test_f1: 0.6361
 epoch: 57, train_loss: 0.2356, test_loss: 1.7870, test_f1: 0.6038
 epoch: 58, train_loss: 0.1939, test_loss: 1.8550, test_f1: 0.5934
 epoch: 59, train_loss: 0.2128, test_loss: 1.9843, test_f1: 0.5970
 epoch: 60, train_loss: 0.2246, test_loss: 1.7816, test_f1: 0.6148
 epoch: 61, train_loss: 0.2164, test_loss: 1.8623, test_f1: 0.5993
 epoch: 62, train_loss: 0.1887, test_loss: 2.1942, test_f1: 0.5773
 epoch: 63, train_loss: 0.2129, test_loss: 2.0910, test_f1: 0.5998
 epoch: 64, train_loss: 0.2151, test_loss: 2.0399, test_f1: 0.6117
 epoch: 65, train_loss: 0.1934, test_loss: 2.0250, test_f1: 0.6014
 epoch: 66, train_loss: 0.1674, test_loss: 2.0537, test_f1: 0.6140
 epoch: 67, train_loss: 0.1680, test_loss: 1.8954, test_f1: 0.6328
 epoch: 68, train_loss: 0.1637, test_loss: 2.0395, test_f1: 0.5858
 epoch: 69, train_loss: 0.1732, test_loss: 2.0408, test_f1: 0.6280
 epoch: 70, train_loss: 0.1767, test_loss: 1.8642, test_f1: 0.6321
 epoch: 71, train_loss: 0.1719, test_loss: 2.1535, test_f1: 0.6099
 epoch: 72, train_loss: 0.1597, test_loss: 2.1340, test_f1: 0.6391
 epoch: 73, train_loss: 0.1348, test_loss: 2.1999, test_f1: 0.6057
 epoch: 74, train_loss: 0.1458, test_loss: 2.0944, test_f1: 0.6423
 epoch: 75, train_loss: 0.1659, test_loss: 2.3995, test_f1: 0.6116
 epoch: 76, train_loss: 0.1648, test_loss: 2.1159, test_f1: 0.6361
 epoch: 77, train_loss: 0.1645, test_loss: 2.3383, test_f1: 0.5473
 epoch: 78, train_loss: 0.1660, test_loss: 2.2367, test_f1: 0.6173
 epoch: 79, train_loss: 0.1670, test_loss: 2.3741, test_f1: 0.5956
 epoch: 80, train_loss: 0.1605, test_loss: 2.1715, test_f1: 0.5988
 epoch: 81, train_loss: 0.1602, test_loss: 2.2275, test_f1: 0.6045
 epoch: 82, train_loss: 0.1632, test_loss: 2.0997, test_f1: 0.6135
 epoch: 83, train_loss: 0.1437, test_loss: 2.1409, test_f1: 0.6415
 epoch: 84, train_loss: 0.1423, test_loss: 2.3650, test_f1: 0.5907
 epoch: 85, train_loss: 0.1327, test_loss: 2.2561, test_f1: 0.6049
 epoch: 86, train_loss: 0.1458, test_loss: 2.6784, test_f1: 0.5861
 epoch: 87, train_loss: 0.1186, test_loss: 2.3709, test_f1: 0.6015
 epoch: 88, train_loss: 0.1416, test_loss: 2.7000, test_f1: 0.5833
 epoch: 89, train_loss: 0.1335, test_loss: 2.2943, test_f1: 0.6158
 epoch: 90, train_loss: 0.1258, test_loss: 2.2768, test_f1: 0.6343
 epoch: 91, train_loss: 0.1389, test_loss: 2.3774, test_f1: 0.5873
 epoch: 92, train_loss: 0.1470, test_loss: 2.3057, test_f1: 0.5964
 epoch: 93, train_loss: 0.1403, test_loss: 2.4539, test_f1: 0.6351
 epoch: 94, train_loss: 0.1376, test_loss: 2.4045, test_f1: 0.6220
 epoch: 95, train_loss: 0.0924, test_loss: 2.5254, test_f1: 0.5834
 epoch: 96, train_loss: 0.0988, test_loss: 2.5125, test_f1: 0.6002
 epoch: 97, train_loss: 0.0969, test_loss: 2.7283, test_f1: 0.5808
 epoch: 98, train_loss: 0.1076, test_loss: 2.5526, test_f1: 0.6156
 epoch: 99, train_loss: 0.1018, test_loss: 2.6407, test_f1: 0.5968
##################ITERATION #1 ****************************************
 epoch: 0, train_loss: 1.2077, test_loss: 1.3218, test_f1: 0.3358
 epoch: 1, train_loss: 1.0466, test_loss: 1.3146, test_f1: 0.3795
 epoch: 2, train_loss: 0.9844, test_loss: 1.0344, test_f1: 0.5671
 epoch: 3, train_loss: 0.9040, test_loss: 0.9781, test_f1: 0.5932
 epoch: 4, train_loss: 0.8667, test_loss: 1.0222, test_f1: 0.5379
 epoch: 5, train_loss: 0.8392, test_loss: 0.9476, test_f1: 0.6162
 epoch: 6, train_loss: 0.7959, test_loss: 0.9234, test_f1: 0.6600
 epoch: 7, train_loss: 0.7724, test_loss: 0.9271, test_f1: 0.6225
 epoch: 8, train_loss: 0.7398, test_loss: 1.0095, test_f1: 0.5963
 epoch: 9, train_loss: 0.7386, test_loss: 1.0735, test_f1: 0.5934
 epoch: 10, train_loss: 0.7238, test_loss: 1.1053, test_f1: 0.5860
 epoch: 11, train_loss: 0.6916, test_loss: 1.1463, test_f1: 0.5780
 epoch: 12, train_loss: 0.6910, test_loss: 1.1031, test_f1: 0.5985
 epoch: 13, train_loss: 0.6847, test_loss: 1.0915, test_f1: 0.5629
 epoch: 14, train_loss: 0.6507, test_loss: 1.1222, test_f1: 0.5384
 epoch: 15, train_loss: 0.6274, test_loss: 1.0903, test_f1: 0.5910
 epoch: 16, train_loss: 0.6132, test_loss: 1.2199, test_f1: 0.6117
 epoch: 17, train_loss: 0.6065, test_loss: 1.0729, test_f1: 0.6352
 epoch: 18, train_loss: 0.6054, test_loss: 1.1471, test_f1: 0.5740
 epoch: 19, train_loss: 0.6109, test_loss: 1.3462, test_f1: 0.5393
 epoch: 20, train_loss: 0.6055, test_loss: 1.1063, test_f1: 0.6357
 epoch: 21, train_loss: 0.5688, test_loss: 1.1222, test_f1: 0.6481
 epoch: 22, train_loss: 0.5554, test_loss: 1.2092, test_f1: 0.6148
 epoch: 23, train_loss: 0.5505, test_loss: 1.2893, test_f1: 0.5560
 epoch: 24, train_loss: 0.5327, test_loss: 1.4004, test_f1: 0.6047
 epoch: 25, train_loss: 0.5371, test_loss: 1.6378, test_f1: 0.5404
 epoch: 26, train_loss: 0.5302, test_loss: 1.1574, test_f1: 0.6910
 epoch: 27, train_loss: 0.5187, test_loss: 1.2648, test_f1: 0.6270
 epoch: 28, train_loss: 0.5028, test_loss: 1.3584, test_f1: 0.6137
 epoch: 29, train_loss: 0.5010, test_loss: 1.3071, test_f1: 0.6682
 epoch: 30, train_loss: 0.4685, test_loss: 1.2387, test_f1: 0.6259
 epoch: 31, train_loss: 0.4668, test_loss: 1.3551, test_f1: 0.6163
 epoch: 32, train_loss: 0.4737, test_loss: 1.3073, test_f1: 0.6513
 epoch: 33, train_loss: 0.4491, test_loss: 1.4217, test_f1: 0.6066
 epoch: 34, train_loss: 0.4573, test_loss: 1.5009, test_f1: 0.6253
 epoch: 35, train_loss: 0.4257, test_loss: 1.4166, test_f1: 0.6556
 epoch: 36, train_loss: 0.4298, test_loss: 1.4437, test_f1: 0.6361
 epoch: 37, train_loss: 0.4153, test_loss: 1.4959, test_f1: 0.6278
 epoch: 38, train_loss: 0.4019, test_loss: 1.5524, test_f1: 0.6516
 epoch: 39, train_loss: 0.4009, test_loss: 1.5389, test_f1: 0.6328
 epoch: 40, train_loss: 0.3931, test_loss: 1.7016, test_f1: 0.6282
 epoch: 41, train_loss: 0.3905, test_loss: 1.9276, test_f1: 0.6166
 epoch: 42, train_loss: 0.3828, test_loss: 1.5957, test_f1: 0.6502
 epoch: 43, train_loss: 0.3551, test_loss: 1.4959, test_f1: 0.6534
 epoch: 44, train_loss: 0.3503, test_loss: 1.7691, test_f1: 0.6178
 epoch: 45, train_loss: 0.3796, test_loss: 1.7636, test_f1: 0.6483
 epoch: 46, train_loss: 0.3655, test_loss: 1.9195, test_f1: 0.6231
 epoch: 47, train_loss: 0.3861, test_loss: 1.6637, test_f1: 0.6259
 epoch: 48, train_loss: 0.3346, test_loss: 1.7300, test_f1: 0.6320
 epoch: 49, train_loss: 0.3165, test_loss: 1.8261, test_f1: 0.6227
 epoch: 50, train_loss: 0.2936, test_loss: 1.9904, test_f1: 0.6297
 epoch: 51, train_loss: 0.2719, test_loss: 1.8815, test_f1: 0.6528
 epoch: 52, train_loss: 0.2748, test_loss: 1.8439, test_f1: 0.6429
 epoch: 53, train_loss: 0.2516, test_loss: 1.9948, test_f1: 0.6522
 epoch: 54, train_loss: 0.2414, test_loss: 1.8438, test_f1: 0.6801
 epoch: 55, train_loss: 0.2432, test_loss: 2.0794, test_f1: 0.6517
 epoch: 56, train_loss: 0.2437, test_loss: 2.0982, test_f1: 0.6404
 epoch: 57, train_loss: 0.2147, test_loss: 2.0679, test_f1: 0.6632
 epoch: 58, train_loss: 0.2187, test_loss: 2.1105, test_f1: 0.6726
 epoch: 59, train_loss: 0.2064, test_loss: 2.2379, test_f1: 0.6588
 epoch: 60, train_loss: 0.2110, test_loss: 2.2737, test_f1: 0.5985
 epoch: 61, train_loss: 0.2231, test_loss: 2.4544, test_f1: 0.6050
 epoch: 62, train_loss: 0.2206, test_loss: 2.2341, test_f1: 0.6804
 epoch: 63, train_loss: 0.1964, test_loss: 2.2710, test_f1: 0.6654
 epoch: 64, train_loss: 0.1954, test_loss: 2.3681, test_f1: 0.6521
 epoch: 65, train_loss: 0.2063, test_loss: 2.2924, test_f1: 0.6738
 epoch: 66, train_loss: 0.1911, test_loss: 2.2379, test_f1: 0.6749
 epoch: 67, train_loss: 0.2252, test_loss: 2.4218, test_f1: 0.6449
 epoch: 68, train_loss: 0.1711, test_loss: 2.5850, test_f1: 0.6508
 epoch: 69, train_loss: 0.1985, test_loss: 2.4066, test_f1: 0.6447
 epoch: 70, train_loss: 0.1975, test_loss: 2.3806, test_f1: 0.6422
 epoch: 71, train_loss: 0.1938, test_loss: 2.2829, test_f1: 0.6526
 epoch: 72, train_loss: 0.1905, test_loss: 2.3279, test_f1: 0.6401
 epoch: 73, train_loss: 0.1858, test_loss: 2.5954, test_f1: 0.6611
 epoch: 74, train_loss: 0.1664, test_loss: 2.5315, test_f1: 0.6731
 epoch: 75, train_loss: 0.1575, test_loss: 2.5383, test_f1: 0.6625
 epoch: 76, train_loss: 0.1352, test_loss: 2.6985, test_f1: 0.6455
 epoch: 77, train_loss: 0.1832, test_loss: 2.5788, test_f1: 0.6183
 epoch: 78, train_loss: 0.1653, test_loss: 2.6879, test_f1: 0.6392
 epoch: 79, train_loss: 0.1872, test_loss: 2.5960, test_f1: 0.6374
 epoch: 80, train_loss: 0.1697, test_loss: 2.5944, test_f1: 0.6679
 epoch: 81, train_loss: 0.1812, test_loss: 2.8284, test_f1: 0.6266
 epoch: 82, train_loss: 0.1389, test_loss: 2.8040, test_f1: 0.6326
 epoch: 83, train_loss: 0.1498, test_loss: 2.7107, test_f1: 0.6639
 epoch: 84, train_loss: 0.1279, test_loss: 2.6887, test_f1: 0.6457
 epoch: 85, train_loss: 0.1334, test_loss: 2.8816, test_f1: 0.6431
 epoch: 86, train_loss: 0.1462, test_loss: 2.9430, test_f1: 0.6428
 epoch: 87, train_loss: 0.1663, test_loss: 2.7983, test_f1: 0.6415
 epoch: 88, train_loss: 0.1398, test_loss: 3.0045, test_f1: 0.6551
 epoch: 89, train_loss: 0.1663, test_loss: 2.7800, test_f1: 0.6630
 epoch: 90, train_loss: 0.1437, test_loss: 2.8066, test_f1: 0.6768
 epoch: 91, train_loss: 0.1551, test_loss: 2.8302, test_f1: 0.6344
 epoch: 92, train_loss: 0.1436, test_loss: 3.0020, test_f1: 0.6448
 epoch: 93, train_loss: 0.1479, test_loss: 2.9072, test_f1: 0.6662
 epoch: 94, train_loss: 0.1526, test_loss: 2.7237, test_f1: 0.6486
 epoch: 95, train_loss: 0.1495, test_loss: 2.9624, test_f1: 0.6859
 epoch: 96, train_loss: 0.1257, test_loss: 3.0835, test_f1: 0.6562
 epoch: 97, train_loss: 0.1164, test_loss: 3.4221, test_f1: 0.6503
 epoch: 98, train_loss: 0.1391, test_loss: 3.0417, test_f1: 0.6459
 epoch: 99, train_loss: 0.1366, test_loss: 3.1355, test_f1: 0.6488
##################ITERATION #2 ****************************************
 epoch: 0, train_loss: 1.1676, test_loss: 1.2926, test_f1: 0.3315
 epoch: 1, train_loss: 0.9705, test_loss: 1.0645, test_f1: 0.5088
 epoch: 2, train_loss: 0.8863, test_loss: 1.0059, test_f1: 0.5217
 epoch: 3, train_loss: 0.8528, test_loss: 0.9601, test_f1: 0.5296
 epoch: 4, train_loss: 0.8318, test_loss: 0.9766, test_f1: 0.5443
 epoch: 5, train_loss: 0.7856, test_loss: 0.9779, test_f1: 0.5565
 epoch: 6, train_loss: 0.7739, test_loss: 0.9888, test_f1: 0.5451
 epoch: 7, train_loss: 0.7428, test_loss: 1.1415, test_f1: 0.5197
 epoch: 8, train_loss: 0.7004, test_loss: 1.0708, test_f1: 0.5908
 epoch: 9, train_loss: 0.6827, test_loss: 1.1533, test_f1: 0.5757
 epoch: 10, train_loss: 0.6792, test_loss: 1.0336, test_f1: 0.5433
 epoch: 11, train_loss: 0.6489, test_loss: 0.9205, test_f1: 0.6097
 epoch: 12, train_loss: 0.6409, test_loss: 1.0129, test_f1: 0.5511
 epoch: 13, train_loss: 0.6272, test_loss: 1.3378, test_f1: 0.4950
 epoch: 14, train_loss: 0.6235, test_loss: 1.0933, test_f1: 0.5631
 epoch: 15, train_loss: 0.5910, test_loss: 1.2322, test_f1: 0.5501
 epoch: 16, train_loss: 0.5872, test_loss: 1.1296, test_f1: 0.5440
 epoch: 17, train_loss: 0.5752, test_loss: 1.0715, test_f1: 0.5416
 epoch: 18, train_loss: 0.5624, test_loss: 1.3138, test_f1: 0.5726
 epoch: 19, train_loss: 0.5412, test_loss: 1.2514, test_f1: 0.5447
 epoch: 20, train_loss: 0.5256, test_loss: 1.2226, test_f1: 0.5944
 epoch: 21, train_loss: 0.5239, test_loss: 1.2902, test_f1: 0.5433
 epoch: 22, train_loss: 0.5283, test_loss: 1.1442, test_f1: 0.6065
 epoch: 23, train_loss: 0.5254, test_loss: 1.0797, test_f1: 0.5632
 epoch: 24, train_loss: 0.4897, test_loss: 1.3317, test_f1: 0.5885
 epoch: 25, train_loss: 0.4941, test_loss: 1.3954, test_f1: 0.5763
 epoch: 26, train_loss: 0.4798, test_loss: 1.4324, test_f1: 0.5767
 epoch: 27, train_loss: 0.4837, test_loss: 1.2580, test_f1: 0.5702
 epoch: 28, train_loss: 0.4568, test_loss: 1.3309, test_f1: 0.5663
 epoch: 29, train_loss: 0.4406, test_loss: 1.4224, test_f1: 0.6319
 epoch: 30, train_loss: 0.4482, test_loss: 1.3656, test_f1: 0.5755
 epoch: 31, train_loss: 0.4197, test_loss: 1.2160, test_f1: 0.6140
 epoch: 32, train_loss: 0.3818, test_loss: 1.4595, test_f1: 0.5642
 epoch: 33, train_loss: 0.3545, test_loss: 1.5691, test_f1: 0.5927
 epoch: 34, train_loss: 0.4030, test_loss: 1.5388, test_f1: 0.5845
 epoch: 35, train_loss: 0.4117, test_loss: 1.3673, test_f1: 0.6371
 epoch: 36, train_loss: 0.3713, test_loss: 1.3927, test_f1: 0.5508
 epoch: 37, train_loss: 0.3507, test_loss: 1.4577, test_f1: 0.5759
 epoch: 38, train_loss: 0.3230, test_loss: 1.7400, test_f1: 0.5690
 epoch: 39, train_loss: 0.3265, test_loss: 1.3822, test_f1: 0.6144
 epoch: 40, train_loss: 0.3306, test_loss: 1.8854, test_f1: 0.5728
 epoch: 41, train_loss: 0.3325, test_loss: 1.5280, test_f1: 0.6005
 epoch: 42, train_loss: 0.3102, test_loss: 1.5278, test_f1: 0.5811
 epoch: 43, train_loss: 0.3044, test_loss: 1.4717, test_f1: 0.6075
 epoch: 44, train_loss: 0.3561, test_loss: 1.6854, test_f1: 0.6201
 epoch: 45, train_loss: 0.2895, test_loss: 1.5468, test_f1: 0.6136
 epoch: 46, train_loss: 0.2863, test_loss: 1.9074, test_f1: 0.6264
 epoch: 47, train_loss: 0.2876, test_loss: 1.6905, test_f1: 0.5759
 epoch: 48, train_loss: 0.2892, test_loss: 1.7624, test_f1: 0.5902
 epoch: 49, train_loss: 0.3077, test_loss: 1.7263, test_f1: 0.6215
 epoch: 50, train_loss: 0.2867, test_loss: 1.6460, test_f1: 0.6103
 epoch: 51, train_loss: 0.2354, test_loss: 1.7494, test_f1: 0.6514
 epoch: 52, train_loss: 0.2113, test_loss: 1.8810, test_f1: 0.6582
 epoch: 53, train_loss: 0.1878, test_loss: 1.9194, test_f1: 0.6292
 epoch: 54, train_loss: 0.1736, test_loss: 1.7578, test_f1: 0.6243
 epoch: 55, train_loss: 0.1816, test_loss: 1.8367, test_f1: 0.6486
 epoch: 56, train_loss: 0.1844, test_loss: 2.0938, test_f1: 0.5990
 epoch: 57, train_loss: 0.1757, test_loss: 1.9939, test_f1: 0.6099
 epoch: 58, train_loss: 0.1717, test_loss: 1.9395, test_f1: 0.6303
 epoch: 59, train_loss: 0.1649, test_loss: 1.9431, test_f1: 0.6376
 epoch: 60, train_loss: 0.1766, test_loss: 1.9948, test_f1: 0.6273
 epoch: 61, train_loss: 0.1664, test_loss: 2.1229, test_f1: 0.6594
 epoch: 62, train_loss: 0.1495, test_loss: 1.9679, test_f1: 0.6293
 epoch: 63, train_loss: 0.1666, test_loss: 2.1003, test_f1: 0.6768
 epoch: 64, train_loss: 0.1560, test_loss: 2.2639, test_f1: 0.6293
 epoch: 65, train_loss: 0.1335, test_loss: 2.1891, test_f1: 0.6358
 epoch: 66, train_loss: 0.1345, test_loss: 1.9853, test_f1: 0.6625
 epoch: 67, train_loss: 0.1372, test_loss: 2.2053, test_f1: 0.6278
 epoch: 68, train_loss: 0.1638, test_loss: 2.0991, test_f1: 0.6573
 epoch: 69, train_loss: 0.1552, test_loss: 2.1603, test_f1: 0.6333
 epoch: 70, train_loss: 0.1410, test_loss: 2.2246, test_f1: 0.6409
 epoch: 71, train_loss: 0.1282, test_loss: 2.3997, test_f1: 0.6374
 epoch: 72, train_loss: 0.1247, test_loss: 2.6127, test_f1: 0.6159
 epoch: 73, train_loss: 0.1431, test_loss: 2.3350, test_f1: 0.6512
 epoch: 74, train_loss: 0.1133, test_loss: 2.3511, test_f1: 0.6402
 epoch: 75, train_loss: 0.1179, test_loss: 2.2413, test_f1: 0.6204
 epoch: 76, train_loss: 0.1375, test_loss: 2.2838, test_f1: 0.6462
 epoch: 77, train_loss: 0.1654, test_loss: 2.4208, test_f1: 0.6466
 epoch: 78, train_loss: 0.1347, test_loss: 2.0976, test_f1: 0.6530
 epoch: 79, train_loss: 0.1325, test_loss: 2.4713, test_f1: 0.6283
 epoch: 80, train_loss: 0.1501, test_loss: 2.0729, test_f1: 0.6627
 epoch: 81, train_loss: 0.1193, test_loss: 2.4440, test_f1: 0.6381
 epoch: 82, train_loss: 0.1205, test_loss: 2.1219, test_f1: 0.6646
 epoch: 83, train_loss: 0.1133, test_loss: 2.6365, test_f1: 0.6122
 epoch: 84, train_loss: 0.1145, test_loss: 2.5092, test_f1: 0.6398
 epoch: 85, train_loss: 0.1091, test_loss: 2.7111, test_f1: 0.6420
 epoch: 86, train_loss: 0.1196, test_loss: 2.5374, test_f1: 0.6488
 epoch: 87, train_loss: 0.1253, test_loss: 2.5064, test_f1: 0.6341
 epoch: 88, train_loss: 0.1288, test_loss: 2.5040, test_f1: 0.6250
 epoch: 89, train_loss: 0.1186, test_loss: 2.5916, test_f1: 0.6183
 epoch: 90, train_loss: 0.1131, test_loss: 2.4141, test_f1: 0.6560
 epoch: 91, train_loss: 0.1106, test_loss: 2.7380, test_f1: 0.6528
 epoch: 92, train_loss: 0.1016, test_loss: 2.6903, test_f1: 0.6514
 epoch: 93, train_loss: 0.1035, test_loss: 2.8149, test_f1: 0.6218
 epoch: 94, train_loss: 0.1074, test_loss: 2.5249, test_f1: 0.6606
 epoch: 95, train_loss: 0.1314, test_loss: 2.8588, test_f1: 0.6388
 epoch: 96, train_loss: 0.1055, test_loss: 2.8378, test_f1: 0.6269
 epoch: 97, train_loss: 0.1267, test_loss: 2.7306, test_f1: 0.6384
 epoch: 98, train_loss: 0.1206, test_loss: 3.2842, test_f1: 0.5973
 epoch: 99, train_loss: 0.1540, test_loss: 2.7659, test_f1: 0.6334
##################ITERATION #3 ****************************************
 epoch: 0, train_loss: 1.2042, test_loss: 1.3250, test_f1: 0.3087
 epoch: 1, train_loss: 1.0192, test_loss: 1.1174, test_f1: 0.5294
 epoch: 2, train_loss: 0.9631, test_loss: 1.0636, test_f1: 0.5251
 epoch: 3, train_loss: 0.9153, test_loss: 1.0182, test_f1: 0.5577
 epoch: 4, train_loss: 0.8826, test_loss: 0.9613, test_f1: 0.5766
 epoch: 5, train_loss: 0.8447, test_loss: 0.9474, test_f1: 0.6130
 epoch: 6, train_loss: 0.8238, test_loss: 0.9523, test_f1: 0.5971
 epoch: 7, train_loss: 0.7817, test_loss: 0.9566, test_f1: 0.5912
 epoch: 8, train_loss: 0.7602, test_loss: 1.0374, test_f1: 0.5805
 epoch: 9, train_loss: 0.7380, test_loss: 1.0198, test_f1: 0.5957
 epoch: 10, train_loss: 0.7266, test_loss: 1.0710, test_f1: 0.5433
 epoch: 11, train_loss: 0.7273, test_loss: 1.0309, test_f1: 0.6186
 epoch: 12, train_loss: 0.6864, test_loss: 1.0468, test_f1: 0.6384
 epoch: 13, train_loss: 0.6645, test_loss: 0.9962, test_f1: 0.5908
 epoch: 14, train_loss: 0.6761, test_loss: 0.9712, test_f1: 0.6221
 epoch: 15, train_loss: 0.6533, test_loss: 1.0421, test_f1: 0.5846
 epoch: 16, train_loss: 0.6249, test_loss: 1.0491, test_f1: 0.6263
 epoch: 17, train_loss: 0.6216, test_loss: 0.9638, test_f1: 0.6390
 epoch: 18, train_loss: 0.5947, test_loss: 1.0611, test_f1: 0.6360
 epoch: 19, train_loss: 0.5720, test_loss: 1.0145, test_f1: 0.6070
 epoch: 20, train_loss: 0.5782, test_loss: 1.0859, test_f1: 0.6096
 epoch: 21, train_loss: 0.5742, test_loss: 1.1268, test_f1: 0.5756
 epoch: 22, train_loss: 0.5570, test_loss: 1.1284, test_f1: 0.5643
 epoch: 23, train_loss: 0.5374, test_loss: 1.1478, test_f1: 0.6238
 epoch: 24, train_loss: 0.5403, test_loss: 0.9906, test_f1: 0.6179
 epoch: 25, train_loss: 0.5373, test_loss: 1.0150, test_f1: 0.6187
 epoch: 26, train_loss: 0.5012, test_loss: 1.0741, test_f1: 0.6300
 epoch: 27, train_loss: 0.5154, test_loss: 1.3242, test_f1: 0.5321
 epoch: 28, train_loss: 0.5138, test_loss: 1.1648, test_f1: 0.6070
 epoch: 29, train_loss: 0.5281, test_loss: 1.1434, test_f1: 0.6125
 epoch: 30, train_loss: 0.4818, test_loss: 1.2891, test_f1: 0.5950
 epoch: 31, train_loss: 0.4813, test_loss: 2.0549, test_f1: 0.4601
 epoch: 32, train_loss: 0.5122, test_loss: 1.1986, test_f1: 0.6131
 epoch: 33, train_loss: 0.4808, test_loss: 1.2283, test_f1: 0.5915
 epoch: 34, train_loss: 0.4212, test_loss: 1.2362, test_f1: 0.5786
 epoch: 35, train_loss: 0.4019, test_loss: 1.5319, test_f1: 0.5778
 epoch: 36, train_loss: 0.4355, test_loss: 1.2423, test_f1: 0.6136
 epoch: 37, train_loss: 0.4149, test_loss: 1.4415, test_f1: 0.5514
 epoch: 38, train_loss: 0.3979, test_loss: 1.3428, test_f1: 0.5716
 epoch: 39, train_loss: 0.3975, test_loss: 1.3625, test_f1: 0.6033
 epoch: 40, train_loss: 0.3905, test_loss: 1.4737, test_f1: 0.5493
 epoch: 41, train_loss: 0.3924, test_loss: 1.6649, test_f1: 0.5375
 epoch: 42, train_loss: 0.3707, test_loss: 1.5932, test_f1: 0.5620
 epoch: 43, train_loss: 0.3500, test_loss: 1.4770, test_f1: 0.5663
 epoch: 44, train_loss: 0.3583, test_loss: 1.4683, test_f1: 0.5663
 epoch: 45, train_loss: 0.3635, test_loss: 1.5981, test_f1: 0.5977
 epoch: 46, train_loss: 0.3753, test_loss: 1.6028, test_f1: 0.5716
 epoch: 47, train_loss: 0.3390, test_loss: 1.5073, test_f1: 0.5756
 epoch: 48, train_loss: 0.3325, test_loss: 1.7079, test_f1: 0.5597
 epoch: 49, train_loss: 0.3197, test_loss: 1.6112, test_f1: 0.5790
 epoch: 50, train_loss: 0.2732, test_loss: 1.5970, test_f1: 0.5927
 epoch: 51, train_loss: 0.2537, test_loss: 1.7592, test_f1: 0.5725
 epoch: 52, train_loss: 0.2343, test_loss: 1.6674, test_f1: 0.5825
 epoch: 53, train_loss: 0.2225, test_loss: 1.7415, test_f1: 0.5692
 epoch: 54, train_loss: 0.2189, test_loss: 1.9239, test_f1: 0.5907
 epoch: 55, train_loss: 0.2119, test_loss: 1.8256, test_f1: 0.5834
 epoch: 56, train_loss: 0.2172, test_loss: 1.9519, test_f1: 0.5879
 epoch: 57, train_loss: 0.2147, test_loss: 1.8230, test_f1: 0.5984
 epoch: 58, train_loss: 0.2083, test_loss: 2.0295, test_f1: 0.6019
 epoch: 59, train_loss: 0.1998, test_loss: 2.0897, test_f1: 0.5972
 epoch: 60, train_loss: 0.1940, test_loss: 1.9923, test_f1: 0.5805
 epoch: 61, train_loss: 0.1759, test_loss: 2.0169, test_f1: 0.5847
 epoch: 62, train_loss: 0.2069, test_loss: 2.0137, test_f1: 0.5968
 epoch: 63, train_loss: 0.1701, test_loss: 2.0398, test_f1: 0.6024
 epoch: 64, train_loss: 0.1849, test_loss: 2.2074, test_f1: 0.5850
 epoch: 65, train_loss: 0.1930, test_loss: 1.9587, test_f1: 0.6182
 epoch: 66, train_loss: 0.1763, test_loss: 2.0769, test_f1: 0.5847
 epoch: 67, train_loss: 0.1889, test_loss: 2.0912, test_f1: 0.5517
 epoch: 68, train_loss: 0.2021, test_loss: 2.2269, test_f1: 0.6084
 epoch: 69, train_loss: 0.1695, test_loss: 2.1911, test_f1: 0.5991
 epoch: 70, train_loss: 0.1949, test_loss: 2.2639, test_f1: 0.6074
 epoch: 71, train_loss: 0.1488, test_loss: 2.1557, test_f1: 0.5833
 epoch: 72, train_loss: 0.1764, test_loss: 2.2412, test_f1: 0.6290
 epoch: 73, train_loss: 0.1782, test_loss: 2.2233, test_f1: 0.5776
 epoch: 74, train_loss: 0.1849, test_loss: 2.0135, test_f1: 0.5733
 epoch: 75, train_loss: 0.1832, test_loss: 2.0783, test_f1: 0.5996
 epoch: 76, train_loss: 0.1504, test_loss: 2.2820, test_f1: 0.5941
 epoch: 77, train_loss: 0.1581, test_loss: 2.3172, test_f1: 0.6329
 epoch: 78, train_loss: 0.1506, test_loss: 2.1620, test_f1: 0.5999
 epoch: 79, train_loss: 0.1462, test_loss: 2.1715, test_f1: 0.6451
 epoch: 80, train_loss: 0.1428, test_loss: 2.3459, test_f1: 0.6006
 epoch: 81, train_loss: 0.1442, test_loss: 2.3684, test_f1: 0.5700
 epoch: 82, train_loss: 0.1649, test_loss: 2.3726, test_f1: 0.5688
 epoch: 83, train_loss: 0.1471, test_loss: 2.3336, test_f1: 0.5701
 epoch: 84, train_loss: 0.1425, test_loss: 2.3476, test_f1: 0.6102
 epoch: 85, train_loss: 0.1290, test_loss: 2.4090, test_f1: 0.6085
 epoch: 86, train_loss: 0.1430, test_loss: 2.4939, test_f1: 0.5864
 epoch: 87, train_loss: 0.1294, test_loss: 2.3453, test_f1: 0.6166
 epoch: 88, train_loss: 0.1253, test_loss: 2.3977, test_f1: 0.6107
 epoch: 89, train_loss: 0.1354, test_loss: 2.4923, test_f1: 0.6002
 epoch: 90, train_loss: 0.1442, test_loss: 2.4880, test_f1: 0.5991
 epoch: 91, train_loss: 0.1318, test_loss: 2.3151, test_f1: 0.6026
 epoch: 92, train_loss: 0.1482, test_loss: 2.4771, test_f1: 0.6467
 epoch: 93, train_loss: 0.1215, test_loss: 2.5504, test_f1: 0.5911
 epoch: 94, train_loss: 0.1156, test_loss: 2.6655, test_f1: 0.6159
 epoch: 95, train_loss: 0.1154, test_loss: 2.6424, test_f1: 0.6035
 epoch: 96, train_loss: 0.1314, test_loss: 2.6455, test_f1: 0.5766
 epoch: 97, train_loss: 0.1220, test_loss: 2.4342, test_f1: 0.6174
 epoch: 98, train_loss: 0.1155, test_loss: 2.5064, test_f1: 0.5997
 epoch: 99, train_loss: 0.1158, test_loss: 2.5141, test_f1: 0.6058
##################ITERATION #4 ****************************************
 epoch: 0, train_loss: 1.2563, test_loss: 1.3564, test_f1: 0.2991
 epoch: 1, train_loss: 1.0206, test_loss: 1.2265, test_f1: 0.4368
 epoch: 2, train_loss: 0.9377, test_loss: 1.0270, test_f1: 0.5086
 epoch: 3, train_loss: 0.8721, test_loss: 0.9946, test_f1: 0.5469
 epoch: 4, train_loss: 0.8290, test_loss: 0.9775, test_f1: 0.5951
 epoch: 5, train_loss: 0.7964, test_loss: 0.9447, test_f1: 0.6201
 epoch: 6, train_loss: 0.7724, test_loss: 0.9253, test_f1: 0.5992
 epoch: 7, train_loss: 0.7672, test_loss: 1.0372, test_f1: 0.6349
 epoch: 8, train_loss: 0.7432, test_loss: 0.9642, test_f1: 0.6381
 epoch: 9, train_loss: 0.7038, test_loss: 0.9876, test_f1: 0.6130
 epoch: 10, train_loss: 0.7013, test_loss: 1.0020, test_f1: 0.5750
 epoch: 11, train_loss: 0.6806, test_loss: 0.9451, test_f1: 0.6275
 epoch: 12, train_loss: 0.6374, test_loss: 1.0001, test_f1: 0.6356
 epoch: 13, train_loss: 0.6280, test_loss: 0.9453, test_f1: 0.5836
 epoch: 14, train_loss: 0.6105, test_loss: 1.2029, test_f1: 0.5759
 epoch: 15, train_loss: 0.5992, test_loss: 1.0587, test_f1: 0.5769
 epoch: 16, train_loss: 0.5956, test_loss: 1.0029, test_f1: 0.6268
 epoch: 17, train_loss: 0.5859, test_loss: 1.0723, test_f1: 0.5957
 epoch: 18, train_loss: 0.5770, test_loss: 1.0291, test_f1: 0.6042
 epoch: 19, train_loss: 0.5548, test_loss: 1.0860, test_f1: 0.6314
 epoch: 20, train_loss: 0.5215, test_loss: 1.0916, test_f1: 0.6034
 epoch: 21, train_loss: 0.5259, test_loss: 1.0659, test_f1: 0.6915
 epoch: 22, train_loss: 0.5496, test_loss: 1.3012, test_f1: 0.5396
 epoch: 23, train_loss: 0.5290, test_loss: 1.1561, test_f1: 0.6058
 epoch: 24, train_loss: 0.4799, test_loss: 1.1068, test_f1: 0.6096
 epoch: 25, train_loss: 0.4809, test_loss: 1.3115, test_f1: 0.6078
 epoch: 26, train_loss: 0.4722, test_loss: 1.1414, test_f1: 0.5950
 epoch: 27, train_loss: 0.4482, test_loss: 1.1946, test_f1: 0.6456
 epoch: 28, train_loss: 0.4657, test_loss: 1.3938, test_f1: 0.5459
 epoch: 29, train_loss: 0.4620, test_loss: 1.2188, test_f1: 0.6156
 epoch: 30, train_loss: 0.4263, test_loss: 1.1668, test_f1: 0.6261
 epoch: 31, train_loss: 0.4130, test_loss: 1.4806, test_f1: 0.5868
 epoch: 32, train_loss: 0.4104, test_loss: 1.2342, test_f1: 0.6227
 epoch: 33, train_loss: 0.3897, test_loss: 1.2895, test_f1: 0.6109
 epoch: 34, train_loss: 0.3879, test_loss: 1.3408, test_f1: 0.6426
 epoch: 35, train_loss: 0.3698, test_loss: 1.3718, test_f1: 0.6539
 epoch: 36, train_loss: 0.3611, test_loss: 1.3791, test_f1: 0.6306
 epoch: 37, train_loss: 0.3578, test_loss: 1.3203, test_f1: 0.6442
 epoch: 38, train_loss: 0.3452, test_loss: 1.4139, test_f1: 0.6408
 epoch: 39, train_loss: 0.4060, test_loss: 1.7809, test_f1: 0.5240
 epoch: 40, train_loss: 0.3592, test_loss: 1.3182, test_f1: 0.6573
 epoch: 41, train_loss: 0.3498, test_loss: 1.7059, test_f1: 0.5946
 epoch: 42, train_loss: 0.3198, test_loss: 1.4235, test_f1: 0.6414
 epoch: 43, train_loss: 0.2917, test_loss: 1.4691, test_f1: 0.6686
 epoch: 44, train_loss: 0.3052, test_loss: 1.6956, test_f1: 0.5889
 epoch: 45, train_loss: 0.3077, test_loss: 1.6895, test_f1: 0.6407
 epoch: 46, train_loss: 0.3048, test_loss: 1.3613, test_f1: 0.6530
 epoch: 47, train_loss: 0.3041, test_loss: 1.4141, test_f1: 0.6693
 epoch: 48, train_loss: 0.3048, test_loss: 1.7152, test_f1: 0.5829
 epoch: 49, train_loss: 0.3419, test_loss: 1.5414, test_f1: 0.5955
 epoch: 50, train_loss: 0.2798, test_loss: 1.6299, test_f1: 0.6410
 epoch: 51, train_loss: 0.2389, test_loss: 1.6535, test_f1: 0.6420
 epoch: 52, train_loss: 0.1980, test_loss: 1.6200, test_f1: 0.6344
 epoch: 53, train_loss: 0.1929, test_loss: 1.7962, test_f1: 0.6308
 epoch: 54, train_loss: 0.1797, test_loss: 1.6595, test_f1: 0.6381
 epoch: 55, train_loss: 0.1651, test_loss: 1.7231, test_f1: 0.6429
 epoch: 56, train_loss: 0.1847, test_loss: 1.9912, test_f1: 0.6063
 epoch: 57, train_loss: 0.1642, test_loss: 1.8219, test_f1: 0.6412
 epoch: 58, train_loss: 0.1622, test_loss: 1.9647, test_f1: 0.5959
 epoch: 59, train_loss: 0.1755, test_loss: 2.1123, test_f1: 0.5974
 epoch: 60, train_loss: 0.1393, test_loss: 1.9569, test_f1: 0.6152
 epoch: 61, train_loss: 0.1666, test_loss: 2.1695, test_f1: 0.6090
 epoch: 62, train_loss: 0.1648, test_loss: 1.9703, test_f1: 0.6251
 epoch: 63, train_loss: 0.1524, test_loss: 2.0775, test_f1: 0.6312
 epoch: 64, train_loss: 0.1556, test_loss: 1.8727, test_f1: 0.6352
 epoch: 65, train_loss: 0.1593, test_loss: 2.0813, test_f1: 0.6482
 epoch: 66, train_loss: 0.1516, test_loss: 2.1737, test_f1: 0.6022
 epoch: 67, train_loss: 0.1545, test_loss: 1.9162, test_f1: 0.6339
 epoch: 68, train_loss: 0.1465, test_loss: 2.1471, test_f1: 0.6347
 epoch: 69, train_loss: 0.1594, test_loss: 1.9764, test_f1: 0.6481
 epoch: 70, train_loss: 0.1457, test_loss: 2.3722, test_f1: 0.6241
 epoch: 71, train_loss: 0.1694, test_loss: 2.0040, test_f1: 0.6421
 epoch: 72, train_loss: 0.1481, test_loss: 2.0478, test_f1: 0.6653
 epoch: 73, train_loss: 0.1503, test_loss: 1.9913, test_f1: 0.6521
 epoch: 74, train_loss: 0.1528, test_loss: 2.2452, test_f1: 0.6185
 epoch: 75, train_loss: 0.1230, test_loss: 2.1062, test_f1: 0.6351
 epoch: 76, train_loss: 0.1218, test_loss: 2.3391, test_f1: 0.6065
 epoch: 77, train_loss: 0.1374, test_loss: 2.1834, test_f1: 0.6459
 epoch: 78, train_loss: 0.1249, test_loss: 2.1900, test_f1: 0.6543
 epoch: 79, train_loss: 0.1356, test_loss: 2.2555, test_f1: 0.6330
 epoch: 80, train_loss: 0.1290, test_loss: 2.2945, test_f1: 0.6221
 epoch: 81, train_loss: 0.1362, test_loss: 2.2115, test_f1: 0.6250
 epoch: 82, train_loss: 0.1535, test_loss: 2.1861, test_f1: 0.6260
 epoch: 83, train_loss: 0.1262, test_loss: 2.3222, test_f1: 0.6457
 epoch: 84, train_loss: 0.1355, test_loss: 2.2404, test_f1: 0.6332
 epoch: 85, train_loss: 0.1315, test_loss: 2.2429, test_f1: 0.6427
 epoch: 86, train_loss: 0.1305, test_loss: 2.3021, test_f1: 0.6373
 epoch: 87, train_loss: 0.1282, test_loss: 2.3518, test_f1: 0.6543
 epoch: 88, train_loss: 0.1339, test_loss: 2.4050, test_f1: 0.6344
 epoch: 89, train_loss: 0.1534, test_loss: 2.5173, test_f1: 0.5988
 epoch: 90, train_loss: 0.1453, test_loss: 2.3049, test_f1: 0.6474
 epoch: 91, train_loss: 0.1352, test_loss: 2.1070, test_f1: 0.6588
 epoch: 92, train_loss: 0.1074, test_loss: 2.3765, test_f1: 0.6547
 epoch: 93, train_loss: 0.1021, test_loss: 2.2053, test_f1: 0.6627
 epoch: 94, train_loss: 0.0983, test_loss: 2.4038, test_f1: 0.6363
 epoch: 95, train_loss: 0.1202, test_loss: 2.1932, test_f1: 0.6328
 epoch: 96, train_loss: 0.1006, test_loss: 2.4467, test_f1: 0.6564
 epoch: 97, train_loss: 0.0990, test_loss: 2.3079, test_f1: 0.6236
 epoch: 98, train_loss: 0.0872, test_loss: 2.2926, test_f1: 0.6568
 epoch: 99, train_loss: 0.0839, test_loss: 2.3488, test_f1: 0.6537
##################ITERATION #5 ****************************************
 epoch: 0, train_loss: 1.1813, test_loss: 1.4052, test_f1: 0.3277
 epoch: 1, train_loss: 1.0020, test_loss: 1.2466, test_f1: 0.3716
 epoch: 2, train_loss: 0.9194, test_loss: 1.0210, test_f1: 0.5628
 epoch: 3, train_loss: 0.8736, test_loss: 1.0718, test_f1: 0.5445
 epoch: 4, train_loss: 0.8248, test_loss: 1.0844, test_f1: 0.5475
 epoch: 5, train_loss: 0.8059, test_loss: 1.1408, test_f1: 0.4439
 epoch: 6, train_loss: 0.7887, test_loss: 1.0339, test_f1: 0.5251
 epoch: 7, train_loss: 0.7566, test_loss: 0.9842, test_f1: 0.5522
 epoch: 8, train_loss: 0.7476, test_loss: 1.0155, test_f1: 0.5442
 epoch: 9, train_loss: 0.7283, test_loss: 0.9677, test_f1: 0.6018
 epoch: 10, train_loss: 0.6912, test_loss: 0.9752, test_f1: 0.6218
 epoch: 11, train_loss: 0.6805, test_loss: 1.0795, test_f1: 0.5444
 epoch: 12, train_loss: 0.6616, test_loss: 1.1627, test_f1: 0.5357
 epoch: 13, train_loss: 0.6712, test_loss: 1.1589, test_f1: 0.5650
 epoch: 14, train_loss: 0.6484, test_loss: 1.1907, test_f1: 0.5323
 epoch: 15, train_loss: 0.6226, test_loss: 1.1395, test_f1: 0.5601
 epoch: 16, train_loss: 0.6046, test_loss: 1.1484, test_f1: 0.5597
 epoch: 17, train_loss: 0.6121, test_loss: 1.1436, test_f1: 0.6188
 epoch: 18, train_loss: 0.6001, test_loss: 1.0706, test_f1: 0.6233
 epoch: 19, train_loss: 0.5769, test_loss: 1.1561, test_f1: 0.6241
 epoch: 20, train_loss: 0.5497, test_loss: 1.2063, test_f1: 0.5590
 epoch: 21, train_loss: 0.5352, test_loss: 1.1149, test_f1: 0.5985
 epoch: 22, train_loss: 0.5252, test_loss: 1.1973, test_f1: 0.5922
 epoch: 23, train_loss: 0.5280, test_loss: 1.2696, test_f1: 0.5823
 epoch: 24, train_loss: 0.4973, test_loss: 1.3597, test_f1: 0.5542
 epoch: 25, train_loss: 0.5142, test_loss: 1.2544, test_f1: 0.5866
 epoch: 26, train_loss: 0.5009, test_loss: 1.4568, test_f1: 0.5380
 epoch: 27, train_loss: 0.4748, test_loss: 1.2795, test_f1: 0.6140
 epoch: 28, train_loss: 0.4719, test_loss: 1.2784, test_f1: 0.5795
 epoch: 29, train_loss: 0.4698, test_loss: 1.7966, test_f1: 0.5314
 epoch: 30, train_loss: 0.4769, test_loss: 1.3482, test_f1: 0.5678
 epoch: 31, train_loss: 0.4253, test_loss: 1.4449, test_f1: 0.5885
 epoch: 32, train_loss: 0.4549, test_loss: 1.3591, test_f1: 0.6168
 epoch: 33, train_loss: 0.4552, test_loss: 1.4767, test_f1: 0.5679
 epoch: 34, train_loss: 0.4257, test_loss: 1.5911, test_f1: 0.5872
 epoch: 35, train_loss: 0.4523, test_loss: 1.7027, test_f1: 0.5804
 epoch: 36, train_loss: 0.4503, test_loss: 1.6582, test_f1: 0.6014
 epoch: 37, train_loss: 0.4013, test_loss: 1.3168, test_f1: 0.6055
 epoch: 38, train_loss: 0.3890, test_loss: 1.4302, test_f1: 0.5882
 epoch: 39, train_loss: 0.3965, test_loss: 1.5200, test_f1: 0.5863
 epoch: 40, train_loss: 0.3557, test_loss: 1.6040, test_f1: 0.5620
 epoch: 41, train_loss: 0.3676, test_loss: 1.7327, test_f1: 0.5889
 epoch: 42, train_loss: 0.3521, test_loss: 1.5805, test_f1: 0.6166
 epoch: 43, train_loss: 0.3485, test_loss: 1.8100, test_f1: 0.5814
 epoch: 44, train_loss: 0.3545, test_loss: 1.7000, test_f1: 0.5798
 epoch: 45, train_loss: 0.3659, test_loss: 1.8478, test_f1: 0.5914
 epoch: 46, train_loss: 0.3679, test_loss: 1.7734, test_f1: 0.5891
 epoch: 47, train_loss: 0.3286, test_loss: 1.5960, test_f1: 0.5564
 epoch: 48, train_loss: 0.3233, test_loss: 1.9269, test_f1: 0.5404
 epoch: 49, train_loss: 0.3332, test_loss: 1.6717, test_f1: 0.6166
 epoch: 50, train_loss: 0.3087, test_loss: 1.7722, test_f1: 0.5999
 epoch: 51, train_loss: 0.2576, test_loss: 1.7527, test_f1: 0.6347
 epoch: 52, train_loss: 0.2437, test_loss: 1.7490, test_f1: 0.6182
 epoch: 53, train_loss: 0.1981, test_loss: 1.8637, test_f1: 0.6183
 epoch: 54, train_loss: 0.2179, test_loss: 2.0145, test_f1: 0.6149
 epoch: 55, train_loss: 0.2001, test_loss: 1.9312, test_f1: 0.6060
 epoch: 56, train_loss: 0.1966, test_loss: 2.1207, test_f1: 0.6246
 epoch: 57, train_loss: 0.2005, test_loss: 2.0393, test_f1: 0.6284
 epoch: 58, train_loss: 0.1846, test_loss: 2.2417, test_f1: 0.5982
 epoch: 59, train_loss: 0.1713, test_loss: 2.0719, test_f1: 0.6120
 epoch: 60, train_loss: 0.1888, test_loss: 2.2516, test_f1: 0.5974
 epoch: 61, train_loss: 0.2003, test_loss: 2.0866, test_f1: 0.5815
 epoch: 62, train_loss: 0.1627, test_loss: 2.3952, test_f1: 0.5968
 epoch: 63, train_loss: 0.1651, test_loss: 2.4068, test_f1: 0.5790
 epoch: 64, train_loss: 0.1514, test_loss: 2.5713, test_f1: 0.5932
 epoch: 65, train_loss: 0.1544, test_loss: 2.2791, test_f1: 0.6132
 epoch: 66, train_loss: 0.1691, test_loss: 2.3611, test_f1: 0.6009
 epoch: 67, train_loss: 0.1628, test_loss: 2.2358, test_f1: 0.6048
 epoch: 68, train_loss: 0.1883, test_loss: 2.3554, test_f1: 0.5961
 epoch: 69, train_loss: 0.1794, test_loss: 2.5996, test_f1: 0.5922
 epoch: 70, train_loss: 0.1643, test_loss: 2.2854, test_f1: 0.5960
 epoch: 71, train_loss: 0.1791, test_loss: 2.4878, test_f1: 0.5966
 epoch: 72, train_loss: 0.1855, test_loss: 2.5317, test_f1: 0.5744
 epoch: 73, train_loss: 0.1803, test_loss: 2.2350, test_f1: 0.5904
 epoch: 74, train_loss: 0.1350, test_loss: 2.5336, test_f1: 0.6247
 epoch: 75, train_loss: 0.1536, test_loss: 2.4768, test_f1: 0.6036
 epoch: 76, train_loss: 0.1292, test_loss: 2.6927, test_f1: 0.5896
 epoch: 77, train_loss: 0.1533, test_loss: 2.7203, test_f1: 0.5991
 epoch: 78, train_loss: 0.1532, test_loss: 2.3036, test_f1: 0.6356
 epoch: 79, train_loss: 0.1407, test_loss: 2.7261, test_f1: 0.5642
 epoch: 80, train_loss: 0.1536, test_loss: 2.8970, test_f1: 0.5848
 epoch: 81, train_loss: 0.1543, test_loss: 2.3452, test_f1: 0.6331
 epoch: 82, train_loss: 0.1487, test_loss: 2.7279, test_f1: 0.5894
 epoch: 83, train_loss: 0.1331, test_loss: 2.6427, test_f1: 0.5963
 epoch: 84, train_loss: 0.1397, test_loss: 2.6436, test_f1: 0.5824
 epoch: 85, train_loss: 0.1674, test_loss: 2.7221, test_f1: 0.5743
 epoch: 86, train_loss: 0.1708, test_loss: 2.6616, test_f1: 0.5913
 epoch: 87, train_loss: 0.1468, test_loss: 2.4603, test_f1: 0.6110
 epoch: 88, train_loss: 0.1361, test_loss: 2.8273, test_f1: 0.6108
 epoch: 89, train_loss: 0.1446, test_loss: 2.7243, test_f1: 0.6020
 epoch: 90, train_loss: 0.1427, test_loss: 2.5774, test_f1: 0.5977
 epoch: 91, train_loss: 0.1225, test_loss: 2.8749, test_f1: 0.6161
 epoch: 92, train_loss: 0.1087, test_loss: 2.9436, test_f1: 0.5926
 epoch: 93, train_loss: 0.1115, test_loss: 2.5676, test_f1: 0.6314
 epoch: 94, train_loss: 0.1077, test_loss: 3.1433, test_f1: 0.5841
 epoch: 95, train_loss: 0.1231, test_loss: 2.8560, test_f1: 0.5948
 epoch: 96, train_loss: 0.1183, test_loss: 2.8316, test_f1: 0.5888
 epoch: 97, train_loss: 0.1236, test_loss: 2.9124, test_f1: 0.6179
 epoch: 98, train_loss: 0.2147, test_loss: 2.7940, test_f1: 0.6076
 epoch: 99, train_loss: 0.1591, test_loss: 2.7994, test_f1: 0.5627
##################ITERATION #6 ****************************************
 epoch: 0, train_loss: 1.4109, test_loss: 1.4590, test_f1: 0.1365
 epoch: 1, train_loss: 1.0776, test_loss: 1.4394, test_f1: 0.2701
 epoch: 2, train_loss: 0.9790, test_loss: 1.1065, test_f1: 0.5538
 epoch: 3, train_loss: 0.9481, test_loss: 1.0235, test_f1: 0.5755
 epoch: 4, train_loss: 0.9140, test_loss: 1.0481, test_f1: 0.5496
 epoch: 5, train_loss: 0.8854, test_loss: 1.0212, test_f1: 0.5624
 epoch: 6, train_loss: 0.8385, test_loss: 1.0324, test_f1: 0.6026
 epoch: 7, train_loss: 0.8485, test_loss: 1.0932, test_f1: 0.5851
 epoch: 8, train_loss: 0.8103, test_loss: 1.0435, test_f1: 0.5537
 epoch: 9, train_loss: 0.7823, test_loss: 1.0004, test_f1: 0.6166
 epoch: 10, train_loss: 0.7865, test_loss: 1.0233, test_f1: 0.5969
 epoch: 11, train_loss: 0.7691, test_loss: 1.0068, test_f1: 0.5508
 epoch: 12, train_loss: 0.7312, test_loss: 1.0041, test_f1: 0.6154
 epoch: 13, train_loss: 0.6991, test_loss: 1.0375, test_f1: 0.6263
 epoch: 14, train_loss: 0.7061, test_loss: 1.0822, test_f1: 0.5201
 epoch: 15, train_loss: 0.6967, test_loss: 1.1022, test_f1: 0.5388
 epoch: 16, train_loss: 0.6821, test_loss: 1.1021, test_f1: 0.5744
 epoch: 17, train_loss: 0.6572, test_loss: 1.1784, test_f1: 0.5642
 epoch: 18, train_loss: 0.6706, test_loss: 1.3679, test_f1: 0.5791
 epoch: 19, train_loss: 0.6447, test_loss: 1.0517, test_f1: 0.6148
 epoch: 20, train_loss: 0.6341, test_loss: 1.1260, test_f1: 0.6005
 epoch: 21, train_loss: 0.6280, test_loss: 1.1346, test_f1: 0.5587
 epoch: 22, train_loss: 0.6082, test_loss: 1.1591, test_f1: 0.5879
 epoch: 23, train_loss: 0.5696, test_loss: 1.2173, test_f1: 0.5198
 epoch: 24, train_loss: 0.5621, test_loss: 1.2222, test_f1: 0.5441
 epoch: 25, train_loss: 0.5726, test_loss: 1.2064, test_f1: 0.5853
 epoch: 26, train_loss: 0.5581, test_loss: 1.1159, test_f1: 0.6178
 epoch: 27, train_loss: 0.5491, test_loss: 1.3396, test_f1: 0.5761
 epoch: 28, train_loss: 0.5136, test_loss: 1.2919, test_f1: 0.5584
 epoch: 29, train_loss: 0.5270, test_loss: 1.1862, test_f1: 0.6178
 epoch: 30, train_loss: 0.5191, test_loss: 1.1802, test_f1: 0.6186
 epoch: 31, train_loss: 0.5190, test_loss: 1.1539, test_f1: 0.6444
 epoch: 32, train_loss: 0.5059, test_loss: 1.3481, test_f1: 0.5536
 epoch: 33, train_loss: 0.5013, test_loss: 1.2327, test_f1: 0.6126
 epoch: 34, train_loss: 0.5227, test_loss: 1.4980, test_f1: 0.5269
 epoch: 35, train_loss: 0.4917, test_loss: 1.2966, test_f1: 0.6155
 epoch: 36, train_loss: 0.4726, test_loss: 1.2936, test_f1: 0.5907
 epoch: 37, train_loss: 0.4790, test_loss: 1.2484, test_f1: 0.6255
 epoch: 38, train_loss: 0.4492, test_loss: 1.3950, test_f1: 0.6201
 epoch: 39, train_loss: 0.3933, test_loss: 1.3415, test_f1: 0.6350
 epoch: 40, train_loss: 0.4202, test_loss: 1.3071, test_f1: 0.6134
 epoch: 41, train_loss: 0.4256, test_loss: 1.4047, test_f1: 0.6430
 epoch: 42, train_loss: 0.4311, test_loss: 1.2345, test_f1: 0.6448
 epoch: 43, train_loss: 0.4027, test_loss: 1.3181, test_f1: 0.6098
 epoch: 44, train_loss: 0.3765, test_loss: 1.5716, test_f1: 0.6132
 epoch: 45, train_loss: 0.3696, test_loss: 1.5385, test_f1: 0.5855
 epoch: 46, train_loss: 0.3558, test_loss: 1.3716, test_f1: 0.6639
 epoch: 47, train_loss: 0.4085, test_loss: 1.3977, test_f1: 0.6343
 epoch: 48, train_loss: 0.3988, test_loss: 1.6753, test_f1: 0.5685
 epoch: 49, train_loss: 0.3683, test_loss: 1.4655, test_f1: 0.6162
 epoch: 50, train_loss: 0.3677, test_loss: 1.4918, test_f1: 0.6148
 epoch: 51, train_loss: 0.2935, test_loss: 1.5039, test_f1: 0.6146
 epoch: 52, train_loss: 0.2720, test_loss: 1.4696, test_f1: 0.6253
 epoch: 53, train_loss: 0.2601, test_loss: 1.5590, test_f1: 0.6191
 epoch: 54, train_loss: 0.2556, test_loss: 1.5311, test_f1: 0.6427
 epoch: 55, train_loss: 0.2589, test_loss: 1.6248, test_f1: 0.6456
 epoch: 56, train_loss: 0.2583, test_loss: 1.6777, test_f1: 0.5995
 epoch: 57, train_loss: 0.2265, test_loss: 1.5953, test_f1: 0.6268
 epoch: 58, train_loss: 0.2637, test_loss: 1.7868, test_f1: 0.6090
 epoch: 59, train_loss: 0.2583, test_loss: 1.7740, test_f1: 0.5975
 epoch: 60, train_loss: 0.2413, test_loss: 1.7515, test_f1: 0.5950
 epoch: 61, train_loss: 0.2182, test_loss: 1.6991, test_f1: 0.6182
 epoch: 62, train_loss: 0.2282, test_loss: 1.6944, test_f1: 0.6200
 epoch: 63, train_loss: 0.2444, test_loss: 1.7828, test_f1: 0.6103
 epoch: 64, train_loss: 0.2253, test_loss: 1.8764, test_f1: 0.6297
 epoch: 65, train_loss: 0.2154, test_loss: 1.8675, test_f1: 0.6026
 epoch: 66, train_loss: 0.2044, test_loss: 1.9245, test_f1: 0.6137
 epoch: 67, train_loss: 0.2057, test_loss: 1.8742, test_f1: 0.6088
 epoch: 68, train_loss: 0.2255, test_loss: 1.9806, test_f1: 0.6102
 epoch: 69, train_loss: 0.2450, test_loss: 1.7634, test_f1: 0.6247
 epoch: 70, train_loss: 0.1884, test_loss: 1.7479, test_f1: 0.6432
 epoch: 71, train_loss: 0.1798, test_loss: 1.7840, test_f1: 0.6559
 epoch: 72, train_loss: 0.1913, test_loss: 1.9554, test_f1: 0.5856
 epoch: 73, train_loss: 0.2003, test_loss: 1.7278, test_f1: 0.6683
 epoch: 74, train_loss: 0.2178, test_loss: 1.9122, test_f1: 0.6159
 epoch: 75, train_loss: 0.1979, test_loss: 2.0012, test_f1: 0.6331
 epoch: 76, train_loss: 0.1767, test_loss: 1.8450, test_f1: 0.6569
 epoch: 77, train_loss: 0.1721, test_loss: 1.8588, test_f1: 0.6644
 epoch: 78, train_loss: 0.1808, test_loss: 2.0639, test_f1: 0.6593
 epoch: 79, train_loss: 0.2359, test_loss: 1.8830, test_f1: 0.6274
 epoch: 80, train_loss: 0.2040, test_loss: 1.9199, test_f1: 0.6422
 epoch: 81, train_loss: 0.1690, test_loss: 2.0436, test_f1: 0.6303
 epoch: 82, train_loss: 0.1765, test_loss: 1.9473, test_f1: 0.6054
 epoch: 83, train_loss: 0.1962, test_loss: 2.0745, test_f1: 0.6162
 epoch: 84, train_loss: 0.2043, test_loss: 2.0484, test_f1: 0.6091
 epoch: 85, train_loss: 0.1788, test_loss: 2.1035, test_f1: 0.6065
 epoch: 86, train_loss: 0.1584, test_loss: 2.1371, test_f1: 0.6364
 epoch: 87, train_loss: 0.1760, test_loss: 2.1807, test_f1: 0.5892
 epoch: 88, train_loss: 0.1775, test_loss: 2.0857, test_f1: 0.6268
 epoch: 89, train_loss: 0.1728, test_loss: 2.1918, test_f1: 0.5613
 epoch: 90, train_loss: 0.1689, test_loss: 2.1209, test_f1: 0.6390
 epoch: 91, train_loss: 0.1616, test_loss: 2.0504, test_f1: 0.6610
 epoch: 92, train_loss: 0.1491, test_loss: 2.1575, test_f1: 0.6335
 epoch: 93, train_loss: 0.1471, test_loss: 2.1656, test_f1: 0.6302
 epoch: 94, train_loss: 0.1584, test_loss: 2.5624, test_f1: 0.6111
 epoch: 95, train_loss: 0.1530, test_loss: 2.3812, test_f1: 0.6407
 epoch: 96, train_loss: 0.1439, test_loss: 2.1862, test_f1: 0.6225
 epoch: 97, train_loss: 0.1280, test_loss: 2.3257, test_f1: 0.6089
 epoch: 98, train_loss: 0.1631, test_loss: 2.1238, test_f1: 0.6383
 epoch: 99, train_loss: 0.1719, test_loss: 2.2618, test_f1: 0.6293
##################ITERATION #7 ****************************************
 epoch: 0, train_loss: 1.3193, test_loss: 1.4935, test_f1: 0.1476
 epoch: 1, train_loss: 1.0702, test_loss: 1.2056, test_f1: 0.4910
 epoch: 2, train_loss: 0.9549, test_loss: 1.1224, test_f1: 0.5779
 epoch: 3, train_loss: 0.9113, test_loss: 1.0852, test_f1: 0.5452
 epoch: 4, train_loss: 0.8574, test_loss: 1.1031, test_f1: 0.5527
 epoch: 5, train_loss: 0.8414, test_loss: 1.0596, test_f1: 0.5590
 epoch: 6, train_loss: 0.8278, test_loss: 1.0250, test_f1: 0.5677
 epoch: 7, train_loss: 0.7909, test_loss: 1.0035, test_f1: 0.6177
 epoch: 8, train_loss: 0.7540, test_loss: 1.0774, test_f1: 0.5932
 epoch: 9, train_loss: 0.7596, test_loss: 1.1415, test_f1: 0.5865
 epoch: 10, train_loss: 0.7137, test_loss: 1.0927, test_f1: 0.5399
 epoch: 11, train_loss: 0.7248, test_loss: 1.0473, test_f1: 0.6036
 epoch: 12, train_loss: 0.6797, test_loss: 1.1138, test_f1: 0.5211
 epoch: 13, train_loss: 0.6738, test_loss: 1.1006, test_f1: 0.5684
 epoch: 14, train_loss: 0.6605, test_loss: 1.2470, test_f1: 0.5194
 epoch: 15, train_loss: 0.6312, test_loss: 1.1737, test_f1: 0.5816
 epoch: 16, train_loss: 0.6304, test_loss: 1.1665, test_f1: 0.5541
 epoch: 17, train_loss: 0.6079, test_loss: 1.2154, test_f1: 0.5928
 epoch: 18, train_loss: 0.6230, test_loss: 1.3388, test_f1: 0.5568
 epoch: 19, train_loss: 0.6163, test_loss: 1.0710, test_f1: 0.5288
 epoch: 20, train_loss: 0.5910, test_loss: 1.4136, test_f1: 0.5668
 epoch: 21, train_loss: 0.5613, test_loss: 1.1588, test_f1: 0.6218
 epoch: 22, train_loss: 0.5561, test_loss: 1.2566, test_f1: 0.5946
 epoch: 23, train_loss: 0.5210, test_loss: 1.5747, test_f1: 0.5672
 epoch: 24, train_loss: 0.5499, test_loss: 1.3917, test_f1: 0.5649
 epoch: 25, train_loss: 0.5327, test_loss: 1.3485, test_f1: 0.5808
 epoch: 26, train_loss: 0.4904, test_loss: 1.3722, test_f1: 0.5623
 epoch: 27, train_loss: 0.5166, test_loss: 1.2532, test_f1: 0.6196
 epoch: 28, train_loss: 0.5002, test_loss: 1.3104, test_f1: 0.5923
 epoch: 29, train_loss: 0.4824, test_loss: 1.3213, test_f1: 0.6003
 epoch: 30, train_loss: 0.4702, test_loss: 1.2579, test_f1: 0.6253
 epoch: 31, train_loss: 0.4636, test_loss: 1.2750, test_f1: 0.5805
 epoch: 32, train_loss: 0.4053, test_loss: 1.4136, test_f1: 0.6060
 epoch: 33, train_loss: 0.4340, test_loss: 1.5304, test_f1: 0.5653
 epoch: 34, train_loss: 0.4292, test_loss: 1.4388, test_f1: 0.5738
 epoch: 35, train_loss: 0.4070, test_loss: 1.5059, test_f1: 0.5840
 epoch: 36, train_loss: 0.4050, test_loss: 1.7053, test_f1: 0.5518
 epoch: 37, train_loss: 0.4019, test_loss: 1.4703, test_f1: 0.6200
 epoch: 38, train_loss: 0.3912, test_loss: 1.4109, test_f1: 0.6377
 epoch: 39, train_loss: 0.3885, test_loss: 1.6059, test_f1: 0.6243
 epoch: 40, train_loss: 0.3729, test_loss: 1.8216, test_f1: 0.5586
 epoch: 41, train_loss: 0.3357, test_loss: 1.5704, test_f1: 0.6080
 epoch: 42, train_loss: 0.3352, test_loss: 1.6007, test_f1: 0.6318
 epoch: 43, train_loss: 0.3641, test_loss: 1.9740, test_f1: 0.5871
 epoch: 44, train_loss: 0.3554, test_loss: 1.7963, test_f1: 0.6107
 epoch: 45, train_loss: 0.3371, test_loss: 1.6861, test_f1: 0.5937
 epoch: 46, train_loss: 0.3673, test_loss: 1.7862, test_f1: 0.6354
 epoch: 47, train_loss: 0.3784, test_loss: 1.7161, test_f1: 0.6229
 epoch: 48, train_loss: 0.3724, test_loss: 1.5625, test_f1: 0.6191
 epoch: 49, train_loss: 0.3497, test_loss: 1.7118, test_f1: 0.5947
 epoch: 50, train_loss: 0.3132, test_loss: 1.5098, test_f1: 0.6421
 epoch: 51, train_loss: 0.2892, test_loss: 1.8546, test_f1: 0.5902
 epoch: 52, train_loss: 0.2497, test_loss: 1.5713, test_f1: 0.6074
 epoch: 53, train_loss: 0.2208, test_loss: 1.9358, test_f1: 0.6024
 epoch: 54, train_loss: 0.2195, test_loss: 1.8455, test_f1: 0.6066
 epoch: 55, train_loss: 0.2245, test_loss: 1.8819, test_f1: 0.6326
 epoch: 56, train_loss: 0.2409, test_loss: 1.8678, test_f1: 0.6089
 epoch: 57, train_loss: 0.2173, test_loss: 1.9229, test_f1: 0.6181
 epoch: 58, train_loss: 0.2265, test_loss: 1.9324, test_f1: 0.6368
 epoch: 59, train_loss: 0.2083, test_loss: 1.9834, test_f1: 0.6010
 epoch: 60, train_loss: 0.2132, test_loss: 1.8825, test_f1: 0.6231
 epoch: 61, train_loss: 0.2085, test_loss: 2.1750, test_f1: 0.5964
 epoch: 62, train_loss: 0.1920, test_loss: 2.2579, test_f1: 0.6077
 epoch: 63, train_loss: 0.1950, test_loss: 2.0966, test_f1: 0.6028
 epoch: 64, train_loss: 0.1919, test_loss: 1.9863, test_f1: 0.5898
 epoch: 65, train_loss: 0.2204, test_loss: 2.1054, test_f1: 0.6638
 epoch: 66, train_loss: 0.2017, test_loss: 2.1217, test_f1: 0.6436
 epoch: 67, train_loss: 0.1922, test_loss: 2.1420, test_f1: 0.6336
 epoch: 68, train_loss: 0.2021, test_loss: 2.2132, test_f1: 0.5934
 epoch: 69, train_loss: 0.1695, test_loss: 2.3773, test_f1: 0.5826
 epoch: 70, train_loss: 0.1849, test_loss: 2.3135, test_f1: 0.6275
 epoch: 71, train_loss: 0.1774, test_loss: 2.4266, test_f1: 0.6036
 epoch: 72, train_loss: 0.1608, test_loss: 2.2393, test_f1: 0.6374
 epoch: 73, train_loss: 0.1709, test_loss: 2.3171, test_f1: 0.6201
 epoch: 74, train_loss: 0.1563, test_loss: 2.3810, test_f1: 0.6406
 epoch: 75, train_loss: 0.1601, test_loss: 2.4771, test_f1: 0.5716
 epoch: 76, train_loss: 0.1610, test_loss: 2.3798, test_f1: 0.5907
 epoch: 77, train_loss: 0.1619, test_loss: 2.4745, test_f1: 0.5997
 epoch: 78, train_loss: 0.1672, test_loss: 2.2507, test_f1: 0.6584
 epoch: 79, train_loss: 0.1823, test_loss: 2.3835, test_f1: 0.6131
 epoch: 80, train_loss: 0.1663, test_loss: 2.5445, test_f1: 0.5940
 epoch: 81, train_loss: 0.1418, test_loss: 2.4571, test_f1: 0.6061
 epoch: 82, train_loss: 0.1423, test_loss: 2.4269, test_f1: 0.6257
 epoch: 83, train_loss: 0.1328, test_loss: 2.5901, test_f1: 0.6269
 epoch: 84, train_loss: 0.1245, test_loss: 2.7163, test_f1: 0.6156
 epoch: 85, train_loss: 0.1578, test_loss: 2.6229, test_f1: 0.6046
 epoch: 86, train_loss: 0.1400, test_loss: 2.6721, test_f1: 0.6078
 epoch: 87, train_loss: 0.1611, test_loss: 2.4867, test_f1: 0.6301
 epoch: 88, train_loss: 0.1622, test_loss: 2.4720, test_f1: 0.6008
 epoch: 89, train_loss: 0.1859, test_loss: 2.6320, test_f1: 0.6314
 epoch: 90, train_loss: 0.1449, test_loss: 2.5929, test_f1: 0.6303
 epoch: 91, train_loss: 0.1225, test_loss: 2.4365, test_f1: 0.6170
 epoch: 92, train_loss: 0.1133, test_loss: 2.7053, test_f1: 0.6452
 epoch: 93, train_loss: 0.1285, test_loss: 2.6869, test_f1: 0.6042
 epoch: 94, train_loss: 0.1243, test_loss: 2.9772, test_f1: 0.5892
 epoch: 95, train_loss: 0.1285, test_loss: 2.7487, test_f1: 0.5944
 epoch: 96, train_loss: 0.1635, test_loss: 2.6843, test_f1: 0.6182
 epoch: 97, train_loss: 0.1576, test_loss: 2.5657, test_f1: 0.6125
 epoch: 98, train_loss: 0.1224, test_loss: 2.7150, test_f1: 0.6099
 epoch: 99, train_loss: 0.1235, test_loss: 2.7501, test_f1: 0.6171
##################ITERATION #8 ****************************************
 epoch: 0, train_loss: 1.3409, test_loss: 1.3324, test_f1: 0.3346
 epoch: 1, train_loss: 1.0601, test_loss: 1.1551, test_f1: 0.4495
 epoch: 2, train_loss: 0.9878, test_loss: 1.1003, test_f1: 0.5274
 epoch: 3, train_loss: 0.9228, test_loss: 1.0749, test_f1: 0.5130
 epoch: 4, train_loss: 0.8615, test_loss: 1.1164, test_f1: 0.5426
 epoch: 5, train_loss: 0.8270, test_loss: 1.0537, test_f1: 0.5655
 epoch: 6, train_loss: 0.8041, test_loss: 1.1649, test_f1: 0.5310
 epoch: 7, train_loss: 0.7792, test_loss: 1.0730, test_f1: 0.5581
 epoch: 8, train_loss: 0.7711, test_loss: 1.1337, test_f1: 0.5218
 epoch: 9, train_loss: 0.7649, test_loss: 1.0643, test_f1: 0.5617
 epoch: 10, train_loss: 0.7312, test_loss: 1.0488, test_f1: 0.6006
 epoch: 11, train_loss: 0.6980, test_loss: 1.0666, test_f1: 0.5535
 epoch: 12, train_loss: 0.6933, test_loss: 1.1457, test_f1: 0.6123
 epoch: 13, train_loss: 0.6740, test_loss: 1.1520, test_f1: 0.5671
 epoch: 14, train_loss: 0.6292, test_loss: 1.1746, test_f1: 0.5696
 epoch: 15, train_loss: 0.6236, test_loss: 1.0792, test_f1: 0.5782
 epoch: 16, train_loss: 0.6270, test_loss: 1.2489, test_f1: 0.5377
 epoch: 17, train_loss: 0.6169, test_loss: 1.0440, test_f1: 0.6194
 epoch: 18, train_loss: 0.5738, test_loss: 1.3627, test_f1: 0.4990
 epoch: 19, train_loss: 0.5955, test_loss: 1.1458, test_f1: 0.5896
 epoch: 20, train_loss: 0.5660, test_loss: 1.1794, test_f1: 0.5838
 epoch: 21, train_loss: 0.5433, test_loss: 1.3426, test_f1: 0.5364
 epoch: 22, train_loss: 0.5301, test_loss: 1.2531, test_f1: 0.5783
 epoch: 23, train_loss: 0.5144, test_loss: 1.2356, test_f1: 0.5868
 epoch: 24, train_loss: 0.5591, test_loss: 1.3111, test_f1: 0.6140
 epoch: 25, train_loss: 0.4746, test_loss: 1.3117, test_f1: 0.5711
 epoch: 26, train_loss: 0.4968, test_loss: 1.5437, test_f1: 0.6138
 epoch: 27, train_loss: 0.4707, test_loss: 1.3267, test_f1: 0.5899
 epoch: 28, train_loss: 0.4863, test_loss: 1.3387, test_f1: 0.6015
 epoch: 29, train_loss: 0.4364, test_loss: 1.5303, test_f1: 0.5940
 epoch: 30, train_loss: 0.4578, test_loss: 1.5579, test_f1: 0.5738
 epoch: 31, train_loss: 0.4290, test_loss: 1.3107, test_f1: 0.5969
 epoch: 32, train_loss: 0.4535, test_loss: 1.3832, test_f1: 0.5424
 epoch: 33, train_loss: 0.4145, test_loss: 1.4283, test_f1: 0.6428
 epoch: 34, train_loss: 0.4087, test_loss: 1.3903, test_f1: 0.6548
 epoch: 35, train_loss: 0.3896, test_loss: 1.4840, test_f1: 0.6108
 epoch: 36, train_loss: 0.3984, test_loss: 1.6560, test_f1: 0.5793
 epoch: 37, train_loss: 0.3926, test_loss: 1.5714, test_f1: 0.5994
 epoch: 38, train_loss: 0.3596, test_loss: 1.6951, test_f1: 0.5808
 epoch: 39, train_loss: 0.3231, test_loss: 1.5028, test_f1: 0.6216
 epoch: 40, train_loss: 0.3192, test_loss: 1.5927, test_f1: 0.5755
 epoch: 41, train_loss: 0.3941, test_loss: 2.0139, test_f1: 0.5820
 epoch: 42, train_loss: 0.4057, test_loss: 1.6614, test_f1: 0.5839
 epoch: 43, train_loss: 0.3269, test_loss: 1.7431, test_f1: 0.5696
 epoch: 44, train_loss: 0.3142, test_loss: 1.5805, test_f1: 0.6304
 epoch: 45, train_loss: 0.3212, test_loss: 1.7203, test_f1: 0.6003
 epoch: 46, train_loss: 0.3044, test_loss: 2.0315, test_f1: 0.5654
 epoch: 47, train_loss: 0.3146, test_loss: 1.8797, test_f1: 0.5849
 epoch: 48, train_loss: 0.2829, test_loss: 2.3484, test_f1: 0.5646
 epoch: 49, train_loss: 0.3148, test_loss: 2.0513, test_f1: 0.5664
 epoch: 50, train_loss: 0.2826, test_loss: 2.0508, test_f1: 0.6050
 epoch: 51, train_loss: 0.2617, test_loss: 1.8353, test_f1: 0.6260
 epoch: 52, train_loss: 0.2437, test_loss: 2.0109, test_f1: 0.5873
 epoch: 53, train_loss: 0.2266, test_loss: 1.9969, test_f1: 0.5641
 epoch: 54, train_loss: 0.2321, test_loss: 2.0812, test_f1: 0.5744
 epoch: 55, train_loss: 0.2041, test_loss: 1.9484, test_f1: 0.5918
 epoch: 56, train_loss: 0.1922, test_loss: 1.8943, test_f1: 0.5778
 epoch: 57, train_loss: 0.2143, test_loss: 2.1695, test_f1: 0.5993
 epoch: 58, train_loss: 0.1880, test_loss: 2.1192, test_f1: 0.5789
 epoch: 59, train_loss: 0.1918, test_loss: 2.4280, test_f1: 0.5729
 epoch: 60, train_loss: 0.2008, test_loss: 2.2118, test_f1: 0.5808
 epoch: 61, train_loss: 0.1909, test_loss: 2.2196, test_f1: 0.5976
 epoch: 62, train_loss: 0.2075, test_loss: 2.2208, test_f1: 0.6185
 epoch: 63, train_loss: 0.1681, test_loss: 2.1972, test_f1: 0.5902
 epoch: 64, train_loss: 0.1614, test_loss: 2.2337, test_f1: 0.5901
 epoch: 65, train_loss: 0.1879, test_loss: 2.1185, test_f1: 0.5929
 epoch: 66, train_loss: 0.1734, test_loss: 2.3072, test_f1: 0.5789
 epoch: 67, train_loss: 0.1585, test_loss: 2.4158, test_f1: 0.5697
 epoch: 68, train_loss: 0.1962, test_loss: 2.4167, test_f1: 0.6092
 epoch: 69, train_loss: 0.1655, test_loss: 2.2579, test_f1: 0.5738
 epoch: 70, train_loss: 0.1669, test_loss: 2.5145, test_f1: 0.6001
 epoch: 71, train_loss: 0.1873, test_loss: 2.4355, test_f1: 0.5756
 epoch: 72, train_loss: 0.1596, test_loss: 2.5336, test_f1: 0.5866
 epoch: 73, train_loss: 0.1604, test_loss: 2.4447, test_f1: 0.5767
 epoch: 74, train_loss: 0.1604, test_loss: 2.4912, test_f1: 0.6020
 epoch: 75, train_loss: 0.1559, test_loss: 2.3640, test_f1: 0.5926
 epoch: 76, train_loss: 0.1301, test_loss: 2.4811, test_f1: 0.5936
 epoch: 77, train_loss: 0.1465, test_loss: 2.4763, test_f1: 0.5611
 epoch: 78, train_loss: 0.1402, test_loss: 2.5928, test_f1: 0.5836
 epoch: 79, train_loss: 0.1252, test_loss: 2.5494, test_f1: 0.5963
 epoch: 80, train_loss: 0.1225, test_loss: 2.8181, test_f1: 0.5976
 epoch: 81, train_loss: 0.1435, test_loss: 2.7563, test_f1: 0.5782
 epoch: 82, train_loss: 0.1684, test_loss: 2.6321, test_f1: 0.6123
 epoch: 83, train_loss: 0.1466, test_loss: 2.6022, test_f1: 0.5905
 epoch: 84, train_loss: 0.1427, test_loss: 2.4263, test_f1: 0.6151
 epoch: 85, train_loss: 0.1402, test_loss: 2.6897, test_f1: 0.5870
 epoch: 86, train_loss: 0.1200, test_loss: 2.5208, test_f1: 0.6137
 epoch: 87, train_loss: 0.1131, test_loss: 2.7153, test_f1: 0.6004
 epoch: 88, train_loss: 0.1414, test_loss: 2.8222, test_f1: 0.5914
 epoch: 89, train_loss: 0.1330, test_loss: 2.5669, test_f1: 0.5693
 epoch: 90, train_loss: 0.1238, test_loss: 2.8994, test_f1: 0.5860
 epoch: 91, train_loss: 0.1785, test_loss: 2.4773, test_f1: 0.5971
 epoch: 92, train_loss: 0.1374, test_loss: 2.8312, test_f1: 0.5910
 epoch: 93, train_loss: 0.1406, test_loss: 2.8959, test_f1: 0.6041
 epoch: 94, train_loss: 0.1323, test_loss: 2.6707, test_f1: 0.6152
 epoch: 95, train_loss: 0.1298, test_loss: 2.7916, test_f1: 0.5777
 epoch: 96, train_loss: 0.1443, test_loss: 2.7664, test_f1: 0.5844
 epoch: 97, train_loss: 0.1360, test_loss: 3.0415, test_f1: 0.5757
 epoch: 98, train_loss: 0.1420, test_loss: 2.6652, test_f1: 0.5928
 epoch: 99, train_loss: 0.1247, test_loss: 2.7556, test_f1: 0.5998
##################ITERATION #9 ****************************************
 epoch: 0, train_loss: 1.3544, test_loss: 1.6065, test_f1: 0.2014
 epoch: 1, train_loss: 1.0905, test_loss: 1.3414, test_f1: 0.3252
 epoch: 2, train_loss: 0.9832, test_loss: 1.3387, test_f1: 0.4548
 epoch: 3, train_loss: 0.9201, test_loss: 1.2673, test_f1: 0.5832
 epoch: 4, train_loss: 0.9047, test_loss: 1.2679, test_f1: 0.5201
 epoch: 5, train_loss: 0.8507, test_loss: 1.1334, test_f1: 0.5500
 epoch: 6, train_loss: 0.8267, test_loss: 1.1260, test_f1: 0.5579
 epoch: 7, train_loss: 0.7906, test_loss: 1.0889, test_f1: 0.6110
 epoch: 8, train_loss: 0.7534, test_loss: 1.1917, test_f1: 0.5856
 epoch: 9, train_loss: 0.7490, test_loss: 1.1101, test_f1: 0.5692
 epoch: 10, train_loss: 0.7122, test_loss: 1.0658, test_f1: 0.6150
 epoch: 11, train_loss: 0.6678, test_loss: 1.1074, test_f1: 0.5695
 epoch: 12, train_loss: 0.6883, test_loss: 1.1619, test_f1: 0.6163
 epoch: 13, train_loss: 0.6866, test_loss: 1.1526, test_f1: 0.5637
 epoch: 14, train_loss: 0.7012, test_loss: 1.1785, test_f1: 0.5749
 epoch: 15, train_loss: 0.6744, test_loss: 1.1071, test_f1: 0.5893
 epoch: 16, train_loss: 0.6506, test_loss: 1.2618, test_f1: 0.5353
 epoch: 17, train_loss: 0.6507, test_loss: 1.1775, test_f1: 0.6236
 epoch: 18, train_loss: 0.5956, test_loss: 1.2811, test_f1: 0.5817
 epoch: 19, train_loss: 0.6062, test_loss: 1.1065, test_f1: 0.6328
 epoch: 20, train_loss: 0.6040, test_loss: 1.1050, test_f1: 0.5768
 epoch: 21, train_loss: 0.5780, test_loss: 1.2063, test_f1: 0.6126
 epoch: 22, train_loss: 0.5554, test_loss: 1.2470, test_f1: 0.6227
 epoch: 23, train_loss: 0.5559, test_loss: 1.1757, test_f1: 0.6570
 epoch: 24, train_loss: 0.5277, test_loss: 1.2842, test_f1: 0.6008
 epoch: 25, train_loss: 0.5069, test_loss: 1.2665, test_f1: 0.5813
 epoch: 26, train_loss: 0.5376, test_loss: 1.2924, test_f1: 0.6258
 epoch: 27, train_loss: 0.5073, test_loss: 1.4967, test_f1: 0.5572
 epoch: 28, train_loss: 0.5129, test_loss: 1.5143, test_f1: 0.6002
 epoch: 29, train_loss: 0.4756, test_loss: 1.5585, test_f1: 0.6009
 epoch: 30, train_loss: 0.4646, test_loss: 1.2742, test_f1: 0.6234
 epoch: 31, train_loss: 0.4742, test_loss: 1.2853, test_f1: 0.6398
 epoch: 32, train_loss: 0.4515, test_loss: 1.4373, test_f1: 0.6269
 epoch: 33, train_loss: 0.4777, test_loss: 1.5122, test_f1: 0.6167
 epoch: 34, train_loss: 0.4834, test_loss: 1.4304, test_f1: 0.6087
 epoch: 35, train_loss: 0.4351, test_loss: 1.5927, test_f1: 0.5398
 epoch: 36, train_loss: 0.4261, test_loss: 1.5681, test_f1: 0.6198
 epoch: 37, train_loss: 0.4212, test_loss: 1.7061, test_f1: 0.6453
 epoch: 38, train_loss: 0.4185, test_loss: 1.6775, test_f1: 0.6340
 epoch: 39, train_loss: 0.4224, test_loss: 1.5461, test_f1: 0.6335
 epoch: 40, train_loss: 0.3866, test_loss: 1.4521, test_f1: 0.6195
 epoch: 41, train_loss: 0.3555, test_loss: 1.9170, test_f1: 0.6283
 epoch: 42, train_loss: 0.3548, test_loss: 1.6954, test_f1: 0.5272
 epoch: 43, train_loss: 0.3862, test_loss: 1.6910, test_f1: 0.6210
 epoch: 44, train_loss: 0.3803, test_loss: 1.5780, test_f1: 0.6734
 epoch: 45, train_loss: 0.3582, test_loss: 1.6333, test_f1: 0.6448
 epoch: 46, train_loss: 0.3514, test_loss: 1.7100, test_f1: 0.6749
 epoch: 47, train_loss: 0.3457, test_loss: 1.5001, test_f1: 0.6622
 epoch: 48, train_loss: 0.3383, test_loss: 1.6602, test_f1: 0.6184
 epoch: 49, train_loss: 0.3245, test_loss: 1.7171, test_f1: 0.6393
 epoch: 50, train_loss: 0.3640, test_loss: 1.4796, test_f1: 0.6471
 epoch: 51, train_loss: 0.2944, test_loss: 1.5821, test_f1: 0.6575
 epoch: 52, train_loss: 0.2490, test_loss: 1.5942, test_f1: 0.6724
 epoch: 53, train_loss: 0.2405, test_loss: 1.7120, test_f1: 0.6077
 epoch: 54, train_loss: 0.2443, test_loss: 1.7519, test_f1: 0.6328
 epoch: 55, train_loss: 0.2140, test_loss: 1.9128, test_f1: 0.6287
 epoch: 56, train_loss: 0.2590, test_loss: 1.7814, test_f1: 0.6359
 epoch: 57, train_loss: 0.2264, test_loss: 1.8799, test_f1: 0.6318
 epoch: 58, train_loss: 0.2400, test_loss: 1.8963, test_f1: 0.6183
 epoch: 59, train_loss: 0.2195, test_loss: 1.9356, test_f1: 0.6111
 epoch: 60, train_loss: 0.2125, test_loss: 1.9680, test_f1: 0.6483
 epoch: 61, train_loss: 0.2015, test_loss: 2.0312, test_f1: 0.6072
 epoch: 62, train_loss: 0.2018, test_loss: 1.9514, test_f1: 0.6467
 epoch: 63, train_loss: 0.2114, test_loss: 1.9469, test_f1: 0.6203
 epoch: 64, train_loss: 0.1849, test_loss: 2.0612, test_f1: 0.6076
 epoch: 65, train_loss: 0.1902, test_loss: 2.0929, test_f1: 0.6231
 epoch: 66, train_loss: 0.2070, test_loss: 2.0562, test_f1: 0.6117
 epoch: 67, train_loss: 0.1850, test_loss: 2.2554, test_f1: 0.6293
 epoch: 68, train_loss: 0.1793, test_loss: 2.1109, test_f1: 0.5992
 epoch: 69, train_loss: 0.1713, test_loss: 2.0924, test_f1: 0.6406
 epoch: 70, train_loss: 0.1829, test_loss: 2.2016, test_f1: 0.6330
 epoch: 71, train_loss: 0.1686, test_loss: 2.4699, test_f1: 0.5970
 epoch: 72, train_loss: 0.1887, test_loss: 2.3641, test_f1: 0.6008
 epoch: 73, train_loss: 0.2199, test_loss: 2.2574, test_f1: 0.6012
 epoch: 74, train_loss: 0.2085, test_loss: 2.2061, test_f1: 0.6305
 epoch: 75, train_loss: 0.1997, test_loss: 2.1090, test_f1: 0.6084
 epoch: 76, train_loss: 0.1861, test_loss: 2.0941, test_f1: 0.6080
 epoch: 77, train_loss: 0.1701, test_loss: 2.1682, test_f1: 0.6140
 epoch: 78, train_loss: 0.1755, test_loss: 2.3930, test_f1: 0.6326
 epoch: 79, train_loss: 0.1427, test_loss: 2.3179, test_f1: 0.5910
 epoch: 80, train_loss: 0.1340, test_loss: 2.4900, test_f1: 0.6236
 epoch: 81, train_loss: 0.1764, test_loss: 2.4141, test_f1: 0.5883
 epoch: 82, train_loss: 0.1856, test_loss: 2.2642, test_f1: 0.6300
 epoch: 83, train_loss: 0.1699, test_loss: 2.4331, test_f1: 0.6465
 epoch: 84, train_loss: 0.1729, test_loss: 2.3499, test_f1: 0.6274
 epoch: 85, train_loss: 0.1699, test_loss: 2.3793, test_f1: 0.5902
 epoch: 86, train_loss: 0.1670, test_loss: 2.3888, test_f1: 0.6132
 epoch: 87, train_loss: 0.1583, test_loss: 2.2835, test_f1: 0.6170
 epoch: 88, train_loss: 0.1410, test_loss: 2.6798, test_f1: 0.6038
 epoch: 89, train_loss: 0.1425, test_loss: 2.6765, test_f1: 0.6187
 epoch: 90, train_loss: 0.1233, test_loss: 2.5325, test_f1: 0.5951
 epoch: 91, train_loss: 0.1382, test_loss: 2.8051, test_f1: 0.6251
 epoch: 92, train_loss: 0.1483, test_loss: 2.4913, test_f1: 0.6045
 epoch: 93, train_loss: 0.1669, test_loss: 2.5062, test_f1: 0.6519
 epoch: 94, train_loss: 0.1457, test_loss: 2.6152, test_f1: 0.6205
 epoch: 95, train_loss: 0.1536, test_loss: 2.7053, test_f1: 0.5883
 epoch: 96, train_loss: 0.1230, test_loss: 2.8285, test_f1: 0.6436
 epoch: 97, train_loss: 0.1404, test_loss: 2.6093, test_f1: 0.6238
 epoch: 98, train_loss: 0.1297, test_loss: 2.7707, test_f1: 0.5727
 epoch: 99, train_loss: 0.1101, test_loss: 2.7452, test_f1: 0.6011

Training completed in 620.55 seconds
Best F1: 0.6915 at epoch 21
Mean F1 across iterations: 0.6667  0.0170
========================FINAL RESULTS================================
FEGIN weighted F1: 0.6915  0.0170
python main.py --data ltspice_demos --representation component_pin --model FEGIN --layers 3 --hiddens 64 --batch_size 64 --lr 0.001 --emb_size 250 --epochs 100 --save_appendix component_pin_L3_H64_BS64_LR0.001_E250 --no_val
-----



STDERR:
  File "main.py", line 370, in <module>
    main()
  File "main.py", line 254, in main
    dataset = dataset_class(
  File "/home/philip/projects/ltspice_examples_code_repo/Circuit-Completion-Using-GNNs/component_classification_with_link_prediction_head/evaluation/FEGIN/kernel/circuit_datasets.py", line 15, in __init__
    self.data, self.slices = torch.load(self.processed_paths[0])
  File "/home/philip/.local/lib/python3.8/site-packages/torch/serialization.py", line 1040, in load
    warnings.warn(
  File "/usr/lib/python3.8/warnings.py", line 109, in _showwarnmsg
    sw(msg.message, msg.category, msg.filename, msg.lineno,
  File "main.py", line 47, in warn_with_traceback
    traceback.print_stack(file=log)
/home/philip/projects/ltspice_examples_code_repo/Circuit-Completion-Using-GNNs/component_classification_with_link_prediction_head/evaluation/FEGIN/kernel/circuit_datasets.py:15: FutureWarning: You are using `torch.load` with `weights_only=False` (the current default value), which uses the default pickle module implicitly. It is possible to construct malicious pickle data which will execute arbitrary code during unpickling (See https://github.com/pytorch/pytorch/blob/main/SECURITY.md#untrusted-models for more details). In a future release, the default value for `weights_only` will be flipped to `True`. This limits the functions that could be executed during unpickling. Arbitrary objects will no longer be allowed to be loaded via this mode unless they are explicitly allowlisted by the user via `torch.serialization.add_safe_globals`. We recommend you start setting `weights_only=True` for any use case where you don't have full control of the loaded file. Please open an issue on GitHub for any issues related to this experimental feature.
  self.data, self.slices = torch.load(self.processed_paths[0])
