STDOUT:
Results will be saved in /home/philip/projects/ltspice_examples_code_repo/Circuit-Completion-Using-GNNs/component_classification_with_link_prediction_head/evaluation/FEGIN/results/model_FEGIN_dataset_ltspice_demos
Command line input: python main.py --data ltspice_demos --representation component_pin --model FEGIN --layers 3 --hiddens 128 --batch_size 32 --lr 0.001 --emb_size 128 --epochs 100 --save_appendix component_pin_L3_H128_BS32_LR0.001_E128 --no_val
 is saved.
-----
ltspice_demos - FEGIN
Using 3 layers, 128 hidden units, h = 2
Loading component_pin representation dataset
ENTERED
Training FEGIN on component_pin representation
Train: 1565, Test: 383
##################ITERATION #0 ****************************************
 epoch: 0, train_loss: 1.2037, test_loss: 1.2478, test_f1: 0.3676
 epoch: 1, train_loss: 0.9894, test_loss: 1.0725, test_f1: 0.4867
 epoch: 2, train_loss: 0.9064, test_loss: 1.0995, test_f1: 0.4781
 epoch: 3, train_loss: 0.8557, test_loss: 1.0542, test_f1: 0.5633
 epoch: 4, train_loss: 0.8108, test_loss: 1.0890, test_f1: 0.4510
 epoch: 5, train_loss: 0.7831, test_loss: 1.0292, test_f1: 0.5899
 epoch: 6, train_loss: 0.7694, test_loss: 1.0274, test_f1: 0.6306
 epoch: 7, train_loss: 0.7518, test_loss: 1.1446, test_f1: 0.5056
 epoch: 8, train_loss: 0.7076, test_loss: 0.9672, test_f1: 0.6142
 epoch: 9, train_loss: 0.6963, test_loss: 1.0855, test_f1: 0.5984
 epoch: 10, train_loss: 0.6771, test_loss: 1.1424, test_f1: 0.6289
 epoch: 11, train_loss: 0.6798, test_loss: 1.0407, test_f1: 0.5696
 epoch: 12, train_loss: 0.6782, test_loss: 1.1134, test_f1: 0.6350
 epoch: 13, train_loss: 0.6488, test_loss: 1.3271, test_f1: 0.5246
 epoch: 14, train_loss: 0.6386, test_loss: 1.2268, test_f1: 0.5627
 epoch: 15, train_loss: 0.6153, test_loss: 1.2140, test_f1: 0.5524
 epoch: 16, train_loss: 0.5933, test_loss: 1.0634, test_f1: 0.6031
 epoch: 17, train_loss: 0.5820, test_loss: 1.1236, test_f1: 0.6078
 epoch: 18, train_loss: 0.5983, test_loss: 1.4438, test_f1: 0.5397
 epoch: 19, train_loss: 0.5716, test_loss: 1.1100, test_f1: 0.6466
 epoch: 20, train_loss: 0.5502, test_loss: 1.3654, test_f1: 0.6251
 epoch: 21, train_loss: 0.5361, test_loss: 1.2890, test_f1: 0.5951
 epoch: 22, train_loss: 0.5607, test_loss: 1.2901, test_f1: 0.5674
 epoch: 23, train_loss: 0.4995, test_loss: 1.3977, test_f1: 0.6340
 epoch: 24, train_loss: 0.5196, test_loss: 1.4249, test_f1: 0.5125
 epoch: 25, train_loss: 0.4865, test_loss: 1.2767, test_f1: 0.6496
 epoch: 26, train_loss: 0.4945, test_loss: 1.2611, test_f1: 0.6454
 epoch: 27, train_loss: 0.4775, test_loss: 1.3378, test_f1: 0.6331
 epoch: 28, train_loss: 0.4402, test_loss: 1.3261, test_f1: 0.6252
 epoch: 29, train_loss: 0.4341, test_loss: 1.3770, test_f1: 0.6717
 epoch: 30, train_loss: 0.4603, test_loss: 1.1450, test_f1: 0.6867
 epoch: 31, train_loss: 0.3729, test_loss: 1.3045, test_f1: 0.6666
 epoch: 32, train_loss: 0.3736, test_loss: 1.4959, test_f1: 0.6824
 epoch: 33, train_loss: 0.3717, test_loss: 1.4059, test_f1: 0.6578
 epoch: 34, train_loss: 0.3917, test_loss: 1.4712, test_f1: 0.6180
 epoch: 35, train_loss: 0.3700, test_loss: 1.5560, test_f1: 0.6164
 epoch: 36, train_loss: 0.3686, test_loss: 1.3083, test_f1: 0.6589
 epoch: 37, train_loss: 0.3060, test_loss: 1.7751, test_f1: 0.6603
 epoch: 38, train_loss: 0.2972, test_loss: 1.8128, test_f1: 0.6482
 epoch: 39, train_loss: 0.3458, test_loss: 1.6014, test_f1: 0.6858
 epoch: 40, train_loss: 0.2952, test_loss: 1.7011, test_f1: 0.6491
 epoch: 41, train_loss: 0.3205, test_loss: 1.6026, test_f1: 0.6874
 epoch: 42, train_loss: 0.2863, test_loss: 1.6512, test_f1: 0.6961
 epoch: 43, train_loss: 0.2654, test_loss: 1.7870, test_f1: 0.6415
 epoch: 44, train_loss: 0.2684, test_loss: 1.8235, test_f1: 0.6553
 epoch: 45, train_loss: 0.3140, test_loss: 1.4881, test_f1: 0.6495
 epoch: 46, train_loss: 0.3050, test_loss: 1.9373, test_f1: 0.6503
 epoch: 47, train_loss: 0.2689, test_loss: 2.0329, test_f1: 0.6551
 epoch: 48, train_loss: 0.2670, test_loss: 1.6932, test_f1: 0.6660
 epoch: 49, train_loss: 0.2429, test_loss: 2.3106, test_f1: 0.6247
 epoch: 50, train_loss: 0.2780, test_loss: 1.9427, test_f1: 0.6573
 epoch: 51, train_loss: 0.2027, test_loss: 2.0764, test_f1: 0.6678
 epoch: 52, train_loss: 0.1614, test_loss: 2.2128, test_f1: 0.6549
 epoch: 53, train_loss: 0.1767, test_loss: 2.2753, test_f1: 0.6371
 epoch: 54, train_loss: 0.1808, test_loss: 2.4737, test_f1: 0.6250
 epoch: 55, train_loss: 0.1387, test_loss: 2.1400, test_f1: 0.6567
 epoch: 56, train_loss: 0.1412, test_loss: 2.3212, test_f1: 0.6426
 epoch: 57, train_loss: 0.1323, test_loss: 2.4620, test_f1: 0.6777
 epoch: 58, train_loss: 0.1336, test_loss: 2.4513, test_f1: 0.6522
 epoch: 59, train_loss: 0.1473, test_loss: 2.5896, test_f1: 0.6622
 epoch: 60, train_loss: 0.1344, test_loss: 2.4197, test_f1: 0.6602
 epoch: 61, train_loss: 0.0968, test_loss: 2.7339, test_f1: 0.6497
 epoch: 62, train_loss: 0.1539, test_loss: 2.9880, test_f1: 0.6462
 epoch: 63, train_loss: 0.1317, test_loss: 2.8233, test_f1: 0.6389
 epoch: 64, train_loss: 0.1271, test_loss: 2.8615, test_f1: 0.6598
 epoch: 65, train_loss: 0.1130, test_loss: 2.5413, test_f1: 0.6653
 epoch: 66, train_loss: 0.1252, test_loss: 2.6804, test_f1: 0.6413
 epoch: 67, train_loss: 0.1531, test_loss: 2.8529, test_f1: 0.6549
 epoch: 68, train_loss: 0.1229, test_loss: 2.4026, test_f1: 0.6666
 epoch: 69, train_loss: 0.1243, test_loss: 2.6965, test_f1: 0.6652
 epoch: 70, train_loss: 0.1156, test_loss: 2.9659, test_f1: 0.6415
 epoch: 71, train_loss: 0.1287, test_loss: 2.8343, test_f1: 0.6755
 epoch: 72, train_loss: 0.1126, test_loss: 2.8164, test_f1: 0.6646
 epoch: 73, train_loss: 0.1105, test_loss: 3.3774, test_f1: 0.6547
 epoch: 74, train_loss: 0.0998, test_loss: 2.9670, test_f1: 0.6835
 epoch: 75, train_loss: 0.1206, test_loss: 2.8646, test_f1: 0.6400
 epoch: 76, train_loss: 0.1239, test_loss: 2.7690, test_f1: 0.6596
 epoch: 77, train_loss: 0.1547, test_loss: 2.6567, test_f1: 0.6741
 epoch: 78, train_loss: 0.0818, test_loss: 2.8552, test_f1: 0.6679
 epoch: 79, train_loss: 0.1034, test_loss: 2.8395, test_f1: 0.6509
 epoch: 80, train_loss: 0.1229, test_loss: 2.6161, test_f1: 0.6527
 epoch: 81, train_loss: 0.0878, test_loss: 2.7121, test_f1: 0.6730
 epoch: 82, train_loss: 0.0763, test_loss: 3.0529, test_f1: 0.6743
 epoch: 83, train_loss: 0.0873, test_loss: 2.8836, test_f1: 0.6679
 epoch: 84, train_loss: 0.0933, test_loss: 2.8501, test_f1: 0.6494
 epoch: 85, train_loss: 0.0747, test_loss: 3.1334, test_f1: 0.6732
 epoch: 86, train_loss: 0.0754, test_loss: 3.0924, test_f1: 0.6617
 epoch: 87, train_loss: 0.1211, test_loss: 3.1584, test_f1: 0.6381
 epoch: 88, train_loss: 0.1038, test_loss: 3.2288, test_f1: 0.6489
 epoch: 89, train_loss: 0.1341, test_loss: 3.1480, test_f1: 0.6430
 epoch: 90, train_loss: 0.1170, test_loss: 2.9593, test_f1: 0.6603
 epoch: 91, train_loss: 0.0938, test_loss: 3.2732, test_f1: 0.6592
 epoch: 92, train_loss: 0.1053, test_loss: 3.2564, test_f1: 0.6650
 epoch: 93, train_loss: 0.1116, test_loss: 2.6133, test_f1: 0.6853
 epoch: 94, train_loss: 0.0810, test_loss: 2.9593, test_f1: 0.6312
 epoch: 95, train_loss: 0.0837, test_loss: 3.1752, test_f1: 0.6804
 epoch: 96, train_loss: 0.1099, test_loss: 3.1810, test_f1: 0.6403
 epoch: 97, train_loss: 0.0941, test_loss: 3.0684, test_f1: 0.6268
 epoch: 98, train_loss: 0.0847, test_loss: 3.0023, test_f1: 0.6920
 epoch: 99, train_loss: 0.0672, test_loss: 3.0686, test_f1: 0.6902
##################ITERATION #1 ****************************************
 epoch: 0, train_loss: 1.1103, test_loss: 1.1368, test_f1: 0.4906
 epoch: 1, train_loss: 0.9161, test_loss: 0.9731, test_f1: 0.5805
 epoch: 2, train_loss: 0.8370, test_loss: 1.0388, test_f1: 0.5300
 epoch: 3, train_loss: 0.7948, test_loss: 1.0034, test_f1: 0.6011
 epoch: 4, train_loss: 0.7712, test_loss: 1.0262, test_f1: 0.5584
 epoch: 5, train_loss: 0.7597, test_loss: 1.0337, test_f1: 0.6306
 epoch: 6, train_loss: 0.7349, test_loss: 1.0215, test_f1: 0.5554
 epoch: 7, train_loss: 0.6820, test_loss: 1.0410, test_f1: 0.5932
 epoch: 8, train_loss: 0.7081, test_loss: 1.0971, test_f1: 0.5781
 epoch: 9, train_loss: 0.6776, test_loss: 1.1135, test_f1: 0.5555
 epoch: 10, train_loss: 0.6603, test_loss: 1.0232, test_f1: 0.6309
 epoch: 11, train_loss: 0.6495, test_loss: 1.1769, test_f1: 0.6258
 epoch: 12, train_loss: 0.6160, test_loss: 1.1601, test_f1: 0.6578
 epoch: 13, train_loss: 0.5938, test_loss: 1.3092, test_f1: 0.6322
 epoch: 14, train_loss: 0.5861, test_loss: 1.4016, test_f1: 0.5741
 epoch: 15, train_loss: 0.5667, test_loss: 1.2153, test_f1: 0.6231
 epoch: 16, train_loss: 0.5528, test_loss: 1.1626, test_f1: 0.6211
 epoch: 17, train_loss: 0.5423, test_loss: 1.1167, test_f1: 0.6289
 epoch: 18, train_loss: 0.5654, test_loss: 1.0853, test_f1: 0.6813
 epoch: 19, train_loss: 0.4945, test_loss: 1.0442, test_f1: 0.6701
 epoch: 20, train_loss: 0.4932, test_loss: 1.2871, test_f1: 0.5928
 epoch: 21, train_loss: 0.5113, test_loss: 1.2092, test_f1: 0.6726
 epoch: 22, train_loss: 0.4945, test_loss: 1.1689, test_f1: 0.6563
 epoch: 23, train_loss: 0.4348, test_loss: 1.2946, test_f1: 0.6369
 epoch: 24, train_loss: 0.4480, test_loss: 1.3319, test_f1: 0.6246
 epoch: 25, train_loss: 0.4578, test_loss: 1.1928, test_f1: 0.6966
 epoch: 26, train_loss: 0.4127, test_loss: 1.3031, test_f1: 0.6215
 epoch: 27, train_loss: 0.4015, test_loss: 1.2559, test_f1: 0.6412
 epoch: 28, train_loss: 0.4310, test_loss: 1.5038, test_f1: 0.6252
 epoch: 29, train_loss: 0.3701, test_loss: 1.3586, test_f1: 0.6237
 epoch: 30, train_loss: 0.3835, test_loss: 1.3794, test_f1: 0.5702
 epoch: 31, train_loss: 0.3351, test_loss: 1.4987, test_f1: 0.6023
 epoch: 32, train_loss: 0.3429, test_loss: 1.5550, test_f1: 0.6160
 epoch: 33, train_loss: 0.3499, test_loss: 1.4381, test_f1: 0.6131
 epoch: 34, train_loss: 0.3340, test_loss: 1.8799, test_f1: 0.6174
 epoch: 35, train_loss: 0.3020, test_loss: 1.5718, test_f1: 0.5843
 epoch: 36, train_loss: 0.3333, test_loss: 1.9435, test_f1: 0.6273
 epoch: 37, train_loss: 0.3126, test_loss: 1.6271, test_f1: 0.6538
 epoch: 38, train_loss: 0.3028, test_loss: 1.7115, test_f1: 0.6465
 epoch: 39, train_loss: 0.3514, test_loss: 1.6500, test_f1: 0.6592
 epoch: 40, train_loss: 0.3151, test_loss: 1.7780, test_f1: 0.6728
 epoch: 41, train_loss: 0.2803, test_loss: 1.6959, test_f1: 0.5814
 epoch: 42, train_loss: 0.2768, test_loss: 1.6091, test_f1: 0.6628
 epoch: 43, train_loss: 0.2679, test_loss: 1.6681, test_f1: 0.6400
 epoch: 44, train_loss: 0.2644, test_loss: 1.6822, test_f1: 0.6633
 epoch: 45, train_loss: 0.2573, test_loss: 1.9374, test_f1: 0.6365
 epoch: 46, train_loss: 0.2832, test_loss: 1.5656, test_f1: 0.6494
 epoch: 47, train_loss: 0.2167, test_loss: 1.6746, test_f1: 0.6078
 epoch: 48, train_loss: 0.2181, test_loss: 1.9059, test_f1: 0.6357
 epoch: 49, train_loss: 0.2460, test_loss: 2.1134, test_f1: 0.6075
 epoch: 50, train_loss: 0.2310, test_loss: 2.1267, test_f1: 0.6095
 epoch: 51, train_loss: 0.1842, test_loss: 1.8985, test_f1: 0.6507
 epoch: 52, train_loss: 0.1634, test_loss: 2.0642, test_f1: 0.6557
 epoch: 53, train_loss: 0.1406, test_loss: 2.2531, test_f1: 0.6395
 epoch: 54, train_loss: 0.1444, test_loss: 2.0847, test_f1: 0.6704
 epoch: 55, train_loss: 0.1427, test_loss: 2.2340, test_f1: 0.6472
 epoch: 56, train_loss: 0.1137, test_loss: 2.2981, test_f1: 0.6429
 epoch: 57, train_loss: 0.1145, test_loss: 2.2142, test_f1: 0.6371
 epoch: 58, train_loss: 0.1360, test_loss: 2.3732, test_f1: 0.6347
 epoch: 59, train_loss: 0.1337, test_loss: 2.6112, test_f1: 0.6405
 epoch: 60, train_loss: 0.1494, test_loss: 2.0878, test_f1: 0.6378
 epoch: 61, train_loss: 0.1339, test_loss: 2.0172, test_f1: 0.6813
 epoch: 62, train_loss: 0.1108, test_loss: 2.1750, test_f1: 0.6172
 epoch: 63, train_loss: 0.1150, test_loss: 2.3668, test_f1: 0.6375
 epoch: 64, train_loss: 0.1096, test_loss: 2.0468, test_f1: 0.6594
 epoch: 65, train_loss: 0.1106, test_loss: 2.2080, test_f1: 0.6391
 epoch: 66, train_loss: 0.1287, test_loss: 2.1641, test_f1: 0.6634
 epoch: 67, train_loss: 0.0979, test_loss: 2.4096, test_f1: 0.6305
 epoch: 68, train_loss: 0.1512, test_loss: 2.3942, test_f1: 0.6437
 epoch: 69, train_loss: 0.1248, test_loss: 2.5661, test_f1: 0.6176
 epoch: 70, train_loss: 0.1105, test_loss: 2.3950, test_f1: 0.6207
 epoch: 71, train_loss: 0.1208, test_loss: 2.4584, test_f1: 0.6400
 epoch: 72, train_loss: 0.0986, test_loss: 2.4609, test_f1: 0.6301
 epoch: 73, train_loss: 0.0984, test_loss: 2.5673, test_f1: 0.6437
 epoch: 74, train_loss: 0.1345, test_loss: 2.6110, test_f1: 0.6448
 epoch: 75, train_loss: 0.1208, test_loss: 2.7593, test_f1: 0.6310
 epoch: 76, train_loss: 0.1250, test_loss: 2.4388, test_f1: 0.6364
 epoch: 77, train_loss: 0.0895, test_loss: 2.6387, test_f1: 0.6287
 epoch: 78, train_loss: 0.0902, test_loss: 2.7182, test_f1: 0.6274
 epoch: 79, train_loss: 0.0816, test_loss: 2.9008, test_f1: 0.6511
 epoch: 80, train_loss: 0.1091, test_loss: 2.9509, test_f1: 0.6179
 epoch: 81, train_loss: 0.1252, test_loss: 2.9951, test_f1: 0.6278
 epoch: 82, train_loss: 0.1122, test_loss: 2.8993, test_f1: 0.6448
 epoch: 83, train_loss: 0.1176, test_loss: 2.7242, test_f1: 0.6358
 epoch: 84, train_loss: 0.0973, test_loss: 2.4779, test_f1: 0.6486
 epoch: 85, train_loss: 0.1001, test_loss: 2.5885, test_f1: 0.6109
 epoch: 86, train_loss: 0.0891, test_loss: 2.4668, test_f1: 0.6447
 epoch: 87, train_loss: 0.0667, test_loss: 3.0541, test_f1: 0.6491
 epoch: 88, train_loss: 0.0941, test_loss: 3.1672, test_f1: 0.6256
 epoch: 89, train_loss: 0.0720, test_loss: 3.1261, test_f1: 0.6233
 epoch: 90, train_loss: 0.0685, test_loss: 2.8979, test_f1: 0.6277
 epoch: 91, train_loss: 0.0874, test_loss: 2.6675, test_f1: 0.6555
 epoch: 92, train_loss: 0.1565, test_loss: 2.7775, test_f1: 0.6257
 epoch: 93, train_loss: 0.0726, test_loss: 2.8978, test_f1: 0.6249
 epoch: 94, train_loss: 0.0832, test_loss: 2.9493, test_f1: 0.6510
 epoch: 95, train_loss: 0.0833, test_loss: 2.8318, test_f1: 0.6759
 epoch: 96, train_loss: 0.0664, test_loss: 2.9736, test_f1: 0.6345
 epoch: 97, train_loss: 0.0751, test_loss: 3.0554, test_f1: 0.6521
 epoch: 98, train_loss: 0.0706, test_loss: 3.1846, test_f1: 0.6232
 epoch: 99, train_loss: 0.0754, test_loss: 3.0251, test_f1: 0.6329
##################ITERATION #2 ****************************************
 epoch: 0, train_loss: 1.0810, test_loss: 1.3259, test_f1: 0.3795
 epoch: 1, train_loss: 0.8957, test_loss: 1.0468, test_f1: 0.5869
 epoch: 2, train_loss: 0.8436, test_loss: 1.0196, test_f1: 0.5665
 epoch: 3, train_loss: 0.7894, test_loss: 1.0023, test_f1: 0.5885
 epoch: 4, train_loss: 0.7520, test_loss: 1.2610, test_f1: 0.5105
 epoch: 5, train_loss: 0.7481, test_loss: 1.1436, test_f1: 0.6188
 epoch: 6, train_loss: 0.7086, test_loss: 1.1205, test_f1: 0.5237
 epoch: 7, train_loss: 0.6947, test_loss: 1.3843, test_f1: 0.5482
 epoch: 8, train_loss: 0.6521, test_loss: 1.0996, test_f1: 0.5635
 epoch: 9, train_loss: 0.6757, test_loss: 1.1856, test_f1: 0.6383
 epoch: 10, train_loss: 0.6293, test_loss: 1.1168, test_f1: 0.6092
 epoch: 11, train_loss: 0.6195, test_loss: 1.1387, test_f1: 0.5529
 epoch: 12, train_loss: 0.6337, test_loss: 1.0995, test_f1: 0.5793
 epoch: 13, train_loss: 0.5926, test_loss: 1.4135, test_f1: 0.5329
 epoch: 14, train_loss: 0.6032, test_loss: 1.2657, test_f1: 0.6475
 epoch: 15, train_loss: 0.5889, test_loss: 1.0802, test_f1: 0.5672
 epoch: 16, train_loss: 0.6059, test_loss: 1.0748, test_f1: 0.5500
 epoch: 17, train_loss: 0.5488, test_loss: 1.4326, test_f1: 0.6106
 epoch: 18, train_loss: 0.5735, test_loss: 1.1543, test_f1: 0.6249
 epoch: 19, train_loss: 0.5507, test_loss: 1.3076, test_f1: 0.6499
 epoch: 20, train_loss: 0.5241, test_loss: 1.3334, test_f1: 0.6313
 epoch: 21, train_loss: 0.5130, test_loss: 1.1923, test_f1: 0.6537
 epoch: 22, train_loss: 0.4840, test_loss: 1.2707, test_f1: 0.6238
 epoch: 23, train_loss: 0.4711, test_loss: 1.2196, test_f1: 0.6567
 epoch: 24, train_loss: 0.4675, test_loss: 1.5084, test_f1: 0.6410
 epoch: 25, train_loss: 0.4445, test_loss: 1.3196, test_f1: 0.6438
 epoch: 26, train_loss: 0.4547, test_loss: 1.4727, test_f1: 0.5636
 epoch: 27, train_loss: 0.4356, test_loss: 1.3657, test_f1: 0.6244
 epoch: 28, train_loss: 0.4190, test_loss: 1.4324, test_f1: 0.5990
 epoch: 29, train_loss: 0.4137, test_loss: 1.2405, test_f1: 0.6174
 epoch: 30, train_loss: 0.3971, test_loss: 1.6676, test_f1: 0.5905
 epoch: 31, train_loss: 0.3934, test_loss: 1.4247, test_f1: 0.6221
 epoch: 32, train_loss: 0.3611, test_loss: 1.4619, test_f1: 0.6449
 epoch: 33, train_loss: 0.3580, test_loss: 1.4706, test_f1: 0.6262
 epoch: 34, train_loss: 0.3554, test_loss: 1.4982, test_f1: 0.6168
 epoch: 35, train_loss: 0.3774, test_loss: 1.4456, test_f1: 0.6459
 epoch: 36, train_loss: 0.3355, test_loss: 1.5876, test_f1: 0.6483
 epoch: 37, train_loss: 0.3427, test_loss: 1.5401, test_f1: 0.6384
 epoch: 38, train_loss: 0.3343, test_loss: 1.6733, test_f1: 0.6424
 epoch: 39, train_loss: 0.3159, test_loss: 1.6980, test_f1: 0.6231
 epoch: 40, train_loss: 0.2747, test_loss: 1.7712, test_f1: 0.6482
 epoch: 41, train_loss: 0.3067, test_loss: 1.7518, test_f1: 0.6329
 epoch: 42, train_loss: 0.2529, test_loss: 1.6462, test_f1: 0.6472
 epoch: 43, train_loss: 0.2703, test_loss: 1.6986, test_f1: 0.6352
 epoch: 44, train_loss: 0.2594, test_loss: 1.9469, test_f1: 0.6465
 epoch: 45, train_loss: 0.2786, test_loss: 1.9470, test_f1: 0.6324
 epoch: 46, train_loss: 0.2550, test_loss: 1.9062, test_f1: 0.5803
 epoch: 47, train_loss: 0.2440, test_loss: 2.1621, test_f1: 0.6319
 epoch: 48, train_loss: 0.2467, test_loss: 2.0704, test_f1: 0.6628
 epoch: 49, train_loss: 0.2414, test_loss: 1.9718, test_f1: 0.6246
 epoch: 50, train_loss: 0.2263, test_loss: 2.1115, test_f1: 0.6014
 epoch: 51, train_loss: 0.2096, test_loss: 1.9913, test_f1: 0.6629
 epoch: 52, train_loss: 0.1485, test_loss: 2.0827, test_f1: 0.6282
 epoch: 53, train_loss: 0.1657, test_loss: 1.9934, test_f1: 0.6213
 epoch: 54, train_loss: 0.1559, test_loss: 2.0762, test_f1: 0.6419
 epoch: 55, train_loss: 0.1374, test_loss: 2.1475, test_f1: 0.6269
 epoch: 56, train_loss: 0.1438, test_loss: 2.2758, test_f1: 0.6331
 epoch: 57, train_loss: 0.1522, test_loss: 2.1728, test_f1: 0.6429
 epoch: 58, train_loss: 0.1310, test_loss: 2.1208, test_f1: 0.6395
 epoch: 59, train_loss: 0.1599, test_loss: 2.4222, test_f1: 0.6067
 epoch: 60, train_loss: 0.1511, test_loss: 2.3703, test_f1: 0.6301
 epoch: 61, train_loss: 0.1340, test_loss: 2.3540, test_f1: 0.6450
 epoch: 62, train_loss: 0.1259, test_loss: 2.2465, test_f1: 0.6084
 epoch: 63, train_loss: 0.1128, test_loss: 2.3442, test_f1: 0.6382
 epoch: 64, train_loss: 0.1462, test_loss: 2.4607, test_f1: 0.6398
 epoch: 65, train_loss: 0.1315, test_loss: 2.2855, test_f1: 0.6249
 epoch: 66, train_loss: 0.1189, test_loss: 2.3093, test_f1: 0.6401
 epoch: 67, train_loss: 0.1138, test_loss: 2.4070, test_f1: 0.6376
 epoch: 68, train_loss: 0.1140, test_loss: 2.3673, test_f1: 0.6487
 epoch: 69, train_loss: 0.1315, test_loss: 2.4280, test_f1: 0.6276
 epoch: 70, train_loss: 0.1306, test_loss: 2.3874, test_f1: 0.6529
 epoch: 71, train_loss: 0.1341, test_loss: 2.3756, test_f1: 0.6329
 epoch: 72, train_loss: 0.1098, test_loss: 2.5713, test_f1: 0.6123
 epoch: 73, train_loss: 0.1185, test_loss: 2.5171, test_f1: 0.6506
 epoch: 74, train_loss: 0.0894, test_loss: 2.5656, test_f1: 0.6606
 epoch: 75, train_loss: 0.0993, test_loss: 2.6238, test_f1: 0.6397
 epoch: 76, train_loss: 0.1056, test_loss: 2.7618, test_f1: 0.6261
 epoch: 77, train_loss: 0.1188, test_loss: 2.7368, test_f1: 0.6227
 epoch: 78, train_loss: 0.0986, test_loss: 2.5016, test_f1: 0.6431
 epoch: 79, train_loss: 0.1158, test_loss: 2.8191, test_f1: 0.6360
 epoch: 80, train_loss: 0.0886, test_loss: 2.7026, test_f1: 0.6380
 epoch: 81, train_loss: 0.0985, test_loss: 2.5862, test_f1: 0.6300
 epoch: 82, train_loss: 0.1037, test_loss: 2.7258, test_f1: 0.6528
 epoch: 83, train_loss: 0.1243, test_loss: 2.7328, test_f1: 0.6480
 epoch: 84, train_loss: 0.1061, test_loss: 2.7765, test_f1: 0.6177
 epoch: 85, train_loss: 0.1016, test_loss: 2.7551, test_f1: 0.6431
 epoch: 86, train_loss: 0.1036, test_loss: 2.7409, test_f1: 0.6492
 epoch: 87, train_loss: 0.0840, test_loss: 2.8898, test_f1: 0.6497
 epoch: 88, train_loss: 0.1012, test_loss: 2.7212, test_f1: 0.6112
 epoch: 89, train_loss: 0.1050, test_loss: 2.6880, test_f1: 0.6233
 epoch: 90, train_loss: 0.0946, test_loss: 2.5852, test_f1: 0.6513
 epoch: 91, train_loss: 0.0929, test_loss: 2.7229, test_f1: 0.6509
 epoch: 92, train_loss: 0.0962, test_loss: 2.4367, test_f1: 0.6487
 epoch: 93, train_loss: 0.0989, test_loss: 2.9439, test_f1: 0.6148
 epoch: 94, train_loss: 0.0860, test_loss: 2.9940, test_f1: 0.6330
 epoch: 95, train_loss: 0.0776, test_loss: 3.1902, test_f1: 0.6367
 epoch: 96, train_loss: 0.0964, test_loss: 3.2637, test_f1: 0.6358
 epoch: 97, train_loss: 0.0884, test_loss: 3.0925, test_f1: 0.6079
 epoch: 98, train_loss: 0.0986, test_loss: 3.2182, test_f1: 0.6274
 epoch: 99, train_loss: 0.0686, test_loss: 3.2408, test_f1: 0.6085
##################ITERATION #3 ****************************************
 epoch: 0, train_loss: 1.1517, test_loss: 1.2846, test_f1: 0.3607
 epoch: 1, train_loss: 0.9325, test_loss: 1.0685, test_f1: 0.4876
 epoch: 2, train_loss: 0.8401, test_loss: 1.0768, test_f1: 0.5531
 epoch: 3, train_loss: 0.8033, test_loss: 1.1080, test_f1: 0.5290
 epoch: 4, train_loss: 0.7818, test_loss: 0.9408, test_f1: 0.5973
 epoch: 5, train_loss: 0.7634, test_loss: 1.0163, test_f1: 0.5762
 epoch: 6, train_loss: 0.7401, test_loss: 1.0613, test_f1: 0.6134
 epoch: 7, train_loss: 0.7061, test_loss: 0.9869, test_f1: 0.5711
 epoch: 8, train_loss: 0.6743, test_loss: 1.0075, test_f1: 0.5956
 epoch: 9, train_loss: 0.6966, test_loss: 1.0623, test_f1: 0.6120
 epoch: 10, train_loss: 0.6949, test_loss: 1.1843, test_f1: 0.5663
 epoch: 11, train_loss: 0.6266, test_loss: 1.1828, test_f1: 0.5250
 epoch: 12, train_loss: 0.6470, test_loss: 0.9764, test_f1: 0.6119
 epoch: 13, train_loss: 0.6228, test_loss: 1.3901, test_f1: 0.5217
 epoch: 14, train_loss: 0.6278, test_loss: 1.0954, test_f1: 0.5570
 epoch: 15, train_loss: 0.6052, test_loss: 0.9855, test_f1: 0.6249
 epoch: 16, train_loss: 0.6111, test_loss: 1.0662, test_f1: 0.6522
 epoch: 17, train_loss: 0.6027, test_loss: 0.9880, test_f1: 0.6043
 epoch: 18, train_loss: 0.5771, test_loss: 1.1592, test_f1: 0.5844
 epoch: 19, train_loss: 0.5468, test_loss: 1.1971, test_f1: 0.5400
 epoch: 20, train_loss: 0.5311, test_loss: 1.2447, test_f1: 0.5734
 epoch: 21, train_loss: 0.5173, test_loss: 1.1615, test_f1: 0.6307
 epoch: 22, train_loss: 0.4995, test_loss: 1.3564, test_f1: 0.5234
 epoch: 23, train_loss: 0.5032, test_loss: 1.2141, test_f1: 0.6022
 epoch: 24, train_loss: 0.4937, test_loss: 1.4549, test_f1: 0.5587
 epoch: 25, train_loss: 0.4319, test_loss: 1.3188, test_f1: 0.6434
 epoch: 26, train_loss: 0.4396, test_loss: 1.4551, test_f1: 0.5338
 epoch: 27, train_loss: 0.4629, test_loss: 1.4406, test_f1: 0.5987
 epoch: 28, train_loss: 0.4394, test_loss: 1.1810, test_f1: 0.5792
 epoch: 29, train_loss: 0.4162, test_loss: 1.2241, test_f1: 0.6329
 epoch: 30, train_loss: 0.4217, test_loss: 1.4940, test_f1: 0.6119
 epoch: 31, train_loss: 0.4248, test_loss: 1.4410, test_f1: 0.6041
 epoch: 32, train_loss: 0.3749, test_loss: 1.3001, test_f1: 0.6496
 epoch: 33, train_loss: 0.4083, test_loss: 1.3007, test_f1: 0.6153
 epoch: 34, train_loss: 0.4368, test_loss: 1.3300, test_f1: 0.6037
 epoch: 35, train_loss: 0.4040, test_loss: 1.2284, test_f1: 0.6528
 epoch: 36, train_loss: 0.3519, test_loss: 1.2850, test_f1: 0.6418
 epoch: 37, train_loss: 0.3629, test_loss: 1.6020, test_f1: 0.6114
 epoch: 38, train_loss: 0.3513, test_loss: 1.5460, test_f1: 0.6413
 epoch: 39, train_loss: 0.3790, test_loss: 1.5850, test_f1: 0.6184
 epoch: 40, train_loss: 0.3397, test_loss: 1.3260, test_f1: 0.6078
 epoch: 41, train_loss: 0.3312, test_loss: 1.3924, test_f1: 0.5668
 epoch: 42, train_loss: 0.3516, test_loss: 1.9502, test_f1: 0.5789
 epoch: 43, train_loss: 0.2758, test_loss: 1.5655, test_f1: 0.6015
 epoch: 44, train_loss: 0.3197, test_loss: 1.3574, test_f1: 0.6308
 epoch: 45, train_loss: 0.2859, test_loss: 1.8229, test_f1: 0.6108
 epoch: 46, train_loss: 0.2397, test_loss: 1.9020, test_f1: 0.6179
 epoch: 47, train_loss: 0.2700, test_loss: 1.8471, test_f1: 0.5926
 epoch: 48, train_loss: 0.2919, test_loss: 1.8620, test_f1: 0.6111
 epoch: 49, train_loss: 0.2705, test_loss: 1.7398, test_f1: 0.5970
 epoch: 50, train_loss: 0.2350, test_loss: 1.7976, test_f1: 0.6043
 epoch: 51, train_loss: 0.2099, test_loss: 1.9064, test_f1: 0.6109
 epoch: 52, train_loss: 0.1910, test_loss: 1.8965, test_f1: 0.6222
 epoch: 53, train_loss: 0.1694, test_loss: 1.8791, test_f1: 0.6189
 epoch: 54, train_loss: 0.1636, test_loss: 1.9734, test_f1: 0.6270
 epoch: 55, train_loss: 0.1666, test_loss: 2.0150, test_f1: 0.6455
 epoch: 56, train_loss: 0.1302, test_loss: 2.2502, test_f1: 0.6105
 epoch: 57, train_loss: 0.1642, test_loss: 2.2196, test_f1: 0.5888
 epoch: 58, train_loss: 0.1643, test_loss: 2.1824, test_f1: 0.6034
 epoch: 59, train_loss: 0.1453, test_loss: 2.1023, test_f1: 0.6298
 epoch: 60, train_loss: 0.1385, test_loss: 2.4076, test_f1: 0.6058
 epoch: 61, train_loss: 0.1460, test_loss: 2.1797, test_f1: 0.5940
 epoch: 62, train_loss: 0.1378, test_loss: 2.2549, test_f1: 0.6128
 epoch: 63, train_loss: 0.1357, test_loss: 2.2802, test_f1: 0.6388
 epoch: 64, train_loss: 0.1240, test_loss: 2.2846, test_f1: 0.6318
 epoch: 65, train_loss: 0.1259, test_loss: 2.4937, test_f1: 0.5979
 epoch: 66, train_loss: 0.1297, test_loss: 2.6695, test_f1: 0.6092
 epoch: 67, train_loss: 0.1326, test_loss: 2.3902, test_f1: 0.6182
 epoch: 68, train_loss: 0.1413, test_loss: 2.6509, test_f1: 0.6051
 epoch: 69, train_loss: 0.1322, test_loss: 2.2922, test_f1: 0.6252
 epoch: 70, train_loss: 0.1307, test_loss: 2.5228, test_f1: 0.6445
 epoch: 71, train_loss: 0.1274, test_loss: 2.3501, test_f1: 0.6245
 epoch: 72, train_loss: 0.1280, test_loss: 2.3298, test_f1: 0.6179
 epoch: 73, train_loss: 0.1164, test_loss: 2.4876, test_f1: 0.6225
 epoch: 74, train_loss: 0.1272, test_loss: 2.3150, test_f1: 0.6081
 epoch: 75, train_loss: 0.1191, test_loss: 2.6780, test_f1: 0.5933
 epoch: 76, train_loss: 0.1273, test_loss: 2.2868, test_f1: 0.6127
 epoch: 77, train_loss: 0.0833, test_loss: 2.6220, test_f1: 0.6134
 epoch: 78, train_loss: 0.0937, test_loss: 2.4203, test_f1: 0.6308
 epoch: 79, train_loss: 0.1190, test_loss: 2.0853, test_f1: 0.6189
 epoch: 80, train_loss: 0.1058, test_loss: 2.4709, test_f1: 0.6129
 epoch: 81, train_loss: 0.1286, test_loss: 2.6261, test_f1: 0.5875
 epoch: 82, train_loss: 0.1052, test_loss: 2.4857, test_f1: 0.6087
 epoch: 83, train_loss: 0.1282, test_loss: 2.5682, test_f1: 0.6220
 epoch: 84, train_loss: 0.1004, test_loss: 2.5915, test_f1: 0.5851
 epoch: 85, train_loss: 0.1335, test_loss: 2.1651, test_f1: 0.6401
 epoch: 86, train_loss: 0.1043, test_loss: 2.3889, test_f1: 0.6361
 epoch: 87, train_loss: 0.1173, test_loss: 2.4243, test_f1: 0.6362
 epoch: 88, train_loss: 0.0835, test_loss: 2.5413, test_f1: 0.6247
 epoch: 89, train_loss: 0.1099, test_loss: 2.9024, test_f1: 0.5919
 epoch: 90, train_loss: 0.1085, test_loss: 2.4083, test_f1: 0.6343
 epoch: 91, train_loss: 0.1026, test_loss: 2.4544, test_f1: 0.6491
 epoch: 92, train_loss: 0.1057, test_loss: 2.5533, test_f1: 0.6045
 epoch: 93, train_loss: 0.1441, test_loss: 2.6565, test_f1: 0.6131
 epoch: 94, train_loss: 0.0870, test_loss: 2.5799, test_f1: 0.6212
 epoch: 95, train_loss: 0.1030, test_loss: 2.6140, test_f1: 0.6172
 epoch: 96, train_loss: 0.0881, test_loss: 2.6954, test_f1: 0.6296
 epoch: 97, train_loss: 0.1033, test_loss: 2.5063, test_f1: 0.6142
 epoch: 98, train_loss: 0.1294, test_loss: 2.6095, test_f1: 0.6109
 epoch: 99, train_loss: 0.0801, test_loss: 2.6721, test_f1: 0.5926
##################ITERATION #4 ****************************************
 epoch: 0, train_loss: 1.1964, test_loss: 1.3392, test_f1: 0.4471
 epoch: 1, train_loss: 0.9331, test_loss: 1.0411, test_f1: 0.5782
 epoch: 2, train_loss: 0.8570, test_loss: 1.0063, test_f1: 0.5990
 epoch: 3, train_loss: 0.8152, test_loss: 1.1409, test_f1: 0.4697
 epoch: 4, train_loss: 0.8019, test_loss: 1.0687, test_f1: 0.6441
 epoch: 5, train_loss: 0.7747, test_loss: 0.9683, test_f1: 0.6347
 epoch: 6, train_loss: 0.7507, test_loss: 1.0113, test_f1: 0.5920
 epoch: 7, train_loss: 0.7340, test_loss: 1.1183, test_f1: 0.5531
 epoch: 8, train_loss: 0.6920, test_loss: 0.9582, test_f1: 0.6284
 epoch: 9, train_loss: 0.6750, test_loss: 1.0125, test_f1: 0.6295
 epoch: 10, train_loss: 0.6780, test_loss: 1.0101, test_f1: 0.6174
 epoch: 11, train_loss: 0.6372, test_loss: 1.3493, test_f1: 0.5708
 epoch: 12, train_loss: 0.6372, test_loss: 1.1745, test_f1: 0.5613
 epoch: 13, train_loss: 0.6431, test_loss: 1.1433, test_f1: 0.6530
 epoch: 14, train_loss: 0.6135, test_loss: 1.0111, test_f1: 0.6381
 epoch: 15, train_loss: 0.6202, test_loss: 1.1510, test_f1: 0.6133
 epoch: 16, train_loss: 0.5579, test_loss: 1.0776, test_f1: 0.6091
 epoch: 17, train_loss: 0.5697, test_loss: 1.0917, test_f1: 0.6429
 epoch: 18, train_loss: 0.5643, test_loss: 1.0929, test_f1: 0.6284
 epoch: 19, train_loss: 0.5632, test_loss: 0.9863, test_f1: 0.6552
 epoch: 20, train_loss: 0.5175, test_loss: 1.1781, test_f1: 0.6104
 epoch: 21, train_loss: 0.5069, test_loss: 1.0260, test_f1: 0.6237
 epoch: 22, train_loss: 0.5213, test_loss: 1.1519, test_f1: 0.6491
 epoch: 23, train_loss: 0.4928, test_loss: 1.0707, test_f1: 0.6185
 epoch: 24, train_loss: 0.4796, test_loss: 1.2091, test_f1: 0.6208
 epoch: 25, train_loss: 0.4801, test_loss: 1.3489, test_f1: 0.5772
 epoch: 26, train_loss: 0.4782, test_loss: 1.1308, test_f1: 0.6137
 epoch: 27, train_loss: 0.4480, test_loss: 1.2130, test_f1: 0.6611
 epoch: 28, train_loss: 0.4504, test_loss: 1.0757, test_f1: 0.6340
 epoch: 29, train_loss: 0.4083, test_loss: 1.1741, test_f1: 0.6274
 epoch: 30, train_loss: 0.4304, test_loss: 1.4073, test_f1: 0.6313
 epoch: 31, train_loss: 0.4167, test_loss: 1.3195, test_f1: 0.6246
 epoch: 32, train_loss: 0.4011, test_loss: 1.4347, test_f1: 0.6007
 epoch: 33, train_loss: 0.3776, test_loss: 1.5058, test_f1: 0.6041
 epoch: 34, train_loss: 0.3675, test_loss: 1.3101, test_f1: 0.6811
 epoch: 35, train_loss: 0.3369, test_loss: 1.3246, test_f1: 0.6513
 epoch: 36, train_loss: 0.4110, test_loss: 1.3365, test_f1: 0.6471
 epoch: 37, train_loss: 0.4084, test_loss: 1.3529, test_f1: 0.5916
 epoch: 38, train_loss: 0.3408, test_loss: 1.4508, test_f1: 0.6411
 epoch: 39, train_loss: 0.3662, test_loss: 1.3651, test_f1: 0.6015
 epoch: 40, train_loss: 0.3335, test_loss: 1.3964, test_f1: 0.6305
 epoch: 41, train_loss: 0.3328, test_loss: 1.5328, test_f1: 0.5910
 epoch: 42, train_loss: 0.3390, test_loss: 1.4389, test_f1: 0.6464
 epoch: 43, train_loss: 0.3486, test_loss: 1.2222, test_f1: 0.6527
 epoch: 44, train_loss: 0.3184, test_loss: 1.4037, test_f1: 0.6169
 epoch: 45, train_loss: 0.3288, test_loss: 1.3764, test_f1: 0.6500
 epoch: 46, train_loss: 0.2750, test_loss: 1.6186, test_f1: 0.6224
 epoch: 47, train_loss: 0.2761, test_loss: 1.4007, test_f1: 0.6697
 epoch: 48, train_loss: 0.2782, test_loss: 1.3824, test_f1: 0.6736
 epoch: 49, train_loss: 0.3054, test_loss: 1.5982, test_f1: 0.6348
 epoch: 50, train_loss: 0.2867, test_loss: 1.4738, test_f1: 0.6572
 epoch: 51, train_loss: 0.2598, test_loss: 1.4195, test_f1: 0.6651
 epoch: 52, train_loss: 0.2101, test_loss: 1.5127, test_f1: 0.6538
 epoch: 53, train_loss: 0.2154, test_loss: 1.5099, test_f1: 0.6678
 epoch: 54, train_loss: 0.1516, test_loss: 1.9416, test_f1: 0.6214
 epoch: 55, train_loss: 0.1982, test_loss: 1.7450, test_f1: 0.6430
 epoch: 56, train_loss: 0.1891, test_loss: 1.8169, test_f1: 0.6388
 epoch: 57, train_loss: 0.1748, test_loss: 1.7048, test_f1: 0.6686
 epoch: 58, train_loss: 0.1586, test_loss: 1.9771, test_f1: 0.6386
 epoch: 59, train_loss: 0.1540, test_loss: 1.9104, test_f1: 0.6480
 epoch: 60, train_loss: 0.1571, test_loss: 1.8987, test_f1: 0.6479
 epoch: 61, train_loss: 0.1605, test_loss: 1.9485, test_f1: 0.6545
 epoch: 62, train_loss: 0.1533, test_loss: 2.1456, test_f1: 0.6184
 epoch: 63, train_loss: 0.1388, test_loss: 2.2027, test_f1: 0.6303
 epoch: 64, train_loss: 0.1590, test_loss: 1.7989, test_f1: 0.6699
 epoch: 65, train_loss: 0.1573, test_loss: 2.0023, test_f1: 0.6670
 epoch: 66, train_loss: 0.1647, test_loss: 1.8954, test_f1: 0.6476
 epoch: 67, train_loss: 0.1507, test_loss: 2.0639, test_f1: 0.6524
 epoch: 68, train_loss: 0.1452, test_loss: 2.0737, test_f1: 0.6375
 epoch: 69, train_loss: 0.1622, test_loss: 2.1315, test_f1: 0.6374
 epoch: 70, train_loss: 0.1381, test_loss: 2.2476, test_f1: 0.6324
 epoch: 71, train_loss: 0.1460, test_loss: 2.2963, test_f1: 0.6121
 epoch: 72, train_loss: 0.1348, test_loss: 2.0141, test_f1: 0.6801
 epoch: 73, train_loss: 0.1461, test_loss: 2.3840, test_f1: 0.6479
 epoch: 74, train_loss: 0.1344, test_loss: 2.0685, test_f1: 0.6263
 epoch: 75, train_loss: 0.1439, test_loss: 2.3002, test_f1: 0.6259
 epoch: 76, train_loss: 0.1337, test_loss: 2.2482, test_f1: 0.6100
 epoch: 77, train_loss: 0.1366, test_loss: 2.1902, test_f1: 0.6376
 epoch: 78, train_loss: 0.1143, test_loss: 2.3600, test_f1: 0.6204
 epoch: 79, train_loss: 0.1406, test_loss: 2.2679, test_f1: 0.6397
 epoch: 80, train_loss: 0.1335, test_loss: 2.1626, test_f1: 0.6298
 epoch: 81, train_loss: 0.1209, test_loss: 2.4576, test_f1: 0.5991
 epoch: 82, train_loss: 0.1108, test_loss: 2.3365, test_f1: 0.6593
 epoch: 83, train_loss: 0.1389, test_loss: 2.6334, test_f1: 0.6077
 epoch: 84, train_loss: 0.1065, test_loss: 2.4279, test_f1: 0.6441
 epoch: 85, train_loss: 0.1134, test_loss: 2.6123, test_f1: 0.6295
 epoch: 86, train_loss: 0.0985, test_loss: 2.3677, test_f1: 0.6552
 epoch: 87, train_loss: 0.1128, test_loss: 2.4440, test_f1: 0.6432
 epoch: 88, train_loss: 0.1081, test_loss: 2.3482, test_f1: 0.6559
 epoch: 89, train_loss: 0.1276, test_loss: 2.2630, test_f1: 0.6504
 epoch: 90, train_loss: 0.1134, test_loss: 2.4479, test_f1: 0.6203
 epoch: 91, train_loss: 0.1225, test_loss: 2.5390, test_f1: 0.6307
 epoch: 92, train_loss: 0.1215, test_loss: 2.2866, test_f1: 0.6620
 epoch: 93, train_loss: 0.1069, test_loss: 2.5934, test_f1: 0.6419
 epoch: 94, train_loss: 0.1061, test_loss: 2.6305, test_f1: 0.6177
 epoch: 95, train_loss: 0.0883, test_loss: 2.5451, test_f1: 0.6433
 epoch: 96, train_loss: 0.1188, test_loss: 2.6864, test_f1: 0.6109
 epoch: 97, train_loss: 0.1144, test_loss: 2.5342, test_f1: 0.6022
 epoch: 98, train_loss: 0.1060, test_loss: 2.6742, test_f1: 0.6408
 epoch: 99, train_loss: 0.1107, test_loss: 2.4086, test_f1: 0.6261
##################ITERATION #5 ****************************************
 epoch: 0, train_loss: 1.2035, test_loss: 1.3704, test_f1: 0.4413
 epoch: 1, train_loss: 0.9478, test_loss: 1.0687, test_f1: 0.5167
 epoch: 2, train_loss: 0.8714, test_loss: 1.0530, test_f1: 0.6090
 epoch: 3, train_loss: 0.8464, test_loss: 1.0807, test_f1: 0.5970
 epoch: 4, train_loss: 0.8024, test_loss: 1.1008, test_f1: 0.5775
 epoch: 5, train_loss: 0.7854, test_loss: 0.9657, test_f1: 0.5896
 epoch: 6, train_loss: 0.7744, test_loss: 0.9899, test_f1: 0.5667
 epoch: 7, train_loss: 0.7589, test_loss: 1.0204, test_f1: 0.5974
 epoch: 8, train_loss: 0.7223, test_loss: 0.9587, test_f1: 0.6020
 epoch: 9, train_loss: 0.7025, test_loss: 1.0139, test_f1: 0.5827
 epoch: 10, train_loss: 0.7043, test_loss: 0.9669, test_f1: 0.5554
 epoch: 11, train_loss: 0.6702, test_loss: 1.0091, test_f1: 0.6060
 epoch: 12, train_loss: 0.6784, test_loss: 0.9523, test_f1: 0.6731
 epoch: 13, train_loss: 0.6423, test_loss: 1.0597, test_f1: 0.6425
 epoch: 14, train_loss: 0.6013, test_loss: 1.3117, test_f1: 0.5648
 epoch: 15, train_loss: 0.6131, test_loss: 1.1044, test_f1: 0.6386
 epoch: 16, train_loss: 0.5922, test_loss: 1.2457, test_f1: 0.6076
 epoch: 17, train_loss: 0.5575, test_loss: 1.0595, test_f1: 0.6377
 epoch: 18, train_loss: 0.5618, test_loss: 1.0531, test_f1: 0.6238
 epoch: 19, train_loss: 0.5694, test_loss: 1.3359, test_f1: 0.5819
 epoch: 20, train_loss: 0.5530, test_loss: 1.3407, test_f1: 0.5661
 epoch: 21, train_loss: 0.5488, test_loss: 1.3548, test_f1: 0.6343
 epoch: 22, train_loss: 0.5041, test_loss: 1.2315, test_f1: 0.6146
 epoch: 23, train_loss: 0.5306, test_loss: 1.2385, test_f1: 0.6208
 epoch: 24, train_loss: 0.4858, test_loss: 1.0914, test_f1: 0.6342
 epoch: 25, train_loss: 0.4959, test_loss: 1.3044, test_f1: 0.6044
 epoch: 26, train_loss: 0.4928, test_loss: 1.0759, test_f1: 0.6422
 epoch: 27, train_loss: 0.4670, test_loss: 1.3945, test_f1: 0.5886
 epoch: 28, train_loss: 0.4843, test_loss: 1.3948, test_f1: 0.6544
 epoch: 29, train_loss: 0.4487, test_loss: 1.2533, test_f1: 0.6876
 epoch: 30, train_loss: 0.4510, test_loss: 1.4647, test_f1: 0.6356
 epoch: 31, train_loss: 0.4615, test_loss: 1.3048, test_f1: 0.5842
 epoch: 32, train_loss: 0.4101, test_loss: 1.2761, test_f1: 0.6245
 epoch: 33, train_loss: 0.3798, test_loss: 1.5638, test_f1: 0.6415
 epoch: 34, train_loss: 0.3853, test_loss: 1.2487, test_f1: 0.6460
 epoch: 35, train_loss: 0.3832, test_loss: 1.6055, test_f1: 0.6074
 epoch: 36, train_loss: 0.4022, test_loss: 1.4419, test_f1: 0.6258
 epoch: 37, train_loss: 0.3828, test_loss: 1.4475, test_f1: 0.6194
 epoch: 38, train_loss: 0.3757, test_loss: 1.5469, test_f1: 0.6292
 epoch: 39, train_loss: 0.3356, test_loss: 1.6810, test_f1: 0.6409
 epoch: 40, train_loss: 0.3321, test_loss: 1.6716, test_f1: 0.6056
 epoch: 41, train_loss: 0.3282, test_loss: 1.6224, test_f1: 0.6109
 epoch: 42, train_loss: 0.3503, test_loss: 1.7395, test_f1: 0.6020
 epoch: 43, train_loss: 0.3430, test_loss: 1.5889, test_f1: 0.6060
 epoch: 44, train_loss: 0.3159, test_loss: 1.7282, test_f1: 0.6323
 epoch: 45, train_loss: 0.3116, test_loss: 1.6527, test_f1: 0.6337
 epoch: 46, train_loss: 0.3199, test_loss: 1.7647, test_f1: 0.6507
 epoch: 47, train_loss: 0.3138, test_loss: 1.8119, test_f1: 0.5686
 epoch: 48, train_loss: 0.2712, test_loss: 1.8063, test_f1: 0.6426
 epoch: 49, train_loss: 0.2841, test_loss: 2.3774, test_f1: 0.5187
 epoch: 50, train_loss: 0.2701, test_loss: 2.0071, test_f1: 0.6423
 epoch: 51, train_loss: 0.2229, test_loss: 1.9482, test_f1: 0.6248
 epoch: 52, train_loss: 0.2174, test_loss: 2.1391, test_f1: 0.6052
 epoch: 53, train_loss: 0.2019, test_loss: 1.9354, test_f1: 0.6632
 epoch: 54, train_loss: 0.1827, test_loss: 1.9813, test_f1: 0.6506
 epoch: 55, train_loss: 0.1688, test_loss: 2.1985, test_f1: 0.6141
 epoch: 56, train_loss: 0.1997, test_loss: 2.2765, test_f1: 0.5655
 epoch: 57, train_loss: 0.1676, test_loss: 2.2481, test_f1: 0.6301
 epoch: 58, train_loss: 0.1599, test_loss: 2.1725, test_f1: 0.5777
 epoch: 59, train_loss: 0.1756, test_loss: 2.3465, test_f1: 0.5751
 epoch: 60, train_loss: 0.1772, test_loss: 2.1120, test_f1: 0.6079
 epoch: 61, train_loss: 0.1905, test_loss: 2.1185, test_f1: 0.6040
 epoch: 62, train_loss: 0.1609, test_loss: 2.3271, test_f1: 0.6091
 epoch: 63, train_loss: 0.2030, test_loss: 2.2083, test_f1: 0.6366
 epoch: 64, train_loss: 0.1650, test_loss: 2.0250, test_f1: 0.6836
 epoch: 65, train_loss: 0.1482, test_loss: 2.1891, test_f1: 0.6034
 epoch: 66, train_loss: 0.1614, test_loss: 2.1627, test_f1: 0.6176
 epoch: 67, train_loss: 0.1357, test_loss: 2.4130, test_f1: 0.6066
 epoch: 68, train_loss: 0.1480, test_loss: 2.3409, test_f1: 0.6283
 epoch: 69, train_loss: 0.1309, test_loss: 2.4142, test_f1: 0.5973
 epoch: 70, train_loss: 0.1426, test_loss: 2.3533, test_f1: 0.6166
 epoch: 71, train_loss: 0.1525, test_loss: 2.5012, test_f1: 0.5574
 epoch: 72, train_loss: 0.1612, test_loss: 2.4848, test_f1: 0.5987
 epoch: 73, train_loss: 0.1436, test_loss: 2.5503, test_f1: 0.5875
 epoch: 74, train_loss: 0.1451, test_loss: 2.5658, test_f1: 0.6068
 epoch: 75, train_loss: 0.1439, test_loss: 2.5777, test_f1: 0.6034
 epoch: 76, train_loss: 0.1447, test_loss: 2.4369, test_f1: 0.6133
 epoch: 77, train_loss: 0.1633, test_loss: 2.5785, test_f1: 0.5949
 epoch: 78, train_loss: 0.1642, test_loss: 2.5420, test_f1: 0.6204
 epoch: 79, train_loss: 0.1055, test_loss: 2.4328, test_f1: 0.6273
 epoch: 80, train_loss: 0.1212, test_loss: 2.5147, test_f1: 0.5950
 epoch: 81, train_loss: 0.1004, test_loss: 2.7647, test_f1: 0.6212
 epoch: 82, train_loss: 0.1345, test_loss: 2.6696, test_f1: 0.6197
 epoch: 83, train_loss: 0.1156, test_loss: 2.5623, test_f1: 0.6297
 epoch: 84, train_loss: 0.1086, test_loss: 2.5657, test_f1: 0.6060
 epoch: 85, train_loss: 0.0835, test_loss: 2.7413, test_f1: 0.5995
 epoch: 86, train_loss: 0.1172, test_loss: 2.9180, test_f1: 0.6077
 epoch: 87, train_loss: 0.1119, test_loss: 2.9982, test_f1: 0.5762
 epoch: 88, train_loss: 0.1129, test_loss: 2.6232, test_f1: 0.6225
 epoch: 89, train_loss: 0.1314, test_loss: 2.7661, test_f1: 0.6109
 epoch: 90, train_loss: 0.1202, test_loss: 2.4872, test_f1: 0.6556
 epoch: 91, train_loss: 0.1174, test_loss: 2.6200, test_f1: 0.6381
 epoch: 92, train_loss: 0.1049, test_loss: 3.0731, test_f1: 0.6423
 epoch: 93, train_loss: 0.1029, test_loss: 2.7579, test_f1: 0.6113
 epoch: 94, train_loss: 0.1225, test_loss: 2.6620, test_f1: 0.6396
 epoch: 95, train_loss: 0.1371, test_loss: 2.6032, test_f1: 0.6433
 epoch: 96, train_loss: 0.1158, test_loss: 2.9178, test_f1: 0.6187
 epoch: 97, train_loss: 0.1049, test_loss: 2.8184, test_f1: 0.6131
 epoch: 98, train_loss: 0.0967, test_loss: 3.0283, test_f1: 0.5918
 epoch: 99, train_loss: 0.0878, test_loss: 3.0271, test_f1: 0.5984
##################ITERATION #6 ****************************************
 epoch: 0, train_loss: 1.1923, test_loss: 1.2619, test_f1: 0.4233
 epoch: 1, train_loss: 0.9400, test_loss: 1.0590, test_f1: 0.5684
 epoch: 2, train_loss: 0.8826, test_loss: 1.0318, test_f1: 0.5774
 epoch: 3, train_loss: 0.8141, test_loss: 0.9816, test_f1: 0.6058
 epoch: 4, train_loss: 0.7833, test_loss: 1.2815, test_f1: 0.5234
 epoch: 5, train_loss: 0.7624, test_loss: 0.9429, test_f1: 0.6313
 epoch: 6, train_loss: 0.7784, test_loss: 0.9867, test_f1: 0.5787
 epoch: 7, train_loss: 0.7139, test_loss: 0.9633, test_f1: 0.6438
 epoch: 8, train_loss: 0.7179, test_loss: 1.1259, test_f1: 0.5374
 epoch: 9, train_loss: 0.7160, test_loss: 0.9803, test_f1: 0.6470
 epoch: 10, train_loss: 0.6947, test_loss: 1.0049, test_f1: 0.6225
 epoch: 11, train_loss: 0.6487, test_loss: 0.9763, test_f1: 0.5935
 epoch: 12, train_loss: 0.6793, test_loss: 1.0599, test_f1: 0.6301
 epoch: 13, train_loss: 0.6170, test_loss: 1.0041, test_f1: 0.6109
 epoch: 14, train_loss: 0.6053, test_loss: 1.0091, test_f1: 0.5734
 epoch: 15, train_loss: 0.5978, test_loss: 1.0455, test_f1: 0.6027
 epoch: 16, train_loss: 0.6089, test_loss: 1.3356, test_f1: 0.5202
 epoch: 17, train_loss: 0.5910, test_loss: 1.0927, test_f1: 0.5913
 epoch: 18, train_loss: 0.5515, test_loss: 1.3348, test_f1: 0.5123
 epoch: 19, train_loss: 0.5909, test_loss: 1.0601, test_f1: 0.5699
 epoch: 20, train_loss: 0.5292, test_loss: 1.1260, test_f1: 0.5869
 epoch: 21, train_loss: 0.5436, test_loss: 1.1553, test_f1: 0.5911
 epoch: 22, train_loss: 0.5203, test_loss: 1.1651, test_f1: 0.6306
 epoch: 23, train_loss: 0.5305, test_loss: 1.1357, test_f1: 0.5828
 epoch: 24, train_loss: 0.5263, test_loss: 1.1286, test_f1: 0.6518
 epoch: 25, train_loss: 0.4666, test_loss: 1.4376, test_f1: 0.4872
 epoch: 26, train_loss: 0.5101, test_loss: 1.3111, test_f1: 0.5775
 epoch: 27, train_loss: 0.4871, test_loss: 1.1231, test_f1: 0.5968
 epoch: 28, train_loss: 0.4736, test_loss: 1.1026, test_f1: 0.6462
 epoch: 29, train_loss: 0.4640, test_loss: 1.3010, test_f1: 0.5715
 epoch: 30, train_loss: 0.4271, test_loss: 1.3595, test_f1: 0.5982
 epoch: 31, train_loss: 0.4069, test_loss: 1.3315, test_f1: 0.6059
 epoch: 32, train_loss: 0.4149, test_loss: 1.3750, test_f1: 0.5899
 epoch: 33, train_loss: 0.4396, test_loss: 1.4145, test_f1: 0.5599
 epoch: 34, train_loss: 0.3871, test_loss: 1.4250, test_f1: 0.6331
 epoch: 35, train_loss: 0.3791, test_loss: 1.3623, test_f1: 0.6447
 epoch: 36, train_loss: 0.3645, test_loss: 1.3711, test_f1: 0.5907
 epoch: 37, train_loss: 0.3692, test_loss: 1.6208, test_f1: 0.5517
 epoch: 38, train_loss: 0.3599, test_loss: 1.8676, test_f1: 0.5803
 epoch: 39, train_loss: 0.3721, test_loss: 1.5029, test_f1: 0.6270
 epoch: 40, train_loss: 0.3391, test_loss: 1.4398, test_f1: 0.6197
 epoch: 41, train_loss: 0.3507, test_loss: 1.9284, test_f1: 0.5865
 epoch: 42, train_loss: 0.3370, test_loss: 1.5371, test_f1: 0.6238
 epoch: 43, train_loss: 0.3139, test_loss: 1.6069, test_f1: 0.5805
 epoch: 44, train_loss: 0.2964, test_loss: 1.6468, test_f1: 0.6240
 epoch: 45, train_loss: 0.3029, test_loss: 1.5761, test_f1: 0.6205
 epoch: 46, train_loss: 0.3002, test_loss: 1.6375, test_f1: 0.5968
 epoch: 47, train_loss: 0.3225, test_loss: 1.6211, test_f1: 0.5973
 epoch: 48, train_loss: 0.3072, test_loss: 1.6348, test_f1: 0.6486
 epoch: 49, train_loss: 0.2806, test_loss: 1.8641, test_f1: 0.6123
 epoch: 50, train_loss: 0.2716, test_loss: 1.9597, test_f1: 0.6082
 epoch: 51, train_loss: 0.2377, test_loss: 1.9681, test_f1: 0.6027
 epoch: 52, train_loss: 0.2102, test_loss: 2.0686, test_f1: 0.5979
 epoch: 53, train_loss: 0.1947, test_loss: 2.0742, test_f1: 0.5971
 epoch: 54, train_loss: 0.1833, test_loss: 2.2650, test_f1: 0.6251
 epoch: 55, train_loss: 0.1770, test_loss: 2.6617, test_f1: 0.6061
 epoch: 56, train_loss: 0.1834, test_loss: 2.4157, test_f1: 0.5797
 epoch: 57, train_loss: 0.1716, test_loss: 2.1737, test_f1: 0.6243
 epoch: 58, train_loss: 0.1654, test_loss: 2.2844, test_f1: 0.6027
 epoch: 59, train_loss: 0.1695, test_loss: 2.7565, test_f1: 0.5962
 epoch: 60, train_loss: 0.1474, test_loss: 2.6636, test_f1: 0.5757
 epoch: 61, train_loss: 0.1600, test_loss: 2.4573, test_f1: 0.6036
 epoch: 62, train_loss: 0.1544, test_loss: 2.7117, test_f1: 0.5935
 epoch: 63, train_loss: 0.1626, test_loss: 2.6297, test_f1: 0.5859
 epoch: 64, train_loss: 0.1703, test_loss: 2.4116, test_f1: 0.6002
 epoch: 65, train_loss: 0.1603, test_loss: 2.2449, test_f1: 0.6014
 epoch: 66, train_loss: 0.1696, test_loss: 2.3409, test_f1: 0.6239
 epoch: 67, train_loss: 0.1816, test_loss: 2.4641, test_f1: 0.6175
 epoch: 68, train_loss: 0.1555, test_loss: 2.2162, test_f1: 0.6130
 epoch: 69, train_loss: 0.1506, test_loss: 2.2740, test_f1: 0.5961
 epoch: 70, train_loss: 0.1362, test_loss: 2.5826, test_f1: 0.6038
 epoch: 71, train_loss: 0.1313, test_loss: 2.7861, test_f1: 0.6128
 epoch: 72, train_loss: 0.1381, test_loss: 2.7372, test_f1: 0.6148
 epoch: 73, train_loss: 0.1026, test_loss: 2.7719, test_f1: 0.5894
 epoch: 74, train_loss: 0.1443, test_loss: 2.7359, test_f1: 0.6061
 epoch: 75, train_loss: 0.1594, test_loss: 2.7976, test_f1: 0.5799
 epoch: 76, train_loss: 0.1402, test_loss: 2.8362, test_f1: 0.5856
 epoch: 77, train_loss: 0.1107, test_loss: 2.7851, test_f1: 0.6146
 epoch: 78, train_loss: 0.1557, test_loss: 2.8723, test_f1: 0.5909
 epoch: 79, train_loss: 0.1152, test_loss: 3.0075, test_f1: 0.5866
 epoch: 80, train_loss: 0.1203, test_loss: 2.9087, test_f1: 0.5992
 epoch: 81, train_loss: 0.1254, test_loss: 2.9766, test_f1: 0.5809
 epoch: 82, train_loss: 0.1346, test_loss: 3.0635, test_f1: 0.5769
 epoch: 83, train_loss: 0.1109, test_loss: 3.0690, test_f1: 0.5749
 epoch: 84, train_loss: 0.1369, test_loss: 2.7270, test_f1: 0.5994
 epoch: 85, train_loss: 0.1168, test_loss: 3.0853, test_f1: 0.5984
 epoch: 86, train_loss: 0.1208, test_loss: 2.8157, test_f1: 0.5998
 epoch: 87, train_loss: 0.1244, test_loss: 3.0841, test_f1: 0.5888
 epoch: 88, train_loss: 0.1117, test_loss: 3.0874, test_f1: 0.6075
 epoch: 89, train_loss: 0.1045, test_loss: 3.0653, test_f1: 0.5913
 epoch: 90, train_loss: 0.1382, test_loss: 3.0419, test_f1: 0.5630
 epoch: 91, train_loss: 0.1219, test_loss: 2.9061, test_f1: 0.5944
 epoch: 92, train_loss: 0.1235, test_loss: 2.8869, test_f1: 0.5927
 epoch: 93, train_loss: 0.1010, test_loss: 2.9785, test_f1: 0.6085
 epoch: 94, train_loss: 0.0991, test_loss: 3.0186, test_f1: 0.5841
 epoch: 95, train_loss: 0.1029, test_loss: 2.9416, test_f1: 0.6015
 epoch: 96, train_loss: 0.1153, test_loss: 3.0220, test_f1: 0.5757
 epoch: 97, train_loss: 0.1292, test_loss: 3.1263, test_f1: 0.5931
 epoch: 98, train_loss: 0.1039, test_loss: 2.9821, test_f1: 0.6048
 epoch: 99, train_loss: 0.1058, test_loss: 2.9230, test_f1: 0.5947
##################ITERATION #7 ****************************************
 epoch: 0, train_loss: 1.2281, test_loss: 1.3210, test_f1: 0.3762
 epoch: 1, train_loss: 0.9130, test_loss: 1.0088, test_f1: 0.5973
 epoch: 2, train_loss: 0.8581, test_loss: 0.9873, test_f1: 0.6051
 epoch: 3, train_loss: 0.8048, test_loss: 1.0116, test_f1: 0.6091
 epoch: 4, train_loss: 0.7990, test_loss: 0.9643, test_f1: 0.5621
 epoch: 5, train_loss: 0.7679, test_loss: 0.9879, test_f1: 0.5419
 epoch: 6, train_loss: 0.7569, test_loss: 0.9837, test_f1: 0.6051
 epoch: 7, train_loss: 0.7243, test_loss: 1.1172, test_f1: 0.5907
 epoch: 8, train_loss: 0.7013, test_loss: 1.1465, test_f1: 0.5524
 epoch: 9, train_loss: 0.6683, test_loss: 1.0982, test_f1: 0.5490
 epoch: 10, train_loss: 0.6673, test_loss: 1.1189, test_f1: 0.6061
 epoch: 11, train_loss: 0.6522, test_loss: 0.9942, test_f1: 0.6078
 epoch: 12, train_loss: 0.6368, test_loss: 1.2757, test_f1: 0.5237
 epoch: 13, train_loss: 0.6177, test_loss: 1.0854, test_f1: 0.5858
 epoch: 14, train_loss: 0.5852, test_loss: 1.0736, test_f1: 0.6152
 epoch: 15, train_loss: 0.6056, test_loss: 0.9989, test_f1: 0.6582
 epoch: 16, train_loss: 0.5731, test_loss: 1.2253, test_f1: 0.6290
 epoch: 17, train_loss: 0.5822, test_loss: 1.1016, test_f1: 0.6383
 epoch: 18, train_loss: 0.5604, test_loss: 1.1589, test_f1: 0.6176
 epoch: 19, train_loss: 0.5353, test_loss: 1.1704, test_f1: 0.6262
 epoch: 20, train_loss: 0.5048, test_loss: 1.2261, test_f1: 0.5507
 epoch: 21, train_loss: 0.5009, test_loss: 1.1401, test_f1: 0.6344
 epoch: 22, train_loss: 0.4794, test_loss: 1.6845, test_f1: 0.6061
 epoch: 23, train_loss: 0.4850, test_loss: 1.4496, test_f1: 0.5935
 epoch: 24, train_loss: 0.4807, test_loss: 1.4722, test_f1: 0.5601
 epoch: 25, train_loss: 0.4482, test_loss: 1.4175, test_f1: 0.6052
 epoch: 26, train_loss: 0.4409, test_loss: 1.5063, test_f1: 0.6426
 epoch: 27, train_loss: 0.4290, test_loss: 1.5040, test_f1: 0.5838
 epoch: 28, train_loss: 0.4619, test_loss: 1.4596, test_f1: 0.6038
 epoch: 29, train_loss: 0.4217, test_loss: 1.4756, test_f1: 0.6183
 epoch: 30, train_loss: 0.4112, test_loss: 1.4190, test_f1: 0.6258
 epoch: 31, train_loss: 0.3899, test_loss: 1.5716, test_f1: 0.5491
 epoch: 32, train_loss: 0.3811, test_loss: 1.3878, test_f1: 0.6328
 epoch: 33, train_loss: 0.4257, test_loss: 1.3510, test_f1: 0.6558
 epoch: 34, train_loss: 0.3752, test_loss: 1.5844, test_f1: 0.6071
 epoch: 35, train_loss: 0.3661, test_loss: 1.7169, test_f1: 0.5891
 epoch: 36, train_loss: 0.3541, test_loss: 1.8847, test_f1: 0.5856
 epoch: 37, train_loss: 0.3592, test_loss: 1.8228, test_f1: 0.5706
 epoch: 38, train_loss: 0.3441, test_loss: 1.5858, test_f1: 0.6220
 epoch: 39, train_loss: 0.3094, test_loss: 1.7019, test_f1: 0.6477
 epoch: 40, train_loss: 0.3082, test_loss: 1.8836, test_f1: 0.6416
 epoch: 41, train_loss: 0.3205, test_loss: 1.7699, test_f1: 0.6321
 epoch: 42, train_loss: 0.2901, test_loss: 1.7053, test_f1: 0.6442
 epoch: 43, train_loss: 0.3043, test_loss: 1.6835, test_f1: 0.6665
 epoch: 44, train_loss: 0.3114, test_loss: 1.8210, test_f1: 0.6538
 epoch: 45, train_loss: 0.2794, test_loss: 1.8651, test_f1: 0.6273
 epoch: 46, train_loss: 0.3128, test_loss: 1.6257, test_f1: 0.6115
 epoch: 47, train_loss: 0.2901, test_loss: 1.9608, test_f1: 0.5682
 epoch: 48, train_loss: 0.2865, test_loss: 1.8993, test_f1: 0.5984
 epoch: 49, train_loss: 0.2479, test_loss: 2.1063, test_f1: 0.6243
 epoch: 50, train_loss: 0.2529, test_loss: 2.0493, test_f1: 0.6206
 epoch: 51, train_loss: 0.2283, test_loss: 2.0917, test_f1: 0.6129
 epoch: 52, train_loss: 0.1600, test_loss: 2.3911, test_f1: 0.6059
 epoch: 53, train_loss: 0.1667, test_loss: 2.2173, test_f1: 0.6258
 epoch: 54, train_loss: 0.1323, test_loss: 2.3214, test_f1: 0.6389
 epoch: 55, train_loss: 0.1650, test_loss: 2.3828, test_f1: 0.6389
 epoch: 56, train_loss: 0.1702, test_loss: 2.2620, test_f1: 0.6286
 epoch: 57, train_loss: 0.1445, test_loss: 2.0443, test_f1: 0.6348
 epoch: 58, train_loss: 0.1321, test_loss: 2.4416, test_f1: 0.6343
 epoch: 59, train_loss: 0.1551, test_loss: 2.4253, test_f1: 0.6462
 epoch: 60, train_loss: 0.1400, test_loss: 2.2664, test_f1: 0.6642
 epoch: 61, train_loss: 0.1122, test_loss: 2.5445, test_f1: 0.6554
 epoch: 62, train_loss: 0.1074, test_loss: 2.6272, test_f1: 0.6526
 epoch: 63, train_loss: 0.1507, test_loss: 2.5675, test_f1: 0.6282
 epoch: 64, train_loss: 0.1694, test_loss: 2.3604, test_f1: 0.6595
 epoch: 65, train_loss: 0.1391, test_loss: 2.5138, test_f1: 0.6192
 epoch: 66, train_loss: 0.1449, test_loss: 2.3131, test_f1: 0.6632
 epoch: 67, train_loss: 0.1332, test_loss: 2.3981, test_f1: 0.6480
 epoch: 68, train_loss: 0.1043, test_loss: 2.5946, test_f1: 0.6285
 epoch: 69, train_loss: 0.1265, test_loss: 2.4972, test_f1: 0.6411
 epoch: 70, train_loss: 0.1116, test_loss: 2.7826, test_f1: 0.6342
 epoch: 71, train_loss: 0.1563, test_loss: 2.7218, test_f1: 0.6180
 epoch: 72, train_loss: 0.1333, test_loss: 2.5937, test_f1: 0.6478
 epoch: 73, train_loss: 0.1266, test_loss: 2.7149, test_f1: 0.6455
 epoch: 74, train_loss: 0.1508, test_loss: 2.7378, test_f1: 0.6182
 epoch: 75, train_loss: 0.1445, test_loss: 2.3441, test_f1: 0.6374
 epoch: 76, train_loss: 0.1163, test_loss: 2.6595, test_f1: 0.6323
 epoch: 77, train_loss: 0.0956, test_loss: 2.7649, test_f1: 0.6254
 epoch: 78, train_loss: 0.0987, test_loss: 2.8772, test_f1: 0.6133
 epoch: 79, train_loss: 0.1050, test_loss: 2.7385, test_f1: 0.6151
 epoch: 80, train_loss: 0.1285, test_loss: 2.9219, test_f1: 0.6206
 epoch: 81, train_loss: 0.1452, test_loss: 2.4139, test_f1: 0.6425
 epoch: 82, train_loss: 0.1129, test_loss: 2.8136, test_f1: 0.6559
 epoch: 83, train_loss: 0.1016, test_loss: 2.7122, test_f1: 0.6710
 epoch: 84, train_loss: 0.0993, test_loss: 2.7986, test_f1: 0.6412
 epoch: 85, train_loss: 0.1232, test_loss: 2.6657, test_f1: 0.6179
 epoch: 86, train_loss: 0.1159, test_loss: 2.6445, test_f1: 0.6617
 epoch: 87, train_loss: 0.1034, test_loss: 2.6487, test_f1: 0.6254
 epoch: 88, train_loss: 0.1176, test_loss: 2.7566, test_f1: 0.6130
 epoch: 89, train_loss: 0.0787, test_loss: 2.8247, test_f1: 0.6159
 epoch: 90, train_loss: 0.0859, test_loss: 2.8568, test_f1: 0.6451
 epoch: 91, train_loss: 0.1080, test_loss: 2.5373, test_f1: 0.6520
 epoch: 92, train_loss: 0.1098, test_loss: 2.7651, test_f1: 0.6380
 epoch: 93, train_loss: 0.0952, test_loss: 2.7978, test_f1: 0.6539
 epoch: 94, train_loss: 0.0999, test_loss: 2.7653, test_f1: 0.6314
 epoch: 95, train_loss: 0.0910, test_loss: 2.9539, test_f1: 0.6224
 epoch: 96, train_loss: 0.0970, test_loss: 2.7892, test_f1: 0.6329
 epoch: 97, train_loss: 0.0926, test_loss: 2.9237, test_f1: 0.6548
 epoch: 98, train_loss: 0.0832, test_loss: 3.0099, test_f1: 0.6322
 epoch: 99, train_loss: 0.1083, test_loss: 3.0687, test_f1: 0.6253
##################ITERATION #8 ****************************************
 epoch: 0, train_loss: 1.2855, test_loss: 1.1660, test_f1: 0.5149
 epoch: 1, train_loss: 0.9407, test_loss: 1.0161, test_f1: 0.5747
 epoch: 2, train_loss: 0.8662, test_loss: 1.0018, test_f1: 0.5208
 epoch: 3, train_loss: 0.8122, test_loss: 1.0007, test_f1: 0.6030
 epoch: 4, train_loss: 0.7980, test_loss: 0.9752, test_f1: 0.6116
 epoch: 5, train_loss: 0.7443, test_loss: 0.9954, test_f1: 0.6100
 epoch: 6, train_loss: 0.7205, test_loss: 1.0685, test_f1: 0.5747
 epoch: 7, train_loss: 0.6851, test_loss: 1.0209, test_f1: 0.5488
 epoch: 8, train_loss: 0.7011, test_loss: 1.0269, test_f1: 0.5755
 epoch: 9, train_loss: 0.6539, test_loss: 1.0492, test_f1: 0.5840
 epoch: 10, train_loss: 0.6693, test_loss: 1.0864, test_f1: 0.6365
 epoch: 11, train_loss: 0.6433, test_loss: 0.9874, test_f1: 0.5883
 epoch: 12, train_loss: 0.6191, test_loss: 0.9209, test_f1: 0.6746
 epoch: 13, train_loss: 0.6034, test_loss: 0.9771, test_f1: 0.6058
 epoch: 14, train_loss: 0.6032, test_loss: 1.0693, test_f1: 0.5572
 epoch: 15, train_loss: 0.5771, test_loss: 1.1142, test_f1: 0.5875
 epoch: 16, train_loss: 0.5319, test_loss: 1.1367, test_f1: 0.5939
 epoch: 17, train_loss: 0.5285, test_loss: 1.2111, test_f1: 0.5703
 epoch: 18, train_loss: 0.5007, test_loss: 1.1512, test_f1: 0.6221
 epoch: 19, train_loss: 0.4798, test_loss: 1.1989, test_f1: 0.6151
 epoch: 20, train_loss: 0.5005, test_loss: 1.1665, test_f1: 0.6182
 epoch: 21, train_loss: 0.4828, test_loss: 1.1746, test_f1: 0.6516
 epoch: 22, train_loss: 0.4639, test_loss: 1.3481, test_f1: 0.6291
 epoch: 23, train_loss: 0.4972, test_loss: 1.4656, test_f1: 0.5893
 epoch: 24, train_loss: 0.4803, test_loss: 1.2085, test_f1: 0.6078
 epoch: 25, train_loss: 0.4440, test_loss: 1.2755, test_f1: 0.6224
 epoch: 26, train_loss: 0.4259, test_loss: 1.5685, test_f1: 0.5473
 epoch: 27, train_loss: 0.4162, test_loss: 1.3528, test_f1: 0.6207
 epoch: 28, train_loss: 0.4112, test_loss: 1.3242, test_f1: 0.6292
 epoch: 29, train_loss: 0.3998, test_loss: 1.2741, test_f1: 0.6534
 epoch: 30, train_loss: 0.4036, test_loss: 1.2514, test_f1: 0.6412
 epoch: 31, train_loss: 0.3760, test_loss: 1.3060, test_f1: 0.6734
 epoch: 32, train_loss: 0.3697, test_loss: 1.4335, test_f1: 0.5941
 epoch: 33, train_loss: 0.4057, test_loss: 1.1417, test_f1: 0.6723
 epoch: 34, train_loss: 0.3861, test_loss: 1.6391, test_f1: 0.5872
 epoch: 35, train_loss: 0.3646, test_loss: 1.3145, test_f1: 0.6440
 epoch: 36, train_loss: 0.3397, test_loss: 1.4094, test_f1: 0.6486
 epoch: 37, train_loss: 0.3370, test_loss: 1.8782, test_f1: 0.6022
 epoch: 38, train_loss: 0.3811, test_loss: 1.6136, test_f1: 0.5949
 epoch: 39, train_loss: 0.3285, test_loss: 1.7204, test_f1: 0.5907
 epoch: 40, train_loss: 0.3178, test_loss: 1.5902, test_f1: 0.6277
 epoch: 41, train_loss: 0.2800, test_loss: 1.7916, test_f1: 0.6093
 epoch: 42, train_loss: 0.2838, test_loss: 1.4490, test_f1: 0.6764
 epoch: 43, train_loss: 0.2798, test_loss: 1.8996, test_f1: 0.6282
 epoch: 44, train_loss: 0.2841, test_loss: 1.7802, test_f1: 0.6429
 epoch: 45, train_loss: 0.2989, test_loss: 1.6806, test_f1: 0.6021
 epoch: 46, train_loss: 0.2657, test_loss: 1.8306, test_f1: 0.5969
 epoch: 47, train_loss: 0.2969, test_loss: 1.5682, test_f1: 0.6168
 epoch: 48, train_loss: 0.2490, test_loss: 1.9164, test_f1: 0.6040
 epoch: 49, train_loss: 0.2218, test_loss: 1.9050, test_f1: 0.6063
 epoch: 50, train_loss: 0.2271, test_loss: 2.0856, test_f1: 0.6162
 epoch: 51, train_loss: 0.2052, test_loss: 2.0621, test_f1: 0.6059
 epoch: 52, train_loss: 0.1667, test_loss: 1.8539, test_f1: 0.6421
 epoch: 53, train_loss: 0.1888, test_loss: 2.0814, test_f1: 0.6521
 epoch: 54, train_loss: 0.1500, test_loss: 2.4098, test_f1: 0.6059
 epoch: 55, train_loss: 0.1518, test_loss: 2.2227, test_f1: 0.6081
 epoch: 56, train_loss: 0.1603, test_loss: 2.3116, test_f1: 0.6301
 epoch: 57, train_loss: 0.1392, test_loss: 2.4237, test_f1: 0.6175
 epoch: 58, train_loss: 0.1509, test_loss: 2.3276, test_f1: 0.6392
 epoch: 59, train_loss: 0.1458, test_loss: 2.5800, test_f1: 0.6123
 epoch: 60, train_loss: 0.1505, test_loss: 2.3006, test_f1: 0.6385
 epoch: 61, train_loss: 0.1522, test_loss: 2.7261, test_f1: 0.6221
 epoch: 62, train_loss: 0.1634, test_loss: 2.4727, test_f1: 0.5772
 epoch: 63, train_loss: 0.1386, test_loss: 2.3609, test_f1: 0.6139
 epoch: 64, train_loss: 0.1171, test_loss: 2.4894, test_f1: 0.6001
 epoch: 65, train_loss: 0.1217, test_loss: 2.6339, test_f1: 0.6036
 epoch: 66, train_loss: 0.1239, test_loss: 2.7111, test_f1: 0.6014
 epoch: 67, train_loss: 0.1020, test_loss: 2.7518, test_f1: 0.6098
 epoch: 68, train_loss: 0.1147, test_loss: 2.6593, test_f1: 0.6335
 epoch: 69, train_loss: 0.1413, test_loss: 2.6808, test_f1: 0.5977
 epoch: 70, train_loss: 0.1512, test_loss: 2.5430, test_f1: 0.5835
 epoch: 71, train_loss: 0.1416, test_loss: 2.6594, test_f1: 0.6198
 epoch: 72, train_loss: 0.1251, test_loss: 2.5228, test_f1: 0.6270
 epoch: 73, train_loss: 0.1239, test_loss: 2.2768, test_f1: 0.6368
 epoch: 74, train_loss: 0.1146, test_loss: 2.6330, test_f1: 0.6058
 epoch: 75, train_loss: 0.1180, test_loss: 2.3016, test_f1: 0.6324
 epoch: 76, train_loss: 0.1233, test_loss: 2.6380, test_f1: 0.6133
 epoch: 77, train_loss: 0.1229, test_loss: 2.5067, test_f1: 0.6100
 epoch: 78, train_loss: 0.1254, test_loss: 2.4573, test_f1: 0.6638
 epoch: 79, train_loss: 0.0976, test_loss: 2.4558, test_f1: 0.6111
 epoch: 80, train_loss: 0.1337, test_loss: 2.3935, test_f1: 0.6496
 epoch: 81, train_loss: 0.1448, test_loss: 2.5304, test_f1: 0.6387
 epoch: 82, train_loss: 0.1195, test_loss: 2.4340, test_f1: 0.6722
 epoch: 83, train_loss: 0.0859, test_loss: 2.7914, test_f1: 0.6429
 epoch: 84, train_loss: 0.1022, test_loss: 2.9669, test_f1: 0.6256
 epoch: 85, train_loss: 0.0927, test_loss: 2.7709, test_f1: 0.6362
 epoch: 86, train_loss: 0.0950, test_loss: 2.9009, test_f1: 0.5985
 epoch: 87, train_loss: 0.1067, test_loss: 2.7923, test_f1: 0.6163
 epoch: 88, train_loss: 0.1113, test_loss: 2.6575, test_f1: 0.6486
 epoch: 89, train_loss: 0.0767, test_loss: 2.9046, test_f1: 0.6268
 epoch: 90, train_loss: 0.1264, test_loss: 2.9946, test_f1: 0.6092
 epoch: 91, train_loss: 0.1126, test_loss: 2.7918, test_f1: 0.5926
 epoch: 92, train_loss: 0.1267, test_loss: 2.4463, test_f1: 0.6312
 epoch: 93, train_loss: 0.0973, test_loss: 2.8026, test_f1: 0.6215
 epoch: 94, train_loss: 0.0734, test_loss: 2.8850, test_f1: 0.6526
 epoch: 95, train_loss: 0.0843, test_loss: 2.7439, test_f1: 0.6561
 epoch: 96, train_loss: 0.0893, test_loss: 3.0109, test_f1: 0.6347
 epoch: 97, train_loss: 0.0738, test_loss: 2.5934, test_f1: 0.6640
 epoch: 98, train_loss: 0.1016, test_loss: 2.7547, test_f1: 0.6187
 epoch: 99, train_loss: 0.1139, test_loss: 2.7179, test_f1: 0.6182
##################ITERATION #9 ****************************************
 epoch: 0, train_loss: 1.2438, test_loss: 1.3001, test_f1: 0.3834
 epoch: 1, train_loss: 0.9465, test_loss: 0.9880, test_f1: 0.5735
 epoch: 2, train_loss: 0.8887, test_loss: 0.9849, test_f1: 0.5416
 epoch: 3, train_loss: 0.8505, test_loss: 0.9587, test_f1: 0.6069
 epoch: 4, train_loss: 0.8340, test_loss: 1.0462, test_f1: 0.5640
 epoch: 5, train_loss: 0.7817, test_loss: 0.9754, test_f1: 0.6312
 epoch: 6, train_loss: 0.7585, test_loss: 0.9881, test_f1: 0.6100
 epoch: 7, train_loss: 0.7406, test_loss: 0.9732, test_f1: 0.5904
 epoch: 8, train_loss: 0.7461, test_loss: 1.0221, test_f1: 0.5863
 epoch: 9, train_loss: 0.6906, test_loss: 1.0583, test_f1: 0.5927
 epoch: 10, train_loss: 0.6863, test_loss: 1.0192, test_f1: 0.5587
 epoch: 11, train_loss: 0.6797, test_loss: 1.0582, test_f1: 0.5758
 epoch: 12, train_loss: 0.6464, test_loss: 1.0648, test_f1: 0.5806
 epoch: 13, train_loss: 0.6476, test_loss: 0.9289, test_f1: 0.6331
 epoch: 14, train_loss: 0.6586, test_loss: 1.0656, test_f1: 0.6247
 epoch: 15, train_loss: 0.6359, test_loss: 1.0371, test_f1: 0.6116
 epoch: 16, train_loss: 0.5934, test_loss: 1.0922, test_f1: 0.6667
 epoch: 17, train_loss: 0.5914, test_loss: 1.0443, test_f1: 0.6075
 epoch: 18, train_loss: 0.5733, test_loss: 1.2378, test_f1: 0.5387
 epoch: 19, train_loss: 0.5785, test_loss: 1.0703, test_f1: 0.5966
 epoch: 20, train_loss: 0.5639, test_loss: 1.1035, test_f1: 0.6184
 epoch: 21, train_loss: 0.5282, test_loss: 1.3214, test_f1: 0.5473
 epoch: 22, train_loss: 0.5450, test_loss: 1.1641, test_f1: 0.5735
 epoch: 23, train_loss: 0.5082, test_loss: 1.0238, test_f1: 0.6332
 epoch: 24, train_loss: 0.5209, test_loss: 1.1158, test_f1: 0.6262
 epoch: 25, train_loss: 0.5015, test_loss: 1.2198, test_f1: 0.5827
 epoch: 26, train_loss: 0.4957, test_loss: 1.0785, test_f1: 0.6390
 epoch: 27, train_loss: 0.4578, test_loss: 1.5526, test_f1: 0.5583
 epoch: 28, train_loss: 0.4466, test_loss: 1.5416, test_f1: 0.5476
 epoch: 29, train_loss: 0.4801, test_loss: 1.3154, test_f1: 0.5873
 epoch: 30, train_loss: 0.4651, test_loss: 1.6400, test_f1: 0.5828
 epoch: 31, train_loss: 0.4601, test_loss: 1.4877, test_f1: 0.5719
 epoch: 32, train_loss: 0.4353, test_loss: 1.4223, test_f1: 0.6349
 epoch: 33, train_loss: 0.4184, test_loss: 1.4873, test_f1: 0.6130
 epoch: 34, train_loss: 0.4177, test_loss: 1.3198, test_f1: 0.6169
 epoch: 35, train_loss: 0.4195, test_loss: 1.4179, test_f1: 0.6553
 epoch: 36, train_loss: 0.3895, test_loss: 1.3499, test_f1: 0.5921
 epoch: 37, train_loss: 0.3951, test_loss: 1.2551, test_f1: 0.6490
 epoch: 38, train_loss: 0.3931, test_loss: 1.3450, test_f1: 0.6332
 epoch: 39, train_loss: 0.3455, test_loss: 1.3748, test_f1: 0.6375
 epoch: 40, train_loss: 0.3824, test_loss: 1.5259, test_f1: 0.6273
 epoch: 41, train_loss: 0.3753, test_loss: 1.4162, test_f1: 0.5723
 epoch: 42, train_loss: 0.3649, test_loss: 1.3842, test_f1: 0.6460
 epoch: 43, train_loss: 0.3181, test_loss: 1.7765, test_f1: 0.5443
 epoch: 44, train_loss: 0.3139, test_loss: 1.7713, test_f1: 0.5865
 epoch: 45, train_loss: 0.2759, test_loss: 1.7817, test_f1: 0.5924
 epoch: 46, train_loss: 0.3556, test_loss: 1.5578, test_f1: 0.6109
 epoch: 47, train_loss: 0.3388, test_loss: 1.8666, test_f1: 0.5957
 epoch: 48, train_loss: 0.3008, test_loss: 1.4441, test_f1: 0.6428
 epoch: 49, train_loss: 0.2880, test_loss: 2.0474, test_f1: 0.5730
 epoch: 50, train_loss: 0.2954, test_loss: 1.6518, test_f1: 0.6478
 epoch: 51, train_loss: 0.2717, test_loss: 1.8633, test_f1: 0.6029
 epoch: 52, train_loss: 0.2105, test_loss: 1.7582, test_f1: 0.6356
 epoch: 53, train_loss: 0.2323, test_loss: 1.8036, test_f1: 0.6289
 epoch: 54, train_loss: 0.2031, test_loss: 1.9436, test_f1: 0.5980
 epoch: 55, train_loss: 0.2326, test_loss: 1.9797, test_f1: 0.5996
 epoch: 56, train_loss: 0.2077, test_loss: 2.3411, test_f1: 0.5786
 epoch: 57, train_loss: 0.1849, test_loss: 2.1334, test_f1: 0.6038
 epoch: 58, train_loss: 0.1836, test_loss: 2.2078, test_f1: 0.6117
 epoch: 59, train_loss: 0.1582, test_loss: 2.1454, test_f1: 0.5909
 epoch: 60, train_loss: 0.1607, test_loss: 2.3100, test_f1: 0.5691
 epoch: 61, train_loss: 0.1690, test_loss: 2.2597, test_f1: 0.6369
 epoch: 62, train_loss: 0.1794, test_loss: 2.1680, test_f1: 0.5940
 epoch: 63, train_loss: 0.1398, test_loss: 2.2933, test_f1: 0.5919
 epoch: 64, train_loss: 0.1877, test_loss: 2.3188, test_f1: 0.5839
 epoch: 65, train_loss: 0.1509, test_loss: 2.2689, test_f1: 0.5950
 epoch: 66, train_loss: 0.1747, test_loss: 2.1898, test_f1: 0.6060
 epoch: 67, train_loss: 0.1614, test_loss: 2.2844, test_f1: 0.6102
 epoch: 68, train_loss: 0.1561, test_loss: 2.2912, test_f1: 0.5889
 epoch: 69, train_loss: 0.1541, test_loss: 2.2782, test_f1: 0.6204
 epoch: 70, train_loss: 0.1636, test_loss: 2.1379, test_f1: 0.6020
 epoch: 71, train_loss: 0.1406, test_loss: 2.3392, test_f1: 0.6131
 epoch: 72, train_loss: 0.1232, test_loss: 2.3493, test_f1: 0.6173
 epoch: 73, train_loss: 0.1372, test_loss: 2.5201, test_f1: 0.6034
 epoch: 74, train_loss: 0.1576, test_loss: 2.3005, test_f1: 0.6257
 epoch: 75, train_loss: 0.1568, test_loss: 2.3729, test_f1: 0.6235
 epoch: 76, train_loss: 0.1468, test_loss: 2.5312, test_f1: 0.5790
 epoch: 77, train_loss: 0.1309, test_loss: 2.4670, test_f1: 0.6000
 epoch: 78, train_loss: 0.1559, test_loss: 2.4688, test_f1: 0.5993
 epoch: 79, train_loss: 0.1400, test_loss: 2.3317, test_f1: 0.6309
 epoch: 80, train_loss: 0.1277, test_loss: 2.4556, test_f1: 0.6036
 epoch: 81, train_loss: 0.1199, test_loss: 2.5464, test_f1: 0.5906
 epoch: 82, train_loss: 0.1072, test_loss: 2.5267, test_f1: 0.6037
 epoch: 83, train_loss: 0.1414, test_loss: 2.5750, test_f1: 0.5857
 epoch: 84, train_loss: 0.1146, test_loss: 2.3744, test_f1: 0.6368
 epoch: 85, train_loss: 0.1102, test_loss: 2.4503, test_f1: 0.6126
 epoch: 86, train_loss: 0.1248, test_loss: 2.5535, test_f1: 0.6022
 epoch: 87, train_loss: 0.1193, test_loss: 2.7055, test_f1: 0.6031
 epoch: 88, train_loss: 0.0936, test_loss: 2.5620, test_f1: 0.5956
 epoch: 89, train_loss: 0.1186, test_loss: 3.3618, test_f1: 0.5777
 epoch: 90, train_loss: 0.1288, test_loss: 2.9692, test_f1: 0.5727
 epoch: 91, train_loss: 0.1785, test_loss: 2.4812, test_f1: 0.5979
 epoch: 92, train_loss: 0.1387, test_loss: 2.3749, test_f1: 0.6139
 epoch: 93, train_loss: 0.1219, test_loss: 2.5413, test_f1: 0.5950
 epoch: 94, train_loss: 0.1130, test_loss: 2.6788, test_f1: 0.6189
 epoch: 95, train_loss: 0.1049, test_loss: 2.9025, test_f1: 0.6048
 epoch: 96, train_loss: 0.1410, test_loss: 2.7483, test_f1: 0.6109
 epoch: 97, train_loss: 0.1287, test_loss: 2.7797, test_f1: 0.5934
 epoch: 98, train_loss: 0.1227, test_loss: 2.8754, test_f1: 0.6006
 epoch: 99, train_loss: 0.1204, test_loss: 2.8175, test_f1: 0.5901

Training completed in 597.26 seconds
Best F1: 0.6966 at epoch 25
Mean F1 across iterations: 0.6743  0.0154
========================FINAL RESULTS================================
FEGIN weighted F1: 0.6966  0.0154
python main.py --data ltspice_demos --representation component_pin --model FEGIN --layers 3 --hiddens 128 --batch_size 32 --lr 0.001 --emb_size 128 --epochs 100 --save_appendix component_pin_L3_H128_BS32_LR0.001_E128 --no_val
-----



STDERR:
  File "main.py", line 370, in <module>
    main()
  File "main.py", line 254, in main
    dataset = dataset_class(
  File "/home/philip/projects/ltspice_examples_code_repo/Circuit-Completion-Using-GNNs/component_classification_with_link_prediction_head/evaluation/FEGIN/kernel/circuit_datasets.py", line 15, in __init__
    self.data, self.slices = torch.load(self.processed_paths[0])
  File "/home/philip/.local/lib/python3.8/site-packages/torch/serialization.py", line 1040, in load
    warnings.warn(
  File "/usr/lib/python3.8/warnings.py", line 109, in _showwarnmsg
    sw(msg.message, msg.category, msg.filename, msg.lineno,
  File "main.py", line 47, in warn_with_traceback
    traceback.print_stack(file=log)
/home/philip/projects/ltspice_examples_code_repo/Circuit-Completion-Using-GNNs/component_classification_with_link_prediction_head/evaluation/FEGIN/kernel/circuit_datasets.py:15: FutureWarning: You are using `torch.load` with `weights_only=False` (the current default value), which uses the default pickle module implicitly. It is possible to construct malicious pickle data which will execute arbitrary code during unpickling (See https://github.com/pytorch/pytorch/blob/main/SECURITY.md#untrusted-models for more details). In a future release, the default value for `weights_only` will be flipped to `True`. This limits the functions that could be executed during unpickling. Arbitrary objects will no longer be allowed to be loaded via this mode unless they are explicitly allowlisted by the user via `torch.serialization.add_safe_globals`. We recommend you start setting `weights_only=True` for any use case where you don't have full control of the loaded file. Please open an issue on GitHub for any issues related to this experimental feature.
  self.data, self.slices = torch.load(self.processed_paths[0])
