STDOUT:
Results will be saved in /home/philip/projects/ltspice_examples_code_repo/Circuit-Completion-Using-GNNs/component_classification_with_link_prediction_head/evaluation/FEGIN/results/model_FEGIN_dataset_ltspice_demos
Command line input: python main.py --data ltspice_demos --representation component_component --model FEGIN --layers 5 --hiddens 128 --batch_size 256 --lr 0.001 --emb_size 512 --epochs 100 --save_appendix component_component_L5_H128_BS256_LR0.001_E512 --no_val
 is saved.
-----
ltspice_demos - FEGIN
Using 5 layers, 128 hidden units, h = 2
Loading component_component representation dataset
ENTERED
Training FEGIN on component_component representation
Train: 1565, Test: 383
##################ITERATION #0 ****************************************
 epoch: 0, train_loss: 1.3417, test_loss: 1.3394, test_f1: 0.1435
 epoch: 1, train_loss: 1.2089, test_loss: 1.3025, test_f1: 0.3518
 epoch: 2, train_loss: 1.1718, test_loss: 1.2994, test_f1: 0.3516
 epoch: 3, train_loss: 1.1186, test_loss: 1.2918, test_f1: 0.3430
 epoch: 4, train_loss: 1.0791, test_loss: 1.3235, test_f1: 0.3391
 epoch: 5, train_loss: 1.0397, test_loss: 1.3330, test_f1: 0.3647
 epoch: 6, train_loss: 1.0101, test_loss: 1.2711, test_f1: 0.3592
 epoch: 7, train_loss: 0.9672, test_loss: 1.1962, test_f1: 0.4806
 epoch: 8, train_loss: 0.9691, test_loss: 1.2117, test_f1: 0.3861
 epoch: 9, train_loss: 0.9271, test_loss: 1.2431, test_f1: 0.4384
 epoch: 10, train_loss: 0.9020, test_loss: 1.2725, test_f1: 0.4716
 epoch: 11, train_loss: 0.8933, test_loss: 1.2508, test_f1: 0.5107
 epoch: 12, train_loss: 0.8337, test_loss: 1.2819, test_f1: 0.4346
 epoch: 13, train_loss: 0.8192, test_loss: 1.2372, test_f1: 0.4769
 epoch: 14, train_loss: 0.8250, test_loss: 1.3068, test_f1: 0.5007
 epoch: 15, train_loss: 0.7985, test_loss: 1.2576, test_f1: 0.5289
 epoch: 16, train_loss: 0.7881, test_loss: 1.3625, test_f1: 0.4993
 epoch: 17, train_loss: 0.7629, test_loss: 1.3352, test_f1: 0.4920
 epoch: 18, train_loss: 0.7517, test_loss: 1.3354, test_f1: 0.5285
 epoch: 19, train_loss: 0.7393, test_loss: 1.3714, test_f1: 0.4985
 epoch: 20, train_loss: 0.7356, test_loss: 1.5462, test_f1: 0.4669
 epoch: 21, train_loss: 0.7112, test_loss: 1.4770, test_f1: 0.4317
 epoch: 22, train_loss: 0.7158, test_loss: 1.6473, test_f1: 0.4453
 epoch: 23, train_loss: 0.7276, test_loss: 1.5705, test_f1: 0.5308
 epoch: 24, train_loss: 0.7117, test_loss: 1.3010, test_f1: 0.5370
 epoch: 25, train_loss: 0.6926, test_loss: 1.2339, test_f1: 0.5450
 epoch: 26, train_loss: 0.6551, test_loss: 1.4019, test_f1: 0.5437
 epoch: 27, train_loss: 0.6755, test_loss: 1.5593, test_f1: 0.4827
 epoch: 28, train_loss: 0.6223, test_loss: 1.3817, test_f1: 0.5519
 epoch: 29, train_loss: 0.6426, test_loss: 1.4256, test_f1: 0.5210
 epoch: 30, train_loss: 0.6307, test_loss: 1.6473, test_f1: 0.4712
 epoch: 31, train_loss: 0.6221, test_loss: 1.6084, test_f1: 0.5386
 epoch: 32, train_loss: 0.5902, test_loss: 1.4458, test_f1: 0.5193
 epoch: 33, train_loss: 0.6081, test_loss: 1.6250, test_f1: 0.4899
 epoch: 34, train_loss: 0.6528, test_loss: 1.6390, test_f1: 0.4546
 epoch: 35, train_loss: 0.6082, test_loss: 1.5560, test_f1: 0.4794
 epoch: 36, train_loss: 0.6027, test_loss: 2.4086, test_f1: 0.4704
 epoch: 37, train_loss: 0.5949, test_loss: 2.0872, test_f1: 0.4835
 epoch: 38, train_loss: 0.5745, test_loss: 1.7439, test_f1: 0.5173
 epoch: 39, train_loss: 0.5543, test_loss: 1.8812, test_f1: 0.4667
 epoch: 40, train_loss: 0.5659, test_loss: 1.5554, test_f1: 0.5241
 epoch: 41, train_loss: 0.5574, test_loss: 1.4644, test_f1: 0.5752
 epoch: 42, train_loss: 0.5592, test_loss: 1.6167, test_f1: 0.5371
 epoch: 43, train_loss: 0.5293, test_loss: 1.7484, test_f1: 0.5466
 epoch: 44, train_loss: 0.5184, test_loss: 1.6235, test_f1: 0.5092
 epoch: 45, train_loss: 0.5009, test_loss: 1.6572, test_f1: 0.4905
 epoch: 46, train_loss: 0.4886, test_loss: 1.7378, test_f1: 0.4883
 epoch: 47, train_loss: 0.4947, test_loss: 1.7307, test_f1: 0.4993
 epoch: 48, train_loss: 0.4908, test_loss: 1.9641, test_f1: 0.4673
 epoch: 49, train_loss: 0.4887, test_loss: 1.9453, test_f1: 0.5032
 epoch: 50, train_loss: 0.4675, test_loss: 1.9028, test_f1: 0.4852
 epoch: 51, train_loss: 0.4268, test_loss: 2.0281, test_f1: 0.4956
 epoch: 52, train_loss: 0.4233, test_loss: 2.0610, test_f1: 0.5122
 epoch: 53, train_loss: 0.3954, test_loss: 2.1184, test_f1: 0.5024
 epoch: 54, train_loss: 0.4035, test_loss: 2.1704, test_f1: 0.5055
 epoch: 55, train_loss: 0.4007, test_loss: 2.0882, test_f1: 0.4912
 epoch: 56, train_loss: 0.3820, test_loss: 2.0266, test_f1: 0.4690
 epoch: 57, train_loss: 0.3661, test_loss: 2.1022, test_f1: 0.5146
 epoch: 58, train_loss: 0.3613, test_loss: 2.1974, test_f1: 0.5600
 epoch: 59, train_loss: 0.3973, test_loss: 2.0362, test_f1: 0.5257
 epoch: 60, train_loss: 0.3799, test_loss: 2.0480, test_f1: 0.5227
 epoch: 61, train_loss: 0.3494, test_loss: 2.3167, test_f1: 0.4747
 epoch: 62, train_loss: 0.3860, test_loss: 2.3412, test_f1: 0.4898
 epoch: 63, train_loss: 0.3491, test_loss: 2.1998, test_f1: 0.5020
 epoch: 64, train_loss: 0.3459, test_loss: 2.2133, test_f1: 0.4851
 epoch: 65, train_loss: 0.3642, test_loss: 2.2075, test_f1: 0.4794
 epoch: 66, train_loss: 0.3672, test_loss: 2.2934, test_f1: 0.5075
 epoch: 67, train_loss: 0.3566, test_loss: 2.0763, test_f1: 0.5174
 epoch: 68, train_loss: 0.3601, test_loss: 2.1396, test_f1: 0.5029
 epoch: 69, train_loss: 0.3476, test_loss: 2.1906, test_f1: 0.5266
 epoch: 70, train_loss: 0.3375, test_loss: 2.2578, test_f1: 0.4865
 epoch: 71, train_loss: 0.3149, test_loss: 2.1708, test_f1: 0.4988
 epoch: 72, train_loss: 0.3329, test_loss: 2.4658, test_f1: 0.4874
 epoch: 73, train_loss: 0.3243, test_loss: 2.6738, test_f1: 0.4745
 epoch: 74, train_loss: 0.3327, test_loss: 2.5913, test_f1: 0.5066
 epoch: 75, train_loss: 0.3428, test_loss: 2.6012, test_f1: 0.5110
 epoch: 76, train_loss: 0.3269, test_loss: 2.4922, test_f1: 0.5183
 epoch: 77, train_loss: 0.3244, test_loss: 2.5008, test_f1: 0.5100
 epoch: 78, train_loss: 0.3151, test_loss: 2.8527, test_f1: 0.4464
 epoch: 79, train_loss: 0.3213, test_loss: 2.7634, test_f1: 0.4866
 epoch: 80, train_loss: 0.3321, test_loss: 2.5106, test_f1: 0.4960
 epoch: 81, train_loss: 0.3378, test_loss: 2.3850, test_f1: 0.5026
 epoch: 82, train_loss: 0.3634, test_loss: 2.4580, test_f1: 0.4947
 epoch: 83, train_loss: 0.3930, test_loss: 2.3934, test_f1: 0.4898
 epoch: 84, train_loss: 0.3610, test_loss: 2.1353, test_f1: 0.5128
 epoch: 85, train_loss: 0.3501, test_loss: 2.1669, test_f1: 0.4825
 epoch: 86, train_loss: 0.3506, test_loss: 2.5804, test_f1: 0.5072
 epoch: 87, train_loss: 0.3160, test_loss: 3.0057, test_f1: 0.4927
 epoch: 88, train_loss: 0.2999, test_loss: 3.3346, test_f1: 0.4827
 epoch: 89, train_loss: 0.2978, test_loss: 3.1783, test_f1: 0.4798
 epoch: 90, train_loss: 0.3130, test_loss: 3.0412, test_f1: 0.4983
 epoch: 91, train_loss: 0.2999, test_loss: 3.1358, test_f1: 0.4790
 epoch: 92, train_loss: 0.3230, test_loss: 3.1200, test_f1: 0.5225
 epoch: 93, train_loss: 0.2938, test_loss: 2.7281, test_f1: 0.5272
 epoch: 94, train_loss: 0.2967, test_loss: 2.5087, test_f1: 0.4953
 epoch: 95, train_loss: 0.2697, test_loss: 2.6733, test_f1: 0.4742
 epoch: 96, train_loss: 0.2946, test_loss: 3.1418, test_f1: 0.5019
 epoch: 97, train_loss: 0.2882, test_loss: 3.5010, test_f1: 0.4881
 epoch: 98, train_loss: 0.2667, test_loss: 3.2054, test_f1: 0.4738
 epoch: 99, train_loss: 0.2703, test_loss: 3.1894, test_f1: 0.5029
##################ITERATION #1 ****************************************
 epoch: 0, train_loss: 1.2525, test_loss: 1.3212, test_f1: 0.2771
 epoch: 1, train_loss: 1.1171, test_loss: 1.2641, test_f1: 0.2622
 epoch: 2, train_loss: 1.0617, test_loss: 1.2196, test_f1: 0.2974
 epoch: 3, train_loss: 1.0153, test_loss: 1.1872, test_f1: 0.4269
 epoch: 4, train_loss: 0.9662, test_loss: 1.1572, test_f1: 0.4530
 epoch: 5, train_loss: 0.9151, test_loss: 1.1511, test_f1: 0.5343
 epoch: 6, train_loss: 0.8899, test_loss: 1.1190, test_f1: 0.5466
 epoch: 7, train_loss: 0.8754, test_loss: 1.2255, test_f1: 0.5284
 epoch: 8, train_loss: 0.8491, test_loss: 1.1892, test_f1: 0.5059
 epoch: 9, train_loss: 0.7940, test_loss: 1.2041, test_f1: 0.4830
 epoch: 10, train_loss: 0.7711, test_loss: 1.1733, test_f1: 0.5843
 epoch: 11, train_loss: 0.7571, test_loss: 1.3739, test_f1: 0.5425
 epoch: 12, train_loss: 0.7466, test_loss: 1.5341, test_f1: 0.5166
 epoch: 13, train_loss: 0.7592, test_loss: 1.2695, test_f1: 0.5651
 epoch: 14, train_loss: 0.7162, test_loss: 1.2472, test_f1: 0.5710
 epoch: 15, train_loss: 0.7156, test_loss: 1.2539, test_f1: 0.5695
 epoch: 16, train_loss: 0.6965, test_loss: 1.3454, test_f1: 0.5302
 epoch: 17, train_loss: 0.6556, test_loss: 1.6735, test_f1: 0.4816
 epoch: 18, train_loss: 0.6478, test_loss: 1.7570, test_f1: 0.5484
 epoch: 19, train_loss: 0.6299, test_loss: 1.6508, test_f1: 0.5339
 epoch: 20, train_loss: 0.6281, test_loss: 1.8884, test_f1: 0.5208
 epoch: 21, train_loss: 0.6692, test_loss: 1.6619, test_f1: 0.5474
 epoch: 22, train_loss: 0.6418, test_loss: 1.5696, test_f1: 0.5834
 epoch: 23, train_loss: 0.6064, test_loss: 1.4122, test_f1: 0.6044
 epoch: 24, train_loss: 0.5931, test_loss: 1.5967, test_f1: 0.5766
 epoch: 25, train_loss: 0.5617, test_loss: 1.6864, test_f1: 0.5434
 epoch: 26, train_loss: 0.5686, test_loss: 1.8471, test_f1: 0.5429
 epoch: 27, train_loss: 0.5605, test_loss: 2.1849, test_f1: 0.4889
 epoch: 28, train_loss: 0.5798, test_loss: 2.3170, test_f1: 0.4928
 epoch: 29, train_loss: 0.5712, test_loss: 2.0044, test_f1: 0.5727
 epoch: 30, train_loss: 0.5770, test_loss: 1.7450, test_f1: 0.5476
 epoch: 31, train_loss: 0.5998, test_loss: 1.7848, test_f1: 0.5387
 epoch: 32, train_loss: 0.5640, test_loss: 2.0489, test_f1: 0.4719
 epoch: 33, train_loss: 0.5704, test_loss: 1.9844, test_f1: 0.5238
 epoch: 34, train_loss: 0.5628, test_loss: 1.9892, test_f1: 0.5732
 epoch: 35, train_loss: 0.5001, test_loss: 1.7926, test_f1: 0.5717
 epoch: 36, train_loss: 0.5016, test_loss: 1.7799, test_f1: 0.5741
 epoch: 37, train_loss: 0.5159, test_loss: 1.9233, test_f1: 0.5590
 epoch: 38, train_loss: 0.4910, test_loss: 2.2950, test_f1: 0.4988
 epoch: 39, train_loss: 0.4849, test_loss: 2.1270, test_f1: 0.4638
 epoch: 40, train_loss: 0.4938, test_loss: 1.7361, test_f1: 0.5668
 epoch: 41, train_loss: 0.4967, test_loss: 1.9131, test_f1: 0.5434
 epoch: 42, train_loss: 0.4963, test_loss: 1.7898, test_f1: 0.5098
 epoch: 43, train_loss: 0.5358, test_loss: 1.7912, test_f1: 0.5209
 epoch: 44, train_loss: 0.5128, test_loss: 1.5453, test_f1: 0.5550
 epoch: 45, train_loss: 0.4903, test_loss: 1.8194, test_f1: 0.5257
 epoch: 46, train_loss: 0.4541, test_loss: 2.3284, test_f1: 0.5576
 epoch: 47, train_loss: 0.4508, test_loss: 2.7729, test_f1: 0.5263
 epoch: 48, train_loss: 0.4425, test_loss: 2.5623, test_f1: 0.5461
 epoch: 49, train_loss: 0.4115, test_loss: 2.3121, test_f1: 0.5761
 epoch: 50, train_loss: 0.4106, test_loss: 2.3448, test_f1: 0.5415
 epoch: 51, train_loss: 0.4099, test_loss: 2.1267, test_f1: 0.5647
 epoch: 52, train_loss: 0.3669, test_loss: 2.0584, test_f1: 0.5305
 epoch: 53, train_loss: 0.3666, test_loss: 2.0443, test_f1: 0.5336
 epoch: 54, train_loss: 0.3749, test_loss: 2.2535, test_f1: 0.5620
 epoch: 55, train_loss: 0.3602, test_loss: 2.4058, test_f1: 0.5454
 epoch: 56, train_loss: 0.3327, test_loss: 2.4006, test_f1: 0.5262
 epoch: 57, train_loss: 0.3352, test_loss: 2.3407, test_f1: 0.5347
 epoch: 58, train_loss: 0.3331, test_loss: 2.1956, test_f1: 0.5433
 epoch: 59, train_loss: 0.3419, test_loss: 2.5148, test_f1: 0.5240
 epoch: 60, train_loss: 0.3449, test_loss: 2.4496, test_f1: 0.5437
 epoch: 61, train_loss: 0.3317, test_loss: 2.5290, test_f1: 0.5414
 epoch: 62, train_loss: 0.3194, test_loss: 2.5252, test_f1: 0.5386
 epoch: 63, train_loss: 0.3211, test_loss: 2.5502, test_f1: 0.5288
 epoch: 64, train_loss: 0.3073, test_loss: 2.2667, test_f1: 0.5587
 epoch: 65, train_loss: 0.3258, test_loss: 2.2574, test_f1: 0.5740
 epoch: 66, train_loss: 0.3249, test_loss: 2.4262, test_f1: 0.5556
 epoch: 67, train_loss: 0.3062, test_loss: 2.4778, test_f1: 0.5826
 epoch: 68, train_loss: 0.3129, test_loss: 2.4930, test_f1: 0.5729
 epoch: 69, train_loss: 0.3025, test_loss: 3.0917, test_f1: 0.5258
 epoch: 70, train_loss: 0.3182, test_loss: 2.6426, test_f1: 0.5224
 epoch: 71, train_loss: 0.3013, test_loss: 2.6378, test_f1: 0.5286
 epoch: 72, train_loss: 0.2930, test_loss: 2.5204, test_f1: 0.5293
 epoch: 73, train_loss: 0.2949, test_loss: 2.3203, test_f1: 0.5429
 epoch: 74, train_loss: 0.3354, test_loss: 2.5965, test_f1: 0.5239
 epoch: 75, train_loss: 0.3646, test_loss: 2.7303, test_f1: 0.5322
 epoch: 76, train_loss: 0.3548, test_loss: 2.6207, test_f1: 0.5581
 epoch: 77, train_loss: 0.3205, test_loss: 2.4745, test_f1: 0.5687
 epoch: 78, train_loss: 0.3070, test_loss: 2.3050, test_f1: 0.5557
 epoch: 79, train_loss: 0.3049, test_loss: 2.2256, test_f1: 0.5477
 epoch: 80, train_loss: 0.2897, test_loss: 2.3991, test_f1: 0.5234
 epoch: 81, train_loss: 0.3148, test_loss: 2.3930, test_f1: 0.5293
 epoch: 82, train_loss: 0.3091, test_loss: 2.7505, test_f1: 0.4962
 epoch: 83, train_loss: 0.3063, test_loss: 2.6887, test_f1: 0.4926
 epoch: 84, train_loss: 0.2941, test_loss: 2.8466, test_f1: 0.5439
 epoch: 85, train_loss: 0.2948, test_loss: 2.4166, test_f1: 0.5393
 epoch: 86, train_loss: 0.2842, test_loss: 2.3030, test_f1: 0.5667
 epoch: 87, train_loss: 0.2875, test_loss: 2.6526, test_f1: 0.5463
 epoch: 88, train_loss: 0.2947, test_loss: 2.6092, test_f1: 0.5343
 epoch: 89, train_loss: 0.2841, test_loss: 2.8043, test_f1: 0.5411
 epoch: 90, train_loss: 0.2908, test_loss: 2.6855, test_f1: 0.5392
 epoch: 91, train_loss: 0.2660, test_loss: 2.9346, test_f1: 0.5203
 epoch: 92, train_loss: 0.2540, test_loss: 2.5109, test_f1: 0.5247
 epoch: 93, train_loss: 0.2629, test_loss: 2.4588, test_f1: 0.5631
 epoch: 94, train_loss: 0.2480, test_loss: 2.5605, test_f1: 0.5416
 epoch: 95, train_loss: 0.2523, test_loss: 2.5294, test_f1: 0.5423
 epoch: 96, train_loss: 0.2373, test_loss: 2.8616, test_f1: 0.5632
 epoch: 97, train_loss: 0.2439, test_loss: 3.5451, test_f1: 0.5360
 epoch: 98, train_loss: 0.2647, test_loss: 3.5809, test_f1: 0.5407
 epoch: 99, train_loss: 0.2593, test_loss: 3.1626, test_f1: 0.5329
##################ITERATION #2 ****************************************
 epoch: 0, train_loss: 1.2370, test_loss: 1.3455, test_f1: 0.1474
 epoch: 1, train_loss: 1.1106, test_loss: 1.2957, test_f1: 0.3156
 epoch: 2, train_loss: 1.0449, test_loss: 1.2384, test_f1: 0.3187
 epoch: 3, train_loss: 1.0111, test_loss: 1.2037, test_f1: 0.3715
 epoch: 4, train_loss: 0.9824, test_loss: 1.1890, test_f1: 0.4983
 epoch: 5, train_loss: 0.9217, test_loss: 1.1828, test_f1: 0.5023
 epoch: 6, train_loss: 0.9034, test_loss: 1.2060, test_f1: 0.5391
 epoch: 7, train_loss: 0.8700, test_loss: 1.1784, test_f1: 0.4947
 epoch: 8, train_loss: 0.8465, test_loss: 1.1891, test_f1: 0.5147
 epoch: 9, train_loss: 0.8213, test_loss: 1.2639, test_f1: 0.4910
 epoch: 10, train_loss: 0.8061, test_loss: 1.4098, test_f1: 0.4818
 epoch: 11, train_loss: 0.7859, test_loss: 1.3017, test_f1: 0.5530
 epoch: 12, train_loss: 0.7657, test_loss: 1.2387, test_f1: 0.5733
 epoch: 13, train_loss: 0.7506, test_loss: 1.4937, test_f1: 0.4999
 epoch: 14, train_loss: 0.7624, test_loss: 1.3823, test_f1: 0.5237
 epoch: 15, train_loss: 0.7627, test_loss: 1.4267, test_f1: 0.5532
 epoch: 16, train_loss: 0.7066, test_loss: 1.7967, test_f1: 0.4498
 epoch: 17, train_loss: 0.7267, test_loss: 1.8343, test_f1: 0.4893
 epoch: 18, train_loss: 0.7311, test_loss: 1.4977, test_f1: 0.5434
 epoch: 19, train_loss: 0.7177, test_loss: 1.5146, test_f1: 0.5266
 epoch: 20, train_loss: 0.6652, test_loss: 1.4301, test_f1: 0.5346
 epoch: 21, train_loss: 0.6540, test_loss: 1.4362, test_f1: 0.5756
 epoch: 22, train_loss: 0.6346, test_loss: 1.5711, test_f1: 0.5571
 epoch: 23, train_loss: 0.6293, test_loss: 1.5927, test_f1: 0.5044
 epoch: 24, train_loss: 0.6182, test_loss: 1.6272, test_f1: 0.6048
 epoch: 25, train_loss: 0.5885, test_loss: 1.6696, test_f1: 0.5622
 epoch: 26, train_loss: 0.6146, test_loss: 1.5746, test_f1: 0.5549
 epoch: 27, train_loss: 0.6383, test_loss: 1.7745, test_f1: 0.4729
 epoch: 28, train_loss: 0.6174, test_loss: 1.8169, test_f1: 0.5163
 epoch: 29, train_loss: 0.6454, test_loss: 1.6610, test_f1: 0.5427
 epoch: 30, train_loss: 0.6022, test_loss: 1.5503, test_f1: 0.5475
 epoch: 31, train_loss: 0.5725, test_loss: 1.5955, test_f1: 0.5595
 epoch: 32, train_loss: 0.5933, test_loss: 1.6133, test_f1: 0.5395
 epoch: 33, train_loss: 0.5638, test_loss: 1.5799, test_f1: 0.5594
 epoch: 34, train_loss: 0.5586, test_loss: 1.5423, test_f1: 0.5710
 epoch: 35, train_loss: 0.5673, test_loss: 1.7705, test_f1: 0.5514
 epoch: 36, train_loss: 0.5528, test_loss: 1.8252, test_f1: 0.5009
 epoch: 37, train_loss: 0.5842, test_loss: 1.7675, test_f1: 0.5550
 epoch: 38, train_loss: 0.5116, test_loss: 1.6070, test_f1: 0.5574
 epoch: 39, train_loss: 0.5043, test_loss: 1.7290, test_f1: 0.5379
 epoch: 40, train_loss: 0.4964, test_loss: 1.5958, test_f1: 0.5239
 epoch: 41, train_loss: 0.5162, test_loss: 1.7079, test_f1: 0.5352
 epoch: 42, train_loss: 0.5939, test_loss: 1.7680, test_f1: 0.5424
 epoch: 43, train_loss: 0.5075, test_loss: 1.8692, test_f1: 0.5576
 epoch: 44, train_loss: 0.5556, test_loss: 1.9547, test_f1: 0.5401
 epoch: 45, train_loss: 0.5023, test_loss: 1.6569, test_f1: 0.5750
 epoch: 46, train_loss: 0.5043, test_loss: 1.5998, test_f1: 0.5379
 epoch: 47, train_loss: 0.4984, test_loss: 1.7652, test_f1: 0.5630
 epoch: 48, train_loss: 0.4772, test_loss: 1.6545, test_f1: 0.5696
 epoch: 49, train_loss: 0.4453, test_loss: 1.7302, test_f1: 0.5463
 epoch: 50, train_loss: 0.4435, test_loss: 1.9747, test_f1: 0.5240
 epoch: 51, train_loss: 0.4140, test_loss: 2.0093, test_f1: 0.5323
 epoch: 52, train_loss: 0.4103, test_loss: 2.2488, test_f1: 0.5550
 epoch: 53, train_loss: 0.3956, test_loss: 2.0344, test_f1: 0.5717
 epoch: 54, train_loss: 0.3815, test_loss: 1.9775, test_f1: 0.5345
 epoch: 55, train_loss: 0.3929, test_loss: 1.7879, test_f1: 0.5926
 epoch: 56, train_loss: 0.4023, test_loss: 1.8960, test_f1: 0.5949
 epoch: 57, train_loss: 0.3907, test_loss: 2.1488, test_f1: 0.5844
 epoch: 58, train_loss: 0.3840, test_loss: 2.1067, test_f1: 0.5781
 epoch: 59, train_loss: 0.3847, test_loss: 2.1258, test_f1: 0.5352
 epoch: 60, train_loss: 0.3725, test_loss: 2.1136, test_f1: 0.5222
 epoch: 61, train_loss: 0.3810, test_loss: 2.0602, test_f1: 0.5582
 epoch: 62, train_loss: 0.3648, test_loss: 2.2140, test_f1: 0.5862
 epoch: 63, train_loss: 0.3716, test_loss: 2.0995, test_f1: 0.5663
 epoch: 64, train_loss: 0.3602, test_loss: 2.1224, test_f1: 0.5551
 epoch: 65, train_loss: 0.3461, test_loss: 2.0617, test_f1: 0.5697
 epoch: 66, train_loss: 0.3859, test_loss: 2.1660, test_f1: 0.5496
 epoch: 67, train_loss: 0.3155, test_loss: 2.2048, test_f1: 0.5608
 epoch: 68, train_loss: 0.3406, test_loss: 2.0585, test_f1: 0.5751
 epoch: 69, train_loss: 0.3229, test_loss: 2.0524, test_f1: 0.5902
 epoch: 70, train_loss: 0.3241, test_loss: 2.1477, test_f1: 0.5676
 epoch: 71, train_loss: 0.3242, test_loss: 2.3228, test_f1: 0.5602
 epoch: 72, train_loss: 0.3337, test_loss: 2.3933, test_f1: 0.5488
 epoch: 73, train_loss: 0.3527, test_loss: 2.0350, test_f1: 0.5869
 epoch: 74, train_loss: 0.3259, test_loss: 1.8894, test_f1: 0.6015
 epoch: 75, train_loss: 0.3314, test_loss: 1.9232, test_f1: 0.5900
 epoch: 76, train_loss: 0.3247, test_loss: 2.2328, test_f1: 0.5745
 epoch: 77, train_loss: 0.3409, test_loss: 2.2382, test_f1: 0.5628
 epoch: 78, train_loss: 0.3260, test_loss: 2.3273, test_f1: 0.5853
 epoch: 79, train_loss: 0.3435, test_loss: 2.3893, test_f1: 0.5576
 epoch: 80, train_loss: 0.3259, test_loss: 2.6977, test_f1: 0.5774
 epoch: 81, train_loss: 0.3493, test_loss: 2.4992, test_f1: 0.5858
 epoch: 82, train_loss: 0.3585, test_loss: 1.9280, test_f1: 0.6063
 epoch: 83, train_loss: 0.3003, test_loss: 2.3142, test_f1: 0.5353
 epoch: 84, train_loss: 0.3407, test_loss: 2.2587, test_f1: 0.5468
 epoch: 85, train_loss: 0.2942, test_loss: 2.1543, test_f1: 0.5762
 epoch: 86, train_loss: 0.3230, test_loss: 2.2639, test_f1: 0.5690
 epoch: 87, train_loss: 0.2991, test_loss: 2.3558, test_f1: 0.5859
 epoch: 88, train_loss: 0.3201, test_loss: 2.3371, test_f1: 0.5690
 epoch: 89, train_loss: 0.3161, test_loss: 2.3117, test_f1: 0.5932
 epoch: 90, train_loss: 0.3077, test_loss: 2.1597, test_f1: 0.5813
 epoch: 91, train_loss: 0.3172, test_loss: 2.0995, test_f1: 0.5745
 epoch: 92, train_loss: 0.3324, test_loss: 1.9979, test_f1: 0.5977
 epoch: 93, train_loss: 0.3045, test_loss: 2.2345, test_f1: 0.5997
 epoch: 94, train_loss: 0.2771, test_loss: 2.0675, test_f1: 0.6062
 epoch: 95, train_loss: 0.2703, test_loss: 2.0580, test_f1: 0.5916
 epoch: 96, train_loss: 0.2916, test_loss: 2.1206, test_f1: 0.5790
 epoch: 97, train_loss: 0.2805, test_loss: 2.1952, test_f1: 0.5830
 epoch: 98, train_loss: 0.3062, test_loss: 2.2144, test_f1: 0.6020
 epoch: 99, train_loss: 0.3060, test_loss: 2.3370, test_f1: 0.6085
##################ITERATION #3 ****************************************
 epoch: 0, train_loss: 1.2114, test_loss: 1.2932, test_f1: 0.1420
 epoch: 1, train_loss: 1.0901, test_loss: 1.2729, test_f1: 0.3130
 epoch: 2, train_loss: 1.0394, test_loss: 1.2129, test_f1: 0.4497
 epoch: 3, train_loss: 1.0007, test_loss: 1.1659, test_f1: 0.4151
 epoch: 4, train_loss: 0.9426, test_loss: 1.1986, test_f1: 0.4846
 epoch: 5, train_loss: 0.9280, test_loss: 1.1671, test_f1: 0.5230
 epoch: 6, train_loss: 0.8908, test_loss: 1.1931, test_f1: 0.4891
 epoch: 7, train_loss: 0.8687, test_loss: 1.1035, test_f1: 0.5967
 epoch: 8, train_loss: 0.8673, test_loss: 1.2356, test_f1: 0.5882
 epoch: 9, train_loss: 0.8215, test_loss: 1.2344, test_f1: 0.5115
 epoch: 10, train_loss: 0.8131, test_loss: 1.1106, test_f1: 0.6085
 epoch: 11, train_loss: 0.7817, test_loss: 1.0913, test_f1: 0.5891
 epoch: 12, train_loss: 0.8023, test_loss: 1.2193, test_f1: 0.5486
 epoch: 13, train_loss: 0.7668, test_loss: 1.3349, test_f1: 0.4884
 epoch: 14, train_loss: 0.7594, test_loss: 1.4120, test_f1: 0.4973
 epoch: 15, train_loss: 0.7527, test_loss: 1.1653, test_f1: 0.5271
 epoch: 16, train_loss: 0.7367, test_loss: 1.2208, test_f1: 0.5348
 epoch: 17, train_loss: 0.6947, test_loss: 1.1281, test_f1: 0.5809
 epoch: 18, train_loss: 0.7026, test_loss: 1.2954, test_f1: 0.5582
 epoch: 19, train_loss: 0.7045, test_loss: 1.2882, test_f1: 0.5482
 epoch: 20, train_loss: 0.6750, test_loss: 1.3836, test_f1: 0.5407
 epoch: 21, train_loss: 0.6368, test_loss: 1.4971, test_f1: 0.5387
 epoch: 22, train_loss: 0.6264, test_loss: 1.4738, test_f1: 0.5439
 epoch: 23, train_loss: 0.6344, test_loss: 1.4930, test_f1: 0.5987
 epoch: 24, train_loss: 0.6274, test_loss: 1.2788, test_f1: 0.5939
 epoch: 25, train_loss: 0.6326, test_loss: 1.4951, test_f1: 0.5054
 epoch: 26, train_loss: 0.6226, test_loss: 1.5682, test_f1: 0.4681
 epoch: 27, train_loss: 0.6122, test_loss: 1.2643, test_f1: 0.5916
 epoch: 28, train_loss: 0.6250, test_loss: 1.3132, test_f1: 0.5658
 epoch: 29, train_loss: 0.6140, test_loss: 1.4699, test_f1: 0.5647
 epoch: 30, train_loss: 0.6162, test_loss: 1.8328, test_f1: 0.5054
 epoch: 31, train_loss: 0.6584, test_loss: 1.8321, test_f1: 0.5583
 epoch: 32, train_loss: 0.6418, test_loss: 1.4875, test_f1: 0.4921
 epoch: 33, train_loss: 0.5899, test_loss: 1.6984, test_f1: 0.4076
 epoch: 34, train_loss: 0.5954, test_loss: 1.5204, test_f1: 0.5388
 epoch: 35, train_loss: 0.5806, test_loss: 1.4024, test_f1: 0.5661
 epoch: 36, train_loss: 0.5846, test_loss: 1.5513, test_f1: 0.5055
 epoch: 37, train_loss: 0.5659, test_loss: 1.8426, test_f1: 0.4791
 epoch: 38, train_loss: 0.5710, test_loss: 1.5142, test_f1: 0.5710
 epoch: 39, train_loss: 0.5435, test_loss: 1.5771, test_f1: 0.5904
 epoch: 40, train_loss: 0.5274, test_loss: 1.5812, test_f1: 0.5603
 epoch: 41, train_loss: 0.5328, test_loss: 1.7885, test_f1: 0.5040
 epoch: 42, train_loss: 0.5461, test_loss: 1.5868, test_f1: 0.5404
 epoch: 43, train_loss: 0.5274, test_loss: 1.8458, test_f1: 0.5063
 epoch: 44, train_loss: 0.5302, test_loss: 1.6109, test_f1: 0.5802
 epoch: 45, train_loss: 0.5401, test_loss: 1.4582, test_f1: 0.5851
 epoch: 46, train_loss: 0.5287, test_loss: 1.5440, test_f1: 0.5990
 epoch: 47, train_loss: 0.4986, test_loss: 1.4711, test_f1: 0.5796
 epoch: 48, train_loss: 0.4889, test_loss: 1.5742, test_f1: 0.5709
 epoch: 49, train_loss: 0.4681, test_loss: 1.6082, test_f1: 0.5914
 epoch: 50, train_loss: 0.5049, test_loss: 1.6691, test_f1: 0.5670
 epoch: 51, train_loss: 0.5051, test_loss: 1.6315, test_f1: 0.5865
 epoch: 52, train_loss: 0.4591, test_loss: 1.8804, test_f1: 0.5526
 epoch: 53, train_loss: 0.4352, test_loss: 1.9134, test_f1: 0.5744
 epoch: 54, train_loss: 0.4270, test_loss: 1.7875, test_f1: 0.5631
 epoch: 55, train_loss: 0.4041, test_loss: 1.6716, test_f1: 0.5953
 epoch: 56, train_loss: 0.4224, test_loss: 1.7383, test_f1: 0.5797
 epoch: 57, train_loss: 0.4016, test_loss: 1.8974, test_f1: 0.5367
 epoch: 58, train_loss: 0.4094, test_loss: 2.0991, test_f1: 0.5386
 epoch: 59, train_loss: 0.3795, test_loss: 1.9874, test_f1: 0.5668
 epoch: 60, train_loss: 0.3849, test_loss: 1.8756, test_f1: 0.5721
 epoch: 61, train_loss: 0.3714, test_loss: 1.9453, test_f1: 0.5766
 epoch: 62, train_loss: 0.3639, test_loss: 2.0154, test_f1: 0.5674
 epoch: 63, train_loss: 0.3708, test_loss: 2.1038, test_f1: 0.5598
 epoch: 64, train_loss: 0.3717, test_loss: 2.0604, test_f1: 0.5523
 epoch: 65, train_loss: 0.3545, test_loss: 2.0389, test_f1: 0.5239
 epoch: 66, train_loss: 0.3540, test_loss: 2.0639, test_f1: 0.5195
 epoch: 67, train_loss: 0.3580, test_loss: 1.9838, test_f1: 0.5461
 epoch: 68, train_loss: 0.3387, test_loss: 1.9376, test_f1: 0.5324
 epoch: 69, train_loss: 0.3384, test_loss: 2.0407, test_f1: 0.5179
 epoch: 70, train_loss: 0.3431, test_loss: 2.1707, test_f1: 0.5451
 epoch: 71, train_loss: 0.3566, test_loss: 1.9520, test_f1: 0.5492
 epoch: 72, train_loss: 0.3660, test_loss: 1.9749, test_f1: 0.5080
 epoch: 73, train_loss: 0.3639, test_loss: 2.3063, test_f1: 0.5428
 epoch: 74, train_loss: 0.3536, test_loss: 1.9709, test_f1: 0.5584
 epoch: 75, train_loss: 0.3175, test_loss: 2.0904, test_f1: 0.5728
 epoch: 76, train_loss: 0.3475, test_loss: 2.2111, test_f1: 0.5625
 epoch: 77, train_loss: 0.3205, test_loss: 2.2442, test_f1: 0.5454
 epoch: 78, train_loss: 0.3152, test_loss: 2.0885, test_f1: 0.5306
 epoch: 79, train_loss: 0.3341, test_loss: 2.2064, test_f1: 0.4884
 epoch: 80, train_loss: 0.3391, test_loss: 2.1075, test_f1: 0.5306
 epoch: 81, train_loss: 0.3299, test_loss: 2.0370, test_f1: 0.5517
 epoch: 82, train_loss: 0.2960, test_loss: 2.1184, test_f1: 0.5412
 epoch: 83, train_loss: 0.2911, test_loss: 2.1687, test_f1: 0.5531
 epoch: 84, train_loss: 0.2872, test_loss: 2.1711, test_f1: 0.5591
 epoch: 85, train_loss: 0.3172, test_loss: 2.3102, test_f1: 0.5442
 epoch: 86, train_loss: 0.2896, test_loss: 2.4663, test_f1: 0.5503
 epoch: 87, train_loss: 0.3012, test_loss: 2.2357, test_f1: 0.5901
 epoch: 88, train_loss: 0.3294, test_loss: 2.4659, test_f1: 0.5395
 epoch: 89, train_loss: 0.3520, test_loss: 2.5300, test_f1: 0.5702
 epoch: 90, train_loss: 0.3149, test_loss: 2.0804, test_f1: 0.6257
 epoch: 91, train_loss: 0.3123, test_loss: 2.1278, test_f1: 0.6181
 epoch: 92, train_loss: 0.2929, test_loss: 2.2276, test_f1: 0.5823
 epoch: 93, train_loss: 0.3163, test_loss: 2.0205, test_f1: 0.5747
 epoch: 94, train_loss: 0.2870, test_loss: 1.9318, test_f1: 0.5756
 epoch: 95, train_loss: 0.3009, test_loss: 1.9926, test_f1: 0.5883
 epoch: 96, train_loss: 0.2991, test_loss: 2.0269, test_f1: 0.5821
 epoch: 97, train_loss: 0.3086, test_loss: 1.8822, test_f1: 0.5734
 epoch: 98, train_loss: 0.3098, test_loss: 1.9270, test_f1: 0.5916
 epoch: 99, train_loss: 0.2826, test_loss: 2.2311, test_f1: 0.5701
##################ITERATION #4 ****************************************
 epoch: 0, train_loss: 1.2903, test_loss: 1.4137, test_f1: 0.1365
 epoch: 1, train_loss: 1.1248, test_loss: 1.3511, test_f1: 0.1519
 epoch: 2, train_loss: 1.0666, test_loss: 1.2682, test_f1: 0.2147
 epoch: 3, train_loss: 1.0055, test_loss: 1.3087, test_f1: 0.2232
 epoch: 4, train_loss: 0.9606, test_loss: 1.2708, test_f1: 0.3850
 epoch: 5, train_loss: 0.9401, test_loss: 1.3086, test_f1: 0.3655
 epoch: 6, train_loss: 0.8896, test_loss: 1.2623, test_f1: 0.4764
 epoch: 7, train_loss: 0.8552, test_loss: 1.2450, test_f1: 0.4303
 epoch: 8, train_loss: 0.8929, test_loss: 1.1988, test_f1: 0.5378
 epoch: 9, train_loss: 0.8461, test_loss: 1.2349, test_f1: 0.4596
 epoch: 10, train_loss: 0.8164, test_loss: 1.1790, test_f1: 0.5466
 epoch: 11, train_loss: 0.8088, test_loss: 1.1397, test_f1: 0.5443
 epoch: 12, train_loss: 0.7568, test_loss: 1.1397, test_f1: 0.5650
 epoch: 13, train_loss: 0.7700, test_loss: 1.3765, test_f1: 0.4659
 epoch: 14, train_loss: 0.7464, test_loss: 1.1555, test_f1: 0.5913
 epoch: 15, train_loss: 0.7230, test_loss: 1.1716, test_f1: 0.4976
 epoch: 16, train_loss: 0.6970, test_loss: 1.4843, test_f1: 0.4540
 epoch: 17, train_loss: 0.7050, test_loss: 1.2684, test_f1: 0.5711
 epoch: 18, train_loss: 0.7308, test_loss: 1.2166, test_f1: 0.5628
 epoch: 19, train_loss: 0.7318, test_loss: 1.3990, test_f1: 0.5447
 epoch: 20, train_loss: 0.7626, test_loss: 1.2987, test_f1: 0.5724
 epoch: 21, train_loss: 0.7344, test_loss: 1.2526, test_f1: 0.5521
 epoch: 22, train_loss: 0.7418, test_loss: 1.2223, test_f1: 0.5808
 epoch: 23, train_loss: 0.7317, test_loss: 1.2825, test_f1: 0.5414
 epoch: 24, train_loss: 0.6853, test_loss: 1.2536, test_f1: 0.5876
 epoch: 25, train_loss: 0.6489, test_loss: 1.3915, test_f1: 0.5042
 epoch: 26, train_loss: 0.6438, test_loss: 1.5446, test_f1: 0.5226
 epoch: 27, train_loss: 0.6052, test_loss: 1.5373, test_f1: 0.5397
 epoch: 28, train_loss: 0.5929, test_loss: 1.5717, test_f1: 0.5769
 epoch: 29, train_loss: 0.5967, test_loss: 1.5458, test_f1: 0.5547
 epoch: 30, train_loss: 0.5924, test_loss: 1.4925, test_f1: 0.5681
 epoch: 31, train_loss: 0.5662, test_loss: 1.4228, test_f1: 0.5925
 epoch: 32, train_loss: 0.5714, test_loss: 1.4863, test_f1: 0.5504
 epoch: 33, train_loss: 0.5956, test_loss: 1.6438, test_f1: 0.4914
 epoch: 34, train_loss: 0.6469, test_loss: 1.4690, test_f1: 0.4681
 epoch: 35, train_loss: 0.6684, test_loss: 1.6243, test_f1: 0.5046
 epoch: 36, train_loss: 0.6467, test_loss: 1.5477, test_f1: 0.5215
 epoch: 37, train_loss: 0.6222, test_loss: 1.9326, test_f1: 0.4870
 epoch: 38, train_loss: 0.5936, test_loss: 1.5770, test_f1: 0.5936
 epoch: 39, train_loss: 0.5982, test_loss: 1.6016, test_f1: 0.5848
 epoch: 40, train_loss: 0.5919, test_loss: 1.4607, test_f1: 0.5397
 epoch: 41, train_loss: 0.5604, test_loss: 1.5237, test_f1: 0.5278
 epoch: 42, train_loss: 0.5688, test_loss: 1.3540, test_f1: 0.6370
 epoch: 43, train_loss: 0.5846, test_loss: 1.4449, test_f1: 0.5732
 epoch: 44, train_loss: 0.5689, test_loss: 1.5309, test_f1: 0.5948
 epoch: 45, train_loss: 0.5349, test_loss: 1.5903, test_f1: 0.5257
 epoch: 46, train_loss: 0.5185, test_loss: 1.4665, test_f1: 0.5996
 epoch: 47, train_loss: 0.4924, test_loss: 1.3729, test_f1: 0.6068
 epoch: 48, train_loss: 0.4971, test_loss: 1.4986, test_f1: 0.5551
 epoch: 49, train_loss: 0.4964, test_loss: 1.7175, test_f1: 0.5604
 epoch: 50, train_loss: 0.5064, test_loss: 1.8161, test_f1: 0.5376
 epoch: 51, train_loss: 0.4925, test_loss: 1.9178, test_f1: 0.5447
 epoch: 52, train_loss: 0.4587, test_loss: 1.7076, test_f1: 0.5880
 epoch: 53, train_loss: 0.4439, test_loss: 1.6311, test_f1: 0.5940
 epoch: 54, train_loss: 0.4357, test_loss: 1.6610, test_f1: 0.5805
 epoch: 55, train_loss: 0.4187, test_loss: 1.8065, test_f1: 0.5470
 epoch: 56, train_loss: 0.4394, test_loss: 2.0540, test_f1: 0.5703
 epoch: 57, train_loss: 0.4406, test_loss: 1.8794, test_f1: 0.5881
 epoch: 58, train_loss: 0.4056, test_loss: 2.0934, test_f1: 0.5570
 epoch: 59, train_loss: 0.4185, test_loss: 2.0775, test_f1: 0.5544
 epoch: 60, train_loss: 0.3952, test_loss: 1.8164, test_f1: 0.5651
 epoch: 61, train_loss: 0.3819, test_loss: 1.7431, test_f1: 0.5607
 epoch: 62, train_loss: 0.3856, test_loss: 1.7988, test_f1: 0.5675
 epoch: 63, train_loss: 0.3845, test_loss: 1.7861, test_f1: 0.5711
 epoch: 64, train_loss: 0.3813, test_loss: 1.7928, test_f1: 0.5876
 epoch: 65, train_loss: 0.3946, test_loss: 1.7426, test_f1: 0.5954
 epoch: 66, train_loss: 0.3700, test_loss: 1.8093, test_f1: 0.5649
 epoch: 67, train_loss: 0.3848, test_loss: 1.6190, test_f1: 0.5990
 epoch: 68, train_loss: 0.3871, test_loss: 1.5932, test_f1: 0.5735
 epoch: 69, train_loss: 0.3654, test_loss: 1.7002, test_f1: 0.5752
 epoch: 70, train_loss: 0.3482, test_loss: 1.7587, test_f1: 0.5761
 epoch: 71, train_loss: 0.3785, test_loss: 1.8809, test_f1: 0.5194
 epoch: 72, train_loss: 0.3921, test_loss: 1.8103, test_f1: 0.5337
 epoch: 73, train_loss: 0.3689, test_loss: 1.8462, test_f1: 0.5661
 epoch: 74, train_loss: 0.3676, test_loss: 1.9860, test_f1: 0.5699
 epoch: 75, train_loss: 0.3773, test_loss: 1.8679, test_f1: 0.5717
 epoch: 76, train_loss: 0.3691, test_loss: 1.7946, test_f1: 0.5967
 epoch: 77, train_loss: 0.3677, test_loss: 1.8682, test_f1: 0.5773
 epoch: 78, train_loss: 0.3597, test_loss: 2.1334, test_f1: 0.5267
 epoch: 79, train_loss: 0.3396, test_loss: 2.0934, test_f1: 0.5630
 epoch: 80, train_loss: 0.3446, test_loss: 1.8177, test_f1: 0.5941
 epoch: 81, train_loss: 0.3024, test_loss: 1.7751, test_f1: 0.5923
 epoch: 82, train_loss: 0.3410, test_loss: 1.7446, test_f1: 0.5990
 epoch: 83, train_loss: 0.3335, test_loss: 1.9004, test_f1: 0.6015
 epoch: 84, train_loss: 0.3295, test_loss: 1.9785, test_f1: 0.5765
 epoch: 85, train_loss: 0.3158, test_loss: 1.9821, test_f1: 0.5636
 epoch: 86, train_loss: 0.3187, test_loss: 1.7829, test_f1: 0.5836
 epoch: 87, train_loss: 0.3278, test_loss: 1.8350, test_f1: 0.5740
 epoch: 88, train_loss: 0.3202, test_loss: 2.5540, test_f1: 0.5587
 epoch: 89, train_loss: 0.3105, test_loss: 2.2910, test_f1: 0.5600
 epoch: 90, train_loss: 0.3107, test_loss: 2.1944, test_f1: 0.5611
 epoch: 91, train_loss: 0.3359, test_loss: 2.0232, test_f1: 0.5968
 epoch: 92, train_loss: 0.3314, test_loss: 1.9849, test_f1: 0.6195
 epoch: 93, train_loss: 0.3135, test_loss: 1.9933, test_f1: 0.5943
 epoch: 94, train_loss: 0.3037, test_loss: 2.0597, test_f1: 0.5709
 epoch: 95, train_loss: 0.3249, test_loss: 2.2054, test_f1: 0.5709
 epoch: 96, train_loss: 0.2926, test_loss: 2.2643, test_f1: 0.5368
 epoch: 97, train_loss: 0.3262, test_loss: 2.2068, test_f1: 0.5456
 epoch: 98, train_loss: 0.3052, test_loss: 2.1103, test_f1: 0.5352
 epoch: 99, train_loss: 0.3105, test_loss: 2.1926, test_f1: 0.5527
##################ITERATION #5 ****************************************
 epoch: 0, train_loss: 1.2698, test_loss: 1.3682, test_f1: 0.1836
 epoch: 1, train_loss: 1.1241, test_loss: 1.3339, test_f1: 0.1888
 epoch: 2, train_loss: 1.0597, test_loss: 1.3248, test_f1: 0.2266
 epoch: 3, train_loss: 1.0247, test_loss: 1.2500, test_f1: 0.3519
 epoch: 4, train_loss: 0.9828, test_loss: 1.1997, test_f1: 0.4362
 epoch: 5, train_loss: 0.9440, test_loss: 1.2681, test_f1: 0.3131
 epoch: 6, train_loss: 0.9347, test_loss: 1.2744, test_f1: 0.3910
 epoch: 7, train_loss: 0.9083, test_loss: 1.2932, test_f1: 0.4355
 epoch: 8, train_loss: 0.8821, test_loss: 1.1847, test_f1: 0.4962
 epoch: 9, train_loss: 0.8528, test_loss: 1.2345, test_f1: 0.4943
 epoch: 10, train_loss: 0.8368, test_loss: 1.1380, test_f1: 0.5785
 epoch: 11, train_loss: 0.8244, test_loss: 1.1414, test_f1: 0.5296
 epoch: 12, train_loss: 0.7920, test_loss: 1.2208, test_f1: 0.5107
 epoch: 13, train_loss: 0.8050, test_loss: 1.5075, test_f1: 0.4220
 epoch: 14, train_loss: 0.7924, test_loss: 1.5394, test_f1: 0.4477
 epoch: 15, train_loss: 0.7960, test_loss: 1.3411, test_f1: 0.5700
 epoch: 16, train_loss: 0.7686, test_loss: 1.4065, test_f1: 0.4691
 epoch: 17, train_loss: 0.7602, test_loss: 1.2795, test_f1: 0.5544
 epoch: 18, train_loss: 0.7641, test_loss: 1.3261, test_f1: 0.5308
 epoch: 19, train_loss: 0.7624, test_loss: 1.3079, test_f1: 0.5321
 epoch: 20, train_loss: 0.7372, test_loss: 1.3501, test_f1: 0.5712
 epoch: 21, train_loss: 0.7162, test_loss: 1.4341, test_f1: 0.5499
 epoch: 22, train_loss: 0.6935, test_loss: 1.4870, test_f1: 0.5521
 epoch: 23, train_loss: 0.6786, test_loss: 1.4441, test_f1: 0.5367
 epoch: 24, train_loss: 0.6683, test_loss: 1.3556, test_f1: 0.5764
 epoch: 25, train_loss: 0.6974, test_loss: 1.4361, test_f1: 0.5604
 epoch: 26, train_loss: 0.6696, test_loss: 1.4146, test_f1: 0.5849
 epoch: 27, train_loss: 0.6737, test_loss: 1.4093, test_f1: 0.5489
 epoch: 28, train_loss: 0.6196, test_loss: 1.5111, test_f1: 0.5436
 epoch: 29, train_loss: 0.6193, test_loss: 1.6336, test_f1: 0.5218
 epoch: 30, train_loss: 0.6664, test_loss: 1.2921, test_f1: 0.5941
 epoch: 31, train_loss: 0.6469, test_loss: 1.8201, test_f1: 0.4531
 epoch: 32, train_loss: 0.6283, test_loss: 1.4058, test_f1: 0.5945
 epoch: 33, train_loss: 0.6188, test_loss: 1.6179, test_f1: 0.5444
 epoch: 34, train_loss: 0.6316, test_loss: 1.6382, test_f1: 0.5307
 epoch: 35, train_loss: 0.5902, test_loss: 1.7191, test_f1: 0.5004
 epoch: 36, train_loss: 0.5823, test_loss: 1.5264, test_f1: 0.5470
 epoch: 37, train_loss: 0.5582, test_loss: 1.5024, test_f1: 0.5296
 epoch: 38, train_loss: 0.5421, test_loss: 1.6357, test_f1: 0.5398
 epoch: 39, train_loss: 0.5508, test_loss: 1.8219, test_f1: 0.4999
 epoch: 40, train_loss: 0.5537, test_loss: 1.5231, test_f1: 0.5493
 epoch: 41, train_loss: 0.5591, test_loss: 1.8837, test_f1: 0.4722
 epoch: 42, train_loss: 0.5599, test_loss: 1.7351, test_f1: 0.5152
 epoch: 43, train_loss: 0.5361, test_loss: 1.9667, test_f1: 0.4841
 epoch: 44, train_loss: 0.5175, test_loss: 1.8416, test_f1: 0.4936
 epoch: 45, train_loss: 0.5185, test_loss: 1.6215, test_f1: 0.5382
 epoch: 46, train_loss: 0.5300, test_loss: 1.7832, test_f1: 0.5431
 epoch: 47, train_loss: 0.5574, test_loss: 1.6890, test_f1: 0.5516
 epoch: 48, train_loss: 0.5718, test_loss: 1.7215, test_f1: 0.5234
 epoch: 49, train_loss: 0.5345, test_loss: 1.5800, test_f1: 0.5643
 epoch: 50, train_loss: 0.5022, test_loss: 1.5123, test_f1: 0.5776
 epoch: 51, train_loss: 0.4735, test_loss: 1.6370, test_f1: 0.5787
 epoch: 52, train_loss: 0.4550, test_loss: 1.7463, test_f1: 0.5706
 epoch: 53, train_loss: 0.4535, test_loss: 1.7607, test_f1: 0.5577
 epoch: 54, train_loss: 0.4473, test_loss: 1.8214, test_f1: 0.5609
 epoch: 55, train_loss: 0.4442, test_loss: 2.0233, test_f1: 0.5165
 epoch: 56, train_loss: 0.4221, test_loss: 1.8645, test_f1: 0.5530
 epoch: 57, train_loss: 0.4005, test_loss: 1.9702, test_f1: 0.5274
 epoch: 58, train_loss: 0.3959, test_loss: 1.8248, test_f1: 0.5429
 epoch: 59, train_loss: 0.4351, test_loss: 1.9122, test_f1: 0.4894
 epoch: 60, train_loss: 0.4457, test_loss: 1.8634, test_f1: 0.5174
 epoch: 61, train_loss: 0.4095, test_loss: 1.7071, test_f1: 0.5647
 epoch: 62, train_loss: 0.4032, test_loss: 1.6860, test_f1: 0.5467
 epoch: 63, train_loss: 0.3879, test_loss: 1.9832, test_f1: 0.5511
 epoch: 64, train_loss: 0.3817, test_loss: 1.9889, test_f1: 0.5462
 epoch: 65, train_loss: 0.3504, test_loss: 1.8888, test_f1: 0.5728
 epoch: 66, train_loss: 0.3445, test_loss: 2.1484, test_f1: 0.6081
 epoch: 67, train_loss: 0.3548, test_loss: 2.0028, test_f1: 0.6128
 epoch: 68, train_loss: 0.3712, test_loss: 2.1137, test_f1: 0.6077
 epoch: 69, train_loss: 0.3491, test_loss: 2.2179, test_f1: 0.5921
 epoch: 70, train_loss: 0.3540, test_loss: 2.0714, test_f1: 0.5819
 epoch: 71, train_loss: 0.3236, test_loss: 2.0150, test_f1: 0.5958
 epoch: 72, train_loss: 0.3334, test_loss: 2.2471, test_f1: 0.5496
 epoch: 73, train_loss: 0.3239, test_loss: 2.2507, test_f1: 0.5628
 epoch: 74, train_loss: 0.3410, test_loss: 2.3157, test_f1: 0.5650
 epoch: 75, train_loss: 0.3343, test_loss: 2.1126, test_f1: 0.5986
 epoch: 76, train_loss: 0.3482, test_loss: 2.0405, test_f1: 0.5756
 epoch: 77, train_loss: 0.3321, test_loss: 2.0664, test_f1: 0.5698
 epoch: 78, train_loss: 0.3476, test_loss: 2.0538, test_f1: 0.5307
 epoch: 79, train_loss: 0.3424, test_loss: 2.1706, test_f1: 0.5576
 epoch: 80, train_loss: 0.3638, test_loss: 2.3024, test_f1: 0.5682
 epoch: 81, train_loss: 0.3490, test_loss: 2.3200, test_f1: 0.5721
 epoch: 82, train_loss: 0.3623, test_loss: 2.1803, test_f1: 0.5937
 epoch: 83, train_loss: 0.3531, test_loss: 2.2778, test_f1: 0.5773
 epoch: 84, train_loss: 0.3496, test_loss: 2.1438, test_f1: 0.6183
 epoch: 85, train_loss: 0.3234, test_loss: 2.1150, test_f1: 0.5756
 epoch: 86, train_loss: 0.3350, test_loss: 2.4366, test_f1: 0.5649
 epoch: 87, train_loss: 0.3127, test_loss: 2.7357, test_f1: 0.5476
 epoch: 88, train_loss: 0.3028, test_loss: 2.4155, test_f1: 0.5370
 epoch: 89, train_loss: 0.3385, test_loss: 2.4364, test_f1: 0.5352
 epoch: 90, train_loss: 0.3357, test_loss: 2.4330, test_f1: 0.5563
 epoch: 91, train_loss: 0.3926, test_loss: 2.3876, test_f1: 0.5370
 epoch: 92, train_loss: 0.3536, test_loss: 2.5469, test_f1: 0.5140
 epoch: 93, train_loss: 0.3406, test_loss: 2.4521, test_f1: 0.5398
 epoch: 94, train_loss: 0.3256, test_loss: 2.2841, test_f1: 0.5320
 epoch: 95, train_loss: 0.3308, test_loss: 2.4212, test_f1: 0.5271
 epoch: 96, train_loss: 0.3627, test_loss: 2.3392, test_f1: 0.5348
 epoch: 97, train_loss: 0.3127, test_loss: 2.4169, test_f1: 0.5378
 epoch: 98, train_loss: 0.3115, test_loss: 2.3118, test_f1: 0.5591
 epoch: 99, train_loss: 0.2949, test_loss: 2.5271, test_f1: 0.4954
##################ITERATION #6 ****************************************
 epoch: 0, train_loss: 1.2558, test_loss: 1.3527, test_f1: 0.2171
 epoch: 1, train_loss: 1.1416, test_loss: 1.3291, test_f1: 0.1476
 epoch: 2, train_loss: 1.0790, test_loss: 1.3101, test_f1: 0.3062
 epoch: 3, train_loss: 1.0353, test_loss: 1.2520, test_f1: 0.2998
 epoch: 4, train_loss: 0.9714, test_loss: 1.2566, test_f1: 0.3789
 epoch: 5, train_loss: 0.9575, test_loss: 1.2034, test_f1: 0.5181
 epoch: 6, train_loss: 0.9158, test_loss: 1.1803, test_f1: 0.5203
 epoch: 7, train_loss: 0.8808, test_loss: 1.2404, test_f1: 0.5534
 epoch: 8, train_loss: 0.8604, test_loss: 1.2225, test_f1: 0.4903
 epoch: 9, train_loss: 0.8755, test_loss: 1.3187, test_f1: 0.4207
 epoch: 10, train_loss: 0.8533, test_loss: 1.2589, test_f1: 0.4824
 epoch: 11, train_loss: 0.8372, test_loss: 1.2830, test_f1: 0.5397
 epoch: 12, train_loss: 0.8057, test_loss: 1.1734, test_f1: 0.5384
 epoch: 13, train_loss: 0.7956, test_loss: 1.3964, test_f1: 0.5401
 epoch: 14, train_loss: 0.7606, test_loss: 1.3591, test_f1: 0.5491
 epoch: 15, train_loss: 0.7205, test_loss: 1.4799, test_f1: 0.4853
 epoch: 16, train_loss: 0.7220, test_loss: 1.4580, test_f1: 0.5404
 epoch: 17, train_loss: 0.7192, test_loss: 2.1374, test_f1: 0.4464
 epoch: 18, train_loss: 0.7213, test_loss: 1.7439, test_f1: 0.4760
 epoch: 19, train_loss: 0.6652, test_loss: 1.4849, test_f1: 0.4964
 epoch: 20, train_loss: 0.6741, test_loss: 1.4139, test_f1: 0.5093
 epoch: 21, train_loss: 0.6420, test_loss: 1.6841, test_f1: 0.4602
 epoch: 22, train_loss: 0.6998, test_loss: 1.4213, test_f1: 0.5392
 epoch: 23, train_loss: 0.6930, test_loss: 1.2444, test_f1: 0.5960
 epoch: 24, train_loss: 0.6811, test_loss: 1.5784, test_f1: 0.5595
 epoch: 25, train_loss: 0.6528, test_loss: 1.5563, test_f1: 0.4988
 epoch: 26, train_loss: 0.6803, test_loss: 1.6068, test_f1: 0.5557
 epoch: 27, train_loss: 0.6682, test_loss: 1.5680, test_f1: 0.5589
 epoch: 28, train_loss: 0.6471, test_loss: 1.7720, test_f1: 0.5066
 epoch: 29, train_loss: 0.6514, test_loss: 1.5713, test_f1: 0.5350
 epoch: 30, train_loss: 0.6361, test_loss: 1.6208, test_f1: 0.5276
 epoch: 31, train_loss: 0.6559, test_loss: 1.6594, test_f1: 0.5412
 epoch: 32, train_loss: 0.5997, test_loss: 1.7768, test_f1: 0.5181
 epoch: 33, train_loss: 0.6557, test_loss: 1.6342, test_f1: 0.5193
 epoch: 34, train_loss: 0.6612, test_loss: 1.4065, test_f1: 0.5341
 epoch: 35, train_loss: 0.6110, test_loss: 1.6185, test_f1: 0.5306
 epoch: 36, train_loss: 0.5973, test_loss: 1.4842, test_f1: 0.5293
 epoch: 37, train_loss: 0.6046, test_loss: 1.3156, test_f1: 0.5653
 epoch: 38, train_loss: 0.6179, test_loss: 1.6062, test_f1: 0.5133
 epoch: 39, train_loss: 0.5604, test_loss: 1.4384, test_f1: 0.5465
 epoch: 40, train_loss: 0.5729, test_loss: 1.5401, test_f1: 0.5370
 epoch: 41, train_loss: 0.5631, test_loss: 1.6460, test_f1: 0.5225
 epoch: 42, train_loss: 0.5708, test_loss: 1.4904, test_f1: 0.5648
 epoch: 43, train_loss: 0.5462, test_loss: 1.5840, test_f1: 0.5374
 epoch: 44, train_loss: 0.5413, test_loss: 1.9463, test_f1: 0.5267
 epoch: 45, train_loss: 0.5553, test_loss: 2.0550, test_f1: 0.5391
 epoch: 46, train_loss: 0.5417, test_loss: 1.6856, test_f1: 0.5643
 epoch: 47, train_loss: 0.5357, test_loss: 1.6393, test_f1: 0.5253
 epoch: 48, train_loss: 0.5266, test_loss: 1.6660, test_f1: 0.5356
 epoch: 49, train_loss: 0.5078, test_loss: 1.5308, test_f1: 0.5763
 epoch: 50, train_loss: 0.4880, test_loss: 1.4236, test_f1: 0.5715
 epoch: 51, train_loss: 0.4491, test_loss: 1.5427, test_f1: 0.5458
 epoch: 52, train_loss: 0.4417, test_loss: 1.8680, test_f1: 0.5056
 epoch: 53, train_loss: 0.4248, test_loss: 1.8223, test_f1: 0.5343
 epoch: 54, train_loss: 0.4115, test_loss: 1.7876, test_f1: 0.5379
 epoch: 55, train_loss: 0.4253, test_loss: 1.8930, test_f1: 0.5500
 epoch: 56, train_loss: 0.4151, test_loss: 1.9117, test_f1: 0.5491
 epoch: 57, train_loss: 0.3817, test_loss: 1.7290, test_f1: 0.5661
 epoch: 58, train_loss: 0.4189, test_loss: 1.8119, test_f1: 0.5621
 epoch: 59, train_loss: 0.4064, test_loss: 1.9912, test_f1: 0.5394
 epoch: 60, train_loss: 0.3877, test_loss: 1.6783, test_f1: 0.5495
 epoch: 61, train_loss: 0.4002, test_loss: 1.5334, test_f1: 0.5928
 epoch: 62, train_loss: 0.3634, test_loss: 1.6347, test_f1: 0.5749
 epoch: 63, train_loss: 0.3602, test_loss: 1.7454, test_f1: 0.6034
 epoch: 64, train_loss: 0.3728, test_loss: 1.6274, test_f1: 0.5799
 epoch: 65, train_loss: 0.3425, test_loss: 2.0097, test_f1: 0.5498
 epoch: 66, train_loss: 0.3470, test_loss: 1.9773, test_f1: 0.5606
 epoch: 67, train_loss: 0.3452, test_loss: 2.0588, test_f1: 0.5604
 epoch: 68, train_loss: 0.3523, test_loss: 1.8817, test_f1: 0.5409
 epoch: 69, train_loss: 0.3449, test_loss: 2.0391, test_f1: 0.5504
 epoch: 70, train_loss: 0.3431, test_loss: 2.0050, test_f1: 0.5386
 epoch: 71, train_loss: 0.3514, test_loss: 1.9787, test_f1: 0.5491
 epoch: 72, train_loss: 0.3231, test_loss: 2.0496, test_f1: 0.5522
 epoch: 73, train_loss: 0.3499, test_loss: 1.9225, test_f1: 0.5615
 epoch: 74, train_loss: 0.3367, test_loss: 1.9078, test_f1: 0.5751
 epoch: 75, train_loss: 0.3474, test_loss: 2.3235, test_f1: 0.5265
 epoch: 76, train_loss: 0.3794, test_loss: 2.7983, test_f1: 0.5399
 epoch: 77, train_loss: 0.3497, test_loss: 2.2106, test_f1: 0.5094
 epoch: 78, train_loss: 0.3469, test_loss: 2.0409, test_f1: 0.5324
 epoch: 79, train_loss: 0.3515, test_loss: 2.1036, test_f1: 0.5515
 epoch: 80, train_loss: 0.3489, test_loss: 2.0082, test_f1: 0.5186
 epoch: 81, train_loss: 0.3504, test_loss: 2.0879, test_f1: 0.5085
 epoch: 82, train_loss: 0.3263, test_loss: 2.1583, test_f1: 0.5236
 epoch: 83, train_loss: 0.3542, test_loss: 2.1836, test_f1: 0.5275
 epoch: 84, train_loss: 0.3508, test_loss: 2.1772, test_f1: 0.5495
 epoch: 85, train_loss: 0.3322, test_loss: 2.2631, test_f1: 0.5399
 epoch: 86, train_loss: 0.3419, test_loss: 2.4636, test_f1: 0.5048
 epoch: 87, train_loss: 0.3455, test_loss: 2.1554, test_f1: 0.5051
 epoch: 88, train_loss: 0.3540, test_loss: 2.0153, test_f1: 0.5445
 epoch: 89, train_loss: 0.3396, test_loss: 2.1805, test_f1: 0.5591
 epoch: 90, train_loss: 0.3106, test_loss: 2.3285, test_f1: 0.5699
 epoch: 91, train_loss: 0.3032, test_loss: 2.4115, test_f1: 0.5586
 epoch: 92, train_loss: 0.3234, test_loss: 2.3368, test_f1: 0.5354
 epoch: 93, train_loss: 0.3255, test_loss: 2.2137, test_f1: 0.5231
 epoch: 94, train_loss: 0.3196, test_loss: 2.0551, test_f1: 0.5540
 epoch: 95, train_loss: 0.3081, test_loss: 2.0444, test_f1: 0.5661
 epoch: 96, train_loss: 0.3159, test_loss: 2.3720, test_f1: 0.5135
 epoch: 97, train_loss: 0.3053, test_loss: 2.3108, test_f1: 0.5314
 epoch: 98, train_loss: 0.2803, test_loss: 2.1586, test_f1: 0.5781
 epoch: 99, train_loss: 0.2853, test_loss: 2.2550, test_f1: 0.5898
##################ITERATION #7 ****************************************
 epoch: 0, train_loss: 1.2762, test_loss: 1.3814, test_f1: 0.1604
 epoch: 1, train_loss: 1.1369, test_loss: 1.2941, test_f1: 0.2033
 epoch: 2, train_loss: 1.0574, test_loss: 1.3202, test_f1: 0.3538
 epoch: 3, train_loss: 1.0236, test_loss: 1.2881, test_f1: 0.3014
 epoch: 4, train_loss: 0.9929, test_loss: 1.2749, test_f1: 0.4228
 epoch: 5, train_loss: 0.9406, test_loss: 1.2209, test_f1: 0.4353
 epoch: 6, train_loss: 0.9106, test_loss: 1.1583, test_f1: 0.4425
 epoch: 7, train_loss: 0.8807, test_loss: 1.0925, test_f1: 0.5488
 epoch: 8, train_loss: 0.8638, test_loss: 1.1083, test_f1: 0.5319
 epoch: 9, train_loss: 0.8262, test_loss: 1.1007, test_f1: 0.5640
 epoch: 10, train_loss: 0.8200, test_loss: 1.1159, test_f1: 0.5269
 epoch: 11, train_loss: 0.8094, test_loss: 1.1377, test_f1: 0.5282
 epoch: 12, train_loss: 0.8048, test_loss: 1.1396, test_f1: 0.5673
 epoch: 13, train_loss: 0.7447, test_loss: 1.1179, test_f1: 0.5761
 epoch: 14, train_loss: 0.7363, test_loss: 1.2464, test_f1: 0.5360
 epoch: 15, train_loss: 0.7295, test_loss: 1.1462, test_f1: 0.5619
 epoch: 16, train_loss: 0.7012, test_loss: 1.2200, test_f1: 0.5400
 epoch: 17, train_loss: 0.7068, test_loss: 1.2589, test_f1: 0.5708
 epoch: 18, train_loss: 0.6852, test_loss: 1.3672, test_f1: 0.5251
 epoch: 19, train_loss: 0.6742, test_loss: 1.2366, test_f1: 0.5830
 epoch: 20, train_loss: 0.6669, test_loss: 1.3376, test_f1: 0.5172
 epoch: 21, train_loss: 0.6666, test_loss: 1.3828, test_f1: 0.5448
 epoch: 22, train_loss: 0.6391, test_loss: 1.4874, test_f1: 0.5283
 epoch: 23, train_loss: 0.7014, test_loss: 1.3926, test_f1: 0.5661
 epoch: 24, train_loss: 0.6993, test_loss: 1.4375, test_f1: 0.4984
 epoch: 25, train_loss: 0.7048, test_loss: 1.2417, test_f1: 0.5186
 epoch: 26, train_loss: 0.6783, test_loss: 1.2838, test_f1: 0.5706
 epoch: 27, train_loss: 0.6737, test_loss: 1.3471, test_f1: 0.5587
 epoch: 28, train_loss: 0.6809, test_loss: 1.3207, test_f1: 0.5508
 epoch: 29, train_loss: 0.6577, test_loss: 1.3553, test_f1: 0.5148
 epoch: 30, train_loss: 0.6172, test_loss: 1.3870, test_f1: 0.5559
 epoch: 31, train_loss: 0.6190, test_loss: 1.6234, test_f1: 0.5121
 epoch: 32, train_loss: 0.6452, test_loss: 1.8312, test_f1: 0.4265
 epoch: 33, train_loss: 0.6217, test_loss: 1.5480, test_f1: 0.4886
 epoch: 34, train_loss: 0.5835, test_loss: 1.6065, test_f1: 0.5191
 epoch: 35, train_loss: 0.5642, test_loss: 1.5614, test_f1: 0.5060
 epoch: 36, train_loss: 0.5557, test_loss: 1.5289, test_f1: 0.5439
 epoch: 37, train_loss: 0.5768, test_loss: 1.4689, test_f1: 0.5301
 epoch: 38, train_loss: 0.5359, test_loss: 1.5835, test_f1: 0.5510
 epoch: 39, train_loss: 0.5762, test_loss: 1.6837, test_f1: 0.5403
 epoch: 40, train_loss: 0.6044, test_loss: 1.6589, test_f1: 0.5439
 epoch: 41, train_loss: 0.5891, test_loss: 1.6039, test_f1: 0.5410
 epoch: 42, train_loss: 0.6036, test_loss: 1.6103, test_f1: 0.4999
 epoch: 43, train_loss: 0.6016, test_loss: 1.4670, test_f1: 0.5506
 epoch: 44, train_loss: 0.5810, test_loss: 1.3943, test_f1: 0.5384
 epoch: 45, train_loss: 0.5528, test_loss: 1.4064, test_f1: 0.5624
 epoch: 46, train_loss: 0.5248, test_loss: 1.3833, test_f1: 0.5639
 epoch: 47, train_loss: 0.5197, test_loss: 1.3831, test_f1: 0.5801
 epoch: 48, train_loss: 0.5095, test_loss: 1.5748, test_f1: 0.5514
 epoch: 49, train_loss: 0.4822, test_loss: 1.4931, test_f1: 0.5465
 epoch: 50, train_loss: 0.4827, test_loss: 1.4117, test_f1: 0.5821
 epoch: 51, train_loss: 0.4743, test_loss: 1.4638, test_f1: 0.5936
 epoch: 52, train_loss: 0.4345, test_loss: 1.6221, test_f1: 0.5513
 epoch: 53, train_loss: 0.4227, test_loss: 1.6695, test_f1: 0.5693
 epoch: 54, train_loss: 0.3907, test_loss: 1.7646, test_f1: 0.5752
 epoch: 55, train_loss: 0.3954, test_loss: 1.7385, test_f1: 0.5637
 epoch: 56, train_loss: 0.3834, test_loss: 1.6904, test_f1: 0.5715
 epoch: 57, train_loss: 0.3749, test_loss: 1.7442, test_f1: 0.5714
 epoch: 58, train_loss: 0.3961, test_loss: 1.7721, test_f1: 0.5937
 epoch: 59, train_loss: 0.3926, test_loss: 1.7255, test_f1: 0.6173
 epoch: 60, train_loss: 0.3754, test_loss: 1.7345, test_f1: 0.5803
 epoch: 61, train_loss: 0.3834, test_loss: 1.8140, test_f1: 0.5558
 epoch: 62, train_loss: 0.3908, test_loss: 1.7633, test_f1: 0.5626
 epoch: 63, train_loss: 0.3892, test_loss: 1.7971, test_f1: 0.5642
 epoch: 64, train_loss: 0.3917, test_loss: 1.8412, test_f1: 0.5703
 epoch: 65, train_loss: 0.3640, test_loss: 1.9053, test_f1: 0.5545
 epoch: 66, train_loss: 0.3810, test_loss: 2.0128, test_f1: 0.5088
 epoch: 67, train_loss: 0.3765, test_loss: 1.7729, test_f1: 0.5469
 epoch: 68, train_loss: 0.3913, test_loss: 1.7695, test_f1: 0.5739
 epoch: 69, train_loss: 0.3447, test_loss: 1.7857, test_f1: 0.5647
 epoch: 70, train_loss: 0.3694, test_loss: 2.0684, test_f1: 0.5180
 epoch: 71, train_loss: 0.3664, test_loss: 2.1295, test_f1: 0.5379
 epoch: 72, train_loss: 0.3586, test_loss: 1.9044, test_f1: 0.5579
 epoch: 73, train_loss: 0.3619, test_loss: 1.7885, test_f1: 0.5627
 epoch: 74, train_loss: 0.3561, test_loss: 1.7953, test_f1: 0.5638
 epoch: 75, train_loss: 0.3429, test_loss: 1.8087, test_f1: 0.5430
 epoch: 76, train_loss: 0.3433, test_loss: 1.9471, test_f1: 0.5457
 epoch: 77, train_loss: 0.3350, test_loss: 1.8566, test_f1: 0.5749
 epoch: 78, train_loss: 0.3097, test_loss: 1.9208, test_f1: 0.5833
 epoch: 79, train_loss: 0.3017, test_loss: 1.9968, test_f1: 0.5726
 epoch: 80, train_loss: 0.2924, test_loss: 2.1325, test_f1: 0.5797
 epoch: 81, train_loss: 0.3129, test_loss: 2.3829, test_f1: 0.5396
 epoch: 82, train_loss: 0.3090, test_loss: 2.3300, test_f1: 0.5709
 epoch: 83, train_loss: 0.3466, test_loss: 2.2416, test_f1: 0.5793
 epoch: 84, train_loss: 0.3331, test_loss: 2.0775, test_f1: 0.5664
 epoch: 85, train_loss: 0.3353, test_loss: 1.9999, test_f1: 0.6022
 epoch: 86, train_loss: 0.3141, test_loss: 2.1418, test_f1: 0.5544
 epoch: 87, train_loss: 0.3294, test_loss: 2.2060, test_f1: 0.6001
 epoch: 88, train_loss: 0.3522, test_loss: 2.2425, test_f1: 0.5722
 epoch: 89, train_loss: 0.3117, test_loss: 2.0153, test_f1: 0.6009
 epoch: 90, train_loss: 0.3465, test_loss: 1.9349, test_f1: 0.5500
 epoch: 91, train_loss: 0.3321, test_loss: 2.1048, test_f1: 0.5817
 epoch: 92, train_loss: 0.3573, test_loss: 2.1578, test_f1: 0.5631
 epoch: 93, train_loss: 0.3310, test_loss: 2.2006, test_f1: 0.5525
 epoch: 94, train_loss: 0.3726, test_loss: 2.0727, test_f1: 0.6038
 epoch: 95, train_loss: 0.2953, test_loss: 2.0886, test_f1: 0.5761
 epoch: 96, train_loss: 0.3200, test_loss: 2.1040, test_f1: 0.5605
 epoch: 97, train_loss: 0.3043, test_loss: 2.0685, test_f1: 0.5738
 epoch: 98, train_loss: 0.3091, test_loss: 2.0298, test_f1: 0.6033
 epoch: 99, train_loss: 0.2938, test_loss: 2.1355, test_f1: 0.5880
##################ITERATION #8 ****************************************
 epoch: 0, train_loss: 1.2429, test_loss: 1.3642, test_f1: 0.2014
 epoch: 1, train_loss: 1.1465, test_loss: 1.3237, test_f1: 0.1990
 epoch: 2, train_loss: 1.0668, test_loss: 1.2938, test_f1: 0.3479
 epoch: 3, train_loss: 1.0224, test_loss: 1.2637, test_f1: 0.3504
 epoch: 4, train_loss: 1.0104, test_loss: 1.2738, test_f1: 0.3810
 epoch: 5, train_loss: 0.9730, test_loss: 1.2317, test_f1: 0.3910
 epoch: 6, train_loss: 0.9621, test_loss: 1.1853, test_f1: 0.3786
 epoch: 7, train_loss: 0.9118, test_loss: 1.1886, test_f1: 0.4262
 epoch: 8, train_loss: 0.8858, test_loss: 1.2570, test_f1: 0.4589
 epoch: 9, train_loss: 0.8914, test_loss: 1.1315, test_f1: 0.5505
 epoch: 10, train_loss: 0.8609, test_loss: 1.1826, test_f1: 0.5238
 epoch: 11, train_loss: 0.8459, test_loss: 1.2627, test_f1: 0.4380
 epoch: 12, train_loss: 0.8486, test_loss: 1.2165, test_f1: 0.5150
 epoch: 13, train_loss: 0.8307, test_loss: 1.2589, test_f1: 0.5017
 epoch: 14, train_loss: 0.8132, test_loss: 1.2466, test_f1: 0.4948
 epoch: 15, train_loss: 0.7752, test_loss: 1.3799, test_f1: 0.4943
 epoch: 16, train_loss: 0.7750, test_loss: 1.3144, test_f1: 0.5240
 epoch: 17, train_loss: 0.7575, test_loss: 1.2123, test_f1: 0.5541
 epoch: 18, train_loss: 0.7440, test_loss: 1.2530, test_f1: 0.5638
 epoch: 19, train_loss: 0.7504, test_loss: 1.2631, test_f1: 0.5515
 epoch: 20, train_loss: 0.7161, test_loss: 1.4477, test_f1: 0.4961
 epoch: 21, train_loss: 0.7005, test_loss: 1.5023, test_f1: 0.5755
 epoch: 22, train_loss: 0.6762, test_loss: 1.6829, test_f1: 0.4985
 epoch: 23, train_loss: 0.6710, test_loss: 1.7477, test_f1: 0.5246
 epoch: 24, train_loss: 0.6697, test_loss: 1.5690, test_f1: 0.4815
 epoch: 25, train_loss: 0.6481, test_loss: 1.3546, test_f1: 0.5735
 epoch: 26, train_loss: 0.6483, test_loss: 1.3877, test_f1: 0.5125
 epoch: 27, train_loss: 0.6502, test_loss: 1.3616, test_f1: 0.5292
 epoch: 28, train_loss: 0.6514, test_loss: 1.2470, test_f1: 0.5881
 epoch: 29, train_loss: 0.6770, test_loss: 1.3897, test_f1: 0.5784
 epoch: 30, train_loss: 0.6739, test_loss: 1.7634, test_f1: 0.5158
 epoch: 31, train_loss: 0.6418, test_loss: 1.3475, test_f1: 0.5756
 epoch: 32, train_loss: 0.6388, test_loss: 1.4962, test_f1: 0.6156
 epoch: 33, train_loss: 0.6056, test_loss: 1.6537, test_f1: 0.5165
 epoch: 34, train_loss: 0.6330, test_loss: 1.6090, test_f1: 0.5346
 epoch: 35, train_loss: 0.6205, test_loss: 1.5778, test_f1: 0.5272
 epoch: 36, train_loss: 0.6138, test_loss: 1.5470, test_f1: 0.5302
 epoch: 37, train_loss: 0.6495, test_loss: 1.8205, test_f1: 0.5202
 epoch: 38, train_loss: 0.6085, test_loss: 1.6674, test_f1: 0.5830
 epoch: 39, train_loss: 0.5740, test_loss: 1.9662, test_f1: 0.5438
 epoch: 40, train_loss: 0.5773, test_loss: 1.9529, test_f1: 0.5227
 epoch: 41, train_loss: 0.5866, test_loss: 1.9311, test_f1: 0.5137
 epoch: 42, train_loss: 0.5616, test_loss: 1.7436, test_f1: 0.5366
 epoch: 43, train_loss: 0.5879, test_loss: 1.5800, test_f1: 0.5854
 epoch: 44, train_loss: 0.5494, test_loss: 1.4617, test_f1: 0.5633
 epoch: 45, train_loss: 0.5474, test_loss: 1.5594, test_f1: 0.5980
 epoch: 46, train_loss: 0.5338, test_loss: 1.7285, test_f1: 0.5359
 epoch: 47, train_loss: 0.4970, test_loss: 4.9111, test_f1: 0.4409
 epoch: 48, train_loss: 0.5113, test_loss: 1.9522, test_f1: 0.4736
 epoch: 49, train_loss: 0.4722, test_loss: 1.7897, test_f1: 0.5383
 epoch: 50, train_loss: 0.5264, test_loss: 2.0336, test_f1: 0.5277
 epoch: 51, train_loss: 0.4973, test_loss: 2.4253, test_f1: 0.5072
 epoch: 52, train_loss: 0.4700, test_loss: 2.0830, test_f1: 0.5399
 epoch: 53, train_loss: 0.4705, test_loss: 1.8279, test_f1: 0.5236
 epoch: 54, train_loss: 0.4242, test_loss: 1.9233, test_f1: 0.5411
 epoch: 55, train_loss: 0.4375, test_loss: 1.8759, test_f1: 0.5736
 epoch: 56, train_loss: 0.4307, test_loss: 2.1141, test_f1: 0.5376
 epoch: 57, train_loss: 0.4332, test_loss: 2.3370, test_f1: 0.5021
 epoch: 58, train_loss: 0.4091, test_loss: 2.3455, test_f1: 0.5166
 epoch: 59, train_loss: 0.4023, test_loss: 2.0664, test_f1: 0.5577
 epoch: 60, train_loss: 0.4043, test_loss: 1.9965, test_f1: 0.5820
 epoch: 61, train_loss: 0.3801, test_loss: 2.1437, test_f1: 0.5436
 epoch: 62, train_loss: 0.3997, test_loss: 2.0097, test_f1: 0.5274
 epoch: 63, train_loss: 0.3921, test_loss: 1.9920, test_f1: 0.5326
 epoch: 64, train_loss: 0.3960, test_loss: 2.0178, test_f1: 0.5322
 epoch: 65, train_loss: 0.3851, test_loss: 2.4208, test_f1: 0.5706
 epoch: 66, train_loss: 0.3886, test_loss: 2.5451, test_f1: 0.5367
 epoch: 67, train_loss: 0.3864, test_loss: 2.5388, test_f1: 0.5240
 epoch: 68, train_loss: 0.3496, test_loss: 2.4460, test_f1: 0.5270
 epoch: 69, train_loss: 0.3710, test_loss: 2.4521, test_f1: 0.5390
 epoch: 70, train_loss: 0.3735, test_loss: 2.3440, test_f1: 0.5457
 epoch: 71, train_loss: 0.3491, test_loss: 2.3131, test_f1: 0.5540
 epoch: 72, train_loss: 0.3624, test_loss: 2.0502, test_f1: 0.5989
 epoch: 73, train_loss: 0.3790, test_loss: 2.0279, test_f1: 0.5752
 epoch: 74, train_loss: 0.3633, test_loss: 2.3107, test_f1: 0.4755
 epoch: 75, train_loss: 0.3582, test_loss: 2.1510, test_f1: 0.5152
 epoch: 76, train_loss: 0.3634, test_loss: 2.2123, test_f1: 0.5594
 epoch: 77, train_loss: 0.3553, test_loss: 2.2321, test_f1: 0.5537
 epoch: 78, train_loss: 0.3483, test_loss: 2.3987, test_f1: 0.5461
 epoch: 79, train_loss: 0.3328, test_loss: 2.7907, test_f1: 0.5218
 epoch: 80, train_loss: 0.3333, test_loss: 2.5492, test_f1: 0.5401
 epoch: 81, train_loss: 0.3450, test_loss: 2.3720, test_f1: 0.5319
 epoch: 82, train_loss: 0.3883, test_loss: 2.3372, test_f1: 0.5970
 epoch: 83, train_loss: 0.3700, test_loss: 2.4865, test_f1: 0.5923
 epoch: 84, train_loss: 0.3731, test_loss: 2.2801, test_f1: 0.5698
 epoch: 85, train_loss: 0.3492, test_loss: 2.4274, test_f1: 0.5528
 epoch: 86, train_loss: 0.3314, test_loss: 2.3287, test_f1: 0.5496
 epoch: 87, train_loss: 0.3428, test_loss: 2.3673, test_f1: 0.5345
 epoch: 88, train_loss: 0.3569, test_loss: 2.2465, test_f1: 0.5880
 epoch: 89, train_loss: 0.3666, test_loss: 2.5552, test_f1: 0.5312
 epoch: 90, train_loss: 0.3627, test_loss: 2.2002, test_f1: 0.5791
 epoch: 91, train_loss: 0.4207, test_loss: 2.1014, test_f1: 0.5612
 epoch: 92, train_loss: 0.3899, test_loss: 2.1534, test_f1: 0.5326
 epoch: 93, train_loss: 0.3995, test_loss: 2.3504, test_f1: 0.5434
 epoch: 94, train_loss: 0.3665, test_loss: 2.4409, test_f1: 0.5737
 epoch: 95, train_loss: 0.3523, test_loss: 2.7199, test_f1: 0.5191
 epoch: 96, train_loss: 0.3338, test_loss: 2.3159, test_f1: 0.5592
 epoch: 97, train_loss: 0.3227, test_loss: 2.4039, test_f1: 0.5642
 epoch: 98, train_loss: 0.3190, test_loss: 2.3107, test_f1: 0.5889
 epoch: 99, train_loss: 0.3118, test_loss: 2.2455, test_f1: 0.6020
##################ITERATION #9 ****************************************
 epoch: 0, train_loss: 1.2866, test_loss: 1.3841, test_f1: 0.2110
 epoch: 1, train_loss: 1.0980, test_loss: 1.3760, test_f1: 0.1420
 epoch: 2, train_loss: 1.0435, test_loss: 1.3176, test_f1: 0.2409
 epoch: 3, train_loss: 0.9898, test_loss: 1.2710, test_f1: 0.4410
 epoch: 4, train_loss: 0.9236, test_loss: 1.1997, test_f1: 0.3960
 epoch: 5, train_loss: 0.8950, test_loss: 1.2322, test_f1: 0.4221
 epoch: 6, train_loss: 0.8954, test_loss: 1.1852, test_f1: 0.5157
 epoch: 7, train_loss: 0.8459, test_loss: 1.1322, test_f1: 0.5747
 epoch: 8, train_loss: 0.8535, test_loss: 1.1571, test_f1: 0.6089
 epoch: 9, train_loss: 0.8305, test_loss: 1.1742, test_f1: 0.5779
 epoch: 10, train_loss: 0.8070, test_loss: 1.1885, test_f1: 0.5711
 epoch: 11, train_loss: 0.7918, test_loss: 1.2358, test_f1: 0.5108
 epoch: 12, train_loss: 0.7687, test_loss: 1.1335, test_f1: 0.5856
 epoch: 13, train_loss: 0.7377, test_loss: 1.1437, test_f1: 0.5908
 epoch: 14, train_loss: 0.7469, test_loss: 1.3659, test_f1: 0.5028
 epoch: 15, train_loss: 0.7632, test_loss: 1.4336, test_f1: 0.5296
 epoch: 16, train_loss: 0.7450, test_loss: 2.1348, test_f1: 0.5561
 epoch: 17, train_loss: 0.7312, test_loss: 1.1505, test_f1: 0.6075
 epoch: 18, train_loss: 0.7481, test_loss: 1.2366, test_f1: 0.5681
 epoch: 19, train_loss: 0.7199, test_loss: 1.2941, test_f1: 0.5706
 epoch: 20, train_loss: 0.7008, test_loss: 1.4223, test_f1: 0.5320
 epoch: 21, train_loss: 0.7007, test_loss: 1.5100, test_f1: 0.5204
 epoch: 22, train_loss: 0.6847, test_loss: 1.3709, test_f1: 0.4709
 epoch: 23, train_loss: 0.6726, test_loss: 1.4340, test_f1: 0.5099
 epoch: 24, train_loss: 0.6626, test_loss: 1.3011, test_f1: 0.5765
 epoch: 25, train_loss: 0.6596, test_loss: 1.3427, test_f1: 0.5696
 epoch: 26, train_loss: 0.6503, test_loss: 1.1899, test_f1: 0.5673
 epoch: 27, train_loss: 0.6424, test_loss: 1.1227, test_f1: 0.5942
 epoch: 28, train_loss: 0.6378, test_loss: 1.4056, test_f1: 0.5652
 epoch: 29, train_loss: 0.6439, test_loss: 2.1271, test_f1: 0.5522
 epoch: 30, train_loss: 0.6012, test_loss: 1.6500, test_f1: 0.5641
 epoch: 31, train_loss: 0.5846, test_loss: 1.5899, test_f1: 0.5772
 epoch: 32, train_loss: 0.5971, test_loss: 1.3694, test_f1: 0.5915
 epoch: 33, train_loss: 0.5494, test_loss: 1.5395, test_f1: 0.5672
 epoch: 34, train_loss: 0.5605, test_loss: 1.9324, test_f1: 0.5033
 epoch: 35, train_loss: 0.5767, test_loss: 1.8565, test_f1: 0.5393
 epoch: 36, train_loss: 0.5852, test_loss: 1.4593, test_f1: 0.5495
 epoch: 37, train_loss: 0.5398, test_loss: 1.5199, test_f1: 0.5631
 epoch: 38, train_loss: 0.5168, test_loss: 1.5884, test_f1: 0.5737
 epoch: 39, train_loss: 0.5122, test_loss: 1.7759, test_f1: 0.5676
 epoch: 40, train_loss: 0.5183, test_loss: 1.8766, test_f1: 0.5721
 epoch: 41, train_loss: 0.5051, test_loss: 1.9427, test_f1: 0.5499
 epoch: 42, train_loss: 0.4968, test_loss: 1.8270, test_f1: 0.5675
 epoch: 43, train_loss: 0.4930, test_loss: 1.9009, test_f1: 0.5688
 epoch: 44, train_loss: 0.4687, test_loss: 1.8960, test_f1: 0.5886
 epoch: 45, train_loss: 0.4955, test_loss: 1.6873, test_f1: 0.5570
 epoch: 46, train_loss: 0.5369, test_loss: 2.2318, test_f1: 0.4622
 epoch: 47, train_loss: 0.4722, test_loss: 1.7471, test_f1: 0.5072
 epoch: 48, train_loss: 0.5176, test_loss: 2.0052, test_f1: 0.5333
 epoch: 49, train_loss: 0.5068, test_loss: 2.1549, test_f1: 0.6037
 epoch: 50, train_loss: 0.5135, test_loss: 2.0988, test_f1: 0.5716
 epoch: 51, train_loss: 0.4856, test_loss: 1.9527, test_f1: 0.5756
 epoch: 52, train_loss: 0.4695, test_loss: 1.8230, test_f1: 0.5878
 epoch: 53, train_loss: 0.4396, test_loss: 1.8370, test_f1: 0.5727
 epoch: 54, train_loss: 0.4394, test_loss: 1.8194, test_f1: 0.5943
 epoch: 55, train_loss: 0.4336, test_loss: 1.8889, test_f1: 0.5589
 epoch: 56, train_loss: 0.4245, test_loss: 1.8723, test_f1: 0.5889
 epoch: 57, train_loss: 0.3834, test_loss: 2.0528, test_f1: 0.5645
 epoch: 58, train_loss: 0.3797, test_loss: 2.1502, test_f1: 0.5710
 epoch: 59, train_loss: 0.3754, test_loss: 2.2539, test_f1: 0.5534
 epoch: 60, train_loss: 0.4032, test_loss: 2.3233, test_f1: 0.5642
 epoch: 61, train_loss: 0.4239, test_loss: 1.9954, test_f1: 0.5891
 epoch: 62, train_loss: 0.4246, test_loss: 1.8223, test_f1: 0.5545
 epoch: 63, train_loss: 0.3973, test_loss: 1.9742, test_f1: 0.5214
 epoch: 64, train_loss: 0.3951, test_loss: 1.7379, test_f1: 0.5880
 epoch: 65, train_loss: 0.3694, test_loss: 1.7198, test_f1: 0.5844
 epoch: 66, train_loss: 0.3689, test_loss: 1.7951, test_f1: 0.5658
 epoch: 67, train_loss: 0.3520, test_loss: 1.8932, test_f1: 0.5519
 epoch: 68, train_loss: 0.3667, test_loss: 2.0177, test_f1: 0.5639
 epoch: 69, train_loss: 0.3357, test_loss: 2.1424, test_f1: 0.5564
 epoch: 70, train_loss: 0.3816, test_loss: 2.2629, test_f1: 0.5697
 epoch: 71, train_loss: 0.3957, test_loss: 2.4253, test_f1: 0.5618
 epoch: 72, train_loss: 0.4007, test_loss: 2.1422, test_f1: 0.5338
 epoch: 73, train_loss: 0.3616, test_loss: 2.0651, test_f1: 0.5863
 epoch: 74, train_loss: 0.3523, test_loss: 1.8894, test_f1: 0.5941
 epoch: 75, train_loss: 0.3367, test_loss: 1.7935, test_f1: 0.6123
 epoch: 76, train_loss: 0.3252, test_loss: 1.8290, test_f1: 0.6227
 epoch: 77, train_loss: 0.3356, test_loss: 2.0466, test_f1: 0.5797
 epoch: 78, train_loss: 0.3330, test_loss: 2.2896, test_f1: 0.6074
 epoch: 79, train_loss: 0.3352, test_loss: 2.5272, test_f1: 0.5829
 epoch: 80, train_loss: 0.3424, test_loss: 2.4554, test_f1: 0.5660
 epoch: 81, train_loss: 0.3253, test_loss: 2.3225, test_f1: 0.5819
 epoch: 82, train_loss: 0.3131, test_loss: 2.2293, test_f1: 0.6012
 epoch: 83, train_loss: 0.3235, test_loss: 2.2660, test_f1: 0.6033
 epoch: 84, train_loss: 0.3224, test_loss: 2.3462, test_f1: 0.5893
 epoch: 85, train_loss: 0.2959, test_loss: 2.4041, test_f1: 0.5665
 epoch: 86, train_loss: 0.2817, test_loss: 2.3918, test_f1: 0.5916
 epoch: 87, train_loss: 0.2985, test_loss: 2.3712, test_f1: 0.5998
 epoch: 88, train_loss: 0.3337, test_loss: 2.4880, test_f1: 0.6073
 epoch: 89, train_loss: 0.3244, test_loss: 2.2596, test_f1: 0.5662
 epoch: 90, train_loss: 0.3311, test_loss: 2.1977, test_f1: 0.5373
 epoch: 91, train_loss: 0.3254, test_loss: 2.5210, test_f1: 0.5511
 epoch: 92, train_loss: 0.2955, test_loss: 2.2943, test_f1: 0.5835
 epoch: 93, train_loss: 0.3225, test_loss: 2.1939, test_f1: 0.5946
 epoch: 94, train_loss: 0.2856, test_loss: 2.3272, test_f1: 0.5794
 epoch: 95, train_loss: 0.2817, test_loss: 2.3219, test_f1: 0.5755
 epoch: 96, train_loss: 0.2737, test_loss: 2.3050, test_f1: 0.5920
 epoch: 97, train_loss: 0.2708, test_loss: 2.3277, test_f1: 0.5728
 epoch: 98, train_loss: 0.2899, test_loss: 2.3267, test_f1: 0.5887
 epoch: 99, train_loss: 0.3141, test_loss: 2.0498, test_f1: 0.6048

Training completed in 309.22 seconds
Best F1: 0.6370 at epoch 42
Mean F1 across iterations: 0.6128  0.0158
========================FINAL RESULTS================================
FEGIN weighted F1: 0.6370  0.0158
python main.py --data ltspice_demos --representation component_component --model FEGIN --layers 5 --hiddens 128 --batch_size 256 --lr 0.001 --emb_size 512 --epochs 100 --save_appendix component_component_L5_H128_BS256_LR0.001_E512 --no_val
-----



STDERR:
  File "main.py", line 370, in <module>
    main()
  File "main.py", line 254, in main
    dataset = dataset_class(
  File "/home/philip/projects/ltspice_examples_code_repo/Circuit-Completion-Using-GNNs/component_classification_with_link_prediction_head/evaluation/FEGIN/kernel/circuit_datasets.py", line 15, in __init__
    self.data, self.slices = torch.load(self.processed_paths[0])
  File "/home/philip/.local/lib/python3.8/site-packages/torch/serialization.py", line 1040, in load
    warnings.warn(
  File "/usr/lib/python3.8/warnings.py", line 109, in _showwarnmsg
    sw(msg.message, msg.category, msg.filename, msg.lineno,
  File "main.py", line 47, in warn_with_traceback
    traceback.print_stack(file=log)
/home/philip/projects/ltspice_examples_code_repo/Circuit-Completion-Using-GNNs/component_classification_with_link_prediction_head/evaluation/FEGIN/kernel/circuit_datasets.py:15: FutureWarning: You are using `torch.load` with `weights_only=False` (the current default value), which uses the default pickle module implicitly. It is possible to construct malicious pickle data which will execute arbitrary code during unpickling (See https://github.com/pytorch/pytorch/blob/main/SECURITY.md#untrusted-models for more details). In a future release, the default value for `weights_only` will be flipped to `True`. This limits the functions that could be executed during unpickling. Arbitrary objects will no longer be allowed to be loaded via this mode unless they are explicitly allowlisted by the user via `torch.serialization.add_safe_globals`. We recommend you start setting `weights_only=True` for any use case where you don't have full control of the loaded file. Please open an issue on GitHub for any issues related to this experimental feature.
  self.data, self.slices = torch.load(self.processed_paths[0])
