STDOUT:
Results will be saved in /home/philip/projects/ltspice_examples_code_repo/Circuit-Completion-Using-GNNs/component_classification_with_link_prediction_head/evaluation/FEGIN/results/model_FEGIN_dataset_ltspice_examples
Command line input: python main.py --data ltspice_examples --representation component_net --model FEGIN --layers 4 --hiddens 32 --batch_size 256 --lr 0.0001 --emb_size 512 --epochs 100 --save_appendix component_net_L4_H32_BS256_LR0.0001_E512 --no_val
 is saved.
-----
ltspice_examples - FEGIN
Using 4 layers, 32 hidden units, h = 2
Loading component_net representation dataset
ENTERED
Training FEGIN on component_net representation
Train: 3558, Test: 846
##################ITERATION #0 ****************************************
 epoch: 0, train_loss: 1.3614, test_loss: 1.3607, test_f1: 0.2270
 epoch: 1, train_loss: 1.3572, test_loss: 1.3602, test_f1: 0.2270
 epoch: 2, train_loss: 1.3550, test_loss: 1.3598, test_f1: 0.2270
 epoch: 3, train_loss: 1.3517, test_loss: 1.3572, test_f1: 0.2270
 epoch: 4, train_loss: 1.3491, test_loss: 1.3531, test_f1: 0.2270
 epoch: 5, train_loss: 1.3461, test_loss: 1.3482, test_f1: 0.2270
 epoch: 6, train_loss: 1.3441, test_loss: 1.3439, test_f1: 0.2270
 epoch: 7, train_loss: 1.3394, test_loss: 1.3402, test_f1: 0.2270
 epoch: 8, train_loss: 1.3359, test_loss: 1.3361, test_f1: 0.2270
 epoch: 9, train_loss: 1.3330, test_loss: 1.3313, test_f1: 0.2270
 epoch: 10, train_loss: 1.3286, test_loss: 1.3276, test_f1: 0.2270
 epoch: 11, train_loss: 1.3254, test_loss: 1.3244, test_f1: 0.2270
 epoch: 12, train_loss: 1.3213, test_loss: 1.3201, test_f1: 0.2270
 epoch: 13, train_loss: 1.3176, test_loss: 1.3158, test_f1: 0.2270
 epoch: 14, train_loss: 1.3138, test_loss: 1.3116, test_f1: 0.2320
 epoch: 15, train_loss: 1.3090, test_loss: 1.3078, test_f1: 0.2320
 epoch: 16, train_loss: 1.3059, test_loss: 1.3045, test_f1: 0.2368
 epoch: 17, train_loss: 1.3003, test_loss: 1.3008, test_f1: 0.2416
 epoch: 18, train_loss: 1.2972, test_loss: 1.2960, test_f1: 0.2461
 epoch: 19, train_loss: 1.2938, test_loss: 1.2915, test_f1: 0.2506
 epoch: 20, train_loss: 1.2892, test_loss: 1.2879, test_f1: 0.2591
 epoch: 21, train_loss: 1.2830, test_loss: 1.2842, test_f1: 0.2611
 epoch: 22, train_loss: 1.2813, test_loss: 1.2807, test_f1: 0.2631
 epoch: 23, train_loss: 1.2763, test_loss: 1.2763, test_f1: 0.2709
 epoch: 24, train_loss: 1.2715, test_loss: 1.2709, test_f1: 0.2824
 epoch: 25, train_loss: 1.2671, test_loss: 1.2668, test_f1: 0.2867
 epoch: 26, train_loss: 1.2611, test_loss: 1.2621, test_f1: 0.2892
 epoch: 27, train_loss: 1.2590, test_loss: 1.2575, test_f1: 0.2980
 epoch: 28, train_loss: 1.2543, test_loss: 1.2535, test_f1: 0.2988
 epoch: 29, train_loss: 1.2466, test_loss: 1.2477, test_f1: 0.3137
 epoch: 30, train_loss: 1.2434, test_loss: 1.2412, test_f1: 0.3226
 epoch: 31, train_loss: 1.2376, test_loss: 1.2357, test_f1: 0.3280
 epoch: 32, train_loss: 1.2320, test_loss: 1.2309, test_f1: 0.3340
 epoch: 33, train_loss: 1.2286, test_loss: 1.2249, test_f1: 0.3445
 epoch: 34, train_loss: 1.2226, test_loss: 1.2180, test_f1: 0.3499
 epoch: 35, train_loss: 1.2177, test_loss: 1.2111, test_f1: 0.3615
 epoch: 36, train_loss: 1.2153, test_loss: 1.2035, test_f1: 0.3668
 epoch: 37, train_loss: 1.2052, test_loss: 1.1971, test_f1: 0.3744
 epoch: 38, train_loss: 1.1995, test_loss: 1.1898, test_f1: 0.3782
 epoch: 39, train_loss: 1.1944, test_loss: 1.1818, test_f1: 0.3815
 epoch: 40, train_loss: 1.1881, test_loss: 1.1743, test_f1: 0.3912
 epoch: 41, train_loss: 1.1793, test_loss: 1.1673, test_f1: 0.3925
 epoch: 42, train_loss: 1.1729, test_loss: 1.1596, test_f1: 0.3956
 epoch: 43, train_loss: 1.1627, test_loss: 1.1521, test_f1: 0.4011
 epoch: 44, train_loss: 1.1562, test_loss: 1.1447, test_f1: 0.4063
 epoch: 45, train_loss: 1.1488, test_loss: 1.1363, test_f1: 0.4157
 epoch: 46, train_loss: 1.1477, test_loss: 1.1293, test_f1: 0.4214
 epoch: 47, train_loss: 1.1353, test_loss: 1.1183, test_f1: 0.4264
 epoch: 48, train_loss: 1.1279, test_loss: 1.1127, test_f1: 0.4292
 epoch: 49, train_loss: 1.1250, test_loss: 1.1052, test_f1: 0.4307
 epoch: 50, train_loss: 1.1180, test_loss: 1.0969, test_f1: 0.4343
 epoch: 51, train_loss: 1.1172, test_loss: 1.0933, test_f1: 0.4331
 epoch: 52, train_loss: 1.1115, test_loss: 1.0900, test_f1: 0.4352
 epoch: 53, train_loss: 1.1052, test_loss: 1.0848, test_f1: 0.4395
 epoch: 54, train_loss: 1.1013, test_loss: 1.0813, test_f1: 0.4388
 epoch: 55, train_loss: 1.1029, test_loss: 1.0775, test_f1: 0.4630
 epoch: 56, train_loss: 1.0967, test_loss: 1.0739, test_f1: 0.4482
 epoch: 57, train_loss: 1.0919, test_loss: 1.0701, test_f1: 0.4551
 epoch: 58, train_loss: 1.0861, test_loss: 1.0682, test_f1: 0.4710
 epoch: 59, train_loss: 1.0846, test_loss: 1.0635, test_f1: 0.4676
 epoch: 60, train_loss: 1.0801, test_loss: 1.0606, test_f1: 0.4623
 epoch: 61, train_loss: 1.0803, test_loss: 1.0566, test_f1: 0.4848
 epoch: 62, train_loss: 1.0738, test_loss: 1.0529, test_f1: 0.4779
 epoch: 63, train_loss: 1.0745, test_loss: 1.0494, test_f1: 0.4859
 epoch: 64, train_loss: 1.0721, test_loss: 1.0447, test_f1: 0.4872
 epoch: 65, train_loss: 1.0618, test_loss: 1.0425, test_f1: 0.4881
 epoch: 66, train_loss: 1.0563, test_loss: 1.0379, test_f1: 0.4878
 epoch: 67, train_loss: 1.0616, test_loss: 1.0354, test_f1: 0.4909
 epoch: 68, train_loss: 1.0611, test_loss: 1.0339, test_f1: 0.4911
 epoch: 69, train_loss: 1.0554, test_loss: 1.0290, test_f1: 0.4937
 epoch: 70, train_loss: 1.0551, test_loss: 1.0287, test_f1: 0.4914
 epoch: 71, train_loss: 1.0524, test_loss: 1.0247, test_f1: 0.4917
 epoch: 72, train_loss: 1.0515, test_loss: 1.0203, test_f1: 0.4951
 epoch: 73, train_loss: 1.0405, test_loss: 1.0169, test_f1: 0.4911
 epoch: 74, train_loss: 1.0392, test_loss: 1.0143, test_f1: 0.4976
 epoch: 75, train_loss: 1.0382, test_loss: 1.0123, test_f1: 0.4972
 epoch: 76, train_loss: 1.0375, test_loss: 1.0086, test_f1: 0.5092
 epoch: 77, train_loss: 1.0324, test_loss: 1.0050, test_f1: 0.5082
 epoch: 78, train_loss: 1.0277, test_loss: 1.0029, test_f1: 0.5012
 epoch: 79, train_loss: 1.0226, test_loss: 0.9999, test_f1: 0.5103
 epoch: 80, train_loss: 1.0230, test_loss: 0.9990, test_f1: 0.5159
 epoch: 81, train_loss: 1.0263, test_loss: 0.9969, test_f1: 0.5139
 epoch: 82, train_loss: 1.0197, test_loss: 0.9929, test_f1: 0.5124
 epoch: 83, train_loss: 1.0163, test_loss: 0.9898, test_f1: 0.5145
 epoch: 84, train_loss: 1.0116, test_loss: 0.9868, test_f1: 0.5134
 epoch: 85, train_loss: 1.0138, test_loss: 0.9838, test_f1: 0.5095
 epoch: 86, train_loss: 1.0034, test_loss: 0.9804, test_f1: 0.5191
 epoch: 87, train_loss: 1.0090, test_loss: 0.9779, test_f1: 0.5117
 epoch: 88, train_loss: 1.0038, test_loss: 0.9752, test_f1: 0.5096
 epoch: 89, train_loss: 1.0063, test_loss: 0.9744, test_f1: 0.5065
 epoch: 90, train_loss: 0.9966, test_loss: 0.9728, test_f1: 0.5067
 epoch: 91, train_loss: 0.9967, test_loss: 0.9717, test_f1: 0.5076
 epoch: 92, train_loss: 0.9961, test_loss: 0.9709, test_f1: 0.5041
 epoch: 93, train_loss: 0.9920, test_loss: 0.9665, test_f1: 0.5166
 epoch: 94, train_loss: 0.9943, test_loss: 0.9651, test_f1: 0.5132
 epoch: 95, train_loss: 0.9850, test_loss: 0.9642, test_f1: 0.5126
 epoch: 96, train_loss: 0.9869, test_loss: 0.9608, test_f1: 0.5132
 epoch: 97, train_loss: 0.9764, test_loss: 0.9603, test_f1: 0.5093
 epoch: 98, train_loss: 0.9821, test_loss: 0.9567, test_f1: 0.5184
 epoch: 99, train_loss: 0.9785, test_loss: 0.9567, test_f1: 0.5138
##################ITERATION #1 ****************************************
 epoch: 0, train_loss: 1.3273, test_loss: 1.3359, test_f1: 0.2270
 epoch: 1, train_loss: 1.3199, test_loss: 1.3310, test_f1: 0.2270
 epoch: 2, train_loss: 1.3162, test_loss: 1.3251, test_f1: 0.2270
 epoch: 3, train_loss: 1.3113, test_loss: 1.3184, test_f1: 0.2270
 epoch: 4, train_loss: 1.3066, test_loss: 1.3133, test_f1: 0.2270
 epoch: 5, train_loss: 1.3007, test_loss: 1.3070, test_f1: 0.2270
 epoch: 6, train_loss: 1.2968, test_loss: 1.3012, test_f1: 0.2270
 epoch: 7, train_loss: 1.2911, test_loss: 1.2953, test_f1: 0.2270
 epoch: 8, train_loss: 1.2838, test_loss: 1.2894, test_f1: 0.2270
 epoch: 9, train_loss: 1.2802, test_loss: 1.2832, test_f1: 0.2270
 epoch: 10, train_loss: 1.2756, test_loss: 1.2775, test_f1: 0.2270
 epoch: 11, train_loss: 1.2676, test_loss: 1.2715, test_f1: 0.2270
 epoch: 12, train_loss: 1.2652, test_loss: 1.2655, test_f1: 0.2270
 epoch: 13, train_loss: 1.2598, test_loss: 1.2593, test_f1: 0.2270
 epoch: 14, train_loss: 1.2534, test_loss: 1.2533, test_f1: 0.2270
 epoch: 15, train_loss: 1.2494, test_loss: 1.2473, test_f1: 0.2270
 epoch: 16, train_loss: 1.2417, test_loss: 1.2413, test_f1: 0.2295
 epoch: 17, train_loss: 1.2370, test_loss: 1.2349, test_f1: 0.2506
 epoch: 18, train_loss: 1.2346, test_loss: 1.2288, test_f1: 0.2611
 epoch: 19, train_loss: 1.2269, test_loss: 1.2237, test_f1: 0.2728
 epoch: 20, train_loss: 1.2261, test_loss: 1.2186, test_f1: 0.2765
 epoch: 21, train_loss: 1.2207, test_loss: 1.2130, test_f1: 0.2801
 epoch: 22, train_loss: 1.2162, test_loss: 1.2077, test_f1: 0.2844
 epoch: 23, train_loss: 1.2117, test_loss: 1.2030, test_f1: 0.2996
 epoch: 24, train_loss: 1.2022, test_loss: 1.1958, test_f1: 0.3294
 epoch: 25, train_loss: 1.1982, test_loss: 1.1905, test_f1: 0.3420
 epoch: 26, train_loss: 1.1956, test_loss: 1.1847, test_f1: 0.3513
 epoch: 27, train_loss: 1.1926, test_loss: 1.1795, test_f1: 0.3714
 epoch: 28, train_loss: 1.1859, test_loss: 1.1734, test_f1: 0.3941
 epoch: 29, train_loss: 1.1830, test_loss: 1.1668, test_f1: 0.3955
 epoch: 30, train_loss: 1.1726, test_loss: 1.1611, test_f1: 0.4022
 epoch: 31, train_loss: 1.1673, test_loss: 1.1548, test_f1: 0.4079
 epoch: 32, train_loss: 1.1640, test_loss: 1.1488, test_f1: 0.4138
 epoch: 33, train_loss: 1.1623, test_loss: 1.1411, test_f1: 0.4275
 epoch: 34, train_loss: 1.1573, test_loss: 1.1342, test_f1: 0.4302
 epoch: 35, train_loss: 1.1424, test_loss: 1.1271, test_f1: 0.4465
 epoch: 36, train_loss: 1.1402, test_loss: 1.1209, test_f1: 0.4517
 epoch: 37, train_loss: 1.1378, test_loss: 1.1128, test_f1: 0.4581
 epoch: 38, train_loss: 1.1267, test_loss: 1.1047, test_f1: 0.4651
 epoch: 39, train_loss: 1.1209, test_loss: 1.0998, test_f1: 0.4680
 epoch: 40, train_loss: 1.1134, test_loss: 1.0917, test_f1: 0.4679
 epoch: 41, train_loss: 1.1164, test_loss: 1.0895, test_f1: 0.4631
 epoch: 42, train_loss: 1.1046, test_loss: 1.0780, test_f1: 0.4755
 epoch: 43, train_loss: 1.0966, test_loss: 1.0720, test_f1: 0.4750
 epoch: 44, train_loss: 1.0918, test_loss: 1.0677, test_f1: 0.4759
 epoch: 45, train_loss: 1.0847, test_loss: 1.0608, test_f1: 0.4850
 epoch: 46, train_loss: 1.0800, test_loss: 1.0543, test_f1: 0.4766
 epoch: 47, train_loss: 1.0713, test_loss: 1.0518, test_f1: 0.4880
 epoch: 48, train_loss: 1.0686, test_loss: 1.0411, test_f1: 0.4868
 epoch: 49, train_loss: 1.0611, test_loss: 1.0405, test_f1: 0.4810
 epoch: 50, train_loss: 1.0557, test_loss: 1.0318, test_f1: 0.4913
 epoch: 51, train_loss: 1.0489, test_loss: 1.0269, test_f1: 0.4864
 epoch: 52, train_loss: 1.0440, test_loss: 1.0257, test_f1: 0.4809
 epoch: 53, train_loss: 1.0400, test_loss: 1.0253, test_f1: 0.4783
 epoch: 54, train_loss: 1.0416, test_loss: 1.0202, test_f1: 0.4850
 epoch: 55, train_loss: 1.0330, test_loss: 1.0191, test_f1: 0.4790
 epoch: 56, train_loss: 1.0359, test_loss: 1.0167, test_f1: 0.4803
 epoch: 57, train_loss: 1.0343, test_loss: 1.0175, test_f1: 0.4834
 epoch: 58, train_loss: 1.0268, test_loss: 1.0120, test_f1: 0.4835
 epoch: 59, train_loss: 1.0254, test_loss: 1.0097, test_f1: 0.4856
 epoch: 60, train_loss: 1.0151, test_loss: 1.0103, test_f1: 0.4816
 epoch: 61, train_loss: 1.0166, test_loss: 1.0041, test_f1: 0.4843
 epoch: 62, train_loss: 1.0192, test_loss: 1.0043, test_f1: 0.4793
 epoch: 63, train_loss: 1.0053, test_loss: 1.0045, test_f1: 0.4839
 epoch: 64, train_loss: 1.0120, test_loss: 0.9996, test_f1: 0.4827
 epoch: 65, train_loss: 1.0020, test_loss: 0.9945, test_f1: 0.4850
 epoch: 66, train_loss: 1.0031, test_loss: 0.9947, test_f1: 0.4847
 epoch: 67, train_loss: 1.0043, test_loss: 0.9918, test_f1: 0.4875
 epoch: 68, train_loss: 1.0044, test_loss: 0.9939, test_f1: 0.4871
 epoch: 69, train_loss: 1.0004, test_loss: 0.9939, test_f1: 0.4864
 epoch: 70, train_loss: 0.9971, test_loss: 0.9913, test_f1: 0.4857
 epoch: 71, train_loss: 0.9937, test_loss: 0.9866, test_f1: 0.4872
 epoch: 72, train_loss: 0.9911, test_loss: 0.9912, test_f1: 0.4846
 epoch: 73, train_loss: 0.9827, test_loss: 0.9844, test_f1: 0.4900
 epoch: 74, train_loss: 0.9807, test_loss: 0.9864, test_f1: 0.4929
 epoch: 75, train_loss: 0.9893, test_loss: 0.9892, test_f1: 0.4887
 epoch: 76, train_loss: 0.9797, test_loss: 0.9857, test_f1: 0.4887
 epoch: 77, train_loss: 0.9817, test_loss: 0.9794, test_f1: 0.4910
 epoch: 78, train_loss: 0.9859, test_loss: 0.9819, test_f1: 0.4853
 epoch: 79, train_loss: 0.9745, test_loss: 0.9736, test_f1: 0.4853
 epoch: 80, train_loss: 0.9789, test_loss: 0.9723, test_f1: 0.4870
 epoch: 81, train_loss: 0.9725, test_loss: 0.9780, test_f1: 0.4923
 epoch: 82, train_loss: 0.9715, test_loss: 0.9715, test_f1: 0.4907
 epoch: 83, train_loss: 0.9604, test_loss: 0.9707, test_f1: 0.4871
 epoch: 84, train_loss: 0.9704, test_loss: 0.9701, test_f1: 0.4875
 epoch: 85, train_loss: 0.9691, test_loss: 0.9775, test_f1: 0.4853
 epoch: 86, train_loss: 0.9638, test_loss: 0.9730, test_f1: 0.4887
 epoch: 87, train_loss: 0.9675, test_loss: 0.9681, test_f1: 0.4895
 epoch: 88, train_loss: 0.9599, test_loss: 0.9615, test_f1: 0.4921
 epoch: 89, train_loss: 0.9602, test_loss: 0.9673, test_f1: 0.4901
 epoch: 90, train_loss: 0.9536, test_loss: 0.9664, test_f1: 0.4847
 epoch: 91, train_loss: 0.9570, test_loss: 0.9630, test_f1: 0.4835
 epoch: 92, train_loss: 0.9462, test_loss: 0.9754, test_f1: 0.4891
 epoch: 93, train_loss: 0.9543, test_loss: 0.9684, test_f1: 0.4923
 epoch: 94, train_loss: 0.9483, test_loss: 0.9645, test_f1: 0.4884
 epoch: 95, train_loss: 0.9429, test_loss: 0.9592, test_f1: 0.4886
 epoch: 96, train_loss: 0.9465, test_loss: 0.9588, test_f1: 0.4964
 epoch: 97, train_loss: 0.9480, test_loss: 0.9582, test_f1: 0.4880
 epoch: 98, train_loss: 0.9417, test_loss: 0.9556, test_f1: 0.4852
 epoch: 99, train_loss: 0.9409, test_loss: 0.9571, test_f1: 0.4880
##################ITERATION #2 ****************************************
 epoch: 0, train_loss: 1.3189, test_loss: 1.3267, test_f1: 0.2270
 epoch: 1, train_loss: 1.3082, test_loss: 1.3248, test_f1: 0.2270
 epoch: 2, train_loss: 1.2990, test_loss: 1.3158, test_f1: 0.2270
 epoch: 3, train_loss: 1.2875, test_loss: 1.3040, test_f1: 0.2270
 epoch: 4, train_loss: 1.2839, test_loss: 1.2929, test_f1: 0.2270
 epoch: 5, train_loss: 1.2772, test_loss: 1.2813, test_f1: 0.2788
 epoch: 6, train_loss: 1.2704, test_loss: 1.2609, test_f1: 0.3130
 epoch: 7, train_loss: 1.2607, test_loss: 1.2452, test_f1: 0.3192
 epoch: 8, train_loss: 1.2560, test_loss: 1.2352, test_f1: 0.3247
 epoch: 9, train_loss: 1.2476, test_loss: 1.2281, test_f1: 0.3267
 epoch: 10, train_loss: 1.2397, test_loss: 1.2206, test_f1: 0.3327
 epoch: 11, train_loss: 1.2371, test_loss: 1.2136, test_f1: 0.3359
 epoch: 12, train_loss: 1.2307, test_loss: 1.2072, test_f1: 0.3370
 epoch: 13, train_loss: 1.2242, test_loss: 1.2010, test_f1: 0.3441
 epoch: 14, train_loss: 1.2182, test_loss: 1.1946, test_f1: 0.3531
 epoch: 15, train_loss: 1.2181, test_loss: 1.1890, test_f1: 0.3567
 epoch: 16, train_loss: 1.2081, test_loss: 1.1846, test_f1: 0.3559
 epoch: 17, train_loss: 1.2037, test_loss: 1.1787, test_f1: 0.3550
 epoch: 18, train_loss: 1.1950, test_loss: 1.1743, test_f1: 0.3716
 epoch: 19, train_loss: 1.1973, test_loss: 1.1694, test_f1: 0.3691
 epoch: 20, train_loss: 1.1870, test_loss: 1.1633, test_f1: 0.3682
 epoch: 21, train_loss: 1.1822, test_loss: 1.1566, test_f1: 0.3765
 epoch: 22, train_loss: 1.1825, test_loss: 1.1537, test_f1: 0.3696
 epoch: 23, train_loss: 1.1725, test_loss: 1.1488, test_f1: 0.3822
 epoch: 24, train_loss: 1.1714, test_loss: 1.1435, test_f1: 0.3901
 epoch: 25, train_loss: 1.1625, test_loss: 1.1383, test_f1: 0.3952
 epoch: 26, train_loss: 1.1603, test_loss: 1.1330, test_f1: 0.3983
 epoch: 27, train_loss: 1.1559, test_loss: 1.1286, test_f1: 0.4059
 epoch: 28, train_loss: 1.1502, test_loss: 1.1235, test_f1: 0.4117
 epoch: 29, train_loss: 1.1521, test_loss: 1.1199, test_f1: 0.4125
 epoch: 30, train_loss: 1.1399, test_loss: 1.1141, test_f1: 0.4158
 epoch: 31, train_loss: 1.1383, test_loss: 1.1096, test_f1: 0.4193
 epoch: 32, train_loss: 1.1276, test_loss: 1.1039, test_f1: 0.4277
 epoch: 33, train_loss: 1.1223, test_loss: 1.0987, test_f1: 0.4317
 epoch: 34, train_loss: 1.1209, test_loss: 1.0957, test_f1: 0.4363
 epoch: 35, train_loss: 1.1192, test_loss: 1.0898, test_f1: 0.4470
 epoch: 36, train_loss: 1.1196, test_loss: 1.0856, test_f1: 0.4471
 epoch: 37, train_loss: 1.1120, test_loss: 1.0806, test_f1: 0.4525
 epoch: 38, train_loss: 1.1066, test_loss: 1.0759, test_f1: 0.4588
 epoch: 39, train_loss: 1.1020, test_loss: 1.0746, test_f1: 0.4530
 epoch: 40, train_loss: 1.0948, test_loss: 1.0673, test_f1: 0.4652
 epoch: 41, train_loss: 1.0876, test_loss: 1.0612, test_f1: 0.4717
 epoch: 42, train_loss: 1.0805, test_loss: 1.0548, test_f1: 0.4763
 epoch: 43, train_loss: 1.0761, test_loss: 1.0518, test_f1: 0.4713
 epoch: 44, train_loss: 1.0767, test_loss: 1.0469, test_f1: 0.4811
 epoch: 45, train_loss: 1.0710, test_loss: 1.0411, test_f1: 0.4878
 epoch: 46, train_loss: 1.0637, test_loss: 1.0394, test_f1: 0.4825
 epoch: 47, train_loss: 1.0645, test_loss: 1.0376, test_f1: 0.4775
 epoch: 48, train_loss: 1.0544, test_loss: 1.0321, test_f1: 0.4818
 epoch: 49, train_loss: 1.0503, test_loss: 1.0279, test_f1: 0.4850
 epoch: 50, train_loss: 1.0511, test_loss: 1.0259, test_f1: 0.4762
 epoch: 51, train_loss: 1.0408, test_loss: 1.0243, test_f1: 0.4819
 epoch: 52, train_loss: 1.0439, test_loss: 1.0214, test_f1: 0.4803
 epoch: 53, train_loss: 1.0417, test_loss: 1.0188, test_f1: 0.4832
 epoch: 54, train_loss: 1.0381, test_loss: 1.0164, test_f1: 0.4835
 epoch: 55, train_loss: 1.0394, test_loss: 1.0152, test_f1: 0.4830
 epoch: 56, train_loss: 1.0332, test_loss: 1.0134, test_f1: 0.4802
 epoch: 57, train_loss: 1.0266, test_loss: 1.0121, test_f1: 0.4795
 epoch: 58, train_loss: 1.0309, test_loss: 1.0118, test_f1: 0.4834
 epoch: 59, train_loss: 1.0274, test_loss: 1.0107, test_f1: 0.4821
 epoch: 60, train_loss: 1.0239, test_loss: 1.0079, test_f1: 0.4788
 epoch: 61, train_loss: 1.0220, test_loss: 1.0048, test_f1: 0.4838
 epoch: 62, train_loss: 1.0214, test_loss: 1.0047, test_f1: 0.4868
 epoch: 63, train_loss: 1.0232, test_loss: 1.0027, test_f1: 0.4867
 epoch: 64, train_loss: 1.0169, test_loss: 1.0018, test_f1: 0.4853
 epoch: 65, train_loss: 1.0137, test_loss: 1.0000, test_f1: 0.4845
 epoch: 66, train_loss: 1.0138, test_loss: 0.9979, test_f1: 0.4887
 epoch: 67, train_loss: 1.0103, test_loss: 0.9979, test_f1: 0.4885
 epoch: 68, train_loss: 1.0094, test_loss: 0.9955, test_f1: 0.4914
 epoch: 69, train_loss: 1.0115, test_loss: 0.9934, test_f1: 0.4910
 epoch: 70, train_loss: 1.0056, test_loss: 0.9928, test_f1: 0.4952
 epoch: 71, train_loss: 0.9976, test_loss: 0.9909, test_f1: 0.4964
 epoch: 72, train_loss: 1.0043, test_loss: 0.9889, test_f1: 0.4962
 epoch: 73, train_loss: 0.9989, test_loss: 0.9874, test_f1: 0.4919
 epoch: 74, train_loss: 0.9985, test_loss: 0.9873, test_f1: 0.4917
 epoch: 75, train_loss: 0.9992, test_loss: 0.9853, test_f1: 0.4927
 epoch: 76, train_loss: 0.9953, test_loss: 0.9832, test_f1: 0.4939
 epoch: 77, train_loss: 0.9957, test_loss: 0.9839, test_f1: 0.4905
 epoch: 78, train_loss: 0.9930, test_loss: 0.9824, test_f1: 0.4909
 epoch: 79, train_loss: 1.0002, test_loss: 0.9810, test_f1: 0.4954
 epoch: 80, train_loss: 0.9876, test_loss: 0.9806, test_f1: 0.4969
 epoch: 81, train_loss: 0.9901, test_loss: 0.9806, test_f1: 0.4915
 epoch: 82, train_loss: 0.9868, test_loss: 0.9783, test_f1: 0.4881
 epoch: 83, train_loss: 0.9818, test_loss: 0.9798, test_f1: 0.4887
 epoch: 84, train_loss: 0.9869, test_loss: 0.9780, test_f1: 0.4917
 epoch: 85, train_loss: 0.9729, test_loss: 0.9767, test_f1: 0.4906
 epoch: 86, train_loss: 0.9840, test_loss: 0.9763, test_f1: 0.4917
 epoch: 87, train_loss: 0.9794, test_loss: 0.9748, test_f1: 0.4886
 epoch: 88, train_loss: 0.9812, test_loss: 0.9730, test_f1: 0.4945
 epoch: 89, train_loss: 0.9767, test_loss: 0.9727, test_f1: 0.4925
 epoch: 90, train_loss: 0.9726, test_loss: 0.9720, test_f1: 0.4909
 epoch: 91, train_loss: 0.9724, test_loss: 0.9717, test_f1: 0.4835
 epoch: 92, train_loss: 0.9720, test_loss: 0.9707, test_f1: 0.4845
 epoch: 93, train_loss: 0.9718, test_loss: 0.9702, test_f1: 0.4920
 epoch: 94, train_loss: 0.9708, test_loss: 0.9680, test_f1: 0.4874
 epoch: 95, train_loss: 0.9695, test_loss: 0.9670, test_f1: 0.4833
 epoch: 96, train_loss: 0.9737, test_loss: 0.9662, test_f1: 0.4809
 epoch: 97, train_loss: 0.9633, test_loss: 0.9660, test_f1: 0.4797
 epoch: 98, train_loss: 0.9641, test_loss: 0.9628, test_f1: 0.4881
 epoch: 99, train_loss: 0.9592, test_loss: 0.9635, test_f1: 0.4846
##################ITERATION #3 ****************************************
 epoch: 0, train_loss: 1.3125, test_loss: 1.3198, test_f1: 0.2270
 epoch: 1, train_loss: 1.2943, test_loss: 1.3192, test_f1: 0.2270
 epoch: 2, train_loss: 1.2856, test_loss: 1.3097, test_f1: 0.2270
 epoch: 3, train_loss: 1.2769, test_loss: 1.2917, test_f1: 0.2270
 epoch: 4, train_loss: 1.2665, test_loss: 1.2731, test_f1: 0.2270
 epoch: 5, train_loss: 1.2597, test_loss: 1.2533, test_f1: 0.2295
 epoch: 6, train_loss: 1.2510, test_loss: 1.2393, test_f1: 0.2347
 epoch: 7, train_loss: 1.2418, test_loss: 1.2289, test_f1: 0.2700
 epoch: 8, train_loss: 1.2364, test_loss: 1.2213, test_f1: 0.2788
 epoch: 9, train_loss: 1.2286, test_loss: 1.2135, test_f1: 0.2960
 epoch: 10, train_loss: 1.2210, test_loss: 1.2063, test_f1: 0.3155
 epoch: 11, train_loss: 1.2131, test_loss: 1.1980, test_f1: 0.3350
 epoch: 12, train_loss: 1.2069, test_loss: 1.1914, test_f1: 0.3645
 epoch: 13, train_loss: 1.2022, test_loss: 1.1814, test_f1: 0.3734
 epoch: 14, train_loss: 1.1910, test_loss: 1.1736, test_f1: 0.3913
 epoch: 15, train_loss: 1.1841, test_loss: 1.1668, test_f1: 0.4079
 epoch: 16, train_loss: 1.1759, test_loss: 1.1573, test_f1: 0.4159
 epoch: 17, train_loss: 1.1673, test_loss: 1.1502, test_f1: 0.4189
 epoch: 18, train_loss: 1.1635, test_loss: 1.1419, test_f1: 0.4239
 epoch: 19, train_loss: 1.1607, test_loss: 1.1338, test_f1: 0.4269
 epoch: 20, train_loss: 1.1512, test_loss: 1.1264, test_f1: 0.4369
 epoch: 21, train_loss: 1.1437, test_loss: 1.1189, test_f1: 0.4393
 epoch: 22, train_loss: 1.1325, test_loss: 1.1114, test_f1: 0.4420
 epoch: 23, train_loss: 1.1286, test_loss: 1.1037, test_f1: 0.4442
 epoch: 24, train_loss: 1.1184, test_loss: 1.0948, test_f1: 0.4473
 epoch: 25, train_loss: 1.1146, test_loss: 1.0866, test_f1: 0.4444
 epoch: 26, train_loss: 1.1081, test_loss: 1.0802, test_f1: 0.4465
 epoch: 27, train_loss: 1.1010, test_loss: 1.0729, test_f1: 0.4476
 epoch: 28, train_loss: 1.0968, test_loss: 1.0671, test_f1: 0.4385
 epoch: 29, train_loss: 1.0877, test_loss: 1.0615, test_f1: 0.4413
 epoch: 30, train_loss: 1.0826, test_loss: 1.0569, test_f1: 0.4380
 epoch: 31, train_loss: 1.0743, test_loss: 1.0499, test_f1: 0.4470
 epoch: 32, train_loss: 1.0689, test_loss: 1.0470, test_f1: 0.4470
 epoch: 33, train_loss: 1.0672, test_loss: 1.0420, test_f1: 0.4503
 epoch: 34, train_loss: 1.0581, test_loss: 1.0386, test_f1: 0.4523
 epoch: 35, train_loss: 1.0531, test_loss: 1.0279, test_f1: 0.4619
 epoch: 36, train_loss: 1.0432, test_loss: 1.0259, test_f1: 0.4603
 epoch: 37, train_loss: 1.0405, test_loss: 1.0217, test_f1: 0.4601
 epoch: 38, train_loss: 1.0257, test_loss: 1.0136, test_f1: 0.4651
 epoch: 39, train_loss: 1.0259, test_loss: 1.0094, test_f1: 0.4647
 epoch: 40, train_loss: 1.0221, test_loss: 1.0099, test_f1: 0.4619
 epoch: 41, train_loss: 1.0110, test_loss: 1.0069, test_f1: 0.4611
 epoch: 42, train_loss: 1.0149, test_loss: 1.0008, test_f1: 0.4630
 epoch: 43, train_loss: 1.0129, test_loss: 1.0011, test_f1: 0.4679
 epoch: 44, train_loss: 0.9966, test_loss: 1.0008, test_f1: 0.4706
 epoch: 45, train_loss: 1.0003, test_loss: 0.9940, test_f1: 0.4703
 epoch: 46, train_loss: 0.9926, test_loss: 0.9919, test_f1: 0.4681
 epoch: 47, train_loss: 0.9921, test_loss: 0.9861, test_f1: 0.4689
 epoch: 48, train_loss: 0.9920, test_loss: 0.9851, test_f1: 0.4718
 epoch: 49, train_loss: 0.9812, test_loss: 0.9857, test_f1: 0.4679
 epoch: 50, train_loss: 0.9791, test_loss: 0.9841, test_f1: 0.4701
 epoch: 51, train_loss: 0.9780, test_loss: 0.9835, test_f1: 0.4718
 epoch: 52, train_loss: 0.9737, test_loss: 0.9851, test_f1: 0.4715
 epoch: 53, train_loss: 0.9715, test_loss: 0.9806, test_f1: 0.4744
 epoch: 54, train_loss: 0.9647, test_loss: 0.9817, test_f1: 0.4775
 epoch: 55, train_loss: 0.9616, test_loss: 0.9783, test_f1: 0.4767
 epoch: 56, train_loss: 0.9734, test_loss: 0.9790, test_f1: 0.4807
 epoch: 57, train_loss: 0.9637, test_loss: 0.9792, test_f1: 0.4736
 epoch: 58, train_loss: 0.9667, test_loss: 0.9763, test_f1: 0.4772
 epoch: 59, train_loss: 0.9618, test_loss: 0.9731, test_f1: 0.4764
 epoch: 60, train_loss: 0.9613, test_loss: 0.9717, test_f1: 0.4786
 epoch: 61, train_loss: 0.9616, test_loss: 0.9693, test_f1: 0.4804
 epoch: 62, train_loss: 0.9607, test_loss: 0.9636, test_f1: 0.4773
 epoch: 63, train_loss: 0.9539, test_loss: 0.9680, test_f1: 0.4805
 epoch: 64, train_loss: 0.9510, test_loss: 0.9695, test_f1: 0.4829
 epoch: 65, train_loss: 0.9503, test_loss: 0.9684, test_f1: 0.4817
 epoch: 66, train_loss: 0.9499, test_loss: 0.9675, test_f1: 0.4784
 epoch: 67, train_loss: 0.9467, test_loss: 0.9609, test_f1: 0.4855
 epoch: 68, train_loss: 0.9533, test_loss: 0.9642, test_f1: 0.4811
 epoch: 69, train_loss: 0.9412, test_loss: 0.9675, test_f1: 0.4865
 epoch: 70, train_loss: 0.9444, test_loss: 0.9643, test_f1: 0.4858
 epoch: 71, train_loss: 0.9355, test_loss: 0.9615, test_f1: 0.4865
 epoch: 72, train_loss: 0.9427, test_loss: 0.9679, test_f1: 0.4846
 epoch: 73, train_loss: 0.9429, test_loss: 0.9645, test_f1: 0.4845
 epoch: 74, train_loss: 0.9421, test_loss: 0.9689, test_f1: 0.4867
 epoch: 75, train_loss: 0.9442, test_loss: 0.9644, test_f1: 0.4872
 epoch: 76, train_loss: 0.9379, test_loss: 0.9662, test_f1: 0.4895
 epoch: 77, train_loss: 0.9325, test_loss: 0.9633, test_f1: 0.4919
 epoch: 78, train_loss: 0.9351, test_loss: 0.9615, test_f1: 0.4902
 epoch: 79, train_loss: 0.9333, test_loss: 0.9598, test_f1: 0.4909
 epoch: 80, train_loss: 0.9297, test_loss: 0.9607, test_f1: 0.4910
 epoch: 81, train_loss: 0.9341, test_loss: 0.9611, test_f1: 0.4974
 epoch: 82, train_loss: 0.9265, test_loss: 0.9548, test_f1: 0.5042
 epoch: 83, train_loss: 0.9307, test_loss: 0.9598, test_f1: 0.5042
 epoch: 84, train_loss: 0.9239, test_loss: 0.9615, test_f1: 0.5057
 epoch: 85, train_loss: 0.9191, test_loss: 0.9628, test_f1: 0.5109
 epoch: 86, train_loss: 0.9157, test_loss: 0.9576, test_f1: 0.5097
 epoch: 87, train_loss: 0.9146, test_loss: 0.9543, test_f1: 0.5109
 epoch: 88, train_loss: 0.9227, test_loss: 0.9525, test_f1: 0.5087
 epoch: 89, train_loss: 0.9113, test_loss: 0.9518, test_f1: 0.5097
 epoch: 90, train_loss: 0.9142, test_loss: 0.9534, test_f1: 0.5087
 epoch: 91, train_loss: 0.9267, test_loss: 0.9583, test_f1: 0.5108
 epoch: 92, train_loss: 0.9163, test_loss: 0.9615, test_f1: 0.5120
 epoch: 93, train_loss: 0.9140, test_loss: 0.9600, test_f1: 0.5117
 epoch: 94, train_loss: 0.9141, test_loss: 0.9598, test_f1: 0.5120
 epoch: 95, train_loss: 0.9166, test_loss: 0.9605, test_f1: 0.5120
 epoch: 96, train_loss: 0.9048, test_loss: 0.9580, test_f1: 0.5131
 epoch: 97, train_loss: 0.9084, test_loss: 0.9538, test_f1: 0.5099
 epoch: 98, train_loss: 0.9043, test_loss: 0.9521, test_f1: 0.5151
 epoch: 99, train_loss: 0.9075, test_loss: 0.9528, test_f1: 0.5119
##################ITERATION #4 ****************************************
 epoch: 0, train_loss: 1.3045, test_loss: 1.3169, test_f1: 0.2270
 epoch: 1, train_loss: 1.2789, test_loss: 1.3074, test_f1: 0.2270
 epoch: 2, train_loss: 1.2656, test_loss: 1.2900, test_f1: 0.2270
 epoch: 3, train_loss: 1.2580, test_loss: 1.2659, test_f1: 0.2270
 epoch: 4, train_loss: 1.2477, test_loss: 1.2437, test_f1: 0.2350
 epoch: 5, train_loss: 1.2416, test_loss: 1.2221, test_f1: 0.2648
 epoch: 6, train_loss: 1.2371, test_loss: 1.2068, test_f1: 0.2963
 epoch: 7, train_loss: 1.2269, test_loss: 1.1965, test_f1: 0.3044
 epoch: 8, train_loss: 1.2214, test_loss: 1.1879, test_f1: 0.3084
 epoch: 9, train_loss: 1.2158, test_loss: 1.1794, test_f1: 0.3125
 epoch: 10, train_loss: 1.2098, test_loss: 1.1716, test_f1: 0.3296
 epoch: 11, train_loss: 1.2060, test_loss: 1.1629, test_f1: 0.3316
 epoch: 12, train_loss: 1.1937, test_loss: 1.1574, test_f1: 0.3470
 epoch: 13, train_loss: 1.1917, test_loss: 1.1502, test_f1: 0.3711
 epoch: 14, train_loss: 1.1859, test_loss: 1.1422, test_f1: 0.3918
 epoch: 15, train_loss: 1.1715, test_loss: 1.1348, test_f1: 0.3923
 epoch: 16, train_loss: 1.1607, test_loss: 1.1300, test_f1: 0.4066
 epoch: 17, train_loss: 1.1597, test_loss: 1.1222, test_f1: 0.4128
 epoch: 18, train_loss: 1.1565, test_loss: 1.1135, test_f1: 0.4083
 epoch: 19, train_loss: 1.1429, test_loss: 1.1064, test_f1: 0.4152
 epoch: 20, train_loss: 1.1419, test_loss: 1.0991, test_f1: 0.4177
 epoch: 21, train_loss: 1.1354, test_loss: 1.0912, test_f1: 0.4190
 epoch: 22, train_loss: 1.1260, test_loss: 1.0861, test_f1: 0.4346
 epoch: 23, train_loss: 1.1199, test_loss: 1.0775, test_f1: 0.4382
 epoch: 24, train_loss: 1.1153, test_loss: 1.0700, test_f1: 0.4513
 epoch: 25, train_loss: 1.1119, test_loss: 1.0653, test_f1: 0.4498
 epoch: 26, train_loss: 1.0959, test_loss: 1.0583, test_f1: 0.4441
 epoch: 27, train_loss: 1.0911, test_loss: 1.0528, test_f1: 0.4495
 epoch: 28, train_loss: 1.0907, test_loss: 1.0454, test_f1: 0.4520
 epoch: 29, train_loss: 1.0810, test_loss: 1.0415, test_f1: 0.4572
 epoch: 30, train_loss: 1.0777, test_loss: 1.0335, test_f1: 0.4632
 epoch: 31, train_loss: 1.0602, test_loss: 1.0279, test_f1: 0.4657
 epoch: 32, train_loss: 1.0577, test_loss: 1.0188, test_f1: 0.4643
 epoch: 33, train_loss: 1.0528, test_loss: 1.0153, test_f1: 0.4720
 epoch: 34, train_loss: 1.0444, test_loss: 1.0136, test_f1: 0.4624
 epoch: 35, train_loss: 1.0380, test_loss: 1.0056, test_f1: 0.4682
 epoch: 36, train_loss: 1.0373, test_loss: 0.9995, test_f1: 0.4737
 epoch: 37, train_loss: 1.0295, test_loss: 0.9957, test_f1: 0.4698
 epoch: 38, train_loss: 1.0275, test_loss: 0.9903, test_f1: 0.4724
 epoch: 39, train_loss: 1.0212, test_loss: 0.9872, test_f1: 0.4734
 epoch: 40, train_loss: 1.0200, test_loss: 0.9849, test_f1: 0.4804
 epoch: 41, train_loss: 1.0186, test_loss: 0.9765, test_f1: 0.4824
 epoch: 42, train_loss: 1.0115, test_loss: 0.9734, test_f1: 0.4806
 epoch: 43, train_loss: 0.9973, test_loss: 0.9706, test_f1: 0.4828
 epoch: 44, train_loss: 1.0024, test_loss: 0.9652, test_f1: 0.4872
 epoch: 45, train_loss: 0.9984, test_loss: 0.9635, test_f1: 0.4878
 epoch: 46, train_loss: 0.9925, test_loss: 0.9629, test_f1: 0.4948
 epoch: 47, train_loss: 0.9802, test_loss: 0.9606, test_f1: 0.4880
 epoch: 48, train_loss: 0.9863, test_loss: 0.9601, test_f1: 0.4861
 epoch: 49, train_loss: 0.9775, test_loss: 0.9604, test_f1: 0.4833
 epoch: 50, train_loss: 0.9774, test_loss: 0.9609, test_f1: 0.4852
 epoch: 51, train_loss: 0.9734, test_loss: 0.9537, test_f1: 0.4949
 epoch: 52, train_loss: 0.9794, test_loss: 0.9534, test_f1: 0.4910
 epoch: 53, train_loss: 0.9680, test_loss: 0.9520, test_f1: 0.4940
 epoch: 54, train_loss: 0.9542, test_loss: 0.9520, test_f1: 0.4954
 epoch: 55, train_loss: 0.9723, test_loss: 0.9497, test_f1: 0.4973
 epoch: 56, train_loss: 0.9695, test_loss: 0.9480, test_f1: 0.4924
 epoch: 57, train_loss: 0.9636, test_loss: 0.9445, test_f1: 0.4907
 epoch: 58, train_loss: 0.9623, test_loss: 0.9492, test_f1: 0.4977
 epoch: 59, train_loss: 0.9570, test_loss: 0.9473, test_f1: 0.4946
 epoch: 60, train_loss: 0.9530, test_loss: 0.9474, test_f1: 0.4943
 epoch: 61, train_loss: 0.9564, test_loss: 0.9495, test_f1: 0.4903
 epoch: 62, train_loss: 0.9556, test_loss: 0.9494, test_f1: 0.4879
 epoch: 63, train_loss: 0.9622, test_loss: 0.9504, test_f1: 0.4855
 epoch: 64, train_loss: 0.9488, test_loss: 0.9449, test_f1: 0.4972
 epoch: 65, train_loss: 0.9485, test_loss: 0.9480, test_f1: 0.4991
 epoch: 66, train_loss: 0.9489, test_loss: 0.9444, test_f1: 0.4981
 epoch: 67, train_loss: 0.9439, test_loss: 0.9437, test_f1: 0.4950
 epoch: 68, train_loss: 0.9526, test_loss: 0.9450, test_f1: 0.4993
 epoch: 69, train_loss: 0.9495, test_loss: 0.9471, test_f1: 0.4847
 epoch: 70, train_loss: 0.9350, test_loss: 0.9422, test_f1: 0.4989
 epoch: 71, train_loss: 0.9420, test_loss: 0.9430, test_f1: 0.4926
 epoch: 72, train_loss: 0.9386, test_loss: 0.9423, test_f1: 0.4927
 epoch: 73, train_loss: 0.9381, test_loss: 0.9387, test_f1: 0.5063
 epoch: 74, train_loss: 0.9444, test_loss: 0.9420, test_f1: 0.4955
 epoch: 75, train_loss: 0.9314, test_loss: 0.9402, test_f1: 0.5029
 epoch: 76, train_loss: 0.9434, test_loss: 0.9372, test_f1: 0.5040
 epoch: 77, train_loss: 0.9284, test_loss: 0.9385, test_f1: 0.4995
 epoch: 78, train_loss: 0.9323, test_loss: 0.9419, test_f1: 0.4991
 epoch: 79, train_loss: 0.9267, test_loss: 0.9396, test_f1: 0.5015
 epoch: 80, train_loss: 0.9314, test_loss: 0.9406, test_f1: 0.4972
 epoch: 81, train_loss: 0.9317, test_loss: 0.9424, test_f1: 0.4952
 epoch: 82, train_loss: 0.9268, test_loss: 0.9405, test_f1: 0.5022
 epoch: 83, train_loss: 0.9251, test_loss: 0.9432, test_f1: 0.5014
 epoch: 84, train_loss: 0.9299, test_loss: 0.9415, test_f1: 0.5003
 epoch: 85, train_loss: 0.9226, test_loss: 0.9441, test_f1: 0.4976
 epoch: 86, train_loss: 0.9218, test_loss: 0.9480, test_f1: 0.4932
 epoch: 87, train_loss: 0.9168, test_loss: 0.9468, test_f1: 0.4976
 epoch: 88, train_loss: 0.9132, test_loss: 0.9436, test_f1: 0.4979
 epoch: 89, train_loss: 0.9213, test_loss: 0.9438, test_f1: 0.5008
 epoch: 90, train_loss: 0.9196, test_loss: 0.9511, test_f1: 0.4888
 epoch: 91, train_loss: 0.9135, test_loss: 0.9467, test_f1: 0.4988
 epoch: 92, train_loss: 0.9179, test_loss: 0.9398, test_f1: 0.5006
 epoch: 93, train_loss: 0.9181, test_loss: 0.9411, test_f1: 0.4990
 epoch: 94, train_loss: 0.9118, test_loss: 0.9427, test_f1: 0.4975
 epoch: 95, train_loss: 0.9056, test_loss: 0.9413, test_f1: 0.5040
 epoch: 96, train_loss: 0.9193, test_loss: 0.9411, test_f1: 0.5024
 epoch: 97, train_loss: 0.9150, test_loss: 0.9478, test_f1: 0.4926
 epoch: 98, train_loss: 0.9055, test_loss: 0.9504, test_f1: 0.5017
 epoch: 99, train_loss: 0.9040, test_loss: 0.9519, test_f1: 0.5044
##################ITERATION #5 ****************************************
 epoch: 0, train_loss: 1.3084, test_loss: 1.3311, test_f1: 0.2270
 epoch: 1, train_loss: 1.2769, test_loss: 1.3316, test_f1: 0.2270
 epoch: 2, train_loss: 1.2671, test_loss: 1.3286, test_f1: 0.2270
 epoch: 3, train_loss: 1.2510, test_loss: 1.3290, test_f1: 0.2270
 epoch: 4, train_loss: 1.2365, test_loss: 1.3073, test_f1: 0.2526
 epoch: 5, train_loss: 1.2275, test_loss: 1.2417, test_f1: 0.2600
 epoch: 6, train_loss: 1.2196, test_loss: 1.1957, test_f1: 0.3001
 epoch: 7, train_loss: 1.2153, test_loss: 1.1786, test_f1: 0.3107
 epoch: 8, train_loss: 1.2023, test_loss: 1.1684, test_f1: 0.3105
 epoch: 9, train_loss: 1.1937, test_loss: 1.1591, test_f1: 0.3390
 epoch: 10, train_loss: 1.1866, test_loss: 1.1518, test_f1: 0.3515
 epoch: 11, train_loss: 1.1858, test_loss: 1.1424, test_f1: 0.3659
 epoch: 12, train_loss: 1.1715, test_loss: 1.1340, test_f1: 0.3713
 epoch: 13, train_loss: 1.1730, test_loss: 1.1288, test_f1: 0.3807
 epoch: 14, train_loss: 1.1581, test_loss: 1.1215, test_f1: 0.4062
 epoch: 15, train_loss: 1.1550, test_loss: 1.1104, test_f1: 0.4115
 epoch: 16, train_loss: 1.1478, test_loss: 1.1068, test_f1: 0.4207
 epoch: 17, train_loss: 1.1432, test_loss: 1.0993, test_f1: 0.4267
 epoch: 18, train_loss: 1.1377, test_loss: 1.0942, test_f1: 0.4334
 epoch: 19, train_loss: 1.1309, test_loss: 1.0871, test_f1: 0.4505
 epoch: 20, train_loss: 1.1265, test_loss: 1.0817, test_f1: 0.4471
 epoch: 21, train_loss: 1.1165, test_loss: 1.0730, test_f1: 0.4624
 epoch: 22, train_loss: 1.1104, test_loss: 1.0664, test_f1: 0.4637
 epoch: 23, train_loss: 1.1110, test_loss: 1.0602, test_f1: 0.4673
 epoch: 24, train_loss: 1.1032, test_loss: 1.0560, test_f1: 0.4678
 epoch: 25, train_loss: 1.1028, test_loss: 1.0533, test_f1: 0.4699
 epoch: 26, train_loss: 1.0976, test_loss: 1.0461, test_f1: 0.4722
 epoch: 27, train_loss: 1.0833, test_loss: 1.0408, test_f1: 0.4697
 epoch: 28, train_loss: 1.0832, test_loss: 1.0327, test_f1: 0.4772
 epoch: 29, train_loss: 1.0795, test_loss: 1.0282, test_f1: 0.4742
 epoch: 30, train_loss: 1.0744, test_loss: 1.0224, test_f1: 0.4745
 epoch: 31, train_loss: 1.0687, test_loss: 1.0180, test_f1: 0.4733
 epoch: 32, train_loss: 1.0664, test_loss: 1.0155, test_f1: 0.4709
 epoch: 33, train_loss: 1.0559, test_loss: 1.0116, test_f1: 0.4639
 epoch: 34, train_loss: 1.0533, test_loss: 1.0060, test_f1: 0.4767
 epoch: 35, train_loss: 1.0472, test_loss: 1.0026, test_f1: 0.4698
 epoch: 36, train_loss: 1.0424, test_loss: 0.9987, test_f1: 0.4826
 epoch: 37, train_loss: 1.0394, test_loss: 0.9933, test_f1: 0.4835
 epoch: 38, train_loss: 1.0367, test_loss: 0.9891, test_f1: 0.4740
 epoch: 39, train_loss: 1.0375, test_loss: 0.9927, test_f1: 0.4762
 epoch: 40, train_loss: 1.0313, test_loss: 0.9886, test_f1: 0.4778
 epoch: 41, train_loss: 1.0229, test_loss: 0.9835, test_f1: 0.4780
 epoch: 42, train_loss: 1.0273, test_loss: 0.9839, test_f1: 0.4813
 epoch: 43, train_loss: 1.0260, test_loss: 0.9789, test_f1: 0.4749
 epoch: 44, train_loss: 1.0110, test_loss: 0.9767, test_f1: 0.4790
 epoch: 45, train_loss: 1.0059, test_loss: 0.9776, test_f1: 0.4817
 epoch: 46, train_loss: 1.0031, test_loss: 0.9725, test_f1: 0.4816
 epoch: 47, train_loss: 1.0000, test_loss: 0.9782, test_f1: 0.4797
 epoch: 48, train_loss: 1.0031, test_loss: 0.9686, test_f1: 0.4774
 epoch: 49, train_loss: 1.0024, test_loss: 0.9675, test_f1: 0.4874
 epoch: 50, train_loss: 0.9909, test_loss: 0.9720, test_f1: 0.4819
 epoch: 51, train_loss: 0.9895, test_loss: 0.9725, test_f1: 0.4873
 epoch: 52, train_loss: 0.9902, test_loss: 0.9680, test_f1: 0.4865
 epoch: 53, train_loss: 0.9856, test_loss: 0.9623, test_f1: 0.4852
 epoch: 54, train_loss: 0.9843, test_loss: 0.9659, test_f1: 0.4899
 epoch: 55, train_loss: 0.9935, test_loss: 0.9659, test_f1: 0.4919
 epoch: 56, train_loss: 0.9681, test_loss: 0.9671, test_f1: 0.4886
 epoch: 57, train_loss: 0.9852, test_loss: 0.9638, test_f1: 0.4851
 epoch: 58, train_loss: 0.9806, test_loss: 0.9629, test_f1: 0.4849
 epoch: 59, train_loss: 0.9664, test_loss: 0.9597, test_f1: 0.4940
 epoch: 60, train_loss: 0.9806, test_loss: 0.9585, test_f1: 0.4913
 epoch: 61, train_loss: 0.9753, test_loss: 0.9561, test_f1: 0.4869
 epoch: 62, train_loss: 0.9686, test_loss: 0.9568, test_f1: 0.4869
 epoch: 63, train_loss: 0.9658, test_loss: 0.9569, test_f1: 0.4908
 epoch: 64, train_loss: 0.9643, test_loss: 0.9535, test_f1: 0.4872
 epoch: 65, train_loss: 0.9680, test_loss: 0.9587, test_f1: 0.4863
 epoch: 66, train_loss: 0.9675, test_loss: 0.9587, test_f1: 0.4904
 epoch: 67, train_loss: 0.9697, test_loss: 0.9511, test_f1: 0.4931
 epoch: 68, train_loss: 0.9568, test_loss: 0.9497, test_f1: 0.4868
 epoch: 69, train_loss: 0.9659, test_loss: 0.9573, test_f1: 0.4868
 epoch: 70, train_loss: 0.9617, test_loss: 0.9504, test_f1: 0.4885
 epoch: 71, train_loss: 0.9705, test_loss: 0.9493, test_f1: 0.4890
 epoch: 72, train_loss: 0.9565, test_loss: 0.9521, test_f1: 0.4879
 epoch: 73, train_loss: 0.9547, test_loss: 0.9527, test_f1: 0.4956
 epoch: 74, train_loss: 0.9590, test_loss: 0.9490, test_f1: 0.4926
 epoch: 75, train_loss: 0.9508, test_loss: 0.9462, test_f1: 0.4934
 epoch: 76, train_loss: 0.9473, test_loss: 0.9430, test_f1: 0.4919
 epoch: 77, train_loss: 0.9429, test_loss: 0.9452, test_f1: 0.4909
 epoch: 78, train_loss: 0.9513, test_loss: 0.9505, test_f1: 0.4886
 epoch: 79, train_loss: 0.9452, test_loss: 0.9472, test_f1: 0.4909
 epoch: 80, train_loss: 0.9491, test_loss: 0.9507, test_f1: 0.4995
 epoch: 81, train_loss: 0.9500, test_loss: 0.9498, test_f1: 0.4916
 epoch: 82, train_loss: 0.9477, test_loss: 0.9434, test_f1: 0.4919
 epoch: 83, train_loss: 0.9471, test_loss: 0.9415, test_f1: 0.4923
 epoch: 84, train_loss: 0.9373, test_loss: 0.9404, test_f1: 0.4957
 epoch: 85, train_loss: 0.9404, test_loss: 0.9430, test_f1: 0.4936
 epoch: 86, train_loss: 0.9415, test_loss: 0.9389, test_f1: 0.4971
 epoch: 87, train_loss: 0.9412, test_loss: 0.9471, test_f1: 0.4985
 epoch: 88, train_loss: 0.9362, test_loss: 0.9407, test_f1: 0.4940
 epoch: 89, train_loss: 0.9370, test_loss: 0.9410, test_f1: 0.4965
 epoch: 90, train_loss: 0.9393, test_loss: 0.9421, test_f1: 0.4947
 epoch: 91, train_loss: 0.9361, test_loss: 0.9420, test_f1: 0.4969
 epoch: 92, train_loss: 0.9334, test_loss: 0.9392, test_f1: 0.5003
 epoch: 93, train_loss: 0.9277, test_loss: 0.9408, test_f1: 0.4975
 epoch: 94, train_loss: 0.9382, test_loss: 0.9380, test_f1: 0.5005
 epoch: 95, train_loss: 0.9299, test_loss: 0.9410, test_f1: 0.5039
 epoch: 96, train_loss: 0.9370, test_loss: 0.9380, test_f1: 0.4988
 epoch: 97, train_loss: 0.9303, test_loss: 0.9433, test_f1: 0.5042
 epoch: 98, train_loss: 0.9291, test_loss: 0.9394, test_f1: 0.5027
 epoch: 99, train_loss: 0.9249, test_loss: 0.9424, test_f1: 0.4989
##################ITERATION #6 ****************************************
 epoch: 0, train_loss: 1.3244, test_loss: 1.3128, test_f1: 0.2270
 epoch: 1, train_loss: 1.2809, test_loss: 1.3129, test_f1: 0.2270
 epoch: 2, train_loss: 1.2665, test_loss: 1.2962, test_f1: 0.2270
 epoch: 3, train_loss: 1.2435, test_loss: 1.2666, test_f1: 0.2270
 epoch: 4, train_loss: 1.2339, test_loss: 1.2229, test_f1: 0.2690
 epoch: 5, train_loss: 1.2282, test_loss: 1.1930, test_f1: 0.2783
 epoch: 6, train_loss: 1.2155, test_loss: 1.1756, test_f1: 0.2929
 epoch: 7, train_loss: 1.2066, test_loss: 1.1659, test_f1: 0.3054
 epoch: 8, train_loss: 1.1954, test_loss: 1.1551, test_f1: 0.3206
 epoch: 9, train_loss: 1.1900, test_loss: 1.1479, test_f1: 0.3311
 epoch: 10, train_loss: 1.1834, test_loss: 1.1398, test_f1: 0.3511
 epoch: 11, train_loss: 1.1770, test_loss: 1.1330, test_f1: 0.3568
 epoch: 12, train_loss: 1.1676, test_loss: 1.1235, test_f1: 0.3656
 epoch: 13, train_loss: 1.1612, test_loss: 1.1162, test_f1: 0.3737
 epoch: 14, train_loss: 1.1491, test_loss: 1.1080, test_f1: 0.3869
 epoch: 15, train_loss: 1.1445, test_loss: 1.0995, test_f1: 0.3934
 epoch: 16, train_loss: 1.1415, test_loss: 1.0898, test_f1: 0.4165
 epoch: 17, train_loss: 1.1370, test_loss: 1.0827, test_f1: 0.4182
 epoch: 18, train_loss: 1.1252, test_loss: 1.0749, test_f1: 0.4240
 epoch: 19, train_loss: 1.1209, test_loss: 1.0696, test_f1: 0.4284
 epoch: 20, train_loss: 1.1241, test_loss: 1.0623, test_f1: 0.4435
 epoch: 21, train_loss: 1.1043, test_loss: 1.0560, test_f1: 0.4477
 epoch: 22, train_loss: 1.1067, test_loss: 1.0510, test_f1: 0.4477
 epoch: 23, train_loss: 1.1029, test_loss: 1.0435, test_f1: 0.4450
 epoch: 24, train_loss: 1.0902, test_loss: 1.0384, test_f1: 0.4528
 epoch: 25, train_loss: 1.0884, test_loss: 1.0352, test_f1: 0.4573
 epoch: 26, train_loss: 1.0775, test_loss: 1.0304, test_f1: 0.4532
 epoch: 27, train_loss: 1.0832, test_loss: 1.0226, test_f1: 0.4585
 epoch: 28, train_loss: 1.0801, test_loss: 1.0186, test_f1: 0.4677
 epoch: 29, train_loss: 1.0652, test_loss: 1.0150, test_f1: 0.4677
 epoch: 30, train_loss: 1.0592, test_loss: 1.0132, test_f1: 0.4672
 epoch: 31, train_loss: 1.0575, test_loss: 1.0106, test_f1: 0.4589
 epoch: 32, train_loss: 1.0487, test_loss: 1.0065, test_f1: 0.4557
 epoch: 33, train_loss: 1.0516, test_loss: 1.0016, test_f1: 0.4744
 epoch: 34, train_loss: 1.0470, test_loss: 0.9974, test_f1: 0.4668
 epoch: 35, train_loss: 1.0518, test_loss: 0.9952, test_f1: 0.4664
 epoch: 36, train_loss: 1.0376, test_loss: 0.9896, test_f1: 0.4731
 epoch: 37, train_loss: 1.0323, test_loss: 0.9861, test_f1: 0.4709
 epoch: 38, train_loss: 1.0348, test_loss: 0.9843, test_f1: 0.4613
 epoch: 39, train_loss: 1.0254, test_loss: 0.9838, test_f1: 0.4629
 epoch: 40, train_loss: 1.0235, test_loss: 0.9783, test_f1: 0.4634
 epoch: 41, train_loss: 1.0178, test_loss: 0.9757, test_f1: 0.4728
 epoch: 42, train_loss: 1.0119, test_loss: 0.9724, test_f1: 0.4702
 epoch: 43, train_loss: 1.0153, test_loss: 0.9680, test_f1: 0.4945
 epoch: 44, train_loss: 1.0039, test_loss: 0.9648, test_f1: 0.4940
 epoch: 45, train_loss: 1.0041, test_loss: 0.9618, test_f1: 0.4968
 epoch: 46, train_loss: 0.9942, test_loss: 0.9609, test_f1: 0.4864
 epoch: 47, train_loss: 0.9926, test_loss: 0.9577, test_f1: 0.4925
 epoch: 48, train_loss: 0.9895, test_loss: 0.9512, test_f1: 0.4982
 epoch: 49, train_loss: 0.9961, test_loss: 0.9504, test_f1: 0.5117
 epoch: 50, train_loss: 0.9863, test_loss: 0.9443, test_f1: 0.5116
 epoch: 51, train_loss: 0.9907, test_loss: 0.9435, test_f1: 0.5125
 epoch: 52, train_loss: 0.9757, test_loss: 0.9430, test_f1: 0.5111
 epoch: 53, train_loss: 0.9771, test_loss: 0.9446, test_f1: 0.5108
 epoch: 54, train_loss: 0.9791, test_loss: 0.9409, test_f1: 0.5152
 epoch: 55, train_loss: 0.9812, test_loss: 0.9405, test_f1: 0.5167
 epoch: 56, train_loss: 0.9738, test_loss: 0.9377, test_f1: 0.5143
 epoch: 57, train_loss: 0.9781, test_loss: 0.9373, test_f1: 0.5161
 epoch: 58, train_loss: 0.9768, test_loss: 0.9349, test_f1: 0.5167
 epoch: 59, train_loss: 0.9757, test_loss: 0.9353, test_f1: 0.5188
 epoch: 60, train_loss: 0.9777, test_loss: 0.9341, test_f1: 0.5213
 epoch: 61, train_loss: 0.9793, test_loss: 0.9346, test_f1: 0.5187
 epoch: 62, train_loss: 0.9712, test_loss: 0.9340, test_f1: 0.5190
 epoch: 63, train_loss: 0.9643, test_loss: 0.9324, test_f1: 0.5189
 epoch: 64, train_loss: 0.9641, test_loss: 0.9316, test_f1: 0.5164
 epoch: 65, train_loss: 0.9639, test_loss: 0.9293, test_f1: 0.5220
 epoch: 66, train_loss: 0.9614, test_loss: 0.9298, test_f1: 0.5212
 epoch: 67, train_loss: 0.9581, test_loss: 0.9269, test_f1: 0.5224
 epoch: 68, train_loss: 0.9586, test_loss: 0.9267, test_f1: 0.5240
 epoch: 69, train_loss: 0.9553, test_loss: 0.9272, test_f1: 0.5157
 epoch: 70, train_loss: 0.9663, test_loss: 0.9276, test_f1: 0.5171
 epoch: 71, train_loss: 0.9630, test_loss: 0.9265, test_f1: 0.5181
 epoch: 72, train_loss: 0.9553, test_loss: 0.9213, test_f1: 0.5291
 epoch: 73, train_loss: 0.9577, test_loss: 0.9198, test_f1: 0.5231
 epoch: 74, train_loss: 0.9590, test_loss: 0.9211, test_f1: 0.5182
 epoch: 75, train_loss: 0.9500, test_loss: 0.9208, test_f1: 0.5293
 epoch: 76, train_loss: 0.9595, test_loss: 0.9197, test_f1: 0.5181
 epoch: 77, train_loss: 0.9478, test_loss: 0.9184, test_f1: 0.5258
 epoch: 78, train_loss: 0.9511, test_loss: 0.9166, test_f1: 0.5172
 epoch: 79, train_loss: 0.9493, test_loss: 0.9150, test_f1: 0.5207
 epoch: 80, train_loss: 0.9390, test_loss: 0.9166, test_f1: 0.5247
 epoch: 81, train_loss: 0.9429, test_loss: 0.9142, test_f1: 0.5303
 epoch: 82, train_loss: 0.9409, test_loss: 0.9133, test_f1: 0.5341
 epoch: 83, train_loss: 0.9431, test_loss: 0.9131, test_f1: 0.5302
 epoch: 84, train_loss: 0.9477, test_loss: 0.9098, test_f1: 0.5312
 epoch: 85, train_loss: 0.9425, test_loss: 0.9107, test_f1: 0.5248
 epoch: 86, train_loss: 0.9408, test_loss: 0.9103, test_f1: 0.5318
 epoch: 87, train_loss: 0.9437, test_loss: 0.9136, test_f1: 0.5179
 epoch: 88, train_loss: 0.9336, test_loss: 0.9107, test_f1: 0.5214
 epoch: 89, train_loss: 0.9321, test_loss: 0.9109, test_f1: 0.5160
 epoch: 90, train_loss: 0.9457, test_loss: 0.9111, test_f1: 0.5214
 epoch: 91, train_loss: 0.9335, test_loss: 0.9091, test_f1: 0.5220
 epoch: 92, train_loss: 0.9358, test_loss: 0.9074, test_f1: 0.5202
 epoch: 93, train_loss: 0.9315, test_loss: 0.9085, test_f1: 0.5213
 epoch: 94, train_loss: 0.9382, test_loss: 0.9117, test_f1: 0.5089
 epoch: 95, train_loss: 0.9295, test_loss: 0.9102, test_f1: 0.5132
 epoch: 96, train_loss: 0.9250, test_loss: 0.9112, test_f1: 0.5114
 epoch: 97, train_loss: 0.9299, test_loss: 0.9079, test_f1: 0.5144
 epoch: 98, train_loss: 0.9279, test_loss: 0.9056, test_f1: 0.5172
 epoch: 99, train_loss: 0.9232, test_loss: 0.9061, test_f1: 0.5146
##################ITERATION #7 ****************************************
 epoch: 0, train_loss: 1.3633, test_loss: 1.3364, test_f1: 0.2270
 epoch: 1, train_loss: 1.3123, test_loss: 1.3199, test_f1: 0.2270
 epoch: 2, train_loss: 1.2807, test_loss: 1.3119, test_f1: 0.2270
 epoch: 3, train_loss: 1.2733, test_loss: 1.2847, test_f1: 0.2270
 epoch: 4, train_loss: 1.2525, test_loss: 1.2439, test_f1: 0.2270
 epoch: 5, train_loss: 1.2359, test_loss: 1.2190, test_f1: 0.2392
 epoch: 6, train_loss: 1.2285, test_loss: 1.2069, test_f1: 0.2600
 epoch: 7, train_loss: 1.2212, test_loss: 1.1959, test_f1: 0.2857
 epoch: 8, train_loss: 1.2112, test_loss: 1.1845, test_f1: 0.3257
 epoch: 9, train_loss: 1.1971, test_loss: 1.1756, test_f1: 0.3399
 epoch: 10, train_loss: 1.1909, test_loss: 1.1662, test_f1: 0.3495
 epoch: 11, train_loss: 1.1838, test_loss: 1.1556, test_f1: 0.3667
 epoch: 12, train_loss: 1.1805, test_loss: 1.1471, test_f1: 0.3823
 epoch: 13, train_loss: 1.1786, test_loss: 1.1373, test_f1: 0.4006
 epoch: 14, train_loss: 1.1599, test_loss: 1.1291, test_f1: 0.4111
 epoch: 15, train_loss: 1.1552, test_loss: 1.1210, test_f1: 0.4280
 epoch: 16, train_loss: 1.1473, test_loss: 1.1121, test_f1: 0.4338
 epoch: 17, train_loss: 1.1330, test_loss: 1.1025, test_f1: 0.4333
 epoch: 18, train_loss: 1.1258, test_loss: 1.0924, test_f1: 0.4391
 epoch: 19, train_loss: 1.1167, test_loss: 1.0841, test_f1: 0.4367
 epoch: 20, train_loss: 1.1147, test_loss: 1.0757, test_f1: 0.4478
 epoch: 21, train_loss: 1.1040, test_loss: 1.0690, test_f1: 0.4461
 epoch: 22, train_loss: 1.0965, test_loss: 1.0623, test_f1: 0.4551
 epoch: 23, train_loss: 1.0843, test_loss: 1.0538, test_f1: 0.4574
 epoch: 24, train_loss: 1.0859, test_loss: 1.0449, test_f1: 0.4588
 epoch: 25, train_loss: 1.0833, test_loss: 1.0379, test_f1: 0.4618
 epoch: 26, train_loss: 1.0724, test_loss: 1.0300, test_f1: 0.4647
 epoch: 27, train_loss: 1.0690, test_loss: 1.0258, test_f1: 0.4671
 epoch: 28, train_loss: 1.0589, test_loss: 1.0196, test_f1: 0.4710
 epoch: 29, train_loss: 1.0572, test_loss: 1.0145, test_f1: 0.4719
 epoch: 30, train_loss: 1.0485, test_loss: 1.0099, test_f1: 0.4694
 epoch: 31, train_loss: 1.0503, test_loss: 1.0047, test_f1: 0.4725
 epoch: 32, train_loss: 1.0394, test_loss: 1.0009, test_f1: 0.4732
 epoch: 33, train_loss: 1.0317, test_loss: 0.9951, test_f1: 0.4752
 epoch: 34, train_loss: 1.0255, test_loss: 0.9910, test_f1: 0.4776
 epoch: 35, train_loss: 1.0265, test_loss: 0.9876, test_f1: 0.4773
 epoch: 36, train_loss: 1.0137, test_loss: 0.9865, test_f1: 0.4804
 epoch: 37, train_loss: 1.0141, test_loss: 0.9867, test_f1: 0.4796
 epoch: 38, train_loss: 1.0092, test_loss: 0.9803, test_f1: 0.4798
 epoch: 39, train_loss: 1.0017, test_loss: 0.9757, test_f1: 0.4797
 epoch: 40, train_loss: 1.0065, test_loss: 0.9732, test_f1: 0.4805
 epoch: 41, train_loss: 0.9912, test_loss: 0.9761, test_f1: 0.4812
 epoch: 42, train_loss: 1.0010, test_loss: 0.9750, test_f1: 0.4830
 epoch: 43, train_loss: 0.9880, test_loss: 0.9719, test_f1: 0.4796
 epoch: 44, train_loss: 0.9854, test_loss: 0.9751, test_f1: 0.4789
 epoch: 45, train_loss: 0.9815, test_loss: 0.9718, test_f1: 0.4854
 epoch: 46, train_loss: 0.9815, test_loss: 0.9696, test_f1: 0.4896
 epoch: 47, train_loss: 0.9778, test_loss: 0.9670, test_f1: 0.4959
 epoch: 48, train_loss: 0.9742, test_loss: 0.9634, test_f1: 0.4988
 epoch: 49, train_loss: 0.9733, test_loss: 0.9593, test_f1: 0.5015
 epoch: 50, train_loss: 0.9655, test_loss: 0.9611, test_f1: 0.5094
 epoch: 51, train_loss: 0.9589, test_loss: 0.9636, test_f1: 0.5007
 epoch: 52, train_loss: 0.9708, test_loss: 0.9690, test_f1: 0.4947
 epoch: 53, train_loss: 0.9707, test_loss: 0.9682, test_f1: 0.5003
 epoch: 54, train_loss: 0.9626, test_loss: 0.9694, test_f1: 0.5024
 epoch: 55, train_loss: 0.9594, test_loss: 0.9691, test_f1: 0.4970
 epoch: 56, train_loss: 0.9552, test_loss: 0.9638, test_f1: 0.4999
 epoch: 57, train_loss: 0.9591, test_loss: 0.9635, test_f1: 0.5039
 epoch: 58, train_loss: 0.9495, test_loss: 0.9628, test_f1: 0.5033
 epoch: 59, train_loss: 0.9568, test_loss: 0.9620, test_f1: 0.5007
 epoch: 60, train_loss: 0.9574, test_loss: 0.9650, test_f1: 0.5013
 epoch: 61, train_loss: 0.9536, test_loss: 0.9640, test_f1: 0.4984
 epoch: 62, train_loss: 0.9546, test_loss: 0.9630, test_f1: 0.5090
 epoch: 63, train_loss: 0.9622, test_loss: 0.9604, test_f1: 0.5121
 epoch: 64, train_loss: 0.9588, test_loss: 0.9650, test_f1: 0.5085
 epoch: 65, train_loss: 0.9561, test_loss: 0.9666, test_f1: 0.5048
 epoch: 66, train_loss: 0.9511, test_loss: 0.9639, test_f1: 0.5129
 epoch: 67, train_loss: 0.9526, test_loss: 0.9614, test_f1: 0.5089
 epoch: 68, train_loss: 0.9465, test_loss: 0.9603, test_f1: 0.5026
 epoch: 69, train_loss: 0.9482, test_loss: 0.9609, test_f1: 0.5065
 epoch: 70, train_loss: 0.9423, test_loss: 0.9706, test_f1: 0.5049
 epoch: 71, train_loss: 0.9488, test_loss: 0.9665, test_f1: 0.5078
 epoch: 72, train_loss: 0.9419, test_loss: 0.9666, test_f1: 0.5044
 epoch: 73, train_loss: 0.9440, test_loss: 0.9671, test_f1: 0.5034
 epoch: 74, train_loss: 0.9432, test_loss: 0.9677, test_f1: 0.5101
 epoch: 75, train_loss: 0.9435, test_loss: 0.9622, test_f1: 0.5084
 epoch: 76, train_loss: 0.9348, test_loss: 0.9688, test_f1: 0.5054
 epoch: 77, train_loss: 0.9373, test_loss: 0.9712, test_f1: 0.5013
 epoch: 78, train_loss: 0.9328, test_loss: 0.9656, test_f1: 0.5006
 epoch: 79, train_loss: 0.9363, test_loss: 0.9663, test_f1: 0.5004
 epoch: 80, train_loss: 0.9329, test_loss: 0.9705, test_f1: 0.4990
 epoch: 81, train_loss: 0.9403, test_loss: 0.9692, test_f1: 0.5003
 epoch: 82, train_loss: 0.9367, test_loss: 0.9688, test_f1: 0.4976
 epoch: 83, train_loss: 0.9334, test_loss: 0.9686, test_f1: 0.4975
 epoch: 84, train_loss: 0.9339, test_loss: 0.9665, test_f1: 0.4994
 epoch: 85, train_loss: 0.9342, test_loss: 0.9673, test_f1: 0.5014
 epoch: 86, train_loss: 0.9327, test_loss: 0.9683, test_f1: 0.5017
 epoch: 87, train_loss: 0.9227, test_loss: 0.9711, test_f1: 0.4978
 epoch: 88, train_loss: 0.9209, test_loss: 0.9724, test_f1: 0.5013
 epoch: 89, train_loss: 0.9379, test_loss: 0.9684, test_f1: 0.5011
 epoch: 90, train_loss: 0.9320, test_loss: 0.9694, test_f1: 0.5056
 epoch: 91, train_loss: 0.9210, test_loss: 0.9713, test_f1: 0.5125
 epoch: 92, train_loss: 0.9300, test_loss: 0.9693, test_f1: 0.5084
 epoch: 93, train_loss: 0.9318, test_loss: 0.9778, test_f1: 0.5059
 epoch: 94, train_loss: 0.9241, test_loss: 0.9752, test_f1: 0.4959
 epoch: 95, train_loss: 0.9233, test_loss: 0.9762, test_f1: 0.5076
 epoch: 96, train_loss: 0.9201, test_loss: 0.9727, test_f1: 0.5111
 epoch: 97, train_loss: 0.9173, test_loss: 0.9718, test_f1: 0.5140
 epoch: 98, train_loss: 0.9140, test_loss: 0.9697, test_f1: 0.5124
 epoch: 99, train_loss: 0.9195, test_loss: 0.9667, test_f1: 0.5059
##################ITERATION #8 ****************************************
 epoch: 0, train_loss: 1.3425, test_loss: 1.3134, test_f1: 0.2270
 epoch: 1, train_loss: 1.2743, test_loss: 1.2964, test_f1: 0.2270
 epoch: 2, train_loss: 1.2497, test_loss: 1.2829, test_f1: 0.2270
 epoch: 3, train_loss: 1.2285, test_loss: 1.2539, test_f1: 0.2516
 epoch: 4, train_loss: 1.2198, test_loss: 1.2121, test_f1: 0.2588
 epoch: 5, train_loss: 1.2077, test_loss: 1.1713, test_f1: 0.3387
 epoch: 6, train_loss: 1.2018, test_loss: 1.1526, test_f1: 0.3532
 epoch: 7, train_loss: 1.1880, test_loss: 1.1385, test_f1: 0.3661
 epoch: 8, train_loss: 1.1765, test_loss: 1.1292, test_f1: 0.3868
 epoch: 9, train_loss: 1.1753, test_loss: 1.1210, test_f1: 0.3931
 epoch: 10, train_loss: 1.1614, test_loss: 1.1130, test_f1: 0.4159
 epoch: 11, train_loss: 1.1567, test_loss: 1.1047, test_f1: 0.4256
 epoch: 12, train_loss: 1.1485, test_loss: 1.0967, test_f1: 0.4352
 epoch: 13, train_loss: 1.1382, test_loss: 1.0921, test_f1: 0.4378
 epoch: 14, train_loss: 1.1319, test_loss: 1.0852, test_f1: 0.4411
 epoch: 15, train_loss: 1.1378, test_loss: 1.0792, test_f1: 0.4550
 epoch: 16, train_loss: 1.1260, test_loss: 1.0708, test_f1: 0.4526
 epoch: 17, train_loss: 1.1147, test_loss: 1.0653, test_f1: 0.4539
 epoch: 18, train_loss: 1.1081, test_loss: 1.0585, test_f1: 0.4553
 epoch: 19, train_loss: 1.0983, test_loss: 1.0519, test_f1: 0.4624
 epoch: 20, train_loss: 1.0998, test_loss: 1.0461, test_f1: 0.4634
 epoch: 21, train_loss: 1.0829, test_loss: 1.0393, test_f1: 0.4704
 epoch: 22, train_loss: 1.0880, test_loss: 1.0323, test_f1: 0.4751
 epoch: 23, train_loss: 1.0889, test_loss: 1.0280, test_f1: 0.4729
 epoch: 24, train_loss: 1.0751, test_loss: 1.0217, test_f1: 0.4792
 epoch: 25, train_loss: 1.0602, test_loss: 1.0159, test_f1: 0.4728
 epoch: 26, train_loss: 1.0653, test_loss: 1.0124, test_f1: 0.4738
 epoch: 27, train_loss: 1.0584, test_loss: 1.0064, test_f1: 0.4772
 epoch: 28, train_loss: 1.0532, test_loss: 1.0035, test_f1: 0.4792
 epoch: 29, train_loss: 1.0466, test_loss: 0.9966, test_f1: 0.4805
 epoch: 30, train_loss: 1.0413, test_loss: 0.9916, test_f1: 0.4882
 epoch: 31, train_loss: 1.0319, test_loss: 0.9890, test_f1: 0.4835
 epoch: 32, train_loss: 1.0360, test_loss: 0.9847, test_f1: 0.4860
 epoch: 33, train_loss: 1.0255, test_loss: 0.9792, test_f1: 0.4861
 epoch: 34, train_loss: 1.0218, test_loss: 0.9772, test_f1: 0.4891
 epoch: 35, train_loss: 1.0177, test_loss: 0.9716, test_f1: 0.4885
 epoch: 36, train_loss: 1.0098, test_loss: 0.9701, test_f1: 0.4842
 epoch: 37, train_loss: 1.0026, test_loss: 0.9701, test_f1: 0.4793
 epoch: 38, train_loss: 1.0030, test_loss: 0.9669, test_f1: 0.4834
 epoch: 39, train_loss: 1.0004, test_loss: 0.9622, test_f1: 0.4802
 epoch: 40, train_loss: 1.0015, test_loss: 0.9599, test_f1: 0.4845
 epoch: 41, train_loss: 0.9870, test_loss: 0.9601, test_f1: 0.4812
 epoch: 42, train_loss: 0.9894, test_loss: 0.9589, test_f1: 0.4869
 epoch: 43, train_loss: 0.9863, test_loss: 0.9569, test_f1: 0.4880
 epoch: 44, train_loss: 0.9890, test_loss: 0.9545, test_f1: 0.4856
 epoch: 45, train_loss: 0.9793, test_loss: 0.9556, test_f1: 0.4822
 epoch: 46, train_loss: 0.9889, test_loss: 0.9513, test_f1: 0.4897
 epoch: 47, train_loss: 0.9747, test_loss: 0.9500, test_f1: 0.4883
 epoch: 48, train_loss: 0.9688, test_loss: 0.9483, test_f1: 0.5047
 epoch: 49, train_loss: 0.9741, test_loss: 0.9501, test_f1: 0.4974
 epoch: 50, train_loss: 0.9635, test_loss: 0.9505, test_f1: 0.5012
 epoch: 51, train_loss: 0.9665, test_loss: 0.9507, test_f1: 0.4972
 epoch: 52, train_loss: 0.9622, test_loss: 0.9489, test_f1: 0.5016
 epoch: 53, train_loss: 0.9496, test_loss: 0.9483, test_f1: 0.5007
 epoch: 54, train_loss: 0.9605, test_loss: 0.9473, test_f1: 0.4996
 epoch: 55, train_loss: 0.9548, test_loss: 0.9469, test_f1: 0.4999
 epoch: 56, train_loss: 0.9570, test_loss: 0.9470, test_f1: 0.5009
 epoch: 57, train_loss: 0.9616, test_loss: 0.9479, test_f1: 0.5025
 epoch: 58, train_loss: 0.9529, test_loss: 0.9459, test_f1: 0.4993
 epoch: 59, train_loss: 0.9455, test_loss: 0.9455, test_f1: 0.5040
 epoch: 60, train_loss: 0.9491, test_loss: 0.9458, test_f1: 0.5012
 epoch: 61, train_loss: 0.9515, test_loss: 0.9430, test_f1: 0.5016
 epoch: 62, train_loss: 0.9432, test_loss: 0.9473, test_f1: 0.5004
 epoch: 63, train_loss: 0.9524, test_loss: 0.9459, test_f1: 0.5074
 epoch: 64, train_loss: 0.9447, test_loss: 0.9467, test_f1: 0.5037
 epoch: 65, train_loss: 0.9464, test_loss: 0.9469, test_f1: 0.5074
 epoch: 66, train_loss: 0.9434, test_loss: 0.9406, test_f1: 0.5063
 epoch: 67, train_loss: 0.9469, test_loss: 0.9386, test_f1: 0.5026
 epoch: 68, train_loss: 0.9423, test_loss: 0.9394, test_f1: 0.5060
 epoch: 69, train_loss: 0.9525, test_loss: 0.9395, test_f1: 0.5070
 epoch: 70, train_loss: 0.9379, test_loss: 0.9434, test_f1: 0.5071
 epoch: 71, train_loss: 0.9382, test_loss: 0.9434, test_f1: 0.5069
 epoch: 72, train_loss: 0.9419, test_loss: 0.9429, test_f1: 0.5114
 epoch: 73, train_loss: 0.9313, test_loss: 0.9466, test_f1: 0.5124
 epoch: 74, train_loss: 0.9294, test_loss: 0.9407, test_f1: 0.5142
 epoch: 75, train_loss: 0.9323, test_loss: 0.9403, test_f1: 0.5075
 epoch: 76, train_loss: 0.9265, test_loss: 0.9379, test_f1: 0.5057
 epoch: 77, train_loss: 0.9305, test_loss: 0.9426, test_f1: 0.5100
 epoch: 78, train_loss: 0.9316, test_loss: 0.9403, test_f1: 0.5127
 epoch: 79, train_loss: 0.9326, test_loss: 0.9423, test_f1: 0.5096
 epoch: 80, train_loss: 0.9311, test_loss: 0.9386, test_f1: 0.5149
 epoch: 81, train_loss: 0.9272, test_loss: 0.9363, test_f1: 0.5151
 epoch: 82, train_loss: 0.9313, test_loss: 0.9395, test_f1: 0.5116
 epoch: 83, train_loss: 0.9196, test_loss: 0.9387, test_f1: 0.5102
 epoch: 84, train_loss: 0.9247, test_loss: 0.9347, test_f1: 0.5108
 epoch: 85, train_loss: 0.9258, test_loss: 0.9353, test_f1: 0.5084
 epoch: 86, train_loss: 0.9195, test_loss: 0.9351, test_f1: 0.5054
 epoch: 87, train_loss: 0.9264, test_loss: 0.9321, test_f1: 0.5059
 epoch: 88, train_loss: 0.9202, test_loss: 0.9327, test_f1: 0.5110
 epoch: 89, train_loss: 0.9213, test_loss: 0.9359, test_f1: 0.5115
 epoch: 90, train_loss: 0.9163, test_loss: 0.9339, test_f1: 0.5156
 epoch: 91, train_loss: 0.9148, test_loss: 0.9342, test_f1: 0.5157
 epoch: 92, train_loss: 0.9190, test_loss: 0.9356, test_f1: 0.5165
 epoch: 93, train_loss: 0.9131, test_loss: 0.9349, test_f1: 0.5135
 epoch: 94, train_loss: 0.9237, test_loss: 0.9402, test_f1: 0.5103
 epoch: 95, train_loss: 0.9152, test_loss: 0.9417, test_f1: 0.5054
 epoch: 96, train_loss: 0.9163, test_loss: 0.9401, test_f1: 0.5093
 epoch: 97, train_loss: 0.9095, test_loss: 0.9384, test_f1: 0.5117
 epoch: 98, train_loss: 0.9111, test_loss: 0.9363, test_f1: 0.5156
 epoch: 99, train_loss: 0.9117, test_loss: 0.9393, test_f1: 0.5149
##################ITERATION #9 ****************************************
 epoch: 0, train_loss: 1.4106, test_loss: 1.3758, test_f1: 0.2270
 epoch: 1, train_loss: 1.3323, test_loss: 1.3623, test_f1: 0.2270
 epoch: 2, train_loss: 1.2875, test_loss: 1.3331, test_f1: 0.2270
 epoch: 3, train_loss: 1.2647, test_loss: 1.2722, test_f1: 0.2560
 epoch: 4, train_loss: 1.2500, test_loss: 1.2196, test_f1: 0.3259
 epoch: 5, train_loss: 1.2319, test_loss: 1.1913, test_f1: 0.3425
 epoch: 6, train_loss: 1.2190, test_loss: 1.1746, test_f1: 0.3487
 epoch: 7, train_loss: 1.2066, test_loss: 1.1648, test_f1: 0.3618
 epoch: 8, train_loss: 1.1932, test_loss: 1.1542, test_f1: 0.3707
 epoch: 9, train_loss: 1.1867, test_loss: 1.1447, test_f1: 0.3638
 epoch: 10, train_loss: 1.1757, test_loss: 1.1350, test_f1: 0.3777
 epoch: 11, train_loss: 1.1656, test_loss: 1.1254, test_f1: 0.3885
 epoch: 12, train_loss: 1.1553, test_loss: 1.1137, test_f1: 0.4020
 epoch: 13, train_loss: 1.1546, test_loss: 1.1026, test_f1: 0.4226
 epoch: 14, train_loss: 1.1450, test_loss: 1.0941, test_f1: 0.4259
 epoch: 15, train_loss: 1.1329, test_loss: 1.0848, test_f1: 0.4316
 epoch: 16, train_loss: 1.1247, test_loss: 1.0781, test_f1: 0.4381
 epoch: 17, train_loss: 1.1134, test_loss: 1.0694, test_f1: 0.4368
 epoch: 18, train_loss: 1.1101, test_loss: 1.0631, test_f1: 0.4390
 epoch: 19, train_loss: 1.1042, test_loss: 1.0547, test_f1: 0.4401
 epoch: 20, train_loss: 1.0957, test_loss: 1.0485, test_f1: 0.4440
 epoch: 21, train_loss: 1.0924, test_loss: 1.0408, test_f1: 0.4443
 epoch: 22, train_loss: 1.0787, test_loss: 1.0342, test_f1: 0.4501
 epoch: 23, train_loss: 1.0750, test_loss: 1.0309, test_f1: 0.4524
 epoch: 24, train_loss: 1.0641, test_loss: 1.0258, test_f1: 0.4495
 epoch: 25, train_loss: 1.0647, test_loss: 1.0191, test_f1: 0.4705
 epoch: 26, train_loss: 1.0595, test_loss: 1.0186, test_f1: 0.4490
 epoch: 27, train_loss: 1.0551, test_loss: 1.0118, test_f1: 0.4614
 epoch: 28, train_loss: 1.0534, test_loss: 1.0076, test_f1: 0.4511
 epoch: 29, train_loss: 1.0372, test_loss: 1.0038, test_f1: 0.4671
 epoch: 30, train_loss: 1.0290, test_loss: 0.9999, test_f1: 0.4689
 epoch: 31, train_loss: 1.0276, test_loss: 0.9957, test_f1: 0.4716
 epoch: 32, train_loss: 1.0245, test_loss: 0.9941, test_f1: 0.4701
 epoch: 33, train_loss: 1.0290, test_loss: 0.9906, test_f1: 0.4864
 epoch: 34, train_loss: 1.0146, test_loss: 0.9884, test_f1: 0.4892
 epoch: 35, train_loss: 1.0103, test_loss: 0.9834, test_f1: 0.4842
 epoch: 36, train_loss: 1.0070, test_loss: 0.9831, test_f1: 0.4694
 epoch: 37, train_loss: 1.0059, test_loss: 0.9800, test_f1: 0.4836
 epoch: 38, train_loss: 1.0063, test_loss: 0.9754, test_f1: 0.4876
 epoch: 39, train_loss: 1.0010, test_loss: 0.9766, test_f1: 0.4960
 epoch: 40, train_loss: 0.9976, test_loss: 0.9736, test_f1: 0.4880
 epoch: 41, train_loss: 0.9930, test_loss: 0.9727, test_f1: 0.4852
 epoch: 42, train_loss: 0.9862, test_loss: 0.9701, test_f1: 0.4854
 epoch: 43, train_loss: 0.9901, test_loss: 0.9682, test_f1: 0.4842
 epoch: 44, train_loss: 0.9853, test_loss: 0.9704, test_f1: 0.4956
 epoch: 45, train_loss: 0.9735, test_loss: 0.9665, test_f1: 0.5018
 epoch: 46, train_loss: 0.9867, test_loss: 0.9674, test_f1: 0.4970
 epoch: 47, train_loss: 0.9682, test_loss: 0.9673, test_f1: 0.5041
 epoch: 48, train_loss: 0.9705, test_loss: 0.9646, test_f1: 0.4907
 epoch: 49, train_loss: 0.9706, test_loss: 0.9647, test_f1: 0.4956
 epoch: 50, train_loss: 0.9584, test_loss: 0.9660, test_f1: 0.4957
 epoch: 51, train_loss: 0.9634, test_loss: 0.9639, test_f1: 0.4997
 epoch: 52, train_loss: 0.9618, test_loss: 0.9621, test_f1: 0.4896
 epoch: 53, train_loss: 0.9577, test_loss: 0.9602, test_f1: 0.4900
 epoch: 54, train_loss: 0.9573, test_loss: 0.9591, test_f1: 0.4928
 epoch: 55, train_loss: 0.9553, test_loss: 0.9576, test_f1: 0.4936
 epoch: 56, train_loss: 0.9553, test_loss: 0.9572, test_f1: 0.5011
 epoch: 57, train_loss: 0.9487, test_loss: 0.9553, test_f1: 0.5037
 epoch: 58, train_loss: 0.9493, test_loss: 0.9543, test_f1: 0.4976
 epoch: 59, train_loss: 0.9437, test_loss: 0.9571, test_f1: 0.4989
 epoch: 60, train_loss: 0.9433, test_loss: 0.9535, test_f1: 0.4996
 epoch: 61, train_loss: 0.9439, test_loss: 0.9522, test_f1: 0.5057
 epoch: 62, train_loss: 0.9509, test_loss: 0.9530, test_f1: 0.5093
 epoch: 63, train_loss: 0.9485, test_loss: 0.9527, test_f1: 0.5042
 epoch: 64, train_loss: 0.9421, test_loss: 0.9549, test_f1: 0.5024
 epoch: 65, train_loss: 0.9427, test_loss: 0.9547, test_f1: 0.5074
 epoch: 66, train_loss: 0.9344, test_loss: 0.9550, test_f1: 0.4955
 epoch: 67, train_loss: 0.9402, test_loss: 0.9510, test_f1: 0.5032
 epoch: 68, train_loss: 0.9344, test_loss: 0.9517, test_f1: 0.5064
 epoch: 69, train_loss: 0.9363, test_loss: 0.9502, test_f1: 0.5068
 epoch: 70, train_loss: 0.9378, test_loss: 0.9516, test_f1: 0.4982
 epoch: 71, train_loss: 0.9336, test_loss: 0.9524, test_f1: 0.4977
 epoch: 72, train_loss: 0.9292, test_loss: 0.9508, test_f1: 0.5029
 epoch: 73, train_loss: 0.9354, test_loss: 0.9500, test_f1: 0.5050
 epoch: 74, train_loss: 0.9279, test_loss: 0.9502, test_f1: 0.4972
 epoch: 75, train_loss: 0.9313, test_loss: 0.9516, test_f1: 0.5030
 epoch: 76, train_loss: 0.9319, test_loss: 0.9517, test_f1: 0.4918
 epoch: 77, train_loss: 0.9210, test_loss: 0.9505, test_f1: 0.5017
 epoch: 78, train_loss: 0.9318, test_loss: 0.9490, test_f1: 0.4973
 epoch: 79, train_loss: 0.9226, test_loss: 0.9501, test_f1: 0.4978
 epoch: 80, train_loss: 0.9235, test_loss: 0.9486, test_f1: 0.5031
 epoch: 81, train_loss: 0.9156, test_loss: 0.9492, test_f1: 0.5067
 epoch: 82, train_loss: 0.9218, test_loss: 0.9489, test_f1: 0.4926
 epoch: 83, train_loss: 0.9210, test_loss: 0.9508, test_f1: 0.4970
 epoch: 84, train_loss: 0.9213, test_loss: 0.9473, test_f1: 0.4867
 epoch: 85, train_loss: 0.9217, test_loss: 0.9511, test_f1: 0.4924
 epoch: 86, train_loss: 0.9189, test_loss: 0.9479, test_f1: 0.4922
 epoch: 87, train_loss: 0.9196, test_loss: 0.9473, test_f1: 0.4847
 epoch: 88, train_loss: 0.9169, test_loss: 0.9492, test_f1: 0.4849
 epoch: 89, train_loss: 0.9109, test_loss: 0.9473, test_f1: 0.4894
 epoch: 90, train_loss: 0.9141, test_loss: 0.9496, test_f1: 0.5115
 epoch: 91, train_loss: 0.9122, test_loss: 0.9473, test_f1: 0.4971
 epoch: 92, train_loss: 0.9058, test_loss: 0.9460, test_f1: 0.4951
 epoch: 93, train_loss: 0.9125, test_loss: 0.9469, test_f1: 0.4924
 epoch: 94, train_loss: 0.9047, test_loss: 0.9479, test_f1: 0.4921
 epoch: 95, train_loss: 0.9032, test_loss: 0.9494, test_f1: 0.5050
 epoch: 96, train_loss: 0.9205, test_loss: 0.9468, test_f1: 0.5060
 epoch: 97, train_loss: 0.9041, test_loss: 0.9462, test_f1: 0.5101
 epoch: 98, train_loss: 0.9085, test_loss: 0.9483, test_f1: 0.5038
 epoch: 99, train_loss: 0.9056, test_loss: 0.9463, test_f1: 0.5031

Training completed in 398.69 seconds
Best F1: 0.5341 at epoch 82
Mean F1 across iterations: 0.5114  0.0106
========================FINAL RESULTS================================
FEGIN weighted F1: 0.5341  0.0106
python main.py --data ltspice_examples --representation component_net --model FEGIN --layers 4 --hiddens 32 --batch_size 256 --lr 0.0001 --emb_size 512 --epochs 100 --save_appendix component_net_L4_H32_BS256_LR0.0001_E512 --no_val
-----



STDERR:
  File "main.py", line 370, in <module>
    main()
  File "main.py", line 254, in main
    dataset = dataset_class(
  File "/home/philip/projects/ltspice_examples_code_repo/Circuit-Completion-Using-GNNs/component_classification_with_link_prediction_head/evaluation/FEGIN/kernel/circuit_datasets.py", line 15, in __init__
    self.data, self.slices = torch.load(self.processed_paths[0])
  File "/home/philip/.local/lib/python3.8/site-packages/torch/serialization.py", line 1040, in load
    warnings.warn(
  File "/usr/lib/python3.8/warnings.py", line 109, in _showwarnmsg
    sw(msg.message, msg.category, msg.filename, msg.lineno,
  File "main.py", line 47, in warn_with_traceback
    traceback.print_stack(file=log)
/home/philip/projects/ltspice_examples_code_repo/Circuit-Completion-Using-GNNs/component_classification_with_link_prediction_head/evaluation/FEGIN/kernel/circuit_datasets.py:15: FutureWarning: You are using `torch.load` with `weights_only=False` (the current default value), which uses the default pickle module implicitly. It is possible to construct malicious pickle data which will execute arbitrary code during unpickling (See https://github.com/pytorch/pytorch/blob/main/SECURITY.md#untrusted-models for more details). In a future release, the default value for `weights_only` will be flipped to `True`. This limits the functions that could be executed during unpickling. Arbitrary objects will no longer be allowed to be loaded via this mode unless they are explicitly allowlisted by the user via `torch.serialization.add_safe_globals`. We recommend you start setting `weights_only=True` for any use case where you don't have full control of the loaded file. Please open an issue on GitHub for any issues related to this experimental feature.
  self.data, self.slices = torch.load(self.processed_paths[0])
