STDOUT:
Results will be saved in /home/philip/projects/ltspice_examples_code_repo/Circuit-Completion-Using-GNNs/component_classification_with_link_prediction_head/evaluation/FEGIN/results/model_FEGIN_dataset_ltspice_demos
Command line input: python main.py --data ltspice_demos --representation component_component --model FEGIN --layers 5 --hiddens 32 --batch_size 64 --lr 0.01 --emb_size 250 --epochs 100 --save_appendix component_component_L5_H32_BS64_LR0.01_E250 --no_val
 is saved.
-----
ltspice_demos - FEGIN
Using 5 layers, 32 hidden units, h = 2
Loading component_component representation dataset
ENTERED
Training FEGIN on component_component representation
Train: 1565, Test: 383
##################ITERATION #0 ****************************************
 epoch: 0, train_loss: 1.2540, test_loss: 1.3780, test_f1: 0.3083
 epoch: 1, train_loss: 1.1814, test_loss: 1.2472, test_f1: 0.3206
 epoch: 2, train_loss: 1.1197, test_loss: 1.2682, test_f1: 0.3825
 epoch: 3, train_loss: 1.0960, test_loss: 1.1712, test_f1: 0.4056
 epoch: 4, train_loss: 1.0557, test_loss: 1.0942, test_f1: 0.5341
 epoch: 5, train_loss: 1.0058, test_loss: 1.1122, test_f1: 0.4996
 epoch: 6, train_loss: 0.9650, test_loss: 1.1266, test_f1: 0.4569
 epoch: 7, train_loss: 0.9845, test_loss: 1.0132, test_f1: 0.5172
 epoch: 8, train_loss: 0.9356, test_loss: 1.1539, test_f1: 0.5167
 epoch: 9, train_loss: 0.9163, test_loss: 1.2120, test_f1: 0.4862
 epoch: 10, train_loss: 0.9211, test_loss: 1.0215, test_f1: 0.5036
 epoch: 11, train_loss: 0.8791, test_loss: 1.4952, test_f1: 0.3875
 epoch: 12, train_loss: 0.8830, test_loss: 1.1241, test_f1: 0.4527
 epoch: 13, train_loss: 0.8802, test_loss: 1.1614, test_f1: 0.4754
 epoch: 14, train_loss: 0.8762, test_loss: 1.3682, test_f1: 0.4704
 epoch: 15, train_loss: 0.8535, test_loss: 0.9799, test_f1: 0.5614
 epoch: 16, train_loss: 0.8206, test_loss: 1.1046, test_f1: 0.4253
 epoch: 17, train_loss: 0.8466, test_loss: 0.9750, test_f1: 0.6069
 epoch: 18, train_loss: 0.8755, test_loss: 2.0533, test_f1: 0.2550
 epoch: 19, train_loss: 0.8914, test_loss: 1.2873, test_f1: 0.4992
 epoch: 20, train_loss: 0.8584, test_loss: 1.0564, test_f1: 0.4645
 epoch: 21, train_loss: 0.8295, test_loss: 1.3986, test_f1: 0.5179
 epoch: 22, train_loss: 0.8086, test_loss: 1.8072, test_f1: 0.5044
 epoch: 23, train_loss: 0.7909, test_loss: 2.1511, test_f1: 0.4293
 epoch: 24, train_loss: 0.8302, test_loss: 1.0874, test_f1: 0.4975
 epoch: 25, train_loss: 0.8224, test_loss: 1.9790, test_f1: 0.4510
 epoch: 26, train_loss: 0.8271, test_loss: 1.2467, test_f1: 0.5101
 epoch: 27, train_loss: 0.8270, test_loss: 1.2619, test_f1: 0.5050
 epoch: 28, train_loss: 0.8051, test_loss: 1.0773, test_f1: 0.5148
 epoch: 29, train_loss: 0.7800, test_loss: 1.0616, test_f1: 0.5211
 epoch: 30, train_loss: 0.7850, test_loss: 1.2196, test_f1: 0.5505
 epoch: 31, train_loss: 0.7793, test_loss: 1.5687, test_f1: 0.4342
 epoch: 32, train_loss: 0.7592, test_loss: 1.5119, test_f1: 0.5187
 epoch: 33, train_loss: 0.7537, test_loss: 1.2237, test_f1: 0.5710
 epoch: 34, train_loss: 0.7490, test_loss: 1.1773, test_f1: 0.5827
 epoch: 35, train_loss: 0.7464, test_loss: 1.4378, test_f1: 0.5916
 epoch: 36, train_loss: 0.7420, test_loss: 1.4532, test_f1: 0.5365
 epoch: 37, train_loss: 0.7232, test_loss: 1.3077, test_f1: 0.5575
 epoch: 38, train_loss: 0.7291, test_loss: 1.2920, test_f1: 0.5326
 epoch: 39, train_loss: 0.7231, test_loss: 1.1883, test_f1: 0.5711
 epoch: 40, train_loss: 0.7414, test_loss: 1.1043, test_f1: 0.5749
 epoch: 41, train_loss: 0.7194, test_loss: 1.3849, test_f1: 0.5738
 epoch: 42, train_loss: 0.6929, test_loss: 1.5183, test_f1: 0.5188
 epoch: 43, train_loss: 0.7285, test_loss: 1.1326, test_f1: 0.6347
 epoch: 44, train_loss: 0.7149, test_loss: 1.6545, test_f1: 0.5588
 epoch: 45, train_loss: 0.7071, test_loss: 1.0614, test_f1: 0.5671
 epoch: 46, train_loss: 0.6801, test_loss: 1.0616, test_f1: 0.5848
 epoch: 47, train_loss: 0.6845, test_loss: 1.0992, test_f1: 0.6210
 epoch: 48, train_loss: 0.7181, test_loss: 1.0631, test_f1: 0.5834
 epoch: 49, train_loss: 0.6899, test_loss: 1.1807, test_f1: 0.6425
 epoch: 50, train_loss: 0.6893, test_loss: 1.7141, test_f1: 0.5206
 epoch: 51, train_loss: 0.6514, test_loss: 1.2827, test_f1: 0.6052
 epoch: 52, train_loss: 0.6099, test_loss: 1.2189, test_f1: 0.6048
 epoch: 53, train_loss: 0.6073, test_loss: 1.2900, test_f1: 0.5841
 epoch: 54, train_loss: 0.5997, test_loss: 1.2496, test_f1: 0.6034
 epoch: 55, train_loss: 0.5971, test_loss: 1.2998, test_f1: 0.5643
 epoch: 56, train_loss: 0.5873, test_loss: 1.3241, test_f1: 0.5928
 epoch: 57, train_loss: 0.5842, test_loss: 1.3012, test_f1: 0.6387
 epoch: 58, train_loss: 0.5808, test_loss: 1.3135, test_f1: 0.6148
 epoch: 59, train_loss: 0.5669, test_loss: 1.5701, test_f1: 0.5496
 epoch: 60, train_loss: 0.5735, test_loss: 1.4279, test_f1: 0.5894
 epoch: 61, train_loss: 0.5736, test_loss: 1.4101, test_f1: 0.5938
 epoch: 62, train_loss: 0.5759, test_loss: 1.3834, test_f1: 0.6183
 epoch: 63, train_loss: 0.5523, test_loss: 1.4619, test_f1: 0.6046
 epoch: 64, train_loss: 0.5360, test_loss: 1.3508, test_f1: 0.6279
 epoch: 65, train_loss: 0.5420, test_loss: 1.6971, test_f1: 0.5488
 epoch: 66, train_loss: 0.5488, test_loss: 1.5463, test_f1: 0.5988
 epoch: 67, train_loss: 0.5408, test_loss: 1.3001, test_f1: 0.6184
 epoch: 68, train_loss: 0.5350, test_loss: 1.5286, test_f1: 0.5931
 epoch: 69, train_loss: 0.5246, test_loss: 1.5528, test_f1: 0.5831
 epoch: 70, train_loss: 0.5585, test_loss: 1.4041, test_f1: 0.6428
 epoch: 71, train_loss: 0.5171, test_loss: 1.9061, test_f1: 0.5583
 epoch: 72, train_loss: 0.5356, test_loss: 1.4961, test_f1: 0.6123
 epoch: 73, train_loss: 0.5496, test_loss: 1.4868, test_f1: 0.6036
 epoch: 74, train_loss: 0.5158, test_loss: 1.6201, test_f1: 0.5641
 epoch: 75, train_loss: 0.4959, test_loss: 1.5965, test_f1: 0.5864
 epoch: 76, train_loss: 0.5084, test_loss: 2.1471, test_f1: 0.5387
 epoch: 77, train_loss: 0.4995, test_loss: 1.6205, test_f1: 0.6093
 epoch: 78, train_loss: 0.5003, test_loss: 1.6511, test_f1: 0.6156
 epoch: 79, train_loss: 0.4842, test_loss: 1.6933, test_f1: 0.5812
 epoch: 80, train_loss: 0.5199, test_loss: 1.6653, test_f1: 0.6176
 epoch: 81, train_loss: 0.5161, test_loss: 1.5300, test_f1: 0.6033
 epoch: 82, train_loss: 0.5017, test_loss: 1.7118, test_f1: 0.5904
 epoch: 83, train_loss: 0.4836, test_loss: 1.8139, test_f1: 0.5672
 epoch: 84, train_loss: 0.4577, test_loss: 1.8955, test_f1: 0.6008
 epoch: 85, train_loss: 0.4972, test_loss: 1.5299, test_f1: 0.5975
 epoch: 86, train_loss: 0.5034, test_loss: 1.5345, test_f1: 0.5915
 epoch: 87, train_loss: 0.4825, test_loss: 1.6166, test_f1: 0.5777
 epoch: 88, train_loss: 0.4988, test_loss: 1.4371, test_f1: 0.6095
 epoch: 89, train_loss: 0.4847, test_loss: 1.7361, test_f1: 0.5463
 epoch: 90, train_loss: 0.4829, test_loss: 1.6103, test_f1: 0.5968
 epoch: 91, train_loss: 0.5231, test_loss: 1.7040, test_f1: 0.5174
 epoch: 92, train_loss: 0.4769, test_loss: 1.7145, test_f1: 0.5834
 epoch: 93, train_loss: 0.4592, test_loss: 1.5165, test_f1: 0.6219
 epoch: 94, train_loss: 0.4319, test_loss: 1.5153, test_f1: 0.6106
 epoch: 95, train_loss: 0.4453, test_loss: 1.7503, test_f1: 0.5900
 epoch: 96, train_loss: 0.4583, test_loss: 1.5923, test_f1: 0.6204
 epoch: 97, train_loss: 0.4780, test_loss: 1.8370, test_f1: 0.5325
 epoch: 98, train_loss: 0.4657, test_loss: 1.6288, test_f1: 0.6077
 epoch: 99, train_loss: 0.4626, test_loss: 1.6560, test_f1: 0.5659
##################ITERATION #1 ****************************************
 epoch: 0, train_loss: 1.2607, test_loss: 1.3201, test_f1: 0.2003
 epoch: 1, train_loss: 1.1863, test_loss: 1.2445, test_f1: 0.2740
 epoch: 2, train_loss: 1.1052, test_loss: 1.2908, test_f1: 0.3711
 epoch: 3, train_loss: 1.0791, test_loss: 1.2406, test_f1: 0.3717
 epoch: 4, train_loss: 1.0380, test_loss: 1.2414, test_f1: 0.4336
 epoch: 5, train_loss: 0.9760, test_loss: 1.1501, test_f1: 0.5079
 epoch: 6, train_loss: 0.9798, test_loss: 1.6842, test_f1: 0.3302
 epoch: 7, train_loss: 0.9497, test_loss: 1.1827, test_f1: 0.4775
 epoch: 8, train_loss: 0.9587, test_loss: 1.1864, test_f1: 0.4241
 epoch: 9, train_loss: 0.9281, test_loss: 1.1480, test_f1: 0.5242
 epoch: 10, train_loss: 0.9052, test_loss: 1.1097, test_f1: 0.4891
 epoch: 11, train_loss: 0.9084, test_loss: 1.0687, test_f1: 0.5259
 epoch: 12, train_loss: 0.8895, test_loss: 1.0456, test_f1: 0.5288
 epoch: 13, train_loss: 0.9138, test_loss: 1.1210, test_f1: 0.5107
 epoch: 14, train_loss: 0.8934, test_loss: 1.2335, test_f1: 0.4650
 epoch: 15, train_loss: 0.8845, test_loss: 1.0656, test_f1: 0.5526
 epoch: 16, train_loss: 0.8745, test_loss: 1.1315, test_f1: 0.5403
 epoch: 17, train_loss: 0.8668, test_loss: 1.0501, test_f1: 0.5698
 epoch: 18, train_loss: 0.8963, test_loss: 1.0271, test_f1: 0.5211
 epoch: 19, train_loss: 0.8639, test_loss: 1.1425, test_f1: 0.5644
 epoch: 20, train_loss: 0.8787, test_loss: 1.0978, test_f1: 0.5451
 epoch: 21, train_loss: 0.8579, test_loss: 1.0949, test_f1: 0.5154
 epoch: 22, train_loss: 0.8374, test_loss: 0.9819, test_f1: 0.5645
 epoch: 23, train_loss: 0.8228, test_loss: 1.0225, test_f1: 0.5569
 epoch: 24, train_loss: 0.8288, test_loss: 1.0122, test_f1: 0.5800
 epoch: 25, train_loss: 0.8090, test_loss: 1.0268, test_f1: 0.5838
 epoch: 26, train_loss: 0.8050, test_loss: 1.0812, test_f1: 0.5790
 epoch: 27, train_loss: 0.8417, test_loss: 1.1689, test_f1: 0.4750
 epoch: 28, train_loss: 0.8179, test_loss: 1.0669, test_f1: 0.5704
 epoch: 29, train_loss: 0.8080, test_loss: 1.0985, test_f1: 0.5882
 epoch: 30, train_loss: 0.8009, test_loss: 1.0667, test_f1: 0.5997
 epoch: 31, train_loss: 0.7785, test_loss: 1.0679, test_f1: 0.5553
 epoch: 32, train_loss: 0.7925, test_loss: 1.2364, test_f1: 0.4744
 epoch: 33, train_loss: 0.8008, test_loss: 1.0580, test_f1: 0.5569
 epoch: 34, train_loss: 0.7914, test_loss: 1.0706, test_f1: 0.5503
 epoch: 35, train_loss: 0.8066, test_loss: 1.0630, test_f1: 0.5712
 epoch: 36, train_loss: 0.7911, test_loss: 1.3661, test_f1: 0.5282
 epoch: 37, train_loss: 0.7596, test_loss: 1.0974, test_f1: 0.5670
 epoch: 38, train_loss: 0.7671, test_loss: 1.1756, test_f1: 0.5413
 epoch: 39, train_loss: 0.7840, test_loss: 1.2202, test_f1: 0.5289
 epoch: 40, train_loss: 0.7528, test_loss: 1.8029, test_f1: 0.5814
 epoch: 41, train_loss: 0.7626, test_loss: 1.1801, test_f1: 0.5476
 epoch: 42, train_loss: 0.7549, test_loss: 1.1913, test_f1: 0.5422
 epoch: 43, train_loss: 0.7745, test_loss: 1.2228, test_f1: 0.5468
 epoch: 44, train_loss: 0.7457, test_loss: 1.0990, test_f1: 0.5457
 epoch: 45, train_loss: 0.7720, test_loss: 1.1356, test_f1: 0.5930
 epoch: 46, train_loss: 0.7629, test_loss: 1.2255, test_f1: 0.5202
 epoch: 47, train_loss: 0.7461, test_loss: 1.1035, test_f1: 0.5898
 epoch: 48, train_loss: 0.7282, test_loss: 1.1460, test_f1: 0.5967
 epoch: 49, train_loss: 0.7075, test_loss: 1.3296, test_f1: 0.5501
 epoch: 50, train_loss: 0.7419, test_loss: 1.3282, test_f1: 0.5202
 epoch: 51, train_loss: 0.7112, test_loss: 1.1704, test_f1: 0.5891
 epoch: 52, train_loss: 0.7152, test_loss: 1.1307, test_f1: 0.6104
 epoch: 53, train_loss: 0.6737, test_loss: 1.2043, test_f1: 0.6092
 epoch: 54, train_loss: 0.6796, test_loss: 1.2016, test_f1: 0.5897
 epoch: 55, train_loss: 0.6807, test_loss: 1.1699, test_f1: 0.5913
 epoch: 56, train_loss: 0.6589, test_loss: 1.2638, test_f1: 0.5972
 epoch: 57, train_loss: 0.6764, test_loss: 1.2849, test_f1: 0.5590
 epoch: 58, train_loss: 0.6597, test_loss: 1.2054, test_f1: 0.6075
 epoch: 59, train_loss: 0.6491, test_loss: 1.3309, test_f1: 0.5630
 epoch: 60, train_loss: 0.6623, test_loss: 1.3495, test_f1: 0.5702
 epoch: 61, train_loss: 0.6610, test_loss: 1.3458, test_f1: 0.5784
 epoch: 62, train_loss: 0.6434, test_loss: 1.2758, test_f1: 0.6003
 epoch: 63, train_loss: 0.6160, test_loss: 1.2092, test_f1: 0.5948
 epoch: 64, train_loss: 0.6186, test_loss: 1.3910, test_f1: 0.6037
 epoch: 65, train_loss: 0.6121, test_loss: 1.2660, test_f1: 0.5989
 epoch: 66, train_loss: 0.6416, test_loss: 1.3102, test_f1: 0.5983
 epoch: 67, train_loss: 0.6428, test_loss: 1.2018, test_f1: 0.6121
 epoch: 68, train_loss: 0.6101, test_loss: 1.3446, test_f1: 0.6184
 epoch: 69, train_loss: 0.6349, test_loss: 1.4455, test_f1: 0.5338
 epoch: 70, train_loss: 0.6339, test_loss: 1.5276, test_f1: 0.6178
 epoch: 71, train_loss: 0.6059, test_loss: 1.2642, test_f1: 0.5907
 epoch: 72, train_loss: 0.5982, test_loss: 1.3446, test_f1: 0.5782
 epoch: 73, train_loss: 0.6044, test_loss: 1.5375, test_f1: 0.5833
 epoch: 74, train_loss: 0.6198, test_loss: 1.2478, test_f1: 0.6023
 epoch: 75, train_loss: 0.5856, test_loss: 1.4661, test_f1: 0.5715
 epoch: 76, train_loss: 0.6049, test_loss: 1.4742, test_f1: 0.5975
 epoch: 77, train_loss: 0.6097, test_loss: 1.3935, test_f1: 0.6017
 epoch: 78, train_loss: 0.5900, test_loss: 1.6136, test_f1: 0.5919
 epoch: 79, train_loss: 0.5817, test_loss: 1.2506, test_f1: 0.6368
 epoch: 80, train_loss: 0.5803, test_loss: 1.3754, test_f1: 0.5946
 epoch: 81, train_loss: 0.5883, test_loss: 1.4934, test_f1: 0.6003
 epoch: 82, train_loss: 0.5878, test_loss: 1.4753, test_f1: 0.6186
 epoch: 83, train_loss: 0.5903, test_loss: 1.2017, test_f1: 0.6025
 epoch: 84, train_loss: 0.6011, test_loss: 1.3770, test_f1: 0.5783
 epoch: 85, train_loss: 0.5705, test_loss: 1.3720, test_f1: 0.5700
 epoch: 86, train_loss: 0.5706, test_loss: 1.5985, test_f1: 0.5790
 epoch: 87, train_loss: 0.5377, test_loss: 1.6284, test_f1: 0.5745
 epoch: 88, train_loss: 0.5489, test_loss: 1.4040, test_f1: 0.6111
 epoch: 89, train_loss: 0.5510, test_loss: 1.6205, test_f1: 0.5699
 epoch: 90, train_loss: 0.5846, test_loss: 1.9689, test_f1: 0.5865
 epoch: 91, train_loss: 0.5752, test_loss: 1.2939, test_f1: 0.6101
 epoch: 92, train_loss: 0.5514, test_loss: 1.2679, test_f1: 0.6129
 epoch: 93, train_loss: 0.5267, test_loss: 1.4102, test_f1: 0.5757
 epoch: 94, train_loss: 0.5633, test_loss: 1.2698, test_f1: 0.6275
 epoch: 95, train_loss: 0.5412, test_loss: 1.2953, test_f1: 0.6342
 epoch: 96, train_loss: 0.5122, test_loss: 1.3428, test_f1: 0.6292
 epoch: 97, train_loss: 0.5325, test_loss: 1.4818, test_f1: 0.5977
 epoch: 98, train_loss: 0.5018, test_loss: 1.4968, test_f1: 0.5962
 epoch: 99, train_loss: 0.5225, test_loss: 1.4071, test_f1: 0.5958
##################ITERATION #2 ****************************************
 epoch: 0, train_loss: 1.3004, test_loss: 1.2733, test_f1: 0.3380
 epoch: 1, train_loss: 1.1746, test_loss: 1.1994, test_f1: 0.4036
 epoch: 2, train_loss: 1.1173, test_loss: 1.1892, test_f1: 0.4505
 epoch: 3, train_loss: 1.1240, test_loss: 1.1932, test_f1: 0.4432
 epoch: 4, train_loss: 1.0688, test_loss: 1.2206, test_f1: 0.3335
 epoch: 5, train_loss: 1.0273, test_loss: 1.2309, test_f1: 0.4318
 epoch: 6, train_loss: 1.0145, test_loss: 1.1517, test_f1: 0.5149
 epoch: 7, train_loss: 1.0018, test_loss: 1.1247, test_f1: 0.4446
 epoch: 8, train_loss: 1.0089, test_loss: 1.1588, test_f1: 0.4799
 epoch: 9, train_loss: 0.9590, test_loss: 1.0811, test_f1: 0.4235
 epoch: 10, train_loss: 0.9479, test_loss: 1.0815, test_f1: 0.5119
 epoch: 11, train_loss: 0.9087, test_loss: 1.0979, test_f1: 0.5195
 epoch: 12, train_loss: 0.9203, test_loss: 1.0326, test_f1: 0.4474
 epoch: 13, train_loss: 0.9254, test_loss: 1.0825, test_f1: 0.4587
 epoch: 14, train_loss: 0.8995, test_loss: 1.0446, test_f1: 0.5618
 epoch: 15, train_loss: 0.8700, test_loss: 0.9995, test_f1: 0.5470
 epoch: 16, train_loss: 0.8882, test_loss: 1.0058, test_f1: 0.4919
 epoch: 17, train_loss: 0.9026, test_loss: 0.9872, test_f1: 0.5660
 epoch: 18, train_loss: 0.8406, test_loss: 1.0259, test_f1: 0.5744
 epoch: 19, train_loss: 0.8372, test_loss: 0.9875, test_f1: 0.5770
 epoch: 20, train_loss: 0.8434, test_loss: 1.0265, test_f1: 0.5521
 epoch: 21, train_loss: 0.8281, test_loss: 1.0494, test_f1: 0.5479
 epoch: 22, train_loss: 0.8103, test_loss: 0.9912, test_f1: 0.5728
 epoch: 23, train_loss: 0.8029, test_loss: 1.3340, test_f1: 0.4495
 epoch: 24, train_loss: 0.8000, test_loss: 1.0673, test_f1: 0.5659
 epoch: 25, train_loss: 0.7968, test_loss: 1.2019, test_f1: 0.5012
 epoch: 26, train_loss: 0.8019, test_loss: 1.4041, test_f1: 0.4760
 epoch: 27, train_loss: 0.7881, test_loss: 1.1215, test_f1: 0.4875
 epoch: 28, train_loss: 0.8093, test_loss: 1.0462, test_f1: 0.5388
 epoch: 29, train_loss: 0.7788, test_loss: 1.1654, test_f1: 0.5263
 epoch: 30, train_loss: 0.7669, test_loss: 1.0428, test_f1: 0.5425
 epoch: 31, train_loss: 0.7817, test_loss: 1.0098, test_f1: 0.6012
 epoch: 32, train_loss: 0.8307, test_loss: 1.0397, test_f1: 0.5613
 epoch: 33, train_loss: 0.8034, test_loss: 1.2720, test_f1: 0.4731
 epoch: 34, train_loss: 0.7718, test_loss: 1.0171, test_f1: 0.5698
 epoch: 35, train_loss: 0.7485, test_loss: 1.0683, test_f1: 0.5337
 epoch: 36, train_loss: 0.7456, test_loss: 1.0834, test_f1: 0.5956
 epoch: 37, train_loss: 0.7422, test_loss: 1.2959, test_f1: 0.4966
 epoch: 38, train_loss: 0.7861, test_loss: 1.0105, test_f1: 0.6242
 epoch: 39, train_loss: 0.7270, test_loss: 1.2074, test_f1: 0.5355
 epoch: 40, train_loss: 0.7596, test_loss: 1.2448, test_f1: 0.5695
 epoch: 41, train_loss: 0.7481, test_loss: 1.0896, test_f1: 0.5956
 epoch: 42, train_loss: 0.7532, test_loss: 1.1838, test_f1: 0.5269
 epoch: 43, train_loss: 0.7227, test_loss: 1.2628, test_f1: 0.5818
 epoch: 44, train_loss: 0.7186, test_loss: 1.1976, test_f1: 0.5943
 epoch: 45, train_loss: 0.7179, test_loss: 1.4427, test_f1: 0.4933
 epoch: 46, train_loss: 0.7223, test_loss: 1.1736, test_f1: 0.6129
 epoch: 47, train_loss: 0.7341, test_loss: 1.1998, test_f1: 0.5541
 epoch: 48, train_loss: 0.7399, test_loss: 1.1981, test_f1: 0.5394
 epoch: 49, train_loss: 0.7276, test_loss: 1.0243, test_f1: 0.5945
 epoch: 50, train_loss: 0.7081, test_loss: 1.3410, test_f1: 0.6156
 epoch: 51, train_loss: 0.6888, test_loss: 1.2384, test_f1: 0.5953
 epoch: 52, train_loss: 0.6547, test_loss: 1.1331, test_f1: 0.6038
 epoch: 53, train_loss: 0.6471, test_loss: 1.1662, test_f1: 0.6451
 epoch: 54, train_loss: 0.6521, test_loss: 1.2613, test_f1: 0.5554
 epoch: 55, train_loss: 0.6475, test_loss: 1.1725, test_f1: 0.5735
 epoch: 56, train_loss: 0.6359, test_loss: 1.2132, test_f1: 0.6080
 epoch: 57, train_loss: 0.6268, test_loss: 1.4323, test_f1: 0.5854
 epoch: 58, train_loss: 0.6345, test_loss: 1.2939, test_f1: 0.5942
 epoch: 59, train_loss: 0.6383, test_loss: 1.1734, test_f1: 0.6402
 epoch: 60, train_loss: 0.6382, test_loss: 1.2846, test_f1: 0.6119
 epoch: 61, train_loss: 0.6487, test_loss: 1.3183, test_f1: 0.6187
 epoch: 62, train_loss: 0.6335, test_loss: 1.5480, test_f1: 0.5234
 epoch: 63, train_loss: 0.6319, test_loss: 1.2718, test_f1: 0.6215
 epoch: 64, train_loss: 0.6014, test_loss: 1.3942, test_f1: 0.5694
 epoch: 65, train_loss: 0.6096, test_loss: 1.4569, test_f1: 0.5930
 epoch: 66, train_loss: 0.6270, test_loss: 1.4287, test_f1: 0.5884
 epoch: 67, train_loss: 0.6006, test_loss: 1.3426, test_f1: 0.5894
 epoch: 68, train_loss: 0.5997, test_loss: 1.6037, test_f1: 0.5596
 epoch: 69, train_loss: 0.5949, test_loss: 1.4576, test_f1: 0.5873
 epoch: 70, train_loss: 0.5728, test_loss: 1.6449, test_f1: 0.5464
 epoch: 71, train_loss: 0.6104, test_loss: 1.5090, test_f1: 0.6077
 epoch: 72, train_loss: 0.6066, test_loss: 1.5416, test_f1: 0.5934
 epoch: 73, train_loss: 0.5890, test_loss: 1.4757, test_f1: 0.5868
 epoch: 74, train_loss: 0.5843, test_loss: 1.5668, test_f1: 0.5618
 epoch: 75, train_loss: 0.5924, test_loss: 1.7261, test_f1: 0.5742
 epoch: 76, train_loss: 0.5800, test_loss: 1.7529, test_f1: 0.5445
 epoch: 77, train_loss: 0.5738, test_loss: 1.5292, test_f1: 0.6121
 epoch: 78, train_loss: 0.5835, test_loss: 1.5519, test_f1: 0.5997
 epoch: 79, train_loss: 0.6054, test_loss: 1.5913, test_f1: 0.5719
 epoch: 80, train_loss: 0.5778, test_loss: 1.3589, test_f1: 0.5748
 epoch: 81, train_loss: 0.5848, test_loss: 1.5024, test_f1: 0.5386
 epoch: 82, train_loss: 0.5487, test_loss: 1.5231, test_f1: 0.5724
 epoch: 83, train_loss: 0.5615, test_loss: 1.5565, test_f1: 0.5611
 epoch: 84, train_loss: 0.5444, test_loss: 1.4471, test_f1: 0.5923
 epoch: 85, train_loss: 0.5374, test_loss: 1.6585, test_f1: 0.5803
 epoch: 86, train_loss: 0.5450, test_loss: 1.5702, test_f1: 0.5877
 epoch: 87, train_loss: 0.5667, test_loss: 1.7759, test_f1: 0.5920
 epoch: 88, train_loss: 0.5577, test_loss: 1.8211, test_f1: 0.5420
 epoch: 89, train_loss: 0.5447, test_loss: 1.6248, test_f1: 0.6037
 epoch: 90, train_loss: 0.5442, test_loss: 1.7048, test_f1: 0.5779
 epoch: 91, train_loss: 0.5546, test_loss: 1.5664, test_f1: 0.6094
 epoch: 92, train_loss: 0.5565, test_loss: 1.5736, test_f1: 0.5677
 epoch: 93, train_loss: 0.5371, test_loss: 1.5227, test_f1: 0.5839
 epoch: 94, train_loss: 0.5758, test_loss: 1.3949, test_f1: 0.5847
 epoch: 95, train_loss: 0.5521, test_loss: 1.4649, test_f1: 0.6028
 epoch: 96, train_loss: 0.5611, test_loss: 1.4704, test_f1: 0.5915
 epoch: 97, train_loss: 0.5670, test_loss: 1.5063, test_f1: 0.5443
 epoch: 98, train_loss: 0.5441, test_loss: 1.5535, test_f1: 0.5774
 epoch: 99, train_loss: 0.5178, test_loss: 1.6288, test_f1: 0.5759
##################ITERATION #3 ****************************************
 epoch: 0, train_loss: 1.2543, test_loss: 1.2634, test_f1: 0.3548
 epoch: 1, train_loss: 1.1757, test_loss: 1.2085, test_f1: 0.3971
 epoch: 2, train_loss: 1.1277, test_loss: 1.1880, test_f1: 0.4268
 epoch: 3, train_loss: 1.1084, test_loss: 1.2006, test_f1: 0.4314
 epoch: 4, train_loss: 1.0729, test_loss: 1.2249, test_f1: 0.3281
 epoch: 5, train_loss: 1.0659, test_loss: 1.1499, test_f1: 0.4488
 epoch: 6, train_loss: 1.0646, test_loss: 1.1981, test_f1: 0.4302
 epoch: 7, train_loss: 1.0473, test_loss: 1.1472, test_f1: 0.4108
 epoch: 8, train_loss: 1.0153, test_loss: 1.1660, test_f1: 0.4165
 epoch: 9, train_loss: 1.0276, test_loss: 1.1465, test_f1: 0.4593
 epoch: 10, train_loss: 1.0063, test_loss: 1.1647, test_f1: 0.4366
 epoch: 11, train_loss: 0.9664, test_loss: 1.1238, test_f1: 0.4468
 epoch: 12, train_loss: 0.9260, test_loss: 1.0758, test_f1: 0.4608
 epoch: 13, train_loss: 0.9143, test_loss: 1.0916, test_f1: 0.4912
 epoch: 14, train_loss: 0.9172, test_loss: 1.0186, test_f1: 0.4842
 epoch: 15, train_loss: 0.9124, test_loss: 1.2030, test_f1: 0.3947
 epoch: 16, train_loss: 0.8844, test_loss: 1.0872, test_f1: 0.5372
 epoch: 17, train_loss: 0.9037, test_loss: 1.0116, test_f1: 0.5607
 epoch: 18, train_loss: 0.8605, test_loss: 1.0752, test_f1: 0.5727
 epoch: 19, train_loss: 0.8438, test_loss: 1.0152, test_f1: 0.5725
 epoch: 20, train_loss: 0.9308, test_loss: 1.1371, test_f1: 0.4872
 epoch: 21, train_loss: 0.8800, test_loss: 1.1236, test_f1: 0.5477
 epoch: 22, train_loss: 0.8642, test_loss: 1.0454, test_f1: 0.4749
 epoch: 23, train_loss: 0.8530, test_loss: 1.0281, test_f1: 0.5340
 epoch: 24, train_loss: 0.8634, test_loss: 1.1142, test_f1: 0.5146
 epoch: 25, train_loss: 0.8331, test_loss: 1.1717, test_f1: 0.5584
 epoch: 26, train_loss: 0.8107, test_loss: 1.0196, test_f1: 0.5911
 epoch: 27, train_loss: 0.8184, test_loss: 1.0091, test_f1: 0.5566
 epoch: 28, train_loss: 0.8280, test_loss: 1.0380, test_f1: 0.5345
 epoch: 29, train_loss: 0.8212, test_loss: 1.0178, test_f1: 0.5736
 epoch: 30, train_loss: 0.7930, test_loss: 1.0138, test_f1: 0.5456
 epoch: 31, train_loss: 0.8154, test_loss: 1.1597, test_f1: 0.5522
 epoch: 32, train_loss: 0.8198, test_loss: 1.0421, test_f1: 0.6094
 epoch: 33, train_loss: 0.8039, test_loss: 1.0754, test_f1: 0.5600
 epoch: 34, train_loss: 0.7851, test_loss: 1.0203, test_f1: 0.5887
 epoch: 35, train_loss: 0.7816, test_loss: 1.0133, test_f1: 0.5830
 epoch: 36, train_loss: 0.8236, test_loss: 1.0657, test_f1: 0.5750
 epoch: 37, train_loss: 0.8031, test_loss: 1.0153, test_f1: 0.5818
 epoch: 38, train_loss: 0.7731, test_loss: 1.1109, test_f1: 0.5625
 epoch: 39, train_loss: 0.8211, test_loss: 1.1828, test_f1: 0.5349
 epoch: 40, train_loss: 0.7970, test_loss: 1.2935, test_f1: 0.5444
 epoch: 41, train_loss: 0.7860, test_loss: 1.0676, test_f1: 0.5791
 epoch: 42, train_loss: 0.7592, test_loss: 1.2171, test_f1: 0.5301
 epoch: 43, train_loss: 0.7627, test_loss: 1.0766, test_f1: 0.5968
 epoch: 44, train_loss: 0.7425, test_loss: 1.1206, test_f1: 0.5717
 epoch: 45, train_loss: 0.7287, test_loss: 1.1319, test_f1: 0.5996
 epoch: 46, train_loss: 0.7476, test_loss: 1.2294, test_f1: 0.6399
 epoch: 47, train_loss: 0.7747, test_loss: 1.0795, test_f1: 0.5948
 epoch: 48, train_loss: 0.7749, test_loss: 1.1447, test_f1: 0.5541
 epoch: 49, train_loss: 0.7344, test_loss: 1.2257, test_f1: 0.5950
 epoch: 50, train_loss: 0.7296, test_loss: 1.2160, test_f1: 0.5717
 epoch: 51, train_loss: 0.6887, test_loss: 1.1047, test_f1: 0.5965
 epoch: 52, train_loss: 0.6857, test_loss: 1.3146, test_f1: 0.5544
 epoch: 53, train_loss: 0.6669, test_loss: 1.0786, test_f1: 0.6060
 epoch: 54, train_loss: 0.6771, test_loss: 1.2435, test_f1: 0.5716
 epoch: 55, train_loss: 0.6759, test_loss: 1.0762, test_f1: 0.6526
 epoch: 56, train_loss: 0.6618, test_loss: 1.3086, test_f1: 0.5624
 epoch: 57, train_loss: 0.6588, test_loss: 1.2251, test_f1: 0.5999
 epoch: 58, train_loss: 0.7134, test_loss: 1.2136, test_f1: 0.6165
 epoch: 59, train_loss: 0.6679, test_loss: 1.2652, test_f1: 0.5861
 epoch: 60, train_loss: 0.6644, test_loss: 1.3335, test_f1: 0.5720
 epoch: 61, train_loss: 0.6674, test_loss: 1.3115, test_f1: 0.6058
 epoch: 62, train_loss: 0.6577, test_loss: 1.3078, test_f1: 0.5960
 epoch: 63, train_loss: 0.6382, test_loss: 1.4276, test_f1: 0.5424
 epoch: 64, train_loss: 0.6074, test_loss: 1.6044, test_f1: 0.6018
 epoch: 65, train_loss: 0.6454, test_loss: 1.5442, test_f1: 0.5634
 epoch: 66, train_loss: 0.6262, test_loss: 1.3788, test_f1: 0.5904
 epoch: 67, train_loss: 0.6176, test_loss: 1.5384, test_f1: 0.5721
 epoch: 68, train_loss: 0.6159, test_loss: 1.2344, test_f1: 0.6077
 epoch: 69, train_loss: 0.6148, test_loss: 1.4699, test_f1: 0.5885
 epoch: 70, train_loss: 0.6064, test_loss: 1.2329, test_f1: 0.5584
 epoch: 71, train_loss: 0.6054, test_loss: 1.4703, test_f1: 0.6062
 epoch: 72, train_loss: 0.6275, test_loss: 1.5102, test_f1: 0.5823
 epoch: 73, train_loss: 0.6210, test_loss: 1.3855, test_f1: 0.5555
 epoch: 74, train_loss: 0.6092, test_loss: 1.3842, test_f1: 0.5916
 epoch: 75, train_loss: 0.6195, test_loss: 1.6412, test_f1: 0.5906
 epoch: 76, train_loss: 0.5764, test_loss: 1.2860, test_f1: 0.6074
 epoch: 77, train_loss: 0.5796, test_loss: 1.5112, test_f1: 0.5855
 epoch: 78, train_loss: 0.5938, test_loss: 1.3440, test_f1: 0.6081
 epoch: 79, train_loss: 0.6053, test_loss: 1.5022, test_f1: 0.5639
 epoch: 80, train_loss: 0.5631, test_loss: 1.5584, test_f1: 0.5928
 epoch: 81, train_loss: 0.5679, test_loss: 1.5970, test_f1: 0.5579
 epoch: 82, train_loss: 0.5748, test_loss: 1.5062, test_f1: 0.5734
 epoch: 83, train_loss: 0.5553, test_loss: 1.3445, test_f1: 0.6087
 epoch: 84, train_loss: 0.5487, test_loss: 1.4145, test_f1: 0.6171
 epoch: 85, train_loss: 0.5743, test_loss: 1.3926, test_f1: 0.5665
 epoch: 86, train_loss: 0.5676, test_loss: 1.5675, test_f1: 0.5528
 epoch: 87, train_loss: 0.5645, test_loss: 1.5156, test_f1: 0.6059
 epoch: 88, train_loss: 0.5736, test_loss: 1.5102, test_f1: 0.6027
 epoch: 89, train_loss: 0.5669, test_loss: 1.7087, test_f1: 0.5645
 epoch: 90, train_loss: 0.5530, test_loss: 1.7293, test_f1: 0.5497
 epoch: 91, train_loss: 0.5443, test_loss: 1.3313, test_f1: 0.5952
 epoch: 92, train_loss: 0.5779, test_loss: 1.2619, test_f1: 0.5760
 epoch: 93, train_loss: 0.5511, test_loss: 1.4688, test_f1: 0.6096
 epoch: 94, train_loss: 0.5640, test_loss: 1.6579, test_f1: 0.5743
 epoch: 95, train_loss: 0.5469, test_loss: 1.7105, test_f1: 0.5894
 epoch: 96, train_loss: 0.5776, test_loss: 1.4938, test_f1: 0.5773
 epoch: 97, train_loss: 0.6126, test_loss: 1.5925, test_f1: 0.5445
 epoch: 98, train_loss: 0.5410, test_loss: 1.8661, test_f1: 0.5641
 epoch: 99, train_loss: 0.5247, test_loss: 1.4930, test_f1: 0.6042
##################ITERATION #4 ****************************************
 epoch: 0, train_loss: 1.3170, test_loss: 1.2838, test_f1: 0.3241
 epoch: 1, train_loss: 1.2160, test_loss: 1.2867, test_f1: 0.3539
 epoch: 2, train_loss: 1.1881, test_loss: 1.2243, test_f1: 0.4003
 epoch: 3, train_loss: 1.1465, test_loss: 1.3620, test_f1: 0.3631
 epoch: 4, train_loss: 1.1150, test_loss: 1.1675, test_f1: 0.3485
 epoch: 5, train_loss: 1.0645, test_loss: 1.2695, test_f1: 0.3874
 epoch: 6, train_loss: 1.1120, test_loss: 1.1938, test_f1: 0.4151
 epoch: 7, train_loss: 1.0278, test_loss: 1.2351, test_f1: 0.4078
 epoch: 8, train_loss: 0.9939, test_loss: 1.1858, test_f1: 0.4032
 epoch: 9, train_loss: 0.9542, test_loss: 1.0916, test_f1: 0.5660
 epoch: 10, train_loss: 0.9306, test_loss: 1.1701, test_f1: 0.4218
 epoch: 11, train_loss: 0.9261, test_loss: 1.1343, test_f1: 0.5378
 epoch: 12, train_loss: 0.9034, test_loss: 1.4542, test_f1: 0.4062
 epoch: 13, train_loss: 0.8710, test_loss: 1.6841, test_f1: 0.3922
 epoch: 14, train_loss: 0.9240, test_loss: 1.0101, test_f1: 0.4740
 epoch: 15, train_loss: 0.9077, test_loss: 1.5561, test_f1: 0.4000
 epoch: 16, train_loss: 0.8847, test_loss: 1.0090, test_f1: 0.5596
 epoch: 17, train_loss: 0.8506, test_loss: 1.0603, test_f1: 0.4151
 epoch: 18, train_loss: 0.8472, test_loss: 1.0237, test_f1: 0.4936
 epoch: 19, train_loss: 0.8590, test_loss: 1.0099, test_f1: 0.5904
 epoch: 20, train_loss: 0.8410, test_loss: 1.2075, test_f1: 0.5029
 epoch: 21, train_loss: 0.8296, test_loss: 1.0174, test_f1: 0.5547
 epoch: 22, train_loss: 0.8324, test_loss: 1.0970, test_f1: 0.5695
 epoch: 23, train_loss: 0.8318, test_loss: 1.2588, test_f1: 0.4394
 epoch: 24, train_loss: 0.8524, test_loss: 1.0633, test_f1: 0.5529
 epoch: 25, train_loss: 0.8430, test_loss: 1.0151, test_f1: 0.5992
 epoch: 26, train_loss: 0.8012, test_loss: 1.0155, test_f1: 0.6045
 epoch: 27, train_loss: 0.8470, test_loss: 0.9948, test_f1: 0.5693
 epoch: 28, train_loss: 0.8070, test_loss: 0.9848, test_f1: 0.6130
 epoch: 29, train_loss: 0.8016, test_loss: 0.9856, test_f1: 0.5755
 epoch: 30, train_loss: 0.7649, test_loss: 1.0400, test_f1: 0.5562
 epoch: 31, train_loss: 0.7945, test_loss: 1.1832, test_f1: 0.5241
 epoch: 32, train_loss: 0.8065, test_loss: 0.9556, test_f1: 0.5572
 epoch: 33, train_loss: 0.7549, test_loss: 0.9750, test_f1: 0.6108
 epoch: 34, train_loss: 0.7632, test_loss: 1.0478, test_f1: 0.5918
 epoch: 35, train_loss: 0.7691, test_loss: 1.0045, test_f1: 0.5886
 epoch: 36, train_loss: 0.7709, test_loss: 1.5962, test_f1: 0.4561
 epoch: 37, train_loss: 0.7688, test_loss: 1.0011, test_f1: 0.5878
 epoch: 38, train_loss: 0.7489, test_loss: 1.4085, test_f1: 0.5638
 epoch: 39, train_loss: 0.7724, test_loss: 1.4559, test_f1: 0.4805
 epoch: 40, train_loss: 0.7405, test_loss: 1.0253, test_f1: 0.5123
 epoch: 41, train_loss: 0.7321, test_loss: 1.2107, test_f1: 0.5756
 epoch: 42, train_loss: 0.7755, test_loss: 1.3493, test_f1: 0.5474
 epoch: 43, train_loss: 0.7360, test_loss: 1.1175, test_f1: 0.5258
 epoch: 44, train_loss: 0.7631, test_loss: 1.1621, test_f1: 0.5553
 epoch: 45, train_loss: 0.7558, test_loss: 1.0076, test_f1: 0.6037
 epoch: 46, train_loss: 0.7225, test_loss: 1.1639, test_f1: 0.6037
 epoch: 47, train_loss: 0.7147, test_loss: 1.1414, test_f1: 0.5457
 epoch: 48, train_loss: 0.7106, test_loss: 1.3433, test_f1: 0.5227
 epoch: 49, train_loss: 0.7387, test_loss: 1.3636, test_f1: 0.5616
 epoch: 50, train_loss: 0.6952, test_loss: 1.1499, test_f1: 0.5754
 epoch: 51, train_loss: 0.7369, test_loss: 1.1981, test_f1: 0.6047
 epoch: 52, train_loss: 0.6696, test_loss: 1.1152, test_f1: 0.6144
 epoch: 53, train_loss: 0.6720, test_loss: 1.0611, test_f1: 0.5500
 epoch: 54, train_loss: 0.6588, test_loss: 1.1983, test_f1: 0.5918
 epoch: 55, train_loss: 0.6586, test_loss: 1.1140, test_f1: 0.6039
 epoch: 56, train_loss: 0.6339, test_loss: 1.2556, test_f1: 0.6005
 epoch: 57, train_loss: 0.6319, test_loss: 1.1376, test_f1: 0.6097
 epoch: 58, train_loss: 0.6217, test_loss: 1.2138, test_f1: 0.5771
 epoch: 59, train_loss: 0.6215, test_loss: 1.2496, test_f1: 0.6223
 epoch: 60, train_loss: 0.6085, test_loss: 1.2240, test_f1: 0.6028
 epoch: 61, train_loss: 0.6275, test_loss: 1.1469, test_f1: 0.6117
 epoch: 62, train_loss: 0.6385, test_loss: 1.1279, test_f1: 0.5830
 epoch: 63, train_loss: 0.6161, test_loss: 1.0323, test_f1: 0.6322
 epoch: 64, train_loss: 0.6336, test_loss: 1.2423, test_f1: 0.6122
 epoch: 65, train_loss: 0.6332, test_loss: 1.1949, test_f1: 0.5941
 epoch: 66, train_loss: 0.6676, test_loss: 1.6618, test_f1: 0.4605
 epoch: 67, train_loss: 0.6282, test_loss: 1.2146, test_f1: 0.6067
 epoch: 68, train_loss: 0.6208, test_loss: 1.3266, test_f1: 0.5775
 epoch: 69, train_loss: 0.6107, test_loss: 1.1828, test_f1: 0.5701
 epoch: 70, train_loss: 0.6120, test_loss: 1.1926, test_f1: 0.5949
 epoch: 71, train_loss: 0.5935, test_loss: 1.2269, test_f1: 0.5841
 epoch: 72, train_loss: 0.5921, test_loss: 1.1148, test_f1: 0.6196
 epoch: 73, train_loss: 0.6061, test_loss: 1.1829, test_f1: 0.5874
 epoch: 74, train_loss: 0.6165, test_loss: 1.8338, test_f1: 0.4889
 epoch: 75, train_loss: 0.5801, test_loss: 1.3391, test_f1: 0.6290
 epoch: 76, train_loss: 0.6073, test_loss: 1.1563, test_f1: 0.6020
 epoch: 77, train_loss: 0.5952, test_loss: 1.3034, test_f1: 0.5551
 epoch: 78, train_loss: 0.5874, test_loss: 1.1171, test_f1: 0.6029
 epoch: 79, train_loss: 0.6184, test_loss: 1.1799, test_f1: 0.6159
 epoch: 80, train_loss: 0.6060, test_loss: 1.2214, test_f1: 0.5994
 epoch: 81, train_loss: 0.5903, test_loss: 1.3074, test_f1: 0.6020
 epoch: 82, train_loss: 0.5939, test_loss: 1.2072, test_f1: 0.6325
 epoch: 83, train_loss: 0.5788, test_loss: 1.3903, test_f1: 0.5837
 epoch: 84, train_loss: 0.5842, test_loss: 1.0329, test_f1: 0.5999
 epoch: 85, train_loss: 0.5885, test_loss: 1.2331, test_f1: 0.5520
 epoch: 86, train_loss: 0.5751, test_loss: 1.3510, test_f1: 0.6035
 epoch: 87, train_loss: 0.5729, test_loss: 1.3802, test_f1: 0.5572
 epoch: 88, train_loss: 0.5916, test_loss: 1.3201, test_f1: 0.6268
 epoch: 89, train_loss: 0.5788, test_loss: 1.3442, test_f1: 0.6098
 epoch: 90, train_loss: 0.5844, test_loss: 1.1960, test_f1: 0.5781
 epoch: 91, train_loss: 0.5696, test_loss: 1.2223, test_f1: 0.5976
 epoch: 92, train_loss: 0.5730, test_loss: 1.1989, test_f1: 0.6170
 epoch: 93, train_loss: 0.5701, test_loss: 1.4471, test_f1: 0.5690
 epoch: 94, train_loss: 0.5696, test_loss: 1.1969, test_f1: 0.6434
 epoch: 95, train_loss: 0.5756, test_loss: 1.3266, test_f1: 0.6050
 epoch: 96, train_loss: 0.5577, test_loss: 1.3168, test_f1: 0.6282
 epoch: 97, train_loss: 0.5362, test_loss: 1.2859, test_f1: 0.6447
 epoch: 98, train_loss: 0.5605, test_loss: 1.3507, test_f1: 0.5807
 epoch: 99, train_loss: 0.5436, test_loss: 1.3032, test_f1: 0.5743
##################ITERATION #5 ****************************************
 epoch: 0, train_loss: 1.2969, test_loss: 1.3110, test_f1: 0.3304
 epoch: 1, train_loss: 1.2121, test_loss: 1.2801, test_f1: 0.3567
 epoch: 2, train_loss: 1.1634, test_loss: 1.2287, test_f1: 0.4067
 epoch: 3, train_loss: 1.1061, test_loss: 1.1940, test_f1: 0.4266
 epoch: 4, train_loss: 1.0682, test_loss: 1.2167, test_f1: 0.4042
 epoch: 5, train_loss: 1.0855, test_loss: 1.1769, test_f1: 0.4717
 epoch: 6, train_loss: 1.0234, test_loss: 1.1260, test_f1: 0.4210
 epoch: 7, train_loss: 0.9942, test_loss: 1.5454, test_f1: 0.4305
 epoch: 8, train_loss: 0.9567, test_loss: 1.1525, test_f1: 0.4698
 epoch: 9, train_loss: 0.9578, test_loss: 1.2214, test_f1: 0.4311
 epoch: 10, train_loss: 0.9575, test_loss: 1.3387, test_f1: 0.3511
 epoch: 11, train_loss: 0.9627, test_loss: 1.3359, test_f1: 0.3799
 epoch: 12, train_loss: 0.9101, test_loss: 1.2152, test_f1: 0.4892
 epoch: 13, train_loss: 0.9294, test_loss: 1.2063, test_f1: 0.4313
 epoch: 14, train_loss: 0.9383, test_loss: 1.1677, test_f1: 0.3770
 epoch: 15, train_loss: 0.8924, test_loss: 1.2714, test_f1: 0.4856
 epoch: 16, train_loss: 0.9245, test_loss: 1.0928, test_f1: 0.4598
 epoch: 17, train_loss: 0.8760, test_loss: 1.2090, test_f1: 0.4463
 epoch: 18, train_loss: 0.9149, test_loss: 1.1124, test_f1: 0.4452
 epoch: 19, train_loss: 0.8924, test_loss: 1.0515, test_f1: 0.4913
 epoch: 20, train_loss: 0.8795, test_loss: 1.0583, test_f1: 0.5213
 epoch: 21, train_loss: 0.8614, test_loss: 1.1027, test_f1: 0.5136
 epoch: 22, train_loss: 0.8551, test_loss: 1.1443, test_f1: 0.5179
 epoch: 23, train_loss: 0.8443, test_loss: 1.4926, test_f1: 0.3671
 epoch: 24, train_loss: 0.8371, test_loss: 1.0359, test_f1: 0.5258
 epoch: 25, train_loss: 0.8455, test_loss: 1.1268, test_f1: 0.5106
 epoch: 26, train_loss: 0.8298, test_loss: 1.1291, test_f1: 0.5150
 epoch: 27, train_loss: 0.8120, test_loss: 1.2023, test_f1: 0.5060
 epoch: 28, train_loss: 0.8392, test_loss: 1.2288, test_f1: 0.4524
 epoch: 29, train_loss: 0.8524, test_loss: 1.1837, test_f1: 0.4625
 epoch: 30, train_loss: 0.8125, test_loss: 1.1456, test_f1: 0.5263
 epoch: 31, train_loss: 0.8095, test_loss: 1.1728, test_f1: 0.5107
 epoch: 32, train_loss: 0.8103, test_loss: 1.0885, test_f1: 0.5403
 epoch: 33, train_loss: 0.8184, test_loss: 1.1251, test_f1: 0.5089
 epoch: 34, train_loss: 0.8181, test_loss: 1.2599, test_f1: 0.4508
 epoch: 35, train_loss: 0.7909, test_loss: 1.1920, test_f1: 0.4942
 epoch: 36, train_loss: 0.8039, test_loss: 1.1096, test_f1: 0.5282
 epoch: 37, train_loss: 0.7851, test_loss: 1.4123, test_f1: 0.4909
 epoch: 38, train_loss: 0.8127, test_loss: 1.1430, test_f1: 0.4889
 epoch: 39, train_loss: 0.7957, test_loss: 1.2284, test_f1: 0.5300
 epoch: 40, train_loss: 0.7685, test_loss: 1.1737, test_f1: 0.5271
 epoch: 41, train_loss: 0.7954, test_loss: 1.1347, test_f1: 0.5281
 epoch: 42, train_loss: 0.7750, test_loss: 1.2058, test_f1: 0.5460
 epoch: 43, train_loss: 0.7581, test_loss: 1.3278, test_f1: 0.5421
 epoch: 44, train_loss: 0.8022, test_loss: 1.2512, test_f1: 0.5496
 epoch: 45, train_loss: 0.8222, test_loss: 1.1779, test_f1: 0.5294
 epoch: 46, train_loss: 0.8072, test_loss: 1.1035, test_f1: 0.5451
 epoch: 47, train_loss: 0.7726, test_loss: 1.2212, test_f1: 0.4972
 epoch: 48, train_loss: 0.7632, test_loss: 1.3617, test_f1: 0.5543
 epoch: 49, train_loss: 0.7804, test_loss: 1.1558, test_f1: 0.5616
 epoch: 50, train_loss: 0.7693, test_loss: 1.1950, test_f1: 0.5558
 epoch: 51, train_loss: 0.7421, test_loss: 1.1599, test_f1: 0.5608
 epoch: 52, train_loss: 0.7160, test_loss: 1.1237, test_f1: 0.5706
 epoch: 53, train_loss: 0.7135, test_loss: 1.4218, test_f1: 0.4881
 epoch: 54, train_loss: 0.7270, test_loss: 1.3620, test_f1: 0.5048
 epoch: 55, train_loss: 0.7029, test_loss: 1.2252, test_f1: 0.5468
 epoch: 56, train_loss: 0.6976, test_loss: 1.3214, test_f1: 0.5137
 epoch: 57, train_loss: 0.7074, test_loss: 1.3005, test_f1: 0.5371
 epoch: 58, train_loss: 0.7096, test_loss: 2.0346, test_f1: 0.4315
 epoch: 59, train_loss: 0.7229, test_loss: 1.1886, test_f1: 0.5256
 epoch: 60, train_loss: 0.6923, test_loss: 1.2310, test_f1: 0.6052
 epoch: 61, train_loss: 0.6929, test_loss: 1.2622, test_f1: 0.5550
 epoch: 62, train_loss: 0.6927, test_loss: 1.4521, test_f1: 0.5074
 epoch: 63, train_loss: 0.6635, test_loss: 1.3639, test_f1: 0.5266
 epoch: 64, train_loss: 0.6785, test_loss: 1.3521, test_f1: 0.5658
 epoch: 65, train_loss: 0.6760, test_loss: 1.4176, test_f1: 0.5430
 epoch: 66, train_loss: 0.6822, test_loss: 1.3646, test_f1: 0.5490
 epoch: 67, train_loss: 0.6807, test_loss: 1.5990, test_f1: 0.5100
 epoch: 68, train_loss: 0.6448, test_loss: 1.8030, test_f1: 0.5156
 epoch: 69, train_loss: 0.6580, test_loss: 1.4939, test_f1: 0.4662
 epoch: 70, train_loss: 0.6822, test_loss: 1.2167, test_f1: 0.5532
 epoch: 71, train_loss: 0.6709, test_loss: 1.1949, test_f1: 0.5575
 epoch: 72, train_loss: 0.6517, test_loss: 1.5113, test_f1: 0.5947
 epoch: 73, train_loss: 0.6421, test_loss: 1.4667, test_f1: 0.5667
 epoch: 74, train_loss: 0.6650, test_loss: 1.4160, test_f1: 0.5215
 epoch: 75, train_loss: 0.6556, test_loss: 1.5436, test_f1: 0.5725
 epoch: 76, train_loss: 0.6415, test_loss: 1.2766, test_f1: 0.5693
 epoch: 77, train_loss: 0.6252, test_loss: 1.5425, test_f1: 0.5828
 epoch: 78, train_loss: 0.6450, test_loss: 1.8055, test_f1: 0.5022
 epoch: 79, train_loss: 0.6420, test_loss: 1.4593, test_f1: 0.5819
 epoch: 80, train_loss: 0.6667, test_loss: 1.7573, test_f1: 0.5504
 epoch: 81, train_loss: 0.6457, test_loss: 1.4884, test_f1: 0.5617
 epoch: 82, train_loss: 0.6418, test_loss: 1.4703, test_f1: 0.5743
 epoch: 83, train_loss: 0.6128, test_loss: 1.4715, test_f1: 0.5406
 epoch: 84, train_loss: 0.6233, test_loss: 1.5417, test_f1: 0.5509
 epoch: 85, train_loss: 0.6185, test_loss: 1.3189, test_f1: 0.5531
 epoch: 86, train_loss: 0.6397, test_loss: 1.2736, test_f1: 0.5758
 epoch: 87, train_loss: 0.6320, test_loss: 1.4492, test_f1: 0.5755
 epoch: 88, train_loss: 0.6189, test_loss: 1.5246, test_f1: 0.6124
 epoch: 89, train_loss: 0.5966, test_loss: 1.4258, test_f1: 0.6181
 epoch: 90, train_loss: 0.5953, test_loss: 1.4301, test_f1: 0.5902
 epoch: 91, train_loss: 0.5887, test_loss: 1.4365, test_f1: 0.5362
 epoch: 92, train_loss: 0.6074, test_loss: 1.3754, test_f1: 0.6098
 epoch: 93, train_loss: 0.5958, test_loss: 1.3750, test_f1: 0.6095
 epoch: 94, train_loss: 0.6076, test_loss: 1.4311, test_f1: 0.5604
 epoch: 95, train_loss: 0.6141, test_loss: 1.3491, test_f1: 0.6133
 epoch: 96, train_loss: 0.5908, test_loss: 1.2576, test_f1: 0.5915
 epoch: 97, train_loss: 0.6041, test_loss: 1.4620, test_f1: 0.6109
 epoch: 98, train_loss: 0.5990, test_loss: 1.5104, test_f1: 0.5969
 epoch: 99, train_loss: 0.6011, test_loss: 1.4348, test_f1: 0.6339
##################ITERATION #6 ****************************************
 epoch: 0, train_loss: 1.3090, test_loss: 1.3133, test_f1: 0.2336
 epoch: 1, train_loss: 1.2201, test_loss: 1.2383, test_f1: 0.3566
 epoch: 2, train_loss: 1.1718, test_loss: 1.2230, test_f1: 0.2830
 epoch: 3, train_loss: 1.1376, test_loss: 1.2123, test_f1: 0.4399
 epoch: 4, train_loss: 1.0834, test_loss: 1.2529, test_f1: 0.3139
 epoch: 5, train_loss: 1.0710, test_loss: 1.3751, test_f1: 0.3375
 epoch: 6, train_loss: 1.0468, test_loss: 1.2954, test_f1: 0.4452
 epoch: 7, train_loss: 1.0196, test_loss: 1.2436, test_f1: 0.4750
 epoch: 8, train_loss: 0.9662, test_loss: 1.2313, test_f1: 0.4342
 epoch: 9, train_loss: 0.9599, test_loss: 1.2417, test_f1: 0.4233
 epoch: 10, train_loss: 0.9504, test_loss: 1.3400, test_f1: 0.4105
 epoch: 11, train_loss: 0.9474, test_loss: 1.0671, test_f1: 0.5154
 epoch: 12, train_loss: 0.9151, test_loss: 1.0663, test_f1: 0.5196
 epoch: 13, train_loss: 0.9236, test_loss: 1.0995, test_f1: 0.4522
 epoch: 14, train_loss: 0.9224, test_loss: 1.2571, test_f1: 0.4854
 epoch: 15, train_loss: 0.8985, test_loss: 1.2081, test_f1: 0.4816
 epoch: 16, train_loss: 0.8760, test_loss: 1.7945, test_f1: 0.3861
 epoch: 17, train_loss: 0.8681, test_loss: 1.0533, test_f1: 0.4738
 epoch: 18, train_loss: 0.8698, test_loss: 1.0315, test_f1: 0.4968
 epoch: 19, train_loss: 0.8479, test_loss: 1.0780, test_f1: 0.5009
 epoch: 20, train_loss: 0.8357, test_loss: 1.1885, test_f1: 0.4379
 epoch: 21, train_loss: 0.8450, test_loss: 1.1232, test_f1: 0.4899
 epoch: 22, train_loss: 0.8500, test_loss: 1.0710, test_f1: 0.4982
 epoch: 23, train_loss: 0.8315, test_loss: 1.2031, test_f1: 0.4901
 epoch: 24, train_loss: 0.8172, test_loss: 1.1954, test_f1: 0.4935
 epoch: 25, train_loss: 0.8439, test_loss: 1.0660, test_f1: 0.5025
 epoch: 26, train_loss: 0.8332, test_loss: 1.0222, test_f1: 0.5364
 epoch: 27, train_loss: 0.8180, test_loss: 1.0545, test_f1: 0.5589
 epoch: 28, train_loss: 0.8312, test_loss: 1.8889, test_f1: 0.3522
 epoch: 29, train_loss: 0.8254, test_loss: 1.3522, test_f1: 0.5422
 epoch: 30, train_loss: 0.8164, test_loss: 1.1592, test_f1: 0.5000
 epoch: 31, train_loss: 0.7912, test_loss: 1.2265, test_f1: 0.4455
 epoch: 32, train_loss: 0.8069, test_loss: 1.7827, test_f1: 0.3655
 epoch: 33, train_loss: 0.8107, test_loss: 1.2433, test_f1: 0.5040
 epoch: 34, train_loss: 0.7920, test_loss: 1.2268, test_f1: 0.5037
 epoch: 35, train_loss: 0.7906, test_loss: 1.1807, test_f1: 0.5142
 epoch: 36, train_loss: 0.8087, test_loss: 1.1664, test_f1: 0.5406
 epoch: 37, train_loss: 0.7679, test_loss: 1.1902, test_f1: 0.5320
 epoch: 38, train_loss: 0.7669, test_loss: 1.2072, test_f1: 0.4852
 epoch: 39, train_loss: 0.7714, test_loss: 1.1674, test_f1: 0.4968
 epoch: 40, train_loss: 0.7873, test_loss: 1.3082, test_f1: 0.5495
 epoch: 41, train_loss: 0.7656, test_loss: 1.1941, test_f1: 0.5661
 epoch: 42, train_loss: 0.7826, test_loss: 1.1126, test_f1: 0.5657
 epoch: 43, train_loss: 0.7614, test_loss: 1.1477, test_f1: 0.5284
 epoch: 44, train_loss: 0.7796, test_loss: 1.2415, test_f1: 0.5403
 epoch: 45, train_loss: 0.7584, test_loss: 1.1395, test_f1: 0.5507
 epoch: 46, train_loss: 0.7554, test_loss: 1.3417, test_f1: 0.5228
 epoch: 47, train_loss: 0.7537, test_loss: 1.3883, test_f1: 0.5891
 epoch: 48, train_loss: 0.7502, test_loss: 1.3782, test_f1: 0.4916
 epoch: 49, train_loss: 0.7380, test_loss: 1.5046, test_f1: 0.5245
 epoch: 50, train_loss: 0.7745, test_loss: 1.3087, test_f1: 0.5524
 epoch: 51, train_loss: 0.7384, test_loss: 1.2246, test_f1: 0.5087
 epoch: 52, train_loss: 0.7188, test_loss: 1.1500, test_f1: 0.5458
 epoch: 53, train_loss: 0.6944, test_loss: 1.2351, test_f1: 0.5383
 epoch: 54, train_loss: 0.7132, test_loss: 1.1517, test_f1: 0.5596
 epoch: 55, train_loss: 0.6842, test_loss: 1.2203, test_f1: 0.5438
 epoch: 56, train_loss: 0.6747, test_loss: 1.2882, test_f1: 0.5469
 epoch: 57, train_loss: 0.6905, test_loss: 1.2282, test_f1: 0.5793
 epoch: 58, train_loss: 0.6923, test_loss: 1.2670, test_f1: 0.5520
 epoch: 59, train_loss: 0.6780, test_loss: 1.3354, test_f1: 0.5538
 epoch: 60, train_loss: 0.6761, test_loss: 1.3599, test_f1: 0.5605
 epoch: 61, train_loss: 0.6959, test_loss: 1.3353, test_f1: 0.5607
 epoch: 62, train_loss: 0.6662, test_loss: 1.2721, test_f1: 0.5748
 epoch: 63, train_loss: 0.6763, test_loss: 1.2807, test_f1: 0.5579
 epoch: 64, train_loss: 0.6678, test_loss: 1.3397, test_f1: 0.5596
 epoch: 65, train_loss: 0.6830, test_loss: 1.2161, test_f1: 0.5975
 epoch: 66, train_loss: 0.6771, test_loss: 1.5052, test_f1: 0.5503
 epoch: 67, train_loss: 0.6618, test_loss: 1.4043, test_f1: 0.5454
 epoch: 68, train_loss: 0.6755, test_loss: 1.4574, test_f1: 0.5747
 epoch: 69, train_loss: 0.6509, test_loss: 1.6073, test_f1: 0.5351
 epoch: 70, train_loss: 0.6576, test_loss: 1.6156, test_f1: 0.5549
 epoch: 71, train_loss: 0.6604, test_loss: 1.3457, test_f1: 0.5761
 epoch: 72, train_loss: 0.6490, test_loss: 1.3649, test_f1: 0.6070
 epoch: 73, train_loss: 0.6328, test_loss: 1.6840, test_f1: 0.5396
 epoch: 74, train_loss: 0.6532, test_loss: 1.4082, test_f1: 0.6175
 epoch: 75, train_loss: 0.6417, test_loss: 1.5259, test_f1: 0.5331
 epoch: 76, train_loss: 0.6325, test_loss: 1.5509, test_f1: 0.5649
 epoch: 77, train_loss: 0.6247, test_loss: 1.5684, test_f1: 0.5641
 epoch: 78, train_loss: 0.6473, test_loss: 1.5419, test_f1: 0.4870
 epoch: 79, train_loss: 0.6587, test_loss: 1.2817, test_f1: 0.6150
 epoch: 80, train_loss: 0.6341, test_loss: 1.5128, test_f1: 0.5339
 epoch: 81, train_loss: 0.6290, test_loss: 1.4810, test_f1: 0.6140
 epoch: 82, train_loss: 0.6299, test_loss: 1.5815, test_f1: 0.6050
 epoch: 83, train_loss: 0.6193, test_loss: 1.7407, test_f1: 0.5320
 epoch: 84, train_loss: 0.6703, test_loss: 1.3407, test_f1: 0.6219
 epoch: 85, train_loss: 0.6381, test_loss: 1.3322, test_f1: 0.5841
 epoch: 86, train_loss: 0.6236, test_loss: 1.4150, test_f1: 0.5988
 epoch: 87, train_loss: 0.6257, test_loss: 1.6489, test_f1: 0.5290
 epoch: 88, train_loss: 0.6062, test_loss: 1.5746, test_f1: 0.6422
 epoch: 89, train_loss: 0.6078, test_loss: 1.4305, test_f1: 0.6263
 epoch: 90, train_loss: 0.6151, test_loss: 1.2733, test_f1: 0.6817
 epoch: 91, train_loss: 0.5943, test_loss: 1.4130, test_f1: 0.6830
 epoch: 92, train_loss: 0.5967, test_loss: 1.4958, test_f1: 0.6003
 epoch: 93, train_loss: 0.6079, test_loss: 1.5329, test_f1: 0.5212
 epoch: 94, train_loss: 0.6422, test_loss: 1.5171, test_f1: 0.5834
 epoch: 95, train_loss: 0.6389, test_loss: 1.4031, test_f1: 0.5486
 epoch: 96, train_loss: 0.5926, test_loss: 1.5609, test_f1: 0.5245
 epoch: 97, train_loss: 0.6010, test_loss: 1.3191, test_f1: 0.6133
 epoch: 98, train_loss: 0.6058, test_loss: 1.5665, test_f1: 0.5668
 epoch: 99, train_loss: 0.5953, test_loss: 1.4411, test_f1: 0.5270
##################ITERATION #7 ****************************************
 epoch: 0, train_loss: 1.2767, test_loss: 1.2767, test_f1: 0.3235
 epoch: 1, train_loss: 1.1933, test_loss: 1.2317, test_f1: 0.3780
 epoch: 2, train_loss: 1.1524, test_loss: 1.2381, test_f1: 0.4426
 epoch: 3, train_loss: 1.0932, test_loss: 1.2147, test_f1: 0.4385
 epoch: 4, train_loss: 1.0418, test_loss: 1.2290, test_f1: 0.4388
 epoch: 5, train_loss: 1.0404, test_loss: 1.1038, test_f1: 0.4923
 epoch: 6, train_loss: 0.9728, test_loss: 1.0955, test_f1: 0.4175
 epoch: 7, train_loss: 0.9528, test_loss: 1.1494, test_f1: 0.4846
 epoch: 8, train_loss: 0.9611, test_loss: 1.0978, test_f1: 0.4379
 epoch: 9, train_loss: 0.9253, test_loss: 1.0851, test_f1: 0.4133
 epoch: 10, train_loss: 0.8995, test_loss: 1.2342, test_f1: 0.4640
 epoch: 11, train_loss: 0.9087, test_loss: 1.0841, test_f1: 0.4083
 epoch: 12, train_loss: 0.9182, test_loss: 1.0664, test_f1: 0.5372
 epoch: 13, train_loss: 0.8888, test_loss: 1.0390, test_f1: 0.4947
 epoch: 14, train_loss: 0.8984, test_loss: 1.0283, test_f1: 0.5323
 epoch: 15, train_loss: 0.9350, test_loss: 1.0843, test_f1: 0.4958
 epoch: 16, train_loss: 0.8948, test_loss: 1.0104, test_f1: 0.4243
 epoch: 17, train_loss: 0.8698, test_loss: 0.9923, test_f1: 0.5077
 epoch: 18, train_loss: 0.8609, test_loss: 0.9737, test_f1: 0.5737
 epoch: 19, train_loss: 0.8718, test_loss: 1.1259, test_f1: 0.5147
 epoch: 20, train_loss: 0.8847, test_loss: 0.9679, test_f1: 0.4672
 epoch: 21, train_loss: 0.8601, test_loss: 1.1983, test_f1: 0.4704
 epoch: 22, train_loss: 0.8584, test_loss: 1.0436, test_f1: 0.5703
 epoch: 23, train_loss: 0.8510, test_loss: 1.0959, test_f1: 0.5492
 epoch: 24, train_loss: 0.8317, test_loss: 1.2312, test_f1: 0.5201
 epoch: 25, train_loss: 0.8089, test_loss: 1.2819, test_f1: 0.5251
 epoch: 26, train_loss: 0.8180, test_loss: 1.3160, test_f1: 0.5217
 epoch: 27, train_loss: 0.8274, test_loss: 1.2441, test_f1: 0.5572
 epoch: 28, train_loss: 0.8071, test_loss: 1.5654, test_f1: 0.5348
 epoch: 29, train_loss: 0.8166, test_loss: 1.2727, test_f1: 0.5148
 epoch: 30, train_loss: 0.8427, test_loss: 1.2904, test_f1: 0.5481
 epoch: 31, train_loss: 0.8240, test_loss: 1.2698, test_f1: 0.5691
 epoch: 32, train_loss: 0.8101, test_loss: 1.5262, test_f1: 0.5734
 epoch: 33, train_loss: 0.8099, test_loss: 1.2624, test_f1: 0.5198
 epoch: 34, train_loss: 0.8235, test_loss: 1.3972, test_f1: 0.5193
 epoch: 35, train_loss: 0.8681, test_loss: 1.2534, test_f1: 0.5338
 epoch: 36, train_loss: 0.8101, test_loss: 1.0951, test_f1: 0.5871
 epoch: 37, train_loss: 0.8077, test_loss: 1.1345, test_f1: 0.5367
 epoch: 38, train_loss: 0.8229, test_loss: 1.5486, test_f1: 0.4255
 epoch: 39, train_loss: 0.8016, test_loss: 1.0163, test_f1: 0.5815
 epoch: 40, train_loss: 0.7941, test_loss: 1.2734, test_f1: 0.5392
 epoch: 41, train_loss: 0.7854, test_loss: 1.4900, test_f1: 0.5614
 epoch: 42, train_loss: 0.7883, test_loss: 1.3306, test_f1: 0.5662
 epoch: 43, train_loss: 0.7910, test_loss: 1.2311, test_f1: 0.5555
 epoch: 44, train_loss: 0.7761, test_loss: 1.3096, test_f1: 0.5898
 epoch: 45, train_loss: 0.7604, test_loss: 1.2829, test_f1: 0.5684
 epoch: 46, train_loss: 0.7850, test_loss: 1.3170, test_f1: 0.5819
 epoch: 47, train_loss: 0.7905, test_loss: 1.0469, test_f1: 0.6021
 epoch: 48, train_loss: 0.7967, test_loss: 1.5455, test_f1: 0.5446
 epoch: 49, train_loss: 0.7774, test_loss: 1.2268, test_f1: 0.5719
 epoch: 50, train_loss: 0.7751, test_loss: 1.1942, test_f1: 0.5035
 epoch: 51, train_loss: 0.7755, test_loss: 1.3184, test_f1: 0.6094
 epoch: 52, train_loss: 0.7427, test_loss: 1.4764, test_f1: 0.5498
 epoch: 53, train_loss: 0.7400, test_loss: 1.3513, test_f1: 0.5926
 epoch: 54, train_loss: 0.7361, test_loss: 1.5018, test_f1: 0.5342
 epoch: 55, train_loss: 0.7373, test_loss: 1.2131, test_f1: 0.5858
 epoch: 56, train_loss: 0.7232, test_loss: 1.4945, test_f1: 0.5854
 epoch: 57, train_loss: 0.7325, test_loss: 1.2652, test_f1: 0.5741
 epoch: 58, train_loss: 0.6983, test_loss: 1.4855, test_f1: 0.5684
 epoch: 59, train_loss: 0.7059, test_loss: 1.5274, test_f1: 0.5906
 epoch: 60, train_loss: 0.7279, test_loss: 1.6644, test_f1: 0.5313
 epoch: 61, train_loss: 0.7028, test_loss: 1.4856, test_f1: 0.5935
 epoch: 62, train_loss: 0.7000, test_loss: 1.6826, test_f1: 0.5918
 epoch: 63, train_loss: 0.7014, test_loss: 1.6348, test_f1: 0.5972
 epoch: 64, train_loss: 0.7222, test_loss: 1.3214, test_f1: 0.6166
 epoch: 65, train_loss: 0.7059, test_loss: 1.2845, test_f1: 0.6089
 epoch: 66, train_loss: 0.6989, test_loss: 1.7463, test_f1: 0.5933
 epoch: 67, train_loss: 0.6816, test_loss: 1.3408, test_f1: 0.6154
 epoch: 68, train_loss: 0.7011, test_loss: 1.3638, test_f1: 0.5452
 epoch: 69, train_loss: 0.6885, test_loss: 1.4637, test_f1: 0.5818
 epoch: 70, train_loss: 0.7132, test_loss: 1.4239, test_f1: 0.6219
 epoch: 71, train_loss: 0.6919, test_loss: 1.3640, test_f1: 0.5809
 epoch: 72, train_loss: 0.6775, test_loss: 1.4001, test_f1: 0.5845
 epoch: 73, train_loss: 0.6754, test_loss: 1.7695, test_f1: 0.5679
 epoch: 74, train_loss: 0.6717, test_loss: 1.9948, test_f1: 0.5593
 epoch: 75, train_loss: 0.6847, test_loss: 1.4445, test_f1: 0.6056
 epoch: 76, train_loss: 0.6708, test_loss: 1.4940, test_f1: 0.6181
 epoch: 77, train_loss: 0.6520, test_loss: 1.7349, test_f1: 0.5944
 epoch: 78, train_loss: 0.6635, test_loss: 1.7503, test_f1: 0.5961
 epoch: 79, train_loss: 0.6417, test_loss: 1.7051, test_f1: 0.5955
 epoch: 80, train_loss: 0.6413, test_loss: 1.8515, test_f1: 0.5463
 epoch: 81, train_loss: 0.6394, test_loss: 1.4800, test_f1: 0.5912
 epoch: 82, train_loss: 0.6379, test_loss: 1.5867, test_f1: 0.5866
 epoch: 83, train_loss: 0.6282, test_loss: 1.7656, test_f1: 0.5872
 epoch: 84, train_loss: 0.6263, test_loss: 1.3306, test_f1: 0.5817
 epoch: 85, train_loss: 0.6460, test_loss: 1.5577, test_f1: 0.5974
 epoch: 86, train_loss: 0.6425, test_loss: 1.2880, test_f1: 0.6204
 epoch: 87, train_loss: 0.6316, test_loss: 1.4721, test_f1: 0.5716
 epoch: 88, train_loss: 0.6151, test_loss: 1.3306, test_f1: 0.5746
 epoch: 89, train_loss: 0.6286, test_loss: 1.3321, test_f1: 0.6021
 epoch: 90, train_loss: 0.6311, test_loss: 1.4048, test_f1: 0.5958
 epoch: 91, train_loss: 0.5952, test_loss: 1.7469, test_f1: 0.5928
 epoch: 92, train_loss: 0.6332, test_loss: 2.0291, test_f1: 0.5635
 epoch: 93, train_loss: 0.8032, test_loss: 1.3218, test_f1: 0.5753
 epoch: 94, train_loss: 0.7138, test_loss: 1.2528, test_f1: 0.6133
 epoch: 95, train_loss: 0.6325, test_loss: 1.6314, test_f1: 0.6078
 epoch: 96, train_loss: 0.6510, test_loss: 1.6694, test_f1: 0.5838
 epoch: 97, train_loss: 0.6618, test_loss: 1.8809, test_f1: 0.6127
 epoch: 98, train_loss: 0.6208, test_loss: 1.7040, test_f1: 0.5671
 epoch: 99, train_loss: 0.6136, test_loss: 1.3835, test_f1: 0.5943
##################ITERATION #8 ****************************************
 epoch: 0, train_loss: 1.3348, test_loss: 1.3075, test_f1: 0.2971
 epoch: 1, train_loss: 1.1847, test_loss: 1.1999, test_f1: 0.3595
 epoch: 2, train_loss: 1.1214, test_loss: 1.1818, test_f1: 0.3163
 epoch: 3, train_loss: 1.0709, test_loss: 1.2197, test_f1: 0.4281
 epoch: 4, train_loss: 1.0247, test_loss: 1.1520, test_f1: 0.4403
 epoch: 5, train_loss: 0.9853, test_loss: 1.1840, test_f1: 0.4672
 epoch: 6, train_loss: 0.9812, test_loss: 1.2136, test_f1: 0.5111
 epoch: 7, train_loss: 0.9558, test_loss: 1.0973, test_f1: 0.5030
 epoch: 8, train_loss: 0.9300, test_loss: 1.0694, test_f1: 0.5373
 epoch: 9, train_loss: 0.9377, test_loss: 1.1812, test_f1: 0.5163
 epoch: 10, train_loss: 0.9246, test_loss: 1.0601, test_f1: 0.5111
 epoch: 11, train_loss: 0.8936, test_loss: 1.1573, test_f1: 0.4673
 epoch: 12, train_loss: 0.8939, test_loss: 1.1851, test_f1: 0.5217
 epoch: 13, train_loss: 0.8722, test_loss: 1.1629, test_f1: 0.5369
 epoch: 14, train_loss: 0.8743, test_loss: 1.0653, test_f1: 0.5649
 epoch: 15, train_loss: 0.8597, test_loss: 1.1836, test_f1: 0.4870
 epoch: 16, train_loss: 0.8483, test_loss: 1.0245, test_f1: 0.5637
 epoch: 17, train_loss: 0.8526, test_loss: 1.4265, test_f1: 0.4786
 epoch: 18, train_loss: 0.8553, test_loss: 1.3303, test_f1: 0.4886
 epoch: 19, train_loss: 0.8353, test_loss: 1.0366, test_f1: 0.5975
 epoch: 20, train_loss: 0.8413, test_loss: 1.0775, test_f1: 0.5615
 epoch: 21, train_loss: 0.8350, test_loss: 1.1158, test_f1: 0.5096
 epoch: 22, train_loss: 0.8128, test_loss: 1.1861, test_f1: 0.5578
 epoch: 23, train_loss: 0.8078, test_loss: 1.1687, test_f1: 0.5732
 epoch: 24, train_loss: 0.8120, test_loss: 1.1431, test_f1: 0.5461
 epoch: 25, train_loss: 0.8400, test_loss: 1.0747, test_f1: 0.5638
 epoch: 26, train_loss: 0.8110, test_loss: 1.1450, test_f1: 0.5834
 epoch: 27, train_loss: 0.8182, test_loss: 1.0783, test_f1: 0.5595
 epoch: 28, train_loss: 0.7815, test_loss: 1.3497, test_f1: 0.5443
 epoch: 29, train_loss: 0.8307, test_loss: 1.3759, test_f1: 0.5629
 epoch: 30, train_loss: 0.8390, test_loss: 1.1225, test_f1: 0.5994
 epoch: 31, train_loss: 0.8179, test_loss: 1.3295, test_f1: 0.5347
 epoch: 32, train_loss: 0.7951, test_loss: 1.0359, test_f1: 0.5893
 epoch: 33, train_loss: 0.7812, test_loss: 1.4626, test_f1: 0.4647
 epoch: 34, train_loss: 0.7791, test_loss: 1.2289, test_f1: 0.5574
 epoch: 35, train_loss: 0.7768, test_loss: 1.2160, test_f1: 0.5544
 epoch: 36, train_loss: 0.7990, test_loss: 1.0472, test_f1: 0.5840
 epoch: 37, train_loss: 0.7817, test_loss: 1.0925, test_f1: 0.5643
 epoch: 38, train_loss: 0.7419, test_loss: 1.0807, test_f1: 0.5965
 epoch: 39, train_loss: 0.7394, test_loss: 1.0855, test_f1: 0.5893
 epoch: 40, train_loss: 0.7464, test_loss: 1.1816, test_f1: 0.5720
 epoch: 41, train_loss: 0.7465, test_loss: 1.1734, test_f1: 0.5631
 epoch: 42, train_loss: 0.7646, test_loss: 1.9658, test_f1: 0.4081
 epoch: 43, train_loss: 0.7666, test_loss: 1.1711, test_f1: 0.5728
 epoch: 44, train_loss: 0.7160, test_loss: 1.4625, test_f1: 0.5070
 epoch: 45, train_loss: 0.7348, test_loss: 1.1460, test_f1: 0.5952
 epoch: 46, train_loss: 0.7148, test_loss: 1.0711, test_f1: 0.6057
 epoch: 47, train_loss: 0.7272, test_loss: 1.1934, test_f1: 0.5404
 epoch: 48, train_loss: 0.7047, test_loss: 1.5037, test_f1: 0.5383
 epoch: 49, train_loss: 0.7075, test_loss: 3.2750, test_f1: 0.3296
 epoch: 50, train_loss: 0.7159, test_loss: 1.3060, test_f1: 0.5730
 epoch: 51, train_loss: 0.7193, test_loss: 1.3063, test_f1: 0.5698
 epoch: 52, train_loss: 0.6592, test_loss: 1.3065, test_f1: 0.5771
 epoch: 53, train_loss: 0.6483, test_loss: 1.2528, test_f1: 0.5595
 epoch: 54, train_loss: 0.6364, test_loss: 1.5113, test_f1: 0.5449
 epoch: 55, train_loss: 0.6565, test_loss: 1.2860, test_f1: 0.5634
 epoch: 56, train_loss: 0.6587, test_loss: 1.1937, test_f1: 0.5498
 epoch: 57, train_loss: 0.6470, test_loss: 1.1979, test_f1: 0.5911
 epoch: 58, train_loss: 0.6394, test_loss: 1.2065, test_f1: 0.5897
 epoch: 59, train_loss: 0.6340, test_loss: 1.4340, test_f1: 0.5603
 epoch: 60, train_loss: 0.6217, test_loss: 1.5206, test_f1: 0.4996
 epoch: 61, train_loss: 0.6232, test_loss: 1.1414, test_f1: 0.5884
 epoch: 62, train_loss: 0.5982, test_loss: 1.5596, test_f1: 0.5679
 epoch: 63, train_loss: 0.5978, test_loss: 1.3638, test_f1: 0.5895
 epoch: 64, train_loss: 0.5920, test_loss: 1.7443, test_f1: 0.5171
 epoch: 65, train_loss: 0.6317, test_loss: 1.2162, test_f1: 0.6399
 epoch: 66, train_loss: 0.6085, test_loss: 1.4066, test_f1: 0.5731
 epoch: 67, train_loss: 0.6363, test_loss: 1.3579, test_f1: 0.5723
 epoch: 68, train_loss: 0.6103, test_loss: 1.5068, test_f1: 0.5946
 epoch: 69, train_loss: 0.5774, test_loss: 1.1672, test_f1: 0.5965
 epoch: 70, train_loss: 0.5878, test_loss: 1.3301, test_f1: 0.6261
 epoch: 71, train_loss: 0.5675, test_loss: 1.3342, test_f1: 0.6131
 epoch: 72, train_loss: 0.5844, test_loss: 1.3529, test_f1: 0.6173
 epoch: 73, train_loss: 0.6266, test_loss: 1.3909, test_f1: 0.5726
 epoch: 74, train_loss: 0.6135, test_loss: 1.1788, test_f1: 0.6073
 epoch: 75, train_loss: 0.6055, test_loss: 1.4206, test_f1: 0.6011
 epoch: 76, train_loss: 0.5831, test_loss: 1.4565, test_f1: 0.5782
 epoch: 77, train_loss: 0.5826, test_loss: 1.3096, test_f1: 0.5803
 epoch: 78, train_loss: 0.5924, test_loss: 1.3576, test_f1: 0.5952
 epoch: 79, train_loss: 0.5539, test_loss: 1.4948, test_f1: 0.5553
 epoch: 80, train_loss: 0.5637, test_loss: 1.5912, test_f1: 0.5794
 epoch: 81, train_loss: 0.5680, test_loss: 1.2681, test_f1: 0.6031
 epoch: 82, train_loss: 0.5989, test_loss: 1.4072, test_f1: 0.6036
 epoch: 83, train_loss: 0.5698, test_loss: 1.6634, test_f1: 0.5516
 epoch: 84, train_loss: 0.5598, test_loss: 1.5804, test_f1: 0.5775
 epoch: 85, train_loss: 0.5859, test_loss: 1.1966, test_f1: 0.6218
 epoch: 86, train_loss: 0.5589, test_loss: 1.5244, test_f1: 0.5829
 epoch: 87, train_loss: 0.5618, test_loss: 1.3724, test_f1: 0.5809
 epoch: 88, train_loss: 0.5624, test_loss: 1.5721, test_f1: 0.6049
 epoch: 89, train_loss: 0.5582, test_loss: 1.4628, test_f1: 0.6156
 epoch: 90, train_loss: 0.5373, test_loss: 1.4208, test_f1: 0.6097
 epoch: 91, train_loss: 0.5544, test_loss: 1.3980, test_f1: 0.5976
 epoch: 92, train_loss: 0.5538, test_loss: 1.3299, test_f1: 0.5926
 epoch: 93, train_loss: 0.5619, test_loss: 1.5065, test_f1: 0.6031
 epoch: 94, train_loss: 0.5266, test_loss: 1.3411, test_f1: 0.6409
 epoch: 95, train_loss: 0.5179, test_loss: 1.5814, test_f1: 0.6060
 epoch: 96, train_loss: 0.5375, test_loss: 1.4189, test_f1: 0.6367
 epoch: 97, train_loss: 0.5319, test_loss: 1.7211, test_f1: 0.5880
 epoch: 98, train_loss: 0.5325, test_loss: 1.3850, test_f1: 0.6076
 epoch: 99, train_loss: 0.5328, test_loss: 1.8934, test_f1: 0.5487
##################ITERATION #9 ****************************************
 epoch: 0, train_loss: 1.3460, test_loss: 1.3111, test_f1: 0.3279
 epoch: 1, train_loss: 1.1844, test_loss: 1.1794, test_f1: 0.4385
 epoch: 2, train_loss: 1.0868, test_loss: 1.1934, test_f1: 0.4283
 epoch: 3, train_loss: 1.0198, test_loss: 1.1770, test_f1: 0.5024
 epoch: 4, train_loss: 1.0279, test_loss: 1.1315, test_f1: 0.5040
 epoch: 5, train_loss: 0.9837, test_loss: 1.0901, test_f1: 0.5458
 epoch: 6, train_loss: 0.9640, test_loss: 1.0198, test_f1: 0.5255
 epoch: 7, train_loss: 0.9394, test_loss: 1.0660, test_f1: 0.5449
 epoch: 8, train_loss: 0.9318, test_loss: 1.0319, test_f1: 0.4570
 epoch: 9, train_loss: 0.9077, test_loss: 1.0342, test_f1: 0.5780
 epoch: 10, train_loss: 0.9030, test_loss: 1.0485, test_f1: 0.4833
 epoch: 11, train_loss: 0.9062, test_loss: 1.1501, test_f1: 0.5036
 epoch: 12, train_loss: 0.8965, test_loss: 1.0363, test_f1: 0.5386
 epoch: 13, train_loss: 0.8709, test_loss: 1.2570, test_f1: 0.5091
 epoch: 14, train_loss: 0.8744, test_loss: 1.0747, test_f1: 0.4808
 epoch: 15, train_loss: 0.8783, test_loss: 1.1896, test_f1: 0.4801
 epoch: 16, train_loss: 0.8483, test_loss: 1.1424, test_f1: 0.5143
 epoch: 17, train_loss: 0.8661, test_loss: 1.1110, test_f1: 0.5268
 epoch: 18, train_loss: 0.8401, test_loss: 1.0384, test_f1: 0.5403
 epoch: 19, train_loss: 0.8420, test_loss: 1.0844, test_f1: 0.5716
 epoch: 20, train_loss: 0.8697, test_loss: 1.1316, test_f1: 0.5644
 epoch: 21, train_loss: 0.8408, test_loss: 1.4557, test_f1: 0.3892
 epoch: 22, train_loss: 0.8400, test_loss: 1.1744, test_f1: 0.5085
 epoch: 23, train_loss: 0.8065, test_loss: 1.0346, test_f1: 0.5281
 epoch: 24, train_loss: 0.8132, test_loss: 1.0948, test_f1: 0.5362
 epoch: 25, train_loss: 0.7819, test_loss: 1.1163, test_f1: 0.5219
 epoch: 26, train_loss: 0.7893, test_loss: 1.5535, test_f1: 0.3979
 epoch: 27, train_loss: 0.8253, test_loss: 1.2447, test_f1: 0.5646
 epoch: 28, train_loss: 0.8280, test_loss: 1.2182, test_f1: 0.4823
 epoch: 29, train_loss: 0.7819, test_loss: 1.1765, test_f1: 0.5322
 epoch: 30, train_loss: 0.7893, test_loss: 1.1020, test_f1: 0.5361
 epoch: 31, train_loss: 0.8141, test_loss: 1.1375, test_f1: 0.4967
 epoch: 32, train_loss: 0.8036, test_loss: 1.1454, test_f1: 0.5391
 epoch: 33, train_loss: 0.7941, test_loss: 1.6643, test_f1: 0.3217
 epoch: 34, train_loss: 0.8102, test_loss: 1.0817, test_f1: 0.5415
 epoch: 35, train_loss: 0.7673, test_loss: 1.2106, test_f1: 0.5073
 epoch: 36, train_loss: 0.7690, test_loss: 1.2653, test_f1: 0.5275
 epoch: 37, train_loss: 0.7362, test_loss: 1.2293, test_f1: 0.5448
 epoch: 38, train_loss: 0.7409, test_loss: 1.2866, test_f1: 0.5404
 epoch: 39, train_loss: 0.7599, test_loss: 1.1940, test_f1: 0.4952
 epoch: 40, train_loss: 0.7566, test_loss: 1.1407, test_f1: 0.5739
 epoch: 41, train_loss: 0.7395, test_loss: 1.3619, test_f1: 0.5494
 epoch: 42, train_loss: 0.7440, test_loss: 1.4488, test_f1: 0.5075
 epoch: 43, train_loss: 0.7123, test_loss: 1.2046, test_f1: 0.5384
 epoch: 44, train_loss: 0.7314, test_loss: 1.1328, test_f1: 0.5528
 epoch: 45, train_loss: 0.7205, test_loss: 1.9200, test_f1: 0.4578
 epoch: 46, train_loss: 0.7385, test_loss: 1.1469, test_f1: 0.5454
 epoch: 47, train_loss: 0.7173, test_loss: 1.4960, test_f1: 0.5038
 epoch: 48, train_loss: 0.7071, test_loss: 1.4270, test_f1: 0.5795
 epoch: 49, train_loss: 0.7019, test_loss: 1.5764, test_f1: 0.4603
 epoch: 50, train_loss: 0.6912, test_loss: 1.4277, test_f1: 0.5410
 epoch: 51, train_loss: 0.6546, test_loss: 1.4276, test_f1: 0.5279
 epoch: 52, train_loss: 0.6354, test_loss: 1.3243, test_f1: 0.5371
 epoch: 53, train_loss: 0.6339, test_loss: 1.5211, test_f1: 0.5269
 epoch: 54, train_loss: 0.6138, test_loss: 1.4393, test_f1: 0.5087
 epoch: 55, train_loss: 0.6223, test_loss: 1.6247, test_f1: 0.5189
 epoch: 56, train_loss: 0.6348, test_loss: 1.5299, test_f1: 0.5136
 epoch: 57, train_loss: 0.6113, test_loss: 1.6426, test_f1: 0.5198
 epoch: 58, train_loss: 0.6369, test_loss: 1.5679, test_f1: 0.4916
 epoch: 59, train_loss: 0.6298, test_loss: 1.4731, test_f1: 0.5060
 epoch: 60, train_loss: 0.5824, test_loss: 1.8099, test_f1: 0.4999
 epoch: 61, train_loss: 0.5709, test_loss: 1.7128, test_f1: 0.5353
 epoch: 62, train_loss: 0.6189, test_loss: 1.6069, test_f1: 0.5369
 epoch: 63, train_loss: 0.6002, test_loss: 1.6305, test_f1: 0.5280
 epoch: 64, train_loss: 0.6033, test_loss: 1.4447, test_f1: 0.4883
 epoch: 65, train_loss: 0.6099, test_loss: 1.5135, test_f1: 0.5361
 epoch: 66, train_loss: 0.5864, test_loss: 1.2889, test_f1: 0.5579
 epoch: 67, train_loss: 0.5994, test_loss: 1.8516, test_f1: 0.4987
 epoch: 68, train_loss: 0.5707, test_loss: 1.6821, test_f1: 0.4809
 epoch: 69, train_loss: 0.6036, test_loss: 1.4031, test_f1: 0.5296
 epoch: 70, train_loss: 0.5879, test_loss: 1.7018, test_f1: 0.5025
 epoch: 71, train_loss: 0.5597, test_loss: 1.5965, test_f1: 0.5234
 epoch: 72, train_loss: 0.5778, test_loss: 1.9099, test_f1: 0.4996
 epoch: 73, train_loss: 0.5690, test_loss: 1.7515, test_f1: 0.5057
 epoch: 74, train_loss: 0.5576, test_loss: 2.1657, test_f1: 0.5075
 epoch: 75, train_loss: 0.5827, test_loss: 1.7263, test_f1: 0.5189
 epoch: 76, train_loss: 0.5597, test_loss: 2.1248, test_f1: 0.5143
 epoch: 77, train_loss: 0.5692, test_loss: 1.5685, test_f1: 0.5092
 epoch: 78, train_loss: 0.5582, test_loss: 1.6722, test_f1: 0.5286
 epoch: 79, train_loss: 0.5421, test_loss: 1.7030, test_f1: 0.5231
 epoch: 80, train_loss: 0.5942, test_loss: 2.0616, test_f1: 0.4977
 epoch: 81, train_loss: 0.5689, test_loss: 2.0641, test_f1: 0.4607
 epoch: 82, train_loss: 0.5557, test_loss: 1.8618, test_f1: 0.5579
 epoch: 83, train_loss: 0.5754, test_loss: 1.7078, test_f1: 0.5240
 epoch: 84, train_loss: 0.5673, test_loss: 1.9487, test_f1: 0.4908
 epoch: 85, train_loss: 0.5615, test_loss: 1.7185, test_f1: 0.5419
 epoch: 86, train_loss: 0.5451, test_loss: 1.9539, test_f1: 0.5355
 epoch: 87, train_loss: 0.5354, test_loss: 1.7818, test_f1: 0.5260
 epoch: 88, train_loss: 0.5785, test_loss: 1.7563, test_f1: 0.5155
 epoch: 89, train_loss: 0.5368, test_loss: 1.8178, test_f1: 0.5105
 epoch: 90, train_loss: 0.5444, test_loss: 1.8707, test_f1: 0.5078
 epoch: 91, train_loss: 0.5511, test_loss: 2.0557, test_f1: 0.5269
 epoch: 92, train_loss: 0.5621, test_loss: 1.6239, test_f1: 0.5461
 epoch: 93, train_loss: 0.5836, test_loss: 1.7433, test_f1: 0.5301
 epoch: 94, train_loss: 0.5351, test_loss: 2.1294, test_f1: 0.4936
 epoch: 95, train_loss: 0.5299, test_loss: 1.8858, test_f1: 0.4943
 epoch: 96, train_loss: 0.5157, test_loss: 1.9200, test_f1: 0.5006
 epoch: 97, train_loss: 0.5306, test_loss: 1.8012, test_f1: 0.5463
 epoch: 98, train_loss: 0.5135, test_loss: 2.0653, test_f1: 0.4907
 epoch: 99, train_loss: 0.5014, test_loss: 2.3380, test_f1: 0.5222

Training completed in 647.32 seconds
Best F1: 0.6830 at epoch 91
Mean F1 across iterations: 0.6381  0.0246
========================FINAL RESULTS================================
FEGIN weighted F1: 0.6830  0.0246
python main.py --data ltspice_demos --representation component_component --model FEGIN --layers 5 --hiddens 32 --batch_size 64 --lr 0.01 --emb_size 250 --epochs 100 --save_appendix component_component_L5_H32_BS64_LR0.01_E250 --no_val
-----



STDERR:
  File "main.py", line 370, in <module>
    main()
  File "main.py", line 254, in main
    dataset = dataset_class(
  File "/home/philip/projects/ltspice_examples_code_repo/Circuit-Completion-Using-GNNs/component_classification_with_link_prediction_head/evaluation/FEGIN/kernel/circuit_datasets.py", line 15, in __init__
    self.data, self.slices = torch.load(self.processed_paths[0])
  File "/home/philip/.local/lib/python3.8/site-packages/torch/serialization.py", line 1040, in load
    warnings.warn(
  File "/usr/lib/python3.8/warnings.py", line 109, in _showwarnmsg
    sw(msg.message, msg.category, msg.filename, msg.lineno,
  File "main.py", line 47, in warn_with_traceback
    traceback.print_stack(file=log)
/home/philip/projects/ltspice_examples_code_repo/Circuit-Completion-Using-GNNs/component_classification_with_link_prediction_head/evaluation/FEGIN/kernel/circuit_datasets.py:15: FutureWarning: You are using `torch.load` with `weights_only=False` (the current default value), which uses the default pickle module implicitly. It is possible to construct malicious pickle data which will execute arbitrary code during unpickling (See https://github.com/pytorch/pytorch/blob/main/SECURITY.md#untrusted-models for more details). In a future release, the default value for `weights_only` will be flipped to `True`. This limits the functions that could be executed during unpickling. Arbitrary objects will no longer be allowed to be loaded via this mode unless they are explicitly allowlisted by the user via `torch.serialization.add_safe_globals`. We recommend you start setting `weights_only=True` for any use case where you don't have full control of the loaded file. Please open an issue on GitHub for any issues related to this experimental feature.
  self.data, self.slices = torch.load(self.processed_paths[0])
