STDOUT:
Results will be saved in /home/philip/projects/ltspice_examples_code_repo/Circuit-Completion-Using-GNNs/component_classification_with_link_prediction_head/evaluation/FEGIN/results/model_FEGIN_dataset_ltspice_examples
Command line input: python main.py --data ltspice_examples --representation component_pin_net --model FEGIN --layers 5 --hiddens 32 --batch_size 128 --lr 0.0001 --emb_size 512 --epochs 100 --save_appendix component_pin_net_L5_H32_BS128_LR0.0001_E512 --no_val
 is saved.
-----
ltspice_examples - FEGIN
Using 5 layers, 32 hidden units, h = 2
Loading component_pin_net representation dataset
ENTERED
Training FEGIN on component_pin_net representation
Train: 3558, Test: 846
##################ITERATION #0 ****************************************
 epoch: 0, train_loss: 1.3972, test_loss: 1.3959, test_f1: 0.1004
 epoch: 1, train_loss: 1.3879, test_loss: 1.3915, test_f1: 0.1004
 epoch: 2, train_loss: 1.3809, test_loss: 1.3795, test_f1: 0.1004
 epoch: 3, train_loss: 1.3712, test_loss: 1.3673, test_f1: 0.1318
 epoch: 4, train_loss: 1.3598, test_loss: 1.3543, test_f1: 0.1799
 epoch: 5, train_loss: 1.3458, test_loss: 1.3388, test_f1: 0.2674
 epoch: 6, train_loss: 1.3290, test_loss: 1.3208, test_f1: 0.3007
 epoch: 7, train_loss: 1.3104, test_loss: 1.3021, test_f1: 0.2688
 epoch: 8, train_loss: 1.2912, test_loss: 1.2801, test_f1: 0.2438
 epoch: 9, train_loss: 1.2734, test_loss: 1.2625, test_f1: 0.2354
 epoch: 10, train_loss: 1.2583, test_loss: 1.2459, test_f1: 0.2306
 epoch: 11, train_loss: 1.2499, test_loss: 1.2332, test_f1: 0.2295
 epoch: 12, train_loss: 1.2355, test_loss: 1.2216, test_f1: 0.2295
 epoch: 13, train_loss: 1.2277, test_loss: 1.2121, test_f1: 0.2270
 epoch: 14, train_loss: 1.2153, test_loss: 1.2031, test_f1: 0.2270
 epoch: 15, train_loss: 1.2097, test_loss: 1.1939, test_f1: 0.2270
 epoch: 16, train_loss: 1.2066, test_loss: 1.1875, test_f1: 0.2344
 epoch: 17, train_loss: 1.1954, test_loss: 1.1817, test_f1: 0.2885
 epoch: 18, train_loss: 1.1905, test_loss: 1.1732, test_f1: 0.3182
 epoch: 19, train_loss: 1.1861, test_loss: 1.1686, test_f1: 0.3324
 epoch: 20, train_loss: 1.1806, test_loss: 1.1606, test_f1: 0.3364
 epoch: 21, train_loss: 1.1672, test_loss: 1.1529, test_f1: 0.3393
 epoch: 22, train_loss: 1.1674, test_loss: 1.1463, test_f1: 0.3403
 epoch: 23, train_loss: 1.1600, test_loss: 1.1400, test_f1: 0.3415
 epoch: 24, train_loss: 1.1498, test_loss: 1.1309, test_f1: 0.3486
 epoch: 25, train_loss: 1.1423, test_loss: 1.1250, test_f1: 0.3730
 epoch: 26, train_loss: 1.1365, test_loss: 1.1156, test_f1: 0.3798
 epoch: 27, train_loss: 1.1282, test_loss: 1.1097, test_f1: 0.3701
 epoch: 28, train_loss: 1.1169, test_loss: 1.0991, test_f1: 0.4006
 epoch: 29, train_loss: 1.1057, test_loss: 1.0944, test_f1: 0.4116
 epoch: 30, train_loss: 1.1008, test_loss: 1.0857, test_f1: 0.4025
 epoch: 31, train_loss: 1.0954, test_loss: 1.0788, test_f1: 0.3986
 epoch: 32, train_loss: 1.0873, test_loss: 1.0724, test_f1: 0.4056
 epoch: 33, train_loss: 1.0764, test_loss: 1.0657, test_f1: 0.4075
 epoch: 34, train_loss: 1.0789, test_loss: 1.0623, test_f1: 0.3938
 epoch: 35, train_loss: 1.0619, test_loss: 1.0564, test_f1: 0.3930
 epoch: 36, train_loss: 1.0556, test_loss: 1.0506, test_f1: 0.3977
 epoch: 37, train_loss: 1.0474, test_loss: 1.0520, test_f1: 0.4163
 epoch: 38, train_loss: 1.0459, test_loss: 1.0454, test_f1: 0.4297
 epoch: 39, train_loss: 1.0398, test_loss: 1.0420, test_f1: 0.4489
 epoch: 40, train_loss: 1.0328, test_loss: 1.0383, test_f1: 0.4479
 epoch: 41, train_loss: 1.0308, test_loss: 1.0327, test_f1: 0.4606
 epoch: 42, train_loss: 1.0207, test_loss: 1.0282, test_f1: 0.4630
 epoch: 43, train_loss: 1.0137, test_loss: 1.0239, test_f1: 0.4660
 epoch: 44, train_loss: 1.0117, test_loss: 1.0216, test_f1: 0.4566
 epoch: 45, train_loss: 1.0127, test_loss: 1.0283, test_f1: 0.4581
 epoch: 46, train_loss: 1.0050, test_loss: 1.0140, test_f1: 0.4856
 epoch: 47, train_loss: 0.9936, test_loss: 1.0118, test_f1: 0.4837
 epoch: 48, train_loss: 0.9868, test_loss: 1.0066, test_f1: 0.5068
 epoch: 49, train_loss: 0.9874, test_loss: 1.0237, test_f1: 0.4986
 epoch: 50, train_loss: 0.9826, test_loss: 1.0062, test_f1: 0.5232
 epoch: 51, train_loss: 0.9818, test_loss: 1.0066, test_f1: 0.5174
 epoch: 52, train_loss: 0.9791, test_loss: 1.0192, test_f1: 0.4959
 epoch: 53, train_loss: 0.9707, test_loss: 1.0012, test_f1: 0.5181
 epoch: 54, train_loss: 0.9725, test_loss: 0.9997, test_f1: 0.4984
 epoch: 55, train_loss: 0.9719, test_loss: 1.0028, test_f1: 0.5246
 epoch: 56, train_loss: 0.9673, test_loss: 1.0008, test_f1: 0.5256
 epoch: 57, train_loss: 0.9664, test_loss: 0.9963, test_f1: 0.5292
 epoch: 58, train_loss: 0.9640, test_loss: 0.9964, test_f1: 0.5146
 epoch: 59, train_loss: 0.9589, test_loss: 0.9973, test_f1: 0.5336
 epoch: 60, train_loss: 0.9548, test_loss: 0.9946, test_f1: 0.5333
 epoch: 61, train_loss: 0.9687, test_loss: 0.9959, test_f1: 0.5280
 epoch: 62, train_loss: 0.9549, test_loss: 0.9973, test_f1: 0.5263
 epoch: 63, train_loss: 0.9662, test_loss: 0.9964, test_f1: 0.5322
 epoch: 64, train_loss: 0.9528, test_loss: 0.9879, test_f1: 0.5368
 epoch: 65, train_loss: 0.9530, test_loss: 0.9897, test_f1: 0.5214
 epoch: 66, train_loss: 0.9528, test_loss: 0.9899, test_f1: 0.5303
 epoch: 67, train_loss: 0.9470, test_loss: 0.9833, test_f1: 0.5339
 epoch: 68, train_loss: 0.9437, test_loss: 0.9813, test_f1: 0.5342
 epoch: 69, train_loss: 0.9479, test_loss: 0.9818, test_f1: 0.5471
 epoch: 70, train_loss: 0.9477, test_loss: 0.9831, test_f1: 0.5369
 epoch: 71, train_loss: 0.9412, test_loss: 0.9796, test_f1: 0.5369
 epoch: 72, train_loss: 0.9457, test_loss: 0.9793, test_f1: 0.5175
 epoch: 73, train_loss: 0.9393, test_loss: 0.9805, test_f1: 0.5297
 epoch: 74, train_loss: 0.9383, test_loss: 0.9795, test_f1: 0.5237
 epoch: 75, train_loss: 0.9421, test_loss: 0.9808, test_f1: 0.5315
 epoch: 76, train_loss: 0.9418, test_loss: 0.9748, test_f1: 0.5234
 epoch: 77, train_loss: 0.9339, test_loss: 0.9791, test_f1: 0.5216
 epoch: 78, train_loss: 0.9367, test_loss: 0.9763, test_f1: 0.5274
 epoch: 79, train_loss: 0.9271, test_loss: 0.9751, test_f1: 0.5274
 epoch: 80, train_loss: 0.9282, test_loss: 0.9734, test_f1: 0.5427
 epoch: 81, train_loss: 0.9256, test_loss: 0.9688, test_f1: 0.5396
 epoch: 82, train_loss: 0.9242, test_loss: 0.9687, test_f1: 0.5342
 epoch: 83, train_loss: 0.9256, test_loss: 0.9741, test_f1: 0.5315
 epoch: 84, train_loss: 0.9305, test_loss: 0.9664, test_f1: 0.5358
 epoch: 85, train_loss: 0.9314, test_loss: 0.9680, test_f1: 0.5372
 epoch: 86, train_loss: 0.9277, test_loss: 0.9616, test_f1: 0.5342
 epoch: 87, train_loss: 0.9210, test_loss: 0.9656, test_f1: 0.5346
 epoch: 88, train_loss: 0.9187, test_loss: 0.9668, test_f1: 0.5420
 epoch: 89, train_loss: 0.9255, test_loss: 0.9622, test_f1: 0.5347
 epoch: 90, train_loss: 0.9167, test_loss: 0.9636, test_f1: 0.5390
 epoch: 91, train_loss: 0.9248, test_loss: 0.9635, test_f1: 0.5392
 epoch: 92, train_loss: 0.9135, test_loss: 0.9627, test_f1: 0.5400
 epoch: 93, train_loss: 0.9124, test_loss: 0.9585, test_f1: 0.5426
 epoch: 94, train_loss: 0.9088, test_loss: 0.9633, test_f1: 0.5398
 epoch: 95, train_loss: 0.9175, test_loss: 0.9653, test_f1: 0.5325
 epoch: 96, train_loss: 0.9181, test_loss: 0.9580, test_f1: 0.5345
 epoch: 97, train_loss: 0.9207, test_loss: 0.9577, test_f1: 0.5267
 epoch: 98, train_loss: 0.9145, test_loss: 0.9610, test_f1: 0.5402
 epoch: 99, train_loss: 0.9057, test_loss: 0.9556, test_f1: 0.5377
##################ITERATION #1 ****************************************
 epoch: 0, train_loss: 1.3660, test_loss: 1.3739, test_f1: 0.1004
 epoch: 1, train_loss: 1.3410, test_loss: 1.3627, test_f1: 0.1053
 epoch: 2, train_loss: 1.3238, test_loss: 1.3203, test_f1: 0.3343
 epoch: 3, train_loss: 1.3054, test_loss: 1.2957, test_f1: 0.4055
 epoch: 4, train_loss: 1.2854, test_loss: 1.2723, test_f1: 0.3870
 epoch: 5, train_loss: 1.2666, test_loss: 1.2498, test_f1: 0.3414
 epoch: 6, train_loss: 1.2448, test_loss: 1.2311, test_f1: 0.3451
 epoch: 7, train_loss: 1.2248, test_loss: 1.2077, test_f1: 0.3451
 epoch: 8, train_loss: 1.2067, test_loss: 1.1875, test_f1: 0.3460
 epoch: 9, train_loss: 1.1910, test_loss: 1.1707, test_f1: 0.3460
 epoch: 10, train_loss: 1.1739, test_loss: 1.1546, test_f1: 0.3460
 epoch: 11, train_loss: 1.1612, test_loss: 1.1416, test_f1: 0.3450
 epoch: 12, train_loss: 1.1465, test_loss: 1.1269, test_f1: 0.3441
 epoch: 13, train_loss: 1.1361, test_loss: 1.1149, test_f1: 0.3440
 epoch: 14, train_loss: 1.1264, test_loss: 1.1052, test_f1: 0.3411
 epoch: 15, train_loss: 1.1139, test_loss: 1.0965, test_f1: 0.3411
 epoch: 16, train_loss: 1.1044, test_loss: 1.0862, test_f1: 0.3430
 epoch: 17, train_loss: 1.0900, test_loss: 1.0796, test_f1: 0.3411
 epoch: 18, train_loss: 1.0823, test_loss: 1.0727, test_f1: 0.3350
 epoch: 19, train_loss: 1.0771, test_loss: 1.0684, test_f1: 0.3401
 epoch: 20, train_loss: 1.0745, test_loss: 1.0634, test_f1: 0.3378
 epoch: 21, train_loss: 1.0635, test_loss: 1.0604, test_f1: 0.3389
 epoch: 22, train_loss: 1.0586, test_loss: 1.0626, test_f1: 0.3403
 epoch: 23, train_loss: 1.0470, test_loss: 1.0549, test_f1: 0.3522
 epoch: 24, train_loss: 1.0407, test_loss: 1.0542, test_f1: 0.3536
 epoch: 25, train_loss: 1.0384, test_loss: 1.0589, test_f1: 0.3532
 epoch: 26, train_loss: 1.0365, test_loss: 1.0534, test_f1: 0.3996
 epoch: 27, train_loss: 1.0325, test_loss: 1.0460, test_f1: 0.4049
 epoch: 28, train_loss: 1.0292, test_loss: 1.0465, test_f1: 0.4183
 epoch: 29, train_loss: 1.0198, test_loss: 1.0464, test_f1: 0.4321
 epoch: 30, train_loss: 1.0217, test_loss: 1.0396, test_f1: 0.4374
 epoch: 31, train_loss: 1.0151, test_loss: 1.0396, test_f1: 0.4241
 epoch: 32, train_loss: 1.0110, test_loss: 1.0410, test_f1: 0.4300
 epoch: 33, train_loss: 1.0081, test_loss: 1.0327, test_f1: 0.4579
 epoch: 34, train_loss: 1.0047, test_loss: 1.0311, test_f1: 0.4597
 epoch: 35, train_loss: 0.9943, test_loss: 1.0200, test_f1: 0.4691
 epoch: 36, train_loss: 0.9954, test_loss: 1.0217, test_f1: 0.4570
 epoch: 37, train_loss: 0.9893, test_loss: 1.0162, test_f1: 0.4759
 epoch: 38, train_loss: 0.9872, test_loss: 1.0109, test_f1: 0.4663
 epoch: 39, train_loss: 0.9786, test_loss: 1.0197, test_f1: 0.4665
 epoch: 40, train_loss: 0.9738, test_loss: 0.9975, test_f1: 0.4802
 epoch: 41, train_loss: 0.9696, test_loss: 0.9980, test_f1: 0.5108
 epoch: 42, train_loss: 0.9682, test_loss: 0.9984, test_f1: 0.5096
 epoch: 43, train_loss: 0.9637, test_loss: 0.9920, test_f1: 0.5071
 epoch: 44, train_loss: 0.9611, test_loss: 0.9823, test_f1: 0.5092
 epoch: 45, train_loss: 0.9562, test_loss: 0.9816, test_f1: 0.5130
 epoch: 46, train_loss: 0.9508, test_loss: 0.9712, test_f1: 0.5122
 epoch: 47, train_loss: 0.9503, test_loss: 0.9778, test_f1: 0.5215
 epoch: 48, train_loss: 0.9481, test_loss: 0.9756, test_f1: 0.5104
 epoch: 49, train_loss: 0.9389, test_loss: 0.9769, test_f1: 0.5167
 epoch: 50, train_loss: 0.9312, test_loss: 0.9619, test_f1: 0.5141
 epoch: 51, train_loss: 0.9426, test_loss: 0.9733, test_f1: 0.5208
 epoch: 52, train_loss: 0.9336, test_loss: 0.9690, test_f1: 0.5169
 epoch: 53, train_loss: 0.9300, test_loss: 0.9711, test_f1: 0.5163
 epoch: 54, train_loss: 0.9289, test_loss: 0.9633, test_f1: 0.5178
 epoch: 55, train_loss: 0.9222, test_loss: 0.9606, test_f1: 0.5156
 epoch: 56, train_loss: 0.9285, test_loss: 0.9586, test_f1: 0.5186
 epoch: 57, train_loss: 0.9261, test_loss: 0.9610, test_f1: 0.5216
 epoch: 58, train_loss: 0.9227, test_loss: 0.9527, test_f1: 0.5010
 epoch: 59, train_loss: 0.9221, test_loss: 0.9480, test_f1: 0.5234
 epoch: 60, train_loss: 0.9183, test_loss: 0.9505, test_f1: 0.5229
 epoch: 61, train_loss: 0.9172, test_loss: 0.9459, test_f1: 0.5146
 epoch: 62, train_loss: 0.9132, test_loss: 0.9498, test_f1: 0.5107
 epoch: 63, train_loss: 0.9218, test_loss: 0.9516, test_f1: 0.5275
 epoch: 64, train_loss: 0.9172, test_loss: 0.9490, test_f1: 0.5165
 epoch: 65, train_loss: 0.9132, test_loss: 0.9427, test_f1: 0.5312
 epoch: 66, train_loss: 0.9135, test_loss: 0.9474, test_f1: 0.5251
 epoch: 67, train_loss: 0.9105, test_loss: 0.9434, test_f1: 0.5083
 epoch: 68, train_loss: 0.9079, test_loss: 0.9402, test_f1: 0.5316
 epoch: 69, train_loss: 0.9163, test_loss: 0.9279, test_f1: 0.5349
 epoch: 70, train_loss: 0.9099, test_loss: 0.9425, test_f1: 0.5082
 epoch: 71, train_loss: 0.9058, test_loss: 0.9435, test_f1: 0.5280
 epoch: 72, train_loss: 0.9092, test_loss: 0.9387, test_f1: 0.5264
 epoch: 73, train_loss: 0.9017, test_loss: 0.9272, test_f1: 0.5284
 epoch: 74, train_loss: 0.9054, test_loss: 0.9314, test_f1: 0.5294
 epoch: 75, train_loss: 0.8983, test_loss: 0.9326, test_f1: 0.5270
 epoch: 76, train_loss: 0.9005, test_loss: 0.9248, test_f1: 0.5337
 epoch: 77, train_loss: 0.9023, test_loss: 0.9304, test_f1: 0.5296
 epoch: 78, train_loss: 0.9005, test_loss: 0.9309, test_f1: 0.5179
 epoch: 79, train_loss: 0.8929, test_loss: 0.9270, test_f1: 0.5288
 epoch: 80, train_loss: 0.9057, test_loss: 0.9207, test_f1: 0.5241
 epoch: 81, train_loss: 0.8921, test_loss: 0.9244, test_f1: 0.5206
 epoch: 82, train_loss: 0.8959, test_loss: 0.9154, test_f1: 0.5242
 epoch: 83, train_loss: 0.8967, test_loss: 0.9130, test_f1: 0.5450
 epoch: 84, train_loss: 0.8921, test_loss: 0.9138, test_f1: 0.5291
 epoch: 85, train_loss: 0.8901, test_loss: 0.9110, test_f1: 0.5326
 epoch: 86, train_loss: 0.8883, test_loss: 0.9107, test_f1: 0.5342
 epoch: 87, train_loss: 0.8921, test_loss: 0.9150, test_f1: 0.5290
 epoch: 88, train_loss: 0.8942, test_loss: 0.9114, test_f1: 0.5324
 epoch: 89, train_loss: 0.8891, test_loss: 0.9079, test_f1: 0.5330
 epoch: 90, train_loss: 0.8867, test_loss: 0.9137, test_f1: 0.5325
 epoch: 91, train_loss: 0.8814, test_loss: 0.8997, test_f1: 0.5328
 epoch: 92, train_loss: 0.8919, test_loss: 0.9057, test_f1: 0.5318
 epoch: 93, train_loss: 0.8907, test_loss: 0.9141, test_f1: 0.5357
 epoch: 94, train_loss: 0.8837, test_loss: 0.9030, test_f1: 0.5470
 epoch: 95, train_loss: 0.8845, test_loss: 0.9061, test_f1: 0.5346
 epoch: 96, train_loss: 0.8750, test_loss: 0.8981, test_f1: 0.5383
 epoch: 97, train_loss: 0.8879, test_loss: 0.9078, test_f1: 0.5458
 epoch: 98, train_loss: 0.8905, test_loss: 0.9043, test_f1: 0.5386
 epoch: 99, train_loss: 0.8863, test_loss: 0.9072, test_f1: 0.5273
##################ITERATION #2 ****************************************
 epoch: 0, train_loss: 1.3182, test_loss: 1.3392, test_f1: 0.1125
 epoch: 1, train_loss: 1.2854, test_loss: 1.3091, test_f1: 0.2539
 epoch: 2, train_loss: 1.2646, test_loss: 1.2663, test_f1: 0.3186
 epoch: 3, train_loss: 1.2438, test_loss: 1.2353, test_f1: 0.3429
 epoch: 4, train_loss: 1.2243, test_loss: 1.2083, test_f1: 0.3632
 epoch: 5, train_loss: 1.2029, test_loss: 1.1878, test_f1: 0.3316
 epoch: 6, train_loss: 1.1798, test_loss: 1.1650, test_f1: 0.3298
 epoch: 7, train_loss: 1.1637, test_loss: 1.1464, test_f1: 0.3354
 epoch: 8, train_loss: 1.1466, test_loss: 1.1318, test_f1: 0.3339
 epoch: 9, train_loss: 1.1341, test_loss: 1.1208, test_f1: 0.3327
 epoch: 10, train_loss: 1.1171, test_loss: 1.1108, test_f1: 0.3304
 epoch: 11, train_loss: 1.1102, test_loss: 1.1007, test_f1: 0.3315
 epoch: 12, train_loss: 1.0928, test_loss: 1.0945, test_f1: 0.3422
 epoch: 13, train_loss: 1.0847, test_loss: 1.0847, test_f1: 0.3517
 epoch: 14, train_loss: 1.0753, test_loss: 1.0821, test_f1: 0.3738
 epoch: 15, train_loss: 1.0650, test_loss: 1.0731, test_f1: 0.3833
 epoch: 16, train_loss: 1.0528, test_loss: 1.0692, test_f1: 0.4037
 epoch: 17, train_loss: 1.0504, test_loss: 1.0593, test_f1: 0.4394
 epoch: 18, train_loss: 1.0394, test_loss: 1.0582, test_f1: 0.4321
 epoch: 19, train_loss: 1.0282, test_loss: 1.0525, test_f1: 0.4417
 epoch: 20, train_loss: 1.0233, test_loss: 1.0598, test_f1: 0.4416
 epoch: 21, train_loss: 1.0203, test_loss: 1.0476, test_f1: 0.4384
 epoch: 22, train_loss: 1.0135, test_loss: 1.0489, test_f1: 0.4329
 epoch: 23, train_loss: 1.0105, test_loss: 1.0374, test_f1: 0.4583
 epoch: 24, train_loss: 1.0016, test_loss: 1.0420, test_f1: 0.4503
 epoch: 25, train_loss: 0.9942, test_loss: 1.0487, test_f1: 0.4519
 epoch: 26, train_loss: 0.9857, test_loss: 1.0311, test_f1: 0.4621
 epoch: 27, train_loss: 0.9851, test_loss: 1.0277, test_f1: 0.4564
 epoch: 28, train_loss: 0.9783, test_loss: 1.0216, test_f1: 0.4615
 epoch: 29, train_loss: 0.9681, test_loss: 1.0209, test_f1: 0.4653
 epoch: 30, train_loss: 0.9679, test_loss: 1.0371, test_f1: 0.4510
 epoch: 31, train_loss: 0.9613, test_loss: 1.0100, test_f1: 0.4696
 epoch: 32, train_loss: 0.9583, test_loss: 1.0162, test_f1: 0.4751
 epoch: 33, train_loss: 0.9529, test_loss: 1.0113, test_f1: 0.4627
 epoch: 34, train_loss: 0.9565, test_loss: 1.0049, test_f1: 0.4849
 epoch: 35, train_loss: 0.9462, test_loss: 0.9956, test_f1: 0.4865
 epoch: 36, train_loss: 0.9463, test_loss: 0.9939, test_f1: 0.5025
 epoch: 37, train_loss: 0.9400, test_loss: 1.0106, test_f1: 0.4881
 epoch: 38, train_loss: 0.9417, test_loss: 0.9955, test_f1: 0.4784
 epoch: 39, train_loss: 0.9342, test_loss: 1.0080, test_f1: 0.4827
 epoch: 40, train_loss: 0.9255, test_loss: 0.9944, test_f1: 0.4844
 epoch: 41, train_loss: 0.9259, test_loss: 0.9914, test_f1: 0.5031
 epoch: 42, train_loss: 0.9218, test_loss: 0.9840, test_f1: 0.4980
 epoch: 43, train_loss: 0.9235, test_loss: 0.9681, test_f1: 0.4955
 epoch: 44, train_loss: 0.9266, test_loss: 0.9906, test_f1: 0.5058
 epoch: 45, train_loss: 0.9188, test_loss: 1.0108, test_f1: 0.4761
 epoch: 46, train_loss: 0.9216, test_loss: 0.9879, test_f1: 0.5036
 epoch: 47, train_loss: 0.9099, test_loss: 0.9664, test_f1: 0.5047
 epoch: 48, train_loss: 0.9137, test_loss: 0.9812, test_f1: 0.4887
 epoch: 49, train_loss: 0.9197, test_loss: 0.9552, test_f1: 0.5089
 epoch: 50, train_loss: 0.9121, test_loss: 0.9895, test_f1: 0.4976
 epoch: 51, train_loss: 0.9062, test_loss: 0.9422, test_f1: 0.5088
 epoch: 52, train_loss: 0.9026, test_loss: 0.9544, test_f1: 0.5017
 epoch: 53, train_loss: 0.8989, test_loss: 0.9478, test_f1: 0.5084
 epoch: 54, train_loss: 0.8966, test_loss: 0.9521, test_f1: 0.5174
 epoch: 55, train_loss: 0.8994, test_loss: 0.9442, test_f1: 0.5124
 epoch: 56, train_loss: 0.8941, test_loss: 0.9409, test_f1: 0.5100
 epoch: 57, train_loss: 0.8930, test_loss: 0.9401, test_f1: 0.5216
 epoch: 58, train_loss: 0.8874, test_loss: 0.9656, test_f1: 0.5105
 epoch: 59, train_loss: 0.8939, test_loss: 0.9538, test_f1: 0.5078
 epoch: 60, train_loss: 0.8955, test_loss: 0.9703, test_f1: 0.5118
 epoch: 61, train_loss: 0.8898, test_loss: 0.9358, test_f1: 0.5172
 epoch: 62, train_loss: 0.8906, test_loss: 0.9483, test_f1: 0.5119
 epoch: 63, train_loss: 0.8909, test_loss: 0.9575, test_f1: 0.5053
 epoch: 64, train_loss: 0.8880, test_loss: 0.9378, test_f1: 0.5129
 epoch: 65, train_loss: 0.8861, test_loss: 0.9382, test_f1: 0.5123
 epoch: 66, train_loss: 0.8880, test_loss: 0.9601, test_f1: 0.5107
 epoch: 67, train_loss: 0.8833, test_loss: 0.9457, test_f1: 0.5178
 epoch: 68, train_loss: 0.8784, test_loss: 0.9272, test_f1: 0.5207
 epoch: 69, train_loss: 0.8823, test_loss: 0.9469, test_f1: 0.5184
 epoch: 70, train_loss: 0.8785, test_loss: 0.9409, test_f1: 0.5171
 epoch: 71, train_loss: 0.8810, test_loss: 0.9398, test_f1: 0.5166
 epoch: 72, train_loss: 0.8727, test_loss: 0.9389, test_f1: 0.5100
 epoch: 73, train_loss: 0.8849, test_loss: 0.9420, test_f1: 0.5123
 epoch: 74, train_loss: 0.8762, test_loss: 0.9214, test_f1: 0.5182
 epoch: 75, train_loss: 0.8703, test_loss: 0.9333, test_f1: 0.5092
 epoch: 76, train_loss: 0.8679, test_loss: 0.9213, test_f1: 0.5279
 epoch: 77, train_loss: 0.8761, test_loss: 0.9492, test_f1: 0.5089
 epoch: 78, train_loss: 0.8759, test_loss: 0.9277, test_f1: 0.5169
 epoch: 79, train_loss: 0.8649, test_loss: 0.9283, test_f1: 0.5154
 epoch: 80, train_loss: 0.8796, test_loss: 0.9325, test_f1: 0.5173
 epoch: 81, train_loss: 0.8683, test_loss: 0.9422, test_f1: 0.5156
 epoch: 82, train_loss: 0.8713, test_loss: 0.9220, test_f1: 0.5166
 epoch: 83, train_loss: 0.8632, test_loss: 0.9337, test_f1: 0.5121
 epoch: 84, train_loss: 0.8701, test_loss: 0.9354, test_f1: 0.5275
 epoch: 85, train_loss: 0.8696, test_loss: 0.9371, test_f1: 0.5249
 epoch: 86, train_loss: 0.8642, test_loss: 0.9273, test_f1: 0.5274
 epoch: 87, train_loss: 0.8592, test_loss: 0.9355, test_f1: 0.5252
 epoch: 88, train_loss: 0.8673, test_loss: 0.9355, test_f1: 0.5238
 epoch: 89, train_loss: 0.8775, test_loss: 0.9084, test_f1: 0.5205
 epoch: 90, train_loss: 0.8668, test_loss: 0.9147, test_f1: 0.5255
 epoch: 91, train_loss: 0.8631, test_loss: 0.9298, test_f1: 0.5198
 epoch: 92, train_loss: 0.8536, test_loss: 0.9174, test_f1: 0.5216
 epoch: 93, train_loss: 0.8538, test_loss: 0.9140, test_f1: 0.5225
 epoch: 94, train_loss: 0.8590, test_loss: 0.9265, test_f1: 0.5271
 epoch: 95, train_loss: 0.8621, test_loss: 0.9166, test_f1: 0.5201
 epoch: 96, train_loss: 0.8601, test_loss: 0.9444, test_f1: 0.5132
 epoch: 97, train_loss: 0.8616, test_loss: 0.9642, test_f1: 0.5158
 epoch: 98, train_loss: 0.8549, test_loss: 0.9281, test_f1: 0.5122
 epoch: 99, train_loss: 0.8516, test_loss: 0.9236, test_f1: 0.5271
##################ITERATION #3 ****************************************
 epoch: 0, train_loss: 1.3150, test_loss: 1.3170, test_f1: 0.2270
 epoch: 1, train_loss: 1.2696, test_loss: 1.2702, test_f1: 0.2270
 epoch: 2, train_loss: 1.2429, test_loss: 1.2282, test_f1: 0.2962
 epoch: 3, train_loss: 1.2206, test_loss: 1.1942, test_f1: 0.3496
 epoch: 4, train_loss: 1.1996, test_loss: 1.1673, test_f1: 0.3415
 epoch: 5, train_loss: 1.1785, test_loss: 1.1455, test_f1: 0.3462
 epoch: 6, train_loss: 1.1602, test_loss: 1.1243, test_f1: 0.3578
 epoch: 7, train_loss: 1.1401, test_loss: 1.1075, test_f1: 0.3635
 epoch: 8, train_loss: 1.1294, test_loss: 1.0922, test_f1: 0.3978
 epoch: 9, train_loss: 1.1064, test_loss: 1.0749, test_f1: 0.4151
 epoch: 10, train_loss: 1.0903, test_loss: 1.0651, test_f1: 0.4218
 epoch: 11, train_loss: 1.0792, test_loss: 1.0527, test_f1: 0.4294
 epoch: 12, train_loss: 1.0660, test_loss: 1.0484, test_f1: 0.4222
 epoch: 13, train_loss: 1.0538, test_loss: 1.0390, test_f1: 0.4297
 epoch: 14, train_loss: 1.0433, test_loss: 1.0358, test_f1: 0.4387
 epoch: 15, train_loss: 1.0362, test_loss: 1.0278, test_f1: 0.4478
 epoch: 16, train_loss: 1.0260, test_loss: 1.0221, test_f1: 0.4630
 epoch: 17, train_loss: 1.0227, test_loss: 1.0149, test_f1: 0.4680
 epoch: 18, train_loss: 1.0097, test_loss: 1.0172, test_f1: 0.4666
 epoch: 19, train_loss: 1.0030, test_loss: 1.0127, test_f1: 0.4626
 epoch: 20, train_loss: 1.0034, test_loss: 1.0078, test_f1: 0.4666
 epoch: 21, train_loss: 0.9908, test_loss: 0.9986, test_f1: 0.4770
 epoch: 22, train_loss: 0.9821, test_loss: 0.9932, test_f1: 0.4786
 epoch: 23, train_loss: 0.9798, test_loss: 0.9880, test_f1: 0.4809
 epoch: 24, train_loss: 0.9759, test_loss: 0.9819, test_f1: 0.4873
 epoch: 25, train_loss: 0.9638, test_loss: 0.9895, test_f1: 0.4787
 epoch: 26, train_loss: 0.9622, test_loss: 0.9787, test_f1: 0.4881
 epoch: 27, train_loss: 0.9562, test_loss: 0.9770, test_f1: 0.4959
 epoch: 28, train_loss: 0.9536, test_loss: 0.9758, test_f1: 0.4889
 epoch: 29, train_loss: 0.9467, test_loss: 0.9989, test_f1: 0.4724
 epoch: 30, train_loss: 0.9418, test_loss: 0.9707, test_f1: 0.4863
 epoch: 31, train_loss: 0.9401, test_loss: 0.9624, test_f1: 0.4985
 epoch: 32, train_loss: 0.9320, test_loss: 0.9547, test_f1: 0.4983
 epoch: 33, train_loss: 0.9266, test_loss: 0.9637, test_f1: 0.4905
 epoch: 34, train_loss: 0.9241, test_loss: 0.9661, test_f1: 0.4861
 epoch: 35, train_loss: 0.9212, test_loss: 0.9508, test_f1: 0.4943
 epoch: 36, train_loss: 0.9081, test_loss: 0.9540, test_f1: 0.4941
 epoch: 37, train_loss: 0.9180, test_loss: 0.9578, test_f1: 0.4989
 epoch: 38, train_loss: 0.9110, test_loss: 0.9478, test_f1: 0.5117
 epoch: 39, train_loss: 0.9068, test_loss: 0.9505, test_f1: 0.4917
 epoch: 40, train_loss: 0.9031, test_loss: 0.9685, test_f1: 0.5001
 epoch: 41, train_loss: 0.9020, test_loss: 0.9618, test_f1: 0.4999
 epoch: 42, train_loss: 0.8917, test_loss: 0.9529, test_f1: 0.5204
 epoch: 43, train_loss: 0.8991, test_loss: 0.9418, test_f1: 0.5120
 epoch: 44, train_loss: 0.8880, test_loss: 0.9335, test_f1: 0.5237
 epoch: 45, train_loss: 0.8873, test_loss: 0.9418, test_f1: 0.5126
 epoch: 46, train_loss: 0.8989, test_loss: 0.9145, test_f1: 0.5303
 epoch: 47, train_loss: 0.8774, test_loss: 0.9271, test_f1: 0.5115
 epoch: 48, train_loss: 0.8800, test_loss: 0.9406, test_f1: 0.5122
 epoch: 49, train_loss: 0.8922, test_loss: 0.9568, test_f1: 0.5257
 epoch: 50, train_loss: 0.8743, test_loss: 0.9343, test_f1: 0.5124
 epoch: 51, train_loss: 0.8748, test_loss: 0.9492, test_f1: 0.5089
 epoch: 52, train_loss: 0.8671, test_loss: 0.9353, test_f1: 0.5086
 epoch: 53, train_loss: 0.8734, test_loss: 0.9290, test_f1: 0.5177
 epoch: 54, train_loss: 0.8605, test_loss: 0.9356, test_f1: 0.5132
 epoch: 55, train_loss: 0.8719, test_loss: 0.9247, test_f1: 0.5231
 epoch: 56, train_loss: 0.8658, test_loss: 0.9240, test_f1: 0.5176
 epoch: 57, train_loss: 0.8661, test_loss: 0.9341, test_f1: 0.5183
 epoch: 58, train_loss: 0.8619, test_loss: 0.9306, test_f1: 0.5125
 epoch: 59, train_loss: 0.8587, test_loss: 0.9293, test_f1: 0.5101
 epoch: 60, train_loss: 0.8601, test_loss: 0.9252, test_f1: 0.5172
 epoch: 61, train_loss: 0.8543, test_loss: 0.9193, test_f1: 0.5142
 epoch: 62, train_loss: 0.8531, test_loss: 0.9257, test_f1: 0.5126
 epoch: 63, train_loss: 0.8541, test_loss: 0.9317, test_f1: 0.5088
 epoch: 64, train_loss: 0.8588, test_loss: 0.9288, test_f1: 0.5044
 epoch: 65, train_loss: 0.8551, test_loss: 0.9259, test_f1: 0.5212
 epoch: 66, train_loss: 0.8525, test_loss: 0.9173, test_f1: 0.5081
 epoch: 67, train_loss: 0.8474, test_loss: 0.9234, test_f1: 0.5060
 epoch: 68, train_loss: 0.8523, test_loss: 0.9310, test_f1: 0.5089
 epoch: 69, train_loss: 0.8534, test_loss: 0.9382, test_f1: 0.5011
 epoch: 70, train_loss: 0.8504, test_loss: 0.9278, test_f1: 0.5187
 epoch: 71, train_loss: 0.8436, test_loss: 0.9328, test_f1: 0.5153
 epoch: 72, train_loss: 0.8422, test_loss: 0.9318, test_f1: 0.5154
 epoch: 73, train_loss: 0.8487, test_loss: 0.9233, test_f1: 0.5127
 epoch: 74, train_loss: 0.8442, test_loss: 0.9337, test_f1: 0.5215
 epoch: 75, train_loss: 0.8385, test_loss: 0.9245, test_f1: 0.5143
 epoch: 76, train_loss: 0.8437, test_loss: 0.9282, test_f1: 0.5143
 epoch: 77, train_loss: 0.8454, test_loss: 0.9334, test_f1: 0.5096
 epoch: 78, train_loss: 0.8345, test_loss: 0.9159, test_f1: 0.5167
 epoch: 79, train_loss: 0.8360, test_loss: 0.9271, test_f1: 0.5093
 epoch: 80, train_loss: 0.8455, test_loss: 0.9247, test_f1: 0.5251
 epoch: 81, train_loss: 0.8426, test_loss: 0.9179, test_f1: 0.5189
 epoch: 82, train_loss: 0.8345, test_loss: 0.9257, test_f1: 0.5090
 epoch: 83, train_loss: 0.8360, test_loss: 0.9339, test_f1: 0.5105
 epoch: 84, train_loss: 0.8257, test_loss: 0.9291, test_f1: 0.5145
 epoch: 85, train_loss: 0.8332, test_loss: 0.9341, test_f1: 0.5184
 epoch: 86, train_loss: 0.8246, test_loss: 0.9409, test_f1: 0.5114
 epoch: 87, train_loss: 0.8260, test_loss: 0.9314, test_f1: 0.5207
 epoch: 88, train_loss: 0.8301, test_loss: 0.9285, test_f1: 0.5173
 epoch: 89, train_loss: 0.8292, test_loss: 0.9259, test_f1: 0.5110
 epoch: 90, train_loss: 0.8269, test_loss: 0.9272, test_f1: 0.5170
 epoch: 91, train_loss: 0.8211, test_loss: 0.9286, test_f1: 0.5178
 epoch: 92, train_loss: 0.8225, test_loss: 0.9135, test_f1: 0.5178
 epoch: 93, train_loss: 0.8256, test_loss: 0.9209, test_f1: 0.5155
 epoch: 94, train_loss: 0.8264, test_loss: 0.9137, test_f1: 0.5225
 epoch: 95, train_loss: 0.8183, test_loss: 0.9372, test_f1: 0.5157
 epoch: 96, train_loss: 0.8184, test_loss: 0.9296, test_f1: 0.5149
 epoch: 97, train_loss: 0.8147, test_loss: 0.9141, test_f1: 0.5257
 epoch: 98, train_loss: 0.8243, test_loss: 0.9336, test_f1: 0.5206
 epoch: 99, train_loss: 0.8149, test_loss: 0.9252, test_f1: 0.5095
##################ITERATION #4 ****************************************
 epoch: 0, train_loss: 1.2857, test_loss: 1.3117, test_f1: 0.2270
 epoch: 1, train_loss: 1.2482, test_loss: 1.2753, test_f1: 0.2661
 epoch: 2, train_loss: 1.2310, test_loss: 1.2116, test_f1: 0.2771
 epoch: 3, train_loss: 1.2069, test_loss: 1.1752, test_f1: 0.3639
 epoch: 4, train_loss: 1.1857, test_loss: 1.1503, test_f1: 0.4147
 epoch: 5, train_loss: 1.1602, test_loss: 1.1219, test_f1: 0.4262
 epoch: 6, train_loss: 1.1360, test_loss: 1.1020, test_f1: 0.4421
 epoch: 7, train_loss: 1.1156, test_loss: 1.0803, test_f1: 0.4541
 epoch: 8, train_loss: 1.0974, test_loss: 1.0673, test_f1: 0.4427
 epoch: 9, train_loss: 1.0817, test_loss: 1.0557, test_f1: 0.4641
 epoch: 10, train_loss: 1.0684, test_loss: 1.0397, test_f1: 0.4588
 epoch: 11, train_loss: 1.0662, test_loss: 1.0368, test_f1: 0.4674
 epoch: 12, train_loss: 1.0472, test_loss: 1.0246, test_f1: 0.4743
 epoch: 13, train_loss: 1.0355, test_loss: 1.0184, test_f1: 0.4723
 epoch: 14, train_loss: 1.0320, test_loss: 1.0108, test_f1: 0.4741
 epoch: 15, train_loss: 1.0250, test_loss: 1.0052, test_f1: 0.4869
 epoch: 16, train_loss: 1.0146, test_loss: 0.9940, test_f1: 0.4752
 epoch: 17, train_loss: 1.0187, test_loss: 0.9875, test_f1: 0.4953
 epoch: 18, train_loss: 1.0029, test_loss: 0.9850, test_f1: 0.4803
 epoch: 19, train_loss: 1.0002, test_loss: 0.9866, test_f1: 0.4891
 epoch: 20, train_loss: 0.9905, test_loss: 0.9873, test_f1: 0.4844
 epoch: 21, train_loss: 0.9911, test_loss: 0.9807, test_f1: 0.4950
 epoch: 22, train_loss: 0.9914, test_loss: 0.9780, test_f1: 0.4999
 epoch: 23, train_loss: 0.9800, test_loss: 0.9685, test_f1: 0.5038
 epoch: 24, train_loss: 0.9769, test_loss: 0.9575, test_f1: 0.5041
 epoch: 25, train_loss: 0.9744, test_loss: 0.9624, test_f1: 0.4965
 epoch: 26, train_loss: 0.9690, test_loss: 0.9518, test_f1: 0.5050
 epoch: 27, train_loss: 0.9657, test_loss: 0.9418, test_f1: 0.5152
 epoch: 28, train_loss: 0.9659, test_loss: 0.9480, test_f1: 0.5066
 epoch: 29, train_loss: 0.9543, test_loss: 0.9685, test_f1: 0.4977
 epoch: 30, train_loss: 0.9590, test_loss: 0.9439, test_f1: 0.5182
 epoch: 31, train_loss: 0.9542, test_loss: 0.9482, test_f1: 0.5033
 epoch: 32, train_loss: 0.9501, test_loss: 0.9384, test_f1: 0.5171
 epoch: 33, train_loss: 0.9496, test_loss: 0.9399, test_f1: 0.4992
 epoch: 34, train_loss: 0.9422, test_loss: 0.9424, test_f1: 0.5131
 epoch: 35, train_loss: 0.9373, test_loss: 0.9450, test_f1: 0.5217
 epoch: 36, train_loss: 0.9420, test_loss: 0.9320, test_f1: 0.5119
 epoch: 37, train_loss: 0.9391, test_loss: 0.9204, test_f1: 0.5231
 epoch: 38, train_loss: 0.9304, test_loss: 0.9249, test_f1: 0.5143
 epoch: 39, train_loss: 0.9347, test_loss: 0.9240, test_f1: 0.5186
 epoch: 40, train_loss: 0.9221, test_loss: 0.9209, test_f1: 0.5238
 epoch: 41, train_loss: 0.9313, test_loss: 0.9238, test_f1: 0.5173
 epoch: 42, train_loss: 0.9281, test_loss: 0.9099, test_f1: 0.5144
 epoch: 43, train_loss: 0.9175, test_loss: 0.9260, test_f1: 0.5200
 epoch: 44, train_loss: 0.9197, test_loss: 0.9144, test_f1: 0.5132
 epoch: 45, train_loss: 0.9131, test_loss: 0.9004, test_f1: 0.5207
 epoch: 46, train_loss: 0.9175, test_loss: 0.9050, test_f1: 0.5195
 epoch: 47, train_loss: 0.9139, test_loss: 0.8950, test_f1: 0.5210
 epoch: 48, train_loss: 0.9067, test_loss: 0.8946, test_f1: 0.5242
 epoch: 49, train_loss: 0.8989, test_loss: 0.9019, test_f1: 0.5252
 epoch: 50, train_loss: 0.8961, test_loss: 0.9024, test_f1: 0.5276
 epoch: 51, train_loss: 0.8964, test_loss: 0.8918, test_f1: 0.5252
 epoch: 52, train_loss: 0.8976, test_loss: 0.8951, test_f1: 0.5240
 epoch: 53, train_loss: 0.9012, test_loss: 0.8900, test_f1: 0.5253
 epoch: 54, train_loss: 0.8888, test_loss: 0.8959, test_f1: 0.5247
 epoch: 55, train_loss: 0.8882, test_loss: 0.8815, test_f1: 0.5284
 epoch: 56, train_loss: 0.8904, test_loss: 0.8900, test_f1: 0.5249
 epoch: 57, train_loss: 0.8831, test_loss: 0.8870, test_f1: 0.5264
 epoch: 58, train_loss: 0.8812, test_loss: 0.8791, test_f1: 0.5257
 epoch: 59, train_loss: 0.8924, test_loss: 0.8809, test_f1: 0.5221
 epoch: 60, train_loss: 0.8907, test_loss: 0.8847, test_f1: 0.5238
 epoch: 61, train_loss: 0.8835, test_loss: 0.8764, test_f1: 0.5381
 epoch: 62, train_loss: 0.8851, test_loss: 0.8839, test_f1: 0.5251
 epoch: 63, train_loss: 0.8872, test_loss: 0.8815, test_f1: 0.5270
 epoch: 64, train_loss: 0.8805, test_loss: 0.8824, test_f1: 0.5228
 epoch: 65, train_loss: 0.8876, test_loss: 0.8761, test_f1: 0.5314
 epoch: 66, train_loss: 0.8784, test_loss: 0.8741, test_f1: 0.5303
 epoch: 67, train_loss: 0.8812, test_loss: 0.8755, test_f1: 0.5326
 epoch: 68, train_loss: 0.8714, test_loss: 0.8708, test_f1: 0.5389
 epoch: 69, train_loss: 0.8742, test_loss: 0.8727, test_f1: 0.5261
 epoch: 70, train_loss: 0.8688, test_loss: 0.8675, test_f1: 0.5399
 epoch: 71, train_loss: 0.8719, test_loss: 0.8740, test_f1: 0.5235
 epoch: 72, train_loss: 0.8699, test_loss: 0.8702, test_f1: 0.5337
 epoch: 73, train_loss: 0.8694, test_loss: 0.8661, test_f1: 0.5409
 epoch: 74, train_loss: 0.8690, test_loss: 0.8653, test_f1: 0.5311
 epoch: 75, train_loss: 0.8717, test_loss: 0.8674, test_f1: 0.5397
 epoch: 76, train_loss: 0.8623, test_loss: 0.8676, test_f1: 0.5295
 epoch: 77, train_loss: 0.8656, test_loss: 0.8675, test_f1: 0.5358
 epoch: 78, train_loss: 0.8635, test_loss: 0.8648, test_f1: 0.5385
 epoch: 79, train_loss: 0.8675, test_loss: 0.8643, test_f1: 0.5334
 epoch: 80, train_loss: 0.8615, test_loss: 0.8629, test_f1: 0.5443
 epoch: 81, train_loss: 0.8626, test_loss: 0.8593, test_f1: 0.5334
 epoch: 82, train_loss: 0.8705, test_loss: 0.8559, test_f1: 0.5437
 epoch: 83, train_loss: 0.8648, test_loss: 0.8581, test_f1: 0.5384
 epoch: 84, train_loss: 0.8609, test_loss: 0.8625, test_f1: 0.5368
 epoch: 85, train_loss: 0.8584, test_loss: 0.8592, test_f1: 0.5461
 epoch: 86, train_loss: 0.8595, test_loss: 0.8501, test_f1: 0.5456
 epoch: 87, train_loss: 0.8670, test_loss: 0.8601, test_f1: 0.5251
 epoch: 88, train_loss: 0.8602, test_loss: 0.8579, test_f1: 0.5456
 epoch: 89, train_loss: 0.8515, test_loss: 0.8452, test_f1: 0.5433
 epoch: 90, train_loss: 0.8563, test_loss: 0.8472, test_f1: 0.5368
 epoch: 91, train_loss: 0.8556, test_loss: 0.8529, test_f1: 0.5448
 epoch: 92, train_loss: 0.8548, test_loss: 0.8505, test_f1: 0.5419
 epoch: 93, train_loss: 0.8528, test_loss: 0.8598, test_f1: 0.5323
 epoch: 94, train_loss: 0.8565, test_loss: 0.8498, test_f1: 0.5404
 epoch: 95, train_loss: 0.8489, test_loss: 0.8476, test_f1: 0.5407
 epoch: 96, train_loss: 0.8483, test_loss: 0.8490, test_f1: 0.5427
 epoch: 97, train_loss: 0.8506, test_loss: 0.8560, test_f1: 0.5267
 epoch: 98, train_loss: 0.8545, test_loss: 0.8493, test_f1: 0.5417
 epoch: 99, train_loss: 0.8455, test_loss: 0.8528, test_f1: 0.5484
##################ITERATION #5 ****************************************
 epoch: 0, train_loss: 1.2812, test_loss: 1.3215, test_f1: 0.2270
 epoch: 1, train_loss: 1.2318, test_loss: 1.2864, test_f1: 0.2270
 epoch: 2, train_loss: 1.2068, test_loss: 1.1797, test_f1: 0.3335
 epoch: 3, train_loss: 1.1812, test_loss: 1.1435, test_f1: 0.3944
 epoch: 4, train_loss: 1.1515, test_loss: 1.1148, test_f1: 0.4039
 epoch: 5, train_loss: 1.1305, test_loss: 1.0956, test_f1: 0.4246
 epoch: 6, train_loss: 1.1100, test_loss: 1.0778, test_f1: 0.4415
 epoch: 7, train_loss: 1.0943, test_loss: 1.0597, test_f1: 0.4533
 epoch: 8, train_loss: 1.0788, test_loss: 1.0495, test_f1: 0.4551
 epoch: 9, train_loss: 1.0602, test_loss: 1.0434, test_f1: 0.4521
 epoch: 10, train_loss: 1.0539, test_loss: 1.0302, test_f1: 0.4536
 epoch: 11, train_loss: 1.0359, test_loss: 1.0256, test_f1: 0.4532
 epoch: 12, train_loss: 1.0310, test_loss: 1.0149, test_f1: 0.4704
 epoch: 13, train_loss: 1.0225, test_loss: 1.0160, test_f1: 0.4556
 epoch: 14, train_loss: 1.0110, test_loss: 1.0024, test_f1: 0.4704
 epoch: 15, train_loss: 1.0028, test_loss: 0.9996, test_f1: 0.4769
 epoch: 16, train_loss: 0.9923, test_loss: 0.9910, test_f1: 0.4799
 epoch: 17, train_loss: 0.9923, test_loss: 1.0122, test_f1: 0.4479
 epoch: 18, train_loss: 0.9945, test_loss: 0.9856, test_f1: 0.4755
 epoch: 19, train_loss: 0.9772, test_loss: 0.9794, test_f1: 0.4784
 epoch: 20, train_loss: 0.9740, test_loss: 0.9670, test_f1: 0.4906
 epoch: 21, train_loss: 0.9716, test_loss: 0.9694, test_f1: 0.4862
 epoch: 22, train_loss: 0.9614, test_loss: 0.9626, test_f1: 0.4887
 epoch: 23, train_loss: 0.9597, test_loss: 0.9537, test_f1: 0.4950
 epoch: 24, train_loss: 0.9499, test_loss: 0.9490, test_f1: 0.4920
 epoch: 25, train_loss: 0.9450, test_loss: 0.9360, test_f1: 0.4960
 epoch: 26, train_loss: 0.9399, test_loss: 0.9348, test_f1: 0.5049
 epoch: 27, train_loss: 0.9398, test_loss: 0.9327, test_f1: 0.5085
 epoch: 28, train_loss: 0.9369, test_loss: 0.9341, test_f1: 0.4930
 epoch: 29, train_loss: 0.9262, test_loss: 0.9438, test_f1: 0.5041
 epoch: 30, train_loss: 0.9243, test_loss: 0.9251, test_f1: 0.5065
 epoch: 31, train_loss: 0.9259, test_loss: 0.9107, test_f1: 0.5045
 epoch: 32, train_loss: 0.9216, test_loss: 0.9119, test_f1: 0.5055
 epoch: 33, train_loss: 0.9086, test_loss: 0.9082, test_f1: 0.5187
 epoch: 34, train_loss: 0.9110, test_loss: 0.8979, test_f1: 0.5220
 epoch: 35, train_loss: 0.9036, test_loss: 0.9045, test_f1: 0.5241
 epoch: 36, train_loss: 0.9108, test_loss: 0.9148, test_f1: 0.5110
 epoch: 37, train_loss: 0.9096, test_loss: 0.8944, test_f1: 0.5307
 epoch: 38, train_loss: 0.8969, test_loss: 0.9023, test_f1: 0.5260
 epoch: 39, train_loss: 0.8953, test_loss: 0.8959, test_f1: 0.5257
 epoch: 40, train_loss: 0.8989, test_loss: 0.9032, test_f1: 0.5304
 epoch: 41, train_loss: 0.8854, test_loss: 0.8869, test_f1: 0.5287
 epoch: 42, train_loss: 0.8906, test_loss: 0.8895, test_f1: 0.5197
 epoch: 43, train_loss: 0.8874, test_loss: 0.8855, test_f1: 0.5256
 epoch: 44, train_loss: 0.8874, test_loss: 0.8860, test_f1: 0.5279
 epoch: 45, train_loss: 0.8891, test_loss: 0.8801, test_f1: 0.5410
 epoch: 46, train_loss: 0.8772, test_loss: 0.8776, test_f1: 0.5174
 epoch: 47, train_loss: 0.8727, test_loss: 0.9179, test_f1: 0.5247
 epoch: 48, train_loss: 0.8736, test_loss: 0.8620, test_f1: 0.5342
 epoch: 49, train_loss: 0.8712, test_loss: 0.8659, test_f1: 0.5198
 epoch: 50, train_loss: 0.8679, test_loss: 0.8739, test_f1: 0.5214
 epoch: 51, train_loss: 0.8675, test_loss: 0.8617, test_f1: 0.5341
 epoch: 52, train_loss: 0.8693, test_loss: 0.8589, test_f1: 0.5352
 epoch: 53, train_loss: 0.8641, test_loss: 0.8572, test_f1: 0.5412
 epoch: 54, train_loss: 0.8670, test_loss: 0.8653, test_f1: 0.5290
 epoch: 55, train_loss: 0.8623, test_loss: 0.8587, test_f1: 0.5379
 epoch: 56, train_loss: 0.8586, test_loss: 0.8640, test_f1: 0.5445
 epoch: 57, train_loss: 0.8540, test_loss: 0.8574, test_f1: 0.5461
 epoch: 58, train_loss: 0.8552, test_loss: 0.8568, test_f1: 0.5365
 epoch: 59, train_loss: 0.8548, test_loss: 0.8580, test_f1: 0.5402
 epoch: 60, train_loss: 0.8546, test_loss: 0.8559, test_f1: 0.5316
 epoch: 61, train_loss: 0.8554, test_loss: 0.8636, test_f1: 0.5228
 epoch: 62, train_loss: 0.8484, test_loss: 0.8483, test_f1: 0.5365
 epoch: 63, train_loss: 0.8575, test_loss: 0.8556, test_f1: 0.5392
 epoch: 64, train_loss: 0.8532, test_loss: 0.8489, test_f1: 0.5332
 epoch: 65, train_loss: 0.8601, test_loss: 0.8575, test_f1: 0.5292
 epoch: 66, train_loss: 0.8470, test_loss: 0.8491, test_f1: 0.5341
 epoch: 67, train_loss: 0.8454, test_loss: 0.8736, test_f1: 0.5325
 epoch: 68, train_loss: 0.8523, test_loss: 0.8530, test_f1: 0.5266
 epoch: 69, train_loss: 0.8453, test_loss: 0.8508, test_f1: 0.5470
 epoch: 70, train_loss: 0.8535, test_loss: 0.8559, test_f1: 0.5333
 epoch: 71, train_loss: 0.8448, test_loss: 0.8517, test_f1: 0.5496
 epoch: 72, train_loss: 0.8478, test_loss: 0.8527, test_f1: 0.5468
 epoch: 73, train_loss: 0.8445, test_loss: 0.8486, test_f1: 0.5341
 epoch: 74, train_loss: 0.8466, test_loss: 0.8503, test_f1: 0.5371
 epoch: 75, train_loss: 0.8389, test_loss: 0.8548, test_f1: 0.5449
 epoch: 76, train_loss: 0.8427, test_loss: 0.8515, test_f1: 0.5434
 epoch: 77, train_loss: 0.8422, test_loss: 0.8468, test_f1: 0.5259
 epoch: 78, train_loss: 0.8364, test_loss: 0.8598, test_f1: 0.5350
 epoch: 79, train_loss: 0.8418, test_loss: 0.8471, test_f1: 0.5317
 epoch: 80, train_loss: 0.8456, test_loss: 0.8488, test_f1: 0.5246
 epoch: 81, train_loss: 0.8443, test_loss: 0.8494, test_f1: 0.5265
 epoch: 82, train_loss: 0.8351, test_loss: 0.8503, test_f1: 0.5267
 epoch: 83, train_loss: 0.8375, test_loss: 0.8468, test_f1: 0.5357
 epoch: 84, train_loss: 0.8342, test_loss: 0.8487, test_f1: 0.5363
 epoch: 85, train_loss: 0.8299, test_loss: 0.8543, test_f1: 0.5427
 epoch: 86, train_loss: 0.8286, test_loss: 0.8449, test_f1: 0.5343
 epoch: 87, train_loss: 0.8361, test_loss: 0.8461, test_f1: 0.5285
 epoch: 88, train_loss: 0.8306, test_loss: 0.8596, test_f1: 0.5220
 epoch: 89, train_loss: 0.8297, test_loss: 0.8556, test_f1: 0.5284
 epoch: 90, train_loss: 0.8285, test_loss: 0.8501, test_f1: 0.5270
 epoch: 91, train_loss: 0.8244, test_loss: 0.8586, test_f1: 0.5266
 epoch: 92, train_loss: 0.8335, test_loss: 0.8526, test_f1: 0.5223
 epoch: 93, train_loss: 0.8249, test_loss: 0.8448, test_f1: 0.5323
 epoch: 94, train_loss: 0.8270, test_loss: 0.8488, test_f1: 0.5425
 epoch: 95, train_loss: 0.8288, test_loss: 0.8480, test_f1: 0.5450
 epoch: 96, train_loss: 0.8339, test_loss: 0.8455, test_f1: 0.5404
 epoch: 97, train_loss: 0.8214, test_loss: 0.8525, test_f1: 0.5409
 epoch: 98, train_loss: 0.8160, test_loss: 0.8490, test_f1: 0.5411
 epoch: 99, train_loss: 0.8255, test_loss: 0.8506, test_f1: 0.5410
##################ITERATION #6 ****************************************
 epoch: 0, train_loss: 1.3140, test_loss: 1.3440, test_f1: 0.2270
 epoch: 1, train_loss: 1.2618, test_loss: 1.2655, test_f1: 0.2270
 epoch: 2, train_loss: 1.2416, test_loss: 1.1985, test_f1: 0.2270
 epoch: 3, train_loss: 1.2119, test_loss: 1.1608, test_f1: 0.2993
 epoch: 4, train_loss: 1.1866, test_loss: 1.1284, test_f1: 0.3335
 epoch: 5, train_loss: 1.1502, test_loss: 1.0981, test_f1: 0.3662
 epoch: 6, train_loss: 1.1279, test_loss: 1.0770, test_f1: 0.4049
 epoch: 7, train_loss: 1.1088, test_loss: 1.0612, test_f1: 0.4016
 epoch: 8, train_loss: 1.0955, test_loss: 1.0462, test_f1: 0.4226
 epoch: 9, train_loss: 1.0722, test_loss: 1.0456, test_f1: 0.4276
 epoch: 10, train_loss: 1.0662, test_loss: 1.0329, test_f1: 0.4329
 epoch: 11, train_loss: 1.0540, test_loss: 1.0262, test_f1: 0.4337
 epoch: 12, train_loss: 1.0452, test_loss: 1.0231, test_f1: 0.4340
 epoch: 13, train_loss: 1.0310, test_loss: 1.0205, test_f1: 0.4409
 epoch: 14, train_loss: 1.0305, test_loss: 1.0142, test_f1: 0.4396
 epoch: 15, train_loss: 1.0260, test_loss: 1.0059, test_f1: 0.4611
 epoch: 16, train_loss: 1.0206, test_loss: 1.0043, test_f1: 0.4721
 epoch: 17, train_loss: 1.0123, test_loss: 0.9991, test_f1: 0.4710
 epoch: 18, train_loss: 1.0032, test_loss: 0.9942, test_f1: 0.4681
 epoch: 19, train_loss: 1.0034, test_loss: 0.9872, test_f1: 0.4907
 epoch: 20, train_loss: 0.9969, test_loss: 0.9840, test_f1: 0.4952
 epoch: 21, train_loss: 0.9955, test_loss: 0.9993, test_f1: 0.4699
 epoch: 22, train_loss: 0.9842, test_loss: 0.9763, test_f1: 0.4920
 epoch: 23, train_loss: 0.9822, test_loss: 0.9831, test_f1: 0.4941
 epoch: 24, train_loss: 0.9748, test_loss: 0.9748, test_f1: 0.4974
 epoch: 25, train_loss: 0.9761, test_loss: 0.9720, test_f1: 0.4898
 epoch: 26, train_loss: 0.9650, test_loss: 0.9642, test_f1: 0.4965
 epoch: 27, train_loss: 0.9606, test_loss: 0.9582, test_f1: 0.5015
 epoch: 28, train_loss: 0.9570, test_loss: 0.9545, test_f1: 0.5107
 epoch: 29, train_loss: 0.9490, test_loss: 0.9691, test_f1: 0.4834
 epoch: 30, train_loss: 0.9497, test_loss: 0.9548, test_f1: 0.4902
 epoch: 31, train_loss: 0.9417, test_loss: 0.9553, test_f1: 0.4922
 epoch: 32, train_loss: 0.9472, test_loss: 0.9579, test_f1: 0.4978
 epoch: 33, train_loss: 0.9302, test_loss: 0.9575, test_f1: 0.4977
 epoch: 34, train_loss: 0.9358, test_loss: 0.9487, test_f1: 0.5009
 epoch: 35, train_loss: 0.9272, test_loss: 0.9384, test_f1: 0.5109
 epoch: 36, train_loss: 0.9277, test_loss: 0.9316, test_f1: 0.5061
 epoch: 37, train_loss: 0.9183, test_loss: 0.9369, test_f1: 0.5073
 epoch: 38, train_loss: 0.9149, test_loss: 0.9297, test_f1: 0.5054
 epoch: 39, train_loss: 0.9149, test_loss: 0.9183, test_f1: 0.5256
 epoch: 40, train_loss: 0.9120, test_loss: 0.9306, test_f1: 0.5057
 epoch: 41, train_loss: 0.9122, test_loss: 0.9183, test_f1: 0.5034
 epoch: 42, train_loss: 0.9167, test_loss: 0.9656, test_f1: 0.4903
 epoch: 43, train_loss: 0.9125, test_loss: 0.9326, test_f1: 0.5084
 epoch: 44, train_loss: 0.9042, test_loss: 0.9246, test_f1: 0.5029
 epoch: 45, train_loss: 0.8990, test_loss: 0.9157, test_f1: 0.5256
 epoch: 46, train_loss: 0.9000, test_loss: 0.9013, test_f1: 0.5189
 epoch: 47, train_loss: 0.8948, test_loss: 0.9130, test_f1: 0.5309
 epoch: 48, train_loss: 0.8987, test_loss: 0.9134, test_f1: 0.5129
 epoch: 49, train_loss: 0.8902, test_loss: 0.8986, test_f1: 0.5189
 epoch: 50, train_loss: 0.8876, test_loss: 0.9056, test_f1: 0.5349
 epoch: 51, train_loss: 0.8782, test_loss: 0.9065, test_f1: 0.5270
 epoch: 52, train_loss: 0.8815, test_loss: 0.9020, test_f1: 0.5236
 epoch: 53, train_loss: 0.8813, test_loss: 0.8997, test_f1: 0.5387
 epoch: 54, train_loss: 0.8796, test_loss: 0.8942, test_f1: 0.5290
 epoch: 55, train_loss: 0.8836, test_loss: 0.8973, test_f1: 0.5222
 epoch: 56, train_loss: 0.8726, test_loss: 0.8994, test_f1: 0.5289
 epoch: 57, train_loss: 0.8778, test_loss: 0.9008, test_f1: 0.5337
 epoch: 58, train_loss: 0.8723, test_loss: 0.9080, test_f1: 0.5304
 epoch: 59, train_loss: 0.8637, test_loss: 0.8943, test_f1: 0.5283
 epoch: 60, train_loss: 0.8676, test_loss: 0.8962, test_f1: 0.5303
 epoch: 61, train_loss: 0.8683, test_loss: 0.8999, test_f1: 0.5311
 epoch: 62, train_loss: 0.8662, test_loss: 0.8979, test_f1: 0.5330
 epoch: 63, train_loss: 0.8655, test_loss: 0.8906, test_f1: 0.5340
 epoch: 64, train_loss: 0.8696, test_loss: 0.8895, test_f1: 0.5395
 epoch: 65, train_loss: 0.8703, test_loss: 0.8947, test_f1: 0.5368
 epoch: 66, train_loss: 0.8670, test_loss: 0.8869, test_f1: 0.5287
 epoch: 67, train_loss: 0.8706, test_loss: 0.8870, test_f1: 0.5347
 epoch: 68, train_loss: 0.8565, test_loss: 0.8940, test_f1: 0.5341
 epoch: 69, train_loss: 0.8557, test_loss: 0.8876, test_f1: 0.5380
 epoch: 70, train_loss: 0.8652, test_loss: 0.8831, test_f1: 0.5424
 epoch: 71, train_loss: 0.8668, test_loss: 0.8896, test_f1: 0.5404
 epoch: 72, train_loss: 0.8593, test_loss: 0.8881, test_f1: 0.5317
 epoch: 73, train_loss: 0.8565, test_loss: 0.8850, test_f1: 0.5331
 epoch: 74, train_loss: 0.8650, test_loss: 0.8927, test_f1: 0.5382
 epoch: 75, train_loss: 0.8468, test_loss: 0.8829, test_f1: 0.5322
 epoch: 76, train_loss: 0.8570, test_loss: 0.8775, test_f1: 0.5302
 epoch: 77, train_loss: 0.8486, test_loss: 0.8795, test_f1: 0.5408
 epoch: 78, train_loss: 0.8532, test_loss: 0.8808, test_f1: 0.5380
 epoch: 79, train_loss: 0.8478, test_loss: 0.8844, test_f1: 0.5373
 epoch: 80, train_loss: 0.8436, test_loss: 0.8842, test_f1: 0.5330
 epoch: 81, train_loss: 0.8393, test_loss: 0.8758, test_f1: 0.5356
 epoch: 82, train_loss: 0.8439, test_loss: 0.8834, test_f1: 0.5344
 epoch: 83, train_loss: 0.8398, test_loss: 0.8798, test_f1: 0.5343
 epoch: 84, train_loss: 0.8502, test_loss: 0.8818, test_f1: 0.5343
 epoch: 85, train_loss: 0.8419, test_loss: 0.8882, test_f1: 0.5385
 epoch: 86, train_loss: 0.8445, test_loss: 0.8774, test_f1: 0.5431
 epoch: 87, train_loss: 0.8481, test_loss: 0.8770, test_f1: 0.5342
 epoch: 88, train_loss: 0.8456, test_loss: 0.8731, test_f1: 0.5382
 epoch: 89, train_loss: 0.8401, test_loss: 0.8798, test_f1: 0.5232
 epoch: 90, train_loss: 0.8439, test_loss: 0.8735, test_f1: 0.5349
 epoch: 91, train_loss: 0.8434, test_loss: 0.8779, test_f1: 0.5296
 epoch: 92, train_loss: 0.8374, test_loss: 0.8784, test_f1: 0.5307
 epoch: 93, train_loss: 0.8347, test_loss: 0.8807, test_f1: 0.5330
 epoch: 94, train_loss: 0.8344, test_loss: 0.8770, test_f1: 0.5381
 epoch: 95, train_loss: 0.8402, test_loss: 0.8759, test_f1: 0.5348
 epoch: 96, train_loss: 0.8344, test_loss: 0.8755, test_f1: 0.5331
 epoch: 97, train_loss: 0.8363, test_loss: 0.8744, test_f1: 0.5383
 epoch: 98, train_loss: 0.8353, test_loss: 0.8748, test_f1: 0.5427
 epoch: 99, train_loss: 0.8384, test_loss: 0.8722, test_f1: 0.5345
##################ITERATION #7 ****************************************
 epoch: 0, train_loss: 1.2959, test_loss: 1.3157, test_f1: 0.2270
 epoch: 1, train_loss: 1.2271, test_loss: 1.2993, test_f1: 0.2506
 epoch: 2, train_loss: 1.1833, test_loss: 1.1839, test_f1: 0.3445
 epoch: 3, train_loss: 1.1547, test_loss: 1.1049, test_f1: 0.4177
 epoch: 4, train_loss: 1.1267, test_loss: 1.0839, test_f1: 0.4285
 epoch: 5, train_loss: 1.0997, test_loss: 1.0722, test_f1: 0.4324
 epoch: 6, train_loss: 1.0880, test_loss: 1.0588, test_f1: 0.4444
 epoch: 7, train_loss: 1.0737, test_loss: 1.0486, test_f1: 0.4435
 epoch: 8, train_loss: 1.0572, test_loss: 1.0451, test_f1: 0.4464
 epoch: 9, train_loss: 1.0419, test_loss: 1.0346, test_f1: 0.4651
 epoch: 10, train_loss: 1.0354, test_loss: 1.0315, test_f1: 0.4780
 epoch: 11, train_loss: 1.0352, test_loss: 1.0254, test_f1: 0.4706
 epoch: 12, train_loss: 1.0191, test_loss: 1.0229, test_f1: 0.4720
 epoch: 13, train_loss: 1.0118, test_loss: 1.0179, test_f1: 0.4869
 epoch: 14, train_loss: 1.0111, test_loss: 1.0194, test_f1: 0.4884
 epoch: 15, train_loss: 1.0074, test_loss: 1.0139, test_f1: 0.4838
 epoch: 16, train_loss: 0.9998, test_loss: 1.0074, test_f1: 0.4857
 epoch: 17, train_loss: 0.9976, test_loss: 1.0076, test_f1: 0.4838
 epoch: 18, train_loss: 0.9866, test_loss: 0.9959, test_f1: 0.4758
 epoch: 19, train_loss: 0.9846, test_loss: 1.0051, test_f1: 0.4767
 epoch: 20, train_loss: 0.9725, test_loss: 1.0025, test_f1: 0.4854
 epoch: 21, train_loss: 0.9796, test_loss: 0.9994, test_f1: 0.4965
 epoch: 22, train_loss: 0.9728, test_loss: 0.9826, test_f1: 0.4869
 epoch: 23, train_loss: 0.9707, test_loss: 0.9877, test_f1: 0.4982
 epoch: 24, train_loss: 0.9630, test_loss: 1.0073, test_f1: 0.4916
 epoch: 25, train_loss: 0.9629, test_loss: 0.9925, test_f1: 0.4851
 epoch: 26, train_loss: 0.9571, test_loss: 0.9940, test_f1: 0.4984
 epoch: 27, train_loss: 0.9627, test_loss: 0.9968, test_f1: 0.4961
 epoch: 28, train_loss: 0.9552, test_loss: 0.9915, test_f1: 0.4915
 epoch: 29, train_loss: 0.9524, test_loss: 0.9813, test_f1: 0.5013
 epoch: 30, train_loss: 0.9497, test_loss: 0.9914, test_f1: 0.4964
 epoch: 31, train_loss: 0.9440, test_loss: 0.9828, test_f1: 0.4914
 epoch: 32, train_loss: 0.9334, test_loss: 0.9848, test_f1: 0.5013
 epoch: 33, train_loss: 0.9332, test_loss: 0.9821, test_f1: 0.4984
 epoch: 34, train_loss: 0.9469, test_loss: 0.9754, test_f1: 0.5045
 epoch: 35, train_loss: 0.9325, test_loss: 0.9825, test_f1: 0.4994
 epoch: 36, train_loss: 0.9225, test_loss: 0.9706, test_f1: 0.4997
 epoch: 37, train_loss: 0.9280, test_loss: 0.9700, test_f1: 0.4935
 epoch: 38, train_loss: 0.9293, test_loss: 0.9731, test_f1: 0.4938
 epoch: 39, train_loss: 0.9263, test_loss: 0.9710, test_f1: 0.5018
 epoch: 40, train_loss: 0.9180, test_loss: 0.9743, test_f1: 0.5014
 epoch: 41, train_loss: 0.9075, test_loss: 0.9753, test_f1: 0.5013
 epoch: 42, train_loss: 0.9131, test_loss: 0.9620, test_f1: 0.5045
 epoch: 43, train_loss: 0.9128, test_loss: 0.9716, test_f1: 0.4977
 epoch: 44, train_loss: 0.9106, test_loss: 0.9781, test_f1: 0.4970
 epoch: 45, train_loss: 0.9121, test_loss: 0.9703, test_f1: 0.5033
 epoch: 46, train_loss: 0.9123, test_loss: 0.9667, test_f1: 0.5038
 epoch: 47, train_loss: 0.9068, test_loss: 0.9746, test_f1: 0.4981
 epoch: 48, train_loss: 0.9013, test_loss: 0.9703, test_f1: 0.5042
 epoch: 49, train_loss: 0.8973, test_loss: 0.9644, test_f1: 0.5027
 epoch: 50, train_loss: 0.9028, test_loss: 0.9793, test_f1: 0.5070
 epoch: 51, train_loss: 0.8900, test_loss: 0.9755, test_f1: 0.5034
 epoch: 52, train_loss: 0.8903, test_loss: 0.9703, test_f1: 0.5110
 epoch: 53, train_loss: 0.8907, test_loss: 0.9633, test_f1: 0.4986
 epoch: 54, train_loss: 0.8927, test_loss: 0.9680, test_f1: 0.5034
 epoch: 55, train_loss: 0.8876, test_loss: 0.9754, test_f1: 0.5184
 epoch: 56, train_loss: 0.8953, test_loss: 0.9706, test_f1: 0.5016
 epoch: 57, train_loss: 0.8806, test_loss: 0.9730, test_f1: 0.5087
 epoch: 58, train_loss: 0.8791, test_loss: 0.9698, test_f1: 0.5038
 epoch: 59, train_loss: 0.8778, test_loss: 0.9665, test_f1: 0.5151
 epoch: 60, train_loss: 0.8812, test_loss: 0.9746, test_f1: 0.5074
 epoch: 61, train_loss: 0.8742, test_loss: 0.9724, test_f1: 0.5051
 epoch: 62, train_loss: 0.8843, test_loss: 0.9687, test_f1: 0.5083
 epoch: 63, train_loss: 0.8855, test_loss: 0.9660, test_f1: 0.5065
 epoch: 64, train_loss: 0.8789, test_loss: 0.9741, test_f1: 0.5073
 epoch: 65, train_loss: 0.8793, test_loss: 0.9683, test_f1: 0.5108
 epoch: 66, train_loss: 0.8782, test_loss: 0.9785, test_f1: 0.5088
 epoch: 67, train_loss: 0.8749, test_loss: 0.9760, test_f1: 0.5117
 epoch: 68, train_loss: 0.8680, test_loss: 0.9665, test_f1: 0.5107
 epoch: 69, train_loss: 0.8692, test_loss: 0.9754, test_f1: 0.5029
 epoch: 70, train_loss: 0.8760, test_loss: 0.9676, test_f1: 0.5160
 epoch: 71, train_loss: 0.8783, test_loss: 0.9693, test_f1: 0.5177
 epoch: 72, train_loss: 0.8700, test_loss: 0.9641, test_f1: 0.5083
 epoch: 73, train_loss: 0.8733, test_loss: 0.9753, test_f1: 0.5206
 epoch: 74, train_loss: 0.8743, test_loss: 0.9701, test_f1: 0.5115
 epoch: 75, train_loss: 0.8825, test_loss: 0.9755, test_f1: 0.5189
 epoch: 76, train_loss: 0.8688, test_loss: 0.9755, test_f1: 0.5037
 epoch: 77, train_loss: 0.8665, test_loss: 0.9791, test_f1: 0.5126
 epoch: 78, train_loss: 0.8784, test_loss: 0.9788, test_f1: 0.5221
 epoch: 79, train_loss: 0.8668, test_loss: 0.9889, test_f1: 0.5222
 epoch: 80, train_loss: 0.8555, test_loss: 0.9784, test_f1: 0.5204
 epoch: 81, train_loss: 0.8530, test_loss: 0.9761, test_f1: 0.5295
 epoch: 82, train_loss: 0.8616, test_loss: 0.9751, test_f1: 0.5255
 epoch: 83, train_loss: 0.8636, test_loss: 0.9812, test_f1: 0.5211
 epoch: 84, train_loss: 0.8603, test_loss: 0.9662, test_f1: 0.5210
 epoch: 85, train_loss: 0.8601, test_loss: 0.9752, test_f1: 0.5249
 epoch: 86, train_loss: 0.8605, test_loss: 0.9801, test_f1: 0.5221
 epoch: 87, train_loss: 0.8636, test_loss: 0.9833, test_f1: 0.5278
 epoch: 88, train_loss: 0.8675, test_loss: 0.9779, test_f1: 0.5213
 epoch: 89, train_loss: 0.8569, test_loss: 0.9813, test_f1: 0.5171
 epoch: 90, train_loss: 0.8607, test_loss: 0.9879, test_f1: 0.5278
 epoch: 91, train_loss: 0.8567, test_loss: 0.9830, test_f1: 0.5286
 epoch: 92, train_loss: 0.8698, test_loss: 0.9868, test_f1: 0.5153
 epoch: 93, train_loss: 0.8637, test_loss: 0.9834, test_f1: 0.5171
 epoch: 94, train_loss: 0.8580, test_loss: 0.9870, test_f1: 0.5192
 epoch: 95, train_loss: 0.8525, test_loss: 0.9811, test_f1: 0.5164
 epoch: 96, train_loss: 0.8548, test_loss: 0.9765, test_f1: 0.5210
 epoch: 97, train_loss: 0.8550, test_loss: 0.9787, test_f1: 0.5156
 epoch: 98, train_loss: 0.8520, test_loss: 0.9788, test_f1: 0.5201
 epoch: 99, train_loss: 0.8526, test_loss: 0.9806, test_f1: 0.5184
##################ITERATION #8 ****************************************
 epoch: 0, train_loss: 1.2840, test_loss: 1.3340, test_f1: 0.2270
 epoch: 1, train_loss: 1.2042, test_loss: 1.2923, test_f1: 0.2270
 epoch: 2, train_loss: 1.1884, test_loss: 1.1704, test_f1: 0.2635
 epoch: 3, train_loss: 1.1603, test_loss: 1.1039, test_f1: 0.3698
 epoch: 4, train_loss: 1.1442, test_loss: 1.0874, test_f1: 0.3931
 epoch: 5, train_loss: 1.1286, test_loss: 1.0792, test_f1: 0.3966
 epoch: 6, train_loss: 1.1043, test_loss: 1.0759, test_f1: 0.4067
 epoch: 7, train_loss: 1.0947, test_loss: 1.0613, test_f1: 0.4294
 epoch: 8, train_loss: 1.0831, test_loss: 1.0548, test_f1: 0.4563
 epoch: 9, train_loss: 1.0700, test_loss: 1.0499, test_f1: 0.4369
 epoch: 10, train_loss: 1.0531, test_loss: 1.0469, test_f1: 0.4518
 epoch: 11, train_loss: 1.0470, test_loss: 1.0362, test_f1: 0.4617
 epoch: 12, train_loss: 1.0380, test_loss: 1.0391, test_f1: 0.4501
 epoch: 13, train_loss: 1.0352, test_loss: 1.0333, test_f1: 0.4415
 epoch: 14, train_loss: 1.0222, test_loss: 1.0236, test_f1: 0.4539
 epoch: 15, train_loss: 1.0145, test_loss: 1.0178, test_f1: 0.4583
 epoch: 16, train_loss: 1.0095, test_loss: 1.0251, test_f1: 0.4645
 epoch: 17, train_loss: 1.0025, test_loss: 1.0105, test_f1: 0.4791
 epoch: 18, train_loss: 1.0009, test_loss: 1.0101, test_f1: 0.4551
 epoch: 19, train_loss: 0.9938, test_loss: 1.0041, test_f1: 0.4599
 epoch: 20, train_loss: 0.9838, test_loss: 0.9926, test_f1: 0.4879
 epoch: 21, train_loss: 0.9733, test_loss: 0.9880, test_f1: 0.4922
 epoch: 22, train_loss: 0.9855, test_loss: 0.9834, test_f1: 0.4789
 epoch: 23, train_loss: 0.9727, test_loss: 0.9844, test_f1: 0.4784
 epoch: 24, train_loss: 0.9785, test_loss: 0.9702, test_f1: 0.4955
 epoch: 25, train_loss: 0.9724, test_loss: 0.9685, test_f1: 0.4913
 epoch: 26, train_loss: 0.9660, test_loss: 0.9764, test_f1: 0.4972
 epoch: 27, train_loss: 0.9582, test_loss: 0.9536, test_f1: 0.4963
 epoch: 28, train_loss: 0.9576, test_loss: 0.9646, test_f1: 0.4973
 epoch: 29, train_loss: 0.9560, test_loss: 0.9677, test_f1: 0.4894
 epoch: 30, train_loss: 0.9532, test_loss: 0.9607, test_f1: 0.5021
 epoch: 31, train_loss: 0.9410, test_loss: 0.9450, test_f1: 0.5004
 epoch: 32, train_loss: 0.9392, test_loss: 0.9430, test_f1: 0.5058
 epoch: 33, train_loss: 0.9460, test_loss: 0.9346, test_f1: 0.5117
 epoch: 34, train_loss: 0.9416, test_loss: 0.9471, test_f1: 0.5102
 epoch: 35, train_loss: 0.9376, test_loss: 0.9467, test_f1: 0.5123
 epoch: 36, train_loss: 0.9404, test_loss: 0.9519, test_f1: 0.5058
 epoch: 37, train_loss: 0.9387, test_loss: 0.9280, test_f1: 0.5182
 epoch: 38, train_loss: 0.9239, test_loss: 0.9472, test_f1: 0.5134
 epoch: 39, train_loss: 0.9246, test_loss: 0.9142, test_f1: 0.5257
 epoch: 40, train_loss: 0.9202, test_loss: 0.9404, test_f1: 0.5124
 epoch: 41, train_loss: 0.9239, test_loss: 0.9202, test_f1: 0.5234
 epoch: 42, train_loss: 0.9195, test_loss: 0.9374, test_f1: 0.5186
 epoch: 43, train_loss: 0.9148, test_loss: 0.9141, test_f1: 0.5254
 epoch: 44, train_loss: 0.9188, test_loss: 0.9094, test_f1: 0.5282
 epoch: 45, train_loss: 0.9076, test_loss: 0.9013, test_f1: 0.5289
 epoch: 46, train_loss: 0.9079, test_loss: 0.9079, test_f1: 0.5236
 epoch: 47, train_loss: 0.9094, test_loss: 0.9083, test_f1: 0.5225
 epoch: 48, train_loss: 0.9005, test_loss: 0.9284, test_f1: 0.5144
 epoch: 49, train_loss: 0.9069, test_loss: 0.9059, test_f1: 0.5209
 epoch: 50, train_loss: 0.9005, test_loss: 0.8919, test_f1: 0.5444
 epoch: 51, train_loss: 0.8997, test_loss: 0.8990, test_f1: 0.5227
 epoch: 52, train_loss: 0.8885, test_loss: 0.8984, test_f1: 0.5217
 epoch: 53, train_loss: 0.8850, test_loss: 0.9012, test_f1: 0.5240
 epoch: 54, train_loss: 0.8888, test_loss: 0.8947, test_f1: 0.5230
 epoch: 55, train_loss: 0.8899, test_loss: 0.9013, test_f1: 0.5240
 epoch: 56, train_loss: 0.8814, test_loss: 0.8957, test_f1: 0.5292
 epoch: 57, train_loss: 0.8925, test_loss: 0.8984, test_f1: 0.5251
 epoch: 58, train_loss: 0.8810, test_loss: 0.8954, test_f1: 0.5237
 epoch: 59, train_loss: 0.8762, test_loss: 0.9066, test_f1: 0.5257
 epoch: 60, train_loss: 0.8779, test_loss: 0.9026, test_f1: 0.5298
 epoch: 61, train_loss: 0.8822, test_loss: 0.9024, test_f1: 0.5325
 epoch: 62, train_loss: 0.8765, test_loss: 0.9027, test_f1: 0.5303
 epoch: 63, train_loss: 0.8693, test_loss: 0.8939, test_f1: 0.5384
 epoch: 64, train_loss: 0.8776, test_loss: 0.8888, test_f1: 0.5435
 epoch: 65, train_loss: 0.8759, test_loss: 0.8824, test_f1: 0.5353
 epoch: 66, train_loss: 0.8784, test_loss: 0.8881, test_f1: 0.5356
 epoch: 67, train_loss: 0.8728, test_loss: 0.8816, test_f1: 0.5326
 epoch: 68, train_loss: 0.8750, test_loss: 0.8910, test_f1: 0.5330
 epoch: 69, train_loss: 0.8690, test_loss: 0.8869, test_f1: 0.5331
 epoch: 70, train_loss: 0.8703, test_loss: 0.8903, test_f1: 0.5297
 epoch: 71, train_loss: 0.8656, test_loss: 0.8867, test_f1: 0.5334
 epoch: 72, train_loss: 0.8576, test_loss: 0.8863, test_f1: 0.5311
 epoch: 73, train_loss: 0.8642, test_loss: 0.8944, test_f1: 0.5277
 epoch: 74, train_loss: 0.8634, test_loss: 0.8852, test_f1: 0.5264
 epoch: 75, train_loss: 0.8612, test_loss: 0.8834, test_f1: 0.5337
 epoch: 76, train_loss: 0.8620, test_loss: 0.8844, test_f1: 0.5332
 epoch: 77, train_loss: 0.8611, test_loss: 0.8924, test_f1: 0.5220
 epoch: 78, train_loss: 0.8614, test_loss: 0.8925, test_f1: 0.5366
 epoch: 79, train_loss: 0.8538, test_loss: 0.8906, test_f1: 0.5247
 epoch: 80, train_loss: 0.8493, test_loss: 0.8729, test_f1: 0.5372
 epoch: 81, train_loss: 0.8539, test_loss: 0.8967, test_f1: 0.5285
 epoch: 82, train_loss: 0.8546, test_loss: 0.8789, test_f1: 0.5250
 epoch: 83, train_loss: 0.8587, test_loss: 0.8834, test_f1: 0.5235
 epoch: 84, train_loss: 0.8521, test_loss: 0.8929, test_f1: 0.5245
 epoch: 85, train_loss: 0.8595, test_loss: 0.8847, test_f1: 0.5292
 epoch: 86, train_loss: 0.8616, test_loss: 0.8697, test_f1: 0.5328
 epoch: 87, train_loss: 0.8559, test_loss: 0.8792, test_f1: 0.5357
 epoch: 88, train_loss: 0.8513, test_loss: 0.8776, test_f1: 0.5320
 epoch: 89, train_loss: 0.8442, test_loss: 0.8868, test_f1: 0.5340
 epoch: 90, train_loss: 0.8490, test_loss: 0.8783, test_f1: 0.5384
 epoch: 91, train_loss: 0.8526, test_loss: 0.8755, test_f1: 0.5447
 epoch: 92, train_loss: 0.8417, test_loss: 0.8808, test_f1: 0.5397
 epoch: 93, train_loss: 0.8446, test_loss: 0.8834, test_f1: 0.5342
 epoch: 94, train_loss: 0.8353, test_loss: 0.8742, test_f1: 0.5389
 epoch: 95, train_loss: 0.8384, test_loss: 0.8719, test_f1: 0.5444
 epoch: 96, train_loss: 0.8410, test_loss: 0.8738, test_f1: 0.5313
 epoch: 97, train_loss: 0.8492, test_loss: 0.8847, test_f1: 0.5373
 epoch: 98, train_loss: 0.8323, test_loss: 0.8689, test_f1: 0.5365
 epoch: 99, train_loss: 0.8327, test_loss: 0.8628, test_f1: 0.5509
##################ITERATION #9 ****************************************
 epoch: 0, train_loss: 1.3024, test_loss: 1.3288, test_f1: 0.2270
 epoch: 1, train_loss: 1.2025, test_loss: 1.2422, test_f1: 0.2345
 epoch: 2, train_loss: 1.1660, test_loss: 1.1353, test_f1: 0.3778
 epoch: 3, train_loss: 1.1527, test_loss: 1.0968, test_f1: 0.3939
 epoch: 4, train_loss: 1.1218, test_loss: 1.0823, test_f1: 0.4079
 epoch: 5, train_loss: 1.0998, test_loss: 1.0683, test_f1: 0.4165
 epoch: 6, train_loss: 1.0858, test_loss: 1.0584, test_f1: 0.4480
 epoch: 7, train_loss: 1.0689, test_loss: 1.0544, test_f1: 0.4276
 epoch: 8, train_loss: 1.0577, test_loss: 1.0441, test_f1: 0.4485
 epoch: 9, train_loss: 1.0502, test_loss: 1.0393, test_f1: 0.4484
 epoch: 10, train_loss: 1.0342, test_loss: 1.0378, test_f1: 0.4494
 epoch: 11, train_loss: 1.0303, test_loss: 1.0333, test_f1: 0.4603
 epoch: 12, train_loss: 1.0296, test_loss: 1.0259, test_f1: 0.4697
 epoch: 13, train_loss: 1.0194, test_loss: 1.0299, test_f1: 0.4694
 epoch: 14, train_loss: 1.0087, test_loss: 1.0214, test_f1: 0.4755
 epoch: 15, train_loss: 1.0037, test_loss: 1.0154, test_f1: 0.4701
 epoch: 16, train_loss: 0.9999, test_loss: 1.0176, test_f1: 0.4757
 epoch: 17, train_loss: 0.9963, test_loss: 1.0115, test_f1: 0.4660
 epoch: 18, train_loss: 0.9900, test_loss: 1.0095, test_f1: 0.4679
 epoch: 19, train_loss: 0.9860, test_loss: 0.9999, test_f1: 0.4898
 epoch: 20, train_loss: 0.9775, test_loss: 0.9981, test_f1: 0.5001
 epoch: 21, train_loss: 0.9818, test_loss: 0.9998, test_f1: 0.5048
 epoch: 22, train_loss: 0.9734, test_loss: 0.9920, test_f1: 0.4772
 epoch: 23, train_loss: 0.9718, test_loss: 0.9850, test_f1: 0.4738
 epoch: 24, train_loss: 0.9698, test_loss: 0.9825, test_f1: 0.4990
 epoch: 25, train_loss: 0.9600, test_loss: 0.9805, test_f1: 0.5182
 epoch: 26, train_loss: 0.9579, test_loss: 0.9874, test_f1: 0.5029
 epoch: 27, train_loss: 0.9475, test_loss: 0.9840, test_f1: 0.5152
 epoch: 28, train_loss: 0.9496, test_loss: 0.9737, test_f1: 0.5055
 epoch: 29, train_loss: 0.9511, test_loss: 0.9696, test_f1: 0.5147
 epoch: 30, train_loss: 0.9426, test_loss: 0.9687, test_f1: 0.5017
 epoch: 31, train_loss: 0.9371, test_loss: 0.9843, test_f1: 0.5080
 epoch: 32, train_loss: 0.9368, test_loss: 0.9639, test_f1: 0.5266
 epoch: 33, train_loss: 0.9387, test_loss: 0.9778, test_f1: 0.5084
 epoch: 34, train_loss: 0.9314, test_loss: 0.9727, test_f1: 0.5163
 epoch: 35, train_loss: 0.9194, test_loss: 0.9541, test_f1: 0.5153
 epoch: 36, train_loss: 0.9247, test_loss: 0.9610, test_f1: 0.5184
 epoch: 37, train_loss: 0.9213, test_loss: 0.9587, test_f1: 0.5253
 epoch: 38, train_loss: 0.9167, test_loss: 0.9570, test_f1: 0.5127
 epoch: 39, train_loss: 0.9152, test_loss: 0.9666, test_f1: 0.5141
 epoch: 40, train_loss: 0.9072, test_loss: 0.9504, test_f1: 0.5284
 epoch: 41, train_loss: 0.9046, test_loss: 0.9443, test_f1: 0.5125
 epoch: 42, train_loss: 0.9076, test_loss: 0.9613, test_f1: 0.5111
 epoch: 43, train_loss: 0.9118, test_loss: 0.9419, test_f1: 0.5140
 epoch: 44, train_loss: 0.8982, test_loss: 0.9462, test_f1: 0.5067
 epoch: 45, train_loss: 0.8927, test_loss: 0.9488, test_f1: 0.5302
 epoch: 46, train_loss: 0.8895, test_loss: 0.9468, test_f1: 0.5195
 epoch: 47, train_loss: 0.8843, test_loss: 0.9371, test_f1: 0.5145
 epoch: 48, train_loss: 0.8873, test_loss: 0.9257, test_f1: 0.5164
 epoch: 49, train_loss: 0.8866, test_loss: 0.9395, test_f1: 0.5169
 epoch: 50, train_loss: 0.8778, test_loss: 0.9225, test_f1: 0.5149
 epoch: 51, train_loss: 0.8815, test_loss: 0.9262, test_f1: 0.5173
 epoch: 52, train_loss: 0.8907, test_loss: 0.9246, test_f1: 0.5123
 epoch: 53, train_loss: 0.8779, test_loss: 0.9244, test_f1: 0.5224
 epoch: 54, train_loss: 0.8728, test_loss: 0.9210, test_f1: 0.5156
 epoch: 55, train_loss: 0.8773, test_loss: 0.9262, test_f1: 0.5190
 epoch: 56, train_loss: 0.8750, test_loss: 0.9270, test_f1: 0.5159
 epoch: 57, train_loss: 0.8691, test_loss: 0.9186, test_f1: 0.5228
 epoch: 58, train_loss: 0.8841, test_loss: 0.9175, test_f1: 0.5284
 epoch: 59, train_loss: 0.8652, test_loss: 0.9150, test_f1: 0.5279
 epoch: 60, train_loss: 0.8732, test_loss: 0.9141, test_f1: 0.5276
 epoch: 61, train_loss: 0.8619, test_loss: 0.9168, test_f1: 0.5239
 epoch: 62, train_loss: 0.8689, test_loss: 0.9200, test_f1: 0.5237
 epoch: 63, train_loss: 0.8687, test_loss: 0.9275, test_f1: 0.5264
 epoch: 64, train_loss: 0.8636, test_loss: 0.9212, test_f1: 0.5313
 epoch: 65, train_loss: 0.8519, test_loss: 0.9120, test_f1: 0.5191
 epoch: 66, train_loss: 0.8540, test_loss: 0.9193, test_f1: 0.5268
 epoch: 67, train_loss: 0.8511, test_loss: 0.9181, test_f1: 0.5229
 epoch: 68, train_loss: 0.8623, test_loss: 0.9174, test_f1: 0.5261
 epoch: 69, train_loss: 0.8584, test_loss: 0.9085, test_f1: 0.5373
 epoch: 70, train_loss: 0.8653, test_loss: 0.9119, test_f1: 0.5183
 epoch: 71, train_loss: 0.8499, test_loss: 0.9221, test_f1: 0.5301
 epoch: 72, train_loss: 0.8552, test_loss: 0.9085, test_f1: 0.5269
 epoch: 73, train_loss: 0.8420, test_loss: 0.9070, test_f1: 0.5229
 epoch: 74, train_loss: 0.8330, test_loss: 0.9191, test_f1: 0.5207
 epoch: 75, train_loss: 0.8513, test_loss: 0.9089, test_f1: 0.5225
 epoch: 76, train_loss: 0.8503, test_loss: 0.9037, test_f1: 0.5175
 epoch: 77, train_loss: 0.8475, test_loss: 0.8990, test_f1: 0.5261
 epoch: 78, train_loss: 0.8524, test_loss: 0.9085, test_f1: 0.5198
 epoch: 79, train_loss: 0.8431, test_loss: 0.9094, test_f1: 0.5203
 epoch: 80, train_loss: 0.8421, test_loss: 0.9072, test_f1: 0.5262
 epoch: 81, train_loss: 0.8409, test_loss: 0.8986, test_f1: 0.5229
 epoch: 82, train_loss: 0.8376, test_loss: 0.9137, test_f1: 0.5259
 epoch: 83, train_loss: 0.8307, test_loss: 0.9076, test_f1: 0.5186
 epoch: 84, train_loss: 0.8389, test_loss: 0.9124, test_f1: 0.5224
 epoch: 85, train_loss: 0.8372, test_loss: 0.9086, test_f1: 0.5293
 epoch: 86, train_loss: 0.8316, test_loss: 0.9016, test_f1: 0.5184
 epoch: 87, train_loss: 0.8377, test_loss: 0.8986, test_f1: 0.5331
 epoch: 88, train_loss: 0.8220, test_loss: 0.9105, test_f1: 0.5183
 epoch: 89, train_loss: 0.8289, test_loss: 0.9054, test_f1: 0.5345
 epoch: 90, train_loss: 0.8224, test_loss: 0.9076, test_f1: 0.5253
 epoch: 91, train_loss: 0.8321, test_loss: 0.9037, test_f1: 0.5200
 epoch: 92, train_loss: 0.8342, test_loss: 0.9060, test_f1: 0.5184
 epoch: 93, train_loss: 0.8259, test_loss: 0.8963, test_f1: 0.5266
 epoch: 94, train_loss: 0.8245, test_loss: 0.8891, test_f1: 0.5304
 epoch: 95, train_loss: 0.8287, test_loss: 0.9058, test_f1: 0.5225
 epoch: 96, train_loss: 0.8221, test_loss: 0.8899, test_f1: 0.5277
 epoch: 97, train_loss: 0.8161, test_loss: 0.8965, test_f1: 0.5274
 epoch: 98, train_loss: 0.8166, test_loss: 0.8909, test_f1: 0.5267
 epoch: 99, train_loss: 0.8113, test_loss: 0.8954, test_f1: 0.5378

Training completed in 551.68 seconds
Best F1: 0.5509 at epoch 99
Mean F1 across iterations: 0.5412  0.0086
========================FINAL RESULTS================================
FEGIN weighted F1: 0.5509  0.0086
python main.py --data ltspice_examples --representation component_pin_net --model FEGIN --layers 5 --hiddens 32 --batch_size 128 --lr 0.0001 --emb_size 512 --epochs 100 --save_appendix component_pin_net_L5_H32_BS128_LR0.0001_E512 --no_val
-----



STDERR:
  File "main.py", line 370, in <module>
    main()
  File "main.py", line 254, in main
    dataset = dataset_class(
  File "/home/philip/projects/ltspice_examples_code_repo/Circuit-Completion-Using-GNNs/component_classification_with_link_prediction_head/evaluation/FEGIN/kernel/circuit_datasets.py", line 15, in __init__
    self.data, self.slices = torch.load(self.processed_paths[0])
  File "/home/philip/.local/lib/python3.8/site-packages/torch/serialization.py", line 1040, in load
    warnings.warn(
  File "/usr/lib/python3.8/warnings.py", line 109, in _showwarnmsg
    sw(msg.message, msg.category, msg.filename, msg.lineno,
  File "main.py", line 47, in warn_with_traceback
    traceback.print_stack(file=log)
/home/philip/projects/ltspice_examples_code_repo/Circuit-Completion-Using-GNNs/component_classification_with_link_prediction_head/evaluation/FEGIN/kernel/circuit_datasets.py:15: FutureWarning: You are using `torch.load` with `weights_only=False` (the current default value), which uses the default pickle module implicitly. It is possible to construct malicious pickle data which will execute arbitrary code during unpickling (See https://github.com/pytorch/pytorch/blob/main/SECURITY.md#untrusted-models for more details). In a future release, the default value for `weights_only` will be flipped to `True`. This limits the functions that could be executed during unpickling. Arbitrary objects will no longer be allowed to be loaded via this mode unless they are explicitly allowlisted by the user via `torch.serialization.add_safe_globals`. We recommend you start setting `weights_only=True` for any use case where you don't have full control of the loaded file. Please open an issue on GitHub for any issues related to this experimental feature.
  self.data, self.slices = torch.load(self.processed_paths[0])
