STDOUT:
Results will be saved in /home/philip/projects/ltspice_examples_code_repo/Circuit-Completion-Using-GNNs/component_classification_with_link_prediction_head/evaluation/FEGIN/results/model_FEGIN_dataset_ltspice_examples
Command line input: python main.py --data ltspice_examples --representation component_net --model FEGIN --layers 5 --hiddens 64 --batch_size 128 --lr 0.0001 --emb_size 512 --epochs 100 --save_appendix component_net_L5_H64_BS128_LR0.0001_E512 --no_val
 is saved.
-----
ltspice_examples - FEGIN
Using 5 layers, 64 hidden units, h = 2
Loading component_net representation dataset
ENTERED
Training FEGIN on component_net representation
Train: 3558, Test: 846
##################ITERATION #0 ****************************************
 epoch: 0, train_loss: 1.4016, test_loss: 1.3970, test_f1: 0.0793
 epoch: 1, train_loss: 1.3828, test_loss: 1.3820, test_f1: 0.2046
 epoch: 2, train_loss: 1.3663, test_loss: 1.3570, test_f1: 0.3932
 epoch: 3, train_loss: 1.3444, test_loss: 1.3298, test_f1: 0.3612
 epoch: 4, train_loss: 1.3194, test_loss: 1.3017, test_f1: 0.3271
 epoch: 5, train_loss: 1.2909, test_loss: 1.2727, test_f1: 0.3149
 epoch: 6, train_loss: 1.2631, test_loss: 1.2470, test_f1: 0.3122
 epoch: 7, train_loss: 1.2380, test_loss: 1.2252, test_f1: 0.3286
 epoch: 8, train_loss: 1.2164, test_loss: 1.2022, test_f1: 0.3446
 epoch: 9, train_loss: 1.1945, test_loss: 1.1821, test_f1: 0.3356
 epoch: 10, train_loss: 1.1822, test_loss: 1.1629, test_f1: 0.3471
 epoch: 11, train_loss: 1.1643, test_loss: 1.1444, test_f1: 0.3504
 epoch: 12, train_loss: 1.1425, test_loss: 1.1247, test_f1: 0.3523
 epoch: 13, train_loss: 1.1301, test_loss: 1.1074, test_f1: 0.3786
 epoch: 14, train_loss: 1.1148, test_loss: 1.0920, test_f1: 0.3994
 epoch: 15, train_loss: 1.1001, test_loss: 1.0792, test_f1: 0.4498
 epoch: 16, train_loss: 1.0842, test_loss: 1.0633, test_f1: 0.4774
 epoch: 17, train_loss: 1.0732, test_loss: 1.0497, test_f1: 0.4915
 epoch: 18, train_loss: 1.0539, test_loss: 1.0356, test_f1: 0.5011
 epoch: 19, train_loss: 1.0463, test_loss: 1.0342, test_f1: 0.5057
 epoch: 20, train_loss: 1.0277, test_loss: 1.0149, test_f1: 0.5263
 epoch: 21, train_loss: 1.0148, test_loss: 0.9975, test_f1: 0.5125
 epoch: 22, train_loss: 0.9969, test_loss: 0.9819, test_f1: 0.5235
 epoch: 23, train_loss: 0.9940, test_loss: 0.9719, test_f1: 0.5120
 epoch: 24, train_loss: 0.9755, test_loss: 0.9568, test_f1: 0.5204
 epoch: 25, train_loss: 0.9578, test_loss: 0.9670, test_f1: 0.5239
 epoch: 26, train_loss: 0.9419, test_loss: 0.9456, test_f1: 0.4983
 epoch: 27, train_loss: 0.9349, test_loss: 0.9506, test_f1: 0.5101
 epoch: 28, train_loss: 0.9171, test_loss: 0.9349, test_f1: 0.5144
 epoch: 29, train_loss: 0.9077, test_loss: 0.9494, test_f1: 0.4948
 epoch: 30, train_loss: 0.9067, test_loss: 0.9254, test_f1: 0.5068
 epoch: 31, train_loss: 0.8951, test_loss: 0.9362, test_f1: 0.5146
 epoch: 32, train_loss: 0.8949, test_loss: 0.9585, test_f1: 0.5104
 epoch: 33, train_loss: 0.8840, test_loss: 0.9503, test_f1: 0.5208
 epoch: 34, train_loss: 0.8844, test_loss: 0.9341, test_f1: 0.5233
 epoch: 35, train_loss: 0.8759, test_loss: 0.9391, test_f1: 0.5136
 epoch: 36, train_loss: 0.8686, test_loss: 0.9472, test_f1: 0.5235
 epoch: 37, train_loss: 0.8600, test_loss: 0.9412, test_f1: 0.5252
 epoch: 38, train_loss: 0.8604, test_loss: 0.9439, test_f1: 0.5157
 epoch: 39, train_loss: 0.8549, test_loss: 0.9276, test_f1: 0.5222
 epoch: 40, train_loss: 0.8496, test_loss: 0.9566, test_f1: 0.5250
 epoch: 41, train_loss: 0.8453, test_loss: 0.9219, test_f1: 0.5300
 epoch: 42, train_loss: 0.8475, test_loss: 0.9654, test_f1: 0.5266
 epoch: 43, train_loss: 0.8379, test_loss: 0.9377, test_f1: 0.5019
 epoch: 44, train_loss: 0.8264, test_loss: 0.9806, test_f1: 0.5114
 epoch: 45, train_loss: 0.8380, test_loss: 0.9351, test_f1: 0.5302
 epoch: 46, train_loss: 0.8190, test_loss: 0.9620, test_f1: 0.5145
 epoch: 47, train_loss: 0.8133, test_loss: 0.9511, test_f1: 0.5278
 epoch: 48, train_loss: 0.8140, test_loss: 0.9772, test_f1: 0.5251
 epoch: 49, train_loss: 0.8115, test_loss: 0.9561, test_f1: 0.5332
 epoch: 50, train_loss: 0.8115, test_loss: 0.9563, test_f1: 0.5369
 epoch: 51, train_loss: 0.8098, test_loss: 0.9492, test_f1: 0.5409
 epoch: 52, train_loss: 0.7888, test_loss: 0.9516, test_f1: 0.5366
 epoch: 53, train_loss: 0.7883, test_loss: 0.9461, test_f1: 0.5364
 epoch: 54, train_loss: 0.7851, test_loss: 0.9529, test_f1: 0.5338
 epoch: 55, train_loss: 0.7868, test_loss: 0.9554, test_f1: 0.5506
 epoch: 56, train_loss: 0.7932, test_loss: 0.9567, test_f1: 0.5336
 epoch: 57, train_loss: 0.7837, test_loss: 0.9602, test_f1: 0.5426
 epoch: 58, train_loss: 0.7865, test_loss: 0.9803, test_f1: 0.5441
 epoch: 59, train_loss: 0.7916, test_loss: 0.9598, test_f1: 0.5408
 epoch: 60, train_loss: 0.7893, test_loss: 0.9557, test_f1: 0.5453
 epoch: 61, train_loss: 0.7765, test_loss: 0.9649, test_f1: 0.5481
 epoch: 62, train_loss: 0.7796, test_loss: 0.9734, test_f1: 0.5383
 epoch: 63, train_loss: 0.7901, test_loss: 0.9663, test_f1: 0.5598
 epoch: 64, train_loss: 0.7756, test_loss: 0.9762, test_f1: 0.5439
 epoch: 65, train_loss: 0.7651, test_loss: 0.9751, test_f1: 0.5370
 epoch: 66, train_loss: 0.7807, test_loss: 0.9592, test_f1: 0.5421
 epoch: 67, train_loss: 0.7730, test_loss: 0.9829, test_f1: 0.5364
 epoch: 68, train_loss: 0.7738, test_loss: 0.9709, test_f1: 0.5303
 epoch: 69, train_loss: 0.7677, test_loss: 0.9712, test_f1: 0.5547
 epoch: 70, train_loss: 0.7762, test_loss: 0.9554, test_f1: 0.5503
 epoch: 71, train_loss: 0.7728, test_loss: 0.9771, test_f1: 0.5318
 epoch: 72, train_loss: 0.7642, test_loss: 0.9844, test_f1: 0.5494
 epoch: 73, train_loss: 0.7653, test_loss: 0.9815, test_f1: 0.5499
 epoch: 74, train_loss: 0.7563, test_loss: 0.9757, test_f1: 0.5610
 epoch: 75, train_loss: 0.7657, test_loss: 0.9764, test_f1: 0.5566
 epoch: 76, train_loss: 0.7593, test_loss: 0.9855, test_f1: 0.5467
 epoch: 77, train_loss: 0.7612, test_loss: 0.9763, test_f1: 0.5527
 epoch: 78, train_loss: 0.7497, test_loss: 0.9706, test_f1: 0.5744
 epoch: 79, train_loss: 0.7529, test_loss: 0.9799, test_f1: 0.5729
 epoch: 80, train_loss: 0.7568, test_loss: 0.9784, test_f1: 0.5675
 epoch: 81, train_loss: 0.7585, test_loss: 0.9818, test_f1: 0.5656
 epoch: 82, train_loss: 0.7571, test_loss: 0.9788, test_f1: 0.5680
 epoch: 83, train_loss: 0.7529, test_loss: 0.9897, test_f1: 0.5704
 epoch: 84, train_loss: 0.7449, test_loss: 1.0071, test_f1: 0.5621
 epoch: 85, train_loss: 0.7556, test_loss: 0.9978, test_f1: 0.5614
 epoch: 86, train_loss: 0.7386, test_loss: 0.9940, test_f1: 0.5568
 epoch: 87, train_loss: 0.7565, test_loss: 1.0048, test_f1: 0.5702
 epoch: 88, train_loss: 0.7435, test_loss: 0.9844, test_f1: 0.5670
 epoch: 89, train_loss: 0.7409, test_loss: 0.9838, test_f1: 0.5524
 epoch: 90, train_loss: 0.7501, test_loss: 1.0030, test_f1: 0.5741
 epoch: 91, train_loss: 0.7340, test_loss: 1.0104, test_f1: 0.5525
 epoch: 92, train_loss: 0.7392, test_loss: 1.0018, test_f1: 0.5515
 epoch: 93, train_loss: 0.7374, test_loss: 1.0136, test_f1: 0.5692
 epoch: 94, train_loss: 0.7382, test_loss: 1.0035, test_f1: 0.5532
 epoch: 95, train_loss: 0.7360, test_loss: 1.0019, test_f1: 0.5549
 epoch: 96, train_loss: 0.7303, test_loss: 1.0105, test_f1: 0.5566
 epoch: 97, train_loss: 0.7400, test_loss: 1.0134, test_f1: 0.5597
 epoch: 98, train_loss: 0.7340, test_loss: 1.0137, test_f1: 0.5669
 epoch: 99, train_loss: 0.7337, test_loss: 1.0000, test_f1: 0.5834
##################ITERATION #1 ****************************************
 epoch: 0, train_loss: 1.3275, test_loss: 1.3647, test_f1: 0.2270
 epoch: 1, train_loss: 1.2857, test_loss: 1.3188, test_f1: 0.2489
 epoch: 2, train_loss: 1.2605, test_loss: 1.2588, test_f1: 0.3398
 epoch: 3, train_loss: 1.2390, test_loss: 1.2142, test_f1: 0.3771
 epoch: 4, train_loss: 1.2160, test_loss: 1.1855, test_f1: 0.3951
 epoch: 5, train_loss: 1.1939, test_loss: 1.1677, test_f1: 0.4072
 epoch: 6, train_loss: 1.1738, test_loss: 1.1435, test_f1: 0.4188
 epoch: 7, train_loss: 1.1547, test_loss: 1.1213, test_f1: 0.4440
 epoch: 8, train_loss: 1.1297, test_loss: 1.1000, test_f1: 0.4522
 epoch: 9, train_loss: 1.1088, test_loss: 1.0794, test_f1: 0.4576
 epoch: 10, train_loss: 1.0928, test_loss: 1.0639, test_f1: 0.4635
 epoch: 11, train_loss: 1.0716, test_loss: 1.0377, test_f1: 0.4675
 epoch: 12, train_loss: 1.0568, test_loss: 1.0288, test_f1: 0.4661
 epoch: 13, train_loss: 1.0352, test_loss: 1.0117, test_f1: 0.4758
 epoch: 14, train_loss: 1.0225, test_loss: 1.0035, test_f1: 0.4868
 epoch: 15, train_loss: 1.0129, test_loss: 0.9848, test_f1: 0.4934
 epoch: 16, train_loss: 0.9999, test_loss: 0.9748, test_f1: 0.4838
 epoch: 17, train_loss: 0.9821, test_loss: 0.9657, test_f1: 0.4921
 epoch: 18, train_loss: 0.9741, test_loss: 0.9600, test_f1: 0.5067
 epoch: 19, train_loss: 0.9627, test_loss: 0.9500, test_f1: 0.4940
 epoch: 20, train_loss: 0.9499, test_loss: 0.9473, test_f1: 0.5055
 epoch: 21, train_loss: 0.9495, test_loss: 0.9409, test_f1: 0.5011
 epoch: 22, train_loss: 0.9381, test_loss: 0.9330, test_f1: 0.5211
 epoch: 23, train_loss: 0.9385, test_loss: 0.9273, test_f1: 0.5064
 epoch: 24, train_loss: 0.9222, test_loss: 0.9355, test_f1: 0.5262
 epoch: 25, train_loss: 0.9091, test_loss: 0.9429, test_f1: 0.5038
 epoch: 26, train_loss: 0.9116, test_loss: 0.9244, test_f1: 0.5277
 epoch: 27, train_loss: 0.9024, test_loss: 0.9236, test_f1: 0.5077
 epoch: 28, train_loss: 0.8863, test_loss: 0.9180, test_f1: 0.5270
 epoch: 29, train_loss: 0.8900, test_loss: 0.9263, test_f1: 0.5218
 epoch: 30, train_loss: 0.8768, test_loss: 0.9198, test_f1: 0.5168
 epoch: 31, train_loss: 0.8774, test_loss: 0.9381, test_f1: 0.5294
 epoch: 32, train_loss: 0.8690, test_loss: 0.9134, test_f1: 0.5187
 epoch: 33, train_loss: 0.8580, test_loss: 0.9161, test_f1: 0.5284
 epoch: 34, train_loss: 0.8563, test_loss: 0.9187, test_f1: 0.5261
 epoch: 35, train_loss: 0.8400, test_loss: 0.9246, test_f1: 0.5316
 epoch: 36, train_loss: 0.8479, test_loss: 0.9154, test_f1: 0.5366
 epoch: 37, train_loss: 0.8419, test_loss: 0.9421, test_f1: 0.5341
 epoch: 38, train_loss: 0.8378, test_loss: 0.9283, test_f1: 0.5282
 epoch: 39, train_loss: 0.8284, test_loss: 0.9093, test_f1: 0.5372
 epoch: 40, train_loss: 0.8375, test_loss: 0.9121, test_f1: 0.5456
 epoch: 41, train_loss: 0.8261, test_loss: 0.9475, test_f1: 0.5223
 epoch: 42, train_loss: 0.8096, test_loss: 0.9332, test_f1: 0.5184
 epoch: 43, train_loss: 0.8214, test_loss: 0.9212, test_f1: 0.5343
 epoch: 44, train_loss: 0.8150, test_loss: 0.9407, test_f1: 0.5318
 epoch: 45, train_loss: 0.8117, test_loss: 0.9218, test_f1: 0.5509
 epoch: 46, train_loss: 0.8035, test_loss: 0.9521, test_f1: 0.5444
 epoch: 47, train_loss: 0.7991, test_loss: 0.9358, test_f1: 0.5406
 epoch: 48, train_loss: 0.8058, test_loss: 0.9339, test_f1: 0.5401
 epoch: 49, train_loss: 0.7987, test_loss: 0.9594, test_f1: 0.5402
 epoch: 50, train_loss: 0.8001, test_loss: 0.9323, test_f1: 0.5477
 epoch: 51, train_loss: 0.7845, test_loss: 0.9544, test_f1: 0.5385
 epoch: 52, train_loss: 0.7793, test_loss: 0.9378, test_f1: 0.5563
 epoch: 53, train_loss: 0.7758, test_loss: 0.9558, test_f1: 0.5526
 epoch: 54, train_loss: 0.7716, test_loss: 0.9508, test_f1: 0.5502
 epoch: 55, train_loss: 0.7858, test_loss: 0.9501, test_f1: 0.5658
 epoch: 56, train_loss: 0.7888, test_loss: 0.9409, test_f1: 0.5680
 epoch: 57, train_loss: 0.7804, test_loss: 0.9376, test_f1: 0.5647
 epoch: 58, train_loss: 0.7749, test_loss: 0.9279, test_f1: 0.5677
 epoch: 59, train_loss: 0.7764, test_loss: 0.9283, test_f1: 0.5567
 epoch: 60, train_loss: 0.7620, test_loss: 0.9438, test_f1: 0.5553
 epoch: 61, train_loss: 0.7770, test_loss: 0.9482, test_f1: 0.5528
 epoch: 62, train_loss: 0.7640, test_loss: 0.9476, test_f1: 0.5511
 epoch: 63, train_loss: 0.7607, test_loss: 0.9590, test_f1: 0.5495
 epoch: 64, train_loss: 0.7659, test_loss: 0.9660, test_f1: 0.5594
 epoch: 65, train_loss: 0.7530, test_loss: 0.9526, test_f1: 0.5680
 epoch: 66, train_loss: 0.7618, test_loss: 0.9521, test_f1: 0.5596
 epoch: 67, train_loss: 0.7614, test_loss: 0.9448, test_f1: 0.5584
 epoch: 68, train_loss: 0.7547, test_loss: 0.9405, test_f1: 0.5735
 epoch: 69, train_loss: 0.7585, test_loss: 0.9471, test_f1: 0.5732
 epoch: 70, train_loss: 0.7610, test_loss: 0.9572, test_f1: 0.5478
 epoch: 71, train_loss: 0.7524, test_loss: 0.9625, test_f1: 0.5675
 epoch: 72, train_loss: 0.7443, test_loss: 0.9723, test_f1: 0.5641
 epoch: 73, train_loss: 0.7554, test_loss: 0.9473, test_f1: 0.5641
 epoch: 74, train_loss: 0.7505, test_loss: 0.9772, test_f1: 0.5669
 epoch: 75, train_loss: 0.7506, test_loss: 0.9417, test_f1: 0.5745
 epoch: 76, train_loss: 0.7510, test_loss: 0.9567, test_f1: 0.5699
 epoch: 77, train_loss: 0.7464, test_loss: 0.9728, test_f1: 0.5739
 epoch: 78, train_loss: 0.7416, test_loss: 0.9659, test_f1: 0.5667
 epoch: 79, train_loss: 0.7521, test_loss: 0.9654, test_f1: 0.5679
 epoch: 80, train_loss: 0.7410, test_loss: 0.9598, test_f1: 0.5681
 epoch: 81, train_loss: 0.7419, test_loss: 0.9870, test_f1: 0.5650
 epoch: 82, train_loss: 0.7439, test_loss: 0.9882, test_f1: 0.5732
 epoch: 83, train_loss: 0.7357, test_loss: 0.9643, test_f1: 0.5751
 epoch: 84, train_loss: 0.7365, test_loss: 0.9723, test_f1: 0.5768
 epoch: 85, train_loss: 0.7374, test_loss: 0.9766, test_f1: 0.5796
 epoch: 86, train_loss: 0.7271, test_loss: 0.9805, test_f1: 0.5823
 epoch: 87, train_loss: 0.7340, test_loss: 0.9806, test_f1: 0.5749
 epoch: 88, train_loss: 0.7257, test_loss: 0.9640, test_f1: 0.5820
 epoch: 89, train_loss: 0.7370, test_loss: 0.9706, test_f1: 0.5755
 epoch: 90, train_loss: 0.7255, test_loss: 0.9832, test_f1: 0.5565
 epoch: 91, train_loss: 0.7226, test_loss: 0.9673, test_f1: 0.5639
 epoch: 92, train_loss: 0.7204, test_loss: 0.9640, test_f1: 0.5641
 epoch: 93, train_loss: 0.7252, test_loss: 0.9879, test_f1: 0.5758
 epoch: 94, train_loss: 0.7222, test_loss: 0.9572, test_f1: 0.5742
 epoch: 95, train_loss: 0.7222, test_loss: 0.9716, test_f1: 0.5729
 epoch: 96, train_loss: 0.7194, test_loss: 1.0045, test_f1: 0.5683
 epoch: 97, train_loss: 0.7256, test_loss: 1.0014, test_f1: 0.5910
 epoch: 98, train_loss: 0.7134, test_loss: 1.0020, test_f1: 0.5842
 epoch: 99, train_loss: 0.7247, test_loss: 1.0032, test_f1: 0.5767
##################ITERATION #2 ****************************************
 epoch: 0, train_loss: 1.2955, test_loss: 1.3290, test_f1: 0.2270
 epoch: 1, train_loss: 1.2390, test_loss: 1.2532, test_f1: 0.2780
 epoch: 2, train_loss: 1.2112, test_loss: 1.1875, test_f1: 0.3293
 epoch: 3, train_loss: 1.1867, test_loss: 1.1413, test_f1: 0.4228
 epoch: 4, train_loss: 1.1609, test_loss: 1.1155, test_f1: 0.4317
 epoch: 5, train_loss: 1.1332, test_loss: 1.0856, test_f1: 0.4561
 epoch: 6, train_loss: 1.1100, test_loss: 1.0573, test_f1: 0.4661
 epoch: 7, train_loss: 1.0870, test_loss: 1.0419, test_f1: 0.4683
 epoch: 8, train_loss: 1.0731, test_loss: 1.0156, test_f1: 0.4732
 epoch: 9, train_loss: 1.0563, test_loss: 1.0025, test_f1: 0.4657
 epoch: 10, train_loss: 1.0371, test_loss: 0.9817, test_f1: 0.4703
 epoch: 11, train_loss: 1.0163, test_loss: 0.9708, test_f1: 0.4835
 epoch: 12, train_loss: 1.0177, test_loss: 0.9597, test_f1: 0.4992
 epoch: 13, train_loss: 0.9916, test_loss: 0.9531, test_f1: 0.5047
 epoch: 14, train_loss: 0.9765, test_loss: 0.9468, test_f1: 0.4986
 epoch: 15, train_loss: 0.9691, test_loss: 0.9511, test_f1: 0.4970
 epoch: 16, train_loss: 0.9638, test_loss: 0.9508, test_f1: 0.5065
 epoch: 17, train_loss: 0.9590, test_loss: 0.9396, test_f1: 0.4999
 epoch: 18, train_loss: 0.9449, test_loss: 0.9331, test_f1: 0.5046
 epoch: 19, train_loss: 0.9332, test_loss: 0.9400, test_f1: 0.5134
 epoch: 20, train_loss: 0.9313, test_loss: 0.9545, test_f1: 0.4984
 epoch: 21, train_loss: 0.9309, test_loss: 0.9361, test_f1: 0.5083
 epoch: 22, train_loss: 0.9226, test_loss: 0.9390, test_f1: 0.5138
 epoch: 23, train_loss: 0.9132, test_loss: 0.9292, test_f1: 0.5476
 epoch: 24, train_loss: 0.9020, test_loss: 0.9615, test_f1: 0.5445
 epoch: 25, train_loss: 0.9008, test_loss: 0.9367, test_f1: 0.5201
 epoch: 26, train_loss: 0.8901, test_loss: 0.9546, test_f1: 0.5353
 epoch: 27, train_loss: 0.8888, test_loss: 0.9379, test_f1: 0.5384
 epoch: 28, train_loss: 0.8791, test_loss: 0.9266, test_f1: 0.5678
 epoch: 29, train_loss: 0.8695, test_loss: 0.9385, test_f1: 0.5526
 epoch: 30, train_loss: 0.8651, test_loss: 0.9332, test_f1: 0.5518
 epoch: 31, train_loss: 0.8692, test_loss: 0.9296, test_f1: 0.5323
 epoch: 32, train_loss: 0.8636, test_loss: 0.9633, test_f1: 0.5449
 epoch: 33, train_loss: 0.8558, test_loss: 0.9500, test_f1: 0.5215
 epoch: 34, train_loss: 0.8612, test_loss: 0.9657, test_f1: 0.5458
 epoch: 35, train_loss: 0.8509, test_loss: 0.9082, test_f1: 0.5586
 epoch: 36, train_loss: 0.8537, test_loss: 0.9348, test_f1: 0.5697
 epoch: 37, train_loss: 0.8452, test_loss: 0.9348, test_f1: 0.5501
 epoch: 38, train_loss: 0.8525, test_loss: 0.9576, test_f1: 0.5511
 epoch: 39, train_loss: 0.8238, test_loss: 0.9476, test_f1: 0.5577
 epoch: 40, train_loss: 0.8383, test_loss: 0.9214, test_f1: 0.5701
 epoch: 41, train_loss: 0.8392, test_loss: 0.9681, test_f1: 0.5576
 epoch: 42, train_loss: 0.8318, test_loss: 0.9456, test_f1: 0.5646
 epoch: 43, train_loss: 0.8310, test_loss: 0.9291, test_f1: 0.5562
 epoch: 44, train_loss: 0.8241, test_loss: 0.9510, test_f1: 0.5547
 epoch: 45, train_loss: 0.8257, test_loss: 0.9491, test_f1: 0.5627
 epoch: 46, train_loss: 0.8096, test_loss: 0.9376, test_f1: 0.5701
 epoch: 47, train_loss: 0.8131, test_loss: 0.9830, test_f1: 0.5590
 epoch: 48, train_loss: 0.8008, test_loss: 0.9605, test_f1: 0.5637
 epoch: 49, train_loss: 0.8089, test_loss: 0.9644, test_f1: 0.5716
 epoch: 50, train_loss: 0.7974, test_loss: 0.9571, test_f1: 0.5735
 epoch: 51, train_loss: 0.8004, test_loss: 0.9566, test_f1: 0.5726
 epoch: 52, train_loss: 0.8005, test_loss: 0.9378, test_f1: 0.5700
 epoch: 53, train_loss: 0.7866, test_loss: 0.9649, test_f1: 0.5565
 epoch: 54, train_loss: 0.7908, test_loss: 0.9623, test_f1: 0.5673
 epoch: 55, train_loss: 0.7853, test_loss: 0.9496, test_f1: 0.5738
 epoch: 56, train_loss: 0.7903, test_loss: 0.9562, test_f1: 0.5662
 epoch: 57, train_loss: 0.7722, test_loss: 0.9600, test_f1: 0.5768
 epoch: 58, train_loss: 0.7854, test_loss: 0.9670, test_f1: 0.5673
 epoch: 59, train_loss: 0.7773, test_loss: 0.9804, test_f1: 0.5751
 epoch: 60, train_loss: 0.7853, test_loss: 0.9637, test_f1: 0.5719
 epoch: 61, train_loss: 0.7777, test_loss: 0.9675, test_f1: 0.5716
 epoch: 62, train_loss: 0.7855, test_loss: 0.9707, test_f1: 0.5734
 epoch: 63, train_loss: 0.7708, test_loss: 0.9629, test_f1: 0.5828
 epoch: 64, train_loss: 0.7708, test_loss: 0.9953, test_f1: 0.5700
 epoch: 65, train_loss: 0.7809, test_loss: 0.9566, test_f1: 0.5756
 epoch: 66, train_loss: 0.7707, test_loss: 0.9630, test_f1: 0.5672
 epoch: 67, train_loss: 0.7665, test_loss: 0.9687, test_f1: 0.5527
 epoch: 68, train_loss: 0.7651, test_loss: 0.9830, test_f1: 0.5789
 epoch: 69, train_loss: 0.7603, test_loss: 0.9606, test_f1: 0.5661
 epoch: 70, train_loss: 0.7580, test_loss: 0.9754, test_f1: 0.5748
 epoch: 71, train_loss: 0.7699, test_loss: 0.9827, test_f1: 0.5663
 epoch: 72, train_loss: 0.7520, test_loss: 0.9714, test_f1: 0.5678
 epoch: 73, train_loss: 0.7544, test_loss: 0.9641, test_f1: 0.5764
 epoch: 74, train_loss: 0.7678, test_loss: 0.9749, test_f1: 0.5780
 epoch: 75, train_loss: 0.7653, test_loss: 0.9791, test_f1: 0.5746
 epoch: 76, train_loss: 0.7525, test_loss: 0.9708, test_f1: 0.5733
 epoch: 77, train_loss: 0.7546, test_loss: 0.9704, test_f1: 0.5767
 epoch: 78, train_loss: 0.7525, test_loss: 0.9972, test_f1: 0.5703
 epoch: 79, train_loss: 0.7501, test_loss: 0.9904, test_f1: 0.5560
 epoch: 80, train_loss: 0.7505, test_loss: 0.9712, test_f1: 0.5689
 epoch: 81, train_loss: 0.7430, test_loss: 0.9637, test_f1: 0.5778
 epoch: 82, train_loss: 0.7551, test_loss: 0.9703, test_f1: 0.5800
 epoch: 83, train_loss: 0.7360, test_loss: 0.9693, test_f1: 0.5774
 epoch: 84, train_loss: 0.7373, test_loss: 0.9914, test_f1: 0.5765
 epoch: 85, train_loss: 0.7398, test_loss: 0.9577, test_f1: 0.5731
 epoch: 86, train_loss: 0.7423, test_loss: 0.9749, test_f1: 0.5724
 epoch: 87, train_loss: 0.7475, test_loss: 0.9766, test_f1: 0.5679
 epoch: 88, train_loss: 0.7504, test_loss: 0.9734, test_f1: 0.5750
 epoch: 89, train_loss: 0.7441, test_loss: 0.9926, test_f1: 0.5732
 epoch: 90, train_loss: 0.7459, test_loss: 0.9869, test_f1: 0.5784
 epoch: 91, train_loss: 0.7334, test_loss: 0.9827, test_f1: 0.5579
 epoch: 92, train_loss: 0.7474, test_loss: 0.9955, test_f1: 0.5670
 epoch: 93, train_loss: 0.7445, test_loss: 0.9891, test_f1: 0.5695
 epoch: 94, train_loss: 0.7397, test_loss: 0.9860, test_f1: 0.5776
 epoch: 95, train_loss: 0.7339, test_loss: 1.0008, test_f1: 0.5607
 epoch: 96, train_loss: 0.7331, test_loss: 0.9970, test_f1: 0.5621
 epoch: 97, train_loss: 0.7379, test_loss: 0.9756, test_f1: 0.5712
 epoch: 98, train_loss: 0.7335, test_loss: 0.9938, test_f1: 0.5732
 epoch: 99, train_loss: 0.7264, test_loss: 0.9812, test_f1: 0.5749
##################ITERATION #3 ****************************************
 epoch: 0, train_loss: 1.2692, test_loss: 1.3292, test_f1: 0.2295
 epoch: 1, train_loss: 1.2096, test_loss: 1.2179, test_f1: 0.3978
 epoch: 2, train_loss: 1.1814, test_loss: 1.1448, test_f1: 0.4070
 epoch: 3, train_loss: 1.1550, test_loss: 1.1049, test_f1: 0.4317
 epoch: 4, train_loss: 1.1380, test_loss: 1.0786, test_f1: 0.4400
 epoch: 5, train_loss: 1.1166, test_loss: 1.0537, test_f1: 0.4555
 epoch: 6, train_loss: 1.0897, test_loss: 1.0318, test_f1: 0.4704
 epoch: 7, train_loss: 1.0752, test_loss: 1.0088, test_f1: 0.4749
 epoch: 8, train_loss: 1.0580, test_loss: 0.9940, test_f1: 0.4942
 epoch: 9, train_loss: 1.0414, test_loss: 0.9769, test_f1: 0.4926
 epoch: 10, train_loss: 1.0258, test_loss: 0.9687, test_f1: 0.4917
 epoch: 11, train_loss: 1.0137, test_loss: 0.9548, test_f1: 0.4913
 epoch: 12, train_loss: 0.9933, test_loss: 0.9455, test_f1: 0.5096
 epoch: 13, train_loss: 0.9923, test_loss: 0.9409, test_f1: 0.5222
 epoch: 14, train_loss: 0.9838, test_loss: 0.9232, test_f1: 0.4995
 epoch: 15, train_loss: 0.9649, test_loss: 0.9223, test_f1: 0.4984
 epoch: 16, train_loss: 0.9591, test_loss: 0.9201, test_f1: 0.5150
 epoch: 17, train_loss: 0.9469, test_loss: 0.9052, test_f1: 0.5061
 epoch: 18, train_loss: 0.9417, test_loss: 0.9077, test_f1: 0.5209
 epoch: 19, train_loss: 0.9338, test_loss: 0.9012, test_f1: 0.5223
 epoch: 20, train_loss: 0.9333, test_loss: 0.9085, test_f1: 0.5201
 epoch: 21, train_loss: 0.9222, test_loss: 0.9098, test_f1: 0.5296
 epoch: 22, train_loss: 0.9087, test_loss: 0.9039, test_f1: 0.5266
 epoch: 23, train_loss: 0.9074, test_loss: 0.8962, test_f1: 0.5296
 epoch: 24, train_loss: 0.8953, test_loss: 0.8981, test_f1: 0.5342
 epoch: 25, train_loss: 0.8934, test_loss: 0.9038, test_f1: 0.5351
 epoch: 26, train_loss: 0.8879, test_loss: 0.8986, test_f1: 0.5324
 epoch: 27, train_loss: 0.8824, test_loss: 0.9184, test_f1: 0.5351
 epoch: 28, train_loss: 0.8865, test_loss: 0.8980, test_f1: 0.5356
 epoch: 29, train_loss: 0.8728, test_loss: 0.8988, test_f1: 0.5280
 epoch: 30, train_loss: 0.8637, test_loss: 0.9173, test_f1: 0.5342
 epoch: 31, train_loss: 0.8591, test_loss: 0.8982, test_f1: 0.5495
 epoch: 32, train_loss: 0.8593, test_loss: 0.8992, test_f1: 0.5516
 epoch: 33, train_loss: 0.8506, test_loss: 0.8953, test_f1: 0.5299
 epoch: 34, train_loss: 0.8467, test_loss: 0.9062, test_f1: 0.5334
 epoch: 35, train_loss: 0.8498, test_loss: 0.9069, test_f1: 0.5494
 epoch: 36, train_loss: 0.8414, test_loss: 0.8968, test_f1: 0.5471
 epoch: 37, train_loss: 0.8357, test_loss: 0.9122, test_f1: 0.5495
 epoch: 38, train_loss: 0.8336, test_loss: 0.9146, test_f1: 0.5411
 epoch: 39, train_loss: 0.8316, test_loss: 0.9046, test_f1: 0.5620
 epoch: 40, train_loss: 0.8194, test_loss: 0.9089, test_f1: 0.5413
 epoch: 41, train_loss: 0.8273, test_loss: 0.9099, test_f1: 0.5510
 epoch: 42, train_loss: 0.8185, test_loss: 0.9071, test_f1: 0.5492
 epoch: 43, train_loss: 0.8188, test_loss: 0.9156, test_f1: 0.5616
 epoch: 44, train_loss: 0.8270, test_loss: 0.9139, test_f1: 0.5564
 epoch: 45, train_loss: 0.8131, test_loss: 0.9220, test_f1: 0.5438
 epoch: 46, train_loss: 0.8101, test_loss: 0.9070, test_f1: 0.5587
 epoch: 47, train_loss: 0.8138, test_loss: 0.9197, test_f1: 0.5590
 epoch: 48, train_loss: 0.8160, test_loss: 0.9166, test_f1: 0.5642
 epoch: 49, train_loss: 0.7939, test_loss: 0.8931, test_f1: 0.5541
 epoch: 50, train_loss: 0.8028, test_loss: 0.9294, test_f1: 0.5396
 epoch: 51, train_loss: 0.7998, test_loss: 0.9148, test_f1: 0.5404
 epoch: 52, train_loss: 0.7826, test_loss: 0.9172, test_f1: 0.5506
 epoch: 53, train_loss: 0.7903, test_loss: 0.9129, test_f1: 0.5530
 epoch: 54, train_loss: 0.7824, test_loss: 0.9152, test_f1: 0.5642
 epoch: 55, train_loss: 0.7862, test_loss: 0.9127, test_f1: 0.5581
 epoch: 56, train_loss: 0.7829, test_loss: 0.9220, test_f1: 0.5554
 epoch: 57, train_loss: 0.7807, test_loss: 0.9169, test_f1: 0.5623
 epoch: 58, train_loss: 0.7851, test_loss: 0.9237, test_f1: 0.5709
 epoch: 59, train_loss: 0.7797, test_loss: 0.9030, test_f1: 0.5737
 epoch: 60, train_loss: 0.7763, test_loss: 0.9284, test_f1: 0.5619
 epoch: 61, train_loss: 0.7809, test_loss: 0.9184, test_f1: 0.5621
 epoch: 62, train_loss: 0.7611, test_loss: 0.9268, test_f1: 0.5594
 epoch: 63, train_loss: 0.7662, test_loss: 0.9167, test_f1: 0.5710
 epoch: 64, train_loss: 0.7642, test_loss: 0.9198, test_f1: 0.5591
 epoch: 65, train_loss: 0.7645, test_loss: 0.9187, test_f1: 0.5630
 epoch: 66, train_loss: 0.7728, test_loss: 0.9355, test_f1: 0.5475
 epoch: 67, train_loss: 0.7651, test_loss: 0.9300, test_f1: 0.5620
 epoch: 68, train_loss: 0.7646, test_loss: 0.9407, test_f1: 0.5585
 epoch: 69, train_loss: 0.7589, test_loss: 0.9204, test_f1: 0.5647
 epoch: 70, train_loss: 0.7558, test_loss: 0.9246, test_f1: 0.5619
 epoch: 71, train_loss: 0.7562, test_loss: 0.9454, test_f1: 0.5549
 epoch: 72, train_loss: 0.7577, test_loss: 0.9233, test_f1: 0.5629
 epoch: 73, train_loss: 0.7644, test_loss: 0.9317, test_f1: 0.5593
 epoch: 74, train_loss: 0.7476, test_loss: 0.9526, test_f1: 0.5519
 epoch: 75, train_loss: 0.7491, test_loss: 0.9370, test_f1: 0.5506
 epoch: 76, train_loss: 0.7557, test_loss: 0.9342, test_f1: 0.5578
 epoch: 77, train_loss: 0.7419, test_loss: 0.9268, test_f1: 0.5703
 epoch: 78, train_loss: 0.7422, test_loss: 0.9378, test_f1: 0.5642
 epoch: 79, train_loss: 0.7483, test_loss: 0.9283, test_f1: 0.5653
 epoch: 80, train_loss: 0.7475, test_loss: 0.9434, test_f1: 0.5546
 epoch: 81, train_loss: 0.7504, test_loss: 0.9513, test_f1: 0.5422
 epoch: 82, train_loss: 0.7454, test_loss: 0.9511, test_f1: 0.5485
 epoch: 83, train_loss: 0.7412, test_loss: 0.9446, test_f1: 0.5610
 epoch: 84, train_loss: 0.7402, test_loss: 0.9412, test_f1: 0.5548
 epoch: 85, train_loss: 0.7436, test_loss: 0.9450, test_f1: 0.5709
 epoch: 86, train_loss: 0.7384, test_loss: 0.9492, test_f1: 0.5643
 epoch: 87, train_loss: 0.7458, test_loss: 0.9308, test_f1: 0.5791
 epoch: 88, train_loss: 0.7304, test_loss: 0.9525, test_f1: 0.5655
 epoch: 89, train_loss: 0.7249, test_loss: 0.9405, test_f1: 0.5750
 epoch: 90, train_loss: 0.7378, test_loss: 0.9632, test_f1: 0.5732
 epoch: 91, train_loss: 0.7337, test_loss: 0.9478, test_f1: 0.5621
 epoch: 92, train_loss: 0.7319, test_loss: 0.9429, test_f1: 0.5615
 epoch: 93, train_loss: 0.7342, test_loss: 0.9355, test_f1: 0.5743
 epoch: 94, train_loss: 0.7339, test_loss: 0.9429, test_f1: 0.5675
 epoch: 95, train_loss: 0.7339, test_loss: 0.9601, test_f1: 0.5658
 epoch: 96, train_loss: 0.7266, test_loss: 0.9637, test_f1: 0.5624
 epoch: 97, train_loss: 0.7300, test_loss: 0.9715, test_f1: 0.5687
 epoch: 98, train_loss: 0.7205, test_loss: 0.9605, test_f1: 0.5756
 epoch: 99, train_loss: 0.7265, test_loss: 0.9558, test_f1: 0.5676
##################ITERATION #4 ****************************************
 epoch: 0, train_loss: 1.2775, test_loss: 1.3367, test_f1: 0.3135
 epoch: 1, train_loss: 1.1920, test_loss: 1.2060, test_f1: 0.3303
 epoch: 2, train_loss: 1.1570, test_loss: 1.1205, test_f1: 0.4163
 epoch: 3, train_loss: 1.1348, test_loss: 1.0657, test_f1: 0.4453
 epoch: 4, train_loss: 1.1067, test_loss: 1.0456, test_f1: 0.4480
 epoch: 5, train_loss: 1.0814, test_loss: 1.0213, test_f1: 0.4708
 epoch: 6, train_loss: 1.0548, test_loss: 0.9977, test_f1: 0.4743
 epoch: 7, train_loss: 1.0421, test_loss: 0.9836, test_f1: 0.4813
 epoch: 8, train_loss: 1.0283, test_loss: 0.9716, test_f1: 0.4814
 epoch: 9, train_loss: 1.0111, test_loss: 0.9537, test_f1: 0.4859
 epoch: 10, train_loss: 0.9935, test_loss: 0.9468, test_f1: 0.4940
 epoch: 11, train_loss: 0.9883, test_loss: 0.9348, test_f1: 0.4996
 epoch: 12, train_loss: 0.9829, test_loss: 0.9307, test_f1: 0.5029
 epoch: 13, train_loss: 0.9668, test_loss: 0.9247, test_f1: 0.5011
 epoch: 14, train_loss: 0.9512, test_loss: 0.9148, test_f1: 0.5086
 epoch: 15, train_loss: 0.9489, test_loss: 0.9168, test_f1: 0.5081
 epoch: 16, train_loss: 0.9366, test_loss: 0.9072, test_f1: 0.5057
 epoch: 17, train_loss: 0.9361, test_loss: 0.9047, test_f1: 0.5342
 epoch: 18, train_loss: 0.9254, test_loss: 0.9082, test_f1: 0.5283
 epoch: 19, train_loss: 0.9260, test_loss: 0.9063, test_f1: 0.5285
 epoch: 20, train_loss: 0.9146, test_loss: 0.9121, test_f1: 0.5195
 epoch: 21, train_loss: 0.8973, test_loss: 0.9065, test_f1: 0.5436
 epoch: 22, train_loss: 0.8960, test_loss: 0.9105, test_f1: 0.5302
 epoch: 23, train_loss: 0.9029, test_loss: 0.8995, test_f1: 0.5358
 epoch: 24, train_loss: 0.8886, test_loss: 0.9066, test_f1: 0.5408
 epoch: 25, train_loss: 0.8965, test_loss: 0.9142, test_f1: 0.5541
 epoch: 26, train_loss: 0.8813, test_loss: 0.9103, test_f1: 0.5542
 epoch: 27, train_loss: 0.8773, test_loss: 0.9041, test_f1: 0.5363
 epoch: 28, train_loss: 0.8771, test_loss: 0.9072, test_f1: 0.5320
 epoch: 29, train_loss: 0.8638, test_loss: 0.9058, test_f1: 0.5387
 epoch: 30, train_loss: 0.8551, test_loss: 0.9024, test_f1: 0.5308
 epoch: 31, train_loss: 0.8642, test_loss: 0.9114, test_f1: 0.5460
 epoch: 32, train_loss: 0.8534, test_loss: 0.9074, test_f1: 0.5332
 epoch: 33, train_loss: 0.8462, test_loss: 0.9093, test_f1: 0.5438
 epoch: 34, train_loss: 0.8448, test_loss: 0.9195, test_f1: 0.5360
 epoch: 35, train_loss: 0.8379, test_loss: 0.9134, test_f1: 0.5521
 epoch: 36, train_loss: 0.8363, test_loss: 0.8993, test_f1: 0.5320
 epoch: 37, train_loss: 0.8424, test_loss: 0.9124, test_f1: 0.5428
 epoch: 38, train_loss: 0.8337, test_loss: 0.9236, test_f1: 0.5404
 epoch: 39, train_loss: 0.8268, test_loss: 0.8975, test_f1: 0.5486
 epoch: 40, train_loss: 0.8332, test_loss: 0.9043, test_f1: 0.5346
 epoch: 41, train_loss: 0.8160, test_loss: 0.9138, test_f1: 0.5479
 epoch: 42, train_loss: 0.8158, test_loss: 0.9015, test_f1: 0.5408
 epoch: 43, train_loss: 0.8133, test_loss: 0.9064, test_f1: 0.5347
 epoch: 44, train_loss: 0.8182, test_loss: 0.9091, test_f1: 0.5612
 epoch: 45, train_loss: 0.8119, test_loss: 0.9081, test_f1: 0.5475
 epoch: 46, train_loss: 0.8047, test_loss: 0.9203, test_f1: 0.5560
 epoch: 47, train_loss: 0.7997, test_loss: 0.9108, test_f1: 0.5277
 epoch: 48, train_loss: 0.8022, test_loss: 0.9150, test_f1: 0.5456
 epoch: 49, train_loss: 0.7984, test_loss: 0.9172, test_f1: 0.5577
 epoch: 50, train_loss: 0.8014, test_loss: 0.9113, test_f1: 0.5539
 epoch: 51, train_loss: 0.7903, test_loss: 0.9175, test_f1: 0.5448
 epoch: 52, train_loss: 0.7787, test_loss: 0.9093, test_f1: 0.5484
 epoch: 53, train_loss: 0.7722, test_loss: 0.9160, test_f1: 0.5520
 epoch: 54, train_loss: 0.7816, test_loss: 0.9058, test_f1: 0.5582
 epoch: 55, train_loss: 0.7727, test_loss: 0.9170, test_f1: 0.5451
 epoch: 56, train_loss: 0.7746, test_loss: 0.9183, test_f1: 0.5554
 epoch: 57, train_loss: 0.7630, test_loss: 0.9225, test_f1: 0.5691
 epoch: 58, train_loss: 0.7734, test_loss: 0.9135, test_f1: 0.5613
 epoch: 59, train_loss: 0.7697, test_loss: 0.9158, test_f1: 0.5529
 epoch: 60, train_loss: 0.7651, test_loss: 0.9051, test_f1: 0.5634
 epoch: 61, train_loss: 0.7748, test_loss: 0.9187, test_f1: 0.5533
 epoch: 62, train_loss: 0.7649, test_loss: 0.9165, test_f1: 0.5567
 epoch: 63, train_loss: 0.7681, test_loss: 0.9096, test_f1: 0.5637
 epoch: 64, train_loss: 0.7580, test_loss: 0.9117, test_f1: 0.5520
 epoch: 65, train_loss: 0.7644, test_loss: 0.9128, test_f1: 0.5584
 epoch: 66, train_loss: 0.7576, test_loss: 0.9282, test_f1: 0.5569
 epoch: 67, train_loss: 0.7544, test_loss: 0.9141, test_f1: 0.5538
 epoch: 68, train_loss: 0.7534, test_loss: 0.9234, test_f1: 0.5725
 epoch: 69, train_loss: 0.7498, test_loss: 0.9301, test_f1: 0.5559
 epoch: 70, train_loss: 0.7584, test_loss: 0.9311, test_f1: 0.5569
 epoch: 71, train_loss: 0.7630, test_loss: 0.9265, test_f1: 0.5550
 epoch: 72, train_loss: 0.7637, test_loss: 0.9425, test_f1: 0.5507
 epoch: 73, train_loss: 0.7438, test_loss: 0.9309, test_f1: 0.5607
 epoch: 74, train_loss: 0.7497, test_loss: 0.9346, test_f1: 0.5609
 epoch: 75, train_loss: 0.7399, test_loss: 0.9352, test_f1: 0.5579
 epoch: 76, train_loss: 0.7425, test_loss: 0.9236, test_f1: 0.5588
 epoch: 77, train_loss: 0.7532, test_loss: 0.9297, test_f1: 0.5589
 epoch: 78, train_loss: 0.7422, test_loss: 0.9370, test_f1: 0.5730
 epoch: 79, train_loss: 0.7438, test_loss: 0.9235, test_f1: 0.5763
 epoch: 80, train_loss: 0.7474, test_loss: 0.9261, test_f1: 0.5598
 epoch: 81, train_loss: 0.7354, test_loss: 0.9299, test_f1: 0.5610
 epoch: 82, train_loss: 0.7330, test_loss: 0.9378, test_f1: 0.5629
 epoch: 83, train_loss: 0.7351, test_loss: 0.9248, test_f1: 0.5483
 epoch: 84, train_loss: 0.7345, test_loss: 0.9359, test_f1: 0.5655
 epoch: 85, train_loss: 0.7239, test_loss: 0.9203, test_f1: 0.5848
 epoch: 86, train_loss: 0.7363, test_loss: 0.9395, test_f1: 0.5671
 epoch: 87, train_loss: 0.7367, test_loss: 0.9415, test_f1: 0.5705
 epoch: 88, train_loss: 0.7347, test_loss: 0.9234, test_f1: 0.5790
 epoch: 89, train_loss: 0.7312, test_loss: 0.9283, test_f1: 0.5663
 epoch: 90, train_loss: 0.7342, test_loss: 0.9296, test_f1: 0.5865
 epoch: 91, train_loss: 0.7338, test_loss: 0.9397, test_f1: 0.5788
 epoch: 92, train_loss: 0.7291, test_loss: 0.9302, test_f1: 0.5759
 epoch: 93, train_loss: 0.7351, test_loss: 0.9274, test_f1: 0.5786
 epoch: 94, train_loss: 0.7288, test_loss: 0.9244, test_f1: 0.5794
 epoch: 95, train_loss: 0.7196, test_loss: 0.9363, test_f1: 0.5795
 epoch: 96, train_loss: 0.7301, test_loss: 0.9329, test_f1: 0.5958
 epoch: 97, train_loss: 0.7330, test_loss: 0.9359, test_f1: 0.5727
 epoch: 98, train_loss: 0.7229, test_loss: 0.9273, test_f1: 0.5869
 epoch: 99, train_loss: 0.7139, test_loss: 0.9353, test_f1: 0.5937
##################ITERATION #5 ****************************************
 epoch: 0, train_loss: 1.2615, test_loss: 1.3525, test_f1: 0.3304
 epoch: 1, train_loss: 1.1913, test_loss: 1.2344, test_f1: 0.3210
 epoch: 2, train_loss: 1.1610, test_loss: 1.1428, test_f1: 0.3609
 epoch: 3, train_loss: 1.1443, test_loss: 1.1078, test_f1: 0.3896
 epoch: 4, train_loss: 1.1172, test_loss: 1.0744, test_f1: 0.4228
 epoch: 5, train_loss: 1.1027, test_loss: 1.0657, test_f1: 0.4253
 epoch: 6, train_loss: 1.0785, test_loss: 1.0354, test_f1: 0.4471
 epoch: 7, train_loss: 1.0672, test_loss: 1.0142, test_f1: 0.4595
 epoch: 8, train_loss: 1.0413, test_loss: 1.0175, test_f1: 0.4527
 epoch: 9, train_loss: 1.0400, test_loss: 0.9983, test_f1: 0.4785
 epoch: 10, train_loss: 1.0214, test_loss: 0.9881, test_f1: 0.5025
 epoch: 11, train_loss: 1.0102, test_loss: 0.9728, test_f1: 0.4816
 epoch: 12, train_loss: 1.0054, test_loss: 0.9894, test_f1: 0.4788
 epoch: 13, train_loss: 0.9927, test_loss: 0.9564, test_f1: 0.5048
 epoch: 14, train_loss: 0.9725, test_loss: 0.9458, test_f1: 0.5043
 epoch: 15, train_loss: 0.9621, test_loss: 0.9450, test_f1: 0.5031
 epoch: 16, train_loss: 0.9568, test_loss: 0.9383, test_f1: 0.5145
 epoch: 17, train_loss: 0.9532, test_loss: 0.9339, test_f1: 0.5103
 epoch: 18, train_loss: 0.9417, test_loss: 0.9335, test_f1: 0.5093
 epoch: 19, train_loss: 0.9250, test_loss: 0.9289, test_f1: 0.5157
 epoch: 20, train_loss: 0.9281, test_loss: 0.9346, test_f1: 0.5210
 epoch: 21, train_loss: 0.9125, test_loss: 0.9367, test_f1: 0.5322
 epoch: 22, train_loss: 0.9164, test_loss: 0.9397, test_f1: 0.5120
 epoch: 23, train_loss: 0.9075, test_loss: 0.9397, test_f1: 0.5275
 epoch: 24, train_loss: 0.9089, test_loss: 0.9271, test_f1: 0.5403
 epoch: 25, train_loss: 0.9036, test_loss: 0.9447, test_f1: 0.5339
 epoch: 26, train_loss: 0.8937, test_loss: 0.9291, test_f1: 0.5504
 epoch: 27, train_loss: 0.8727, test_loss: 0.9198, test_f1: 0.5436
 epoch: 28, train_loss: 0.8813, test_loss: 0.9302, test_f1: 0.5451
 epoch: 29, train_loss: 0.8832, test_loss: 0.9225, test_f1: 0.5392
 epoch: 30, train_loss: 0.8752, test_loss: 0.9229, test_f1: 0.5419
 epoch: 31, train_loss: 0.8622, test_loss: 0.9315, test_f1: 0.5377
 epoch: 32, train_loss: 0.8600, test_loss: 0.9382, test_f1: 0.5273
 epoch: 33, train_loss: 0.8610, test_loss: 0.9285, test_f1: 0.5396
 epoch: 34, train_loss: 0.8673, test_loss: 0.9358, test_f1: 0.5491
 epoch: 35, train_loss: 0.8551, test_loss: 0.9271, test_f1: 0.5391
 epoch: 36, train_loss: 0.8428, test_loss: 0.9235, test_f1: 0.5568
 epoch: 37, train_loss: 0.8399, test_loss: 0.9429, test_f1: 0.5431
 epoch: 38, train_loss: 0.8346, test_loss: 0.9357, test_f1: 0.5403
 epoch: 39, train_loss: 0.8301, test_loss: 0.9306, test_f1: 0.5552
 epoch: 40, train_loss: 0.8235, test_loss: 0.9222, test_f1: 0.5641
 epoch: 41, train_loss: 0.8215, test_loss: 0.9305, test_f1: 0.5434
 epoch: 42, train_loss: 0.8180, test_loss: 0.9232, test_f1: 0.5451
 epoch: 43, train_loss: 0.8191, test_loss: 0.9431, test_f1: 0.5384
 epoch: 44, train_loss: 0.8108, test_loss: 0.9184, test_f1: 0.5437
 epoch: 45, train_loss: 0.8097, test_loss: 0.9410, test_f1: 0.5474
 epoch: 46, train_loss: 0.8128, test_loss: 0.9249, test_f1: 0.5539
 epoch: 47, train_loss: 0.8055, test_loss: 0.9201, test_f1: 0.5589
 epoch: 48, train_loss: 0.8091, test_loss: 0.9279, test_f1: 0.5529
 epoch: 49, train_loss: 0.7960, test_loss: 0.9321, test_f1: 0.5467
 epoch: 50, train_loss: 0.8019, test_loss: 0.9447, test_f1: 0.5567
 epoch: 51, train_loss: 0.7839, test_loss: 0.9469, test_f1: 0.5430
 epoch: 52, train_loss: 0.7816, test_loss: 0.9403, test_f1: 0.5506
 epoch: 53, train_loss: 0.7791, test_loss: 0.9324, test_f1: 0.5540
 epoch: 54, train_loss: 0.7728, test_loss: 0.9423, test_f1: 0.5349
 epoch: 55, train_loss: 0.7784, test_loss: 0.9373, test_f1: 0.5500
 epoch: 56, train_loss: 0.7837, test_loss: 0.9470, test_f1: 0.5384
 epoch: 57, train_loss: 0.7688, test_loss: 0.9457, test_f1: 0.5638
 epoch: 58, train_loss: 0.7776, test_loss: 0.9252, test_f1: 0.5634
 epoch: 59, train_loss: 0.7700, test_loss: 0.9406, test_f1: 0.5515
 epoch: 60, train_loss: 0.7683, test_loss: 0.9401, test_f1: 0.5469
 epoch: 61, train_loss: 0.7713, test_loss: 0.9357, test_f1: 0.5597
 epoch: 62, train_loss: 0.7651, test_loss: 0.9393, test_f1: 0.5621
 epoch: 63, train_loss: 0.7697, test_loss: 0.9407, test_f1: 0.5540
 epoch: 64, train_loss: 0.7604, test_loss: 0.9356, test_f1: 0.5545
 epoch: 65, train_loss: 0.7577, test_loss: 0.9433, test_f1: 0.5597
 epoch: 66, train_loss: 0.7642, test_loss: 0.9482, test_f1: 0.5551
 epoch: 67, train_loss: 0.7561, test_loss: 0.9479, test_f1: 0.5481
 epoch: 68, train_loss: 0.7520, test_loss: 0.9517, test_f1: 0.5543
 epoch: 69, train_loss: 0.7516, test_loss: 0.9585, test_f1: 0.5610
 epoch: 70, train_loss: 0.7702, test_loss: 0.9515, test_f1: 0.5622
 epoch: 71, train_loss: 0.7587, test_loss: 0.9506, test_f1: 0.5570
 epoch: 72, train_loss: 0.7467, test_loss: 0.9478, test_f1: 0.5748
 epoch: 73, train_loss: 0.7504, test_loss: 0.9467, test_f1: 0.5712
 epoch: 74, train_loss: 0.7411, test_loss: 0.9429, test_f1: 0.5822
 epoch: 75, train_loss: 0.7492, test_loss: 0.9627, test_f1: 0.5560
 epoch: 76, train_loss: 0.7452, test_loss: 0.9555, test_f1: 0.5695
 epoch: 77, train_loss: 0.7341, test_loss: 0.9439, test_f1: 0.5700
 epoch: 78, train_loss: 0.7540, test_loss: 0.9476, test_f1: 0.5675
 epoch: 79, train_loss: 0.7370, test_loss: 0.9379, test_f1: 0.5900
 epoch: 80, train_loss: 0.7515, test_loss: 0.9613, test_f1: 0.5637
 epoch: 81, train_loss: 0.7420, test_loss: 0.9442, test_f1: 0.5680
 epoch: 82, train_loss: 0.7305, test_loss: 0.9585, test_f1: 0.5613
 epoch: 83, train_loss: 0.7397, test_loss: 0.9544, test_f1: 0.5712
 epoch: 84, train_loss: 0.7357, test_loss: 0.9599, test_f1: 0.5543
 epoch: 85, train_loss: 0.7195, test_loss: 0.9564, test_f1: 0.5685
 epoch: 86, train_loss: 0.7292, test_loss: 0.9701, test_f1: 0.5572
 epoch: 87, train_loss: 0.7283, test_loss: 0.9656, test_f1: 0.5721
 epoch: 88, train_loss: 0.7351, test_loss: 0.9617, test_f1: 0.5564
 epoch: 89, train_loss: 0.7282, test_loss: 0.9594, test_f1: 0.5804
 epoch: 90, train_loss: 0.7297, test_loss: 0.9681, test_f1: 0.5711
 epoch: 91, train_loss: 0.7250, test_loss: 0.9651, test_f1: 0.5604
 epoch: 92, train_loss: 0.7158, test_loss: 0.9638, test_f1: 0.5604
 epoch: 93, train_loss: 0.7071, test_loss: 0.9639, test_f1: 0.5648
 epoch: 94, train_loss: 0.7165, test_loss: 0.9545, test_f1: 0.5669
 epoch: 95, train_loss: 0.7227, test_loss: 0.9603, test_f1: 0.5723
 epoch: 96, train_loss: 0.7088, test_loss: 0.9606, test_f1: 0.5698
 epoch: 97, train_loss: 0.7190, test_loss: 0.9587, test_f1: 0.5648
 epoch: 98, train_loss: 0.7145, test_loss: 0.9663, test_f1: 0.5647
 epoch: 99, train_loss: 0.7200, test_loss: 0.9650, test_f1: 0.5680
##################ITERATION #6 ****************************************
 epoch: 0, train_loss: 1.3150, test_loss: 1.3450, test_f1: 0.2757
 epoch: 1, train_loss: 1.2081, test_loss: 1.2205, test_f1: 0.2949
 epoch: 2, train_loss: 1.1632, test_loss: 1.1177, test_f1: 0.4121
 epoch: 3, train_loss: 1.1348, test_loss: 1.0655, test_f1: 0.4536
 epoch: 4, train_loss: 1.1053, test_loss: 1.0383, test_f1: 0.4789
 epoch: 5, train_loss: 1.0871, test_loss: 1.0185, test_f1: 0.4808
 epoch: 6, train_loss: 1.0639, test_loss: 0.9993, test_f1: 0.4830
 epoch: 7, train_loss: 1.0405, test_loss: 0.9839, test_f1: 0.5034
 epoch: 8, train_loss: 1.0380, test_loss: 0.9715, test_f1: 0.4986
 epoch: 9, train_loss: 1.0174, test_loss: 0.9567, test_f1: 0.5007
 epoch: 10, train_loss: 1.0071, test_loss: 0.9534, test_f1: 0.4936
 epoch: 11, train_loss: 0.9996, test_loss: 0.9447, test_f1: 0.5124
 epoch: 12, train_loss: 0.9802, test_loss: 0.9327, test_f1: 0.5183
 epoch: 13, train_loss: 0.9751, test_loss: 0.9355, test_f1: 0.5273
 epoch: 14, train_loss: 0.9610, test_loss: 0.9200, test_f1: 0.5311
 epoch: 15, train_loss: 0.9473, test_loss: 0.9358, test_f1: 0.5245
 epoch: 16, train_loss: 0.9488, test_loss: 0.9441, test_f1: 0.5083
 epoch: 17, train_loss: 0.9242, test_loss: 0.9059, test_f1: 0.5337
 epoch: 18, train_loss: 0.9203, test_loss: 0.9291, test_f1: 0.5283
 epoch: 19, train_loss: 0.9158, test_loss: 0.9324, test_f1: 0.5276
 epoch: 20, train_loss: 0.9082, test_loss: 0.9197, test_f1: 0.5320
 epoch: 21, train_loss: 0.9122, test_loss: 0.9402, test_f1: 0.5170
 epoch: 22, train_loss: 0.8979, test_loss: 0.9249, test_f1: 0.5197
 epoch: 23, train_loss: 0.8977, test_loss: 0.9387, test_f1: 0.5105
 epoch: 24, train_loss: 0.8901, test_loss: 0.9396, test_f1: 0.5213
 epoch: 25, train_loss: 0.8881, test_loss: 0.9273, test_f1: 0.5159
 epoch: 26, train_loss: 0.8794, test_loss: 0.9316, test_f1: 0.5273
 epoch: 27, train_loss: 0.8706, test_loss: 0.9306, test_f1: 0.5269
 epoch: 28, train_loss: 0.8793, test_loss: 0.9225, test_f1: 0.5256
 epoch: 29, train_loss: 0.8686, test_loss: 0.9553, test_f1: 0.5224
 epoch: 30, train_loss: 0.8663, test_loss: 0.9263, test_f1: 0.5307
 epoch: 31, train_loss: 0.8611, test_loss: 0.9204, test_f1: 0.5284
 epoch: 32, train_loss: 0.8592, test_loss: 0.9468, test_f1: 0.5269
 epoch: 33, train_loss: 0.8562, test_loss: 0.9468, test_f1: 0.5280
 epoch: 34, train_loss: 0.8566, test_loss: 0.9431, test_f1: 0.5252
 epoch: 35, train_loss: 0.8514, test_loss: 0.9281, test_f1: 0.5364
 epoch: 36, train_loss: 0.8505, test_loss: 0.9416, test_f1: 0.5349
 epoch: 37, train_loss: 0.8469, test_loss: 0.9488, test_f1: 0.5267
 epoch: 38, train_loss: 0.8390, test_loss: 0.9396, test_f1: 0.5406
 epoch: 39, train_loss: 0.8338, test_loss: 0.9484, test_f1: 0.5309
 epoch: 40, train_loss: 0.8263, test_loss: 0.9522, test_f1: 0.5191
 epoch: 41, train_loss: 0.8281, test_loss: 0.9609, test_f1: 0.5291
 epoch: 42, train_loss: 0.8252, test_loss: 0.9675, test_f1: 0.5320
 epoch: 43, train_loss: 0.8232, test_loss: 0.9747, test_f1: 0.5288
 epoch: 44, train_loss: 0.8171, test_loss: 0.9737, test_f1: 0.5228
 epoch: 45, train_loss: 0.8317, test_loss: 0.9667, test_f1: 0.5268
 epoch: 46, train_loss: 0.8120, test_loss: 0.9367, test_f1: 0.5382
 epoch: 47, train_loss: 0.8197, test_loss: 0.9440, test_f1: 0.5423
 epoch: 48, train_loss: 0.8099, test_loss: 0.9692, test_f1: 0.5379
 epoch: 49, train_loss: 0.8010, test_loss: 0.9824, test_f1: 0.5310
 epoch: 50, train_loss: 0.8071, test_loss: 0.9648, test_f1: 0.5231
 epoch: 51, train_loss: 0.7897, test_loss: 0.9555, test_f1: 0.5384
 epoch: 52, train_loss: 0.8064, test_loss: 0.9759, test_f1: 0.5368
 epoch: 53, train_loss: 0.7935, test_loss: 0.9850, test_f1: 0.5295
 epoch: 54, train_loss: 0.7940, test_loss: 0.9896, test_f1: 0.5449
 epoch: 55, train_loss: 0.7881, test_loss: 0.9793, test_f1: 0.5361
 epoch: 56, train_loss: 0.7881, test_loss: 0.9688, test_f1: 0.5409
 epoch: 57, train_loss: 0.7907, test_loss: 0.9873, test_f1: 0.5300
 epoch: 58, train_loss: 0.7944, test_loss: 0.9710, test_f1: 0.5484
 epoch: 59, train_loss: 0.7739, test_loss: 0.9784, test_f1: 0.5425
 epoch: 60, train_loss: 0.7971, test_loss: 0.9795, test_f1: 0.5345
 epoch: 61, train_loss: 0.7820, test_loss: 0.9685, test_f1: 0.5513
 epoch: 62, train_loss: 0.7897, test_loss: 0.9968, test_f1: 0.5439
 epoch: 63, train_loss: 0.7790, test_loss: 0.9939, test_f1: 0.5386
 epoch: 64, train_loss: 0.7810, test_loss: 0.9837, test_f1: 0.5515
 epoch: 65, train_loss: 0.7771, test_loss: 0.9766, test_f1: 0.5381
 epoch: 66, train_loss: 0.7779, test_loss: 0.9842, test_f1: 0.5469
 epoch: 67, train_loss: 0.7686, test_loss: 0.9822, test_f1: 0.5551
 epoch: 68, train_loss: 0.7733, test_loss: 0.9968, test_f1: 0.5588
 epoch: 69, train_loss: 0.7753, test_loss: 0.9912, test_f1: 0.5638
 epoch: 70, train_loss: 0.7715, test_loss: 0.9858, test_f1: 0.5605
 epoch: 71, train_loss: 0.7745, test_loss: 0.9980, test_f1: 0.5662
 epoch: 72, train_loss: 0.7622, test_loss: 0.9823, test_f1: 0.5824
 epoch: 73, train_loss: 0.7677, test_loss: 1.0046, test_f1: 0.5578
 epoch: 74, train_loss: 0.7592, test_loss: 0.9955, test_f1: 0.5606
 epoch: 75, train_loss: 0.7655, test_loss: 0.9965, test_f1: 0.5643
 epoch: 76, train_loss: 0.7629, test_loss: 0.9809, test_f1: 0.5631
 epoch: 77, train_loss: 0.7669, test_loss: 0.9848, test_f1: 0.5841
 epoch: 78, train_loss: 0.7609, test_loss: 0.9942, test_f1: 0.5606
 epoch: 79, train_loss: 0.7672, test_loss: 1.0021, test_f1: 0.5535
 epoch: 80, train_loss: 0.7495, test_loss: 0.9866, test_f1: 0.5755
 epoch: 81, train_loss: 0.7554, test_loss: 1.0027, test_f1: 0.5566
 epoch: 82, train_loss: 0.7600, test_loss: 1.0210, test_f1: 0.5669
 epoch: 83, train_loss: 0.7530, test_loss: 1.0084, test_f1: 0.5709
 epoch: 84, train_loss: 0.7517, test_loss: 1.0349, test_f1: 0.5468
 epoch: 85, train_loss: 0.7519, test_loss: 0.9970, test_f1: 0.5852
 epoch: 86, train_loss: 0.7479, test_loss: 1.0090, test_f1: 0.5828
 epoch: 87, train_loss: 0.7598, test_loss: 0.9960, test_f1: 0.5904
 epoch: 88, train_loss: 0.7410, test_loss: 1.0068, test_f1: 0.5676
 epoch: 89, train_loss: 0.7553, test_loss: 1.0320, test_f1: 0.5648
 epoch: 90, train_loss: 0.7406, test_loss: 1.0098, test_f1: 0.5934
 epoch: 91, train_loss: 0.7475, test_loss: 1.0099, test_f1: 0.5874
 epoch: 92, train_loss: 0.7371, test_loss: 1.0242, test_f1: 0.5936
 epoch: 93, train_loss: 0.7345, test_loss: 1.0433, test_f1: 0.5709
 epoch: 94, train_loss: 0.7444, test_loss: 1.0279, test_f1: 0.5661
 epoch: 95, train_loss: 0.7452, test_loss: 1.0368, test_f1: 0.5869
 epoch: 96, train_loss: 0.7407, test_loss: 1.0232, test_f1: 0.5950
 epoch: 97, train_loss: 0.7361, test_loss: 1.0346, test_f1: 0.5925
 epoch: 98, train_loss: 0.7391, test_loss: 1.0356, test_f1: 0.5617
 epoch: 99, train_loss: 0.7207, test_loss: 1.0342, test_f1: 0.5918
##################ITERATION #7 ****************************************
 epoch: 0, train_loss: 1.2820, test_loss: 1.2986, test_f1: 0.2570
 epoch: 1, train_loss: 1.1819, test_loss: 1.1944, test_f1: 0.3440
 epoch: 2, train_loss: 1.1447, test_loss: 1.0968, test_f1: 0.4121
 epoch: 3, train_loss: 1.1266, test_loss: 1.0445, test_f1: 0.4433
 epoch: 4, train_loss: 1.0891, test_loss: 1.0254, test_f1: 0.4621
 epoch: 5, train_loss: 1.0766, test_loss: 1.0205, test_f1: 0.4812
 epoch: 6, train_loss: 1.0534, test_loss: 0.9955, test_f1: 0.4960
 epoch: 7, train_loss: 1.0409, test_loss: 0.9788, test_f1: 0.5062
 epoch: 8, train_loss: 1.0252, test_loss: 0.9756, test_f1: 0.5117
 epoch: 9, train_loss: 1.0137, test_loss: 0.9593, test_f1: 0.5081
 epoch: 10, train_loss: 1.0068, test_loss: 0.9450, test_f1: 0.5120
 epoch: 11, train_loss: 0.9930, test_loss: 0.9322, test_f1: 0.5267
 epoch: 12, train_loss: 0.9842, test_loss: 0.9315, test_f1: 0.5168
 epoch: 13, train_loss: 0.9729, test_loss: 0.9287, test_f1: 0.5174
 epoch: 14, train_loss: 0.9622, test_loss: 0.9246, test_f1: 0.5252
 epoch: 15, train_loss: 0.9458, test_loss: 0.9178, test_f1: 0.5203
 epoch: 16, train_loss: 0.9386, test_loss: 0.9196, test_f1: 0.5156
 epoch: 17, train_loss: 0.9329, test_loss: 0.9070, test_f1: 0.5225
 epoch: 18, train_loss: 0.9347, test_loss: 0.8985, test_f1: 0.5349
 epoch: 19, train_loss: 0.9280, test_loss: 0.8878, test_f1: 0.5302
 epoch: 20, train_loss: 0.9091, test_loss: 0.8936, test_f1: 0.5359
 epoch: 21, train_loss: 0.9156, test_loss: 0.8907, test_f1: 0.5400
 epoch: 22, train_loss: 0.9108, test_loss: 0.8906, test_f1: 0.5381
 epoch: 23, train_loss: 0.8894, test_loss: 0.9060, test_f1: 0.5376
 epoch: 24, train_loss: 0.8924, test_loss: 0.8817, test_f1: 0.5429
 epoch: 25, train_loss: 0.8839, test_loss: 0.8901, test_f1: 0.5472
 epoch: 26, train_loss: 0.8864, test_loss: 0.8869, test_f1: 0.5442
 epoch: 27, train_loss: 0.8730, test_loss: 0.8848, test_f1: 0.5472
 epoch: 28, train_loss: 0.8672, test_loss: 0.8986, test_f1: 0.5502
 epoch: 29, train_loss: 0.8648, test_loss: 0.9046, test_f1: 0.5492
 epoch: 30, train_loss: 0.8674, test_loss: 0.8825, test_f1: 0.5464
 epoch: 31, train_loss: 0.8606, test_loss: 0.8993, test_f1: 0.5465
 epoch: 32, train_loss: 0.8568, test_loss: 0.8995, test_f1: 0.5522
 epoch: 33, train_loss: 0.8475, test_loss: 0.8887, test_f1: 0.5552
 epoch: 34, train_loss: 0.8415, test_loss: 0.8874, test_f1: 0.5593
 epoch: 35, train_loss: 0.8421, test_loss: 0.8782, test_f1: 0.5655
 epoch: 36, train_loss: 0.8317, test_loss: 0.8876, test_f1: 0.5568
 epoch: 37, train_loss: 0.8316, test_loss: 0.8796, test_f1: 0.5688
 epoch: 38, train_loss: 0.8293, test_loss: 0.8775, test_f1: 0.5614
 epoch: 39, train_loss: 0.8236, test_loss: 0.8896, test_f1: 0.5710
 epoch: 40, train_loss: 0.8239, test_loss: 0.8622, test_f1: 0.5729
 epoch: 41, train_loss: 0.8238, test_loss: 0.8880, test_f1: 0.5723
 epoch: 42, train_loss: 0.8154, test_loss: 0.8987, test_f1: 0.5747
 epoch: 43, train_loss: 0.8043, test_loss: 0.8921, test_f1: 0.5774
 epoch: 44, train_loss: 0.8125, test_loss: 0.8854, test_f1: 0.5856
 epoch: 45, train_loss: 0.7973, test_loss: 0.8849, test_f1: 0.5845
 epoch: 46, train_loss: 0.7919, test_loss: 0.8837, test_f1: 0.5804
 epoch: 47, train_loss: 0.7955, test_loss: 0.8724, test_f1: 0.5908
 epoch: 48, train_loss: 0.7857, test_loss: 0.8912, test_f1: 0.5824
 epoch: 49, train_loss: 0.7845, test_loss: 0.8923, test_f1: 0.5870
 epoch: 50, train_loss: 0.7768, test_loss: 0.8932, test_f1: 0.5798
 epoch: 51, train_loss: 0.7668, test_loss: 0.8829, test_f1: 0.5847
 epoch: 52, train_loss: 0.7727, test_loss: 0.8716, test_f1: 0.5998
 epoch: 53, train_loss: 0.7680, test_loss: 0.8818, test_f1: 0.5827
 epoch: 54, train_loss: 0.7708, test_loss: 0.8893, test_f1: 0.5847
 epoch: 55, train_loss: 0.7649, test_loss: 0.8730, test_f1: 0.5912
 epoch: 56, train_loss: 0.7616, test_loss: 0.8910, test_f1: 0.5908
 epoch: 57, train_loss: 0.7589, test_loss: 0.8838, test_f1: 0.5865
 epoch: 58, train_loss: 0.7593, test_loss: 0.8863, test_f1: 0.5990
 epoch: 59, train_loss: 0.7647, test_loss: 0.8842, test_f1: 0.6009
 epoch: 60, train_loss: 0.7530, test_loss: 0.8875, test_f1: 0.5921
 epoch: 61, train_loss: 0.7594, test_loss: 0.8962, test_f1: 0.5916
 epoch: 62, train_loss: 0.7485, test_loss: 0.8909, test_f1: 0.5975
 epoch: 63, train_loss: 0.7572, test_loss: 0.8947, test_f1: 0.6031
 epoch: 64, train_loss: 0.7507, test_loss: 0.9049, test_f1: 0.5820
 epoch: 65, train_loss: 0.7513, test_loss: 0.8938, test_f1: 0.5953
 epoch: 66, train_loss: 0.7408, test_loss: 0.8929, test_f1: 0.5964
 epoch: 67, train_loss: 0.7524, test_loss: 0.8932, test_f1: 0.6006
 epoch: 68, train_loss: 0.7480, test_loss: 0.8900, test_f1: 0.5937
 epoch: 69, train_loss: 0.7370, test_loss: 0.8871, test_f1: 0.6060
 epoch: 70, train_loss: 0.7360, test_loss: 0.8885, test_f1: 0.6107
 epoch: 71, train_loss: 0.7415, test_loss: 0.8952, test_f1: 0.6074
 epoch: 72, train_loss: 0.7293, test_loss: 0.8968, test_f1: 0.6108
 epoch: 73, train_loss: 0.7359, test_loss: 0.8884, test_f1: 0.6164
 epoch: 74, train_loss: 0.7382, test_loss: 0.8866, test_f1: 0.6183
 epoch: 75, train_loss: 0.7345, test_loss: 0.8775, test_f1: 0.6039
 epoch: 76, train_loss: 0.7320, test_loss: 0.8804, test_f1: 0.6138
 epoch: 77, train_loss: 0.7272, test_loss: 0.8932, test_f1: 0.6004
 epoch: 78, train_loss: 0.7308, test_loss: 0.8939, test_f1: 0.6081
 epoch: 79, train_loss: 0.7249, test_loss: 0.8955, test_f1: 0.6023
 epoch: 80, train_loss: 0.7221, test_loss: 0.9031, test_f1: 0.6213
 epoch: 81, train_loss: 0.7277, test_loss: 0.9090, test_f1: 0.6086
 epoch: 82, train_loss: 0.7257, test_loss: 0.8905, test_f1: 0.6181
 epoch: 83, train_loss: 0.7245, test_loss: 0.9142, test_f1: 0.6113
 epoch: 84, train_loss: 0.7178, test_loss: 0.9021, test_f1: 0.6110
 epoch: 85, train_loss: 0.7221, test_loss: 0.9093, test_f1: 0.6198
 epoch: 86, train_loss: 0.7166, test_loss: 0.9109, test_f1: 0.6119
 epoch: 87, train_loss: 0.7200, test_loss: 0.9208, test_f1: 0.6107
 epoch: 88, train_loss: 0.7038, test_loss: 0.9168, test_f1: 0.6158
 epoch: 89, train_loss: 0.7168, test_loss: 0.9093, test_f1: 0.6088
 epoch: 90, train_loss: 0.7120, test_loss: 0.9176, test_f1: 0.6125
 epoch: 91, train_loss: 0.7058, test_loss: 0.9101, test_f1: 0.6095
 epoch: 92, train_loss: 0.7101, test_loss: 0.9096, test_f1: 0.6136
 epoch: 93, train_loss: 0.7134, test_loss: 0.8997, test_f1: 0.6098
 epoch: 94, train_loss: 0.6953, test_loss: 0.9116, test_f1: 0.6058
 epoch: 95, train_loss: 0.7069, test_loss: 0.9012, test_f1: 0.6144
 epoch: 96, train_loss: 0.7032, test_loss: 0.9245, test_f1: 0.5973
 epoch: 97, train_loss: 0.7173, test_loss: 0.9253, test_f1: 0.6030
 epoch: 98, train_loss: 0.7010, test_loss: 0.9302, test_f1: 0.6046
 epoch: 99, train_loss: 0.7053, test_loss: 0.9232, test_f1: 0.6143
##################ITERATION #8 ****************************************
 epoch: 0, train_loss: 1.3099, test_loss: 1.3192, test_f1: 0.2270
 epoch: 1, train_loss: 1.1875, test_loss: 1.1614, test_f1: 0.3694
 epoch: 2, train_loss: 1.1382, test_loss: 1.0471, test_f1: 0.4713
 epoch: 3, train_loss: 1.1096, test_loss: 1.0126, test_f1: 0.5073
 epoch: 4, train_loss: 1.0900, test_loss: 0.9993, test_f1: 0.5122
 epoch: 5, train_loss: 1.0686, test_loss: 0.9833, test_f1: 0.5133
 epoch: 6, train_loss: 1.0604, test_loss: 0.9742, test_f1: 0.5206
 epoch: 7, train_loss: 1.0496, test_loss: 0.9711, test_f1: 0.5207
 epoch: 8, train_loss: 1.0307, test_loss: 0.9563, test_f1: 0.5310
 epoch: 9, train_loss: 1.0181, test_loss: 0.9499, test_f1: 0.5183
 epoch: 10, train_loss: 1.0074, test_loss: 0.9388, test_f1: 0.5035
 epoch: 11, train_loss: 1.0036, test_loss: 0.9470, test_f1: 0.4932
 epoch: 12, train_loss: 0.9947, test_loss: 0.9419, test_f1: 0.5020
 epoch: 13, train_loss: 0.9780, test_loss: 0.9350, test_f1: 0.5162
 epoch: 14, train_loss: 0.9789, test_loss: 0.9406, test_f1: 0.5031
 epoch: 15, train_loss: 0.9714, test_loss: 0.9346, test_f1: 0.4993
 epoch: 16, train_loss: 0.9566, test_loss: 0.9296, test_f1: 0.5268
 epoch: 17, train_loss: 0.9593, test_loss: 0.9241, test_f1: 0.5033
 epoch: 18, train_loss: 0.9460, test_loss: 0.9253, test_f1: 0.5027
 epoch: 19, train_loss: 0.9446, test_loss: 0.9355, test_f1: 0.5170
 epoch: 20, train_loss: 0.9317, test_loss: 0.9259, test_f1: 0.5099
 epoch: 21, train_loss: 0.9302, test_loss: 0.9211, test_f1: 0.5112
 epoch: 22, train_loss: 0.9249, test_loss: 0.9193, test_f1: 0.5171
 epoch: 23, train_loss: 0.9216, test_loss: 0.9180, test_f1: 0.5179
 epoch: 24, train_loss: 0.9199, test_loss: 0.9106, test_f1: 0.5281
 epoch: 25, train_loss: 0.9082, test_loss: 0.9041, test_f1: 0.5497
 epoch: 26, train_loss: 0.9125, test_loss: 0.9298, test_f1: 0.5408
 epoch: 27, train_loss: 0.8974, test_loss: 0.9233, test_f1: 0.5280
 epoch: 28, train_loss: 0.8957, test_loss: 0.9196, test_f1: 0.5401
 epoch: 29, train_loss: 0.8940, test_loss: 0.9328, test_f1: 0.5302
 epoch: 30, train_loss: 0.8930, test_loss: 0.9216, test_f1: 0.5266
 epoch: 31, train_loss: 0.8891, test_loss: 0.9312, test_f1: 0.5299
 epoch: 32, train_loss: 0.8808, test_loss: 0.9286, test_f1: 0.5467
 epoch: 33, train_loss: 0.8735, test_loss: 0.9272, test_f1: 0.5468
 epoch: 34, train_loss: 0.8797, test_loss: 0.9255, test_f1: 0.5407
 epoch: 35, train_loss: 0.8667, test_loss: 0.9177, test_f1: 0.5378
 epoch: 36, train_loss: 0.8618, test_loss: 0.9450, test_f1: 0.5460
 epoch: 37, train_loss: 0.8626, test_loss: 0.9297, test_f1: 0.5344
 epoch: 38, train_loss: 0.8609, test_loss: 0.9138, test_f1: 0.5476
 epoch: 39, train_loss: 0.8537, test_loss: 0.9318, test_f1: 0.5378
 epoch: 40, train_loss: 0.8711, test_loss: 0.9394, test_f1: 0.5396
 epoch: 41, train_loss: 0.8490, test_loss: 0.9265, test_f1: 0.5504
 epoch: 42, train_loss: 0.8480, test_loss: 0.9343, test_f1: 0.5549
 epoch: 43, train_loss: 0.8321, test_loss: 0.9484, test_f1: 0.5373
 epoch: 44, train_loss: 0.8292, test_loss: 0.9253, test_f1: 0.5427
 epoch: 45, train_loss: 0.8326, test_loss: 0.9359, test_f1: 0.5450
 epoch: 46, train_loss: 0.8307, test_loss: 0.9286, test_f1: 0.5622
 epoch: 47, train_loss: 0.8269, test_loss: 0.9308, test_f1: 0.5613
 epoch: 48, train_loss: 0.8389, test_loss: 0.9427, test_f1: 0.5648
 epoch: 49, train_loss: 0.8203, test_loss: 0.9295, test_f1: 0.5558
 epoch: 50, train_loss: 0.8258, test_loss: 0.9361, test_f1: 0.5497
 epoch: 51, train_loss: 0.8185, test_loss: 0.9391, test_f1: 0.5620
 epoch: 52, train_loss: 0.8116, test_loss: 0.9476, test_f1: 0.5402
 epoch: 53, train_loss: 0.8051, test_loss: 0.9414, test_f1: 0.5614
 epoch: 54, train_loss: 0.8053, test_loss: 0.9410, test_f1: 0.5508
 epoch: 55, train_loss: 0.8023, test_loss: 0.9426, test_f1: 0.5495
 epoch: 56, train_loss: 0.7983, test_loss: 0.9291, test_f1: 0.5655
 epoch: 57, train_loss: 0.7974, test_loss: 0.9352, test_f1: 0.5606
 epoch: 58, train_loss: 0.7947, test_loss: 0.9358, test_f1: 0.5573
 epoch: 59, train_loss: 0.8039, test_loss: 0.9421, test_f1: 0.5611
 epoch: 60, train_loss: 0.8027, test_loss: 0.9386, test_f1: 0.5637
 epoch: 61, train_loss: 0.7964, test_loss: 0.9411, test_f1: 0.5657
 epoch: 62, train_loss: 0.7858, test_loss: 0.9355, test_f1: 0.5668
 epoch: 63, train_loss: 0.8058, test_loss: 0.9359, test_f1: 0.5562
 epoch: 64, train_loss: 0.8117, test_loss: 0.9469, test_f1: 0.5584
 epoch: 65, train_loss: 0.7915, test_loss: 0.9359, test_f1: 0.5715
 epoch: 66, train_loss: 0.7976, test_loss: 0.9406, test_f1: 0.5577
 epoch: 67, train_loss: 0.7862, test_loss: 0.9477, test_f1: 0.5658
 epoch: 68, train_loss: 0.7968, test_loss: 0.9475, test_f1: 0.5608
 epoch: 69, train_loss: 0.7900, test_loss: 0.9490, test_f1: 0.5719
 epoch: 70, train_loss: 0.7884, test_loss: 0.9399, test_f1: 0.5629
 epoch: 71, train_loss: 0.7820, test_loss: 0.9439, test_f1: 0.5728
 epoch: 72, train_loss: 0.7890, test_loss: 0.9610, test_f1: 0.5697
 epoch: 73, train_loss: 0.7843, test_loss: 0.9481, test_f1: 0.5783
 epoch: 74, train_loss: 0.7847, test_loss: 0.9352, test_f1: 0.5825
 epoch: 75, train_loss: 0.7726, test_loss: 0.9461, test_f1: 0.5732
 epoch: 76, train_loss: 0.7836, test_loss: 0.9533, test_f1: 0.5615
 epoch: 77, train_loss: 0.7792, test_loss: 0.9511, test_f1: 0.5718
 epoch: 78, train_loss: 0.7724, test_loss: 0.9466, test_f1: 0.5715
 epoch: 79, train_loss: 0.7747, test_loss: 0.9569, test_f1: 0.5663
 epoch: 80, train_loss: 0.7709, test_loss: 0.9559, test_f1: 0.5713
 epoch: 81, train_loss: 0.7670, test_loss: 0.9593, test_f1: 0.5793
 epoch: 82, train_loss: 0.7743, test_loss: 0.9565, test_f1: 0.5801
 epoch: 83, train_loss: 0.7731, test_loss: 0.9571, test_f1: 0.5784
 epoch: 84, train_loss: 0.7726, test_loss: 0.9668, test_f1: 0.5703
 epoch: 85, train_loss: 0.7578, test_loss: 0.9630, test_f1: 0.5756
 epoch: 86, train_loss: 0.7629, test_loss: 0.9591, test_f1: 0.5764
 epoch: 87, train_loss: 0.7593, test_loss: 0.9582, test_f1: 0.5700
 epoch: 88, train_loss: 0.7649, test_loss: 0.9581, test_f1: 0.5782
 epoch: 89, train_loss: 0.7750, test_loss: 0.9660, test_f1: 0.5695
 epoch: 90, train_loss: 0.7661, test_loss: 0.9590, test_f1: 0.5764
 epoch: 91, train_loss: 0.7627, test_loss: 0.9499, test_f1: 0.5792
 epoch: 92, train_loss: 0.7629, test_loss: 0.9461, test_f1: 0.5823
 epoch: 93, train_loss: 0.7654, test_loss: 0.9592, test_f1: 0.5805
 epoch: 94, train_loss: 0.7630, test_loss: 0.9557, test_f1: 0.5836
 epoch: 95, train_loss: 0.7547, test_loss: 0.9546, test_f1: 0.5763
 epoch: 96, train_loss: 0.7558, test_loss: 0.9578, test_f1: 0.5754
 epoch: 97, train_loss: 0.7533, test_loss: 0.9565, test_f1: 0.5844
 epoch: 98, train_loss: 0.7539, test_loss: 0.9535, test_f1: 0.5785
 epoch: 99, train_loss: 0.7556, test_loss: 0.9703, test_f1: 0.5771
##################ITERATION #9 ****************************************
 epoch: 0, train_loss: 1.2905, test_loss: 1.3537, test_f1: 0.2719
 epoch: 1, train_loss: 1.1792, test_loss: 1.1641, test_f1: 0.4062
 epoch: 2, train_loss: 1.1443, test_loss: 1.0802, test_f1: 0.4579
 epoch: 3, train_loss: 1.1126, test_loss: 1.0400, test_f1: 0.4529
 epoch: 4, train_loss: 1.0855, test_loss: 1.0171, test_f1: 0.4607
 epoch: 5, train_loss: 1.0787, test_loss: 1.0001, test_f1: 0.4671
 epoch: 6, train_loss: 1.0587, test_loss: 0.9878, test_f1: 0.4977
 epoch: 7, train_loss: 1.0394, test_loss: 0.9834, test_f1: 0.4977
 epoch: 8, train_loss: 1.0137, test_loss: 0.9629, test_f1: 0.4878
 epoch: 9, train_loss: 1.0085, test_loss: 0.9560, test_f1: 0.5170
 epoch: 10, train_loss: 1.0029, test_loss: 0.9520, test_f1: 0.5093
 epoch: 11, train_loss: 0.9914, test_loss: 0.9509, test_f1: 0.5133
 epoch: 12, train_loss: 0.9723, test_loss: 0.9542, test_f1: 0.5107
 epoch: 13, train_loss: 0.9684, test_loss: 0.9531, test_f1: 0.5196
 epoch: 14, train_loss: 0.9577, test_loss: 0.9320, test_f1: 0.5234
 epoch: 15, train_loss: 0.9442, test_loss: 0.9390, test_f1: 0.5157
 epoch: 16, train_loss: 0.9360, test_loss: 0.9350, test_f1: 0.5313
 epoch: 17, train_loss: 0.9337, test_loss: 0.9381, test_f1: 0.5208
 epoch: 18, train_loss: 0.9236, test_loss: 0.9358, test_f1: 0.5217
 epoch: 19, train_loss: 0.9168, test_loss: 0.9327, test_f1: 0.5344
 epoch: 20, train_loss: 0.9141, test_loss: 0.9379, test_f1: 0.5069
 epoch: 21, train_loss: 0.9074, test_loss: 0.9339, test_f1: 0.5381
 epoch: 22, train_loss: 0.9046, test_loss: 0.9311, test_f1: 0.5335
 epoch: 23, train_loss: 0.8960, test_loss: 0.9386, test_f1: 0.5452
 epoch: 24, train_loss: 0.8949, test_loss: 0.9375, test_f1: 0.5341
 epoch: 25, train_loss: 0.8793, test_loss: 0.9450, test_f1: 0.5300
 epoch: 26, train_loss: 0.8863, test_loss: 0.9407, test_f1: 0.5366
 epoch: 27, train_loss: 0.8762, test_loss: 0.9348, test_f1: 0.5491
 epoch: 28, train_loss: 0.8730, test_loss: 0.9443, test_f1: 0.5512
 epoch: 29, train_loss: 0.8707, test_loss: 0.9442, test_f1: 0.5481
 epoch: 30, train_loss: 0.8668, test_loss: 0.9360, test_f1: 0.5592
 epoch: 31, train_loss: 0.8624, test_loss: 0.9267, test_f1: 0.5635
 epoch: 32, train_loss: 0.8602, test_loss: 0.9474, test_f1: 0.5721
 epoch: 33, train_loss: 0.8506, test_loss: 0.9346, test_f1: 0.5665
 epoch: 34, train_loss: 0.8400, test_loss: 0.9324, test_f1: 0.5708
 epoch: 35, train_loss: 0.8402, test_loss: 0.9313, test_f1: 0.5725
 epoch: 36, train_loss: 0.8304, test_loss: 0.9286, test_f1: 0.5852
 epoch: 37, train_loss: 0.8355, test_loss: 0.9255, test_f1: 0.5859
 epoch: 38, train_loss: 0.8254, test_loss: 0.9426, test_f1: 0.5725
 epoch: 39, train_loss: 0.8363, test_loss: 0.9440, test_f1: 0.5731
 epoch: 40, train_loss: 0.8261, test_loss: 0.9434, test_f1: 0.5682
 epoch: 41, train_loss: 0.8243, test_loss: 0.9618, test_f1: 0.5557
 epoch: 42, train_loss: 0.8191, test_loss: 0.9466, test_f1: 0.5875
 epoch: 43, train_loss: 0.8092, test_loss: 0.9291, test_f1: 0.5813
 epoch: 44, train_loss: 0.8033, test_loss: 0.9430, test_f1: 0.5775
 epoch: 45, train_loss: 0.8081, test_loss: 0.9300, test_f1: 0.5760
 epoch: 46, train_loss: 0.8102, test_loss: 0.9443, test_f1: 0.5882
 epoch: 47, train_loss: 0.7944, test_loss: 0.9465, test_f1: 0.5887
 epoch: 48, train_loss: 0.8014, test_loss: 0.9519, test_f1: 0.5796
 epoch: 49, train_loss: 0.7946, test_loss: 0.9466, test_f1: 0.5755
 epoch: 50, train_loss: 0.7849, test_loss: 0.9583, test_f1: 0.5818
 epoch: 51, train_loss: 0.7830, test_loss: 0.9383, test_f1: 0.5780
 epoch: 52, train_loss: 0.7788, test_loss: 0.9380, test_f1: 0.5866
 epoch: 53, train_loss: 0.7659, test_loss: 0.9366, test_f1: 0.5795
 epoch: 54, train_loss: 0.7774, test_loss: 0.9489, test_f1: 0.5717
 epoch: 55, train_loss: 0.7762, test_loss: 0.9575, test_f1: 0.5832
 epoch: 56, train_loss: 0.7746, test_loss: 0.9427, test_f1: 0.5939
 epoch: 57, train_loss: 0.7652, test_loss: 0.9571, test_f1: 0.5863
 epoch: 58, train_loss: 0.7550, test_loss: 0.9577, test_f1: 0.5786
 epoch: 59, train_loss: 0.7562, test_loss: 0.9476, test_f1: 0.5922
 epoch: 60, train_loss: 0.7728, test_loss: 0.9519, test_f1: 0.5756
 epoch: 61, train_loss: 0.7686, test_loss: 0.9507, test_f1: 0.5811
 epoch: 62, train_loss: 0.7615, test_loss: 0.9480, test_f1: 0.5816
 epoch: 63, train_loss: 0.7532, test_loss: 0.9527, test_f1: 0.5895
 epoch: 64, train_loss: 0.7560, test_loss: 0.9570, test_f1: 0.5812
 epoch: 65, train_loss: 0.7603, test_loss: 0.9452, test_f1: 0.5857
 epoch: 66, train_loss: 0.7581, test_loss: 0.9479, test_f1: 0.5819
 epoch: 67, train_loss: 0.7544, test_loss: 0.9518, test_f1: 0.5839
 epoch: 68, train_loss: 0.7544, test_loss: 0.9596, test_f1: 0.5833
 epoch: 69, train_loss: 0.7503, test_loss: 0.9583, test_f1: 0.5899
 epoch: 70, train_loss: 0.7579, test_loss: 0.9724, test_f1: 0.5748
 epoch: 71, train_loss: 0.7531, test_loss: 0.9629, test_f1: 0.5852
 epoch: 72, train_loss: 0.7516, test_loss: 0.9572, test_f1: 0.5823
 epoch: 73, train_loss: 0.7423, test_loss: 0.9757, test_f1: 0.5819
 epoch: 74, train_loss: 0.7414, test_loss: 0.9762, test_f1: 0.5833
 epoch: 75, train_loss: 0.7522, test_loss: 0.9720, test_f1: 0.5932
 epoch: 76, train_loss: 0.7432, test_loss: 0.9789, test_f1: 0.5832
 epoch: 77, train_loss: 0.7398, test_loss: 0.9662, test_f1: 0.5787
 epoch: 78, train_loss: 0.7327, test_loss: 0.9594, test_f1: 0.5850
 epoch: 79, train_loss: 0.7303, test_loss: 0.9707, test_f1: 0.5767
 epoch: 80, train_loss: 0.7449, test_loss: 0.9718, test_f1: 0.5790
 epoch: 81, train_loss: 0.7321, test_loss: 0.9756, test_f1: 0.5804
 epoch: 82, train_loss: 0.7378, test_loss: 0.9768, test_f1: 0.5806
 epoch: 83, train_loss: 0.7274, test_loss: 0.9784, test_f1: 0.5828
 epoch: 84, train_loss: 0.7333, test_loss: 0.9683, test_f1: 0.5867
 epoch: 85, train_loss: 0.7219, test_loss: 0.9750, test_f1: 0.5903
 epoch: 86, train_loss: 0.7328, test_loss: 0.9762, test_f1: 0.5921
 epoch: 87, train_loss: 0.7305, test_loss: 0.9859, test_f1: 0.5805
 epoch: 88, train_loss: 0.7461, test_loss: 0.9755, test_f1: 0.5815
 epoch: 89, train_loss: 0.7127, test_loss: 0.9885, test_f1: 0.5789
 epoch: 90, train_loss: 0.7224, test_loss: 0.9834, test_f1: 0.5869
 epoch: 91, train_loss: 0.7151, test_loss: 0.9793, test_f1: 0.5809
 epoch: 92, train_loss: 0.7119, test_loss: 0.9867, test_f1: 0.5864
 epoch: 93, train_loss: 0.7225, test_loss: 0.9765, test_f1: 0.5923
 epoch: 94, train_loss: 0.7188, test_loss: 0.9835, test_f1: 0.5821
 epoch: 95, train_loss: 0.7145, test_loss: 0.9741, test_f1: 0.5859
 epoch: 96, train_loss: 0.7038, test_loss: 0.9844, test_f1: 0.5809
 epoch: 97, train_loss: 0.7128, test_loss: 0.9926, test_f1: 0.5970
 epoch: 98, train_loss: 0.7093, test_loss: 0.9929, test_f1: 0.5851
 epoch: 99, train_loss: 0.7105, test_loss: 0.9782, test_f1: 0.5915

Training completed in 523.58 seconds
Best F1: 0.6213 at epoch 80
Mean F1 across iterations: 0.5920  0.0114
========================FINAL RESULTS================================
FEGIN weighted F1: 0.6213  0.0114
python main.py --data ltspice_examples --representation component_net --model FEGIN --layers 5 --hiddens 64 --batch_size 128 --lr 0.0001 --emb_size 512 --epochs 100 --save_appendix component_net_L5_H64_BS128_LR0.0001_E512 --no_val
-----



STDERR:
  File "main.py", line 370, in <module>
    main()
  File "main.py", line 254, in main
    dataset = dataset_class(
  File "/home/philip/projects/ltspice_examples_code_repo/Circuit-Completion-Using-GNNs/component_classification_with_link_prediction_head/evaluation/FEGIN/kernel/circuit_datasets.py", line 15, in __init__
    self.data, self.slices = torch.load(self.processed_paths[0])
  File "/home/philip/.local/lib/python3.8/site-packages/torch/serialization.py", line 1040, in load
    warnings.warn(
  File "/usr/lib/python3.8/warnings.py", line 109, in _showwarnmsg
    sw(msg.message, msg.category, msg.filename, msg.lineno,
  File "main.py", line 47, in warn_with_traceback
    traceback.print_stack(file=log)
/home/philip/projects/ltspice_examples_code_repo/Circuit-Completion-Using-GNNs/component_classification_with_link_prediction_head/evaluation/FEGIN/kernel/circuit_datasets.py:15: FutureWarning: You are using `torch.load` with `weights_only=False` (the current default value), which uses the default pickle module implicitly. It is possible to construct malicious pickle data which will execute arbitrary code during unpickling (See https://github.com/pytorch/pytorch/blob/main/SECURITY.md#untrusted-models for more details). In a future release, the default value for `weights_only` will be flipped to `True`. This limits the functions that could be executed during unpickling. Arbitrary objects will no longer be allowed to be loaded via this mode unless they are explicitly allowlisted by the user via `torch.serialization.add_safe_globals`. We recommend you start setting `weights_only=True` for any use case where you don't have full control of the loaded file. Please open an issue on GitHub for any issues related to this experimental feature.
  self.data, self.slices = torch.load(self.processed_paths[0])
