STDOUT:
Results will be saved in /home/philip/projects/ltspice_examples_code_repo/Circuit-Completion-Using-GNNs/component_classification_with_link_prediction_head/evaluation/FEGIN/results/model_FEGIN_dataset_ltspice_examples
Command line input: python main.py --data ltspice_examples --representation component_pin_net --model FEGIN --layers 2 --hiddens 32 --batch_size 256 --lr 0.1 --emb_size 250 --epochs 100 --save_appendix component_pin_net_L2_H32_BS256_LR0.1_E250 --no_val
 is saved.
-----
ltspice_examples - FEGIN
Using 2 layers, 32 hidden units, h = 2
Loading component_pin_net representation dataset
ENTERED
Training FEGIN on component_pin_net representation
Train: 3558, Test: 846
##################ITERATION #0 ****************************************
 epoch: 0, train_loss: 1.3647, test_loss: 1.7164, test_f1: 0.2344
 epoch: 1, train_loss: 1.2921, test_loss: 1.3081, test_f1: 0.2270
 epoch: 2, train_loss: 1.1999, test_loss: 1.1911, test_f1: 0.3144
 epoch: 3, train_loss: 1.1502, test_loss: 1.2367, test_f1: 0.3460
 epoch: 4, train_loss: 1.1576, test_loss: 1.1168, test_f1: 0.3413
 epoch: 5, train_loss: 1.1333, test_loss: 1.1654, test_f1: 0.3250
 epoch: 6, train_loss: 1.1414, test_loss: 1.1562, test_f1: 0.3354
 epoch: 7, train_loss: 1.1283, test_loss: 1.1479, test_f1: 0.3777
 epoch: 8, train_loss: 1.1074, test_loss: 1.0588, test_f1: 0.3887
 epoch: 9, train_loss: 1.1109, test_loss: 1.0878, test_f1: 0.3430
 epoch: 10, train_loss: 1.1237, test_loss: 1.5723, test_f1: 0.3044
 epoch: 11, train_loss: 1.1023, test_loss: 1.0764, test_f1: 0.3569
 epoch: 12, train_loss: 1.0864, test_loss: 1.4795, test_f1: 0.2528
 epoch: 13, train_loss: 1.0958, test_loss: 1.0916, test_f1: 0.3413
 epoch: 14, train_loss: 1.0836, test_loss: 1.0996, test_f1: 0.4154
 epoch: 15, train_loss: 1.0717, test_loss: 1.0862, test_f1: 0.3533
 epoch: 16, train_loss: 1.0814, test_loss: 1.0650, test_f1: 0.3563
 epoch: 17, train_loss: 1.0771, test_loss: 1.0540, test_f1: 0.3553
 epoch: 18, train_loss: 1.0539, test_loss: 1.0768, test_f1: 0.3460
 epoch: 19, train_loss: 1.0594, test_loss: 1.1491, test_f1: 0.3523
 epoch: 20, train_loss: 1.0795, test_loss: 1.0484, test_f1: 0.4558
 epoch: 21, train_loss: 1.0463, test_loss: 1.0969, test_f1: 0.4097
 epoch: 22, train_loss: 1.0479, test_loss: 1.1673, test_f1: 0.4513
 epoch: 23, train_loss: 1.0326, test_loss: 1.0769, test_f1: 0.4136
 epoch: 24, train_loss: 1.0494, test_loss: 1.1865, test_f1: 0.4142
 epoch: 25, train_loss: 1.0496, test_loss: 1.2019, test_f1: 0.4320
 epoch: 26, train_loss: 1.0240, test_loss: 1.0663, test_f1: 0.5110
 epoch: 27, train_loss: 1.0400, test_loss: 1.0356, test_f1: 0.4328
 epoch: 28, train_loss: 1.0391, test_loss: 1.0971, test_f1: 0.4611
 epoch: 29, train_loss: 1.0211, test_loss: 1.0377, test_f1: 0.5013
 epoch: 30, train_loss: 1.0231, test_loss: 1.8068, test_f1: 0.4253
 epoch: 31, train_loss: 1.0293, test_loss: 1.1131, test_f1: 0.3405
 epoch: 32, train_loss: 1.0433, test_loss: 1.0521, test_f1: 0.3625
 epoch: 33, train_loss: 1.0540, test_loss: 1.0733, test_f1: 0.3953
 epoch: 34, train_loss: 1.0610, test_loss: 1.0583, test_f1: 0.3524
 epoch: 35, train_loss: 1.0351, test_loss: 1.0061, test_f1: 0.4225
 epoch: 36, train_loss: 1.0208, test_loss: 1.0725, test_f1: 0.3651
 epoch: 37, train_loss: 1.0103, test_loss: 0.9932, test_f1: 0.4760
 epoch: 38, train_loss: 1.0208, test_loss: 1.3893, test_f1: 0.2702
 epoch: 39, train_loss: 1.0801, test_loss: 1.4951, test_f1: 0.3179
 epoch: 40, train_loss: 1.0826, test_loss: 1.3530, test_f1: 0.3383
 epoch: 41, train_loss: 1.0740, test_loss: 1.2773, test_f1: 0.3555
 epoch: 42, train_loss: 1.0796, test_loss: 1.2582, test_f1: 0.3371
 epoch: 43, train_loss: 1.0523, test_loss: 1.1613, test_f1: 0.3761
 epoch: 44, train_loss: 1.0429, test_loss: 1.0425, test_f1: 0.3871
 epoch: 45, train_loss: 1.0314, test_loss: 1.0457, test_f1: 0.4841
 epoch: 46, train_loss: 1.0546, test_loss: 1.0616, test_f1: 0.4065
 epoch: 47, train_loss: 1.0294, test_loss: 1.0446, test_f1: 0.3836
 epoch: 48, train_loss: 1.0236, test_loss: 1.0232, test_f1: 0.4689
 epoch: 49, train_loss: 1.0745, test_loss: 1.1801, test_f1: 0.4425
 epoch: 50, train_loss: 1.0410, test_loss: 1.0772, test_f1: 0.4851
 epoch: 51, train_loss: 1.0437, test_loss: 1.0311, test_f1: 0.4447
 epoch: 52, train_loss: 1.0152, test_loss: 1.1056, test_f1: 0.4722
 epoch: 53, train_loss: 1.0015, test_loss: 1.0365, test_f1: 0.4614
 epoch: 54, train_loss: 0.9998, test_loss: 1.1985, test_f1: 0.4608
 epoch: 55, train_loss: 1.0020, test_loss: 1.1852, test_f1: 0.4345
 epoch: 56, train_loss: 0.9891, test_loss: 1.0497, test_f1: 0.4582
 epoch: 57, train_loss: 0.9822, test_loss: 1.0862, test_f1: 0.4392
 epoch: 58, train_loss: 0.9933, test_loss: 1.0371, test_f1: 0.4562
 epoch: 59, train_loss: 0.9948, test_loss: 1.0029, test_f1: 0.4810
 epoch: 60, train_loss: 0.9914, test_loss: 0.9811, test_f1: 0.4732
 epoch: 61, train_loss: 0.9917, test_loss: 1.0435, test_f1: 0.4550
 epoch: 62, train_loss: 1.0033, test_loss: 1.0680, test_f1: 0.4617
 epoch: 63, train_loss: 0.9846, test_loss: 1.0025, test_f1: 0.4848
 epoch: 64, train_loss: 0.9734, test_loss: 1.0914, test_f1: 0.4830
 epoch: 65, train_loss: 0.9864, test_loss: 1.0207, test_f1: 0.4806
 epoch: 66, train_loss: 0.9884, test_loss: 1.0561, test_f1: 0.4678
 epoch: 67, train_loss: 0.9807, test_loss: 1.1490, test_f1: 0.4561
 epoch: 68, train_loss: 0.9858, test_loss: 1.1234, test_f1: 0.4584
 epoch: 69, train_loss: 0.9887, test_loss: 1.1261, test_f1: 0.4820
 epoch: 70, train_loss: 0.9822, test_loss: 1.0230, test_f1: 0.4704
 epoch: 71, train_loss: 0.9812, test_loss: 1.0308, test_f1: 0.4914
 epoch: 72, train_loss: 0.9705, test_loss: 1.0007, test_f1: 0.4796
 epoch: 73, train_loss: 0.9708, test_loss: 1.0001, test_f1: 0.4809
 epoch: 74, train_loss: 0.9635, test_loss: 1.1157, test_f1: 0.4751
 epoch: 75, train_loss: 0.9733, test_loss: 1.3186, test_f1: 0.4705
 epoch: 76, train_loss: 0.9790, test_loss: 0.9917, test_f1: 0.4504
 epoch: 77, train_loss: 0.9820, test_loss: 1.1524, test_f1: 0.4668
 epoch: 78, train_loss: 0.9695, test_loss: 1.0097, test_f1: 0.4867
 epoch: 79, train_loss: 0.9767, test_loss: 1.0830, test_f1: 0.4768
 epoch: 80, train_loss: 0.9908, test_loss: 0.9900, test_f1: 0.4754
 epoch: 81, train_loss: 0.9806, test_loss: 1.0346, test_f1: 0.4876
 epoch: 82, train_loss: 0.9639, test_loss: 1.0487, test_f1: 0.4805
 epoch: 83, train_loss: 0.9658, test_loss: 1.0082, test_f1: 0.4916
 epoch: 84, train_loss: 0.9773, test_loss: 0.9850, test_f1: 0.4694
 epoch: 85, train_loss: 0.9737, test_loss: 0.9716, test_f1: 0.4962
 epoch: 86, train_loss: 0.9766, test_loss: 1.4128, test_f1: 0.4581
 epoch: 87, train_loss: 0.9770, test_loss: 1.9686, test_f1: 0.3932
 epoch: 88, train_loss: 0.9856, test_loss: 1.0893, test_f1: 0.4552
 epoch: 89, train_loss: 0.9901, test_loss: 1.0696, test_f1: 0.4580
 epoch: 90, train_loss: 0.9904, test_loss: 0.9992, test_f1: 0.4683
 epoch: 91, train_loss: 0.9744, test_loss: 1.0242, test_f1: 0.4807
 epoch: 92, train_loss: 0.9762, test_loss: 1.0046, test_f1: 0.4520
 epoch: 93, train_loss: 0.9551, test_loss: 1.0287, test_f1: 0.4640
 epoch: 94, train_loss: 0.9695, test_loss: 1.2286, test_f1: 0.4278
 epoch: 95, train_loss: 0.9685, test_loss: 1.0202, test_f1: 0.4667
 epoch: 96, train_loss: 0.9664, test_loss: 1.1024, test_f1: 0.5121
 epoch: 97, train_loss: 0.9653, test_loss: 1.0405, test_f1: 0.4771
 epoch: 98, train_loss: 0.9744, test_loss: 1.2620, test_f1: 0.4881
 epoch: 99, train_loss: 0.9741, test_loss: 1.2120, test_f1: 0.4461
##################ITERATION #1 ****************************************
 epoch: 0, train_loss: 1.5823, test_loss: 1.4009, test_f1: 0.2270
 epoch: 1, train_loss: 1.3760, test_loss: 1.3613, test_f1: 0.2270
 epoch: 2, train_loss: 1.3262, test_loss: 1.3196, test_f1: 0.2270
 epoch: 3, train_loss: 1.3038, test_loss: 1.3156, test_f1: 0.2270
 epoch: 4, train_loss: 1.3024, test_loss: 1.3154, test_f1: 0.2270
 epoch: 5, train_loss: 1.3016, test_loss: 1.3153, test_f1: 0.2270
 epoch: 6, train_loss: 1.3014, test_loss: 1.3161, test_f1: 0.2270
 epoch: 7, train_loss: 1.3014, test_loss: 1.3142, test_f1: 0.2270
 epoch: 8, train_loss: 1.3018, test_loss: 1.3159, test_f1: 0.2270
 epoch: 9, train_loss: 1.3014, test_loss: 1.3150, test_f1: 0.2270
 epoch: 10, train_loss: 1.3015, test_loss: 1.3142, test_f1: 0.2270
 epoch: 11, train_loss: 1.3015, test_loss: 1.3156, test_f1: 0.2270
 epoch: 12, train_loss: 1.3022, test_loss: 1.3168, test_f1: 0.2270
 epoch: 13, train_loss: 1.3022, test_loss: 1.3143, test_f1: 0.2270
 epoch: 14, train_loss: 1.3016, test_loss: 1.3161, test_f1: 0.2270
 epoch: 15, train_loss: 1.3019, test_loss: 1.3153, test_f1: 0.2270
 epoch: 16, train_loss: 1.3018, test_loss: 1.3143, test_f1: 0.2270
 epoch: 17, train_loss: 1.3018, test_loss: 1.3152, test_f1: 0.2270
 epoch: 18, train_loss: 1.3015, test_loss: 1.3150, test_f1: 0.2270
 epoch: 19, train_loss: 1.3020, test_loss: 1.3159, test_f1: 0.2270
 epoch: 20, train_loss: 1.3014, test_loss: 1.3141, test_f1: 0.2270
 epoch: 21, train_loss: 1.3022, test_loss: 1.3143, test_f1: 0.2270
 epoch: 22, train_loss: 1.3015, test_loss: 1.3160, test_f1: 0.2270
 epoch: 23, train_loss: 1.3019, test_loss: 1.3150, test_f1: 0.2270
 epoch: 24, train_loss: 1.3020, test_loss: 1.3150, test_f1: 0.2270
 epoch: 25, train_loss: 1.3014, test_loss: 1.3156, test_f1: 0.2270
 epoch: 26, train_loss: 1.3017, test_loss: 1.3140, test_f1: 0.2270
 epoch: 27, train_loss: 1.3017, test_loss: 1.3157, test_f1: 0.2270
 epoch: 28, train_loss: 1.3017, test_loss: 1.3150, test_f1: 0.2270
 epoch: 29, train_loss: 1.3020, test_loss: 1.3154, test_f1: 0.2270
 epoch: 30, train_loss: 1.3016, test_loss: 1.3153, test_f1: 0.2270
 epoch: 31, train_loss: 1.3015, test_loss: 1.3147, test_f1: 0.2270
 epoch: 32, train_loss: 1.3019, test_loss: 1.3167, test_f1: 0.2270
 epoch: 33, train_loss: 1.3016, test_loss: 1.3146, test_f1: 0.2270
 epoch: 34, train_loss: 1.3019, test_loss: 1.3158, test_f1: 0.2270
 epoch: 35, train_loss: 1.3021, test_loss: 1.3141, test_f1: 0.2270
 epoch: 36, train_loss: 1.3022, test_loss: 1.3148, test_f1: 0.2270
 epoch: 37, train_loss: 1.3024, test_loss: 1.3144, test_f1: 0.2270
 epoch: 38, train_loss: 1.3015, test_loss: 1.3155, test_f1: 0.2270
 epoch: 39, train_loss: 1.3018, test_loss: 1.3154, test_f1: 0.2270
 epoch: 40, train_loss: 1.3016, test_loss: 1.3145, test_f1: 0.2270
 epoch: 41, train_loss: 1.3022, test_loss: 1.3176, test_f1: 0.2270
 epoch: 42, train_loss: 1.3020, test_loss: 1.3141, test_f1: 0.2270
 epoch: 43, train_loss: 1.3022, test_loss: 1.3145, test_f1: 0.2270
 epoch: 44, train_loss: 1.3018, test_loss: 1.3154, test_f1: 0.2270
 epoch: 45, train_loss: 1.3018, test_loss: 1.3145, test_f1: 0.2270
 epoch: 46, train_loss: 1.3026, test_loss: 1.3181, test_f1: 0.2270
 epoch: 47, train_loss: 1.3022, test_loss: 1.3152, test_f1: 0.2270
 epoch: 48, train_loss: 1.3017, test_loss: 1.3153, test_f1: 0.2270
 epoch: 49, train_loss: 1.3018, test_loss: 1.3147, test_f1: 0.2270
 epoch: 50, train_loss: 1.3015, test_loss: 1.3152, test_f1: 0.2270
 epoch: 51, train_loss: 1.3022, test_loss: 1.3149, test_f1: 0.2270
 epoch: 52, train_loss: 1.3015, test_loss: 1.3158, test_f1: 0.2270
 epoch: 53, train_loss: 1.3013, test_loss: 1.3153, test_f1: 0.2270
 epoch: 54, train_loss: 1.3019, test_loss: 1.3145, test_f1: 0.2270
 epoch: 55, train_loss: 1.3019, test_loss: 1.3154, test_f1: 0.2270
 epoch: 56, train_loss: 1.3017, test_loss: 1.3150, test_f1: 0.2270
 epoch: 57, train_loss: 1.3017, test_loss: 1.3152, test_f1: 0.2270
 epoch: 58, train_loss: 1.3015, test_loss: 1.3153, test_f1: 0.2270
 epoch: 59, train_loss: 1.3016, test_loss: 1.3144, test_f1: 0.2270
 epoch: 60, train_loss: 1.3018, test_loss: 1.3165, test_f1: 0.2270
 epoch: 61, train_loss: 1.3014, test_loss: 1.3142, test_f1: 0.2270
 epoch: 62, train_loss: 1.3016, test_loss: 1.3147, test_f1: 0.2270
 epoch: 63, train_loss: 1.3013, test_loss: 1.3150, test_f1: 0.2270
 epoch: 64, train_loss: 1.3015, test_loss: 1.3146, test_f1: 0.2270
 epoch: 65, train_loss: 1.3019, test_loss: 1.3158, test_f1: 0.2270
 epoch: 66, train_loss: 1.3016, test_loss: 1.3142, test_f1: 0.2270
 epoch: 67, train_loss: 1.3013, test_loss: 1.3152, test_f1: 0.2270
 epoch: 68, train_loss: 1.3017, test_loss: 1.3153, test_f1: 0.2270
 epoch: 69, train_loss: 1.3020, test_loss: 1.3147, test_f1: 0.2270
 epoch: 70, train_loss: 1.3016, test_loss: 1.3156, test_f1: 0.2270
 epoch: 71, train_loss: 1.3013, test_loss: 1.3145, test_f1: 0.2270
 epoch: 72, train_loss: 1.3016, test_loss: 1.3154, test_f1: 0.2270
 epoch: 73, train_loss: 1.3020, test_loss: 1.3146, test_f1: 0.2270
 epoch: 74, train_loss: 1.3019, test_loss: 1.3162, test_f1: 0.2270
 epoch: 75, train_loss: 1.3018, test_loss: 1.3144, test_f1: 0.2270
 epoch: 76, train_loss: 1.3014, test_loss: 1.3152, test_f1: 0.2270
 epoch: 77, train_loss: 1.3018, test_loss: 1.3156, test_f1: 0.2270
 epoch: 78, train_loss: 1.3015, test_loss: 1.3152, test_f1: 0.2270
 epoch: 79, train_loss: 1.3015, test_loss: 1.3147, test_f1: 0.2270
 epoch: 80, train_loss: 1.3015, test_loss: 1.3157, test_f1: 0.2270
 epoch: 81, train_loss: 1.3019, test_loss: 1.3143, test_f1: 0.2270
 epoch: 82, train_loss: 1.3018, test_loss: 1.3146, test_f1: 0.2270
 epoch: 83, train_loss: 1.3018, test_loss: 1.3155, test_f1: 0.2270
 epoch: 84, train_loss: 1.3014, test_loss: 1.3150, test_f1: 0.2270
 epoch: 85, train_loss: 1.3016, test_loss: 1.3151, test_f1: 0.2270
 epoch: 86, train_loss: 1.3017, test_loss: 1.3154, test_f1: 0.2270
 epoch: 87, train_loss: 1.3012, test_loss: 1.3144, test_f1: 0.2270
 epoch: 88, train_loss: 1.3018, test_loss: 1.3148, test_f1: 0.2270
 epoch: 89, train_loss: 1.3018, test_loss: 1.3154, test_f1: 0.2270
 epoch: 90, train_loss: 1.3017, test_loss: 1.3152, test_f1: 0.2270
 epoch: 91, train_loss: 1.3017, test_loss: 1.3140, test_f1: 0.2270
 epoch: 92, train_loss: 1.3018, test_loss: 1.3160, test_f1: 0.2270
 epoch: 93, train_loss: 1.3014, test_loss: 1.3150, test_f1: 0.2270
 epoch: 94, train_loss: 1.3014, test_loss: 1.3148, test_f1: 0.2270
 epoch: 95, train_loss: 1.3022, test_loss: 1.3159, test_f1: 0.2270
 epoch: 96, train_loss: 1.3016, test_loss: 1.3136, test_f1: 0.2270
 epoch: 97, train_loss: 1.3015, test_loss: 1.3156, test_f1: 0.2270
 epoch: 98, train_loss: 1.3019, test_loss: 1.3158, test_f1: 0.2270
 epoch: 99, train_loss: 1.3016, test_loss: 1.3145, test_f1: 0.2270
##################ITERATION #2 ****************************************
 epoch: 0, train_loss: 1.3183, test_loss: 1.3189, test_f1: 0.2270
 epoch: 1, train_loss: 1.3043, test_loss: 1.3155, test_f1: 0.2270
 epoch: 2, train_loss: 1.3021, test_loss: 1.3156, test_f1: 0.2270
 epoch: 3, train_loss: 1.3020, test_loss: 1.3153, test_f1: 0.2270
 epoch: 4, train_loss: 1.3019, test_loss: 1.3155, test_f1: 0.2270
 epoch: 5, train_loss: 1.3027, test_loss: 1.3154, test_f1: 0.2270
 epoch: 6, train_loss: 1.3027, test_loss: 1.3145, test_f1: 0.2270
 epoch: 7, train_loss: 1.3022, test_loss: 1.3152, test_f1: 0.2270
 epoch: 8, train_loss: 1.3016, test_loss: 1.3156, test_f1: 0.2270
 epoch: 9, train_loss: 1.3015, test_loss: 1.3146, test_f1: 0.2270
 epoch: 10, train_loss: 1.3018, test_loss: 1.3155, test_f1: 0.2270
 epoch: 11, train_loss: 1.3016, test_loss: 1.3147, test_f1: 0.2270
 epoch: 12, train_loss: 1.3024, test_loss: 1.3168, test_f1: 0.2270
 epoch: 13, train_loss: 1.3020, test_loss: 1.3153, test_f1: 0.2270
 epoch: 14, train_loss: 1.3019, test_loss: 1.3143, test_f1: 0.2270
 epoch: 15, train_loss: 1.3018, test_loss: 1.3154, test_f1: 0.2270
 epoch: 16, train_loss: 1.3021, test_loss: 1.3158, test_f1: 0.2270
 epoch: 17, train_loss: 1.3017, test_loss: 1.3143, test_f1: 0.2270
 epoch: 18, train_loss: 1.3017, test_loss: 1.3157, test_f1: 0.2270
 epoch: 19, train_loss: 1.3018, test_loss: 1.3156, test_f1: 0.2270
 epoch: 20, train_loss: 1.3020, test_loss: 1.3143, test_f1: 0.2270
 epoch: 21, train_loss: 1.3019, test_loss: 1.3156, test_f1: 0.2270
 epoch: 22, train_loss: 1.3019, test_loss: 1.3146, test_f1: 0.2270
 epoch: 23, train_loss: 1.3020, test_loss: 1.3152, test_f1: 0.2270
 epoch: 24, train_loss: 1.3020, test_loss: 1.3147, test_f1: 0.2270
 epoch: 25, train_loss: 1.3027, test_loss: 1.3149, test_f1: 0.2270
 epoch: 26, train_loss: 1.3023, test_loss: 1.3151, test_f1: 0.2270
 epoch: 27, train_loss: 1.3021, test_loss: 1.3150, test_f1: 0.2270
 epoch: 28, train_loss: 1.3023, test_loss: 1.3151, test_f1: 0.2270
 epoch: 29, train_loss: 1.3021, test_loss: 1.3153, test_f1: 0.2270
 epoch: 30, train_loss: 1.3018, test_loss: 1.3162, test_f1: 0.2270
 epoch: 31, train_loss: 1.3022, test_loss: 1.3151, test_f1: 0.2270
 epoch: 32, train_loss: 1.3018, test_loss: 1.3163, test_f1: 0.2270
 epoch: 33, train_loss: 1.3023, test_loss: 1.3134, test_f1: 0.2270
 epoch: 34, train_loss: 1.3023, test_loss: 1.3172, test_f1: 0.2270
 epoch: 35, train_loss: 1.3023, test_loss: 1.3134, test_f1: 0.2270
 epoch: 36, train_loss: 1.3027, test_loss: 1.3188, test_f1: 0.2270
 epoch: 37, train_loss: 1.3026, test_loss: 1.3137, test_f1: 0.2270
 epoch: 38, train_loss: 1.3024, test_loss: 1.3160, test_f1: 0.2270
 epoch: 39, train_loss: 1.3023, test_loss: 1.3142, test_f1: 0.2270
 epoch: 40, train_loss: 1.3048, test_loss: 1.3143, test_f1: 0.2270
 epoch: 41, train_loss: 1.3021, test_loss: 1.3149, test_f1: 0.2270
 epoch: 42, train_loss: 1.3018, test_loss: 1.3152, test_f1: 0.2270
 epoch: 43, train_loss: 1.3018, test_loss: 1.3153, test_f1: 0.2270
 epoch: 44, train_loss: 1.3024, test_loss: 1.3148, test_f1: 0.2270
 epoch: 45, train_loss: 1.3021, test_loss: 1.3151, test_f1: 0.2270
 epoch: 46, train_loss: 1.3023, test_loss: 1.3160, test_f1: 0.2270
 epoch: 47, train_loss: 1.3019, test_loss: 1.3146, test_f1: 0.2270
 epoch: 48, train_loss: 1.3017, test_loss: 1.3162, test_f1: 0.2270
 epoch: 49, train_loss: 1.3023, test_loss: 1.3144, test_f1: 0.2270
 epoch: 50, train_loss: 1.3022, test_loss: 1.3159, test_f1: 0.2270
 epoch: 51, train_loss: 1.3015, test_loss: 1.3150, test_f1: 0.2270
 epoch: 52, train_loss: 1.3017, test_loss: 1.3157, test_f1: 0.2270
 epoch: 53, train_loss: 1.3014, test_loss: 1.3149, test_f1: 0.2270
 epoch: 54, train_loss: 1.3021, test_loss: 1.3145, test_f1: 0.2270
 epoch: 55, train_loss: 1.3021, test_loss: 1.3160, test_f1: 0.2270
 epoch: 56, train_loss: 1.3020, test_loss: 1.3142, test_f1: 0.2270
 epoch: 57, train_loss: 1.3015, test_loss: 1.3161, test_f1: 0.2270
 epoch: 58, train_loss: 1.3017, test_loss: 1.3156, test_f1: 0.2270
 epoch: 59, train_loss: 1.3016, test_loss: 1.3139, test_f1: 0.2270
 epoch: 60, train_loss: 1.3015, test_loss: 1.3155, test_f1: 0.2270
 epoch: 61, train_loss: 1.3020, test_loss: 1.3161, test_f1: 0.2270
 epoch: 62, train_loss: 1.3017, test_loss: 1.3149, test_f1: 0.2270
 epoch: 63, train_loss: 1.3015, test_loss: 1.3142, test_f1: 0.2270
 epoch: 64, train_loss: 1.3020, test_loss: 1.3149, test_f1: 0.2270
 epoch: 65, train_loss: 1.3019, test_loss: 1.3165, test_f1: 0.2270
 epoch: 66, train_loss: 1.3019, test_loss: 1.3141, test_f1: 0.2270
 epoch: 67, train_loss: 1.3020, test_loss: 1.3164, test_f1: 0.2270
 epoch: 68, train_loss: 1.3017, test_loss: 1.3141, test_f1: 0.2270
 epoch: 69, train_loss: 1.3014, test_loss: 1.3156, test_f1: 0.2270
 epoch: 70, train_loss: 1.3015, test_loss: 1.3154, test_f1: 0.2270
 epoch: 71, train_loss: 1.3016, test_loss: 1.3153, test_f1: 0.2270
 epoch: 72, train_loss: 1.3015, test_loss: 1.3149, test_f1: 0.2270
 epoch: 73, train_loss: 1.3024, test_loss: 1.3152, test_f1: 0.2270
 epoch: 74, train_loss: 1.3019, test_loss: 1.3158, test_f1: 0.2270
 epoch: 75, train_loss: 1.3015, test_loss: 1.3143, test_f1: 0.2270
 epoch: 76, train_loss: 1.3014, test_loss: 1.3150, test_f1: 0.2270
 epoch: 77, train_loss: 1.3016, test_loss: 1.3155, test_f1: 0.2270
 epoch: 78, train_loss: 1.3017, test_loss: 1.3149, test_f1: 0.2270
 epoch: 79, train_loss: 1.3017, test_loss: 1.3155, test_f1: 0.2270
 epoch: 80, train_loss: 1.3015, test_loss: 1.3148, test_f1: 0.2270
 epoch: 81, train_loss: 1.3015, test_loss: 1.3156, test_f1: 0.2270
 epoch: 82, train_loss: 1.3014, test_loss: 1.3144, test_f1: 0.2270
 epoch: 83, train_loss: 1.3018, test_loss: 1.3150, test_f1: 0.2270
 epoch: 84, train_loss: 1.3016, test_loss: 1.3152, test_f1: 0.2270
 epoch: 85, train_loss: 1.3017, test_loss: 1.3151, test_f1: 0.2270
 epoch: 86, train_loss: 1.3019, test_loss: 1.3149, test_f1: 0.2270
 epoch: 87, train_loss: 1.3016, test_loss: 1.3158, test_f1: 0.2270
 epoch: 88, train_loss: 1.3018, test_loss: 1.3160, test_f1: 0.2270
 epoch: 89, train_loss: 1.3027, test_loss: 1.3138, test_f1: 0.2270
 epoch: 90, train_loss: 1.3017, test_loss: 1.3166, test_f1: 0.2270
 epoch: 91, train_loss: 1.3019, test_loss: 1.3156, test_f1: 0.2270
 epoch: 92, train_loss: 1.3014, test_loss: 1.3152, test_f1: 0.2270
 epoch: 93, train_loss: 1.3017, test_loss: 1.3149, test_f1: 0.2270
 epoch: 94, train_loss: 1.3028, test_loss: 1.3164, test_f1: 0.2270
 epoch: 95, train_loss: 1.3015, test_loss: 1.3142, test_f1: 0.2270
 epoch: 96, train_loss: 1.3024, test_loss: 1.3154, test_f1: 0.2270
 epoch: 97, train_loss: 1.3013, test_loss: 1.3144, test_f1: 0.2270
 epoch: 98, train_loss: 1.3022, test_loss: 1.3142, test_f1: 0.2270
 epoch: 99, train_loss: 1.3017, test_loss: 1.3163, test_f1: 0.2270
##################ITERATION #3 ****************************************
 epoch: 0, train_loss: 1.3365, test_loss: 1.3138, test_f1: 0.2270
 epoch: 1, train_loss: 1.3032, test_loss: 1.3149, test_f1: 0.2270
 epoch: 2, train_loss: 1.3022, test_loss: 1.3161, test_f1: 0.2270
 epoch: 3, train_loss: 1.3023, test_loss: 1.3143, test_f1: 0.2270
 epoch: 4, train_loss: 1.3021, test_loss: 1.3157, test_f1: 0.2270
 epoch: 5, train_loss: 1.3021, test_loss: 1.3150, test_f1: 0.2270
 epoch: 6, train_loss: 1.3021, test_loss: 1.3164, test_f1: 0.2270
 epoch: 7, train_loss: 1.3027, test_loss: 1.3142, test_f1: 0.2270
 epoch: 8, train_loss: 1.3026, test_loss: 1.3185, test_f1: 0.2270
 epoch: 9, train_loss: 1.3034, test_loss: 1.3137, test_f1: 0.2270
 epoch: 10, train_loss: 1.3033, test_loss: 1.3169, test_f1: 0.2270
 epoch: 11, train_loss: 1.3021, test_loss: 1.3139, test_f1: 0.2270
 epoch: 12, train_loss: 1.3014, test_loss: 1.3159, test_f1: 0.2270
 epoch: 13, train_loss: 1.3015, test_loss: 1.3148, test_f1: 0.2270
 epoch: 14, train_loss: 1.3019, test_loss: 1.3154, test_f1: 0.2270
 epoch: 15, train_loss: 1.3016, test_loss: 1.3154, test_f1: 0.2270
 epoch: 16, train_loss: 1.3022, test_loss: 1.3146, test_f1: 0.2270
 epoch: 17, train_loss: 1.3028, test_loss: 1.3162, test_f1: 0.2270
 epoch: 18, train_loss: 1.3029, test_loss: 1.3152, test_f1: 0.2270
 epoch: 19, train_loss: 1.3028, test_loss: 1.3148, test_f1: 0.2270
 epoch: 20, train_loss: 1.3022, test_loss: 1.3159, test_f1: 0.2270
 epoch: 21, train_loss: 1.3019, test_loss: 1.3157, test_f1: 0.2270
 epoch: 22, train_loss: 1.3024, test_loss: 1.3142, test_f1: 0.2270
 epoch: 23, train_loss: 1.3031, test_loss: 1.3148, test_f1: 0.2270
 epoch: 24, train_loss: 1.3025, test_loss: 1.3150, test_f1: 0.2270
 epoch: 25, train_loss: 1.3025, test_loss: 1.3159, test_f1: 0.2270
 epoch: 26, train_loss: 1.3031, test_loss: 1.3144, test_f1: 0.2270
 epoch: 27, train_loss: 1.3023, test_loss: 1.3157, test_f1: 0.2270
 epoch: 28, train_loss: 1.3019, test_loss: 1.3149, test_f1: 0.2270
 epoch: 29, train_loss: 1.3015, test_loss: 1.3162, test_f1: 0.2270
 epoch: 30, train_loss: 1.3025, test_loss: 1.3160, test_f1: 0.2270
 epoch: 31, train_loss: 1.3018, test_loss: 1.3140, test_f1: 0.2270
 epoch: 32, train_loss: 1.3024, test_loss: 1.3146, test_f1: 0.2270
 epoch: 33, train_loss: 1.3023, test_loss: 1.3153, test_f1: 0.2270
 epoch: 34, train_loss: 1.3026, test_loss: 1.3160, test_f1: 0.2270
 epoch: 35, train_loss: 1.3022, test_loss: 1.3152, test_f1: 0.2270
 epoch: 36, train_loss: 1.3018, test_loss: 1.3145, test_f1: 0.2270
 epoch: 37, train_loss: 1.3019, test_loss: 1.3154, test_f1: 0.2270
 epoch: 38, train_loss: 1.3019, test_loss: 1.3152, test_f1: 0.2270
 epoch: 39, train_loss: 1.3023, test_loss: 1.3149, test_f1: 0.2270
 epoch: 40, train_loss: 1.3024, test_loss: 1.3171, test_f1: 0.2270
 epoch: 41, train_loss: 1.3018, test_loss: 1.3151, test_f1: 0.2270
 epoch: 42, train_loss: 1.3019, test_loss: 1.3155, test_f1: 0.2270
 epoch: 43, train_loss: 1.3024, test_loss: 1.3146, test_f1: 0.2270
 epoch: 44, train_loss: 1.3023, test_loss: 1.3156, test_f1: 0.2270
 epoch: 45, train_loss: 1.3024, test_loss: 1.3137, test_f1: 0.2270
 epoch: 46, train_loss: 1.3047, test_loss: 1.3156, test_f1: 0.2270
 epoch: 47, train_loss: 1.3045, test_loss: 1.3153, test_f1: 0.2270
 epoch: 48, train_loss: 1.3024, test_loss: 1.3154, test_f1: 0.2270
 epoch: 49, train_loss: 1.3018, test_loss: 1.3168, test_f1: 0.2270
 epoch: 50, train_loss: 1.3024, test_loss: 1.3135, test_f1: 0.2270
 epoch: 51, train_loss: 1.3021, test_loss: 1.3152, test_f1: 0.2270
 epoch: 52, train_loss: 1.3014, test_loss: 1.3159, test_f1: 0.2270
 epoch: 53, train_loss: 1.3028, test_loss: 1.3142, test_f1: 0.2270
 epoch: 54, train_loss: 1.3020, test_loss: 1.3158, test_f1: 0.2270
 epoch: 55, train_loss: 1.3013, test_loss: 1.3159, test_f1: 0.2270
 epoch: 56, train_loss: 1.3017, test_loss: 1.3151, test_f1: 0.2270
 epoch: 57, train_loss: 1.3013, test_loss: 1.3156, test_f1: 0.2270
 epoch: 58, train_loss: 1.3016, test_loss: 1.3142, test_f1: 0.2270
 epoch: 59, train_loss: 1.3020, test_loss: 1.3159, test_f1: 0.2270
 epoch: 60, train_loss: 1.3017, test_loss: 1.3147, test_f1: 0.2270
 epoch: 61, train_loss: 1.3016, test_loss: 1.3148, test_f1: 0.2270
 epoch: 62, train_loss: 1.3013, test_loss: 1.3154, test_f1: 0.2270
 epoch: 63, train_loss: 1.3016, test_loss: 1.3151, test_f1: 0.2270
 epoch: 64, train_loss: 1.3020, test_loss: 1.3144, test_f1: 0.2270
 epoch: 65, train_loss: 1.3015, test_loss: 1.3158, test_f1: 0.2270
 epoch: 66, train_loss: 1.3020, test_loss: 1.3156, test_f1: 0.2270
 epoch: 67, train_loss: 1.3018, test_loss: 1.3147, test_f1: 0.2270
 epoch: 68, train_loss: 1.3019, test_loss: 1.3161, test_f1: 0.2270
 epoch: 69, train_loss: 1.3018, test_loss: 1.3143, test_f1: 0.2270
 epoch: 70, train_loss: 1.3019, test_loss: 1.3157, test_f1: 0.2270
 epoch: 71, train_loss: 1.3012, test_loss: 1.3150, test_f1: 0.2270
 epoch: 72, train_loss: 1.3017, test_loss: 1.3155, test_f1: 0.2270
 epoch: 73, train_loss: 1.3020, test_loss: 1.3142, test_f1: 0.2270
 epoch: 74, train_loss: 1.3016, test_loss: 1.3162, test_f1: 0.2270
 epoch: 75, train_loss: 1.3018, test_loss: 1.3148, test_f1: 0.2270
 epoch: 76, train_loss: 1.3015, test_loss: 1.3152, test_f1: 0.2270
 epoch: 77, train_loss: 1.3014, test_loss: 1.3149, test_f1: 0.2270
 epoch: 78, train_loss: 1.3015, test_loss: 1.3146, test_f1: 0.2270
 epoch: 79, train_loss: 1.3015, test_loss: 1.3149, test_f1: 0.2270
 epoch: 80, train_loss: 1.3017, test_loss: 1.3158, test_f1: 0.2270
 epoch: 81, train_loss: 1.3016, test_loss: 1.3155, test_f1: 0.2270
 epoch: 82, train_loss: 1.3016, test_loss: 1.3148, test_f1: 0.2270
 epoch: 83, train_loss: 1.3018, test_loss: 1.3148, test_f1: 0.2270
 epoch: 84, train_loss: 1.3017, test_loss: 1.3150, test_f1: 0.2270
 epoch: 85, train_loss: 1.3020, test_loss: 1.3147, test_f1: 0.2270
 epoch: 86, train_loss: 1.3018, test_loss: 1.3156, test_f1: 0.2270
 epoch: 87, train_loss: 1.3020, test_loss: 1.3152, test_f1: 0.2270
 epoch: 88, train_loss: 1.3015, test_loss: 1.3153, test_f1: 0.2270
 epoch: 89, train_loss: 1.3017, test_loss: 1.3151, test_f1: 0.2270
 epoch: 90, train_loss: 1.3014, test_loss: 1.3159, test_f1: 0.2270
 epoch: 91, train_loss: 1.3015, test_loss: 1.3150, test_f1: 0.2270
 epoch: 92, train_loss: 1.3017, test_loss: 1.3157, test_f1: 0.2270
 epoch: 93, train_loss: 1.3021, test_loss: 1.3142, test_f1: 0.2270
 epoch: 94, train_loss: 1.3014, test_loss: 1.3150, test_f1: 0.2270
 epoch: 95, train_loss: 1.3017, test_loss: 1.3148, test_f1: 0.2270
 epoch: 96, train_loss: 1.3016, test_loss: 1.3154, test_f1: 0.2270
 epoch: 97, train_loss: 1.3017, test_loss: 1.3152, test_f1: 0.2270
 epoch: 98, train_loss: 1.3018, test_loss: 1.3152, test_f1: 0.2270
 epoch: 99, train_loss: 1.3019, test_loss: 1.3152, test_f1: 0.2270
##################ITERATION #4 ****************************************
 epoch: 0, train_loss: 1.3069, test_loss: 1.3163, test_f1: 0.2270
 epoch: 1, train_loss: 1.3034, test_loss: 1.3155, test_f1: 0.2270
 epoch: 2, train_loss: 1.3024, test_loss: 1.3159, test_f1: 0.2270
 epoch: 3, train_loss: 1.3030, test_loss: 1.3156, test_f1: 0.2270
 epoch: 4, train_loss: 1.3018, test_loss: 1.3138, test_f1: 0.2270
 epoch: 5, train_loss: 1.3017, test_loss: 1.3161, test_f1: 0.2270
 epoch: 6, train_loss: 1.3029, test_loss: 1.3142, test_f1: 0.2270
 epoch: 7, train_loss: 1.3017, test_loss: 1.3157, test_f1: 0.2270
 epoch: 8, train_loss: 1.3022, test_loss: 1.3147, test_f1: 0.2270
 epoch: 9, train_loss: 1.3022, test_loss: 1.3151, test_f1: 0.2270
 epoch: 10, train_loss: 1.3025, test_loss: 1.3149, test_f1: 0.2270
 epoch: 11, train_loss: 1.3029, test_loss: 1.3145, test_f1: 0.2270
 epoch: 12, train_loss: 1.3028, test_loss: 1.3146, test_f1: 0.2270
 epoch: 13, train_loss: 1.3032, test_loss: 1.3162, test_f1: 0.2270
 epoch: 14, train_loss: 1.3017, test_loss: 1.3150, test_f1: 0.2270
 epoch: 15, train_loss: 1.3025, test_loss: 1.3155, test_f1: 0.2270
 epoch: 16, train_loss: 1.3017, test_loss: 1.3144, test_f1: 0.2270
 epoch: 17, train_loss: 1.3026, test_loss: 1.3159, test_f1: 0.2270
 epoch: 18, train_loss: 1.3041, test_loss: 1.3145, test_f1: 0.2270
 epoch: 19, train_loss: 1.3023, test_loss: 1.3159, test_f1: 0.2270
 epoch: 20, train_loss: 1.3023, test_loss: 1.3155, test_f1: 0.2270
 epoch: 21, train_loss: 1.3027, test_loss: 1.3145, test_f1: 0.2270
 epoch: 22, train_loss: 1.3023, test_loss: 1.3173, test_f1: 0.2270
 epoch: 23, train_loss: 1.3028, test_loss: 1.3147, test_f1: 0.2270
 epoch: 24, train_loss: 1.3024, test_loss: 1.3158, test_f1: 0.2270
 epoch: 25, train_loss: 1.3026, test_loss: 1.3142, test_f1: 0.2270
 epoch: 26, train_loss: 1.3016, test_loss: 1.3160, test_f1: 0.2270
 epoch: 27, train_loss: 1.3022, test_loss: 1.3155, test_f1: 0.2270
 epoch: 28, train_loss: 1.3022, test_loss: 1.3146, test_f1: 0.2270
 epoch: 29, train_loss: 1.3022, test_loss: 1.3151, test_f1: 0.2270
 epoch: 30, train_loss: 1.3024, test_loss: 1.3159, test_f1: 0.2270
 epoch: 31, train_loss: 1.3018, test_loss: 1.3143, test_f1: 0.2270
 epoch: 32, train_loss: 1.3014, test_loss: 1.3173, test_f1: 0.2270
 epoch: 33, train_loss: 1.3019, test_loss: 1.3138, test_f1: 0.2270
 epoch: 34, train_loss: 1.3015, test_loss: 1.3165, test_f1: 0.2270
 epoch: 35, train_loss: 1.3020, test_loss: 1.3143, test_f1: 0.2270
 epoch: 36, train_loss: 1.3020, test_loss: 1.3154, test_f1: 0.2270
 epoch: 37, train_loss: 1.3024, test_loss: 1.3138, test_f1: 0.2270
 epoch: 38, train_loss: 1.3020, test_loss: 1.3166, test_f1: 0.2270
 epoch: 39, train_loss: 1.3026, test_loss: 1.3146, test_f1: 0.2270
 epoch: 40, train_loss: 1.3028, test_loss: 1.3157, test_f1: 0.2270
 epoch: 41, train_loss: 1.3024, test_loss: 1.3152, test_f1: 0.2270
 epoch: 42, train_loss: 1.3030, test_loss: 1.3153, test_f1: 0.2270
 epoch: 43, train_loss: 1.3030, test_loss: 1.3145, test_f1: 0.2270
 epoch: 44, train_loss: 1.3032, test_loss: 1.3166, test_f1: 0.2270
 epoch: 45, train_loss: 1.3029, test_loss: 1.3148, test_f1: 0.2270
 epoch: 46, train_loss: 1.3027, test_loss: 1.3145, test_f1: 0.2270
 epoch: 47, train_loss: 1.3022, test_loss: 1.3157, test_f1: 0.2270
 epoch: 48, train_loss: 1.3024, test_loss: 1.3136, test_f1: 0.2270
 epoch: 49, train_loss: 1.3030, test_loss: 1.3165, test_f1: 0.2270
 epoch: 50, train_loss: 1.3021, test_loss: 1.3147, test_f1: 0.2270
 epoch: 51, train_loss: 1.3016, test_loss: 1.3154, test_f1: 0.2270
 epoch: 52, train_loss: 1.3014, test_loss: 1.3156, test_f1: 0.2270
 epoch: 53, train_loss: 1.3013, test_loss: 1.3147, test_f1: 0.2270
 epoch: 54, train_loss: 1.3016, test_loss: 1.3149, test_f1: 0.2270
 epoch: 55, train_loss: 1.3016, test_loss: 1.3156, test_f1: 0.2270
 epoch: 56, train_loss: 1.3013, test_loss: 1.3148, test_f1: 0.2270
 epoch: 57, train_loss: 1.3014, test_loss: 1.3152, test_f1: 0.2270
 epoch: 58, train_loss: 1.3015, test_loss: 1.3146, test_f1: 0.2270
 epoch: 59, train_loss: 1.3014, test_loss: 1.3147, test_f1: 0.2270
 epoch: 60, train_loss: 1.3015, test_loss: 1.3148, test_f1: 0.2270
 epoch: 61, train_loss: 1.3014, test_loss: 1.3154, test_f1: 0.2270
 epoch: 62, train_loss: 1.3017, test_loss: 1.3162, test_f1: 0.2270
 epoch: 63, train_loss: 1.3014, test_loss: 1.3143, test_f1: 0.2270
 epoch: 64, train_loss: 1.3014, test_loss: 1.3148, test_f1: 0.2270
 epoch: 65, train_loss: 1.3016, test_loss: 1.3151, test_f1: 0.2270
 epoch: 66, train_loss: 1.3015, test_loss: 1.3153, test_f1: 0.2270
 epoch: 67, train_loss: 1.3017, test_loss: 1.3150, test_f1: 0.2270
 epoch: 68, train_loss: 1.3017, test_loss: 1.3160, test_f1: 0.2270
 epoch: 69, train_loss: 1.3017, test_loss: 1.3140, test_f1: 0.2270
 epoch: 70, train_loss: 1.3014, test_loss: 1.3154, test_f1: 0.2270
 epoch: 71, train_loss: 1.3017, test_loss: 1.3153, test_f1: 0.2270
 epoch: 72, train_loss: 1.3013, test_loss: 1.3159, test_f1: 0.2270
 epoch: 73, train_loss: 1.3024, test_loss: 1.3154, test_f1: 0.2270
 epoch: 74, train_loss: 1.3019, test_loss: 1.3147, test_f1: 0.2270
 epoch: 75, train_loss: 1.3015, test_loss: 1.3148, test_f1: 0.2270
 epoch: 76, train_loss: 1.3016, test_loss: 1.3145, test_f1: 0.2270
 epoch: 77, train_loss: 1.3020, test_loss: 1.3160, test_f1: 0.2270
 epoch: 78, train_loss: 1.3015, test_loss: 1.3151, test_f1: 0.2270
 epoch: 79, train_loss: 1.3019, test_loss: 1.3145, test_f1: 0.2270
 epoch: 80, train_loss: 1.3014, test_loss: 1.3153, test_f1: 0.2270
 epoch: 81, train_loss: 1.3019, test_loss: 1.3163, test_f1: 0.2270
 epoch: 82, train_loss: 1.3017, test_loss: 1.3152, test_f1: 0.2270
 epoch: 83, train_loss: 1.3019, test_loss: 1.3152, test_f1: 0.2270
 epoch: 84, train_loss: 1.3014, test_loss: 1.3150, test_f1: 0.2270
 epoch: 85, train_loss: 1.3014, test_loss: 1.3151, test_f1: 0.2270
 epoch: 86, train_loss: 1.3017, test_loss: 1.3152, test_f1: 0.2270
 epoch: 87, train_loss: 1.3017, test_loss: 1.3145, test_f1: 0.2270
 epoch: 88, train_loss: 1.3014, test_loss: 1.3147, test_f1: 0.2270
 epoch: 89, train_loss: 1.3015, test_loss: 1.3157, test_f1: 0.2270
 epoch: 90, train_loss: 1.3017, test_loss: 1.3152, test_f1: 0.2270
 epoch: 91, train_loss: 1.3014, test_loss: 1.3146, test_f1: 0.2270
 epoch: 92, train_loss: 1.3023, test_loss: 1.3156, test_f1: 0.2270
 epoch: 93, train_loss: 1.3020, test_loss: 1.3150, test_f1: 0.2270
 epoch: 94, train_loss: 1.3019, test_loss: 1.3148, test_f1: 0.2270
 epoch: 95, train_loss: 1.3015, test_loss: 1.3159, test_f1: 0.2270
 epoch: 96, train_loss: 1.3017, test_loss: 1.3150, test_f1: 0.2270
 epoch: 97, train_loss: 1.3017, test_loss: 1.3140, test_f1: 0.2270
 epoch: 98, train_loss: 1.3022, test_loss: 1.3159, test_f1: 0.2270
 epoch: 99, train_loss: 1.3014, test_loss: 1.3149, test_f1: 0.2270
##################ITERATION #5 ****************************************
 epoch: 0, train_loss: 1.3045, test_loss: 1.3195, test_f1: 0.2270
 epoch: 1, train_loss: 1.3038, test_loss: 1.3161, test_f1: 0.2270
 epoch: 2, train_loss: 1.3024, test_loss: 1.3144, test_f1: 0.2270
 epoch: 3, train_loss: 1.3019, test_loss: 1.3153, test_f1: 0.2270
 epoch: 4, train_loss: 1.3024, test_loss: 1.3160, test_f1: 0.2270
 epoch: 5, train_loss: 1.3018, test_loss: 1.3152, test_f1: 0.2270
 epoch: 6, train_loss: 1.3024, test_loss: 1.3172, test_f1: 0.2270
 epoch: 7, train_loss: 1.3030, test_loss: 1.3146, test_f1: 0.2270
 epoch: 8, train_loss: 1.3026, test_loss: 1.3142, test_f1: 0.2270
 epoch: 9, train_loss: 1.3015, test_loss: 1.3152, test_f1: 0.2270
 epoch: 10, train_loss: 1.3025, test_loss: 1.3163, test_f1: 0.2270
 epoch: 11, train_loss: 1.3020, test_loss: 1.3142, test_f1: 0.2270
 epoch: 12, train_loss: 1.3018, test_loss: 1.3159, test_f1: 0.2270
 epoch: 13, train_loss: 1.3023, test_loss: 1.3151, test_f1: 0.2270
 epoch: 14, train_loss: 1.3023, test_loss: 1.3144, test_f1: 0.2270
 epoch: 15, train_loss: 1.3027, test_loss: 1.3160, test_f1: 0.2270
 epoch: 16, train_loss: 1.3029, test_loss: 1.3166, test_f1: 0.2270
 epoch: 17, train_loss: 1.3020, test_loss: 1.3146, test_f1: 0.2270
 epoch: 18, train_loss: 1.3015, test_loss: 1.3157, test_f1: 0.2270
 epoch: 19, train_loss: 1.3014, test_loss: 1.3145, test_f1: 0.2270
 epoch: 20, train_loss: 1.3016, test_loss: 1.3157, test_f1: 0.2270
 epoch: 21, train_loss: 1.3020, test_loss: 1.3142, test_f1: 0.2270
 epoch: 22, train_loss: 1.3027, test_loss: 1.3150, test_f1: 0.2270
 epoch: 23, train_loss: 1.3022, test_loss: 1.3156, test_f1: 0.2270
 epoch: 24, train_loss: 1.3018, test_loss: 1.3146, test_f1: 0.2270
 epoch: 25, train_loss: 1.3018, test_loss: 1.3167, test_f1: 0.2270
 epoch: 26, train_loss: 1.3024, test_loss: 1.3152, test_f1: 0.2270
 epoch: 27, train_loss: 1.3021, test_loss: 1.3159, test_f1: 0.2270
 epoch: 28, train_loss: 1.3026, test_loss: 1.3140, test_f1: 0.2270
 epoch: 29, train_loss: 1.3029, test_loss: 1.3153, test_f1: 0.2270
 epoch: 30, train_loss: 1.3021, test_loss: 1.3161, test_f1: 0.2270
 epoch: 31, train_loss: 1.3030, test_loss: 1.3141, test_f1: 0.2270
 epoch: 32, train_loss: 1.3032, test_loss: 1.3175, test_f1: 0.2270
 epoch: 33, train_loss: 1.3026, test_loss: 1.3155, test_f1: 0.2270
 epoch: 34, train_loss: 1.3023, test_loss: 1.3151, test_f1: 0.2270
 epoch: 35, train_loss: 1.3024, test_loss: 1.3152, test_f1: 0.2270
 epoch: 36, train_loss: 1.3019, test_loss: 1.3162, test_f1: 0.2270
 epoch: 37, train_loss: 1.3023, test_loss: 1.3157, test_f1: 0.2270
 epoch: 38, train_loss: 1.3031, test_loss: 1.3139, test_f1: 0.2270
 epoch: 39, train_loss: 1.3018, test_loss: 1.3169, test_f1: 0.2270
 epoch: 40, train_loss: 1.3035, test_loss: 1.3160, test_f1: 0.2270
 epoch: 41, train_loss: 1.3026, test_loss: 1.3146, test_f1: 0.2270
 epoch: 42, train_loss: 1.3019, test_loss: 1.3149, test_f1: 0.2270
 epoch: 43, train_loss: 1.3018, test_loss: 1.3153, test_f1: 0.2270
 epoch: 44, train_loss: 1.3019, test_loss: 1.3156, test_f1: 0.2270
 epoch: 45, train_loss: 1.3021, test_loss: 1.3150, test_f1: 0.2270
 epoch: 46, train_loss: 1.3027, test_loss: 1.3147, test_f1: 0.2270
 epoch: 47, train_loss: 1.3025, test_loss: 1.3154, test_f1: 0.2270
 epoch: 48, train_loss: 1.3021, test_loss: 1.3143, test_f1: 0.2270
 epoch: 49, train_loss: 1.3027, test_loss: 1.3145, test_f1: 0.2270
 epoch: 50, train_loss: 1.3021, test_loss: 1.3159, test_f1: 0.2270
 epoch: 51, train_loss: 1.3017, test_loss: 1.3153, test_f1: 0.2270
 epoch: 52, train_loss: 1.3016, test_loss: 1.3147, test_f1: 0.2270
 epoch: 53, train_loss: 1.3017, test_loss: 1.3156, test_f1: 0.2270
 epoch: 54, train_loss: 1.3015, test_loss: 1.3150, test_f1: 0.2270
 epoch: 55, train_loss: 1.3016, test_loss: 1.3156, test_f1: 0.2270
 epoch: 56, train_loss: 1.3017, test_loss: 1.3149, test_f1: 0.2270
 epoch: 57, train_loss: 1.3018, test_loss: 1.3142, test_f1: 0.2270
 epoch: 58, train_loss: 1.3016, test_loss: 1.3160, test_f1: 0.2270
 epoch: 59, train_loss: 1.3024, test_loss: 1.3140, test_f1: 0.2270
 epoch: 60, train_loss: 1.3015, test_loss: 1.3156, test_f1: 0.2270
 epoch: 61, train_loss: 1.3014, test_loss: 1.3152, test_f1: 0.2270
 epoch: 62, train_loss: 1.3019, test_loss: 1.3157, test_f1: 0.2270
 epoch: 63, train_loss: 1.3018, test_loss: 1.3143, test_f1: 0.2270
 epoch: 64, train_loss: 1.3014, test_loss: 1.3156, test_f1: 0.2270
 epoch: 65, train_loss: 1.3014, test_loss: 1.3149, test_f1: 0.2270
 epoch: 66, train_loss: 1.3018, test_loss: 1.3145, test_f1: 0.2270
 epoch: 67, train_loss: 1.3016, test_loss: 1.3152, test_f1: 0.2270
 epoch: 68, train_loss: 1.3018, test_loss: 1.3153, test_f1: 0.2270
 epoch: 69, train_loss: 1.3015, test_loss: 1.3151, test_f1: 0.2270
 epoch: 70, train_loss: 1.3016, test_loss: 1.3145, test_f1: 0.2270
 epoch: 71, train_loss: 1.3015, test_loss: 1.3156, test_f1: 0.2270
 epoch: 72, train_loss: 1.3014, test_loss: 1.3145, test_f1: 0.2270
 epoch: 73, train_loss: 1.3018, test_loss: 1.3156, test_f1: 0.2270
 epoch: 74, train_loss: 1.3016, test_loss: 1.3151, test_f1: 0.2270
 epoch: 75, train_loss: 1.3016, test_loss: 1.3151, test_f1: 0.2270
 epoch: 76, train_loss: 1.3016, test_loss: 1.3150, test_f1: 0.2270
 epoch: 77, train_loss: 1.3018, test_loss: 1.3152, test_f1: 0.2270
 epoch: 78, train_loss: 1.3017, test_loss: 1.3147, test_f1: 0.2270
 epoch: 79, train_loss: 1.3023, test_loss: 1.3153, test_f1: 0.2270
 epoch: 80, train_loss: 1.3017, test_loss: 1.3152, test_f1: 0.2270
 epoch: 81, train_loss: 1.3015, test_loss: 1.3149, test_f1: 0.2270
 epoch: 82, train_loss: 1.3015, test_loss: 1.3155, test_f1: 0.2270
 epoch: 83, train_loss: 1.3015, test_loss: 1.3146, test_f1: 0.2270
 epoch: 84, train_loss: 1.3021, test_loss: 1.3150, test_f1: 0.2270
 epoch: 85, train_loss: 1.3021, test_loss: 1.3147, test_f1: 0.2270
 epoch: 86, train_loss: 1.3017, test_loss: 1.3155, test_f1: 0.2270
 epoch: 87, train_loss: 1.3016, test_loss: 1.3147, test_f1: 0.2270
 epoch: 88, train_loss: 1.3015, test_loss: 1.3151, test_f1: 0.2270
 epoch: 89, train_loss: 1.3015, test_loss: 1.3150, test_f1: 0.2270
 epoch: 90, train_loss: 1.3022, test_loss: 1.3148, test_f1: 0.2270
 epoch: 91, train_loss: 1.3014, test_loss: 1.3146, test_f1: 0.2270
 epoch: 92, train_loss: 1.3021, test_loss: 1.3155, test_f1: 0.2270
 epoch: 93, train_loss: 1.3020, test_loss: 1.3145, test_f1: 0.2270
 epoch: 94, train_loss: 1.3015, test_loss: 1.3158, test_f1: 0.2270
 epoch: 95, train_loss: 1.3019, test_loss: 1.3158, test_f1: 0.2270
 epoch: 96, train_loss: 1.3016, test_loss: 1.3149, test_f1: 0.2270
 epoch: 97, train_loss: 1.3013, test_loss: 1.3153, test_f1: 0.2270
 epoch: 98, train_loss: 1.3018, test_loss: 1.3150, test_f1: 0.2270
 epoch: 99, train_loss: 1.3022, test_loss: 1.3154, test_f1: 0.2270
##################ITERATION #6 ****************************************
 epoch: 0, train_loss: 1.3034, test_loss: 1.3175, test_f1: 0.2270
 epoch: 1, train_loss: 1.3040, test_loss: 1.3149, test_f1: 0.2270
 epoch: 2, train_loss: 1.3033, test_loss: 1.3143, test_f1: 0.2270
 epoch: 3, train_loss: 1.3031, test_loss: 1.3168, test_f1: 0.2270
 epoch: 4, train_loss: 1.3018, test_loss: 1.3150, test_f1: 0.2270
 epoch: 5, train_loss: 1.3017, test_loss: 1.3149, test_f1: 0.2270
 epoch: 6, train_loss: 1.3019, test_loss: 1.3150, test_f1: 0.2270
 epoch: 7, train_loss: 1.3026, test_loss: 1.3161, test_f1: 0.2270
 epoch: 8, train_loss: 1.3026, test_loss: 1.3151, test_f1: 0.2270
 epoch: 9, train_loss: 1.3021, test_loss: 1.3156, test_f1: 0.2270
 epoch: 10, train_loss: 1.3016, test_loss: 1.3149, test_f1: 0.2270
 epoch: 11, train_loss: 1.3026, test_loss: 1.3172, test_f1: 0.2270
 epoch: 12, train_loss: 1.3025, test_loss: 1.3150, test_f1: 0.2270
 epoch: 13, train_loss: 1.3016, test_loss: 1.3146, test_f1: 0.2270
 epoch: 14, train_loss: 1.3024, test_loss: 1.3164, test_f1: 0.2270
 epoch: 15, train_loss: 1.3018, test_loss: 1.3144, test_f1: 0.2270
 epoch: 16, train_loss: 1.3027, test_loss: 1.3179, test_f1: 0.2270
 epoch: 17, train_loss: 1.3019, test_loss: 1.3143, test_f1: 0.2270
 epoch: 18, train_loss: 1.3024, test_loss: 1.3157, test_f1: 0.2270
 epoch: 19, train_loss: 1.3023, test_loss: 1.3156, test_f1: 0.2270
 epoch: 20, train_loss: 1.3019, test_loss: 1.3142, test_f1: 0.2270
 epoch: 21, train_loss: 1.3022, test_loss: 1.3150, test_f1: 0.2270
 epoch: 22, train_loss: 1.3024, test_loss: 1.3151, test_f1: 0.2270
 epoch: 23, train_loss: 1.3023, test_loss: 1.3148, test_f1: 0.2270
 epoch: 24, train_loss: 1.3024, test_loss: 1.3172, test_f1: 0.2270
 epoch: 25, train_loss: 1.3022, test_loss: 1.3142, test_f1: 0.2270
 epoch: 26, train_loss: 1.3027, test_loss: 1.3153, test_f1: 0.2270
 epoch: 27, train_loss: 1.3018, test_loss: 1.3151, test_f1: 0.2270
 epoch: 28, train_loss: 1.3024, test_loss: 1.3157, test_f1: 0.2270
 epoch: 29, train_loss: 1.3020, test_loss: 1.3146, test_f1: 0.2270
 epoch: 30, train_loss: 1.3028, test_loss: 1.3167, test_f1: 0.2270
 epoch: 31, train_loss: 1.3023, test_loss: 1.3156, test_f1: 0.2270
 epoch: 32, train_loss: 1.3023, test_loss: 1.3153, test_f1: 0.2270
 epoch: 33, train_loss: 1.3024, test_loss: 1.3146, test_f1: 0.2270
 epoch: 34, train_loss: 1.3030, test_loss: 1.3158, test_f1: 0.2270
 epoch: 35, train_loss: 1.3034, test_loss: 1.3144, test_f1: 0.2270
 epoch: 36, train_loss: 1.3037, test_loss: 1.3163, test_f1: 0.2270
 epoch: 37, train_loss: 1.3021, test_loss: 1.3144, test_f1: 0.2270
 epoch: 38, train_loss: 1.3022, test_loss: 1.3155, test_f1: 0.2270
 epoch: 39, train_loss: 1.3018, test_loss: 1.3151, test_f1: 0.2270
 epoch: 40, train_loss: 1.3028, test_loss: 1.3166, test_f1: 0.2270
 epoch: 41, train_loss: 1.3033, test_loss: 1.3143, test_f1: 0.2270
 epoch: 42, train_loss: 1.3032, test_loss: 1.3168, test_f1: 0.2270
 epoch: 43, train_loss: 1.3026, test_loss: 1.3166, test_f1: 0.2270
 epoch: 44, train_loss: 1.3026, test_loss: 1.3153, test_f1: 0.2270
 epoch: 45, train_loss: 1.3022, test_loss: 1.3170, test_f1: 0.2270
 epoch: 46, train_loss: 1.3022, test_loss: 1.3150, test_f1: 0.2270
 epoch: 47, train_loss: 1.3027, test_loss: 1.3169, test_f1: 0.2270
 epoch: 48, train_loss: 1.3026, test_loss: 1.3146, test_f1: 0.2270
 epoch: 49, train_loss: 1.3019, test_loss: 1.3144, test_f1: 0.2270
 epoch: 50, train_loss: 1.3028, test_loss: 1.3153, test_f1: 0.2270
 epoch: 51, train_loss: 1.3018, test_loss: 1.3150, test_f1: 0.2270
 epoch: 52, train_loss: 1.3016, test_loss: 1.3141, test_f1: 0.2270
 epoch: 53, train_loss: 1.3016, test_loss: 1.3157, test_f1: 0.2270
 epoch: 54, train_loss: 1.3017, test_loss: 1.3146, test_f1: 0.2270
 epoch: 55, train_loss: 1.3016, test_loss: 1.3149, test_f1: 0.2270
 epoch: 56, train_loss: 1.3018, test_loss: 1.3152, test_f1: 0.2270
 epoch: 57, train_loss: 1.3017, test_loss: 1.3146, test_f1: 0.2270
 epoch: 58, train_loss: 1.3016, test_loss: 1.3158, test_f1: 0.2270
 epoch: 59, train_loss: 1.3017, test_loss: 1.3150, test_f1: 0.2270
 epoch: 60, train_loss: 1.3014, test_loss: 1.3156, test_f1: 0.2270
 epoch: 61, train_loss: 1.3018, test_loss: 1.3158, test_f1: 0.2270
 epoch: 62, train_loss: 1.3014, test_loss: 1.3142, test_f1: 0.2270
 epoch: 63, train_loss: 1.3016, test_loss: 1.3150, test_f1: 0.2270
 epoch: 64, train_loss: 1.3016, test_loss: 1.3150, test_f1: 0.2270
 epoch: 65, train_loss: 1.3014, test_loss: 1.3151, test_f1: 0.2270
 epoch: 66, train_loss: 1.3015, test_loss: 1.3155, test_f1: 0.2270
 epoch: 67, train_loss: 1.3017, test_loss: 1.3149, test_f1: 0.2270
 epoch: 68, train_loss: 1.3016, test_loss: 1.3155, test_f1: 0.2270
 epoch: 69, train_loss: 1.3014, test_loss: 1.3148, test_f1: 0.2270
 epoch: 70, train_loss: 1.3016, test_loss: 1.3147, test_f1: 0.2270
 epoch: 71, train_loss: 1.3017, test_loss: 1.3153, test_f1: 0.2270
 epoch: 72, train_loss: 1.3016, test_loss: 1.3153, test_f1: 0.2270
 epoch: 73, train_loss: 1.3015, test_loss: 1.3150, test_f1: 0.2270
 epoch: 74, train_loss: 1.3018, test_loss: 1.3155, test_f1: 0.2270
 epoch: 75, train_loss: 1.3016, test_loss: 1.3145, test_f1: 0.2270
 epoch: 76, train_loss: 1.3016, test_loss: 1.3155, test_f1: 0.2270
 epoch: 77, train_loss: 1.3021, test_loss: 1.3149, test_f1: 0.2270
 epoch: 78, train_loss: 1.3015, test_loss: 1.3153, test_f1: 0.2270
 epoch: 79, train_loss: 1.3014, test_loss: 1.3155, test_f1: 0.2270
 epoch: 80, train_loss: 1.3020, test_loss: 1.3143, test_f1: 0.2270
 epoch: 81, train_loss: 1.3015, test_loss: 1.3151, test_f1: 0.2270
 epoch: 82, train_loss: 1.3015, test_loss: 1.3151, test_f1: 0.2270
 epoch: 83, train_loss: 1.3016, test_loss: 1.3148, test_f1: 0.2270
 epoch: 84, train_loss: 1.3016, test_loss: 1.3149, test_f1: 0.2270
 epoch: 85, train_loss: 1.3014, test_loss: 1.3152, test_f1: 0.2270
 epoch: 86, train_loss: 1.3017, test_loss: 1.3151, test_f1: 0.2270
 epoch: 87, train_loss: 1.3017, test_loss: 1.3145, test_f1: 0.2270
 epoch: 88, train_loss: 1.3013, test_loss: 1.3156, test_f1: 0.2270
 epoch: 89, train_loss: 1.3020, test_loss: 1.3166, test_f1: 0.2270
 epoch: 90, train_loss: 1.3019, test_loss: 1.3142, test_f1: 0.2270
 epoch: 91, train_loss: 1.3016, test_loss: 1.3155, test_f1: 0.2270
 epoch: 92, train_loss: 1.3016, test_loss: 1.3153, test_f1: 0.2270
 epoch: 93, train_loss: 1.3016, test_loss: 1.3143, test_f1: 0.2270
 epoch: 94, train_loss: 1.3019, test_loss: 1.3161, test_f1: 0.2270
 epoch: 95, train_loss: 1.3014, test_loss: 1.3148, test_f1: 0.2270
 epoch: 96, train_loss: 1.3017, test_loss: 1.3145, test_f1: 0.2270
 epoch: 97, train_loss: 1.3017, test_loss: 1.3151, test_f1: 0.2270
 epoch: 98, train_loss: 1.3014, test_loss: 1.3156, test_f1: 0.2270
 epoch: 99, train_loss: 1.3018, test_loss: 1.3148, test_f1: 0.2270
##################ITERATION #7 ****************************************
 epoch: 0, train_loss: 1.3037, test_loss: 1.3185, test_f1: 0.2270
 epoch: 1, train_loss: 1.3037, test_loss: 1.3185, test_f1: 0.2270
 epoch: 2, train_loss: 1.3018, test_loss: 1.3138, test_f1: 0.2270
 epoch: 3, train_loss: 1.3016, test_loss: 1.3161, test_f1: 0.2270
 epoch: 4, train_loss: 1.3018, test_loss: 1.3156, test_f1: 0.2270
 epoch: 5, train_loss: 1.3023, test_loss: 1.3140, test_f1: 0.2270
 epoch: 6, train_loss: 1.3029, test_loss: 1.3149, test_f1: 0.2270
 epoch: 7, train_loss: 1.3034, test_loss: 1.3145, test_f1: 0.2270
 epoch: 8, train_loss: 1.3022, test_loss: 1.3163, test_f1: 0.2270
 epoch: 9, train_loss: 1.3018, test_loss: 1.3145, test_f1: 0.2270
 epoch: 10, train_loss: 1.3015, test_loss: 1.3152, test_f1: 0.2270
 epoch: 11, train_loss: 1.3021, test_loss: 1.3147, test_f1: 0.2270
 epoch: 12, train_loss: 1.3020, test_loss: 1.3160, test_f1: 0.2270
 epoch: 13, train_loss: 1.3023, test_loss: 1.3149, test_f1: 0.2270
 epoch: 14, train_loss: 1.3021, test_loss: 1.3144, test_f1: 0.2270
 epoch: 15, train_loss: 1.3021, test_loss: 1.3176, test_f1: 0.2270
 epoch: 16, train_loss: 1.3029, test_loss: 1.3150, test_f1: 0.2270
 epoch: 17, train_loss: 1.3018, test_loss: 1.3149, test_f1: 0.2270
 epoch: 18, train_loss: 1.3021, test_loss: 1.3156, test_f1: 0.2270
 epoch: 19, train_loss: 1.3016, test_loss: 1.3144, test_f1: 0.2270
 epoch: 20, train_loss: 1.3025, test_loss: 1.3151, test_f1: 0.2270
 epoch: 21, train_loss: 1.3037, test_loss: 1.3156, test_f1: 0.2270
 epoch: 22, train_loss: 1.3028, test_loss: 1.3147, test_f1: 0.2270
 epoch: 23, train_loss: 1.3024, test_loss: 1.3157, test_f1: 0.2270
 epoch: 24, train_loss: 1.3021, test_loss: 1.3162, test_f1: 0.2270
 epoch: 25, train_loss: 1.3023, test_loss: 1.3143, test_f1: 0.2270
 epoch: 26, train_loss: 1.3019, test_loss: 1.3156, test_f1: 0.2270
 epoch: 27, train_loss: 1.3022, test_loss: 1.3151, test_f1: 0.2270
 epoch: 28, train_loss: 1.3028, test_loss: 1.3170, test_f1: 0.2270
 epoch: 29, train_loss: 1.3025, test_loss: 1.3144, test_f1: 0.2270
 epoch: 30, train_loss: 1.3027, test_loss: 1.3145, test_f1: 0.2270
 epoch: 31, train_loss: 1.3020, test_loss: 1.3156, test_f1: 0.2270
 epoch: 32, train_loss: 1.3030, test_loss: 1.3141, test_f1: 0.2270
 epoch: 33, train_loss: 1.3024, test_loss: 1.3151, test_f1: 0.2270
 epoch: 34, train_loss: 1.3024, test_loss: 1.3148, test_f1: 0.2270
 epoch: 35, train_loss: 1.3028, test_loss: 1.3137, test_f1: 0.2270
 epoch: 36, train_loss: 1.3053, test_loss: 1.3161, test_f1: 0.2270
 epoch: 37, train_loss: 1.3042, test_loss: 1.3156, test_f1: 0.2270
 epoch: 38, train_loss: 1.3015, test_loss: 1.3158, test_f1: 0.2270
 epoch: 39, train_loss: 1.3025, test_loss: 1.3150, test_f1: 0.2270
 epoch: 40, train_loss: 1.3020, test_loss: 1.3162, test_f1: 0.2270
 epoch: 41, train_loss: 1.3022, test_loss: 1.3154, test_f1: 0.2270
 epoch: 42, train_loss: 1.3025, test_loss: 1.3159, test_f1: 0.2270
 epoch: 43, train_loss: 1.3021, test_loss: 1.3158, test_f1: 0.2270
 epoch: 44, train_loss: 1.3016, test_loss: 1.3157, test_f1: 0.2270
 epoch: 45, train_loss: 1.3020, test_loss: 1.3158, test_f1: 0.2270
 epoch: 46, train_loss: 1.3017, test_loss: 1.3148, test_f1: 0.2270
 epoch: 47, train_loss: 1.3025, test_loss: 1.3162, test_f1: 0.2270
 epoch: 48, train_loss: 1.3014, test_loss: 1.3151, test_f1: 0.2270
 epoch: 49, train_loss: 1.3023, test_loss: 1.3144, test_f1: 0.2270
 epoch: 50, train_loss: 1.3020, test_loss: 1.3159, test_f1: 0.2270
 epoch: 51, train_loss: 1.3015, test_loss: 1.3151, test_f1: 0.2270
 epoch: 52, train_loss: 1.3016, test_loss: 1.3146, test_f1: 0.2270
 epoch: 53, train_loss: 1.3020, test_loss: 1.3151, test_f1: 0.2270
 epoch: 54, train_loss: 1.3018, test_loss: 1.3154, test_f1: 0.2270
 epoch: 55, train_loss: 1.3017, test_loss: 1.3155, test_f1: 0.2270
 epoch: 56, train_loss: 1.3015, test_loss: 1.3148, test_f1: 0.2270
 epoch: 57, train_loss: 1.3018, test_loss: 1.3145, test_f1: 0.2270
 epoch: 58, train_loss: 1.3017, test_loss: 1.3156, test_f1: 0.2270
 epoch: 59, train_loss: 1.3014, test_loss: 1.3141, test_f1: 0.2270
 epoch: 60, train_loss: 1.3013, test_loss: 1.3150, test_f1: 0.2270
 epoch: 61, train_loss: 1.3022, test_loss: 1.3156, test_f1: 0.2270
 epoch: 62, train_loss: 1.3017, test_loss: 1.3147, test_f1: 0.2270
 epoch: 63, train_loss: 1.3020, test_loss: 1.3153, test_f1: 0.2270
 epoch: 64, train_loss: 1.3020, test_loss: 1.3160, test_f1: 0.2270
 epoch: 65, train_loss: 1.3015, test_loss: 1.3146, test_f1: 0.2270
 epoch: 66, train_loss: 1.3016, test_loss: 1.3146, test_f1: 0.2270
 epoch: 67, train_loss: 1.3016, test_loss: 1.3155, test_f1: 0.2270
 epoch: 68, train_loss: 1.3016, test_loss: 1.3151, test_f1: 0.2270
 epoch: 69, train_loss: 1.3014, test_loss: 1.3152, test_f1: 0.2270
 epoch: 70, train_loss: 1.3018, test_loss: 1.3143, test_f1: 0.2270
 epoch: 71, train_loss: 1.3022, test_loss: 1.3159, test_f1: 0.2270
 epoch: 72, train_loss: 1.3015, test_loss: 1.3145, test_f1: 0.2270
 epoch: 73, train_loss: 1.3015, test_loss: 1.3148, test_f1: 0.2270
 epoch: 74, train_loss: 1.3015, test_loss: 1.3153, test_f1: 0.2270
 epoch: 75, train_loss: 1.3017, test_loss: 1.3155, test_f1: 0.2270
 epoch: 76, train_loss: 1.3016, test_loss: 1.3148, test_f1: 0.2270
 epoch: 77, train_loss: 1.3015, test_loss: 1.3147, test_f1: 0.2270
 epoch: 78, train_loss: 1.3018, test_loss: 1.3145, test_f1: 0.2270
 epoch: 79, train_loss: 1.3012, test_loss: 1.3158, test_f1: 0.2270
 epoch: 80, train_loss: 1.3017, test_loss: 1.3158, test_f1: 0.2270
 epoch: 81, train_loss: 1.3016, test_loss: 1.3144, test_f1: 0.2270
 epoch: 82, train_loss: 1.3016, test_loss: 1.3156, test_f1: 0.2270
 epoch: 83, train_loss: 1.3018, test_loss: 1.3143, test_f1: 0.2270
 epoch: 84, train_loss: 1.3015, test_loss: 1.3155, test_f1: 0.2270
 epoch: 85, train_loss: 1.3016, test_loss: 1.3163, test_f1: 0.2270
 epoch: 86, train_loss: 1.3018, test_loss: 1.3149, test_f1: 0.2270
 epoch: 87, train_loss: 1.3015, test_loss: 1.3156, test_f1: 0.2270
 epoch: 88, train_loss: 1.3019, test_loss: 1.3148, test_f1: 0.2270
 epoch: 89, train_loss: 1.3018, test_loss: 1.3155, test_f1: 0.2270
 epoch: 90, train_loss: 1.3016, test_loss: 1.3148, test_f1: 0.2270
 epoch: 91, train_loss: 1.3017, test_loss: 1.3147, test_f1: 0.2270
 epoch: 92, train_loss: 1.3013, test_loss: 1.3154, test_f1: 0.2270
 epoch: 93, train_loss: 1.3022, test_loss: 1.3157, test_f1: 0.2270
 epoch: 94, train_loss: 1.3020, test_loss: 1.3145, test_f1: 0.2270
 epoch: 95, train_loss: 1.3017, test_loss: 1.3155, test_f1: 0.2270
 epoch: 96, train_loss: 1.3020, test_loss: 1.3141, test_f1: 0.2270
 epoch: 97, train_loss: 1.3018, test_loss: 1.3161, test_f1: 0.2270
 epoch: 98, train_loss: 1.3015, test_loss: 1.3154, test_f1: 0.2270
 epoch: 99, train_loss: 1.3016, test_loss: 1.3149, test_f1: 0.2270
##################ITERATION #8 ****************************************
 epoch: 0, train_loss: 1.3047, test_loss: 1.3157, test_f1: 0.2270
 epoch: 1, train_loss: 1.3047, test_loss: 1.3145, test_f1: 0.2270
 epoch: 2, train_loss: 1.3021, test_loss: 1.3152, test_f1: 0.2270
 epoch: 3, train_loss: 1.3020, test_loss: 1.3147, test_f1: 0.2270
 epoch: 4, train_loss: 1.3029, test_loss: 1.3171, test_f1: 0.2270
 epoch: 5, train_loss: 1.3039, test_loss: 1.3143, test_f1: 0.2270
 epoch: 6, train_loss: 1.3030, test_loss: 1.3158, test_f1: 0.2270
 epoch: 7, train_loss: 1.3025, test_loss: 1.3152, test_f1: 0.2270
 epoch: 8, train_loss: 1.3020, test_loss: 1.3167, test_f1: 0.2270
 epoch: 9, train_loss: 1.3020, test_loss: 1.3147, test_f1: 0.2270
 epoch: 10, train_loss: 1.3030, test_loss: 1.3164, test_f1: 0.2270
 epoch: 11, train_loss: 1.3037, test_loss: 1.3140, test_f1: 0.2270
 epoch: 12, train_loss: 1.3023, test_loss: 1.3159, test_f1: 0.2270
 epoch: 13, train_loss: 1.3020, test_loss: 1.3159, test_f1: 0.2270
 epoch: 14, train_loss: 1.3016, test_loss: 1.3143, test_f1: 0.2270
 epoch: 15, train_loss: 1.3021, test_loss: 1.3157, test_f1: 0.2270
 epoch: 16, train_loss: 1.3031, test_loss: 1.3157, test_f1: 0.2270
 epoch: 17, train_loss: 1.3018, test_loss: 1.3156, test_f1: 0.2270
 epoch: 18, train_loss: 1.3025, test_loss: 1.3155, test_f1: 0.2270
 epoch: 19, train_loss: 1.3024, test_loss: 1.3154, test_f1: 0.2270
 epoch: 20, train_loss: 1.3027, test_loss: 1.3139, test_f1: 0.2270
 epoch: 21, train_loss: 1.3021, test_loss: 1.3155, test_f1: 0.2270
 epoch: 22, train_loss: 1.3025, test_loss: 1.3153, test_f1: 0.2270
 epoch: 23, train_loss: 1.3017, test_loss: 1.3156, test_f1: 0.2270
 epoch: 24, train_loss: 1.3019, test_loss: 1.3150, test_f1: 0.2270
 epoch: 25, train_loss: 1.3018, test_loss: 1.3158, test_f1: 0.2270
 epoch: 26, train_loss: 1.3020, test_loss: 1.3146, test_f1: 0.2270
 epoch: 27, train_loss: 1.3021, test_loss: 1.3156, test_f1: 0.2270
 epoch: 28, train_loss: 1.3023, test_loss: 1.3153, test_f1: 0.2270
 epoch: 29, train_loss: 1.3017, test_loss: 1.3156, test_f1: 0.2270
 epoch: 30, train_loss: 1.3017, test_loss: 1.3148, test_f1: 0.2270
 epoch: 31, train_loss: 1.3017, test_loss: 1.3155, test_f1: 0.2270
 epoch: 32, train_loss: 1.3018, test_loss: 1.3159, test_f1: 0.2270
 epoch: 33, train_loss: 1.3021, test_loss: 1.3142, test_f1: 0.2270
 epoch: 34, train_loss: 1.3020, test_loss: 1.3159, test_f1: 0.2270
 epoch: 35, train_loss: 1.3023, test_loss: 1.3148, test_f1: 0.2270
 epoch: 36, train_loss: 1.3021, test_loss: 1.3150, test_f1: 0.2270
 epoch: 37, train_loss: 1.3020, test_loss: 1.3159, test_f1: 0.2270
 epoch: 38, train_loss: 1.3021, test_loss: 1.3159, test_f1: 0.2270
 epoch: 39, train_loss: 1.3018, test_loss: 1.3153, test_f1: 0.2270
 epoch: 40, train_loss: 1.3019, test_loss: 1.3160, test_f1: 0.2270
 epoch: 41, train_loss: 1.3026, test_loss: 1.3147, test_f1: 0.2270
 epoch: 42, train_loss: 1.3020, test_loss: 1.3165, test_f1: 0.2270
 epoch: 43, train_loss: 1.3015, test_loss: 1.3140, test_f1: 0.2270
 epoch: 44, train_loss: 1.3023, test_loss: 1.3145, test_f1: 0.2270
 epoch: 45, train_loss: 1.3015, test_loss: 1.3164, test_f1: 0.2270
 epoch: 46, train_loss: 1.3031, test_loss: 1.3152, test_f1: 0.2270
 epoch: 47, train_loss: 1.3022, test_loss: 1.3153, test_f1: 0.2270
 epoch: 48, train_loss: 1.3021, test_loss: 1.3141, test_f1: 0.2270
 epoch: 49, train_loss: 1.3018, test_loss: 1.3162, test_f1: 0.2270
 epoch: 50, train_loss: 1.3019, test_loss: 1.3141, test_f1: 0.2270
 epoch: 51, train_loss: 1.3018, test_loss: 1.3147, test_f1: 0.2270
 epoch: 52, train_loss: 1.3016, test_loss: 1.3158, test_f1: 0.2270
 epoch: 53, train_loss: 1.3020, test_loss: 1.3148, test_f1: 0.2270
 epoch: 54, train_loss: 1.3012, test_loss: 1.3159, test_f1: 0.2270
 epoch: 55, train_loss: 1.3022, test_loss: 1.3148, test_f1: 0.2270
 epoch: 56, train_loss: 1.3022, test_loss: 1.3159, test_f1: 0.2270
 epoch: 57, train_loss: 1.3027, test_loss: 1.3151, test_f1: 0.2270
 epoch: 58, train_loss: 1.3018, test_loss: 1.3160, test_f1: 0.2270
 epoch: 59, train_loss: 1.3017, test_loss: 1.3150, test_f1: 0.2270
 epoch: 60, train_loss: 1.3018, test_loss: 1.3144, test_f1: 0.2270
 epoch: 61, train_loss: 1.3012, test_loss: 1.3153, test_f1: 0.2270
 epoch: 62, train_loss: 1.3014, test_loss: 1.3155, test_f1: 0.2270
 epoch: 63, train_loss: 1.3013, test_loss: 1.3149, test_f1: 0.2270
 epoch: 64, train_loss: 1.3019, test_loss: 1.3147, test_f1: 0.2270
 epoch: 65, train_loss: 1.3018, test_loss: 1.3152, test_f1: 0.2270
 epoch: 66, train_loss: 1.3018, test_loss: 1.3154, test_f1: 0.2270
 epoch: 67, train_loss: 1.3014, test_loss: 1.3150, test_f1: 0.2270
 epoch: 68, train_loss: 1.3017, test_loss: 1.3153, test_f1: 0.2270
 epoch: 69, train_loss: 1.3019, test_loss: 1.3150, test_f1: 0.2270
 epoch: 70, train_loss: 1.3015, test_loss: 1.3152, test_f1: 0.2270
 epoch: 71, train_loss: 1.3017, test_loss: 1.3152, test_f1: 0.2270
 epoch: 72, train_loss: 1.3018, test_loss: 1.3149, test_f1: 0.2270
 epoch: 73, train_loss: 1.3015, test_loss: 1.3143, test_f1: 0.2270
 epoch: 74, train_loss: 1.3021, test_loss: 1.3160, test_f1: 0.2270
 epoch: 75, train_loss: 1.3017, test_loss: 1.3145, test_f1: 0.2270
 epoch: 76, train_loss: 1.3018, test_loss: 1.3148, test_f1: 0.2270
 epoch: 77, train_loss: 1.3014, test_loss: 1.3159, test_f1: 0.2270
 epoch: 78, train_loss: 1.3014, test_loss: 1.3148, test_f1: 0.2270
 epoch: 79, train_loss: 1.3016, test_loss: 1.3148, test_f1: 0.2270
 epoch: 80, train_loss: 1.3017, test_loss: 1.3162, test_f1: 0.2270
 epoch: 81, train_loss: 1.3020, test_loss: 1.3141, test_f1: 0.2270
 epoch: 82, train_loss: 1.3015, test_loss: 1.3153, test_f1: 0.2270
 epoch: 83, train_loss: 1.3022, test_loss: 1.3146, test_f1: 0.2270
 epoch: 84, train_loss: 1.3019, test_loss: 1.3159, test_f1: 0.2270
 epoch: 85, train_loss: 1.3016, test_loss: 1.3147, test_f1: 0.2270
 epoch: 86, train_loss: 1.3024, test_loss: 1.3158, test_f1: 0.2270
 epoch: 87, train_loss: 1.3017, test_loss: 1.3149, test_f1: 0.2270
 epoch: 88, train_loss: 1.3017, test_loss: 1.3150, test_f1: 0.2270
 epoch: 89, train_loss: 1.3017, test_loss: 1.3150, test_f1: 0.2270
 epoch: 90, train_loss: 1.3017, test_loss: 1.3152, test_f1: 0.2270
 epoch: 91, train_loss: 1.3015, test_loss: 1.3151, test_f1: 0.2270
 epoch: 92, train_loss: 1.3016, test_loss: 1.3151, test_f1: 0.2270
 epoch: 93, train_loss: 1.3017, test_loss: 1.3146, test_f1: 0.2270
 epoch: 94, train_loss: 1.3017, test_loss: 1.3150, test_f1: 0.2270
 epoch: 95, train_loss: 1.3018, test_loss: 1.3166, test_f1: 0.2270
 epoch: 96, train_loss: 1.3014, test_loss: 1.3145, test_f1: 0.2270
 epoch: 97, train_loss: 1.3014, test_loss: 1.3152, test_f1: 0.2270
 epoch: 98, train_loss: 1.3019, test_loss: 1.3151, test_f1: 0.2270
 epoch: 99, train_loss: 1.3015, test_loss: 1.3141, test_f1: 0.2270
##################ITERATION #9 ****************************************
 epoch: 0, train_loss: 1.3036, test_loss: 1.3189, test_f1: 0.2270
 epoch: 1, train_loss: 1.2986, test_loss: 1.3199, test_f1: 0.2270
 epoch: 2, train_loss: 1.2904, test_loss: 1.3138, test_f1: 0.2270
 epoch: 3, train_loss: 1.3025, test_loss: 1.3148, test_f1: 0.2270
 epoch: 4, train_loss: 1.3024, test_loss: 1.3145, test_f1: 0.2270
 epoch: 5, train_loss: 1.3019, test_loss: 1.3154, test_f1: 0.2270
 epoch: 6, train_loss: 1.3022, test_loss: 1.3156, test_f1: 0.2270
 epoch: 7, train_loss: 1.3018, test_loss: 1.3141, test_f1: 0.2270
 epoch: 8, train_loss: 1.3018, test_loss: 1.3160, test_f1: 0.2270
 epoch: 9, train_loss: 1.3016, test_loss: 1.3144, test_f1: 0.2270
 epoch: 10, train_loss: 1.3027, test_loss: 1.3151, test_f1: 0.2270
 epoch: 11, train_loss: 1.3023, test_loss: 1.3163, test_f1: 0.2270
 epoch: 12, train_loss: 1.3018, test_loss: 1.3154, test_f1: 0.2270
 epoch: 13, train_loss: 1.3014, test_loss: 1.3155, test_f1: 0.2270
 epoch: 14, train_loss: 1.3018, test_loss: 1.3152, test_f1: 0.2270
 epoch: 15, train_loss: 1.3018, test_loss: 1.3143, test_f1: 0.2270
 epoch: 16, train_loss: 1.3025, test_loss: 1.3152, test_f1: 0.2270
 epoch: 17, train_loss: 1.3026, test_loss: 1.3161, test_f1: 0.2270
 epoch: 18, train_loss: 1.3030, test_loss: 1.3143, test_f1: 0.2270
 epoch: 19, train_loss: 1.3055, test_loss: 1.3184, test_f1: 0.2270
 epoch: 20, train_loss: 1.3026, test_loss: 1.3153, test_f1: 0.2270
 epoch: 21, train_loss: 1.3017, test_loss: 1.3149, test_f1: 0.2270
 epoch: 22, train_loss: 1.3018, test_loss: 1.3163, test_f1: 0.2270
 epoch: 23, train_loss: 1.3026, test_loss: 1.3167, test_f1: 0.2270
 epoch: 24, train_loss: 1.3027, test_loss: 1.3160, test_f1: 0.2270
 epoch: 25, train_loss: 1.3017, test_loss: 1.3149, test_f1: 0.2270
 epoch: 26, train_loss: 1.3020, test_loss: 1.3149, test_f1: 0.2270
 epoch: 27, train_loss: 1.3019, test_loss: 1.3150, test_f1: 0.2270
 epoch: 28, train_loss: 1.3023, test_loss: 1.3161, test_f1: 0.2270
 epoch: 29, train_loss: 1.3029, test_loss: 1.3134, test_f1: 0.2270
 epoch: 30, train_loss: 1.3027, test_loss: 1.3158, test_f1: 0.2270
 epoch: 31, train_loss: 1.3020, test_loss: 1.3150, test_f1: 0.2270
 epoch: 32, train_loss: 1.3023, test_loss: 1.3145, test_f1: 0.2270
 epoch: 33, train_loss: 1.3029, test_loss: 1.3181, test_f1: 0.2270
 epoch: 34, train_loss: 1.3027, test_loss: 1.3142, test_f1: 0.2270
 epoch: 35, train_loss: 1.3025, test_loss: 1.3151, test_f1: 0.2270
 epoch: 36, train_loss: 1.3018, test_loss: 1.3147, test_f1: 0.2270
 epoch: 37, train_loss: 1.3019, test_loss: 1.3152, test_f1: 0.2270
 epoch: 38, train_loss: 1.3029, test_loss: 1.3146, test_f1: 0.2270
 epoch: 39, train_loss: 1.3018, test_loss: 1.3146, test_f1: 0.2270
 epoch: 40, train_loss: 1.3019, test_loss: 1.3154, test_f1: 0.2270
 epoch: 41, train_loss: 1.3025, test_loss: 1.3173, test_f1: 0.2270
 epoch: 42, train_loss: 1.3024, test_loss: 1.3143, test_f1: 0.2270
 epoch: 43, train_loss: 1.3020, test_loss: 1.3151, test_f1: 0.2270
 epoch: 44, train_loss: 1.3023, test_loss: 1.3145, test_f1: 0.2270
 epoch: 45, train_loss: 1.3027, test_loss: 1.3164, test_f1: 0.2270
 epoch: 46, train_loss: 1.3021, test_loss: 1.3162, test_f1: 0.2270
 epoch: 47, train_loss: 1.3019, test_loss: 1.3149, test_f1: 0.2270
 epoch: 48, train_loss: 1.3018, test_loss: 1.3154, test_f1: 0.2270
 epoch: 49, train_loss: 1.3019, test_loss: 1.3146, test_f1: 0.2270
 epoch: 50, train_loss: 1.3022, test_loss: 1.3155, test_f1: 0.2270
 epoch: 51, train_loss: 1.3013, test_loss: 1.3146, test_f1: 0.2270
 epoch: 52, train_loss: 1.3016, test_loss: 1.3151, test_f1: 0.2270
 epoch: 53, train_loss: 1.3017, test_loss: 1.3154, test_f1: 0.2270
 epoch: 54, train_loss: 1.3019, test_loss: 1.3145, test_f1: 0.2270
 epoch: 55, train_loss: 1.3024, test_loss: 1.3157, test_f1: 0.2270
 epoch: 56, train_loss: 1.3016, test_loss: 1.3142, test_f1: 0.2270
 epoch: 57, train_loss: 1.3020, test_loss: 1.3154, test_f1: 0.2270
 epoch: 58, train_loss: 1.3013, test_loss: 1.3150, test_f1: 0.2270
 epoch: 59, train_loss: 1.3016, test_loss: 1.3163, test_f1: 0.2270
 epoch: 60, train_loss: 1.3017, test_loss: 1.3144, test_f1: 0.2270
 epoch: 61, train_loss: 1.3016, test_loss: 1.3152, test_f1: 0.2270
 epoch: 62, train_loss: 1.3017, test_loss: 1.3154, test_f1: 0.2270
 epoch: 63, train_loss: 1.3016, test_loss: 1.3147, test_f1: 0.2270
 epoch: 64, train_loss: 1.3021, test_loss: 1.3144, test_f1: 0.2270
 epoch: 65, train_loss: 1.3014, test_loss: 1.3154, test_f1: 0.2270
 epoch: 66, train_loss: 1.3016, test_loss: 1.3151, test_f1: 0.2270
 epoch: 67, train_loss: 1.3018, test_loss: 1.3153, test_f1: 0.2270
 epoch: 68, train_loss: 1.3017, test_loss: 1.3156, test_f1: 0.2270
 epoch: 69, train_loss: 1.3017, test_loss: 1.3160, test_f1: 0.2270
 epoch: 70, train_loss: 1.3014, test_loss: 1.3141, test_f1: 0.2270
 epoch: 71, train_loss: 1.3019, test_loss: 1.3151, test_f1: 0.2270
 epoch: 72, train_loss: 1.3023, test_loss: 1.3159, test_f1: 0.2270
 epoch: 73, train_loss: 1.3014, test_loss: 1.3140, test_f1: 0.2270
 epoch: 74, train_loss: 1.3023, test_loss: 1.3154, test_f1: 0.2270
 epoch: 75, train_loss: 1.3016, test_loss: 1.3153, test_f1: 0.2270
 epoch: 76, train_loss: 1.3015, test_loss: 1.3144, test_f1: 0.2270
 epoch: 77, train_loss: 1.3018, test_loss: 1.3163, test_f1: 0.2270
 epoch: 78, train_loss: 1.3014, test_loss: 1.3152, test_f1: 0.2270
 epoch: 79, train_loss: 1.3015, test_loss: 1.3149, test_f1: 0.2270
 epoch: 80, train_loss: 1.3018, test_loss: 1.3151, test_f1: 0.2270
 epoch: 81, train_loss: 1.3020, test_loss: 1.3154, test_f1: 0.2270
 epoch: 82, train_loss: 1.3016, test_loss: 1.3157, test_f1: 0.2270
 epoch: 83, train_loss: 1.3015, test_loss: 1.3144, test_f1: 0.2270
 epoch: 84, train_loss: 1.3017, test_loss: 1.3159, test_f1: 0.2270
 epoch: 85, train_loss: 1.3019, test_loss: 1.3142, test_f1: 0.2270
 epoch: 86, train_loss: 1.3017, test_loss: 1.3158, test_f1: 0.2270
 epoch: 87, train_loss: 1.3016, test_loss: 1.3149, test_f1: 0.2270
 epoch: 88, train_loss: 1.3014, test_loss: 1.3151, test_f1: 0.2270
 epoch: 89, train_loss: 1.3019, test_loss: 1.3141, test_f1: 0.2270
 epoch: 90, train_loss: 1.3018, test_loss: 1.3157, test_f1: 0.2270
 epoch: 91, train_loss: 1.3018, test_loss: 1.3152, test_f1: 0.2270
 epoch: 92, train_loss: 1.3022, test_loss: 1.3160, test_f1: 0.2270
 epoch: 93, train_loss: 1.3015, test_loss: 1.3139, test_f1: 0.2270
 epoch: 94, train_loss: 1.3017, test_loss: 1.3149, test_f1: 0.2270
 epoch: 95, train_loss: 1.3015, test_loss: 1.3158, test_f1: 0.2270
 epoch: 96, train_loss: 1.3023, test_loss: 1.3146, test_f1: 0.2270
 epoch: 97, train_loss: 1.3019, test_loss: 1.3151, test_f1: 0.2270
 epoch: 98, train_loss: 1.3016, test_loss: 1.3148, test_f1: 0.2270
 epoch: 99, train_loss: 1.3016, test_loss: 1.3160, test_f1: 0.2270

Training completed in 395.56 seconds
Best F1: 0.5121 at epoch 96
Mean F1 across iterations: 0.2555  0.0855
========================FINAL RESULTS================================
FEGIN weighted F1: 0.5121  0.0855
python main.py --data ltspice_examples --representation component_pin_net --model FEGIN --layers 2 --hiddens 32 --batch_size 256 --lr 0.1 --emb_size 250 --epochs 100 --save_appendix component_pin_net_L2_H32_BS256_LR0.1_E250 --no_val
-----



STDERR:
  File "main.py", line 370, in <module>
    main()
  File "main.py", line 254, in main
    dataset = dataset_class(
  File "/home/philip/projects/ltspice_examples_code_repo/Circuit-Completion-Using-GNNs/component_classification_with_link_prediction_head/evaluation/FEGIN/kernel/circuit_datasets.py", line 15, in __init__
    self.data, self.slices = torch.load(self.processed_paths[0])
  File "/home/philip/.local/lib/python3.8/site-packages/torch/serialization.py", line 1040, in load
    warnings.warn(
  File "/usr/lib/python3.8/warnings.py", line 109, in _showwarnmsg
    sw(msg.message, msg.category, msg.filename, msg.lineno,
  File "main.py", line 47, in warn_with_traceback
    traceback.print_stack(file=log)
/home/philip/projects/ltspice_examples_code_repo/Circuit-Completion-Using-GNNs/component_classification_with_link_prediction_head/evaluation/FEGIN/kernel/circuit_datasets.py:15: FutureWarning: You are using `torch.load` with `weights_only=False` (the current default value), which uses the default pickle module implicitly. It is possible to construct malicious pickle data which will execute arbitrary code during unpickling (See https://github.com/pytorch/pytorch/blob/main/SECURITY.md#untrusted-models for more details). In a future release, the default value for `weights_only` will be flipped to `True`. This limits the functions that could be executed during unpickling. Arbitrary objects will no longer be allowed to be loaded via this mode unless they are explicitly allowlisted by the user via `torch.serialization.add_safe_globals`. We recommend you start setting `weights_only=True` for any use case where you don't have full control of the loaded file. Please open an issue on GitHub for any issues related to this experimental feature.
  self.data, self.slices = torch.load(self.processed_paths[0])
