STDOUT:
Results will be saved in /home/philip/projects/ltspice_examples_code_repo/Circuit-Completion-Using-GNNs/component_classification_with_link_prediction_head/evaluation/FEGIN/results/model_FEGIN_dataset_ltspice_demos
Command line input: python main.py --data ltspice_demos --representation component_component --model FEGIN --layers 5 --hiddens 32 --batch_size 64 --lr 0.01 --emb_size 250 --epochs 100 --save_appendix component_component_L5_H32_BS64_LR0.01_E250 --no_val
 is saved.
-----
ltspice_demos - FEGIN
Using 5 layers, 32 hidden units, h = 2
Loading component_component representation dataset
ENTERED
Training FEGIN on component_component representation
Train: 1565, Test: 383
##################ITERATION #0 ****************************************
 epoch: 0, train_loss: 1.2570, test_loss: 1.3550, test_f1: 0.2597
 epoch: 1, train_loss: 1.1861, test_loss: 1.2493, test_f1: 0.2840
 epoch: 2, train_loss: 1.1393, test_loss: 1.1993, test_f1: 0.4367
 epoch: 3, train_loss: 1.1147, test_loss: 1.2036, test_f1: 0.3405
 epoch: 4, train_loss: 1.0889, test_loss: 1.2940, test_f1: 0.3300
 epoch: 5, train_loss: 1.0631, test_loss: 1.4602, test_f1: 0.4675
 epoch: 6, train_loss: 1.0265, test_loss: 1.2309, test_f1: 0.4727
 epoch: 7, train_loss: 1.0269, test_loss: 1.2739, test_f1: 0.3680
 epoch: 8, train_loss: 0.9896, test_loss: 1.2354, test_f1: 0.4776
 epoch: 9, train_loss: 0.9750, test_loss: 1.0972, test_f1: 0.4869
 epoch: 10, train_loss: 0.9339, test_loss: 0.9878, test_f1: 0.5238
 epoch: 11, train_loss: 0.8920, test_loss: 0.9800, test_f1: 0.5435
 epoch: 12, train_loss: 0.8908, test_loss: 1.0415, test_f1: 0.5159
 epoch: 13, train_loss: 0.8906, test_loss: 1.0748, test_f1: 0.5261
 epoch: 14, train_loss: 0.8942, test_loss: 1.2368, test_f1: 0.4391
 epoch: 15, train_loss: 0.8951, test_loss: 1.1691, test_f1: 0.4922
 epoch: 16, train_loss: 0.8731, test_loss: 1.3487, test_f1: 0.4961
 epoch: 17, train_loss: 0.8756, test_loss: 1.0212, test_f1: 0.5628
 epoch: 18, train_loss: 0.8731, test_loss: 1.2373, test_f1: 0.5174
 epoch: 19, train_loss: 0.8563, test_loss: 1.1387, test_f1: 0.5096
 epoch: 20, train_loss: 0.8364, test_loss: 1.1136, test_f1: 0.4947
 epoch: 21, train_loss: 0.8435, test_loss: 0.9880, test_f1: 0.5155
 epoch: 22, train_loss: 0.8020, test_loss: 1.0410, test_f1: 0.5232
 epoch: 23, train_loss: 0.8089, test_loss: 0.9631, test_f1: 0.5535
 epoch: 24, train_loss: 0.8128, test_loss: 0.9772, test_f1: 0.5470
 epoch: 25, train_loss: 0.8207, test_loss: 0.9760, test_f1: 0.5508
 epoch: 26, train_loss: 0.8055, test_loss: 0.9415, test_f1: 0.6109
 epoch: 27, train_loss: 0.7949, test_loss: 0.9305, test_f1: 0.6043
 epoch: 28, train_loss: 0.7771, test_loss: 0.9515, test_f1: 0.5659
 epoch: 29, train_loss: 0.7834, test_loss: 0.9906, test_f1: 0.6031
 epoch: 30, train_loss: 0.7800, test_loss: 1.0359, test_f1: 0.5605
 epoch: 31, train_loss: 0.7675, test_loss: 1.0612, test_f1: 0.5188
 epoch: 32, train_loss: 0.7508, test_loss: 1.0626, test_f1: 0.5169
 epoch: 33, train_loss: 0.7772, test_loss: 1.1468, test_f1: 0.5834
 epoch: 34, train_loss: 0.7594, test_loss: 1.2098, test_f1: 0.5675
 epoch: 35, train_loss: 0.7495, test_loss: 1.1618, test_f1: 0.5167
 epoch: 36, train_loss: 0.7392, test_loss: 1.1269, test_f1: 0.5578
 epoch: 37, train_loss: 0.7547, test_loss: 1.1292, test_f1: 0.5645
 epoch: 38, train_loss: 0.7407, test_loss: 1.1702, test_f1: 0.5536
 epoch: 39, train_loss: 0.7617, test_loss: 1.5683, test_f1: 0.5285
 epoch: 40, train_loss: 0.7350, test_loss: 1.2850, test_f1: 0.4909
 epoch: 41, train_loss: 0.7398, test_loss: 1.2999, test_f1: 0.5550
 epoch: 42, train_loss: 0.7548, test_loss: 1.3241, test_f1: 0.5314
 epoch: 43, train_loss: 0.7329, test_loss: 1.4247, test_f1: 0.5014
 epoch: 44, train_loss: 0.7308, test_loss: 1.1697, test_f1: 0.5327
 epoch: 45, train_loss: 0.7124, test_loss: 1.3056, test_f1: 0.5075
 epoch: 46, train_loss: 0.7126, test_loss: 1.0930, test_f1: 0.5307
 epoch: 47, train_loss: 0.7157, test_loss: 1.0922, test_f1: 0.5813
 epoch: 48, train_loss: 0.7105, test_loss: 1.1475, test_f1: 0.5364
 epoch: 49, train_loss: 0.7113, test_loss: 1.2053, test_f1: 0.4845
 epoch: 50, train_loss: 0.7146, test_loss: 1.3186, test_f1: 0.5082
 epoch: 51, train_loss: 0.6885, test_loss: 1.1640, test_f1: 0.5681
 epoch: 52, train_loss: 0.6487, test_loss: 1.2202, test_f1: 0.5575
 epoch: 53, train_loss: 0.6480, test_loss: 1.1682, test_f1: 0.5183
 epoch: 54, train_loss: 0.6277, test_loss: 1.2196, test_f1: 0.5619
 epoch: 55, train_loss: 0.6285, test_loss: 1.2280, test_f1: 0.5515
 epoch: 56, train_loss: 0.6023, test_loss: 1.4086, test_f1: 0.5306
 epoch: 57, train_loss: 0.6346, test_loss: 1.4461, test_f1: 0.5342
 epoch: 58, train_loss: 0.5988, test_loss: 1.6490, test_f1: 0.5365
 epoch: 59, train_loss: 0.5784, test_loss: 1.5836, test_f1: 0.5456
 epoch: 60, train_loss: 0.6067, test_loss: 1.6006, test_f1: 0.5518
 epoch: 61, train_loss: 0.6176, test_loss: 1.8698, test_f1: 0.5686
 epoch: 62, train_loss: 0.6003, test_loss: 1.7053, test_f1: 0.5379
 epoch: 63, train_loss: 0.5783, test_loss: 1.5069, test_f1: 0.4946
 epoch: 64, train_loss: 0.5947, test_loss: 1.6366, test_f1: 0.5302
 epoch: 65, train_loss: 0.5810, test_loss: 1.5129, test_f1: 0.4952
 epoch: 66, train_loss: 0.5696, test_loss: 1.8563, test_f1: 0.5727
 epoch: 67, train_loss: 0.5882, test_loss: 1.6811, test_f1: 0.5657
 epoch: 68, train_loss: 0.5593, test_loss: 1.3696, test_f1: 0.5219
 epoch: 69, train_loss: 0.5862, test_loss: 1.4690, test_f1: 0.5697
 epoch: 70, train_loss: 0.5603, test_loss: 1.5603, test_f1: 0.5575
 epoch: 71, train_loss: 0.5420, test_loss: 1.4442, test_f1: 0.5413
 epoch: 72, train_loss: 0.5586, test_loss: 1.6094, test_f1: 0.5426
 epoch: 73, train_loss: 0.5509, test_loss: 1.5600, test_f1: 0.4974
 epoch: 74, train_loss: 0.5256, test_loss: 1.3864, test_f1: 0.5324
 epoch: 75, train_loss: 0.5496, test_loss: 1.3330, test_f1: 0.5930
 epoch: 76, train_loss: 0.5507, test_loss: 1.6175, test_f1: 0.5425
 epoch: 77, train_loss: 0.5148, test_loss: 1.6395, test_f1: 0.5312
 epoch: 78, train_loss: 0.5212, test_loss: 1.7340, test_f1: 0.6001
 epoch: 79, train_loss: 0.5273, test_loss: 1.8104, test_f1: 0.5178
 epoch: 80, train_loss: 0.5513, test_loss: 1.6003, test_f1: 0.5254
 epoch: 81, train_loss: 0.5529, test_loss: 1.5511, test_f1: 0.5786
 epoch: 82, train_loss: 0.5140, test_loss: 1.8018, test_f1: 0.5823
 epoch: 83, train_loss: 0.5391, test_loss: 1.8049, test_f1: 0.5262
 epoch: 84, train_loss: 0.5480, test_loss: 1.6511, test_f1: 0.5840
 epoch: 85, train_loss: 0.5565, test_loss: 1.5342, test_f1: 0.5770
 epoch: 86, train_loss: 0.5418, test_loss: 1.4945, test_f1: 0.5359
 epoch: 87, train_loss: 0.4924, test_loss: 1.8538, test_f1: 0.5780
 epoch: 88, train_loss: 0.5409, test_loss: 1.3755, test_f1: 0.6211
 epoch: 89, train_loss: 0.5039, test_loss: 1.6272, test_f1: 0.5013
 epoch: 90, train_loss: 0.5305, test_loss: 1.6286, test_f1: 0.5414
 epoch: 91, train_loss: 0.5039, test_loss: 1.9525, test_f1: 0.5379
 epoch: 92, train_loss: 0.4923, test_loss: 1.6875, test_f1: 0.5797
 epoch: 93, train_loss: 0.4834, test_loss: 1.9528, test_f1: 0.5783
 epoch: 94, train_loss: 0.5169, test_loss: 2.0375, test_f1: 0.5578
 epoch: 95, train_loss: 0.5078, test_loss: 1.7062, test_f1: 0.5371
 epoch: 96, train_loss: 0.4869, test_loss: 2.0413, test_f1: 0.5495
 epoch: 97, train_loss: 0.5097, test_loss: 1.7997, test_f1: 0.5219
 epoch: 98, train_loss: 0.4908, test_loss: 1.8045, test_f1: 0.5717
 epoch: 99, train_loss: 0.4740, test_loss: 1.8912, test_f1: 0.5808
##################ITERATION #1 ****************************************
 epoch: 0, train_loss: 1.2667, test_loss: 1.2782, test_f1: 0.3237
 epoch: 1, train_loss: 1.1820, test_loss: 1.2195, test_f1: 0.3433
 epoch: 2, train_loss: 1.0921, test_loss: 1.1951, test_f1: 0.3843
 epoch: 3, train_loss: 1.0827, test_loss: 1.1100, test_f1: 0.4129
 epoch: 4, train_loss: 1.0209, test_loss: 1.0670, test_f1: 0.4236
 epoch: 5, train_loss: 0.9599, test_loss: 1.1593, test_f1: 0.5093
 epoch: 6, train_loss: 0.9621, test_loss: 1.1238, test_f1: 0.4033
 epoch: 7, train_loss: 0.9279, test_loss: 1.1265, test_f1: 0.5313
 epoch: 8, train_loss: 0.9447, test_loss: 1.0846, test_f1: 0.4527
 epoch: 9, train_loss: 0.9023, test_loss: 1.0670, test_f1: 0.4708
 epoch: 10, train_loss: 0.9179, test_loss: 1.1615, test_f1: 0.5281
 epoch: 11, train_loss: 0.9205, test_loss: 1.2103, test_f1: 0.4257
 epoch: 12, train_loss: 0.9114, test_loss: 1.2559, test_f1: 0.4463
 epoch: 13, train_loss: 0.8968, test_loss: 1.1170, test_f1: 0.4245
 epoch: 14, train_loss: 0.8758, test_loss: 1.0630, test_f1: 0.5453
 epoch: 15, train_loss: 0.8536, test_loss: 1.0714, test_f1: 0.5960
 epoch: 16, train_loss: 0.8738, test_loss: 1.1162, test_f1: 0.4373
 epoch: 17, train_loss: 0.8547, test_loss: 1.1762, test_f1: 0.4315
 epoch: 18, train_loss: 0.8736, test_loss: 1.0388, test_f1: 0.5449
 epoch: 19, train_loss: 0.8588, test_loss: 1.1038, test_f1: 0.4741
 epoch: 20, train_loss: 0.8394, test_loss: 1.1361, test_f1: 0.5380
 epoch: 21, train_loss: 0.8488, test_loss: 1.0446, test_f1: 0.5157
 epoch: 22, train_loss: 0.8451, test_loss: 1.1925, test_f1: 0.5247
 epoch: 23, train_loss: 0.8372, test_loss: 1.0626, test_f1: 0.5391
 epoch: 24, train_loss: 0.8667, test_loss: 1.2369, test_f1: 0.4451
 epoch: 25, train_loss: 0.8439, test_loss: 1.0795, test_f1: 0.5591
 epoch: 26, train_loss: 0.8069, test_loss: 1.0653, test_f1: 0.5712
 epoch: 27, train_loss: 0.8223, test_loss: 1.1405, test_f1: 0.5578
 epoch: 28, train_loss: 0.8299, test_loss: 1.1813, test_f1: 0.5441
 epoch: 29, train_loss: 0.8064, test_loss: 1.1981, test_f1: 0.5912
 epoch: 30, train_loss: 0.8115, test_loss: 1.0857, test_f1: 0.5743
 epoch: 31, train_loss: 0.7906, test_loss: 1.1397, test_f1: 0.5385
 epoch: 32, train_loss: 0.7919, test_loss: 1.1858, test_f1: 0.5708
 epoch: 33, train_loss: 0.7905, test_loss: 1.3869, test_f1: 0.4596
 epoch: 34, train_loss: 0.7791, test_loss: 1.0440, test_f1: 0.6002
 epoch: 35, train_loss: 0.7699, test_loss: 1.1488, test_f1: 0.5773
 epoch: 36, train_loss: 0.8241, test_loss: 1.2330, test_f1: 0.5360
 epoch: 37, train_loss: 0.8175, test_loss: 1.2124, test_f1: 0.4969
 epoch: 38, train_loss: 0.7847, test_loss: 1.2133, test_f1: 0.5053
 epoch: 39, train_loss: 0.7695, test_loss: 1.2656, test_f1: 0.5599
 epoch: 40, train_loss: 0.7501, test_loss: 1.1400, test_f1: 0.5659
 epoch: 41, train_loss: 0.7478, test_loss: 1.7112, test_f1: 0.4463
 epoch: 42, train_loss: 0.7487, test_loss: 1.1386, test_f1: 0.5312
 epoch: 43, train_loss: 0.7425, test_loss: 1.2993, test_f1: 0.5286
 epoch: 44, train_loss: 0.7252, test_loss: 1.1930, test_f1: 0.5257
 epoch: 45, train_loss: 0.7759, test_loss: 1.3316, test_f1: 0.4809
 epoch: 46, train_loss: 0.7821, test_loss: 1.3699, test_f1: 0.4078
 epoch: 47, train_loss: 0.7398, test_loss: 1.2550, test_f1: 0.5683
 epoch: 48, train_loss: 0.7281, test_loss: 1.3414, test_f1: 0.5880
 epoch: 49, train_loss: 0.6926, test_loss: 2.2322, test_f1: 0.5416
 epoch: 50, train_loss: 0.7227, test_loss: 1.7193, test_f1: 0.4700
 epoch: 51, train_loss: 0.7062, test_loss: 1.3712, test_f1: 0.5566
 epoch: 52, train_loss: 0.6753, test_loss: 1.4310, test_f1: 0.5537
 epoch: 53, train_loss: 0.6768, test_loss: 1.4214, test_f1: 0.5884
 epoch: 54, train_loss: 0.6925, test_loss: 1.1876, test_f1: 0.5733
 epoch: 55, train_loss: 0.6510, test_loss: 1.3574, test_f1: 0.5864
 epoch: 56, train_loss: 0.6355, test_loss: 1.6455, test_f1: 0.5504
 epoch: 57, train_loss: 0.6386, test_loss: 1.4965, test_f1: 0.5880
 epoch: 58, train_loss: 0.6461, test_loss: 1.2345, test_f1: 0.5579
 epoch: 59, train_loss: 0.6307, test_loss: 1.4725, test_f1: 0.5970
 epoch: 60, train_loss: 0.6326, test_loss: 1.4936, test_f1: 0.5829
 epoch: 61, train_loss: 0.6213, test_loss: 1.3715, test_f1: 0.5701
 epoch: 62, train_loss: 0.6279, test_loss: 1.2914, test_f1: 0.5893
 epoch: 63, train_loss: 0.5903, test_loss: 1.3570, test_f1: 0.5659
 epoch: 64, train_loss: 0.5979, test_loss: 1.5783, test_f1: 0.5650
 epoch: 65, train_loss: 0.6202, test_loss: 1.6074, test_f1: 0.4933
 epoch: 66, train_loss: 0.5950, test_loss: 1.3549, test_f1: 0.6048
 epoch: 67, train_loss: 0.6169, test_loss: 1.6092, test_f1: 0.5779
 epoch: 68, train_loss: 0.6025, test_loss: 1.6175, test_f1: 0.5627
 epoch: 69, train_loss: 0.6014, test_loss: 2.1317, test_f1: 0.5292
 epoch: 70, train_loss: 0.6066, test_loss: 1.4862, test_f1: 0.5575
 epoch: 71, train_loss: 0.5835, test_loss: 1.5867, test_f1: 0.5819
 epoch: 72, train_loss: 0.5907, test_loss: 1.6088, test_f1: 0.5439
 epoch: 73, train_loss: 0.5712, test_loss: 1.4888, test_f1: 0.5369
 epoch: 74, train_loss: 0.5804, test_loss: 1.4684, test_f1: 0.5592
 epoch: 75, train_loss: 0.5783, test_loss: 1.5392, test_f1: 0.5583
 epoch: 76, train_loss: 0.5779, test_loss: 1.4290, test_f1: 0.5322
 epoch: 77, train_loss: 0.5953, test_loss: 1.7492, test_f1: 0.4925
 epoch: 78, train_loss: 0.5638, test_loss: 1.4484, test_f1: 0.5718
 epoch: 79, train_loss: 0.5465, test_loss: 1.8238, test_f1: 0.5329
 epoch: 80, train_loss: 0.5439, test_loss: 1.5693, test_f1: 0.5768
 epoch: 81, train_loss: 0.5886, test_loss: 1.8763, test_f1: 0.5432
 epoch: 82, train_loss: 0.5935, test_loss: 1.4498, test_f1: 0.5763
 epoch: 83, train_loss: 0.5774, test_loss: 1.4997, test_f1: 0.5551
 epoch: 84, train_loss: 0.5690, test_loss: 1.6888, test_f1: 0.5564
 epoch: 85, train_loss: 0.5674, test_loss: 1.3734, test_f1: 0.5616
 epoch: 86, train_loss: 0.5598, test_loss: 1.5056, test_f1: 0.5977
 epoch: 87, train_loss: 0.5507, test_loss: 1.6332, test_f1: 0.5404
 epoch: 88, train_loss: 0.5125, test_loss: 1.7557, test_f1: 0.5464
 epoch: 89, train_loss: 0.5435, test_loss: 1.6320, test_f1: 0.5478
 epoch: 90, train_loss: 0.5293, test_loss: 1.5792, test_f1: 0.5519
 epoch: 91, train_loss: 0.5606, test_loss: 1.6261, test_f1: 0.5337
 epoch: 92, train_loss: 0.5271, test_loss: 1.5352, test_f1: 0.5651
 epoch: 93, train_loss: 0.5428, test_loss: 1.6914, test_f1: 0.5539
 epoch: 94, train_loss: 0.5283, test_loss: 1.9050, test_f1: 0.5474
 epoch: 95, train_loss: 0.5382, test_loss: 2.2291, test_f1: 0.5222
 epoch: 96, train_loss: 0.5134, test_loss: 1.8301, test_f1: 0.5092
 epoch: 97, train_loss: 0.5213, test_loss: 2.1911, test_f1: 0.5624
 epoch: 98, train_loss: 0.5792, test_loss: 1.7843, test_f1: 0.5461
 epoch: 99, train_loss: 0.5414, test_loss: 2.1800, test_f1: 0.5210
##################ITERATION #2 ****************************************
 epoch: 0, train_loss: 1.3195, test_loss: 1.2874, test_f1: 0.2958
 epoch: 1, train_loss: 1.1817, test_loss: 1.2079, test_f1: 0.3456
 epoch: 2, train_loss: 1.0900, test_loss: 1.1905, test_f1: 0.4261
 epoch: 3, train_loss: 1.0558, test_loss: 1.3978, test_f1: 0.3408
 epoch: 4, train_loss: 1.0151, test_loss: 1.2439, test_f1: 0.3946
 epoch: 5, train_loss: 0.9417, test_loss: 1.1399, test_f1: 0.5057
 epoch: 6, train_loss: 0.9307, test_loss: 1.2121, test_f1: 0.4793
 epoch: 7, train_loss: 0.9249, test_loss: 1.0336, test_f1: 0.5493
 epoch: 8, train_loss: 0.8946, test_loss: 1.2554, test_f1: 0.4227
 epoch: 9, train_loss: 0.8852, test_loss: 1.2777, test_f1: 0.4770
 epoch: 10, train_loss: 0.8591, test_loss: 1.1531, test_f1: 0.5037
 epoch: 11, train_loss: 0.8372, test_loss: 1.1966, test_f1: 0.4636
 epoch: 12, train_loss: 0.8583, test_loss: 1.0749, test_f1: 0.5050
 epoch: 13, train_loss: 0.8373, test_loss: 1.0985, test_f1: 0.5451
 epoch: 14, train_loss: 0.8343, test_loss: 1.1230, test_f1: 0.5255
 epoch: 15, train_loss: 0.8282, test_loss: 1.0013, test_f1: 0.5449
 epoch: 16, train_loss: 0.8061, test_loss: 1.0440, test_f1: 0.5621
 epoch: 17, train_loss: 0.7812, test_loss: 1.2915, test_f1: 0.4811
 epoch: 18, train_loss: 0.8170, test_loss: 1.1491, test_f1: 0.4709
 epoch: 19, train_loss: 0.7752, test_loss: 1.0496, test_f1: 0.5460
 epoch: 20, train_loss: 0.7751, test_loss: 1.1554, test_f1: 0.4963
 epoch: 21, train_loss: 0.7786, test_loss: 1.0186, test_f1: 0.5863
 epoch: 22, train_loss: 0.7600, test_loss: 1.1415, test_f1: 0.5636
 epoch: 23, train_loss: 0.7484, test_loss: 1.5859, test_f1: 0.5293
 epoch: 24, train_loss: 0.7483, test_loss: 1.1185, test_f1: 0.4922
 epoch: 25, train_loss: 0.7415, test_loss: 1.1108, test_f1: 0.5163
 epoch: 26, train_loss: 0.7494, test_loss: 1.0964, test_f1: 0.5686
 epoch: 27, train_loss: 0.7240, test_loss: 1.2526, test_f1: 0.5524
 epoch: 28, train_loss: 0.7377, test_loss: 1.4319, test_f1: 0.4943
 epoch: 29, train_loss: 0.7207, test_loss: 1.2415, test_f1: 0.5224
 epoch: 30, train_loss: 0.7326, test_loss: 1.1350, test_f1: 0.5156
 epoch: 31, train_loss: 0.7380, test_loss: 1.2699, test_f1: 0.4602
 epoch: 32, train_loss: 0.7339, test_loss: 1.5922, test_f1: 0.5124
 epoch: 33, train_loss: 0.7218, test_loss: 1.1401, test_f1: 0.5473
 epoch: 34, train_loss: 0.7029, test_loss: 1.1143, test_f1: 0.5747
 epoch: 35, train_loss: 0.7171, test_loss: 1.1264, test_f1: 0.5608
 epoch: 36, train_loss: 0.6834, test_loss: 1.4201, test_f1: 0.5154
 epoch: 37, train_loss: 0.7069, test_loss: 1.1366, test_f1: 0.5907
 epoch: 38, train_loss: 0.7362, test_loss: 1.4369, test_f1: 0.5508
 epoch: 39, train_loss: 0.6911, test_loss: 1.9705, test_f1: 0.5114
 epoch: 40, train_loss: 0.7217, test_loss: 1.6203, test_f1: 0.5791
 epoch: 41, train_loss: 0.7596, test_loss: 1.1106, test_f1: 0.5875
 epoch: 42, train_loss: 0.7255, test_loss: 1.2334, test_f1: 0.5508
 epoch: 43, train_loss: 0.6650, test_loss: 1.6505, test_f1: 0.5577
 epoch: 44, train_loss: 0.6688, test_loss: 1.9818, test_f1: 0.5649
 epoch: 45, train_loss: 0.6796, test_loss: 1.7475, test_f1: 0.5587
 epoch: 46, train_loss: 0.6722, test_loss: 1.5385, test_f1: 0.5593
 epoch: 47, train_loss: 0.6987, test_loss: 1.3207, test_f1: 0.5418
 epoch: 48, train_loss: 0.6530, test_loss: 1.7617, test_f1: 0.5139
 epoch: 49, train_loss: 0.6904, test_loss: 2.4825, test_f1: 0.5336
 epoch: 50, train_loss: 0.6662, test_loss: 1.8705, test_f1: 0.5488
 epoch: 51, train_loss: 0.6203, test_loss: 2.2434, test_f1: 0.5245
 epoch: 52, train_loss: 0.6077, test_loss: 1.7611, test_f1: 0.5573
 epoch: 53, train_loss: 0.5921, test_loss: 1.8600, test_f1: 0.5838
 epoch: 54, train_loss: 0.5827, test_loss: 2.2471, test_f1: 0.5219
 epoch: 55, train_loss: 0.5696, test_loss: 1.9427, test_f1: 0.5733
 epoch: 56, train_loss: 0.5718, test_loss: 1.8801, test_f1: 0.5094
 epoch: 57, train_loss: 0.5684, test_loss: 1.9422, test_f1: 0.5663
 epoch: 58, train_loss: 0.5487, test_loss: 2.6904, test_f1: 0.4751
 epoch: 59, train_loss: 0.5897, test_loss: 1.6165, test_f1: 0.5871
 epoch: 60, train_loss: 0.5836, test_loss: 1.5016, test_f1: 0.5541
 epoch: 61, train_loss: 0.5681, test_loss: 2.0129, test_f1: 0.5405
 epoch: 62, train_loss: 0.5555, test_loss: 2.0521, test_f1: 0.5534
 epoch: 63, train_loss: 0.5462, test_loss: 2.2089, test_f1: 0.5578
 epoch: 64, train_loss: 0.5386, test_loss: 2.3475, test_f1: 0.5259
 epoch: 65, train_loss: 0.5236, test_loss: 2.6439, test_f1: 0.5546
 epoch: 66, train_loss: 0.5325, test_loss: 2.5168, test_f1: 0.5322
 epoch: 67, train_loss: 0.5733, test_loss: 2.4780, test_f1: 0.5411
 epoch: 68, train_loss: 0.5471, test_loss: 3.4719, test_f1: 0.5250
 epoch: 69, train_loss: 0.5558, test_loss: 1.9567, test_f1: 0.5822
 epoch: 70, train_loss: 0.5124, test_loss: 2.2971, test_f1: 0.5313
 epoch: 71, train_loss: 0.5355, test_loss: 2.5792, test_f1: 0.5477
 epoch: 72, train_loss: 0.5385, test_loss: 2.3800, test_f1: 0.5461
 epoch: 73, train_loss: 0.5151, test_loss: 1.9135, test_f1: 0.6124
 epoch: 74, train_loss: 0.5321, test_loss: 2.7143, test_f1: 0.5403
 epoch: 75, train_loss: 0.5179, test_loss: 1.9780, test_f1: 0.5866
 epoch: 76, train_loss: 0.5298, test_loss: 2.1857, test_f1: 0.5844
 epoch: 77, train_loss: 0.4854, test_loss: 2.5191, test_f1: 0.5401
 epoch: 78, train_loss: 0.5073, test_loss: 2.3653, test_f1: 0.5566
 epoch: 79, train_loss: 0.5224, test_loss: 2.5118, test_f1: 0.5212
 epoch: 80, train_loss: 0.5182, test_loss: 2.5147, test_f1: 0.5829
 epoch: 81, train_loss: 0.5231, test_loss: 3.7050, test_f1: 0.4864
 epoch: 82, train_loss: 0.5105, test_loss: 2.6777, test_f1: 0.5385
 epoch: 83, train_loss: 0.5091, test_loss: 2.5583, test_f1: 0.5950
 epoch: 84, train_loss: 0.5109, test_loss: 2.3948, test_f1: 0.6112
 epoch: 85, train_loss: 0.5072, test_loss: 2.2427, test_f1: 0.5218
 epoch: 86, train_loss: 0.5004, test_loss: 2.9759, test_f1: 0.5659
 epoch: 87, train_loss: 0.4854, test_loss: 2.7874, test_f1: 0.5829
 epoch: 88, train_loss: 0.4672, test_loss: 3.0295, test_f1: 0.5959
 epoch: 89, train_loss: 0.4991, test_loss: 2.2427, test_f1: 0.5932
 epoch: 90, train_loss: 0.4986, test_loss: 2.0733, test_f1: 0.6034
 epoch: 91, train_loss: 0.4968, test_loss: 3.8389, test_f1: 0.5739
 epoch: 92, train_loss: 0.5108, test_loss: 3.4274, test_f1: 0.5107
 epoch: 93, train_loss: 0.4681, test_loss: 2.5467, test_f1: 0.5966
 epoch: 94, train_loss: 0.5347, test_loss: 4.0977, test_f1: 0.5053
 epoch: 95, train_loss: 0.5205, test_loss: 3.3833, test_f1: 0.5202
 epoch: 96, train_loss: 0.5062, test_loss: 2.1505, test_f1: 0.5787
 epoch: 97, train_loss: 0.4754, test_loss: 2.2912, test_f1: 0.5745
 epoch: 98, train_loss: 0.4725, test_loss: 1.7798, test_f1: 0.6352
 epoch: 99, train_loss: 0.4756, test_loss: 2.1770, test_f1: 0.5998
##################ITERATION #3 ****************************************
 epoch: 0, train_loss: 1.3187, test_loss: 1.3212, test_f1: 0.2551
 epoch: 1, train_loss: 1.1877, test_loss: 1.2394, test_f1: 0.4243
 epoch: 2, train_loss: 1.1399, test_loss: 1.2053, test_f1: 0.4329
 epoch: 3, train_loss: 1.1131, test_loss: 1.2074, test_f1: 0.3207
 epoch: 4, train_loss: 1.0923, test_loss: 1.2105, test_f1: 0.4441
 epoch: 5, train_loss: 1.0593, test_loss: 1.1505, test_f1: 0.4431
 epoch: 6, train_loss: 1.0329, test_loss: 1.2183, test_f1: 0.4952
 epoch: 7, train_loss: 1.0271, test_loss: 1.2990, test_f1: 0.3592
 epoch: 8, train_loss: 0.9765, test_loss: 1.1563, test_f1: 0.5227
 epoch: 9, train_loss: 0.9608, test_loss: 1.0970, test_f1: 0.5198
 epoch: 10, train_loss: 0.9550, test_loss: 1.1616, test_f1: 0.4938
 epoch: 11, train_loss: 0.9765, test_loss: 1.0748, test_f1: 0.5290
 epoch: 12, train_loss: 0.9440, test_loss: 1.1713, test_f1: 0.4912
 epoch: 13, train_loss: 0.9087, test_loss: 1.1184, test_f1: 0.4359
 epoch: 14, train_loss: 0.9300, test_loss: 1.1673, test_f1: 0.5230
 epoch: 15, train_loss: 0.9269, test_loss: 1.2248, test_f1: 0.5340
 epoch: 16, train_loss: 0.9121, test_loss: 1.1178, test_f1: 0.4582
 epoch: 17, train_loss: 0.8757, test_loss: 1.1461, test_f1: 0.5533
 epoch: 18, train_loss: 0.8697, test_loss: 1.1838, test_f1: 0.5079
 epoch: 19, train_loss: 0.8616, test_loss: 1.0641, test_f1: 0.5682
 epoch: 20, train_loss: 0.8600, test_loss: 1.1405, test_f1: 0.5858
 epoch: 21, train_loss: 0.8518, test_loss: 1.3458, test_f1: 0.5722
 epoch: 22, train_loss: 0.8575, test_loss: 1.1082, test_f1: 0.5770
 epoch: 23, train_loss: 0.8461, test_loss: 1.0829, test_f1: 0.5992
 epoch: 24, train_loss: 0.8604, test_loss: 1.2547, test_f1: 0.6107
 epoch: 25, train_loss: 0.8483, test_loss: 1.3908, test_f1: 0.5283
 epoch: 26, train_loss: 0.8306, test_loss: 1.0987, test_f1: 0.5789
 epoch: 27, train_loss: 0.8341, test_loss: 1.1169, test_f1: 0.5844
 epoch: 28, train_loss: 0.8291, test_loss: 1.1233, test_f1: 0.5849
 epoch: 29, train_loss: 0.8155, test_loss: 1.1998, test_f1: 0.5808
 epoch: 30, train_loss: 0.8164, test_loss: 1.1974, test_f1: 0.6218
 epoch: 31, train_loss: 0.8013, test_loss: 1.0854, test_f1: 0.6151
 epoch: 32, train_loss: 0.8113, test_loss: 1.1338, test_f1: 0.5456
 epoch: 33, train_loss: 0.8038, test_loss: 1.3432, test_f1: 0.5375
 epoch: 34, train_loss: 0.8344, test_loss: 1.0666, test_f1: 0.6143
 epoch: 35, train_loss: 0.8049, test_loss: 1.0540, test_f1: 0.6260
 epoch: 36, train_loss: 0.8009, test_loss: 1.0657, test_f1: 0.6348
 epoch: 37, train_loss: 0.7994, test_loss: 1.0170, test_f1: 0.5871
 epoch: 38, train_loss: 0.7938, test_loss: 1.1710, test_f1: 0.5511
 epoch: 39, train_loss: 0.7709, test_loss: 1.2787, test_f1: 0.5935
 epoch: 40, train_loss: 0.7696, test_loss: 1.1083, test_f1: 0.5867
 epoch: 41, train_loss: 0.8100, test_loss: 1.0522, test_f1: 0.5740
 epoch: 42, train_loss: 0.7638, test_loss: 1.1698, test_f1: 0.5487
 epoch: 43, train_loss: 0.7745, test_loss: 1.2195, test_f1: 0.5967
 epoch: 44, train_loss: 0.7618, test_loss: 1.0503, test_f1: 0.6225
 epoch: 45, train_loss: 0.7721, test_loss: 1.2286, test_f1: 0.5159
 epoch: 46, train_loss: 0.7868, test_loss: 1.1078, test_f1: 0.6207
 epoch: 47, train_loss: 0.7651, test_loss: 1.0023, test_f1: 0.5960
 epoch: 48, train_loss: 0.7577, test_loss: 1.0308, test_f1: 0.6001
 epoch: 49, train_loss: 0.7603, test_loss: 1.1731, test_f1: 0.5565
 epoch: 50, train_loss: 0.7398, test_loss: 1.2969, test_f1: 0.5776
 epoch: 51, train_loss: 0.7296, test_loss: 1.1139, test_f1: 0.5899
 epoch: 52, train_loss: 0.7056, test_loss: 1.0848, test_f1: 0.6072
 epoch: 53, train_loss: 0.6860, test_loss: 1.0065, test_f1: 0.6124
 epoch: 54, train_loss: 0.6876, test_loss: 1.1240, test_f1: 0.6143
 epoch: 55, train_loss: 0.6965, test_loss: 1.1437, test_f1: 0.6322
 epoch: 56, train_loss: 0.6776, test_loss: 1.1785, test_f1: 0.6190
 epoch: 57, train_loss: 0.6991, test_loss: 1.2024, test_f1: 0.6039
 epoch: 58, train_loss: 0.6995, test_loss: 1.3260, test_f1: 0.5957
 epoch: 59, train_loss: 0.6796, test_loss: 1.0590, test_f1: 0.6428
 epoch: 60, train_loss: 0.6705, test_loss: 1.0617, test_f1: 0.6585
 epoch: 61, train_loss: 0.6605, test_loss: 1.1686, test_f1: 0.6289
 epoch: 62, train_loss: 0.6778, test_loss: 1.2758, test_f1: 0.6433
 epoch: 63, train_loss: 0.6515, test_loss: 1.1675, test_f1: 0.6476
 epoch: 64, train_loss: 0.6742, test_loss: 1.0759, test_f1: 0.6328
 epoch: 65, train_loss: 0.6672, test_loss: 1.0302, test_f1: 0.6468
 epoch: 66, train_loss: 0.6465, test_loss: 1.1272, test_f1: 0.5924
 epoch: 67, train_loss: 0.6729, test_loss: 1.1048, test_f1: 0.6126
 epoch: 68, train_loss: 0.6179, test_loss: 1.1201, test_f1: 0.6484
 epoch: 69, train_loss: 0.6327, test_loss: 1.1467, test_f1: 0.6217
 epoch: 70, train_loss: 0.6699, test_loss: 1.2209, test_f1: 0.6026
 epoch: 71, train_loss: 0.6510, test_loss: 1.2223, test_f1: 0.6206
 epoch: 72, train_loss: 0.6414, test_loss: 1.2875, test_f1: 0.6076
 epoch: 73, train_loss: 0.6226, test_loss: 1.5310, test_f1: 0.5988
 epoch: 74, train_loss: 0.6373, test_loss: 1.3327, test_f1: 0.6195
 epoch: 75, train_loss: 0.6259, test_loss: 1.3397, test_f1: 0.5894
 epoch: 76, train_loss: 0.5913, test_loss: 1.6962, test_f1: 0.6340
 epoch: 77, train_loss: 0.6317, test_loss: 1.5095, test_f1: 0.6294
 epoch: 78, train_loss: 0.6105, test_loss: 1.3402, test_f1: 0.6165
 epoch: 79, train_loss: 0.6105, test_loss: 1.2996, test_f1: 0.6294
 epoch: 80, train_loss: 0.5872, test_loss: 1.6564, test_f1: 0.5805
 epoch: 81, train_loss: 0.5874, test_loss: 1.4454, test_f1: 0.6228
 epoch: 82, train_loss: 0.6167, test_loss: 1.2664, test_f1: 0.6309
 epoch: 83, train_loss: 0.5967, test_loss: 1.2436, test_f1: 0.6149
 epoch: 84, train_loss: 0.5807, test_loss: 1.3456, test_f1: 0.6344
 epoch: 85, train_loss: 0.5996, test_loss: 1.5266, test_f1: 0.5887
 epoch: 86, train_loss: 0.5640, test_loss: 1.5201, test_f1: 0.6498
 epoch: 87, train_loss: 0.5842, test_loss: 1.9484, test_f1: 0.6415
 epoch: 88, train_loss: 0.5585, test_loss: 1.2228, test_f1: 0.6275
 epoch: 89, train_loss: 0.5788, test_loss: 1.5931, test_f1: 0.5972
 epoch: 90, train_loss: 0.5665, test_loss: 1.2331, test_f1: 0.6493
 epoch: 91, train_loss: 0.5521, test_loss: 1.5555, test_f1: 0.6311
 epoch: 92, train_loss: 0.5565, test_loss: 1.4989, test_f1: 0.6086
 epoch: 93, train_loss: 0.5426, test_loss: 1.4173, test_f1: 0.6403
 epoch: 94, train_loss: 0.5529, test_loss: 2.1584, test_f1: 0.6064
 epoch: 95, train_loss: 0.5655, test_loss: 1.7264, test_f1: 0.6353
 epoch: 96, train_loss: 0.5376, test_loss: 1.6337, test_f1: 0.6390
 epoch: 97, train_loss: 0.5780, test_loss: 1.9850, test_f1: 0.6198
 epoch: 98, train_loss: 0.5679, test_loss: 1.1544, test_f1: 0.6383
 epoch: 99, train_loss: 0.5583, test_loss: 1.6250, test_f1: 0.6309
##################ITERATION #4 ****************************************
 epoch: 0, train_loss: 1.3078, test_loss: 1.2250, test_f1: 0.4033
 epoch: 1, train_loss: 1.1408, test_loss: 1.2715, test_f1: 0.3368
 epoch: 2, train_loss: 1.0652, test_loss: 1.1567, test_f1: 0.5048
 epoch: 3, train_loss: 1.0170, test_loss: 1.2086, test_f1: 0.3889
 epoch: 4, train_loss: 1.0066, test_loss: 1.1332, test_f1: 0.5438
 epoch: 5, train_loss: 0.9619, test_loss: 1.1637, test_f1: 0.4871
 epoch: 6, train_loss: 0.9345, test_loss: 1.0182, test_f1: 0.5587
 epoch: 7, train_loss: 0.9253, test_loss: 1.0633, test_f1: 0.5221
 epoch: 8, train_loss: 0.9191, test_loss: 1.0062, test_f1: 0.5599
 epoch: 9, train_loss: 0.9007, test_loss: 1.0515, test_f1: 0.5301
 epoch: 10, train_loss: 0.9107, test_loss: 1.1155, test_f1: 0.5146
 epoch: 11, train_loss: 0.9061, test_loss: 1.0474, test_f1: 0.5501
 epoch: 12, train_loss: 0.8777, test_loss: 1.0558, test_f1: 0.5566
 epoch: 13, train_loss: 0.8666, test_loss: 0.9861, test_f1: 0.5733
 epoch: 14, train_loss: 0.8827, test_loss: 1.0610, test_f1: 0.5543
 epoch: 15, train_loss: 0.8784, test_loss: 1.0784, test_f1: 0.5301
 epoch: 16, train_loss: 0.8588, test_loss: 1.0895, test_f1: 0.4911
 epoch: 17, train_loss: 0.8377, test_loss: 0.9876, test_f1: 0.5319
 epoch: 18, train_loss: 0.8357, test_loss: 1.0195, test_f1: 0.5490
 epoch: 19, train_loss: 0.8249, test_loss: 1.0265, test_f1: 0.5734
 epoch: 20, train_loss: 0.8165, test_loss: 1.1874, test_f1: 0.5564
 epoch: 21, train_loss: 0.8175, test_loss: 1.0199, test_f1: 0.5278
 epoch: 22, train_loss: 0.8051, test_loss: 1.0832, test_f1: 0.5343
 epoch: 23, train_loss: 0.8203, test_loss: 1.2424, test_f1: 0.5227
 epoch: 24, train_loss: 0.8265, test_loss: 1.8011, test_f1: 0.4300
 epoch: 25, train_loss: 0.8117, test_loss: 0.9635, test_f1: 0.5984
 epoch: 26, train_loss: 0.7921, test_loss: 1.1149, test_f1: 0.5871
 epoch: 27, train_loss: 0.7749, test_loss: 1.0254, test_f1: 0.5890
 epoch: 28, train_loss: 0.8047, test_loss: 1.1438, test_f1: 0.5281
 epoch: 29, train_loss: 0.8427, test_loss: 1.2310, test_f1: 0.5611
 epoch: 30, train_loss: 0.8176, test_loss: 1.6782, test_f1: 0.4742
 epoch: 31, train_loss: 0.7775, test_loss: 1.1973, test_f1: 0.5536
 epoch: 32, train_loss: 0.7811, test_loss: 1.0495, test_f1: 0.5642
 epoch: 33, train_loss: 0.7741, test_loss: 1.0131, test_f1: 0.5897
 epoch: 34, train_loss: 0.7752, test_loss: 1.1388, test_f1: 0.5350
 epoch: 35, train_loss: 0.7602, test_loss: 1.1692, test_f1: 0.5680
 epoch: 36, train_loss: 0.7496, test_loss: 1.2526, test_f1: 0.5577
 epoch: 37, train_loss: 0.7651, test_loss: 1.1082, test_f1: 0.5881
 epoch: 38, train_loss: 0.7307, test_loss: 1.1004, test_f1: 0.5682
 epoch: 39, train_loss: 0.7376, test_loss: 1.2988, test_f1: 0.5162
 epoch: 40, train_loss: 0.7359, test_loss: 1.2108, test_f1: 0.6071
 epoch: 41, train_loss: 0.7150, test_loss: 1.6965, test_f1: 0.5219
 epoch: 42, train_loss: 0.7610, test_loss: 1.1849, test_f1: 0.5762
 epoch: 43, train_loss: 0.7354, test_loss: 1.1103, test_f1: 0.5705
 epoch: 44, train_loss: 0.7423, test_loss: 1.0925, test_f1: 0.5874
 epoch: 45, train_loss: 0.7495, test_loss: 1.1003, test_f1: 0.5363
 epoch: 46, train_loss: 0.7139, test_loss: 1.2328, test_f1: 0.6338
 epoch: 47, train_loss: 0.7211, test_loss: 1.0574, test_f1: 0.5757
 epoch: 48, train_loss: 0.7560, test_loss: 1.0321, test_f1: 0.6283
 epoch: 49, train_loss: 0.7223, test_loss: 1.4115, test_f1: 0.4743
 epoch: 50, train_loss: 0.7317, test_loss: 1.1319, test_f1: 0.5768
 epoch: 51, train_loss: 0.6989, test_loss: 1.1954, test_f1: 0.6224
 epoch: 52, train_loss: 0.6806, test_loss: 1.0758, test_f1: 0.6307
 epoch: 53, train_loss: 0.6521, test_loss: 1.2445, test_f1: 0.6030
 epoch: 54, train_loss: 0.6406, test_loss: 1.1515, test_f1: 0.6168
 epoch: 55, train_loss: 0.6482, test_loss: 1.2480, test_f1: 0.5690
 epoch: 56, train_loss: 0.6448, test_loss: 1.2391, test_f1: 0.5949
 epoch: 57, train_loss: 0.6075, test_loss: 1.3415, test_f1: 0.6218
 epoch: 58, train_loss: 0.6166, test_loss: 1.2701, test_f1: 0.6047
 epoch: 59, train_loss: 0.6132, test_loss: 1.2694, test_f1: 0.6115
 epoch: 60, train_loss: 0.6217, test_loss: 1.4033, test_f1: 0.5995
 epoch: 61, train_loss: 0.6352, test_loss: 1.2537, test_f1: 0.5982
 epoch: 62, train_loss: 0.6248, test_loss: 1.3802, test_f1: 0.6145
 epoch: 63, train_loss: 0.6262, test_loss: 1.2844, test_f1: 0.6006
 epoch: 64, train_loss: 0.6158, test_loss: 1.1143, test_f1: 0.6608
 epoch: 65, train_loss: 0.6183, test_loss: 1.2960, test_f1: 0.6077
 epoch: 66, train_loss: 0.6064, test_loss: 1.2639, test_f1: 0.6093
 epoch: 67, train_loss: 0.5836, test_loss: 1.3940, test_f1: 0.5133
 epoch: 68, train_loss: 0.5963, test_loss: 1.5184, test_f1: 0.6125
 epoch: 69, train_loss: 0.6436, test_loss: 1.6954, test_f1: 0.4990
 epoch: 70, train_loss: 0.6222, test_loss: 1.3833, test_f1: 0.5825
 epoch: 71, train_loss: 0.6219, test_loss: 1.1494, test_f1: 0.5939
 epoch: 72, train_loss: 0.6700, test_loss: 1.2096, test_f1: 0.5807
 epoch: 73, train_loss: 0.6652, test_loss: 1.4647, test_f1: 0.5444
 epoch: 74, train_loss: 0.6489, test_loss: 1.7835, test_f1: 0.5587
 epoch: 75, train_loss: 0.6298, test_loss: 1.5828, test_f1: 0.5169
 epoch: 76, train_loss: 0.6169, test_loss: 1.5290, test_f1: 0.5932
 epoch: 77, train_loss: 0.6183, test_loss: 1.3665, test_f1: 0.5434
 epoch: 78, train_loss: 0.6071, test_loss: 1.2195, test_f1: 0.5802
 epoch: 79, train_loss: 0.6057, test_loss: 1.3072, test_f1: 0.6196
 epoch: 80, train_loss: 0.5924, test_loss: 1.5583, test_f1: 0.5909
 epoch: 81, train_loss: 0.6042, test_loss: 1.4962, test_f1: 0.5698
 epoch: 82, train_loss: 0.6008, test_loss: 1.4853, test_f1: 0.5161
 epoch: 83, train_loss: 0.5953, test_loss: 1.5667, test_f1: 0.5626
 epoch: 84, train_loss: 0.5833, test_loss: 1.7204, test_f1: 0.5504
 epoch: 85, train_loss: 0.6004, test_loss: 1.2835, test_f1: 0.6249
 epoch: 86, train_loss: 0.5955, test_loss: 1.2344, test_f1: 0.5708
 epoch: 87, train_loss: 0.5715, test_loss: 1.5099, test_f1: 0.5416
 epoch: 88, train_loss: 0.5962, test_loss: 1.2905, test_f1: 0.6436
 epoch: 89, train_loss: 0.6006, test_loss: 1.3643, test_f1: 0.5748
 epoch: 90, train_loss: 0.6218, test_loss: 1.2801, test_f1: 0.5606
 epoch: 91, train_loss: 0.5691, test_loss: 1.5223, test_f1: 0.6016
 epoch: 92, train_loss: 0.5318, test_loss: 1.5250, test_f1: 0.5850
 epoch: 93, train_loss: 0.5638, test_loss: 1.4961, test_f1: 0.6004
 epoch: 94, train_loss: 0.5857, test_loss: 1.3287, test_f1: 0.6159
 epoch: 95, train_loss: 0.5934, test_loss: 1.9210, test_f1: 0.5417
 epoch: 96, train_loss: 0.5639, test_loss: 1.5039, test_f1: 0.5545
 epoch: 97, train_loss: 0.5446, test_loss: 1.4169, test_f1: 0.5939
 epoch: 98, train_loss: 0.5594, test_loss: 1.5000, test_f1: 0.5802
 epoch: 99, train_loss: 0.5568, test_loss: 1.5008, test_f1: 0.5523
##################ITERATION #5 ****************************************
 epoch: 0, train_loss: 1.3121, test_loss: 1.3208, test_f1: 0.2391
 epoch: 1, train_loss: 1.1865, test_loss: 1.2234, test_f1: 0.3959
 epoch: 2, train_loss: 1.1537, test_loss: 1.1632, test_f1: 0.4327
 epoch: 3, train_loss: 1.0863, test_loss: 1.2075, test_f1: 0.4108
 epoch: 4, train_loss: 1.0448, test_loss: 1.2242, test_f1: 0.3646
 epoch: 5, train_loss: 0.9955, test_loss: 1.1586, test_f1: 0.4927
 epoch: 6, train_loss: 0.9732, test_loss: 1.1030, test_f1: 0.4773
 epoch: 7, train_loss: 0.9583, test_loss: 1.1944, test_f1: 0.4208
 epoch: 8, train_loss: 0.9333, test_loss: 1.1436, test_f1: 0.3643
 epoch: 9, train_loss: 0.9334, test_loss: 1.3370, test_f1: 0.4925
 epoch: 10, train_loss: 0.9172, test_loss: 1.1426, test_f1: 0.4036
 epoch: 11, train_loss: 0.9110, test_loss: 1.0917, test_f1: 0.5570
 epoch: 12, train_loss: 0.8711, test_loss: 1.3505, test_f1: 0.4801
 epoch: 13, train_loss: 0.9249, test_loss: 1.0337, test_f1: 0.4444
 epoch: 14, train_loss: 0.9390, test_loss: 1.2289, test_f1: 0.4908
 epoch: 15, train_loss: 0.9078, test_loss: 1.0752, test_f1: 0.5474
 epoch: 16, train_loss: 0.9157, test_loss: 1.1283, test_f1: 0.5394
 epoch: 17, train_loss: 0.8757, test_loss: 1.6576, test_f1: 0.2939
 epoch: 18, train_loss: 0.8458, test_loss: 1.8541, test_f1: 0.4249
 epoch: 19, train_loss: 0.8613, test_loss: 1.3380, test_f1: 0.4395
 epoch: 20, train_loss: 0.8353, test_loss: 2.9400, test_f1: 0.2270
 epoch: 21, train_loss: 0.9713, test_loss: 1.2162, test_f1: 0.3738
 epoch: 22, train_loss: 0.8748, test_loss: 1.0248, test_f1: 0.5270
 epoch: 23, train_loss: 0.8447, test_loss: 1.1818, test_f1: 0.4165
 epoch: 24, train_loss: 0.8478, test_loss: 1.0653, test_f1: 0.5357
 epoch: 25, train_loss: 0.8278, test_loss: 1.0775, test_f1: 0.5608
 epoch: 26, train_loss: 0.8273, test_loss: 1.1540, test_f1: 0.5216
 epoch: 27, train_loss: 0.8000, test_loss: 1.1305, test_f1: 0.4667
 epoch: 28, train_loss: 0.8182, test_loss: 1.0597, test_f1: 0.5263
 epoch: 29, train_loss: 0.8386, test_loss: 0.9859, test_f1: 0.5450
 epoch: 30, train_loss: 0.8086, test_loss: 1.0445, test_f1: 0.5547
 epoch: 31, train_loss: 0.7922, test_loss: 1.1071, test_f1: 0.4407
 epoch: 32, train_loss: 0.7831, test_loss: 1.0143, test_f1: 0.5782
 epoch: 33, train_loss: 0.7793, test_loss: 0.9980, test_f1: 0.6044
 epoch: 34, train_loss: 0.8419, test_loss: 1.1622, test_f1: 0.4780
 epoch: 35, train_loss: 0.7899, test_loss: 1.0690, test_f1: 0.5635
 epoch: 36, train_loss: 0.7878, test_loss: 0.9611, test_f1: 0.5903
 epoch: 37, train_loss: 0.7793, test_loss: 1.0576, test_f1: 0.5561
 epoch: 38, train_loss: 0.7926, test_loss: 0.9867, test_f1: 0.5366
 epoch: 39, train_loss: 0.7701, test_loss: 1.1180, test_f1: 0.5141
 epoch: 40, train_loss: 0.7620, test_loss: 1.3275, test_f1: 0.4927
 epoch: 41, train_loss: 0.7653, test_loss: 0.9985, test_f1: 0.6149
 epoch: 42, train_loss: 0.7626, test_loss: 1.4832, test_f1: 0.4997
 epoch: 43, train_loss: 0.7472, test_loss: 1.2089, test_f1: 0.5302
 epoch: 44, train_loss: 0.7688, test_loss: 1.0409, test_f1: 0.5510
 epoch: 45, train_loss: 0.7480, test_loss: 1.1839, test_f1: 0.5629
 epoch: 46, train_loss: 0.7448, test_loss: 1.1158, test_f1: 0.5562
 epoch: 47, train_loss: 0.7600, test_loss: 1.2301, test_f1: 0.5693
 epoch: 48, train_loss: 0.7438, test_loss: 1.9858, test_f1: 0.5871
 epoch: 49, train_loss: 0.7714, test_loss: 1.1830, test_f1: 0.5393
 epoch: 50, train_loss: 0.7465, test_loss: 1.0401, test_f1: 0.6270
 epoch: 51, train_loss: 0.7242, test_loss: 1.0904, test_f1: 0.5788
 epoch: 52, train_loss: 0.7045, test_loss: 6.5046, test_f1: 0.5621
 epoch: 53, train_loss: 0.6960, test_loss: 1.1947, test_f1: 0.5874
 epoch: 54, train_loss: 0.7023, test_loss: 1.1625, test_f1: 0.5704
 epoch: 55, train_loss: 0.6943, test_loss: 1.1898, test_f1: 0.5295
 epoch: 56, train_loss: 0.6808, test_loss: 1.3307, test_f1: 0.4906
 epoch: 57, train_loss: 0.6836, test_loss: 1.2086, test_f1: 0.5719
 epoch: 58, train_loss: 0.6771, test_loss: 1.1354, test_f1: 0.6208
 epoch: 59, train_loss: 0.6808, test_loss: 1.2561, test_f1: 0.5665
 epoch: 60, train_loss: 0.6452, test_loss: 1.1327, test_f1: 0.6230
 epoch: 61, train_loss: 0.6722, test_loss: 1.3176, test_f1: 0.5474
 epoch: 62, train_loss: 0.6502, test_loss: 1.3425, test_f1: 0.5764
 epoch: 63, train_loss: 0.6618, test_loss: 1.2856, test_f1: 0.5867
 epoch: 64, train_loss: 0.6893, test_loss: 1.2465, test_f1: 0.5722
 epoch: 65, train_loss: 0.6571, test_loss: 1.4687, test_f1: 0.5226
 epoch: 66, train_loss: 0.6389, test_loss: 1.2530, test_f1: 0.5959
 epoch: 67, train_loss: 0.6198, test_loss: 1.3171, test_f1: 0.5676
 epoch: 68, train_loss: 0.6195, test_loss: 1.5349, test_f1: 0.5528
 epoch: 69, train_loss: 0.6419, test_loss: 1.3445, test_f1: 0.5693
 epoch: 70, train_loss: 0.6388, test_loss: 1.4167, test_f1: 0.5522
 epoch: 71, train_loss: 0.6374, test_loss: 1.3993, test_f1: 0.5874
 epoch: 72, train_loss: 0.6428, test_loss: 1.4510, test_f1: 0.5681
 epoch: 73, train_loss: 0.6215, test_loss: 1.3876, test_f1: 0.5535
 epoch: 74, train_loss: 0.6588, test_loss: 1.2818, test_f1: 0.5710
 epoch: 75, train_loss: 0.6372, test_loss: 1.4478, test_f1: 0.5689
 epoch: 76, train_loss: 0.6311, test_loss: 1.3397, test_f1: 0.5840
 epoch: 77, train_loss: 0.6199, test_loss: 1.3675, test_f1: 0.5649
 epoch: 78, train_loss: 0.6322, test_loss: 1.5982, test_f1: 0.5145
 epoch: 79, train_loss: 0.6447, test_loss: 1.2894, test_f1: 0.5551
 epoch: 80, train_loss: 0.6432, test_loss: 1.4005, test_f1: 0.5853
 epoch: 81, train_loss: 0.6248, test_loss: 1.3726, test_f1: 0.5596
 epoch: 82, train_loss: 0.6149, test_loss: 1.3363, test_f1: 0.5839
 epoch: 83, train_loss: 0.6059, test_loss: 1.4796, test_f1: 0.5348
 epoch: 84, train_loss: 0.6021, test_loss: 1.5375, test_f1: 0.5748
 epoch: 85, train_loss: 0.5948, test_loss: 1.4543, test_f1: 0.5583
 epoch: 86, train_loss: 0.7354, test_loss: 1.3373, test_f1: 0.5430
 epoch: 87, train_loss: 0.6830, test_loss: 1.2032, test_f1: 0.5824
 epoch: 88, train_loss: 0.6502, test_loss: 1.3239, test_f1: 0.6030
 epoch: 89, train_loss: 0.6219, test_loss: 1.2646, test_f1: 0.6044
 epoch: 90, train_loss: 0.6123, test_loss: 1.3577, test_f1: 0.5894
 epoch: 91, train_loss: 0.5796, test_loss: 1.3347, test_f1: 0.5629
 epoch: 92, train_loss: 0.5818, test_loss: 1.3660, test_f1: 0.5596
 epoch: 93, train_loss: 0.5903, test_loss: 1.4064, test_f1: 0.5708
 epoch: 94, train_loss: 0.5933, test_loss: 1.2865, test_f1: 0.5830
 epoch: 95, train_loss: 0.5911, test_loss: 1.5183, test_f1: 0.5550
 epoch: 96, train_loss: 0.5842, test_loss: 1.3814, test_f1: 0.5462
 epoch: 97, train_loss: 0.5787, test_loss: 1.3822, test_f1: 0.6018
 epoch: 98, train_loss: 0.6098, test_loss: 1.4612, test_f1: 0.5720
 epoch: 99, train_loss: 0.6305, test_loss: 1.4327, test_f1: 0.5463
##################ITERATION #6 ****************************************
 epoch: 0, train_loss: 1.2762, test_loss: 1.3771, test_f1: 0.3034
 epoch: 1, train_loss: 1.1527, test_loss: 1.2103, test_f1: 0.3892
 epoch: 2, train_loss: 1.1141, test_loss: 1.1780, test_f1: 0.3559
 epoch: 3, train_loss: 1.0706, test_loss: 1.1621, test_f1: 0.3603
 epoch: 4, train_loss: 1.0307, test_loss: 1.1348, test_f1: 0.4353
 epoch: 5, train_loss: 0.9825, test_loss: 1.0545, test_f1: 0.4292
 epoch: 6, train_loss: 0.9686, test_loss: 1.0606, test_f1: 0.5221
 epoch: 7, train_loss: 1.0022, test_loss: 1.0670, test_f1: 0.5183
 epoch: 8, train_loss: 0.9503, test_loss: 1.0625, test_f1: 0.4889
 epoch: 9, train_loss: 0.9364, test_loss: 1.0684, test_f1: 0.4623
 epoch: 10, train_loss: 0.9063, test_loss: 1.0155, test_f1: 0.4822
 epoch: 11, train_loss: 0.8896, test_loss: 1.0043, test_f1: 0.5342
 epoch: 12, train_loss: 0.8799, test_loss: 1.1525, test_f1: 0.5336
 epoch: 13, train_loss: 0.8934, test_loss: 1.0890, test_f1: 0.5288
 epoch: 14, train_loss: 0.9197, test_loss: 1.1114, test_f1: 0.4533
 epoch: 15, train_loss: 0.8963, test_loss: 0.9636, test_f1: 0.5760
 epoch: 16, train_loss: 0.8823, test_loss: 1.2842, test_f1: 0.5362
 epoch: 17, train_loss: 0.8933, test_loss: 1.2495, test_f1: 0.4345
 epoch: 18, train_loss: 0.8716, test_loss: 1.2059, test_f1: 0.5370
 epoch: 19, train_loss: 0.8561, test_loss: 1.0486, test_f1: 0.5461
 epoch: 20, train_loss: 0.8614, test_loss: 1.2293, test_f1: 0.5003
 epoch: 21, train_loss: 0.8763, test_loss: 1.0332, test_f1: 0.4843
 epoch: 22, train_loss: 0.8708, test_loss: 1.0025, test_f1: 0.5552
 epoch: 23, train_loss: 0.8498, test_loss: 0.9777, test_f1: 0.5418
 epoch: 24, train_loss: 0.8336, test_loss: 1.0527, test_f1: 0.4381
 epoch: 25, train_loss: 0.8460, test_loss: 0.9938, test_f1: 0.5369
 epoch: 26, train_loss: 0.8715, test_loss: 0.9933, test_f1: 0.5632
 epoch: 27, train_loss: 0.8476, test_loss: 1.0243, test_f1: 0.5426
 epoch: 28, train_loss: 0.8523, test_loss: 1.1556, test_f1: 0.4777
 epoch: 29, train_loss: 0.9203, test_loss: 1.0591, test_f1: 0.5429
 epoch: 30, train_loss: 0.8678, test_loss: 1.0060, test_f1: 0.4947
 epoch: 31, train_loss: 0.8839, test_loss: 1.1881, test_f1: 0.4984
 epoch: 32, train_loss: 0.8946, test_loss: 1.0302, test_f1: 0.5637
 epoch: 33, train_loss: 0.8615, test_loss: 1.0189, test_f1: 0.5598
 epoch: 34, train_loss: 0.8279, test_loss: 0.9833, test_f1: 0.5691
 epoch: 35, train_loss: 0.8191, test_loss: 0.9702, test_f1: 0.5808
 epoch: 36, train_loss: 0.8058, test_loss: 1.0861, test_f1: 0.4990
 epoch: 37, train_loss: 0.8274, test_loss: 1.1262, test_f1: 0.4991
 epoch: 38, train_loss: 0.8066, test_loss: 1.0455, test_f1: 0.5562
 epoch: 39, train_loss: 0.7969, test_loss: 1.0078, test_f1: 0.5364
 epoch: 40, train_loss: 0.7918, test_loss: 1.0873, test_f1: 0.4922
 epoch: 41, train_loss: 0.8449, test_loss: 1.0416, test_f1: 0.5488
 epoch: 42, train_loss: 0.8155, test_loss: 1.0284, test_f1: 0.5280
 epoch: 43, train_loss: 0.7763, test_loss: 1.0914, test_f1: 0.5244
 epoch: 44, train_loss: 0.7757, test_loss: 1.0853, test_f1: 0.5093
 epoch: 45, train_loss: 0.7778, test_loss: 0.9898, test_f1: 0.5752
 epoch: 46, train_loss: 0.7693, test_loss: 1.0030, test_f1: 0.5603
 epoch: 47, train_loss: 0.7635, test_loss: 1.0991, test_f1: 0.5364
 epoch: 48, train_loss: 0.7826, test_loss: 1.0486, test_f1: 0.5462
 epoch: 49, train_loss: 0.7643, test_loss: 1.0540, test_f1: 0.5138
 epoch: 50, train_loss: 0.7786, test_loss: 1.0312, test_f1: 0.5864
 epoch: 51, train_loss: 0.7581, test_loss: 1.2309, test_f1: 0.4380
 epoch: 52, train_loss: 0.7433, test_loss: 0.9909, test_f1: 0.5679
 epoch: 53, train_loss: 0.7268, test_loss: 1.0623, test_f1: 0.5366
 epoch: 54, train_loss: 0.7461, test_loss: 1.1035, test_f1: 0.5245
 epoch: 55, train_loss: 0.7159, test_loss: 1.0322, test_f1: 0.5600
 epoch: 56, train_loss: 0.7198, test_loss: 1.0570, test_f1: 0.5993
 epoch: 57, train_loss: 0.7280, test_loss: 1.2310, test_f1: 0.4867
 epoch: 58, train_loss: 0.7174, test_loss: 1.0359, test_f1: 0.5439
 epoch: 59, train_loss: 0.7091, test_loss: 1.3585, test_f1: 0.5515
 epoch: 60, train_loss: 0.7141, test_loss: 1.0673, test_f1: 0.5560
 epoch: 61, train_loss: 0.7190, test_loss: 1.0435, test_f1: 0.5870
 epoch: 62, train_loss: 0.6955, test_loss: 1.1588, test_f1: 0.5322
 epoch: 63, train_loss: 0.7349, test_loss: 1.0980, test_f1: 0.5779
 epoch: 64, train_loss: 0.7204, test_loss: 1.1035, test_f1: 0.5744
 epoch: 65, train_loss: 0.7058, test_loss: 1.1643, test_f1: 0.5836
 epoch: 66, train_loss: 0.6901, test_loss: 1.1048, test_f1: 0.5657
 epoch: 67, train_loss: 0.6860, test_loss: 1.2107, test_f1: 0.5521
 epoch: 68, train_loss: 0.7017, test_loss: 1.3240, test_f1: 0.5226
 epoch: 69, train_loss: 0.6854, test_loss: 1.0831, test_f1: 0.5870
 epoch: 70, train_loss: 0.6773, test_loss: 1.1971, test_f1: 0.5347
 epoch: 71, train_loss: 0.6819, test_loss: 1.1897, test_f1: 0.5658
 epoch: 72, train_loss: 0.6663, test_loss: 1.1963, test_f1: 0.5394
 epoch: 73, train_loss: 0.6647, test_loss: 1.2151, test_f1: 0.5762
 epoch: 74, train_loss: 0.6989, test_loss: 1.0972, test_f1: 0.6050
 epoch: 75, train_loss: 0.6818, test_loss: 1.8711, test_f1: 0.4863
 epoch: 76, train_loss: 0.6778, test_loss: 1.1189, test_f1: 0.5784
 epoch: 77, train_loss: 0.6629, test_loss: 1.3181, test_f1: 0.5796
 epoch: 78, train_loss: 0.6786, test_loss: 1.1626, test_f1: 0.5624
 epoch: 79, train_loss: 0.6619, test_loss: 1.1474, test_f1: 0.5892
 epoch: 80, train_loss: 0.6569, test_loss: 1.1582, test_f1: 0.5480
 epoch: 81, train_loss: 0.6440, test_loss: 1.3953, test_f1: 0.5210
 epoch: 82, train_loss: 0.6489, test_loss: 1.1606, test_f1: 0.5804
 epoch: 83, train_loss: 0.6608, test_loss: 1.8411, test_f1: 0.4734
 epoch: 84, train_loss: 0.6627, test_loss: 1.2154, test_f1: 0.5537
 epoch: 85, train_loss: 0.6567, test_loss: 1.5329, test_f1: 0.5018
 epoch: 86, train_loss: 0.6448, test_loss: 1.2434, test_f1: 0.5757
 epoch: 87, train_loss: 0.6522, test_loss: 1.2482, test_f1: 0.5489
 epoch: 88, train_loss: 0.6620, test_loss: 1.2414, test_f1: 0.5641
 epoch: 89, train_loss: 0.6382, test_loss: 1.2436, test_f1: 0.5811
 epoch: 90, train_loss: 0.6437, test_loss: 1.1990, test_f1: 0.5926
 epoch: 91, train_loss: 0.6752, test_loss: 1.3298, test_f1: 0.4939
 epoch: 92, train_loss: 0.8142, test_loss: 1.1277, test_f1: 0.5403
 epoch: 93, train_loss: 0.7124, test_loss: 1.0355, test_f1: 0.5967
 epoch: 94, train_loss: 0.6575, test_loss: 1.0314, test_f1: 0.6118
 epoch: 95, train_loss: 0.6447, test_loss: 1.1071, test_f1: 0.5932
 epoch: 96, train_loss: 0.6304, test_loss: 1.2402, test_f1: 0.5312
 epoch: 97, train_loss: 0.6331, test_loss: 1.3530, test_f1: 0.5115
 epoch: 98, train_loss: 0.6521, test_loss: 1.0808, test_f1: 0.6013
 epoch: 99, train_loss: 0.6598, test_loss: 1.0373, test_f1: 0.6156
##################ITERATION #7 ****************************************
 epoch: 0, train_loss: 1.3280, test_loss: 1.3154, test_f1: 0.3487
 epoch: 1, train_loss: 1.1829, test_loss: 1.2223, test_f1: 0.3421
 epoch: 2, train_loss: 1.1613, test_loss: 1.1912, test_f1: 0.4334
 epoch: 3, train_loss: 1.0991, test_loss: 1.2282, test_f1: 0.4019
 epoch: 4, train_loss: 1.0909, test_loss: 1.2926, test_f1: 0.4095
 epoch: 5, train_loss: 1.0508, test_loss: 1.0593, test_f1: 0.5895
 epoch: 6, train_loss: 0.9996, test_loss: 1.0627, test_f1: 0.5562
 epoch: 7, train_loss: 1.0071, test_loss: 1.1992, test_f1: 0.4471
 epoch: 8, train_loss: 0.9549, test_loss: 1.1701, test_f1: 0.4875
 epoch: 9, train_loss: 0.9544, test_loss: 1.0849, test_f1: 0.5649
 epoch: 10, train_loss: 0.9348, test_loss: 1.0945, test_f1: 0.5154
 epoch: 11, train_loss: 0.9264, test_loss: 1.0346, test_f1: 0.5288
 epoch: 12, train_loss: 0.8952, test_loss: 1.0508, test_f1: 0.5241
 epoch: 13, train_loss: 0.8921, test_loss: 1.0395, test_f1: 0.5410
 epoch: 14, train_loss: 0.8839, test_loss: 1.2806, test_f1: 0.4892
 epoch: 15, train_loss: 0.9299, test_loss: 1.1055, test_f1: 0.4482
 epoch: 16, train_loss: 0.9098, test_loss: 1.0648, test_f1: 0.5312
 epoch: 17, train_loss: 0.8996, test_loss: 1.0111, test_f1: 0.5424
 epoch: 18, train_loss: 0.8552, test_loss: 1.0011, test_f1: 0.5360
 epoch: 19, train_loss: 0.8518, test_loss: 1.0351, test_f1: 0.5268
 epoch: 20, train_loss: 0.8395, test_loss: 1.1793, test_f1: 0.5878
 epoch: 21, train_loss: 0.8329, test_loss: 1.3347, test_f1: 0.5272
 epoch: 22, train_loss: 0.8533, test_loss: 1.0345, test_f1: 0.5296
 epoch: 23, train_loss: 0.8433, test_loss: 1.0804, test_f1: 0.5315
 epoch: 24, train_loss: 0.8244, test_loss: 1.0497, test_f1: 0.5558
 epoch: 25, train_loss: 0.8291, test_loss: 1.0427, test_f1: 0.5301
 epoch: 26, train_loss: 0.7951, test_loss: 1.0754, test_f1: 0.5590
 epoch: 27, train_loss: 0.8077, test_loss: 1.1757, test_f1: 0.5208
 epoch: 28, train_loss: 0.8071, test_loss: 1.4311, test_f1: 0.4111
 epoch: 29, train_loss: 0.8097, test_loss: 1.1275, test_f1: 0.5375
 epoch: 30, train_loss: 0.8388, test_loss: 1.0213, test_f1: 0.5971
 epoch: 31, train_loss: 0.7952, test_loss: 1.0220, test_f1: 0.5640
 epoch: 32, train_loss: 0.7697, test_loss: 1.2280, test_f1: 0.5473
 epoch: 33, train_loss: 0.7831, test_loss: 1.0519, test_f1: 0.5927
 epoch: 34, train_loss: 0.7517, test_loss: 1.1183, test_f1: 0.5388
 epoch: 35, train_loss: 0.7581, test_loss: 1.0940, test_f1: 0.5801
 epoch: 36, train_loss: 0.7516, test_loss: 1.0929, test_f1: 0.5799
 epoch: 37, train_loss: 0.7378, test_loss: 1.3083, test_f1: 0.5579
 epoch: 38, train_loss: 0.7718, test_loss: 1.0817, test_f1: 0.5745
 epoch: 39, train_loss: 0.7455, test_loss: 1.2424, test_f1: 0.5854
 epoch: 40, train_loss: 0.7185, test_loss: 1.0261, test_f1: 0.6113
 epoch: 41, train_loss: 0.7522, test_loss: 1.3060, test_f1: 0.5403
 epoch: 42, train_loss: 0.7604, test_loss: 1.0390, test_f1: 0.5963
 epoch: 43, train_loss: 0.7289, test_loss: 1.2528, test_f1: 0.5371
 epoch: 44, train_loss: 0.7381, test_loss: 1.2423, test_f1: 0.5976
 epoch: 45, train_loss: 0.7192, test_loss: 1.1099, test_f1: 0.5750
 epoch: 46, train_loss: 0.7124, test_loss: 1.2979, test_f1: 0.5404
 epoch: 47, train_loss: 0.6975, test_loss: 1.2521, test_f1: 0.5229
 epoch: 48, train_loss: 0.6952, test_loss: 1.1512, test_f1: 0.5916
 epoch: 49, train_loss: 0.7091, test_loss: 1.3529, test_f1: 0.5475
 epoch: 50, train_loss: 0.6990, test_loss: 1.5557, test_f1: 0.5962
 epoch: 51, train_loss: 0.6868, test_loss: 1.2102, test_f1: 0.6006
 epoch: 52, train_loss: 0.6443, test_loss: 1.4096, test_f1: 0.5717
 epoch: 53, train_loss: 0.6488, test_loss: 1.7049, test_f1: 0.5670
 epoch: 54, train_loss: 0.6693, test_loss: 1.2039, test_f1: 0.5658
 epoch: 55, train_loss: 0.6393, test_loss: 1.2789, test_f1: 0.5708
 epoch: 56, train_loss: 0.6318, test_loss: 1.3730, test_f1: 0.5775
 epoch: 57, train_loss: 0.6320, test_loss: 1.3273, test_f1: 0.6009
 epoch: 58, train_loss: 0.6148, test_loss: 1.4309, test_f1: 0.5770
 epoch: 59, train_loss: 0.6236, test_loss: 1.6036, test_f1: 0.6159
 epoch: 60, train_loss: 0.6333, test_loss: 1.3519, test_f1: 0.5825
 epoch: 61, train_loss: 0.5994, test_loss: 1.4233, test_f1: 0.6077
 epoch: 62, train_loss: 0.6191, test_loss: 1.4950, test_f1: 0.5960
 epoch: 63, train_loss: 0.6090, test_loss: 1.4584, test_f1: 0.5753
 epoch: 64, train_loss: 0.5842, test_loss: 1.5504, test_f1: 0.5605
 epoch: 65, train_loss: 0.6010, test_loss: 1.4115, test_f1: 0.5951
 epoch: 66, train_loss: 0.5882, test_loss: 1.6151, test_f1: 0.5651
 epoch: 67, train_loss: 0.5853, test_loss: 1.5908, test_f1: 0.5811
 epoch: 68, train_loss: 0.6061, test_loss: 1.7330, test_f1: 0.5369
 epoch: 69, train_loss: 0.5959, test_loss: 1.4806, test_f1: 0.6040
 epoch: 70, train_loss: 0.5939, test_loss: 1.4235, test_f1: 0.6137
 epoch: 71, train_loss: 0.5927, test_loss: 1.4658, test_f1: 0.5857
 epoch: 72, train_loss: 0.6234, test_loss: 1.5145, test_f1: 0.5571
 epoch: 73, train_loss: 0.6256, test_loss: 1.3459, test_f1: 0.5805
 epoch: 74, train_loss: 0.5870, test_loss: 2.1306, test_f1: 0.5226
 epoch: 75, train_loss: 0.5877, test_loss: 1.5870, test_f1: 0.5935
 epoch: 76, train_loss: 0.5906, test_loss: 1.5578, test_f1: 0.5717
 epoch: 77, train_loss: 0.6048, test_loss: 1.3047, test_f1: 0.6024
 epoch: 78, train_loss: 0.5943, test_loss: 1.3169, test_f1: 0.5777
 epoch: 79, train_loss: 0.5739, test_loss: 1.5477, test_f1: 0.5957
 epoch: 80, train_loss: 0.5652, test_loss: 1.5171, test_f1: 0.5891
 epoch: 81, train_loss: 0.5470, test_loss: 1.5345, test_f1: 0.5857
 epoch: 82, train_loss: 0.5821, test_loss: 1.4852, test_f1: 0.5743
 epoch: 83, train_loss: 0.5759, test_loss: 1.5228, test_f1: 0.5700
 epoch: 84, train_loss: 0.5762, test_loss: 1.5274, test_f1: 0.6135
 epoch: 85, train_loss: 0.5773, test_loss: 1.4914, test_f1: 0.6185
 epoch: 86, train_loss: 0.5694, test_loss: 1.6816, test_f1: 0.5949
 epoch: 87, train_loss: 0.5779, test_loss: 1.4545, test_f1: 0.5845
 epoch: 88, train_loss: 0.5542, test_loss: 1.5320, test_f1: 0.6038
 epoch: 89, train_loss: 0.5812, test_loss: 1.5080, test_f1: 0.5885
 epoch: 90, train_loss: 0.5578, test_loss: 1.6159, test_f1: 0.6014
 epoch: 91, train_loss: 0.5699, test_loss: 1.5560, test_f1: 0.6026
 epoch: 92, train_loss: 0.5549, test_loss: 1.8179, test_f1: 0.5735
 epoch: 93, train_loss: 0.5745, test_loss: 1.7704, test_f1: 0.5507
 epoch: 94, train_loss: 0.5638, test_loss: 1.8836, test_f1: 0.5866
 epoch: 95, train_loss: 0.5159, test_loss: 1.6459, test_f1: 0.6077
 epoch: 96, train_loss: 0.5532, test_loss: 2.0338, test_f1: 0.5606
 epoch: 97, train_loss: 0.5697, test_loss: 2.3317, test_f1: 0.5164
 epoch: 98, train_loss: 0.5650, test_loss: 1.8251, test_f1: 0.5776
 epoch: 99, train_loss: 0.5423, test_loss: 1.9636, test_f1: 0.6367
##################ITERATION #8 ****************************************
 epoch: 0, train_loss: 1.2942, test_loss: 1.3713, test_f1: 0.3056
 epoch: 1, train_loss: 1.1404, test_loss: 1.1890, test_f1: 0.4229
 epoch: 2, train_loss: 1.1065, test_loss: 1.1252, test_f1: 0.4847
 epoch: 3, train_loss: 1.0310, test_loss: 1.2845, test_f1: 0.4118
 epoch: 4, train_loss: 1.0004, test_loss: 1.1981, test_f1: 0.4597
 epoch: 5, train_loss: 0.9753, test_loss: 1.0716, test_f1: 0.4890
 epoch: 6, train_loss: 0.9366, test_loss: 1.2760, test_f1: 0.4308
 epoch: 7, train_loss: 0.9441, test_loss: 1.0701, test_f1: 0.5514
 epoch: 8, train_loss: 0.9068, test_loss: 1.0272, test_f1: 0.5014
 epoch: 9, train_loss: 0.9126, test_loss: 1.0210, test_f1: 0.5162
 epoch: 10, train_loss: 0.8585, test_loss: 1.2929, test_f1: 0.4703
 epoch: 11, train_loss: 0.8606, test_loss: 1.0551, test_f1: 0.5430
 epoch: 12, train_loss: 0.8609, test_loss: 1.1469, test_f1: 0.5158
 epoch: 13, train_loss: 0.8742, test_loss: 1.0138, test_f1: 0.5356
 epoch: 14, train_loss: 0.8294, test_loss: 0.9863, test_f1: 0.5844
 epoch: 15, train_loss: 0.8374, test_loss: 0.9961, test_f1: 0.5691
 epoch: 16, train_loss: 0.8197, test_loss: 1.1105, test_f1: 0.5240
 epoch: 17, train_loss: 0.8331, test_loss: 0.9935, test_f1: 0.5661
 epoch: 18, train_loss: 0.8448, test_loss: 1.1208, test_f1: 0.5394
 epoch: 19, train_loss: 0.8327, test_loss: 1.0473, test_f1: 0.5977
 epoch: 20, train_loss: 0.8183, test_loss: 1.0414, test_f1: 0.5773
 epoch: 21, train_loss: 0.8162, test_loss: 1.1036, test_f1: 0.5004
 epoch: 22, train_loss: 0.7933, test_loss: 1.0504, test_f1: 0.5640
 epoch: 23, train_loss: 0.7825, test_loss: 1.0461, test_f1: 0.5976
 epoch: 24, train_loss: 0.7721, test_loss: 1.0262, test_f1: 0.5704
 epoch: 25, train_loss: 0.8108, test_loss: 1.0623, test_f1: 0.5730
 epoch: 26, train_loss: 0.8032, test_loss: 0.9862, test_f1: 0.6097
 epoch: 27, train_loss: 0.7722, test_loss: 1.0099, test_f1: 0.5898
 epoch: 28, train_loss: 0.7775, test_loss: 1.3146, test_f1: 0.4955
 epoch: 29, train_loss: 0.7928, test_loss: 1.3952, test_f1: 0.4908
 epoch: 30, train_loss: 0.7846, test_loss: 0.9862, test_f1: 0.6092
 epoch: 31, train_loss: 0.7615, test_loss: 1.1860, test_f1: 0.5094
 epoch: 32, train_loss: 0.7645, test_loss: 1.3066, test_f1: 0.5368
 epoch: 33, train_loss: 0.7493, test_loss: 1.2282, test_f1: 0.5398
 epoch: 34, train_loss: 0.7626, test_loss: 1.1764, test_f1: 0.5197
 epoch: 35, train_loss: 0.7339, test_loss: 1.2385, test_f1: 0.5686
 epoch: 36, train_loss: 0.7440, test_loss: 1.1049, test_f1: 0.5949
 epoch: 37, train_loss: 0.7292, test_loss: 1.0986, test_f1: 0.6348
 epoch: 38, train_loss: 0.7115, test_loss: 1.1026, test_f1: 0.5727
 epoch: 39, train_loss: 0.7033, test_loss: 1.1991, test_f1: 0.5342
 epoch: 40, train_loss: 0.7051, test_loss: 1.3225, test_f1: 0.5537
 epoch: 41, train_loss: 0.7052, test_loss: 1.2991, test_f1: 0.5453
 epoch: 42, train_loss: 0.6937, test_loss: 1.0753, test_f1: 0.5878
 epoch: 43, train_loss: 0.6966, test_loss: 1.2647, test_f1: 0.5615
 epoch: 44, train_loss: 0.7021, test_loss: 1.3896, test_f1: 0.5895
 epoch: 45, train_loss: 0.7067, test_loss: 1.1205, test_f1: 0.5655
 epoch: 46, train_loss: 0.6839, test_loss: 1.1382, test_f1: 0.5952
 epoch: 47, train_loss: 0.6977, test_loss: 1.4256, test_f1: 0.5425
 epoch: 48, train_loss: 0.7307, test_loss: 1.3148, test_f1: 0.5373
 epoch: 49, train_loss: 0.7340, test_loss: 1.0092, test_f1: 0.5867
 epoch: 50, train_loss: 0.6614, test_loss: 1.1243, test_f1: 0.5858
 epoch: 51, train_loss: 0.6496, test_loss: 1.1077, test_f1: 0.5913
 epoch: 52, train_loss: 0.6202, test_loss: 1.0614, test_f1: 0.6042
 epoch: 53, train_loss: 0.6009, test_loss: 1.2554, test_f1: 0.5835
 epoch: 54, train_loss: 0.6101, test_loss: 1.2150, test_f1: 0.6086
 epoch: 55, train_loss: 0.6159, test_loss: 1.0762, test_f1: 0.5923
 epoch: 56, train_loss: 0.6204, test_loss: 1.3081, test_f1: 0.5733
 epoch: 57, train_loss: 0.6040, test_loss: 1.2067, test_f1: 0.5773
 epoch: 58, train_loss: 0.6192, test_loss: 1.3779, test_f1: 0.5822
 epoch: 59, train_loss: 0.6132, test_loss: 1.4055, test_f1: 0.5651
 epoch: 60, train_loss: 0.6060, test_loss: 1.2995, test_f1: 0.5750
 epoch: 61, train_loss: 0.5862, test_loss: 1.1981, test_f1: 0.6168
 epoch: 62, train_loss: 0.5688, test_loss: 1.2934, test_f1: 0.5811
 epoch: 63, train_loss: 0.5781, test_loss: 1.4463, test_f1: 0.5305
 epoch: 64, train_loss: 0.5602, test_loss: 1.3723, test_f1: 0.6035
 epoch: 65, train_loss: 0.5672, test_loss: 1.4284, test_f1: 0.5607
 epoch: 66, train_loss: 0.5742, test_loss: 1.4087, test_f1: 0.5860
 epoch: 67, train_loss: 0.5777, test_loss: 1.2558, test_f1: 0.5872
 epoch: 68, train_loss: 0.6161, test_loss: 1.3230, test_f1: 0.5717
 epoch: 69, train_loss: 0.5725, test_loss: 1.6167, test_f1: 0.5335
 epoch: 70, train_loss: 0.5477, test_loss: 1.2858, test_f1: 0.5957
 epoch: 71, train_loss: 0.5649, test_loss: 1.3428, test_f1: 0.5541
 epoch: 72, train_loss: 0.5538, test_loss: 1.4801, test_f1: 0.5498
 epoch: 73, train_loss: 0.5741, test_loss: 1.4923, test_f1: 0.5710
 epoch: 74, train_loss: 0.5609, test_loss: 1.6379, test_f1: 0.5380
 epoch: 75, train_loss: 0.5377, test_loss: 1.4460, test_f1: 0.5831
 epoch: 76, train_loss: 0.5516, test_loss: 1.6703, test_f1: 0.5238
 epoch: 77, train_loss: 0.5622, test_loss: 1.4724, test_f1: 0.5462
 epoch: 78, train_loss: 0.5521, test_loss: 1.6261, test_f1: 0.6102
 epoch: 79, train_loss: 0.5372, test_loss: 1.7359, test_f1: 0.5092
 epoch: 80, train_loss: 0.5147, test_loss: 1.9377, test_f1: 0.5642
 epoch: 81, train_loss: 0.5349, test_loss: 1.7730, test_f1: 0.5457
 epoch: 82, train_loss: 0.5505, test_loss: 1.6888, test_f1: 0.5699
 epoch: 83, train_loss: 0.5447, test_loss: 1.8521, test_f1: 0.5318
 epoch: 84, train_loss: 0.5147, test_loss: 1.4924, test_f1: 0.5638
 epoch: 85, train_loss: 0.5072, test_loss: 1.4708, test_f1: 0.5910
 epoch: 86, train_loss: 0.5390, test_loss: 1.4992, test_f1: 0.5519
 epoch: 87, train_loss: 0.4970, test_loss: 1.6542, test_f1: 0.5534
 epoch: 88, train_loss: 0.4970, test_loss: 2.1279, test_f1: 0.5235
 epoch: 89, train_loss: 0.5231, test_loss: 2.1183, test_f1: 0.5262
 epoch: 90, train_loss: 0.5635, test_loss: 2.0253, test_f1: 0.5064
 epoch: 91, train_loss: 0.5471, test_loss: 1.4380, test_f1: 0.6021
 epoch: 92, train_loss: 0.4828, test_loss: 1.6126, test_f1: 0.5708
 epoch: 93, train_loss: 0.5243, test_loss: 1.7822, test_f1: 0.5731
 epoch: 94, train_loss: 0.4857, test_loss: 2.0043, test_f1: 0.5322
 epoch: 95, train_loss: 0.5448, test_loss: 1.9428, test_f1: 0.5289
 epoch: 96, train_loss: 0.5095, test_loss: 1.7741, test_f1: 0.5696
 epoch: 97, train_loss: 0.5114, test_loss: 1.5168, test_f1: 0.5704
 epoch: 98, train_loss: 0.4850, test_loss: 1.5913, test_f1: 0.5703
 epoch: 99, train_loss: 0.5194, test_loss: 1.8906, test_f1: 0.5384
##################ITERATION #9 ****************************************
 epoch: 0, train_loss: 1.3305, test_loss: 1.3549, test_f1: 0.2369
 epoch: 1, train_loss: 1.2183, test_loss: 1.2470, test_f1: 0.3560
 epoch: 2, train_loss: 1.1322, test_loss: 1.2035, test_f1: 0.4386
 epoch: 3, train_loss: 1.1064, test_loss: 1.1907, test_f1: 0.4597
 epoch: 4, train_loss: 1.0593, test_loss: 1.2195, test_f1: 0.4981
 epoch: 5, train_loss: 1.0123, test_loss: 1.1551, test_f1: 0.4659
 epoch: 6, train_loss: 1.0024, test_loss: 1.1257, test_f1: 0.4855
 epoch: 7, train_loss: 0.9966, test_loss: 1.0488, test_f1: 0.4919
 epoch: 8, train_loss: 0.9555, test_loss: 1.0671, test_f1: 0.4618
 epoch: 9, train_loss: 0.9235, test_loss: 1.0693, test_f1: 0.5222
 epoch: 10, train_loss: 0.9264, test_loss: 1.0405, test_f1: 0.4391
 epoch: 11, train_loss: 0.9012, test_loss: 1.1907, test_f1: 0.4492
 epoch: 12, train_loss: 0.9159, test_loss: 1.0903, test_f1: 0.4577
 epoch: 13, train_loss: 0.9264, test_loss: 1.0819, test_f1: 0.4622
 epoch: 14, train_loss: 0.8812, test_loss: 0.9883, test_f1: 0.5698
 epoch: 15, train_loss: 0.8485, test_loss: 1.1652, test_f1: 0.4670
 epoch: 16, train_loss: 0.8667, test_loss: 1.0441, test_f1: 0.5128
 epoch: 17, train_loss: 0.8361, test_loss: 1.2635, test_f1: 0.5309
 epoch: 18, train_loss: 0.8355, test_loss: 1.0428, test_f1: 0.5393
 epoch: 19, train_loss: 0.8341, test_loss: 1.0224, test_f1: 0.5302
 epoch: 20, train_loss: 0.8318, test_loss: 1.0308, test_f1: 0.5371
 epoch: 21, train_loss: 0.8327, test_loss: 1.0109, test_f1: 0.5683
 epoch: 22, train_loss: 0.8142, test_loss: 1.1174, test_f1: 0.4890
 epoch: 23, train_loss: 0.8085, test_loss: 1.2554, test_f1: 0.5416
 epoch: 24, train_loss: 0.8233, test_loss: 1.1411, test_f1: 0.4798
 epoch: 25, train_loss: 0.8198, test_loss: 1.0118, test_f1: 0.5530
 epoch: 26, train_loss: 0.7890, test_loss: 1.0645, test_f1: 0.5272
 epoch: 27, train_loss: 0.8104, test_loss: 1.2679, test_f1: 0.4918
 epoch: 28, train_loss: 0.7831, test_loss: 1.1356, test_f1: 0.5816
 epoch: 29, train_loss: 0.7761, test_loss: 1.5268, test_f1: 0.5116
 epoch: 30, train_loss: 0.7791, test_loss: 1.2449, test_f1: 0.5250
 epoch: 31, train_loss: 0.7845, test_loss: 1.1994, test_f1: 0.5639
 epoch: 32, train_loss: 0.7930, test_loss: 1.2922, test_f1: 0.5012
 epoch: 33, train_loss: 0.7677, test_loss: 1.0739, test_f1: 0.5056
 epoch: 34, train_loss: 0.7696, test_loss: 1.2065, test_f1: 0.4742
 epoch: 35, train_loss: 0.7623, test_loss: 1.3348, test_f1: 0.4900
 epoch: 36, train_loss: 0.7371, test_loss: 1.0835, test_f1: 0.5776
 epoch: 37, train_loss: 0.7497, test_loss: 2.0781, test_f1: 0.5218
 epoch: 38, train_loss: 0.7691, test_loss: 1.2273, test_f1: 0.4925
 epoch: 39, train_loss: 0.7518, test_loss: 1.3317, test_f1: 0.5382
 epoch: 40, train_loss: 0.7744, test_loss: 1.2657, test_f1: 0.4895
 epoch: 41, train_loss: 0.7475, test_loss: 1.1352, test_f1: 0.5279
 epoch: 42, train_loss: 0.7370, test_loss: 1.1854, test_f1: 0.5084
 epoch: 43, train_loss: 0.7464, test_loss: 1.7510, test_f1: 0.4505
 epoch: 44, train_loss: 0.7212, test_loss: 1.1059, test_f1: 0.5753
 epoch: 45, train_loss: 0.7182, test_loss: 1.0777, test_f1: 0.5769
 epoch: 46, train_loss: 0.7089, test_loss: 1.1548, test_f1: 0.5016
 epoch: 47, train_loss: 0.6902, test_loss: 1.3934, test_f1: 0.5240
 epoch: 48, train_loss: 0.7224, test_loss: 1.5191, test_f1: 0.5046
 epoch: 49, train_loss: 0.7528, test_loss: 1.3846, test_f1: 0.5398
 epoch: 50, train_loss: 0.7165, test_loss: 1.3849, test_f1: 0.5415
 epoch: 51, train_loss: 0.6980, test_loss: 1.1454, test_f1: 0.5509
 epoch: 52, train_loss: 0.6915, test_loss: 1.4606, test_f1: 0.5451
 epoch: 53, train_loss: 0.6690, test_loss: 1.1639, test_f1: 0.5723
 epoch: 54, train_loss: 0.6647, test_loss: 1.3305, test_f1: 0.5903
 epoch: 55, train_loss: 0.6264, test_loss: 1.2607, test_f1: 0.5524
 epoch: 56, train_loss: 0.6256, test_loss: 1.7463, test_f1: 0.5321
 epoch: 57, train_loss: 0.6053, test_loss: 1.7095, test_f1: 0.5501
 epoch: 58, train_loss: 0.6236, test_loss: 1.4828, test_f1: 0.5474
 epoch: 59, train_loss: 0.6239, test_loss: 1.3418, test_f1: 0.5635
 epoch: 60, train_loss: 0.6005, test_loss: 1.8274, test_f1: 0.5412
 epoch: 61, train_loss: 0.6071, test_loss: 1.5876, test_f1: 0.5747
 epoch: 62, train_loss: 0.5999, test_loss: 1.9222, test_f1: 0.5858
 epoch: 63, train_loss: 0.5867, test_loss: 1.8015, test_f1: 0.5636
 epoch: 64, train_loss: 0.5782, test_loss: 1.6013, test_f1: 0.5543
 epoch: 65, train_loss: 0.5747, test_loss: 1.7004, test_f1: 0.5638
 epoch: 66, train_loss: 0.5684, test_loss: 1.8107, test_f1: 0.5869
 epoch: 67, train_loss: 0.5998, test_loss: 1.7410, test_f1: 0.5635
 epoch: 68, train_loss: 0.6181, test_loss: 1.6856, test_f1: 0.5337
 epoch: 69, train_loss: 0.6028, test_loss: 1.6739, test_f1: 0.5453
 epoch: 70, train_loss: 0.5626, test_loss: 1.7842, test_f1: 0.5620
 epoch: 71, train_loss: 0.5858, test_loss: 1.6775, test_f1: 0.5855
 epoch: 72, train_loss: 0.5613, test_loss: 1.8903, test_f1: 0.5663
 epoch: 73, train_loss: 0.5642, test_loss: 1.9189, test_f1: 0.5835
 epoch: 74, train_loss: 0.5486, test_loss: 2.3127, test_f1: 0.5681
 epoch: 75, train_loss: 0.5748, test_loss: 2.0804, test_f1: 0.5804
 epoch: 76, train_loss: 0.5445, test_loss: 1.8164, test_f1: 0.5477
 epoch: 77, train_loss: 0.5517, test_loss: 1.7961, test_f1: 0.5645
 epoch: 78, train_loss: 0.5399, test_loss: 1.9622, test_f1: 0.5351
 epoch: 79, train_loss: 0.5520, test_loss: 1.9121, test_f1: 0.5930
 epoch: 80, train_loss: 0.5435, test_loss: 2.1556, test_f1: 0.5394
 epoch: 81, train_loss: 0.5117, test_loss: 1.8086, test_f1: 0.5846
 epoch: 82, train_loss: 0.5204, test_loss: 1.9359, test_f1: 0.5643
 epoch: 83, train_loss: 0.5123, test_loss: 2.1815, test_f1: 0.5593
 epoch: 84, train_loss: 0.5436, test_loss: 2.3657, test_f1: 0.5608
 epoch: 85, train_loss: 0.5188, test_loss: 2.2429, test_f1: 0.5780
 epoch: 86, train_loss: 0.5360, test_loss: 2.1740, test_f1: 0.5390
 epoch: 87, train_loss: 0.5434, test_loss: 2.6666, test_f1: 0.5512
 epoch: 88, train_loss: 0.5138, test_loss: 2.1484, test_f1: 0.5711
 epoch: 89, train_loss: 0.5399, test_loss: 2.3062, test_f1: 0.5851
 epoch: 90, train_loss: 0.5362, test_loss: 2.5450, test_f1: 0.5080
 epoch: 91, train_loss: 0.5232, test_loss: 2.0349, test_f1: 0.5315
 epoch: 92, train_loss: 0.5414, test_loss: 2.4047, test_f1: 0.5008
 epoch: 93, train_loss: 0.5139, test_loss: 1.8667, test_f1: 0.5666
 epoch: 94, train_loss: 0.5292, test_loss: 1.9038, test_f1: 0.5152
 epoch: 95, train_loss: 0.4946, test_loss: 2.1635, test_f1: 0.5687
 epoch: 96, train_loss: 0.4860, test_loss: 2.1971, test_f1: 0.5865
 epoch: 97, train_loss: 0.4835, test_loss: 1.9430, test_f1: 0.5737
 epoch: 98, train_loss: 0.5192, test_loss: 1.9380, test_f1: 0.5534
 epoch: 99, train_loss: 0.4928, test_loss: 2.0837, test_f1: 0.5560

Training completed in 486.56 seconds
Best F1: 0.6608 at epoch 64
Mean F1 across iterations: 0.6288  0.0203
========================FINAL RESULTS================================
FEGIN weighted F1: 0.6608  0.0203
python main.py --data ltspice_demos --representation component_component --model FEGIN --layers 5 --hiddens 32 --batch_size 64 --lr 0.01 --emb_size 250 --epochs 100 --save_appendix component_component_L5_H32_BS64_LR0.01_E250 --no_val
-----



STDERR:
  File "main.py", line 370, in <module>
    main()
  File "main.py", line 254, in main
    dataset = dataset_class(
  File "/home/philip/projects/ltspice_examples_code_repo/Circuit-Completion-Using-GNNs/component_classification_with_link_prediction_head/evaluation/FEGIN/kernel/circuit_datasets.py", line 15, in __init__
    self.data, self.slices = torch.load(self.processed_paths[0])
  File "/home/philip/.local/lib/python3.8/site-packages/torch/serialization.py", line 1040, in load
    warnings.warn(
  File "/usr/lib/python3.8/warnings.py", line 109, in _showwarnmsg
    sw(msg.message, msg.category, msg.filename, msg.lineno,
  File "main.py", line 47, in warn_with_traceback
    traceback.print_stack(file=log)
/home/philip/projects/ltspice_examples_code_repo/Circuit-Completion-Using-GNNs/component_classification_with_link_prediction_head/evaluation/FEGIN/kernel/circuit_datasets.py:15: FutureWarning: You are using `torch.load` with `weights_only=False` (the current default value), which uses the default pickle module implicitly. It is possible to construct malicious pickle data which will execute arbitrary code during unpickling (See https://github.com/pytorch/pytorch/blob/main/SECURITY.md#untrusted-models for more details). In a future release, the default value for `weights_only` will be flipped to `True`. This limits the functions that could be executed during unpickling. Arbitrary objects will no longer be allowed to be loaded via this mode unless they are explicitly allowlisted by the user via `torch.serialization.add_safe_globals`. We recommend you start setting `weights_only=True` for any use case where you don't have full control of the loaded file. Please open an issue on GitHub for any issues related to this experimental feature.
  self.data, self.slices = torch.load(self.processed_paths[0])
