STDOUT:
Results will be saved in /home/philip/projects/ltspice_examples_code_repo/Circuit-Completion-Using-GNNs/component_classification_with_link_prediction_head/evaluation/FEGIN/results/model_FEGIN_dataset_ltspice_demos
Command line input: python main.py --data ltspice_demos --representation component_pin_net --model FEGIN --layers 4 --hiddens 32 --batch_size 64 --lr 0.001 --emb_size 512 --epochs 100 --save_appendix component_pin_net_L4_H32_BS64_LR0.001_E512 --no_val
 is saved.
-----
ltspice_demos - FEGIN
Using 4 layers, 32 hidden units, h = 2
Loading component_pin_net representation dataset
ENTERED
Training FEGIN on component_pin_net representation
Train: 1565, Test: 383
##################ITERATION #0 ****************************************
 epoch: 0, train_loss: 1.2857, test_loss: 1.3102, test_f1: 0.2281
 epoch: 1, train_loss: 1.1974, test_loss: 1.2504, test_f1: 0.3394
 epoch: 2, train_loss: 1.1340, test_loss: 1.1872, test_f1: 0.4362
 epoch: 3, train_loss: 1.0736, test_loss: 1.1498, test_f1: 0.4355
 epoch: 4, train_loss: 1.0398, test_loss: 1.1330, test_f1: 0.4431
 epoch: 5, train_loss: 1.0151, test_loss: 1.1111, test_f1: 0.4345
 epoch: 6, train_loss: 0.9996, test_loss: 1.1153, test_f1: 0.4533
 epoch: 7, train_loss: 0.9916, test_loss: 1.0933, test_f1: 0.4459
 epoch: 8, train_loss: 0.9789, test_loss: 1.1025, test_f1: 0.4679
 epoch: 9, train_loss: 0.9782, test_loss: 1.0813, test_f1: 0.4604
 epoch: 10, train_loss: 0.9572, test_loss: 1.0831, test_f1: 0.4641
 epoch: 11, train_loss: 0.9422, test_loss: 1.0790, test_f1: 0.4922
 epoch: 12, train_loss: 0.9340, test_loss: 1.0795, test_f1: 0.5113
 epoch: 13, train_loss: 0.9317, test_loss: 1.0733, test_f1: 0.5047
 epoch: 14, train_loss: 0.9188, test_loss: 1.0474, test_f1: 0.5354
 epoch: 15, train_loss: 0.8992, test_loss: 1.0472, test_f1: 0.5565
 epoch: 16, train_loss: 0.9083, test_loss: 1.0878, test_f1: 0.5224
 epoch: 17, train_loss: 0.8922, test_loss: 1.0503, test_f1: 0.5485
 epoch: 18, train_loss: 0.8866, test_loss: 1.0487, test_f1: 0.5695
 epoch: 19, train_loss: 0.8811, test_loss: 1.0732, test_f1: 0.5440
 epoch: 20, train_loss: 0.8895, test_loss: 1.0338, test_f1: 0.5764
 epoch: 21, train_loss: 0.8773, test_loss: 1.0598, test_f1: 0.5568
 epoch: 22, train_loss: 0.8677, test_loss: 0.9754, test_f1: 0.5883
 epoch: 23, train_loss: 0.8307, test_loss: 1.0459, test_f1: 0.5637
 epoch: 24, train_loss: 0.8386, test_loss: 1.0588, test_f1: 0.5940
 epoch: 25, train_loss: 0.8175, test_loss: 1.0155, test_f1: 0.5954
 epoch: 26, train_loss: 0.8088, test_loss: 1.0030, test_f1: 0.6084
 epoch: 27, train_loss: 0.8096, test_loss: 0.9470, test_f1: 0.6097
 epoch: 28, train_loss: 0.8020, test_loss: 1.0592, test_f1: 0.5336
 epoch: 29, train_loss: 0.7821, test_loss: 0.9636, test_f1: 0.6009
 epoch: 30, train_loss: 0.7770, test_loss: 1.1822, test_f1: 0.4849
 epoch: 31, train_loss: 0.7490, test_loss: 0.9459, test_f1: 0.6116
 epoch: 32, train_loss: 0.7622, test_loss: 1.0814, test_f1: 0.6008
 epoch: 33, train_loss: 0.7379, test_loss: 1.0883, test_f1: 0.5414
 epoch: 34, train_loss: 0.7275, test_loss: 1.0959, test_f1: 0.4484
 epoch: 35, train_loss: 0.7309, test_loss: 0.9685, test_f1: 0.5965
 epoch: 36, train_loss: 0.7172, test_loss: 0.9398, test_f1: 0.6243
 epoch: 37, train_loss: 0.7232, test_loss: 1.0941, test_f1: 0.5979
 epoch: 38, train_loss: 0.7003, test_loss: 1.0858, test_f1: 0.5921
 epoch: 39, train_loss: 0.6857, test_loss: 0.9994, test_f1: 0.6219
 epoch: 40, train_loss: 0.6646, test_loss: 1.1210, test_f1: 0.5246
 epoch: 41, train_loss: 0.6502, test_loss: 1.2282, test_f1: 0.5786
 epoch: 42, train_loss: 0.6478, test_loss: 0.9683, test_f1: 0.6068
 epoch: 43, train_loss: 0.6481, test_loss: 1.0908, test_f1: 0.5650
 epoch: 44, train_loss: 0.6338, test_loss: 1.1026, test_f1: 0.5513
 epoch: 45, train_loss: 0.6311, test_loss: 1.1672, test_f1: 0.5135
 epoch: 46, train_loss: 0.5887, test_loss: 1.0668, test_f1: 0.6160
 epoch: 47, train_loss: 0.6102, test_loss: 1.1366, test_f1: 0.5925
 epoch: 48, train_loss: 0.6164, test_loss: 1.0273, test_f1: 0.6421
 epoch: 49, train_loss: 0.5886, test_loss: 1.1525, test_f1: 0.5627
 epoch: 50, train_loss: 0.5945, test_loss: 1.0859, test_f1: 0.5987
 epoch: 51, train_loss: 0.5737, test_loss: 1.0720, test_f1: 0.6177
 epoch: 52, train_loss: 0.5437, test_loss: 1.0847, test_f1: 0.5892
 epoch: 53, train_loss: 0.5248, test_loss: 1.0187, test_f1: 0.6198
 epoch: 54, train_loss: 0.5264, test_loss: 1.1032, test_f1: 0.5651
 epoch: 55, train_loss: 0.5098, test_loss: 1.0498, test_f1: 0.6113
 epoch: 56, train_loss: 0.4984, test_loss: 1.1165, test_f1: 0.6533
 epoch: 57, train_loss: 0.4991, test_loss: 1.0387, test_f1: 0.6037
 epoch: 58, train_loss: 0.5115, test_loss: 1.1098, test_f1: 0.6214
 epoch: 59, train_loss: 0.4904, test_loss: 1.1909, test_f1: 0.6068
 epoch: 60, train_loss: 0.5037, test_loss: 1.1979, test_f1: 0.5790
 epoch: 61, train_loss: 0.4654, test_loss: 1.1744, test_f1: 0.6287
 epoch: 62, train_loss: 0.4831, test_loss: 1.1581, test_f1: 0.5758
 epoch: 63, train_loss: 0.4908, test_loss: 1.2136, test_f1: 0.5906
 epoch: 64, train_loss: 0.4756, test_loss: 1.2381, test_f1: 0.5794
 epoch: 65, train_loss: 0.4767, test_loss: 1.0875, test_f1: 0.6386
 epoch: 66, train_loss: 0.4526, test_loss: 1.1579, test_f1: 0.6105
 epoch: 67, train_loss: 0.4461, test_loss: 1.2163, test_f1: 0.5931
 epoch: 68, train_loss: 0.4429, test_loss: 1.1398, test_f1: 0.6180
 epoch: 69, train_loss: 0.4373, test_loss: 1.2752, test_f1: 0.5860
 epoch: 70, train_loss: 0.4414, test_loss: 1.1273, test_f1: 0.6404
 epoch: 71, train_loss: 0.4456, test_loss: 1.3369, test_f1: 0.5869
 epoch: 72, train_loss: 0.4249, test_loss: 1.2368, test_f1: 0.6011
 epoch: 73, train_loss: 0.4434, test_loss: 1.3535, test_f1: 0.5855
 epoch: 74, train_loss: 0.4352, test_loss: 1.2169, test_f1: 0.6158
 epoch: 75, train_loss: 0.3871, test_loss: 1.4101, test_f1: 0.5941
 epoch: 76, train_loss: 0.4101, test_loss: 1.3303, test_f1: 0.6008
 epoch: 77, train_loss: 0.4264, test_loss: 1.3254, test_f1: 0.6036
 epoch: 78, train_loss: 0.3936, test_loss: 1.4411, test_f1: 0.5831
 epoch: 79, train_loss: 0.3906, test_loss: 1.3505, test_f1: 0.5848
 epoch: 80, train_loss: 0.3807, test_loss: 1.4327, test_f1: 0.6003
 epoch: 81, train_loss: 0.3904, test_loss: 1.4469, test_f1: 0.5929
 epoch: 82, train_loss: 0.3763, test_loss: 1.4799, test_f1: 0.6039
 epoch: 83, train_loss: 0.3781, test_loss: 1.2931, test_f1: 0.6218
 epoch: 84, train_loss: 0.3798, test_loss: 1.4854, test_f1: 0.6035
 epoch: 85, train_loss: 0.3772, test_loss: 1.3652, test_f1: 0.5927
 epoch: 86, train_loss: 0.3701, test_loss: 1.5721, test_f1: 0.5452
 epoch: 87, train_loss: 0.3481, test_loss: 1.4552, test_f1: 0.5993
 epoch: 88, train_loss: 0.3527, test_loss: 1.5462, test_f1: 0.5949
 epoch: 89, train_loss: 0.3311, test_loss: 1.5726, test_f1: 0.6036
 epoch: 90, train_loss: 0.3654, test_loss: 1.5747, test_f1: 0.5656
 epoch: 91, train_loss: 0.3642, test_loss: 1.5341, test_f1: 0.5911
 epoch: 92, train_loss: 0.3687, test_loss: 1.5670, test_f1: 0.6003
 epoch: 93, train_loss: 0.3379, test_loss: 1.7482, test_f1: 0.5500
 epoch: 94, train_loss: 0.3341, test_loss: 1.6052, test_f1: 0.5761
 epoch: 95, train_loss: 0.3360, test_loss: 1.6327, test_f1: 0.5946
 epoch: 96, train_loss: 0.3452, test_loss: 1.7545, test_f1: 0.5650
 epoch: 97, train_loss: 0.3184, test_loss: 1.5434, test_f1: 0.6207
 epoch: 98, train_loss: 0.3290, test_loss: 1.7599, test_f1: 0.5619
 epoch: 99, train_loss: 0.3116, test_loss: 1.8422, test_f1: 0.5678
##################ITERATION #1 ****************************************
 epoch: 0, train_loss: 1.1699, test_loss: 1.3115, test_f1: 0.4057
 epoch: 1, train_loss: 1.0650, test_loss: 1.1761, test_f1: 0.3882
 epoch: 2, train_loss: 1.0188, test_loss: 1.0969, test_f1: 0.4518
 epoch: 3, train_loss: 1.0033, test_loss: 1.0644, test_f1: 0.5060
 epoch: 4, train_loss: 0.9702, test_loss: 1.0667, test_f1: 0.5151
 epoch: 5, train_loss: 0.9584, test_loss: 1.0248, test_f1: 0.5370
 epoch: 6, train_loss: 0.9373, test_loss: 1.0410, test_f1: 0.5158
 epoch: 7, train_loss: 0.9307, test_loss: 1.0324, test_f1: 0.5640
 epoch: 8, train_loss: 0.9099, test_loss: 1.0197, test_f1: 0.5721
 epoch: 9, train_loss: 0.8956, test_loss: 1.0008, test_f1: 0.5509
 epoch: 10, train_loss: 0.8871, test_loss: 1.0144, test_f1: 0.5664
 epoch: 11, train_loss: 0.8803, test_loss: 0.9884, test_f1: 0.5961
 epoch: 12, train_loss: 0.8609, test_loss: 1.0040, test_f1: 0.5611
 epoch: 13, train_loss: 0.8434, test_loss: 0.9941, test_f1: 0.5926
 epoch: 14, train_loss: 0.8264, test_loss: 1.0016, test_f1: 0.5788
 epoch: 15, train_loss: 0.8314, test_loss: 1.0031, test_f1: 0.5707
 epoch: 16, train_loss: 0.8313, test_loss: 1.0229, test_f1: 0.5475
 epoch: 17, train_loss: 0.7900, test_loss: 0.9952, test_f1: 0.5706
 epoch: 18, train_loss: 0.8053, test_loss: 1.0172, test_f1: 0.5411
 epoch: 19, train_loss: 0.7947, test_loss: 1.0073, test_f1: 0.5934
 epoch: 20, train_loss: 0.7656, test_loss: 0.9662, test_f1: 0.5907
 epoch: 21, train_loss: 0.7549, test_loss: 1.0105, test_f1: 0.5664
 epoch: 22, train_loss: 0.7559, test_loss: 1.0403, test_f1: 0.5631
 epoch: 23, train_loss: 0.7579, test_loss: 1.0113, test_f1: 0.5348
 epoch: 24, train_loss: 0.7385, test_loss: 0.9761, test_f1: 0.5916
 epoch: 25, train_loss: 0.7475, test_loss: 1.0432, test_f1: 0.5760
 epoch: 26, train_loss: 0.7181, test_loss: 1.0315, test_f1: 0.5815
 epoch: 27, train_loss: 0.6951, test_loss: 1.0425, test_f1: 0.5642
 epoch: 28, train_loss: 0.6718, test_loss: 1.0087, test_f1: 0.5551
 epoch: 29, train_loss: 0.6811, test_loss: 1.0502, test_f1: 0.5535
 epoch: 30, train_loss: 0.6870, test_loss: 0.9879, test_f1: 0.5983
 epoch: 31, train_loss: 0.6666, test_loss: 1.0952, test_f1: 0.5772
 epoch: 32, train_loss: 0.6684, test_loss: 1.0710, test_f1: 0.5827
 epoch: 33, train_loss: 0.6727, test_loss: 1.0690, test_f1: 0.5619
 epoch: 34, train_loss: 0.6455, test_loss: 1.0503, test_f1: 0.6272
 epoch: 35, train_loss: 0.6585, test_loss: 1.1083, test_f1: 0.5782
 epoch: 36, train_loss: 0.6514, test_loss: 1.0834, test_f1: 0.5534
 epoch: 37, train_loss: 0.6297, test_loss: 1.1716, test_f1: 0.5290
 epoch: 38, train_loss: 0.6290, test_loss: 1.1045, test_f1: 0.5685
 epoch: 39, train_loss: 0.5984, test_loss: 1.1305, test_f1: 0.5959
 epoch: 40, train_loss: 0.6027, test_loss: 1.2009, test_f1: 0.5682
 epoch: 41, train_loss: 0.6031, test_loss: 1.1013, test_f1: 0.6272
 epoch: 42, train_loss: 0.5763, test_loss: 1.0957, test_f1: 0.5889
 epoch: 43, train_loss: 0.5932, test_loss: 1.1543, test_f1: 0.5759
 epoch: 44, train_loss: 0.5628, test_loss: 1.1512, test_f1: 0.5901
 epoch: 45, train_loss: 0.5735, test_loss: 1.2311, test_f1: 0.5511
 epoch: 46, train_loss: 0.5796, test_loss: 1.1461, test_f1: 0.6102
 epoch: 47, train_loss: 0.5470, test_loss: 1.2279, test_f1: 0.5970
 epoch: 48, train_loss: 0.5334, test_loss: 1.2331, test_f1: 0.5959
 epoch: 49, train_loss: 0.5320, test_loss: 1.3363, test_f1: 0.5956
 epoch: 50, train_loss: 0.5189, test_loss: 1.3434, test_f1: 0.5575
 epoch: 51, train_loss: 0.4937, test_loss: 1.3017, test_f1: 0.6043
 epoch: 52, train_loss: 0.4742, test_loss: 1.3122, test_f1: 0.5985
 epoch: 53, train_loss: 0.4751, test_loss: 1.3488, test_f1: 0.6172
 epoch: 54, train_loss: 0.4559, test_loss: 1.2493, test_f1: 0.6174
 epoch: 55, train_loss: 0.4559, test_loss: 1.2981, test_f1: 0.6126
 epoch: 56, train_loss: 0.4577, test_loss: 1.3179, test_f1: 0.6006
 epoch: 57, train_loss: 0.4312, test_loss: 1.3841, test_f1: 0.5990
 epoch: 58, train_loss: 0.4396, test_loss: 1.3572, test_f1: 0.6234
 epoch: 59, train_loss: 0.4418, test_loss: 1.3469, test_f1: 0.6019
 epoch: 60, train_loss: 0.4214, test_loss: 1.3989, test_f1: 0.6230
 epoch: 61, train_loss: 0.4454, test_loss: 1.4153, test_f1: 0.6103
 epoch: 62, train_loss: 0.4374, test_loss: 1.4858, test_f1: 0.5927
 epoch: 63, train_loss: 0.4256, test_loss: 1.4690, test_f1: 0.6038
 epoch: 64, train_loss: 0.4014, test_loss: 1.4343, test_f1: 0.6140
 epoch: 65, train_loss: 0.3960, test_loss: 1.4648, test_f1: 0.6130
 epoch: 66, train_loss: 0.3927, test_loss: 1.5063, test_f1: 0.5880
 epoch: 67, train_loss: 0.3993, test_loss: 1.4776, test_f1: 0.5883
 epoch: 68, train_loss: 0.3822, test_loss: 1.5852, test_f1: 0.5798
 epoch: 69, train_loss: 0.3989, test_loss: 1.4754, test_f1: 0.5801
 epoch: 70, train_loss: 0.4089, test_loss: 1.5002, test_f1: 0.6174
 epoch: 71, train_loss: 0.3721, test_loss: 1.5940, test_f1: 0.6066
 epoch: 72, train_loss: 0.3686, test_loss: 1.5496, test_f1: 0.6234
 epoch: 73, train_loss: 0.3795, test_loss: 1.4882, test_f1: 0.6092
 epoch: 74, train_loss: 0.3547, test_loss: 1.5905, test_f1: 0.5983
 epoch: 75, train_loss: 0.3388, test_loss: 1.5289, test_f1: 0.6259
 epoch: 76, train_loss: 0.3845, test_loss: 1.5951, test_f1: 0.6015
 epoch: 77, train_loss: 0.3316, test_loss: 1.5606, test_f1: 0.6281
 epoch: 78, train_loss: 0.3287, test_loss: 1.5848, test_f1: 0.6289
 epoch: 79, train_loss: 0.3660, test_loss: 1.6490, test_f1: 0.6002
 epoch: 80, train_loss: 0.3437, test_loss: 1.6414, test_f1: 0.6197
 epoch: 81, train_loss: 0.3385, test_loss: 1.6644, test_f1: 0.6208
 epoch: 82, train_loss: 0.3378, test_loss: 1.7155, test_f1: 0.5801
 epoch: 83, train_loss: 0.3454, test_loss: 1.6853, test_f1: 0.6233
 epoch: 84, train_loss: 0.3635, test_loss: 1.7317, test_f1: 0.5759
 epoch: 85, train_loss: 0.3403, test_loss: 1.6714, test_f1: 0.6392
 epoch: 86, train_loss: 0.3288, test_loss: 1.7164, test_f1: 0.6109
 epoch: 87, train_loss: 0.3106, test_loss: 1.7073, test_f1: 0.5782
 epoch: 88, train_loss: 0.3144, test_loss: 1.6789, test_f1: 0.6161
 epoch: 89, train_loss: 0.3356, test_loss: 1.7152, test_f1: 0.5970
 epoch: 90, train_loss: 0.3211, test_loss: 1.6965, test_f1: 0.6181
 epoch: 91, train_loss: 0.3103, test_loss: 1.7595, test_f1: 0.5867
 epoch: 92, train_loss: 0.2966, test_loss: 1.7769, test_f1: 0.5909
 epoch: 93, train_loss: 0.2972, test_loss: 1.8144, test_f1: 0.5960
 epoch: 94, train_loss: 0.2919, test_loss: 1.7634, test_f1: 0.6260
 epoch: 95, train_loss: 0.3076, test_loss: 1.7765, test_f1: 0.6026
 epoch: 96, train_loss: 0.2967, test_loss: 1.8291, test_f1: 0.6367
 epoch: 97, train_loss: 0.3074, test_loss: 1.7828, test_f1: 0.5935
 epoch: 98, train_loss: 0.3143, test_loss: 1.7705, test_f1: 0.6154
 epoch: 99, train_loss: 0.2999, test_loss: 1.7488, test_f1: 0.6133
##################ITERATION #2 ****************************************
 epoch: 0, train_loss: 1.1783, test_loss: 1.3027, test_f1: 0.1805
 epoch: 1, train_loss: 1.0451, test_loss: 1.1967, test_f1: 0.3815
 epoch: 2, train_loss: 1.0028, test_loss: 1.0440, test_f1: 0.5204
 epoch: 3, train_loss: 0.9462, test_loss: 1.0295, test_f1: 0.5495
 epoch: 4, train_loss: 0.9234, test_loss: 1.0015, test_f1: 0.5374
 epoch: 5, train_loss: 0.8945, test_loss: 0.9964, test_f1: 0.5597
 epoch: 6, train_loss: 0.8929, test_loss: 0.9900, test_f1: 0.5795
 epoch: 7, train_loss: 0.8769, test_loss: 1.0127, test_f1: 0.4757
 epoch: 8, train_loss: 0.8466, test_loss: 1.0164, test_f1: 0.5532
 epoch: 9, train_loss: 0.8265, test_loss: 1.0184, test_f1: 0.5558
 epoch: 10, train_loss: 0.8181, test_loss: 1.0232, test_f1: 0.5668
 epoch: 11, train_loss: 0.7939, test_loss: 1.0297, test_f1: 0.5421
 epoch: 12, train_loss: 0.7860, test_loss: 0.9473, test_f1: 0.5972
 epoch: 13, train_loss: 0.7564, test_loss: 0.9536, test_f1: 0.5849
 epoch: 14, train_loss: 0.7759, test_loss: 0.9616, test_f1: 0.6084
 epoch: 15, train_loss: 0.7419, test_loss: 0.9871, test_f1: 0.5917
 epoch: 16, train_loss: 0.7377, test_loss: 0.9353, test_f1: 0.5969
 epoch: 17, train_loss: 0.7046, test_loss: 0.9523, test_f1: 0.6296
 epoch: 18, train_loss: 0.6965, test_loss: 1.0366, test_f1: 0.6142
 epoch: 19, train_loss: 0.6957, test_loss: 0.9745, test_f1: 0.6244
 epoch: 20, train_loss: 0.6899, test_loss: 0.9769, test_f1: 0.6083
 epoch: 21, train_loss: 0.6834, test_loss: 1.0424, test_f1: 0.6180
 epoch: 22, train_loss: 0.6583, test_loss: 0.9834, test_f1: 0.6321
 epoch: 23, train_loss: 0.6497, test_loss: 1.0366, test_f1: 0.6113
 epoch: 24, train_loss: 0.6444, test_loss: 0.9813, test_f1: 0.6319
 epoch: 25, train_loss: 0.6336, test_loss: 0.9644, test_f1: 0.6336
 epoch: 26, train_loss: 0.6174, test_loss: 1.0136, test_f1: 0.6263
 epoch: 27, train_loss: 0.6180, test_loss: 0.9867, test_f1: 0.6442
 epoch: 28, train_loss: 0.6051, test_loss: 1.0157, test_f1: 0.6241
 epoch: 29, train_loss: 0.6210, test_loss: 0.9998, test_f1: 0.6782
 epoch: 30, train_loss: 0.5698, test_loss: 1.1020, test_f1: 0.6188
 epoch: 31, train_loss: 0.5658, test_loss: 1.0609, test_f1: 0.6161
 epoch: 32, train_loss: 0.5704, test_loss: 1.0988, test_f1: 0.6224
 epoch: 33, train_loss: 0.5732, test_loss: 1.1265, test_f1: 0.6215
 epoch: 34, train_loss: 0.5739, test_loss: 1.0968, test_f1: 0.6139
 epoch: 35, train_loss: 0.5550, test_loss: 1.0882, test_f1: 0.6411
 epoch: 36, train_loss: 0.5321, test_loss: 1.1383, test_f1: 0.6147
 epoch: 37, train_loss: 0.5335, test_loss: 1.1559, test_f1: 0.6482
 epoch: 38, train_loss: 0.5251, test_loss: 1.1637, test_f1: 0.5967
 epoch: 39, train_loss: 0.5304, test_loss: 1.1854, test_f1: 0.5769
 epoch: 40, train_loss: 0.4958, test_loss: 1.3495, test_f1: 0.6410
 epoch: 41, train_loss: 0.5093, test_loss: 1.2350, test_f1: 0.6248
 epoch: 42, train_loss: 0.4848, test_loss: 1.2206, test_f1: 0.6207
 epoch: 43, train_loss: 0.4940, test_loss: 1.2628, test_f1: 0.6119
 epoch: 44, train_loss: 0.4924, test_loss: 1.2511, test_f1: 0.6386
 epoch: 45, train_loss: 0.4775, test_loss: 1.2486, test_f1: 0.6244
 epoch: 46, train_loss: 0.4426, test_loss: 1.2341, test_f1: 0.6264
 epoch: 47, train_loss: 0.4671, test_loss: 1.3701, test_f1: 0.6282
 epoch: 48, train_loss: 0.4518, test_loss: 1.2948, test_f1: 0.6019
 epoch: 49, train_loss: 0.4886, test_loss: 1.2700, test_f1: 0.6069
 epoch: 50, train_loss: 0.4826, test_loss: 1.3411, test_f1: 0.5845
 epoch: 51, train_loss: 0.4472, test_loss: 1.2916, test_f1: 0.6166
 epoch: 52, train_loss: 0.4219, test_loss: 1.2581, test_f1: 0.6195
 epoch: 53, train_loss: 0.3880, test_loss: 1.3339, test_f1: 0.6177
 epoch: 54, train_loss: 0.3980, test_loss: 1.3169, test_f1: 0.6315
 epoch: 55, train_loss: 0.3924, test_loss: 1.3536, test_f1: 0.6094
 epoch: 56, train_loss: 0.3773, test_loss: 1.3844, test_f1: 0.6088
 epoch: 57, train_loss: 0.3698, test_loss: 1.3194, test_f1: 0.6362
 epoch: 58, train_loss: 0.3721, test_loss: 1.3822, test_f1: 0.6216
 epoch: 59, train_loss: 0.3684, test_loss: 1.3962, test_f1: 0.6050
 epoch: 60, train_loss: 0.3865, test_loss: 1.4421, test_f1: 0.6331
 epoch: 61, train_loss: 0.3551, test_loss: 1.3903, test_f1: 0.6204
 epoch: 62, train_loss: 0.3724, test_loss: 1.4485, test_f1: 0.5916
 epoch: 63, train_loss: 0.3754, test_loss: 1.3900, test_f1: 0.6521
 epoch: 64, train_loss: 0.3497, test_loss: 1.3957, test_f1: 0.6473
 epoch: 65, train_loss: 0.3536, test_loss: 1.4801, test_f1: 0.6069
 epoch: 66, train_loss: 0.3451, test_loss: 1.4833, test_f1: 0.6044
 epoch: 67, train_loss: 0.3563, test_loss: 1.4747, test_f1: 0.6253
 epoch: 68, train_loss: 0.3388, test_loss: 1.4777, test_f1: 0.6324
 epoch: 69, train_loss: 0.3461, test_loss: 1.4470, test_f1: 0.6171
 epoch: 70, train_loss: 0.3460, test_loss: 1.4536, test_f1: 0.6041
 epoch: 71, train_loss: 0.3543, test_loss: 1.5363, test_f1: 0.6480
 epoch: 72, train_loss: 0.3573, test_loss: 1.5433, test_f1: 0.5979
 epoch: 73, train_loss: 0.3590, test_loss: 1.4676, test_f1: 0.6498
 epoch: 74, train_loss: 0.3189, test_loss: 1.5144, test_f1: 0.6208
 epoch: 75, train_loss: 0.3498, test_loss: 1.4760, test_f1: 0.6485
 epoch: 76, train_loss: 0.2925, test_loss: 1.4934, test_f1: 0.6412
 epoch: 77, train_loss: 0.3215, test_loss: 1.5735, test_f1: 0.6345
 epoch: 78, train_loss: 0.3379, test_loss: 1.5822, test_f1: 0.5921
 epoch: 79, train_loss: 0.3306, test_loss: 1.5268, test_f1: 0.6397
 epoch: 80, train_loss: 0.3064, test_loss: 1.5971, test_f1: 0.6077
 epoch: 81, train_loss: 0.3074, test_loss: 1.5722, test_f1: 0.6263
 epoch: 82, train_loss: 0.3084, test_loss: 1.5232, test_f1: 0.6362
 epoch: 83, train_loss: 0.3238, test_loss: 1.5412, test_f1: 0.6340
 epoch: 84, train_loss: 0.3133, test_loss: 1.6247, test_f1: 0.6291
 epoch: 85, train_loss: 0.3038, test_loss: 1.6507, test_f1: 0.6131
 epoch: 86, train_loss: 0.2954, test_loss: 1.7640, test_f1: 0.5938
 epoch: 87, train_loss: 0.3188, test_loss: 1.7528, test_f1: 0.5750
 epoch: 88, train_loss: 0.2961, test_loss: 1.5894, test_f1: 0.6173
 epoch: 89, train_loss: 0.2907, test_loss: 1.6640, test_f1: 0.6035
 epoch: 90, train_loss: 0.2823, test_loss: 1.6022, test_f1: 0.6154
 epoch: 91, train_loss: 0.2867, test_loss: 1.6461, test_f1: 0.6128
 epoch: 92, train_loss: 0.2960, test_loss: 1.6431, test_f1: 0.6295
 epoch: 93, train_loss: 0.2964, test_loss: 1.5934, test_f1: 0.6260
 epoch: 94, train_loss: 0.3034, test_loss: 1.7100, test_f1: 0.6203
 epoch: 95, train_loss: 0.3048, test_loss: 1.7296, test_f1: 0.5893
 epoch: 96, train_loss: 0.2693, test_loss: 1.7008, test_f1: 0.6097
 epoch: 97, train_loss: 0.2611, test_loss: 1.8082, test_f1: 0.5743
 epoch: 98, train_loss: 0.2504, test_loss: 1.7489, test_f1: 0.5969
 epoch: 99, train_loss: 0.2686, test_loss: 1.7777, test_f1: 0.6106
##################ITERATION #3 ****************************************
 epoch: 0, train_loss: 1.1186, test_loss: 1.4757, test_f1: 0.1021
 epoch: 1, train_loss: 1.0092, test_loss: 2.1992, test_f1: 0.1281
 epoch: 2, train_loss: 0.9943, test_loss: 1.1721, test_f1: 0.4189
 epoch: 3, train_loss: 0.9580, test_loss: 1.0559, test_f1: 0.5442
 epoch: 4, train_loss: 0.9355, test_loss: 1.0439, test_f1: 0.5449
 epoch: 5, train_loss: 0.9323, test_loss: 1.0372, test_f1: 0.5598
 epoch: 6, train_loss: 0.9033, test_loss: 1.0493, test_f1: 0.4997
 epoch: 7, train_loss: 0.9116, test_loss: 1.0500, test_f1: 0.5409
 epoch: 8, train_loss: 0.8853, test_loss: 1.0280, test_f1: 0.5318
 epoch: 9, train_loss: 0.8693, test_loss: 1.0775, test_f1: 0.5336
 epoch: 10, train_loss: 0.8635, test_loss: 1.0330, test_f1: 0.5384
 epoch: 11, train_loss: 0.8437, test_loss: 1.0399, test_f1: 0.5459
 epoch: 12, train_loss: 0.8536, test_loss: 1.0186, test_f1: 0.5103
 epoch: 13, train_loss: 0.8337, test_loss: 1.0485, test_f1: 0.5608
 epoch: 14, train_loss: 0.8125, test_loss: 1.0331, test_f1: 0.5296
 epoch: 15, train_loss: 0.8159, test_loss: 1.0016, test_f1: 0.5671
 epoch: 16, train_loss: 0.7956, test_loss: 1.0060, test_f1: 0.5654
 epoch: 17, train_loss: 0.7884, test_loss: 0.9936, test_f1: 0.5944
 epoch: 18, train_loss: 0.7755, test_loss: 1.0390, test_f1: 0.5819
 epoch: 19, train_loss: 0.7523, test_loss: 1.1007, test_f1: 0.5767
 epoch: 20, train_loss: 0.7427, test_loss: 1.0418, test_f1: 0.5481
 epoch: 21, train_loss: 0.7377, test_loss: 1.0942, test_f1: 0.5506
 epoch: 22, train_loss: 0.7333, test_loss: 1.0579, test_f1: 0.5709
 epoch: 23, train_loss: 0.6965, test_loss: 1.0680, test_f1: 0.5489
 epoch: 24, train_loss: 0.6968, test_loss: 1.0324, test_f1: 0.6008
 epoch: 25, train_loss: 0.7069, test_loss: 1.0743, test_f1: 0.6257
 epoch: 26, train_loss: 0.6833, test_loss: 1.1188, test_f1: 0.5478
 epoch: 27, train_loss: 0.6786, test_loss: 1.0393, test_f1: 0.5927
 epoch: 28, train_loss: 0.6586, test_loss: 1.1001, test_f1: 0.5875
 epoch: 29, train_loss: 0.6305, test_loss: 1.1729, test_f1: 0.5971
 epoch: 30, train_loss: 0.6588, test_loss: 1.1280, test_f1: 0.6105
 epoch: 31, train_loss: 0.6577, test_loss: 1.1267, test_f1: 0.5799
 epoch: 32, train_loss: 0.6218, test_loss: 1.1164, test_f1: 0.6077
 epoch: 33, train_loss: 0.5828, test_loss: 1.2204, test_f1: 0.5953
 epoch: 34, train_loss: 0.6024, test_loss: 1.2532, test_f1: 0.5359
 epoch: 35, train_loss: 0.5874, test_loss: 1.1831, test_f1: 0.6075
 epoch: 36, train_loss: 0.5760, test_loss: 1.1915, test_f1: 0.5892
 epoch: 37, train_loss: 0.5816, test_loss: 1.2161, test_f1: 0.6098
 epoch: 38, train_loss: 0.5736, test_loss: 1.3131, test_f1: 0.5921
 epoch: 39, train_loss: 0.5796, test_loss: 1.2253, test_f1: 0.5888
 epoch: 40, train_loss: 0.5806, test_loss: 1.2617, test_f1: 0.6026
 epoch: 41, train_loss: 0.5443, test_loss: 1.2248, test_f1: 0.6104
 epoch: 42, train_loss: 0.5251, test_loss: 1.2077, test_f1: 0.6230
 epoch: 43, train_loss: 0.5359, test_loss: 1.2654, test_f1: 0.5902
 epoch: 44, train_loss: 0.5171, test_loss: 1.2462, test_f1: 0.5960
 epoch: 45, train_loss: 0.5104, test_loss: 1.2616, test_f1: 0.6246
 epoch: 46, train_loss: 0.5219, test_loss: 1.2873, test_f1: 0.6045
 epoch: 47, train_loss: 0.5101, test_loss: 1.2956, test_f1: 0.6275
 epoch: 48, train_loss: 0.5339, test_loss: 1.3022, test_f1: 0.6117
 epoch: 49, train_loss: 0.4809, test_loss: 1.3337, test_f1: 0.5932
 epoch: 50, train_loss: 0.4813, test_loss: 1.3991, test_f1: 0.6315
 epoch: 51, train_loss: 0.4501, test_loss: 1.3671, test_f1: 0.6137
 epoch: 52, train_loss: 0.4431, test_loss: 1.3718, test_f1: 0.6047
 epoch: 53, train_loss: 0.4104, test_loss: 1.3163, test_f1: 0.5981
 epoch: 54, train_loss: 0.4101, test_loss: 1.3663, test_f1: 0.6159
 epoch: 55, train_loss: 0.4170, test_loss: 1.4251, test_f1: 0.6083
 epoch: 56, train_loss: 0.4144, test_loss: 1.3966, test_f1: 0.6211
 epoch: 57, train_loss: 0.3885, test_loss: 1.3783, test_f1: 0.6404
 epoch: 58, train_loss: 0.4141, test_loss: 1.4335, test_f1: 0.6306
 epoch: 59, train_loss: 0.3961, test_loss: 1.3718, test_f1: 0.6331
 epoch: 60, train_loss: 0.4163, test_loss: 1.4185, test_f1: 0.6054
 epoch: 61, train_loss: 0.3880, test_loss: 1.4985, test_f1: 0.6096
 epoch: 62, train_loss: 0.3785, test_loss: 1.3556, test_f1: 0.6271
 epoch: 63, train_loss: 0.4015, test_loss: 1.5477, test_f1: 0.5920
 epoch: 64, train_loss: 0.3728, test_loss: 1.3865, test_f1: 0.6263
 epoch: 65, train_loss: 0.3907, test_loss: 1.5206, test_f1: 0.6290
 epoch: 66, train_loss: 0.3906, test_loss: 1.6390, test_f1: 0.5975
 epoch: 67, train_loss: 0.3650, test_loss: 1.5570, test_f1: 0.6253
 epoch: 68, train_loss: 0.3769, test_loss: 1.5763, test_f1: 0.6245
 epoch: 69, train_loss: 0.3975, test_loss: 1.6014, test_f1: 0.6091
 epoch: 70, train_loss: 0.3774, test_loss: 1.5837, test_f1: 0.6183
 epoch: 71, train_loss: 0.3725, test_loss: 1.6271, test_f1: 0.6365
 epoch: 72, train_loss: 0.3448, test_loss: 1.6644, test_f1: 0.6202
 epoch: 73, train_loss: 0.3649, test_loss: 1.5288, test_f1: 0.6209
 epoch: 74, train_loss: 0.3568, test_loss: 1.6177, test_f1: 0.6212
 epoch: 75, train_loss: 0.3528, test_loss: 1.6968, test_f1: 0.6341
 epoch: 76, train_loss: 0.3427, test_loss: 1.6650, test_f1: 0.5895
 epoch: 77, train_loss: 0.3437, test_loss: 1.6571, test_f1: 0.6118
 epoch: 78, train_loss: 0.3335, test_loss: 1.6862, test_f1: 0.6267
 epoch: 79, train_loss: 0.3285, test_loss: 1.6551, test_f1: 0.6151
 epoch: 80, train_loss: 0.3431, test_loss: 1.7137, test_f1: 0.6052
 epoch: 81, train_loss: 0.3500, test_loss: 1.6231, test_f1: 0.6243
 epoch: 82, train_loss: 0.3339, test_loss: 1.9037, test_f1: 0.5932
 epoch: 83, train_loss: 0.3329, test_loss: 1.6139, test_f1: 0.6081
 epoch: 84, train_loss: 0.3352, test_loss: 1.7802, test_f1: 0.5979
 epoch: 85, train_loss: 0.3373, test_loss: 1.7365, test_f1: 0.6217
 epoch: 86, train_loss: 0.3267, test_loss: 1.7151, test_f1: 0.6129
 epoch: 87, train_loss: 0.3362, test_loss: 2.0616, test_f1: 0.5769
 epoch: 88, train_loss: 0.3310, test_loss: 1.9354, test_f1: 0.5852
 epoch: 89, train_loss: 0.3046, test_loss: 1.7156, test_f1: 0.6081
 epoch: 90, train_loss: 0.3297, test_loss: 1.9642, test_f1: 0.5805
 epoch: 91, train_loss: 0.3205, test_loss: 1.8559, test_f1: 0.5896
 epoch: 92, train_loss: 0.3130, test_loss: 1.7258, test_f1: 0.6116
 epoch: 93, train_loss: 0.3006, test_loss: 1.9816, test_f1: 0.5989
 epoch: 94, train_loss: 0.3006, test_loss: 1.7938, test_f1: 0.6277
 epoch: 95, train_loss: 0.3010, test_loss: 2.0278, test_f1: 0.5999
 epoch: 96, train_loss: 0.2976, test_loss: 1.6931, test_f1: 0.6386
 epoch: 97, train_loss: 0.2898, test_loss: 1.8406, test_f1: 0.6065
 epoch: 98, train_loss: 0.2911, test_loss: 2.1442, test_f1: 0.6009
 epoch: 99, train_loss: 0.3152, test_loss: 1.8387, test_f1: 0.6140
##################ITERATION #4 ****************************************
 epoch: 0, train_loss: 1.2838, test_loss: 1.3180, test_f1: 0.2281
 epoch: 1, train_loss: 1.0891, test_loss: 1.1870, test_f1: 0.3830
 epoch: 2, train_loss: 1.0357, test_loss: 1.1007, test_f1: 0.4903
 epoch: 3, train_loss: 0.9782, test_loss: 1.0854, test_f1: 0.4680
 epoch: 4, train_loss: 0.9767, test_loss: 1.0830, test_f1: 0.4888
 epoch: 5, train_loss: 0.9585, test_loss: 1.0473, test_f1: 0.5184
 epoch: 6, train_loss: 0.9398, test_loss: 1.0513, test_f1: 0.5215
 epoch: 7, train_loss: 0.9118, test_loss: 1.0437, test_f1: 0.5403
 epoch: 8, train_loss: 0.8943, test_loss: 1.0568, test_f1: 0.4756
 epoch: 9, train_loss: 0.8833, test_loss: 1.0353, test_f1: 0.4896
 epoch: 10, train_loss: 0.8844, test_loss: 1.0247, test_f1: 0.5427
 epoch: 11, train_loss: 0.8649, test_loss: 1.0475, test_f1: 0.5372
 epoch: 12, train_loss: 0.8573, test_loss: 1.0407, test_f1: 0.5288
 epoch: 13, train_loss: 0.8267, test_loss: 1.0581, test_f1: 0.5234
 epoch: 14, train_loss: 0.8315, test_loss: 0.9769, test_f1: 0.6005
 epoch: 15, train_loss: 0.8038, test_loss: 0.9883, test_f1: 0.5721
 epoch: 16, train_loss: 0.8075, test_loss: 0.9748, test_f1: 0.5564
 epoch: 17, train_loss: 0.7972, test_loss: 1.0250, test_f1: 0.5520
 epoch: 18, train_loss: 0.7730, test_loss: 1.0081, test_f1: 0.5916
 epoch: 19, train_loss: 0.7640, test_loss: 1.0202, test_f1: 0.5586
 epoch: 20, train_loss: 0.7577, test_loss: 1.0016, test_f1: 0.5930
 epoch: 21, train_loss: 0.7641, test_loss: 1.0457, test_f1: 0.5871
 epoch: 22, train_loss: 0.7330, test_loss: 1.0371, test_f1: 0.5541
 epoch: 23, train_loss: 0.7344, test_loss: 1.0054, test_f1: 0.5605
 epoch: 24, train_loss: 0.7304, test_loss: 1.0511, test_f1: 0.5192
 epoch: 25, train_loss: 0.7044, test_loss: 1.0940, test_f1: 0.5430
 epoch: 26, train_loss: 0.7254, test_loss: 1.1465, test_f1: 0.5002
 epoch: 27, train_loss: 0.7306, test_loss: 1.0272, test_f1: 0.5218
 epoch: 28, train_loss: 0.7236, test_loss: 1.0097, test_f1: 0.5600
 epoch: 29, train_loss: 0.7015, test_loss: 1.0717, test_f1: 0.5660
 epoch: 30, train_loss: 0.6780, test_loss: 1.0465, test_f1: 0.5612
 epoch: 31, train_loss: 0.6550, test_loss: 1.0824, test_f1: 0.5681
 epoch: 32, train_loss: 0.6749, test_loss: 1.1281, test_f1: 0.5529
 epoch: 33, train_loss: 0.6574, test_loss: 1.0390, test_f1: 0.6130
 epoch: 34, train_loss: 0.6493, test_loss: 1.1657, test_f1: 0.5058
 epoch: 35, train_loss: 0.6454, test_loss: 1.0645, test_f1: 0.5580
 epoch: 36, train_loss: 0.6473, test_loss: 1.0555, test_f1: 0.5763
 epoch: 37, train_loss: 0.6348, test_loss: 1.2165, test_f1: 0.5094
 epoch: 38, train_loss: 0.6367, test_loss: 1.1149, test_f1: 0.5742
 epoch: 39, train_loss: 0.6288, test_loss: 1.0868, test_f1: 0.5710
 epoch: 40, train_loss: 0.6231, test_loss: 1.2059, test_f1: 0.5759
 epoch: 41, train_loss: 0.5938, test_loss: 1.2173, test_f1: 0.5308
 epoch: 42, train_loss: 0.5964, test_loss: 1.1633, test_f1: 0.5641
 epoch: 43, train_loss: 0.6092, test_loss: 1.0574, test_f1: 0.6006
 epoch: 44, train_loss: 0.6148, test_loss: 1.1221, test_f1: 0.5865
 epoch: 45, train_loss: 0.5959, test_loss: 1.1170, test_f1: 0.5766
 epoch: 46, train_loss: 0.5742, test_loss: 1.1657, test_f1: 0.5609
 epoch: 47, train_loss: 0.5775, test_loss: 1.0992, test_f1: 0.6203
 epoch: 48, train_loss: 0.5607, test_loss: 1.2965, test_f1: 0.5655
 epoch: 49, train_loss: 0.5635, test_loss: 1.2195, test_f1: 0.6269
 epoch: 50, train_loss: 0.5482, test_loss: 1.1752, test_f1: 0.5800
 epoch: 51, train_loss: 0.5352, test_loss: 1.2009, test_f1: 0.5715
 epoch: 52, train_loss: 0.5008, test_loss: 1.1758, test_f1: 0.5997
 epoch: 53, train_loss: 0.5055, test_loss: 1.2664, test_f1: 0.5756
 epoch: 54, train_loss: 0.4836, test_loss: 1.2441, test_f1: 0.5904
 epoch: 55, train_loss: 0.5020, test_loss: 1.1893, test_f1: 0.6297
 epoch: 56, train_loss: 0.4867, test_loss: 1.2709, test_f1: 0.6266
 epoch: 57, train_loss: 0.4908, test_loss: 1.2410, test_f1: 0.6497
 epoch: 58, train_loss: 0.4745, test_loss: 1.1621, test_f1: 0.6026
 epoch: 59, train_loss: 0.4799, test_loss: 1.3435, test_f1: 0.5947
 epoch: 60, train_loss: 0.4763, test_loss: 1.2117, test_f1: 0.6215
 epoch: 61, train_loss: 0.4756, test_loss: 1.2674, test_f1: 0.6364
 epoch: 62, train_loss: 0.4488, test_loss: 1.2742, test_f1: 0.5868
 epoch: 63, train_loss: 0.4474, test_loss: 1.2336, test_f1: 0.6170
 epoch: 64, train_loss: 0.4751, test_loss: 1.2732, test_f1: 0.6042
 epoch: 65, train_loss: 0.4454, test_loss: 1.3015, test_f1: 0.6064
 epoch: 66, train_loss: 0.4465, test_loss: 1.4058, test_f1: 0.5726
 epoch: 67, train_loss: 0.4226, test_loss: 1.3029, test_f1: 0.6437
 epoch: 68, train_loss: 0.4263, test_loss: 1.2852, test_f1: 0.6628
 epoch: 69, train_loss: 0.4201, test_loss: 1.2481, test_f1: 0.6721
 epoch: 70, train_loss: 0.4344, test_loss: 1.5271, test_f1: 0.5923
 epoch: 71, train_loss: 0.4342, test_loss: 1.4356, test_f1: 0.6217
 epoch: 72, train_loss: 0.4384, test_loss: 1.3098, test_f1: 0.6437
 epoch: 73, train_loss: 0.4111, test_loss: 1.3516, test_f1: 0.6365
 epoch: 74, train_loss: 0.4144, test_loss: 1.5179, test_f1: 0.5627
 epoch: 75, train_loss: 0.4236, test_loss: 1.4214, test_f1: 0.6178
 epoch: 76, train_loss: 0.4203, test_loss: 1.3844, test_f1: 0.6125
 epoch: 77, train_loss: 0.3892, test_loss: 1.3389, test_f1: 0.6441
 epoch: 78, train_loss: 0.4089, test_loss: 1.4141, test_f1: 0.6116
 epoch: 79, train_loss: 0.3896, test_loss: 1.3401, test_f1: 0.6353
 epoch: 80, train_loss: 0.4156, test_loss: 1.3807, test_f1: 0.6144
 epoch: 81, train_loss: 0.4002, test_loss: 1.5222, test_f1: 0.5861
 epoch: 82, train_loss: 0.3838, test_loss: 1.5237, test_f1: 0.6084
 epoch: 83, train_loss: 0.4210, test_loss: 1.5752, test_f1: 0.5901
 epoch: 84, train_loss: 0.4100, test_loss: 1.4609, test_f1: 0.6578
 epoch: 85, train_loss: 0.3878, test_loss: 1.4347, test_f1: 0.6150
 epoch: 86, train_loss: 0.3895, test_loss: 1.5202, test_f1: 0.5909
 epoch: 87, train_loss: 0.4008, test_loss: 1.6385, test_f1: 0.5941
 epoch: 88, train_loss: 0.3782, test_loss: 1.5475, test_f1: 0.6089
 epoch: 89, train_loss: 0.3800, test_loss: 1.5380, test_f1: 0.6343
 epoch: 90, train_loss: 0.3767, test_loss: 1.5141, test_f1: 0.5929
 epoch: 91, train_loss: 0.3764, test_loss: 1.5181, test_f1: 0.6278
 epoch: 92, train_loss: 0.3349, test_loss: 1.5091, test_f1: 0.6351
 epoch: 93, train_loss: 0.3610, test_loss: 1.6350, test_f1: 0.6033
 epoch: 94, train_loss: 0.3576, test_loss: 1.5427, test_f1: 0.5972
 epoch: 95, train_loss: 0.3390, test_loss: 1.4086, test_f1: 0.6151
 epoch: 96, train_loss: 0.3577, test_loss: 1.4624, test_f1: 0.6288
 epoch: 97, train_loss: 0.3742, test_loss: 1.5444, test_f1: 0.5944
 epoch: 98, train_loss: 0.3452, test_loss: 1.4961, test_f1: 0.6064
 epoch: 99, train_loss: 0.3467, test_loss: 1.4237, test_f1: 0.6713
##################ITERATION #5 ****************************************
 epoch: 0, train_loss: 1.2882, test_loss: 1.6455, test_f1: 0.1365
 epoch: 1, train_loss: 1.0547, test_loss: 1.1611, test_f1: 0.3668
 epoch: 2, train_loss: 0.9881, test_loss: 1.0867, test_f1: 0.4930
 epoch: 3, train_loss: 0.9496, test_loss: 1.0111, test_f1: 0.5700
 epoch: 4, train_loss: 0.9452, test_loss: 1.0269, test_f1: 0.5279
 epoch: 5, train_loss: 0.9117, test_loss: 1.0034, test_f1: 0.5396
 epoch: 6, train_loss: 0.9094, test_loss: 1.0100, test_f1: 0.5489
 epoch: 7, train_loss: 0.8856, test_loss: 0.9989, test_f1: 0.5618
 epoch: 8, train_loss: 0.8561, test_loss: 0.9851, test_f1: 0.5669
 epoch: 9, train_loss: 0.8532, test_loss: 0.9860, test_f1: 0.5383
 epoch: 10, train_loss: 0.8357, test_loss: 1.0111, test_f1: 0.5297
 epoch: 11, train_loss: 0.8256, test_loss: 0.9950, test_f1: 0.5814
 epoch: 12, train_loss: 0.8261, test_loss: 1.0015, test_f1: 0.5568
 epoch: 13, train_loss: 0.7906, test_loss: 0.9548, test_f1: 0.5718
 epoch: 14, train_loss: 0.7930, test_loss: 0.9841, test_f1: 0.5714
 epoch: 15, train_loss: 0.7593, test_loss: 1.0069, test_f1: 0.5520
 epoch: 16, train_loss: 0.7646, test_loss: 1.0217, test_f1: 0.5734
 epoch: 17, train_loss: 0.7652, test_loss: 0.9876, test_f1: 0.5634
 epoch: 18, train_loss: 0.7686, test_loss: 1.0409, test_f1: 0.5259
 epoch: 19, train_loss: 0.7189, test_loss: 1.0272, test_f1: 0.6037
 epoch: 20, train_loss: 0.7224, test_loss: 1.0362, test_f1: 0.5583
 epoch: 21, train_loss: 0.7228, test_loss: 0.9793, test_f1: 0.6187
 epoch: 22, train_loss: 0.6918, test_loss: 1.0282, test_f1: 0.5645
 epoch: 23, train_loss: 0.7005, test_loss: 1.0347, test_f1: 0.6114
 epoch: 24, train_loss: 0.6861, test_loss: 1.0304, test_f1: 0.6111
 epoch: 25, train_loss: 0.6744, test_loss: 1.1932, test_f1: 0.5276
 epoch: 26, train_loss: 0.6762, test_loss: 1.0361, test_f1: 0.6055
 epoch: 27, train_loss: 0.6753, test_loss: 1.0510, test_f1: 0.5821
 epoch: 28, train_loss: 0.6223, test_loss: 1.0549, test_f1: 0.5759
 epoch: 29, train_loss: 0.6370, test_loss: 1.0811, test_f1: 0.6270
 epoch: 30, train_loss: 0.6279, test_loss: 1.0961, test_f1: 0.6097
 epoch: 31, train_loss: 0.6263, test_loss: 1.0970, test_f1: 0.6011
 epoch: 32, train_loss: 0.6391, test_loss: 1.0589, test_f1: 0.6328
 epoch: 33, train_loss: 0.6573, test_loss: 1.1086, test_f1: 0.5696
 epoch: 34, train_loss: 0.6298, test_loss: 1.0706, test_f1: 0.6392
 epoch: 35, train_loss: 0.6103, test_loss: 1.0592, test_f1: 0.5657
 epoch: 36, train_loss: 0.5821, test_loss: 1.0863, test_f1: 0.5928
 epoch: 37, train_loss: 0.5576, test_loss: 1.0779, test_f1: 0.5701
 epoch: 38, train_loss: 0.5687, test_loss: 1.3462, test_f1: 0.5756
 epoch: 39, train_loss: 0.5551, test_loss: 1.1303, test_f1: 0.5894
 epoch: 40, train_loss: 0.5703, test_loss: 1.1616, test_f1: 0.5975
 epoch: 41, train_loss: 0.5464, test_loss: 1.1066, test_f1: 0.6056
 epoch: 42, train_loss: 0.5403, test_loss: 1.1155, test_f1: 0.6144
 epoch: 43, train_loss: 0.5163, test_loss: 1.2843, test_f1: 0.5576
 epoch: 44, train_loss: 0.5333, test_loss: 1.1246, test_f1: 0.5864
 epoch: 45, train_loss: 0.5407, test_loss: 1.3398, test_f1: 0.5974
 epoch: 46, train_loss: 0.5405, test_loss: 1.0687, test_f1: 0.5896
 epoch: 47, train_loss: 0.5191, test_loss: 1.3166, test_f1: 0.5758
 epoch: 48, train_loss: 0.5127, test_loss: 1.1915, test_f1: 0.6094
 epoch: 49, train_loss: 0.5003, test_loss: 1.2098, test_f1: 0.6468
 epoch: 50, train_loss: 0.4946, test_loss: 1.1592, test_f1: 0.6356
 epoch: 51, train_loss: 0.4807, test_loss: 1.1048, test_f1: 0.6166
 epoch: 52, train_loss: 0.4598, test_loss: 1.2572, test_f1: 0.5982
 epoch: 53, train_loss: 0.4726, test_loss: 1.1355, test_f1: 0.6277
 epoch: 54, train_loss: 0.4370, test_loss: 1.1657, test_f1: 0.6082
 epoch: 55, train_loss: 0.4414, test_loss: 1.2246, test_f1: 0.6030
 epoch: 56, train_loss: 0.4240, test_loss: 1.2818, test_f1: 0.6194
 epoch: 57, train_loss: 0.4428, test_loss: 1.2557, test_f1: 0.5971
 epoch: 58, train_loss: 0.4345, test_loss: 1.3341, test_f1: 0.6159
 epoch: 59, train_loss: 0.4102, test_loss: 1.2636, test_f1: 0.6017
 epoch: 60, train_loss: 0.4350, test_loss: 1.2801, test_f1: 0.6062
 epoch: 61, train_loss: 0.3997, test_loss: 1.2899, test_f1: 0.5637
 epoch: 62, train_loss: 0.4151, test_loss: 1.2629, test_f1: 0.6218
 epoch: 63, train_loss: 0.3908, test_loss: 1.2702, test_f1: 0.6667
 epoch: 64, train_loss: 0.4195, test_loss: 1.2552, test_f1: 0.6310
 epoch: 65, train_loss: 0.4173, test_loss: 1.2373, test_f1: 0.5840
 epoch: 66, train_loss: 0.4227, test_loss: 1.2728, test_f1: 0.6462
 epoch: 67, train_loss: 0.3999, test_loss: 1.4167, test_f1: 0.5944
 epoch: 68, train_loss: 0.3712, test_loss: 1.4224, test_f1: 0.5997
 epoch: 69, train_loss: 0.4066, test_loss: 1.4664, test_f1: 0.6062
 epoch: 70, train_loss: 0.4084, test_loss: 1.2600, test_f1: 0.6277
 epoch: 71, train_loss: 0.3927, test_loss: 1.3369, test_f1: 0.5989
 epoch: 72, train_loss: 0.3808, test_loss: 1.2195, test_f1: 0.6380
 epoch: 73, train_loss: 0.3791, test_loss: 1.3371, test_f1: 0.6016
 epoch: 74, train_loss: 0.3700, test_loss: 1.2179, test_f1: 0.6604
 epoch: 75, train_loss: 0.3751, test_loss: 1.4015, test_f1: 0.6137
 epoch: 76, train_loss: 0.3727, test_loss: 1.2843, test_f1: 0.6635
 epoch: 77, train_loss: 0.3796, test_loss: 1.3259, test_f1: 0.6018
 epoch: 78, train_loss: 0.3681, test_loss: 1.4086, test_f1: 0.6278
 epoch: 79, train_loss: 0.3734, test_loss: 1.2906, test_f1: 0.6208
 epoch: 80, train_loss: 0.3540, test_loss: 1.4153, test_f1: 0.5992
 epoch: 81, train_loss: 0.3654, test_loss: 1.3520, test_f1: 0.6048
 epoch: 82, train_loss: 0.3626, test_loss: 1.3972, test_f1: 0.5940
 epoch: 83, train_loss: 0.3829, test_loss: 1.4413, test_f1: 0.5870
 epoch: 84, train_loss: 0.3374, test_loss: 1.3717, test_f1: 0.6092
 epoch: 85, train_loss: 0.3765, test_loss: 1.3014, test_f1: 0.6323
 epoch: 86, train_loss: 0.3668, test_loss: 1.2409, test_f1: 0.6662
 epoch: 87, train_loss: 0.3197, test_loss: 1.3275, test_f1: 0.6545
 epoch: 88, train_loss: 0.3349, test_loss: 1.3727, test_f1: 0.6150
 epoch: 89, train_loss: 0.3656, test_loss: 1.3200, test_f1: 0.6410
 epoch: 90, train_loss: 0.3415, test_loss: 1.3224, test_f1: 0.6459
 epoch: 91, train_loss: 0.3341, test_loss: 1.4361, test_f1: 0.5989
 epoch: 92, train_loss: 0.3328, test_loss: 1.4968, test_f1: 0.6429
 epoch: 93, train_loss: 0.3306, test_loss: 1.3678, test_f1: 0.6351
 epoch: 94, train_loss: 0.3365, test_loss: 1.3706, test_f1: 0.6149
 epoch: 95, train_loss: 0.3333, test_loss: 1.3516, test_f1: 0.6283
 epoch: 96, train_loss: 0.3312, test_loss: 1.4293, test_f1: 0.6227
 epoch: 97, train_loss: 0.3297, test_loss: 1.3308, test_f1: 0.6099
 epoch: 98, train_loss: 0.3384, test_loss: 1.3729, test_f1: 0.6389
 epoch: 99, train_loss: 0.3263, test_loss: 1.4345, test_f1: 0.6430
##################ITERATION #6 ****************************************
 epoch: 0, train_loss: 1.3309, test_loss: 1.3334, test_f1: 0.1365
 epoch: 1, train_loss: 1.0802, test_loss: 1.2790, test_f1: 0.3484
 epoch: 2, train_loss: 1.0129, test_loss: 1.0811, test_f1: 0.5051
 epoch: 3, train_loss: 0.9741, test_loss: 1.0629, test_f1: 0.5687
 epoch: 4, train_loss: 0.9434, test_loss: 1.0631, test_f1: 0.5300
 epoch: 5, train_loss: 0.8968, test_loss: 1.0955, test_f1: 0.5276
 epoch: 6, train_loss: 0.8952, test_loss: 1.0759, test_f1: 0.5147
 epoch: 7, train_loss: 0.8646, test_loss: 1.0111, test_f1: 0.5653
 epoch: 8, train_loss: 0.8511, test_loss: 1.0150, test_f1: 0.5863
 epoch: 9, train_loss: 0.8442, test_loss: 1.0149, test_f1: 0.5814
 epoch: 10, train_loss: 0.8139, test_loss: 1.0207, test_f1: 0.6082
 epoch: 11, train_loss: 0.8108, test_loss: 1.0078, test_f1: 0.5533
 epoch: 12, train_loss: 0.8060, test_loss: 1.0362, test_f1: 0.6055
 epoch: 13, train_loss: 0.7795, test_loss: 1.0426, test_f1: 0.6232
 epoch: 14, train_loss: 0.7602, test_loss: 1.0210, test_f1: 0.6108
 epoch: 15, train_loss: 0.7501, test_loss: 0.9827, test_f1: 0.6121
 epoch: 16, train_loss: 0.7266, test_loss: 0.9984, test_f1: 0.6334
 epoch: 17, train_loss: 0.7294, test_loss: 1.0155, test_f1: 0.6045
 epoch: 18, train_loss: 0.6988, test_loss: 0.9841, test_f1: 0.6316
 epoch: 19, train_loss: 0.7223, test_loss: 1.0324, test_f1: 0.5930
 epoch: 20, train_loss: 0.6848, test_loss: 1.0299, test_f1: 0.5856
 epoch: 21, train_loss: 0.6889, test_loss: 1.0454, test_f1: 0.5981
 epoch: 22, train_loss: 0.6647, test_loss: 1.0627, test_f1: 0.6144
 epoch: 23, train_loss: 0.6721, test_loss: 1.0885, test_f1: 0.5657
 epoch: 24, train_loss: 0.6555, test_loss: 1.1562, test_f1: 0.5775
 epoch: 25, train_loss: 0.6382, test_loss: 1.0931, test_f1: 0.5648
 epoch: 26, train_loss: 0.6275, test_loss: 1.1441, test_f1: 0.5580
 epoch: 27, train_loss: 0.6370, test_loss: 1.1325, test_f1: 0.6119
 epoch: 28, train_loss: 0.5985, test_loss: 1.1244, test_f1: 0.6082
 epoch: 29, train_loss: 0.5967, test_loss: 1.2008, test_f1: 0.5971
 epoch: 30, train_loss: 0.5779, test_loss: 1.1928, test_f1: 0.6040
 epoch: 31, train_loss: 0.5909, test_loss: 1.1442, test_f1: 0.6387
 epoch: 32, train_loss: 0.5590, test_loss: 1.2304, test_f1: 0.6243
 epoch: 33, train_loss: 0.5728, test_loss: 1.1737, test_f1: 0.5896
 epoch: 34, train_loss: 0.5559, test_loss: 1.1668, test_f1: 0.6119
 epoch: 35, train_loss: 0.5337, test_loss: 1.2845, test_f1: 0.5785
 epoch: 36, train_loss: 0.5422, test_loss: 1.2708, test_f1: 0.6018
 epoch: 37, train_loss: 0.5285, test_loss: 1.2933, test_f1: 0.5775
 epoch: 38, train_loss: 0.5218, test_loss: 1.2221, test_f1: 0.6288
 epoch: 39, train_loss: 0.5417, test_loss: 1.2793, test_f1: 0.5987
 epoch: 40, train_loss: 0.4876, test_loss: 1.2796, test_f1: 0.6069
 epoch: 41, train_loss: 0.5134, test_loss: 1.3344, test_f1: 0.6074
 epoch: 42, train_loss: 0.4837, test_loss: 1.3194, test_f1: 0.6413
 epoch: 43, train_loss: 0.4772, test_loss: 1.3639, test_f1: 0.5725
 epoch: 44, train_loss: 0.4928, test_loss: 1.4812, test_f1: 0.6160
 epoch: 45, train_loss: 0.4894, test_loss: 1.4897, test_f1: 0.6110
 epoch: 46, train_loss: 0.4549, test_loss: 1.4962, test_f1: 0.6126
 epoch: 47, train_loss: 0.4721, test_loss: 1.4406, test_f1: 0.5573
 epoch: 48, train_loss: 0.4832, test_loss: 1.5340, test_f1: 0.5886
 epoch: 49, train_loss: 0.4577, test_loss: 1.4612, test_f1: 0.6207
 epoch: 50, train_loss: 0.4500, test_loss: 1.5688, test_f1: 0.6263
 epoch: 51, train_loss: 0.4127, test_loss: 1.4925, test_f1: 0.5863
 epoch: 52, train_loss: 0.3903, test_loss: 1.5243, test_f1: 0.5883
 epoch: 53, train_loss: 0.3873, test_loss: 1.5526, test_f1: 0.5774
 epoch: 54, train_loss: 0.3991, test_loss: 1.5713, test_f1: 0.5845
 epoch: 55, train_loss: 0.3633, test_loss: 1.5970, test_f1: 0.6041
 epoch: 56, train_loss: 0.3627, test_loss: 1.5609, test_f1: 0.6150
 epoch: 57, train_loss: 0.3592, test_loss: 1.5630, test_f1: 0.5798
 epoch: 58, train_loss: 0.3522, test_loss: 1.7016, test_f1: 0.5700
 epoch: 59, train_loss: 0.3364, test_loss: 1.6722, test_f1: 0.5988
 epoch: 60, train_loss: 0.3637, test_loss: 1.6333, test_f1: 0.5747
 epoch: 61, train_loss: 0.3436, test_loss: 1.7482, test_f1: 0.5722
 epoch: 62, train_loss: 0.3559, test_loss: 1.7348, test_f1: 0.5717
 epoch: 63, train_loss: 0.3409, test_loss: 1.7984, test_f1: 0.5811
 epoch: 64, train_loss: 0.3304, test_loss: 1.7675, test_f1: 0.5638
 epoch: 65, train_loss: 0.3289, test_loss: 1.7662, test_f1: 0.5775
 epoch: 66, train_loss: 0.3552, test_loss: 1.7459, test_f1: 0.5875
 epoch: 67, train_loss: 0.3266, test_loss: 1.7804, test_f1: 0.5898
 epoch: 68, train_loss: 0.3259, test_loss: 1.7451, test_f1: 0.5784
 epoch: 69, train_loss: 0.3199, test_loss: 2.0067, test_f1: 0.5863
 epoch: 70, train_loss: 0.3188, test_loss: 1.8512, test_f1: 0.5702
 epoch: 71, train_loss: 0.3235, test_loss: 1.8238, test_f1: 0.6005
 epoch: 72, train_loss: 0.3205, test_loss: 1.9247, test_f1: 0.5663
 epoch: 73, train_loss: 0.3025, test_loss: 1.8554, test_f1: 0.5968
 epoch: 74, train_loss: 0.3172, test_loss: 1.8677, test_f1: 0.5919
 epoch: 75, train_loss: 0.3101, test_loss: 1.9481, test_f1: 0.5801
 epoch: 76, train_loss: 0.3128, test_loss: 1.8727, test_f1: 0.5970
 epoch: 77, train_loss: 0.3181, test_loss: 1.9333, test_f1: 0.5866
 epoch: 78, train_loss: 0.2870, test_loss: 1.9364, test_f1: 0.5919
 epoch: 79, train_loss: 0.3120, test_loss: 2.0251, test_f1: 0.5578
 epoch: 80, train_loss: 0.3135, test_loss: 1.9684, test_f1: 0.5873
 epoch: 81, train_loss: 0.2713, test_loss: 1.9758, test_f1: 0.5989
 epoch: 82, train_loss: 0.3097, test_loss: 2.0593, test_f1: 0.5782
 epoch: 83, train_loss: 0.3265, test_loss: 1.9724, test_f1: 0.5944
 epoch: 84, train_loss: 0.2782, test_loss: 1.9660, test_f1: 0.6096
 epoch: 85, train_loss: 0.2795, test_loss: 2.0559, test_f1: 0.5773
 epoch: 86, train_loss: 0.3029, test_loss: 2.0385, test_f1: 0.5666
 epoch: 87, train_loss: 0.2857, test_loss: 2.0770, test_f1: 0.5899
 epoch: 88, train_loss: 0.2611, test_loss: 2.1100, test_f1: 0.5912
 epoch: 89, train_loss: 0.2653, test_loss: 2.1402, test_f1: 0.5733
 epoch: 90, train_loss: 0.2712, test_loss: 2.0306, test_f1: 0.6005
 epoch: 91, train_loss: 0.2575, test_loss: 2.1197, test_f1: 0.5638
 epoch: 92, train_loss: 0.2722, test_loss: 2.1053, test_f1: 0.5656
 epoch: 93, train_loss: 0.2625, test_loss: 2.0894, test_f1: 0.5714
 epoch: 94, train_loss: 0.2664, test_loss: 2.0473, test_f1: 0.6002
 epoch: 95, train_loss: 0.2642, test_loss: 2.1971, test_f1: 0.5979
 epoch: 96, train_loss: 0.2551, test_loss: 2.2385, test_f1: 0.5849
 epoch: 97, train_loss: 0.2632, test_loss: 2.2321, test_f1: 0.5966
 epoch: 98, train_loss: 0.2631, test_loss: 2.1516, test_f1: 0.5773
 epoch: 99, train_loss: 0.2596, test_loss: 2.2034, test_f1: 0.5977
##################ITERATION #7 ****************************************
 epoch: 0, train_loss: 1.4289, test_loss: 1.4234, test_f1: 0.3377
 epoch: 1, train_loss: 1.1053, test_loss: 1.3342, test_f1: 0.3684
 epoch: 2, train_loss: 1.0461, test_loss: 1.0660, test_f1: 0.4893
 epoch: 3, train_loss: 0.9915, test_loss: 1.0954, test_f1: 0.5216
 epoch: 4, train_loss: 0.9731, test_loss: 1.0612, test_f1: 0.5291
 epoch: 5, train_loss: 0.9313, test_loss: 1.0702, test_f1: 0.5273
 epoch: 6, train_loss: 0.9065, test_loss: 1.0600, test_f1: 0.5417
 epoch: 7, train_loss: 0.9073, test_loss: 1.0173, test_f1: 0.5096
 epoch: 8, train_loss: 0.8961, test_loss: 1.0549, test_f1: 0.5572
 epoch: 9, train_loss: 0.8667, test_loss: 1.0633, test_f1: 0.5605
 epoch: 10, train_loss: 0.8611, test_loss: 1.0644, test_f1: 0.5602
 epoch: 11, train_loss: 0.8407, test_loss: 1.0402, test_f1: 0.5736
 epoch: 12, train_loss: 0.8281, test_loss: 1.0365, test_f1: 0.5807
 epoch: 13, train_loss: 0.8069, test_loss: 1.1023, test_f1: 0.5236
 epoch: 14, train_loss: 0.8016, test_loss: 1.0429, test_f1: 0.5676
 epoch: 15, train_loss: 0.7773, test_loss: 1.0750, test_f1: 0.5473
 epoch: 16, train_loss: 0.7666, test_loss: 1.0403, test_f1: 0.5706
 epoch: 17, train_loss: 0.7637, test_loss: 1.0417, test_f1: 0.5933
 epoch: 18, train_loss: 0.7527, test_loss: 0.9940, test_f1: 0.5958
 epoch: 19, train_loss: 0.7692, test_loss: 1.0304, test_f1: 0.5420
 epoch: 20, train_loss: 0.7422, test_loss: 1.0719, test_f1: 0.5625
 epoch: 21, train_loss: 0.7308, test_loss: 1.0501, test_f1: 0.6042
 epoch: 22, train_loss: 0.6998, test_loss: 1.0276, test_f1: 0.6054
 epoch: 23, train_loss: 0.7066, test_loss: 1.0508, test_f1: 0.6202
 epoch: 24, train_loss: 0.6831, test_loss: 1.0864, test_f1: 0.5724
 epoch: 25, train_loss: 0.6852, test_loss: 1.0856, test_f1: 0.5701
 epoch: 26, train_loss: 0.6997, test_loss: 1.0086, test_f1: 0.6236
 epoch: 27, train_loss: 0.6881, test_loss: 1.1119, test_f1: 0.5819
 epoch: 28, train_loss: 0.6578, test_loss: 1.0431, test_f1: 0.6140
 epoch: 29, train_loss: 0.6517, test_loss: 1.0329, test_f1: 0.6161
 epoch: 30, train_loss: 0.6407, test_loss: 1.1225, test_f1: 0.5997
 epoch: 31, train_loss: 0.6167, test_loss: 1.1230, test_f1: 0.5733
 epoch: 32, train_loss: 0.6184, test_loss: 1.0391, test_f1: 0.6067
 epoch: 33, train_loss: 0.6142, test_loss: 1.1550, test_f1: 0.5896
 epoch: 34, train_loss: 0.6226, test_loss: 1.2154, test_f1: 0.5461
 epoch: 35, train_loss: 0.6123, test_loss: 1.1773, test_f1: 0.5570
 epoch: 36, train_loss: 0.6100, test_loss: 1.1443, test_f1: 0.5874
 epoch: 37, train_loss: 0.5938, test_loss: 1.1155, test_f1: 0.6207
 epoch: 38, train_loss: 0.5741, test_loss: 1.1267, test_f1: 0.6037
 epoch: 39, train_loss: 0.5776, test_loss: 1.2829, test_f1: 0.5232
 epoch: 40, train_loss: 0.5935, test_loss: 1.2295, test_f1: 0.5992
 epoch: 41, train_loss: 0.5743, test_loss: 1.2011, test_f1: 0.5909
 epoch: 42, train_loss: 0.5770, test_loss: 1.1097, test_f1: 0.5904
 epoch: 43, train_loss: 0.5537, test_loss: 1.3022, test_f1: 0.5372
 epoch: 44, train_loss: 0.5573, test_loss: 1.1955, test_f1: 0.5862
 epoch: 45, train_loss: 0.5386, test_loss: 1.1300, test_f1: 0.6217
 epoch: 46, train_loss: 0.5629, test_loss: 1.2270, test_f1: 0.6158
 epoch: 47, train_loss: 0.5296, test_loss: 1.1882, test_f1: 0.5939
 epoch: 48, train_loss: 0.5361, test_loss: 1.2338, test_f1: 0.5811
 epoch: 49, train_loss: 0.5095, test_loss: 1.2028, test_f1: 0.6105
 epoch: 50, train_loss: 0.4990, test_loss: 1.2261, test_f1: 0.6086
 epoch: 51, train_loss: 0.4327, test_loss: 1.2470, test_f1: 0.6270
 epoch: 52, train_loss: 0.4512, test_loss: 1.2511, test_f1: 0.6103
 epoch: 53, train_loss: 0.4457, test_loss: 1.2242, test_f1: 0.6291
 epoch: 54, train_loss: 0.4290, test_loss: 1.3067, test_f1: 0.5991
 epoch: 55, train_loss: 0.4182, test_loss: 1.2947, test_f1: 0.6058
 epoch: 56, train_loss: 0.4329, test_loss: 1.3477, test_f1: 0.5717
 epoch: 57, train_loss: 0.4502, test_loss: 1.3071, test_f1: 0.5858
 epoch: 58, train_loss: 0.4373, test_loss: 1.2519, test_f1: 0.6215
 epoch: 59, train_loss: 0.4184, test_loss: 1.3744, test_f1: 0.5789
 epoch: 60, train_loss: 0.4040, test_loss: 1.3272, test_f1: 0.6114
 epoch: 61, train_loss: 0.4119, test_loss: 1.4550, test_f1: 0.5844
 epoch: 62, train_loss: 0.4134, test_loss: 1.3320, test_f1: 0.6124
 epoch: 63, train_loss: 0.3882, test_loss: 1.4580, test_f1: 0.5694
 epoch: 64, train_loss: 0.4395, test_loss: 1.4547, test_f1: 0.5839
 epoch: 65, train_loss: 0.4101, test_loss: 1.4161, test_f1: 0.5806
 epoch: 66, train_loss: 0.3990, test_loss: 1.3773, test_f1: 0.6165
 epoch: 67, train_loss: 0.3995, test_loss: 1.3748, test_f1: 0.5908
 epoch: 68, train_loss: 0.4000, test_loss: 1.3702, test_f1: 0.6340
 epoch: 69, train_loss: 0.3924, test_loss: 1.4650, test_f1: 0.5743
 epoch: 70, train_loss: 0.4027, test_loss: 1.4447, test_f1: 0.5772
 epoch: 71, train_loss: 0.3831, test_loss: 1.4616, test_f1: 0.5766
 epoch: 72, train_loss: 0.3901, test_loss: 1.4269, test_f1: 0.5770
 epoch: 73, train_loss: 0.3869, test_loss: 1.6004, test_f1: 0.5886
 epoch: 74, train_loss: 0.3668, test_loss: 1.4382, test_f1: 0.6138
 epoch: 75, train_loss: 0.3696, test_loss: 1.6235, test_f1: 0.5771
 epoch: 76, train_loss: 0.3634, test_loss: 1.5597, test_f1: 0.5914
 epoch: 77, train_loss: 0.3649, test_loss: 1.6383, test_f1: 0.5877
 epoch: 78, train_loss: 0.3452, test_loss: 1.5187, test_f1: 0.6046
 epoch: 79, train_loss: 0.3660, test_loss: 1.5743, test_f1: 0.5847
 epoch: 80, train_loss: 0.3519, test_loss: 1.5227, test_f1: 0.6050
 epoch: 81, train_loss: 0.3711, test_loss: 1.5703, test_f1: 0.5831
 epoch: 82, train_loss: 0.3390, test_loss: 1.6218, test_f1: 0.5341
 epoch: 83, train_loss: 0.3766, test_loss: 1.4175, test_f1: 0.6317
 epoch: 84, train_loss: 0.3537, test_loss: 1.4737, test_f1: 0.6205
 epoch: 85, train_loss: 0.3459, test_loss: 1.6685, test_f1: 0.6031
 epoch: 86, train_loss: 0.3206, test_loss: 1.5534, test_f1: 0.6228
 epoch: 87, train_loss: 0.3409, test_loss: 1.5840, test_f1: 0.5990
 epoch: 88, train_loss: 0.3486, test_loss: 1.4578, test_f1: 0.6374
 epoch: 89, train_loss: 0.3284, test_loss: 1.6997, test_f1: 0.5592
 epoch: 90, train_loss: 0.3190, test_loss: 1.7964, test_f1: 0.5622
 epoch: 91, train_loss: 0.3204, test_loss: 1.4953, test_f1: 0.6305
 epoch: 92, train_loss: 0.3162, test_loss: 1.7093, test_f1: 0.5688
 epoch: 93, train_loss: 0.3161, test_loss: 1.5285, test_f1: 0.6335
 epoch: 94, train_loss: 0.3290, test_loss: 1.7484, test_f1: 0.5857
 epoch: 95, train_loss: 0.3218, test_loss: 1.8548, test_f1: 0.5479
 epoch: 96, train_loss: 0.3433, test_loss: 1.8875, test_f1: 0.5644
 epoch: 97, train_loss: 0.3439, test_loss: 1.5003, test_f1: 0.6419
 epoch: 98, train_loss: 0.3202, test_loss: 1.7672, test_f1: 0.5790
 epoch: 99, train_loss: 0.3195, test_loss: 1.6783, test_f1: 0.6069
##################ITERATION #8 ****************************************
 epoch: 0, train_loss: 1.6755, test_loss: 1.4323, test_f1: 0.3411
 epoch: 1, train_loss: 1.2258, test_loss: 1.2518, test_f1: 0.2611
 epoch: 2, train_loss: 1.0757, test_loss: 1.1586, test_f1: 0.4518
 epoch: 3, train_loss: 1.0210, test_loss: 1.1091, test_f1: 0.4857
 epoch: 4, train_loss: 1.0016, test_loss: 1.1349, test_f1: 0.5439
 epoch: 5, train_loss: 0.9490, test_loss: 1.0883, test_f1: 0.4901
 epoch: 6, train_loss: 0.9266, test_loss: 1.0972, test_f1: 0.5300
 epoch: 7, train_loss: 0.9007, test_loss: 1.0493, test_f1: 0.5448
 epoch: 8, train_loss: 0.8877, test_loss: 1.0618, test_f1: 0.5434
 epoch: 9, train_loss: 0.8655, test_loss: 1.0489, test_f1: 0.5324
 epoch: 10, train_loss: 0.8535, test_loss: 1.0348, test_f1: 0.5537
 epoch: 11, train_loss: 0.8401, test_loss: 1.0374, test_f1: 0.5463
 epoch: 12, train_loss: 0.8384, test_loss: 1.0063, test_f1: 0.5754
 epoch: 13, train_loss: 0.7753, test_loss: 1.0255, test_f1: 0.5404
 epoch: 14, train_loss: 0.7786, test_loss: 1.0245, test_f1: 0.5656
 epoch: 15, train_loss: 0.7719, test_loss: 1.0098, test_f1: 0.5777
 epoch: 16, train_loss: 0.7483, test_loss: 1.0070, test_f1: 0.5915
 epoch: 17, train_loss: 0.7386, test_loss: 0.9956, test_f1: 0.5697
 epoch: 18, train_loss: 0.7415, test_loss: 1.0297, test_f1: 0.5410
 epoch: 19, train_loss: 0.7308, test_loss: 0.9979, test_f1: 0.5738
 epoch: 20, train_loss: 0.7046, test_loss: 1.0289, test_f1: 0.6120
 epoch: 21, train_loss: 0.7039, test_loss: 0.9969, test_f1: 0.5884
 epoch: 22, train_loss: 0.6881, test_loss: 1.0266, test_f1: 0.5789
 epoch: 23, train_loss: 0.6946, test_loss: 1.0532, test_f1: 0.5868
 epoch: 24, train_loss: 0.6690, test_loss: 1.0488, test_f1: 0.6002
 epoch: 25, train_loss: 0.6889, test_loss: 1.0055, test_f1: 0.6168
 epoch: 26, train_loss: 0.6447, test_loss: 1.0818, test_f1: 0.5649
 epoch: 27, train_loss: 0.6288, test_loss: 1.0806, test_f1: 0.5975
 epoch: 28, train_loss: 0.6154, test_loss: 1.0739, test_f1: 0.5973
 epoch: 29, train_loss: 0.6183, test_loss: 1.0846, test_f1: 0.5718
 epoch: 30, train_loss: 0.6050, test_loss: 1.1052, test_f1: 0.5918
 epoch: 31, train_loss: 0.6025, test_loss: 1.1321, test_f1: 0.5858
 epoch: 32, train_loss: 0.5766, test_loss: 1.0897, test_f1: 0.5831
 epoch: 33, train_loss: 0.5896, test_loss: 1.1820, test_f1: 0.5854
 epoch: 34, train_loss: 0.5623, test_loss: 1.1193, test_f1: 0.6019
 epoch: 35, train_loss: 0.5683, test_loss: 1.1531, test_f1: 0.5952
 epoch: 36, train_loss: 0.5508, test_loss: 1.1899, test_f1: 0.5940
 epoch: 37, train_loss: 0.5459, test_loss: 1.2133, test_f1: 0.6086
 epoch: 38, train_loss: 0.5320, test_loss: 1.2227, test_f1: 0.5853
 epoch: 39, train_loss: 0.5461, test_loss: 1.1999, test_f1: 0.6335
 epoch: 40, train_loss: 0.5307, test_loss: 1.2179, test_f1: 0.6169
 epoch: 41, train_loss: 0.5294, test_loss: 1.2581, test_f1: 0.5858
 epoch: 42, train_loss: 0.5039, test_loss: 1.2803, test_f1: 0.5815
 epoch: 43, train_loss: 0.5147, test_loss: 1.2958, test_f1: 0.6264
 epoch: 44, train_loss: 0.4970, test_loss: 1.2872, test_f1: 0.5913
 epoch: 45, train_loss: 0.5101, test_loss: 1.3942, test_f1: 0.5699
 epoch: 46, train_loss: 0.4883, test_loss: 1.3093, test_f1: 0.6507
 epoch: 47, train_loss: 0.4764, test_loss: 1.3656, test_f1: 0.5692
 epoch: 48, train_loss: 0.4679, test_loss: 1.3571, test_f1: 0.5594
 epoch: 49, train_loss: 0.4686, test_loss: 1.4081, test_f1: 0.6093
 epoch: 50, train_loss: 0.4734, test_loss: 1.4547, test_f1: 0.5915
 epoch: 51, train_loss: 0.4352, test_loss: 1.4464, test_f1: 0.5995
 epoch: 52, train_loss: 0.4276, test_loss: 1.4554, test_f1: 0.5906
 epoch: 53, train_loss: 0.4094, test_loss: 1.4398, test_f1: 0.6155
 epoch: 54, train_loss: 0.3926, test_loss: 1.4369, test_f1: 0.5882
 epoch: 55, train_loss: 0.3841, test_loss: 1.5019, test_f1: 0.5846
 epoch: 56, train_loss: 0.4028, test_loss: 1.3848, test_f1: 0.5943
 epoch: 57, train_loss: 0.3533, test_loss: 1.4652, test_f1: 0.5846
 epoch: 58, train_loss: 0.3597, test_loss: 1.5231, test_f1: 0.6063
 epoch: 59, train_loss: 0.3865, test_loss: 1.5818, test_f1: 0.5966
 epoch: 60, train_loss: 0.3785, test_loss: 1.5210, test_f1: 0.5937
 epoch: 61, train_loss: 0.3520, test_loss: 1.5453, test_f1: 0.5952
 epoch: 62, train_loss: 0.3629, test_loss: 1.5009, test_f1: 0.6267
 epoch: 63, train_loss: 0.3690, test_loss: 1.6440, test_f1: 0.5765
 epoch: 64, train_loss: 0.3618, test_loss: 1.6202, test_f1: 0.6007
 epoch: 65, train_loss: 0.3300, test_loss: 1.6375, test_f1: 0.5853
 epoch: 66, train_loss: 0.3472, test_loss: 1.5627, test_f1: 0.5928
 epoch: 67, train_loss: 0.3360, test_loss: 1.6672, test_f1: 0.5800
 epoch: 68, train_loss: 0.3499, test_loss: 1.6284, test_f1: 0.5904
 epoch: 69, train_loss: 0.3444, test_loss: 1.6280, test_f1: 0.5995
 epoch: 70, train_loss: 0.3419, test_loss: 1.6286, test_f1: 0.5827
 epoch: 71, train_loss: 0.3561, test_loss: 1.6340, test_f1: 0.6093
 epoch: 72, train_loss: 0.3394, test_loss: 1.6071, test_f1: 0.5938
 epoch: 73, train_loss: 0.3109, test_loss: 1.6452, test_f1: 0.5896
 epoch: 74, train_loss: 0.3129, test_loss: 1.6384, test_f1: 0.6124
 epoch: 75, train_loss: 0.3381, test_loss: 1.6867, test_f1: 0.5777
 epoch: 76, train_loss: 0.3430, test_loss: 1.7445, test_f1: 0.5816
 epoch: 77, train_loss: 0.3136, test_loss: 1.6878, test_f1: 0.6018
 epoch: 78, train_loss: 0.3138, test_loss: 1.7219, test_f1: 0.5928
 epoch: 79, train_loss: 0.3201, test_loss: 1.7088, test_f1: 0.5830
 epoch: 80, train_loss: 0.3239, test_loss: 1.6295, test_f1: 0.5911
 epoch: 81, train_loss: 0.3150, test_loss: 1.7108, test_f1: 0.6038
 epoch: 82, train_loss: 0.2843, test_loss: 1.7940, test_f1: 0.5819
 epoch: 83, train_loss: 0.2828, test_loss: 1.6946, test_f1: 0.6283
 epoch: 84, train_loss: 0.2782, test_loss: 1.7979, test_f1: 0.5864
 epoch: 85, train_loss: 0.3040, test_loss: 1.8718, test_f1: 0.5844
 epoch: 86, train_loss: 0.3012, test_loss: 1.9555, test_f1: 0.5667
 epoch: 87, train_loss: 0.2951, test_loss: 1.8406, test_f1: 0.5720
 epoch: 88, train_loss: 0.2890, test_loss: 1.8552, test_f1: 0.6059
 epoch: 89, train_loss: 0.3017, test_loss: 1.7176, test_f1: 0.5903
 epoch: 90, train_loss: 0.2901, test_loss: 1.8535, test_f1: 0.6137
 epoch: 91, train_loss: 0.2887, test_loss: 1.9423, test_f1: 0.5851
 epoch: 92, train_loss: 0.3128, test_loss: 1.7677, test_f1: 0.5934
 epoch: 93, train_loss: 0.2809, test_loss: 1.8876, test_f1: 0.5814
 epoch: 94, train_loss: 0.2863, test_loss: 1.8485, test_f1: 0.5952
 epoch: 95, train_loss: 0.2482, test_loss: 1.9049, test_f1: 0.5895
 epoch: 96, train_loss: 0.2727, test_loss: 1.7992, test_f1: 0.6067
 epoch: 97, train_loss: 0.2818, test_loss: 1.9623, test_f1: 0.5596
 epoch: 98, train_loss: 0.2656, test_loss: 1.9737, test_f1: 0.5832
 epoch: 99, train_loss: 0.3117, test_loss: 1.9415, test_f1: 0.5863
##################ITERATION #9 ****************************************
 epoch: 0, train_loss: 1.4449, test_loss: 1.7148, test_f1: 0.2281
 epoch: 1, train_loss: 1.0733, test_loss: 1.2276, test_f1: 0.4016
 epoch: 2, train_loss: 1.0256, test_loss: 1.1297, test_f1: 0.4523
 epoch: 3, train_loss: 0.9989, test_loss: 1.0394, test_f1: 0.5665
 epoch: 4, train_loss: 0.9612, test_loss: 1.1323, test_f1: 0.5277
 epoch: 5, train_loss: 0.9101, test_loss: 1.0855, test_f1: 0.5450
 epoch: 6, train_loss: 0.9098, test_loss: 1.0914, test_f1: 0.5441
 epoch: 7, train_loss: 0.8732, test_loss: 1.0491, test_f1: 0.5450
 epoch: 8, train_loss: 0.8769, test_loss: 1.0157, test_f1: 0.5960
 epoch: 9, train_loss: 0.8686, test_loss: 1.0426, test_f1: 0.5887
 epoch: 10, train_loss: 0.8547, test_loss: 1.0588, test_f1: 0.5408
 epoch: 11, train_loss: 0.8116, test_loss: 1.0279, test_f1: 0.5939
 epoch: 12, train_loss: 0.8136, test_loss: 1.0180, test_f1: 0.5781
 epoch: 13, train_loss: 0.7935, test_loss: 1.0481, test_f1: 0.5588
 epoch: 14, train_loss: 0.7786, test_loss: 1.0811, test_f1: 0.5367
 epoch: 15, train_loss: 0.7820, test_loss: 1.0383, test_f1: 0.5626
 epoch: 16, train_loss: 0.7488, test_loss: 1.0484, test_f1: 0.5946
 epoch: 17, train_loss: 0.7271, test_loss: 1.0636, test_f1: 0.5983
 epoch: 18, train_loss: 0.7290, test_loss: 1.0580, test_f1: 0.6250
 epoch: 19, train_loss: 0.7165, test_loss: 1.0040, test_f1: 0.6082
 epoch: 20, train_loss: 0.7251, test_loss: 1.0935, test_f1: 0.5763
 epoch: 21, train_loss: 0.7318, test_loss: 1.1002, test_f1: 0.6255
 epoch: 22, train_loss: 0.7034, test_loss: 1.0290, test_f1: 0.5832
 epoch: 23, train_loss: 0.6932, test_loss: 1.0465, test_f1: 0.5957
 epoch: 24, train_loss: 0.7054, test_loss: 1.0757, test_f1: 0.6158
 epoch: 25, train_loss: 0.6994, test_loss: 1.1019, test_f1: 0.5930
 epoch: 26, train_loss: 0.6351, test_loss: 1.0149, test_f1: 0.5804
 epoch: 27, train_loss: 0.6420, test_loss: 1.1184, test_f1: 0.5705
 epoch: 28, train_loss: 0.6285, test_loss: 1.1679, test_f1: 0.5922
 epoch: 29, train_loss: 0.6264, test_loss: 1.1740, test_f1: 0.5942
 epoch: 30, train_loss: 0.6283, test_loss: 1.1956, test_f1: 0.5980
 epoch: 31, train_loss: 0.5878, test_loss: 1.3220, test_f1: 0.5712
 epoch: 32, train_loss: 0.6048, test_loss: 1.2134, test_f1: 0.5790
 epoch: 33, train_loss: 0.6113, test_loss: 1.2829, test_f1: 0.6108
 epoch: 34, train_loss: 0.5768, test_loss: 1.1597, test_f1: 0.6085
 epoch: 35, train_loss: 0.5815, test_loss: 1.1880, test_f1: 0.6050
 epoch: 36, train_loss: 0.5825, test_loss: 1.2087, test_f1: 0.5958
 epoch: 37, train_loss: 0.5493, test_loss: 1.2067, test_f1: 0.6053
 epoch: 38, train_loss: 0.5692, test_loss: 1.2016, test_f1: 0.6150
 epoch: 39, train_loss: 0.5402, test_loss: 1.1978, test_f1: 0.6187
 epoch: 40, train_loss: 0.5400, test_loss: 1.2674, test_f1: 0.6235
 epoch: 41, train_loss: 0.5417, test_loss: 1.2448, test_f1: 0.5958
 epoch: 42, train_loss: 0.5456, test_loss: 1.2909, test_f1: 0.6014
 epoch: 43, train_loss: 0.5323, test_loss: 1.2676, test_f1: 0.5883
 epoch: 44, train_loss: 0.4944, test_loss: 1.2871, test_f1: 0.6229
 epoch: 45, train_loss: 0.5459, test_loss: 1.2096, test_f1: 0.5855
 epoch: 46, train_loss: 0.5203, test_loss: 1.3569, test_f1: 0.6121
 epoch: 47, train_loss: 0.5119, test_loss: 1.3697, test_f1: 0.6046
 epoch: 48, train_loss: 0.4961, test_loss: 1.2930, test_f1: 0.6272
 epoch: 49, train_loss: 0.5087, test_loss: 1.2900, test_f1: 0.6271
 epoch: 50, train_loss: 0.5120, test_loss: 1.1616, test_f1: 0.6030
 epoch: 51, train_loss: 0.4736, test_loss: 1.2789, test_f1: 0.6303
 epoch: 52, train_loss: 0.4554, test_loss: 1.3069, test_f1: 0.6176
 epoch: 53, train_loss: 0.4528, test_loss: 1.3276, test_f1: 0.6234
 epoch: 54, train_loss: 0.4282, test_loss: 1.3322, test_f1: 0.6312
 epoch: 55, train_loss: 0.4369, test_loss: 1.3742, test_f1: 0.6211
 epoch: 56, train_loss: 0.4287, test_loss: 1.3207, test_f1: 0.6346
 epoch: 57, train_loss: 0.4154, test_loss: 1.3864, test_f1: 0.6136
 epoch: 58, train_loss: 0.3944, test_loss: 1.3221, test_f1: 0.6283
 epoch: 59, train_loss: 0.4096, test_loss: 1.3887, test_f1: 0.6176
 epoch: 60, train_loss: 0.4031, test_loss: 1.3731, test_f1: 0.6368
 epoch: 61, train_loss: 0.4086, test_loss: 1.4369, test_f1: 0.6328
 epoch: 62, train_loss: 0.4075, test_loss: 1.3780, test_f1: 0.6346
 epoch: 63, train_loss: 0.3973, test_loss: 1.2750, test_f1: 0.6401
 epoch: 64, train_loss: 0.3914, test_loss: 1.3611, test_f1: 0.6365
 epoch: 65, train_loss: 0.3841, test_loss: 1.4407, test_f1: 0.6036
 epoch: 66, train_loss: 0.3837, test_loss: 1.4538, test_f1: 0.6481
 epoch: 67, train_loss: 0.3541, test_loss: 1.4405, test_f1: 0.6209
 epoch: 68, train_loss: 0.3954, test_loss: 1.4684, test_f1: 0.6174
 epoch: 69, train_loss: 0.4004, test_loss: 1.3874, test_f1: 0.6330
 epoch: 70, train_loss: 0.3812, test_loss: 1.4371, test_f1: 0.6407
 epoch: 71, train_loss: 0.3731, test_loss: 1.4405, test_f1: 0.6413
 epoch: 72, train_loss: 0.3575, test_loss: 1.4608, test_f1: 0.6349
 epoch: 73, train_loss: 0.3723, test_loss: 1.4785, test_f1: 0.6082
 epoch: 74, train_loss: 0.3643, test_loss: 1.4446, test_f1: 0.6438
 epoch: 75, train_loss: 0.3708, test_loss: 1.5846, test_f1: 0.6075
 epoch: 76, train_loss: 0.3430, test_loss: 1.5461, test_f1: 0.6317
 epoch: 77, train_loss: 0.3547, test_loss: 1.5045, test_f1: 0.6353
 epoch: 78, train_loss: 0.3506, test_loss: 1.4862, test_f1: 0.6321
 epoch: 79, train_loss: 0.3531, test_loss: 1.4873, test_f1: 0.6197
 epoch: 80, train_loss: 0.3410, test_loss: 1.5415, test_f1: 0.6083
 epoch: 81, train_loss: 0.3319, test_loss: 1.5485, test_f1: 0.6420
 epoch: 82, train_loss: 0.3493, test_loss: 1.5955, test_f1: 0.6165
 epoch: 83, train_loss: 0.3342, test_loss: 1.5567, test_f1: 0.6454
 epoch: 84, train_loss: 0.3174, test_loss: 1.6916, test_f1: 0.6195
 epoch: 85, train_loss: 0.3364, test_loss: 1.6431, test_f1: 0.5618
 epoch: 86, train_loss: 0.3220, test_loss: 1.5009, test_f1: 0.6309
 epoch: 87, train_loss: 0.3254, test_loss: 1.5942, test_f1: 0.6323
 epoch: 88, train_loss: 0.3144, test_loss: 1.6066, test_f1: 0.6317
 epoch: 89, train_loss: 0.3279, test_loss: 1.7079, test_f1: 0.6026
 epoch: 90, train_loss: 0.3546, test_loss: 1.7101, test_f1: 0.6288
 epoch: 91, train_loss: 0.3397, test_loss: 1.7635, test_f1: 0.6077
 epoch: 92, train_loss: 0.3270, test_loss: 1.6267, test_f1: 0.6450
 epoch: 93, train_loss: 0.3376, test_loss: 1.6166, test_f1: 0.6367
 epoch: 94, train_loss: 0.3180, test_loss: 1.6681, test_f1: 0.6125
 epoch: 95, train_loss: 0.3036, test_loss: 1.7719, test_f1: 0.6310
 epoch: 96, train_loss: 0.3064, test_loss: 1.6429, test_f1: 0.6309
 epoch: 97, train_loss: 0.3132, test_loss: 1.7198, test_f1: 0.5791
 epoch: 98, train_loss: 0.3103, test_loss: 1.7844, test_f1: 0.6002
 epoch: 99, train_loss: 0.3076, test_loss: 1.7135, test_f1: 0.6143

Training completed in 450.41 seconds
Best F1: 0.6782 at epoch 29
Mean F1 across iterations: 0.6532  0.0135
========================FINAL RESULTS================================
FEGIN weighted F1: 0.6782  0.0135
python main.py --data ltspice_demos --representation component_pin_net --model FEGIN --layers 4 --hiddens 32 --batch_size 64 --lr 0.001 --emb_size 512 --epochs 100 --save_appendix component_pin_net_L4_H32_BS64_LR0.001_E512 --no_val
-----



STDERR:
  File "main.py", line 370, in <module>
    main()
  File "main.py", line 254, in main
    dataset = dataset_class(
  File "/home/philip/projects/ltspice_examples_code_repo/Circuit-Completion-Using-GNNs/component_classification_with_link_prediction_head/evaluation/FEGIN/kernel/circuit_datasets.py", line 15, in __init__
    self.data, self.slices = torch.load(self.processed_paths[0])
  File "/home/philip/.local/lib/python3.8/site-packages/torch/serialization.py", line 1040, in load
    warnings.warn(
  File "/usr/lib/python3.8/warnings.py", line 109, in _showwarnmsg
    sw(msg.message, msg.category, msg.filename, msg.lineno,
  File "main.py", line 47, in warn_with_traceback
    traceback.print_stack(file=log)
/home/philip/projects/ltspice_examples_code_repo/Circuit-Completion-Using-GNNs/component_classification_with_link_prediction_head/evaluation/FEGIN/kernel/circuit_datasets.py:15: FutureWarning: You are using `torch.load` with `weights_only=False` (the current default value), which uses the default pickle module implicitly. It is possible to construct malicious pickle data which will execute arbitrary code during unpickling (See https://github.com/pytorch/pytorch/blob/main/SECURITY.md#untrusted-models for more details). In a future release, the default value for `weights_only` will be flipped to `True`. This limits the functions that could be executed during unpickling. Arbitrary objects will no longer be allowed to be loaded via this mode unless they are explicitly allowlisted by the user via `torch.serialization.add_safe_globals`. We recommend you start setting `weights_only=True` for any use case where you don't have full control of the loaded file. Please open an issue on GitHub for any issues related to this experimental feature.
  self.data, self.slices = torch.load(self.processed_paths[0])
