STDOUT:
Results will be saved in /home/philip/projects/ltspice_examples_code_repo/Circuit-Completion-Using-GNNs/component_classification_with_link_prediction_head/evaluation/FEGIN/results/model_FEGIN_dataset_ltspice_examples
Command line input: python main.py --data ltspice_examples --representation component_net --model FEGIN --layers 4 --hiddens 32 --batch_size 32 --lr 0.01 --emb_size 128 --epochs 100 --save_appendix component_net_L4_H32_BS32_LR0.01_E128 --no_val
 is saved.
-----
ltspice_examples - FEGIN
Using 4 layers, 32 hidden units, h = 2
Loading component_net representation dataset
ENTERED
Training FEGIN on component_net representation
Train: 3558, Test: 846
##################ITERATION #0 ****************************************
 epoch: 0, train_loss: 1.1793, test_loss: 1.1265, test_f1: 0.4290
 epoch: 1, train_loss: 1.0449, test_loss: 1.0092, test_f1: 0.4924
 epoch: 2, train_loss: 1.0230, test_loss: 1.0607, test_f1: 0.4490
 epoch: 3, train_loss: 0.9936, test_loss: 0.9786, test_f1: 0.4721
 epoch: 4, train_loss: 0.9808, test_loss: 1.0732, test_f1: 0.4979
 epoch: 5, train_loss: 0.9611, test_loss: 0.9980, test_f1: 0.4532
 epoch: 6, train_loss: 0.9592, test_loss: 1.0289, test_f1: 0.5275
 epoch: 7, train_loss: 0.9483, test_loss: 0.9348, test_f1: 0.4771
 epoch: 8, train_loss: 0.9416, test_loss: 0.8884, test_f1: 0.5392
 epoch: 9, train_loss: 0.9315, test_loss: 0.9852, test_f1: 0.4562
 epoch: 10, train_loss: 0.9289, test_loss: 0.9415, test_f1: 0.4780
 epoch: 11, train_loss: 0.9169, test_loss: 1.0360, test_f1: 0.4771
 epoch: 12, train_loss: 0.9254, test_loss: 0.9650, test_f1: 0.5138
 epoch: 13, train_loss: 0.9246, test_loss: 0.9242, test_f1: 0.4661
 epoch: 14, train_loss: 0.9181, test_loss: 0.9758, test_f1: 0.4895
 epoch: 15, train_loss: 0.9396, test_loss: 0.9965, test_f1: 0.4865
 epoch: 16, train_loss: 0.9067, test_loss: 0.9682, test_f1: 0.4773
 epoch: 17, train_loss: 0.9386, test_loss: 1.0100, test_f1: 0.5433
 epoch: 18, train_loss: 0.9224, test_loss: 0.9739, test_f1: 0.5180
 epoch: 19, train_loss: 0.9063, test_loss: 1.0058, test_f1: 0.5051
 epoch: 20, train_loss: 0.9169, test_loss: 0.9876, test_f1: 0.4817
 epoch: 21, train_loss: 0.8926, test_loss: 0.9528, test_f1: 0.5018
 epoch: 22, train_loss: 0.9035, test_loss: 0.9913, test_f1: 0.4989
 epoch: 23, train_loss: 0.8873, test_loss: 0.9339, test_f1: 0.5014
 epoch: 24, train_loss: 0.8883, test_loss: 1.0258, test_f1: 0.4975
 epoch: 25, train_loss: 0.8866, test_loss: 1.0026, test_f1: 0.5481
 epoch: 26, train_loss: 0.8753, test_loss: 1.1146, test_f1: 0.4597
 epoch: 27, train_loss: 0.8783, test_loss: 0.9784, test_f1: 0.4918
 epoch: 28, train_loss: 0.9032, test_loss: 0.9440, test_f1: 0.5274
 epoch: 29, train_loss: 0.8757, test_loss: 0.9147, test_f1: 0.5087
 epoch: 30, train_loss: 0.8817, test_loss: 0.9466, test_f1: 0.5150
 epoch: 31, train_loss: 0.8568, test_loss: 0.9828, test_f1: 0.5134
 epoch: 32, train_loss: 0.8672, test_loss: 0.9887, test_f1: 0.5064
 epoch: 33, train_loss: 0.8628, test_loss: 1.0922, test_f1: 0.4979
 epoch: 34, train_loss: 0.8557, test_loss: 0.9981, test_f1: 0.5292
 epoch: 35, train_loss: 0.8493, test_loss: 1.0435, test_f1: 0.5687
 epoch: 36, train_loss: 0.8606, test_loss: 1.0535, test_f1: 0.5183
 epoch: 37, train_loss: 0.8490, test_loss: 1.0100, test_f1: 0.5026
 epoch: 38, train_loss: 0.8464, test_loss: 1.0511, test_f1: 0.5549
 epoch: 39, train_loss: 0.8404, test_loss: 0.9959, test_f1: 0.5515
 epoch: 40, train_loss: 0.8404, test_loss: 1.0116, test_f1: 0.5167
 epoch: 41, train_loss: 0.8303, test_loss: 0.9800, test_f1: 0.5087
 epoch: 42, train_loss: 0.8190, test_loss: 1.0202, test_f1: 0.5223
 epoch: 43, train_loss: 0.8288, test_loss: 0.9422, test_f1: 0.5573
 epoch: 44, train_loss: 0.8349, test_loss: 0.9748, test_f1: 0.5310
 epoch: 45, train_loss: 0.8466, test_loss: 0.8947, test_f1: 0.5610
 epoch: 46, train_loss: 0.8407, test_loss: 1.0018, test_f1: 0.5701
 epoch: 47, train_loss: 0.8336, test_loss: 1.1024, test_f1: 0.5127
 epoch: 48, train_loss: 0.8237, test_loss: 1.0071, test_f1: 0.5252
 epoch: 49, train_loss: 0.8240, test_loss: 1.0014, test_f1: 0.5478
 epoch: 50, train_loss: 0.8206, test_loss: 0.8906, test_f1: 0.5450
 epoch: 51, train_loss: 0.7965, test_loss: 0.9377, test_f1: 0.5393
 epoch: 52, train_loss: 0.7810, test_loss: 0.9660, test_f1: 0.5581
 epoch: 53, train_loss: 0.7765, test_loss: 0.9884, test_f1: 0.5537
 epoch: 54, train_loss: 0.7719, test_loss: 0.9731, test_f1: 0.5558
 epoch: 55, train_loss: 0.7833, test_loss: 0.9426, test_f1: 0.5893
 epoch: 56, train_loss: 0.7709, test_loss: 0.9724, test_f1: 0.6026
 epoch: 57, train_loss: 0.7652, test_loss: 0.9588, test_f1: 0.5582
 epoch: 58, train_loss: 0.7622, test_loss: 1.0274, test_f1: 0.5779
 epoch: 59, train_loss: 0.7595, test_loss: 1.0502, test_f1: 0.5249
 epoch: 60, train_loss: 0.7476, test_loss: 1.0138, test_f1: 0.5744
 epoch: 61, train_loss: 0.7491, test_loss: 1.0932, test_f1: 0.5831
 epoch: 62, train_loss: 0.7539, test_loss: 1.0112, test_f1: 0.5715
 epoch: 63, train_loss: 0.7579, test_loss: 0.9654, test_f1: 0.5865
 epoch: 64, train_loss: 0.7500, test_loss: 0.9504, test_f1: 0.5540
 epoch: 65, train_loss: 0.7633, test_loss: 0.9913, test_f1: 0.5745
 epoch: 66, train_loss: 0.7493, test_loss: 0.9885, test_f1: 0.5797
 epoch: 67, train_loss: 0.7410, test_loss: 1.0686, test_f1: 0.5511
 epoch: 68, train_loss: 0.7466, test_loss: 1.0086, test_f1: 0.6193
 epoch: 69, train_loss: 0.7475, test_loss: 1.0371, test_f1: 0.5861
 epoch: 70, train_loss: 0.7457, test_loss: 0.9627, test_f1: 0.6197
 epoch: 71, train_loss: 0.7196, test_loss: 1.1009, test_f1: 0.5518
 epoch: 72, train_loss: 0.7273, test_loss: 1.0114, test_f1: 0.5740
 epoch: 73, train_loss: 0.7371, test_loss: 0.9485, test_f1: 0.5832
 epoch: 74, train_loss: 0.7498, test_loss: 1.0019, test_f1: 0.5733
 epoch: 75, train_loss: 0.7411, test_loss: 1.1310, test_f1: 0.5777
 epoch: 76, train_loss: 0.7394, test_loss: 1.0906, test_f1: 0.5955
 epoch: 77, train_loss: 0.7383, test_loss: 1.0478, test_f1: 0.5789
 epoch: 78, train_loss: 0.7362, test_loss: 1.0387, test_f1: 0.5888
 epoch: 79, train_loss: 0.7179, test_loss: 1.1498, test_f1: 0.5953
 epoch: 80, train_loss: 0.7279, test_loss: 1.1061, test_f1: 0.5933
 epoch: 81, train_loss: 0.7251, test_loss: 1.0692, test_f1: 0.5935
 epoch: 82, train_loss: 0.7179, test_loss: 1.0564, test_f1: 0.5849
 epoch: 83, train_loss: 0.7216, test_loss: 1.0412, test_f1: 0.5921
 epoch: 84, train_loss: 0.7225, test_loss: 0.9704, test_f1: 0.6028
 epoch: 85, train_loss: 0.7068, test_loss: 0.9298, test_f1: 0.5656
 epoch: 86, train_loss: 0.7129, test_loss: 0.9318, test_f1: 0.5609
 epoch: 87, train_loss: 0.7100, test_loss: 0.9684, test_f1: 0.5699
 epoch: 88, train_loss: 0.7137, test_loss: 0.9931, test_f1: 0.5782
 epoch: 89, train_loss: 0.7297, test_loss: 1.0195, test_f1: 0.5587
 epoch: 90, train_loss: 0.7065, test_loss: 0.9926, test_f1: 0.5680
 epoch: 91, train_loss: 0.7099, test_loss: 1.0140, test_f1: 0.5893
 epoch: 92, train_loss: 0.7098, test_loss: 0.9257, test_f1: 0.5960
 epoch: 93, train_loss: 0.7133, test_loss: 0.9869, test_f1: 0.6178
 epoch: 94, train_loss: 0.6988, test_loss: 1.0537, test_f1: 0.6127
 epoch: 95, train_loss: 0.7043, test_loss: 0.9202, test_f1: 0.5702
 epoch: 96, train_loss: 0.7081, test_loss: 0.9231, test_f1: 0.6332
 epoch: 97, train_loss: 0.7126, test_loss: 1.0192, test_f1: 0.6150
 epoch: 98, train_loss: 0.7076, test_loss: 0.9940, test_f1: 0.6002
 epoch: 99, train_loss: 0.7040, test_loss: 0.9770, test_f1: 0.6239
##################ITERATION #1 ****************************************
 epoch: 0, train_loss: 1.1631, test_loss: 1.1600, test_f1: 0.3717
 epoch: 1, train_loss: 1.0398, test_loss: 0.9757, test_f1: 0.4555
 epoch: 2, train_loss: 1.0007, test_loss: 0.9620, test_f1: 0.4512
 epoch: 3, train_loss: 0.9836, test_loss: 1.0150, test_f1: 0.4876
 epoch: 4, train_loss: 0.9951, test_loss: 0.9530, test_f1: 0.4748
 epoch: 5, train_loss: 0.9612, test_loss: 0.9426, test_f1: 0.4757
 epoch: 6, train_loss: 0.9575, test_loss: 0.9781, test_f1: 0.4844
 epoch: 7, train_loss: 0.9535, test_loss: 0.9562, test_f1: 0.4790
 epoch: 8, train_loss: 0.9474, test_loss: 0.9459, test_f1: 0.4849
 epoch: 9, train_loss: 0.9477, test_loss: 1.0140, test_f1: 0.5052
 epoch: 10, train_loss: 0.9320, test_loss: 1.0514, test_f1: 0.4567
 epoch: 11, train_loss: 0.9173, test_loss: 1.0684, test_f1: 0.4652
 epoch: 12, train_loss: 0.9200, test_loss: 0.9642, test_f1: 0.4933
 epoch: 13, train_loss: 0.9342, test_loss: 0.9996, test_f1: 0.5060
 epoch: 14, train_loss: 0.9080, test_loss: 0.9560, test_f1: 0.5462
 epoch: 15, train_loss: 0.9031, test_loss: 1.0140, test_f1: 0.5253
 epoch: 16, train_loss: 0.9176, test_loss: 0.9610, test_f1: 0.5177
 epoch: 17, train_loss: 0.8897, test_loss: 0.9871, test_f1: 0.5740
 epoch: 18, train_loss: 0.8982, test_loss: 1.0045, test_f1: 0.5156
 epoch: 19, train_loss: 0.8972, test_loss: 0.9307, test_f1: 0.4987
 epoch: 20, train_loss: 0.8859, test_loss: 0.9618, test_f1: 0.5542
 epoch: 21, train_loss: 0.8993, test_loss: 0.9875, test_f1: 0.4945
 epoch: 22, train_loss: 0.8844, test_loss: 0.8997, test_f1: 0.5241
 epoch: 23, train_loss: 0.8807, test_loss: 1.0325, test_f1: 0.5242
 epoch: 24, train_loss: 0.8857, test_loss: 0.9225, test_f1: 0.5151
 epoch: 25, train_loss: 0.8764, test_loss: 0.9865, test_f1: 0.5256
 epoch: 26, train_loss: 0.9049, test_loss: 1.0421, test_f1: 0.5207
 epoch: 27, train_loss: 0.8650, test_loss: 1.0221, test_f1: 0.5373
 epoch: 28, train_loss: 0.8631, test_loss: 0.9420, test_f1: 0.5571
 epoch: 29, train_loss: 0.8533, test_loss: 1.0302, test_f1: 0.4713
 epoch: 30, train_loss: 0.8732, test_loss: 0.9377, test_f1: 0.5191
 epoch: 31, train_loss: 0.8467, test_loss: 0.9446, test_f1: 0.5548
 epoch: 32, train_loss: 0.8539, test_loss: 0.9247, test_f1: 0.5078
 epoch: 33, train_loss: 0.8563, test_loss: 0.9811, test_f1: 0.5481
 epoch: 34, train_loss: 0.8379, test_loss: 0.9277, test_f1: 0.5447
 epoch: 35, train_loss: 0.8591, test_loss: 0.9472, test_f1: 0.4749
 epoch: 36, train_loss: 0.8628, test_loss: 1.0934, test_f1: 0.5480
 epoch: 37, train_loss: 0.8658, test_loss: 0.9702, test_f1: 0.5602
 epoch: 38, train_loss: 0.8546, test_loss: 0.9262, test_f1: 0.5832
 epoch: 39, train_loss: 0.8508, test_loss: 0.9383, test_f1: 0.5974
 epoch: 40, train_loss: 0.8298, test_loss: 0.9448, test_f1: 0.5679
 epoch: 41, train_loss: 0.8578, test_loss: 0.8959, test_f1: 0.5995
 epoch: 42, train_loss: 0.8717, test_loss: 0.8581, test_f1: 0.5457
 epoch: 43, train_loss: 0.8218, test_loss: 0.9328, test_f1: 0.5268
 epoch: 44, train_loss: 0.8103, test_loss: 0.8843, test_f1: 0.5774
 epoch: 45, train_loss: 0.8284, test_loss: 0.9876, test_f1: 0.5503
 epoch: 46, train_loss: 0.8171, test_loss: 0.9685, test_f1: 0.5514
 epoch: 47, train_loss: 0.8242, test_loss: 0.9206, test_f1: 0.5470
 epoch: 48, train_loss: 0.8200, test_loss: 0.9383, test_f1: 0.5881
 epoch: 49, train_loss: 0.8116, test_loss: 0.8540, test_f1: 0.6262
 epoch: 50, train_loss: 0.7893, test_loss: 0.8548, test_f1: 0.6106
 epoch: 51, train_loss: 0.7866, test_loss: 0.9190, test_f1: 0.5685
 epoch: 52, train_loss: 0.7854, test_loss: 0.9437, test_f1: 0.6303
 epoch: 53, train_loss: 0.7808, test_loss: 0.9289, test_f1: 0.6299
 epoch: 54, train_loss: 0.7741, test_loss: 0.9280, test_f1: 0.6080
 epoch: 55, train_loss: 0.7674, test_loss: 0.9482, test_f1: 0.5988
 epoch: 56, train_loss: 0.7683, test_loss: 0.9397, test_f1: 0.5747
 epoch: 57, train_loss: 0.7626, test_loss: 0.9253, test_f1: 0.6100
 epoch: 58, train_loss: 0.7436, test_loss: 0.9530, test_f1: 0.6107
 epoch: 59, train_loss: 0.7588, test_loss: 0.9079, test_f1: 0.5828
 epoch: 60, train_loss: 0.7490, test_loss: 0.8748, test_f1: 0.5932
 epoch: 61, train_loss: 0.7568, test_loss: 0.9245, test_f1: 0.6427
 epoch: 62, train_loss: 0.7506, test_loss: 0.9154, test_f1: 0.5801
 epoch: 63, train_loss: 0.7434, test_loss: 0.9786, test_f1: 0.6196
 epoch: 64, train_loss: 0.7323, test_loss: 0.9598, test_f1: 0.6005
 epoch: 65, train_loss: 0.7446, test_loss: 0.9042, test_f1: 0.6173
 epoch: 66, train_loss: 0.7531, test_loss: 0.9199, test_f1: 0.5780
 epoch: 67, train_loss: 0.7338, test_loss: 0.9059, test_f1: 0.5763
 epoch: 68, train_loss: 0.7462, test_loss: 0.9029, test_f1: 0.6426
 epoch: 69, train_loss: 0.7481, test_loss: 0.9210, test_f1: 0.5811
 epoch: 70, train_loss: 0.7575, test_loss: 0.9322, test_f1: 0.6223
 epoch: 71, train_loss: 0.7540, test_loss: 0.9066, test_f1: 0.6322
 epoch: 72, train_loss: 0.7400, test_loss: 0.9409, test_f1: 0.5832
 epoch: 73, train_loss: 0.7431, test_loss: 0.8857, test_f1: 0.6308
 epoch: 74, train_loss: 0.7357, test_loss: 0.9563, test_f1: 0.6192
 epoch: 75, train_loss: 0.7193, test_loss: 0.8910, test_f1: 0.6226
 epoch: 76, train_loss: 0.7366, test_loss: 0.9974, test_f1: 0.5991
 epoch: 77, train_loss: 0.7390, test_loss: 0.9712, test_f1: 0.5947
 epoch: 78, train_loss: 0.7297, test_loss: 0.9210, test_f1: 0.6405
 epoch: 79, train_loss: 0.7265, test_loss: 0.9654, test_f1: 0.6296
 epoch: 80, train_loss: 0.7392, test_loss: 0.9166, test_f1: 0.6181
 epoch: 81, train_loss: 0.7177, test_loss: 0.8579, test_f1: 0.6117
 epoch: 82, train_loss: 0.7256, test_loss: 0.9319, test_f1: 0.5717
 epoch: 83, train_loss: 0.7129, test_loss: 0.9394, test_f1: 0.6096
 epoch: 84, train_loss: 0.7186, test_loss: 0.9592, test_f1: 0.6283
 epoch: 85, train_loss: 0.7144, test_loss: 0.8877, test_f1: 0.6259
 epoch: 86, train_loss: 0.7288, test_loss: 0.9772, test_f1: 0.6002
 epoch: 87, train_loss: 0.7038, test_loss: 0.9040, test_f1: 0.5891
 epoch: 88, train_loss: 0.6950, test_loss: 0.9395, test_f1: 0.6404
 epoch: 89, train_loss: 0.6952, test_loss: 0.9645, test_f1: 0.5997
 epoch: 90, train_loss: 0.7134, test_loss: 0.9769, test_f1: 0.6150
 epoch: 91, train_loss: 0.7301, test_loss: 0.8855, test_f1: 0.5944
 epoch: 92, train_loss: 0.7154, test_loss: 0.9569, test_f1: 0.6187
 epoch: 93, train_loss: 0.7120, test_loss: 0.9261, test_f1: 0.6250
 epoch: 94, train_loss: 0.6999, test_loss: 0.8814, test_f1: 0.6389
 epoch: 95, train_loss: 0.7120, test_loss: 0.9106, test_f1: 0.6007
 epoch: 96, train_loss: 0.6907, test_loss: 0.8883, test_f1: 0.6119
 epoch: 97, train_loss: 0.6973, test_loss: 0.9028, test_f1: 0.6160
 epoch: 98, train_loss: 0.6949, test_loss: 0.9039, test_f1: 0.6368
 epoch: 99, train_loss: 0.7093, test_loss: 0.8730, test_f1: 0.6500
##################ITERATION #2 ****************************************
 epoch: 0, train_loss: 1.1733, test_loss: 1.1294, test_f1: 0.3912
 epoch: 1, train_loss: 1.0671, test_loss: 1.0843, test_f1: 0.4104
 epoch: 2, train_loss: 1.0568, test_loss: 1.0881, test_f1: 0.4026
 epoch: 3, train_loss: 1.0260, test_loss: 1.1199, test_f1: 0.4403
 epoch: 4, train_loss: 1.0074, test_loss: 1.0051, test_f1: 0.5340
 epoch: 5, train_loss: 0.9884, test_loss: 1.0096, test_f1: 0.4691
 epoch: 6, train_loss: 0.9855, test_loss: 1.1166, test_f1: 0.4128
 epoch: 7, train_loss: 0.9854, test_loss: 1.0647, test_f1: 0.4764
 epoch: 8, train_loss: 0.9714, test_loss: 0.9851, test_f1: 0.4915
 epoch: 9, train_loss: 0.9668, test_loss: 1.0166, test_f1: 0.5358
 epoch: 10, train_loss: 0.9537, test_loss: 0.9489, test_f1: 0.4963
 epoch: 11, train_loss: 0.9607, test_loss: 1.0107, test_f1: 0.5013
 epoch: 12, train_loss: 0.9405, test_loss: 0.9613, test_f1: 0.4892
 epoch: 13, train_loss: 0.9579, test_loss: 1.0479, test_f1: 0.4412
 epoch: 14, train_loss: 0.9702, test_loss: 1.0337, test_f1: 0.4896
 epoch: 15, train_loss: 0.9464, test_loss: 1.0568, test_f1: 0.4631
 epoch: 16, train_loss: 0.9416, test_loss: 1.0286, test_f1: 0.5080
 epoch: 17, train_loss: 0.9398, test_loss: 1.0788, test_f1: 0.4532
 epoch: 18, train_loss: 0.9337, test_loss: 1.0457, test_f1: 0.4932
 epoch: 19, train_loss: 0.9380, test_loss: 1.0273, test_f1: 0.4946
 epoch: 20, train_loss: 0.9189, test_loss: 0.9945, test_f1: 0.5078
 epoch: 21, train_loss: 0.9187, test_loss: 1.0561, test_f1: 0.4766
 epoch: 22, train_loss: 0.9138, test_loss: 0.9904, test_f1: 0.5024
 epoch: 23, train_loss: 0.9063, test_loss: 1.0599, test_f1: 0.5494
 epoch: 24, train_loss: 0.9076, test_loss: 1.0508, test_f1: 0.4809
 epoch: 25, train_loss: 0.9121, test_loss: 1.0265, test_f1: 0.4982
 epoch: 26, train_loss: 0.8972, test_loss: 1.0512, test_f1: 0.5536
 epoch: 27, train_loss: 0.9097, test_loss: 0.9654, test_f1: 0.5631
 epoch: 28, train_loss: 0.9251, test_loss: 1.0279, test_f1: 0.5074
 epoch: 29, train_loss: 0.8960, test_loss: 1.0028, test_f1: 0.5671
 epoch: 30, train_loss: 0.8995, test_loss: 1.0283, test_f1: 0.5287
 epoch: 31, train_loss: 0.8925, test_loss: 0.9990, test_f1: 0.5000
 epoch: 32, train_loss: 0.8879, test_loss: 1.1394, test_f1: 0.4958
 epoch: 33, train_loss: 0.8909, test_loss: 1.0907, test_f1: 0.5411
 epoch: 34, train_loss: 0.8813, test_loss: 0.9763, test_f1: 0.5218
 epoch: 35, train_loss: 0.8720, test_loss: 1.0057, test_f1: 0.5900
 epoch: 36, train_loss: 0.8796, test_loss: 1.0834, test_f1: 0.5587
 epoch: 37, train_loss: 0.8714, test_loss: 1.0803, test_f1: 0.5545
 epoch: 38, train_loss: 0.8689, test_loss: 1.1628, test_f1: 0.5210
 epoch: 39, train_loss: 0.8494, test_loss: 1.1252, test_f1: 0.5649
 epoch: 40, train_loss: 0.8527, test_loss: 0.9457, test_f1: 0.5225
 epoch: 41, train_loss: 0.8584, test_loss: 1.0340, test_f1: 0.4980
 epoch: 42, train_loss: 0.8488, test_loss: 1.0734, test_f1: 0.5627
 epoch: 43, train_loss: 0.8440, test_loss: 1.0894, test_f1: 0.5607
 epoch: 44, train_loss: 0.8306, test_loss: 1.1164, test_f1: 0.5802
 epoch: 45, train_loss: 0.8452, test_loss: 1.0795, test_f1: 0.5403
 epoch: 46, train_loss: 0.8477, test_loss: 1.0321, test_f1: 0.5153
 epoch: 47, train_loss: 0.8435, test_loss: 1.0308, test_f1: 0.5871
 epoch: 48, train_loss: 0.8344, test_loss: 1.1326, test_f1: 0.5916
 epoch: 49, train_loss: 0.8327, test_loss: 1.2621, test_f1: 0.5638
 epoch: 50, train_loss: 0.8342, test_loss: 1.1172, test_f1: 0.5368
 epoch: 51, train_loss: 0.8099, test_loss: 0.9938, test_f1: 0.6233
 epoch: 52, train_loss: 0.7983, test_loss: 1.0990, test_f1: 0.6195
 epoch: 53, train_loss: 0.7886, test_loss: 1.1514, test_f1: 0.6002
 epoch: 54, train_loss: 0.7870, test_loss: 1.1160, test_f1: 0.5942
 epoch: 55, train_loss: 0.7684, test_loss: 1.1842, test_f1: 0.6062
 epoch: 56, train_loss: 0.7946, test_loss: 1.0761, test_f1: 0.6340
 epoch: 57, train_loss: 0.7734, test_loss: 1.1547, test_f1: 0.6148
 epoch: 58, train_loss: 0.7768, test_loss: 1.1004, test_f1: 0.6104
 epoch: 59, train_loss: 0.7891, test_loss: 1.2617, test_f1: 0.6080
 epoch: 60, train_loss: 0.7748, test_loss: 1.3166, test_f1: 0.5945
 epoch: 61, train_loss: 0.7564, test_loss: 1.2143, test_f1: 0.6039
 epoch: 62, train_loss: 0.7621, test_loss: 1.1330, test_f1: 0.5680
 epoch: 63, train_loss: 0.7610, test_loss: 1.1193, test_f1: 0.6155
 epoch: 64, train_loss: 0.7548, test_loss: 1.2928, test_f1: 0.5901
 epoch: 65, train_loss: 0.7534, test_loss: 1.1932, test_f1: 0.6251
 epoch: 66, train_loss: 0.7515, test_loss: 1.2419, test_f1: 0.6022
 epoch: 67, train_loss: 0.7368, test_loss: 1.3045, test_f1: 0.6202
 epoch: 68, train_loss: 0.7398, test_loss: 1.2932, test_f1: 0.6231
 epoch: 69, train_loss: 0.7404, test_loss: 1.4598, test_f1: 0.6320
 epoch: 70, train_loss: 0.7374, test_loss: 1.2370, test_f1: 0.6071
 epoch: 71, train_loss: 0.7377, test_loss: 1.2960, test_f1: 0.6366
 epoch: 72, train_loss: 0.7279, test_loss: 1.4217, test_f1: 0.6093
 epoch: 73, train_loss: 0.7180, test_loss: 1.1690, test_f1: 0.5889
 epoch: 74, train_loss: 0.7224, test_loss: 1.2664, test_f1: 0.6170
 epoch: 75, train_loss: 0.7458, test_loss: 1.3116, test_f1: 0.5855
 epoch: 76, train_loss: 0.7264, test_loss: 1.3726, test_f1: 0.6157
 epoch: 77, train_loss: 0.7419, test_loss: 1.2496, test_f1: 0.6357
 epoch: 78, train_loss: 0.7307, test_loss: 1.4143, test_f1: 0.6092
 epoch: 79, train_loss: 0.7503, test_loss: 1.2463, test_f1: 0.6281
 epoch: 80, train_loss: 0.7107, test_loss: 1.2548, test_f1: 0.6256
 epoch: 81, train_loss: 0.7305, test_loss: 1.4385, test_f1: 0.6394
 epoch: 82, train_loss: 0.7176, test_loss: 1.2915, test_f1: 0.6413
 epoch: 83, train_loss: 0.7088, test_loss: 1.2506, test_f1: 0.6199
 epoch: 84, train_loss: 0.7146, test_loss: 1.3745, test_f1: 0.6602
 epoch: 85, train_loss: 0.7265, test_loss: 1.2750, test_f1: 0.6385
 epoch: 86, train_loss: 0.7017, test_loss: 1.3866, test_f1: 0.6161
 epoch: 87, train_loss: 0.7003, test_loss: 1.4661, test_f1: 0.6286
 epoch: 88, train_loss: 0.7124, test_loss: 1.2526, test_f1: 0.6334
 epoch: 89, train_loss: 0.7029, test_loss: 1.3217, test_f1: 0.5986
 epoch: 90, train_loss: 0.6998, test_loss: 1.3297, test_f1: 0.6163
 epoch: 91, train_loss: 0.7158, test_loss: 1.2774, test_f1: 0.6276
 epoch: 92, train_loss: 0.6907, test_loss: 1.2115, test_f1: 0.6091
 epoch: 93, train_loss: 0.7115, test_loss: 1.2748, test_f1: 0.6303
 epoch: 94, train_loss: 0.6929, test_loss: 1.3862, test_f1: 0.6238
 epoch: 95, train_loss: 0.7007, test_loss: 1.2514, test_f1: 0.6556
 epoch: 96, train_loss: 0.6996, test_loss: 1.2629, test_f1: 0.6418
 epoch: 97, train_loss: 0.6858, test_loss: 1.3424, test_f1: 0.6280
 epoch: 98, train_loss: 0.7018, test_loss: 1.2783, test_f1: 0.6391
 epoch: 99, train_loss: 0.7039, test_loss: 1.3322, test_f1: 0.6292
##################ITERATION #3 ****************************************
 epoch: 0, train_loss: 1.1551, test_loss: 1.0202, test_f1: 0.4007
 epoch: 1, train_loss: 1.0433, test_loss: 0.9954, test_f1: 0.4632
 epoch: 2, train_loss: 1.0047, test_loss: 1.0059, test_f1: 0.4411
 epoch: 3, train_loss: 1.0089, test_loss: 1.0533, test_f1: 0.4519
 epoch: 4, train_loss: 0.9984, test_loss: 1.1622, test_f1: 0.4000
 epoch: 5, train_loss: 1.0004, test_loss: 0.9714, test_f1: 0.4957
 epoch: 6, train_loss: 0.9818, test_loss: 0.9701, test_f1: 0.4649
 epoch: 7, train_loss: 0.9715, test_loss: 1.0032, test_f1: 0.4752
 epoch: 8, train_loss: 0.9582, test_loss: 1.0419, test_f1: 0.5035
 epoch: 9, train_loss: 0.9570, test_loss: 0.9747, test_f1: 0.5179
 epoch: 10, train_loss: 0.9290, test_loss: 0.9819, test_f1: 0.5036
 epoch: 11, train_loss: 0.9214, test_loss: 0.9801, test_f1: 0.4942
 epoch: 12, train_loss: 0.9326, test_loss: 0.9807, test_f1: 0.4854
 epoch: 13, train_loss: 0.9212, test_loss: 0.8900, test_f1: 0.5007
 epoch: 14, train_loss: 0.9050, test_loss: 0.9511, test_f1: 0.4916
 epoch: 15, train_loss: 0.9031, test_loss: 0.9169, test_f1: 0.5237
 epoch: 16, train_loss: 0.9194, test_loss: 0.9558, test_f1: 0.4949
 epoch: 17, train_loss: 0.9492, test_loss: 0.9662, test_f1: 0.4945
 epoch: 18, train_loss: 0.9285, test_loss: 0.9097, test_f1: 0.4939
 epoch: 19, train_loss: 0.9090, test_loss: 1.0002, test_f1: 0.4703
 epoch: 20, train_loss: 0.9074, test_loss: 0.9388, test_f1: 0.4926
 epoch: 21, train_loss: 0.8931, test_loss: 0.9415, test_f1: 0.5033
 epoch: 22, train_loss: 0.8937, test_loss: 0.9932, test_f1: 0.4921
 epoch: 23, train_loss: 0.8919, test_loss: 0.9944, test_f1: 0.4879
 epoch: 24, train_loss: 0.8900, test_loss: 0.9867, test_f1: 0.5055
 epoch: 25, train_loss: 0.8726, test_loss: 1.0192, test_f1: 0.4951
 epoch: 26, train_loss: 0.8774, test_loss: 0.9898, test_f1: 0.5340
 epoch: 27, train_loss: 0.8830, test_loss: 0.9594, test_f1: 0.4908
 epoch: 28, train_loss: 0.9262, test_loss: 1.1179, test_f1: 0.4693
 epoch: 29, train_loss: 0.8777, test_loss: 0.9070, test_f1: 0.5015
 epoch: 30, train_loss: 0.8662, test_loss: 0.8711, test_f1: 0.5338
 epoch: 31, train_loss: 0.8517, test_loss: 0.8760, test_f1: 0.5663
 epoch: 32, train_loss: 0.8562, test_loss: 0.8640, test_f1: 0.5643
 epoch: 33, train_loss: 0.8639, test_loss: 1.0023, test_f1: 0.5068
 epoch: 34, train_loss: 0.8819, test_loss: 0.9347, test_f1: 0.5125
 epoch: 35, train_loss: 0.8472, test_loss: 0.9212, test_f1: 0.5257
 epoch: 36, train_loss: 0.8476, test_loss: 0.9143, test_f1: 0.5526
 epoch: 37, train_loss: 0.8621, test_loss: 0.9337, test_f1: 0.5484
 epoch: 38, train_loss: 0.8600, test_loss: 0.9276, test_f1: 0.5722
 epoch: 39, train_loss: 0.8454, test_loss: 0.9769, test_f1: 0.5617
 epoch: 40, train_loss: 0.8372, test_loss: 0.9833, test_f1: 0.5667
 epoch: 41, train_loss: 0.8308, test_loss: 0.9524, test_f1: 0.5993
 epoch: 42, train_loss: 0.8214, test_loss: 1.0582, test_f1: 0.5855
 epoch: 43, train_loss: 0.8411, test_loss: 0.9588, test_f1: 0.5159
 epoch: 44, train_loss: 0.8390, test_loss: 0.9480, test_f1: 0.5849
 epoch: 45, train_loss: 0.8182, test_loss: 0.9823, test_f1: 0.5697
 epoch: 46, train_loss: 0.8261, test_loss: 0.9195, test_f1: 0.5641
 epoch: 47, train_loss: 0.8186, test_loss: 0.9647, test_f1: 0.5659
 epoch: 48, train_loss: 0.8212, test_loss: 0.8926, test_f1: 0.6013
 epoch: 49, train_loss: 0.8243, test_loss: 0.9321, test_f1: 0.5772
 epoch: 50, train_loss: 0.8070, test_loss: 1.0097, test_f1: 0.5354
 epoch: 51, train_loss: 0.7817, test_loss: 0.8955, test_f1: 0.5849
 epoch: 52, train_loss: 0.7805, test_loss: 0.9145, test_f1: 0.5842
 epoch: 53, train_loss: 0.7667, test_loss: 0.9299, test_f1: 0.5977
 epoch: 54, train_loss: 0.7588, test_loss: 0.9294, test_f1: 0.5892
 epoch: 55, train_loss: 0.7676, test_loss: 0.9128, test_f1: 0.5823
 epoch: 56, train_loss: 0.7611, test_loss: 0.9553, test_f1: 0.5928
 epoch: 57, train_loss: 0.7577, test_loss: 0.9350, test_f1: 0.5953
 epoch: 58, train_loss: 0.7771, test_loss: 0.9530, test_f1: 0.6014
 epoch: 59, train_loss: 0.7571, test_loss: 0.9256, test_f1: 0.6441
 epoch: 60, train_loss: 0.7487, test_loss: 0.9259, test_f1: 0.6077
 epoch: 61, train_loss: 0.7349, test_loss: 0.9629, test_f1: 0.6001
 epoch: 62, train_loss: 0.7555, test_loss: 0.9274, test_f1: 0.5975
 epoch: 63, train_loss: 0.7450, test_loss: 0.9656, test_f1: 0.6039
 epoch: 64, train_loss: 0.7438, test_loss: 0.9161, test_f1: 0.6149
 epoch: 65, train_loss: 0.7541, test_loss: 1.0121, test_f1: 0.5931
 epoch: 66, train_loss: 0.7431, test_loss: 0.8933, test_f1: 0.6076
 epoch: 67, train_loss: 0.7421, test_loss: 0.9736, test_f1: 0.5931
 epoch: 68, train_loss: 0.7361, test_loss: 0.9228, test_f1: 0.5920
 epoch: 69, train_loss: 0.7382, test_loss: 0.9204, test_f1: 0.5974
 epoch: 70, train_loss: 0.7419, test_loss: 0.9792, test_f1: 0.5794
 epoch: 71, train_loss: 0.7358, test_loss: 0.9886, test_f1: 0.5774
 epoch: 72, train_loss: 0.7421, test_loss: 0.8698, test_f1: 0.6263
 epoch: 73, train_loss: 0.7232, test_loss: 0.9823, test_f1: 0.5863
 epoch: 74, train_loss: 0.7261, test_loss: 0.9200, test_f1: 0.6025
 epoch: 75, train_loss: 0.7207, test_loss: 0.9626, test_f1: 0.6511
 epoch: 76, train_loss: 0.7316, test_loss: 0.9122, test_f1: 0.6488
 epoch: 77, train_loss: 0.7303, test_loss: 0.9585, test_f1: 0.6031
 epoch: 78, train_loss: 0.7342, test_loss: 0.9984, test_f1: 0.6526
 epoch: 79, train_loss: 0.7381, test_loss: 0.9688, test_f1: 0.6136
 epoch: 80, train_loss: 0.7155, test_loss: 0.9615, test_f1: 0.5965
 epoch: 81, train_loss: 0.7134, test_loss: 0.8842, test_f1: 0.6167
 epoch: 82, train_loss: 0.7129, test_loss: 0.9260, test_f1: 0.6570
 epoch: 83, train_loss: 0.7174, test_loss: 1.0137, test_f1: 0.6202
 epoch: 84, train_loss: 0.7054, test_loss: 0.9780, test_f1: 0.6200
 epoch: 85, train_loss: 0.7006, test_loss: 0.9327, test_f1: 0.5980
 epoch: 86, train_loss: 0.7218, test_loss: 0.8877, test_f1: 0.6165
 epoch: 87, train_loss: 0.7021, test_loss: 0.8769, test_f1: 0.6626
 epoch: 88, train_loss: 0.7243, test_loss: 0.9899, test_f1: 0.5909
 epoch: 89, train_loss: 0.7306, test_loss: 0.9615, test_f1: 0.6327
 epoch: 90, train_loss: 0.6989, test_loss: 0.9423, test_f1: 0.6185
 epoch: 91, train_loss: 0.6984, test_loss: 0.9578, test_f1: 0.6069
 epoch: 92, train_loss: 0.7058, test_loss: 1.0258, test_f1: 0.6270
 epoch: 93, train_loss: 0.7128, test_loss: 0.9719, test_f1: 0.6225
 epoch: 94, train_loss: 0.6893, test_loss: 0.9532, test_f1: 0.6468
 epoch: 95, train_loss: 0.6981, test_loss: 0.9914, test_f1: 0.6018
 epoch: 96, train_loss: 0.7020, test_loss: 0.9320, test_f1: 0.6517
 epoch: 97, train_loss: 0.7205, test_loss: 1.0084, test_f1: 0.6186
 epoch: 98, train_loss: 0.6948, test_loss: 0.9981, test_f1: 0.6145
 epoch: 99, train_loss: 0.7002, test_loss: 1.1530, test_f1: 0.5921
##################ITERATION #4 ****************************************
 epoch: 0, train_loss: 1.1656, test_loss: 1.0769, test_f1: 0.4120
 epoch: 1, train_loss: 1.0379, test_loss: 1.1054, test_f1: 0.4091
 epoch: 2, train_loss: 1.0127, test_loss: 1.0179, test_f1: 0.4423
 epoch: 3, train_loss: 0.9899, test_loss: 1.0250, test_f1: 0.5317
 epoch: 4, train_loss: 0.9816, test_loss: 1.0737, test_f1: 0.4696
 epoch: 5, train_loss: 0.9846, test_loss: 1.0936, test_f1: 0.4699
 epoch: 6, train_loss: 0.9939, test_loss: 1.0038, test_f1: 0.4863
 epoch: 7, train_loss: 0.9695, test_loss: 0.9940, test_f1: 0.4683
 epoch: 8, train_loss: 0.9505, test_loss: 1.0527, test_f1: 0.4672
 epoch: 9, train_loss: 0.9489, test_loss: 0.9859, test_f1: 0.5512
 epoch: 10, train_loss: 0.9367, test_loss: 0.9648, test_f1: 0.4706
 epoch: 11, train_loss: 0.9171, test_loss: 0.9872, test_f1: 0.4970
 epoch: 12, train_loss: 0.9247, test_loss: 0.9579, test_f1: 0.5294
 epoch: 13, train_loss: 0.9234, test_loss: 0.9787, test_f1: 0.4960
 epoch: 14, train_loss: 0.9158, test_loss: 0.9962, test_f1: 0.5385
 epoch: 15, train_loss: 0.9149, test_loss: 0.8933, test_f1: 0.5578
 epoch: 16, train_loss: 0.8988, test_loss: 0.9544, test_f1: 0.5069
 epoch: 17, train_loss: 0.9011, test_loss: 0.9448, test_f1: 0.5494
 epoch: 18, train_loss: 0.8871, test_loss: 0.9760, test_f1: 0.5050
 epoch: 19, train_loss: 0.8772, test_loss: 1.0125, test_f1: 0.5250
 epoch: 20, train_loss: 0.8885, test_loss: 0.9927, test_f1: 0.5024
 epoch: 21, train_loss: 0.8977, test_loss: 0.9244, test_f1: 0.5588
 epoch: 22, train_loss: 0.8857, test_loss: 0.9916, test_f1: 0.5652
 epoch: 23, train_loss: 0.8787, test_loss: 0.8612, test_f1: 0.4988
 epoch: 24, train_loss: 0.8801, test_loss: 0.9433, test_f1: 0.5454
 epoch: 25, train_loss: 0.8714, test_loss: 0.9378, test_f1: 0.5059
 epoch: 26, train_loss: 0.8643, test_loss: 0.9359, test_f1: 0.5317
 epoch: 27, train_loss: 0.8625, test_loss: 0.9345, test_f1: 0.5291
 epoch: 28, train_loss: 0.8483, test_loss: 0.9839, test_f1: 0.4864
 epoch: 29, train_loss: 0.8599, test_loss: 0.9709, test_f1: 0.5334
 epoch: 30, train_loss: 0.8440, test_loss: 0.9872, test_f1: 0.5462
 epoch: 31, train_loss: 0.8396, test_loss: 0.9097, test_f1: 0.5201
 epoch: 32, train_loss: 0.8389, test_loss: 0.9800, test_f1: 0.5475
 epoch: 33, train_loss: 0.8393, test_loss: 0.9266, test_f1: 0.5321
 epoch: 34, train_loss: 0.8651, test_loss: 1.0288, test_f1: 0.4760
 epoch: 35, train_loss: 0.8585, test_loss: 0.9870, test_f1: 0.6095
 epoch: 36, train_loss: 0.8458, test_loss: 0.8941, test_f1: 0.5806
 epoch: 37, train_loss: 0.8380, test_loss: 0.9116, test_f1: 0.6050
 epoch: 38, train_loss: 0.8393, test_loss: 0.9018, test_f1: 0.5392
 epoch: 39, train_loss: 0.8398, test_loss: 0.9317, test_f1: 0.5405
 epoch: 40, train_loss: 0.8384, test_loss: 0.9866, test_f1: 0.5658
 epoch: 41, train_loss: 0.8277, test_loss: 0.9080, test_f1: 0.5512
 epoch: 42, train_loss: 0.8217, test_loss: 0.9474, test_f1: 0.5334
 epoch: 43, train_loss: 0.8202, test_loss: 0.9614, test_f1: 0.5501
 epoch: 44, train_loss: 0.8090, test_loss: 0.9133, test_f1: 0.5821
 epoch: 45, train_loss: 0.8270, test_loss: 0.9308, test_f1: 0.6103
 epoch: 46, train_loss: 0.8082, test_loss: 0.8891, test_f1: 0.5823
 epoch: 47, train_loss: 0.7927, test_loss: 0.8867, test_f1: 0.5424
 epoch: 48, train_loss: 0.8039, test_loss: 1.0460, test_f1: 0.5127
 epoch: 49, train_loss: 0.8738, test_loss: 0.9112, test_f1: 0.5737
 epoch: 50, train_loss: 0.8336, test_loss: 0.9541, test_f1: 0.5900
 epoch: 51, train_loss: 0.8133, test_loss: 0.9851, test_f1: 0.5332
 epoch: 52, train_loss: 0.7985, test_loss: 1.0039, test_f1: 0.5867
 epoch: 53, train_loss: 0.8018, test_loss: 0.9808, test_f1: 0.5468
 epoch: 54, train_loss: 0.7934, test_loss: 0.9793, test_f1: 0.5274
 epoch: 55, train_loss: 0.7850, test_loss: 0.9294, test_f1: 0.5757
 epoch: 56, train_loss: 0.8011, test_loss: 0.9927, test_f1: 0.5981
 epoch: 57, train_loss: 0.7787, test_loss: 0.9502, test_f1: 0.5702
 epoch: 58, train_loss: 0.7689, test_loss: 0.9643, test_f1: 0.5505
 epoch: 59, train_loss: 0.7769, test_loss: 0.9349, test_f1: 0.6281
 epoch: 60, train_loss: 0.7636, test_loss: 1.0420, test_f1: 0.5473
 epoch: 61, train_loss: 0.7702, test_loss: 0.9438, test_f1: 0.5671
 epoch: 62, train_loss: 0.7635, test_loss: 0.9904, test_f1: 0.5559
 epoch: 63, train_loss: 0.7565, test_loss: 1.0273, test_f1: 0.5777
 epoch: 64, train_loss: 0.7638, test_loss: 0.9775, test_f1: 0.5861
 epoch: 65, train_loss: 0.7659, test_loss: 0.9868, test_f1: 0.6339
 epoch: 66, train_loss: 0.7645, test_loss: 1.0226, test_f1: 0.5891
 epoch: 67, train_loss: 0.7371, test_loss: 0.9947, test_f1: 0.6077
 epoch: 68, train_loss: 0.7585, test_loss: 1.0416, test_f1: 0.6069
 epoch: 69, train_loss: 0.7557, test_loss: 0.9355, test_f1: 0.5490
 epoch: 70, train_loss: 0.7552, test_loss: 0.9741, test_f1: 0.6046
 epoch: 71, train_loss: 0.7651, test_loss: 0.9658, test_f1: 0.6006
 epoch: 72, train_loss: 0.7505, test_loss: 1.0372, test_f1: 0.6059
 epoch: 73, train_loss: 0.8028, test_loss: 0.9867, test_f1: 0.5693
 epoch: 74, train_loss: 0.7640, test_loss: 0.9954, test_f1: 0.5723
 epoch: 75, train_loss: 0.7514, test_loss: 0.9839, test_f1: 0.5693
 epoch: 76, train_loss: 0.7427, test_loss: 1.0089, test_f1: 0.6193
 epoch: 77, train_loss: 0.7337, test_loss: 1.0004, test_f1: 0.5686
 epoch: 78, train_loss: 0.7477, test_loss: 1.0074, test_f1: 0.5914
 epoch: 79, train_loss: 0.7354, test_loss: 1.0206, test_f1: 0.5664
 epoch: 80, train_loss: 0.7394, test_loss: 1.0103, test_f1: 0.6021
 epoch: 81, train_loss: 0.7448, test_loss: 1.0694, test_f1: 0.6151
 epoch: 82, train_loss: 0.7339, test_loss: 1.0539, test_f1: 0.5647
 epoch: 83, train_loss: 0.7382, test_loss: 0.9617, test_f1: 0.5976
 epoch: 84, train_loss: 0.7220, test_loss: 0.9138, test_f1: 0.5898
 epoch: 85, train_loss: 0.7125, test_loss: 0.9701, test_f1: 0.5910
 epoch: 86, train_loss: 0.7341, test_loss: 0.8926, test_f1: 0.6618
 epoch: 87, train_loss: 0.7302, test_loss: 0.9910, test_f1: 0.6064
 epoch: 88, train_loss: 0.7208, test_loss: 0.9627, test_f1: 0.5947
 epoch: 89, train_loss: 0.7085, test_loss: 1.0252, test_f1: 0.6137
 epoch: 90, train_loss: 0.7193, test_loss: 1.0569, test_f1: 0.5844
 epoch: 91, train_loss: 0.7195, test_loss: 1.1305, test_f1: 0.5790
 epoch: 92, train_loss: 0.7068, test_loss: 0.9869, test_f1: 0.6137
 epoch: 93, train_loss: 0.7072, test_loss: 1.0777, test_f1: 0.6152
 epoch: 94, train_loss: 0.7196, test_loss: 0.9860, test_f1: 0.6104
 epoch: 95, train_loss: 0.6982, test_loss: 1.0110, test_f1: 0.6419
 epoch: 96, train_loss: 0.7092, test_loss: 1.0001, test_f1: 0.5873
 epoch: 97, train_loss: 0.6974, test_loss: 1.1543, test_f1: 0.6211
 epoch: 98, train_loss: 0.7517, test_loss: 1.0319, test_f1: 0.5772
 epoch: 99, train_loss: 0.7347, test_loss: 1.0012, test_f1: 0.6093
##################ITERATION #5 ****************************************
 epoch: 0, train_loss: 1.1598, test_loss: 1.0813, test_f1: 0.3746
 epoch: 1, train_loss: 1.0265, test_loss: 1.0252, test_f1: 0.4958
 epoch: 2, train_loss: 1.0086, test_loss: 1.0451, test_f1: 0.5238
 epoch: 3, train_loss: 0.9994, test_loss: 1.0397, test_f1: 0.4563
 epoch: 4, train_loss: 0.9813, test_loss: 1.0074, test_f1: 0.4662
 epoch: 5, train_loss: 0.9670, test_loss: 0.9850, test_f1: 0.4973
 epoch: 6, train_loss: 0.9691, test_loss: 1.0245, test_f1: 0.4840
 epoch: 7, train_loss: 0.9547, test_loss: 1.0071, test_f1: 0.4489
 epoch: 8, train_loss: 0.9561, test_loss: 0.9732, test_f1: 0.5118
 epoch: 9, train_loss: 0.9459, test_loss: 1.0196, test_f1: 0.4722
 epoch: 10, train_loss: 0.9507, test_loss: 0.9223, test_f1: 0.5186
 epoch: 11, train_loss: 0.9408, test_loss: 0.9912, test_f1: 0.4818
 epoch: 12, train_loss: 0.9322, test_loss: 0.9941, test_f1: 0.4915
 epoch: 13, train_loss: 0.9334, test_loss: 0.9970, test_f1: 0.4946
 epoch: 14, train_loss: 0.9248, test_loss: 0.9362, test_f1: 0.5295
 epoch: 15, train_loss: 0.9128, test_loss: 0.8897, test_f1: 0.5109
 epoch: 16, train_loss: 0.9162, test_loss: 0.9435, test_f1: 0.5162
 epoch: 17, train_loss: 0.9201, test_loss: 0.9668, test_f1: 0.5038
 epoch: 18, train_loss: 0.8955, test_loss: 0.9446, test_f1: 0.5107
 epoch: 19, train_loss: 0.9045, test_loss: 0.9748, test_f1: 0.5374
 epoch: 20, train_loss: 0.8956, test_loss: 0.9734, test_f1: 0.5002
 epoch: 21, train_loss: 0.8908, test_loss: 0.9334, test_f1: 0.5127
 epoch: 22, train_loss: 0.8828, test_loss: 0.9438, test_f1: 0.5360
 epoch: 23, train_loss: 0.8835, test_loss: 0.9477, test_f1: 0.4966
 epoch: 24, train_loss: 0.8758, test_loss: 0.9489, test_f1: 0.5312
 epoch: 25, train_loss: 0.8707, test_loss: 0.9230, test_f1: 0.5585
 epoch: 26, train_loss: 0.8961, test_loss: 0.9627, test_f1: 0.4910
 epoch: 27, train_loss: 0.8834, test_loss: 0.8903, test_f1: 0.5498
 epoch: 28, train_loss: 0.8639, test_loss: 0.8816, test_f1: 0.5511
 epoch: 29, train_loss: 0.8601, test_loss: 0.9125, test_f1: 0.5656
 epoch: 30, train_loss: 0.8634, test_loss: 0.8634, test_f1: 0.5692
 epoch: 31, train_loss: 0.8860, test_loss: 0.9221, test_f1: 0.5439
 epoch: 32, train_loss: 0.8570, test_loss: 0.8808, test_f1: 0.5373
 epoch: 33, train_loss: 0.8560, test_loss: 0.9584, test_f1: 0.5592
 epoch: 34, train_loss: 0.8489, test_loss: 0.9039, test_f1: 0.5699
 epoch: 35, train_loss: 0.8507, test_loss: 0.9149, test_f1: 0.5489
 epoch: 36, train_loss: 0.8806, test_loss: 0.8859, test_f1: 0.5858
 epoch: 37, train_loss: 0.8547, test_loss: 0.8446, test_f1: 0.5704
 epoch: 38, train_loss: 0.8407, test_loss: 0.8706, test_f1: 0.5713
 epoch: 39, train_loss: 0.8356, test_loss: 0.9347, test_f1: 0.5742
 epoch: 40, train_loss: 0.8413, test_loss: 0.9760, test_f1: 0.5805
 epoch: 41, train_loss: 0.8378, test_loss: 0.9447, test_f1: 0.5330
 epoch: 42, train_loss: 0.8245, test_loss: 0.9159, test_f1: 0.5441
 epoch: 43, train_loss: 0.8772, test_loss: 0.9240, test_f1: 0.5815
 epoch: 44, train_loss: 0.8422, test_loss: 0.9570, test_f1: 0.5601
 epoch: 45, train_loss: 0.8452, test_loss: 0.8940, test_f1: 0.5752
 epoch: 46, train_loss: 0.8368, test_loss: 0.8877, test_f1: 0.6083
 epoch: 47, train_loss: 0.8123, test_loss: 0.8951, test_f1: 0.5727
 epoch: 48, train_loss: 0.8155, test_loss: 0.8764, test_f1: 0.5867
 epoch: 49, train_loss: 0.8091, test_loss: 0.9116, test_f1: 0.5555
 epoch: 50, train_loss: 0.8163, test_loss: 0.9050, test_f1: 0.5573
 epoch: 51, train_loss: 0.8132, test_loss: 0.9365, test_f1: 0.5921
 epoch: 52, train_loss: 0.8180, test_loss: 0.9110, test_f1: 0.5711
 epoch: 53, train_loss: 0.8112, test_loss: 0.8910, test_f1: 0.6206
 epoch: 54, train_loss: 0.8031, test_loss: 0.8779, test_f1: 0.6194
 epoch: 55, train_loss: 0.8037, test_loss: 0.8883, test_f1: 0.6167
 epoch: 56, train_loss: 0.8228, test_loss: 0.9114, test_f1: 0.6169
 epoch: 57, train_loss: 0.8221, test_loss: 0.9281, test_f1: 0.6080
 epoch: 58, train_loss: 0.8013, test_loss: 0.8908, test_f1: 0.5948
 epoch: 59, train_loss: 0.7870, test_loss: 0.9123, test_f1: 0.6086
 epoch: 60, train_loss: 0.7909, test_loss: 0.9414, test_f1: 0.5752
 epoch: 61, train_loss: 0.7988, test_loss: 0.9205, test_f1: 0.6210
 epoch: 62, train_loss: 0.7881, test_loss: 0.9004, test_f1: 0.6411
 epoch: 63, train_loss: 0.7858, test_loss: 0.8813, test_f1: 0.6277
 epoch: 64, train_loss: 0.7883, test_loss: 0.8819, test_f1: 0.6047
 epoch: 65, train_loss: 0.7840, test_loss: 0.8969, test_f1: 0.6302
 epoch: 66, train_loss: 0.7965, test_loss: 0.9079, test_f1: 0.5902
 epoch: 67, train_loss: 0.7880, test_loss: 0.8995, test_f1: 0.6214
 epoch: 68, train_loss: 0.7698, test_loss: 0.8877, test_f1: 0.6086
 epoch: 69, train_loss: 0.7733, test_loss: 0.9154, test_f1: 0.6305
 epoch: 70, train_loss: 0.7830, test_loss: 0.8870, test_f1: 0.5873
 epoch: 71, train_loss: 0.7708, test_loss: 0.8764, test_f1: 0.6117
 epoch: 72, train_loss: 0.7756, test_loss: 0.8938, test_f1: 0.5976
 epoch: 73, train_loss: 0.7796, test_loss: 0.8794, test_f1: 0.6098
 epoch: 74, train_loss: 0.7793, test_loss: 0.8878, test_f1: 0.5717
 epoch: 75, train_loss: 0.7798, test_loss: 0.9113, test_f1: 0.5882
 epoch: 76, train_loss: 0.7675, test_loss: 0.9037, test_f1: 0.6273
 epoch: 77, train_loss: 0.7679, test_loss: 0.9236, test_f1: 0.6015
 epoch: 78, train_loss: 0.7790, test_loss: 0.8993, test_f1: 0.6078
 epoch: 79, train_loss: 0.7645, test_loss: 0.8670, test_f1: 0.5886
 epoch: 80, train_loss: 0.7733, test_loss: 0.9034, test_f1: 0.6140
 epoch: 81, train_loss: 0.7563, test_loss: 0.9264, test_f1: 0.6032
 epoch: 82, train_loss: 0.7469, test_loss: 0.9224, test_f1: 0.6221
 epoch: 83, train_loss: 0.7651, test_loss: 0.9201, test_f1: 0.6155
 epoch: 84, train_loss: 0.7778, test_loss: 0.8909, test_f1: 0.6116
 epoch: 85, train_loss: 0.7543, test_loss: 0.9381, test_f1: 0.6107
 epoch: 86, train_loss: 0.7591, test_loss: 0.9543, test_f1: 0.6207
 epoch: 87, train_loss: 0.7424, test_loss: 0.8813, test_f1: 0.6527
 epoch: 88, train_loss: 0.7523, test_loss: 0.9184, test_f1: 0.6133
 epoch: 89, train_loss: 0.7551, test_loss: 0.9484, test_f1: 0.6126
 epoch: 90, train_loss: 0.7463, test_loss: 0.9213, test_f1: 0.6231
 epoch: 91, train_loss: 0.7569, test_loss: 0.9133, test_f1: 0.5988
 epoch: 92, train_loss: 0.7551, test_loss: 0.9352, test_f1: 0.6171
 epoch: 93, train_loss: 0.7619, test_loss: 0.9316, test_f1: 0.6013
 epoch: 94, train_loss: 0.7551, test_loss: 0.9014, test_f1: 0.6142
 epoch: 95, train_loss: 0.7488, test_loss: 0.9357, test_f1: 0.6173
 epoch: 96, train_loss: 0.7371, test_loss: 1.0095, test_f1: 0.6151
 epoch: 97, train_loss: 0.7256, test_loss: 0.9269, test_f1: 0.6051
 epoch: 98, train_loss: 0.7518, test_loss: 0.9754, test_f1: 0.6319
 epoch: 99, train_loss: 0.7701, test_loss: 0.9205, test_f1: 0.5917
##################ITERATION #6 ****************************************
 epoch: 0, train_loss: 1.1196, test_loss: 1.0619, test_f1: 0.4770
 epoch: 1, train_loss: 1.0281, test_loss: 0.9772, test_f1: 0.4414
 epoch: 2, train_loss: 0.9990, test_loss: 0.9895, test_f1: 0.4589
 epoch: 3, train_loss: 0.9786, test_loss: 1.0464, test_f1: 0.4625
 epoch: 4, train_loss: 0.9960, test_loss: 1.0029, test_f1: 0.4628
 epoch: 5, train_loss: 0.9561, test_loss: 0.9648, test_f1: 0.4704
 epoch: 6, train_loss: 0.9535, test_loss: 0.9940, test_f1: 0.4457
 epoch: 7, train_loss: 0.9502, test_loss: 0.9533, test_f1: 0.4889
 epoch: 8, train_loss: 0.9453, test_loss: 0.9856, test_f1: 0.4888
 epoch: 9, train_loss: 0.9496, test_loss: 0.9624, test_f1: 0.5390
 epoch: 10, train_loss: 0.9282, test_loss: 0.9301, test_f1: 0.5050
 epoch: 11, train_loss: 0.9356, test_loss: 0.9599, test_f1: 0.4932
 epoch: 12, train_loss: 0.9145, test_loss: 0.9689, test_f1: 0.4704
 epoch: 13, train_loss: 0.8986, test_loss: 1.0070, test_f1: 0.5038
 epoch: 14, train_loss: 0.9092, test_loss: 0.9526, test_f1: 0.5331
 epoch: 15, train_loss: 0.9184, test_loss: 0.9737, test_f1: 0.5212
 epoch: 16, train_loss: 0.8887, test_loss: 0.9569, test_f1: 0.5170
 epoch: 17, train_loss: 0.8958, test_loss: 0.9776, test_f1: 0.4569
 epoch: 18, train_loss: 0.8958, test_loss: 0.9400, test_f1: 0.5472
 epoch: 19, train_loss: 0.8740, test_loss: 0.9510, test_f1: 0.5169
 epoch: 20, train_loss: 0.8865, test_loss: 0.9411, test_f1: 0.5204
 epoch: 21, train_loss: 0.9097, test_loss: 0.9126, test_f1: 0.5376
 epoch: 22, train_loss: 0.8708, test_loss: 0.9497, test_f1: 0.5351
 epoch: 23, train_loss: 0.8717, test_loss: 0.9804, test_f1: 0.5713
 epoch: 24, train_loss: 0.8627, test_loss: 0.9324, test_f1: 0.6100
 epoch: 25, train_loss: 0.8589, test_loss: 0.9417, test_f1: 0.5800
 epoch: 26, train_loss: 0.8580, test_loss: 0.9468, test_f1: 0.6086
 epoch: 27, train_loss: 0.8570, test_loss: 0.9223, test_f1: 0.5494
 epoch: 28, train_loss: 0.8457, test_loss: 0.9088, test_f1: 0.5576
 epoch: 29, train_loss: 0.8472, test_loss: 0.9112, test_f1: 0.5950
 epoch: 30, train_loss: 0.8490, test_loss: 0.8883, test_f1: 0.5748
 epoch: 31, train_loss: 0.8399, test_loss: 0.8828, test_f1: 0.6115
 epoch: 32, train_loss: 0.8386, test_loss: 0.8935, test_f1: 0.5353
 epoch: 33, train_loss: 0.8412, test_loss: 0.8927, test_f1: 0.6061
 epoch: 34, train_loss: 0.8263, test_loss: 0.8967, test_f1: 0.5793
 epoch: 35, train_loss: 0.8340, test_loss: 0.9366, test_f1: 0.5647
 epoch: 36, train_loss: 0.8273, test_loss: 0.9794, test_f1: 0.4890
 epoch: 37, train_loss: 0.9540, test_loss: 1.0201, test_f1: 0.5081
 epoch: 38, train_loss: 0.8982, test_loss: 0.9782, test_f1: 0.5444
 epoch: 39, train_loss: 0.9107, test_loss: 0.9460, test_f1: 0.4771
 epoch: 40, train_loss: 0.8831, test_loss: 0.9376, test_f1: 0.4907
 epoch: 41, train_loss: 0.8951, test_loss: 0.9323, test_f1: 0.5228
 epoch: 42, train_loss: 0.8669, test_loss: 0.9103, test_f1: 0.5258
 epoch: 43, train_loss: 0.8556, test_loss: 0.9469, test_f1: 0.5366
 epoch: 44, train_loss: 0.8416, test_loss: 0.9529, test_f1: 0.5182
 epoch: 45, train_loss: 0.8416, test_loss: 0.9185, test_f1: 0.5747
 epoch: 46, train_loss: 0.8509, test_loss: 0.9170, test_f1: 0.6009
 epoch: 47, train_loss: 0.8181, test_loss: 0.9244, test_f1: 0.5874
 epoch: 48, train_loss: 0.8243, test_loss: 0.9367, test_f1: 0.5992
 epoch: 49, train_loss: 0.8385, test_loss: 0.9136, test_f1: 0.5743
 epoch: 50, train_loss: 0.8327, test_loss: 0.8747, test_f1: 0.5972
 epoch: 51, train_loss: 0.8004, test_loss: 0.9377, test_f1: 0.6109
 epoch: 52, train_loss: 0.7958, test_loss: 0.8828, test_f1: 0.6076
 epoch: 53, train_loss: 0.7960, test_loss: 0.9286, test_f1: 0.6202
 epoch: 54, train_loss: 0.7786, test_loss: 0.9038, test_f1: 0.6160
 epoch: 55, train_loss: 0.7719, test_loss: 0.9332, test_f1: 0.5972
 epoch: 56, train_loss: 0.7641, test_loss: 0.9433, test_f1: 0.5838
 epoch: 57, train_loss: 0.7721, test_loss: 0.9432, test_f1: 0.5850
 epoch: 58, train_loss: 0.7626, test_loss: 0.9315, test_f1: 0.6213
 epoch: 59, train_loss: 0.7529, test_loss: 0.9259, test_f1: 0.5943
 epoch: 60, train_loss: 0.7709, test_loss: 0.9089, test_f1: 0.6207
 epoch: 61, train_loss: 0.7665, test_loss: 0.9186, test_f1: 0.5806
 epoch: 62, train_loss: 0.7466, test_loss: 0.9689, test_f1: 0.6195
 epoch: 63, train_loss: 0.7520, test_loss: 0.9292, test_f1: 0.5989
 epoch: 64, train_loss: 0.7764, test_loss: 0.9097, test_f1: 0.6195
 epoch: 65, train_loss: 0.7649, test_loss: 0.9011, test_f1: 0.6088
 epoch: 66, train_loss: 0.7796, test_loss: 0.9112, test_f1: 0.5858
 epoch: 67, train_loss: 0.7517, test_loss: 0.9062, test_f1: 0.5870
 epoch: 68, train_loss: 0.7637, test_loss: 0.9041, test_f1: 0.5618
 epoch: 69, train_loss: 0.7708, test_loss: 0.9174, test_f1: 0.5745
 epoch: 70, train_loss: 0.7499, test_loss: 0.9160, test_f1: 0.6038
 epoch: 71, train_loss: 0.7564, test_loss: 0.8918, test_f1: 0.6062
 epoch: 72, train_loss: 0.7603, test_loss: 0.9205, test_f1: 0.5947
 epoch: 73, train_loss: 0.7400, test_loss: 0.9328, test_f1: 0.6331
 epoch: 74, train_loss: 0.7406, test_loss: 0.9306, test_f1: 0.5837
 epoch: 75, train_loss: 0.7369, test_loss: 0.9540, test_f1: 0.5978
 epoch: 76, train_loss: 0.7658, test_loss: 0.9470, test_f1: 0.6269
 epoch: 77, train_loss: 0.7319, test_loss: 0.9351, test_f1: 0.6069
 epoch: 78, train_loss: 0.7442, test_loss: 0.9186, test_f1: 0.6008
 epoch: 79, train_loss: 0.7528, test_loss: 0.9435, test_f1: 0.6176
 epoch: 80, train_loss: 0.7383, test_loss: 0.9462, test_f1: 0.6340
 epoch: 81, train_loss: 0.7320, test_loss: 0.9441, test_f1: 0.6157
 epoch: 82, train_loss: 0.7334, test_loss: 0.9411, test_f1: 0.5958
 epoch: 83, train_loss: 0.7322, test_loss: 0.9629, test_f1: 0.6174
 epoch: 84, train_loss: 0.7486, test_loss: 0.9219, test_f1: 0.6132
 epoch: 85, train_loss: 0.7345, test_loss: 0.9533, test_f1: 0.6132
 epoch: 86, train_loss: 0.7053, test_loss: 0.9194, test_f1: 0.6036
 epoch: 87, train_loss: 0.7394, test_loss: 0.9244, test_f1: 0.5984
 epoch: 88, train_loss: 0.7550, test_loss: 0.9222, test_f1: 0.6193
 epoch: 89, train_loss: 0.7258, test_loss: 0.9239, test_f1: 0.6197
 epoch: 90, train_loss: 0.7247, test_loss: 0.9431, test_f1: 0.5917
 epoch: 91, train_loss: 0.7321, test_loss: 0.9322, test_f1: 0.6209
 epoch: 92, train_loss: 0.7121, test_loss: 0.9324, test_f1: 0.6350
 epoch: 93, train_loss: 0.7128, test_loss: 0.9476, test_f1: 0.6052
 epoch: 94, train_loss: 0.7218, test_loss: 0.9830, test_f1: 0.5881
 epoch: 95, train_loss: 0.7260, test_loss: 1.0044, test_f1: 0.5959
 epoch: 96, train_loss: 0.7132, test_loss: 0.9104, test_f1: 0.6030
 epoch: 97, train_loss: 0.6988, test_loss: 0.9098, test_f1: 0.6232
 epoch: 98, train_loss: 0.7224, test_loss: 0.9586, test_f1: 0.6180
 epoch: 99, train_loss: 0.7067, test_loss: 0.9542, test_f1: 0.5827
##################ITERATION #7 ****************************************
 epoch: 0, train_loss: 1.1859, test_loss: 1.0694, test_f1: 0.4224
 epoch: 1, train_loss: 1.0469, test_loss: 1.0743, test_f1: 0.4548
 epoch: 2, train_loss: 1.0100, test_loss: 1.0222, test_f1: 0.4324
 epoch: 3, train_loss: 0.9959, test_loss: 0.9850, test_f1: 0.4733
 epoch: 4, train_loss: 1.0020, test_loss: 1.0288, test_f1: 0.4762
 epoch: 5, train_loss: 0.9877, test_loss: 1.0471, test_f1: 0.4277
 epoch: 6, train_loss: 0.9920, test_loss: 1.0565, test_f1: 0.4556
 epoch: 7, train_loss: 0.9779, test_loss: 0.9602, test_f1: 0.4830
 epoch: 8, train_loss: 0.9688, test_loss: 1.0091, test_f1: 0.4977
 epoch: 9, train_loss: 0.9611, test_loss: 1.0038, test_f1: 0.4681
 epoch: 10, train_loss: 0.9554, test_loss: 0.9675, test_f1: 0.4912
 epoch: 11, train_loss: 0.9468, test_loss: 1.0088, test_f1: 0.4921
 epoch: 12, train_loss: 0.9560, test_loss: 0.9723, test_f1: 0.4842
 epoch: 13, train_loss: 0.9490, test_loss: 0.9249, test_f1: 0.5020
 epoch: 14, train_loss: 0.9385, test_loss: 0.9218, test_f1: 0.4895
 epoch: 15, train_loss: 0.9442, test_loss: 0.9657, test_f1: 0.4538
 epoch: 16, train_loss: 0.9382, test_loss: 0.9953, test_f1: 0.5047
 epoch: 17, train_loss: 0.9224, test_loss: 0.9624, test_f1: 0.4919
 epoch: 18, train_loss: 0.9251, test_loss: 0.9209, test_f1: 0.4943
 epoch: 19, train_loss: 0.9154, test_loss: 0.9806, test_f1: 0.5096
 epoch: 20, train_loss: 0.9108, test_loss: 0.9767, test_f1: 0.5061
 epoch: 21, train_loss: 0.9072, test_loss: 0.9771, test_f1: 0.5367
 epoch: 22, train_loss: 0.9145, test_loss: 0.9368, test_f1: 0.4961
 epoch: 23, train_loss: 0.9065, test_loss: 0.9200, test_f1: 0.4844
 epoch: 24, train_loss: 0.9047, test_loss: 0.9726, test_f1: 0.5027
 epoch: 25, train_loss: 0.9021, test_loss: 0.9680, test_f1: 0.5174
 epoch: 26, train_loss: 0.8985, test_loss: 0.9548, test_f1: 0.5204
 epoch: 27, train_loss: 0.8929, test_loss: 0.9753, test_f1: 0.5019
 epoch: 28, train_loss: 0.8886, test_loss: 0.9174, test_f1: 0.4963
 epoch: 29, train_loss: 0.8912, test_loss: 0.9434, test_f1: 0.4894
 epoch: 30, train_loss: 0.8890, test_loss: 0.9488, test_f1: 0.5521
 epoch: 31, train_loss: 0.8881, test_loss: 0.9400, test_f1: 0.4957
 epoch: 32, train_loss: 0.8813, test_loss: 0.9828, test_f1: 0.4942
 epoch: 33, train_loss: 0.8833, test_loss: 0.9055, test_f1: 0.4857
 epoch: 34, train_loss: 0.8674, test_loss: 0.9300, test_f1: 0.4660
 epoch: 35, train_loss: 0.8596, test_loss: 0.9532, test_f1: 0.5267
 epoch: 36, train_loss: 0.8665, test_loss: 0.9687, test_f1: 0.4938
 epoch: 37, train_loss: 0.8706, test_loss: 1.0069, test_f1: 0.4984
 epoch: 38, train_loss: 0.8671, test_loss: 0.9188, test_f1: 0.5474
 epoch: 39, train_loss: 0.8961, test_loss: 0.9969, test_f1: 0.5019
 epoch: 40, train_loss: 0.9911, test_loss: 1.0833, test_f1: 0.4680
 epoch: 41, train_loss: 0.9616, test_loss: 0.8956, test_f1: 0.4882
 epoch: 42, train_loss: 0.9565, test_loss: 1.0613, test_f1: 0.4850
 epoch: 43, train_loss: 0.9489, test_loss: 0.9888, test_f1: 0.5145
 epoch: 44, train_loss: 0.9354, test_loss: 1.0064, test_f1: 0.4680
 epoch: 45, train_loss: 0.9179, test_loss: 0.8753, test_f1: 0.4945
 epoch: 46, train_loss: 0.9202, test_loss: 0.9798, test_f1: 0.5216
 epoch: 47, train_loss: 0.9122, test_loss: 0.9108, test_f1: 0.4854
 epoch: 48, train_loss: 0.9152, test_loss: 0.9535, test_f1: 0.4773
 epoch: 49, train_loss: 0.9014, test_loss: 0.9658, test_f1: 0.4933
 epoch: 50, train_loss: 0.8867, test_loss: 0.9631, test_f1: 0.5346
 epoch: 51, train_loss: 0.8679, test_loss: 0.9429, test_f1: 0.4965
 epoch: 52, train_loss: 0.8437, test_loss: 0.9505, test_f1: 0.5052
 epoch: 53, train_loss: 0.8593, test_loss: 0.9344, test_f1: 0.5262
 epoch: 54, train_loss: 0.8570, test_loss: 0.9774, test_f1: 0.5031
 epoch: 55, train_loss: 0.8386, test_loss: 0.9325, test_f1: 0.5654
 epoch: 56, train_loss: 0.8376, test_loss: 0.9678, test_f1: 0.5629
 epoch: 57, train_loss: 0.8289, test_loss: 0.9546, test_f1: 0.5010
 epoch: 58, train_loss: 0.8446, test_loss: 0.9365, test_f1: 0.4938
 epoch: 59, train_loss: 0.8312, test_loss: 0.9525, test_f1: 0.5024
 epoch: 60, train_loss: 0.8259, test_loss: 0.9268, test_f1: 0.5218
 epoch: 61, train_loss: 0.8223, test_loss: 0.9523, test_f1: 0.5124
 epoch: 62, train_loss: 0.8118, test_loss: 0.9275, test_f1: 0.5243
 epoch: 63, train_loss: 0.8232, test_loss: 0.9345, test_f1: 0.5759
 epoch: 64, train_loss: 0.8239, test_loss: 0.9395, test_f1: 0.5467
 epoch: 65, train_loss: 0.8078, test_loss: 0.9181, test_f1: 0.5503
 epoch: 66, train_loss: 0.8151, test_loss: 0.9042, test_f1: 0.5517
 epoch: 67, train_loss: 0.8099, test_loss: 0.9116, test_f1: 0.5853
 epoch: 68, train_loss: 0.7998, test_loss: 0.9167, test_f1: 0.5517
 epoch: 69, train_loss: 0.8229, test_loss: 0.9421, test_f1: 0.5716
 epoch: 70, train_loss: 0.8027, test_loss: 0.9036, test_f1: 0.5449
 epoch: 71, train_loss: 0.7950, test_loss: 0.9501, test_f1: 0.5392
 epoch: 72, train_loss: 0.7942, test_loss: 0.9259, test_f1: 0.5927
 epoch: 73, train_loss: 0.7893, test_loss: 0.9120, test_f1: 0.5802
 epoch: 74, train_loss: 0.7879, test_loss: 0.9452, test_f1: 0.5365
 epoch: 75, train_loss: 0.8406, test_loss: 0.9224, test_f1: 0.5322
 epoch: 76, train_loss: 0.8600, test_loss: 0.9563, test_f1: 0.5380
 epoch: 77, train_loss: 0.8410, test_loss: 0.9331, test_f1: 0.5326
 epoch: 78, train_loss: 0.8224, test_loss: 0.9797, test_f1: 0.5366
 epoch: 79, train_loss: 0.8185, test_loss: 0.9601, test_f1: 0.5519
 epoch: 80, train_loss: 0.8127, test_loss: 0.9786, test_f1: 0.5494
 epoch: 81, train_loss: 0.7907, test_loss: 0.9721, test_f1: 0.5881
 epoch: 82, train_loss: 0.7866, test_loss: 0.9855, test_f1: 0.5529
 epoch: 83, train_loss: 0.7950, test_loss: 0.9469, test_f1: 0.5872
 epoch: 84, train_loss: 0.7963, test_loss: 0.9457, test_f1: 0.5470
 epoch: 85, train_loss: 0.7971, test_loss: 0.9344, test_f1: 0.5798
 epoch: 86, train_loss: 0.7930, test_loss: 0.8952, test_f1: 0.5970
 epoch: 87, train_loss: 0.7798, test_loss: 0.8938, test_f1: 0.5307
 epoch: 88, train_loss: 0.7873, test_loss: 0.9378, test_f1: 0.6205
 epoch: 89, train_loss: 0.7755, test_loss: 0.8986, test_f1: 0.5894
 epoch: 90, train_loss: 0.7778, test_loss: 0.9428, test_f1: 0.5935
 epoch: 91, train_loss: 0.7838, test_loss: 0.9285, test_f1: 0.5770
 epoch: 92, train_loss: 0.7753, test_loss: 0.9032, test_f1: 0.5866
 epoch: 93, train_loss: 0.7639, test_loss: 0.9342, test_f1: 0.5782
 epoch: 94, train_loss: 0.7869, test_loss: 0.9533, test_f1: 0.6018
 epoch: 95, train_loss: 0.7711, test_loss: 0.9619, test_f1: 0.5468
 epoch: 96, train_loss: 0.7734, test_loss: 0.9550, test_f1: 0.5931
 epoch: 97, train_loss: 0.7869, test_loss: 0.9271, test_f1: 0.5378
 epoch: 98, train_loss: 0.7612, test_loss: 0.9139, test_f1: 0.5908
 epoch: 99, train_loss: 0.7743, test_loss: 0.9527, test_f1: 0.5882
##################ITERATION #8 ****************************************
 epoch: 0, train_loss: 1.1700, test_loss: 1.0600, test_f1: 0.4273
 epoch: 1, train_loss: 1.0238, test_loss: 1.0026, test_f1: 0.4454
 epoch: 2, train_loss: 0.9820, test_loss: 0.9286, test_f1: 0.4856
 epoch: 3, train_loss: 0.9741, test_loss: 0.9564, test_f1: 0.4683
 epoch: 4, train_loss: 0.9595, test_loss: 1.0355, test_f1: 0.4712
 epoch: 5, train_loss: 0.9519, test_loss: 0.9515, test_f1: 0.4851
 epoch: 6, train_loss: 0.9465, test_loss: 1.0581, test_f1: 0.4665
 epoch: 7, train_loss: 0.9507, test_loss: 0.9192, test_f1: 0.5105
 epoch: 8, train_loss: 0.9309, test_loss: 0.9920, test_f1: 0.4921
 epoch: 9, train_loss: 0.9374, test_loss: 0.9472, test_f1: 0.4909
 epoch: 10, train_loss: 0.9288, test_loss: 0.9351, test_f1: 0.5079
 epoch: 11, train_loss: 0.9160, test_loss: 0.9348, test_f1: 0.4973
 epoch: 12, train_loss: 0.9285, test_loss: 0.9683, test_f1: 0.4915
 epoch: 13, train_loss: 0.9220, test_loss: 0.9349, test_f1: 0.5109
 epoch: 14, train_loss: 0.9113, test_loss: 0.8983, test_f1: 0.4972
 epoch: 15, train_loss: 0.9226, test_loss: 0.9017, test_f1: 0.5015
 epoch: 16, train_loss: 0.9168, test_loss: 0.8863, test_f1: 0.5674
 epoch: 17, train_loss: 0.8841, test_loss: 0.8820, test_f1: 0.4984
 epoch: 18, train_loss: 0.8907, test_loss: 0.9135, test_f1: 0.5122
 epoch: 19, train_loss: 0.8862, test_loss: 0.9073, test_f1: 0.5047
 epoch: 20, train_loss: 0.8804, test_loss: 0.9268, test_f1: 0.5016
 epoch: 21, train_loss: 0.8771, test_loss: 0.9633, test_f1: 0.5069
 epoch: 22, train_loss: 0.8648, test_loss: 0.8937, test_f1: 0.5185
 epoch: 23, train_loss: 0.8513, test_loss: 0.9393, test_f1: 0.5414
 epoch: 24, train_loss: 0.8658, test_loss: 0.9099, test_f1: 0.4988
 epoch: 25, train_loss: 0.8658, test_loss: 0.8729, test_f1: 0.5444
 epoch: 26, train_loss: 0.8572, test_loss: 0.8694, test_f1: 0.5600
 epoch: 27, train_loss: 0.8452, test_loss: 0.9890, test_f1: 0.4788
 epoch: 28, train_loss: 0.8463, test_loss: 0.8700, test_f1: 0.5586
 epoch: 29, train_loss: 0.8293, test_loss: 0.9004, test_f1: 0.5193
 epoch: 30, train_loss: 0.8410, test_loss: 0.8814, test_f1: 0.5297
 epoch: 31, train_loss: 0.8327, test_loss: 0.9626, test_f1: 0.5318
 epoch: 32, train_loss: 0.8474, test_loss: 0.8655, test_f1: 0.5333
 epoch: 33, train_loss: 0.8262, test_loss: 0.8920, test_f1: 0.5256
 epoch: 34, train_loss: 0.8355, test_loss: 0.8477, test_f1: 0.5237
 epoch: 35, train_loss: 0.8251, test_loss: 0.9024, test_f1: 0.5482
 epoch: 36, train_loss: 0.8210, test_loss: 0.8461, test_f1: 0.5870
 epoch: 37, train_loss: 0.9066, test_loss: 0.9132, test_f1: 0.5160
 epoch: 38, train_loss: 0.8861, test_loss: 0.9321, test_f1: 0.5009
 epoch: 39, train_loss: 0.9128, test_loss: 0.9848, test_f1: 0.4657
 epoch: 40, train_loss: 0.9990, test_loss: 0.9976, test_f1: 0.4894
 epoch: 41, train_loss: 0.9373, test_loss: 1.0419, test_f1: 0.4582
 epoch: 42, train_loss: 0.9325, test_loss: 0.8777, test_f1: 0.5138
 epoch: 43, train_loss: 0.8950, test_loss: 0.8690, test_f1: 0.5738
 epoch: 44, train_loss: 0.8813, test_loss: 0.8873, test_f1: 0.5085
 epoch: 45, train_loss: 0.8725, test_loss: 0.9812, test_f1: 0.5292
 epoch: 46, train_loss: 0.8772, test_loss: 0.8824, test_f1: 0.5123
 epoch: 47, train_loss: 0.8566, test_loss: 0.8740, test_f1: 0.5369
 epoch: 48, train_loss: 0.8496, test_loss: 0.8665, test_f1: 0.5460
 epoch: 49, train_loss: 0.8425, test_loss: 0.8919, test_f1: 0.5218
 epoch: 50, train_loss: 0.8390, test_loss: 0.8466, test_f1: 0.5327
 epoch: 51, train_loss: 0.8271, test_loss: 0.8695, test_f1: 0.5348
 epoch: 52, train_loss: 0.8084, test_loss: 0.8605, test_f1: 0.5604
 epoch: 53, train_loss: 0.8200, test_loss: 0.8479, test_f1: 0.5468
 epoch: 54, train_loss: 0.7960, test_loss: 0.8941, test_f1: 0.5519
 epoch: 55, train_loss: 0.8157, test_loss: 0.8443, test_f1: 0.5553
 epoch: 56, train_loss: 0.7978, test_loss: 0.8459, test_f1: 0.5630
 epoch: 57, train_loss: 0.8100, test_loss: 0.8338, test_f1: 0.5575
 epoch: 58, train_loss: 0.7915, test_loss: 0.8579, test_f1: 0.5846
 epoch: 59, train_loss: 0.7987, test_loss: 0.8800, test_f1: 0.5540
 epoch: 60, train_loss: 0.7903, test_loss: 0.8278, test_f1: 0.5542
 epoch: 61, train_loss: 0.7748, test_loss: 0.8375, test_f1: 0.5623
 epoch: 62, train_loss: 0.7726, test_loss: 0.8154, test_f1: 0.5997
 epoch: 63, train_loss: 0.7842, test_loss: 0.8422, test_f1: 0.5647
 epoch: 64, train_loss: 0.7755, test_loss: 0.8260, test_f1: 0.6225
 epoch: 65, train_loss: 0.7699, test_loss: 0.8507, test_f1: 0.5954
 epoch: 66, train_loss: 0.7877, test_loss: 0.8444, test_f1: 0.6032
 epoch: 67, train_loss: 0.7753, test_loss: 0.8663, test_f1: 0.5950
 epoch: 68, train_loss: 0.7798, test_loss: 0.8270, test_f1: 0.6347
 epoch: 69, train_loss: 0.7671, test_loss: 0.8265, test_f1: 0.6220
 epoch: 70, train_loss: 0.7636, test_loss: 0.8412, test_f1: 0.5839
 epoch: 71, train_loss: 0.7666, test_loss: 0.8230, test_f1: 0.6145
 epoch: 72, train_loss: 0.7618, test_loss: 0.8317, test_f1: 0.6373
 epoch: 73, train_loss: 0.7559, test_loss: 0.8520, test_f1: 0.6255
 epoch: 74, train_loss: 0.7691, test_loss: 0.8417, test_f1: 0.5993
 epoch: 75, train_loss: 0.7477, test_loss: 0.8408, test_f1: 0.5942
 epoch: 76, train_loss: 0.7607, test_loss: 0.8295, test_f1: 0.5895
 epoch: 77, train_loss: 0.7474, test_loss: 0.8343, test_f1: 0.6194
 epoch: 78, train_loss: 0.7407, test_loss: 0.8491, test_f1: 0.6396
 epoch: 79, train_loss: 0.7460, test_loss: 0.8449, test_f1: 0.6258
 epoch: 80, train_loss: 0.7527, test_loss: 0.8350, test_f1: 0.6190
 epoch: 81, train_loss: 0.7503, test_loss: 0.8228, test_f1: 0.5788
 epoch: 82, train_loss: 0.7375, test_loss: 0.8521, test_f1: 0.5964
 epoch: 83, train_loss: 0.7542, test_loss: 0.8115, test_f1: 0.6279
 epoch: 84, train_loss: 0.7464, test_loss: 0.8997, test_f1: 0.5589
 epoch: 85, train_loss: 0.7961, test_loss: 0.8515, test_f1: 0.5839
 epoch: 86, train_loss: 0.7699, test_loss: 0.8268, test_f1: 0.6214
 epoch: 87, train_loss: 0.7597, test_loss: 0.8353, test_f1: 0.6519
 epoch: 88, train_loss: 0.7612, test_loss: 0.8759, test_f1: 0.5737
 epoch: 89, train_loss: 0.7368, test_loss: 0.8265, test_f1: 0.6408
 epoch: 90, train_loss: 0.7433, test_loss: 0.8376, test_f1: 0.6039
 epoch: 91, train_loss: 0.7457, test_loss: 0.8442, test_f1: 0.6263
 epoch: 92, train_loss: 0.7383, test_loss: 0.8492, test_f1: 0.6274
 epoch: 93, train_loss: 0.7308, test_loss: 0.8791, test_f1: 0.6284
 epoch: 94, train_loss: 0.7332, test_loss: 0.8434, test_f1: 0.5988
 epoch: 95, train_loss: 0.7344, test_loss: 0.8898, test_f1: 0.6233
 epoch: 96, train_loss: 0.7098, test_loss: 0.9238, test_f1: 0.6082
 epoch: 97, train_loss: 0.7320, test_loss: 0.8084, test_f1: 0.6363
 epoch: 98, train_loss: 0.7234, test_loss: 0.8763, test_f1: 0.6124
 epoch: 99, train_loss: 0.7229, test_loss: 0.8694, test_f1: 0.6016
##################ITERATION #9 ****************************************
 epoch: 0, train_loss: 1.1432, test_loss: 1.0740, test_f1: 0.4315
 epoch: 1, train_loss: 1.0500, test_loss: 1.0372, test_f1: 0.4436
 epoch: 2, train_loss: 1.0192, test_loss: 0.9761, test_f1: 0.4763
 epoch: 3, train_loss: 0.9903, test_loss: 1.0108, test_f1: 0.4765
 epoch: 4, train_loss: 0.9928, test_loss: 0.9635, test_f1: 0.5124
 epoch: 5, train_loss: 0.9713, test_loss: 1.0260, test_f1: 0.4863
 epoch: 6, train_loss: 0.9678, test_loss: 0.9924, test_f1: 0.5323
 epoch: 7, train_loss: 0.9464, test_loss: 0.9806, test_f1: 0.5434
 epoch: 8, train_loss: 0.9629, test_loss: 0.9664, test_f1: 0.5033
 epoch: 9, train_loss: 0.9367, test_loss: 1.0077, test_f1: 0.5455
 epoch: 10, train_loss: 0.9424, test_loss: 0.8802, test_f1: 0.5133
 epoch: 11, train_loss: 0.9214, test_loss: 0.8837, test_f1: 0.5468
 epoch: 12, train_loss: 0.9153, test_loss: 0.9608, test_f1: 0.5405
 epoch: 13, train_loss: 0.9334, test_loss: 0.9910, test_f1: 0.4688
 epoch: 14, train_loss: 0.9108, test_loss: 0.9337, test_f1: 0.5005
 epoch: 15, train_loss: 0.9114, test_loss: 0.9540, test_f1: 0.5125
 epoch: 16, train_loss: 0.9128, test_loss: 1.0458, test_f1: 0.5229
 epoch: 17, train_loss: 0.9247, test_loss: 1.0101, test_f1: 0.5305
 epoch: 18, train_loss: 0.9040, test_loss: 0.9969, test_f1: 0.5086
 epoch: 19, train_loss: 0.9139, test_loss: 0.9883, test_f1: 0.4895
 epoch: 20, train_loss: 0.9044, test_loss: 0.9430, test_f1: 0.5286
 epoch: 21, train_loss: 0.9034, test_loss: 0.9497, test_f1: 0.5298
 epoch: 22, train_loss: 0.8871, test_loss: 0.9417, test_f1: 0.5208
 epoch: 23, train_loss: 0.8823, test_loss: 0.9511, test_f1: 0.5320
 epoch: 24, train_loss: 0.8957, test_loss: 0.9600, test_f1: 0.5447
 epoch: 25, train_loss: 0.8739, test_loss: 0.9383, test_f1: 0.5193
 epoch: 26, train_loss: 0.8814, test_loss: 0.9376, test_f1: 0.5583
 epoch: 27, train_loss: 0.8904, test_loss: 0.9998, test_f1: 0.4903
 epoch: 28, train_loss: 0.9053, test_loss: 0.9605, test_f1: 0.4925
 epoch: 29, train_loss: 0.8857, test_loss: 0.9469, test_f1: 0.5198
 epoch: 30, train_loss: 0.8764, test_loss: 0.9312, test_f1: 0.5647
 epoch: 31, train_loss: 0.8866, test_loss: 0.9193, test_f1: 0.5465
 epoch: 32, train_loss: 0.8563, test_loss: 0.9084, test_f1: 0.5779
 epoch: 33, train_loss: 0.8492, test_loss: 0.9119, test_f1: 0.5646
 epoch: 34, train_loss: 0.8490, test_loss: 0.8933, test_f1: 0.5534
 epoch: 35, train_loss: 0.8473, test_loss: 0.9053, test_f1: 0.5784
 epoch: 36, train_loss: 0.8425, test_loss: 0.8967, test_f1: 0.5841
 epoch: 37, train_loss: 0.8443, test_loss: 0.9154, test_f1: 0.5369
 epoch: 38, train_loss: 0.8391, test_loss: 0.8627, test_f1: 0.5544
 epoch: 39, train_loss: 0.8484, test_loss: 0.8921, test_f1: 0.5667
 epoch: 40, train_loss: 0.8272, test_loss: 0.9257, test_f1: 0.5268
 epoch: 41, train_loss: 0.8355, test_loss: 0.8826, test_f1: 0.6024
 epoch: 42, train_loss: 0.8310, test_loss: 0.8859, test_f1: 0.5518
 epoch: 43, train_loss: 0.8310, test_loss: 0.9555, test_f1: 0.5354
 epoch: 44, train_loss: 0.8525, test_loss: 0.9120, test_f1: 0.5703
 epoch: 45, train_loss: 0.8500, test_loss: 0.8983, test_f1: 0.5425
 epoch: 46, train_loss: 0.8364, test_loss: 0.8816, test_f1: 0.6049
 epoch: 47, train_loss: 0.8341, test_loss: 0.9045, test_f1: 0.5676
 epoch: 48, train_loss: 0.8129, test_loss: 0.8539, test_f1: 0.5820
 epoch: 49, train_loss: 0.8089, test_loss: 0.8806, test_f1: 0.5525
 epoch: 50, train_loss: 0.8230, test_loss: 0.9093, test_f1: 0.5498
 epoch: 51, train_loss: 0.7991, test_loss: 0.8406, test_f1: 0.6190
 epoch: 52, train_loss: 0.7930, test_loss: 0.8745, test_f1: 0.5674
 epoch: 53, train_loss: 0.7765, test_loss: 0.8756, test_f1: 0.5967
 epoch: 54, train_loss: 0.7710, test_loss: 0.8859, test_f1: 0.5790
 epoch: 55, train_loss: 0.7854, test_loss: 0.8590, test_f1: 0.5937
 epoch: 56, train_loss: 0.7832, test_loss: 0.8772, test_f1: 0.6155
 epoch: 57, train_loss: 0.7749, test_loss: 0.8806, test_f1: 0.5969
 epoch: 58, train_loss: 0.7767, test_loss: 0.8645, test_f1: 0.6120
 epoch: 59, train_loss: 0.7700, test_loss: 0.8862, test_f1: 0.6010
 epoch: 60, train_loss: 0.7806, test_loss: 0.8481, test_f1: 0.6020
 epoch: 61, train_loss: 0.7729, test_loss: 0.8312, test_f1: 0.6066
 epoch: 62, train_loss: 0.7601, test_loss: 0.8494, test_f1: 0.5796
 epoch: 63, train_loss: 0.7622, test_loss: 0.8559, test_f1: 0.6004
 epoch: 64, train_loss: 0.7745, test_loss: 0.8311, test_f1: 0.6383
 epoch: 65, train_loss: 0.7542, test_loss: 0.8743, test_f1: 0.5997
 epoch: 66, train_loss: 0.7474, test_loss: 0.8316, test_f1: 0.6175
 epoch: 67, train_loss: 0.7608, test_loss: 0.8505, test_f1: 0.6165
 epoch: 68, train_loss: 0.7454, test_loss: 0.8236, test_f1: 0.6126
 epoch: 69, train_loss: 0.7478, test_loss: 0.8352, test_f1: 0.6243
 epoch: 70, train_loss: 0.7586, test_loss: 0.8611, test_f1: 0.5999
 epoch: 71, train_loss: 0.7585, test_loss: 0.8693, test_f1: 0.6223
 epoch: 72, train_loss: 0.7499, test_loss: 0.8383, test_f1: 0.6010
 epoch: 73, train_loss: 0.7431, test_loss: 0.8435, test_f1: 0.6318
 epoch: 74, train_loss: 0.7548, test_loss: 0.8567, test_f1: 0.5978
 epoch: 75, train_loss: 0.7639, test_loss: 0.8656, test_f1: 0.5990
 epoch: 76, train_loss: 0.7505, test_loss: 0.8494, test_f1: 0.5911
 epoch: 77, train_loss: 0.7575, test_loss: 0.8839, test_f1: 0.5864
 epoch: 78, train_loss: 0.7625, test_loss: 0.8478, test_f1: 0.6083
 epoch: 79, train_loss: 0.7424, test_loss: 0.8500, test_f1: 0.6403
 epoch: 80, train_loss: 0.7430, test_loss: 0.8520, test_f1: 0.6088
 epoch: 81, train_loss: 0.7418, test_loss: 0.8641, test_f1: 0.6257
 epoch: 82, train_loss: 0.7283, test_loss: 0.8402, test_f1: 0.6365
 epoch: 83, train_loss: 0.7594, test_loss: 0.8692, test_f1: 0.6107
 epoch: 84, train_loss: 0.7286, test_loss: 0.8444, test_f1: 0.6403
 epoch: 85, train_loss: 0.7240, test_loss: 0.8384, test_f1: 0.6215
 epoch: 86, train_loss: 0.7268, test_loss: 0.8628, test_f1: 0.6392
 epoch: 87, train_loss: 0.7392, test_loss: 0.8699, test_f1: 0.6185
 epoch: 88, train_loss: 0.7263, test_loss: 0.8517, test_f1: 0.6177
 epoch: 89, train_loss: 0.7264, test_loss: 0.8434, test_f1: 0.6393
 epoch: 90, train_loss: 0.7288, test_loss: 0.8418, test_f1: 0.6487
 epoch: 91, train_loss: 0.7384, test_loss: 0.8517, test_f1: 0.6292
 epoch: 92, train_loss: 0.7405, test_loss: 0.8533, test_f1: 0.6159
 epoch: 93, train_loss: 0.7129, test_loss: 0.8646, test_f1: 0.5916
 epoch: 94, train_loss: 0.7141, test_loss: 0.8601, test_f1: 0.6403
 epoch: 95, train_loss: 0.7068, test_loss: 0.8671, test_f1: 0.6137
 epoch: 96, train_loss: 0.7095, test_loss: 0.8901, test_f1: 0.6134
 epoch: 97, train_loss: 0.7091, test_loss: 0.8954, test_f1: 0.6242
 epoch: 98, train_loss: 0.6914, test_loss: 0.8449, test_f1: 0.6280
 epoch: 99, train_loss: 0.7077, test_loss: 0.8304, test_f1: 0.6527

Training completed in 1109.45 seconds
Best F1: 0.6626 at epoch 87
Mean F1 across iterations: 0.6481  0.0133
========================FINAL RESULTS================================
FEGIN weighted F1: 0.6626  0.0133
python main.py --data ltspice_examples --representation component_net --model FEGIN --layers 4 --hiddens 32 --batch_size 32 --lr 0.01 --emb_size 128 --epochs 100 --save_appendix component_net_L4_H32_BS32_LR0.01_E128 --no_val
-----



STDERR:
  File "main.py", line 370, in <module>
    main()
  File "main.py", line 254, in main
    dataset = dataset_class(
  File "/home/philip/projects/ltspice_examples_code_repo/Circuit-Completion-Using-GNNs/component_classification_with_link_prediction_head/evaluation/FEGIN/kernel/circuit_datasets.py", line 15, in __init__
    self.data, self.slices = torch.load(self.processed_paths[0])
  File "/home/philip/.local/lib/python3.8/site-packages/torch/serialization.py", line 1040, in load
    warnings.warn(
  File "/usr/lib/python3.8/warnings.py", line 109, in _showwarnmsg
    sw(msg.message, msg.category, msg.filename, msg.lineno,
  File "main.py", line 47, in warn_with_traceback
    traceback.print_stack(file=log)
/home/philip/projects/ltspice_examples_code_repo/Circuit-Completion-Using-GNNs/component_classification_with_link_prediction_head/evaluation/FEGIN/kernel/circuit_datasets.py:15: FutureWarning: You are using `torch.load` with `weights_only=False` (the current default value), which uses the default pickle module implicitly. It is possible to construct malicious pickle data which will execute arbitrary code during unpickling (See https://github.com/pytorch/pytorch/blob/main/SECURITY.md#untrusted-models for more details). In a future release, the default value for `weights_only` will be flipped to `True`. This limits the functions that could be executed during unpickling. Arbitrary objects will no longer be allowed to be loaded via this mode unless they are explicitly allowlisted by the user via `torch.serialization.add_safe_globals`. We recommend you start setting `weights_only=True` for any use case where you don't have full control of the loaded file. Please open an issue on GitHub for any issues related to this experimental feature.
  self.data, self.slices = torch.load(self.processed_paths[0])
