STDOUT:
Results will be saved in /home/philip/projects/ltspice_examples_code_repo/Circuit-Completion-Using-GNNs/component_classification_with_link_prediction_head/evaluation/FEGIN/results/model_FEGIN_dataset_ltspice_examples
Command line input: python main.py --data ltspice_examples --representation component_net --model FEGIN --layers 4 --hiddens 128 --batch_size 256 --lr 0.001 --emb_size 128 --epochs 100 --save_appendix component_net_L4_H128_BS256_LR0.001_E128 --no_val
 is saved.
-----
ltspice_examples - FEGIN
Using 4 layers, 128 hidden units, h = 2
Loading component_net representation dataset
ENTERED
Training FEGIN on component_net representation
Train: 3558, Test: 846
##################ITERATION #0 ****************************************
 epoch: 0, train_loss: 1.2783, test_loss: 1.3270, test_f1: 0.2270
 epoch: 1, train_loss: 1.1522, test_loss: 1.2541, test_f1: 0.2539
 epoch: 2, train_loss: 1.0701, test_loss: 1.1251, test_f1: 0.4523
 epoch: 3, train_loss: 0.9874, test_loss: 1.0185, test_f1: 0.4826
 epoch: 4, train_loss: 0.9351, test_loss: 0.9686, test_f1: 0.5146
 epoch: 5, train_loss: 0.9065, test_loss: 0.9809, test_f1: 0.5019
 epoch: 6, train_loss: 0.8840, test_loss: 0.9456, test_f1: 0.4936
 epoch: 7, train_loss: 0.8523, test_loss: 0.9116, test_f1: 0.5343
 epoch: 8, train_loss: 0.8242, test_loss: 0.9257, test_f1: 0.5565
 epoch: 9, train_loss: 0.8143, test_loss: 0.9103, test_f1: 0.5576
 epoch: 10, train_loss: 0.7941, test_loss: 0.9520, test_f1: 0.5421
 epoch: 11, train_loss: 0.7878, test_loss: 1.0068, test_f1: 0.5504
 epoch: 12, train_loss: 0.7719, test_loss: 0.9556, test_f1: 0.5622
 epoch: 13, train_loss: 0.7528, test_loss: 0.9981, test_f1: 0.5527
 epoch: 14, train_loss: 0.7432, test_loss: 0.9338, test_f1: 0.5528
 epoch: 15, train_loss: 0.7331, test_loss: 0.9800, test_f1: 0.5804
 epoch: 16, train_loss: 0.7207, test_loss: 0.9665, test_f1: 0.5918
 epoch: 17, train_loss: 0.6896, test_loss: 0.9738, test_f1: 0.5771
 epoch: 18, train_loss: 0.6814, test_loss: 0.9682, test_f1: 0.6071
 epoch: 19, train_loss: 0.6771, test_loss: 0.9969, test_f1: 0.6098
 epoch: 20, train_loss: 0.6733, test_loss: 0.9545, test_f1: 0.6131
 epoch: 21, train_loss: 0.6367, test_loss: 0.9345, test_f1: 0.6222
 epoch: 22, train_loss: 0.6384, test_loss: 0.9877, test_f1: 0.5858
 epoch: 23, train_loss: 0.6115, test_loss: 1.0572, test_f1: 0.5570
 epoch: 24, train_loss: 0.5857, test_loss: 1.0335, test_f1: 0.6369
 epoch: 25, train_loss: 0.5799, test_loss: 1.1285, test_f1: 0.5862
 epoch: 26, train_loss: 0.5843, test_loss: 1.0178, test_f1: 0.6039
 epoch: 27, train_loss: 0.5959, test_loss: 1.0110, test_f1: 0.6073
 epoch: 28, train_loss: 0.5635, test_loss: 0.9646, test_f1: 0.6036
 epoch: 29, train_loss: 0.5502, test_loss: 1.0156, test_f1: 0.6489
 epoch: 30, train_loss: 0.5249, test_loss: 1.1211, test_f1: 0.6198
 epoch: 31, train_loss: 0.5416, test_loss: 1.0856, test_f1: 0.6187
 epoch: 32, train_loss: 0.5172, test_loss: 1.1385, test_f1: 0.5824
 epoch: 33, train_loss: 0.4901, test_loss: 1.1048, test_f1: 0.5956
 epoch: 34, train_loss: 0.4750, test_loss: 1.1490, test_f1: 0.6147
 epoch: 35, train_loss: 0.4973, test_loss: 1.2067, test_f1: 0.5907
 epoch: 36, train_loss: 0.4596, test_loss: 1.0943, test_f1: 0.6092
 epoch: 37, train_loss: 0.4507, test_loss: 1.1708, test_f1: 0.6303
 epoch: 38, train_loss: 0.4388, test_loss: 1.1309, test_f1: 0.6404
 epoch: 39, train_loss: 0.4165, test_loss: 1.2301, test_f1: 0.6289
 epoch: 40, train_loss: 0.3995, test_loss: 1.2268, test_f1: 0.6281
 epoch: 41, train_loss: 0.3929, test_loss: 1.3348, test_f1: 0.6243
 epoch: 42, train_loss: 0.3868, test_loss: 1.2285, test_f1: 0.6224
 epoch: 43, train_loss: 0.3816, test_loss: 1.4370, test_f1: 0.5778
 epoch: 44, train_loss: 0.3668, test_loss: 1.4756, test_f1: 0.5916
 epoch: 45, train_loss: 0.3776, test_loss: 1.4308, test_f1: 0.6120
 epoch: 46, train_loss: 0.3882, test_loss: 1.3987, test_f1: 0.6353
 epoch: 47, train_loss: 0.3738, test_loss: 1.3810, test_f1: 0.6116
 epoch: 48, train_loss: 0.3507, test_loss: 1.2943, test_f1: 0.6223
 epoch: 49, train_loss: 0.3440, test_loss: 1.3476, test_f1: 0.6280
 epoch: 50, train_loss: 0.3349, test_loss: 1.4173, test_f1: 0.6321
 epoch: 51, train_loss: 0.2781, test_loss: 1.4713, test_f1: 0.6231
 epoch: 52, train_loss: 0.2684, test_loss: 1.6049, test_f1: 0.6102
 epoch: 53, train_loss: 0.2600, test_loss: 1.6474, test_f1: 0.6049
 epoch: 54, train_loss: 0.2403, test_loss: 1.5970, test_f1: 0.5923
 epoch: 55, train_loss: 0.2275, test_loss: 1.8163, test_f1: 0.6096
 epoch: 56, train_loss: 0.2374, test_loss: 1.6802, test_f1: 0.6317
 epoch: 57, train_loss: 0.2231, test_loss: 1.9188, test_f1: 0.6191
 epoch: 58, train_loss: 0.2331, test_loss: 1.9076, test_f1: 0.6038
 epoch: 59, train_loss: 0.2384, test_loss: 1.9621, test_f1: 0.6298
 epoch: 60, train_loss: 0.2108, test_loss: 1.8591, test_f1: 0.6186
 epoch: 61, train_loss: 0.2062, test_loss: 1.9692, test_f1: 0.5888
 epoch: 62, train_loss: 0.2160, test_loss: 2.0791, test_f1: 0.6190
 epoch: 63, train_loss: 0.2020, test_loss: 2.0519, test_f1: 0.6133
 epoch: 64, train_loss: 0.1933, test_loss: 2.0330, test_f1: 0.6144
 epoch: 65, train_loss: 0.1902, test_loss: 2.0072, test_f1: 0.6252
 epoch: 66, train_loss: 0.1919, test_loss: 2.2965, test_f1: 0.5907
 epoch: 67, train_loss: 0.1981, test_loss: 2.3938, test_f1: 0.6023
 epoch: 68, train_loss: 0.1916, test_loss: 2.4711, test_f1: 0.6224
 epoch: 69, train_loss: 0.1882, test_loss: 2.4905, test_f1: 0.6113
 epoch: 70, train_loss: 0.1792, test_loss: 2.1101, test_f1: 0.6342
 epoch: 71, train_loss: 0.1877, test_loss: 2.3716, test_f1: 0.6067
 epoch: 72, train_loss: 0.1797, test_loss: 2.2684, test_f1: 0.6130
 epoch: 73, train_loss: 0.1766, test_loss: 2.5744, test_f1: 0.6197
 epoch: 74, train_loss: 0.1751, test_loss: 2.4326, test_f1: 0.5987
 epoch: 75, train_loss: 0.1668, test_loss: 2.2902, test_f1: 0.6264
 epoch: 76, train_loss: 0.1805, test_loss: 2.2594, test_f1: 0.6144
 epoch: 77, train_loss: 0.1907, test_loss: 2.4418, test_f1: 0.6445
 epoch: 78, train_loss: 0.1775, test_loss: 2.4842, test_f1: 0.6160
 epoch: 79, train_loss: 0.1601, test_loss: 2.4406, test_f1: 0.6082
 epoch: 80, train_loss: 0.1727, test_loss: 2.4770, test_f1: 0.6141
 epoch: 81, train_loss: 0.1431, test_loss: 2.4302, test_f1: 0.6214
 epoch: 82, train_loss: 0.1447, test_loss: 2.6078, test_f1: 0.6032
 epoch: 83, train_loss: 0.1515, test_loss: 2.6207, test_f1: 0.6483
 epoch: 84, train_loss: 0.1402, test_loss: 2.6378, test_f1: 0.6052
 epoch: 85, train_loss: 0.1398, test_loss: 2.7323, test_f1: 0.6204
 epoch: 86, train_loss: 0.1602, test_loss: 2.8777, test_f1: 0.6023
 epoch: 87, train_loss: 0.1393, test_loss: 2.3893, test_f1: 0.6054
 epoch: 88, train_loss: 0.1530, test_loss: 2.4972, test_f1: 0.6025
 epoch: 89, train_loss: 0.1410, test_loss: 2.7215, test_f1: 0.6162
 epoch: 90, train_loss: 0.1434, test_loss: 2.8287, test_f1: 0.6097
 epoch: 91, train_loss: 0.1609, test_loss: 3.0662, test_f1: 0.5950
 epoch: 92, train_loss: 0.1525, test_loss: 2.6969, test_f1: 0.6095
 epoch: 93, train_loss: 0.1610, test_loss: 2.6148, test_f1: 0.6065
 epoch: 94, train_loss: 0.1497, test_loss: 2.4672, test_f1: 0.6233
 epoch: 95, train_loss: 0.1398, test_loss: 2.7654, test_f1: 0.6164
 epoch: 96, train_loss: 0.1305, test_loss: 2.8790, test_f1: 0.6180
 epoch: 97, train_loss: 0.1393, test_loss: 2.8219, test_f1: 0.6099
 epoch: 98, train_loss: 0.1330, test_loss: 2.8187, test_f1: 0.6051
 epoch: 99, train_loss: 0.1392, test_loss: 2.9185, test_f1: 0.6056
##################ITERATION #1 ****************************************
 epoch: 0, train_loss: 1.1749, test_loss: 1.2550, test_f1: 0.2271
 epoch: 1, train_loss: 1.0341, test_loss: 1.1506, test_f1: 0.4155
 epoch: 2, train_loss: 0.9556, test_loss: 1.0661, test_f1: 0.4525
 epoch: 3, train_loss: 0.9067, test_loss: 0.9539, test_f1: 0.4468
 epoch: 4, train_loss: 0.8764, test_loss: 0.9661, test_f1: 0.5045
 epoch: 5, train_loss: 0.8650, test_loss: 0.9407, test_f1: 0.5265
 epoch: 6, train_loss: 0.8390, test_loss: 0.8959, test_f1: 0.5646
 epoch: 7, train_loss: 0.8165, test_loss: 0.9218, test_f1: 0.5788
 epoch: 8, train_loss: 0.7793, test_loss: 0.9615, test_f1: 0.5298
 epoch: 9, train_loss: 0.7773, test_loss: 0.9029, test_f1: 0.5963
 epoch: 10, train_loss: 0.7738, test_loss: 0.9315, test_f1: 0.5640
 epoch: 11, train_loss: 0.7445, test_loss: 0.9564, test_f1: 0.5144
 epoch: 12, train_loss: 0.7285, test_loss: 0.9520, test_f1: 0.5504
 epoch: 13, train_loss: 0.7309, test_loss: 1.0201, test_f1: 0.5677
 epoch: 14, train_loss: 0.7175, test_loss: 0.9147, test_f1: 0.5935
 epoch: 15, train_loss: 0.6890, test_loss: 0.9457, test_f1: 0.6071
 epoch: 16, train_loss: 0.6763, test_loss: 0.9129, test_f1: 0.6030
 epoch: 17, train_loss: 0.6659, test_loss: 0.9638, test_f1: 0.5896
 epoch: 18, train_loss: 0.6481, test_loss: 0.9352, test_f1: 0.6005
 epoch: 19, train_loss: 0.6370, test_loss: 0.9839, test_f1: 0.6342
 epoch: 20, train_loss: 0.6263, test_loss: 1.0537, test_f1: 0.5591
 epoch: 21, train_loss: 0.6114, test_loss: 1.0433, test_f1: 0.5995
 epoch: 22, train_loss: 0.5965, test_loss: 1.2346, test_f1: 0.5400
 epoch: 23, train_loss: 0.6071, test_loss: 1.0558, test_f1: 0.5972
 epoch: 24, train_loss: 0.5950, test_loss: 1.0656, test_f1: 0.6134
 epoch: 25, train_loss: 0.5631, test_loss: 1.0265, test_f1: 0.6291
 epoch: 26, train_loss: 0.5702, test_loss: 1.0043, test_f1: 0.6330
 epoch: 27, train_loss: 0.5500, test_loss: 1.2820, test_f1: 0.5722
 epoch: 28, train_loss: 0.5486, test_loss: 1.3111, test_f1: 0.5688
 epoch: 29, train_loss: 0.5362, test_loss: 1.0636, test_f1: 0.5981
 epoch: 30, train_loss: 0.5302, test_loss: 1.1277, test_f1: 0.6092
 epoch: 31, train_loss: 0.5016, test_loss: 1.0771, test_f1: 0.6224
 epoch: 32, train_loss: 0.4960, test_loss: 1.1154, test_f1: 0.6199
 epoch: 33, train_loss: 0.4862, test_loss: 1.2515, test_f1: 0.6169
 epoch: 34, train_loss: 0.4631, test_loss: 1.3621, test_f1: 0.6211
 epoch: 35, train_loss: 0.4722, test_loss: 1.2170, test_f1: 0.6215
 epoch: 36, train_loss: 0.4500, test_loss: 1.1138, test_f1: 0.6231
 epoch: 37, train_loss: 0.4171, test_loss: 1.1321, test_f1: 0.6135
 epoch: 38, train_loss: 0.4046, test_loss: 1.2107, test_f1: 0.6346
 epoch: 39, train_loss: 0.4143, test_loss: 1.1708, test_f1: 0.6235
 epoch: 40, train_loss: 0.4054, test_loss: 1.1989, test_f1: 0.6189
 epoch: 41, train_loss: 0.3915, test_loss: 1.1522, test_f1: 0.6485
 epoch: 42, train_loss: 0.3982, test_loss: 1.4740, test_f1: 0.5895
 epoch: 43, train_loss: 0.3778, test_loss: 1.3034, test_f1: 0.6259
 epoch: 44, train_loss: 0.3752, test_loss: 1.4192, test_f1: 0.6202
 epoch: 45, train_loss: 0.3685, test_loss: 1.5071, test_f1: 0.6143
 epoch: 46, train_loss: 0.3578, test_loss: 1.4730, test_f1: 0.6017
 epoch: 47, train_loss: 0.3550, test_loss: 1.3914, test_f1: 0.6345
 epoch: 48, train_loss: 0.3415, test_loss: 1.5939, test_f1: 0.6375
 epoch: 49, train_loss: 0.3262, test_loss: 1.4253, test_f1: 0.6539
 epoch: 50, train_loss: 0.3206, test_loss: 1.5581, test_f1: 0.6486
 epoch: 51, train_loss: 0.2939, test_loss: 1.5186, test_f1: 0.6219
 epoch: 52, train_loss: 0.2539, test_loss: 1.6442, test_f1: 0.6322
 epoch: 53, train_loss: 0.2516, test_loss: 1.5930, test_f1: 0.6365
 epoch: 54, train_loss: 0.2416, test_loss: 1.6812, test_f1: 0.6354
 epoch: 55, train_loss: 0.2324, test_loss: 1.7198, test_f1: 0.6241
 epoch: 56, train_loss: 0.2329, test_loss: 1.7234, test_f1: 0.6517
 epoch: 57, train_loss: 0.2251, test_loss: 1.7477, test_f1: 0.6378
 epoch: 58, train_loss: 0.2237, test_loss: 1.8462, test_f1: 0.6328
 epoch: 59, train_loss: 0.2060, test_loss: 1.8459, test_f1: 0.6200
 epoch: 60, train_loss: 0.2152, test_loss: 1.7336, test_f1: 0.6685
 epoch: 61, train_loss: 0.2158, test_loss: 1.8721, test_f1: 0.6364
 epoch: 62, train_loss: 0.2134, test_loss: 2.0542, test_f1: 0.6295
 epoch: 63, train_loss: 0.2099, test_loss: 1.8785, test_f1: 0.6503
 epoch: 64, train_loss: 0.2048, test_loss: 1.8654, test_f1: 0.6292
 epoch: 65, train_loss: 0.2102, test_loss: 1.8407, test_f1: 0.6292
 epoch: 66, train_loss: 0.1983, test_loss: 1.9112, test_f1: 0.6288
 epoch: 67, train_loss: 0.1859, test_loss: 2.0369, test_f1: 0.6335
 epoch: 68, train_loss: 0.1815, test_loss: 1.9589, test_f1: 0.6414
 epoch: 69, train_loss: 0.1828, test_loss: 2.1284, test_f1: 0.6338
 epoch: 70, train_loss: 0.1924, test_loss: 2.1516, test_f1: 0.6402
 epoch: 71, train_loss: 0.1947, test_loss: 2.0317, test_f1: 0.6108
 epoch: 72, train_loss: 0.1851, test_loss: 2.2078, test_f1: 0.6273
 epoch: 73, train_loss: 0.1800, test_loss: 2.0485, test_f1: 0.6337
 epoch: 74, train_loss: 0.1796, test_loss: 2.0292, test_f1: 0.6249
 epoch: 75, train_loss: 0.1827, test_loss: 2.1014, test_f1: 0.6159
 epoch: 76, train_loss: 0.1843, test_loss: 2.2412, test_f1: 0.6263
 epoch: 77, train_loss: 0.1667, test_loss: 2.1479, test_f1: 0.6243
 epoch: 78, train_loss: 0.1586, test_loss: 2.1100, test_f1: 0.6304
 epoch: 79, train_loss: 0.1613, test_loss: 2.2373, test_f1: 0.6183
 epoch: 80, train_loss: 0.1557, test_loss: 2.2659, test_f1: 0.6464
 epoch: 81, train_loss: 0.1662, test_loss: 2.3168, test_f1: 0.6165
 epoch: 82, train_loss: 0.1623, test_loss: 2.3983, test_f1: 0.5997
 epoch: 83, train_loss: 0.1666, test_loss: 2.6682, test_f1: 0.6251
 epoch: 84, train_loss: 0.1712, test_loss: 2.2723, test_f1: 0.6059
 epoch: 85, train_loss: 0.1524, test_loss: 2.5336, test_f1: 0.6120
 epoch: 86, train_loss: 0.1684, test_loss: 2.2065, test_f1: 0.6184
 epoch: 87, train_loss: 0.1435, test_loss: 2.5339, test_f1: 0.6353
 epoch: 88, train_loss: 0.1332, test_loss: 2.3634, test_f1: 0.6460
 epoch: 89, train_loss: 0.1526, test_loss: 2.2716, test_f1: 0.6434
 epoch: 90, train_loss: 0.1407, test_loss: 2.4149, test_f1: 0.6382
 epoch: 91, train_loss: 0.1394, test_loss: 2.5455, test_f1: 0.6233
 epoch: 92, train_loss: 0.1406, test_loss: 2.3926, test_f1: 0.6376
 epoch: 93, train_loss: 0.1512, test_loss: 2.6315, test_f1: 0.6273
 epoch: 94, train_loss: 0.1334, test_loss: 2.4323, test_f1: 0.6419
 epoch: 95, train_loss: 0.1568, test_loss: 2.6280, test_f1: 0.6434
 epoch: 96, train_loss: 0.1435, test_loss: 2.5452, test_f1: 0.6204
 epoch: 97, train_loss: 0.1555, test_loss: 2.4231, test_f1: 0.6393
 epoch: 98, train_loss: 0.1590, test_loss: 2.4617, test_f1: 0.6134
 epoch: 99, train_loss: 0.1508, test_loss: 2.2952, test_f1: 0.6378
##################ITERATION #2 ****************************************
 epoch: 0, train_loss: 1.2095, test_loss: 1.2449, test_f1: 0.2651
 epoch: 1, train_loss: 1.0262, test_loss: 1.1224, test_f1: 0.3415
 epoch: 2, train_loss: 0.9631, test_loss: 1.0347, test_f1: 0.4156
 epoch: 3, train_loss: 0.9209, test_loss: 0.9904, test_f1: 0.5054
 epoch: 4, train_loss: 0.8908, test_loss: 0.9564, test_f1: 0.5341
 epoch: 5, train_loss: 0.8560, test_loss: 0.9509, test_f1: 0.5529
 epoch: 6, train_loss: 0.8477, test_loss: 0.9179, test_f1: 0.5704
 epoch: 7, train_loss: 0.8456, test_loss: 0.8925, test_f1: 0.5655
 epoch: 8, train_loss: 0.8146, test_loss: 0.9296, test_f1: 0.5531
 epoch: 9, train_loss: 0.7937, test_loss: 0.9589, test_f1: 0.5389
 epoch: 10, train_loss: 0.7933, test_loss: 0.9216, test_f1: 0.5785
 epoch: 11, train_loss: 0.7701, test_loss: 0.9043, test_f1: 0.5717
 epoch: 12, train_loss: 0.7439, test_loss: 0.9861, test_f1: 0.5596
 epoch: 13, train_loss: 0.7579, test_loss: 0.9278, test_f1: 0.5948
 epoch: 14, train_loss: 0.7326, test_loss: 0.9126, test_f1: 0.6396
 epoch: 15, train_loss: 0.7036, test_loss: 0.9549, test_f1: 0.5927
 epoch: 16, train_loss: 0.7008, test_loss: 0.9696, test_f1: 0.5897
 epoch: 17, train_loss: 0.7020, test_loss: 0.9661, test_f1: 0.6307
 epoch: 18, train_loss: 0.6813, test_loss: 1.2180, test_f1: 0.5347
 epoch: 19, train_loss: 0.6812, test_loss: 1.1192, test_f1: 0.5675
 epoch: 20, train_loss: 0.6471, test_loss: 0.9868, test_f1: 0.6025
 epoch: 21, train_loss: 0.6416, test_loss: 0.9774, test_f1: 0.6053
 epoch: 22, train_loss: 0.6342, test_loss: 1.0097, test_f1: 0.6205
 epoch: 23, train_loss: 0.6139, test_loss: 1.0322, test_f1: 0.6157
 epoch: 24, train_loss: 0.6216, test_loss: 1.0305, test_f1: 0.6024
 epoch: 25, train_loss: 0.6225, test_loss: 0.9835, test_f1: 0.6314
 epoch: 26, train_loss: 0.6005, test_loss: 1.1191, test_f1: 0.5843
 epoch: 27, train_loss: 0.5720, test_loss: 1.0494, test_f1: 0.6221
 epoch: 28, train_loss: 0.5513, test_loss: 0.9722, test_f1: 0.6616
 epoch: 29, train_loss: 0.5563, test_loss: 1.1345, test_f1: 0.5915
 epoch: 30, train_loss: 0.5466, test_loss: 0.9373, test_f1: 0.6441
 epoch: 31, train_loss: 0.5265, test_loss: 1.3889, test_f1: 0.5465
 epoch: 32, train_loss: 0.5228, test_loss: 1.0661, test_f1: 0.6008
 epoch: 33, train_loss: 0.4953, test_loss: 1.1397, test_f1: 0.6204
 epoch: 34, train_loss: 0.5039, test_loss: 1.2501, test_f1: 0.5892
 epoch: 35, train_loss: 0.4916, test_loss: 1.1713, test_f1: 0.6220
 epoch: 36, train_loss: 0.4828, test_loss: 1.1728, test_f1: 0.5960
 epoch: 37, train_loss: 0.4726, test_loss: 1.3847, test_f1: 0.5639
 epoch: 38, train_loss: 0.4613, test_loss: 1.1959, test_f1: 0.6354
 epoch: 39, train_loss: 0.4535, test_loss: 1.2068, test_f1: 0.6031
 epoch: 40, train_loss: 0.4454, test_loss: 1.2774, test_f1: 0.5955
 epoch: 41, train_loss: 0.4607, test_loss: 1.2626, test_f1: 0.5989
 epoch: 42, train_loss: 0.4252, test_loss: 1.0304, test_f1: 0.6466
 epoch: 43, train_loss: 0.4125, test_loss: 1.4679, test_f1: 0.6397
 epoch: 44, train_loss: 0.3946, test_loss: 1.3154, test_f1: 0.6101
 epoch: 45, train_loss: 0.4013, test_loss: 1.4702, test_f1: 0.6037
 epoch: 46, train_loss: 0.3978, test_loss: 1.3092, test_f1: 0.5953
 epoch: 47, train_loss: 0.3985, test_loss: 1.3019, test_f1: 0.6441
 epoch: 48, train_loss: 0.3875, test_loss: 1.3056, test_f1: 0.6430
 epoch: 49, train_loss: 0.3649, test_loss: 1.4174, test_f1: 0.6069
 epoch: 50, train_loss: 0.3716, test_loss: 1.2815, test_f1: 0.6259
 epoch: 51, train_loss: 0.3332, test_loss: 1.2817, test_f1: 0.6610
 epoch: 52, train_loss: 0.2958, test_loss: 1.3319, test_f1: 0.6409
 epoch: 53, train_loss: 0.2785, test_loss: 1.3520, test_f1: 0.6603
 epoch: 54, train_loss: 0.2771, test_loss: 1.4666, test_f1: 0.6366
 epoch: 55, train_loss: 0.2690, test_loss: 1.4144, test_f1: 0.6450
 epoch: 56, train_loss: 0.2535, test_loss: 1.5124, test_f1: 0.6318
 epoch: 57, train_loss: 0.2543, test_loss: 1.6436, test_f1: 0.6380
 epoch: 58, train_loss: 0.2507, test_loss: 1.6293, test_f1: 0.6118
 epoch: 59, train_loss: 0.2468, test_loss: 1.6456, test_f1: 0.6501
 epoch: 60, train_loss: 0.2421, test_loss: 1.4982, test_f1: 0.6630
 epoch: 61, train_loss: 0.2442, test_loss: 1.5615, test_f1: 0.6499
 epoch: 62, train_loss: 0.2419, test_loss: 1.5626, test_f1: 0.6516
 epoch: 63, train_loss: 0.2265, test_loss: 1.7359, test_f1: 0.6428
 epoch: 64, train_loss: 0.2304, test_loss: 1.6734, test_f1: 0.6270
 epoch: 65, train_loss: 0.2377, test_loss: 1.7048, test_f1: 0.6516
 epoch: 66, train_loss: 0.2055, test_loss: 1.7592, test_f1: 0.6376
 epoch: 67, train_loss: 0.2078, test_loss: 1.7225, test_f1: 0.6322
 epoch: 68, train_loss: 0.2174, test_loss: 1.7003, test_f1: 0.6249
 epoch: 69, train_loss: 0.2113, test_loss: 1.8226, test_f1: 0.6398
 epoch: 70, train_loss: 0.2250, test_loss: 1.7511, test_f1: 0.6669
 epoch: 71, train_loss: 0.2171, test_loss: 1.9683, test_f1: 0.6284
 epoch: 72, train_loss: 0.1975, test_loss: 1.7763, test_f1: 0.6259
 epoch: 73, train_loss: 0.1951, test_loss: 1.8554, test_f1: 0.6182
 epoch: 74, train_loss: 0.1908, test_loss: 1.7705, test_f1: 0.6586
 epoch: 75, train_loss: 0.1698, test_loss: 2.0942, test_f1: 0.6260
 epoch: 76, train_loss: 0.1875, test_loss: 1.7738, test_f1: 0.6381
 epoch: 77, train_loss: 0.1804, test_loss: 2.0319, test_f1: 0.6194
 epoch: 78, train_loss: 0.1816, test_loss: 2.0289, test_f1: 0.6341
 epoch: 79, train_loss: 0.1806, test_loss: 1.9286, test_f1: 0.6408
 epoch: 80, train_loss: 0.1846, test_loss: 1.9431, test_f1: 0.6573
 epoch: 81, train_loss: 0.1762, test_loss: 2.1207, test_f1: 0.6356
 epoch: 82, train_loss: 0.1717, test_loss: 2.0205, test_f1: 0.6429
 epoch: 83, train_loss: 0.1811, test_loss: 2.0633, test_f1: 0.6263
 epoch: 84, train_loss: 0.1779, test_loss: 2.0859, test_f1: 0.6283
 epoch: 85, train_loss: 0.1674, test_loss: 2.1362, test_f1: 0.6347
 epoch: 86, train_loss: 0.1730, test_loss: 1.9487, test_f1: 0.6494
 epoch: 87, train_loss: 0.1679, test_loss: 2.2562, test_f1: 0.6149
 epoch: 88, train_loss: 0.1948, test_loss: 2.1059, test_f1: 0.6169
 epoch: 89, train_loss: 0.1677, test_loss: 2.0803, test_f1: 0.6394
 epoch: 90, train_loss: 0.1575, test_loss: 1.9964, test_f1: 0.6436
 epoch: 91, train_loss: 0.1528, test_loss: 2.2697, test_f1: 0.6205
 epoch: 92, train_loss: 0.1741, test_loss: 2.1124, test_f1: 0.6256
 epoch: 93, train_loss: 0.1571, test_loss: 2.2355, test_f1: 0.6230
 epoch: 94, train_loss: 0.1467, test_loss: 2.2896, test_f1: 0.6249
 epoch: 95, train_loss: 0.1405, test_loss: 2.2287, test_f1: 0.6327
 epoch: 96, train_loss: 0.1436, test_loss: 2.1753, test_f1: 0.6550
 epoch: 97, train_loss: 0.1718, test_loss: 2.2867, test_f1: 0.6139
 epoch: 98, train_loss: 0.1689, test_loss: 2.2753, test_f1: 0.6278
 epoch: 99, train_loss: 0.1473, test_loss: 2.5453, test_f1: 0.6246
##################ITERATION #3 ****************************************
 epoch: 0, train_loss: 1.2643, test_loss: 1.2662, test_f1: 0.2320
 epoch: 1, train_loss: 1.0150, test_loss: 1.1530, test_f1: 0.3343
 epoch: 2, train_loss: 0.9523, test_loss: 1.0014, test_f1: 0.4470
 epoch: 3, train_loss: 0.8997, test_loss: 0.9115, test_f1: 0.4998
 epoch: 4, train_loss: 0.8752, test_loss: 0.9761, test_f1: 0.5422
 epoch: 5, train_loss: 0.8543, test_loss: 0.9009, test_f1: 0.5109
 epoch: 6, train_loss: 0.8205, test_loss: 0.9290, test_f1: 0.5356
 epoch: 7, train_loss: 0.8127, test_loss: 0.9247, test_f1: 0.5411
 epoch: 8, train_loss: 0.8053, test_loss: 0.9540, test_f1: 0.5446
 epoch: 9, train_loss: 0.7683, test_loss: 0.9667, test_f1: 0.5733
 epoch: 10, train_loss: 0.7704, test_loss: 0.9299, test_f1: 0.5579
 epoch: 11, train_loss: 0.7600, test_loss: 0.9808, test_f1: 0.6160
 epoch: 12, train_loss: 0.7472, test_loss: 1.0925, test_f1: 0.5390
 epoch: 13, train_loss: 0.7436, test_loss: 0.9493, test_f1: 0.6056
 epoch: 14, train_loss: 0.7190, test_loss: 0.9532, test_f1: 0.5732
 epoch: 15, train_loss: 0.7149, test_loss: 0.9772, test_f1: 0.6174
 epoch: 16, train_loss: 0.6916, test_loss: 0.9933, test_f1: 0.6135
 epoch: 17, train_loss: 0.6881, test_loss: 0.9901, test_f1: 0.5815
 epoch: 18, train_loss: 0.6860, test_loss: 0.9383, test_f1: 0.6012
 epoch: 19, train_loss: 0.6512, test_loss: 0.9852, test_f1: 0.5940
 epoch: 20, train_loss: 0.6500, test_loss: 1.0088, test_f1: 0.5896
 epoch: 21, train_loss: 0.6437, test_loss: 1.0841, test_f1: 0.5989
 epoch: 22, train_loss: 0.6146, test_loss: 1.0063, test_f1: 0.6167
 epoch: 23, train_loss: 0.6168, test_loss: 1.2435, test_f1: 0.5582
 epoch: 24, train_loss: 0.5912, test_loss: 1.0122, test_f1: 0.6277
 epoch: 25, train_loss: 0.5658, test_loss: 1.0626, test_f1: 0.6304
 epoch: 26, train_loss: 0.5886, test_loss: 1.0408, test_f1: 0.6252
 epoch: 27, train_loss: 0.5622, test_loss: 1.1136, test_f1: 0.6214
 epoch: 28, train_loss: 0.5616, test_loss: 1.0451, test_f1: 0.6182
 epoch: 29, train_loss: 0.5449, test_loss: 1.0709, test_f1: 0.6440
 epoch: 30, train_loss: 0.5120, test_loss: 1.2319, test_f1: 0.5794
 epoch: 31, train_loss: 0.5018, test_loss: 1.2264, test_f1: 0.6081
 epoch: 32, train_loss: 0.5101, test_loss: 1.2718, test_f1: 0.6183
 epoch: 33, train_loss: 0.5078, test_loss: 1.2495, test_f1: 0.6132
 epoch: 34, train_loss: 0.4970, test_loss: 1.2177, test_f1: 0.6166
 epoch: 35, train_loss: 0.4741, test_loss: 1.2991, test_f1: 0.6146
 epoch: 36, train_loss: 0.4632, test_loss: 1.2930, test_f1: 0.6255
 epoch: 37, train_loss: 0.4568, test_loss: 1.2934, test_f1: 0.6231
 epoch: 38, train_loss: 0.4477, test_loss: 1.5019, test_f1: 0.6091
 epoch: 39, train_loss: 0.4484, test_loss: 1.2908, test_f1: 0.6591
 epoch: 40, train_loss: 0.4382, test_loss: 1.3300, test_f1: 0.6353
 epoch: 41, train_loss: 0.4242, test_loss: 1.3968, test_f1: 0.6110
 epoch: 42, train_loss: 0.4121, test_loss: 1.4454, test_f1: 0.5862
 epoch: 43, train_loss: 0.4167, test_loss: 1.4076, test_f1: 0.6435
 epoch: 44, train_loss: 0.3880, test_loss: 1.5814, test_f1: 0.6392
 epoch: 45, train_loss: 0.3813, test_loss: 1.7356, test_f1: 0.5636
 epoch: 46, train_loss: 0.3845, test_loss: 1.5933, test_f1: 0.6167
 epoch: 47, train_loss: 0.3767, test_loss: 1.5681, test_f1: 0.5909
 epoch: 48, train_loss: 0.3758, test_loss: 1.4829, test_f1: 0.5946
 epoch: 49, train_loss: 0.3789, test_loss: 1.5529, test_f1: 0.6384
 epoch: 50, train_loss: 0.3816, test_loss: 1.5418, test_f1: 0.5970
 epoch: 51, train_loss: 0.3219, test_loss: 1.5557, test_f1: 0.6384
 epoch: 52, train_loss: 0.3072, test_loss: 1.5130, test_f1: 0.6421
 epoch: 53, train_loss: 0.3009, test_loss: 1.5513, test_f1: 0.6382
 epoch: 54, train_loss: 0.2889, test_loss: 1.5609, test_f1: 0.6340
 epoch: 55, train_loss: 0.2792, test_loss: 1.5889, test_f1: 0.6362
 epoch: 56, train_loss: 0.2602, test_loss: 1.6911, test_f1: 0.6206
 epoch: 57, train_loss: 0.2562, test_loss: 1.7439, test_f1: 0.6275
 epoch: 58, train_loss: 0.2485, test_loss: 1.8568, test_f1: 0.6276
 epoch: 59, train_loss: 0.2509, test_loss: 1.7375, test_f1: 0.6466
 epoch: 60, train_loss: 0.2424, test_loss: 1.7678, test_f1: 0.6119
 epoch: 61, train_loss: 0.2354, test_loss: 1.8915, test_f1: 0.6123
 epoch: 62, train_loss: 0.2511, test_loss: 1.8256, test_f1: 0.6164
 epoch: 63, train_loss: 0.2443, test_loss: 1.7932, test_f1: 0.6194
 epoch: 64, train_loss: 0.2311, test_loss: 1.9429, test_f1: 0.6079
 epoch: 65, train_loss: 0.2239, test_loss: 1.9458, test_f1: 0.6290
 epoch: 66, train_loss: 0.2141, test_loss: 1.8097, test_f1: 0.6378
 epoch: 67, train_loss: 0.2153, test_loss: 1.8554, test_f1: 0.6311
 epoch: 68, train_loss: 0.2255, test_loss: 1.8950, test_f1: 0.6184
 epoch: 69, train_loss: 0.1918, test_loss: 2.0120, test_f1: 0.6266
 epoch: 70, train_loss: 0.2135, test_loss: 2.1332, test_f1: 0.6150
 epoch: 71, train_loss: 0.1964, test_loss: 2.0209, test_f1: 0.6125
 epoch: 72, train_loss: 0.2053, test_loss: 1.9882, test_f1: 0.6412
 epoch: 73, train_loss: 0.1996, test_loss: 2.1839, test_f1: 0.6160
 epoch: 74, train_loss: 0.1855, test_loss: 2.0335, test_f1: 0.6304
 epoch: 75, train_loss: 0.1949, test_loss: 2.1066, test_f1: 0.6312
 epoch: 76, train_loss: 0.1861, test_loss: 2.1732, test_f1: 0.6203
 epoch: 77, train_loss: 0.1875, test_loss: 2.3605, test_f1: 0.6112
 epoch: 78, train_loss: 0.1930, test_loss: 2.2675, test_f1: 0.6157
 epoch: 79, train_loss: 0.1994, test_loss: 2.1683, test_f1: 0.6169
 epoch: 80, train_loss: 0.1901, test_loss: 2.1748, test_f1: 0.6140
 epoch: 81, train_loss: 0.1791, test_loss: 2.2811, test_f1: 0.6227
 epoch: 82, train_loss: 0.1798, test_loss: 2.3575, test_f1: 0.6140
 epoch: 83, train_loss: 0.1892, test_loss: 2.2627, test_f1: 0.6244
 epoch: 84, train_loss: 0.1859, test_loss: 2.2113, test_f1: 0.6206
 epoch: 85, train_loss: 0.1630, test_loss: 2.1567, test_f1: 0.6344
 epoch: 86, train_loss: 0.1606, test_loss: 2.2732, test_f1: 0.6180
 epoch: 87, train_loss: 0.1696, test_loss: 2.4797, test_f1: 0.6229
 epoch: 88, train_loss: 0.1703, test_loss: 2.3227, test_f1: 0.6049
 epoch: 89, train_loss: 0.1703, test_loss: 2.3396, test_f1: 0.6224
 epoch: 90, train_loss: 0.1659, test_loss: 2.4479, test_f1: 0.6272
 epoch: 91, train_loss: 0.1716, test_loss: 2.3065, test_f1: 0.6509
 epoch: 92, train_loss: 0.1616, test_loss: 2.6046, test_f1: 0.6191
 epoch: 93, train_loss: 0.1715, test_loss: 2.3395, test_f1: 0.6398
 epoch: 94, train_loss: 0.1616, test_loss: 2.2545, test_f1: 0.6431
 epoch: 95, train_loss: 0.1657, test_loss: 2.4605, test_f1: 0.6359
 epoch: 96, train_loss: 0.1618, test_loss: 2.3289, test_f1: 0.6494
 epoch: 97, train_loss: 0.1449, test_loss: 2.4062, test_f1: 0.6317
 epoch: 98, train_loss: 0.1429, test_loss: 2.6810, test_f1: 0.6060
 epoch: 99, train_loss: 0.1508, test_loss: 2.6787, test_f1: 0.6345
##################ITERATION #4 ****************************************
 epoch: 0, train_loss: 1.3121, test_loss: 1.2384, test_f1: 0.2295
 epoch: 1, train_loss: 1.0486, test_loss: 1.1702, test_f1: 0.3947
 epoch: 2, train_loss: 0.9665, test_loss: 1.0566, test_f1: 0.4487
 epoch: 3, train_loss: 0.9336, test_loss: 0.9428, test_f1: 0.4756
 epoch: 4, train_loss: 0.8940, test_loss: 0.9084, test_f1: 0.5148
 epoch: 5, train_loss: 0.8562, test_loss: 0.9407, test_f1: 0.5152
 epoch: 6, train_loss: 0.8372, test_loss: 0.9156, test_f1: 0.5230
 epoch: 7, train_loss: 0.8375, test_loss: 0.8709, test_f1: 0.5796
 epoch: 8, train_loss: 0.8334, test_loss: 0.9251, test_f1: 0.5453
 epoch: 9, train_loss: 0.8116, test_loss: 0.8569, test_f1: 0.5794
 epoch: 10, train_loss: 0.7835, test_loss: 0.8895, test_f1: 0.5441
 epoch: 11, train_loss: 0.7837, test_loss: 0.9356, test_f1: 0.6064
 epoch: 12, train_loss: 0.7774, test_loss: 0.9511, test_f1: 0.6151
 epoch: 13, train_loss: 0.7507, test_loss: 0.8892, test_f1: 0.5918
 epoch: 14, train_loss: 0.7372, test_loss: 0.9691, test_f1: 0.5867
 epoch: 15, train_loss: 0.7247, test_loss: 0.8021, test_f1: 0.5578
 epoch: 16, train_loss: 0.7105, test_loss: 0.8540, test_f1: 0.6140
 epoch: 17, train_loss: 0.6978, test_loss: 0.9528, test_f1: 0.6279
 epoch: 18, train_loss: 0.7039, test_loss: 0.8998, test_f1: 0.6293
 epoch: 19, train_loss: 0.6806, test_loss: 0.9088, test_f1: 0.6113
 epoch: 20, train_loss: 0.6563, test_loss: 0.9822, test_f1: 0.5946
 epoch: 21, train_loss: 0.6564, test_loss: 0.9608, test_f1: 0.5997
 epoch: 22, train_loss: 0.6492, test_loss: 0.8952, test_f1: 0.6427
 epoch: 23, train_loss: 0.6355, test_loss: 1.0454, test_f1: 0.5915
 epoch: 24, train_loss: 0.6380, test_loss: 1.0755, test_f1: 0.5558
 epoch: 25, train_loss: 0.6199, test_loss: 0.9001, test_f1: 0.6247
 epoch: 26, train_loss: 0.6162, test_loss: 0.9337, test_f1: 0.6181
 epoch: 27, train_loss: 0.5995, test_loss: 0.9610, test_f1: 0.6454
 epoch: 28, train_loss: 0.5953, test_loss: 0.9692, test_f1: 0.6357
 epoch: 29, train_loss: 0.5609, test_loss: 0.9664, test_f1: 0.6156
 epoch: 30, train_loss: 0.5483, test_loss: 0.9510, test_f1: 0.6174
 epoch: 31, train_loss: 0.5285, test_loss: 1.0149, test_f1: 0.6437
 epoch: 32, train_loss: 0.5390, test_loss: 1.0746, test_f1: 0.6313
 epoch: 33, train_loss: 0.5420, test_loss: 1.0552, test_f1: 0.6285
 epoch: 34, train_loss: 0.5049, test_loss: 1.1353, test_f1: 0.6591
 epoch: 35, train_loss: 0.5057, test_loss: 1.2219, test_f1: 0.6064
 epoch: 36, train_loss: 0.4726, test_loss: 1.1634, test_f1: 0.6652
 epoch: 37, train_loss: 0.4911, test_loss: 1.0207, test_f1: 0.6264
 epoch: 38, train_loss: 0.4818, test_loss: 1.1212, test_f1: 0.6012
 epoch: 39, train_loss: 0.4426, test_loss: 1.1658, test_f1: 0.6391
 epoch: 40, train_loss: 0.4542, test_loss: 1.1425, test_f1: 0.6142
 epoch: 41, train_loss: 0.4464, test_loss: 1.1524, test_f1: 0.6685
 epoch: 42, train_loss: 0.4624, test_loss: 1.1177, test_f1: 0.6134
 epoch: 43, train_loss: 0.4363, test_loss: 1.1655, test_f1: 0.6225
 epoch: 44, train_loss: 0.4137, test_loss: 1.1811, test_f1: 0.6661
 epoch: 45, train_loss: 0.3914, test_loss: 1.2716, test_f1: 0.6323
 epoch: 46, train_loss: 0.3950, test_loss: 1.1849, test_f1: 0.6471
 epoch: 47, train_loss: 0.4050, test_loss: 1.3297, test_f1: 0.6623
 epoch: 48, train_loss: 0.4007, test_loss: 1.2870, test_f1: 0.6254
 epoch: 49, train_loss: 0.3911, test_loss: 1.3624, test_f1: 0.6291
 epoch: 50, train_loss: 0.3924, test_loss: 1.2693, test_f1: 0.6735
 epoch: 51, train_loss: 0.3625, test_loss: 1.3416, test_f1: 0.6503
 epoch: 52, train_loss: 0.3106, test_loss: 1.2996, test_f1: 0.6590
 epoch: 53, train_loss: 0.3022, test_loss: 1.4374, test_f1: 0.6546
 epoch: 54, train_loss: 0.2894, test_loss: 1.4306, test_f1: 0.6474
 epoch: 55, train_loss: 0.2793, test_loss: 1.5269, test_f1: 0.6574
 epoch: 56, train_loss: 0.2909, test_loss: 1.5337, test_f1: 0.6368
 epoch: 57, train_loss: 0.2846, test_loss: 1.5508, test_f1: 0.6498
 epoch: 58, train_loss: 0.2693, test_loss: 1.5184, test_f1: 0.6579
 epoch: 59, train_loss: 0.2662, test_loss: 1.5762, test_f1: 0.6363
 epoch: 60, train_loss: 0.2501, test_loss: 1.6233, test_f1: 0.6502
 epoch: 61, train_loss: 0.2517, test_loss: 1.5950, test_f1: 0.6549
 epoch: 62, train_loss: 0.2363, test_loss: 1.6502, test_f1: 0.6572
 epoch: 63, train_loss: 0.2389, test_loss: 1.6252, test_f1: 0.6489
 epoch: 64, train_loss: 0.2378, test_loss: 1.6272, test_f1: 0.6320
 epoch: 65, train_loss: 0.2329, test_loss: 1.4974, test_f1: 0.6408
 epoch: 66, train_loss: 0.2238, test_loss: 1.6276, test_f1: 0.6191
 epoch: 67, train_loss: 0.2353, test_loss: 1.7253, test_f1: 0.6549
 epoch: 68, train_loss: 0.2290, test_loss: 1.7587, test_f1: 0.6454
 epoch: 69, train_loss: 0.2172, test_loss: 1.6670, test_f1: 0.6399
 epoch: 70, train_loss: 0.2189, test_loss: 1.7133, test_f1: 0.6565
 epoch: 71, train_loss: 0.2175, test_loss: 1.8319, test_f1: 0.6642
 epoch: 72, train_loss: 0.2130, test_loss: 1.7424, test_f1: 0.6558
 epoch: 73, train_loss: 0.2172, test_loss: 1.8149, test_f1: 0.6398
 epoch: 74, train_loss: 0.2172, test_loss: 1.7121, test_f1: 0.6609
 epoch: 75, train_loss: 0.2186, test_loss: 1.8147, test_f1: 0.6462
 epoch: 76, train_loss: 0.2205, test_loss: 1.8483, test_f1: 0.6616
 epoch: 77, train_loss: 0.2237, test_loss: 2.0337, test_f1: 0.6221
 epoch: 78, train_loss: 0.2146, test_loss: 1.8859, test_f1: 0.6622
 epoch: 79, train_loss: 0.2007, test_loss: 1.7758, test_f1: 0.6452
 epoch: 80, train_loss: 0.2097, test_loss: 1.8616, test_f1: 0.6455
 epoch: 81, train_loss: 0.2010, test_loss: 1.9555, test_f1: 0.6228
 epoch: 82, train_loss: 0.1899, test_loss: 1.9486, test_f1: 0.6493
 epoch: 83, train_loss: 0.1787, test_loss: 1.9316, test_f1: 0.6300
 epoch: 84, train_loss: 0.1865, test_loss: 2.1915, test_f1: 0.6030
 epoch: 85, train_loss: 0.1917, test_loss: 1.8195, test_f1: 0.6378
 epoch: 86, train_loss: 0.1797, test_loss: 1.9794, test_f1: 0.6419
 epoch: 87, train_loss: 0.1988, test_loss: 2.0266, test_f1: 0.6419
 epoch: 88, train_loss: 0.1802, test_loss: 1.9931, test_f1: 0.6402
 epoch: 89, train_loss: 0.1908, test_loss: 2.1064, test_f1: 0.6492
 epoch: 90, train_loss: 0.1657, test_loss: 2.1965, test_f1: 0.6457
 epoch: 91, train_loss: 0.1720, test_loss: 2.1361, test_f1: 0.6160
 epoch: 92, train_loss: 0.1786, test_loss: 2.2571, test_f1: 0.6182
 epoch: 93, train_loss: 0.1769, test_loss: 2.1370, test_f1: 0.6223
 epoch: 94, train_loss: 0.1903, test_loss: 2.2434, test_f1: 0.6440
 epoch: 95, train_loss: 0.1807, test_loss: 2.1990, test_f1: 0.6291
 epoch: 96, train_loss: 0.1666, test_loss: 2.0262, test_f1: 0.6412
 epoch: 97, train_loss: 0.1615, test_loss: 2.1936, test_f1: 0.6367
 epoch: 98, train_loss: 0.1801, test_loss: 2.2154, test_f1: 0.6062
 epoch: 99, train_loss: 0.1734, test_loss: 2.0974, test_f1: 0.6521
##################ITERATION #5 ****************************************
 epoch: 0, train_loss: 1.4290, test_loss: 1.2870, test_f1: 0.2270
 epoch: 1, train_loss: 1.0913, test_loss: 1.1987, test_f1: 0.2597
 epoch: 2, train_loss: 0.9994, test_loss: 1.0496, test_f1: 0.4055
 epoch: 3, train_loss: 0.9570, test_loss: 0.9541, test_f1: 0.4785
 epoch: 4, train_loss: 0.9230, test_loss: 0.9214, test_f1: 0.5086
 epoch: 5, train_loss: 0.9049, test_loss: 0.9117, test_f1: 0.5079
 epoch: 6, train_loss: 0.8792, test_loss: 0.9102, test_f1: 0.5164
 epoch: 7, train_loss: 0.8536, test_loss: 0.9309, test_f1: 0.5037
 epoch: 8, train_loss: 0.8249, test_loss: 0.8821, test_f1: 0.5429
 epoch: 9, train_loss: 0.8326, test_loss: 0.8862, test_f1: 0.5774
 epoch: 10, train_loss: 0.7976, test_loss: 0.9060, test_f1: 0.5895
 epoch: 11, train_loss: 0.7890, test_loss: 0.8297, test_f1: 0.5715
 epoch: 12, train_loss: 0.7746, test_loss: 0.8690, test_f1: 0.5936
 epoch: 13, train_loss: 0.7619, test_loss: 0.8962, test_f1: 0.5546
 epoch: 14, train_loss: 0.7553, test_loss: 1.0114, test_f1: 0.5504
 epoch: 15, train_loss: 0.7459, test_loss: 0.9575, test_f1: 0.5887
 epoch: 16, train_loss: 0.7358, test_loss: 0.8625, test_f1: 0.6119
 epoch: 17, train_loss: 0.7228, test_loss: 0.9840, test_f1: 0.5881
 epoch: 18, train_loss: 0.7095, test_loss: 0.9201, test_f1: 0.5913
 epoch: 19, train_loss: 0.6999, test_loss: 1.0703, test_f1: 0.5454
 epoch: 20, train_loss: 0.6843, test_loss: 0.9716, test_f1: 0.6156
 epoch: 21, train_loss: 0.6845, test_loss: 1.0244, test_f1: 0.5912
 epoch: 22, train_loss: 0.6741, test_loss: 0.9178, test_f1: 0.6115
 epoch: 23, train_loss: 0.6793, test_loss: 1.0182, test_f1: 0.5795
 epoch: 24, train_loss: 0.6571, test_loss: 1.0659, test_f1: 0.5976
 epoch: 25, train_loss: 0.6405, test_loss: 0.9841, test_f1: 0.6214
 epoch: 26, train_loss: 0.6242, test_loss: 1.3534, test_f1: 0.5680
 epoch: 27, train_loss: 0.6266, test_loss: 0.9969, test_f1: 0.6047
 epoch: 28, train_loss: 0.6082, test_loss: 1.1161, test_f1: 0.5786
 epoch: 29, train_loss: 0.6137, test_loss: 1.0667, test_f1: 0.5929
 epoch: 30, train_loss: 0.6126, test_loss: 0.9874, test_f1: 0.6075
 epoch: 31, train_loss: 0.5984, test_loss: 1.1164, test_f1: 0.5800
 epoch: 32, train_loss: 0.5879, test_loss: 1.0367, test_f1: 0.5999
 epoch: 33, train_loss: 0.5665, test_loss: 1.0699, test_f1: 0.6003
 epoch: 34, train_loss: 0.5640, test_loss: 1.2049, test_f1: 0.5681
 epoch: 35, train_loss: 0.5510, test_loss: 1.2594, test_f1: 0.5692
 epoch: 36, train_loss: 0.5514, test_loss: 1.1117, test_f1: 0.6339
 epoch: 37, train_loss: 0.5376, test_loss: 1.0636, test_f1: 0.6123
 epoch: 38, train_loss: 0.5309, test_loss: 1.0600, test_f1: 0.6292
 epoch: 39, train_loss: 0.5240, test_loss: 1.1513, test_f1: 0.6111
 epoch: 40, train_loss: 0.5072, test_loss: 1.1675, test_f1: 0.6040
 epoch: 41, train_loss: 0.5522, test_loss: 1.0809, test_f1: 0.6220
 epoch: 42, train_loss: 0.5179, test_loss: 1.1514, test_f1: 0.6221
 epoch: 43, train_loss: 0.4677, test_loss: 1.2101, test_f1: 0.5875
 epoch: 44, train_loss: 0.4698, test_loss: 1.1561, test_f1: 0.6374
 epoch: 45, train_loss: 0.4587, test_loss: 1.0699, test_f1: 0.6581
 epoch: 46, train_loss: 0.4992, test_loss: 1.0932, test_f1: 0.6578
 epoch: 47, train_loss: 0.4595, test_loss: 1.1428, test_f1: 0.6347
 epoch: 48, train_loss: 0.4459, test_loss: 1.1456, test_f1: 0.6288
 epoch: 49, train_loss: 0.4292, test_loss: 1.2953, test_f1: 0.6177
 epoch: 50, train_loss: 0.4646, test_loss: 1.1427, test_f1: 0.6331
 epoch: 51, train_loss: 0.4108, test_loss: 1.2305, test_f1: 0.6309
 epoch: 52, train_loss: 0.3627, test_loss: 1.1867, test_f1: 0.6209
 epoch: 53, train_loss: 0.3519, test_loss: 1.2149, test_f1: 0.6472
 epoch: 54, train_loss: 0.3359, test_loss: 1.2877, test_f1: 0.6359
 epoch: 55, train_loss: 0.3333, test_loss: 1.2643, test_f1: 0.6431
 epoch: 56, train_loss: 0.3240, test_loss: 1.3876, test_f1: 0.6053
 epoch: 57, train_loss: 0.3023, test_loss: 1.3703, test_f1: 0.6248
 epoch: 58, train_loss: 0.3033, test_loss: 1.2795, test_f1: 0.6508
 epoch: 59, train_loss: 0.3124, test_loss: 1.4044, test_f1: 0.6284
 epoch: 60, train_loss: 0.3047, test_loss: 1.3085, test_f1: 0.6405
 epoch: 61, train_loss: 0.2963, test_loss: 1.3631, test_f1: 0.6487
 epoch: 62, train_loss: 0.3021, test_loss: 1.3553, test_f1: 0.6440
 epoch: 63, train_loss: 0.2833, test_loss: 1.4088, test_f1: 0.6457
 epoch: 64, train_loss: 0.2819, test_loss: 1.4092, test_f1: 0.6264
 epoch: 65, train_loss: 0.2829, test_loss: 1.4310, test_f1: 0.6551
 epoch: 66, train_loss: 0.2567, test_loss: 1.4750, test_f1: 0.6312
 epoch: 67, train_loss: 0.2775, test_loss: 1.5403, test_f1: 0.6197
 epoch: 68, train_loss: 0.2753, test_loss: 1.4810, test_f1: 0.6267
 epoch: 69, train_loss: 0.2712, test_loss: 1.6359, test_f1: 0.6239
 epoch: 70, train_loss: 0.2770, test_loss: 1.3975, test_f1: 0.6441
 epoch: 71, train_loss: 0.2711, test_loss: 1.5405, test_f1: 0.6420
 epoch: 72, train_loss: 0.2597, test_loss: 1.4973, test_f1: 0.6367
 epoch: 73, train_loss: 0.2907, test_loss: 1.5605, test_f1: 0.6120
 epoch: 74, train_loss: 0.2716, test_loss: 1.5739, test_f1: 0.6353
 epoch: 75, train_loss: 0.2583, test_loss: 1.4669, test_f1: 0.6480
 epoch: 76, train_loss: 0.2573, test_loss: 1.6731, test_f1: 0.6127
 epoch: 77, train_loss: 0.2465, test_loss: 1.5256, test_f1: 0.6634
 epoch: 78, train_loss: 0.2482, test_loss: 1.6273, test_f1: 0.6327
 epoch: 79, train_loss: 0.2576, test_loss: 1.6941, test_f1: 0.6067
 epoch: 80, train_loss: 0.2608, test_loss: 1.5598, test_f1: 0.6701
 epoch: 81, train_loss: 0.2376, test_loss: 1.5217, test_f1: 0.6661
 epoch: 82, train_loss: 0.2255, test_loss: 1.7066, test_f1: 0.6266
 epoch: 83, train_loss: 0.2368, test_loss: 1.6690, test_f1: 0.6424
 epoch: 84, train_loss: 0.2296, test_loss: 1.6439, test_f1: 0.6317
 epoch: 85, train_loss: 0.2193, test_loss: 1.7179, test_f1: 0.6457
 epoch: 86, train_loss: 0.2120, test_loss: 1.7386, test_f1: 0.6580
 epoch: 87, train_loss: 0.2015, test_loss: 1.7001, test_f1: 0.6403
 epoch: 88, train_loss: 0.2015, test_loss: 1.8882, test_f1: 0.6287
 epoch: 89, train_loss: 0.2141, test_loss: 1.6246, test_f1: 0.6409
 epoch: 90, train_loss: 0.2150, test_loss: 1.8772, test_f1: 0.6208
 epoch: 91, train_loss: 0.2074, test_loss: 1.9799, test_f1: 0.6198
 epoch: 92, train_loss: 0.2025, test_loss: 1.7791, test_f1: 0.6061
 epoch: 93, train_loss: 0.1870, test_loss: 1.9299, test_f1: 0.6333
 epoch: 94, train_loss: 0.1968, test_loss: 2.0787, test_f1: 0.6232
 epoch: 95, train_loss: 0.1991, test_loss: 1.9849, test_f1: 0.6408
 epoch: 96, train_loss: 0.1976, test_loss: 1.8239, test_f1: 0.6466
 epoch: 97, train_loss: 0.1921, test_loss: 1.9417, test_f1: 0.6239
 epoch: 98, train_loss: 0.2114, test_loss: 1.9020, test_f1: 0.6329
 epoch: 99, train_loss: 0.1982, test_loss: 1.9144, test_f1: 0.6196
##################ITERATION #6 ****************************************
 epoch: 0, train_loss: 1.5738, test_loss: 1.3397, test_f1: 0.2270
 epoch: 1, train_loss: 1.0632, test_loss: 1.1923, test_f1: 0.2709
 epoch: 2, train_loss: 0.9793, test_loss: 1.0577, test_f1: 0.3767
 epoch: 3, train_loss: 0.9443, test_loss: 0.9742, test_f1: 0.4664
 epoch: 4, train_loss: 0.9059, test_loss: 0.9576, test_f1: 0.4641
 epoch: 5, train_loss: 0.8831, test_loss: 0.9255, test_f1: 0.5219
 epoch: 6, train_loss: 0.8698, test_loss: 0.9244, test_f1: 0.5451
 epoch: 7, train_loss: 0.8441, test_loss: 0.9240, test_f1: 0.5386
 epoch: 8, train_loss: 0.8420, test_loss: 0.9011, test_f1: 0.5689
 epoch: 9, train_loss: 0.8095, test_loss: 0.9176, test_f1: 0.5633
 epoch: 10, train_loss: 0.7876, test_loss: 0.9128, test_f1: 0.5492
 epoch: 11, train_loss: 0.7832, test_loss: 0.9545, test_f1: 0.5555
 epoch: 12, train_loss: 0.7693, test_loss: 0.9239, test_f1: 0.5766
 epoch: 13, train_loss: 0.7754, test_loss: 1.0151, test_f1: 0.5353
 epoch: 14, train_loss: 0.7586, test_loss: 0.9284, test_f1: 0.5522
 epoch: 15, train_loss: 0.7359, test_loss: 0.9476, test_f1: 0.5944
 epoch: 16, train_loss: 0.7128, test_loss: 0.9121, test_f1: 0.6020
 epoch: 17, train_loss: 0.7388, test_loss: 0.9232, test_f1: 0.5783
 epoch: 18, train_loss: 0.7264, test_loss: 1.0033, test_f1: 0.5152
 epoch: 19, train_loss: 0.7041, test_loss: 0.9490, test_f1: 0.5932
 epoch: 20, train_loss: 0.7006, test_loss: 1.0217, test_f1: 0.5646
 epoch: 21, train_loss: 0.6949, test_loss: 0.9635, test_f1: 0.5691
 epoch: 22, train_loss: 0.6782, test_loss: 0.9257, test_f1: 0.6044
 epoch: 23, train_loss: 0.6564, test_loss: 0.9983, test_f1: 0.5628
 epoch: 24, train_loss: 0.6384, test_loss: 1.0650, test_f1: 0.5721
 epoch: 25, train_loss: 0.6505, test_loss: 0.9554, test_f1: 0.6197
 epoch: 26, train_loss: 0.6439, test_loss: 1.0225, test_f1: 0.5738
 epoch: 27, train_loss: 0.6316, test_loss: 1.0135, test_f1: 0.5806
 epoch: 28, train_loss: 0.6280, test_loss: 1.0302, test_f1: 0.6145
 epoch: 29, train_loss: 0.6168, test_loss: 0.9912, test_f1: 0.6048
 epoch: 30, train_loss: 0.5891, test_loss: 0.9657, test_f1: 0.6166
 epoch: 31, train_loss: 0.5884, test_loss: 1.1821, test_f1: 0.5746
 epoch: 32, train_loss: 0.5839, test_loss: 1.0398, test_f1: 0.6106
 epoch: 33, train_loss: 0.5853, test_loss: 1.0740, test_f1: 0.5881
 epoch: 34, train_loss: 0.5621, test_loss: 1.0766, test_f1: 0.6070
 epoch: 35, train_loss: 0.5552, test_loss: 1.0316, test_f1: 0.5973
 epoch: 36, train_loss: 0.5468, test_loss: 1.2147, test_f1: 0.5562
 epoch: 37, train_loss: 0.5453, test_loss: 1.1179, test_f1: 0.6139
 epoch: 38, train_loss: 0.5187, test_loss: 1.1299, test_f1: 0.6345
 epoch: 39, train_loss: 0.5007, test_loss: 1.1318, test_f1: 0.6409
 epoch: 40, train_loss: 0.5063, test_loss: 1.1534, test_f1: 0.6015
 epoch: 41, train_loss: 0.5120, test_loss: 1.0548, test_f1: 0.6147
 epoch: 42, train_loss: 0.4870, test_loss: 1.1418, test_f1: 0.6421
 epoch: 43, train_loss: 0.4731, test_loss: 1.1129, test_f1: 0.5852
 epoch: 44, train_loss: 0.4926, test_loss: 1.2125, test_f1: 0.6042
 epoch: 45, train_loss: 0.4703, test_loss: 1.1370, test_f1: 0.6140
 epoch: 46, train_loss: 0.4741, test_loss: 1.1458, test_f1: 0.6141
 epoch: 47, train_loss: 0.4619, test_loss: 1.2744, test_f1: 0.5983
 epoch: 48, train_loss: 0.4557, test_loss: 1.2566, test_f1: 0.6370
 epoch: 49, train_loss: 0.4119, test_loss: 1.1981, test_f1: 0.6098
 epoch: 50, train_loss: 0.4457, test_loss: 1.3542, test_f1: 0.6264
 epoch: 51, train_loss: 0.4080, test_loss: 1.2525, test_f1: 0.6134
 epoch: 52, train_loss: 0.3619, test_loss: 1.2777, test_f1: 0.6172
 epoch: 53, train_loss: 0.3373, test_loss: 1.2622, test_f1: 0.6603
 epoch: 54, train_loss: 0.3416, test_loss: 1.4176, test_f1: 0.6540
 epoch: 55, train_loss: 0.3264, test_loss: 1.3877, test_f1: 0.6451
 epoch: 56, train_loss: 0.3128, test_loss: 1.4288, test_f1: 0.6278
 epoch: 57, train_loss: 0.3177, test_loss: 1.4701, test_f1: 0.6195
 epoch: 58, train_loss: 0.3236, test_loss: 1.3812, test_f1: 0.6598
 epoch: 59, train_loss: 0.3284, test_loss: 1.3598, test_f1: 0.6358
 epoch: 60, train_loss: 0.3266, test_loss: 1.4355, test_f1: 0.6405
 epoch: 61, train_loss: 0.3047, test_loss: 1.3611, test_f1: 0.6413
 epoch: 62, train_loss: 0.2917, test_loss: 1.4831, test_f1: 0.6622
 epoch: 63, train_loss: 0.2806, test_loss: 1.4870, test_f1: 0.6504
 epoch: 64, train_loss: 0.2624, test_loss: 1.4605, test_f1: 0.6715
 epoch: 65, train_loss: 0.2669, test_loss: 1.5123, test_f1: 0.6302
 epoch: 66, train_loss: 0.2634, test_loss: 1.6271, test_f1: 0.6318
 epoch: 67, train_loss: 0.2944, test_loss: 1.5532, test_f1: 0.6285
 epoch: 68, train_loss: 0.2724, test_loss: 1.6186, test_f1: 0.6672
 epoch: 69, train_loss: 0.2638, test_loss: 1.4721, test_f1: 0.6435
 epoch: 70, train_loss: 0.2602, test_loss: 1.6638, test_f1: 0.6301
 epoch: 71, train_loss: 0.2685, test_loss: 1.5737, test_f1: 0.6592
 epoch: 72, train_loss: 0.2794, test_loss: 1.6150, test_f1: 0.6129
 epoch: 73, train_loss: 0.2599, test_loss: 1.5638, test_f1: 0.6448
 epoch: 74, train_loss: 0.2458, test_loss: 1.5201, test_f1: 0.6660
 epoch: 75, train_loss: 0.2496, test_loss: 1.6281, test_f1: 0.6633
 epoch: 76, train_loss: 0.2550, test_loss: 1.6549, test_f1: 0.6453
 epoch: 77, train_loss: 0.2481, test_loss: 1.6128, test_f1: 0.6376
 epoch: 78, train_loss: 0.2517, test_loss: 1.8031, test_f1: 0.6262
 epoch: 79, train_loss: 0.2298, test_loss: 1.6764, test_f1: 0.6325
 epoch: 80, train_loss: 0.2380, test_loss: 1.7501, test_f1: 0.6375
 epoch: 81, train_loss: 0.2293, test_loss: 1.8182, test_f1: 0.6134
 epoch: 82, train_loss: 0.2297, test_loss: 1.8185, test_f1: 0.6311
 epoch: 83, train_loss: 0.2496, test_loss: 1.7625, test_f1: 0.6513
 epoch: 84, train_loss: 0.2386, test_loss: 1.6768, test_f1: 0.6262
 epoch: 85, train_loss: 0.2225, test_loss: 1.7269, test_f1: 0.6487
 epoch: 86, train_loss: 0.2109, test_loss: 1.8518, test_f1: 0.6361
 epoch: 87, train_loss: 0.2221, test_loss: 1.9283, test_f1: 0.6612
 epoch: 88, train_loss: 0.2169, test_loss: 1.8693, test_f1: 0.6443
 epoch: 89, train_loss: 0.2197, test_loss: 1.7223, test_f1: 0.6428
 epoch: 90, train_loss: 0.2051, test_loss: 1.7094, test_f1: 0.6285
 epoch: 91, train_loss: 0.2163, test_loss: 1.8355, test_f1: 0.6651
 epoch: 92, train_loss: 0.2211, test_loss: 2.0180, test_f1: 0.6199
 epoch: 93, train_loss: 0.1960, test_loss: 1.8405, test_f1: 0.6294
 epoch: 94, train_loss: 0.1852, test_loss: 1.9018, test_f1: 0.6461
 epoch: 95, train_loss: 0.1899, test_loss: 2.0736, test_f1: 0.6398
 epoch: 96, train_loss: 0.1932, test_loss: 1.9593, test_f1: 0.6549
 epoch: 97, train_loss: 0.2113, test_loss: 1.9560, test_f1: 0.6389
 epoch: 98, train_loss: 0.2272, test_loss: 1.9628, test_f1: 0.6477
 epoch: 99, train_loss: 0.2339, test_loss: 1.8315, test_f1: 0.6044
##################ITERATION #7 ****************************************
 epoch: 0, train_loss: 1.5673, test_loss: 1.2351, test_f1: 0.3150
 epoch: 1, train_loss: 1.0599, test_loss: 1.1222, test_f1: 0.3367
 epoch: 2, train_loss: 0.9846, test_loss: 1.1257, test_f1: 0.3655
 epoch: 3, train_loss: 0.9274, test_loss: 1.0377, test_f1: 0.4845
 epoch: 4, train_loss: 0.9059, test_loss: 0.9736, test_f1: 0.5271
 epoch: 5, train_loss: 0.8794, test_loss: 0.9744, test_f1: 0.4929
 epoch: 6, train_loss: 0.8616, test_loss: 0.9210, test_f1: 0.5105
 epoch: 7, train_loss: 0.8455, test_loss: 0.9233, test_f1: 0.5368
 epoch: 8, train_loss: 0.8310, test_loss: 0.9372, test_f1: 0.5365
 epoch: 9, train_loss: 0.8067, test_loss: 0.8818, test_f1: 0.5562
 epoch: 10, train_loss: 0.7868, test_loss: 0.9401, test_f1: 0.5319
 epoch: 11, train_loss: 0.7802, test_loss: 0.9180, test_f1: 0.5513
 epoch: 12, train_loss: 0.7705, test_loss: 0.8855, test_f1: 0.5650
 epoch: 13, train_loss: 0.7565, test_loss: 0.9330, test_f1: 0.5674
 epoch: 14, train_loss: 0.7399, test_loss: 1.0024, test_f1: 0.5571
 epoch: 15, train_loss: 0.7399, test_loss: 0.9227, test_f1: 0.5467
 epoch: 16, train_loss: 0.7039, test_loss: 1.0031, test_f1: 0.5861
 epoch: 17, train_loss: 0.6994, test_loss: 0.9749, test_f1: 0.5809
 epoch: 18, train_loss: 0.6860, test_loss: 0.8913, test_f1: 0.6096
 epoch: 19, train_loss: 0.6754, test_loss: 1.0184, test_f1: 0.5837
 epoch: 20, train_loss: 0.6811, test_loss: 1.0146, test_f1: 0.5844
 epoch: 21, train_loss: 0.6695, test_loss: 0.9596, test_f1: 0.5661
 epoch: 22, train_loss: 0.6754, test_loss: 0.9822, test_f1: 0.5703
 epoch: 23, train_loss: 0.6413, test_loss: 0.9310, test_f1: 0.5729
 epoch: 24, train_loss: 0.6437, test_loss: 0.9790, test_f1: 0.5985
 epoch: 25, train_loss: 0.6390, test_loss: 1.0029, test_f1: 0.6221
 epoch: 26, train_loss: 0.6258, test_loss: 1.0167, test_f1: 0.5876
 epoch: 27, train_loss: 0.6026, test_loss: 1.0009, test_f1: 0.6249
 epoch: 28, train_loss: 0.5998, test_loss: 1.0061, test_f1: 0.6392
 epoch: 29, train_loss: 0.6021, test_loss: 1.0387, test_f1: 0.6442
 epoch: 30, train_loss: 0.5850, test_loss: 1.0090, test_f1: 0.6272
 epoch: 31, train_loss: 0.5673, test_loss: 0.9723, test_f1: 0.6570
 epoch: 32, train_loss: 0.5490, test_loss: 1.0872, test_f1: 0.5790
 epoch: 33, train_loss: 0.5389, test_loss: 1.0577, test_f1: 0.6197
 epoch: 34, train_loss: 0.5292, test_loss: 1.0254, test_f1: 0.6283
 epoch: 35, train_loss: 0.5091, test_loss: 1.0135, test_f1: 0.6308
 epoch: 36, train_loss: 0.5138, test_loss: 1.1173, test_f1: 0.6054
 epoch: 37, train_loss: 0.5064, test_loss: 1.0881, test_f1: 0.6138
 epoch: 38, train_loss: 0.5125, test_loss: 1.0944, test_f1: 0.6274
 epoch: 39, train_loss: 0.4789, test_loss: 1.0960, test_f1: 0.6741
 epoch: 40, train_loss: 0.4574, test_loss: 1.1300, test_f1: 0.6104
 epoch: 41, train_loss: 0.4813, test_loss: 1.2333, test_f1: 0.6240
 epoch: 42, train_loss: 0.4664, test_loss: 1.1863, test_f1: 0.6248
 epoch: 43, train_loss: 0.4631, test_loss: 1.1944, test_f1: 0.5887
 epoch: 44, train_loss: 0.4286, test_loss: 1.1606, test_f1: 0.6468
 epoch: 45, train_loss: 0.4436, test_loss: 1.2191, test_f1: 0.6108
 epoch: 46, train_loss: 0.4374, test_loss: 1.2126, test_f1: 0.6456
 epoch: 47, train_loss: 0.4256, test_loss: 1.1284, test_f1: 0.6316
 epoch: 48, train_loss: 0.4204, test_loss: 1.3165, test_f1: 0.6163
 epoch: 49, train_loss: 0.4310, test_loss: 1.2081, test_f1: 0.6188
 epoch: 50, train_loss: 0.3926, test_loss: 1.2285, test_f1: 0.6488
 epoch: 51, train_loss: 0.3713, test_loss: 1.1971, test_f1: 0.6537
 epoch: 52, train_loss: 0.3298, test_loss: 1.3055, test_f1: 0.6512
 epoch: 53, train_loss: 0.3171, test_loss: 1.2526, test_f1: 0.6655
 epoch: 54, train_loss: 0.3178, test_loss: 1.2874, test_f1: 0.6352
 epoch: 55, train_loss: 0.3086, test_loss: 1.2993, test_f1: 0.6452
 epoch: 56, train_loss: 0.2987, test_loss: 1.4634, test_f1: 0.6253
 epoch: 57, train_loss: 0.2931, test_loss: 1.5085, test_f1: 0.6453
 epoch: 58, train_loss: 0.2887, test_loss: 1.4135, test_f1: 0.6604
 epoch: 59, train_loss: 0.2984, test_loss: 1.4544, test_f1: 0.6458
 epoch: 60, train_loss: 0.2790, test_loss: 1.4781, test_f1: 0.6454
 epoch: 61, train_loss: 0.2817, test_loss: 1.5139, test_f1: 0.6525
 epoch: 62, train_loss: 0.2785, test_loss: 1.6253, test_f1: 0.6531
 epoch: 63, train_loss: 0.2583, test_loss: 1.5669, test_f1: 0.6383
 epoch: 64, train_loss: 0.2816, test_loss: 1.4467, test_f1: 0.6518
 epoch: 65, train_loss: 0.2590, test_loss: 1.4719, test_f1: 0.6364
 epoch: 66, train_loss: 0.2627, test_loss: 1.5221, test_f1: 0.6630
 epoch: 67, train_loss: 0.2500, test_loss: 1.5487, test_f1: 0.6500
 epoch: 68, train_loss: 0.2633, test_loss: 1.6366, test_f1: 0.6482
 epoch: 69, train_loss: 0.2455, test_loss: 1.5033, test_f1: 0.6614
 epoch: 70, train_loss: 0.2500, test_loss: 1.8025, test_f1: 0.6221
 epoch: 71, train_loss: 0.2330, test_loss: 1.6744, test_f1: 0.6434
 epoch: 72, train_loss: 0.2454, test_loss: 1.7272, test_f1: 0.6309
 epoch: 73, train_loss: 0.2382, test_loss: 1.7369, test_f1: 0.6366
 epoch: 74, train_loss: 0.2355, test_loss: 1.8247, test_f1: 0.6254
 epoch: 75, train_loss: 0.2355, test_loss: 1.6842, test_f1: 0.6332
 epoch: 76, train_loss: 0.2240, test_loss: 1.6547, test_f1: 0.6529
 epoch: 77, train_loss: 0.2121, test_loss: 1.7783, test_f1: 0.6284
 epoch: 78, train_loss: 0.2194, test_loss: 1.9085, test_f1: 0.6494
 epoch: 79, train_loss: 0.2047, test_loss: 1.7491, test_f1: 0.6449
 epoch: 80, train_loss: 0.2228, test_loss: 1.8224, test_f1: 0.6034
 epoch: 81, train_loss: 0.2405, test_loss: 1.9078, test_f1: 0.6208
 epoch: 82, train_loss: 0.2346, test_loss: 1.9255, test_f1: 0.6305
 epoch: 83, train_loss: 0.2305, test_loss: 1.8423, test_f1: 0.6345
 epoch: 84, train_loss: 0.2313, test_loss: 1.8232, test_f1: 0.6429
 epoch: 85, train_loss: 0.2124, test_loss: 1.8943, test_f1: 0.6243
 epoch: 86, train_loss: 0.2198, test_loss: 1.7573, test_f1: 0.6365
 epoch: 87, train_loss: 0.2102, test_loss: 1.9618, test_f1: 0.6534
 epoch: 88, train_loss: 0.1838, test_loss: 1.9310, test_f1: 0.6363
 epoch: 89, train_loss: 0.1970, test_loss: 1.9065, test_f1: 0.6457
 epoch: 90, train_loss: 0.2077, test_loss: 2.0654, test_f1: 0.6460
 epoch: 91, train_loss: 0.2045, test_loss: 2.0229, test_f1: 0.6303
 epoch: 92, train_loss: 0.2067, test_loss: 1.8254, test_f1: 0.6497
 epoch: 93, train_loss: 0.2052, test_loss: 2.0646, test_f1: 0.6274
 epoch: 94, train_loss: 0.2137, test_loss: 1.9711, test_f1: 0.6372
 epoch: 95, train_loss: 0.1949, test_loss: 2.0457, test_f1: 0.6393
 epoch: 96, train_loss: 0.1778, test_loss: 1.9917, test_f1: 0.6401
 epoch: 97, train_loss: 0.1744, test_loss: 2.0181, test_f1: 0.6323
 epoch: 98, train_loss: 0.1727, test_loss: 2.0770, test_f1: 0.6252
 epoch: 99, train_loss: 0.1889, test_loss: 1.9213, test_f1: 0.6442
##################ITERATION #8 ****************************************
 epoch: 0, train_loss: 1.7489, test_loss: 1.2507, test_f1: 0.2270
 epoch: 1, train_loss: 1.0959, test_loss: 1.1742, test_f1: 0.2783
 epoch: 2, train_loss: 0.9955, test_loss: 1.1063, test_f1: 0.4132
 epoch: 3, train_loss: 0.9517, test_loss: 1.0338, test_f1: 0.4432
 epoch: 4, train_loss: 0.9110, test_loss: 1.0039, test_f1: 0.4666
 epoch: 5, train_loss: 0.8927, test_loss: 0.9546, test_f1: 0.5399
 epoch: 6, train_loss: 0.8733, test_loss: 0.9347, test_f1: 0.5202
 epoch: 7, train_loss: 0.8453, test_loss: 0.9262, test_f1: 0.5534
 epoch: 8, train_loss: 0.8325, test_loss: 0.9367, test_f1: 0.5310
 epoch: 9, train_loss: 0.8133, test_loss: 0.8863, test_f1: 0.5740
 epoch: 10, train_loss: 0.8116, test_loss: 0.9367, test_f1: 0.5623
 epoch: 11, train_loss: 0.7925, test_loss: 0.9271, test_f1: 0.5893
 epoch: 12, train_loss: 0.7752, test_loss: 0.9157, test_f1: 0.5739
 epoch: 13, train_loss: 0.7629, test_loss: 0.9399, test_f1: 0.5818
 epoch: 14, train_loss: 0.7622, test_loss: 0.9375, test_f1: 0.5736
 epoch: 15, train_loss: 0.7402, test_loss: 0.9713, test_f1: 0.5928
 epoch: 16, train_loss: 0.7541, test_loss: 0.9554, test_f1: 0.6108
 epoch: 17, train_loss: 0.7317, test_loss: 0.9311, test_f1: 0.5725
 epoch: 18, train_loss: 0.7096, test_loss: 0.9721, test_f1: 0.5842
 epoch: 19, train_loss: 0.7116, test_loss: 1.0767, test_f1: 0.5672
 epoch: 20, train_loss: 0.7005, test_loss: 0.8968, test_f1: 0.6085
 epoch: 21, train_loss: 0.6815, test_loss: 0.8826, test_f1: 0.6105
 epoch: 22, train_loss: 0.6750, test_loss: 0.9942, test_f1: 0.5858
 epoch: 23, train_loss: 0.6657, test_loss: 0.9047, test_f1: 0.6180
 epoch: 24, train_loss: 0.6511, test_loss: 0.9769, test_f1: 0.5728
 epoch: 25, train_loss: 0.6474, test_loss: 0.9380, test_f1: 0.6118
 epoch: 26, train_loss: 0.6381, test_loss: 0.9224, test_f1: 0.5999
 epoch: 27, train_loss: 0.6148, test_loss: 0.9664, test_f1: 0.6203
 epoch: 28, train_loss: 0.6012, test_loss: 0.9995, test_f1: 0.6040
 epoch: 29, train_loss: 0.5994, test_loss: 0.9924, test_f1: 0.6116
 epoch: 30, train_loss: 0.5952, test_loss: 1.0780, test_f1: 0.6123
 epoch: 31, train_loss: 0.5691, test_loss: 1.0977, test_f1: 0.5667
 epoch: 32, train_loss: 0.5763, test_loss: 1.0484, test_f1: 0.6303
 epoch: 33, train_loss: 0.5996, test_loss: 0.9700, test_f1: 0.6300
 epoch: 34, train_loss: 0.5580, test_loss: 1.0042, test_f1: 0.6005
 epoch: 35, train_loss: 0.5368, test_loss: 1.0066, test_f1: 0.6016
 epoch: 36, train_loss: 0.5062, test_loss: 1.0972, test_f1: 0.6270
 epoch: 37, train_loss: 0.5086, test_loss: 1.1083, test_f1: 0.6023
 epoch: 38, train_loss: 0.5267, test_loss: 1.0459, test_f1: 0.5978
 epoch: 39, train_loss: 0.5204, test_loss: 1.0975, test_f1: 0.6301
 epoch: 40, train_loss: 0.5054, test_loss: 1.0939, test_f1: 0.6413
 epoch: 41, train_loss: 0.5085, test_loss: 1.1375, test_f1: 0.6226
 epoch: 42, train_loss: 0.5126, test_loss: 1.1862, test_f1: 0.6047
 epoch: 43, train_loss: 0.4781, test_loss: 1.0855, test_f1: 0.6035
 epoch: 44, train_loss: 0.4611, test_loss: 1.1809, test_f1: 0.6548
 epoch: 45, train_loss: 0.4700, test_loss: 1.0273, test_f1: 0.6100
 epoch: 46, train_loss: 0.4644, test_loss: 1.1583, test_f1: 0.6131
 epoch: 47, train_loss: 0.4308, test_loss: 1.1732, test_f1: 0.6271
 epoch: 48, train_loss: 0.4284, test_loss: 1.2270, test_f1: 0.6144
 epoch: 49, train_loss: 0.4318, test_loss: 1.3454, test_f1: 0.5978
 epoch: 50, train_loss: 0.4316, test_loss: 1.2011, test_f1: 0.6152
 epoch: 51, train_loss: 0.4101, test_loss: 1.1390, test_f1: 0.6320
 epoch: 52, train_loss: 0.3782, test_loss: 1.2075, test_f1: 0.6314
 epoch: 53, train_loss: 0.3513, test_loss: 1.2128, test_f1: 0.6256
 epoch: 54, train_loss: 0.3403, test_loss: 1.2897, test_f1: 0.6255
 epoch: 55, train_loss: 0.3285, test_loss: 1.3191, test_f1: 0.6226
 epoch: 56, train_loss: 0.3297, test_loss: 1.3523, test_f1: 0.6171
 epoch: 57, train_loss: 0.3149, test_loss: 1.2829, test_f1: 0.6366
 epoch: 58, train_loss: 0.2900, test_loss: 1.3170, test_f1: 0.6360
 epoch: 59, train_loss: 0.2978, test_loss: 1.3756, test_f1: 0.6478
 epoch: 60, train_loss: 0.3048, test_loss: 1.4181, test_f1: 0.6335
 epoch: 61, train_loss: 0.3097, test_loss: 1.4654, test_f1: 0.6333
 epoch: 62, train_loss: 0.2935, test_loss: 1.2995, test_f1: 0.6363
 epoch: 63, train_loss: 0.3007, test_loss: 1.3600, test_f1: 0.6300
 epoch: 64, train_loss: 0.2924, test_loss: 1.4462, test_f1: 0.6384
 epoch: 65, train_loss: 0.2949, test_loss: 1.4063, test_f1: 0.6200
 epoch: 66, train_loss: 0.2895, test_loss: 1.3520, test_f1: 0.6409
 epoch: 67, train_loss: 0.2777, test_loss: 1.6154, test_f1: 0.6340
 epoch: 68, train_loss: 0.2704, test_loss: 1.4067, test_f1: 0.6486
 epoch: 69, train_loss: 0.2810, test_loss: 1.3905, test_f1: 0.6450
 epoch: 70, train_loss: 0.2940, test_loss: 1.5401, test_f1: 0.6054
 epoch: 71, train_loss: 0.2571, test_loss: 1.5045, test_f1: 0.6335
 epoch: 72, train_loss: 0.2435, test_loss: 1.4975, test_f1: 0.6594
 epoch: 73, train_loss: 0.2491, test_loss: 1.4557, test_f1: 0.6419
 epoch: 74, train_loss: 0.2430, test_loss: 1.4976, test_f1: 0.6326
 epoch: 75, train_loss: 0.2415, test_loss: 1.5473, test_f1: 0.6553
 epoch: 76, train_loss: 0.2528, test_loss: 1.5714, test_f1: 0.6302
 epoch: 77, train_loss: 0.2517, test_loss: 1.6184, test_f1: 0.6269
 epoch: 78, train_loss: 0.2332, test_loss: 1.4916, test_f1: 0.6449
 epoch: 79, train_loss: 0.2532, test_loss: 1.5104, test_f1: 0.6511
 epoch: 80, train_loss: 0.2374, test_loss: 1.5655, test_f1: 0.6408
 epoch: 81, train_loss: 0.2330, test_loss: 1.7222, test_f1: 0.6341
 epoch: 82, train_loss: 0.2374, test_loss: 1.5794, test_f1: 0.6217
 epoch: 83, train_loss: 0.2177, test_loss: 1.7123, test_f1: 0.6276
 epoch: 84, train_loss: 0.2313, test_loss: 1.7099, test_f1: 0.6258
 epoch: 85, train_loss: 0.2131, test_loss: 1.7711, test_f1: 0.6365
 epoch: 86, train_loss: 0.2218, test_loss: 1.8884, test_f1: 0.6441
 epoch: 87, train_loss: 0.2286, test_loss: 1.6594, test_f1: 0.6419
 epoch: 88, train_loss: 0.2316, test_loss: 1.9077, test_f1: 0.6191
 epoch: 89, train_loss: 0.2380, test_loss: 1.8648, test_f1: 0.6351
 epoch: 90, train_loss: 0.2449, test_loss: 1.6649, test_f1: 0.6317
 epoch: 91, train_loss: 0.2298, test_loss: 1.7864, test_f1: 0.6287
 epoch: 92, train_loss: 0.2190, test_loss: 1.7311, test_f1: 0.6276
 epoch: 93, train_loss: 0.1962, test_loss: 1.7665, test_f1: 0.6408
 epoch: 94, train_loss: 0.1922, test_loss: 2.0464, test_f1: 0.6157
 epoch: 95, train_loss: 0.2047, test_loss: 1.8662, test_f1: 0.6329
 epoch: 96, train_loss: 0.2279, test_loss: 1.8149, test_f1: 0.6380
 epoch: 97, train_loss: 0.2287, test_loss: 1.8226, test_f1: 0.6235
 epoch: 98, train_loss: 0.1994, test_loss: 1.7730, test_f1: 0.6213
 epoch: 99, train_loss: 0.2006, test_loss: 1.8172, test_f1: 0.6250
##################ITERATION #9 ****************************************
 epoch: 0, train_loss: 1.6466, test_loss: 1.3716, test_f1: 0.2270
 epoch: 1, train_loss: 1.0942, test_loss: 1.1258, test_f1: 0.3822
 epoch: 2, train_loss: 1.0016, test_loss: 1.0503, test_f1: 0.3666
 epoch: 3, train_loss: 0.9503, test_loss: 0.9950, test_f1: 0.4082
 epoch: 4, train_loss: 0.9248, test_loss: 1.0081, test_f1: 0.4738
 epoch: 5, train_loss: 0.8953, test_loss: 0.9747, test_f1: 0.5183
 epoch: 6, train_loss: 0.8675, test_loss: 0.9665, test_f1: 0.5201
 epoch: 7, train_loss: 0.8493, test_loss: 0.9587, test_f1: 0.4982
 epoch: 8, train_loss: 0.8558, test_loss: 0.9859, test_f1: 0.5524
 epoch: 9, train_loss: 0.8186, test_loss: 0.9119, test_f1: 0.5356
 epoch: 10, train_loss: 0.8083, test_loss: 0.9466, test_f1: 0.5511
 epoch: 11, train_loss: 0.8082, test_loss: 0.9517, test_f1: 0.5434
 epoch: 12, train_loss: 0.7848, test_loss: 0.9296, test_f1: 0.6042
 epoch: 13, train_loss: 0.7842, test_loss: 0.9306, test_f1: 0.5866
 epoch: 14, train_loss: 0.7523, test_loss: 0.9778, test_f1: 0.5467
 epoch: 15, train_loss: 0.7480, test_loss: 0.9852, test_f1: 0.5494
 epoch: 16, train_loss: 0.7315, test_loss: 0.9704, test_f1: 0.5566
 epoch: 17, train_loss: 0.7317, test_loss: 0.9978, test_f1: 0.5655
 epoch: 18, train_loss: 0.7306, test_loss: 0.9599, test_f1: 0.5690
 epoch: 19, train_loss: 0.7089, test_loss: 0.9224, test_f1: 0.6021
 epoch: 20, train_loss: 0.6905, test_loss: 0.9784, test_f1: 0.5566
 epoch: 21, train_loss: 0.6707, test_loss: 1.0987, test_f1: 0.5462
 epoch: 22, train_loss: 0.6965, test_loss: 1.0076, test_f1: 0.5839
 epoch: 23, train_loss: 0.6768, test_loss: 1.0568, test_f1: 0.5646
 epoch: 24, train_loss: 0.6657, test_loss: 0.9719, test_f1: 0.6115
 epoch: 25, train_loss: 0.6580, test_loss: 1.0152, test_f1: 0.5961
 epoch: 26, train_loss: 0.6584, test_loss: 0.9594, test_f1: 0.6235
 epoch: 27, train_loss: 0.6339, test_loss: 1.0233, test_f1: 0.5596
 epoch: 28, train_loss: 0.6131, test_loss: 0.9503, test_f1: 0.6285
 epoch: 29, train_loss: 0.6097, test_loss: 1.0270, test_f1: 0.6036
 epoch: 30, train_loss: 0.5996, test_loss: 1.0242, test_f1: 0.6310
 epoch: 31, train_loss: 0.5882, test_loss: 1.0156, test_f1: 0.6218
 epoch: 32, train_loss: 0.5670, test_loss: 1.0560, test_f1: 0.5961
 epoch: 33, train_loss: 0.5742, test_loss: 1.0420, test_f1: 0.6202
 epoch: 34, train_loss: 0.5854, test_loss: 1.0662, test_f1: 0.6224
 epoch: 35, train_loss: 0.5782, test_loss: 1.0852, test_f1: 0.6132
 epoch: 36, train_loss: 0.5696, test_loss: 1.0856, test_f1: 0.6135
 epoch: 37, train_loss: 0.5556, test_loss: 0.9583, test_f1: 0.6397
 epoch: 38, train_loss: 0.5629, test_loss: 1.0785, test_f1: 0.6016
 epoch: 39, train_loss: 0.5329, test_loss: 1.0447, test_f1: 0.6336
 epoch: 40, train_loss: 0.5282, test_loss: 1.1396, test_f1: 0.6163
 epoch: 41, train_loss: 0.5072, test_loss: 1.0985, test_f1: 0.6293
 epoch: 42, train_loss: 0.4972, test_loss: 1.0358, test_f1: 0.6198
 epoch: 43, train_loss: 0.4780, test_loss: 1.0507, test_f1: 0.6461
 epoch: 44, train_loss: 0.5027, test_loss: 1.2795, test_f1: 0.6089
 epoch: 45, train_loss: 0.4941, test_loss: 1.2067, test_f1: 0.6365
 epoch: 46, train_loss: 0.4920, test_loss: 1.2048, test_f1: 0.6255
 epoch: 47, train_loss: 0.4778, test_loss: 1.1448, test_f1: 0.6327
 epoch: 48, train_loss: 0.4765, test_loss: 1.1281, test_f1: 0.6252
 epoch: 49, train_loss: 0.4759, test_loss: 1.0424, test_f1: 0.6405
 epoch: 50, train_loss: 0.4760, test_loss: 1.3847, test_f1: 0.6184
 epoch: 51, train_loss: 0.4358, test_loss: 1.1593, test_f1: 0.6440
 epoch: 52, train_loss: 0.3991, test_loss: 1.1386, test_f1: 0.6606
 epoch: 53, train_loss: 0.3920, test_loss: 1.2923, test_f1: 0.6353
 epoch: 54, train_loss: 0.3672, test_loss: 1.3363, test_f1: 0.6314
 epoch: 55, train_loss: 0.3802, test_loss: 1.2198, test_f1: 0.6588
 epoch: 56, train_loss: 0.3512, test_loss: 1.3133, test_f1: 0.6552
 epoch: 57, train_loss: 0.3346, test_loss: 1.2859, test_f1: 0.6638
 epoch: 58, train_loss: 0.3376, test_loss: 1.3178, test_f1: 0.6329
 epoch: 59, train_loss: 0.3190, test_loss: 1.3451, test_f1: 0.6522
 epoch: 60, train_loss: 0.3056, test_loss: 1.3488, test_f1: 0.6491
 epoch: 61, train_loss: 0.3232, test_loss: 1.3881, test_f1: 0.6629
 epoch: 62, train_loss: 0.3130, test_loss: 1.3334, test_f1: 0.6444
 epoch: 63, train_loss: 0.3016, test_loss: 1.3003, test_f1: 0.6573
 epoch: 64, train_loss: 0.2838, test_loss: 1.3466, test_f1: 0.6469
 epoch: 65, train_loss: 0.3003, test_loss: 1.3584, test_f1: 0.6486
 epoch: 66, train_loss: 0.2982, test_loss: 1.4007, test_f1: 0.6394
 epoch: 67, train_loss: 0.2946, test_loss: 1.3973, test_f1: 0.6594
 epoch: 68, train_loss: 0.2945, test_loss: 1.3013, test_f1: 0.6710
 epoch: 69, train_loss: 0.2829, test_loss: 1.3261, test_f1: 0.6572
 epoch: 70, train_loss: 0.2810, test_loss: 1.4217, test_f1: 0.6327
 epoch: 71, train_loss: 0.2775, test_loss: 1.6079, test_f1: 0.6336
 epoch: 72, train_loss: 0.2784, test_loss: 1.4966, test_f1: 0.6319
 epoch: 73, train_loss: 0.2666, test_loss: 1.4614, test_f1: 0.6524
 epoch: 74, train_loss: 0.2844, test_loss: 1.5733, test_f1: 0.6528
 epoch: 75, train_loss: 0.2620, test_loss: 1.5371, test_f1: 0.6380
 epoch: 76, train_loss: 0.2861, test_loss: 1.6204, test_f1: 0.6509
 epoch: 77, train_loss: 0.2640, test_loss: 1.4864, test_f1: 0.6595
 epoch: 78, train_loss: 0.2642, test_loss: 1.5689, test_f1: 0.6213
 epoch: 79, train_loss: 0.2488, test_loss: 1.4816, test_f1: 0.6453
 epoch: 80, train_loss: 0.2659, test_loss: 1.5162, test_f1: 0.6426
 epoch: 81, train_loss: 0.2610, test_loss: 1.5536, test_f1: 0.6594
 epoch: 82, train_loss: 0.2350, test_loss: 1.5569, test_f1: 0.6487
 epoch: 83, train_loss: 0.2438, test_loss: 1.6079, test_f1: 0.6514
 epoch: 84, train_loss: 0.2288, test_loss: 1.6331, test_f1: 0.6283
 epoch: 85, train_loss: 0.2455, test_loss: 1.5470, test_f1: 0.6719
 epoch: 86, train_loss: 0.2310, test_loss: 1.6691, test_f1: 0.6523
 epoch: 87, train_loss: 0.2211, test_loss: 1.6984, test_f1: 0.6463
 epoch: 88, train_loss: 0.2281, test_loss: 1.6790, test_f1: 0.6230
 epoch: 89, train_loss: 0.2329, test_loss: 1.6419, test_f1: 0.6427
 epoch: 90, train_loss: 0.2351, test_loss: 1.6841, test_f1: 0.6322
 epoch: 91, train_loss: 0.2273, test_loss: 1.7515, test_f1: 0.6303
 epoch: 92, train_loss: 0.2430, test_loss: 1.6521, test_f1: 0.6345
 epoch: 93, train_loss: 0.2297, test_loss: 1.7864, test_f1: 0.6596
 epoch: 94, train_loss: 0.2271, test_loss: 1.7106, test_f1: 0.6403
 epoch: 95, train_loss: 0.2318, test_loss: 1.8061, test_f1: 0.6404
 epoch: 96, train_loss: 0.2142, test_loss: 1.7919, test_f1: 0.6428
 epoch: 97, train_loss: 0.2120, test_loss: 1.6501, test_f1: 0.6446
 epoch: 98, train_loss: 0.2058, test_loss: 1.7913, test_f1: 0.6333
 epoch: 99, train_loss: 0.1977, test_loss: 1.8167, test_f1: 0.6456

Training completed in 418.80 seconds
Best F1: 0.6741 at epoch 39
Mean F1 across iterations: 0.6664  0.0077
========================FINAL RESULTS================================
FEGIN weighted F1: 0.6741  0.0077
python main.py --data ltspice_examples --representation component_net --model FEGIN --layers 4 --hiddens 128 --batch_size 256 --lr 0.001 --emb_size 128 --epochs 100 --save_appendix component_net_L4_H128_BS256_LR0.001_E128 --no_val
-----



STDERR:
  File "main.py", line 370, in <module>
    main()
  File "main.py", line 254, in main
    dataset = dataset_class(
  File "/home/philip/projects/ltspice_examples_code_repo/Circuit-Completion-Using-GNNs/component_classification_with_link_prediction_head/evaluation/FEGIN/kernel/circuit_datasets.py", line 15, in __init__
    self.data, self.slices = torch.load(self.processed_paths[0])
  File "/home/philip/.local/lib/python3.8/site-packages/torch/serialization.py", line 1040, in load
    warnings.warn(
  File "/usr/lib/python3.8/warnings.py", line 109, in _showwarnmsg
    sw(msg.message, msg.category, msg.filename, msg.lineno,
  File "main.py", line 47, in warn_with_traceback
    traceback.print_stack(file=log)
/home/philip/projects/ltspice_examples_code_repo/Circuit-Completion-Using-GNNs/component_classification_with_link_prediction_head/evaluation/FEGIN/kernel/circuit_datasets.py:15: FutureWarning: You are using `torch.load` with `weights_only=False` (the current default value), which uses the default pickle module implicitly. It is possible to construct malicious pickle data which will execute arbitrary code during unpickling (See https://github.com/pytorch/pytorch/blob/main/SECURITY.md#untrusted-models for more details). In a future release, the default value for `weights_only` will be flipped to `True`. This limits the functions that could be executed during unpickling. Arbitrary objects will no longer be allowed to be loaded via this mode unless they are explicitly allowlisted by the user via `torch.serialization.add_safe_globals`. We recommend you start setting `weights_only=True` for any use case where you don't have full control of the loaded file. Please open an issue on GitHub for any issues related to this experimental feature.
  self.data, self.slices = torch.load(self.processed_paths[0])
