STDOUT:
Results will be saved in /home/philip/projects/ltspice_examples_code_repo/Circuit-Completion-Using-GNNs/component_classification_with_link_prediction_head/evaluation/FEGIN/results/model_FEGIN_dataset_ltspice_examples
Command line input: python main.py --data ltspice_examples --representation component_pin_net --model FEGIN --layers 6 --hiddens 32 --batch_size 128 --lr 0.0001 --emb_size 128 --epochs 100 --save_appendix component_pin_net_L6_H32_BS128_LR0.0001_E128 --no_val
 is saved.
-----
ltspice_examples - FEGIN
Using 6 layers, 32 hidden units, h = 2
Loading component_pin_net representation dataset
ENTERED
Training FEGIN on component_pin_net representation
Train: 3558, Test: 846
##################ITERATION #0 ****************************************
 epoch: 0, train_loss: 1.3891, test_loss: 1.3903, test_f1: 0.0304
 epoch: 1, train_loss: 1.3818, test_loss: 1.3852, test_f1: 0.1400
 epoch: 2, train_loss: 1.3770, test_loss: 1.3769, test_f1: 0.2420
 epoch: 3, train_loss: 1.3722, test_loss: 1.3692, test_f1: 0.3855
 epoch: 4, train_loss: 1.3659, test_loss: 1.3613, test_f1: 0.4352
 epoch: 5, train_loss: 1.3586, test_loss: 1.3526, test_f1: 0.4256
 epoch: 6, train_loss: 1.3474, test_loss: 1.3410, test_f1: 0.3932
 epoch: 7, train_loss: 1.3351, test_loss: 1.3268, test_f1: 0.3254
 epoch: 8, train_loss: 1.3208, test_loss: 1.3101, test_f1: 0.3283
 epoch: 9, train_loss: 1.3023, test_loss: 1.2919, test_f1: 0.3184
 epoch: 10, train_loss: 1.2878, test_loss: 1.2738, test_f1: 0.3293
 epoch: 11, train_loss: 1.2690, test_loss: 1.2564, test_f1: 0.3313
 epoch: 12, train_loss: 1.2575, test_loss: 1.2410, test_f1: 0.3403
 epoch: 13, train_loss: 1.2415, test_loss: 1.2236, test_f1: 0.3422
 epoch: 14, train_loss: 1.2246, test_loss: 1.2058, test_f1: 0.3422
 epoch: 15, train_loss: 1.2143, test_loss: 1.1908, test_f1: 0.3441
 epoch: 16, train_loss: 1.1967, test_loss: 1.1725, test_f1: 0.3422
 epoch: 17, train_loss: 1.1807, test_loss: 1.1551, test_f1: 0.3458
 epoch: 18, train_loss: 1.1582, test_loss: 1.1368, test_f1: 0.3458
 epoch: 19, train_loss: 1.1481, test_loss: 1.1225, test_f1: 0.3450
 epoch: 20, train_loss: 1.1280, test_loss: 1.1084, test_f1: 0.3460
 epoch: 21, train_loss: 1.1168, test_loss: 1.0991, test_f1: 0.3440
 epoch: 22, train_loss: 1.1019, test_loss: 1.0902, test_f1: 0.3460
 epoch: 23, train_loss: 1.0901, test_loss: 1.0841, test_f1: 0.3459
 epoch: 24, train_loss: 1.0768, test_loss: 1.0790, test_f1: 0.3440
 epoch: 25, train_loss: 1.0650, test_loss: 1.0780, test_f1: 0.3429
 epoch: 26, train_loss: 1.0583, test_loss: 1.0772, test_f1: 0.3411
 epoch: 27, train_loss: 1.0548, test_loss: 1.0719, test_f1: 0.3436
 epoch: 28, train_loss: 1.0432, test_loss: 1.0664, test_f1: 0.3448
 epoch: 29, train_loss: 1.0348, test_loss: 1.0635, test_f1: 0.3536
 epoch: 30, train_loss: 1.0315, test_loss: 1.0583, test_f1: 0.3786
 epoch: 31, train_loss: 1.0312, test_loss: 1.0543, test_f1: 0.3825
 epoch: 32, train_loss: 1.0211, test_loss: 1.0575, test_f1: 0.4271
 epoch: 33, train_loss: 1.0138, test_loss: 1.0535, test_f1: 0.4171
 epoch: 34, train_loss: 1.0091, test_loss: 1.0540, test_f1: 0.4255
 epoch: 35, train_loss: 1.0007, test_loss: 1.0442, test_f1: 0.4473
 epoch: 36, train_loss: 0.9996, test_loss: 1.0482, test_f1: 0.4530
 epoch: 37, train_loss: 0.9975, test_loss: 1.0471, test_f1: 0.4470
 epoch: 38, train_loss: 0.9870, test_loss: 1.0314, test_f1: 0.4593
 epoch: 39, train_loss: 0.9856, test_loss: 1.0335, test_f1: 0.4627
 epoch: 40, train_loss: 0.9828, test_loss: 1.0261, test_f1: 0.4951
 epoch: 41, train_loss: 0.9707, test_loss: 1.0193, test_f1: 0.4876
 epoch: 42, train_loss: 0.9611, test_loss: 1.0189, test_f1: 0.5042
 epoch: 43, train_loss: 0.9598, test_loss: 1.0099, test_f1: 0.5009
 epoch: 44, train_loss: 0.9588, test_loss: 1.0112, test_f1: 0.4990
 epoch: 45, train_loss: 0.9531, test_loss: 1.0088, test_f1: 0.5034
 epoch: 46, train_loss: 0.9470, test_loss: 0.9928, test_f1: 0.4884
 epoch: 47, train_loss: 0.9432, test_loss: 0.9980, test_f1: 0.4994
 epoch: 48, train_loss: 0.9378, test_loss: 1.0001, test_f1: 0.5055
 epoch: 49, train_loss: 0.9340, test_loss: 0.9849, test_f1: 0.4983
 epoch: 50, train_loss: 0.9245, test_loss: 0.9832, test_f1: 0.4845
 epoch: 51, train_loss: 0.9349, test_loss: 0.9746, test_f1: 0.5018
 epoch: 52, train_loss: 0.9243, test_loss: 0.9732, test_f1: 0.5070
 epoch: 53, train_loss: 0.9157, test_loss: 0.9715, test_f1: 0.5058
 epoch: 54, train_loss: 0.9202, test_loss: 0.9763, test_f1: 0.5059
 epoch: 55, train_loss: 0.9272, test_loss: 0.9702, test_f1: 0.5000
 epoch: 56, train_loss: 0.9191, test_loss: 0.9737, test_f1: 0.5090
 epoch: 57, train_loss: 0.9129, test_loss: 0.9674, test_f1: 0.5046
 epoch: 58, train_loss: 0.9187, test_loss: 0.9603, test_f1: 0.5034
 epoch: 59, train_loss: 0.9212, test_loss: 0.9716, test_f1: 0.5036
 epoch: 60, train_loss: 0.9080, test_loss: 0.9685, test_f1: 0.5131
 epoch: 61, train_loss: 0.9141, test_loss: 0.9616, test_f1: 0.5078
 epoch: 62, train_loss: 0.9091, test_loss: 0.9565, test_f1: 0.5043
 epoch: 63, train_loss: 0.9148, test_loss: 0.9604, test_f1: 0.5081
 epoch: 64, train_loss: 0.9066, test_loss: 0.9543, test_f1: 0.5069
 epoch: 65, train_loss: 0.9003, test_loss: 0.9541, test_f1: 0.5078
 epoch: 66, train_loss: 0.9089, test_loss: 0.9530, test_f1: 0.5046
 epoch: 67, train_loss: 0.9081, test_loss: 0.9589, test_f1: 0.5050
 epoch: 68, train_loss: 0.9062, test_loss: 0.9491, test_f1: 0.5067
 epoch: 69, train_loss: 0.9089, test_loss: 0.9407, test_f1: 0.5006
 epoch: 70, train_loss: 0.9058, test_loss: 0.9465, test_f1: 0.5130
 epoch: 71, train_loss: 0.9024, test_loss: 0.9489, test_f1: 0.5092
 epoch: 72, train_loss: 0.8867, test_loss: 0.9474, test_f1: 0.5046
 epoch: 73, train_loss: 0.9056, test_loss: 0.9473, test_f1: 0.5128
 epoch: 74, train_loss: 0.8920, test_loss: 0.9512, test_f1: 0.5016
 epoch: 75, train_loss: 0.8958, test_loss: 0.9425, test_f1: 0.5149
 epoch: 76, train_loss: 0.8980, test_loss: 0.9460, test_f1: 0.5103
 epoch: 77, train_loss: 0.8932, test_loss: 0.9391, test_f1: 0.5139
 epoch: 78, train_loss: 0.8903, test_loss: 0.9404, test_f1: 0.5113
 epoch: 79, train_loss: 0.8944, test_loss: 0.9437, test_f1: 0.5066
 epoch: 80, train_loss: 0.8972, test_loss: 0.9383, test_f1: 0.5134
 epoch: 81, train_loss: 0.8990, test_loss: 0.9460, test_f1: 0.5072
 epoch: 82, train_loss: 0.8944, test_loss: 0.9431, test_f1: 0.5109
 epoch: 83, train_loss: 0.8954, test_loss: 0.9401, test_f1: 0.5035
 epoch: 84, train_loss: 0.8891, test_loss: 0.9329, test_f1: 0.5116
 epoch: 85, train_loss: 0.8872, test_loss: 0.9379, test_f1: 0.5127
 epoch: 86, train_loss: 0.8765, test_loss: 0.9350, test_f1: 0.5154
 epoch: 87, train_loss: 0.8807, test_loss: 0.9378, test_f1: 0.5109
 epoch: 88, train_loss: 0.8824, test_loss: 0.9393, test_f1: 0.5051
 epoch: 89, train_loss: 0.8886, test_loss: 0.9413, test_f1: 0.5180
 epoch: 90, train_loss: 0.8867, test_loss: 0.9371, test_f1: 0.5075
 epoch: 91, train_loss: 0.8832, test_loss: 0.9331, test_f1: 0.5200
 epoch: 92, train_loss: 0.8810, test_loss: 0.9346, test_f1: 0.5090
 epoch: 93, train_loss: 0.8775, test_loss: 0.9309, test_f1: 0.5162
 epoch: 94, train_loss: 0.8758, test_loss: 0.9288, test_f1: 0.5176
 epoch: 95, train_loss: 0.8675, test_loss: 0.9332, test_f1: 0.5121
 epoch: 96, train_loss: 0.8724, test_loss: 0.9316, test_f1: 0.5104
 epoch: 97, train_loss: 0.8841, test_loss: 0.9342, test_f1: 0.5122
 epoch: 98, train_loss: 0.8861, test_loss: 0.9308, test_f1: 0.5167
 epoch: 99, train_loss: 0.8781, test_loss: 0.9454, test_f1: 0.5193
##################ITERATION #1 ****************************************
 epoch: 0, train_loss: 1.3562, test_loss: 1.3746, test_f1: 0.2270
 epoch: 1, train_loss: 1.3343, test_loss: 1.3538, test_f1: 0.2728
 epoch: 2, train_loss: 1.3175, test_loss: 1.3079, test_f1: 0.3864
 epoch: 3, train_loss: 1.2987, test_loss: 1.2797, test_f1: 0.4053
 epoch: 4, train_loss: 1.2784, test_loss: 1.2543, test_f1: 0.4082
 epoch: 5, train_loss: 1.2562, test_loss: 1.2283, test_f1: 0.4064
 epoch: 6, train_loss: 1.2261, test_loss: 1.2036, test_f1: 0.3946
 epoch: 7, train_loss: 1.2069, test_loss: 1.1803, test_f1: 0.3848
 epoch: 8, train_loss: 1.1794, test_loss: 1.1585, test_f1: 0.3753
 epoch: 9, train_loss: 1.1592, test_loss: 1.1433, test_f1: 0.3677
 epoch: 10, train_loss: 1.1406, test_loss: 1.1266, test_f1: 0.3686
 epoch: 11, train_loss: 1.1214, test_loss: 1.1129, test_f1: 0.3709
 epoch: 12, train_loss: 1.1097, test_loss: 1.1012, test_f1: 0.3576
 epoch: 13, train_loss: 1.0944, test_loss: 1.0906, test_f1: 0.3573
 epoch: 14, train_loss: 1.0873, test_loss: 1.0923, test_f1: 0.3687
 epoch: 15, train_loss: 1.0779, test_loss: 1.0798, test_f1: 0.3807
 epoch: 16, train_loss: 1.0661, test_loss: 1.0813, test_f1: 0.3713
 epoch: 17, train_loss: 1.0620, test_loss: 1.0640, test_f1: 0.4007
 epoch: 18, train_loss: 1.0531, test_loss: 1.0675, test_f1: 0.4024
 epoch: 19, train_loss: 1.0465, test_loss: 1.0607, test_f1: 0.4074
 epoch: 20, train_loss: 1.0423, test_loss: 1.0501, test_f1: 0.4187
 epoch: 21, train_loss: 1.0324, test_loss: 1.0490, test_f1: 0.4343
 epoch: 22, train_loss: 1.0315, test_loss: 1.0509, test_f1: 0.4320
 epoch: 23, train_loss: 1.0202, test_loss: 1.0449, test_f1: 0.4460
 epoch: 24, train_loss: 1.0200, test_loss: 1.0365, test_f1: 0.4537
 epoch: 25, train_loss: 1.0132, test_loss: 1.0320, test_f1: 0.4524
 epoch: 26, train_loss: 1.0150, test_loss: 1.0305, test_f1: 0.4632
 epoch: 27, train_loss: 1.0050, test_loss: 1.0291, test_f1: 0.4700
 epoch: 28, train_loss: 1.0100, test_loss: 1.0411, test_f1: 0.4486
 epoch: 29, train_loss: 1.0001, test_loss: 1.0245, test_f1: 0.4727
 epoch: 30, train_loss: 0.9917, test_loss: 1.0159, test_f1: 0.4604
 epoch: 31, train_loss: 0.9919, test_loss: 1.0162, test_f1: 0.4736
 epoch: 32, train_loss: 0.9816, test_loss: 1.0127, test_f1: 0.4729
 epoch: 33, train_loss: 0.9934, test_loss: 1.0117, test_f1: 0.4654
 epoch: 34, train_loss: 0.9755, test_loss: 1.0112, test_f1: 0.4699
 epoch: 35, train_loss: 0.9756, test_loss: 1.0096, test_f1: 0.4771
 epoch: 36, train_loss: 0.9745, test_loss: 0.9988, test_f1: 0.4779
 epoch: 37, train_loss: 0.9787, test_loss: 0.9964, test_f1: 0.4797
 epoch: 38, train_loss: 0.9683, test_loss: 0.9974, test_f1: 0.4820
 epoch: 39, train_loss: 0.9706, test_loss: 0.9912, test_f1: 0.4849
 epoch: 40, train_loss: 0.9586, test_loss: 0.9889, test_f1: 0.4946
 epoch: 41, train_loss: 0.9588, test_loss: 0.9850, test_f1: 0.5003
 epoch: 42, train_loss: 0.9595, test_loss: 0.9766, test_f1: 0.4998
 epoch: 43, train_loss: 0.9449, test_loss: 0.9854, test_f1: 0.5064
 epoch: 44, train_loss: 0.9513, test_loss: 0.9772, test_f1: 0.4960
 epoch: 45, train_loss: 0.9539, test_loss: 0.9812, test_f1: 0.5061
 epoch: 46, train_loss: 0.9443, test_loss: 0.9803, test_f1: 0.5060
 epoch: 47, train_loss: 0.9464, test_loss: 0.9822, test_f1: 0.5039
 epoch: 48, train_loss: 0.9422, test_loss: 0.9702, test_f1: 0.5140
 epoch: 49, train_loss: 0.9443, test_loss: 0.9671, test_f1: 0.5090
 epoch: 50, train_loss: 0.9371, test_loss: 0.9774, test_f1: 0.5128
 epoch: 51, train_loss: 0.9279, test_loss: 0.9673, test_f1: 0.5220
 epoch: 52, train_loss: 0.9289, test_loss: 0.9738, test_f1: 0.5224
 epoch: 53, train_loss: 0.9320, test_loss: 0.9696, test_f1: 0.5111
 epoch: 54, train_loss: 0.9308, test_loss: 0.9634, test_f1: 0.5149
 epoch: 55, train_loss: 0.9329, test_loss: 0.9732, test_f1: 0.5124
 epoch: 56, train_loss: 0.9196, test_loss: 0.9621, test_f1: 0.5151
 epoch: 57, train_loss: 0.9237, test_loss: 0.9691, test_f1: 0.5261
 epoch: 58, train_loss: 0.9307, test_loss: 0.9707, test_f1: 0.5119
 epoch: 59, train_loss: 0.9235, test_loss: 0.9767, test_f1: 0.5182
 epoch: 60, train_loss: 0.9223, test_loss: 0.9657, test_f1: 0.5169
 epoch: 61, train_loss: 0.9228, test_loss: 0.9698, test_f1: 0.5140
 epoch: 62, train_loss: 0.9148, test_loss: 0.9623, test_f1: 0.5228
 epoch: 63, train_loss: 0.9200, test_loss: 0.9653, test_f1: 0.5103
 epoch: 64, train_loss: 0.9167, test_loss: 0.9712, test_f1: 0.5111
 epoch: 65, train_loss: 0.9195, test_loss: 0.9717, test_f1: 0.5183
 epoch: 66, train_loss: 0.9196, test_loss: 0.9657, test_f1: 0.5275
 epoch: 67, train_loss: 0.9163, test_loss: 0.9604, test_f1: 0.5204
 epoch: 68, train_loss: 0.9082, test_loss: 0.9598, test_f1: 0.5296
 epoch: 69, train_loss: 0.9097, test_loss: 0.9646, test_f1: 0.5177
 epoch: 70, train_loss: 0.9108, test_loss: 0.9674, test_f1: 0.5145
 epoch: 71, train_loss: 0.9046, test_loss: 0.9715, test_f1: 0.5171
 epoch: 72, train_loss: 0.9047, test_loss: 0.9649, test_f1: 0.5184
 epoch: 73, train_loss: 0.9013, test_loss: 0.9657, test_f1: 0.5244
 epoch: 74, train_loss: 0.9092, test_loss: 0.9765, test_f1: 0.5179
 epoch: 75, train_loss: 0.9096, test_loss: 0.9609, test_f1: 0.5178
 epoch: 76, train_loss: 0.9032, test_loss: 0.9657, test_f1: 0.5200
 epoch: 77, train_loss: 0.9058, test_loss: 0.9596, test_f1: 0.5291
 epoch: 78, train_loss: 0.8971, test_loss: 0.9619, test_f1: 0.5261
 epoch: 79, train_loss: 0.9071, test_loss: 0.9722, test_f1: 0.5094
 epoch: 80, train_loss: 0.9003, test_loss: 0.9674, test_f1: 0.5204
 epoch: 81, train_loss: 0.9003, test_loss: 0.9679, test_f1: 0.5145
 epoch: 82, train_loss: 0.8960, test_loss: 0.9648, test_f1: 0.5212
 epoch: 83, train_loss: 0.9030, test_loss: 0.9636, test_f1: 0.5200
 epoch: 84, train_loss: 0.8974, test_loss: 0.9647, test_f1: 0.5204
 epoch: 85, train_loss: 0.8910, test_loss: 0.9612, test_f1: 0.5308
 epoch: 86, train_loss: 0.9013, test_loss: 0.9698, test_f1: 0.5265
 epoch: 87, train_loss: 0.8947, test_loss: 0.9678, test_f1: 0.5247
 epoch: 88, train_loss: 0.8961, test_loss: 0.9705, test_f1: 0.5187
 epoch: 89, train_loss: 0.8919, test_loss: 0.9573, test_f1: 0.5251
 epoch: 90, train_loss: 0.8844, test_loss: 0.9668, test_f1: 0.5210
 epoch: 91, train_loss: 0.8933, test_loss: 0.9681, test_f1: 0.5269
 epoch: 92, train_loss: 0.8935, test_loss: 0.9766, test_f1: 0.5218
 epoch: 93, train_loss: 0.8886, test_loss: 0.9696, test_f1: 0.5172
 epoch: 94, train_loss: 0.8875, test_loss: 0.9678, test_f1: 0.5261
 epoch: 95, train_loss: 0.8969, test_loss: 0.9682, test_f1: 0.5190
 epoch: 96, train_loss: 0.8903, test_loss: 0.9664, test_f1: 0.5310
 epoch: 97, train_loss: 0.8865, test_loss: 0.9658, test_f1: 0.5223
 epoch: 98, train_loss: 0.8864, test_loss: 0.9663, test_f1: 0.5223
 epoch: 99, train_loss: 0.8945, test_loss: 0.9566, test_f1: 0.5269
##################ITERATION #2 ****************************************
 epoch: 0, train_loss: 1.3232, test_loss: 1.3363, test_f1: 0.2270
 epoch: 1, train_loss: 1.2998, test_loss: 1.3120, test_f1: 0.2270
 epoch: 2, train_loss: 1.2906, test_loss: 1.2876, test_f1: 0.2270
 epoch: 3, train_loss: 1.2774, test_loss: 1.2692, test_f1: 0.2270
 epoch: 4, train_loss: 1.2664, test_loss: 1.2522, test_f1: 0.2270
 epoch: 5, train_loss: 1.2508, test_loss: 1.2373, test_f1: 0.2270
 epoch: 6, train_loss: 1.2395, test_loss: 1.2204, test_f1: 0.2270
 epoch: 7, train_loss: 1.2266, test_loss: 1.2052, test_f1: 0.2395
 epoch: 8, train_loss: 1.2158, test_loss: 1.1903, test_f1: 0.2392
 epoch: 9, train_loss: 1.1984, test_loss: 1.1759, test_f1: 0.2603
 epoch: 10, train_loss: 1.1902, test_loss: 1.1633, test_f1: 0.3037
 epoch: 11, train_loss: 1.1782, test_loss: 1.1484, test_f1: 0.3509
 epoch: 12, train_loss: 1.1639, test_loss: 1.1325, test_f1: 0.3993
 epoch: 13, train_loss: 1.1496, test_loss: 1.1193, test_f1: 0.3917
 epoch: 14, train_loss: 1.1334, test_loss: 1.1043, test_f1: 0.4127
 epoch: 15, train_loss: 1.1254, test_loss: 1.0873, test_f1: 0.4173
 epoch: 16, train_loss: 1.1117, test_loss: 1.0756, test_f1: 0.4166
 epoch: 17, train_loss: 1.0990, test_loss: 1.0645, test_f1: 0.4119
 epoch: 18, train_loss: 1.0858, test_loss: 1.0483, test_f1: 0.4359
 epoch: 19, train_loss: 1.0726, test_loss: 1.0405, test_f1: 0.4288
 epoch: 20, train_loss: 1.0586, test_loss: 1.0331, test_f1: 0.4445
 epoch: 21, train_loss: 1.0545, test_loss: 1.0257, test_f1: 0.4498
 epoch: 22, train_loss: 1.0407, test_loss: 1.0260, test_f1: 0.4333
 epoch: 23, train_loss: 1.0353, test_loss: 1.0141, test_f1: 0.4650
 epoch: 24, train_loss: 1.0274, test_loss: 1.0134, test_f1: 0.4657
 epoch: 25, train_loss: 1.0135, test_loss: 0.9976, test_f1: 0.4844
 epoch: 26, train_loss: 1.0120, test_loss: 0.9967, test_f1: 0.4794
 epoch: 27, train_loss: 1.0005, test_loss: 0.9981, test_f1: 0.4692
 epoch: 28, train_loss: 1.0007, test_loss: 0.9910, test_f1: 0.4791
 epoch: 29, train_loss: 0.9955, test_loss: 0.9899, test_f1: 0.4984
 epoch: 30, train_loss: 0.9904, test_loss: 0.9838, test_f1: 0.4950
 epoch: 31, train_loss: 0.9815, test_loss: 0.9844, test_f1: 0.4937
 epoch: 32, train_loss: 0.9747, test_loss: 0.9818, test_f1: 0.5051
 epoch: 33, train_loss: 0.9747, test_loss: 0.9821, test_f1: 0.4964
 epoch: 34, train_loss: 0.9646, test_loss: 0.9860, test_f1: 0.4892
 epoch: 35, train_loss: 0.9647, test_loss: 0.9706, test_f1: 0.5081
 epoch: 36, train_loss: 0.9671, test_loss: 0.9955, test_f1: 0.4778
 epoch: 37, train_loss: 0.9581, test_loss: 0.9739, test_f1: 0.5104
 epoch: 38, train_loss: 0.9499, test_loss: 0.9722, test_f1: 0.5091
 epoch: 39, train_loss: 0.9486, test_loss: 0.9767, test_f1: 0.5008
 epoch: 40, train_loss: 0.9453, test_loss: 0.9951, test_f1: 0.4771
 epoch: 41, train_loss: 0.9517, test_loss: 0.9850, test_f1: 0.4924
 epoch: 42, train_loss: 0.9384, test_loss: 0.9726, test_f1: 0.4966
 epoch: 43, train_loss: 0.9437, test_loss: 0.9638, test_f1: 0.5034
 epoch: 44, train_loss: 0.9464, test_loss: 0.9545, test_f1: 0.5003
 epoch: 45, train_loss: 0.9287, test_loss: 0.9673, test_f1: 0.5059
 epoch: 46, train_loss: 0.9345, test_loss: 0.9611, test_f1: 0.5030
 epoch: 47, train_loss: 0.9274, test_loss: 0.9601, test_f1: 0.5067
 epoch: 48, train_loss: 0.9332, test_loss: 0.9631, test_f1: 0.5080
 epoch: 49, train_loss: 0.9215, test_loss: 0.9524, test_f1: 0.5095
 epoch: 50, train_loss: 0.9270, test_loss: 0.9665, test_f1: 0.5016
 epoch: 51, train_loss: 0.9184, test_loss: 0.9515, test_f1: 0.5153
 epoch: 52, train_loss: 0.9173, test_loss: 0.9676, test_f1: 0.5080
 epoch: 53, train_loss: 0.9127, test_loss: 0.9775, test_f1: 0.4973
 epoch: 54, train_loss: 0.9185, test_loss: 0.9611, test_f1: 0.5201
 epoch: 55, train_loss: 0.9086, test_loss: 0.9540, test_f1: 0.5164
 epoch: 56, train_loss: 0.9078, test_loss: 0.9599, test_f1: 0.5139
 epoch: 57, train_loss: 0.9088, test_loss: 0.9572, test_f1: 0.5047
 epoch: 58, train_loss: 0.9051, test_loss: 0.9532, test_f1: 0.5127
 epoch: 59, train_loss: 0.9018, test_loss: 0.9563, test_f1: 0.5183
 epoch: 60, train_loss: 0.9074, test_loss: 0.9469, test_f1: 0.5236
 epoch: 61, train_loss: 0.9017, test_loss: 0.9578, test_f1: 0.5212
 epoch: 62, train_loss: 0.9059, test_loss: 0.9570, test_f1: 0.5161
 epoch: 63, train_loss: 0.9028, test_loss: 0.9498, test_f1: 0.5144
 epoch: 64, train_loss: 0.9017, test_loss: 0.9721, test_f1: 0.5137
 epoch: 65, train_loss: 0.9111, test_loss: 0.9557, test_f1: 0.5163
 epoch: 66, train_loss: 0.9020, test_loss: 0.9485, test_f1: 0.5268
 epoch: 67, train_loss: 0.9024, test_loss: 0.9491, test_f1: 0.5235
 epoch: 68, train_loss: 0.8981, test_loss: 0.9547, test_f1: 0.5277
 epoch: 69, train_loss: 0.8964, test_loss: 0.9441, test_f1: 0.5209
 epoch: 70, train_loss: 0.8975, test_loss: 0.9437, test_f1: 0.5234
 epoch: 71, train_loss: 0.8984, test_loss: 0.9481, test_f1: 0.5205
 epoch: 72, train_loss: 0.8916, test_loss: 0.9499, test_f1: 0.5187
 epoch: 73, train_loss: 0.8853, test_loss: 0.9488, test_f1: 0.5190
 epoch: 74, train_loss: 0.8922, test_loss: 0.9394, test_f1: 0.5329
 epoch: 75, train_loss: 0.8912, test_loss: 0.9462, test_f1: 0.5168
 epoch: 76, train_loss: 0.8916, test_loss: 0.9460, test_f1: 0.5245
 epoch: 77, train_loss: 0.8924, test_loss: 0.9481, test_f1: 0.5294
 epoch: 78, train_loss: 0.8903, test_loss: 0.9377, test_f1: 0.5226
 epoch: 79, train_loss: 0.8941, test_loss: 0.9378, test_f1: 0.5227
 epoch: 80, train_loss: 0.8900, test_loss: 0.9435, test_f1: 0.5228
 epoch: 81, train_loss: 0.8895, test_loss: 0.9569, test_f1: 0.5278
 epoch: 82, train_loss: 0.8852, test_loss: 0.9509, test_f1: 0.5226
 epoch: 83, train_loss: 0.8869, test_loss: 0.9515, test_f1: 0.5298
 epoch: 84, train_loss: 0.8798, test_loss: 0.9483, test_f1: 0.5179
 epoch: 85, train_loss: 0.8807, test_loss: 0.9438, test_f1: 0.5196
 epoch: 86, train_loss: 0.8818, test_loss: 0.9487, test_f1: 0.5236
 epoch: 87, train_loss: 0.8776, test_loss: 0.9426, test_f1: 0.5223
 epoch: 88, train_loss: 0.8830, test_loss: 0.9450, test_f1: 0.5255
 epoch: 89, train_loss: 0.8768, test_loss: 0.9439, test_f1: 0.5245
 epoch: 90, train_loss: 0.8842, test_loss: 0.9502, test_f1: 0.5244
 epoch: 91, train_loss: 0.8818, test_loss: 0.9535, test_f1: 0.5195
 epoch: 92, train_loss: 0.8778, test_loss: 0.9388, test_f1: 0.5195
 epoch: 93, train_loss: 0.8796, test_loss: 0.9518, test_f1: 0.5216
 epoch: 94, train_loss: 0.8753, test_loss: 0.9446, test_f1: 0.5273
 epoch: 95, train_loss: 0.8711, test_loss: 0.9510, test_f1: 0.5212
 epoch: 96, train_loss: 0.8736, test_loss: 0.9469, test_f1: 0.5245
 epoch: 97, train_loss: 0.8742, test_loss: 0.9418, test_f1: 0.5238
 epoch: 98, train_loss: 0.8693, test_loss: 0.9340, test_f1: 0.5273
 epoch: 99, train_loss: 0.8732, test_loss: 0.9386, test_f1: 0.5237
##################ITERATION #3 ****************************************
 epoch: 0, train_loss: 1.3056, test_loss: 1.3394, test_f1: 0.2270
 epoch: 1, train_loss: 1.2676, test_loss: 1.3098, test_f1: 0.2270
 epoch: 2, train_loss: 1.2400, test_loss: 1.2442, test_f1: 0.3171
 epoch: 3, train_loss: 1.2165, test_loss: 1.1948, test_f1: 0.3334
 epoch: 4, train_loss: 1.1942, test_loss: 1.1659, test_f1: 0.3486
 epoch: 5, train_loss: 1.1698, test_loss: 1.1490, test_f1: 0.3605
 epoch: 6, train_loss: 1.1475, test_loss: 1.1287, test_f1: 0.3604
 epoch: 7, train_loss: 1.1278, test_loss: 1.1168, test_f1: 0.3637
 epoch: 8, train_loss: 1.1165, test_loss: 1.1049, test_f1: 0.3689
 epoch: 9, train_loss: 1.1035, test_loss: 1.0899, test_f1: 0.3745
 epoch: 10, train_loss: 1.0866, test_loss: 1.0889, test_f1: 0.3856
 epoch: 11, train_loss: 1.0750, test_loss: 1.0708, test_f1: 0.3861
 epoch: 12, train_loss: 1.0630, test_loss: 1.0707, test_f1: 0.3958
 epoch: 13, train_loss: 1.0544, test_loss: 1.0612, test_f1: 0.3986
 epoch: 14, train_loss: 1.0428, test_loss: 1.0500, test_f1: 0.4117
 epoch: 15, train_loss: 1.0323, test_loss: 1.0416, test_f1: 0.4184
 epoch: 16, train_loss: 1.0246, test_loss: 1.0426, test_f1: 0.4259
 epoch: 17, train_loss: 1.0138, test_loss: 1.0361, test_f1: 0.4481
 epoch: 18, train_loss: 1.0085, test_loss: 1.0307, test_f1: 0.4474
 epoch: 19, train_loss: 1.0050, test_loss: 1.0256, test_f1: 0.4580
 epoch: 20, train_loss: 0.9920, test_loss: 1.0225, test_f1: 0.4562
 epoch: 21, train_loss: 0.9879, test_loss: 1.0137, test_f1: 0.4662
 epoch: 22, train_loss: 0.9828, test_loss: 1.0027, test_f1: 0.4961
 epoch: 23, train_loss: 0.9780, test_loss: 1.0024, test_f1: 0.4934
 epoch: 24, train_loss: 0.9731, test_loss: 1.0136, test_f1: 0.4729
 epoch: 25, train_loss: 0.9649, test_loss: 0.9910, test_f1: 0.4831
 epoch: 26, train_loss: 0.9628, test_loss: 1.0052, test_f1: 0.4897
 epoch: 27, train_loss: 0.9509, test_loss: 0.9789, test_f1: 0.4875
 epoch: 28, train_loss: 0.9543, test_loss: 0.9826, test_f1: 0.5004
 epoch: 29, train_loss: 0.9448, test_loss: 0.9799, test_f1: 0.4986
 epoch: 30, train_loss: 0.9451, test_loss: 0.9714, test_f1: 0.5163
 epoch: 31, train_loss: 0.9370, test_loss: 0.9489, test_f1: 0.5007
 epoch: 32, train_loss: 0.9331, test_loss: 0.9795, test_f1: 0.5026
 epoch: 33, train_loss: 0.9347, test_loss: 0.9637, test_f1: 0.4926
 epoch: 34, train_loss: 0.9251, test_loss: 0.9557, test_f1: 0.5016
 epoch: 35, train_loss: 0.9244, test_loss: 0.9559, test_f1: 0.5012
 epoch: 36, train_loss: 0.9148, test_loss: 0.9485, test_f1: 0.5022
 epoch: 37, train_loss: 0.9156, test_loss: 0.9495, test_f1: 0.5110
 epoch: 38, train_loss: 0.9163, test_loss: 0.9344, test_f1: 0.4965
 epoch: 39, train_loss: 0.9150, test_loss: 0.9382, test_f1: 0.4971
 epoch: 40, train_loss: 0.9042, test_loss: 0.9429, test_f1: 0.5230
 epoch: 41, train_loss: 0.9052, test_loss: 0.9433, test_f1: 0.5046
 epoch: 42, train_loss: 0.9069, test_loss: 0.9455, test_f1: 0.5192
 epoch: 43, train_loss: 0.9007, test_loss: 0.9288, test_f1: 0.5178
 epoch: 44, train_loss: 0.8956, test_loss: 0.9316, test_f1: 0.5097
 epoch: 45, train_loss: 0.9027, test_loss: 0.9177, test_f1: 0.5317
 epoch: 46, train_loss: 0.8958, test_loss: 0.9358, test_f1: 0.5111
 epoch: 47, train_loss: 0.8854, test_loss: 0.9309, test_f1: 0.5196
 epoch: 48, train_loss: 0.8853, test_loss: 0.9329, test_f1: 0.5278
 epoch: 49, train_loss: 0.8885, test_loss: 0.9365, test_f1: 0.5191
 epoch: 50, train_loss: 0.8888, test_loss: 0.9266, test_f1: 0.5321
 epoch: 51, train_loss: 0.8841, test_loss: 0.9153, test_f1: 0.5254
 epoch: 52, train_loss: 0.8771, test_loss: 0.9119, test_f1: 0.5392
 epoch: 53, train_loss: 0.8745, test_loss: 0.9079, test_f1: 0.5314
 epoch: 54, train_loss: 0.8746, test_loss: 0.9200, test_f1: 0.5309
 epoch: 55, train_loss: 0.8719, test_loss: 0.9171, test_f1: 0.5253
 epoch: 56, train_loss: 0.8652, test_loss: 0.9077, test_f1: 0.5311
 epoch: 57, train_loss: 0.8631, test_loss: 0.9030, test_f1: 0.5262
 epoch: 58, train_loss: 0.8745, test_loss: 0.9199, test_f1: 0.5191
 epoch: 59, train_loss: 0.8741, test_loss: 0.9118, test_f1: 0.5237
 epoch: 60, train_loss: 0.8635, test_loss: 0.9249, test_f1: 0.5230
 epoch: 61, train_loss: 0.8701, test_loss: 0.9228, test_f1: 0.5250
 epoch: 62, train_loss: 0.8696, test_loss: 0.9132, test_f1: 0.5264
 epoch: 63, train_loss: 0.8644, test_loss: 0.9041, test_f1: 0.5431
 epoch: 64, train_loss: 0.8643, test_loss: 0.9078, test_f1: 0.5255
 epoch: 65, train_loss: 0.8620, test_loss: 0.9243, test_f1: 0.5283
 epoch: 66, train_loss: 0.8646, test_loss: 0.9040, test_f1: 0.5201
 epoch: 67, train_loss: 0.8662, test_loss: 0.9150, test_f1: 0.5288
 epoch: 68, train_loss: 0.8616, test_loss: 0.9098, test_f1: 0.5283
 epoch: 69, train_loss: 0.8593, test_loss: 0.9036, test_f1: 0.5404
 epoch: 70, train_loss: 0.8630, test_loss: 0.9107, test_f1: 0.5359
 epoch: 71, train_loss: 0.8596, test_loss: 0.9252, test_f1: 0.5269
 epoch: 72, train_loss: 0.8544, test_loss: 0.9097, test_f1: 0.5245
 epoch: 73, train_loss: 0.8552, test_loss: 0.9092, test_f1: 0.5366
 epoch: 74, train_loss: 0.8518, test_loss: 0.9138, test_f1: 0.5281
 epoch: 75, train_loss: 0.8508, test_loss: 0.9043, test_f1: 0.5320
 epoch: 76, train_loss: 0.8473, test_loss: 0.8989, test_f1: 0.5468
 epoch: 77, train_loss: 0.8544, test_loss: 0.9214, test_f1: 0.5225
 epoch: 78, train_loss: 0.8488, test_loss: 0.9178, test_f1: 0.5368
 epoch: 79, train_loss: 0.8570, test_loss: 0.9237, test_f1: 0.5275
 epoch: 80, train_loss: 0.8458, test_loss: 0.9244, test_f1: 0.5360
 epoch: 81, train_loss: 0.8492, test_loss: 0.9070, test_f1: 0.5369
 epoch: 82, train_loss: 0.8477, test_loss: 0.9112, test_f1: 0.5397
 epoch: 83, train_loss: 0.8515, test_loss: 0.9171, test_f1: 0.5395
 epoch: 84, train_loss: 0.8429, test_loss: 0.9204, test_f1: 0.5262
 epoch: 85, train_loss: 0.8453, test_loss: 0.9159, test_f1: 0.5284
 epoch: 86, train_loss: 0.8545, test_loss: 0.9270, test_f1: 0.5420
 epoch: 87, train_loss: 0.8468, test_loss: 0.9217, test_f1: 0.5344
 epoch: 88, train_loss: 0.8439, test_loss: 0.9228, test_f1: 0.5353
 epoch: 89, train_loss: 0.8424, test_loss: 0.9226, test_f1: 0.5301
 epoch: 90, train_loss: 0.8470, test_loss: 0.9187, test_f1: 0.5360
 epoch: 91, train_loss: 0.8410, test_loss: 0.9310, test_f1: 0.5438
 epoch: 92, train_loss: 0.8403, test_loss: 0.9107, test_f1: 0.5542
 epoch: 93, train_loss: 0.8348, test_loss: 0.9389, test_f1: 0.5303
 epoch: 94, train_loss: 0.8401, test_loss: 0.9248, test_f1: 0.5341
 epoch: 95, train_loss: 0.8341, test_loss: 0.9105, test_f1: 0.5259
 epoch: 96, train_loss: 0.8315, test_loss: 0.9061, test_f1: 0.5426
 epoch: 97, train_loss: 0.8358, test_loss: 0.9214, test_f1: 0.5446
 epoch: 98, train_loss: 0.8347, test_loss: 0.9213, test_f1: 0.5408
 epoch: 99, train_loss: 0.8412, test_loss: 0.9293, test_f1: 0.5429
##################ITERATION #4 ****************************************
 epoch: 0, train_loss: 1.2810, test_loss: 1.3117, test_f1: 0.2270
 epoch: 1, train_loss: 1.2293, test_loss: 1.2447, test_f1: 0.2295
 epoch: 2, train_loss: 1.2034, test_loss: 1.1897, test_f1: 0.3456
 epoch: 3, train_loss: 1.1764, test_loss: 1.1516, test_f1: 0.3973
 epoch: 4, train_loss: 1.1511, test_loss: 1.1308, test_f1: 0.4031
 epoch: 5, train_loss: 1.1384, test_loss: 1.1170, test_f1: 0.4303
 epoch: 6, train_loss: 1.1222, test_loss: 1.1006, test_f1: 0.4340
 epoch: 7, train_loss: 1.1067, test_loss: 1.0893, test_f1: 0.4196
 epoch: 8, train_loss: 1.0873, test_loss: 1.0846, test_f1: 0.4182
 epoch: 9, train_loss: 1.0810, test_loss: 1.0800, test_f1: 0.4158
 epoch: 10, train_loss: 1.0668, test_loss: 1.0649, test_f1: 0.4223
 epoch: 11, train_loss: 1.0602, test_loss: 1.0597, test_f1: 0.4257
 epoch: 12, train_loss: 1.0489, test_loss: 1.0591, test_f1: 0.4316
 epoch: 13, train_loss: 1.0493, test_loss: 1.0478, test_f1: 0.4407
 epoch: 14, train_loss: 1.0355, test_loss: 1.0483, test_f1: 0.4417
 epoch: 15, train_loss: 1.0308, test_loss: 1.0377, test_f1: 0.4616
 epoch: 16, train_loss: 1.0249, test_loss: 1.0355, test_f1: 0.4455
 epoch: 17, train_loss: 1.0172, test_loss: 1.0241, test_f1: 0.4565
 epoch: 18, train_loss: 1.0135, test_loss: 1.0295, test_f1: 0.4535
 epoch: 19, train_loss: 1.0114, test_loss: 1.0198, test_f1: 0.4560
 epoch: 20, train_loss: 1.0067, test_loss: 1.0164, test_f1: 0.4791
 epoch: 21, train_loss: 1.0008, test_loss: 1.0151, test_f1: 0.4776
 epoch: 22, train_loss: 0.9978, test_loss: 1.0137, test_f1: 0.4780
 epoch: 23, train_loss: 0.9886, test_loss: 1.0022, test_f1: 0.4812
 epoch: 24, train_loss: 0.9888, test_loss: 1.0103, test_f1: 0.4782
 epoch: 25, train_loss: 0.9796, test_loss: 1.0066, test_f1: 0.4813
 epoch: 26, train_loss: 0.9891, test_loss: 1.0039, test_f1: 0.4825
 epoch: 27, train_loss: 0.9762, test_loss: 0.9954, test_f1: 0.4850
 epoch: 28, train_loss: 0.9656, test_loss: 1.0016, test_f1: 0.4843
 epoch: 29, train_loss: 0.9671, test_loss: 1.0041, test_f1: 0.4884
 epoch: 30, train_loss: 0.9593, test_loss: 1.0027, test_f1: 0.4796
 epoch: 31, train_loss: 0.9557, test_loss: 0.9960, test_f1: 0.4815
 epoch: 32, train_loss: 0.9497, test_loss: 0.9800, test_f1: 0.4886
 epoch: 33, train_loss: 0.9479, test_loss: 0.9824, test_f1: 0.4970
 epoch: 34, train_loss: 0.9495, test_loss: 0.9802, test_f1: 0.5032
 epoch: 35, train_loss: 0.9410, test_loss: 0.9922, test_f1: 0.4939
 epoch: 36, train_loss: 0.9467, test_loss: 1.0327, test_f1: 0.4708
 epoch: 37, train_loss: 0.9324, test_loss: 0.9854, test_f1: 0.4905
 epoch: 38, train_loss: 0.9324, test_loss: 0.9778, test_f1: 0.5027
 epoch: 39, train_loss: 0.9272, test_loss: 0.9667, test_f1: 0.5145
 epoch: 40, train_loss: 0.9227, test_loss: 0.9585, test_f1: 0.5102
 epoch: 41, train_loss: 0.9239, test_loss: 0.9611, test_f1: 0.4963
 epoch: 42, train_loss: 0.9225, test_loss: 0.9692, test_f1: 0.5186
 epoch: 43, train_loss: 0.9123, test_loss: 0.9823, test_f1: 0.5047
 epoch: 44, train_loss: 0.9117, test_loss: 0.9741, test_f1: 0.5009
 epoch: 45, train_loss: 0.9043, test_loss: 0.9596, test_f1: 0.5213
 epoch: 46, train_loss: 0.9146, test_loss: 0.9721, test_f1: 0.5182
 epoch: 47, train_loss: 0.9086, test_loss: 0.9624, test_f1: 0.5129
 epoch: 48, train_loss: 0.8981, test_loss: 0.9508, test_f1: 0.5278
 epoch: 49, train_loss: 0.9042, test_loss: 0.9497, test_f1: 0.5186
 epoch: 50, train_loss: 0.9004, test_loss: 0.9621, test_f1: 0.5210
 epoch: 51, train_loss: 0.8893, test_loss: 0.9615, test_f1: 0.5219
 epoch: 52, train_loss: 0.8922, test_loss: 0.9559, test_f1: 0.5152
 epoch: 53, train_loss: 0.8881, test_loss: 0.9596, test_f1: 0.5211
 epoch: 54, train_loss: 0.8824, test_loss: 0.9506, test_f1: 0.5202
 epoch: 55, train_loss: 0.8904, test_loss: 0.9607, test_f1: 0.5175
 epoch: 56, train_loss: 0.8842, test_loss: 0.9579, test_f1: 0.5156
 epoch: 57, train_loss: 0.8932, test_loss: 0.9544, test_f1: 0.5120
 epoch: 58, train_loss: 0.8894, test_loss: 0.9550, test_f1: 0.5203
 epoch: 59, train_loss: 0.8875, test_loss: 0.9490, test_f1: 0.5174
 epoch: 60, train_loss: 0.8834, test_loss: 0.9516, test_f1: 0.5228
 epoch: 61, train_loss: 0.8824, test_loss: 0.9445, test_f1: 0.5182
 epoch: 62, train_loss: 0.8774, test_loss: 0.9437, test_f1: 0.5186
 epoch: 63, train_loss: 0.8755, test_loss: 0.9427, test_f1: 0.5197
 epoch: 64, train_loss: 0.8859, test_loss: 0.9519, test_f1: 0.5258
 epoch: 65, train_loss: 0.8791, test_loss: 0.9604, test_f1: 0.5246
 epoch: 66, train_loss: 0.8717, test_loss: 0.9493, test_f1: 0.5235
 epoch: 67, train_loss: 0.8747, test_loss: 0.9513, test_f1: 0.5218
 epoch: 68, train_loss: 0.8721, test_loss: 0.9629, test_f1: 0.5228
 epoch: 69, train_loss: 0.8687, test_loss: 0.9495, test_f1: 0.5251
 epoch: 70, train_loss: 0.8756, test_loss: 0.9529, test_f1: 0.5233
 epoch: 71, train_loss: 0.8655, test_loss: 0.9529, test_f1: 0.5261
 epoch: 72, train_loss: 0.8766, test_loss: 0.9571, test_f1: 0.5282
 epoch: 73, train_loss: 0.8727, test_loss: 0.9467, test_f1: 0.5253
 epoch: 74, train_loss: 0.8703, test_loss: 0.9507, test_f1: 0.5254
 epoch: 75, train_loss: 0.8675, test_loss: 0.9473, test_f1: 0.5242
 epoch: 76, train_loss: 0.8582, test_loss: 0.9494, test_f1: 0.5219
 epoch: 77, train_loss: 0.8708, test_loss: 0.9433, test_f1: 0.5182
 epoch: 78, train_loss: 0.8674, test_loss: 0.9397, test_f1: 0.5234
 epoch: 79, train_loss: 0.8559, test_loss: 0.9475, test_f1: 0.5184
 epoch: 80, train_loss: 0.8718, test_loss: 0.9399, test_f1: 0.5247
 epoch: 81, train_loss: 0.8638, test_loss: 0.9443, test_f1: 0.5197
 epoch: 82, train_loss: 0.8695, test_loss: 0.9411, test_f1: 0.5244
 epoch: 83, train_loss: 0.8668, test_loss: 0.9463, test_f1: 0.5257
 epoch: 84, train_loss: 0.8578, test_loss: 0.9417, test_f1: 0.5227
 epoch: 85, train_loss: 0.8607, test_loss: 0.9413, test_f1: 0.5196
 epoch: 86, train_loss: 0.8527, test_loss: 0.9398, test_f1: 0.5245
 epoch: 87, train_loss: 0.8563, test_loss: 0.9276, test_f1: 0.5251
 epoch: 88, train_loss: 0.8600, test_loss: 0.9381, test_f1: 0.5232
 epoch: 89, train_loss: 0.8606, test_loss: 0.9409, test_f1: 0.5255
 epoch: 90, train_loss: 0.8505, test_loss: 0.9450, test_f1: 0.5274
 epoch: 91, train_loss: 0.8524, test_loss: 0.9547, test_f1: 0.5281
 epoch: 92, train_loss: 0.8583, test_loss: 0.9384, test_f1: 0.5252
 epoch: 93, train_loss: 0.8508, test_loss: 0.9419, test_f1: 0.5213
 epoch: 94, train_loss: 0.8519, test_loss: 0.9398, test_f1: 0.5261
 epoch: 95, train_loss: 0.8490, test_loss: 0.9382, test_f1: 0.5286
 epoch: 96, train_loss: 0.8534, test_loss: 0.9398, test_f1: 0.5242
 epoch: 97, train_loss: 0.8445, test_loss: 0.9318, test_f1: 0.5207
 epoch: 98, train_loss: 0.8472, test_loss: 0.9422, test_f1: 0.5237
 epoch: 99, train_loss: 0.8438, test_loss: 0.9341, test_f1: 0.5228
##################ITERATION #5 ****************************************
 epoch: 0, train_loss: 1.2425, test_loss: 1.3571, test_f1: 0.2270
 epoch: 1, train_loss: 1.1767, test_loss: 1.2693, test_f1: 0.3136
 epoch: 2, train_loss: 1.1497, test_loss: 1.1258, test_f1: 0.3422
 epoch: 3, train_loss: 1.1273, test_loss: 1.0830, test_f1: 0.3464
 epoch: 4, train_loss: 1.1151, test_loss: 1.0709, test_f1: 0.3545
 epoch: 5, train_loss: 1.0920, test_loss: 1.0604, test_f1: 0.3568
 epoch: 6, train_loss: 1.0787, test_loss: 1.0523, test_f1: 0.3752
 epoch: 7, train_loss: 1.0703, test_loss: 1.0392, test_f1: 0.3964
 epoch: 8, train_loss: 1.0606, test_loss: 1.0413, test_f1: 0.4105
 epoch: 9, train_loss: 1.0520, test_loss: 1.0325, test_f1: 0.4287
 epoch: 10, train_loss: 1.0372, test_loss: 1.0271, test_f1: 0.4332
 epoch: 11, train_loss: 1.0287, test_loss: 1.0118, test_f1: 0.4403
 epoch: 12, train_loss: 1.0304, test_loss: 1.0119, test_f1: 0.4480
 epoch: 13, train_loss: 1.0144, test_loss: 1.0006, test_f1: 0.4630
 epoch: 14, train_loss: 1.0093, test_loss: 1.0002, test_f1: 0.4674
 epoch: 15, train_loss: 0.9999, test_loss: 0.9926, test_f1: 0.4720
 epoch: 16, train_loss: 0.9984, test_loss: 0.9824, test_f1: 0.4817
 epoch: 17, train_loss: 0.9918, test_loss: 0.9855, test_f1: 0.4765
 epoch: 18, train_loss: 0.9865, test_loss: 0.9714, test_f1: 0.4848
 epoch: 19, train_loss: 0.9823, test_loss: 0.9580, test_f1: 0.4922
 epoch: 20, train_loss: 0.9719, test_loss: 0.9568, test_f1: 0.4892
 epoch: 21, train_loss: 0.9667, test_loss: 0.9560, test_f1: 0.4932
 epoch: 22, train_loss: 0.9641, test_loss: 0.9600, test_f1: 0.4887
 epoch: 23, train_loss: 0.9586, test_loss: 0.9501, test_f1: 0.4918
 epoch: 24, train_loss: 0.9646, test_loss: 0.9521, test_f1: 0.5019
 epoch: 25, train_loss: 0.9470, test_loss: 0.9476, test_f1: 0.5049
 epoch: 26, train_loss: 0.9498, test_loss: 0.9361, test_f1: 0.5028
 epoch: 27, train_loss: 0.9373, test_loss: 0.9425, test_f1: 0.5058
 epoch: 28, train_loss: 0.9269, test_loss: 0.9323, test_f1: 0.5094
 epoch: 29, train_loss: 0.9362, test_loss: 0.9435, test_f1: 0.5035
 epoch: 30, train_loss: 0.9301, test_loss: 0.9243, test_f1: 0.5106
 epoch: 31, train_loss: 0.9244, test_loss: 0.9407, test_f1: 0.5101
 epoch: 32, train_loss: 0.9163, test_loss: 0.9402, test_f1: 0.5011
 epoch: 33, train_loss: 0.9094, test_loss: 0.9343, test_f1: 0.5097
 epoch: 34, train_loss: 0.9166, test_loss: 0.9435, test_f1: 0.5112
 epoch: 35, train_loss: 0.9156, test_loss: 0.9307, test_f1: 0.5174
 epoch: 36, train_loss: 0.9057, test_loss: 0.9478, test_f1: 0.5062
 epoch: 37, train_loss: 0.9004, test_loss: 0.9249, test_f1: 0.5082
 epoch: 38, train_loss: 0.9045, test_loss: 0.9491, test_f1: 0.5321
 epoch: 39, train_loss: 0.8992, test_loss: 0.9522, test_f1: 0.5235
 epoch: 40, train_loss: 0.8930, test_loss: 0.9248, test_f1: 0.5250
 epoch: 41, train_loss: 0.8931, test_loss: 0.9460, test_f1: 0.5157
 epoch: 42, train_loss: 0.8854, test_loss: 0.9503, test_f1: 0.5153
 epoch: 43, train_loss: 0.8866, test_loss: 0.9243, test_f1: 0.5338
 epoch: 44, train_loss: 0.8844, test_loss: 0.9489, test_f1: 0.5294
 epoch: 45, train_loss: 0.8764, test_loss: 0.9218, test_f1: 0.5351
 epoch: 46, train_loss: 0.8811, test_loss: 0.9387, test_f1: 0.5384
 epoch: 47, train_loss: 0.8737, test_loss: 0.9262, test_f1: 0.5382
 epoch: 48, train_loss: 0.8726, test_loss: 0.9195, test_f1: 0.5303
 epoch: 49, train_loss: 0.8705, test_loss: 0.9793, test_f1: 0.5356
 epoch: 50, train_loss: 0.8687, test_loss: 0.8993, test_f1: 0.5304
 epoch: 51, train_loss: 0.8580, test_loss: 0.9327, test_f1: 0.5368
 epoch: 52, train_loss: 0.8586, test_loss: 0.9294, test_f1: 0.5341
 epoch: 53, train_loss: 0.8566, test_loss: 0.9471, test_f1: 0.5306
 epoch: 54, train_loss: 0.8617, test_loss: 0.9296, test_f1: 0.5399
 epoch: 55, train_loss: 0.8581, test_loss: 0.9377, test_f1: 0.5375
 epoch: 56, train_loss: 0.8508, test_loss: 0.9305, test_f1: 0.5329
 epoch: 57, train_loss: 0.8529, test_loss: 0.9393, test_f1: 0.5437
 epoch: 58, train_loss: 0.8492, test_loss: 0.9419, test_f1: 0.5444
 epoch: 59, train_loss: 0.8555, test_loss: 0.9430, test_f1: 0.5385
 epoch: 60, train_loss: 0.8557, test_loss: 0.9393, test_f1: 0.5371
 epoch: 61, train_loss: 0.8484, test_loss: 0.9317, test_f1: 0.5437
 epoch: 62, train_loss: 0.8389, test_loss: 0.9410, test_f1: 0.5331
 epoch: 63, train_loss: 0.8486, test_loss: 0.9378, test_f1: 0.5344
 epoch: 64, train_loss: 0.8464, test_loss: 0.9447, test_f1: 0.5322
 epoch: 65, train_loss: 0.8437, test_loss: 0.9471, test_f1: 0.5475
 epoch: 66, train_loss: 0.8504, test_loss: 0.9497, test_f1: 0.5395
 epoch: 67, train_loss: 0.8414, test_loss: 0.9450, test_f1: 0.5401
 epoch: 68, train_loss: 0.8406, test_loss: 0.9492, test_f1: 0.5424
 epoch: 69, train_loss: 0.8357, test_loss: 0.9479, test_f1: 0.5376
 epoch: 70, train_loss: 0.8390, test_loss: 0.9173, test_f1: 0.5380
 epoch: 71, train_loss: 0.8302, test_loss: 0.9384, test_f1: 0.5389
 epoch: 72, train_loss: 0.8330, test_loss: 0.9428, test_f1: 0.5488
 epoch: 73, train_loss: 0.8325, test_loss: 0.9424, test_f1: 0.5328
 epoch: 74, train_loss: 0.8348, test_loss: 0.9265, test_f1: 0.5344
 epoch: 75, train_loss: 0.8324, test_loss: 0.9673, test_f1: 0.5408
 epoch: 76, train_loss: 0.8350, test_loss: 0.9442, test_f1: 0.5376
 epoch: 77, train_loss: 0.8333, test_loss: 0.9403, test_f1: 0.5410
 epoch: 78, train_loss: 0.8207, test_loss: 0.9444, test_f1: 0.5435
 epoch: 79, train_loss: 0.8316, test_loss: 0.9497, test_f1: 0.5411
 epoch: 80, train_loss: 0.8286, test_loss: 0.9400, test_f1: 0.5457
 epoch: 81, train_loss: 0.8274, test_loss: 0.9485, test_f1: 0.5401
 epoch: 82, train_loss: 0.8273, test_loss: 0.9416, test_f1: 0.5346
 epoch: 83, train_loss: 0.8256, test_loss: 0.9573, test_f1: 0.5442
 epoch: 84, train_loss: 0.8297, test_loss: 0.9558, test_f1: 0.5468
 epoch: 85, train_loss: 0.8274, test_loss: 0.9554, test_f1: 0.5506
 epoch: 86, train_loss: 0.8145, test_loss: 0.9374, test_f1: 0.5432
 epoch: 87, train_loss: 0.8198, test_loss: 0.9521, test_f1: 0.5342
 epoch: 88, train_loss: 0.8177, test_loss: 0.9629, test_f1: 0.5394
 epoch: 89, train_loss: 0.8143, test_loss: 0.9276, test_f1: 0.5374
 epoch: 90, train_loss: 0.8169, test_loss: 0.9496, test_f1: 0.5377
 epoch: 91, train_loss: 0.8249, test_loss: 0.9213, test_f1: 0.5362
 epoch: 92, train_loss: 0.8136, test_loss: 0.9626, test_f1: 0.5455
 epoch: 93, train_loss: 0.8078, test_loss: 0.9246, test_f1: 0.5368
 epoch: 94, train_loss: 0.8126, test_loss: 0.9376, test_f1: 0.5389
 epoch: 95, train_loss: 0.8068, test_loss: 0.9611, test_f1: 0.5423
 epoch: 96, train_loss: 0.8072, test_loss: 0.9508, test_f1: 0.5481
 epoch: 97, train_loss: 0.8066, test_loss: 0.9469, test_f1: 0.5519
 epoch: 98, train_loss: 0.8011, test_loss: 0.9426, test_f1: 0.5436
 epoch: 99, train_loss: 0.8122, test_loss: 0.9533, test_f1: 0.5447
##################ITERATION #6 ****************************************
 epoch: 0, train_loss: 1.2991, test_loss: 1.3245, test_f1: 0.2270
 epoch: 1, train_loss: 1.2302, test_loss: 1.2406, test_f1: 0.3268
 epoch: 2, train_loss: 1.1926, test_loss: 1.1764, test_f1: 0.3560
 epoch: 3, train_loss: 1.1750, test_loss: 1.1436, test_f1: 0.3604
 epoch: 4, train_loss: 1.1435, test_loss: 1.1186, test_f1: 0.3752
 epoch: 5, train_loss: 1.1251, test_loss: 1.1067, test_f1: 0.3840
 epoch: 6, train_loss: 1.1095, test_loss: 1.0891, test_f1: 0.3970
 epoch: 7, train_loss: 1.0971, test_loss: 1.0754, test_f1: 0.4145
 epoch: 8, train_loss: 1.0770, test_loss: 1.0672, test_f1: 0.4297
 epoch: 9, train_loss: 1.0626, test_loss: 1.0534, test_f1: 0.4406
 epoch: 10, train_loss: 1.0584, test_loss: 1.0507, test_f1: 0.4477
 epoch: 11, train_loss: 1.0418, test_loss: 1.0381, test_f1: 0.4493
 epoch: 12, train_loss: 1.0345, test_loss: 1.0375, test_f1: 0.4589
 epoch: 13, train_loss: 1.0314, test_loss: 1.0459, test_f1: 0.4678
 epoch: 14, train_loss: 1.0202, test_loss: 1.0214, test_f1: 0.4660
 epoch: 15, train_loss: 1.0128, test_loss: 1.0133, test_f1: 0.4607
 epoch: 16, train_loss: 1.0075, test_loss: 0.9954, test_f1: 0.4775
 epoch: 17, train_loss: 1.0048, test_loss: 0.9991, test_f1: 0.4739
 epoch: 18, train_loss: 0.9817, test_loss: 0.9896, test_f1: 0.4672
 epoch: 19, train_loss: 0.9910, test_loss: 0.9945, test_f1: 0.4649
 epoch: 20, train_loss: 0.9823, test_loss: 0.9668, test_f1: 0.4641
 epoch: 21, train_loss: 0.9691, test_loss: 0.9656, test_f1: 0.4805
 epoch: 22, train_loss: 0.9692, test_loss: 0.9676, test_f1: 0.4794
 epoch: 23, train_loss: 0.9701, test_loss: 0.9749, test_f1: 0.4744
 epoch: 24, train_loss: 0.9630, test_loss: 0.9572, test_f1: 0.4772
 epoch: 25, train_loss: 0.9477, test_loss: 0.9586, test_f1: 0.4734
 epoch: 26, train_loss: 0.9454, test_loss: 0.9630, test_f1: 0.4717
 epoch: 27, train_loss: 0.9479, test_loss: 0.9479, test_f1: 0.4861
 epoch: 28, train_loss: 0.9306, test_loss: 0.9687, test_f1: 0.4817
 epoch: 29, train_loss: 0.9409, test_loss: 0.9264, test_f1: 0.5162
 epoch: 30, train_loss: 0.9362, test_loss: 0.9310, test_f1: 0.5114
 epoch: 31, train_loss: 0.9298, test_loss: 0.9576, test_f1: 0.5058
 epoch: 32, train_loss: 0.9347, test_loss: 0.9223, test_f1: 0.5037
 epoch: 33, train_loss: 0.9214, test_loss: 0.9136, test_f1: 0.5147
 epoch: 34, train_loss: 0.9312, test_loss: 0.9109, test_f1: 0.5240
 epoch: 35, train_loss: 0.9245, test_loss: 0.9161, test_f1: 0.5217
 epoch: 36, train_loss: 0.9186, test_loss: 0.9355, test_f1: 0.5082
 epoch: 37, train_loss: 0.9086, test_loss: 0.9073, test_f1: 0.5291
 epoch: 38, train_loss: 0.9211, test_loss: 0.9086, test_f1: 0.5306
 epoch: 39, train_loss: 0.9170, test_loss: 0.9024, test_f1: 0.5320
 epoch: 40, train_loss: 0.9034, test_loss: 0.9019, test_f1: 0.5257
 epoch: 41, train_loss: 0.9097, test_loss: 0.9166, test_f1: 0.5230
 epoch: 42, train_loss: 0.9016, test_loss: 0.8972, test_f1: 0.5372
 epoch: 43, train_loss: 0.9005, test_loss: 0.8918, test_f1: 0.5304
 epoch: 44, train_loss: 0.8901, test_loss: 0.8958, test_f1: 0.5359
 epoch: 45, train_loss: 0.8989, test_loss: 0.8806, test_f1: 0.5361
 epoch: 46, train_loss: 0.8869, test_loss: 0.8858, test_f1: 0.5356
 epoch: 47, train_loss: 0.8932, test_loss: 0.8864, test_f1: 0.5278
 epoch: 48, train_loss: 0.8884, test_loss: 0.8774, test_f1: 0.5455
 epoch: 49, train_loss: 0.8855, test_loss: 0.8792, test_f1: 0.5400
 epoch: 50, train_loss: 0.8879, test_loss: 0.9107, test_f1: 0.5269
 epoch: 51, train_loss: 0.8743, test_loss: 0.8877, test_f1: 0.5398
 epoch: 52, train_loss: 0.8752, test_loss: 0.8770, test_f1: 0.5449
 epoch: 53, train_loss: 0.8787, test_loss: 0.8777, test_f1: 0.5402
 epoch: 54, train_loss: 0.8637, test_loss: 0.8665, test_f1: 0.5437
 epoch: 55, train_loss: 0.8705, test_loss: 0.8764, test_f1: 0.5504
 epoch: 56, train_loss: 0.8630, test_loss: 0.8745, test_f1: 0.5489
 epoch: 57, train_loss: 0.8659, test_loss: 0.8760, test_f1: 0.5457
 epoch: 58, train_loss: 0.8659, test_loss: 0.8646, test_f1: 0.5476
 epoch: 59, train_loss: 0.8788, test_loss: 0.8631, test_f1: 0.5547
 epoch: 60, train_loss: 0.8621, test_loss: 0.8648, test_f1: 0.5450
 epoch: 61, train_loss: 0.8659, test_loss: 0.8598, test_f1: 0.5510
 epoch: 62, train_loss: 0.8647, test_loss: 0.8638, test_f1: 0.5491
 epoch: 63, train_loss: 0.8581, test_loss: 0.8667, test_f1: 0.5464
 epoch: 64, train_loss: 0.8637, test_loss: 0.8644, test_f1: 0.5540
 epoch: 65, train_loss: 0.8626, test_loss: 0.8751, test_f1: 0.5500
 epoch: 66, train_loss: 0.8623, test_loss: 0.8629, test_f1: 0.5498
 epoch: 67, train_loss: 0.8636, test_loss: 0.8651, test_f1: 0.5486
 epoch: 68, train_loss: 0.8619, test_loss: 0.8607, test_f1: 0.5518
 epoch: 69, train_loss: 0.8591, test_loss: 0.8581, test_f1: 0.5501
 epoch: 70, train_loss: 0.8543, test_loss: 0.8615, test_f1: 0.5556
 epoch: 71, train_loss: 0.8543, test_loss: 0.8511, test_f1: 0.5539
 epoch: 72, train_loss: 0.8522, test_loss: 0.8574, test_f1: 0.5519
 epoch: 73, train_loss: 0.8521, test_loss: 0.8609, test_f1: 0.5560
 epoch: 74, train_loss: 0.8503, test_loss: 0.8633, test_f1: 0.5524
 epoch: 75, train_loss: 0.8518, test_loss: 0.8525, test_f1: 0.5542
 epoch: 76, train_loss: 0.8504, test_loss: 0.8568, test_f1: 0.5546
 epoch: 77, train_loss: 0.8483, test_loss: 0.8539, test_f1: 0.5519
 epoch: 78, train_loss: 0.8490, test_loss: 0.8545, test_f1: 0.5529
 epoch: 79, train_loss: 0.8473, test_loss: 0.8582, test_f1: 0.5552
 epoch: 80, train_loss: 0.8445, test_loss: 0.8605, test_f1: 0.5562
 epoch: 81, train_loss: 0.8425, test_loss: 0.8617, test_f1: 0.5511
 epoch: 82, train_loss: 0.8533, test_loss: 0.8577, test_f1: 0.5552
 epoch: 83, train_loss: 0.8372, test_loss: 0.8467, test_f1: 0.5543
 epoch: 84, train_loss: 0.8434, test_loss: 0.8540, test_f1: 0.5524
 epoch: 85, train_loss: 0.8422, test_loss: 0.8532, test_f1: 0.5542
 epoch: 86, train_loss: 0.8344, test_loss: 0.8606, test_f1: 0.5600
 epoch: 87, train_loss: 0.8422, test_loss: 0.8637, test_f1: 0.5495
 epoch: 88, train_loss: 0.8367, test_loss: 0.8597, test_f1: 0.5557
 epoch: 89, train_loss: 0.8384, test_loss: 0.8636, test_f1: 0.5547
 epoch: 90, train_loss: 0.8422, test_loss: 0.8584, test_f1: 0.5502
 epoch: 91, train_loss: 0.8272, test_loss: 0.8546, test_f1: 0.5566
 epoch: 92, train_loss: 0.8295, test_loss: 0.8622, test_f1: 0.5547
 epoch: 93, train_loss: 0.8345, test_loss: 0.8540, test_f1: 0.5593
 epoch: 94, train_loss: 0.8446, test_loss: 0.8559, test_f1: 0.5564
 epoch: 95, train_loss: 0.8311, test_loss: 0.8656, test_f1: 0.5414
 epoch: 96, train_loss: 0.8169, test_loss: 0.8586, test_f1: 0.5496
 epoch: 97, train_loss: 0.8275, test_loss: 0.8548, test_f1: 0.5502
 epoch: 98, train_loss: 0.8329, test_loss: 0.8639, test_f1: 0.5489
 epoch: 99, train_loss: 0.8232, test_loss: 0.8545, test_f1: 0.5531
##################ITERATION #7 ****************************************
 epoch: 0, train_loss: 1.2768, test_loss: 1.3084, test_f1: 0.2270
 epoch: 1, train_loss: 1.1858, test_loss: 1.2353, test_f1: 0.2416
 epoch: 2, train_loss: 1.1588, test_loss: 1.1317, test_f1: 0.3494
 epoch: 3, train_loss: 1.1395, test_loss: 1.0996, test_f1: 0.3515
 epoch: 4, train_loss: 1.1153, test_loss: 1.0893, test_f1: 0.3643
 epoch: 5, train_loss: 1.1010, test_loss: 1.0769, test_f1: 0.3733
 epoch: 6, train_loss: 1.0746, test_loss: 1.0642, test_f1: 0.3893
 epoch: 7, train_loss: 1.0704, test_loss: 1.0613, test_f1: 0.3954
 epoch: 8, train_loss: 1.0510, test_loss: 1.0559, test_f1: 0.4046
 epoch: 9, train_loss: 1.0426, test_loss: 1.0443, test_f1: 0.4214
 epoch: 10, train_loss: 1.0367, test_loss: 1.0411, test_f1: 0.4253
 epoch: 11, train_loss: 1.0290, test_loss: 1.0442, test_f1: 0.4293
 epoch: 12, train_loss: 1.0160, test_loss: 1.0374, test_f1: 0.4425
 epoch: 13, train_loss: 1.0068, test_loss: 1.0243, test_f1: 0.4651
 epoch: 14, train_loss: 0.9939, test_loss: 1.0244, test_f1: 0.4595
 epoch: 15, train_loss: 0.9954, test_loss: 1.0224, test_f1: 0.4558
 epoch: 16, train_loss: 0.9884, test_loss: 1.0074, test_f1: 0.4731
 epoch: 17, train_loss: 0.9823, test_loss: 1.0036, test_f1: 0.4710
 epoch: 18, train_loss: 0.9818, test_loss: 1.0023, test_f1: 0.4572
 epoch: 19, train_loss: 0.9686, test_loss: 0.9946, test_f1: 0.4724
 epoch: 20, train_loss: 0.9711, test_loss: 0.9952, test_f1: 0.4696
 epoch: 21, train_loss: 0.9627, test_loss: 1.0010, test_f1: 0.4651
 epoch: 22, train_loss: 0.9563, test_loss: 0.9839, test_f1: 0.4862
 epoch: 23, train_loss: 0.9585, test_loss: 0.9746, test_f1: 0.4807
 epoch: 24, train_loss: 0.9503, test_loss: 0.9801, test_f1: 0.4880
 epoch: 25, train_loss: 0.9378, test_loss: 0.9701, test_f1: 0.4958
 epoch: 26, train_loss: 0.9454, test_loss: 0.9617, test_f1: 0.5011
 epoch: 27, train_loss: 0.9371, test_loss: 0.9524, test_f1: 0.4962
 epoch: 28, train_loss: 0.9318, test_loss: 0.9486, test_f1: 0.4988
 epoch: 29, train_loss: 0.9224, test_loss: 0.9685, test_f1: 0.4886
 epoch: 30, train_loss: 0.9230, test_loss: 0.9516, test_f1: 0.5103
 epoch: 31, train_loss: 0.9119, test_loss: 0.9450, test_f1: 0.5001
 epoch: 32, train_loss: 0.9152, test_loss: 0.9431, test_f1: 0.5050
 epoch: 33, train_loss: 0.9175, test_loss: 0.9390, test_f1: 0.4956
 epoch: 34, train_loss: 0.9125, test_loss: 0.9466, test_f1: 0.5112
 epoch: 35, train_loss: 0.9071, test_loss: 0.9395, test_f1: 0.5123
 epoch: 36, train_loss: 0.9059, test_loss: 0.9329, test_f1: 0.5152
 epoch: 37, train_loss: 0.9053, test_loss: 0.9292, test_f1: 0.5127
 epoch: 38, train_loss: 0.9066, test_loss: 0.9171, test_f1: 0.5196
 epoch: 39, train_loss: 0.8924, test_loss: 0.9232, test_f1: 0.5125
 epoch: 40, train_loss: 0.8978, test_loss: 0.9196, test_f1: 0.5182
 epoch: 41, train_loss: 0.8893, test_loss: 0.9102, test_f1: 0.5174
 epoch: 42, train_loss: 0.8938, test_loss: 0.9080, test_f1: 0.5201
 epoch: 43, train_loss: 0.8894, test_loss: 0.9103, test_f1: 0.5209
 epoch: 44, train_loss: 0.8857, test_loss: 0.8946, test_f1: 0.5232
 epoch: 45, train_loss: 0.8793, test_loss: 0.8845, test_f1: 0.5369
 epoch: 46, train_loss: 0.8788, test_loss: 0.8855, test_f1: 0.5407
 epoch: 47, train_loss: 0.8797, test_loss: 0.9043, test_f1: 0.5237
 epoch: 48, train_loss: 0.8794, test_loss: 0.9135, test_f1: 0.5104
 epoch: 49, train_loss: 0.8633, test_loss: 0.9087, test_f1: 0.5153
 epoch: 50, train_loss: 0.8682, test_loss: 0.8849, test_f1: 0.5244
 epoch: 51, train_loss: 0.8670, test_loss: 0.8913, test_f1: 0.5250
 epoch: 52, train_loss: 0.8722, test_loss: 0.8945, test_f1: 0.5120
 epoch: 53, train_loss: 0.8658, test_loss: 0.8925, test_f1: 0.5261
 epoch: 54, train_loss: 0.8517, test_loss: 0.8977, test_f1: 0.5239
 epoch: 55, train_loss: 0.8615, test_loss: 0.9070, test_f1: 0.5272
 epoch: 56, train_loss: 0.8577, test_loss: 0.9020, test_f1: 0.5246
 epoch: 57, train_loss: 0.8565, test_loss: 0.8978, test_f1: 0.5200
 epoch: 58, train_loss: 0.8693, test_loss: 0.8826, test_f1: 0.5235
 epoch: 59, train_loss: 0.8534, test_loss: 0.9036, test_f1: 0.5129
 epoch: 60, train_loss: 0.8665, test_loss: 0.9044, test_f1: 0.5150
 epoch: 61, train_loss: 0.8647, test_loss: 0.9016, test_f1: 0.5146
 epoch: 62, train_loss: 0.8462, test_loss: 0.8898, test_f1: 0.5245
 epoch: 63, train_loss: 0.8546, test_loss: 0.8854, test_f1: 0.5137
 epoch: 64, train_loss: 0.8509, test_loss: 0.8783, test_f1: 0.5219
 epoch: 65, train_loss: 0.8511, test_loss: 0.8740, test_f1: 0.5294
 epoch: 66, train_loss: 0.8497, test_loss: 0.8924, test_f1: 0.5190
 epoch: 67, train_loss: 0.8448, test_loss: 0.8932, test_f1: 0.5248
 epoch: 68, train_loss: 0.8563, test_loss: 0.8887, test_f1: 0.5235
 epoch: 69, train_loss: 0.8530, test_loss: 0.8994, test_f1: 0.5179
 epoch: 70, train_loss: 0.8460, test_loss: 0.9040, test_f1: 0.5202
 epoch: 71, train_loss: 0.8441, test_loss: 0.8922, test_f1: 0.5095
 epoch: 72, train_loss: 0.8484, test_loss: 0.8803, test_f1: 0.5232
 epoch: 73, train_loss: 0.8407, test_loss: 0.8925, test_f1: 0.5181
 epoch: 74, train_loss: 0.8441, test_loss: 0.8890, test_f1: 0.5160
 epoch: 75, train_loss: 0.8453, test_loss: 0.8936, test_f1: 0.5177
 epoch: 76, train_loss: 0.8400, test_loss: 0.8956, test_f1: 0.5128
 epoch: 77, train_loss: 0.8428, test_loss: 0.9125, test_f1: 0.5102
 epoch: 78, train_loss: 0.8385, test_loss: 0.9013, test_f1: 0.5122
 epoch: 79, train_loss: 0.8341, test_loss: 0.9033, test_f1: 0.5184
 epoch: 80, train_loss: 0.8342, test_loss: 0.8979, test_f1: 0.5109
 epoch: 81, train_loss: 0.8358, test_loss: 0.8868, test_f1: 0.5087
 epoch: 82, train_loss: 0.8375, test_loss: 0.9049, test_f1: 0.5149
 epoch: 83, train_loss: 0.8322, test_loss: 0.9071, test_f1: 0.5195
 epoch: 84, train_loss: 0.8385, test_loss: 0.9025, test_f1: 0.5171
 epoch: 85, train_loss: 0.8351, test_loss: 0.8894, test_f1: 0.5137
 epoch: 86, train_loss: 0.8378, test_loss: 0.8815, test_f1: 0.5155
 epoch: 87, train_loss: 0.8296, test_loss: 0.8857, test_f1: 0.5136
 epoch: 88, train_loss: 0.8257, test_loss: 0.8981, test_f1: 0.5185
 epoch: 89, train_loss: 0.8291, test_loss: 0.8894, test_f1: 0.5117
 epoch: 90, train_loss: 0.8343, test_loss: 0.8996, test_f1: 0.5265
 epoch: 91, train_loss: 0.8335, test_loss: 0.9330, test_f1: 0.5230
 epoch: 92, train_loss: 0.8292, test_loss: 0.9281, test_f1: 0.5203
 epoch: 93, train_loss: 0.8283, test_loss: 0.9121, test_f1: 0.5073
 epoch: 94, train_loss: 0.8292, test_loss: 0.9007, test_f1: 0.5116
 epoch: 95, train_loss: 0.8297, test_loss: 0.9165, test_f1: 0.5132
 epoch: 96, train_loss: 0.8212, test_loss: 0.8984, test_f1: 0.5045
 epoch: 97, train_loss: 0.8229, test_loss: 0.9252, test_f1: 0.5145
 epoch: 98, train_loss: 0.8190, test_loss: 0.9155, test_f1: 0.5136
 epoch: 99, train_loss: 0.8225, test_loss: 0.9120, test_f1: 0.5278
##################ITERATION #8 ****************************************
 epoch: 0, train_loss: 1.3522, test_loss: 1.3539, test_f1: 0.2270
 epoch: 1, train_loss: 1.2455, test_loss: 1.2642, test_f1: 0.2270
 epoch: 2, train_loss: 1.2104, test_loss: 1.1610, test_f1: 0.3189
 epoch: 3, train_loss: 1.1728, test_loss: 1.1209, test_f1: 0.3744
 epoch: 4, train_loss: 1.1499, test_loss: 1.0958, test_f1: 0.3762
 epoch: 5, train_loss: 1.1306, test_loss: 1.0760, test_f1: 0.3996
 epoch: 6, train_loss: 1.1124, test_loss: 1.0672, test_f1: 0.3879
 epoch: 7, train_loss: 1.0916, test_loss: 1.0580, test_f1: 0.4007
 epoch: 8, train_loss: 1.0833, test_loss: 1.0388, test_f1: 0.4234
 epoch: 9, train_loss: 1.0605, test_loss: 1.0333, test_f1: 0.4244
 epoch: 10, train_loss: 1.0507, test_loss: 1.0274, test_f1: 0.4460
 epoch: 11, train_loss: 1.0428, test_loss: 1.0188, test_f1: 0.4524
 epoch: 12, train_loss: 1.0292, test_loss: 1.0146, test_f1: 0.4485
 epoch: 13, train_loss: 1.0209, test_loss: 1.0105, test_f1: 0.4452
 epoch: 14, train_loss: 1.0198, test_loss: 1.0065, test_f1: 0.4599
 epoch: 15, train_loss: 1.0048, test_loss: 1.0022, test_f1: 0.4650
 epoch: 16, train_loss: 1.0029, test_loss: 0.9956, test_f1: 0.4629
 epoch: 17, train_loss: 0.9985, test_loss: 1.0006, test_f1: 0.4727
 epoch: 18, train_loss: 0.9992, test_loss: 0.9880, test_f1: 0.4767
 epoch: 19, train_loss: 0.9809, test_loss: 0.9860, test_f1: 0.4708
 epoch: 20, train_loss: 0.9887, test_loss: 0.9789, test_f1: 0.4908
 epoch: 21, train_loss: 0.9824, test_loss: 0.9806, test_f1: 0.4947
 epoch: 22, train_loss: 0.9829, test_loss: 0.9798, test_f1: 0.4996
 epoch: 23, train_loss: 0.9721, test_loss: 0.9777, test_f1: 0.4899
 epoch: 24, train_loss: 0.9671, test_loss: 0.9680, test_f1: 0.4977
 epoch: 25, train_loss: 0.9605, test_loss: 0.9712, test_f1: 0.4992
 epoch: 26, train_loss: 0.9605, test_loss: 0.9675, test_f1: 0.4900
 epoch: 27, train_loss: 0.9594, test_loss: 0.9583, test_f1: 0.4971
 epoch: 28, train_loss: 0.9455, test_loss: 0.9586, test_f1: 0.5035
 epoch: 29, train_loss: 0.9566, test_loss: 0.9585, test_f1: 0.4962
 epoch: 30, train_loss: 0.9532, test_loss: 0.9573, test_f1: 0.5070
 epoch: 31, train_loss: 0.9435, test_loss: 0.9600, test_f1: 0.5009
 epoch: 32, train_loss: 0.9417, test_loss: 0.9480, test_f1: 0.5028
 epoch: 33, train_loss: 0.9321, test_loss: 0.9377, test_f1: 0.5137
 epoch: 34, train_loss: 0.9386, test_loss: 0.9419, test_f1: 0.5100
 epoch: 35, train_loss: 0.9292, test_loss: 0.9440, test_f1: 0.5158
 epoch: 36, train_loss: 0.9351, test_loss: 0.9415, test_f1: 0.5198
 epoch: 37, train_loss: 0.9314, test_loss: 0.9314, test_f1: 0.5151
 epoch: 38, train_loss: 0.9224, test_loss: 0.9403, test_f1: 0.5131
 epoch: 39, train_loss: 0.9223, test_loss: 0.9329, test_f1: 0.5199
 epoch: 40, train_loss: 0.9199, test_loss: 0.9340, test_f1: 0.5201
 epoch: 41, train_loss: 0.9166, test_loss: 0.9277, test_f1: 0.5218
 epoch: 42, train_loss: 0.9134, test_loss: 0.9242, test_f1: 0.5271
 epoch: 43, train_loss: 0.9098, test_loss: 0.9233, test_f1: 0.5228
 epoch: 44, train_loss: 0.9094, test_loss: 0.9333, test_f1: 0.5208
 epoch: 45, train_loss: 0.9074, test_loss: 0.9240, test_f1: 0.5168
 epoch: 46, train_loss: 0.9025, test_loss: 0.9279, test_f1: 0.5196
 epoch: 47, train_loss: 0.9050, test_loss: 0.9202, test_f1: 0.5142
 epoch: 48, train_loss: 0.8985, test_loss: 0.9182, test_f1: 0.5246
 epoch: 49, train_loss: 0.9000, test_loss: 0.9210, test_f1: 0.5190
 epoch: 50, train_loss: 0.8988, test_loss: 0.9202, test_f1: 0.5219
 epoch: 51, train_loss: 0.9003, test_loss: 0.9097, test_f1: 0.5245
 epoch: 52, train_loss: 0.8987, test_loss: 0.9093, test_f1: 0.5217
 epoch: 53, train_loss: 0.8824, test_loss: 0.9163, test_f1: 0.5261
 epoch: 54, train_loss: 0.8935, test_loss: 0.9051, test_f1: 0.5295
 epoch: 55, train_loss: 0.8869, test_loss: 0.9054, test_f1: 0.5243
 epoch: 56, train_loss: 0.8836, test_loss: 0.9154, test_f1: 0.5281
 epoch: 57, train_loss: 0.8828, test_loss: 0.9062, test_f1: 0.5251
 epoch: 58, train_loss: 0.8898, test_loss: 0.9118, test_f1: 0.5259
 epoch: 59, train_loss: 0.8841, test_loss: 0.9153, test_f1: 0.5274
 epoch: 60, train_loss: 0.8862, test_loss: 0.9113, test_f1: 0.5272
 epoch: 61, train_loss: 0.8759, test_loss: 0.9126, test_f1: 0.5285
 epoch: 62, train_loss: 0.8848, test_loss: 0.9102, test_f1: 0.5274
 epoch: 63, train_loss: 0.8763, test_loss: 0.9120, test_f1: 0.5331
 epoch: 64, train_loss: 0.8723, test_loss: 0.9137, test_f1: 0.5268
 epoch: 65, train_loss: 0.8720, test_loss: 0.9044, test_f1: 0.5281
 epoch: 66, train_loss: 0.8721, test_loss: 0.9092, test_f1: 0.5311
 epoch: 67, train_loss: 0.8794, test_loss: 0.9022, test_f1: 0.5291
 epoch: 68, train_loss: 0.8688, test_loss: 0.9025, test_f1: 0.5307
 epoch: 69, train_loss: 0.8753, test_loss: 0.9019, test_f1: 0.5317
 epoch: 70, train_loss: 0.8690, test_loss: 0.9058, test_f1: 0.5340
 epoch: 71, train_loss: 0.8683, test_loss: 0.9128, test_f1: 0.5374
 epoch: 72, train_loss: 0.8682, test_loss: 0.9034, test_f1: 0.5353
 epoch: 73, train_loss: 0.8627, test_loss: 0.8884, test_f1: 0.5352
 epoch: 74, train_loss: 0.8692, test_loss: 0.9037, test_f1: 0.5298
 epoch: 75, train_loss: 0.8700, test_loss: 0.9009, test_f1: 0.5353
 epoch: 76, train_loss: 0.8604, test_loss: 0.8942, test_f1: 0.5322
 epoch: 77, train_loss: 0.8608, test_loss: 0.8906, test_f1: 0.5400
 epoch: 78, train_loss: 0.8617, test_loss: 0.9025, test_f1: 0.5406
 epoch: 79, train_loss: 0.8533, test_loss: 0.9062, test_f1: 0.5384
 epoch: 80, train_loss: 0.8616, test_loss: 0.9011, test_f1: 0.5393
 epoch: 81, train_loss: 0.8578, test_loss: 0.8906, test_f1: 0.5341
 epoch: 82, train_loss: 0.8563, test_loss: 0.8870, test_f1: 0.5321
 epoch: 83, train_loss: 0.8616, test_loss: 0.8904, test_f1: 0.5369
 epoch: 84, train_loss: 0.8487, test_loss: 0.8854, test_f1: 0.5414
 epoch: 85, train_loss: 0.8559, test_loss: 0.8786, test_f1: 0.5419
 epoch: 86, train_loss: 0.8535, test_loss: 0.8875, test_f1: 0.5419
 epoch: 87, train_loss: 0.8544, test_loss: 0.8882, test_f1: 0.5329
 epoch: 88, train_loss: 0.8573, test_loss: 0.8916, test_f1: 0.5388
 epoch: 89, train_loss: 0.8537, test_loss: 0.8916, test_f1: 0.5373
 epoch: 90, train_loss: 0.8570, test_loss: 0.8964, test_f1: 0.5378
 epoch: 91, train_loss: 0.8472, test_loss: 0.8941, test_f1: 0.5407
 epoch: 92, train_loss: 0.8488, test_loss: 0.8874, test_f1: 0.5382
 epoch: 93, train_loss: 0.8533, test_loss: 0.8776, test_f1: 0.5380
 epoch: 94, train_loss: 0.8422, test_loss: 0.8773, test_f1: 0.5383
 epoch: 95, train_loss: 0.8495, test_loss: 0.8693, test_f1: 0.5377
 epoch: 96, train_loss: 0.8397, test_loss: 0.8538, test_f1: 0.5614
 epoch: 97, train_loss: 0.8429, test_loss: 0.8780, test_f1: 0.5407
 epoch: 98, train_loss: 0.8372, test_loss: 0.8843, test_f1: 0.5429
 epoch: 99, train_loss: 0.8372, test_loss: 0.8895, test_f1: 0.5440
##################ITERATION #9 ****************************************
 epoch: 0, train_loss: 1.3413, test_loss: 1.3955, test_f1: 0.2270
 epoch: 1, train_loss: 1.2116, test_loss: 1.2155, test_f1: 0.2270
 epoch: 2, train_loss: 1.1696, test_loss: 1.0951, test_f1: 0.3561
 epoch: 3, train_loss: 1.1405, test_loss: 1.0596, test_f1: 0.3810
 epoch: 4, train_loss: 1.1177, test_loss: 1.0419, test_f1: 0.4018
 epoch: 5, train_loss: 1.0946, test_loss: 1.0264, test_f1: 0.4212
 epoch: 6, train_loss: 1.0830, test_loss: 1.0113, test_f1: 0.4364
 epoch: 7, train_loss: 1.0583, test_loss: 1.0025, test_f1: 0.4492
 epoch: 8, train_loss: 1.0520, test_loss: 0.9980, test_f1: 0.4565
 epoch: 9, train_loss: 1.0450, test_loss: 0.9912, test_f1: 0.4542
 epoch: 10, train_loss: 1.0320, test_loss: 0.9866, test_f1: 0.4578
 epoch: 11, train_loss: 1.0217, test_loss: 0.9793, test_f1: 0.4465
 epoch: 12, train_loss: 1.0138, test_loss: 0.9710, test_f1: 0.4753
 epoch: 13, train_loss: 1.0068, test_loss: 0.9685, test_f1: 0.4661
 epoch: 14, train_loss: 0.9997, test_loss: 0.9619, test_f1: 0.4839
 epoch: 15, train_loss: 0.9863, test_loss: 0.9570, test_f1: 0.4892
 epoch: 16, train_loss: 0.9854, test_loss: 0.9515, test_f1: 0.4831
 epoch: 17, train_loss: 0.9847, test_loss: 0.9472, test_f1: 0.4921
 epoch: 18, train_loss: 0.9772, test_loss: 0.9441, test_f1: 0.4964
 epoch: 19, train_loss: 0.9725, test_loss: 0.9382, test_f1: 0.4907
 epoch: 20, train_loss: 0.9694, test_loss: 0.9374, test_f1: 0.4811
 epoch: 21, train_loss: 0.9654, test_loss: 0.9365, test_f1: 0.4831
 epoch: 22, train_loss: 0.9620, test_loss: 0.9292, test_f1: 0.4893
 epoch: 23, train_loss: 0.9561, test_loss: 0.9243, test_f1: 0.5054
 epoch: 24, train_loss: 0.9561, test_loss: 0.9207, test_f1: 0.5101
 epoch: 25, train_loss: 0.9494, test_loss: 0.9260, test_f1: 0.4872
 epoch: 26, train_loss: 0.9481, test_loss: 0.9246, test_f1: 0.4914
 epoch: 27, train_loss: 0.9529, test_loss: 0.9268, test_f1: 0.4857
 epoch: 28, train_loss: 0.9423, test_loss: 0.9174, test_f1: 0.4984
 epoch: 29, train_loss: 0.9359, test_loss: 0.9106, test_f1: 0.4994
 epoch: 30, train_loss: 0.9433, test_loss: 0.9265, test_f1: 0.4970
 epoch: 31, train_loss: 0.9268, test_loss: 0.9032, test_f1: 0.5073
 epoch: 32, train_loss: 0.9301, test_loss: 0.9109, test_f1: 0.4931
 epoch: 33, train_loss: 0.9244, test_loss: 0.8936, test_f1: 0.5141
 epoch: 34, train_loss: 0.9231, test_loss: 0.8997, test_f1: 0.5136
 epoch: 35, train_loss: 0.9242, test_loss: 0.9116, test_f1: 0.5117
 epoch: 36, train_loss: 0.9106, test_loss: 0.8942, test_f1: 0.5249
 epoch: 37, train_loss: 0.9177, test_loss: 0.8964, test_f1: 0.5140
 epoch: 38, train_loss: 0.9203, test_loss: 0.8972, test_f1: 0.5239
 epoch: 39, train_loss: 0.9063, test_loss: 0.8976, test_f1: 0.5080
 epoch: 40, train_loss: 0.9097, test_loss: 0.8938, test_f1: 0.5158
 epoch: 41, train_loss: 0.8999, test_loss: 0.8816, test_f1: 0.5241
 epoch: 42, train_loss: 0.8993, test_loss: 0.8932, test_f1: 0.5205
 epoch: 43, train_loss: 0.9003, test_loss: 0.8944, test_f1: 0.5185
 epoch: 44, train_loss: 0.8999, test_loss: 0.8844, test_f1: 0.5320
 epoch: 45, train_loss: 0.8995, test_loss: 0.8916, test_f1: 0.5203
 epoch: 46, train_loss: 0.8970, test_loss: 0.8790, test_f1: 0.5336
 epoch: 47, train_loss: 0.8874, test_loss: 0.8763, test_f1: 0.5273
 epoch: 48, train_loss: 0.8867, test_loss: 0.9016, test_f1: 0.5229
 epoch: 49, train_loss: 0.8801, test_loss: 0.8869, test_f1: 0.5149
 epoch: 50, train_loss: 0.8813, test_loss: 0.8902, test_f1: 0.5214
 epoch: 51, train_loss: 0.8771, test_loss: 0.8797, test_f1: 0.5192
 epoch: 52, train_loss: 0.8844, test_loss: 0.8927, test_f1: 0.5307
 epoch: 53, train_loss: 0.8745, test_loss: 0.8832, test_f1: 0.5182
 epoch: 54, train_loss: 0.8671, test_loss: 0.8790, test_f1: 0.5236
 epoch: 55, train_loss: 0.8729, test_loss: 0.8861, test_f1: 0.5183
 epoch: 56, train_loss: 0.8722, test_loss: 0.8875, test_f1: 0.5227
 epoch: 57, train_loss: 0.8667, test_loss: 0.8725, test_f1: 0.5186
 epoch: 58, train_loss: 0.8645, test_loss: 0.8853, test_f1: 0.5216
 epoch: 59, train_loss: 0.8623, test_loss: 0.8861, test_f1: 0.5181
 epoch: 60, train_loss: 0.8597, test_loss: 0.8659, test_f1: 0.5241
 epoch: 61, train_loss: 0.8656, test_loss: 0.8835, test_f1: 0.5184
 epoch: 62, train_loss: 0.8554, test_loss: 0.8678, test_f1: 0.5234
 epoch: 63, train_loss: 0.8589, test_loss: 0.8758, test_f1: 0.5220
 epoch: 64, train_loss: 0.8673, test_loss: 0.8660, test_f1: 0.5280
 epoch: 65, train_loss: 0.8531, test_loss: 0.8743, test_f1: 0.5250
 epoch: 66, train_loss: 0.8448, test_loss: 0.8786, test_f1: 0.5321
 epoch: 67, train_loss: 0.8601, test_loss: 0.8656, test_f1: 0.5274
 epoch: 68, train_loss: 0.8481, test_loss: 0.8668, test_f1: 0.5282
 epoch: 69, train_loss: 0.8532, test_loss: 0.8834, test_f1: 0.5314
 epoch: 70, train_loss: 0.8496, test_loss: 0.8848, test_f1: 0.5293
 epoch: 71, train_loss: 0.8464, test_loss: 0.8930, test_f1: 0.5341
 epoch: 72, train_loss: 0.8490, test_loss: 0.8703, test_f1: 0.5271
 epoch: 73, train_loss: 0.8497, test_loss: 0.8737, test_f1: 0.5324
 epoch: 74, train_loss: 0.8456, test_loss: 0.8572, test_f1: 0.5306
 epoch: 75, train_loss: 0.8416, test_loss: 0.8550, test_f1: 0.5299
 epoch: 76, train_loss: 0.8531, test_loss: 0.8833, test_f1: 0.5248
 epoch: 77, train_loss: 0.8523, test_loss: 0.8718, test_f1: 0.5299
 epoch: 78, train_loss: 0.8466, test_loss: 0.8636, test_f1: 0.5344
 epoch: 79, train_loss: 0.8504, test_loss: 0.8594, test_f1: 0.5338
 epoch: 80, train_loss: 0.8432, test_loss: 0.8578, test_f1: 0.5292
 epoch: 81, train_loss: 0.8318, test_loss: 0.8747, test_f1: 0.5318
 epoch: 82, train_loss: 0.8383, test_loss: 0.8776, test_f1: 0.5391
 epoch: 83, train_loss: 0.8323, test_loss: 0.8695, test_f1: 0.5398
 epoch: 84, train_loss: 0.8369, test_loss: 0.8779, test_f1: 0.5382
 epoch: 85, train_loss: 0.8498, test_loss: 0.8727, test_f1: 0.5312
 epoch: 86, train_loss: 0.8343, test_loss: 0.8571, test_f1: 0.5350
 epoch: 87, train_loss: 0.8302, test_loss: 0.8825, test_f1: 0.5385
 epoch: 88, train_loss: 0.8307, test_loss: 0.8616, test_f1: 0.5245
 epoch: 89, train_loss: 0.8330, test_loss: 0.8745, test_f1: 0.5336
 epoch: 90, train_loss: 0.8337, test_loss: 0.8505, test_f1: 0.5422
 epoch: 91, train_loss: 0.8298, test_loss: 0.8425, test_f1: 0.5385
 epoch: 92, train_loss: 0.8167, test_loss: 0.8426, test_f1: 0.5439
 epoch: 93, train_loss: 0.8249, test_loss: 0.8596, test_f1: 0.5373
 epoch: 94, train_loss: 0.8346, test_loss: 0.8545, test_f1: 0.5304
 epoch: 95, train_loss: 0.8124, test_loss: 0.8391, test_f1: 0.5443
 epoch: 96, train_loss: 0.8251, test_loss: 0.8511, test_f1: 0.5422
 epoch: 97, train_loss: 0.8184, test_loss: 0.8420, test_f1: 0.5385
 epoch: 98, train_loss: 0.8264, test_loss: 0.8545, test_f1: 0.5388
 epoch: 99, train_loss: 0.8172, test_loss: 0.8471, test_f1: 0.5405

Training completed in 583.89 seconds
Best F1: 0.5614 at epoch 96
Mean F1 across iterations: 0.5425  0.0135
========================FINAL RESULTS================================
FEGIN weighted F1: 0.5614  0.0135
python main.py --data ltspice_examples --representation component_pin_net --model FEGIN --layers 6 --hiddens 32 --batch_size 128 --lr 0.0001 --emb_size 128 --epochs 100 --save_appendix component_pin_net_L6_H32_BS128_LR0.0001_E128 --no_val
-----



STDERR:
  File "main.py", line 370, in <module>
    main()
  File "main.py", line 254, in main
    dataset = dataset_class(
  File "/home/philip/projects/ltspice_examples_code_repo/Circuit-Completion-Using-GNNs/component_classification_with_link_prediction_head/evaluation/FEGIN/kernel/circuit_datasets.py", line 15, in __init__
    self.data, self.slices = torch.load(self.processed_paths[0])
  File "/home/philip/.local/lib/python3.8/site-packages/torch/serialization.py", line 1040, in load
    warnings.warn(
  File "/usr/lib/python3.8/warnings.py", line 109, in _showwarnmsg
    sw(msg.message, msg.category, msg.filename, msg.lineno,
  File "main.py", line 47, in warn_with_traceback
    traceback.print_stack(file=log)
/home/philip/projects/ltspice_examples_code_repo/Circuit-Completion-Using-GNNs/component_classification_with_link_prediction_head/evaluation/FEGIN/kernel/circuit_datasets.py:15: FutureWarning: You are using `torch.load` with `weights_only=False` (the current default value), which uses the default pickle module implicitly. It is possible to construct malicious pickle data which will execute arbitrary code during unpickling (See https://github.com/pytorch/pytorch/blob/main/SECURITY.md#untrusted-models for more details). In a future release, the default value for `weights_only` will be flipped to `True`. This limits the functions that could be executed during unpickling. Arbitrary objects will no longer be allowed to be loaded via this mode unless they are explicitly allowlisted by the user via `torch.serialization.add_safe_globals`. We recommend you start setting `weights_only=True` for any use case where you don't have full control of the loaded file. Please open an issue on GitHub for any issues related to this experimental feature.
  self.data, self.slices = torch.load(self.processed_paths[0])
