STDOUT:
Results will be saved in /home/philip/projects/ltspice_examples_code_repo/Circuit-Completion-Using-GNNs/component_classification_with_link_prediction_head/evaluation/FEGIN/results/model_FEGIN_dataset_ltspice_examples
Command line input: python main.py --data ltspice_examples --representation component_net --model FEGIN --layers 3 --hiddens 32 --batch_size 64 --lr 0.001 --emb_size 128 --epochs 100 --save_appendix component_net_L3_H32_BS64_LR0.001_E128 --no_val
 is saved.
-----
ltspice_examples - FEGIN
Using 3 layers, 32 hidden units, h = 2
Loading component_net representation dataset
ENTERED
Training FEGIN on component_net representation
Train: 3558, Test: 846
##################ITERATION #0 ****************************************
 epoch: 0, train_loss: 1.3121, test_loss: 1.2353, test_f1: 0.2405
 epoch: 1, train_loss: 1.1895, test_loss: 1.1255, test_f1: 0.3678
 epoch: 2, train_loss: 1.1161, test_loss: 1.0429, test_f1: 0.4456
 epoch: 3, train_loss: 1.0660, test_loss: 0.9989, test_f1: 0.4645
 epoch: 4, train_loss: 1.0104, test_loss: 0.9818, test_f1: 0.4804
 epoch: 5, train_loss: 0.9857, test_loss: 0.9529, test_f1: 0.5015
 epoch: 6, train_loss: 0.9706, test_loss: 1.0266, test_f1: 0.4435
 epoch: 7, train_loss: 0.9557, test_loss: 0.9353, test_f1: 0.5088
 epoch: 8, train_loss: 0.9358, test_loss: 0.9531, test_f1: 0.5021
 epoch: 9, train_loss: 0.9255, test_loss: 0.9310, test_f1: 0.5168
 epoch: 10, train_loss: 0.9223, test_loss: 0.9607, test_f1: 0.4925
 epoch: 11, train_loss: 0.9171, test_loss: 0.9429, test_f1: 0.4988
 epoch: 12, train_loss: 0.9001, test_loss: 0.9358, test_f1: 0.5072
 epoch: 13, train_loss: 0.8931, test_loss: 0.9751, test_f1: 0.4944
 epoch: 14, train_loss: 0.8887, test_loss: 0.9237, test_f1: 0.5214
 epoch: 15, train_loss: 0.8742, test_loss: 0.9970, test_f1: 0.5016
 epoch: 16, train_loss: 0.8641, test_loss: 0.9343, test_f1: 0.5275
 epoch: 17, train_loss: 0.8691, test_loss: 0.9126, test_f1: 0.5229
 epoch: 18, train_loss: 0.8565, test_loss: 0.9232, test_f1: 0.5300
 epoch: 19, train_loss: 0.8489, test_loss: 1.0441, test_f1: 0.5033
 epoch: 20, train_loss: 0.8506, test_loss: 0.9490, test_f1: 0.5468
 epoch: 21, train_loss: 0.8458, test_loss: 0.9468, test_f1: 0.5717
 epoch: 22, train_loss: 0.8249, test_loss: 0.8983, test_f1: 0.5907
 epoch: 23, train_loss: 0.8441, test_loss: 0.9203, test_f1: 0.5892
 epoch: 24, train_loss: 0.8152, test_loss: 0.9383, test_f1: 0.5718
 epoch: 25, train_loss: 0.8125, test_loss: 1.0245, test_f1: 0.4983
 epoch: 26, train_loss: 0.8115, test_loss: 0.9619, test_f1: 0.5778
 epoch: 27, train_loss: 0.8015, test_loss: 0.9624, test_f1: 0.5715
 epoch: 28, train_loss: 0.8008, test_loss: 0.9662, test_f1: 0.5717
 epoch: 29, train_loss: 0.8004, test_loss: 0.9728, test_f1: 0.5362
 epoch: 30, train_loss: 0.8054, test_loss: 0.9602, test_f1: 0.5782
 epoch: 31, train_loss: 0.7915, test_loss: 1.0244, test_f1: 0.5551
 epoch: 32, train_loss: 0.7822, test_loss: 0.9796, test_f1: 0.6028
 epoch: 33, train_loss: 0.7823, test_loss: 0.9995, test_f1: 0.5426
 epoch: 34, train_loss: 0.7825, test_loss: 0.9362, test_f1: 0.5338
 epoch: 35, train_loss: 0.7830, test_loss: 0.9356, test_f1: 0.5643
 epoch: 36, train_loss: 0.7730, test_loss: 0.9460, test_f1: 0.5586
 epoch: 37, train_loss: 0.7852, test_loss: 1.0075, test_f1: 0.5341
 epoch: 38, train_loss: 0.7639, test_loss: 0.9852, test_f1: 0.5678
 epoch: 39, train_loss: 0.7679, test_loss: 0.9975, test_f1: 0.5740
 epoch: 40, train_loss: 0.7629, test_loss: 1.0074, test_f1: 0.5580
 epoch: 41, train_loss: 0.7436, test_loss: 1.0220, test_f1: 0.5690
 epoch: 42, train_loss: 0.7399, test_loss: 1.0603, test_f1: 0.5297
 epoch: 43, train_loss: 0.7368, test_loss: 0.9889, test_f1: 0.6032
 epoch: 44, train_loss: 0.7470, test_loss: 1.0067, test_f1: 0.5600
 epoch: 45, train_loss: 0.7239, test_loss: 0.9739, test_f1: 0.5593
 epoch: 46, train_loss: 0.7426, test_loss: 0.9984, test_f1: 0.6014
 epoch: 47, train_loss: 0.7322, test_loss: 0.9815, test_f1: 0.6085
 epoch: 48, train_loss: 0.7340, test_loss: 0.9854, test_f1: 0.5766
 epoch: 49, train_loss: 0.7189, test_loss: 0.9223, test_f1: 0.5988
 epoch: 50, train_loss: 0.7312, test_loss: 1.0021, test_f1: 0.6039
 epoch: 51, train_loss: 0.7039, test_loss: 0.9901, test_f1: 0.5941
 epoch: 52, train_loss: 0.6894, test_loss: 0.9618, test_f1: 0.6317
 epoch: 53, train_loss: 0.6820, test_loss: 0.9880, test_f1: 0.5926
 epoch: 54, train_loss: 0.6772, test_loss: 0.9946, test_f1: 0.5836
 epoch: 55, train_loss: 0.6832, test_loss: 0.9799, test_f1: 0.6184
 epoch: 56, train_loss: 0.6839, test_loss: 0.9769, test_f1: 0.6156
 epoch: 57, train_loss: 0.6809, test_loss: 1.0134, test_f1: 0.6180
 epoch: 58, train_loss: 0.6766, test_loss: 0.9745, test_f1: 0.6147
 epoch: 59, train_loss: 0.6861, test_loss: 1.0057, test_f1: 0.5945
 epoch: 60, train_loss: 0.6696, test_loss: 0.9828, test_f1: 0.6106
 epoch: 61, train_loss: 0.6694, test_loss: 1.0012, test_f1: 0.6099
 epoch: 62, train_loss: 0.6531, test_loss: 0.9464, test_f1: 0.6227
 epoch: 63, train_loss: 0.6523, test_loss: 0.9708, test_f1: 0.6396
 epoch: 64, train_loss: 0.6721, test_loss: 0.9566, test_f1: 0.6276
 epoch: 65, train_loss: 0.6637, test_loss: 0.9511, test_f1: 0.6344
 epoch: 66, train_loss: 0.6643, test_loss: 1.1123, test_f1: 0.6147
 epoch: 67, train_loss: 0.6576, test_loss: 0.9335, test_f1: 0.5978
 epoch: 68, train_loss: 0.6485, test_loss: 0.9801, test_f1: 0.6389
 epoch: 69, train_loss: 0.6488, test_loss: 0.9835, test_f1: 0.6431
 epoch: 70, train_loss: 0.6423, test_loss: 0.9944, test_f1: 0.6261
 epoch: 71, train_loss: 0.6556, test_loss: 0.9092, test_f1: 0.6273
 epoch: 72, train_loss: 0.6377, test_loss: 0.9710, test_f1: 0.6330
 epoch: 73, train_loss: 0.6344, test_loss: 0.9652, test_f1: 0.6292
 epoch: 74, train_loss: 0.6475, test_loss: 0.9496, test_f1: 0.6429
 epoch: 75, train_loss: 0.6312, test_loss: 0.9946, test_f1: 0.6328
 epoch: 76, train_loss: 0.6415, test_loss: 0.9810, test_f1: 0.6314
 epoch: 77, train_loss: 0.6310, test_loss: 0.9696, test_f1: 0.6425
 epoch: 78, train_loss: 0.6208, test_loss: 1.0028, test_f1: 0.6097
 epoch: 79, train_loss: 0.6268, test_loss: 1.0075, test_f1: 0.6258
 epoch: 80, train_loss: 0.6173, test_loss: 1.0016, test_f1: 0.6288
 epoch: 81, train_loss: 0.6172, test_loss: 0.9928, test_f1: 0.6170
 epoch: 82, train_loss: 0.6511, test_loss: 1.0064, test_f1: 0.6322
 epoch: 83, train_loss: 0.6196, test_loss: 1.0070, test_f1: 0.6390
 epoch: 84, train_loss: 0.6243, test_loss: 0.9615, test_f1: 0.6404
 epoch: 85, train_loss: 0.6078, test_loss: 1.0316, test_f1: 0.6424
 epoch: 86, train_loss: 0.6176, test_loss: 1.0156, test_f1: 0.6296
 epoch: 87, train_loss: 0.6113, test_loss: 1.0100, test_f1: 0.6312
 epoch: 88, train_loss: 0.6252, test_loss: 0.9679, test_f1: 0.6325
 epoch: 89, train_loss: 0.6179, test_loss: 1.0759, test_f1: 0.6107
 epoch: 90, train_loss: 0.6012, test_loss: 0.9484, test_f1: 0.6495
 epoch: 91, train_loss: 0.6192, test_loss: 0.9586, test_f1: 0.6681
 epoch: 92, train_loss: 0.5954, test_loss: 0.9751, test_f1: 0.6533
 epoch: 93, train_loss: 0.5833, test_loss: 1.0083, test_f1: 0.6611
 epoch: 94, train_loss: 0.6032, test_loss: 0.9621, test_f1: 0.6405
 epoch: 95, train_loss: 0.5869, test_loss: 0.9725, test_f1: 0.6481
 epoch: 96, train_loss: 0.6037, test_loss: 0.9782, test_f1: 0.6495
 epoch: 97, train_loss: 0.5977, test_loss: 1.0315, test_f1: 0.6281
 epoch: 98, train_loss: 0.5679, test_loss: 1.0096, test_f1: 0.6379
 epoch: 99, train_loss: 0.6027, test_loss: 1.0007, test_f1: 0.6417
##################ITERATION #1 ****************************************
 epoch: 0, train_loss: 1.2099, test_loss: 1.1640, test_f1: 0.3667
 epoch: 1, train_loss: 1.0749, test_loss: 0.9965, test_f1: 0.4734
 epoch: 2, train_loss: 1.0241, test_loss: 0.9619, test_f1: 0.4830
 epoch: 3, train_loss: 0.9880, test_loss: 0.9663, test_f1: 0.4802
 epoch: 4, train_loss: 0.9665, test_loss: 0.9255, test_f1: 0.5122
 epoch: 5, train_loss: 0.9558, test_loss: 0.9517, test_f1: 0.4838
 epoch: 6, train_loss: 0.9473, test_loss: 0.9357, test_f1: 0.5205
 epoch: 7, train_loss: 0.9323, test_loss: 0.9475, test_f1: 0.5011
 epoch: 8, train_loss: 0.9204, test_loss: 0.9245, test_f1: 0.5070
 epoch: 9, train_loss: 0.9219, test_loss: 0.9075, test_f1: 0.5184
 epoch: 10, train_loss: 0.9060, test_loss: 0.9173, test_f1: 0.5219
 epoch: 11, train_loss: 0.9042, test_loss: 0.9606, test_f1: 0.5087
 epoch: 12, train_loss: 0.8944, test_loss: 0.9574, test_f1: 0.5174
 epoch: 13, train_loss: 0.8816, test_loss: 0.9621, test_f1: 0.5219
 epoch: 14, train_loss: 0.8784, test_loss: 0.9258, test_f1: 0.5303
 epoch: 15, train_loss: 0.8763, test_loss: 0.9314, test_f1: 0.5134
 epoch: 16, train_loss: 0.8695, test_loss: 0.9714, test_f1: 0.5242
 epoch: 17, train_loss: 0.8614, test_loss: 0.9272, test_f1: 0.5289
 epoch: 18, train_loss: 0.8610, test_loss: 1.0113, test_f1: 0.5193
 epoch: 19, train_loss: 0.8500, test_loss: 0.8898, test_f1: 0.5294
 epoch: 20, train_loss: 0.8441, test_loss: 0.9618, test_f1: 0.5514
 epoch: 21, train_loss: 0.8511, test_loss: 0.9676, test_f1: 0.5507
 epoch: 22, train_loss: 0.8465, test_loss: 0.9265, test_f1: 0.5749
 epoch: 23, train_loss: 0.8348, test_loss: 0.9404, test_f1: 0.5330
 epoch: 24, train_loss: 0.8299, test_loss: 0.9197, test_f1: 0.5720
 epoch: 25, train_loss: 0.8285, test_loss: 1.0058, test_f1: 0.5277
 epoch: 26, train_loss: 0.8311, test_loss: 0.9912, test_f1: 0.5409
 epoch: 27, train_loss: 0.8086, test_loss: 0.9321, test_f1: 0.5457
 epoch: 28, train_loss: 0.8192, test_loss: 0.9101, test_f1: 0.5450
 epoch: 29, train_loss: 0.8293, test_loss: 1.0359, test_f1: 0.5410
 epoch: 30, train_loss: 0.8207, test_loss: 1.0119, test_f1: 0.5392
 epoch: 31, train_loss: 0.8141, test_loss: 1.0000, test_f1: 0.5518
 epoch: 32, train_loss: 0.7919, test_loss: 1.0484, test_f1: 0.5242
 epoch: 33, train_loss: 0.8120, test_loss: 0.9631, test_f1: 0.5578
 epoch: 34, train_loss: 0.7803, test_loss: 0.9686, test_f1: 0.5772
 epoch: 35, train_loss: 0.7890, test_loss: 0.9629, test_f1: 0.5524
 epoch: 36, train_loss: 0.7877, test_loss: 0.9372, test_f1: 0.5751
 epoch: 37, train_loss: 0.7772, test_loss: 0.9303, test_f1: 0.5534
 epoch: 38, train_loss: 0.7743, test_loss: 1.0293, test_f1: 0.5407
 epoch: 39, train_loss: 0.7786, test_loss: 0.9051, test_f1: 0.5851
 epoch: 40, train_loss: 0.7701, test_loss: 1.0119, test_f1: 0.5933
 epoch: 41, train_loss: 0.7623, test_loss: 1.0317, test_f1: 0.5716
 epoch: 42, train_loss: 0.7748, test_loss: 0.9506, test_f1: 0.5972
 epoch: 43, train_loss: 0.7612, test_loss: 0.9867, test_f1: 0.5902
 epoch: 44, train_loss: 0.7548, test_loss: 0.9877, test_f1: 0.5989
 epoch: 45, train_loss: 0.7556, test_loss: 0.9886, test_f1: 0.5901
 epoch: 46, train_loss: 0.7534, test_loss: 0.9855, test_f1: 0.5934
 epoch: 47, train_loss: 0.7470, test_loss: 1.0459, test_f1: 0.6043
 epoch: 48, train_loss: 0.7420, test_loss: 1.0166, test_f1: 0.5963
 epoch: 49, train_loss: 0.7348, test_loss: 0.9930, test_f1: 0.5940
 epoch: 50, train_loss: 0.7317, test_loss: 1.0018, test_f1: 0.5723
 epoch: 51, train_loss: 0.7245, test_loss: 0.9907, test_f1: 0.6140
 epoch: 52, train_loss: 0.7160, test_loss: 1.0218, test_f1: 0.6182
 epoch: 53, train_loss: 0.7101, test_loss: 0.9743, test_f1: 0.6210
 epoch: 54, train_loss: 0.7093, test_loss: 0.9931, test_f1: 0.6303
 epoch: 55, train_loss: 0.7067, test_loss: 0.9865, test_f1: 0.6165
 epoch: 56, train_loss: 0.7051, test_loss: 1.0001, test_f1: 0.6195
 epoch: 57, train_loss: 0.6998, test_loss: 0.9351, test_f1: 0.6069
 epoch: 58, train_loss: 0.7041, test_loss: 0.9681, test_f1: 0.6239
 epoch: 59, train_loss: 0.7032, test_loss: 0.9822, test_f1: 0.6433
 epoch: 60, train_loss: 0.6894, test_loss: 0.9761, test_f1: 0.6319
 epoch: 61, train_loss: 0.7028, test_loss: 1.0037, test_f1: 0.6226
 epoch: 62, train_loss: 0.6912, test_loss: 0.9734, test_f1: 0.6248
 epoch: 63, train_loss: 0.6796, test_loss: 0.9908, test_f1: 0.6175
 epoch: 64, train_loss: 0.6836, test_loss: 1.0061, test_f1: 0.6473
 epoch: 65, train_loss: 0.6927, test_loss: 1.0167, test_f1: 0.6115
 epoch: 66, train_loss: 0.6992, test_loss: 1.0179, test_f1: 0.6069
 epoch: 67, train_loss: 0.6804, test_loss: 0.9950, test_f1: 0.6157
 epoch: 68, train_loss: 0.6906, test_loss: 1.0349, test_f1: 0.6200
 epoch: 69, train_loss: 0.6921, test_loss: 1.0113, test_f1: 0.6415
 epoch: 70, train_loss: 0.6739, test_loss: 1.0153, test_f1: 0.6223
 epoch: 71, train_loss: 0.6799, test_loss: 0.9974, test_f1: 0.6084
 epoch: 72, train_loss: 0.6707, test_loss: 0.9803, test_f1: 0.6310
 epoch: 73, train_loss: 0.6683, test_loss: 0.9992, test_f1: 0.6142
 epoch: 74, train_loss: 0.6736, test_loss: 0.9684, test_f1: 0.6214
 epoch: 75, train_loss: 0.6680, test_loss: 1.0337, test_f1: 0.6353
 epoch: 76, train_loss: 0.6534, test_loss: 1.0032, test_f1: 0.6253
 epoch: 77, train_loss: 0.6643, test_loss: 0.9985, test_f1: 0.6266
 epoch: 78, train_loss: 0.6629, test_loss: 1.0141, test_f1: 0.6476
 epoch: 79, train_loss: 0.6549, test_loss: 0.9958, test_f1: 0.6253
 epoch: 80, train_loss: 0.6660, test_loss: 0.9664, test_f1: 0.6524
 epoch: 81, train_loss: 0.6618, test_loss: 0.9663, test_f1: 0.6286
 epoch: 82, train_loss: 0.6472, test_loss: 1.0244, test_f1: 0.6199
 epoch: 83, train_loss: 0.6485, test_loss: 1.0654, test_f1: 0.6391
 epoch: 84, train_loss: 0.6703, test_loss: 0.9899, test_f1: 0.6478
 epoch: 85, train_loss: 0.6448, test_loss: 1.0656, test_f1: 0.6225
 epoch: 86, train_loss: 0.6445, test_loss: 1.0605, test_f1: 0.6202
 epoch: 87, train_loss: 0.6544, test_loss: 1.0125, test_f1: 0.6285
 epoch: 88, train_loss: 0.6506, test_loss: 0.9981, test_f1: 0.6239
 epoch: 89, train_loss: 0.6452, test_loss: 0.9642, test_f1: 0.6527
 epoch: 90, train_loss: 0.6476, test_loss: 1.0068, test_f1: 0.6428
 epoch: 91, train_loss: 0.6423, test_loss: 1.0561, test_f1: 0.6345
 epoch: 92, train_loss: 0.6431, test_loss: 0.9913, test_f1: 0.6521
 epoch: 93, train_loss: 0.6331, test_loss: 1.0082, test_f1: 0.6934
 epoch: 94, train_loss: 0.6306, test_loss: 1.0584, test_f1: 0.6475
 epoch: 95, train_loss: 0.6304, test_loss: 1.0619, test_f1: 0.6140
 epoch: 96, train_loss: 0.6351, test_loss: 1.0522, test_f1: 0.6208
 epoch: 97, train_loss: 0.6475, test_loss: 1.0648, test_f1: 0.6537
 epoch: 98, train_loss: 0.6248, test_loss: 1.0500, test_f1: 0.6408
 epoch: 99, train_loss: 0.6170, test_loss: 1.0735, test_f1: 0.6479
##################ITERATION #2 ****************************************
 epoch: 0, train_loss: 1.1866, test_loss: 1.1023, test_f1: 0.4193
 epoch: 1, train_loss: 1.0441, test_loss: 1.0048, test_f1: 0.4604
 epoch: 2, train_loss: 1.0051, test_loss: 0.9776, test_f1: 0.4868
 epoch: 3, train_loss: 0.9691, test_loss: 0.9429, test_f1: 0.4986
 epoch: 4, train_loss: 0.9562, test_loss: 0.9654, test_f1: 0.5551
 epoch: 5, train_loss: 0.9332, test_loss: 0.9063, test_f1: 0.5221
 epoch: 6, train_loss: 0.9250, test_loss: 0.9147, test_f1: 0.5358
 epoch: 7, train_loss: 0.9046, test_loss: 0.9348, test_f1: 0.5122
 epoch: 8, train_loss: 0.8991, test_loss: 0.8751, test_f1: 0.5462
 epoch: 9, train_loss: 0.8854, test_loss: 0.9229, test_f1: 0.5244
 epoch: 10, train_loss: 0.8888, test_loss: 0.8475, test_f1: 0.5466
 epoch: 11, train_loss: 0.8745, test_loss: 0.9230, test_f1: 0.5492
 epoch: 12, train_loss: 0.8653, test_loss: 0.9046, test_f1: 0.5351
 epoch: 13, train_loss: 0.8515, test_loss: 0.9059, test_f1: 0.5603
 epoch: 14, train_loss: 0.8482, test_loss: 0.9247, test_f1: 0.5679
 epoch: 15, train_loss: 0.8472, test_loss: 0.9526, test_f1: 0.5496
 epoch: 16, train_loss: 0.8486, test_loss: 0.8280, test_f1: 0.5449
 epoch: 17, train_loss: 0.8325, test_loss: 0.8918, test_f1: 0.5767
 epoch: 18, train_loss: 0.8296, test_loss: 0.9258, test_f1: 0.5709
 epoch: 19, train_loss: 0.8267, test_loss: 0.9318, test_f1: 0.5480
 epoch: 20, train_loss: 0.8316, test_loss: 0.9117, test_f1: 0.5685
 epoch: 21, train_loss: 0.8088, test_loss: 0.8452, test_f1: 0.5888
 epoch: 22, train_loss: 0.7983, test_loss: 0.8875, test_f1: 0.5764
 epoch: 23, train_loss: 0.8021, test_loss: 0.9094, test_f1: 0.5875
 epoch: 24, train_loss: 0.7992, test_loss: 0.8959, test_f1: 0.5738
 epoch: 25, train_loss: 0.7928, test_loss: 0.9941, test_f1: 0.5543
 epoch: 26, train_loss: 0.7886, test_loss: 0.9464, test_f1: 0.5624
 epoch: 27, train_loss: 0.7653, test_loss: 0.9291, test_f1: 0.5853
 epoch: 28, train_loss: 0.7677, test_loss: 0.9151, test_f1: 0.5717
 epoch: 29, train_loss: 0.7605, test_loss: 1.0250, test_f1: 0.5570
 epoch: 30, train_loss: 0.7613, test_loss: 0.9445, test_f1: 0.5706
 epoch: 31, train_loss: 0.7617, test_loss: 0.9252, test_f1: 0.5938
 epoch: 32, train_loss: 0.7486, test_loss: 0.9531, test_f1: 0.5854
 epoch: 33, train_loss: 0.7559, test_loss: 1.0078, test_f1: 0.5456
 epoch: 34, train_loss: 0.7410, test_loss: 0.9329, test_f1: 0.6006
 epoch: 35, train_loss: 0.7366, test_loss: 0.9544, test_f1: 0.5919
 epoch: 36, train_loss: 0.7275, test_loss: 0.9776, test_f1: 0.5718
 epoch: 37, train_loss: 0.7267, test_loss: 1.0026, test_f1: 0.6037
 epoch: 38, train_loss: 0.7251, test_loss: 0.9797, test_f1: 0.5782
 epoch: 39, train_loss: 0.7412, test_loss: 0.9435, test_f1: 0.5910
 epoch: 40, train_loss: 0.7211, test_loss: 1.0020, test_f1: 0.5425
 epoch: 41, train_loss: 0.7132, test_loss: 0.9486, test_f1: 0.6003
 epoch: 42, train_loss: 0.7228, test_loss: 0.9726, test_f1: 0.5992
 epoch: 43, train_loss: 0.7107, test_loss: 0.9715, test_f1: 0.5937
 epoch: 44, train_loss: 0.6988, test_loss: 1.0105, test_f1: 0.5641
 epoch: 45, train_loss: 0.7162, test_loss: 1.0331, test_f1: 0.6010
 epoch: 46, train_loss: 0.7135, test_loss: 1.0031, test_f1: 0.5333
 epoch: 47, train_loss: 0.7039, test_loss: 0.9172, test_f1: 0.6047
 epoch: 48, train_loss: 0.7054, test_loss: 1.0050, test_f1: 0.5951
 epoch: 49, train_loss: 0.6965, test_loss: 0.9891, test_f1: 0.6176
 epoch: 50, train_loss: 0.6791, test_loss: 0.9798, test_f1: 0.5853
 epoch: 51, train_loss: 0.6678, test_loss: 0.9733, test_f1: 0.6049
 epoch: 52, train_loss: 0.6603, test_loss: 0.9880, test_f1: 0.5691
 epoch: 53, train_loss: 0.6593, test_loss: 1.0336, test_f1: 0.5772
 epoch: 54, train_loss: 0.6630, test_loss: 1.0533, test_f1: 0.5875
 epoch: 55, train_loss: 0.6462, test_loss: 1.0148, test_f1: 0.5996
 epoch: 56, train_loss: 0.6475, test_loss: 0.9875, test_f1: 0.5979
 epoch: 57, train_loss: 0.6354, test_loss: 1.0342, test_f1: 0.6204
 epoch: 58, train_loss: 0.6358, test_loss: 1.0595, test_f1: 0.5927
 epoch: 59, train_loss: 0.6422, test_loss: 1.0805, test_f1: 0.5750
 epoch: 60, train_loss: 0.6250, test_loss: 1.0553, test_f1: 0.5929
 epoch: 61, train_loss: 0.6447, test_loss: 1.0669, test_f1: 0.5985
 epoch: 62, train_loss: 0.6417, test_loss: 1.1056, test_f1: 0.5723
 epoch: 63, train_loss: 0.6320, test_loss: 1.1383, test_f1: 0.5815
 epoch: 64, train_loss: 0.6378, test_loss: 1.0779, test_f1: 0.6035
 epoch: 65, train_loss: 0.6160, test_loss: 1.1405, test_f1: 0.5670
 epoch: 66, train_loss: 0.6071, test_loss: 1.0994, test_f1: 0.6151
 epoch: 67, train_loss: 0.6353, test_loss: 1.1451, test_f1: 0.6095
 epoch: 68, train_loss: 0.6313, test_loss: 1.1006, test_f1: 0.6073
 epoch: 69, train_loss: 0.6313, test_loss: 1.1320, test_f1: 0.6187
 epoch: 70, train_loss: 0.6259, test_loss: 1.1071, test_f1: 0.6147
 epoch: 71, train_loss: 0.6187, test_loss: 1.0478, test_f1: 0.6079
 epoch: 72, train_loss: 0.6112, test_loss: 1.1478, test_f1: 0.5922
 epoch: 73, train_loss: 0.6187, test_loss: 1.0955, test_f1: 0.6195
 epoch: 74, train_loss: 0.6126, test_loss: 1.0962, test_f1: 0.5664
 epoch: 75, train_loss: 0.6053, test_loss: 1.1073, test_f1: 0.5883
 epoch: 76, train_loss: 0.5959, test_loss: 1.1049, test_f1: 0.6018
 epoch: 77, train_loss: 0.5904, test_loss: 1.1305, test_f1: 0.5697
 epoch: 78, train_loss: 0.6085, test_loss: 1.1664, test_f1: 0.5635
 epoch: 79, train_loss: 0.5882, test_loss: 1.1148, test_f1: 0.6054
 epoch: 80, train_loss: 0.5999, test_loss: 1.2364, test_f1: 0.5998
 epoch: 81, train_loss: 0.5880, test_loss: 1.1672, test_f1: 0.5908
 epoch: 82, train_loss: 0.5898, test_loss: 1.1519, test_f1: 0.6342
 epoch: 83, train_loss: 0.5939, test_loss: 1.3145, test_f1: 0.5878
 epoch: 84, train_loss: 0.5773, test_loss: 1.1346, test_f1: 0.6177
 epoch: 85, train_loss: 0.5907, test_loss: 1.2270, test_f1: 0.6128
 epoch: 86, train_loss: 0.5790, test_loss: 1.1350, test_f1: 0.6183
 epoch: 87, train_loss: 0.5872, test_loss: 1.1203, test_f1: 0.6056
 epoch: 88, train_loss: 0.5846, test_loss: 1.2821, test_f1: 0.5760
 epoch: 89, train_loss: 0.5758, test_loss: 1.2311, test_f1: 0.5906
 epoch: 90, train_loss: 0.5730, test_loss: 1.2738, test_f1: 0.6151
 epoch: 91, train_loss: 0.5775, test_loss: 1.1872, test_f1: 0.6126
 epoch: 92, train_loss: 0.5738, test_loss: 1.0852, test_f1: 0.6088
 epoch: 93, train_loss: 0.5883, test_loss: 1.3014, test_f1: 0.6109
 epoch: 94, train_loss: 0.5741, test_loss: 1.1069, test_f1: 0.5895
 epoch: 95, train_loss: 0.5659, test_loss: 1.1576, test_f1: 0.6100
 epoch: 96, train_loss: 0.5813, test_loss: 1.1949, test_f1: 0.6080
 epoch: 97, train_loss: 0.5850, test_loss: 1.0968, test_f1: 0.6135
 epoch: 98, train_loss: 0.5639, test_loss: 1.2017, test_f1: 0.6235
 epoch: 99, train_loss: 0.5624, test_loss: 1.1643, test_f1: 0.6298
##################ITERATION #3 ****************************************
 epoch: 0, train_loss: 1.2399, test_loss: 1.1036, test_f1: 0.4453
 epoch: 1, train_loss: 1.0938, test_loss: 0.9913, test_f1: 0.4591
 epoch: 2, train_loss: 1.0486, test_loss: 0.9809, test_f1: 0.4568
 epoch: 3, train_loss: 1.0026, test_loss: 0.9474, test_f1: 0.4769
 epoch: 4, train_loss: 0.9937, test_loss: 0.9434, test_f1: 0.4822
 epoch: 5, train_loss: 0.9669, test_loss: 0.9621, test_f1: 0.4785
 epoch: 6, train_loss: 0.9634, test_loss: 0.9126, test_f1: 0.4791
 epoch: 7, train_loss: 0.9515, test_loss: 0.9552, test_f1: 0.4968
 epoch: 8, train_loss: 0.9472, test_loss: 0.9701, test_f1: 0.4946
 epoch: 9, train_loss: 0.9375, test_loss: 0.9100, test_f1: 0.5164
 epoch: 10, train_loss: 0.9187, test_loss: 0.9221, test_f1: 0.5062
 epoch: 11, train_loss: 0.9173, test_loss: 0.8885, test_f1: 0.5112
 epoch: 12, train_loss: 0.8993, test_loss: 0.8778, test_f1: 0.5529
 epoch: 13, train_loss: 0.8969, test_loss: 0.9201, test_f1: 0.5319
 epoch: 14, train_loss: 0.8852, test_loss: 0.9598, test_f1: 0.5371
 epoch: 15, train_loss: 0.8656, test_loss: 0.9161, test_f1: 0.5591
 epoch: 16, train_loss: 0.8564, test_loss: 0.8810, test_f1: 0.5713
 epoch: 17, train_loss: 0.8468, test_loss: 0.8975, test_f1: 0.5439
 epoch: 18, train_loss: 0.8492, test_loss: 0.8998, test_f1: 0.5653
 epoch: 19, train_loss: 0.8421, test_loss: 0.9269, test_f1: 0.5656
 epoch: 20, train_loss: 0.8293, test_loss: 0.9107, test_f1: 0.5551
 epoch: 21, train_loss: 0.8216, test_loss: 0.9064, test_f1: 0.5439
 epoch: 22, train_loss: 0.8213, test_loss: 0.9203, test_f1: 0.5476
 epoch: 23, train_loss: 0.8209, test_loss: 0.9152, test_f1: 0.5700
 epoch: 24, train_loss: 0.8080, test_loss: 0.8760, test_f1: 0.6173
 epoch: 25, train_loss: 0.8000, test_loss: 0.8869, test_f1: 0.5676
 epoch: 26, train_loss: 0.7918, test_loss: 0.8630, test_f1: 0.5913
 epoch: 27, train_loss: 0.7907, test_loss: 0.9604, test_f1: 0.5618
 epoch: 28, train_loss: 0.7807, test_loss: 0.8702, test_f1: 0.5829
 epoch: 29, train_loss: 0.7934, test_loss: 0.9673, test_f1: 0.5698
 epoch: 30, train_loss: 0.7802, test_loss: 0.8736, test_f1: 0.5936
 epoch: 31, train_loss: 0.7720, test_loss: 0.8843, test_f1: 0.5749
 epoch: 32, train_loss: 0.7761, test_loss: 0.9014, test_f1: 0.5836
 epoch: 33, train_loss: 0.7689, test_loss: 0.8534, test_f1: 0.6196
 epoch: 34, train_loss: 0.7551, test_loss: 0.9004, test_f1: 0.6013
 epoch: 35, train_loss: 0.7491, test_loss: 0.8634, test_f1: 0.6113
 epoch: 36, train_loss: 0.7543, test_loss: 0.9338, test_f1: 0.6077
 epoch: 37, train_loss: 0.7456, test_loss: 0.8897, test_f1: 0.6065
 epoch: 38, train_loss: 0.7473, test_loss: 0.9065, test_f1: 0.6003
 epoch: 39, train_loss: 0.7230, test_loss: 0.9561, test_f1: 0.5880
 epoch: 40, train_loss: 0.7359, test_loss: 0.9295, test_f1: 0.6092
 epoch: 41, train_loss: 0.7351, test_loss: 0.9015, test_f1: 0.6153
 epoch: 42, train_loss: 0.7317, test_loss: 0.9098, test_f1: 0.6025
 epoch: 43, train_loss: 0.7287, test_loss: 0.9069, test_f1: 0.5858
 epoch: 44, train_loss: 0.7093, test_loss: 0.8970, test_f1: 0.6156
 epoch: 45, train_loss: 0.7079, test_loss: 0.9142, test_f1: 0.5928
 epoch: 46, train_loss: 0.7064, test_loss: 0.9254, test_f1: 0.6097
 epoch: 47, train_loss: 0.6992, test_loss: 0.8780, test_f1: 0.6040
 epoch: 48, train_loss: 0.6901, test_loss: 0.8712, test_f1: 0.6296
 epoch: 49, train_loss: 0.6907, test_loss: 0.8887, test_f1: 0.6175
 epoch: 50, train_loss: 0.6887, test_loss: 0.8701, test_f1: 0.6638
 epoch: 51, train_loss: 0.6679, test_loss: 0.8495, test_f1: 0.6630
 epoch: 52, train_loss: 0.6691, test_loss: 0.8462, test_f1: 0.6460
 epoch: 53, train_loss: 0.6580, test_loss: 0.8821, test_f1: 0.6709
 epoch: 54, train_loss: 0.6405, test_loss: 0.8765, test_f1: 0.6708
 epoch: 55, train_loss: 0.6514, test_loss: 0.8785, test_f1: 0.6439
 epoch: 56, train_loss: 0.6362, test_loss: 0.8795, test_f1: 0.6239
 epoch: 57, train_loss: 0.6468, test_loss: 0.8590, test_f1: 0.6512
 epoch: 58, train_loss: 0.6418, test_loss: 0.8769, test_f1: 0.6499
 epoch: 59, train_loss: 0.6471, test_loss: 0.8993, test_f1: 0.6568
 epoch: 60, train_loss: 0.6513, test_loss: 0.8924, test_f1: 0.6413
 epoch: 61, train_loss: 0.6343, test_loss: 0.8537, test_f1: 0.6596
 epoch: 62, train_loss: 0.6291, test_loss: 0.8828, test_f1: 0.6455
 epoch: 63, train_loss: 0.6214, test_loss: 0.8653, test_f1: 0.6577
 epoch: 64, train_loss: 0.6273, test_loss: 0.8602, test_f1: 0.6512
 epoch: 65, train_loss: 0.6278, test_loss: 0.9096, test_f1: 0.6312
 epoch: 66, train_loss: 0.6103, test_loss: 0.8949, test_f1: 0.6341
 epoch: 67, train_loss: 0.6191, test_loss: 0.8888, test_f1: 0.6424
 epoch: 68, train_loss: 0.6109, test_loss: 0.8994, test_f1: 0.6425
 epoch: 69, train_loss: 0.6219, test_loss: 0.8892, test_f1: 0.6524
 epoch: 70, train_loss: 0.6151, test_loss: 0.8904, test_f1: 0.6415
 epoch: 71, train_loss: 0.6035, test_loss: 0.9066, test_f1: 0.6386
 epoch: 72, train_loss: 0.6104, test_loss: 0.8978, test_f1: 0.6281
 epoch: 73, train_loss: 0.6200, test_loss: 0.8979, test_f1: 0.6420
 epoch: 74, train_loss: 0.5937, test_loss: 0.8807, test_f1: 0.6567
 epoch: 75, train_loss: 0.5896, test_loss: 0.8795, test_f1: 0.6366
 epoch: 76, train_loss: 0.6019, test_loss: 0.8856, test_f1: 0.6560
 epoch: 77, train_loss: 0.6095, test_loss: 0.8463, test_f1: 0.6747
 epoch: 78, train_loss: 0.5987, test_loss: 0.9063, test_f1: 0.6521
 epoch: 79, train_loss: 0.5917, test_loss: 0.8945, test_f1: 0.6474
 epoch: 80, train_loss: 0.5950, test_loss: 0.8965, test_f1: 0.6336
 epoch: 81, train_loss: 0.5920, test_loss: 0.9323, test_f1: 0.6461
 epoch: 82, train_loss: 0.5895, test_loss: 0.8799, test_f1: 0.6603
 epoch: 83, train_loss: 0.5893, test_loss: 0.9360, test_f1: 0.6566
 epoch: 84, train_loss: 0.5903, test_loss: 0.9008, test_f1: 0.6626
 epoch: 85, train_loss: 0.5870, test_loss: 0.9183, test_f1: 0.6393
 epoch: 86, train_loss: 0.5788, test_loss: 0.8923, test_f1: 0.6450
 epoch: 87, train_loss: 0.5713, test_loss: 0.8915, test_f1: 0.6476
 epoch: 88, train_loss: 0.5720, test_loss: 0.9098, test_f1: 0.6681
 epoch: 89, train_loss: 0.5627, test_loss: 0.9092, test_f1: 0.6558
 epoch: 90, train_loss: 0.5594, test_loss: 0.8957, test_f1: 0.6698
 epoch: 91, train_loss: 0.5619, test_loss: 0.9493, test_f1: 0.6462
 epoch: 92, train_loss: 0.5600, test_loss: 0.9125, test_f1: 0.6601
 epoch: 93, train_loss: 0.5641, test_loss: 0.9355, test_f1: 0.6466
 epoch: 94, train_loss: 0.5466, test_loss: 0.8991, test_f1: 0.6374
 epoch: 95, train_loss: 0.5519, test_loss: 0.9188, test_f1: 0.6505
 epoch: 96, train_loss: 0.5709, test_loss: 0.9150, test_f1: 0.6688
 epoch: 97, train_loss: 0.5433, test_loss: 0.9458, test_f1: 0.6897
 epoch: 98, train_loss: 0.5445, test_loss: 0.9056, test_f1: 0.6658
 epoch: 99, train_loss: 0.5749, test_loss: 0.9320, test_f1: 0.6622
##################ITERATION #4 ****************************************
 epoch: 0, train_loss: 1.2684, test_loss: 1.1494, test_f1: 0.4209
 epoch: 1, train_loss: 1.1002, test_loss: 1.0017, test_f1: 0.4716
 epoch: 2, train_loss: 1.0598, test_loss: 0.9740, test_f1: 0.4752
 epoch: 3, train_loss: 1.0176, test_loss: 0.9990, test_f1: 0.4605
 epoch: 4, train_loss: 0.9893, test_loss: 0.9561, test_f1: 0.4972
 epoch: 5, train_loss: 0.9741, test_loss: 0.9545, test_f1: 0.5058
 epoch: 6, train_loss: 0.9607, test_loss: 0.9283, test_f1: 0.5138
 epoch: 7, train_loss: 0.9461, test_loss: 0.9383, test_f1: 0.5287
 epoch: 8, train_loss: 0.9385, test_loss: 0.9697, test_f1: 0.5232
 epoch: 9, train_loss: 0.9284, test_loss: 0.9591, test_f1: 0.5142
 epoch: 10, train_loss: 0.9219, test_loss: 0.9545, test_f1: 0.5151
 epoch: 11, train_loss: 0.9151, test_loss: 0.9415, test_f1: 0.5140
 epoch: 12, train_loss: 0.9057, test_loss: 0.9698, test_f1: 0.5060
 epoch: 13, train_loss: 0.8993, test_loss: 0.9295, test_f1: 0.5358
 epoch: 14, train_loss: 0.8879, test_loss: 1.0160, test_f1: 0.4726
 epoch: 15, train_loss: 0.8794, test_loss: 0.9299, test_f1: 0.5064
 epoch: 16, train_loss: 0.8882, test_loss: 0.9579, test_f1: 0.5100
 epoch: 17, train_loss: 0.8729, test_loss: 0.9139, test_f1: 0.5288
 epoch: 18, train_loss: 0.8638, test_loss: 0.9516, test_f1: 0.5175
 epoch: 19, train_loss: 0.8636, test_loss: 0.9433, test_f1: 0.5216
 epoch: 20, train_loss: 0.8609, test_loss: 0.9348, test_f1: 0.5252
 epoch: 21, train_loss: 0.8559, test_loss: 0.9383, test_f1: 0.5140
 epoch: 22, train_loss: 0.8498, test_loss: 0.9120, test_f1: 0.5342
 epoch: 23, train_loss: 0.8392, test_loss: 0.9068, test_f1: 0.5450
 epoch: 24, train_loss: 0.8324, test_loss: 0.9310, test_f1: 0.5275
 epoch: 25, train_loss: 0.8384, test_loss: 0.9524, test_f1: 0.5224
 epoch: 26, train_loss: 0.8330, test_loss: 0.9314, test_f1: 0.5551
 epoch: 27, train_loss: 0.8244, test_loss: 0.9294, test_f1: 0.5281
 epoch: 28, train_loss: 0.8389, test_loss: 0.9141, test_f1: 0.5262
 epoch: 29, train_loss: 0.8217, test_loss: 0.9543, test_f1: 0.5236
 epoch: 30, train_loss: 0.8122, test_loss: 0.9934, test_f1: 0.5086
 epoch: 31, train_loss: 0.8071, test_loss: 0.8924, test_f1: 0.5925
 epoch: 32, train_loss: 0.7991, test_loss: 0.9034, test_f1: 0.5659
 epoch: 33, train_loss: 0.8121, test_loss: 0.9161, test_f1: 0.5661
 epoch: 34, train_loss: 0.7911, test_loss: 0.9708, test_f1: 0.5197
 epoch: 35, train_loss: 0.7981, test_loss: 0.9689, test_f1: 0.5686
 epoch: 36, train_loss: 0.7740, test_loss: 0.9473, test_f1: 0.5341
 epoch: 37, train_loss: 0.7867, test_loss: 0.8981, test_f1: 0.5575
 epoch: 38, train_loss: 0.7779, test_loss: 0.9014, test_f1: 0.5632
 epoch: 39, train_loss: 0.7585, test_loss: 0.8967, test_f1: 0.5707
 epoch: 40, train_loss: 0.7768, test_loss: 0.9406, test_f1: 0.5713
 epoch: 41, train_loss: 0.7644, test_loss: 0.9579, test_f1: 0.5558
 epoch: 42, train_loss: 0.7641, test_loss: 0.8985, test_f1: 0.5589
 epoch: 43, train_loss: 0.7523, test_loss: 0.9036, test_f1: 0.5486
 epoch: 44, train_loss: 0.7519, test_loss: 0.9023, test_f1: 0.5557
 epoch: 45, train_loss: 0.7583, test_loss: 0.9216, test_f1: 0.5665
 epoch: 46, train_loss: 0.7629, test_loss: 0.9429, test_f1: 0.5298
 epoch: 47, train_loss: 0.7495, test_loss: 0.9109, test_f1: 0.5544
 epoch: 48, train_loss: 0.7417, test_loss: 0.9043, test_f1: 0.5744
 epoch: 49, train_loss: 0.7613, test_loss: 0.9316, test_f1: 0.5730
 epoch: 50, train_loss: 0.7386, test_loss: 0.9170, test_f1: 0.5942
 epoch: 51, train_loss: 0.7266, test_loss: 0.8852, test_f1: 0.5874
 epoch: 52, train_loss: 0.7154, test_loss: 0.8867, test_f1: 0.5974
 epoch: 53, train_loss: 0.7040, test_loss: 0.8803, test_f1: 0.6028
 epoch: 54, train_loss: 0.7041, test_loss: 0.8820, test_f1: 0.5946
 epoch: 55, train_loss: 0.6947, test_loss: 0.9064, test_f1: 0.5715
 epoch: 56, train_loss: 0.6959, test_loss: 0.9036, test_f1: 0.5824
 epoch: 57, train_loss: 0.6959, test_loss: 0.9120, test_f1: 0.5926
 epoch: 58, train_loss: 0.6913, test_loss: 0.9001, test_f1: 0.6143
 epoch: 59, train_loss: 0.6848, test_loss: 0.9135, test_f1: 0.5881
 epoch: 60, train_loss: 0.7019, test_loss: 0.8669, test_f1: 0.5958
 epoch: 61, train_loss: 0.6883, test_loss: 0.9146, test_f1: 0.6133
 epoch: 62, train_loss: 0.6842, test_loss: 0.9192, test_f1: 0.5916
 epoch: 63, train_loss: 0.6983, test_loss: 0.9125, test_f1: 0.5880
 epoch: 64, train_loss: 0.6884, test_loss: 0.9002, test_f1: 0.6027
 epoch: 65, train_loss: 0.6670, test_loss: 0.8735, test_f1: 0.6420
 epoch: 66, train_loss: 0.6757, test_loss: 0.8785, test_f1: 0.6262
 epoch: 67, train_loss: 0.6746, test_loss: 0.9001, test_f1: 0.6228
 epoch: 68, train_loss: 0.6661, test_loss: 0.8979, test_f1: 0.6289
 epoch: 69, train_loss: 0.6753, test_loss: 0.8881, test_f1: 0.6068
 epoch: 70, train_loss: 0.6697, test_loss: 0.9293, test_f1: 0.6002
 epoch: 71, train_loss: 0.6664, test_loss: 0.8746, test_f1: 0.6129
 epoch: 72, train_loss: 0.6697, test_loss: 0.9003, test_f1: 0.6344
 epoch: 73, train_loss: 0.6567, test_loss: 0.8840, test_f1: 0.6259
 epoch: 74, train_loss: 0.6587, test_loss: 0.8999, test_f1: 0.6172
 epoch: 75, train_loss: 0.6688, test_loss: 0.9212, test_f1: 0.6076
 epoch: 76, train_loss: 0.6731, test_loss: 0.8969, test_f1: 0.6070
 epoch: 77, train_loss: 0.6675, test_loss: 0.9407, test_f1: 0.5847
 epoch: 78, train_loss: 0.6605, test_loss: 0.9190, test_f1: 0.6028
 epoch: 79, train_loss: 0.6569, test_loss: 0.8933, test_f1: 0.6224
 epoch: 80, train_loss: 0.6468, test_loss: 0.9054, test_f1: 0.6272
 epoch: 81, train_loss: 0.6543, test_loss: 0.9159, test_f1: 0.6411
 epoch: 82, train_loss: 0.6634, test_loss: 0.8812, test_f1: 0.6655
 epoch: 83, train_loss: 0.6416, test_loss: 0.8993, test_f1: 0.6363
 epoch: 84, train_loss: 0.6468, test_loss: 0.8965, test_f1: 0.6234
 epoch: 85, train_loss: 0.6365, test_loss: 0.9073, test_f1: 0.6159
 epoch: 86, train_loss: 0.6335, test_loss: 0.9242, test_f1: 0.6088
 epoch: 87, train_loss: 0.6572, test_loss: 0.8838, test_f1: 0.6269
 epoch: 88, train_loss: 0.6412, test_loss: 0.8892, test_f1: 0.6174
 epoch: 89, train_loss: 0.6423, test_loss: 0.9061, test_f1: 0.6320
 epoch: 90, train_loss: 0.6397, test_loss: 0.9145, test_f1: 0.6099
 epoch: 91, train_loss: 0.6419, test_loss: 1.0049, test_f1: 0.5709
 epoch: 92, train_loss: 0.6490, test_loss: 0.9328, test_f1: 0.6061
 epoch: 93, train_loss: 0.6166, test_loss: 0.9283, test_f1: 0.6040
 epoch: 94, train_loss: 0.6284, test_loss: 0.9596, test_f1: 0.6112
 epoch: 95, train_loss: 0.6213, test_loss: 0.9414, test_f1: 0.6088
 epoch: 96, train_loss: 0.6292, test_loss: 0.9337, test_f1: 0.6010
 epoch: 97, train_loss: 0.6429, test_loss: 0.9538, test_f1: 0.6333
 epoch: 98, train_loss: 0.6253, test_loss: 0.9373, test_f1: 0.6188
 epoch: 99, train_loss: 0.6220, test_loss: 0.9216, test_f1: 0.6172
##################ITERATION #5 ****************************************
 epoch: 0, train_loss: 1.2532, test_loss: 1.0845, test_f1: 0.4972
 epoch: 1, train_loss: 1.0618, test_loss: 0.9612, test_f1: 0.4729
 epoch: 2, train_loss: 1.0133, test_loss: 0.9615, test_f1: 0.4554
 epoch: 3, train_loss: 0.9910, test_loss: 0.9474, test_f1: 0.5033
 epoch: 4, train_loss: 0.9740, test_loss: 0.9467, test_f1: 0.5159
 epoch: 5, train_loss: 0.9502, test_loss: 0.9457, test_f1: 0.5333
 epoch: 6, train_loss: 0.9443, test_loss: 0.9300, test_f1: 0.5312
 epoch: 7, train_loss: 0.9255, test_loss: 0.9150, test_f1: 0.5064
 epoch: 8, train_loss: 0.9316, test_loss: 0.8874, test_f1: 0.5503
 epoch: 9, train_loss: 0.9153, test_loss: 0.9181, test_f1: 0.5163
 epoch: 10, train_loss: 0.9054, test_loss: 0.9113, test_f1: 0.5385
 epoch: 11, train_loss: 0.8920, test_loss: 0.8992, test_f1: 0.5434
 epoch: 12, train_loss: 0.8881, test_loss: 0.9030, test_f1: 0.5608
 epoch: 13, train_loss: 0.8840, test_loss: 0.9161, test_f1: 0.5273
 epoch: 14, train_loss: 0.8725, test_loss: 0.9080, test_f1: 0.5674
 epoch: 15, train_loss: 0.8585, test_loss: 0.9455, test_f1: 0.5522
 epoch: 16, train_loss: 0.8621, test_loss: 0.8994, test_f1: 0.5713
 epoch: 17, train_loss: 0.8543, test_loss: 0.9109, test_f1: 0.5641
 epoch: 18, train_loss: 0.8462, test_loss: 0.9395, test_f1: 0.5436
 epoch: 19, train_loss: 0.8504, test_loss: 0.8955, test_f1: 0.5744
 epoch: 20, train_loss: 0.8414, test_loss: 0.9171, test_f1: 0.5736
 epoch: 21, train_loss: 0.8249, test_loss: 0.8826, test_f1: 0.5981
 epoch: 22, train_loss: 0.8329, test_loss: 0.8987, test_f1: 0.5889
 epoch: 23, train_loss: 0.8333, test_loss: 0.9345, test_f1: 0.5777
 epoch: 24, train_loss: 0.8340, test_loss: 0.8954, test_f1: 0.5743
 epoch: 25, train_loss: 0.8153, test_loss: 0.8600, test_f1: 0.5908
 epoch: 26, train_loss: 0.8180, test_loss: 0.8949, test_f1: 0.5733
 epoch: 27, train_loss: 0.8233, test_loss: 0.8974, test_f1: 0.5941
 epoch: 28, train_loss: 0.8034, test_loss: 0.8604, test_f1: 0.5971
 epoch: 29, train_loss: 0.8062, test_loss: 0.8912, test_f1: 0.5726
 epoch: 30, train_loss: 0.8077, test_loss: 0.8869, test_f1: 0.6044
 epoch: 31, train_loss: 0.7950, test_loss: 0.9053, test_f1: 0.5457
 epoch: 32, train_loss: 0.7878, test_loss: 0.8799, test_f1: 0.5846
 epoch: 33, train_loss: 0.7826, test_loss: 0.8718, test_f1: 0.5911
 epoch: 34, train_loss: 0.7728, test_loss: 0.8902, test_f1: 0.5845
 epoch: 35, train_loss: 0.7758, test_loss: 0.9082, test_f1: 0.5816
 epoch: 36, train_loss: 0.7661, test_loss: 0.8827, test_f1: 0.6092
 epoch: 37, train_loss: 0.7701, test_loss: 0.8801, test_f1: 0.5991
 epoch: 38, train_loss: 0.7538, test_loss: 0.9178, test_f1: 0.5883
 epoch: 39, train_loss: 0.7741, test_loss: 0.9045, test_f1: 0.6077
 epoch: 40, train_loss: 0.7623, test_loss: 0.8711, test_f1: 0.6123
 epoch: 41, train_loss: 0.7550, test_loss: 0.9387, test_f1: 0.5885
 epoch: 42, train_loss: 0.7558, test_loss: 0.8859, test_f1: 0.6243
 epoch: 43, train_loss: 0.7544, test_loss: 0.8834, test_f1: 0.5998
 epoch: 44, train_loss: 0.7420, test_loss: 0.8668, test_f1: 0.6395
 epoch: 45, train_loss: 0.7491, test_loss: 0.9233, test_f1: 0.6099
 epoch: 46, train_loss: 0.7413, test_loss: 0.9099, test_f1: 0.5990
 epoch: 47, train_loss: 0.7328, test_loss: 0.8647, test_f1: 0.6279
 epoch: 48, train_loss: 0.7188, test_loss: 0.8848, test_f1: 0.6243
 epoch: 49, train_loss: 0.7252, test_loss: 0.8661, test_f1: 0.6160
 epoch: 50, train_loss: 0.7093, test_loss: 0.8727, test_f1: 0.6393
 epoch: 51, train_loss: 0.7084, test_loss: 0.8726, test_f1: 0.6324
 epoch: 52, train_loss: 0.6847, test_loss: 0.8619, test_f1: 0.6370
 epoch: 53, train_loss: 0.6843, test_loss: 0.8651, test_f1: 0.6383
 epoch: 54, train_loss: 0.6872, test_loss: 0.8618, test_f1: 0.6313
 epoch: 55, train_loss: 0.6798, test_loss: 0.8728, test_f1: 0.6405
 epoch: 56, train_loss: 0.6746, test_loss: 0.8584, test_f1: 0.6832
 epoch: 57, train_loss: 0.6721, test_loss: 0.8297, test_f1: 0.6401
 epoch: 58, train_loss: 0.6699, test_loss: 0.8518, test_f1: 0.6256
 epoch: 59, train_loss: 0.6867, test_loss: 0.8428, test_f1: 0.6386
 epoch: 60, train_loss: 0.6761, test_loss: 0.8600, test_f1: 0.6445
 epoch: 61, train_loss: 0.6729, test_loss: 0.8846, test_f1: 0.6201
 epoch: 62, train_loss: 0.6753, test_loss: 0.9051, test_f1: 0.6220
 epoch: 63, train_loss: 0.6563, test_loss: 0.8675, test_f1: 0.6431
 epoch: 64, train_loss: 0.6633, test_loss: 0.8567, test_f1: 0.6434
 epoch: 65, train_loss: 0.6748, test_loss: 0.8545, test_f1: 0.6647
 epoch: 66, train_loss: 0.6487, test_loss: 0.9068, test_f1: 0.6511
 epoch: 67, train_loss: 0.6600, test_loss: 0.8838, test_f1: 0.6444
 epoch: 68, train_loss: 0.6502, test_loss: 0.9029, test_f1: 0.6353
 epoch: 69, train_loss: 0.6534, test_loss: 0.8672, test_f1: 0.6500
 epoch: 70, train_loss: 0.6593, test_loss: 0.8588, test_f1: 0.6411
 epoch: 71, train_loss: 0.6572, test_loss: 0.8470, test_f1: 0.6540
 epoch: 72, train_loss: 0.6483, test_loss: 0.8961, test_f1: 0.6516
 epoch: 73, train_loss: 0.6444, test_loss: 0.8922, test_f1: 0.6478
 epoch: 74, train_loss: 0.6438, test_loss: 0.8968, test_f1: 0.6310
 epoch: 75, train_loss: 0.6318, test_loss: 0.8678, test_f1: 0.6654
 epoch: 76, train_loss: 0.6563, test_loss: 0.8770, test_f1: 0.6471
 epoch: 77, train_loss: 0.6319, test_loss: 0.8716, test_f1: 0.6481
 epoch: 78, train_loss: 0.6221, test_loss: 0.8952, test_f1: 0.6631
 epoch: 79, train_loss: 0.6299, test_loss: 0.8909, test_f1: 0.6466
 epoch: 80, train_loss: 0.6149, test_loss: 0.9120, test_f1: 0.6455
 epoch: 81, train_loss: 0.6311, test_loss: 0.8675, test_f1: 0.6518
 epoch: 82, train_loss: 0.6355, test_loss: 0.8453, test_f1: 0.6643
 epoch: 83, train_loss: 0.6119, test_loss: 0.8855, test_f1: 0.6623
 epoch: 84, train_loss: 0.6233, test_loss: 0.8582, test_f1: 0.6773
 epoch: 85, train_loss: 0.6093, test_loss: 0.9188, test_f1: 0.6379
 epoch: 86, train_loss: 0.6162, test_loss: 0.8855, test_f1: 0.6633
 epoch: 87, train_loss: 0.6168, test_loss: 0.8769, test_f1: 0.6645
 epoch: 88, train_loss: 0.6018, test_loss: 0.8648, test_f1: 0.6490
 epoch: 89, train_loss: 0.6061, test_loss: 0.9016, test_f1: 0.6560
 epoch: 90, train_loss: 0.6091, test_loss: 0.9154, test_f1: 0.6569
 epoch: 91, train_loss: 0.6035, test_loss: 0.8989, test_f1: 0.6553
 epoch: 92, train_loss: 0.6139, test_loss: 0.9033, test_f1: 0.6671
 epoch: 93, train_loss: 0.6026, test_loss: 0.9777, test_f1: 0.6487
 epoch: 94, train_loss: 0.6154, test_loss: 0.8756, test_f1: 0.6866
 epoch: 95, train_loss: 0.6100, test_loss: 0.8997, test_f1: 0.6394
 epoch: 96, train_loss: 0.6136, test_loss: 0.8956, test_f1: 0.6697
 epoch: 97, train_loss: 0.6026, test_loss: 0.8708, test_f1: 0.6671
 epoch: 98, train_loss: 0.6047, test_loss: 0.9006, test_f1: 0.6493
 epoch: 99, train_loss: 0.5933, test_loss: 0.8988, test_f1: 0.6657
##################ITERATION #6 ****************************************
 epoch: 0, train_loss: 1.3297, test_loss: 1.1966, test_f1: 0.3019
 epoch: 1, train_loss: 1.1235, test_loss: 1.0311, test_f1: 0.4337
 epoch: 2, train_loss: 1.0700, test_loss: 1.0937, test_f1: 0.4416
 epoch: 3, train_loss: 1.0257, test_loss: 1.0064, test_f1: 0.4559
 epoch: 4, train_loss: 0.9868, test_loss: 1.0140, test_f1: 0.4453
 epoch: 5, train_loss: 0.9805, test_loss: 1.0064, test_f1: 0.4710
 epoch: 6, train_loss: 0.9695, test_loss: 1.0134, test_f1: 0.4617
 epoch: 7, train_loss: 0.9496, test_loss: 0.9995, test_f1: 0.4528
 epoch: 8, train_loss: 0.9338, test_loss: 0.9887, test_f1: 0.4726
 epoch: 9, train_loss: 0.9258, test_loss: 0.9931, test_f1: 0.4910
 epoch: 10, train_loss: 0.9113, test_loss: 0.9794, test_f1: 0.5129
 epoch: 11, train_loss: 0.8985, test_loss: 0.9811, test_f1: 0.5196
 epoch: 12, train_loss: 0.8893, test_loss: 0.9793, test_f1: 0.5266
 epoch: 13, train_loss: 0.8771, test_loss: 0.9535, test_f1: 0.5369
 epoch: 14, train_loss: 0.8645, test_loss: 0.9613, test_f1: 0.5218
 epoch: 15, train_loss: 0.8766, test_loss: 0.9733, test_f1: 0.5076
 epoch: 16, train_loss: 0.8613, test_loss: 0.9327, test_f1: 0.5127
 epoch: 17, train_loss: 0.8624, test_loss: 0.9620, test_f1: 0.5017
 epoch: 18, train_loss: 0.8528, test_loss: 0.9710, test_f1: 0.5193
 epoch: 19, train_loss: 0.8386, test_loss: 0.9584, test_f1: 0.5367
 epoch: 20, train_loss: 0.8374, test_loss: 0.9463, test_f1: 0.5360
 epoch: 21, train_loss: 0.8387, test_loss: 0.9522, test_f1: 0.5134
 epoch: 22, train_loss: 0.8379, test_loss: 0.9499, test_f1: 0.5179
 epoch: 23, train_loss: 0.8100, test_loss: 0.9541, test_f1: 0.5211
 epoch: 24, train_loss: 0.8147, test_loss: 0.9957, test_f1: 0.5239
 epoch: 25, train_loss: 0.8119, test_loss: 0.9468, test_f1: 0.5422
 epoch: 26, train_loss: 0.8087, test_loss: 0.9434, test_f1: 0.5556
 epoch: 27, train_loss: 0.8047, test_loss: 0.9883, test_f1: 0.5594
 epoch: 28, train_loss: 0.8043, test_loss: 0.9448, test_f1: 0.5754
 epoch: 29, train_loss: 0.7918, test_loss: 0.9356, test_f1: 0.5769
 epoch: 30, train_loss: 0.7943, test_loss: 0.9403, test_f1: 0.5376
 epoch: 31, train_loss: 0.7951, test_loss: 0.9470, test_f1: 0.5428
 epoch: 32, train_loss: 0.7893, test_loss: 0.8982, test_f1: 0.5596
 epoch: 33, train_loss: 0.8096, test_loss: 1.0017, test_f1: 0.5350
 epoch: 34, train_loss: 0.7800, test_loss: 0.9094, test_f1: 0.5680
 epoch: 35, train_loss: 0.7774, test_loss: 0.9588, test_f1: 0.5569
 epoch: 36, train_loss: 0.7834, test_loss: 0.9191, test_f1: 0.5583
 epoch: 37, train_loss: 0.7638, test_loss: 0.9449, test_f1: 0.5574
 epoch: 38, train_loss: 0.7783, test_loss: 0.9779, test_f1: 0.5421
 epoch: 39, train_loss: 0.7531, test_loss: 0.9421, test_f1: 0.5545
 epoch: 40, train_loss: 0.7766, test_loss: 1.0245, test_f1: 0.5818
 epoch: 41, train_loss: 0.7672, test_loss: 0.9199, test_f1: 0.5645
 epoch: 42, train_loss: 0.7444, test_loss: 0.9167, test_f1: 0.5420
 epoch: 43, train_loss: 0.7407, test_loss: 0.9266, test_f1: 0.5734
 epoch: 44, train_loss: 0.7368, test_loss: 0.9562, test_f1: 0.6016
 epoch: 45, train_loss: 0.7339, test_loss: 0.9612, test_f1: 0.5837
 epoch: 46, train_loss: 0.7402, test_loss: 0.9379, test_f1: 0.5762
 epoch: 47, train_loss: 0.7338, test_loss: 1.0027, test_f1: 0.5790
 epoch: 48, train_loss: 0.7377, test_loss: 0.9318, test_f1: 0.5754
 epoch: 49, train_loss: 0.7371, test_loss: 0.9642, test_f1: 0.5877
 epoch: 50, train_loss: 0.7336, test_loss: 0.9695, test_f1: 0.5634
 epoch: 51, train_loss: 0.7103, test_loss: 0.9930, test_f1: 0.5565
 epoch: 52, train_loss: 0.6958, test_loss: 0.9833, test_f1: 0.5653
 epoch: 53, train_loss: 0.7010, test_loss: 0.9596, test_f1: 0.5870
 epoch: 54, train_loss: 0.6999, test_loss: 0.9194, test_f1: 0.6088
 epoch: 55, train_loss: 0.7060, test_loss: 0.9404, test_f1: 0.5614
 epoch: 56, train_loss: 0.6897, test_loss: 0.9590, test_f1: 0.5862
 epoch: 57, train_loss: 0.6888, test_loss: 0.9633, test_f1: 0.5964
 epoch: 58, train_loss: 0.6886, test_loss: 0.9449, test_f1: 0.5848
 epoch: 59, train_loss: 0.6767, test_loss: 1.0043, test_f1: 0.5619
 epoch: 60, train_loss: 0.6782, test_loss: 0.9503, test_f1: 0.5769
 epoch: 61, train_loss: 0.6703, test_loss: 0.9833, test_f1: 0.5812
 epoch: 62, train_loss: 0.6929, test_loss: 0.9887, test_f1: 0.5970
 epoch: 63, train_loss: 0.6690, test_loss: 0.9754, test_f1: 0.5832
 epoch: 64, train_loss: 0.6663, test_loss: 0.9479, test_f1: 0.5991
 epoch: 65, train_loss: 0.6617, test_loss: 1.0089, test_f1: 0.6024
 epoch: 66, train_loss: 0.6690, test_loss: 0.9808, test_f1: 0.6244
 epoch: 67, train_loss: 0.6522, test_loss: 0.9650, test_f1: 0.5807
 epoch: 68, train_loss: 0.6684, test_loss: 0.9973, test_f1: 0.6061
 epoch: 69, train_loss: 0.6575, test_loss: 1.0571, test_f1: 0.5779
 epoch: 70, train_loss: 0.6636, test_loss: 0.9641, test_f1: 0.5961
 epoch: 71, train_loss: 0.6449, test_loss: 0.9769, test_f1: 0.6132
 epoch: 72, train_loss: 0.6564, test_loss: 1.0017, test_f1: 0.5857
 epoch: 73, train_loss: 0.6496, test_loss: 1.0213, test_f1: 0.6077
 epoch: 74, train_loss: 0.6651, test_loss: 1.0210, test_f1: 0.6059
 epoch: 75, train_loss: 0.6523, test_loss: 0.9731, test_f1: 0.6066
 epoch: 76, train_loss: 0.6491, test_loss: 1.0212, test_f1: 0.6034
 epoch: 77, train_loss: 0.6427, test_loss: 1.0535, test_f1: 0.6037
 epoch: 78, train_loss: 0.6412, test_loss: 1.0362, test_f1: 0.6003
 epoch: 79, train_loss: 0.6352, test_loss: 0.9500, test_f1: 0.6359
 epoch: 80, train_loss: 0.6362, test_loss: 1.0048, test_f1: 0.5983
 epoch: 81, train_loss: 0.6335, test_loss: 0.9818, test_f1: 0.6145
 epoch: 82, train_loss: 0.6364, test_loss: 1.0286, test_f1: 0.5912
 epoch: 83, train_loss: 0.6416, test_loss: 0.9777, test_f1: 0.6462
 epoch: 84, train_loss: 0.6274, test_loss: 0.9733, test_f1: 0.5919
 epoch: 85, train_loss: 0.6313, test_loss: 1.0528, test_f1: 0.6098
 epoch: 86, train_loss: 0.6305, test_loss: 1.0478, test_f1: 0.6063
 epoch: 87, train_loss: 0.6248, test_loss: 1.0538, test_f1: 0.5867
 epoch: 88, train_loss: 0.6236, test_loss: 1.0022, test_f1: 0.6217
 epoch: 89, train_loss: 0.6292, test_loss: 1.0063, test_f1: 0.6174
 epoch: 90, train_loss: 0.6292, test_loss: 1.0083, test_f1: 0.6297
 epoch: 91, train_loss: 0.6196, test_loss: 0.9995, test_f1: 0.6211
 epoch: 92, train_loss: 0.6322, test_loss: 0.9767, test_f1: 0.6283
 epoch: 93, train_loss: 0.6198, test_loss: 1.0031, test_f1: 0.6353
 epoch: 94, train_loss: 0.6096, test_loss: 1.0654, test_f1: 0.6110
 epoch: 95, train_loss: 0.6082, test_loss: 1.0501, test_f1: 0.6003
 epoch: 96, train_loss: 0.6091, test_loss: 0.9646, test_f1: 0.6523
 epoch: 97, train_loss: 0.6063, test_loss: 1.0175, test_f1: 0.6184
 epoch: 98, train_loss: 0.6085, test_loss: 1.0327, test_f1: 0.6181
 epoch: 99, train_loss: 0.6057, test_loss: 1.0018, test_f1: 0.6185
##################ITERATION #7 ****************************************
 epoch: 0, train_loss: 1.3666, test_loss: 1.1220, test_f1: 0.4523
 epoch: 1, train_loss: 1.1156, test_loss: 0.9897, test_f1: 0.4984
 epoch: 2, train_loss: 1.0688, test_loss: 0.9511, test_f1: 0.4884
 epoch: 3, train_loss: 1.0153, test_loss: 0.9301, test_f1: 0.4967
 epoch: 4, train_loss: 0.9909, test_loss: 0.9475, test_f1: 0.4785
 epoch: 5, train_loss: 0.9748, test_loss: 0.9177, test_f1: 0.5089
 epoch: 6, train_loss: 0.9599, test_loss: 0.9582, test_f1: 0.4894
 epoch: 7, train_loss: 0.9486, test_loss: 0.9536, test_f1: 0.4957
 epoch: 8, train_loss: 0.9227, test_loss: 0.9046, test_f1: 0.5075
 epoch: 9, train_loss: 0.9157, test_loss: 0.9545, test_f1: 0.5171
 epoch: 10, train_loss: 0.9132, test_loss: 0.8646, test_f1: 0.5212
 epoch: 11, train_loss: 0.8991, test_loss: 0.9437, test_f1: 0.5175
 epoch: 12, train_loss: 0.9044, test_loss: 0.9643, test_f1: 0.5197
 epoch: 13, train_loss: 0.8797, test_loss: 0.9314, test_f1: 0.5240
 epoch: 14, train_loss: 0.8720, test_loss: 0.8876, test_f1: 0.5204
 epoch: 15, train_loss: 0.8753, test_loss: 0.9090, test_f1: 0.5192
 epoch: 16, train_loss: 0.8641, test_loss: 0.8835, test_f1: 0.5325
 epoch: 17, train_loss: 0.8738, test_loss: 0.9489, test_f1: 0.5168
 epoch: 18, train_loss: 0.8462, test_loss: 0.9043, test_f1: 0.5254
 epoch: 19, train_loss: 0.8431, test_loss: 0.9380, test_f1: 0.5374
 epoch: 20, train_loss: 0.8498, test_loss: 0.9492, test_f1: 0.5195
 epoch: 21, train_loss: 0.8508, test_loss: 0.9535, test_f1: 0.5362
 epoch: 22, train_loss: 0.8275, test_loss: 0.9973, test_f1: 0.5077
 epoch: 23, train_loss: 0.8348, test_loss: 0.9633, test_f1: 0.5493
 epoch: 24, train_loss: 0.8239, test_loss: 0.9890, test_f1: 0.5183
 epoch: 25, train_loss: 0.8206, test_loss: 0.8817, test_f1: 0.5198
 epoch: 26, train_loss: 0.8160, test_loss: 0.9779, test_f1: 0.5430
 epoch: 27, train_loss: 0.8118, test_loss: 0.9492, test_f1: 0.5529
 epoch: 28, train_loss: 0.8126, test_loss: 0.9443, test_f1: 0.5676
 epoch: 29, train_loss: 0.8097, test_loss: 0.9501, test_f1: 0.5535
 epoch: 30, train_loss: 0.8035, test_loss: 0.9326, test_f1: 0.5402
 epoch: 31, train_loss: 0.8027, test_loss: 0.9941, test_f1: 0.5568
 epoch: 32, train_loss: 0.8022, test_loss: 0.9419, test_f1: 0.5910
 epoch: 33, train_loss: 0.7988, test_loss: 0.9509, test_f1: 0.5640
 epoch: 34, train_loss: 0.7875, test_loss: 0.9536, test_f1: 0.5582
 epoch: 35, train_loss: 0.7927, test_loss: 0.9567, test_f1: 0.5529
 epoch: 36, train_loss: 0.7911, test_loss: 0.9562, test_f1: 0.5620
 epoch: 37, train_loss: 0.7797, test_loss: 0.9641, test_f1: 0.5632
 epoch: 38, train_loss: 0.7823, test_loss: 0.9558, test_f1: 0.5968
 epoch: 39, train_loss: 0.7823, test_loss: 1.0018, test_f1: 0.5735
 epoch: 40, train_loss: 0.7620, test_loss: 0.9475, test_f1: 0.5755
 epoch: 41, train_loss: 0.7597, test_loss: 0.9712, test_f1: 0.5810
 epoch: 42, train_loss: 0.7705, test_loss: 1.0241, test_f1: 0.5387
 epoch: 43, train_loss: 0.7570, test_loss: 0.9795, test_f1: 0.5810
 epoch: 44, train_loss: 0.7572, test_loss: 0.9581, test_f1: 0.6005
 epoch: 45, train_loss: 0.7585, test_loss: 0.9279, test_f1: 0.6057
 epoch: 46, train_loss: 0.7333, test_loss: 0.9549, test_f1: 0.6063
 epoch: 47, train_loss: 0.7540, test_loss: 0.9311, test_f1: 0.6099
 epoch: 48, train_loss: 0.7504, test_loss: 0.9271, test_f1: 0.5947
 epoch: 49, train_loss: 0.7456, test_loss: 0.9993, test_f1: 0.5735
 epoch: 50, train_loss: 0.7296, test_loss: 0.9715, test_f1: 0.6056
 epoch: 51, train_loss: 0.7296, test_loss: 0.9518, test_f1: 0.5983
 epoch: 52, train_loss: 0.7111, test_loss: 0.9579, test_f1: 0.5997
 epoch: 53, train_loss: 0.6986, test_loss: 0.9351, test_f1: 0.6104
 epoch: 54, train_loss: 0.7002, test_loss: 0.9666, test_f1: 0.5907
 epoch: 55, train_loss: 0.6959, test_loss: 0.9801, test_f1: 0.5795
 epoch: 56, train_loss: 0.6850, test_loss: 0.9488, test_f1: 0.6145
 epoch: 57, train_loss: 0.6846, test_loss: 0.9568, test_f1: 0.6160
 epoch: 58, train_loss: 0.7076, test_loss: 0.9095, test_f1: 0.6339
 epoch: 59, train_loss: 0.6886, test_loss: 0.9384, test_f1: 0.6115
 epoch: 60, train_loss: 0.6860, test_loss: 0.9506, test_f1: 0.6125
 epoch: 61, train_loss: 0.6961, test_loss: 0.9341, test_f1: 0.6298
 epoch: 62, train_loss: 0.6710, test_loss: 0.9344, test_f1: 0.6084
 epoch: 63, train_loss: 0.6849, test_loss: 0.9257, test_f1: 0.6138
 epoch: 64, train_loss: 0.6690, test_loss: 0.9454, test_f1: 0.6133
 epoch: 65, train_loss: 0.6734, test_loss: 0.9534, test_f1: 0.6239
 epoch: 66, train_loss: 0.6736, test_loss: 0.9656, test_f1: 0.6146
 epoch: 67, train_loss: 0.6739, test_loss: 0.9422, test_f1: 0.6178
 epoch: 68, train_loss: 0.6757, test_loss: 0.9378, test_f1: 0.6172
 epoch: 69, train_loss: 0.6740, test_loss: 0.9539, test_f1: 0.5988
 epoch: 70, train_loss: 0.6779, test_loss: 0.9329, test_f1: 0.6053
 epoch: 71, train_loss: 0.6635, test_loss: 0.9625, test_f1: 0.6068
 epoch: 72, train_loss: 0.6729, test_loss: 0.9994, test_f1: 0.6114
 epoch: 73, train_loss: 0.6718, test_loss: 0.9248, test_f1: 0.5989
 epoch: 74, train_loss: 0.6681, test_loss: 0.9308, test_f1: 0.6070
 epoch: 75, train_loss: 0.6541, test_loss: 0.9359, test_f1: 0.6336
 epoch: 76, train_loss: 0.6638, test_loss: 0.9900, test_f1: 0.6157
 epoch: 77, train_loss: 0.6450, test_loss: 0.9644, test_f1: 0.6277
 epoch: 78, train_loss: 0.6496, test_loss: 0.9347, test_f1: 0.6343
 epoch: 79, train_loss: 0.6488, test_loss: 0.9435, test_f1: 0.6228
 epoch: 80, train_loss: 0.6433, test_loss: 0.9463, test_f1: 0.6261
 epoch: 81, train_loss: 0.6405, test_loss: 0.9572, test_f1: 0.6066
 epoch: 82, train_loss: 0.6430, test_loss: 0.9407, test_f1: 0.6266
 epoch: 83, train_loss: 0.6473, test_loss: 0.9503, test_f1: 0.6184
 epoch: 84, train_loss: 0.6387, test_loss: 0.9573, test_f1: 0.6056
 epoch: 85, train_loss: 0.6392, test_loss: 0.9624, test_f1: 0.6130
 epoch: 86, train_loss: 0.6433, test_loss: 0.9401, test_f1: 0.6190
 epoch: 87, train_loss: 0.6431, test_loss: 0.9629, test_f1: 0.6219
 epoch: 88, train_loss: 0.6273, test_loss: 0.9392, test_f1: 0.6381
 epoch: 89, train_loss: 0.6285, test_loss: 0.9401, test_f1: 0.6165
 epoch: 90, train_loss: 0.6157, test_loss: 0.9637, test_f1: 0.6360
 epoch: 91, train_loss: 0.6192, test_loss: 0.9796, test_f1: 0.6224
 epoch: 92, train_loss: 0.6156, test_loss: 0.9649, test_f1: 0.6070
 epoch: 93, train_loss: 0.6196, test_loss: 1.0193, test_f1: 0.6076
 epoch: 94, train_loss: 0.6118, test_loss: 0.9898, test_f1: 0.6119
 epoch: 95, train_loss: 0.6251, test_loss: 0.9984, test_f1: 0.6176
 epoch: 96, train_loss: 0.6199, test_loss: 0.9584, test_f1: 0.6106
 epoch: 97, train_loss: 0.6136, test_loss: 0.9890, test_f1: 0.6081
 epoch: 98, train_loss: 0.6155, test_loss: 1.0367, test_f1: 0.5960
 epoch: 99, train_loss: 0.6135, test_loss: 0.9958, test_f1: 0.5975
##################ITERATION #8 ****************************************
 epoch: 0, train_loss: 1.3192, test_loss: 1.1043, test_f1: 0.3962
 epoch: 1, train_loss: 1.0915, test_loss: 0.9797, test_f1: 0.4674
 epoch: 2, train_loss: 1.0167, test_loss: 0.9650, test_f1: 0.4737
 epoch: 3, train_loss: 0.9898, test_loss: 0.9247, test_f1: 0.4966
 epoch: 4, train_loss: 0.9666, test_loss: 0.9250, test_f1: 0.4949
 epoch: 5, train_loss: 0.9343, test_loss: 0.9298, test_f1: 0.4874
 epoch: 6, train_loss: 0.9297, test_loss: 0.8957, test_f1: 0.4984
 epoch: 7, train_loss: 0.9182, test_loss: 0.9040, test_f1: 0.5049
 epoch: 8, train_loss: 0.9125, test_loss: 0.8911, test_f1: 0.5121
 epoch: 9, train_loss: 0.8909, test_loss: 0.8912, test_f1: 0.5135
 epoch: 10, train_loss: 0.8890, test_loss: 0.9230, test_f1: 0.5261
 epoch: 11, train_loss: 0.8821, test_loss: 0.8922, test_f1: 0.5102
 epoch: 12, train_loss: 0.8657, test_loss: 0.8737, test_f1: 0.5513
 epoch: 13, train_loss: 0.8699, test_loss: 0.8705, test_f1: 0.5057
 epoch: 14, train_loss: 0.8520, test_loss: 0.8857, test_f1: 0.5274
 epoch: 15, train_loss: 0.8549, test_loss: 0.8827, test_f1: 0.5406
 epoch: 16, train_loss: 0.8332, test_loss: 0.8791, test_f1: 0.5461
 epoch: 17, train_loss: 0.8302, test_loss: 0.8613, test_f1: 0.5589
 epoch: 18, train_loss: 0.8280, test_loss: 0.9284, test_f1: 0.5766
 epoch: 19, train_loss: 0.8156, test_loss: 0.8905, test_f1: 0.5561
 epoch: 20, train_loss: 0.8163, test_loss: 0.8759, test_f1: 0.5858
 epoch: 21, train_loss: 0.8003, test_loss: 0.8616, test_f1: 0.5628
 epoch: 22, train_loss: 0.7872, test_loss: 0.8738, test_f1: 0.5804
 epoch: 23, train_loss: 0.7957, test_loss: 0.8585, test_f1: 0.5810
 epoch: 24, train_loss: 0.7751, test_loss: 0.8623, test_f1: 0.5888
 epoch: 25, train_loss: 0.7832, test_loss: 0.8653, test_f1: 0.5840
 epoch: 26, train_loss: 0.7851, test_loss: 0.8753, test_f1: 0.5685
 epoch: 27, train_loss: 0.7755, test_loss: 0.8687, test_f1: 0.5741
 epoch: 28, train_loss: 0.7721, test_loss: 0.9041, test_f1: 0.5731
 epoch: 29, train_loss: 0.7602, test_loss: 0.8641, test_f1: 0.5988
 epoch: 30, train_loss: 0.7564, test_loss: 0.8829, test_f1: 0.5725
 epoch: 31, train_loss: 0.7600, test_loss: 0.9008, test_f1: 0.5727
 epoch: 32, train_loss: 0.7567, test_loss: 0.8772, test_f1: 0.6044
 epoch: 33, train_loss: 0.7487, test_loss: 0.8389, test_f1: 0.5805
 epoch: 34, train_loss: 0.7504, test_loss: 0.8566, test_f1: 0.5704
 epoch: 35, train_loss: 0.7317, test_loss: 0.8484, test_f1: 0.6105
 epoch: 36, train_loss: 0.7137, test_loss: 0.8767, test_f1: 0.6060
 epoch: 37, train_loss: 0.7343, test_loss: 0.8877, test_f1: 0.5989
 epoch: 38, train_loss: 0.7280, test_loss: 0.8719, test_f1: 0.5815
 epoch: 39, train_loss: 0.7281, test_loss: 0.8329, test_f1: 0.5881
 epoch: 40, train_loss: 0.7247, test_loss: 0.8689, test_f1: 0.5929
 epoch: 41, train_loss: 0.7227, test_loss: 0.8744, test_f1: 0.5934
 epoch: 42, train_loss: 0.7180, test_loss: 0.8829, test_f1: 0.5771
 epoch: 43, train_loss: 0.7055, test_loss: 0.8716, test_f1: 0.6037
 epoch: 44, train_loss: 0.6986, test_loss: 0.8833, test_f1: 0.6233
 epoch: 45, train_loss: 0.7121, test_loss: 0.8187, test_f1: 0.5951
 epoch: 46, train_loss: 0.7021, test_loss: 0.8647, test_f1: 0.6109
 epoch: 47, train_loss: 0.6978, test_loss: 0.8846, test_f1: 0.6283
 epoch: 48, train_loss: 0.6996, test_loss: 0.8969, test_f1: 0.5877
 epoch: 49, train_loss: 0.7092, test_loss: 0.8740, test_f1: 0.6235
 epoch: 50, train_loss: 0.6913, test_loss: 0.8722, test_f1: 0.6029
 epoch: 51, train_loss: 0.6762, test_loss: 0.8830, test_f1: 0.6247
 epoch: 52, train_loss: 0.6690, test_loss: 0.8640, test_f1: 0.6201
 epoch: 53, train_loss: 0.6642, test_loss: 0.8754, test_f1: 0.6335
 epoch: 54, train_loss: 0.6484, test_loss: 0.8791, test_f1: 0.6221
 epoch: 55, train_loss: 0.6569, test_loss: 0.8604, test_f1: 0.6295
 epoch: 56, train_loss: 0.6389, test_loss: 0.8644, test_f1: 0.6337
 epoch: 57, train_loss: 0.6379, test_loss: 0.8979, test_f1: 0.6355
 epoch: 58, train_loss: 0.6392, test_loss: 0.8785, test_f1: 0.6269
 epoch: 59, train_loss: 0.6409, test_loss: 0.8869, test_f1: 0.6243
 epoch: 60, train_loss: 0.6552, test_loss: 0.8997, test_f1: 0.6144
 epoch: 61, train_loss: 0.6326, test_loss: 0.8997, test_f1: 0.6281
 epoch: 62, train_loss: 0.6358, test_loss: 0.8957, test_f1: 0.6098
 epoch: 63, train_loss: 0.6323, test_loss: 0.8808, test_f1: 0.6282
 epoch: 64, train_loss: 0.6355, test_loss: 0.8957, test_f1: 0.6309
 epoch: 65, train_loss: 0.6255, test_loss: 0.8826, test_f1: 0.6641
 epoch: 66, train_loss: 0.6209, test_loss: 0.9112, test_f1: 0.6426
 epoch: 67, train_loss: 0.6187, test_loss: 0.8981, test_f1: 0.6343
 epoch: 68, train_loss: 0.6406, test_loss: 0.9019, test_f1: 0.6492
 epoch: 69, train_loss: 0.6168, test_loss: 0.8826, test_f1: 0.6267
 epoch: 70, train_loss: 0.6082, test_loss: 0.8785, test_f1: 0.6338
 epoch: 71, train_loss: 0.6041, test_loss: 0.9227, test_f1: 0.6138
 epoch: 72, train_loss: 0.6169, test_loss: 0.9050, test_f1: 0.6302
 epoch: 73, train_loss: 0.6039, test_loss: 0.8928, test_f1: 0.6334
 epoch: 74, train_loss: 0.6155, test_loss: 0.8771, test_f1: 0.6436
 epoch: 75, train_loss: 0.6087, test_loss: 0.9115, test_f1: 0.6003
 epoch: 76, train_loss: 0.6163, test_loss: 0.9920, test_f1: 0.6363
 epoch: 77, train_loss: 0.6257, test_loss: 0.9262, test_f1: 0.6174
 epoch: 78, train_loss: 0.6032, test_loss: 0.9026, test_f1: 0.6173
 epoch: 79, train_loss: 0.6008, test_loss: 0.9322, test_f1: 0.6451
 epoch: 80, train_loss: 0.5860, test_loss: 0.9208, test_f1: 0.6396
 epoch: 81, train_loss: 0.6023, test_loss: 0.9043, test_f1: 0.6694
 epoch: 82, train_loss: 0.5990, test_loss: 0.9308, test_f1: 0.6225
 epoch: 83, train_loss: 0.6010, test_loss: 0.9429, test_f1: 0.6380
 epoch: 84, train_loss: 0.5979, test_loss: 0.9186, test_f1: 0.6324
 epoch: 85, train_loss: 0.5893, test_loss: 0.9495, test_f1: 0.6422
 epoch: 86, train_loss: 0.6038, test_loss: 0.9328, test_f1: 0.6278
 epoch: 87, train_loss: 0.5792, test_loss: 0.9197, test_f1: 0.6534
 epoch: 88, train_loss: 0.5731, test_loss: 0.9185, test_f1: 0.6643
 epoch: 89, train_loss: 0.5901, test_loss: 0.9477, test_f1: 0.6378
 epoch: 90, train_loss: 0.5713, test_loss: 0.9311, test_f1: 0.6412
 epoch: 91, train_loss: 0.5762, test_loss: 0.9386, test_f1: 0.6458
 epoch: 92, train_loss: 0.5749, test_loss: 0.9423, test_f1: 0.6342
 epoch: 93, train_loss: 0.5774, test_loss: 0.9598, test_f1: 0.6412
 epoch: 94, train_loss: 0.5745, test_loss: 0.9539, test_f1: 0.6462
 epoch: 95, train_loss: 0.5885, test_loss: 1.0014, test_f1: 0.6070
 epoch: 96, train_loss: 0.5783, test_loss: 0.9719, test_f1: 0.6296
 epoch: 97, train_loss: 0.5763, test_loss: 0.9754, test_f1: 0.6452
 epoch: 98, train_loss: 0.5781, test_loss: 0.9479, test_f1: 0.6635
 epoch: 99, train_loss: 0.5718, test_loss: 0.9545, test_f1: 0.6379
##################ITERATION #9 ****************************************
 epoch: 0, train_loss: 1.3718, test_loss: 1.1039, test_f1: 0.4578
 epoch: 1, train_loss: 1.1286, test_loss: 1.0174, test_f1: 0.5224
 epoch: 2, train_loss: 1.0567, test_loss: 0.9917, test_f1: 0.4997
 epoch: 3, train_loss: 1.0305, test_loss: 0.9704, test_f1: 0.4764
 epoch: 4, train_loss: 0.9926, test_loss: 0.9720, test_f1: 0.4714
 epoch: 5, train_loss: 0.9847, test_loss: 0.9800, test_f1: 0.4880
 epoch: 6, train_loss: 0.9641, test_loss: 0.9394, test_f1: 0.5024
 epoch: 7, train_loss: 0.9547, test_loss: 0.9612, test_f1: 0.4958
 epoch: 8, train_loss: 0.9364, test_loss: 0.9796, test_f1: 0.5264
 epoch: 9, train_loss: 0.9318, test_loss: 0.9589, test_f1: 0.5075
 epoch: 10, train_loss: 0.9120, test_loss: 0.9819, test_f1: 0.5239
 epoch: 11, train_loss: 0.9062, test_loss: 0.9777, test_f1: 0.5137
 epoch: 12, train_loss: 0.8889, test_loss: 0.9751, test_f1: 0.5304
 epoch: 13, train_loss: 0.8868, test_loss: 0.9585, test_f1: 0.5254
 epoch: 14, train_loss: 0.8807, test_loss: 0.9541, test_f1: 0.5288
 epoch: 15, train_loss: 0.8523, test_loss: 0.9504, test_f1: 0.5136
 epoch: 16, train_loss: 0.8718, test_loss: 0.9336, test_f1: 0.5522
 epoch: 17, train_loss: 0.8663, test_loss: 0.9385, test_f1: 0.5474
 epoch: 18, train_loss: 0.8595, test_loss: 0.9409, test_f1: 0.5297
 epoch: 19, train_loss: 0.8515, test_loss: 0.9467, test_f1: 0.5736
 epoch: 20, train_loss: 0.8382, test_loss: 0.9733, test_f1: 0.5511
 epoch: 21, train_loss: 0.8311, test_loss: 0.9173, test_f1: 0.5647
 epoch: 22, train_loss: 0.8261, test_loss: 0.9209, test_f1: 0.5552
 epoch: 23, train_loss: 0.8199, test_loss: 0.9296, test_f1: 0.5447
 epoch: 24, train_loss: 0.8270, test_loss: 0.9191, test_f1: 0.5530
 epoch: 25, train_loss: 0.8274, test_loss: 0.9419, test_f1: 0.5371
 epoch: 26, train_loss: 0.8145, test_loss: 0.9575, test_f1: 0.5692
 epoch: 27, train_loss: 0.8067, test_loss: 0.9291, test_f1: 0.5750
 epoch: 28, train_loss: 0.8104, test_loss: 0.9237, test_f1: 0.5839
 epoch: 29, train_loss: 0.7879, test_loss: 0.9328, test_f1: 0.5847
 epoch: 30, train_loss: 0.7861, test_loss: 0.9137, test_f1: 0.5632
 epoch: 31, train_loss: 0.7832, test_loss: 0.9339, test_f1: 0.5722
 epoch: 32, train_loss: 0.7904, test_loss: 0.9129, test_f1: 0.5828
 epoch: 33, train_loss: 0.7746, test_loss: 0.9154, test_f1: 0.5733
 epoch: 34, train_loss: 0.7855, test_loss: 0.9451, test_f1: 0.5787
 epoch: 35, train_loss: 0.7691, test_loss: 0.9454, test_f1: 0.5714
 epoch: 36, train_loss: 0.7580, test_loss: 0.9460, test_f1: 0.5980
 epoch: 37, train_loss: 0.7566, test_loss: 0.9493, test_f1: 0.5775
 epoch: 38, train_loss: 0.7500, test_loss: 0.9471, test_f1: 0.6192
 epoch: 39, train_loss: 0.7472, test_loss: 0.9520, test_f1: 0.6167
 epoch: 40, train_loss: 0.7496, test_loss: 0.9441, test_f1: 0.5721
 epoch: 41, train_loss: 0.7397, test_loss: 0.9614, test_f1: 0.6050
 epoch: 42, train_loss: 0.7359, test_loss: 0.9590, test_f1: 0.6078
 epoch: 43, train_loss: 0.7395, test_loss: 0.9201, test_f1: 0.6017
 epoch: 44, train_loss: 0.7293, test_loss: 0.9540, test_f1: 0.5896
 epoch: 45, train_loss: 0.7281, test_loss: 0.9353, test_f1: 0.6148
 epoch: 46, train_loss: 0.7139, test_loss: 0.9662, test_f1: 0.6154
 epoch: 47, train_loss: 0.7175, test_loss: 0.9471, test_f1: 0.5827
 epoch: 48, train_loss: 0.7094, test_loss: 0.9608, test_f1: 0.5895
 epoch: 49, train_loss: 0.7059, test_loss: 0.9573, test_f1: 0.6334
 epoch: 50, train_loss: 0.7060, test_loss: 0.9245, test_f1: 0.6033
 epoch: 51, train_loss: 0.6758, test_loss: 0.9067, test_f1: 0.6362
 epoch: 52, train_loss: 0.6737, test_loss: 0.9159, test_f1: 0.6279
 epoch: 53, train_loss: 0.6832, test_loss: 0.9532, test_f1: 0.6336
 epoch: 54, train_loss: 0.6712, test_loss: 0.9313, test_f1: 0.6388
 epoch: 55, train_loss: 0.6785, test_loss: 0.9305, test_f1: 0.6416
 epoch: 56, train_loss: 0.6724, test_loss: 0.9381, test_f1: 0.6489
 epoch: 57, train_loss: 0.6754, test_loss: 0.9361, test_f1: 0.6429
 epoch: 58, train_loss: 0.6620, test_loss: 0.9389, test_f1: 0.6505
 epoch: 59, train_loss: 0.6606, test_loss: 0.9607, test_f1: 0.6252
 epoch: 60, train_loss: 0.6577, test_loss: 0.9384, test_f1: 0.6532
 epoch: 61, train_loss: 0.6410, test_loss: 0.9382, test_f1: 0.6544
 epoch: 62, train_loss: 0.6431, test_loss: 0.9366, test_f1: 0.6551
 epoch: 63, train_loss: 0.6408, test_loss: 0.9345, test_f1: 0.6535
 epoch: 64, train_loss: 0.6316, test_loss: 0.9638, test_f1: 0.6408
 epoch: 65, train_loss: 0.6479, test_loss: 0.9542, test_f1: 0.6464
 epoch: 66, train_loss: 0.6367, test_loss: 0.9399, test_f1: 0.6268
 epoch: 67, train_loss: 0.6471, test_loss: 0.9769, test_f1: 0.6454
 epoch: 68, train_loss: 0.6449, test_loss: 0.9456, test_f1: 0.6555
 epoch: 69, train_loss: 0.6341, test_loss: 0.9566, test_f1: 0.6215
 epoch: 70, train_loss: 0.6233, test_loss: 0.9492, test_f1: 0.6662
 epoch: 71, train_loss: 0.6396, test_loss: 0.9491, test_f1: 0.6600
 epoch: 72, train_loss: 0.6232, test_loss: 0.9762, test_f1: 0.6538
 epoch: 73, train_loss: 0.6261, test_loss: 0.9633, test_f1: 0.6491
 epoch: 74, train_loss: 0.6402, test_loss: 0.9822, test_f1: 0.6348
 epoch: 75, train_loss: 0.6285, test_loss: 0.9623, test_f1: 0.6445
 epoch: 76, train_loss: 0.6292, test_loss: 0.9801, test_f1: 0.6302
 epoch: 77, train_loss: 0.6164, test_loss: 0.9801, test_f1: 0.6497
 epoch: 78, train_loss: 0.6271, test_loss: 0.9887, test_f1: 0.6512
 epoch: 79, train_loss: 0.6113, test_loss: 0.9818, test_f1: 0.6634
 epoch: 80, train_loss: 0.6048, test_loss: 1.0024, test_f1: 0.6561
 epoch: 81, train_loss: 0.6106, test_loss: 0.9906, test_f1: 0.6448
 epoch: 82, train_loss: 0.6001, test_loss: 1.0006, test_f1: 0.6599
 epoch: 83, train_loss: 0.6287, test_loss: 0.9860, test_f1: 0.6592
 epoch: 84, train_loss: 0.6011, test_loss: 1.0223, test_f1: 0.6343
 epoch: 85, train_loss: 0.6099, test_loss: 1.0172, test_f1: 0.6158
 epoch: 86, train_loss: 0.6115, test_loss: 0.9755, test_f1: 0.6723
 epoch: 87, train_loss: 0.5981, test_loss: 0.9777, test_f1: 0.6806
 epoch: 88, train_loss: 0.5905, test_loss: 1.0082, test_f1: 0.6473
 epoch: 89, train_loss: 0.5964, test_loss: 1.0099, test_f1: 0.6662
 epoch: 90, train_loss: 0.6000, test_loss: 0.9796, test_f1: 0.6549
 epoch: 91, train_loss: 0.6016, test_loss: 1.0310, test_f1: 0.6495
 epoch: 92, train_loss: 0.5993, test_loss: 1.0010, test_f1: 0.6241
 epoch: 93, train_loss: 0.5860, test_loss: 1.0132, test_f1: 0.6183
 epoch: 94, train_loss: 0.6046, test_loss: 0.9805, test_f1: 0.6441
 epoch: 95, train_loss: 0.5891, test_loss: 1.0090, test_f1: 0.6248
 epoch: 96, train_loss: 0.5836, test_loss: 1.0265, test_f1: 0.6339
 epoch: 97, train_loss: 0.5974, test_loss: 1.0087, test_f1: 0.6333
 epoch: 98, train_loss: 0.5825, test_loss: 1.0070, test_f1: 0.6663
 epoch: 99, train_loss: 0.5832, test_loss: 1.0210, test_f1: 0.6216

Training completed in 610.51 seconds
Best F1: 0.6934 at epoch 93
Mean F1 across iterations: 0.6678  0.0198
========================FINAL RESULTS================================
FEGIN weighted F1: 0.6934  0.0198
python main.py --data ltspice_examples --representation component_net --model FEGIN --layers 3 --hiddens 32 --batch_size 64 --lr 0.001 --emb_size 128 --epochs 100 --save_appendix component_net_L3_H32_BS64_LR0.001_E128 --no_val
-----



STDERR:
  File "main.py", line 370, in <module>
    main()
  File "main.py", line 254, in main
    dataset = dataset_class(
  File "/home/philip/projects/ltspice_examples_code_repo/Circuit-Completion-Using-GNNs/component_classification_with_link_prediction_head/evaluation/FEGIN/kernel/circuit_datasets.py", line 15, in __init__
    self.data, self.slices = torch.load(self.processed_paths[0])
  File "/home/philip/.local/lib/python3.8/site-packages/torch/serialization.py", line 1040, in load
    warnings.warn(
  File "/usr/lib/python3.8/warnings.py", line 109, in _showwarnmsg
    sw(msg.message, msg.category, msg.filename, msg.lineno,
  File "main.py", line 47, in warn_with_traceback
    traceback.print_stack(file=log)
/home/philip/projects/ltspice_examples_code_repo/Circuit-Completion-Using-GNNs/component_classification_with_link_prediction_head/evaluation/FEGIN/kernel/circuit_datasets.py:15: FutureWarning: You are using `torch.load` with `weights_only=False` (the current default value), which uses the default pickle module implicitly. It is possible to construct malicious pickle data which will execute arbitrary code during unpickling (See https://github.com/pytorch/pytorch/blob/main/SECURITY.md#untrusted-models for more details). In a future release, the default value for `weights_only` will be flipped to `True`. This limits the functions that could be executed during unpickling. Arbitrary objects will no longer be allowed to be loaded via this mode unless they are explicitly allowlisted by the user via `torch.serialization.add_safe_globals`. We recommend you start setting `weights_only=True` for any use case where you don't have full control of the loaded file. Please open an issue on GitHub for any issues related to this experimental feature.
  self.data, self.slices = torch.load(self.processed_paths[0])
