STDOUT:
Results will be saved in /home/philip/projects/ltspice_examples_code_repo/Circuit-Completion-Using-GNNs/component_classification_with_link_prediction_head/evaluation/FEGIN/results/model_FEGIN_dataset_ltspice_examples
Command line input: python main.py --data ltspice_examples --representation component_component --model FEGIN --layers 3 --hiddens 32 --batch_size 256 --lr 0.01 --emb_size 250 --epochs 100 --save_appendix component_component_L3_H32_BS256_LR0.01_E250 --no_val
 is saved.
-----
ltspice_examples - FEGIN
Using 3 layers, 32 hidden units, h = 2
Loading component_component representation dataset
ENTERED
Training FEGIN on component_component representation
Train: 3556, Test: 845
##################ITERATION #0 ****************************************
 epoch: 0, train_loss: 1.2973, test_loss: 1.2543, test_f1: 0.2870
 epoch: 1, train_loss: 1.2214, test_loss: 1.2103, test_f1: 0.3016
 epoch: 2, train_loss: 1.1804, test_loss: 1.1443, test_f1: 0.3504
 epoch: 3, train_loss: 1.1533, test_loss: 1.1387, test_f1: 0.4006
 epoch: 4, train_loss: 1.1118, test_loss: 1.0935, test_f1: 0.4712
 epoch: 5, train_loss: 1.0753, test_loss: 1.0510, test_f1: 0.4759
 epoch: 6, train_loss: 1.0562, test_loss: 0.9822, test_f1: 0.4841
 epoch: 7, train_loss: 1.0158, test_loss: 1.0381, test_f1: 0.4546
 epoch: 8, train_loss: 0.9916, test_loss: 0.9755, test_f1: 0.5060
 epoch: 9, train_loss: 0.9805, test_loss: 1.0077, test_f1: 0.5241
 epoch: 10, train_loss: 0.9627, test_loss: 1.0204, test_f1: 0.4793
 epoch: 11, train_loss: 0.9366, test_loss: 0.9759, test_f1: 0.5118
 epoch: 12, train_loss: 0.9203, test_loss: 1.0102, test_f1: 0.5119
 epoch: 13, train_loss: 0.9188, test_loss: 1.1594, test_f1: 0.4523
 epoch: 14, train_loss: 0.8869, test_loss: 1.0746, test_f1: 0.4785
 epoch: 15, train_loss: 0.8765, test_loss: 0.9549, test_f1: 0.5063
 epoch: 16, train_loss: 0.8698, test_loss: 0.9642, test_f1: 0.4804
 epoch: 17, train_loss: 0.8612, test_loss: 1.0169, test_f1: 0.4797
 epoch: 18, train_loss: 0.8406, test_loss: 1.1963, test_f1: 0.4859
 epoch: 19, train_loss: 0.8646, test_loss: 1.0457, test_f1: 0.5187
 epoch: 20, train_loss: 0.8303, test_loss: 1.0278, test_f1: 0.5185
 epoch: 21, train_loss: 0.8221, test_loss: 1.0036, test_f1: 0.5292
 epoch: 22, train_loss: 0.7999, test_loss: 1.0444, test_f1: 0.5227
 epoch: 23, train_loss: 0.8089, test_loss: 0.9893, test_f1: 0.5351
 epoch: 24, train_loss: 0.8206, test_loss: 1.1565, test_f1: 0.4544
 epoch: 25, train_loss: 0.7958, test_loss: 1.0159, test_f1: 0.5250
 epoch: 26, train_loss: 0.7825, test_loss: 1.1750, test_f1: 0.4906
 epoch: 27, train_loss: 0.8128, test_loss: 1.1929, test_f1: 0.4770
 epoch: 28, train_loss: 0.7725, test_loss: 0.9827, test_f1: 0.5724
 epoch: 29, train_loss: 0.7589, test_loss: 1.1399, test_f1: 0.5223
 epoch: 30, train_loss: 0.7542, test_loss: 1.1427, test_f1: 0.5006
 epoch: 31, train_loss: 0.7556, test_loss: 1.2010, test_f1: 0.4870
 epoch: 32, train_loss: 0.7701, test_loss: 1.0166, test_f1: 0.5188
 epoch: 33, train_loss: 0.7611, test_loss: 1.0214, test_f1: 0.5334
 epoch: 34, train_loss: 0.7412, test_loss: 1.0362, test_f1: 0.5410
 epoch: 35, train_loss: 0.7544, test_loss: 1.0043, test_f1: 0.5358
 epoch: 36, train_loss: 0.7586, test_loss: 1.1939, test_f1: 0.4595
 epoch: 37, train_loss: 0.7269, test_loss: 1.2349, test_f1: 0.4672
 epoch: 38, train_loss: 0.7145, test_loss: 1.1211, test_f1: 0.5157
 epoch: 39, train_loss: 0.7178, test_loss: 1.1235, test_f1: 0.5165
 epoch: 40, train_loss: 0.7229, test_loss: 1.1118, test_f1: 0.5315
 epoch: 41, train_loss: 0.7134, test_loss: 1.1056, test_f1: 0.5448
 epoch: 42, train_loss: 0.7060, test_loss: 1.0866, test_f1: 0.5557
 epoch: 43, train_loss: 0.7069, test_loss: 1.1924, test_f1: 0.4886
 epoch: 44, train_loss: 0.7001, test_loss: 1.3715, test_f1: 0.5117
 epoch: 45, train_loss: 0.6857, test_loss: 1.1561, test_f1: 0.5362
 epoch: 46, train_loss: 0.6973, test_loss: 1.3397, test_f1: 0.5119
 epoch: 47, train_loss: 0.6990, test_loss: 1.0828, test_f1: 0.5386
 epoch: 48, train_loss: 0.6784, test_loss: 1.1906, test_f1: 0.5210
 epoch: 49, train_loss: 0.6641, test_loss: 1.2083, test_f1: 0.5571
 epoch: 50, train_loss: 0.6687, test_loss: 1.2024, test_f1: 0.5484
 epoch: 51, train_loss: 0.6486, test_loss: 1.1801, test_f1: 0.5485
 epoch: 52, train_loss: 0.6304, test_loss: 1.1637, test_f1: 0.5704
 epoch: 53, train_loss: 0.5976, test_loss: 1.2778, test_f1: 0.5418
 epoch: 54, train_loss: 0.5891, test_loss: 1.4018, test_f1: 0.5222
 epoch: 55, train_loss: 0.5865, test_loss: 1.3089, test_f1: 0.5600
 epoch: 56, train_loss: 0.5859, test_loss: 1.3230, test_f1: 0.5381
 epoch: 57, train_loss: 0.5674, test_loss: 1.2445, test_f1: 0.5605
 epoch: 58, train_loss: 0.5872, test_loss: 1.4986, test_f1: 0.5470
 epoch: 59, train_loss: 0.5700, test_loss: 1.3885, test_f1: 0.5366
 epoch: 60, train_loss: 0.5635, test_loss: 1.5297, test_f1: 0.5312
 epoch: 61, train_loss: 0.5688, test_loss: 1.4671, test_f1: 0.5212
 epoch: 62, train_loss: 0.5529, test_loss: 1.3851, test_f1: 0.5757
 epoch: 63, train_loss: 0.5558, test_loss: 1.5038, test_f1: 0.5457
 epoch: 64, train_loss: 0.5542, test_loss: 1.4874, test_f1: 0.5687
 epoch: 65, train_loss: 0.5576, test_loss: 1.4951, test_f1: 0.5275
 epoch: 66, train_loss: 0.5621, test_loss: 1.2391, test_f1: 0.5618
 epoch: 67, train_loss: 0.5704, test_loss: 1.4238, test_f1: 0.5384
 epoch: 68, train_loss: 0.5461, test_loss: 1.3231, test_f1: 0.5641
 epoch: 69, train_loss: 0.5450, test_loss: 1.3594, test_f1: 0.5350
 epoch: 70, train_loss: 0.5171, test_loss: 1.6490, test_f1: 0.5298
 epoch: 71, train_loss: 0.5194, test_loss: 1.5397, test_f1: 0.5702
 epoch: 72, train_loss: 0.5748, test_loss: 1.2176, test_f1: 0.5601
 epoch: 73, train_loss: 0.5538, test_loss: 1.3966, test_f1: 0.5376
 epoch: 74, train_loss: 0.5239, test_loss: 1.2738, test_f1: 0.5796
 epoch: 75, train_loss: 0.5008, test_loss: 1.2804, test_f1: 0.5764
 epoch: 76, train_loss: 0.5013, test_loss: 1.6061, test_f1: 0.5707
 epoch: 77, train_loss: 0.5373, test_loss: 1.6085, test_f1: 0.5382
 epoch: 78, train_loss: 0.5366, test_loss: 1.6502, test_f1: 0.5057
 epoch: 79, train_loss: 0.5392, test_loss: 1.4526, test_f1: 0.5724
 epoch: 80, train_loss: 0.5079, test_loss: 1.6219, test_f1: 0.5342
 epoch: 81, train_loss: 0.4758, test_loss: 1.6171, test_f1: 0.5547
 epoch: 82, train_loss: 0.4865, test_loss: 1.5003, test_f1: 0.5606
 epoch: 83, train_loss: 0.4875, test_loss: 1.5478, test_f1: 0.5477
 epoch: 84, train_loss: 0.4979, test_loss: 1.5226, test_f1: 0.5717
 epoch: 85, train_loss: 0.5039, test_loss: 1.6183, test_f1: 0.5584
 epoch: 86, train_loss: 0.5027, test_loss: 1.6171, test_f1: 0.5371
 epoch: 87, train_loss: 0.4913, test_loss: 1.5958, test_f1: 0.5605
 epoch: 88, train_loss: 0.4723, test_loss: 1.7292, test_f1: 0.5457
 epoch: 89, train_loss: 0.4742, test_loss: 1.5149, test_f1: 0.5758
 epoch: 90, train_loss: 0.4962, test_loss: 1.5427, test_f1: 0.5474
 epoch: 91, train_loss: 0.4827, test_loss: 1.3440, test_f1: 0.5847
 epoch: 92, train_loss: 0.4708, test_loss: 1.6734, test_f1: 0.5566
 epoch: 93, train_loss: 0.4534, test_loss: 1.7048, test_f1: 0.5313
 epoch: 94, train_loss: 0.5253, test_loss: 1.6937, test_f1: 0.5272
 epoch: 95, train_loss: 0.4906, test_loss: 1.6489, test_f1: 0.5435
 epoch: 96, train_loss: 0.4572, test_loss: 1.7202, test_f1: 0.5246
 epoch: 97, train_loss: 0.4678, test_loss: 1.3907, test_f1: 0.6069
 epoch: 98, train_loss: 0.4944, test_loss: 1.4134, test_f1: 0.5815
 epoch: 99, train_loss: 0.4613, test_loss: 1.6921, test_f1: 0.5495
##################ITERATION #1 ****************************************
 epoch: 0, train_loss: 1.2870, test_loss: 1.2408, test_f1: 0.3232
 epoch: 1, train_loss: 1.1758, test_loss: 1.1738, test_f1: 0.3680
 epoch: 2, train_loss: 1.1187, test_loss: 1.1249, test_f1: 0.3948
 epoch: 3, train_loss: 1.0648, test_loss: 1.0990, test_f1: 0.4114
 epoch: 4, train_loss: 1.0332, test_loss: 0.9794, test_f1: 0.4894
 epoch: 5, train_loss: 0.9981, test_loss: 1.0871, test_f1: 0.4409
 epoch: 6, train_loss: 0.9833, test_loss: 1.0831, test_f1: 0.4413
 epoch: 7, train_loss: 0.9720, test_loss: 1.0142, test_f1: 0.4478
 epoch: 8, train_loss: 0.9453, test_loss: 1.1093, test_f1: 0.4403
 epoch: 9, train_loss: 0.9414, test_loss: 1.0627, test_f1: 0.4966
 epoch: 10, train_loss: 0.9183, test_loss: 1.0464, test_f1: 0.4630
 epoch: 11, train_loss: 0.9031, test_loss: 1.0295, test_f1: 0.4873
 epoch: 12, train_loss: 0.8880, test_loss: 1.0431, test_f1: 0.5245
 epoch: 13, train_loss: 0.8731, test_loss: 1.0735, test_f1: 0.5375
 epoch: 14, train_loss: 0.8778, test_loss: 1.1043, test_f1: 0.4989
 epoch: 15, train_loss: 0.8701, test_loss: 0.9663, test_f1: 0.5050
 epoch: 16, train_loss: 0.8685, test_loss: 1.0284, test_f1: 0.5057
 epoch: 17, train_loss: 0.8295, test_loss: 1.0374, test_f1: 0.5334
 epoch: 18, train_loss: 0.8243, test_loss: 1.0865, test_f1: 0.5286
 epoch: 19, train_loss: 0.8250, test_loss: 1.0365, test_f1: 0.5267
 epoch: 20, train_loss: 0.8235, test_loss: 1.0894, test_f1: 0.5464
 epoch: 21, train_loss: 0.8000, test_loss: 1.0494, test_f1: 0.5316
 epoch: 22, train_loss: 0.7962, test_loss: 1.0314, test_f1: 0.5306
 epoch: 23, train_loss: 0.7836, test_loss: 1.0301, test_f1: 0.5323
 epoch: 24, train_loss: 0.7914, test_loss: 1.0893, test_f1: 0.5057
 epoch: 25, train_loss: 0.7767, test_loss: 1.0588, test_f1: 0.5540
 epoch: 26, train_loss: 0.7879, test_loss: 1.1731, test_f1: 0.4978
 epoch: 27, train_loss: 0.7708, test_loss: 1.1085, test_f1: 0.5208
 epoch: 28, train_loss: 0.7529, test_loss: 1.2434, test_f1: 0.4888
 epoch: 29, train_loss: 0.7479, test_loss: 1.0621, test_f1: 0.5279
 epoch: 30, train_loss: 0.7465, test_loss: 1.1418, test_f1: 0.5398
 epoch: 31, train_loss: 0.7307, test_loss: 1.1743, test_f1: 0.5234
 epoch: 32, train_loss: 0.7338, test_loss: 1.1565, test_f1: 0.5240
 epoch: 33, train_loss: 0.7656, test_loss: 1.1886, test_f1: 0.5134
 epoch: 34, train_loss: 0.7617, test_loss: 1.0474, test_f1: 0.5423
 epoch: 35, train_loss: 0.7406, test_loss: 1.0982, test_f1: 0.5288
 epoch: 36, train_loss: 0.7159, test_loss: 1.3699, test_f1: 0.4978
 epoch: 37, train_loss: 0.7261, test_loss: 1.1542, test_f1: 0.5298
 epoch: 38, train_loss: 0.7186, test_loss: 1.0943, test_f1: 0.5450
 epoch: 39, train_loss: 0.7298, test_loss: 1.1255, test_f1: 0.5440
 epoch: 40, train_loss: 0.6920, test_loss: 1.0706, test_f1: 0.5462
 epoch: 41, train_loss: 0.6872, test_loss: 1.1245, test_f1: 0.5471
 epoch: 42, train_loss: 0.6767, test_loss: 1.2003, test_f1: 0.5295
 epoch: 43, train_loss: 0.6589, test_loss: 1.1727, test_f1: 0.5331
 epoch: 44, train_loss: 0.6723, test_loss: 1.3031, test_f1: 0.5245
 epoch: 45, train_loss: 0.6915, test_loss: 1.2072, test_f1: 0.5165
 epoch: 46, train_loss: 0.7166, test_loss: 1.1339, test_f1: 0.5414
 epoch: 47, train_loss: 0.6915, test_loss: 1.1134, test_f1: 0.5515
 epoch: 48, train_loss: 0.6936, test_loss: 1.1318, test_f1: 0.5458
 epoch: 49, train_loss: 0.6626, test_loss: 1.1655, test_f1: 0.5351
 epoch: 50, train_loss: 0.6373, test_loss: 1.2284, test_f1: 0.5479
 epoch: 51, train_loss: 0.6272, test_loss: 1.1789, test_f1: 0.5689
 epoch: 52, train_loss: 0.5839, test_loss: 1.1765, test_f1: 0.5567
 epoch: 53, train_loss: 0.6020, test_loss: 1.1879, test_f1: 0.5721
 epoch: 54, train_loss: 0.6066, test_loss: 1.2591, test_f1: 0.5349
 epoch: 55, train_loss: 0.5741, test_loss: 1.4218, test_f1: 0.5262
 epoch: 56, train_loss: 0.5715, test_loss: 1.2034, test_f1: 0.5457
 epoch: 57, train_loss: 0.5640, test_loss: 1.3287, test_f1: 0.5522
 epoch: 58, train_loss: 0.5675, test_loss: 1.3624, test_f1: 0.5254
 epoch: 59, train_loss: 0.5524, test_loss: 1.2903, test_f1: 0.5470
 epoch: 60, train_loss: 0.5538, test_loss: 1.3010, test_f1: 0.5490
 epoch: 61, train_loss: 0.5606, test_loss: 1.4570, test_f1: 0.5044
 epoch: 62, train_loss: 0.5661, test_loss: 1.3694, test_f1: 0.5558
 epoch: 63, train_loss: 0.5459, test_loss: 1.3269, test_f1: 0.5457
 epoch: 64, train_loss: 0.5603, test_loss: 1.3229, test_f1: 0.5369
 epoch: 65, train_loss: 0.5246, test_loss: 1.4577, test_f1: 0.5336
 epoch: 66, train_loss: 0.5355, test_loss: 1.3022, test_f1: 0.5524
 epoch: 67, train_loss: 0.5376, test_loss: 1.3440, test_f1: 0.5343
 epoch: 68, train_loss: 0.5416, test_loss: 1.3657, test_f1: 0.5281
 epoch: 69, train_loss: 0.5251, test_loss: 1.3536, test_f1: 0.5704
 epoch: 70, train_loss: 0.5159, test_loss: 1.3273, test_f1: 0.5447
 epoch: 71, train_loss: 0.5268, test_loss: 1.5221, test_f1: 0.5568
 epoch: 72, train_loss: 0.5545, test_loss: 1.4215, test_f1: 0.5419
 epoch: 73, train_loss: 0.5193, test_loss: 1.3024, test_f1: 0.5658
 epoch: 74, train_loss: 0.5241, test_loss: 1.2691, test_f1: 0.5457
 epoch: 75, train_loss: 0.5311, test_loss: 1.3570, test_f1: 0.5501
 epoch: 76, train_loss: 0.5029, test_loss: 1.4438, test_f1: 0.5384
 epoch: 77, train_loss: 0.5048, test_loss: 1.6103, test_f1: 0.5142
 epoch: 78, train_loss: 0.5041, test_loss: 1.3545, test_f1: 0.5503
 epoch: 79, train_loss: 0.5042, test_loss: 1.3576, test_f1: 0.5549
 epoch: 80, train_loss: 0.5050, test_loss: 1.6309, test_f1: 0.5410
 epoch: 81, train_loss: 0.4989, test_loss: 1.5716, test_f1: 0.5194
 epoch: 82, train_loss: 0.5010, test_loss: 1.3793, test_f1: 0.5666
 epoch: 83, train_loss: 0.4965, test_loss: 1.3946, test_f1: 0.5524
 epoch: 84, train_loss: 0.5061, test_loss: 1.2993, test_f1: 0.5412
 epoch: 85, train_loss: 0.4992, test_loss: 1.4157, test_f1: 0.5643
 epoch: 86, train_loss: 0.4956, test_loss: 1.4455, test_f1: 0.5525
 epoch: 87, train_loss: 0.4615, test_loss: 1.4404, test_f1: 0.5488
 epoch: 88, train_loss: 0.4888, test_loss: 1.4108, test_f1: 0.5447
 epoch: 89, train_loss: 0.4750, test_loss: 1.5695, test_f1: 0.5429
 epoch: 90, train_loss: 0.4794, test_loss: 1.3999, test_f1: 0.5475
 epoch: 91, train_loss: 0.4760, test_loss: 1.3637, test_f1: 0.5776
 epoch: 92, train_loss: 0.4898, test_loss: 1.4781, test_f1: 0.5488
 epoch: 93, train_loss: 0.4705, test_loss: 1.5532, test_f1: 0.5388
 epoch: 94, train_loss: 0.4700, test_loss: 1.4943, test_f1: 0.5750
 epoch: 95, train_loss: 0.4812, test_loss: 1.4796, test_f1: 0.5603
 epoch: 96, train_loss: 0.4825, test_loss: 1.3664, test_f1: 0.5727
 epoch: 97, train_loss: 0.4611, test_loss: 1.5927, test_f1: 0.5364
 epoch: 98, train_loss: 0.4624, test_loss: 1.3586, test_f1: 0.5792
 epoch: 99, train_loss: 0.4686, test_loss: 1.5167, test_f1: 0.5497
##################ITERATION #2 ****************************************
 epoch: 0, train_loss: 1.3695, test_loss: 1.2690, test_f1: 0.2542
 epoch: 1, train_loss: 1.2039, test_loss: 1.2038, test_f1: 0.3733
 epoch: 2, train_loss: 1.1650, test_loss: 1.1349, test_f1: 0.4384
 epoch: 3, train_loss: 1.1416, test_loss: 1.1114, test_f1: 0.4300
 epoch: 4, train_loss: 1.1095, test_loss: 1.0535, test_f1: 0.4612
 epoch: 5, train_loss: 1.0634, test_loss: 1.0530, test_f1: 0.4379
 epoch: 6, train_loss: 1.0432, test_loss: 1.0354, test_f1: 0.4575
 epoch: 7, train_loss: 1.0218, test_loss: 1.0357, test_f1: 0.4636
 epoch: 8, train_loss: 1.0088, test_loss: 1.0493, test_f1: 0.4297
 epoch: 9, train_loss: 0.9820, test_loss: 0.9720, test_f1: 0.4771
 epoch: 10, train_loss: 0.9568, test_loss: 0.9473, test_f1: 0.4979
 epoch: 11, train_loss: 0.9537, test_loss: 1.0030, test_f1: 0.4842
 epoch: 12, train_loss: 0.9618, test_loss: 0.9932, test_f1: 0.4663
 epoch: 13, train_loss: 0.9373, test_loss: 1.0477, test_f1: 0.4570
 epoch: 14, train_loss: 0.9085, test_loss: 0.9688, test_f1: 0.5087
 epoch: 15, train_loss: 0.8944, test_loss: 0.9653, test_f1: 0.5047
 epoch: 16, train_loss: 0.8801, test_loss: 1.1118, test_f1: 0.4825
 epoch: 17, train_loss: 0.8877, test_loss: 0.9317, test_f1: 0.5093
 epoch: 18, train_loss: 0.8818, test_loss: 0.9647, test_f1: 0.5117
 epoch: 19, train_loss: 0.8633, test_loss: 0.9666, test_f1: 0.5665
 epoch: 20, train_loss: 0.8567, test_loss: 1.1217, test_f1: 0.4340
 epoch: 21, train_loss: 0.8526, test_loss: 1.1528, test_f1: 0.4650
 epoch: 22, train_loss: 0.8558, test_loss: 0.9280, test_f1: 0.5467
 epoch: 23, train_loss: 0.8419, test_loss: 0.9589, test_f1: 0.5029
 epoch: 24, train_loss: 0.8318, test_loss: 1.0291, test_f1: 0.5139
 epoch: 25, train_loss: 0.8418, test_loss: 0.9902, test_f1: 0.5246
 epoch: 26, train_loss: 0.8327, test_loss: 0.9937, test_f1: 0.5389
 epoch: 27, train_loss: 0.8175, test_loss: 1.0017, test_f1: 0.5489
 epoch: 28, train_loss: 0.8054, test_loss: 1.0145, test_f1: 0.4778
 epoch: 29, train_loss: 0.8219, test_loss: 1.1168, test_f1: 0.4552
 epoch: 30, train_loss: 0.7923, test_loss: 0.9827, test_f1: 0.5110
 epoch: 31, train_loss: 0.8029, test_loss: 0.9940, test_f1: 0.5697
 epoch: 32, train_loss: 0.8210, test_loss: 1.0148, test_f1: 0.4860
 epoch: 33, train_loss: 0.8149, test_loss: 0.9572, test_f1: 0.5151
 epoch: 34, train_loss: 0.7838, test_loss: 0.9955, test_f1: 0.5337
 epoch: 35, train_loss: 0.8080, test_loss: 0.9813, test_f1: 0.5377
 epoch: 36, train_loss: 0.7908, test_loss: 1.0231, test_f1: 0.5011
 epoch: 37, train_loss: 0.7646, test_loss: 0.9954, test_f1: 0.5510
 epoch: 38, train_loss: 0.7749, test_loss: 0.9487, test_f1: 0.5411
 epoch: 39, train_loss: 0.7704, test_loss: 0.9839, test_f1: 0.5081
 epoch: 40, train_loss: 0.7601, test_loss: 1.0018, test_f1: 0.5146
 epoch: 41, train_loss: 0.7603, test_loss: 0.9645, test_f1: 0.5455
 epoch: 42, train_loss: 0.7646, test_loss: 0.9926, test_f1: 0.5303
 epoch: 43, train_loss: 0.7517, test_loss: 1.3121, test_f1: 0.4982
 epoch: 44, train_loss: 0.7858, test_loss: 1.0553, test_f1: 0.5154
 epoch: 45, train_loss: 0.7636, test_loss: 1.0347, test_f1: 0.5224
 epoch: 46, train_loss: 0.7478, test_loss: 1.0534, test_f1: 0.5510
 epoch: 47, train_loss: 0.7466, test_loss: 0.9985, test_f1: 0.5538
 epoch: 48, train_loss: 0.7400, test_loss: 1.0631, test_f1: 0.5254
 epoch: 49, train_loss: 0.7143, test_loss: 1.0308, test_f1: 0.5598
 epoch: 50, train_loss: 0.7280, test_loss: 1.0393, test_f1: 0.5366
 epoch: 51, train_loss: 0.7122, test_loss: 1.0542, test_f1: 0.5099
 epoch: 52, train_loss: 0.6732, test_loss: 1.0484, test_f1: 0.5348
 epoch: 53, train_loss: 0.6611, test_loss: 1.0876, test_f1: 0.5198
 epoch: 54, train_loss: 0.6590, test_loss: 1.0776, test_f1: 0.5627
 epoch: 55, train_loss: 0.6534, test_loss: 1.0334, test_f1: 0.5516
 epoch: 56, train_loss: 0.6515, test_loss: 1.0740, test_f1: 0.5219
 epoch: 57, train_loss: 0.6406, test_loss: 1.1444, test_f1: 0.5217
 epoch: 58, train_loss: 0.6543, test_loss: 1.0680, test_f1: 0.5378
 epoch: 59, train_loss: 0.6413, test_loss: 1.0973, test_f1: 0.5700
 epoch: 60, train_loss: 0.6338, test_loss: 1.1325, test_f1: 0.5293
 epoch: 61, train_loss: 0.6257, test_loss: 1.1997, test_f1: 0.4944
 epoch: 62, train_loss: 0.6261, test_loss: 1.1095, test_f1: 0.5518
 epoch: 63, train_loss: 0.6145, test_loss: 1.0985, test_f1: 0.5266
 epoch: 64, train_loss: 0.6230, test_loss: 1.0780, test_f1: 0.5761
 epoch: 65, train_loss: 0.6149, test_loss: 1.1395, test_f1: 0.5638
 epoch: 66, train_loss: 0.6064, test_loss: 1.2270, test_f1: 0.5215
 epoch: 67, train_loss: 0.6306, test_loss: 1.2315, test_f1: 0.5500
 epoch: 68, train_loss: 0.6459, test_loss: 1.1371, test_f1: 0.5448
 epoch: 69, train_loss: 0.6205, test_loss: 1.1335, test_f1: 0.5224
 epoch: 70, train_loss: 0.6033, test_loss: 1.1814, test_f1: 0.5464
 epoch: 71, train_loss: 0.6262, test_loss: 1.2275, test_f1: 0.5301
 epoch: 72, train_loss: 0.6087, test_loss: 1.1440, test_f1: 0.5549
 epoch: 73, train_loss: 0.5874, test_loss: 1.2281, test_f1: 0.5343
 epoch: 74, train_loss: 0.6027, test_loss: 1.1491, test_f1: 0.5480
 epoch: 75, train_loss: 0.5809, test_loss: 1.2187, test_f1: 0.5267
 epoch: 76, train_loss: 0.5895, test_loss: 1.2282, test_f1: 0.5406
 epoch: 77, train_loss: 0.5753, test_loss: 1.2366, test_f1: 0.5299
 epoch: 78, train_loss: 0.5783, test_loss: 1.2712, test_f1: 0.5599
 epoch: 79, train_loss: 0.6037, test_loss: 1.1651, test_f1: 0.5669
 epoch: 80, train_loss: 0.5778, test_loss: 1.1890, test_f1: 0.5697
 epoch: 81, train_loss: 0.5872, test_loss: 1.1950, test_f1: 0.5694
 epoch: 82, train_loss: 0.5853, test_loss: 1.2057, test_f1: 0.5432
 epoch: 83, train_loss: 0.5875, test_loss: 1.2362, test_f1: 0.5510
 epoch: 84, train_loss: 0.5528, test_loss: 1.1902, test_f1: 0.5573
 epoch: 85, train_loss: 0.5575, test_loss: 1.2315, test_f1: 0.5503
 epoch: 86, train_loss: 0.5635, test_loss: 1.1800, test_f1: 0.5540
 epoch: 87, train_loss: 0.5486, test_loss: 1.1799, test_f1: 0.5595
 epoch: 88, train_loss: 0.5402, test_loss: 1.2257, test_f1: 0.5436
 epoch: 89, train_loss: 0.5617, test_loss: 1.2650, test_f1: 0.5508
 epoch: 90, train_loss: 0.5680, test_loss: 1.3453, test_f1: 0.5166
 epoch: 91, train_loss: 0.5449, test_loss: 1.2634, test_f1: 0.5286
 epoch: 92, train_loss: 0.5586, test_loss: 1.3342, test_f1: 0.5402
 epoch: 93, train_loss: 0.5614, test_loss: 1.2383, test_f1: 0.5402
 epoch: 94, train_loss: 0.5283, test_loss: 1.1970, test_f1: 0.5613
 epoch: 95, train_loss: 0.5246, test_loss: 1.3147, test_f1: 0.5216
 epoch: 96, train_loss: 0.5413, test_loss: 1.3016, test_f1: 0.5321
 epoch: 97, train_loss: 0.5334, test_loss: 1.2514, test_f1: 0.5280
 epoch: 98, train_loss: 0.5297, test_loss: 1.2456, test_f1: 0.5583
 epoch: 99, train_loss: 0.5508, test_loss: 1.2252, test_f1: 0.5625
##################ITERATION #3 ****************************************
 epoch: 0, train_loss: 1.3855, test_loss: 1.3128, test_f1: 0.2553
 epoch: 1, train_loss: 1.1917, test_loss: 1.1642, test_f1: 0.4066
 epoch: 2, train_loss: 1.1419, test_loss: 1.0914, test_f1: 0.4544
 epoch: 3, train_loss: 1.0980, test_loss: 1.0074, test_f1: 0.5021
 epoch: 4, train_loss: 1.0548, test_loss: 1.0948, test_f1: 0.4438
 epoch: 5, train_loss: 1.0299, test_loss: 0.9627, test_f1: 0.5174
 epoch: 6, train_loss: 1.0113, test_loss: 0.9488, test_f1: 0.5176
 epoch: 7, train_loss: 0.9886, test_loss: 0.9770, test_f1: 0.4746
 epoch: 8, train_loss: 0.9613, test_loss: 0.9543, test_f1: 0.5078
 epoch: 9, train_loss: 0.9478, test_loss: 0.9567, test_f1: 0.4676
 epoch: 10, train_loss: 0.9300, test_loss: 1.0107, test_f1: 0.4538
 epoch: 11, train_loss: 0.9185, test_loss: 1.0511, test_f1: 0.4735
 epoch: 12, train_loss: 0.9191, test_loss: 0.9363, test_f1: 0.5107
 epoch: 13, train_loss: 0.9042, test_loss: 1.0041, test_f1: 0.4529
 epoch: 14, train_loss: 0.8903, test_loss: 0.9946, test_f1: 0.4932
 epoch: 15, train_loss: 0.8936, test_loss: 1.0470, test_f1: 0.4809
 epoch: 16, train_loss: 0.8787, test_loss: 0.9860, test_f1: 0.4957
 epoch: 17, train_loss: 0.8655, test_loss: 1.0047, test_f1: 0.4558
 epoch: 18, train_loss: 0.8552, test_loss: 1.0554, test_f1: 0.5322
 epoch: 19, train_loss: 0.8481, test_loss: 0.9701, test_f1: 0.4794
 epoch: 20, train_loss: 0.8322, test_loss: 1.0329, test_f1: 0.4925
 epoch: 21, train_loss: 0.8345, test_loss: 0.9933, test_f1: 0.5057
 epoch: 22, train_loss: 0.8352, test_loss: 1.0210, test_f1: 0.4842
 epoch: 23, train_loss: 0.8380, test_loss: 0.9999, test_f1: 0.4902
 epoch: 24, train_loss: 0.8288, test_loss: 1.0372, test_f1: 0.5044
 epoch: 25, train_loss: 0.8227, test_loss: 1.0205, test_f1: 0.5372
 epoch: 26, train_loss: 0.8028, test_loss: 1.0323, test_f1: 0.4927
 epoch: 27, train_loss: 0.7948, test_loss: 0.9971, test_f1: 0.5296
 epoch: 28, train_loss: 0.8072, test_loss: 0.9524, test_f1: 0.5032
 epoch: 29, train_loss: 0.8079, test_loss: 1.0378, test_f1: 0.5069
 epoch: 30, train_loss: 0.7991, test_loss: 1.1047, test_f1: 0.4626
 epoch: 31, train_loss: 0.7860, test_loss: 1.0207, test_f1: 0.5225
 epoch: 32, train_loss: 0.7936, test_loss: 1.0113, test_f1: 0.5122
 epoch: 33, train_loss: 0.7875, test_loss: 1.0254, test_f1: 0.5186
 epoch: 34, train_loss: 0.7734, test_loss: 1.0636, test_f1: 0.5168
 epoch: 35, train_loss: 0.7624, test_loss: 1.1218, test_f1: 0.4919
 epoch: 36, train_loss: 0.7670, test_loss: 1.0040, test_f1: 0.5373
 epoch: 37, train_loss: 0.7593, test_loss: 1.0573, test_f1: 0.4965
 epoch: 38, train_loss: 0.7425, test_loss: 1.1420, test_f1: 0.4855
 epoch: 39, train_loss: 0.7563, test_loss: 1.0120, test_f1: 0.5471
 epoch: 40, train_loss: 0.7355, test_loss: 1.1000, test_f1: 0.5291
 epoch: 41, train_loss: 0.7398, test_loss: 1.0727, test_f1: 0.5340
 epoch: 42, train_loss: 0.7273, test_loss: 1.0913, test_f1: 0.5265
 epoch: 43, train_loss: 0.7192, test_loss: 1.2552, test_f1: 0.4757
 epoch: 44, train_loss: 0.7244, test_loss: 1.0579, test_f1: 0.5198
 epoch: 45, train_loss: 0.7512, test_loss: 1.0825, test_f1: 0.5182
 epoch: 46, train_loss: 0.7314, test_loss: 1.0950, test_f1: 0.5215
 epoch: 47, train_loss: 0.7143, test_loss: 1.0642, test_f1: 0.5590
 epoch: 48, train_loss: 0.7530, test_loss: 1.2148, test_f1: 0.4783
 epoch: 49, train_loss: 0.7274, test_loss: 1.1669, test_f1: 0.4757
 epoch: 50, train_loss: 0.7080, test_loss: 1.0882, test_f1: 0.5182
 epoch: 51, train_loss: 0.6708, test_loss: 1.1148, test_f1: 0.5495
 epoch: 52, train_loss: 0.6603, test_loss: 1.3988, test_f1: 0.4704
 epoch: 53, train_loss: 0.6541, test_loss: 1.1262, test_f1: 0.5521
 epoch: 54, train_loss: 0.6346, test_loss: 1.2153, test_f1: 0.5404
 epoch: 55, train_loss: 0.6344, test_loss: 1.1869, test_f1: 0.5351
 epoch: 56, train_loss: 0.6401, test_loss: 1.2952, test_f1: 0.5310
 epoch: 57, train_loss: 0.6286, test_loss: 1.2262, test_f1: 0.5215
 epoch: 58, train_loss: 0.6246, test_loss: 1.2055, test_f1: 0.5431
 epoch: 59, train_loss: 0.6368, test_loss: 1.1753, test_f1: 0.5357
 epoch: 60, train_loss: 0.6269, test_loss: 1.2160, test_f1: 0.5444
 epoch: 61, train_loss: 0.6308, test_loss: 1.4489, test_f1: 0.4924
 epoch: 62, train_loss: 0.6248, test_loss: 1.3253, test_f1: 0.5213
 epoch: 63, train_loss: 0.6162, test_loss: 1.2850, test_f1: 0.5091
 epoch: 64, train_loss: 0.6170, test_loss: 1.3003, test_f1: 0.4963
 epoch: 65, train_loss: 0.6214, test_loss: 1.4886, test_f1: 0.5169
 epoch: 66, train_loss: 0.5952, test_loss: 1.3882, test_f1: 0.5073
 epoch: 67, train_loss: 0.5999, test_loss: 1.2246, test_f1: 0.5682
 epoch: 68, train_loss: 0.6000, test_loss: 1.2501, test_f1: 0.5525
 epoch: 69, train_loss: 0.5901, test_loss: 1.2700, test_f1: 0.5319
 epoch: 70, train_loss: 0.5965, test_loss: 1.4103, test_f1: 0.5117
 epoch: 71, train_loss: 0.5940, test_loss: 1.3332, test_f1: 0.5244
 epoch: 72, train_loss: 0.5864, test_loss: 1.1819, test_f1: 0.5458
 epoch: 73, train_loss: 0.5720, test_loss: 1.2547, test_f1: 0.5516
 epoch: 74, train_loss: 0.5827, test_loss: 1.5427, test_f1: 0.5278
 epoch: 75, train_loss: 0.5787, test_loss: 1.6109, test_f1: 0.4924
 epoch: 76, train_loss: 0.5939, test_loss: 1.2551, test_f1: 0.5936
 epoch: 77, train_loss: 0.5961, test_loss: 1.4506, test_f1: 0.4905
 epoch: 78, train_loss: 0.5770, test_loss: 1.4953, test_f1: 0.5093
 epoch: 79, train_loss: 0.5997, test_loss: 1.5094, test_f1: 0.5081
 epoch: 80, train_loss: 0.5826, test_loss: 1.2419, test_f1: 0.5557
 epoch: 81, train_loss: 0.5832, test_loss: 1.2256, test_f1: 0.5297
 epoch: 82, train_loss: 0.5586, test_loss: 1.2852, test_f1: 0.5612
 epoch: 83, train_loss: 0.5646, test_loss: 1.3172, test_f1: 0.5447
 epoch: 84, train_loss: 0.5527, test_loss: 1.3927, test_f1: 0.5541
 epoch: 85, train_loss: 0.5619, test_loss: 1.3134, test_f1: 0.5489
 epoch: 86, train_loss: 0.5658, test_loss: 1.6768, test_f1: 0.4849
 epoch: 87, train_loss: 0.5515, test_loss: 1.6571, test_f1: 0.5031
 epoch: 88, train_loss: 0.5544, test_loss: 1.5377, test_f1: 0.5157
 epoch: 89, train_loss: 0.5469, test_loss: 1.1643, test_f1: 0.5499
 epoch: 90, train_loss: 0.5452, test_loss: 1.5435, test_f1: 0.4916
 epoch: 91, train_loss: 0.5432, test_loss: 1.8033, test_f1: 0.5050
 epoch: 92, train_loss: 0.5591, test_loss: 1.9001, test_f1: 0.4684
 epoch: 93, train_loss: 0.5505, test_loss: 1.3568, test_f1: 0.5715
 epoch: 94, train_loss: 0.5710, test_loss: 1.3303, test_f1: 0.5553
 epoch: 95, train_loss: 0.5717, test_loss: 1.3503, test_f1: 0.5089
 epoch: 96, train_loss: 0.5445, test_loss: 1.3423, test_f1: 0.5248
 epoch: 97, train_loss: 0.5428, test_loss: 1.4036, test_f1: 0.5474
 epoch: 98, train_loss: 0.5451, test_loss: 1.3328, test_f1: 0.5245
 epoch: 99, train_loss: 0.5250, test_loss: 1.5305, test_f1: 0.5145
##################ITERATION #4 ****************************************
 epoch: 0, train_loss: 1.3670, test_loss: 1.2624, test_f1: 0.2580
 epoch: 1, train_loss: 1.1709, test_loss: 1.1716, test_f1: 0.3020
 epoch: 2, train_loss: 1.1260, test_loss: 1.0858, test_f1: 0.4411
 epoch: 3, train_loss: 1.0864, test_loss: 1.0048, test_f1: 0.4632
 epoch: 4, train_loss: 1.0557, test_loss: 1.0528, test_f1: 0.4374
 epoch: 5, train_loss: 1.0174, test_loss: 0.9765, test_f1: 0.4772
 epoch: 6, train_loss: 1.0073, test_loss: 1.1193, test_f1: 0.4474
 epoch: 7, train_loss: 0.9840, test_loss: 0.9440, test_f1: 0.4676
 epoch: 8, train_loss: 0.9781, test_loss: 1.1787, test_f1: 0.4094
 epoch: 9, train_loss: 0.9545, test_loss: 1.0096, test_f1: 0.4715
 epoch: 10, train_loss: 0.9448, test_loss: 0.8892, test_f1: 0.5056
 epoch: 11, train_loss: 0.9222, test_loss: 0.9016, test_f1: 0.4920
 epoch: 12, train_loss: 0.9169, test_loss: 0.9646, test_f1: 0.5052
 epoch: 13, train_loss: 0.9070, test_loss: 0.9514, test_f1: 0.5108
 epoch: 14, train_loss: 0.8973, test_loss: 0.9149, test_f1: 0.5114
 epoch: 15, train_loss: 0.8881, test_loss: 0.9358, test_f1: 0.4972
 epoch: 16, train_loss: 0.8838, test_loss: 0.9814, test_f1: 0.5016
 epoch: 17, train_loss: 0.8728, test_loss: 0.9265, test_f1: 0.5312
 epoch: 18, train_loss: 0.8507, test_loss: 0.9402, test_f1: 0.5450
 epoch: 19, train_loss: 0.8408, test_loss: 0.9949, test_f1: 0.5052
 epoch: 20, train_loss: 0.8401, test_loss: 1.0455, test_f1: 0.5068
 epoch: 21, train_loss: 0.8301, test_loss: 1.0686, test_f1: 0.4893
 epoch: 22, train_loss: 0.8254, test_loss: 0.9759, test_f1: 0.5282
 epoch: 23, train_loss: 0.8273, test_loss: 1.0250, test_f1: 0.5009
 epoch: 24, train_loss: 0.8051, test_loss: 1.0689, test_f1: 0.4988
 epoch: 25, train_loss: 0.7904, test_loss: 1.0106, test_f1: 0.5339
 epoch: 26, train_loss: 0.8041, test_loss: 1.0417, test_f1: 0.5073
 epoch: 27, train_loss: 0.7922, test_loss: 1.0989, test_f1: 0.5368
 epoch: 28, train_loss: 0.7853, test_loss: 1.0310, test_f1: 0.5346
 epoch: 29, train_loss: 0.7882, test_loss: 1.0275, test_f1: 0.5575
 epoch: 30, train_loss: 0.7772, test_loss: 1.1256, test_f1: 0.5116
 epoch: 31, train_loss: 0.7855, test_loss: 1.1090, test_f1: 0.5193
 epoch: 32, train_loss: 0.7773, test_loss: 1.2276, test_f1: 0.4812
 epoch: 33, train_loss: 0.7626, test_loss: 1.1192, test_f1: 0.5029
 epoch: 34, train_loss: 0.7539, test_loss: 1.0714, test_f1: 0.5445
 epoch: 35, train_loss: 0.7404, test_loss: 1.1521, test_f1: 0.5220
 epoch: 36, train_loss: 0.7448, test_loss: 1.0028, test_f1: 0.5442
 epoch: 37, train_loss: 0.7536, test_loss: 1.0605, test_f1: 0.5504
 epoch: 38, train_loss: 0.7503, test_loss: 1.1314, test_f1: 0.5229
 epoch: 39, train_loss: 0.7179, test_loss: 1.1306, test_f1: 0.5184
 epoch: 40, train_loss: 0.7076, test_loss: 1.2012, test_f1: 0.5278
 epoch: 41, train_loss: 0.7033, test_loss: 1.2471, test_f1: 0.4891
 epoch: 42, train_loss: 0.7319, test_loss: 1.1545, test_f1: 0.5579
 epoch: 43, train_loss: 0.7082, test_loss: 1.0862, test_f1: 0.5617
 epoch: 44, train_loss: 0.7024, test_loss: 1.1492, test_f1: 0.5200
 epoch: 45, train_loss: 0.7148, test_loss: 1.1144, test_f1: 0.5429
 epoch: 46, train_loss: 0.7001, test_loss: 1.1256, test_f1: 0.5383
 epoch: 47, train_loss: 0.6938, test_loss: 1.1547, test_f1: 0.5909
 epoch: 48, train_loss: 0.6784, test_loss: 1.2513, test_f1: 0.5258
 epoch: 49, train_loss: 0.7013, test_loss: 1.1612, test_f1: 0.5409
 epoch: 50, train_loss: 0.7085, test_loss: 1.1135, test_f1: 0.5462
 epoch: 51, train_loss: 0.6761, test_loss: 1.0981, test_f1: 0.5492
 epoch: 52, train_loss: 0.6463, test_loss: 1.2628, test_f1: 0.5453
 epoch: 53, train_loss: 0.6299, test_loss: 1.2823, test_f1: 0.5097
 epoch: 54, train_loss: 0.6268, test_loss: 1.2384, test_f1: 0.5640
 epoch: 55, train_loss: 0.6131, test_loss: 1.2313, test_f1: 0.5494
 epoch: 56, train_loss: 0.5957, test_loss: 1.2274, test_f1: 0.5457
 epoch: 57, train_loss: 0.6082, test_loss: 1.3306, test_f1: 0.5293
 epoch: 58, train_loss: 0.5908, test_loss: 1.2452, test_f1: 0.5645
 epoch: 59, train_loss: 0.6028, test_loss: 1.2708, test_f1: 0.5428
 epoch: 60, train_loss: 0.5892, test_loss: 1.4074, test_f1: 0.5290
 epoch: 61, train_loss: 0.6038, test_loss: 1.2985, test_f1: 0.5296
 epoch: 62, train_loss: 0.5979, test_loss: 1.3540, test_f1: 0.5280
 epoch: 63, train_loss: 0.5762, test_loss: 1.3128, test_f1: 0.5634
 epoch: 64, train_loss: 0.5967, test_loss: 1.3667, test_f1: 0.5491
 epoch: 65, train_loss: 0.5960, test_loss: 1.3632, test_f1: 0.5402
 epoch: 66, train_loss: 0.5723, test_loss: 1.3495, test_f1: 0.5522
 epoch: 67, train_loss: 0.5576, test_loss: 1.3137, test_f1: 0.5644
 epoch: 68, train_loss: 0.5762, test_loss: 1.3283, test_f1: 0.5715
 epoch: 69, train_loss: 0.5747, test_loss: 1.3979, test_f1: 0.5571
 epoch: 70, train_loss: 0.5801, test_loss: 1.3773, test_f1: 0.5470
 epoch: 71, train_loss: 0.5800, test_loss: 1.3408, test_f1: 0.5712
 epoch: 72, train_loss: 0.5588, test_loss: 1.2328, test_f1: 0.5684
 epoch: 73, train_loss: 0.5800, test_loss: 1.3899, test_f1: 0.5650
 epoch: 74, train_loss: 0.6148, test_loss: 1.3628, test_f1: 0.5221
 epoch: 75, train_loss: 0.6359, test_loss: 1.3365, test_f1: 0.5565
 epoch: 76, train_loss: 0.6040, test_loss: 1.2825, test_f1: 0.5514
 epoch: 77, train_loss: 0.5851, test_loss: 1.2890, test_f1: 0.5681
 epoch: 78, train_loss: 0.5827, test_loss: 1.3084, test_f1: 0.5505
 epoch: 79, train_loss: 0.5581, test_loss: 1.3588, test_f1: 0.5589
 epoch: 80, train_loss: 0.5468, test_loss: 1.3927, test_f1: 0.5266
 epoch: 81, train_loss: 0.5413, test_loss: 1.3920, test_f1: 0.5375
 epoch: 82, train_loss: 0.5426, test_loss: 1.5200, test_f1: 0.5474
 epoch: 83, train_loss: 0.5541, test_loss: 1.3344, test_f1: 0.5601
 epoch: 84, train_loss: 0.5266, test_loss: 1.4243, test_f1: 0.5458
 epoch: 85, train_loss: 0.5343, test_loss: 1.4578, test_f1: 0.5464
 epoch: 86, train_loss: 0.5226, test_loss: 1.5031, test_f1: 0.5355
 epoch: 87, train_loss: 0.5196, test_loss: 1.5617, test_f1: 0.5300
 epoch: 88, train_loss: 0.5249, test_loss: 1.4354, test_f1: 0.5596
 epoch: 89, train_loss: 0.5197, test_loss: 1.5134, test_f1: 0.5602
 epoch: 90, train_loss: 0.5129, test_loss: 1.3707, test_f1: 0.5795
 epoch: 91, train_loss: 0.5232, test_loss: 1.4038, test_f1: 0.5646
 epoch: 92, train_loss: 0.5204, test_loss: 1.3605, test_f1: 0.5870
 epoch: 93, train_loss: 0.5304, test_loss: 1.7649, test_f1: 0.4979
 epoch: 94, train_loss: 0.5257, test_loss: 1.5938, test_f1: 0.5425
 epoch: 95, train_loss: 0.5126, test_loss: 1.5662, test_f1: 0.5465
 epoch: 96, train_loss: 0.4935, test_loss: 1.6009, test_f1: 0.5289
 epoch: 97, train_loss: 0.5000, test_loss: 1.7109, test_f1: 0.5268
 epoch: 98, train_loss: 0.4874, test_loss: 1.4638, test_f1: 0.5557
 epoch: 99, train_loss: 0.4951, test_loss: 1.4271, test_f1: 0.5813
##################ITERATION #5 ****************************************
 epoch: 0, train_loss: 1.3831, test_loss: 1.2583, test_f1: 0.2274
 epoch: 1, train_loss: 1.1965, test_loss: 1.1721, test_f1: 0.3430
 epoch: 2, train_loss: 1.1412, test_loss: 1.0949, test_f1: 0.4646
 epoch: 3, train_loss: 1.1019, test_loss: 1.0374, test_f1: 0.4514
 epoch: 4, train_loss: 1.0583, test_loss: 1.0877, test_f1: 0.4103
 epoch: 5, train_loss: 1.0441, test_loss: 1.0286, test_f1: 0.4559
 epoch: 6, train_loss: 1.0100, test_loss: 0.9797, test_f1: 0.4690
 epoch: 7, train_loss: 0.9783, test_loss: 1.0674, test_f1: 0.4670
 epoch: 8, train_loss: 0.9781, test_loss: 1.0035, test_f1: 0.5041
 epoch: 9, train_loss: 0.9517, test_loss: 1.0767, test_f1: 0.4639
 epoch: 10, train_loss: 0.9633, test_loss: 0.9968, test_f1: 0.4883
 epoch: 11, train_loss: 0.9244, test_loss: 1.0416, test_f1: 0.4477
 epoch: 12, train_loss: 0.9037, test_loss: 0.9582, test_f1: 0.5292
 epoch: 13, train_loss: 0.8937, test_loss: 0.9370, test_f1: 0.5251
 epoch: 14, train_loss: 0.8934, test_loss: 1.0421, test_f1: 0.4877
 epoch: 15, train_loss: 0.8872, test_loss: 1.0167, test_f1: 0.5142
 epoch: 16, train_loss: 0.8701, test_loss: 0.9718, test_f1: 0.4820
 epoch: 17, train_loss: 0.8413, test_loss: 0.9595, test_f1: 0.5206
 epoch: 18, train_loss: 0.8354, test_loss: 1.0976, test_f1: 0.5324
 epoch: 19, train_loss: 0.8389, test_loss: 1.1061, test_f1: 0.5015
 epoch: 20, train_loss: 0.8603, test_loss: 1.0136, test_f1: 0.4984
 epoch: 21, train_loss: 0.8331, test_loss: 0.9947, test_f1: 0.5369
 epoch: 22, train_loss: 0.8176, test_loss: 0.9541, test_f1: 0.5717
 epoch: 23, train_loss: 0.8092, test_loss: 1.0494, test_f1: 0.5524
 epoch: 24, train_loss: 0.8201, test_loss: 1.0040, test_f1: 0.5196
 epoch: 25, train_loss: 0.8044, test_loss: 1.0047, test_f1: 0.5128
 epoch: 26, train_loss: 0.7792, test_loss: 1.1246, test_f1: 0.5233
 epoch: 27, train_loss: 0.7900, test_loss: 1.0495, test_f1: 0.5073
 epoch: 28, train_loss: 0.7712, test_loss: 1.0803, test_f1: 0.5326
 epoch: 29, train_loss: 0.7757, test_loss: 1.1484, test_f1: 0.5196
 epoch: 30, train_loss: 0.8063, test_loss: 1.0695, test_f1: 0.5153
 epoch: 31, train_loss: 0.7831, test_loss: 0.9706, test_f1: 0.5265
 epoch: 32, train_loss: 0.7773, test_loss: 0.9607, test_f1: 0.5622
 epoch: 33, train_loss: 0.7901, test_loss: 1.3623, test_f1: 0.4807
 epoch: 34, train_loss: 0.7558, test_loss: 1.0218, test_f1: 0.5380
 epoch: 35, train_loss: 0.7355, test_loss: 1.0477, test_f1: 0.5541
 epoch: 36, train_loss: 0.7421, test_loss: 1.0759, test_f1: 0.5410
 epoch: 37, train_loss: 0.7386, test_loss: 1.0954, test_f1: 0.5466
 epoch: 38, train_loss: 0.7498, test_loss: 1.0534, test_f1: 0.5322
 epoch: 39, train_loss: 0.7189, test_loss: 1.1731, test_f1: 0.5202
 epoch: 40, train_loss: 0.7178, test_loss: 1.1107, test_f1: 0.5468
 epoch: 41, train_loss: 0.7361, test_loss: 1.0862, test_f1: 0.5279
 epoch: 42, train_loss: 0.7163, test_loss: 1.1576, test_f1: 0.5103
 epoch: 43, train_loss: 0.7163, test_loss: 1.1242, test_f1: 0.5377
 epoch: 44, train_loss: 0.6959, test_loss: 1.2099, test_f1: 0.5240
 epoch: 45, train_loss: 0.7038, test_loss: 1.0642, test_f1: 0.5632
 epoch: 46, train_loss: 0.6679, test_loss: 1.1252, test_f1: 0.5397
 epoch: 47, train_loss: 0.6744, test_loss: 1.1044, test_f1: 0.5527
 epoch: 48, train_loss: 0.6736, test_loss: 1.2404, test_f1: 0.5605
 epoch: 49, train_loss: 0.6728, test_loss: 1.3768, test_f1: 0.4869
 epoch: 50, train_loss: 0.6770, test_loss: 1.2360, test_f1: 0.5268
 epoch: 51, train_loss: 0.6473, test_loss: 1.1996, test_f1: 0.5723
 epoch: 52, train_loss: 0.6274, test_loss: 1.2177, test_f1: 0.5410
 epoch: 53, train_loss: 0.6090, test_loss: 1.2017, test_f1: 0.5327
 epoch: 54, train_loss: 0.5939, test_loss: 1.1839, test_f1: 0.5754
 epoch: 55, train_loss: 0.5831, test_loss: 1.2759, test_f1: 0.5406
 epoch: 56, train_loss: 0.5670, test_loss: 1.4341, test_f1: 0.4943
 epoch: 57, train_loss: 0.5678, test_loss: 1.3098, test_f1: 0.5407
 epoch: 58, train_loss: 0.5638, test_loss: 1.2741, test_f1: 0.5491
 epoch: 59, train_loss: 0.5546, test_loss: 1.4352, test_f1: 0.5114
 epoch: 60, train_loss: 0.5671, test_loss: 1.5093, test_f1: 0.5150
 epoch: 61, train_loss: 0.5809, test_loss: 1.4673, test_f1: 0.5418
 epoch: 62, train_loss: 0.5603, test_loss: 1.2950, test_f1: 0.5363
 epoch: 63, train_loss: 0.5624, test_loss: 1.3556, test_f1: 0.5236
 epoch: 64, train_loss: 0.5867, test_loss: 1.4327, test_f1: 0.5109
 epoch: 65, train_loss: 0.5783, test_loss: 1.2925, test_f1: 0.5286
 epoch: 66, train_loss: 0.5523, test_loss: 1.4409, test_f1: 0.5373
 epoch: 67, train_loss: 0.5559, test_loss: 1.4664, test_f1: 0.5190
 epoch: 68, train_loss: 0.5371, test_loss: 1.3493, test_f1: 0.5579
 epoch: 69, train_loss: 0.5299, test_loss: 1.5462, test_f1: 0.5511
 epoch: 70, train_loss: 0.5350, test_loss: 1.5386, test_f1: 0.5380
 epoch: 71, train_loss: 0.5474, test_loss: 1.5002, test_f1: 0.5112
 epoch: 72, train_loss: 0.5418, test_loss: 1.4227, test_f1: 0.5494
 epoch: 73, train_loss: 0.5448, test_loss: 1.6021, test_f1: 0.5459
 epoch: 74, train_loss: 0.5420, test_loss: 1.6683, test_f1: 0.5268
 epoch: 75, train_loss: 0.5248, test_loss: 1.5335, test_f1: 0.5421
 epoch: 76, train_loss: 0.5110, test_loss: 1.5134, test_f1: 0.5313
 epoch: 77, train_loss: 0.5038, test_loss: 1.5620, test_f1: 0.5265
 epoch: 78, train_loss: 0.5288, test_loss: 1.2581, test_f1: 0.5561
 epoch: 79, train_loss: 0.5129, test_loss: 1.4649, test_f1: 0.5505
 epoch: 80, train_loss: 0.5113, test_loss: 1.6296, test_f1: 0.5324
 epoch: 81, train_loss: 0.4932, test_loss: 1.5030, test_f1: 0.5383
 epoch: 82, train_loss: 0.5244, test_loss: 1.4880, test_f1: 0.5397
 epoch: 83, train_loss: 0.5154, test_loss: 1.8442, test_f1: 0.5291
 epoch: 84, train_loss: 0.4953, test_loss: 1.3479, test_f1: 0.5642
 epoch: 85, train_loss: 0.5053, test_loss: 1.5351, test_f1: 0.5526
 epoch: 86, train_loss: 0.5019, test_loss: 1.5961, test_f1: 0.5428
 epoch: 87, train_loss: 0.4904, test_loss: 1.4043, test_f1: 0.5567
 epoch: 88, train_loss: 0.4847, test_loss: 1.6968, test_f1: 0.5384
 epoch: 89, train_loss: 0.4863, test_loss: 1.6373, test_f1: 0.5516
 epoch: 90, train_loss: 0.4792, test_loss: 1.7041, test_f1: 0.5321
 epoch: 91, train_loss: 0.5029, test_loss: 1.6890, test_f1: 0.5134
 epoch: 92, train_loss: 0.4999, test_loss: 1.6572, test_f1: 0.5519
 epoch: 93, train_loss: 0.4803, test_loss: 1.6833, test_f1: 0.5602
 epoch: 94, train_loss: 0.4542, test_loss: 1.6280, test_f1: 0.5370
 epoch: 95, train_loss: 0.4511, test_loss: 1.6370, test_f1: 0.5568
 epoch: 96, train_loss: 0.4594, test_loss: 1.7761, test_f1: 0.5316
 epoch: 97, train_loss: 0.4446, test_loss: 1.6659, test_f1: 0.5574
 epoch: 98, train_loss: 0.4695, test_loss: 1.5326, test_f1: 0.5527
 epoch: 99, train_loss: 0.4846, test_loss: 1.8035, test_f1: 0.5134
##################ITERATION #6 ****************************************
 epoch: 0, train_loss: 1.3634, test_loss: 1.3049, test_f1: 0.2274
 epoch: 1, train_loss: 1.1965, test_loss: 1.1744, test_f1: 0.3582
 epoch: 2, train_loss: 1.1610, test_loss: 1.1343, test_f1: 0.4263
 epoch: 3, train_loss: 1.1290, test_loss: 1.1154, test_f1: 0.4303
 epoch: 4, train_loss: 1.0964, test_loss: 1.0264, test_f1: 0.4358
 epoch: 5, train_loss: 1.0607, test_loss: 1.0824, test_f1: 0.4470
 epoch: 6, train_loss: 1.0133, test_loss: 1.0803, test_f1: 0.4154
 epoch: 7, train_loss: 1.0071, test_loss: 1.0261, test_f1: 0.4114
 epoch: 8, train_loss: 0.9763, test_loss: 0.9639, test_f1: 0.4763
 epoch: 9, train_loss: 0.9715, test_loss: 0.9459, test_f1: 0.4707
 epoch: 10, train_loss: 0.9556, test_loss: 0.9977, test_f1: 0.4595
 epoch: 11, train_loss: 0.9435, test_loss: 1.0289, test_f1: 0.4798
 epoch: 12, train_loss: 0.9279, test_loss: 1.0326, test_f1: 0.4581
 epoch: 13, train_loss: 0.9047, test_loss: 0.9962, test_f1: 0.4753
 epoch: 14, train_loss: 0.9031, test_loss: 1.0928, test_f1: 0.4534
 epoch: 15, train_loss: 0.8951, test_loss: 0.9752, test_f1: 0.5194
 epoch: 16, train_loss: 0.9075, test_loss: 0.9535, test_f1: 0.5153
 epoch: 17, train_loss: 0.8927, test_loss: 1.0067, test_f1: 0.4912
 epoch: 18, train_loss: 0.8627, test_loss: 1.0494, test_f1: 0.5051
 epoch: 19, train_loss: 0.8660, test_loss: 0.9428, test_f1: 0.5014
 epoch: 20, train_loss: 0.8588, test_loss: 0.9779, test_f1: 0.4993
 epoch: 21, train_loss: 0.8495, test_loss: 1.0752, test_f1: 0.5244
 epoch: 22, train_loss: 0.8470, test_loss: 1.0392, test_f1: 0.5397
 epoch: 23, train_loss: 0.8512, test_loss: 1.0019, test_f1: 0.5095
 epoch: 24, train_loss: 0.8423, test_loss: 0.9944, test_f1: 0.5277
 epoch: 25, train_loss: 0.8298, test_loss: 0.9745, test_f1: 0.5276
 epoch: 26, train_loss: 0.8053, test_loss: 1.1424, test_f1: 0.5151
 epoch: 27, train_loss: 0.8044, test_loss: 1.1363, test_f1: 0.4757
 epoch: 28, train_loss: 0.8372, test_loss: 1.1184, test_f1: 0.4645
 epoch: 29, train_loss: 0.8421, test_loss: 1.0122, test_f1: 0.5449
 epoch: 30, train_loss: 0.7997, test_loss: 0.9958, test_f1: 0.5476
 epoch: 31, train_loss: 0.7856, test_loss: 1.0500, test_f1: 0.5531
 epoch: 32, train_loss: 0.7864, test_loss: 1.0352, test_f1: 0.5308
 epoch: 33, train_loss: 0.7587, test_loss: 1.0551, test_f1: 0.5260
 epoch: 34, train_loss: 0.7791, test_loss: 1.1420, test_f1: 0.4885
 epoch: 35, train_loss: 0.7934, test_loss: 0.9791, test_f1: 0.5719
 epoch: 36, train_loss: 0.7549, test_loss: 1.0869, test_f1: 0.5381
 epoch: 37, train_loss: 0.7720, test_loss: 1.1185, test_f1: 0.5443
 epoch: 38, train_loss: 0.7621, test_loss: 1.0490, test_f1: 0.5213
 epoch: 39, train_loss: 0.7616, test_loss: 1.1514, test_f1: 0.4773
 epoch: 40, train_loss: 0.7385, test_loss: 1.0233, test_f1: 0.5681
 epoch: 41, train_loss: 0.7329, test_loss: 1.2170, test_f1: 0.5304
 epoch: 42, train_loss: 0.7459, test_loss: 1.1793, test_f1: 0.4744
 epoch: 43, train_loss: 0.7466, test_loss: 0.9820, test_f1: 0.5591
 epoch: 44, train_loss: 0.7338, test_loss: 1.1145, test_f1: 0.4877
 epoch: 45, train_loss: 0.7423, test_loss: 1.0499, test_f1: 0.5511
 epoch: 46, train_loss: 0.7252, test_loss: 1.1398, test_f1: 0.5143
 epoch: 47, train_loss: 0.7258, test_loss: 1.0485, test_f1: 0.5638
 epoch: 48, train_loss: 0.7196, test_loss: 1.1429, test_f1: 0.5233
 epoch: 49, train_loss: 0.6983, test_loss: 1.0650, test_f1: 0.5652
 epoch: 50, train_loss: 0.7180, test_loss: 1.3465, test_f1: 0.4751
 epoch: 51, train_loss: 0.6958, test_loss: 1.1048, test_f1: 0.5194
 epoch: 52, train_loss: 0.6555, test_loss: 1.1140, test_f1: 0.5449
 epoch: 53, train_loss: 0.6564, test_loss: 1.1750, test_f1: 0.5168
 epoch: 54, train_loss: 0.6292, test_loss: 1.2143, test_f1: 0.5497
 epoch: 55, train_loss: 0.6300, test_loss: 1.1068, test_f1: 0.5944
 epoch: 56, train_loss: 0.6384, test_loss: 1.1462, test_f1: 0.5480
 epoch: 57, train_loss: 0.6393, test_loss: 1.1606, test_f1: 0.5659
 epoch: 58, train_loss: 0.6173, test_loss: 1.2072, test_f1: 0.5211
 epoch: 59, train_loss: 0.6327, test_loss: 1.2128, test_f1: 0.5307
 epoch: 60, train_loss: 0.6229, test_loss: 1.1787, test_f1: 0.5292
 epoch: 61, train_loss: 0.6172, test_loss: 1.2570, test_f1: 0.5127
 epoch: 62, train_loss: 0.6250, test_loss: 1.1528, test_f1: 0.5438
 epoch: 63, train_loss: 0.6065, test_loss: 1.1949, test_f1: 0.5738
 epoch: 64, train_loss: 0.6262, test_loss: 1.2179, test_f1: 0.5527
 epoch: 65, train_loss: 0.6155, test_loss: 1.1652, test_f1: 0.5769
 epoch: 66, train_loss: 0.6073, test_loss: 1.2503, test_f1: 0.5300
 epoch: 67, train_loss: 0.6027, test_loss: 1.2421, test_f1: 0.5429
 epoch: 68, train_loss: 0.6005, test_loss: 1.5209, test_f1: 0.5198
 epoch: 69, train_loss: 0.6043, test_loss: 1.2709, test_f1: 0.5323
 epoch: 70, train_loss: 0.6051, test_loss: 1.1673, test_f1: 0.5511
 epoch: 71, train_loss: 0.6015, test_loss: 1.2569, test_f1: 0.5478
 epoch: 72, train_loss: 0.5845, test_loss: 1.2235, test_f1: 0.5617
 epoch: 73, train_loss: 0.5829, test_loss: 1.2698, test_f1: 0.5348
 epoch: 74, train_loss: 0.5806, test_loss: 1.3195, test_f1: 0.5388
 epoch: 75, train_loss: 0.5836, test_loss: 1.3935, test_f1: 0.5095
 epoch: 76, train_loss: 0.5965, test_loss: 1.3234, test_f1: 0.5240
 epoch: 77, train_loss: 0.5987, test_loss: 1.2399, test_f1: 0.5180
 epoch: 78, train_loss: 0.5774, test_loss: 1.3355, test_f1: 0.5315
 epoch: 79, train_loss: 0.5729, test_loss: 1.3520, test_f1: 0.5204
 epoch: 80, train_loss: 0.5684, test_loss: 1.2899, test_f1: 0.5560
 epoch: 81, train_loss: 0.5494, test_loss: 1.4114, test_f1: 0.5117
 epoch: 82, train_loss: 0.5602, test_loss: 1.4570, test_f1: 0.5127
 epoch: 83, train_loss: 0.5735, test_loss: 1.3209, test_f1: 0.5409
 epoch: 84, train_loss: 0.5422, test_loss: 1.3367, test_f1: 0.5410
 epoch: 85, train_loss: 0.5600, test_loss: 1.3877, test_f1: 0.5430
 epoch: 86, train_loss: 0.5529, test_loss: 1.2622, test_f1: 0.5524
 epoch: 87, train_loss: 0.5705, test_loss: 1.3189, test_f1: 0.5188
 epoch: 88, train_loss: 0.5566, test_loss: 1.4133, test_f1: 0.5181
 epoch: 89, train_loss: 0.5496, test_loss: 1.3615, test_f1: 0.5415
 epoch: 90, train_loss: 0.5584, test_loss: 1.3631, test_f1: 0.5203
 epoch: 91, train_loss: 0.5410, test_loss: 1.2967, test_f1: 0.5673
 epoch: 92, train_loss: 0.5254, test_loss: 1.3676, test_f1: 0.5449
 epoch: 93, train_loss: 0.5371, test_loss: 1.3357, test_f1: 0.5588
 epoch: 94, train_loss: 0.5545, test_loss: 1.4079, test_f1: 0.5449
 epoch: 95, train_loss: 0.5267, test_loss: 1.3879, test_f1: 0.5540
 epoch: 96, train_loss: 0.5399, test_loss: 1.4764, test_f1: 0.5177
 epoch: 97, train_loss: 0.5406, test_loss: 1.3434, test_f1: 0.5696
 epoch: 98, train_loss: 0.5536, test_loss: 1.2876, test_f1: 0.5499
 epoch: 99, train_loss: 0.5308, test_loss: 1.4915, test_f1: 0.5380
##################ITERATION #7 ****************************************
 epoch: 0, train_loss: 1.4439, test_loss: 1.3004, test_f1: 0.2509
 epoch: 1, train_loss: 1.2490, test_loss: 1.2253, test_f1: 0.3145
 epoch: 2, train_loss: 1.2117, test_loss: 1.1685, test_f1: 0.4109
 epoch: 3, train_loss: 1.1875, test_loss: 1.1492, test_f1: 0.4412
 epoch: 4, train_loss: 1.1515, test_loss: 1.1102, test_f1: 0.4303
 epoch: 5, train_loss: 1.1238, test_loss: 1.1127, test_f1: 0.4050
 epoch: 6, train_loss: 1.0929, test_loss: 1.0501, test_f1: 0.4660
 epoch: 7, train_loss: 1.0658, test_loss: 1.0573, test_f1: 0.4478
 epoch: 8, train_loss: 1.0363, test_loss: 1.3003, test_f1: 0.3924
 epoch: 9, train_loss: 1.0284, test_loss: 1.0006, test_f1: 0.4919
 epoch: 10, train_loss: 0.9929, test_loss: 1.0462, test_f1: 0.4967
 epoch: 11, train_loss: 0.9998, test_loss: 0.9873, test_f1: 0.5121
 epoch: 12, train_loss: 0.9819, test_loss: 1.0753, test_f1: 0.4509
 epoch: 13, train_loss: 0.9688, test_loss: 0.9496, test_f1: 0.5069
 epoch: 14, train_loss: 0.9398, test_loss: 0.9714, test_f1: 0.4928
 epoch: 15, train_loss: 0.9245, test_loss: 1.0506, test_f1: 0.4647
 epoch: 16, train_loss: 0.9240, test_loss: 0.9419, test_f1: 0.5046
 epoch: 17, train_loss: 0.9267, test_loss: 0.9635, test_f1: 0.5172
 epoch: 18, train_loss: 0.9137, test_loss: 1.1303, test_f1: 0.4967
 epoch: 19, train_loss: 0.8924, test_loss: 0.9853, test_f1: 0.4621
 epoch: 20, train_loss: 0.8968, test_loss: 1.0575, test_f1: 0.4882
 epoch: 21, train_loss: 0.8958, test_loss: 1.0271, test_f1: 0.5061
 epoch: 22, train_loss: 0.9005, test_loss: 1.0230, test_f1: 0.5232
 epoch: 23, train_loss: 0.8937, test_loss: 1.0280, test_f1: 0.5145
 epoch: 24, train_loss: 0.8735, test_loss: 1.1157, test_f1: 0.4977
 epoch: 25, train_loss: 0.8606, test_loss: 1.0083, test_f1: 0.5335
 epoch: 26, train_loss: 0.8538, test_loss: 1.0584, test_f1: 0.5364
 epoch: 27, train_loss: 0.8596, test_loss: 0.9643, test_f1: 0.4949
 epoch: 28, train_loss: 0.8530, test_loss: 1.0506, test_f1: 0.5213
 epoch: 29, train_loss: 0.8280, test_loss: 1.0670, test_f1: 0.5308
 epoch: 30, train_loss: 0.8334, test_loss: 1.0899, test_f1: 0.5163
 epoch: 31, train_loss: 0.8259, test_loss: 1.2403, test_f1: 0.4739
 epoch: 32, train_loss: 0.8179, test_loss: 1.0233, test_f1: 0.4978
 epoch: 33, train_loss: 0.8079, test_loss: 1.0566, test_f1: 0.5209
 epoch: 34, train_loss: 0.8136, test_loss: 1.0312, test_f1: 0.5278
 epoch: 35, train_loss: 0.8068, test_loss: 1.0109, test_f1: 0.5155
 epoch: 36, train_loss: 0.7954, test_loss: 1.0605, test_f1: 0.5362
 epoch: 37, train_loss: 0.7925, test_loss: 1.1293, test_f1: 0.4881
 epoch: 38, train_loss: 0.7828, test_loss: 1.1172, test_f1: 0.5198
 epoch: 39, train_loss: 0.7906, test_loss: 1.1447, test_f1: 0.4745
 epoch: 40, train_loss: 0.7939, test_loss: 1.2285, test_f1: 0.4452
 epoch: 41, train_loss: 0.7748, test_loss: 1.0584, test_f1: 0.5271
 epoch: 42, train_loss: 0.7628, test_loss: 1.1493, test_f1: 0.4767
 epoch: 43, train_loss: 0.7696, test_loss: 1.1572, test_f1: 0.5080
 epoch: 44, train_loss: 0.7716, test_loss: 1.1130, test_f1: 0.5094
 epoch: 45, train_loss: 0.7775, test_loss: 1.1118, test_f1: 0.5099
 epoch: 46, train_loss: 0.7605, test_loss: 1.1753, test_f1: 0.4707
 epoch: 47, train_loss: 0.7598, test_loss: 1.1297, test_f1: 0.5011
 epoch: 48, train_loss: 0.7362, test_loss: 1.0695, test_f1: 0.5171
 epoch: 49, train_loss: 0.7693, test_loss: 1.1548, test_f1: 0.5438
 epoch: 50, train_loss: 0.7513, test_loss: 1.0805, test_f1: 0.5231
 epoch: 51, train_loss: 0.7102, test_loss: 1.1047, test_f1: 0.5090
 epoch: 52, train_loss: 0.6771, test_loss: 1.1774, test_f1: 0.5371
 epoch: 53, train_loss: 0.6883, test_loss: 1.1723, test_f1: 0.5206
 epoch: 54, train_loss: 0.6633, test_loss: 1.1404, test_f1: 0.5316
 epoch: 55, train_loss: 0.6699, test_loss: 1.2963, test_f1: 0.5174
 epoch: 56, train_loss: 0.6765, test_loss: 1.1468, test_f1: 0.5192
 epoch: 57, train_loss: 0.6726, test_loss: 1.1309, test_f1: 0.5091
 epoch: 58, train_loss: 0.6602, test_loss: 1.2073, test_f1: 0.5077
 epoch: 59, train_loss: 0.6480, test_loss: 1.1279, test_f1: 0.5031
 epoch: 60, train_loss: 0.6455, test_loss: 1.1702, test_f1: 0.5172
 epoch: 61, train_loss: 0.6779, test_loss: 1.2431, test_f1: 0.5271
 epoch: 62, train_loss: 0.6467, test_loss: 1.2826, test_f1: 0.4940
 epoch: 63, train_loss: 0.6490, test_loss: 1.3244, test_f1: 0.5037
 epoch: 64, train_loss: 0.6486, test_loss: 1.1893, test_f1: 0.5139
 epoch: 65, train_loss: 0.6321, test_loss: 1.2538, test_f1: 0.5139
 epoch: 66, train_loss: 0.6358, test_loss: 1.2911, test_f1: 0.5398
 epoch: 67, train_loss: 0.6218, test_loss: 1.2349, test_f1: 0.5182
 epoch: 68, train_loss: 0.6309, test_loss: 1.4795, test_f1: 0.4925
 epoch: 69, train_loss: 0.6285, test_loss: 1.1991, test_f1: 0.5261
 epoch: 70, train_loss: 0.6184, test_loss: 1.3811, test_f1: 0.4866
 epoch: 71, train_loss: 0.6214, test_loss: 1.3827, test_f1: 0.5062
 epoch: 72, train_loss: 0.6444, test_loss: 1.2919, test_f1: 0.5057
 epoch: 73, train_loss: 0.6122, test_loss: 1.2770, test_f1: 0.5279
 epoch: 74, train_loss: 0.5997, test_loss: 1.3381, test_f1: 0.5081
 epoch: 75, train_loss: 0.5996, test_loss: 1.3505, test_f1: 0.5215
 epoch: 76, train_loss: 0.6035, test_loss: 1.2353, test_f1: 0.5401
 epoch: 77, train_loss: 0.6138, test_loss: 1.3098, test_f1: 0.5249
 epoch: 78, train_loss: 0.6090, test_loss: 1.2080, test_f1: 0.5293
 epoch: 79, train_loss: 0.6025, test_loss: 1.2626, test_f1: 0.5160
 epoch: 80, train_loss: 0.5910, test_loss: 1.3808, test_f1: 0.5194
 epoch: 81, train_loss: 0.5869, test_loss: 1.5745, test_f1: 0.5187
 epoch: 82, train_loss: 0.6071, test_loss: 1.2676, test_f1: 0.5096
 epoch: 83, train_loss: 0.5833, test_loss: 1.4659, test_f1: 0.5311
 epoch: 84, train_loss: 0.6018, test_loss: 1.3494, test_f1: 0.5095
 epoch: 85, train_loss: 0.5694, test_loss: 1.3874, test_f1: 0.5298
 epoch: 86, train_loss: 0.5877, test_loss: 1.4340, test_f1: 0.5017
 epoch: 87, train_loss: 0.5904, test_loss: 1.4706, test_f1: 0.5147
 epoch: 88, train_loss: 0.5959, test_loss: 1.4501, test_f1: 0.5078
 epoch: 89, train_loss: 0.5882, test_loss: 1.5717, test_f1: 0.5113
 epoch: 90, train_loss: 0.5581, test_loss: 1.4947, test_f1: 0.5068
 epoch: 91, train_loss: 0.5692, test_loss: 1.6035, test_f1: 0.4855
 epoch: 92, train_loss: 0.5714, test_loss: 1.4713, test_f1: 0.5144
 epoch: 93, train_loss: 0.5554, test_loss: 1.4505, test_f1: 0.4920
 epoch: 94, train_loss: 0.5680, test_loss: 1.3007, test_f1: 0.5447
 epoch: 95, train_loss: 0.5842, test_loss: 1.5066, test_f1: 0.5221
 epoch: 96, train_loss: 0.5656, test_loss: 1.3433, test_f1: 0.5300
 epoch: 97, train_loss: 0.5595, test_loss: 1.6155, test_f1: 0.5060
 epoch: 98, train_loss: 0.5668, test_loss: 1.1632, test_f1: 0.5345
 epoch: 99, train_loss: 0.5626, test_loss: 1.5836, test_f1: 0.5018
##################ITERATION #8 ****************************************
 epoch: 0, train_loss: 1.4108, test_loss: 1.2749, test_f1: 0.2274
 epoch: 1, train_loss: 1.2179, test_loss: 1.1826, test_f1: 0.3702
 epoch: 2, train_loss: 1.1765, test_loss: 1.1210, test_f1: 0.4403
 epoch: 3, train_loss: 1.1352, test_loss: 1.0935, test_f1: 0.4013
 epoch: 4, train_loss: 1.0963, test_loss: 1.0083, test_f1: 0.4572
 epoch: 5, train_loss: 1.0525, test_loss: 1.0273, test_f1: 0.4503
 epoch: 6, train_loss: 1.0311, test_loss: 0.9491, test_f1: 0.4903
 epoch: 7, train_loss: 1.0207, test_loss: 0.9457, test_f1: 0.4952
 epoch: 8, train_loss: 0.9909, test_loss: 0.9587, test_f1: 0.4888
 epoch: 9, train_loss: 0.9715, test_loss: 0.9571, test_f1: 0.4984
 epoch: 10, train_loss: 0.9454, test_loss: 1.0028, test_f1: 0.4987
 epoch: 11, train_loss: 0.9347, test_loss: 1.0039, test_f1: 0.4971
 epoch: 12, train_loss: 0.9272, test_loss: 1.0240, test_f1: 0.4650
 epoch: 13, train_loss: 0.9020, test_loss: 1.0508, test_f1: 0.5092
 epoch: 14, train_loss: 0.9066, test_loss: 1.0037, test_f1: 0.5126
 epoch: 15, train_loss: 0.9064, test_loss: 1.0408, test_f1: 0.4932
 epoch: 16, train_loss: 0.8727, test_loss: 0.9797, test_f1: 0.5125
 epoch: 17, train_loss: 0.8728, test_loss: 1.1320, test_f1: 0.4433
 epoch: 18, train_loss: 0.8620, test_loss: 0.9843, test_f1: 0.5208
 epoch: 19, train_loss: 0.8540, test_loss: 1.0647, test_f1: 0.5037
 epoch: 20, train_loss: 0.8419, test_loss: 1.0479, test_f1: 0.4982
 epoch: 21, train_loss: 0.8376, test_loss: 0.9633, test_f1: 0.5397
 epoch: 22, train_loss: 0.8315, test_loss: 1.0001, test_f1: 0.5224
 epoch: 23, train_loss: 0.8186, test_loss: 1.0381, test_f1: 0.4999
 epoch: 24, train_loss: 0.8121, test_loss: 0.9927, test_f1: 0.5103
 epoch: 25, train_loss: 0.8167, test_loss: 1.0033, test_f1: 0.5208
 epoch: 26, train_loss: 0.8207, test_loss: 1.0231, test_f1: 0.5197
 epoch: 27, train_loss: 0.8043, test_loss: 1.0620, test_f1: 0.5286
 epoch: 28, train_loss: 0.8016, test_loss: 1.0639, test_f1: 0.5344
 epoch: 29, train_loss: 0.7889, test_loss: 1.0018, test_f1: 0.5426
 epoch: 30, train_loss: 0.8080, test_loss: 1.1813, test_f1: 0.5241
 epoch: 31, train_loss: 0.7907, test_loss: 1.0418, test_f1: 0.5270
 epoch: 32, train_loss: 0.7655, test_loss: 1.0625, test_f1: 0.5294
 epoch: 33, train_loss: 0.7691, test_loss: 1.1064, test_f1: 0.4942
 epoch: 34, train_loss: 0.7579, test_loss: 1.0315, test_f1: 0.5524
 epoch: 35, train_loss: 0.7671, test_loss: 1.0502, test_f1: 0.5495
 epoch: 36, train_loss: 0.7509, test_loss: 1.0944, test_f1: 0.5357
 epoch: 37, train_loss: 0.7763, test_loss: 1.0343, test_f1: 0.5568
 epoch: 38, train_loss: 0.7602, test_loss: 1.1645, test_f1: 0.4865
 epoch: 39, train_loss: 0.7580, test_loss: 1.1589, test_f1: 0.4949
 epoch: 40, train_loss: 0.7525, test_loss: 1.1565, test_f1: 0.5249
 epoch: 41, train_loss: 0.7430, test_loss: 1.1087, test_f1: 0.5555
 epoch: 42, train_loss: 0.7509, test_loss: 1.1298, test_f1: 0.5671
 epoch: 43, train_loss: 0.7360, test_loss: 1.0696, test_f1: 0.5343
 epoch: 44, train_loss: 0.7363, test_loss: 1.1387, test_f1: 0.5691
 epoch: 45, train_loss: 0.7231, test_loss: 1.1229, test_f1: 0.5515
 epoch: 46, train_loss: 0.7299, test_loss: 1.2139, test_f1: 0.5404
 epoch: 47, train_loss: 0.7206, test_loss: 1.1323, test_f1: 0.5593
 epoch: 48, train_loss: 0.7045, test_loss: 1.1670, test_f1: 0.5442
 epoch: 49, train_loss: 0.7237, test_loss: 1.1185, test_f1: 0.5361
 epoch: 50, train_loss: 0.7214, test_loss: 1.2719, test_f1: 0.5437
 epoch: 51, train_loss: 0.6890, test_loss: 1.1338, test_f1: 0.5455
 epoch: 52, train_loss: 0.6521, test_loss: 1.2184, test_f1: 0.5526
 epoch: 53, train_loss: 0.6400, test_loss: 1.2050, test_f1: 0.5700
 epoch: 54, train_loss: 0.6477, test_loss: 1.2510, test_f1: 0.5476
 epoch: 55, train_loss: 0.6549, test_loss: 1.2263, test_f1: 0.5658
 epoch: 56, train_loss: 0.6339, test_loss: 1.2423, test_f1: 0.5673
 epoch: 57, train_loss: 0.6179, test_loss: 1.2867, test_f1: 0.5497
 epoch: 58, train_loss: 0.6288, test_loss: 1.2573, test_f1: 0.5718
 epoch: 59, train_loss: 0.6172, test_loss: 1.2926, test_f1: 0.5489
 epoch: 60, train_loss: 0.6137, test_loss: 1.2983, test_f1: 0.5684
 epoch: 61, train_loss: 0.6108, test_loss: 1.3558, test_f1: 0.5595
 epoch: 62, train_loss: 0.5863, test_loss: 1.3918, test_f1: 0.5419
 epoch: 63, train_loss: 0.6289, test_loss: 1.4221, test_f1: 0.5505
 epoch: 64, train_loss: 0.5924, test_loss: 1.3425, test_f1: 0.5285
 epoch: 65, train_loss: 0.6049, test_loss: 1.2641, test_f1: 0.5732
 epoch: 66, train_loss: 0.6235, test_loss: 1.1991, test_f1: 0.5591
 epoch: 67, train_loss: 0.6078, test_loss: 1.2151, test_f1: 0.5615
 epoch: 68, train_loss: 0.5994, test_loss: 1.2557, test_f1: 0.5866
 epoch: 69, train_loss: 0.5973, test_loss: 1.3043, test_f1: 0.5566
 epoch: 70, train_loss: 0.5965, test_loss: 1.4206, test_f1: 0.5381
 epoch: 71, train_loss: 0.5815, test_loss: 1.4203, test_f1: 0.5602
 epoch: 72, train_loss: 0.5835, test_loss: 1.2684, test_f1: 0.5497
 epoch: 73, train_loss: 0.5880, test_loss: 1.4515, test_f1: 0.5556
 epoch: 74, train_loss: 0.5799, test_loss: 1.3945, test_f1: 0.5421
 epoch: 75, train_loss: 0.5561, test_loss: 1.3796, test_f1: 0.5562
 epoch: 76, train_loss: 0.5967, test_loss: 1.4083, test_f1: 0.5400
 epoch: 77, train_loss: 0.5589, test_loss: 1.4918, test_f1: 0.5516
 epoch: 78, train_loss: 0.5588, test_loss: 1.4893, test_f1: 0.5312
 epoch: 79, train_loss: 0.5564, test_loss: 1.4038, test_f1: 0.5755
 epoch: 80, train_loss: 0.5478, test_loss: 1.3821, test_f1: 0.5694
 epoch: 81, train_loss: 0.5560, test_loss: 1.4932, test_f1: 0.5535
 epoch: 82, train_loss: 0.5312, test_loss: 1.5438, test_f1: 0.5060
 epoch: 83, train_loss: 0.5510, test_loss: 1.4720, test_f1: 0.5624
 epoch: 84, train_loss: 0.5606, test_loss: 1.7129, test_f1: 0.5311
 epoch: 85, train_loss: 0.5684, test_loss: 1.4043, test_f1: 0.5432
 epoch: 86, train_loss: 0.5331, test_loss: 1.4246, test_f1: 0.5614
 epoch: 87, train_loss: 0.5177, test_loss: 1.5871, test_f1: 0.5264
 epoch: 88, train_loss: 0.5428, test_loss: 1.4477, test_f1: 0.5491
 epoch: 89, train_loss: 0.5271, test_loss: 1.3831, test_f1: 0.5649
 epoch: 90, train_loss: 0.5267, test_loss: 1.5084, test_f1: 0.5489
 epoch: 91, train_loss: 0.5324, test_loss: 1.3715, test_f1: 0.5988
 epoch: 92, train_loss: 0.5367, test_loss: 1.5120, test_f1: 0.5483
 epoch: 93, train_loss: 0.5292, test_loss: 1.4885, test_f1: 0.5751
 epoch: 94, train_loss: 0.5255, test_loss: 1.6803, test_f1: 0.5273
 epoch: 95, train_loss: 0.5142, test_loss: 1.4653, test_f1: 0.5671
 epoch: 96, train_loss: 0.5179, test_loss: 1.5518, test_f1: 0.5632
 epoch: 97, train_loss: 0.5208, test_loss: 1.5035, test_f1: 0.5835
 epoch: 98, train_loss: 0.5090, test_loss: 1.5597, test_f1: 0.5499
 epoch: 99, train_loss: 0.5069, test_loss: 1.6071, test_f1: 0.5523
##################ITERATION #9 ****************************************
 epoch: 0, train_loss: 1.4238, test_loss: 1.2608, test_f1: 0.2716
 epoch: 1, train_loss: 1.2552, test_loss: 1.2094, test_f1: 0.3167
 epoch: 2, train_loss: 1.1956, test_loss: 1.1379, test_f1: 0.4004
 epoch: 3, train_loss: 1.1682, test_loss: 1.1122, test_f1: 0.4400
 epoch: 4, train_loss: 1.1289, test_loss: 1.0824, test_f1: 0.4663
 epoch: 5, train_loss: 1.1160, test_loss: 1.1383, test_f1: 0.4490
 epoch: 6, train_loss: 1.0838, test_loss: 1.2224, test_f1: 0.3965
 epoch: 7, train_loss: 1.0503, test_loss: 1.0053, test_f1: 0.4740
 epoch: 8, train_loss: 1.0228, test_loss: 0.9779, test_f1: 0.5258
 epoch: 9, train_loss: 1.0089, test_loss: 0.9608, test_f1: 0.4860
 epoch: 10, train_loss: 0.9885, test_loss: 0.9495, test_f1: 0.5027
 epoch: 11, train_loss: 0.9793, test_loss: 0.9130, test_f1: 0.5433
 epoch: 12, train_loss: 0.9477, test_loss: 1.1922, test_f1: 0.4113
 epoch: 13, train_loss: 0.9499, test_loss: 0.9280, test_f1: 0.5213
 epoch: 14, train_loss: 0.9286, test_loss: 0.8912, test_f1: 0.5104
 epoch: 15, train_loss: 0.9230, test_loss: 0.9428, test_f1: 0.5371
 epoch: 16, train_loss: 0.9289, test_loss: 1.0592, test_f1: 0.4873
 epoch: 17, train_loss: 0.9192, test_loss: 0.9042, test_f1: 0.5377
 epoch: 18, train_loss: 0.8859, test_loss: 0.9365, test_f1: 0.5348
 epoch: 19, train_loss: 0.8958, test_loss: 1.0046, test_f1: 0.4967
 epoch: 20, train_loss: 0.8774, test_loss: 0.9870, test_f1: 0.5175
 epoch: 21, train_loss: 0.8702, test_loss: 0.9220, test_f1: 0.5362
 epoch: 22, train_loss: 0.8619, test_loss: 0.9388, test_f1: 0.5349
 epoch: 23, train_loss: 0.8471, test_loss: 0.9886, test_f1: 0.5029
 epoch: 24, train_loss: 0.8526, test_loss: 1.1114, test_f1: 0.5045
 epoch: 25, train_loss: 0.8578, test_loss: 0.9915, test_f1: 0.5203
 epoch: 26, train_loss: 0.8503, test_loss: 0.8947, test_f1: 0.5280
 epoch: 27, train_loss: 0.8510, test_loss: 1.0026, test_f1: 0.4862
 epoch: 28, train_loss: 0.8528, test_loss: 0.9964, test_f1: 0.5121
 epoch: 29, train_loss: 0.8336, test_loss: 0.9617, test_f1: 0.5423
 epoch: 30, train_loss: 0.8216, test_loss: 1.1288, test_f1: 0.4880
 epoch: 31, train_loss: 0.8199, test_loss: 0.9756, test_f1: 0.5282
 epoch: 32, train_loss: 0.8402, test_loss: 0.9096, test_f1: 0.5088
 epoch: 33, train_loss: 0.8249, test_loss: 0.9872, test_f1: 0.5510
 epoch: 34, train_loss: 0.8261, test_loss: 1.1045, test_f1: 0.5274
 epoch: 35, train_loss: 0.8004, test_loss: 1.0812, test_f1: 0.5032
 epoch: 36, train_loss: 0.8195, test_loss: 1.0277, test_f1: 0.5085
 epoch: 37, train_loss: 0.8049, test_loss: 1.0006, test_f1: 0.5421
 epoch: 38, train_loss: 0.8143, test_loss: 1.0184, test_f1: 0.5323
 epoch: 39, train_loss: 0.8004, test_loss: 0.9560, test_f1: 0.5382
 epoch: 40, train_loss: 0.7854, test_loss: 1.0698, test_f1: 0.5564
 epoch: 41, train_loss: 0.8019, test_loss: 0.9900, test_f1: 0.5477
 epoch: 42, train_loss: 0.7863, test_loss: 0.9312, test_f1: 0.5330
 epoch: 43, train_loss: 0.7759, test_loss: 0.9940, test_f1: 0.5483
 epoch: 44, train_loss: 0.7917, test_loss: 1.0097, test_f1: 0.5420
 epoch: 45, train_loss: 0.7702, test_loss: 1.0981, test_f1: 0.4971
 epoch: 46, train_loss: 0.7854, test_loss: 1.0405, test_f1: 0.5289
 epoch: 47, train_loss: 0.7753, test_loss: 1.0053, test_f1: 0.5379
 epoch: 48, train_loss: 0.7608, test_loss: 1.0533, test_f1: 0.5112
 epoch: 49, train_loss: 0.7658, test_loss: 1.0452, test_f1: 0.5446
 epoch: 50, train_loss: 0.7501, test_loss: 1.1010, test_f1: 0.5321
 epoch: 51, train_loss: 0.7373, test_loss: 1.0322, test_f1: 0.5474
 epoch: 52, train_loss: 0.7242, test_loss: 1.0376, test_f1: 0.5489
 epoch: 53, train_loss: 0.7118, test_loss: 1.0152, test_f1: 0.5687
 epoch: 54, train_loss: 0.6953, test_loss: 1.0479, test_f1: 0.5620
 epoch: 55, train_loss: 0.6925, test_loss: 1.0396, test_f1: 0.5429
 epoch: 56, train_loss: 0.7111, test_loss: 1.0219, test_f1: 0.5567
 epoch: 57, train_loss: 0.7067, test_loss: 1.0681, test_f1: 0.5619
 epoch: 58, train_loss: 0.7152, test_loss: 1.0644, test_f1: 0.5409
 epoch: 59, train_loss: 0.6963, test_loss: 1.0160, test_f1: 0.5597
 epoch: 60, train_loss: 0.6904, test_loss: 1.0391, test_f1: 0.5502
 epoch: 61, train_loss: 0.6789, test_loss: 1.0280, test_f1: 0.5679
 epoch: 62, train_loss: 0.6842, test_loss: 1.0339, test_f1: 0.5522
 epoch: 63, train_loss: 0.6776, test_loss: 1.1062, test_f1: 0.5437
 epoch: 64, train_loss: 0.6633, test_loss: 1.0380, test_f1: 0.5673
 epoch: 65, train_loss: 0.6725, test_loss: 1.0881, test_f1: 0.5487
 epoch: 66, train_loss: 0.6630, test_loss: 1.1147, test_f1: 0.5257
 epoch: 67, train_loss: 0.6749, test_loss: 1.1608, test_f1: 0.5077
 epoch: 68, train_loss: 0.6779, test_loss: 1.0551, test_f1: 0.5571
 epoch: 69, train_loss: 0.6730, test_loss: 1.0692, test_f1: 0.5437
 epoch: 70, train_loss: 0.6571, test_loss: 1.0159, test_f1: 0.5596
 epoch: 71, train_loss: 0.6477, test_loss: 1.0505, test_f1: 0.5499
 epoch: 72, train_loss: 0.6484, test_loss: 0.9797, test_f1: 0.5693
 epoch: 73, train_loss: 0.6493, test_loss: 1.0739, test_f1: 0.5799
 epoch: 74, train_loss: 0.6446, test_loss: 1.0616, test_f1: 0.5576
 epoch: 75, train_loss: 0.6422, test_loss: 1.1456, test_f1: 0.5295
 epoch: 76, train_loss: 0.6560, test_loss: 1.0953, test_f1: 0.5634
 epoch: 77, train_loss: 0.6810, test_loss: 1.0834, test_f1: 0.5550
 epoch: 78, train_loss: 0.6364, test_loss: 1.0804, test_f1: 0.5711
 epoch: 79, train_loss: 0.6401, test_loss: 1.1423, test_f1: 0.5318
 epoch: 80, train_loss: 0.6281, test_loss: 1.1500, test_f1: 0.5265
 epoch: 81, train_loss: 0.6400, test_loss: 1.1001, test_f1: 0.5348
 epoch: 82, train_loss: 0.6208, test_loss: 1.1046, test_f1: 0.5448
 epoch: 83, train_loss: 0.6336, test_loss: 1.0849, test_f1: 0.5523
 epoch: 84, train_loss: 0.6128, test_loss: 1.0860, test_f1: 0.5771
 epoch: 85, train_loss: 0.6261, test_loss: 1.1657, test_f1: 0.5433
 epoch: 86, train_loss: 0.6215, test_loss: 1.0712, test_f1: 0.5540
 epoch: 87, train_loss: 0.6434, test_loss: 1.1728, test_f1: 0.5255
 epoch: 88, train_loss: 0.6156, test_loss: 1.1053, test_f1: 0.5645
 epoch: 89, train_loss: 0.6055, test_loss: 1.1237, test_f1: 0.5450
 epoch: 90, train_loss: 0.6251, test_loss: 1.1320, test_f1: 0.5597
 epoch: 91, train_loss: 0.6133, test_loss: 1.1764, test_f1: 0.5384
 epoch: 92, train_loss: 0.6423, test_loss: 1.1410, test_f1: 0.5539
 epoch: 93, train_loss: 0.6308, test_loss: 1.1017, test_f1: 0.5406
 epoch: 94, train_loss: 0.6277, test_loss: 1.2297, test_f1: 0.5223
 epoch: 95, train_loss: 0.6236, test_loss: 1.0855, test_f1: 0.5587
 epoch: 96, train_loss: 0.6133, test_loss: 1.2395, test_f1: 0.5072
 epoch: 97, train_loss: 0.6005, test_loss: 1.1016, test_f1: 0.5313
 epoch: 98, train_loss: 0.5969, test_loss: 1.2054, test_f1: 0.5166
 epoch: 99, train_loss: 0.6045, test_loss: 1.3615, test_f1: 0.5005

Training completed in 374.14 seconds
Best F1: 0.6069 at epoch 97
Mean F1 across iterations: 0.5840  0.0165
========================FINAL RESULTS================================
FEGIN weighted F1: 0.6069  0.0165
python main.py --data ltspice_examples --representation component_component --model FEGIN --layers 3 --hiddens 32 --batch_size 256 --lr 0.01 --emb_size 250 --epochs 100 --save_appendix component_component_L3_H32_BS256_LR0.01_E250 --no_val
-----



STDERR:
  File "main.py", line 370, in <module>
    main()
  File "main.py", line 254, in main
    dataset = dataset_class(
  File "/home/philip/projects/ltspice_examples_code_repo/Circuit-Completion-Using-GNNs/component_classification_with_link_prediction_head/evaluation/FEGIN/kernel/circuit_datasets.py", line 15, in __init__
    self.data, self.slices = torch.load(self.processed_paths[0])
  File "/home/philip/.local/lib/python3.8/site-packages/torch/serialization.py", line 1040, in load
    warnings.warn(
  File "/usr/lib/python3.8/warnings.py", line 109, in _showwarnmsg
    sw(msg.message, msg.category, msg.filename, msg.lineno,
  File "main.py", line 47, in warn_with_traceback
    traceback.print_stack(file=log)
/home/philip/projects/ltspice_examples_code_repo/Circuit-Completion-Using-GNNs/component_classification_with_link_prediction_head/evaluation/FEGIN/kernel/circuit_datasets.py:15: FutureWarning: You are using `torch.load` with `weights_only=False` (the current default value), which uses the default pickle module implicitly. It is possible to construct malicious pickle data which will execute arbitrary code during unpickling (See https://github.com/pytorch/pytorch/blob/main/SECURITY.md#untrusted-models for more details). In a future release, the default value for `weights_only` will be flipped to `True`. This limits the functions that could be executed during unpickling. Arbitrary objects will no longer be allowed to be loaded via this mode unless they are explicitly allowlisted by the user via `torch.serialization.add_safe_globals`. We recommend you start setting `weights_only=True` for any use case where you don't have full control of the loaded file. Please open an issue on GitHub for any issues related to this experimental feature.
  self.data, self.slices = torch.load(self.processed_paths[0])
