STDOUT:
Results will be saved in /home/philip/projects/ltspice_examples_code_repo/Circuit-Completion-Using-GNNs/component_classification_with_link_prediction_head/evaluation/FEGIN/results/model_FEGIN_dataset_ltspice_demos
Command line input: python main.py --data ltspice_demos --representation component_pin --model FEGIN --layers 3 --hiddens 128 --batch_size 128 --lr 0.001 --emb_size 250 --epochs 100 --save_appendix component_pin_L3_H128_BS128_LR0.001_E250 --no_val
 is saved.
-----
ltspice_demos - FEGIN
Using 3 layers, 128 hidden units, h = 2
Loading component_pin representation dataset
ENTERED
Training FEGIN on component_pin representation
Train: 1565, Test: 383
##################ITERATION #0 ****************************************
 epoch: 0, train_loss: 1.2933, test_loss: 1.2940, test_f1: 0.3480
 epoch: 1, train_loss: 1.1618, test_loss: 1.3124, test_f1: 0.3255
 epoch: 2, train_loss: 1.1129, test_loss: 1.3690, test_f1: 0.3514
 epoch: 3, train_loss: 1.0626, test_loss: 1.3698, test_f1: 0.3428
 epoch: 4, train_loss: 0.9727, test_loss: 1.1637, test_f1: 0.3572
 epoch: 5, train_loss: 0.9046, test_loss: 1.2028, test_f1: 0.4640
 epoch: 6, train_loss: 0.8416, test_loss: 1.0775, test_f1: 0.5696
 epoch: 7, train_loss: 0.8173, test_loss: 0.9705, test_f1: 0.6188
 epoch: 8, train_loss: 0.7768, test_loss: 1.0973, test_f1: 0.4844
 epoch: 9, train_loss: 0.7566, test_loss: 1.0848, test_f1: 0.5532
 epoch: 10, train_loss: 0.7060, test_loss: 1.0521, test_f1: 0.5436
 epoch: 11, train_loss: 0.6868, test_loss: 1.1010, test_f1: 0.5709
 epoch: 12, train_loss: 0.6885, test_loss: 1.0384, test_f1: 0.5962
 epoch: 13, train_loss: 0.6393, test_loss: 1.5486, test_f1: 0.3726
 epoch: 14, train_loss: 0.6247, test_loss: 1.1043, test_f1: 0.6060
 epoch: 15, train_loss: 0.6144, test_loss: 1.1306, test_f1: 0.5054
 epoch: 16, train_loss: 0.5849, test_loss: 1.1055, test_f1: 0.5479
 epoch: 17, train_loss: 0.5646, test_loss: 1.1787, test_f1: 0.5407
 epoch: 18, train_loss: 0.5734, test_loss: 1.0361, test_f1: 0.5889
 epoch: 19, train_loss: 0.5166, test_loss: 1.2055, test_f1: 0.5699
 epoch: 20, train_loss: 0.4908, test_loss: 1.5046, test_f1: 0.5998
 epoch: 21, train_loss: 0.5314, test_loss: 1.5308, test_f1: 0.5635
 epoch: 22, train_loss: 0.5319, test_loss: 1.2500, test_f1: 0.6165
 epoch: 23, train_loss: 0.4726, test_loss: 1.4843, test_f1: 0.5939
 epoch: 24, train_loss: 0.4852, test_loss: 1.2913, test_f1: 0.6179
 epoch: 25, train_loss: 0.4339, test_loss: 1.4417, test_f1: 0.6430
 epoch: 26, train_loss: 0.4430, test_loss: 1.2375, test_f1: 0.6529
 epoch: 27, train_loss: 0.4387, test_loss: 1.4593, test_f1: 0.6351
 epoch: 28, train_loss: 0.4364, test_loss: 1.3767, test_f1: 0.6228
 epoch: 29, train_loss: 0.3978, test_loss: 1.4845, test_f1: 0.6508
 epoch: 30, train_loss: 0.3755, test_loss: 1.5165, test_f1: 0.6647
 epoch: 31, train_loss: 0.3859, test_loss: 1.4194, test_f1: 0.5795
 epoch: 32, train_loss: 0.3670, test_loss: 1.4192, test_f1: 0.6394
 epoch: 33, train_loss: 0.3544, test_loss: 1.8939, test_f1: 0.6255
 epoch: 34, train_loss: 0.3894, test_loss: 1.5913, test_f1: 0.6285
 epoch: 35, train_loss: 0.3265, test_loss: 1.6966, test_f1: 0.5895
 epoch: 36, train_loss: 0.3040, test_loss: 1.6790, test_f1: 0.6252
 epoch: 37, train_loss: 0.3429, test_loss: 1.7321, test_f1: 0.6118
 epoch: 38, train_loss: 0.2937, test_loss: 1.6635, test_f1: 0.6480
 epoch: 39, train_loss: 0.2675, test_loss: 1.7033, test_f1: 0.6193
 epoch: 40, train_loss: 0.2746, test_loss: 1.9243, test_f1: 0.6468
 epoch: 41, train_loss: 0.2837, test_loss: 1.8301, test_f1: 0.5803
 epoch: 42, train_loss: 0.3318, test_loss: 2.1376, test_f1: 0.5786
 epoch: 43, train_loss: 0.3336, test_loss: 1.7971, test_f1: 0.6568
 epoch: 44, train_loss: 0.3005, test_loss: 2.0788, test_f1: 0.5672
 epoch: 45, train_loss: 0.3186, test_loss: 1.7534, test_f1: 0.6048
 epoch: 46, train_loss: 0.2951, test_loss: 1.6756, test_f1: 0.6000
 epoch: 47, train_loss: 0.2843, test_loss: 1.7808, test_f1: 0.6321
 epoch: 48, train_loss: 0.2645, test_loss: 1.6553, test_f1: 0.6702
 epoch: 49, train_loss: 0.2456, test_loss: 1.6489, test_f1: 0.6677
 epoch: 50, train_loss: 0.2750, test_loss: 1.8090, test_f1: 0.6255
 epoch: 51, train_loss: 0.1996, test_loss: 1.7906, test_f1: 0.6524
 epoch: 52, train_loss: 0.1960, test_loss: 1.7230, test_f1: 0.6615
 epoch: 53, train_loss: 0.1546, test_loss: 1.7955, test_f1: 0.6948
 epoch: 54, train_loss: 0.1477, test_loss: 1.9160, test_f1: 0.6778
 epoch: 55, train_loss: 0.1385, test_loss: 1.9666, test_f1: 0.6361
 epoch: 56, train_loss: 0.1269, test_loss: 2.0564, test_f1: 0.6473
 epoch: 57, train_loss: 0.1227, test_loss: 2.1357, test_f1: 0.6589
 epoch: 58, train_loss: 0.1133, test_loss: 2.2631, test_f1: 0.6494
 epoch: 59, train_loss: 0.1212, test_loss: 2.2171, test_f1: 0.6512
 epoch: 60, train_loss: 0.1135, test_loss: 2.2068, test_f1: 0.6438
 epoch: 61, train_loss: 0.1297, test_loss: 2.2244, test_f1: 0.6347
 epoch: 62, train_loss: 0.1256, test_loss: 2.3496, test_f1: 0.6409
 epoch: 63, train_loss: 0.1404, test_loss: 2.1385, test_f1: 0.6741
 epoch: 64, train_loss: 0.1105, test_loss: 2.2187, test_f1: 0.6675
 epoch: 65, train_loss: 0.1104, test_loss: 2.3515, test_f1: 0.6365
 epoch: 66, train_loss: 0.1197, test_loss: 2.2795, test_f1: 0.6459
 epoch: 67, train_loss: 0.1108, test_loss: 2.4030, test_f1: 0.6431
 epoch: 68, train_loss: 0.1216, test_loss: 2.5438, test_f1: 0.6426
 epoch: 69, train_loss: 0.1122, test_loss: 2.5542, test_f1: 0.6357
 epoch: 70, train_loss: 0.0864, test_loss: 2.4930, test_f1: 0.6201
 epoch: 71, train_loss: 0.0825, test_loss: 2.6811, test_f1: 0.6375
 epoch: 72, train_loss: 0.0867, test_loss: 2.6093, test_f1: 0.6456
 epoch: 73, train_loss: 0.0903, test_loss: 2.5215, test_f1: 0.6395
 epoch: 74, train_loss: 0.1233, test_loss: 2.8721, test_f1: 0.6250
 epoch: 75, train_loss: 0.1140, test_loss: 2.7389, test_f1: 0.6430
 epoch: 76, train_loss: 0.0906, test_loss: 2.7714, test_f1: 0.6215
 epoch: 77, train_loss: 0.0797, test_loss: 2.6543, test_f1: 0.6127
 epoch: 78, train_loss: 0.0733, test_loss: 2.7829, test_f1: 0.6084
 epoch: 79, train_loss: 0.0699, test_loss: 2.7627, test_f1: 0.6125
 epoch: 80, train_loss: 0.0800, test_loss: 2.7754, test_f1: 0.6041
 epoch: 81, train_loss: 0.0727, test_loss: 2.6486, test_f1: 0.6373
 epoch: 82, train_loss: 0.0579, test_loss: 2.7833, test_f1: 0.6532
 epoch: 83, train_loss: 0.0655, test_loss: 2.8635, test_f1: 0.6536
 epoch: 84, train_loss: 0.1216, test_loss: 2.9185, test_f1: 0.6081
 epoch: 85, train_loss: 0.1035, test_loss: 2.7774, test_f1: 0.6625
 epoch: 86, train_loss: 0.1117, test_loss: 2.9083, test_f1: 0.6286
 epoch: 87, train_loss: 0.1123, test_loss: 2.8004, test_f1: 0.6034
 epoch: 88, train_loss: 0.0752, test_loss: 2.9554, test_f1: 0.5968
 epoch: 89, train_loss: 0.0858, test_loss: 3.1921, test_f1: 0.6143
 epoch: 90, train_loss: 0.0891, test_loss: 3.0377, test_f1: 0.6043
 epoch: 91, train_loss: 0.0868, test_loss: 2.8659, test_f1: 0.6246
 epoch: 92, train_loss: 0.0747, test_loss: 2.9024, test_f1: 0.6138
 epoch: 93, train_loss: 0.0575, test_loss: 3.2061, test_f1: 0.6182
 epoch: 94, train_loss: 0.0747, test_loss: 3.3385, test_f1: 0.6021
 epoch: 95, train_loss: 0.0926, test_loss: 3.3952, test_f1: 0.5632
 epoch: 96, train_loss: 0.0861, test_loss: 3.3989, test_f1: 0.6074
 epoch: 97, train_loss: 0.0836, test_loss: 3.0207, test_f1: 0.6167
 epoch: 98, train_loss: 0.0598, test_loss: 3.3054, test_f1: 0.6207
 epoch: 99, train_loss: 0.0461, test_loss: 3.0388, test_f1: 0.6408
##################ITERATION #1 ****************************************
 epoch: 0, train_loss: 1.1348, test_loss: 1.3665, test_f1: 0.3359
 epoch: 1, train_loss: 0.9677, test_loss: 1.4611, test_f1: 0.2872
 epoch: 2, train_loss: 0.8911, test_loss: 1.5216, test_f1: 0.2876
 epoch: 3, train_loss: 0.8391, test_loss: 1.3106, test_f1: 0.4178
 epoch: 4, train_loss: 0.7983, test_loss: 1.1746, test_f1: 0.5052
 epoch: 5, train_loss: 0.7621, test_loss: 1.2850, test_f1: 0.4407
 epoch: 6, train_loss: 0.7405, test_loss: 1.1162, test_f1: 0.5460
 epoch: 7, train_loss: 0.6885, test_loss: 1.3158, test_f1: 0.4875
 epoch: 8, train_loss: 0.6776, test_loss: 1.0818, test_f1: 0.6111
 epoch: 9, train_loss: 0.6550, test_loss: 1.0018, test_f1: 0.6090
 epoch: 10, train_loss: 0.6306, test_loss: 1.1336, test_f1: 0.5214
 epoch: 11, train_loss: 0.6117, test_loss: 1.1174, test_f1: 0.5805
 epoch: 12, train_loss: 0.6048, test_loss: 1.3076, test_f1: 0.5212
 epoch: 13, train_loss: 0.5870, test_loss: 1.2948, test_f1: 0.4809
 epoch: 14, train_loss: 0.5893, test_loss: 1.2758, test_f1: 0.4939
 epoch: 15, train_loss: 0.5734, test_loss: 1.1648, test_f1: 0.5905
 epoch: 16, train_loss: 0.5248, test_loss: 1.2910, test_f1: 0.5321
 epoch: 17, train_loss: 0.5042, test_loss: 1.1541, test_f1: 0.5959
 epoch: 18, train_loss: 0.5002, test_loss: 1.3021, test_f1: 0.5713
 epoch: 19, train_loss: 0.4634, test_loss: 1.6331, test_f1: 0.5581
 epoch: 20, train_loss: 0.4669, test_loss: 1.3564, test_f1: 0.5516
 epoch: 21, train_loss: 0.4473, test_loss: 1.4152, test_f1: 0.6288
 epoch: 22, train_loss: 0.4213, test_loss: 1.6883, test_f1: 0.5432
 epoch: 23, train_loss: 0.4212, test_loss: 1.9940, test_f1: 0.4748
 epoch: 24, train_loss: 0.4317, test_loss: 1.8603, test_f1: 0.4984
 epoch: 25, train_loss: 0.4134, test_loss: 1.5408, test_f1: 0.6117
 epoch: 26, train_loss: 0.3695, test_loss: 1.3862, test_f1: 0.6336
 epoch: 27, train_loss: 0.3411, test_loss: 1.9191, test_f1: 0.6017
 epoch: 28, train_loss: 0.3713, test_loss: 2.0320, test_f1: 0.6020
 epoch: 29, train_loss: 0.4017, test_loss: 2.0162, test_f1: 0.5116
 epoch: 30, train_loss: 0.3757, test_loss: 1.6039, test_f1: 0.6187
 epoch: 31, train_loss: 0.3513, test_loss: 1.8546, test_f1: 0.5517
 epoch: 32, train_loss: 0.3167, test_loss: 1.7823, test_f1: 0.5749
 epoch: 33, train_loss: 0.3029, test_loss: 1.7713, test_f1: 0.5864
 epoch: 34, train_loss: 0.2727, test_loss: 1.7578, test_f1: 0.5845
 epoch: 35, train_loss: 0.2843, test_loss: 2.0053, test_f1: 0.5266
 epoch: 36, train_loss: 0.2795, test_loss: 2.2401, test_f1: 0.5883
 epoch: 37, train_loss: 0.2503, test_loss: 1.8347, test_f1: 0.6265
 epoch: 38, train_loss: 0.2231, test_loss: 1.9853, test_f1: 0.5973
 epoch: 39, train_loss: 0.2530, test_loss: 2.3463, test_f1: 0.5955
 epoch: 40, train_loss: 0.2592, test_loss: 1.8854, test_f1: 0.6239
 epoch: 41, train_loss: 0.2764, test_loss: 2.0459, test_f1: 0.5732
 epoch: 42, train_loss: 0.2563, test_loss: 2.4680, test_f1: 0.5130
 epoch: 43, train_loss: 0.2289, test_loss: 2.0922, test_f1: 0.5981
 epoch: 44, train_loss: 0.2498, test_loss: 2.1632, test_f1: 0.6313
 epoch: 45, train_loss: 0.2710, test_loss: 2.0590, test_f1: 0.5733
 epoch: 46, train_loss: 0.3144, test_loss: 2.0149, test_f1: 0.5967
 epoch: 47, train_loss: 0.3153, test_loss: 2.3626, test_f1: 0.5021
 epoch: 48, train_loss: 0.2693, test_loss: 2.1364, test_f1: 0.5670
 epoch: 49, train_loss: 0.2561, test_loss: 1.8599, test_f1: 0.6123
 epoch: 50, train_loss: 0.2752, test_loss: 2.0601, test_f1: 0.5957
 epoch: 51, train_loss: 0.2242, test_loss: 1.9289, test_f1: 0.5979
 epoch: 52, train_loss: 0.1930, test_loss: 2.0597, test_f1: 0.6345
 epoch: 53, train_loss: 0.1628, test_loss: 2.0060, test_f1: 0.6378
 epoch: 54, train_loss: 0.1399, test_loss: 2.0591, test_f1: 0.5955
 epoch: 55, train_loss: 0.1288, test_loss: 2.0659, test_f1: 0.6211
 epoch: 56, train_loss: 0.1155, test_loss: 2.1896, test_f1: 0.6078
 epoch: 57, train_loss: 0.1144, test_loss: 2.2852, test_f1: 0.5892
 epoch: 58, train_loss: 0.1212, test_loss: 2.1617, test_f1: 0.6163
 epoch: 59, train_loss: 0.1082, test_loss: 2.4165, test_f1: 0.5995
 epoch: 60, train_loss: 0.1008, test_loss: 2.4734, test_f1: 0.6233
 epoch: 61, train_loss: 0.0998, test_loss: 2.4530, test_f1: 0.5624
 epoch: 62, train_loss: 0.0917, test_loss: 2.5412, test_f1: 0.5834
 epoch: 63, train_loss: 0.0829, test_loss: 2.5872, test_f1: 0.5825
 epoch: 64, train_loss: 0.1083, test_loss: 2.7581, test_f1: 0.5707
 epoch: 65, train_loss: 0.1530, test_loss: 2.8458, test_f1: 0.5389
 epoch: 66, train_loss: 0.1237, test_loss: 2.7592, test_f1: 0.5884
 epoch: 67, train_loss: 0.1099, test_loss: 2.7257, test_f1: 0.5761
 epoch: 68, train_loss: 0.0992, test_loss: 2.8132, test_f1: 0.5661
 epoch: 69, train_loss: 0.0923, test_loss: 2.7980, test_f1: 0.5605
 epoch: 70, train_loss: 0.1359, test_loss: 2.5141, test_f1: 0.5719
 epoch: 71, train_loss: 0.1015, test_loss: 2.5712, test_f1: 0.5692
 epoch: 72, train_loss: 0.0975, test_loss: 2.7714, test_f1: 0.5888
 epoch: 73, train_loss: 0.0946, test_loss: 2.8360, test_f1: 0.5979
 epoch: 74, train_loss: 0.1226, test_loss: 2.8474, test_f1: 0.5987
 epoch: 75, train_loss: 0.0897, test_loss: 3.2228, test_f1: 0.5918
 epoch: 76, train_loss: 0.0848, test_loss: 3.1178, test_f1: 0.6037
 epoch: 77, train_loss: 0.0805, test_loss: 3.1104, test_f1: 0.6024
 epoch: 78, train_loss: 0.1203, test_loss: 2.7870, test_f1: 0.6003
 epoch: 79, train_loss: 0.1128, test_loss: 2.9268, test_f1: 0.5878
 epoch: 80, train_loss: 0.1635, test_loss: 2.9009, test_f1: 0.6048
 epoch: 81, train_loss: 0.1482, test_loss: 2.6104, test_f1: 0.5754
 epoch: 82, train_loss: 0.1237, test_loss: 2.9819, test_f1: 0.5621
 epoch: 83, train_loss: 0.1202, test_loss: 2.7987, test_f1: 0.6056
 epoch: 84, train_loss: 0.0930, test_loss: 3.1810, test_f1: 0.5996
 epoch: 85, train_loss: 0.0826, test_loss: 3.0901, test_f1: 0.5342
 epoch: 86, train_loss: 0.0609, test_loss: 3.2253, test_f1: 0.5576
 epoch: 87, train_loss: 0.0536, test_loss: 3.0947, test_f1: 0.5734
 epoch: 88, train_loss: 0.0590, test_loss: 3.3471, test_f1: 0.5633
 epoch: 89, train_loss: 0.0737, test_loss: 3.2943, test_f1: 0.5791
 epoch: 90, train_loss: 0.0771, test_loss: 3.4046, test_f1: 0.5588
 epoch: 91, train_loss: 0.0607, test_loss: 3.3520, test_f1: 0.5775
 epoch: 92, train_loss: 0.0725, test_loss: 3.3640, test_f1: 0.5747
 epoch: 93, train_loss: 0.0778, test_loss: 3.3727, test_f1: 0.5901
 epoch: 94, train_loss: 0.0604, test_loss: 3.4697, test_f1: 0.5740
 epoch: 95, train_loss: 0.0669, test_loss: 3.5384, test_f1: 0.5745
 epoch: 96, train_loss: 0.0711, test_loss: 3.4008, test_f1: 0.5509
 epoch: 97, train_loss: 0.1372, test_loss: 3.3143, test_f1: 0.5756
 epoch: 98, train_loss: 0.1060, test_loss: 3.4083, test_f1: 0.5763
 epoch: 99, train_loss: 0.0926, test_loss: 3.1283, test_f1: 0.5619
##################ITERATION #2 ****************************************
 epoch: 0, train_loss: 1.1770, test_loss: 1.3525, test_f1: 0.2865
 epoch: 1, train_loss: 0.9810, test_loss: 1.4352, test_f1: 0.2268
 epoch: 2, train_loss: 0.8928, test_loss: 1.5502, test_f1: 0.2761
 epoch: 3, train_loss: 0.8388, test_loss: 1.5249, test_f1: 0.3199
 epoch: 4, train_loss: 0.8012, test_loss: 1.2699, test_f1: 0.4581
 epoch: 5, train_loss: 0.7764, test_loss: 1.0173, test_f1: 0.5757
 epoch: 6, train_loss: 0.7624, test_loss: 0.9943, test_f1: 0.6082
 epoch: 7, train_loss: 0.7259, test_loss: 0.9751, test_f1: 0.6107
 epoch: 8, train_loss: 0.6824, test_loss: 1.0198, test_f1: 0.5859
 epoch: 9, train_loss: 0.6839, test_loss: 1.0406, test_f1: 0.5983
 epoch: 10, train_loss: 0.6341, test_loss: 1.0794, test_f1: 0.5796
 epoch: 11, train_loss: 0.6165, test_loss: 0.9846, test_f1: 0.5891
 epoch: 12, train_loss: 0.5865, test_loss: 1.1575, test_f1: 0.5356
 epoch: 13, train_loss: 0.5792, test_loss: 1.1547, test_f1: 0.5846
 epoch: 14, train_loss: 0.5806, test_loss: 1.2382, test_f1: 0.5747
 epoch: 15, train_loss: 0.5507, test_loss: 1.1610, test_f1: 0.6200
 epoch: 16, train_loss: 0.5303, test_loss: 1.0856, test_f1: 0.6197
 epoch: 17, train_loss: 0.5973, test_loss: 1.2466, test_f1: 0.5583
 epoch: 18, train_loss: 0.5495, test_loss: 1.2413, test_f1: 0.6147
 epoch: 19, train_loss: 0.5178, test_loss: 1.1726, test_f1: 0.6015
 epoch: 20, train_loss: 0.4775, test_loss: 1.0966, test_f1: 0.5996
 epoch: 21, train_loss: 0.4327, test_loss: 1.2259, test_f1: 0.6330
 epoch: 22, train_loss: 0.4530, test_loss: 1.2803, test_f1: 0.6049
 epoch: 23, train_loss: 0.4376, test_loss: 1.2976, test_f1: 0.6499
 epoch: 24, train_loss: 0.4253, test_loss: 1.2711, test_f1: 0.6171
 epoch: 25, train_loss: 0.3913, test_loss: 1.4061, test_f1: 0.6266
 epoch: 26, train_loss: 0.4098, test_loss: 1.2666, test_f1: 0.6522
 epoch: 27, train_loss: 0.3751, test_loss: 1.3378, test_f1: 0.6666
 epoch: 28, train_loss: 0.3479, test_loss: 1.2789, test_f1: 0.6389
 epoch: 29, train_loss: 0.3702, test_loss: 1.5611, test_f1: 0.6236
 epoch: 30, train_loss: 0.3696, test_loss: 1.3156, test_f1: 0.6470
 epoch: 31, train_loss: 0.3169, test_loss: 1.3405, test_f1: 0.6505
 epoch: 32, train_loss: 0.2873, test_loss: 1.5123, test_f1: 0.6647
 epoch: 33, train_loss: 0.3630, test_loss: 1.4641, test_f1: 0.6285
 epoch: 34, train_loss: 0.3564, test_loss: 1.5559, test_f1: 0.6945
 epoch: 35, train_loss: 0.3433, test_loss: 1.5023, test_f1: 0.6111
 epoch: 36, train_loss: 0.2993, test_loss: 1.4208, test_f1: 0.6881
 epoch: 37, train_loss: 0.2882, test_loss: 1.4134, test_f1: 0.6513
 epoch: 38, train_loss: 0.2591, test_loss: 1.6374, test_f1: 0.6942
 epoch: 39, train_loss: 0.2829, test_loss: 1.6177, test_f1: 0.6794
 epoch: 40, train_loss: 0.2387, test_loss: 1.5516, test_f1: 0.6659
 epoch: 41, train_loss: 0.2625, test_loss: 1.6200, test_f1: 0.6547
 epoch: 42, train_loss: 0.2207, test_loss: 1.7887, test_f1: 0.6358
 epoch: 43, train_loss: 0.2298, test_loss: 1.9064, test_f1: 0.5924
 epoch: 44, train_loss: 0.2538, test_loss: 1.8500, test_f1: 0.6630
 epoch: 45, train_loss: 0.2425, test_loss: 1.6817, test_f1: 0.6417
 epoch: 46, train_loss: 0.2185, test_loss: 2.1920, test_f1: 0.6073
 epoch: 47, train_loss: 0.2525, test_loss: 1.9274, test_f1: 0.6112
 epoch: 48, train_loss: 0.2235, test_loss: 1.9251, test_f1: 0.6594
 epoch: 49, train_loss: 0.2064, test_loss: 1.9020, test_f1: 0.6838
 epoch: 50, train_loss: 0.2360, test_loss: 1.8551, test_f1: 0.6477
 epoch: 51, train_loss: 0.1728, test_loss: 1.8741, test_f1: 0.6452
 epoch: 52, train_loss: 0.1757, test_loss: 1.7993, test_f1: 0.6616
 epoch: 53, train_loss: 0.1520, test_loss: 1.8928, test_f1: 0.6640
 epoch: 54, train_loss: 0.2140, test_loss: 1.9154, test_f1: 0.6518
 epoch: 55, train_loss: 0.1599, test_loss: 2.1066, test_f1: 0.6396
 epoch: 56, train_loss: 0.1413, test_loss: 1.8280, test_f1: 0.6774
 epoch: 57, train_loss: 0.1232, test_loss: 1.9279, test_f1: 0.6635
 epoch: 58, train_loss: 0.1139, test_loss: 2.1404, test_f1: 0.6553
 epoch: 59, train_loss: 0.1056, test_loss: 2.2161, test_f1: 0.6372
 epoch: 60, train_loss: 0.1151, test_loss: 2.1674, test_f1: 0.6558
 epoch: 61, train_loss: 0.0981, test_loss: 2.1097, test_f1: 0.6534
 epoch: 62, train_loss: 0.0935, test_loss: 2.1322, test_f1: 0.6845
 epoch: 63, train_loss: 0.0856, test_loss: 2.3313, test_f1: 0.6696
 epoch: 64, train_loss: 0.0981, test_loss: 2.2944, test_f1: 0.6898
 epoch: 65, train_loss: 0.1015, test_loss: 2.4047, test_f1: 0.6399
 epoch: 66, train_loss: 0.0914, test_loss: 2.3607, test_f1: 0.6484
 epoch: 67, train_loss: 0.0829, test_loss: 2.2340, test_f1: 0.6661
 epoch: 68, train_loss: 0.0691, test_loss: 2.2550, test_f1: 0.6688
 epoch: 69, train_loss: 0.0690, test_loss: 2.4943, test_f1: 0.6600
 epoch: 70, train_loss: 0.0877, test_loss: 2.4306, test_f1: 0.6708
 epoch: 71, train_loss: 0.1021, test_loss: 2.5833, test_f1: 0.6579
 epoch: 72, train_loss: 0.0864, test_loss: 2.4811, test_f1: 0.6600
 epoch: 73, train_loss: 0.1074, test_loss: 2.5482, test_f1: 0.6255
 epoch: 74, train_loss: 0.0919, test_loss: 2.6232, test_f1: 0.6436
 epoch: 75, train_loss: 0.0818, test_loss: 2.6514, test_f1: 0.6403
 epoch: 76, train_loss: 0.1152, test_loss: 2.4289, test_f1: 0.6252
 epoch: 77, train_loss: 0.0947, test_loss: 2.6994, test_f1: 0.6313
 epoch: 78, train_loss: 0.0999, test_loss: 2.3847, test_f1: 0.6671
 epoch: 79, train_loss: 0.1059, test_loss: 2.6199, test_f1: 0.6162
 epoch: 80, train_loss: 0.0936, test_loss: 2.4898, test_f1: 0.6524
 epoch: 81, train_loss: 0.1305, test_loss: 2.5565, test_f1: 0.6531
 epoch: 82, train_loss: 0.1153, test_loss: 2.4515, test_f1: 0.6398
 epoch: 83, train_loss: 0.1037, test_loss: 2.8565, test_f1: 0.6230
 epoch: 84, train_loss: 0.0775, test_loss: 2.5983, test_f1: 0.6536
 epoch: 85, train_loss: 0.0794, test_loss: 2.5455, test_f1: 0.6450
 epoch: 86, train_loss: 0.0831, test_loss: 2.6558, test_f1: 0.6431
 epoch: 87, train_loss: 0.0794, test_loss: 2.5450, test_f1: 0.6381
 epoch: 88, train_loss: 0.0686, test_loss: 2.4535, test_f1: 0.6532
 epoch: 89, train_loss: 0.1032, test_loss: 2.3474, test_f1: 0.6680
 epoch: 90, train_loss: 0.1002, test_loss: 2.5275, test_f1: 0.6390
 epoch: 91, train_loss: 0.0659, test_loss: 2.7095, test_f1: 0.6422
 epoch: 92, train_loss: 0.0609, test_loss: 2.6515, test_f1: 0.6597
 epoch: 93, train_loss: 0.0575, test_loss: 2.7664, test_f1: 0.6192
 epoch: 94, train_loss: 0.0451, test_loss: 2.7651, test_f1: 0.6536
 epoch: 95, train_loss: 0.0717, test_loss: 2.8526, test_f1: 0.6433
 epoch: 96, train_loss: 0.0766, test_loss: 2.8355, test_f1: 0.6725
 epoch: 97, train_loss: 0.0750, test_loss: 3.0557, test_f1: 0.6501
 epoch: 98, train_loss: 0.0648, test_loss: 2.9741, test_f1: 0.6488
 epoch: 99, train_loss: 0.0504, test_loss: 3.1265, test_f1: 0.6338
##################ITERATION #3 ****************************************
 epoch: 0, train_loss: 1.1587, test_loss: 1.3297, test_f1: 0.2655
 epoch: 1, train_loss: 0.9643, test_loss: 1.3606, test_f1: 0.2630
 epoch: 2, train_loss: 0.8894, test_loss: 1.2574, test_f1: 0.2594
 epoch: 3, train_loss: 0.8062, test_loss: 1.1361, test_f1: 0.4493
 epoch: 4, train_loss: 0.7953, test_loss: 1.0312, test_f1: 0.5225
 epoch: 5, train_loss: 0.7487, test_loss: 1.0313, test_f1: 0.5601
 epoch: 6, train_loss: 0.7272, test_loss: 1.0628, test_f1: 0.5650
 epoch: 7, train_loss: 0.7193, test_loss: 1.0936, test_f1: 0.5849
 epoch: 8, train_loss: 0.6844, test_loss: 1.1637, test_f1: 0.5230
 epoch: 9, train_loss: 0.6723, test_loss: 1.3183, test_f1: 0.5323
 epoch: 10, train_loss: 0.6622, test_loss: 1.0597, test_f1: 0.5595
 epoch: 11, train_loss: 0.6486, test_loss: 1.1876, test_f1: 0.5378
 epoch: 12, train_loss: 0.6161, test_loss: 1.1603, test_f1: 0.6147
 epoch: 13, train_loss: 0.5829, test_loss: 1.0045, test_f1: 0.6231
 epoch: 14, train_loss: 0.5557, test_loss: 1.3133, test_f1: 0.5847
 epoch: 15, train_loss: 0.5517, test_loss: 1.1643, test_f1: 0.5759
 epoch: 16, train_loss: 0.5382, test_loss: 1.2545, test_f1: 0.5615
 epoch: 17, train_loss: 0.4956, test_loss: 1.5156, test_f1: 0.6371
 epoch: 18, train_loss: 0.4984, test_loss: 1.4647, test_f1: 0.5863
 epoch: 19, train_loss: 0.5021, test_loss: 1.2341, test_f1: 0.6069
 epoch: 20, train_loss: 0.4863, test_loss: 1.4752, test_f1: 0.5667
 epoch: 21, train_loss: 0.4443, test_loss: 1.1916, test_f1: 0.6684
 epoch: 22, train_loss: 0.4319, test_loss: 1.4281, test_f1: 0.6137
 epoch: 23, train_loss: 0.4081, test_loss: 1.3656, test_f1: 0.6047
 epoch: 24, train_loss: 0.4131, test_loss: 1.2616, test_f1: 0.6660
 epoch: 25, train_loss: 0.4246, test_loss: 1.3924, test_f1: 0.6192
 epoch: 26, train_loss: 0.4112, test_loss: 1.3036, test_f1: 0.5687
 epoch: 27, train_loss: 0.4194, test_loss: 1.9947, test_f1: 0.5901
 epoch: 28, train_loss: 0.3939, test_loss: 1.5377, test_f1: 0.5884
 epoch: 29, train_loss: 0.3707, test_loss: 1.6022, test_f1: 0.6054
 epoch: 30, train_loss: 0.3499, test_loss: 1.5022, test_f1: 0.6290
 epoch: 31, train_loss: 0.3569, test_loss: 1.5711, test_f1: 0.6036
 epoch: 32, train_loss: 0.3618, test_loss: 1.7813, test_f1: 0.5918
 epoch: 33, train_loss: 0.3425, test_loss: 2.0837, test_f1: 0.5862
 epoch: 34, train_loss: 0.3561, test_loss: 1.6945, test_f1: 0.5954
 epoch: 35, train_loss: 0.3010, test_loss: 1.6269, test_f1: 0.6077
 epoch: 36, train_loss: 0.3017, test_loss: 1.7152, test_f1: 0.5781
 epoch: 37, train_loss: 0.2751, test_loss: 1.6904, test_f1: 0.6652
 epoch: 38, train_loss: 0.2603, test_loss: 1.7310, test_f1: 0.5889
 epoch: 39, train_loss: 0.2581, test_loss: 1.7071, test_f1: 0.6326
 epoch: 40, train_loss: 0.2764, test_loss: 1.8372, test_f1: 0.6262
 epoch: 41, train_loss: 0.2504, test_loss: 2.0012, test_f1: 0.5805
 epoch: 42, train_loss: 0.2798, test_loss: 1.9917, test_f1: 0.6177
 epoch: 43, train_loss: 0.2503, test_loss: 1.9137, test_f1: 0.6426
 epoch: 44, train_loss: 0.2394, test_loss: 2.0336, test_f1: 0.5781
 epoch: 45, train_loss: 0.2411, test_loss: 1.8888, test_f1: 0.6069
 epoch: 46, train_loss: 0.2652, test_loss: 2.0598, test_f1: 0.5636
 epoch: 47, train_loss: 0.2280, test_loss: 2.2082, test_f1: 0.6187
 epoch: 48, train_loss: 0.2268, test_loss: 2.3951, test_f1: 0.5879
 epoch: 49, train_loss: 0.2280, test_loss: 2.1361, test_f1: 0.5930
 epoch: 50, train_loss: 0.2445, test_loss: 2.2126, test_f1: 0.6219
 epoch: 51, train_loss: 0.2101, test_loss: 2.0033, test_f1: 0.6132
 epoch: 52, train_loss: 0.2141, test_loss: 2.1123, test_f1: 0.5971
 epoch: 53, train_loss: 0.1829, test_loss: 2.0963, test_f1: 0.6158
 epoch: 54, train_loss: 0.1482, test_loss: 2.1795, test_f1: 0.6146
 epoch: 55, train_loss: 0.1517, test_loss: 2.1318, test_f1: 0.6403
 epoch: 56, train_loss: 0.1299, test_loss: 2.2260, test_f1: 0.6128
 epoch: 57, train_loss: 0.1327, test_loss: 2.2302, test_f1: 0.6084
 epoch: 58, train_loss: 0.1220, test_loss: 2.3204, test_f1: 0.5995
 epoch: 59, train_loss: 0.1350, test_loss: 2.3922, test_f1: 0.6223
 epoch: 60, train_loss: 0.1225, test_loss: 2.3326, test_f1: 0.6312
 epoch: 61, train_loss: 0.1241, test_loss: 2.4814, test_f1: 0.6259
 epoch: 62, train_loss: 0.1143, test_loss: 2.4193, test_f1: 0.6219
 epoch: 63, train_loss: 0.1358, test_loss: 2.5701, test_f1: 0.5955
 epoch: 64, train_loss: 0.1261, test_loss: 2.3372, test_f1: 0.6177
 epoch: 65, train_loss: 0.1124, test_loss: 2.4440, test_f1: 0.6309
 epoch: 66, train_loss: 0.0968, test_loss: 2.4310, test_f1: 0.6269
 epoch: 67, train_loss: 0.1048, test_loss: 2.5504, test_f1: 0.6044
 epoch: 68, train_loss: 0.1055, test_loss: 2.6859, test_f1: 0.6084
 epoch: 69, train_loss: 0.1312, test_loss: 2.3748, test_f1: 0.6021
 epoch: 70, train_loss: 0.1360, test_loss: 2.6402, test_f1: 0.6009
 epoch: 71, train_loss: 0.1160, test_loss: 2.5408, test_f1: 0.6242
 epoch: 72, train_loss: 0.1268, test_loss: 2.7212, test_f1: 0.5866
 epoch: 73, train_loss: 0.0913, test_loss: 2.6385, test_f1: 0.5900
 epoch: 74, train_loss: 0.0888, test_loss: 2.7943, test_f1: 0.6102
 epoch: 75, train_loss: 0.1012, test_loss: 2.7106, test_f1: 0.5992
 epoch: 76, train_loss: 0.0896, test_loss: 2.8520, test_f1: 0.6143
 epoch: 77, train_loss: 0.0765, test_loss: 2.7664, test_f1: 0.6134
 epoch: 78, train_loss: 0.0843, test_loss: 2.8159, test_f1: 0.6014
 epoch: 79, train_loss: 0.0707, test_loss: 2.7052, test_f1: 0.6064
 epoch: 80, train_loss: 0.0715, test_loss: 2.7860, test_f1: 0.5988
 epoch: 81, train_loss: 0.0693, test_loss: 3.0862, test_f1: 0.5904
 epoch: 82, train_loss: 0.0767, test_loss: 3.0113, test_f1: 0.6014
 epoch: 83, train_loss: 0.0803, test_loss: 3.0752, test_f1: 0.5893
 epoch: 84, train_loss: 0.1668, test_loss: 2.7275, test_f1: 0.5949
 epoch: 85, train_loss: 0.1279, test_loss: 3.3517, test_f1: 0.5810
 epoch: 86, train_loss: 0.0839, test_loss: 3.1880, test_f1: 0.6024
 epoch: 87, train_loss: 0.0864, test_loss: 2.7450, test_f1: 0.6187
 epoch: 88, train_loss: 0.0845, test_loss: 3.0201, test_f1: 0.6018
 epoch: 89, train_loss: 0.0819, test_loss: 3.1345, test_f1: 0.5857
 epoch: 90, train_loss: 0.0645, test_loss: 3.0912, test_f1: 0.5974
 epoch: 91, train_loss: 0.0842, test_loss: 3.1107, test_f1: 0.6027
 epoch: 92, train_loss: 0.0783, test_loss: 3.0239, test_f1: 0.6067
 epoch: 93, train_loss: 0.0813, test_loss: 3.0108, test_f1: 0.5941
 epoch: 94, train_loss: 0.0965, test_loss: 3.1191, test_f1: 0.6135
 epoch: 95, train_loss: 0.0871, test_loss: 3.0200, test_f1: 0.6104
 epoch: 96, train_loss: 0.1000, test_loss: 3.1547, test_f1: 0.5907
 epoch: 97, train_loss: 0.0674, test_loss: 3.1726, test_f1: 0.5730
 epoch: 98, train_loss: 0.1486, test_loss: 3.0729, test_f1: 0.5925
 epoch: 99, train_loss: 0.1014, test_loss: 3.1070, test_f1: 0.5691
##################ITERATION #4 ****************************************
 epoch: 0, train_loss: 1.1612, test_loss: 1.3672, test_f1: 0.3472
 epoch: 1, train_loss: 0.9727, test_loss: 1.4591, test_f1: 0.2629
 epoch: 2, train_loss: 0.8901, test_loss: 1.4536, test_f1: 0.3045
 epoch: 3, train_loss: 0.8445, test_loss: 1.5442, test_f1: 0.3103
 epoch: 4, train_loss: 0.8099, test_loss: 1.3167, test_f1: 0.4182
 epoch: 5, train_loss: 0.7600, test_loss: 1.1644, test_f1: 0.5455
 epoch: 6, train_loss: 0.7498, test_loss: 1.0677, test_f1: 0.5806
 epoch: 7, train_loss: 0.7233, test_loss: 1.1066, test_f1: 0.6206
 epoch: 8, train_loss: 0.6904, test_loss: 1.0671, test_f1: 0.5988
 epoch: 9, train_loss: 0.6803, test_loss: 1.1681, test_f1: 0.6110
 epoch: 10, train_loss: 0.6563, test_loss: 1.1226, test_f1: 0.6135
 epoch: 11, train_loss: 0.6233, test_loss: 1.3551, test_f1: 0.5521
 epoch: 12, train_loss: 0.6525, test_loss: 1.1463, test_f1: 0.5628
 epoch: 13, train_loss: 0.6029, test_loss: 1.2720, test_f1: 0.5249
 epoch: 14, train_loss: 0.5783, test_loss: 1.2267, test_f1: 0.6016
 epoch: 15, train_loss: 0.6100, test_loss: 1.5525, test_f1: 0.5343
 epoch: 16, train_loss: 0.5695, test_loss: 1.2140, test_f1: 0.5993
 epoch: 17, train_loss: 0.5612, test_loss: 1.1252, test_f1: 0.6264
 epoch: 18, train_loss: 0.5533, test_loss: 1.1730, test_f1: 0.6385
 epoch: 19, train_loss: 0.5483, test_loss: 1.3483, test_f1: 0.5911
 epoch: 20, train_loss: 0.5329, test_loss: 1.0773, test_f1: 0.6470
 epoch: 21, train_loss: 0.4881, test_loss: 1.1905, test_f1: 0.6499
 epoch: 22, train_loss: 0.4574, test_loss: 1.3708, test_f1: 0.5847
 epoch: 23, train_loss: 0.4569, test_loss: 1.4671, test_f1: 0.5925
 epoch: 24, train_loss: 0.4353, test_loss: 1.5685, test_f1: 0.6277
 epoch: 25, train_loss: 0.4149, test_loss: 1.5189, test_f1: 0.5842
 epoch: 26, train_loss: 0.4149, test_loss: 1.5605, test_f1: 0.5666
 epoch: 27, train_loss: 0.4061, test_loss: 1.4630, test_f1: 0.5704
 epoch: 28, train_loss: 0.3725, test_loss: 1.5691, test_f1: 0.6131
 epoch: 29, train_loss: 0.3771, test_loss: 1.5193, test_f1: 0.6392
 epoch: 30, train_loss: 0.3782, test_loss: 1.5562, test_f1: 0.5753
 epoch: 31, train_loss: 0.4055, test_loss: 1.6088, test_f1: 0.6021
 epoch: 32, train_loss: 0.4135, test_loss: 1.5113, test_f1: 0.6186
 epoch: 33, train_loss: 0.3497, test_loss: 1.8224, test_f1: 0.6180
 epoch: 34, train_loss: 0.3248, test_loss: 1.8824, test_f1: 0.5297
 epoch: 35, train_loss: 0.3080, test_loss: 1.8896, test_f1: 0.6026
 epoch: 36, train_loss: 0.3382, test_loss: 1.9016, test_f1: 0.6256
 epoch: 37, train_loss: 0.3124, test_loss: 1.9936, test_f1: 0.6344
 epoch: 38, train_loss: 0.2998, test_loss: 1.8351, test_f1: 0.5962
 epoch: 39, train_loss: 0.3197, test_loss: 1.7254, test_f1: 0.5686
 epoch: 40, train_loss: 0.2990, test_loss: 1.5639, test_f1: 0.5803
 epoch: 41, train_loss: 0.3136, test_loss: 1.7296, test_f1: 0.5907
 epoch: 42, train_loss: 0.2767, test_loss: 1.6305, test_f1: 0.6301
 epoch: 43, train_loss: 0.2720, test_loss: 1.8968, test_f1: 0.5614
 epoch: 44, train_loss: 0.2740, test_loss: 2.5635, test_f1: 0.5509
 epoch: 45, train_loss: 0.3562, test_loss: 1.7718, test_f1: 0.6120
 epoch: 46, train_loss: 0.2952, test_loss: 2.2027, test_f1: 0.5973
 epoch: 47, train_loss: 0.2755, test_loss: 1.6476, test_f1: 0.6615
 epoch: 48, train_loss: 0.2581, test_loss: 1.6753, test_f1: 0.6445
 epoch: 49, train_loss: 0.2503, test_loss: 1.9808, test_f1: 0.6138
 epoch: 50, train_loss: 0.2451, test_loss: 1.9160, test_f1: 0.5827
 epoch: 51, train_loss: 0.2390, test_loss: 2.1059, test_f1: 0.5688
 epoch: 52, train_loss: 0.1831, test_loss: 2.0984, test_f1: 0.6166
 epoch: 53, train_loss: 0.1844, test_loss: 1.9793, test_f1: 0.6142
 epoch: 54, train_loss: 0.1592, test_loss: 2.0698, test_f1: 0.6129
 epoch: 55, train_loss: 0.1498, test_loss: 2.1822, test_f1: 0.6020
 epoch: 56, train_loss: 0.1615, test_loss: 2.3150, test_f1: 0.5743
 epoch: 57, train_loss: 0.1495, test_loss: 2.0148, test_f1: 0.6372
 epoch: 58, train_loss: 0.1466, test_loss: 2.1091, test_f1: 0.6171
 epoch: 59, train_loss: 0.1372, test_loss: 2.4020, test_f1: 0.5903
 epoch: 60, train_loss: 0.1383, test_loss: 2.2833, test_f1: 0.6142
 epoch: 61, train_loss: 0.1182, test_loss: 2.2416, test_f1: 0.6341
 epoch: 62, train_loss: 0.1809, test_loss: 2.6821, test_f1: 0.5725
 epoch: 63, train_loss: 0.1561, test_loss: 2.4378, test_f1: 0.6355
 epoch: 64, train_loss: 0.1291, test_loss: 2.3982, test_f1: 0.6089
 epoch: 65, train_loss: 0.1176, test_loss: 2.2999, test_f1: 0.5679
 epoch: 66, train_loss: 0.1105, test_loss: 2.6088, test_f1: 0.5692
 epoch: 67, train_loss: 0.1072, test_loss: 2.6514, test_f1: 0.5881
 epoch: 68, train_loss: 0.1471, test_loss: 2.5919, test_f1: 0.6049
 epoch: 69, train_loss: 0.1227, test_loss: 2.3737, test_f1: 0.6061
 epoch: 70, train_loss: 0.1166, test_loss: 2.6056, test_f1: 0.5785
 epoch: 71, train_loss: 0.1121, test_loss: 2.5408, test_f1: 0.6075
 epoch: 72, train_loss: 0.0987, test_loss: 2.7484, test_f1: 0.5912
 epoch: 73, train_loss: 0.1224, test_loss: 2.5268, test_f1: 0.6111
 epoch: 74, train_loss: 0.1293, test_loss: 2.8123, test_f1: 0.5976
 epoch: 75, train_loss: 0.1311, test_loss: 2.6804, test_f1: 0.6092
 epoch: 76, train_loss: 0.1629, test_loss: 2.3749, test_f1: 0.6089
 epoch: 77, train_loss: 0.1360, test_loss: 2.8557, test_f1: 0.5925
 epoch: 78, train_loss: 0.1193, test_loss: 2.6693, test_f1: 0.6274
 epoch: 79, train_loss: 0.1192, test_loss: 2.7943, test_f1: 0.6166
 epoch: 80, train_loss: 0.1348, test_loss: 2.6774, test_f1: 0.5748
 epoch: 81, train_loss: 0.1233, test_loss: 2.5948, test_f1: 0.6099
 epoch: 82, train_loss: 0.0921, test_loss: 2.6894, test_f1: 0.5923
 epoch: 83, train_loss: 0.0846, test_loss: 2.8399, test_f1: 0.5908
 epoch: 84, train_loss: 0.0815, test_loss: 2.6625, test_f1: 0.6018
 epoch: 85, train_loss: 0.1115, test_loss: 2.7771, test_f1: 0.5997
 epoch: 86, train_loss: 0.0931, test_loss: 3.1690, test_f1: 0.5768
 epoch: 87, train_loss: 0.0964, test_loss: 3.0636, test_f1: 0.5536
 epoch: 88, train_loss: 0.0743, test_loss: 3.1960, test_f1: 0.5918
 epoch: 89, train_loss: 0.0908, test_loss: 3.1763, test_f1: 0.5980
 epoch: 90, train_loss: 0.0826, test_loss: 2.9827, test_f1: 0.5540
 epoch: 91, train_loss: 0.0674, test_loss: 2.9425, test_f1: 0.6163
 epoch: 92, train_loss: 0.0723, test_loss: 3.1745, test_f1: 0.5981
 epoch: 93, train_loss: 0.0664, test_loss: 3.0296, test_f1: 0.5988
 epoch: 94, train_loss: 0.0637, test_loss: 2.8199, test_f1: 0.5785
 epoch: 95, train_loss: 0.1126, test_loss: 2.7192, test_f1: 0.6061
 epoch: 96, train_loss: 0.1390, test_loss: 2.9291, test_f1: 0.6026
 epoch: 97, train_loss: 0.0960, test_loss: 3.0470, test_f1: 0.5863
 epoch: 98, train_loss: 0.0921, test_loss: 2.9969, test_f1: 0.5721
 epoch: 99, train_loss: 0.0903, test_loss: 2.9819, test_f1: 0.5859
##################ITERATION #5 ****************************************
 epoch: 0, train_loss: 1.2190, test_loss: 1.3911, test_f1: 0.2992
 epoch: 1, train_loss: 0.9673, test_loss: 1.3983, test_f1: 0.3227
 epoch: 2, train_loss: 0.9039, test_loss: 1.3610, test_f1: 0.3782
 epoch: 3, train_loss: 0.8290, test_loss: 1.1677, test_f1: 0.4437
 epoch: 4, train_loss: 0.8025, test_loss: 1.0154, test_f1: 0.5829
 epoch: 5, train_loss: 0.7783, test_loss: 1.0188, test_f1: 0.5783
 epoch: 6, train_loss: 0.7411, test_loss: 1.0145, test_f1: 0.6190
 epoch: 7, train_loss: 0.7330, test_loss: 0.9723, test_f1: 0.5900
 epoch: 8, train_loss: 0.6814, test_loss: 1.0007, test_f1: 0.6372
 epoch: 9, train_loss: 0.6753, test_loss: 1.0576, test_f1: 0.5614
 epoch: 10, train_loss: 0.6603, test_loss: 1.1310, test_f1: 0.5497
 epoch: 11, train_loss: 0.6410, test_loss: 1.3292, test_f1: 0.5494
 epoch: 12, train_loss: 0.5866, test_loss: 1.1238, test_f1: 0.6268
 epoch: 13, train_loss: 0.5920, test_loss: 1.2971, test_f1: 0.5354
 epoch: 14, train_loss: 0.5488, test_loss: 1.0669, test_f1: 0.6551
 epoch: 15, train_loss: 0.5410, test_loss: 1.1888, test_f1: 0.6067
 epoch: 16, train_loss: 0.5347, test_loss: 1.4603, test_f1: 0.5540
 epoch: 17, train_loss: 0.5346, test_loss: 1.2762, test_f1: 0.6177
 epoch: 18, train_loss: 0.5241, test_loss: 1.1419, test_f1: 0.5863
 epoch: 19, train_loss: 0.4935, test_loss: 1.3789, test_f1: 0.5476
 epoch: 20, train_loss: 0.4488, test_loss: 1.2073, test_f1: 0.6099
 epoch: 21, train_loss: 0.4609, test_loss: 1.4115, test_f1: 0.5993
 epoch: 22, train_loss: 0.4375, test_loss: 1.3435, test_f1: 0.5825
 epoch: 23, train_loss: 0.4194, test_loss: 1.4911, test_f1: 0.6189
 epoch: 24, train_loss: 0.4158, test_loss: 1.3482, test_f1: 0.6009
 epoch: 25, train_loss: 0.3795, test_loss: 1.3764, test_f1: 0.5741
 epoch: 26, train_loss: 0.3931, test_loss: 1.7397, test_f1: 0.5553
 epoch: 27, train_loss: 0.4124, test_loss: 1.8299, test_f1: 0.5301
 epoch: 28, train_loss: 0.3226, test_loss: 1.4861, test_f1: 0.6039
 epoch: 29, train_loss: 0.3354, test_loss: 1.6262, test_f1: 0.5827
 epoch: 30, train_loss: 0.3468, test_loss: 1.9134, test_f1: 0.5252
 epoch: 31, train_loss: 0.3219, test_loss: 1.6355, test_f1: 0.5998
 epoch: 32, train_loss: 0.2996, test_loss: 1.5994, test_f1: 0.6055
 epoch: 33, train_loss: 0.2973, test_loss: 1.7436, test_f1: 0.5932
 epoch: 34, train_loss: 0.2989, test_loss: 1.6220, test_f1: 0.5934
 epoch: 35, train_loss: 0.3129, test_loss: 1.7498, test_f1: 0.5916
 epoch: 36, train_loss: 0.2782, test_loss: 1.7660, test_f1: 0.5825
 epoch: 37, train_loss: 0.3052, test_loss: 1.8578, test_f1: 0.6275
 epoch: 38, train_loss: 0.2797, test_loss: 1.7456, test_f1: 0.5713
 epoch: 39, train_loss: 0.2530, test_loss: 1.6164, test_f1: 0.6229
 epoch: 40, train_loss: 0.2690, test_loss: 2.1130, test_f1: 0.5731
 epoch: 41, train_loss: 0.2810, test_loss: 1.6853, test_f1: 0.6204
 epoch: 42, train_loss: 0.2360, test_loss: 1.8308, test_f1: 0.5982
 epoch: 43, train_loss: 0.2133, test_loss: 1.7958, test_f1: 0.6020
 epoch: 44, train_loss: 0.2209, test_loss: 1.9640, test_f1: 0.5891
 epoch: 45, train_loss: 0.2164, test_loss: 2.0225, test_f1: 0.5946
 epoch: 46, train_loss: 0.1844, test_loss: 1.8306, test_f1: 0.6235
 epoch: 47, train_loss: 0.1488, test_loss: 2.2725, test_f1: 0.6101
 epoch: 48, train_loss: 0.2236, test_loss: 2.0051, test_f1: 0.5896
 epoch: 49, train_loss: 0.1997, test_loss: 2.2217, test_f1: 0.5979
 epoch: 50, train_loss: 0.2101, test_loss: 1.9840, test_f1: 0.6037
 epoch: 51, train_loss: 0.1632, test_loss: 2.1569, test_f1: 0.5881
 epoch: 52, train_loss: 0.1432, test_loss: 2.0225, test_f1: 0.6215
 epoch: 53, train_loss: 0.1480, test_loss: 2.3019, test_f1: 0.5960
 epoch: 54, train_loss: 0.1358, test_loss: 2.2138, test_f1: 0.6383
 epoch: 55, train_loss: 0.1403, test_loss: 2.2044, test_f1: 0.6009
 epoch: 56, train_loss: 0.1287, test_loss: 2.2559, test_f1: 0.5943
 epoch: 57, train_loss: 0.1582, test_loss: 2.2569, test_f1: 0.6123
 epoch: 58, train_loss: 0.1176, test_loss: 2.2465, test_f1: 0.6326
 epoch: 59, train_loss: 0.1120, test_loss: 2.2262, test_f1: 0.6316
 epoch: 60, train_loss: 0.1006, test_loss: 2.3775, test_f1: 0.6244
 epoch: 61, train_loss: 0.0965, test_loss: 2.2448, test_f1: 0.6188
 epoch: 62, train_loss: 0.1260, test_loss: 2.4379, test_f1: 0.6113
 epoch: 63, train_loss: 0.1092, test_loss: 2.4375, test_f1: 0.6069
 epoch: 64, train_loss: 0.1102, test_loss: 2.3144, test_f1: 0.6085
 epoch: 65, train_loss: 0.0978, test_loss: 2.3563, test_f1: 0.6035
 epoch: 66, train_loss: 0.0819, test_loss: 2.5315, test_f1: 0.5933
 epoch: 67, train_loss: 0.0806, test_loss: 2.5668, test_f1: 0.6462
 epoch: 68, train_loss: 0.0772, test_loss: 2.5454, test_f1: 0.6279
 epoch: 69, train_loss: 0.0913, test_loss: 2.5742, test_f1: 0.5851
 epoch: 70, train_loss: 0.1031, test_loss: 2.3807, test_f1: 0.5934
 epoch: 71, train_loss: 0.1457, test_loss: 2.6077, test_f1: 0.5899
 epoch: 72, train_loss: 0.1148, test_loss: 2.8622, test_f1: 0.6151
 epoch: 73, train_loss: 0.0995, test_loss: 2.4666, test_f1: 0.5983
 epoch: 74, train_loss: 0.0842, test_loss: 2.5072, test_f1: 0.5819
 epoch: 75, train_loss: 0.0857, test_loss: 2.6378, test_f1: 0.5896
 epoch: 76, train_loss: 0.1008, test_loss: 2.4451, test_f1: 0.6332
 epoch: 77, train_loss: 0.0756, test_loss: 2.4890, test_f1: 0.6038
 epoch: 78, train_loss: 0.0841, test_loss: 2.6263, test_f1: 0.5738
 epoch: 79, train_loss: 0.0941, test_loss: 2.5187, test_f1: 0.5961
 epoch: 80, train_loss: 0.0924, test_loss: 2.5236, test_f1: 0.6065
 epoch: 81, train_loss: 0.0912, test_loss: 2.2605, test_f1: 0.6033
 epoch: 82, train_loss: 0.0725, test_loss: 2.4151, test_f1: 0.6296
 epoch: 83, train_loss: 0.0723, test_loss: 2.7145, test_f1: 0.6278
 epoch: 84, train_loss: 0.0673, test_loss: 2.6492, test_f1: 0.6178
 epoch: 85, train_loss: 0.0710, test_loss: 3.0566, test_f1: 0.5971
 epoch: 86, train_loss: 0.0803, test_loss: 2.6416, test_f1: 0.6418
 epoch: 87, train_loss: 0.0997, test_loss: 2.7854, test_f1: 0.5821
 epoch: 88, train_loss: 0.0737, test_loss: 2.6078, test_f1: 0.6182
 epoch: 89, train_loss: 0.0806, test_loss: 2.4562, test_f1: 0.6238
 epoch: 90, train_loss: 0.0982, test_loss: 2.7047, test_f1: 0.6472
 epoch: 91, train_loss: 0.0951, test_loss: 3.1330, test_f1: 0.6344
 epoch: 92, train_loss: 0.1296, test_loss: 3.0544, test_f1: 0.5951
 epoch: 93, train_loss: 0.1032, test_loss: 2.6764, test_f1: 0.6542
 epoch: 94, train_loss: 0.0913, test_loss: 2.7341, test_f1: 0.6210
 epoch: 95, train_loss: 0.0938, test_loss: 2.7127, test_f1: 0.6266
 epoch: 96, train_loss: 0.0852, test_loss: 2.7508, test_f1: 0.6025
 epoch: 97, train_loss: 0.0557, test_loss: 2.9350, test_f1: 0.6098
 epoch: 98, train_loss: 0.0742, test_loss: 2.9302, test_f1: 0.6273
 epoch: 99, train_loss: 0.0644, test_loss: 2.4807, test_f1: 0.6234
##################ITERATION #6 ****************************************
 epoch: 0, train_loss: 1.1935, test_loss: 1.5801, test_f1: 0.1365
 epoch: 1, train_loss: 0.9992, test_loss: 1.2479, test_f1: 0.2897
 epoch: 2, train_loss: 0.9240, test_loss: 1.1644, test_f1: 0.4001
 epoch: 3, train_loss: 0.8797, test_loss: 1.0586, test_f1: 0.5743
 epoch: 4, train_loss: 0.8075, test_loss: 1.0987, test_f1: 0.5598
 epoch: 5, train_loss: 0.7788, test_loss: 1.1216, test_f1: 0.5201
 epoch: 6, train_loss: 0.7490, test_loss: 1.0956, test_f1: 0.5323
 epoch: 7, train_loss: 0.7445, test_loss: 1.0403, test_f1: 0.5329
 epoch: 8, train_loss: 0.7026, test_loss: 1.0409, test_f1: 0.6331
 epoch: 9, train_loss: 0.7226, test_loss: 1.0608, test_f1: 0.5982
 epoch: 10, train_loss: 0.6898, test_loss: 1.0658, test_f1: 0.6071
 epoch: 11, train_loss: 0.6504, test_loss: 1.2558, test_f1: 0.5361
 epoch: 12, train_loss: 0.6355, test_loss: 1.0943, test_f1: 0.5995
 epoch: 13, train_loss: 0.6167, test_loss: 1.1472, test_f1: 0.5249
 epoch: 14, train_loss: 0.6328, test_loss: 1.2553, test_f1: 0.5264
 epoch: 15, train_loss: 0.6396, test_loss: 1.0432, test_f1: 0.5484
 epoch: 16, train_loss: 0.6057, test_loss: 1.1016, test_f1: 0.5726
 epoch: 17, train_loss: 0.5854, test_loss: 1.2341, test_f1: 0.5409
 epoch: 18, train_loss: 0.5726, test_loss: 1.3277, test_f1: 0.5466
 epoch: 19, train_loss: 0.5684, test_loss: 1.2291, test_f1: 0.5035
 epoch: 20, train_loss: 0.5265, test_loss: 1.0756, test_f1: 0.6266
 epoch: 21, train_loss: 0.5143, test_loss: 1.3662, test_f1: 0.5566
 epoch: 22, train_loss: 0.4941, test_loss: 1.2780, test_f1: 0.5870
 epoch: 23, train_loss: 0.4823, test_loss: 1.2395, test_f1: 0.5663
 epoch: 24, train_loss: 0.4629, test_loss: 1.3544, test_f1: 0.5084
 epoch: 25, train_loss: 0.4481, test_loss: 1.5162, test_f1: 0.5850
 epoch: 26, train_loss: 0.4731, test_loss: 1.5268, test_f1: 0.5536
 epoch: 27, train_loss: 0.4922, test_loss: 1.5076, test_f1: 0.5720
 epoch: 28, train_loss: 0.4786, test_loss: 1.4184, test_f1: 0.5374
 epoch: 29, train_loss: 0.4832, test_loss: 1.4149, test_f1: 0.5717
 epoch: 30, train_loss: 0.4333, test_loss: 1.4657, test_f1: 0.5269
 epoch: 31, train_loss: 0.4108, test_loss: 1.4759, test_f1: 0.6221
 epoch: 32, train_loss: 0.4084, test_loss: 1.5593, test_f1: 0.5724
 epoch: 33, train_loss: 0.3540, test_loss: 1.4498, test_f1: 0.5695
 epoch: 34, train_loss: 0.3738, test_loss: 1.6788, test_f1: 0.5564
 epoch: 35, train_loss: 0.3523, test_loss: 1.5030, test_f1: 0.6168
 epoch: 36, train_loss: 0.3225, test_loss: 1.6516, test_f1: 0.5820
 epoch: 37, train_loss: 0.3232, test_loss: 1.8339, test_f1: 0.5651
 epoch: 38, train_loss: 0.3024, test_loss: 1.5691, test_f1: 0.6092
 epoch: 39, train_loss: 0.3295, test_loss: 1.8990, test_f1: 0.5315
 epoch: 40, train_loss: 0.3797, test_loss: 1.5385, test_f1: 0.5867
 epoch: 41, train_loss: 0.2871, test_loss: 1.9752, test_f1: 0.4976
 epoch: 42, train_loss: 0.2984, test_loss: 1.9516, test_f1: 0.5605
 epoch: 43, train_loss: 0.2861, test_loss: 1.6141, test_f1: 0.6202
 epoch: 44, train_loss: 0.2666, test_loss: 1.9871, test_f1: 0.5795
 epoch: 45, train_loss: 0.2655, test_loss: 2.0353, test_f1: 0.5483
 epoch: 46, train_loss: 0.2690, test_loss: 1.9357, test_f1: 0.5794
 epoch: 47, train_loss: 0.2715, test_loss: 1.9986, test_f1: 0.6090
 epoch: 48, train_loss: 0.2614, test_loss: 1.9229, test_f1: 0.5644
 epoch: 49, train_loss: 0.2737, test_loss: 1.9813, test_f1: 0.6049
 epoch: 50, train_loss: 0.3398, test_loss: 1.6605, test_f1: 0.5864
 epoch: 51, train_loss: 0.2490, test_loss: 1.7667, test_f1: 0.5886
 epoch: 52, train_loss: 0.2250, test_loss: 2.1291, test_f1: 0.5543
 epoch: 53, train_loss: 0.1983, test_loss: 1.9019, test_f1: 0.6022
 epoch: 54, train_loss: 0.1716, test_loss: 1.9483, test_f1: 0.5917
 epoch: 55, train_loss: 0.1537, test_loss: 2.2249, test_f1: 0.5734
 epoch: 56, train_loss: 0.1544, test_loss: 2.1343, test_f1: 0.5946
 epoch: 57, train_loss: 0.1879, test_loss: 1.8666, test_f1: 0.6125
 epoch: 58, train_loss: 0.1886, test_loss: 2.1139, test_f1: 0.5875
 epoch: 59, train_loss: 0.2146, test_loss: 2.1932, test_f1: 0.6019
 epoch: 60, train_loss: 0.1519, test_loss: 2.2168, test_f1: 0.6411
 epoch: 61, train_loss: 0.1379, test_loss: 2.1773, test_f1: 0.5976
 epoch: 62, train_loss: 0.1264, test_loss: 2.1293, test_f1: 0.5923
 epoch: 63, train_loss: 0.1119, test_loss: 2.4132, test_f1: 0.5846
 epoch: 64, train_loss: 0.1340, test_loss: 2.3973, test_f1: 0.5858
 epoch: 65, train_loss: 0.1218, test_loss: 2.4501, test_f1: 0.5904
 epoch: 66, train_loss: 0.1215, test_loss: 2.3921, test_f1: 0.5915
 epoch: 67, train_loss: 0.1128, test_loss: 2.5136, test_f1: 0.5817
 epoch: 68, train_loss: 0.1193, test_loss: 2.5620, test_f1: 0.5942
 epoch: 69, train_loss: 0.1067, test_loss: 2.4744, test_f1: 0.6073
 epoch: 70, train_loss: 0.1275, test_loss: 2.5090, test_f1: 0.5980
 epoch: 71, train_loss: 0.1293, test_loss: 2.4776, test_f1: 0.5851
 epoch: 72, train_loss: 0.1347, test_loss: 2.5326, test_f1: 0.5780
 epoch: 73, train_loss: 0.1126, test_loss: 2.6152, test_f1: 0.5736
 epoch: 74, train_loss: 0.1242, test_loss: 2.6200, test_f1: 0.5767
 epoch: 75, train_loss: 0.1000, test_loss: 2.4871, test_f1: 0.5855
 epoch: 76, train_loss: 0.0960, test_loss: 2.6216, test_f1: 0.5871
 epoch: 77, train_loss: 0.0971, test_loss: 2.7379, test_f1: 0.5914
 epoch: 78, train_loss: 0.1288, test_loss: 2.7874, test_f1: 0.5724
 epoch: 79, train_loss: 0.1457, test_loss: 2.8952, test_f1: 0.5428
 epoch: 80, train_loss: 0.1412, test_loss: 2.8459, test_f1: 0.5826
 epoch: 81, train_loss: 0.1244, test_loss: 2.4629, test_f1: 0.5854
 epoch: 82, train_loss: 0.0969, test_loss: 2.7443, test_f1: 0.5727
 epoch: 83, train_loss: 0.1105, test_loss: 2.8672, test_f1: 0.5854
 epoch: 84, train_loss: 0.0954, test_loss: 2.8091, test_f1: 0.5849
 epoch: 85, train_loss: 0.1087, test_loss: 2.7365, test_f1: 0.5858
 epoch: 86, train_loss: 0.1484, test_loss: 2.3648, test_f1: 0.5845
 epoch: 87, train_loss: 0.1239, test_loss: 2.4016, test_f1: 0.5792
 epoch: 88, train_loss: 0.1033, test_loss: 2.5517, test_f1: 0.5971
 epoch: 89, train_loss: 0.1050, test_loss: 2.7337, test_f1: 0.5936
 epoch: 90, train_loss: 0.0903, test_loss: 2.8046, test_f1: 0.5553
 epoch: 91, train_loss: 0.0884, test_loss: 2.6982, test_f1: 0.5886
 epoch: 92, train_loss: 0.0854, test_loss: 2.7603, test_f1: 0.5767
 epoch: 93, train_loss: 0.0976, test_loss: 2.8300, test_f1: 0.5845
 epoch: 94, train_loss: 0.1139, test_loss: 2.9293, test_f1: 0.5820
 epoch: 95, train_loss: 0.1010, test_loss: 2.8976, test_f1: 0.5589
 epoch: 96, train_loss: 0.0996, test_loss: 2.8481, test_f1: 0.5671
 epoch: 97, train_loss: 0.0868, test_loss: 2.7204, test_f1: 0.5937
 epoch: 98, train_loss: 0.0969, test_loss: 2.6795, test_f1: 0.5751
 epoch: 99, train_loss: 0.0908, test_loss: 2.8154, test_f1: 0.5779
##################ITERATION #7 ****************************************
 epoch: 0, train_loss: 1.2639, test_loss: 1.4854, test_f1: 0.2213
 epoch: 1, train_loss: 0.9685, test_loss: 1.4981, test_f1: 0.1934
 epoch: 2, train_loss: 0.8810, test_loss: 1.5182, test_f1: 0.2925
 epoch: 3, train_loss: 0.8080, test_loss: 1.3314, test_f1: 0.3183
 epoch: 4, train_loss: 0.7751, test_loss: 1.1015, test_f1: 0.5320
 epoch: 5, train_loss: 0.7160, test_loss: 1.1090, test_f1: 0.5422
 epoch: 6, train_loss: 0.7012, test_loss: 1.1649, test_f1: 0.5648
 epoch: 7, train_loss: 0.6554, test_loss: 1.2018, test_f1: 0.5907
 epoch: 8, train_loss: 0.6569, test_loss: 1.0973, test_f1: 0.5952
 epoch: 9, train_loss: 0.6022, test_loss: 1.1166, test_f1: 0.5499
 epoch: 10, train_loss: 0.5843, test_loss: 1.1202, test_f1: 0.5648
 epoch: 11, train_loss: 0.5572, test_loss: 1.2956, test_f1: 0.5180
 epoch: 12, train_loss: 0.5371, test_loss: 1.2884, test_f1: 0.5240
 epoch: 13, train_loss: 0.5704, test_loss: 1.2769, test_f1: 0.5488
 epoch: 14, train_loss: 0.5214, test_loss: 1.0767, test_f1: 0.6236
 epoch: 15, train_loss: 0.4993, test_loss: 1.1265, test_f1: 0.6210
 epoch: 16, train_loss: 0.4590, test_loss: 1.1663, test_f1: 0.6072
 epoch: 17, train_loss: 0.4601, test_loss: 1.1800, test_f1: 0.6085
 epoch: 18, train_loss: 0.4431, test_loss: 1.5149, test_f1: 0.5522
 epoch: 19, train_loss: 0.4684, test_loss: 1.2756, test_f1: 0.5701
 epoch: 20, train_loss: 0.4767, test_loss: 1.3155, test_f1: 0.5900
 epoch: 21, train_loss: 0.4560, test_loss: 1.1677, test_f1: 0.6247
 epoch: 22, train_loss: 0.3930, test_loss: 1.2373, test_f1: 0.5985
 epoch: 23, train_loss: 0.3888, test_loss: 1.4011, test_f1: 0.6335
 epoch: 24, train_loss: 0.3409, test_loss: 1.4947, test_f1: 0.5817
 epoch: 25, train_loss: 0.3774, test_loss: 1.6437, test_f1: 0.5529
 epoch: 26, train_loss: 0.3819, test_loss: 1.3984, test_f1: 0.5868
 epoch: 27, train_loss: 0.3644, test_loss: 1.5320, test_f1: 0.5921
 epoch: 28, train_loss: 0.4073, test_loss: 1.4494, test_f1: 0.6402
 epoch: 29, train_loss: 0.3572, test_loss: 1.4051, test_f1: 0.6217
 epoch: 30, train_loss: 0.3090, test_loss: 1.4649, test_f1: 0.6165
 epoch: 31, train_loss: 0.3227, test_loss: 1.7619, test_f1: 0.5847
 epoch: 32, train_loss: 0.3113, test_loss: 1.6289, test_f1: 0.6035
 epoch: 33, train_loss: 0.2919, test_loss: 1.6852, test_f1: 0.5886
 epoch: 34, train_loss: 0.2821, test_loss: 1.7099, test_f1: 0.5838
 epoch: 35, train_loss: 0.3165, test_loss: 1.4999, test_f1: 0.6208
 epoch: 36, train_loss: 0.2755, test_loss: 1.5777, test_f1: 0.6037
 epoch: 37, train_loss: 0.2410, test_loss: 2.1228, test_f1: 0.5765
 epoch: 38, train_loss: 0.2719, test_loss: 2.0515, test_f1: 0.5799
 epoch: 39, train_loss: 0.2657, test_loss: 1.8644, test_f1: 0.6050
 epoch: 40, train_loss: 0.2626, test_loss: 1.7353, test_f1: 0.6008
 epoch: 41, train_loss: 0.2660, test_loss: 1.8434, test_f1: 0.5798
 epoch: 42, train_loss: 0.2532, test_loss: 1.8173, test_f1: 0.5842
 epoch: 43, train_loss: 0.2440, test_loss: 1.7084, test_f1: 0.6126
 epoch: 44, train_loss: 0.2325, test_loss: 2.1794, test_f1: 0.5455
 epoch: 45, train_loss: 0.2403, test_loss: 1.6818, test_f1: 0.6182
 epoch: 46, train_loss: 0.2194, test_loss: 2.0521, test_f1: 0.5816
 epoch: 47, train_loss: 0.2359, test_loss: 1.9388, test_f1: 0.6002
 epoch: 48, train_loss: 0.2311, test_loss: 2.2296, test_f1: 0.5530
 epoch: 49, train_loss: 0.2464, test_loss: 1.8244, test_f1: 0.5563
 epoch: 50, train_loss: 0.1988, test_loss: 2.0395, test_f1: 0.5982
 epoch: 51, train_loss: 0.1706, test_loss: 1.8096, test_f1: 0.6248
 epoch: 52, train_loss: 0.1502, test_loss: 2.0150, test_f1: 0.6165
 epoch: 53, train_loss: 0.1369, test_loss: 2.0190, test_f1: 0.6125
 epoch: 54, train_loss: 0.1250, test_loss: 1.9647, test_f1: 0.6278
 epoch: 55, train_loss: 0.1310, test_loss: 2.0687, test_f1: 0.6077
 epoch: 56, train_loss: 0.1303, test_loss: 2.3559, test_f1: 0.5740
 epoch: 57, train_loss: 0.1048, test_loss: 2.4035, test_f1: 0.6012
 epoch: 58, train_loss: 0.0923, test_loss: 2.2936, test_f1: 0.6100
 epoch: 59, train_loss: 0.1034, test_loss: 2.5603, test_f1: 0.6083
 epoch: 60, train_loss: 0.0859, test_loss: 2.4969, test_f1: 0.5973
 epoch: 61, train_loss: 0.0785, test_loss: 2.7402, test_f1: 0.6042
 epoch: 62, train_loss: 0.0923, test_loss: 2.7723, test_f1: 0.5898
 epoch: 63, train_loss: 0.1088, test_loss: 2.5968, test_f1: 0.6110
 epoch: 64, train_loss: 0.1103, test_loss: 2.7050, test_f1: 0.5932
 epoch: 65, train_loss: 0.0972, test_loss: 2.7190, test_f1: 0.6255
 epoch: 66, train_loss: 0.0800, test_loss: 2.6557, test_f1: 0.6174
 epoch: 67, train_loss: 0.0866, test_loss: 3.0445, test_f1: 0.5939
 epoch: 68, train_loss: 0.0776, test_loss: 2.8537, test_f1: 0.6084
 epoch: 69, train_loss: 0.1021, test_loss: 2.7703, test_f1: 0.5952
 epoch: 70, train_loss: 0.0851, test_loss: 2.6296, test_f1: 0.5946
 epoch: 71, train_loss: 0.0831, test_loss: 2.6923, test_f1: 0.5898
 epoch: 72, train_loss: 0.0720, test_loss: 2.7349, test_f1: 0.6036
 epoch: 73, train_loss: 0.0806, test_loss: 2.8276, test_f1: 0.5977
 epoch: 74, train_loss: 0.0919, test_loss: 2.9795, test_f1: 0.5765
 epoch: 75, train_loss: 0.0774, test_loss: 3.0209, test_f1: 0.5945
 epoch: 76, train_loss: 0.0837, test_loss: 2.6976, test_f1: 0.5867
 epoch: 77, train_loss: 0.0975, test_loss: 2.8109, test_f1: 0.6054
 epoch: 78, train_loss: 0.0876, test_loss: 2.8018, test_f1: 0.6012
 epoch: 79, train_loss: 0.1211, test_loss: 2.8534, test_f1: 0.5901
 epoch: 80, train_loss: 0.0999, test_loss: 2.8057, test_f1: 0.6069
 epoch: 81, train_loss: 0.0927, test_loss: 2.7767, test_f1: 0.6073
 epoch: 82, train_loss: 0.0803, test_loss: 2.7153, test_f1: 0.6480
 epoch: 83, train_loss: 0.1149, test_loss: 2.6490, test_f1: 0.5868
 epoch: 84, train_loss: 0.1353, test_loss: 2.3588, test_f1: 0.6434
 epoch: 85, train_loss: 0.1390, test_loss: 2.2644, test_f1: 0.6285
 epoch: 86, train_loss: 0.1107, test_loss: 2.6041, test_f1: 0.6370
 epoch: 87, train_loss: 0.0995, test_loss: 2.6070, test_f1: 0.6117
 epoch: 88, train_loss: 0.0993, test_loss: 2.5037, test_f1: 0.5913
 epoch: 89, train_loss: 0.1036, test_loss: 2.7154, test_f1: 0.5719
 epoch: 90, train_loss: 0.0942, test_loss: 2.6317, test_f1: 0.5932
 epoch: 91, train_loss: 0.1250, test_loss: 2.6085, test_f1: 0.6299
 epoch: 92, train_loss: 0.0891, test_loss: 2.7937, test_f1: 0.5935
 epoch: 93, train_loss: 0.0892, test_loss: 2.9998, test_f1: 0.5850
 epoch: 94, train_loss: 0.0778, test_loss: 2.8359, test_f1: 0.6047
 epoch: 95, train_loss: 0.0992, test_loss: 2.8751, test_f1: 0.5741
 epoch: 96, train_loss: 0.0754, test_loss: 2.8042, test_f1: 0.5819
 epoch: 97, train_loss: 0.0947, test_loss: 2.6475, test_f1: 0.5973
 epoch: 98, train_loss: 0.0850, test_loss: 2.5640, test_f1: 0.6043
 epoch: 99, train_loss: 0.0810, test_loss: 2.6606, test_f1: 0.6185
##################ITERATION #8 ****************************************
 epoch: 0, train_loss: 1.2606, test_loss: 1.5018, test_f1: 0.1420
 epoch: 1, train_loss: 1.0663, test_loss: 1.3416, test_f1: 0.2699
 epoch: 2, train_loss: 0.9497, test_loss: 1.2663, test_f1: 0.3461
 epoch: 3, train_loss: 0.8617, test_loss: 1.1311, test_f1: 0.4568
 epoch: 4, train_loss: 0.8125, test_loss: 1.0838, test_f1: 0.5098
 epoch: 5, train_loss: 0.7960, test_loss: 1.1968, test_f1: 0.4627
 epoch: 6, train_loss: 0.7840, test_loss: 1.1295, test_f1: 0.5435
 epoch: 7, train_loss: 0.7489, test_loss: 1.1137, test_f1: 0.5281
 epoch: 8, train_loss: 0.7064, test_loss: 1.0540, test_f1: 0.4971
 epoch: 9, train_loss: 0.6876, test_loss: 1.0125, test_f1: 0.5841
 epoch: 10, train_loss: 0.6812, test_loss: 1.0860, test_f1: 0.5969
 epoch: 11, train_loss: 0.6317, test_loss: 1.0510, test_f1: 0.5866
 epoch: 12, train_loss: 0.6073, test_loss: 1.0561, test_f1: 0.5994
 epoch: 13, train_loss: 0.6121, test_loss: 1.2004, test_f1: 0.5311
 epoch: 14, train_loss: 0.6009, test_loss: 1.2850, test_f1: 0.5860
 epoch: 15, train_loss: 0.5929, test_loss: 1.1357, test_f1: 0.5875
 epoch: 16, train_loss: 0.5400, test_loss: 1.1773, test_f1: 0.5915
 epoch: 17, train_loss: 0.5461, test_loss: 1.2862, test_f1: 0.5344
 epoch: 18, train_loss: 0.4987, test_loss: 1.1801, test_f1: 0.5961
 epoch: 19, train_loss: 0.4764, test_loss: 1.2559, test_f1: 0.5679
 epoch: 20, train_loss: 0.4805, test_loss: 1.5182, test_f1: 0.5710
 epoch: 21, train_loss: 0.5058, test_loss: 1.3946, test_f1: 0.5381
 epoch: 22, train_loss: 0.4852, test_loss: 1.2544, test_f1: 0.5900
 epoch: 23, train_loss: 0.4621, test_loss: 1.3046, test_f1: 0.5613
 epoch: 24, train_loss: 0.4370, test_loss: 1.3665, test_f1: 0.5352
 epoch: 25, train_loss: 0.4389, test_loss: 1.5544, test_f1: 0.5842
 epoch: 26, train_loss: 0.4431, test_loss: 1.2931, test_f1: 0.6208
 epoch: 27, train_loss: 0.4301, test_loss: 1.6086, test_f1: 0.5508
 epoch: 28, train_loss: 0.4233, test_loss: 1.5543, test_f1: 0.5870
 epoch: 29, train_loss: 0.3966, test_loss: 1.2810, test_f1: 0.6324
 epoch: 30, train_loss: 0.3743, test_loss: 1.5610, test_f1: 0.5827
 epoch: 31, train_loss: 0.3599, test_loss: 1.4545, test_f1: 0.6032
 epoch: 32, train_loss: 0.3778, test_loss: 1.5663, test_f1: 0.5942
 epoch: 33, train_loss: 0.3567, test_loss: 1.5631, test_f1: 0.5847
 epoch: 34, train_loss: 0.4133, test_loss: 1.5393, test_f1: 0.5979
 epoch: 35, train_loss: 0.3710, test_loss: 1.4331, test_f1: 0.6038
 epoch: 36, train_loss: 0.3689, test_loss: 1.3465, test_f1: 0.6689
 epoch: 37, train_loss: 0.3678, test_loss: 1.5406, test_f1: 0.6332
 epoch: 38, train_loss: 0.3444, test_loss: 1.5757, test_f1: 0.5651
 epoch: 39, train_loss: 0.2933, test_loss: 1.4737, test_f1: 0.6520
 epoch: 40, train_loss: 0.2855, test_loss: 1.5929, test_f1: 0.6245
 epoch: 41, train_loss: 0.2829, test_loss: 1.9231, test_f1: 0.5534
 epoch: 42, train_loss: 0.2814, test_loss: 1.6608, test_f1: 0.6045
 epoch: 43, train_loss: 0.2630, test_loss: 1.6964, test_f1: 0.6304
 epoch: 44, train_loss: 0.2714, test_loss: 1.6796, test_f1: 0.6375
 epoch: 45, train_loss: 0.2734, test_loss: 1.5664, test_f1: 0.6299
 epoch: 46, train_loss: 0.2446, test_loss: 1.6763, test_f1: 0.5995
 epoch: 47, train_loss: 0.2403, test_loss: 1.5454, test_f1: 0.6287
 epoch: 48, train_loss: 0.2419, test_loss: 1.8024, test_f1: 0.6109
 epoch: 49, train_loss: 0.2674, test_loss: 1.8884, test_f1: 0.5931
 epoch: 50, train_loss: 0.2636, test_loss: 1.8093, test_f1: 0.5844
 epoch: 51, train_loss: 0.2482, test_loss: 1.7129, test_f1: 0.5962
 epoch: 52, train_loss: 0.1970, test_loss: 1.8275, test_f1: 0.5929
 epoch: 53, train_loss: 0.1828, test_loss: 1.8308, test_f1: 0.5889
 epoch: 54, train_loss: 0.1674, test_loss: 1.8535, test_f1: 0.6293
 epoch: 55, train_loss: 0.1434, test_loss: 1.8503, test_f1: 0.6196
 epoch: 56, train_loss: 0.1547, test_loss: 2.0247, test_f1: 0.5963
 epoch: 57, train_loss: 0.1422, test_loss: 2.0082, test_f1: 0.6241
 epoch: 58, train_loss: 0.1386, test_loss: 2.0181, test_f1: 0.6147
 epoch: 59, train_loss: 0.1435, test_loss: 2.1220, test_f1: 0.6185
 epoch: 60, train_loss: 0.1206, test_loss: 2.2763, test_f1: 0.6034
 epoch: 61, train_loss: 0.1570, test_loss: 2.3145, test_f1: 0.5990
 epoch: 62, train_loss: 0.1362, test_loss: 2.3099, test_f1: 0.6173
 epoch: 63, train_loss: 0.1415, test_loss: 2.1345, test_f1: 0.6367
 epoch: 64, train_loss: 0.1153, test_loss: 2.2495, test_f1: 0.6094
 epoch: 65, train_loss: 0.1240, test_loss: 2.2259, test_f1: 0.6230
 epoch: 66, train_loss: 0.1453, test_loss: 2.2889, test_f1: 0.6049
 epoch: 67, train_loss: 0.1126, test_loss: 2.2453, test_f1: 0.6197
 epoch: 68, train_loss: 0.0912, test_loss: 2.2817, test_f1: 0.6107
 epoch: 69, train_loss: 0.1271, test_loss: 2.2489, test_f1: 0.6036
 epoch: 70, train_loss: 0.1085, test_loss: 2.5246, test_f1: 0.5993
 epoch: 71, train_loss: 0.1483, test_loss: 2.4029, test_f1: 0.6246
 epoch: 72, train_loss: 0.1132, test_loss: 2.3853, test_f1: 0.6129
 epoch: 73, train_loss: 0.1141, test_loss: 2.4591, test_f1: 0.6138
 epoch: 74, train_loss: 0.1121, test_loss: 2.4547, test_f1: 0.6087
 epoch: 75, train_loss: 0.0962, test_loss: 2.4096, test_f1: 0.6099
 epoch: 76, train_loss: 0.1147, test_loss: 2.3809, test_f1: 0.6093
 epoch: 77, train_loss: 0.0988, test_loss: 2.4535, test_f1: 0.6030
 epoch: 78, train_loss: 0.1064, test_loss: 2.5283, test_f1: 0.6348
 epoch: 79, train_loss: 0.1323, test_loss: 2.3435, test_f1: 0.6020
 epoch: 80, train_loss: 0.1261, test_loss: 2.5422, test_f1: 0.6085
 epoch: 81, train_loss: 0.1511, test_loss: 2.3871, test_f1: 0.6545
 epoch: 82, train_loss: 0.1766, test_loss: 2.4307, test_f1: 0.6282
 epoch: 83, train_loss: 0.1383, test_loss: 2.4734, test_f1: 0.6244
 epoch: 84, train_loss: 0.0910, test_loss: 2.5391, test_f1: 0.6121
 epoch: 85, train_loss: 0.0841, test_loss: 2.3401, test_f1: 0.6119
 epoch: 86, train_loss: 0.0817, test_loss: 2.5648, test_f1: 0.6244
 epoch: 87, train_loss: 0.1499, test_loss: 2.5699, test_f1: 0.5868
 epoch: 88, train_loss: 0.1536, test_loss: 2.6135, test_f1: 0.5800
 epoch: 89, train_loss: 0.1289, test_loss: 2.6092, test_f1: 0.6076
 epoch: 90, train_loss: 0.1102, test_loss: 2.5541, test_f1: 0.5930
 epoch: 91, train_loss: 0.1080, test_loss: 2.2762, test_f1: 0.6441
 epoch: 92, train_loss: 0.1098, test_loss: 2.4357, test_f1: 0.6021
 epoch: 93, train_loss: 0.0798, test_loss: 2.4796, test_f1: 0.6093
 epoch: 94, train_loss: 0.0767, test_loss: 2.6513, test_f1: 0.6012
 epoch: 95, train_loss: 0.0778, test_loss: 2.6759, test_f1: 0.6085
 epoch: 96, train_loss: 0.0730, test_loss: 2.5890, test_f1: 0.6455
 epoch: 97, train_loss: 0.0691, test_loss: 2.5626, test_f1: 0.6145
 epoch: 98, train_loss: 0.0797, test_loss: 2.8004, test_f1: 0.5745
 epoch: 99, train_loss: 0.1003, test_loss: 2.7738, test_f1: 0.6232
##################ITERATION #9 ****************************************
 epoch: 0, train_loss: 1.2815, test_loss: 1.5605, test_f1: 0.3350
 epoch: 1, train_loss: 1.0009, test_loss: 1.3936, test_f1: 0.3468
 epoch: 2, train_loss: 0.9362, test_loss: 1.2762, test_f1: 0.2393
 epoch: 3, train_loss: 0.8438, test_loss: 1.1464, test_f1: 0.4965
 epoch: 4, train_loss: 0.7782, test_loss: 0.9682, test_f1: 0.6759
 epoch: 5, train_loss: 0.7473, test_loss: 0.9729, test_f1: 0.6347
 epoch: 6, train_loss: 0.7092, test_loss: 1.0666, test_f1: 0.5441
 epoch: 7, train_loss: 0.6942, test_loss: 0.9872, test_f1: 0.5963
 epoch: 8, train_loss: 0.6676, test_loss: 1.0945, test_f1: 0.5695
 epoch: 9, train_loss: 0.6219, test_loss: 1.0396, test_f1: 0.5614
 epoch: 10, train_loss: 0.6110, test_loss: 1.1004, test_f1: 0.6024
 epoch: 11, train_loss: 0.5867, test_loss: 1.0814, test_f1: 0.5967
 epoch: 12, train_loss: 0.5729, test_loss: 1.1895, test_f1: 0.5312
 epoch: 13, train_loss: 0.5942, test_loss: 1.1672, test_f1: 0.5370
 epoch: 14, train_loss: 0.5396, test_loss: 1.0171, test_f1: 0.6068
 epoch: 15, train_loss: 0.5139, test_loss: 1.1675, test_f1: 0.5801
 epoch: 16, train_loss: 0.4978, test_loss: 1.2534, test_f1: 0.5783
 epoch: 17, train_loss: 0.5635, test_loss: 1.0431, test_f1: 0.5847
 epoch: 18, train_loss: 0.5548, test_loss: 1.1412, test_f1: 0.6447
 epoch: 19, train_loss: 0.5009, test_loss: 1.0275, test_f1: 0.6346
 epoch: 20, train_loss: 0.4972, test_loss: 1.0643, test_f1: 0.6439
 epoch: 21, train_loss: 0.4636, test_loss: 1.1805, test_f1: 0.5722
 epoch: 22, train_loss: 0.4709, test_loss: 1.2919, test_f1: 0.5780
 epoch: 23, train_loss: 0.4460, test_loss: 1.2056, test_f1: 0.6053
 epoch: 24, train_loss: 0.3917, test_loss: 1.2363, test_f1: 0.5814
 epoch: 25, train_loss: 0.4161, test_loss: 1.3891, test_f1: 0.5973
 epoch: 26, train_loss: 0.4209, test_loss: 1.1368, test_f1: 0.6522
 epoch: 27, train_loss: 0.3910, test_loss: 1.3998, test_f1: 0.5413
 epoch: 28, train_loss: 0.3910, test_loss: 1.3790, test_f1: 0.6218
 epoch: 29, train_loss: 0.3753, test_loss: 1.3477, test_f1: 0.6234
 epoch: 30, train_loss: 0.3757, test_loss: 1.2337, test_f1: 0.6239
 epoch: 31, train_loss: 0.4015, test_loss: 1.3405, test_f1: 0.5819
 epoch: 32, train_loss: 0.4409, test_loss: 1.6342, test_f1: 0.5758
 epoch: 33, train_loss: 0.4089, test_loss: 1.4522, test_f1: 0.6022
 epoch: 34, train_loss: 0.3348, test_loss: 1.4459, test_f1: 0.6077
 epoch: 35, train_loss: 0.3602, test_loss: 1.4584, test_f1: 0.6006
 epoch: 36, train_loss: 0.3370, test_loss: 1.4499, test_f1: 0.6011
 epoch: 37, train_loss: 0.3610, test_loss: 1.4551, test_f1: 0.6483
 epoch: 38, train_loss: 0.3422, test_loss: 1.3301, test_f1: 0.6034
 epoch: 39, train_loss: 0.2971, test_loss: 1.4093, test_f1: 0.6134
 epoch: 40, train_loss: 0.2849, test_loss: 1.8381, test_f1: 0.5721
 epoch: 41, train_loss: 0.2842, test_loss: 1.7770, test_f1: 0.5851
 epoch: 42, train_loss: 0.2954, test_loss: 1.6779, test_f1: 0.6201
 epoch: 43, train_loss: 0.2759, test_loss: 1.5511, test_f1: 0.6141
 epoch: 44, train_loss: 0.2983, test_loss: 1.8922, test_f1: 0.5475
 epoch: 45, train_loss: 0.2684, test_loss: 1.7017, test_f1: 0.6348
 epoch: 46, train_loss: 0.2533, test_loss: 1.7059, test_f1: 0.5975
 epoch: 47, train_loss: 0.2570, test_loss: 1.5581, test_f1: 0.6223
 epoch: 48, train_loss: 0.2312, test_loss: 1.5619, test_f1: 0.6184
 epoch: 49, train_loss: 0.1955, test_loss: 1.8173, test_f1: 0.6150
 epoch: 50, train_loss: 0.2310, test_loss: 1.8242, test_f1: 0.5941
 epoch: 51, train_loss: 0.1880, test_loss: 1.6489, test_f1: 0.6307
 epoch: 52, train_loss: 0.1484, test_loss: 1.8536, test_f1: 0.6239
 epoch: 53, train_loss: 0.1482, test_loss: 1.7860, test_f1: 0.6307
 epoch: 54, train_loss: 0.1430, test_loss: 1.8039, test_f1: 0.6333
 epoch: 55, train_loss: 0.1404, test_loss: 1.8854, test_f1: 0.6265
 epoch: 56, train_loss: 0.1513, test_loss: 1.9886, test_f1: 0.6202
 epoch: 57, train_loss: 0.1468, test_loss: 1.9407, test_f1: 0.6092
 epoch: 58, train_loss: 0.1341, test_loss: 1.8602, test_f1: 0.6364
 epoch: 59, train_loss: 0.1229, test_loss: 1.8458, test_f1: 0.6277
 epoch: 60, train_loss: 0.1406, test_loss: 1.9643, test_f1: 0.6318
 epoch: 61, train_loss: 0.1527, test_loss: 1.8610, test_f1: 0.6467
 epoch: 62, train_loss: 0.1900, test_loss: 1.9748, test_f1: 0.6262
 epoch: 63, train_loss: 0.1682, test_loss: 1.9032, test_f1: 0.6059
 epoch: 64, train_loss: 0.1587, test_loss: 1.7717, test_f1: 0.6302
 epoch: 65, train_loss: 0.1477, test_loss: 1.8097, test_f1: 0.6352
 epoch: 66, train_loss: 0.1408, test_loss: 1.7479, test_f1: 0.6435
 epoch: 67, train_loss: 0.1206, test_loss: 1.8167, test_f1: 0.6389
 epoch: 68, train_loss: 0.1163, test_loss: 1.8980, test_f1: 0.6332
 epoch: 69, train_loss: 0.0969, test_loss: 1.8417, test_f1: 0.6491
 epoch: 70, train_loss: 0.1106, test_loss: 1.9661, test_f1: 0.6525
 epoch: 71, train_loss: 0.1233, test_loss: 2.1522, test_f1: 0.6223
 epoch: 72, train_loss: 0.1241, test_loss: 2.0583, test_f1: 0.6084
 epoch: 73, train_loss: 0.1445, test_loss: 2.0943, test_f1: 0.6279
 epoch: 74, train_loss: 0.1367, test_loss: 2.1303, test_f1: 0.5890
 epoch: 75, train_loss: 0.1126, test_loss: 2.0153, test_f1: 0.6411
 epoch: 76, train_loss: 0.0993, test_loss: 2.1513, test_f1: 0.6334
 epoch: 77, train_loss: 0.1041, test_loss: 2.0836, test_f1: 0.6296
 epoch: 78, train_loss: 0.1007, test_loss: 2.1322, test_f1: 0.6475
 epoch: 79, train_loss: 0.0847, test_loss: 2.1152, test_f1: 0.6617
 epoch: 80, train_loss: 0.0869, test_loss: 2.1969, test_f1: 0.6462
 epoch: 81, train_loss: 0.0726, test_loss: 2.2955, test_f1: 0.6373
 epoch: 82, train_loss: 0.0857, test_loss: 1.9701, test_f1: 0.6482
 epoch: 83, train_loss: 0.1273, test_loss: 2.1228, test_f1: 0.6620
 epoch: 84, train_loss: 0.0856, test_loss: 2.1979, test_f1: 0.6315
 epoch: 85, train_loss: 0.1082, test_loss: 2.3124, test_f1: 0.6106
 epoch: 86, train_loss: 0.1485, test_loss: 2.3241, test_f1: 0.6124
 epoch: 87, train_loss: 0.1256, test_loss: 2.2776, test_f1: 0.6299
 epoch: 88, train_loss: 0.1333, test_loss: 2.2692, test_f1: 0.6306
 epoch: 89, train_loss: 0.1060, test_loss: 2.4623, test_f1: 0.6268
 epoch: 90, train_loss: 0.0825, test_loss: 2.5172, test_f1: 0.5870
 epoch: 91, train_loss: 0.0940, test_loss: 2.3694, test_f1: 0.5973
 epoch: 92, train_loss: 0.0704, test_loss: 2.3877, test_f1: 0.6168
 epoch: 93, train_loss: 0.0779, test_loss: 2.2950, test_f1: 0.6270
 epoch: 94, train_loss: 0.0795, test_loss: 2.4715, test_f1: 0.6186
 epoch: 95, train_loss: 0.0677, test_loss: 2.4722, test_f1: 0.6221
 epoch: 96, train_loss: 0.1001, test_loss: 2.7377, test_f1: 0.5829
 epoch: 97, train_loss: 0.0772, test_loss: 2.4992, test_f1: 0.6245
 epoch: 98, train_loss: 0.1070, test_loss: 2.4237, test_f1: 0.6311
 epoch: 99, train_loss: 0.1022, test_loss: 2.4104, test_f1: 0.6140

Training completed in 349.56 seconds
Best F1: 0.6948 at epoch 53
Mean F1 across iterations: 0.6646  0.0190
========================FINAL RESULTS================================
FEGIN weighted F1: 0.6948  0.0190
python main.py --data ltspice_demos --representation component_pin --model FEGIN --layers 3 --hiddens 128 --batch_size 128 --lr 0.001 --emb_size 250 --epochs 100 --save_appendix component_pin_L3_H128_BS128_LR0.001_E250 --no_val
-----



STDERR:
  File "main.py", line 370, in <module>
    main()
  File "main.py", line 254, in main
    dataset = dataset_class(
  File "/home/philip/projects/ltspice_examples_code_repo/Circuit-Completion-Using-GNNs/component_classification_with_link_prediction_head/evaluation/FEGIN/kernel/circuit_datasets.py", line 15, in __init__
    self.data, self.slices = torch.load(self.processed_paths[0])
  File "/home/philip/.local/lib/python3.8/site-packages/torch/serialization.py", line 1040, in load
    warnings.warn(
  File "/usr/lib/python3.8/warnings.py", line 109, in _showwarnmsg
    sw(msg.message, msg.category, msg.filename, msg.lineno,
  File "main.py", line 47, in warn_with_traceback
    traceback.print_stack(file=log)
/home/philip/projects/ltspice_examples_code_repo/Circuit-Completion-Using-GNNs/component_classification_with_link_prediction_head/evaluation/FEGIN/kernel/circuit_datasets.py:15: FutureWarning: You are using `torch.load` with `weights_only=False` (the current default value), which uses the default pickle module implicitly. It is possible to construct malicious pickle data which will execute arbitrary code during unpickling (See https://github.com/pytorch/pytorch/blob/main/SECURITY.md#untrusted-models for more details). In a future release, the default value for `weights_only` will be flipped to `True`. This limits the functions that could be executed during unpickling. Arbitrary objects will no longer be allowed to be loaded via this mode unless they are explicitly allowlisted by the user via `torch.serialization.add_safe_globals`. We recommend you start setting `weights_only=True` for any use case where you don't have full control of the loaded file. Please open an issue on GitHub for any issues related to this experimental feature.
  self.data, self.slices = torch.load(self.processed_paths[0])
