STDOUT:
Results will be saved in /home/philip/projects/ltspice_examples_code_repo/Circuit-Completion-Using-GNNs/component_classification_with_link_prediction_head/evaluation/FEGIN/results/model_FEGIN_dataset_ltspice_examples
Command line input: python main.py --data ltspice_examples --representation component_pin_net --model FEGIN --layers 3 --hiddens 32 --batch_size 64 --lr 0.01 --emb_size 512 --epochs 100 --save_appendix component_pin_net_L3_H32_BS64_LR0.01_E512 --no_val
 is saved.
-----
ltspice_examples - FEGIN
Using 3 layers, 32 hidden units, h = 2
Loading component_pin_net representation dataset
ENTERED
Training FEGIN on component_pin_net representation
Train: 3558, Test: 846
##################ITERATION #0 ****************************************
 epoch: 0, train_loss: 1.1971, test_loss: 1.0422, test_f1: 0.4469
 epoch: 1, train_loss: 1.0353, test_loss: 1.0727, test_f1: 0.3908
 epoch: 2, train_loss: 1.0099, test_loss: 1.0124, test_f1: 0.4906
 epoch: 3, train_loss: 0.9668, test_loss: 0.9684, test_f1: 0.4599
 epoch: 4, train_loss: 0.9570, test_loss: 1.0074, test_f1: 0.5421
 epoch: 5, train_loss: 0.9414, test_loss: 1.0349, test_f1: 0.4956
 epoch: 6, train_loss: 0.9231, test_loss: 0.9569, test_f1: 0.5491
 epoch: 7, train_loss: 0.9181, test_loss: 0.9780, test_f1: 0.5729
 epoch: 8, train_loss: 0.9158, test_loss: 0.9909, test_f1: 0.4988
 epoch: 9, train_loss: 0.8759, test_loss: 0.9935, test_f1: 0.5409
 epoch: 10, train_loss: 0.8927, test_loss: 0.9753, test_f1: 0.5150
 epoch: 11, train_loss: 0.8770, test_loss: 0.9763, test_f1: 0.5632
 epoch: 12, train_loss: 0.8862, test_loss: 0.9291, test_f1: 0.5460
 epoch: 13, train_loss: 0.8718, test_loss: 0.9532, test_f1: 0.5397
 epoch: 14, train_loss: 0.8617, test_loss: 0.9141, test_f1: 0.5651
 epoch: 15, train_loss: 0.8524, test_loss: 0.9906, test_f1: 0.4994
 epoch: 16, train_loss: 0.8345, test_loss: 0.9151, test_f1: 0.5469
 epoch: 17, train_loss: 0.8184, test_loss: 0.9572, test_f1: 0.5365
 epoch: 18, train_loss: 0.8279, test_loss: 0.9677, test_f1: 0.5402
 epoch: 19, train_loss: 0.8208, test_loss: 0.8758, test_f1: 0.5443
 epoch: 20, train_loss: 0.8133, test_loss: 0.9521, test_f1: 0.5144
 epoch: 21, train_loss: 0.8008, test_loss: 0.8966, test_f1: 0.5537
 epoch: 22, train_loss: 0.7913, test_loss: 0.8607, test_f1: 0.5836
 epoch: 23, train_loss: 0.7953, test_loss: 1.0445, test_f1: 0.5311
 epoch: 24, train_loss: 0.7886, test_loss: 0.8515, test_f1: 0.5507
 epoch: 25, train_loss: 0.7648, test_loss: 0.8516, test_f1: 0.5430
 epoch: 26, train_loss: 0.7735, test_loss: 0.8215, test_f1: 0.5918
 epoch: 27, train_loss: 0.7693, test_loss: 0.8136, test_f1: 0.5798
 epoch: 28, train_loss: 0.7771, test_loss: 0.7797, test_f1: 0.5621
 epoch: 29, train_loss: 0.7449, test_loss: 0.8831, test_f1: 0.5529
 epoch: 30, train_loss: 0.7453, test_loss: 0.9092, test_f1: 0.5899
 epoch: 31, train_loss: 0.7439, test_loss: 0.8592, test_f1: 0.5785
 epoch: 32, train_loss: 0.7428, test_loss: 0.8414, test_f1: 0.5685
 epoch: 33, train_loss: 0.7376, test_loss: 0.9619, test_f1: 0.5885
 epoch: 34, train_loss: 0.7427, test_loss: 0.9886, test_f1: 0.5263
 epoch: 35, train_loss: 0.7359, test_loss: 0.9301, test_f1: 0.5443
 epoch: 36, train_loss: 0.7487, test_loss: 0.8741, test_f1: 0.6055
 epoch: 37, train_loss: 0.7343, test_loss: 0.9183, test_f1: 0.5394
 epoch: 38, train_loss: 0.7378, test_loss: 0.9214, test_f1: 0.5369
 epoch: 39, train_loss: 0.7196, test_loss: 0.9540, test_f1: 0.6112
 epoch: 40, train_loss: 0.7206, test_loss: 0.8438, test_f1: 0.6146
 epoch: 41, train_loss: 0.7210, test_loss: 0.8742, test_f1: 0.6007
 epoch: 42, train_loss: 0.7049, test_loss: 0.8021, test_f1: 0.6181
 epoch: 43, train_loss: 0.7244, test_loss: 0.9478, test_f1: 0.5612
 epoch: 44, train_loss: 0.7330, test_loss: 0.9038, test_f1: 0.6275
 epoch: 45, train_loss: 0.7015, test_loss: 0.9351, test_f1: 0.6196
 epoch: 46, train_loss: 0.7192, test_loss: 0.7993, test_f1: 0.6089
 epoch: 47, train_loss: 0.6887, test_loss: 0.9174, test_f1: 0.6311
 epoch: 48, train_loss: 0.7008, test_loss: 0.9132, test_f1: 0.5983
 epoch: 49, train_loss: 0.7047, test_loss: 0.8849, test_f1: 0.5783
 epoch: 50, train_loss: 0.6813, test_loss: 1.0242, test_f1: 0.5932
 epoch: 51, train_loss: 0.6525, test_loss: 0.8717, test_f1: 0.6285
 epoch: 52, train_loss: 0.6356, test_loss: 0.9032, test_f1: 0.6334
 epoch: 53, train_loss: 0.6500, test_loss: 0.8752, test_f1: 0.6694
 epoch: 54, train_loss: 0.6351, test_loss: 1.0240, test_f1: 0.6551
 epoch: 55, train_loss: 0.6328, test_loss: 0.9149, test_f1: 0.6266
 epoch: 56, train_loss: 0.6278, test_loss: 1.0563, test_f1: 0.6365
 epoch: 57, train_loss: 0.6569, test_loss: 0.7770, test_f1: 0.6368
 epoch: 58, train_loss: 0.6369, test_loss: 0.7610, test_f1: 0.6434
 epoch: 59, train_loss: 0.6310, test_loss: 0.9081, test_f1: 0.6417
 epoch: 60, train_loss: 0.6052, test_loss: 0.9730, test_f1: 0.6373
 epoch: 61, train_loss: 0.6156, test_loss: 0.8475, test_f1: 0.6473
 epoch: 62, train_loss: 0.6180, test_loss: 1.0074, test_f1: 0.6329
 epoch: 63, train_loss: 0.5928, test_loss: 0.9762, test_f1: 0.6108
 epoch: 64, train_loss: 0.6165, test_loss: 0.9988, test_f1: 0.6378
 epoch: 65, train_loss: 0.6033, test_loss: 1.0018, test_f1: 0.6469
 epoch: 66, train_loss: 0.6026, test_loss: 0.9785, test_f1: 0.6384
 epoch: 67, train_loss: 0.5910, test_loss: 0.8764, test_f1: 0.6515
 epoch: 68, train_loss: 0.6115, test_loss: 1.0249, test_f1: 0.6681
 epoch: 69, train_loss: 0.5939, test_loss: 0.8970, test_f1: 0.6591
 epoch: 70, train_loss: 0.5977, test_loss: 1.0386, test_f1: 0.6255
 epoch: 71, train_loss: 0.5808, test_loss: 1.0070, test_f1: 0.6282
 epoch: 72, train_loss: 0.5932, test_loss: 0.9307, test_f1: 0.6454
 epoch: 73, train_loss: 0.5869, test_loss: 0.8984, test_f1: 0.6563
 epoch: 74, train_loss: 0.5804, test_loss: 1.1184, test_f1: 0.6541
 epoch: 75, train_loss: 0.5776, test_loss: 1.1107, test_f1: 0.6317
 epoch: 76, train_loss: 0.5858, test_loss: 1.0512, test_f1: 0.6371
 epoch: 77, train_loss: 0.5867, test_loss: 0.9584, test_f1: 0.6478
 epoch: 78, train_loss: 0.5848, test_loss: 0.9058, test_f1: 0.6514
 epoch: 79, train_loss: 0.5799, test_loss: 1.1052, test_f1: 0.6404
 epoch: 80, train_loss: 0.5713, test_loss: 1.0441, test_f1: 0.6594
 epoch: 81, train_loss: 0.5785, test_loss: 1.0048, test_f1: 0.6416
 epoch: 82, train_loss: 0.5725, test_loss: 1.0252, test_f1: 0.6470
 epoch: 83, train_loss: 0.5642, test_loss: 1.1845, test_f1: 0.6616
 epoch: 84, train_loss: 0.5775, test_loss: 0.9963, test_f1: 0.6533
 epoch: 85, train_loss: 0.5506, test_loss: 1.0691, test_f1: 0.6552
 epoch: 86, train_loss: 0.5567, test_loss: 1.0048, test_f1: 0.6334
 epoch: 87, train_loss: 0.5490, test_loss: 0.8827, test_f1: 0.6394
 epoch: 88, train_loss: 0.5492, test_loss: 1.0758, test_f1: 0.6401
 epoch: 89, train_loss: 0.5613, test_loss: 0.9823, test_f1: 0.6516
 epoch: 90, train_loss: 0.5682, test_loss: 0.9977, test_f1: 0.6543
 epoch: 91, train_loss: 0.5554, test_loss: 1.0842, test_f1: 0.6946
 epoch: 92, train_loss: 0.5470, test_loss: 0.9238, test_f1: 0.6709
 epoch: 93, train_loss: 0.5479, test_loss: 1.0510, test_f1: 0.6562
 epoch: 94, train_loss: 0.5483, test_loss: 1.0188, test_f1: 0.6493
 epoch: 95, train_loss: 0.5348, test_loss: 0.9929, test_f1: 0.6688
 epoch: 96, train_loss: 0.5566, test_loss: 1.0517, test_f1: 0.6575
 epoch: 97, train_loss: 0.5482, test_loss: 0.9583, test_f1: 0.6464
 epoch: 98, train_loss: 0.5664, test_loss: 0.9407, test_f1: 0.6557
 epoch: 99, train_loss: 0.5497, test_loss: 1.0201, test_f1: 0.6649
##################ITERATION #1 ****************************************
 epoch: 0, train_loss: 1.0969, test_loss: 1.0024, test_f1: 0.3811
 epoch: 1, train_loss: 0.9896, test_loss: 1.0289, test_f1: 0.4655
 epoch: 2, train_loss: 0.9623, test_loss: 0.9402, test_f1: 0.4933
 epoch: 3, train_loss: 0.9441, test_loss: 0.9205, test_f1: 0.5061
 epoch: 4, train_loss: 0.9443, test_loss: 1.1233, test_f1: 0.4314
 epoch: 5, train_loss: 0.9227, test_loss: 0.9505, test_f1: 0.5004
 epoch: 6, train_loss: 0.9043, test_loss: 0.8440, test_f1: 0.5505
 epoch: 7, train_loss: 0.8769, test_loss: 0.8938, test_f1: 0.5730
 epoch: 8, train_loss: 0.8761, test_loss: 0.8546, test_f1: 0.5682
 epoch: 9, train_loss: 0.8569, test_loss: 0.8985, test_f1: 0.5658
 epoch: 10, train_loss: 0.8582, test_loss: 0.8349, test_f1: 0.5558
 epoch: 11, train_loss: 0.8303, test_loss: 0.8348, test_f1: 0.5291
 epoch: 12, train_loss: 0.8208, test_loss: 0.8127, test_f1: 0.6225
 epoch: 13, train_loss: 0.8268, test_loss: 0.8373, test_f1: 0.6266
 epoch: 14, train_loss: 0.8139, test_loss: 0.8483, test_f1: 0.6118
 epoch: 15, train_loss: 0.8197, test_loss: 0.8545, test_f1: 0.5792
 epoch: 16, train_loss: 0.8052, test_loss: 0.8519, test_f1: 0.5791
 epoch: 17, train_loss: 0.7945, test_loss: 0.8806, test_f1: 0.6268
 epoch: 18, train_loss: 0.7902, test_loss: 0.8977, test_f1: 0.5411
 epoch: 19, train_loss: 0.7895, test_loss: 0.8664, test_f1: 0.5782
 epoch: 20, train_loss: 0.7738, test_loss: 0.8424, test_f1: 0.5509
 epoch: 21, train_loss: 0.7589, test_loss: 0.7799, test_f1: 0.6218
 epoch: 22, train_loss: 0.7581, test_loss: 0.8083, test_f1: 0.5999
 epoch: 23, train_loss: 0.7458, test_loss: 0.7744, test_f1: 0.6089
 epoch: 24, train_loss: 0.7484, test_loss: 0.7289, test_f1: 0.6062
 epoch: 25, train_loss: 0.7575, test_loss: 0.8481, test_f1: 0.6059
 epoch: 26, train_loss: 0.7544, test_loss: 0.7676, test_f1: 0.6687
 epoch: 27, train_loss: 0.7345, test_loss: 0.8238, test_f1: 0.5816
 epoch: 28, train_loss: 0.7570, test_loss: 0.7388, test_f1: 0.6476
 epoch: 29, train_loss: 0.7546, test_loss: 0.7796, test_f1: 0.5841
 epoch: 30, train_loss: 0.7443, test_loss: 0.8565, test_f1: 0.6206
 epoch: 31, train_loss: 0.7211, test_loss: 0.8657, test_f1: 0.5868
 epoch: 32, train_loss: 0.7129, test_loss: 0.9146, test_f1: 0.6335
 epoch: 33, train_loss: 0.7136, test_loss: 0.8596, test_f1: 0.6344
 epoch: 34, train_loss: 0.7384, test_loss: 0.8744, test_f1: 0.5677
 epoch: 35, train_loss: 0.7200, test_loss: 0.8061, test_f1: 0.6169
 epoch: 36, train_loss: 0.7113, test_loss: 0.7415, test_f1: 0.6607
 epoch: 37, train_loss: 0.7198, test_loss: 0.8437, test_f1: 0.6037
 epoch: 38, train_loss: 0.7070, test_loss: 0.8133, test_f1: 0.6433
 epoch: 39, train_loss: 0.7105, test_loss: 0.8173, test_f1: 0.6113
 epoch: 40, train_loss: 0.6926, test_loss: 0.8291, test_f1: 0.6121
 epoch: 41, train_loss: 0.7054, test_loss: 0.8830, test_f1: 0.6005
 epoch: 42, train_loss: 0.6789, test_loss: 0.8448, test_f1: 0.6574
 epoch: 43, train_loss: 0.6888, test_loss: 0.8646, test_f1: 0.6076
 epoch: 44, train_loss: 0.6913, test_loss: 0.8618, test_f1: 0.5791
 epoch: 45, train_loss: 0.7163, test_loss: 0.7617, test_f1: 0.6120
 epoch: 46, train_loss: 0.6802, test_loss: 0.8430, test_f1: 0.6345
 epoch: 47, train_loss: 0.6695, test_loss: 0.9021, test_f1: 0.6495
 epoch: 48, train_loss: 0.6695, test_loss: 0.8871, test_f1: 0.6120
 epoch: 49, train_loss: 0.6756, test_loss: 0.7697, test_f1: 0.6133
 epoch: 50, train_loss: 0.6722, test_loss: 0.8205, test_f1: 0.6395
 epoch: 51, train_loss: 0.6330, test_loss: 0.8254, test_f1: 0.6669
 epoch: 52, train_loss: 0.6332, test_loss: 0.8540, test_f1: 0.6658
 epoch: 53, train_loss: 0.6196, test_loss: 0.7666, test_f1: 0.6683
 epoch: 54, train_loss: 0.6314, test_loss: 0.8806, test_f1: 0.6504
 epoch: 55, train_loss: 0.6127, test_loss: 0.8678, test_f1: 0.6468
 epoch: 56, train_loss: 0.5991, test_loss: 0.7970, test_f1: 0.6429
 epoch: 57, train_loss: 0.6128, test_loss: 0.7977, test_f1: 0.6500
 epoch: 58, train_loss: 0.5960, test_loss: 0.8690, test_f1: 0.6611
 epoch: 59, train_loss: 0.6103, test_loss: 0.9028, test_f1: 0.6796
 epoch: 60, train_loss: 0.5994, test_loss: 0.9190, test_f1: 0.6141
 epoch: 61, train_loss: 0.6034, test_loss: 0.8507, test_f1: 0.6624
 epoch: 62, train_loss: 0.5845, test_loss: 0.9029, test_f1: 0.6742
 epoch: 63, train_loss: 0.5798, test_loss: 0.8448, test_f1: 0.6514
 epoch: 64, train_loss: 0.6028, test_loss: 0.7898, test_f1: 0.6628
 epoch: 65, train_loss: 0.5757, test_loss: 0.9582, test_f1: 0.6462
 epoch: 66, train_loss: 0.5854, test_loss: 0.8544, test_f1: 0.6798
 epoch: 67, train_loss: 0.5892, test_loss: 0.8645, test_f1: 0.6639
 epoch: 68, train_loss: 0.5975, test_loss: 0.8587, test_f1: 0.6379
 epoch: 69, train_loss: 0.5860, test_loss: 0.8588, test_f1: 0.6598
 epoch: 70, train_loss: 0.5628, test_loss: 0.8530, test_f1: 0.6663
 epoch: 71, train_loss: 0.5655, test_loss: 0.8724, test_f1: 0.6741
 epoch: 72, train_loss: 0.5693, test_loss: 0.8205, test_f1: 0.6626
 epoch: 73, train_loss: 0.5615, test_loss: 0.9199, test_f1: 0.6629
 epoch: 74, train_loss: 0.5667, test_loss: 0.9637, test_f1: 0.6619
 epoch: 75, train_loss: 0.5742, test_loss: 0.9344, test_f1: 0.6455
 epoch: 76, train_loss: 0.5677, test_loss: 1.0042, test_f1: 0.6482
 epoch: 77, train_loss: 0.5637, test_loss: 0.7996, test_f1: 0.7007
 epoch: 78, train_loss: 0.5590, test_loss: 0.8571, test_f1: 0.6453
 epoch: 79, train_loss: 0.5712, test_loss: 0.8971, test_f1: 0.6550
 epoch: 80, train_loss: 0.5691, test_loss: 0.8231, test_f1: 0.6562
 epoch: 81, train_loss: 0.5510, test_loss: 0.9357, test_f1: 0.6341
 epoch: 82, train_loss: 0.5769, test_loss: 0.9673, test_f1: 0.6389
 epoch: 83, train_loss: 0.5440, test_loss: 0.9947, test_f1: 0.6543
 epoch: 84, train_loss: 0.5476, test_loss: 0.9601, test_f1: 0.6667
 epoch: 85, train_loss: 0.5586, test_loss: 0.9409, test_f1: 0.6558
 epoch: 86, train_loss: 0.5499, test_loss: 0.8398, test_f1: 0.6539
 epoch: 87, train_loss: 0.5458, test_loss: 0.8473, test_f1: 0.6718
 epoch: 88, train_loss: 0.5539, test_loss: 0.9413, test_f1: 0.6617
 epoch: 89, train_loss: 0.5414, test_loss: 0.9269, test_f1: 0.6482
 epoch: 90, train_loss: 0.5209, test_loss: 0.9324, test_f1: 0.6629
 epoch: 91, train_loss: 0.5342, test_loss: 0.8908, test_f1: 0.6579
 epoch: 92, train_loss: 0.5524, test_loss: 0.8434, test_f1: 0.6607
 epoch: 93, train_loss: 0.5206, test_loss: 0.9112, test_f1: 0.6649
 epoch: 94, train_loss: 0.5379, test_loss: 0.9538, test_f1: 0.6467
 epoch: 95, train_loss: 0.5246, test_loss: 0.8907, test_f1: 0.6812
 epoch: 96, train_loss: 0.5263, test_loss: 0.8740, test_f1: 0.6567
 epoch: 97, train_loss: 0.5393, test_loss: 1.0193, test_f1: 0.6483
 epoch: 98, train_loss: 0.5410, test_loss: 0.9799, test_f1: 0.6434
 epoch: 99, train_loss: 0.5262, test_loss: 0.9007, test_f1: 0.6578
##################ITERATION #2 ****************************************
 epoch: 0, train_loss: 1.1042, test_loss: 1.2543, test_f1: 0.3260
 epoch: 1, train_loss: 1.0122, test_loss: 1.0477, test_f1: 0.4774
 epoch: 2, train_loss: 0.9687, test_loss: 1.0214, test_f1: 0.4256
 epoch: 3, train_loss: 0.9585, test_loss: 0.9304, test_f1: 0.4901
 epoch: 4, train_loss: 0.9397, test_loss: 0.9274, test_f1: 0.5133
 epoch: 5, train_loss: 0.9306, test_loss: 0.8806, test_f1: 0.4972
 epoch: 6, train_loss: 0.9150, test_loss: 0.8686, test_f1: 0.5415
 epoch: 7, train_loss: 0.9007, test_loss: 0.8938, test_f1: 0.5375
 epoch: 8, train_loss: 0.8869, test_loss: 0.8810, test_f1: 0.5243
 epoch: 9, train_loss: 0.8857, test_loss: 0.9096, test_f1: 0.5804
 epoch: 10, train_loss: 0.8761, test_loss: 0.8109, test_f1: 0.5677
 epoch: 11, train_loss: 0.8516, test_loss: 0.8498, test_f1: 0.5121
 epoch: 12, train_loss: 0.8395, test_loss: 0.8295, test_f1: 0.5422
 epoch: 13, train_loss: 0.8465, test_loss: 0.8636, test_f1: 0.5483
 epoch: 14, train_loss: 0.8210, test_loss: 0.8002, test_f1: 0.5891
 epoch: 15, train_loss: 0.8312, test_loss: 0.8577, test_f1: 0.5955
 epoch: 16, train_loss: 0.8219, test_loss: 0.7628, test_f1: 0.6197
 epoch: 17, train_loss: 0.8051, test_loss: 0.9222, test_f1: 0.5332
 epoch: 18, train_loss: 0.7937, test_loss: 0.7614, test_f1: 0.6297
 epoch: 19, train_loss: 0.7857, test_loss: 0.8513, test_f1: 0.5836
 epoch: 20, train_loss: 0.8053, test_loss: 0.7496, test_f1: 0.6215
 epoch: 21, train_loss: 0.7904, test_loss: 0.8138, test_f1: 0.5901
 epoch: 22, train_loss: 0.7876, test_loss: 0.7480, test_f1: 0.5904
 epoch: 23, train_loss: 0.7864, test_loss: 0.9167, test_f1: 0.5647
 epoch: 24, train_loss: 0.7854, test_loss: 0.7386, test_f1: 0.5834
 epoch: 25, train_loss: 0.7537, test_loss: 0.8300, test_f1: 0.5903
 epoch: 26, train_loss: 0.7648, test_loss: 0.7574, test_f1: 0.6014
 epoch: 27, train_loss: 0.7708, test_loss: 0.7321, test_f1: 0.6448
 epoch: 28, train_loss: 0.7598, test_loss: 0.7125, test_f1: 0.6227
 epoch: 29, train_loss: 0.7463, test_loss: 0.7500, test_f1: 0.5912
 epoch: 30, train_loss: 0.7514, test_loss: 0.9018, test_f1: 0.5498
 epoch: 31, train_loss: 0.7474, test_loss: 0.7289, test_f1: 0.6254
 epoch: 32, train_loss: 0.7405, test_loss: 0.7775, test_f1: 0.6443
 epoch: 33, train_loss: 0.7480, test_loss: 0.7685, test_f1: 0.6050
 epoch: 34, train_loss: 0.7535, test_loss: 0.7676, test_f1: 0.6192
 epoch: 35, train_loss: 0.7388, test_loss: 0.6980, test_f1: 0.6475
 epoch: 36, train_loss: 0.7253, test_loss: 0.7123, test_f1: 0.6341
 epoch: 37, train_loss: 0.7253, test_loss: 0.7189, test_f1: 0.5954
 epoch: 38, train_loss: 0.7207, test_loss: 0.7303, test_f1: 0.6354
 epoch: 39, train_loss: 0.7137, test_loss: 0.6936, test_f1: 0.6946
 epoch: 40, train_loss: 0.7219, test_loss: 0.9036, test_f1: 0.5687
 epoch: 41, train_loss: 0.7092, test_loss: 0.7588, test_f1: 0.6271
 epoch: 42, train_loss: 0.7197, test_loss: 0.7347, test_f1: 0.6606
 epoch: 43, train_loss: 0.7185, test_loss: 0.8077, test_f1: 0.5866
 epoch: 44, train_loss: 0.6966, test_loss: 0.7145, test_f1: 0.6282
 epoch: 45, train_loss: 0.7081, test_loss: 0.7659, test_f1: 0.6625
 epoch: 46, train_loss: 0.7071, test_loss: 0.7421, test_f1: 0.6444
 epoch: 47, train_loss: 0.7017, test_loss: 0.7473, test_f1: 0.6062
 epoch: 48, train_loss: 0.6983, test_loss: 0.7095, test_f1: 0.6434
 epoch: 49, train_loss: 0.6930, test_loss: 0.8281, test_f1: 0.5861
 epoch: 50, train_loss: 0.7035, test_loss: 0.7561, test_f1: 0.6326
 epoch: 51, train_loss: 0.6976, test_loss: 0.7271, test_f1: 0.6344
 epoch: 52, train_loss: 0.6900, test_loss: 0.7399, test_f1: 0.6160
 epoch: 53, train_loss: 0.6555, test_loss: 0.7305, test_f1: 0.6335
 epoch: 54, train_loss: 0.6520, test_loss: 0.7351, test_f1: 0.6358
 epoch: 55, train_loss: 0.6375, test_loss: 0.8171, test_f1: 0.6370
 epoch: 56, train_loss: 0.6302, test_loss: 0.7280, test_f1: 0.6365
 epoch: 57, train_loss: 0.6390, test_loss: 0.7435, test_f1: 0.6752
 epoch: 58, train_loss: 0.6302, test_loss: 0.7164, test_f1: 0.6648
 epoch: 59, train_loss: 0.6307, test_loss: 0.7363, test_f1: 0.6530
 epoch: 60, train_loss: 0.6218, test_loss: 0.7220, test_f1: 0.6773
 epoch: 61, train_loss: 0.6148, test_loss: 0.7505, test_f1: 0.6568
 epoch: 62, train_loss: 0.6269, test_loss: 0.7599, test_f1: 0.6060
 epoch: 63, train_loss: 0.6224, test_loss: 0.7344, test_f1: 0.6670
 epoch: 64, train_loss: 0.6305, test_loss: 0.7548, test_f1: 0.6385
 epoch: 65, train_loss: 0.6156, test_loss: 0.7415, test_f1: 0.6386
 epoch: 66, train_loss: 0.6128, test_loss: 0.7673, test_f1: 0.6314
 epoch: 67, train_loss: 0.6205, test_loss: 0.8205, test_f1: 0.6563
 epoch: 68, train_loss: 0.6001, test_loss: 0.7254, test_f1: 0.6415
 epoch: 69, train_loss: 0.5798, test_loss: 0.7410, test_f1: 0.6650
 epoch: 70, train_loss: 0.5988, test_loss: 0.7649, test_f1: 0.6698
 epoch: 71, train_loss: 0.5835, test_loss: 0.7837, test_f1: 0.6658
 epoch: 72, train_loss: 0.5989, test_loss: 0.7597, test_f1: 0.6461
 epoch: 73, train_loss: 0.5786, test_loss: 0.7964, test_f1: 0.6389
 epoch: 74, train_loss: 0.6019, test_loss: 0.7335, test_f1: 0.6520
 epoch: 75, train_loss: 0.5754, test_loss: 0.7961, test_f1: 0.6489
 epoch: 76, train_loss: 0.5848, test_loss: 0.7949, test_f1: 0.6467
 epoch: 77, train_loss: 0.5775, test_loss: 0.8768, test_f1: 0.6456
 epoch: 78, train_loss: 0.5879, test_loss: 0.7479, test_f1: 0.6347
 epoch: 79, train_loss: 0.5777, test_loss: 0.7709, test_f1: 0.6439
 epoch: 80, train_loss: 0.5815, test_loss: 0.7499, test_f1: 0.6826
 epoch: 81, train_loss: 0.5810, test_loss: 0.7412, test_f1: 0.6428
 epoch: 82, train_loss: 0.5566, test_loss: 0.7274, test_f1: 0.6631
 epoch: 83, train_loss: 0.5656, test_loss: 0.7589, test_f1: 0.6688
 epoch: 84, train_loss: 0.5700, test_loss: 0.7286, test_f1: 0.6699
 epoch: 85, train_loss: 0.5728, test_loss: 0.7708, test_f1: 0.6737
 epoch: 86, train_loss: 0.5643, test_loss: 0.8115, test_f1: 0.6390
 epoch: 87, train_loss: 0.5682, test_loss: 0.7362, test_f1: 0.6541
 epoch: 88, train_loss: 0.5674, test_loss: 0.7521, test_f1: 0.6909
 epoch: 89, train_loss: 0.5493, test_loss: 0.7375, test_f1: 0.6856
 epoch: 90, train_loss: 0.5596, test_loss: 0.7198, test_f1: 0.6461
 epoch: 91, train_loss: 0.5594, test_loss: 0.7591, test_f1: 0.6729
 epoch: 92, train_loss: 0.5604, test_loss: 0.7528, test_f1: 0.6319
 epoch: 93, train_loss: 0.5524, test_loss: 0.7353, test_f1: 0.6517
 epoch: 94, train_loss: 0.5498, test_loss: 0.7425, test_f1: 0.6768
 epoch: 95, train_loss: 0.5506, test_loss: 0.7400, test_f1: 0.6918
 epoch: 96, train_loss: 0.5294, test_loss: 0.7865, test_f1: 0.6377
 epoch: 97, train_loss: 0.5332, test_loss: 0.7737, test_f1: 0.6493
 epoch: 98, train_loss: 0.5476, test_loss: 0.7561, test_f1: 0.6661
 epoch: 99, train_loss: 0.5376, test_loss: 0.8282, test_f1: 0.6785
##################ITERATION #3 ****************************************
 epoch: 0, train_loss: 1.1030, test_loss: 1.0457, test_f1: 0.3574
 epoch: 1, train_loss: 0.9813, test_loss: 0.9528, test_f1: 0.4985
 epoch: 2, train_loss: 0.9520, test_loss: 0.9008, test_f1: 0.5553
 epoch: 3, train_loss: 0.9382, test_loss: 0.9334, test_f1: 0.5166
 epoch: 4, train_loss: 0.9088, test_loss: 0.9569, test_f1: 0.5526
 epoch: 5, train_loss: 0.8902, test_loss: 1.1121, test_f1: 0.4993
 epoch: 6, train_loss: 0.8972, test_loss: 0.9337, test_f1: 0.5924
 epoch: 7, train_loss: 0.8836, test_loss: 0.8991, test_f1: 0.5528
 epoch: 8, train_loss: 0.8634, test_loss: 0.8592, test_f1: 0.5050
 epoch: 9, train_loss: 0.8594, test_loss: 0.8825, test_f1: 0.5138
 epoch: 10, train_loss: 0.8499, test_loss: 0.9353, test_f1: 0.5759
 epoch: 11, train_loss: 0.8625, test_loss: 0.9694, test_f1: 0.5591
 epoch: 12, train_loss: 0.8437, test_loss: 0.8871, test_f1: 0.5769
 epoch: 13, train_loss: 0.8303, test_loss: 0.9171, test_f1: 0.5504
 epoch: 14, train_loss: 0.8252, test_loss: 1.1273, test_f1: 0.4972
 epoch: 15, train_loss: 0.8184, test_loss: 0.8790, test_f1: 0.5489
 epoch: 16, train_loss: 0.8208, test_loss: 0.8686, test_f1: 0.5501
 epoch: 17, train_loss: 0.8046, test_loss: 0.8954, test_f1: 0.5828
 epoch: 18, train_loss: 0.8014, test_loss: 0.8433, test_f1: 0.6034
 epoch: 19, train_loss: 0.8106, test_loss: 0.8865, test_f1: 0.5787
 epoch: 20, train_loss: 0.7814, test_loss: 0.9092, test_f1: 0.5836
 epoch: 21, train_loss: 0.7883, test_loss: 0.8874, test_f1: 0.5942
 epoch: 22, train_loss: 0.7788, test_loss: 0.9064, test_f1: 0.5966
 epoch: 23, train_loss: 0.7681, test_loss: 0.8434, test_f1: 0.5591
 epoch: 24, train_loss: 0.7707, test_loss: 0.9261, test_f1: 0.5521
 epoch: 25, train_loss: 0.7597, test_loss: 0.9069, test_f1: 0.6186
 epoch: 26, train_loss: 0.7779, test_loss: 0.8239, test_f1: 0.5838
 epoch: 27, train_loss: 0.7632, test_loss: 0.8952, test_f1: 0.6331
 epoch: 28, train_loss: 0.7715, test_loss: 0.8552, test_f1: 0.5833
 epoch: 29, train_loss: 0.7376, test_loss: 0.9220, test_f1: 0.5749
 epoch: 30, train_loss: 0.7499, test_loss: 0.8678, test_f1: 0.5918
 epoch: 31, train_loss: 0.7463, test_loss: 0.8202, test_f1: 0.6427
 epoch: 32, train_loss: 0.7653, test_loss: 0.9197, test_f1: 0.6067
 epoch: 33, train_loss: 0.7346, test_loss: 0.8331, test_f1: 0.6454
 epoch: 34, train_loss: 0.7295, test_loss: 0.8571, test_f1: 0.6457
 epoch: 35, train_loss: 0.7283, test_loss: 0.9173, test_f1: 0.6119
 epoch: 36, train_loss: 0.7488, test_loss: 0.8702, test_f1: 0.6008
 epoch: 37, train_loss: 0.7177, test_loss: 0.9045, test_f1: 0.6003
 epoch: 38, train_loss: 0.7136, test_loss: 0.8955, test_f1: 0.6214
 epoch: 39, train_loss: 0.7078, test_loss: 0.8963, test_f1: 0.5810
 epoch: 40, train_loss: 0.7224, test_loss: 0.8165, test_f1: 0.6518
 epoch: 41, train_loss: 0.7282, test_loss: 0.8351, test_f1: 0.6305
 epoch: 42, train_loss: 0.7120, test_loss: 0.8651, test_f1: 0.6421
 epoch: 43, train_loss: 0.6922, test_loss: 0.9389, test_f1: 0.6721
 epoch: 44, train_loss: 0.7203, test_loss: 1.0508, test_f1: 0.5343
 epoch: 45, train_loss: 0.7176, test_loss: 0.8698, test_f1: 0.6169
 epoch: 46, train_loss: 0.7040, test_loss: 0.8852, test_f1: 0.6211
 epoch: 47, train_loss: 0.6987, test_loss: 0.9170, test_f1: 0.6240
 epoch: 48, train_loss: 0.6810, test_loss: 0.8909, test_f1: 0.6555
 epoch: 49, train_loss: 0.6814, test_loss: 0.9965, test_f1: 0.5861
 epoch: 50, train_loss: 0.7052, test_loss: 0.9534, test_f1: 0.6165
 epoch: 51, train_loss: 0.6659, test_loss: 0.9050, test_f1: 0.6271
 epoch: 52, train_loss: 0.6575, test_loss: 0.9581, test_f1: 0.6733
 epoch: 53, train_loss: 0.6200, test_loss: 0.9171, test_f1: 0.6614
 epoch: 54, train_loss: 0.6252, test_loss: 0.8925, test_f1: 0.6901
 epoch: 55, train_loss: 0.6544, test_loss: 0.8352, test_f1: 0.6787
 epoch: 56, train_loss: 0.6286, test_loss: 0.9764, test_f1: 0.6597
 epoch: 57, train_loss: 0.6310, test_loss: 0.9852, test_f1: 0.6223
 epoch: 58, train_loss: 0.6237, test_loss: 0.9350, test_f1: 0.6504
 epoch: 59, train_loss: 0.6119, test_loss: 0.8826, test_f1: 0.6533
 epoch: 60, train_loss: 0.6270, test_loss: 1.0593, test_f1: 0.6490
 epoch: 61, train_loss: 0.6418, test_loss: 0.9430, test_f1: 0.6946
 epoch: 62, train_loss: 0.6131, test_loss: 0.9195, test_f1: 0.6612
 epoch: 63, train_loss: 0.6102, test_loss: 0.9212, test_f1: 0.6713
 epoch: 64, train_loss: 0.6221, test_loss: 0.9092, test_f1: 0.6463
 epoch: 65, train_loss: 0.6065, test_loss: 0.9835, test_f1: 0.6820
 epoch: 66, train_loss: 0.6012, test_loss: 0.9463, test_f1: 0.6700
 epoch: 67, train_loss: 0.5872, test_loss: 0.9216, test_f1: 0.6854
 epoch: 68, train_loss: 0.6340, test_loss: 1.0291, test_f1: 0.6461
 epoch: 69, train_loss: 0.6028, test_loss: 1.0960, test_f1: 0.6593
 epoch: 70, train_loss: 0.5824, test_loss: 0.9595, test_f1: 0.6698
 epoch: 71, train_loss: 0.6028, test_loss: 1.0661, test_f1: 0.6538
 epoch: 72, train_loss: 0.6058, test_loss: 0.9821, test_f1: 0.6693
 epoch: 73, train_loss: 0.6020, test_loss: 0.9639, test_f1: 0.6502
 epoch: 74, train_loss: 0.5925, test_loss: 1.0173, test_f1: 0.6567
 epoch: 75, train_loss: 0.5897, test_loss: 0.8617, test_f1: 0.6666
 epoch: 76, train_loss: 0.6052, test_loss: 0.9053, test_f1: 0.6694
 epoch: 77, train_loss: 0.5709, test_loss: 0.9636, test_f1: 0.6614
 epoch: 78, train_loss: 0.5840, test_loss: 0.9655, test_f1: 0.6756
 epoch: 79, train_loss: 0.6021, test_loss: 0.8973, test_f1: 0.6618
 epoch: 80, train_loss: 0.5926, test_loss: 1.0796, test_f1: 0.6513
 epoch: 81, train_loss: 0.5792, test_loss: 0.9201, test_f1: 0.6635
 epoch: 82, train_loss: 0.5830, test_loss: 1.1172, test_f1: 0.6495
 epoch: 83, train_loss: 0.5625, test_loss: 1.1104, test_f1: 0.6613
 epoch: 84, train_loss: 0.5772, test_loss: 0.9693, test_f1: 0.6701
 epoch: 85, train_loss: 0.5803, test_loss: 0.9984, test_f1: 0.6651
 epoch: 86, train_loss: 0.5483, test_loss: 1.1629, test_f1: 0.6903
 epoch: 87, train_loss: 0.5586, test_loss: 0.9903, test_f1: 0.6741
 epoch: 88, train_loss: 0.5571, test_loss: 0.9778, test_f1: 0.6722
 epoch: 89, train_loss: 0.5692, test_loss: 1.1071, test_f1: 0.6670
 epoch: 90, train_loss: 0.5644, test_loss: 1.0166, test_f1: 0.6818
 epoch: 91, train_loss: 0.5787, test_loss: 1.0135, test_f1: 0.6751
 epoch: 92, train_loss: 0.5719, test_loss: 1.0189, test_f1: 0.6765
 epoch: 93, train_loss: 0.5582, test_loss: 0.9373, test_f1: 0.6721
 epoch: 94, train_loss: 0.5725, test_loss: 1.0033, test_f1: 0.6705
 epoch: 95, train_loss: 0.5660, test_loss: 0.8900, test_f1: 0.6888
 epoch: 96, train_loss: 0.5723, test_loss: 0.9881, test_f1: 0.6762
 epoch: 97, train_loss: 0.5419, test_loss: 1.0943, test_f1: 0.6696
 epoch: 98, train_loss: 0.5583, test_loss: 0.9769, test_f1: 0.6960
 epoch: 99, train_loss: 0.5559, test_loss: 1.0959, test_f1: 0.6684
##################ITERATION #4 ****************************************
 epoch: 0, train_loss: 1.0902, test_loss: 1.0321, test_f1: 0.4311
 epoch: 1, train_loss: 0.9854, test_loss: 1.0046, test_f1: 0.4805
 epoch: 2, train_loss: 0.9511, test_loss: 0.9442, test_f1: 0.4963
 epoch: 3, train_loss: 0.9314, test_loss: 0.9195, test_f1: 0.5620
 epoch: 4, train_loss: 0.9232, test_loss: 1.0347, test_f1: 0.4838
 epoch: 5, train_loss: 0.9157, test_loss: 0.9451, test_f1: 0.5108
 epoch: 6, train_loss: 0.8934, test_loss: 0.9203, test_f1: 0.5697
 epoch: 7, train_loss: 0.8751, test_loss: 0.8754, test_f1: 0.5680
 epoch: 8, train_loss: 0.8605, test_loss: 0.9448, test_f1: 0.5842
 epoch: 9, train_loss: 0.8410, test_loss: 0.9161, test_f1: 0.5575
 epoch: 10, train_loss: 0.8578, test_loss: 0.8963, test_f1: 0.5482
 epoch: 11, train_loss: 0.8460, test_loss: 0.9222, test_f1: 0.4976
 epoch: 12, train_loss: 0.8447, test_loss: 0.8338, test_f1: 0.5609
 epoch: 13, train_loss: 0.8209, test_loss: 0.8633, test_f1: 0.5488
 epoch: 14, train_loss: 0.8311, test_loss: 0.8263, test_f1: 0.5838
 epoch: 15, train_loss: 0.8090, test_loss: 0.8906, test_f1: 0.5714
 epoch: 16, train_loss: 0.8357, test_loss: 0.8484, test_f1: 0.5487
 epoch: 17, train_loss: 0.8215, test_loss: 0.9170, test_f1: 0.5861
 epoch: 18, train_loss: 0.7975, test_loss: 1.3005, test_f1: 0.4490
 epoch: 19, train_loss: 0.8017, test_loss: 0.8593, test_f1: 0.5760
 epoch: 20, train_loss: 0.8064, test_loss: 0.8409, test_f1: 0.5763
 epoch: 21, train_loss: 0.7788, test_loss: 0.8299, test_f1: 0.5545
 epoch: 22, train_loss: 0.7829, test_loss: 0.8634, test_f1: 0.6225
 epoch: 23, train_loss: 0.7835, test_loss: 0.8626, test_f1: 0.6028
 epoch: 24, train_loss: 0.7807, test_loss: 0.7644, test_f1: 0.6462
 epoch: 25, train_loss: 0.7828, test_loss: 0.8504, test_f1: 0.5280
 epoch: 26, train_loss: 0.7698, test_loss: 0.8050, test_f1: 0.6045
 epoch: 27, train_loss: 0.7950, test_loss: 0.8094, test_f1: 0.6186
 epoch: 28, train_loss: 0.7733, test_loss: 0.8505, test_f1: 0.5637
 epoch: 29, train_loss: 0.7631, test_loss: 0.9003, test_f1: 0.6103
 epoch: 30, train_loss: 0.7818, test_loss: 0.8096, test_f1: 0.6168
 epoch: 31, train_loss: 0.7552, test_loss: 0.7877, test_f1: 0.6049
 epoch: 32, train_loss: 0.7597, test_loss: 0.7908, test_f1: 0.6325
 epoch: 33, train_loss: 0.7578, test_loss: 0.7894, test_f1: 0.6351
 epoch: 34, train_loss: 0.7503, test_loss: 0.7843, test_f1: 0.5947
 epoch: 35, train_loss: 0.7259, test_loss: 0.7656, test_f1: 0.6164
 epoch: 36, train_loss: 0.7234, test_loss: 0.7611, test_f1: 0.5984
 epoch: 37, train_loss: 0.7205, test_loss: 0.8522, test_f1: 0.5975
 epoch: 38, train_loss: 0.7210, test_loss: 0.7739, test_f1: 0.6577
 epoch: 39, train_loss: 0.7285, test_loss: 0.7769, test_f1: 0.6259
 epoch: 40, train_loss: 0.7092, test_loss: 0.7349, test_f1: 0.6587
 epoch: 41, train_loss: 0.7226, test_loss: 0.7818, test_f1: 0.6616
 epoch: 42, train_loss: 0.6865, test_loss: 0.7574, test_f1: 0.6096
 epoch: 43, train_loss: 0.7206, test_loss: 0.7670, test_f1: 0.6249
 epoch: 44, train_loss: 0.6864, test_loss: 0.7794, test_f1: 0.6604
 epoch: 45, train_loss: 0.6874, test_loss: 0.8641, test_f1: 0.6004
 epoch: 46, train_loss: 0.6939, test_loss: 0.8603, test_f1: 0.5949
 epoch: 47, train_loss: 0.6940, test_loss: 0.8307, test_f1: 0.6186
 epoch: 48, train_loss: 0.7117, test_loss: 0.7853, test_f1: 0.6161
 epoch: 49, train_loss: 0.6989, test_loss: 0.7107, test_f1: 0.6503
 epoch: 50, train_loss: 0.6893, test_loss: 0.8153, test_f1: 0.5852
 epoch: 51, train_loss: 0.6706, test_loss: 0.8049, test_f1: 0.6455
 epoch: 52, train_loss: 0.6466, test_loss: 0.7960, test_f1: 0.6414
 epoch: 53, train_loss: 0.6467, test_loss: 0.7917, test_f1: 0.6573
 epoch: 54, train_loss: 0.6285, test_loss: 0.7628, test_f1: 0.6642
 epoch: 55, train_loss: 0.6218, test_loss: 0.7391, test_f1: 0.6575
 epoch: 56, train_loss: 0.6236, test_loss: 0.7666, test_f1: 0.6593
 epoch: 57, train_loss: 0.6420, test_loss: 0.7673, test_f1: 0.6629
 epoch: 58, train_loss: 0.6260, test_loss: 0.7996, test_f1: 0.6713
 epoch: 59, train_loss: 0.6201, test_loss: 0.7553, test_f1: 0.6337
 epoch: 60, train_loss: 0.6013, test_loss: 0.8503, test_f1: 0.6436
 epoch: 61, train_loss: 0.6108, test_loss: 0.8219, test_f1: 0.6222
 epoch: 62, train_loss: 0.6210, test_loss: 0.7803, test_f1: 0.6664
 epoch: 63, train_loss: 0.5904, test_loss: 0.8338, test_f1: 0.6534
 epoch: 64, train_loss: 0.5910, test_loss: 0.8582, test_f1: 0.6416
 epoch: 65, train_loss: 0.5854, test_loss: 0.8046, test_f1: 0.6738
 epoch: 66, train_loss: 0.5897, test_loss: 0.8715, test_f1: 0.6576
 epoch: 67, train_loss: 0.5857, test_loss: 0.8593, test_f1: 0.6542
 epoch: 68, train_loss: 0.5909, test_loss: 0.7951, test_f1: 0.6573
 epoch: 69, train_loss: 0.6000, test_loss: 0.7666, test_f1: 0.6359
 epoch: 70, train_loss: 0.5787, test_loss: 0.8442, test_f1: 0.6484
 epoch: 71, train_loss: 0.5717, test_loss: 0.8218, test_f1: 0.6726
 epoch: 72, train_loss: 0.5824, test_loss: 0.8843, test_f1: 0.6524
 epoch: 73, train_loss: 0.5851, test_loss: 0.8774, test_f1: 0.6826
 epoch: 74, train_loss: 0.5557, test_loss: 0.9230, test_f1: 0.6727
 epoch: 75, train_loss: 0.5718, test_loss: 0.8309, test_f1: 0.6581
 epoch: 76, train_loss: 0.5647, test_loss: 0.7755, test_f1: 0.6666
 epoch: 77, train_loss: 0.5847, test_loss: 0.7819, test_f1: 0.6585
 epoch: 78, train_loss: 0.5586, test_loss: 0.8384, test_f1: 0.6590
 epoch: 79, train_loss: 0.5685, test_loss: 0.8060, test_f1: 0.6721
 epoch: 80, train_loss: 0.5603, test_loss: 0.8953, test_f1: 0.6686
 epoch: 81, train_loss: 0.5612, test_loss: 0.8495, test_f1: 0.6894
 epoch: 82, train_loss: 0.5546, test_loss: 0.8217, test_f1: 0.6851
 epoch: 83, train_loss: 0.5609, test_loss: 0.7969, test_f1: 0.6807
 epoch: 84, train_loss: 0.5452, test_loss: 0.8147, test_f1: 0.7010
 epoch: 85, train_loss: 0.5547, test_loss: 0.8740, test_f1: 0.6718
 epoch: 86, train_loss: 0.5451, test_loss: 0.8645, test_f1: 0.6729
 epoch: 87, train_loss: 0.5539, test_loss: 0.7869, test_f1: 0.6928
 epoch: 88, train_loss: 0.5525, test_loss: 0.7729, test_f1: 0.6782
 epoch: 89, train_loss: 0.5455, test_loss: 0.8824, test_f1: 0.6605
 epoch: 90, train_loss: 0.5514, test_loss: 0.8008, test_f1: 0.6793
 epoch: 91, train_loss: 0.5384, test_loss: 0.8491, test_f1: 0.6714
 epoch: 92, train_loss: 0.5424, test_loss: 0.8004, test_f1: 0.6968
 epoch: 93, train_loss: 0.5297, test_loss: 0.8138, test_f1: 0.7014
 epoch: 94, train_loss: 0.5381, test_loss: 0.7927, test_f1: 0.6820
 epoch: 95, train_loss: 0.5492, test_loss: 0.8351, test_f1: 0.6904
 epoch: 96, train_loss: 0.5226, test_loss: 0.8415, test_f1: 0.6700
 epoch: 97, train_loss: 0.5412, test_loss: 0.8135, test_f1: 0.6786
 epoch: 98, train_loss: 0.5652, test_loss: 0.8589, test_f1: 0.6709
 epoch: 99, train_loss: 0.5418, test_loss: 0.9475, test_f1: 0.6736
##################ITERATION #5 ****************************************
 epoch: 0, train_loss: 1.1630, test_loss: 1.2078, test_f1: 0.3852
 epoch: 1, train_loss: 1.0259, test_loss: 1.0086, test_f1: 0.4367
 epoch: 2, train_loss: 0.9945, test_loss: 0.9623, test_f1: 0.4773
 epoch: 3, train_loss: 0.9793, test_loss: 1.2031, test_f1: 0.4214
 epoch: 4, train_loss: 0.9465, test_loss: 0.9488, test_f1: 0.4930
 epoch: 5, train_loss: 0.9364, test_loss: 1.1180, test_f1: 0.3795
 epoch: 6, train_loss: 0.9141, test_loss: 0.8462, test_f1: 0.5416
 epoch: 7, train_loss: 0.9000, test_loss: 0.8478, test_f1: 0.5594
 epoch: 8, train_loss: 0.8929, test_loss: 0.9155, test_f1: 0.5408
 epoch: 9, train_loss: 0.8851, test_loss: 0.9190, test_f1: 0.5360
 epoch: 10, train_loss: 0.8739, test_loss: 0.8044, test_f1: 0.5971
 epoch: 11, train_loss: 0.8502, test_loss: 0.9560, test_f1: 0.5052
 epoch: 12, train_loss: 0.8507, test_loss: 0.9457, test_f1: 0.5031
 epoch: 13, train_loss: 0.8372, test_loss: 0.7934, test_f1: 0.5608
 epoch: 14, train_loss: 0.8403, test_loss: 0.8876, test_f1: 0.5324
 epoch: 15, train_loss: 0.8168, test_loss: 0.8696, test_f1: 0.5631
 epoch: 16, train_loss: 0.8342, test_loss: 0.8568, test_f1: 0.5580
 epoch: 17, train_loss: 0.8298, test_loss: 0.7872, test_f1: 0.6092
 epoch: 18, train_loss: 0.8249, test_loss: 0.8700, test_f1: 0.5280
 epoch: 19, train_loss: 0.8095, test_loss: 0.9183, test_f1: 0.5696
 epoch: 20, train_loss: 0.8115, test_loss: 0.8294, test_f1: 0.5842
 epoch: 21, train_loss: 0.8121, test_loss: 0.9114, test_f1: 0.5709
 epoch: 22, train_loss: 0.8092, test_loss: 0.8493, test_f1: 0.6180
 epoch: 23, train_loss: 0.8208, test_loss: 1.0294, test_f1: 0.4637
 epoch: 24, train_loss: 0.8066, test_loss: 0.8086, test_f1: 0.5905
 epoch: 25, train_loss: 0.7977, test_loss: 0.9182, test_f1: 0.5929
 epoch: 26, train_loss: 0.8022, test_loss: 0.9737, test_f1: 0.5755
 epoch: 27, train_loss: 0.7864, test_loss: 0.8600, test_f1: 0.5829
 epoch: 28, train_loss: 0.7858, test_loss: 0.9000, test_f1: 0.6091
 epoch: 29, train_loss: 0.8217, test_loss: 0.8765, test_f1: 0.5883
 epoch: 30, train_loss: 0.8023, test_loss: 0.8973, test_f1: 0.6443
 epoch: 31, train_loss: 0.7874, test_loss: 0.8555, test_f1: 0.6233
 epoch: 32, train_loss: 0.7656, test_loss: 0.9100, test_f1: 0.5595
 epoch: 33, train_loss: 0.7730, test_loss: 0.8944, test_f1: 0.6377
 epoch: 34, train_loss: 0.7730, test_loss: 0.8858, test_f1: 0.5994
 epoch: 35, train_loss: 0.7649, test_loss: 0.9037, test_f1: 0.6064
 epoch: 36, train_loss: 0.7535, test_loss: 0.9285, test_f1: 0.5800
 epoch: 37, train_loss: 0.7590, test_loss: 0.8508, test_f1: 0.6004
 epoch: 38, train_loss: 0.7620, test_loss: 0.7775, test_f1: 0.6166
 epoch: 39, train_loss: 0.7402, test_loss: 0.9116, test_f1: 0.5929
 epoch: 40, train_loss: 0.7447, test_loss: 0.9937, test_f1: 0.6080
 epoch: 41, train_loss: 0.7455, test_loss: 0.8793, test_f1: 0.6164
 epoch: 42, train_loss: 0.7411, test_loss: 0.8927, test_f1: 0.6195
 epoch: 43, train_loss: 0.7489, test_loss: 0.8764, test_f1: 0.6522
 epoch: 44, train_loss: 0.7261, test_loss: 0.9643, test_f1: 0.6108
 epoch: 45, train_loss: 0.7506, test_loss: 0.8278, test_f1: 0.6447
 epoch: 46, train_loss: 0.7410, test_loss: 0.9167, test_f1: 0.6351
 epoch: 47, train_loss: 0.7261, test_loss: 0.9923, test_f1: 0.6201
 epoch: 48, train_loss: 0.7322, test_loss: 0.9887, test_f1: 0.6319
 epoch: 49, train_loss: 0.7289, test_loss: 0.7495, test_f1: 0.6283
 epoch: 50, train_loss: 0.7168, test_loss: 0.8955, test_f1: 0.6243
 epoch: 51, train_loss: 0.6870, test_loss: 0.8491, test_f1: 0.6234
 epoch: 52, train_loss: 0.6918, test_loss: 0.8661, test_f1: 0.6095
 epoch: 53, train_loss: 0.6759, test_loss: 0.8801, test_f1: 0.6344
 epoch: 54, train_loss: 0.6692, test_loss: 0.8964, test_f1: 0.6304
 epoch: 55, train_loss: 0.6860, test_loss: 0.8412, test_f1: 0.6481
 epoch: 56, train_loss: 0.6588, test_loss: 0.9020, test_f1: 0.6372
 epoch: 57, train_loss: 0.6694, test_loss: 0.8392, test_f1: 0.6284
 epoch: 58, train_loss: 0.6795, test_loss: 0.9074, test_f1: 0.5992
 epoch: 59, train_loss: 0.6720, test_loss: 0.8468, test_f1: 0.6356
 epoch: 60, train_loss: 0.6645, test_loss: 0.7885, test_f1: 0.6286
 epoch: 61, train_loss: 0.6582, test_loss: 0.8707, test_f1: 0.6259
 epoch: 62, train_loss: 0.6619, test_loss: 0.8277, test_f1: 0.6395
 epoch: 63, train_loss: 0.6619, test_loss: 0.7732, test_f1: 0.6525
 epoch: 64, train_loss: 0.6517, test_loss: 0.7828, test_f1: 0.6373
 epoch: 65, train_loss: 0.6533, test_loss: 0.8605, test_f1: 0.6429
 epoch: 66, train_loss: 0.6413, test_loss: 0.8460, test_f1: 0.6533
 epoch: 67, train_loss: 0.6387, test_loss: 0.8443, test_f1: 0.6370
 epoch: 68, train_loss: 0.6350, test_loss: 0.8006, test_f1: 0.6558
 epoch: 69, train_loss: 0.6570, test_loss: 0.7927, test_f1: 0.6321
 epoch: 70, train_loss: 0.6460, test_loss: 0.7697, test_f1: 0.6559
 epoch: 71, train_loss: 0.6327, test_loss: 0.7414, test_f1: 0.6708
 epoch: 72, train_loss: 0.6359, test_loss: 0.8960, test_f1: 0.6709
 epoch: 73, train_loss: 0.6317, test_loss: 0.8104, test_f1: 0.6381
 epoch: 74, train_loss: 0.6386, test_loss: 0.8084, test_f1: 0.6728
 epoch: 75, train_loss: 0.6245, test_loss: 0.8960, test_f1: 0.6352
 epoch: 76, train_loss: 0.6384, test_loss: 0.8153, test_f1: 0.6682
 epoch: 77, train_loss: 0.6267, test_loss: 1.0078, test_f1: 0.6115
 epoch: 78, train_loss: 0.6383, test_loss: 0.7146, test_f1: 0.6568
 epoch: 79, train_loss: 0.6169, test_loss: 1.0586, test_f1: 0.6274
 epoch: 80, train_loss: 0.6187, test_loss: 0.7271, test_f1: 0.6651
 epoch: 81, train_loss: 0.6283, test_loss: 0.7874, test_f1: 0.6380
 epoch: 82, train_loss: 0.6145, test_loss: 0.9032, test_f1: 0.6270
 epoch: 83, train_loss: 0.6193, test_loss: 0.9324, test_f1: 0.6351
 epoch: 84, train_loss: 0.6091, test_loss: 0.8786, test_f1: 0.6465
 epoch: 85, train_loss: 0.6036, test_loss: 0.8673, test_f1: 0.6438
 epoch: 86, train_loss: 0.6125, test_loss: 0.9361, test_f1: 0.6417
 epoch: 87, train_loss: 0.6063, test_loss: 0.9530, test_f1: 0.6768
 epoch: 88, train_loss: 0.5935, test_loss: 1.0015, test_f1: 0.6645
 epoch: 89, train_loss: 0.6041, test_loss: 0.8458, test_f1: 0.6304
 epoch: 90, train_loss: 0.6111, test_loss: 0.8497, test_f1: 0.6428
 epoch: 91, train_loss: 0.6030, test_loss: 0.8941, test_f1: 0.6225
 epoch: 92, train_loss: 0.5840, test_loss: 0.9133, test_f1: 0.6125
 epoch: 93, train_loss: 0.5884, test_loss: 0.8298, test_f1: 0.6354
 epoch: 94, train_loss: 0.5917, test_loss: 0.8069, test_f1: 0.6404
 epoch: 95, train_loss: 0.5967, test_loss: 0.8464, test_f1: 0.6346
 epoch: 96, train_loss: 0.5915, test_loss: 1.0315, test_f1: 0.6251
 epoch: 97, train_loss: 0.5761, test_loss: 0.9548, test_f1: 0.6340
 epoch: 98, train_loss: 0.5873, test_loss: 1.0202, test_f1: 0.6481
 epoch: 99, train_loss: 0.5958, test_loss: 0.8462, test_f1: 0.6280
##################ITERATION #6 ****************************************
 epoch: 0, train_loss: 1.1107, test_loss: 1.1073, test_f1: 0.4251
 epoch: 1, train_loss: 0.9934, test_loss: 0.9763, test_f1: 0.4568
 epoch: 2, train_loss: 0.9599, test_loss: 0.9316, test_f1: 0.4942
 epoch: 3, train_loss: 0.9404, test_loss: 0.9701, test_f1: 0.4969
 epoch: 4, train_loss: 0.9290, test_loss: 1.0315, test_f1: 0.4869
 epoch: 5, train_loss: 0.9116, test_loss: 0.9827, test_f1: 0.5110
 epoch: 6, train_loss: 0.9017, test_loss: 0.9446, test_f1: 0.5327
 epoch: 7, train_loss: 0.8905, test_loss: 0.9399, test_f1: 0.5205
 epoch: 8, train_loss: 0.8833, test_loss: 0.8622, test_f1: 0.5434
 epoch: 9, train_loss: 0.8785, test_loss: 0.8660, test_f1: 0.5034
 epoch: 10, train_loss: 0.8524, test_loss: 0.9294, test_f1: 0.5548
 epoch: 11, train_loss: 0.8435, test_loss: 0.9430, test_f1: 0.5601
 epoch: 12, train_loss: 0.8561, test_loss: 0.9572, test_f1: 0.5326
 epoch: 13, train_loss: 0.8458, test_loss: 1.0094, test_f1: 0.5198
 epoch: 14, train_loss: 0.8418, test_loss: 0.8799, test_f1: 0.5472
 epoch: 15, train_loss: 0.8401, test_loss: 0.8695, test_f1: 0.5639
 epoch: 16, train_loss: 0.8235, test_loss: 0.9117, test_f1: 0.6012
 epoch: 17, train_loss: 0.8285, test_loss: 0.8922, test_f1: 0.5828
 epoch: 18, train_loss: 0.8031, test_loss: 0.9639, test_f1: 0.4699
 epoch: 19, train_loss: 0.8107, test_loss: 0.9099, test_f1: 0.5828
 epoch: 20, train_loss: 0.7894, test_loss: 1.0598, test_f1: 0.4952
 epoch: 21, train_loss: 0.8114, test_loss: 0.8169, test_f1: 0.6090
 epoch: 22, train_loss: 0.7901, test_loss: 0.8741, test_f1: 0.6211
 epoch: 23, train_loss: 0.7930, test_loss: 0.8748, test_f1: 0.5872
 epoch: 24, train_loss: 0.7847, test_loss: 0.9273, test_f1: 0.6045
 epoch: 25, train_loss: 0.8079, test_loss: 0.8258, test_f1: 0.6087
 epoch: 26, train_loss: 0.7869, test_loss: 0.7839, test_f1: 0.5955
 epoch: 27, train_loss: 0.7939, test_loss: 0.9218, test_f1: 0.5289
 epoch: 28, train_loss: 0.7733, test_loss: 0.7971, test_f1: 0.6174
 epoch: 29, train_loss: 0.7549, test_loss: 0.9349, test_f1: 0.5921
 epoch: 30, train_loss: 0.7680, test_loss: 0.7813, test_f1: 0.6284
 epoch: 31, train_loss: 0.7880, test_loss: 0.8489, test_f1: 0.6499
 epoch: 32, train_loss: 0.7575, test_loss: 0.8198, test_f1: 0.6319
 epoch: 33, train_loss: 0.7550, test_loss: 0.9036, test_f1: 0.5334
 epoch: 34, train_loss: 0.7588, test_loss: 0.9950, test_f1: 0.5988
 epoch: 35, train_loss: 0.7573, test_loss: 0.9268, test_f1: 0.5441
 epoch: 36, train_loss: 0.7472, test_loss: 0.7931, test_f1: 0.6133
 epoch: 37, train_loss: 0.7464, test_loss: 0.7616, test_f1: 0.6158
 epoch: 38, train_loss: 0.7386, test_loss: 0.9398, test_f1: 0.5713
 epoch: 39, train_loss: 0.7536, test_loss: 0.7509, test_f1: 0.6290
 epoch: 40, train_loss: 0.7389, test_loss: 0.8612, test_f1: 0.5752
 epoch: 41, train_loss: 0.7287, test_loss: 0.8981, test_f1: 0.6245
 epoch: 42, train_loss: 0.7311, test_loss: 0.7589, test_f1: 0.6521
 epoch: 43, train_loss: 0.7365, test_loss: 0.9118, test_f1: 0.5867
 epoch: 44, train_loss: 0.7274, test_loss: 0.7688, test_f1: 0.6457
 epoch: 45, train_loss: 0.7238, test_loss: 0.8057, test_f1: 0.6298
 epoch: 46, train_loss: 0.7289, test_loss: 0.8233, test_f1: 0.6292
 epoch: 47, train_loss: 0.7221, test_loss: 0.9491, test_f1: 0.5815
 epoch: 48, train_loss: 0.7172, test_loss: 0.8635, test_f1: 0.5633
 epoch: 49, train_loss: 0.7023, test_loss: 1.1702, test_f1: 0.5653
 epoch: 50, train_loss: 0.7202, test_loss: 1.0207, test_f1: 0.6303
 epoch: 51, train_loss: 0.7057, test_loss: 0.8792, test_f1: 0.6242
 epoch: 52, train_loss: 0.6759, test_loss: 0.9515, test_f1: 0.6494
 epoch: 53, train_loss: 0.6792, test_loss: 0.9056, test_f1: 0.6246
 epoch: 54, train_loss: 0.6624, test_loss: 0.7494, test_f1: 0.6707
 epoch: 55, train_loss: 0.6656, test_loss: 1.0323, test_f1: 0.6338
 epoch: 56, train_loss: 0.6500, test_loss: 0.8944, test_f1: 0.6403
 epoch: 57, train_loss: 0.6580, test_loss: 0.9567, test_f1: 0.6352
 epoch: 58, train_loss: 0.6466, test_loss: 1.0208, test_f1: 0.6817
 epoch: 59, train_loss: 0.6525, test_loss: 1.0278, test_f1: 0.6647
 epoch: 60, train_loss: 0.6387, test_loss: 0.8937, test_f1: 0.6414
 epoch: 61, train_loss: 0.6648, test_loss: 0.9094, test_f1: 0.6646
 epoch: 62, train_loss: 0.6542, test_loss: 0.7935, test_f1: 0.6499
 epoch: 63, train_loss: 0.6453, test_loss: 0.9307, test_f1: 0.6618
 epoch: 64, train_loss: 0.6516, test_loss: 0.9624, test_f1: 0.6381
 epoch: 65, train_loss: 0.6495, test_loss: 0.9068, test_f1: 0.6401
 epoch: 66, train_loss: 0.6470, test_loss: 0.8919, test_f1: 0.6464
 epoch: 67, train_loss: 0.6471, test_loss: 0.9150, test_f1: 0.6753
 epoch: 68, train_loss: 0.6444, test_loss: 1.1158, test_f1: 0.6555
 epoch: 69, train_loss: 0.6289, test_loss: 0.9877, test_f1: 0.6425
 epoch: 70, train_loss: 0.6453, test_loss: 0.9132, test_f1: 0.6311
 epoch: 71, train_loss: 0.6467, test_loss: 0.9004, test_f1: 0.6609
 epoch: 72, train_loss: 0.6236, test_loss: 0.7572, test_f1: 0.6686
 epoch: 73, train_loss: 0.6323, test_loss: 0.7847, test_f1: 0.6896
 epoch: 74, train_loss: 0.6260, test_loss: 0.9591, test_f1: 0.6600
 epoch: 75, train_loss: 0.6245, test_loss: 1.0151, test_f1: 0.6596
 epoch: 76, train_loss: 0.6248, test_loss: 0.8979, test_f1: 0.6859
 epoch: 77, train_loss: 0.6271, test_loss: 0.7846, test_f1: 0.6641
 epoch: 78, train_loss: 0.6381, test_loss: 0.8886, test_f1: 0.6680
 epoch: 79, train_loss: 0.6332, test_loss: 0.8443, test_f1: 0.6630
 epoch: 80, train_loss: 0.6219, test_loss: 0.8643, test_f1: 0.6773
 epoch: 81, train_loss: 0.6201, test_loss: 0.7429, test_f1: 0.6462
 epoch: 82, train_loss: 0.6191, test_loss: 0.7578, test_f1: 0.6819
 epoch: 83, train_loss: 0.6227, test_loss: 0.9056, test_f1: 0.6814
 epoch: 84, train_loss: 0.6061, test_loss: 0.7825, test_f1: 0.6594
 epoch: 85, train_loss: 0.6157, test_loss: 0.7992, test_f1: 0.6561
 epoch: 86, train_loss: 0.6158, test_loss: 0.9876, test_f1: 0.6686
 epoch: 87, train_loss: 0.6202, test_loss: 0.7470, test_f1: 0.6805
 epoch: 88, train_loss: 0.5933, test_loss: 0.9753, test_f1: 0.6636
 epoch: 89, train_loss: 0.6189, test_loss: 0.9611, test_f1: 0.6584
 epoch: 90, train_loss: 0.6131, test_loss: 0.8244, test_f1: 0.6814
 epoch: 91, train_loss: 0.6083, test_loss: 0.7669, test_f1: 0.7064
 epoch: 92, train_loss: 0.6023, test_loss: 0.9172, test_f1: 0.6207
 epoch: 93, train_loss: 0.6050, test_loss: 0.8977, test_f1: 0.6350
 epoch: 94, train_loss: 0.6100, test_loss: 0.7921, test_f1: 0.6816
 epoch: 95, train_loss: 0.5965, test_loss: 0.8682, test_f1: 0.6834
 epoch: 96, train_loss: 0.6096, test_loss: 0.7943, test_f1: 0.6471
 epoch: 97, train_loss: 0.6175, test_loss: 0.8410, test_f1: 0.6545
 epoch: 98, train_loss: 0.6019, test_loss: 0.8564, test_f1: 0.6518
 epoch: 99, train_loss: 0.6085, test_loss: 0.8901, test_f1: 0.6866
##################ITERATION #7 ****************************************
 epoch: 0, train_loss: 1.0992, test_loss: 1.1437, test_f1: 0.4663
 epoch: 1, train_loss: 1.0096, test_loss: 1.0305, test_f1: 0.4781
 epoch: 2, train_loss: 0.9683, test_loss: 0.9862, test_f1: 0.4894
 epoch: 3, train_loss: 0.9482, test_loss: 0.9800, test_f1: 0.5161
 epoch: 4, train_loss: 0.9310, test_loss: 1.0255, test_f1: 0.5114
 epoch: 5, train_loss: 0.9249, test_loss: 1.0782, test_f1: 0.4935
 epoch: 6, train_loss: 0.9080, test_loss: 0.8945, test_f1: 0.5207
 epoch: 7, train_loss: 0.8920, test_loss: 0.9914, test_f1: 0.5019
 epoch: 8, train_loss: 0.9152, test_loss: 0.9754, test_f1: 0.5497
 epoch: 9, train_loss: 0.8775, test_loss: 0.9327, test_f1: 0.5433
 epoch: 10, train_loss: 0.8535, test_loss: 0.9228, test_f1: 0.5570
 epoch: 11, train_loss: 0.8507, test_loss: 0.8546, test_f1: 0.6151
 epoch: 12, train_loss: 0.8513, test_loss: 0.9671, test_f1: 0.5158
 epoch: 13, train_loss: 0.8410, test_loss: 0.9161, test_f1: 0.6053
 epoch: 14, train_loss: 0.8372, test_loss: 0.8600, test_f1: 0.5794
 epoch: 15, train_loss: 0.8100, test_loss: 0.9275, test_f1: 0.5862
 epoch: 16, train_loss: 0.8107, test_loss: 0.8872, test_f1: 0.5396
 epoch: 17, train_loss: 0.8142, test_loss: 0.8932, test_f1: 0.6100
 epoch: 18, train_loss: 0.8188, test_loss: 0.8671, test_f1: 0.6118
 epoch: 19, train_loss: 0.7986, test_loss: 0.8732, test_f1: 0.5833
 epoch: 20, train_loss: 0.7887, test_loss: 0.9560, test_f1: 0.5332
 epoch: 21, train_loss: 0.7897, test_loss: 0.9214, test_f1: 0.6093
 epoch: 22, train_loss: 0.7992, test_loss: 0.8680, test_f1: 0.6049
 epoch: 23, train_loss: 0.7903, test_loss: 0.8552, test_f1: 0.6179
 epoch: 24, train_loss: 0.7645, test_loss: 0.8842, test_f1: 0.6196
 epoch: 25, train_loss: 0.7811, test_loss: 0.8595, test_f1: 0.6214
 epoch: 26, train_loss: 0.7626, test_loss: 0.8459, test_f1: 0.6236
 epoch: 27, train_loss: 0.7522, test_loss: 0.8250, test_f1: 0.6280
 epoch: 28, train_loss: 0.7710, test_loss: 0.8589, test_f1: 0.6132
 epoch: 29, train_loss: 0.7713, test_loss: 1.1469, test_f1: 0.5169
 epoch: 30, train_loss: 0.7590, test_loss: 0.8846, test_f1: 0.5775
 epoch: 31, train_loss: 0.7482, test_loss: 0.8757, test_f1: 0.6008
 epoch: 32, train_loss: 0.7453, test_loss: 0.8435, test_f1: 0.6429
 epoch: 33, train_loss: 0.7394, test_loss: 0.8793, test_f1: 0.5906
 epoch: 34, train_loss: 0.7478, test_loss: 0.8844, test_f1: 0.6199
 epoch: 35, train_loss: 0.7390, test_loss: 0.9286, test_f1: 0.5910
 epoch: 36, train_loss: 0.7365, test_loss: 0.8696, test_f1: 0.6076
 epoch: 37, train_loss: 0.7283, test_loss: 0.8818, test_f1: 0.6273
 epoch: 38, train_loss: 0.7456, test_loss: 0.8715, test_f1: 0.6281
 epoch: 39, train_loss: 0.7355, test_loss: 0.9151, test_f1: 0.6339
 epoch: 40, train_loss: 0.7149, test_loss: 0.8629, test_f1: 0.6445
 epoch: 41, train_loss: 0.7248, test_loss: 0.8842, test_f1: 0.6113
 epoch: 42, train_loss: 0.7141, test_loss: 0.8659, test_f1: 0.6224
 epoch: 43, train_loss: 0.7286, test_loss: 0.8904, test_f1: 0.6341
 epoch: 44, train_loss: 0.6970, test_loss: 0.7800, test_f1: 0.6622
 epoch: 45, train_loss: 0.7039, test_loss: 0.8607, test_f1: 0.6274
 epoch: 46, train_loss: 0.7010, test_loss: 0.8899, test_f1: 0.6176
 epoch: 47, train_loss: 0.6946, test_loss: 0.8869, test_f1: 0.6166
 epoch: 48, train_loss: 0.7042, test_loss: 0.8846, test_f1: 0.6402
 epoch: 49, train_loss: 0.6994, test_loss: 0.8455, test_f1: 0.6276
 epoch: 50, train_loss: 0.6820, test_loss: 0.9693, test_f1: 0.5871
 epoch: 51, train_loss: 0.6742, test_loss: 0.8731, test_f1: 0.6424
 epoch: 52, train_loss: 0.6406, test_loss: 0.8250, test_f1: 0.6562
 epoch: 53, train_loss: 0.6432, test_loss: 0.8269, test_f1: 0.6604
 epoch: 54, train_loss: 0.6226, test_loss: 0.8187, test_f1: 0.6687
 epoch: 55, train_loss: 0.6486, test_loss: 0.8528, test_f1: 0.6414
 epoch: 56, train_loss: 0.6204, test_loss: 0.8145, test_f1: 0.6651
 epoch: 57, train_loss: 0.6240, test_loss: 0.7997, test_f1: 0.6559
 epoch: 58, train_loss: 0.6210, test_loss: 0.7983, test_f1: 0.6569
 epoch: 59, train_loss: 0.6145, test_loss: 0.8020, test_f1: 0.6712
 epoch: 60, train_loss: 0.6086, test_loss: 0.8638, test_f1: 0.6558
 epoch: 61, train_loss: 0.6296, test_loss: 0.8213, test_f1: 0.6406
 epoch: 62, train_loss: 0.6158, test_loss: 0.8473, test_f1: 0.6480
 epoch: 63, train_loss: 0.6002, test_loss: 0.8658, test_f1: 0.6542
 epoch: 64, train_loss: 0.6050, test_loss: 0.8658, test_f1: 0.6570
 epoch: 65, train_loss: 0.6031, test_loss: 0.8925, test_f1: 0.6413
 epoch: 66, train_loss: 0.5949, test_loss: 0.8716, test_f1: 0.6488
 epoch: 67, train_loss: 0.5961, test_loss: 0.8822, test_f1: 0.6556
 epoch: 68, train_loss: 0.5857, test_loss: 0.8470, test_f1: 0.6695
 epoch: 69, train_loss: 0.5935, test_loss: 0.8854, test_f1: 0.6668
 epoch: 70, train_loss: 0.6037, test_loss: 0.8818, test_f1: 0.6564
 epoch: 71, train_loss: 0.6015, test_loss: 0.9053, test_f1: 0.6377
 epoch: 72, train_loss: 0.5916, test_loss: 0.8700, test_f1: 0.6551
 epoch: 73, train_loss: 0.5797, test_loss: 0.8666, test_f1: 0.6516
 epoch: 74, train_loss: 0.5899, test_loss: 0.8720, test_f1: 0.6455
 epoch: 75, train_loss: 0.5960, test_loss: 0.8522, test_f1: 0.6342
 epoch: 76, train_loss: 0.5882, test_loss: 0.8400, test_f1: 0.6731
 epoch: 77, train_loss: 0.5732, test_loss: 0.8932, test_f1: 0.6609
 epoch: 78, train_loss: 0.5836, test_loss: 0.8710, test_f1: 0.6544
 epoch: 79, train_loss: 0.5957, test_loss: 0.8995, test_f1: 0.6624
 epoch: 80, train_loss: 0.5804, test_loss: 0.8566, test_f1: 0.6645
 epoch: 81, train_loss: 0.5650, test_loss: 0.8771, test_f1: 0.6594
 epoch: 82, train_loss: 0.5739, test_loss: 0.8707, test_f1: 0.6482
 epoch: 83, train_loss: 0.5603, test_loss: 0.8931, test_f1: 0.6571
 epoch: 84, train_loss: 0.5543, test_loss: 0.8916, test_f1: 0.6754
 epoch: 85, train_loss: 0.5612, test_loss: 0.8993, test_f1: 0.6577
 epoch: 86, train_loss: 0.5771, test_loss: 0.8718, test_f1: 0.6459
 epoch: 87, train_loss: 0.5770, test_loss: 0.8975, test_f1: 0.6396
 epoch: 88, train_loss: 0.5691, test_loss: 0.8582, test_f1: 0.6522
 epoch: 89, train_loss: 0.5454, test_loss: 0.8862, test_f1: 0.6638
 epoch: 90, train_loss: 0.5557, test_loss: 0.8789, test_f1: 0.6358
 epoch: 91, train_loss: 0.5627, test_loss: 0.8418, test_f1: 0.6562
 epoch: 92, train_loss: 0.5583, test_loss: 0.8737, test_f1: 0.6553
 epoch: 93, train_loss: 0.5635, test_loss: 0.8485, test_f1: 0.6432
 epoch: 94, train_loss: 0.5500, test_loss: 0.9288, test_f1: 0.6532
 epoch: 95, train_loss: 0.5496, test_loss: 0.8853, test_f1: 0.6612
 epoch: 96, train_loss: 0.5327, test_loss: 0.9434, test_f1: 0.6433
 epoch: 97, train_loss: 0.5522, test_loss: 0.9223, test_f1: 0.6702
 epoch: 98, train_loss: 0.5436, test_loss: 0.9217, test_f1: 0.6557
 epoch: 99, train_loss: 0.5272, test_loss: 0.9358, test_f1: 0.6652
##################ITERATION #8 ****************************************
 epoch: 0, train_loss: 1.1326, test_loss: 1.1210, test_f1: 0.4503
 epoch: 1, train_loss: 1.0146, test_loss: 1.0782, test_f1: 0.4711
 epoch: 2, train_loss: 0.9852, test_loss: 1.0033, test_f1: 0.5173
 epoch: 3, train_loss: 0.9602, test_loss: 0.9327, test_f1: 0.5225
 epoch: 4, train_loss: 0.9343, test_loss: 0.9905, test_f1: 0.5257
 epoch: 5, train_loss: 0.9476, test_loss: 0.9520, test_f1: 0.5105
 epoch: 6, train_loss: 0.9492, test_loss: 1.0848, test_f1: 0.5012
 epoch: 7, train_loss: 0.9256, test_loss: 0.9644, test_f1: 0.5141
 epoch: 8, train_loss: 0.9072, test_loss: 0.9757, test_f1: 0.5289
 epoch: 9, train_loss: 0.8919, test_loss: 1.2254, test_f1: 0.4083
 epoch: 10, train_loss: 0.8888, test_loss: 0.9527, test_f1: 0.5396
 epoch: 11, train_loss: 0.8856, test_loss: 0.9606, test_f1: 0.5393
 epoch: 12, train_loss: 0.8669, test_loss: 0.9050, test_f1: 0.5283
 epoch: 13, train_loss: 0.8586, test_loss: 0.8983, test_f1: 0.5580
 epoch: 14, train_loss: 0.8590, test_loss: 1.0299, test_f1: 0.4871
 epoch: 15, train_loss: 0.8370, test_loss: 0.8745, test_f1: 0.5946
 epoch: 16, train_loss: 0.8430, test_loss: 1.0324, test_f1: 0.4955
 epoch: 17, train_loss: 0.8329, test_loss: 0.9023, test_f1: 0.5375
 epoch: 18, train_loss: 0.8267, test_loss: 0.8827, test_f1: 0.5498
 epoch: 19, train_loss: 0.8203, test_loss: 0.8993, test_f1: 0.5660
 epoch: 20, train_loss: 0.8147, test_loss: 0.9036, test_f1: 0.5865
 epoch: 21, train_loss: 0.8071, test_loss: 0.8420, test_f1: 0.5830
 epoch: 22, train_loss: 0.7850, test_loss: 0.8783, test_f1: 0.5991
 epoch: 23, train_loss: 0.7846, test_loss: 0.8923, test_f1: 0.6089
 epoch: 24, train_loss: 0.7865, test_loss: 0.8500, test_f1: 0.5702
 epoch: 25, train_loss: 0.7867, test_loss: 0.9169, test_f1: 0.5724
 epoch: 26, train_loss: 0.7925, test_loss: 0.8590, test_f1: 0.5817
 epoch: 27, train_loss: 0.7633, test_loss: 0.8149, test_f1: 0.5862
 epoch: 28, train_loss: 0.7746, test_loss: 0.8166, test_f1: 0.6018
 epoch: 29, train_loss: 0.7639, test_loss: 1.0517, test_f1: 0.5406
 epoch: 30, train_loss: 0.7601, test_loss: 0.8097, test_f1: 0.5799
 epoch: 31, train_loss: 0.7389, test_loss: 0.8622, test_f1: 0.5798
 epoch: 32, train_loss: 0.7513, test_loss: 0.8961, test_f1: 0.5677
 epoch: 33, train_loss: 0.7359, test_loss: 0.8945, test_f1: 0.5822
 epoch: 34, train_loss: 0.7511, test_loss: 0.8684, test_f1: 0.5932
 epoch: 35, train_loss: 0.7447, test_loss: 0.8280, test_f1: 0.6107
 epoch: 36, train_loss: 0.7530, test_loss: 0.8189, test_f1: 0.6059
 epoch: 37, train_loss: 0.7277, test_loss: 0.9039, test_f1: 0.5772
 epoch: 38, train_loss: 0.7134, test_loss: 0.9520, test_f1: 0.5923
 epoch: 39, train_loss: 0.7319, test_loss: 1.0205, test_f1: 0.5856
 epoch: 40, train_loss: 0.7108, test_loss: 0.9329, test_f1: 0.6174
 epoch: 41, train_loss: 0.7346, test_loss: 0.8407, test_f1: 0.6317
 epoch: 42, train_loss: 0.7368, test_loss: 0.8207, test_f1: 0.6336
 epoch: 43, train_loss: 0.6981, test_loss: 0.8514, test_f1: 0.6129
 epoch: 44, train_loss: 0.7244, test_loss: 0.7825, test_f1: 0.6087
 epoch: 45, train_loss: 0.7061, test_loss: 0.8559, test_f1: 0.5872
 epoch: 46, train_loss: 0.7130, test_loss: 1.2150, test_f1: 0.4999
 epoch: 47, train_loss: 0.7315, test_loss: 0.8316, test_f1: 0.5925
 epoch: 48, train_loss: 0.7087, test_loss: 0.9579, test_f1: 0.5957
 epoch: 49, train_loss: 0.7185, test_loss: 0.9299, test_f1: 0.6159
 epoch: 50, train_loss: 0.6878, test_loss: 0.8941, test_f1: 0.6339
 epoch: 51, train_loss: 0.6607, test_loss: 0.8795, test_f1: 0.6411
 epoch: 52, train_loss: 0.6589, test_loss: 0.9472, test_f1: 0.6131
 epoch: 53, train_loss: 0.6489, test_loss: 0.9264, test_f1: 0.6505
 epoch: 54, train_loss: 0.6428, test_loss: 0.9344, test_f1: 0.6300
 epoch: 55, train_loss: 0.6223, test_loss: 0.9250, test_f1: 0.6489
 epoch: 56, train_loss: 0.6205, test_loss: 0.8880, test_f1: 0.6487
 epoch: 57, train_loss: 0.6169, test_loss: 0.9240, test_f1: 0.6039
 epoch: 58, train_loss: 0.6472, test_loss: 0.9897, test_f1: 0.5855
 epoch: 59, train_loss: 0.6351, test_loss: 0.9421, test_f1: 0.6263
 epoch: 60, train_loss: 0.6138, test_loss: 0.8790, test_f1: 0.6239
 epoch: 61, train_loss: 0.6239, test_loss: 1.0072, test_f1: 0.6218
 epoch: 62, train_loss: 0.6275, test_loss: 0.8721, test_f1: 0.6328
 epoch: 63, train_loss: 0.6141, test_loss: 0.9572, test_f1: 0.6360
 epoch: 64, train_loss: 0.6186, test_loss: 0.9702, test_f1: 0.6390
 epoch: 65, train_loss: 0.6143, test_loss: 0.9528, test_f1: 0.6306
 epoch: 66, train_loss: 0.6044, test_loss: 0.9004, test_f1: 0.6295
 epoch: 67, train_loss: 0.6175, test_loss: 0.9875, test_f1: 0.6167
 epoch: 68, train_loss: 0.5993, test_loss: 0.8976, test_f1: 0.6317
 epoch: 69, train_loss: 0.5966, test_loss: 0.9456, test_f1: 0.6190
 epoch: 70, train_loss: 0.5854, test_loss: 0.9726, test_f1: 0.6262
 epoch: 71, train_loss: 0.6172, test_loss: 0.9452, test_f1: 0.6376
 epoch: 72, train_loss: 0.5960, test_loss: 1.0016, test_f1: 0.6092
 epoch: 73, train_loss: 0.5808, test_loss: 1.0521, test_f1: 0.6278
 epoch: 74, train_loss: 0.5780, test_loss: 0.9629, test_f1: 0.6454
 epoch: 75, train_loss: 0.5976, test_loss: 0.9166, test_f1: 0.6628
 epoch: 76, train_loss: 0.5876, test_loss: 0.9754, test_f1: 0.6507
 epoch: 77, train_loss: 0.5960, test_loss: 0.9799, test_f1: 0.6354
 epoch: 78, train_loss: 0.5920, test_loss: 1.0608, test_f1: 0.5807
 epoch: 79, train_loss: 0.5891, test_loss: 0.9830, test_f1: 0.6424
 epoch: 80, train_loss: 0.5842, test_loss: 0.8770, test_f1: 0.6559
 epoch: 81, train_loss: 0.5879, test_loss: 1.0541, test_f1: 0.5867
 epoch: 82, train_loss: 0.5749, test_loss: 0.9832, test_f1: 0.6185
 epoch: 83, train_loss: 0.5848, test_loss: 1.0503, test_f1: 0.6519
 epoch: 84, train_loss: 0.5649, test_loss: 0.9171, test_f1: 0.6292
 epoch: 85, train_loss: 0.5964, test_loss: 0.9189, test_f1: 0.6337
 epoch: 86, train_loss: 0.5718, test_loss: 0.9482, test_f1: 0.6500
 epoch: 87, train_loss: 0.5573, test_loss: 0.9004, test_f1: 0.6597
 epoch: 88, train_loss: 0.5733, test_loss: 0.8805, test_f1: 0.6415
 epoch: 89, train_loss: 0.5718, test_loss: 0.9714, test_f1: 0.6657
 epoch: 90, train_loss: 0.5726, test_loss: 0.9224, test_f1: 0.6470
 epoch: 91, train_loss: 0.5752, test_loss: 0.8849, test_f1: 0.6400
 epoch: 92, train_loss: 0.5693, test_loss: 0.9445, test_f1: 0.6626
 epoch: 93, train_loss: 0.5530, test_loss: 0.9703, test_f1: 0.6724
 epoch: 94, train_loss: 0.5687, test_loss: 0.8792, test_f1: 0.6668
 epoch: 95, train_loss: 0.5494, test_loss: 1.0261, test_f1: 0.6107
 epoch: 96, train_loss: 0.5545, test_loss: 1.0006, test_f1: 0.6550
 epoch: 97, train_loss: 0.5447, test_loss: 1.0576, test_f1: 0.6550
 epoch: 98, train_loss: 0.5434, test_loss: 1.0426, test_f1: 0.6309
 epoch: 99, train_loss: 0.5497, test_loss: 1.0660, test_f1: 0.6639
##################ITERATION #9 ****************************************
 epoch: 0, train_loss: 1.0904, test_loss: 1.0712, test_f1: 0.4429
 epoch: 1, train_loss: 0.9651, test_loss: 0.9548, test_f1: 0.4704
 epoch: 2, train_loss: 0.9531, test_loss: 0.9780, test_f1: 0.4876
 epoch: 3, train_loss: 0.9466, test_loss: 0.9714, test_f1: 0.5087
 epoch: 4, train_loss: 0.9169, test_loss: 0.9336, test_f1: 0.5581
 epoch: 5, train_loss: 0.8981, test_loss: 0.9256, test_f1: 0.5655
 epoch: 6, train_loss: 0.9006, test_loss: 0.9457, test_f1: 0.5217
 epoch: 7, train_loss: 0.8873, test_loss: 0.9433, test_f1: 0.5541
 epoch: 8, train_loss: 0.8732, test_loss: 1.1320, test_f1: 0.4103
 epoch: 9, train_loss: 0.8624, test_loss: 0.9046, test_f1: 0.5179
 epoch: 10, train_loss: 0.8470, test_loss: 0.8661, test_f1: 0.5551
 epoch: 11, train_loss: 0.8460, test_loss: 0.9082, test_f1: 0.5765
 epoch: 12, train_loss: 0.8489, test_loss: 0.8804, test_f1: 0.5398
 epoch: 13, train_loss: 0.8449, test_loss: 0.9043, test_f1: 0.5675
 epoch: 14, train_loss: 0.8241, test_loss: 0.8838, test_f1: 0.5857
 epoch: 15, train_loss: 0.8394, test_loss: 1.0363, test_f1: 0.5279
 epoch: 16, train_loss: 0.8236, test_loss: 0.7948, test_f1: 0.6366
 epoch: 17, train_loss: 0.8220, test_loss: 0.8984, test_f1: 0.5455
 epoch: 18, train_loss: 0.8232, test_loss: 0.9543, test_f1: 0.5368
 epoch: 19, train_loss: 0.8061, test_loss: 0.9681, test_f1: 0.5758
 epoch: 20, train_loss: 0.7990, test_loss: 0.8998, test_f1: 0.5742
 epoch: 21, train_loss: 0.7955, test_loss: 1.0117, test_f1: 0.5385
 epoch: 22, train_loss: 0.8019, test_loss: 0.9575, test_f1: 0.5589
 epoch: 23, train_loss: 0.7969, test_loss: 0.8756, test_f1: 0.6047
 epoch: 24, train_loss: 0.7908, test_loss: 0.9351, test_f1: 0.6161
 epoch: 25, train_loss: 0.7837, test_loss: 0.7960, test_f1: 0.6402
 epoch: 26, train_loss: 0.7894, test_loss: 0.8440, test_f1: 0.5912
 epoch: 27, train_loss: 0.7801, test_loss: 0.9197, test_f1: 0.6068
 epoch: 28, train_loss: 0.7835, test_loss: 0.8592, test_f1: 0.5963
 epoch: 29, train_loss: 0.7680, test_loss: 0.9972, test_f1: 0.6014
 epoch: 30, train_loss: 0.7715, test_loss: 0.8910, test_f1: 0.6126
 epoch: 31, train_loss: 0.7641, test_loss: 0.8516, test_f1: 0.6225
 epoch: 32, train_loss: 0.7599, test_loss: 0.8883, test_f1: 0.6254
 epoch: 33, train_loss: 0.7709, test_loss: 0.9428, test_f1: 0.5807
 epoch: 34, train_loss: 0.7448, test_loss: 0.8373, test_f1: 0.6047
 epoch: 35, train_loss: 0.7287, test_loss: 0.8280, test_f1: 0.6316
 epoch: 36, train_loss: 0.7347, test_loss: 0.8551, test_f1: 0.6041
 epoch: 37, train_loss: 0.7622, test_loss: 0.8087, test_f1: 0.6379
 epoch: 38, train_loss: 0.7250, test_loss: 0.8575, test_f1: 0.6146
 epoch: 39, train_loss: 0.7150, test_loss: 0.8475, test_f1: 0.6028
 epoch: 40, train_loss: 0.7370, test_loss: 0.8431, test_f1: 0.5949
 epoch: 41, train_loss: 0.7335, test_loss: 0.7453, test_f1: 0.6561
 epoch: 42, train_loss: 0.7188, test_loss: 0.9172, test_f1: 0.6488
 epoch: 43, train_loss: 0.6957, test_loss: 0.9454, test_f1: 0.6664
 epoch: 44, train_loss: 0.7258, test_loss: 0.7754, test_f1: 0.6396
 epoch: 45, train_loss: 0.7226, test_loss: 0.8061, test_f1: 0.6639
 epoch: 46, train_loss: 0.7129, test_loss: 0.7951, test_f1: 0.6331
 epoch: 47, train_loss: 0.6973, test_loss: 0.7906, test_f1: 0.6507
 epoch: 48, train_loss: 0.6788, test_loss: 0.9870, test_f1: 0.6206
 epoch: 49, train_loss: 0.7236, test_loss: 0.9009, test_f1: 0.6609
 epoch: 50, train_loss: 0.6919, test_loss: 0.9284, test_f1: 0.6244
 epoch: 51, train_loss: 0.6748, test_loss: 0.8877, test_f1: 0.6749
 epoch: 52, train_loss: 0.6522, test_loss: 0.9545, test_f1: 0.6656
 epoch: 53, train_loss: 0.6349, test_loss: 0.8247, test_f1: 0.6515
 epoch: 54, train_loss: 0.6530, test_loss: 0.8186, test_f1: 0.6567
 epoch: 55, train_loss: 0.6394, test_loss: 0.9431, test_f1: 0.6429
 epoch: 56, train_loss: 0.6299, test_loss: 0.9108, test_f1: 0.6669
 epoch: 57, train_loss: 0.6184, test_loss: 0.8335, test_f1: 0.6459
 epoch: 58, train_loss: 0.6247, test_loss: 0.8803, test_f1: 0.6458
 epoch: 59, train_loss: 0.6244, test_loss: 0.8957, test_f1: 0.6633
 epoch: 60, train_loss: 0.6323, test_loss: 0.9078, test_f1: 0.6295
 epoch: 61, train_loss: 0.6378, test_loss: 0.9643, test_f1: 0.6844
 epoch: 62, train_loss: 0.6148, test_loss: 0.9347, test_f1: 0.6713
 epoch: 63, train_loss: 0.6180, test_loss: 0.8874, test_f1: 0.6505
 epoch: 64, train_loss: 0.6142, test_loss: 0.9905, test_f1: 0.6245
 epoch: 65, train_loss: 0.6027, test_loss: 0.8879, test_f1: 0.6614
 epoch: 66, train_loss: 0.6137, test_loss: 0.9316, test_f1: 0.6590
 epoch: 67, train_loss: 0.6039, test_loss: 0.9326, test_f1: 0.6508
 epoch: 68, train_loss: 0.5853, test_loss: 0.9086, test_f1: 0.6586
 epoch: 69, train_loss: 0.5964, test_loss: 0.9729, test_f1: 0.6509
 epoch: 70, train_loss: 0.6004, test_loss: 0.9883, test_f1: 0.6583
 epoch: 71, train_loss: 0.5886, test_loss: 0.9761, test_f1: 0.6639
 epoch: 72, train_loss: 0.5964, test_loss: 0.9417, test_f1: 0.7042
 epoch: 73, train_loss: 0.6002, test_loss: 1.0747, test_f1: 0.6529
 epoch: 74, train_loss: 0.5892, test_loss: 1.0592, test_f1: 0.6652
 epoch: 75, train_loss: 0.5797, test_loss: 0.9776, test_f1: 0.6545
 epoch: 76, train_loss: 0.5873, test_loss: 0.9866, test_f1: 0.6561
 epoch: 77, train_loss: 0.5712, test_loss: 1.0534, test_f1: 0.6363
 epoch: 78, train_loss: 0.5770, test_loss: 1.0349, test_f1: 0.6709
 epoch: 79, train_loss: 0.5629, test_loss: 1.0880, test_f1: 0.6674
 epoch: 80, train_loss: 0.5757, test_loss: 0.9478, test_f1: 0.6756
 epoch: 81, train_loss: 0.5351, test_loss: 0.9731, test_f1: 0.6758
 epoch: 82, train_loss: 0.5575, test_loss: 1.0588, test_f1: 0.6796
 epoch: 83, train_loss: 0.5558, test_loss: 0.9866, test_f1: 0.6785
 epoch: 84, train_loss: 0.5649, test_loss: 1.1562, test_f1: 0.6565
 epoch: 85, train_loss: 0.5734, test_loss: 1.0943, test_f1: 0.6630
 epoch: 86, train_loss: 0.5562, test_loss: 1.0202, test_f1: 0.6659
 epoch: 87, train_loss: 0.5656, test_loss: 0.9878, test_f1: 0.6714
 epoch: 88, train_loss: 0.5590, test_loss: 1.0351, test_f1: 0.6456
 epoch: 89, train_loss: 0.5369, test_loss: 1.1055, test_f1: 0.6633
 epoch: 90, train_loss: 0.5475, test_loss: 1.0861, test_f1: 0.6565
 epoch: 91, train_loss: 0.5600, test_loss: 0.9804, test_f1: 0.6571
 epoch: 92, train_loss: 0.5589, test_loss: 1.0958, test_f1: 0.6742
 epoch: 93, train_loss: 0.5378, test_loss: 1.0171, test_f1: 0.6609
 epoch: 94, train_loss: 0.5310, test_loss: 1.0538, test_f1: 0.6687
 epoch: 95, train_loss: 0.5257, test_loss: 1.0523, test_f1: 0.6514
 epoch: 96, train_loss: 0.5446, test_loss: 1.0401, test_f1: 0.6366
 epoch: 97, train_loss: 0.5374, test_loss: 0.9655, test_f1: 0.6739
 epoch: 98, train_loss: 0.5414, test_loss: 1.1055, test_f1: 0.6676
 epoch: 99, train_loss: 0.5094, test_loss: 1.0352, test_f1: 0.6762

Training completed in 642.16 seconds
Best F1: 0.7064 at epoch 91
Mean F1 across iterations: 0.6923  0.0120
========================FINAL RESULTS================================
FEGIN weighted F1: 0.7064  0.0120
python main.py --data ltspice_examples --representation component_pin_net --model FEGIN --layers 3 --hiddens 32 --batch_size 64 --lr 0.01 --emb_size 512 --epochs 100 --save_appendix component_pin_net_L3_H32_BS64_LR0.01_E512 --no_val
-----



STDERR:
  File "main.py", line 370, in <module>
    main()
  File "main.py", line 254, in main
    dataset = dataset_class(
  File "/home/philip/projects/ltspice_examples_code_repo/Circuit-Completion-Using-GNNs/component_classification_with_link_prediction_head/evaluation/FEGIN/kernel/circuit_datasets.py", line 15, in __init__
    self.data, self.slices = torch.load(self.processed_paths[0])
  File "/home/philip/.local/lib/python3.8/site-packages/torch/serialization.py", line 1040, in load
    warnings.warn(
  File "/usr/lib/python3.8/warnings.py", line 109, in _showwarnmsg
    sw(msg.message, msg.category, msg.filename, msg.lineno,
  File "main.py", line 47, in warn_with_traceback
    traceback.print_stack(file=log)
/home/philip/projects/ltspice_examples_code_repo/Circuit-Completion-Using-GNNs/component_classification_with_link_prediction_head/evaluation/FEGIN/kernel/circuit_datasets.py:15: FutureWarning: You are using `torch.load` with `weights_only=False` (the current default value), which uses the default pickle module implicitly. It is possible to construct malicious pickle data which will execute arbitrary code during unpickling (See https://github.com/pytorch/pytorch/blob/main/SECURITY.md#untrusted-models for more details). In a future release, the default value for `weights_only` will be flipped to `True`. This limits the functions that could be executed during unpickling. Arbitrary objects will no longer be allowed to be loaded via this mode unless they are explicitly allowlisted by the user via `torch.serialization.add_safe_globals`. We recommend you start setting `weights_only=True` for any use case where you don't have full control of the loaded file. Please open an issue on GitHub for any issues related to this experimental feature.
  self.data, self.slices = torch.load(self.processed_paths[0])
