STDOUT:
Results will be saved in /home/philip/projects/ltspice_examples_code_repo/Circuit-Completion-Using-GNNs/component_classification_with_link_prediction_head/evaluation/FEGIN/results/model_FEGIN_dataset_ltspice_demos
Command line input: python main.py --data ltspice_demos --representation component_net --model FEGIN --layers 5 --hiddens 128 --batch_size 64 --lr 0.001 --emb_size 250 --epochs 100 --save_appendix component_net_L5_H128_BS64_LR0.001_E250 --no_val
 is saved.
-----
ltspice_demos - FEGIN
Using 5 layers, 128 hidden units, h = 2
Loading component_net representation dataset
ENTERED
Training FEGIN on component_net representation
Train: 1565, Test: 383
##################ITERATION #0 ****************************************
 epoch: 0, train_loss: 1.2162, test_loss: 1.3001, test_f1: 0.2281
 epoch: 1, train_loss: 1.1008, test_loss: 1.1534, test_f1: 0.4211
 epoch: 2, train_loss: 1.0228, test_loss: 1.1198, test_f1: 0.5299
 epoch: 3, train_loss: 0.9646, test_loss: 1.1340, test_f1: 0.5370
 epoch: 4, train_loss: 0.9140, test_loss: 1.0969, test_f1: 0.5738
 epoch: 5, train_loss: 0.8990, test_loss: 1.0848, test_f1: 0.5724
 epoch: 6, train_loss: 0.8700, test_loss: 1.1333, test_f1: 0.5799
 epoch: 7, train_loss: 0.8714, test_loss: 1.0934, test_f1: 0.5489
 epoch: 8, train_loss: 0.8507, test_loss: 1.0199, test_f1: 0.5896
 epoch: 9, train_loss: 0.8152, test_loss: 1.1273, test_f1: 0.5759
 epoch: 10, train_loss: 0.7881, test_loss: 1.1570, test_f1: 0.5926
 epoch: 11, train_loss: 0.7965, test_loss: 1.3037, test_f1: 0.5583
 epoch: 12, train_loss: 0.7768, test_loss: 1.1970, test_f1: 0.5600
 epoch: 13, train_loss: 0.7518, test_loss: 1.3015, test_f1: 0.5635
 epoch: 14, train_loss: 0.7378, test_loss: 1.3936, test_f1: 0.5278
 epoch: 15, train_loss: 0.7256, test_loss: 1.3661, test_f1: 0.5794
 epoch: 16, train_loss: 0.6954, test_loss: 1.2929, test_f1: 0.6085
 epoch: 17, train_loss: 0.6689, test_loss: 1.3580, test_f1: 0.5675
 epoch: 18, train_loss: 0.6734, test_loss: 1.3580, test_f1: 0.6058
 epoch: 19, train_loss: 0.6968, test_loss: 1.3277, test_f1: 0.5820
 epoch: 20, train_loss: 0.6551, test_loss: 1.5798, test_f1: 0.5814
 epoch: 21, train_loss: 0.6285, test_loss: 1.4120, test_f1: 0.5993
 epoch: 22, train_loss: 0.6329, test_loss: 1.5344, test_f1: 0.5609
 epoch: 23, train_loss: 0.6285, test_loss: 1.5874, test_f1: 0.5663
 epoch: 24, train_loss: 0.5834, test_loss: 1.5964, test_f1: 0.5989
 epoch: 25, train_loss: 0.5570, test_loss: 1.6497, test_f1: 0.6120
 epoch: 26, train_loss: 0.5449, test_loss: 1.6212, test_f1: 0.5755
 epoch: 27, train_loss: 0.5806, test_loss: 1.8471, test_f1: 0.5331
 epoch: 28, train_loss: 0.5355, test_loss: 1.6388, test_f1: 0.5826
 epoch: 29, train_loss: 0.5330, test_loss: 1.6626, test_f1: 0.5995
 epoch: 30, train_loss: 0.5392, test_loss: 1.6676, test_f1: 0.5574
 epoch: 31, train_loss: 0.5029, test_loss: 1.8037, test_f1: 0.5974
 epoch: 32, train_loss: 0.4804, test_loss: 1.5271, test_f1: 0.6091
 epoch: 33, train_loss: 0.4577, test_loss: 1.8133, test_f1: 0.6046
 epoch: 34, train_loss: 0.4860, test_loss: 1.8949, test_f1: 0.5496
 epoch: 35, train_loss: 0.4800, test_loss: 1.9063, test_f1: 0.5848
 epoch: 36, train_loss: 0.4653, test_loss: 2.0116, test_f1: 0.5539
 epoch: 37, train_loss: 0.4328, test_loss: 1.9604, test_f1: 0.6153
 epoch: 38, train_loss: 0.4361, test_loss: 1.7714, test_f1: 0.6065
 epoch: 39, train_loss: 0.4307, test_loss: 2.0681, test_f1: 0.5717
 epoch: 40, train_loss: 0.4016, test_loss: 2.1744, test_f1: 0.6094
 epoch: 41, train_loss: 0.3829, test_loss: 2.7151, test_f1: 0.5539
 epoch: 42, train_loss: 0.4091, test_loss: 1.9370, test_f1: 0.5963
 epoch: 43, train_loss: 0.3999, test_loss: 2.1602, test_f1: 0.5981
 epoch: 44, train_loss: 0.3689, test_loss: 1.9528, test_f1: 0.6070
 epoch: 45, train_loss: 0.4441, test_loss: 2.4024, test_f1: 0.5772
 epoch: 46, train_loss: 0.4118, test_loss: 2.3600, test_f1: 0.5861
 epoch: 47, train_loss: 0.3609, test_loss: 2.3429, test_f1: 0.5865
 epoch: 48, train_loss: 0.3527, test_loss: 2.5243, test_f1: 0.5717
 epoch: 49, train_loss: 0.3455, test_loss: 2.2528, test_f1: 0.5954
 epoch: 50, train_loss: 0.3210, test_loss: 2.5106, test_f1: 0.5848
 epoch: 51, train_loss: 0.2884, test_loss: 2.6340, test_f1: 0.5985
 epoch: 52, train_loss: 0.2809, test_loss: 2.5568, test_f1: 0.6065
 epoch: 53, train_loss: 0.2582, test_loss: 2.8998, test_f1: 0.5995
 epoch: 54, train_loss: 0.2647, test_loss: 2.6316, test_f1: 0.5898
 epoch: 55, train_loss: 0.2543, test_loss: 2.5544, test_f1: 0.6137
 epoch: 56, train_loss: 0.2298, test_loss: 2.7458, test_f1: 0.6196
 epoch: 57, train_loss: 0.2390, test_loss: 2.8497, test_f1: 0.5915
 epoch: 58, train_loss: 0.2411, test_loss: 2.8435, test_f1: 0.6287
 epoch: 59, train_loss: 0.2281, test_loss: 2.9161, test_f1: 0.6131
 epoch: 60, train_loss: 0.2031, test_loss: 2.9625, test_f1: 0.6035
 epoch: 61, train_loss: 0.2089, test_loss: 3.1174, test_f1: 0.6033
 epoch: 62, train_loss: 0.2018, test_loss: 3.1334, test_f1: 0.5883
 epoch: 63, train_loss: 0.2033, test_loss: 3.1623, test_f1: 0.6054
 epoch: 64, train_loss: 0.1999, test_loss: 2.9761, test_f1: 0.6079
 epoch: 65, train_loss: 0.1979, test_loss: 3.0000, test_f1: 0.5851
 epoch: 66, train_loss: 0.2266, test_loss: 3.0161, test_f1: 0.6215
 epoch: 67, train_loss: 0.2141, test_loss: 3.0646, test_f1: 0.5905
 epoch: 68, train_loss: 0.1838, test_loss: 3.3258, test_f1: 0.5964
 epoch: 69, train_loss: 0.2091, test_loss: 3.2093, test_f1: 0.6011
 epoch: 70, train_loss: 0.1758, test_loss: 3.3328, test_f1: 0.5979
 epoch: 71, train_loss: 0.1868, test_loss: 3.5574, test_f1: 0.5872
 epoch: 72, train_loss: 0.1695, test_loss: 3.5983, test_f1: 0.6020
 epoch: 73, train_loss: 0.1642, test_loss: 3.4611, test_f1: 0.5817
 epoch: 74, train_loss: 0.1588, test_loss: 3.3092, test_f1: 0.5802
 epoch: 75, train_loss: 0.1681, test_loss: 3.5187, test_f1: 0.6177
 epoch: 76, train_loss: 0.1644, test_loss: 3.8657, test_f1: 0.5770
 epoch: 77, train_loss: 0.1613, test_loss: 3.8452, test_f1: 0.5562
 epoch: 78, train_loss: 0.2026, test_loss: 3.5543, test_f1: 0.5541
 epoch: 79, train_loss: 0.1632, test_loss: 3.7130, test_f1: 0.5928
 epoch: 80, train_loss: 0.1813, test_loss: 3.7094, test_f1: 0.5846
 epoch: 81, train_loss: 0.1871, test_loss: 3.8841, test_f1: 0.5686
 epoch: 82, train_loss: 0.1761, test_loss: 3.8784, test_f1: 0.6091
 epoch: 83, train_loss: 0.1666, test_loss: 3.9342, test_f1: 0.5564
 epoch: 84, train_loss: 0.1835, test_loss: 3.8625, test_f1: 0.5617
 epoch: 85, train_loss: 0.1630, test_loss: 3.8871, test_f1: 0.6114
 epoch: 86, train_loss: 0.1537, test_loss: 3.9042, test_f1: 0.6125
 epoch: 87, train_loss: 0.1346, test_loss: 4.2020, test_f1: 0.5989
 epoch: 88, train_loss: 0.1296, test_loss: 4.2261, test_f1: 0.6149
 epoch: 89, train_loss: 0.1255, test_loss: 4.2895, test_f1: 0.5809
 epoch: 90, train_loss: 0.1317, test_loss: 4.3783, test_f1: 0.5917
 epoch: 91, train_loss: 0.1403, test_loss: 4.3056, test_f1: 0.5758
 epoch: 92, train_loss: 0.1481, test_loss: 3.8985, test_f1: 0.6099
 epoch: 93, train_loss: 0.1555, test_loss: 4.0188, test_f1: 0.5920
 epoch: 94, train_loss: 0.1445, test_loss: 4.2667, test_f1: 0.6049
 epoch: 95, train_loss: 0.1384, test_loss: 4.0617, test_f1: 0.5853
 epoch: 96, train_loss: 0.1273, test_loss: 4.1677, test_f1: 0.5891
 epoch: 97, train_loss: 0.1219, test_loss: 4.3978, test_f1: 0.5690
 epoch: 98, train_loss: 0.1494, test_loss: 4.1312, test_f1: 0.5737
 epoch: 99, train_loss: 0.1417, test_loss: 4.2798, test_f1: 0.5490
##################ITERATION #1 ****************************************
 epoch: 0, train_loss: 1.1521, test_loss: 1.2534, test_f1: 0.3107
 epoch: 1, train_loss: 1.0110, test_loss: 1.1126, test_f1: 0.4873
 epoch: 2, train_loss: 0.9729, test_loss: 1.0900, test_f1: 0.5162
 epoch: 3, train_loss: 0.9256, test_loss: 1.0267, test_f1: 0.5356
 epoch: 4, train_loss: 0.8961, test_loss: 1.0564, test_f1: 0.5312
 epoch: 5, train_loss: 0.8803, test_loss: 1.0580, test_f1: 0.5800
 epoch: 6, train_loss: 0.8488, test_loss: 1.0958, test_f1: 0.5862
 epoch: 7, train_loss: 0.8301, test_loss: 1.1230, test_f1: 0.5601
 epoch: 8, train_loss: 0.8229, test_loss: 1.0720, test_f1: 0.5800
 epoch: 9, train_loss: 0.8084, test_loss: 1.2849, test_f1: 0.5691
 epoch: 10, train_loss: 0.7903, test_loss: 1.3605, test_f1: 0.5230
 epoch: 11, train_loss: 0.7812, test_loss: 1.2001, test_f1: 0.5650
 epoch: 12, train_loss: 0.7505, test_loss: 1.2268, test_f1: 0.5636
 epoch: 13, train_loss: 0.7392, test_loss: 1.3266, test_f1: 0.5119
 epoch: 14, train_loss: 0.7404, test_loss: 1.1968, test_f1: 0.5915
 epoch: 15, train_loss: 0.6754, test_loss: 1.2964, test_f1: 0.5574
 epoch: 16, train_loss: 0.6953, test_loss: 1.2685, test_f1: 0.6145
 epoch: 17, train_loss: 0.7078, test_loss: 1.3904, test_f1: 0.5693
 epoch: 18, train_loss: 0.6624, test_loss: 1.2801, test_f1: 0.6093
 epoch: 19, train_loss: 0.6520, test_loss: 1.2276, test_f1: 0.5902
 epoch: 20, train_loss: 0.6476, test_loss: 1.4754, test_f1: 0.5244
 epoch: 21, train_loss: 0.6452, test_loss: 1.6241, test_f1: 0.5537
 epoch: 22, train_loss: 0.6557, test_loss: 1.2116, test_f1: 0.6089
 epoch: 23, train_loss: 0.6205, test_loss: 1.4424, test_f1: 0.6142
 epoch: 24, train_loss: 0.5798, test_loss: 1.3135, test_f1: 0.6314
 epoch: 25, train_loss: 0.5988, test_loss: 1.4597, test_f1: 0.5357
 epoch: 26, train_loss: 0.5814, test_loss: 1.5941, test_f1: 0.5659
 epoch: 27, train_loss: 0.5341, test_loss: 1.5935, test_f1: 0.6203
 epoch: 28, train_loss: 0.5133, test_loss: 1.5873, test_f1: 0.6070
 epoch: 29, train_loss: 0.4763, test_loss: 1.9013, test_f1: 0.5944
 epoch: 30, train_loss: 0.4743, test_loss: 1.6910, test_f1: 0.6145
 epoch: 31, train_loss: 0.4878, test_loss: 1.8877, test_f1: 0.5967
 epoch: 32, train_loss: 0.4963, test_loss: 1.8588, test_f1: 0.5238
 epoch: 33, train_loss: 0.5081, test_loss: 1.7496, test_f1: 0.5545
 epoch: 34, train_loss: 0.4696, test_loss: 1.8153, test_f1: 0.5848
 epoch: 35, train_loss: 0.4600, test_loss: 1.7025, test_f1: 0.5985
 epoch: 36, train_loss: 0.4243, test_loss: 1.8630, test_f1: 0.6003
 epoch: 37, train_loss: 0.4437, test_loss: 1.9630, test_f1: 0.5610
 epoch: 38, train_loss: 0.4227, test_loss: 2.1020, test_f1: 0.5499
 epoch: 39, train_loss: 0.3684, test_loss: 1.8930, test_f1: 0.5772
 epoch: 40, train_loss: 0.4423, test_loss: 1.9509, test_f1: 0.6131
 epoch: 41, train_loss: 0.4557, test_loss: 1.8775, test_f1: 0.5939
 epoch: 42, train_loss: 0.4049, test_loss: 1.8353, test_f1: 0.5698
 epoch: 43, train_loss: 0.3637, test_loss: 1.8699, test_f1: 0.6194
 epoch: 44, train_loss: 0.3750, test_loss: 2.0686, test_f1: 0.5708
 epoch: 45, train_loss: 0.3591, test_loss: 2.0925, test_f1: 0.5589
 epoch: 46, train_loss: 0.3437, test_loss: 1.8476, test_f1: 0.6139
 epoch: 47, train_loss: 0.3784, test_loss: 2.2943, test_f1: 0.6114
 epoch: 48, train_loss: 0.3579, test_loss: 2.1098, test_f1: 0.6025
 epoch: 49, train_loss: 0.3363, test_loss: 2.2355, test_f1: 0.5849
 epoch: 50, train_loss: 0.3193, test_loss: 2.1427, test_f1: 0.5956
 epoch: 51, train_loss: 0.3326, test_loss: 2.0116, test_f1: 0.6168
 epoch: 52, train_loss: 0.3014, test_loss: 2.2600, test_f1: 0.6073
 epoch: 53, train_loss: 0.2536, test_loss: 2.4347, test_f1: 0.6074
 epoch: 54, train_loss: 0.2356, test_loss: 2.2407, test_f1: 0.6146
 epoch: 55, train_loss: 0.2254, test_loss: 2.6352, test_f1: 0.5823
 epoch: 56, train_loss: 0.2361, test_loss: 2.5073, test_f1: 0.6202
 epoch: 57, train_loss: 0.2447, test_loss: 2.5403, test_f1: 0.6325
 epoch: 58, train_loss: 0.2381, test_loss: 2.5333, test_f1: 0.5970
 epoch: 59, train_loss: 0.2152, test_loss: 2.6331, test_f1: 0.6103
 epoch: 60, train_loss: 0.2045, test_loss: 3.1995, test_f1: 0.6070
 epoch: 61, train_loss: 0.2006, test_loss: 3.2272, test_f1: 0.5756
 epoch: 62, train_loss: 0.2050, test_loss: 2.9283, test_f1: 0.6283
 epoch: 63, train_loss: 0.2124, test_loss: 3.1089, test_f1: 0.5755
 epoch: 64, train_loss: 0.2131, test_loss: 2.7684, test_f1: 0.5915
 epoch: 65, train_loss: 0.2059, test_loss: 3.0857, test_f1: 0.5933
 epoch: 66, train_loss: 0.1913, test_loss: 2.8791, test_f1: 0.6384
 epoch: 67, train_loss: 0.1890, test_loss: 3.0802, test_f1: 0.6067
 epoch: 68, train_loss: 0.1809, test_loss: 3.1179, test_f1: 0.6046
 epoch: 69, train_loss: 0.1901, test_loss: 3.1103, test_f1: 0.6270
 epoch: 70, train_loss: 0.1658, test_loss: 3.0270, test_f1: 0.6286
 epoch: 71, train_loss: 0.2056, test_loss: 3.2604, test_f1: 0.6130
 epoch: 72, train_loss: 0.1700, test_loss: 3.2686, test_f1: 0.5960
 epoch: 73, train_loss: 0.1839, test_loss: 3.3854, test_f1: 0.6042
 epoch: 74, train_loss: 0.1693, test_loss: 3.0267, test_f1: 0.6070
 epoch: 75, train_loss: 0.1950, test_loss: 3.3441, test_f1: 0.5756
 epoch: 76, train_loss: 0.2113, test_loss: 3.6791, test_f1: 0.6072
 epoch: 77, train_loss: 0.2329, test_loss: 2.9886, test_f1: 0.5841
 epoch: 78, train_loss: 0.2249, test_loss: 3.0222, test_f1: 0.6183
 epoch: 79, train_loss: 0.2205, test_loss: 3.4080, test_f1: 0.5894
 epoch: 80, train_loss: 0.2007, test_loss: 3.1174, test_f1: 0.5987
 epoch: 81, train_loss: 0.1784, test_loss: 3.1328, test_f1: 0.5811
 epoch: 82, train_loss: 0.1691, test_loss: 3.1838, test_f1: 0.5937
 epoch: 83, train_loss: 0.1805, test_loss: 3.1546, test_f1: 0.6087
 epoch: 84, train_loss: 0.1866, test_loss: 3.1577, test_f1: 0.5666
 epoch: 85, train_loss: 0.1532, test_loss: 3.1678, test_f1: 0.5814
 epoch: 86, train_loss: 0.1767, test_loss: 3.3923, test_f1: 0.5909
 epoch: 87, train_loss: 0.1429, test_loss: 3.4265, test_f1: 0.5957
 epoch: 88, train_loss: 0.1535, test_loss: 3.1742, test_f1: 0.6168
 epoch: 89, train_loss: 0.1489, test_loss: 3.7378, test_f1: 0.5883
 epoch: 90, train_loss: 0.1353, test_loss: 3.7559, test_f1: 0.5832
 epoch: 91, train_loss: 0.1344, test_loss: 3.6059, test_f1: 0.5814
 epoch: 92, train_loss: 0.1395, test_loss: 3.3039, test_f1: 0.5894
 epoch: 93, train_loss: 0.1025, test_loss: 3.4125, test_f1: 0.5896
 epoch: 94, train_loss: 0.1513, test_loss: 4.0459, test_f1: 0.5828
 epoch: 95, train_loss: 0.1454, test_loss: 3.7345, test_f1: 0.6074
 epoch: 96, train_loss: 0.1667, test_loss: 3.7812, test_f1: 0.5777
 epoch: 97, train_loss: 0.1469, test_loss: 3.8871, test_f1: 0.5832
 epoch: 98, train_loss: 0.1392, test_loss: 3.8027, test_f1: 0.5902
 epoch: 99, train_loss: 0.1421, test_loss: 3.9677, test_f1: 0.5611
##################ITERATION #2 ****************************************
 epoch: 0, train_loss: 1.1648, test_loss: 1.2336, test_f1: 0.2410
 epoch: 1, train_loss: 1.0249, test_loss: 1.1281, test_f1: 0.4301
 epoch: 2, train_loss: 0.9538, test_loss: 1.0923, test_f1: 0.5490
 epoch: 3, train_loss: 0.9305, test_loss: 1.0524, test_f1: 0.5452
 epoch: 4, train_loss: 0.9022, test_loss: 1.0579, test_f1: 0.5656
 epoch: 5, train_loss: 0.8640, test_loss: 1.0511, test_f1: 0.5747
 epoch: 6, train_loss: 0.8475, test_loss: 1.0597, test_f1: 0.5542
 epoch: 7, train_loss: 0.8476, test_loss: 1.0036, test_f1: 0.5901
 epoch: 8, train_loss: 0.8503, test_loss: 1.0385, test_f1: 0.6052
 epoch: 9, train_loss: 0.8127, test_loss: 1.2144, test_f1: 0.5292
 epoch: 10, train_loss: 0.7990, test_loss: 1.1899, test_f1: 0.5722
 epoch: 11, train_loss: 0.7883, test_loss: 1.2254, test_f1: 0.5496
 epoch: 12, train_loss: 0.7780, test_loss: 1.3039, test_f1: 0.5631
 epoch: 13, train_loss: 0.7619, test_loss: 1.2771, test_f1: 0.6084
 epoch: 14, train_loss: 0.7485, test_loss: 1.2735, test_f1: 0.5989
 epoch: 15, train_loss: 0.7288, test_loss: 1.4022, test_f1: 0.5417
 epoch: 16, train_loss: 0.7216, test_loss: 1.3740, test_f1: 0.6063
 epoch: 17, train_loss: 0.7136, test_loss: 1.3419, test_f1: 0.5823
 epoch: 18, train_loss: 0.6807, test_loss: 1.2913, test_f1: 0.5700
 epoch: 19, train_loss: 0.6627, test_loss: 1.4560, test_f1: 0.6148
 epoch: 20, train_loss: 0.6696, test_loss: 1.4377, test_f1: 0.5536
 epoch: 21, train_loss: 0.6468, test_loss: 1.6880, test_f1: 0.5671
 epoch: 22, train_loss: 0.6245, test_loss: 1.5192, test_f1: 0.5765
 epoch: 23, train_loss: 0.5851, test_loss: 1.4763, test_f1: 0.5999
 epoch: 24, train_loss: 0.5947, test_loss: 1.5237, test_f1: 0.5871
 epoch: 25, train_loss: 0.5705, test_loss: 1.4974, test_f1: 0.6010
 epoch: 26, train_loss: 0.5591, test_loss: 1.7062, test_f1: 0.6345
 epoch: 27, train_loss: 0.5753, test_loss: 1.6157, test_f1: 0.5631
 epoch: 28, train_loss: 0.5411, test_loss: 1.5243, test_f1: 0.5866
 epoch: 29, train_loss: 0.5743, test_loss: 1.5654, test_f1: 0.5545
 epoch: 30, train_loss: 0.5653, test_loss: 1.7547, test_f1: 0.5563
 epoch: 31, train_loss: 0.5403, test_loss: 2.0462, test_f1: 0.5669
 epoch: 32, train_loss: 0.5321, test_loss: 1.6955, test_f1: 0.6018
 epoch: 33, train_loss: 0.4990, test_loss: 1.4788, test_f1: 0.6226
 epoch: 34, train_loss: 0.5059, test_loss: 1.5492, test_f1: 0.5986
 epoch: 35, train_loss: 0.4769, test_loss: 2.1707, test_f1: 0.5198
 epoch: 36, train_loss: 0.4855, test_loss: 1.9104, test_f1: 0.5806
 epoch: 37, train_loss: 0.4657, test_loss: 1.7847, test_f1: 0.6211
 epoch: 38, train_loss: 0.4727, test_loss: 1.9857, test_f1: 0.6011
 epoch: 39, train_loss: 0.4673, test_loss: 1.9779, test_f1: 0.5897
 epoch: 40, train_loss: 0.4500, test_loss: 2.3480, test_f1: 0.5581
 epoch: 41, train_loss: 0.4477, test_loss: 1.9220, test_f1: 0.5751
 epoch: 42, train_loss: 0.4243, test_loss: 2.0018, test_f1: 0.5915
 epoch: 43, train_loss: 0.4226, test_loss: 2.0281, test_f1: 0.5541
 epoch: 44, train_loss: 0.4258, test_loss: 1.9240, test_f1: 0.5643
 epoch: 45, train_loss: 0.4014, test_loss: 1.9216, test_f1: 0.5857
 epoch: 46, train_loss: 0.4193, test_loss: 2.3428, test_f1: 0.5826
 epoch: 47, train_loss: 0.4198, test_loss: 2.0749, test_f1: 0.5864
 epoch: 48, train_loss: 0.4540, test_loss: 1.9955, test_f1: 0.5103
 epoch: 49, train_loss: 0.4302, test_loss: 2.0161, test_f1: 0.5755
 epoch: 50, train_loss: 0.3911, test_loss: 2.1777, test_f1: 0.5498
 epoch: 51, train_loss: 0.3397, test_loss: 2.0851, test_f1: 0.5927
 epoch: 52, train_loss: 0.3140, test_loss: 2.1412, test_f1: 0.5795
 epoch: 53, train_loss: 0.2920, test_loss: 2.3947, test_f1: 0.5901
 epoch: 54, train_loss: 0.2950, test_loss: 2.3438, test_f1: 0.5771
 epoch: 55, train_loss: 0.2882, test_loss: 2.5868, test_f1: 0.5559
 epoch: 56, train_loss: 0.2659, test_loss: 2.3339, test_f1: 0.5765
 epoch: 57, train_loss: 0.2696, test_loss: 2.5308, test_f1: 0.5950
 epoch: 58, train_loss: 0.2577, test_loss: 2.4440, test_f1: 0.5889
 epoch: 59, train_loss: 0.2272, test_loss: 2.5575, test_f1: 0.5885
 epoch: 60, train_loss: 0.2602, test_loss: 2.6470, test_f1: 0.5947
 epoch: 61, train_loss: 0.2431, test_loss: 2.7083, test_f1: 0.5557
 epoch: 62, train_loss: 0.2607, test_loss: 2.6154, test_f1: 0.6013
 epoch: 63, train_loss: 0.2394, test_loss: 2.4204, test_f1: 0.6110
 epoch: 64, train_loss: 0.2315, test_loss: 2.6374, test_f1: 0.6225
 epoch: 65, train_loss: 0.2431, test_loss: 2.6793, test_f1: 0.5640
 epoch: 66, train_loss: 0.2397, test_loss: 2.8450, test_f1: 0.5964
 epoch: 67, train_loss: 0.2360, test_loss: 2.9149, test_f1: 0.5856
 epoch: 68, train_loss: 0.2049, test_loss: 2.8571, test_f1: 0.5941
 epoch: 69, train_loss: 0.2101, test_loss: 3.0343, test_f1: 0.5993
 epoch: 70, train_loss: 0.2068, test_loss: 2.7682, test_f1: 0.5752
 epoch: 71, train_loss: 0.2291, test_loss: 2.8146, test_f1: 0.5966
 epoch: 72, train_loss: 0.2293, test_loss: 2.8167, test_f1: 0.5819
 epoch: 73, train_loss: 0.2512, test_loss: 2.8314, test_f1: 0.6309
 epoch: 74, train_loss: 0.2188, test_loss: 2.4697, test_f1: 0.6307
 epoch: 75, train_loss: 0.2145, test_loss: 3.1628, test_f1: 0.5883
 epoch: 76, train_loss: 0.2150, test_loss: 2.6907, test_f1: 0.6088
 epoch: 77, train_loss: 0.2296, test_loss: 3.0639, test_f1: 0.5638
 epoch: 78, train_loss: 0.2295, test_loss: 3.1337, test_f1: 0.5627
 epoch: 79, train_loss: 0.2203, test_loss: 2.7810, test_f1: 0.6104
 epoch: 80, train_loss: 0.2136, test_loss: 2.8403, test_f1: 0.6005
 epoch: 81, train_loss: 0.2288, test_loss: 3.0759, test_f1: 0.6057
 epoch: 82, train_loss: 0.2172, test_loss: 3.0070, test_f1: 0.5945
 epoch: 83, train_loss: 0.2144, test_loss: 3.0499, test_f1: 0.6005
 epoch: 84, train_loss: 0.1834, test_loss: 3.2256, test_f1: 0.5973
 epoch: 85, train_loss: 0.1897, test_loss: 3.3968, test_f1: 0.5698
 epoch: 86, train_loss: 0.1616, test_loss: 3.3429, test_f1: 0.6241
 epoch: 87, train_loss: 0.1911, test_loss: 3.6688, test_f1: 0.6255
 epoch: 88, train_loss: 0.2051, test_loss: 3.4261, test_f1: 0.5765
 epoch: 89, train_loss: 0.1927, test_loss: 3.1786, test_f1: 0.6012
 epoch: 90, train_loss: 0.1817, test_loss: 3.2951, test_f1: 0.5894
 epoch: 91, train_loss: 0.1576, test_loss: 3.5551, test_f1: 0.6029
 epoch: 92, train_loss: 0.1669, test_loss: 3.1497, test_f1: 0.6190
 epoch: 93, train_loss: 0.1600, test_loss: 3.3322, test_f1: 0.5994
 epoch: 94, train_loss: 0.1830, test_loss: 3.3260, test_f1: 0.5882
 epoch: 95, train_loss: 0.1899, test_loss: 3.0100, test_f1: 0.6319
 epoch: 96, train_loss: 0.1773, test_loss: 3.5765, test_f1: 0.6103
 epoch: 97, train_loss: 0.1750, test_loss: 3.6766, test_f1: 0.5692
 epoch: 98, train_loss: 0.2565, test_loss: 3.4175, test_f1: 0.6189
 epoch: 99, train_loss: 0.2133, test_loss: 3.1595, test_f1: 0.6045
##################ITERATION #3 ****************************************
 epoch: 0, train_loss: 1.1870, test_loss: 1.3068, test_f1: 0.2101
 epoch: 1, train_loss: 1.0350, test_loss: 1.1523, test_f1: 0.4085
 epoch: 2, train_loss: 0.9736, test_loss: 1.1249, test_f1: 0.4484
 epoch: 3, train_loss: 0.9089, test_loss: 1.1110, test_f1: 0.4893
 epoch: 4, train_loss: 0.8817, test_loss: 1.0611, test_f1: 0.5074
 epoch: 5, train_loss: 0.8831, test_loss: 1.1141, test_f1: 0.5300
 epoch: 6, train_loss: 0.8545, test_loss: 1.1928, test_f1: 0.5418
 epoch: 7, train_loss: 0.8210, test_loss: 1.0703, test_f1: 0.5443
 epoch: 8, train_loss: 0.8155, test_loss: 0.9949, test_f1: 0.5260
 epoch: 9, train_loss: 0.8187, test_loss: 1.2170, test_f1: 0.5435
 epoch: 10, train_loss: 0.7907, test_loss: 1.1811, test_f1: 0.5728
 epoch: 11, train_loss: 0.7835, test_loss: 1.0150, test_f1: 0.5895
 epoch: 12, train_loss: 0.7565, test_loss: 1.1192, test_f1: 0.5366
 epoch: 13, train_loss: 0.7615, test_loss: 1.1957, test_f1: 0.5377
 epoch: 14, train_loss: 0.7407, test_loss: 1.1100, test_f1: 0.5548
 epoch: 15, train_loss: 0.7287, test_loss: 1.1938, test_f1: 0.5842
 epoch: 16, train_loss: 0.7113, test_loss: 1.3344, test_f1: 0.5251
 epoch: 17, train_loss: 0.6847, test_loss: 1.3153, test_f1: 0.6082
 epoch: 18, train_loss: 0.6710, test_loss: 1.3674, test_f1: 0.5712
 epoch: 19, train_loss: 0.6500, test_loss: 1.3460, test_f1: 0.5682
 epoch: 20, train_loss: 0.6608, test_loss: 1.4197, test_f1: 0.5529
 epoch: 21, train_loss: 0.6594, test_loss: 1.3053, test_f1: 0.5661
 epoch: 22, train_loss: 0.6555, test_loss: 1.3650, test_f1: 0.5972
 epoch: 23, train_loss: 0.6046, test_loss: 1.4615, test_f1: 0.5746
 epoch: 24, train_loss: 0.5797, test_loss: 1.5187, test_f1: 0.5529
 epoch: 25, train_loss: 0.5648, test_loss: 1.6642, test_f1: 0.5628
 epoch: 26, train_loss: 0.5791, test_loss: 1.2528, test_f1: 0.5828
 epoch: 27, train_loss: 0.5841, test_loss: 1.6944, test_f1: 0.5680
 epoch: 28, train_loss: 0.5476, test_loss: 1.8118, test_f1: 0.5822
 epoch: 29, train_loss: 0.5508, test_loss: 1.3169, test_f1: 0.6144
 epoch: 30, train_loss: 0.5212, test_loss: 1.5378, test_f1: 0.6010
 epoch: 31, train_loss: 0.5281, test_loss: 1.4334, test_f1: 0.5899
 epoch: 32, train_loss: 0.5090, test_loss: 1.6044, test_f1: 0.5970
 epoch: 33, train_loss: 0.5117, test_loss: 1.9189, test_f1: 0.5607
 epoch: 34, train_loss: 0.4912, test_loss: 1.5808, test_f1: 0.6011
 epoch: 35, train_loss: 0.4655, test_loss: 1.7656, test_f1: 0.5183
 epoch: 36, train_loss: 0.4889, test_loss: 2.0962, test_f1: 0.6006
 epoch: 37, train_loss: 0.4812, test_loss: 1.8364, test_f1: 0.5612
 epoch: 38, train_loss: 0.4545, test_loss: 1.8506, test_f1: 0.5846
 epoch: 39, train_loss: 0.4446, test_loss: 2.1517, test_f1: 0.5110
 epoch: 40, train_loss: 0.4261, test_loss: 1.7866, test_f1: 0.6014
 epoch: 41, train_loss: 0.4328, test_loss: 2.1104, test_f1: 0.6184
 epoch: 42, train_loss: 0.4298, test_loss: 1.7746, test_f1: 0.5999
 epoch: 43, train_loss: 0.4073, test_loss: 1.7924, test_f1: 0.6034
 epoch: 44, train_loss: 0.3899, test_loss: 2.0343, test_f1: 0.5978
 epoch: 45, train_loss: 0.4330, test_loss: 2.0675, test_f1: 0.6041
 epoch: 46, train_loss: 0.3933, test_loss: 2.1092, test_f1: 0.5975
 epoch: 47, train_loss: 0.3929, test_loss: 2.2468, test_f1: 0.5855
 epoch: 48, train_loss: 0.3814, test_loss: 2.1099, test_f1: 0.5898
 epoch: 49, train_loss: 0.3690, test_loss: 1.9701, test_f1: 0.6397
 epoch: 50, train_loss: 0.3844, test_loss: 2.1006, test_f1: 0.5805
 epoch: 51, train_loss: 0.3470, test_loss: 2.0507, test_f1: 0.6026
 epoch: 52, train_loss: 0.2939, test_loss: 2.0751, test_f1: 0.6069
 epoch: 53, train_loss: 0.2686, test_loss: 2.4799, test_f1: 0.5881
 epoch: 54, train_loss: 0.2575, test_loss: 2.7232, test_f1: 0.5841
 epoch: 55, train_loss: 0.2464, test_loss: 2.3111, test_f1: 0.6160
 epoch: 56, train_loss: 0.2669, test_loss: 2.6032, test_f1: 0.5795
 epoch: 57, train_loss: 0.2694, test_loss: 2.6914, test_f1: 0.5663
 epoch: 58, train_loss: 0.2208, test_loss: 2.5096, test_f1: 0.5839
 epoch: 59, train_loss: 0.2241, test_loss: 2.6426, test_f1: 0.5786
 epoch: 60, train_loss: 0.2063, test_loss: 3.1040, test_f1: 0.5935
 epoch: 61, train_loss: 0.2475, test_loss: 3.0283, test_f1: 0.5777
 epoch: 62, train_loss: 0.2447, test_loss: 2.7664, test_f1: 0.6224
 epoch: 63, train_loss: 0.2378, test_loss: 2.5689, test_f1: 0.5894
 epoch: 64, train_loss: 0.2311, test_loss: 3.0317, test_f1: 0.6028
 epoch: 65, train_loss: 0.2296, test_loss: 3.0571, test_f1: 0.5587
 epoch: 66, train_loss: 0.2455, test_loss: 2.8631, test_f1: 0.5773
 epoch: 67, train_loss: 0.2488, test_loss: 3.0553, test_f1: 0.5834
 epoch: 68, train_loss: 0.2364, test_loss: 2.5230, test_f1: 0.6281
 epoch: 69, train_loss: 0.2196, test_loss: 2.6411, test_f1: 0.6171
 epoch: 70, train_loss: 0.2185, test_loss: 2.9968, test_f1: 0.6026
 epoch: 71, train_loss: 0.2163, test_loss: 2.8119, test_f1: 0.6003
 epoch: 72, train_loss: 0.2312, test_loss: 3.0294, test_f1: 0.5736
 epoch: 73, train_loss: 0.2142, test_loss: 3.0965, test_f1: 0.5892
 epoch: 74, train_loss: 0.2100, test_loss: 2.7958, test_f1: 0.6054
 epoch: 75, train_loss: 0.2006, test_loss: 2.7596, test_f1: 0.5724
 epoch: 76, train_loss: 0.1754, test_loss: 3.0254, test_f1: 0.6004
 epoch: 77, train_loss: 0.1915, test_loss: 3.1752, test_f1: 0.5904
 epoch: 78, train_loss: 0.1940, test_loss: 2.8813, test_f1: 0.5858
 epoch: 79, train_loss: 0.1903, test_loss: 3.0368, test_f1: 0.6002
 epoch: 80, train_loss: 0.1876, test_loss: 2.9265, test_f1: 0.6130
 epoch: 81, train_loss: 0.1911, test_loss: 3.2168, test_f1: 0.6069
 epoch: 82, train_loss: 0.1794, test_loss: 3.3928, test_f1: 0.5902
 epoch: 83, train_loss: 0.1896, test_loss: 3.2651, test_f1: 0.6017
 epoch: 84, train_loss: 0.1714, test_loss: 3.1648, test_f1: 0.5721
 epoch: 85, train_loss: 0.1820, test_loss: 3.4600, test_f1: 0.5704
 epoch: 86, train_loss: 0.1936, test_loss: 3.3328, test_f1: 0.5937
 epoch: 87, train_loss: 0.1695, test_loss: 3.3226, test_f1: 0.5915
 epoch: 88, train_loss: 0.1826, test_loss: 3.4068, test_f1: 0.5801
 epoch: 89, train_loss: 0.1643, test_loss: 3.4389, test_f1: 0.5949
 epoch: 90, train_loss: 0.1641, test_loss: 3.6304, test_f1: 0.5839
 epoch: 91, train_loss: 0.1763, test_loss: 3.7189, test_f1: 0.5670
 epoch: 92, train_loss: 0.1669, test_loss: 3.2701, test_f1: 0.5888
 epoch: 93, train_loss: 0.1562, test_loss: 3.5053, test_f1: 0.6126
 epoch: 94, train_loss: 0.1867, test_loss: 3.5327, test_f1: 0.6153
 epoch: 95, train_loss: 0.1598, test_loss: 3.7661, test_f1: 0.5621
 epoch: 96, train_loss: 0.2023, test_loss: 3.2902, test_f1: 0.5997
 epoch: 97, train_loss: 0.1703, test_loss: 3.2351, test_f1: 0.6208
 epoch: 98, train_loss: 0.1662, test_loss: 3.4329, test_f1: 0.5821
 epoch: 99, train_loss: 0.1508, test_loss: 3.5311, test_f1: 0.6043
##################ITERATION #4 ****************************************
 epoch: 0, train_loss: 1.2134, test_loss: 1.2436, test_f1: 0.3181
 epoch: 1, train_loss: 1.0435, test_loss: 1.1341, test_f1: 0.3861
 epoch: 2, train_loss: 0.9800, test_loss: 1.0826, test_f1: 0.5012
 epoch: 3, train_loss: 0.9539, test_loss: 1.0669, test_f1: 0.5911
 epoch: 4, train_loss: 0.9122, test_loss: 1.1544, test_f1: 0.5532
 epoch: 5, train_loss: 0.9005, test_loss: 1.0152, test_f1: 0.5460
 epoch: 6, train_loss: 0.8911, test_loss: 1.0181, test_f1: 0.5611
 epoch: 7, train_loss: 0.8589, test_loss: 1.0576, test_f1: 0.5422
 epoch: 8, train_loss: 0.8579, test_loss: 1.0928, test_f1: 0.5166
 epoch: 9, train_loss: 0.8208, test_loss: 1.0732, test_f1: 0.5843
 epoch: 10, train_loss: 0.8223, test_loss: 0.9716, test_f1: 0.5984
 epoch: 11, train_loss: 0.8244, test_loss: 1.1635, test_f1: 0.5612
 epoch: 12, train_loss: 0.8021, test_loss: 1.1701, test_f1: 0.5842
 epoch: 13, train_loss: 0.7709, test_loss: 1.0360, test_f1: 0.6167
 epoch: 14, train_loss: 0.7671, test_loss: 1.1941, test_f1: 0.5667
 epoch: 15, train_loss: 0.7413, test_loss: 1.1819, test_f1: 0.5735
 epoch: 16, train_loss: 0.7417, test_loss: 1.2549, test_f1: 0.5553
 epoch: 17, train_loss: 0.7153, test_loss: 1.1629, test_f1: 0.6041
 epoch: 18, train_loss: 0.6899, test_loss: 1.2464, test_f1: 0.5570
 epoch: 19, train_loss: 0.7019, test_loss: 1.1561, test_f1: 0.5843
 epoch: 20, train_loss: 0.6731, test_loss: 1.3111, test_f1: 0.6307
 epoch: 21, train_loss: 0.6659, test_loss: 1.1176, test_f1: 0.6407
 epoch: 22, train_loss: 0.6424, test_loss: 1.2489, test_f1: 0.6193
 epoch: 23, train_loss: 0.6504, test_loss: 1.5265, test_f1: 0.5844
 epoch: 24, train_loss: 0.6331, test_loss: 1.4521, test_f1: 0.5924
 epoch: 25, train_loss: 0.6237, test_loss: 1.3878, test_f1: 0.6412
 epoch: 26, train_loss: 0.6004, test_loss: 1.2337, test_f1: 0.5550
 epoch: 27, train_loss: 0.5881, test_loss: 1.4864, test_f1: 0.5630
 epoch: 28, train_loss: 0.5672, test_loss: 1.3846, test_f1: 0.5909
 epoch: 29, train_loss: 0.5514, test_loss: 1.5602, test_f1: 0.5940
 epoch: 30, train_loss: 0.5545, test_loss: 1.5816, test_f1: 0.5972
 epoch: 31, train_loss: 0.5374, test_loss: 1.6959, test_f1: 0.5665
 epoch: 32, train_loss: 0.5436, test_loss: 1.3637, test_f1: 0.5854
 epoch: 33, train_loss: 0.5187, test_loss: 1.5712, test_f1: 0.5672
 epoch: 34, train_loss: 0.5426, test_loss: 1.6416, test_f1: 0.5815
 epoch: 35, train_loss: 0.4703, test_loss: 1.4489, test_f1: 0.6193
 epoch: 36, train_loss: 0.4871, test_loss: 1.9240, test_f1: 0.5358
 epoch: 37, train_loss: 0.4933, test_loss: 1.5866, test_f1: 0.5828
 epoch: 38, train_loss: 0.5014, test_loss: 1.6359, test_f1: 0.5969
 epoch: 39, train_loss: 0.4739, test_loss: 1.6269, test_f1: 0.6342
 epoch: 40, train_loss: 0.4683, test_loss: 1.4796, test_f1: 0.6105
 epoch: 41, train_loss: 0.4773, test_loss: 1.8925, test_f1: 0.5957
 epoch: 42, train_loss: 0.4587, test_loss: 1.5094, test_f1: 0.5438
 epoch: 43, train_loss: 0.4685, test_loss: 1.7022, test_f1: 0.5499
 epoch: 44, train_loss: 0.4403, test_loss: 1.9801, test_f1: 0.5877
 epoch: 45, train_loss: 0.4349, test_loss: 1.9699, test_f1: 0.6151
 epoch: 46, train_loss: 0.4160, test_loss: 2.1194, test_f1: 0.5942
 epoch: 47, train_loss: 0.4103, test_loss: 1.8898, test_f1: 0.6159
 epoch: 48, train_loss: 0.4168, test_loss: 1.8461, test_f1: 0.6177
 epoch: 49, train_loss: 0.4237, test_loss: 1.8498, test_f1: 0.6242
 epoch: 50, train_loss: 0.3870, test_loss: 1.9348, test_f1: 0.5875
 epoch: 51, train_loss: 0.3577, test_loss: 1.8112, test_f1: 0.6272
 epoch: 52, train_loss: 0.3154, test_loss: 2.1502, test_f1: 0.6183
 epoch: 53, train_loss: 0.2844, test_loss: 2.2103, test_f1: 0.5982
 epoch: 54, train_loss: 0.3048, test_loss: 2.4713, test_f1: 0.6261
 epoch: 55, train_loss: 0.3048, test_loss: 2.5513, test_f1: 0.5855
 epoch: 56, train_loss: 0.2775, test_loss: 2.5476, test_f1: 0.5868
 epoch: 57, train_loss: 0.2654, test_loss: 2.5514, test_f1: 0.5827
 epoch: 58, train_loss: 0.2407, test_loss: 2.5190, test_f1: 0.6031
 epoch: 59, train_loss: 0.2490, test_loss: 2.5903, test_f1: 0.6239
 epoch: 60, train_loss: 0.2670, test_loss: 2.5724, test_f1: 0.6113
 epoch: 61, train_loss: 0.2829, test_loss: 2.6794, test_f1: 0.5924
 epoch: 62, train_loss: 0.2594, test_loss: 2.5306, test_f1: 0.6120
 epoch: 63, train_loss: 0.2523, test_loss: 2.5769, test_f1: 0.6030
 epoch: 64, train_loss: 0.2375, test_loss: 2.4848, test_f1: 0.6191
 epoch: 65, train_loss: 0.2448, test_loss: 2.8390, test_f1: 0.5801
 epoch: 66, train_loss: 0.2500, test_loss: 2.8287, test_f1: 0.5947
 epoch: 67, train_loss: 0.2357, test_loss: 2.5745, test_f1: 0.5958
 epoch: 68, train_loss: 0.2429, test_loss: 2.6270, test_f1: 0.5950
 epoch: 69, train_loss: 0.2381, test_loss: 2.6599, test_f1: 0.5877
 epoch: 70, train_loss: 0.2350, test_loss: 2.8177, test_f1: 0.5834
 epoch: 71, train_loss: 0.2050, test_loss: 2.8245, test_f1: 0.5799
 epoch: 72, train_loss: 0.2114, test_loss: 2.8102, test_f1: 0.5836
 epoch: 73, train_loss: 0.1896, test_loss: 3.0164, test_f1: 0.5930
 epoch: 74, train_loss: 0.2350, test_loss: 2.8257, test_f1: 0.6126
 epoch: 75, train_loss: 0.2151, test_loss: 2.9421, test_f1: 0.5926
 epoch: 76, train_loss: 0.2087, test_loss: 3.0568, test_f1: 0.5979
 epoch: 77, train_loss: 0.1837, test_loss: 3.0309, test_f1: 0.6038
 epoch: 78, train_loss: 0.2063, test_loss: 3.3490, test_f1: 0.5890
 epoch: 79, train_loss: 0.2122, test_loss: 2.8773, test_f1: 0.6099
 epoch: 80, train_loss: 0.2025, test_loss: 3.3433, test_f1: 0.5847
 epoch: 81, train_loss: 0.2136, test_loss: 3.0540, test_f1: 0.6030
 epoch: 82, train_loss: 0.2337, test_loss: 3.0415, test_f1: 0.6049
 epoch: 83, train_loss: 0.2059, test_loss: 3.3094, test_f1: 0.5579
 epoch: 84, train_loss: 0.2181, test_loss: 2.9098, test_f1: 0.5962
 epoch: 85, train_loss: 0.2040, test_loss: 3.2004, test_f1: 0.5713
 epoch: 86, train_loss: 0.1834, test_loss: 3.2979, test_f1: 0.5754
 epoch: 87, train_loss: 0.2026, test_loss: 3.5042, test_f1: 0.5866
 epoch: 88, train_loss: 0.1748, test_loss: 3.0772, test_f1: 0.5845
 epoch: 89, train_loss: 0.1741, test_loss: 3.2535, test_f1: 0.6024
 epoch: 90, train_loss: 0.1673, test_loss: 3.6294, test_f1: 0.6074
 epoch: 91, train_loss: 0.1863, test_loss: 3.1328, test_f1: 0.6103
 epoch: 92, train_loss: 0.1878, test_loss: 3.2633, test_f1: 0.6166
 epoch: 93, train_loss: 0.1846, test_loss: 3.3197, test_f1: 0.5971
 epoch: 94, train_loss: 0.1898, test_loss: 3.2112, test_f1: 0.6086
 epoch: 95, train_loss: 0.1794, test_loss: 3.3839, test_f1: 0.6021
 epoch: 96, train_loss: 0.1906, test_loss: 3.2759, test_f1: 0.5726
 epoch: 97, train_loss: 0.2179, test_loss: 2.9003, test_f1: 0.6041
 epoch: 98, train_loss: 0.1718, test_loss: 3.3657, test_f1: 0.5812
 epoch: 99, train_loss: 0.1662, test_loss: 3.3683, test_f1: 0.5839
##################ITERATION #5 ****************************************
 epoch: 0, train_loss: 1.2827, test_loss: 1.2871, test_f1: 0.2254
 epoch: 1, train_loss: 1.0621, test_loss: 1.1269, test_f1: 0.4057
 epoch: 2, train_loss: 0.9759, test_loss: 1.0937, test_f1: 0.4914
 epoch: 3, train_loss: 0.9458, test_loss: 1.1180, test_f1: 0.4995
 epoch: 4, train_loss: 0.9040, test_loss: 1.0592, test_f1: 0.5144
 epoch: 5, train_loss: 0.8945, test_loss: 1.1558, test_f1: 0.4004
 epoch: 6, train_loss: 0.8799, test_loss: 1.0354, test_f1: 0.5381
 epoch: 7, train_loss: 0.8742, test_loss: 1.1085, test_f1: 0.5755
 epoch: 8, train_loss: 0.8630, test_loss: 1.0794, test_f1: 0.5527
 epoch: 9, train_loss: 0.8213, test_loss: 1.1103, test_f1: 0.5098
 epoch: 10, train_loss: 0.8205, test_loss: 1.1473, test_f1: 0.5304
 epoch: 11, train_loss: 0.8096, test_loss: 1.1395, test_f1: 0.5512
 epoch: 12, train_loss: 0.8120, test_loss: 1.1190, test_f1: 0.5323
 epoch: 13, train_loss: 0.7835, test_loss: 1.1398, test_f1: 0.5915
 epoch: 14, train_loss: 0.7588, test_loss: 1.0650, test_f1: 0.5885
 epoch: 15, train_loss: 0.7712, test_loss: 1.1245, test_f1: 0.5963
 epoch: 16, train_loss: 0.7259, test_loss: 1.1950, test_f1: 0.5864
 epoch: 17, train_loss: 0.6910, test_loss: 1.1892, test_f1: 0.5665
 epoch: 18, train_loss: 0.7286, test_loss: 1.2224, test_f1: 0.6308
 epoch: 19, train_loss: 0.7075, test_loss: 1.2032, test_f1: 0.6163
 epoch: 20, train_loss: 0.6805, test_loss: 1.3292, test_f1: 0.5611
 epoch: 21, train_loss: 0.6459, test_loss: 1.3080, test_f1: 0.5710
 epoch: 22, train_loss: 0.6433, test_loss: 1.2943, test_f1: 0.6105
 epoch: 23, train_loss: 0.6228, test_loss: 1.3496, test_f1: 0.5965
 epoch: 24, train_loss: 0.6588, test_loss: 1.4306, test_f1: 0.6001
 epoch: 25, train_loss: 0.6096, test_loss: 1.3812, test_f1: 0.5893
 epoch: 26, train_loss: 0.6312, test_loss: 1.2439, test_f1: 0.6104
 epoch: 27, train_loss: 0.5855, test_loss: 1.3758, test_f1: 0.5938
 epoch: 28, train_loss: 0.5816, test_loss: 1.4453, test_f1: 0.5961
 epoch: 29, train_loss: 0.5780, test_loss: 1.6096, test_f1: 0.5996
 epoch: 30, train_loss: 0.5676, test_loss: 1.3747, test_f1: 0.5924
 epoch: 31, train_loss: 0.5686, test_loss: 1.4974, test_f1: 0.6081
 epoch: 32, train_loss: 0.4850, test_loss: 1.5968, test_f1: 0.5981
 epoch: 33, train_loss: 0.5371, test_loss: 1.8293, test_f1: 0.5601
 epoch: 34, train_loss: 0.5248, test_loss: 1.6336, test_f1: 0.5958
 epoch: 35, train_loss: 0.5047, test_loss: 1.6384, test_f1: 0.5807
 epoch: 36, train_loss: 0.4795, test_loss: 1.7699, test_f1: 0.5968
 epoch: 37, train_loss: 0.4790, test_loss: 1.5844, test_f1: 0.6128
 epoch: 38, train_loss: 0.5044, test_loss: 1.6210, test_f1: 0.5986
 epoch: 39, train_loss: 0.4645, test_loss: 1.7372, test_f1: 0.6009
 epoch: 40, train_loss: 0.4604, test_loss: 1.4602, test_f1: 0.6188
 epoch: 41, train_loss: 0.4558, test_loss: 1.6653, test_f1: 0.6159
 epoch: 42, train_loss: 0.4265, test_loss: 1.8589, test_f1: 0.6213
 epoch: 43, train_loss: 0.4200, test_loss: 1.8024, test_f1: 0.6036
 epoch: 44, train_loss: 0.4288, test_loss: 1.6223, test_f1: 0.6220
 epoch: 45, train_loss: 0.4586, test_loss: 1.6850, test_f1: 0.5444
 epoch: 46, train_loss: 0.4436, test_loss: 1.6393, test_f1: 0.5930
 epoch: 47, train_loss: 0.4310, test_loss: 1.8373, test_f1: 0.5770
 epoch: 48, train_loss: 0.4211, test_loss: 1.6923, test_f1: 0.5849
 epoch: 49, train_loss: 0.4299, test_loss: 1.6544, test_f1: 0.6100
 epoch: 50, train_loss: 0.3707, test_loss: 1.8257, test_f1: 0.5800
 epoch: 51, train_loss: 0.3327, test_loss: 1.7827, test_f1: 0.6265
 epoch: 52, train_loss: 0.3070, test_loss: 1.8594, test_f1: 0.6412
 epoch: 53, train_loss: 0.2875, test_loss: 1.9102, test_f1: 0.6260
 epoch: 54, train_loss: 0.2772, test_loss: 2.1165, test_f1: 0.5931
 epoch: 55, train_loss: 0.2708, test_loss: 2.1605, test_f1: 0.5956
 epoch: 56, train_loss: 0.2900, test_loss: 2.0703, test_f1: 0.6201
 epoch: 57, train_loss: 0.2775, test_loss: 2.1052, test_f1: 0.6023
 epoch: 58, train_loss: 0.2431, test_loss: 2.3374, test_f1: 0.6107
 epoch: 59, train_loss: 0.2641, test_loss: 2.4745, test_f1: 0.5929
 epoch: 60, train_loss: 0.2739, test_loss: 2.4658, test_f1: 0.6082
 epoch: 61, train_loss: 0.2546, test_loss: 2.4414, test_f1: 0.6034
 epoch: 62, train_loss: 0.2367, test_loss: 2.1332, test_f1: 0.6050
 epoch: 63, train_loss: 0.2373, test_loss: 2.5793, test_f1: 0.6029
 epoch: 64, train_loss: 0.2202, test_loss: 2.5213, test_f1: 0.5922
 epoch: 65, train_loss: 0.2074, test_loss: 2.5472, test_f1: 0.5917
 epoch: 66, train_loss: 0.1975, test_loss: 2.5544, test_f1: 0.6243
 epoch: 67, train_loss: 0.2328, test_loss: 3.0112, test_f1: 0.5801
 epoch: 68, train_loss: 0.2074, test_loss: 2.4716, test_f1: 0.6056
 epoch: 69, train_loss: 0.2216, test_loss: 2.5069, test_f1: 0.5955
 epoch: 70, train_loss: 0.2189, test_loss: 2.4687, test_f1: 0.5893
 epoch: 71, train_loss: 0.1994, test_loss: 2.7079, test_f1: 0.6055
 epoch: 72, train_loss: 0.2153, test_loss: 2.5368, test_f1: 0.6313
 epoch: 73, train_loss: 0.2426, test_loss: 2.6937, test_f1: 0.6056
 epoch: 74, train_loss: 0.1948, test_loss: 2.6114, test_f1: 0.5911
 epoch: 75, train_loss: 0.1703, test_loss: 2.6689, test_f1: 0.6064
 epoch: 76, train_loss: 0.2078, test_loss: 2.8466, test_f1: 0.6033
 epoch: 77, train_loss: 0.2245, test_loss: 2.9536, test_f1: 0.5733
 epoch: 78, train_loss: 0.1911, test_loss: 2.8785, test_f1: 0.5994
 epoch: 79, train_loss: 0.1923, test_loss: 2.7485, test_f1: 0.5960
 epoch: 80, train_loss: 0.2105, test_loss: 2.9648, test_f1: 0.6062
 epoch: 81, train_loss: 0.2203, test_loss: 2.9072, test_f1: 0.5792
 epoch: 82, train_loss: 0.1807, test_loss: 2.6582, test_f1: 0.5632
 epoch: 83, train_loss: 0.1849, test_loss: 2.8622, test_f1: 0.5963
 epoch: 84, train_loss: 0.1900, test_loss: 2.8287, test_f1: 0.5969
 epoch: 85, train_loss: 0.1769, test_loss: 2.9109, test_f1: 0.5895
 epoch: 86, train_loss: 0.1800, test_loss: 2.8446, test_f1: 0.5971
 epoch: 87, train_loss: 0.1655, test_loss: 3.3095, test_f1: 0.5992
 epoch: 88, train_loss: 0.1822, test_loss: 3.0300, test_f1: 0.5897
 epoch: 89, train_loss: 0.1637, test_loss: 3.1980, test_f1: 0.5692
 epoch: 90, train_loss: 0.1701, test_loss: 3.3460, test_f1: 0.5928
 epoch: 91, train_loss: 0.1783, test_loss: 2.9469, test_f1: 0.5941
 epoch: 92, train_loss: 0.1655, test_loss: 3.1373, test_f1: 0.5926
 epoch: 93, train_loss: 0.1497, test_loss: 3.2981, test_f1: 0.6205
 epoch: 94, train_loss: 0.1485, test_loss: 3.3169, test_f1: 0.6003
 epoch: 95, train_loss: 0.1405, test_loss: 3.4611, test_f1: 0.5936
 epoch: 96, train_loss: 0.1624, test_loss: 2.9984, test_f1: 0.5826
 epoch: 97, train_loss: 0.1496, test_loss: 3.1310, test_f1: 0.6332
 epoch: 98, train_loss: 0.1452, test_loss: 3.3025, test_f1: 0.6333
 epoch: 99, train_loss: 0.1532, test_loss: 3.3904, test_f1: 0.6313
##################ITERATION #6 ****************************************
 epoch: 0, train_loss: 1.3018, test_loss: 1.2867, test_f1: 0.1371
 epoch: 1, train_loss: 1.0449, test_loss: 1.2377, test_f1: 0.3376
 epoch: 2, train_loss: 0.9804, test_loss: 1.1334, test_f1: 0.4744
 epoch: 3, train_loss: 0.9319, test_loss: 1.1061, test_f1: 0.4332
 epoch: 4, train_loss: 0.9107, test_loss: 0.9749, test_f1: 0.5570
 epoch: 5, train_loss: 0.8902, test_loss: 0.9942, test_f1: 0.5501
 epoch: 6, train_loss: 0.8689, test_loss: 1.0876, test_f1: 0.5442
 epoch: 7, train_loss: 0.8813, test_loss: 0.9954, test_f1: 0.5707
 epoch: 8, train_loss: 0.8317, test_loss: 1.0311, test_f1: 0.5480
 epoch: 9, train_loss: 0.8401, test_loss: 1.0477, test_f1: 0.5639
 epoch: 10, train_loss: 0.8186, test_loss: 1.0629, test_f1: 0.5576
 epoch: 11, train_loss: 0.7956, test_loss: 1.0345, test_f1: 0.5868
 epoch: 12, train_loss: 0.8052, test_loss: 1.0482, test_f1: 0.5811
 epoch: 13, train_loss: 0.7686, test_loss: 1.1423, test_f1: 0.5701
 epoch: 14, train_loss: 0.7568, test_loss: 1.1067, test_f1: 0.5773
 epoch: 15, train_loss: 0.7548, test_loss: 1.1026, test_f1: 0.5707
 epoch: 16, train_loss: 0.7220, test_loss: 1.1304, test_f1: 0.5214
 epoch: 17, train_loss: 0.7264, test_loss: 1.0935, test_f1: 0.5623
 epoch: 18, train_loss: 0.7067, test_loss: 1.1586, test_f1: 0.6111
 epoch: 19, train_loss: 0.6478, test_loss: 1.1863, test_f1: 0.6348
 epoch: 20, train_loss: 0.6711, test_loss: 1.0635, test_f1: 0.6553
 epoch: 21, train_loss: 0.6590, test_loss: 1.4999, test_f1: 0.4891
 epoch: 22, train_loss: 0.6352, test_loss: 1.2302, test_f1: 0.6044
 epoch: 23, train_loss: 0.6355, test_loss: 1.2488, test_f1: 0.5660
 epoch: 24, train_loss: 0.6320, test_loss: 1.1572, test_f1: 0.6227
 epoch: 25, train_loss: 0.5958, test_loss: 1.4017, test_f1: 0.5887
 epoch: 26, train_loss: 0.6248, test_loss: 1.0540, test_f1: 0.6023
 epoch: 27, train_loss: 0.5752, test_loss: 1.3339, test_f1: 0.5931
 epoch: 28, train_loss: 0.5274, test_loss: 1.4271, test_f1: 0.6258
 epoch: 29, train_loss: 0.5488, test_loss: 1.3440, test_f1: 0.5868
 epoch: 30, train_loss: 0.5591, test_loss: 1.3730, test_f1: 0.6129
 epoch: 31, train_loss: 0.5064, test_loss: 1.2504, test_f1: 0.5998
 epoch: 32, train_loss: 0.4863, test_loss: 1.7082, test_f1: 0.5341
 epoch: 33, train_loss: 0.5112, test_loss: 1.7362, test_f1: 0.5518
 epoch: 34, train_loss: 0.4875, test_loss: 1.5787, test_f1: 0.5385
 epoch: 35, train_loss: 0.5197, test_loss: 1.5889, test_f1: 0.5999
 epoch: 36, train_loss: 0.4727, test_loss: 1.6189, test_f1: 0.5682
 epoch: 37, train_loss: 0.4648, test_loss: 1.5523, test_f1: 0.5762
 epoch: 38, train_loss: 0.4904, test_loss: 1.4398, test_f1: 0.6005
 epoch: 39, train_loss: 0.4552, test_loss: 1.5467, test_f1: 0.6020
 epoch: 40, train_loss: 0.4458, test_loss: 1.4236, test_f1: 0.6490
 epoch: 41, train_loss: 0.4210, test_loss: 1.5506, test_f1: 0.6262
 epoch: 42, train_loss: 0.4684, test_loss: 1.5535, test_f1: 0.6089
 epoch: 43, train_loss: 0.4437, test_loss: 1.6896, test_f1: 0.5730
 epoch: 44, train_loss: 0.3888, test_loss: 1.5378, test_f1: 0.6092
 epoch: 45, train_loss: 0.4025, test_loss: 1.6340, test_f1: 0.5540
 epoch: 46, train_loss: 0.4006, test_loss: 1.8476, test_f1: 0.5993
 epoch: 47, train_loss: 0.4102, test_loss: 1.5099, test_f1: 0.6328
 epoch: 48, train_loss: 0.4161, test_loss: 1.8023, test_f1: 0.5952
 epoch: 49, train_loss: 0.4050, test_loss: 1.7626, test_f1: 0.5376
 epoch: 50, train_loss: 0.3421, test_loss: 1.8851, test_f1: 0.5966
 epoch: 51, train_loss: 0.3166, test_loss: 1.6332, test_f1: 0.6321
 epoch: 52, train_loss: 0.2933, test_loss: 1.6454, test_f1: 0.6332
 epoch: 53, train_loss: 0.2712, test_loss: 1.8273, test_f1: 0.6384
 epoch: 54, train_loss: 0.2830, test_loss: 1.8248, test_f1: 0.6031
 epoch: 55, train_loss: 0.2743, test_loss: 1.7983, test_f1: 0.6220
 epoch: 56, train_loss: 0.2797, test_loss: 1.8955, test_f1: 0.6296
 epoch: 57, train_loss: 0.2601, test_loss: 1.8968, test_f1: 0.6000
 epoch: 58, train_loss: 0.2427, test_loss: 2.1545, test_f1: 0.6276
 epoch: 59, train_loss: 0.2296, test_loss: 2.0027, test_f1: 0.6517
 epoch: 60, train_loss: 0.2516, test_loss: 2.0078, test_f1: 0.6377
 epoch: 61, train_loss: 0.2499, test_loss: 1.9890, test_f1: 0.6277
 epoch: 62, train_loss: 0.2343, test_loss: 1.9224, test_f1: 0.6560
 epoch: 63, train_loss: 0.2283, test_loss: 1.9992, test_f1: 0.6284
 epoch: 64, train_loss: 0.2359, test_loss: 2.2130, test_f1: 0.6013
 epoch: 65, train_loss: 0.2163, test_loss: 2.3351, test_f1: 0.6073
 epoch: 66, train_loss: 0.2132, test_loss: 2.5033, test_f1: 0.6335
 epoch: 67, train_loss: 0.2205, test_loss: 2.4226, test_f1: 0.6118
 epoch: 68, train_loss: 0.2272, test_loss: 2.3971, test_f1: 0.6475
 epoch: 69, train_loss: 0.2193, test_loss: 2.6617, test_f1: 0.6066
 epoch: 70, train_loss: 0.2003, test_loss: 2.1858, test_f1: 0.6251
 epoch: 71, train_loss: 0.2307, test_loss: 2.5674, test_f1: 0.6349
 epoch: 72, train_loss: 0.2055, test_loss: 2.4749, test_f1: 0.6229
 epoch: 73, train_loss: 0.1863, test_loss: 2.6008, test_f1: 0.6207
 epoch: 74, train_loss: 0.1837, test_loss: 2.4408, test_f1: 0.6144
 epoch: 75, train_loss: 0.2022, test_loss: 2.5855, test_f1: 0.5966
 epoch: 76, train_loss: 0.1869, test_loss: 2.4914, test_f1: 0.6373
 epoch: 77, train_loss: 0.1616, test_loss: 2.3629, test_f1: 0.6441
 epoch: 78, train_loss: 0.1875, test_loss: 2.5495, test_f1: 0.6481
 epoch: 79, train_loss: 0.1836, test_loss: 2.7467, test_f1: 0.6149
 epoch: 80, train_loss: 0.1978, test_loss: 2.7917, test_f1: 0.6213
 epoch: 81, train_loss: 0.1978, test_loss: 2.4398, test_f1: 0.6121
 epoch: 82, train_loss: 0.2036, test_loss: 2.6895, test_f1: 0.6222
 epoch: 83, train_loss: 0.1829, test_loss: 2.6254, test_f1: 0.6141
 epoch: 84, train_loss: 0.1743, test_loss: 2.5173, test_f1: 0.6485
 epoch: 85, train_loss: 0.1545, test_loss: 2.5421, test_f1: 0.6211
 epoch: 86, train_loss: 0.1698, test_loss: 2.9025, test_f1: 0.5772
 epoch: 87, train_loss: 0.1371, test_loss: 2.8261, test_f1: 0.6143
 epoch: 88, train_loss: 0.1960, test_loss: 2.8917, test_f1: 0.6217
 epoch: 89, train_loss: 0.1931, test_loss: 2.8222, test_f1: 0.6075
 epoch: 90, train_loss: 0.1952, test_loss: 2.5261, test_f1: 0.6422
 epoch: 91, train_loss: 0.1838, test_loss: 2.5717, test_f1: 0.6416
 epoch: 92, train_loss: 0.1664, test_loss: 2.7766, test_f1: 0.6432
 epoch: 93, train_loss: 0.1722, test_loss: 2.7051, test_f1: 0.6400
 epoch: 94, train_loss: 0.1843, test_loss: 2.7960, test_f1: 0.6026
 epoch: 95, train_loss: 0.1649, test_loss: 2.7333, test_f1: 0.5996
 epoch: 96, train_loss: 0.1762, test_loss: 3.1074, test_f1: 0.6038
 epoch: 97, train_loss: 0.1709, test_loss: 2.5867, test_f1: 0.6481
 epoch: 98, train_loss: 0.1534, test_loss: 2.5316, test_f1: 0.6232
 epoch: 99, train_loss: 0.1399, test_loss: 2.8292, test_f1: 0.6250
##################ITERATION #7 ****************************************
 epoch: 0, train_loss: 1.2981, test_loss: 1.2591, test_f1: 0.2393
 epoch: 1, train_loss: 1.0648, test_loss: 1.1240, test_f1: 0.3406
 epoch: 2, train_loss: 0.9864, test_loss: 1.1434, test_f1: 0.4934
 epoch: 3, train_loss: 0.9498, test_loss: 1.0723, test_f1: 0.5339
 epoch: 4, train_loss: 0.9119, test_loss: 1.0454, test_f1: 0.5536
 epoch: 5, train_loss: 0.8823, test_loss: 1.0538, test_f1: 0.5652
 epoch: 6, train_loss: 0.8793, test_loss: 1.0507, test_f1: 0.5309
 epoch: 7, train_loss: 0.8658, test_loss: 1.0244, test_f1: 0.5556
 epoch: 8, train_loss: 0.8254, test_loss: 1.1429, test_f1: 0.5451
 epoch: 9, train_loss: 0.8364, test_loss: 1.0778, test_f1: 0.5787
 epoch: 10, train_loss: 0.8018, test_loss: 1.0698, test_f1: 0.5854
 epoch: 11, train_loss: 0.8098, test_loss: 1.0959, test_f1: 0.5566
 epoch: 12, train_loss: 0.7800, test_loss: 1.1225, test_f1: 0.5840
 epoch: 13, train_loss: 0.7626, test_loss: 1.1019, test_f1: 0.6118
 epoch: 14, train_loss: 0.7391, test_loss: 1.0908, test_f1: 0.5752
 epoch: 15, train_loss: 0.7285, test_loss: 1.1725, test_f1: 0.5971
 epoch: 16, train_loss: 0.7399, test_loss: 1.2288, test_f1: 0.5823
 epoch: 17, train_loss: 0.7350, test_loss: 1.1009, test_f1: 0.6047
 epoch: 18, train_loss: 0.6961, test_loss: 1.3249, test_f1: 0.5484
 epoch: 19, train_loss: 0.6901, test_loss: 1.2879, test_f1: 0.5645
 epoch: 20, train_loss: 0.6922, test_loss: 1.0851, test_f1: 0.5970
 epoch: 21, train_loss: 0.6658, test_loss: 1.1410, test_f1: 0.6319
 epoch: 22, train_loss: 0.6787, test_loss: 1.1485, test_f1: 0.6066
 epoch: 23, train_loss: 0.6595, test_loss: 1.2892, test_f1: 0.5523
 epoch: 24, train_loss: 0.6434, test_loss: 1.2359, test_f1: 0.5803
 epoch: 25, train_loss: 0.6584, test_loss: 1.2806, test_f1: 0.5598
 epoch: 26, train_loss: 0.6380, test_loss: 1.3329, test_f1: 0.5894
 epoch: 27, train_loss: 0.6305, test_loss: 1.3396, test_f1: 0.5570
 epoch: 28, train_loss: 0.6173, test_loss: 1.3773, test_f1: 0.5545
 epoch: 29, train_loss: 0.6074, test_loss: 1.2784, test_f1: 0.6180
 epoch: 30, train_loss: 0.5745, test_loss: 1.4023, test_f1: 0.5840
 epoch: 31, train_loss: 0.6186, test_loss: 1.4984, test_f1: 0.5371
 epoch: 32, train_loss: 0.5954, test_loss: 1.3482, test_f1: 0.5915
 epoch: 33, train_loss: 0.5609, test_loss: 1.4192, test_f1: 0.5981
 epoch: 34, train_loss: 0.5629, test_loss: 1.4299, test_f1: 0.6065
 epoch: 35, train_loss: 0.5554, test_loss: 1.7563, test_f1: 0.5666
 epoch: 36, train_loss: 0.5934, test_loss: 1.7399, test_f1: 0.5176
 epoch: 37, train_loss: 0.5188, test_loss: 1.6021, test_f1: 0.6151
 epoch: 38, train_loss: 0.5317, test_loss: 1.5049, test_f1: 0.5909
 epoch: 39, train_loss: 0.4921, test_loss: 1.8641, test_f1: 0.5369
 epoch: 40, train_loss: 0.5107, test_loss: 1.5635, test_f1: 0.5958
 epoch: 41, train_loss: 0.4705, test_loss: 1.6381, test_f1: 0.5595
 epoch: 42, train_loss: 0.4942, test_loss: 1.4798, test_f1: 0.6395
 epoch: 43, train_loss: 0.5028, test_loss: 1.4557, test_f1: 0.5932
 epoch: 44, train_loss: 0.4716, test_loss: 1.6752, test_f1: 0.5742
 epoch: 45, train_loss: 0.4682, test_loss: 1.6884, test_f1: 0.5979
 epoch: 46, train_loss: 0.4663, test_loss: 1.4098, test_f1: 0.6082
 epoch: 47, train_loss: 0.4694, test_loss: 1.4762, test_f1: 0.6219
 epoch: 48, train_loss: 0.4564, test_loss: 1.8658, test_f1: 0.5772
 epoch: 49, train_loss: 0.4410, test_loss: 1.6897, test_f1: 0.6197
 epoch: 50, train_loss: 0.4296, test_loss: 2.2466, test_f1: 0.4962
 epoch: 51, train_loss: 0.4246, test_loss: 1.6097, test_f1: 0.6008
 epoch: 52, train_loss: 0.3488, test_loss: 1.7375, test_f1: 0.6151
 epoch: 53, train_loss: 0.3358, test_loss: 2.0256, test_f1: 0.6069
 epoch: 54, train_loss: 0.3150, test_loss: 1.9851, test_f1: 0.6352
 epoch: 55, train_loss: 0.3501, test_loss: 1.9698, test_f1: 0.6212
 epoch: 56, train_loss: 0.3617, test_loss: 2.0189, test_f1: 0.6130
 epoch: 57, train_loss: 0.3194, test_loss: 1.8357, test_f1: 0.6652
 epoch: 58, train_loss: 0.3223, test_loss: 2.0836, test_f1: 0.6425
 epoch: 59, train_loss: 0.2852, test_loss: 2.1071, test_f1: 0.6397
 epoch: 60, train_loss: 0.3050, test_loss: 2.0074, test_f1: 0.6542
 epoch: 61, train_loss: 0.3069, test_loss: 2.3944, test_f1: 0.6013
 epoch: 62, train_loss: 0.3052, test_loss: 2.1003, test_f1: 0.6184
 epoch: 63, train_loss: 0.2895, test_loss: 2.2389, test_f1: 0.6408
 epoch: 64, train_loss: 0.2917, test_loss: 2.3078, test_f1: 0.6000
 epoch: 65, train_loss: 0.2779, test_loss: 2.2647, test_f1: 0.6337
 epoch: 66, train_loss: 0.3022, test_loss: 2.3744, test_f1: 0.6010
 epoch: 67, train_loss: 0.2765, test_loss: 2.4281, test_f1: 0.5949
 epoch: 68, train_loss: 0.2791, test_loss: 2.2936, test_f1: 0.5897
 epoch: 69, train_loss: 0.2711, test_loss: 2.7156, test_f1: 0.5938
 epoch: 70, train_loss: 0.2490, test_loss: 2.5234, test_f1: 0.5807
 epoch: 71, train_loss: 0.2682, test_loss: 2.6263, test_f1: 0.5741
 epoch: 72, train_loss: 0.2694, test_loss: 2.4351, test_f1: 0.6135
 epoch: 73, train_loss: 0.2503, test_loss: 2.6632, test_f1: 0.6061
 epoch: 74, train_loss: 0.2529, test_loss: 2.6604, test_f1: 0.5552
 epoch: 75, train_loss: 0.2326, test_loss: 2.6102, test_f1: 0.5953
 epoch: 76, train_loss: 0.2555, test_loss: 2.5698, test_f1: 0.5717
 epoch: 77, train_loss: 0.2405, test_loss: 2.8193, test_f1: 0.5982
 epoch: 78, train_loss: 0.2269, test_loss: 2.5776, test_f1: 0.5925
 epoch: 79, train_loss: 0.2586, test_loss: 2.9600, test_f1: 0.5566
 epoch: 80, train_loss: 0.2477, test_loss: 2.5639, test_f1: 0.5886
 epoch: 81, train_loss: 0.2396, test_loss: 2.8023, test_f1: 0.5913
 epoch: 82, train_loss: 0.2347, test_loss: 2.9756, test_f1: 0.5825
 epoch: 83, train_loss: 0.2534, test_loss: 2.5842, test_f1: 0.6003
 epoch: 84, train_loss: 0.2491, test_loss: 2.5819, test_f1: 0.6038
 epoch: 85, train_loss: 0.2343, test_loss: 2.7287, test_f1: 0.6047
 epoch: 86, train_loss: 0.2171, test_loss: 2.9188, test_f1: 0.5834
 epoch: 87, train_loss: 0.1870, test_loss: 2.9386, test_f1: 0.5979
 epoch: 88, train_loss: 0.1970, test_loss: 2.9591, test_f1: 0.5981
 epoch: 89, train_loss: 0.1955, test_loss: 2.9386, test_f1: 0.5933
 epoch: 90, train_loss: 0.2055, test_loss: 2.9575, test_f1: 0.5957
 epoch: 91, train_loss: 0.2010, test_loss: 2.8715, test_f1: 0.6076
 epoch: 92, train_loss: 0.2362, test_loss: 2.9637, test_f1: 0.5687
 epoch: 93, train_loss: 0.2085, test_loss: 2.8637, test_f1: 0.6135
 epoch: 94, train_loss: 0.2247, test_loss: 2.7803, test_f1: 0.5676
 epoch: 95, train_loss: 0.1807, test_loss: 2.8534, test_f1: 0.6251
 epoch: 96, train_loss: 0.1950, test_loss: 2.9378, test_f1: 0.6100
 epoch: 97, train_loss: 0.1993, test_loss: 2.7913, test_f1: 0.6014
 epoch: 98, train_loss: 0.1835, test_loss: 2.6843, test_f1: 0.6150
 epoch: 99, train_loss: 0.1917, test_loss: 2.9495, test_f1: 0.6329
##################ITERATION #8 ****************************************
 epoch: 0, train_loss: 1.3706, test_loss: 1.3255, test_f1: 0.1365
 epoch: 1, train_loss: 1.0547, test_loss: 1.1462, test_f1: 0.3346
 epoch: 2, train_loss: 0.9840, test_loss: 1.1485, test_f1: 0.4053
 epoch: 3, train_loss: 0.9653, test_loss: 1.0699, test_f1: 0.5506
 epoch: 4, train_loss: 0.9237, test_loss: 1.1168, test_f1: 0.5013
 epoch: 5, train_loss: 0.9061, test_loss: 1.0991, test_f1: 0.5013
 epoch: 6, train_loss: 0.9018, test_loss: 0.9827, test_f1: 0.5996
 epoch: 7, train_loss: 0.8705, test_loss: 1.1059, test_f1: 0.4980
 epoch: 8, train_loss: 0.8371, test_loss: 1.0482, test_f1: 0.5694
 epoch: 9, train_loss: 0.8405, test_loss: 1.0430, test_f1: 0.5946
 epoch: 10, train_loss: 0.8021, test_loss: 1.0400, test_f1: 0.5922
 epoch: 11, train_loss: 0.7857, test_loss: 1.0952, test_f1: 0.5373
 epoch: 12, train_loss: 0.8079, test_loss: 1.1069, test_f1: 0.5595
 epoch: 13, train_loss: 0.7764, test_loss: 1.2229, test_f1: 0.5108
 epoch: 14, train_loss: 0.7552, test_loss: 1.1011, test_f1: 0.6054
 epoch: 15, train_loss: 0.7385, test_loss: 1.2543, test_f1: 0.5740
 epoch: 16, train_loss: 0.7272, test_loss: 1.1814, test_f1: 0.6117
 epoch: 17, train_loss: 0.7098, test_loss: 1.2213, test_f1: 0.5642
 epoch: 18, train_loss: 0.7003, test_loss: 1.1302, test_f1: 0.5582
 epoch: 19, train_loss: 0.6720, test_loss: 1.1590, test_f1: 0.6170
 epoch: 20, train_loss: 0.7209, test_loss: 1.2000, test_f1: 0.5918
 epoch: 21, train_loss: 0.6642, test_loss: 1.1833, test_f1: 0.6182
 epoch: 22, train_loss: 0.6785, test_loss: 1.2658, test_f1: 0.6228
 epoch: 23, train_loss: 0.6311, test_loss: 1.4421, test_f1: 0.5805
 epoch: 24, train_loss: 0.6010, test_loss: 1.2744, test_f1: 0.6412
 epoch: 25, train_loss: 0.6209, test_loss: 1.3447, test_f1: 0.6012
 epoch: 26, train_loss: 0.6121, test_loss: 1.2863, test_f1: 0.6003
 epoch: 27, train_loss: 0.6070, test_loss: 1.3844, test_f1: 0.5969
 epoch: 28, train_loss: 0.5854, test_loss: 1.5000, test_f1: 0.5876
 epoch: 29, train_loss: 0.5657, test_loss: 1.6004, test_f1: 0.5843
 epoch: 30, train_loss: 0.5529, test_loss: 1.4589, test_f1: 0.6238
 epoch: 31, train_loss: 0.5507, test_loss: 1.6436, test_f1: 0.5677
 epoch: 32, train_loss: 0.5799, test_loss: 1.6428, test_f1: 0.5689
 epoch: 33, train_loss: 0.5469, test_loss: 1.5462, test_f1: 0.5663
 epoch: 34, train_loss: 0.5395, test_loss: 1.7730, test_f1: 0.5533
 epoch: 35, train_loss: 0.5612, test_loss: 1.4660, test_f1: 0.6174
 epoch: 36, train_loss: 0.5416, test_loss: 1.4138, test_f1: 0.5891
 epoch: 37, train_loss: 0.4738, test_loss: 1.7376, test_f1: 0.5537
 epoch: 38, train_loss: 0.4995, test_loss: 1.7709, test_f1: 0.5209
 epoch: 39, train_loss: 0.4738, test_loss: 1.6788, test_f1: 0.5651
 epoch: 40, train_loss: 0.4845, test_loss: 1.6598, test_f1: 0.5508
 epoch: 41, train_loss: 0.4625, test_loss: 1.8730, test_f1: 0.5722
 epoch: 42, train_loss: 0.4542, test_loss: 1.9503, test_f1: 0.5925
 epoch: 43, train_loss: 0.4552, test_loss: 1.8903, test_f1: 0.5722
 epoch: 44, train_loss: 0.4542, test_loss: 1.7755, test_f1: 0.5900
 epoch: 45, train_loss: 0.4462, test_loss: 2.0342, test_f1: 0.5618
 epoch: 46, train_loss: 0.4629, test_loss: 1.6716, test_f1: 0.6202
 epoch: 47, train_loss: 0.4523, test_loss: 1.9153, test_f1: 0.5372
 epoch: 48, train_loss: 0.3944, test_loss: 2.4146, test_f1: 0.5468
 epoch: 49, train_loss: 0.4002, test_loss: 2.1646, test_f1: 0.5386
 epoch: 50, train_loss: 0.4105, test_loss: 2.1971, test_f1: 0.5784
 epoch: 51, train_loss: 0.3732, test_loss: 2.0805, test_f1: 0.5935
 epoch: 52, train_loss: 0.3313, test_loss: 2.2058, test_f1: 0.5818
 epoch: 53, train_loss: 0.3090, test_loss: 2.2053, test_f1: 0.5742
 epoch: 54, train_loss: 0.3069, test_loss: 2.3013, test_f1: 0.5808
 epoch: 55, train_loss: 0.3124, test_loss: 2.4832, test_f1: 0.5863
 epoch: 56, train_loss: 0.2984, test_loss: 2.2973, test_f1: 0.6137
 epoch: 57, train_loss: 0.2853, test_loss: 2.4361, test_f1: 0.5930
 epoch: 58, train_loss: 0.2798, test_loss: 2.3763, test_f1: 0.6220
 epoch: 59, train_loss: 0.2834, test_loss: 2.4382, test_f1: 0.5875
 epoch: 60, train_loss: 0.2786, test_loss: 2.5286, test_f1: 0.6529
 epoch: 61, train_loss: 0.2861, test_loss: 2.7397, test_f1: 0.5876
 epoch: 62, train_loss: 0.2651, test_loss: 2.6698, test_f1: 0.5994
 epoch: 63, train_loss: 0.2584, test_loss: 3.0037, test_f1: 0.5508
 epoch: 64, train_loss: 0.2559, test_loss: 2.4543, test_f1: 0.5962
 epoch: 65, train_loss: 0.2532, test_loss: 3.0589, test_f1: 0.5849
 epoch: 66, train_loss: 0.2375, test_loss: 2.7313, test_f1: 0.5972
 epoch: 67, train_loss: 0.2581, test_loss: 3.0284, test_f1: 0.5923
 epoch: 68, train_loss: 0.2349, test_loss: 2.7956, test_f1: 0.5896
 epoch: 69, train_loss: 0.2410, test_loss: 3.1212, test_f1: 0.5896
 epoch: 70, train_loss: 0.2316, test_loss: 2.9139, test_f1: 0.5844
 epoch: 71, train_loss: 0.2447, test_loss: 3.0361, test_f1: 0.5769
 epoch: 72, train_loss: 0.2365, test_loss: 2.7852, test_f1: 0.5700
 epoch: 73, train_loss: 0.2500, test_loss: 2.7627, test_f1: 0.6147
 epoch: 74, train_loss: 0.2134, test_loss: 2.9773, test_f1: 0.5904
 epoch: 75, train_loss: 0.2145, test_loss: 2.8592, test_f1: 0.6011
 epoch: 76, train_loss: 0.1990, test_loss: 3.0023, test_f1: 0.5893
 epoch: 77, train_loss: 0.2400, test_loss: 3.5173, test_f1: 0.5997
 epoch: 78, train_loss: 0.2333, test_loss: 3.1993, test_f1: 0.5594
 epoch: 79, train_loss: 0.2470, test_loss: 3.1716, test_f1: 0.5774
 epoch: 80, train_loss: 0.2307, test_loss: 3.3470, test_f1: 0.5973
 epoch: 81, train_loss: 0.2241, test_loss: 3.0429, test_f1: 0.5988
 epoch: 82, train_loss: 0.2497, test_loss: 3.0061, test_f1: 0.6043
 epoch: 83, train_loss: 0.2506, test_loss: 3.3094, test_f1: 0.5881
 epoch: 84, train_loss: 0.2199, test_loss: 3.0662, test_f1: 0.6165
 epoch: 85, train_loss: 0.2060, test_loss: 3.1015, test_f1: 0.6061
 epoch: 86, train_loss: 0.1745, test_loss: 3.1609, test_f1: 0.6091
 epoch: 87, train_loss: 0.1659, test_loss: 3.2411, test_f1: 0.6033
 epoch: 88, train_loss: 0.1895, test_loss: 3.3546, test_f1: 0.6259
 epoch: 89, train_loss: 0.1742, test_loss: 3.2418, test_f1: 0.6069
 epoch: 90, train_loss: 0.1978, test_loss: 3.3716, test_f1: 0.6042
 epoch: 91, train_loss: 0.2022, test_loss: 3.2711, test_f1: 0.6148
 epoch: 92, train_loss: 0.1951, test_loss: 3.8358, test_f1: 0.5745
 epoch: 93, train_loss: 0.2383, test_loss: 3.5070, test_f1: 0.5784
 epoch: 94, train_loss: 0.2356, test_loss: 3.4375, test_f1: 0.5998
 epoch: 95, train_loss: 0.2169, test_loss: 2.9798, test_f1: 0.5917
 epoch: 96, train_loss: 0.1847, test_loss: 3.3146, test_f1: 0.6325
 epoch: 97, train_loss: 0.1882, test_loss: 3.4248, test_f1: 0.6361
 epoch: 98, train_loss: 0.1777, test_loss: 3.7196, test_f1: 0.5866
 epoch: 99, train_loss: 0.1922, test_loss: 3.2875, test_f1: 0.6110
##################ITERATION #9 ****************************************
 epoch: 0, train_loss: 1.3657, test_loss: 1.4378, test_f1: 0.1365
 epoch: 1, train_loss: 1.0799, test_loss: 1.1851, test_f1: 0.2857
 epoch: 2, train_loss: 0.9969, test_loss: 1.0656, test_f1: 0.4766
 epoch: 3, train_loss: 0.9592, test_loss: 1.0292, test_f1: 0.5314
 epoch: 4, train_loss: 0.9061, test_loss: 0.9691, test_f1: 0.5497
 epoch: 5, train_loss: 0.8721, test_loss: 0.9723, test_f1: 0.6032
 epoch: 6, train_loss: 0.8444, test_loss: 1.0099, test_f1: 0.5864
 epoch: 7, train_loss: 0.8624, test_loss: 1.0002, test_f1: 0.5969
 epoch: 8, train_loss: 0.8455, test_loss: 1.0770, test_f1: 0.6033
 epoch: 9, train_loss: 0.8425, test_loss: 1.1136, test_f1: 0.4919
 epoch: 10, train_loss: 0.8199, test_loss: 1.0313, test_f1: 0.5700
 epoch: 11, train_loss: 0.8006, test_loss: 1.0998, test_f1: 0.5849
 epoch: 12, train_loss: 0.8011, test_loss: 1.1026, test_f1: 0.6043
 epoch: 13, train_loss: 0.7526, test_loss: 1.0822, test_f1: 0.5464
 epoch: 14, train_loss: 0.7573, test_loss: 1.0668, test_f1: 0.5767
 epoch: 15, train_loss: 0.7243, test_loss: 1.0843, test_f1: 0.5878
 epoch: 16, train_loss: 0.7260, test_loss: 1.1771, test_f1: 0.6040
 epoch: 17, train_loss: 0.7233, test_loss: 1.2929, test_f1: 0.5807
 epoch: 18, train_loss: 0.7226, test_loss: 1.2451, test_f1: 0.6048
 epoch: 19, train_loss: 0.7111, test_loss: 1.2400, test_f1: 0.6054
 epoch: 20, train_loss: 0.6793, test_loss: 1.3321, test_f1: 0.5907
 epoch: 21, train_loss: 0.6736, test_loss: 1.4679, test_f1: 0.5289
 epoch: 22, train_loss: 0.6812, test_loss: 1.2100, test_f1: 0.6411
 epoch: 23, train_loss: 0.6551, test_loss: 1.4835, test_f1: 0.6054
 epoch: 24, train_loss: 0.6262, test_loss: 1.4287, test_f1: 0.6331
 epoch: 25, train_loss: 0.6741, test_loss: 1.2838, test_f1: 0.6167
 epoch: 26, train_loss: 0.6596, test_loss: 1.3866, test_f1: 0.5880
 epoch: 27, train_loss: 0.6222, test_loss: 1.6751, test_f1: 0.5984
 epoch: 28, train_loss: 0.5874, test_loss: 1.6450, test_f1: 0.6111
 epoch: 29, train_loss: 0.5706, test_loss: 1.4247, test_f1: 0.6102
 epoch: 30, train_loss: 0.5750, test_loss: 2.4135, test_f1: 0.4066
 epoch: 31, train_loss: 0.6254, test_loss: 1.7763, test_f1: 0.5411
 epoch: 32, train_loss: 0.5778, test_loss: 1.6131, test_f1: 0.5119
 epoch: 33, train_loss: 0.5356, test_loss: 1.7781, test_f1: 0.5823
 epoch: 34, train_loss: 0.5361, test_loss: 1.7418, test_f1: 0.5494
 epoch: 35, train_loss: 0.5553, test_loss: 1.5149, test_f1: 0.5905
 epoch: 36, train_loss: 0.5161, test_loss: 1.7647, test_f1: 0.5738
 epoch: 37, train_loss: 0.4997, test_loss: 1.6286, test_f1: 0.6219
 epoch: 38, train_loss: 0.5124, test_loss: 1.6495, test_f1: 0.6001
 epoch: 39, train_loss: 0.5155, test_loss: 1.6035, test_f1: 0.5881
 epoch: 40, train_loss: 0.4909, test_loss: 1.5656, test_f1: 0.5791
 epoch: 41, train_loss: 0.5178, test_loss: 2.1065, test_f1: 0.5555
 epoch: 42, train_loss: 0.5470, test_loss: 1.7162, test_f1: 0.5877
 epoch: 43, train_loss: 0.4852, test_loss: 1.5953, test_f1: 0.6265
 epoch: 44, train_loss: 0.4690, test_loss: 1.9971, test_f1: 0.5824
 epoch: 45, train_loss: 0.4505, test_loss: 1.8862, test_f1: 0.6001
 epoch: 46, train_loss: 0.4650, test_loss: 1.6981, test_f1: 0.6028
 epoch: 47, train_loss: 0.4264, test_loss: 1.5536, test_f1: 0.6262
 epoch: 48, train_loss: 0.4640, test_loss: 1.9104, test_f1: 0.6203
 epoch: 49, train_loss: 0.4118, test_loss: 1.8645, test_f1: 0.6159
 epoch: 50, train_loss: 0.4333, test_loss: 2.4275, test_f1: 0.5780
 epoch: 51, train_loss: 0.4586, test_loss: 2.3482, test_f1: 0.5645
 epoch: 52, train_loss: 0.4041, test_loss: 2.0090, test_f1: 0.5950
 epoch: 53, train_loss: 0.3515, test_loss: 2.3109, test_f1: 0.5992
 epoch: 54, train_loss: 0.3352, test_loss: 2.2024, test_f1: 0.6130
 epoch: 55, train_loss: 0.3129, test_loss: 2.3403, test_f1: 0.5901
 epoch: 56, train_loss: 0.3295, test_loss: 2.2645, test_f1: 0.6336
 epoch: 57, train_loss: 0.3092, test_loss: 2.5017, test_f1: 0.5907
 epoch: 58, train_loss: 0.3181, test_loss: 2.3866, test_f1: 0.6191
 epoch: 59, train_loss: 0.2731, test_loss: 2.3561, test_f1: 0.6341
 epoch: 60, train_loss: 0.3066, test_loss: 2.5413, test_f1: 0.6033
 epoch: 61, train_loss: 0.3189, test_loss: 2.2945, test_f1: 0.6170
 epoch: 62, train_loss: 0.2945, test_loss: 2.4640, test_f1: 0.6251
 epoch: 63, train_loss: 0.2883, test_loss: 2.5444, test_f1: 0.5960
 epoch: 64, train_loss: 0.2886, test_loss: 2.6408, test_f1: 0.6219
 epoch: 65, train_loss: 0.2615, test_loss: 2.6992, test_f1: 0.6061
 epoch: 66, train_loss: 0.2700, test_loss: 2.6485, test_f1: 0.6237
 epoch: 67, train_loss: 0.2660, test_loss: 2.6166, test_f1: 0.6314
 epoch: 68, train_loss: 0.2504, test_loss: 2.9255, test_f1: 0.6223
 epoch: 69, train_loss: 0.2532, test_loss: 2.9283, test_f1: 0.5798
 epoch: 70, train_loss: 0.2938, test_loss: 2.6384, test_f1: 0.6278
 epoch: 71, train_loss: 0.2837, test_loss: 2.6237, test_f1: 0.6270
 epoch: 72, train_loss: 0.2464, test_loss: 2.7012, test_f1: 0.5975
 epoch: 73, train_loss: 0.2392, test_loss: 2.8858, test_f1: 0.5867
 epoch: 74, train_loss: 0.2397, test_loss: 2.9452, test_f1: 0.6290
 epoch: 75, train_loss: 0.2921, test_loss: 3.1118, test_f1: 0.5838
 epoch: 76, train_loss: 0.2549, test_loss: 2.6994, test_f1: 0.6024
 epoch: 77, train_loss: 0.2271, test_loss: 2.8782, test_f1: 0.6165
 epoch: 78, train_loss: 0.2525, test_loss: 3.0125, test_f1: 0.5992
 epoch: 79, train_loss: 0.2689, test_loss: 2.9784, test_f1: 0.5876
 epoch: 80, train_loss: 0.2556, test_loss: 2.9441, test_f1: 0.6007
 epoch: 81, train_loss: 0.2486, test_loss: 3.0448, test_f1: 0.5884
 epoch: 82, train_loss: 0.2272, test_loss: 3.1116, test_f1: 0.6080
 epoch: 83, train_loss: 0.2026, test_loss: 3.0093, test_f1: 0.6240
 epoch: 84, train_loss: 0.2267, test_loss: 3.1211, test_f1: 0.6135
 epoch: 85, train_loss: 0.2258, test_loss: 2.9610, test_f1: 0.6085
 epoch: 86, train_loss: 0.2430, test_loss: 3.2098, test_f1: 0.6085
 epoch: 87, train_loss: 0.2374, test_loss: 3.3264, test_f1: 0.6299
 epoch: 88, train_loss: 0.2232, test_loss: 3.0936, test_f1: 0.6168
 epoch: 89, train_loss: 0.2219, test_loss: 3.0238, test_f1: 0.5995
 epoch: 90, train_loss: 0.2179, test_loss: 3.2070, test_f1: 0.5943
 epoch: 91, train_loss: 0.2085, test_loss: 3.3993, test_f1: 0.6146
 epoch: 92, train_loss: 0.1772, test_loss: 3.4469, test_f1: 0.5971
 epoch: 93, train_loss: 0.1764, test_loss: 3.2670, test_f1: 0.6088
 epoch: 94, train_loss: 0.2127, test_loss: 3.2595, test_f1: 0.6423
 epoch: 95, train_loss: 0.2172, test_loss: 3.1515, test_f1: 0.5980
 epoch: 96, train_loss: 0.1940, test_loss: 3.2863, test_f1: 0.6218
 epoch: 97, train_loss: 0.1944, test_loss: 3.1331, test_f1: 0.6056
 epoch: 98, train_loss: 0.1867, test_loss: 3.4317, test_f1: 0.6080
 epoch: 99, train_loss: 0.1674, test_loss: 3.8076, test_f1: 0.6016

Training completed in 506.32 seconds
Best F1: 0.6652 at epoch 57
Mean F1 across iterations: 0.6440  0.0103
========================FINAL RESULTS================================
FEGIN weighted F1: 0.6652  0.0103
python main.py --data ltspice_demos --representation component_net --model FEGIN --layers 5 --hiddens 128 --batch_size 64 --lr 0.001 --emb_size 250 --epochs 100 --save_appendix component_net_L5_H128_BS64_LR0.001_E250 --no_val
-----



STDERR:
  File "main.py", line 370, in <module>
    main()
  File "main.py", line 254, in main
    dataset = dataset_class(
  File "/home/philip/projects/ltspice_examples_code_repo/Circuit-Completion-Using-GNNs/component_classification_with_link_prediction_head/evaluation/FEGIN/kernel/circuit_datasets.py", line 15, in __init__
    self.data, self.slices = torch.load(self.processed_paths[0])
  File "/home/philip/.local/lib/python3.8/site-packages/torch/serialization.py", line 1040, in load
    warnings.warn(
  File "/usr/lib/python3.8/warnings.py", line 109, in _showwarnmsg
    sw(msg.message, msg.category, msg.filename, msg.lineno,
  File "main.py", line 47, in warn_with_traceback
    traceback.print_stack(file=log)
/home/philip/projects/ltspice_examples_code_repo/Circuit-Completion-Using-GNNs/component_classification_with_link_prediction_head/evaluation/FEGIN/kernel/circuit_datasets.py:15: FutureWarning: You are using `torch.load` with `weights_only=False` (the current default value), which uses the default pickle module implicitly. It is possible to construct malicious pickle data which will execute arbitrary code during unpickling (See https://github.com/pytorch/pytorch/blob/main/SECURITY.md#untrusted-models for more details). In a future release, the default value for `weights_only` will be flipped to `True`. This limits the functions that could be executed during unpickling. Arbitrary objects will no longer be allowed to be loaded via this mode unless they are explicitly allowlisted by the user via `torch.serialization.add_safe_globals`. We recommend you start setting `weights_only=True` for any use case where you don't have full control of the loaded file. Please open an issue on GitHub for any issues related to this experimental feature.
  self.data, self.slices = torch.load(self.processed_paths[0])
