STDOUT:
Results will be saved in /home/philip/projects/ltspice_examples_code_repo/Circuit-Completion-Using-GNNs/component_classification_with_link_prediction_head/evaluation/FEGIN/results/model_FEGIN_dataset_ltspice_demos
Command line input: python main.py --data ltspice_demos --representation component_pin --model FEGIN --layers 6 --hiddens 64 --batch_size 64 --lr 0.01 --emb_size 250 --epochs 100 --save_appendix component_pin_L6_H64_BS64_LR0.01_E250 --no_val
 is saved.
-----
ltspice_demos - FEGIN
Using 6 layers, 64 hidden units, h = 2
Loading component_pin representation dataset
ENTERED
Training FEGIN on component_pin representation
Train: 1565, Test: 383
##################ITERATION #0 ****************************************
 epoch: 0, train_loss: 1.2385, test_loss: 1.5024, test_f1: 0.3079
 epoch: 1, train_loss: 1.0763, test_loss: 1.2057, test_f1: 0.4456
 epoch: 2, train_loss: 1.0139, test_loss: 1.5559, test_f1: 0.2142
 epoch: 3, train_loss: 0.9999, test_loss: 1.5636, test_f1: 0.2575
 epoch: 4, train_loss: 0.9663, test_loss: 1.6055, test_f1: 0.3150
 epoch: 5, train_loss: 0.8972, test_loss: 0.9908, test_f1: 0.4788
 epoch: 6, train_loss: 0.8694, test_loss: 1.2139, test_f1: 0.5452
 epoch: 7, train_loss: 0.8456, test_loss: 1.1274, test_f1: 0.5874
 epoch: 8, train_loss: 0.8659, test_loss: 1.0800, test_f1: 0.5392
 epoch: 9, train_loss: 0.8244, test_loss: 1.4343, test_f1: 0.3943
 epoch: 10, train_loss: 0.7890, test_loss: 1.0642, test_f1: 0.4238
 epoch: 11, train_loss: 0.7877, test_loss: 1.0976, test_f1: 0.4787
 epoch: 12, train_loss: 0.7714, test_loss: 2.1573, test_f1: 0.3371
 epoch: 13, train_loss: 0.7429, test_loss: 1.0498, test_f1: 0.5885
 epoch: 14, train_loss: 0.7616, test_loss: 1.0925, test_f1: 0.5691
 epoch: 15, train_loss: 0.7640, test_loss: 1.2617, test_f1: 0.4807
 epoch: 16, train_loss: 0.7612, test_loss: 1.0447, test_f1: 0.6007
 epoch: 17, train_loss: 0.7860, test_loss: 1.2362, test_f1: 0.4846
 epoch: 18, train_loss: 0.7475, test_loss: 1.0852, test_f1: 0.5895
 epoch: 19, train_loss: 0.7038, test_loss: 1.0935, test_f1: 0.5969
 epoch: 20, train_loss: 0.7455, test_loss: 0.9231, test_f1: 0.6219
 epoch: 21, train_loss: 0.7156, test_loss: 0.9770, test_f1: 0.5295
 epoch: 22, train_loss: 0.7144, test_loss: 1.0206, test_f1: 0.6075
 epoch: 23, train_loss: 0.6914, test_loss: 1.2615, test_f1: 0.6059
 epoch: 24, train_loss: 0.6783, test_loss: 2.6461, test_f1: 0.3808
 epoch: 25, train_loss: 0.7152, test_loss: 1.3421, test_f1: 0.5298
 epoch: 26, train_loss: 0.7353, test_loss: 1.0010, test_f1: 0.5983
 epoch: 27, train_loss: 0.6767, test_loss: 1.5090, test_f1: 0.4970
 epoch: 28, train_loss: 0.6616, test_loss: 1.1093, test_f1: 0.4884
 epoch: 29, train_loss: 0.6794, test_loss: 1.1925, test_f1: 0.5692
 epoch: 30, train_loss: 0.6975, test_loss: 1.1688, test_f1: 0.5347
 epoch: 31, train_loss: 0.6779, test_loss: 0.9839, test_f1: 0.5964
 epoch: 32, train_loss: 0.6610, test_loss: 1.2845, test_f1: 0.4582
 epoch: 33, train_loss: 0.6830, test_loss: 1.2027, test_f1: 0.5676
 epoch: 34, train_loss: 0.6437, test_loss: 1.3186, test_f1: 0.5633
 epoch: 35, train_loss: 0.6699, test_loss: 1.0344, test_f1: 0.6066
 epoch: 36, train_loss: 0.6364, test_loss: 1.2210, test_f1: 0.6172
 epoch: 37, train_loss: 0.6837, test_loss: 1.1616, test_f1: 0.5734
 epoch: 38, train_loss: 0.6687, test_loss: 1.4061, test_f1: 0.5560
 epoch: 39, train_loss: 0.6415, test_loss: 1.3398, test_f1: 0.5108
 epoch: 40, train_loss: 0.6279, test_loss: 1.3992, test_f1: 0.5042
 epoch: 41, train_loss: 0.6056, test_loss: 1.4303, test_f1: 0.5825
 epoch: 42, train_loss: 0.5870, test_loss: 1.4413, test_f1: 0.5636
 epoch: 43, train_loss: 0.6033, test_loss: 1.0810, test_f1: 0.6312
 epoch: 44, train_loss: 0.6686, test_loss: 1.1280, test_f1: 0.5852
 epoch: 45, train_loss: 0.6080, test_loss: 1.4679, test_f1: 0.5470
 epoch: 46, train_loss: 0.5650, test_loss: 1.6108, test_f1: 0.5124
 epoch: 47, train_loss: 0.5906, test_loss: 1.4412, test_f1: 0.5689
 epoch: 48, train_loss: 0.5879, test_loss: 1.6063, test_f1: 0.6313
 epoch: 49, train_loss: 0.6010, test_loss: 1.9357, test_f1: 0.5082
 epoch: 50, train_loss: 0.6336, test_loss: 1.3897, test_f1: 0.5779
 epoch: 51, train_loss: 0.5850, test_loss: 1.6008, test_f1: 0.6000
 epoch: 52, train_loss: 0.5233, test_loss: 1.5825, test_f1: 0.6009
 epoch: 53, train_loss: 0.5216, test_loss: 1.5648, test_f1: 0.6083
 epoch: 54, train_loss: 0.4994, test_loss: 1.6460, test_f1: 0.6271
 epoch: 55, train_loss: 0.4786, test_loss: 1.9937, test_f1: 0.5635
 epoch: 56, train_loss: 0.5186, test_loss: 1.6278, test_f1: 0.5610
 epoch: 57, train_loss: 0.4873, test_loss: 1.7974, test_f1: 0.6113
 epoch: 58, train_loss: 0.4805, test_loss: 1.7725, test_f1: 0.6595
 epoch: 59, train_loss: 0.4722, test_loss: 1.7551, test_f1: 0.5992
 epoch: 60, train_loss: 0.4711, test_loss: 1.8061, test_f1: 0.6570
 epoch: 61, train_loss: 0.4628, test_loss: 1.9415, test_f1: 0.6364
 epoch: 62, train_loss: 0.4862, test_loss: 1.8832, test_f1: 0.6562
 epoch: 63, train_loss: 0.4543, test_loss: 1.8290, test_f1: 0.5825
 epoch: 64, train_loss: 0.4352, test_loss: 1.8746, test_f1: 0.6109
 epoch: 65, train_loss: 0.4527, test_loss: 1.9279, test_f1: 0.6355
 epoch: 66, train_loss: 0.4372, test_loss: 1.9504, test_f1: 0.6241
 epoch: 67, train_loss: 0.4302, test_loss: 1.9949, test_f1: 0.5765
 epoch: 68, train_loss: 0.4478, test_loss: 2.0007, test_f1: 0.5854
 epoch: 69, train_loss: 0.3986, test_loss: 2.1718, test_f1: 0.5942
 epoch: 70, train_loss: 0.4189, test_loss: 2.1627, test_f1: 0.5873
 epoch: 71, train_loss: 0.4271, test_loss: 2.1433, test_f1: 0.5867
 epoch: 72, train_loss: 0.4511, test_loss: 2.1011, test_f1: 0.5599
 epoch: 73, train_loss: 0.4375, test_loss: 2.1664, test_f1: 0.5694
 epoch: 74, train_loss: 0.3960, test_loss: 2.1839, test_f1: 0.6586
 epoch: 75, train_loss: 0.3913, test_loss: 2.3686, test_f1: 0.6628
 epoch: 76, train_loss: 0.3976, test_loss: 2.1090, test_f1: 0.6382
 epoch: 77, train_loss: 0.3669, test_loss: 2.3743, test_f1: 0.5798
 epoch: 78, train_loss: 0.3723, test_loss: 2.4350, test_f1: 0.6087
 epoch: 79, train_loss: 0.3755, test_loss: 2.4306, test_f1: 0.6245
 epoch: 80, train_loss: 0.3714, test_loss: 2.7450, test_f1: 0.5939
 epoch: 81, train_loss: 0.3722, test_loss: 2.5098, test_f1: 0.5683
 epoch: 82, train_loss: 0.3380, test_loss: 2.2939, test_f1: 0.6213
 epoch: 83, train_loss: 0.3538, test_loss: 2.4478, test_f1: 0.6197
 epoch: 84, train_loss: 0.3403, test_loss: 2.3062, test_f1: 0.5580
 epoch: 85, train_loss: 0.3589, test_loss: 2.4948, test_f1: 0.6320
 epoch: 86, train_loss: 0.4080, test_loss: 2.1162, test_f1: 0.5792
 epoch: 87, train_loss: 0.3495, test_loss: 2.0221, test_f1: 0.6345
 epoch: 88, train_loss: 0.3318, test_loss: 2.3791, test_f1: 0.6564
 epoch: 89, train_loss: 0.2979, test_loss: 2.8182, test_f1: 0.6549
 epoch: 90, train_loss: 0.3465, test_loss: 2.4209, test_f1: 0.6286
 epoch: 91, train_loss: 0.3463, test_loss: 2.4372, test_f1: 0.6439
 epoch: 92, train_loss: 0.3331, test_loss: 2.8405, test_f1: 0.6081
 epoch: 93, train_loss: 0.3073, test_loss: 2.4719, test_f1: 0.6583
 epoch: 94, train_loss: 0.3993, test_loss: 2.2594, test_f1: 0.6318
 epoch: 95, train_loss: 0.3498, test_loss: 2.0466, test_f1: 0.6833
 epoch: 96, train_loss: 0.3195, test_loss: 2.3526, test_f1: 0.6519
 epoch: 97, train_loss: 0.3038, test_loss: 2.5425, test_f1: 0.6669
 epoch: 98, train_loss: 0.3221, test_loss: 2.8237, test_f1: 0.6265
 epoch: 99, train_loss: 0.3084, test_loss: 2.3649, test_f1: 0.6267
##################ITERATION #1 ****************************************
 epoch: 0, train_loss: 1.1955, test_loss: 1.3020, test_f1: 0.2504
 epoch: 1, train_loss: 0.9781, test_loss: 1.1056, test_f1: 0.4807
 epoch: 2, train_loss: 0.9400, test_loss: 1.0371, test_f1: 0.5204
 epoch: 3, train_loss: 0.8678, test_loss: 1.0526, test_f1: 0.5307
 epoch: 4, train_loss: 0.8733, test_loss: 1.0379, test_f1: 0.5071
 epoch: 5, train_loss: 0.8554, test_loss: 1.0797, test_f1: 0.4853
 epoch: 6, train_loss: 0.8094, test_loss: 0.9394, test_f1: 0.5555
 epoch: 7, train_loss: 0.7982, test_loss: 1.4491, test_f1: 0.4496
 epoch: 8, train_loss: 0.7967, test_loss: 1.0692, test_f1: 0.5506
 epoch: 9, train_loss: 0.8465, test_loss: 1.8582, test_f1: 0.6238
 epoch: 10, train_loss: 0.7737, test_loss: 1.1350, test_f1: 0.4812
 epoch: 11, train_loss: 0.7658, test_loss: 1.1824, test_f1: 0.5119
 epoch: 12, train_loss: 0.7602, test_loss: 1.0365, test_f1: 0.5019
 epoch: 13, train_loss: 0.7596, test_loss: 1.1313, test_f1: 0.6020
 epoch: 14, train_loss: 0.7570, test_loss: 1.3031, test_f1: 0.5364
 epoch: 15, train_loss: 0.7337, test_loss: 1.1309, test_f1: 0.5251
 epoch: 16, train_loss: 0.7114, test_loss: 2.3059, test_f1: 0.3899
 epoch: 17, train_loss: 0.7596, test_loss: 1.6164, test_f1: 0.5594
 epoch: 18, train_loss: 0.7092, test_loss: 1.2842, test_f1: 0.4990
 epoch: 19, train_loss: 0.7098, test_loss: 1.0061, test_f1: 0.5108
 epoch: 20, train_loss: 0.7335, test_loss: 1.0234, test_f1: 0.6058
 epoch: 21, train_loss: 0.7099, test_loss: 1.0105, test_f1: 0.6016
 epoch: 22, train_loss: 0.7032, test_loss: 1.1139, test_f1: 0.4992
 epoch: 23, train_loss: 0.6678, test_loss: 0.9994, test_f1: 0.5893
 epoch: 24, train_loss: 0.6546, test_loss: 1.1933, test_f1: 0.5901
 epoch: 25, train_loss: 0.6513, test_loss: 1.4811, test_f1: 0.5413
 epoch: 26, train_loss: 0.6793, test_loss: 1.9148, test_f1: 0.4535
 epoch: 27, train_loss: 0.6780, test_loss: 1.2229, test_f1: 0.5896
 epoch: 28, train_loss: 0.6407, test_loss: 1.3407, test_f1: 0.4325
 epoch: 29, train_loss: 0.6417, test_loss: 1.1190, test_f1: 0.5556
 epoch: 30, train_loss: 0.6504, test_loss: 1.0243, test_f1: 0.5994
 epoch: 31, train_loss: 0.6248, test_loss: 1.2270, test_f1: 0.5558
 epoch: 32, train_loss: 0.6691, test_loss: 1.1531, test_f1: 0.5058
 epoch: 33, train_loss: 0.6080, test_loss: 1.3289, test_f1: 0.6089
 epoch: 34, train_loss: 0.6332, test_loss: 1.1115, test_f1: 0.5001
 epoch: 35, train_loss: 0.6356, test_loss: 1.2450, test_f1: 0.5802
 epoch: 36, train_loss: 0.6632, test_loss: 1.0877, test_f1: 0.5608
 epoch: 37, train_loss: 0.6184, test_loss: 1.2927, test_f1: 0.4980
 epoch: 38, train_loss: 0.5993, test_loss: 1.4781, test_f1: 0.5412
 epoch: 39, train_loss: 0.5944, test_loss: 1.3399, test_f1: 0.5545
 epoch: 40, train_loss: 0.6125, test_loss: 1.5084, test_f1: 0.4979
 epoch: 41, train_loss: 0.5947, test_loss: 1.9920, test_f1: 0.4954
 epoch: 42, train_loss: 0.5774, test_loss: 1.3057, test_f1: 0.6009
 epoch: 43, train_loss: 0.5797, test_loss: 1.2539, test_f1: 0.6489
 epoch: 44, train_loss: 0.5632, test_loss: 1.2120, test_f1: 0.6422
 epoch: 45, train_loss: 0.5910, test_loss: 1.6995, test_f1: 0.5975
 epoch: 46, train_loss: 0.5597, test_loss: 1.4761, test_f1: 0.5568
 epoch: 47, train_loss: 0.5497, test_loss: 1.5310, test_f1: 0.5660
 epoch: 48, train_loss: 0.5686, test_loss: 1.1905, test_f1: 0.5327
 epoch: 49, train_loss: 0.5688, test_loss: 1.2225, test_f1: 0.6362
 epoch: 50, train_loss: 0.5185, test_loss: 1.4935, test_f1: 0.5674
 epoch: 51, train_loss: 0.4918, test_loss: 1.4189, test_f1: 0.5632
 epoch: 52, train_loss: 0.4910, test_loss: 1.4818, test_f1: 0.6388
 epoch: 53, train_loss: 0.4653, test_loss: 1.6342, test_f1: 0.5693
 epoch: 54, train_loss: 0.4459, test_loss: 1.5359, test_f1: 0.5964
 epoch: 55, train_loss: 0.4553, test_loss: 1.4269, test_f1: 0.6162
 epoch: 56, train_loss: 0.4746, test_loss: 1.7383, test_f1: 0.6123
 epoch: 57, train_loss: 0.4596, test_loss: 1.3701, test_f1: 0.5862
 epoch: 58, train_loss: 0.4441, test_loss: 1.8134, test_f1: 0.5500
 epoch: 59, train_loss: 0.4401, test_loss: 1.6977, test_f1: 0.6119
 epoch: 60, train_loss: 0.4415, test_loss: 1.5829, test_f1: 0.6468
 epoch: 61, train_loss: 0.4119, test_loss: 1.3642, test_f1: 0.6417
 epoch: 62, train_loss: 0.4030, test_loss: 1.5883, test_f1: 0.6190
 epoch: 63, train_loss: 0.3931, test_loss: 1.7928, test_f1: 0.5748
 epoch: 64, train_loss: 0.4011, test_loss: 1.7093, test_f1: 0.6317
 epoch: 65, train_loss: 0.4093, test_loss: 1.9367, test_f1: 0.5599
 epoch: 66, train_loss: 0.3848, test_loss: 1.6517, test_f1: 0.6156
 epoch: 67, train_loss: 0.3436, test_loss: 1.9451, test_f1: 0.6074
 epoch: 68, train_loss: 0.3660, test_loss: 1.9751, test_f1: 0.5946
 epoch: 69, train_loss: 0.3969, test_loss: 1.9605, test_f1: 0.6090
 epoch: 70, train_loss: 0.3840, test_loss: 1.5568, test_f1: 0.6384
 epoch: 71, train_loss: 0.3860, test_loss: 1.7215, test_f1: 0.6268
 epoch: 72, train_loss: 0.3605, test_loss: 1.7851, test_f1: 0.6347
 epoch: 73, train_loss: 0.3845, test_loss: 1.7280, test_f1: 0.5982
 epoch: 74, train_loss: 0.3516, test_loss: 2.1258, test_f1: 0.6052
 epoch: 75, train_loss: 0.3644, test_loss: 1.8227, test_f1: 0.6154
 epoch: 76, train_loss: 0.3326, test_loss: 1.7961, test_f1: 0.6247
 epoch: 77, train_loss: 0.3421, test_loss: 1.7311, test_f1: 0.6429
 epoch: 78, train_loss: 0.3590, test_loss: 1.8564, test_f1: 0.6412
 epoch: 79, train_loss: 0.3396, test_loss: 1.9349, test_f1: 0.6337
 epoch: 80, train_loss: 0.3377, test_loss: 2.1673, test_f1: 0.5667
 epoch: 81, train_loss: 0.3132, test_loss: 2.1506, test_f1: 0.6274
 epoch: 82, train_loss: 0.3467, test_loss: 1.7495, test_f1: 0.6443
 epoch: 83, train_loss: 0.3036, test_loss: 2.1431, test_f1: 0.6202
 epoch: 84, train_loss: 0.3032, test_loss: 1.8860, test_f1: 0.6439
 epoch: 85, train_loss: 0.3145, test_loss: 2.1244, test_f1: 0.6166
 epoch: 86, train_loss: 0.3022, test_loss: 2.2094, test_f1: 0.6139
 epoch: 87, train_loss: 0.3058, test_loss: 2.2401, test_f1: 0.6359
 epoch: 88, train_loss: 0.2923, test_loss: 2.2322, test_f1: 0.6087
 epoch: 89, train_loss: 0.2966, test_loss: 1.8129, test_f1: 0.6242
 epoch: 90, train_loss: 0.2859, test_loss: 2.6259, test_f1: 0.6205
 epoch: 91, train_loss: 0.2967, test_loss: 2.1275, test_f1: 0.5989
 epoch: 92, train_loss: 0.2860, test_loss: 2.4287, test_f1: 0.6275
 epoch: 93, train_loss: 0.3143, test_loss: 2.4047, test_f1: 0.6012
 epoch: 94, train_loss: 0.3165, test_loss: 2.4165, test_f1: 0.6319
 epoch: 95, train_loss: 0.2861, test_loss: 2.4064, test_f1: 0.6250
 epoch: 96, train_loss: 0.2891, test_loss: 1.9178, test_f1: 0.6771
 epoch: 97, train_loss: 0.2810, test_loss: 2.2726, test_f1: 0.6176
 epoch: 98, train_loss: 0.2462, test_loss: 2.6104, test_f1: 0.6509
 epoch: 99, train_loss: 0.2540, test_loss: 2.6233, test_f1: 0.6290
##################ITERATION #2 ****************************************
 epoch: 0, train_loss: 1.2452, test_loss: 1.3986, test_f1: 0.2666
 epoch: 1, train_loss: 0.9862, test_loss: 1.1224, test_f1: 0.4646
 epoch: 2, train_loss: 0.9654, test_loss: 1.0124, test_f1: 0.5300
 epoch: 3, train_loss: 0.9063, test_loss: 1.0471, test_f1: 0.5146
 epoch: 4, train_loss: 0.8869, test_loss: 1.0666, test_f1: 0.5350
 epoch: 5, train_loss: 0.8561, test_loss: 0.9988, test_f1: 0.5220
 epoch: 6, train_loss: 0.8442, test_loss: 0.9507, test_f1: 0.5606
 epoch: 7, train_loss: 0.8312, test_loss: 1.0292, test_f1: 0.5889
 epoch: 8, train_loss: 0.8309, test_loss: 1.1321, test_f1: 0.4840
 epoch: 9, train_loss: 0.8093, test_loss: 1.0928, test_f1: 0.5709
 epoch: 10, train_loss: 0.7967, test_loss: 0.9861, test_f1: 0.5593
 epoch: 11, train_loss: 0.8049, test_loss: 1.2006, test_f1: 0.4442
 epoch: 12, train_loss: 0.8015, test_loss: 1.1952, test_f1: 0.5121
 epoch: 13, train_loss: 0.7980, test_loss: 0.9892, test_f1: 0.5359
 epoch: 14, train_loss: 0.7800, test_loss: 1.0224, test_f1: 0.6042
 epoch: 15, train_loss: 0.7243, test_loss: 1.2032, test_f1: 0.5934
 epoch: 16, train_loss: 0.7369, test_loss: 0.9732, test_f1: 0.5500
 epoch: 17, train_loss: 0.7265, test_loss: 1.2053, test_f1: 0.4864
 epoch: 18, train_loss: 0.7403, test_loss: 1.1705, test_f1: 0.5668
 epoch: 19, train_loss: 0.7025, test_loss: 1.0847, test_f1: 0.5908
 epoch: 20, train_loss: 0.7353, test_loss: 1.1081, test_f1: 0.6016
 epoch: 21, train_loss: 0.7109, test_loss: 1.1766, test_f1: 0.4662
 epoch: 22, train_loss: 0.6815, test_loss: 1.1030, test_f1: 0.5496
 epoch: 23, train_loss: 0.7342, test_loss: 1.0729, test_f1: 0.5364
 epoch: 24, train_loss: 0.6948, test_loss: 1.2208, test_f1: 0.5282
 epoch: 25, train_loss: 0.6951, test_loss: 1.1904, test_f1: 0.5505
 epoch: 26, train_loss: 0.6628, test_loss: 1.2177, test_f1: 0.5554
 epoch: 27, train_loss: 0.7057, test_loss: 1.0626, test_f1: 0.6147
 epoch: 28, train_loss: 0.6979, test_loss: 1.1471, test_f1: 0.5872
 epoch: 29, train_loss: 0.6669, test_loss: 1.2199, test_f1: 0.5524
 epoch: 30, train_loss: 0.6874, test_loss: 1.0316, test_f1: 0.6038
 epoch: 31, train_loss: 0.6455, test_loss: 1.0193, test_f1: 0.5861
 epoch: 32, train_loss: 0.6767, test_loss: 1.1761, test_f1: 0.5637
 epoch: 33, train_loss: 0.6598, test_loss: 1.4688, test_f1: 0.5173
 epoch: 34, train_loss: 0.6644, test_loss: 1.0193, test_f1: 0.6110
 epoch: 35, train_loss: 0.6192, test_loss: 1.0777, test_f1: 0.5864
 epoch: 36, train_loss: 0.6249, test_loss: 1.2663, test_f1: 0.5946
 epoch: 37, train_loss: 0.6167, test_loss: 1.0855, test_f1: 0.5871
 epoch: 38, train_loss: 0.6360, test_loss: 1.3905, test_f1: 0.5402
 epoch: 39, train_loss: 0.6104, test_loss: 1.0860, test_f1: 0.5896
 epoch: 40, train_loss: 0.5985, test_loss: 1.1926, test_f1: 0.6011
 epoch: 41, train_loss: 0.6022, test_loss: 1.0733, test_f1: 0.6009
 epoch: 42, train_loss: 0.6258, test_loss: 1.0524, test_f1: 0.6020
 epoch: 43, train_loss: 0.6136, test_loss: 1.1605, test_f1: 0.5891
 epoch: 44, train_loss: 0.5854, test_loss: 1.1255, test_f1: 0.5859
 epoch: 45, train_loss: 0.5866, test_loss: 1.3921, test_f1: 0.5726
 epoch: 46, train_loss: 0.6177, test_loss: 1.0698, test_f1: 0.6228
 epoch: 47, train_loss: 0.5728, test_loss: 1.2537, test_f1: 0.4641
 epoch: 48, train_loss: 0.5805, test_loss: 1.4613, test_f1: 0.5541
 epoch: 49, train_loss: 0.5747, test_loss: 1.2848, test_f1: 0.5993
 epoch: 50, train_loss: 0.5915, test_loss: 1.2626, test_f1: 0.5421
 epoch: 51, train_loss: 0.5597, test_loss: 1.5335, test_f1: 0.5222
 epoch: 52, train_loss: 0.5281, test_loss: 1.3525, test_f1: 0.6359
 epoch: 53, train_loss: 0.5033, test_loss: 1.2678, test_f1: 0.6066
 epoch: 54, train_loss: 0.4757, test_loss: 1.3990, test_f1: 0.6018
 epoch: 55, train_loss: 0.4847, test_loss: 1.8673, test_f1: 0.6084
 epoch: 56, train_loss: 0.4767, test_loss: 1.6962, test_f1: 0.6190
 epoch: 57, train_loss: 0.5008, test_loss: 1.5824, test_f1: 0.6196
 epoch: 58, train_loss: 0.4788, test_loss: 1.7083, test_f1: 0.5586
 epoch: 59, train_loss: 0.4671, test_loss: 1.4775, test_f1: 0.5837
 epoch: 60, train_loss: 0.4541, test_loss: 1.7626, test_f1: 0.5833
 epoch: 61, train_loss: 0.4859, test_loss: 1.4837, test_f1: 0.5805
 epoch: 62, train_loss: 0.4555, test_loss: 1.4907, test_f1: 0.6515
 epoch: 63, train_loss: 0.4669, test_loss: 1.3207, test_f1: 0.5903
 epoch: 64, train_loss: 0.4217, test_loss: 1.6945, test_f1: 0.6160
 epoch: 65, train_loss: 0.4357, test_loss: 1.5668, test_f1: 0.6329
 epoch: 66, train_loss: 0.3992, test_loss: 1.5245, test_f1: 0.6105
 epoch: 67, train_loss: 0.4063, test_loss: 1.6591, test_f1: 0.6021
 epoch: 68, train_loss: 0.4417, test_loss: 1.6424, test_f1: 0.6073
 epoch: 69, train_loss: 0.4053, test_loss: 1.7599, test_f1: 0.5860
 epoch: 70, train_loss: 0.4122, test_loss: 1.6988, test_f1: 0.6079
 epoch: 71, train_loss: 0.4292, test_loss: 1.7726, test_f1: 0.5911
 epoch: 72, train_loss: 0.3949, test_loss: 1.7213, test_f1: 0.6070
 epoch: 73, train_loss: 0.4485, test_loss: 1.8327, test_f1: 0.5763
 epoch: 74, train_loss: 0.4068, test_loss: 1.9042, test_f1: 0.6234
 epoch: 75, train_loss: 0.4093, test_loss: 1.6078, test_f1: 0.5683
 epoch: 76, train_loss: 0.4070, test_loss: 1.4231, test_f1: 0.6260
 epoch: 77, train_loss: 0.3960, test_loss: 2.5901, test_f1: 0.6255
 epoch: 78, train_loss: 0.3928, test_loss: 1.8522, test_f1: 0.6413
 epoch: 79, train_loss: 0.4090, test_loss: 2.0235, test_f1: 0.5438
 epoch: 80, train_loss: 0.3756, test_loss: 2.1071, test_f1: 0.6297
 epoch: 81, train_loss: 0.3789, test_loss: 1.8124, test_f1: 0.6181
 epoch: 82, train_loss: 0.3897, test_loss: 1.9164, test_f1: 0.5915
 epoch: 83, train_loss: 0.3908, test_loss: 1.8394, test_f1: 0.6031
 epoch: 84, train_loss: 0.3651, test_loss: 1.6670, test_f1: 0.5997
 epoch: 85, train_loss: 0.3612, test_loss: 1.6694, test_f1: 0.5962
 epoch: 86, train_loss: 0.3450, test_loss: 1.9403, test_f1: 0.6265
 epoch: 87, train_loss: 0.3506, test_loss: 1.9170, test_f1: 0.5981
 epoch: 88, train_loss: 0.3903, test_loss: 1.7397, test_f1: 0.6149
 epoch: 89, train_loss: 0.3837, test_loss: 1.8802, test_f1: 0.5767
 epoch: 90, train_loss: 0.3531, test_loss: 2.0457, test_f1: 0.6092
 epoch: 91, train_loss: 0.3507, test_loss: 1.7068, test_f1: 0.5997
 epoch: 92, train_loss: 0.3352, test_loss: 2.0051, test_f1: 0.5986
 epoch: 93, train_loss: 0.3280, test_loss: 2.2848, test_f1: 0.5949
 epoch: 94, train_loss: 0.3764, test_loss: 2.3473, test_f1: 0.5851
 epoch: 95, train_loss: 0.3376, test_loss: 2.0268, test_f1: 0.5546
 epoch: 96, train_loss: 0.3121, test_loss: 2.0330, test_f1: 0.6438
 epoch: 97, train_loss: 0.3253, test_loss: 1.9903, test_f1: 0.5913
 epoch: 98, train_loss: 0.3122, test_loss: 2.1322, test_f1: 0.6022
 epoch: 99, train_loss: 0.3338, test_loss: 2.4721, test_f1: 0.6278
##################ITERATION #3 ****************************************
 epoch: 0, train_loss: 1.2567, test_loss: 1.1869, test_f1: 0.4347
 epoch: 1, train_loss: 1.0069, test_loss: 1.1193, test_f1: 0.4916
 epoch: 2, train_loss: 0.9562, test_loss: 1.0821, test_f1: 0.4715
 epoch: 3, train_loss: 0.9031, test_loss: 0.9688, test_f1: 0.4862
 epoch: 4, train_loss: 0.9003, test_loss: 1.0470, test_f1: 0.4778
 epoch: 5, train_loss: 0.8963, test_loss: 1.0176, test_f1: 0.5399
 epoch: 6, train_loss: 0.8365, test_loss: 1.0154, test_f1: 0.6002
 epoch: 7, train_loss: 0.7962, test_loss: 1.5500, test_f1: 0.4485
 epoch: 8, train_loss: 0.8029, test_loss: 1.0254, test_f1: 0.6222
 epoch: 9, train_loss: 0.7819, test_loss: 1.0886, test_f1: 0.5349
 epoch: 10, train_loss: 0.7884, test_loss: 1.5321, test_f1: 0.4370
 epoch: 11, train_loss: 0.7936, test_loss: 0.9656, test_f1: 0.6093
 epoch: 12, train_loss: 0.7479, test_loss: 1.0083, test_f1: 0.6021
 epoch: 13, train_loss: 0.7158, test_loss: 1.1392, test_f1: 0.5968
 epoch: 14, train_loss: 0.7132, test_loss: 1.2035, test_f1: 0.5745
 epoch: 15, train_loss: 0.7197, test_loss: 1.0299, test_f1: 0.5802
 epoch: 16, train_loss: 0.7319, test_loss: 1.5157, test_f1: 0.4690
 epoch: 17, train_loss: 0.7127, test_loss: 1.1416, test_f1: 0.5467
 epoch: 18, train_loss: 0.6978, test_loss: 1.5584, test_f1: 0.4626
 epoch: 19, train_loss: 0.6898, test_loss: 1.4817, test_f1: 0.4462
 epoch: 20, train_loss: 0.7340, test_loss: 1.1251, test_f1: 0.5340
 epoch: 21, train_loss: 0.6859, test_loss: 0.9935, test_f1: 0.5479
 epoch: 22, train_loss: 0.6602, test_loss: 1.4111, test_f1: 0.5602
 epoch: 23, train_loss: 0.7057, test_loss: 1.4337, test_f1: 0.4821
 epoch: 24, train_loss: 0.6944, test_loss: 1.1373, test_f1: 0.5634
 epoch: 25, train_loss: 0.6851, test_loss: 1.2924, test_f1: 0.4998
 epoch: 26, train_loss: 0.6443, test_loss: 1.1126, test_f1: 0.5547
 epoch: 27, train_loss: 0.6809, test_loss: 1.0095, test_f1: 0.5980
 epoch: 28, train_loss: 0.6740, test_loss: 1.2811, test_f1: 0.5791
 epoch: 29, train_loss: 0.6456, test_loss: 1.1662, test_f1: 0.5584
 epoch: 30, train_loss: 0.6242, test_loss: 1.3971, test_f1: 0.5789
 epoch: 31, train_loss: 0.6619, test_loss: 1.1817, test_f1: 0.5338
 epoch: 32, train_loss: 0.6760, test_loss: 1.0523, test_f1: 0.5895
 epoch: 33, train_loss: 0.6725, test_loss: 1.2517, test_f1: 0.5835
 epoch: 34, train_loss: 0.6734, test_loss: 1.0956, test_f1: 0.6311
 epoch: 35, train_loss: 0.6714, test_loss: 1.1151, test_f1: 0.5890
 epoch: 36, train_loss: 0.6369, test_loss: 1.3924, test_f1: 0.5530
 epoch: 37, train_loss: 0.6104, test_loss: 1.0885, test_f1: 0.5909
 epoch: 38, train_loss: 0.6214, test_loss: 1.2226, test_f1: 0.5258
 epoch: 39, train_loss: 0.6254, test_loss: 1.4820, test_f1: 0.5389
 epoch: 40, train_loss: 0.6528, test_loss: 1.2113, test_f1: 0.6338
 epoch: 41, train_loss: 0.6258, test_loss: 1.1713, test_f1: 0.5144
 epoch: 42, train_loss: 0.6494, test_loss: 1.2433, test_f1: 0.5605
 epoch: 43, train_loss: 0.5992, test_loss: 1.0516, test_f1: 0.6148
 epoch: 44, train_loss: 0.6085, test_loss: 1.2298, test_f1: 0.4792
 epoch: 45, train_loss: 0.5937, test_loss: 1.1331, test_f1: 0.5766
 epoch: 46, train_loss: 0.5519, test_loss: 1.1776, test_f1: 0.6152
 epoch: 47, train_loss: 0.5637, test_loss: 1.5625, test_f1: 0.6212
 epoch: 48, train_loss: 0.5670, test_loss: 1.0762, test_f1: 0.5757
 epoch: 49, train_loss: 0.6048, test_loss: 1.1897, test_f1: 0.6007
 epoch: 50, train_loss: 0.5365, test_loss: 1.1511, test_f1: 0.6375
 epoch: 51, train_loss: 0.5274, test_loss: 1.4380, test_f1: 0.6038
 epoch: 52, train_loss: 0.4914, test_loss: 1.1548, test_f1: 0.6545
 epoch: 53, train_loss: 0.4676, test_loss: 1.0912, test_f1: 0.6049
 epoch: 54, train_loss: 0.4781, test_loss: 1.2767, test_f1: 0.5803
 epoch: 55, train_loss: 0.4554, test_loss: 1.4528, test_f1: 0.5821
 epoch: 56, train_loss: 0.4669, test_loss: 1.4450, test_f1: 0.6154
 epoch: 57, train_loss: 0.4526, test_loss: 1.3633, test_f1: 0.5780
 epoch: 58, train_loss: 0.4479, test_loss: 1.5832, test_f1: 0.5745
 epoch: 59, train_loss: 0.4797, test_loss: 1.4121, test_f1: 0.6057
 epoch: 60, train_loss: 0.4578, test_loss: 1.3367, test_f1: 0.6281
 epoch: 61, train_loss: 0.4186, test_loss: 1.3736, test_f1: 0.5873
 epoch: 62, train_loss: 0.4088, test_loss: 1.4920, test_f1: 0.6230
 epoch: 63, train_loss: 0.4003, test_loss: 1.5662, test_f1: 0.5920
 epoch: 64, train_loss: 0.4172, test_loss: 1.6365, test_f1: 0.6384
 epoch: 65, train_loss: 0.4304, test_loss: 1.2777, test_f1: 0.6721
 epoch: 66, train_loss: 0.4146, test_loss: 1.4358, test_f1: 0.6461
 epoch: 67, train_loss: 0.3723, test_loss: 1.4063, test_f1: 0.6322
 epoch: 68, train_loss: 0.3834, test_loss: 1.3319, test_f1: 0.6067
 epoch: 69, train_loss: 0.3875, test_loss: 1.5433, test_f1: 0.6294
 epoch: 70, train_loss: 0.3827, test_loss: 1.3930, test_f1: 0.6260
 epoch: 71, train_loss: 0.3729, test_loss: 1.4950, test_f1: 0.6175
 epoch: 72, train_loss: 0.4123, test_loss: 1.4039, test_f1: 0.6632
 epoch: 73, train_loss: 0.3611, test_loss: 1.6787, test_f1: 0.5765
 epoch: 74, train_loss: 0.3895, test_loss: 1.5327, test_f1: 0.6028
 epoch: 75, train_loss: 0.3644, test_loss: 1.7053, test_f1: 0.6212
 epoch: 76, train_loss: 0.3783, test_loss: 1.3966, test_f1: 0.6225
 epoch: 77, train_loss: 0.3557, test_loss: 1.4954, test_f1: 0.5756
 epoch: 78, train_loss: 0.3814, test_loss: 1.8991, test_f1: 0.5589
 epoch: 79, train_loss: 0.3647, test_loss: 1.7629, test_f1: 0.6383
 epoch: 80, train_loss: 0.3558, test_loss: 1.7021, test_f1: 0.5676
 epoch: 81, train_loss: 0.3797, test_loss: 1.3931, test_f1: 0.6084
 epoch: 82, train_loss: 0.3507, test_loss: 1.5616, test_f1: 0.6502
 epoch: 83, train_loss: 0.3291, test_loss: 1.6397, test_f1: 0.6325
 epoch: 84, train_loss: 0.3297, test_loss: 1.9905, test_f1: 0.6126
 epoch: 85, train_loss: 0.3156, test_loss: 1.5671, test_f1: 0.6262
 epoch: 86, train_loss: 0.2981, test_loss: 1.5812, test_f1: 0.5850
 epoch: 87, train_loss: 0.2958, test_loss: 1.7222, test_f1: 0.6342
 epoch: 88, train_loss: 0.2812, test_loss: 1.7992, test_f1: 0.6237
 epoch: 89, train_loss: 0.2741, test_loss: 1.6487, test_f1: 0.6248
 epoch: 90, train_loss: 0.2851, test_loss: 1.8226, test_f1: 0.6358
 epoch: 91, train_loss: 0.3024, test_loss: 1.5540, test_f1: 0.6179
 epoch: 92, train_loss: 0.2622, test_loss: 1.6266, test_f1: 0.5923
 epoch: 93, train_loss: 0.2815, test_loss: 2.1297, test_f1: 0.5907
 epoch: 94, train_loss: 0.2834, test_loss: 1.7346, test_f1: 0.6530
 epoch: 95, train_loss: 0.2903, test_loss: 1.5767, test_f1: 0.6355
 epoch: 96, train_loss: 0.2744, test_loss: 1.6331, test_f1: 0.6289
 epoch: 97, train_loss: 0.2489, test_loss: 1.8216, test_f1: 0.6495
 epoch: 98, train_loss: 0.2724, test_loss: 1.5411, test_f1: 0.6137
 epoch: 99, train_loss: 0.2573, test_loss: 1.8594, test_f1: 0.6264
##################ITERATION #4 ****************************************
 epoch: 0, train_loss: 1.2104, test_loss: 1.1789, test_f1: 0.4399
 epoch: 1, train_loss: 0.9908, test_loss: 1.1231, test_f1: 0.4541
 epoch: 2, train_loss: 0.9058, test_loss: 1.0112, test_f1: 0.4927
 epoch: 3, train_loss: 0.9040, test_loss: 0.9914, test_f1: 0.5052
 epoch: 4, train_loss: 0.8610, test_loss: 1.0583, test_f1: 0.4955
 epoch: 5, train_loss: 0.8295, test_loss: 1.1638, test_f1: 0.4696
 epoch: 6, train_loss: 0.8087, test_loss: 0.9978, test_f1: 0.5933
 epoch: 7, train_loss: 0.8380, test_loss: 1.0140, test_f1: 0.5184
 epoch: 8, train_loss: 0.8030, test_loss: 1.1159, test_f1: 0.5505
 epoch: 9, train_loss: 0.8282, test_loss: 0.9765, test_f1: 0.5657
 epoch: 10, train_loss: 0.7977, test_loss: 0.9489, test_f1: 0.5751
 epoch: 11, train_loss: 0.7523, test_loss: 0.9680, test_f1: 0.5682
 epoch: 12, train_loss: 0.7264, test_loss: 0.9649, test_f1: 0.6126
 epoch: 13, train_loss: 0.7431, test_loss: 1.5638, test_f1: 0.5231
 epoch: 14, train_loss: 0.7466, test_loss: 0.9258, test_f1: 0.5930
 epoch: 15, train_loss: 0.7420, test_loss: 1.0531, test_f1: 0.5777
 epoch: 16, train_loss: 0.7292, test_loss: 1.1383, test_f1: 0.5046
 epoch: 17, train_loss: 0.7226, test_loss: 1.2487, test_f1: 0.5241
 epoch: 18, train_loss: 0.7026, test_loss: 1.1345, test_f1: 0.5585
 epoch: 19, train_loss: 0.7053, test_loss: 1.1622, test_f1: 0.5744
 epoch: 20, train_loss: 0.6732, test_loss: 1.1428, test_f1: 0.5359
 epoch: 21, train_loss: 0.6776, test_loss: 1.0770, test_f1: 0.5285
 epoch: 22, train_loss: 0.6663, test_loss: 1.0510, test_f1: 0.5421
 epoch: 23, train_loss: 0.6490, test_loss: 1.0933, test_f1: 0.5754
 epoch: 24, train_loss: 0.6641, test_loss: 1.8701, test_f1: 0.4635
 epoch: 25, train_loss: 0.6696, test_loss: 1.0612, test_f1: 0.5987
 epoch: 26, train_loss: 0.6442, test_loss: 1.3570, test_f1: 0.4618
 epoch: 27, train_loss: 0.6415, test_loss: 1.0757, test_f1: 0.5715
 epoch: 28, train_loss: 0.6485, test_loss: 1.0741, test_f1: 0.6032
 epoch: 29, train_loss: 0.6024, test_loss: 1.1903, test_f1: 0.5569
 epoch: 30, train_loss: 0.6407, test_loss: 1.2226, test_f1: 0.5761
 epoch: 31, train_loss: 0.6417, test_loss: 1.1174, test_f1: 0.5928
 epoch: 32, train_loss: 0.6197, test_loss: 0.9712, test_f1: 0.5802
 epoch: 33, train_loss: 0.6440, test_loss: 1.2719, test_f1: 0.5654
 epoch: 34, train_loss: 0.6075, test_loss: 1.0362, test_f1: 0.6095
 epoch: 35, train_loss: 0.6118, test_loss: 1.1919, test_f1: 0.5861
 epoch: 36, train_loss: 0.5938, test_loss: 1.0944, test_f1: 0.5714
 epoch: 37, train_loss: 0.5894, test_loss: 1.3199, test_f1: 0.5336
 epoch: 38, train_loss: 0.5948, test_loss: 1.2469, test_f1: 0.5911
 epoch: 39, train_loss: 0.5770, test_loss: 1.4195, test_f1: 0.5604
 epoch: 40, train_loss: 0.5667, test_loss: 1.0159, test_f1: 0.6220
 epoch: 41, train_loss: 0.6351, test_loss: 0.9995, test_f1: 0.6126
 epoch: 42, train_loss: 0.6377, test_loss: 1.6696, test_f1: 0.5614
 epoch: 43, train_loss: 0.5889, test_loss: 1.2583, test_f1: 0.6173
 epoch: 44, train_loss: 0.5563, test_loss: 1.0611, test_f1: 0.5884
 epoch: 45, train_loss: 0.5377, test_loss: 1.1363, test_f1: 0.5987
 epoch: 46, train_loss: 0.5446, test_loss: 1.4718, test_f1: 0.5534
 epoch: 47, train_loss: 0.5383, test_loss: 1.4139, test_f1: 0.5415
 epoch: 48, train_loss: 0.5614, test_loss: 1.7305, test_f1: 0.5503
 epoch: 49, train_loss: 0.5788, test_loss: 1.3431, test_f1: 0.5991
 epoch: 50, train_loss: 0.5657, test_loss: 1.3087, test_f1: 0.5322
 epoch: 51, train_loss: 0.5208, test_loss: 1.4535, test_f1: 0.5541
 epoch: 52, train_loss: 0.5071, test_loss: 1.2231, test_f1: 0.5723
 epoch: 53, train_loss: 0.4723, test_loss: 1.7192, test_f1: 0.5421
 epoch: 54, train_loss: 0.4539, test_loss: 1.5845, test_f1: 0.5549
 epoch: 55, train_loss: 0.4120, test_loss: 1.5101, test_f1: 0.5819
 epoch: 56, train_loss: 0.4248, test_loss: 1.4235, test_f1: 0.6167
 epoch: 57, train_loss: 0.4374, test_loss: 1.6620, test_f1: 0.5995
 epoch: 58, train_loss: 0.4304, test_loss: 1.7234, test_f1: 0.5646
 epoch: 59, train_loss: 0.3935, test_loss: 1.6303, test_f1: 0.5590
 epoch: 60, train_loss: 0.3979, test_loss: 1.5431, test_f1: 0.5664
 epoch: 61, train_loss: 0.3618, test_loss: 2.0175, test_f1: 0.5235
 epoch: 62, train_loss: 0.3889, test_loss: 1.9979, test_f1: 0.4937
 epoch: 63, train_loss: 0.3799, test_loss: 1.6003, test_f1: 0.5692
 epoch: 64, train_loss: 0.4134, test_loss: 1.4427, test_f1: 0.5734
 epoch: 65, train_loss: 0.3810, test_loss: 1.5965, test_f1: 0.5380
 epoch: 66, train_loss: 0.3681, test_loss: 1.6374, test_f1: 0.5522
 epoch: 67, train_loss: 0.3764, test_loss: 1.6139, test_f1: 0.5923
 epoch: 68, train_loss: 0.3856, test_loss: 1.7605, test_f1: 0.5868
 epoch: 69, train_loss: 0.3791, test_loss: 1.3958, test_f1: 0.6246
 epoch: 70, train_loss: 0.3836, test_loss: 1.9575, test_f1: 0.5025
 epoch: 71, train_loss: 0.4317, test_loss: 2.0699, test_f1: 0.4699
 epoch: 72, train_loss: 0.3900, test_loss: 2.2128, test_f1: 0.5114
 epoch: 73, train_loss: 0.3676, test_loss: 1.6776, test_f1: 0.6048
 epoch: 74, train_loss: 0.3345, test_loss: 1.7450, test_f1: 0.6314
 epoch: 75, train_loss: 0.3320, test_loss: 2.0385, test_f1: 0.5984
 epoch: 76, train_loss: 0.3281, test_loss: 1.5888, test_f1: 0.6022
 epoch: 77, train_loss: 0.3149, test_loss: 1.9418, test_f1: 0.5865
 epoch: 78, train_loss: 0.3127, test_loss: 2.1915, test_f1: 0.5945
 epoch: 79, train_loss: 0.3458, test_loss: 1.8664, test_f1: 0.5759
 epoch: 80, train_loss: 0.3040, test_loss: 1.9953, test_f1: 0.5287
 epoch: 81, train_loss: 0.3532, test_loss: 1.7228, test_f1: 0.5715
 epoch: 82, train_loss: 0.3627, test_loss: 1.8826, test_f1: 0.5762
 epoch: 83, train_loss: 0.3260, test_loss: 1.6576, test_f1: 0.6233
 epoch: 84, train_loss: 0.3746, test_loss: 1.8267, test_f1: 0.5704
 epoch: 85, train_loss: 0.3707, test_loss: 1.5298, test_f1: 0.5834
 epoch: 86, train_loss: 0.2992, test_loss: 1.7616, test_f1: 0.6220
 epoch: 87, train_loss: 0.3191, test_loss: 2.2412, test_f1: 0.5640
 epoch: 88, train_loss: 0.3149, test_loss: 1.7628, test_f1: 0.5675
 epoch: 89, train_loss: 0.2933, test_loss: 1.7935, test_f1: 0.6146
 epoch: 90, train_loss: 0.2895, test_loss: 1.8839, test_f1: 0.5827
 epoch: 91, train_loss: 0.2861, test_loss: 1.7912, test_f1: 0.6281
 epoch: 92, train_loss: 0.3044, test_loss: 2.2340, test_f1: 0.5558
 epoch: 93, train_loss: 0.2870, test_loss: 2.3463, test_f1: 0.5806
 epoch: 94, train_loss: 0.2916, test_loss: 2.0519, test_f1: 0.6206
 epoch: 95, train_loss: 0.2570, test_loss: 2.0146, test_f1: 0.5739
 epoch: 96, train_loss: 0.2826, test_loss: 2.0717, test_f1: 0.5935
 epoch: 97, train_loss: 0.2897, test_loss: 2.1504, test_f1: 0.5858
 epoch: 98, train_loss: 0.2905, test_loss: 2.1062, test_f1: 0.6076
 epoch: 99, train_loss: 0.3057, test_loss: 2.0639, test_f1: 0.5961
##################ITERATION #5 ****************************************
 epoch: 0, train_loss: 1.1986, test_loss: 1.4555, test_f1: 0.3136
 epoch: 1, train_loss: 0.9755, test_loss: 1.0471, test_f1: 0.5376
 epoch: 2, train_loss: 0.9196, test_loss: 1.0735, test_f1: 0.5232
 epoch: 3, train_loss: 0.8777, test_loss: 1.0383, test_f1: 0.5532
 epoch: 4, train_loss: 0.8515, test_loss: 1.0208, test_f1: 0.5439
 epoch: 5, train_loss: 0.8125, test_loss: 0.9895, test_f1: 0.5757
 epoch: 6, train_loss: 0.8052, test_loss: 1.5440, test_f1: 0.2907
 epoch: 7, train_loss: 0.8377, test_loss: 0.9698, test_f1: 0.5821
 epoch: 8, train_loss: 0.8109, test_loss: 1.0083, test_f1: 0.5423
 epoch: 9, train_loss: 0.7634, test_loss: 1.1002, test_f1: 0.5424
 epoch: 10, train_loss: 0.7731, test_loss: 1.4838, test_f1: 0.4511
 epoch: 11, train_loss: 0.7828, test_loss: 1.0479, test_f1: 0.6015
 epoch: 12, train_loss: 0.7686, test_loss: 0.9784, test_f1: 0.5759
 epoch: 13, train_loss: 0.7464, test_loss: 1.1101, test_f1: 0.5414
 epoch: 14, train_loss: 0.7432, test_loss: 1.0815, test_f1: 0.5803
 epoch: 15, train_loss: 0.7219, test_loss: 1.1120, test_f1: 0.5380
 epoch: 16, train_loss: 0.8723, test_loss: 1.0097, test_f1: 0.6090
 epoch: 17, train_loss: 0.7509, test_loss: 1.2733, test_f1: 0.5890
 epoch: 18, train_loss: 0.7208, test_loss: 1.1177, test_f1: 0.5915
 epoch: 19, train_loss: 0.7203, test_loss: 1.1714, test_f1: 0.5722
 epoch: 20, train_loss: 0.6852, test_loss: 1.4477, test_f1: 0.5894
 epoch: 21, train_loss: 0.7304, test_loss: 1.6233, test_f1: 0.5693
 epoch: 22, train_loss: 0.7255, test_loss: 1.3109, test_f1: 0.5502
 epoch: 23, train_loss: 0.7210, test_loss: 0.9843, test_f1: 0.6146
 epoch: 24, train_loss: 0.6954, test_loss: 1.1684, test_f1: 0.6413
 epoch: 25, train_loss: 0.6822, test_loss: 1.5088, test_f1: 0.5616
 epoch: 26, train_loss: 0.6812, test_loss: 1.1945, test_f1: 0.6223
 epoch: 27, train_loss: 0.6624, test_loss: 1.6009, test_f1: 0.6085
 epoch: 28, train_loss: 0.6928, test_loss: 1.4023, test_f1: 0.6122
 epoch: 29, train_loss: 0.6848, test_loss: 0.9934, test_f1: 0.6085
 epoch: 30, train_loss: 0.6707, test_loss: 1.1736, test_f1: 0.5711
 epoch: 31, train_loss: 0.6810, test_loss: 1.0718, test_f1: 0.5962
 epoch: 32, train_loss: 0.6639, test_loss: 1.0938, test_f1: 0.5641
 epoch: 33, train_loss: 0.6618, test_loss: 1.5853, test_f1: 0.5273
 epoch: 34, train_loss: 0.6639, test_loss: 1.5664, test_f1: 0.5552
 epoch: 35, train_loss: 0.6521, test_loss: 1.1059, test_f1: 0.6095
 epoch: 36, train_loss: 0.6424, test_loss: 1.1201, test_f1: 0.6197
 epoch: 37, train_loss: 0.6376, test_loss: 1.1490, test_f1: 0.6196
 epoch: 38, train_loss: 0.6273, test_loss: 1.4511, test_f1: 0.5946
 epoch: 39, train_loss: 0.6006, test_loss: 1.4762, test_f1: 0.3588
 epoch: 40, train_loss: 0.6431, test_loss: 1.4505, test_f1: 0.5701
 epoch: 41, train_loss: 0.6314, test_loss: 1.5394, test_f1: 0.5941
 epoch: 42, train_loss: 0.6587, test_loss: 1.3040, test_f1: 0.6086
 epoch: 43, train_loss: 0.6146, test_loss: 1.1628, test_f1: 0.6399
 epoch: 44, train_loss: 0.6490, test_loss: 1.6582, test_f1: 0.6058
 epoch: 45, train_loss: 0.6062, test_loss: 1.1262, test_f1: 0.6599
 epoch: 46, train_loss: 0.6006, test_loss: 2.3379, test_f1: 0.5873
 epoch: 47, train_loss: 0.6341, test_loss: 1.0492, test_f1: 0.6332
 epoch: 48, train_loss: 0.6038, test_loss: 1.4260, test_f1: 0.6375
 epoch: 49, train_loss: 0.5882, test_loss: 1.5935, test_f1: 0.5869
 epoch: 50, train_loss: 0.6001, test_loss: 1.1779, test_f1: 0.6370
 epoch: 51, train_loss: 0.5468, test_loss: 1.5003, test_f1: 0.6204
 epoch: 52, train_loss: 0.5349, test_loss: 1.3984, test_f1: 0.6180
 epoch: 53, train_loss: 0.5140, test_loss: 1.7674, test_f1: 0.5962
 epoch: 54, train_loss: 0.5280, test_loss: 1.4575, test_f1: 0.6583
 epoch: 55, train_loss: 0.4977, test_loss: 1.5532, test_f1: 0.6120
 epoch: 56, train_loss: 0.4872, test_loss: 1.5088, test_f1: 0.6259
 epoch: 57, train_loss: 0.4957, test_loss: 1.6637, test_f1: 0.6740
 epoch: 58, train_loss: 0.4963, test_loss: 1.4862, test_f1: 0.6174
 epoch: 59, train_loss: 0.5111, test_loss: 1.4437, test_f1: 0.6339
 epoch: 60, train_loss: 0.4988, test_loss: 1.5569, test_f1: 0.6119
 epoch: 61, train_loss: 0.4873, test_loss: 1.6983, test_f1: 0.6217
 epoch: 62, train_loss: 0.4767, test_loss: 1.3300, test_f1: 0.6275
 epoch: 63, train_loss: 0.4876, test_loss: 1.9821, test_f1: 0.6237
 epoch: 64, train_loss: 0.4870, test_loss: 1.8529, test_f1: 0.6090
 epoch: 65, train_loss: 0.4971, test_loss: 2.0355, test_f1: 0.5750
 epoch: 66, train_loss: 0.4729, test_loss: 1.3744, test_f1: 0.6503
 epoch: 67, train_loss: 0.4985, test_loss: 1.6615, test_f1: 0.6173
 epoch: 68, train_loss: 0.5098, test_loss: 1.8400, test_f1: 0.6149
 epoch: 69, train_loss: 0.4535, test_loss: 1.4972, test_f1: 0.6646
 epoch: 70, train_loss: 0.4631, test_loss: 2.0633, test_f1: 0.6448
 epoch: 71, train_loss: 0.4398, test_loss: 1.7349, test_f1: 0.6085
 epoch: 72, train_loss: 0.4484, test_loss: 1.5998, test_f1: 0.6220
 epoch: 73, train_loss: 0.4512, test_loss: 1.6455, test_f1: 0.6183
 epoch: 74, train_loss: 0.4464, test_loss: 1.5979, test_f1: 0.6379
 epoch: 75, train_loss: 0.4339, test_loss: 1.7985, test_f1: 0.6346
 epoch: 76, train_loss: 0.4799, test_loss: 1.6046, test_f1: 0.6449
 epoch: 77, train_loss: 0.4443, test_loss: 1.9039, test_f1: 0.6099
 epoch: 78, train_loss: 0.4333, test_loss: 1.5838, test_f1: 0.6279
 epoch: 79, train_loss: 0.4041, test_loss: 1.9653, test_f1: 0.6316
 epoch: 80, train_loss: 0.4171, test_loss: 1.9491, test_f1: 0.6247
 epoch: 81, train_loss: 0.4063, test_loss: 1.8632, test_f1: 0.6264
 epoch: 82, train_loss: 0.4260, test_loss: 2.0280, test_f1: 0.6504
 epoch: 83, train_loss: 0.4460, test_loss: 1.8050, test_f1: 0.6356
 epoch: 84, train_loss: 0.4316, test_loss: 1.8763, test_f1: 0.6462
 epoch: 85, train_loss: 0.4180, test_loss: 1.8901, test_f1: 0.6002
 epoch: 86, train_loss: 0.4111, test_loss: 1.6798, test_f1: 0.6235
 epoch: 87, train_loss: 0.4270, test_loss: 1.5248, test_f1: 0.6235
 epoch: 88, train_loss: 0.4707, test_loss: 2.0968, test_f1: 0.6205
 epoch: 89, train_loss: 0.4274, test_loss: 1.4900, test_f1: 0.7122
 epoch: 90, train_loss: 0.3794, test_loss: 1.8467, test_f1: 0.6425
 epoch: 91, train_loss: 0.3715, test_loss: 1.7267, test_f1: 0.6163
 epoch: 92, train_loss: 0.3736, test_loss: 1.9164, test_f1: 0.6145
 epoch: 93, train_loss: 0.3745, test_loss: 2.2345, test_f1: 0.6122
 epoch: 94, train_loss: 0.3833, test_loss: 1.6784, test_f1: 0.6289
 epoch: 95, train_loss: 0.3822, test_loss: 2.2336, test_f1: 0.6059
 epoch: 96, train_loss: 0.3862, test_loss: 1.9905, test_f1: 0.6192
 epoch: 97, train_loss: 0.3825, test_loss: 1.8249, test_f1: 0.6455
 epoch: 98, train_loss: 0.4156, test_loss: 1.9777, test_f1: 0.6031
 epoch: 99, train_loss: 0.3571, test_loss: 2.1125, test_f1: 0.6349
##################ITERATION #6 ****************************************
 epoch: 0, train_loss: 1.1674, test_loss: 1.3968, test_f1: 0.4158
 epoch: 1, train_loss: 0.9881, test_loss: 1.0645, test_f1: 0.4661
 epoch: 2, train_loss: 0.9196, test_loss: 1.0591, test_f1: 0.4949
 epoch: 3, train_loss: 0.8463, test_loss: 1.0052, test_f1: 0.5762
 epoch: 4, train_loss: 0.8271, test_loss: 1.2233, test_f1: 0.4909
 epoch: 5, train_loss: 0.8344, test_loss: 1.1172, test_f1: 0.5214
 epoch: 6, train_loss: 0.8180, test_loss: 1.2431, test_f1: 0.4379
 epoch: 7, train_loss: 0.8127, test_loss: 1.2976, test_f1: 0.4429
 epoch: 8, train_loss: 0.7974, test_loss: 1.1015, test_f1: 0.5736
 epoch: 9, train_loss: 0.7989, test_loss: 1.1401, test_f1: 0.5241
 epoch: 10, train_loss: 0.7948, test_loss: 0.9600, test_f1: 0.5710
 epoch: 11, train_loss: 0.7740, test_loss: 1.1033, test_f1: 0.5527
 epoch: 12, train_loss: 0.8171, test_loss: 1.0423, test_f1: 0.5557
 epoch: 13, train_loss: 0.7493, test_loss: 1.0821, test_f1: 0.5550
 epoch: 14, train_loss: 0.7477, test_loss: 1.0799, test_f1: 0.5887
 epoch: 15, train_loss: 0.7486, test_loss: 1.2397, test_f1: 0.5188
 epoch: 16, train_loss: 0.7712, test_loss: 1.0604, test_f1: 0.5730
 epoch: 17, train_loss: 0.7624, test_loss: 1.1207, test_f1: 0.5636
 epoch: 18, train_loss: 0.7800, test_loss: 1.0081, test_f1: 0.6237
 epoch: 19, train_loss: 0.7616, test_loss: 1.1168, test_f1: 0.5088
 epoch: 20, train_loss: 0.7321, test_loss: 1.1411, test_f1: 0.5693
 epoch: 21, train_loss: 0.7402, test_loss: 1.1586, test_f1: 0.5782
 epoch: 22, train_loss: 0.7127, test_loss: 1.0753, test_f1: 0.5850
 epoch: 23, train_loss: 0.7024, test_loss: 1.1932, test_f1: 0.5813
 epoch: 24, train_loss: 0.7153, test_loss: 1.1114, test_f1: 0.5545
 epoch: 25, train_loss: 0.7323, test_loss: 1.0211, test_f1: 0.5805
 epoch: 26, train_loss: 0.7217, test_loss: 1.2184, test_f1: 0.5553
 epoch: 27, train_loss: 0.7186, test_loss: 0.9679, test_f1: 0.4976
 epoch: 28, train_loss: 0.7257, test_loss: 1.0429, test_f1: 0.5016
 epoch: 29, train_loss: 0.6972, test_loss: 1.0528, test_f1: 0.5821
 epoch: 30, train_loss: 0.6795, test_loss: 1.1279, test_f1: 0.5793
 epoch: 31, train_loss: 0.6808, test_loss: 1.3004, test_f1: 0.5823
 epoch: 32, train_loss: 0.7236, test_loss: 1.0568, test_f1: 0.5191
 epoch: 33, train_loss: 0.7177, test_loss: 1.0629, test_f1: 0.5372
 epoch: 34, train_loss: 0.7122, test_loss: 1.0534, test_f1: 0.5294
 epoch: 35, train_loss: 0.6864, test_loss: 1.0908, test_f1: 0.5702
 epoch: 36, train_loss: 0.6777, test_loss: 1.1538, test_f1: 0.5662
 epoch: 37, train_loss: 0.6774, test_loss: 1.1675, test_f1: 0.6182
 epoch: 38, train_loss: 0.6670, test_loss: 1.1331, test_f1: 0.5850
 epoch: 39, train_loss: 0.6422, test_loss: 1.0840, test_f1: 0.5665
 epoch: 40, train_loss: 0.6350, test_loss: 1.2264, test_f1: 0.6012
 epoch: 41, train_loss: 0.6720, test_loss: 1.0596, test_f1: 0.5642
 epoch: 42, train_loss: 0.6794, test_loss: 1.1296, test_f1: 0.5624
 epoch: 43, train_loss: 0.6449, test_loss: 1.2265, test_f1: 0.5767
 epoch: 44, train_loss: 0.6980, test_loss: 1.0587, test_f1: 0.5608
 epoch: 45, train_loss: 0.6477, test_loss: 1.1213, test_f1: 0.5481
 epoch: 46, train_loss: 0.6367, test_loss: 1.1069, test_f1: 0.5667
 epoch: 47, train_loss: 0.6391, test_loss: 1.4420, test_f1: 0.5689
 epoch: 48, train_loss: 0.6515, test_loss: 0.9967, test_f1: 0.6328
 epoch: 49, train_loss: 0.6181, test_loss: 1.1110, test_f1: 0.6057
 epoch: 50, train_loss: 0.6119, test_loss: 1.0928, test_f1: 0.5580
 epoch: 51, train_loss: 0.5889, test_loss: 1.2444, test_f1: 0.5643
 epoch: 52, train_loss: 0.5544, test_loss: 1.1086, test_f1: 0.5772
 epoch: 53, train_loss: 0.5772, test_loss: 1.1852, test_f1: 0.6244
 epoch: 54, train_loss: 0.5542, test_loss: 1.0464, test_f1: 0.6052
 epoch: 55, train_loss: 0.5592, test_loss: 1.2136, test_f1: 0.6035
 epoch: 56, train_loss: 0.5564, test_loss: 1.0931, test_f1: 0.6327
 epoch: 57, train_loss: 0.5469, test_loss: 1.1873, test_f1: 0.6019
 epoch: 58, train_loss: 0.5241, test_loss: 1.1911, test_f1: 0.6089
 epoch: 59, train_loss: 0.5275, test_loss: 1.2792, test_f1: 0.6023
 epoch: 60, train_loss: 0.5285, test_loss: 1.2594, test_f1: 0.6364
 epoch: 61, train_loss: 0.5007, test_loss: 1.3613, test_f1: 0.5984
 epoch: 62, train_loss: 0.5087, test_loss: 1.2803, test_f1: 0.6363
 epoch: 63, train_loss: 0.4961, test_loss: 1.4163, test_f1: 0.6239
 epoch: 64, train_loss: 0.4897, test_loss: 1.2132, test_f1: 0.6261
 epoch: 65, train_loss: 0.4825, test_loss: 1.2896, test_f1: 0.6110
 epoch: 66, train_loss: 0.4757, test_loss: 1.5169, test_f1: 0.6199
 epoch: 67, train_loss: 0.4754, test_loss: 1.3046, test_f1: 0.6438
 epoch: 68, train_loss: 0.4833, test_loss: 1.4063, test_f1: 0.6567
 epoch: 69, train_loss: 0.4851, test_loss: 1.4589, test_f1: 0.6443
 epoch: 70, train_loss: 0.4859, test_loss: 1.5058, test_f1: 0.6373
 epoch: 71, train_loss: 0.5029, test_loss: 1.3846, test_f1: 0.6300
 epoch: 72, train_loss: 0.4794, test_loss: 1.4257, test_f1: 0.6268
 epoch: 73, train_loss: 0.4482, test_loss: 1.6947, test_f1: 0.6449
 epoch: 74, train_loss: 0.4582, test_loss: 1.5110, test_f1: 0.6141
 epoch: 75, train_loss: 0.4568, test_loss: 1.4210, test_f1: 0.6352
 epoch: 76, train_loss: 0.4299, test_loss: 1.4039, test_f1: 0.5943
 epoch: 77, train_loss: 0.4308, test_loss: 1.6168, test_f1: 0.6017
 epoch: 78, train_loss: 0.4516, test_loss: 1.3821, test_f1: 0.6116
 epoch: 79, train_loss: 0.5005, test_loss: 1.6226, test_f1: 0.6150
 epoch: 80, train_loss: 0.4775, test_loss: 1.2411, test_f1: 0.6321
 epoch: 81, train_loss: 0.4491, test_loss: 1.6305, test_f1: 0.6325
 epoch: 82, train_loss: 0.4504, test_loss: 1.7053, test_f1: 0.6425
 epoch: 83, train_loss: 0.4154, test_loss: 1.6873, test_f1: 0.6095
 epoch: 84, train_loss: 0.4303, test_loss: 1.6203, test_f1: 0.6413
 epoch: 85, train_loss: 0.4513, test_loss: 1.3616, test_f1: 0.6487
 epoch: 86, train_loss: 0.4199, test_loss: 1.6016, test_f1: 0.6468
 epoch: 87, train_loss: 0.4093, test_loss: 1.5779, test_f1: 0.6436
 epoch: 88, train_loss: 0.4190, test_loss: 1.6676, test_f1: 0.6146
 epoch: 89, train_loss: 0.4056, test_loss: 1.4278, test_f1: 0.6550
 epoch: 90, train_loss: 0.4225, test_loss: 1.6443, test_f1: 0.5946
 epoch: 91, train_loss: 0.3942, test_loss: 1.7215, test_f1: 0.6315
 epoch: 92, train_loss: 0.4035, test_loss: 1.5546, test_f1: 0.6261
 epoch: 93, train_loss: 0.3577, test_loss: 1.9013, test_f1: 0.6046
 epoch: 94, train_loss: 0.3842, test_loss: 1.6174, test_f1: 0.6144
 epoch: 95, train_loss: 0.3883, test_loss: 1.5214, test_f1: 0.6044
 epoch: 96, train_loss: 0.3718, test_loss: 1.6470, test_f1: 0.6205
 epoch: 97, train_loss: 0.3878, test_loss: 1.7996, test_f1: 0.6249
 epoch: 98, train_loss: 0.3875, test_loss: 1.6267, test_f1: 0.6283
 epoch: 99, train_loss: 0.3787, test_loss: 1.6046, test_f1: 0.6344
##################ITERATION #7 ****************************************
 epoch: 0, train_loss: 1.1966, test_loss: 1.3868, test_f1: 0.2770
 epoch: 1, train_loss: 0.9810, test_loss: 1.0113, test_f1: 0.5824
 epoch: 2, train_loss: 0.9576, test_loss: 2.8738, test_f1: 0.2438
 epoch: 3, train_loss: 0.9067, test_loss: 1.0479, test_f1: 0.5063
 epoch: 4, train_loss: 0.8954, test_loss: 1.1998, test_f1: 0.4083
 epoch: 5, train_loss: 0.8772, test_loss: 1.1155, test_f1: 0.5074
 epoch: 6, train_loss: 0.8376, test_loss: 1.1826, test_f1: 0.5501
 epoch: 7, train_loss: 0.8176, test_loss: 4.5735, test_f1: 0.2434
 epoch: 8, train_loss: 0.8570, test_loss: 1.1107, test_f1: 0.5138
 epoch: 9, train_loss: 0.7828, test_loss: 1.1349, test_f1: 0.4922
 epoch: 10, train_loss: 0.7898, test_loss: 1.2904, test_f1: 0.5462
 epoch: 11, train_loss: 0.7973, test_loss: 1.0382, test_f1: 0.5452
 epoch: 12, train_loss: 0.7511, test_loss: 1.2355, test_f1: 0.4667
 epoch: 13, train_loss: 0.7642, test_loss: 1.0671, test_f1: 0.6070
 epoch: 14, train_loss: 0.7451, test_loss: 1.1786, test_f1: 0.4610
 epoch: 15, train_loss: 0.7441, test_loss: 1.4340, test_f1: 0.4567
 epoch: 16, train_loss: 0.7384, test_loss: 1.1620, test_f1: 0.5218
 epoch: 17, train_loss: 0.7435, test_loss: 1.4773, test_f1: 0.4442
 epoch: 18, train_loss: 0.7342, test_loss: 0.9847, test_f1: 0.5792
 epoch: 19, train_loss: 0.6912, test_loss: 1.0806, test_f1: 0.5493
 epoch: 20, train_loss: 0.7499, test_loss: 1.1745, test_f1: 0.5534
 epoch: 21, train_loss: 0.6989, test_loss: 1.2647, test_f1: 0.5749
 epoch: 22, train_loss: 0.7136, test_loss: 1.2005, test_f1: 0.5458
 epoch: 23, train_loss: 0.7003, test_loss: 1.1153, test_f1: 0.5960
 epoch: 24, train_loss: 0.7223, test_loss: 1.0450, test_f1: 0.5285
 epoch: 25, train_loss: 0.6623, test_loss: 1.0260, test_f1: 0.6285
 epoch: 26, train_loss: 0.6828, test_loss: 0.9570, test_f1: 0.6440
 epoch: 27, train_loss: 0.7165, test_loss: 2.3234, test_f1: 0.3430
 epoch: 28, train_loss: 0.7171, test_loss: 1.4409, test_f1: 0.4489
 epoch: 29, train_loss: 0.6773, test_loss: 0.9374, test_f1: 0.6204
 epoch: 30, train_loss: 0.6943, test_loss: 1.0125, test_f1: 0.6350
 epoch: 31, train_loss: 0.6590, test_loss: 1.0658, test_f1: 0.5613
 epoch: 32, train_loss: 0.6603, test_loss: 1.2024, test_f1: 0.5719
 epoch: 33, train_loss: 0.6307, test_loss: 1.1384, test_f1: 0.5976
 epoch: 34, train_loss: 0.6384, test_loss: 1.0023, test_f1: 0.6370
 epoch: 35, train_loss: 0.6317, test_loss: 1.2149, test_f1: 0.6713
 epoch: 36, train_loss: 0.6156, test_loss: 1.2991, test_f1: 0.6116
 epoch: 37, train_loss: 0.6256, test_loss: 1.2355, test_f1: 0.6068
 epoch: 38, train_loss: 0.6096, test_loss: 1.1344, test_f1: 0.6096
 epoch: 39, train_loss: 0.6048, test_loss: 1.3395, test_f1: 0.6108
 epoch: 40, train_loss: 0.6169, test_loss: 1.6447, test_f1: 0.5874
 epoch: 41, train_loss: 0.6649, test_loss: 0.9784, test_f1: 0.6533
 epoch: 42, train_loss: 0.6288, test_loss: 1.0394, test_f1: 0.6067
 epoch: 43, train_loss: 0.5954, test_loss: 1.6832, test_f1: 0.5114
 epoch: 44, train_loss: 0.6203, test_loss: 1.1743, test_f1: 0.6078
 epoch: 45, train_loss: 0.5741, test_loss: 1.1891, test_f1: 0.5840
 epoch: 46, train_loss: 0.5772, test_loss: 1.3327, test_f1: 0.6234
 epoch: 47, train_loss: 0.6125, test_loss: 1.0686, test_f1: 0.6008
 epoch: 48, train_loss: 0.5812, test_loss: 1.0777, test_f1: 0.6653
 epoch: 49, train_loss: 0.5467, test_loss: 1.2908, test_f1: 0.5970
 epoch: 50, train_loss: 0.5768, test_loss: 1.0484, test_f1: 0.6548
 epoch: 51, train_loss: 0.5282, test_loss: 1.0566, test_f1: 0.6934
 epoch: 52, train_loss: 0.5068, test_loss: 1.0479, test_f1: 0.6573
 epoch: 53, train_loss: 0.5218, test_loss: 1.2005, test_f1: 0.6639
 epoch: 54, train_loss: 0.4845, test_loss: 1.0814, test_f1: 0.6821
 epoch: 55, train_loss: 0.4927, test_loss: 1.1374, test_f1: 0.6593
 epoch: 56, train_loss: 0.4851, test_loss: 1.3287, test_f1: 0.6552
 epoch: 57, train_loss: 0.4571, test_loss: 1.4149, test_f1: 0.6130
 epoch: 58, train_loss: 0.4509, test_loss: 1.1911, test_f1: 0.6383
 epoch: 59, train_loss: 0.4460, test_loss: 1.3057, test_f1: 0.6666
 epoch: 60, train_loss: 0.4405, test_loss: 1.2089, test_f1: 0.6424
 epoch: 61, train_loss: 0.4653, test_loss: 1.4982, test_f1: 0.6438
 epoch: 62, train_loss: 0.4377, test_loss: 1.5148, test_f1: 0.6829
 epoch: 63, train_loss: 0.4625, test_loss: 1.2305, test_f1: 0.6642
 epoch: 64, train_loss: 0.4413, test_loss: 2.0866, test_f1: 0.6250
 epoch: 65, train_loss: 0.4551, test_loss: 1.2189, test_f1: 0.6486
 epoch: 66, train_loss: 0.4336, test_loss: 1.5043, test_f1: 0.6176
 epoch: 67, train_loss: 0.4272, test_loss: 1.4092, test_f1: 0.5717
 epoch: 68, train_loss: 0.4398, test_loss: 1.7616, test_f1: 0.6060
 epoch: 69, train_loss: 0.4479, test_loss: 1.6445, test_f1: 0.6371
 epoch: 70, train_loss: 0.4458, test_loss: 1.5911, test_f1: 0.6245
 epoch: 71, train_loss: 0.4211, test_loss: 1.2784, test_f1: 0.6086
 epoch: 72, train_loss: 0.4363, test_loss: 1.4408, test_f1: 0.6183
 epoch: 73, train_loss: 0.4472, test_loss: 1.5918, test_f1: 0.6043
 epoch: 74, train_loss: 0.4173, test_loss: 1.2633, test_f1: 0.6639
 epoch: 75, train_loss: 0.3964, test_loss: 1.2623, test_f1: 0.6590
 epoch: 76, train_loss: 0.4018, test_loss: 1.3889, test_f1: 0.6680
 epoch: 77, train_loss: 0.4092, test_loss: 1.5561, test_f1: 0.6686
 epoch: 78, train_loss: 0.4032, test_loss: 1.4519, test_f1: 0.6513
 epoch: 79, train_loss: 0.4083, test_loss: 1.3009, test_f1: 0.6903
 epoch: 80, train_loss: 0.3784, test_loss: 2.0780, test_f1: 0.5861
 epoch: 81, train_loss: 0.3782, test_loss: 1.5434, test_f1: 0.6289
 epoch: 82, train_loss: 0.4069, test_loss: 1.6721, test_f1: 0.6328
 epoch: 83, train_loss: 0.4082, test_loss: 1.4250, test_f1: 0.6606
 epoch: 84, train_loss: 0.3766, test_loss: 1.6687, test_f1: 0.6052
 epoch: 85, train_loss: 0.3841, test_loss: 1.4877, test_f1: 0.6645
 epoch: 86, train_loss: 0.3854, test_loss: 1.6322, test_f1: 0.6223
 epoch: 87, train_loss: 0.3813, test_loss: 1.4948, test_f1: 0.6820
 epoch: 88, train_loss: 0.3721, test_loss: 1.4959, test_f1: 0.6993
 epoch: 89, train_loss: 0.3566, test_loss: 1.3881, test_f1: 0.6748
 epoch: 90, train_loss: 0.3615, test_loss: 1.7671, test_f1: 0.6522
 epoch: 91, train_loss: 0.3623, test_loss: 1.7575, test_f1: 0.6513
 epoch: 92, train_loss: 0.3514, test_loss: 1.7433, test_f1: 0.6574
 epoch: 93, train_loss: 0.3319, test_loss: 1.7383, test_f1: 0.6786
 epoch: 94, train_loss: 0.3728, test_loss: 1.8472, test_f1: 0.6686
 epoch: 95, train_loss: 0.3425, test_loss: 1.8818, test_f1: 0.6575
 epoch: 96, train_loss: 0.3315, test_loss: 1.6874, test_f1: 0.6627
 epoch: 97, train_loss: 0.3156, test_loss: 1.8590, test_f1: 0.5952
 epoch: 98, train_loss: 0.3475, test_loss: 1.6163, test_f1: 0.6748
 epoch: 99, train_loss: 0.3061, test_loss: 1.8789, test_f1: 0.6337
##################ITERATION #8 ****************************************
 epoch: 0, train_loss: 1.2269, test_loss: 1.2732, test_f1: 0.3857
 epoch: 1, train_loss: 0.9407, test_loss: 1.2053, test_f1: 0.4606
 epoch: 2, train_loss: 0.8959, test_loss: 1.0540, test_f1: 0.4791
 epoch: 3, train_loss: 0.8738, test_loss: 1.0428, test_f1: 0.5038
 epoch: 4, train_loss: 0.8378, test_loss: 1.0483, test_f1: 0.5300
 epoch: 5, train_loss: 0.8219, test_loss: 1.2789, test_f1: 0.4327
 epoch: 6, train_loss: 0.8143, test_loss: 1.0373, test_f1: 0.5563
 epoch: 7, train_loss: 0.7918, test_loss: 1.0902, test_f1: 0.5650
 epoch: 8, train_loss: 0.7860, test_loss: 1.1514, test_f1: 0.4997
 epoch: 9, train_loss: 0.7714, test_loss: 1.1242, test_f1: 0.5320
 epoch: 10, train_loss: 0.7763, test_loss: 1.0028, test_f1: 0.5602
 epoch: 11, train_loss: 0.7606, test_loss: 1.2726, test_f1: 0.5231
 epoch: 12, train_loss: 0.7574, test_loss: 1.1388, test_f1: 0.5958
 epoch: 13, train_loss: 0.7689, test_loss: 1.0753, test_f1: 0.5644
 epoch: 14, train_loss: 0.7409, test_loss: 1.0468, test_f1: 0.4959
 epoch: 15, train_loss: 0.7185, test_loss: 1.1492, test_f1: 0.6003
 epoch: 16, train_loss: 0.7177, test_loss: 1.3495, test_f1: 0.5874
 epoch: 17, train_loss: 0.7142, test_loss: 1.1170, test_f1: 0.5651
 epoch: 18, train_loss: 0.6853, test_loss: 1.0521, test_f1: 0.6115
 epoch: 19, train_loss: 0.7439, test_loss: 1.2262, test_f1: 0.5666
 epoch: 20, train_loss: 0.7241, test_loss: 0.9780, test_f1: 0.5579
 epoch: 21, train_loss: 0.7075, test_loss: 0.9734, test_f1: 0.6002
 epoch: 22, train_loss: 0.6838, test_loss: 1.1049, test_f1: 0.5515
 epoch: 23, train_loss: 0.6973, test_loss: 1.0591, test_f1: 0.6350
 epoch: 24, train_loss: 0.6969, test_loss: 1.3042, test_f1: 0.5761
 epoch: 25, train_loss: 0.7054, test_loss: 1.2245, test_f1: 0.4906
 epoch: 26, train_loss: 0.6687, test_loss: 1.0748, test_f1: 0.4935
 epoch: 27, train_loss: 0.6454, test_loss: 1.0946, test_f1: 0.5253
 epoch: 28, train_loss: 0.6308, test_loss: 1.4594, test_f1: 0.5211
 epoch: 29, train_loss: 0.6502, test_loss: 1.2801, test_f1: 0.5823
 epoch: 30, train_loss: 0.6530, test_loss: 1.6440, test_f1: 0.6170
 epoch: 31, train_loss: 0.6287, test_loss: 1.0841, test_f1: 0.5614
 epoch: 32, train_loss: 0.6242, test_loss: 1.1203, test_f1: 0.6278
 epoch: 33, train_loss: 0.6149, test_loss: 1.1001, test_f1: 0.6011
 epoch: 34, train_loss: 0.6537, test_loss: 0.9980, test_f1: 0.6113
 epoch: 35, train_loss: 0.6255, test_loss: 1.1542, test_f1: 0.5877
 epoch: 36, train_loss: 0.6160, test_loss: 1.2748, test_f1: 0.6616
 epoch: 37, train_loss: 0.6278, test_loss: 1.4035, test_f1: 0.5093
 epoch: 38, train_loss: 0.6346, test_loss: 1.1336, test_f1: 0.5842
 epoch: 39, train_loss: 0.6152, test_loss: 1.0632, test_f1: 0.6473
 epoch: 40, train_loss: 0.5862, test_loss: 1.4224, test_f1: 0.5877
 epoch: 41, train_loss: 0.6175, test_loss: 1.0007, test_f1: 0.5990
 epoch: 42, train_loss: 0.6246, test_loss: 1.2691, test_f1: 0.5145
 epoch: 43, train_loss: 0.7179, test_loss: 1.7174, test_f1: 0.4555
 epoch: 44, train_loss: 0.6307, test_loss: 1.1682, test_f1: 0.5221
 epoch: 45, train_loss: 0.6097, test_loss: 1.2795, test_f1: 0.5474
 epoch: 46, train_loss: 0.6172, test_loss: 1.1714, test_f1: 0.5973
 epoch: 47, train_loss: 0.5745, test_loss: 1.2380, test_f1: 0.5771
 epoch: 48, train_loss: 0.5920, test_loss: 1.5776, test_f1: 0.4513
 epoch: 49, train_loss: 0.5709, test_loss: 1.0618, test_f1: 0.6613
 epoch: 50, train_loss: 0.6028, test_loss: 1.0849, test_f1: 0.6368
 epoch: 51, train_loss: 0.5449, test_loss: 1.1021, test_f1: 0.6474
 epoch: 52, train_loss: 0.5067, test_loss: 1.0640, test_f1: 0.6527
 epoch: 53, train_loss: 0.4796, test_loss: 1.2579, test_f1: 0.6519
 epoch: 54, train_loss: 0.4994, test_loss: 1.0696, test_f1: 0.6324
 epoch: 55, train_loss: 0.5001, test_loss: 1.1101, test_f1: 0.6528
 epoch: 56, train_loss: 0.5036, test_loss: 1.2902, test_f1: 0.6709
 epoch: 57, train_loss: 0.4870, test_loss: 1.1482, test_f1: 0.6489
 epoch: 58, train_loss: 0.4741, test_loss: 1.1561, test_f1: 0.6291
 epoch: 59, train_loss: 0.4582, test_loss: 1.1604, test_f1: 0.6600
 epoch: 60, train_loss: 0.4646, test_loss: 1.2208, test_f1: 0.6145
 epoch: 61, train_loss: 0.4667, test_loss: 1.2528, test_f1: 0.6304
 epoch: 62, train_loss: 0.4664, test_loss: 1.3222, test_f1: 0.6589
 epoch: 63, train_loss: 0.4293, test_loss: 1.3909, test_f1: 0.6190
 epoch: 64, train_loss: 0.4475, test_loss: 1.4258, test_f1: 0.6209
 epoch: 65, train_loss: 0.4177, test_loss: 1.4202, test_f1: 0.5916
 epoch: 66, train_loss: 0.4149, test_loss: 1.5979, test_f1: 0.5823
 epoch: 67, train_loss: 0.4205, test_loss: 1.6001, test_f1: 0.6062
 epoch: 68, train_loss: 0.4077, test_loss: 1.3435, test_f1: 0.5894
 epoch: 69, train_loss: 0.4268, test_loss: 1.4691, test_f1: 0.6223
 epoch: 70, train_loss: 0.4027, test_loss: 1.4293, test_f1: 0.6251
 epoch: 71, train_loss: 0.4091, test_loss: 1.3988, test_f1: 0.6069
 epoch: 72, train_loss: 0.3742, test_loss: 1.5451, test_f1: 0.6101
 epoch: 73, train_loss: 0.4061, test_loss: 1.5182, test_f1: 0.6464
 epoch: 74, train_loss: 0.4208, test_loss: 1.5977, test_f1: 0.5767
 epoch: 75, train_loss: 0.4247, test_loss: 1.5433, test_f1: 0.5499
 epoch: 76, train_loss: 0.4216, test_loss: 1.4882, test_f1: 0.6110
 epoch: 77, train_loss: 0.4108, test_loss: 1.3482, test_f1: 0.5822
 epoch: 78, train_loss: 0.4081, test_loss: 1.4053, test_f1: 0.6354
 epoch: 79, train_loss: 0.4247, test_loss: 1.3511, test_f1: 0.6843
 epoch: 80, train_loss: 0.3840, test_loss: 1.5096, test_f1: 0.5999
 epoch: 81, train_loss: 0.3569, test_loss: 1.5215, test_f1: 0.6215
 epoch: 82, train_loss: 0.3676, test_loss: 1.5648, test_f1: 0.6157
 epoch: 83, train_loss: 0.3437, test_loss: 1.5912, test_f1: 0.6159
 epoch: 84, train_loss: 0.3671, test_loss: 1.6057, test_f1: 0.6115
 epoch: 85, train_loss: 0.3863, test_loss: 1.4444, test_f1: 0.6038
 epoch: 86, train_loss: 0.3517, test_loss: 1.5797, test_f1: 0.6174
 epoch: 87, train_loss: 0.3520, test_loss: 1.6187, test_f1: 0.6021
 epoch: 88, train_loss: 0.3932, test_loss: 1.5799, test_f1: 0.6055
 epoch: 89, train_loss: 0.3826, test_loss: 1.4335, test_f1: 0.6702
 epoch: 90, train_loss: 0.3776, test_loss: 1.7559, test_f1: 0.5624
 epoch: 91, train_loss: 0.3674, test_loss: 1.6945, test_f1: 0.5944
 epoch: 92, train_loss: 0.3531, test_loss: 1.6542, test_f1: 0.6050
 epoch: 93, train_loss: 0.3125, test_loss: 1.6435, test_f1: 0.6335
 epoch: 94, train_loss: 0.3059, test_loss: 1.8100, test_f1: 0.5799
 epoch: 95, train_loss: 0.3499, test_loss: 1.5735, test_f1: 0.6168
 epoch: 96, train_loss: 0.3398, test_loss: 1.5914, test_f1: 0.5915
 epoch: 97, train_loss: 0.3535, test_loss: 1.7023, test_f1: 0.6369
 epoch: 98, train_loss: 0.3299, test_loss: 1.5698, test_f1: 0.6000
 epoch: 99, train_loss: 0.3325, test_loss: 1.5153, test_f1: 0.6196
##################ITERATION #9 ****************************************
 epoch: 0, train_loss: 1.2814, test_loss: 1.1919, test_f1: 0.3544
 epoch: 1, train_loss: 1.0067, test_loss: 1.1761, test_f1: 0.4273
 epoch: 2, train_loss: 0.9152, test_loss: 1.0480, test_f1: 0.5235
 epoch: 3, train_loss: 0.8802, test_loss: 1.1158, test_f1: 0.4421
 epoch: 4, train_loss: 0.8418, test_loss: 1.4174, test_f1: 0.4389
 epoch: 5, train_loss: 0.8562, test_loss: 1.0151, test_f1: 0.5292
 epoch: 6, train_loss: 0.8367, test_loss: 1.6025, test_f1: 0.4978
 epoch: 7, train_loss: 0.8364, test_loss: 2.3298, test_f1: 0.4417
 epoch: 8, train_loss: 0.8354, test_loss: 0.9899, test_f1: 0.5765
 epoch: 9, train_loss: 0.8064, test_loss: 1.1460, test_f1: 0.5199
 epoch: 10, train_loss: 0.7829, test_loss: 1.0873, test_f1: 0.5839
 epoch: 11, train_loss: 0.7923, test_loss: 1.1454, test_f1: 0.5820
 epoch: 12, train_loss: 0.7857, test_loss: 1.0580, test_f1: 0.4991
 epoch: 13, train_loss: 0.7571, test_loss: 1.3608, test_f1: 0.5783
 epoch: 14, train_loss: 0.7328, test_loss: 1.2401, test_f1: 0.6120
 epoch: 15, train_loss: 0.7248, test_loss: 1.1140, test_f1: 0.6084
 epoch: 16, train_loss: 0.7626, test_loss: 1.1382, test_f1: 0.5299
 epoch: 17, train_loss: 0.7377, test_loss: 1.0192, test_f1: 0.6350
 epoch: 18, train_loss: 0.7279, test_loss: 1.3494, test_f1: 0.5483
 epoch: 19, train_loss: 0.7211, test_loss: 1.1855, test_f1: 0.6072
 epoch: 20, train_loss: 0.7037, test_loss: 1.1743, test_f1: 0.5567
 epoch: 21, train_loss: 0.6780, test_loss: 1.4140, test_f1: 0.6038
 epoch: 22, train_loss: 0.6763, test_loss: 1.2212, test_f1: 0.5696
 epoch: 23, train_loss: 0.7243, test_loss: 1.2019, test_f1: 0.5635
 epoch: 24, train_loss: 0.6860, test_loss: 1.3043, test_f1: 0.5593
 epoch: 25, train_loss: 0.6864, test_loss: 1.4752, test_f1: 0.5199
 epoch: 26, train_loss: 0.6835, test_loss: 1.8312, test_f1: 0.4657
 epoch: 27, train_loss: 0.7062, test_loss: 1.6125, test_f1: 0.5061
 epoch: 28, train_loss: 0.7132, test_loss: 1.6375, test_f1: 0.5225
 epoch: 29, train_loss: 0.7030, test_loss: 1.1678, test_f1: 0.5777
 epoch: 30, train_loss: 0.6787, test_loss: 1.1139, test_f1: 0.5797
 epoch: 31, train_loss: 0.7126, test_loss: 1.4925, test_f1: 0.4600
 epoch: 32, train_loss: 0.6679, test_loss: 1.3199, test_f1: 0.4901
 epoch: 33, train_loss: 0.6497, test_loss: 1.4742, test_f1: 0.6139
 epoch: 34, train_loss: 0.6550, test_loss: 1.1245, test_f1: 0.5704
 epoch: 35, train_loss: 0.6260, test_loss: 1.4311, test_f1: 0.6600
 epoch: 36, train_loss: 0.6531, test_loss: 1.0587, test_f1: 0.6031
 epoch: 37, train_loss: 0.6250, test_loss: 1.3315, test_f1: 0.6735
 epoch: 38, train_loss: 0.6284, test_loss: 1.6605, test_f1: 0.6370
 epoch: 39, train_loss: 0.6396, test_loss: 1.0364, test_f1: 0.6918
 epoch: 40, train_loss: 0.6386, test_loss: 1.6041, test_f1: 0.5745
 epoch: 41, train_loss: 0.6275, test_loss: 1.0358, test_f1: 0.6471
 epoch: 42, train_loss: 0.5802, test_loss: 1.3982, test_f1: 0.5405
 epoch: 43, train_loss: 0.5976, test_loss: 1.1869, test_f1: 0.6723
 epoch: 44, train_loss: 0.5731, test_loss: 1.8286, test_f1: 0.6634
 epoch: 45, train_loss: 0.6090, test_loss: 1.1569, test_f1: 0.6167
 epoch: 46, train_loss: 0.5977, test_loss: 1.1008, test_f1: 0.6573
 epoch: 47, train_loss: 0.6157, test_loss: 1.2957, test_f1: 0.4943
 epoch: 48, train_loss: 0.5734, test_loss: 1.3527, test_f1: 0.5752
 epoch: 49, train_loss: 0.5393, test_loss: 1.5715, test_f1: 0.5993
 epoch: 50, train_loss: 0.5770, test_loss: 1.1636, test_f1: 0.6204
 epoch: 51, train_loss: 0.5366, test_loss: 1.3167, test_f1: 0.6529
 epoch: 52, train_loss: 0.5066, test_loss: 1.4869, test_f1: 0.6159
 epoch: 53, train_loss: 0.5095, test_loss: 1.5588, test_f1: 0.6038
 epoch: 54, train_loss: 0.5293, test_loss: 1.4929, test_f1: 0.5978
 epoch: 55, train_loss: 0.4783, test_loss: 1.4220, test_f1: 0.6717
 epoch: 56, train_loss: 0.4850, test_loss: 1.5164, test_f1: 0.6486
 epoch: 57, train_loss: 0.4640, test_loss: 1.8552, test_f1: 0.6053
 epoch: 58, train_loss: 0.4595, test_loss: 1.6287, test_f1: 0.6238
 epoch: 59, train_loss: 0.4803, test_loss: 1.7788, test_f1: 0.6040
 epoch: 60, train_loss: 0.4586, test_loss: 1.7293, test_f1: 0.6181
 epoch: 61, train_loss: 0.4554, test_loss: 1.8516, test_f1: 0.6561
 epoch: 62, train_loss: 0.4398, test_loss: 1.6610, test_f1: 0.6456
 epoch: 63, train_loss: 0.4467, test_loss: 1.8610, test_f1: 0.6235
 epoch: 64, train_loss: 0.4426, test_loss: 1.8670, test_f1: 0.6584
 epoch: 65, train_loss: 0.4415, test_loss: 1.6409, test_f1: 0.6628
 epoch: 66, train_loss: 0.4274, test_loss: 2.1158, test_f1: 0.5246
 epoch: 67, train_loss: 0.4350, test_loss: 1.7536, test_f1: 0.6751
 epoch: 68, train_loss: 0.4424, test_loss: 1.4468, test_f1: 0.5736
 epoch: 69, train_loss: 0.4140, test_loss: 2.3782, test_f1: 0.5523
 epoch: 70, train_loss: 0.4363, test_loss: 2.0112, test_f1: 0.6022
 epoch: 71, train_loss: 0.4597, test_loss: 1.4553, test_f1: 0.6315
 epoch: 72, train_loss: 0.4330, test_loss: 1.8389, test_f1: 0.5906
 epoch: 73, train_loss: 0.3874, test_loss: 1.8104, test_f1: 0.6171
 epoch: 74, train_loss: 0.4293, test_loss: 1.8371, test_f1: 0.6168
 epoch: 75, train_loss: 0.4206, test_loss: 1.9127, test_f1: 0.6294
 epoch: 76, train_loss: 0.4230, test_loss: 2.0800, test_f1: 0.5816
 epoch: 77, train_loss: 0.4305, test_loss: 1.8599, test_f1: 0.6205
 epoch: 78, train_loss: 0.4306, test_loss: 1.5081, test_f1: 0.6194
 epoch: 79, train_loss: 0.4199, test_loss: 2.1420, test_f1: 0.6053
 epoch: 80, train_loss: 0.3899, test_loss: 1.7808, test_f1: 0.5796
 epoch: 81, train_loss: 0.3936, test_loss: 2.1988, test_f1: 0.6117
 epoch: 82, train_loss: 0.3801, test_loss: 1.9173, test_f1: 0.5820
 epoch: 83, train_loss: 0.3678, test_loss: 1.6125, test_f1: 0.6522
 epoch: 84, train_loss: 0.3858, test_loss: 1.8254, test_f1: 0.6317
 epoch: 85, train_loss: 0.3734, test_loss: 2.0871, test_f1: 0.6391
 epoch: 86, train_loss: 0.3932, test_loss: 2.1767, test_f1: 0.5902
 epoch: 87, train_loss: 0.3935, test_loss: 2.0170, test_f1: 0.6046
 epoch: 88, train_loss: 0.3905, test_loss: 2.3556, test_f1: 0.6369
 epoch: 89, train_loss: 0.3720, test_loss: 2.4462, test_f1: 0.6032
 epoch: 90, train_loss: 0.3694, test_loss: 2.0498, test_f1: 0.6146
 epoch: 91, train_loss: 0.3411, test_loss: 2.0534, test_f1: 0.5619
 epoch: 92, train_loss: 0.3408, test_loss: 1.8418, test_f1: 0.5996
 epoch: 93, train_loss: 0.3237, test_loss: 2.1238, test_f1: 0.6108
 epoch: 94, train_loss: 0.3062, test_loss: 2.4075, test_f1: 0.5962
 epoch: 95, train_loss: 0.3496, test_loss: 2.6293, test_f1: 0.5302
 epoch: 96, train_loss: 0.3449, test_loss: 2.0587, test_f1: 0.6280
 epoch: 97, train_loss: 0.3438, test_loss: 1.9998, test_f1: 0.6244
 epoch: 98, train_loss: 0.3430, test_loss: 1.7740, test_f1: 0.6303
 epoch: 99, train_loss: 0.3399, test_loss: 2.1754, test_f1: 0.5929

Training completed in 550.43 seconds
Best F1: 0.7122 at epoch 89
Mean F1 across iterations: 0.6760  0.0228
========================FINAL RESULTS================================
FEGIN weighted F1: 0.7122  0.0228
python main.py --data ltspice_demos --representation component_pin --model FEGIN --layers 6 --hiddens 64 --batch_size 64 --lr 0.01 --emb_size 250 --epochs 100 --save_appendix component_pin_L6_H64_BS64_LR0.01_E250 --no_val
-----



STDERR:
  File "main.py", line 370, in <module>
    main()
  File "main.py", line 254, in main
    dataset = dataset_class(
  File "/home/philip/projects/ltspice_examples_code_repo/Circuit-Completion-Using-GNNs/component_classification_with_link_prediction_head/evaluation/FEGIN/kernel/circuit_datasets.py", line 15, in __init__
    self.data, self.slices = torch.load(self.processed_paths[0])
  File "/home/philip/.local/lib/python3.8/site-packages/torch/serialization.py", line 1040, in load
    warnings.warn(
  File "/usr/lib/python3.8/warnings.py", line 109, in _showwarnmsg
    sw(msg.message, msg.category, msg.filename, msg.lineno,
  File "main.py", line 47, in warn_with_traceback
    traceback.print_stack(file=log)
/home/philip/projects/ltspice_examples_code_repo/Circuit-Completion-Using-GNNs/component_classification_with_link_prediction_head/evaluation/FEGIN/kernel/circuit_datasets.py:15: FutureWarning: You are using `torch.load` with `weights_only=False` (the current default value), which uses the default pickle module implicitly. It is possible to construct malicious pickle data which will execute arbitrary code during unpickling (See https://github.com/pytorch/pytorch/blob/main/SECURITY.md#untrusted-models for more details). In a future release, the default value for `weights_only` will be flipped to `True`. This limits the functions that could be executed during unpickling. Arbitrary objects will no longer be allowed to be loaded via this mode unless they are explicitly allowlisted by the user via `torch.serialization.add_safe_globals`. We recommend you start setting `weights_only=True` for any use case where you don't have full control of the loaded file. Please open an issue on GitHub for any issues related to this experimental feature.
  self.data, self.slices = torch.load(self.processed_paths[0])
