STDOUT:
Results will be saved in /home/philip/projects/ltspice_examples_code_repo/Circuit-Completion-Using-GNNs/component_classification_with_link_prediction_head/evaluation/FEGIN/results/model_FEGIN_dataset_ltspice_examples
Command line input: python main.py --data ltspice_examples --representation component_component --model FEGIN --layers 5 --hiddens 128 --batch_size 256 --lr 0.001 --emb_size 512 --epochs 100 --save_appendix component_component_L5_H128_BS256_LR0.001_E512 --no_val
 is saved.
-----
ltspice_examples - FEGIN
Using 5 layers, 128 hidden units, h = 2
Loading component_component representation dataset
ENTERED
Training FEGIN on component_component representation
Train: 3556, Test: 845
##################ITERATION #0 ****************************************
 epoch: 0, train_loss: 1.3147, test_loss: 1.2858, test_f1: 0.2589
 epoch: 1, train_loss: 1.2029, test_loss: 1.2183, test_f1: 0.3047
 epoch: 2, train_loss: 1.1460, test_loss: 1.1488, test_f1: 0.3583
 epoch: 3, train_loss: 1.0973, test_loss: 1.0753, test_f1: 0.4826
 epoch: 4, train_loss: 1.0358, test_loss: 0.9953, test_f1: 0.4949
 epoch: 5, train_loss: 1.0023, test_loss: 1.0906, test_f1: 0.4368
 epoch: 6, train_loss: 0.9538, test_loss: 0.9832, test_f1: 0.4856
 epoch: 7, train_loss: 0.9235, test_loss: 0.9962, test_f1: 0.5155
 epoch: 8, train_loss: 0.9095, test_loss: 1.0369, test_f1: 0.5014
 epoch: 9, train_loss: 0.8781, test_loss: 1.0269, test_f1: 0.5131
 epoch: 10, train_loss: 0.8528, test_loss: 1.1206, test_f1: 0.4867
 epoch: 11, train_loss: 0.8260, test_loss: 1.1486, test_f1: 0.4834
 epoch: 12, train_loss: 0.8119, test_loss: 1.0618, test_f1: 0.5040
 epoch: 13, train_loss: 0.8054, test_loss: 1.0962, test_f1: 0.5221
 epoch: 14, train_loss: 0.7768, test_loss: 1.0430, test_f1: 0.5062
 epoch: 15, train_loss: 0.7478, test_loss: 1.0296, test_f1: 0.5553
 epoch: 16, train_loss: 0.7432, test_loss: 1.1303, test_f1: 0.5185
 epoch: 17, train_loss: 0.7152, test_loss: 1.1269, test_f1: 0.5268
 epoch: 18, train_loss: 0.7004, test_loss: 1.2594, test_f1: 0.5216
 epoch: 19, train_loss: 0.6729, test_loss: 1.3157, test_f1: 0.5316
 epoch: 20, train_loss: 0.6684, test_loss: 1.5113, test_f1: 0.4798
 epoch: 21, train_loss: 0.6533, test_loss: 1.1757, test_f1: 0.5498
 epoch: 22, train_loss: 0.6379, test_loss: 1.2552, test_f1: 0.5391
 epoch: 23, train_loss: 0.6098, test_loss: 1.3510, test_f1: 0.5333
 epoch: 24, train_loss: 0.6149, test_loss: 1.3628, test_f1: 0.5526
 epoch: 25, train_loss: 0.5955, test_loss: 1.4774, test_f1: 0.5428
 epoch: 26, train_loss: 0.5823, test_loss: 1.3789, test_f1: 0.5250
 epoch: 27, train_loss: 0.5812, test_loss: 1.4000, test_f1: 0.5474
 epoch: 28, train_loss: 0.5992, test_loss: 1.6008, test_f1: 0.5045
 epoch: 29, train_loss: 0.5707, test_loss: 1.5745, test_f1: 0.5228
 epoch: 30, train_loss: 0.5235, test_loss: 1.5866, test_f1: 0.5283
 epoch: 31, train_loss: 0.5266, test_loss: 1.7642, test_f1: 0.5183
 epoch: 32, train_loss: 0.5237, test_loss: 1.5641, test_f1: 0.5306
 epoch: 33, train_loss: 0.5256, test_loss: 1.4868, test_f1: 0.5215
 epoch: 34, train_loss: 0.5116, test_loss: 1.6452, test_f1: 0.5250
 epoch: 35, train_loss: 0.4911, test_loss: 1.5489, test_f1: 0.5413
 epoch: 36, train_loss: 0.4751, test_loss: 1.7142, test_f1: 0.5413
 epoch: 37, train_loss: 0.4445, test_loss: 1.7846, test_f1: 0.5171
 epoch: 38, train_loss: 0.4711, test_loss: 1.7352, test_f1: 0.5512
 epoch: 39, train_loss: 0.4642, test_loss: 1.7598, test_f1: 0.5219
 epoch: 40, train_loss: 0.4584, test_loss: 1.7661, test_f1: 0.5354
 epoch: 41, train_loss: 0.4304, test_loss: 1.8511, test_f1: 0.5432
 epoch: 42, train_loss: 0.4231, test_loss: 1.7981, test_f1: 0.5421
 epoch: 43, train_loss: 0.4418, test_loss: 2.0487, test_f1: 0.5222
 epoch: 44, train_loss: 0.4517, test_loss: 1.9433, test_f1: 0.5279
 epoch: 45, train_loss: 0.4552, test_loss: 1.6913, test_f1: 0.5325
 epoch: 46, train_loss: 0.4113, test_loss: 1.7992, test_f1: 0.5321
 epoch: 47, train_loss: 0.3946, test_loss: 1.8534, test_f1: 0.5202
 epoch: 48, train_loss: 0.3881, test_loss: 2.0301, test_f1: 0.5281
 epoch: 49, train_loss: 0.3894, test_loss: 2.1162, test_f1: 0.5329
 epoch: 50, train_loss: 0.3808, test_loss: 1.8311, test_f1: 0.5279
 epoch: 51, train_loss: 0.3420, test_loss: 2.2962, test_f1: 0.5158
 epoch: 52, train_loss: 0.3260, test_loss: 2.4262, test_f1: 0.5137
 epoch: 53, train_loss: 0.2933, test_loss: 2.4880, test_f1: 0.5279
 epoch: 54, train_loss: 0.2895, test_loss: 2.6069, test_f1: 0.5044
 epoch: 55, train_loss: 0.2704, test_loss: 2.4836, test_f1: 0.5112
 epoch: 56, train_loss: 0.2629, test_loss: 2.5838, test_f1: 0.5190
 epoch: 57, train_loss: 0.2707, test_loss: 2.5976, test_f1: 0.5144
 epoch: 58, train_loss: 0.2547, test_loss: 2.5048, test_f1: 0.5107
 epoch: 59, train_loss: 0.2498, test_loss: 2.5446, test_f1: 0.5311
 epoch: 60, train_loss: 0.2615, test_loss: 2.6869, test_f1: 0.5280
 epoch: 61, train_loss: 0.2577, test_loss: 2.4359, test_f1: 0.5186
 epoch: 62, train_loss: 0.2442, test_loss: 2.6150, test_f1: 0.5356
 epoch: 63, train_loss: 0.2186, test_loss: 2.7450, test_f1: 0.5299
 epoch: 64, train_loss: 0.2519, test_loss: 2.9836, test_f1: 0.5084
 epoch: 65, train_loss: 0.2372, test_loss: 2.8310, test_f1: 0.5030
 epoch: 66, train_loss: 0.2719, test_loss: 2.6769, test_f1: 0.5094
 epoch: 67, train_loss: 0.2779, test_loss: 2.7170, test_f1: 0.5121
 epoch: 68, train_loss: 0.2554, test_loss: 2.8098, test_f1: 0.5479
 epoch: 69, train_loss: 0.2355, test_loss: 2.8287, test_f1: 0.5280
 epoch: 70, train_loss: 0.2318, test_loss: 2.7075, test_f1: 0.5145
 epoch: 71, train_loss: 0.2319, test_loss: 2.8622, test_f1: 0.5189
 epoch: 72, train_loss: 0.2362, test_loss: 2.6475, test_f1: 0.5048
 epoch: 73, train_loss: 0.2222, test_loss: 3.0122, test_f1: 0.4935
 epoch: 74, train_loss: 0.2134, test_loss: 3.0467, test_f1: 0.5076
 epoch: 75, train_loss: 0.2063, test_loss: 2.9417, test_f1: 0.5154
 epoch: 76, train_loss: 0.2078, test_loss: 2.9779, test_f1: 0.5246
 epoch: 77, train_loss: 0.2206, test_loss: 2.6941, test_f1: 0.5427
 epoch: 78, train_loss: 0.2043, test_loss: 2.9797, test_f1: 0.5093
 epoch: 79, train_loss: 0.1901, test_loss: 3.1169, test_f1: 0.5055
 epoch: 80, train_loss: 0.2025, test_loss: 3.1286, test_f1: 0.5151
 epoch: 81, train_loss: 0.2082, test_loss: 3.1385, test_f1: 0.5121
 epoch: 82, train_loss: 0.1975, test_loss: 3.1988, test_f1: 0.5056
 epoch: 83, train_loss: 0.2036, test_loss: 2.9347, test_f1: 0.5358
 epoch: 84, train_loss: 0.2088, test_loss: 3.0802, test_f1: 0.5364
 epoch: 85, train_loss: 0.2051, test_loss: 3.3180, test_f1: 0.5162
 epoch: 86, train_loss: 0.1873, test_loss: 3.1530, test_f1: 0.5057
 epoch: 87, train_loss: 0.1987, test_loss: 3.0189, test_f1: 0.5320
 epoch: 88, train_loss: 0.1982, test_loss: 2.8999, test_f1: 0.5201
 epoch: 89, train_loss: 0.1980, test_loss: 3.1364, test_f1: 0.5197
 epoch: 90, train_loss: 0.1744, test_loss: 3.2975, test_f1: 0.5232
 epoch: 91, train_loss: 0.1780, test_loss: 3.5151, test_f1: 0.5124
 epoch: 92, train_loss: 0.1725, test_loss: 3.5572, test_f1: 0.5308
 epoch: 93, train_loss: 0.1604, test_loss: 3.2607, test_f1: 0.5219
 epoch: 94, train_loss: 0.1541, test_loss: 3.4848, test_f1: 0.5155
 epoch: 95, train_loss: 0.1722, test_loss: 3.2935, test_f1: 0.5224
 epoch: 96, train_loss: 0.1537, test_loss: 3.4016, test_f1: 0.5284
 epoch: 97, train_loss: 0.1635, test_loss: 3.4948, test_f1: 0.5292
 epoch: 98, train_loss: 0.1750, test_loss: 3.4760, test_f1: 0.5231
 epoch: 99, train_loss: 0.1782, test_loss: 3.2497, test_f1: 0.5354
##################ITERATION #1 ****************************************
 epoch: 0, train_loss: 1.2410, test_loss: 1.2375, test_f1: 0.2579
 epoch: 1, train_loss: 1.1202, test_loss: 1.1526, test_f1: 0.4118
 epoch: 2, train_loss: 1.0669, test_loss: 1.0562, test_f1: 0.4561
 epoch: 3, train_loss: 1.0362, test_loss: 1.0383, test_f1: 0.4736
 epoch: 4, train_loss: 1.0061, test_loss: 1.0222, test_f1: 0.4810
 epoch: 5, train_loss: 0.9825, test_loss: 1.0053, test_f1: 0.5150
 epoch: 6, train_loss: 0.9425, test_loss: 0.9805, test_f1: 0.5364
 epoch: 7, train_loss: 0.9074, test_loss: 1.0668, test_f1: 0.4810
 epoch: 8, train_loss: 0.8907, test_loss: 1.0182, test_f1: 0.5253
 epoch: 9, train_loss: 0.8731, test_loss: 1.0658, test_f1: 0.5232
 epoch: 10, train_loss: 0.8413, test_loss: 1.1379, test_f1: 0.5127
 epoch: 11, train_loss: 0.8134, test_loss: 1.2009, test_f1: 0.5012
 epoch: 12, train_loss: 0.8085, test_loss: 1.1631, test_f1: 0.4885
 epoch: 13, train_loss: 0.7945, test_loss: 1.1297, test_f1: 0.5208
 epoch: 14, train_loss: 0.7780, test_loss: 1.2451, test_f1: 0.5222
 epoch: 15, train_loss: 0.7462, test_loss: 1.1304, test_f1: 0.5440
 epoch: 16, train_loss: 0.7193, test_loss: 1.4570, test_f1: 0.4832
 epoch: 17, train_loss: 0.7021, test_loss: 1.2974, test_f1: 0.5291
 epoch: 18, train_loss: 0.6918, test_loss: 1.2018, test_f1: 0.5434
 epoch: 19, train_loss: 0.6730, test_loss: 1.3863, test_f1: 0.5429
 epoch: 20, train_loss: 0.6665, test_loss: 1.2945, test_f1: 0.5476
 epoch: 21, train_loss: 0.6233, test_loss: 1.4635, test_f1: 0.5207
 epoch: 22, train_loss: 0.5995, test_loss: 1.4512, test_f1: 0.5168
 epoch: 23, train_loss: 0.6345, test_loss: 1.6056, test_f1: 0.4934
 epoch: 24, train_loss: 0.6119, test_loss: 1.7054, test_f1: 0.5087
 epoch: 25, train_loss: 0.5934, test_loss: 1.6254, test_f1: 0.5209
 epoch: 26, train_loss: 0.5783, test_loss: 1.4953, test_f1: 0.5147
 epoch: 27, train_loss: 0.5402, test_loss: 1.4910, test_f1: 0.5084
 epoch: 28, train_loss: 0.5549, test_loss: 1.5875, test_f1: 0.5390
 epoch: 29, train_loss: 0.5286, test_loss: 1.5536, test_f1: 0.5343
 epoch: 30, train_loss: 0.5251, test_loss: 1.5062, test_f1: 0.5155
 epoch: 31, train_loss: 0.5243, test_loss: 1.5320, test_f1: 0.5374
 epoch: 32, train_loss: 0.5239, test_loss: 1.7281, test_f1: 0.5016
 epoch: 33, train_loss: 0.4998, test_loss: 1.7288, test_f1: 0.5085
 epoch: 34, train_loss: 0.4668, test_loss: 1.9298, test_f1: 0.4895
 epoch: 35, train_loss: 0.4891, test_loss: 1.4132, test_f1: 0.5279
 epoch: 36, train_loss: 0.4895, test_loss: 2.0252, test_f1: 0.4962
 epoch: 37, train_loss: 0.4765, test_loss: 1.8238, test_f1: 0.5161
 epoch: 38, train_loss: 0.4787, test_loss: 1.5911, test_f1: 0.5227
 epoch: 39, train_loss: 0.4368, test_loss: 1.6948, test_f1: 0.5477
 epoch: 40, train_loss: 0.4472, test_loss: 1.8507, test_f1: 0.5035
 epoch: 41, train_loss: 0.4552, test_loss: 1.9609, test_f1: 0.5049
 epoch: 42, train_loss: 0.4422, test_loss: 1.8112, test_f1: 0.5206
 epoch: 43, train_loss: 0.4195, test_loss: 1.9644, test_f1: 0.5245
 epoch: 44, train_loss: 0.3900, test_loss: 2.0840, test_f1: 0.5313
 epoch: 45, train_loss: 0.4046, test_loss: 2.2771, test_f1: 0.5238
 epoch: 46, train_loss: 0.3836, test_loss: 2.2113, test_f1: 0.5098
 epoch: 47, train_loss: 0.3754, test_loss: 1.9339, test_f1: 0.5486
 epoch: 48, train_loss: 0.3886, test_loss: 2.2094, test_f1: 0.5075
 epoch: 49, train_loss: 0.3835, test_loss: 2.1008, test_f1: 0.5206
 epoch: 50, train_loss: 0.3610, test_loss: 2.5204, test_f1: 0.5352
 epoch: 51, train_loss: 0.3204, test_loss: 2.1477, test_f1: 0.5317
 epoch: 52, train_loss: 0.2950, test_loss: 2.3628, test_f1: 0.5361
 epoch: 53, train_loss: 0.2739, test_loss: 2.2039, test_f1: 0.5193
 epoch: 54, train_loss: 0.2547, test_loss: 2.3852, test_f1: 0.5326
 epoch: 55, train_loss: 0.2533, test_loss: 2.5403, test_f1: 0.5253
 epoch: 56, train_loss: 0.2490, test_loss: 2.7265, test_f1: 0.5375
 epoch: 57, train_loss: 0.2634, test_loss: 2.5075, test_f1: 0.5271
 epoch: 58, train_loss: 0.2371, test_loss: 2.4879, test_f1: 0.5258
 epoch: 59, train_loss: 0.2432, test_loss: 2.6247, test_f1: 0.5267
 epoch: 60, train_loss: 0.2399, test_loss: 2.7491, test_f1: 0.5364
 epoch: 61, train_loss: 0.2285, test_loss: 2.5030, test_f1: 0.5396
 epoch: 62, train_loss: 0.2251, test_loss: 3.0708, test_f1: 0.5130
 epoch: 63, train_loss: 0.2280, test_loss: 3.0357, test_f1: 0.5071
 epoch: 64, train_loss: 0.2448, test_loss: 2.6159, test_f1: 0.5378
 epoch: 65, train_loss: 0.2390, test_loss: 2.8450, test_f1: 0.5149
 epoch: 66, train_loss: 0.2351, test_loss: 2.8270, test_f1: 0.5107
 epoch: 67, train_loss: 0.2112, test_loss: 2.9473, test_f1: 0.5218
 epoch: 68, train_loss: 0.2098, test_loss: 2.7088, test_f1: 0.5269
 epoch: 69, train_loss: 0.2230, test_loss: 2.8993, test_f1: 0.5118
 epoch: 70, train_loss: 0.2426, test_loss: 2.9296, test_f1: 0.5076
 epoch: 71, train_loss: 0.2354, test_loss: 2.8180, test_f1: 0.5287
 epoch: 72, train_loss: 0.2160, test_loss: 2.6882, test_f1: 0.5172
 epoch: 73, train_loss: 0.2176, test_loss: 2.8030, test_f1: 0.5292
 epoch: 74, train_loss: 0.1928, test_loss: 3.0079, test_f1: 0.5341
 epoch: 75, train_loss: 0.2024, test_loss: 2.7837, test_f1: 0.5091
 epoch: 76, train_loss: 0.2035, test_loss: 3.0316, test_f1: 0.5212
 epoch: 77, train_loss: 0.2023, test_loss: 2.9477, test_f1: 0.5194
 epoch: 78, train_loss: 0.1855, test_loss: 2.9483, test_f1: 0.5207
 epoch: 79, train_loss: 0.1733, test_loss: 3.1956, test_f1: 0.5027
 epoch: 80, train_loss: 0.1709, test_loss: 3.2626, test_f1: 0.5206
 epoch: 81, train_loss: 0.1881, test_loss: 2.9030, test_f1: 0.5397
 epoch: 82, train_loss: 0.1837, test_loss: 3.1481, test_f1: 0.5300
 epoch: 83, train_loss: 0.1778, test_loss: 3.1288, test_f1: 0.5117
 epoch: 84, train_loss: 0.2146, test_loss: 3.1930, test_f1: 0.5177
 epoch: 85, train_loss: 0.2058, test_loss: 3.0280, test_f1: 0.5108
 epoch: 86, train_loss: 0.1900, test_loss: 2.9073, test_f1: 0.5211
 epoch: 87, train_loss: 0.1746, test_loss: 3.0883, test_f1: 0.4968
 epoch: 88, train_loss: 0.1716, test_loss: 3.1023, test_f1: 0.5292
 epoch: 89, train_loss: 0.1722, test_loss: 3.3157, test_f1: 0.5186
 epoch: 90, train_loss: 0.1589, test_loss: 3.3203, test_f1: 0.5189
 epoch: 91, train_loss: 0.1660, test_loss: 3.1943, test_f1: 0.5356
 epoch: 92, train_loss: 0.1641, test_loss: 3.1352, test_f1: 0.5261
 epoch: 93, train_loss: 0.1834, test_loss: 3.7414, test_f1: 0.5024
 epoch: 94, train_loss: 0.1781, test_loss: 3.2658, test_f1: 0.5149
 epoch: 95, train_loss: 0.1798, test_loss: 3.2713, test_f1: 0.5329
 epoch: 96, train_loss: 0.1705, test_loss: 3.3240, test_f1: 0.5185
 epoch: 97, train_loss: 0.1507, test_loss: 3.3463, test_f1: 0.5312
 epoch: 98, train_loss: 0.1382, test_loss: 3.7313, test_f1: 0.5086
 epoch: 99, train_loss: 0.1673, test_loss: 3.3189, test_f1: 0.5135
##################ITERATION #2 ****************************************
 epoch: 0, train_loss: 1.2740, test_loss: 1.2642, test_f1: 0.3154
 epoch: 1, train_loss: 1.1342, test_loss: 1.1587, test_f1: 0.4311
 epoch: 2, train_loss: 1.0738, test_loss: 1.0795, test_f1: 0.4210
 epoch: 3, train_loss: 1.0246, test_loss: 1.0228, test_f1: 0.4430
 epoch: 4, train_loss: 0.9944, test_loss: 1.0058, test_f1: 0.4760
 epoch: 5, train_loss: 0.9561, test_loss: 1.0326, test_f1: 0.4708
 epoch: 6, train_loss: 0.9204, test_loss: 0.9780, test_f1: 0.4942
 epoch: 7, train_loss: 0.9142, test_loss: 1.0258, test_f1: 0.5076
 epoch: 8, train_loss: 0.8837, test_loss: 1.0473, test_f1: 0.4924
 epoch: 9, train_loss: 0.8814, test_loss: 1.0505, test_f1: 0.4687
 epoch: 10, train_loss: 0.8702, test_loss: 1.0362, test_f1: 0.5090
 epoch: 11, train_loss: 0.8400, test_loss: 1.0371, test_f1: 0.4980
 epoch: 12, train_loss: 0.8100, test_loss: 1.0315, test_f1: 0.5263
 epoch: 13, train_loss: 0.8117, test_loss: 1.0941, test_f1: 0.4937
 epoch: 14, train_loss: 0.7991, test_loss: 1.1315, test_f1: 0.5191
 epoch: 15, train_loss: 0.7756, test_loss: 1.1837, test_f1: 0.4983
 epoch: 16, train_loss: 0.7654, test_loss: 1.1248, test_f1: 0.5009
 epoch: 17, train_loss: 0.7624, test_loss: 1.2924, test_f1: 0.5156
 epoch: 18, train_loss: 0.7384, test_loss: 1.1967, test_f1: 0.4969
 epoch: 19, train_loss: 0.7230, test_loss: 1.3027, test_f1: 0.5030
 epoch: 20, train_loss: 0.7083, test_loss: 1.2783, test_f1: 0.5104
 epoch: 21, train_loss: 0.7403, test_loss: 1.7837, test_f1: 0.4944
 epoch: 22, train_loss: 0.7094, test_loss: 1.3169, test_f1: 0.4908
 epoch: 23, train_loss: 0.6703, test_loss: 1.3079, test_f1: 0.5176
 epoch: 24, train_loss: 0.6687, test_loss: 1.2899, test_f1: 0.5080
 epoch: 25, train_loss: 0.6636, test_loss: 1.2578, test_f1: 0.5139
 epoch: 26, train_loss: 0.6556, test_loss: 1.2963, test_f1: 0.5304
 epoch: 27, train_loss: 0.6292, test_loss: 1.1878, test_f1: 0.5504
 epoch: 28, train_loss: 0.6255, test_loss: 1.3079, test_f1: 0.5556
 epoch: 29, train_loss: 0.6184, test_loss: 1.6094, test_f1: 0.5085
 epoch: 30, train_loss: 0.5953, test_loss: 1.2942, test_f1: 0.5491
 epoch: 31, train_loss: 0.5771, test_loss: 1.4463, test_f1: 0.5267
 epoch: 32, train_loss: 0.5816, test_loss: 1.4912, test_f1: 0.4924
 epoch: 33, train_loss: 0.5868, test_loss: 1.3832, test_f1: 0.5389
 epoch: 34, train_loss: 0.5637, test_loss: 1.5733, test_f1: 0.5174
 epoch: 35, train_loss: 0.5506, test_loss: 1.5502, test_f1: 0.5046
 epoch: 36, train_loss: 0.5496, test_loss: 1.4669, test_f1: 0.5331
 epoch: 37, train_loss: 0.5569, test_loss: 1.7998, test_f1: 0.5092
 epoch: 38, train_loss: 0.5432, test_loss: 1.6170, test_f1: 0.5165
 epoch: 39, train_loss: 0.5159, test_loss: 1.6958, test_f1: 0.5470
 epoch: 40, train_loss: 0.5134, test_loss: 1.5522, test_f1: 0.5649
 epoch: 41, train_loss: 0.5002, test_loss: 1.7310, test_f1: 0.5088
 epoch: 42, train_loss: 0.4980, test_loss: 1.6869, test_f1: 0.5200
 epoch: 43, train_loss: 0.5106, test_loss: 1.5869, test_f1: 0.5655
 epoch: 44, train_loss: 0.5118, test_loss: 1.6022, test_f1: 0.5462
 epoch: 45, train_loss: 0.4950, test_loss: 1.5367, test_f1: 0.5856
 epoch: 46, train_loss: 0.4825, test_loss: 1.5788, test_f1: 0.5167
 epoch: 47, train_loss: 0.4720, test_loss: 1.6974, test_f1: 0.5192
 epoch: 48, train_loss: 0.4529, test_loss: 1.7040, test_f1: 0.5189
 epoch: 49, train_loss: 0.4419, test_loss: 1.8224, test_f1: 0.5114
 epoch: 50, train_loss: 0.4196, test_loss: 2.1010, test_f1: 0.5375
 epoch: 51, train_loss: 0.4046, test_loss: 1.7558, test_f1: 0.5338
 epoch: 52, train_loss: 0.3720, test_loss: 1.8497, test_f1: 0.5334
 epoch: 53, train_loss: 0.3601, test_loss: 1.8293, test_f1: 0.5436
 epoch: 54, train_loss: 0.3361, test_loss: 1.9022, test_f1: 0.5511
 epoch: 55, train_loss: 0.3387, test_loss: 1.9312, test_f1: 0.5645
 epoch: 56, train_loss: 0.3439, test_loss: 2.1981, test_f1: 0.5533
 epoch: 57, train_loss: 0.3376, test_loss: 1.9310, test_f1: 0.5502
 epoch: 58, train_loss: 0.3228, test_loss: 2.0096, test_f1: 0.5349
 epoch: 59, train_loss: 0.3107, test_loss: 2.1662, test_f1: 0.5397
 epoch: 60, train_loss: 0.3206, test_loss: 2.1081, test_f1: 0.5660
 epoch: 61, train_loss: 0.3118, test_loss: 2.2874, test_f1: 0.5279
 epoch: 62, train_loss: 0.2844, test_loss: 2.0491, test_f1: 0.5534
 epoch: 63, train_loss: 0.2920, test_loss: 2.3006, test_f1: 0.5491
 epoch: 64, train_loss: 0.2661, test_loss: 2.1374, test_f1: 0.5484
 epoch: 65, train_loss: 0.2814, test_loss: 2.3861, test_f1: 0.5512
 epoch: 66, train_loss: 0.2843, test_loss: 2.1165, test_f1: 0.5691
 epoch: 67, train_loss: 0.2886, test_loss: 2.4296, test_f1: 0.5528
 epoch: 68, train_loss: 0.3028, test_loss: 2.4387, test_f1: 0.5490
 epoch: 69, train_loss: 0.3264, test_loss: 2.2426, test_f1: 0.5494
 epoch: 70, train_loss: 0.3040, test_loss: 2.1499, test_f1: 0.5429
 epoch: 71, train_loss: 0.2751, test_loss: 2.5523, test_f1: 0.5206
 epoch: 72, train_loss: 0.2672, test_loss: 2.3614, test_f1: 0.5432
 epoch: 73, train_loss: 0.2505, test_loss: 2.4824, test_f1: 0.5464
 epoch: 74, train_loss: 0.2620, test_loss: 2.4756, test_f1: 0.5448
 epoch: 75, train_loss: 0.2776, test_loss: 2.9058, test_f1: 0.5007
 epoch: 76, train_loss: 0.2524, test_loss: 2.5296, test_f1: 0.5397
 epoch: 77, train_loss: 0.2653, test_loss: 2.4680, test_f1: 0.5266
 epoch: 78, train_loss: 0.2642, test_loss: 2.7190, test_f1: 0.5426
 epoch: 79, train_loss: 0.2384, test_loss: 2.4315, test_f1: 0.5441
 epoch: 80, train_loss: 0.2469, test_loss: 2.7209, test_f1: 0.5365
 epoch: 81, train_loss: 0.2496, test_loss: 2.8127, test_f1: 0.5264
 epoch: 82, train_loss: 0.2608, test_loss: 2.7199, test_f1: 0.5235
 epoch: 83, train_loss: 0.2545, test_loss: 2.3216, test_f1: 0.5286
 epoch: 84, train_loss: 0.2552, test_loss: 2.6569, test_f1: 0.5581
 epoch: 85, train_loss: 0.2279, test_loss: 2.6181, test_f1: 0.5362
 epoch: 86, train_loss: 0.2292, test_loss: 2.6694, test_f1: 0.5421
 epoch: 87, train_loss: 0.2106, test_loss: 2.8630, test_f1: 0.5444
 epoch: 88, train_loss: 0.2317, test_loss: 2.6302, test_f1: 0.5369
 epoch: 89, train_loss: 0.2214, test_loss: 2.7648, test_f1: 0.5512
 epoch: 90, train_loss: 0.2155, test_loss: 2.8745, test_f1: 0.5129
 epoch: 91, train_loss: 0.2355, test_loss: 2.9545, test_f1: 0.5291
 epoch: 92, train_loss: 0.2355, test_loss: 2.7918, test_f1: 0.5592
 epoch: 93, train_loss: 0.2262, test_loss: 2.7547, test_f1: 0.5143
 epoch: 94, train_loss: 0.2184, test_loss: 2.6276, test_f1: 0.5380
 epoch: 95, train_loss: 0.2069, test_loss: 2.8567, test_f1: 0.5301
 epoch: 96, train_loss: 0.2250, test_loss: 2.6927, test_f1: 0.5496
 epoch: 97, train_loss: 0.2216, test_loss: 2.7231, test_f1: 0.5555
 epoch: 98, train_loss: 0.2099, test_loss: 2.6623, test_f1: 0.5520
 epoch: 99, train_loss: 0.2181, test_loss: 3.1339, test_f1: 0.5220
##################ITERATION #3 ****************************************
 epoch: 0, train_loss: 1.2954, test_loss: 1.2779, test_f1: 0.3377
 epoch: 1, train_loss: 1.1295, test_loss: 1.2299, test_f1: 0.3619
 epoch: 2, train_loss: 1.0957, test_loss: 1.1259, test_f1: 0.4074
 epoch: 3, train_loss: 1.0344, test_loss: 1.0729, test_f1: 0.4217
 epoch: 4, train_loss: 1.0012, test_loss: 1.0352, test_f1: 0.4579
 epoch: 5, train_loss: 0.9607, test_loss: 1.0143, test_f1: 0.4959
 epoch: 6, train_loss: 0.9453, test_loss: 0.9950, test_f1: 0.5146
 epoch: 7, train_loss: 0.9068, test_loss: 1.1583, test_f1: 0.4784
 epoch: 8, train_loss: 0.8904, test_loss: 1.0647, test_f1: 0.5074
 epoch: 9, train_loss: 0.8760, test_loss: 1.0823, test_f1: 0.4958
 epoch: 10, train_loss: 0.8677, test_loss: 1.0817, test_f1: 0.4954
 epoch: 11, train_loss: 0.8161, test_loss: 1.0573, test_f1: 0.5271
 epoch: 12, train_loss: 0.7990, test_loss: 1.1346, test_f1: 0.5066
 epoch: 13, train_loss: 0.7762, test_loss: 1.1573, test_f1: 0.5198
 epoch: 14, train_loss: 0.7734, test_loss: 1.1805, test_f1: 0.4946
 epoch: 15, train_loss: 0.7420, test_loss: 1.1979, test_f1: 0.5319
 epoch: 16, train_loss: 0.7194, test_loss: 1.3044, test_f1: 0.5066
 epoch: 17, train_loss: 0.7029, test_loss: 1.2592, test_f1: 0.5179
 epoch: 18, train_loss: 0.6932, test_loss: 1.3290, test_f1: 0.5205
 epoch: 19, train_loss: 0.7019, test_loss: 1.3249, test_f1: 0.5038
 epoch: 20, train_loss: 0.6915, test_loss: 1.3777, test_f1: 0.4949
 epoch: 21, train_loss: 0.6609, test_loss: 1.3611, test_f1: 0.5372
 epoch: 22, train_loss: 0.6379, test_loss: 1.3552, test_f1: 0.5435
 epoch: 23, train_loss: 0.6205, test_loss: 1.3410, test_f1: 0.5303
 epoch: 24, train_loss: 0.6206, test_loss: 1.6367, test_f1: 0.5217
 epoch: 25, train_loss: 0.6239, test_loss: 1.6573, test_f1: 0.4920
 epoch: 26, train_loss: 0.6081, test_loss: 1.4894, test_f1: 0.5461
 epoch: 27, train_loss: 0.5710, test_loss: 1.5187, test_f1: 0.5337
 epoch: 28, train_loss: 0.5641, test_loss: 1.7531, test_f1: 0.5205
 epoch: 29, train_loss: 0.5366, test_loss: 1.6444, test_f1: 0.5467
 epoch: 30, train_loss: 0.5571, test_loss: 1.7664, test_f1: 0.4923
 epoch: 31, train_loss: 0.5479, test_loss: 1.6268, test_f1: 0.5289
 epoch: 32, train_loss: 0.5274, test_loss: 1.8016, test_f1: 0.5305
 epoch: 33, train_loss: 0.5108, test_loss: 1.7477, test_f1: 0.5022
 epoch: 34, train_loss: 0.5086, test_loss: 1.7191, test_f1: 0.5505
 epoch: 35, train_loss: 0.4888, test_loss: 1.8203, test_f1: 0.5384
 epoch: 36, train_loss: 0.4799, test_loss: 1.8562, test_f1: 0.5379
 epoch: 37, train_loss: 0.4979, test_loss: 1.9205, test_f1: 0.5437
 epoch: 38, train_loss: 0.4984, test_loss: 1.8641, test_f1: 0.5368
 epoch: 39, train_loss: 0.4911, test_loss: 1.7816, test_f1: 0.5198
 epoch: 40, train_loss: 0.5060, test_loss: 1.9311, test_f1: 0.5148
 epoch: 41, train_loss: 0.4780, test_loss: 1.9386, test_f1: 0.5066
 epoch: 42, train_loss: 0.4471, test_loss: 1.8914, test_f1: 0.5303
 epoch: 43, train_loss: 0.4494, test_loss: 2.0682, test_f1: 0.5247
 epoch: 44, train_loss: 0.4241, test_loss: 1.8429, test_f1: 0.5231
 epoch: 45, train_loss: 0.4029, test_loss: 2.3086, test_f1: 0.5189
 epoch: 46, train_loss: 0.4201, test_loss: 1.8724, test_f1: 0.5569
 epoch: 47, train_loss: 0.4308, test_loss: 2.0497, test_f1: 0.5077
 epoch: 48, train_loss: 0.4161, test_loss: 2.2151, test_f1: 0.5136
 epoch: 49, train_loss: 0.3751, test_loss: 2.3415, test_f1: 0.4888
 epoch: 50, train_loss: 0.3977, test_loss: 2.3170, test_f1: 0.5650
 epoch: 51, train_loss: 0.3649, test_loss: 2.1596, test_f1: 0.5121
 epoch: 52, train_loss: 0.3238, test_loss: 2.2475, test_f1: 0.5104
 epoch: 53, train_loss: 0.2984, test_loss: 2.3545, test_f1: 0.5238
 epoch: 54, train_loss: 0.2877, test_loss: 2.2747, test_f1: 0.5260
 epoch: 55, train_loss: 0.2681, test_loss: 2.4816, test_f1: 0.5185
 epoch: 56, train_loss: 0.2917, test_loss: 2.5010, test_f1: 0.5215
 epoch: 57, train_loss: 0.2771, test_loss: 2.8311, test_f1: 0.4992
 epoch: 58, train_loss: 0.2691, test_loss: 2.5336, test_f1: 0.5134
 epoch: 59, train_loss: 0.2638, test_loss: 2.6033, test_f1: 0.5331
 epoch: 60, train_loss: 0.2703, test_loss: 2.6660, test_f1: 0.5068
 epoch: 61, train_loss: 0.2353, test_loss: 2.7665, test_f1: 0.5022
 epoch: 62, train_loss: 0.2406, test_loss: 2.8601, test_f1: 0.5037
 epoch: 63, train_loss: 0.2489, test_loss: 3.0057, test_f1: 0.5082
 epoch: 64, train_loss: 0.2402, test_loss: 2.7050, test_f1: 0.5044
 epoch: 65, train_loss: 0.2391, test_loss: 2.8484, test_f1: 0.5104
 epoch: 66, train_loss: 0.2529, test_loss: 3.1575, test_f1: 0.5117
 epoch: 67, train_loss: 0.2486, test_loss: 2.9866, test_f1: 0.5201
 epoch: 68, train_loss: 0.2524, test_loss: 2.9010, test_f1: 0.5071
 epoch: 69, train_loss: 0.2249, test_loss: 2.8002, test_f1: 0.5183
 epoch: 70, train_loss: 0.2236, test_loss: 3.2558, test_f1: 0.4915
 epoch: 71, train_loss: 0.2334, test_loss: 2.7104, test_f1: 0.5137
 epoch: 72, train_loss: 0.2332, test_loss: 3.1459, test_f1: 0.5128
 epoch: 73, train_loss: 0.2355, test_loss: 2.9923, test_f1: 0.5241
 epoch: 74, train_loss: 0.2174, test_loss: 3.2011, test_f1: 0.5165
 epoch: 75, train_loss: 0.2221, test_loss: 3.0390, test_f1: 0.5408
 epoch: 76, train_loss: 0.2009, test_loss: 3.0294, test_f1: 0.5200
 epoch: 77, train_loss: 0.2121, test_loss: 2.9799, test_f1: 0.5050
 epoch: 78, train_loss: 0.2168, test_loss: 3.3267, test_f1: 0.5181
 epoch: 79, train_loss: 0.2282, test_loss: 3.1716, test_f1: 0.5052
 epoch: 80, train_loss: 0.2126, test_loss: 3.1226, test_f1: 0.4899
 epoch: 81, train_loss: 0.2237, test_loss: 2.9591, test_f1: 0.5120
 epoch: 82, train_loss: 0.2097, test_loss: 3.1435, test_f1: 0.5225
 epoch: 83, train_loss: 0.2175, test_loss: 3.4215, test_f1: 0.5146
 epoch: 84, train_loss: 0.1954, test_loss: 3.2828, test_f1: 0.5035
 epoch: 85, train_loss: 0.1922, test_loss: 3.5155, test_f1: 0.4928
 epoch: 86, train_loss: 0.1835, test_loss: 3.2348, test_f1: 0.5011
 epoch: 87, train_loss: 0.1921, test_loss: 3.3702, test_f1: 0.5133
 epoch: 88, train_loss: 0.1949, test_loss: 3.4684, test_f1: 0.4857
 epoch: 89, train_loss: 0.1987, test_loss: 3.5345, test_f1: 0.5048
 epoch: 90, train_loss: 0.1745, test_loss: 3.4644, test_f1: 0.5112
 epoch: 91, train_loss: 0.1796, test_loss: 3.4567, test_f1: 0.4952
 epoch: 92, train_loss: 0.1722, test_loss: 3.5256, test_f1: 0.5118
 epoch: 93, train_loss: 0.1532, test_loss: 3.3875, test_f1: 0.5191
 epoch: 94, train_loss: 0.1654, test_loss: 3.4336, test_f1: 0.5099
 epoch: 95, train_loss: 0.1573, test_loss: 3.6207, test_f1: 0.4896
 epoch: 96, train_loss: 0.1595, test_loss: 3.2566, test_f1: 0.5160
 epoch: 97, train_loss: 0.1852, test_loss: 3.6801, test_f1: 0.5234
 epoch: 98, train_loss: 0.1893, test_loss: 3.5383, test_f1: 0.4948
 epoch: 99, train_loss: 0.1732, test_loss: 3.6944, test_f1: 0.5022
##################ITERATION #4 ****************************************
 epoch: 0, train_loss: 1.3455, test_loss: 1.3017, test_f1: 0.3423
 epoch: 1, train_loss: 1.1999, test_loss: 1.1979, test_f1: 0.5038
 epoch: 2, train_loss: 1.1226, test_loss: 1.0647, test_f1: 0.4693
 epoch: 3, train_loss: 1.0603, test_loss: 1.0313, test_f1: 0.5272
 epoch: 4, train_loss: 1.0240, test_loss: 1.0098, test_f1: 0.5143
 epoch: 5, train_loss: 0.9858, test_loss: 1.0109, test_f1: 0.4612
 epoch: 6, train_loss: 0.9905, test_loss: 0.9886, test_f1: 0.5183
 epoch: 7, train_loss: 0.9372, test_loss: 1.0698, test_f1: 0.4702
 epoch: 8, train_loss: 0.9268, test_loss: 0.9988, test_f1: 0.5222
 epoch: 9, train_loss: 0.9016, test_loss: 1.0033, test_f1: 0.5175
 epoch: 10, train_loss: 0.8740, test_loss: 0.9243, test_f1: 0.5499
 epoch: 11, train_loss: 0.8445, test_loss: 0.9471, test_f1: 0.5665
 epoch: 12, train_loss: 0.8449, test_loss: 1.0130, test_f1: 0.5049
 epoch: 13, train_loss: 0.8157, test_loss: 1.0587, test_f1: 0.5564
 epoch: 14, train_loss: 0.7970, test_loss: 1.1468, test_f1: 0.5145
 epoch: 15, train_loss: 0.7731, test_loss: 1.1053, test_f1: 0.5121
 epoch: 16, train_loss: 0.7586, test_loss: 1.1655, test_f1: 0.5166
 epoch: 17, train_loss: 0.7407, test_loss: 1.2078, test_f1: 0.5381
 epoch: 18, train_loss: 0.7612, test_loss: 1.2137, test_f1: 0.5096
 epoch: 19, train_loss: 0.7399, test_loss: 1.3041, test_f1: 0.5071
 epoch: 20, train_loss: 0.6964, test_loss: 1.2699, test_f1: 0.4941
 epoch: 21, train_loss: 0.7046, test_loss: 1.1374, test_f1: 0.5101
 epoch: 22, train_loss: 0.6641, test_loss: 1.1403, test_f1: 0.5486
 epoch: 23, train_loss: 0.6634, test_loss: 1.2691, test_f1: 0.5081
 epoch: 24, train_loss: 0.6676, test_loss: 1.3667, test_f1: 0.5228
 epoch: 25, train_loss: 0.6446, test_loss: 1.2973, test_f1: 0.5384
 epoch: 26, train_loss: 0.6325, test_loss: 1.3637, test_f1: 0.5270
 epoch: 27, train_loss: 0.6240, test_loss: 1.3012, test_f1: 0.5196
 epoch: 28, train_loss: 0.6093, test_loss: 1.3380, test_f1: 0.5518
 epoch: 29, train_loss: 0.5872, test_loss: 1.4983, test_f1: 0.5296
 epoch: 30, train_loss: 0.5718, test_loss: 1.4022, test_f1: 0.5226
 epoch: 31, train_loss: 0.5808, test_loss: 1.5372, test_f1: 0.5159
 epoch: 32, train_loss: 0.5954, test_loss: 1.4191, test_f1: 0.5477
 epoch: 33, train_loss: 0.5468, test_loss: 1.5316, test_f1: 0.5254
 epoch: 34, train_loss: 0.5434, test_loss: 1.4608, test_f1: 0.5435
 epoch: 35, train_loss: 0.5303, test_loss: 1.7087, test_f1: 0.5290
 epoch: 36, train_loss: 0.5097, test_loss: 1.4989, test_f1: 0.5485
 epoch: 37, train_loss: 0.5186, test_loss: 1.8044, test_f1: 0.5036
 epoch: 38, train_loss: 0.5579, test_loss: 1.7465, test_f1: 0.5329
 epoch: 39, train_loss: 0.5525, test_loss: 1.6042, test_f1: 0.5261
 epoch: 40, train_loss: 0.5103, test_loss: 1.4988, test_f1: 0.5370
 epoch: 41, train_loss: 0.4839, test_loss: 1.6058, test_f1: 0.5193
 epoch: 42, train_loss: 0.4896, test_loss: 1.9597, test_f1: 0.5026
 epoch: 43, train_loss: 0.5031, test_loss: 1.4678, test_f1: 0.5435
 epoch: 44, train_loss: 0.4888, test_loss: 1.7138, test_f1: 0.5306
 epoch: 45, train_loss: 0.4458, test_loss: 1.4803, test_f1: 0.5700
 epoch: 46, train_loss: 0.4675, test_loss: 1.8416, test_f1: 0.5514
 epoch: 47, train_loss: 0.4624, test_loss: 1.9838, test_f1: 0.5055
 epoch: 48, train_loss: 0.4597, test_loss: 1.6789, test_f1: 0.5403
 epoch: 49, train_loss: 0.4635, test_loss: 1.6253, test_f1: 0.5454
 epoch: 50, train_loss: 0.4187, test_loss: 1.8911, test_f1: 0.5447
 epoch: 51, train_loss: 0.3857, test_loss: 1.8175, test_f1: 0.5392
 epoch: 52, train_loss: 0.3585, test_loss: 1.8794, test_f1: 0.5685
 epoch: 53, train_loss: 0.3331, test_loss: 1.9030, test_f1: 0.5425
 epoch: 54, train_loss: 0.3235, test_loss: 1.8962, test_f1: 0.5401
 epoch: 55, train_loss: 0.3149, test_loss: 2.1011, test_f1: 0.5411
 epoch: 56, train_loss: 0.3415, test_loss: 1.9766, test_f1: 0.5347
 epoch: 57, train_loss: 0.3279, test_loss: 2.1763, test_f1: 0.5486
 epoch: 58, train_loss: 0.3130, test_loss: 2.1137, test_f1: 0.5477
 epoch: 59, train_loss: 0.3057, test_loss: 2.1443, test_f1: 0.5434
 epoch: 60, train_loss: 0.3128, test_loss: 2.2736, test_f1: 0.5379
 epoch: 61, train_loss: 0.2955, test_loss: 2.1899, test_f1: 0.5344
 epoch: 62, train_loss: 0.2955, test_loss: 2.1045, test_f1: 0.5500
 epoch: 63, train_loss: 0.2990, test_loss: 2.2230, test_f1: 0.5436
 epoch: 64, train_loss: 0.2921, test_loss: 2.2130, test_f1: 0.5480
 epoch: 65, train_loss: 0.2849, test_loss: 2.5162, test_f1: 0.5324
 epoch: 66, train_loss: 0.2895, test_loss: 2.4010, test_f1: 0.5249
 epoch: 67, train_loss: 0.2736, test_loss: 2.3643, test_f1: 0.5414
 epoch: 68, train_loss: 0.2894, test_loss: 2.3487, test_f1: 0.5245
 epoch: 69, train_loss: 0.2916, test_loss: 2.3568, test_f1: 0.5261
 epoch: 70, train_loss: 0.2752, test_loss: 2.2628, test_f1: 0.5584
 epoch: 71, train_loss: 0.2793, test_loss: 2.3317, test_f1: 0.5564
 epoch: 72, train_loss: 0.2598, test_loss: 2.5193, test_f1: 0.5495
 epoch: 73, train_loss: 0.2755, test_loss: 2.2529, test_f1: 0.5388
 epoch: 74, train_loss: 0.2631, test_loss: 2.4685, test_f1: 0.5496
 epoch: 75, train_loss: 0.2533, test_loss: 2.5614, test_f1: 0.5239
 epoch: 76, train_loss: 0.2526, test_loss: 2.4636, test_f1: 0.5580
 epoch: 77, train_loss: 0.2689, test_loss: 2.6272, test_f1: 0.5276
 epoch: 78, train_loss: 0.2518, test_loss: 2.6440, test_f1: 0.5552
 epoch: 79, train_loss: 0.2509, test_loss: 2.4413, test_f1: 0.5543
 epoch: 80, train_loss: 0.2435, test_loss: 2.6709, test_f1: 0.5215
 epoch: 81, train_loss: 0.2278, test_loss: 2.7203, test_f1: 0.5116
 epoch: 82, train_loss: 0.2379, test_loss: 2.5472, test_f1: 0.5506
 epoch: 83, train_loss: 0.2473, test_loss: 2.4473, test_f1: 0.5529
 epoch: 84, train_loss: 0.2299, test_loss: 2.7515, test_f1: 0.5403
 epoch: 85, train_loss: 0.2278, test_loss: 2.9093, test_f1: 0.5247
 epoch: 86, train_loss: 0.2326, test_loss: 2.7918, test_f1: 0.5332
 epoch: 87, train_loss: 0.2506, test_loss: 2.6112, test_f1: 0.5515
 epoch: 88, train_loss: 0.2216, test_loss: 2.7402, test_f1: 0.5483
 epoch: 89, train_loss: 0.2315, test_loss: 2.9672, test_f1: 0.5319
 epoch: 90, train_loss: 0.2245, test_loss: 2.7166, test_f1: 0.5423
 epoch: 91, train_loss: 0.2141, test_loss: 2.7111, test_f1: 0.5401
 epoch: 92, train_loss: 0.2191, test_loss: 2.5408, test_f1: 0.5387
 epoch: 93, train_loss: 0.2376, test_loss: 2.7597, test_f1: 0.5457
 epoch: 94, train_loss: 0.2259, test_loss: 2.9395, test_f1: 0.5294
 epoch: 95, train_loss: 0.2273, test_loss: 2.7349, test_f1: 0.5353
 epoch: 96, train_loss: 0.2196, test_loss: 2.9078, test_f1: 0.5340
 epoch: 97, train_loss: 0.1991, test_loss: 2.7979, test_f1: 0.5429
 epoch: 98, train_loss: 0.1944, test_loss: 2.9493, test_f1: 0.5437
 epoch: 99, train_loss: 0.2152, test_loss: 2.8228, test_f1: 0.5414
##################ITERATION #5 ****************************************
 epoch: 0, train_loss: 1.4298, test_loss: 1.3993, test_f1: 0.3446
 epoch: 1, train_loss: 1.2392, test_loss: 1.2024, test_f1: 0.3850
 epoch: 2, train_loss: 1.1731, test_loss: 1.1370, test_f1: 0.3976
 epoch: 3, train_loss: 1.0943, test_loss: 1.0799, test_f1: 0.4342
 epoch: 4, train_loss: 1.0582, test_loss: 1.0117, test_f1: 0.5382
 epoch: 5, train_loss: 1.0274, test_loss: 0.9996, test_f1: 0.4980
 epoch: 6, train_loss: 0.9900, test_loss: 1.0313, test_f1: 0.5033
 epoch: 7, train_loss: 0.9716, test_loss: 1.0130, test_f1: 0.5060
 epoch: 8, train_loss: 0.9288, test_loss: 1.0181, test_f1: 0.4891
 epoch: 9, train_loss: 0.8989, test_loss: 0.9948, test_f1: 0.5306
 epoch: 10, train_loss: 0.8797, test_loss: 1.0436, test_f1: 0.4789
 epoch: 11, train_loss: 0.8545, test_loss: 0.9843, test_f1: 0.5410
 epoch: 12, train_loss: 0.8342, test_loss: 1.0591, test_f1: 0.4945
 epoch: 13, train_loss: 0.8243, test_loss: 1.0300, test_f1: 0.4884
 epoch: 14, train_loss: 0.7990, test_loss: 1.0551, test_f1: 0.5103
 epoch: 15, train_loss: 0.7727, test_loss: 1.0315, test_f1: 0.5061
 epoch: 16, train_loss: 0.7511, test_loss: 1.0351, test_f1: 0.5055
 epoch: 17, train_loss: 0.7438, test_loss: 1.2473, test_f1: 0.5326
 epoch: 18, train_loss: 0.7334, test_loss: 1.0373, test_f1: 0.5569
 epoch: 19, train_loss: 0.7182, test_loss: 1.0842, test_f1: 0.5327
 epoch: 20, train_loss: 0.7027, test_loss: 1.0837, test_f1: 0.5202
 epoch: 21, train_loss: 0.7022, test_loss: 1.0876, test_f1: 0.5073
 epoch: 22, train_loss: 0.6729, test_loss: 1.2783, test_f1: 0.5099
 epoch: 23, train_loss: 0.6603, test_loss: 1.1800, test_f1: 0.5479
 epoch: 24, train_loss: 0.6438, test_loss: 1.2111, test_f1: 0.5274
 epoch: 25, train_loss: 0.6488, test_loss: 1.2159, test_f1: 0.5402
 epoch: 26, train_loss: 0.6407, test_loss: 1.1677, test_f1: 0.5324
 epoch: 27, train_loss: 0.6271, test_loss: 1.3430, test_f1: 0.5297
 epoch: 28, train_loss: 0.6071, test_loss: 1.1868, test_f1: 0.5371
 epoch: 29, train_loss: 0.6117, test_loss: 1.4075, test_f1: 0.5277
 epoch: 30, train_loss: 0.5709, test_loss: 1.2885, test_f1: 0.5670
 epoch: 31, train_loss: 0.5554, test_loss: 1.3635, test_f1: 0.5625
 epoch: 32, train_loss: 0.5617, test_loss: 1.4471, test_f1: 0.5591
 epoch: 33, train_loss: 0.5703, test_loss: 1.2472, test_f1: 0.5804
 epoch: 34, train_loss: 0.5763, test_loss: 1.4503, test_f1: 0.5207
 epoch: 35, train_loss: 0.5438, test_loss: 1.3091, test_f1: 0.5579
 epoch: 36, train_loss: 0.5233, test_loss: 1.2939, test_f1: 0.5614
 epoch: 37, train_loss: 0.5105, test_loss: 1.5187, test_f1: 0.5234
 epoch: 38, train_loss: 0.4936, test_loss: 1.5081, test_f1: 0.5295
 epoch: 39, train_loss: 0.5277, test_loss: 1.5249, test_f1: 0.5365
 epoch: 40, train_loss: 0.5146, test_loss: 1.4521, test_f1: 0.4771
 epoch: 41, train_loss: 0.4959, test_loss: 1.4620, test_f1: 0.5349
 epoch: 42, train_loss: 0.4813, test_loss: 1.6693, test_f1: 0.4958
 epoch: 43, train_loss: 0.4841, test_loss: 1.5233, test_f1: 0.5316
 epoch: 44, train_loss: 0.4586, test_loss: 2.3628, test_f1: 0.4965
 epoch: 45, train_loss: 0.4539, test_loss: 1.5714, test_f1: 0.5293
 epoch: 46, train_loss: 0.4555, test_loss: 1.6725, test_f1: 0.5295
 epoch: 47, train_loss: 0.4510, test_loss: 1.6243, test_f1: 0.5536
 epoch: 48, train_loss: 0.4434, test_loss: 1.9449, test_f1: 0.5147
 epoch: 49, train_loss: 0.4594, test_loss: 1.5236, test_f1: 0.5405
 epoch: 50, train_loss: 0.4421, test_loss: 1.6705, test_f1: 0.5342
 epoch: 51, train_loss: 0.3851, test_loss: 1.7006, test_f1: 0.5430
 epoch: 52, train_loss: 0.3589, test_loss: 1.6679, test_f1: 0.5311
 epoch: 53, train_loss: 0.3405, test_loss: 1.8158, test_f1: 0.5240
 epoch: 54, train_loss: 0.3271, test_loss: 1.8850, test_f1: 0.5239
 epoch: 55, train_loss: 0.3372, test_loss: 2.0662, test_f1: 0.5065
 epoch: 56, train_loss: 0.3153, test_loss: 1.8422, test_f1: 0.5373
 epoch: 57, train_loss: 0.3158, test_loss: 1.9611, test_f1: 0.5236
 epoch: 58, train_loss: 0.3098, test_loss: 2.1776, test_f1: 0.5120
 epoch: 59, train_loss: 0.3206, test_loss: 2.0424, test_f1: 0.5377
 epoch: 60, train_loss: 0.3156, test_loss: 2.1216, test_f1: 0.5360
 epoch: 61, train_loss: 0.2938, test_loss: 2.1184, test_f1: 0.5259
 epoch: 62, train_loss: 0.2969, test_loss: 2.1959, test_f1: 0.5256
 epoch: 63, train_loss: 0.2924, test_loss: 2.1878, test_f1: 0.5385
 epoch: 64, train_loss: 0.2813, test_loss: 2.1396, test_f1: 0.5207
 epoch: 65, train_loss: 0.2849, test_loss: 2.0676, test_f1: 0.5185
 epoch: 66, train_loss: 0.2887, test_loss: 2.3731, test_f1: 0.5405
 epoch: 67, train_loss: 0.2744, test_loss: 2.2222, test_f1: 0.5256
 epoch: 68, train_loss: 0.2818, test_loss: 2.2988, test_f1: 0.5293
 epoch: 69, train_loss: 0.2758, test_loss: 2.4624, test_f1: 0.5299
 epoch: 70, train_loss: 0.2615, test_loss: 2.1502, test_f1: 0.5437
 epoch: 71, train_loss: 0.2658, test_loss: 2.1590, test_f1: 0.5525
 epoch: 72, train_loss: 0.2902, test_loss: 2.2616, test_f1: 0.5455
 epoch: 73, train_loss: 0.2564, test_loss: 2.2144, test_f1: 0.5571
 epoch: 74, train_loss: 0.2578, test_loss: 2.3286, test_f1: 0.5428
 epoch: 75, train_loss: 0.2486, test_loss: 2.3927, test_f1: 0.5511
 epoch: 76, train_loss: 0.2303, test_loss: 2.3350, test_f1: 0.5373
 epoch: 77, train_loss: 0.2275, test_loss: 2.4065, test_f1: 0.5490
 epoch: 78, train_loss: 0.2513, test_loss: 2.4633, test_f1: 0.5506
 epoch: 79, train_loss: 0.2690, test_loss: 2.5378, test_f1: 0.5251
 epoch: 80, train_loss: 0.2655, test_loss: 2.5222, test_f1: 0.5295
 epoch: 81, train_loss: 0.2418, test_loss: 2.7381, test_f1: 0.5189
 epoch: 82, train_loss: 0.2471, test_loss: 2.8505, test_f1: 0.4941
 epoch: 83, train_loss: 0.2442, test_loss: 2.5636, test_f1: 0.5087
 epoch: 84, train_loss: 0.2500, test_loss: 2.4126, test_f1: 0.5366
 epoch: 85, train_loss: 0.2270, test_loss: 2.4648, test_f1: 0.5416
 epoch: 86, train_loss: 0.2119, test_loss: 2.4285, test_f1: 0.5404
 epoch: 87, train_loss: 0.2269, test_loss: 2.3923, test_f1: 0.5285
 epoch: 88, train_loss: 0.2175, test_loss: 2.6976, test_f1: 0.5263
 epoch: 89, train_loss: 0.2139, test_loss: 2.9177, test_f1: 0.5385
 epoch: 90, train_loss: 0.2112, test_loss: 2.5608, test_f1: 0.5494
 epoch: 91, train_loss: 0.1988, test_loss: 2.6046, test_f1: 0.5508
 epoch: 92, train_loss: 0.1990, test_loss: 2.5825, test_f1: 0.5599
 epoch: 93, train_loss: 0.2018, test_loss: 2.6413, test_f1: 0.5393
 epoch: 94, train_loss: 0.2363, test_loss: 2.6897, test_f1: 0.5235
 epoch: 95, train_loss: 0.2201, test_loss: 2.6882, test_f1: 0.5627
 epoch: 96, train_loss: 0.2115, test_loss: 2.7831, test_f1: 0.5244
 epoch: 97, train_loss: 0.2024, test_loss: 2.6111, test_f1: 0.5499
 epoch: 98, train_loss: 0.1948, test_loss: 2.7956, test_f1: 0.5488
 epoch: 99, train_loss: 0.1940, test_loss: 2.5745, test_f1: 0.5433
##################ITERATION #6 ****************************************
 epoch: 0, train_loss: 1.4958, test_loss: 1.2660, test_f1: 0.3270
 epoch: 1, train_loss: 1.2128, test_loss: 1.1611, test_f1: 0.4754
 epoch: 2, train_loss: 1.1162, test_loss: 1.0772, test_f1: 0.4408
 epoch: 3, train_loss: 1.0497, test_loss: 1.0313, test_f1: 0.4819
 epoch: 4, train_loss: 1.0234, test_loss: 1.0041, test_f1: 0.4691
 epoch: 5, train_loss: 0.9780, test_loss: 0.9812, test_f1: 0.5097
 epoch: 6, train_loss: 0.9520, test_loss: 0.9668, test_f1: 0.4940
 epoch: 7, train_loss: 0.9160, test_loss: 0.9560, test_f1: 0.5105
 epoch: 8, train_loss: 0.8871, test_loss: 1.0101, test_f1: 0.5009
 epoch: 9, train_loss: 0.8740, test_loss: 1.0602, test_f1: 0.4759
 epoch: 10, train_loss: 0.8541, test_loss: 1.0271, test_f1: 0.5011
 epoch: 11, train_loss: 0.8259, test_loss: 0.9558, test_f1: 0.5079
 epoch: 12, train_loss: 0.8058, test_loss: 1.0379, test_f1: 0.5011
 epoch: 13, train_loss: 0.7888, test_loss: 1.0559, test_f1: 0.5224
 epoch: 14, train_loss: 0.7674, test_loss: 1.0172, test_f1: 0.5386
 epoch: 15, train_loss: 0.7482, test_loss: 1.1400, test_f1: 0.5155
 epoch: 16, train_loss: 0.7334, test_loss: 1.1627, test_f1: 0.4950
 epoch: 17, train_loss: 0.7327, test_loss: 1.0797, test_f1: 0.5187
 epoch: 18, train_loss: 0.7153, test_loss: 1.0834, test_f1: 0.5191
 epoch: 19, train_loss: 0.7120, test_loss: 1.1052, test_f1: 0.5133
 epoch: 20, train_loss: 0.6844, test_loss: 1.1954, test_f1: 0.4941
 epoch: 21, train_loss: 0.6564, test_loss: 1.1834, test_f1: 0.5188
 epoch: 22, train_loss: 0.6408, test_loss: 1.2692, test_f1: 0.5046
 epoch: 23, train_loss: 0.6279, test_loss: 1.1908, test_f1: 0.5392
 epoch: 24, train_loss: 0.6237, test_loss: 1.1948, test_f1: 0.5454
 epoch: 25, train_loss: 0.6306, test_loss: 1.2587, test_f1: 0.5486
 epoch: 26, train_loss: 0.6216, test_loss: 1.2047, test_f1: 0.5178
 epoch: 27, train_loss: 0.6016, test_loss: 1.3497, test_f1: 0.4979
 epoch: 28, train_loss: 0.5974, test_loss: 1.2905, test_f1: 0.5369
 epoch: 29, train_loss: 0.5824, test_loss: 1.5655, test_f1: 0.4984
 epoch: 30, train_loss: 0.5780, test_loss: 1.2726, test_f1: 0.5627
 epoch: 31, train_loss: 0.5595, test_loss: 1.4838, test_f1: 0.4901
 epoch: 32, train_loss: 0.5523, test_loss: 1.4690, test_f1: 0.5352
 epoch: 33, train_loss: 0.5353, test_loss: 1.3862, test_f1: 0.5399
 epoch: 34, train_loss: 0.5286, test_loss: 1.6052, test_f1: 0.5342
 epoch: 35, train_loss: 0.5338, test_loss: 1.4894, test_f1: 0.5312
 epoch: 36, train_loss: 0.5501, test_loss: 1.3837, test_f1: 0.5018
 epoch: 37, train_loss: 0.5470, test_loss: 1.3488, test_f1: 0.5442
 epoch: 38, train_loss: 0.5160, test_loss: 1.3527, test_f1: 0.5436
 epoch: 39, train_loss: 0.4747, test_loss: 1.6657, test_f1: 0.5439
 epoch: 40, train_loss: 0.4624, test_loss: 1.6982, test_f1: 0.5340
 epoch: 41, train_loss: 0.4665, test_loss: 1.6154, test_f1: 0.5402
 epoch: 42, train_loss: 0.4895, test_loss: 1.6897, test_f1: 0.5253
 epoch: 43, train_loss: 0.4547, test_loss: 1.5651, test_f1: 0.5275
 epoch: 44, train_loss: 0.4546, test_loss: 1.7787, test_f1: 0.5028
 epoch: 45, train_loss: 0.4492, test_loss: 1.8262, test_f1: 0.5568
 epoch: 46, train_loss: 0.4413, test_loss: 1.5819, test_f1: 0.5436
 epoch: 47, train_loss: 0.4560, test_loss: 1.9210, test_f1: 0.5264
 epoch: 48, train_loss: 0.4298, test_loss: 1.7659, test_f1: 0.5066
 epoch: 49, train_loss: 0.4155, test_loss: 1.8908, test_f1: 0.5096
 epoch: 50, train_loss: 0.3919, test_loss: 1.7862, test_f1: 0.5325
 epoch: 51, train_loss: 0.3587, test_loss: 1.8321, test_f1: 0.5488
 epoch: 52, train_loss: 0.3555, test_loss: 2.0871, test_f1: 0.5428
 epoch: 53, train_loss: 0.3301, test_loss: 1.9350, test_f1: 0.5530
 epoch: 54, train_loss: 0.3199, test_loss: 2.0021, test_f1: 0.5439
 epoch: 55, train_loss: 0.3206, test_loss: 2.0423, test_f1: 0.5411
 epoch: 56, train_loss: 0.3107, test_loss: 2.0417, test_f1: 0.5337
 epoch: 57, train_loss: 0.2972, test_loss: 2.0869, test_f1: 0.5630
 epoch: 58, train_loss: 0.3007, test_loss: 2.2069, test_f1: 0.5474
 epoch: 59, train_loss: 0.2860, test_loss: 2.1271, test_f1: 0.5510
 epoch: 60, train_loss: 0.2772, test_loss: 2.1911, test_f1: 0.5389
 epoch: 61, train_loss: 0.2823, test_loss: 2.0920, test_f1: 0.5408
 epoch: 62, train_loss: 0.2984, test_loss: 2.3361, test_f1: 0.5389
 epoch: 63, train_loss: 0.2933, test_loss: 2.2399, test_f1: 0.5490
 epoch: 64, train_loss: 0.2862, test_loss: 2.2900, test_f1: 0.5286
 epoch: 65, train_loss: 0.2771, test_loss: 2.2892, test_f1: 0.5376
 epoch: 66, train_loss: 0.2757, test_loss: 2.3835, test_f1: 0.5435
 epoch: 67, train_loss: 0.2864, test_loss: 2.3249, test_f1: 0.5295
 epoch: 68, train_loss: 0.2744, test_loss: 2.4668, test_f1: 0.5165
 epoch: 69, train_loss: 0.2686, test_loss: 2.4200, test_f1: 0.5473
 epoch: 70, train_loss: 0.2647, test_loss: 2.3201, test_f1: 0.5529
 epoch: 71, train_loss: 0.2546, test_loss: 2.3323, test_f1: 0.5562
 epoch: 72, train_loss: 0.2445, test_loss: 2.2226, test_f1: 0.5577
 epoch: 73, train_loss: 0.2508, test_loss: 2.5329, test_f1: 0.5451
 epoch: 74, train_loss: 0.2404, test_loss: 2.5631, test_f1: 0.5354
 epoch: 75, train_loss: 0.2462, test_loss: 2.2964, test_f1: 0.5576
 epoch: 76, train_loss: 0.2444, test_loss: 2.6086, test_f1: 0.5310
 epoch: 77, train_loss: 0.2520, test_loss: 2.6494, test_f1: 0.5387
 epoch: 78, train_loss: 0.2491, test_loss: 2.5628, test_f1: 0.5216
 epoch: 79, train_loss: 0.2581, test_loss: 2.5923, test_f1: 0.5280
 epoch: 80, train_loss: 0.2391, test_loss: 2.3327, test_f1: 0.5244
 epoch: 81, train_loss: 0.2264, test_loss: 2.5768, test_f1: 0.5202
 epoch: 82, train_loss: 0.2367, test_loss: 2.5317, test_f1: 0.5247
 epoch: 83, train_loss: 0.2161, test_loss: 2.6768, test_f1: 0.5369
 epoch: 84, train_loss: 0.2209, test_loss: 2.6843, test_f1: 0.5572
 epoch: 85, train_loss: 0.2287, test_loss: 3.0457, test_f1: 0.5333
 epoch: 86, train_loss: 0.2241, test_loss: 2.6237, test_f1: 0.5252
 epoch: 87, train_loss: 0.2268, test_loss: 2.7962, test_f1: 0.5265
 epoch: 88, train_loss: 0.2220, test_loss: 2.5410, test_f1: 0.5287
 epoch: 89, train_loss: 0.2118, test_loss: 2.4917, test_f1: 0.5500
 epoch: 90, train_loss: 0.2252, test_loss: 2.5906, test_f1: 0.5467
 epoch: 91, train_loss: 0.2223, test_loss: 2.6167, test_f1: 0.5515
 epoch: 92, train_loss: 0.2087, test_loss: 2.6740, test_f1: 0.5319
 epoch: 93, train_loss: 0.1944, test_loss: 2.7122, test_f1: 0.5440
 epoch: 94, train_loss: 0.2020, test_loss: 2.9968, test_f1: 0.5462
 epoch: 95, train_loss: 0.2051, test_loss: 2.9460, test_f1: 0.5243
 epoch: 96, train_loss: 0.2152, test_loss: 2.7852, test_f1: 0.5414
 epoch: 97, train_loss: 0.2089, test_loss: 2.5792, test_f1: 0.5795
 epoch: 98, train_loss: 0.2277, test_loss: 2.9061, test_f1: 0.5261
 epoch: 99, train_loss: 0.2119, test_loss: 2.8029, test_f1: 0.5329
##################ITERATION #7 ****************************************
 epoch: 0, train_loss: 1.4858, test_loss: 1.2656, test_f1: 0.3310
 epoch: 1, train_loss: 1.1758, test_loss: 1.1913, test_f1: 0.3622
 epoch: 2, train_loss: 1.1181, test_loss: 1.1417, test_f1: 0.4090
 epoch: 3, train_loss: 1.0811, test_loss: 1.0831, test_f1: 0.4484
 epoch: 4, train_loss: 1.0079, test_loss: 1.0495, test_f1: 0.4590
 epoch: 5, train_loss: 0.9771, test_loss: 1.0297, test_f1: 0.4667
 epoch: 6, train_loss: 0.9525, test_loss: 0.9528, test_f1: 0.5128
 epoch: 7, train_loss: 0.9238, test_loss: 0.9809, test_f1: 0.4806
 epoch: 8, train_loss: 0.8997, test_loss: 1.0401, test_f1: 0.4926
 epoch: 9, train_loss: 0.8681, test_loss: 1.0209, test_f1: 0.5433
 epoch: 10, train_loss: 0.8450, test_loss: 1.0710, test_f1: 0.5412
 epoch: 11, train_loss: 0.8339, test_loss: 1.0745, test_f1: 0.4908
 epoch: 12, train_loss: 0.7985, test_loss: 1.0871, test_f1: 0.5191
 epoch: 13, train_loss: 0.7834, test_loss: 1.1921, test_f1: 0.5171
 epoch: 14, train_loss: 0.7541, test_loss: 1.1300, test_f1: 0.5481
 epoch: 15, train_loss: 0.7476, test_loss: 1.1515, test_f1: 0.5269
 epoch: 16, train_loss: 0.7600, test_loss: 1.1020, test_f1: 0.5390
 epoch: 17, train_loss: 0.7148, test_loss: 1.1493, test_f1: 0.5597
 epoch: 18, train_loss: 0.7176, test_loss: 1.1922, test_f1: 0.5256
 epoch: 19, train_loss: 0.7019, test_loss: 1.2379, test_f1: 0.5065
 epoch: 20, train_loss: 0.6904, test_loss: 1.2007, test_f1: 0.5528
 epoch: 21, train_loss: 0.6613, test_loss: 1.2060, test_f1: 0.5780
 epoch: 22, train_loss: 0.6727, test_loss: 1.2641, test_f1: 0.5506
 epoch: 23, train_loss: 0.6386, test_loss: 1.3383, test_f1: 0.5021
 epoch: 24, train_loss: 0.6329, test_loss: 1.4488, test_f1: 0.5552
 epoch: 25, train_loss: 0.6161, test_loss: 1.2704, test_f1: 0.5659
 epoch: 26, train_loss: 0.5852, test_loss: 1.1915, test_f1: 0.5608
 epoch: 27, train_loss: 0.6067, test_loss: 1.3753, test_f1: 0.5231
 epoch: 28, train_loss: 0.6050, test_loss: 1.4125, test_f1: 0.5460
 epoch: 29, train_loss: 0.5898, test_loss: 1.5031, test_f1: 0.5113
 epoch: 30, train_loss: 0.5603, test_loss: 1.4494, test_f1: 0.5180
 epoch: 31, train_loss: 0.5560, test_loss: 1.4299, test_f1: 0.5645
 epoch: 32, train_loss: 0.5346, test_loss: 1.3927, test_f1: 0.5666
 epoch: 33, train_loss: 0.5430, test_loss: 1.4385, test_f1: 0.5650
 epoch: 34, train_loss: 0.5277, test_loss: 1.5125, test_f1: 0.5531
 epoch: 35, train_loss: 0.5241, test_loss: 1.4819, test_f1: 0.5346
 epoch: 36, train_loss: 0.5120, test_loss: 1.5499, test_f1: 0.5508
 epoch: 37, train_loss: 0.5405, test_loss: 1.5223, test_f1: 0.5318
 epoch: 38, train_loss: 0.5364, test_loss: 1.4025, test_f1: 0.5171
 epoch: 39, train_loss: 0.5022, test_loss: 1.6950, test_f1: 0.5284
 epoch: 40, train_loss: 0.4727, test_loss: 1.5012, test_f1: 0.5631
 epoch: 41, train_loss: 0.4702, test_loss: 1.5064, test_f1: 0.5424
 epoch: 42, train_loss: 0.4950, test_loss: 1.6088, test_f1: 0.5185
 epoch: 43, train_loss: 0.4806, test_loss: 1.6268, test_f1: 0.5087
 epoch: 44, train_loss: 0.4814, test_loss: 1.5988, test_f1: 0.5491
 epoch: 45, train_loss: 0.4724, test_loss: 1.4966, test_f1: 0.5271
 epoch: 46, train_loss: 0.4522, test_loss: 1.6763, test_f1: 0.5163
 epoch: 47, train_loss: 0.4270, test_loss: 1.6269, test_f1: 0.5273
 epoch: 48, train_loss: 0.4367, test_loss: 1.7326, test_f1: 0.5354
 epoch: 49, train_loss: 0.4230, test_loss: 1.8165, test_f1: 0.5171
 epoch: 50, train_loss: 0.4069, test_loss: 1.6904, test_f1: 0.5301
 epoch: 51, train_loss: 0.3825, test_loss: 1.6156, test_f1: 0.5430
 epoch: 52, train_loss: 0.3387, test_loss: 1.7551, test_f1: 0.5561
 epoch: 53, train_loss: 0.3173, test_loss: 1.7782, test_f1: 0.5478
 epoch: 54, train_loss: 0.3025, test_loss: 1.9266, test_f1: 0.5376
 epoch: 55, train_loss: 0.3017, test_loss: 1.9185, test_f1: 0.5520
 epoch: 56, train_loss: 0.3037, test_loss: 2.1715, test_f1: 0.5076
 epoch: 57, train_loss: 0.3112, test_loss: 2.1420, test_f1: 0.5246
 epoch: 58, train_loss: 0.2820, test_loss: 2.0102, test_f1: 0.5370
 epoch: 59, train_loss: 0.2683, test_loss: 2.1274, test_f1: 0.5360
 epoch: 60, train_loss: 0.2808, test_loss: 2.3045, test_f1: 0.5233
 epoch: 61, train_loss: 0.2730, test_loss: 1.9672, test_f1: 0.5436
 epoch: 62, train_loss: 0.2720, test_loss: 2.0867, test_f1: 0.5557
 epoch: 63, train_loss: 0.2913, test_loss: 2.0089, test_f1: 0.5584
 epoch: 64, train_loss: 0.2922, test_loss: 2.1044, test_f1: 0.5354
 epoch: 65, train_loss: 0.2755, test_loss: 2.0868, test_f1: 0.5466
 epoch: 66, train_loss: 0.2536, test_loss: 2.1746, test_f1: 0.5348
 epoch: 67, train_loss: 0.2560, test_loss: 2.1310, test_f1: 0.5348
 epoch: 68, train_loss: 0.2704, test_loss: 2.3793, test_f1: 0.5174
 epoch: 69, train_loss: 0.2761, test_loss: 2.1886, test_f1: 0.5308
 epoch: 70, train_loss: 0.2730, test_loss: 2.3141, test_f1: 0.5062
 epoch: 71, train_loss: 0.2657, test_loss: 2.2975, test_f1: 0.5377
 epoch: 72, train_loss: 0.2495, test_loss: 2.2460, test_f1: 0.5381
 epoch: 73, train_loss: 0.2480, test_loss: 2.1986, test_f1: 0.5254
 epoch: 74, train_loss: 0.2422, test_loss: 2.1300, test_f1: 0.5500
 epoch: 75, train_loss: 0.2460, test_loss: 2.3525, test_f1: 0.5491
 epoch: 76, train_loss: 0.2328, test_loss: 2.4500, test_f1: 0.5292
 epoch: 77, train_loss: 0.2246, test_loss: 2.5825, test_f1: 0.5225
 epoch: 78, train_loss: 0.2388, test_loss: 2.4969, test_f1: 0.5349
 epoch: 79, train_loss: 0.2399, test_loss: 2.4687, test_f1: 0.5376
 epoch: 80, train_loss: 0.2261, test_loss: 2.4761, test_f1: 0.5369
 epoch: 81, train_loss: 0.2330, test_loss: 2.6453, test_f1: 0.5250
 epoch: 82, train_loss: 0.2063, test_loss: 2.6162, test_f1: 0.5262
 epoch: 83, train_loss: 0.2276, test_loss: 2.5289, test_f1: 0.5299
 epoch: 84, train_loss: 0.2150, test_loss: 2.6922, test_f1: 0.5258
 epoch: 85, train_loss: 0.2228, test_loss: 2.5161, test_f1: 0.5460
 epoch: 86, train_loss: 0.2127, test_loss: 2.4803, test_f1: 0.5410
 epoch: 87, train_loss: 0.2229, test_loss: 2.3676, test_f1: 0.5293
 epoch: 88, train_loss: 0.2339, test_loss: 2.5217, test_f1: 0.5138
 epoch: 89, train_loss: 0.2223, test_loss: 3.0678, test_f1: 0.5273
 epoch: 90, train_loss: 0.2137, test_loss: 2.6560, test_f1: 0.5270
 epoch: 91, train_loss: 0.1893, test_loss: 2.7431, test_f1: 0.5259
 epoch: 92, train_loss: 0.1913, test_loss: 2.6258, test_f1: 0.5326
 epoch: 93, train_loss: 0.2043, test_loss: 2.6380, test_f1: 0.5569
 epoch: 94, train_loss: 0.2335, test_loss: 2.6519, test_f1: 0.5314
 epoch: 95, train_loss: 0.2135, test_loss: 2.6153, test_f1: 0.5121
 epoch: 96, train_loss: 0.2049, test_loss: 2.3992, test_f1: 0.5463
 epoch: 97, train_loss: 0.2027, test_loss: 2.4997, test_f1: 0.5188
 epoch: 98, train_loss: 0.1883, test_loss: 2.4206, test_f1: 0.5404
 epoch: 99, train_loss: 0.1902, test_loss: 2.5369, test_f1: 0.5674
##################ITERATION #8 ****************************************
 epoch: 0, train_loss: 1.5634, test_loss: 1.3378, test_f1: 0.2895
 epoch: 1, train_loss: 1.2199, test_loss: 1.2133, test_f1: 0.3036
 epoch: 2, train_loss: 1.1429, test_loss: 1.1193, test_f1: 0.4304
 epoch: 3, train_loss: 1.0776, test_loss: 1.0443, test_f1: 0.4918
 epoch: 4, train_loss: 1.0311, test_loss: 1.0264, test_f1: 0.4603
 epoch: 5, train_loss: 1.0061, test_loss: 0.9719, test_f1: 0.5288
 epoch: 6, train_loss: 0.9658, test_loss: 0.9731, test_f1: 0.5016
 epoch: 7, train_loss: 0.9494, test_loss: 0.9798, test_f1: 0.5125
 epoch: 8, train_loss: 0.9365, test_loss: 1.0087, test_f1: 0.4766
 epoch: 9, train_loss: 0.9074, test_loss: 1.0035, test_f1: 0.5078
 epoch: 10, train_loss: 0.8958, test_loss: 1.0276, test_f1: 0.4918
 epoch: 11, train_loss: 0.9044, test_loss: 1.0087, test_f1: 0.4898
 epoch: 12, train_loss: 0.8589, test_loss: 1.0487, test_f1: 0.4975
 epoch: 13, train_loss: 0.8344, test_loss: 1.0309, test_f1: 0.5204
 epoch: 14, train_loss: 0.8098, test_loss: 1.0544, test_f1: 0.5234
 epoch: 15, train_loss: 0.8045, test_loss: 1.0692, test_f1: 0.5145
 epoch: 16, train_loss: 0.7810, test_loss: 1.1055, test_f1: 0.4957
 epoch: 17, train_loss: 0.7868, test_loss: 1.1410, test_f1: 0.4845
 epoch: 18, train_loss: 0.7952, test_loss: 1.1743, test_f1: 0.5063
 epoch: 19, train_loss: 0.7600, test_loss: 1.1448, test_f1: 0.5099
 epoch: 20, train_loss: 0.7413, test_loss: 1.1326, test_f1: 0.5169
 epoch: 21, train_loss: 0.7312, test_loss: 1.0971, test_f1: 0.5348
 epoch: 22, train_loss: 0.7149, test_loss: 1.1036, test_f1: 0.5345
 epoch: 23, train_loss: 0.7030, test_loss: 1.1521, test_f1: 0.5265
 epoch: 24, train_loss: 0.7155, test_loss: 1.1406, test_f1: 0.5197
 epoch: 25, train_loss: 0.6865, test_loss: 1.2327, test_f1: 0.4963
 epoch: 26, train_loss: 0.6731, test_loss: 1.1987, test_f1: 0.5216
 epoch: 27, train_loss: 0.6594, test_loss: 1.2692, test_f1: 0.5317
 epoch: 28, train_loss: 0.6615, test_loss: 1.2362, test_f1: 0.5272
 epoch: 29, train_loss: 0.6539, test_loss: 1.4271, test_f1: 0.5490
 epoch: 30, train_loss: 0.6539, test_loss: 1.2050, test_f1: 0.5340
 epoch: 31, train_loss: 0.6060, test_loss: 1.1615, test_f1: 0.5669
 epoch: 32, train_loss: 0.6100, test_loss: 1.4169, test_f1: 0.5224
 epoch: 33, train_loss: 0.6312, test_loss: 1.4729, test_f1: 0.5114
 epoch: 34, train_loss: 0.6157, test_loss: 1.2977, test_f1: 0.5148
 epoch: 35, train_loss: 0.5857, test_loss: 1.3284, test_f1: 0.5453
 epoch: 36, train_loss: 0.5755, test_loss: 1.3799, test_f1: 0.5139
 epoch: 37, train_loss: 0.5738, test_loss: 1.4153, test_f1: 0.5248
 epoch: 38, train_loss: 0.5583, test_loss: 1.4338, test_f1: 0.4994
 epoch: 39, train_loss: 0.5626, test_loss: 1.4746, test_f1: 0.5357
 epoch: 40, train_loss: 0.5454, test_loss: 1.5393, test_f1: 0.5198
 epoch: 41, train_loss: 0.5496, test_loss: 1.5401, test_f1: 0.4820
 epoch: 42, train_loss: 0.5375, test_loss: 1.3748, test_f1: 0.5344
 epoch: 43, train_loss: 0.5090, test_loss: 1.5166, test_f1: 0.5309
 epoch: 44, train_loss: 0.5135, test_loss: 1.4067, test_f1: 0.5324
 epoch: 45, train_loss: 0.5333, test_loss: 1.6935, test_f1: 0.5212
 epoch: 46, train_loss: 0.5148, test_loss: 1.4329, test_f1: 0.5220
 epoch: 47, train_loss: 0.4830, test_loss: 1.5190, test_f1: 0.5396
 epoch: 48, train_loss: 0.4643, test_loss: 1.6262, test_f1: 0.5006
 epoch: 49, train_loss: 0.4817, test_loss: 1.6079, test_f1: 0.4993
 epoch: 50, train_loss: 0.4684, test_loss: 1.5281, test_f1: 0.5319
 epoch: 51, train_loss: 0.4425, test_loss: 1.6967, test_f1: 0.5153
 epoch: 52, train_loss: 0.3948, test_loss: 1.6145, test_f1: 0.5359
 epoch: 53, train_loss: 0.3760, test_loss: 1.7689, test_f1: 0.5373
 epoch: 54, train_loss: 0.3665, test_loss: 1.9184, test_f1: 0.5303
 epoch: 55, train_loss: 0.3623, test_loss: 1.8176, test_f1: 0.5343
 epoch: 56, train_loss: 0.3754, test_loss: 1.9093, test_f1: 0.5302
 epoch: 57, train_loss: 0.3667, test_loss: 1.8707, test_f1: 0.5202
 epoch: 58, train_loss: 0.3828, test_loss: 1.9460, test_f1: 0.5293
 epoch: 59, train_loss: 0.3485, test_loss: 1.8549, test_f1: 0.5314
 epoch: 60, train_loss: 0.3468, test_loss: 1.9809, test_f1: 0.5010
 epoch: 61, train_loss: 0.3481, test_loss: 1.7842, test_f1: 0.5242
 epoch: 62, train_loss: 0.3259, test_loss: 2.0369, test_f1: 0.5185
 epoch: 63, train_loss: 0.3298, test_loss: 1.9768, test_f1: 0.5384
 epoch: 64, train_loss: 0.3218, test_loss: 1.7762, test_f1: 0.5575
 epoch: 65, train_loss: 0.3235, test_loss: 2.1652, test_f1: 0.5330
 epoch: 66, train_loss: 0.3152, test_loss: 2.0975, test_f1: 0.5226
 epoch: 67, train_loss: 0.3068, test_loss: 1.8772, test_f1: 0.5416
 epoch: 68, train_loss: 0.2984, test_loss: 2.0332, test_f1: 0.5167
 epoch: 69, train_loss: 0.2883, test_loss: 1.9870, test_f1: 0.5262
 epoch: 70, train_loss: 0.3105, test_loss: 2.0754, test_f1: 0.5455
 epoch: 71, train_loss: 0.3007, test_loss: 1.9682, test_f1: 0.5095
 epoch: 72, train_loss: 0.2944, test_loss: 2.2550, test_f1: 0.5161
 epoch: 73, train_loss: 0.2930, test_loss: 2.0892, test_f1: 0.5224
 epoch: 74, train_loss: 0.2902, test_loss: 2.1494, test_f1: 0.5257
 epoch: 75, train_loss: 0.2838, test_loss: 2.0898, test_f1: 0.5358
 epoch: 76, train_loss: 0.2652, test_loss: 2.1962, test_f1: 0.5097
 epoch: 77, train_loss: 0.2556, test_loss: 2.1815, test_f1: 0.5431
 epoch: 78, train_loss: 0.2739, test_loss: 2.0056, test_f1: 0.5582
 epoch: 79, train_loss: 0.2807, test_loss: 2.2494, test_f1: 0.4995
 epoch: 80, train_loss: 0.2861, test_loss: 2.1102, test_f1: 0.5175
 epoch: 81, train_loss: 0.2770, test_loss: 2.0948, test_f1: 0.5262
 epoch: 82, train_loss: 0.2790, test_loss: 2.1140, test_f1: 0.5382
 epoch: 83, train_loss: 0.2794, test_loss: 2.1284, test_f1: 0.5228
 epoch: 84, train_loss: 0.2544, test_loss: 2.1816, test_f1: 0.5193
 epoch: 85, train_loss: 0.2604, test_loss: 2.1351, test_f1: 0.5267
 epoch: 86, train_loss: 0.2670, test_loss: 2.2216, test_f1: 0.5187
 epoch: 87, train_loss: 0.2638, test_loss: 2.1970, test_f1: 0.5249
 epoch: 88, train_loss: 0.2479, test_loss: 2.2037, test_f1: 0.5180
 epoch: 89, train_loss: 0.2527, test_loss: 2.1810, test_f1: 0.5227
 epoch: 90, train_loss: 0.2548, test_loss: 2.3298, test_f1: 0.5130
 epoch: 91, train_loss: 0.2492, test_loss: 2.3939, test_f1: 0.5104
 epoch: 92, train_loss: 0.2619, test_loss: 2.3759, test_f1: 0.5353
 epoch: 93, train_loss: 0.2562, test_loss: 2.3611, test_f1: 0.5217
 epoch: 94, train_loss: 0.2490, test_loss: 2.2340, test_f1: 0.5532
 epoch: 95, train_loss: 0.2274, test_loss: 2.3018, test_f1: 0.5292
 epoch: 96, train_loss: 0.2135, test_loss: 2.4780, test_f1: 0.5396
 epoch: 97, train_loss: 0.2390, test_loss: 2.1967, test_f1: 0.5456
 epoch: 98, train_loss: 0.2282, test_loss: 2.3939, test_f1: 0.5312
 epoch: 99, train_loss: 0.2185, test_loss: 2.4675, test_f1: 0.5229
##################ITERATION #9 ****************************************
 epoch: 0, train_loss: 1.6288, test_loss: 1.2970, test_f1: 0.2533
 epoch: 1, train_loss: 1.2233, test_loss: 1.2017, test_f1: 0.3100
 epoch: 2, train_loss: 1.1413, test_loss: 1.1303, test_f1: 0.4280
 epoch: 3, train_loss: 1.0901, test_loss: 1.0665, test_f1: 0.4472
 epoch: 4, train_loss: 1.0526, test_loss: 1.0934, test_f1: 0.4189
 epoch: 5, train_loss: 1.0325, test_loss: 1.0113, test_f1: 0.4390
 epoch: 6, train_loss: 0.9888, test_loss: 0.9772, test_f1: 0.4450
 epoch: 7, train_loss: 0.9636, test_loss: 1.0873, test_f1: 0.4328
 epoch: 8, train_loss: 0.9438, test_loss: 0.9941, test_f1: 0.4561
 epoch: 9, train_loss: 0.9224, test_loss: 1.0194, test_f1: 0.5089
 epoch: 10, train_loss: 0.8860, test_loss: 1.0100, test_f1: 0.4988
 epoch: 11, train_loss: 0.8870, test_loss: 1.0231, test_f1: 0.4647
 epoch: 12, train_loss: 0.8633, test_loss: 1.0279, test_f1: 0.5036
 epoch: 13, train_loss: 0.8464, test_loss: 1.0810, test_f1: 0.4792
 epoch: 14, train_loss: 0.8237, test_loss: 1.0145, test_f1: 0.4704
 epoch: 15, train_loss: 0.8086, test_loss: 0.9489, test_f1: 0.5359
 epoch: 16, train_loss: 0.8028, test_loss: 1.1626, test_f1: 0.4946
 epoch: 17, train_loss: 0.7951, test_loss: 1.0353, test_f1: 0.5298
 epoch: 18, train_loss: 0.7749, test_loss: 1.0389, test_f1: 0.5103
 epoch: 19, train_loss: 0.7495, test_loss: 1.0635, test_f1: 0.5298
 epoch: 20, train_loss: 0.7468, test_loss: 1.0786, test_f1: 0.5121
 epoch: 21, train_loss: 0.7220, test_loss: 1.1498, test_f1: 0.5115
 epoch: 22, train_loss: 0.7245, test_loss: 1.1126, test_f1: 0.5240
 epoch: 23, train_loss: 0.7115, test_loss: 1.1761, test_f1: 0.5298
 epoch: 24, train_loss: 0.7006, test_loss: 1.2311, test_f1: 0.4946
 epoch: 25, train_loss: 0.6845, test_loss: 1.3001, test_f1: 0.4998
 epoch: 26, train_loss: 0.6865, test_loss: 1.1523, test_f1: 0.5318
 epoch: 27, train_loss: 0.6844, test_loss: 1.1827, test_f1: 0.5238
 epoch: 28, train_loss: 0.6595, test_loss: 1.3100, test_f1: 0.5227
 epoch: 29, train_loss: 0.6443, test_loss: 1.2143, test_f1: 0.5332
 epoch: 30, train_loss: 0.6252, test_loss: 1.2625, test_f1: 0.5356
 epoch: 31, train_loss: 0.6045, test_loss: 1.5149, test_f1: 0.5143
 epoch: 32, train_loss: 0.6206, test_loss: 1.4561, test_f1: 0.5273
 epoch: 33, train_loss: 0.6144, test_loss: 1.4086, test_f1: 0.5084
 epoch: 34, train_loss: 0.5966, test_loss: 1.3617, test_f1: 0.5352
 epoch: 35, train_loss: 0.5752, test_loss: 1.3755, test_f1: 0.5348
 epoch: 36, train_loss: 0.5573, test_loss: 1.2855, test_f1: 0.5413
 epoch: 37, train_loss: 0.5491, test_loss: 1.4212, test_f1: 0.5133
 epoch: 38, train_loss: 0.5377, test_loss: 1.5669, test_f1: 0.5288
 epoch: 39, train_loss: 0.5527, test_loss: 1.4922, test_f1: 0.5375
 epoch: 40, train_loss: 0.5480, test_loss: 1.4008, test_f1: 0.5213
 epoch: 41, train_loss: 0.5426, test_loss: 1.3524, test_f1: 0.5482
 epoch: 42, train_loss: 0.5167, test_loss: 1.4547, test_f1: 0.5425
 epoch: 43, train_loss: 0.5281, test_loss: 1.5391, test_f1: 0.5380
 epoch: 44, train_loss: 0.5191, test_loss: 1.5803, test_f1: 0.5496
 epoch: 45, train_loss: 0.5260, test_loss: 1.4524, test_f1: 0.5369
 epoch: 46, train_loss: 0.5031, test_loss: 1.5850, test_f1: 0.5412
 epoch: 47, train_loss: 0.4979, test_loss: 1.3936, test_f1: 0.5360
 epoch: 48, train_loss: 0.5032, test_loss: 1.6811, test_f1: 0.5067
 epoch: 49, train_loss: 0.5005, test_loss: 1.4849, test_f1: 0.5301
 epoch: 50, train_loss: 0.4859, test_loss: 1.7564, test_f1: 0.5513
 epoch: 51, train_loss: 0.4434, test_loss: 1.6548, test_f1: 0.5380
 epoch: 52, train_loss: 0.3941, test_loss: 1.7626, test_f1: 0.5179
 epoch: 53, train_loss: 0.3740, test_loss: 1.7307, test_f1: 0.5316
 epoch: 54, train_loss: 0.3713, test_loss: 1.9579, test_f1: 0.5344
 epoch: 55, train_loss: 0.3794, test_loss: 2.0518, test_f1: 0.5295
 epoch: 56, train_loss: 0.3571, test_loss: 1.8183, test_f1: 0.5487
 epoch: 57, train_loss: 0.3660, test_loss: 1.9223, test_f1: 0.5549
 epoch: 58, train_loss: 0.3488, test_loss: 1.8849, test_f1: 0.5414
 epoch: 59, train_loss: 0.3429, test_loss: 1.9242, test_f1: 0.5234
 epoch: 60, train_loss: 0.3528, test_loss: 1.9376, test_f1: 0.5192
 epoch: 61, train_loss: 0.3512, test_loss: 1.8922, test_f1: 0.5606
 epoch: 62, train_loss: 0.3292, test_loss: 1.9519, test_f1: 0.5760
 epoch: 63, train_loss: 0.3214, test_loss: 2.0023, test_f1: 0.5240
 epoch: 64, train_loss: 0.3261, test_loss: 2.1211, test_f1: 0.5166
 epoch: 65, train_loss: 0.3152, test_loss: 2.1554, test_f1: 0.5382
 epoch: 66, train_loss: 0.3036, test_loss: 2.2350, test_f1: 0.5207
 epoch: 67, train_loss: 0.3010, test_loss: 2.2907, test_f1: 0.5524
 epoch: 68, train_loss: 0.2913, test_loss: 2.1402, test_f1: 0.5439
 epoch: 69, train_loss: 0.2961, test_loss: 2.3182, test_f1: 0.5233
 epoch: 70, train_loss: 0.2714, test_loss: 2.3045, test_f1: 0.5129
 epoch: 71, train_loss: 0.2930, test_loss: 2.1564, test_f1: 0.5482
 epoch: 72, train_loss: 0.3083, test_loss: 1.9831, test_f1: 0.5469
 epoch: 73, train_loss: 0.2954, test_loss: 2.0226, test_f1: 0.5658
 epoch: 74, train_loss: 0.2782, test_loss: 2.3684, test_f1: 0.5340
 epoch: 75, train_loss: 0.2813, test_loss: 2.3029, test_f1: 0.5167
 epoch: 76, train_loss: 0.2784, test_loss: 2.3153, test_f1: 0.5247
 epoch: 77, train_loss: 0.2748, test_loss: 2.2586, test_f1: 0.5268
 epoch: 78, train_loss: 0.2784, test_loss: 2.2431, test_f1: 0.5435
 epoch: 79, train_loss: 0.2577, test_loss: 2.5952, test_f1: 0.5194
 epoch: 80, train_loss: 0.2607, test_loss: 2.1478, test_f1: 0.5354
 epoch: 81, train_loss: 0.2609, test_loss: 2.4873, test_f1: 0.5324
 epoch: 82, train_loss: 0.2594, test_loss: 2.3087, test_f1: 0.5567
 epoch: 83, train_loss: 0.2814, test_loss: 2.2176, test_f1: 0.5361
 epoch: 84, train_loss: 0.2711, test_loss: 2.0829, test_f1: 0.5378
 epoch: 85, train_loss: 0.2673, test_loss: 2.3784, test_f1: 0.5254
 epoch: 86, train_loss: 0.2540, test_loss: 2.3256, test_f1: 0.5291
 epoch: 87, train_loss: 0.2702, test_loss: 2.5211, test_f1: 0.5245
 epoch: 88, train_loss: 0.2618, test_loss: 2.4452, test_f1: 0.5298
 epoch: 89, train_loss: 0.2460, test_loss: 2.5935, test_f1: 0.5265
 epoch: 90, train_loss: 0.2501, test_loss: 2.5168, test_f1: 0.5329
 epoch: 91, train_loss: 0.2506, test_loss: 2.7266, test_f1: 0.5115
 epoch: 92, train_loss: 0.2573, test_loss: 2.4071, test_f1: 0.5492
 epoch: 93, train_loss: 0.2416, test_loss: 2.4114, test_f1: 0.5196
 epoch: 94, train_loss: 0.2522, test_loss: 2.4198, test_f1: 0.5197
 epoch: 95, train_loss: 0.2305, test_loss: 2.5430, test_f1: 0.5308
 epoch: 96, train_loss: 0.2326, test_loss: 2.4420, test_f1: 0.5418
 epoch: 97, train_loss: 0.2271, test_loss: 2.3400, test_f1: 0.5298
 epoch: 98, train_loss: 0.2396, test_loss: 2.6840, test_f1: 0.5261
 epoch: 99, train_loss: 0.2355, test_loss: 2.5775, test_f1: 0.5348

Training completed in 436.39 seconds
Best F1: 0.5856 at epoch 45
Mean F1 across iterations: 0.5705  0.0112
========================FINAL RESULTS================================
FEGIN weighted F1: 0.5856  0.0112
python main.py --data ltspice_examples --representation component_component --model FEGIN --layers 5 --hiddens 128 --batch_size 256 --lr 0.001 --emb_size 512 --epochs 100 --save_appendix component_component_L5_H128_BS256_LR0.001_E512 --no_val
-----



STDERR:
  File "main.py", line 370, in <module>
    main()
  File "main.py", line 254, in main
    dataset = dataset_class(
  File "/home/philip/projects/ltspice_examples_code_repo/Circuit-Completion-Using-GNNs/component_classification_with_link_prediction_head/evaluation/FEGIN/kernel/circuit_datasets.py", line 15, in __init__
    self.data, self.slices = torch.load(self.processed_paths[0])
  File "/home/philip/.local/lib/python3.8/site-packages/torch/serialization.py", line 1040, in load
    warnings.warn(
  File "/usr/lib/python3.8/warnings.py", line 109, in _showwarnmsg
    sw(msg.message, msg.category, msg.filename, msg.lineno,
  File "main.py", line 47, in warn_with_traceback
    traceback.print_stack(file=log)
/home/philip/projects/ltspice_examples_code_repo/Circuit-Completion-Using-GNNs/component_classification_with_link_prediction_head/evaluation/FEGIN/kernel/circuit_datasets.py:15: FutureWarning: You are using `torch.load` with `weights_only=False` (the current default value), which uses the default pickle module implicitly. It is possible to construct malicious pickle data which will execute arbitrary code during unpickling (See https://github.com/pytorch/pytorch/blob/main/SECURITY.md#untrusted-models for more details). In a future release, the default value for `weights_only` will be flipped to `True`. This limits the functions that could be executed during unpickling. Arbitrary objects will no longer be allowed to be loaded via this mode unless they are explicitly allowlisted by the user via `torch.serialization.add_safe_globals`. We recommend you start setting `weights_only=True` for any use case where you don't have full control of the loaded file. Please open an issue on GitHub for any issues related to this experimental feature.
  self.data, self.slices = torch.load(self.processed_paths[0])
