STDOUT:
Results will be saved in /home/philip/projects/ltspice_examples_code_repo/Circuit-Completion-Using-GNNs/component_classification_with_link_prediction_head/evaluation/FEGIN/results/model_FEGIN_dataset_ltspice_demos
Command line input: python main.py --data ltspice_demos --representation component_pin --model FEGIN --layers 3 --hiddens 16 --batch_size 128 --lr 0.01 --emb_size 250 --epochs 100 --save_appendix component_pin_L3_H16_BS128_LR0.01_E250 --no_val
 is saved.
-----
ltspice_demos - FEGIN
Using 3 layers, 16 hidden units, h = 2
Loading component_pin representation dataset
ENTERED
Training FEGIN on component_pin representation
Train: 1565, Test: 383
##################ITERATION #0 ****************************************
 epoch: 0, train_loss: 1.2803, test_loss: 1.3147, test_f1: 0.2281
 epoch: 1, train_loss: 1.1927, test_loss: 1.3393, test_f1: 0.2281
 epoch: 2, train_loss: 1.1578, test_loss: 1.3161, test_f1: 0.3515
 epoch: 3, train_loss: 1.1369, test_loss: 1.2097, test_f1: 0.2583
 epoch: 4, train_loss: 1.1075, test_loss: 1.1861, test_f1: 0.3419
 epoch: 5, train_loss: 1.0506, test_loss: 1.1421, test_f1: 0.4394
 epoch: 6, train_loss: 0.9760, test_loss: 1.1716, test_f1: 0.5166
 epoch: 7, train_loss: 0.9368, test_loss: 1.1226, test_f1: 0.5031
 epoch: 8, train_loss: 0.9234, test_loss: 1.5463, test_f1: 0.3552
 epoch: 9, train_loss: 0.9167, test_loss: 1.0595, test_f1: 0.4608
 epoch: 10, train_loss: 0.8729, test_loss: 1.0994, test_f1: 0.4997
 epoch: 11, train_loss: 0.8470, test_loss: 1.1794, test_f1: 0.4098
 epoch: 12, train_loss: 0.8379, test_loss: 1.0294, test_f1: 0.5319
 epoch: 13, train_loss: 0.8332, test_loss: 1.1407, test_f1: 0.5103
 epoch: 14, train_loss: 0.8097, test_loss: 1.0045, test_f1: 0.4587
 epoch: 15, train_loss: 0.8004, test_loss: 1.0294, test_f1: 0.4992
 epoch: 16, train_loss: 0.7995, test_loss: 1.1895, test_f1: 0.5108
 epoch: 17, train_loss: 0.7814, test_loss: 1.2386, test_f1: 0.5676
 epoch: 18, train_loss: 0.7732, test_loss: 1.2380, test_f1: 0.5135
 epoch: 19, train_loss: 0.7474, test_loss: 1.3789, test_f1: 0.4990
 epoch: 20, train_loss: 0.7659, test_loss: 2.0827, test_f1: 0.4268
 epoch: 21, train_loss: 0.7742, test_loss: 1.5034, test_f1: 0.5040
 epoch: 22, train_loss: 0.7751, test_loss: 1.5300, test_f1: 0.5508
 epoch: 23, train_loss: 0.7885, test_loss: 1.4627, test_f1: 0.5157
 epoch: 24, train_loss: 0.7658, test_loss: 1.5067, test_f1: 0.5131
 epoch: 25, train_loss: 0.7526, test_loss: 1.6434, test_f1: 0.4244
 epoch: 26, train_loss: 0.7527, test_loss: 1.7716, test_f1: 0.5086
 epoch: 27, train_loss: 0.7638, test_loss: 2.3895, test_f1: 0.4099
 epoch: 28, train_loss: 0.7391, test_loss: 1.8884, test_f1: 0.5673
 epoch: 29, train_loss: 0.7453, test_loss: 1.9245, test_f1: 0.4406
 epoch: 30, train_loss: 0.7443, test_loss: 1.6958, test_f1: 0.4957
 epoch: 31, train_loss: 0.7302, test_loss: 1.8872, test_f1: 0.5791
 epoch: 32, train_loss: 0.7332, test_loss: 1.9538, test_f1: 0.4379
 epoch: 33, train_loss: 0.7529, test_loss: 1.6318, test_f1: 0.5621
 epoch: 34, train_loss: 0.7286, test_loss: 1.7995, test_f1: 0.4447
 epoch: 35, train_loss: 0.7211, test_loss: 1.4903, test_f1: 0.5467
 epoch: 36, train_loss: 0.7148, test_loss: 1.9677, test_f1: 0.4102
 epoch: 37, train_loss: 0.7167, test_loss: 1.4372, test_f1: 0.5350
 epoch: 38, train_loss: 0.7475, test_loss: 1.4415, test_f1: 0.5927
 epoch: 39, train_loss: 0.7236, test_loss: 1.9308, test_f1: 0.4532
 epoch: 40, train_loss: 0.7289, test_loss: 1.4486, test_f1: 0.5767
 epoch: 41, train_loss: 0.7398, test_loss: 1.5622, test_f1: 0.4380
 epoch: 42, train_loss: 0.7442, test_loss: 1.7730, test_f1: 0.4986
 epoch: 43, train_loss: 0.7145, test_loss: 1.6672, test_f1: 0.5247
 epoch: 44, train_loss: 0.7017, test_loss: 1.8793, test_f1: 0.5429
 epoch: 45, train_loss: 0.7000, test_loss: 1.8578, test_f1: 0.5541
 epoch: 46, train_loss: 0.7392, test_loss: 2.3316, test_f1: 0.4168
 epoch: 47, train_loss: 0.7410, test_loss: 1.4607, test_f1: 0.5435
 epoch: 48, train_loss: 0.7290, test_loss: 1.1359, test_f1: 0.6125
 epoch: 49, train_loss: 0.7065, test_loss: 1.5471, test_f1: 0.5396
 epoch: 50, train_loss: 0.6993, test_loss: 1.5592, test_f1: 0.4901
 epoch: 51, train_loss: 0.6738, test_loss: 1.6747, test_f1: 0.5061
 epoch: 52, train_loss: 0.6765, test_loss: 1.5282, test_f1: 0.5641
 epoch: 53, train_loss: 0.6737, test_loss: 1.5845, test_f1: 0.5669
 epoch: 54, train_loss: 0.6716, test_loss: 1.6333, test_f1: 0.4669
 epoch: 55, train_loss: 0.6787, test_loss: 1.9210, test_f1: 0.5754
 epoch: 56, train_loss: 0.6647, test_loss: 1.4490, test_f1: 0.4869
 epoch: 57, train_loss: 0.6585, test_loss: 1.3708, test_f1: 0.5768
 epoch: 58, train_loss: 0.6563, test_loss: 1.5393, test_f1: 0.5587
 epoch: 59, train_loss: 0.6694, test_loss: 1.5584, test_f1: 0.5477
 epoch: 60, train_loss: 0.6683, test_loss: 1.4546, test_f1: 0.5799
 epoch: 61, train_loss: 0.6596, test_loss: 1.7573, test_f1: 0.5610
 epoch: 62, train_loss: 0.6499, test_loss: 1.7737, test_f1: 0.5854
 epoch: 63, train_loss: 0.6677, test_loss: 1.6635, test_f1: 0.4502
 epoch: 64, train_loss: 0.6602, test_loss: 1.5195, test_f1: 0.5807
 epoch: 65, train_loss: 0.6483, test_loss: 1.4193, test_f1: 0.5301
 epoch: 66, train_loss: 0.6502, test_loss: 1.5255, test_f1: 0.5789
 epoch: 67, train_loss: 0.6402, test_loss: 1.3878, test_f1: 0.5445
 epoch: 68, train_loss: 0.6500, test_loss: 1.7471, test_f1: 0.6162
 epoch: 69, train_loss: 0.6472, test_loss: 1.8049, test_f1: 0.5779
 epoch: 70, train_loss: 0.6536, test_loss: 2.2421, test_f1: 0.5314
 epoch: 71, train_loss: 0.6647, test_loss: 1.6055, test_f1: 0.4747
 epoch: 72, train_loss: 0.6468, test_loss: 1.4752, test_f1: 0.5813
 epoch: 73, train_loss: 0.6452, test_loss: 1.9304, test_f1: 0.5361
 epoch: 74, train_loss: 0.6383, test_loss: 1.7057, test_f1: 0.5691
 epoch: 75, train_loss: 0.6428, test_loss: 1.6450, test_f1: 0.6110
 epoch: 76, train_loss: 0.6407, test_loss: 1.2562, test_f1: 0.5606
 epoch: 77, train_loss: 0.6311, test_loss: 1.7854, test_f1: 0.5796
 epoch: 78, train_loss: 0.6782, test_loss: 1.8624, test_f1: 0.5716
 epoch: 79, train_loss: 0.6620, test_loss: 1.9109, test_f1: 0.5771
 epoch: 80, train_loss: 0.6603, test_loss: 1.5719, test_f1: 0.5022
 epoch: 81, train_loss: 0.6548, test_loss: 1.5995, test_f1: 0.6078
 epoch: 82, train_loss: 0.6612, test_loss: 2.0837, test_f1: 0.5652
 epoch: 83, train_loss: 0.6531, test_loss: 1.7348, test_f1: 0.5906
 epoch: 84, train_loss: 0.6317, test_loss: 1.6632, test_f1: 0.6145
 epoch: 85, train_loss: 0.6358, test_loss: 1.6786, test_f1: 0.6341
 epoch: 86, train_loss: 0.6292, test_loss: 1.7234, test_f1: 0.5941
 epoch: 87, train_loss: 0.6330, test_loss: 1.6434, test_f1: 0.6036
 epoch: 88, train_loss: 0.6259, test_loss: 1.8809, test_f1: 0.5381
 epoch: 89, train_loss: 0.6378, test_loss: 1.7710, test_f1: 0.5604
 epoch: 90, train_loss: 0.6436, test_loss: 1.4365, test_f1: 0.6326
 epoch: 91, train_loss: 0.6147, test_loss: 1.8345, test_f1: 0.6206
 epoch: 92, train_loss: 0.6302, test_loss: 1.8849, test_f1: 0.6106
 epoch: 93, train_loss: 0.6215, test_loss: 1.3740, test_f1: 0.6088
 epoch: 94, train_loss: 0.6296, test_loss: 2.1425, test_f1: 0.5767
 epoch: 95, train_loss: 0.6221, test_loss: 1.8899, test_f1: 0.5932
 epoch: 96, train_loss: 0.6195, test_loss: 1.8806, test_f1: 0.6079
 epoch: 97, train_loss: 0.6251, test_loss: 2.0277, test_f1: 0.5541
 epoch: 98, train_loss: 0.6113, test_loss: 2.0559, test_f1: 0.6361
 epoch: 99, train_loss: 0.6209, test_loss: 2.1960, test_f1: 0.5756
##################ITERATION #1 ****************************************
 epoch: 0, train_loss: 1.1976, test_loss: 1.5390, test_f1: 0.2137
 epoch: 1, train_loss: 1.0754, test_loss: 1.4839, test_f1: 0.3155
 epoch: 2, train_loss: 1.0159, test_loss: 1.3846, test_f1: 0.3262
 epoch: 3, train_loss: 0.9840, test_loss: 1.1391, test_f1: 0.3987
 epoch: 4, train_loss: 0.9515, test_loss: 1.0256, test_f1: 0.4965
 epoch: 5, train_loss: 0.9224, test_loss: 1.2098, test_f1: 0.4909
 epoch: 6, train_loss: 0.9009, test_loss: 2.7107, test_f1: 0.2875
 epoch: 7, train_loss: 0.8663, test_loss: 1.1348, test_f1: 0.4932
 epoch: 8, train_loss: 0.8680, test_loss: 1.1084, test_f1: 0.5705
 epoch: 9, train_loss: 0.8312, test_loss: 1.1440, test_f1: 0.4537
 epoch: 10, train_loss: 0.8186, test_loss: 0.9293, test_f1: 0.5651
 epoch: 11, train_loss: 0.8221, test_loss: 0.9365, test_f1: 0.4961
 epoch: 12, train_loss: 0.8149, test_loss: 1.0100, test_f1: 0.5425
 epoch: 13, train_loss: 0.7969, test_loss: 1.0933, test_f1: 0.4865
 epoch: 14, train_loss: 0.7697, test_loss: 1.0285, test_f1: 0.5863
 epoch: 15, train_loss: 0.7636, test_loss: 1.3054, test_f1: 0.4918
 epoch: 16, train_loss: 0.7561, test_loss: 1.1322, test_f1: 0.5428
 epoch: 17, train_loss: 0.7660, test_loss: 3.9838, test_f1: 0.2535
 epoch: 18, train_loss: 0.8237, test_loss: 1.4700, test_f1: 0.4858
 epoch: 19, train_loss: 0.8481, test_loss: 1.1749, test_f1: 0.4868
 epoch: 20, train_loss: 0.7942, test_loss: 1.2744, test_f1: 0.3893
 epoch: 21, train_loss: 0.7708, test_loss: 0.9595, test_f1: 0.5304
 epoch: 22, train_loss: 0.7554, test_loss: 1.1403, test_f1: 0.5325
 epoch: 23, train_loss: 0.7609, test_loss: 0.9090, test_f1: 0.5334
 epoch: 24, train_loss: 0.7359, test_loss: 1.0902, test_f1: 0.5727
 epoch: 25, train_loss: 0.7515, test_loss: 1.0508, test_f1: 0.5224
 epoch: 26, train_loss: 0.7594, test_loss: 1.1954, test_f1: 0.4870
 epoch: 27, train_loss: 0.7336, test_loss: 0.9477, test_f1: 0.6184
 epoch: 28, train_loss: 0.7331, test_loss: 1.1441, test_f1: 0.5068
 epoch: 29, train_loss: 0.7309, test_loss: 1.3676, test_f1: 0.5147
 epoch: 30, train_loss: 0.7395, test_loss: 1.1080, test_f1: 0.5390
 epoch: 31, train_loss: 0.7372, test_loss: 1.0352, test_f1: 0.5738
 epoch: 32, train_loss: 0.7294, test_loss: 1.2505, test_f1: 0.5415
 epoch: 33, train_loss: 0.7342, test_loss: 1.2511, test_f1: 0.4897
 epoch: 34, train_loss: 0.7421, test_loss: 1.0618, test_f1: 0.6109
 epoch: 35, train_loss: 0.7127, test_loss: 1.0943, test_f1: 0.5050
 epoch: 36, train_loss: 0.7267, test_loss: 1.0483, test_f1: 0.6265
 epoch: 37, train_loss: 0.7138, test_loss: 1.4732, test_f1: 0.5360
 epoch: 38, train_loss: 0.7596, test_loss: 1.0510, test_f1: 0.5675
 epoch: 39, train_loss: 0.7362, test_loss: 1.0654, test_f1: 0.6121
 epoch: 40, train_loss: 0.7245, test_loss: 1.1390, test_f1: 0.5364
 epoch: 41, train_loss: 0.7685, test_loss: 1.6916, test_f1: 0.4212
 epoch: 42, train_loss: 0.7430, test_loss: 1.1674, test_f1: 0.4986
 epoch: 43, train_loss: 0.7281, test_loss: 1.0670, test_f1: 0.5069
 epoch: 44, train_loss: 0.7123, test_loss: 0.9685, test_f1: 0.6580
 epoch: 45, train_loss: 0.7321, test_loss: 1.0788, test_f1: 0.5235
 epoch: 46, train_loss: 0.7084, test_loss: 1.0997, test_f1: 0.6192
 epoch: 47, train_loss: 0.7136, test_loss: 1.0914, test_f1: 0.6248
 epoch: 48, train_loss: 0.7066, test_loss: 1.4262, test_f1: 0.6165
 epoch: 49, train_loss: 0.6823, test_loss: 1.6765, test_f1: 0.5726
 epoch: 50, train_loss: 0.6864, test_loss: 1.0998, test_f1: 0.6190
 epoch: 51, train_loss: 0.7185, test_loss: 1.3959, test_f1: 0.5724
 epoch: 52, train_loss: 0.6921, test_loss: 1.3096, test_f1: 0.5833
 epoch: 53, train_loss: 0.6617, test_loss: 1.2582, test_f1: 0.5997
 epoch: 54, train_loss: 0.6697, test_loss: 1.1521, test_f1: 0.6379
 epoch: 55, train_loss: 0.6712, test_loss: 1.4689, test_f1: 0.6422
 epoch: 56, train_loss: 0.6494, test_loss: 1.2199, test_f1: 0.5835
 epoch: 57, train_loss: 0.6633, test_loss: 1.2715, test_f1: 0.5745
 epoch: 58, train_loss: 0.6374, test_loss: 1.2944, test_f1: 0.6277
 epoch: 59, train_loss: 0.6517, test_loss: 1.2765, test_f1: 0.6601
 epoch: 60, train_loss: 0.6351, test_loss: 1.4495, test_f1: 0.5525
 epoch: 61, train_loss: 0.6214, test_loss: 1.5829, test_f1: 0.6362
 epoch: 62, train_loss: 0.6339, test_loss: 1.0809, test_f1: 0.6452
 epoch: 63, train_loss: 0.6305, test_loss: 1.1850, test_f1: 0.6535
 epoch: 64, train_loss: 0.6293, test_loss: 1.4350, test_f1: 0.5669
 epoch: 65, train_loss: 0.6283, test_loss: 1.4839, test_f1: 0.5917
 epoch: 66, train_loss: 0.6261, test_loss: 1.3607, test_f1: 0.6046
 epoch: 67, train_loss: 0.6301, test_loss: 1.3126, test_f1: 0.6064
 epoch: 68, train_loss: 0.6166, test_loss: 1.2515, test_f1: 0.6395
 epoch: 69, train_loss: 0.6149, test_loss: 1.3195, test_f1: 0.5799
 epoch: 70, train_loss: 0.6189, test_loss: 1.2905, test_f1: 0.6461
 epoch: 71, train_loss: 0.6077, test_loss: 1.5200, test_f1: 0.5625
 epoch: 72, train_loss: 0.6146, test_loss: 1.3268, test_f1: 0.6213
 epoch: 73, train_loss: 0.6026, test_loss: 1.4082, test_f1: 0.5706
 epoch: 74, train_loss: 0.5953, test_loss: 1.1276, test_f1: 0.6752
 epoch: 75, train_loss: 0.6136, test_loss: 1.3613, test_f1: 0.6042
 epoch: 76, train_loss: 0.6312, test_loss: 2.0209, test_f1: 0.5097
 epoch: 77, train_loss: 0.6370, test_loss: 1.2382, test_f1: 0.6289
 epoch: 78, train_loss: 0.5925, test_loss: 1.1333, test_f1: 0.6690
 epoch: 79, train_loss: 0.6005, test_loss: 1.5317, test_f1: 0.6038
 epoch: 80, train_loss: 0.5916, test_loss: 1.6798, test_f1: 0.6263
 epoch: 81, train_loss: 0.6067, test_loss: 1.2907, test_f1: 0.6390
 epoch: 82, train_loss: 0.5964, test_loss: 1.5796, test_f1: 0.5082
 epoch: 83, train_loss: 0.6039, test_loss: 1.6372, test_f1: 0.5973
 epoch: 84, train_loss: 0.5899, test_loss: 1.4765, test_f1: 0.6274
 epoch: 85, train_loss: 0.5786, test_loss: 1.7106, test_f1: 0.5203
 epoch: 86, train_loss: 0.5957, test_loss: 1.5740, test_f1: 0.5508
 epoch: 87, train_loss: 0.5873, test_loss: 1.4637, test_f1: 0.5681
 epoch: 88, train_loss: 0.5919, test_loss: 1.2417, test_f1: 0.6259
 epoch: 89, train_loss: 0.5497, test_loss: 1.3483, test_f1: 0.6826
 epoch: 90, train_loss: 0.5423, test_loss: 1.7683, test_f1: 0.6309
 epoch: 91, train_loss: 0.6065, test_loss: 1.2867, test_f1: 0.6363
 epoch: 92, train_loss: 0.5894, test_loss: 1.5998, test_f1: 0.6430
 epoch: 93, train_loss: 0.5867, test_loss: 1.8229, test_f1: 0.5625
 epoch: 94, train_loss: 0.5470, test_loss: 1.5750, test_f1: 0.6362
 epoch: 95, train_loss: 0.5613, test_loss: 1.6601, test_f1: 0.6395
 epoch: 96, train_loss: 0.5566, test_loss: 1.6168, test_f1: 0.6255
 epoch: 97, train_loss: 0.5589, test_loss: 1.7970, test_f1: 0.4424
 epoch: 98, train_loss: 0.5604, test_loss: 1.9292, test_f1: 0.6393
 epoch: 99, train_loss: 0.5499, test_loss: 1.6702, test_f1: 0.5914
##################ITERATION #2 ****************************************
 epoch: 0, train_loss: 1.2840, test_loss: 1.2889, test_f1: 0.2281
 epoch: 1, train_loss: 1.1251, test_loss: 1.2356, test_f1: 0.3093
 epoch: 2, train_loss: 1.0593, test_loss: 1.1162, test_f1: 0.3913
 epoch: 3, train_loss: 0.9785, test_loss: 1.0209, test_f1: 0.5332
 epoch: 4, train_loss: 0.9402, test_loss: 1.0153, test_f1: 0.5607
 epoch: 5, train_loss: 0.9137, test_loss: 1.0318, test_f1: 0.5412
 epoch: 6, train_loss: 0.8673, test_loss: 1.0830, test_f1: 0.5369
 epoch: 7, train_loss: 0.8576, test_loss: 1.2692, test_f1: 0.4764
 epoch: 8, train_loss: 0.8266, test_loss: 1.0022, test_f1: 0.6048
 epoch: 9, train_loss: 0.8155, test_loss: 1.1627, test_f1: 0.4328
 epoch: 10, train_loss: 0.8243, test_loss: 1.2132, test_f1: 0.4440
 epoch: 11, train_loss: 0.8054, test_loss: 1.1342, test_f1: 0.5655
 epoch: 12, train_loss: 0.7792, test_loss: 1.0120, test_f1: 0.5486
 epoch: 13, train_loss: 0.8463, test_loss: 1.1458, test_f1: 0.5415
 epoch: 14, train_loss: 0.8542, test_loss: 1.0083, test_f1: 0.5436
 epoch: 15, train_loss: 0.8015, test_loss: 1.0889, test_f1: 0.5958
 epoch: 16, train_loss: 0.7725, test_loss: 1.1798, test_f1: 0.4956
 epoch: 17, train_loss: 0.7878, test_loss: 1.3738, test_f1: 0.5879
 epoch: 18, train_loss: 0.7739, test_loss: 0.9928, test_f1: 0.5796
 epoch: 19, train_loss: 0.7503, test_loss: 1.1026, test_f1: 0.6007
 epoch: 20, train_loss: 0.7592, test_loss: 1.3392, test_f1: 0.5776
 epoch: 21, train_loss: 0.7408, test_loss: 1.3606, test_f1: 0.5130
 epoch: 22, train_loss: 0.7600, test_loss: 1.1991, test_f1: 0.4383
 epoch: 23, train_loss: 0.7435, test_loss: 2.0037, test_f1: 0.3573
 epoch: 24, train_loss: 0.7491, test_loss: 1.1308, test_f1: 0.5654
 epoch: 25, train_loss: 0.7415, test_loss: 1.0711, test_f1: 0.5746
 epoch: 26, train_loss: 0.7381, test_loss: 1.0302, test_f1: 0.5857
 epoch: 27, train_loss: 0.7280, test_loss: 1.0816, test_f1: 0.6087
 epoch: 28, train_loss: 0.7356, test_loss: 1.7041, test_f1: 0.4304
 epoch: 29, train_loss: 0.7278, test_loss: 1.3164, test_f1: 0.5707
 epoch: 30, train_loss: 0.7434, test_loss: 1.2533, test_f1: 0.5169
 epoch: 31, train_loss: 0.7615, test_loss: 1.2326, test_f1: 0.5012
 epoch: 32, train_loss: 0.7592, test_loss: 1.4056, test_f1: 0.5106
 epoch: 33, train_loss: 0.7272, test_loss: 1.7007, test_f1: 0.4200
 epoch: 34, train_loss: 0.7394, test_loss: 1.1109, test_f1: 0.5648
 epoch: 35, train_loss: 0.7000, test_loss: 1.1269, test_f1: 0.5712
 epoch: 36, train_loss: 0.7271, test_loss: 1.4549, test_f1: 0.5768
 epoch: 37, train_loss: 0.7348, test_loss: 1.1461, test_f1: 0.5803
 epoch: 38, train_loss: 0.7194, test_loss: 1.1609, test_f1: 0.5488
 epoch: 39, train_loss: 0.6952, test_loss: 1.0902, test_f1: 0.6251
 epoch: 40, train_loss: 0.6914, test_loss: 1.0499, test_f1: 0.5656
 epoch: 41, train_loss: 0.7036, test_loss: 1.4087, test_f1: 0.5400
 epoch: 42, train_loss: 0.7427, test_loss: 1.3559, test_f1: 0.5843
 epoch: 43, train_loss: 0.7238, test_loss: 1.6176, test_f1: 0.5549
 epoch: 44, train_loss: 0.7355, test_loss: 1.4085, test_f1: 0.5534
 epoch: 45, train_loss: 0.7667, test_loss: 1.4422, test_f1: 0.5535
 epoch: 46, train_loss: 0.7445, test_loss: 1.5693, test_f1: 0.5454
 epoch: 47, train_loss: 0.7056, test_loss: 1.4747, test_f1: 0.5621
 epoch: 48, train_loss: 0.6953, test_loss: 1.1333, test_f1: 0.5734
 epoch: 49, train_loss: 0.6796, test_loss: 1.1095, test_f1: 0.5936
 epoch: 50, train_loss: 0.6905, test_loss: 1.1858, test_f1: 0.5700
 epoch: 51, train_loss: 0.6583, test_loss: 1.1037, test_f1: 0.5911
 epoch: 52, train_loss: 0.6587, test_loss: 1.1304, test_f1: 0.6028
 epoch: 53, train_loss: 0.6560, test_loss: 1.0848, test_f1: 0.5959
 epoch: 54, train_loss: 0.6518, test_loss: 1.0956, test_f1: 0.5958
 epoch: 55, train_loss: 0.6408, test_loss: 1.1857, test_f1: 0.6016
 epoch: 56, train_loss: 0.6454, test_loss: 1.1680, test_f1: 0.5934
 epoch: 57, train_loss: 0.6433, test_loss: 1.1684, test_f1: 0.6135
 epoch: 58, train_loss: 0.6496, test_loss: 1.1259, test_f1: 0.6126
 epoch: 59, train_loss: 0.6526, test_loss: 1.0995, test_f1: 0.6118
 epoch: 60, train_loss: 0.6441, test_loss: 1.1758, test_f1: 0.6321
 epoch: 61, train_loss: 0.6432, test_loss: 1.1870, test_f1: 0.6258
 epoch: 62, train_loss: 0.6370, test_loss: 1.4015, test_f1: 0.5955
 epoch: 63, train_loss: 0.6448, test_loss: 1.5587, test_f1: 0.5917
 epoch: 64, train_loss: 0.6783, test_loss: 1.4717, test_f1: 0.5901
 epoch: 65, train_loss: 0.6681, test_loss: 1.2500, test_f1: 0.5825
 epoch: 66, train_loss: 0.6467, test_loss: 1.2261, test_f1: 0.6138
 epoch: 67, train_loss: 0.6435, test_loss: 1.2910, test_f1: 0.6100
 epoch: 68, train_loss: 0.6526, test_loss: 1.2004, test_f1: 0.6127
 epoch: 69, train_loss: 0.6430, test_loss: 1.1262, test_f1: 0.5651
 epoch: 70, train_loss: 0.6399, test_loss: 1.3380, test_f1: 0.5825
 epoch: 71, train_loss: 0.6665, test_loss: 1.2349, test_f1: 0.5977
 epoch: 72, train_loss: 0.6554, test_loss: 1.2519, test_f1: 0.5972
 epoch: 73, train_loss: 0.6694, test_loss: 1.2909, test_f1: 0.6139
 epoch: 74, train_loss: 0.6312, test_loss: 1.3251, test_f1: 0.5889
 epoch: 75, train_loss: 0.6357, test_loss: 1.2195, test_f1: 0.5945
 epoch: 76, train_loss: 0.6191, test_loss: 1.2262, test_f1: 0.6574
 epoch: 77, train_loss: 0.6192, test_loss: 1.2089, test_f1: 0.5982
 epoch: 78, train_loss: 0.6205, test_loss: 1.3457, test_f1: 0.5791
 epoch: 79, train_loss: 0.6206, test_loss: 1.2635, test_f1: 0.6123
 epoch: 80, train_loss: 0.6288, test_loss: 1.2370, test_f1: 0.6128
 epoch: 81, train_loss: 0.6231, test_loss: 1.2230, test_f1: 0.6232
 epoch: 82, train_loss: 0.6215, test_loss: 1.1900, test_f1: 0.6378
 epoch: 83, train_loss: 0.6278, test_loss: 1.1362, test_f1: 0.6411
 epoch: 84, train_loss: 0.6276, test_loss: 1.2933, test_f1: 0.5989
 epoch: 85, train_loss: 0.6057, test_loss: 1.2830, test_f1: 0.6002
 epoch: 86, train_loss: 0.5967, test_loss: 1.3559, test_f1: 0.5541
 epoch: 87, train_loss: 0.6001, test_loss: 1.2827, test_f1: 0.6138
 epoch: 88, train_loss: 0.6154, test_loss: 1.1976, test_f1: 0.6234
 epoch: 89, train_loss: 0.6276, test_loss: 1.5076, test_f1: 0.5686
 epoch: 90, train_loss: 0.6133, test_loss: 1.3455, test_f1: 0.6036
 epoch: 91, train_loss: 0.6086, test_loss: 1.2917, test_f1: 0.6488
 epoch: 92, train_loss: 0.6032, test_loss: 1.2655, test_f1: 0.6012
 epoch: 93, train_loss: 0.5913, test_loss: 1.1268, test_f1: 0.5473
 epoch: 94, train_loss: 0.6056, test_loss: 1.3899, test_f1: 0.6096
 epoch: 95, train_loss: 0.6124, test_loss: 1.3525, test_f1: 0.6025
 epoch: 96, train_loss: 0.5896, test_loss: 1.3264, test_f1: 0.6075
 epoch: 97, train_loss: 0.6146, test_loss: 1.3870, test_f1: 0.5465
 epoch: 98, train_loss: 0.6021, test_loss: 1.3032, test_f1: 0.6301
 epoch: 99, train_loss: 0.5978, test_loss: 1.2871, test_f1: 0.5938
##################ITERATION #3 ****************************************
 epoch: 0, train_loss: 1.4653, test_loss: 1.5540, test_f1: 0.1616
 epoch: 1, train_loss: 1.0930, test_loss: 1.2828, test_f1: 0.3095
 epoch: 2, train_loss: 1.0154, test_loss: 1.1925, test_f1: 0.4434
 epoch: 3, train_loss: 0.9941, test_loss: 1.1208, test_f1: 0.5011
 epoch: 4, train_loss: 0.9568, test_loss: 1.0828, test_f1: 0.5017
 epoch: 5, train_loss: 0.9252, test_loss: 1.2817, test_f1: 0.4297
 epoch: 6, train_loss: 0.9250, test_loss: 1.1544, test_f1: 0.4537
 epoch: 7, train_loss: 0.8840, test_loss: 1.1921, test_f1: 0.4691
 epoch: 8, train_loss: 0.8571, test_loss: 1.3908, test_f1: 0.4262
 epoch: 9, train_loss: 0.8338, test_loss: 2.2892, test_f1: 0.2887
 epoch: 10, train_loss: 0.8521, test_loss: 1.1409, test_f1: 0.5115
 epoch: 11, train_loss: 0.8518, test_loss: 1.0652, test_f1: 0.5774
 epoch: 12, train_loss: 0.8120, test_loss: 1.0648, test_f1: 0.5848
 epoch: 13, train_loss: 0.8010, test_loss: 1.4130, test_f1: 0.4075
 epoch: 14, train_loss: 0.8086, test_loss: 1.7233, test_f1: 0.3024
 epoch: 15, train_loss: 0.8012, test_loss: 1.1830, test_f1: 0.5461
 epoch: 16, train_loss: 0.8178, test_loss: 1.0843, test_f1: 0.4858
 epoch: 17, train_loss: 0.7741, test_loss: 1.1295, test_f1: 0.5603
 epoch: 18, train_loss: 0.7669, test_loss: 1.1573, test_f1: 0.5409
 epoch: 19, train_loss: 0.7678, test_loss: 1.1145, test_f1: 0.5849
 epoch: 20, train_loss: 0.7609, test_loss: 1.8987, test_f1: 0.3872
 epoch: 21, train_loss: 0.7910, test_loss: 1.3016, test_f1: 0.4932
 epoch: 22, train_loss: 0.7986, test_loss: 1.5995, test_f1: 0.4707
 epoch: 23, train_loss: 0.7488, test_loss: 1.2264, test_f1: 0.5554
 epoch: 24, train_loss: 0.7286, test_loss: 1.0977, test_f1: 0.5728
 epoch: 25, train_loss: 0.7377, test_loss: 1.3995, test_f1: 0.5595
 epoch: 26, train_loss: 0.7471, test_loss: 1.2821, test_f1: 0.5244
 epoch: 27, train_loss: 0.7852, test_loss: 1.2937, test_f1: 0.4872
 epoch: 28, train_loss: 0.7643, test_loss: 1.3121, test_f1: 0.4847
 epoch: 29, train_loss: 0.7323, test_loss: 1.2553, test_f1: 0.5809
 epoch: 30, train_loss: 0.7278, test_loss: 1.1027, test_f1: 0.5875
 epoch: 31, train_loss: 0.7262, test_loss: 1.2432, test_f1: 0.5536
 epoch: 32, train_loss: 0.7202, test_loss: 1.2000, test_f1: 0.5733
 epoch: 33, train_loss: 0.7115, test_loss: 1.3493, test_f1: 0.5199
 epoch: 34, train_loss: 0.7013, test_loss: 1.0288, test_f1: 0.5982
 epoch: 35, train_loss: 0.7011, test_loss: 1.1949, test_f1: 0.5612
 epoch: 36, train_loss: 0.6895, test_loss: 1.0661, test_f1: 0.5775
 epoch: 37, train_loss: 0.7391, test_loss: 1.7816, test_f1: 0.5341
 epoch: 38, train_loss: 0.7671, test_loss: 1.1041, test_f1: 0.5111
 epoch: 39, train_loss: 0.7417, test_loss: 1.0001, test_f1: 0.5972
 epoch: 40, train_loss: 0.7201, test_loss: 1.3110, test_f1: 0.6161
 epoch: 41, train_loss: 0.7282, test_loss: 1.3317, test_f1: 0.5501
 epoch: 42, train_loss: 0.7189, test_loss: 1.1588, test_f1: 0.6047
 epoch: 43, train_loss: 0.7243, test_loss: 1.0628, test_f1: 0.6125
 epoch: 44, train_loss: 0.7173, test_loss: 1.0765, test_f1: 0.5869
 epoch: 45, train_loss: 0.7027, test_loss: 1.3749, test_f1: 0.5324
 epoch: 46, train_loss: 0.7000, test_loss: 2.0672, test_f1: 0.4214
 epoch: 47, train_loss: 0.7043, test_loss: 2.0304, test_f1: 0.5090
 epoch: 48, train_loss: 0.6901, test_loss: 1.1955, test_f1: 0.5387
 epoch: 49, train_loss: 0.6841, test_loss: 1.1967, test_f1: 0.6071
 epoch: 50, train_loss: 0.6908, test_loss: 1.3756, test_f1: 0.5717
 epoch: 51, train_loss: 0.7092, test_loss: 1.4034, test_f1: 0.5808
 epoch: 52, train_loss: 0.6717, test_loss: 1.3153, test_f1: 0.6024
 epoch: 53, train_loss: 0.6442, test_loss: 1.3677, test_f1: 0.5488
 epoch: 54, train_loss: 0.6488, test_loss: 1.5152, test_f1: 0.5506
 epoch: 55, train_loss: 0.6388, test_loss: 1.3407, test_f1: 0.5772
 epoch: 56, train_loss: 0.6465, test_loss: 1.4303, test_f1: 0.5535
 epoch: 57, train_loss: 0.6316, test_loss: 1.4639, test_f1: 0.5775
 epoch: 58, train_loss: 0.6510, test_loss: 1.3939, test_f1: 0.5820
 epoch: 59, train_loss: 0.6270, test_loss: 1.7514, test_f1: 0.5242
 epoch: 60, train_loss: 0.6274, test_loss: 1.2580, test_f1: 0.5699
 epoch: 61, train_loss: 0.6227, test_loss: 1.6418, test_f1: 0.5325
 epoch: 62, train_loss: 0.6293, test_loss: 1.4642, test_f1: 0.5756
 epoch: 63, train_loss: 0.6239, test_loss: 1.3992, test_f1: 0.5831
 epoch: 64, train_loss: 0.6327, test_loss: 1.5543, test_f1: 0.5764
 epoch: 65, train_loss: 0.6333, test_loss: 1.9013, test_f1: 0.5410
 epoch: 66, train_loss: 0.6295, test_loss: 1.4889, test_f1: 0.5700
 epoch: 67, train_loss: 0.6393, test_loss: 1.2326, test_f1: 0.5907
 epoch: 68, train_loss: 0.5994, test_loss: 1.7486, test_f1: 0.6084
 epoch: 69, train_loss: 0.6299, test_loss: 1.4732, test_f1: 0.5574
 epoch: 70, train_loss: 0.6504, test_loss: 1.3637, test_f1: 0.5991
 epoch: 71, train_loss: 0.6066, test_loss: 1.3115, test_f1: 0.6017
 epoch: 72, train_loss: 0.6136, test_loss: 1.3869, test_f1: 0.6331
 epoch: 73, train_loss: 0.6108, test_loss: 1.2900, test_f1: 0.5621
 epoch: 74, train_loss: 0.6158, test_loss: 1.4261, test_f1: 0.6248
 epoch: 75, train_loss: 0.6028, test_loss: 1.2348, test_f1: 0.6648
 epoch: 76, train_loss: 0.5957, test_loss: 1.3564, test_f1: 0.5847
 epoch: 77, train_loss: 0.5845, test_loss: 1.6585, test_f1: 0.5959
 epoch: 78, train_loss: 0.6315, test_loss: 1.3238, test_f1: 0.5925
 epoch: 79, train_loss: 0.6229, test_loss: 1.3253, test_f1: 0.6056
 epoch: 80, train_loss: 0.5782, test_loss: 1.2345, test_f1: 0.6354
 epoch: 81, train_loss: 0.5944, test_loss: 1.2340, test_f1: 0.6260
 epoch: 82, train_loss: 0.5796, test_loss: 1.5106, test_f1: 0.5504
 epoch: 83, train_loss: 0.5800, test_loss: 1.5864, test_f1: 0.6014
 epoch: 84, train_loss: 0.5872, test_loss: 1.5230, test_f1: 0.5557
 epoch: 85, train_loss: 0.5887, test_loss: 1.3117, test_f1: 0.6307
 epoch: 86, train_loss: 0.5852, test_loss: 1.7083, test_f1: 0.5725
 epoch: 87, train_loss: 0.5601, test_loss: 1.4085, test_f1: 0.6037
 epoch: 88, train_loss: 0.5820, test_loss: 1.6199, test_f1: 0.6004
 epoch: 89, train_loss: 0.5653, test_loss: 1.3954, test_f1: 0.6256
 epoch: 90, train_loss: 0.5958, test_loss: 1.4627, test_f1: 0.5565
 epoch: 91, train_loss: 0.5617, test_loss: 1.6807, test_f1: 0.6271
 epoch: 92, train_loss: 0.5672, test_loss: 2.2775, test_f1: 0.5417
 epoch: 93, train_loss: 0.5988, test_loss: 1.8308, test_f1: 0.6021
 epoch: 94, train_loss: 0.5946, test_loss: 2.0055, test_f1: 0.5645
 epoch: 95, train_loss: 0.5870, test_loss: 1.4424, test_f1: 0.5949
 epoch: 96, train_loss: 0.5836, test_loss: 1.4482, test_f1: 0.5631
 epoch: 97, train_loss: 0.5731, test_loss: 1.2681, test_f1: 0.6113
 epoch: 98, train_loss: 0.5714, test_loss: 1.3941, test_f1: 0.5908
 epoch: 99, train_loss: 0.5835, test_loss: 1.7624, test_f1: 0.5463
##################ITERATION #4 ****************************************
 epoch: 0, train_loss: 1.2233, test_loss: 1.3640, test_f1: 0.2109
 epoch: 1, train_loss: 1.0726, test_loss: 1.3179, test_f1: 0.2583
 epoch: 2, train_loss: 1.0202, test_loss: 1.2083, test_f1: 0.4018
 epoch: 3, train_loss: 0.9972, test_loss: 1.0456, test_f1: 0.5085
 epoch: 4, train_loss: 0.9683, test_loss: 1.0154, test_f1: 0.5154
 epoch: 5, train_loss: 0.9451, test_loss: 1.0349, test_f1: 0.4933
 epoch: 6, train_loss: 0.9054, test_loss: 0.9743, test_f1: 0.5597
 epoch: 7, train_loss: 0.8918, test_loss: 1.0268, test_f1: 0.5680
 epoch: 8, train_loss: 0.8823, test_loss: 1.0877, test_f1: 0.5149
 epoch: 9, train_loss: 0.8363, test_loss: 0.9997, test_f1: 0.5271
 epoch: 10, train_loss: 0.8322, test_loss: 1.0722, test_f1: 0.4692
 epoch: 11, train_loss: 0.8332, test_loss: 1.1033, test_f1: 0.5058
 epoch: 12, train_loss: 0.8347, test_loss: 0.9905, test_f1: 0.4886
 epoch: 13, train_loss: 0.8208, test_loss: 1.3708, test_f1: 0.4599
 epoch: 14, train_loss: 0.8103, test_loss: 1.6784, test_f1: 0.4785
 epoch: 15, train_loss: 0.8070, test_loss: 1.0583, test_f1: 0.5440
 epoch: 16, train_loss: 0.7860, test_loss: 0.9384, test_f1: 0.5586
 epoch: 17, train_loss: 0.8089, test_loss: 1.0695, test_f1: 0.5497
 epoch: 18, train_loss: 0.7529, test_loss: 0.9888, test_f1: 0.5856
 epoch: 19, train_loss: 0.7620, test_loss: 1.0214, test_f1: 0.5777
 epoch: 20, train_loss: 0.7797, test_loss: 1.0260, test_f1: 0.5685
 epoch: 21, train_loss: 0.7915, test_loss: 1.0756, test_f1: 0.5509
 epoch: 22, train_loss: 0.7706, test_loss: 0.9367, test_f1: 0.6081
 epoch: 23, train_loss: 0.7513, test_loss: 1.0277, test_f1: 0.5569
 epoch: 24, train_loss: 0.7588, test_loss: 1.2668, test_f1: 0.5261
 epoch: 25, train_loss: 0.7672, test_loss: 1.3259, test_f1: 0.5031
 epoch: 26, train_loss: 0.7763, test_loss: 1.1902, test_f1: 0.5207
 epoch: 27, train_loss: 0.7709, test_loss: 1.1641, test_f1: 0.5426
 epoch: 28, train_loss: 0.7413, test_loss: 1.1366, test_f1: 0.5154
 epoch: 29, train_loss: 0.7447, test_loss: 1.0934, test_f1: 0.5590
 epoch: 30, train_loss: 0.7290, test_loss: 0.9342, test_f1: 0.5816
 epoch: 31, train_loss: 0.7369, test_loss: 0.9783, test_f1: 0.5478
 epoch: 32, train_loss: 0.7671, test_loss: 1.1007, test_f1: 0.5284
 epoch: 33, train_loss: 0.7662, test_loss: 1.1030, test_f1: 0.4996
 epoch: 34, train_loss: 0.7452, test_loss: 0.9222, test_f1: 0.5493
 epoch: 35, train_loss: 0.7454, test_loss: 0.9922, test_f1: 0.6000
 epoch: 36, train_loss: 0.7392, test_loss: 1.2048, test_f1: 0.5423
 epoch: 37, train_loss: 0.7536, test_loss: 1.1910, test_f1: 0.5194
 epoch: 38, train_loss: 0.7272, test_loss: 1.0351, test_f1: 0.5899
 epoch: 39, train_loss: 0.7223, test_loss: 1.0248, test_f1: 0.5972
 epoch: 40, train_loss: 0.7153, test_loss: 1.1800, test_f1: 0.5338
 epoch: 41, train_loss: 0.6861, test_loss: 1.0463, test_f1: 0.5988
 epoch: 42, train_loss: 0.7023, test_loss: 1.0843, test_f1: 0.5574
 epoch: 43, train_loss: 0.6965, test_loss: 1.0958, test_f1: 0.5589
 epoch: 44, train_loss: 0.6929, test_loss: 1.0947, test_f1: 0.5958
 epoch: 45, train_loss: 0.7038, test_loss: 1.3597, test_f1: 0.5068
 epoch: 46, train_loss: 0.7007, test_loss: 1.0332, test_f1: 0.5821
 epoch: 47, train_loss: 0.7309, test_loss: 1.3584, test_f1: 0.4541
 epoch: 48, train_loss: 0.7087, test_loss: 1.1141, test_f1: 0.5584
 epoch: 49, train_loss: 0.7129, test_loss: 1.1194, test_f1: 0.5487
 epoch: 50, train_loss: 0.7170, test_loss: 1.1125, test_f1: 0.5226
 epoch: 51, train_loss: 0.6859, test_loss: 1.0596, test_f1: 0.6025
 epoch: 52, train_loss: 0.6875, test_loss: 1.1199, test_f1: 0.5805
 epoch: 53, train_loss: 0.6765, test_loss: 1.1128, test_f1: 0.6107
 epoch: 54, train_loss: 0.6548, test_loss: 1.0781, test_f1: 0.6085
 epoch: 55, train_loss: 0.6981, test_loss: 1.1413, test_f1: 0.5800
 epoch: 56, train_loss: 0.6617, test_loss: 1.0888, test_f1: 0.6108
 epoch: 57, train_loss: 0.6439, test_loss: 1.0772, test_f1: 0.5822
 epoch: 58, train_loss: 0.6495, test_loss: 1.1734, test_f1: 0.5904
 epoch: 59, train_loss: 0.6530, test_loss: 1.3202, test_f1: 0.4991
 epoch: 60, train_loss: 0.6508, test_loss: 1.0898, test_f1: 0.5996
 epoch: 61, train_loss: 0.6597, test_loss: 1.1089, test_f1: 0.6044
 epoch: 62, train_loss: 0.6377, test_loss: 1.0798, test_f1: 0.5817
 epoch: 63, train_loss: 0.6627, test_loss: 1.1167, test_f1: 0.6134
 epoch: 64, train_loss: 0.6551, test_loss: 1.0962, test_f1: 0.5781
 epoch: 65, train_loss: 0.6588, test_loss: 1.1182, test_f1: 0.6086
 epoch: 66, train_loss: 0.6369, test_loss: 1.1671, test_f1: 0.6128
 epoch: 67, train_loss: 0.6369, test_loss: 1.0965, test_f1: 0.6064
 epoch: 68, train_loss: 0.6227, test_loss: 1.1117, test_f1: 0.5848
 epoch: 69, train_loss: 0.6322, test_loss: 1.1787, test_f1: 0.5902
 epoch: 70, train_loss: 0.6734, test_loss: 1.2336, test_f1: 0.5343
 epoch: 71, train_loss: 0.6592, test_loss: 1.2025, test_f1: 0.6018
 epoch: 72, train_loss: 0.6437, test_loss: 1.0873, test_f1: 0.5887
 epoch: 73, train_loss: 0.6308, test_loss: 1.1481, test_f1: 0.6121
 epoch: 74, train_loss: 0.6105, test_loss: 1.3162, test_f1: 0.5900
 epoch: 75, train_loss: 0.6201, test_loss: 1.2346, test_f1: 0.5963
 epoch: 76, train_loss: 0.6173, test_loss: 1.2720, test_f1: 0.5750
 epoch: 77, train_loss: 0.6092, test_loss: 1.1458, test_f1: 0.6305
 epoch: 78, train_loss: 0.6174, test_loss: 1.2689, test_f1: 0.5706
 epoch: 79, train_loss: 0.6133, test_loss: 1.1906, test_f1: 0.6050
 epoch: 80, train_loss: 0.5901, test_loss: 1.1756, test_f1: 0.6449
 epoch: 81, train_loss: 0.6102, test_loss: 1.2560, test_f1: 0.5884
 epoch: 82, train_loss: 0.5961, test_loss: 1.2947, test_f1: 0.6088
 epoch: 83, train_loss: 0.5846, test_loss: 1.3010, test_f1: 0.6179
 epoch: 84, train_loss: 0.5922, test_loss: 1.2168, test_f1: 0.5959
 epoch: 85, train_loss: 0.6094, test_loss: 1.3796, test_f1: 0.5733
 epoch: 86, train_loss: 0.6394, test_loss: 1.2091, test_f1: 0.6045
 epoch: 87, train_loss: 0.5843, test_loss: 1.4318, test_f1: 0.5874
 epoch: 88, train_loss: 0.6077, test_loss: 1.2337, test_f1: 0.5743
 epoch: 89, train_loss: 0.5986, test_loss: 1.1667, test_f1: 0.5913
 epoch: 90, train_loss: 0.6007, test_loss: 1.2703, test_f1: 0.5989
 epoch: 91, train_loss: 0.6070, test_loss: 1.3631, test_f1: 0.5455
 epoch: 92, train_loss: 0.5925, test_loss: 1.2259, test_f1: 0.6103
 epoch: 93, train_loss: 0.6031, test_loss: 1.1784, test_f1: 0.6343
 epoch: 94, train_loss: 0.6176, test_loss: 1.1855, test_f1: 0.6001
 epoch: 95, train_loss: 0.6198, test_loss: 1.3282, test_f1: 0.6151
 epoch: 96, train_loss: 0.5784, test_loss: 1.5609, test_f1: 0.5636
 epoch: 97, train_loss: 0.5873, test_loss: 1.1766, test_f1: 0.5871
 epoch: 98, train_loss: 0.6101, test_loss: 1.0747, test_f1: 0.6380
 epoch: 99, train_loss: 0.6121, test_loss: 1.3168, test_f1: 0.5774
##################ITERATION #5 ****************************************
 epoch: 0, train_loss: 1.2436, test_loss: 1.3586, test_f1: 0.3398
 epoch: 1, train_loss: 1.0575, test_loss: 1.3601, test_f1: 0.3332
 epoch: 2, train_loss: 0.9843, test_loss: 1.1477, test_f1: 0.4478
 epoch: 3, train_loss: 0.9334, test_loss: 1.4076, test_f1: 0.3230
 epoch: 4, train_loss: 0.8977, test_loss: 1.3525, test_f1: 0.5253
 epoch: 5, train_loss: 0.8732, test_loss: 0.9774, test_f1: 0.5329
 epoch: 6, train_loss: 0.8419, test_loss: 1.1229, test_f1: 0.4979
 epoch: 7, train_loss: 0.8243, test_loss: 1.1577, test_f1: 0.5113
 epoch: 8, train_loss: 0.8418, test_loss: 1.1705, test_f1: 0.5426
 epoch: 9, train_loss: 0.8175, test_loss: 1.1071, test_f1: 0.5071
 epoch: 10, train_loss: 0.8333, test_loss: 1.2183, test_f1: 0.5071
 epoch: 11, train_loss: 0.8276, test_loss: 1.0149, test_f1: 0.5800
 epoch: 12, train_loss: 0.8206, test_loss: 1.1180, test_f1: 0.5916
 epoch: 13, train_loss: 0.8131, test_loss: 0.9895, test_f1: 0.5812
 epoch: 14, train_loss: 0.7826, test_loss: 1.3579, test_f1: 0.4872
 epoch: 15, train_loss: 0.7936, test_loss: 1.0520, test_f1: 0.5729
 epoch: 16, train_loss: 0.8676, test_loss: 1.7827, test_f1: 0.3969
 epoch: 17, train_loss: 0.8274, test_loss: 1.3714, test_f1: 0.4799
 epoch: 18, train_loss: 0.8099, test_loss: 1.1323, test_f1: 0.5371
 epoch: 19, train_loss: 0.7466, test_loss: 1.0344, test_f1: 0.5568
 epoch: 20, train_loss: 0.7506, test_loss: 1.2938, test_f1: 0.4657
 epoch: 21, train_loss: 0.7492, test_loss: 1.0484, test_f1: 0.5621
 epoch: 22, train_loss: 0.7383, test_loss: 1.2573, test_f1: 0.5173
 epoch: 23, train_loss: 0.7276, test_loss: 1.1459, test_f1: 0.5460
 epoch: 24, train_loss: 0.7291, test_loss: 1.0759, test_f1: 0.5572
 epoch: 25, train_loss: 0.7712, test_loss: 1.2210, test_f1: 0.5876
 epoch: 26, train_loss: 0.7591, test_loss: 1.9388, test_f1: 0.3996
 epoch: 27, train_loss: 0.7360, test_loss: 1.2997, test_f1: 0.5303
 epoch: 28, train_loss: 0.7226, test_loss: 1.0626, test_f1: 0.5495
 epoch: 29, train_loss: 0.7358, test_loss: 1.2310, test_f1: 0.5679
 epoch: 30, train_loss: 0.7443, test_loss: 1.0974, test_f1: 0.5778
 epoch: 31, train_loss: 0.7377, test_loss: 1.1105, test_f1: 0.5647
 epoch: 32, train_loss: 0.7412, test_loss: 1.3180, test_f1: 0.5853
 epoch: 33, train_loss: 0.7389, test_loss: 1.0511, test_f1: 0.6023
 epoch: 34, train_loss: 0.7106, test_loss: 1.0973, test_f1: 0.6040
 epoch: 35, train_loss: 0.6914, test_loss: 1.3805, test_f1: 0.5649
 epoch: 36, train_loss: 0.6999, test_loss: 1.1422, test_f1: 0.5997
 epoch: 37, train_loss: 0.7263, test_loss: 1.0974, test_f1: 0.5943
 epoch: 38, train_loss: 0.7153, test_loss: 1.1097, test_f1: 0.6086
 epoch: 39, train_loss: 0.6900, test_loss: 1.3213, test_f1: 0.4727
 epoch: 40, train_loss: 0.7196, test_loss: 1.2957, test_f1: 0.5670
 epoch: 41, train_loss: 0.7301, test_loss: 1.2694, test_f1: 0.5198
 epoch: 42, train_loss: 0.7321, test_loss: 1.0964, test_f1: 0.6124
 epoch: 43, train_loss: 0.7317, test_loss: 1.3164, test_f1: 0.5332
 epoch: 44, train_loss: 0.7321, test_loss: 1.0878, test_f1: 0.5499
 epoch: 45, train_loss: 0.6883, test_loss: 1.1341, test_f1: 0.5766
 epoch: 46, train_loss: 0.7124, test_loss: 1.2055, test_f1: 0.6087
 epoch: 47, train_loss: 0.7536, test_loss: 1.1633, test_f1: 0.5537
 epoch: 48, train_loss: 0.7309, test_loss: 1.4003, test_f1: 0.5214
 epoch: 49, train_loss: 0.6979, test_loss: 1.5193, test_f1: 0.4926
 epoch: 50, train_loss: 0.6975, test_loss: 1.2603, test_f1: 0.5726
 epoch: 51, train_loss: 0.6958, test_loss: 1.0611, test_f1: 0.6301
 epoch: 52, train_loss: 0.6778, test_loss: 1.2011, test_f1: 0.5852
 epoch: 53, train_loss: 0.6679, test_loss: 1.2579, test_f1: 0.5746
 epoch: 54, train_loss: 0.6519, test_loss: 1.2808, test_f1: 0.5994
 epoch: 55, train_loss: 0.6478, test_loss: 1.2737, test_f1: 0.5990
 epoch: 56, train_loss: 0.6483, test_loss: 1.3655, test_f1: 0.5568
 epoch: 57, train_loss: 0.6475, test_loss: 1.3518, test_f1: 0.5972
 epoch: 58, train_loss: 0.6511, test_loss: 1.3440, test_f1: 0.6155
 epoch: 59, train_loss: 0.6493, test_loss: 1.1632, test_f1: 0.6017
 epoch: 60, train_loss: 0.6479, test_loss: 1.2287, test_f1: 0.5984
 epoch: 61, train_loss: 0.6490, test_loss: 1.3564, test_f1: 0.5927
 epoch: 62, train_loss: 0.6346, test_loss: 1.3261, test_f1: 0.5878
 epoch: 63, train_loss: 0.6483, test_loss: 1.2005, test_f1: 0.5994
 epoch: 64, train_loss: 0.6301, test_loss: 1.2814, test_f1: 0.5766
 epoch: 65, train_loss: 0.6421, test_loss: 1.2720, test_f1: 0.6005
 epoch: 66, train_loss: 0.6633, test_loss: 1.2438, test_f1: 0.6170
 epoch: 67, train_loss: 0.7099, test_loss: 1.5855, test_f1: 0.6007
 epoch: 68, train_loss: 0.6942, test_loss: 2.2501, test_f1: 0.4156
 epoch: 69, train_loss: 0.6868, test_loss: 1.4280, test_f1: 0.5767
 epoch: 70, train_loss: 0.6929, test_loss: 1.1796, test_f1: 0.6053
 epoch: 71, train_loss: 0.6717, test_loss: 1.2484, test_f1: 0.5972
 epoch: 72, train_loss: 0.6745, test_loss: 1.0790, test_f1: 0.5981
 epoch: 73, train_loss: 0.6355, test_loss: 1.2953, test_f1: 0.6109
 epoch: 74, train_loss: 0.6341, test_loss: 1.2843, test_f1: 0.5979
 epoch: 75, train_loss: 0.6160, test_loss: 1.3207, test_f1: 0.6034
 epoch: 76, train_loss: 0.6438, test_loss: 1.4084, test_f1: 0.5859
 epoch: 77, train_loss: 0.6227, test_loss: 1.3066, test_f1: 0.6120
 epoch: 78, train_loss: 0.6353, test_loss: 1.1905, test_f1: 0.6337
 epoch: 79, train_loss: 0.6400, test_loss: 1.1973, test_f1: 0.6111
 epoch: 80, train_loss: 0.6180, test_loss: 1.5199, test_f1: 0.5831
 epoch: 81, train_loss: 0.6187, test_loss: 1.3307, test_f1: 0.6120
 epoch: 82, train_loss: 0.6152, test_loss: 1.3328, test_f1: 0.6002
 epoch: 83, train_loss: 0.6340, test_loss: 1.5854, test_f1: 0.5662
 epoch: 84, train_loss: 0.6377, test_loss: 1.6438, test_f1: 0.6221
 epoch: 85, train_loss: 0.6300, test_loss: 1.3623, test_f1: 0.5938
 epoch: 86, train_loss: 0.6400, test_loss: 1.1548, test_f1: 0.5957
 epoch: 87, train_loss: 0.7196, test_loss: 1.5176, test_f1: 0.5794
 epoch: 88, train_loss: 0.6575, test_loss: 1.2828, test_f1: 0.6119
 epoch: 89, train_loss: 0.6238, test_loss: 1.3624, test_f1: 0.5798
 epoch: 90, train_loss: 0.6168, test_loss: 1.2725, test_f1: 0.6144
 epoch: 91, train_loss: 0.6033, test_loss: 1.3847, test_f1: 0.6082
 epoch: 92, train_loss: 0.6150, test_loss: 1.4588, test_f1: 0.5873
 epoch: 93, train_loss: 0.6036, test_loss: 1.3924, test_f1: 0.5871
 epoch: 94, train_loss: 0.5972, test_loss: 1.4993, test_f1: 0.5830
 epoch: 95, train_loss: 0.6042, test_loss: 1.4499, test_f1: 0.5814
 epoch: 96, train_loss: 0.6193, test_loss: 1.4104, test_f1: 0.5979
 epoch: 97, train_loss: 0.6192, test_loss: 1.5776, test_f1: 0.5928
 epoch: 98, train_loss: 0.6371, test_loss: 1.2797, test_f1: 0.5999
 epoch: 99, train_loss: 0.5966, test_loss: 1.4369, test_f1: 0.5768
##################ITERATION #6 ****************************************
 epoch: 0, train_loss: 1.2568, test_loss: 1.4230, test_f1: 0.2782
 epoch: 1, train_loss: 1.0525, test_loss: 2.4125, test_f1: 0.0456
 epoch: 2, train_loss: 1.0058, test_loss: 1.2354, test_f1: 0.3526
 epoch: 3, train_loss: 0.9715, test_loss: 1.1794, test_f1: 0.4206
 epoch: 4, train_loss: 0.9288, test_loss: 1.0915, test_f1: 0.4817
 epoch: 5, train_loss: 0.8975, test_loss: 0.9910, test_f1: 0.5471
 epoch: 6, train_loss: 0.8873, test_loss: 0.9933, test_f1: 0.5586
 epoch: 7, train_loss: 0.8763, test_loss: 0.9876, test_f1: 0.5104
 epoch: 8, train_loss: 0.8400, test_loss: 1.0482, test_f1: 0.5123
 epoch: 9, train_loss: 0.8325, test_loss: 0.9916, test_f1: 0.5782
 epoch: 10, train_loss: 0.8182, test_loss: 1.0377, test_f1: 0.5363
 epoch: 11, train_loss: 0.8003, test_loss: 1.0774, test_f1: 0.5601
 epoch: 12, train_loss: 0.8093, test_loss: 1.1496, test_f1: 0.5450
 epoch: 13, train_loss: 0.7952, test_loss: 1.0861, test_f1: 0.5860
 epoch: 14, train_loss: 0.7941, test_loss: 1.1108, test_f1: 0.5567
 epoch: 15, train_loss: 0.7827, test_loss: 1.0448, test_f1: 0.5851
 epoch: 16, train_loss: 0.7830, test_loss: 1.0089, test_f1: 0.6306
 epoch: 17, train_loss: 0.7717, test_loss: 1.4645, test_f1: 0.4751
 epoch: 18, train_loss: 0.7689, test_loss: 1.3785, test_f1: 0.5315
 epoch: 19, train_loss: 0.7719, test_loss: 1.2234, test_f1: 0.5336
 epoch: 20, train_loss: 0.7622, test_loss: 1.0522, test_f1: 0.6128
 epoch: 21, train_loss: 0.7711, test_loss: 1.0648, test_f1: 0.5542
 epoch: 22, train_loss: 0.7634, test_loss: 1.5557, test_f1: 0.5522
 epoch: 23, train_loss: 0.7619, test_loss: 1.0197, test_f1: 0.6202
 epoch: 24, train_loss: 0.7699, test_loss: 1.0808, test_f1: 0.5700
 epoch: 25, train_loss: 0.7493, test_loss: 1.0753, test_f1: 0.5842
 epoch: 26, train_loss: 0.7516, test_loss: 1.0910, test_f1: 0.5554
 epoch: 27, train_loss: 0.7381, test_loss: 1.4510, test_f1: 0.5264
 epoch: 28, train_loss: 0.7451, test_loss: 1.2278, test_f1: 0.5545
 epoch: 29, train_loss: 0.7412, test_loss: 1.0530, test_f1: 0.6264
 epoch: 30, train_loss: 0.7064, test_loss: 1.0758, test_f1: 0.6315
 epoch: 31, train_loss: 0.7035, test_loss: 1.1211, test_f1: 0.5994
 epoch: 32, train_loss: 0.7324, test_loss: 1.3438, test_f1: 0.5888
 epoch: 33, train_loss: 0.7411, test_loss: 1.4633, test_f1: 0.5261
 epoch: 34, train_loss: 0.7647, test_loss: 1.1409, test_f1: 0.6208
 epoch: 35, train_loss: 0.7289, test_loss: 1.1936, test_f1: 0.5868
 epoch: 36, train_loss: 0.7434, test_loss: 1.0842, test_f1: 0.5842
 epoch: 37, train_loss: 0.7204, test_loss: 1.1325, test_f1: 0.5709
 epoch: 38, train_loss: 0.6941, test_loss: 1.3920, test_f1: 0.5701
 epoch: 39, train_loss: 0.7205, test_loss: 1.0455, test_f1: 0.5960
 epoch: 40, train_loss: 0.6908, test_loss: 1.2661, test_f1: 0.5466
 epoch: 41, train_loss: 0.7047, test_loss: 1.0515, test_f1: 0.5809
 epoch: 42, train_loss: 0.7337, test_loss: 1.2533, test_f1: 0.5113
 epoch: 43, train_loss: 0.7298, test_loss: 1.0199, test_f1: 0.5731
 epoch: 44, train_loss: 0.7241, test_loss: 1.0474, test_f1: 0.5963
 epoch: 45, train_loss: 0.7016, test_loss: 1.0498, test_f1: 0.6333
 epoch: 46, train_loss: 0.6895, test_loss: 1.1666, test_f1: 0.6192
 epoch: 47, train_loss: 0.6795, test_loss: 1.0874, test_f1: 0.5958
 epoch: 48, train_loss: 0.6816, test_loss: 1.0070, test_f1: 0.6397
 epoch: 49, train_loss: 0.6758, test_loss: 1.2036, test_f1: 0.5702
 epoch: 50, train_loss: 0.6810, test_loss: 1.0620, test_f1: 0.6186
 epoch: 51, train_loss: 0.6498, test_loss: 1.0836, test_f1: 0.6542
 epoch: 52, train_loss: 0.6351, test_loss: 1.1177, test_f1: 0.5955
 epoch: 53, train_loss: 0.6558, test_loss: 1.1341, test_f1: 0.6005
 epoch: 54, train_loss: 0.6471, test_loss: 1.0237, test_f1: 0.6546
 epoch: 55, train_loss: 0.6307, test_loss: 1.0532, test_f1: 0.6720
 epoch: 56, train_loss: 0.6356, test_loss: 1.1963, test_f1: 0.6001
 epoch: 57, train_loss: 0.6261, test_loss: 1.1267, test_f1: 0.6171
 epoch: 58, train_loss: 0.6325, test_loss: 1.0654, test_f1: 0.6286
 epoch: 59, train_loss: 0.6350, test_loss: 1.1382, test_f1: 0.6153
 epoch: 60, train_loss: 0.6109, test_loss: 1.1223, test_f1: 0.6484
 epoch: 61, train_loss: 0.6134, test_loss: 1.4756, test_f1: 0.6006
 epoch: 62, train_loss: 0.6197, test_loss: 1.1405, test_f1: 0.6392
 epoch: 63, train_loss: 0.6233, test_loss: 1.1436, test_f1: 0.6744
 epoch: 64, train_loss: 0.6243, test_loss: 1.0999, test_f1: 0.6412
 epoch: 65, train_loss: 0.6298, test_loss: 1.2257, test_f1: 0.5874
 epoch: 66, train_loss: 0.6111, test_loss: 1.3001, test_f1: 0.6270
 epoch: 67, train_loss: 0.6061, test_loss: 1.1183, test_f1: 0.6298
 epoch: 68, train_loss: 0.6115, test_loss: 1.2065, test_f1: 0.6068
 epoch: 69, train_loss: 0.6141, test_loss: 1.0996, test_f1: 0.6428
 epoch: 70, train_loss: 0.6132, test_loss: 1.2364, test_f1: 0.6239
 epoch: 71, train_loss: 0.6224, test_loss: 1.1641, test_f1: 0.6389
 epoch: 72, train_loss: 0.6018, test_loss: 1.1740, test_f1: 0.6199
 epoch: 73, train_loss: 0.6045, test_loss: 1.1302, test_f1: 0.6358
 epoch: 74, train_loss: 0.6031, test_loss: 1.2271, test_f1: 0.6550
 epoch: 75, train_loss: 0.6555, test_loss: 1.2280, test_f1: 0.6128
 epoch: 76, train_loss: 0.6253, test_loss: 1.2254, test_f1: 0.6174
 epoch: 77, train_loss: 0.6050, test_loss: 1.1891, test_f1: 0.6244
 epoch: 78, train_loss: 0.6145, test_loss: 1.2047, test_f1: 0.6235
 epoch: 79, train_loss: 0.6084, test_loss: 1.2873, test_f1: 0.6107
 epoch: 80, train_loss: 0.5869, test_loss: 1.2809, test_f1: 0.6196
 epoch: 81, train_loss: 0.5918, test_loss: 1.2383, test_f1: 0.6304
 epoch: 82, train_loss: 0.6044, test_loss: 1.1222, test_f1: 0.6422
 epoch: 83, train_loss: 0.5928, test_loss: 1.0416, test_f1: 0.6648
 epoch: 84, train_loss: 0.5995, test_loss: 1.0729, test_f1: 0.6462
 epoch: 85, train_loss: 0.5867, test_loss: 1.1117, test_f1: 0.6267
 epoch: 86, train_loss: 0.5958, test_loss: 1.1405, test_f1: 0.6587
 epoch: 87, train_loss: 0.5888, test_loss: 1.1879, test_f1: 0.6496
 epoch: 88, train_loss: 0.5879, test_loss: 1.1774, test_f1: 0.6261
 epoch: 89, train_loss: 0.5940, test_loss: 1.2276, test_f1: 0.6458
 epoch: 90, train_loss: 0.5754, test_loss: 1.1846, test_f1: 0.6459
 epoch: 91, train_loss: 0.5796, test_loss: 1.2543, test_f1: 0.6536
 epoch: 92, train_loss: 0.5696, test_loss: 1.1555, test_f1: 0.6444
 epoch: 93, train_loss: 0.5825, test_loss: 1.2341, test_f1: 0.6673
 epoch: 94, train_loss: 0.5743, test_loss: 1.2838, test_f1: 0.6381
 epoch: 95, train_loss: 0.5789, test_loss: 1.2329, test_f1: 0.6276
 epoch: 96, train_loss: 0.5766, test_loss: 1.2470, test_f1: 0.6289
 epoch: 97, train_loss: 0.5655, test_loss: 1.3992, test_f1: 0.6361
 epoch: 98, train_loss: 0.5571, test_loss: 1.3457, test_f1: 0.6362
 epoch: 99, train_loss: 0.5622, test_loss: 1.3617, test_f1: 0.5905
##################ITERATION #7 ****************************************
 epoch: 0, train_loss: 1.2767, test_loss: 1.4564, test_f1: 0.3146
 epoch: 1, train_loss: 1.0963, test_loss: 1.4367, test_f1: 0.2281
 epoch: 2, train_loss: 1.0659, test_loss: 1.3219, test_f1: 0.2864
 epoch: 3, train_loss: 1.0227, test_loss: 1.2811, test_f1: 0.3705
 epoch: 4, train_loss: 1.0079, test_loss: 1.1677, test_f1: 0.3665
 epoch: 5, train_loss: 0.9718, test_loss: 1.1859, test_f1: 0.3934
 epoch: 6, train_loss: 0.9852, test_loss: 1.3011, test_f1: 0.4224
 epoch: 7, train_loss: 0.9555, test_loss: 1.0306, test_f1: 0.4608
 epoch: 8, train_loss: 0.9294, test_loss: 1.0693, test_f1: 0.5312
 epoch: 9, train_loss: 0.8898, test_loss: 1.1448, test_f1: 0.4638
 epoch: 10, train_loss: 0.8736, test_loss: 1.0309, test_f1: 0.5072
 epoch: 11, train_loss: 0.8715, test_loss: 1.0235, test_f1: 0.5010
 epoch: 12, train_loss: 0.8670, test_loss: 1.0305, test_f1: 0.4715
 epoch: 13, train_loss: 0.8608, test_loss: 1.0967, test_f1: 0.5548
 epoch: 14, train_loss: 0.8426, test_loss: 1.0259, test_f1: 0.4920
 epoch: 15, train_loss: 0.8246, test_loss: 1.0539, test_f1: 0.5224
 epoch: 16, train_loss: 0.8131, test_loss: 1.1345, test_f1: 0.4191
 epoch: 17, train_loss: 0.7996, test_loss: 1.0859, test_f1: 0.5002
 epoch: 18, train_loss: 0.8016, test_loss: 1.0859, test_f1: 0.5361
 epoch: 19, train_loss: 0.8026, test_loss: 1.0841, test_f1: 0.5210
 epoch: 20, train_loss: 0.8063, test_loss: 1.0281, test_f1: 0.5435
 epoch: 21, train_loss: 0.7773, test_loss: 1.2235, test_f1: 0.5343
 epoch: 22, train_loss: 0.7898, test_loss: 1.0361, test_f1: 0.5568
 epoch: 23, train_loss: 0.7994, test_loss: 1.2336, test_f1: 0.4938
 epoch: 24, train_loss: 0.7893, test_loss: 0.9990, test_f1: 0.5227
 epoch: 25, train_loss: 0.8153, test_loss: 1.6388, test_f1: 0.3907
 epoch: 26, train_loss: 0.8613, test_loss: 0.9921, test_f1: 0.5427
 epoch: 27, train_loss: 0.8331, test_loss: 1.1659, test_f1: 0.5586
 epoch: 28, train_loss: 0.7726, test_loss: 1.0952, test_f1: 0.5749
 epoch: 29, train_loss: 0.7903, test_loss: 1.0810, test_f1: 0.5122
 epoch: 30, train_loss: 0.7992, test_loss: 1.0463, test_f1: 0.5033
 epoch: 31, train_loss: 0.7879, test_loss: 0.9844, test_f1: 0.5960
 epoch: 32, train_loss: 0.7975, test_loss: 1.0525, test_f1: 0.4957
 epoch: 33, train_loss: 0.7949, test_loss: 1.0136, test_f1: 0.4997
 epoch: 34, train_loss: 0.7849, test_loss: 1.1348, test_f1: 0.5290
 epoch: 35, train_loss: 0.7614, test_loss: 0.9997, test_f1: 0.5444
 epoch: 36, train_loss: 0.7622, test_loss: 1.1626, test_f1: 0.5551
 epoch: 37, train_loss: 0.7663, test_loss: 1.2132, test_f1: 0.5509
 epoch: 38, train_loss: 0.7584, test_loss: 1.1442, test_f1: 0.5384
 epoch: 39, train_loss: 0.7446, test_loss: 1.0149, test_f1: 0.5733
 epoch: 40, train_loss: 0.7386, test_loss: 1.2340, test_f1: 0.5450
 epoch: 41, train_loss: 0.7554, test_loss: 1.5386, test_f1: 0.5042
 epoch: 42, train_loss: 0.7283, test_loss: 1.0055, test_f1: 0.5902
 epoch: 43, train_loss: 0.7348, test_loss: 1.1619, test_f1: 0.6031
 epoch: 44, train_loss: 0.7898, test_loss: 1.0677, test_f1: 0.5369
 epoch: 45, train_loss: 0.7774, test_loss: 0.9860, test_f1: 0.5117
 epoch: 46, train_loss: 0.7685, test_loss: 1.2066, test_f1: 0.4822
 epoch: 47, train_loss: 0.7437, test_loss: 1.1322, test_f1: 0.5415
 epoch: 48, train_loss: 0.7384, test_loss: 0.9566, test_f1: 0.5972
 epoch: 49, train_loss: 0.7285, test_loss: 0.9706, test_f1: 0.5386
 epoch: 50, train_loss: 0.7370, test_loss: 1.0321, test_f1: 0.5802
 epoch: 51, train_loss: 0.7563, test_loss: 1.0038, test_f1: 0.5636
 epoch: 52, train_loss: 0.7342, test_loss: 1.0430, test_f1: 0.4692
 epoch: 53, train_loss: 0.7140, test_loss: 1.0173, test_f1: 0.6024
 epoch: 54, train_loss: 0.7310, test_loss: 1.0254, test_f1: 0.5067
 epoch: 55, train_loss: 0.7000, test_loss: 0.9971, test_f1: 0.5693
 epoch: 56, train_loss: 0.7100, test_loss: 1.1827, test_f1: 0.5523
 epoch: 57, train_loss: 0.6974, test_loss: 1.1146, test_f1: 0.6063
 epoch: 58, train_loss: 0.6871, test_loss: 1.0727, test_f1: 0.5815
 epoch: 59, train_loss: 0.6962, test_loss: 1.0586, test_f1: 0.5961
 epoch: 60, train_loss: 0.7062, test_loss: 1.1265, test_f1: 0.6068
 epoch: 61, train_loss: 0.6800, test_loss: 1.0127, test_f1: 0.6218
 epoch: 62, train_loss: 0.6647, test_loss: 1.1558, test_f1: 0.5661
 epoch: 63, train_loss: 0.6767, test_loss: 1.3129, test_f1: 0.5419
 epoch: 64, train_loss: 0.6785, test_loss: 1.1960, test_f1: 0.5578
 epoch: 65, train_loss: 0.6820, test_loss: 1.1152, test_f1: 0.5954
 epoch: 66, train_loss: 0.6634, test_loss: 1.1108, test_f1: 0.6020
 epoch: 67, train_loss: 0.6743, test_loss: 1.2371, test_f1: 0.5961
 epoch: 68, train_loss: 0.7016, test_loss: 1.0550, test_f1: 0.5946
 epoch: 69, train_loss: 0.6836, test_loss: 0.9949, test_f1: 0.5752
 epoch: 70, train_loss: 0.6711, test_loss: 1.0863, test_f1: 0.6172
 epoch: 71, train_loss: 0.6789, test_loss: 1.1260, test_f1: 0.5520
 epoch: 72, train_loss: 0.6762, test_loss: 1.2393, test_f1: 0.5536
 epoch: 73, train_loss: 0.6675, test_loss: 1.1647, test_f1: 0.6181
 epoch: 74, train_loss: 0.6748, test_loss: 1.1890, test_f1: 0.5711
 epoch: 75, train_loss: 0.6700, test_loss: 1.0135, test_f1: 0.5555
 epoch: 76, train_loss: 0.6880, test_loss: 1.1106, test_f1: 0.5781
 epoch: 77, train_loss: 0.6661, test_loss: 1.2269, test_f1: 0.5893
 epoch: 78, train_loss: 0.6600, test_loss: 1.0466, test_f1: 0.5829
 epoch: 79, train_loss: 0.6540, test_loss: 1.2602, test_f1: 0.5735
 epoch: 80, train_loss: 0.6588, test_loss: 1.4178, test_f1: 0.5984
 epoch: 81, train_loss: 0.6433, test_loss: 1.2648, test_f1: 0.5798
 epoch: 82, train_loss: 0.6498, test_loss: 1.2213, test_f1: 0.5946
 epoch: 83, train_loss: 0.6548, test_loss: 0.9873, test_f1: 0.6150
 epoch: 84, train_loss: 0.6570, test_loss: 1.1612, test_f1: 0.5985
 epoch: 85, train_loss: 0.6800, test_loss: 1.3639, test_f1: 0.4975
 epoch: 86, train_loss: 0.6865, test_loss: 1.2440, test_f1: 0.5845
 epoch: 87, train_loss: 0.6781, test_loss: 1.0608, test_f1: 0.5777
 epoch: 88, train_loss: 0.6684, test_loss: 1.1535, test_f1: 0.5825
 epoch: 89, train_loss: 0.6493, test_loss: 1.0971, test_f1: 0.5793
 epoch: 90, train_loss: 0.6388, test_loss: 1.1149, test_f1: 0.5984
 epoch: 91, train_loss: 0.6502, test_loss: 1.3631, test_f1: 0.5614
 epoch: 92, train_loss: 0.6303, test_loss: 1.2202, test_f1: 0.6079
 epoch: 93, train_loss: 0.6493, test_loss: 1.3010, test_f1: 0.5724
 epoch: 94, train_loss: 0.6210, test_loss: 1.2138, test_f1: 0.5740
 epoch: 95, train_loss: 0.6231, test_loss: 1.0884, test_f1: 0.5856
 epoch: 96, train_loss: 0.6362, test_loss: 1.3726, test_f1: 0.5710
 epoch: 97, train_loss: 0.6492, test_loss: 1.5687, test_f1: 0.5796
 epoch: 98, train_loss: 0.6858, test_loss: 1.1009, test_f1: 0.5931
 epoch: 99, train_loss: 0.6462, test_loss: 1.2783, test_f1: 0.5986
##################ITERATION #8 ****************************************
 epoch: 0, train_loss: 1.2690, test_loss: 1.3725, test_f1: 0.2288
 epoch: 1, train_loss: 1.0698, test_loss: 1.2795, test_f1: 0.2689
 epoch: 2, train_loss: 1.0113, test_loss: 1.1330, test_f1: 0.4594
 epoch: 3, train_loss: 0.9681, test_loss: 1.1116, test_f1: 0.4485
 epoch: 4, train_loss: 0.9504, test_loss: 1.0525, test_f1: 0.5339
 epoch: 5, train_loss: 0.9075, test_loss: 1.0260, test_f1: 0.4863
 epoch: 6, train_loss: 0.8760, test_loss: 1.0124, test_f1: 0.5604
 epoch: 7, train_loss: 0.8867, test_loss: 1.0336, test_f1: 0.5601
 epoch: 8, train_loss: 0.8443, test_loss: 1.2321, test_f1: 0.4602
 epoch: 9, train_loss: 0.8280, test_loss: 1.0839, test_f1: 0.4994
 epoch: 10, train_loss: 0.8145, test_loss: 1.0738, test_f1: 0.5159
 epoch: 11, train_loss: 0.8089, test_loss: 1.0412, test_f1: 0.5569
 epoch: 12, train_loss: 0.7923, test_loss: 2.3138, test_f1: 0.4077
 epoch: 13, train_loss: 0.8434, test_loss: 1.0273, test_f1: 0.5387
 epoch: 14, train_loss: 0.8106, test_loss: 1.0267, test_f1: 0.6159
 epoch: 15, train_loss: 0.8035, test_loss: 1.0074, test_f1: 0.5924
 epoch: 16, train_loss: 0.8093, test_loss: 1.5974, test_f1: 0.4952
 epoch: 17, train_loss: 0.7810, test_loss: 1.8275, test_f1: 0.4860
 epoch: 18, train_loss: 0.7860, test_loss: 1.1660, test_f1: 0.5558
 epoch: 19, train_loss: 0.7752, test_loss: 1.1141, test_f1: 0.5377
 epoch: 20, train_loss: 0.7680, test_loss: 1.1525, test_f1: 0.5739
 epoch: 21, train_loss: 0.7629, test_loss: 1.0448, test_f1: 0.5751
 epoch: 22, train_loss: 0.7461, test_loss: 1.0106, test_f1: 0.5989
 epoch: 23, train_loss: 0.7609, test_loss: 1.0717, test_f1: 0.6072
 epoch: 24, train_loss: 0.7483, test_loss: 1.4620, test_f1: 0.5657
 epoch: 25, train_loss: 0.7429, test_loss: 1.0193, test_f1: 0.6010
 epoch: 26, train_loss: 0.7395, test_loss: 1.0564, test_f1: 0.5303
 epoch: 27, train_loss: 0.7445, test_loss: 1.0544, test_f1: 0.6105
 epoch: 28, train_loss: 0.7230, test_loss: 1.0810, test_f1: 0.5323
 epoch: 29, train_loss: 0.7280, test_loss: 1.3599, test_f1: 0.5454
 epoch: 30, train_loss: 0.7219, test_loss: 1.0013, test_f1: 0.5997
 epoch: 31, train_loss: 0.7132, test_loss: 1.1191, test_f1: 0.5567
 epoch: 32, train_loss: 0.7051, test_loss: 1.1078, test_f1: 0.5864
 epoch: 33, train_loss: 0.7089, test_loss: 1.1999, test_f1: 0.6005
 epoch: 34, train_loss: 0.7233, test_loss: 1.3862, test_f1: 0.5370
 epoch: 35, train_loss: 0.7147, test_loss: 1.0159, test_f1: 0.5989
 epoch: 36, train_loss: 0.7083, test_loss: 1.0436, test_f1: 0.5570
 epoch: 37, train_loss: 0.7167, test_loss: 1.1173, test_f1: 0.6147
 epoch: 38, train_loss: 0.7056, test_loss: 1.2244, test_f1: 0.5870
 epoch: 39, train_loss: 0.7188, test_loss: 1.6384, test_f1: 0.4755
 epoch: 40, train_loss: 0.7100, test_loss: 1.1429, test_f1: 0.5964
 epoch: 41, train_loss: 0.6846, test_loss: 1.3734, test_f1: 0.5401
 epoch: 42, train_loss: 0.7046, test_loss: 1.0142, test_f1: 0.5288
 epoch: 43, train_loss: 0.7159, test_loss: 1.4061, test_f1: 0.5576
 epoch: 44, train_loss: 0.7043, test_loss: 1.3611, test_f1: 0.5313
 epoch: 45, train_loss: 0.6834, test_loss: 1.2387, test_f1: 0.5954
 epoch: 46, train_loss: 0.6938, test_loss: 1.1986, test_f1: 0.5671
 epoch: 47, train_loss: 0.6984, test_loss: 1.0543, test_f1: 0.5760
 epoch: 48, train_loss: 0.6961, test_loss: 1.0914, test_f1: 0.5632
 epoch: 49, train_loss: 0.6735, test_loss: 1.0868, test_f1: 0.5949
 epoch: 50, train_loss: 0.6776, test_loss: 1.0479, test_f1: 0.6034
 epoch: 51, train_loss: 0.6554, test_loss: 1.0545, test_f1: 0.6166
 epoch: 52, train_loss: 0.6570, test_loss: 1.0649, test_f1: 0.6173
 epoch: 53, train_loss: 0.6552, test_loss: 1.1025, test_f1: 0.6123
 epoch: 54, train_loss: 0.6483, test_loss: 1.2528, test_f1: 0.5853
 epoch: 55, train_loss: 0.6575, test_loss: 1.1007, test_f1: 0.6063
 epoch: 56, train_loss: 0.6358, test_loss: 1.0605, test_f1: 0.5867
 epoch: 57, train_loss: 0.6549, test_loss: 1.1438, test_f1: 0.6062
 epoch: 58, train_loss: 0.6388, test_loss: 1.1937, test_f1: 0.5852
 epoch: 59, train_loss: 0.6373, test_loss: 1.2588, test_f1: 0.6258
 epoch: 60, train_loss: 0.6275, test_loss: 1.3572, test_f1: 0.6147
 epoch: 61, train_loss: 0.6515, test_loss: 1.2453, test_f1: 0.5793
 epoch: 62, train_loss: 0.6580, test_loss: 1.1996, test_f1: 0.6042
 epoch: 63, train_loss: 0.6397, test_loss: 1.1225, test_f1: 0.6201
 epoch: 64, train_loss: 0.6388, test_loss: 1.2098, test_f1: 0.5991
 epoch: 65, train_loss: 0.6387, test_loss: 1.4986, test_f1: 0.5481
 epoch: 66, train_loss: 0.6330, test_loss: 1.1992, test_f1: 0.6104
 epoch: 67, train_loss: 0.6325, test_loss: 1.3396, test_f1: 0.6190
 epoch: 68, train_loss: 0.6205, test_loss: 1.3000, test_f1: 0.6128
 epoch: 69, train_loss: 0.6156, test_loss: 1.2501, test_f1: 0.6137
 epoch: 70, train_loss: 0.6343, test_loss: 1.2644, test_f1: 0.6035
 epoch: 71, train_loss: 0.6444, test_loss: 1.2542, test_f1: 0.6068
 epoch: 72, train_loss: 0.6375, test_loss: 1.2977, test_f1: 0.5846
 epoch: 73, train_loss: 0.6474, test_loss: 1.2616, test_f1: 0.6358
 epoch: 74, train_loss: 0.6334, test_loss: 1.1809, test_f1: 0.6232
 epoch: 75, train_loss: 0.6340, test_loss: 1.1607, test_f1: 0.5910
 epoch: 76, train_loss: 0.6696, test_loss: 1.0932, test_f1: 0.6287
 epoch: 77, train_loss: 0.6855, test_loss: 1.0816, test_f1: 0.5557
 epoch: 78, train_loss: 0.6512, test_loss: 1.2087, test_f1: 0.5920
 epoch: 79, train_loss: 0.6386, test_loss: 1.1370, test_f1: 0.5962
 epoch: 80, train_loss: 0.6105, test_loss: 1.2027, test_f1: 0.5690
 epoch: 81, train_loss: 0.6068, test_loss: 1.2512, test_f1: 0.6172
 epoch: 82, train_loss: 0.6150, test_loss: 1.3697, test_f1: 0.5681
 epoch: 83, train_loss: 0.6205, test_loss: 1.5138, test_f1: 0.5239
 epoch: 84, train_loss: 0.6233, test_loss: 1.2093, test_f1: 0.5987
 epoch: 85, train_loss: 0.6032, test_loss: 1.5339, test_f1: 0.5946
 epoch: 86, train_loss: 0.6062, test_loss: 1.3798, test_f1: 0.5950
 epoch: 87, train_loss: 0.6088, test_loss: 1.3097, test_f1: 0.5634
 epoch: 88, train_loss: 0.6024, test_loss: 1.4196, test_f1: 0.5452
 epoch: 89, train_loss: 0.6145, test_loss: 1.2540, test_f1: 0.5978
 epoch: 90, train_loss: 0.6173, test_loss: 1.4131, test_f1: 0.5889
 epoch: 91, train_loss: 0.6018, test_loss: 1.3810, test_f1: 0.6164
 epoch: 92, train_loss: 0.5930, test_loss: 1.2920, test_f1: 0.6314
 epoch: 93, train_loss: 0.5877, test_loss: 1.3336, test_f1: 0.5906
 epoch: 94, train_loss: 0.5931, test_loss: 1.3245, test_f1: 0.6248
 epoch: 95, train_loss: 0.5793, test_loss: 1.3796, test_f1: 0.5585
 epoch: 96, train_loss: 0.5796, test_loss: 1.3988, test_f1: 0.6060
 epoch: 97, train_loss: 0.5893, test_loss: 1.2739, test_f1: 0.6444
 epoch: 98, train_loss: 0.5887, test_loss: 1.5734, test_f1: 0.5907
 epoch: 99, train_loss: 0.5795, test_loss: 1.3006, test_f1: 0.6364
##################ITERATION #9 ****************************************
 epoch: 0, train_loss: 1.2849, test_loss: 1.4445, test_f1: 0.3389
 epoch: 1, train_loss: 1.0852, test_loss: 1.3351, test_f1: 0.2836
 epoch: 2, train_loss: 1.0122, test_loss: 1.2074, test_f1: 0.3995
 epoch: 3, train_loss: 0.9732, test_loss: 1.1587, test_f1: 0.5272
 epoch: 4, train_loss: 0.9407, test_loss: 1.1201, test_f1: 0.5066
 epoch: 5, train_loss: 0.9139, test_loss: 1.0770, test_f1: 0.5844
 epoch: 6, train_loss: 0.8882, test_loss: 1.1161, test_f1: 0.4702
 epoch: 7, train_loss: 0.8748, test_loss: 0.9948, test_f1: 0.5669
 epoch: 8, train_loss: 0.8501, test_loss: 1.1893, test_f1: 0.5338
 epoch: 9, train_loss: 0.8369, test_loss: 1.0309, test_f1: 0.5592
 epoch: 10, train_loss: 0.8114, test_loss: 1.0641, test_f1: 0.5608
 epoch: 11, train_loss: 0.7951, test_loss: 1.0508, test_f1: 0.5786
 epoch: 12, train_loss: 0.7884, test_loss: 1.0914, test_f1: 0.4932
 epoch: 13, train_loss: 0.8122, test_loss: 1.6464, test_f1: 0.3405
 epoch: 14, train_loss: 0.7794, test_loss: 1.0232, test_f1: 0.5970
 epoch: 15, train_loss: 0.7900, test_loss: 1.3143, test_f1: 0.5350
 epoch: 16, train_loss: 0.7664, test_loss: 1.1157, test_f1: 0.5821
 epoch: 17, train_loss: 0.7789, test_loss: 1.1371, test_f1: 0.5157
 epoch: 18, train_loss: 0.7507, test_loss: 1.1682, test_f1: 0.5931
 epoch: 19, train_loss: 0.7475, test_loss: 1.2102, test_f1: 0.6078
 epoch: 20, train_loss: 0.7558, test_loss: 1.4921, test_f1: 0.5434
 epoch: 21, train_loss: 0.7506, test_loss: 0.9809, test_f1: 0.6290
 epoch: 22, train_loss: 0.7778, test_loss: 1.0289, test_f1: 0.5646
 epoch: 23, train_loss: 0.7561, test_loss: 1.0551, test_f1: 0.6308
 epoch: 24, train_loss: 0.7738, test_loss: 1.0420, test_f1: 0.5878
 epoch: 25, train_loss: 0.7802, test_loss: 1.1643, test_f1: 0.5352
 epoch: 26, train_loss: 0.7467, test_loss: 1.0253, test_f1: 0.5742
 epoch: 27, train_loss: 0.7236, test_loss: 1.5757, test_f1: 0.5764
 epoch: 28, train_loss: 0.7349, test_loss: 1.2733, test_f1: 0.5770
 epoch: 29, train_loss: 0.7464, test_loss: 0.9997, test_f1: 0.6060
 epoch: 30, train_loss: 0.7635, test_loss: 1.2063, test_f1: 0.4954
 epoch: 31, train_loss: 0.7869, test_loss: 1.0606, test_f1: 0.5789
 epoch: 32, train_loss: 0.7541, test_loss: 1.0813, test_f1: 0.5998
 epoch: 33, train_loss: 0.7484, test_loss: 1.1266, test_f1: 0.4670
 epoch: 34, train_loss: 0.7742, test_loss: 0.9891, test_f1: 0.6247
 epoch: 35, train_loss: 0.7188, test_loss: 1.1635, test_f1: 0.6048
 epoch: 36, train_loss: 0.7160, test_loss: 0.9976, test_f1: 0.6196
 epoch: 37, train_loss: 0.7142, test_loss: 1.0373, test_f1: 0.5799
 epoch: 38, train_loss: 0.7249, test_loss: 1.7116, test_f1: 0.5454
 epoch: 39, train_loss: 0.7042, test_loss: 1.0495, test_f1: 0.5765
 epoch: 40, train_loss: 0.7037, test_loss: 1.1012, test_f1: 0.5879
 epoch: 41, train_loss: 0.6802, test_loss: 1.1131, test_f1: 0.6233
 epoch: 42, train_loss: 0.6749, test_loss: 1.1908, test_f1: 0.5834
 epoch: 43, train_loss: 0.6758, test_loss: 1.1252, test_f1: 0.6003
 epoch: 44, train_loss: 0.6742, test_loss: 1.2518, test_f1: 0.6064
 epoch: 45, train_loss: 0.6696, test_loss: 1.2308, test_f1: 0.5178
 epoch: 46, train_loss: 0.6841, test_loss: 1.0792, test_f1: 0.5745
 epoch: 47, train_loss: 0.6873, test_loss: 1.2373, test_f1: 0.5895
 epoch: 48, train_loss: 0.6728, test_loss: 1.2545, test_f1: 0.6086
 epoch: 49, train_loss: 0.6730, test_loss: 1.1119, test_f1: 0.5904
 epoch: 50, train_loss: 0.6693, test_loss: 1.2793, test_f1: 0.5793
 epoch: 51, train_loss: 0.6616, test_loss: 1.3666, test_f1: 0.5684
 epoch: 52, train_loss: 0.6372, test_loss: 1.1550, test_f1: 0.6134
 epoch: 53, train_loss: 0.6194, test_loss: 1.1962, test_f1: 0.6170
 epoch: 54, train_loss: 0.6237, test_loss: 1.1983, test_f1: 0.6050
 epoch: 55, train_loss: 0.6463, test_loss: 1.3112, test_f1: 0.5459
 epoch: 56, train_loss: 0.6377, test_loss: 1.2960, test_f1: 0.6076
 epoch: 57, train_loss: 0.6363, test_loss: 1.3829, test_f1: 0.6128
 epoch: 58, train_loss: 0.6335, test_loss: 1.2611, test_f1: 0.6365
 epoch: 59, train_loss: 0.6365, test_loss: 1.3785, test_f1: 0.5942
 epoch: 60, train_loss: 0.6384, test_loss: 1.3311, test_f1: 0.5924
 epoch: 61, train_loss: 0.6032, test_loss: 1.2562, test_f1: 0.6342
 epoch: 62, train_loss: 0.6011, test_loss: 1.1755, test_f1: 0.6205
 epoch: 63, train_loss: 0.5959, test_loss: 1.3613, test_f1: 0.6170
 epoch: 64, train_loss: 0.5970, test_loss: 1.5218, test_f1: 0.6245
 epoch: 65, train_loss: 0.5789, test_loss: 1.2443, test_f1: 0.6143
 epoch: 66, train_loss: 0.5870, test_loss: 1.6655, test_f1: 0.6324
 epoch: 67, train_loss: 0.5663, test_loss: 1.2455, test_f1: 0.6387
 epoch: 68, train_loss: 0.5882, test_loss: 1.1593, test_f1: 0.6369
 epoch: 69, train_loss: 0.5878, test_loss: 1.5934, test_f1: 0.6097
 epoch: 70, train_loss: 0.5941, test_loss: 1.7466, test_f1: 0.6411
 epoch: 71, train_loss: 0.6617, test_loss: 1.5731, test_f1: 0.5922
 epoch: 72, train_loss: 0.6381, test_loss: 1.2430, test_f1: 0.5876
 epoch: 73, train_loss: 0.6013, test_loss: 1.3643, test_f1: 0.6232
 epoch: 74, train_loss: 0.5913, test_loss: 1.1428, test_f1: 0.6380
 epoch: 75, train_loss: 0.5870, test_loss: 1.4146, test_f1: 0.6240
 epoch: 76, train_loss: 0.5853, test_loss: 1.3179, test_f1: 0.6003
 epoch: 77, train_loss: 0.5694, test_loss: 1.2875, test_f1: 0.6419
 epoch: 78, train_loss: 0.5488, test_loss: 1.4410, test_f1: 0.5766
 epoch: 79, train_loss: 0.5943, test_loss: 1.4750, test_f1: 0.5947
 epoch: 80, train_loss: 0.5886, test_loss: 1.2794, test_f1: 0.6282
 epoch: 81, train_loss: 0.5736, test_loss: 1.4278, test_f1: 0.5972
 epoch: 82, train_loss: 0.6165, test_loss: 1.3983, test_f1: 0.5739
 epoch: 83, train_loss: 0.5762, test_loss: 1.2909, test_f1: 0.5774
 epoch: 84, train_loss: 0.5974, test_loss: 1.9801, test_f1: 0.5942
 epoch: 85, train_loss: 0.5626, test_loss: 1.2757, test_f1: 0.6230
 epoch: 86, train_loss: 0.5663, test_loss: 1.3192, test_f1: 0.6283
 epoch: 87, train_loss: 0.5739, test_loss: 1.2861, test_f1: 0.6157
 epoch: 88, train_loss: 0.5669, test_loss: 1.5846, test_f1: 0.6692
 epoch: 89, train_loss: 0.5778, test_loss: 1.2928, test_f1: 0.6443
 epoch: 90, train_loss: 0.5828, test_loss: 1.2901, test_f1: 0.6310
 epoch: 91, train_loss: 0.5660, test_loss: 1.4382, test_f1: 0.6146
 epoch: 92, train_loss: 0.5383, test_loss: 1.5008, test_f1: 0.6331
 epoch: 93, train_loss: 0.5465, test_loss: 1.5932, test_f1: 0.5985
 epoch: 94, train_loss: 0.5390, test_loss: 1.4307, test_f1: 0.6212
 epoch: 95, train_loss: 0.5385, test_loss: 1.3149, test_f1: 0.6262
 epoch: 96, train_loss: 0.5163, test_loss: 1.5517, test_f1: 0.6227
 epoch: 97, train_loss: 0.5549, test_loss: 1.5191, test_f1: 0.6618
 epoch: 98, train_loss: 0.5767, test_loss: 1.4416, test_f1: 0.5919
 epoch: 99, train_loss: 0.5425, test_loss: 1.3178, test_f1: 0.6392

Training completed in 338.29 seconds
Best F1: 0.6826 at epoch 89
Mean F1 across iterations: 0.6529  0.0188
========================FINAL RESULTS================================
FEGIN weighted F1: 0.6826  0.0188
python main.py --data ltspice_demos --representation component_pin --model FEGIN --layers 3 --hiddens 16 --batch_size 128 --lr 0.01 --emb_size 250 --epochs 100 --save_appendix component_pin_L3_H16_BS128_LR0.01_E250 --no_val
-----



STDERR:
  File "main.py", line 370, in <module>
    main()
  File "main.py", line 254, in main
    dataset = dataset_class(
  File "/home/philip/projects/ltspice_examples_code_repo/Circuit-Completion-Using-GNNs/component_classification_with_link_prediction_head/evaluation/FEGIN/kernel/circuit_datasets.py", line 15, in __init__
    self.data, self.slices = torch.load(self.processed_paths[0])
  File "/home/philip/.local/lib/python3.8/site-packages/torch/serialization.py", line 1040, in load
    warnings.warn(
  File "/usr/lib/python3.8/warnings.py", line 109, in _showwarnmsg
    sw(msg.message, msg.category, msg.filename, msg.lineno,
  File "main.py", line 47, in warn_with_traceback
    traceback.print_stack(file=log)
/home/philip/projects/ltspice_examples_code_repo/Circuit-Completion-Using-GNNs/component_classification_with_link_prediction_head/evaluation/FEGIN/kernel/circuit_datasets.py:15: FutureWarning: You are using `torch.load` with `weights_only=False` (the current default value), which uses the default pickle module implicitly. It is possible to construct malicious pickle data which will execute arbitrary code during unpickling (See https://github.com/pytorch/pytorch/blob/main/SECURITY.md#untrusted-models for more details). In a future release, the default value for `weights_only` will be flipped to `True`. This limits the functions that could be executed during unpickling. Arbitrary objects will no longer be allowed to be loaded via this mode unless they are explicitly allowlisted by the user via `torch.serialization.add_safe_globals`. We recommend you start setting `weights_only=True` for any use case where you don't have full control of the loaded file. Please open an issue on GitHub for any issues related to this experimental feature.
  self.data, self.slices = torch.load(self.processed_paths[0])
