STDOUT:
Results will be saved in /home/philip/projects/ltspice_examples_code_repo/Circuit-Completion-Using-GNNs/component_classification_with_link_prediction_head/evaluation/FEGIN/results/model_FEGIN_dataset_ltspice_examples
Command line input: python main.py --data ltspice_examples --representation component_pin_net --model FEGIN --layers 6 --hiddens 16 --batch_size 32 --lr 0.0001 --emb_size 250 --epochs 100 --save_appendix component_pin_net_L6_H16_BS32_LR0.0001_E250 --no_val
 is saved.
-----
ltspice_examples - FEGIN
Using 6 layers, 16 hidden units, h = 2
Loading component_pin_net representation dataset
ENTERED
Training FEGIN on component_pin_net representation
Train: 3558, Test: 846
##################ITERATION #0 ****************************************
 epoch: 0, train_loss: 1.4581, test_loss: 1.4368, test_f1: 0.0793
 epoch: 1, train_loss: 1.4421, test_loss: 1.4288, test_f1: 0.0793
 epoch: 2, train_loss: 1.4334, test_loss: 1.4197, test_f1: 0.0795
 epoch: 3, train_loss: 1.4235, test_loss: 1.4092, test_f1: 0.1398
 epoch: 4, train_loss: 1.4124, test_loss: 1.3978, test_f1: 0.1954
 epoch: 5, train_loss: 1.3988, test_loss: 1.3853, test_f1: 0.2069
 epoch: 6, train_loss: 1.3812, test_loss: 1.3642, test_f1: 0.3163
 epoch: 7, train_loss: 1.3594, test_loss: 1.3351, test_f1: 0.3294
 epoch: 8, train_loss: 1.3291, test_loss: 1.3132, test_f1: 0.3163
 epoch: 9, train_loss: 1.3077, test_loss: 1.2848, test_f1: 0.2948
 epoch: 10, train_loss: 1.2874, test_loss: 1.2661, test_f1: 0.2918
 epoch: 11, train_loss: 1.2726, test_loss: 1.2501, test_f1: 0.2694
 epoch: 12, train_loss: 1.2602, test_loss: 1.2300, test_f1: 0.2835
 epoch: 13, train_loss: 1.2467, test_loss: 1.2168, test_f1: 0.3023
 epoch: 14, train_loss: 1.2355, test_loss: 1.1994, test_f1: 0.3417
 epoch: 15, train_loss: 1.2216, test_loss: 1.1866, test_f1: 0.3456
 epoch: 16, train_loss: 1.2085, test_loss: 1.1735, test_f1: 0.3637
 epoch: 17, train_loss: 1.2020, test_loss: 1.1579, test_f1: 0.3554
 epoch: 18, train_loss: 1.1860, test_loss: 1.1430, test_f1: 0.3422
 epoch: 19, train_loss: 1.1722, test_loss: 1.1265, test_f1: 0.3479
 epoch: 20, train_loss: 1.1648, test_loss: 1.1156, test_f1: 0.3422
 epoch: 21, train_loss: 1.1495, test_loss: 1.1121, test_f1: 0.3444
 epoch: 22, train_loss: 1.1502, test_loss: 1.0939, test_f1: 0.3420
 epoch: 23, train_loss: 1.1256, test_loss: 1.0889, test_f1: 0.3519
 epoch: 24, train_loss: 1.1260, test_loss: 1.0807, test_f1: 0.3460
 epoch: 25, train_loss: 1.1231, test_loss: 1.0782, test_f1: 0.3420
 epoch: 26, train_loss: 1.1104, test_loss: 1.0747, test_f1: 0.3484
 epoch: 27, train_loss: 1.1029, test_loss: 1.0693, test_f1: 0.3430
 epoch: 28, train_loss: 1.0908, test_loss: 1.0731, test_f1: 0.3448
 epoch: 29, train_loss: 1.0937, test_loss: 1.0662, test_f1: 0.3426
 epoch: 30, train_loss: 1.0859, test_loss: 1.0628, test_f1: 0.3420
 epoch: 31, train_loss: 1.0934, test_loss: 1.0593, test_f1: 0.3451
 epoch: 32, train_loss: 1.0876, test_loss: 1.0585, test_f1: 0.3455
 epoch: 33, train_loss: 1.0771, test_loss: 1.0642, test_f1: 0.3420
 epoch: 34, train_loss: 1.0779, test_loss: 1.0652, test_f1: 0.3441
 epoch: 35, train_loss: 1.0803, test_loss: 1.0624, test_f1: 0.3448
 epoch: 36, train_loss: 1.0808, test_loss: 1.0609, test_f1: 0.3469
 epoch: 37, train_loss: 1.0727, test_loss: 1.0543, test_f1: 0.3451
 epoch: 38, train_loss: 1.0704, test_loss: 1.0578, test_f1: 0.3462
 epoch: 39, train_loss: 1.0578, test_loss: 1.0610, test_f1: 0.3460
 epoch: 40, train_loss: 1.0660, test_loss: 1.0536, test_f1: 0.3462
 epoch: 41, train_loss: 1.0528, test_loss: 1.0619, test_f1: 0.3417
 epoch: 42, train_loss: 1.0569, test_loss: 1.0567, test_f1: 0.3434
 epoch: 43, train_loss: 1.0563, test_loss: 1.0414, test_f1: 0.3443
 epoch: 44, train_loss: 1.0551, test_loss: 1.0536, test_f1: 0.3494
 epoch: 45, train_loss: 1.0501, test_loss: 1.0486, test_f1: 0.3669
 epoch: 46, train_loss: 1.0471, test_loss: 1.0633, test_f1: 0.3573
 epoch: 47, train_loss: 1.0479, test_loss: 1.0513, test_f1: 0.3547
 epoch: 48, train_loss: 1.0454, test_loss: 1.0510, test_f1: 0.3744
 epoch: 49, train_loss: 1.0456, test_loss: 1.0330, test_f1: 0.3846
 epoch: 50, train_loss: 1.0365, test_loss: 1.0460, test_f1: 0.3907
 epoch: 51, train_loss: 1.0307, test_loss: 1.0348, test_f1: 0.4062
 epoch: 52, train_loss: 1.0367, test_loss: 1.0379, test_f1: 0.3895
 epoch: 53, train_loss: 1.0377, test_loss: 1.0348, test_f1: 0.4022
 epoch: 54, train_loss: 1.0326, test_loss: 1.0244, test_f1: 0.4042
 epoch: 55, train_loss: 1.0278, test_loss: 1.0330, test_f1: 0.4093
 epoch: 56, train_loss: 1.0291, test_loss: 1.0310, test_f1: 0.4135
 epoch: 57, train_loss: 1.0329, test_loss: 1.0223, test_f1: 0.3979
 epoch: 58, train_loss: 1.0316, test_loss: 1.0336, test_f1: 0.4063
 epoch: 59, train_loss: 1.0313, test_loss: 1.0243, test_f1: 0.4180
 epoch: 60, train_loss: 1.0298, test_loss: 1.0296, test_f1: 0.4319
 epoch: 61, train_loss: 1.0341, test_loss: 1.0186, test_f1: 0.4264
 epoch: 62, train_loss: 1.0291, test_loss: 1.0212, test_f1: 0.4241
 epoch: 63, train_loss: 1.0262, test_loss: 1.0442, test_f1: 0.4146
 epoch: 64, train_loss: 1.0229, test_loss: 1.0273, test_f1: 0.4348
 epoch: 65, train_loss: 1.0138, test_loss: 1.0127, test_f1: 0.4299
 epoch: 66, train_loss: 1.0248, test_loss: 1.0313, test_f1: 0.4220
 epoch: 67, train_loss: 1.0230, test_loss: 1.0228, test_f1: 0.4342
 epoch: 68, train_loss: 1.0225, test_loss: 1.0097, test_f1: 0.4404
 epoch: 69, train_loss: 1.0198, test_loss: 1.0218, test_f1: 0.4425
 epoch: 70, train_loss: 1.0224, test_loss: 1.0254, test_f1: 0.4398
 epoch: 71, train_loss: 1.0123, test_loss: 1.0021, test_f1: 0.4407
 epoch: 72, train_loss: 1.0165, test_loss: 0.9984, test_f1: 0.4429
 epoch: 73, train_loss: 1.0171, test_loss: 1.0069, test_f1: 0.4315
 epoch: 74, train_loss: 1.0128, test_loss: 1.0170, test_f1: 0.4288
 epoch: 75, train_loss: 1.0154, test_loss: 1.0096, test_f1: 0.4408
 epoch: 76, train_loss: 1.0185, test_loss: 1.0217, test_f1: 0.4541
 epoch: 77, train_loss: 1.0120, test_loss: 1.0130, test_f1: 0.4446
 epoch: 78, train_loss: 1.0114, test_loss: 1.0248, test_f1: 0.4541
 epoch: 79, train_loss: 1.0094, test_loss: 1.0259, test_f1: 0.4506
 epoch: 80, train_loss: 1.0105, test_loss: 1.0026, test_f1: 0.4520
 epoch: 81, train_loss: 1.0114, test_loss: 1.0014, test_f1: 0.4513
 epoch: 82, train_loss: 1.0115, test_loss: 1.0150, test_f1: 0.4544
 epoch: 83, train_loss: 1.0103, test_loss: 1.0104, test_f1: 0.4452
 epoch: 84, train_loss: 1.0062, test_loss: 1.0135, test_f1: 0.4513
 epoch: 85, train_loss: 1.0074, test_loss: 0.9966, test_f1: 0.4575
 epoch: 86, train_loss: 1.0066, test_loss: 1.0034, test_f1: 0.4554
 epoch: 87, train_loss: 1.0049, test_loss: 1.0055, test_f1: 0.4602
 epoch: 88, train_loss: 0.9991, test_loss: 0.9961, test_f1: 0.4552
 epoch: 89, train_loss: 0.9991, test_loss: 1.0048, test_f1: 0.4572
 epoch: 90, train_loss: 1.0020, test_loss: 1.0205, test_f1: 0.4520
 epoch: 91, train_loss: 1.0022, test_loss: 1.0277, test_f1: 0.4536
 epoch: 92, train_loss: 0.9986, test_loss: 1.0157, test_f1: 0.4560
 epoch: 93, train_loss: 0.9901, test_loss: 0.9987, test_f1: 0.4566
 epoch: 94, train_loss: 1.0034, test_loss: 0.9969, test_f1: 0.4519
 epoch: 95, train_loss: 0.9960, test_loss: 0.9977, test_f1: 0.4515
 epoch: 96, train_loss: 0.9992, test_loss: 0.9994, test_f1: 0.4560
 epoch: 97, train_loss: 0.9904, test_loss: 1.0113, test_f1: 0.4572
 epoch: 98, train_loss: 1.0005, test_loss: 1.0003, test_f1: 0.4612
 epoch: 99, train_loss: 0.9925, test_loss: 0.9988, test_f1: 0.4568
##################ITERATION #1 ****************************************
 epoch: 0, train_loss: 1.3596, test_loss: 1.3496, test_f1: 0.2662
 epoch: 1, train_loss: 1.3446, test_loss: 1.3376, test_f1: 0.2287
 epoch: 2, train_loss: 1.3305, test_loss: 1.3214, test_f1: 0.2270
 epoch: 3, train_loss: 1.3108, test_loss: 1.2997, test_f1: 0.2270
 epoch: 4, train_loss: 1.2877, test_loss: 1.2625, test_f1: 0.2295
 epoch: 5, train_loss: 1.2612, test_loss: 1.2282, test_f1: 0.3367
 epoch: 6, train_loss: 1.2316, test_loss: 1.1950, test_f1: 0.3422
 epoch: 7, train_loss: 1.2027, test_loss: 1.1631, test_f1: 0.3460
 epoch: 8, train_loss: 1.1847, test_loss: 1.1428, test_f1: 0.3429
 epoch: 9, train_loss: 1.1639, test_loss: 1.1219, test_f1: 0.3429
 epoch: 10, train_loss: 1.1515, test_loss: 1.1136, test_f1: 0.3393
 epoch: 11, train_loss: 1.1259, test_loss: 1.1014, test_f1: 0.3417
 epoch: 12, train_loss: 1.1228, test_loss: 1.0951, test_f1: 0.3403
 epoch: 13, train_loss: 1.1119, test_loss: 1.0850, test_f1: 0.3429
 epoch: 14, train_loss: 1.0956, test_loss: 1.0840, test_f1: 0.3405
 epoch: 15, train_loss: 1.0949, test_loss: 1.0781, test_f1: 0.3414
 epoch: 16, train_loss: 1.0944, test_loss: 1.0800, test_f1: 0.3431
 epoch: 17, train_loss: 1.0848, test_loss: 1.0682, test_f1: 0.3416
 epoch: 18, train_loss: 1.0742, test_loss: 1.0646, test_f1: 0.3428
 epoch: 19, train_loss: 1.0745, test_loss: 1.0652, test_f1: 0.3438
 epoch: 20, train_loss: 1.0722, test_loss: 1.0540, test_f1: 0.3428
 epoch: 21, train_loss: 1.0632, test_loss: 1.0558, test_f1: 0.3440
 epoch: 22, train_loss: 1.0647, test_loss: 1.0521, test_f1: 0.3442
 epoch: 23, train_loss: 1.0523, test_loss: 1.0562, test_f1: 0.3477
 epoch: 24, train_loss: 1.0531, test_loss: 1.0504, test_f1: 0.3580
 epoch: 25, train_loss: 1.0535, test_loss: 1.0504, test_f1: 0.3704
 epoch: 26, train_loss: 1.0428, test_loss: 1.0350, test_f1: 0.3718
 epoch: 27, train_loss: 1.0387, test_loss: 1.0129, test_f1: 0.3839
 epoch: 28, train_loss: 1.0367, test_loss: 1.0167, test_f1: 0.3953
 epoch: 29, train_loss: 1.0376, test_loss: 1.0280, test_f1: 0.4300
 epoch: 30, train_loss: 1.0319, test_loss: 1.0098, test_f1: 0.4215
 epoch: 31, train_loss: 1.0307, test_loss: 0.9906, test_f1: 0.4280
 epoch: 32, train_loss: 1.0247, test_loss: 0.9894, test_f1: 0.4399
 epoch: 33, train_loss: 1.0281, test_loss: 0.9758, test_f1: 0.4618
 epoch: 34, train_loss: 1.0118, test_loss: 0.9786, test_f1: 0.4481
 epoch: 35, train_loss: 1.0145, test_loss: 0.9817, test_f1: 0.4545
 epoch: 36, train_loss: 1.0156, test_loss: 0.9703, test_f1: 0.4708
 epoch: 37, train_loss: 1.0093, test_loss: 0.9701, test_f1: 0.4817
 epoch: 38, train_loss: 0.9976, test_loss: 0.9671, test_f1: 0.4703
 epoch: 39, train_loss: 1.0036, test_loss: 0.9618, test_f1: 0.4917
 epoch: 40, train_loss: 1.0024, test_loss: 0.9549, test_f1: 0.4911
 epoch: 41, train_loss: 0.9980, test_loss: 0.9522, test_f1: 0.4888
 epoch: 42, train_loss: 1.0010, test_loss: 0.9608, test_f1: 0.4886
 epoch: 43, train_loss: 0.9807, test_loss: 0.9504, test_f1: 0.4973
 epoch: 44, train_loss: 0.9954, test_loss: 0.9545, test_f1: 0.4822
 epoch: 45, train_loss: 0.9859, test_loss: 0.9435, test_f1: 0.4928
 epoch: 46, train_loss: 0.9837, test_loss: 0.9521, test_f1: 0.4995
 epoch: 47, train_loss: 0.9908, test_loss: 0.9414, test_f1: 0.4947
 epoch: 48, train_loss: 0.9822, test_loss: 0.9366, test_f1: 0.4975
 epoch: 49, train_loss: 0.9755, test_loss: 0.9507, test_f1: 0.4991
 epoch: 50, train_loss: 0.9815, test_loss: 0.9320, test_f1: 0.5063
 epoch: 51, train_loss: 0.9686, test_loss: 0.9359, test_f1: 0.4977
 epoch: 52, train_loss: 0.9676, test_loss: 0.9406, test_f1: 0.5050
 epoch: 53, train_loss: 0.9787, test_loss: 0.9385, test_f1: 0.5082
 epoch: 54, train_loss: 0.9613, test_loss: 0.9341, test_f1: 0.5179
 epoch: 55, train_loss: 0.9657, test_loss: 0.9301, test_f1: 0.5089
 epoch: 56, train_loss: 0.9647, test_loss: 0.9337, test_f1: 0.5007
 epoch: 57, train_loss: 0.9593, test_loss: 0.9250, test_f1: 0.5068
 epoch: 58, train_loss: 0.9696, test_loss: 0.9299, test_f1: 0.4897
 epoch: 59, train_loss: 0.9722, test_loss: 0.9317, test_f1: 0.5068
 epoch: 60, train_loss: 0.9747, test_loss: 0.9266, test_f1: 0.5061
 epoch: 61, train_loss: 0.9554, test_loss: 0.9288, test_f1: 0.5210
 epoch: 62, train_loss: 0.9597, test_loss: 0.9266, test_f1: 0.5126
 epoch: 63, train_loss: 0.9677, test_loss: 0.9274, test_f1: 0.5082
 epoch: 64, train_loss: 0.9595, test_loss: 0.9262, test_f1: 0.5239
 epoch: 65, train_loss: 0.9559, test_loss: 0.9266, test_f1: 0.5108
 epoch: 66, train_loss: 0.9682, test_loss: 0.9297, test_f1: 0.5034
 epoch: 67, train_loss: 0.9509, test_loss: 0.9354, test_f1: 0.4961
 epoch: 68, train_loss: 0.9558, test_loss: 0.9253, test_f1: 0.5113
 epoch: 69, train_loss: 0.9517, test_loss: 0.9262, test_f1: 0.5039
 epoch: 70, train_loss: 0.9504, test_loss: 0.9204, test_f1: 0.5098
 epoch: 71, train_loss: 0.9600, test_loss: 0.9259, test_f1: 0.5054
 epoch: 72, train_loss: 0.9505, test_loss: 0.9248, test_f1: 0.5252
 epoch: 73, train_loss: 0.9548, test_loss: 0.9219, test_f1: 0.5052
 epoch: 74, train_loss: 0.9495, test_loss: 0.9159, test_f1: 0.5108
 epoch: 75, train_loss: 0.9547, test_loss: 0.9246, test_f1: 0.5233
 epoch: 76, train_loss: 0.9602, test_loss: 0.9171, test_f1: 0.5070
 epoch: 77, train_loss: 0.9441, test_loss: 0.9187, test_f1: 0.5097
 epoch: 78, train_loss: 0.9510, test_loss: 0.9210, test_f1: 0.5044
 epoch: 79, train_loss: 0.9462, test_loss: 0.9201, test_f1: 0.5178
 epoch: 80, train_loss: 0.9458, test_loss: 0.9162, test_f1: 0.5236
 epoch: 81, train_loss: 0.9482, test_loss: 0.9330, test_f1: 0.5157
 epoch: 82, train_loss: 0.9400, test_loss: 0.9221, test_f1: 0.5222
 epoch: 83, train_loss: 0.9523, test_loss: 0.9162, test_f1: 0.5121
 epoch: 84, train_loss: 0.9499, test_loss: 0.9137, test_f1: 0.5062
 epoch: 85, train_loss: 0.9547, test_loss: 0.9081, test_f1: 0.5140
 epoch: 86, train_loss: 0.9435, test_loss: 0.9147, test_f1: 0.5248
 epoch: 87, train_loss: 0.9604, test_loss: 0.9113, test_f1: 0.5304
 epoch: 88, train_loss: 0.9526, test_loss: 0.9111, test_f1: 0.5270
 epoch: 89, train_loss: 0.9311, test_loss: 0.9151, test_f1: 0.5209
 epoch: 90, train_loss: 0.9550, test_loss: 0.9182, test_f1: 0.5197
 epoch: 91, train_loss: 0.9435, test_loss: 0.9168, test_f1: 0.5249
 epoch: 92, train_loss: 0.9513, test_loss: 0.9252, test_f1: 0.5112
 epoch: 93, train_loss: 0.9466, test_loss: 0.9098, test_f1: 0.5272
 epoch: 94, train_loss: 0.9427, test_loss: 0.9124, test_f1: 0.5197
 epoch: 95, train_loss: 0.9428, test_loss: 0.9213, test_f1: 0.5075
 epoch: 96, train_loss: 0.9379, test_loss: 0.9106, test_f1: 0.5217
 epoch: 97, train_loss: 0.9328, test_loss: 0.9105, test_f1: 0.5263
 epoch: 98, train_loss: 0.9402, test_loss: 0.9080, test_f1: 0.5221
 epoch: 99, train_loss: 0.9309, test_loss: 0.9106, test_f1: 0.5220
##################ITERATION #2 ****************************************
 epoch: 0, train_loss: 1.2962, test_loss: 1.2799, test_f1: 0.2270
 epoch: 1, train_loss: 1.2770, test_loss: 1.2651, test_f1: 0.2270
 epoch: 2, train_loss: 1.2650, test_loss: 1.2518, test_f1: 0.2270
 epoch: 3, train_loss: 1.2526, test_loss: 1.2383, test_f1: 0.2270
 epoch: 4, train_loss: 1.2395, test_loss: 1.2222, test_f1: 0.2270
 epoch: 5, train_loss: 1.2232, test_loss: 1.2016, test_f1: 0.2270
 epoch: 6, train_loss: 1.2072, test_loss: 1.1782, test_f1: 0.2709
 epoch: 7, train_loss: 1.1837, test_loss: 1.1527, test_f1: 0.3478
 epoch: 8, train_loss: 1.1657, test_loss: 1.1326, test_f1: 0.3441
 epoch: 9, train_loss: 1.1462, test_loss: 1.1078, test_f1: 0.3431
 epoch: 10, train_loss: 1.1334, test_loss: 1.0916, test_f1: 0.3441
 epoch: 11, train_loss: 1.1203, test_loss: 1.0819, test_f1: 0.3380
 epoch: 12, train_loss: 1.1091, test_loss: 1.0764, test_f1: 0.3420
 epoch: 13, train_loss: 1.1041, test_loss: 1.0770, test_f1: 0.3331
 epoch: 14, train_loss: 1.0871, test_loss: 1.0624, test_f1: 0.3416
 epoch: 15, train_loss: 1.0761, test_loss: 1.0579, test_f1: 0.3440
 epoch: 16, train_loss: 1.0796, test_loss: 1.0620, test_f1: 0.3416
 epoch: 17, train_loss: 1.0748, test_loss: 1.0564, test_f1: 0.3465
 epoch: 18, train_loss: 1.0623, test_loss: 1.0622, test_f1: 0.3417
 epoch: 19, train_loss: 1.0679, test_loss: 1.0601, test_f1: 0.3459
 epoch: 20, train_loss: 1.0712, test_loss: 1.0514, test_f1: 0.3788
 epoch: 21, train_loss: 1.0564, test_loss: 1.0559, test_f1: 0.3631
 epoch: 22, train_loss: 1.0592, test_loss: 1.0510, test_f1: 0.3619
 epoch: 23, train_loss: 1.0552, test_loss: 1.0635, test_f1: 0.3608
 epoch: 24, train_loss: 1.0471, test_loss: 1.0548, test_f1: 0.3902
 epoch: 25, train_loss: 1.0468, test_loss: 1.0595, test_f1: 0.3828
 epoch: 26, train_loss: 1.0431, test_loss: 1.0665, test_f1: 0.4066
 epoch: 27, train_loss: 1.0414, test_loss: 1.0610, test_f1: 0.4103
 epoch: 28, train_loss: 1.0426, test_loss: 1.0632, test_f1: 0.4119
 epoch: 29, train_loss: 1.0382, test_loss: 1.0589, test_f1: 0.4144
 epoch: 30, train_loss: 1.0404, test_loss: 1.0580, test_f1: 0.4162
 epoch: 31, train_loss: 1.0353, test_loss: 1.0579, test_f1: 0.4300
 epoch: 32, train_loss: 1.0317, test_loss: 1.0565, test_f1: 0.4545
 epoch: 33, train_loss: 1.0304, test_loss: 1.0580, test_f1: 0.4349
 epoch: 34, train_loss: 1.0269, test_loss: 1.0497, test_f1: 0.4583
 epoch: 35, train_loss: 1.0185, test_loss: 1.0567, test_f1: 0.4433
 epoch: 36, train_loss: 1.0235, test_loss: 1.0690, test_f1: 0.4496
 epoch: 37, train_loss: 1.0153, test_loss: 1.0632, test_f1: 0.4598
 epoch: 38, train_loss: 1.0204, test_loss: 1.0683, test_f1: 0.4510
 epoch: 39, train_loss: 1.0136, test_loss: 1.0539, test_f1: 0.4749
 epoch: 40, train_loss: 1.0197, test_loss: 1.0516, test_f1: 0.4819
 epoch: 41, train_loss: 1.0112, test_loss: 1.0725, test_f1: 0.4687
 epoch: 42, train_loss: 1.0111, test_loss: 1.0592, test_f1: 0.4776
 epoch: 43, train_loss: 1.0074, test_loss: 1.0526, test_f1: 0.4774
 epoch: 44, train_loss: 1.0036, test_loss: 1.0701, test_f1: 0.4687
 epoch: 45, train_loss: 1.0027, test_loss: 1.0386, test_f1: 0.4804
 epoch: 46, train_loss: 0.9967, test_loss: 1.0431, test_f1: 0.4640
 epoch: 47, train_loss: 0.9966, test_loss: 1.0624, test_f1: 0.4693
 epoch: 48, train_loss: 0.9879, test_loss: 1.0397, test_f1: 0.4700
 epoch: 49, train_loss: 0.9940, test_loss: 1.0416, test_f1: 0.4796
 epoch: 50, train_loss: 0.9870, test_loss: 1.0445, test_f1: 0.4782
 epoch: 51, train_loss: 0.9939, test_loss: 1.0556, test_f1: 0.4653
 epoch: 52, train_loss: 0.9876, test_loss: 1.0415, test_f1: 0.4790
 epoch: 53, train_loss: 0.9806, test_loss: 1.0268, test_f1: 0.4910
 epoch: 54, train_loss: 0.9916, test_loss: 1.0261, test_f1: 0.4935
 epoch: 55, train_loss: 0.9729, test_loss: 1.0662, test_f1: 0.4808
 epoch: 56, train_loss: 0.9875, test_loss: 1.0620, test_f1: 0.4660
 epoch: 57, train_loss: 0.9880, test_loss: 1.0399, test_f1: 0.4790
 epoch: 58, train_loss: 0.9805, test_loss: 1.0356, test_f1: 0.4819
 epoch: 59, train_loss: 0.9747, test_loss: 1.0328, test_f1: 0.4885
 epoch: 60, train_loss: 0.9784, test_loss: 1.0376, test_f1: 0.4768
 epoch: 61, train_loss: 0.9717, test_loss: 1.0782, test_f1: 0.4630
 epoch: 62, train_loss: 0.9751, test_loss: 1.0382, test_f1: 0.4924
 epoch: 63, train_loss: 0.9775, test_loss: 1.0545, test_f1: 0.4752
 epoch: 64, train_loss: 0.9697, test_loss: 1.0577, test_f1: 0.4738
 epoch: 65, train_loss: 0.9748, test_loss: 1.0439, test_f1: 0.4677
 epoch: 66, train_loss: 0.9834, test_loss: 1.0499, test_f1: 0.4690
 epoch: 67, train_loss: 0.9681, test_loss: 1.0390, test_f1: 0.4790
 epoch: 68, train_loss: 0.9676, test_loss: 1.0277, test_f1: 0.4873
 epoch: 69, train_loss: 0.9773, test_loss: 1.0906, test_f1: 0.4651
 epoch: 70, train_loss: 0.9681, test_loss: 1.0589, test_f1: 0.4660
 epoch: 71, train_loss: 0.9673, test_loss: 1.0440, test_f1: 0.4797
 epoch: 72, train_loss: 0.9691, test_loss: 1.0283, test_f1: 0.4867
 epoch: 73, train_loss: 0.9686, test_loss: 1.0437, test_f1: 0.4790
 epoch: 74, train_loss: 0.9700, test_loss: 1.0420, test_f1: 0.4805
 epoch: 75, train_loss: 0.9596, test_loss: 1.0295, test_f1: 0.4932
 epoch: 76, train_loss: 0.9661, test_loss: 1.0875, test_f1: 0.4731
 epoch: 77, train_loss: 0.9660, test_loss: 1.0451, test_f1: 0.4924
 epoch: 78, train_loss: 0.9554, test_loss: 1.0295, test_f1: 0.4892
 epoch: 79, train_loss: 0.9694, test_loss: 1.0421, test_f1: 0.4981
 epoch: 80, train_loss: 0.9735, test_loss: 1.0519, test_f1: 0.4708
 epoch: 81, train_loss: 0.9659, test_loss: 1.0372, test_f1: 0.4756
 epoch: 82, train_loss: 0.9649, test_loss: 1.0069, test_f1: 0.5053
 epoch: 83, train_loss: 0.9597, test_loss: 1.0137, test_f1: 0.4989
 epoch: 84, train_loss: 0.9607, test_loss: 1.0234, test_f1: 0.4749
 epoch: 85, train_loss: 0.9564, test_loss: 1.0197, test_f1: 0.4824
 epoch: 86, train_loss: 0.9544, test_loss: 1.0327, test_f1: 0.4897
 epoch: 87, train_loss: 0.9646, test_loss: 1.0219, test_f1: 0.4987
 epoch: 88, train_loss: 0.9557, test_loss: 1.0106, test_f1: 0.5161
 epoch: 89, train_loss: 0.9528, test_loss: 1.0378, test_f1: 0.4998
 epoch: 90, train_loss: 0.9516, test_loss: 1.0176, test_f1: 0.4917
 epoch: 91, train_loss: 0.9575, test_loss: 1.0366, test_f1: 0.5051
 epoch: 92, train_loss: 0.9598, test_loss: 1.0253, test_f1: 0.4937
 epoch: 93, train_loss: 0.9531, test_loss: 1.0133, test_f1: 0.4972
 epoch: 94, train_loss: 0.9556, test_loss: 1.0349, test_f1: 0.4724
 epoch: 95, train_loss: 0.9532, test_loss: 1.0219, test_f1: 0.4993
 epoch: 96, train_loss: 0.9555, test_loss: 1.0497, test_f1: 0.4816
 epoch: 97, train_loss: 0.9509, test_loss: 1.0394, test_f1: 0.4961
 epoch: 98, train_loss: 0.9464, test_loss: 1.0243, test_f1: 0.4851
 epoch: 99, train_loss: 0.9502, test_loss: 1.0172, test_f1: 0.4972
##################ITERATION #3 ****************************************
 epoch: 0, train_loss: 1.2901, test_loss: 1.2569, test_f1: 0.2270
 epoch: 1, train_loss: 1.2486, test_loss: 1.2163, test_f1: 0.2992
 epoch: 2, train_loss: 1.2145, test_loss: 1.1817, test_f1: 0.3344
 epoch: 3, train_loss: 1.1873, test_loss: 1.1548, test_f1: 0.3441
 epoch: 4, train_loss: 1.1724, test_loss: 1.1404, test_f1: 0.3411
 epoch: 5, train_loss: 1.1453, test_loss: 1.1207, test_f1: 0.3460
 epoch: 6, train_loss: 1.1339, test_loss: 1.1156, test_f1: 0.3421
 epoch: 7, train_loss: 1.1196, test_loss: 1.1134, test_f1: 0.3441
 epoch: 8, train_loss: 1.1113, test_loss: 1.1092, test_f1: 0.3431
 epoch: 9, train_loss: 1.1041, test_loss: 1.1116, test_f1: 0.3373
 epoch: 10, train_loss: 1.0992, test_loss: 1.0960, test_f1: 0.3430
 epoch: 11, train_loss: 1.0870, test_loss: 1.0929, test_f1: 0.3427
 epoch: 12, train_loss: 1.0779, test_loss: 1.0974, test_f1: 0.3415
 epoch: 13, train_loss: 1.0739, test_loss: 1.0921, test_f1: 0.3425
 epoch: 14, train_loss: 1.0688, test_loss: 1.0887, test_f1: 0.3526
 epoch: 15, train_loss: 1.0659, test_loss: 1.0849, test_f1: 0.3363
 epoch: 16, train_loss: 1.0555, test_loss: 1.0905, test_f1: 0.3461
 epoch: 17, train_loss: 1.0539, test_loss: 1.0748, test_f1: 0.3547
 epoch: 18, train_loss: 1.0558, test_loss: 1.0803, test_f1: 0.3551
 epoch: 19, train_loss: 1.0457, test_loss: 1.0780, test_f1: 0.3578
 epoch: 20, train_loss: 1.0362, test_loss: 1.0625, test_f1: 0.3772
 epoch: 21, train_loss: 1.0412, test_loss: 1.0524, test_f1: 0.3817
 epoch: 22, train_loss: 1.0316, test_loss: 1.0586, test_f1: 0.3845
 epoch: 23, train_loss: 1.0312, test_loss: 1.0558, test_f1: 0.4106
 epoch: 24, train_loss: 1.0300, test_loss: 1.0554, test_f1: 0.4019
 epoch: 25, train_loss: 1.0212, test_loss: 1.0546, test_f1: 0.4320
 epoch: 26, train_loss: 1.0103, test_loss: 1.0604, test_f1: 0.4198
 epoch: 27, train_loss: 1.0103, test_loss: 1.0511, test_f1: 0.4177
 epoch: 28, train_loss: 1.0092, test_loss: 1.0504, test_f1: 0.4143
 epoch: 29, train_loss: 1.0131, test_loss: 1.0520, test_f1: 0.4543
 epoch: 30, train_loss: 1.0066, test_loss: 1.0496, test_f1: 0.4662
 epoch: 31, train_loss: 1.0035, test_loss: 1.0409, test_f1: 0.4471
 epoch: 32, train_loss: 0.9971, test_loss: 1.0635, test_f1: 0.4521
 epoch: 33, train_loss: 0.9925, test_loss: 1.0565, test_f1: 0.4451
 epoch: 34, train_loss: 0.9941, test_loss: 1.0501, test_f1: 0.4565
 epoch: 35, train_loss: 0.9847, test_loss: 1.0348, test_f1: 0.4725
 epoch: 36, train_loss: 0.9899, test_loss: 1.0327, test_f1: 0.4638
 epoch: 37, train_loss: 0.9856, test_loss: 1.0562, test_f1: 0.4742
 epoch: 38, train_loss: 0.9750, test_loss: 1.0330, test_f1: 0.4922
 epoch: 39, train_loss: 0.9840, test_loss: 1.0414, test_f1: 0.4795
 epoch: 40, train_loss: 0.9782, test_loss: 1.0233, test_f1: 0.4884
 epoch: 41, train_loss: 0.9734, test_loss: 1.0284, test_f1: 0.4699
 epoch: 42, train_loss: 0.9747, test_loss: 1.0246, test_f1: 0.5005
 epoch: 43, train_loss: 0.9690, test_loss: 1.0156, test_f1: 0.5021
 epoch: 44, train_loss: 0.9717, test_loss: 1.0326, test_f1: 0.4762
 epoch: 45, train_loss: 0.9713, test_loss: 1.0187, test_f1: 0.5001
 epoch: 46, train_loss: 0.9693, test_loss: 1.0107, test_f1: 0.5071
 epoch: 47, train_loss: 0.9725, test_loss: 1.0163, test_f1: 0.5027
 epoch: 48, train_loss: 0.9600, test_loss: 1.0346, test_f1: 0.5001
 epoch: 49, train_loss: 0.9636, test_loss: 1.0109, test_f1: 0.5090
 epoch: 50, train_loss: 0.9677, test_loss: 1.0181, test_f1: 0.5067
 epoch: 51, train_loss: 0.9550, test_loss: 1.0232, test_f1: 0.5069
 epoch: 52, train_loss: 0.9652, test_loss: 1.0312, test_f1: 0.5023
 epoch: 53, train_loss: 0.9610, test_loss: 1.0197, test_f1: 0.5015
 epoch: 54, train_loss: 0.9594, test_loss: 1.0275, test_f1: 0.4940
 epoch: 55, train_loss: 0.9553, test_loss: 1.0090, test_f1: 0.5142
 epoch: 56, train_loss: 0.9497, test_loss: 1.0124, test_f1: 0.4981
 epoch: 57, train_loss: 0.9485, test_loss: 1.0171, test_f1: 0.5099
 epoch: 58, train_loss: 0.9560, test_loss: 1.0259, test_f1: 0.5049
 epoch: 59, train_loss: 0.9492, test_loss: 1.0212, test_f1: 0.5012
 epoch: 60, train_loss: 0.9522, test_loss: 1.0075, test_f1: 0.5210
 epoch: 61, train_loss: 0.9571, test_loss: 1.0021, test_f1: 0.5164
 epoch: 62, train_loss: 0.9455, test_loss: 1.0040, test_f1: 0.5120
 epoch: 63, train_loss: 0.9581, test_loss: 1.0149, test_f1: 0.5072
 epoch: 64, train_loss: 0.9467, test_loss: 1.0113, test_f1: 0.5075
 epoch: 65, train_loss: 0.9459, test_loss: 1.0262, test_f1: 0.5087
 epoch: 66, train_loss: 0.9456, test_loss: 1.0223, test_f1: 0.5078
 epoch: 67, train_loss: 0.9407, test_loss: 1.0119, test_f1: 0.5121
 epoch: 68, train_loss: 0.9428, test_loss: 1.0163, test_f1: 0.5112
 epoch: 69, train_loss: 0.9360, test_loss: 1.0059, test_f1: 0.5042
 epoch: 70, train_loss: 0.9394, test_loss: 1.0287, test_f1: 0.5079
 epoch: 71, train_loss: 0.9430, test_loss: 1.0274, test_f1: 0.4956
 epoch: 72, train_loss: 0.9408, test_loss: 1.0220, test_f1: 0.5136
 epoch: 73, train_loss: 0.9510, test_loss: 1.0060, test_f1: 0.5230
 epoch: 74, train_loss: 0.9375, test_loss: 1.0138, test_f1: 0.4968
 epoch: 75, train_loss: 0.9354, test_loss: 1.0066, test_f1: 0.5219
 epoch: 76, train_loss: 0.9426, test_loss: 1.0128, test_f1: 0.5119
 epoch: 77, train_loss: 0.9415, test_loss: 1.0065, test_f1: 0.5140
 epoch: 78, train_loss: 0.9348, test_loss: 1.0264, test_f1: 0.5054
 epoch: 79, train_loss: 0.9467, test_loss: 0.9924, test_f1: 0.5101
 epoch: 80, train_loss: 0.9401, test_loss: 1.0018, test_f1: 0.5235
 epoch: 81, train_loss: 0.9376, test_loss: 1.0163, test_f1: 0.4999
 epoch: 82, train_loss: 0.9361, test_loss: 0.9959, test_f1: 0.5245
 epoch: 83, train_loss: 0.9323, test_loss: 1.0138, test_f1: 0.5112
 epoch: 84, train_loss: 0.9433, test_loss: 1.0388, test_f1: 0.4957
 epoch: 85, train_loss: 0.9329, test_loss: 1.0148, test_f1: 0.5057
 epoch: 86, train_loss: 0.9426, test_loss: 1.0060, test_f1: 0.5218
 epoch: 87, train_loss: 0.9358, test_loss: 1.0464, test_f1: 0.4937
 epoch: 88, train_loss: 0.9305, test_loss: 0.9970, test_f1: 0.5209
 epoch: 89, train_loss: 0.9331, test_loss: 0.9940, test_f1: 0.5055
 epoch: 90, train_loss: 0.9224, test_loss: 0.9914, test_f1: 0.5235
 epoch: 91, train_loss: 0.9364, test_loss: 1.0189, test_f1: 0.5152
 epoch: 92, train_loss: 0.9276, test_loss: 1.0152, test_f1: 0.5061
 epoch: 93, train_loss: 0.9359, test_loss: 1.0176, test_f1: 0.5142
 epoch: 94, train_loss: 0.9345, test_loss: 0.9918, test_f1: 0.5242
 epoch: 95, train_loss: 0.9247, test_loss: 1.0103, test_f1: 0.5099
 epoch: 96, train_loss: 0.9161, test_loss: 1.0024, test_f1: 0.5151
 epoch: 97, train_loss: 0.9219, test_loss: 0.9983, test_f1: 0.5150
 epoch: 98, train_loss: 0.9201, test_loss: 0.9970, test_f1: 0.5152
 epoch: 99, train_loss: 0.9321, test_loss: 1.0042, test_f1: 0.5162
##################ITERATION #4 ****************************************
 epoch: 0, train_loss: 1.2771, test_loss: 1.2300, test_f1: 0.2887
 epoch: 1, train_loss: 1.2295, test_loss: 1.2008, test_f1: 0.3171
 epoch: 2, train_loss: 1.2033, test_loss: 1.1759, test_f1: 0.3425
 epoch: 3, train_loss: 1.1821, test_loss: 1.1534, test_f1: 0.3422
 epoch: 4, train_loss: 1.1582, test_loss: 1.1361, test_f1: 0.3441
 epoch: 5, train_loss: 1.1445, test_loss: 1.1213, test_f1: 0.3421
 epoch: 6, train_loss: 1.1184, test_loss: 1.1116, test_f1: 0.3485
 epoch: 7, train_loss: 1.1142, test_loss: 1.0940, test_f1: 0.3533
 epoch: 8, train_loss: 1.0992, test_loss: 1.0767, test_f1: 0.3717
 epoch: 9, train_loss: 1.0930, test_loss: 1.0849, test_f1: 0.3787
 epoch: 10, train_loss: 1.0828, test_loss: 1.0758, test_f1: 0.3775
 epoch: 11, train_loss: 1.0678, test_loss: 1.0684, test_f1: 0.3908
 epoch: 12, train_loss: 1.0685, test_loss: 1.0619, test_f1: 0.4011
 epoch: 13, train_loss: 1.0566, test_loss: 1.0569, test_f1: 0.3908
 epoch: 14, train_loss: 1.0565, test_loss: 1.0923, test_f1: 0.3789
 epoch: 15, train_loss: 1.0491, test_loss: 1.0522, test_f1: 0.4300
 epoch: 16, train_loss: 1.0343, test_loss: 1.0514, test_f1: 0.4156
 epoch: 17, train_loss: 1.0350, test_loss: 1.0413, test_f1: 0.4201
 epoch: 18, train_loss: 1.0373, test_loss: 1.0389, test_f1: 0.4514
 epoch: 19, train_loss: 1.0247, test_loss: 1.0404, test_f1: 0.4546
 epoch: 20, train_loss: 1.0183, test_loss: 1.0313, test_f1: 0.4452
 epoch: 21, train_loss: 1.0166, test_loss: 1.0213, test_f1: 0.4380
 epoch: 22, train_loss: 1.0126, test_loss: 1.0139, test_f1: 0.4480
 epoch: 23, train_loss: 1.0071, test_loss: 1.0070, test_f1: 0.4629
 epoch: 24, train_loss: 1.0048, test_loss: 1.0127, test_f1: 0.4542
 epoch: 25, train_loss: 0.9985, test_loss: 0.9975, test_f1: 0.4626
 epoch: 26, train_loss: 0.9971, test_loss: 0.9950, test_f1: 0.4637
 epoch: 27, train_loss: 1.0037, test_loss: 0.9934, test_f1: 0.4630
 epoch: 28, train_loss: 0.9959, test_loss: 0.9888, test_f1: 0.4655
 epoch: 29, train_loss: 0.9835, test_loss: 0.9880, test_f1: 0.4715
 epoch: 30, train_loss: 0.9866, test_loss: 0.9911, test_f1: 0.4684
 epoch: 31, train_loss: 0.9785, test_loss: 0.9789, test_f1: 0.4770
 epoch: 32, train_loss: 0.9847, test_loss: 0.9779, test_f1: 0.4784
 epoch: 33, train_loss: 0.9810, test_loss: 0.9698, test_f1: 0.4759
 epoch: 34, train_loss: 0.9692, test_loss: 0.9779, test_f1: 0.4965
 epoch: 35, train_loss: 0.9708, test_loss: 0.9745, test_f1: 0.4806
 epoch: 36, train_loss: 0.9698, test_loss: 0.9789, test_f1: 0.4966
 epoch: 37, train_loss: 0.9699, test_loss: 0.9687, test_f1: 0.4885
 epoch: 38, train_loss: 0.9631, test_loss: 0.9677, test_f1: 0.4957
 epoch: 39, train_loss: 0.9635, test_loss: 0.9666, test_f1: 0.4802
 epoch: 40, train_loss: 0.9634, test_loss: 0.9654, test_f1: 0.4984
 epoch: 41, train_loss: 0.9641, test_loss: 0.9595, test_f1: 0.4813
 epoch: 42, train_loss: 0.9555, test_loss: 0.9568, test_f1: 0.4978
 epoch: 43, train_loss: 0.9640, test_loss: 0.9616, test_f1: 0.4947
 epoch: 44, train_loss: 0.9562, test_loss: 0.9624, test_f1: 0.4943
 epoch: 45, train_loss: 0.9609, test_loss: 0.9606, test_f1: 0.5019
 epoch: 46, train_loss: 0.9629, test_loss: 0.9536, test_f1: 0.4799
 epoch: 47, train_loss: 0.9533, test_loss: 0.9517, test_f1: 0.4877
 epoch: 48, train_loss: 0.9533, test_loss: 0.9617, test_f1: 0.4949
 epoch: 49, train_loss: 0.9489, test_loss: 0.9487, test_f1: 0.4849
 epoch: 50, train_loss: 0.9512, test_loss: 0.9390, test_f1: 0.4918
 epoch: 51, train_loss: 0.9376, test_loss: 0.9352, test_f1: 0.4978
 epoch: 52, train_loss: 0.9462, test_loss: 0.9357, test_f1: 0.4838
 epoch: 53, train_loss: 0.9459, test_loss: 0.9434, test_f1: 0.4940
 epoch: 54, train_loss: 0.9391, test_loss: 0.9447, test_f1: 0.4873
 epoch: 55, train_loss: 0.9406, test_loss: 0.9505, test_f1: 0.5083
 epoch: 56, train_loss: 0.9542, test_loss: 0.9433, test_f1: 0.5048
 epoch: 57, train_loss: 0.9396, test_loss: 0.9378, test_f1: 0.4997
 epoch: 58, train_loss: 0.9390, test_loss: 0.9276, test_f1: 0.5058
 epoch: 59, train_loss: 0.9428, test_loss: 0.9464, test_f1: 0.4746
 epoch: 60, train_loss: 0.9478, test_loss: 0.9402, test_f1: 0.5012
 epoch: 61, train_loss: 0.9481, test_loss: 0.9310, test_f1: 0.5082
 epoch: 62, train_loss: 0.9403, test_loss: 0.9328, test_f1: 0.5087
 epoch: 63, train_loss: 0.9356, test_loss: 0.9404, test_f1: 0.4854
 epoch: 64, train_loss: 0.9473, test_loss: 0.9338, test_f1: 0.5128
 epoch: 65, train_loss: 0.9352, test_loss: 0.9332, test_f1: 0.5071
 epoch: 66, train_loss: 0.9326, test_loss: 0.9395, test_f1: 0.4997
 epoch: 67, train_loss: 0.9331, test_loss: 0.9283, test_f1: 0.4988
 epoch: 68, train_loss: 0.9383, test_loss: 0.9339, test_f1: 0.5106
 epoch: 69, train_loss: 0.9367, test_loss: 0.9287, test_f1: 0.5050
 epoch: 70, train_loss: 0.9306, test_loss: 0.9410, test_f1: 0.5125
 epoch: 71, train_loss: 0.9250, test_loss: 0.9296, test_f1: 0.5146
 epoch: 72, train_loss: 0.9369, test_loss: 0.9237, test_f1: 0.5183
 epoch: 73, train_loss: 0.9279, test_loss: 0.9322, test_f1: 0.5078
 epoch: 74, train_loss: 0.9315, test_loss: 0.9172, test_f1: 0.5050
 epoch: 75, train_loss: 0.9317, test_loss: 0.9290, test_f1: 0.5178
 epoch: 76, train_loss: 0.9257, test_loss: 0.9291, test_f1: 0.5222
 epoch: 77, train_loss: 0.9367, test_loss: 0.9145, test_f1: 0.5149
 epoch: 78, train_loss: 0.9304, test_loss: 0.9260, test_f1: 0.5158
 epoch: 79, train_loss: 0.9282, test_loss: 0.9235, test_f1: 0.5148
 epoch: 80, train_loss: 0.9339, test_loss: 0.9286, test_f1: 0.5056
 epoch: 81, train_loss: 0.9290, test_loss: 0.9154, test_f1: 0.5181
 epoch: 82, train_loss: 0.9352, test_loss: 0.9233, test_f1: 0.5065
 epoch: 83, train_loss: 0.9220, test_loss: 0.9323, test_f1: 0.5216
 epoch: 84, train_loss: 0.9291, test_loss: 0.9298, test_f1: 0.5196
 epoch: 85, train_loss: 0.9150, test_loss: 0.9280, test_f1: 0.5143
 epoch: 86, train_loss: 0.9255, test_loss: 0.9341, test_f1: 0.5182
 epoch: 87, train_loss: 0.9287, test_loss: 0.9118, test_f1: 0.5223
 epoch: 88, train_loss: 0.9238, test_loss: 0.9266, test_f1: 0.5255
 epoch: 89, train_loss: 0.9221, test_loss: 0.9298, test_f1: 0.5279
 epoch: 90, train_loss: 0.9287, test_loss: 0.9240, test_f1: 0.5131
 epoch: 91, train_loss: 0.9219, test_loss: 0.9220, test_f1: 0.5163
 epoch: 92, train_loss: 0.9250, test_loss: 0.9248, test_f1: 0.5200
 epoch: 93, train_loss: 0.9256, test_loss: 0.9308, test_f1: 0.5224
 epoch: 94, train_loss: 0.9198, test_loss: 0.9223, test_f1: 0.5038
 epoch: 95, train_loss: 0.9180, test_loss: 0.9174, test_f1: 0.5106
 epoch: 96, train_loss: 0.9167, test_loss: 0.9187, test_f1: 0.5282
 epoch: 97, train_loss: 0.9229, test_loss: 0.9081, test_f1: 0.5233
 epoch: 98, train_loss: 0.9172, test_loss: 0.9159, test_f1: 0.5272
 epoch: 99, train_loss: 0.9214, test_loss: 0.9130, test_f1: 0.5246
##################ITERATION #5 ****************************************
 epoch: 0, train_loss: 1.2747, test_loss: 1.1518, test_f1: 0.3299
 epoch: 1, train_loss: 1.1944, test_loss: 1.1226, test_f1: 0.3422
 epoch: 2, train_loss: 1.1645, test_loss: 1.1056, test_f1: 0.3460
 epoch: 3, train_loss: 1.1409, test_loss: 1.0972, test_f1: 0.3424
 epoch: 4, train_loss: 1.1268, test_loss: 1.0891, test_f1: 0.3458
 epoch: 5, train_loss: 1.1115, test_loss: 1.0822, test_f1: 0.3515
 epoch: 6, train_loss: 1.1010, test_loss: 1.0786, test_f1: 0.3525
 epoch: 7, train_loss: 1.0910, test_loss: 1.0731, test_f1: 0.3534
 epoch: 8, train_loss: 1.0867, test_loss: 1.0729, test_f1: 0.3508
 epoch: 9, train_loss: 1.0787, test_loss: 1.0703, test_f1: 0.3477
 epoch: 10, train_loss: 1.0779, test_loss: 1.0672, test_f1: 0.3496
 epoch: 11, train_loss: 1.0691, test_loss: 1.0672, test_f1: 0.3543
 epoch: 12, train_loss: 1.0714, test_loss: 1.0689, test_f1: 0.3538
 epoch: 13, train_loss: 1.0580, test_loss: 1.0640, test_f1: 0.3550
 epoch: 14, train_loss: 1.0610, test_loss: 1.0600, test_f1: 0.3496
 epoch: 15, train_loss: 1.0575, test_loss: 1.0476, test_f1: 0.3578
 epoch: 16, train_loss: 1.0516, test_loss: 1.0482, test_f1: 0.3610
 epoch: 17, train_loss: 1.0560, test_loss: 1.0456, test_f1: 0.3612
 epoch: 18, train_loss: 1.0464, test_loss: 1.0489, test_f1: 0.3623
 epoch: 19, train_loss: 1.0463, test_loss: 1.0496, test_f1: 0.3716
 epoch: 20, train_loss: 1.0400, test_loss: 1.0496, test_f1: 0.3693
 epoch: 21, train_loss: 1.0391, test_loss: 1.0433, test_f1: 0.3722
 epoch: 22, train_loss: 1.0346, test_loss: 1.0328, test_f1: 0.3805
 epoch: 23, train_loss: 1.0344, test_loss: 1.0381, test_f1: 0.3866
 epoch: 24, train_loss: 1.0312, test_loss: 1.0226, test_f1: 0.3906
 epoch: 25, train_loss: 1.0325, test_loss: 1.0372, test_f1: 0.4059
 epoch: 26, train_loss: 1.0256, test_loss: 1.0309, test_f1: 0.4051
 epoch: 27, train_loss: 1.0265, test_loss: 1.0200, test_f1: 0.4121
 epoch: 28, train_loss: 1.0162, test_loss: 1.0266, test_f1: 0.4231
 epoch: 29, train_loss: 1.0171, test_loss: 1.0240, test_f1: 0.4306
 epoch: 30, train_loss: 1.0139, test_loss: 1.0364, test_f1: 0.4260
 epoch: 31, train_loss: 1.0168, test_loss: 1.0386, test_f1: 0.4283
 epoch: 32, train_loss: 1.0124, test_loss: 1.0191, test_f1: 0.4269
 epoch: 33, train_loss: 1.0158, test_loss: 1.0130, test_f1: 0.4358
 epoch: 34, train_loss: 1.0092, test_loss: 1.0038, test_f1: 0.4442
 epoch: 35, train_loss: 1.0110, test_loss: 1.0022, test_f1: 0.4596
 epoch: 36, train_loss: 1.0117, test_loss: 0.9978, test_f1: 0.4592
 epoch: 37, train_loss: 1.0100, test_loss: 1.0032, test_f1: 0.4499
 epoch: 38, train_loss: 1.0015, test_loss: 1.0135, test_f1: 0.4627
 epoch: 39, train_loss: 0.9957, test_loss: 1.0117, test_f1: 0.4690
 epoch: 40, train_loss: 1.0022, test_loss: 0.9866, test_f1: 0.4469
 epoch: 41, train_loss: 0.9901, test_loss: 0.9854, test_f1: 0.4702
 epoch: 42, train_loss: 0.9960, test_loss: 0.9917, test_f1: 0.4530
 epoch: 43, train_loss: 0.9911, test_loss: 0.9890, test_f1: 0.4682
 epoch: 44, train_loss: 0.9855, test_loss: 1.0004, test_f1: 0.4740
 epoch: 45, train_loss: 0.9873, test_loss: 0.9704, test_f1: 0.4713
 epoch: 46, train_loss: 0.9915, test_loss: 0.9849, test_f1: 0.4783
 epoch: 47, train_loss: 0.9865, test_loss: 0.9595, test_f1: 0.4708
 epoch: 48, train_loss: 0.9844, test_loss: 0.9738, test_f1: 0.4728
 epoch: 49, train_loss: 0.9783, test_loss: 0.9699, test_f1: 0.4681
 epoch: 50, train_loss: 0.9768, test_loss: 0.9586, test_f1: 0.4646
 epoch: 51, train_loss: 0.9747, test_loss: 0.9528, test_f1: 0.4725
 epoch: 52, train_loss: 0.9746, test_loss: 0.9624, test_f1: 0.4761
 epoch: 53, train_loss: 0.9718, test_loss: 0.9555, test_f1: 0.4740
 epoch: 54, train_loss: 0.9732, test_loss: 0.9551, test_f1: 0.4705
 epoch: 55, train_loss: 0.9734, test_loss: 0.9496, test_f1: 0.4627
 epoch: 56, train_loss: 0.9707, test_loss: 0.9528, test_f1: 0.4758
 epoch: 57, train_loss: 0.9721, test_loss: 0.9419, test_f1: 0.4803
 epoch: 58, train_loss: 0.9667, test_loss: 0.9390, test_f1: 0.4797
 epoch: 59, train_loss: 0.9732, test_loss: 0.9474, test_f1: 0.4633
 epoch: 60, train_loss: 0.9664, test_loss: 0.9373, test_f1: 0.4782
 epoch: 61, train_loss: 0.9782, test_loss: 0.9398, test_f1: 0.4781
 epoch: 62, train_loss: 0.9744, test_loss: 0.9539, test_f1: 0.4823
 epoch: 63, train_loss: 0.9679, test_loss: 0.9429, test_f1: 0.4845
 epoch: 64, train_loss: 0.9757, test_loss: 0.9459, test_f1: 0.4718
 epoch: 65, train_loss: 0.9714, test_loss: 0.9382, test_f1: 0.4861
 epoch: 66, train_loss: 0.9600, test_loss: 0.9444, test_f1: 0.4866
 epoch: 67, train_loss: 0.9654, test_loss: 0.9513, test_f1: 0.4877
 epoch: 68, train_loss: 0.9619, test_loss: 0.9441, test_f1: 0.4795
 epoch: 69, train_loss: 0.9562, test_loss: 0.9414, test_f1: 0.4794
 epoch: 70, train_loss: 0.9614, test_loss: 0.9330, test_f1: 0.4886
 epoch: 71, train_loss: 0.9645, test_loss: 0.9288, test_f1: 0.4834
 epoch: 72, train_loss: 0.9618, test_loss: 0.9271, test_f1: 0.4949
 epoch: 73, train_loss: 0.9547, test_loss: 0.9265, test_f1: 0.5024
 epoch: 74, train_loss: 0.9604, test_loss: 0.9473, test_f1: 0.4869
 epoch: 75, train_loss: 0.9592, test_loss: 0.9419, test_f1: 0.4868
 epoch: 76, train_loss: 0.9575, test_loss: 0.9371, test_f1: 0.4950
 epoch: 77, train_loss: 0.9650, test_loss: 0.9310, test_f1: 0.4801
 epoch: 78, train_loss: 0.9557, test_loss: 0.9363, test_f1: 0.4867
 epoch: 79, train_loss: 0.9562, test_loss: 0.9251, test_f1: 0.4728
 epoch: 80, train_loss: 0.9501, test_loss: 0.9262, test_f1: 0.4843
 epoch: 81, train_loss: 0.9471, test_loss: 0.9274, test_f1: 0.4905
 epoch: 82, train_loss: 0.9540, test_loss: 0.9322, test_f1: 0.4884
 epoch: 83, train_loss: 0.9444, test_loss: 0.9227, test_f1: 0.4828
 epoch: 84, train_loss: 0.9450, test_loss: 0.9167, test_f1: 0.4912
 epoch: 85, train_loss: 0.9507, test_loss: 0.9241, test_f1: 0.4903
 epoch: 86, train_loss: 0.9459, test_loss: 0.9379, test_f1: 0.4869
 epoch: 87, train_loss: 0.9498, test_loss: 0.9253, test_f1: 0.4893
 epoch: 88, train_loss: 0.9490, test_loss: 0.9251, test_f1: 0.4920
 epoch: 89, train_loss: 0.9495, test_loss: 0.9243, test_f1: 0.4913
 epoch: 90, train_loss: 0.9409, test_loss: 0.9163, test_f1: 0.5041
 epoch: 91, train_loss: 0.9398, test_loss: 0.9163, test_f1: 0.4922
 epoch: 92, train_loss: 0.9497, test_loss: 0.9303, test_f1: 0.4962
 epoch: 93, train_loss: 0.9500, test_loss: 0.9156, test_f1: 0.5012
 epoch: 94, train_loss: 0.9386, test_loss: 0.9091, test_f1: 0.5016
 epoch: 95, train_loss: 0.9490, test_loss: 0.9334, test_f1: 0.4982
 epoch: 96, train_loss: 0.9434, test_loss: 0.9393, test_f1: 0.4959
 epoch: 97, train_loss: 0.9452, test_loss: 0.9348, test_f1: 0.4936
 epoch: 98, train_loss: 0.9409, test_loss: 0.9242, test_f1: 0.4923
 epoch: 99, train_loss: 0.9405, test_loss: 0.9373, test_f1: 0.5004
##################ITERATION #6 ****************************************
 epoch: 0, train_loss: 1.3010, test_loss: 1.1750, test_f1: 0.2801
 epoch: 1, train_loss: 1.2074, test_loss: 1.1350, test_f1: 0.3430
 epoch: 2, train_loss: 1.1718, test_loss: 1.1015, test_f1: 0.3575
 epoch: 3, train_loss: 1.1499, test_loss: 1.0787, test_f1: 0.3606
 epoch: 4, train_loss: 1.1276, test_loss: 1.0710, test_f1: 0.3699
 epoch: 5, train_loss: 1.1170, test_loss: 1.0594, test_f1: 0.3710
 epoch: 6, train_loss: 1.0955, test_loss: 1.0497, test_f1: 0.3792
 epoch: 7, train_loss: 1.0882, test_loss: 1.0372, test_f1: 0.3986
 epoch: 8, train_loss: 1.0837, test_loss: 1.0329, test_f1: 0.3924
 epoch: 9, train_loss: 1.0744, test_loss: 1.0342, test_f1: 0.4137
 epoch: 10, train_loss: 1.0684, test_loss: 1.0160, test_f1: 0.4190
 epoch: 11, train_loss: 1.0599, test_loss: 1.0133, test_f1: 0.4181
 epoch: 12, train_loss: 1.0437, test_loss: 1.0045, test_f1: 0.4432
 epoch: 13, train_loss: 1.0414, test_loss: 0.9917, test_f1: 0.4343
 epoch: 14, train_loss: 1.0344, test_loss: 1.0032, test_f1: 0.4403
 epoch: 15, train_loss: 1.0300, test_loss: 0.9982, test_f1: 0.4427
 epoch: 16, train_loss: 1.0255, test_loss: 0.9990, test_f1: 0.4556
 epoch: 17, train_loss: 1.0270, test_loss: 0.9795, test_f1: 0.4623
 epoch: 18, train_loss: 1.0167, test_loss: 0.9734, test_f1: 0.4561
 epoch: 19, train_loss: 1.0191, test_loss: 0.9741, test_f1: 0.4423
 epoch: 20, train_loss: 1.0132, test_loss: 0.9762, test_f1: 0.4513
 epoch: 21, train_loss: 1.0104, test_loss: 0.9705, test_f1: 0.4577
 epoch: 22, train_loss: 1.0121, test_loss: 0.9667, test_f1: 0.4668
 epoch: 23, train_loss: 1.0085, test_loss: 0.9793, test_f1: 0.4548
 epoch: 24, train_loss: 1.0019, test_loss: 0.9588, test_f1: 0.4538
 epoch: 25, train_loss: 1.0008, test_loss: 0.9558, test_f1: 0.4617
 epoch: 26, train_loss: 0.9964, test_loss: 0.9645, test_f1: 0.4614
 epoch: 27, train_loss: 1.0006, test_loss: 0.9630, test_f1: 0.4544
 epoch: 28, train_loss: 0.9975, test_loss: 0.9403, test_f1: 0.4683
 epoch: 29, train_loss: 0.9840, test_loss: 0.9491, test_f1: 0.4651
 epoch: 30, train_loss: 0.9859, test_loss: 0.9530, test_f1: 0.4596
 epoch: 31, train_loss: 0.9891, test_loss: 0.9481, test_f1: 0.4700
 epoch: 32, train_loss: 0.9847, test_loss: 0.9436, test_f1: 0.4622
 epoch: 33, train_loss: 0.9826, test_loss: 0.9354, test_f1: 0.4755
 epoch: 34, train_loss: 0.9829, test_loss: 0.9336, test_f1: 0.4713
 epoch: 35, train_loss: 0.9740, test_loss: 0.9414, test_f1: 0.4689
 epoch: 36, train_loss: 0.9743, test_loss: 0.9304, test_f1: 0.4786
 epoch: 37, train_loss: 0.9619, test_loss: 0.9372, test_f1: 0.4643
 epoch: 38, train_loss: 0.9611, test_loss: 0.9308, test_f1: 0.4773
 epoch: 39, train_loss: 0.9650, test_loss: 0.9244, test_f1: 0.4838
 epoch: 40, train_loss: 0.9588, test_loss: 0.9281, test_f1: 0.4800
 epoch: 41, train_loss: 0.9659, test_loss: 0.9369, test_f1: 0.4780
 epoch: 42, train_loss: 0.9629, test_loss: 0.9270, test_f1: 0.4743
 epoch: 43, train_loss: 0.9600, test_loss: 0.9205, test_f1: 0.4817
 epoch: 44, train_loss: 0.9617, test_loss: 0.9381, test_f1: 0.4739
 epoch: 45, train_loss: 0.9499, test_loss: 0.9226, test_f1: 0.4800
 epoch: 46, train_loss: 0.9512, test_loss: 0.9237, test_f1: 0.4788
 epoch: 47, train_loss: 0.9498, test_loss: 0.9172, test_f1: 0.4841
 epoch: 48, train_loss: 0.9570, test_loss: 0.9038, test_f1: 0.4951
 epoch: 49, train_loss: 0.9570, test_loss: 0.8977, test_f1: 0.4940
 epoch: 50, train_loss: 0.9407, test_loss: 0.9191, test_f1: 0.4811
 epoch: 51, train_loss: 0.9429, test_loss: 0.9158, test_f1: 0.4885
 epoch: 52, train_loss: 0.9500, test_loss: 0.8986, test_f1: 0.4965
 epoch: 53, train_loss: 0.9458, test_loss: 0.9108, test_f1: 0.4916
 epoch: 54, train_loss: 0.9409, test_loss: 0.9078, test_f1: 0.4908
 epoch: 55, train_loss: 0.9415, test_loss: 0.9020, test_f1: 0.4955
 epoch: 56, train_loss: 0.9516, test_loss: 0.9080, test_f1: 0.4864
 epoch: 57, train_loss: 0.9316, test_loss: 0.9005, test_f1: 0.4967
 epoch: 58, train_loss: 0.9423, test_loss: 0.9015, test_f1: 0.5016
 epoch: 59, train_loss: 0.9422, test_loss: 0.9003, test_f1: 0.4950
 epoch: 60, train_loss: 0.9383, test_loss: 0.9017, test_f1: 0.4957
 epoch: 61, train_loss: 0.9388, test_loss: 0.8996, test_f1: 0.5020
 epoch: 62, train_loss: 0.9307, test_loss: 0.8986, test_f1: 0.4995
 epoch: 63, train_loss: 0.9364, test_loss: 0.8915, test_f1: 0.5013
 epoch: 64, train_loss: 0.9362, test_loss: 0.9101, test_f1: 0.4870
 epoch: 65, train_loss: 0.9336, test_loss: 0.9150, test_f1: 0.4867
 epoch: 66, train_loss: 0.9361, test_loss: 0.8933, test_f1: 0.5092
 epoch: 67, train_loss: 0.9384, test_loss: 0.9037, test_f1: 0.4947
 epoch: 68, train_loss: 0.9362, test_loss: 0.8987, test_f1: 0.4874
 epoch: 69, train_loss: 0.9337, test_loss: 0.8894, test_f1: 0.5124
 epoch: 70, train_loss: 0.9244, test_loss: 0.8991, test_f1: 0.4887
 epoch: 71, train_loss: 0.9313, test_loss: 0.9012, test_f1: 0.4889
 epoch: 72, train_loss: 0.9314, test_loss: 0.9036, test_f1: 0.4892
 epoch: 73, train_loss: 0.9292, test_loss: 0.9007, test_f1: 0.4901
 epoch: 74, train_loss: 0.9191, test_loss: 0.9075, test_f1: 0.4926
 epoch: 75, train_loss: 0.9353, test_loss: 0.9063, test_f1: 0.4825
 epoch: 76, train_loss: 0.9327, test_loss: 0.9225, test_f1: 0.4930
 epoch: 77, train_loss: 0.9267, test_loss: 0.8852, test_f1: 0.5211
 epoch: 78, train_loss: 0.9410, test_loss: 0.8980, test_f1: 0.4947
 epoch: 79, train_loss: 0.9428, test_loss: 0.9073, test_f1: 0.4966
 epoch: 80, train_loss: 0.9306, test_loss: 0.9128, test_f1: 0.4944
 epoch: 81, train_loss: 0.9261, test_loss: 0.9040, test_f1: 0.4904
 epoch: 82, train_loss: 0.9218, test_loss: 0.8974, test_f1: 0.4946
 epoch: 83, train_loss: 0.9191, test_loss: 0.9124, test_f1: 0.4937
 epoch: 84, train_loss: 0.9268, test_loss: 0.8963, test_f1: 0.5009
 epoch: 85, train_loss: 0.9306, test_loss: 0.8915, test_f1: 0.4988
 epoch: 86, train_loss: 0.9295, test_loss: 0.8994, test_f1: 0.5099
 epoch: 87, train_loss: 0.9167, test_loss: 0.9024, test_f1: 0.5030
 epoch: 88, train_loss: 0.9202, test_loss: 0.8909, test_f1: 0.5155
 epoch: 89, train_loss: 0.9173, test_loss: 0.8864, test_f1: 0.5326
 epoch: 90, train_loss: 0.9173, test_loss: 0.9211, test_f1: 0.4909
 epoch: 91, train_loss: 0.9168, test_loss: 0.8929, test_f1: 0.4954
 epoch: 92, train_loss: 0.9126, test_loss: 0.8868, test_f1: 0.5212
 epoch: 93, train_loss: 0.9060, test_loss: 0.8997, test_f1: 0.4941
 epoch: 94, train_loss: 0.9208, test_loss: 0.8890, test_f1: 0.4978
 epoch: 95, train_loss: 0.9197, test_loss: 0.8925, test_f1: 0.4958
 epoch: 96, train_loss: 0.9106, test_loss: 0.8909, test_f1: 0.5147
 epoch: 97, train_loss: 0.9210, test_loss: 0.8839, test_f1: 0.5088
 epoch: 98, train_loss: 0.9176, test_loss: 0.8995, test_f1: 0.4968
 epoch: 99, train_loss: 0.9059, test_loss: 0.8866, test_f1: 0.5026
##################ITERATION #7 ****************************************
 epoch: 0, train_loss: 1.3488, test_loss: 1.2515, test_f1: 0.2651
 epoch: 1, train_loss: 1.2315, test_loss: 1.1781, test_f1: 0.3073
 epoch: 2, train_loss: 1.1988, test_loss: 1.1369, test_f1: 0.3297
 epoch: 3, train_loss: 1.1680, test_loss: 1.1157, test_f1: 0.3568
 epoch: 4, train_loss: 1.1437, test_loss: 1.0977, test_f1: 0.3499
 epoch: 5, train_loss: 1.1207, test_loss: 1.0832, test_f1: 0.3515
 epoch: 6, train_loss: 1.1069, test_loss: 1.0805, test_f1: 0.3558
 epoch: 7, train_loss: 1.0922, test_loss: 1.0707, test_f1: 0.3602
 epoch: 8, train_loss: 1.0830, test_loss: 1.0612, test_f1: 0.3684
 epoch: 9, train_loss: 1.0735, test_loss: 1.0554, test_f1: 0.3678
 epoch: 10, train_loss: 1.0625, test_loss: 1.0458, test_f1: 0.3852
 epoch: 11, train_loss: 1.0579, test_loss: 1.0389, test_f1: 0.4049
 epoch: 12, train_loss: 1.0505, test_loss: 1.0314, test_f1: 0.4266
 epoch: 13, train_loss: 1.0431, test_loss: 1.0294, test_f1: 0.4105
 epoch: 14, train_loss: 1.0386, test_loss: 1.0200, test_f1: 0.4646
 epoch: 15, train_loss: 1.0332, test_loss: 1.0266, test_f1: 0.4293
 epoch: 16, train_loss: 1.0309, test_loss: 1.0165, test_f1: 0.4686
 epoch: 17, train_loss: 1.0217, test_loss: 1.0090, test_f1: 0.4608
 epoch: 18, train_loss: 1.0109, test_loss: 1.0069, test_f1: 0.4905
 epoch: 19, train_loss: 1.0080, test_loss: 1.0040, test_f1: 0.4817
 epoch: 20, train_loss: 1.0148, test_loss: 1.0028, test_f1: 0.5022
 epoch: 21, train_loss: 1.0026, test_loss: 0.9989, test_f1: 0.4937
 epoch: 22, train_loss: 0.9956, test_loss: 0.9991, test_f1: 0.4763
 epoch: 23, train_loss: 0.9989, test_loss: 0.9915, test_f1: 0.4884
 epoch: 24, train_loss: 0.9935, test_loss: 0.9953, test_f1: 0.4960
 epoch: 25, train_loss: 0.9901, test_loss: 0.9847, test_f1: 0.4901
 epoch: 26, train_loss: 0.9849, test_loss: 0.9819, test_f1: 0.5027
 epoch: 27, train_loss: 0.9830, test_loss: 0.9716, test_f1: 0.4937
 epoch: 28, train_loss: 0.9780, test_loss: 0.9737, test_f1: 0.5078
 epoch: 29, train_loss: 0.9781, test_loss: 0.9815, test_f1: 0.4965
 epoch: 30, train_loss: 0.9715, test_loss: 0.9775, test_f1: 0.5044
 epoch: 31, train_loss: 0.9694, test_loss: 0.9660, test_f1: 0.5086
 epoch: 32, train_loss: 0.9691, test_loss: 0.9603, test_f1: 0.4948
 epoch: 33, train_loss: 0.9676, test_loss: 0.9581, test_f1: 0.5007
 epoch: 34, train_loss: 0.9731, test_loss: 0.9610, test_f1: 0.4819
 epoch: 35, train_loss: 0.9670, test_loss: 0.9696, test_f1: 0.4924
 epoch: 36, train_loss: 0.9693, test_loss: 0.9570, test_f1: 0.5092
 epoch: 37, train_loss: 0.9657, test_loss: 0.9597, test_f1: 0.5072
 epoch: 38, train_loss: 0.9601, test_loss: 0.9589, test_f1: 0.5103
 epoch: 39, train_loss: 0.9657, test_loss: 0.9434, test_f1: 0.4973
 epoch: 40, train_loss: 0.9599, test_loss: 0.9411, test_f1: 0.4986
 epoch: 41, train_loss: 0.9602, test_loss: 0.9327, test_f1: 0.5005
 epoch: 42, train_loss: 0.9547, test_loss: 0.9258, test_f1: 0.5055
 epoch: 43, train_loss: 0.9555, test_loss: 0.9232, test_f1: 0.5127
 epoch: 44, train_loss: 0.9503, test_loss: 0.9215, test_f1: 0.5073
 epoch: 45, train_loss: 0.9482, test_loss: 0.9213, test_f1: 0.5101
 epoch: 46, train_loss: 0.9476, test_loss: 0.9159, test_f1: 0.5031
 epoch: 47, train_loss: 0.9492, test_loss: 0.9160, test_f1: 0.5064
 epoch: 48, train_loss: 0.9444, test_loss: 0.9317, test_f1: 0.4972
 epoch: 49, train_loss: 0.9345, test_loss: 0.9198, test_f1: 0.5060
 epoch: 50, train_loss: 0.9412, test_loss: 0.9209, test_f1: 0.5090
 epoch: 51, train_loss: 0.9460, test_loss: 0.9213, test_f1: 0.5063
 epoch: 52, train_loss: 0.9333, test_loss: 0.9170, test_f1: 0.5023
 epoch: 53, train_loss: 0.9308, test_loss: 0.9208, test_f1: 0.5235
 epoch: 54, train_loss: 0.9396, test_loss: 0.9135, test_f1: 0.5048
 epoch: 55, train_loss: 0.9369, test_loss: 0.9065, test_f1: 0.5112
 epoch: 56, train_loss: 0.9332, test_loss: 0.9131, test_f1: 0.4967
 epoch: 57, train_loss: 0.9292, test_loss: 0.9064, test_f1: 0.5036
 epoch: 58, train_loss: 0.9301, test_loss: 0.9051, test_f1: 0.5154
 epoch: 59, train_loss: 0.9288, test_loss: 0.9123, test_f1: 0.5113
 epoch: 60, train_loss: 0.9432, test_loss: 0.9033, test_f1: 0.5161
 epoch: 61, train_loss: 0.9328, test_loss: 0.8952, test_f1: 0.5238
 epoch: 62, train_loss: 0.9254, test_loss: 0.9002, test_f1: 0.5039
 epoch: 63, train_loss: 0.9282, test_loss: 0.8929, test_f1: 0.5340
 epoch: 64, train_loss: 0.9290, test_loss: 0.8885, test_f1: 0.5340
 epoch: 65, train_loss: 0.9242, test_loss: 0.8902, test_f1: 0.5257
 epoch: 66, train_loss: 0.9167, test_loss: 0.8971, test_f1: 0.5142
 epoch: 67, train_loss: 0.9317, test_loss: 0.8961, test_f1: 0.5216
 epoch: 68, train_loss: 0.9240, test_loss: 0.8947, test_f1: 0.5172
 epoch: 69, train_loss: 0.9279, test_loss: 0.8902, test_f1: 0.5280
 epoch: 70, train_loss: 0.9293, test_loss: 0.9176, test_f1: 0.5140
 epoch: 71, train_loss: 0.9227, test_loss: 0.9104, test_f1: 0.5197
 epoch: 72, train_loss: 0.9222, test_loss: 0.8958, test_f1: 0.5114
 epoch: 73, train_loss: 0.9140, test_loss: 0.8867, test_f1: 0.5215
 epoch: 74, train_loss: 0.9188, test_loss: 0.8886, test_f1: 0.5163
 epoch: 75, train_loss: 0.9235, test_loss: 0.8831, test_f1: 0.5187
 epoch: 76, train_loss: 0.9109, test_loss: 0.8994, test_f1: 0.5228
 epoch: 77, train_loss: 0.9184, test_loss: 0.8811, test_f1: 0.5286
 epoch: 78, train_loss: 0.9112, test_loss: 0.8892, test_f1: 0.5205
 epoch: 79, train_loss: 0.9174, test_loss: 0.8777, test_f1: 0.5325
 epoch: 80, train_loss: 0.9073, test_loss: 0.8808, test_f1: 0.5273
 epoch: 81, train_loss: 0.9168, test_loss: 0.8813, test_f1: 0.5250
 epoch: 82, train_loss: 0.9068, test_loss: 0.8678, test_f1: 0.5355
 epoch: 83, train_loss: 0.9128, test_loss: 0.8888, test_f1: 0.5082
 epoch: 84, train_loss: 0.9121, test_loss: 0.8760, test_f1: 0.5212
 epoch: 85, train_loss: 0.9094, test_loss: 0.8799, test_f1: 0.5213
 epoch: 86, train_loss: 0.9126, test_loss: 0.8728, test_f1: 0.5159
 epoch: 87, train_loss: 0.9099, test_loss: 0.8725, test_f1: 0.5167
 epoch: 88, train_loss: 0.9173, test_loss: 0.8773, test_f1: 0.5085
 epoch: 89, train_loss: 0.9066, test_loss: 0.8758, test_f1: 0.5147
 epoch: 90, train_loss: 0.9006, test_loss: 0.8674, test_f1: 0.5092
 epoch: 91, train_loss: 0.8963, test_loss: 0.8858, test_f1: 0.5101
 epoch: 92, train_loss: 0.9091, test_loss: 0.8753, test_f1: 0.5191
 epoch: 93, train_loss: 0.9124, test_loss: 0.8586, test_f1: 0.5359
 epoch: 94, train_loss: 0.8929, test_loss: 0.8768, test_f1: 0.5274
 epoch: 95, train_loss: 0.9101, test_loss: 0.8734, test_f1: 0.5280
 epoch: 96, train_loss: 0.8983, test_loss: 0.8677, test_f1: 0.5347
 epoch: 97, train_loss: 0.9036, test_loss: 0.8708, test_f1: 0.5223
 epoch: 98, train_loss: 0.9047, test_loss: 0.8660, test_f1: 0.5120
 epoch: 99, train_loss: 0.9045, test_loss: 0.8640, test_f1: 0.5319
##################ITERATION #8 ****************************************
 epoch: 0, train_loss: 1.3450, test_loss: 1.2238, test_f1: 0.2851
 epoch: 1, train_loss: 1.2343, test_loss: 1.1825, test_f1: 0.3085
 epoch: 2, train_loss: 1.2168, test_loss: 1.1518, test_f1: 0.3244
 epoch: 3, train_loss: 1.1831, test_loss: 1.1295, test_f1: 0.3266
 epoch: 4, train_loss: 1.1683, test_loss: 1.1078, test_f1: 0.3354
 epoch: 5, train_loss: 1.1489, test_loss: 1.0966, test_f1: 0.3453
 epoch: 6, train_loss: 1.1306, test_loss: 1.0814, test_f1: 0.3431
 epoch: 7, train_loss: 1.1305, test_loss: 1.0617, test_f1: 0.3516
 epoch: 8, train_loss: 1.1176, test_loss: 1.0638, test_f1: 0.3636
 epoch: 9, train_loss: 1.1040, test_loss: 1.0553, test_f1: 0.3703
 epoch: 10, train_loss: 1.0896, test_loss: 1.0485, test_f1: 0.3694
 epoch: 11, train_loss: 1.0922, test_loss: 1.0439, test_f1: 0.3810
 epoch: 12, train_loss: 1.0750, test_loss: 1.0382, test_f1: 0.3939
 epoch: 13, train_loss: 1.0726, test_loss: 1.0230, test_f1: 0.4008
 epoch: 14, train_loss: 1.0662, test_loss: 1.0436, test_f1: 0.4161
 epoch: 15, train_loss: 1.0634, test_loss: 1.0209, test_f1: 0.4100
 epoch: 16, train_loss: 1.0541, test_loss: 1.0125, test_f1: 0.4323
 epoch: 17, train_loss: 1.0449, test_loss: 1.0076, test_f1: 0.4610
 epoch: 18, train_loss: 1.0416, test_loss: 1.0064, test_f1: 0.4470
 epoch: 19, train_loss: 1.0344, test_loss: 1.0164, test_f1: 0.4493
 epoch: 20, train_loss: 1.0320, test_loss: 0.9997, test_f1: 0.4417
 epoch: 21, train_loss: 1.0323, test_loss: 1.0188, test_f1: 0.4419
 epoch: 22, train_loss: 1.0184, test_loss: 1.0086, test_f1: 0.4514
 epoch: 23, train_loss: 1.0234, test_loss: 1.0071, test_f1: 0.4632
 epoch: 24, train_loss: 1.0122, test_loss: 0.9937, test_f1: 0.4730
 epoch: 25, train_loss: 1.0109, test_loss: 1.0010, test_f1: 0.4630
 epoch: 26, train_loss: 1.0028, test_loss: 1.0257, test_f1: 0.4663
 epoch: 27, train_loss: 1.0044, test_loss: 0.9987, test_f1: 0.4652
 epoch: 28, train_loss: 1.0033, test_loss: 0.9804, test_f1: 0.4720
 epoch: 29, train_loss: 1.0033, test_loss: 0.9797, test_f1: 0.4754
 epoch: 30, train_loss: 0.9948, test_loss: 0.9973, test_f1: 0.4585
 epoch: 31, train_loss: 0.9932, test_loss: 0.9776, test_f1: 0.4730
 epoch: 32, train_loss: 0.9877, test_loss: 0.9857, test_f1: 0.4773
 epoch: 33, train_loss: 1.0010, test_loss: 0.9895, test_f1: 0.4691
 epoch: 34, train_loss: 0.9857, test_loss: 0.9928, test_f1: 0.4792
 epoch: 35, train_loss: 0.9861, test_loss: 0.9911, test_f1: 0.4658
 epoch: 36, train_loss: 0.9912, test_loss: 0.9757, test_f1: 0.4775
 epoch: 37, train_loss: 0.9852, test_loss: 0.9676, test_f1: 0.4813
 epoch: 38, train_loss: 0.9778, test_loss: 0.9718, test_f1: 0.4831
 epoch: 39, train_loss: 0.9789, test_loss: 0.9606, test_f1: 0.4849
 epoch: 40, train_loss: 0.9711, test_loss: 0.9572, test_f1: 0.4852
 epoch: 41, train_loss: 0.9743, test_loss: 0.9531, test_f1: 0.4875
 epoch: 42, train_loss: 0.9681, test_loss: 0.9521, test_f1: 0.4917
 epoch: 43, train_loss: 0.9708, test_loss: 0.9594, test_f1: 0.4927
 epoch: 44, train_loss: 0.9651, test_loss: 0.9591, test_f1: 0.4941
 epoch: 45, train_loss: 0.9758, test_loss: 0.9477, test_f1: 0.4901
 epoch: 46, train_loss: 0.9728, test_loss: 0.9536, test_f1: 0.4844
 epoch: 47, train_loss: 0.9573, test_loss: 0.9533, test_f1: 0.4860
 epoch: 48, train_loss: 0.9565, test_loss: 0.9433, test_f1: 0.4889
 epoch: 49, train_loss: 0.9607, test_loss: 0.9401, test_f1: 0.4950
 epoch: 50, train_loss: 0.9617, test_loss: 0.9382, test_f1: 0.5030
 epoch: 51, train_loss: 0.9547, test_loss: 0.9378, test_f1: 0.5029
 epoch: 52, train_loss: 0.9574, test_loss: 0.9446, test_f1: 0.4955
 epoch: 53, train_loss: 0.9569, test_loss: 0.9462, test_f1: 0.4918
 epoch: 54, train_loss: 0.9605, test_loss: 0.9331, test_f1: 0.5066
 epoch: 55, train_loss: 0.9603, test_loss: 0.9380, test_f1: 0.5041
 epoch: 56, train_loss: 0.9558, test_loss: 0.9446, test_f1: 0.4932
 epoch: 57, train_loss: 0.9509, test_loss: 0.9444, test_f1: 0.5021
 epoch: 58, train_loss: 0.9439, test_loss: 0.9342, test_f1: 0.4987
 epoch: 59, train_loss: 0.9507, test_loss: 0.9401, test_f1: 0.4939
 epoch: 60, train_loss: 0.9431, test_loss: 0.9317, test_f1: 0.5164
 epoch: 61, train_loss: 0.9516, test_loss: 0.9333, test_f1: 0.5000
 epoch: 62, train_loss: 0.9518, test_loss: 0.9362, test_f1: 0.4953
 epoch: 63, train_loss: 0.9476, test_loss: 0.9344, test_f1: 0.4968
 epoch: 64, train_loss: 0.9508, test_loss: 0.9386, test_f1: 0.5009
 epoch: 65, train_loss: 0.9473, test_loss: 0.9387, test_f1: 0.5048
 epoch: 66, train_loss: 0.9461, test_loss: 0.9339, test_f1: 0.4964
 epoch: 67, train_loss: 0.9482, test_loss: 0.9420, test_f1: 0.4995
 epoch: 68, train_loss: 0.9581, test_loss: 0.9232, test_f1: 0.5049
 epoch: 69, train_loss: 0.9456, test_loss: 0.9283, test_f1: 0.5051
 epoch: 70, train_loss: 0.9423, test_loss: 0.9286, test_f1: 0.4990
 epoch: 71, train_loss: 0.9384, test_loss: 0.9276, test_f1: 0.5071
 epoch: 72, train_loss: 0.9467, test_loss: 0.9381, test_f1: 0.4967
 epoch: 73, train_loss: 0.9424, test_loss: 0.9333, test_f1: 0.4968
 epoch: 74, train_loss: 0.9388, test_loss: 0.9457, test_f1: 0.5018
 epoch: 75, train_loss: 0.9404, test_loss: 0.9236, test_f1: 0.5063
 epoch: 76, train_loss: 0.9438, test_loss: 0.9268, test_f1: 0.5043
 epoch: 77, train_loss: 0.9434, test_loss: 0.9335, test_f1: 0.5002
 epoch: 78, train_loss: 0.9393, test_loss: 0.9354, test_f1: 0.4944
 epoch: 79, train_loss: 0.9335, test_loss: 0.9265, test_f1: 0.4965
 epoch: 80, train_loss: 0.9466, test_loss: 0.9197, test_f1: 0.5091
 epoch: 81, train_loss: 0.9349, test_loss: 0.9284, test_f1: 0.5021
 epoch: 82, train_loss: 0.9375, test_loss: 0.9215, test_f1: 0.5008
 epoch: 83, train_loss: 0.9350, test_loss: 0.9274, test_f1: 0.5021
 epoch: 84, train_loss: 0.9406, test_loss: 0.9179, test_f1: 0.4966
 epoch: 85, train_loss: 0.9347, test_loss: 0.9219, test_f1: 0.5026
 epoch: 86, train_loss: 0.9357, test_loss: 0.9245, test_f1: 0.4944
 epoch: 87, train_loss: 0.9351, test_loss: 0.9199, test_f1: 0.5033
 epoch: 88, train_loss: 0.9364, test_loss: 0.9288, test_f1: 0.5042
 epoch: 89, train_loss: 0.9331, test_loss: 0.9260, test_f1: 0.5052
 epoch: 90, train_loss: 0.9297, test_loss: 0.9271, test_f1: 0.5049
 epoch: 91, train_loss: 0.9326, test_loss: 0.9095, test_f1: 0.5130
 epoch: 92, train_loss: 0.9333, test_loss: 0.9172, test_f1: 0.5060
 epoch: 93, train_loss: 0.9417, test_loss: 0.9224, test_f1: 0.5029
 epoch: 94, train_loss: 0.9247, test_loss: 0.9174, test_f1: 0.5044
 epoch: 95, train_loss: 0.9276, test_loss: 0.9176, test_f1: 0.4994
 epoch: 96, train_loss: 0.9286, test_loss: 0.9136, test_f1: 0.5108
 epoch: 97, train_loss: 0.9319, test_loss: 0.9163, test_f1: 0.5079
 epoch: 98, train_loss: 0.9292, test_loss: 0.9163, test_f1: 0.5229
 epoch: 99, train_loss: 0.9270, test_loss: 0.9156, test_f1: 0.5098
##################ITERATION #9 ****************************************
 epoch: 0, train_loss: 1.3258, test_loss: 1.1697, test_f1: 0.3024
 epoch: 1, train_loss: 1.2177, test_loss: 1.1287, test_f1: 0.3565
 epoch: 2, train_loss: 1.1884, test_loss: 1.1113, test_f1: 0.3881
 epoch: 3, train_loss: 1.1509, test_loss: 1.0808, test_f1: 0.4154
 epoch: 4, train_loss: 1.1418, test_loss: 1.0725, test_f1: 0.4358
 epoch: 5, train_loss: 1.1312, test_loss: 1.0556, test_f1: 0.4239
 epoch: 6, train_loss: 1.1133, test_loss: 1.0393, test_f1: 0.4274
 epoch: 7, train_loss: 1.0990, test_loss: 1.0318, test_f1: 0.4430
 epoch: 8, train_loss: 1.0997, test_loss: 1.0238, test_f1: 0.4371
 epoch: 9, train_loss: 1.0867, test_loss: 1.0234, test_f1: 0.4325
 epoch: 10, train_loss: 1.0799, test_loss: 1.0072, test_f1: 0.4495
 epoch: 11, train_loss: 1.0682, test_loss: 1.0070, test_f1: 0.4346
 epoch: 12, train_loss: 1.0592, test_loss: 1.0022, test_f1: 0.4364
 epoch: 13, train_loss: 1.0563, test_loss: 0.9995, test_f1: 0.4450
 epoch: 14, train_loss: 1.0401, test_loss: 0.9940, test_f1: 0.4500
 epoch: 15, train_loss: 1.0440, test_loss: 0.9949, test_f1: 0.4436
 epoch: 16, train_loss: 1.0381, test_loss: 0.9867, test_f1: 0.4501
 epoch: 17, train_loss: 1.0413, test_loss: 0.9803, test_f1: 0.4475
 epoch: 18, train_loss: 1.0399, test_loss: 0.9849, test_f1: 0.4603
 epoch: 19, train_loss: 1.0311, test_loss: 0.9782, test_f1: 0.4658
 epoch: 20, train_loss: 1.0217, test_loss: 0.9773, test_f1: 0.4614
 epoch: 21, train_loss: 1.0232, test_loss: 0.9795, test_f1: 0.4555
 epoch: 22, train_loss: 1.0186, test_loss: 0.9722, test_f1: 0.4652
 epoch: 23, train_loss: 1.0124, test_loss: 0.9687, test_f1: 0.4676
 epoch: 24, train_loss: 1.0054, test_loss: 0.9670, test_f1: 0.4651
 epoch: 25, train_loss: 1.0144, test_loss: 0.9659, test_f1: 0.4792
 epoch: 26, train_loss: 0.9965, test_loss: 0.9637, test_f1: 0.4749
 epoch: 27, train_loss: 0.9976, test_loss: 0.9639, test_f1: 0.4861
 epoch: 28, train_loss: 1.0007, test_loss: 0.9592, test_f1: 0.4610
 epoch: 29, train_loss: 0.9851, test_loss: 0.9571, test_f1: 0.4695
 epoch: 30, train_loss: 0.9857, test_loss: 0.9579, test_f1: 0.4796
 epoch: 31, train_loss: 0.9978, test_loss: 0.9535, test_f1: 0.4900
 epoch: 32, train_loss: 0.9855, test_loss: 0.9506, test_f1: 0.4766
 epoch: 33, train_loss: 0.9824, test_loss: 0.9523, test_f1: 0.4830
 epoch: 34, train_loss: 0.9775, test_loss: 0.9455, test_f1: 0.4871
 epoch: 35, train_loss: 0.9812, test_loss: 0.9466, test_f1: 0.4989
 epoch: 36, train_loss: 0.9825, test_loss: 0.9547, test_f1: 0.4868
 epoch: 37, train_loss: 0.9698, test_loss: 0.9581, test_f1: 0.4767
 epoch: 38, train_loss: 0.9731, test_loss: 0.9509, test_f1: 0.4850
 epoch: 39, train_loss: 0.9709, test_loss: 0.9458, test_f1: 0.5009
 epoch: 40, train_loss: 0.9839, test_loss: 0.9476, test_f1: 0.4992
 epoch: 41, train_loss: 0.9733, test_loss: 0.9477, test_f1: 0.4951
 epoch: 42, train_loss: 0.9674, test_loss: 0.9554, test_f1: 0.4945
 epoch: 43, train_loss: 0.9653, test_loss: 0.9406, test_f1: 0.4950
 epoch: 44, train_loss: 0.9719, test_loss: 0.9457, test_f1: 0.4939
 epoch: 45, train_loss: 0.9648, test_loss: 0.9530, test_f1: 0.5032
 epoch: 46, train_loss: 0.9606, test_loss: 0.9549, test_f1: 0.4959
 epoch: 47, train_loss: 0.9662, test_loss: 0.9468, test_f1: 0.5034
 epoch: 48, train_loss: 0.9584, test_loss: 0.9500, test_f1: 0.5073
 epoch: 49, train_loss: 0.9632, test_loss: 0.9521, test_f1: 0.5017
 epoch: 50, train_loss: 0.9587, test_loss: 0.9416, test_f1: 0.4867
 epoch: 51, train_loss: 0.9549, test_loss: 0.9337, test_f1: 0.5084
 epoch: 52, train_loss: 0.9584, test_loss: 0.9424, test_f1: 0.5023
 epoch: 53, train_loss: 0.9510, test_loss: 0.9458, test_f1: 0.5073
 epoch: 54, train_loss: 0.9490, test_loss: 0.9428, test_f1: 0.4953
 epoch: 55, train_loss: 0.9569, test_loss: 0.9450, test_f1: 0.5090
 epoch: 56, train_loss: 0.9548, test_loss: 0.9507, test_f1: 0.5040
 epoch: 57, train_loss: 0.9461, test_loss: 0.9436, test_f1: 0.5017
 epoch: 58, train_loss: 0.9592, test_loss: 0.9413, test_f1: 0.5032
 epoch: 59, train_loss: 0.9542, test_loss: 0.9464, test_f1: 0.5168
 epoch: 60, train_loss: 0.9510, test_loss: 0.9403, test_f1: 0.5119
 epoch: 61, train_loss: 0.9495, test_loss: 0.9522, test_f1: 0.5132
 epoch: 62, train_loss: 0.9464, test_loss: 0.9339, test_f1: 0.5132
 epoch: 63, train_loss: 0.9563, test_loss: 0.9356, test_f1: 0.5237
 epoch: 64, train_loss: 0.9513, test_loss: 0.9329, test_f1: 0.5163
 epoch: 65, train_loss: 0.9396, test_loss: 0.9322, test_f1: 0.5084
 epoch: 66, train_loss: 0.9343, test_loss: 0.9333, test_f1: 0.5335
 epoch: 67, train_loss: 0.9336, test_loss: 0.9416, test_f1: 0.5072
 epoch: 68, train_loss: 0.9437, test_loss: 0.9376, test_f1: 0.5255
 epoch: 69, train_loss: 0.9436, test_loss: 0.9473, test_f1: 0.5119
 epoch: 70, train_loss: 0.9512, test_loss: 0.9330, test_f1: 0.5084
 epoch: 71, train_loss: 0.9556, test_loss: 0.9342, test_f1: 0.5219
 epoch: 72, train_loss: 0.9547, test_loss: 0.9381, test_f1: 0.5143
 epoch: 73, train_loss: 0.9339, test_loss: 0.9269, test_f1: 0.5144
 epoch: 74, train_loss: 0.9386, test_loss: 0.9344, test_f1: 0.5123
 epoch: 75, train_loss: 0.9444, test_loss: 0.9316, test_f1: 0.5163
 epoch: 76, train_loss: 0.9410, test_loss: 0.9304, test_f1: 0.5215
 epoch: 77, train_loss: 0.9383, test_loss: 0.9350, test_f1: 0.5215
 epoch: 78, train_loss: 0.9405, test_loss: 0.9227, test_f1: 0.5135
 epoch: 79, train_loss: 0.9376, test_loss: 0.9403, test_f1: 0.5352
 epoch: 80, train_loss: 0.9389, test_loss: 0.9205, test_f1: 0.5228
 epoch: 81, train_loss: 0.9457, test_loss: 0.9292, test_f1: 0.5212
 epoch: 82, train_loss: 0.9363, test_loss: 0.9210, test_f1: 0.5259
 epoch: 83, train_loss: 0.9315, test_loss: 0.9265, test_f1: 0.5144
 epoch: 84, train_loss: 0.9383, test_loss: 0.9201, test_f1: 0.5261
 epoch: 85, train_loss: 0.9289, test_loss: 0.9317, test_f1: 0.5367
 epoch: 86, train_loss: 0.9386, test_loss: 0.9214, test_f1: 0.5276
 epoch: 87, train_loss: 0.9340, test_loss: 0.9275, test_f1: 0.5223
 epoch: 88, train_loss: 0.9455, test_loss: 0.9222, test_f1: 0.5082
 epoch: 89, train_loss: 0.9358, test_loss: 0.9295, test_f1: 0.5203
 epoch: 90, train_loss: 0.9277, test_loss: 0.9221, test_f1: 0.5132
 epoch: 91, train_loss: 0.9292, test_loss: 0.9331, test_f1: 0.5169
 epoch: 92, train_loss: 0.9386, test_loss: 0.9153, test_f1: 0.5108
 epoch: 93, train_loss: 0.9329, test_loss: 0.9240, test_f1: 0.5111
 epoch: 94, train_loss: 0.9278, test_loss: 0.9168, test_f1: 0.5166
 epoch: 95, train_loss: 0.9272, test_loss: 0.9243, test_f1: 0.5110
 epoch: 96, train_loss: 0.9296, test_loss: 0.9283, test_f1: 0.5112
 epoch: 97, train_loss: 0.9265, test_loss: 0.9235, test_f1: 0.5288
 epoch: 98, train_loss: 0.9336, test_loss: 0.9319, test_f1: 0.5145
 epoch: 99, train_loss: 0.9378, test_loss: 0.9419, test_f1: 0.5102

Training completed in 1416.80 seconds
Best F1: 0.5367 at epoch 85
Mean F1 across iterations: 0.5192  0.0215
========================FINAL RESULTS================================
FEGIN weighted F1: 0.5367  0.0215
python main.py --data ltspice_examples --representation component_pin_net --model FEGIN --layers 6 --hiddens 16 --batch_size 32 --lr 0.0001 --emb_size 250 --epochs 100 --save_appendix component_pin_net_L6_H16_BS32_LR0.0001_E250 --no_val
-----



STDERR:
  File "main.py", line 370, in <module>
    main()
  File "main.py", line 254, in main
    dataset = dataset_class(
  File "/home/philip/projects/ltspice_examples_code_repo/Circuit-Completion-Using-GNNs/component_classification_with_link_prediction_head/evaluation/FEGIN/kernel/circuit_datasets.py", line 15, in __init__
    self.data, self.slices = torch.load(self.processed_paths[0])
  File "/home/philip/.local/lib/python3.8/site-packages/torch/serialization.py", line 1040, in load
    warnings.warn(
  File "/usr/lib/python3.8/warnings.py", line 109, in _showwarnmsg
    sw(msg.message, msg.category, msg.filename, msg.lineno,
  File "main.py", line 47, in warn_with_traceback
    traceback.print_stack(file=log)
/home/philip/projects/ltspice_examples_code_repo/Circuit-Completion-Using-GNNs/component_classification_with_link_prediction_head/evaluation/FEGIN/kernel/circuit_datasets.py:15: FutureWarning: You are using `torch.load` with `weights_only=False` (the current default value), which uses the default pickle module implicitly. It is possible to construct malicious pickle data which will execute arbitrary code during unpickling (See https://github.com/pytorch/pytorch/blob/main/SECURITY.md#untrusted-models for more details). In a future release, the default value for `weights_only` will be flipped to `True`. This limits the functions that could be executed during unpickling. Arbitrary objects will no longer be allowed to be loaded via this mode unless they are explicitly allowlisted by the user via `torch.serialization.add_safe_globals`. We recommend you start setting `weights_only=True` for any use case where you don't have full control of the loaded file. Please open an issue on GitHub for any issues related to this experimental feature.
  self.data, self.slices = torch.load(self.processed_paths[0])
