STDOUT:
Results will be saved in /home/philip/projects/ltspice_examples_code_repo/Circuit-Completion-Using-GNNs/component_classification_with_link_prediction_head/evaluation/FEGIN/results/model_FEGIN_dataset_ltspice_examples
Command line input: python main.py --data ltspice_examples --representation component_component --model FEGIN --layers 5 --hiddens 32 --batch_size 128 --lr 0.0001 --emb_size 512 --epochs 100 --save_appendix component_component_L5_H32_BS128_LR0.0001_E512 --no_val
 is saved.
-----
ltspice_examples - FEGIN
Using 5 layers, 32 hidden units, h = 2
Loading component_component representation dataset
ENTERED
Training FEGIN on component_component representation
Train: 3556, Test: 845
##################ITERATION #0 ****************************************
 epoch: 0, train_loss: 1.3589, test_loss: 1.3622, test_f1: 0.2274
 epoch: 1, train_loss: 1.3520, test_loss: 1.3572, test_f1: 0.2274
 epoch: 2, train_loss: 1.3468, test_loss: 1.3512, test_f1: 0.2274
 epoch: 3, train_loss: 1.3426, test_loss: 1.3463, test_f1: 0.2274
 epoch: 4, train_loss: 1.3387, test_loss: 1.3418, test_f1: 0.2274
 epoch: 5, train_loss: 1.3324, test_loss: 1.3375, test_f1: 0.2274
 epoch: 6, train_loss: 1.3276, test_loss: 1.3325, test_f1: 0.2274
 epoch: 7, train_loss: 1.3215, test_loss: 1.3278, test_f1: 0.2274
 epoch: 8, train_loss: 1.3159, test_loss: 1.3212, test_f1: 0.2274
 epoch: 9, train_loss: 1.3087, test_loss: 1.3163, test_f1: 0.2274
 epoch: 10, train_loss: 1.3039, test_loss: 1.3105, test_f1: 0.2274
 epoch: 11, train_loss: 1.2962, test_loss: 1.3039, test_f1: 0.2274
 epoch: 12, train_loss: 1.2911, test_loss: 1.2980, test_f1: 0.2274
 epoch: 13, train_loss: 1.2864, test_loss: 1.2907, test_f1: 0.2274
 epoch: 14, train_loss: 1.2787, test_loss: 1.2843, test_f1: 0.2274
 epoch: 15, train_loss: 1.2737, test_loss: 1.2791, test_f1: 0.2274
 epoch: 16, train_loss: 1.2682, test_loss: 1.2727, test_f1: 0.2274
 epoch: 17, train_loss: 1.2628, test_loss: 1.2659, test_f1: 0.2274
 epoch: 18, train_loss: 1.2626, test_loss: 1.2595, test_f1: 0.2274
 epoch: 19, train_loss: 1.2539, test_loss: 1.2541, test_f1: 0.2274
 epoch: 20, train_loss: 1.2512, test_loss: 1.2486, test_f1: 0.2274
 epoch: 21, train_loss: 1.2466, test_loss: 1.2428, test_f1: 0.2274
 epoch: 22, train_loss: 1.2405, test_loss: 1.2374, test_f1: 0.2274
 epoch: 23, train_loss: 1.2335, test_loss: 1.2320, test_f1: 0.2274
 epoch: 24, train_loss: 1.2336, test_loss: 1.2282, test_f1: 0.2274
 epoch: 25, train_loss: 1.2302, test_loss: 1.2232, test_f1: 0.2274
 epoch: 26, train_loss: 1.2227, test_loss: 1.2159, test_f1: 0.2274
 epoch: 27, train_loss: 1.2224, test_loss: 1.2118, test_f1: 0.2583
 epoch: 28, train_loss: 1.2180, test_loss: 1.2065, test_f1: 0.2792
 epoch: 29, train_loss: 1.2120, test_loss: 1.2047, test_f1: 0.3173
 epoch: 30, train_loss: 1.2085, test_loss: 1.1977, test_f1: 0.3162
 epoch: 31, train_loss: 1.2076, test_loss: 1.1934, test_f1: 0.3140
 epoch: 32, train_loss: 1.2033, test_loss: 1.1921, test_f1: 0.3203
 epoch: 33, train_loss: 1.2039, test_loss: 1.1895, test_f1: 0.3261
 epoch: 34, train_loss: 1.2021, test_loss: 1.1850, test_f1: 0.3298
 epoch: 35, train_loss: 1.1943, test_loss: 1.1798, test_f1: 0.3357
 epoch: 36, train_loss: 1.1868, test_loss: 1.1792, test_f1: 0.3272
 epoch: 37, train_loss: 1.1858, test_loss: 1.1773, test_f1: 0.3414
 epoch: 38, train_loss: 1.1825, test_loss: 1.1754, test_f1: 0.3393
 epoch: 39, train_loss: 1.1786, test_loss: 1.1721, test_f1: 0.3423
 epoch: 40, train_loss: 1.1729, test_loss: 1.1686, test_f1: 0.3401
 epoch: 41, train_loss: 1.1741, test_loss: 1.1656, test_f1: 0.3380
 epoch: 42, train_loss: 1.1656, test_loss: 1.1617, test_f1: 0.3368
 epoch: 43, train_loss: 1.1660, test_loss: 1.1617, test_f1: 0.3434
 epoch: 44, train_loss: 1.1563, test_loss: 1.1556, test_f1: 0.3405
 epoch: 45, train_loss: 1.1558, test_loss: 1.1560, test_f1: 0.3455
 epoch: 46, train_loss: 1.1532, test_loss: 1.1503, test_f1: 0.3464
 epoch: 47, train_loss: 1.1515, test_loss: 1.1458, test_f1: 0.3485
 epoch: 48, train_loss: 1.1379, test_loss: 1.1411, test_f1: 0.3515
 epoch: 49, train_loss: 1.1399, test_loss: 1.1389, test_f1: 0.3468
 epoch: 50, train_loss: 1.1243, test_loss: 1.1369, test_f1: 0.3527
 epoch: 51, train_loss: 1.1260, test_loss: 1.1348, test_f1: 0.3492
 epoch: 52, train_loss: 1.1258, test_loss: 1.1354, test_f1: 0.3511
 epoch: 53, train_loss: 1.1195, test_loss: 1.1315, test_f1: 0.3499
 epoch: 54, train_loss: 1.1212, test_loss: 1.1288, test_f1: 0.3474
 epoch: 55, train_loss: 1.1195, test_loss: 1.1282, test_f1: 0.3520
 epoch: 56, train_loss: 1.1150, test_loss: 1.1266, test_f1: 0.3448
 epoch: 57, train_loss: 1.1160, test_loss: 1.1266, test_f1: 0.3461
 epoch: 58, train_loss: 1.1081, test_loss: 1.1253, test_f1: 0.3470
 epoch: 59, train_loss: 1.1086, test_loss: 1.1224, test_f1: 0.3551
 epoch: 60, train_loss: 1.1080, test_loss: 1.1224, test_f1: 0.3665
 epoch: 61, train_loss: 1.1096, test_loss: 1.1219, test_f1: 0.3749
 epoch: 62, train_loss: 1.1067, test_loss: 1.1208, test_f1: 0.3768
 epoch: 63, train_loss: 1.1048, test_loss: 1.1222, test_f1: 0.3843
 epoch: 64, train_loss: 1.0999, test_loss: 1.1206, test_f1: 0.3860
 epoch: 65, train_loss: 1.1019, test_loss: 1.1228, test_f1: 0.3965
 epoch: 66, train_loss: 1.0962, test_loss: 1.1180, test_f1: 0.4006
 epoch: 67, train_loss: 1.0973, test_loss: 1.1159, test_f1: 0.4093
 epoch: 68, train_loss: 1.0901, test_loss: 1.1151, test_f1: 0.4051
 epoch: 69, train_loss: 1.0941, test_loss: 1.1159, test_f1: 0.4030
 epoch: 70, train_loss: 1.0922, test_loss: 1.1183, test_f1: 0.4132
 epoch: 71, train_loss: 1.0883, test_loss: 1.1137, test_f1: 0.4109
 epoch: 72, train_loss: 1.0884, test_loss: 1.1112, test_f1: 0.4186
 epoch: 73, train_loss: 1.0817, test_loss: 1.1150, test_f1: 0.4197
 epoch: 74, train_loss: 1.0857, test_loss: 1.1105, test_f1: 0.4069
 epoch: 75, train_loss: 1.0797, test_loss: 1.1110, test_f1: 0.4222
 epoch: 76, train_loss: 1.0889, test_loss: 1.1091, test_f1: 0.4204
 epoch: 77, train_loss: 1.0784, test_loss: 1.1133, test_f1: 0.4229
 epoch: 78, train_loss: 1.0838, test_loss: 1.1088, test_f1: 0.4231
 epoch: 79, train_loss: 1.0767, test_loss: 1.1119, test_f1: 0.4311
 epoch: 80, train_loss: 1.0799, test_loss: 1.1093, test_f1: 0.4314
 epoch: 81, train_loss: 1.0739, test_loss: 1.1054, test_f1: 0.4265
 epoch: 82, train_loss: 1.0668, test_loss: 1.1063, test_f1: 0.4247
 epoch: 83, train_loss: 1.0688, test_loss: 1.1098, test_f1: 0.4257
 epoch: 84, train_loss: 1.0653, test_loss: 1.1080, test_f1: 0.4320
 epoch: 85, train_loss: 1.0604, test_loss: 1.1050, test_f1: 0.4338
 epoch: 86, train_loss: 1.0681, test_loss: 1.1084, test_f1: 0.4250
 epoch: 87, train_loss: 1.0649, test_loss: 1.1018, test_f1: 0.4283
 epoch: 88, train_loss: 1.0690, test_loss: 1.1029, test_f1: 0.4305
 epoch: 89, train_loss: 1.0592, test_loss: 1.1032, test_f1: 0.4305
 epoch: 90, train_loss: 1.0673, test_loss: 1.1059, test_f1: 0.4366
 epoch: 91, train_loss: 1.0632, test_loss: 1.1028, test_f1: 0.4280
 epoch: 92, train_loss: 1.0626, test_loss: 1.1015, test_f1: 0.4363
 epoch: 93, train_loss: 1.0653, test_loss: 1.1016, test_f1: 0.4275
 epoch: 94, train_loss: 1.0592, test_loss: 1.1005, test_f1: 0.4284
 epoch: 95, train_loss: 1.0634, test_loss: 1.1024, test_f1: 0.4323
 epoch: 96, train_loss: 1.0556, test_loss: 1.1012, test_f1: 0.4327
 epoch: 97, train_loss: 1.0572, test_loss: 1.1023, test_f1: 0.4325
 epoch: 98, train_loss: 1.0586, test_loss: 1.0986, test_f1: 0.4304
 epoch: 99, train_loss: 1.0490, test_loss: 1.1020, test_f1: 0.4280
##################ITERATION #1 ****************************************
 epoch: 0, train_loss: 1.3353, test_loss: 1.3418, test_f1: 0.2274
 epoch: 1, train_loss: 1.3260, test_loss: 1.3330, test_f1: 0.2274
 epoch: 2, train_loss: 1.3202, test_loss: 1.3220, test_f1: 0.2274
 epoch: 3, train_loss: 1.3120, test_loss: 1.3130, test_f1: 0.2274
 epoch: 4, train_loss: 1.3068, test_loss: 1.3068, test_f1: 0.2274
 epoch: 5, train_loss: 1.2996, test_loss: 1.3002, test_f1: 0.2274
 epoch: 6, train_loss: 1.2930, test_loss: 1.2946, test_f1: 0.2274
 epoch: 7, train_loss: 1.2874, test_loss: 1.2886, test_f1: 0.2274
 epoch: 8, train_loss: 1.2841, test_loss: 1.2831, test_f1: 0.2274
 epoch: 9, train_loss: 1.2776, test_loss: 1.2784, test_f1: 0.2274
 epoch: 10, train_loss: 1.2741, test_loss: 1.2724, test_f1: 0.2274
 epoch: 11, train_loss: 1.2704, test_loss: 1.2680, test_f1: 0.2274
 epoch: 12, train_loss: 1.2649, test_loss: 1.2634, test_f1: 0.2274
 epoch: 13, train_loss: 1.2602, test_loss: 1.2598, test_f1: 0.2274
 epoch: 14, train_loss: 1.2559, test_loss: 1.2557, test_f1: 0.2274
 epoch: 15, train_loss: 1.2506, test_loss: 1.2507, test_f1: 0.2274
 epoch: 16, train_loss: 1.2499, test_loss: 1.2460, test_f1: 0.2274
 epoch: 17, train_loss: 1.2444, test_loss: 1.2421, test_f1: 0.2274
 epoch: 18, train_loss: 1.2415, test_loss: 1.2372, test_f1: 0.2269
 epoch: 19, train_loss: 1.2365, test_loss: 1.2331, test_f1: 0.2269
 epoch: 20, train_loss: 1.2377, test_loss: 1.2287, test_f1: 0.2359
 epoch: 21, train_loss: 1.2269, test_loss: 1.2240, test_f1: 0.2311
 epoch: 22, train_loss: 1.2215, test_loss: 1.2183, test_f1: 0.2706
 epoch: 23, train_loss: 1.2198, test_loss: 1.2161, test_f1: 0.2693
 epoch: 24, train_loss: 1.2187, test_loss: 1.2107, test_f1: 0.2749
 epoch: 25, train_loss: 1.2164, test_loss: 1.2053, test_f1: 0.2735
 epoch: 26, train_loss: 1.2104, test_loss: 1.2025, test_f1: 0.2971
 epoch: 27, train_loss: 1.2024, test_loss: 1.1957, test_f1: 0.3070
 epoch: 28, train_loss: 1.2047, test_loss: 1.1931, test_f1: 0.3251
 epoch: 29, train_loss: 1.2017, test_loss: 1.1905, test_f1: 0.3387
 epoch: 30, train_loss: 1.1949, test_loss: 1.1875, test_f1: 0.3458
 epoch: 31, train_loss: 1.1968, test_loss: 1.1840, test_f1: 0.3501
 epoch: 32, train_loss: 1.1874, test_loss: 1.1805, test_f1: 0.3668
 epoch: 33, train_loss: 1.1852, test_loss: 1.1751, test_f1: 0.3812
 epoch: 34, train_loss: 1.1839, test_loss: 1.1750, test_f1: 0.3767
 epoch: 35, train_loss: 1.1794, test_loss: 1.1717, test_f1: 0.3755
 epoch: 36, train_loss: 1.1732, test_loss: 1.1683, test_f1: 0.3794
 epoch: 37, train_loss: 1.1741, test_loss: 1.1633, test_f1: 0.3962
 epoch: 38, train_loss: 1.1734, test_loss: 1.1592, test_f1: 0.3885
 epoch: 39, train_loss: 1.1600, test_loss: 1.1545, test_f1: 0.4042
 epoch: 40, train_loss: 1.1641, test_loss: 1.1568, test_f1: 0.4024
 epoch: 41, train_loss: 1.1581, test_loss: 1.1468, test_f1: 0.4095
 epoch: 42, train_loss: 1.1516, test_loss: 1.1451, test_f1: 0.4084
 epoch: 43, train_loss: 1.1488, test_loss: 1.1431, test_f1: 0.4154
 epoch: 44, train_loss: 1.1469, test_loss: 1.1428, test_f1: 0.4119
 epoch: 45, train_loss: 1.1457, test_loss: 1.1333, test_f1: 0.4223
 epoch: 46, train_loss: 1.1402, test_loss: 1.1352, test_f1: 0.4203
 epoch: 47, train_loss: 1.1364, test_loss: 1.1329, test_f1: 0.4151
 epoch: 48, train_loss: 1.1346, test_loss: 1.1310, test_f1: 0.4287
 epoch: 49, train_loss: 1.1370, test_loss: 1.1237, test_f1: 0.4223
 epoch: 50, train_loss: 1.1290, test_loss: 1.1220, test_f1: 0.4208
 epoch: 51, train_loss: 1.1236, test_loss: 1.1206, test_f1: 0.4245
 epoch: 52, train_loss: 1.1256, test_loss: 1.1192, test_f1: 0.4255
 epoch: 53, train_loss: 1.1254, test_loss: 1.1157, test_f1: 0.4251
 epoch: 54, train_loss: 1.1230, test_loss: 1.1181, test_f1: 0.4271
 epoch: 55, train_loss: 1.1207, test_loss: 1.1143, test_f1: 0.4297
 epoch: 56, train_loss: 1.1248, test_loss: 1.1137, test_f1: 0.4288
 epoch: 57, train_loss: 1.1227, test_loss: 1.1119, test_f1: 0.4321
 epoch: 58, train_loss: 1.1140, test_loss: 1.1103, test_f1: 0.4322
 epoch: 59, train_loss: 1.1188, test_loss: 1.1099, test_f1: 0.4389
 epoch: 60, train_loss: 1.1165, test_loss: 1.1068, test_f1: 0.4379
 epoch: 61, train_loss: 1.1118, test_loss: 1.1086, test_f1: 0.4320
 epoch: 62, train_loss: 1.1093, test_loss: 1.1076, test_f1: 0.4360
 epoch: 63, train_loss: 1.1041, test_loss: 1.1045, test_f1: 0.4362
 epoch: 64, train_loss: 1.1036, test_loss: 1.1017, test_f1: 0.4381
 epoch: 65, train_loss: 1.1042, test_loss: 1.1016, test_f1: 0.4393
 epoch: 66, train_loss: 1.1007, test_loss: 1.1017, test_f1: 0.4445
 epoch: 67, train_loss: 1.1070, test_loss: 1.0982, test_f1: 0.4396
 epoch: 68, train_loss: 1.0970, test_loss: 1.0988, test_f1: 0.4348
 epoch: 69, train_loss: 1.0935, test_loss: 1.0984, test_f1: 0.4483
 epoch: 70, train_loss: 1.0960, test_loss: 1.0968, test_f1: 0.4466
 epoch: 71, train_loss: 1.1073, test_loss: 1.0953, test_f1: 0.4406
 epoch: 72, train_loss: 1.0941, test_loss: 1.0901, test_f1: 0.4482
 epoch: 73, train_loss: 1.0946, test_loss: 1.0903, test_f1: 0.4504
 epoch: 74, train_loss: 1.0918, test_loss: 1.0878, test_f1: 0.4500
 epoch: 75, train_loss: 1.0864, test_loss: 1.0899, test_f1: 0.4478
 epoch: 76, train_loss: 1.0866, test_loss: 1.0844, test_f1: 0.4450
 epoch: 77, train_loss: 1.0855, test_loss: 1.0810, test_f1: 0.4488
 epoch: 78, train_loss: 1.0873, test_loss: 1.0802, test_f1: 0.4566
 epoch: 79, train_loss: 1.0918, test_loss: 1.0792, test_f1: 0.4553
 epoch: 80, train_loss: 1.0850, test_loss: 1.0773, test_f1: 0.4514
 epoch: 81, train_loss: 1.0913, test_loss: 1.0746, test_f1: 0.4539
 epoch: 82, train_loss: 1.0857, test_loss: 1.0781, test_f1: 0.4570
 epoch: 83, train_loss: 1.0851, test_loss: 1.0793, test_f1: 0.4521
 epoch: 84, train_loss: 1.0726, test_loss: 1.0761, test_f1: 0.4521
 epoch: 85, train_loss: 1.0853, test_loss: 1.0754, test_f1: 0.4565
 epoch: 86, train_loss: 1.0791, test_loss: 1.0707, test_f1: 0.4573
 epoch: 87, train_loss: 1.0725, test_loss: 1.0716, test_f1: 0.4593
 epoch: 88, train_loss: 1.0693, test_loss: 1.0701, test_f1: 0.4584
 epoch: 89, train_loss: 1.0752, test_loss: 1.0675, test_f1: 0.4723
 epoch: 90, train_loss: 1.0774, test_loss: 1.0661, test_f1: 0.4644
 epoch: 91, train_loss: 1.0643, test_loss: 1.0659, test_f1: 0.4705
 epoch: 92, train_loss: 1.0676, test_loss: 1.0652, test_f1: 0.4603
 epoch: 93, train_loss: 1.0763, test_loss: 1.0662, test_f1: 0.4563
 epoch: 94, train_loss: 1.0623, test_loss: 1.0645, test_f1: 0.4623
 epoch: 95, train_loss: 1.0728, test_loss: 1.0663, test_f1: 0.4713
 epoch: 96, train_loss: 1.0668, test_loss: 1.0653, test_f1: 0.4674
 epoch: 97, train_loss: 1.0589, test_loss: 1.0610, test_f1: 0.4721
 epoch: 98, train_loss: 1.0669, test_loss: 1.0602, test_f1: 0.4682
 epoch: 99, train_loss: 1.0669, test_loss: 1.0621, test_f1: 0.4552
##################ITERATION #2 ****************************************
 epoch: 0, train_loss: 1.3228, test_loss: 1.3237, test_f1: 0.2274
 epoch: 1, train_loss: 1.3079, test_loss: 1.3135, test_f1: 0.2274
 epoch: 2, train_loss: 1.2954, test_loss: 1.2942, test_f1: 0.2274
 epoch: 3, train_loss: 1.2854, test_loss: 1.2798, test_f1: 0.2274
 epoch: 4, train_loss: 1.2757, test_loss: 1.2689, test_f1: 0.2274
 epoch: 5, train_loss: 1.2730, test_loss: 1.2606, test_f1: 0.2274
 epoch: 6, train_loss: 1.2679, test_loss: 1.2543, test_f1: 0.2517
 epoch: 7, train_loss: 1.2600, test_loss: 1.2461, test_f1: 0.2761
 epoch: 8, train_loss: 1.2548, test_loss: 1.2403, test_f1: 0.3014
 epoch: 9, train_loss: 1.2498, test_loss: 1.2340, test_f1: 0.2955
 epoch: 10, train_loss: 1.2469, test_loss: 1.2289, test_f1: 0.3095
 epoch: 11, train_loss: 1.2409, test_loss: 1.2232, test_f1: 0.3280
 epoch: 12, train_loss: 1.2344, test_loss: 1.2211, test_f1: 0.3300
 epoch: 13, train_loss: 1.2305, test_loss: 1.2154, test_f1: 0.3379
 epoch: 14, train_loss: 1.2235, test_loss: 1.2116, test_f1: 0.3423
 epoch: 15, train_loss: 1.2163, test_loss: 1.2058, test_f1: 0.3530
 epoch: 16, train_loss: 1.2169, test_loss: 1.2029, test_f1: 0.3647
 epoch: 17, train_loss: 1.2096, test_loss: 1.1970, test_f1: 0.3757
 epoch: 18, train_loss: 1.2108, test_loss: 1.1918, test_f1: 0.3800
 epoch: 19, train_loss: 1.2101, test_loss: 1.1902, test_f1: 0.3889
 epoch: 20, train_loss: 1.2000, test_loss: 1.1843, test_f1: 0.3900
 epoch: 21, train_loss: 1.1998, test_loss: 1.1786, test_f1: 0.3921
 epoch: 22, train_loss: 1.1942, test_loss: 1.1736, test_f1: 0.3934
 epoch: 23, train_loss: 1.1916, test_loss: 1.1713, test_f1: 0.3902
 epoch: 24, train_loss: 1.1877, test_loss: 1.1678, test_f1: 0.3918
 epoch: 25, train_loss: 1.1808, test_loss: 1.1636, test_f1: 0.3995
 epoch: 26, train_loss: 1.1797, test_loss: 1.1595, test_f1: 0.4050
 epoch: 27, train_loss: 1.1739, test_loss: 1.1570, test_f1: 0.4038
 epoch: 28, train_loss: 1.1685, test_loss: 1.1488, test_f1: 0.4048
 epoch: 29, train_loss: 1.1670, test_loss: 1.1514, test_f1: 0.4036
 epoch: 30, train_loss: 1.1606, test_loss: 1.1456, test_f1: 0.4059
 epoch: 31, train_loss: 1.1585, test_loss: 1.1431, test_f1: 0.4027
 epoch: 32, train_loss: 1.1570, test_loss: 1.1354, test_f1: 0.4073
 epoch: 33, train_loss: 1.1539, test_loss: 1.1357, test_f1: 0.4176
 epoch: 34, train_loss: 1.1476, test_loss: 1.1328, test_f1: 0.4079
 epoch: 35, train_loss: 1.1502, test_loss: 1.1319, test_f1: 0.4139
 epoch: 36, train_loss: 1.1433, test_loss: 1.1257, test_f1: 0.4160
 epoch: 37, train_loss: 1.1409, test_loss: 1.1186, test_f1: 0.4160
 epoch: 38, train_loss: 1.1299, test_loss: 1.1240, test_f1: 0.4176
 epoch: 39, train_loss: 1.1369, test_loss: 1.1052, test_f1: 0.4313
 epoch: 40, train_loss: 1.1229, test_loss: 1.1114, test_f1: 0.4287
 epoch: 41, train_loss: 1.1282, test_loss: 1.1090, test_f1: 0.4203
 epoch: 42, train_loss: 1.1264, test_loss: 1.1062, test_f1: 0.4230
 epoch: 43, train_loss: 1.1219, test_loss: 1.0979, test_f1: 0.4335
 epoch: 44, train_loss: 1.1224, test_loss: 1.0937, test_f1: 0.4427
 epoch: 45, train_loss: 1.1151, test_loss: 1.1000, test_f1: 0.4218
 epoch: 46, train_loss: 1.1128, test_loss: 1.0925, test_f1: 0.4410
 epoch: 47, train_loss: 1.1119, test_loss: 1.0821, test_f1: 0.4462
 epoch: 48, train_loss: 1.1134, test_loss: 1.0893, test_f1: 0.4452
 epoch: 49, train_loss: 1.1145, test_loss: 1.0899, test_f1: 0.4396
 epoch: 50, train_loss: 1.1145, test_loss: 1.0833, test_f1: 0.4551
 epoch: 51, train_loss: 1.0965, test_loss: 1.0784, test_f1: 0.4572
 epoch: 52, train_loss: 1.0998, test_loss: 1.0774, test_f1: 0.4492
 epoch: 53, train_loss: 1.0986, test_loss: 1.0772, test_f1: 0.4603
 epoch: 54, train_loss: 1.0918, test_loss: 1.0790, test_f1: 0.4333
 epoch: 55, train_loss: 1.0931, test_loss: 1.0799, test_f1: 0.4366
 epoch: 56, train_loss: 1.0888, test_loss: 1.0781, test_f1: 0.4465
 epoch: 57, train_loss: 1.0899, test_loss: 1.0716, test_f1: 0.4566
 epoch: 58, train_loss: 1.0983, test_loss: 1.0689, test_f1: 0.4517
 epoch: 59, train_loss: 1.0832, test_loss: 1.0690, test_f1: 0.4615
 epoch: 60, train_loss: 1.0893, test_loss: 1.0669, test_f1: 0.4471
 epoch: 61, train_loss: 1.0863, test_loss: 1.0687, test_f1: 0.4559
 epoch: 62, train_loss: 1.0807, test_loss: 1.0700, test_f1: 0.4557
 epoch: 63, train_loss: 1.0791, test_loss: 1.0680, test_f1: 0.4617
 epoch: 64, train_loss: 1.0780, test_loss: 1.0657, test_f1: 0.4589
 epoch: 65, train_loss: 1.0755, test_loss: 1.0666, test_f1: 0.4622
 epoch: 66, train_loss: 1.0843, test_loss: 1.0682, test_f1: 0.4619
 epoch: 67, train_loss: 1.0809, test_loss: 1.0681, test_f1: 0.4578
 epoch: 68, train_loss: 1.0750, test_loss: 1.0698, test_f1: 0.4520
 epoch: 69, train_loss: 1.0742, test_loss: 1.0656, test_f1: 0.4583
 epoch: 70, train_loss: 1.0737, test_loss: 1.0653, test_f1: 0.4593
 epoch: 71, train_loss: 1.0707, test_loss: 1.0644, test_f1: 0.4592
 epoch: 72, train_loss: 1.0656, test_loss: 1.0619, test_f1: 0.4584
 epoch: 73, train_loss: 1.0775, test_loss: 1.0659, test_f1: 0.4621
 epoch: 74, train_loss: 1.0747, test_loss: 1.0653, test_f1: 0.4508
 epoch: 75, train_loss: 1.0681, test_loss: 1.0662, test_f1: 0.4541
 epoch: 76, train_loss: 1.0713, test_loss: 1.0674, test_f1: 0.4537
 epoch: 77, train_loss: 1.0719, test_loss: 1.0618, test_f1: 0.4442
 epoch: 78, train_loss: 1.0693, test_loss: 1.0606, test_f1: 0.4583
 epoch: 79, train_loss: 1.0698, test_loss: 1.0636, test_f1: 0.4551
 epoch: 80, train_loss: 1.0676, test_loss: 1.0601, test_f1: 0.4616
 epoch: 81, train_loss: 1.0654, test_loss: 1.0637, test_f1: 0.4571
 epoch: 82, train_loss: 1.0665, test_loss: 1.0608, test_f1: 0.4616
 epoch: 83, train_loss: 1.0638, test_loss: 1.0627, test_f1: 0.4544
 epoch: 84, train_loss: 1.0582, test_loss: 1.0588, test_f1: 0.4582
 epoch: 85, train_loss: 1.0650, test_loss: 1.0574, test_f1: 0.4673
 epoch: 86, train_loss: 1.0649, test_loss: 1.0573, test_f1: 0.4573
 epoch: 87, train_loss: 1.0670, test_loss: 1.0573, test_f1: 0.4539
 epoch: 88, train_loss: 1.0584, test_loss: 1.0615, test_f1: 0.4433
 epoch: 89, train_loss: 1.0569, test_loss: 1.0595, test_f1: 0.4540
 epoch: 90, train_loss: 1.0545, test_loss: 1.0561, test_f1: 0.4533
 epoch: 91, train_loss: 1.0504, test_loss: 1.0577, test_f1: 0.4474
 epoch: 92, train_loss: 1.0524, test_loss: 1.0618, test_f1: 0.4417
 epoch: 93, train_loss: 1.0486, test_loss: 1.0596, test_f1: 0.4441
 epoch: 94, train_loss: 1.0434, test_loss: 1.0567, test_f1: 0.4483
 epoch: 95, train_loss: 1.0485, test_loss: 1.0644, test_f1: 0.4453
 epoch: 96, train_loss: 1.0521, test_loss: 1.0587, test_f1: 0.4513
 epoch: 97, train_loss: 1.0468, test_loss: 1.0565, test_f1: 0.4464
 epoch: 98, train_loss: 1.0468, test_loss: 1.0567, test_f1: 0.4511
 epoch: 99, train_loss: 1.0588, test_loss: 1.0524, test_f1: 0.4475
##################ITERATION #3 ****************************************
 epoch: 0, train_loss: 1.3023, test_loss: 1.3053, test_f1: 0.2274
 epoch: 1, train_loss: 1.2832, test_loss: 1.2847, test_f1: 0.2274
 epoch: 2, train_loss: 1.2786, test_loss: 1.2721, test_f1: 0.2274
 epoch: 3, train_loss: 1.2670, test_loss: 1.2631, test_f1: 0.2274
 epoch: 4, train_loss: 1.2604, test_loss: 1.2571, test_f1: 0.2371
 epoch: 5, train_loss: 1.2572, test_loss: 1.2495, test_f1: 0.2381
 epoch: 6, train_loss: 1.2475, test_loss: 1.2413, test_f1: 0.2530
 epoch: 7, train_loss: 1.2445, test_loss: 1.2370, test_f1: 0.2689
 epoch: 8, train_loss: 1.2388, test_loss: 1.2329, test_f1: 0.2907
 epoch: 9, train_loss: 1.2355, test_loss: 1.2256, test_f1: 0.2887
 epoch: 10, train_loss: 1.2346, test_loss: 1.2233, test_f1: 0.3045
 epoch: 11, train_loss: 1.2269, test_loss: 1.2179, test_f1: 0.2959
 epoch: 12, train_loss: 1.2196, test_loss: 1.2142, test_f1: 0.3045
 epoch: 13, train_loss: 1.2205, test_loss: 1.2088, test_f1: 0.3174
 epoch: 14, train_loss: 1.2153, test_loss: 1.2036, test_f1: 0.3237
 epoch: 15, train_loss: 1.2154, test_loss: 1.2026, test_f1: 0.3154
 epoch: 16, train_loss: 1.2125, test_loss: 1.1984, test_f1: 0.3227
 epoch: 17, train_loss: 1.2025, test_loss: 1.1943, test_f1: 0.3343
 epoch: 18, train_loss: 1.2011, test_loss: 1.1925, test_f1: 0.3232
 epoch: 19, train_loss: 1.2023, test_loss: 1.1866, test_f1: 0.3468
 epoch: 20, train_loss: 1.2023, test_loss: 1.1828, test_f1: 0.3622
 epoch: 21, train_loss: 1.1959, test_loss: 1.1791, test_f1: 0.3667
 epoch: 22, train_loss: 1.1868, test_loss: 1.1748, test_f1: 0.3770
 epoch: 23, train_loss: 1.1917, test_loss: 1.1740, test_f1: 0.3870
 epoch: 24, train_loss: 1.1835, test_loss: 1.1682, test_f1: 0.3888
 epoch: 25, train_loss: 1.1842, test_loss: 1.1669, test_f1: 0.3912
 epoch: 26, train_loss: 1.1830, test_loss: 1.1659, test_f1: 0.3937
 epoch: 27, train_loss: 1.1759, test_loss: 1.1649, test_f1: 0.3944
 epoch: 28, train_loss: 1.1811, test_loss: 1.1631, test_f1: 0.3982
 epoch: 29, train_loss: 1.1738, test_loss: 1.1613, test_f1: 0.3951
 epoch: 30, train_loss: 1.1708, test_loss: 1.1578, test_f1: 0.3973
 epoch: 31, train_loss: 1.1712, test_loss: 1.1581, test_f1: 0.3949
 epoch: 32, train_loss: 1.1671, test_loss: 1.1560, test_f1: 0.3947
 epoch: 33, train_loss: 1.1580, test_loss: 1.1564, test_f1: 0.4017
 epoch: 34, train_loss: 1.1632, test_loss: 1.1581, test_f1: 0.4001
 epoch: 35, train_loss: 1.1564, test_loss: 1.1535, test_f1: 0.4049
 epoch: 36, train_loss: 1.1561, test_loss: 1.1479, test_f1: 0.3976
 epoch: 37, train_loss: 1.1553, test_loss: 1.1516, test_f1: 0.4076
 epoch: 38, train_loss: 1.1562, test_loss: 1.1489, test_f1: 0.4131
 epoch: 39, train_loss: 1.1440, test_loss: 1.1452, test_f1: 0.4105
 epoch: 40, train_loss: 1.1450, test_loss: 1.1431, test_f1: 0.4121
 epoch: 41, train_loss: 1.1433, test_loss: 1.1400, test_f1: 0.4186
 epoch: 42, train_loss: 1.1427, test_loss: 1.1380, test_f1: 0.4163
 epoch: 43, train_loss: 1.1458, test_loss: 1.1351, test_f1: 0.4167
 epoch: 44, train_loss: 1.1335, test_loss: 1.1357, test_f1: 0.4164
 epoch: 45, train_loss: 1.1410, test_loss: 1.1326, test_f1: 0.4208
 epoch: 46, train_loss: 1.1354, test_loss: 1.1328, test_f1: 0.4170
 epoch: 47, train_loss: 1.1336, test_loss: 1.1322, test_f1: 0.4199
 epoch: 48, train_loss: 1.1266, test_loss: 1.1288, test_f1: 0.4221
 epoch: 49, train_loss: 1.1305, test_loss: 1.1282, test_f1: 0.4212
 epoch: 50, train_loss: 1.1246, test_loss: 1.1239, test_f1: 0.4222
 epoch: 51, train_loss: 1.1254, test_loss: 1.1217, test_f1: 0.4264
 epoch: 52, train_loss: 1.1149, test_loss: 1.1257, test_f1: 0.4202
 epoch: 53, train_loss: 1.1192, test_loss: 1.1254, test_f1: 0.4254
 epoch: 54, train_loss: 1.1251, test_loss: 1.1260, test_f1: 0.4257
 epoch: 55, train_loss: 1.1155, test_loss: 1.1212, test_f1: 0.4205
 epoch: 56, train_loss: 1.1150, test_loss: 1.1257, test_f1: 0.4069
 epoch: 57, train_loss: 1.1139, test_loss: 1.1234, test_f1: 0.4175
 epoch: 58, train_loss: 1.1191, test_loss: 1.1204, test_f1: 0.4219
 epoch: 59, train_loss: 1.1077, test_loss: 1.1189, test_f1: 0.4226
 epoch: 60, train_loss: 1.1136, test_loss: 1.1166, test_f1: 0.4223
 epoch: 61, train_loss: 1.1139, test_loss: 1.1143, test_f1: 0.4223
 epoch: 62, train_loss: 1.1207, test_loss: 1.1205, test_f1: 0.4267
 epoch: 63, train_loss: 1.1108, test_loss: 1.1166, test_f1: 0.4221
 epoch: 64, train_loss: 1.1076, test_loss: 1.1172, test_f1: 0.4209
 epoch: 65, train_loss: 1.1034, test_loss: 1.1184, test_f1: 0.4221
 epoch: 66, train_loss: 1.1088, test_loss: 1.1176, test_f1: 0.4253
 epoch: 67, train_loss: 1.1098, test_loss: 1.1153, test_f1: 0.4287
 epoch: 68, train_loss: 1.1010, test_loss: 1.1134, test_f1: 0.4230
 epoch: 69, train_loss: 1.1013, test_loss: 1.1168, test_f1: 0.4290
 epoch: 70, train_loss: 1.0979, test_loss: 1.1110, test_f1: 0.4386
 epoch: 71, train_loss: 1.1016, test_loss: 1.1120, test_f1: 0.4246
 epoch: 72, train_loss: 1.1066, test_loss: 1.1168, test_f1: 0.4200
 epoch: 73, train_loss: 1.0981, test_loss: 1.1083, test_f1: 0.4209
 epoch: 74, train_loss: 1.1008, test_loss: 1.1145, test_f1: 0.4207
 epoch: 75, train_loss: 1.1001, test_loss: 1.1143, test_f1: 0.4286
 epoch: 76, train_loss: 1.0994, test_loss: 1.1117, test_f1: 0.4325
 epoch: 77, train_loss: 1.0968, test_loss: 1.1076, test_f1: 0.4195
 epoch: 78, train_loss: 1.1000, test_loss: 1.1107, test_f1: 0.4284
 epoch: 79, train_loss: 1.1005, test_loss: 1.1129, test_f1: 0.4191
 epoch: 80, train_loss: 1.0951, test_loss: 1.1068, test_f1: 0.4387
 epoch: 81, train_loss: 1.0883, test_loss: 1.1046, test_f1: 0.4210
 epoch: 82, train_loss: 1.0928, test_loss: 1.1033, test_f1: 0.4198
 epoch: 83, train_loss: 1.0903, test_loss: 1.1041, test_f1: 0.4246
 epoch: 84, train_loss: 1.0832, test_loss: 1.1026, test_f1: 0.4243
 epoch: 85, train_loss: 1.0884, test_loss: 1.1028, test_f1: 0.4226
 epoch: 86, train_loss: 1.0984, test_loss: 1.1050, test_f1: 0.4254
 epoch: 87, train_loss: 1.0887, test_loss: 1.1024, test_f1: 0.4355
 epoch: 88, train_loss: 1.0825, test_loss: 1.1005, test_f1: 0.4187
 epoch: 89, train_loss: 1.0725, test_loss: 1.1056, test_f1: 0.4243
 epoch: 90, train_loss: 1.0815, test_loss: 1.1026, test_f1: 0.4277
 epoch: 91, train_loss: 1.0801, test_loss: 1.0982, test_f1: 0.4126
 epoch: 92, train_loss: 1.0783, test_loss: 1.1014, test_f1: 0.4242
 epoch: 93, train_loss: 1.0850, test_loss: 1.0990, test_f1: 0.4256
 epoch: 94, train_loss: 1.0785, test_loss: 1.0995, test_f1: 0.4275
 epoch: 95, train_loss: 1.0774, test_loss: 1.0985, test_f1: 0.4290
 epoch: 96, train_loss: 1.0737, test_loss: 1.0985, test_f1: 0.4235
 epoch: 97, train_loss: 1.0721, test_loss: 1.0957, test_f1: 0.4270
 epoch: 98, train_loss: 1.0773, test_loss: 1.0979, test_f1: 0.4253
 epoch: 99, train_loss: 1.0805, test_loss: 1.0990, test_f1: 0.4279
##################ITERATION #4 ****************************************
 epoch: 0, train_loss: 1.3102, test_loss: 1.3203, test_f1: 0.2251
 epoch: 1, train_loss: 1.2876, test_loss: 1.2953, test_f1: 0.2505
 epoch: 2, train_loss: 1.2785, test_loss: 1.2731, test_f1: 0.2527
 epoch: 3, train_loss: 1.2646, test_loss: 1.2576, test_f1: 0.2692
 epoch: 4, train_loss: 1.2569, test_loss: 1.2496, test_f1: 0.2816
 epoch: 5, train_loss: 1.2529, test_loss: 1.2415, test_f1: 0.2820
 epoch: 6, train_loss: 1.2454, test_loss: 1.2369, test_f1: 0.3027
 epoch: 7, train_loss: 1.2430, test_loss: 1.2278, test_f1: 0.3187
 epoch: 8, train_loss: 1.2336, test_loss: 1.2255, test_f1: 0.3455
 epoch: 9, train_loss: 1.2314, test_loss: 1.2181, test_f1: 0.3466
 epoch: 10, train_loss: 1.2247, test_loss: 1.2120, test_f1: 0.3509
 epoch: 11, train_loss: 1.2211, test_loss: 1.2067, test_f1: 0.3567
 epoch: 12, train_loss: 1.2135, test_loss: 1.2014, test_f1: 0.3644
 epoch: 13, train_loss: 1.2101, test_loss: 1.1945, test_f1: 0.3674
 epoch: 14, train_loss: 1.2111, test_loss: 1.1890, test_f1: 0.3834
 epoch: 15, train_loss: 1.2055, test_loss: 1.1869, test_f1: 0.3984
 epoch: 16, train_loss: 1.2012, test_loss: 1.1819, test_f1: 0.3836
 epoch: 17, train_loss: 1.1959, test_loss: 1.1781, test_f1: 0.3913
 epoch: 18, train_loss: 1.1865, test_loss: 1.1710, test_f1: 0.3967
 epoch: 19, train_loss: 1.1851, test_loss: 1.1698, test_f1: 0.3917
 epoch: 20, train_loss: 1.1864, test_loss: 1.1633, test_f1: 0.4045
 epoch: 21, train_loss: 1.1811, test_loss: 1.1640, test_f1: 0.4087
 epoch: 22, train_loss: 1.1764, test_loss: 1.1566, test_f1: 0.4095
 epoch: 23, train_loss: 1.1762, test_loss: 1.1512, test_f1: 0.4255
 epoch: 24, train_loss: 1.1675, test_loss: 1.1472, test_f1: 0.4200
 epoch: 25, train_loss: 1.1656, test_loss: 1.1430, test_f1: 0.4354
 epoch: 26, train_loss: 1.1584, test_loss: 1.1367, test_f1: 0.4470
 epoch: 27, train_loss: 1.1550, test_loss: 1.1320, test_f1: 0.4305
 epoch: 28, train_loss: 1.1570, test_loss: 1.1316, test_f1: 0.4423
 epoch: 29, train_loss: 1.1438, test_loss: 1.1258, test_f1: 0.4442
 epoch: 30, train_loss: 1.1448, test_loss: 1.1241, test_f1: 0.4472
 epoch: 31, train_loss: 1.1497, test_loss: 1.1165, test_f1: 0.4508
 epoch: 32, train_loss: 1.1276, test_loss: 1.1174, test_f1: 0.4504
 epoch: 33, train_loss: 1.1362, test_loss: 1.1121, test_f1: 0.4443
 epoch: 34, train_loss: 1.1295, test_loss: 1.1101, test_f1: 0.4556
 epoch: 35, train_loss: 1.1215, test_loss: 1.1028, test_f1: 0.4468
 epoch: 36, train_loss: 1.1228, test_loss: 1.1046, test_f1: 0.4553
 epoch: 37, train_loss: 1.1195, test_loss: 1.1008, test_f1: 0.4669
 epoch: 38, train_loss: 1.1134, test_loss: 1.0951, test_f1: 0.4550
 epoch: 39, train_loss: 1.1110, test_loss: 1.0933, test_f1: 0.4496
 epoch: 40, train_loss: 1.1095, test_loss: 1.0866, test_f1: 0.4546
 epoch: 41, train_loss: 1.1015, test_loss: 1.0849, test_f1: 0.4543
 epoch: 42, train_loss: 1.1100, test_loss: 1.0891, test_f1: 0.4646
 epoch: 43, train_loss: 1.1024, test_loss: 1.0799, test_f1: 0.4697
 epoch: 44, train_loss: 1.0966, test_loss: 1.0788, test_f1: 0.4665
 epoch: 45, train_loss: 1.0937, test_loss: 1.0786, test_f1: 0.4666
 epoch: 46, train_loss: 1.0941, test_loss: 1.0704, test_f1: 0.4632
 epoch: 47, train_loss: 1.0845, test_loss: 1.0730, test_f1: 0.4631
 epoch: 48, train_loss: 1.0774, test_loss: 1.0736, test_f1: 0.4664
 epoch: 49, train_loss: 1.0819, test_loss: 1.0675, test_f1: 0.4712
 epoch: 50, train_loss: 1.0711, test_loss: 1.0697, test_f1: 0.4701
 epoch: 51, train_loss: 1.0734, test_loss: 1.0662, test_f1: 0.4713
 epoch: 52, train_loss: 1.0752, test_loss: 1.0635, test_f1: 0.4765
 epoch: 53, train_loss: 1.0670, test_loss: 1.0670, test_f1: 0.4784
 epoch: 54, train_loss: 1.0662, test_loss: 1.0647, test_f1: 0.4786
 epoch: 55, train_loss: 1.0642, test_loss: 1.0608, test_f1: 0.4729
 epoch: 56, train_loss: 1.0637, test_loss: 1.0617, test_f1: 0.4791
 epoch: 57, train_loss: 1.0770, test_loss: 1.0611, test_f1: 0.4771
 epoch: 58, train_loss: 1.0551, test_loss: 1.0620, test_f1: 0.4756
 epoch: 59, train_loss: 1.0637, test_loss: 1.0573, test_f1: 0.4813
 epoch: 60, train_loss: 1.0597, test_loss: 1.0530, test_f1: 0.4801
 epoch: 61, train_loss: 1.0645, test_loss: 1.0530, test_f1: 0.4816
 epoch: 62, train_loss: 1.0770, test_loss: 1.0572, test_f1: 0.4711
 epoch: 63, train_loss: 1.0545, test_loss: 1.0551, test_f1: 0.4763
 epoch: 64, train_loss: 1.0601, test_loss: 1.0602, test_f1: 0.4700
 epoch: 65, train_loss: 1.0580, test_loss: 1.0556, test_f1: 0.4808
 epoch: 66, train_loss: 1.0547, test_loss: 1.0563, test_f1: 0.4710
 epoch: 67, train_loss: 1.0455, test_loss: 1.0533, test_f1: 0.4764
 epoch: 68, train_loss: 1.0506, test_loss: 1.0531, test_f1: 0.4743
 epoch: 69, train_loss: 1.0610, test_loss: 1.0550, test_f1: 0.4730
 epoch: 70, train_loss: 1.0459, test_loss: 1.0539, test_f1: 0.4666
 epoch: 71, train_loss: 1.0407, test_loss: 1.0487, test_f1: 0.4801
 epoch: 72, train_loss: 1.0402, test_loss: 1.0516, test_f1: 0.4795
 epoch: 73, train_loss: 1.0454, test_loss: 1.0522, test_f1: 0.4730
 epoch: 74, train_loss: 1.0413, test_loss: 1.0498, test_f1: 0.4815
 epoch: 75, train_loss: 1.0509, test_loss: 1.0504, test_f1: 0.4711
 epoch: 76, train_loss: 1.0505, test_loss: 1.0503, test_f1: 0.4769
 epoch: 77, train_loss: 1.0423, test_loss: 1.0473, test_f1: 0.4786
 epoch: 78, train_loss: 1.0347, test_loss: 1.0540, test_f1: 0.4747
 epoch: 79, train_loss: 1.0386, test_loss: 1.0516, test_f1: 0.4746
 epoch: 80, train_loss: 1.0315, test_loss: 1.0557, test_f1: 0.4768
 epoch: 81, train_loss: 1.0305, test_loss: 1.0459, test_f1: 0.4784
 epoch: 82, train_loss: 1.0403, test_loss: 1.0512, test_f1: 0.4739
 epoch: 83, train_loss: 1.0318, test_loss: 1.0492, test_f1: 0.4772
 epoch: 84, train_loss: 1.0239, test_loss: 1.0496, test_f1: 0.4765
 epoch: 85, train_loss: 1.0382, test_loss: 1.0481, test_f1: 0.4750
 epoch: 86, train_loss: 1.0338, test_loss: 1.0512, test_f1: 0.4720
 epoch: 87, train_loss: 1.0356, test_loss: 1.0486, test_f1: 0.4694
 epoch: 88, train_loss: 1.0258, test_loss: 1.0467, test_f1: 0.4740
 epoch: 89, train_loss: 1.0308, test_loss: 1.0469, test_f1: 0.4783
 epoch: 90, train_loss: 1.0331, test_loss: 1.0410, test_f1: 0.4771
 epoch: 91, train_loss: 1.0234, test_loss: 1.0481, test_f1: 0.4641
 epoch: 92, train_loss: 1.0154, test_loss: 1.0455, test_f1: 0.4753
 epoch: 93, train_loss: 1.0165, test_loss: 1.0459, test_f1: 0.4706
 epoch: 94, train_loss: 1.0210, test_loss: 1.0463, test_f1: 0.4685
 epoch: 95, train_loss: 1.0224, test_loss: 1.0440, test_f1: 0.4721
 epoch: 96, train_loss: 1.0097, test_loss: 1.0500, test_f1: 0.4698
 epoch: 97, train_loss: 1.0230, test_loss: 1.0474, test_f1: 0.4704
 epoch: 98, train_loss: 1.0197, test_loss: 1.0480, test_f1: 0.4694
 epoch: 99, train_loss: 1.0067, test_loss: 1.0480, test_f1: 0.4737
##################ITERATION #5 ****************************************
 epoch: 0, train_loss: 1.3098, test_loss: 1.3088, test_f1: 0.2274
 epoch: 1, train_loss: 1.2879, test_loss: 1.2859, test_f1: 0.2274
 epoch: 2, train_loss: 1.2807, test_loss: 1.2765, test_f1: 0.2399
 epoch: 3, train_loss: 1.2721, test_loss: 1.2539, test_f1: 0.2274
 epoch: 4, train_loss: 1.2645, test_loss: 1.2449, test_f1: 0.2548
 epoch: 5, train_loss: 1.2591, test_loss: 1.2395, test_f1: 0.2576
 epoch: 6, train_loss: 1.2582, test_loss: 1.2327, test_f1: 0.2693
 epoch: 7, train_loss: 1.2432, test_loss: 1.2273, test_f1: 0.2858
 epoch: 8, train_loss: 1.2397, test_loss: 1.2242, test_f1: 0.2796
 epoch: 9, train_loss: 1.2313, test_loss: 1.2166, test_f1: 0.3133
 epoch: 10, train_loss: 1.2299, test_loss: 1.2091, test_f1: 0.3176
 epoch: 11, train_loss: 1.2243, test_loss: 1.2038, test_f1: 0.3245
 epoch: 12, train_loss: 1.2252, test_loss: 1.2030, test_f1: 0.3243
 epoch: 13, train_loss: 1.2183, test_loss: 1.1963, test_f1: 0.3281
 epoch: 14, train_loss: 1.2194, test_loss: 1.1913, test_f1: 0.3301
 epoch: 15, train_loss: 1.2063, test_loss: 1.1854, test_f1: 0.3403
 epoch: 16, train_loss: 1.2020, test_loss: 1.1814, test_f1: 0.3527
 epoch: 17, train_loss: 1.1962, test_loss: 1.1774, test_f1: 0.3771
 epoch: 18, train_loss: 1.1934, test_loss: 1.1738, test_f1: 0.3880
 epoch: 19, train_loss: 1.1875, test_loss: 1.1683, test_f1: 0.3910
 epoch: 20, train_loss: 1.1883, test_loss: 1.1641, test_f1: 0.3985
 epoch: 21, train_loss: 1.1877, test_loss: 1.1595, test_f1: 0.4081
 epoch: 22, train_loss: 1.1794, test_loss: 1.1565, test_f1: 0.4018
 epoch: 23, train_loss: 1.1754, test_loss: 1.1536, test_f1: 0.4078
 epoch: 24, train_loss: 1.1687, test_loss: 1.1509, test_f1: 0.4013
 epoch: 25, train_loss: 1.1640, test_loss: 1.1492, test_f1: 0.4030
 epoch: 26, train_loss: 1.1597, test_loss: 1.1476, test_f1: 0.4011
 epoch: 27, train_loss: 1.1631, test_loss: 1.1437, test_f1: 0.3930
 epoch: 28, train_loss: 1.1553, test_loss: 1.1388, test_f1: 0.4099
 epoch: 29, train_loss: 1.1550, test_loss: 1.1389, test_f1: 0.4027
 epoch: 30, train_loss: 1.1508, test_loss: 1.1303, test_f1: 0.3968
 epoch: 31, train_loss: 1.1471, test_loss: 1.1247, test_f1: 0.4128
 epoch: 32, train_loss: 1.1418, test_loss: 1.1271, test_f1: 0.4076
 epoch: 33, train_loss: 1.1425, test_loss: 1.1248, test_f1: 0.4109
 epoch: 34, train_loss: 1.1351, test_loss: 1.1230, test_f1: 0.4133
 epoch: 35, train_loss: 1.1329, test_loss: 1.1235, test_f1: 0.4025
 epoch: 36, train_loss: 1.1328, test_loss: 1.1205, test_f1: 0.4067
 epoch: 37, train_loss: 1.1273, test_loss: 1.1232, test_f1: 0.4075
 epoch: 38, train_loss: 1.1172, test_loss: 1.1171, test_f1: 0.4202
 epoch: 39, train_loss: 1.1212, test_loss: 1.1179, test_f1: 0.4205
 epoch: 40, train_loss: 1.1242, test_loss: 1.1145, test_f1: 0.4078
 epoch: 41, train_loss: 1.1264, test_loss: 1.1107, test_f1: 0.4111
 epoch: 42, train_loss: 1.1071, test_loss: 1.1197, test_f1: 0.4072
 epoch: 43, train_loss: 1.1092, test_loss: 1.1137, test_f1: 0.4119
 epoch: 44, train_loss: 1.1112, test_loss: 1.1128, test_f1: 0.4070
 epoch: 45, train_loss: 1.1035, test_loss: 1.1039, test_f1: 0.4142
 epoch: 46, train_loss: 1.1020, test_loss: 1.1070, test_f1: 0.4073
 epoch: 47, train_loss: 1.0956, test_loss: 1.1084, test_f1: 0.4123
 epoch: 48, train_loss: 1.0986, test_loss: 1.0971, test_f1: 0.4129
 epoch: 49, train_loss: 1.0871, test_loss: 1.1027, test_f1: 0.4149
 epoch: 50, train_loss: 1.0929, test_loss: 1.1003, test_f1: 0.4250
 epoch: 51, train_loss: 1.0916, test_loss: 1.0927, test_f1: 0.4203
 epoch: 52, train_loss: 1.0932, test_loss: 1.0988, test_f1: 0.4118
 epoch: 53, train_loss: 1.0945, test_loss: 1.0964, test_f1: 0.4173
 epoch: 54, train_loss: 1.0913, test_loss: 1.0980, test_f1: 0.4128
 epoch: 55, train_loss: 1.0794, test_loss: 1.0999, test_f1: 0.4076
 epoch: 56, train_loss: 1.0800, test_loss: 1.1036, test_f1: 0.4045
 epoch: 57, train_loss: 1.0880, test_loss: 1.0940, test_f1: 0.4140
 epoch: 58, train_loss: 1.0765, test_loss: 1.0912, test_f1: 0.4200
 epoch: 59, train_loss: 1.0809, test_loss: 1.0961, test_f1: 0.4189
 epoch: 60, train_loss: 1.0808, test_loss: 1.0949, test_f1: 0.4138
 epoch: 61, train_loss: 1.0803, test_loss: 1.0932, test_f1: 0.4135
 epoch: 62, train_loss: 1.0801, test_loss: 1.0886, test_f1: 0.4200
 epoch: 63, train_loss: 1.0650, test_loss: 1.0874, test_f1: 0.4086
 epoch: 64, train_loss: 1.0727, test_loss: 1.0905, test_f1: 0.4046
 epoch: 65, train_loss: 1.0676, test_loss: 1.0933, test_f1: 0.4080
 epoch: 66, train_loss: 1.0726, test_loss: 1.0911, test_f1: 0.4059
 epoch: 67, train_loss: 1.0697, test_loss: 1.0894, test_f1: 0.4146
 epoch: 68, train_loss: 1.0708, test_loss: 1.0939, test_f1: 0.4119
 epoch: 69, train_loss: 1.0690, test_loss: 1.0900, test_f1: 0.4185
 epoch: 70, train_loss: 1.0598, test_loss: 1.0882, test_f1: 0.4177
 epoch: 71, train_loss: 1.0667, test_loss: 1.0893, test_f1: 0.4135
 epoch: 72, train_loss: 1.0635, test_loss: 1.0909, test_f1: 0.4139
 epoch: 73, train_loss: 1.0635, test_loss: 1.0891, test_f1: 0.4194
 epoch: 74, train_loss: 1.0652, test_loss: 1.0928, test_f1: 0.4081
 epoch: 75, train_loss: 1.0592, test_loss: 1.0914, test_f1: 0.4129
 epoch: 76, train_loss: 1.0556, test_loss: 1.0884, test_f1: 0.4137
 epoch: 77, train_loss: 1.0496, test_loss: 1.0861, test_f1: 0.4121
 epoch: 78, train_loss: 1.0601, test_loss: 1.0928, test_f1: 0.4100
 epoch: 79, train_loss: 1.0613, test_loss: 1.0899, test_f1: 0.4070
 epoch: 80, train_loss: 1.0591, test_loss: 1.0839, test_f1: 0.4185
 epoch: 81, train_loss: 1.0582, test_loss: 1.0796, test_f1: 0.4241
 epoch: 82, train_loss: 1.0515, test_loss: 1.0862, test_f1: 0.4229
 epoch: 83, train_loss: 1.0501, test_loss: 1.0911, test_f1: 0.4200
 epoch: 84, train_loss: 1.0489, test_loss: 1.0911, test_f1: 0.4202
 epoch: 85, train_loss: 1.0563, test_loss: 1.0907, test_f1: 0.4067
 epoch: 86, train_loss: 1.0499, test_loss: 1.0891, test_f1: 0.4169
 epoch: 87, train_loss: 1.0481, test_loss: 1.0895, test_f1: 0.4277
 epoch: 88, train_loss: 1.0404, test_loss: 1.0942, test_f1: 0.4267
 epoch: 89, train_loss: 1.0413, test_loss: 1.0905, test_f1: 0.4213
 epoch: 90, train_loss: 1.0526, test_loss: 1.0885, test_f1: 0.4232
 epoch: 91, train_loss: 1.0534, test_loss: 1.0836, test_f1: 0.4308
 epoch: 92, train_loss: 1.0463, test_loss: 1.0820, test_f1: 0.4288
 epoch: 93, train_loss: 1.0406, test_loss: 1.0892, test_f1: 0.4215
 epoch: 94, train_loss: 1.0513, test_loss: 1.0869, test_f1: 0.4291
 epoch: 95, train_loss: 1.0442, test_loss: 1.0768, test_f1: 0.4308
 epoch: 96, train_loss: 1.0354, test_loss: 1.0782, test_f1: 0.4248
 epoch: 97, train_loss: 1.0436, test_loss: 1.0857, test_f1: 0.4265
 epoch: 98, train_loss: 1.0423, test_loss: 1.0763, test_f1: 0.4333
 epoch: 99, train_loss: 1.0395, test_loss: 1.0814, test_f1: 0.4310
##################ITERATION #6 ****************************************
 epoch: 0, train_loss: 1.3134, test_loss: 1.3213, test_f1: 0.2274
 epoch: 1, train_loss: 1.2983, test_loss: 1.2992, test_f1: 0.2555
 epoch: 2, train_loss: 1.2833, test_loss: 1.2861, test_f1: 0.2558
 epoch: 3, train_loss: 1.2831, test_loss: 1.2675, test_f1: 0.2728
 epoch: 4, train_loss: 1.2647, test_loss: 1.2567, test_f1: 0.2797
 epoch: 5, train_loss: 1.2606, test_loss: 1.2520, test_f1: 0.2689
 epoch: 6, train_loss: 1.2612, test_loss: 1.2452, test_f1: 0.2934
 epoch: 7, train_loss: 1.2536, test_loss: 1.2353, test_f1: 0.3047
 epoch: 8, train_loss: 1.2431, test_loss: 1.2302, test_f1: 0.3153
 epoch: 9, train_loss: 1.2377, test_loss: 1.2234, test_f1: 0.3247
 epoch: 10, train_loss: 1.2413, test_loss: 1.2188, test_f1: 0.3248
 epoch: 11, train_loss: 1.2306, test_loss: 1.2148, test_f1: 0.3291
 epoch: 12, train_loss: 1.2277, test_loss: 1.2101, test_f1: 0.3371
 epoch: 13, train_loss: 1.2205, test_loss: 1.2057, test_f1: 0.3533
 epoch: 14, train_loss: 1.2157, test_loss: 1.2060, test_f1: 0.3646
 epoch: 15, train_loss: 1.2153, test_loss: 1.2016, test_f1: 0.3756
 epoch: 16, train_loss: 1.2136, test_loss: 1.1980, test_f1: 0.3828
 epoch: 17, train_loss: 1.2142, test_loss: 1.1985, test_f1: 0.3883
 epoch: 18, train_loss: 1.2130, test_loss: 1.1973, test_f1: 0.3821
 epoch: 19, train_loss: 1.2020, test_loss: 1.1931, test_f1: 0.3804
 epoch: 20, train_loss: 1.1979, test_loss: 1.1907, test_f1: 0.3827
 epoch: 21, train_loss: 1.2073, test_loss: 1.1871, test_f1: 0.3844
 epoch: 22, train_loss: 1.1995, test_loss: 1.1884, test_f1: 0.3868
 epoch: 23, train_loss: 1.1949, test_loss: 1.1849, test_f1: 0.3957
 epoch: 24, train_loss: 1.1904, test_loss: 1.1783, test_f1: 0.3849
 epoch: 25, train_loss: 1.1851, test_loss: 1.1754, test_f1: 0.3996
 epoch: 26, train_loss: 1.1873, test_loss: 1.1732, test_f1: 0.3949
 epoch: 27, train_loss: 1.1810, test_loss: 1.1723, test_f1: 0.3991
 epoch: 28, train_loss: 1.1786, test_loss: 1.1685, test_f1: 0.4017
 epoch: 29, train_loss: 1.1793, test_loss: 1.1635, test_f1: 0.4045
 epoch: 30, train_loss: 1.1771, test_loss: 1.1660, test_f1: 0.4000
 epoch: 31, train_loss: 1.1717, test_loss: 1.1630, test_f1: 0.4034
 epoch: 32, train_loss: 1.1764, test_loss: 1.1638, test_f1: 0.4088
 epoch: 33, train_loss: 1.1598, test_loss: 1.1597, test_f1: 0.4027
 epoch: 34, train_loss: 1.1639, test_loss: 1.1553, test_f1: 0.4078
 epoch: 35, train_loss: 1.1554, test_loss: 1.1569, test_f1: 0.4152
 epoch: 36, train_loss: 1.1579, test_loss: 1.1497, test_f1: 0.4187
 epoch: 37, train_loss: 1.1563, test_loss: 1.1510, test_f1: 0.4126
 epoch: 38, train_loss: 1.1548, test_loss: 1.1515, test_f1: 0.4237
 epoch: 39, train_loss: 1.1417, test_loss: 1.1465, test_f1: 0.4188
 epoch: 40, train_loss: 1.1537, test_loss: 1.1480, test_f1: 0.4162
 epoch: 41, train_loss: 1.1460, test_loss: 1.1460, test_f1: 0.4163
 epoch: 42, train_loss: 1.1468, test_loss: 1.1403, test_f1: 0.4260
 epoch: 43, train_loss: 1.1418, test_loss: 1.1385, test_f1: 0.4266
 epoch: 44, train_loss: 1.1345, test_loss: 1.1408, test_f1: 0.4209
 epoch: 45, train_loss: 1.1348, test_loss: 1.1392, test_f1: 0.4169
 epoch: 46, train_loss: 1.1319, test_loss: 1.1374, test_f1: 0.4237
 epoch: 47, train_loss: 1.1266, test_loss: 1.1361, test_f1: 0.4328
 epoch: 48, train_loss: 1.1362, test_loss: 1.1362, test_f1: 0.4298
 epoch: 49, train_loss: 1.1246, test_loss: 1.1375, test_f1: 0.4355
 epoch: 50, train_loss: 1.1276, test_loss: 1.1342, test_f1: 0.4120
 epoch: 51, train_loss: 1.1202, test_loss: 1.1351, test_f1: 0.4194
 epoch: 52, train_loss: 1.1213, test_loss: 1.1291, test_f1: 0.4222
 epoch: 53, train_loss: 1.1204, test_loss: 1.1300, test_f1: 0.4330
 epoch: 54, train_loss: 1.1232, test_loss: 1.1238, test_f1: 0.4279
 epoch: 55, train_loss: 1.1215, test_loss: 1.1266, test_f1: 0.4326
 epoch: 56, train_loss: 1.1128, test_loss: 1.1248, test_f1: 0.4286
 epoch: 57, train_loss: 1.1187, test_loss: 1.1259, test_f1: 0.4364
 epoch: 58, train_loss: 1.1109, test_loss: 1.1237, test_f1: 0.4244
 epoch: 59, train_loss: 1.1086, test_loss: 1.1201, test_f1: 0.4305
 epoch: 60, train_loss: 1.1153, test_loss: 1.1236, test_f1: 0.4301
 epoch: 61, train_loss: 1.1119, test_loss: 1.1194, test_f1: 0.4202
 epoch: 62, train_loss: 1.1075, test_loss: 1.1154, test_f1: 0.4189
 epoch: 63, train_loss: 1.0994, test_loss: 1.1178, test_f1: 0.4270
 epoch: 64, train_loss: 1.1089, test_loss: 1.1204, test_f1: 0.4294
 epoch: 65, train_loss: 1.1079, test_loss: 1.1155, test_f1: 0.4222
 epoch: 66, train_loss: 1.1043, test_loss: 1.1183, test_f1: 0.4335
 epoch: 67, train_loss: 1.1037, test_loss: 1.1201, test_f1: 0.4340
 epoch: 68, train_loss: 1.0981, test_loss: 1.1195, test_f1: 0.4261
 epoch: 69, train_loss: 1.1002, test_loss: 1.1212, test_f1: 0.4306
 epoch: 70, train_loss: 1.0986, test_loss: 1.1198, test_f1: 0.4350
 epoch: 71, train_loss: 1.0980, test_loss: 1.1132, test_f1: 0.4177
 epoch: 72, train_loss: 1.0923, test_loss: 1.1149, test_f1: 0.4180
 epoch: 73, train_loss: 1.0913, test_loss: 1.1128, test_f1: 0.4246
 epoch: 74, train_loss: 1.0797, test_loss: 1.1165, test_f1: 0.4302
 epoch: 75, train_loss: 1.0922, test_loss: 1.1159, test_f1: 0.4169
 epoch: 76, train_loss: 1.0927, test_loss: 1.1177, test_f1: 0.4190
 epoch: 77, train_loss: 1.0896, test_loss: 1.1124, test_f1: 0.4264
 epoch: 78, train_loss: 1.0899, test_loss: 1.1131, test_f1: 0.4287
 epoch: 79, train_loss: 1.0899, test_loss: 1.1114, test_f1: 0.4165
 epoch: 80, train_loss: 1.0913, test_loss: 1.1103, test_f1: 0.4200
 epoch: 81, train_loss: 1.0849, test_loss: 1.1059, test_f1: 0.4350
 epoch: 82, train_loss: 1.0825, test_loss: 1.1089, test_f1: 0.4372
 epoch: 83, train_loss: 1.0903, test_loss: 1.1102, test_f1: 0.4292
 epoch: 84, train_loss: 1.0872, test_loss: 1.1148, test_f1: 0.4309
 epoch: 85, train_loss: 1.0843, test_loss: 1.1113, test_f1: 0.4244
 epoch: 86, train_loss: 1.0881, test_loss: 1.1086, test_f1: 0.4330
 epoch: 87, train_loss: 1.0821, test_loss: 1.1095, test_f1: 0.4235
 epoch: 88, train_loss: 1.0778, test_loss: 1.1051, test_f1: 0.4306
 epoch: 89, train_loss: 1.0750, test_loss: 1.1071, test_f1: 0.4265
 epoch: 90, train_loss: 1.0719, test_loss: 1.1019, test_f1: 0.4339
 epoch: 91, train_loss: 1.0741, test_loss: 1.1045, test_f1: 0.4317
 epoch: 92, train_loss: 1.0755, test_loss: 1.0994, test_f1: 0.4322
 epoch: 93, train_loss: 1.0753, test_loss: 1.1026, test_f1: 0.4294
 epoch: 94, train_loss: 1.0684, test_loss: 1.1029, test_f1: 0.4408
 epoch: 95, train_loss: 1.0573, test_loss: 1.1034, test_f1: 0.4321
 epoch: 96, train_loss: 1.0628, test_loss: 1.1015, test_f1: 0.4349
 epoch: 97, train_loss: 1.0664, test_loss: 1.1024, test_f1: 0.4240
 epoch: 98, train_loss: 1.0660, test_loss: 1.0986, test_f1: 0.4416
 epoch: 99, train_loss: 1.0694, test_loss: 1.1038, test_f1: 0.4294
##################ITERATION #7 ****************************************
 epoch: 0, train_loss: 1.3231, test_loss: 1.3061, test_f1: 0.2274
 epoch: 1, train_loss: 1.2856, test_loss: 1.2725, test_f1: 0.2555
 epoch: 2, train_loss: 1.2713, test_loss: 1.2539, test_f1: 0.2580
 epoch: 3, train_loss: 1.2612, test_loss: 1.2445, test_f1: 0.2605
 epoch: 4, train_loss: 1.2510, test_loss: 1.2330, test_f1: 0.2770
 epoch: 5, train_loss: 1.2447, test_loss: 1.2208, test_f1: 0.2985
 epoch: 6, train_loss: 1.2413, test_loss: 1.2172, test_f1: 0.3133
 epoch: 7, train_loss: 1.2355, test_loss: 1.2119, test_f1: 0.3331
 epoch: 8, train_loss: 1.2322, test_loss: 1.2068, test_f1: 0.3333
 epoch: 9, train_loss: 1.2233, test_loss: 1.1992, test_f1: 0.3560
 epoch: 10, train_loss: 1.2200, test_loss: 1.1951, test_f1: 0.3572
 epoch: 11, train_loss: 1.2157, test_loss: 1.1907, test_f1: 0.3610
 epoch: 12, train_loss: 1.2108, test_loss: 1.1858, test_f1: 0.3638
 epoch: 13, train_loss: 1.2056, test_loss: 1.1813, test_f1: 0.3669
 epoch: 14, train_loss: 1.2057, test_loss: 1.1768, test_f1: 0.3833
 epoch: 15, train_loss: 1.2016, test_loss: 1.1734, test_f1: 0.3847
 epoch: 16, train_loss: 1.1964, test_loss: 1.1692, test_f1: 0.3811
 epoch: 17, train_loss: 1.1983, test_loss: 1.1667, test_f1: 0.3804
 epoch: 18, train_loss: 1.1869, test_loss: 1.1629, test_f1: 0.3829
 epoch: 19, train_loss: 1.1915, test_loss: 1.1597, test_f1: 0.3945
 epoch: 20, train_loss: 1.1826, test_loss: 1.1550, test_f1: 0.3957
 epoch: 21, train_loss: 1.1758, test_loss: 1.1518, test_f1: 0.3874
 epoch: 22, train_loss: 1.1768, test_loss: 1.1458, test_f1: 0.4077
 epoch: 23, train_loss: 1.1758, test_loss: 1.1414, test_f1: 0.4046
 epoch: 24, train_loss: 1.1740, test_loss: 1.1388, test_f1: 0.3932
 epoch: 25, train_loss: 1.1673, test_loss: 1.1317, test_f1: 0.4064
 epoch: 26, train_loss: 1.1640, test_loss: 1.1283, test_f1: 0.4104
 epoch: 27, train_loss: 1.1546, test_loss: 1.1249, test_f1: 0.4130
 epoch: 28, train_loss: 1.1519, test_loss: 1.1179, test_f1: 0.4179
 epoch: 29, train_loss: 1.1565, test_loss: 1.1156, test_f1: 0.4227
 epoch: 30, train_loss: 1.1552, test_loss: 1.1131, test_f1: 0.4143
 epoch: 31, train_loss: 1.1466, test_loss: 1.1093, test_f1: 0.4180
 epoch: 32, train_loss: 1.1492, test_loss: 1.1057, test_f1: 0.4402
 epoch: 33, train_loss: 1.1423, test_loss: 1.1036, test_f1: 0.4331
 epoch: 34, train_loss: 1.1303, test_loss: 1.0969, test_f1: 0.4267
 epoch: 35, train_loss: 1.1330, test_loss: 1.0948, test_f1: 0.4294
 epoch: 36, train_loss: 1.1256, test_loss: 1.0910, test_f1: 0.4322
 epoch: 37, train_loss: 1.1242, test_loss: 1.0856, test_f1: 0.4330
 epoch: 38, train_loss: 1.1208, test_loss: 1.0832, test_f1: 0.4245
 epoch: 39, train_loss: 1.1241, test_loss: 1.0804, test_f1: 0.4190
 epoch: 40, train_loss: 1.1148, test_loss: 1.0789, test_f1: 0.4277
 epoch: 41, train_loss: 1.1211, test_loss: 1.0678, test_f1: 0.4323
 epoch: 42, train_loss: 1.1066, test_loss: 1.0727, test_f1: 0.4200
 epoch: 43, train_loss: 1.1111, test_loss: 1.0664, test_f1: 0.4224
 epoch: 44, train_loss: 1.1070, test_loss: 1.0611, test_f1: 0.4271
 epoch: 45, train_loss: 1.1071, test_loss: 1.0619, test_f1: 0.4341
 epoch: 46, train_loss: 1.1008, test_loss: 1.0597, test_f1: 0.4229
 epoch: 47, train_loss: 1.0920, test_loss: 1.0575, test_f1: 0.4236
 epoch: 48, train_loss: 1.0998, test_loss: 1.0596, test_f1: 0.4212
 epoch: 49, train_loss: 1.0882, test_loss: 1.0507, test_f1: 0.4374
 epoch: 50, train_loss: 1.0876, test_loss: 1.0515, test_f1: 0.4216
 epoch: 51, train_loss: 1.0797, test_loss: 1.0493, test_f1: 0.4271
 epoch: 52, train_loss: 1.0837, test_loss: 1.0506, test_f1: 0.4284
 epoch: 53, train_loss: 1.0819, test_loss: 1.0507, test_f1: 0.4301
 epoch: 54, train_loss: 1.0781, test_loss: 1.0448, test_f1: 0.4356
 epoch: 55, train_loss: 1.0766, test_loss: 1.0458, test_f1: 0.4325
 epoch: 56, train_loss: 1.0678, test_loss: 1.0432, test_f1: 0.4336
 epoch: 57, train_loss: 1.0706, test_loss: 1.0418, test_f1: 0.4368
 epoch: 58, train_loss: 1.0765, test_loss: 1.0422, test_f1: 0.4363
 epoch: 59, train_loss: 1.0758, test_loss: 1.0399, test_f1: 0.4374
 epoch: 60, train_loss: 1.0685, test_loss: 1.0408, test_f1: 0.4385
 epoch: 61, train_loss: 1.0656, test_loss: 1.0394, test_f1: 0.4432
 epoch: 62, train_loss: 1.0660, test_loss: 1.0395, test_f1: 0.4445
 epoch: 63, train_loss: 1.0659, test_loss: 1.0388, test_f1: 0.4418
 epoch: 64, train_loss: 1.0714, test_loss: 1.0332, test_f1: 0.4423
 epoch: 65, train_loss: 1.0666, test_loss: 1.0353, test_f1: 0.4494
 epoch: 66, train_loss: 1.0731, test_loss: 1.0319, test_f1: 0.4509
 epoch: 67, train_loss: 1.0559, test_loss: 1.0316, test_f1: 0.4488
 epoch: 68, train_loss: 1.0699, test_loss: 1.0323, test_f1: 0.4473
 epoch: 69, train_loss: 1.0606, test_loss: 1.0334, test_f1: 0.4385
 epoch: 70, train_loss: 1.0577, test_loss: 1.0315, test_f1: 0.4506
 epoch: 71, train_loss: 1.0580, test_loss: 1.0303, test_f1: 0.4590
 epoch: 72, train_loss: 1.0557, test_loss: 1.0290, test_f1: 0.4490
 epoch: 73, train_loss: 1.0541, test_loss: 1.0239, test_f1: 0.4561
 epoch: 74, train_loss: 1.0515, test_loss: 1.0270, test_f1: 0.4557
 epoch: 75, train_loss: 1.0563, test_loss: 1.0280, test_f1: 0.4503
 epoch: 76, train_loss: 1.0509, test_loss: 1.0285, test_f1: 0.4570
 epoch: 77, train_loss: 1.0487, test_loss: 1.0217, test_f1: 0.4615
 epoch: 78, train_loss: 1.0531, test_loss: 1.0237, test_f1: 0.4599
 epoch: 79, train_loss: 1.0388, test_loss: 1.0227, test_f1: 0.4500
 epoch: 80, train_loss: 1.0500, test_loss: 1.0197, test_f1: 0.4619
 epoch: 81, train_loss: 1.0498, test_loss: 1.0194, test_f1: 0.4584
 epoch: 82, train_loss: 1.0485, test_loss: 1.0180, test_f1: 0.4609
 epoch: 83, train_loss: 1.0467, test_loss: 1.0173, test_f1: 0.4567
 epoch: 84, train_loss: 1.0467, test_loss: 1.0175, test_f1: 0.4625
 epoch: 85, train_loss: 1.0418, test_loss: 1.0142, test_f1: 0.4600
 epoch: 86, train_loss: 1.0363, test_loss: 1.0136, test_f1: 0.4633
 epoch: 87, train_loss: 1.0459, test_loss: 1.0166, test_f1: 0.4720
 epoch: 88, train_loss: 1.0416, test_loss: 1.0169, test_f1: 0.4685
 epoch: 89, train_loss: 1.0361, test_loss: 1.0162, test_f1: 0.4698
 epoch: 90, train_loss: 1.0338, test_loss: 1.0121, test_f1: 0.4653
 epoch: 91, train_loss: 1.0348, test_loss: 1.0156, test_f1: 0.4608
 epoch: 92, train_loss: 1.0425, test_loss: 1.0125, test_f1: 0.4662
 epoch: 93, train_loss: 1.0329, test_loss: 1.0109, test_f1: 0.4667
 epoch: 94, train_loss: 1.0306, test_loss: 1.0128, test_f1: 0.4800
 epoch: 95, train_loss: 1.0384, test_loss: 1.0107, test_f1: 0.4730
 epoch: 96, train_loss: 1.0444, test_loss: 1.0173, test_f1: 0.4776
 epoch: 97, train_loss: 1.0297, test_loss: 1.0092, test_f1: 0.4641
 epoch: 98, train_loss: 1.0165, test_loss: 1.0039, test_f1: 0.4635
 epoch: 99, train_loss: 1.0201, test_loss: 1.0050, test_f1: 0.4772
##################ITERATION #8 ****************************************
 epoch: 0, train_loss: 1.3404, test_loss: 1.3439, test_f1: 0.2274
 epoch: 1, train_loss: 1.3043, test_loss: 1.3346, test_f1: 0.2274
 epoch: 2, train_loss: 1.2795, test_loss: 1.2950, test_f1: 0.2274
 epoch: 3, train_loss: 1.2715, test_loss: 1.2739, test_f1: 0.2276
 epoch: 4, train_loss: 1.2664, test_loss: 1.2624, test_f1: 0.2403
 epoch: 5, train_loss: 1.2573, test_loss: 1.2541, test_f1: 0.2651
 epoch: 6, train_loss: 1.2551, test_loss: 1.2436, test_f1: 0.2729
 epoch: 7, train_loss: 1.2413, test_loss: 1.2359, test_f1: 0.3027
 epoch: 8, train_loss: 1.2404, test_loss: 1.2281, test_f1: 0.3129
 epoch: 9, train_loss: 1.2369, test_loss: 1.2222, test_f1: 0.3437
 epoch: 10, train_loss: 1.2319, test_loss: 1.2172, test_f1: 0.3491
 epoch: 11, train_loss: 1.2264, test_loss: 1.2126, test_f1: 0.3543
 epoch: 12, train_loss: 1.2204, test_loss: 1.2059, test_f1: 0.3691
 epoch: 13, train_loss: 1.2127, test_loss: 1.2017, test_f1: 0.3731
 epoch: 14, train_loss: 1.2096, test_loss: 1.1977, test_f1: 0.3748
 epoch: 15, train_loss: 1.2077, test_loss: 1.1939, test_f1: 0.3803
 epoch: 16, train_loss: 1.2011, test_loss: 1.1880, test_f1: 0.3895
 epoch: 17, train_loss: 1.2052, test_loss: 1.1822, test_f1: 0.3853
 epoch: 18, train_loss: 1.2027, test_loss: 1.1765, test_f1: 0.4069
 epoch: 19, train_loss: 1.1966, test_loss: 1.1742, test_f1: 0.4060
 epoch: 20, train_loss: 1.1885, test_loss: 1.1688, test_f1: 0.4024
 epoch: 21, train_loss: 1.1832, test_loss: 1.1693, test_f1: 0.4126
 epoch: 22, train_loss: 1.1898, test_loss: 1.1688, test_f1: 0.4012
 epoch: 23, train_loss: 1.1831, test_loss: 1.1654, test_f1: 0.4044
 epoch: 24, train_loss: 1.1812, test_loss: 1.1624, test_f1: 0.4018
 epoch: 25, train_loss: 1.1822, test_loss: 1.1571, test_f1: 0.4108
 epoch: 26, train_loss: 1.1782, test_loss: 1.1562, test_f1: 0.4145
 epoch: 27, train_loss: 1.1812, test_loss: 1.1505, test_f1: 0.4120
 epoch: 28, train_loss: 1.1761, test_loss: 1.1520, test_f1: 0.4039
 epoch: 29, train_loss: 1.1724, test_loss: 1.1503, test_f1: 0.4008
 epoch: 30, train_loss: 1.1670, test_loss: 1.1486, test_f1: 0.3979
 epoch: 31, train_loss: 1.1744, test_loss: 1.1440, test_f1: 0.4104
 epoch: 32, train_loss: 1.1615, test_loss: 1.1408, test_f1: 0.4092
 epoch: 33, train_loss: 1.1598, test_loss: 1.1391, test_f1: 0.4088
 epoch: 34, train_loss: 1.1559, test_loss: 1.1406, test_f1: 0.4114
 epoch: 35, train_loss: 1.1595, test_loss: 1.1371, test_f1: 0.4053
 epoch: 36, train_loss: 1.1586, test_loss: 1.1390, test_f1: 0.4047
 epoch: 37, train_loss: 1.1528, test_loss: 1.1363, test_f1: 0.3969
 epoch: 38, train_loss: 1.1520, test_loss: 1.1313, test_f1: 0.4124
 epoch: 39, train_loss: 1.1490, test_loss: 1.1302, test_f1: 0.4144
 epoch: 40, train_loss: 1.1389, test_loss: 1.1278, test_f1: 0.4141
 epoch: 41, train_loss: 1.1456, test_loss: 1.1297, test_f1: 0.4097
 epoch: 42, train_loss: 1.1398, test_loss: 1.1273, test_f1: 0.4085
 epoch: 43, train_loss: 1.1343, test_loss: 1.1230, test_f1: 0.4064
 epoch: 44, train_loss: 1.1366, test_loss: 1.1167, test_f1: 0.4253
 epoch: 45, train_loss: 1.1334, test_loss: 1.1171, test_f1: 0.4280
 epoch: 46, train_loss: 1.1377, test_loss: 1.1199, test_f1: 0.4196
 epoch: 47, train_loss: 1.1280, test_loss: 1.1151, test_f1: 0.4160
 epoch: 48, train_loss: 1.1265, test_loss: 1.1161, test_f1: 0.4168
 epoch: 49, train_loss: 1.1296, test_loss: 1.1165, test_f1: 0.4229
 epoch: 50, train_loss: 1.1280, test_loss: 1.1111, test_f1: 0.4315
 epoch: 51, train_loss: 1.1228, test_loss: 1.1122, test_f1: 0.4251
 epoch: 52, train_loss: 1.1175, test_loss: 1.1115, test_f1: 0.4196
 epoch: 53, train_loss: 1.1333, test_loss: 1.1103, test_f1: 0.4155
 epoch: 54, train_loss: 1.1277, test_loss: 1.1072, test_f1: 0.4232
 epoch: 55, train_loss: 1.1212, test_loss: 1.1093, test_f1: 0.4197
 epoch: 56, train_loss: 1.1117, test_loss: 1.1115, test_f1: 0.4185
 epoch: 57, train_loss: 1.1230, test_loss: 1.1112, test_f1: 0.4183
 epoch: 58, train_loss: 1.1140, test_loss: 1.1041, test_f1: 0.4167
 epoch: 59, train_loss: 1.1240, test_loss: 1.1061, test_f1: 0.4231
 epoch: 60, train_loss: 1.1163, test_loss: 1.1042, test_f1: 0.4259
 epoch: 61, train_loss: 1.1127, test_loss: 1.1056, test_f1: 0.4252
 epoch: 62, train_loss: 1.1169, test_loss: 1.1029, test_f1: 0.4214
 epoch: 63, train_loss: 1.1217, test_loss: 1.0975, test_f1: 0.4286
 epoch: 64, train_loss: 1.1140, test_loss: 1.1032, test_f1: 0.4218
 epoch: 65, train_loss: 1.1003, test_loss: 1.0958, test_f1: 0.4263
 epoch: 66, train_loss: 1.1153, test_loss: 1.0990, test_f1: 0.4227
 epoch: 67, train_loss: 1.1129, test_loss: 1.0998, test_f1: 0.4309
 epoch: 68, train_loss: 1.1138, test_loss: 1.0990, test_f1: 0.4276
 epoch: 69, train_loss: 1.0988, test_loss: 1.0966, test_f1: 0.4271
 epoch: 70, train_loss: 1.1021, test_loss: 1.0970, test_f1: 0.4267
 epoch: 71, train_loss: 1.1065, test_loss: 1.0962, test_f1: 0.4266
 epoch: 72, train_loss: 1.1145, test_loss: 1.0965, test_f1: 0.4258
 epoch: 73, train_loss: 1.1077, test_loss: 1.0927, test_f1: 0.4317
 epoch: 74, train_loss: 1.1084, test_loss: 1.0944, test_f1: 0.4296
 epoch: 75, train_loss: 1.1087, test_loss: 1.0920, test_f1: 0.4254
 epoch: 76, train_loss: 1.1040, test_loss: 1.0959, test_f1: 0.4264
 epoch: 77, train_loss: 1.0999, test_loss: 1.0921, test_f1: 0.4293
 epoch: 78, train_loss: 1.0893, test_loss: 1.0948, test_f1: 0.4254
 epoch: 79, train_loss: 1.0936, test_loss: 1.0950, test_f1: 0.4215
 epoch: 80, train_loss: 1.1043, test_loss: 1.0955, test_f1: 0.4286
 epoch: 81, train_loss: 1.0921, test_loss: 1.0922, test_f1: 0.4331
 epoch: 82, train_loss: 1.0981, test_loss: 1.0915, test_f1: 0.4291
 epoch: 83, train_loss: 1.0980, test_loss: 1.0918, test_f1: 0.4285
 epoch: 84, train_loss: 1.0917, test_loss: 1.0900, test_f1: 0.4279
 epoch: 85, train_loss: 1.0899, test_loss: 1.0827, test_f1: 0.4287
 epoch: 86, train_loss: 1.0928, test_loss: 1.0864, test_f1: 0.4253
 epoch: 87, train_loss: 1.0964, test_loss: 1.0893, test_f1: 0.4369
 epoch: 88, train_loss: 1.0981, test_loss: 1.0909, test_f1: 0.4290
 epoch: 89, train_loss: 1.0922, test_loss: 1.0908, test_f1: 0.4317
 epoch: 90, train_loss: 1.0961, test_loss: 1.0883, test_f1: 0.4354
 epoch: 91, train_loss: 1.0910, test_loss: 1.0894, test_f1: 0.4417
 epoch: 92, train_loss: 1.0900, test_loss: 1.0898, test_f1: 0.4370
 epoch: 93, train_loss: 1.0910, test_loss: 1.0832, test_f1: 0.4403
 epoch: 94, train_loss: 1.0943, test_loss: 1.0804, test_f1: 0.4365
 epoch: 95, train_loss: 1.0821, test_loss: 1.0835, test_f1: 0.4354
 epoch: 96, train_loss: 1.0929, test_loss: 1.0787, test_f1: 0.4375
 epoch: 97, train_loss: 1.0795, test_loss: 1.0870, test_f1: 0.4393
 epoch: 98, train_loss: 1.0924, test_loss: 1.0840, test_f1: 0.4321
 epoch: 99, train_loss: 1.0916, test_loss: 1.0826, test_f1: 0.4273
##################ITERATION #9 ****************************************
 epoch: 0, train_loss: 1.3311, test_loss: 1.3146, test_f1: 0.2274
 epoch: 1, train_loss: 1.2980, test_loss: 1.2982, test_f1: 0.2274
 epoch: 2, train_loss: 1.2884, test_loss: 1.2753, test_f1: 0.2384
 epoch: 3, train_loss: 1.2779, test_loss: 1.2625, test_f1: 0.2491
 epoch: 4, train_loss: 1.2636, test_loss: 1.2527, test_f1: 0.2533
 epoch: 5, train_loss: 1.2621, test_loss: 1.2431, test_f1: 0.2602
 epoch: 6, train_loss: 1.2584, test_loss: 1.2356, test_f1: 0.2874
 epoch: 7, train_loss: 1.2465, test_loss: 1.2307, test_f1: 0.3234
 epoch: 8, train_loss: 1.2439, test_loss: 1.2234, test_f1: 0.3411
 epoch: 9, train_loss: 1.2360, test_loss: 1.2157, test_f1: 0.3494
 epoch: 10, train_loss: 1.2331, test_loss: 1.2105, test_f1: 0.3581
 epoch: 11, train_loss: 1.2327, test_loss: 1.2056, test_f1: 0.3666
 epoch: 12, train_loss: 1.2185, test_loss: 1.1979, test_f1: 0.3715
 epoch: 13, train_loss: 1.2147, test_loss: 1.1932, test_f1: 0.3729
 epoch: 14, train_loss: 1.2134, test_loss: 1.1893, test_f1: 0.3839
 epoch: 15, train_loss: 1.2134, test_loss: 1.1830, test_f1: 0.3843
 epoch: 16, train_loss: 1.2078, test_loss: 1.1784, test_f1: 0.3808
 epoch: 17, train_loss: 1.1971, test_loss: 1.1709, test_f1: 0.3842
 epoch: 18, train_loss: 1.1989, test_loss: 1.1680, test_f1: 0.3943
 epoch: 19, train_loss: 1.2055, test_loss: 1.1671, test_f1: 0.4000
 epoch: 20, train_loss: 1.1887, test_loss: 1.1617, test_f1: 0.4019
 epoch: 21, train_loss: 1.1843, test_loss: 1.1580, test_f1: 0.4058
 epoch: 22, train_loss: 1.1884, test_loss: 1.1524, test_f1: 0.4054
 epoch: 23, train_loss: 1.1827, test_loss: 1.1521, test_f1: 0.4160
 epoch: 24, train_loss: 1.1698, test_loss: 1.1449, test_f1: 0.4148
 epoch: 25, train_loss: 1.1652, test_loss: 1.1442, test_f1: 0.4074
 epoch: 26, train_loss: 1.1674, test_loss: 1.1425, test_f1: 0.3965
 epoch: 27, train_loss: 1.1637, test_loss: 1.1348, test_f1: 0.4029
 epoch: 28, train_loss: 1.1608, test_loss: 1.1317, test_f1: 0.4067
 epoch: 29, train_loss: 1.1694, test_loss: 1.1314, test_f1: 0.4044
 epoch: 30, train_loss: 1.1558, test_loss: 1.1301, test_f1: 0.4053
 epoch: 31, train_loss: 1.1589, test_loss: 1.1271, test_f1: 0.4091
 epoch: 32, train_loss: 1.1515, test_loss: 1.1232, test_f1: 0.4058
 epoch: 33, train_loss: 1.1455, test_loss: 1.1241, test_f1: 0.4110
 epoch: 34, train_loss: 1.1408, test_loss: 1.1151, test_f1: 0.4100
 epoch: 35, train_loss: 1.1443, test_loss: 1.1132, test_f1: 0.3998
 epoch: 36, train_loss: 1.1365, test_loss: 1.1102, test_f1: 0.4124
 epoch: 37, train_loss: 1.1294, test_loss: 1.1102, test_f1: 0.4114
 epoch: 38, train_loss: 1.1317, test_loss: 1.1064, test_f1: 0.4097
 epoch: 39, train_loss: 1.1267, test_loss: 1.1003, test_f1: 0.4195
 epoch: 40, train_loss: 1.1188, test_loss: 1.0973, test_f1: 0.4084
 epoch: 41, train_loss: 1.1232, test_loss: 1.0933, test_f1: 0.4103
 epoch: 42, train_loss: 1.1163, test_loss: 1.0963, test_f1: 0.4079
 epoch: 43, train_loss: 1.1192, test_loss: 1.0965, test_f1: 0.4119
 epoch: 44, train_loss: 1.1170, test_loss: 1.0943, test_f1: 0.4193
 epoch: 45, train_loss: 1.1105, test_loss: 1.0926, test_f1: 0.4186
 epoch: 46, train_loss: 1.1028, test_loss: 1.0887, test_f1: 0.4272
 epoch: 47, train_loss: 1.0949, test_loss: 1.0859, test_f1: 0.4198
 epoch: 48, train_loss: 1.0958, test_loss: 1.0887, test_f1: 0.4236
 epoch: 49, train_loss: 1.1028, test_loss: 1.0817, test_f1: 0.4214
 epoch: 50, train_loss: 1.0961, test_loss: 1.0894, test_f1: 0.4315
 epoch: 51, train_loss: 1.0880, test_loss: 1.0846, test_f1: 0.4212
 epoch: 52, train_loss: 1.0915, test_loss: 1.0805, test_f1: 0.4239
 epoch: 53, train_loss: 1.0886, test_loss: 1.0799, test_f1: 0.4242
 epoch: 54, train_loss: 1.0878, test_loss: 1.0766, test_f1: 0.4274
 epoch: 55, train_loss: 1.0732, test_loss: 1.0791, test_f1: 0.4244
 epoch: 56, train_loss: 1.0797, test_loss: 1.0756, test_f1: 0.4326
 epoch: 57, train_loss: 1.0759, test_loss: 1.0815, test_f1: 0.4256
 epoch: 58, train_loss: 1.0850, test_loss: 1.0737, test_f1: 0.4259
 epoch: 59, train_loss: 1.0907, test_loss: 1.0746, test_f1: 0.4230
 epoch: 60, train_loss: 1.0787, test_loss: 1.0755, test_f1: 0.4251
 epoch: 61, train_loss: 1.0772, test_loss: 1.0728, test_f1: 0.4283
 epoch: 62, train_loss: 1.0829, test_loss: 1.0728, test_f1: 0.4272
 epoch: 63, train_loss: 1.0778, test_loss: 1.0696, test_f1: 0.4363
 epoch: 64, train_loss: 1.0778, test_loss: 1.0676, test_f1: 0.4383
 epoch: 65, train_loss: 1.0724, test_loss: 1.0702, test_f1: 0.4317
 epoch: 66, train_loss: 1.0708, test_loss: 1.0691, test_f1: 0.4312
 epoch: 67, train_loss: 1.0662, test_loss: 1.0670, test_f1: 0.4359
 epoch: 68, train_loss: 1.0652, test_loss: 1.0677, test_f1: 0.4390
 epoch: 69, train_loss: 1.0668, test_loss: 1.0696, test_f1: 0.4370
 epoch: 70, train_loss: 1.0733, test_loss: 1.0678, test_f1: 0.4394
 epoch: 71, train_loss: 1.0638, test_loss: 1.0687, test_f1: 0.4395
 epoch: 72, train_loss: 1.0569, test_loss: 1.0690, test_f1: 0.4308
 epoch: 73, train_loss: 1.0589, test_loss: 1.0666, test_f1: 0.4301
 epoch: 74, train_loss: 1.0625, test_loss: 1.0701, test_f1: 0.4286
 epoch: 75, train_loss: 1.0568, test_loss: 1.0705, test_f1: 0.4292
 epoch: 76, train_loss: 1.0555, test_loss: 1.0663, test_f1: 0.4294
 epoch: 77, train_loss: 1.0506, test_loss: 1.0621, test_f1: 0.4359
 epoch: 78, train_loss: 1.0501, test_loss: 1.0645, test_f1: 0.4328
 epoch: 79, train_loss: 1.0563, test_loss: 1.0665, test_f1: 0.4394
 epoch: 80, train_loss: 1.0480, test_loss: 1.0661, test_f1: 0.4318
 epoch: 81, train_loss: 1.0584, test_loss: 1.0637, test_f1: 0.4331
 epoch: 82, train_loss: 1.0501, test_loss: 1.0663, test_f1: 0.4323
 epoch: 83, train_loss: 1.0558, test_loss: 1.0642, test_f1: 0.4353
 epoch: 84, train_loss: 1.0395, test_loss: 1.0625, test_f1: 0.4338
 epoch: 85, train_loss: 1.0433, test_loss: 1.0602, test_f1: 0.4338
 epoch: 86, train_loss: 1.0539, test_loss: 1.0616, test_f1: 0.4386
 epoch: 87, train_loss: 1.0471, test_loss: 1.0625, test_f1: 0.4396
 epoch: 88, train_loss: 1.0330, test_loss: 1.0593, test_f1: 0.4370
 epoch: 89, train_loss: 1.0376, test_loss: 1.0574, test_f1: 0.4382
 epoch: 90, train_loss: 1.0432, test_loss: 1.0592, test_f1: 0.4347
 epoch: 91, train_loss: 1.0299, test_loss: 1.0572, test_f1: 0.4383
 epoch: 92, train_loss: 1.0336, test_loss: 1.0522, test_f1: 0.4418
 epoch: 93, train_loss: 1.0414, test_loss: 1.0610, test_f1: 0.4305
 epoch: 94, train_loss: 1.0352, test_loss: 1.0599, test_f1: 0.4346
 epoch: 95, train_loss: 1.0317, test_loss: 1.0587, test_f1: 0.4403
 epoch: 96, train_loss: 1.0381, test_loss: 1.0567, test_f1: 0.4369
 epoch: 97, train_loss: 1.0308, test_loss: 1.0587, test_f1: 0.4346
 epoch: 98, train_loss: 1.0290, test_loss: 1.0550, test_f1: 0.4386
 epoch: 99, train_loss: 1.0275, test_loss: 1.0580, test_f1: 0.4408

Training completed in 516.16 seconds
Best F1: 0.4816 at epoch 61
Mean F1 across iterations: 0.4535  0.0184
========================FINAL RESULTS================================
FEGIN weighted F1: 0.4816  0.0184
python main.py --data ltspice_examples --representation component_component --model FEGIN --layers 5 --hiddens 32 --batch_size 128 --lr 0.0001 --emb_size 512 --epochs 100 --save_appendix component_component_L5_H32_BS128_LR0.0001_E512 --no_val
-----



STDERR:
  File "main.py", line 370, in <module>
    main()
  File "main.py", line 254, in main
    dataset = dataset_class(
  File "/home/philip/projects/ltspice_examples_code_repo/Circuit-Completion-Using-GNNs/component_classification_with_link_prediction_head/evaluation/FEGIN/kernel/circuit_datasets.py", line 15, in __init__
    self.data, self.slices = torch.load(self.processed_paths[0])
  File "/home/philip/.local/lib/python3.8/site-packages/torch/serialization.py", line 1040, in load
    warnings.warn(
  File "/usr/lib/python3.8/warnings.py", line 109, in _showwarnmsg
    sw(msg.message, msg.category, msg.filename, msg.lineno,
  File "main.py", line 47, in warn_with_traceback
    traceback.print_stack(file=log)
/home/philip/projects/ltspice_examples_code_repo/Circuit-Completion-Using-GNNs/component_classification_with_link_prediction_head/evaluation/FEGIN/kernel/circuit_datasets.py:15: FutureWarning: You are using `torch.load` with `weights_only=False` (the current default value), which uses the default pickle module implicitly. It is possible to construct malicious pickle data which will execute arbitrary code during unpickling (See https://github.com/pytorch/pytorch/blob/main/SECURITY.md#untrusted-models for more details). In a future release, the default value for `weights_only` will be flipped to `True`. This limits the functions that could be executed during unpickling. Arbitrary objects will no longer be allowed to be loaded via this mode unless they are explicitly allowlisted by the user via `torch.serialization.add_safe_globals`. We recommend you start setting `weights_only=True` for any use case where you don't have full control of the loaded file. Please open an issue on GitHub for any issues related to this experimental feature.
  self.data, self.slices = torch.load(self.processed_paths[0])
