STDOUT:
Results will be saved in /home/philip/projects/ltspice_examples_code_repo/Circuit-Completion-Using-GNNs/component_classification_with_link_prediction_head/evaluation/FEGIN/results/model_FEGIN_dataset_ltspice_demos
Command line input: python main.py --data ltspice_demos --representation component_component --model FEGIN --layers 4 --hiddens 16 --batch_size 32 --lr 0.01 --emb_size 512 --epochs 100 --save_appendix component_component_L4_H16_BS32_LR0.01_E512 --no_val
 is saved.
-----
ltspice_demos - FEGIN
Using 4 layers, 16 hidden units, h = 2
Loading component_component representation dataset
ENTERED
Training FEGIN on component_component representation
Train: 1565, Test: 383
##################ITERATION #0 ****************************************
 epoch: 0, train_loss: 1.2569, test_loss: 1.3656, test_f1: 0.3287
 epoch: 1, train_loss: 1.1840, test_loss: 1.2218, test_f1: 0.4239
 epoch: 2, train_loss: 1.1679, test_loss: 1.2626, test_f1: 0.3731
 epoch: 3, train_loss: 1.0701, test_loss: 1.2541, test_f1: 0.4059
 epoch: 4, train_loss: 1.0462, test_loss: 1.1655, test_f1: 0.3737
 epoch: 5, train_loss: 1.0022, test_loss: 1.1117, test_f1: 0.5381
 epoch: 6, train_loss: 0.9756, test_loss: 1.0931, test_f1: 0.5408
 epoch: 7, train_loss: 0.9576, test_loss: 1.3184, test_f1: 0.3743
 epoch: 8, train_loss: 0.9755, test_loss: 1.1369, test_f1: 0.5279
 epoch: 9, train_loss: 0.9412, test_loss: 1.0539, test_f1: 0.4229
 epoch: 10, train_loss: 0.9027, test_loss: 1.0759, test_f1: 0.5556
 epoch: 11, train_loss: 0.9090, test_loss: 1.1083, test_f1: 0.5214
 epoch: 12, train_loss: 0.8838, test_loss: 1.0904, test_f1: 0.5424
 epoch: 13, train_loss: 0.8899, test_loss: 1.1551, test_f1: 0.5205
 epoch: 14, train_loss: 0.8771, test_loss: 1.0402, test_f1: 0.5592
 epoch: 15, train_loss: 0.8777, test_loss: 1.0838, test_f1: 0.5635
 epoch: 16, train_loss: 0.8880, test_loss: 1.0369, test_f1: 0.4752
 epoch: 17, train_loss: 0.9066, test_loss: 1.0689, test_f1: 0.5479
 epoch: 18, train_loss: 0.8832, test_loss: 1.0646, test_f1: 0.5566
 epoch: 19, train_loss: 0.8768, test_loss: 1.0389, test_f1: 0.5680
 epoch: 20, train_loss: 0.8751, test_loss: 1.0642, test_f1: 0.5272
 epoch: 21, train_loss: 0.8683, test_loss: 1.0470, test_f1: 0.5257
 epoch: 22, train_loss: 0.8555, test_loss: 1.1666, test_f1: 0.5538
 epoch: 23, train_loss: 0.8724, test_loss: 1.1361, test_f1: 0.5820
 epoch: 24, train_loss: 0.8467, test_loss: 1.0601, test_f1: 0.5787
 epoch: 25, train_loss: 0.8568, test_loss: 1.4279, test_f1: 0.5815
 epoch: 26, train_loss: 0.8436, test_loss: 1.1070, test_f1: 0.4818
 epoch: 27, train_loss: 0.8776, test_loss: 1.0684, test_f1: 0.5131
 epoch: 28, train_loss: 0.9571, test_loss: 1.0531, test_f1: 0.4810
 epoch: 29, train_loss: 0.8910, test_loss: 1.0197, test_f1: 0.5797
 epoch: 30, train_loss: 0.8669, test_loss: 1.0523, test_f1: 0.5147
 epoch: 31, train_loss: 0.8627, test_loss: 1.0976, test_f1: 0.4746
 epoch: 32, train_loss: 0.8563, test_loss: 1.5984, test_f1: 0.5353
 epoch: 33, train_loss: 0.9080, test_loss: 1.2675, test_f1: 0.5176
 epoch: 34, train_loss: 0.8681, test_loss: 1.1690, test_f1: 0.5869
 epoch: 35, train_loss: 0.8575, test_loss: 1.0769, test_f1: 0.5286
 epoch: 36, train_loss: 0.8513, test_loss: 0.9824, test_f1: 0.5473
 epoch: 37, train_loss: 0.8620, test_loss: 1.0340, test_f1: 0.5354
 epoch: 38, train_loss: 0.8500, test_loss: 1.0809, test_f1: 0.5126
 epoch: 39, train_loss: 0.8376, test_loss: 0.9678, test_f1: 0.5576
 epoch: 40, train_loss: 0.8490, test_loss: 1.0793, test_f1: 0.5837
 epoch: 41, train_loss: 0.8325, test_loss: 1.4721, test_f1: 0.5955
 epoch: 42, train_loss: 0.8307, test_loss: 1.5662, test_f1: 0.5783
 epoch: 43, train_loss: 0.8339, test_loss: 1.3290, test_f1: 0.5717
 epoch: 44, train_loss: 0.8443, test_loss: 1.2991, test_f1: 0.5899
 epoch: 45, train_loss: 0.8200, test_loss: 1.3591, test_f1: 0.5557
 epoch: 46, train_loss: 0.8561, test_loss: 1.0566, test_f1: 0.5522
 epoch: 47, train_loss: 0.8095, test_loss: 1.1754, test_f1: 0.5334
 epoch: 48, train_loss: 0.8039, test_loss: 1.0388, test_f1: 0.4763
 epoch: 49, train_loss: 0.8275, test_loss: 1.0811, test_f1: 0.5713
 epoch: 50, train_loss: 0.8214, test_loss: 1.0411, test_f1: 0.5139
 epoch: 51, train_loss: 0.7926, test_loss: 1.1212, test_f1: 0.5642
 epoch: 52, train_loss: 0.7841, test_loss: 1.0509, test_f1: 0.6189
 epoch: 53, train_loss: 0.7939, test_loss: 1.0006, test_f1: 0.5684
 epoch: 54, train_loss: 0.7707, test_loss: 1.0006, test_f1: 0.6382
 epoch: 55, train_loss: 0.7940, test_loss: 1.0966, test_f1: 0.5585
 epoch: 56, train_loss: 0.7930, test_loss: 1.0793, test_f1: 0.6004
 epoch: 57, train_loss: 0.7821, test_loss: 1.0409, test_f1: 0.5933
 epoch: 58, train_loss: 0.7679, test_loss: 1.0761, test_f1: 0.6049
 epoch: 59, train_loss: 0.7534, test_loss: 1.1144, test_f1: 0.5944
 epoch: 60, train_loss: 0.7723, test_loss: 1.0381, test_f1: 0.5764
 epoch: 61, train_loss: 0.7566, test_loss: 1.0814, test_f1: 0.5530
 epoch: 62, train_loss: 0.7486, test_loss: 1.1684, test_f1: 0.5784
 epoch: 63, train_loss: 0.7735, test_loss: 1.0986, test_f1: 0.6257
 epoch: 64, train_loss: 0.7559, test_loss: 1.1115, test_f1: 0.5860
 epoch: 65, train_loss: 0.7552, test_loss: 1.0721, test_f1: 0.5881
 epoch: 66, train_loss: 0.7602, test_loss: 1.1373, test_f1: 0.5448
 epoch: 67, train_loss: 0.7679, test_loss: 1.1273, test_f1: 0.6320
 epoch: 68, train_loss: 0.7534, test_loss: 1.4659, test_f1: 0.6184
 epoch: 69, train_loss: 0.7568, test_loss: 1.2141, test_f1: 0.6034
 epoch: 70, train_loss: 0.7668, test_loss: 1.2308, test_f1: 0.5658
 epoch: 71, train_loss: 0.7408, test_loss: 1.2195, test_f1: 0.5679
 epoch: 72, train_loss: 0.7486, test_loss: 1.1871, test_f1: 0.6423
 epoch: 73, train_loss: 0.7616, test_loss: 1.2468, test_f1: 0.5867
 epoch: 74, train_loss: 0.7558, test_loss: 1.0516, test_f1: 0.5878
 epoch: 75, train_loss: 0.7357, test_loss: 1.3174, test_f1: 0.5719
 epoch: 76, train_loss: 0.7476, test_loss: 1.2528, test_f1: 0.5569
 epoch: 77, train_loss: 0.7451, test_loss: 1.4973, test_f1: 0.6034
 epoch: 78, train_loss: 0.7585, test_loss: 1.3090, test_f1: 0.5105
 epoch: 79, train_loss: 0.7530, test_loss: 1.1717, test_f1: 0.5603
 epoch: 80, train_loss: 0.7293, test_loss: 0.9868, test_f1: 0.6365
 epoch: 81, train_loss: 0.7390, test_loss: 1.1849, test_f1: 0.5317
 epoch: 82, train_loss: 0.7426, test_loss: 1.1764, test_f1: 0.5993
 epoch: 83, train_loss: 0.7473, test_loss: 1.1254, test_f1: 0.5741
 epoch: 84, train_loss: 0.7402, test_loss: 1.3068, test_f1: 0.5910
 epoch: 85, train_loss: 0.7155, test_loss: 1.5370, test_f1: 0.5532
 epoch: 86, train_loss: 0.7221, test_loss: 1.2328, test_f1: 0.6052
 epoch: 87, train_loss: 0.7201, test_loss: 1.2826, test_f1: 0.6059
 epoch: 88, train_loss: 0.7331, test_loss: 1.2858, test_f1: 0.5503
 epoch: 89, train_loss: 0.7327, test_loss: 1.1490, test_f1: 0.5701
 epoch: 90, train_loss: 0.7174, test_loss: 1.0854, test_f1: 0.5802
 epoch: 91, train_loss: 0.7410, test_loss: 1.2458, test_f1: 0.5576
 epoch: 92, train_loss: 0.7610, test_loss: 1.2170, test_f1: 0.5832
 epoch: 93, train_loss: 0.7695, test_loss: 1.1938, test_f1: 0.6093
 epoch: 94, train_loss: 0.7228, test_loss: 1.1004, test_f1: 0.6168
 epoch: 95, train_loss: 0.7298, test_loss: 1.2041, test_f1: 0.6250
 epoch: 96, train_loss: 0.7217, test_loss: 1.4580, test_f1: 0.5786
 epoch: 97, train_loss: 0.7232, test_loss: 1.2285, test_f1: 0.6226
 epoch: 98, train_loss: 0.7094, test_loss: 1.2664, test_f1: 0.5510
 epoch: 99, train_loss: 0.7367, test_loss: 1.1686, test_f1: 0.5852
##################ITERATION #1 ****************************************
 epoch: 0, train_loss: 1.2316, test_loss: 1.3438, test_f1: 0.2404
 epoch: 1, train_loss: 1.1603, test_loss: 1.2263, test_f1: 0.3600
 epoch: 2, train_loss: 1.1398, test_loss: 1.3026, test_f1: 0.3560
 epoch: 3, train_loss: 1.1017, test_loss: 1.2476, test_f1: 0.4489
 epoch: 4, train_loss: 1.0890, test_loss: 1.2003, test_f1: 0.4411
 epoch: 5, train_loss: 1.0685, test_loss: 1.2883, test_f1: 0.4028
 epoch: 6, train_loss: 1.0420, test_loss: 1.2252, test_f1: 0.3989
 epoch: 7, train_loss: 0.9879, test_loss: 1.0864, test_f1: 0.5272
 epoch: 8, train_loss: 0.9717, test_loss: 1.0185, test_f1: 0.5014
 epoch: 9, train_loss: 0.9653, test_loss: 1.0154, test_f1: 0.5524
 epoch: 10, train_loss: 0.9375, test_loss: 1.1054, test_f1: 0.4963
 epoch: 11, train_loss: 0.9131, test_loss: 1.0403, test_f1: 0.5436
 epoch: 12, train_loss: 0.8999, test_loss: 1.0499, test_f1: 0.5457
 epoch: 13, train_loss: 0.9028, test_loss: 1.2713, test_f1: 0.4804
 epoch: 14, train_loss: 0.8883, test_loss: 1.0286, test_f1: 0.5765
 epoch: 15, train_loss: 0.8849, test_loss: 1.0837, test_f1: 0.5252
 epoch: 16, train_loss: 0.8835, test_loss: 0.9887, test_f1: 0.5539
 epoch: 17, train_loss: 0.8726, test_loss: 1.0529, test_f1: 0.5655
 epoch: 18, train_loss: 0.8695, test_loss: 1.0128, test_f1: 0.5589
 epoch: 19, train_loss: 0.8546, test_loss: 1.0386, test_f1: 0.5171
 epoch: 20, train_loss: 0.8726, test_loss: 1.0043, test_f1: 0.5762
 epoch: 21, train_loss: 0.8748, test_loss: 1.0574, test_f1: 0.5528
 epoch: 22, train_loss: 0.8808, test_loss: 1.0434, test_f1: 0.5613
 epoch: 23, train_loss: 0.8566, test_loss: 1.0960, test_f1: 0.4381
 epoch: 24, train_loss: 0.8441, test_loss: 1.0548, test_f1: 0.5546
 epoch: 25, train_loss: 0.8432, test_loss: 1.1015, test_f1: 0.4840
 epoch: 26, train_loss: 0.8379, test_loss: 1.0908, test_f1: 0.5124
 epoch: 27, train_loss: 0.8706, test_loss: 1.1076, test_f1: 0.5616
 epoch: 28, train_loss: 0.8571, test_loss: 1.0653, test_f1: 0.5477
 epoch: 29, train_loss: 0.8732, test_loss: 1.1090, test_f1: 0.5574
 epoch: 30, train_loss: 0.8292, test_loss: 1.0344, test_f1: 0.5676
 epoch: 31, train_loss: 0.8352, test_loss: 1.1321, test_f1: 0.5885
 epoch: 32, train_loss: 0.8551, test_loss: 1.0730, test_f1: 0.5396
 epoch: 33, train_loss: 0.8300, test_loss: 1.2389, test_f1: 0.5361
 epoch: 34, train_loss: 0.8517, test_loss: 1.1994, test_f1: 0.5244
 epoch: 35, train_loss: 0.8252, test_loss: 1.0562, test_f1: 0.5805
 epoch: 36, train_loss: 0.8244, test_loss: 1.1199, test_f1: 0.5613
 epoch: 37, train_loss: 0.8269, test_loss: 1.1128, test_f1: 0.5210
 epoch: 38, train_loss: 0.8691, test_loss: 1.1769, test_f1: 0.5667
 epoch: 39, train_loss: 0.8743, test_loss: 1.3628, test_f1: 0.5327
 epoch: 40, train_loss: 0.8451, test_loss: 1.1837, test_f1: 0.5820
 epoch: 41, train_loss: 0.8204, test_loss: 1.2071, test_f1: 0.5631
 epoch: 42, train_loss: 0.8220, test_loss: 1.1653, test_f1: 0.5876
 epoch: 43, train_loss: 0.8430, test_loss: 1.0721, test_f1: 0.5551
 epoch: 44, train_loss: 0.8168, test_loss: 1.2498, test_f1: 0.5779
 epoch: 45, train_loss: 0.8410, test_loss: 1.3871, test_f1: 0.5129
 epoch: 46, train_loss: 0.8718, test_loss: 1.0891, test_f1: 0.5714
 epoch: 47, train_loss: 0.8278, test_loss: 1.1651, test_f1: 0.4947
 epoch: 48, train_loss: 0.8066, test_loss: 1.1369, test_f1: 0.5803
 epoch: 49, train_loss: 0.8089, test_loss: 1.1135, test_f1: 0.5923
 epoch: 50, train_loss: 0.8094, test_loss: 1.1670, test_f1: 0.5671
 epoch: 51, train_loss: 0.8201, test_loss: 1.1927, test_f1: 0.5348
 epoch: 52, train_loss: 0.7783, test_loss: 1.2189, test_f1: 0.5329
 epoch: 53, train_loss: 0.7771, test_loss: 1.1833, test_f1: 0.5563
 epoch: 54, train_loss: 0.7582, test_loss: 1.3060, test_f1: 0.5358
 epoch: 55, train_loss: 0.7673, test_loss: 1.3017, test_f1: 0.5212
 epoch: 56, train_loss: 0.7728, test_loss: 1.2890, test_f1: 0.5654
 epoch: 57, train_loss: 0.7577, test_loss: 1.2785, test_f1: 0.5660
 epoch: 58, train_loss: 0.7623, test_loss: 1.3699, test_f1: 0.5866
 epoch: 59, train_loss: 0.7708, test_loss: 1.2774, test_f1: 0.5657
 epoch: 60, train_loss: 0.7625, test_loss: 1.3378, test_f1: 0.5661
 epoch: 61, train_loss: 0.7594, test_loss: 1.3482, test_f1: 0.5213
 epoch: 62, train_loss: 0.7568, test_loss: 1.2180, test_f1: 0.5553
 epoch: 63, train_loss: 0.7590, test_loss: 1.2914, test_f1: 0.5766
 epoch: 64, train_loss: 0.7558, test_loss: 1.3252, test_f1: 0.5354
 epoch: 65, train_loss: 0.7625, test_loss: 1.3711, test_f1: 0.5430
 epoch: 66, train_loss: 0.7532, test_loss: 1.2183, test_f1: 0.5427
 epoch: 67, train_loss: 0.7676, test_loss: 1.2035, test_f1: 0.5483
 epoch: 68, train_loss: 0.7349, test_loss: 1.3303, test_f1: 0.5558
 epoch: 69, train_loss: 0.7374, test_loss: 1.2525, test_f1: 0.5797
 epoch: 70, train_loss: 0.7464, test_loss: 1.3811, test_f1: 0.5643
 epoch: 71, train_loss: 0.7384, test_loss: 1.4394, test_f1: 0.4980
 epoch: 72, train_loss: 0.7506, test_loss: 1.3125, test_f1: 0.5692
 epoch: 73, train_loss: 0.7667, test_loss: 1.2965, test_f1: 0.5509
 epoch: 74, train_loss: 0.7450, test_loss: 1.2944, test_f1: 0.5642
 epoch: 75, train_loss: 0.7440, test_loss: 1.3486, test_f1: 0.5543
 epoch: 76, train_loss: 0.7299, test_loss: 1.3925, test_f1: 0.5641
 epoch: 77, train_loss: 0.7525, test_loss: 1.2303, test_f1: 0.5345
 epoch: 78, train_loss: 0.7310, test_loss: 1.3641, test_f1: 0.5621
 epoch: 79, train_loss: 0.7255, test_loss: 1.3038, test_f1: 0.5668
 epoch: 80, train_loss: 0.7342, test_loss: 1.2588, test_f1: 0.5739
 epoch: 81, train_loss: 0.7279, test_loss: 1.3132, test_f1: 0.6008
 epoch: 82, train_loss: 0.7276, test_loss: 1.5434, test_f1: 0.5557
 epoch: 83, train_loss: 0.7236, test_loss: 1.4383, test_f1: 0.6032
 epoch: 84, train_loss: 0.7299, test_loss: 1.3682, test_f1: 0.5737
 epoch: 85, train_loss: 0.7279, test_loss: 1.6731, test_f1: 0.5589
 epoch: 86, train_loss: 0.7334, test_loss: 1.3551, test_f1: 0.5320
 epoch: 87, train_loss: 0.7632, test_loss: 1.3492, test_f1: 0.5770
 epoch: 88, train_loss: 0.7313, test_loss: 1.6085, test_f1: 0.5515
 epoch: 89, train_loss: 0.7273, test_loss: 1.2543, test_f1: 0.6039
 epoch: 90, train_loss: 0.7388, test_loss: 1.4914, test_f1: 0.5738
 epoch: 91, train_loss: 0.7196, test_loss: 1.4347, test_f1: 0.5803
 epoch: 92, train_loss: 0.7244, test_loss: 1.5111, test_f1: 0.5658
 epoch: 93, train_loss: 0.7197, test_loss: 1.3735, test_f1: 0.5540
 epoch: 94, train_loss: 0.7180, test_loss: 1.3325, test_f1: 0.5555
 epoch: 95, train_loss: 0.7217, test_loss: 1.5629, test_f1: 0.5741
 epoch: 96, train_loss: 0.7145, test_loss: 1.4434, test_f1: 0.5508
 epoch: 97, train_loss: 0.7247, test_loss: 1.3185, test_f1: 0.5530
 epoch: 98, train_loss: 0.7600, test_loss: 1.2298, test_f1: 0.5736
 epoch: 99, train_loss: 0.7351, test_loss: 1.4154, test_f1: 0.5608
##################ITERATION #2 ****************************************
 epoch: 0, train_loss: 1.2694, test_loss: 1.2425, test_f1: 0.3061
 epoch: 1, train_loss: 1.1840, test_loss: 1.2170, test_f1: 0.3358
 epoch: 2, train_loss: 1.1363, test_loss: 1.1731, test_f1: 0.4039
 epoch: 3, train_loss: 1.1052, test_loss: 1.1688, test_f1: 0.4050
 epoch: 4, train_loss: 1.0469, test_loss: 1.1678, test_f1: 0.3863
 epoch: 5, train_loss: 0.9966, test_loss: 1.1281, test_f1: 0.5166
 epoch: 6, train_loss: 0.9820, test_loss: 1.2106, test_f1: 0.4650
 epoch: 7, train_loss: 0.9753, test_loss: 1.1387, test_f1: 0.4892
 epoch: 8, train_loss: 0.9447, test_loss: 1.1164, test_f1: 0.3998
 epoch: 9, train_loss: 0.9114, test_loss: 1.1271, test_f1: 0.4087
 epoch: 10, train_loss: 0.9205, test_loss: 1.1562, test_f1: 0.5172
 epoch: 11, train_loss: 0.9144, test_loss: 1.0407, test_f1: 0.5375
 epoch: 12, train_loss: 0.9237, test_loss: 1.0796, test_f1: 0.4991
 epoch: 13, train_loss: 0.9150, test_loss: 1.0032, test_f1: 0.5271
 epoch: 14, train_loss: 0.9066, test_loss: 1.0391, test_f1: 0.4997
 epoch: 15, train_loss: 0.8909, test_loss: 1.1331, test_f1: 0.4950
 epoch: 16, train_loss: 0.9012, test_loss: 1.1192, test_f1: 0.4467
 epoch: 17, train_loss: 0.8841, test_loss: 1.1417, test_f1: 0.5100
 epoch: 18, train_loss: 0.8656, test_loss: 1.0459, test_f1: 0.4108
 epoch: 19, train_loss: 0.8788, test_loss: 1.1882, test_f1: 0.5388
 epoch: 20, train_loss: 0.8452, test_loss: 1.0459, test_f1: 0.4797
 epoch: 21, train_loss: 0.8534, test_loss: 1.0555, test_f1: 0.5175
 epoch: 22, train_loss: 0.8429, test_loss: 1.0699, test_f1: 0.5438
 epoch: 23, train_loss: 0.8487, test_loss: 1.1246, test_f1: 0.4907
 epoch: 24, train_loss: 0.8416, test_loss: 1.1860, test_f1: 0.4883
 epoch: 25, train_loss: 0.8510, test_loss: 1.0403, test_f1: 0.5322
 epoch: 26, train_loss: 0.8559, test_loss: 1.0734, test_f1: 0.5414
 epoch: 27, train_loss: 0.8185, test_loss: 1.0869, test_f1: 0.5676
 epoch: 28, train_loss: 0.8023, test_loss: 1.1556, test_f1: 0.4940
 epoch: 29, train_loss: 0.8344, test_loss: 1.1989, test_f1: 0.4258
 epoch: 30, train_loss: 0.8213, test_loss: 1.0663, test_f1: 0.5142
 epoch: 31, train_loss: 0.8349, test_loss: 1.1987, test_f1: 0.4760
 epoch: 32, train_loss: 0.8749, test_loss: 1.2154, test_f1: 0.4377
 epoch: 33, train_loss: 0.8804, test_loss: 1.2976, test_f1: 0.5005
 epoch: 34, train_loss: 0.8447, test_loss: 1.0464, test_f1: 0.5499
 epoch: 35, train_loss: 0.8390, test_loss: 1.0344, test_f1: 0.5365
 epoch: 36, train_loss: 0.8190, test_loss: 1.0551, test_f1: 0.5008
 epoch: 37, train_loss: 0.8182, test_loss: 1.0551, test_f1: 0.5230
 epoch: 38, train_loss: 0.8053, test_loss: 1.2022, test_f1: 0.5466
 epoch: 39, train_loss: 0.8032, test_loss: 1.0907, test_f1: 0.5803
 epoch: 40, train_loss: 0.8111, test_loss: 1.1283, test_f1: 0.5504
 epoch: 41, train_loss: 0.8003, test_loss: 1.2166, test_f1: 0.4991
 epoch: 42, train_loss: 0.7961, test_loss: 1.1902, test_f1: 0.5521
 epoch: 43, train_loss: 0.7826, test_loss: 1.3061, test_f1: 0.5464
 epoch: 44, train_loss: 0.7810, test_loss: 1.0722, test_f1: 0.5457
 epoch: 45, train_loss: 0.7959, test_loss: 1.0935, test_f1: 0.5852
 epoch: 46, train_loss: 0.7788, test_loss: 1.0828, test_f1: 0.5242
 epoch: 47, train_loss: 0.7853, test_loss: 1.1725, test_f1: 0.5124
 epoch: 48, train_loss: 0.8212, test_loss: 1.1629, test_f1: 0.5296
 epoch: 49, train_loss: 0.7866, test_loss: 1.1458, test_f1: 0.5665
 epoch: 50, train_loss: 0.7990, test_loss: 1.0666, test_f1: 0.5644
 epoch: 51, train_loss: 0.7899, test_loss: 1.0848, test_f1: 0.5485
 epoch: 52, train_loss: 0.7701, test_loss: 1.1706, test_f1: 0.5863
 epoch: 53, train_loss: 0.7561, test_loss: 1.0762, test_f1: 0.5549
 epoch: 54, train_loss: 0.7718, test_loss: 1.2778, test_f1: 0.5716
 epoch: 55, train_loss: 0.7458, test_loss: 1.1620, test_f1: 0.5200
 epoch: 56, train_loss: 0.7521, test_loss: 1.3432, test_f1: 0.5505
 epoch: 57, train_loss: 0.7534, test_loss: 1.1934, test_f1: 0.5504
 epoch: 58, train_loss: 0.7500, test_loss: 1.4289, test_f1: 0.5647
 epoch: 59, train_loss: 0.7340, test_loss: 1.3342, test_f1: 0.4898
 epoch: 60, train_loss: 0.7497, test_loss: 1.1570, test_f1: 0.5923
 epoch: 61, train_loss: 0.7438, test_loss: 1.1766, test_f1: 0.5411
 epoch: 62, train_loss: 0.7424, test_loss: 1.2173, test_f1: 0.5551
 epoch: 63, train_loss: 0.7400, test_loss: 1.2900, test_f1: 0.5961
 epoch: 64, train_loss: 0.7232, test_loss: 1.3467, test_f1: 0.5174
 epoch: 65, train_loss: 0.7382, test_loss: 1.1274, test_f1: 0.6041
 epoch: 66, train_loss: 0.7353, test_loss: 1.6175, test_f1: 0.4754
 epoch: 67, train_loss: 0.7709, test_loss: 1.1053, test_f1: 0.5562
 epoch: 68, train_loss: 0.7548, test_loss: 1.1671, test_f1: 0.5433
 epoch: 69, train_loss: 0.7429, test_loss: 1.2467, test_f1: 0.5891
 epoch: 70, train_loss: 0.7299, test_loss: 1.1037, test_f1: 0.5881
 epoch: 71, train_loss: 0.7569, test_loss: 1.2384, test_f1: 0.5031
 epoch: 72, train_loss: 0.7302, test_loss: 1.2202, test_f1: 0.5343
 epoch: 73, train_loss: 0.7418, test_loss: 1.1615, test_f1: 0.5731
 epoch: 74, train_loss: 0.7306, test_loss: 1.2909, test_f1: 0.4993
 epoch: 75, train_loss: 0.7069, test_loss: 1.2002, test_f1: 0.5595
 epoch: 76, train_loss: 0.7063, test_loss: 1.2083, test_f1: 0.5717
 epoch: 77, train_loss: 0.7220, test_loss: 1.3206, test_f1: 0.5697
 epoch: 78, train_loss: 0.7192, test_loss: 1.1825, test_f1: 0.5948
 epoch: 79, train_loss: 0.7189, test_loss: 1.1899, test_f1: 0.6112
 epoch: 80, train_loss: 0.7138, test_loss: 1.4185, test_f1: 0.5167
 epoch: 81, train_loss: 0.7045, test_loss: 1.2844, test_f1: 0.5958
 epoch: 82, train_loss: 0.7103, test_loss: 1.1992, test_f1: 0.5728
 epoch: 83, train_loss: 0.7247, test_loss: 1.2468, test_f1: 0.6050
 epoch: 84, train_loss: 0.7178, test_loss: 1.3574, test_f1: 0.5908
 epoch: 85, train_loss: 0.7067, test_loss: 1.3458, test_f1: 0.5541
 epoch: 86, train_loss: 0.7078, test_loss: 1.3338, test_f1: 0.5854
 epoch: 87, train_loss: 0.7041, test_loss: 1.2852, test_f1: 0.5673
 epoch: 88, train_loss: 0.7123, test_loss: 1.3645, test_f1: 0.5735
 epoch: 89, train_loss: 0.7230, test_loss: 1.4213, test_f1: 0.5361
 epoch: 90, train_loss: 0.7397, test_loss: 1.2222, test_f1: 0.5562
 epoch: 91, train_loss: 0.6922, test_loss: 1.1875, test_f1: 0.5941
 epoch: 92, train_loss: 0.6981, test_loss: 1.2418, test_f1: 0.5690
 epoch: 93, train_loss: 0.6857, test_loss: 1.2970, test_f1: 0.5778
 epoch: 94, train_loss: 0.6974, test_loss: 1.3563, test_f1: 0.5987
 epoch: 95, train_loss: 0.7070, test_loss: 1.2444, test_f1: 0.5751
 epoch: 96, train_loss: 0.7039, test_loss: 1.3763, test_f1: 0.6141
 epoch: 97, train_loss: 0.7072, test_loss: 1.3228, test_f1: 0.5908
 epoch: 98, train_loss: 0.6824, test_loss: 1.2901, test_f1: 0.5767
 epoch: 99, train_loss: 0.7002, test_loss: 1.3676, test_f1: 0.5811
##################ITERATION #3 ****************************************
 epoch: 0, train_loss: 1.2518, test_loss: 1.3584, test_f1: 0.2601
 epoch: 1, train_loss: 1.1904, test_loss: 1.3224, test_f1: 0.3212
 epoch: 2, train_loss: 1.1549, test_loss: 1.3101, test_f1: 0.3566
 epoch: 3, train_loss: 1.1197, test_loss: 1.3441, test_f1: 0.2406
 epoch: 4, train_loss: 1.0933, test_loss: 1.2296, test_f1: 0.3413
 epoch: 5, train_loss: 1.0247, test_loss: 1.1092, test_f1: 0.4983
 epoch: 6, train_loss: 1.0331, test_loss: 1.1230, test_f1: 0.4781
 epoch: 7, train_loss: 0.9936, test_loss: 1.1839, test_f1: 0.3830
 epoch: 8, train_loss: 0.9721, test_loss: 1.0825, test_f1: 0.4366
 epoch: 9, train_loss: 0.9609, test_loss: 1.0385, test_f1: 0.5428
 epoch: 10, train_loss: 0.9470, test_loss: 1.1754, test_f1: 0.4444
 epoch: 11, train_loss: 0.9527, test_loss: 1.0884, test_f1: 0.4894
 epoch: 12, train_loss: 0.9158, test_loss: 1.0172, test_f1: 0.4389
 epoch: 13, train_loss: 0.9053, test_loss: 1.0636, test_f1: 0.4416
 epoch: 14, train_loss: 0.9117, test_loss: 1.6190, test_f1: 0.4518
 epoch: 15, train_loss: 0.9278, test_loss: 1.8803, test_f1: 0.3386
 epoch: 16, train_loss: 0.9807, test_loss: 1.4195, test_f1: 0.3348
 epoch: 17, train_loss: 0.9371, test_loss: 1.1413, test_f1: 0.4293
 epoch: 18, train_loss: 0.9145, test_loss: 1.5810, test_f1: 0.4875
 epoch: 19, train_loss: 0.9019, test_loss: 1.1133, test_f1: 0.4526
 epoch: 20, train_loss: 0.8827, test_loss: 1.0722, test_f1: 0.4968
 epoch: 21, train_loss: 0.8888, test_loss: 1.2999, test_f1: 0.4641
 epoch: 22, train_loss: 0.8963, test_loss: 1.0919, test_f1: 0.4936
 epoch: 23, train_loss: 0.8977, test_loss: 1.0468, test_f1: 0.5265
 epoch: 24, train_loss: 0.8842, test_loss: 1.1144, test_f1: 0.5040
 epoch: 25, train_loss: 0.8756, test_loss: 1.0408, test_f1: 0.5454
 epoch: 26, train_loss: 0.8758, test_loss: 1.0592, test_f1: 0.5212
 epoch: 27, train_loss: 0.8639, test_loss: 1.0712, test_f1: 0.5180
 epoch: 28, train_loss: 0.8811, test_loss: 1.0839, test_f1: 0.5109
 epoch: 29, train_loss: 0.8738, test_loss: 1.1217, test_f1: 0.4546
 epoch: 30, train_loss: 0.8805, test_loss: 1.0044, test_f1: 0.5586
 epoch: 31, train_loss: 0.8514, test_loss: 1.0569, test_f1: 0.5674
 epoch: 32, train_loss: 0.8645, test_loss: 1.0171, test_f1: 0.5224
 epoch: 33, train_loss: 0.8883, test_loss: 1.7685, test_f1: 0.3441
 epoch: 34, train_loss: 0.8857, test_loss: 1.0539, test_f1: 0.4342
 epoch: 35, train_loss: 0.8718, test_loss: 1.0326, test_f1: 0.5314
 epoch: 36, train_loss: 0.8940, test_loss: 1.1268, test_f1: 0.4901
 epoch: 37, train_loss: 0.8652, test_loss: 1.0843, test_f1: 0.5332
 epoch: 38, train_loss: 0.8820, test_loss: 1.0814, test_f1: 0.4594
 epoch: 39, train_loss: 0.8556, test_loss: 1.0836, test_f1: 0.5394
 epoch: 40, train_loss: 0.8446, test_loss: 1.2270, test_f1: 0.5142
 epoch: 41, train_loss: 0.8555, test_loss: 1.0817, test_f1: 0.4985
 epoch: 42, train_loss: 0.8582, test_loss: 1.0808, test_f1: 0.5314
 epoch: 43, train_loss: 0.8628, test_loss: 1.0423, test_f1: 0.5579
 epoch: 44, train_loss: 0.8313, test_loss: 1.1431, test_f1: 0.5440
 epoch: 45, train_loss: 0.8552, test_loss: 1.0799, test_f1: 0.5272
 epoch: 46, train_loss: 0.8245, test_loss: 1.0829, test_f1: 0.5433
 epoch: 47, train_loss: 0.8587, test_loss: 1.2541, test_f1: 0.4918
 epoch: 48, train_loss: 0.8433, test_loss: 1.1217, test_f1: 0.5433
 epoch: 49, train_loss: 0.8550, test_loss: 1.2943, test_f1: 0.5141
 epoch: 50, train_loss: 0.8340, test_loss: 1.2281, test_f1: 0.5363
 epoch: 51, train_loss: 0.8409, test_loss: 1.1253, test_f1: 0.5353
 epoch: 52, train_loss: 0.8224, test_loss: 1.1149, test_f1: 0.5485
 epoch: 53, train_loss: 0.8124, test_loss: 1.1368, test_f1: 0.5420
 epoch: 54, train_loss: 0.8050, test_loss: 1.1395, test_f1: 0.5127
 epoch: 55, train_loss: 0.8127, test_loss: 1.5690, test_f1: 0.4856
 epoch: 56, train_loss: 0.7878, test_loss: 1.4120, test_f1: 0.4952
 epoch: 57, train_loss: 0.8221, test_loss: 1.1907, test_f1: 0.5139
 epoch: 58, train_loss: 0.8029, test_loss: 1.1612, test_f1: 0.5368
 epoch: 59, train_loss: 0.7923, test_loss: 1.1388, test_f1: 0.5337
 epoch: 60, train_loss: 0.8065, test_loss: 1.3213, test_f1: 0.5556
 epoch: 61, train_loss: 0.8111, test_loss: 1.1715, test_f1: 0.5303
 epoch: 62, train_loss: 0.7958, test_loss: 1.1704, test_f1: 0.5126
 epoch: 63, train_loss: 0.8118, test_loss: 1.1238, test_f1: 0.5105
 epoch: 64, train_loss: 0.7905, test_loss: 1.1303, test_f1: 0.5410
 epoch: 65, train_loss: 0.7855, test_loss: 1.1178, test_f1: 0.5439
 epoch: 66, train_loss: 0.7964, test_loss: 1.1486, test_f1: 0.5278
 epoch: 67, train_loss: 0.7973, test_loss: 1.1509, test_f1: 0.5311
 epoch: 68, train_loss: 0.7865, test_loss: 1.2477, test_f1: 0.5244
 epoch: 69, train_loss: 0.7885, test_loss: 1.1726, test_f1: 0.5604
 epoch: 70, train_loss: 0.7766, test_loss: 1.2267, test_f1: 0.5212
 epoch: 71, train_loss: 0.7766, test_loss: 1.1813, test_f1: 0.5301
 epoch: 72, train_loss: 0.8024, test_loss: 1.1586, test_f1: 0.5653
 epoch: 73, train_loss: 0.7968, test_loss: 1.1430, test_f1: 0.5265
 epoch: 74, train_loss: 0.7995, test_loss: 1.1453, test_f1: 0.5182
 epoch: 75, train_loss: 0.7855, test_loss: 1.5015, test_f1: 0.4650
 epoch: 76, train_loss: 0.7983, test_loss: 1.0879, test_f1: 0.5429
 epoch: 77, train_loss: 0.7726, test_loss: 1.0946, test_f1: 0.5443
 epoch: 78, train_loss: 0.7837, test_loss: 1.0933, test_f1: 0.5463
 epoch: 79, train_loss: 0.7758, test_loss: 1.1998, test_f1: 0.5568
 epoch: 80, train_loss: 0.7719, test_loss: 1.2251, test_f1: 0.5522
 epoch: 81, train_loss: 0.7941, test_loss: 1.1442, test_f1: 0.5502
 epoch: 82, train_loss: 0.7649, test_loss: 1.0959, test_f1: 0.5675
 epoch: 83, train_loss: 0.7736, test_loss: 1.1215, test_f1: 0.5652
 epoch: 84, train_loss: 0.7891, test_loss: 1.1409, test_f1: 0.5619
 epoch: 85, train_loss: 0.7636, test_loss: 1.2319, test_f1: 0.5674
 epoch: 86, train_loss: 0.7563, test_loss: 1.1524, test_f1: 0.5544
 epoch: 87, train_loss: 0.7774, test_loss: 1.3302, test_f1: 0.5561
 epoch: 88, train_loss: 0.7668, test_loss: 1.3890, test_f1: 0.5404
 epoch: 89, train_loss: 0.7741, test_loss: 1.2318, test_f1: 0.5355
 epoch: 90, train_loss: 0.7806, test_loss: 1.2133, test_f1: 0.5568
 epoch: 91, train_loss: 0.7580, test_loss: 1.2949, test_f1: 0.5348
 epoch: 92, train_loss: 0.7719, test_loss: 1.4689, test_f1: 0.5298
 epoch: 93, train_loss: 0.7686, test_loss: 1.4574, test_f1: 0.5321
 epoch: 94, train_loss: 0.7727, test_loss: 1.4664, test_f1: 0.5254
 epoch: 95, train_loss: 0.7804, test_loss: 1.1799, test_f1: 0.5365
 epoch: 96, train_loss: 0.7806, test_loss: 1.2430, test_f1: 0.5186
 epoch: 97, train_loss: 0.7424, test_loss: 1.2155, test_f1: 0.5480
 epoch: 98, train_loss: 0.7571, test_loss: 1.1895, test_f1: 0.5601
 epoch: 99, train_loss: 0.7670, test_loss: 1.2028, test_f1: 0.5372
##################ITERATION #4 ****************************************
 epoch: 0, train_loss: 1.2283, test_loss: 1.2904, test_f1: 0.2917
 epoch: 1, train_loss: 1.1315, test_loss: 1.3745, test_f1: 0.3564
 epoch: 2, train_loss: 1.1094, test_loss: 1.1453, test_f1: 0.4560
 epoch: 3, train_loss: 1.0446, test_loss: 1.4769, test_f1: 0.3239
 epoch: 4, train_loss: 1.0343, test_loss: 1.1313, test_f1: 0.4293
 epoch: 5, train_loss: 1.0258, test_loss: 1.0384, test_f1: 0.5261
 epoch: 6, train_loss: 0.9832, test_loss: 1.0731, test_f1: 0.4198
 epoch: 7, train_loss: 0.9774, test_loss: 1.0820, test_f1: 0.5271
 epoch: 8, train_loss: 0.9542, test_loss: 1.5527, test_f1: 0.4010
 epoch: 9, train_loss: 0.9423, test_loss: 1.1059, test_f1: 0.5108
 epoch: 10, train_loss: 0.9150, test_loss: 1.2052, test_f1: 0.4789
 epoch: 11, train_loss: 0.9152, test_loss: 1.0583, test_f1: 0.5312
 epoch: 12, train_loss: 0.9158, test_loss: 1.0372, test_f1: 0.5492
 epoch: 13, train_loss: 0.8973, test_loss: 0.9899, test_f1: 0.5576
 epoch: 14, train_loss: 0.9238, test_loss: 1.0055, test_f1: 0.5465
 epoch: 15, train_loss: 0.8914, test_loss: 1.2768, test_f1: 0.4686
 epoch: 16, train_loss: 0.9160, test_loss: 0.9978, test_f1: 0.5558
 epoch: 17, train_loss: 0.9033, test_loss: 1.0384, test_f1: 0.5660
 epoch: 18, train_loss: 0.8855, test_loss: 1.0412, test_f1: 0.5545
 epoch: 19, train_loss: 0.8792, test_loss: 0.9712, test_f1: 0.5613
 epoch: 20, train_loss: 0.8776, test_loss: 1.0241, test_f1: 0.5689
 epoch: 21, train_loss: 0.8988, test_loss: 0.9993, test_f1: 0.5237
 epoch: 22, train_loss: 0.8776, test_loss: 1.0504, test_f1: 0.5444
 epoch: 23, train_loss: 0.9016, test_loss: 1.0549, test_f1: 0.5478
 epoch: 24, train_loss: 0.8717, test_loss: 1.0664, test_f1: 0.5257
 epoch: 25, train_loss: 0.8683, test_loss: 0.9861, test_f1: 0.5293
 epoch: 26, train_loss: 0.8914, test_loss: 1.0520, test_f1: 0.5437
 epoch: 27, train_loss: 0.8856, test_loss: 1.0619, test_f1: 0.5653
 epoch: 28, train_loss: 0.8697, test_loss: 1.0794, test_f1: 0.5707
 epoch: 29, train_loss: 0.8838, test_loss: 1.0274, test_f1: 0.5593
 epoch: 30, train_loss: 0.8649, test_loss: 1.0640, test_f1: 0.5555
 epoch: 31, train_loss: 0.8723, test_loss: 1.0495, test_f1: 0.5849
 epoch: 32, train_loss: 0.8640, test_loss: 1.0282, test_f1: 0.5771
 epoch: 33, train_loss: 0.8475, test_loss: 1.0489, test_f1: 0.5947
 epoch: 34, train_loss: 0.8600, test_loss: 1.0526, test_f1: 0.5791
 epoch: 35, train_loss: 0.8563, test_loss: 0.9938, test_f1: 0.5750
 epoch: 36, train_loss: 0.8504, test_loss: 0.9593, test_f1: 0.5761
 epoch: 37, train_loss: 0.8530, test_loss: 1.1401, test_f1: 0.5804
 epoch: 38, train_loss: 0.8411, test_loss: 1.0904, test_f1: 0.5929
 epoch: 39, train_loss: 0.8336, test_loss: 1.1220, test_f1: 0.6187
 epoch: 40, train_loss: 0.8477, test_loss: 1.0608, test_f1: 0.5702
 epoch: 41, train_loss: 0.8447, test_loss: 1.0727, test_f1: 0.5672
 epoch: 42, train_loss: 0.8263, test_loss: 1.0819, test_f1: 0.6113
 epoch: 43, train_loss: 0.8529, test_loss: 1.1033, test_f1: 0.5602
 epoch: 44, train_loss: 0.8534, test_loss: 1.0198, test_f1: 0.5448
 epoch: 45, train_loss: 0.8156, test_loss: 1.1197, test_f1: 0.5898
 epoch: 46, train_loss: 0.8408, test_loss: 1.0075, test_f1: 0.5592
 epoch: 47, train_loss: 0.8295, test_loss: 1.2169, test_f1: 0.5879
 epoch: 48, train_loss: 0.8535, test_loss: 1.0370, test_f1: 0.5947
 epoch: 49, train_loss: 0.8388, test_loss: 1.0481, test_f1: 0.5761
 epoch: 50, train_loss: 0.8397, test_loss: 1.0777, test_f1: 0.5629
 epoch: 51, train_loss: 0.8178, test_loss: 1.0462, test_f1: 0.5982
 epoch: 52, train_loss: 0.8080, test_loss: 1.1131, test_f1: 0.5884
 epoch: 53, train_loss: 0.8203, test_loss: 1.0755, test_f1: 0.5998
 epoch: 54, train_loss: 0.7986, test_loss: 1.1882, test_f1: 0.5748
 epoch: 55, train_loss: 0.7748, test_loss: 1.0611, test_f1: 0.6046
 epoch: 56, train_loss: 0.7836, test_loss: 1.0984, test_f1: 0.5914
 epoch: 57, train_loss: 0.8167, test_loss: 1.0698, test_f1: 0.5467
 epoch: 58, train_loss: 0.8054, test_loss: 1.0411, test_f1: 0.5751
 epoch: 59, train_loss: 0.7899, test_loss: 1.1124, test_f1: 0.6219
 epoch: 60, train_loss: 0.7954, test_loss: 1.0310, test_f1: 0.6043
 epoch: 61, train_loss: 0.7881, test_loss: 1.0543, test_f1: 0.6103
 epoch: 62, train_loss: 0.7974, test_loss: 1.0433, test_f1: 0.5877
 epoch: 63, train_loss: 0.8010, test_loss: 1.0458, test_f1: 0.5901
 epoch: 64, train_loss: 0.7931, test_loss: 1.0125, test_f1: 0.5907
 epoch: 65, train_loss: 0.7857, test_loss: 1.0080, test_f1: 0.6038
 epoch: 66, train_loss: 0.7687, test_loss: 1.1193, test_f1: 0.6328
 epoch: 67, train_loss: 0.7736, test_loss: 1.0796, test_f1: 0.5906
 epoch: 68, train_loss: 0.7790, test_loss: 1.0017, test_f1: 0.5802
 epoch: 69, train_loss: 0.7857, test_loss: 1.0595, test_f1: 0.5745
 epoch: 70, train_loss: 0.7679, test_loss: 1.1047, test_f1: 0.6046
 epoch: 71, train_loss: 0.7619, test_loss: 1.1064, test_f1: 0.5776
 epoch: 72, train_loss: 0.7672, test_loss: 1.1306, test_f1: 0.6095
 epoch: 73, train_loss: 0.7543, test_loss: 1.2436, test_f1: 0.5814
 epoch: 74, train_loss: 0.7838, test_loss: 1.0359, test_f1: 0.5991
 epoch: 75, train_loss: 0.7618, test_loss: 1.0769, test_f1: 0.5615
 epoch: 76, train_loss: 0.7638, test_loss: 1.1397, test_f1: 0.6104
 epoch: 77, train_loss: 0.7868, test_loss: 1.0467, test_f1: 0.5955
 epoch: 78, train_loss: 0.7555, test_loss: 1.0876, test_f1: 0.5879
 epoch: 79, train_loss: 0.7499, test_loss: 1.1104, test_f1: 0.5856
 epoch: 80, train_loss: 0.7505, test_loss: 1.1070, test_f1: 0.5547
 epoch: 81, train_loss: 0.7510, test_loss: 1.0886, test_f1: 0.5702
 epoch: 82, train_loss: 0.7637, test_loss: 1.0616, test_f1: 0.5947
 epoch: 83, train_loss: 0.7399, test_loss: 1.1118, test_f1: 0.5857
 epoch: 84, train_loss: 0.7735, test_loss: 1.1533, test_f1: 0.5830
 epoch: 85, train_loss: 0.7353, test_loss: 1.0834, test_f1: 0.6305
 epoch: 86, train_loss: 0.7446, test_loss: 1.1374, test_f1: 0.5727
 epoch: 87, train_loss: 0.7474, test_loss: 1.1002, test_f1: 0.5986
 epoch: 88, train_loss: 0.7424, test_loss: 1.1396, test_f1: 0.6120
 epoch: 89, train_loss: 0.7616, test_loss: 1.0941, test_f1: 0.6012
 epoch: 90, train_loss: 0.7394, test_loss: 1.4099, test_f1: 0.5993
 epoch: 91, train_loss: 0.7602, test_loss: 1.0877, test_f1: 0.5801
 epoch: 92, train_loss: 0.7351, test_loss: 1.2918, test_f1: 0.6013
 epoch: 93, train_loss: 0.7251, test_loss: 1.3302, test_f1: 0.6126
 epoch: 94, train_loss: 0.7612, test_loss: 1.0932, test_f1: 0.6068
 epoch: 95, train_loss: 0.7457, test_loss: 1.0364, test_f1: 0.5858
 epoch: 96, train_loss: 0.7556, test_loss: 1.1766, test_f1: 0.5984
 epoch: 97, train_loss: 0.7181, test_loss: 1.1368, test_f1: 0.5923
 epoch: 98, train_loss: 0.7412, test_loss: 1.1163, test_f1: 0.5654
 epoch: 99, train_loss: 0.7430, test_loss: 1.0577, test_f1: 0.5643
##################ITERATION #5 ****************************************
 epoch: 0, train_loss: 1.2565, test_loss: 1.2480, test_f1: 0.3834
 epoch: 1, train_loss: 1.1530, test_loss: 1.3636, test_f1: 0.3303
 epoch: 2, train_loss: 1.1487, test_loss: 1.1933, test_f1: 0.4328
 epoch: 3, train_loss: 1.0790, test_loss: 1.0950, test_f1: 0.5329
 epoch: 4, train_loss: 1.0649, test_loss: 1.1441, test_f1: 0.4831
 epoch: 5, train_loss: 1.0150, test_loss: 1.1420, test_f1: 0.4785
 epoch: 6, train_loss: 0.9970, test_loss: 1.0703, test_f1: 0.4976
 epoch: 7, train_loss: 0.9784, test_loss: 1.1654, test_f1: 0.5141
 epoch: 8, train_loss: 0.9858, test_loss: 1.0605, test_f1: 0.5093
 epoch: 9, train_loss: 0.9772, test_loss: 1.2038, test_f1: 0.4147
 epoch: 10, train_loss: 0.9346, test_loss: 1.0300, test_f1: 0.4513
 epoch: 11, train_loss: 0.9363, test_loss: 1.0967, test_f1: 0.5308
 epoch: 12, train_loss: 0.9316, test_loss: 1.0342, test_f1: 0.5225
 epoch: 13, train_loss: 0.9222, test_loss: 1.0528, test_f1: 0.4810
 epoch: 14, train_loss: 0.9090, test_loss: 1.0138, test_f1: 0.5230
 epoch: 15, train_loss: 0.9082, test_loss: 1.0527, test_f1: 0.5127
 epoch: 16, train_loss: 0.9047, test_loss: 1.2245, test_f1: 0.4134
 epoch: 17, train_loss: 0.9051, test_loss: 1.1533, test_f1: 0.5128
 epoch: 18, train_loss: 0.9121, test_loss: 1.0259, test_f1: 0.4629
 epoch: 19, train_loss: 0.8932, test_loss: 1.0479, test_f1: 0.5013
 epoch: 20, train_loss: 0.8741, test_loss: 1.0974, test_f1: 0.4849
 epoch: 21, train_loss: 0.8678, test_loss: 1.0258, test_f1: 0.5126
 epoch: 22, train_loss: 0.8705, test_loss: 1.0102, test_f1: 0.5265
 epoch: 23, train_loss: 0.8644, test_loss: 1.0892, test_f1: 0.5376
 epoch: 24, train_loss: 0.8614, test_loss: 1.0512, test_f1: 0.5391
 epoch: 25, train_loss: 0.8725, test_loss: 1.1048, test_f1: 0.5286
 epoch: 26, train_loss: 0.8645, test_loss: 1.5793, test_f1: 0.3751
 epoch: 27, train_loss: 0.8774, test_loss: 1.1093, test_f1: 0.5128
 epoch: 28, train_loss: 0.8833, test_loss: 1.0181, test_f1: 0.5397
 epoch: 29, train_loss: 0.8546, test_loss: 1.0111, test_f1: 0.5306
 epoch: 30, train_loss: 0.8503, test_loss: 1.0514, test_f1: 0.5668
 epoch: 31, train_loss: 0.8404, test_loss: 1.1243, test_f1: 0.5029
 epoch: 32, train_loss: 0.8536, test_loss: 1.0440, test_f1: 0.5806
 epoch: 33, train_loss: 0.8729, test_loss: 1.0599, test_f1: 0.5244
 epoch: 34, train_loss: 0.8473, test_loss: 0.9853, test_f1: 0.5602
 epoch: 35, train_loss: 0.8881, test_loss: 1.0287, test_f1: 0.5816
 epoch: 36, train_loss: 0.8633, test_loss: 1.0295, test_f1: 0.5500
 epoch: 37, train_loss: 0.8521, test_loss: 1.0899, test_f1: 0.4784
 epoch: 38, train_loss: 0.8491, test_loss: 1.3318, test_f1: 0.4938
 epoch: 39, train_loss: 0.8646, test_loss: 1.0059, test_f1: 0.5103
 epoch: 40, train_loss: 0.8269, test_loss: 1.0987, test_f1: 0.5125
 epoch: 41, train_loss: 0.8353, test_loss: 1.0275, test_f1: 0.5590
 epoch: 42, train_loss: 0.8360, test_loss: 1.0365, test_f1: 0.5720
 epoch: 43, train_loss: 0.8187, test_loss: 1.1483, test_f1: 0.5326
 epoch: 44, train_loss: 0.8209, test_loss: 1.1011, test_f1: 0.5345
 epoch: 45, train_loss: 0.8386, test_loss: 1.1139, test_f1: 0.5095
 epoch: 46, train_loss: 0.8260, test_loss: 1.0300, test_f1: 0.5504
 epoch: 47, train_loss: 0.8206, test_loss: 1.0480, test_f1: 0.5865
 epoch: 48, train_loss: 0.8563, test_loss: 1.2372, test_f1: 0.3674
 epoch: 49, train_loss: 0.9291, test_loss: 1.0580, test_f1: 0.5185
 epoch: 50, train_loss: 0.8478, test_loss: 0.9954, test_f1: 0.5555
 epoch: 51, train_loss: 0.8298, test_loss: 0.9803, test_f1: 0.5693
 epoch: 52, train_loss: 0.8014, test_loss: 1.0225, test_f1: 0.5378
 epoch: 53, train_loss: 0.7985, test_loss: 1.0103, test_f1: 0.5761
 epoch: 54, train_loss: 0.7937, test_loss: 1.0085, test_f1: 0.6058
 epoch: 55, train_loss: 0.7947, test_loss: 1.0412, test_f1: 0.5849
 epoch: 56, train_loss: 0.7789, test_loss: 1.0408, test_f1: 0.5640
 epoch: 57, train_loss: 0.7635, test_loss: 1.1050, test_f1: 0.5661
 epoch: 58, train_loss: 0.7906, test_loss: 1.0278, test_f1: 0.5722
 epoch: 59, train_loss: 0.7935, test_loss: 1.0503, test_f1: 0.5811
 epoch: 60, train_loss: 0.7720, test_loss: 1.0390, test_f1: 0.5941
 epoch: 61, train_loss: 0.7747, test_loss: 1.1000, test_f1: 0.5732
 epoch: 62, train_loss: 0.7859, test_loss: 1.0299, test_f1: 0.5675
 epoch: 63, train_loss: 0.7765, test_loss: 1.0730, test_f1: 0.5668
 epoch: 64, train_loss: 0.7813, test_loss: 1.2119, test_f1: 0.5061
 epoch: 65, train_loss: 0.8005, test_loss: 1.1063, test_f1: 0.5873
 epoch: 66, train_loss: 0.7703, test_loss: 1.1230, test_f1: 0.6116
 epoch: 67, train_loss: 0.7776, test_loss: 1.1017, test_f1: 0.6100
 epoch: 68, train_loss: 0.7824, test_loss: 1.1433, test_f1: 0.5187
 epoch: 69, train_loss: 0.7591, test_loss: 1.1551, test_f1: 0.5618
 epoch: 70, train_loss: 0.7592, test_loss: 1.2244, test_f1: 0.6001
 epoch: 71, train_loss: 0.7556, test_loss: 1.2636, test_f1: 0.5739
 epoch: 72, train_loss: 0.7743, test_loss: 1.0218, test_f1: 0.6090
 epoch: 73, train_loss: 0.7675, test_loss: 1.0383, test_f1: 0.6091
 epoch: 74, train_loss: 0.7534, test_loss: 1.0654, test_f1: 0.5821
 epoch: 75, train_loss: 0.7851, test_loss: 1.0603, test_f1: 0.5765
 epoch: 76, train_loss: 0.7463, test_loss: 1.0599, test_f1: 0.5819
 epoch: 77, train_loss: 0.7572, test_loss: 1.0910, test_f1: 0.5590
 epoch: 78, train_loss: 0.7486, test_loss: 1.0836, test_f1: 0.5855
 epoch: 79, train_loss: 0.7568, test_loss: 1.1722, test_f1: 0.5536
 epoch: 80, train_loss: 0.7447, test_loss: 1.3267, test_f1: 0.5213
 epoch: 81, train_loss: 0.7541, test_loss: 1.1328, test_f1: 0.5369
 epoch: 82, train_loss: 0.7434, test_loss: 1.0859, test_f1: 0.5598
 epoch: 83, train_loss: 0.7387, test_loss: 1.0560, test_f1: 0.5727
 epoch: 84, train_loss: 0.7374, test_loss: 1.0408, test_f1: 0.5816
 epoch: 85, train_loss: 0.7367, test_loss: 1.1716, test_f1: 0.5385
 epoch: 86, train_loss: 0.7613, test_loss: 1.1719, test_f1: 0.5674
 epoch: 87, train_loss: 0.7592, test_loss: 1.1624, test_f1: 0.5611
 epoch: 88, train_loss: 0.7425, test_loss: 1.1092, test_f1: 0.5594
 epoch: 89, train_loss: 0.7444, test_loss: 1.0773, test_f1: 0.5604
 epoch: 90, train_loss: 0.7371, test_loss: 1.1912, test_f1: 0.5472
 epoch: 91, train_loss: 0.7417, test_loss: 1.1264, test_f1: 0.5369
 epoch: 92, train_loss: 0.7393, test_loss: 1.1410, test_f1: 0.5700
 epoch: 93, train_loss: 0.7314, test_loss: 1.2400, test_f1: 0.5420
 epoch: 94, train_loss: 0.7461, test_loss: 1.3388, test_f1: 0.5256
 epoch: 95, train_loss: 0.7435, test_loss: 1.1495, test_f1: 0.5500
 epoch: 96, train_loss: 0.7470, test_loss: 1.1227, test_f1: 0.5895
 epoch: 97, train_loss: 0.7150, test_loss: 1.1274, test_f1: 0.5874
 epoch: 98, train_loss: 0.7327, test_loss: 1.1524, test_f1: 0.5913
 epoch: 99, train_loss: 0.7168, test_loss: 1.2187, test_f1: 0.5499
##################ITERATION #6 ****************************************
 epoch: 0, train_loss: 1.2331, test_loss: 1.4317, test_f1: 0.2875
 epoch: 1, train_loss: 1.1383, test_loss: 1.2444, test_f1: 0.3955
 epoch: 2, train_loss: 1.0935, test_loss: 1.1742, test_f1: 0.4195
 epoch: 3, train_loss: 1.0546, test_loss: 1.2642, test_f1: 0.4049
 epoch: 4, train_loss: 1.0093, test_loss: 1.0756, test_f1: 0.4730
 epoch: 5, train_loss: 1.0099, test_loss: 1.4103, test_f1: 0.2494
 epoch: 6, train_loss: 0.9956, test_loss: 1.1148, test_f1: 0.3695
 epoch: 7, train_loss: 0.9586, test_loss: 1.0434, test_f1: 0.4866
 epoch: 8, train_loss: 0.9546, test_loss: 0.9723, test_f1: 0.5424
 epoch: 9, train_loss: 0.9537, test_loss: 1.0462, test_f1: 0.4863
 epoch: 10, train_loss: 0.9534, test_loss: 0.9682, test_f1: 0.4958
 epoch: 11, train_loss: 0.9374, test_loss: 0.9728, test_f1: 0.5686
 epoch: 12, train_loss: 0.9213, test_loss: 1.0151, test_f1: 0.5472
 epoch: 13, train_loss: 0.9154, test_loss: 1.0197, test_f1: 0.5244
 epoch: 14, train_loss: 0.8826, test_loss: 0.9754, test_f1: 0.5563
 epoch: 15, train_loss: 0.9003, test_loss: 0.9994, test_f1: 0.5425
 epoch: 16, train_loss: 0.8953, test_loss: 1.0817, test_f1: 0.4024
 epoch: 17, train_loss: 0.9090, test_loss: 0.9622, test_f1: 0.5718
 epoch: 18, train_loss: 0.8661, test_loss: 0.9973, test_f1: 0.5629
 epoch: 19, train_loss: 0.8751, test_loss: 0.9553, test_f1: 0.6076
 epoch: 20, train_loss: 0.8770, test_loss: 1.0828, test_f1: 0.4744
 epoch: 21, train_loss: 0.8791, test_loss: 0.9840, test_f1: 0.5656
 epoch: 22, train_loss: 0.8567, test_loss: 0.9934, test_f1: 0.5206
 epoch: 23, train_loss: 0.8626, test_loss: 1.0360, test_f1: 0.5209
 epoch: 24, train_loss: 0.8632, test_loss: 0.9923, test_f1: 0.5875
 epoch: 25, train_loss: 0.8703, test_loss: 0.9762, test_f1: 0.5612
 epoch: 26, train_loss: 0.8624, test_loss: 0.9309, test_f1: 0.5743
 epoch: 27, train_loss: 0.8618, test_loss: 1.9311, test_f1: 0.4319
 epoch: 28, train_loss: 0.9217, test_loss: 1.0038, test_f1: 0.5493
 epoch: 29, train_loss: 0.8292, test_loss: 1.1038, test_f1: 0.5602
 epoch: 30, train_loss: 0.8475, test_loss: 0.9546, test_f1: 0.5866
 epoch: 31, train_loss: 0.8409, test_loss: 1.0836, test_f1: 0.5168
 epoch: 32, train_loss: 0.8513, test_loss: 1.0893, test_f1: 0.5758
 epoch: 33, train_loss: 0.8709, test_loss: 1.0086, test_f1: 0.5867
 epoch: 34, train_loss: 0.8487, test_loss: 0.9986, test_f1: 0.5676
 epoch: 35, train_loss: 0.8362, test_loss: 1.0737, test_f1: 0.5041
 epoch: 36, train_loss: 0.8428, test_loss: 1.0250, test_f1: 0.5797
 epoch: 37, train_loss: 0.8255, test_loss: 1.0435, test_f1: 0.5753
 epoch: 38, train_loss: 0.8293, test_loss: 1.1205, test_f1: 0.5601
 epoch: 39, train_loss: 0.8407, test_loss: 1.0607, test_f1: 0.5551
 epoch: 40, train_loss: 0.8361, test_loss: 1.1262, test_f1: 0.5487
 epoch: 41, train_loss: 0.8396, test_loss: 1.1213, test_f1: 0.5838
 epoch: 42, train_loss: 0.8569, test_loss: 1.0434, test_f1: 0.5618
 epoch: 43, train_loss: 0.8397, test_loss: 1.0881, test_f1: 0.5517
 epoch: 44, train_loss: 0.8277, test_loss: 1.1148, test_f1: 0.5335
 epoch: 45, train_loss: 0.8350, test_loss: 1.0748, test_f1: 0.5379
 epoch: 46, train_loss: 0.8586, test_loss: 1.0775, test_f1: 0.5302
 epoch: 47, train_loss: 0.8321, test_loss: 1.1222, test_f1: 0.5892
 epoch: 48, train_loss: 0.8235, test_loss: 1.0976, test_f1: 0.5288
 epoch: 49, train_loss: 0.8256, test_loss: 0.9861, test_f1: 0.5702
 epoch: 50, train_loss: 0.8377, test_loss: 1.1396, test_f1: 0.5048
 epoch: 51, train_loss: 0.7881, test_loss: 1.0416, test_f1: 0.5814
 epoch: 52, train_loss: 0.7932, test_loss: 1.1315, test_f1: 0.5480
 epoch: 53, train_loss: 0.7939, test_loss: 1.0698, test_f1: 0.5851
 epoch: 54, train_loss: 0.7921, test_loss: 1.0339, test_f1: 0.5641
 epoch: 55, train_loss: 0.7976, test_loss: 1.1040, test_f1: 0.5957
 epoch: 56, train_loss: 0.7958, test_loss: 1.0746, test_f1: 0.5695
 epoch: 57, train_loss: 0.7756, test_loss: 1.1273, test_f1: 0.5676
 epoch: 58, train_loss: 0.8165, test_loss: 1.0776, test_f1: 0.5647
 epoch: 59, train_loss: 0.7866, test_loss: 1.1630, test_f1: 0.5836
 epoch: 60, train_loss: 0.7836, test_loss: 1.0792, test_f1: 0.5793
 epoch: 61, train_loss: 0.7799, test_loss: 1.2186, test_f1: 0.4936
 epoch: 62, train_loss: 0.7707, test_loss: 1.0960, test_f1: 0.5794
 epoch: 63, train_loss: 0.7891, test_loss: 1.1563, test_f1: 0.5817
 epoch: 64, train_loss: 0.7852, test_loss: 1.1911, test_f1: 0.5844
 epoch: 65, train_loss: 0.7714, test_loss: 1.0362, test_f1: 0.5561
 epoch: 66, train_loss: 0.7751, test_loss: 1.0602, test_f1: 0.6098
 epoch: 67, train_loss: 0.7856, test_loss: 1.1770, test_f1: 0.5314
 epoch: 68, train_loss: 0.7712, test_loss: 1.2676, test_f1: 0.5173
 epoch: 69, train_loss: 0.7525, test_loss: 1.1744, test_f1: 0.5564
 epoch: 70, train_loss: 0.7580, test_loss: 1.0204, test_f1: 0.5959
 epoch: 71, train_loss: 0.7702, test_loss: 1.2023, test_f1: 0.5892
 epoch: 72, train_loss: 0.7658, test_loss: 1.1556, test_f1: 0.5785
 epoch: 73, train_loss: 0.7790, test_loss: 1.1990, test_f1: 0.5952
 epoch: 74, train_loss: 0.7563, test_loss: 1.1133, test_f1: 0.5636
 epoch: 75, train_loss: 0.7629, test_loss: 1.2207, test_f1: 0.5585
 epoch: 76, train_loss: 0.7482, test_loss: 1.1719, test_f1: 0.6069
 epoch: 77, train_loss: 0.7595, test_loss: 1.0835, test_f1: 0.5919
 epoch: 78, train_loss: 0.7508, test_loss: 1.1328, test_f1: 0.5720
 epoch: 79, train_loss: 0.7792, test_loss: 1.1276, test_f1: 0.5641
 epoch: 80, train_loss: 0.7571, test_loss: 1.1125, test_f1: 0.5962
 epoch: 81, train_loss: 0.7653, test_loss: 1.2236, test_f1: 0.5048
 epoch: 82, train_loss: 0.7629, test_loss: 1.1674, test_f1: 0.5380
 epoch: 83, train_loss: 0.7473, test_loss: 1.1586, test_f1: 0.6132
 epoch: 84, train_loss: 0.7692, test_loss: 1.1823, test_f1: 0.5972
 epoch: 85, train_loss: 0.7478, test_loss: 1.1870, test_f1: 0.6209
 epoch: 86, train_loss: 0.7501, test_loss: 1.1830, test_f1: 0.5344
 epoch: 87, train_loss: 0.7584, test_loss: 1.2324, test_f1: 0.5344
 epoch: 88, train_loss: 0.7542, test_loss: 1.0913, test_f1: 0.5965
 epoch: 89, train_loss: 0.7352, test_loss: 1.2820, test_f1: 0.5951
 epoch: 90, train_loss: 0.7297, test_loss: 1.4009, test_f1: 0.5524
 epoch: 91, train_loss: 0.7422, test_loss: 1.3070, test_f1: 0.5431
 epoch: 92, train_loss: 0.7448, test_loss: 1.3685, test_f1: 0.5933
 epoch: 93, train_loss: 0.7352, test_loss: 1.1805, test_f1: 0.5531
 epoch: 94, train_loss: 0.7466, test_loss: 1.2952, test_f1: 0.5599
 epoch: 95, train_loss: 0.7695, test_loss: 1.1841, test_f1: 0.5689
 epoch: 96, train_loss: 0.7896, test_loss: 1.1221, test_f1: 0.5967
 epoch: 97, train_loss: 0.7598, test_loss: 1.2204, test_f1: 0.6166
 epoch: 98, train_loss: 0.7320, test_loss: 1.2048, test_f1: 0.5576
 epoch: 99, train_loss: 0.7146, test_loss: 1.2618, test_f1: 0.6103
##################ITERATION #7 ****************************************
 epoch: 0, train_loss: 1.2440, test_loss: 1.2096, test_f1: 0.3241
 epoch: 1, train_loss: 1.1363, test_loss: 1.1904, test_f1: 0.5082
 epoch: 2, train_loss: 1.0686, test_loss: 1.1255, test_f1: 0.3986
 epoch: 3, train_loss: 1.0446, test_loss: 1.0651, test_f1: 0.4326
 epoch: 4, train_loss: 0.9903, test_loss: 1.1474, test_f1: 0.4267
 epoch: 5, train_loss: 0.9957, test_loss: 1.2143, test_f1: 0.4059
 epoch: 6, train_loss: 0.9894, test_loss: 1.1218, test_f1: 0.4035
 epoch: 7, train_loss: 0.9453, test_loss: 1.1259, test_f1: 0.4303
 epoch: 8, train_loss: 0.9382, test_loss: 1.0331, test_f1: 0.5292
 epoch: 9, train_loss: 0.9243, test_loss: 1.1198, test_f1: 0.4923
 epoch: 10, train_loss: 0.9404, test_loss: 1.3337, test_f1: 0.4150
 epoch: 11, train_loss: 0.9406, test_loss: 1.0574, test_f1: 0.5185
 epoch: 12, train_loss: 0.9187, test_loss: 1.1131, test_f1: 0.4999
 epoch: 13, train_loss: 0.9034, test_loss: 1.1937, test_f1: 0.4340
 epoch: 14, train_loss: 0.8928, test_loss: 1.0473, test_f1: 0.5308
 epoch: 15, train_loss: 0.8818, test_loss: 1.0244, test_f1: 0.4897
 epoch: 16, train_loss: 0.9418, test_loss: 1.0380, test_f1: 0.5294
 epoch: 17, train_loss: 0.9037, test_loss: 1.0035, test_f1: 0.5242
 epoch: 18, train_loss: 0.9220, test_loss: 1.0062, test_f1: 0.4457
 epoch: 19, train_loss: 0.8891, test_loss: 1.0075, test_f1: 0.5210
 epoch: 20, train_loss: 0.9036, test_loss: 1.1123, test_f1: 0.4529
 epoch: 21, train_loss: 0.8953, test_loss: 1.0262, test_f1: 0.4567
 epoch: 22, train_loss: 0.8990, test_loss: 1.0930, test_f1: 0.4391
 epoch: 23, train_loss: 0.8851, test_loss: 1.0536, test_f1: 0.4537
 epoch: 24, train_loss: 0.8803, test_loss: 1.0078, test_f1: 0.4561
 epoch: 25, train_loss: 0.8700, test_loss: 1.0659, test_f1: 0.4297
 epoch: 26, train_loss: 0.8693, test_loss: 1.0065, test_f1: 0.5288
 epoch: 27, train_loss: 0.9124, test_loss: 1.0362, test_f1: 0.4668
 epoch: 28, train_loss: 0.8584, test_loss: 1.0115, test_f1: 0.5352
 epoch: 29, train_loss: 0.8703, test_loss: 1.0099, test_f1: 0.5060
 epoch: 30, train_loss: 0.8622, test_loss: 0.9884, test_f1: 0.5169
 epoch: 31, train_loss: 0.8693, test_loss: 0.9755, test_f1: 0.5105
 epoch: 32, train_loss: 0.8523, test_loss: 1.0153, test_f1: 0.5351
 epoch: 33, train_loss: 0.8618, test_loss: 0.9815, test_f1: 0.4410
 epoch: 34, train_loss: 0.8504, test_loss: 1.0349, test_f1: 0.4467
 epoch: 35, train_loss: 0.8815, test_loss: 1.0066, test_f1: 0.4700
 epoch: 36, train_loss: 0.8785, test_loss: 1.0359, test_f1: 0.4622
 epoch: 37, train_loss: 0.8596, test_loss: 0.9944, test_f1: 0.5217
 epoch: 38, train_loss: 0.8590, test_loss: 1.0080, test_f1: 0.5736
 epoch: 39, train_loss: 0.8523, test_loss: 1.0578, test_f1: 0.5007
 epoch: 40, train_loss: 0.8513, test_loss: 0.9888, test_f1: 0.5151
 epoch: 41, train_loss: 0.8466, test_loss: 0.9787, test_f1: 0.5187
 epoch: 42, train_loss: 0.8456, test_loss: 1.0266, test_f1: 0.4614
 epoch: 43, train_loss: 0.8484, test_loss: 0.9793, test_f1: 0.5686
 epoch: 44, train_loss: 0.8391, test_loss: 1.0516, test_f1: 0.5308
 epoch: 45, train_loss: 0.8422, test_loss: 0.9969, test_f1: 0.5022
 epoch: 46, train_loss: 0.8288, test_loss: 0.9846, test_f1: 0.5231
 epoch: 47, train_loss: 0.8247, test_loss: 1.0097, test_f1: 0.5114
 epoch: 48, train_loss: 0.8202, test_loss: 1.1220, test_f1: 0.4540
 epoch: 49, train_loss: 0.8580, test_loss: 1.0024, test_f1: 0.5575
 epoch: 50, train_loss: 0.8357, test_loss: 1.0304, test_f1: 0.5269
 epoch: 51, train_loss: 0.8349, test_loss: 0.9625, test_f1: 0.5142
 epoch: 52, train_loss: 0.8178, test_loss: 0.9826, test_f1: 0.5218
 epoch: 53, train_loss: 0.8172, test_loss: 1.0124, test_f1: 0.5697
 epoch: 54, train_loss: 0.8023, test_loss: 0.9903, test_f1: 0.5224
 epoch: 55, train_loss: 0.7978, test_loss: 1.0271, test_f1: 0.4626
 epoch: 56, train_loss: 0.8168, test_loss: 0.9762, test_f1: 0.4988
 epoch: 57, train_loss: 0.8082, test_loss: 1.0186, test_f1: 0.5141
 epoch: 58, train_loss: 0.7943, test_loss: 1.0829, test_f1: 0.4273
 epoch: 59, train_loss: 0.8162, test_loss: 0.9904, test_f1: 0.4635
 epoch: 60, train_loss: 0.8074, test_loss: 1.0330, test_f1: 0.5123
 epoch: 61, train_loss: 0.8199, test_loss: 1.0518, test_f1: 0.5343
 epoch: 62, train_loss: 0.8024, test_loss: 1.0541, test_f1: 0.4927
 epoch: 63, train_loss: 0.7868, test_loss: 1.0309, test_f1: 0.5003
 epoch: 64, train_loss: 0.7992, test_loss: 0.9960, test_f1: 0.5542
 epoch: 65, train_loss: 0.8006, test_loss: 0.9912, test_f1: 0.5568
 epoch: 66, train_loss: 0.7927, test_loss: 0.9940, test_f1: 0.4973
 epoch: 67, train_loss: 0.7833, test_loss: 1.0162, test_f1: 0.4904
 epoch: 68, train_loss: 0.7803, test_loss: 1.0306, test_f1: 0.5178
 epoch: 69, train_loss: 0.7700, test_loss: 1.0661, test_f1: 0.4640
 epoch: 70, train_loss: 0.7787, test_loss: 1.0313, test_f1: 0.4589
 epoch: 71, train_loss: 0.8047, test_loss: 1.0269, test_f1: 0.4569
 epoch: 72, train_loss: 0.7914, test_loss: 1.0295, test_f1: 0.5075
 epoch: 73, train_loss: 0.8007, test_loss: 1.0452, test_f1: 0.5262
 epoch: 74, train_loss: 0.7861, test_loss: 1.0273, test_f1: 0.5163
 epoch: 75, train_loss: 0.7853, test_loss: 0.9825, test_f1: 0.4930
 epoch: 76, train_loss: 0.7837, test_loss: 1.1082, test_f1: 0.4664
 epoch: 77, train_loss: 0.7898, test_loss: 0.9989, test_f1: 0.5154
 epoch: 78, train_loss: 0.7709, test_loss: 1.0123, test_f1: 0.4713
 epoch: 79, train_loss: 0.7780, test_loss: 1.0215, test_f1: 0.5411
 epoch: 80, train_loss: 0.7819, test_loss: 1.0586, test_f1: 0.5629
 epoch: 81, train_loss: 0.7766, test_loss: 1.0573, test_f1: 0.5659
 epoch: 82, train_loss: 0.7989, test_loss: 0.9895, test_f1: 0.5239
 epoch: 83, train_loss: 0.7849, test_loss: 1.0107, test_f1: 0.5365
 epoch: 84, train_loss: 0.7751, test_loss: 1.0179, test_f1: 0.4720
 epoch: 85, train_loss: 0.7818, test_loss: 1.0139, test_f1: 0.5506
 epoch: 86, train_loss: 0.7849, test_loss: 1.0395, test_f1: 0.5265
 epoch: 87, train_loss: 0.7704, test_loss: 1.0413, test_f1: 0.5220
 epoch: 88, train_loss: 0.7923, test_loss: 1.0563, test_f1: 0.4799
 epoch: 89, train_loss: 0.7743, test_loss: 1.0526, test_f1: 0.4554
 epoch: 90, train_loss: 0.7957, test_loss: 1.0107, test_f1: 0.4912
 epoch: 91, train_loss: 0.7699, test_loss: 1.0470, test_f1: 0.5187
 epoch: 92, train_loss: 0.7819, test_loss: 1.1134, test_f1: 0.5352
 epoch: 93, train_loss: 0.7764, test_loss: 1.1304, test_f1: 0.4793
 epoch: 94, train_loss: 0.7725, test_loss: 1.1088, test_f1: 0.4545
 epoch: 95, train_loss: 0.7492, test_loss: 1.0586, test_f1: 0.4731
 epoch: 96, train_loss: 0.7622, test_loss: 1.0730, test_f1: 0.4711
 epoch: 97, train_loss: 0.7626, test_loss: 1.1227, test_f1: 0.5045
 epoch: 98, train_loss: 0.7905, test_loss: 1.0173, test_f1: 0.4901
 epoch: 99, train_loss: 0.7554, test_loss: 1.0962, test_f1: 0.5490
##################ITERATION #8 ****************************************
 epoch: 0, train_loss: 1.2303, test_loss: 1.2373, test_f1: 0.4070
 epoch: 1, train_loss: 1.1545, test_loss: 1.1762, test_f1: 0.4097
 epoch: 2, train_loss: 1.1132, test_loss: 1.1540, test_f1: 0.3343
 epoch: 3, train_loss: 1.0982, test_loss: 1.1898, test_f1: 0.4359
 epoch: 4, train_loss: 1.1412, test_loss: 1.1906, test_f1: 0.3367
 epoch: 5, train_loss: 1.0766, test_loss: 1.1871, test_f1: 0.3585
 epoch: 6, train_loss: 1.0642, test_loss: 1.1615, test_f1: 0.4703
 epoch: 7, train_loss: 1.0482, test_loss: 1.1361, test_f1: 0.3441
 epoch: 8, train_loss: 1.0082, test_loss: 1.1944, test_f1: 0.3445
 epoch: 9, train_loss: 0.9745, test_loss: 1.1923, test_f1: 0.4139
 epoch: 10, train_loss: 0.9496, test_loss: 1.1194, test_f1: 0.4166
 epoch: 11, train_loss: 0.9466, test_loss: 1.1455, test_f1: 0.4711
 epoch: 12, train_loss: 0.9217, test_loss: 1.0213, test_f1: 0.5394
 epoch: 13, train_loss: 0.9117, test_loss: 1.0416, test_f1: 0.5749
 epoch: 14, train_loss: 0.9035, test_loss: 1.0284, test_f1: 0.5668
 epoch: 15, train_loss: 0.8814, test_loss: 1.0116, test_f1: 0.5781
 epoch: 16, train_loss: 0.8857, test_loss: 1.0649, test_f1: 0.5361
 epoch: 17, train_loss: 0.8796, test_loss: 1.0999, test_f1: 0.5710
 epoch: 18, train_loss: 0.8870, test_loss: 1.0010, test_f1: 0.5778
 epoch: 19, train_loss: 0.8685, test_loss: 1.0298, test_f1: 0.5624
 epoch: 20, train_loss: 0.8747, test_loss: 1.0009, test_f1: 0.5588
 epoch: 21, train_loss: 0.8637, test_loss: 1.0053, test_f1: 0.5343
 epoch: 22, train_loss: 0.8560, test_loss: 0.9903, test_f1: 0.4585
 epoch: 23, train_loss: 0.8943, test_loss: 1.3946, test_f1: 0.4188
 epoch: 24, train_loss: 0.8767, test_loss: 1.0131, test_f1: 0.4432
 epoch: 25, train_loss: 0.8746, test_loss: 1.0725, test_f1: 0.5021
 epoch: 26, train_loss: 0.8502, test_loss: 1.0234, test_f1: 0.5731
 epoch: 27, train_loss: 0.8685, test_loss: 1.0900, test_f1: 0.5412
 epoch: 28, train_loss: 0.8612, test_loss: 1.0623, test_f1: 0.5473
 epoch: 29, train_loss: 0.8549, test_loss: 1.0614, test_f1: 0.5189
 epoch: 30, train_loss: 0.8576, test_loss: 1.0503, test_f1: 0.5418
 epoch: 31, train_loss: 0.8436, test_loss: 1.0868, test_f1: 0.5052
 epoch: 32, train_loss: 0.8303, test_loss: 1.1393, test_f1: 0.5427
 epoch: 33, train_loss: 0.8264, test_loss: 0.9854, test_f1: 0.5368
 epoch: 34, train_loss: 0.8176, test_loss: 1.0443, test_f1: 0.5498
 epoch: 35, train_loss: 0.8293, test_loss: 1.0798, test_f1: 0.5255
 epoch: 36, train_loss: 0.8470, test_loss: 1.0308, test_f1: 0.5801
 epoch: 37, train_loss: 0.8484, test_loss: 1.0306, test_f1: 0.5873
 epoch: 38, train_loss: 0.8329, test_loss: 1.1019, test_f1: 0.5421
 epoch: 39, train_loss: 0.8137, test_loss: 1.2046, test_f1: 0.4697
 epoch: 40, train_loss: 0.8212, test_loss: 1.0766, test_f1: 0.5834
 epoch: 41, train_loss: 0.8269, test_loss: 1.1479, test_f1: 0.5005
 epoch: 42, train_loss: 0.8274, test_loss: 1.0528, test_f1: 0.5046
 epoch: 43, train_loss: 0.8452, test_loss: 0.9949, test_f1: 0.5549
 epoch: 44, train_loss: 0.8129, test_loss: 1.1137, test_f1: 0.4331
 epoch: 45, train_loss: 0.8066, test_loss: 1.1231, test_f1: 0.5064
 epoch: 46, train_loss: 0.8001, test_loss: 1.1081, test_f1: 0.5450
 epoch: 47, train_loss: 0.8165, test_loss: 1.0813, test_f1: 0.5484
 epoch: 48, train_loss: 0.8116, test_loss: 1.0883, test_f1: 0.5590
 epoch: 49, train_loss: 0.7861, test_loss: 1.1316, test_f1: 0.5694
 epoch: 50, train_loss: 0.8086, test_loss: 1.6806, test_f1: 0.4173
 epoch: 51, train_loss: 0.7847, test_loss: 1.0260, test_f1: 0.5757
 epoch: 52, train_loss: 0.7755, test_loss: 1.1373, test_f1: 0.5402
 epoch: 53, train_loss: 0.7853, test_loss: 1.2435, test_f1: 0.4678
 epoch: 54, train_loss: 0.7801, test_loss: 1.1231, test_f1: 0.5746
 epoch: 55, train_loss: 0.7674, test_loss: 1.0393, test_f1: 0.5677
 epoch: 56, train_loss: 0.7736, test_loss: 1.1724, test_f1: 0.5326
 epoch: 57, train_loss: 0.7838, test_loss: 1.1135, test_f1: 0.5542
 epoch: 58, train_loss: 0.7674, test_loss: 1.0845, test_f1: 0.5624
 epoch: 59, train_loss: 0.7609, test_loss: 1.1078, test_f1: 0.5310
 epoch: 60, train_loss: 0.7670, test_loss: 1.1002, test_f1: 0.5767
 epoch: 61, train_loss: 0.7758, test_loss: 1.0668, test_f1: 0.5608
 epoch: 62, train_loss: 0.7757, test_loss: 1.0876, test_f1: 0.5118
 epoch: 63, train_loss: 0.7638, test_loss: 1.1332, test_f1: 0.5848
 epoch: 64, train_loss: 0.7653, test_loss: 1.0978, test_f1: 0.5738
 epoch: 65, train_loss: 0.7490, test_loss: 1.0568, test_f1: 0.5470
 epoch: 66, train_loss: 0.7579, test_loss: 1.0573, test_f1: 0.5385
 epoch: 67, train_loss: 0.7512, test_loss: 1.1084, test_f1: 0.5713
 epoch: 68, train_loss: 0.7502, test_loss: 1.1001, test_f1: 0.5867
 epoch: 69, train_loss: 0.7552, test_loss: 1.1307, test_f1: 0.5480
 epoch: 70, train_loss: 0.7548, test_loss: 1.7346, test_f1: 0.5062
 epoch: 71, train_loss: 0.7544, test_loss: 1.0492, test_f1: 0.5633
 epoch: 72, train_loss: 0.7523, test_loss: 1.0801, test_f1: 0.5512
 epoch: 73, train_loss: 0.7505, test_loss: 1.0885, test_f1: 0.5632
 epoch: 74, train_loss: 0.7593, test_loss: 1.0075, test_f1: 0.5811
 epoch: 75, train_loss: 0.7496, test_loss: 1.2357, test_f1: 0.5410
 epoch: 76, train_loss: 0.7519, test_loss: 1.2512, test_f1: 0.4906
 epoch: 77, train_loss: 0.7526, test_loss: 1.0495, test_f1: 0.5814
 epoch: 78, train_loss: 0.7498, test_loss: 1.1514, test_f1: 0.5568
 epoch: 79, train_loss: 0.7367, test_loss: 1.2534, test_f1: 0.5051
 epoch: 80, train_loss: 0.7248, test_loss: 1.1225, test_f1: 0.5654
 epoch: 81, train_loss: 0.7805, test_loss: 1.0738, test_f1: 0.5632
 epoch: 82, train_loss: 0.7382, test_loss: 1.0657, test_f1: 0.5787
 epoch: 83, train_loss: 0.7331, test_loss: 1.1072, test_f1: 0.5720
 epoch: 84, train_loss: 0.7447, test_loss: 1.1036, test_f1: 0.5359
 epoch: 85, train_loss: 0.7331, test_loss: 1.1836, test_f1: 0.5495
 epoch: 86, train_loss: 0.7288, test_loss: 1.1193, test_f1: 0.5416
 epoch: 87, train_loss: 0.7431, test_loss: 1.1250, test_f1: 0.5902
 epoch: 88, train_loss: 0.7390, test_loss: 1.1340, test_f1: 0.5588
 epoch: 89, train_loss: 0.7522, test_loss: 1.0649, test_f1: 0.5879
 epoch: 90, train_loss: 0.7426, test_loss: 1.1185, test_f1: 0.5440
 epoch: 91, train_loss: 0.7361, test_loss: 1.1419, test_f1: 0.5488
 epoch: 92, train_loss: 0.7409, test_loss: 1.0983, test_f1: 0.4872
 epoch: 93, train_loss: 0.7360, test_loss: 1.3291, test_f1: 0.5025
 epoch: 94, train_loss: 0.7370, test_loss: 1.1279, test_f1: 0.5693
 epoch: 95, train_loss: 0.7345, test_loss: 1.2172, test_f1: 0.5827
 epoch: 96, train_loss: 0.7251, test_loss: 1.1112, test_f1: 0.5713
 epoch: 97, train_loss: 0.7174, test_loss: 1.1967, test_f1: 0.5758
 epoch: 98, train_loss: 0.7256, test_loss: 1.1206, test_f1: 0.5588
 epoch: 99, train_loss: 0.7332, test_loss: 1.6940, test_f1: 0.4550
##################ITERATION #9 ****************************************
 epoch: 0, train_loss: 1.3077, test_loss: 1.2680, test_f1: 0.3463
 epoch: 1, train_loss: 1.2225, test_loss: 1.2885, test_f1: 0.3637
 epoch: 2, train_loss: 1.2045, test_loss: 1.2295, test_f1: 0.3147
 epoch: 3, train_loss: 1.1860, test_loss: 1.2364, test_f1: 0.4006
 epoch: 4, train_loss: 1.1647, test_loss: 1.2956, test_f1: 0.2627
 epoch: 5, train_loss: 1.1436, test_loss: 1.3155, test_f1: 0.3171
 epoch: 6, train_loss: 1.1118, test_loss: 1.1857, test_f1: 0.4572
 epoch: 7, train_loss: 1.1061, test_loss: 1.1711, test_f1: 0.4505
 epoch: 8, train_loss: 1.0942, test_loss: 1.2028, test_f1: 0.3054
 epoch: 9, train_loss: 1.0594, test_loss: 1.2133, test_f1: 0.4183
 epoch: 10, train_loss: 1.0505, test_loss: 1.2236, test_f1: 0.3769
 epoch: 11, train_loss: 1.0437, test_loss: 1.1412, test_f1: 0.4555
 epoch: 12, train_loss: 1.0179, test_loss: 1.0796, test_f1: 0.3910
 epoch: 13, train_loss: 0.9940, test_loss: 1.2420, test_f1: 0.3729
 epoch: 14, train_loss: 0.9997, test_loss: 1.1010, test_f1: 0.4793
 epoch: 15, train_loss: 0.9746, test_loss: 1.1115, test_f1: 0.3971
 epoch: 16, train_loss: 0.9356, test_loss: 1.1537, test_f1: 0.3742
 epoch: 17, train_loss: 0.9356, test_loss: 1.1110, test_f1: 0.5197
 epoch: 18, train_loss: 0.9355, test_loss: 1.0592, test_f1: 0.4763
 epoch: 19, train_loss: 0.9371, test_loss: 1.1774, test_f1: 0.4505
 epoch: 20, train_loss: 0.9537, test_loss: 1.0802, test_f1: 0.3997
 epoch: 21, train_loss: 0.9011, test_loss: 0.9734, test_f1: 0.4379
 epoch: 22, train_loss: 0.9277, test_loss: 1.1103, test_f1: 0.4986
 epoch: 23, train_loss: 0.9057, test_loss: 1.0490, test_f1: 0.4931
 epoch: 24, train_loss: 0.9091, test_loss: 1.0234, test_f1: 0.5625
 epoch: 25, train_loss: 0.9046, test_loss: 1.1377, test_f1: 0.4765
 epoch: 26, train_loss: 0.9025, test_loss: 1.0477, test_f1: 0.4907
 epoch: 27, train_loss: 0.9040, test_loss: 1.0974, test_f1: 0.3879
 epoch: 28, train_loss: 0.8917, test_loss: 1.0045, test_f1: 0.5441
 epoch: 29, train_loss: 0.8938, test_loss: 1.0533, test_f1: 0.4226
 epoch: 30, train_loss: 0.8751, test_loss: 1.0642, test_f1: 0.4168
 epoch: 31, train_loss: 0.8695, test_loss: 1.0484, test_f1: 0.5263
 epoch: 32, train_loss: 0.8734, test_loss: 1.0601, test_f1: 0.5351
 epoch: 33, train_loss: 0.8737, test_loss: 1.0989, test_f1: 0.5218
 epoch: 34, train_loss: 0.8848, test_loss: 1.0319, test_f1: 0.5628
 epoch: 35, train_loss: 0.9223, test_loss: 1.1361, test_f1: 0.4533
 epoch: 36, train_loss: 0.9195, test_loss: 1.0037, test_f1: 0.5224
 epoch: 37, train_loss: 0.8885, test_loss: 0.9968, test_f1: 0.5597
 epoch: 38, train_loss: 0.8857, test_loss: 1.0515, test_f1: 0.4395
 epoch: 39, train_loss: 0.8744, test_loss: 1.0700, test_f1: 0.4273
 epoch: 40, train_loss: 0.8829, test_loss: 0.9908, test_f1: 0.5470
 epoch: 41, train_loss: 0.8555, test_loss: 1.0223, test_f1: 0.5354
 epoch: 42, train_loss: 0.8507, test_loss: 1.0788, test_f1: 0.5386
 epoch: 43, train_loss: 0.8537, test_loss: 1.1333, test_f1: 0.5278
 epoch: 44, train_loss: 0.8454, test_loss: 1.0155, test_f1: 0.5749
 epoch: 45, train_loss: 0.8416, test_loss: 1.1272, test_f1: 0.5711
 epoch: 46, train_loss: 0.8559, test_loss: 1.1406, test_f1: 0.5055
 epoch: 47, train_loss: 0.8585, test_loss: 1.0606, test_f1: 0.5448
 epoch: 48, train_loss: 0.8416, test_loss: 1.0691, test_f1: 0.5164
 epoch: 49, train_loss: 0.8498, test_loss: 0.9932, test_f1: 0.5624
 epoch: 50, train_loss: 0.8481, test_loss: 1.0623, test_f1: 0.5220
 epoch: 51, train_loss: 0.8264, test_loss: 1.0257, test_f1: 0.5427
 epoch: 52, train_loss: 0.8221, test_loss: 1.0360, test_f1: 0.5732
 epoch: 53, train_loss: 0.8139, test_loss: 1.0117, test_f1: 0.5780
 epoch: 54, train_loss: 0.8156, test_loss: 1.0424, test_f1: 0.5253
 epoch: 55, train_loss: 0.7998, test_loss: 1.0296, test_f1: 0.5696
 epoch: 56, train_loss: 0.8039, test_loss: 1.1153, test_f1: 0.5545
 epoch: 57, train_loss: 0.8102, test_loss: 1.0557, test_f1: 0.5371
 epoch: 58, train_loss: 0.8240, test_loss: 1.0574, test_f1: 0.5584
 epoch: 59, train_loss: 0.7992, test_loss: 1.0825, test_f1: 0.5490
 epoch: 60, train_loss: 0.8082, test_loss: 1.1491, test_f1: 0.5233
 epoch: 61, train_loss: 0.7891, test_loss: 1.1136, test_f1: 0.5347
 epoch: 62, train_loss: 0.7951, test_loss: 1.1456, test_f1: 0.5401
 epoch: 63, train_loss: 0.7903, test_loss: 1.0985, test_f1: 0.5408
 epoch: 64, train_loss: 0.7811, test_loss: 1.1255, test_f1: 0.5420
 epoch: 65, train_loss: 0.7865, test_loss: 1.1099, test_f1: 0.5554
 epoch: 66, train_loss: 0.8144, test_loss: 1.0553, test_f1: 0.5581
 epoch: 67, train_loss: 0.7820, test_loss: 1.0871, test_f1: 0.5470
 epoch: 68, train_loss: 0.7773, test_loss: 1.0713, test_f1: 0.5489
 epoch: 69, train_loss: 0.7648, test_loss: 1.1045, test_f1: 0.5160
 epoch: 70, train_loss: 0.7770, test_loss: 1.0893, test_f1: 0.5645
 epoch: 71, train_loss: 0.7657, test_loss: 1.0424, test_f1: 0.5709
 epoch: 72, train_loss: 0.7724, test_loss: 1.1068, test_f1: 0.5548
 epoch: 73, train_loss: 0.7844, test_loss: 1.1012, test_f1: 0.5756
 epoch: 74, train_loss: 0.7772, test_loss: 1.1238, test_f1: 0.5737
 epoch: 75, train_loss: 0.7756, test_loss: 1.0830, test_f1: 0.5556
 epoch: 76, train_loss: 0.7737, test_loss: 1.1120, test_f1: 0.5539
 epoch: 77, train_loss: 0.7597, test_loss: 1.0884, test_f1: 0.5556
 epoch: 78, train_loss: 0.7564, test_loss: 1.0613, test_f1: 0.5581
 epoch: 79, train_loss: 0.7588, test_loss: 1.1177, test_f1: 0.5727
 epoch: 80, train_loss: 0.7591, test_loss: 1.0683, test_f1: 0.5506
 epoch: 81, train_loss: 0.7542, test_loss: 1.0241, test_f1: 0.5936
 epoch: 82, train_loss: 0.7631, test_loss: 1.1148, test_f1: 0.5899
 epoch: 83, train_loss: 0.7537, test_loss: 1.1387, test_f1: 0.5190
 epoch: 84, train_loss: 0.7329, test_loss: 1.0767, test_f1: 0.5290
 epoch: 85, train_loss: 0.7434, test_loss: 1.1221, test_f1: 0.5627
 epoch: 86, train_loss: 0.7539, test_loss: 1.0045, test_f1: 0.5966
 epoch: 87, train_loss: 0.7305, test_loss: 1.0758, test_f1: 0.5684
 epoch: 88, train_loss: 0.7294, test_loss: 1.0968, test_f1: 0.5861
 epoch: 89, train_loss: 0.7357, test_loss: 1.0293, test_f1: 0.6168
 epoch: 90, train_loss: 0.7417, test_loss: 1.5778, test_f1: 0.4317
 epoch: 91, train_loss: 0.7629, test_loss: 1.1853, test_f1: 0.5316
 epoch: 92, train_loss: 0.7557, test_loss: 1.0508, test_f1: 0.5984
 epoch: 93, train_loss: 0.7411, test_loss: 1.0976, test_f1: 0.5693
 epoch: 94, train_loss: 0.7294, test_loss: 1.0819, test_f1: 0.5775
 epoch: 95, train_loss: 0.7474, test_loss: 1.0816, test_f1: 0.5513
 epoch: 96, train_loss: 0.7387, test_loss: 1.1363, test_f1: 0.5712
 epoch: 97, train_loss: 0.7431, test_loss: 1.0392, test_f1: 0.5996
 epoch: 98, train_loss: 0.7601, test_loss: 1.0152, test_f1: 0.5859
 epoch: 99, train_loss: 0.7461, test_loss: 1.0067, test_f1: 0.6063

Training completed in 961.38 seconds
Best F1: 0.6423 at epoch 72
Mean F1 across iterations: 0.6074  0.0229
========================FINAL RESULTS================================
FEGIN weighted F1: 0.6423  0.0229
python main.py --data ltspice_demos --representation component_component --model FEGIN --layers 4 --hiddens 16 --batch_size 32 --lr 0.01 --emb_size 512 --epochs 100 --save_appendix component_component_L4_H16_BS32_LR0.01_E512 --no_val
-----



STDERR:
  File "main.py", line 370, in <module>
    main()
  File "main.py", line 254, in main
    dataset = dataset_class(
  File "/home/philip/projects/ltspice_examples_code_repo/Circuit-Completion-Using-GNNs/component_classification_with_link_prediction_head/evaluation/FEGIN/kernel/circuit_datasets.py", line 15, in __init__
    self.data, self.slices = torch.load(self.processed_paths[0])
  File "/home/philip/.local/lib/python3.8/site-packages/torch/serialization.py", line 1040, in load
    warnings.warn(
  File "/usr/lib/python3.8/warnings.py", line 109, in _showwarnmsg
    sw(msg.message, msg.category, msg.filename, msg.lineno,
  File "main.py", line 47, in warn_with_traceback
    traceback.print_stack(file=log)
/home/philip/projects/ltspice_examples_code_repo/Circuit-Completion-Using-GNNs/component_classification_with_link_prediction_head/evaluation/FEGIN/kernel/circuit_datasets.py:15: FutureWarning: You are using `torch.load` with `weights_only=False` (the current default value), which uses the default pickle module implicitly. It is possible to construct malicious pickle data which will execute arbitrary code during unpickling (See https://github.com/pytorch/pytorch/blob/main/SECURITY.md#untrusted-models for more details). In a future release, the default value for `weights_only` will be flipped to `True`. This limits the functions that could be executed during unpickling. Arbitrary objects will no longer be allowed to be loaded via this mode unless they are explicitly allowlisted by the user via `torch.serialization.add_safe_globals`. We recommend you start setting `weights_only=True` for any use case where you don't have full control of the loaded file. Please open an issue on GitHub for any issues related to this experimental feature.
  self.data, self.slices = torch.load(self.processed_paths[0])
