STDOUT:
Results will be saved in /home/philip/projects/ltspice_examples_code_repo/Circuit-Completion-Using-GNNs/component_classification_with_link_prediction_head/evaluation/FEGIN/results/model_FEGIN_dataset_ltspice_examples
Command line input: python main.py --data ltspice_examples --representation component_net --model FEGIN --layers 2 --hiddens 64 --batch_size 64 --lr 0.0001 --emb_size 128 --epochs 100 --save_appendix component_net_L2_H64_BS64_LR0.0001_E128 --no_val
 is saved.
-----
ltspice_examples - FEGIN
Using 2 layers, 64 hidden units, h = 2
Loading component_net representation dataset
ENTERED
Training FEGIN on component_net representation
Train: 3558, Test: 846
##################ITERATION #0 ****************************************
 epoch: 0, train_loss: 1.3604, test_loss: 1.3541, test_f1: 0.2270
 epoch: 1, train_loss: 1.3442, test_loss: 1.3421, test_f1: 0.2270
 epoch: 2, train_loss: 1.3303, test_loss: 1.3267, test_f1: 0.2270
 epoch: 3, train_loss: 1.3108, test_loss: 1.3026, test_f1: 0.2270
 epoch: 4, train_loss: 1.2851, test_loss: 1.2720, test_f1: 0.2271
 epoch: 5, train_loss: 1.2584, test_loss: 1.2466, test_f1: 0.2289
 epoch: 6, train_loss: 1.2361, test_loss: 1.2236, test_f1: 0.2677
 epoch: 7, train_loss: 1.2189, test_loss: 1.2000, test_f1: 0.3062
 epoch: 8, train_loss: 1.1944, test_loss: 1.1738, test_f1: 0.3396
 epoch: 9, train_loss: 1.1781, test_loss: 1.1470, test_f1: 0.3723
 epoch: 10, train_loss: 1.1542, test_loss: 1.1203, test_f1: 0.3961
 epoch: 11, train_loss: 1.1316, test_loss: 1.0900, test_f1: 0.4294
 epoch: 12, train_loss: 1.1060, test_loss: 1.0633, test_f1: 0.4438
 epoch: 13, train_loss: 1.0837, test_loss: 1.0408, test_f1: 0.4286
 epoch: 14, train_loss: 1.0617, test_loss: 1.0205, test_f1: 0.4394
 epoch: 15, train_loss: 1.0391, test_loss: 1.0074, test_f1: 0.4474
 epoch: 16, train_loss: 1.0242, test_loss: 0.9887, test_f1: 0.4620
 epoch: 17, train_loss: 1.0127, test_loss: 0.9724, test_f1: 0.4601
 epoch: 18, train_loss: 0.9973, test_loss: 0.9695, test_f1: 0.4686
 epoch: 19, train_loss: 0.9834, test_loss: 0.9574, test_f1: 0.4723
 epoch: 20, train_loss: 0.9761, test_loss: 0.9570, test_f1: 0.4759
 epoch: 21, train_loss: 0.9695, test_loss: 0.9545, test_f1: 0.4775
 epoch: 22, train_loss: 0.9599, test_loss: 0.9528, test_f1: 0.4755
 epoch: 23, train_loss: 0.9590, test_loss: 0.9466, test_f1: 0.4764
 epoch: 24, train_loss: 0.9478, test_loss: 0.9427, test_f1: 0.4755
 epoch: 25, train_loss: 0.9454, test_loss: 0.9282, test_f1: 0.4895
 epoch: 26, train_loss: 0.9410, test_loss: 0.9337, test_f1: 0.4901
 epoch: 27, train_loss: 0.9373, test_loss: 0.9419, test_f1: 0.4748
 epoch: 28, train_loss: 0.9299, test_loss: 0.9289, test_f1: 0.4940
 epoch: 29, train_loss: 0.9247, test_loss: 0.9328, test_f1: 0.4772
 epoch: 30, train_loss: 0.9252, test_loss: 0.9291, test_f1: 0.4869
 epoch: 31, train_loss: 0.9233, test_loss: 0.9299, test_f1: 0.4963
 epoch: 32, train_loss: 0.9199, test_loss: 0.9241, test_f1: 0.4898
 epoch: 33, train_loss: 0.9178, test_loss: 0.9206, test_f1: 0.4934
 epoch: 34, train_loss: 0.9171, test_loss: 0.9201, test_f1: 0.5036
 epoch: 35, train_loss: 0.9068, test_loss: 0.9126, test_f1: 0.5154
 epoch: 36, train_loss: 0.9128, test_loss: 0.9188, test_f1: 0.5000
 epoch: 37, train_loss: 0.8985, test_loss: 0.9104, test_f1: 0.5024
 epoch: 38, train_loss: 0.9000, test_loss: 0.9083, test_f1: 0.5174
 epoch: 39, train_loss: 0.8965, test_loss: 0.9038, test_f1: 0.5125
 epoch: 40, train_loss: 0.8904, test_loss: 0.9112, test_f1: 0.5025
 epoch: 41, train_loss: 0.8902, test_loss: 0.9219, test_f1: 0.4964
 epoch: 42, train_loss: 0.8840, test_loss: 0.8880, test_f1: 0.5242
 epoch: 43, train_loss: 0.8809, test_loss: 0.9057, test_f1: 0.5079
 epoch: 44, train_loss: 0.8762, test_loss: 0.9177, test_f1: 0.5085
 epoch: 45, train_loss: 0.8853, test_loss: 0.9000, test_f1: 0.5116
 epoch: 46, train_loss: 0.8831, test_loss: 0.8969, test_f1: 0.5213
 epoch: 47, train_loss: 0.8669, test_loss: 0.9094, test_f1: 0.5115
 epoch: 48, train_loss: 0.8727, test_loss: 0.8987, test_f1: 0.5065
 epoch: 49, train_loss: 0.8822, test_loss: 0.9210, test_f1: 0.5025
 epoch: 50, train_loss: 0.8724, test_loss: 0.9163, test_f1: 0.5138
 epoch: 51, train_loss: 0.8697, test_loss: 0.8951, test_f1: 0.5153
 epoch: 52, train_loss: 0.8575, test_loss: 0.9046, test_f1: 0.5114
 epoch: 53, train_loss: 0.8655, test_loss: 0.9088, test_f1: 0.5154
 epoch: 54, train_loss: 0.8651, test_loss: 0.8965, test_f1: 0.5111
 epoch: 55, train_loss: 0.8617, test_loss: 0.8819, test_f1: 0.5104
 epoch: 56, train_loss: 0.8585, test_loss: 0.8989, test_f1: 0.5117
 epoch: 57, train_loss: 0.8485, test_loss: 0.8956, test_f1: 0.5163
 epoch: 58, train_loss: 0.8601, test_loss: 0.9058, test_f1: 0.5151
 epoch: 59, train_loss: 0.8628, test_loss: 0.9153, test_f1: 0.5129
 epoch: 60, train_loss: 0.8582, test_loss: 0.8961, test_f1: 0.5197
 epoch: 61, train_loss: 0.8540, test_loss: 0.8891, test_f1: 0.5153
 epoch: 62, train_loss: 0.8476, test_loss: 0.8960, test_f1: 0.5184
 epoch: 63, train_loss: 0.8527, test_loss: 0.8962, test_f1: 0.5129
 epoch: 64, train_loss: 0.8579, test_loss: 0.9050, test_f1: 0.5179
 epoch: 65, train_loss: 0.8448, test_loss: 0.9024, test_f1: 0.5174
 epoch: 66, train_loss: 0.8447, test_loss: 0.8948, test_f1: 0.5237
 epoch: 67, train_loss: 0.8477, test_loss: 0.9209, test_f1: 0.5155
 epoch: 68, train_loss: 0.8510, test_loss: 0.9142, test_f1: 0.5130
 epoch: 69, train_loss: 0.8412, test_loss: 0.9038, test_f1: 0.5117
 epoch: 70, train_loss: 0.8435, test_loss: 0.9030, test_f1: 0.5193
 epoch: 71, train_loss: 0.8417, test_loss: 0.9099, test_f1: 0.5172
 epoch: 72, train_loss: 0.8414, test_loss: 0.9082, test_f1: 0.5180
 epoch: 73, train_loss: 0.8424, test_loss: 0.8911, test_f1: 0.5154
 epoch: 74, train_loss: 0.8447, test_loss: 0.9089, test_f1: 0.5246
 epoch: 75, train_loss: 0.8437, test_loss: 0.8984, test_f1: 0.5206
 epoch: 76, train_loss: 0.8387, test_loss: 0.9335, test_f1: 0.5166
 epoch: 77, train_loss: 0.8424, test_loss: 0.8963, test_f1: 0.5230
 epoch: 78, train_loss: 0.8376, test_loss: 0.9187, test_f1: 0.5239
 epoch: 79, train_loss: 0.8374, test_loss: 0.8959, test_f1: 0.5245
 epoch: 80, train_loss: 0.8332, test_loss: 0.9063, test_f1: 0.5181
 epoch: 81, train_loss: 0.8475, test_loss: 0.9204, test_f1: 0.5219
 epoch: 82, train_loss: 0.8278, test_loss: 0.9118, test_f1: 0.5262
 epoch: 83, train_loss: 0.8323, test_loss: 0.9284, test_f1: 0.5158
 epoch: 84, train_loss: 0.8366, test_loss: 0.9170, test_f1: 0.5256
 epoch: 85, train_loss: 0.8341, test_loss: 0.9005, test_f1: 0.5271
 epoch: 86, train_loss: 0.8319, test_loss: 0.9157, test_f1: 0.5236
 epoch: 87, train_loss: 0.8314, test_loss: 0.8965, test_f1: 0.5189
 epoch: 88, train_loss: 0.8256, test_loss: 0.9151, test_f1: 0.5247
 epoch: 89, train_loss: 0.8270, test_loss: 0.9001, test_f1: 0.5214
 epoch: 90, train_loss: 0.8275, test_loss: 0.9141, test_f1: 0.5271
 epoch: 91, train_loss: 0.8285, test_loss: 0.9197, test_f1: 0.5352
 epoch: 92, train_loss: 0.8334, test_loss: 0.9213, test_f1: 0.5260
 epoch: 93, train_loss: 0.8265, test_loss: 0.9077, test_f1: 0.5237
 epoch: 94, train_loss: 0.8293, test_loss: 0.9227, test_f1: 0.5258
 epoch: 95, train_loss: 0.8253, test_loss: 0.9076, test_f1: 0.5266
 epoch: 96, train_loss: 0.8194, test_loss: 0.9120, test_f1: 0.5272
 epoch: 97, train_loss: 0.8123, test_loss: 0.9287, test_f1: 0.5297
 epoch: 98, train_loss: 0.8179, test_loss: 0.9114, test_f1: 0.5289
 epoch: 99, train_loss: 0.8143, test_loss: 0.8957, test_f1: 0.5329
##################ITERATION #1 ****************************************
 epoch: 0, train_loss: 1.3085, test_loss: 1.2882, test_f1: 0.2270
 epoch: 1, train_loss: 1.2599, test_loss: 1.2365, test_f1: 0.2783
 epoch: 2, train_loss: 1.2364, test_loss: 1.2078, test_f1: 0.2909
 epoch: 3, train_loss: 1.2117, test_loss: 1.1759, test_f1: 0.3149
 epoch: 4, train_loss: 1.1844, test_loss: 1.1460, test_f1: 0.3564
 epoch: 5, train_loss: 1.1531, test_loss: 1.1157, test_f1: 0.3818
 epoch: 6, train_loss: 1.1264, test_loss: 1.0833, test_f1: 0.3810
 epoch: 7, train_loss: 1.0979, test_loss: 1.0523, test_f1: 0.3876
 epoch: 8, train_loss: 1.0684, test_loss: 1.0385, test_f1: 0.4012
 epoch: 9, train_loss: 1.0517, test_loss: 1.0174, test_f1: 0.4072
 epoch: 10, train_loss: 1.0352, test_loss: 1.0042, test_f1: 0.4336
 epoch: 11, train_loss: 1.0188, test_loss: 0.9948, test_f1: 0.4409
 epoch: 12, train_loss: 1.0080, test_loss: 0.9835, test_f1: 0.4529
 epoch: 13, train_loss: 0.9906, test_loss: 0.9755, test_f1: 0.4629
 epoch: 14, train_loss: 0.9866, test_loss: 0.9635, test_f1: 0.4634
 epoch: 15, train_loss: 0.9758, test_loss: 0.9575, test_f1: 0.4629
 epoch: 16, train_loss: 0.9754, test_loss: 0.9536, test_f1: 0.4684
 epoch: 17, train_loss: 0.9649, test_loss: 0.9520, test_f1: 0.4750
 epoch: 18, train_loss: 0.9590, test_loss: 0.9378, test_f1: 0.4929
 epoch: 19, train_loss: 0.9449, test_loss: 0.9375, test_f1: 0.4919
 epoch: 20, train_loss: 0.9411, test_loss: 0.9195, test_f1: 0.4866
 epoch: 21, train_loss: 0.9456, test_loss: 0.9214, test_f1: 0.4910
 epoch: 22, train_loss: 0.9279, test_loss: 0.9198, test_f1: 0.4974
 epoch: 23, train_loss: 0.9269, test_loss: 0.9165, test_f1: 0.4989
 epoch: 24, train_loss: 0.9205, test_loss: 0.9264, test_f1: 0.4979
 epoch: 25, train_loss: 0.9223, test_loss: 0.9108, test_f1: 0.5038
 epoch: 26, train_loss: 0.9136, test_loss: 0.9121, test_f1: 0.5102
 epoch: 27, train_loss: 0.9098, test_loss: 0.9151, test_f1: 0.5053
 epoch: 28, train_loss: 0.9069, test_loss: 0.9141, test_f1: 0.5179
 epoch: 29, train_loss: 0.9031, test_loss: 0.8999, test_f1: 0.5148
 epoch: 30, train_loss: 0.9019, test_loss: 0.8917, test_f1: 0.5135
 epoch: 31, train_loss: 0.8942, test_loss: 0.9018, test_f1: 0.5140
 epoch: 32, train_loss: 0.8984, test_loss: 0.8990, test_f1: 0.5159
 epoch: 33, train_loss: 0.8899, test_loss: 0.9099, test_f1: 0.5236
 epoch: 34, train_loss: 0.8930, test_loss: 0.9128, test_f1: 0.5326
 epoch: 35, train_loss: 0.8889, test_loss: 0.9020, test_f1: 0.5350
 epoch: 36, train_loss: 0.8791, test_loss: 0.8990, test_f1: 0.5350
 epoch: 37, train_loss: 0.8762, test_loss: 0.8931, test_f1: 0.5375
 epoch: 38, train_loss: 0.8751, test_loss: 0.9005, test_f1: 0.5287
 epoch: 39, train_loss: 0.8721, test_loss: 0.9176, test_f1: 0.5252
 epoch: 40, train_loss: 0.8647, test_loss: 0.9180, test_f1: 0.5222
 epoch: 41, train_loss: 0.8633, test_loss: 0.9068, test_f1: 0.5407
 epoch: 42, train_loss: 0.8703, test_loss: 0.9255, test_f1: 0.5236
 epoch: 43, train_loss: 0.8567, test_loss: 0.9192, test_f1: 0.5263
 epoch: 44, train_loss: 0.8597, test_loss: 0.8914, test_f1: 0.5481
 epoch: 45, train_loss: 0.8564, test_loss: 0.9024, test_f1: 0.5468
 epoch: 46, train_loss: 0.8584, test_loss: 0.9080, test_f1: 0.5293
 epoch: 47, train_loss: 0.8548, test_loss: 0.9133, test_f1: 0.5417
 epoch: 48, train_loss: 0.8563, test_loss: 0.9015, test_f1: 0.5393
 epoch: 49, train_loss: 0.8412, test_loss: 0.9178, test_f1: 0.5302
 epoch: 50, train_loss: 0.8364, test_loss: 0.9202, test_f1: 0.5287
 epoch: 51, train_loss: 0.8344, test_loss: 0.9157, test_f1: 0.5364
 epoch: 52, train_loss: 0.8413, test_loss: 0.9105, test_f1: 0.5504
 epoch: 53, train_loss: 0.8340, test_loss: 0.9119, test_f1: 0.5370
 epoch: 54, train_loss: 0.8340, test_loss: 0.9187, test_f1: 0.5318
 epoch: 55, train_loss: 0.8338, test_loss: 0.9240, test_f1: 0.5289
 epoch: 56, train_loss: 0.8274, test_loss: 0.9129, test_f1: 0.5601
 epoch: 57, train_loss: 0.8268, test_loss: 0.9128, test_f1: 0.5515
 epoch: 58, train_loss: 0.8339, test_loss: 0.9119, test_f1: 0.5543
 epoch: 59, train_loss: 0.8273, test_loss: 0.9130, test_f1: 0.5467
 epoch: 60, train_loss: 0.8254, test_loss: 0.9144, test_f1: 0.5338
 epoch: 61, train_loss: 0.8241, test_loss: 0.9117, test_f1: 0.5462
 epoch: 62, train_loss: 0.8228, test_loss: 0.9167, test_f1: 0.5487
 epoch: 63, train_loss: 0.8293, test_loss: 0.9208, test_f1: 0.5482
 epoch: 64, train_loss: 0.8179, test_loss: 0.9272, test_f1: 0.5432
 epoch: 65, train_loss: 0.8210, test_loss: 0.9193, test_f1: 0.5568
 epoch: 66, train_loss: 0.8194, test_loss: 0.9152, test_f1: 0.5558
 epoch: 67, train_loss: 0.8196, test_loss: 0.9193, test_f1: 0.5383
 epoch: 68, train_loss: 0.8219, test_loss: 0.9262, test_f1: 0.5415
 epoch: 69, train_loss: 0.8209, test_loss: 0.9227, test_f1: 0.5524
 epoch: 70, train_loss: 0.8132, test_loss: 0.9187, test_f1: 0.5531
 epoch: 71, train_loss: 0.8082, test_loss: 0.9257, test_f1: 0.5476
 epoch: 72, train_loss: 0.8092, test_loss: 0.9207, test_f1: 0.5476
 epoch: 73, train_loss: 0.8064, test_loss: 0.9266, test_f1: 0.5508
 epoch: 74, train_loss: 0.8084, test_loss: 0.9261, test_f1: 0.5376
 epoch: 75, train_loss: 0.8159, test_loss: 0.9163, test_f1: 0.5577
 epoch: 76, train_loss: 0.7999, test_loss: 0.9099, test_f1: 0.5663
 epoch: 77, train_loss: 0.8132, test_loss: 0.9206, test_f1: 0.5635
 epoch: 78, train_loss: 0.8012, test_loss: 0.9230, test_f1: 0.5512
 epoch: 79, train_loss: 0.8016, test_loss: 0.9260, test_f1: 0.5513
 epoch: 80, train_loss: 0.8075, test_loss: 0.9233, test_f1: 0.5460
 epoch: 81, train_loss: 0.7960, test_loss: 0.9210, test_f1: 0.5423
 epoch: 82, train_loss: 0.8033, test_loss: 0.9179, test_f1: 0.5651
 epoch: 83, train_loss: 0.8055, test_loss: 0.9273, test_f1: 0.5500
 epoch: 84, train_loss: 0.7945, test_loss: 0.9236, test_f1: 0.5400
 epoch: 85, train_loss: 0.7964, test_loss: 0.9315, test_f1: 0.5475
 epoch: 86, train_loss: 0.7948, test_loss: 0.9273, test_f1: 0.5568
 epoch: 87, train_loss: 0.7918, test_loss: 0.9224, test_f1: 0.5548
 epoch: 88, train_loss: 0.7992, test_loss: 0.9322, test_f1: 0.5519
 epoch: 89, train_loss: 0.7895, test_loss: 0.9304, test_f1: 0.5525
 epoch: 90, train_loss: 0.7912, test_loss: 0.9149, test_f1: 0.5666
 epoch: 91, train_loss: 0.7832, test_loss: 0.9307, test_f1: 0.5562
 epoch: 92, train_loss: 0.7936, test_loss: 0.9255, test_f1: 0.5663
 epoch: 93, train_loss: 0.7777, test_loss: 0.9291, test_f1: 0.5582
 epoch: 94, train_loss: 0.7910, test_loss: 0.9262, test_f1: 0.5696
 epoch: 95, train_loss: 0.7833, test_loss: 0.9371, test_f1: 0.5603
 epoch: 96, train_loss: 0.7883, test_loss: 0.9287, test_f1: 0.5576
 epoch: 97, train_loss: 0.7818, test_loss: 0.9419, test_f1: 0.5450
 epoch: 98, train_loss: 0.7846, test_loss: 0.9355, test_f1: 0.5692
 epoch: 99, train_loss: 0.7794, test_loss: 0.9390, test_f1: 0.5481
##################ITERATION #2 ****************************************
 epoch: 0, train_loss: 1.2858, test_loss: 1.2569, test_f1: 0.2270
 epoch: 1, train_loss: 1.2252, test_loss: 1.1798, test_f1: 0.3338
 epoch: 2, train_loss: 1.1896, test_loss: 1.1440, test_f1: 0.3421
 epoch: 3, train_loss: 1.1552, test_loss: 1.1112, test_f1: 0.3525
 epoch: 4, train_loss: 1.1236, test_loss: 1.0868, test_f1: 0.3615
 epoch: 5, train_loss: 1.0978, test_loss: 1.0608, test_f1: 0.3801
 epoch: 6, train_loss: 1.0781, test_loss: 1.0411, test_f1: 0.4048
 epoch: 7, train_loss: 1.0463, test_loss: 1.0208, test_f1: 0.4189
 epoch: 8, train_loss: 1.0358, test_loss: 1.0098, test_f1: 0.4307
 epoch: 9, train_loss: 1.0212, test_loss: 1.0017, test_f1: 0.4418
 epoch: 10, train_loss: 1.0121, test_loss: 0.9969, test_f1: 0.4512
 epoch: 11, train_loss: 1.0049, test_loss: 0.9883, test_f1: 0.4513
 epoch: 12, train_loss: 0.9988, test_loss: 0.9821, test_f1: 0.4654
 epoch: 13, train_loss: 0.9866, test_loss: 0.9815, test_f1: 0.4763
 epoch: 14, train_loss: 0.9782, test_loss: 0.9670, test_f1: 0.4773
 epoch: 15, train_loss: 0.9738, test_loss: 0.9750, test_f1: 0.4782
 epoch: 16, train_loss: 0.9714, test_loss: 0.9575, test_f1: 0.4839
 epoch: 17, train_loss: 0.9671, test_loss: 0.9548, test_f1: 0.4862
 epoch: 18, train_loss: 0.9551, test_loss: 0.9588, test_f1: 0.4861
 epoch: 19, train_loss: 0.9482, test_loss: 0.9499, test_f1: 0.4866
 epoch: 20, train_loss: 0.9439, test_loss: 0.9518, test_f1: 0.4894
 epoch: 21, train_loss: 0.9388, test_loss: 0.9434, test_f1: 0.4912
 epoch: 22, train_loss: 0.9420, test_loss: 0.9541, test_f1: 0.4933
 epoch: 23, train_loss: 0.9318, test_loss: 0.9416, test_f1: 0.4897
 epoch: 24, train_loss: 0.9273, test_loss: 0.9312, test_f1: 0.4993
 epoch: 25, train_loss: 0.9307, test_loss: 0.9224, test_f1: 0.5024
 epoch: 26, train_loss: 0.9232, test_loss: 0.9146, test_f1: 0.5036
 epoch: 27, train_loss: 0.9188, test_loss: 0.9237, test_f1: 0.5126
 epoch: 28, train_loss: 0.9181, test_loss: 0.9171, test_f1: 0.5217
 epoch: 29, train_loss: 0.9171, test_loss: 0.9165, test_f1: 0.5198
 epoch: 30, train_loss: 0.9180, test_loss: 0.9193, test_f1: 0.5266
 epoch: 31, train_loss: 0.9088, test_loss: 0.9182, test_f1: 0.5269
 epoch: 32, train_loss: 0.9040, test_loss: 0.9209, test_f1: 0.5318
 epoch: 33, train_loss: 0.9027, test_loss: 0.9136, test_f1: 0.5271
 epoch: 34, train_loss: 0.8983, test_loss: 0.8960, test_f1: 0.5312
 epoch: 35, train_loss: 0.8896, test_loss: 0.9232, test_f1: 0.5264
 epoch: 36, train_loss: 0.8887, test_loss: 0.9244, test_f1: 0.5231
 epoch: 37, train_loss: 0.8884, test_loss: 0.8893, test_f1: 0.5400
 epoch: 38, train_loss: 0.8835, test_loss: 0.9103, test_f1: 0.5333
 epoch: 39, train_loss: 0.8775, test_loss: 0.8947, test_f1: 0.5329
 epoch: 40, train_loss: 0.8808, test_loss: 0.9103, test_f1: 0.5358
 epoch: 41, train_loss: 0.8727, test_loss: 0.9010, test_f1: 0.5342
 epoch: 42, train_loss: 0.8743, test_loss: 0.9001, test_f1: 0.5335
 epoch: 43, train_loss: 0.8643, test_loss: 0.9085, test_f1: 0.5331
 epoch: 44, train_loss: 0.8663, test_loss: 0.8921, test_f1: 0.5378
 epoch: 45, train_loss: 0.8602, test_loss: 0.9145, test_f1: 0.5316
 epoch: 46, train_loss: 0.8597, test_loss: 0.8975, test_f1: 0.5352
 epoch: 47, train_loss: 0.8600, test_loss: 0.9142, test_f1: 0.5312
 epoch: 48, train_loss: 0.8587, test_loss: 0.8636, test_f1: 0.5459
 epoch: 49, train_loss: 0.8596, test_loss: 0.8878, test_f1: 0.5438
 epoch: 50, train_loss: 0.8486, test_loss: 0.9031, test_f1: 0.5340
 epoch: 51, train_loss: 0.8524, test_loss: 0.8923, test_f1: 0.5377
 epoch: 52, train_loss: 0.8416, test_loss: 0.8985, test_f1: 0.5392
 epoch: 53, train_loss: 0.8526, test_loss: 0.8947, test_f1: 0.5390
 epoch: 54, train_loss: 0.8398, test_loss: 0.8682, test_f1: 0.5466
 epoch: 55, train_loss: 0.8467, test_loss: 0.8936, test_f1: 0.5337
 epoch: 56, train_loss: 0.8338, test_loss: 0.8785, test_f1: 0.5369
 epoch: 57, train_loss: 0.8371, test_loss: 0.8866, test_f1: 0.5345
 epoch: 58, train_loss: 0.8312, test_loss: 0.9017, test_f1: 0.5330
 epoch: 59, train_loss: 0.8314, test_loss: 0.8854, test_f1: 0.5340
 epoch: 60, train_loss: 0.8253, test_loss: 0.8936, test_f1: 0.5448
 epoch: 61, train_loss: 0.8343, test_loss: 0.8720, test_f1: 0.5377
 epoch: 62, train_loss: 0.8254, test_loss: 0.8883, test_f1: 0.5281
 epoch: 63, train_loss: 0.8235, test_loss: 0.8704, test_f1: 0.5448
 epoch: 64, train_loss: 0.8266, test_loss: 0.8912, test_f1: 0.5299
 epoch: 65, train_loss: 0.8328, test_loss: 0.8831, test_f1: 0.5395
 epoch: 66, train_loss: 0.8257, test_loss: 0.8960, test_f1: 0.5356
 epoch: 67, train_loss: 0.8290, test_loss: 0.8945, test_f1: 0.5260
 epoch: 68, train_loss: 0.8327, test_loss: 0.8924, test_f1: 0.5249
 epoch: 69, train_loss: 0.8266, test_loss: 0.8944, test_f1: 0.5283
 epoch: 70, train_loss: 0.8234, test_loss: 0.8830, test_f1: 0.5351
 epoch: 71, train_loss: 0.8157, test_loss: 0.8781, test_f1: 0.5387
 epoch: 72, train_loss: 0.8228, test_loss: 0.8888, test_f1: 0.5301
 epoch: 73, train_loss: 0.8173, test_loss: 0.8958, test_f1: 0.5268
 epoch: 74, train_loss: 0.8226, test_loss: 0.8874, test_f1: 0.5317
 epoch: 75, train_loss: 0.8190, test_loss: 0.8646, test_f1: 0.5442
 epoch: 76, train_loss: 0.8158, test_loss: 0.8816, test_f1: 0.5242
 epoch: 77, train_loss: 0.8222, test_loss: 0.8875, test_f1: 0.5254
 epoch: 78, train_loss: 0.8134, test_loss: 0.9070, test_f1: 0.5253
 epoch: 79, train_loss: 0.8162, test_loss: 0.8914, test_f1: 0.5488
 epoch: 80, train_loss: 0.8068, test_loss: 0.8906, test_f1: 0.5306
 epoch: 81, train_loss: 0.8137, test_loss: 0.8661, test_f1: 0.5362
 epoch: 82, train_loss: 0.8113, test_loss: 0.9325, test_f1: 0.5292
 epoch: 83, train_loss: 0.8184, test_loss: 0.8809, test_f1: 0.5404
 epoch: 84, train_loss: 0.8120, test_loss: 0.8902, test_f1: 0.5342
 epoch: 85, train_loss: 0.8049, test_loss: 0.8820, test_f1: 0.5418
 epoch: 86, train_loss: 0.8081, test_loss: 0.8623, test_f1: 0.5310
 epoch: 87, train_loss: 0.8008, test_loss: 0.8945, test_f1: 0.5310
 epoch: 88, train_loss: 0.8019, test_loss: 0.8618, test_f1: 0.5326
 epoch: 89, train_loss: 0.8052, test_loss: 0.8929, test_f1: 0.5459
 epoch: 90, train_loss: 0.8074, test_loss: 0.8967, test_f1: 0.5326
 epoch: 91, train_loss: 0.7956, test_loss: 0.8862, test_f1: 0.5309
 epoch: 92, train_loss: 0.7960, test_loss: 0.8823, test_f1: 0.5304
 epoch: 93, train_loss: 0.7943, test_loss: 0.8681, test_f1: 0.5337
 epoch: 94, train_loss: 0.8016, test_loss: 0.8910, test_f1: 0.5357
 epoch: 95, train_loss: 0.8022, test_loss: 0.8751, test_f1: 0.5329
 epoch: 96, train_loss: 0.7968, test_loss: 0.8761, test_f1: 0.5366
 epoch: 97, train_loss: 0.7872, test_loss: 0.8800, test_f1: 0.5339
 epoch: 98, train_loss: 0.7862, test_loss: 0.8983, test_f1: 0.5364
 epoch: 99, train_loss: 0.7934, test_loss: 0.8831, test_f1: 0.5319
##################ITERATION #3 ****************************************
 epoch: 0, train_loss: 1.2625, test_loss: 1.2215, test_f1: 0.2487
 epoch: 1, train_loss: 1.2000, test_loss: 1.1622, test_f1: 0.3595
 epoch: 2, train_loss: 1.1745, test_loss: 1.1319, test_f1: 0.3724
 epoch: 3, train_loss: 1.1479, test_loss: 1.1018, test_f1: 0.4321
 epoch: 4, train_loss: 1.1271, test_loss: 1.0789, test_f1: 0.4458
 epoch: 5, train_loss: 1.1006, test_loss: 1.0593, test_f1: 0.4416
 epoch: 6, train_loss: 1.0774, test_loss: 1.0343, test_f1: 0.4531
 epoch: 7, train_loss: 1.0546, test_loss: 1.0191, test_f1: 0.4624
 epoch: 8, train_loss: 1.0418, test_loss: 1.0049, test_f1: 0.4544
 epoch: 9, train_loss: 1.0227, test_loss: 0.9949, test_f1: 0.4597
 epoch: 10, train_loss: 1.0137, test_loss: 0.9859, test_f1: 0.4625
 epoch: 11, train_loss: 0.9995, test_loss: 0.9870, test_f1: 0.4617
 epoch: 12, train_loss: 0.9898, test_loss: 0.9771, test_f1: 0.4630
 epoch: 13, train_loss: 0.9829, test_loss: 0.9666, test_f1: 0.4804
 epoch: 14, train_loss: 0.9762, test_loss: 0.9694, test_f1: 0.4666
 epoch: 15, train_loss: 0.9597, test_loss: 0.9675, test_f1: 0.4804
 epoch: 16, train_loss: 0.9571, test_loss: 0.9692, test_f1: 0.4781
 epoch: 17, train_loss: 0.9543, test_loss: 0.9618, test_f1: 0.4972
 epoch: 18, train_loss: 0.9539, test_loss: 0.9577, test_f1: 0.4978
 epoch: 19, train_loss: 0.9390, test_loss: 0.9535, test_f1: 0.4972
 epoch: 20, train_loss: 0.9364, test_loss: 0.9649, test_f1: 0.5092
 epoch: 21, train_loss: 0.9319, test_loss: 0.9617, test_f1: 0.5076
 epoch: 22, train_loss: 0.9254, test_loss: 0.9655, test_f1: 0.5133
 epoch: 23, train_loss: 0.9186, test_loss: 0.9421, test_f1: 0.5080
 epoch: 24, train_loss: 0.9140, test_loss: 0.9497, test_f1: 0.5081
 epoch: 25, train_loss: 0.9169, test_loss: 0.9533, test_f1: 0.5170
 epoch: 26, train_loss: 0.9061, test_loss: 0.9578, test_f1: 0.5084
 epoch: 27, train_loss: 0.9098, test_loss: 0.9961, test_f1: 0.4961
 epoch: 28, train_loss: 0.8995, test_loss: 0.9548, test_f1: 0.5186
 epoch: 29, train_loss: 0.8972, test_loss: 0.9409, test_f1: 0.5204
 epoch: 30, train_loss: 0.9065, test_loss: 0.9499, test_f1: 0.5167
 epoch: 31, train_loss: 0.8993, test_loss: 0.9509, test_f1: 0.5117
 epoch: 32, train_loss: 0.8788, test_loss: 0.9475, test_f1: 0.5030
 epoch: 33, train_loss: 0.8846, test_loss: 0.9511, test_f1: 0.5092
 epoch: 34, train_loss: 0.8795, test_loss: 0.9630, test_f1: 0.5038
 epoch: 35, train_loss: 0.8752, test_loss: 0.9551, test_f1: 0.4986
 epoch: 36, train_loss: 0.8612, test_loss: 0.9524, test_f1: 0.5049
 epoch: 37, train_loss: 0.8795, test_loss: 0.9667, test_f1: 0.5036
 epoch: 38, train_loss: 0.8569, test_loss: 0.9496, test_f1: 0.5092
 epoch: 39, train_loss: 0.8645, test_loss: 0.9613, test_f1: 0.5009
 epoch: 40, train_loss: 0.8632, test_loss: 0.9492, test_f1: 0.4997
 epoch: 41, train_loss: 0.8708, test_loss: 0.9592, test_f1: 0.5045
 epoch: 42, train_loss: 0.8530, test_loss: 0.9589, test_f1: 0.4909
 epoch: 43, train_loss: 0.8569, test_loss: 0.9571, test_f1: 0.5033
 epoch: 44, train_loss: 0.8506, test_loss: 0.9669, test_f1: 0.5023
 epoch: 45, train_loss: 0.8560, test_loss: 0.9702, test_f1: 0.5025
 epoch: 46, train_loss: 0.8433, test_loss: 0.9682, test_f1: 0.5007
 epoch: 47, train_loss: 0.8470, test_loss: 0.9464, test_f1: 0.5082
 epoch: 48, train_loss: 0.8345, test_loss: 0.9592, test_f1: 0.5097
 epoch: 49, train_loss: 0.8415, test_loss: 0.9711, test_f1: 0.5044
 epoch: 50, train_loss: 0.8382, test_loss: 0.9861, test_f1: 0.5022
 epoch: 51, train_loss: 0.8336, test_loss: 0.9693, test_f1: 0.5108
 epoch: 52, train_loss: 0.8296, test_loss: 0.9674, test_f1: 0.5054
 epoch: 53, train_loss: 0.8233, test_loss: 0.9807, test_f1: 0.4963
 epoch: 54, train_loss: 0.8345, test_loss: 0.9797, test_f1: 0.5110
 epoch: 55, train_loss: 0.8308, test_loss: 0.9776, test_f1: 0.5047
 epoch: 56, train_loss: 0.8161, test_loss: 0.9701, test_f1: 0.4998
 epoch: 57, train_loss: 0.8163, test_loss: 0.9760, test_f1: 0.5068
 epoch: 58, train_loss: 0.8302, test_loss: 0.9769, test_f1: 0.4985
 epoch: 59, train_loss: 0.8254, test_loss: 0.9817, test_f1: 0.5082
 epoch: 60, train_loss: 0.8282, test_loss: 0.9736, test_f1: 0.5000
 epoch: 61, train_loss: 0.8224, test_loss: 1.0049, test_f1: 0.4976
 epoch: 62, train_loss: 0.8271, test_loss: 0.9760, test_f1: 0.5196
 epoch: 63, train_loss: 0.8194, test_loss: 0.9792, test_f1: 0.4965
 epoch: 64, train_loss: 0.8216, test_loss: 0.9626, test_f1: 0.5062
 epoch: 65, train_loss: 0.8183, test_loss: 0.9856, test_f1: 0.5035
 epoch: 66, train_loss: 0.8223, test_loss: 0.9692, test_f1: 0.5025
 epoch: 67, train_loss: 0.8173, test_loss: 0.9775, test_f1: 0.5011
 epoch: 68, train_loss: 0.8130, test_loss: 0.9785, test_f1: 0.5139
 epoch: 69, train_loss: 0.8151, test_loss: 0.9641, test_f1: 0.5076
 epoch: 70, train_loss: 0.8198, test_loss: 0.9779, test_f1: 0.5023
 epoch: 71, train_loss: 0.8005, test_loss: 0.9858, test_f1: 0.5025
 epoch: 72, train_loss: 0.8096, test_loss: 0.9876, test_f1: 0.5048
 epoch: 73, train_loss: 0.8038, test_loss: 0.9744, test_f1: 0.5131
 epoch: 74, train_loss: 0.8021, test_loss: 0.9817, test_f1: 0.5113
 epoch: 75, train_loss: 0.8108, test_loss: 0.9996, test_f1: 0.5035
 epoch: 76, train_loss: 0.8047, test_loss: 0.9719, test_f1: 0.5143
 epoch: 77, train_loss: 0.7987, test_loss: 0.9814, test_f1: 0.5188
 epoch: 78, train_loss: 0.8027, test_loss: 0.9788, test_f1: 0.5101
 epoch: 79, train_loss: 0.8127, test_loss: 0.9822, test_f1: 0.5118
 epoch: 80, train_loss: 0.8028, test_loss: 0.9931, test_f1: 0.5119
 epoch: 81, train_loss: 0.8101, test_loss: 0.9647, test_f1: 0.5004
 epoch: 82, train_loss: 0.7953, test_loss: 0.9711, test_f1: 0.5063
 epoch: 83, train_loss: 0.8044, test_loss: 0.9817, test_f1: 0.5140
 epoch: 84, train_loss: 0.8031, test_loss: 1.0020, test_f1: 0.5051
 epoch: 85, train_loss: 0.8096, test_loss: 0.9878, test_f1: 0.5098
 epoch: 86, train_loss: 0.8035, test_loss: 0.9877, test_f1: 0.5052
 epoch: 87, train_loss: 0.8017, test_loss: 0.9867, test_f1: 0.5154
 epoch: 88, train_loss: 0.7970, test_loss: 0.9879, test_f1: 0.5081
 epoch: 89, train_loss: 0.7931, test_loss: 0.9959, test_f1: 0.5085
 epoch: 90, train_loss: 0.7907, test_loss: 1.0044, test_f1: 0.5096
 epoch: 91, train_loss: 0.7952, test_loss: 0.9889, test_f1: 0.5210
 epoch: 92, train_loss: 0.7920, test_loss: 1.0130, test_f1: 0.5105
 epoch: 93, train_loss: 0.7940, test_loss: 0.9926, test_f1: 0.5115
 epoch: 94, train_loss: 0.7872, test_loss: 1.0014, test_f1: 0.5110
 epoch: 95, train_loss: 0.7903, test_loss: 1.0018, test_f1: 0.5063
 epoch: 96, train_loss: 0.7961, test_loss: 1.0054, test_f1: 0.5198
 epoch: 97, train_loss: 0.7946, test_loss: 1.0020, test_f1: 0.5093
 epoch: 98, train_loss: 0.7813, test_loss: 1.0097, test_f1: 0.5088
 epoch: 99, train_loss: 0.7849, test_loss: 1.0005, test_f1: 0.5134
##################ITERATION #4 ****************************************
 epoch: 0, train_loss: 1.2557, test_loss: 1.1866, test_f1: 0.2801
 epoch: 1, train_loss: 1.1748, test_loss: 1.1119, test_f1: 0.3839
 epoch: 2, train_loss: 1.1453, test_loss: 1.0881, test_f1: 0.4114
 epoch: 3, train_loss: 1.1226, test_loss: 1.0629, test_f1: 0.4245
 epoch: 4, train_loss: 1.1008, test_loss: 1.0398, test_f1: 0.4461
 epoch: 5, train_loss: 1.0763, test_loss: 1.0276, test_f1: 0.4431
 epoch: 6, train_loss: 1.0637, test_loss: 1.0112, test_f1: 0.4622
 epoch: 7, train_loss: 1.0422, test_loss: 1.0037, test_f1: 0.4507
 epoch: 8, train_loss: 1.0185, test_loss: 0.9840, test_f1: 0.4656
 epoch: 9, train_loss: 1.0133, test_loss: 0.9739, test_f1: 0.4908
 epoch: 10, train_loss: 1.0027, test_loss: 0.9673, test_f1: 0.4847
 epoch: 11, train_loss: 0.9889, test_loss: 0.9567, test_f1: 0.4973
 epoch: 12, train_loss: 0.9796, test_loss: 0.9489, test_f1: 0.5044
 epoch: 13, train_loss: 0.9681, test_loss: 0.9436, test_f1: 0.4909
 epoch: 14, train_loss: 0.9571, test_loss: 0.9414, test_f1: 0.4928
 epoch: 15, train_loss: 0.9626, test_loss: 0.9437, test_f1: 0.5118
 epoch: 16, train_loss: 0.9457, test_loss: 0.9311, test_f1: 0.5120
 epoch: 17, train_loss: 0.9448, test_loss: 0.9375, test_f1: 0.5046
 epoch: 18, train_loss: 0.9405, test_loss: 0.9243, test_f1: 0.4960
 epoch: 19, train_loss: 0.9343, test_loss: 0.9313, test_f1: 0.5184
 epoch: 20, train_loss: 0.9276, test_loss: 0.9255, test_f1: 0.5133
 epoch: 21, train_loss: 0.9220, test_loss: 0.9180, test_f1: 0.5257
 epoch: 22, train_loss: 0.9190, test_loss: 0.9150, test_f1: 0.5300
 epoch: 23, train_loss: 0.9107, test_loss: 0.9138, test_f1: 0.5306
 epoch: 24, train_loss: 0.9095, test_loss: 0.9111, test_f1: 0.5366
 epoch: 25, train_loss: 0.9023, test_loss: 0.9240, test_f1: 0.5235
 epoch: 26, train_loss: 0.8922, test_loss: 0.9172, test_f1: 0.5345
 epoch: 27, train_loss: 0.8996, test_loss: 0.9126, test_f1: 0.5395
 epoch: 28, train_loss: 0.8909, test_loss: 0.9310, test_f1: 0.5174
 epoch: 29, train_loss: 0.8945, test_loss: 0.9078, test_f1: 0.5431
 epoch: 30, train_loss: 0.8835, test_loss: 0.9483, test_f1: 0.5021
 epoch: 31, train_loss: 0.8800, test_loss: 0.9098, test_f1: 0.5350
 epoch: 32, train_loss: 0.8767, test_loss: 0.9146, test_f1: 0.5417
 epoch: 33, train_loss: 0.8820, test_loss: 0.9113, test_f1: 0.5403
 epoch: 34, train_loss: 0.8665, test_loss: 0.9130, test_f1: 0.5389
 epoch: 35, train_loss: 0.8724, test_loss: 0.8984, test_f1: 0.5355
 epoch: 36, train_loss: 0.8628, test_loss: 0.9035, test_f1: 0.5435
 epoch: 37, train_loss: 0.8643, test_loss: 0.9206, test_f1: 0.5298
 epoch: 38, train_loss: 0.8549, test_loss: 0.9156, test_f1: 0.5415
 epoch: 39, train_loss: 0.8525, test_loss: 0.9023, test_f1: 0.5471
 epoch: 40, train_loss: 0.8601, test_loss: 0.9100, test_f1: 0.5381
 epoch: 41, train_loss: 0.8531, test_loss: 0.9222, test_f1: 0.5411
 epoch: 42, train_loss: 0.8447, test_loss: 0.9198, test_f1: 0.5402
 epoch: 43, train_loss: 0.8465, test_loss: 0.9072, test_f1: 0.5309
 epoch: 44, train_loss: 0.8359, test_loss: 0.8990, test_f1: 0.5498
 epoch: 45, train_loss: 0.8456, test_loss: 0.9092, test_f1: 0.5410
 epoch: 46, train_loss: 0.8411, test_loss: 0.9110, test_f1: 0.5415
 epoch: 47, train_loss: 0.8326, test_loss: 0.9103, test_f1: 0.5331
 epoch: 48, train_loss: 0.8314, test_loss: 0.8984, test_f1: 0.5559
 epoch: 49, train_loss: 0.8263, test_loss: 0.8973, test_f1: 0.5473
 epoch: 50, train_loss: 0.8192, test_loss: 0.8941, test_f1: 0.5418
 epoch: 51, train_loss: 0.8251, test_loss: 0.8971, test_f1: 0.5400
 epoch: 52, train_loss: 0.8313, test_loss: 0.9061, test_f1: 0.5435
 epoch: 53, train_loss: 0.8192, test_loss: 0.9023, test_f1: 0.5498
 epoch: 54, train_loss: 0.8149, test_loss: 0.9034, test_f1: 0.5485
 epoch: 55, train_loss: 0.8148, test_loss: 0.9142, test_f1: 0.5425
 epoch: 56, train_loss: 0.8086, test_loss: 0.9063, test_f1: 0.5472
 epoch: 57, train_loss: 0.8145, test_loss: 0.9257, test_f1: 0.5444
 epoch: 58, train_loss: 0.8207, test_loss: 0.9126, test_f1: 0.5399
 epoch: 59, train_loss: 0.8098, test_loss: 0.8985, test_f1: 0.5405
 epoch: 60, train_loss: 0.8116, test_loss: 0.9004, test_f1: 0.5423
 epoch: 61, train_loss: 0.8192, test_loss: 0.9008, test_f1: 0.5338
 epoch: 62, train_loss: 0.8026, test_loss: 0.9069, test_f1: 0.5328
 epoch: 63, train_loss: 0.8068, test_loss: 0.9089, test_f1: 0.5452
 epoch: 64, train_loss: 0.8130, test_loss: 0.9048, test_f1: 0.5344
 epoch: 65, train_loss: 0.8088, test_loss: 0.9003, test_f1: 0.5428
 epoch: 66, train_loss: 0.8063, test_loss: 0.9036, test_f1: 0.5412
 epoch: 67, train_loss: 0.8029, test_loss: 0.8901, test_f1: 0.5496
 epoch: 68, train_loss: 0.7958, test_loss: 0.8911, test_f1: 0.5549
 epoch: 69, train_loss: 0.8105, test_loss: 0.9066, test_f1: 0.5443
 epoch: 70, train_loss: 0.8102, test_loss: 0.8978, test_f1: 0.5430
 epoch: 71, train_loss: 0.8019, test_loss: 0.9204, test_f1: 0.5520
 epoch: 72, train_loss: 0.8083, test_loss: 0.9209, test_f1: 0.5390
 epoch: 73, train_loss: 0.7918, test_loss: 0.9163, test_f1: 0.5423
 epoch: 74, train_loss: 0.8037, test_loss: 0.8981, test_f1: 0.5429
 epoch: 75, train_loss: 0.7994, test_loss: 0.9014, test_f1: 0.5469
 epoch: 76, train_loss: 0.7929, test_loss: 0.9097, test_f1: 0.5501
 epoch: 77, train_loss: 0.7975, test_loss: 0.9165, test_f1: 0.5490
 epoch: 78, train_loss: 0.7838, test_loss: 0.9013, test_f1: 0.5504
 epoch: 79, train_loss: 0.7875, test_loss: 0.9091, test_f1: 0.5556
 epoch: 80, train_loss: 0.7831, test_loss: 0.9019, test_f1: 0.5517
 epoch: 81, train_loss: 0.7907, test_loss: 0.9303, test_f1: 0.5562
 epoch: 82, train_loss: 0.7906, test_loss: 0.8961, test_f1: 0.5475
 epoch: 83, train_loss: 0.7953, test_loss: 0.9011, test_f1: 0.5554
 epoch: 84, train_loss: 0.7892, test_loss: 0.9110, test_f1: 0.5542
 epoch: 85, train_loss: 0.7949, test_loss: 0.8950, test_f1: 0.5579
 epoch: 86, train_loss: 0.7756, test_loss: 0.9095, test_f1: 0.5548
 epoch: 87, train_loss: 0.7828, test_loss: 0.9111, test_f1: 0.5607
 epoch: 88, train_loss: 0.7830, test_loss: 0.9156, test_f1: 0.5506
 epoch: 89, train_loss: 0.7788, test_loss: 0.9055, test_f1: 0.5556
 epoch: 90, train_loss: 0.7836, test_loss: 0.9102, test_f1: 0.5564
 epoch: 91, train_loss: 0.7826, test_loss: 0.9091, test_f1: 0.5568
 epoch: 92, train_loss: 0.7820, test_loss: 0.9056, test_f1: 0.5570
 epoch: 93, train_loss: 0.7746, test_loss: 0.9002, test_f1: 0.5577
 epoch: 94, train_loss: 0.7636, test_loss: 0.9175, test_f1: 0.5553
 epoch: 95, train_loss: 0.7789, test_loss: 0.9113, test_f1: 0.5561
 epoch: 96, train_loss: 0.7718, test_loss: 0.9037, test_f1: 0.5590
 epoch: 97, train_loss: 0.7735, test_loss: 0.9107, test_f1: 0.5559
 epoch: 98, train_loss: 0.7818, test_loss: 0.9051, test_f1: 0.5546
 epoch: 99, train_loss: 0.7771, test_loss: 0.9117, test_f1: 0.5688
##################ITERATION #5 ****************************************
 epoch: 0, train_loss: 1.2901, test_loss: 1.1778, test_f1: 0.3336
 epoch: 1, train_loss: 1.1813, test_loss: 1.1209, test_f1: 0.3504
 epoch: 2, train_loss: 1.1483, test_loss: 1.0818, test_f1: 0.3775
 epoch: 3, train_loss: 1.1161, test_loss: 1.0555, test_f1: 0.3979
 epoch: 4, train_loss: 1.0928, test_loss: 1.0402, test_f1: 0.4208
 epoch: 5, train_loss: 1.0679, test_loss: 1.0312, test_f1: 0.4383
 epoch: 6, train_loss: 1.0461, test_loss: 1.0081, test_f1: 0.4486
 epoch: 7, train_loss: 1.0305, test_loss: 1.0100, test_f1: 0.4554
 epoch: 8, train_loss: 1.0243, test_loss: 1.0001, test_f1: 0.4517
 epoch: 9, train_loss: 1.0136, test_loss: 0.9912, test_f1: 0.4594
 epoch: 10, train_loss: 1.0024, test_loss: 0.9852, test_f1: 0.4429
 epoch: 11, train_loss: 0.9942, test_loss: 0.9744, test_f1: 0.4718
 epoch: 12, train_loss: 0.9814, test_loss: 0.9718, test_f1: 0.4801
 epoch: 13, train_loss: 0.9685, test_loss: 0.9638, test_f1: 0.4777
 epoch: 14, train_loss: 0.9711, test_loss: 0.9582, test_f1: 0.4876
 epoch: 15, train_loss: 0.9651, test_loss: 0.9679, test_f1: 0.5013
 epoch: 16, train_loss: 0.9606, test_loss: 0.9666, test_f1: 0.5053
 epoch: 17, train_loss: 0.9561, test_loss: 0.9587, test_f1: 0.4887
 epoch: 18, train_loss: 0.9437, test_loss: 0.9602, test_f1: 0.4961
 epoch: 19, train_loss: 0.9344, test_loss: 0.9417, test_f1: 0.5053
 epoch: 20, train_loss: 0.9374, test_loss: 0.9568, test_f1: 0.4859
 epoch: 21, train_loss: 0.9309, test_loss: 0.9402, test_f1: 0.5065
 epoch: 22, train_loss: 0.9283, test_loss: 0.9340, test_f1: 0.5084
 epoch: 23, train_loss: 0.9303, test_loss: 0.9441, test_f1: 0.5121
 epoch: 24, train_loss: 0.9207, test_loss: 0.9323, test_f1: 0.5204
 epoch: 25, train_loss: 0.9157, test_loss: 0.9293, test_f1: 0.5284
 epoch: 26, train_loss: 0.9050, test_loss: 0.9276, test_f1: 0.5263
 epoch: 27, train_loss: 0.9098, test_loss: 0.9326, test_f1: 0.5302
 epoch: 28, train_loss: 0.9069, test_loss: 0.9312, test_f1: 0.5286
 epoch: 29, train_loss: 0.9078, test_loss: 0.9332, test_f1: 0.5294
 epoch: 30, train_loss: 0.8960, test_loss: 0.9376, test_f1: 0.5236
 epoch: 31, train_loss: 0.8910, test_loss: 0.9245, test_f1: 0.5253
 epoch: 32, train_loss: 0.8897, test_loss: 0.9257, test_f1: 0.5074
 epoch: 33, train_loss: 0.8877, test_loss: 0.9310, test_f1: 0.5135
 epoch: 34, train_loss: 0.8897, test_loss: 0.9206, test_f1: 0.5286
 epoch: 35, train_loss: 0.8855, test_loss: 0.9276, test_f1: 0.5411
 epoch: 36, train_loss: 0.8804, test_loss: 0.9197, test_f1: 0.5469
 epoch: 37, train_loss: 0.8837, test_loss: 0.9409, test_f1: 0.5315
 epoch: 38, train_loss: 0.8756, test_loss: 0.9270, test_f1: 0.5456
 epoch: 39, train_loss: 0.8626, test_loss: 0.9194, test_f1: 0.5399
 epoch: 40, train_loss: 0.8675, test_loss: 0.9254, test_f1: 0.5354
 epoch: 41, train_loss: 0.8644, test_loss: 0.9137, test_f1: 0.5446
 epoch: 42, train_loss: 0.8657, test_loss: 0.9063, test_f1: 0.5381
 epoch: 43, train_loss: 0.8646, test_loss: 0.9251, test_f1: 0.5258
 epoch: 44, train_loss: 0.8540, test_loss: 0.9201, test_f1: 0.5317
 epoch: 45, train_loss: 0.8430, test_loss: 0.9163, test_f1: 0.5385
 epoch: 46, train_loss: 0.8500, test_loss: 0.9095, test_f1: 0.5417
 epoch: 47, train_loss: 0.8540, test_loss: 0.9233, test_f1: 0.5462
 epoch: 48, train_loss: 0.8396, test_loss: 0.9077, test_f1: 0.5501
 epoch: 49, train_loss: 0.8401, test_loss: 0.9206, test_f1: 0.5634
 epoch: 50, train_loss: 0.8475, test_loss: 0.9127, test_f1: 0.5385
 epoch: 51, train_loss: 0.8328, test_loss: 0.9068, test_f1: 0.5488
 epoch: 52, train_loss: 0.8369, test_loss: 0.9087, test_f1: 0.5421
 epoch: 53, train_loss: 0.8359, test_loss: 0.9136, test_f1: 0.5434
 epoch: 54, train_loss: 0.8305, test_loss: 0.9189, test_f1: 0.5618
 epoch: 55, train_loss: 0.8221, test_loss: 0.9103, test_f1: 0.5535
 epoch: 56, train_loss: 0.8366, test_loss: 0.9052, test_f1: 0.5430
 epoch: 57, train_loss: 0.8297, test_loss: 0.9210, test_f1: 0.5563
 epoch: 58, train_loss: 0.8284, test_loss: 0.9179, test_f1: 0.5595
 epoch: 59, train_loss: 0.8297, test_loss: 0.9138, test_f1: 0.5415
 epoch: 60, train_loss: 0.8240, test_loss: 0.9065, test_f1: 0.5594
 epoch: 61, train_loss: 0.8187, test_loss: 0.9056, test_f1: 0.5596
 epoch: 62, train_loss: 0.8212, test_loss: 0.9119, test_f1: 0.5623
 epoch: 63, train_loss: 0.8209, test_loss: 0.8987, test_f1: 0.5668
 epoch: 64, train_loss: 0.8276, test_loss: 0.8950, test_f1: 0.5477
 epoch: 65, train_loss: 0.8156, test_loss: 0.9014, test_f1: 0.5435
 epoch: 66, train_loss: 0.8144, test_loss: 0.9042, test_f1: 0.5536
 epoch: 67, train_loss: 0.8185, test_loss: 0.9061, test_f1: 0.5445
 epoch: 68, train_loss: 0.8065, test_loss: 0.9121, test_f1: 0.5451
 epoch: 69, train_loss: 0.8154, test_loss: 0.9139, test_f1: 0.5487
 epoch: 70, train_loss: 0.8091, test_loss: 0.9156, test_f1: 0.5632
 epoch: 71, train_loss: 0.8157, test_loss: 0.9008, test_f1: 0.5385
 epoch: 72, train_loss: 0.8222, test_loss: 0.9096, test_f1: 0.5438
 epoch: 73, train_loss: 0.8126, test_loss: 0.9132, test_f1: 0.5672
 epoch: 74, train_loss: 0.8167, test_loss: 0.9052, test_f1: 0.5677
 epoch: 75, train_loss: 0.8126, test_loss: 0.9101, test_f1: 0.5593
 epoch: 76, train_loss: 0.8025, test_loss: 0.9199, test_f1: 0.5557
 epoch: 77, train_loss: 0.7995, test_loss: 0.9089, test_f1: 0.5648
 epoch: 78, train_loss: 0.8121, test_loss: 0.8978, test_f1: 0.5494
 epoch: 79, train_loss: 0.8024, test_loss: 0.8984, test_f1: 0.5543
 epoch: 80, train_loss: 0.7959, test_loss: 0.9079, test_f1: 0.5429
 epoch: 81, train_loss: 0.8062, test_loss: 0.8923, test_f1: 0.5500
 epoch: 82, train_loss: 0.7963, test_loss: 0.9049, test_f1: 0.5407
 epoch: 83, train_loss: 0.7951, test_loss: 0.8942, test_f1: 0.5574
 epoch: 84, train_loss: 0.8005, test_loss: 0.9054, test_f1: 0.5577
 epoch: 85, train_loss: 0.7976, test_loss: 0.8923, test_f1: 0.5634
 epoch: 86, train_loss: 0.8000, test_loss: 0.8921, test_f1: 0.5613
 epoch: 87, train_loss: 0.7945, test_loss: 0.9071, test_f1: 0.5451
 epoch: 88, train_loss: 0.8046, test_loss: 0.8987, test_f1: 0.5635
 epoch: 89, train_loss: 0.8080, test_loss: 0.8936, test_f1: 0.5655
 epoch: 90, train_loss: 0.7887, test_loss: 0.9074, test_f1: 0.5644
 epoch: 91, train_loss: 0.7822, test_loss: 0.9185, test_f1: 0.5558
 epoch: 92, train_loss: 0.7896, test_loss: 0.9018, test_f1: 0.5685
 epoch: 93, train_loss: 0.7851, test_loss: 0.9020, test_f1: 0.5644
 epoch: 94, train_loss: 0.7901, test_loss: 0.9067, test_f1: 0.5740
 epoch: 95, train_loss: 0.7749, test_loss: 0.9049, test_f1: 0.5557
 epoch: 96, train_loss: 0.7946, test_loss: 0.9085, test_f1: 0.5661
 epoch: 97, train_loss: 0.7917, test_loss: 0.9007, test_f1: 0.5547
 epoch: 98, train_loss: 0.7830, test_loss: 0.9094, test_f1: 0.5522
 epoch: 99, train_loss: 0.7908, test_loss: 0.9152, test_f1: 0.5624
##################ITERATION #6 ****************************************
 epoch: 0, train_loss: 1.2755, test_loss: 1.1926, test_f1: 0.3000
 epoch: 1, train_loss: 1.1733, test_loss: 1.0828, test_f1: 0.3931
 epoch: 2, train_loss: 1.1451, test_loss: 1.0609, test_f1: 0.4153
 epoch: 3, train_loss: 1.1099, test_loss: 1.0354, test_f1: 0.4427
 epoch: 4, train_loss: 1.0834, test_loss: 1.0169, test_f1: 0.4279
 epoch: 5, train_loss: 1.0754, test_loss: 1.0094, test_f1: 0.4222
 epoch: 6, train_loss: 1.0535, test_loss: 0.9879, test_f1: 0.4407
 epoch: 7, train_loss: 1.0349, test_loss: 0.9779, test_f1: 0.4451
 epoch: 8, train_loss: 1.0217, test_loss: 0.9636, test_f1: 0.4718
 epoch: 9, train_loss: 1.0040, test_loss: 0.9674, test_f1: 0.4712
 epoch: 10, train_loss: 0.9996, test_loss: 0.9548, test_f1: 0.4772
 epoch: 11, train_loss: 0.9935, test_loss: 0.9570, test_f1: 0.4827
 epoch: 12, train_loss: 0.9917, test_loss: 0.9524, test_f1: 0.4779
 epoch: 13, train_loss: 0.9744, test_loss: 0.9418, test_f1: 0.4757
 epoch: 14, train_loss: 0.9629, test_loss: 0.9382, test_f1: 0.4839
 epoch: 15, train_loss: 0.9611, test_loss: 0.9294, test_f1: 0.4823
 epoch: 16, train_loss: 0.9527, test_loss: 0.9237, test_f1: 0.4900
 epoch: 17, train_loss: 0.9423, test_loss: 0.9233, test_f1: 0.5144
 epoch: 18, train_loss: 0.9365, test_loss: 0.9459, test_f1: 0.5127
 epoch: 19, train_loss: 0.9292, test_loss: 0.9143, test_f1: 0.5150
 epoch: 20, train_loss: 0.9246, test_loss: 0.9068, test_f1: 0.5192
 epoch: 21, train_loss: 0.9320, test_loss: 0.9087, test_f1: 0.5110
 epoch: 22, train_loss: 0.9159, test_loss: 0.9003, test_f1: 0.5121
 epoch: 23, train_loss: 0.9150, test_loss: 0.9040, test_f1: 0.5221
 epoch: 24, train_loss: 0.9105, test_loss: 0.9286, test_f1: 0.5139
 epoch: 25, train_loss: 0.9189, test_loss: 0.8761, test_f1: 0.5235
 epoch: 26, train_loss: 0.9067, test_loss: 0.8957, test_f1: 0.5144
 epoch: 27, train_loss: 0.8989, test_loss: 0.8886, test_f1: 0.5286
 epoch: 28, train_loss: 0.8888, test_loss: 0.8993, test_f1: 0.5225
 epoch: 29, train_loss: 0.8929, test_loss: 0.8942, test_f1: 0.5297
 epoch: 30, train_loss: 0.8854, test_loss: 0.8971, test_f1: 0.5246
 epoch: 31, train_loss: 0.8822, test_loss: 0.8742, test_f1: 0.5289
 epoch: 32, train_loss: 0.8914, test_loss: 0.8859, test_f1: 0.5274
 epoch: 33, train_loss: 0.8729, test_loss: 0.8854, test_f1: 0.5217
 epoch: 34, train_loss: 0.8754, test_loss: 0.9056, test_f1: 0.5387
 epoch: 35, train_loss: 0.8729, test_loss: 0.8758, test_f1: 0.5332
 epoch: 36, train_loss: 0.8737, test_loss: 0.8899, test_f1: 0.5316
 epoch: 37, train_loss: 0.8687, test_loss: 0.8897, test_f1: 0.5336
 epoch: 38, train_loss: 0.8632, test_loss: 0.9005, test_f1: 0.5244
 epoch: 39, train_loss: 0.8613, test_loss: 0.8843, test_f1: 0.5357
 epoch: 40, train_loss: 0.8595, test_loss: 0.8676, test_f1: 0.5313
 epoch: 41, train_loss: 0.8519, test_loss: 0.8874, test_f1: 0.5335
 epoch: 42, train_loss: 0.8468, test_loss: 0.9007, test_f1: 0.5339
 epoch: 43, train_loss: 0.8513, test_loss: 0.8878, test_f1: 0.5269
 epoch: 44, train_loss: 0.8465, test_loss: 0.8832, test_f1: 0.5301
 epoch: 45, train_loss: 0.8430, test_loss: 0.9065, test_f1: 0.5234
 epoch: 46, train_loss: 0.8566, test_loss: 0.8942, test_f1: 0.5275
 epoch: 47, train_loss: 0.8434, test_loss: 0.8996, test_f1: 0.5294
 epoch: 48, train_loss: 0.8422, test_loss: 0.8947, test_f1: 0.5304
 epoch: 49, train_loss: 0.8469, test_loss: 0.9045, test_f1: 0.5232
 epoch: 50, train_loss: 0.8381, test_loss: 0.9048, test_f1: 0.5311
 epoch: 51, train_loss: 0.8314, test_loss: 0.8957, test_f1: 0.5323
 epoch: 52, train_loss: 0.8303, test_loss: 0.8987, test_f1: 0.5255
 epoch: 53, train_loss: 0.8335, test_loss: 0.8966, test_f1: 0.5305
 epoch: 54, train_loss: 0.8263, test_loss: 0.8903, test_f1: 0.5345
 epoch: 55, train_loss: 0.8244, test_loss: 0.8980, test_f1: 0.5230
 epoch: 56, train_loss: 0.8253, test_loss: 0.8834, test_f1: 0.5355
 epoch: 57, train_loss: 0.8282, test_loss: 0.8848, test_f1: 0.5391
 epoch: 58, train_loss: 0.8298, test_loss: 0.9169, test_f1: 0.5259
 epoch: 59, train_loss: 0.8160, test_loss: 0.9080, test_f1: 0.5294
 epoch: 60, train_loss: 0.8260, test_loss: 0.9055, test_f1: 0.5376
 epoch: 61, train_loss: 0.8199, test_loss: 0.9067, test_f1: 0.5284
 epoch: 62, train_loss: 0.8198, test_loss: 0.8951, test_f1: 0.5337
 epoch: 63, train_loss: 0.8201, test_loss: 0.8908, test_f1: 0.5369
 epoch: 64, train_loss: 0.8191, test_loss: 0.9010, test_f1: 0.5312
 epoch: 65, train_loss: 0.8201, test_loss: 0.8938, test_f1: 0.5390
 epoch: 66, train_loss: 0.8139, test_loss: 0.9045, test_f1: 0.5353
 epoch: 67, train_loss: 0.8100, test_loss: 0.9004, test_f1: 0.5354
 epoch: 68, train_loss: 0.8124, test_loss: 0.9034, test_f1: 0.5324
 epoch: 69, train_loss: 0.8145, test_loss: 0.8830, test_f1: 0.5301
 epoch: 70, train_loss: 0.8153, test_loss: 0.9039, test_f1: 0.5303
 epoch: 71, train_loss: 0.8103, test_loss: 0.9416, test_f1: 0.5280
 epoch: 72, train_loss: 0.8184, test_loss: 0.9136, test_f1: 0.5299
 epoch: 73, train_loss: 0.8190, test_loss: 0.9145, test_f1: 0.5324
 epoch: 74, train_loss: 0.8190, test_loss: 0.9084, test_f1: 0.5314
 epoch: 75, train_loss: 0.8025, test_loss: 0.9118, test_f1: 0.5263
 epoch: 76, train_loss: 0.8048, test_loss: 0.9170, test_f1: 0.5288
 epoch: 77, train_loss: 0.8131, test_loss: 0.9039, test_f1: 0.5263
 epoch: 78, train_loss: 0.8095, test_loss: 0.9197, test_f1: 0.5298
 epoch: 79, train_loss: 0.8053, test_loss: 0.9190, test_f1: 0.5334
 epoch: 80, train_loss: 0.8018, test_loss: 0.9034, test_f1: 0.5399
 epoch: 81, train_loss: 0.7940, test_loss: 0.9064, test_f1: 0.5349
 epoch: 82, train_loss: 0.7992, test_loss: 0.9147, test_f1: 0.5406
 epoch: 83, train_loss: 0.8078, test_loss: 0.9132, test_f1: 0.5340
 epoch: 84, train_loss: 0.8018, test_loss: 0.9308, test_f1: 0.5401
 epoch: 85, train_loss: 0.8082, test_loss: 0.9290, test_f1: 0.5376
 epoch: 86, train_loss: 0.7932, test_loss: 0.9140, test_f1: 0.5290
 epoch: 87, train_loss: 0.8001, test_loss: 0.9048, test_f1: 0.5441
 epoch: 88, train_loss: 0.7963, test_loss: 0.9349, test_f1: 0.5366
 epoch: 89, train_loss: 0.7950, test_loss: 0.9143, test_f1: 0.5386
 epoch: 90, train_loss: 0.7928, test_loss: 0.9253, test_f1: 0.5410
 epoch: 91, train_loss: 0.7927, test_loss: 0.9183, test_f1: 0.5398
 epoch: 92, train_loss: 0.7995, test_loss: 0.9225, test_f1: 0.5379
 epoch: 93, train_loss: 0.7940, test_loss: 0.9230, test_f1: 0.5397
 epoch: 94, train_loss: 0.7866, test_loss: 0.9205, test_f1: 0.5357
 epoch: 95, train_loss: 0.7889, test_loss: 0.9297, test_f1: 0.5351
 epoch: 96, train_loss: 0.7858, test_loss: 0.9181, test_f1: 0.5407
 epoch: 97, train_loss: 0.7892, test_loss: 0.9127, test_f1: 0.5457
 epoch: 98, train_loss: 0.7864, test_loss: 0.9342, test_f1: 0.5295
 epoch: 99, train_loss: 0.7930, test_loss: 0.9254, test_f1: 0.5344
##################ITERATION #7 ****************************************
 epoch: 0, train_loss: 1.3169, test_loss: 1.1793, test_f1: 0.2836
 epoch: 1, train_loss: 1.1665, test_loss: 1.0928, test_f1: 0.3932
 epoch: 2, train_loss: 1.1303, test_loss: 1.0562, test_f1: 0.4033
 epoch: 3, train_loss: 1.0987, test_loss: 1.0342, test_f1: 0.3990
 epoch: 4, train_loss: 1.0737, test_loss: 1.0194, test_f1: 0.4087
 epoch: 5, train_loss: 1.0607, test_loss: 1.0017, test_f1: 0.4217
 epoch: 6, train_loss: 1.0444, test_loss: 0.9950, test_f1: 0.4294
 epoch: 7, train_loss: 1.0162, test_loss: 0.9860, test_f1: 0.4369
 epoch: 8, train_loss: 1.0126, test_loss: 0.9774, test_f1: 0.4601
 epoch: 9, train_loss: 1.0068, test_loss: 0.9811, test_f1: 0.4696
 epoch: 10, train_loss: 0.9946, test_loss: 0.9693, test_f1: 0.4823
 epoch: 11, train_loss: 0.9849, test_loss: 0.9652, test_f1: 0.4868
 epoch: 12, train_loss: 0.9733, test_loss: 0.9625, test_f1: 0.4745
 epoch: 13, train_loss: 0.9680, test_loss: 0.9450, test_f1: 0.4932
 epoch: 14, train_loss: 0.9633, test_loss: 0.9582, test_f1: 0.5013
 epoch: 15, train_loss: 0.9530, test_loss: 0.9473, test_f1: 0.5073
 epoch: 16, train_loss: 0.9512, test_loss: 0.9517, test_f1: 0.5056
 epoch: 17, train_loss: 0.9531, test_loss: 0.9539, test_f1: 0.5087
 epoch: 18, train_loss: 0.9430, test_loss: 0.9500, test_f1: 0.5052
 epoch: 19, train_loss: 0.9448, test_loss: 0.9458, test_f1: 0.5165
 epoch: 20, train_loss: 0.9329, test_loss: 0.9386, test_f1: 0.5220
 epoch: 21, train_loss: 0.9324, test_loss: 0.9484, test_f1: 0.5149
 epoch: 22, train_loss: 0.9293, test_loss: 0.9480, test_f1: 0.5088
 epoch: 23, train_loss: 0.9212, test_loss: 0.9380, test_f1: 0.5220
 epoch: 24, train_loss: 0.9256, test_loss: 0.9581, test_f1: 0.5127
 epoch: 25, train_loss: 0.9093, test_loss: 0.9389, test_f1: 0.5264
 epoch: 26, train_loss: 0.9019, test_loss: 0.9443, test_f1: 0.5233
 epoch: 27, train_loss: 0.9044, test_loss: 0.9473, test_f1: 0.5196
 epoch: 28, train_loss: 0.9067, test_loss: 0.9454, test_f1: 0.5221
 epoch: 29, train_loss: 0.9069, test_loss: 0.9360, test_f1: 0.5222
 epoch: 30, train_loss: 0.8966, test_loss: 0.9356, test_f1: 0.5225
 epoch: 31, train_loss: 0.9017, test_loss: 0.9325, test_f1: 0.5319
 epoch: 32, train_loss: 0.8997, test_loss: 0.9354, test_f1: 0.5283
 epoch: 33, train_loss: 0.8861, test_loss: 0.9417, test_f1: 0.5266
 epoch: 34, train_loss: 0.8957, test_loss: 0.9469, test_f1: 0.5276
 epoch: 35, train_loss: 0.8873, test_loss: 0.9254, test_f1: 0.5304
 epoch: 36, train_loss: 0.8781, test_loss: 0.9311, test_f1: 0.5318
 epoch: 37, train_loss: 0.8758, test_loss: 0.9240, test_f1: 0.5271
 epoch: 38, train_loss: 0.8736, test_loss: 0.9172, test_f1: 0.5340
 epoch: 39, train_loss: 0.8723, test_loss: 0.9367, test_f1: 0.5316
 epoch: 40, train_loss: 0.8689, test_loss: 0.9378, test_f1: 0.5309
 epoch: 41, train_loss: 0.8625, test_loss: 0.9391, test_f1: 0.5266
 epoch: 42, train_loss: 0.8622, test_loss: 0.9275, test_f1: 0.5283
 epoch: 43, train_loss: 0.8518, test_loss: 0.9352, test_f1: 0.5328
 epoch: 44, train_loss: 0.8705, test_loss: 0.9235, test_f1: 0.5262
 epoch: 45, train_loss: 0.8517, test_loss: 0.9395, test_f1: 0.5293
 epoch: 46, train_loss: 0.8493, test_loss: 0.9380, test_f1: 0.5265
 epoch: 47, train_loss: 0.8467, test_loss: 0.9315, test_f1: 0.5314
 epoch: 48, train_loss: 0.8425, test_loss: 0.9405, test_f1: 0.5262
 epoch: 49, train_loss: 0.8431, test_loss: 0.9293, test_f1: 0.5356
 epoch: 50, train_loss: 0.8464, test_loss: 0.9339, test_f1: 0.5329
 epoch: 51, train_loss: 0.8306, test_loss: 0.9369, test_f1: 0.5339
 epoch: 52, train_loss: 0.8412, test_loss: 0.9284, test_f1: 0.5369
 epoch: 53, train_loss: 0.8381, test_loss: 0.9305, test_f1: 0.5293
 epoch: 54, train_loss: 0.8345, test_loss: 0.9377, test_f1: 0.5343
 epoch: 55, train_loss: 0.8400, test_loss: 0.9333, test_f1: 0.5403
 epoch: 56, train_loss: 0.8352, test_loss: 0.9323, test_f1: 0.5280
 epoch: 57, train_loss: 0.8318, test_loss: 0.9366, test_f1: 0.5312
 epoch: 58, train_loss: 0.8201, test_loss: 0.9397, test_f1: 0.5347
 epoch: 59, train_loss: 0.8217, test_loss: 0.9339, test_f1: 0.5400
 epoch: 60, train_loss: 0.8233, test_loss: 0.9385, test_f1: 0.5432
 epoch: 61, train_loss: 0.8315, test_loss: 0.9409, test_f1: 0.5388
 epoch: 62, train_loss: 0.8129, test_loss: 0.9501, test_f1: 0.5293
 epoch: 63, train_loss: 0.8211, test_loss: 0.9383, test_f1: 0.5427
 epoch: 64, train_loss: 0.8169, test_loss: 0.9361, test_f1: 0.5428
 epoch: 65, train_loss: 0.8251, test_loss: 0.9439, test_f1: 0.5362
 epoch: 66, train_loss: 0.8171, test_loss: 0.9313, test_f1: 0.5365
 epoch: 67, train_loss: 0.8143, test_loss: 0.9374, test_f1: 0.5431
 epoch: 68, train_loss: 0.8192, test_loss: 0.9368, test_f1: 0.5422
 epoch: 69, train_loss: 0.8156, test_loss: 0.9416, test_f1: 0.5401
 epoch: 70, train_loss: 0.8158, test_loss: 0.9306, test_f1: 0.5411
 epoch: 71, train_loss: 0.8030, test_loss: 0.9318, test_f1: 0.5527
 epoch: 72, train_loss: 0.8085, test_loss: 0.9379, test_f1: 0.5386
 epoch: 73, train_loss: 0.8171, test_loss: 0.9378, test_f1: 0.5429
 epoch: 74, train_loss: 0.8131, test_loss: 0.9325, test_f1: 0.5455
 epoch: 75, train_loss: 0.8140, test_loss: 0.9380, test_f1: 0.5476
 epoch: 76, train_loss: 0.8035, test_loss: 0.9416, test_f1: 0.5433
 epoch: 77, train_loss: 0.8147, test_loss: 0.9371, test_f1: 0.5490
 epoch: 78, train_loss: 0.8151, test_loss: 0.9354, test_f1: 0.5552
 epoch: 79, train_loss: 0.8053, test_loss: 0.9425, test_f1: 0.5543
 epoch: 80, train_loss: 0.8043, test_loss: 0.9429, test_f1: 0.5469
 epoch: 81, train_loss: 0.8031, test_loss: 0.9435, test_f1: 0.5450
 epoch: 82, train_loss: 0.8006, test_loss: 0.9428, test_f1: 0.5455
 epoch: 83, train_loss: 0.8091, test_loss: 0.9460, test_f1: 0.5520
 epoch: 84, train_loss: 0.7923, test_loss: 0.9394, test_f1: 0.5564
 epoch: 85, train_loss: 0.8086, test_loss: 0.9389, test_f1: 0.5506
 epoch: 86, train_loss: 0.7957, test_loss: 0.9360, test_f1: 0.5487
 epoch: 87, train_loss: 0.8063, test_loss: 0.9446, test_f1: 0.5536
 epoch: 88, train_loss: 0.7982, test_loss: 0.9419, test_f1: 0.5507
 epoch: 89, train_loss: 0.7986, test_loss: 0.9526, test_f1: 0.5529
 epoch: 90, train_loss: 0.7930, test_loss: 0.9495, test_f1: 0.5491
 epoch: 91, train_loss: 0.7882, test_loss: 0.9486, test_f1: 0.5490
 epoch: 92, train_loss: 0.7959, test_loss: 0.9435, test_f1: 0.5497
 epoch: 93, train_loss: 0.7949, test_loss: 0.9437, test_f1: 0.5570
 epoch: 94, train_loss: 0.7902, test_loss: 0.9417, test_f1: 0.5566
 epoch: 95, train_loss: 0.7877, test_loss: 0.9505, test_f1: 0.5564
 epoch: 96, train_loss: 0.7972, test_loss: 0.9476, test_f1: 0.5603
 epoch: 97, train_loss: 0.7916, test_loss: 0.9458, test_f1: 0.5572
 epoch: 98, train_loss: 0.7884, test_loss: 0.9437, test_f1: 0.5547
 epoch: 99, train_loss: 0.8017, test_loss: 0.9373, test_f1: 0.5628
##################ITERATION #8 ****************************************
 epoch: 0, train_loss: 1.3226, test_loss: 1.2013, test_f1: 0.2755
 epoch: 1, train_loss: 1.1967, test_loss: 1.0954, test_f1: 0.3832
 epoch: 2, train_loss: 1.1626, test_loss: 1.0701, test_f1: 0.4007
 epoch: 3, train_loss: 1.1180, test_loss: 1.0601, test_f1: 0.4291
 epoch: 4, train_loss: 1.0939, test_loss: 1.0405, test_f1: 0.4395
 epoch: 5, train_loss: 1.0820, test_loss: 1.0277, test_f1: 0.4447
 epoch: 6, train_loss: 1.0624, test_loss: 1.0077, test_f1: 0.4447
 epoch: 7, train_loss: 1.0466, test_loss: 0.9989, test_f1: 0.4468
 epoch: 8, train_loss: 1.0416, test_loss: 0.9940, test_f1: 0.4765
 epoch: 9, train_loss: 1.0204, test_loss: 0.9914, test_f1: 0.4539
 epoch: 10, train_loss: 1.0230, test_loss: 0.9834, test_f1: 0.4603
 epoch: 11, train_loss: 1.0041, test_loss: 0.9738, test_f1: 0.4604
 epoch: 12, train_loss: 0.9951, test_loss: 0.9690, test_f1: 0.4602
 epoch: 13, train_loss: 0.9825, test_loss: 0.9612, test_f1: 0.4742
 epoch: 14, train_loss: 0.9813, test_loss: 0.9584, test_f1: 0.4835
 epoch: 15, train_loss: 0.9804, test_loss: 0.9572, test_f1: 0.4833
 epoch: 16, train_loss: 0.9754, test_loss: 0.9562, test_f1: 0.4728
 epoch: 17, train_loss: 0.9580, test_loss: 0.9466, test_f1: 0.4822
 epoch: 18, train_loss: 0.9509, test_loss: 0.9438, test_f1: 0.4923
 epoch: 19, train_loss: 0.9473, test_loss: 0.9505, test_f1: 0.5024
 epoch: 20, train_loss: 0.9392, test_loss: 0.9478, test_f1: 0.5027
 epoch: 21, train_loss: 0.9379, test_loss: 0.9417, test_f1: 0.5045
 epoch: 22, train_loss: 0.9423, test_loss: 0.9274, test_f1: 0.5015
 epoch: 23, train_loss: 0.9301, test_loss: 0.9316, test_f1: 0.4978
 epoch: 24, train_loss: 0.9242, test_loss: 0.9347, test_f1: 0.5118
 epoch: 25, train_loss: 0.9265, test_loss: 0.9374, test_f1: 0.5125
 epoch: 26, train_loss: 0.9144, test_loss: 0.9296, test_f1: 0.5078
 epoch: 27, train_loss: 0.9121, test_loss: 0.9366, test_f1: 0.5080
 epoch: 28, train_loss: 0.9127, test_loss: 0.9243, test_f1: 0.5310
 epoch: 29, train_loss: 0.9035, test_loss: 0.9132, test_f1: 0.5109
 epoch: 30, train_loss: 0.9070, test_loss: 0.9155, test_f1: 0.5255
 epoch: 31, train_loss: 0.8977, test_loss: 0.9299, test_f1: 0.5228
 epoch: 32, train_loss: 0.9108, test_loss: 0.9294, test_f1: 0.5179
 epoch: 33, train_loss: 0.8946, test_loss: 0.9194, test_f1: 0.5234
 epoch: 34, train_loss: 0.8844, test_loss: 0.9211, test_f1: 0.5363
 epoch: 35, train_loss: 0.8829, test_loss: 0.9238, test_f1: 0.5233
 epoch: 36, train_loss: 0.8846, test_loss: 0.9255, test_f1: 0.5244
 epoch: 37, train_loss: 0.8805, test_loss: 0.9294, test_f1: 0.5290
 epoch: 38, train_loss: 0.8810, test_loss: 0.9311, test_f1: 0.5250
 epoch: 39, train_loss: 0.8784, test_loss: 0.8994, test_f1: 0.5321
 epoch: 40, train_loss: 0.8773, test_loss: 0.9254, test_f1: 0.5174
 epoch: 41, train_loss: 0.8763, test_loss: 0.9046, test_f1: 0.5235
 epoch: 42, train_loss: 0.8760, test_loss: 0.8973, test_f1: 0.5261
 epoch: 43, train_loss: 0.8626, test_loss: 0.9126, test_f1: 0.5298
 epoch: 44, train_loss: 0.8598, test_loss: 0.9083, test_f1: 0.5217
 epoch: 45, train_loss: 0.8718, test_loss: 0.9061, test_f1: 0.5158
 epoch: 46, train_loss: 0.8553, test_loss: 0.9087, test_f1: 0.5266
 epoch: 47, train_loss: 0.8479, test_loss: 0.9312, test_f1: 0.5224
 epoch: 48, train_loss: 0.8513, test_loss: 0.8726, test_f1: 0.5334
 epoch: 49, train_loss: 0.8590, test_loss: 0.9054, test_f1: 0.5392
 epoch: 50, train_loss: 0.8581, test_loss: 0.8996, test_f1: 0.5441
 epoch: 51, train_loss: 0.8486, test_loss: 0.9049, test_f1: 0.5370
 epoch: 52, train_loss: 0.8477, test_loss: 0.9041, test_f1: 0.5352
 epoch: 53, train_loss: 0.8442, test_loss: 0.9126, test_f1: 0.5332
 epoch: 54, train_loss: 0.8411, test_loss: 0.9202, test_f1: 0.5371
 epoch: 55, train_loss: 0.8349, test_loss: 0.9130, test_f1: 0.5322
 epoch: 56, train_loss: 0.8502, test_loss: 0.9031, test_f1: 0.5293
 epoch: 57, train_loss: 0.8386, test_loss: 0.9154, test_f1: 0.5314
 epoch: 58, train_loss: 0.8390, test_loss: 0.9128, test_f1: 0.5321
 epoch: 59, train_loss: 0.8333, test_loss: 0.9141, test_f1: 0.5383
 epoch: 60, train_loss: 0.8330, test_loss: 0.9051, test_f1: 0.5382
 epoch: 61, train_loss: 0.8278, test_loss: 0.9196, test_f1: 0.5370
 epoch: 62, train_loss: 0.8282, test_loss: 0.9223, test_f1: 0.5447
 epoch: 63, train_loss: 0.8392, test_loss: 0.9346, test_f1: 0.5416
 epoch: 64, train_loss: 0.8293, test_loss: 0.9210, test_f1: 0.5378
 epoch: 65, train_loss: 0.8346, test_loss: 0.9082, test_f1: 0.5367
 epoch: 66, train_loss: 0.8259, test_loss: 0.9047, test_f1: 0.5365
 epoch: 67, train_loss: 0.8284, test_loss: 0.9273, test_f1: 0.5464
 epoch: 68, train_loss: 0.8249, test_loss: 0.9279, test_f1: 0.5419
 epoch: 69, train_loss: 0.8321, test_loss: 0.9113, test_f1: 0.5407
 epoch: 70, train_loss: 0.8284, test_loss: 0.9015, test_f1: 0.5464
 epoch: 71, train_loss: 0.8205, test_loss: 0.9227, test_f1: 0.5512
 epoch: 72, train_loss: 0.8217, test_loss: 0.9234, test_f1: 0.5375
 epoch: 73, train_loss: 0.8200, test_loss: 0.8944, test_f1: 0.5502
 epoch: 74, train_loss: 0.8171, test_loss: 0.9074, test_f1: 0.5477
 epoch: 75, train_loss: 0.8201, test_loss: 0.9098, test_f1: 0.5497
 epoch: 76, train_loss: 0.8157, test_loss: 0.9095, test_f1: 0.5516
 epoch: 77, train_loss: 0.8243, test_loss: 0.9114, test_f1: 0.5521
 epoch: 78, train_loss: 0.8160, test_loss: 0.8948, test_f1: 0.5546
 epoch: 79, train_loss: 0.8063, test_loss: 0.9327, test_f1: 0.5377
 epoch: 80, train_loss: 0.8082, test_loss: 0.9222, test_f1: 0.5472
 epoch: 81, train_loss: 0.8024, test_loss: 0.9005, test_f1: 0.5500
 epoch: 82, train_loss: 0.8108, test_loss: 0.8947, test_f1: 0.5426
 epoch: 83, train_loss: 0.8218, test_loss: 0.9127, test_f1: 0.5538
 epoch: 84, train_loss: 0.8022, test_loss: 0.8959, test_f1: 0.5438
 epoch: 85, train_loss: 0.8032, test_loss: 0.9083, test_f1: 0.5435
 epoch: 86, train_loss: 0.8183, test_loss: 0.9099, test_f1: 0.5487
 epoch: 87, train_loss: 0.8061, test_loss: 0.9041, test_f1: 0.5427
 epoch: 88, train_loss: 0.8018, test_loss: 0.9110, test_f1: 0.5518
 epoch: 89, train_loss: 0.8142, test_loss: 0.9146, test_f1: 0.5513
 epoch: 90, train_loss: 0.7949, test_loss: 0.8972, test_f1: 0.5501
 epoch: 91, train_loss: 0.7907, test_loss: 0.9152, test_f1: 0.5526
 epoch: 92, train_loss: 0.7936, test_loss: 0.9119, test_f1: 0.5501
 epoch: 93, train_loss: 0.8005, test_loss: 0.8971, test_f1: 0.5506
 epoch: 94, train_loss: 0.8059, test_loss: 0.8993, test_f1: 0.5502
 epoch: 95, train_loss: 0.7909, test_loss: 0.8985, test_f1: 0.5611
 epoch: 96, train_loss: 0.7940, test_loss: 0.9000, test_f1: 0.5570
 epoch: 97, train_loss: 0.7984, test_loss: 0.9079, test_f1: 0.5581
 epoch: 98, train_loss: 0.7956, test_loss: 0.9131, test_f1: 0.5432
 epoch: 99, train_loss: 0.7891, test_loss: 0.8820, test_f1: 0.5520
##################ITERATION #9 ****************************************
 epoch: 0, train_loss: 1.3547, test_loss: 1.1527, test_f1: 0.3334
 epoch: 1, train_loss: 1.1964, test_loss: 1.0987, test_f1: 0.3672
 epoch: 2, train_loss: 1.1456, test_loss: 1.0702, test_f1: 0.3926
 epoch: 3, train_loss: 1.1198, test_loss: 1.0422, test_f1: 0.4113
 epoch: 4, train_loss: 1.0876, test_loss: 1.0253, test_f1: 0.4340
 epoch: 5, train_loss: 1.0724, test_loss: 1.0132, test_f1: 0.4493
 epoch: 6, train_loss: 1.0587, test_loss: 1.0061, test_f1: 0.4387
 epoch: 7, train_loss: 1.0358, test_loss: 0.9941, test_f1: 0.4650
 epoch: 8, train_loss: 1.0293, test_loss: 0.9954, test_f1: 0.4640
 epoch: 9, train_loss: 1.0034, test_loss: 0.9973, test_f1: 0.4792
 epoch: 10, train_loss: 0.9976, test_loss: 0.9916, test_f1: 0.4739
 epoch: 11, train_loss: 0.9798, test_loss: 0.9903, test_f1: 0.4791
 epoch: 12, train_loss: 0.9821, test_loss: 0.9796, test_f1: 0.4914
 epoch: 13, train_loss: 0.9722, test_loss: 0.9744, test_f1: 0.4784
 epoch: 14, train_loss: 0.9670, test_loss: 0.9670, test_f1: 0.4843
 epoch: 15, train_loss: 0.9554, test_loss: 0.9770, test_f1: 0.4864
 epoch: 16, train_loss: 0.9482, test_loss: 0.9700, test_f1: 0.4829
 epoch: 17, train_loss: 0.9449, test_loss: 0.9608, test_f1: 0.4862
 epoch: 18, train_loss: 0.9431, test_loss: 0.9631, test_f1: 0.4792
 epoch: 19, train_loss: 0.9478, test_loss: 0.9486, test_f1: 0.5079
 epoch: 20, train_loss: 0.9341, test_loss: 0.9538, test_f1: 0.4950
 epoch: 21, train_loss: 0.9366, test_loss: 0.9439, test_f1: 0.4901
 epoch: 22, train_loss: 0.9407, test_loss: 0.9393, test_f1: 0.4978
 epoch: 23, train_loss: 0.9320, test_loss: 0.9416, test_f1: 0.5224
 epoch: 24, train_loss: 0.9185, test_loss: 0.9487, test_f1: 0.4962
 epoch: 25, train_loss: 0.9105, test_loss: 0.9370, test_f1: 0.5230
 epoch: 26, train_loss: 0.9110, test_loss: 0.9371, test_f1: 0.5195
 epoch: 27, train_loss: 0.9166, test_loss: 0.9417, test_f1: 0.5032
 epoch: 28, train_loss: 0.9154, test_loss: 0.9349, test_f1: 0.5275
 epoch: 29, train_loss: 0.9082, test_loss: 0.9400, test_f1: 0.5175
 epoch: 30, train_loss: 0.9066, test_loss: 0.9373, test_f1: 0.5251
 epoch: 31, train_loss: 0.8933, test_loss: 0.9291, test_f1: 0.5199
 epoch: 32, train_loss: 0.8872, test_loss: 0.9310, test_f1: 0.5197
 epoch: 33, train_loss: 0.8851, test_loss: 0.9361, test_f1: 0.5197
 epoch: 34, train_loss: 0.8876, test_loss: 0.9264, test_f1: 0.5322
 epoch: 35, train_loss: 0.8779, test_loss: 0.9354, test_f1: 0.5281
 epoch: 36, train_loss: 0.8831, test_loss: 0.9235, test_f1: 0.5402
 epoch: 37, train_loss: 0.8699, test_loss: 0.9252, test_f1: 0.5478
 epoch: 38, train_loss: 0.8693, test_loss: 0.9351, test_f1: 0.5453
 epoch: 39, train_loss: 0.8812, test_loss: 0.9177, test_f1: 0.5442
 epoch: 40, train_loss: 0.8621, test_loss: 0.9273, test_f1: 0.5362
 epoch: 41, train_loss: 0.8600, test_loss: 0.9205, test_f1: 0.5466
 epoch: 42, train_loss: 0.8705, test_loss: 0.9269, test_f1: 0.5522
 epoch: 43, train_loss: 0.8682, test_loss: 0.9239, test_f1: 0.5545
 epoch: 44, train_loss: 0.8441, test_loss: 0.9280, test_f1: 0.5331
 epoch: 45, train_loss: 0.8620, test_loss: 0.9167, test_f1: 0.5460
 epoch: 46, train_loss: 0.8593, test_loss: 0.9184, test_f1: 0.5511
 epoch: 47, train_loss: 0.8482, test_loss: 0.9225, test_f1: 0.5473
 epoch: 48, train_loss: 0.8446, test_loss: 0.9161, test_f1: 0.5476
 epoch: 49, train_loss: 0.8450, test_loss: 0.9143, test_f1: 0.5376
 epoch: 50, train_loss: 0.8513, test_loss: 0.9579, test_f1: 0.5280
 epoch: 51, train_loss: 0.8404, test_loss: 0.9106, test_f1: 0.5518
 epoch: 52, train_loss: 0.8309, test_loss: 0.9263, test_f1: 0.5541
 epoch: 53, train_loss: 0.8330, test_loss: 0.9200, test_f1: 0.5580
 epoch: 54, train_loss: 0.8410, test_loss: 0.9192, test_f1: 0.5568
 epoch: 55, train_loss: 0.8363, test_loss: 0.9112, test_f1: 0.5464
 epoch: 56, train_loss: 0.8319, test_loss: 0.9177, test_f1: 0.5530
 epoch: 57, train_loss: 0.8271, test_loss: 0.9136, test_f1: 0.5536
 epoch: 58, train_loss: 0.8309, test_loss: 0.9150, test_f1: 0.5536
 epoch: 59, train_loss: 0.8297, test_loss: 0.9159, test_f1: 0.5498
 epoch: 60, train_loss: 0.8340, test_loss: 0.9131, test_f1: 0.5574
 epoch: 61, train_loss: 0.8227, test_loss: 0.9147, test_f1: 0.5479
 epoch: 62, train_loss: 0.8282, test_loss: 0.9144, test_f1: 0.5626
 epoch: 63, train_loss: 0.8146, test_loss: 0.9033, test_f1: 0.5550
 epoch: 64, train_loss: 0.8153, test_loss: 0.9052, test_f1: 0.5591
 epoch: 65, train_loss: 0.8273, test_loss: 0.9133, test_f1: 0.5605
 epoch: 66, train_loss: 0.8233, test_loss: 0.9120, test_f1: 0.5632
 epoch: 67, train_loss: 0.8157, test_loss: 0.9038, test_f1: 0.5565
 epoch: 68, train_loss: 0.8206, test_loss: 0.9137, test_f1: 0.5505
 epoch: 69, train_loss: 0.8076, test_loss: 0.9069, test_f1: 0.5660
 epoch: 70, train_loss: 0.8150, test_loss: 0.9042, test_f1: 0.5552
 epoch: 71, train_loss: 0.8104, test_loss: 0.9207, test_f1: 0.5468
 epoch: 72, train_loss: 0.8145, test_loss: 0.9184, test_f1: 0.5601
 epoch: 73, train_loss: 0.8124, test_loss: 0.9217, test_f1: 0.5438
 epoch: 74, train_loss: 0.7957, test_loss: 0.9172, test_f1: 0.5516
 epoch: 75, train_loss: 0.8039, test_loss: 0.9181, test_f1: 0.5537
 epoch: 76, train_loss: 0.8022, test_loss: 0.9079, test_f1: 0.5707
 epoch: 77, train_loss: 0.8018, test_loss: 0.9131, test_f1: 0.5578
 epoch: 78, train_loss: 0.8098, test_loss: 0.9162, test_f1: 0.5450
 epoch: 79, train_loss: 0.7973, test_loss: 0.9096, test_f1: 0.5668
 epoch: 80, train_loss: 0.7993, test_loss: 0.9103, test_f1: 0.5571
 epoch: 81, train_loss: 0.7856, test_loss: 0.9070, test_f1: 0.5559
 epoch: 82, train_loss: 0.7914, test_loss: 0.9091, test_f1: 0.5653
 epoch: 83, train_loss: 0.7984, test_loss: 0.9196, test_f1: 0.5624
 epoch: 84, train_loss: 0.8046, test_loss: 0.9159, test_f1: 0.5650
 epoch: 85, train_loss: 0.7904, test_loss: 0.9092, test_f1: 0.5655
 epoch: 86, train_loss: 0.8110, test_loss: 0.9202, test_f1: 0.5623
 epoch: 87, train_loss: 0.7902, test_loss: 0.9212, test_f1: 0.5625
 epoch: 88, train_loss: 0.7940, test_loss: 0.9177, test_f1: 0.5621
 epoch: 89, train_loss: 0.7856, test_loss: 0.9124, test_f1: 0.5606
 epoch: 90, train_loss: 0.7850, test_loss: 0.9143, test_f1: 0.5559
 epoch: 91, train_loss: 0.7922, test_loss: 0.9303, test_f1: 0.5524
 epoch: 92, train_loss: 0.7810, test_loss: 0.9163, test_f1: 0.5577
 epoch: 93, train_loss: 0.7844, test_loss: 0.9248, test_f1: 0.5617
 epoch: 94, train_loss: 0.7814, test_loss: 0.9120, test_f1: 0.5756
 epoch: 95, train_loss: 0.7729, test_loss: 0.9135, test_f1: 0.5628
 epoch: 96, train_loss: 0.7876, test_loss: 0.9166, test_f1: 0.5740
 epoch: 97, train_loss: 0.7884, test_loss: 0.9145, test_f1: 0.5654
 epoch: 98, train_loss: 0.7820, test_loss: 0.9132, test_f1: 0.5760
 epoch: 99, train_loss: 0.7831, test_loss: 0.9323, test_f1: 0.5587

Training completed in 556.85 seconds
Best F1: 0.5760 at epoch 98
Mean F1 across iterations: 0.5563  0.0172
========================FINAL RESULTS================================
FEGIN weighted F1: 0.5760  0.0172
python main.py --data ltspice_examples --representation component_net --model FEGIN --layers 2 --hiddens 64 --batch_size 64 --lr 0.0001 --emb_size 128 --epochs 100 --save_appendix component_net_L2_H64_BS64_LR0.0001_E128 --no_val
-----



STDERR:
  File "main.py", line 370, in <module>
    main()
  File "main.py", line 254, in main
    dataset = dataset_class(
  File "/home/philip/projects/ltspice_examples_code_repo/Circuit-Completion-Using-GNNs/component_classification_with_link_prediction_head/evaluation/FEGIN/kernel/circuit_datasets.py", line 15, in __init__
    self.data, self.slices = torch.load(self.processed_paths[0])
  File "/home/philip/.local/lib/python3.8/site-packages/torch/serialization.py", line 1040, in load
    warnings.warn(
  File "/usr/lib/python3.8/warnings.py", line 109, in _showwarnmsg
    sw(msg.message, msg.category, msg.filename, msg.lineno,
  File "main.py", line 47, in warn_with_traceback
    traceback.print_stack(file=log)
/home/philip/projects/ltspice_examples_code_repo/Circuit-Completion-Using-GNNs/component_classification_with_link_prediction_head/evaluation/FEGIN/kernel/circuit_datasets.py:15: FutureWarning: You are using `torch.load` with `weights_only=False` (the current default value), which uses the default pickle module implicitly. It is possible to construct malicious pickle data which will execute arbitrary code during unpickling (See https://github.com/pytorch/pytorch/blob/main/SECURITY.md#untrusted-models for more details). In a future release, the default value for `weights_only` will be flipped to `True`. This limits the functions that could be executed during unpickling. Arbitrary objects will no longer be allowed to be loaded via this mode unless they are explicitly allowlisted by the user via `torch.serialization.add_safe_globals`. We recommend you start setting `weights_only=True` for any use case where you don't have full control of the loaded file. Please open an issue on GitHub for any issues related to this experimental feature.
  self.data, self.slices = torch.load(self.processed_paths[0])
