STDOUT:
Results will be saved in /home/philip/projects/ltspice_examples_code_repo/Circuit-Completion-Using-GNNs/component_classification_with_link_prediction_head/evaluation/FEGIN/results/model_FEGIN_dataset_ltspice_examples
Command line input: python main.py --data ltspice_examples --representation component_net --model FEGIN --layers 6 --hiddens 128 --batch_size 256 --lr 0.0001 --emb_size 512 --epochs 100 --save_appendix component_net_L6_H128_BS256_LR0.0001_E512 --no_val
 is saved.
-----
ltspice_examples - FEGIN
Using 6 layers, 128 hidden units, h = 2
Loading component_net representation dataset
ENTERED
Training FEGIN on component_net representation
Train: 3558, Test: 846
##################ITERATION #0 ****************************************
 epoch: 0, train_loss: 1.3541, test_loss: 1.3630, test_f1: 0.2270
 epoch: 1, train_loss: 1.3332, test_loss: 1.3571, test_f1: 0.2270
 epoch: 2, train_loss: 1.3172, test_loss: 1.3428, test_f1: 0.2270
 epoch: 3, train_loss: 1.2980, test_loss: 1.3193, test_f1: 0.2270
 epoch: 4, train_loss: 1.2747, test_loss: 1.2874, test_f1: 0.2812
 epoch: 5, train_loss: 1.2497, test_loss: 1.2456, test_f1: 0.3209
 epoch: 6, train_loss: 1.2210, test_loss: 1.2095, test_f1: 0.3457
 epoch: 7, train_loss: 1.1938, test_loss: 1.1744, test_f1: 0.3542
 epoch: 8, train_loss: 1.1611, test_loss: 1.1432, test_f1: 0.3894
 epoch: 9, train_loss: 1.1388, test_loss: 1.1128, test_f1: 0.4143
 epoch: 10, train_loss: 1.1129, test_loss: 1.0817, test_f1: 0.4260
 epoch: 11, train_loss: 1.0883, test_loss: 1.0603, test_f1: 0.4686
 epoch: 12, train_loss: 1.0642, test_loss: 1.0406, test_f1: 0.4800
 epoch: 13, train_loss: 1.0421, test_loss: 1.0204, test_f1: 0.5205
 epoch: 14, train_loss: 1.0179, test_loss: 0.9929, test_f1: 0.5196
 epoch: 15, train_loss: 0.9896, test_loss: 0.9633, test_f1: 0.5434
 epoch: 16, train_loss: 0.9646, test_loss: 0.9509, test_f1: 0.5040
 epoch: 17, train_loss: 0.9483, test_loss: 0.9388, test_f1: 0.5182
 epoch: 18, train_loss: 0.9203, test_loss: 0.9117, test_f1: 0.5337
 epoch: 19, train_loss: 0.9012, test_loss: 0.9046, test_f1: 0.5391
 epoch: 20, train_loss: 0.8878, test_loss: 0.9050, test_f1: 0.5278
 epoch: 21, train_loss: 0.8826, test_loss: 0.9051, test_f1: 0.5261
 epoch: 22, train_loss: 0.8565, test_loss: 0.9006, test_f1: 0.5264
 epoch: 23, train_loss: 0.8486, test_loss: 0.9078, test_f1: 0.5414
 epoch: 24, train_loss: 0.8383, test_loss: 0.8890, test_f1: 0.5151
 epoch: 25, train_loss: 0.8308, test_loss: 0.9083, test_f1: 0.5359
 epoch: 26, train_loss: 0.8237, test_loss: 0.8906, test_f1: 0.5238
 epoch: 27, train_loss: 0.8163, test_loss: 0.8811, test_f1: 0.5344
 epoch: 28, train_loss: 0.8131, test_loss: 0.8847, test_f1: 0.5324
 epoch: 29, train_loss: 0.7933, test_loss: 0.8928, test_f1: 0.5321
 epoch: 30, train_loss: 0.7822, test_loss: 0.9017, test_f1: 0.5418
 epoch: 31, train_loss: 0.7740, test_loss: 0.8972, test_f1: 0.5271
 epoch: 32, train_loss: 0.7663, test_loss: 0.8988, test_f1: 0.5238
 epoch: 33, train_loss: 0.7599, test_loss: 0.8927, test_f1: 0.5348
 epoch: 34, train_loss: 0.7500, test_loss: 0.8861, test_f1: 0.5547
 epoch: 35, train_loss: 0.7510, test_loss: 0.9238, test_f1: 0.5423
 epoch: 36, train_loss: 0.7462, test_loss: 0.8939, test_f1: 0.5406
 epoch: 37, train_loss: 0.7347, test_loss: 0.9276, test_f1: 0.5234
 epoch: 38, train_loss: 0.7266, test_loss: 0.9066, test_f1: 0.5266
 epoch: 39, train_loss: 0.7215, test_loss: 0.9068, test_f1: 0.5442
 epoch: 40, train_loss: 0.7179, test_loss: 0.9066, test_f1: 0.5250
 epoch: 41, train_loss: 0.7078, test_loss: 0.9214, test_f1: 0.5421
 epoch: 42, train_loss: 0.6987, test_loss: 0.9263, test_f1: 0.5402
 epoch: 43, train_loss: 0.6936, test_loss: 0.9334, test_f1: 0.5579
 epoch: 44, train_loss: 0.6994, test_loss: 0.9393, test_f1: 0.5359
 epoch: 45, train_loss: 0.6862, test_loss: 0.9447, test_f1: 0.5235
 epoch: 46, train_loss: 0.6945, test_loss: 0.9612, test_f1: 0.5167
 epoch: 47, train_loss: 0.6823, test_loss: 0.9419, test_f1: 0.5176
 epoch: 48, train_loss: 0.6747, test_loss: 0.9437, test_f1: 0.5540
 epoch: 49, train_loss: 0.6697, test_loss: 0.9304, test_f1: 0.5574
 epoch: 50, train_loss: 0.6646, test_loss: 0.9515, test_f1: 0.5667
 epoch: 51, train_loss: 0.6509, test_loss: 0.9460, test_f1: 0.5630
 epoch: 52, train_loss: 0.6472, test_loss: 0.9643, test_f1: 0.5601
 epoch: 53, train_loss: 0.6430, test_loss: 0.9553, test_f1: 0.5463
 epoch: 54, train_loss: 0.6352, test_loss: 0.9520, test_f1: 0.5605
 epoch: 55, train_loss: 0.6325, test_loss: 0.9557, test_f1: 0.5637
 epoch: 56, train_loss: 0.6401, test_loss: 0.9681, test_f1: 0.5764
 epoch: 57, train_loss: 0.6287, test_loss: 0.9658, test_f1: 0.5770
 epoch: 58, train_loss: 0.6231, test_loss: 0.9678, test_f1: 0.5753
 epoch: 59, train_loss: 0.6185, test_loss: 0.9615, test_f1: 0.5777
 epoch: 60, train_loss: 0.6185, test_loss: 0.9647, test_f1: 0.5658
 epoch: 61, train_loss: 0.6253, test_loss: 0.9991, test_f1: 0.5707
 epoch: 62, train_loss: 0.6161, test_loss: 0.9737, test_f1: 0.5693
 epoch: 63, train_loss: 0.6079, test_loss: 0.9880, test_f1: 0.5685
 epoch: 64, train_loss: 0.6081, test_loss: 0.9912, test_f1: 0.5615
 epoch: 65, train_loss: 0.5999, test_loss: 0.9657, test_f1: 0.5846
 epoch: 66, train_loss: 0.6159, test_loss: 0.9802, test_f1: 0.5882
 epoch: 67, train_loss: 0.6032, test_loss: 0.9818, test_f1: 0.5868
 epoch: 68, train_loss: 0.5983, test_loss: 0.9911, test_f1: 0.5761
 epoch: 69, train_loss: 0.5948, test_loss: 0.9693, test_f1: 0.5755
 epoch: 70, train_loss: 0.5953, test_loss: 0.9869, test_f1: 0.5936
 epoch: 71, train_loss: 0.5878, test_loss: 0.9906, test_f1: 0.5937
 epoch: 72, train_loss: 0.5835, test_loss: 1.0086, test_f1: 0.5837
 epoch: 73, train_loss: 0.5822, test_loss: 1.0444, test_f1: 0.5898
 epoch: 74, train_loss: 0.5856, test_loss: 1.0014, test_f1: 0.5927
 epoch: 75, train_loss: 0.5870, test_loss: 1.0130, test_f1: 0.5796
 epoch: 76, train_loss: 0.5745, test_loss: 1.0270, test_f1: 0.5849
 epoch: 77, train_loss: 0.5870, test_loss: 0.9920, test_f1: 0.5787
 epoch: 78, train_loss: 0.5606, test_loss: 1.0001, test_f1: 0.5806
 epoch: 79, train_loss: 0.5716, test_loss: 1.0128, test_f1: 0.5815
 epoch: 80, train_loss: 0.5690, test_loss: 0.9927, test_f1: 0.5831
 epoch: 81, train_loss: 0.5567, test_loss: 1.0007, test_f1: 0.5815
 epoch: 82, train_loss: 0.5598, test_loss: 0.9927, test_f1: 0.5722
 epoch: 83, train_loss: 0.5735, test_loss: 0.9929, test_f1: 0.5867
 epoch: 84, train_loss: 0.5658, test_loss: 1.0199, test_f1: 0.5927
 epoch: 85, train_loss: 0.5570, test_loss: 1.0148, test_f1: 0.5855
 epoch: 86, train_loss: 0.5547, test_loss: 1.0048, test_f1: 0.5914
 epoch: 87, train_loss: 0.5451, test_loss: 1.0292, test_f1: 0.5825
 epoch: 88, train_loss: 0.5514, test_loss: 1.0083, test_f1: 0.5815
 epoch: 89, train_loss: 0.5504, test_loss: 1.0295, test_f1: 0.5866
 epoch: 90, train_loss: 0.5464, test_loss: 1.0286, test_f1: 0.5856
 epoch: 91, train_loss: 0.5377, test_loss: 1.0224, test_f1: 0.5878
 epoch: 92, train_loss: 0.5470, test_loss: 1.0418, test_f1: 0.5791
 epoch: 93, train_loss: 0.5291, test_loss: 1.0393, test_f1: 0.5893
 epoch: 94, train_loss: 0.5415, test_loss: 1.1060, test_f1: 0.5710
 epoch: 95, train_loss: 0.5381, test_loss: 1.0706, test_f1: 0.5837
 epoch: 96, train_loss: 0.5214, test_loss: 1.0453, test_f1: 0.6024
 epoch: 97, train_loss: 0.5325, test_loss: 1.0625, test_f1: 0.5920
 epoch: 98, train_loss: 0.5082, test_loss: 1.0348, test_f1: 0.6110
 epoch: 99, train_loss: 0.5218, test_loss: 1.0413, test_f1: 0.6028
##################ITERATION #1 ****************************************
 epoch: 0, train_loss: 1.3077, test_loss: 1.3472, test_f1: 0.2270
 epoch: 1, train_loss: 1.2571, test_loss: 1.3231, test_f1: 0.2270
 epoch: 2, train_loss: 1.2278, test_loss: 1.2837, test_f1: 0.2270
 epoch: 3, train_loss: 1.1970, test_loss: 1.2400, test_f1: 0.2725
 epoch: 4, train_loss: 1.1689, test_loss: 1.1744, test_f1: 0.3647
 epoch: 5, train_loss: 1.1406, test_loss: 1.1265, test_f1: 0.4243
 epoch: 6, train_loss: 1.1110, test_loss: 1.0856, test_f1: 0.4607
 epoch: 7, train_loss: 1.0851, test_loss: 1.0518, test_f1: 0.4802
 epoch: 8, train_loss: 1.0567, test_loss: 1.0245, test_f1: 0.4832
 epoch: 9, train_loss: 1.0323, test_loss: 0.9982, test_f1: 0.5058
 epoch: 10, train_loss: 1.0077, test_loss: 0.9729, test_f1: 0.5262
 epoch: 11, train_loss: 0.9815, test_loss: 0.9512, test_f1: 0.5447
 epoch: 12, train_loss: 0.9524, test_loss: 0.9320, test_f1: 0.5343
 epoch: 13, train_loss: 0.9415, test_loss: 0.9146, test_f1: 0.5437
 epoch: 14, train_loss: 0.9122, test_loss: 0.8983, test_f1: 0.5426
 epoch: 15, train_loss: 0.8984, test_loss: 0.9198, test_f1: 0.5518
 epoch: 16, train_loss: 0.8863, test_loss: 0.9189, test_f1: 0.5254
 epoch: 17, train_loss: 0.8740, test_loss: 0.9192, test_f1: 0.5325
 epoch: 18, train_loss: 0.8554, test_loss: 0.8838, test_f1: 0.5639
 epoch: 19, train_loss: 0.8438, test_loss: 0.9045, test_f1: 0.5506
 epoch: 20, train_loss: 0.8308, test_loss: 0.9028, test_f1: 0.5658
 epoch: 21, train_loss: 0.8254, test_loss: 0.8801, test_f1: 0.5654
 epoch: 22, train_loss: 0.8141, test_loss: 0.9153, test_f1: 0.5521
 epoch: 23, train_loss: 0.8036, test_loss: 0.9116, test_f1: 0.5681
 epoch: 24, train_loss: 0.7844, test_loss: 0.9053, test_f1: 0.5775
 epoch: 25, train_loss: 0.7799, test_loss: 0.9306, test_f1: 0.5610
 epoch: 26, train_loss: 0.7791, test_loss: 0.9134, test_f1: 0.5630
 epoch: 27, train_loss: 0.7610, test_loss: 0.9441, test_f1: 0.5583
 epoch: 28, train_loss: 0.7535, test_loss: 0.9081, test_f1: 0.5778
 epoch: 29, train_loss: 0.7505, test_loss: 0.9312, test_f1: 0.5649
 epoch: 30, train_loss: 0.7498, test_loss: 0.9219, test_f1: 0.5621
 epoch: 31, train_loss: 0.7304, test_loss: 0.9136, test_f1: 0.5669
 epoch: 32, train_loss: 0.7268, test_loss: 0.9390, test_f1: 0.5791
 epoch: 33, train_loss: 0.7116, test_loss: 0.9137, test_f1: 0.5699
 epoch: 34, train_loss: 0.7097, test_loss: 0.9607, test_f1: 0.5523
 epoch: 35, train_loss: 0.7044, test_loss: 0.9514, test_f1: 0.5786
 epoch: 36, train_loss: 0.7028, test_loss: 0.9490, test_f1: 0.5863
 epoch: 37, train_loss: 0.6885, test_loss: 0.9271, test_f1: 0.5922
 epoch: 38, train_loss: 0.6904, test_loss: 0.9070, test_f1: 0.5991
 epoch: 39, train_loss: 0.6850, test_loss: 0.9624, test_f1: 0.5763
 epoch: 40, train_loss: 0.6731, test_loss: 0.9504, test_f1: 0.5812
 epoch: 41, train_loss: 0.6617, test_loss: 0.9378, test_f1: 0.5902
 epoch: 42, train_loss: 0.6575, test_loss: 0.9629, test_f1: 0.5797
 epoch: 43, train_loss: 0.6573, test_loss: 0.9543, test_f1: 0.5957
 epoch: 44, train_loss: 0.6583, test_loss: 0.9405, test_f1: 0.5985
 epoch: 45, train_loss: 0.6475, test_loss: 0.9356, test_f1: 0.6055
 epoch: 46, train_loss: 0.6357, test_loss: 0.9533, test_f1: 0.5932
 epoch: 47, train_loss: 0.6342, test_loss: 0.9604, test_f1: 0.5975
 epoch: 48, train_loss: 0.6388, test_loss: 1.0338, test_f1: 0.5744
 epoch: 49, train_loss: 0.6254, test_loss: 0.9545, test_f1: 0.6141
 epoch: 50, train_loss: 0.6340, test_loss: 0.9879, test_f1: 0.5898
 epoch: 51, train_loss: 0.6082, test_loss: 0.9649, test_f1: 0.5834
 epoch: 52, train_loss: 0.5978, test_loss: 0.9675, test_f1: 0.5911
 epoch: 53, train_loss: 0.6024, test_loss: 0.9532, test_f1: 0.6062
 epoch: 54, train_loss: 0.5939, test_loss: 0.9590, test_f1: 0.5982
 epoch: 55, train_loss: 0.5861, test_loss: 0.9668, test_f1: 0.5967
 epoch: 56, train_loss: 0.5817, test_loss: 0.9865, test_f1: 0.6024
 epoch: 57, train_loss: 0.5858, test_loss: 0.9891, test_f1: 0.6115
 epoch: 58, train_loss: 0.5819, test_loss: 1.0004, test_f1: 0.5985
 epoch: 59, train_loss: 0.5692, test_loss: 0.9577, test_f1: 0.6056
 epoch: 60, train_loss: 0.5824, test_loss: 0.9946, test_f1: 0.6055
 epoch: 61, train_loss: 0.5654, test_loss: 0.9894, test_f1: 0.6060
 epoch: 62, train_loss: 0.5732, test_loss: 0.9955, test_f1: 0.5974
 epoch: 63, train_loss: 0.5559, test_loss: 0.9982, test_f1: 0.6175
 epoch: 64, train_loss: 0.5556, test_loss: 1.0077, test_f1: 0.6069
 epoch: 65, train_loss: 0.5574, test_loss: 1.0094, test_f1: 0.6105
 epoch: 66, train_loss: 0.5425, test_loss: 0.9931, test_f1: 0.6145
 epoch: 67, train_loss: 0.5351, test_loss: 1.0025, test_f1: 0.6197
 epoch: 68, train_loss: 0.5342, test_loss: 1.0241, test_f1: 0.6148
 epoch: 69, train_loss: 0.5287, test_loss: 1.0321, test_f1: 0.6027
 epoch: 70, train_loss: 0.5302, test_loss: 1.0075, test_f1: 0.6183
 epoch: 71, train_loss: 0.5190, test_loss: 1.0456, test_f1: 0.6058
 epoch: 72, train_loss: 0.5301, test_loss: 1.0534, test_f1: 0.6039
 epoch: 73, train_loss: 0.5387, test_loss: 1.0409, test_f1: 0.6061
 epoch: 74, train_loss: 0.5239, test_loss: 1.0585, test_f1: 0.5967
 epoch: 75, train_loss: 0.5149, test_loss: 1.0197, test_f1: 0.6107
 epoch: 76, train_loss: 0.5162, test_loss: 1.0510, test_f1: 0.6158
 epoch: 77, train_loss: 0.5139, test_loss: 1.0346, test_f1: 0.6166
 epoch: 78, train_loss: 0.5320, test_loss: 1.0769, test_f1: 0.6197
 epoch: 79, train_loss: 0.5146, test_loss: 1.0680, test_f1: 0.5930
 epoch: 80, train_loss: 0.5200, test_loss: 1.0284, test_f1: 0.6271
 epoch: 81, train_loss: 0.5153, test_loss: 1.0935, test_f1: 0.6005
 epoch: 82, train_loss: 0.5112, test_loss: 1.0494, test_f1: 0.6291
 epoch: 83, train_loss: 0.5042, test_loss: 1.0437, test_f1: 0.6096
 epoch: 84, train_loss: 0.5122, test_loss: 1.0708, test_f1: 0.6122
 epoch: 85, train_loss: 0.5132, test_loss: 1.0757, test_f1: 0.6146
 epoch: 86, train_loss: 0.4912, test_loss: 1.0454, test_f1: 0.6196
 epoch: 87, train_loss: 0.4884, test_loss: 1.0748, test_f1: 0.6115
 epoch: 88, train_loss: 0.4956, test_loss: 1.0780, test_f1: 0.6168
 epoch: 89, train_loss: 0.4900, test_loss: 1.0834, test_f1: 0.6099
 epoch: 90, train_loss: 0.4950, test_loss: 1.0775, test_f1: 0.6179
 epoch: 91, train_loss: 0.5069, test_loss: 1.0886, test_f1: 0.6143
 epoch: 92, train_loss: 0.4796, test_loss: 1.1079, test_f1: 0.6162
 epoch: 93, train_loss: 0.4620, test_loss: 1.1159, test_f1: 0.6021
 epoch: 94, train_loss: 0.4761, test_loss: 1.0893, test_f1: 0.6194
 epoch: 95, train_loss: 0.4758, test_loss: 1.0870, test_f1: 0.6276
 epoch: 96, train_loss: 0.4669, test_loss: 1.1041, test_f1: 0.6142
 epoch: 97, train_loss: 0.4619, test_loss: 1.1069, test_f1: 0.6193
 epoch: 98, train_loss: 0.4650, test_loss: 1.1367, test_f1: 0.6362
 epoch: 99, train_loss: 0.4621, test_loss: 1.1455, test_f1: 0.6330
##################ITERATION #2 ****************************************
 epoch: 0, train_loss: 1.2563, test_loss: 1.3397, test_f1: 0.2270
 epoch: 1, train_loss: 1.1759, test_loss: 1.3237, test_f1: 0.2295
 epoch: 2, train_loss: 1.1407, test_loss: 1.2669, test_f1: 0.3374
 epoch: 3, train_loss: 1.1029, test_loss: 1.1767, test_f1: 0.4136
 epoch: 4, train_loss: 1.0699, test_loss: 1.0847, test_f1: 0.4566
 epoch: 5, train_loss: 1.0411, test_loss: 1.0424, test_f1: 0.4854
 epoch: 6, train_loss: 1.0199, test_loss: 0.9875, test_f1: 0.4756
 epoch: 7, train_loss: 0.9891, test_loss: 0.9632, test_f1: 0.4934
 epoch: 8, train_loss: 0.9688, test_loss: 0.9447, test_f1: 0.4969
 epoch: 9, train_loss: 0.9453, test_loss: 0.9373, test_f1: 0.4905
 epoch: 10, train_loss: 0.9249, test_loss: 0.9371, test_f1: 0.5018
 epoch: 11, train_loss: 0.9038, test_loss: 0.9029, test_f1: 0.5158
 epoch: 12, train_loss: 0.8920, test_loss: 0.9144, test_f1: 0.5172
 epoch: 13, train_loss: 0.8767, test_loss: 0.8905, test_f1: 0.5224
 epoch: 14, train_loss: 0.8537, test_loss: 0.9046, test_f1: 0.5284
 epoch: 15, train_loss: 0.8494, test_loss: 0.8824, test_f1: 0.5281
 epoch: 16, train_loss: 0.8336, test_loss: 0.8927, test_f1: 0.5251
 epoch: 17, train_loss: 0.8244, test_loss: 0.9344, test_f1: 0.5088
 epoch: 18, train_loss: 0.8250, test_loss: 0.8835, test_f1: 0.5302
 epoch: 19, train_loss: 0.8066, test_loss: 0.8759, test_f1: 0.5366
 epoch: 20, train_loss: 0.8012, test_loss: 0.9138, test_f1: 0.5206
 epoch: 21, train_loss: 0.7922, test_loss: 0.9045, test_f1: 0.5403
 epoch: 22, train_loss: 0.7768, test_loss: 0.8822, test_f1: 0.5302
 epoch: 23, train_loss: 0.7758, test_loss: 0.9341, test_f1: 0.5192
 epoch: 24, train_loss: 0.7652, test_loss: 0.9159, test_f1: 0.5490
 epoch: 25, train_loss: 0.7514, test_loss: 0.9181, test_f1: 0.5581
 epoch: 26, train_loss: 0.7484, test_loss: 0.9279, test_f1: 0.5491
 epoch: 27, train_loss: 0.7423, test_loss: 0.9195, test_f1: 0.5764
 epoch: 28, train_loss: 0.7260, test_loss: 0.9216, test_f1: 0.5468
 epoch: 29, train_loss: 0.7229, test_loss: 0.9221, test_f1: 0.5808
 epoch: 30, train_loss: 0.7134, test_loss: 0.9002, test_f1: 0.5590
 epoch: 31, train_loss: 0.7080, test_loss: 0.9270, test_f1: 0.5575
 epoch: 32, train_loss: 0.7008, test_loss: 0.9169, test_f1: 0.5988
 epoch: 33, train_loss: 0.6856, test_loss: 0.9237, test_f1: 0.5786
 epoch: 34, train_loss: 0.6886, test_loss: 0.9563, test_f1: 0.5839
 epoch: 35, train_loss: 0.6671, test_loss: 0.9099, test_f1: 0.5803
 epoch: 36, train_loss: 0.6733, test_loss: 0.9506, test_f1: 0.5860
 epoch: 37, train_loss: 0.6675, test_loss: 0.9218, test_f1: 0.5818
 epoch: 38, train_loss: 0.6559, test_loss: 0.9399, test_f1: 0.5828
 epoch: 39, train_loss: 0.6592, test_loss: 0.9529, test_f1: 0.5774
 epoch: 40, train_loss: 0.6411, test_loss: 0.9754, test_f1: 0.5932
 epoch: 41, train_loss: 0.6459, test_loss: 0.9371, test_f1: 0.5782
 epoch: 42, train_loss: 0.6339, test_loss: 0.9844, test_f1: 0.5779
 epoch: 43, train_loss: 0.6359, test_loss: 0.8973, test_f1: 0.6008
 epoch: 44, train_loss: 0.6250, test_loss: 0.9503, test_f1: 0.5739
 epoch: 45, train_loss: 0.6184, test_loss: 0.9149, test_f1: 0.5935
 epoch: 46, train_loss: 0.6167, test_loss: 0.9667, test_f1: 0.6037
 epoch: 47, train_loss: 0.6191, test_loss: 0.9684, test_f1: 0.6223
 epoch: 48, train_loss: 0.6024, test_loss: 0.9531, test_f1: 0.6122
 epoch: 49, train_loss: 0.6084, test_loss: 0.9168, test_f1: 0.6046
 epoch: 50, train_loss: 0.5948, test_loss: 1.0106, test_f1: 0.6116
 epoch: 51, train_loss: 0.5843, test_loss: 0.9652, test_f1: 0.6178
 epoch: 52, train_loss: 0.5798, test_loss: 0.9577, test_f1: 0.6010
 epoch: 53, train_loss: 0.5598, test_loss: 0.9525, test_f1: 0.6093
 epoch: 54, train_loss: 0.5671, test_loss: 0.9737, test_f1: 0.6199
 epoch: 55, train_loss: 0.5690, test_loss: 0.9826, test_f1: 0.5985
 epoch: 56, train_loss: 0.5567, test_loss: 0.9792, test_f1: 0.6123
 epoch: 57, train_loss: 0.5588, test_loss: 0.9714, test_f1: 0.6075
 epoch: 58, train_loss: 0.5549, test_loss: 0.9882, test_f1: 0.6032
 epoch: 59, train_loss: 0.5563, test_loss: 0.9574, test_f1: 0.6225
 epoch: 60, train_loss: 0.5576, test_loss: 0.9656, test_f1: 0.6143
 epoch: 61, train_loss: 0.5423, test_loss: 0.9574, test_f1: 0.6154
 epoch: 62, train_loss: 0.5359, test_loss: 0.9834, test_f1: 0.6142
 epoch: 63, train_loss: 0.5397, test_loss: 0.9639, test_f1: 0.6237
 epoch: 64, train_loss: 0.5315, test_loss: 0.9988, test_f1: 0.6098
 epoch: 65, train_loss: 0.5321, test_loss: 0.9859, test_f1: 0.6226
 epoch: 66, train_loss: 0.5271, test_loss: 0.9889, test_f1: 0.6090
 epoch: 67, train_loss: 0.5255, test_loss: 0.9952, test_f1: 0.6163
 epoch: 68, train_loss: 0.5193, test_loss: 1.0303, test_f1: 0.5999
 epoch: 69, train_loss: 0.5098, test_loss: 0.9817, test_f1: 0.6371
 epoch: 70, train_loss: 0.5261, test_loss: 0.9743, test_f1: 0.6335
 epoch: 71, train_loss: 0.5113, test_loss: 0.9804, test_f1: 0.6216
 epoch: 72, train_loss: 0.5100, test_loss: 1.0052, test_f1: 0.6111
 epoch: 73, train_loss: 0.5133, test_loss: 0.9809, test_f1: 0.6331
 epoch: 74, train_loss: 0.4988, test_loss: 1.0281, test_f1: 0.6166
 epoch: 75, train_loss: 0.4985, test_loss: 1.0280, test_f1: 0.6056
 epoch: 76, train_loss: 0.4979, test_loss: 1.0341, test_f1: 0.6019
 epoch: 77, train_loss: 0.4987, test_loss: 0.9923, test_f1: 0.6206
 epoch: 78, train_loss: 0.5041, test_loss: 1.0342, test_f1: 0.6064
 epoch: 79, train_loss: 0.4945, test_loss: 1.0385, test_f1: 0.6159
 epoch: 80, train_loss: 0.4905, test_loss: 1.0114, test_f1: 0.6211
 epoch: 81, train_loss: 0.4842, test_loss: 1.0353, test_f1: 0.6340
 epoch: 82, train_loss: 0.4749, test_loss: 1.0494, test_f1: 0.6011
 epoch: 83, train_loss: 0.4802, test_loss: 1.0213, test_f1: 0.6204
 epoch: 84, train_loss: 0.4709, test_loss: 1.0410, test_f1: 0.6220
 epoch: 85, train_loss: 0.4913, test_loss: 1.0607, test_f1: 0.6172
 epoch: 86, train_loss: 0.4673, test_loss: 1.0261, test_f1: 0.6180
 epoch: 87, train_loss: 0.4799, test_loss: 1.0728, test_f1: 0.6352
 epoch: 88, train_loss: 0.4825, test_loss: 1.0094, test_f1: 0.6227
 epoch: 89, train_loss: 0.4759, test_loss: 1.0316, test_f1: 0.6185
 epoch: 90, train_loss: 0.4625, test_loss: 1.0362, test_f1: 0.6427
 epoch: 91, train_loss: 0.4700, test_loss: 1.0602, test_f1: 0.6370
 epoch: 92, train_loss: 0.4576, test_loss: 1.0580, test_f1: 0.6240
 epoch: 93, train_loss: 0.4602, test_loss: 1.0756, test_f1: 0.6187
 epoch: 94, train_loss: 0.4463, test_loss: 1.0832, test_f1: 0.6219
 epoch: 95, train_loss: 0.4487, test_loss: 1.0443, test_f1: 0.6324
 epoch: 96, train_loss: 0.4502, test_loss: 1.0311, test_f1: 0.6260
 epoch: 97, train_loss: 0.4543, test_loss: 1.0641, test_f1: 0.6359
 epoch: 98, train_loss: 0.4354, test_loss: 1.0148, test_f1: 0.6375
 epoch: 99, train_loss: 0.4413, test_loss: 1.0541, test_f1: 0.6343
##################ITERATION #3 ****************************************
 epoch: 0, train_loss: 1.2542, test_loss: 1.3370, test_f1: 0.2270
 epoch: 1, train_loss: 1.1694, test_loss: 1.3021, test_f1: 0.2270
 epoch: 2, train_loss: 1.1297, test_loss: 1.2401, test_f1: 0.3828
 epoch: 3, train_loss: 1.0919, test_loss: 1.1593, test_f1: 0.4087
 epoch: 4, train_loss: 1.0694, test_loss: 1.0816, test_f1: 0.4886
 epoch: 5, train_loss: 1.0499, test_loss: 1.0268, test_f1: 0.4973
 epoch: 6, train_loss: 1.0296, test_loss: 0.9957, test_f1: 0.4791
 epoch: 7, train_loss: 1.0126, test_loss: 0.9663, test_f1: 0.5145
 epoch: 8, train_loss: 0.9828, test_loss: 0.9488, test_f1: 0.5127
 epoch: 9, train_loss: 0.9662, test_loss: 0.9296, test_f1: 0.5485
 epoch: 10, train_loss: 0.9481, test_loss: 0.9379, test_f1: 0.5453
 epoch: 11, train_loss: 0.9375, test_loss: 0.9369, test_f1: 0.5319
 epoch: 12, train_loss: 0.9261, test_loss: 0.9118, test_f1: 0.5652
 epoch: 13, train_loss: 0.9102, test_loss: 0.9262, test_f1: 0.5198
 epoch: 14, train_loss: 0.9017, test_loss: 0.9090, test_f1: 0.5512
 epoch: 15, train_loss: 0.8901, test_loss: 0.8895, test_f1: 0.5618
 epoch: 16, train_loss: 0.8666, test_loss: 0.9003, test_f1: 0.5221
 epoch: 17, train_loss: 0.8644, test_loss: 0.8892, test_f1: 0.5689
 epoch: 18, train_loss: 0.8491, test_loss: 0.9075, test_f1: 0.5419
 epoch: 19, train_loss: 0.8440, test_loss: 0.9028, test_f1: 0.5484
 epoch: 20, train_loss: 0.8253, test_loss: 0.9129, test_f1: 0.5620
 epoch: 21, train_loss: 0.8235, test_loss: 0.8913, test_f1: 0.5683
 epoch: 22, train_loss: 0.8203, test_loss: 0.8764, test_f1: 0.5704
 epoch: 23, train_loss: 0.8012, test_loss: 0.8931, test_f1: 0.5384
 epoch: 24, train_loss: 0.7972, test_loss: 0.8758, test_f1: 0.5661
 epoch: 25, train_loss: 0.7929, test_loss: 0.8906, test_f1: 0.5769
 epoch: 26, train_loss: 0.7882, test_loss: 0.8936, test_f1: 0.5783
 epoch: 27, train_loss: 0.7750, test_loss: 0.8818, test_f1: 0.5683
 epoch: 28, train_loss: 0.7771, test_loss: 0.8949, test_f1: 0.5833
 epoch: 29, train_loss: 0.7679, test_loss: 0.8828, test_f1: 0.5912
 epoch: 30, train_loss: 0.7580, test_loss: 0.8908, test_f1: 0.5936
 epoch: 31, train_loss: 0.7456, test_loss: 0.8810, test_f1: 0.5911
 epoch: 32, train_loss: 0.7320, test_loss: 0.8750, test_f1: 0.5951
 epoch: 33, train_loss: 0.7292, test_loss: 0.8866, test_f1: 0.5917
 epoch: 34, train_loss: 0.7271, test_loss: 0.8788, test_f1: 0.6031
 epoch: 35, train_loss: 0.7213, test_loss: 0.8845, test_f1: 0.6116
 epoch: 36, train_loss: 0.7192, test_loss: 0.8681, test_f1: 0.6163
 epoch: 37, train_loss: 0.7061, test_loss: 0.9134, test_f1: 0.5906
 epoch: 38, train_loss: 0.7103, test_loss: 0.8827, test_f1: 0.6022
 epoch: 39, train_loss: 0.6877, test_loss: 0.8807, test_f1: 0.6211
 epoch: 40, train_loss: 0.6913, test_loss: 0.8924, test_f1: 0.6029
 epoch: 41, train_loss: 0.6879, test_loss: 0.8828, test_f1: 0.6395
 epoch: 42, train_loss: 0.6809, test_loss: 0.9046, test_f1: 0.6029
 epoch: 43, train_loss: 0.6706, test_loss: 0.8744, test_f1: 0.6272
 epoch: 44, train_loss: 0.6579, test_loss: 0.9200, test_f1: 0.6094
 epoch: 45, train_loss: 0.6483, test_loss: 0.8810, test_f1: 0.6115
 epoch: 46, train_loss: 0.6447, test_loss: 0.8897, test_f1: 0.6024
 epoch: 47, train_loss: 0.6361, test_loss: 0.8985, test_f1: 0.6073
 epoch: 48, train_loss: 0.6411, test_loss: 0.8945, test_f1: 0.6298
 epoch: 49, train_loss: 0.6332, test_loss: 0.9191, test_f1: 0.6049
 epoch: 50, train_loss: 0.6378, test_loss: 0.9026, test_f1: 0.6225
 epoch: 51, train_loss: 0.6066, test_loss: 0.8932, test_f1: 0.6180
 epoch: 52, train_loss: 0.6139, test_loss: 0.8991, test_f1: 0.6332
 epoch: 53, train_loss: 0.5999, test_loss: 0.9158, test_f1: 0.6280
 epoch: 54, train_loss: 0.5924, test_loss: 0.9039, test_f1: 0.6284
 epoch: 55, train_loss: 0.5892, test_loss: 0.9152, test_f1: 0.6144
 epoch: 56, train_loss: 0.5945, test_loss: 0.9107, test_f1: 0.6417
 epoch: 57, train_loss: 0.5896, test_loss: 0.9263, test_f1: 0.6330
 epoch: 58, train_loss: 0.5944, test_loss: 0.9200, test_f1: 0.6313
 epoch: 59, train_loss: 0.5819, test_loss: 0.9157, test_f1: 0.6167
 epoch: 60, train_loss: 0.5863, test_loss: 0.9072, test_f1: 0.6386
 epoch: 61, train_loss: 0.5741, test_loss: 0.9280, test_f1: 0.6274
 epoch: 62, train_loss: 0.5597, test_loss: 0.9189, test_f1: 0.6369
 epoch: 63, train_loss: 0.5822, test_loss: 0.9250, test_f1: 0.6240
 epoch: 64, train_loss: 0.5660, test_loss: 0.9147, test_f1: 0.6467
 epoch: 65, train_loss: 0.5636, test_loss: 0.9159, test_f1: 0.6488
 epoch: 66, train_loss: 0.5572, test_loss: 0.9330, test_f1: 0.6188
 epoch: 67, train_loss: 0.5660, test_loss: 0.9273, test_f1: 0.6392
 epoch: 68, train_loss: 0.5358, test_loss: 0.9481, test_f1: 0.6321
 epoch: 69, train_loss: 0.5432, test_loss: 0.9262, test_f1: 0.6401
 epoch: 70, train_loss: 0.5492, test_loss: 0.9328, test_f1: 0.6325
 epoch: 71, train_loss: 0.5415, test_loss: 0.9178, test_f1: 0.6387
 epoch: 72, train_loss: 0.5420, test_loss: 0.9286, test_f1: 0.6243
 epoch: 73, train_loss: 0.5295, test_loss: 0.9173, test_f1: 0.6355
 epoch: 74, train_loss: 0.5343, test_loss: 0.9723, test_f1: 0.6278
 epoch: 75, train_loss: 0.5448, test_loss: 0.9365, test_f1: 0.6315
 epoch: 76, train_loss: 0.5356, test_loss: 0.9512, test_f1: 0.6452
 epoch: 77, train_loss: 0.5217, test_loss: 0.9534, test_f1: 0.6309
 epoch: 78, train_loss: 0.5237, test_loss: 0.9523, test_f1: 0.6427
 epoch: 79, train_loss: 0.5223, test_loss: 0.9622, test_f1: 0.6409
 epoch: 80, train_loss: 0.5100, test_loss: 0.9496, test_f1: 0.6464
 epoch: 81, train_loss: 0.5159, test_loss: 0.9628, test_f1: 0.6314
 epoch: 82, train_loss: 0.5153, test_loss: 0.9618, test_f1: 0.6467
 epoch: 83, train_loss: 0.5029, test_loss: 0.9563, test_f1: 0.6506
 epoch: 84, train_loss: 0.5000, test_loss: 0.9657, test_f1: 0.6369
 epoch: 85, train_loss: 0.5015, test_loss: 0.9587, test_f1: 0.6572
 epoch: 86, train_loss: 0.5051, test_loss: 0.9697, test_f1: 0.6432
 epoch: 87, train_loss: 0.5128, test_loss: 0.9796, test_f1: 0.6495
 epoch: 88, train_loss: 0.5005, test_loss: 0.9697, test_f1: 0.6357
 epoch: 89, train_loss: 0.4862, test_loss: 0.9936, test_f1: 0.6350
 epoch: 90, train_loss: 0.4960, test_loss: 0.9810, test_f1: 0.6463
 epoch: 91, train_loss: 0.4921, test_loss: 0.9876, test_f1: 0.6388
 epoch: 92, train_loss: 0.4996, test_loss: 0.9906, test_f1: 0.6442
 epoch: 93, train_loss: 0.4955, test_loss: 1.0020, test_f1: 0.6381
 epoch: 94, train_loss: 0.4836, test_loss: 0.9632, test_f1: 0.6602
 epoch: 95, train_loss: 0.4738, test_loss: 0.9708, test_f1: 0.6441
 epoch: 96, train_loss: 0.4754, test_loss: 0.9880, test_f1: 0.6617
 epoch: 97, train_loss: 0.4884, test_loss: 0.9778, test_f1: 0.6449
 epoch: 98, train_loss: 0.4863, test_loss: 0.9971, test_f1: 0.6376
 epoch: 99, train_loss: 0.4785, test_loss: 0.9439, test_f1: 0.6439
##################ITERATION #4 ****************************************
 epoch: 0, train_loss: 1.2326, test_loss: 1.3540, test_f1: 0.2270
 epoch: 1, train_loss: 1.1378, test_loss: 1.3518, test_f1: 0.2513
 epoch: 2, train_loss: 1.0853, test_loss: 1.2276, test_f1: 0.3372
 epoch: 3, train_loss: 1.0519, test_loss: 1.1376, test_f1: 0.4386
 epoch: 4, train_loss: 1.0310, test_loss: 1.0805, test_f1: 0.4810
 epoch: 5, train_loss: 1.0035, test_loss: 1.0487, test_f1: 0.4575
 epoch: 6, train_loss: 0.9853, test_loss: 0.9881, test_f1: 0.4787
 epoch: 7, train_loss: 0.9571, test_loss: 0.9554, test_f1: 0.4934
 epoch: 8, train_loss: 0.9413, test_loss: 0.9354, test_f1: 0.4917
 epoch: 9, train_loss: 0.9202, test_loss: 0.9293, test_f1: 0.5241
 epoch: 10, train_loss: 0.9114, test_loss: 0.9226, test_f1: 0.5053
 epoch: 11, train_loss: 0.8951, test_loss: 0.9192, test_f1: 0.5320
 epoch: 12, train_loss: 0.8907, test_loss: 0.9109, test_f1: 0.5298
 epoch: 13, train_loss: 0.8756, test_loss: 0.8967, test_f1: 0.5422
 epoch: 14, train_loss: 0.8626, test_loss: 0.9056, test_f1: 0.5421
 epoch: 15, train_loss: 0.8510, test_loss: 0.8884, test_f1: 0.5529
 epoch: 16, train_loss: 0.8491, test_loss: 0.9025, test_f1: 0.5445
 epoch: 17, train_loss: 0.8288, test_loss: 0.8916, test_f1: 0.5628
 epoch: 18, train_loss: 0.8126, test_loss: 0.8976, test_f1: 0.5643
 epoch: 19, train_loss: 0.8046, test_loss: 0.9017, test_f1: 0.5537
 epoch: 20, train_loss: 0.8001, test_loss: 0.8868, test_f1: 0.5720
 epoch: 21, train_loss: 0.7968, test_loss: 0.9050, test_f1: 0.5561
 epoch: 22, train_loss: 0.7941, test_loss: 0.8805, test_f1: 0.5910
 epoch: 23, train_loss: 0.7790, test_loss: 0.8945, test_f1: 0.5688
 epoch: 24, train_loss: 0.7737, test_loss: 0.8814, test_f1: 0.5941
 epoch: 25, train_loss: 0.7647, test_loss: 0.9086, test_f1: 0.5834
 epoch: 26, train_loss: 0.7618, test_loss: 0.9247, test_f1: 0.5855
 epoch: 27, train_loss: 0.7418, test_loss: 0.8884, test_f1: 0.6070
 epoch: 28, train_loss: 0.7486, test_loss: 0.9089, test_f1: 0.5734
 epoch: 29, train_loss: 0.7257, test_loss: 0.8927, test_f1: 0.5998
 epoch: 30, train_loss: 0.7190, test_loss: 0.9016, test_f1: 0.6038
 epoch: 31, train_loss: 0.7184, test_loss: 0.9282, test_f1: 0.5936
 epoch: 32, train_loss: 0.7276, test_loss: 0.8928, test_f1: 0.6137
 epoch: 33, train_loss: 0.7192, test_loss: 0.8826, test_f1: 0.6166
 epoch: 34, train_loss: 0.6990, test_loss: 0.9472, test_f1: 0.5999
 epoch: 35, train_loss: 0.6918, test_loss: 0.9057, test_f1: 0.6108
 epoch: 36, train_loss: 0.6810, test_loss: 0.8954, test_f1: 0.6222
 epoch: 37, train_loss: 0.6920, test_loss: 0.9129, test_f1: 0.6050
 epoch: 38, train_loss: 0.6776, test_loss: 0.9499, test_f1: 0.5942
 epoch: 39, train_loss: 0.6762, test_loss: 0.9093, test_f1: 0.6164
 epoch: 40, train_loss: 0.6624, test_loss: 0.9243, test_f1: 0.6067
 epoch: 41, train_loss: 0.6539, test_loss: 0.8989, test_f1: 0.6273
 epoch: 42, train_loss: 0.6483, test_loss: 0.9659, test_f1: 0.6074
 epoch: 43, train_loss: 0.6495, test_loss: 0.9533, test_f1: 0.6108
 epoch: 44, train_loss: 0.6330, test_loss: 0.9352, test_f1: 0.6146
 epoch: 45, train_loss: 0.6267, test_loss: 0.9415, test_f1: 0.6136
 epoch: 46, train_loss: 0.6401, test_loss: 0.9149, test_f1: 0.6470
 epoch: 47, train_loss: 0.6303, test_loss: 0.9482, test_f1: 0.6159
 epoch: 48, train_loss: 0.6220, test_loss: 0.9780, test_f1: 0.6264
 epoch: 49, train_loss: 0.6089, test_loss: 0.9425, test_f1: 0.6130
 epoch: 50, train_loss: 0.6102, test_loss: 0.9751, test_f1: 0.6440
 epoch: 51, train_loss: 0.5902, test_loss: 0.9503, test_f1: 0.6175
 epoch: 52, train_loss: 0.5866, test_loss: 0.9382, test_f1: 0.6252
 epoch: 53, train_loss: 0.5878, test_loss: 0.9431, test_f1: 0.6244
 epoch: 54, train_loss: 0.5780, test_loss: 0.9345, test_f1: 0.6351
 epoch: 55, train_loss: 0.5703, test_loss: 0.9490, test_f1: 0.6286
 epoch: 56, train_loss: 0.5627, test_loss: 0.9631, test_f1: 0.6221
 epoch: 57, train_loss: 0.5609, test_loss: 0.9997, test_f1: 0.6129
 epoch: 58, train_loss: 0.5734, test_loss: 1.0137, test_f1: 0.6086
 epoch: 59, train_loss: 0.5625, test_loss: 0.9707, test_f1: 0.6160
 epoch: 60, train_loss: 0.5481, test_loss: 0.9790, test_f1: 0.6234
 epoch: 61, train_loss: 0.5471, test_loss: 0.9582, test_f1: 0.6321
 epoch: 62, train_loss: 0.5477, test_loss: 0.9844, test_f1: 0.6300
 epoch: 63, train_loss: 0.5551, test_loss: 0.9751, test_f1: 0.6304
 epoch: 64, train_loss: 0.5503, test_loss: 0.9923, test_f1: 0.6306
 epoch: 65, train_loss: 0.5473, test_loss: 1.0192, test_f1: 0.6151
 epoch: 66, train_loss: 0.5332, test_loss: 1.0005, test_f1: 0.6300
 epoch: 67, train_loss: 0.5255, test_loss: 0.9903, test_f1: 0.6330
 epoch: 68, train_loss: 0.5312, test_loss: 1.0113, test_f1: 0.6252
 epoch: 69, train_loss: 0.5297, test_loss: 0.9719, test_f1: 0.6423
 epoch: 70, train_loss: 0.5338, test_loss: 0.9979, test_f1: 0.6453
 epoch: 71, train_loss: 0.5199, test_loss: 0.9979, test_f1: 0.6270
 epoch: 72, train_loss: 0.5100, test_loss: 1.0033, test_f1: 0.6163
 epoch: 73, train_loss: 0.5157, test_loss: 1.0143, test_f1: 0.6326
 epoch: 74, train_loss: 0.5127, test_loss: 1.0057, test_f1: 0.6247
 epoch: 75, train_loss: 0.5135, test_loss: 1.0359, test_f1: 0.6401
 epoch: 76, train_loss: 0.5055, test_loss: 1.0162, test_f1: 0.6349
 epoch: 77, train_loss: 0.5059, test_loss: 1.0212, test_f1: 0.6300
 epoch: 78, train_loss: 0.4964, test_loss: 1.0105, test_f1: 0.6390
 epoch: 79, train_loss: 0.4976, test_loss: 1.0394, test_f1: 0.6211
 epoch: 80, train_loss: 0.5020, test_loss: 1.0624, test_f1: 0.6351
 epoch: 81, train_loss: 0.4821, test_loss: 1.0215, test_f1: 0.6309
 epoch: 82, train_loss: 0.4874, test_loss: 1.0570, test_f1: 0.6410
 epoch: 83, train_loss: 0.4907, test_loss: 1.0377, test_f1: 0.6321
 epoch: 84, train_loss: 0.4955, test_loss: 1.0186, test_f1: 0.6383
 epoch: 85, train_loss: 0.4945, test_loss: 1.0249, test_f1: 0.6377
 epoch: 86, train_loss: 0.4802, test_loss: 1.0350, test_f1: 0.6380
 epoch: 87, train_loss: 0.4859, test_loss: 1.0564, test_f1: 0.6402
 epoch: 88, train_loss: 0.4908, test_loss: 1.0670, test_f1: 0.6423
 epoch: 89, train_loss: 0.4661, test_loss: 1.0730, test_f1: 0.6227
 epoch: 90, train_loss: 0.4771, test_loss: 1.0482, test_f1: 0.6284
 epoch: 91, train_loss: 0.4571, test_loss: 1.0798, test_f1: 0.6171
 epoch: 92, train_loss: 0.4657, test_loss: 1.0781, test_f1: 0.6238
 epoch: 93, train_loss: 0.4611, test_loss: 1.0967, test_f1: 0.6167
 epoch: 94, train_loss: 0.4742, test_loss: 1.0973, test_f1: 0.6321
 epoch: 95, train_loss: 0.4591, test_loss: 1.0917, test_f1: 0.6351
 epoch: 96, train_loss: 0.4537, test_loss: 1.1015, test_f1: 0.6356
 epoch: 97, train_loss: 0.4681, test_loss: 1.1440, test_f1: 0.6223
 epoch: 98, train_loss: 0.4632, test_loss: 1.0905, test_f1: 0.6418
 epoch: 99, train_loss: 0.4529, test_loss: 1.0846, test_f1: 0.6336
##################ITERATION #5 ****************************************
 epoch: 0, train_loss: 1.2475, test_loss: 1.3471, test_f1: 0.2270
 epoch: 1, train_loss: 1.1501, test_loss: 1.3284, test_f1: 0.3042
 epoch: 2, train_loss: 1.1058, test_loss: 1.2502, test_f1: 0.3161
 epoch: 3, train_loss: 1.0626, test_loss: 1.1547, test_f1: 0.3745
 epoch: 4, train_loss: 1.0529, test_loss: 1.0887, test_f1: 0.3922
 epoch: 5, train_loss: 1.0127, test_loss: 0.9997, test_f1: 0.4626
 epoch: 6, train_loss: 0.9995, test_loss: 0.9533, test_f1: 0.5113
 epoch: 7, train_loss: 0.9778, test_loss: 0.9533, test_f1: 0.5225
 epoch: 8, train_loss: 0.9553, test_loss: 0.9222, test_f1: 0.5348
 epoch: 9, train_loss: 0.9472, test_loss: 0.9263, test_f1: 0.5170
 epoch: 10, train_loss: 0.9250, test_loss: 0.9122, test_f1: 0.5342
 epoch: 11, train_loss: 0.9058, test_loss: 0.9136, test_f1: 0.5229
 epoch: 12, train_loss: 0.8985, test_loss: 0.8979, test_f1: 0.5417
 epoch: 13, train_loss: 0.8897, test_loss: 0.9266, test_f1: 0.5252
 epoch: 14, train_loss: 0.8769, test_loss: 0.8926, test_f1: 0.5430
 epoch: 15, train_loss: 0.8656, test_loss: 0.8868, test_f1: 0.5614
 epoch: 16, train_loss: 0.8560, test_loss: 0.9205, test_f1: 0.5471
 epoch: 17, train_loss: 0.8548, test_loss: 0.9068, test_f1: 0.5513
 epoch: 18, train_loss: 0.8262, test_loss: 0.9027, test_f1: 0.5447
 epoch: 19, train_loss: 0.8235, test_loss: 0.9125, test_f1: 0.5364
 epoch: 20, train_loss: 0.8135, test_loss: 0.9141, test_f1: 0.5637
 epoch: 21, train_loss: 0.7991, test_loss: 0.9054, test_f1: 0.5632
 epoch: 22, train_loss: 0.7873, test_loss: 0.9080, test_f1: 0.5739
 epoch: 23, train_loss: 0.7884, test_loss: 0.9397, test_f1: 0.5371
 epoch: 24, train_loss: 0.7731, test_loss: 0.9124, test_f1: 0.5556
 epoch: 25, train_loss: 0.7745, test_loss: 0.9240, test_f1: 0.5504
 epoch: 26, train_loss: 0.7605, test_loss: 0.9230, test_f1: 0.5498
 epoch: 27, train_loss: 0.7498, test_loss: 0.9523, test_f1: 0.5346
 epoch: 28, train_loss: 0.7485, test_loss: 0.9184, test_f1: 0.5659
 epoch: 29, train_loss: 0.7388, test_loss: 0.9283, test_f1: 0.5684
 epoch: 30, train_loss: 0.7260, test_loss: 0.9343, test_f1: 0.5822
 epoch: 31, train_loss: 0.7219, test_loss: 0.9633, test_f1: 0.5769
 epoch: 32, train_loss: 0.7125, test_loss: 0.9334, test_f1: 0.5764
 epoch: 33, train_loss: 0.7188, test_loss: 0.9366, test_f1: 0.5747
 epoch: 34, train_loss: 0.7055, test_loss: 0.9394, test_f1: 0.5808
 epoch: 35, train_loss: 0.6994, test_loss: 0.9529, test_f1: 0.5845
 epoch: 36, train_loss: 0.6797, test_loss: 0.9603, test_f1: 0.5844
 epoch: 37, train_loss: 0.6801, test_loss: 0.9550, test_f1: 0.5914
 epoch: 38, train_loss: 0.6908, test_loss: 0.9493, test_f1: 0.5942
 epoch: 39, train_loss: 0.6807, test_loss: 0.9741, test_f1: 0.5859
 epoch: 40, train_loss: 0.6664, test_loss: 0.9633, test_f1: 0.6048
 epoch: 41, train_loss: 0.6641, test_loss: 0.9552, test_f1: 0.5802
 epoch: 42, train_loss: 0.6563, test_loss: 1.0143, test_f1: 0.5900
 epoch: 43, train_loss: 0.6470, test_loss: 0.9767, test_f1: 0.6014
 epoch: 44, train_loss: 0.6369, test_loss: 0.9369, test_f1: 0.5917
 epoch: 45, train_loss: 0.6382, test_loss: 0.9611, test_f1: 0.5988
 epoch: 46, train_loss: 0.6378, test_loss: 0.9820, test_f1: 0.5888
 epoch: 47, train_loss: 0.6264, test_loss: 0.9633, test_f1: 0.5927
 epoch: 48, train_loss: 0.6289, test_loss: 0.9211, test_f1: 0.6178
 epoch: 49, train_loss: 0.6087, test_loss: 0.9311, test_f1: 0.6039
 epoch: 50, train_loss: 0.6072, test_loss: 0.9581, test_f1: 0.6117
 epoch: 51, train_loss: 0.5999, test_loss: 0.9220, test_f1: 0.6181
 epoch: 52, train_loss: 0.5851, test_loss: 0.9226, test_f1: 0.6154
 epoch: 53, train_loss: 0.5898, test_loss: 0.9521, test_f1: 0.6203
 epoch: 54, train_loss: 0.5710, test_loss: 0.9555, test_f1: 0.6219
 epoch: 55, train_loss: 0.5815, test_loss: 0.9541, test_f1: 0.6246
 epoch: 56, train_loss: 0.5775, test_loss: 0.9713, test_f1: 0.6349
 epoch: 57, train_loss: 0.5598, test_loss: 0.9671, test_f1: 0.6226
 epoch: 58, train_loss: 0.5587, test_loss: 0.9928, test_f1: 0.6130
 epoch: 59, train_loss: 0.5656, test_loss: 0.9813, test_f1: 0.6332
 epoch: 60, train_loss: 0.5677, test_loss: 0.9724, test_f1: 0.6289
 epoch: 61, train_loss: 0.5656, test_loss: 0.9562, test_f1: 0.6128
 epoch: 62, train_loss: 0.5539, test_loss: 0.9834, test_f1: 0.6077
 epoch: 63, train_loss: 0.5497, test_loss: 0.9982, test_f1: 0.6147
 epoch: 64, train_loss: 0.5586, test_loss: 1.0125, test_f1: 0.6257
 epoch: 65, train_loss: 0.5457, test_loss: 1.0236, test_f1: 0.6150
 epoch: 66, train_loss: 0.5566, test_loss: 0.9987, test_f1: 0.6159
 epoch: 67, train_loss: 0.5490, test_loss: 1.0258, test_f1: 0.6144
 epoch: 68, train_loss: 0.5428, test_loss: 1.0086, test_f1: 0.6175
 epoch: 69, train_loss: 0.5304, test_loss: 0.9875, test_f1: 0.6054
 epoch: 70, train_loss: 0.5371, test_loss: 1.0290, test_f1: 0.6143
 epoch: 71, train_loss: 0.5205, test_loss: 1.0348, test_f1: 0.6373
 epoch: 72, train_loss: 0.5283, test_loss: 0.9966, test_f1: 0.6192
 epoch: 73, train_loss: 0.5423, test_loss: 1.0463, test_f1: 0.6189
 epoch: 74, train_loss: 0.5229, test_loss: 1.0280, test_f1: 0.6327
 epoch: 75, train_loss: 0.5289, test_loss: 1.0098, test_f1: 0.6275
 epoch: 76, train_loss: 0.5229, test_loss: 1.0356, test_f1: 0.6097
 epoch: 77, train_loss: 0.5257, test_loss: 1.0234, test_f1: 0.6062
 epoch: 78, train_loss: 0.5208, test_loss: 1.0051, test_f1: 0.6260
 epoch: 79, train_loss: 0.5227, test_loss: 1.0203, test_f1: 0.6293
 epoch: 80, train_loss: 0.5193, test_loss: 1.0375, test_f1: 0.6118
 epoch: 81, train_loss: 0.5045, test_loss: 1.0191, test_f1: 0.6400
 epoch: 82, train_loss: 0.5126, test_loss: 1.0258, test_f1: 0.6195
 epoch: 83, train_loss: 0.4906, test_loss: 1.0587, test_f1: 0.6096
 epoch: 84, train_loss: 0.4971, test_loss: 1.0533, test_f1: 0.6201
 epoch: 85, train_loss: 0.4917, test_loss: 1.0464, test_f1: 0.6316
 epoch: 86, train_loss: 0.4999, test_loss: 1.0626, test_f1: 0.6176
 epoch: 87, train_loss: 0.4896, test_loss: 1.0732, test_f1: 0.6235
 epoch: 88, train_loss: 0.4994, test_loss: 1.0729, test_f1: 0.6126
 epoch: 89, train_loss: 0.4877, test_loss: 1.0403, test_f1: 0.6270
 epoch: 90, train_loss: 0.4899, test_loss: 1.0455, test_f1: 0.6358
 epoch: 91, train_loss: 0.4795, test_loss: 1.0749, test_f1: 0.6231
 epoch: 92, train_loss: 0.4885, test_loss: 1.1312, test_f1: 0.6209
 epoch: 93, train_loss: 0.4840, test_loss: 1.0840, test_f1: 0.6049
 epoch: 94, train_loss: 0.4704, test_loss: 1.0629, test_f1: 0.6283
 epoch: 95, train_loss: 0.4586, test_loss: 1.1045, test_f1: 0.6270
 epoch: 96, train_loss: 0.4859, test_loss: 1.0899, test_f1: 0.6040
 epoch: 97, train_loss: 0.4658, test_loss: 1.1536, test_f1: 0.6135
 epoch: 98, train_loss: 0.4634, test_loss: 1.1065, test_f1: 0.5987
 epoch: 99, train_loss: 0.4700, test_loss: 1.0967, test_f1: 0.6142
##################ITERATION #6 ****************************************
 epoch: 0, train_loss: 1.2562, test_loss: 1.3884, test_f1: 0.1333
 epoch: 1, train_loss: 1.1439, test_loss: 1.4432, test_f1: 0.0712
 epoch: 2, train_loss: 1.0986, test_loss: 1.3833, test_f1: 0.1918
 epoch: 3, train_loss: 1.0767, test_loss: 1.2136, test_f1: 0.3873
 epoch: 4, train_loss: 1.0502, test_loss: 1.0523, test_f1: 0.4257
 epoch: 5, train_loss: 1.0212, test_loss: 0.9949, test_f1: 0.4714
 epoch: 6, train_loss: 1.0080, test_loss: 0.9747, test_f1: 0.5098
 epoch: 7, train_loss: 0.9824, test_loss: 0.9421, test_f1: 0.4881
 epoch: 8, train_loss: 0.9629, test_loss: 0.9162, test_f1: 0.5099
 epoch: 9, train_loss: 0.9419, test_loss: 0.9247, test_f1: 0.5211
 epoch: 10, train_loss: 0.9494, test_loss: 0.9204, test_f1: 0.4977
 epoch: 11, train_loss: 0.9325, test_loss: 0.8821, test_f1: 0.5304
 epoch: 12, train_loss: 0.9145, test_loss: 0.9138, test_f1: 0.5325
 epoch: 13, train_loss: 0.9013, test_loss: 0.8889, test_f1: 0.5564
 epoch: 14, train_loss: 0.8949, test_loss: 0.9043, test_f1: 0.5599
 epoch: 15, train_loss: 0.8684, test_loss: 0.8788, test_f1: 0.5566
 epoch: 16, train_loss: 0.8518, test_loss: 0.9074, test_f1: 0.5438
 epoch: 17, train_loss: 0.8536, test_loss: 0.8846, test_f1: 0.5960
 epoch: 18, train_loss: 0.8402, test_loss: 0.8827, test_f1: 0.5727
 epoch: 19, train_loss: 0.8326, test_loss: 0.9063, test_f1: 0.5970
 epoch: 20, train_loss: 0.8224, test_loss: 0.8600, test_f1: 0.6196
 epoch: 21, train_loss: 0.8112, test_loss: 0.9000, test_f1: 0.5736
 epoch: 22, train_loss: 0.8084, test_loss: 0.8728, test_f1: 0.5804
 epoch: 23, train_loss: 0.8054, test_loss: 0.8748, test_f1: 0.6225
 epoch: 24, train_loss: 0.7811, test_loss: 0.8798, test_f1: 0.6059
 epoch: 25, train_loss: 0.7793, test_loss: 0.8955, test_f1: 0.6167
 epoch: 26, train_loss: 0.7725, test_loss: 0.9117, test_f1: 0.5967
 epoch: 27, train_loss: 0.7750, test_loss: 0.8625, test_f1: 0.6266
 epoch: 28, train_loss: 0.7651, test_loss: 0.8862, test_f1: 0.6195
 epoch: 29, train_loss: 0.7575, test_loss: 0.8766, test_f1: 0.6090
 epoch: 30, train_loss: 0.7451, test_loss: 0.8915, test_f1: 0.6266
 epoch: 31, train_loss: 0.7450, test_loss: 0.8859, test_f1: 0.6536
 epoch: 32, train_loss: 0.7266, test_loss: 0.8753, test_f1: 0.6249
 epoch: 33, train_loss: 0.7264, test_loss: 0.9127, test_f1: 0.6438
 epoch: 34, train_loss: 0.7229, test_loss: 0.8769, test_f1: 0.6525
 epoch: 35, train_loss: 0.7071, test_loss: 0.8838, test_f1: 0.6470
 epoch: 36, train_loss: 0.7099, test_loss: 0.8782, test_f1: 0.6346
 epoch: 37, train_loss: 0.6951, test_loss: 0.9063, test_f1: 0.6341
 epoch: 38, train_loss: 0.6900, test_loss: 0.9115, test_f1: 0.6359
 epoch: 39, train_loss: 0.6888, test_loss: 0.9199, test_f1: 0.6127
 epoch: 40, train_loss: 0.6817, test_loss: 0.9097, test_f1: 0.6514
 epoch: 41, train_loss: 0.6822, test_loss: 0.9055, test_f1: 0.6299
 epoch: 42, train_loss: 0.6820, test_loss: 0.9023, test_f1: 0.6435
 epoch: 43, train_loss: 0.6598, test_loss: 0.9037, test_f1: 0.6589
 epoch: 44, train_loss: 0.6489, test_loss: 0.9181, test_f1: 0.6361
 epoch: 45, train_loss: 0.6550, test_loss: 0.9023, test_f1: 0.6377
 epoch: 46, train_loss: 0.6491, test_loss: 0.9191, test_f1: 0.6389
 epoch: 47, train_loss: 0.6461, test_loss: 0.9254, test_f1: 0.6419
 epoch: 48, train_loss: 0.6500, test_loss: 0.9273, test_f1: 0.6324
 epoch: 49, train_loss: 0.6234, test_loss: 0.9350, test_f1: 0.6274
 epoch: 50, train_loss: 0.6230, test_loss: 0.9498, test_f1: 0.6263
 epoch: 51, train_loss: 0.6191, test_loss: 0.9124, test_f1: 0.6588
 epoch: 52, train_loss: 0.6019, test_loss: 0.9253, test_f1: 0.6553
 epoch: 53, train_loss: 0.6020, test_loss: 0.9031, test_f1: 0.6579
 epoch: 54, train_loss: 0.6029, test_loss: 0.9175, test_f1: 0.6522
 epoch: 55, train_loss: 0.5887, test_loss: 0.9198, test_f1: 0.6560
 epoch: 56, train_loss: 0.5895, test_loss: 0.9310, test_f1: 0.6402
 epoch: 57, train_loss: 0.5814, test_loss: 0.9395, test_f1: 0.6330
 epoch: 58, train_loss: 0.5829, test_loss: 0.9331, test_f1: 0.6569
 epoch: 59, train_loss: 0.5739, test_loss: 0.9364, test_f1: 0.6417
 epoch: 60, train_loss: 0.5884, test_loss: 0.9445, test_f1: 0.6444
 epoch: 61, train_loss: 0.5786, test_loss: 0.9389, test_f1: 0.6552
 epoch: 62, train_loss: 0.5724, test_loss: 0.9483, test_f1: 0.6277
 epoch: 63, train_loss: 0.5759, test_loss: 0.9605, test_f1: 0.6214
 epoch: 64, train_loss: 0.5679, test_loss: 0.9612, test_f1: 0.6522
 epoch: 65, train_loss: 0.5645, test_loss: 0.9782, test_f1: 0.6482
 epoch: 66, train_loss: 0.5662, test_loss: 0.9888, test_f1: 0.6392
 epoch: 67, train_loss: 0.5602, test_loss: 0.9662, test_f1: 0.6348
 epoch: 68, train_loss: 0.5579, test_loss: 0.9412, test_f1: 0.6516
 epoch: 69, train_loss: 0.5394, test_loss: 0.9737, test_f1: 0.6299
 epoch: 70, train_loss: 0.5477, test_loss: 0.9846, test_f1: 0.6357
 epoch: 71, train_loss: 0.5530, test_loss: 0.9754, test_f1: 0.6411
 epoch: 72, train_loss: 0.5357, test_loss: 0.9726, test_f1: 0.6204
 epoch: 73, train_loss: 0.5471, test_loss: 0.9957, test_f1: 0.6358
 epoch: 74, train_loss: 0.5602, test_loss: 0.9996, test_f1: 0.6259
 epoch: 75, train_loss: 0.5413, test_loss: 0.9935, test_f1: 0.6235
 epoch: 76, train_loss: 0.5329, test_loss: 0.9900, test_f1: 0.6149
 epoch: 77, train_loss: 0.5402, test_loss: 1.0057, test_f1: 0.6390
 epoch: 78, train_loss: 0.5168, test_loss: 1.0156, test_f1: 0.6380
 epoch: 79, train_loss: 0.5369, test_loss: 1.0099, test_f1: 0.6245
 epoch: 80, train_loss: 0.5300, test_loss: 1.0265, test_f1: 0.6374
 epoch: 81, train_loss: 0.5262, test_loss: 1.0131, test_f1: 0.6333
 epoch: 82, train_loss: 0.5235, test_loss: 1.0181, test_f1: 0.6306
 epoch: 83, train_loss: 0.5292, test_loss: 1.0260, test_f1: 0.6247
 epoch: 84, train_loss: 0.5210, test_loss: 1.0367, test_f1: 0.6287
 epoch: 85, train_loss: 0.5052, test_loss: 1.0375, test_f1: 0.6137
 epoch: 86, train_loss: 0.5046, test_loss: 1.0293, test_f1: 0.6300
 epoch: 87, train_loss: 0.5062, test_loss: 1.0053, test_f1: 0.6415
 epoch: 88, train_loss: 0.5106, test_loss: 1.0105, test_f1: 0.6332
 epoch: 89, train_loss: 0.5069, test_loss: 1.0374, test_f1: 0.6278
 epoch: 90, train_loss: 0.5069, test_loss: 1.0564, test_f1: 0.6368
 epoch: 91, train_loss: 0.4975, test_loss: 1.0473, test_f1: 0.6303
 epoch: 92, train_loss: 0.4980, test_loss: 1.0418, test_f1: 0.6291
 epoch: 93, train_loss: 0.4946, test_loss: 1.0577, test_f1: 0.6291
 epoch: 94, train_loss: 0.4945, test_loss: 1.0414, test_f1: 0.6365
 epoch: 95, train_loss: 0.4994, test_loss: 1.0534, test_f1: 0.6180
 epoch: 96, train_loss: 0.4860, test_loss: 1.0585, test_f1: 0.6297
 epoch: 97, train_loss: 0.4837, test_loss: 1.0628, test_f1: 0.6422
 epoch: 98, train_loss: 0.4725, test_loss: 1.0541, test_f1: 0.6193
 epoch: 99, train_loss: 0.4890, test_loss: 1.0413, test_f1: 0.6405
##################ITERATION #7 ****************************************
 epoch: 0, train_loss: 1.2684, test_loss: 1.3205, test_f1: 0.2270
 epoch: 1, train_loss: 1.1355, test_loss: 1.3187, test_f1: 0.3241
 epoch: 2, train_loss: 1.0950, test_loss: 1.2888, test_f1: 0.3360
 epoch: 3, train_loss: 1.0590, test_loss: 1.2095, test_f1: 0.3872
 epoch: 4, train_loss: 1.0241, test_loss: 1.0751, test_f1: 0.4575
 epoch: 5, train_loss: 1.0149, test_loss: 0.9802, test_f1: 0.5068
 epoch: 6, train_loss: 0.9933, test_loss: 0.9518, test_f1: 0.5372
 epoch: 7, train_loss: 0.9700, test_loss: 0.9268, test_f1: 0.5503
 epoch: 8, train_loss: 0.9542, test_loss: 0.9304, test_f1: 0.5401
 epoch: 9, train_loss: 0.9480, test_loss: 0.9300, test_f1: 0.5324
 epoch: 10, train_loss: 0.9463, test_loss: 0.9082, test_f1: 0.5299
 epoch: 11, train_loss: 0.9146, test_loss: 0.9269, test_f1: 0.5457
 epoch: 12, train_loss: 0.9064, test_loss: 0.9225, test_f1: 0.5522
 epoch: 13, train_loss: 0.8958, test_loss: 0.9091, test_f1: 0.5494
 epoch: 14, train_loss: 0.8788, test_loss: 0.9198, test_f1: 0.5681
 epoch: 15, train_loss: 0.8767, test_loss: 0.9113, test_f1: 0.5399
 epoch: 16, train_loss: 0.8696, test_loss: 0.9211, test_f1: 0.5528
 epoch: 17, train_loss: 0.8603, test_loss: 0.9262, test_f1: 0.5536
 epoch: 18, train_loss: 0.8525, test_loss: 0.9113, test_f1: 0.5539
 epoch: 19, train_loss: 0.8414, test_loss: 0.9233, test_f1: 0.5670
 epoch: 20, train_loss: 0.8391, test_loss: 0.9403, test_f1: 0.5404
 epoch: 21, train_loss: 0.8238, test_loss: 0.9262, test_f1: 0.5744
 epoch: 22, train_loss: 0.8225, test_loss: 0.9106, test_f1: 0.5712
 epoch: 23, train_loss: 0.8145, test_loss: 0.9215, test_f1: 0.5781
 epoch: 24, train_loss: 0.7912, test_loss: 0.8910, test_f1: 0.5956
 epoch: 25, train_loss: 0.7943, test_loss: 0.9022, test_f1: 0.5853
 epoch: 26, train_loss: 0.7932, test_loss: 0.9199, test_f1: 0.5848
 epoch: 27, train_loss: 0.7812, test_loss: 0.9090, test_f1: 0.5892
 epoch: 28, train_loss: 0.7687, test_loss: 0.9076, test_f1: 0.5865
 epoch: 29, train_loss: 0.7688, test_loss: 0.9193, test_f1: 0.5911
 epoch: 30, train_loss: 0.7469, test_loss: 0.9242, test_f1: 0.5898
 epoch: 31, train_loss: 0.7514, test_loss: 0.9358, test_f1: 0.5815
 epoch: 32, train_loss: 0.7408, test_loss: 0.9047, test_f1: 0.5873
 epoch: 33, train_loss: 0.7368, test_loss: 0.9282, test_f1: 0.6013
 epoch: 34, train_loss: 0.7245, test_loss: 0.9294, test_f1: 0.5989
 epoch: 35, train_loss: 0.7187, test_loss: 0.9587, test_f1: 0.5964
 epoch: 36, train_loss: 0.7290, test_loss: 0.9360, test_f1: 0.5998
 epoch: 37, train_loss: 0.7129, test_loss: 0.9242, test_f1: 0.6099
 epoch: 38, train_loss: 0.6997, test_loss: 0.9364, test_f1: 0.5960
 epoch: 39, train_loss: 0.7076, test_loss: 0.9200, test_f1: 0.6034
 epoch: 40, train_loss: 0.6927, test_loss: 0.9668, test_f1: 0.5969
 epoch: 41, train_loss: 0.6947, test_loss: 0.9595, test_f1: 0.6053
 epoch: 42, train_loss: 0.6765, test_loss: 0.9502, test_f1: 0.6432
 epoch: 43, train_loss: 0.6623, test_loss: 0.9572, test_f1: 0.6314
 epoch: 44, train_loss: 0.6736, test_loss: 0.9715, test_f1: 0.6002
 epoch: 45, train_loss: 0.6642, test_loss: 0.9796, test_f1: 0.6150
 epoch: 46, train_loss: 0.6632, test_loss: 0.9718, test_f1: 0.6036
 epoch: 47, train_loss: 0.6490, test_loss: 0.9543, test_f1: 0.6257
 epoch: 48, train_loss: 0.6560, test_loss: 0.9766, test_f1: 0.6189
 epoch: 49, train_loss: 0.6430, test_loss: 0.9883, test_f1: 0.6222
 epoch: 50, train_loss: 0.6468, test_loss: 1.0037, test_f1: 0.6233
 epoch: 51, train_loss: 0.6276, test_loss: 1.0186, test_f1: 0.6247
 epoch: 52, train_loss: 0.6335, test_loss: 1.0105, test_f1: 0.6214
 epoch: 53, train_loss: 0.6123, test_loss: 1.0202, test_f1: 0.6251
 epoch: 54, train_loss: 0.5937, test_loss: 1.0117, test_f1: 0.6270
 epoch: 55, train_loss: 0.6012, test_loss: 1.0188, test_f1: 0.6189
 epoch: 56, train_loss: 0.5911, test_loss: 0.9997, test_f1: 0.6196
 epoch: 57, train_loss: 0.5973, test_loss: 0.9991, test_f1: 0.6265
 epoch: 58, train_loss: 0.6008, test_loss: 1.0354, test_f1: 0.6130
 epoch: 59, train_loss: 0.5841, test_loss: 1.0347, test_f1: 0.6312
 epoch: 60, train_loss: 0.5882, test_loss: 1.0154, test_f1: 0.6301
 epoch: 61, train_loss: 0.5770, test_loss: 1.0222, test_f1: 0.6212
 epoch: 62, train_loss: 0.5783, test_loss: 1.0208, test_f1: 0.6256
 epoch: 63, train_loss: 0.5689, test_loss: 1.0197, test_f1: 0.6185
 epoch: 64, train_loss: 0.5734, test_loss: 1.0273, test_f1: 0.6221
 epoch: 65, train_loss: 0.5694, test_loss: 1.0374, test_f1: 0.6201
 epoch: 66, train_loss: 0.5769, test_loss: 1.0527, test_f1: 0.6146
 epoch: 67, train_loss: 0.5717, test_loss: 1.0479, test_f1: 0.6170
 epoch: 68, train_loss: 0.5695, test_loss: 1.0427, test_f1: 0.6248
 epoch: 69, train_loss: 0.5675, test_loss: 1.0376, test_f1: 0.6238
 epoch: 70, train_loss: 0.5771, test_loss: 1.0449, test_f1: 0.6291
 epoch: 71, train_loss: 0.5575, test_loss: 1.0503, test_f1: 0.6280
 epoch: 72, train_loss: 0.5458, test_loss: 1.0614, test_f1: 0.6145
 epoch: 73, train_loss: 0.5559, test_loss: 1.0305, test_f1: 0.6215
 epoch: 74, train_loss: 0.5483, test_loss: 1.0646, test_f1: 0.6262
 epoch: 75, train_loss: 0.5467, test_loss: 1.0992, test_f1: 0.6160
 epoch: 76, train_loss: 0.5427, test_loss: 1.1070, test_f1: 0.6204
 epoch: 77, train_loss: 0.5394, test_loss: 1.0774, test_f1: 0.6178
 epoch: 78, train_loss: 0.5345, test_loss: 1.0617, test_f1: 0.6355
 epoch: 79, train_loss: 0.5497, test_loss: 1.0578, test_f1: 0.6242
 epoch: 80, train_loss: 0.5439, test_loss: 1.0772, test_f1: 0.6215
 epoch: 81, train_loss: 0.5324, test_loss: 1.0662, test_f1: 0.6191
 epoch: 82, train_loss: 0.5315, test_loss: 1.0490, test_f1: 0.6339
 epoch: 83, train_loss: 0.5253, test_loss: 1.0551, test_f1: 0.6433
 epoch: 84, train_loss: 0.5335, test_loss: 1.0821, test_f1: 0.6242
 epoch: 85, train_loss: 0.5248, test_loss: 1.0581, test_f1: 0.6296
 epoch: 86, train_loss: 0.5049, test_loss: 1.0894, test_f1: 0.6316
 epoch: 87, train_loss: 0.5158, test_loss: 1.1010, test_f1: 0.6280
 epoch: 88, train_loss: 0.5290, test_loss: 1.0666, test_f1: 0.6436
 epoch: 89, train_loss: 0.5064, test_loss: 1.0504, test_f1: 0.6375
 epoch: 90, train_loss: 0.5073, test_loss: 1.0658, test_f1: 0.6428
 epoch: 91, train_loss: 0.5021, test_loss: 1.0812, test_f1: 0.6344
 epoch: 92, train_loss: 0.5149, test_loss: 1.0928, test_f1: 0.6339
 epoch: 93, train_loss: 0.5015, test_loss: 1.0918, test_f1: 0.6410
 epoch: 94, train_loss: 0.5013, test_loss: 1.1386, test_f1: 0.6294
 epoch: 95, train_loss: 0.5020, test_loss: 1.1586, test_f1: 0.6041
 epoch: 96, train_loss: 0.4853, test_loss: 1.1379, test_f1: 0.6162
 epoch: 97, train_loss: 0.4937, test_loss: 1.1572, test_f1: 0.6019
 epoch: 98, train_loss: 0.4958, test_loss: 1.1085, test_f1: 0.6285
 epoch: 99, train_loss: 0.4781, test_loss: 1.1121, test_f1: 0.6357
##################ITERATION #8 ****************************************
 epoch: 0, train_loss: 1.2899, test_loss: 1.3937, test_f1: 0.1781
 epoch: 1, train_loss: 1.1512, test_loss: 1.4098, test_f1: 0.1737
 epoch: 2, train_loss: 1.1091, test_loss: 1.3155, test_f1: 0.2833
 epoch: 3, train_loss: 1.0723, test_loss: 1.2244, test_f1: 0.3389
 epoch: 4, train_loss: 1.0541, test_loss: 1.1500, test_f1: 0.4182
 epoch: 5, train_loss: 1.0310, test_loss: 1.0617, test_f1: 0.4110
 epoch: 6, train_loss: 1.0126, test_loss: 0.9868, test_f1: 0.4836
 epoch: 7, train_loss: 0.9947, test_loss: 0.9375, test_f1: 0.5105
 epoch: 8, train_loss: 0.9594, test_loss: 0.9269, test_f1: 0.5224
 epoch: 9, train_loss: 0.9512, test_loss: 0.9289, test_f1: 0.5240
 epoch: 10, train_loss: 0.9414, test_loss: 0.9102, test_f1: 0.5265
 epoch: 11, train_loss: 0.9291, test_loss: 0.9070, test_f1: 0.5156
 epoch: 12, train_loss: 0.9146, test_loss: 0.9210, test_f1: 0.5257
 epoch: 13, train_loss: 0.9095, test_loss: 0.8952, test_f1: 0.5401
 epoch: 14, train_loss: 0.8885, test_loss: 0.9094, test_f1: 0.5283
 epoch: 15, train_loss: 0.8821, test_loss: 0.8920, test_f1: 0.5354
 epoch: 16, train_loss: 0.8738, test_loss: 0.8796, test_f1: 0.5448
 epoch: 17, train_loss: 0.8532, test_loss: 0.8776, test_f1: 0.5361
 epoch: 18, train_loss: 0.8537, test_loss: 0.8889, test_f1: 0.5439
 epoch: 19, train_loss: 0.8309, test_loss: 0.8881, test_f1: 0.5443
 epoch: 20, train_loss: 0.8353, test_loss: 0.8741, test_f1: 0.5445
 epoch: 21, train_loss: 0.8197, test_loss: 0.8691, test_f1: 0.5509
 epoch: 22, train_loss: 0.8116, test_loss: 0.8586, test_f1: 0.5650
 epoch: 23, train_loss: 0.8030, test_loss: 0.8729, test_f1: 0.5600
 epoch: 24, train_loss: 0.8038, test_loss: 0.8605, test_f1: 0.5636
 epoch: 25, train_loss: 0.7831, test_loss: 0.8744, test_f1: 0.5652
 epoch: 26, train_loss: 0.7716, test_loss: 0.8732, test_f1: 0.5712
 epoch: 27, train_loss: 0.7810, test_loss: 0.8701, test_f1: 0.5802
 epoch: 28, train_loss: 0.7693, test_loss: 0.8782, test_f1: 0.5663
 epoch: 29, train_loss: 0.7659, test_loss: 0.8859, test_f1: 0.5698
 epoch: 30, train_loss: 0.7657, test_loss: 0.8898, test_f1: 0.5710
 epoch: 31, train_loss: 0.7580, test_loss: 0.8970, test_f1: 0.5949
 epoch: 32, train_loss: 0.7397, test_loss: 0.8994, test_f1: 0.5950
 epoch: 33, train_loss: 0.7437, test_loss: 0.8878, test_f1: 0.6029
 epoch: 34, train_loss: 0.7385, test_loss: 0.8742, test_f1: 0.6068
 epoch: 35, train_loss: 0.7174, test_loss: 0.8693, test_f1: 0.5975
 epoch: 36, train_loss: 0.7064, test_loss: 0.8750, test_f1: 0.5995
 epoch: 37, train_loss: 0.7165, test_loss: 0.8743, test_f1: 0.6024
 epoch: 38, train_loss: 0.7096, test_loss: 0.8786, test_f1: 0.5919
 epoch: 39, train_loss: 0.7025, test_loss: 0.8836, test_f1: 0.5935
 epoch: 40, train_loss: 0.6961, test_loss: 0.8872, test_f1: 0.6061
 epoch: 41, train_loss: 0.6975, test_loss: 0.8901, test_f1: 0.6168
 epoch: 42, train_loss: 0.6828, test_loss: 0.8838, test_f1: 0.6120
 epoch: 43, train_loss: 0.6736, test_loss: 0.8893, test_f1: 0.5999
 epoch: 44, train_loss: 0.6779, test_loss: 0.9090, test_f1: 0.5905
 epoch: 45, train_loss: 0.6654, test_loss: 0.8698, test_f1: 0.6171
 epoch: 46, train_loss: 0.6758, test_loss: 0.9209, test_f1: 0.5929
 epoch: 47, train_loss: 0.6537, test_loss: 0.9034, test_f1: 0.5827
 epoch: 48, train_loss: 0.6620, test_loss: 0.9065, test_f1: 0.6045
 epoch: 49, train_loss: 0.6450, test_loss: 0.8960, test_f1: 0.6145
 epoch: 50, train_loss: 0.6376, test_loss: 0.8818, test_f1: 0.6163
 epoch: 51, train_loss: 0.6281, test_loss: 0.9019, test_f1: 0.6257
 epoch: 52, train_loss: 0.6170, test_loss: 0.9052, test_f1: 0.6198
 epoch: 53, train_loss: 0.6191, test_loss: 0.8987, test_f1: 0.6343
 epoch: 54, train_loss: 0.6077, test_loss: 0.9006, test_f1: 0.6390
 epoch: 55, train_loss: 0.6180, test_loss: 0.9065, test_f1: 0.6383
 epoch: 56, train_loss: 0.5927, test_loss: 0.9140, test_f1: 0.6379
 epoch: 57, train_loss: 0.6058, test_loss: 0.8982, test_f1: 0.6311
 epoch: 58, train_loss: 0.6040, test_loss: 0.9035, test_f1: 0.6312
 epoch: 59, train_loss: 0.6073, test_loss: 0.9137, test_f1: 0.6338
 epoch: 60, train_loss: 0.6031, test_loss: 0.9275, test_f1: 0.6254
 epoch: 61, train_loss: 0.6124, test_loss: 0.9315, test_f1: 0.6254
 epoch: 62, train_loss: 0.5890, test_loss: 0.9205, test_f1: 0.6422
 epoch: 63, train_loss: 0.5888, test_loss: 0.9252, test_f1: 0.6463
 epoch: 64, train_loss: 0.5863, test_loss: 0.9134, test_f1: 0.6384
 epoch: 65, train_loss: 0.5718, test_loss: 0.9147, test_f1: 0.6419
 epoch: 66, train_loss: 0.5800, test_loss: 0.9233, test_f1: 0.6468
 epoch: 67, train_loss: 0.5778, test_loss: 0.9431, test_f1: 0.6225
 epoch: 68, train_loss: 0.5783, test_loss: 0.9275, test_f1: 0.6289
 epoch: 69, train_loss: 0.5847, test_loss: 0.9540, test_f1: 0.6278
 epoch: 70, train_loss: 0.5689, test_loss: 0.9522, test_f1: 0.6307
 epoch: 71, train_loss: 0.5741, test_loss: 0.9269, test_f1: 0.6372
 epoch: 72, train_loss: 0.5643, test_loss: 0.9489, test_f1: 0.6399
 epoch: 73, train_loss: 0.5575, test_loss: 0.9297, test_f1: 0.6618
 epoch: 74, train_loss: 0.5574, test_loss: 0.9493, test_f1: 0.6425
 epoch: 75, train_loss: 0.5541, test_loss: 0.9520, test_f1: 0.6442
 epoch: 76, train_loss: 0.5546, test_loss: 0.9494, test_f1: 0.6522
 epoch: 77, train_loss: 0.5541, test_loss: 0.9563, test_f1: 0.6492
 epoch: 78, train_loss: 0.5594, test_loss: 0.9655, test_f1: 0.6391
 epoch: 79, train_loss: 0.5586, test_loss: 0.9570, test_f1: 0.6421
 epoch: 80, train_loss: 0.5530, test_loss: 0.9712, test_f1: 0.6412
 epoch: 81, train_loss: 0.5516, test_loss: 0.9570, test_f1: 0.6515
 epoch: 82, train_loss: 0.5425, test_loss: 0.9790, test_f1: 0.6562
 epoch: 83, train_loss: 0.5370, test_loss: 0.9625, test_f1: 0.6337
 epoch: 84, train_loss: 0.5297, test_loss: 0.9744, test_f1: 0.6370
 epoch: 85, train_loss: 0.5257, test_loss: 1.0049, test_f1: 0.6350
 epoch: 86, train_loss: 0.5412, test_loss: 0.9962, test_f1: 0.6235
 epoch: 87, train_loss: 0.5264, test_loss: 0.9948, test_f1: 0.6566
 epoch: 88, train_loss: 0.5260, test_loss: 0.9968, test_f1: 0.6462
 epoch: 89, train_loss: 0.5208, test_loss: 0.9895, test_f1: 0.6522
 epoch: 90, train_loss: 0.5195, test_loss: 1.0028, test_f1: 0.6518
 epoch: 91, train_loss: 0.5120, test_loss: 1.0347, test_f1: 0.6234
 epoch: 92, train_loss: 0.5069, test_loss: 0.9901, test_f1: 0.6500
 epoch: 93, train_loss: 0.5154, test_loss: 1.0132, test_f1: 0.6355
 epoch: 94, train_loss: 0.5002, test_loss: 1.0075, test_f1: 0.6458
 epoch: 95, train_loss: 0.5119, test_loss: 1.0074, test_f1: 0.6296
 epoch: 96, train_loss: 0.5171, test_loss: 1.0148, test_f1: 0.6433
 epoch: 97, train_loss: 0.5035, test_loss: 1.0131, test_f1: 0.6445
 epoch: 98, train_loss: 0.5108, test_loss: 0.9906, test_f1: 0.6580
 epoch: 99, train_loss: 0.4909, test_loss: 1.0214, test_f1: 0.6347
##################ITERATION #9 ****************************************
 epoch: 0, train_loss: 1.2941, test_loss: 1.3103, test_f1: 0.2270
 epoch: 1, train_loss: 1.1428, test_loss: 1.3746, test_f1: 0.2035
 epoch: 2, train_loss: 1.1041, test_loss: 1.3311, test_f1: 0.2824
 epoch: 3, train_loss: 1.0592, test_loss: 1.1500, test_f1: 0.4413
 epoch: 4, train_loss: 1.0349, test_loss: 1.1046, test_f1: 0.4457
 epoch: 5, train_loss: 1.0182, test_loss: 1.0543, test_f1: 0.4683
 epoch: 6, train_loss: 1.0087, test_loss: 0.9766, test_f1: 0.5075
 epoch: 7, train_loss: 0.9824, test_loss: 0.9416, test_f1: 0.5310
 epoch: 8, train_loss: 0.9645, test_loss: 0.9586, test_f1: 0.5172
 epoch: 9, train_loss: 0.9570, test_loss: 0.9383, test_f1: 0.5453
 epoch: 10, train_loss: 0.9455, test_loss: 0.9440, test_f1: 0.5251
 epoch: 11, train_loss: 0.9303, test_loss: 0.9415, test_f1: 0.5187
 epoch: 12, train_loss: 0.9155, test_loss: 0.9421, test_f1: 0.5369
 epoch: 13, train_loss: 0.9195, test_loss: 0.9369, test_f1: 0.5329
 epoch: 14, train_loss: 0.8888, test_loss: 0.9393, test_f1: 0.5473
 epoch: 15, train_loss: 0.8825, test_loss: 0.9280, test_f1: 0.5353
 epoch: 16, train_loss: 0.8682, test_loss: 0.9291, test_f1: 0.5596
 epoch: 17, train_loss: 0.8653, test_loss: 0.9403, test_f1: 0.5612
 epoch: 18, train_loss: 0.8541, test_loss: 0.9349, test_f1: 0.5705
 epoch: 19, train_loss: 0.8481, test_loss: 0.9238, test_f1: 0.5586
 epoch: 20, train_loss: 0.8338, test_loss: 0.9257, test_f1: 0.5783
 epoch: 21, train_loss: 0.8241, test_loss: 0.9558, test_f1: 0.5576
 epoch: 22, train_loss: 0.8229, test_loss: 0.9456, test_f1: 0.5742
 epoch: 23, train_loss: 0.8177, test_loss: 0.9341, test_f1: 0.5821
 epoch: 24, train_loss: 0.8023, test_loss: 0.9376, test_f1: 0.5920
 epoch: 25, train_loss: 0.7933, test_loss: 0.9337, test_f1: 0.5820
 epoch: 26, train_loss: 0.7947, test_loss: 0.9805, test_f1: 0.5653
 epoch: 27, train_loss: 0.7926, test_loss: 0.9377, test_f1: 0.5744
 epoch: 28, train_loss: 0.7837, test_loss: 0.9426, test_f1: 0.5956
 epoch: 29, train_loss: 0.7739, test_loss: 0.9407, test_f1: 0.5925
 epoch: 30, train_loss: 0.7615, test_loss: 0.9448, test_f1: 0.5869
 epoch: 31, train_loss: 0.7503, test_loss: 0.9632, test_f1: 0.5762
 epoch: 32, train_loss: 0.7556, test_loss: 0.9512, test_f1: 0.5696
 epoch: 33, train_loss: 0.7433, test_loss: 0.9420, test_f1: 0.5800
 epoch: 34, train_loss: 0.7362, test_loss: 0.9374, test_f1: 0.5948
 epoch: 35, train_loss: 0.7378, test_loss: 0.9800, test_f1: 0.5655
 epoch: 36, train_loss: 0.7274, test_loss: 0.9676, test_f1: 0.5895
 epoch: 37, train_loss: 0.7215, test_loss: 0.9358, test_f1: 0.5941
 epoch: 38, train_loss: 0.7131, test_loss: 0.9856, test_f1: 0.5856
 epoch: 39, train_loss: 0.7081, test_loss: 0.9732, test_f1: 0.5912
 epoch: 40, train_loss: 0.7053, test_loss: 0.9690, test_f1: 0.5967
 epoch: 41, train_loss: 0.6863, test_loss: 0.9662, test_f1: 0.6130
 epoch: 42, train_loss: 0.6925, test_loss: 0.9988, test_f1: 0.5916
 epoch: 43, train_loss: 0.6899, test_loss: 0.9867, test_f1: 0.5885
 epoch: 44, train_loss: 0.6971, test_loss: 0.9946, test_f1: 0.5902
 epoch: 45, train_loss: 0.6894, test_loss: 0.9484, test_f1: 0.6042
 epoch: 46, train_loss: 0.6749, test_loss: 0.9953, test_f1: 0.5926
 epoch: 47, train_loss: 0.6710, test_loss: 0.9554, test_f1: 0.5959
 epoch: 48, train_loss: 0.6552, test_loss: 1.0316, test_f1: 0.5842
 epoch: 49, train_loss: 0.6705, test_loss: 1.0176, test_f1: 0.5929
 epoch: 50, train_loss: 0.6605, test_loss: 1.0382, test_f1: 0.6040
 epoch: 51, train_loss: 0.6460, test_loss: 1.0094, test_f1: 0.5974
 epoch: 52, train_loss: 0.6399, test_loss: 1.0085, test_f1: 0.5955
 epoch: 53, train_loss: 0.6333, test_loss: 1.0231, test_f1: 0.5958
 epoch: 54, train_loss: 0.6205, test_loss: 0.9977, test_f1: 0.6121
 epoch: 55, train_loss: 0.6287, test_loss: 1.0088, test_f1: 0.6001
 epoch: 56, train_loss: 0.6259, test_loss: 1.0148, test_f1: 0.5941
 epoch: 57, train_loss: 0.6160, test_loss: 1.0232, test_f1: 0.5951
 epoch: 58, train_loss: 0.6099, test_loss: 1.0271, test_f1: 0.5919
 epoch: 59, train_loss: 0.6075, test_loss: 1.0384, test_f1: 0.5835
 epoch: 60, train_loss: 0.5999, test_loss: 1.0439, test_f1: 0.6034
 epoch: 61, train_loss: 0.6088, test_loss: 1.0565, test_f1: 0.5857
 epoch: 62, train_loss: 0.6067, test_loss: 1.0609, test_f1: 0.5877
 epoch: 63, train_loss: 0.6010, test_loss: 1.0503, test_f1: 0.5978
 epoch: 64, train_loss: 0.5859, test_loss: 1.0427, test_f1: 0.5911
 epoch: 65, train_loss: 0.5934, test_loss: 1.0265, test_f1: 0.5971
 epoch: 66, train_loss: 0.5883, test_loss: 1.0539, test_f1: 0.5799
 epoch: 67, train_loss: 0.5922, test_loss: 1.0982, test_f1: 0.5869
 epoch: 68, train_loss: 0.5912, test_loss: 1.0585, test_f1: 0.5878
 epoch: 69, train_loss: 0.5755, test_loss: 1.0519, test_f1: 0.5896
 epoch: 70, train_loss: 0.5884, test_loss: 1.0304, test_f1: 0.5978
 epoch: 71, train_loss: 0.5776, test_loss: 1.0458, test_f1: 0.5872
 epoch: 72, train_loss: 0.5710, test_loss: 1.0571, test_f1: 0.6047
 epoch: 73, train_loss: 0.5790, test_loss: 1.0787, test_f1: 0.5992
 epoch: 74, train_loss: 0.5725, test_loss: 1.0836, test_f1: 0.6042
 epoch: 75, train_loss: 0.5732, test_loss: 1.0789, test_f1: 0.6099
 epoch: 76, train_loss: 0.5625, test_loss: 1.0668, test_f1: 0.5963
 epoch: 77, train_loss: 0.5483, test_loss: 1.0112, test_f1: 0.6147
 epoch: 78, train_loss: 0.5684, test_loss: 1.0597, test_f1: 0.6070
 epoch: 79, train_loss: 0.5534, test_loss: 1.0644, test_f1: 0.6111
 epoch: 80, train_loss: 0.5533, test_loss: 1.0718, test_f1: 0.5995
 epoch: 81, train_loss: 0.5473, test_loss: 1.0930, test_f1: 0.5973
 epoch: 82, train_loss: 0.5427, test_loss: 1.0745, test_f1: 0.6077
 epoch: 83, train_loss: 0.5440, test_loss: 1.1013, test_f1: 0.6139
 epoch: 84, train_loss: 0.5400, test_loss: 1.1175, test_f1: 0.6099
 epoch: 85, train_loss: 0.5368, test_loss: 1.1523, test_f1: 0.5905
 epoch: 86, train_loss: 0.5482, test_loss: 1.0865, test_f1: 0.6197
 epoch: 87, train_loss: 0.5398, test_loss: 1.0796, test_f1: 0.6112
 epoch: 88, train_loss: 0.5454, test_loss: 1.1278, test_f1: 0.5989
 epoch: 89, train_loss: 0.5444, test_loss: 1.1280, test_f1: 0.6069
 epoch: 90, train_loss: 0.5219, test_loss: 1.1017, test_f1: 0.6040
 epoch: 91, train_loss: 0.5298, test_loss: 1.1413, test_f1: 0.6195
 epoch: 92, train_loss: 0.5260, test_loss: 1.1425, test_f1: 0.6013
 epoch: 93, train_loss: 0.5314, test_loss: 1.1348, test_f1: 0.6090
 epoch: 94, train_loss: 0.5286, test_loss: 1.1514, test_f1: 0.5901
 epoch: 95, train_loss: 0.5229, test_loss: 1.1292, test_f1: 0.6103
 epoch: 96, train_loss: 0.5238, test_loss: 1.1309, test_f1: 0.6209
 epoch: 97, train_loss: 0.5045, test_loss: 1.1512, test_f1: 0.5887
 epoch: 98, train_loss: 0.5043, test_loss: 1.1337, test_f1: 0.6144
 epoch: 99, train_loss: 0.5069, test_loss: 1.1443, test_f1: 0.6087

Training completed in 457.27 seconds
Best F1: 0.6618 at epoch 73
Mean F1 across iterations: 0.6424  0.0159
========================FINAL RESULTS================================
FEGIN weighted F1: 0.6618  0.0159
python main.py --data ltspice_examples --representation component_net --model FEGIN --layers 6 --hiddens 128 --batch_size 256 --lr 0.0001 --emb_size 512 --epochs 100 --save_appendix component_net_L6_H128_BS256_LR0.0001_E512 --no_val
-----



STDERR:
  File "main.py", line 370, in <module>
    main()
  File "main.py", line 254, in main
    dataset = dataset_class(
  File "/home/philip/projects/ltspice_examples_code_repo/Circuit-Completion-Using-GNNs/component_classification_with_link_prediction_head/evaluation/FEGIN/kernel/circuit_datasets.py", line 15, in __init__
    self.data, self.slices = torch.load(self.processed_paths[0])
  File "/home/philip/.local/lib/python3.8/site-packages/torch/serialization.py", line 1040, in load
    warnings.warn(
  File "/usr/lib/python3.8/warnings.py", line 109, in _showwarnmsg
    sw(msg.message, msg.category, msg.filename, msg.lineno,
  File "main.py", line 47, in warn_with_traceback
    traceback.print_stack(file=log)
/home/philip/projects/ltspice_examples_code_repo/Circuit-Completion-Using-GNNs/component_classification_with_link_prediction_head/evaluation/FEGIN/kernel/circuit_datasets.py:15: FutureWarning: You are using `torch.load` with `weights_only=False` (the current default value), which uses the default pickle module implicitly. It is possible to construct malicious pickle data which will execute arbitrary code during unpickling (See https://github.com/pytorch/pytorch/blob/main/SECURITY.md#untrusted-models for more details). In a future release, the default value for `weights_only` will be flipped to `True`. This limits the functions that could be executed during unpickling. Arbitrary objects will no longer be allowed to be loaded via this mode unless they are explicitly allowlisted by the user via `torch.serialization.add_safe_globals`. We recommend you start setting `weights_only=True` for any use case where you don't have full control of the loaded file. Please open an issue on GitHub for any issues related to this experimental feature.
  self.data, self.slices = torch.load(self.processed_paths[0])
