STDOUT:
Results will be saved in /home/philip/projects/ltspice_examples_code_repo/Circuit-Completion-Using-GNNs/component_classification_with_link_prediction_head/evaluation/FEGIN/results/model_FEGIN_dataset_ltspice_examples
Command line input: python main.py --data ltspice_examples --representation component_pin_net --model FEGIN --layers 4 --hiddens 128 --batch_size 32 --lr 0.0001 --emb_size 512 --epochs 100 --save_appendix component_pin_net_L4_H128_BS32_LR0.0001_E512 --no_val
 is saved.
-----
ltspice_examples - FEGIN
Using 4 layers, 128 hidden units, h = 2
Loading component_pin_net representation dataset
ENTERED
Training FEGIN on component_pin_net representation
Train: 3558, Test: 846
##################ITERATION #0 ****************************************
 epoch: 0, train_loss: 1.3056, test_loss: 1.1718, test_f1: 0.3168
 epoch: 1, train_loss: 1.1425, test_loss: 1.0662, test_f1: 0.3430
 epoch: 2, train_loss: 1.0635, test_loss: 1.0420, test_f1: 0.3409
 epoch: 3, train_loss: 1.0290, test_loss: 1.0148, test_f1: 0.4435
 epoch: 4, train_loss: 0.9993, test_loss: 1.0010, test_f1: 0.4612
 epoch: 5, train_loss: 0.9763, test_loss: 0.9689, test_f1: 0.5095
 epoch: 6, train_loss: 0.9633, test_loss: 0.9540, test_f1: 0.4971
 epoch: 7, train_loss: 0.9376, test_loss: 0.9298, test_f1: 0.5073
 epoch: 8, train_loss: 0.9062, test_loss: 0.9212, test_f1: 0.5086
 epoch: 9, train_loss: 0.9068, test_loss: 0.9245, test_f1: 0.5183
 epoch: 10, train_loss: 0.8986, test_loss: 0.8938, test_f1: 0.5164
 epoch: 11, train_loss: 0.8907, test_loss: 0.9158, test_f1: 0.5210
 epoch: 12, train_loss: 0.8657, test_loss: 0.8759, test_f1: 0.5528
 epoch: 13, train_loss: 0.8722, test_loss: 0.8621, test_f1: 0.5656
 epoch: 14, train_loss: 0.8569, test_loss: 0.8586, test_f1: 0.5410
 epoch: 15, train_loss: 0.8404, test_loss: 0.8767, test_f1: 0.5281
 epoch: 16, train_loss: 0.8412, test_loss: 0.8771, test_f1: 0.5323
 epoch: 17, train_loss: 0.8323, test_loss: 0.8723, test_f1: 0.5589
 epoch: 18, train_loss: 0.8123, test_loss: 0.8755, test_f1: 0.5508
 epoch: 19, train_loss: 0.8110, test_loss: 0.8276, test_f1: 0.5626
 epoch: 20, train_loss: 0.8074, test_loss: 0.8731, test_f1: 0.5532
 epoch: 21, train_loss: 0.7979, test_loss: 0.8669, test_f1: 0.5474
 epoch: 22, train_loss: 0.7847, test_loss: 0.8345, test_f1: 0.5585
 epoch: 23, train_loss: 0.7795, test_loss: 0.8626, test_f1: 0.5487
 epoch: 24, train_loss: 0.7674, test_loss: 0.8377, test_f1: 0.5552
 epoch: 25, train_loss: 0.7578, test_loss: 0.8170, test_f1: 0.5609
 epoch: 26, train_loss: 0.7523, test_loss: 0.8433, test_f1: 0.5643
 epoch: 27, train_loss: 0.7519, test_loss: 0.8887, test_f1: 0.5711
 epoch: 28, train_loss: 0.7517, test_loss: 0.8354, test_f1: 0.5605
 epoch: 29, train_loss: 0.7428, test_loss: 0.8653, test_f1: 0.5502
 epoch: 30, train_loss: 0.7331, test_loss: 0.8181, test_f1: 0.5840
 epoch: 31, train_loss: 0.7285, test_loss: 0.8683, test_f1: 0.5816
 epoch: 32, train_loss: 0.7098, test_loss: 0.8469, test_f1: 0.5698
 epoch: 33, train_loss: 0.7195, test_loss: 0.8107, test_f1: 0.5824
 epoch: 34, train_loss: 0.7055, test_loss: 0.8002, test_f1: 0.6149
 epoch: 35, train_loss: 0.7003, test_loss: 0.7780, test_f1: 0.5984
 epoch: 36, train_loss: 0.6864, test_loss: 0.7980, test_f1: 0.6067
 epoch: 37, train_loss: 0.6881, test_loss: 0.8844, test_f1: 0.6016
 epoch: 38, train_loss: 0.6940, test_loss: 0.8020, test_f1: 0.6021
 epoch: 39, train_loss: 0.6772, test_loss: 0.7908, test_f1: 0.6100
 epoch: 40, train_loss: 0.6787, test_loss: 0.8035, test_f1: 0.5884
 epoch: 41, train_loss: 0.6633, test_loss: 0.8652, test_f1: 0.6000
 epoch: 42, train_loss: 0.6566, test_loss: 0.7936, test_f1: 0.6068
 epoch: 43, train_loss: 0.6546, test_loss: 0.8194, test_f1: 0.6271
 epoch: 44, train_loss: 0.6448, test_loss: 0.8550, test_f1: 0.5920
 epoch: 45, train_loss: 0.6387, test_loss: 0.7792, test_f1: 0.6412
 epoch: 46, train_loss: 0.6460, test_loss: 0.8201, test_f1: 0.6173
 epoch: 47, train_loss: 0.6361, test_loss: 0.8062, test_f1: 0.6421
 epoch: 48, train_loss: 0.6232, test_loss: 0.8268, test_f1: 0.6231
 epoch: 49, train_loss: 0.6193, test_loss: 0.8445, test_f1: 0.6335
 epoch: 50, train_loss: 0.6128, test_loss: 0.8410, test_f1: 0.6259
 epoch: 51, train_loss: 0.6023, test_loss: 0.8608, test_f1: 0.6158
 epoch: 52, train_loss: 0.5954, test_loss: 0.8443, test_f1: 0.6172
 epoch: 53, train_loss: 0.5819, test_loss: 0.8588, test_f1: 0.6268
 epoch: 54, train_loss: 0.5793, test_loss: 0.8445, test_f1: 0.6208
 epoch: 55, train_loss: 0.5789, test_loss: 0.8263, test_f1: 0.6418
 epoch: 56, train_loss: 0.5813, test_loss: 0.8546, test_f1: 0.6419
 epoch: 57, train_loss: 0.5684, test_loss: 0.8752, test_f1: 0.6156
 epoch: 58, train_loss: 0.5619, test_loss: 0.8866, test_f1: 0.6327
 epoch: 59, train_loss: 0.5565, test_loss: 0.8541, test_f1: 0.6314
 epoch: 60, train_loss: 0.5666, test_loss: 0.8839, test_f1: 0.6355
 epoch: 61, train_loss: 0.5639, test_loss: 0.8651, test_f1: 0.6365
 epoch: 62, train_loss: 0.5588, test_loss: 0.8686, test_f1: 0.6454
 epoch: 63, train_loss: 0.5521, test_loss: 0.8588, test_f1: 0.6508
 epoch: 64, train_loss: 0.5489, test_loss: 0.8981, test_f1: 0.6589
 epoch: 65, train_loss: 0.5371, test_loss: 0.9373, test_f1: 0.6279
 epoch: 66, train_loss: 0.5555, test_loss: 0.8978, test_f1: 0.6449
 epoch: 67, train_loss: 0.5313, test_loss: 0.9329, test_f1: 0.6424
 epoch: 68, train_loss: 0.5314, test_loss: 0.9232, test_f1: 0.6441
 epoch: 69, train_loss: 0.5283, test_loss: 0.9092, test_f1: 0.6653
 epoch: 70, train_loss: 0.5272, test_loss: 0.8876, test_f1: 0.6478
 epoch: 71, train_loss: 0.5341, test_loss: 0.9786, test_f1: 0.6181
 epoch: 72, train_loss: 0.5277, test_loss: 0.9133, test_f1: 0.6512
 epoch: 73, train_loss: 0.5239, test_loss: 0.9149, test_f1: 0.6615
 epoch: 74, train_loss: 0.5226, test_loss: 0.9193, test_f1: 0.6582
 epoch: 75, train_loss: 0.5093, test_loss: 0.9517, test_f1: 0.6330
 epoch: 76, train_loss: 0.5281, test_loss: 0.9617, test_f1: 0.6399
 epoch: 77, train_loss: 0.5082, test_loss: 0.9490, test_f1: 0.6499
 epoch: 78, train_loss: 0.5139, test_loss: 0.9235, test_f1: 0.6647
 epoch: 79, train_loss: 0.5100, test_loss: 0.9850, test_f1: 0.6541
 epoch: 80, train_loss: 0.5128, test_loss: 0.9190, test_f1: 0.6545
 epoch: 81, train_loss: 0.5142, test_loss: 0.9752, test_f1: 0.6292
 epoch: 82, train_loss: 0.4986, test_loss: 1.0009, test_f1: 0.6331
 epoch: 83, train_loss: 0.4988, test_loss: 0.9962, test_f1: 0.6160
 epoch: 84, train_loss: 0.4957, test_loss: 0.9496, test_f1: 0.6565
 epoch: 85, train_loss: 0.4880, test_loss: 0.9790, test_f1: 0.6539
 epoch: 86, train_loss: 0.4905, test_loss: 1.0002, test_f1: 0.6367
 epoch: 87, train_loss: 0.4949, test_loss: 0.9560, test_f1: 0.6525
 epoch: 88, train_loss: 0.4935, test_loss: 1.0413, test_f1: 0.6349
 epoch: 89, train_loss: 0.4888, test_loss: 1.0171, test_f1: 0.6511
 epoch: 90, train_loss: 0.4948, test_loss: 1.0319, test_f1: 0.6327
 epoch: 91, train_loss: 0.4783, test_loss: 0.9691, test_f1: 0.6572
 epoch: 92, train_loss: 0.4666, test_loss: 1.0237, test_f1: 0.6505
 epoch: 93, train_loss: 0.4834, test_loss: 0.9735, test_f1: 0.6488
 epoch: 94, train_loss: 0.4644, test_loss: 0.9973, test_f1: 0.6628
 epoch: 95, train_loss: 0.4638, test_loss: 1.0466, test_f1: 0.6541
 epoch: 96, train_loss: 0.4810, test_loss: 1.0142, test_f1: 0.6662
 epoch: 97, train_loss: 0.4633, test_loss: 1.0220, test_f1: 0.6636
 epoch: 98, train_loss: 0.4662, test_loss: 1.0364, test_f1: 0.6562
 epoch: 99, train_loss: 0.4556, test_loss: 1.0084, test_f1: 0.6564
##################ITERATION #1 ****************************************
 epoch: 0, train_loss: 1.1642, test_loss: 1.0227, test_f1: 0.4512
 epoch: 1, train_loss: 1.0077, test_loss: 0.9927, test_f1: 0.4844
 epoch: 2, train_loss: 0.9779, test_loss: 0.9664, test_f1: 0.5018
 epoch: 3, train_loss: 0.9491, test_loss: 0.9465, test_f1: 0.5046
 epoch: 4, train_loss: 0.9325, test_loss: 0.9434, test_f1: 0.5291
 epoch: 5, train_loss: 0.9114, test_loss: 0.9329, test_f1: 0.5197
 epoch: 6, train_loss: 0.9003, test_loss: 0.9253, test_f1: 0.5167
 epoch: 7, train_loss: 0.8954, test_loss: 0.8930, test_f1: 0.5433
 epoch: 8, train_loss: 0.8642, test_loss: 0.8928, test_f1: 0.5668
 epoch: 9, train_loss: 0.8536, test_loss: 0.8875, test_f1: 0.5351
 epoch: 10, train_loss: 0.8464, test_loss: 0.8470, test_f1: 0.5488
 epoch: 11, train_loss: 0.8326, test_loss: 0.8625, test_f1: 0.5622
 epoch: 12, train_loss: 0.8271, test_loss: 0.8819, test_f1: 0.5592
 epoch: 13, train_loss: 0.8153, test_loss: 0.8112, test_f1: 0.5887
 epoch: 14, train_loss: 0.7999, test_loss: 0.7926, test_f1: 0.5752
 epoch: 15, train_loss: 0.7919, test_loss: 0.8236, test_f1: 0.6189
 epoch: 16, train_loss: 0.7821, test_loss: 0.8317, test_f1: 0.5852
 epoch: 17, train_loss: 0.7705, test_loss: 0.8140, test_f1: 0.5997
 epoch: 18, train_loss: 0.7598, test_loss: 0.8023, test_f1: 0.5795
 epoch: 19, train_loss: 0.7559, test_loss: 0.7724, test_f1: 0.5856
 epoch: 20, train_loss: 0.7344, test_loss: 0.7641, test_f1: 0.5896
 epoch: 21, train_loss: 0.7314, test_loss: 0.8365, test_f1: 0.6121
 epoch: 22, train_loss: 0.7281, test_loss: 0.8260, test_f1: 0.6133
 epoch: 23, train_loss: 0.7196, test_loss: 0.8153, test_f1: 0.6322
 epoch: 24, train_loss: 0.7187, test_loss: 0.8221, test_f1: 0.6059
 epoch: 25, train_loss: 0.7177, test_loss: 0.7629, test_f1: 0.6021
 epoch: 26, train_loss: 0.7007, test_loss: 0.8430, test_f1: 0.5944
 epoch: 27, train_loss: 0.6894, test_loss: 0.7748, test_f1: 0.6178
 epoch: 28, train_loss: 0.6732, test_loss: 0.7760, test_f1: 0.6005
 epoch: 29, train_loss: 0.6799, test_loss: 0.7776, test_f1: 0.6387
 epoch: 30, train_loss: 0.6540, test_loss: 0.7050, test_f1: 0.6888
 epoch: 31, train_loss: 0.6622, test_loss: 0.7272, test_f1: 0.6672
 epoch: 32, train_loss: 0.6509, test_loss: 0.7084, test_f1: 0.6333
 epoch: 33, train_loss: 0.6512, test_loss: 0.7450, test_f1: 0.6213
 epoch: 34, train_loss: 0.6425, test_loss: 0.8241, test_f1: 0.6538
 epoch: 35, train_loss: 0.6276, test_loss: 0.7586, test_f1: 0.6418
 epoch: 36, train_loss: 0.6181, test_loss: 0.8235, test_f1: 0.6214
 epoch: 37, train_loss: 0.6263, test_loss: 0.7448, test_f1: 0.6381
 epoch: 38, train_loss: 0.6025, test_loss: 0.8449, test_f1: 0.6172
 epoch: 39, train_loss: 0.6140, test_loss: 0.8747, test_f1: 0.6548
 epoch: 40, train_loss: 0.5924, test_loss: 0.7858, test_f1: 0.6508
 epoch: 41, train_loss: 0.5904, test_loss: 0.8208, test_f1: 0.6427
 epoch: 42, train_loss: 0.5963, test_loss: 0.7910, test_f1: 0.6265
 epoch: 43, train_loss: 0.5791, test_loss: 0.8528, test_f1: 0.6274
 epoch: 44, train_loss: 0.5734, test_loss: 0.8174, test_f1: 0.6628
 epoch: 45, train_loss: 0.5681, test_loss: 0.7620, test_f1: 0.6501
 epoch: 46, train_loss: 0.5690, test_loss: 0.7842, test_f1: 0.6594
 epoch: 47, train_loss: 0.5589, test_loss: 0.8130, test_f1: 0.6536
 epoch: 48, train_loss: 0.5611, test_loss: 0.8543, test_f1: 0.6260
 epoch: 49, train_loss: 0.5532, test_loss: 0.7786, test_f1: 0.6616
 epoch: 50, train_loss: 0.5565, test_loss: 0.8261, test_f1: 0.6273
 epoch: 51, train_loss: 0.5314, test_loss: 0.7961, test_f1: 0.6608
 epoch: 52, train_loss: 0.5199, test_loss: 0.7680, test_f1: 0.6686
 epoch: 53, train_loss: 0.5199, test_loss: 0.8558, test_f1: 0.6493
 epoch: 54, train_loss: 0.5083, test_loss: 0.8461, test_f1: 0.6579
 epoch: 55, train_loss: 0.5082, test_loss: 0.8352, test_f1: 0.6558
 epoch: 56, train_loss: 0.5083, test_loss: 0.7956, test_f1: 0.6589
 epoch: 57, train_loss: 0.5016, test_loss: 0.8196, test_f1: 0.6721
 epoch: 58, train_loss: 0.4870, test_loss: 0.8095, test_f1: 0.6621
 epoch: 59, train_loss: 0.4941, test_loss: 0.8247, test_f1: 0.6569
 epoch: 60, train_loss: 0.4858, test_loss: 0.8072, test_f1: 0.6566
 epoch: 61, train_loss: 0.4871, test_loss: 0.8180, test_f1: 0.6851
 epoch: 62, train_loss: 0.4832, test_loss: 0.8397, test_f1: 0.6638
 epoch: 63, train_loss: 0.4742, test_loss: 0.8452, test_f1: 0.6482
 epoch: 64, train_loss: 0.4806, test_loss: 0.9425, test_f1: 0.6428
 epoch: 65, train_loss: 0.4674, test_loss: 0.8792, test_f1: 0.6596
 epoch: 66, train_loss: 0.4800, test_loss: 0.8560, test_f1: 0.6558
 epoch: 67, train_loss: 0.4666, test_loss: 0.9210, test_f1: 0.6438
 epoch: 68, train_loss: 0.4678, test_loss: 0.9587, test_f1: 0.6531
 epoch: 69, train_loss: 0.4633, test_loss: 0.8856, test_f1: 0.6608
 epoch: 70, train_loss: 0.4601, test_loss: 0.8887, test_f1: 0.6693
 epoch: 71, train_loss: 0.4715, test_loss: 0.8370, test_f1: 0.6620
 epoch: 72, train_loss: 0.4645, test_loss: 0.8584, test_f1: 0.6535
 epoch: 73, train_loss: 0.4553, test_loss: 0.8775, test_f1: 0.6517
 epoch: 74, train_loss: 0.4506, test_loss: 0.9128, test_f1: 0.6540
 epoch: 75, train_loss: 0.4506, test_loss: 0.8905, test_f1: 0.6653
 epoch: 76, train_loss: 0.4512, test_loss: 0.8954, test_f1: 0.6628
 epoch: 77, train_loss: 0.4551, test_loss: 0.9429, test_f1: 0.6548
 epoch: 78, train_loss: 0.4416, test_loss: 0.9669, test_f1: 0.6447
 epoch: 79, train_loss: 0.4345, test_loss: 1.0116, test_f1: 0.6377
 epoch: 80, train_loss: 0.4351, test_loss: 0.9976, test_f1: 0.6374
 epoch: 81, train_loss: 0.4368, test_loss: 1.0448, test_f1: 0.6463
 epoch: 82, train_loss: 0.4321, test_loss: 1.0224, test_f1: 0.6430
 epoch: 83, train_loss: 0.4287, test_loss: 0.9985, test_f1: 0.6352
 epoch: 84, train_loss: 0.4265, test_loss: 0.9768, test_f1: 0.6468
 epoch: 85, train_loss: 0.4252, test_loss: 0.9989, test_f1: 0.6393
 epoch: 86, train_loss: 0.4305, test_loss: 0.9299, test_f1: 0.6710
 epoch: 87, train_loss: 0.4283, test_loss: 0.9824, test_f1: 0.6544
 epoch: 88, train_loss: 0.4200, test_loss: 0.9323, test_f1: 0.6705
 epoch: 89, train_loss: 0.4167, test_loss: 1.0138, test_f1: 0.6573
 epoch: 90, train_loss: 0.4168, test_loss: 1.0001, test_f1: 0.6544
 epoch: 91, train_loss: 0.4205, test_loss: 0.9777, test_f1: 0.6643
 epoch: 92, train_loss: 0.4061, test_loss: 0.9921, test_f1: 0.6802
 epoch: 93, train_loss: 0.4133, test_loss: 1.0117, test_f1: 0.6355
 epoch: 94, train_loss: 0.4031, test_loss: 1.0143, test_f1: 0.6660
 epoch: 95, train_loss: 0.4283, test_loss: 0.9906, test_f1: 0.6569
 epoch: 96, train_loss: 0.4075, test_loss: 1.0217, test_f1: 0.6636
 epoch: 97, train_loss: 0.3988, test_loss: 1.0454, test_f1: 0.6450
 epoch: 98, train_loss: 0.3937, test_loss: 1.0259, test_f1: 0.6487
 epoch: 99, train_loss: 0.3912, test_loss: 0.9589, test_f1: 0.6782
##################ITERATION #2 ****************************************
 epoch: 0, train_loss: 1.1190, test_loss: 0.9981, test_f1: 0.5034
 epoch: 1, train_loss: 1.0001, test_loss: 0.9677, test_f1: 0.5159
 epoch: 2, train_loss: 0.9651, test_loss: 0.9359, test_f1: 0.5157
 epoch: 3, train_loss: 0.9420, test_loss: 0.9279, test_f1: 0.5395
 epoch: 4, train_loss: 0.9240, test_loss: 0.8917, test_f1: 0.5486
 epoch: 5, train_loss: 0.9005, test_loss: 0.8678, test_f1: 0.5241
 epoch: 6, train_loss: 0.8879, test_loss: 0.8708, test_f1: 0.5433
 epoch: 7, train_loss: 0.8678, test_loss: 0.8257, test_f1: 0.5642
 epoch: 8, train_loss: 0.8583, test_loss: 0.8381, test_f1: 0.5625
 epoch: 9, train_loss: 0.8548, test_loss: 0.8149, test_f1: 0.5765
 epoch: 10, train_loss: 0.8416, test_loss: 0.8084, test_f1: 0.5581
 epoch: 11, train_loss: 0.8198, test_loss: 0.8221, test_f1: 0.5745
 epoch: 12, train_loss: 0.8268, test_loss: 0.8220, test_f1: 0.5923
 epoch: 13, train_loss: 0.8122, test_loss: 0.7744, test_f1: 0.5965
 epoch: 14, train_loss: 0.7881, test_loss: 0.7677, test_f1: 0.6475
 epoch: 15, train_loss: 0.7828, test_loss: 0.7998, test_f1: 0.6140
 epoch: 16, train_loss: 0.7770, test_loss: 0.7881, test_f1: 0.6200
 epoch: 17, train_loss: 0.7731, test_loss: 0.7469, test_f1: 0.6366
 epoch: 18, train_loss: 0.7396, test_loss: 0.7993, test_f1: 0.6210
 epoch: 19, train_loss: 0.7474, test_loss: 0.7376, test_f1: 0.6425
 epoch: 20, train_loss: 0.7421, test_loss: 0.7357, test_f1: 0.6403
 epoch: 21, train_loss: 0.7262, test_loss: 0.7522, test_f1: 0.6450
 epoch: 22, train_loss: 0.7151, test_loss: 0.7388, test_f1: 0.6437
 epoch: 23, train_loss: 0.7022, test_loss: 0.7649, test_f1: 0.6278
 epoch: 24, train_loss: 0.7044, test_loss: 0.7387, test_f1: 0.6477
 epoch: 25, train_loss: 0.6957, test_loss: 0.7910, test_f1: 0.6011
 epoch: 26, train_loss: 0.6905, test_loss: 0.7395, test_f1: 0.6489
 epoch: 27, train_loss: 0.6760, test_loss: 0.7496, test_f1: 0.6347
 epoch: 28, train_loss: 0.6737, test_loss: 0.8119, test_f1: 0.6291
 epoch: 29, train_loss: 0.6508, test_loss: 0.7276, test_f1: 0.6418
 epoch: 30, train_loss: 0.6644, test_loss: 0.7546, test_f1: 0.6166
 epoch: 31, train_loss: 0.6310, test_loss: 0.7758, test_f1: 0.6141
 epoch: 32, train_loss: 0.6358, test_loss: 0.7403, test_f1: 0.6484
 epoch: 33, train_loss: 0.6275, test_loss: 0.7857, test_f1: 0.6532
 epoch: 34, train_loss: 0.6383, test_loss: 0.7473, test_f1: 0.6525
 epoch: 35, train_loss: 0.6113, test_loss: 0.7616, test_f1: 0.6370
 epoch: 36, train_loss: 0.6212, test_loss: 0.7624, test_f1: 0.6334
 epoch: 37, train_loss: 0.6135, test_loss: 0.7733, test_f1: 0.6386
 epoch: 38, train_loss: 0.6108, test_loss: 0.7872, test_f1: 0.6334
 epoch: 39, train_loss: 0.5869, test_loss: 0.8252, test_f1: 0.6268
 epoch: 40, train_loss: 0.5989, test_loss: 0.8356, test_f1: 0.6172
 epoch: 41, train_loss: 0.5897, test_loss: 0.8233, test_f1: 0.6433
 epoch: 42, train_loss: 0.5759, test_loss: 0.7354, test_f1: 0.6649
 epoch: 43, train_loss: 0.5772, test_loss: 0.7952, test_f1: 0.6306
 epoch: 44, train_loss: 0.5544, test_loss: 0.9317, test_f1: 0.6053
 epoch: 45, train_loss: 0.5707, test_loss: 0.8514, test_f1: 0.6193
 epoch: 46, train_loss: 0.5563, test_loss: 0.8152, test_f1: 0.6326
 epoch: 47, train_loss: 0.5391, test_loss: 0.8731, test_f1: 0.6320
 epoch: 48, train_loss: 0.5508, test_loss: 0.8905, test_f1: 0.6311
 epoch: 49, train_loss: 0.5295, test_loss: 0.8736, test_f1: 0.6333
 epoch: 50, train_loss: 0.5248, test_loss: 0.9505, test_f1: 0.6292
 epoch: 51, train_loss: 0.4982, test_loss: 0.9110, test_f1: 0.6330
 epoch: 52, train_loss: 0.5061, test_loss: 0.9309, test_f1: 0.6259
 epoch: 53, train_loss: 0.4942, test_loss: 0.9332, test_f1: 0.6348
 epoch: 54, train_loss: 0.4770, test_loss: 0.9508, test_f1: 0.6315
 epoch: 55, train_loss: 0.4820, test_loss: 0.9549, test_f1: 0.6392
 epoch: 56, train_loss: 0.4725, test_loss: 0.9475, test_f1: 0.6291
 epoch: 57, train_loss: 0.4866, test_loss: 0.8677, test_f1: 0.6409
 epoch: 58, train_loss: 0.4738, test_loss: 1.0111, test_f1: 0.6430
 epoch: 59, train_loss: 0.4781, test_loss: 1.0376, test_f1: 0.6272
 epoch: 60, train_loss: 0.4590, test_loss: 0.9506, test_f1: 0.6403
 epoch: 61, train_loss: 0.4575, test_loss: 0.9790, test_f1: 0.6386
 epoch: 62, train_loss: 0.4582, test_loss: 1.0683, test_f1: 0.6222
 epoch: 63, train_loss: 0.4515, test_loss: 0.9735, test_f1: 0.6314
 epoch: 64, train_loss: 0.4453, test_loss: 0.9384, test_f1: 0.6411
 epoch: 65, train_loss: 0.4627, test_loss: 1.1119, test_f1: 0.6181
 epoch: 66, train_loss: 0.4639, test_loss: 1.0195, test_f1: 0.6317
 epoch: 67, train_loss: 0.4507, test_loss: 1.0453, test_f1: 0.6286
 epoch: 68, train_loss: 0.4531, test_loss: 1.0853, test_f1: 0.6342
 epoch: 69, train_loss: 0.4417, test_loss: 1.0561, test_f1: 0.6306
 epoch: 70, train_loss: 0.4274, test_loss: 1.0477, test_f1: 0.6195
 epoch: 71, train_loss: 0.4456, test_loss: 1.0058, test_f1: 0.6417
 epoch: 72, train_loss: 0.4410, test_loss: 0.9966, test_f1: 0.6400
 epoch: 73, train_loss: 0.4385, test_loss: 1.1256, test_f1: 0.6331
 epoch: 74, train_loss: 0.4243, test_loss: 1.1405, test_f1: 0.6358
 epoch: 75, train_loss: 0.4265, test_loss: 1.1721, test_f1: 0.6422
 epoch: 76, train_loss: 0.4187, test_loss: 1.1454, test_f1: 0.6442
 epoch: 77, train_loss: 0.4234, test_loss: 1.1531, test_f1: 0.6369
 epoch: 78, train_loss: 0.4186, test_loss: 1.1555, test_f1: 0.6347
 epoch: 79, train_loss: 0.4259, test_loss: 1.1833, test_f1: 0.6070
 epoch: 80, train_loss: 0.3975, test_loss: 1.0447, test_f1: 0.6306
 epoch: 81, train_loss: 0.3977, test_loss: 1.2147, test_f1: 0.6401
 epoch: 82, train_loss: 0.4145, test_loss: 1.1366, test_f1: 0.6444
 epoch: 83, train_loss: 0.4025, test_loss: 1.2530, test_f1: 0.6225
 epoch: 84, train_loss: 0.4114, test_loss: 1.2516, test_f1: 0.6346
 epoch: 85, train_loss: 0.4178, test_loss: 1.2231, test_f1: 0.6087
 epoch: 86, train_loss: 0.4029, test_loss: 1.1137, test_f1: 0.6436
 epoch: 87, train_loss: 0.4078, test_loss: 1.2709, test_f1: 0.6435
 epoch: 88, train_loss: 0.3934, test_loss: 1.1962, test_f1: 0.6427
 epoch: 89, train_loss: 0.3745, test_loss: 1.1991, test_f1: 0.6407
 epoch: 90, train_loss: 0.3783, test_loss: 1.1860, test_f1: 0.6499
 epoch: 91, train_loss: 0.3827, test_loss: 1.2554, test_f1: 0.6542
 epoch: 92, train_loss: 0.3761, test_loss: 1.2525, test_f1: 0.6445
 epoch: 93, train_loss: 0.3784, test_loss: 1.3105, test_f1: 0.6472
 epoch: 94, train_loss: 0.3683, test_loss: 1.2953, test_f1: 0.6343
 epoch: 95, train_loss: 0.3749, test_loss: 1.2424, test_f1: 0.6400
 epoch: 96, train_loss: 0.3660, test_loss: 1.2461, test_f1: 0.6341
 epoch: 97, train_loss: 0.3836, test_loss: 1.3370, test_f1: 0.6242
 epoch: 98, train_loss: 0.3730, test_loss: 1.2450, test_f1: 0.6263
 epoch: 99, train_loss: 0.3556, test_loss: 1.3170, test_f1: 0.6220
##################ITERATION #3 ****************************************
 epoch: 0, train_loss: 1.1053, test_loss: 0.9777, test_f1: 0.5046
 epoch: 1, train_loss: 0.9849, test_loss: 0.9473, test_f1: 0.5461
 epoch: 2, train_loss: 0.9594, test_loss: 0.9172, test_f1: 0.5400
 epoch: 3, train_loss: 0.9357, test_loss: 0.8843, test_f1: 0.5443
 epoch: 4, train_loss: 0.9072, test_loss: 0.8775, test_f1: 0.5546
 epoch: 5, train_loss: 0.8945, test_loss: 0.8533, test_f1: 0.5356
 epoch: 6, train_loss: 0.8705, test_loss: 0.8452, test_f1: 0.5496
 epoch: 7, train_loss: 0.8663, test_loss: 0.8044, test_f1: 0.5609
 epoch: 8, train_loss: 0.8479, test_loss: 0.8057, test_f1: 0.5495
 epoch: 9, train_loss: 0.8273, test_loss: 0.7972, test_f1: 0.5828
 epoch: 10, train_loss: 0.8266, test_loss: 0.7979, test_f1: 0.5949
 epoch: 11, train_loss: 0.8014, test_loss: 0.7972, test_f1: 0.6045
 epoch: 12, train_loss: 0.7868, test_loss: 0.7993, test_f1: 0.5875
 epoch: 13, train_loss: 0.7860, test_loss: 0.7528, test_f1: 0.6199
 epoch: 14, train_loss: 0.7729, test_loss: 0.7417, test_f1: 0.6204
 epoch: 15, train_loss: 0.7819, test_loss: 0.7279, test_f1: 0.6483
 epoch: 16, train_loss: 0.7489, test_loss: 0.7509, test_f1: 0.6354
 epoch: 17, train_loss: 0.7525, test_loss: 0.7543, test_f1: 0.6225
 epoch: 18, train_loss: 0.7321, test_loss: 0.7435, test_f1: 0.6520
 epoch: 19, train_loss: 0.7140, test_loss: 0.7014, test_f1: 0.6564
 epoch: 20, train_loss: 0.7070, test_loss: 0.7206, test_f1: 0.6427
 epoch: 21, train_loss: 0.7024, test_loss: 0.7058, test_f1: 0.6690
 epoch: 22, train_loss: 0.6775, test_loss: 0.7697, test_f1: 0.6325
 epoch: 23, train_loss: 0.6874, test_loss: 0.7243, test_f1: 0.6530
 epoch: 24, train_loss: 0.6813, test_loss: 0.6982, test_f1: 0.6587
 epoch: 25, train_loss: 0.6650, test_loss: 0.7499, test_f1: 0.6466
 epoch: 26, train_loss: 0.6623, test_loss: 0.6878, test_f1: 0.6776
 epoch: 27, train_loss: 0.6644, test_loss: 0.7001, test_f1: 0.6919
 epoch: 28, train_loss: 0.6428, test_loss: 0.7016, test_f1: 0.6576
 epoch: 29, train_loss: 0.6462, test_loss: 0.7248, test_f1: 0.6493
 epoch: 30, train_loss: 0.6258, test_loss: 0.7213, test_f1: 0.6689
 epoch: 31, train_loss: 0.6309, test_loss: 0.7395, test_f1: 0.6498
 epoch: 32, train_loss: 0.6130, test_loss: 0.7596, test_f1: 0.6516
 epoch: 33, train_loss: 0.6101, test_loss: 0.6960, test_f1: 0.6597
 epoch: 34, train_loss: 0.6037, test_loss: 0.7530, test_f1: 0.6629
 epoch: 35, train_loss: 0.6010, test_loss: 0.7929, test_f1: 0.6187
 epoch: 36, train_loss: 0.5909, test_loss: 0.7693, test_f1: 0.6472
 epoch: 37, train_loss: 0.5830, test_loss: 0.8325, test_f1: 0.6323
 epoch: 38, train_loss: 0.5902, test_loss: 0.7155, test_f1: 0.6563
 epoch: 39, train_loss: 0.5721, test_loss: 0.7675, test_f1: 0.6341
 epoch: 40, train_loss: 0.5627, test_loss: 0.7708, test_f1: 0.6389
 epoch: 41, train_loss: 0.5647, test_loss: 0.8051, test_f1: 0.6387
 epoch: 42, train_loss: 0.5682, test_loss: 0.7423, test_f1: 0.6583
 epoch: 43, train_loss: 0.5450, test_loss: 0.8070, test_f1: 0.6410
 epoch: 44, train_loss: 0.5406, test_loss: 0.8178, test_f1: 0.6717
 epoch: 45, train_loss: 0.5417, test_loss: 0.8608, test_f1: 0.6501
 epoch: 46, train_loss: 0.5295, test_loss: 0.8985, test_f1: 0.6426
 epoch: 47, train_loss: 0.5327, test_loss: 0.8707, test_f1: 0.6335
 epoch: 48, train_loss: 0.5344, test_loss: 0.9102, test_f1: 0.6222
 epoch: 49, train_loss: 0.5386, test_loss: 0.9355, test_f1: 0.6426
 epoch: 50, train_loss: 0.5162, test_loss: 0.8664, test_f1: 0.6416
 epoch: 51, train_loss: 0.5059, test_loss: 0.9049, test_f1: 0.6484
 epoch: 52, train_loss: 0.4820, test_loss: 0.8867, test_f1: 0.6503
 epoch: 53, train_loss: 0.4773, test_loss: 0.9283, test_f1: 0.6413
 epoch: 54, train_loss: 0.4668, test_loss: 0.9422, test_f1: 0.6512
 epoch: 55, train_loss: 0.4601, test_loss: 0.9515, test_f1: 0.6404
 epoch: 56, train_loss: 0.4706, test_loss: 0.9337, test_f1: 0.6483
 epoch: 57, train_loss: 0.4588, test_loss: 0.9258, test_f1: 0.6684
 epoch: 58, train_loss: 0.4607, test_loss: 0.9670, test_f1: 0.6592
 epoch: 59, train_loss: 0.4586, test_loss: 0.9432, test_f1: 0.6373
 epoch: 60, train_loss: 0.4550, test_loss: 0.9940, test_f1: 0.6547
 epoch: 61, train_loss: 0.4515, test_loss: 1.0265, test_f1: 0.6431
 epoch: 62, train_loss: 0.4517, test_loss: 1.0923, test_f1: 0.6484
 epoch: 63, train_loss: 0.4453, test_loss: 1.0420, test_f1: 0.6497
 epoch: 64, train_loss: 0.4479, test_loss: 1.0234, test_f1: 0.6494
 epoch: 65, train_loss: 0.4373, test_loss: 1.0875, test_f1: 0.6296
 epoch: 66, train_loss: 0.4390, test_loss: 1.0173, test_f1: 0.6502
 epoch: 67, train_loss: 0.4330, test_loss: 1.0671, test_f1: 0.6516
 epoch: 68, train_loss: 0.4213, test_loss: 1.0607, test_f1: 0.6516
 epoch: 69, train_loss: 0.4262, test_loss: 1.0738, test_f1: 0.6652
 epoch: 70, train_loss: 0.4194, test_loss: 1.1443, test_f1: 0.6654
 epoch: 71, train_loss: 0.4168, test_loss: 1.0592, test_f1: 0.6615
 epoch: 72, train_loss: 0.4285, test_loss: 1.1044, test_f1: 0.6375
 epoch: 73, train_loss: 0.4241, test_loss: 1.1375, test_f1: 0.6512
 epoch: 74, train_loss: 0.4069, test_loss: 1.1164, test_f1: 0.6612
 epoch: 75, train_loss: 0.3995, test_loss: 1.1563, test_f1: 0.6488
 epoch: 76, train_loss: 0.4073, test_loss: 1.1442, test_f1: 0.6569
 epoch: 77, train_loss: 0.4035, test_loss: 1.1963, test_f1: 0.6552
 epoch: 78, train_loss: 0.3985, test_loss: 1.2024, test_f1: 0.6585
 epoch: 79, train_loss: 0.3976, test_loss: 1.2677, test_f1: 0.6412
 epoch: 80, train_loss: 0.3880, test_loss: 1.1879, test_f1: 0.6461
 epoch: 81, train_loss: 0.4043, test_loss: 1.2239, test_f1: 0.6530
 epoch: 82, train_loss: 0.3999, test_loss: 1.2285, test_f1: 0.6454
 epoch: 83, train_loss: 0.3840, test_loss: 1.1604, test_f1: 0.6623
 epoch: 84, train_loss: 0.3886, test_loss: 1.2025, test_f1: 0.6749
 epoch: 85, train_loss: 0.3770, test_loss: 1.2548, test_f1: 0.6547
 epoch: 86, train_loss: 0.3726, test_loss: 1.2511, test_f1: 0.6469
 epoch: 87, train_loss: 0.3772, test_loss: 1.2353, test_f1: 0.6649
 epoch: 88, train_loss: 0.3671, test_loss: 1.2372, test_f1: 0.6578
 epoch: 89, train_loss: 0.3748, test_loss: 1.2754, test_f1: 0.6594
 epoch: 90, train_loss: 0.3670, test_loss: 1.2753, test_f1: 0.6581
 epoch: 91, train_loss: 0.3788, test_loss: 1.2714, test_f1: 0.6509
 epoch: 92, train_loss: 0.3594, test_loss: 1.2382, test_f1: 0.6546
 epoch: 93, train_loss: 0.3691, test_loss: 1.2959, test_f1: 0.6412
 epoch: 94, train_loss: 0.3714, test_loss: 1.2698, test_f1: 0.6664
 epoch: 95, train_loss: 0.3597, test_loss: 1.3111, test_f1: 0.6638
 epoch: 96, train_loss: 0.3575, test_loss: 1.3566, test_f1: 0.6519
 epoch: 97, train_loss: 0.3509, test_loss: 1.3418, test_f1: 0.6660
 epoch: 98, train_loss: 0.3553, test_loss: 1.2538, test_f1: 0.6487
 epoch: 99, train_loss: 0.3476, test_loss: 1.2970, test_f1: 0.6471
##################ITERATION #4 ****************************************
 epoch: 0, train_loss: 1.1141, test_loss: 0.9615, test_f1: 0.5292
 epoch: 1, train_loss: 0.9873, test_loss: 0.9198, test_f1: 0.5000
 epoch: 2, train_loss: 0.9629, test_loss: 0.9053, test_f1: 0.5412
 epoch: 3, train_loss: 0.9379, test_loss: 0.8957, test_f1: 0.5115
 epoch: 4, train_loss: 0.9144, test_loss: 0.8712, test_f1: 0.5485
 epoch: 5, train_loss: 0.9015, test_loss: 0.8758, test_f1: 0.5343
 epoch: 6, train_loss: 0.8899, test_loss: 0.8519, test_f1: 0.5448
 epoch: 7, train_loss: 0.8653, test_loss: 0.8691, test_f1: 0.5899
 epoch: 8, train_loss: 0.8570, test_loss: 0.8765, test_f1: 0.5867
 epoch: 9, train_loss: 0.8435, test_loss: 0.8433, test_f1: 0.5770
 epoch: 10, train_loss: 0.8239, test_loss: 0.8075, test_f1: 0.5761
 epoch: 11, train_loss: 0.8081, test_loss: 0.8307, test_f1: 0.5954
 epoch: 12, train_loss: 0.8009, test_loss: 0.8528, test_f1: 0.5687
 epoch: 13, train_loss: 0.7909, test_loss: 0.8062, test_f1: 0.5859
 epoch: 14, train_loss: 0.7842, test_loss: 0.8039, test_f1: 0.5812
 epoch: 15, train_loss: 0.7595, test_loss: 0.8088, test_f1: 0.5929
 epoch: 16, train_loss: 0.7696, test_loss: 0.7601, test_f1: 0.6328
 epoch: 17, train_loss: 0.7530, test_loss: 0.7866, test_f1: 0.6094
 epoch: 18, train_loss: 0.7401, test_loss: 0.7434, test_f1: 0.6396
 epoch: 19, train_loss: 0.7374, test_loss: 0.7673, test_f1: 0.6259
 epoch: 20, train_loss: 0.7310, test_loss: 0.7925, test_f1: 0.6122
 epoch: 21, train_loss: 0.7019, test_loss: 0.7875, test_f1: 0.5867
 epoch: 22, train_loss: 0.7117, test_loss: 0.7797, test_f1: 0.6197
 epoch: 23, train_loss: 0.6755, test_loss: 0.7402, test_f1: 0.6324
 epoch: 24, train_loss: 0.6941, test_loss: 0.7974, test_f1: 0.6316
 epoch: 25, train_loss: 0.6826, test_loss: 0.7483, test_f1: 0.6204
 epoch: 26, train_loss: 0.6674, test_loss: 0.8362, test_f1: 0.6280
 epoch: 27, train_loss: 0.6630, test_loss: 0.7888, test_f1: 0.6511
 epoch: 28, train_loss: 0.6573, test_loss: 0.7347, test_f1: 0.6549
 epoch: 29, train_loss: 0.6452, test_loss: 0.7773, test_f1: 0.6375
 epoch: 30, train_loss: 0.6344, test_loss: 0.7619, test_f1: 0.6335
 epoch: 31, train_loss: 0.6349, test_loss: 0.7980, test_f1: 0.6478
 epoch: 32, train_loss: 0.6300, test_loss: 0.8231, test_f1: 0.6432
 epoch: 33, train_loss: 0.6282, test_loss: 0.7921, test_f1: 0.6334
 epoch: 34, train_loss: 0.6026, test_loss: 0.9083, test_f1: 0.6468
 epoch: 35, train_loss: 0.6029, test_loss: 0.8315, test_f1: 0.6537
 epoch: 36, train_loss: 0.6001, test_loss: 0.8697, test_f1: 0.6400
 epoch: 37, train_loss: 0.5792, test_loss: 0.8661, test_f1: 0.6342
 epoch: 38, train_loss: 0.5928, test_loss: 0.8455, test_f1: 0.6381
 epoch: 39, train_loss: 0.5774, test_loss: 0.9098, test_f1: 0.6566
 epoch: 40, train_loss: 0.5693, test_loss: 0.9054, test_f1: 0.6337
 epoch: 41, train_loss: 0.5566, test_loss: 0.8505, test_f1: 0.6577
 epoch: 42, train_loss: 0.5585, test_loss: 0.8578, test_f1: 0.6335
 epoch: 43, train_loss: 0.5549, test_loss: 0.9368, test_f1: 0.6584
 epoch: 44, train_loss: 0.5550, test_loss: 0.9128, test_f1: 0.6580
 epoch: 45, train_loss: 0.5528, test_loss: 0.9523, test_f1: 0.6588
 epoch: 46, train_loss: 0.5392, test_loss: 0.8712, test_f1: 0.6323
 epoch: 47, train_loss: 0.5221, test_loss: 0.9228, test_f1: 0.6501
 epoch: 48, train_loss: 0.5114, test_loss: 0.9559, test_f1: 0.6447
 epoch: 49, train_loss: 0.5205, test_loss: 1.0054, test_f1: 0.6447
 epoch: 50, train_loss: 0.5366, test_loss: 1.0069, test_f1: 0.6546
 epoch: 51, train_loss: 0.4979, test_loss: 0.9234, test_f1: 0.6646
 epoch: 52, train_loss: 0.4797, test_loss: 0.9744, test_f1: 0.6541
 epoch: 53, train_loss: 0.4774, test_loss: 0.9972, test_f1: 0.6593
 epoch: 54, train_loss: 0.4763, test_loss: 0.9812, test_f1: 0.6347
 epoch: 55, train_loss: 0.4651, test_loss: 0.9649, test_f1: 0.6697
 epoch: 56, train_loss: 0.4527, test_loss: 1.0248, test_f1: 0.6630
 epoch: 57, train_loss: 0.4675, test_loss: 1.0193, test_f1: 0.6525
 epoch: 58, train_loss: 0.4600, test_loss: 1.0053, test_f1: 0.6478
 epoch: 59, train_loss: 0.4505, test_loss: 1.0519, test_f1: 0.6669
 epoch: 60, train_loss: 0.4602, test_loss: 1.0325, test_f1: 0.6445
 epoch: 61, train_loss: 0.4534, test_loss: 1.1075, test_f1: 0.6521
 epoch: 62, train_loss: 0.4532, test_loss: 1.0437, test_f1: 0.6595
 epoch: 63, train_loss: 0.4351, test_loss: 1.0981, test_f1: 0.6620
 epoch: 64, train_loss: 0.4326, test_loss: 1.0852, test_f1: 0.6656
 epoch: 65, train_loss: 0.4293, test_loss: 1.1087, test_f1: 0.6561
 epoch: 66, train_loss: 0.4218, test_loss: 1.0319, test_f1: 0.6627
 epoch: 67, train_loss: 0.4173, test_loss: 1.0604, test_f1: 0.6508
 epoch: 68, train_loss: 0.4259, test_loss: 1.1691, test_f1: 0.6402
 epoch: 69, train_loss: 0.4263, test_loss: 1.1842, test_f1: 0.6605
 epoch: 70, train_loss: 0.4254, test_loss: 1.1344, test_f1: 0.6489
 epoch: 71, train_loss: 0.4197, test_loss: 1.1323, test_f1: 0.6595
 epoch: 72, train_loss: 0.4140, test_loss: 1.1643, test_f1: 0.6482
 epoch: 73, train_loss: 0.4259, test_loss: 1.1717, test_f1: 0.6617
 epoch: 74, train_loss: 0.4051, test_loss: 1.1665, test_f1: 0.6606
 epoch: 75, train_loss: 0.4135, test_loss: 1.2720, test_f1: 0.6770
 epoch: 76, train_loss: 0.4200, test_loss: 1.1604, test_f1: 0.6663
 epoch: 77, train_loss: 0.4174, test_loss: 1.2167, test_f1: 0.6531
 epoch: 78, train_loss: 0.3938, test_loss: 1.2392, test_f1: 0.6358
 epoch: 79, train_loss: 0.4017, test_loss: 1.2233, test_f1: 0.6446
 epoch: 80, train_loss: 0.3922, test_loss: 1.2011, test_f1: 0.6444
 epoch: 81, train_loss: 0.3878, test_loss: 1.2551, test_f1: 0.6467
 epoch: 82, train_loss: 0.3906, test_loss: 1.2508, test_f1: 0.6552
 epoch: 83, train_loss: 0.3853, test_loss: 1.2059, test_f1: 0.6534
 epoch: 84, train_loss: 0.3905, test_loss: 1.2707, test_f1: 0.6659
 epoch: 85, train_loss: 0.3837, test_loss: 1.2786, test_f1: 0.6522
 epoch: 86, train_loss: 0.3641, test_loss: 1.2661, test_f1: 0.6603
 epoch: 87, train_loss: 0.3812, test_loss: 1.1895, test_f1: 0.6708
 epoch: 88, train_loss: 0.3640, test_loss: 1.2100, test_f1: 0.6666
 epoch: 89, train_loss: 0.3696, test_loss: 1.3562, test_f1: 0.6441
 epoch: 90, train_loss: 0.3625, test_loss: 1.3042, test_f1: 0.6547
 epoch: 91, train_loss: 0.3796, test_loss: 1.3108, test_f1: 0.6446
 epoch: 92, train_loss: 0.3720, test_loss: 1.2987, test_f1: 0.6687
 epoch: 93, train_loss: 0.3655, test_loss: 1.3344, test_f1: 0.6568
 epoch: 94, train_loss: 0.3652, test_loss: 1.3907, test_f1: 0.6613
 epoch: 95, train_loss: 0.3672, test_loss: 1.3531, test_f1: 0.6550
 epoch: 96, train_loss: 0.3526, test_loss: 1.3568, test_f1: 0.6494
 epoch: 97, train_loss: 0.3465, test_loss: 1.3904, test_f1: 0.6613
 epoch: 98, train_loss: 0.3463, test_loss: 1.2810, test_f1: 0.6693
 epoch: 99, train_loss: 0.3351, test_loss: 1.3492, test_f1: 0.6610
##################ITERATION #5 ****************************************
 epoch: 0, train_loss: 1.1661, test_loss: 0.9789, test_f1: 0.5105
 epoch: 1, train_loss: 1.0093, test_loss: 0.9313, test_f1: 0.5243
 epoch: 2, train_loss: 0.9779, test_loss: 0.9246, test_f1: 0.5210
 epoch: 3, train_loss: 0.9433, test_loss: 0.9338, test_f1: 0.5105
 epoch: 4, train_loss: 0.9331, test_loss: 0.8962, test_f1: 0.5104
 epoch: 5, train_loss: 0.9135, test_loss: 0.8721, test_f1: 0.5386
 epoch: 6, train_loss: 0.8921, test_loss: 0.8348, test_f1: 0.5492
 epoch: 7, train_loss: 0.8744, test_loss: 0.8431, test_f1: 0.5449
 epoch: 8, train_loss: 0.8633, test_loss: 0.8147, test_f1: 0.5702
 epoch: 9, train_loss: 0.8544, test_loss: 0.8261, test_f1: 0.5742
 epoch: 10, train_loss: 0.8359, test_loss: 0.8332, test_f1: 0.5725
 epoch: 11, train_loss: 0.8261, test_loss: 0.7933, test_f1: 0.5892
 epoch: 12, train_loss: 0.8116, test_loss: 0.7743, test_f1: 0.5997
 epoch: 13, train_loss: 0.8038, test_loss: 0.7701, test_f1: 0.6153
 epoch: 14, train_loss: 0.7820, test_loss: 0.7676, test_f1: 0.5989
 epoch: 15, train_loss: 0.7776, test_loss: 0.7825, test_f1: 0.6102
 epoch: 16, train_loss: 0.7702, test_loss: 0.7462, test_f1: 0.6397
 epoch: 17, train_loss: 0.7672, test_loss: 0.7586, test_f1: 0.6003
 epoch: 18, train_loss: 0.7375, test_loss: 0.7359, test_f1: 0.6460
 epoch: 19, train_loss: 0.7318, test_loss: 0.7438, test_f1: 0.6171
 epoch: 20, train_loss: 0.7275, test_loss: 0.7337, test_f1: 0.6485
 epoch: 21, train_loss: 0.7257, test_loss: 0.7471, test_f1: 0.6352
 epoch: 22, train_loss: 0.7064, test_loss: 0.7558, test_f1: 0.6379
 epoch: 23, train_loss: 0.7114, test_loss: 0.7168, test_f1: 0.6561
 epoch: 24, train_loss: 0.6804, test_loss: 0.7748, test_f1: 0.6230
 epoch: 25, train_loss: 0.6863, test_loss: 0.7831, test_f1: 0.5976
 epoch: 26, train_loss: 0.6725, test_loss: 0.7217, test_f1: 0.6273
 epoch: 27, train_loss: 0.6804, test_loss: 0.7156, test_f1: 0.6648
 epoch: 28, train_loss: 0.6595, test_loss: 0.7673, test_f1: 0.6507
 epoch: 29, train_loss: 0.6531, test_loss: 0.7332, test_f1: 0.6381
 epoch: 30, train_loss: 0.6382, test_loss: 0.7494, test_f1: 0.6297
 epoch: 31, train_loss: 0.6289, test_loss: 0.7442, test_f1: 0.6488
 epoch: 32, train_loss: 0.6336, test_loss: 0.7924, test_f1: 0.6497
 epoch: 33, train_loss: 0.6208, test_loss: 0.7944, test_f1: 0.6359
 epoch: 34, train_loss: 0.6104, test_loss: 0.8521, test_f1: 0.6364
 epoch: 35, train_loss: 0.6287, test_loss: 0.7601, test_f1: 0.6498
 epoch: 36, train_loss: 0.6032, test_loss: 0.7345, test_f1: 0.6484
 epoch: 37, train_loss: 0.5935, test_loss: 0.7620, test_f1: 0.6465
 epoch: 38, train_loss: 0.5815, test_loss: 0.7761, test_f1: 0.6496
 epoch: 39, train_loss: 0.5772, test_loss: 0.8871, test_f1: 0.6298
 epoch: 40, train_loss: 0.5740, test_loss: 0.9355, test_f1: 0.6471
 epoch: 41, train_loss: 0.5714, test_loss: 0.9056, test_f1: 0.6490
 epoch: 42, train_loss: 0.5526, test_loss: 0.9208, test_f1: 0.6459
 epoch: 43, train_loss: 0.5555, test_loss: 0.8884, test_f1: 0.6356
 epoch: 44, train_loss: 0.5454, test_loss: 0.9870, test_f1: 0.6528
 epoch: 45, train_loss: 0.5464, test_loss: 0.9749, test_f1: 0.6468
 epoch: 46, train_loss: 0.5341, test_loss: 1.0602, test_f1: 0.6574
 epoch: 47, train_loss: 0.5470, test_loss: 1.0176, test_f1: 0.6193
 epoch: 48, train_loss: 0.5402, test_loss: 1.0053, test_f1: 0.6474
 epoch: 49, train_loss: 0.5190, test_loss: 1.0404, test_f1: 0.6309
 epoch: 50, train_loss: 0.5269, test_loss: 0.9098, test_f1: 0.6424
 epoch: 51, train_loss: 0.4993, test_loss: 1.0225, test_f1: 0.6403
 epoch: 52, train_loss: 0.4838, test_loss: 1.0117, test_f1: 0.6529
 epoch: 53, train_loss: 0.4659, test_loss: 1.0236, test_f1: 0.6394
 epoch: 54, train_loss: 0.4743, test_loss: 1.1126, test_f1: 0.6373
 epoch: 55, train_loss: 0.4858, test_loss: 1.0848, test_f1: 0.6409
 epoch: 56, train_loss: 0.4803, test_loss: 1.1447, test_f1: 0.6372
 epoch: 57, train_loss: 0.4711, test_loss: 1.0557, test_f1: 0.6343
 epoch: 58, train_loss: 0.4652, test_loss: 1.1061, test_f1: 0.6391
 epoch: 59, train_loss: 0.4503, test_loss: 1.1452, test_f1: 0.6518
 epoch: 60, train_loss: 0.4486, test_loss: 1.1769, test_f1: 0.6343
 epoch: 61, train_loss: 0.4478, test_loss: 1.1371, test_f1: 0.6352
 epoch: 62, train_loss: 0.4643, test_loss: 1.1314, test_f1: 0.6398
 epoch: 63, train_loss: 0.4424, test_loss: 1.1430, test_f1: 0.6395
 epoch: 64, train_loss: 0.4363, test_loss: 1.1295, test_f1: 0.6293
 epoch: 65, train_loss: 0.4340, test_loss: 1.1681, test_f1: 0.6405
 epoch: 66, train_loss: 0.4299, test_loss: 1.1684, test_f1: 0.6458
 epoch: 67, train_loss: 0.4209, test_loss: 1.0633, test_f1: 0.6440
 epoch: 68, train_loss: 0.4359, test_loss: 1.1164, test_f1: 0.6378
 epoch: 69, train_loss: 0.4191, test_loss: 1.1352, test_f1: 0.6458
 epoch: 70, train_loss: 0.4228, test_loss: 1.0983, test_f1: 0.6372
 epoch: 71, train_loss: 0.4237, test_loss: 1.1888, test_f1: 0.6433
 epoch: 72, train_loss: 0.4191, test_loss: 1.2683, test_f1: 0.6283
 epoch: 73, train_loss: 0.4167, test_loss: 1.2387, test_f1: 0.6424
 epoch: 74, train_loss: 0.4194, test_loss: 1.2259, test_f1: 0.6202
 epoch: 75, train_loss: 0.4042, test_loss: 1.2468, test_f1: 0.6538
 epoch: 76, train_loss: 0.4103, test_loss: 1.1601, test_f1: 0.6374
 epoch: 77, train_loss: 0.3941, test_loss: 1.2011, test_f1: 0.6517
 epoch: 78, train_loss: 0.3943, test_loss: 1.1907, test_f1: 0.6435
 epoch: 79, train_loss: 0.3884, test_loss: 1.2522, test_f1: 0.6517
 epoch: 80, train_loss: 0.3894, test_loss: 1.2295, test_f1: 0.6457
 epoch: 81, train_loss: 0.3922, test_loss: 1.2816, test_f1: 0.6463
 epoch: 82, train_loss: 0.3863, test_loss: 1.2162, test_f1: 0.6408
 epoch: 83, train_loss: 0.3691, test_loss: 1.2599, test_f1: 0.6528
 epoch: 84, train_loss: 0.3604, test_loss: 1.2581, test_f1: 0.6438
 epoch: 85, train_loss: 0.3879, test_loss: 1.2577, test_f1: 0.6302
 epoch: 86, train_loss: 0.3843, test_loss: 1.2979, test_f1: 0.6506
 epoch: 87, train_loss: 0.3688, test_loss: 1.3051, test_f1: 0.6400
 epoch: 88, train_loss: 0.3662, test_loss: 1.3346, test_f1: 0.6456
 epoch: 89, train_loss: 0.3708, test_loss: 1.2568, test_f1: 0.6505
 epoch: 90, train_loss: 0.3702, test_loss: 1.3589, test_f1: 0.6425
 epoch: 91, train_loss: 0.3513, test_loss: 1.3716, test_f1: 0.6550
 epoch: 92, train_loss: 0.3664, test_loss: 1.3311, test_f1: 0.6431
 epoch: 93, train_loss: 0.3583, test_loss: 1.4025, test_f1: 0.6375
 epoch: 94, train_loss: 0.3495, test_loss: 1.3677, test_f1: 0.6474
 epoch: 95, train_loss: 0.3513, test_loss: 1.4853, test_f1: 0.6470
 epoch: 96, train_loss: 0.3550, test_loss: 1.4665, test_f1: 0.6709
 epoch: 97, train_loss: 0.3451, test_loss: 1.3852, test_f1: 0.6379
 epoch: 98, train_loss: 0.3493, test_loss: 1.4456, test_f1: 0.6580
 epoch: 99, train_loss: 0.3349, test_loss: 1.3919, test_f1: 0.6531
##################ITERATION #6 ****************************************
 epoch: 0, train_loss: 1.1709, test_loss: 1.0244, test_f1: 0.4889
 epoch: 1, train_loss: 1.0181, test_loss: 0.9454, test_f1: 0.4943
 epoch: 2, train_loss: 0.9714, test_loss: 0.9180, test_f1: 0.5178
 epoch: 3, train_loss: 0.9676, test_loss: 0.9170, test_f1: 0.5126
 epoch: 4, train_loss: 0.9455, test_loss: 0.9117, test_f1: 0.5173
 epoch: 5, train_loss: 0.9201, test_loss: 0.8815, test_f1: 0.5647
 epoch: 6, train_loss: 0.8963, test_loss: 0.8801, test_f1: 0.5406
 epoch: 7, train_loss: 0.8885, test_loss: 0.8442, test_f1: 0.5354
 epoch: 8, train_loss: 0.8684, test_loss: 0.8141, test_f1: 0.5852
 epoch: 9, train_loss: 0.8613, test_loss: 0.8261, test_f1: 0.5581
 epoch: 10, train_loss: 0.8450, test_loss: 0.8310, test_f1: 0.5809
 epoch: 11, train_loss: 0.8369, test_loss: 0.8042, test_f1: 0.5892
 epoch: 12, train_loss: 0.8140, test_loss: 0.8183, test_f1: 0.6001
 epoch: 13, train_loss: 0.8028, test_loss: 0.7924, test_f1: 0.5917
 epoch: 14, train_loss: 0.8015, test_loss: 0.7828, test_f1: 0.5750
 epoch: 15, train_loss: 0.7849, test_loss: 0.7968, test_f1: 0.6155
 epoch: 16, train_loss: 0.7689, test_loss: 0.7643, test_f1: 0.6197
 epoch: 17, train_loss: 0.7765, test_loss: 0.7616, test_f1: 0.6196
 epoch: 18, train_loss: 0.7548, test_loss: 0.7546, test_f1: 0.6465
 epoch: 19, train_loss: 0.7552, test_loss: 0.7879, test_f1: 0.6423
 epoch: 20, train_loss: 0.7521, test_loss: 0.7558, test_f1: 0.6509
 epoch: 21, train_loss: 0.7384, test_loss: 0.7659, test_f1: 0.6229
 epoch: 22, train_loss: 0.7246, test_loss: 0.7859, test_f1: 0.6057
 epoch: 23, train_loss: 0.7268, test_loss: 0.7531, test_f1: 0.6445
 epoch: 24, train_loss: 0.7133, test_loss: 0.7320, test_f1: 0.6130
 epoch: 25, train_loss: 0.7030, test_loss: 0.7269, test_f1: 0.6318
 epoch: 26, train_loss: 0.7001, test_loss: 0.7119, test_f1: 0.6464
 epoch: 27, train_loss: 0.6901, test_loss: 0.7451, test_f1: 0.6224
 epoch: 28, train_loss: 0.6849, test_loss: 0.7606, test_f1: 0.6323
 epoch: 29, train_loss: 0.6748, test_loss: 0.7341, test_f1: 0.6539
 epoch: 30, train_loss: 0.6735, test_loss: 0.7944, test_f1: 0.6565
 epoch: 31, train_loss: 0.6487, test_loss: 0.7563, test_f1: 0.6566
 epoch: 32, train_loss: 0.6538, test_loss: 0.7545, test_f1: 0.6614
 epoch: 33, train_loss: 0.6482, test_loss: 0.7855, test_f1: 0.6544
 epoch: 34, train_loss: 0.6355, test_loss: 0.7584, test_f1: 0.6471
 epoch: 35, train_loss: 0.6463, test_loss: 0.7631, test_f1: 0.6406
 epoch: 36, train_loss: 0.6317, test_loss: 0.7765, test_f1: 0.6630
 epoch: 37, train_loss: 0.6282, test_loss: 0.7927, test_f1: 0.6501
 epoch: 38, train_loss: 0.6192, test_loss: 0.7468, test_f1: 0.6828
 epoch: 39, train_loss: 0.6097, test_loss: 0.7797, test_f1: 0.6515
 epoch: 40, train_loss: 0.6038, test_loss: 0.7433, test_f1: 0.6559
 epoch: 41, train_loss: 0.5911, test_loss: 0.7889, test_f1: 0.6803
 epoch: 42, train_loss: 0.6144, test_loss: 0.7733, test_f1: 0.6468
 epoch: 43, train_loss: 0.5943, test_loss: 0.8228, test_f1: 0.6626
 epoch: 44, train_loss: 0.5867, test_loss: 0.8112, test_f1: 0.6434
 epoch: 45, train_loss: 0.5800, test_loss: 0.7713, test_f1: 0.6794
 epoch: 46, train_loss: 0.5777, test_loss: 0.7588, test_f1: 0.6515
 epoch: 47, train_loss: 0.5673, test_loss: 0.7640, test_f1: 0.6676
 epoch: 48, train_loss: 0.5596, test_loss: 0.7820, test_f1: 0.7006
 epoch: 49, train_loss: 0.5527, test_loss: 0.8199, test_f1: 0.6648
 epoch: 50, train_loss: 0.5574, test_loss: 0.8645, test_f1: 0.6429
 epoch: 51, train_loss: 0.5344, test_loss: 0.7976, test_f1: 0.6659
 epoch: 52, train_loss: 0.5328, test_loss: 0.8196, test_f1: 0.6619
 epoch: 53, train_loss: 0.5181, test_loss: 0.8476, test_f1: 0.6771
 epoch: 54, train_loss: 0.5060, test_loss: 0.8423, test_f1: 0.6408
 epoch: 55, train_loss: 0.5095, test_loss: 0.8357, test_f1: 0.6641
 epoch: 56, train_loss: 0.5000, test_loss: 0.8598, test_f1: 0.6498
 epoch: 57, train_loss: 0.5036, test_loss: 0.8107, test_f1: 0.6568
 epoch: 58, train_loss: 0.4943, test_loss: 0.8369, test_f1: 0.6563
 epoch: 59, train_loss: 0.4877, test_loss: 0.8428, test_f1: 0.6700
 epoch: 60, train_loss: 0.4797, test_loss: 0.8504, test_f1: 0.6481
 epoch: 61, train_loss: 0.4635, test_loss: 0.8648, test_f1: 0.6502
 epoch: 62, train_loss: 0.4824, test_loss: 0.8530, test_f1: 0.6539
 epoch: 63, train_loss: 0.4803, test_loss: 0.8918, test_f1: 0.6454
 epoch: 64, train_loss: 0.4644, test_loss: 0.8835, test_f1: 0.6420
 epoch: 65, train_loss: 0.4762, test_loss: 0.9068, test_f1: 0.6198
 epoch: 66, train_loss: 0.4720, test_loss: 0.9351, test_f1: 0.6425
 epoch: 67, train_loss: 0.4687, test_loss: 0.8959, test_f1: 0.6614
 epoch: 68, train_loss: 0.4627, test_loss: 0.8861, test_f1: 0.6576
 epoch: 69, train_loss: 0.4784, test_loss: 0.9183, test_f1: 0.6505
 epoch: 70, train_loss: 0.4517, test_loss: 0.8936, test_f1: 0.6622
 epoch: 71, train_loss: 0.4467, test_loss: 0.8905, test_f1: 0.6684
 epoch: 72, train_loss: 0.4501, test_loss: 0.9399, test_f1: 0.6461
 epoch: 73, train_loss: 0.4647, test_loss: 0.8913, test_f1: 0.6587
 epoch: 74, train_loss: 0.4537, test_loss: 0.8980, test_f1: 0.6776
 epoch: 75, train_loss: 0.4395, test_loss: 0.9143, test_f1: 0.6820
 epoch: 76, train_loss: 0.4494, test_loss: 0.9249, test_f1: 0.6595
 epoch: 77, train_loss: 0.4460, test_loss: 0.9071, test_f1: 0.6757
 epoch: 78, train_loss: 0.4344, test_loss: 0.9447, test_f1: 0.6685
 epoch: 79, train_loss: 0.4437, test_loss: 0.9730, test_f1: 0.6565
 epoch: 80, train_loss: 0.4275, test_loss: 0.9400, test_f1: 0.6757
 epoch: 81, train_loss: 0.4335, test_loss: 0.9526, test_f1: 0.6848
 epoch: 82, train_loss: 0.4221, test_loss: 0.9857, test_f1: 0.6671
 epoch: 83, train_loss: 0.4297, test_loss: 0.9594, test_f1: 0.6688
 epoch: 84, train_loss: 0.4215, test_loss: 1.0265, test_f1: 0.6584
 epoch: 85, train_loss: 0.4013, test_loss: 1.0052, test_f1: 0.6719
 epoch: 86, train_loss: 0.4110, test_loss: 1.0266, test_f1: 0.6630
 epoch: 87, train_loss: 0.4124, test_loss: 1.0062, test_f1: 0.6595
 epoch: 88, train_loss: 0.4129, test_loss: 1.0305, test_f1: 0.6313
 epoch: 89, train_loss: 0.4153, test_loss: 1.0147, test_f1: 0.6563
 epoch: 90, train_loss: 0.3999, test_loss: 0.9711, test_f1: 0.6684
 epoch: 91, train_loss: 0.4048, test_loss: 1.0654, test_f1: 0.6640
 epoch: 92, train_loss: 0.4104, test_loss: 1.0514, test_f1: 0.6772
 epoch: 93, train_loss: 0.3962, test_loss: 1.0859, test_f1: 0.6514
 epoch: 94, train_loss: 0.3900, test_loss: 1.0306, test_f1: 0.6785
 epoch: 95, train_loss: 0.3870, test_loss: 1.1247, test_f1: 0.6668
 epoch: 96, train_loss: 0.3904, test_loss: 1.1190, test_f1: 0.6599
 epoch: 97, train_loss: 0.3884, test_loss: 1.1106, test_f1: 0.6496
 epoch: 98, train_loss: 0.3968, test_loss: 1.1276, test_f1: 0.6669
 epoch: 99, train_loss: 0.3668, test_loss: 1.1599, test_f1: 0.6504
##################ITERATION #7 ****************************************
 epoch: 0, train_loss: 1.1625, test_loss: 0.9678, test_f1: 0.4884
 epoch: 1, train_loss: 1.0298, test_loss: 0.9362, test_f1: 0.5215
 epoch: 2, train_loss: 0.9740, test_loss: 0.9133, test_f1: 0.4899
 epoch: 3, train_loss: 0.9423, test_loss: 0.8740, test_f1: 0.5712
 epoch: 4, train_loss: 0.9112, test_loss: 0.8621, test_f1: 0.5313
 epoch: 5, train_loss: 0.9041, test_loss: 0.8792, test_f1: 0.5553
 epoch: 6, train_loss: 0.8966, test_loss: 0.8447, test_f1: 0.5541
 epoch: 7, train_loss: 0.8650, test_loss: 0.8385, test_f1: 0.5466
 epoch: 8, train_loss: 0.8602, test_loss: 0.8360, test_f1: 0.5808
 epoch: 9, train_loss: 0.8464, test_loss: 0.8473, test_f1: 0.5513
 epoch: 10, train_loss: 0.8307, test_loss: 0.8347, test_f1: 0.5672
 epoch: 11, train_loss: 0.8205, test_loss: 0.8207, test_f1: 0.5656
 epoch: 12, train_loss: 0.8044, test_loss: 0.8220, test_f1: 0.5847
 epoch: 13, train_loss: 0.7890, test_loss: 0.8043, test_f1: 0.5829
 epoch: 14, train_loss: 0.7848, test_loss: 0.7843, test_f1: 0.6207
 epoch: 15, train_loss: 0.7689, test_loss: 0.8121, test_f1: 0.6087
 epoch: 16, train_loss: 0.7723, test_loss: 0.7946, test_f1: 0.6071
 epoch: 17, train_loss: 0.7591, test_loss: 0.8031, test_f1: 0.6057
 epoch: 18, train_loss: 0.7421, test_loss: 0.7501, test_f1: 0.6139
 epoch: 19, train_loss: 0.7357, test_loss: 0.7726, test_f1: 0.6136
 epoch: 20, train_loss: 0.7285, test_loss: 0.7503, test_f1: 0.6421
 epoch: 21, train_loss: 0.7147, test_loss: 0.7760, test_f1: 0.5905
 epoch: 22, train_loss: 0.7250, test_loss: 0.7654, test_f1: 0.6158
 epoch: 23, train_loss: 0.7059, test_loss: 0.7857, test_f1: 0.5895
 epoch: 24, train_loss: 0.6794, test_loss: 0.7619, test_f1: 0.6120
 epoch: 25, train_loss: 0.6852, test_loss: 0.7589, test_f1: 0.6476
 epoch: 26, train_loss: 0.6816, test_loss: 0.7356, test_f1: 0.6488
 epoch: 27, train_loss: 0.6677, test_loss: 0.7305, test_f1: 0.6530
 epoch: 28, train_loss: 0.6591, test_loss: 0.8073, test_f1: 0.6396
 epoch: 29, train_loss: 0.6642, test_loss: 0.7877, test_f1: 0.6332
 epoch: 30, train_loss: 0.6542, test_loss: 0.8597, test_f1: 0.6467
 epoch: 31, train_loss: 0.6466, test_loss: 0.8058, test_f1: 0.6667
 epoch: 32, train_loss: 0.6325, test_loss: 0.7739, test_f1: 0.6407
 epoch: 33, train_loss: 0.6325, test_loss: 0.8159, test_f1: 0.6391
 epoch: 34, train_loss: 0.6215, test_loss: 0.7868, test_f1: 0.6352
 epoch: 35, train_loss: 0.6209, test_loss: 0.7923, test_f1: 0.6585
 epoch: 36, train_loss: 0.6186, test_loss: 0.7826, test_f1: 0.6426
 epoch: 37, train_loss: 0.6038, test_loss: 0.8227, test_f1: 0.6308
 epoch: 38, train_loss: 0.6018, test_loss: 0.7886, test_f1: 0.6449
 epoch: 39, train_loss: 0.5976, test_loss: 0.8635, test_f1: 0.6371
 epoch: 40, train_loss: 0.5853, test_loss: 0.9595, test_f1: 0.6432
 epoch: 41, train_loss: 0.5842, test_loss: 0.9977, test_f1: 0.6536
 epoch: 42, train_loss: 0.5734, test_loss: 0.9388, test_f1: 0.6340
 epoch: 43, train_loss: 0.5923, test_loss: 0.9268, test_f1: 0.6466
 epoch: 44, train_loss: 0.5591, test_loss: 0.8821, test_f1: 0.6417
 epoch: 45, train_loss: 0.5534, test_loss: 0.8874, test_f1: 0.6515
 epoch: 46, train_loss: 0.5426, test_loss: 0.8958, test_f1: 0.6451
 epoch: 47, train_loss: 0.5577, test_loss: 0.9509, test_f1: 0.6534
 epoch: 48, train_loss: 0.5479, test_loss: 0.9936, test_f1: 0.6371
 epoch: 49, train_loss: 0.5362, test_loss: 0.9730, test_f1: 0.6449
 epoch: 50, train_loss: 0.5500, test_loss: 0.9490, test_f1: 0.6714
 epoch: 51, train_loss: 0.5169, test_loss: 0.9354, test_f1: 0.6489
 epoch: 52, train_loss: 0.4899, test_loss: 0.9560, test_f1: 0.6622
 epoch: 53, train_loss: 0.4876, test_loss: 1.0150, test_f1: 0.6559
 epoch: 54, train_loss: 0.5046, test_loss: 0.9496, test_f1: 0.6616
 epoch: 55, train_loss: 0.4944, test_loss: 1.0583, test_f1: 0.6364
 epoch: 56, train_loss: 0.4933, test_loss: 0.9978, test_f1: 0.6330
 epoch: 57, train_loss: 0.4769, test_loss: 1.0465, test_f1: 0.6550
 epoch: 58, train_loss: 0.4770, test_loss: 1.0684, test_f1: 0.6508
 epoch: 59, train_loss: 0.4760, test_loss: 1.0238, test_f1: 0.6565
 epoch: 60, train_loss: 0.4751, test_loss: 0.9400, test_f1: 0.6516
 epoch: 61, train_loss: 0.4561, test_loss: 1.0013, test_f1: 0.6454
 epoch: 62, train_loss: 0.4541, test_loss: 1.0759, test_f1: 0.6336
 epoch: 63, train_loss: 0.4682, test_loss: 1.0578, test_f1: 0.6652
 epoch: 64, train_loss: 0.4456, test_loss: 1.0532, test_f1: 0.6267
 epoch: 65, train_loss: 0.4595, test_loss: 1.1360, test_f1: 0.6421
 epoch: 66, train_loss: 0.4535, test_loss: 1.0940, test_f1: 0.6441
 epoch: 67, train_loss: 0.4527, test_loss: 1.0595, test_f1: 0.6570
 epoch: 68, train_loss: 0.4411, test_loss: 1.1596, test_f1: 0.6395
 epoch: 69, train_loss: 0.4453, test_loss: 1.0697, test_f1: 0.6450
 epoch: 70, train_loss: 0.4438, test_loss: 1.0826, test_f1: 0.6526
 epoch: 71, train_loss: 0.4243, test_loss: 1.1247, test_f1: 0.6544
 epoch: 72, train_loss: 0.4442, test_loss: 1.1679, test_f1: 0.6521
 epoch: 73, train_loss: 0.4251, test_loss: 1.0674, test_f1: 0.6659
 epoch: 74, train_loss: 0.4296, test_loss: 1.1312, test_f1: 0.6412
 epoch: 75, train_loss: 0.4261, test_loss: 1.0495, test_f1: 0.6858
 epoch: 76, train_loss: 0.4177, test_loss: 1.1599, test_f1: 0.6638
 epoch: 77, train_loss: 0.4089, test_loss: 1.1385, test_f1: 0.6693
 epoch: 78, train_loss: 0.4136, test_loss: 1.2296, test_f1: 0.6520
 epoch: 79, train_loss: 0.4006, test_loss: 1.2845, test_f1: 0.6500
 epoch: 80, train_loss: 0.4077, test_loss: 1.2206, test_f1: 0.6516
 epoch: 81, train_loss: 0.4098, test_loss: 1.2096, test_f1: 0.6649
 epoch: 82, train_loss: 0.4001, test_loss: 1.2611, test_f1: 0.6600
 epoch: 83, train_loss: 0.4029, test_loss: 1.2382, test_f1: 0.6812
 epoch: 84, train_loss: 0.4089, test_loss: 1.2305, test_f1: 0.6673
 epoch: 85, train_loss: 0.4008, test_loss: 1.2048, test_f1: 0.6632
 epoch: 86, train_loss: 0.3917, test_loss: 1.2832, test_f1: 0.6856
 epoch: 87, train_loss: 0.3991, test_loss: 1.3458, test_f1: 0.6474
 epoch: 88, train_loss: 0.3888, test_loss: 1.1975, test_f1: 0.6762
 epoch: 89, train_loss: 0.3915, test_loss: 1.3053, test_f1: 0.6533
 epoch: 90, train_loss: 0.3909, test_loss: 1.2276, test_f1: 0.6674
 epoch: 91, train_loss: 0.3742, test_loss: 1.3466, test_f1: 0.6509
 epoch: 92, train_loss: 0.3887, test_loss: 1.3146, test_f1: 0.6669
 epoch: 93, train_loss: 0.3656, test_loss: 1.3384, test_f1: 0.6463
 epoch: 94, train_loss: 0.3855, test_loss: 1.2921, test_f1: 0.6677
 epoch: 95, train_loss: 0.3802, test_loss: 1.3101, test_f1: 0.6684
 epoch: 96, train_loss: 0.3815, test_loss: 1.4076, test_f1: 0.6648
 epoch: 97, train_loss: 0.3727, test_loss: 1.4484, test_f1: 0.6471
 epoch: 98, train_loss: 0.3687, test_loss: 1.3507, test_f1: 0.6578
 epoch: 99, train_loss: 0.3531, test_loss: 1.4026, test_f1: 0.6742
##################ITERATION #8 ****************************************
 epoch: 0, train_loss: 1.2144, test_loss: 0.9908, test_f1: 0.4978
 epoch: 1, train_loss: 1.0538, test_loss: 0.9635, test_f1: 0.5024
 epoch: 2, train_loss: 1.0022, test_loss: 0.9196, test_f1: 0.5038
 epoch: 3, train_loss: 0.9637, test_loss: 0.8960, test_f1: 0.5268
 epoch: 4, train_loss: 0.9553, test_loss: 0.8749, test_f1: 0.5055
 epoch: 5, train_loss: 0.9239, test_loss: 0.8648, test_f1: 0.5515
 epoch: 6, train_loss: 0.9092, test_loss: 0.8883, test_f1: 0.5304
 epoch: 7, train_loss: 0.8911, test_loss: 0.8423, test_f1: 0.5676
 epoch: 8, train_loss: 0.8868, test_loss: 0.8141, test_f1: 0.5799
 epoch: 9, train_loss: 0.8701, test_loss: 0.8383, test_f1: 0.5737
 epoch: 10, train_loss: 0.8542, test_loss: 0.8271, test_f1: 0.5698
 epoch: 11, train_loss: 0.8305, test_loss: 0.8022, test_f1: 0.5654
 epoch: 12, train_loss: 0.8282, test_loss: 0.7946, test_f1: 0.5732
 epoch: 13, train_loss: 0.8122, test_loss: 0.8084, test_f1: 0.5828
 epoch: 14, train_loss: 0.8063, test_loss: 0.7828, test_f1: 0.5881
 epoch: 15, train_loss: 0.7925, test_loss: 0.7845, test_f1: 0.6214
 epoch: 16, train_loss: 0.7743, test_loss: 0.7925, test_f1: 0.6165
 epoch: 17, train_loss: 0.7908, test_loss: 0.7734, test_f1: 0.6116
 epoch: 18, train_loss: 0.7609, test_loss: 0.7716, test_f1: 0.6207
 epoch: 19, train_loss: 0.7664, test_loss: 0.7638, test_f1: 0.6294
 epoch: 20, train_loss: 0.7550, test_loss: 0.7751, test_f1: 0.5885
 epoch: 21, train_loss: 0.7465, test_loss: 0.7586, test_f1: 0.6327
 epoch: 22, train_loss: 0.7304, test_loss: 0.7566, test_f1: 0.6251
 epoch: 23, train_loss: 0.7307, test_loss: 0.7439, test_f1: 0.6536
 epoch: 24, train_loss: 0.7363, test_loss: 0.7251, test_f1: 0.6485
 epoch: 25, train_loss: 0.7216, test_loss: 0.7414, test_f1: 0.6159
 epoch: 26, train_loss: 0.6902, test_loss: 0.7456, test_f1: 0.6552
 epoch: 27, train_loss: 0.7094, test_loss: 0.7432, test_f1: 0.6264
 epoch: 28, train_loss: 0.6973, test_loss: 0.7530, test_f1: 0.6532
 epoch: 29, train_loss: 0.6883, test_loss: 0.7476, test_f1: 0.6249
 epoch: 30, train_loss: 0.6809, test_loss: 0.7320, test_f1: 0.6463
 epoch: 31, train_loss: 0.6786, test_loss: 0.7058, test_f1: 0.6503
 epoch: 32, train_loss: 0.6681, test_loss: 0.7208, test_f1: 0.6755
 epoch: 33, train_loss: 0.6590, test_loss: 0.7408, test_f1: 0.6562
 epoch: 34, train_loss: 0.6484, test_loss: 0.7200, test_f1: 0.6708
 epoch: 35, train_loss: 0.6282, test_loss: 0.7800, test_f1: 0.6502
 epoch: 36, train_loss: 0.6298, test_loss: 0.7359, test_f1: 0.6598
 epoch: 37, train_loss: 0.6429, test_loss: 0.7333, test_f1: 0.6647
 epoch: 38, train_loss: 0.6348, test_loss: 0.7134, test_f1: 0.6385
 epoch: 39, train_loss: 0.6122, test_loss: 0.7291, test_f1: 0.6455
 epoch: 40, train_loss: 0.6237, test_loss: 0.7208, test_f1: 0.6869
 epoch: 41, train_loss: 0.5917, test_loss: 0.7329, test_f1: 0.6460
 epoch: 42, train_loss: 0.5946, test_loss: 0.7766, test_f1: 0.6338
 epoch: 43, train_loss: 0.5879, test_loss: 0.7879, test_f1: 0.6409
 epoch: 44, train_loss: 0.5955, test_loss: 0.8120, test_f1: 0.6358
 epoch: 45, train_loss: 0.5948, test_loss: 0.7626, test_f1: 0.6453
 epoch: 46, train_loss: 0.5827, test_loss: 0.7420, test_f1: 0.6886
 epoch: 47, train_loss: 0.5729, test_loss: 0.7961, test_f1: 0.6432
 epoch: 48, train_loss: 0.5814, test_loss: 0.7773, test_f1: 0.6450
 epoch: 49, train_loss: 0.5678, test_loss: 0.7476, test_f1: 0.6572
 epoch: 50, train_loss: 0.5516, test_loss: 0.7673, test_f1: 0.6827
 epoch: 51, train_loss: 0.5346, test_loss: 0.7866, test_f1: 0.6547
 epoch: 52, train_loss: 0.5326, test_loss: 0.7512, test_f1: 0.6657
 epoch: 53, train_loss: 0.5336, test_loss: 0.8201, test_f1: 0.6537
 epoch: 54, train_loss: 0.5140, test_loss: 0.8212, test_f1: 0.6379
 epoch: 55, train_loss: 0.5187, test_loss: 0.8334, test_f1: 0.6328
 epoch: 56, train_loss: 0.5120, test_loss: 0.8273, test_f1: 0.6376
 epoch: 57, train_loss: 0.5049, test_loss: 0.7711, test_f1: 0.6581
 epoch: 58, train_loss: 0.5028, test_loss: 0.7873, test_f1: 0.6621
 epoch: 59, train_loss: 0.5047, test_loss: 0.8054, test_f1: 0.6697
 epoch: 60, train_loss: 0.5059, test_loss: 0.8361, test_f1: 0.6373
 epoch: 61, train_loss: 0.5008, test_loss: 0.8274, test_f1: 0.6358
 epoch: 62, train_loss: 0.4845, test_loss: 0.8986, test_f1: 0.6276
 epoch: 63, train_loss: 0.4880, test_loss: 0.8276, test_f1: 0.6465
 epoch: 64, train_loss: 0.4795, test_loss: 0.8392, test_f1: 0.6641
 epoch: 65, train_loss: 0.4892, test_loss: 0.8514, test_f1: 0.6466
 epoch: 66, train_loss: 0.4881, test_loss: 0.8220, test_f1: 0.6589
 epoch: 67, train_loss: 0.4736, test_loss: 0.8707, test_f1: 0.6322
 epoch: 68, train_loss: 0.4729, test_loss: 0.8022, test_f1: 0.6577
 epoch: 69, train_loss: 0.4712, test_loss: 0.8713, test_f1: 0.6385
 epoch: 70, train_loss: 0.4733, test_loss: 0.8584, test_f1: 0.6468
 epoch: 71, train_loss: 0.4560, test_loss: 0.8783, test_f1: 0.6482
 epoch: 72, train_loss: 0.4548, test_loss: 0.8739, test_f1: 0.6528
 epoch: 73, train_loss: 0.4594, test_loss: 0.8896, test_f1: 0.6393
 epoch: 74, train_loss: 0.4433, test_loss: 0.9484, test_f1: 0.6438
 epoch: 75, train_loss: 0.4446, test_loss: 0.8635, test_f1: 0.6581
 epoch: 76, train_loss: 0.4376, test_loss: 0.8701, test_f1: 0.6480
 epoch: 77, train_loss: 0.4638, test_loss: 0.9391, test_f1: 0.6378
 epoch: 78, train_loss: 0.4382, test_loss: 0.9422, test_f1: 0.6378
 epoch: 79, train_loss: 0.4380, test_loss: 0.8831, test_f1: 0.6723
 epoch: 80, train_loss: 0.4288, test_loss: 0.8857, test_f1: 0.6727
 epoch: 81, train_loss: 0.4373, test_loss: 0.8243, test_f1: 0.6633
 epoch: 82, train_loss: 0.4288, test_loss: 0.9131, test_f1: 0.6476
 epoch: 83, train_loss: 0.4474, test_loss: 0.9084, test_f1: 0.6540
 epoch: 84, train_loss: 0.4361, test_loss: 0.9432, test_f1: 0.6538
 epoch: 85, train_loss: 0.4272, test_loss: 0.9738, test_f1: 0.6425
 epoch: 86, train_loss: 0.4211, test_loss: 0.9885, test_f1: 0.6550
 epoch: 87, train_loss: 0.4191, test_loss: 1.0233, test_f1: 0.6515
 epoch: 88, train_loss: 0.4239, test_loss: 0.9645, test_f1: 0.6616
 epoch: 89, train_loss: 0.4247, test_loss: 0.9476, test_f1: 0.6617
 epoch: 90, train_loss: 0.4145, test_loss: 0.9695, test_f1: 0.6681
 epoch: 91, train_loss: 0.4025, test_loss: 1.0517, test_f1: 0.6599
 epoch: 92, train_loss: 0.4128, test_loss: 1.0342, test_f1: 0.6670
 epoch: 93, train_loss: 0.4123, test_loss: 0.9928, test_f1: 0.6517
 epoch: 94, train_loss: 0.3976, test_loss: 1.0477, test_f1: 0.6671
 epoch: 95, train_loss: 0.4129, test_loss: 1.0479, test_f1: 0.6492
 epoch: 96, train_loss: 0.3994, test_loss: 1.0649, test_f1: 0.6521
 epoch: 97, train_loss: 0.3972, test_loss: 1.0089, test_f1: 0.6681
 epoch: 98, train_loss: 0.3869, test_loss: 1.2201, test_f1: 0.6402
 epoch: 99, train_loss: 0.3801, test_loss: 1.0415, test_f1: 0.6567
##################ITERATION #9 ****************************************
 epoch: 0, train_loss: 1.2563, test_loss: 0.9902, test_f1: 0.4850
 epoch: 1, train_loss: 1.0544, test_loss: 0.9928, test_f1: 0.5057
 epoch: 2, train_loss: 0.9972, test_loss: 0.9957, test_f1: 0.5203
 epoch: 3, train_loss: 0.9581, test_loss: 0.9509, test_f1: 0.5466
 epoch: 4, train_loss: 0.9307, test_loss: 0.9339, test_f1: 0.5405
 epoch: 5, train_loss: 0.9128, test_loss: 0.9290, test_f1: 0.5118
 epoch: 6, train_loss: 0.9090, test_loss: 0.8797, test_f1: 0.5450
 epoch: 7, train_loss: 0.9057, test_loss: 0.9157, test_f1: 0.5329
 epoch: 8, train_loss: 0.8761, test_loss: 0.9275, test_f1: 0.5272
 epoch: 9, train_loss: 0.8650, test_loss: 0.8859, test_f1: 0.5962
 epoch: 10, train_loss: 0.8472, test_loss: 0.8760, test_f1: 0.5832
 epoch: 11, train_loss: 0.8434, test_loss: 0.8779, test_f1: 0.5701
 epoch: 12, train_loss: 0.8222, test_loss: 0.8736, test_f1: 0.6128
 epoch: 13, train_loss: 0.8030, test_loss: 0.8854, test_f1: 0.5890
 epoch: 14, train_loss: 0.7887, test_loss: 0.8482, test_f1: 0.5798
 epoch: 15, train_loss: 0.7986, test_loss: 0.8386, test_f1: 0.6451
 epoch: 16, train_loss: 0.7921, test_loss: 0.8218, test_f1: 0.5882
 epoch: 17, train_loss: 0.7676, test_loss: 0.8377, test_f1: 0.6261
 epoch: 18, train_loss: 0.7569, test_loss: 0.8237, test_f1: 0.6128
 epoch: 19, train_loss: 0.7428, test_loss: 0.7900, test_f1: 0.6306
 epoch: 20, train_loss: 0.7464, test_loss: 0.8220, test_f1: 0.6297
 epoch: 21, train_loss: 0.7180, test_loss: 0.7744, test_f1: 0.6253
 epoch: 22, train_loss: 0.7225, test_loss: 0.8359, test_f1: 0.6531
 epoch: 23, train_loss: 0.7237, test_loss: 0.8273, test_f1: 0.6422
 epoch: 24, train_loss: 0.7081, test_loss: 0.8341, test_f1: 0.6215
 epoch: 25, train_loss: 0.7042, test_loss: 0.8370, test_f1: 0.6348
 epoch: 26, train_loss: 0.6984, test_loss: 0.8203, test_f1: 0.6561
 epoch: 27, train_loss: 0.6861, test_loss: 0.8385, test_f1: 0.6491
 epoch: 28, train_loss: 0.6722, test_loss: 0.8187, test_f1: 0.6626
 epoch: 29, train_loss: 0.6592, test_loss: 0.8503, test_f1: 0.6493
 epoch: 30, train_loss: 0.6701, test_loss: 0.7545, test_f1: 0.6449
 epoch: 31, train_loss: 0.6692, test_loss: 0.8691, test_f1: 0.6395
 epoch: 32, train_loss: 0.6588, test_loss: 0.8512, test_f1: 0.6380
 epoch: 33, train_loss: 0.6375, test_loss: 0.8569, test_f1: 0.6362
 epoch: 34, train_loss: 0.6350, test_loss: 0.8383, test_f1: 0.6637
 epoch: 35, train_loss: 0.6352, test_loss: 0.8011, test_f1: 0.6446
 epoch: 36, train_loss: 0.6271, test_loss: 0.8568, test_f1: 0.6507
 epoch: 37, train_loss: 0.6288, test_loss: 0.8338, test_f1: 0.6644
 epoch: 38, train_loss: 0.6195, test_loss: 0.7810, test_f1: 0.6319
 epoch: 39, train_loss: 0.6112, test_loss: 0.8612, test_f1: 0.6469
 epoch: 40, train_loss: 0.5984, test_loss: 0.8318, test_f1: 0.6322
 epoch: 41, train_loss: 0.6113, test_loss: 0.8619, test_f1: 0.6475
 epoch: 42, train_loss: 0.6029, test_loss: 0.8489, test_f1: 0.6642
 epoch: 43, train_loss: 0.5919, test_loss: 0.8249, test_f1: 0.6701
 epoch: 44, train_loss: 0.5789, test_loss: 0.8832, test_f1: 0.6793
 epoch: 45, train_loss: 0.5744, test_loss: 0.8710, test_f1: 0.6524
 epoch: 46, train_loss: 0.5637, test_loss: 0.9219, test_f1: 0.6644
 epoch: 47, train_loss: 0.5675, test_loss: 0.8015, test_f1: 0.6600
 epoch: 48, train_loss: 0.5637, test_loss: 0.8528, test_f1: 0.6438
 epoch: 49, train_loss: 0.5588, test_loss: 0.9037, test_f1: 0.6308
 epoch: 50, train_loss: 0.5434, test_loss: 0.9680, test_f1: 0.6301
 epoch: 51, train_loss: 0.5252, test_loss: 0.9103, test_f1: 0.6429
 epoch: 52, train_loss: 0.5183, test_loss: 0.9138, test_f1: 0.6593
 epoch: 53, train_loss: 0.5122, test_loss: 0.9362, test_f1: 0.6443
 epoch: 54, train_loss: 0.5137, test_loss: 0.9232, test_f1: 0.6410
 epoch: 55, train_loss: 0.5075, test_loss: 0.9562, test_f1: 0.6631
 epoch: 56, train_loss: 0.5085, test_loss: 0.9003, test_f1: 0.6427
 epoch: 57, train_loss: 0.4720, test_loss: 0.9258, test_f1: 0.6535
 epoch: 58, train_loss: 0.4794, test_loss: 0.9650, test_f1: 0.6353
 epoch: 59, train_loss: 0.4782, test_loss: 0.9747, test_f1: 0.6497
 epoch: 60, train_loss: 0.5019, test_loss: 1.0151, test_f1: 0.6455
 epoch: 61, train_loss: 0.4708, test_loss: 1.0013, test_f1: 0.6578
 epoch: 62, train_loss: 0.4752, test_loss: 1.0168, test_f1: 0.6573
 epoch: 63, train_loss: 0.4717, test_loss: 0.9377, test_f1: 0.6464
 epoch: 64, train_loss: 0.4592, test_loss: 0.9948, test_f1: 0.6441
 epoch: 65, train_loss: 0.4641, test_loss: 1.0081, test_f1: 0.6340
 epoch: 66, train_loss: 0.4622, test_loss: 0.9458, test_f1: 0.6482
 epoch: 67, train_loss: 0.4801, test_loss: 0.9655, test_f1: 0.6521
 epoch: 68, train_loss: 0.4573, test_loss: 1.0201, test_f1: 0.6443
 epoch: 69, train_loss: 0.4571, test_loss: 1.0009, test_f1: 0.6481
 epoch: 70, train_loss: 0.4615, test_loss: 1.0555, test_f1: 0.6462
 epoch: 71, train_loss: 0.4525, test_loss: 1.0808, test_f1: 0.6587
 epoch: 72, train_loss: 0.4419, test_loss: 1.0361, test_f1: 0.6515
 epoch: 73, train_loss: 0.4461, test_loss: 1.0531, test_f1: 0.6584
 epoch: 74, train_loss: 0.4419, test_loss: 0.9814, test_f1: 0.6688
 epoch: 75, train_loss: 0.4275, test_loss: 0.9423, test_f1: 0.6566
 epoch: 76, train_loss: 0.4334, test_loss: 1.1104, test_f1: 0.6497
 epoch: 77, train_loss: 0.4205, test_loss: 1.1152, test_f1: 0.6391
 epoch: 78, train_loss: 0.4292, test_loss: 1.1563, test_f1: 0.6424
 epoch: 79, train_loss: 0.4215, test_loss: 1.1201, test_f1: 0.6464
 epoch: 80, train_loss: 0.4442, test_loss: 1.1178, test_f1: 0.6647
 epoch: 81, train_loss: 0.4194, test_loss: 1.0806, test_f1: 0.6394
 epoch: 82, train_loss: 0.4298, test_loss: 1.1394, test_f1: 0.6610
 epoch: 83, train_loss: 0.4103, test_loss: 1.0773, test_f1: 0.6561
 epoch: 84, train_loss: 0.4225, test_loss: 1.1260, test_f1: 0.6393
 epoch: 85, train_loss: 0.4134, test_loss: 1.1950, test_f1: 0.6515
 epoch: 86, train_loss: 0.4155, test_loss: 1.1832, test_f1: 0.6312
 epoch: 87, train_loss: 0.3998, test_loss: 1.1411, test_f1: 0.6396
 epoch: 88, train_loss: 0.4064, test_loss: 1.1532, test_f1: 0.6701
 epoch: 89, train_loss: 0.3964, test_loss: 1.1235, test_f1: 0.6562
 epoch: 90, train_loss: 0.3928, test_loss: 1.1747, test_f1: 0.6575
 epoch: 91, train_loss: 0.3943, test_loss: 1.1810, test_f1: 0.6524
 epoch: 92, train_loss: 0.3958, test_loss: 1.1393, test_f1: 0.6579
 epoch: 93, train_loss: 0.3850, test_loss: 1.2293, test_f1: 0.6709
 epoch: 94, train_loss: 0.4000, test_loss: 1.2439, test_f1: 0.6723
 epoch: 95, train_loss: 0.3845, test_loss: 1.1780, test_f1: 0.6665
 epoch: 96, train_loss: 0.3762, test_loss: 1.2891, test_f1: 0.6396
 epoch: 97, train_loss: 0.3852, test_loss: 1.2128, test_f1: 0.6655
 epoch: 98, train_loss: 0.3811, test_loss: 1.1966, test_f1: 0.6364
 epoch: 99, train_loss: 0.3762, test_loss: 1.2559, test_f1: 0.6701

Training completed in 1194.35 seconds
Best F1: 0.7006 at epoch 48
Mean F1 across iterations: 0.6814  0.0111
========================FINAL RESULTS================================
FEGIN weighted F1: 0.7006  0.0111
python main.py --data ltspice_examples --representation component_pin_net --model FEGIN --layers 4 --hiddens 128 --batch_size 32 --lr 0.0001 --emb_size 512 --epochs 100 --save_appendix component_pin_net_L4_H128_BS32_LR0.0001_E512 --no_val
-----



STDERR:
  File "main.py", line 370, in <module>
    main()
  File "main.py", line 254, in main
    dataset = dataset_class(
  File "/home/philip/projects/ltspice_examples_code_repo/Circuit-Completion-Using-GNNs/component_classification_with_link_prediction_head/evaluation/FEGIN/kernel/circuit_datasets.py", line 15, in __init__
    self.data, self.slices = torch.load(self.processed_paths[0])
  File "/home/philip/.local/lib/python3.8/site-packages/torch/serialization.py", line 1040, in load
    warnings.warn(
  File "/usr/lib/python3.8/warnings.py", line 109, in _showwarnmsg
    sw(msg.message, msg.category, msg.filename, msg.lineno,
  File "main.py", line 47, in warn_with_traceback
    traceback.print_stack(file=log)
/home/philip/projects/ltspice_examples_code_repo/Circuit-Completion-Using-GNNs/component_classification_with_link_prediction_head/evaluation/FEGIN/kernel/circuit_datasets.py:15: FutureWarning: You are using `torch.load` with `weights_only=False` (the current default value), which uses the default pickle module implicitly. It is possible to construct malicious pickle data which will execute arbitrary code during unpickling (See https://github.com/pytorch/pytorch/blob/main/SECURITY.md#untrusted-models for more details). In a future release, the default value for `weights_only` will be flipped to `True`. This limits the functions that could be executed during unpickling. Arbitrary objects will no longer be allowed to be loaded via this mode unless they are explicitly allowlisted by the user via `torch.serialization.add_safe_globals`. We recommend you start setting `weights_only=True` for any use case where you don't have full control of the loaded file. Please open an issue on GitHub for any issues related to this experimental feature.
  self.data, self.slices = torch.load(self.processed_paths[0])
