STDOUT:
Results will be saved in /home/philip/projects/ltspice_examples_code_repo/Circuit-Completion-Using-GNNs/component_classification_with_link_prediction_head/evaluation/FEGIN/results/model_FEGIN_dataset_ltspice_examples
Command line input: python main.py --data ltspice_examples --representation component_component --model FEGIN --layers 5 --hiddens 32 --batch_size 128 --lr 0.0001 --emb_size 512 --epochs 100 --save_appendix component_component_L5_H32_BS128_LR0.0001_E512 --no_val
 is saved.
-----
ltspice_examples - FEGIN
Using 5 layers, 32 hidden units, h = 2
Loading component_component representation dataset
ENTERED
Training FEGIN on component_component representation
Train: 3556, Test: 845
##################ITERATION #0 ****************************************
 epoch: 0, train_loss: 1.3589, test_loss: 1.3622, test_f1: 0.2274
 epoch: 1, train_loss: 1.3520, test_loss: 1.3573, test_f1: 0.2274
 epoch: 2, train_loss: 1.3468, test_loss: 1.3512, test_f1: 0.2274
 epoch: 3, train_loss: 1.3425, test_loss: 1.3463, test_f1: 0.2274
 epoch: 4, train_loss: 1.3387, test_loss: 1.3420, test_f1: 0.2274
 epoch: 5, train_loss: 1.3325, test_loss: 1.3370, test_f1: 0.2274
 epoch: 6, train_loss: 1.3275, test_loss: 1.3318, test_f1: 0.2274
 epoch: 7, train_loss: 1.3216, test_loss: 1.3266, test_f1: 0.2274
 epoch: 8, train_loss: 1.3160, test_loss: 1.3206, test_f1: 0.2274
 epoch: 9, train_loss: 1.3090, test_loss: 1.3156, test_f1: 0.2274
 epoch: 10, train_loss: 1.3042, test_loss: 1.3105, test_f1: 0.2274
 epoch: 11, train_loss: 1.2966, test_loss: 1.3040, test_f1: 0.2274
 epoch: 12, train_loss: 1.2917, test_loss: 1.2982, test_f1: 0.2274
 epoch: 13, train_loss: 1.2869, test_loss: 1.2921, test_f1: 0.2274
 epoch: 14, train_loss: 1.2793, test_loss: 1.2846, test_f1: 0.2274
 epoch: 15, train_loss: 1.2741, test_loss: 1.2789, test_f1: 0.2274
 epoch: 16, train_loss: 1.2691, test_loss: 1.2724, test_f1: 0.2274
 epoch: 17, train_loss: 1.2637, test_loss: 1.2666, test_f1: 0.2274
 epoch: 18, train_loss: 1.2629, test_loss: 1.2608, test_f1: 0.2274
 epoch: 19, train_loss: 1.2546, test_loss: 1.2548, test_f1: 0.2274
 epoch: 20, train_loss: 1.2523, test_loss: 1.2484, test_f1: 0.2274
 epoch: 21, train_loss: 1.2465, test_loss: 1.2444, test_f1: 0.2274
 epoch: 22, train_loss: 1.2411, test_loss: 1.2390, test_f1: 0.2274
 epoch: 23, train_loss: 1.2340, test_loss: 1.2326, test_f1: 0.2274
 epoch: 24, train_loss: 1.2338, test_loss: 1.2279, test_f1: 0.2274
 epoch: 25, train_loss: 1.2300, test_loss: 1.2240, test_f1: 0.2274
 epoch: 26, train_loss: 1.2230, test_loss: 1.2177, test_f1: 0.2274
 epoch: 27, train_loss: 1.2220, test_loss: 1.2128, test_f1: 0.2482
 epoch: 28, train_loss: 1.2173, test_loss: 1.2078, test_f1: 0.2602
 epoch: 29, train_loss: 1.2117, test_loss: 1.2050, test_f1: 0.3095
 epoch: 30, train_loss: 1.2074, test_loss: 1.2006, test_f1: 0.3156
 epoch: 31, train_loss: 1.2068, test_loss: 1.1949, test_f1: 0.3137
 epoch: 32, train_loss: 1.2019, test_loss: 1.1932, test_f1: 0.3208
 epoch: 33, train_loss: 1.2027, test_loss: 1.1924, test_f1: 0.3222
 epoch: 34, train_loss: 1.1990, test_loss: 1.1868, test_f1: 0.3323
 epoch: 35, train_loss: 1.1915, test_loss: 1.1830, test_f1: 0.3418
 epoch: 36, train_loss: 1.1836, test_loss: 1.1788, test_f1: 0.3461
 epoch: 37, train_loss: 1.1839, test_loss: 1.1770, test_f1: 0.3519
 epoch: 38, train_loss: 1.1795, test_loss: 1.1741, test_f1: 0.3529
 epoch: 39, train_loss: 1.1760, test_loss: 1.1719, test_f1: 0.3548
 epoch: 40, train_loss: 1.1680, test_loss: 1.1673, test_f1: 0.3455
 epoch: 41, train_loss: 1.1703, test_loss: 1.1622, test_f1: 0.3496
 epoch: 42, train_loss: 1.1594, test_loss: 1.1582, test_f1: 0.3536
 epoch: 43, train_loss: 1.1614, test_loss: 1.1533, test_f1: 0.3440
 epoch: 44, train_loss: 1.1514, test_loss: 1.1503, test_f1: 0.3478
 epoch: 45, train_loss: 1.1476, test_loss: 1.1459, test_f1: 0.3495
 epoch: 46, train_loss: 1.1449, test_loss: 1.1419, test_f1: 0.3485
 epoch: 47, train_loss: 1.1427, test_loss: 1.1377, test_f1: 0.3517
 epoch: 48, train_loss: 1.1279, test_loss: 1.1349, test_f1: 0.3526
 epoch: 49, train_loss: 1.1280, test_loss: 1.1321, test_f1: 0.3485
 epoch: 50, train_loss: 1.1180, test_loss: 1.1298, test_f1: 0.3426
 epoch: 51, train_loss: 1.1157, test_loss: 1.1279, test_f1: 0.3427
 epoch: 52, train_loss: 1.1153, test_loss: 1.1263, test_f1: 0.3475
 epoch: 53, train_loss: 1.1115, test_loss: 1.1253, test_f1: 0.3500
 epoch: 54, train_loss: 1.1146, test_loss: 1.1257, test_f1: 0.3503
 epoch: 55, train_loss: 1.1095, test_loss: 1.1211, test_f1: 0.3477
 epoch: 56, train_loss: 1.1054, test_loss: 1.1225, test_f1: 0.3453
 epoch: 57, train_loss: 1.1074, test_loss: 1.1184, test_f1: 0.3475
 epoch: 58, train_loss: 1.0988, test_loss: 1.1174, test_f1: 0.3588
 epoch: 59, train_loss: 1.1024, test_loss: 1.1176, test_f1: 0.3790
 epoch: 60, train_loss: 1.1014, test_loss: 1.1153, test_f1: 0.3849
 epoch: 61, train_loss: 1.1017, test_loss: 1.1189, test_f1: 0.3893
 epoch: 62, train_loss: 1.0961, test_loss: 1.1148, test_f1: 0.3921
 epoch: 63, train_loss: 1.0950, test_loss: 1.1177, test_f1: 0.3950
 epoch: 64, train_loss: 1.0918, test_loss: 1.1121, test_f1: 0.3998
 epoch: 65, train_loss: 1.0941, test_loss: 1.1118, test_f1: 0.4079
 epoch: 66, train_loss: 1.0894, test_loss: 1.1093, test_f1: 0.4085
 epoch: 67, train_loss: 1.0860, test_loss: 1.1108, test_f1: 0.4099
 epoch: 68, train_loss: 1.0784, test_loss: 1.1113, test_f1: 0.4118
 epoch: 69, train_loss: 1.0875, test_loss: 1.1095, test_f1: 0.4172
 epoch: 70, train_loss: 1.0849, test_loss: 1.1049, test_f1: 0.4243
 epoch: 71, train_loss: 1.0809, test_loss: 1.1050, test_f1: 0.4213
 epoch: 72, train_loss: 1.0764, test_loss: 1.1052, test_f1: 0.4180
 epoch: 73, train_loss: 1.0741, test_loss: 1.1075, test_f1: 0.4242
 epoch: 74, train_loss: 1.0788, test_loss: 1.1018, test_f1: 0.4212
 epoch: 75, train_loss: 1.0700, test_loss: 1.1031, test_f1: 0.4189
 epoch: 76, train_loss: 1.0794, test_loss: 1.1041, test_f1: 0.4261
 epoch: 77, train_loss: 1.0719, test_loss: 1.1021, test_f1: 0.4300
 epoch: 78, train_loss: 1.0765, test_loss: 1.1007, test_f1: 0.4257
 epoch: 79, train_loss: 1.0651, test_loss: 1.1008, test_f1: 0.4331
 epoch: 80, train_loss: 1.0709, test_loss: 1.0986, test_f1: 0.4339
 epoch: 81, train_loss: 1.0665, test_loss: 1.0997, test_f1: 0.4243
 epoch: 82, train_loss: 1.0599, test_loss: 1.1006, test_f1: 0.4188
 epoch: 83, train_loss: 1.0597, test_loss: 1.1012, test_f1: 0.4290
 epoch: 84, train_loss: 1.0600, test_loss: 1.0975, test_f1: 0.4332
 epoch: 85, train_loss: 1.0595, test_loss: 1.0954, test_f1: 0.4313
 epoch: 86, train_loss: 1.0588, test_loss: 1.0979, test_f1: 0.4299
 epoch: 87, train_loss: 1.0558, test_loss: 1.0895, test_f1: 0.4370
 epoch: 88, train_loss: 1.0606, test_loss: 1.0937, test_f1: 0.4425
 epoch: 89, train_loss: 1.0570, test_loss: 1.0924, test_f1: 0.4354
 epoch: 90, train_loss: 1.0564, test_loss: 1.0972, test_f1: 0.4395
 epoch: 91, train_loss: 1.0585, test_loss: 1.0915, test_f1: 0.4388
 epoch: 92, train_loss: 1.0564, test_loss: 1.0902, test_f1: 0.4496
 epoch: 93, train_loss: 1.0563, test_loss: 1.0902, test_f1: 0.4462
 epoch: 94, train_loss: 1.0523, test_loss: 1.0904, test_f1: 0.4442
 epoch: 95, train_loss: 1.0567, test_loss: 1.0908, test_f1: 0.4412
 epoch: 96, train_loss: 1.0455, test_loss: 1.0941, test_f1: 0.4444
 epoch: 97, train_loss: 1.0496, test_loss: 1.0920, test_f1: 0.4450
 epoch: 98, train_loss: 1.0507, test_loss: 1.0886, test_f1: 0.4422
 epoch: 99, train_loss: 1.0426, test_loss: 1.0946, test_f1: 0.4473
##################ITERATION #1 ****************************************
 epoch: 0, train_loss: 1.3344, test_loss: 1.3414, test_f1: 0.2274
 epoch: 1, train_loss: 1.3256, test_loss: 1.3326, test_f1: 0.2274
 epoch: 2, train_loss: 1.3197, test_loss: 1.3203, test_f1: 0.2274
 epoch: 3, train_loss: 1.3112, test_loss: 1.3105, test_f1: 0.2274
 epoch: 4, train_loss: 1.3059, test_loss: 1.3022, test_f1: 0.2274
 epoch: 5, train_loss: 1.2989, test_loss: 1.2979, test_f1: 0.2274
 epoch: 6, train_loss: 1.2921, test_loss: 1.2916, test_f1: 0.2274
 epoch: 7, train_loss: 1.2866, test_loss: 1.2868, test_f1: 0.2274
 epoch: 8, train_loss: 1.2829, test_loss: 1.2804, test_f1: 0.2274
 epoch: 9, train_loss: 1.2768, test_loss: 1.2750, test_f1: 0.2274
 epoch: 10, train_loss: 1.2729, test_loss: 1.2677, test_f1: 0.2274
 epoch: 11, train_loss: 1.2688, test_loss: 1.2630, test_f1: 0.2274
 epoch: 12, train_loss: 1.2620, test_loss: 1.2563, test_f1: 0.2274
 epoch: 13, train_loss: 1.2579, test_loss: 1.2507, test_f1: 0.2274
 epoch: 14, train_loss: 1.2514, test_loss: 1.2465, test_f1: 0.2300
 epoch: 15, train_loss: 1.2468, test_loss: 1.2405, test_f1: 0.2472
 epoch: 16, train_loss: 1.2442, test_loss: 1.2344, test_f1: 0.2583
 epoch: 17, train_loss: 1.2391, test_loss: 1.2310, test_f1: 0.2561
 epoch: 18, train_loss: 1.2358, test_loss: 1.2255, test_f1: 0.2617
 epoch: 19, train_loss: 1.2276, test_loss: 1.2179, test_f1: 0.3072
 epoch: 20, train_loss: 1.2288, test_loss: 1.2120, test_f1: 0.3157
 epoch: 21, train_loss: 1.2179, test_loss: 1.2052, test_f1: 0.3228
 epoch: 22, train_loss: 1.2098, test_loss: 1.1979, test_f1: 0.3305
 epoch: 23, train_loss: 1.2068, test_loss: 1.1927, test_f1: 0.3298
 epoch: 24, train_loss: 1.2049, test_loss: 1.1884, test_f1: 0.3292
 epoch: 25, train_loss: 1.2023, test_loss: 1.1821, test_f1: 0.3420
 epoch: 26, train_loss: 1.1963, test_loss: 1.1766, test_f1: 0.3431
 epoch: 27, train_loss: 1.1842, test_loss: 1.1701, test_f1: 0.3550
 epoch: 28, train_loss: 1.1864, test_loss: 1.1766, test_f1: 0.3705
 epoch: 29, train_loss: 1.1824, test_loss: 1.1666, test_f1: 0.3759
 epoch: 30, train_loss: 1.1744, test_loss: 1.1627, test_f1: 0.3763
 epoch: 31, train_loss: 1.1761, test_loss: 1.1598, test_f1: 0.3758
 epoch: 32, train_loss: 1.1655, test_loss: 1.1560, test_f1: 0.3907
 epoch: 33, train_loss: 1.1640, test_loss: 1.1534, test_f1: 0.4049
 epoch: 34, train_loss: 1.1607, test_loss: 1.1482, test_f1: 0.4058
 epoch: 35, train_loss: 1.1579, test_loss: 1.1391, test_f1: 0.4043
 epoch: 36, train_loss: 1.1521, test_loss: 1.1387, test_f1: 0.4092
 epoch: 37, train_loss: 1.1507, test_loss: 1.1328, test_f1: 0.4155
 epoch: 38, train_loss: 1.1477, test_loss: 1.1301, test_f1: 0.4122
 epoch: 39, train_loss: 1.1362, test_loss: 1.1276, test_f1: 0.4208
 epoch: 40, train_loss: 1.1412, test_loss: 1.1197, test_f1: 0.4192
 epoch: 41, train_loss: 1.1322, test_loss: 1.1229, test_f1: 0.4200
 epoch: 42, train_loss: 1.1282, test_loss: 1.1168, test_f1: 0.4202
 epoch: 43, train_loss: 1.1267, test_loss: 1.1098, test_f1: 0.4254
 epoch: 44, train_loss: 1.1257, test_loss: 1.1078, test_f1: 0.4224
 epoch: 45, train_loss: 1.1236, test_loss: 1.1008, test_f1: 0.4312
 epoch: 46, train_loss: 1.1139, test_loss: 1.1011, test_f1: 0.4414
 epoch: 47, train_loss: 1.1108, test_loss: 1.0971, test_f1: 0.4339
 epoch: 48, train_loss: 1.1111, test_loss: 1.0942, test_f1: 0.4478
 epoch: 49, train_loss: 1.1177, test_loss: 1.0995, test_f1: 0.4488
 epoch: 50, train_loss: 1.1050, test_loss: 1.0901, test_f1: 0.4418
 epoch: 51, train_loss: 1.1001, test_loss: 1.0917, test_f1: 0.4486
 epoch: 52, train_loss: 1.1026, test_loss: 1.0875, test_f1: 0.4528
 epoch: 53, train_loss: 1.0991, test_loss: 1.0887, test_f1: 0.4514
 epoch: 54, train_loss: 1.0999, test_loss: 1.0876, test_f1: 0.4531
 epoch: 55, train_loss: 1.0998, test_loss: 1.0816, test_f1: 0.4570
 epoch: 56, train_loss: 1.0970, test_loss: 1.0817, test_f1: 0.4560
 epoch: 57, train_loss: 1.0967, test_loss: 1.0806, test_f1: 0.4544
 epoch: 58, train_loss: 1.0936, test_loss: 1.0823, test_f1: 0.4548
 epoch: 59, train_loss: 1.0965, test_loss: 1.0788, test_f1: 0.4477
 epoch: 60, train_loss: 1.0953, test_loss: 1.0866, test_f1: 0.4568
 epoch: 61, train_loss: 1.0914, test_loss: 1.0812, test_f1: 0.4637
 epoch: 62, train_loss: 1.0875, test_loss: 1.0767, test_f1: 0.4630
 epoch: 63, train_loss: 1.0813, test_loss: 1.0806, test_f1: 0.4625
 epoch: 64, train_loss: 1.0810, test_loss: 1.0792, test_f1: 0.4612
 epoch: 65, train_loss: 1.0813, test_loss: 1.0751, test_f1: 0.4638
 epoch: 66, train_loss: 1.0799, test_loss: 1.0732, test_f1: 0.4686
 epoch: 67, train_loss: 1.0805, test_loss: 1.0647, test_f1: 0.4629
 epoch: 68, train_loss: 1.0768, test_loss: 1.0672, test_f1: 0.4655
 epoch: 69, train_loss: 1.0729, test_loss: 1.0743, test_f1: 0.4640
 epoch: 70, train_loss: 1.0730, test_loss: 1.0646, test_f1: 0.4612
 epoch: 71, train_loss: 1.0863, test_loss: 1.0752, test_f1: 0.4674
 epoch: 72, train_loss: 1.0735, test_loss: 1.0742, test_f1: 0.4606
 epoch: 73, train_loss: 1.0749, test_loss: 1.0614, test_f1: 0.4645
 epoch: 74, train_loss: 1.0713, test_loss: 1.0669, test_f1: 0.4625
 epoch: 75, train_loss: 1.0647, test_loss: 1.0700, test_f1: 0.4525
 epoch: 76, train_loss: 1.0644, test_loss: 1.0631, test_f1: 0.4636
 epoch: 77, train_loss: 1.0670, test_loss: 1.0637, test_f1: 0.4606
 epoch: 78, train_loss: 1.0673, test_loss: 1.0689, test_f1: 0.4650
 epoch: 79, train_loss: 1.0669, test_loss: 1.0570, test_f1: 0.4603
 epoch: 80, train_loss: 1.0661, test_loss: 1.0647, test_f1: 0.4649
 epoch: 81, train_loss: 1.0698, test_loss: 1.0599, test_f1: 0.4706
 epoch: 82, train_loss: 1.0639, test_loss: 1.0576, test_f1: 0.4693
 epoch: 83, train_loss: 1.0625, test_loss: 1.0533, test_f1: 0.4712
 epoch: 84, train_loss: 1.0567, test_loss: 1.0516, test_f1: 0.4662
 epoch: 85, train_loss: 1.0654, test_loss: 1.0617, test_f1: 0.4662
 epoch: 86, train_loss: 1.0648, test_loss: 1.0615, test_f1: 0.4703
 epoch: 87, train_loss: 1.0555, test_loss: 1.0586, test_f1: 0.4691
 epoch: 88, train_loss: 1.0528, test_loss: 1.0654, test_f1: 0.4667
 epoch: 89, train_loss: 1.0564, test_loss: 1.0589, test_f1: 0.4680
 epoch: 90, train_loss: 1.0514, test_loss: 1.0589, test_f1: 0.4662
 epoch: 91, train_loss: 1.0430, test_loss: 1.0541, test_f1: 0.4680
 epoch: 92, train_loss: 1.0471, test_loss: 1.0560, test_f1: 0.4613
 epoch: 93, train_loss: 1.0598, test_loss: 1.0460, test_f1: 0.4698
 epoch: 94, train_loss: 1.0443, test_loss: 1.0551, test_f1: 0.4651
 epoch: 95, train_loss: 1.0532, test_loss: 1.0529, test_f1: 0.4765
 epoch: 96, train_loss: 1.0482, test_loss: 1.0506, test_f1: 0.4693
 epoch: 97, train_loss: 1.0399, test_loss: 1.0478, test_f1: 0.4700
 epoch: 98, train_loss: 1.0506, test_loss: 1.0463, test_f1: 0.4745
 epoch: 99, train_loss: 1.0453, test_loss: 1.0485, test_f1: 0.4638
##################ITERATION #2 ****************************************
 epoch: 0, train_loss: 1.3217, test_loss: 1.3228, test_f1: 0.2274
 epoch: 1, train_loss: 1.3070, test_loss: 1.3113, test_f1: 0.2274
 epoch: 2, train_loss: 1.2950, test_loss: 1.2936, test_f1: 0.2274
 epoch: 3, train_loss: 1.2852, test_loss: 1.2781, test_f1: 0.2274
 epoch: 4, train_loss: 1.2763, test_loss: 1.2680, test_f1: 0.2274
 epoch: 5, train_loss: 1.2726, test_loss: 1.2593, test_f1: 0.2449
 epoch: 6, train_loss: 1.2674, test_loss: 1.2537, test_f1: 0.2612
 epoch: 7, train_loss: 1.2587, test_loss: 1.2435, test_f1: 0.2841
 epoch: 8, train_loss: 1.2535, test_loss: 1.2378, test_f1: 0.2821
 epoch: 9, train_loss: 1.2496, test_loss: 1.2310, test_f1: 0.3065
 epoch: 10, train_loss: 1.2472, test_loss: 1.2263, test_f1: 0.3139
 epoch: 11, train_loss: 1.2394, test_loss: 1.2228, test_f1: 0.3147
 epoch: 12, train_loss: 1.2322, test_loss: 1.2190, test_f1: 0.3259
 epoch: 13, train_loss: 1.2297, test_loss: 1.2156, test_f1: 0.3348
 epoch: 14, train_loss: 1.2230, test_loss: 1.2092, test_f1: 0.3466
 epoch: 15, train_loss: 1.2165, test_loss: 1.2036, test_f1: 0.3615
 epoch: 16, train_loss: 1.2177, test_loss: 1.2026, test_f1: 0.3685
 epoch: 17, train_loss: 1.2088, test_loss: 1.1956, test_f1: 0.3797
 epoch: 18, train_loss: 1.2108, test_loss: 1.1909, test_f1: 0.3835
 epoch: 19, train_loss: 1.2082, test_loss: 1.1911, test_f1: 0.3784
 epoch: 20, train_loss: 1.2004, test_loss: 1.1860, test_f1: 0.3851
 epoch: 21, train_loss: 1.1988, test_loss: 1.1823, test_f1: 0.3975
 epoch: 22, train_loss: 1.1929, test_loss: 1.1791, test_f1: 0.3996
 epoch: 23, train_loss: 1.1929, test_loss: 1.1775, test_f1: 0.4045
 epoch: 24, train_loss: 1.1899, test_loss: 1.1723, test_f1: 0.4025
 epoch: 25, train_loss: 1.1813, test_loss: 1.1683, test_f1: 0.4032
 epoch: 26, train_loss: 1.1796, test_loss: 1.1658, test_f1: 0.4009
 epoch: 27, train_loss: 1.1748, test_loss: 1.1629, test_f1: 0.4038
 epoch: 28, train_loss: 1.1654, test_loss: 1.1558, test_f1: 0.4107
 epoch: 29, train_loss: 1.1681, test_loss: 1.1577, test_f1: 0.4112
 epoch: 30, train_loss: 1.1609, test_loss: 1.1515, test_f1: 0.4133
 epoch: 31, train_loss: 1.1562, test_loss: 1.1476, test_f1: 0.4135
 epoch: 32, train_loss: 1.1601, test_loss: 1.1411, test_f1: 0.4183
 epoch: 33, train_loss: 1.1548, test_loss: 1.1381, test_f1: 0.4264
 epoch: 34, train_loss: 1.1446, test_loss: 1.1366, test_f1: 0.4222
 epoch: 35, train_loss: 1.1507, test_loss: 1.1344, test_f1: 0.4284
 epoch: 36, train_loss: 1.1378, test_loss: 1.1258, test_f1: 0.4219
 epoch: 37, train_loss: 1.1417, test_loss: 1.1215, test_f1: 0.4272
 epoch: 38, train_loss: 1.1262, test_loss: 1.1203, test_f1: 0.4306
 epoch: 39, train_loss: 1.1332, test_loss: 1.1043, test_f1: 0.4391
 epoch: 40, train_loss: 1.1217, test_loss: 1.1084, test_f1: 0.4350
 epoch: 41, train_loss: 1.1235, test_loss: 1.1031, test_f1: 0.4291
 epoch: 42, train_loss: 1.1243, test_loss: 1.1031, test_f1: 0.4318
 epoch: 43, train_loss: 1.1165, test_loss: 1.0963, test_f1: 0.4374
 epoch: 44, train_loss: 1.1134, test_loss: 1.0968, test_f1: 0.4445
 epoch: 45, train_loss: 1.1105, test_loss: 1.0934, test_f1: 0.4340
 epoch: 46, train_loss: 1.1094, test_loss: 1.0940, test_f1: 0.4427
 epoch: 47, train_loss: 1.1090, test_loss: 1.0900, test_f1: 0.4411
 epoch: 48, train_loss: 1.1095, test_loss: 1.0858, test_f1: 0.4479
 epoch: 49, train_loss: 1.1079, test_loss: 1.0884, test_f1: 0.4472
 epoch: 50, train_loss: 1.1086, test_loss: 1.0875, test_f1: 0.4493
 epoch: 51, train_loss: 1.0921, test_loss: 1.0842, test_f1: 0.4494
 epoch: 52, train_loss: 1.0969, test_loss: 1.0872, test_f1: 0.4466
 epoch: 53, train_loss: 1.0945, test_loss: 1.0868, test_f1: 0.4471
 epoch: 54, train_loss: 1.0860, test_loss: 1.0844, test_f1: 0.4466
 epoch: 55, train_loss: 1.0887, test_loss: 1.0889, test_f1: 0.4412
 epoch: 56, train_loss: 1.0840, test_loss: 1.0857, test_f1: 0.4406
 epoch: 57, train_loss: 1.0836, test_loss: 1.0813, test_f1: 0.4480
 epoch: 58, train_loss: 1.0901, test_loss: 1.0788, test_f1: 0.4489
 epoch: 59, train_loss: 1.0751, test_loss: 1.0781, test_f1: 0.4570
 epoch: 60, train_loss: 1.0832, test_loss: 1.0779, test_f1: 0.4487
 epoch: 61, train_loss: 1.0800, test_loss: 1.0752, test_f1: 0.4493
 epoch: 62, train_loss: 1.0780, test_loss: 1.0762, test_f1: 0.4431
 epoch: 63, train_loss: 1.0795, test_loss: 1.0745, test_f1: 0.4482
 epoch: 64, train_loss: 1.0788, test_loss: 1.0748, test_f1: 0.4513
 epoch: 65, train_loss: 1.0697, test_loss: 1.0773, test_f1: 0.4475
 epoch: 66, train_loss: 1.0807, test_loss: 1.0761, test_f1: 0.4424
 epoch: 67, train_loss: 1.0778, test_loss: 1.0754, test_f1: 0.4481
 epoch: 68, train_loss: 1.0727, test_loss: 1.0772, test_f1: 0.4497
 epoch: 69, train_loss: 1.0674, test_loss: 1.0685, test_f1: 0.4582
 epoch: 70, train_loss: 1.0702, test_loss: 1.0744, test_f1: 0.4495
 epoch: 71, train_loss: 1.0678, test_loss: 1.0676, test_f1: 0.4515
 epoch: 72, train_loss: 1.0612, test_loss: 1.0693, test_f1: 0.4549
 epoch: 73, train_loss: 1.0764, test_loss: 1.0671, test_f1: 0.4477
 epoch: 74, train_loss: 1.0671, test_loss: 1.0722, test_f1: 0.4510
 epoch: 75, train_loss: 1.0644, test_loss: 1.0707, test_f1: 0.4462
 epoch: 76, train_loss: 1.0638, test_loss: 1.0746, test_f1: 0.4435
 epoch: 77, train_loss: 1.0685, test_loss: 1.0703, test_f1: 0.4487
 epoch: 78, train_loss: 1.0631, test_loss: 1.0662, test_f1: 0.4573
 epoch: 79, train_loss: 1.0626, test_loss: 1.0683, test_f1: 0.4575
 epoch: 80, train_loss: 1.0606, test_loss: 1.0706, test_f1: 0.4545
 epoch: 81, train_loss: 1.0595, test_loss: 1.0749, test_f1: 0.4503
 epoch: 82, train_loss: 1.0588, test_loss: 1.0669, test_f1: 0.4553
 epoch: 83, train_loss: 1.0593, test_loss: 1.0713, test_f1: 0.4525
 epoch: 84, train_loss: 1.0510, test_loss: 1.0614, test_f1: 0.4582
 epoch: 85, train_loss: 1.0629, test_loss: 1.0599, test_f1: 0.4533
 epoch: 86, train_loss: 1.0618, test_loss: 1.0664, test_f1: 0.4532
 epoch: 87, train_loss: 1.0571, test_loss: 1.0627, test_f1: 0.4450
 epoch: 88, train_loss: 1.0567, test_loss: 1.0719, test_f1: 0.4494
 epoch: 89, train_loss: 1.0491, test_loss: 1.0681, test_f1: 0.4447
 epoch: 90, train_loss: 1.0510, test_loss: 1.0667, test_f1: 0.4499
 epoch: 91, train_loss: 1.0444, test_loss: 1.0632, test_f1: 0.4550
 epoch: 92, train_loss: 1.0481, test_loss: 1.0652, test_f1: 0.4551
 epoch: 93, train_loss: 1.0446, test_loss: 1.0652, test_f1: 0.4516
 epoch: 94, train_loss: 1.0416, test_loss: 1.0662, test_f1: 0.4468
 epoch: 95, train_loss: 1.0427, test_loss: 1.0707, test_f1: 0.4445
 epoch: 96, train_loss: 1.0473, test_loss: 1.0665, test_f1: 0.4486
 epoch: 97, train_loss: 1.0453, test_loss: 1.0648, test_f1: 0.4522
 epoch: 98, train_loss: 1.0476, test_loss: 1.0616, test_f1: 0.4541
 epoch: 99, train_loss: 1.0524, test_loss: 1.0607, test_f1: 0.4538
##################ITERATION #3 ****************************************
 epoch: 0, train_loss: 1.3008, test_loss: 1.3032, test_f1: 0.2274
 epoch: 1, train_loss: 1.2826, test_loss: 1.2816, test_f1: 0.2325
 epoch: 2, train_loss: 1.2770, test_loss: 1.2681, test_f1: 0.2325
 epoch: 3, train_loss: 1.2659, test_loss: 1.2616, test_f1: 0.2350
 epoch: 4, train_loss: 1.2606, test_loss: 1.2544, test_f1: 0.2460
 epoch: 5, train_loss: 1.2568, test_loss: 1.2482, test_f1: 0.2563
 epoch: 6, train_loss: 1.2487, test_loss: 1.2403, test_f1: 0.2605
 epoch: 7, train_loss: 1.2441, test_loss: 1.2366, test_f1: 0.2902
 epoch: 8, train_loss: 1.2393, test_loss: 1.2326, test_f1: 0.3108
 epoch: 9, train_loss: 1.2358, test_loss: 1.2254, test_f1: 0.3028
 epoch: 10, train_loss: 1.2365, test_loss: 1.2234, test_f1: 0.3186
 epoch: 11, train_loss: 1.2271, test_loss: 1.2175, test_f1: 0.3095
 epoch: 12, train_loss: 1.2205, test_loss: 1.2148, test_f1: 0.3156
 epoch: 13, train_loss: 1.2221, test_loss: 1.2101, test_f1: 0.3223
 epoch: 14, train_loss: 1.2165, test_loss: 1.2050, test_f1: 0.3284
 epoch: 15, train_loss: 1.2164, test_loss: 1.2037, test_f1: 0.3237
 epoch: 16, train_loss: 1.2178, test_loss: 1.1995, test_f1: 0.3207
 epoch: 17, train_loss: 1.2056, test_loss: 1.1962, test_f1: 0.3217
 epoch: 18, train_loss: 1.2028, test_loss: 1.1932, test_f1: 0.3229
 epoch: 19, train_loss: 1.2034, test_loss: 1.1887, test_f1: 0.3395
 epoch: 20, train_loss: 1.2033, test_loss: 1.1847, test_f1: 0.3464
 epoch: 21, train_loss: 1.1983, test_loss: 1.1812, test_f1: 0.3580
 epoch: 22, train_loss: 1.1892, test_loss: 1.1766, test_f1: 0.3727
 epoch: 23, train_loss: 1.1933, test_loss: 1.1742, test_f1: 0.3817
 epoch: 24, train_loss: 1.1837, test_loss: 1.1691, test_f1: 0.3877
 epoch: 25, train_loss: 1.1865, test_loss: 1.1668, test_f1: 0.3962
 epoch: 26, train_loss: 1.1850, test_loss: 1.1655, test_f1: 0.3914
 epoch: 27, train_loss: 1.1793, test_loss: 1.1627, test_f1: 0.3871
 epoch: 28, train_loss: 1.1809, test_loss: 1.1602, test_f1: 0.3905
 epoch: 29, train_loss: 1.1729, test_loss: 1.1595, test_f1: 0.3927
 epoch: 30, train_loss: 1.1739, test_loss: 1.1552, test_f1: 0.3863
 epoch: 31, train_loss: 1.1690, test_loss: 1.1522, test_f1: 0.3960
 epoch: 32, train_loss: 1.1683, test_loss: 1.1495, test_f1: 0.3985
 epoch: 33, train_loss: 1.1604, test_loss: 1.1475, test_f1: 0.4010
 epoch: 34, train_loss: 1.1645, test_loss: 1.1478, test_f1: 0.4079
 epoch: 35, train_loss: 1.1582, test_loss: 1.1442, test_f1: 0.4066
 epoch: 36, train_loss: 1.1566, test_loss: 1.1398, test_f1: 0.4021
 epoch: 37, train_loss: 1.1548, test_loss: 1.1430, test_f1: 0.4038
 epoch: 38, train_loss: 1.1587, test_loss: 1.1392, test_f1: 0.4043
 epoch: 39, train_loss: 1.1469, test_loss: 1.1360, test_f1: 0.4067
 epoch: 40, train_loss: 1.1434, test_loss: 1.1343, test_f1: 0.4059
 epoch: 41, train_loss: 1.1432, test_loss: 1.1351, test_f1: 0.4062
 epoch: 42, train_loss: 1.1462, test_loss: 1.1308, test_f1: 0.4061
 epoch: 43, train_loss: 1.1478, test_loss: 1.1285, test_f1: 0.4126
 epoch: 44, train_loss: 1.1350, test_loss: 1.1289, test_f1: 0.4089
 epoch: 45, train_loss: 1.1403, test_loss: 1.1235, test_f1: 0.4223
 epoch: 46, train_loss: 1.1338, test_loss: 1.1200, test_f1: 0.4104
 epoch: 47, train_loss: 1.1339, test_loss: 1.1240, test_f1: 0.4192
 epoch: 48, train_loss: 1.1266, test_loss: 1.1194, test_f1: 0.4200
 epoch: 49, train_loss: 1.1297, test_loss: 1.1181, test_f1: 0.4235
 epoch: 50, train_loss: 1.1263, test_loss: 1.1160, test_f1: 0.4278
 epoch: 51, train_loss: 1.1268, test_loss: 1.1150, test_f1: 0.4286
 epoch: 52, train_loss: 1.1194, test_loss: 1.1145, test_f1: 0.4271
 epoch: 53, train_loss: 1.1187, test_loss: 1.1160, test_f1: 0.4229
 epoch: 54, train_loss: 1.1215, test_loss: 1.1165, test_f1: 0.4160
 epoch: 55, train_loss: 1.1161, test_loss: 1.1139, test_f1: 0.4170
 epoch: 56, train_loss: 1.1145, test_loss: 1.1158, test_f1: 0.4242
 epoch: 57, train_loss: 1.1138, test_loss: 1.1113, test_f1: 0.4274
 epoch: 58, train_loss: 1.1167, test_loss: 1.1114, test_f1: 0.4227
 epoch: 59, train_loss: 1.1107, test_loss: 1.1127, test_f1: 0.4243
 epoch: 60, train_loss: 1.1114, test_loss: 1.1119, test_f1: 0.4250
 epoch: 61, train_loss: 1.1127, test_loss: 1.1084, test_f1: 0.4181
 epoch: 62, train_loss: 1.1198, test_loss: 1.1100, test_f1: 0.4303
 epoch: 63, train_loss: 1.1072, test_loss: 1.1029, test_f1: 0.4223
 epoch: 64, train_loss: 1.1086, test_loss: 1.1061, test_f1: 0.4258
 epoch: 65, train_loss: 1.1040, test_loss: 1.1068, test_f1: 0.4315
 epoch: 66, train_loss: 1.1061, test_loss: 1.1047, test_f1: 0.4267
 epoch: 67, train_loss: 1.1103, test_loss: 1.1000, test_f1: 0.4402
 epoch: 68, train_loss: 1.0977, test_loss: 1.0990, test_f1: 0.4247
 epoch: 69, train_loss: 1.0958, test_loss: 1.1027, test_f1: 0.4278
 epoch: 70, train_loss: 1.0964, test_loss: 1.0996, test_f1: 0.4232
 epoch: 71, train_loss: 1.1027, test_loss: 1.1001, test_f1: 0.4337
 epoch: 72, train_loss: 1.1046, test_loss: 1.1000, test_f1: 0.4257
 epoch: 73, train_loss: 1.0977, test_loss: 1.0973, test_f1: 0.4289
 epoch: 74, train_loss: 1.0996, test_loss: 1.0986, test_f1: 0.4282
 epoch: 75, train_loss: 1.0959, test_loss: 1.0968, test_f1: 0.4264
 epoch: 76, train_loss: 1.0999, test_loss: 1.0973, test_f1: 0.4264
 epoch: 77, train_loss: 1.0932, test_loss: 1.0952, test_f1: 0.4314
 epoch: 78, train_loss: 1.1011, test_loss: 1.0952, test_f1: 0.4310
 epoch: 79, train_loss: 1.0981, test_loss: 1.1010, test_f1: 0.4374
 epoch: 80, train_loss: 1.0929, test_loss: 1.0925, test_f1: 0.4272
 epoch: 81, train_loss: 1.0913, test_loss: 1.0958, test_f1: 0.4308
 epoch: 82, train_loss: 1.0929, test_loss: 1.0965, test_f1: 0.4241
 epoch: 83, train_loss: 1.0855, test_loss: 1.0928, test_f1: 0.4282
 epoch: 84, train_loss: 1.0841, test_loss: 1.0894, test_f1: 0.4363
 epoch: 85, train_loss: 1.0859, test_loss: 1.0954, test_f1: 0.4302
 epoch: 86, train_loss: 1.0979, test_loss: 1.0943, test_f1: 0.4223
 epoch: 87, train_loss: 1.0850, test_loss: 1.0880, test_f1: 0.4257
 epoch: 88, train_loss: 1.0828, test_loss: 1.0855, test_f1: 0.4327
 epoch: 89, train_loss: 1.0729, test_loss: 1.0922, test_f1: 0.4300
 epoch: 90, train_loss: 1.0759, test_loss: 1.0885, test_f1: 0.4318
 epoch: 91, train_loss: 1.0799, test_loss: 1.0851, test_f1: 0.4333
 epoch: 92, train_loss: 1.0766, test_loss: 1.0920, test_f1: 0.4308
 epoch: 93, train_loss: 1.0855, test_loss: 1.0875, test_f1: 0.4403
 epoch: 94, train_loss: 1.0789, test_loss: 1.0881, test_f1: 0.4277
 epoch: 95, train_loss: 1.0775, test_loss: 1.0881, test_f1: 0.4276
 epoch: 96, train_loss: 1.0756, test_loss: 1.0919, test_f1: 0.4239
 epoch: 97, train_loss: 1.0743, test_loss: 1.0815, test_f1: 0.4299
 epoch: 98, train_loss: 1.0778, test_loss: 1.0877, test_f1: 0.4226
 epoch: 99, train_loss: 1.0799, test_loss: 1.0890, test_f1: 0.4233
##################ITERATION #4 ****************************************
 epoch: 0, train_loss: 1.3103, test_loss: 1.3199, test_f1: 0.2247
 epoch: 1, train_loss: 1.2875, test_loss: 1.2954, test_f1: 0.2644
 epoch: 2, train_loss: 1.2784, test_loss: 1.2718, test_f1: 0.2710
 epoch: 3, train_loss: 1.2632, test_loss: 1.2556, test_f1: 0.2885
 epoch: 4, train_loss: 1.2560, test_loss: 1.2466, test_f1: 0.2889
 epoch: 5, train_loss: 1.2522, test_loss: 1.2376, test_f1: 0.3099
 epoch: 6, train_loss: 1.2444, test_loss: 1.2337, test_f1: 0.3228
 epoch: 7, train_loss: 1.2409, test_loss: 1.2255, test_f1: 0.3387
 epoch: 8, train_loss: 1.2321, test_loss: 1.2201, test_f1: 0.3530
 epoch: 9, train_loss: 1.2292, test_loss: 1.2140, test_f1: 0.3584
 epoch: 10, train_loss: 1.2223, test_loss: 1.2072, test_f1: 0.3593
 epoch: 11, train_loss: 1.2194, test_loss: 1.2016, test_f1: 0.3684
 epoch: 12, train_loss: 1.2114, test_loss: 1.1971, test_f1: 0.3718
 epoch: 13, train_loss: 1.2073, test_loss: 1.1928, test_f1: 0.3780
 epoch: 14, train_loss: 1.2079, test_loss: 1.1858, test_f1: 0.3902
 epoch: 15, train_loss: 1.2029, test_loss: 1.1845, test_f1: 0.3854
 epoch: 16, train_loss: 1.1980, test_loss: 1.1780, test_f1: 0.3878
 epoch: 17, train_loss: 1.1927, test_loss: 1.1743, test_f1: 0.3939
 epoch: 18, train_loss: 1.1850, test_loss: 1.1685, test_f1: 0.4020
 epoch: 19, train_loss: 1.1811, test_loss: 1.1673, test_f1: 0.4012
 epoch: 20, train_loss: 1.1830, test_loss: 1.1594, test_f1: 0.4153
 epoch: 21, train_loss: 1.1788, test_loss: 1.1574, test_f1: 0.4161
 epoch: 22, train_loss: 1.1747, test_loss: 1.1509, test_f1: 0.4192
 epoch: 23, train_loss: 1.1717, test_loss: 1.1440, test_f1: 0.4236
 epoch: 24, train_loss: 1.1628, test_loss: 1.1388, test_f1: 0.4304
 epoch: 25, train_loss: 1.1613, test_loss: 1.1343, test_f1: 0.4322
 epoch: 26, train_loss: 1.1539, test_loss: 1.1279, test_f1: 0.4497
 epoch: 27, train_loss: 1.1514, test_loss: 1.1264, test_f1: 0.4434
 epoch: 28, train_loss: 1.1541, test_loss: 1.1246, test_f1: 0.4398
 epoch: 29, train_loss: 1.1401, test_loss: 1.1188, test_f1: 0.4543
 epoch: 30, train_loss: 1.1414, test_loss: 1.1145, test_f1: 0.4570
 epoch: 31, train_loss: 1.1467, test_loss: 1.1114, test_f1: 0.4556
 epoch: 32, train_loss: 1.1249, test_loss: 1.1121, test_f1: 0.4459
 epoch: 33, train_loss: 1.1318, test_loss: 1.1069, test_f1: 0.4457
 epoch: 34, train_loss: 1.1261, test_loss: 1.1053, test_f1: 0.4552
 epoch: 35, train_loss: 1.1203, test_loss: 1.0995, test_f1: 0.4371
 epoch: 36, train_loss: 1.1191, test_loss: 1.1003, test_f1: 0.4571
 epoch: 37, train_loss: 1.1135, test_loss: 1.0945, test_f1: 0.4513
 epoch: 38, train_loss: 1.1111, test_loss: 1.0921, test_f1: 0.4602
 epoch: 39, train_loss: 1.1096, test_loss: 1.0913, test_f1: 0.4528
 epoch: 40, train_loss: 1.1086, test_loss: 1.0858, test_f1: 0.4522
 epoch: 41, train_loss: 1.0987, test_loss: 1.0853, test_f1: 0.4598
 epoch: 42, train_loss: 1.1066, test_loss: 1.0853, test_f1: 0.4553
 epoch: 43, train_loss: 1.0996, test_loss: 1.0798, test_f1: 0.4526
 epoch: 44, train_loss: 1.0941, test_loss: 1.0794, test_f1: 0.4659
 epoch: 45, train_loss: 1.0902, test_loss: 1.0787, test_f1: 0.4693
 epoch: 46, train_loss: 1.0955, test_loss: 1.0735, test_f1: 0.4724
 epoch: 47, train_loss: 1.0842, test_loss: 1.0722, test_f1: 0.4688
 epoch: 48, train_loss: 1.0765, test_loss: 1.0740, test_f1: 0.4648
 epoch: 49, train_loss: 1.0788, test_loss: 1.0684, test_f1: 0.4765
 epoch: 50, train_loss: 1.0714, test_loss: 1.0719, test_f1: 0.4808
 epoch: 51, train_loss: 1.0718, test_loss: 1.0675, test_f1: 0.4834
 epoch: 52, train_loss: 1.0739, test_loss: 1.0667, test_f1: 0.4794
 epoch: 53, train_loss: 1.0683, test_loss: 1.0672, test_f1: 0.4810
 epoch: 54, train_loss: 1.0657, test_loss: 1.0659, test_f1: 0.4764
 epoch: 55, train_loss: 1.0654, test_loss: 1.0660, test_f1: 0.4761
 epoch: 56, train_loss: 1.0632, test_loss: 1.0659, test_f1: 0.4754
 epoch: 57, train_loss: 1.0811, test_loss: 1.0653, test_f1: 0.4805
 epoch: 58, train_loss: 1.0571, test_loss: 1.0635, test_f1: 0.4803
 epoch: 59, train_loss: 1.0652, test_loss: 1.0596, test_f1: 0.4813
 epoch: 60, train_loss: 1.0601, test_loss: 1.0595, test_f1: 0.4756
 epoch: 61, train_loss: 1.0655, test_loss: 1.0638, test_f1: 0.4687
 epoch: 62, train_loss: 1.0766, test_loss: 1.0623, test_f1: 0.4783
 epoch: 63, train_loss: 1.0535, test_loss: 1.0612, test_f1: 0.4751
 epoch: 64, train_loss: 1.0624, test_loss: 1.0639, test_f1: 0.4684
 epoch: 65, train_loss: 1.0591, test_loss: 1.0630, test_f1: 0.4695
 epoch: 66, train_loss: 1.0580, test_loss: 1.0668, test_f1: 0.4604
 epoch: 67, train_loss: 1.0458, test_loss: 1.0617, test_f1: 0.4741
 epoch: 68, train_loss: 1.0503, test_loss: 1.0664, test_f1: 0.4709
 epoch: 69, train_loss: 1.0609, test_loss: 1.0622, test_f1: 0.4700
 epoch: 70, train_loss: 1.0498, test_loss: 1.0631, test_f1: 0.4684
 epoch: 71, train_loss: 1.0390, test_loss: 1.0619, test_f1: 0.4677
 epoch: 72, train_loss: 1.0398, test_loss: 1.0584, test_f1: 0.4733
 epoch: 73, train_loss: 1.0469, test_loss: 1.0575, test_f1: 0.4731
 epoch: 74, train_loss: 1.0421, test_loss: 1.0565, test_f1: 0.4722
 epoch: 75, train_loss: 1.0501, test_loss: 1.0562, test_f1: 0.4768
 epoch: 76, train_loss: 1.0513, test_loss: 1.0534, test_f1: 0.4747
 epoch: 77, train_loss: 1.0433, test_loss: 1.0534, test_f1: 0.4694
 epoch: 78, train_loss: 1.0339, test_loss: 1.0565, test_f1: 0.4663
 epoch: 79, train_loss: 1.0397, test_loss: 1.0578, test_f1: 0.4679
 epoch: 80, train_loss: 1.0317, test_loss: 1.0600, test_f1: 0.4691
 epoch: 81, train_loss: 1.0332, test_loss: 1.0540, test_f1: 0.4742
 epoch: 82, train_loss: 1.0400, test_loss: 1.0590, test_f1: 0.4767
 epoch: 83, train_loss: 1.0332, test_loss: 1.0528, test_f1: 0.4705
 epoch: 84, train_loss: 1.0274, test_loss: 1.0563, test_f1: 0.4730
 epoch: 85, train_loss: 1.0384, test_loss: 1.0541, test_f1: 0.4760
 epoch: 86, train_loss: 1.0335, test_loss: 1.0546, test_f1: 0.4692
 epoch: 87, train_loss: 1.0326, test_loss: 1.0524, test_f1: 0.4663
 epoch: 88, train_loss: 1.0261, test_loss: 1.0533, test_f1: 0.4676
 epoch: 89, train_loss: 1.0350, test_loss: 1.0560, test_f1: 0.4746
 epoch: 90, train_loss: 1.0355, test_loss: 1.0490, test_f1: 0.4797
 epoch: 91, train_loss: 1.0265, test_loss: 1.0536, test_f1: 0.4706
 epoch: 92, train_loss: 1.0170, test_loss: 1.0532, test_f1: 0.4613
 epoch: 93, train_loss: 1.0177, test_loss: 1.0511, test_f1: 0.4711
 epoch: 94, train_loss: 1.0222, test_loss: 1.0524, test_f1: 0.4701
 epoch: 95, train_loss: 1.0252, test_loss: 1.0513, test_f1: 0.4729
 epoch: 96, train_loss: 1.0134, test_loss: 1.0544, test_f1: 0.4726
 epoch: 97, train_loss: 1.0252, test_loss: 1.0570, test_f1: 0.4672
 epoch: 98, train_loss: 1.0196, test_loss: 1.0539, test_f1: 0.4649
 epoch: 99, train_loss: 1.0110, test_loss: 1.0534, test_f1: 0.4727
##################ITERATION #5 ****************************************
 epoch: 0, train_loss: 1.3103, test_loss: 1.3078, test_f1: 0.2274
 epoch: 1, train_loss: 1.2877, test_loss: 1.2867, test_f1: 0.2274
 epoch: 2, train_loss: 1.2811, test_loss: 1.2777, test_f1: 0.2399
 epoch: 3, train_loss: 1.2713, test_loss: 1.2574, test_f1: 0.2395
 epoch: 4, train_loss: 1.2643, test_loss: 1.2471, test_f1: 0.2549
 epoch: 5, train_loss: 1.2603, test_loss: 1.2432, test_f1: 0.2549
 epoch: 6, train_loss: 1.2600, test_loss: 1.2355, test_f1: 0.2713
 epoch: 7, train_loss: 1.2442, test_loss: 1.2278, test_f1: 0.2863
 epoch: 8, train_loss: 1.2398, test_loss: 1.2229, test_f1: 0.2846
 epoch: 9, train_loss: 1.2316, test_loss: 1.2185, test_f1: 0.2933
 epoch: 10, train_loss: 1.2311, test_loss: 1.2111, test_f1: 0.3168
 epoch: 11, train_loss: 1.2248, test_loss: 1.2049, test_f1: 0.3182
 epoch: 12, train_loss: 1.2250, test_loss: 1.2034, test_f1: 0.3185
 epoch: 13, train_loss: 1.2194, test_loss: 1.1971, test_f1: 0.3269
 epoch: 14, train_loss: 1.2198, test_loss: 1.1933, test_f1: 0.3259
 epoch: 15, train_loss: 1.2071, test_loss: 1.1893, test_f1: 0.3347
 epoch: 16, train_loss: 1.2032, test_loss: 1.1843, test_f1: 0.3523
 epoch: 17, train_loss: 1.1976, test_loss: 1.1814, test_f1: 0.3806
 epoch: 18, train_loss: 1.1950, test_loss: 1.1767, test_f1: 0.3703
 epoch: 19, train_loss: 1.1881, test_loss: 1.1709, test_f1: 0.3890
 epoch: 20, train_loss: 1.1877, test_loss: 1.1686, test_f1: 0.3954
 epoch: 21, train_loss: 1.1876, test_loss: 1.1648, test_f1: 0.4001
 epoch: 22, train_loss: 1.1794, test_loss: 1.1628, test_f1: 0.4031
 epoch: 23, train_loss: 1.1757, test_loss: 1.1573, test_f1: 0.4163
 epoch: 24, train_loss: 1.1695, test_loss: 1.1575, test_f1: 0.4077
 epoch: 25, train_loss: 1.1651, test_loss: 1.1559, test_f1: 0.4016
 epoch: 26, train_loss: 1.1604, test_loss: 1.1511, test_f1: 0.4042
 epoch: 27, train_loss: 1.1638, test_loss: 1.1478, test_f1: 0.3971
 epoch: 28, train_loss: 1.1541, test_loss: 1.1444, test_f1: 0.4092
 epoch: 29, train_loss: 1.1568, test_loss: 1.1435, test_f1: 0.4009
 epoch: 30, train_loss: 1.1514, test_loss: 1.1383, test_f1: 0.4028
 epoch: 31, train_loss: 1.1486, test_loss: 1.1320, test_f1: 0.4070
 epoch: 32, train_loss: 1.1407, test_loss: 1.1338, test_f1: 0.4057
 epoch: 33, train_loss: 1.1415, test_loss: 1.1294, test_f1: 0.4137
 epoch: 34, train_loss: 1.1328, test_loss: 1.1256, test_f1: 0.4096
 epoch: 35, train_loss: 1.1344, test_loss: 1.1279, test_f1: 0.4151
 epoch: 36, train_loss: 1.1312, test_loss: 1.1260, test_f1: 0.4121
 epoch: 37, train_loss: 1.1284, test_loss: 1.1289, test_f1: 0.4040
 epoch: 38, train_loss: 1.1162, test_loss: 1.1227, test_f1: 0.4137
 epoch: 39, train_loss: 1.1211, test_loss: 1.1224, test_f1: 0.4111
 epoch: 40, train_loss: 1.1256, test_loss: 1.1186, test_f1: 0.4080
 epoch: 41, train_loss: 1.1269, test_loss: 1.1134, test_f1: 0.4147
 epoch: 42, train_loss: 1.1064, test_loss: 1.1190, test_f1: 0.4135
 epoch: 43, train_loss: 1.1109, test_loss: 1.1165, test_f1: 0.4147
 epoch: 44, train_loss: 1.1113, test_loss: 1.1148, test_f1: 0.4008
 epoch: 45, train_loss: 1.1032, test_loss: 1.1048, test_f1: 0.4183
 epoch: 46, train_loss: 1.1004, test_loss: 1.1077, test_f1: 0.4148
 epoch: 47, train_loss: 1.0958, test_loss: 1.1066, test_f1: 0.4088
 epoch: 48, train_loss: 1.0974, test_loss: 1.0994, test_f1: 0.4189
 epoch: 49, train_loss: 1.0857, test_loss: 1.1076, test_f1: 0.4124
 epoch: 50, train_loss: 1.0904, test_loss: 1.1030, test_f1: 0.4199
 epoch: 51, train_loss: 1.0921, test_loss: 1.0973, test_f1: 0.4146
 epoch: 52, train_loss: 1.0930, test_loss: 1.1036, test_f1: 0.4104
 epoch: 53, train_loss: 1.0959, test_loss: 1.1022, test_f1: 0.4032
 epoch: 54, train_loss: 1.0884, test_loss: 1.1050, test_f1: 0.4032
 epoch: 55, train_loss: 1.0778, test_loss: 1.1044, test_f1: 0.4082
 epoch: 56, train_loss: 1.0785, test_loss: 1.1078, test_f1: 0.4038
 epoch: 57, train_loss: 1.0901, test_loss: 1.0983, test_f1: 0.4110
 epoch: 58, train_loss: 1.0769, test_loss: 1.0936, test_f1: 0.4251
 epoch: 59, train_loss: 1.0811, test_loss: 1.0975, test_f1: 0.4149
 epoch: 60, train_loss: 1.0809, test_loss: 1.0999, test_f1: 0.4123
 epoch: 61, train_loss: 1.0786, test_loss: 1.0992, test_f1: 0.4143
 epoch: 62, train_loss: 1.0823, test_loss: 1.0954, test_f1: 0.4254
 epoch: 63, train_loss: 1.0682, test_loss: 1.0934, test_f1: 0.4072
 epoch: 64, train_loss: 1.0720, test_loss: 1.0946, test_f1: 0.4065
 epoch: 65, train_loss: 1.0685, test_loss: 1.0989, test_f1: 0.4072
 epoch: 66, train_loss: 1.0755, test_loss: 1.0936, test_f1: 0.4126
 epoch: 67, train_loss: 1.0697, test_loss: 1.0915, test_f1: 0.4117
 epoch: 68, train_loss: 1.0720, test_loss: 1.0950, test_f1: 0.4207
 epoch: 69, train_loss: 1.0720, test_loss: 1.0935, test_f1: 0.4092
 epoch: 70, train_loss: 1.0608, test_loss: 1.0933, test_f1: 0.4171
 epoch: 71, train_loss: 1.0653, test_loss: 1.0924, test_f1: 0.4138
 epoch: 72, train_loss: 1.0653, test_loss: 1.0906, test_f1: 0.4158
 epoch: 73, train_loss: 1.0637, test_loss: 1.0894, test_f1: 0.4155
 epoch: 74, train_loss: 1.0644, test_loss: 1.0906, test_f1: 0.4167
 epoch: 75, train_loss: 1.0616, test_loss: 1.0907, test_f1: 0.4167
 epoch: 76, train_loss: 1.0573, test_loss: 1.0891, test_f1: 0.4167
 epoch: 77, train_loss: 1.0516, test_loss: 1.0844, test_f1: 0.4135
 epoch: 78, train_loss: 1.0615, test_loss: 1.0913, test_f1: 0.4091
 epoch: 79, train_loss: 1.0629, test_loss: 1.0894, test_f1: 0.4134
 epoch: 80, train_loss: 1.0617, test_loss: 1.0829, test_f1: 0.4186
 epoch: 81, train_loss: 1.0564, test_loss: 1.0809, test_f1: 0.4218
 epoch: 82, train_loss: 1.0490, test_loss: 1.0822, test_f1: 0.4250
 epoch: 83, train_loss: 1.0492, test_loss: 1.0897, test_f1: 0.4181
 epoch: 84, train_loss: 1.0485, test_loss: 1.0899, test_f1: 0.4168
 epoch: 85, train_loss: 1.0563, test_loss: 1.0862, test_f1: 0.4138
 epoch: 86, train_loss: 1.0473, test_loss: 1.0850, test_f1: 0.4170
 epoch: 87, train_loss: 1.0468, test_loss: 1.0877, test_f1: 0.4156
 epoch: 88, train_loss: 1.0383, test_loss: 1.0916, test_f1: 0.4168
 epoch: 89, train_loss: 1.0402, test_loss: 1.0849, test_f1: 0.4235
 epoch: 90, train_loss: 1.0512, test_loss: 1.0849, test_f1: 0.4166
 epoch: 91, train_loss: 1.0523, test_loss: 1.0775, test_f1: 0.4223
 epoch: 92, train_loss: 1.0466, test_loss: 1.0789, test_f1: 0.4255
 epoch: 93, train_loss: 1.0378, test_loss: 1.0845, test_f1: 0.4186
 epoch: 94, train_loss: 1.0498, test_loss: 1.0774, test_f1: 0.4263
 epoch: 95, train_loss: 1.0429, test_loss: 1.0717, test_f1: 0.4286
 epoch: 96, train_loss: 1.0365, test_loss: 1.0748, test_f1: 0.4231
 epoch: 97, train_loss: 1.0426, test_loss: 1.0802, test_f1: 0.4211
 epoch: 98, train_loss: 1.0468, test_loss: 1.0708, test_f1: 0.4300
 epoch: 99, train_loss: 1.0363, test_loss: 1.0765, test_f1: 0.4307
##################ITERATION #6 ****************************************
 epoch: 0, train_loss: 1.3100, test_loss: 1.3170, test_f1: 0.2274
 epoch: 1, train_loss: 1.2955, test_loss: 1.2954, test_f1: 0.2555
 epoch: 2, train_loss: 1.2815, test_loss: 1.2820, test_f1: 0.2553
 epoch: 3, train_loss: 1.2799, test_loss: 1.2630, test_f1: 0.2586
 epoch: 4, train_loss: 1.2623, test_loss: 1.2524, test_f1: 0.2791
 epoch: 5, train_loss: 1.2602, test_loss: 1.2473, test_f1: 0.2671
 epoch: 6, train_loss: 1.2589, test_loss: 1.2407, test_f1: 0.2914
 epoch: 7, train_loss: 1.2512, test_loss: 1.2318, test_f1: 0.2990
 epoch: 8, train_loss: 1.2437, test_loss: 1.2252, test_f1: 0.3070
 epoch: 9, train_loss: 1.2356, test_loss: 1.2189, test_f1: 0.3098
 epoch: 10, train_loss: 1.2395, test_loss: 1.2134, test_f1: 0.3138
 epoch: 11, train_loss: 1.2281, test_loss: 1.2114, test_f1: 0.3337
 epoch: 12, train_loss: 1.2237, test_loss: 1.2061, test_f1: 0.3357
 epoch: 13, train_loss: 1.2214, test_loss: 1.2005, test_f1: 0.3378
 epoch: 14, train_loss: 1.2173, test_loss: 1.1971, test_f1: 0.3566
 epoch: 15, train_loss: 1.2154, test_loss: 1.1953, test_f1: 0.3651
 epoch: 16, train_loss: 1.2139, test_loss: 1.1930, test_f1: 0.3797
 epoch: 17, train_loss: 1.2119, test_loss: 1.1910, test_f1: 0.3899
 epoch: 18, train_loss: 1.2133, test_loss: 1.1890, test_f1: 0.3780
 epoch: 19, train_loss: 1.2014, test_loss: 1.1843, test_f1: 0.3825
 epoch: 20, train_loss: 1.1970, test_loss: 1.1826, test_f1: 0.3829
 epoch: 21, train_loss: 1.2048, test_loss: 1.1790, test_f1: 0.3852
 epoch: 22, train_loss: 1.2013, test_loss: 1.1769, test_f1: 0.3921
 epoch: 23, train_loss: 1.1963, test_loss: 1.1749, test_f1: 0.3947
 epoch: 24, train_loss: 1.1881, test_loss: 1.1719, test_f1: 0.3971
 epoch: 25, train_loss: 1.1870, test_loss: 1.1730, test_f1: 0.4052
 epoch: 26, train_loss: 1.1916, test_loss: 1.1691, test_f1: 0.4002
 epoch: 27, train_loss: 1.1814, test_loss: 1.1689, test_f1: 0.4051
 epoch: 28, train_loss: 1.1779, test_loss: 1.1659, test_f1: 0.4033
 epoch: 29, train_loss: 1.1824, test_loss: 1.1621, test_f1: 0.4019
 epoch: 30, train_loss: 1.1766, test_loss: 1.1623, test_f1: 0.4073
 epoch: 31, train_loss: 1.1733, test_loss: 1.1588, test_f1: 0.4014
 epoch: 32, train_loss: 1.1771, test_loss: 1.1561, test_f1: 0.4137
 epoch: 33, train_loss: 1.1622, test_loss: 1.1557, test_f1: 0.4114
 epoch: 34, train_loss: 1.1686, test_loss: 1.1511, test_f1: 0.4199
 epoch: 35, train_loss: 1.1620, test_loss: 1.1498, test_f1: 0.4138
 epoch: 36, train_loss: 1.1598, test_loss: 1.1475, test_f1: 0.4146
 epoch: 37, train_loss: 1.1587, test_loss: 1.1511, test_f1: 0.4074
 epoch: 38, train_loss: 1.1574, test_loss: 1.1505, test_f1: 0.4078
 epoch: 39, train_loss: 1.1444, test_loss: 1.1445, test_f1: 0.4135
 epoch: 40, train_loss: 1.1559, test_loss: 1.1457, test_f1: 0.4061
 epoch: 41, train_loss: 1.1495, test_loss: 1.1460, test_f1: 0.4143
 epoch: 42, train_loss: 1.1524, test_loss: 1.1399, test_f1: 0.4146
 epoch: 43, train_loss: 1.1457, test_loss: 1.1387, test_f1: 0.4158
 epoch: 44, train_loss: 1.1428, test_loss: 1.1355, test_f1: 0.4159
 epoch: 45, train_loss: 1.1401, test_loss: 1.1342, test_f1: 0.4187
 epoch: 46, train_loss: 1.1379, test_loss: 1.1326, test_f1: 0.4205
 epoch: 47, train_loss: 1.1346, test_loss: 1.1351, test_f1: 0.4304
 epoch: 48, train_loss: 1.1417, test_loss: 1.1342, test_f1: 0.4189
 epoch: 49, train_loss: 1.1306, test_loss: 1.1360, test_f1: 0.4309
 epoch: 50, train_loss: 1.1360, test_loss: 1.1338, test_f1: 0.4302
 epoch: 51, train_loss: 1.1265, test_loss: 1.1345, test_f1: 0.4301
 epoch: 52, train_loss: 1.1245, test_loss: 1.1327, test_f1: 0.4293
 epoch: 53, train_loss: 1.1252, test_loss: 1.1296, test_f1: 0.4326
 epoch: 54, train_loss: 1.1269, test_loss: 1.1261, test_f1: 0.4413
 epoch: 55, train_loss: 1.1262, test_loss: 1.1261, test_f1: 0.4344
 epoch: 56, train_loss: 1.1177, test_loss: 1.1272, test_f1: 0.4348
 epoch: 57, train_loss: 1.1242, test_loss: 1.1256, test_f1: 0.4484
 epoch: 58, train_loss: 1.1182, test_loss: 1.1267, test_f1: 0.4399
 epoch: 59, train_loss: 1.1152, test_loss: 1.1220, test_f1: 0.4389
 epoch: 60, train_loss: 1.1200, test_loss: 1.1229, test_f1: 0.4327
 epoch: 61, train_loss: 1.1177, test_loss: 1.1204, test_f1: 0.4333
 epoch: 62, train_loss: 1.1155, test_loss: 1.1211, test_f1: 0.4359
 epoch: 63, train_loss: 1.1094, test_loss: 1.1253, test_f1: 0.4441
 epoch: 64, train_loss: 1.1139, test_loss: 1.1238, test_f1: 0.4406
 epoch: 65, train_loss: 1.1181, test_loss: 1.1196, test_f1: 0.4324
 epoch: 66, train_loss: 1.1160, test_loss: 1.1192, test_f1: 0.4437
 epoch: 67, train_loss: 1.1102, test_loss: 1.1239, test_f1: 0.4433
 epoch: 68, train_loss: 1.1062, test_loss: 1.1207, test_f1: 0.4464
 epoch: 69, train_loss: 1.1095, test_loss: 1.1223, test_f1: 0.4363
 epoch: 70, train_loss: 1.1071, test_loss: 1.1233, test_f1: 0.4379
 epoch: 71, train_loss: 1.1118, test_loss: 1.1168, test_f1: 0.4412
 epoch: 72, train_loss: 1.1056, test_loss: 1.1169, test_f1: 0.4399
 epoch: 73, train_loss: 1.1007, test_loss: 1.1222, test_f1: 0.4372
 epoch: 74, train_loss: 1.0951, test_loss: 1.1229, test_f1: 0.4415
 epoch: 75, train_loss: 1.1062, test_loss: 1.1161, test_f1: 0.4398
 epoch: 76, train_loss: 1.1060, test_loss: 1.1192, test_f1: 0.4355
 epoch: 77, train_loss: 1.0937, test_loss: 1.1185, test_f1: 0.4328
 epoch: 78, train_loss: 1.1019, test_loss: 1.1185, test_f1: 0.4328
 epoch: 79, train_loss: 1.0943, test_loss: 1.1182, test_f1: 0.4392
 epoch: 80, train_loss: 1.1063, test_loss: 1.1138, test_f1: 0.4388
 epoch: 81, train_loss: 1.0976, test_loss: 1.1143, test_f1: 0.4397
 epoch: 82, train_loss: 1.0948, test_loss: 1.1109, test_f1: 0.4358
 epoch: 83, train_loss: 1.0993, test_loss: 1.1134, test_f1: 0.4350
 epoch: 84, train_loss: 1.1007, test_loss: 1.1160, test_f1: 0.4343
 epoch: 85, train_loss: 1.0923, test_loss: 1.1146, test_f1: 0.4360
 epoch: 86, train_loss: 1.1020, test_loss: 1.1158, test_f1: 0.4388
 epoch: 87, train_loss: 1.1002, test_loss: 1.1169, test_f1: 0.4348
 epoch: 88, train_loss: 1.0879, test_loss: 1.1129, test_f1: 0.4437
 epoch: 89, train_loss: 1.0898, test_loss: 1.1109, test_f1: 0.4381
 epoch: 90, train_loss: 1.0802, test_loss: 1.1071, test_f1: 0.4492
 epoch: 91, train_loss: 1.0873, test_loss: 1.1119, test_f1: 0.4429
 epoch: 92, train_loss: 1.0851, test_loss: 1.1077, test_f1: 0.4470
 epoch: 93, train_loss: 1.0903, test_loss: 1.1141, test_f1: 0.4400
 epoch: 94, train_loss: 1.0805, test_loss: 1.1078, test_f1: 0.4521
 epoch: 95, train_loss: 1.0739, test_loss: 1.1072, test_f1: 0.4457
 epoch: 96, train_loss: 1.0754, test_loss: 1.1095, test_f1: 0.4493
 epoch: 97, train_loss: 1.0891, test_loss: 1.1038, test_f1: 0.4495
 epoch: 98, train_loss: 1.0809, test_loss: 1.1059, test_f1: 0.4395
 epoch: 99, train_loss: 1.0909, test_loss: 1.1103, test_f1: 0.4449
##################ITERATION #7 ****************************************
 epoch: 0, train_loss: 1.3243, test_loss: 1.3056, test_f1: 0.2274
 epoch: 1, train_loss: 1.2876, test_loss: 1.2712, test_f1: 0.2555
 epoch: 2, train_loss: 1.2738, test_loss: 1.2530, test_f1: 0.2555
 epoch: 3, train_loss: 1.2627, test_loss: 1.2431, test_f1: 0.2696
 epoch: 4, train_loss: 1.2531, test_loss: 1.2329, test_f1: 0.2743
 epoch: 5, train_loss: 1.2457, test_loss: 1.2208, test_f1: 0.3060
 epoch: 6, train_loss: 1.2420, test_loss: 1.2153, test_f1: 0.3100
 epoch: 7, train_loss: 1.2346, test_loss: 1.2107, test_f1: 0.3453
 epoch: 8, train_loss: 1.2315, test_loss: 1.2040, test_f1: 0.3747
 epoch: 9, train_loss: 1.2249, test_loss: 1.1975, test_f1: 0.3744
 epoch: 10, train_loss: 1.2216, test_loss: 1.1943, test_f1: 0.3676
 epoch: 11, train_loss: 1.2164, test_loss: 1.1897, test_f1: 0.3740
 epoch: 12, train_loss: 1.2112, test_loss: 1.1861, test_f1: 0.3779
 epoch: 13, train_loss: 1.2053, test_loss: 1.1824, test_f1: 0.3799
 epoch: 14, train_loss: 1.2073, test_loss: 1.1771, test_f1: 0.3872
 epoch: 15, train_loss: 1.2026, test_loss: 1.1737, test_f1: 0.3872
 epoch: 16, train_loss: 1.1982, test_loss: 1.1685, test_f1: 0.3943
 epoch: 17, train_loss: 1.1979, test_loss: 1.1671, test_f1: 0.3878
 epoch: 18, train_loss: 1.1878, test_loss: 1.1642, test_f1: 0.3834
 epoch: 19, train_loss: 1.1930, test_loss: 1.1604, test_f1: 0.3939
 epoch: 20, train_loss: 1.1839, test_loss: 1.1561, test_f1: 0.3977
 epoch: 21, train_loss: 1.1803, test_loss: 1.1554, test_f1: 0.3885
 epoch: 22, train_loss: 1.1786, test_loss: 1.1475, test_f1: 0.3988
 epoch: 23, train_loss: 1.1758, test_loss: 1.1429, test_f1: 0.4064
 epoch: 24, train_loss: 1.1774, test_loss: 1.1403, test_f1: 0.4014
 epoch: 25, train_loss: 1.1693, test_loss: 1.1353, test_f1: 0.4093
 epoch: 26, train_loss: 1.1651, test_loss: 1.1303, test_f1: 0.4063
 epoch: 27, train_loss: 1.1587, test_loss: 1.1276, test_f1: 0.4137
 epoch: 28, train_loss: 1.1546, test_loss: 1.1215, test_f1: 0.4134
 epoch: 29, train_loss: 1.1563, test_loss: 1.1172, test_f1: 0.4136
 epoch: 30, train_loss: 1.1566, test_loss: 1.1120, test_f1: 0.4224
 epoch: 31, train_loss: 1.1492, test_loss: 1.1092, test_f1: 0.4270
 epoch: 32, train_loss: 1.1507, test_loss: 1.1058, test_f1: 0.4249
 epoch: 33, train_loss: 1.1472, test_loss: 1.1033, test_f1: 0.4271
 epoch: 34, train_loss: 1.1358, test_loss: 1.0983, test_f1: 0.4316
 epoch: 35, train_loss: 1.1377, test_loss: 1.0953, test_f1: 0.4123
 epoch: 36, train_loss: 1.1332, test_loss: 1.0894, test_f1: 0.4197
 epoch: 37, train_loss: 1.1319, test_loss: 1.0881, test_f1: 0.4250
 epoch: 38, train_loss: 1.1262, test_loss: 1.0834, test_f1: 0.4172
 epoch: 39, train_loss: 1.1290, test_loss: 1.0785, test_f1: 0.4165
 epoch: 40, train_loss: 1.1222, test_loss: 1.0775, test_f1: 0.4371
 epoch: 41, train_loss: 1.1260, test_loss: 1.0709, test_f1: 0.4352
 epoch: 42, train_loss: 1.1132, test_loss: 1.0721, test_f1: 0.4349
 epoch: 43, train_loss: 1.1204, test_loss: 1.0678, test_f1: 0.4378
 epoch: 44, train_loss: 1.1122, test_loss: 1.0606, test_f1: 0.4364
 epoch: 45, train_loss: 1.1101, test_loss: 1.0596, test_f1: 0.4389
 epoch: 46, train_loss: 1.1121, test_loss: 1.0577, test_f1: 0.4394
 epoch: 47, train_loss: 1.1058, test_loss: 1.0578, test_f1: 0.4445
 epoch: 48, train_loss: 1.1080, test_loss: 1.0560, test_f1: 0.4321
 epoch: 49, train_loss: 1.1022, test_loss: 1.0504, test_f1: 0.4339
 epoch: 50, train_loss: 1.0972, test_loss: 1.0533, test_f1: 0.4376
 epoch: 51, train_loss: 1.0890, test_loss: 1.0537, test_f1: 0.4469
 epoch: 52, train_loss: 1.0944, test_loss: 1.0518, test_f1: 0.4262
 epoch: 53, train_loss: 1.0900, test_loss: 1.0508, test_f1: 0.4263
 epoch: 54, train_loss: 1.0880, test_loss: 1.0470, test_f1: 0.4348
 epoch: 55, train_loss: 1.0864, test_loss: 1.0483, test_f1: 0.4366
 epoch: 56, train_loss: 1.0796, test_loss: 1.0471, test_f1: 0.4327
 epoch: 57, train_loss: 1.0831, test_loss: 1.0455, test_f1: 0.4370
 epoch: 58, train_loss: 1.0846, test_loss: 1.0439, test_f1: 0.4337
 epoch: 59, train_loss: 1.0862, test_loss: 1.0373, test_f1: 0.4309
 epoch: 60, train_loss: 1.0829, test_loss: 1.0404, test_f1: 0.4262
 epoch: 61, train_loss: 1.0760, test_loss: 1.0399, test_f1: 0.4405
 epoch: 62, train_loss: 1.0738, test_loss: 1.0417, test_f1: 0.4233
 epoch: 63, train_loss: 1.0772, test_loss: 1.0388, test_f1: 0.4373
 epoch: 64, train_loss: 1.0791, test_loss: 1.0347, test_f1: 0.4411
 epoch: 65, train_loss: 1.0757, test_loss: 1.0348, test_f1: 0.4447
 epoch: 66, train_loss: 1.0813, test_loss: 1.0324, test_f1: 0.4409
 epoch: 67, train_loss: 1.0677, test_loss: 1.0311, test_f1: 0.4739
 epoch: 68, train_loss: 1.0779, test_loss: 1.0346, test_f1: 0.4508
 epoch: 69, train_loss: 1.0740, test_loss: 1.0334, test_f1: 0.4617
 epoch: 70, train_loss: 1.0642, test_loss: 1.0287, test_f1: 0.4699
 epoch: 71, train_loss: 1.0683, test_loss: 1.0306, test_f1: 0.4714
 epoch: 72, train_loss: 1.0621, test_loss: 1.0316, test_f1: 0.4620
 epoch: 73, train_loss: 1.0661, test_loss: 1.0297, test_f1: 0.4710
 epoch: 74, train_loss: 1.0668, test_loss: 1.0279, test_f1: 0.4688
 epoch: 75, train_loss: 1.0652, test_loss: 1.0292, test_f1: 0.4453
 epoch: 76, train_loss: 1.0596, test_loss: 1.0305, test_f1: 0.4772
 epoch: 77, train_loss: 1.0582, test_loss: 1.0265, test_f1: 0.4544
 epoch: 78, train_loss: 1.0563, test_loss: 1.0302, test_f1: 0.4438
 epoch: 79, train_loss: 1.0467, test_loss: 1.0266, test_f1: 0.4688
 epoch: 80, train_loss: 1.0578, test_loss: 1.0241, test_f1: 0.4750
 epoch: 81, train_loss: 1.0590, test_loss: 1.0249, test_f1: 0.4761
 epoch: 82, train_loss: 1.0625, test_loss: 1.0231, test_f1: 0.4581
 epoch: 83, train_loss: 1.0546, test_loss: 1.0229, test_f1: 0.4666
 epoch: 84, train_loss: 1.0530, test_loss: 1.0222, test_f1: 0.4728
 epoch: 85, train_loss: 1.0478, test_loss: 1.0223, test_f1: 0.4951
 epoch: 86, train_loss: 1.0458, test_loss: 1.0221, test_f1: 0.4907
 epoch: 87, train_loss: 1.0538, test_loss: 1.0241, test_f1: 0.4774
 epoch: 88, train_loss: 1.0485, test_loss: 1.0222, test_f1: 0.4765
 epoch: 89, train_loss: 1.0453, test_loss: 1.0210, test_f1: 0.4712
 epoch: 90, train_loss: 1.0463, test_loss: 1.0196, test_f1: 0.4632
 epoch: 91, train_loss: 1.0428, test_loss: 1.0240, test_f1: 0.4598
 epoch: 92, train_loss: 1.0471, test_loss: 1.0203, test_f1: 0.4762
 epoch: 93, train_loss: 1.0435, test_loss: 1.0236, test_f1: 0.4781
 epoch: 94, train_loss: 1.0402, test_loss: 1.0262, test_f1: 0.4698
 epoch: 95, train_loss: 1.0483, test_loss: 1.0257, test_f1: 0.4763
 epoch: 96, train_loss: 1.0512, test_loss: 1.0254, test_f1: 0.4850
 epoch: 97, train_loss: 1.0422, test_loss: 1.0205, test_f1: 0.4703
 epoch: 98, train_loss: 1.0264, test_loss: 1.0197, test_f1: 0.4685
 epoch: 99, train_loss: 1.0288, test_loss: 1.0253, test_f1: 0.4715
##################ITERATION #8 ****************************************
 epoch: 0, train_loss: 1.3421, test_loss: 1.3478, test_f1: 0.2274
 epoch: 1, train_loss: 1.3051, test_loss: 1.3389, test_f1: 0.2274
 epoch: 2, train_loss: 1.2787, test_loss: 1.3012, test_f1: 0.2274
 epoch: 3, train_loss: 1.2718, test_loss: 1.2789, test_f1: 0.2278
 epoch: 4, train_loss: 1.2661, test_loss: 1.2652, test_f1: 0.2375
 epoch: 5, train_loss: 1.2605, test_loss: 1.2558, test_f1: 0.2709
 epoch: 6, train_loss: 1.2523, test_loss: 1.2484, test_f1: 0.2674
 epoch: 7, train_loss: 1.2428, test_loss: 1.2387, test_f1: 0.2811
 epoch: 8, train_loss: 1.2409, test_loss: 1.2320, test_f1: 0.3073
 epoch: 9, train_loss: 1.2368, test_loss: 1.2289, test_f1: 0.3351
 epoch: 10, train_loss: 1.2307, test_loss: 1.2234, test_f1: 0.3472
 epoch: 11, train_loss: 1.2288, test_loss: 1.2128, test_f1: 0.3520
 epoch: 12, train_loss: 1.2195, test_loss: 1.2043, test_f1: 0.3638
 epoch: 13, train_loss: 1.2141, test_loss: 1.2008, test_f1: 0.3657
 epoch: 14, train_loss: 1.2085, test_loss: 1.1970, test_f1: 0.3710
 epoch: 15, train_loss: 1.2098, test_loss: 1.1954, test_f1: 0.3802
 epoch: 16, train_loss: 1.2046, test_loss: 1.1914, test_f1: 0.3795
 epoch: 17, train_loss: 1.2044, test_loss: 1.1878, test_f1: 0.3812
 epoch: 18, train_loss: 1.2044, test_loss: 1.1815, test_f1: 0.3857
 epoch: 19, train_loss: 1.1958, test_loss: 1.1765, test_f1: 0.3881
 epoch: 20, train_loss: 1.1895, test_loss: 1.1688, test_f1: 0.3963
 epoch: 21, train_loss: 1.1836, test_loss: 1.1669, test_f1: 0.3985
 epoch: 22, train_loss: 1.1910, test_loss: 1.1635, test_f1: 0.4036
 epoch: 23, train_loss: 1.1813, test_loss: 1.1611, test_f1: 0.4020
 epoch: 24, train_loss: 1.1801, test_loss: 1.1567, test_f1: 0.4131
 epoch: 25, train_loss: 1.1865, test_loss: 1.1516, test_f1: 0.4187
 epoch: 26, train_loss: 1.1772, test_loss: 1.1501, test_f1: 0.4128
 epoch: 27, train_loss: 1.1784, test_loss: 1.1478, test_f1: 0.4052
 epoch: 28, train_loss: 1.1791, test_loss: 1.1466, test_f1: 0.4058
 epoch: 29, train_loss: 1.1731, test_loss: 1.1471, test_f1: 0.4087
 epoch: 30, train_loss: 1.1687, test_loss: 1.1451, test_f1: 0.3982
 epoch: 31, train_loss: 1.1773, test_loss: 1.1401, test_f1: 0.4089
 epoch: 32, train_loss: 1.1627, test_loss: 1.1352, test_f1: 0.4151
 epoch: 33, train_loss: 1.1599, test_loss: 1.1345, test_f1: 0.4122
 epoch: 34, train_loss: 1.1534, test_loss: 1.1319, test_f1: 0.4126
 epoch: 35, train_loss: 1.1640, test_loss: 1.1284, test_f1: 0.4159
 epoch: 36, train_loss: 1.1594, test_loss: 1.1298, test_f1: 0.4177
 epoch: 37, train_loss: 1.1504, test_loss: 1.1284, test_f1: 0.4187
 epoch: 38, train_loss: 1.1505, test_loss: 1.1267, test_f1: 0.4178
 epoch: 39, train_loss: 1.1490, test_loss: 1.1220, test_f1: 0.4177
 epoch: 40, train_loss: 1.1412, test_loss: 1.1215, test_f1: 0.4144
 epoch: 41, train_loss: 1.1486, test_loss: 1.1229, test_f1: 0.4221
 epoch: 42, train_loss: 1.1375, test_loss: 1.1192, test_f1: 0.4274
 epoch: 43, train_loss: 1.1326, test_loss: 1.1210, test_f1: 0.4150
 epoch: 44, train_loss: 1.1375, test_loss: 1.1103, test_f1: 0.4217
 epoch: 45, train_loss: 1.1375, test_loss: 1.1090, test_f1: 0.4296
 epoch: 46, train_loss: 1.1360, test_loss: 1.1105, test_f1: 0.4210
 epoch: 47, train_loss: 1.1300, test_loss: 1.1028, test_f1: 0.4282
 epoch: 48, train_loss: 1.1307, test_loss: 1.1040, test_f1: 0.4265
 epoch: 49, train_loss: 1.1313, test_loss: 1.1064, test_f1: 0.4176
 epoch: 50, train_loss: 1.1301, test_loss: 1.1014, test_f1: 0.4251
 epoch: 51, train_loss: 1.1270, test_loss: 1.1008, test_f1: 0.4219
 epoch: 52, train_loss: 1.1208, test_loss: 1.0985, test_f1: 0.4285
 epoch: 53, train_loss: 1.1325, test_loss: 1.0973, test_f1: 0.4298
 epoch: 54, train_loss: 1.1290, test_loss: 1.0958, test_f1: 0.4262
 epoch: 55, train_loss: 1.1210, test_loss: 1.1016, test_f1: 0.4235
 epoch: 56, train_loss: 1.1132, test_loss: 1.0981, test_f1: 0.4266
 epoch: 57, train_loss: 1.1249, test_loss: 1.0982, test_f1: 0.4300
 epoch: 58, train_loss: 1.1181, test_loss: 1.0935, test_f1: 0.4324
 epoch: 59, train_loss: 1.1208, test_loss: 1.0961, test_f1: 0.4236
 epoch: 60, train_loss: 1.1142, test_loss: 1.0931, test_f1: 0.4287
 epoch: 61, train_loss: 1.1098, test_loss: 1.0944, test_f1: 0.4273
 epoch: 62, train_loss: 1.1175, test_loss: 1.0894, test_f1: 0.4254
 epoch: 63, train_loss: 1.1187, test_loss: 1.0870, test_f1: 0.4337
 epoch: 64, train_loss: 1.1168, test_loss: 1.0906, test_f1: 0.4262
 epoch: 65, train_loss: 1.1011, test_loss: 1.0876, test_f1: 0.4358
 epoch: 66, train_loss: 1.1160, test_loss: 1.0880, test_f1: 0.4375
 epoch: 67, train_loss: 1.1177, test_loss: 1.0894, test_f1: 0.4330
 epoch: 68, train_loss: 1.1152, test_loss: 1.0909, test_f1: 0.4332
 epoch: 69, train_loss: 1.0976, test_loss: 1.0902, test_f1: 0.4250
 epoch: 70, train_loss: 1.1022, test_loss: 1.0885, test_f1: 0.4282
 epoch: 71, train_loss: 1.1073, test_loss: 1.0846, test_f1: 0.4320
 epoch: 72, train_loss: 1.1154, test_loss: 1.0843, test_f1: 0.4350
 epoch: 73, train_loss: 1.1094, test_loss: 1.0836, test_f1: 0.4356
 epoch: 74, train_loss: 1.1083, test_loss: 1.0855, test_f1: 0.4273
 epoch: 75, train_loss: 1.1087, test_loss: 1.0799, test_f1: 0.4413
 epoch: 76, train_loss: 1.1049, test_loss: 1.0833, test_f1: 0.4414
 epoch: 77, train_loss: 1.0970, test_loss: 1.0773, test_f1: 0.4435
 epoch: 78, train_loss: 1.0950, test_loss: 1.0826, test_f1: 0.4305
 epoch: 79, train_loss: 1.0937, test_loss: 1.0798, test_f1: 0.4336
 epoch: 80, train_loss: 1.1037, test_loss: 1.0808, test_f1: 0.4324
 epoch: 81, train_loss: 1.0938, test_loss: 1.0772, test_f1: 0.4399
 epoch: 82, train_loss: 1.0989, test_loss: 1.0741, test_f1: 0.4415
 epoch: 83, train_loss: 1.1020, test_loss: 1.0721, test_f1: 0.4405
 epoch: 84, train_loss: 1.0950, test_loss: 1.0758, test_f1: 0.4428
 epoch: 85, train_loss: 1.0931, test_loss: 1.0754, test_f1: 0.4352
 epoch: 86, train_loss: 1.0935, test_loss: 1.0752, test_f1: 0.4316
 epoch: 87, train_loss: 1.0947, test_loss: 1.0799, test_f1: 0.4365
 epoch: 88, train_loss: 1.0962, test_loss: 1.0782, test_f1: 0.4318
 epoch: 89, train_loss: 1.0947, test_loss: 1.0762, test_f1: 0.4298
 epoch: 90, train_loss: 1.0955, test_loss: 1.0795, test_f1: 0.4325
 epoch: 91, train_loss: 1.0904, test_loss: 1.0766, test_f1: 0.4355
 epoch: 92, train_loss: 1.0909, test_loss: 1.0742, test_f1: 0.4325
 epoch: 93, train_loss: 1.0886, test_loss: 1.0721, test_f1: 0.4287
 epoch: 94, train_loss: 1.0990, test_loss: 1.0692, test_f1: 0.4384
 epoch: 95, train_loss: 1.0841, test_loss: 1.0709, test_f1: 0.4406
 epoch: 96, train_loss: 1.0928, test_loss: 1.0678, test_f1: 0.4346
 epoch: 97, train_loss: 1.0810, test_loss: 1.0747, test_f1: 0.4353
 epoch: 98, train_loss: 1.0910, test_loss: 1.0672, test_f1: 0.4345
 epoch: 99, train_loss: 1.0942, test_loss: 1.0707, test_f1: 0.4409
##################ITERATION #9 ****************************************
 epoch: 0, train_loss: 1.3300, test_loss: 1.3101, test_f1: 0.2274
 epoch: 1, train_loss: 1.2953, test_loss: 1.2954, test_f1: 0.2300
 epoch: 2, train_loss: 1.2846, test_loss: 1.2722, test_f1: 0.2341
 epoch: 3, train_loss: 1.2735, test_loss: 1.2606, test_f1: 0.2539
 epoch: 4, train_loss: 1.2604, test_loss: 1.2491, test_f1: 0.2780
 epoch: 5, train_loss: 1.2595, test_loss: 1.2389, test_f1: 0.2767
 epoch: 6, train_loss: 1.2571, test_loss: 1.2305, test_f1: 0.3018
 epoch: 7, train_loss: 1.2449, test_loss: 1.2250, test_f1: 0.3304
 epoch: 8, train_loss: 1.2414, test_loss: 1.2174, test_f1: 0.3355
 epoch: 9, train_loss: 1.2330, test_loss: 1.2107, test_f1: 0.3545
 epoch: 10, train_loss: 1.2309, test_loss: 1.2054, test_f1: 0.3559
 epoch: 11, train_loss: 1.2315, test_loss: 1.2027, test_f1: 0.3576
 epoch: 12, train_loss: 1.2172, test_loss: 1.1963, test_f1: 0.3742
 epoch: 13, train_loss: 1.2122, test_loss: 1.1904, test_f1: 0.3723
 epoch: 14, train_loss: 1.2114, test_loss: 1.1860, test_f1: 0.3793
 epoch: 15, train_loss: 1.2105, test_loss: 1.1790, test_f1: 0.3829
 epoch: 16, train_loss: 1.2061, test_loss: 1.1748, test_f1: 0.3857
 epoch: 17, train_loss: 1.1944, test_loss: 1.1674, test_f1: 0.3856
 epoch: 18, train_loss: 1.1967, test_loss: 1.1646, test_f1: 0.3938
 epoch: 19, train_loss: 1.2037, test_loss: 1.1635, test_f1: 0.3945
 epoch: 20, train_loss: 1.1892, test_loss: 1.1585, test_f1: 0.4031
 epoch: 21, train_loss: 1.1811, test_loss: 1.1527, test_f1: 0.4092
 epoch: 22, train_loss: 1.1870, test_loss: 1.1485, test_f1: 0.4047
 epoch: 23, train_loss: 1.1793, test_loss: 1.1481, test_f1: 0.4111
 epoch: 24, train_loss: 1.1662, test_loss: 1.1425, test_f1: 0.4101
 epoch: 25, train_loss: 1.1626, test_loss: 1.1390, test_f1: 0.4091
 epoch: 26, train_loss: 1.1660, test_loss: 1.1378, test_f1: 0.4024
 epoch: 27, train_loss: 1.1642, test_loss: 1.1301, test_f1: 0.4035
 epoch: 28, train_loss: 1.1602, test_loss: 1.1258, test_f1: 0.4151
 epoch: 29, train_loss: 1.1687, test_loss: 1.1260, test_f1: 0.4178
 epoch: 30, train_loss: 1.1574, test_loss: 1.1251, test_f1: 0.4125
 epoch: 31, train_loss: 1.1570, test_loss: 1.1207, test_f1: 0.4071
 epoch: 32, train_loss: 1.1487, test_loss: 1.1166, test_f1: 0.4236
 epoch: 33, train_loss: 1.1459, test_loss: 1.1183, test_f1: 0.3947
 epoch: 34, train_loss: 1.1406, test_loss: 1.1174, test_f1: 0.4086
 epoch: 35, train_loss: 1.1463, test_loss: 1.1147, test_f1: 0.4030
 epoch: 36, train_loss: 1.1394, test_loss: 1.1116, test_f1: 0.4148
 epoch: 37, train_loss: 1.1310, test_loss: 1.1087, test_f1: 0.4196
 epoch: 38, train_loss: 1.1305, test_loss: 1.1089, test_f1: 0.4154
 epoch: 39, train_loss: 1.1272, test_loss: 1.1068, test_f1: 0.4111
 epoch: 40, train_loss: 1.1224, test_loss: 1.1017, test_f1: 0.4197
 epoch: 41, train_loss: 1.1286, test_loss: 1.0997, test_f1: 0.4231
 epoch: 42, train_loss: 1.1199, test_loss: 1.1016, test_f1: 0.4186
 epoch: 43, train_loss: 1.1207, test_loss: 1.0992, test_f1: 0.4188
 epoch: 44, train_loss: 1.1198, test_loss: 1.0944, test_f1: 0.4213
 epoch: 45, train_loss: 1.1121, test_loss: 1.0950, test_f1: 0.4176
 epoch: 46, train_loss: 1.1039, test_loss: 1.0937, test_f1: 0.4146
 epoch: 47, train_loss: 1.1000, test_loss: 1.0921, test_f1: 0.4134
 epoch: 48, train_loss: 1.0996, test_loss: 1.0912, test_f1: 0.4143
 epoch: 49, train_loss: 1.1017, test_loss: 1.0898, test_f1: 0.4179
 epoch: 50, train_loss: 1.1001, test_loss: 1.0948, test_f1: 0.4153
 epoch: 51, train_loss: 1.0925, test_loss: 1.0914, test_f1: 0.4162
 epoch: 52, train_loss: 1.0973, test_loss: 1.0924, test_f1: 0.4193
 epoch: 53, train_loss: 1.0915, test_loss: 1.0896, test_f1: 0.4266
 epoch: 54, train_loss: 1.0908, test_loss: 1.0839, test_f1: 0.4307
 epoch: 55, train_loss: 1.0777, test_loss: 1.0891, test_f1: 0.4159
 epoch: 56, train_loss: 1.0850, test_loss: 1.0884, test_f1: 0.4163
 epoch: 57, train_loss: 1.0803, test_loss: 1.0922, test_f1: 0.4121
 epoch: 58, train_loss: 1.0866, test_loss: 1.0895, test_f1: 0.4277
 epoch: 59, train_loss: 1.0883, test_loss: 1.0891, test_f1: 0.4178
 epoch: 60, train_loss: 1.0826, test_loss: 1.0907, test_f1: 0.4169
 epoch: 61, train_loss: 1.0836, test_loss: 1.0901, test_f1: 0.4211
 epoch: 62, train_loss: 1.0907, test_loss: 1.0906, test_f1: 0.4245
 epoch: 63, train_loss: 1.0831, test_loss: 1.0846, test_f1: 0.4226
 epoch: 64, train_loss: 1.0820, test_loss: 1.0878, test_f1: 0.4199
 epoch: 65, train_loss: 1.0797, test_loss: 1.0837, test_f1: 0.4221
 epoch: 66, train_loss: 1.0749, test_loss: 1.0859, test_f1: 0.4194
 epoch: 67, train_loss: 1.0737, test_loss: 1.0854, test_f1: 0.4245
 epoch: 68, train_loss: 1.0728, test_loss: 1.0856, test_f1: 0.4197
 epoch: 69, train_loss: 1.0744, test_loss: 1.0850, test_f1: 0.4186
 epoch: 70, train_loss: 1.0763, test_loss: 1.0841, test_f1: 0.4198
 epoch: 71, train_loss: 1.0674, test_loss: 1.0834, test_f1: 0.4215
 epoch: 72, train_loss: 1.0644, test_loss: 1.0836, test_f1: 0.4239
 epoch: 73, train_loss: 1.0625, test_loss: 1.0816, test_f1: 0.4275
 epoch: 74, train_loss: 1.0667, test_loss: 1.0796, test_f1: 0.4276
 epoch: 75, train_loss: 1.0623, test_loss: 1.0852, test_f1: 0.4297
 epoch: 76, train_loss: 1.0643, test_loss: 1.0807, test_f1: 0.4239
 epoch: 77, train_loss: 1.0563, test_loss: 1.0750, test_f1: 0.4243
 epoch: 78, train_loss: 1.0618, test_loss: 1.0778, test_f1: 0.4258
 epoch: 79, train_loss: 1.0599, test_loss: 1.0784, test_f1: 0.4261
 epoch: 80, train_loss: 1.0536, test_loss: 1.0793, test_f1: 0.4227
 epoch: 81, train_loss: 1.0626, test_loss: 1.0816, test_f1: 0.4253
 epoch: 82, train_loss: 1.0567, test_loss: 1.0800, test_f1: 0.4253
 epoch: 83, train_loss: 1.0569, test_loss: 1.0788, test_f1: 0.4260
 epoch: 84, train_loss: 1.0498, test_loss: 1.0793, test_f1: 0.4278
 epoch: 85, train_loss: 1.0494, test_loss: 1.0780, test_f1: 0.4346
 epoch: 86, train_loss: 1.0605, test_loss: 1.0771, test_f1: 0.4268
 epoch: 87, train_loss: 1.0497, test_loss: 1.0801, test_f1: 0.4246
 epoch: 88, train_loss: 1.0465, test_loss: 1.0784, test_f1: 0.4205
 epoch: 89, train_loss: 1.0411, test_loss: 1.0772, test_f1: 0.4312
 epoch: 90, train_loss: 1.0531, test_loss: 1.0769, test_f1: 0.4225
 epoch: 91, train_loss: 1.0326, test_loss: 1.0762, test_f1: 0.4293
 epoch: 92, train_loss: 1.0382, test_loss: 1.0801, test_f1: 0.4280
 epoch: 93, train_loss: 1.0493, test_loss: 1.0782, test_f1: 0.4275
 epoch: 94, train_loss: 1.0412, test_loss: 1.0760, test_f1: 0.4191
 epoch: 95, train_loss: 1.0415, test_loss: 1.0746, test_f1: 0.4311
 epoch: 96, train_loss: 1.0442, test_loss: 1.0760, test_f1: 0.4237
 epoch: 97, train_loss: 1.0401, test_loss: 1.0817, test_f1: 0.4278
 epoch: 98, train_loss: 1.0392, test_loss: 1.0770, test_f1: 0.4249
 epoch: 99, train_loss: 1.0373, test_loss: 1.0751, test_f1: 0.4175

Training completed in 511.25 seconds
Best F1: 0.4951 at epoch 85
Mean F1 across iterations: 0.4564  0.0206
========================FINAL RESULTS================================
FEGIN weighted F1: 0.4951  0.0206
python main.py --data ltspice_examples --representation component_component --model FEGIN --layers 5 --hiddens 32 --batch_size 128 --lr 0.0001 --emb_size 512 --epochs 100 --save_appendix component_component_L5_H32_BS128_LR0.0001_E512 --no_val
-----



STDERR:
  File "main.py", line 370, in <module>
    main()
  File "main.py", line 254, in main
    dataset = dataset_class(
  File "/home/philip/projects/ltspice_examples_code_repo/Circuit-Completion-Using-GNNs/component_classification_with_link_prediction_head/evaluation/FEGIN/kernel/circuit_datasets.py", line 15, in __init__
    self.data, self.slices = torch.load(self.processed_paths[0])
  File "/home/philip/.local/lib/python3.8/site-packages/torch/serialization.py", line 1040, in load
    warnings.warn(
  File "/usr/lib/python3.8/warnings.py", line 109, in _showwarnmsg
    sw(msg.message, msg.category, msg.filename, msg.lineno,
  File "main.py", line 47, in warn_with_traceback
    traceback.print_stack(file=log)
/home/philip/projects/ltspice_examples_code_repo/Circuit-Completion-Using-GNNs/component_classification_with_link_prediction_head/evaluation/FEGIN/kernel/circuit_datasets.py:15: FutureWarning: You are using `torch.load` with `weights_only=False` (the current default value), which uses the default pickle module implicitly. It is possible to construct malicious pickle data which will execute arbitrary code during unpickling (See https://github.com/pytorch/pytorch/blob/main/SECURITY.md#untrusted-models for more details). In a future release, the default value for `weights_only` will be flipped to `True`. This limits the functions that could be executed during unpickling. Arbitrary objects will no longer be allowed to be loaded via this mode unless they are explicitly allowlisted by the user via `torch.serialization.add_safe_globals`. We recommend you start setting `weights_only=True` for any use case where you don't have full control of the loaded file. Please open an issue on GitHub for any issues related to this experimental feature.
  self.data, self.slices = torch.load(self.processed_paths[0])
