STDOUT:
Results will be saved in /home/philip/projects/ltspice_examples_code_repo/Circuit-Completion-Using-GNNs/component_classification_with_link_prediction_head/evaluation/FEGIN/results/model_FEGIN_dataset_ltspice_examples
Command line input: python main.py --data ltspice_examples --representation component_pin_net --model FEGIN --layers 6 --hiddens 128 --batch_size 128 --lr 0.01 --emb_size 250 --epochs 100 --save_appendix component_pin_net_L6_H128_BS128_LR0.01_E250 --no_val
 is saved.
-----
ltspice_examples - FEGIN
Using 6 layers, 128 hidden units, h = 2
Loading component_pin_net representation dataset
ENTERED
Training FEGIN on component_pin_net representation
Train: 3558, Test: 846
##################ITERATION #0 ****************************************
 epoch: 0, train_loss: 1.1761, test_loss: 1.2369, test_f1: 0.2887
 epoch: 1, train_loss: 1.0208, test_loss: 0.9800, test_f1: 0.4502
 epoch: 2, train_loss: 0.9609, test_loss: 0.9498, test_f1: 0.5239
 epoch: 3, train_loss: 0.9373, test_loss: 1.1086, test_f1: 0.4545
 epoch: 4, train_loss: 0.9303, test_loss: 1.0026, test_f1: 0.4973
 epoch: 5, train_loss: 0.9004, test_loss: 0.9088, test_f1: 0.5333
 epoch: 6, train_loss: 0.8786, test_loss: 0.9506, test_f1: 0.4905
 epoch: 7, train_loss: 0.8871, test_loss: 0.8735, test_f1: 0.5820
 epoch: 8, train_loss: 0.8246, test_loss: 0.9673, test_f1: 0.5055
 epoch: 9, train_loss: 0.8296, test_loss: 0.8628, test_f1: 0.5797
 epoch: 10, train_loss: 0.8188, test_loss: 1.0500, test_f1: 0.4761
 epoch: 11, train_loss: 0.8044, test_loss: 1.1877, test_f1: 0.5015
 epoch: 12, train_loss: 0.8062, test_loss: 0.9080, test_f1: 0.5857
 epoch: 13, train_loss: 0.7760, test_loss: 0.9123, test_f1: 0.5363
 epoch: 14, train_loss: 0.7574, test_loss: 1.0171, test_f1: 0.5897
 epoch: 15, train_loss: 0.7372, test_loss: 0.7833, test_f1: 0.6518
 epoch: 16, train_loss: 0.7487, test_loss: 0.9894, test_f1: 0.5852
 epoch: 17, train_loss: 0.7139, test_loss: 0.8668, test_f1: 0.5897
 epoch: 18, train_loss: 0.7282, test_loss: 0.9336, test_f1: 0.5951
 epoch: 19, train_loss: 0.7019, test_loss: 0.9403, test_f1: 0.6151
 epoch: 20, train_loss: 0.6896, test_loss: 0.8713, test_f1: 0.6338
 epoch: 21, train_loss: 0.6889, test_loss: 0.9801, test_f1: 0.6508
 epoch: 22, train_loss: 0.6854, test_loss: 1.0791, test_f1: 0.5779
 epoch: 23, train_loss: 0.7011, test_loss: 0.8107, test_f1: 0.6308
 epoch: 24, train_loss: 0.6954, test_loss: 0.9253, test_f1: 0.6272
 epoch: 25, train_loss: 0.6764, test_loss: 0.9536, test_f1: 0.6193
 epoch: 26, train_loss: 0.6617, test_loss: 1.0055, test_f1: 0.5933
 epoch: 27, train_loss: 0.6466, test_loss: 0.8663, test_f1: 0.6690
 epoch: 28, train_loss: 0.6346, test_loss: 0.9747, test_f1: 0.6409
 epoch: 29, train_loss: 0.6272, test_loss: 0.8827, test_f1: 0.6343
 epoch: 30, train_loss: 0.6264, test_loss: 0.8596, test_f1: 0.6338
 epoch: 31, train_loss: 0.6065, test_loss: 1.0450, test_f1: 0.6339
 epoch: 32, train_loss: 0.5915, test_loss: 0.9972, test_f1: 0.6763
 epoch: 33, train_loss: 0.5884, test_loss: 1.0197, test_f1: 0.6319
 epoch: 34, train_loss: 0.5836, test_loss: 1.0528, test_f1: 0.6112
 epoch: 35, train_loss: 0.5809, test_loss: 1.2085, test_f1: 0.6367
 epoch: 36, train_loss: 0.5820, test_loss: 0.8603, test_f1: 0.6628
 epoch: 37, train_loss: 0.5522, test_loss: 0.9349, test_f1: 0.6174
 epoch: 38, train_loss: 0.5728, test_loss: 0.9212, test_f1: 0.6069
 epoch: 39, train_loss: 0.5777, test_loss: 0.8891, test_f1: 0.6188
 epoch: 40, train_loss: 0.5688, test_loss: 0.8873, test_f1: 0.6294
 epoch: 41, train_loss: 0.5691, test_loss: 0.8886, test_f1: 0.6376
 epoch: 42, train_loss: 0.5347, test_loss: 0.9506, test_f1: 0.6562
 epoch: 43, train_loss: 0.5826, test_loss: 0.8412, test_f1: 0.6486
 epoch: 44, train_loss: 0.5220, test_loss: 1.0020, test_f1: 0.6639
 epoch: 45, train_loss: 0.5172, test_loss: 0.9873, test_f1: 0.6549
 epoch: 46, train_loss: 0.5383, test_loss: 1.0861, test_f1: 0.6375
 epoch: 47, train_loss: 0.5338, test_loss: 0.9516, test_f1: 0.6413
 epoch: 48, train_loss: 0.5333, test_loss: 1.1388, test_f1: 0.6653
 epoch: 49, train_loss: 0.5087, test_loss: 0.9232, test_f1: 0.6911
 epoch: 50, train_loss: 0.5011, test_loss: 0.8073, test_f1: 0.6783
 epoch: 51, train_loss: 0.4516, test_loss: 1.0919, test_f1: 0.6843
 epoch: 52, train_loss: 0.4233, test_loss: 1.0446, test_f1: 0.6764
 epoch: 53, train_loss: 0.4211, test_loss: 1.1224, test_f1: 0.6585
 epoch: 54, train_loss: 0.4210, test_loss: 1.0663, test_f1: 0.6594
 epoch: 55, train_loss: 0.3942, test_loss: 1.0860, test_f1: 0.6786
 epoch: 56, train_loss: 0.3922, test_loss: 0.9647, test_f1: 0.6867
 epoch: 57, train_loss: 0.4122, test_loss: 0.9119, test_f1: 0.6837
 epoch: 58, train_loss: 0.4024, test_loss: 0.9170, test_f1: 0.6689
 epoch: 59, train_loss: 0.3781, test_loss: 1.1668, test_f1: 0.6518
 epoch: 60, train_loss: 0.3705, test_loss: 1.0666, test_f1: 0.6770
 epoch: 61, train_loss: 0.3682, test_loss: 1.0772, test_f1: 0.6813
 epoch: 62, train_loss: 0.3689, test_loss: 1.2576, test_f1: 0.6464
 epoch: 63, train_loss: 0.3872, test_loss: 1.0620, test_f1: 0.6793
 epoch: 64, train_loss: 0.3532, test_loss: 1.0034, test_f1: 0.6942
 epoch: 65, train_loss: 0.3695, test_loss: 1.0880, test_f1: 0.6718
 epoch: 66, train_loss: 0.3448, test_loss: 1.1842, test_f1: 0.6806
 epoch: 67, train_loss: 0.3322, test_loss: 1.1272, test_f1: 0.6856
 epoch: 68, train_loss: 0.3586, test_loss: 1.2355, test_f1: 0.6784
 epoch: 69, train_loss: 0.3564, test_loss: 1.0814, test_f1: 0.6814
 epoch: 70, train_loss: 0.3408, test_loss: 1.0863, test_f1: 0.6848
 epoch: 71, train_loss: 0.3194, test_loss: 1.0859, test_f1: 0.6941
 epoch: 72, train_loss: 0.3127, test_loss: 1.4262, test_f1: 0.6705
 epoch: 73, train_loss: 0.3338, test_loss: 1.0136, test_f1: 0.6830
 epoch: 74, train_loss: 0.3138, test_loss: 1.1674, test_f1: 0.6833
 epoch: 75, train_loss: 0.3343, test_loss: 1.1827, test_f1: 0.6697
 epoch: 76, train_loss: 0.3049, test_loss: 1.2725, test_f1: 0.6949
 epoch: 77, train_loss: 0.3121, test_loss: 1.1566, test_f1: 0.6830
 epoch: 78, train_loss: 0.3281, test_loss: 1.1365, test_f1: 0.6879
 epoch: 79, train_loss: 0.3249, test_loss: 1.1092, test_f1: 0.6916
 epoch: 80, train_loss: 0.2928, test_loss: 1.3012, test_f1: 0.6638
 epoch: 81, train_loss: 0.3253, test_loss: 1.3736, test_f1: 0.6806
 epoch: 82, train_loss: 0.2834, test_loss: 1.2699, test_f1: 0.6928
 epoch: 83, train_loss: 0.3013, test_loss: 1.1047, test_f1: 0.6810
 epoch: 84, train_loss: 0.3255, test_loss: 1.3357, test_f1: 0.6760
 epoch: 85, train_loss: 0.2885, test_loss: 1.5832, test_f1: 0.6681
 epoch: 86, train_loss: 0.2947, test_loss: 1.2283, test_f1: 0.6872
 epoch: 87, train_loss: 0.2851, test_loss: 1.2836, test_f1: 0.6857
 epoch: 88, train_loss: 0.2601, test_loss: 1.6036, test_f1: 0.6610
 epoch: 89, train_loss: 0.2757, test_loss: 1.2255, test_f1: 0.6957
 epoch: 90, train_loss: 0.2866, test_loss: 1.4188, test_f1: 0.6653
 epoch: 91, train_loss: 0.2945, test_loss: 1.1514, test_f1: 0.6948
 epoch: 92, train_loss: 0.2871, test_loss: 1.0328, test_f1: 0.6881
 epoch: 93, train_loss: 0.2866, test_loss: 1.1496, test_f1: 0.7006
 epoch: 94, train_loss: 0.2786, test_loss: 1.2777, test_f1: 0.6843
 epoch: 95, train_loss: 0.2763, test_loss: 1.3575, test_f1: 0.7064
 epoch: 96, train_loss: 0.2822, test_loss: 1.0879, test_f1: 0.7030
 epoch: 97, train_loss: 0.2687, test_loss: 1.2355, test_f1: 0.7056
 epoch: 98, train_loss: 0.2541, test_loss: 0.9395, test_f1: 0.7073
 epoch: 99, train_loss: 0.2454, test_loss: 1.4450, test_f1: 0.7022
##################ITERATION #1 ****************************************
 epoch: 0, train_loss: 1.2519, test_loss: 1.1119, test_f1: 0.3703
 epoch: 1, train_loss: 1.0293, test_loss: 1.0576, test_f1: 0.4231
 epoch: 2, train_loss: 0.9801, test_loss: 0.9912, test_f1: 0.4865
 epoch: 3, train_loss: 0.9658, test_loss: 0.9774, test_f1: 0.4745
 epoch: 4, train_loss: 0.9771, test_loss: 0.9923, test_f1: 0.5092
 epoch: 5, train_loss: 0.9652, test_loss: 1.0167, test_f1: 0.4620
 epoch: 6, train_loss: 0.9368, test_loss: 1.0313, test_f1: 0.5217
 epoch: 7, train_loss: 0.9440, test_loss: 1.0769, test_f1: 0.5107
 epoch: 8, train_loss: 0.9223, test_loss: 1.0388, test_f1: 0.4905
 epoch: 9, train_loss: 0.9150, test_loss: 1.0049, test_f1: 0.4955
 epoch: 10, train_loss: 0.9103, test_loss: 1.1072, test_f1: 0.4886
 epoch: 11, train_loss: 0.9019, test_loss: 0.9642, test_f1: 0.4983
 epoch: 12, train_loss: 0.8750, test_loss: 1.1267, test_f1: 0.5036
 epoch: 13, train_loss: 0.8716, test_loss: 0.9517, test_f1: 0.5292
 epoch: 14, train_loss: 0.8523, test_loss: 1.0341, test_f1: 0.4914
 epoch: 15, train_loss: 0.8236, test_loss: 0.9668, test_f1: 0.5731
 epoch: 16, train_loss: 0.8554, test_loss: 0.8878, test_f1: 0.5260
 epoch: 17, train_loss: 0.8165, test_loss: 1.1352, test_f1: 0.4621
 epoch: 18, train_loss: 0.8145, test_loss: 0.9954, test_f1: 0.5237
 epoch: 19, train_loss: 0.7885, test_loss: 0.7918, test_f1: 0.5697
 epoch: 20, train_loss: 0.7785, test_loss: 0.8523, test_f1: 0.5776
 epoch: 21, train_loss: 0.7814, test_loss: 1.1277, test_f1: 0.5557
 epoch: 22, train_loss: 0.7909, test_loss: 0.9470, test_f1: 0.5871
 epoch: 23, train_loss: 0.7746, test_loss: 0.8524, test_f1: 0.5896
 epoch: 24, train_loss: 0.7504, test_loss: 0.8206, test_f1: 0.5584
 epoch: 25, train_loss: 0.7362, test_loss: 0.8824, test_f1: 0.5828
 epoch: 26, train_loss: 0.7352, test_loss: 0.7954, test_f1: 0.6385
 epoch: 27, train_loss: 0.7134, test_loss: 0.7838, test_f1: 0.6389
 epoch: 28, train_loss: 0.7323, test_loss: 1.1077, test_f1: 0.5457
 epoch: 29, train_loss: 0.7574, test_loss: 0.9210, test_f1: 0.6387
 epoch: 30, train_loss: 0.7269, test_loss: 0.8319, test_f1: 0.6190
 epoch: 31, train_loss: 0.6958, test_loss: 0.7754, test_f1: 0.5965
 epoch: 32, train_loss: 0.6994, test_loss: 0.9433, test_f1: 0.5994
 epoch: 33, train_loss: 0.6966, test_loss: 0.8520, test_f1: 0.6046
 epoch: 34, train_loss: 0.6563, test_loss: 1.0060, test_f1: 0.5868
 epoch: 35, train_loss: 0.6856, test_loss: 0.7434, test_f1: 0.6429
 epoch: 36, train_loss: 0.6631, test_loss: 0.8300, test_f1: 0.6205
 epoch: 37, train_loss: 0.6647, test_loss: 0.7801, test_f1: 0.6619
 epoch: 38, train_loss: 0.7107, test_loss: 1.0946, test_f1: 0.5270
 epoch: 39, train_loss: 0.7348, test_loss: 0.8764, test_f1: 0.5514
 epoch: 40, train_loss: 0.6970, test_loss: 1.4003, test_f1: 0.4919
 epoch: 41, train_loss: 0.6902, test_loss: 0.7768, test_f1: 0.6355
 epoch: 42, train_loss: 0.6638, test_loss: 0.7864, test_f1: 0.6230
 epoch: 43, train_loss: 0.6643, test_loss: 0.7607, test_f1: 0.6283
 epoch: 44, train_loss: 0.6527, test_loss: 0.8573, test_f1: 0.5840
 epoch: 45, train_loss: 0.6205, test_loss: 0.7669, test_f1: 0.6440
 epoch: 46, train_loss: 0.6152, test_loss: 0.7545, test_f1: 0.6517
 epoch: 47, train_loss: 0.6071, test_loss: 0.9146, test_f1: 0.5921
 epoch: 48, train_loss: 0.6123, test_loss: 0.7677, test_f1: 0.6304
 epoch: 49, train_loss: 0.5904, test_loss: 0.8950, test_f1: 0.6223
 epoch: 50, train_loss: 0.5829, test_loss: 0.7590, test_f1: 0.6406
 epoch: 51, train_loss: 0.5520, test_loss: 0.6832, test_f1: 0.6856
 epoch: 52, train_loss: 0.5145, test_loss: 0.8983, test_f1: 0.6172
 epoch: 53, train_loss: 0.5040, test_loss: 1.0663, test_f1: 0.6514
 epoch: 54, train_loss: 0.5086, test_loss: 0.7914, test_f1: 0.6612
 epoch: 55, train_loss: 0.4863, test_loss: 0.7722, test_f1: 0.6430
 epoch: 56, train_loss: 0.4650, test_loss: 0.8191, test_f1: 0.6760
 epoch: 57, train_loss: 0.4709, test_loss: 0.7741, test_f1: 0.6515
 epoch: 58, train_loss: 0.4763, test_loss: 0.9364, test_f1: 0.6413
 epoch: 59, train_loss: 0.4718, test_loss: 0.8713, test_f1: 0.6058
 epoch: 60, train_loss: 0.4689, test_loss: 0.8629, test_f1: 0.6508
 epoch: 61, train_loss: 0.4551, test_loss: 0.9752, test_f1: 0.6411
 epoch: 62, train_loss: 0.4590, test_loss: 0.7831, test_f1: 0.6555
 epoch: 63, train_loss: 0.4562, test_loss: 0.9621, test_f1: 0.6606
 epoch: 64, train_loss: 0.4406, test_loss: 1.0807, test_f1: 0.6196
 epoch: 65, train_loss: 0.4489, test_loss: 0.7568, test_f1: 0.6619
 epoch: 66, train_loss: 0.4249, test_loss: 0.9683, test_f1: 0.6313
 epoch: 67, train_loss: 0.4297, test_loss: 0.9783, test_f1: 0.6492
 epoch: 68, train_loss: 0.4175, test_loss: 0.9274, test_f1: 0.6433
 epoch: 69, train_loss: 0.3997, test_loss: 0.8624, test_f1: 0.6573
 epoch: 70, train_loss: 0.4198, test_loss: 0.8949, test_f1: 0.7051
 epoch: 71, train_loss: 0.3889, test_loss: 1.0084, test_f1: 0.6527
 epoch: 72, train_loss: 0.3942, test_loss: 1.0030, test_f1: 0.6440
 epoch: 73, train_loss: 0.3932, test_loss: 0.8331, test_f1: 0.6424
 epoch: 74, train_loss: 0.3842, test_loss: 0.9932, test_f1: 0.6521
 epoch: 75, train_loss: 0.3806, test_loss: 0.8813, test_f1: 0.7090
 epoch: 76, train_loss: 0.3900, test_loss: 0.9085, test_f1: 0.6451
 epoch: 77, train_loss: 0.3663, test_loss: 0.9674, test_f1: 0.6426
 epoch: 78, train_loss: 0.4034, test_loss: 0.9186, test_f1: 0.6480
 epoch: 79, train_loss: 0.3960, test_loss: 1.0500, test_f1: 0.6522
 epoch: 80, train_loss: 0.3732, test_loss: 0.9069, test_f1: 0.6554
 epoch: 81, train_loss: 0.3983, test_loss: 1.0478, test_f1: 0.6471
 epoch: 82, train_loss: 0.3775, test_loss: 1.0490, test_f1: 0.6476
 epoch: 83, train_loss: 0.3760, test_loss: 0.9765, test_f1: 0.6320
 epoch: 84, train_loss: 0.3521, test_loss: 1.0152, test_f1: 0.6689
 epoch: 85, train_loss: 0.3628, test_loss: 1.0185, test_f1: 0.6435
 epoch: 86, train_loss: 0.3515, test_loss: 1.0358, test_f1: 0.6689
 epoch: 87, train_loss: 0.3479, test_loss: 1.1455, test_f1: 0.6207
 epoch: 88, train_loss: 0.3597, test_loss: 1.0579, test_f1: 0.6437
 epoch: 89, train_loss: 0.3464, test_loss: 1.1958, test_f1: 0.6502
 epoch: 90, train_loss: 0.3274, test_loss: 1.1871, test_f1: 0.6338
 epoch: 91, train_loss: 0.3683, test_loss: 1.0021, test_f1: 0.6489
 epoch: 92, train_loss: 0.3548, test_loss: 1.2116, test_f1: 0.6586
 epoch: 93, train_loss: 0.3206, test_loss: 1.2176, test_f1: 0.6337
 epoch: 94, train_loss: 0.3139, test_loss: 1.2934, test_f1: 0.6372
 epoch: 95, train_loss: 0.2890, test_loss: 1.3716, test_f1: 0.6420
 epoch: 96, train_loss: 0.3081, test_loss: 1.0878, test_f1: 0.6440
 epoch: 97, train_loss: 0.2961, test_loss: 1.2293, test_f1: 0.6437
 epoch: 98, train_loss: 0.3150, test_loss: 1.1785, test_f1: 0.6607
 epoch: 99, train_loss: 0.3003, test_loss: 1.1879, test_f1: 0.6316
##################ITERATION #2 ****************************************
 epoch: 0, train_loss: 1.2191, test_loss: 1.1081, test_f1: 0.3788
 epoch: 1, train_loss: 1.0675, test_loss: 1.1783, test_f1: 0.3471
 epoch: 2, train_loss: 1.0441, test_loss: 1.0724, test_f1: 0.3518
 epoch: 3, train_loss: 1.0343, test_loss: 1.0659, test_f1: 0.3529
 epoch: 4, train_loss: 1.0061, test_loss: 1.0040, test_f1: 0.5047
 epoch: 5, train_loss: 0.9888, test_loss: 1.0053, test_f1: 0.4397
 epoch: 6, train_loss: 0.9672, test_loss: 0.9434, test_f1: 0.4943
 epoch: 7, train_loss: 0.9557, test_loss: 1.0330, test_f1: 0.4173
 epoch: 8, train_loss: 0.9433, test_loss: 1.0318, test_f1: 0.4843
 epoch: 9, train_loss: 0.9313, test_loss: 0.9296, test_f1: 0.5110
 epoch: 10, train_loss: 0.9187, test_loss: 6.8049, test_f1: 0.3089
 epoch: 11, train_loss: 0.9064, test_loss: 1.0636, test_f1: 0.5124
 epoch: 12, train_loss: 0.8911, test_loss: 1.0630, test_f1: 0.4826
 epoch: 13, train_loss: 0.8926, test_loss: 1.0329, test_f1: 0.4760
 epoch: 14, train_loss: 0.8679, test_loss: 0.8842, test_f1: 0.5345
 epoch: 15, train_loss: 0.8537, test_loss: 1.0097, test_f1: 0.5260
 epoch: 16, train_loss: 0.8570, test_loss: 1.3004, test_f1: 0.4062
 epoch: 17, train_loss: 0.8395, test_loss: 0.8097, test_f1: 0.5918
 epoch: 18, train_loss: 0.8215, test_loss: 0.8083, test_f1: 0.5734
 epoch: 19, train_loss: 0.8145, test_loss: 0.7893, test_f1: 0.6227
 epoch: 20, train_loss: 0.8009, test_loss: 0.8107, test_f1: 0.5988
 epoch: 21, train_loss: 0.7752, test_loss: 0.8233, test_f1: 0.5488
 epoch: 22, train_loss: 0.7618, test_loss: 0.9098, test_f1: 0.5263
 epoch: 23, train_loss: 0.7617, test_loss: 0.8438, test_f1: 0.5411
 epoch: 24, train_loss: 0.7538, test_loss: 0.7893, test_f1: 0.6101
 epoch: 25, train_loss: 0.7575, test_loss: 0.8094, test_f1: 0.5873
 epoch: 26, train_loss: 0.7503, test_loss: 0.8389, test_f1: 0.6052
 epoch: 27, train_loss: 0.7298, test_loss: 0.8978, test_f1: 0.5956
 epoch: 28, train_loss: 0.7292, test_loss: 0.8600, test_f1: 0.5651
 epoch: 29, train_loss: 0.7289, test_loss: 0.8336, test_f1: 0.5779
 epoch: 30, train_loss: 0.6948, test_loss: 0.8273, test_f1: 0.6199
 epoch: 31, train_loss: 0.6862, test_loss: 0.9727, test_f1: 0.5611
 epoch: 32, train_loss: 0.6796, test_loss: 0.8351, test_f1: 0.6056
 epoch: 33, train_loss: 0.6754, test_loss: 0.8688, test_f1: 0.5727
 epoch: 34, train_loss: 0.6652, test_loss: 0.7574, test_f1: 0.6512
 epoch: 35, train_loss: 0.6697, test_loss: 0.8183, test_f1: 0.6144
 epoch: 36, train_loss: 0.6537, test_loss: 0.8173, test_f1: 0.6152
 epoch: 37, train_loss: 0.6529, test_loss: 0.8425, test_f1: 0.6304
 epoch: 38, train_loss: 0.6479, test_loss: 0.7764, test_f1: 0.5940
 epoch: 39, train_loss: 0.6297, test_loss: 1.0104, test_f1: 0.6062
 epoch: 40, train_loss: 0.6435, test_loss: 0.9648, test_f1: 0.6254
 epoch: 41, train_loss: 0.6083, test_loss: 0.9012, test_f1: 0.5553
 epoch: 42, train_loss: 0.6271, test_loss: 1.0250, test_f1: 0.5705
 epoch: 43, train_loss: 0.6219, test_loss: 0.8857, test_f1: 0.6420
 epoch: 44, train_loss: 0.6273, test_loss: 0.7688, test_f1: 0.6278
 epoch: 45, train_loss: 0.5987, test_loss: 1.1638, test_f1: 0.5918
 epoch: 46, train_loss: 0.5755, test_loss: 0.9465, test_f1: 0.6370
 epoch: 47, train_loss: 0.5811, test_loss: 0.8664, test_f1: 0.6272
 epoch: 48, train_loss: 0.5918, test_loss: 0.8973, test_f1: 0.5839
 epoch: 49, train_loss: 0.5834, test_loss: 0.8693, test_f1: 0.6448
 epoch: 50, train_loss: 0.5776, test_loss: 0.9166, test_f1: 0.6642
 epoch: 51, train_loss: 0.5322, test_loss: 0.8592, test_f1: 0.6552
 epoch: 52, train_loss: 0.4922, test_loss: 0.9030, test_f1: 0.6960
 epoch: 53, train_loss: 0.4913, test_loss: 0.8239, test_f1: 0.6618
 epoch: 54, train_loss: 0.4820, test_loss: 0.7879, test_f1: 0.6677
 epoch: 55, train_loss: 0.4629, test_loss: 1.0525, test_f1: 0.6648
 epoch: 56, train_loss: 0.4713, test_loss: 0.9612, test_f1: 0.7016
 epoch: 57, train_loss: 0.4463, test_loss: 0.8884, test_f1: 0.6675
 epoch: 58, train_loss: 0.4487, test_loss: 0.9215, test_f1: 0.6492
 epoch: 59, train_loss: 0.4617, test_loss: 0.9306, test_f1: 0.6581
 epoch: 60, train_loss: 0.4374, test_loss: 0.9119, test_f1: 0.6503
 epoch: 61, train_loss: 0.4293, test_loss: 0.7616, test_f1: 0.6944
 epoch: 62, train_loss: 0.4174, test_loss: 0.8564, test_f1: 0.6643
 epoch: 63, train_loss: 0.4218, test_loss: 0.8959, test_f1: 0.6504
 epoch: 64, train_loss: 0.4261, test_loss: 0.9171, test_f1: 0.6689
 epoch: 65, train_loss: 0.4273, test_loss: 0.9332, test_f1: 0.6734
 epoch: 66, train_loss: 0.3996, test_loss: 0.8690, test_f1: 0.6463
 epoch: 67, train_loss: 0.4069, test_loss: 0.9814, test_f1: 0.6472
 epoch: 68, train_loss: 0.4413, test_loss: 0.8850, test_f1: 0.6452
 epoch: 69, train_loss: 0.4048, test_loss: 1.0265, test_f1: 0.6356
 epoch: 70, train_loss: 0.4000, test_loss: 0.9486, test_f1: 0.6563
 epoch: 71, train_loss: 0.4252, test_loss: 0.9609, test_f1: 0.6561
 epoch: 72, train_loss: 0.4116, test_loss: 0.9148, test_f1: 0.6277
 epoch: 73, train_loss: 0.4105, test_loss: 0.9120, test_f1: 0.6696
 epoch: 74, train_loss: 0.4031, test_loss: 0.9151, test_f1: 0.6618
 epoch: 75, train_loss: 0.3741, test_loss: 0.9359, test_f1: 0.6767
 epoch: 76, train_loss: 0.3875, test_loss: 0.9963, test_f1: 0.6395
 epoch: 77, train_loss: 0.3863, test_loss: 1.0371, test_f1: 0.6350
 epoch: 78, train_loss: 0.3856, test_loss: 1.0879, test_f1: 0.6636
 epoch: 79, train_loss: 0.3608, test_loss: 0.9675, test_f1: 0.6753
 epoch: 80, train_loss: 0.3641, test_loss: 1.1313, test_f1: 0.6323
 epoch: 81, train_loss: 0.3559, test_loss: 0.9132, test_f1: 0.6766
 epoch: 82, train_loss: 0.3722, test_loss: 1.3156, test_f1: 0.6507
 epoch: 83, train_loss: 0.3598, test_loss: 0.9959, test_f1: 0.6597
 epoch: 84, train_loss: 0.3448, test_loss: 1.1999, test_f1: 0.6364
 epoch: 85, train_loss: 0.3286, test_loss: 1.1010, test_f1: 0.6462
 epoch: 86, train_loss: 0.3367, test_loss: 1.1399, test_f1: 0.6436
 epoch: 87, train_loss: 0.3360, test_loss: 1.2102, test_f1: 0.6564
 epoch: 88, train_loss: 0.3411, test_loss: 1.2068, test_f1: 0.6582
 epoch: 89, train_loss: 0.3458, test_loss: 1.1696, test_f1: 0.6337
 epoch: 90, train_loss: 0.3485, test_loss: 1.2580, test_f1: 0.6293
 epoch: 91, train_loss: 0.3427, test_loss: 1.1612, test_f1: 0.6434
 epoch: 92, train_loss: 0.3576, test_loss: 1.1579, test_f1: 0.6389
 epoch: 93, train_loss: 0.3337, test_loss: 1.1925, test_f1: 0.6610
 epoch: 94, train_loss: 0.2994, test_loss: 1.2255, test_f1: 0.6624
 epoch: 95, train_loss: 0.3195, test_loss: 1.3484, test_f1: 0.6578
 epoch: 96, train_loss: 0.3180, test_loss: 1.3384, test_f1: 0.6263
 epoch: 97, train_loss: 0.3087, test_loss: 1.1317, test_f1: 0.6716
 epoch: 98, train_loss: 0.3146, test_loss: 1.1197, test_f1: 0.6449
 epoch: 99, train_loss: 0.3223, test_loss: 1.1420, test_f1: 0.6567
##################ITERATION #3 ****************************************
 epoch: 0, train_loss: 1.1873, test_loss: 1.2662, test_f1: 0.3462
 epoch: 1, train_loss: 1.0780, test_loss: 1.2001, test_f1: 0.4576
 epoch: 2, train_loss: 1.0452, test_loss: 1.0779, test_f1: 0.4560
 epoch: 3, train_loss: 1.0214, test_loss: 1.0566, test_f1: 0.4294
 epoch: 4, train_loss: 1.0147, test_loss: 1.1231, test_f1: 0.4696
 epoch: 5, train_loss: 0.9967, test_loss: 1.1916, test_f1: 0.4636
 epoch: 6, train_loss: 0.9961, test_loss: 1.0288, test_f1: 0.4750
 epoch: 7, train_loss: 0.9773, test_loss: 1.0144, test_f1: 0.4601
 epoch: 8, train_loss: 0.9970, test_loss: 1.0048, test_f1: 0.4682
 epoch: 9, train_loss: 0.9681, test_loss: 0.9543, test_f1: 0.5015
 epoch: 10, train_loss: 0.9585, test_loss: 1.0155, test_f1: 0.4770
 epoch: 11, train_loss: 0.9416, test_loss: 1.1325, test_f1: 0.4753
 epoch: 12, train_loss: 0.9219, test_loss: 0.9839, test_f1: 0.4451
 epoch: 13, train_loss: 0.9515, test_loss: 1.4005, test_f1: 0.3275
 epoch: 14, train_loss: 1.0183, test_loss: 1.2066, test_f1: 0.3868
 epoch: 15, train_loss: 0.9803, test_loss: 1.1460, test_f1: 0.4621
 epoch: 16, train_loss: 0.9446, test_loss: 0.9839, test_f1: 0.4771
 epoch: 17, train_loss: 0.9352, test_loss: 1.0237, test_f1: 0.4617
 epoch: 18, train_loss: 0.9168, test_loss: 1.0817, test_f1: 0.4302
 epoch: 19, train_loss: 0.9084, test_loss: 1.0186, test_f1: 0.4900
 epoch: 20, train_loss: 0.9155, test_loss: 1.0915, test_f1: 0.4923
 epoch: 21, train_loss: 0.9026, test_loss: 0.9730, test_f1: 0.4635
 epoch: 22, train_loss: 0.8859, test_loss: 0.9805, test_f1: 0.4571
 epoch: 23, train_loss: 0.8785, test_loss: 0.9927, test_f1: 0.5172
 epoch: 24, train_loss: 0.8860, test_loss: 1.0127, test_f1: 0.5229
 epoch: 25, train_loss: 0.8572, test_loss: 0.9918, test_f1: 0.5308
 epoch: 26, train_loss: 0.8638, test_loss: 1.0284, test_f1: 0.5268
 epoch: 27, train_loss: 0.8550, test_loss: 1.0776, test_f1: 0.4957
 epoch: 28, train_loss: 0.8412, test_loss: 0.9609, test_f1: 0.5247
 epoch: 29, train_loss: 0.8172, test_loss: 0.9265, test_f1: 0.5510
 epoch: 30, train_loss: 0.8189, test_loss: 1.1128, test_f1: 0.5103
 epoch: 31, train_loss: 0.8313, test_loss: 0.9103, test_f1: 0.4972
 epoch: 32, train_loss: 0.8298, test_loss: 0.9514, test_f1: 0.5230
 epoch: 33, train_loss: 0.8007, test_loss: 0.9873, test_f1: 0.5206
 epoch: 34, train_loss: 0.7810, test_loss: 1.1508, test_f1: 0.5405
 epoch: 35, train_loss: 0.7741, test_loss: 0.9748, test_f1: 0.5284
 epoch: 36, train_loss: 0.7724, test_loss: 0.8993, test_f1: 0.5036
 epoch: 37, train_loss: 0.7387, test_loss: 0.8693, test_f1: 0.5476
 epoch: 38, train_loss: 0.7616, test_loss: 1.0762, test_f1: 0.5376
 epoch: 39, train_loss: 0.7533, test_loss: 0.9019, test_f1: 0.5187
 epoch: 40, train_loss: 0.7397, test_loss: 0.9146, test_f1: 0.5309
 epoch: 41, train_loss: 0.7601, test_loss: 0.8289, test_f1: 0.5348
 epoch: 42, train_loss: 0.7412, test_loss: 1.1391, test_f1: 0.4999
 epoch: 43, train_loss: 0.7441, test_loss: 0.9296, test_f1: 0.5522
 epoch: 44, train_loss: 0.7412, test_loss: 1.0199, test_f1: 0.5230
 epoch: 45, train_loss: 0.7110, test_loss: 0.9462, test_f1: 0.5745
 epoch: 46, train_loss: 0.7064, test_loss: 1.1191, test_f1: 0.5157
 epoch: 47, train_loss: 0.7056, test_loss: 1.0158, test_f1: 0.5434
 epoch: 48, train_loss: 0.7149, test_loss: 0.9656, test_f1: 0.5367
 epoch: 49, train_loss: 0.6978, test_loss: 1.1050, test_f1: 0.5501
 epoch: 50, train_loss: 0.6979, test_loss: 0.8415, test_f1: 0.6010
 epoch: 51, train_loss: 0.6504, test_loss: 0.9875, test_f1: 0.5982
 epoch: 52, train_loss: 0.6197, test_loss: 0.9888, test_f1: 0.6028
 epoch: 53, train_loss: 0.5970, test_loss: 1.1738, test_f1: 0.5586
 epoch: 54, train_loss: 0.5917, test_loss: 0.9954, test_f1: 0.6142
 epoch: 55, train_loss: 0.5784, test_loss: 1.0254, test_f1: 0.6165
 epoch: 56, train_loss: 0.5774, test_loss: 0.9812, test_f1: 0.6090
 epoch: 57, train_loss: 0.5708, test_loss: 1.0525, test_f1: 0.6248
 epoch: 58, train_loss: 0.5826, test_loss: 1.1253, test_f1: 0.6266
 epoch: 59, train_loss: 0.5563, test_loss: 1.0202, test_f1: 0.6098
 epoch: 60, train_loss: 0.5541, test_loss: 1.1007, test_f1: 0.6257
 epoch: 61, train_loss: 0.5404, test_loss: 1.0616, test_f1: 0.6039
 epoch: 62, train_loss: 0.5381, test_loss: 1.1105, test_f1: 0.6454
 epoch: 63, train_loss: 0.5361, test_loss: 1.1150, test_f1: 0.6358
 epoch: 64, train_loss: 0.5410, test_loss: 1.2349, test_f1: 0.6068
 epoch: 65, train_loss: 0.5274, test_loss: 0.9945, test_f1: 0.6169
 epoch: 66, train_loss: 0.5214, test_loss: 1.0189, test_f1: 0.6397
 epoch: 67, train_loss: 0.5194, test_loss: 1.1532, test_f1: 0.6371
 epoch: 68, train_loss: 0.4969, test_loss: 1.3497, test_f1: 0.6035
 epoch: 69, train_loss: 0.5066, test_loss: 1.2621, test_f1: 0.6166
 epoch: 70, train_loss: 0.4962, test_loss: 1.2219, test_f1: 0.6377
 epoch: 71, train_loss: 0.5152, test_loss: 1.2614, test_f1: 0.6212
 epoch: 72, train_loss: 0.4894, test_loss: 1.1954, test_f1: 0.6091
 epoch: 73, train_loss: 0.4741, test_loss: 1.0978, test_f1: 0.6359
 epoch: 74, train_loss: 0.4902, test_loss: 1.2386, test_f1: 0.6122
 epoch: 75, train_loss: 0.4902, test_loss: 1.1706, test_f1: 0.6454
 epoch: 76, train_loss: 0.4575, test_loss: 1.2760, test_f1: 0.6225
 epoch: 77, train_loss: 0.4714, test_loss: 1.1622, test_f1: 0.6502
 epoch: 78, train_loss: 0.4719, test_loss: 1.2792, test_f1: 0.6244
 epoch: 79, train_loss: 0.4607, test_loss: 1.2408, test_f1: 0.6663
 epoch: 80, train_loss: 0.4458, test_loss: 1.4370, test_f1: 0.6383
 epoch: 81, train_loss: 0.4338, test_loss: 1.4364, test_f1: 0.6580
 epoch: 82, train_loss: 0.4428, test_loss: 1.5350, test_f1: 0.6249
 epoch: 83, train_loss: 0.4145, test_loss: 1.4591, test_f1: 0.6425
 epoch: 84, train_loss: 0.4304, test_loss: 1.3444, test_f1: 0.6245
 epoch: 85, train_loss: 0.4245, test_loss: 1.5065, test_f1: 0.5980
 epoch: 86, train_loss: 0.4374, test_loss: 1.3528, test_f1: 0.6845
 epoch: 87, train_loss: 0.4173, test_loss: 1.6749, test_f1: 0.6014
 epoch: 88, train_loss: 0.4015, test_loss: 1.5456, test_f1: 0.6393
 epoch: 89, train_loss: 0.4168, test_loss: 1.3750, test_f1: 0.6469
 epoch: 90, train_loss: 0.3898, test_loss: 1.6236, test_f1: 0.6670
 epoch: 91, train_loss: 0.4131, test_loss: 1.6138, test_f1: 0.6871
 epoch: 92, train_loss: 0.4000, test_loss: 1.3146, test_f1: 0.6951
 epoch: 93, train_loss: 0.4065, test_loss: 1.4788, test_f1: 0.6933
 epoch: 94, train_loss: 0.3735, test_loss: 1.7281, test_f1: 0.6633
 epoch: 95, train_loss: 0.4006, test_loss: 1.6200, test_f1: 0.6573
 epoch: 96, train_loss: 0.3961, test_loss: 1.6609, test_f1: 0.6359
 epoch: 97, train_loss: 0.3854, test_loss: 1.5278, test_f1: 0.6793
 epoch: 98, train_loss: 0.3693, test_loss: 1.5553, test_f1: 0.6812
 epoch: 99, train_loss: 0.3793, test_loss: 1.6405, test_f1: 0.6873
##################ITERATION #4 ****************************************
 epoch: 0, train_loss: 1.2673, test_loss: 1.2715, test_f1: 0.3027
 epoch: 1, train_loss: 1.0081, test_loss: 1.0503, test_f1: 0.5233
 epoch: 2, train_loss: 0.9600, test_loss: 1.0654, test_f1: 0.5163
 epoch: 3, train_loss: 0.9365, test_loss: 1.0972, test_f1: 0.5111
 epoch: 4, train_loss: 0.9298, test_loss: 1.0808, test_f1: 0.5137
 epoch: 5, train_loss: 0.9241, test_loss: 1.0687, test_f1: 0.4902
 epoch: 6, train_loss: 0.8933, test_loss: 1.0299, test_f1: 0.5424
 epoch: 7, train_loss: 0.8511, test_loss: 0.9665, test_f1: 0.5589
 epoch: 8, train_loss: 0.8501, test_loss: 0.9789, test_f1: 0.5543
 epoch: 9, train_loss: 0.8549, test_loss: 1.1260, test_f1: 0.5280
 epoch: 10, train_loss: 0.8437, test_loss: 0.9074, test_f1: 0.5214
 epoch: 11, train_loss: 0.8221, test_loss: 1.0761, test_f1: 0.5091
 epoch: 12, train_loss: 0.8004, test_loss: 0.8258, test_f1: 0.5358
 epoch: 13, train_loss: 0.7924, test_loss: 1.0528, test_f1: 0.5167
 epoch: 14, train_loss: 0.7954, test_loss: 0.8631, test_f1: 0.5291
 epoch: 15, train_loss: 0.7756, test_loss: 0.8393, test_f1: 0.5979
 epoch: 16, train_loss: 0.7574, test_loss: 1.1286, test_f1: 0.5291
 epoch: 17, train_loss: 0.7541, test_loss: 0.8711, test_f1: 0.5841
 epoch: 18, train_loss: 0.7403, test_loss: 0.8578, test_f1: 0.5846
 epoch: 19, train_loss: 0.7111, test_loss: 0.9518, test_f1: 0.6129
 epoch: 20, train_loss: 0.7210, test_loss: 0.7850, test_f1: 0.5966
 epoch: 21, train_loss: 0.7139, test_loss: 0.8593, test_f1: 0.6314
 epoch: 22, train_loss: 0.7144, test_loss: 0.9563, test_f1: 0.5776
 epoch: 23, train_loss: 0.7593, test_loss: 1.0345, test_f1: 0.5720
 epoch: 24, train_loss: 0.7233, test_loss: 0.9590, test_f1: 0.6263
 epoch: 25, train_loss: 0.6960, test_loss: 1.0607, test_f1: 0.6192
 epoch: 26, train_loss: 0.6805, test_loss: 1.0837, test_f1: 0.6418
 epoch: 27, train_loss: 0.6807, test_loss: 0.9389, test_f1: 0.5878
 epoch: 28, train_loss: 0.6777, test_loss: 1.0078, test_f1: 0.6242
 epoch: 29, train_loss: 0.6765, test_loss: 0.9540, test_f1: 0.6191
 epoch: 30, train_loss: 0.6496, test_loss: 1.0271, test_f1: 0.6074
 epoch: 31, train_loss: 0.6434, test_loss: 0.9925, test_f1: 0.6022
 epoch: 32, train_loss: 0.6436, test_loss: 1.2266, test_f1: 0.5705
 epoch: 33, train_loss: 0.6568, test_loss: 1.2131, test_f1: 0.6162
 epoch: 34, train_loss: 0.6349, test_loss: 1.1622, test_f1: 0.6084
 epoch: 35, train_loss: 0.6225, test_loss: 0.9921, test_f1: 0.6386
 epoch: 36, train_loss: 0.6149, test_loss: 1.1294, test_f1: 0.6547
 epoch: 37, train_loss: 0.6023, test_loss: 1.1354, test_f1: 0.6667
 epoch: 38, train_loss: 0.6037, test_loss: 1.1170, test_f1: 0.6076
 epoch: 39, train_loss: 0.6081, test_loss: 1.2511, test_f1: 0.6429
 epoch: 40, train_loss: 0.5977, test_loss: 1.0628, test_f1: 0.6794
 epoch: 41, train_loss: 0.5663, test_loss: 1.2744, test_f1: 0.6287
 epoch: 42, train_loss: 0.5706, test_loss: 1.2863, test_f1: 0.5994
 epoch: 43, train_loss: 0.5685, test_loss: 1.3910, test_f1: 0.6446
 epoch: 44, train_loss: 0.5551, test_loss: 1.3648, test_f1: 0.6398
 epoch: 45, train_loss: 0.5801, test_loss: 1.2295, test_f1: 0.6073
 epoch: 46, train_loss: 0.5587, test_loss: 1.2553, test_f1: 0.6527
 epoch: 47, train_loss: 0.5793, test_loss: 1.3247, test_f1: 0.6259
 epoch: 48, train_loss: 0.5495, test_loss: 1.3452, test_f1: 0.6455
 epoch: 49, train_loss: 0.5678, test_loss: 1.1205, test_f1: 0.6224
 epoch: 50, train_loss: 0.5354, test_loss: 1.1674, test_f1: 0.6521
 epoch: 51, train_loss: 0.5070, test_loss: 1.3976, test_f1: 0.6478
 epoch: 52, train_loss: 0.4756, test_loss: 1.3209, test_f1: 0.6584
 epoch: 53, train_loss: 0.4529, test_loss: 1.3527, test_f1: 0.6622
 epoch: 54, train_loss: 0.4574, test_loss: 1.2450, test_f1: 0.6616
 epoch: 55, train_loss: 0.4418, test_loss: 1.2406, test_f1: 0.6366
 epoch: 56, train_loss: 0.4237, test_loss: 1.3234, test_f1: 0.6790
 epoch: 57, train_loss: 0.4265, test_loss: 1.6124, test_f1: 0.6541
 epoch: 58, train_loss: 0.4254, test_loss: 1.6933, test_f1: 0.6678
 epoch: 59, train_loss: 0.4245, test_loss: 1.5075, test_f1: 0.6551
 epoch: 60, train_loss: 0.4123, test_loss: 1.8989, test_f1: 0.6578
 epoch: 61, train_loss: 0.4084, test_loss: 1.6587, test_f1: 0.6065
 epoch: 62, train_loss: 0.3904, test_loss: 1.3842, test_f1: 0.6717
 epoch: 63, train_loss: 0.3969, test_loss: 1.6144, test_f1: 0.6740
 epoch: 64, train_loss: 0.3878, test_loss: 1.6355, test_f1: 0.6323
 epoch: 65, train_loss: 0.3964, test_loss: 1.6962, test_f1: 0.6952
 epoch: 66, train_loss: 0.3877, test_loss: 1.6177, test_f1: 0.6698
 epoch: 67, train_loss: 0.3935, test_loss: 1.7697, test_f1: 0.6783
 epoch: 68, train_loss: 0.3850, test_loss: 1.6717, test_f1: 0.6734
 epoch: 69, train_loss: 0.3826, test_loss: 1.7581, test_f1: 0.6736
 epoch: 70, train_loss: 0.3805, test_loss: 1.7360, test_f1: 0.6687
 epoch: 71, train_loss: 0.3768, test_loss: 1.5806, test_f1: 0.6407
 epoch: 72, train_loss: 0.3726, test_loss: 1.6675, test_f1: 0.6351
 epoch: 73, train_loss: 0.3660, test_loss: 1.3758, test_f1: 0.6808
 epoch: 74, train_loss: 0.3732, test_loss: 1.6837, test_f1: 0.6506
 epoch: 75, train_loss: 0.3600, test_loss: 1.3985, test_f1: 0.6760
 epoch: 76, train_loss: 0.3539, test_loss: 1.4781, test_f1: 0.6729
 epoch: 77, train_loss: 0.3554, test_loss: 1.6889, test_f1: 0.6734
 epoch: 78, train_loss: 0.3395, test_loss: 1.6372, test_f1: 0.7025
 epoch: 79, train_loss: 0.3340, test_loss: 1.6244, test_f1: 0.6925
 epoch: 80, train_loss: 0.3206, test_loss: 1.8135, test_f1: 0.6860
 epoch: 81, train_loss: 0.3220, test_loss: 1.9365, test_f1: 0.6889
 epoch: 82, train_loss: 0.3426, test_loss: 1.8495, test_f1: 0.6712
 epoch: 83, train_loss: 0.3351, test_loss: 1.9471, test_f1: 0.6856
 epoch: 84, train_loss: 0.3178, test_loss: 1.8668, test_f1: 0.6864
 epoch: 85, train_loss: 0.3447, test_loss: 1.8121, test_f1: 0.6751
 epoch: 86, train_loss: 0.3297, test_loss: 1.6776, test_f1: 0.6842
 epoch: 87, train_loss: 0.3124, test_loss: 1.9474, test_f1: 0.6778
 epoch: 88, train_loss: 0.3076, test_loss: 1.8044, test_f1: 0.6691
 epoch: 89, train_loss: 0.2955, test_loss: 1.8277, test_f1: 0.6703
 epoch: 90, train_loss: 0.2862, test_loss: 1.8963, test_f1: 0.6964
 epoch: 91, train_loss: 0.3109, test_loss: 1.9258, test_f1: 0.6339
 epoch: 92, train_loss: 0.3171, test_loss: 1.9320, test_f1: 0.6703
 epoch: 93, train_loss: 0.3215, test_loss: 1.6829, test_f1: 0.6641
 epoch: 94, train_loss: 0.3025, test_loss: 1.4449, test_f1: 0.6615
 epoch: 95, train_loss: 0.2931, test_loss: 1.6864, test_f1: 0.6791
 epoch: 96, train_loss: 0.3026, test_loss: 1.8719, test_f1: 0.6835
 epoch: 97, train_loss: 0.3213, test_loss: 2.1983, test_f1: 0.6601
 epoch: 98, train_loss: 0.3133, test_loss: 1.7914, test_f1: 0.6737
 epoch: 99, train_loss: 0.3116, test_loss: 1.7793, test_f1: 0.6617
##################ITERATION #5 ****************************************
 epoch: 0, train_loss: 1.3818, test_loss: 1.8965, test_f1: 0.0991
 epoch: 1, train_loss: 1.0064, test_loss: 1.0999, test_f1: 0.4849
 epoch: 2, train_loss: 0.9687, test_loss: 0.9632, test_f1: 0.5189
 epoch: 3, train_loss: 0.9541, test_loss: 0.9822, test_f1: 0.4990
 epoch: 4, train_loss: 0.9369, test_loss: 1.3812, test_f1: 0.3888
 epoch: 5, train_loss: 0.9229, test_loss: 1.0149, test_f1: 0.5324
 epoch: 6, train_loss: 0.8972, test_loss: 1.0523, test_f1: 0.5125
 epoch: 7, train_loss: 0.8835, test_loss: 0.9205, test_f1: 0.5197
 epoch: 8, train_loss: 0.8590, test_loss: 0.8898, test_f1: 0.5584
 epoch: 9, train_loss: 0.8422, test_loss: 0.8601, test_f1: 0.5665
 epoch: 10, train_loss: 0.8285, test_loss: 0.8503, test_f1: 0.5824
 epoch: 11, train_loss: 0.8107, test_loss: 0.8675, test_f1: 0.5930
 epoch: 12, train_loss: 0.8039, test_loss: 0.9008, test_f1: 0.5643
 epoch: 13, train_loss: 0.7887, test_loss: 0.8156, test_f1: 0.6305
 epoch: 14, train_loss: 0.7779, test_loss: 0.9092, test_f1: 0.5363
 epoch: 15, train_loss: 0.7722, test_loss: 0.8348, test_f1: 0.6242
 epoch: 16, train_loss: 0.7839, test_loss: 0.9009, test_f1: 0.6146
 epoch: 17, train_loss: 0.7687, test_loss: 0.7839, test_f1: 0.6108
 epoch: 18, train_loss: 0.7503, test_loss: 0.8370, test_f1: 0.5877
 epoch: 19, train_loss: 0.7422, test_loss: 0.7767, test_f1: 0.6287
 epoch: 20, train_loss: 0.7286, test_loss: 0.8077, test_f1: 0.6214
 epoch: 21, train_loss: 0.7323, test_loss: 0.7978, test_f1: 0.6330
 epoch: 22, train_loss: 0.6919, test_loss: 0.7946, test_f1: 0.6333
 epoch: 23, train_loss: 0.6975, test_loss: 0.8007, test_f1: 0.6013
 epoch: 24, train_loss: 0.6856, test_loss: 0.7670, test_f1: 0.6676
 epoch: 25, train_loss: 0.6988, test_loss: 0.7588, test_f1: 0.6259
 epoch: 26, train_loss: 0.6925, test_loss: 0.8891, test_f1: 0.5850
 epoch: 27, train_loss: 0.7169, test_loss: 0.8073, test_f1: 0.5913
 epoch: 28, train_loss: 0.6769, test_loss: 0.7575, test_f1: 0.6282
 epoch: 29, train_loss: 0.6704, test_loss: 0.9532, test_f1: 0.6170
 epoch: 30, train_loss: 0.6749, test_loss: 0.8010, test_f1: 0.6376
 epoch: 31, train_loss: 0.6760, test_loss: 0.7455, test_f1: 0.6695
 epoch: 32, train_loss: 0.6421, test_loss: 0.9430, test_f1: 0.6206
 epoch: 33, train_loss: 0.6363, test_loss: 0.8324, test_f1: 0.6329
 epoch: 34, train_loss: 0.6111, test_loss: 0.6941, test_f1: 0.6835
 epoch: 35, train_loss: 0.6160, test_loss: 0.7300, test_f1: 0.6820
 epoch: 36, train_loss: 0.6001, test_loss: 0.7937, test_f1: 0.6491
 epoch: 37, train_loss: 0.6065, test_loss: 0.7517, test_f1: 0.6702
 epoch: 38, train_loss: 0.6089, test_loss: 1.2473, test_f1: 0.4851
 epoch: 39, train_loss: 0.6036, test_loss: 0.7606, test_f1: 0.6562
 epoch: 40, train_loss: 0.6054, test_loss: 0.7635, test_f1: 0.6323
 epoch: 41, train_loss: 0.5780, test_loss: 0.8351, test_f1: 0.6187
 epoch: 42, train_loss: 0.5864, test_loss: 0.7684, test_f1: 0.6372
 epoch: 43, train_loss: 0.6060, test_loss: 0.7536, test_f1: 0.6569
 epoch: 44, train_loss: 0.5768, test_loss: 0.7528, test_f1: 0.6605
 epoch: 45, train_loss: 0.5758, test_loss: 0.7508, test_f1: 0.6550
 epoch: 46, train_loss: 0.5536, test_loss: 0.7429, test_f1: 0.6635
 epoch: 47, train_loss: 0.5449, test_loss: 0.7855, test_f1: 0.6746
 epoch: 48, train_loss: 0.5523, test_loss: 0.9159, test_f1: 0.6109
 epoch: 49, train_loss: 0.5441, test_loss: 0.8210, test_f1: 0.6506
 epoch: 50, train_loss: 0.5419, test_loss: 0.8157, test_f1: 0.6489
 epoch: 51, train_loss: 0.4921, test_loss: 0.7494, test_f1: 0.6962
 epoch: 52, train_loss: 0.4680, test_loss: 0.7856, test_f1: 0.6693
 epoch: 53, train_loss: 0.4351, test_loss: 0.7992, test_f1: 0.6655
 epoch: 54, train_loss: 0.4834, test_loss: 0.7630, test_f1: 0.6832
 epoch: 55, train_loss: 0.4551, test_loss: 0.7519, test_f1: 0.6603
 epoch: 56, train_loss: 0.4471, test_loss: 0.8487, test_f1: 0.6512
 epoch: 57, train_loss: 0.4220, test_loss: 0.7849, test_f1: 0.7060
 epoch: 58, train_loss: 0.3908, test_loss: 0.8582, test_f1: 0.6863
 epoch: 59, train_loss: 0.4185, test_loss: 0.7861, test_f1: 0.6813
 epoch: 60, train_loss: 0.3870, test_loss: 0.8616, test_f1: 0.6823
 epoch: 61, train_loss: 0.3985, test_loss: 0.9801, test_f1: 0.6579
 epoch: 62, train_loss: 0.3992, test_loss: 0.9563, test_f1: 0.6548
 epoch: 63, train_loss: 0.4203, test_loss: 0.7926, test_f1: 0.6960
 epoch: 64, train_loss: 0.4018, test_loss: 0.9525, test_f1: 0.6738
 epoch: 65, train_loss: 0.4052, test_loss: 0.9280, test_f1: 0.6631
 epoch: 66, train_loss: 0.4132, test_loss: 1.1470, test_f1: 0.6711
 epoch: 67, train_loss: 0.3882, test_loss: 0.8343, test_f1: 0.6962
 epoch: 68, train_loss: 0.3900, test_loss: 0.9500, test_f1: 0.6671
 epoch: 69, train_loss: 0.3520, test_loss: 0.9785, test_f1: 0.6896
 epoch: 70, train_loss: 0.3437, test_loss: 0.9167, test_f1: 0.6564
 epoch: 71, train_loss: 0.3604, test_loss: 1.0075, test_f1: 0.6747
 epoch: 72, train_loss: 0.3716, test_loss: 0.8881, test_f1: 0.6780
 epoch: 73, train_loss: 0.3595, test_loss: 0.9871, test_f1: 0.6919
 epoch: 74, train_loss: 0.3511, test_loss: 0.9317, test_f1: 0.6961
 epoch: 75, train_loss: 0.3472, test_loss: 0.8737, test_f1: 0.7032
 epoch: 76, train_loss: 0.3347, test_loss: 0.8990, test_f1: 0.7011
 epoch: 77, train_loss: 0.3253, test_loss: 0.9077, test_f1: 0.6893
 epoch: 78, train_loss: 0.3373, test_loss: 0.8864, test_f1: 0.6875
 epoch: 79, train_loss: 0.3518, test_loss: 0.9255, test_f1: 0.7025
 epoch: 80, train_loss: 0.3407, test_loss: 1.1282, test_f1: 0.6474
 epoch: 81, train_loss: 0.3469, test_loss: 0.9545, test_f1: 0.6848
 epoch: 82, train_loss: 0.3370, test_loss: 0.9036, test_f1: 0.6910
 epoch: 83, train_loss: 0.3243, test_loss: 0.9516, test_f1: 0.6775
 epoch: 84, train_loss: 0.3194, test_loss: 0.9063, test_f1: 0.6916
 epoch: 85, train_loss: 0.3272, test_loss: 0.9357, test_f1: 0.6657
 epoch: 86, train_loss: 0.3286, test_loss: 0.9633, test_f1: 0.6749
 epoch: 87, train_loss: 0.3245, test_loss: 1.0333, test_f1: 0.6670
 epoch: 88, train_loss: 0.3423, test_loss: 0.9669, test_f1: 0.6478
 epoch: 89, train_loss: 0.3059, test_loss: 0.9731, test_f1: 0.6827
 epoch: 90, train_loss: 0.3035, test_loss: 1.0513, test_f1: 0.6530
 epoch: 91, train_loss: 0.2817, test_loss: 0.9392, test_f1: 0.7028
 epoch: 92, train_loss: 0.3186, test_loss: 0.9372, test_f1: 0.6858
 epoch: 93, train_loss: 0.2721, test_loss: 0.9858, test_f1: 0.6897
 epoch: 94, train_loss: 0.2888, test_loss: 0.9649, test_f1: 0.6708
 epoch: 95, train_loss: 0.3112, test_loss: 1.0279, test_f1: 0.6939
 epoch: 96, train_loss: 0.3096, test_loss: 1.0763, test_f1: 0.6471
 epoch: 97, train_loss: 0.2691, test_loss: 1.0554, test_f1: 0.6466
 epoch: 98, train_loss: 0.2797, test_loss: 1.0788, test_f1: 0.6635
 epoch: 99, train_loss: 0.2608, test_loss: 1.0353, test_f1: 0.6768
##################ITERATION #6 ****************************************
 epoch: 0, train_loss: 1.2645, test_loss: 1.1984, test_f1: 0.4498
 epoch: 1, train_loss: 1.0120, test_loss: 1.0472, test_f1: 0.5249
 epoch: 2, train_loss: 0.9562, test_loss: 1.0336, test_f1: 0.5031
 epoch: 3, train_loss: 0.9469, test_loss: 1.0325, test_f1: 0.5115
 epoch: 4, train_loss: 0.9294, test_loss: 0.9903, test_f1: 0.5349
 epoch: 5, train_loss: 0.9137, test_loss: 0.9707, test_f1: 0.4954
 epoch: 6, train_loss: 0.9106, test_loss: 0.9400, test_f1: 0.5052
 epoch: 7, train_loss: 0.8929, test_loss: 0.8834, test_f1: 0.5749
 epoch: 8, train_loss: 0.8637, test_loss: 0.9170, test_f1: 0.4858
 epoch: 9, train_loss: 0.8566, test_loss: 0.9841, test_f1: 0.5606
 epoch: 10, train_loss: 0.8446, test_loss: 0.9094, test_f1: 0.5204
 epoch: 11, train_loss: 0.8381, test_loss: 0.9008, test_f1: 0.4910
 epoch: 12, train_loss: 0.8387, test_loss: 0.8811, test_f1: 0.5437
 epoch: 13, train_loss: 0.7993, test_loss: 0.9429, test_f1: 0.5781
 epoch: 14, train_loss: 0.7731, test_loss: 0.8281, test_f1: 0.6118
 epoch: 15, train_loss: 0.7576, test_loss: 0.8494, test_f1: 0.5769
 epoch: 16, train_loss: 0.7515, test_loss: 0.8880, test_f1: 0.6059
 epoch: 17, train_loss: 0.7607, test_loss: 0.7910, test_f1: 0.5834
 epoch: 18, train_loss: 0.7677, test_loss: 1.0100, test_f1: 0.5701
 epoch: 19, train_loss: 0.7275, test_loss: 0.8468, test_f1: 0.6064
 epoch: 20, train_loss: 0.7218, test_loss: 0.8849, test_f1: 0.6138
 epoch: 21, train_loss: 0.7178, test_loss: 0.8472, test_f1: 0.6009
 epoch: 22, train_loss: 0.7052, test_loss: 1.0535, test_f1: 0.5937
 epoch: 23, train_loss: 0.7000, test_loss: 0.8396, test_f1: 0.6396
 epoch: 24, train_loss: 0.6816, test_loss: 1.1827, test_f1: 0.5551
 epoch: 25, train_loss: 0.6717, test_loss: 1.0551, test_f1: 0.5795
 epoch: 26, train_loss: 0.6840, test_loss: 0.7849, test_f1: 0.6383
 epoch: 27, train_loss: 0.6809, test_loss: 1.0884, test_f1: 0.5286
 epoch: 28, train_loss: 0.6639, test_loss: 0.7585, test_f1: 0.6443
 epoch: 29, train_loss: 0.6386, test_loss: 0.8767, test_f1: 0.6207
 epoch: 30, train_loss: 0.6300, test_loss: 0.8528, test_f1: 0.5980
 epoch: 31, train_loss: 0.6498, test_loss: 0.7746, test_f1: 0.6057
 epoch: 32, train_loss: 0.6180, test_loss: 0.8373, test_f1: 0.6323
 epoch: 33, train_loss: 0.6104, test_loss: 0.8326, test_f1: 0.6359
 epoch: 34, train_loss: 0.6153, test_loss: 0.7502, test_f1: 0.6550
 epoch: 35, train_loss: 0.6108, test_loss: 0.8256, test_f1: 0.6469
 epoch: 36, train_loss: 0.6253, test_loss: 0.8980, test_f1: 0.6086
 epoch: 37, train_loss: 0.6280, test_loss: 0.7766, test_f1: 0.6421
 epoch: 38, train_loss: 0.5868, test_loss: 0.8349, test_f1: 0.6418
 epoch: 39, train_loss: 0.6218, test_loss: 0.8695, test_f1: 0.5931
 epoch: 40, train_loss: 0.5981, test_loss: 0.9075, test_f1: 0.6190
 epoch: 41, train_loss: 0.5947, test_loss: 0.7245, test_f1: 0.6547
 epoch: 42, train_loss: 0.5793, test_loss: 0.8531, test_f1: 0.6120
 epoch: 43, train_loss: 0.5522, test_loss: 0.7973, test_f1: 0.6518
 epoch: 44, train_loss: 0.5821, test_loss: 0.9247, test_f1: 0.6437
 epoch: 45, train_loss: 0.5393, test_loss: 0.9182, test_f1: 0.6215
 epoch: 46, train_loss: 0.5669, test_loss: 0.8402, test_f1: 0.6062
 epoch: 47, train_loss: 0.5273, test_loss: 1.1246, test_f1: 0.5684
 epoch: 48, train_loss: 0.5566, test_loss: 0.8761, test_f1: 0.6403
 epoch: 49, train_loss: 0.5523, test_loss: 0.8685, test_f1: 0.6489
 epoch: 50, train_loss: 0.5346, test_loss: 0.8700, test_f1: 0.6598
 epoch: 51, train_loss: 0.4947, test_loss: 0.9220, test_f1: 0.6489
 epoch: 52, train_loss: 0.4515, test_loss: 0.9557, test_f1: 0.5954
 epoch: 53, train_loss: 0.4433, test_loss: 0.8276, test_f1: 0.6686
 epoch: 54, train_loss: 0.4302, test_loss: 0.8522, test_f1: 0.6788
 epoch: 55, train_loss: 0.4094, test_loss: 1.1243, test_f1: 0.6254
 epoch: 56, train_loss: 0.4189, test_loss: 0.9451, test_f1: 0.6227
 epoch: 57, train_loss: 0.4140, test_loss: 0.8917, test_f1: 0.6787
 epoch: 58, train_loss: 0.3843, test_loss: 0.9001, test_f1: 0.6667
 epoch: 59, train_loss: 0.3866, test_loss: 0.9450, test_f1: 0.6836
 epoch: 60, train_loss: 0.4041, test_loss: 0.9864, test_f1: 0.6739
 epoch: 61, train_loss: 0.3881, test_loss: 0.9165, test_f1: 0.6830
 epoch: 62, train_loss: 0.3884, test_loss: 0.9897, test_f1: 0.6660
 epoch: 63, train_loss: 0.3962, test_loss: 1.1163, test_f1: 0.6425
 epoch: 64, train_loss: 0.3748, test_loss: 1.0201, test_f1: 0.6713
 epoch: 65, train_loss: 0.3555, test_loss: 1.2137, test_f1: 0.5902
 epoch: 66, train_loss: 0.3519, test_loss: 1.1034, test_f1: 0.6508
 epoch: 67, train_loss: 0.3868, test_loss: 1.0050, test_f1: 0.6574
 epoch: 68, train_loss: 0.3650, test_loss: 0.8833, test_f1: 0.6903
 epoch: 69, train_loss: 0.3765, test_loss: 1.0679, test_f1: 0.6564
 epoch: 70, train_loss: 0.3541, test_loss: 0.9994, test_f1: 0.6926
 epoch: 71, train_loss: 0.3539, test_loss: 0.9622, test_f1: 0.6908
 epoch: 72, train_loss: 0.3599, test_loss: 1.1188, test_f1: 0.6651
 epoch: 73, train_loss: 0.3334, test_loss: 1.0258, test_f1: 0.6506
 epoch: 74, train_loss: 0.3405, test_loss: 1.0619, test_f1: 0.6467
 epoch: 75, train_loss: 0.3576, test_loss: 1.2247, test_f1: 0.6442
 epoch: 76, train_loss: 0.3555, test_loss: 0.9839, test_f1: 0.6776
 epoch: 77, train_loss: 0.3356, test_loss: 1.0549, test_f1: 0.6647
 epoch: 78, train_loss: 0.3281, test_loss: 1.0370, test_f1: 0.6553
 epoch: 79, train_loss: 0.3488, test_loss: 1.0823, test_f1: 0.6654
 epoch: 80, train_loss: 0.3224, test_loss: 1.1171, test_f1: 0.6767
 epoch: 81, train_loss: 0.3151, test_loss: 1.1792, test_f1: 0.6323
 epoch: 82, train_loss: 0.3118, test_loss: 1.1222, test_f1: 0.6667
 epoch: 83, train_loss: 0.3067, test_loss: 1.1309, test_f1: 0.6757
 epoch: 84, train_loss: 0.3273, test_loss: 1.0094, test_f1: 0.6796
 epoch: 85, train_loss: 0.3261, test_loss: 1.3174, test_f1: 0.6281
 epoch: 86, train_loss: 0.3419, test_loss: 1.0376, test_f1: 0.6711
 epoch: 87, train_loss: 0.3206, test_loss: 1.0717, test_f1: 0.6554
 epoch: 88, train_loss: 0.3055, test_loss: 1.0723, test_f1: 0.6758
 epoch: 89, train_loss: 0.3104, test_loss: 1.1527, test_f1: 0.6364
 epoch: 90, train_loss: 0.3065, test_loss: 1.0347, test_f1: 0.6691
 epoch: 91, train_loss: 0.3265, test_loss: 1.2431, test_f1: 0.6445
 epoch: 92, train_loss: 0.2911, test_loss: 1.0458, test_f1: 0.6831
 epoch: 93, train_loss: 0.2862, test_loss: 1.1996, test_f1: 0.6492
 epoch: 94, train_loss: 0.2916, test_loss: 1.1197, test_f1: 0.6809
 epoch: 95, train_loss: 0.2876, test_loss: 1.2125, test_f1: 0.6637
 epoch: 96, train_loss: 0.3309, test_loss: 1.1759, test_f1: 0.6421
 epoch: 97, train_loss: 0.2895, test_loss: 1.1864, test_f1: 0.6714
 epoch: 98, train_loss: 0.2846, test_loss: 1.1383, test_f1: 0.6644
 epoch: 99, train_loss: 0.2832, test_loss: 1.1381, test_f1: 0.6460
##################ITERATION #7 ****************************************
 epoch: 0, train_loss: 1.3962, test_loss: 1.3603, test_f1: 0.3396
 epoch: 1, train_loss: 1.0017, test_loss: 1.1522, test_f1: 0.4458
 epoch: 2, train_loss: 0.9614, test_loss: 0.9926, test_f1: 0.4663
 epoch: 3, train_loss: 0.9348, test_loss: 1.0103, test_f1: 0.4733
 epoch: 4, train_loss: 0.9146, test_loss: 1.0393, test_f1: 0.5109
 epoch: 5, train_loss: 0.9101, test_loss: 0.9743, test_f1: 0.5184
 epoch: 6, train_loss: 0.9145, test_loss: 0.9906, test_f1: 0.4983
 epoch: 7, train_loss: 0.8723, test_loss: 0.8723, test_f1: 0.5000
 epoch: 8, train_loss: 0.8483, test_loss: 0.9727, test_f1: 0.5907
 epoch: 9, train_loss: 0.8511, test_loss: 0.9154, test_f1: 0.5093
 epoch: 10, train_loss: 0.8334, test_loss: 1.1293, test_f1: 0.4804
 epoch: 11, train_loss: 0.8096, test_loss: 0.8461, test_f1: 0.5414
 epoch: 12, train_loss: 0.7970, test_loss: 0.9223, test_f1: 0.5488
 epoch: 13, train_loss: 0.7851, test_loss: 0.7957, test_f1: 0.6105
 epoch: 14, train_loss: 0.8008, test_loss: 0.9653, test_f1: 0.5125
 epoch: 15, train_loss: 0.7764, test_loss: 0.7586, test_f1: 0.6146
 epoch: 16, train_loss: 0.7713, test_loss: 0.8157, test_f1: 0.5754
 epoch: 17, train_loss: 0.7657, test_loss: 0.8139, test_f1: 0.6026
 epoch: 18, train_loss: 0.7602, test_loss: 0.7561, test_f1: 0.5781
 epoch: 19, train_loss: 0.7271, test_loss: 0.7618, test_f1: 0.5763
 epoch: 20, train_loss: 0.7248, test_loss: 0.8220, test_f1: 0.6062
 epoch: 21, train_loss: 0.7081, test_loss: 0.9068, test_f1: 0.5820
 epoch: 22, train_loss: 0.7249, test_loss: 0.8418, test_f1: 0.6289
 epoch: 23, train_loss: 0.7156, test_loss: 0.7611, test_f1: 0.6393
 epoch: 24, train_loss: 0.6978, test_loss: 1.0033, test_f1: 0.5925
 epoch: 25, train_loss: 0.7110, test_loss: 0.7858, test_f1: 0.6358
 epoch: 26, train_loss: 0.6935, test_loss: 0.8186, test_f1: 0.6081
 epoch: 27, train_loss: 0.6917, test_loss: 0.9356, test_f1: 0.5987
 epoch: 28, train_loss: 0.7102, test_loss: 0.8948, test_f1: 0.5772
 epoch: 29, train_loss: 0.6825, test_loss: 0.8842, test_f1: 0.5843
 epoch: 30, train_loss: 0.6774, test_loss: 0.7801, test_f1: 0.6217
 epoch: 31, train_loss: 0.6607, test_loss: 0.8511, test_f1: 0.5609
 epoch: 32, train_loss: 0.6562, test_loss: 0.9748, test_f1: 0.6254
 epoch: 33, train_loss: 0.6558, test_loss: 0.7752, test_f1: 0.6227
 epoch: 34, train_loss: 0.6477, test_loss: 0.9379, test_f1: 0.6252
 epoch: 35, train_loss: 0.6251, test_loss: 0.8136, test_f1: 0.6042
 epoch: 36, train_loss: 0.6276, test_loss: 0.8449, test_f1: 0.6207
 epoch: 37, train_loss: 0.6421, test_loss: 0.7489, test_f1: 0.6712
 epoch: 38, train_loss: 0.6220, test_loss: 0.7430, test_f1: 0.6577
 epoch: 39, train_loss: 0.6425, test_loss: 0.7719, test_f1: 0.5959
 epoch: 40, train_loss: 0.6310, test_loss: 0.7011, test_f1: 0.6585
 epoch: 41, train_loss: 0.5893, test_loss: 0.7621, test_f1: 0.6371
 epoch: 42, train_loss: 0.6107, test_loss: 0.9900, test_f1: 0.6061
 epoch: 43, train_loss: 0.6012, test_loss: 0.7590, test_f1: 0.6241
 epoch: 44, train_loss: 0.6074, test_loss: 0.7203, test_f1: 0.6769
 epoch: 45, train_loss: 0.6143, test_loss: 0.8136, test_f1: 0.6439
 epoch: 46, train_loss: 0.5939, test_loss: 0.8876, test_f1: 0.6362
 epoch: 47, train_loss: 0.6005, test_loss: 0.7985, test_f1: 0.6405
 epoch: 48, train_loss: 0.5710, test_loss: 0.7657, test_f1: 0.6342
 epoch: 49, train_loss: 0.5684, test_loss: 0.7307, test_f1: 0.6706
 epoch: 50, train_loss: 0.5743, test_loss: 0.7811, test_f1: 0.6229
 epoch: 51, train_loss: 0.5453, test_loss: 0.8220, test_f1: 0.6503
 epoch: 52, train_loss: 0.5081, test_loss: 0.7820, test_f1: 0.6535
 epoch: 53, train_loss: 0.4766, test_loss: 0.6998, test_f1: 0.6915
 epoch: 54, train_loss: 0.4729, test_loss: 0.7601, test_f1: 0.6599
 epoch: 55, train_loss: 0.4874, test_loss: 0.9359, test_f1: 0.6212
 epoch: 56, train_loss: 0.4791, test_loss: 0.7913, test_f1: 0.6657
 epoch: 57, train_loss: 0.4529, test_loss: 0.7597, test_f1: 0.7055
 epoch: 58, train_loss: 0.4938, test_loss: 0.8441, test_f1: 0.6498
 epoch: 59, train_loss: 0.4569, test_loss: 0.7719, test_f1: 0.6834
 epoch: 60, train_loss: 0.4694, test_loss: 0.8175, test_f1: 0.6865
 epoch: 61, train_loss: 0.4648, test_loss: 0.7444, test_f1: 0.6483
 epoch: 62, train_loss: 0.4542, test_loss: 0.7829, test_f1: 0.6528
 epoch: 63, train_loss: 0.4516, test_loss: 0.7334, test_f1: 0.6652
 epoch: 64, train_loss: 0.4366, test_loss: 0.8636, test_f1: 0.6578
 epoch: 65, train_loss: 0.4180, test_loss: 0.8590, test_f1: 0.6610
 epoch: 66, train_loss: 0.4364, test_loss: 0.8556, test_f1: 0.6597
 epoch: 67, train_loss: 0.4493, test_loss: 0.8812, test_f1: 0.6613
 epoch: 68, train_loss: 0.4211, test_loss: 0.9400, test_f1: 0.6671
 epoch: 69, train_loss: 0.4137, test_loss: 0.8586, test_f1: 0.6573
 epoch: 70, train_loss: 0.4417, test_loss: 0.8189, test_f1: 0.6481
 epoch: 71, train_loss: 0.4302, test_loss: 0.7997, test_f1: 0.7004
 epoch: 72, train_loss: 0.4298, test_loss: 0.8181, test_f1: 0.6692
 epoch: 73, train_loss: 0.4239, test_loss: 0.9119, test_f1: 0.6918
 epoch: 74, train_loss: 0.3927, test_loss: 0.8730, test_f1: 0.6601
 epoch: 75, train_loss: 0.3924, test_loss: 0.9538, test_f1: 0.6784
 epoch: 76, train_loss: 0.3878, test_loss: 0.9151, test_f1: 0.6750
 epoch: 77, train_loss: 0.4207, test_loss: 0.8084, test_f1: 0.6879
 epoch: 78, train_loss: 0.4026, test_loss: 0.9610, test_f1: 0.6374
 epoch: 79, train_loss: 0.3818, test_loss: 0.8998, test_f1: 0.6674
 epoch: 80, train_loss: 0.3713, test_loss: 0.9380, test_f1: 0.6704
 epoch: 81, train_loss: 0.3865, test_loss: 0.9467, test_f1: 0.6725
 epoch: 82, train_loss: 0.3557, test_loss: 1.0231, test_f1: 0.6581
 epoch: 83, train_loss: 0.4051, test_loss: 0.8744, test_f1: 0.6766
 epoch: 84, train_loss: 0.3833, test_loss: 1.1256, test_f1: 0.6650
 epoch: 85, train_loss: 0.3562, test_loss: 0.8956, test_f1: 0.6967
 epoch: 86, train_loss: 0.3430, test_loss: 0.8643, test_f1: 0.6916
 epoch: 87, train_loss: 0.3735, test_loss: 1.0056, test_f1: 0.6283
 epoch: 88, train_loss: 0.3838, test_loss: 0.9664, test_f1: 0.6821
 epoch: 89, train_loss: 0.3549, test_loss: 1.0318, test_f1: 0.6687
 epoch: 90, train_loss: 0.3472, test_loss: 0.9145, test_f1: 0.6777
 epoch: 91, train_loss: 0.3275, test_loss: 1.0248, test_f1: 0.6826
 epoch: 92, train_loss: 0.3489, test_loss: 1.1755, test_f1: 0.6348
 epoch: 93, train_loss: 0.3428, test_loss: 1.2024, test_f1: 0.6204
 epoch: 94, train_loss: 0.3141, test_loss: 0.9568, test_f1: 0.6914
 epoch: 95, train_loss: 0.3226, test_loss: 0.9983, test_f1: 0.7023
 epoch: 96, train_loss: 0.3401, test_loss: 0.9585, test_f1: 0.6979
 epoch: 97, train_loss: 0.3373, test_loss: 0.9320, test_f1: 0.6744
 epoch: 98, train_loss: 0.3263, test_loss: 1.0523, test_f1: 0.6777
 epoch: 99, train_loss: 0.3443, test_loss: 1.0533, test_f1: 0.6452
##################ITERATION #8 ****************************************
 epoch: 0, train_loss: 1.2587, test_loss: 1.2022, test_f1: 0.4169
 epoch: 1, train_loss: 0.9910, test_loss: 0.9872, test_f1: 0.5444
 epoch: 2, train_loss: 0.9617, test_loss: 1.0786, test_f1: 0.5261
 epoch: 3, train_loss: 0.9389, test_loss: 1.0337, test_f1: 0.4948
 epoch: 4, train_loss: 0.9317, test_loss: 0.9016, test_f1: 0.5121
 epoch: 5, train_loss: 0.9125, test_loss: 0.9272, test_f1: 0.5372
 epoch: 6, train_loss: 0.8888, test_loss: 0.8589, test_f1: 0.5825
 epoch: 7, train_loss: 0.8666, test_loss: 0.9463, test_f1: 0.5687
 epoch: 8, train_loss: 0.8566, test_loss: 0.8702, test_f1: 0.5611
 epoch: 9, train_loss: 0.8462, test_loss: 1.0076, test_f1: 0.5672
 epoch: 10, train_loss: 0.8290, test_loss: 1.0090, test_f1: 0.5727
 epoch: 11, train_loss: 0.8018, test_loss: 0.8863, test_f1: 0.5822
 epoch: 12, train_loss: 0.7993, test_loss: 0.8559, test_f1: 0.5863
 epoch: 13, train_loss: 0.8131, test_loss: 0.8416, test_f1: 0.5865
 epoch: 14, train_loss: 0.7667, test_loss: 0.8928, test_f1: 0.5850
 epoch: 15, train_loss: 0.7590, test_loss: 0.9708, test_f1: 0.5968
 epoch: 16, train_loss: 0.7547, test_loss: 0.8635, test_f1: 0.5956
 epoch: 17, train_loss: 0.7340, test_loss: 0.7365, test_f1: 0.6437
 epoch: 18, train_loss: 0.7338, test_loss: 0.8379, test_f1: 0.5743
 epoch: 19, train_loss: 0.7184, test_loss: 0.8308, test_f1: 0.6107
 epoch: 20, train_loss: 0.7092, test_loss: 0.7767, test_f1: 0.5958
 epoch: 21, train_loss: 0.6975, test_loss: 0.7618, test_f1: 0.6264
 epoch: 22, train_loss: 0.6865, test_loss: 0.7108, test_f1: 0.6535
 epoch: 23, train_loss: 0.6945, test_loss: 0.9114, test_f1: 0.6087
 epoch: 24, train_loss: 0.6865, test_loss: 0.7809, test_f1: 0.5999
 epoch: 25, train_loss: 0.6723, test_loss: 0.9424, test_f1: 0.5694
 epoch: 26, train_loss: 0.6653, test_loss: 0.7846, test_f1: 0.6453
 epoch: 27, train_loss: 0.6620, test_loss: 0.9273, test_f1: 0.6109
 epoch: 28, train_loss: 0.6693, test_loss: 0.8313, test_f1: 0.5981
 epoch: 29, train_loss: 0.6655, test_loss: 1.0285, test_f1: 0.5662
 epoch: 30, train_loss: 0.6827, test_loss: 0.8033, test_f1: 0.6474
 epoch: 31, train_loss: 0.6218, test_loss: 0.8496, test_f1: 0.6280
 epoch: 32, train_loss: 0.6064, test_loss: 0.7517, test_f1: 0.6441
 epoch: 33, train_loss: 0.5979, test_loss: 1.2271, test_f1: 0.5072
 epoch: 34, train_loss: 0.6220, test_loss: 0.8556, test_f1: 0.6230
 epoch: 35, train_loss: 0.6255, test_loss: 0.8228, test_f1: 0.6344
 epoch: 36, train_loss: 0.5915, test_loss: 0.8001, test_f1: 0.6610
 epoch: 37, train_loss: 0.6088, test_loss: 1.4266, test_f1: 0.4763
 epoch: 38, train_loss: 0.5938, test_loss: 0.9057, test_f1: 0.6194
 epoch: 39, train_loss: 0.5631, test_loss: 0.8667, test_f1: 0.6386
 epoch: 40, train_loss: 0.5620, test_loss: 0.8632, test_f1: 0.6567
 epoch: 41, train_loss: 0.5385, test_loss: 0.7583, test_f1: 0.6717
 epoch: 42, train_loss: 0.5743, test_loss: 0.7704, test_f1: 0.6329
 epoch: 43, train_loss: 0.5991, test_loss: 0.9287, test_f1: 0.5959
 epoch: 44, train_loss: 0.5777, test_loss: 0.8760, test_f1: 0.6395
 epoch: 45, train_loss: 0.5728, test_loss: 0.8251, test_f1: 0.6645
 epoch: 46, train_loss: 0.5600, test_loss: 0.7922, test_f1: 0.6696
 epoch: 47, train_loss: 0.5187, test_loss: 0.8358, test_f1: 0.6743
 epoch: 48, train_loss: 0.5336, test_loss: 0.8345, test_f1: 0.6528
 epoch: 49, train_loss: 0.5208, test_loss: 0.8042, test_f1: 0.6732
 epoch: 50, train_loss: 0.5215, test_loss: 0.9514, test_f1: 0.6551
 epoch: 51, train_loss: 0.4848, test_loss: 0.8136, test_f1: 0.6638
 epoch: 52, train_loss: 0.4356, test_loss: 0.8549, test_f1: 0.6777
 epoch: 53, train_loss: 0.4402, test_loss: 0.9367, test_f1: 0.6738
 epoch: 54, train_loss: 0.4317, test_loss: 0.8716, test_f1: 0.6772
 epoch: 55, train_loss: 0.4153, test_loss: 0.8427, test_f1: 0.6961
 epoch: 56, train_loss: 0.4233, test_loss: 0.8410, test_f1: 0.6711
 epoch: 57, train_loss: 0.4046, test_loss: 0.8990, test_f1: 0.6671
 epoch: 58, train_loss: 0.3886, test_loss: 0.9354, test_f1: 0.6724
 epoch: 59, train_loss: 0.4018, test_loss: 0.9240, test_f1: 0.6493
 epoch: 60, train_loss: 0.3812, test_loss: 0.9631, test_f1: 0.6841
 epoch: 61, train_loss: 0.3756, test_loss: 0.9449, test_f1: 0.6575
 epoch: 62, train_loss: 0.3854, test_loss: 0.9320, test_f1: 0.6772
 epoch: 63, train_loss: 0.3952, test_loss: 0.9643, test_f1: 0.6734
 epoch: 64, train_loss: 0.3967, test_loss: 0.9343, test_f1: 0.6815
 epoch: 65, train_loss: 0.3785, test_loss: 0.8946, test_f1: 0.6689
 epoch: 66, train_loss: 0.3678, test_loss: 0.9730, test_f1: 0.6565
 epoch: 67, train_loss: 0.3504, test_loss: 1.0543, test_f1: 0.6734
 epoch: 68, train_loss: 0.3321, test_loss: 0.9125, test_f1: 0.6905
 epoch: 69, train_loss: 0.3391, test_loss: 0.9523, test_f1: 0.7045
 epoch: 70, train_loss: 0.3506, test_loss: 1.1495, test_f1: 0.6855
 epoch: 71, train_loss: 0.3763, test_loss: 0.9147, test_f1: 0.6737
 epoch: 72, train_loss: 0.3734, test_loss: 1.0069, test_f1: 0.6676
 epoch: 73, train_loss: 0.3787, test_loss: 0.9585, test_f1: 0.6968
 epoch: 74, train_loss: 0.3584, test_loss: 1.0483, test_f1: 0.6676
 epoch: 75, train_loss: 0.3514, test_loss: 1.2442, test_f1: 0.6773
 epoch: 76, train_loss: 0.3259, test_loss: 1.0343, test_f1: 0.6847
 epoch: 77, train_loss: 0.3536, test_loss: 1.1220, test_f1: 0.6759
 epoch: 78, train_loss: 0.3438, test_loss: 1.1460, test_f1: 0.6848
 epoch: 79, train_loss: 0.3261, test_loss: 1.2998, test_f1: 0.6957
 epoch: 80, train_loss: 0.3070, test_loss: 1.1632, test_f1: 0.6835
 epoch: 81, train_loss: 0.3107, test_loss: 1.0927, test_f1: 0.6893
 epoch: 82, train_loss: 0.3203, test_loss: 1.5711, test_f1: 0.6551
 epoch: 83, train_loss: 0.3118, test_loss: 1.4170, test_f1: 0.6386
 epoch: 84, train_loss: 0.3048, test_loss: 1.0657, test_f1: 0.6894
 epoch: 85, train_loss: 0.2718, test_loss: 1.3639, test_f1: 0.6855
 epoch: 86, train_loss: 0.3014, test_loss: 1.3418, test_f1: 0.6629
 epoch: 87, train_loss: 0.3109, test_loss: 1.2271, test_f1: 0.6531
 epoch: 88, train_loss: 0.3161, test_loss: 1.2835, test_f1: 0.6546
 epoch: 89, train_loss: 0.3058, test_loss: 1.1583, test_f1: 0.6578
 epoch: 90, train_loss: 0.3083, test_loss: 1.2837, test_f1: 0.6374
 epoch: 91, train_loss: 0.2784, test_loss: 1.2257, test_f1: 0.6827
 epoch: 92, train_loss: 0.2654, test_loss: 1.1163, test_f1: 0.6878
 epoch: 93, train_loss: 0.2736, test_loss: 1.3309, test_f1: 0.6835
 epoch: 94, train_loss: 0.2931, test_loss: 1.3328, test_f1: 0.6631
 epoch: 95, train_loss: 0.3387, test_loss: 1.5309, test_f1: 0.6358
 epoch: 96, train_loss: 0.3089, test_loss: 1.1893, test_f1: 0.6200
 epoch: 97, train_loss: 0.3021, test_loss: 1.2894, test_f1: 0.6414
 epoch: 98, train_loss: 0.2792, test_loss: 1.4185, test_f1: 0.6680
 epoch: 99, train_loss: 0.2740, test_loss: 1.1490, test_f1: 0.6608
##################ITERATION #9 ****************************************
 epoch: 0, train_loss: 1.3921, test_loss: 1.3636, test_f1: 0.3459
 epoch: 1, train_loss: 1.0047, test_loss: 0.9821, test_f1: 0.4463
 epoch: 2, train_loss: 0.9777, test_loss: 1.0179, test_f1: 0.4852
 epoch: 3, train_loss: 0.9496, test_loss: 1.0525, test_f1: 0.5079
 epoch: 4, train_loss: 0.9367, test_loss: 0.9949, test_f1: 0.4815
 epoch: 5, train_loss: 0.9199, test_loss: 1.0053, test_f1: 0.5031
 epoch: 6, train_loss: 0.9214, test_loss: 0.9788, test_f1: 0.5058
 epoch: 7, train_loss: 0.8996, test_loss: 0.9897, test_f1: 0.5230
 epoch: 8, train_loss: 0.8494, test_loss: 1.0055, test_f1: 0.5671
 epoch: 9, train_loss: 0.8364, test_loss: 0.9723, test_f1: 0.5218
 epoch: 10, train_loss: 0.8259, test_loss: 0.8707, test_f1: 0.5381
 epoch: 11, train_loss: 0.8157, test_loss: 0.9145, test_f1: 0.5324
 epoch: 12, train_loss: 0.8103, test_loss: 0.8759, test_f1: 0.5788
 epoch: 13, train_loss: 0.7974, test_loss: 0.9034, test_f1: 0.5644
 epoch: 14, train_loss: 0.7909, test_loss: 1.1581, test_f1: 0.5141
 epoch: 15, train_loss: 0.7691, test_loss: 0.8711, test_f1: 0.5848
 epoch: 16, train_loss: 0.7684, test_loss: 0.9829, test_f1: 0.5853
 epoch: 17, train_loss: 0.7607, test_loss: 1.0415, test_f1: 0.5589
 epoch: 18, train_loss: 0.7220, test_loss: 1.0351, test_f1: 0.6117
 epoch: 19, train_loss: 0.7286, test_loss: 0.7836, test_f1: 0.6267
 epoch: 20, train_loss: 0.7205, test_loss: 0.7999, test_f1: 0.6366
 epoch: 21, train_loss: 0.7077, test_loss: 1.0780, test_f1: 0.5164
 epoch: 22, train_loss: 0.7082, test_loss: 1.0993, test_f1: 0.6090
 epoch: 23, train_loss: 0.7260, test_loss: 0.9006, test_f1: 0.6125
 epoch: 24, train_loss: 0.6963, test_loss: 0.8715, test_f1: 0.6268
 epoch: 25, train_loss: 0.6690, test_loss: 0.7876, test_f1: 0.6353
 epoch: 26, train_loss: 0.6654, test_loss: 0.8158, test_f1: 0.6218
 epoch: 27, train_loss: 0.6562, test_loss: 0.7322, test_f1: 0.6591
 epoch: 28, train_loss: 0.6365, test_loss: 0.9253, test_f1: 0.5996
 epoch: 29, train_loss: 0.6427, test_loss: 0.9343, test_f1: 0.5856
 epoch: 30, train_loss: 0.6137, test_loss: 0.8662, test_f1: 0.6275
 epoch: 31, train_loss: 0.6422, test_loss: 0.8519, test_f1: 0.6188
 epoch: 32, train_loss: 0.6226, test_loss: 0.8996, test_f1: 0.5989
 epoch: 33, train_loss: 0.6047, test_loss: 0.8194, test_f1: 0.6716
 epoch: 34, train_loss: 0.5990, test_loss: 0.8160, test_f1: 0.6290
 epoch: 35, train_loss: 0.6232, test_loss: 1.3223, test_f1: 0.4673
 epoch: 36, train_loss: 0.6258, test_loss: 0.8938, test_f1: 0.6364
 epoch: 37, train_loss: 0.6036, test_loss: 1.0438, test_f1: 0.5685
 epoch: 38, train_loss: 0.6154, test_loss: 1.1384, test_f1: 0.5576
 epoch: 39, train_loss: 0.5740, test_loss: 1.0650, test_f1: 0.6317
 epoch: 40, train_loss: 0.5635, test_loss: 0.9745, test_f1: 0.5769
 epoch: 41, train_loss: 0.5842, test_loss: 1.0548, test_f1: 0.5842
 epoch: 42, train_loss: 0.5549, test_loss: 1.0092, test_f1: 0.6200
 epoch: 43, train_loss: 0.5509, test_loss: 0.8286, test_f1: 0.6508
 epoch: 44, train_loss: 0.5298, test_loss: 0.8783, test_f1: 0.6457
 epoch: 45, train_loss: 0.5321, test_loss: 1.2086, test_f1: 0.5485
 epoch: 46, train_loss: 0.5377, test_loss: 0.8070, test_f1: 0.6781
 epoch: 47, train_loss: 0.5391, test_loss: 0.9124, test_f1: 0.6465
 epoch: 48, train_loss: 0.5192, test_loss: 0.8886, test_f1: 0.6344
 epoch: 49, train_loss: 0.5306, test_loss: 0.8250, test_f1: 0.6475
 epoch: 50, train_loss: 0.5171, test_loss: 0.9176, test_f1: 0.6498
 epoch: 51, train_loss: 0.4943, test_loss: 0.9603, test_f1: 0.6473
 epoch: 52, train_loss: 0.4450, test_loss: 0.9068, test_f1: 0.6752
 epoch: 53, train_loss: 0.4337, test_loss: 0.9469, test_f1: 0.6581
 epoch: 54, train_loss: 0.4310, test_loss: 0.9876, test_f1: 0.6526
 epoch: 55, train_loss: 0.4086, test_loss: 0.8534, test_f1: 0.6610
 epoch: 56, train_loss: 0.3951, test_loss: 0.9221, test_f1: 0.6656
 epoch: 57, train_loss: 0.3803, test_loss: 0.9230, test_f1: 0.6602
 epoch: 58, train_loss: 0.4037, test_loss: 0.9411, test_f1: 0.6714
 epoch: 59, train_loss: 0.3872, test_loss: 0.9901, test_f1: 0.6522
 epoch: 60, train_loss: 0.3838, test_loss: 1.0493, test_f1: 0.6585
 epoch: 61, train_loss: 0.4099, test_loss: 1.2270, test_f1: 0.6228
 epoch: 62, train_loss: 0.3931, test_loss: 0.9763, test_f1: 0.6495
 epoch: 63, train_loss: 0.4182, test_loss: 0.9224, test_f1: 0.6767
 epoch: 64, train_loss: 0.3908, test_loss: 1.0935, test_f1: 0.6621
 epoch: 65, train_loss: 0.3679, test_loss: 0.9728, test_f1: 0.6558
 epoch: 66, train_loss: 0.3521, test_loss: 1.0169, test_f1: 0.6783
 epoch: 67, train_loss: 0.3828, test_loss: 1.0742, test_f1: 0.6618
 epoch: 68, train_loss: 0.3638, test_loss: 1.1413, test_f1: 0.6562
 epoch: 69, train_loss: 0.3324, test_loss: 1.0625, test_f1: 0.6630
 epoch: 70, train_loss: 0.3438, test_loss: 1.1364, test_f1: 0.6327
 epoch: 71, train_loss: 0.3411, test_loss: 1.1070, test_f1: 0.6665
 epoch: 72, train_loss: 0.3540, test_loss: 1.1115, test_f1: 0.6512
 epoch: 73, train_loss: 0.3646, test_loss: 1.0042, test_f1: 0.6899
 epoch: 74, train_loss: 0.3279, test_loss: 1.1585, test_f1: 0.6745
 epoch: 75, train_loss: 0.3330, test_loss: 1.0521, test_f1: 0.6999
 epoch: 76, train_loss: 0.3264, test_loss: 1.0758, test_f1: 0.6779
 epoch: 77, train_loss: 0.3285, test_loss: 1.0913, test_f1: 0.6919
 epoch: 78, train_loss: 0.3422, test_loss: 1.0775, test_f1: 0.6585
 epoch: 79, train_loss: 0.3271, test_loss: 1.1526, test_f1: 0.6729
 epoch: 80, train_loss: 0.3009, test_loss: 1.2590, test_f1: 0.6773
 epoch: 81, train_loss: 0.2995, test_loss: 1.1724, test_f1: 0.6475
 epoch: 82, train_loss: 0.2936, test_loss: 1.2351, test_f1: 0.6355
 epoch: 83, train_loss: 0.2994, test_loss: 1.4511, test_f1: 0.6811
 epoch: 84, train_loss: 0.3173, test_loss: 1.1589, test_f1: 0.6817
 epoch: 85, train_loss: 0.2955, test_loss: 1.2868, test_f1: 0.6776
 epoch: 86, train_loss: 0.3014, test_loss: 1.1189, test_f1: 0.6787
 epoch: 87, train_loss: 0.3031, test_loss: 1.1985, test_f1: 0.6603
 epoch: 88, train_loss: 0.3020, test_loss: 1.5387, test_f1: 0.6587
 epoch: 89, train_loss: 0.3047, test_loss: 1.1139, test_f1: 0.6550
 epoch: 90, train_loss: 0.2854, test_loss: 1.1479, test_f1: 0.6548
 epoch: 91, train_loss: 0.2928, test_loss: 1.4123, test_f1: 0.6467
 epoch: 92, train_loss: 0.2788, test_loss: 1.3386, test_f1: 0.6375
 epoch: 93, train_loss: 0.2723, test_loss: 1.3048, test_f1: 0.6661
 epoch: 94, train_loss: 0.2948, test_loss: 1.4062, test_f1: 0.6775
 epoch: 95, train_loss: 0.2747, test_loss: 1.2826, test_f1: 0.6945
 epoch: 96, train_loss: 0.2737, test_loss: 1.3838, test_f1: 0.6545
 epoch: 97, train_loss: 0.2945, test_loss: 1.1886, test_f1: 0.6762
 epoch: 98, train_loss: 0.2890, test_loss: 1.2426, test_f1: 0.6644
 epoch: 99, train_loss: 0.2928, test_loss: 1.3513, test_f1: 0.6582

Training completed in 610.55 seconds
Best F1: 0.7090 at epoch 75
Mean F1 across iterations: 0.7024  0.0050
========================FINAL RESULTS================================
FEGIN weighted F1: 0.7090  0.0050
python main.py --data ltspice_examples --representation component_pin_net --model FEGIN --layers 6 --hiddens 128 --batch_size 128 --lr 0.01 --emb_size 250 --epochs 100 --save_appendix component_pin_net_L6_H128_BS128_LR0.01_E250 --no_val
-----



STDERR:
  File "main.py", line 370, in <module>
    main()
  File "main.py", line 254, in main
    dataset = dataset_class(
  File "/home/philip/projects/ltspice_examples_code_repo/Circuit-Completion-Using-GNNs/component_classification_with_link_prediction_head/evaluation/FEGIN/kernel/circuit_datasets.py", line 15, in __init__
    self.data, self.slices = torch.load(self.processed_paths[0])
  File "/home/philip/.local/lib/python3.8/site-packages/torch/serialization.py", line 1040, in load
    warnings.warn(
  File "/usr/lib/python3.8/warnings.py", line 109, in _showwarnmsg
    sw(msg.message, msg.category, msg.filename, msg.lineno,
  File "main.py", line 47, in warn_with_traceback
    traceback.print_stack(file=log)
/home/philip/projects/ltspice_examples_code_repo/Circuit-Completion-Using-GNNs/component_classification_with_link_prediction_head/evaluation/FEGIN/kernel/circuit_datasets.py:15: FutureWarning: You are using `torch.load` with `weights_only=False` (the current default value), which uses the default pickle module implicitly. It is possible to construct malicious pickle data which will execute arbitrary code during unpickling (See https://github.com/pytorch/pytorch/blob/main/SECURITY.md#untrusted-models for more details). In a future release, the default value for `weights_only` will be flipped to `True`. This limits the functions that could be executed during unpickling. Arbitrary objects will no longer be allowed to be loaded via this mode unless they are explicitly allowlisted by the user via `torch.serialization.add_safe_globals`. We recommend you start setting `weights_only=True` for any use case where you don't have full control of the loaded file. Please open an issue on GitHub for any issues related to this experimental feature.
  self.data, self.slices = torch.load(self.processed_paths[0])
