STDOUT:
Results will be saved in /home/philip/projects/ltspice_examples_code_repo/Circuit-Completion-Using-GNNs/component_classification_with_link_prediction_head/evaluation/FEGIN/results/model_FEGIN_dataset_ltspice_demos
Command line input: python main.py --data ltspice_demos --representation component_pin_net --model FEGIN --layers 2 --hiddens 128 --batch_size 64 --lr 0.001 --emb_size 128 --epochs 100 --save_appendix component_pin_net_L2_H128_BS64_LR0.001_E128 --no_val
 is saved.
-----
ltspice_demos - FEGIN
Using 2 layers, 128 hidden units, h = 2
Loading component_pin_net representation dataset
ENTERED
Training FEGIN on component_pin_net representation
Train: 1565, Test: 383
##################ITERATION #0 ****************************************
 epoch: 0, train_loss: 1.2122, test_loss: 1.3827, test_f1: 0.1365
 epoch: 1, train_loss: 1.0393, test_loss: 1.1233, test_f1: 0.4496
 epoch: 2, train_loss: 0.9932, test_loss: 1.0582, test_f1: 0.4614
 epoch: 3, train_loss: 0.9544, test_loss: 1.0167, test_f1: 0.5305
 epoch: 4, train_loss: 0.9323, test_loss: 1.0064, test_f1: 0.5414
 epoch: 5, train_loss: 0.9092, test_loss: 0.9769, test_f1: 0.5654
 epoch: 6, train_loss: 0.8725, test_loss: 0.9836, test_f1: 0.5793
 epoch: 7, train_loss: 0.8469, test_loss: 0.9564, test_f1: 0.5853
 epoch: 8, train_loss: 0.8165, test_loss: 0.9290, test_f1: 0.6016
 epoch: 9, train_loss: 0.8169, test_loss: 0.9357, test_f1: 0.5896
 epoch: 10, train_loss: 0.7711, test_loss: 0.9219, test_f1: 0.6057
 epoch: 11, train_loss: 0.7571, test_loss: 0.9944, test_f1: 0.5320
 epoch: 12, train_loss: 0.7330, test_loss: 0.8943, test_f1: 0.6444
 epoch: 13, train_loss: 0.7081, test_loss: 1.0121, test_f1: 0.5797
 epoch: 14, train_loss: 0.6898, test_loss: 0.9999, test_f1: 0.5843
 epoch: 15, train_loss: 0.6843, test_loss: 0.8864, test_f1: 0.6750
 epoch: 16, train_loss: 0.6862, test_loss: 0.9136, test_f1: 0.6203
 epoch: 17, train_loss: 0.6468, test_loss: 1.0126, test_f1: 0.6060
 epoch: 18, train_loss: 0.6380, test_loss: 0.9419, test_f1: 0.6369
 epoch: 19, train_loss: 0.6157, test_loss: 0.9174, test_f1: 0.6685
 epoch: 20, train_loss: 0.5974, test_loss: 1.1755, test_f1: 0.5736
 epoch: 21, train_loss: 0.5808, test_loss: 1.0067, test_f1: 0.5980
 epoch: 22, train_loss: 0.5755, test_loss: 0.9637, test_f1: 0.6590
 epoch: 23, train_loss: 0.5481, test_loss: 1.0387, test_f1: 0.6382
 epoch: 24, train_loss: 0.5553, test_loss: 1.0394, test_f1: 0.6333
 epoch: 25, train_loss: 0.5254, test_loss: 1.0361, test_f1: 0.6642
 epoch: 26, train_loss: 0.5508, test_loss: 1.0815, test_f1: 0.6321
 epoch: 27, train_loss: 0.4941, test_loss: 1.0985, test_f1: 0.6447
 epoch: 28, train_loss: 0.5164, test_loss: 1.0588, test_f1: 0.6319
 epoch: 29, train_loss: 0.4933, test_loss: 1.1309, test_f1: 0.6707
 epoch: 30, train_loss: 0.4737, test_loss: 1.2306, test_f1: 0.6211
 epoch: 31, train_loss: 0.4735, test_loss: 1.2810, test_f1: 0.5873
 epoch: 32, train_loss: 0.4196, test_loss: 1.3062, test_f1: 0.5708
 epoch: 33, train_loss: 0.4631, test_loss: 1.4754, test_f1: 0.6194
 epoch: 34, train_loss: 0.4715, test_loss: 1.1396, test_f1: 0.6544
 epoch: 35, train_loss: 0.4191, test_loss: 1.2361, test_f1: 0.6483
 epoch: 36, train_loss: 0.4229, test_loss: 1.3161, test_f1: 0.5990
 epoch: 37, train_loss: 0.4176, test_loss: 1.2577, test_f1: 0.6431
 epoch: 38, train_loss: 0.3986, test_loss: 1.2010, test_f1: 0.6584
 epoch: 39, train_loss: 0.3864, test_loss: 1.2405, test_f1: 0.6200
 epoch: 40, train_loss: 0.3915, test_loss: 1.4536, test_f1: 0.6300
 epoch: 41, train_loss: 0.3774, test_loss: 1.4333, test_f1: 0.6207
 epoch: 42, train_loss: 0.3481, test_loss: 1.4123, test_f1: 0.6636
 epoch: 43, train_loss: 0.3847, test_loss: 1.4632, test_f1: 0.6549
 epoch: 44, train_loss: 0.3634, test_loss: 1.4771, test_f1: 0.6574
 epoch: 45, train_loss: 0.3365, test_loss: 1.5174, test_f1: 0.6231
 epoch: 46, train_loss: 0.3405, test_loss: 1.5690, test_f1: 0.6541
 epoch: 47, train_loss: 0.3616, test_loss: 1.5690, test_f1: 0.5930
 epoch: 48, train_loss: 0.3274, test_loss: 1.6924, test_f1: 0.5802
 epoch: 49, train_loss: 0.3383, test_loss: 1.5753, test_f1: 0.6481
 epoch: 50, train_loss: 0.3265, test_loss: 1.4981, test_f1: 0.6024
 epoch: 51, train_loss: 0.2706, test_loss: 1.5227, test_f1: 0.6395
 epoch: 52, train_loss: 0.2577, test_loss: 1.6026, test_f1: 0.6195
 epoch: 53, train_loss: 0.2424, test_loss: 1.6207, test_f1: 0.6512
 epoch: 54, train_loss: 0.2399, test_loss: 1.6843, test_f1: 0.6586
 epoch: 55, train_loss: 0.2295, test_loss: 1.7236, test_f1: 0.6322
 epoch: 56, train_loss: 0.2093, test_loss: 1.7266, test_f1: 0.6342
 epoch: 57, train_loss: 0.2071, test_loss: 1.7671, test_f1: 0.6464
 epoch: 58, train_loss: 0.2114, test_loss: 1.8829, test_f1: 0.6376
 epoch: 59, train_loss: 0.2486, test_loss: 1.9329, test_f1: 0.5887
 epoch: 60, train_loss: 0.2446, test_loss: 1.7606, test_f1: 0.6381
 epoch: 61, train_loss: 0.2296, test_loss: 1.8293, test_f1: 0.6117
 epoch: 62, train_loss: 0.1947, test_loss: 1.8507, test_f1: 0.6294
 epoch: 63, train_loss: 0.2019, test_loss: 1.8685, test_f1: 0.6560
 epoch: 64, train_loss: 0.1890, test_loss: 1.8238, test_f1: 0.6466
 epoch: 65, train_loss: 0.1949, test_loss: 1.9322, test_f1: 0.6357
 epoch: 66, train_loss: 0.1864, test_loss: 2.0016, test_f1: 0.6334
 epoch: 67, train_loss: 0.1844, test_loss: 1.9483, test_f1: 0.6352
 epoch: 68, train_loss: 0.1767, test_loss: 1.9142, test_f1: 0.6466
 epoch: 69, train_loss: 0.1813, test_loss: 1.8176, test_f1: 0.6642
 epoch: 70, train_loss: 0.1702, test_loss: 1.9548, test_f1: 0.6368
 epoch: 71, train_loss: 0.1710, test_loss: 2.0224, test_f1: 0.6303
 epoch: 72, train_loss: 0.1691, test_loss: 1.9972, test_f1: 0.6495
 epoch: 73, train_loss: 0.1802, test_loss: 2.0157, test_f1: 0.6367
 epoch: 74, train_loss: 0.1518, test_loss: 2.2083, test_f1: 0.6412
 epoch: 75, train_loss: 0.1526, test_loss: 2.1561, test_f1: 0.6377
 epoch: 76, train_loss: 0.1384, test_loss: 2.1760, test_f1: 0.6441
 epoch: 77, train_loss: 0.1715, test_loss: 2.1224, test_f1: 0.6682
 epoch: 78, train_loss: 0.1321, test_loss: 2.1602, test_f1: 0.6439
 epoch: 79, train_loss: 0.1472, test_loss: 2.3016, test_f1: 0.6453
 epoch: 80, train_loss: 0.1702, test_loss: 2.2093, test_f1: 0.6446
 epoch: 81, train_loss: 0.1487, test_loss: 2.2202, test_f1: 0.6501
 epoch: 82, train_loss: 0.1383, test_loss: 2.3306, test_f1: 0.6357
 epoch: 83, train_loss: 0.1523, test_loss: 2.2557, test_f1: 0.6358
 epoch: 84, train_loss: 0.1541, test_loss: 2.1824, test_f1: 0.6525
 epoch: 85, train_loss: 0.1260, test_loss: 2.3486, test_f1: 0.6316
 epoch: 86, train_loss: 0.1280, test_loss: 2.4799, test_f1: 0.6287
 epoch: 87, train_loss: 0.1265, test_loss: 2.1683, test_f1: 0.6570
 epoch: 88, train_loss: 0.1540, test_loss: 2.4112, test_f1: 0.6175
 epoch: 89, train_loss: 0.1569, test_loss: 2.3646, test_f1: 0.6338
 epoch: 90, train_loss: 0.1483, test_loss: 2.3115, test_f1: 0.6295
 epoch: 91, train_loss: 0.1327, test_loss: 2.5239, test_f1: 0.6556
 epoch: 92, train_loss: 0.1466, test_loss: 2.3730, test_f1: 0.6375
 epoch: 93, train_loss: 0.1381, test_loss: 2.3013, test_f1: 0.6496
 epoch: 94, train_loss: 0.1225, test_loss: 2.4537, test_f1: 0.6138
 epoch: 95, train_loss: 0.1199, test_loss: 2.5578, test_f1: 0.6318
 epoch: 96, train_loss: 0.1297, test_loss: 2.7396, test_f1: 0.6479
 epoch: 97, train_loss: 0.1091, test_loss: 2.5463, test_f1: 0.6393
 epoch: 98, train_loss: 0.1264, test_loss: 2.6119, test_f1: 0.6276
 epoch: 99, train_loss: 0.1384, test_loss: 2.4794, test_f1: 0.6182
##################ITERATION #1 ****************************************
 epoch: 0, train_loss: 1.0779, test_loss: 1.4849, test_f1: 0.3299
 epoch: 1, train_loss: 0.9413, test_loss: 1.2089, test_f1: 0.3541
 epoch: 2, train_loss: 0.8953, test_loss: 0.9911, test_f1: 0.5100
 epoch: 3, train_loss: 0.8609, test_loss: 1.0380, test_f1: 0.5329
 epoch: 4, train_loss: 0.8222, test_loss: 1.0592, test_f1: 0.5197
 epoch: 5, train_loss: 0.7919, test_loss: 1.1223, test_f1: 0.4862
 epoch: 6, train_loss: 0.7602, test_loss: 1.0769, test_f1: 0.5460
 epoch: 7, train_loss: 0.7136, test_loss: 1.1304, test_f1: 0.5640
 epoch: 8, train_loss: 0.7143, test_loss: 1.1200, test_f1: 0.5937
 epoch: 9, train_loss: 0.6832, test_loss: 1.0315, test_f1: 0.5873
 epoch: 10, train_loss: 0.6759, test_loss: 1.1258, test_f1: 0.5503
 epoch: 11, train_loss: 0.6772, test_loss: 1.0086, test_f1: 0.5805
 epoch: 12, train_loss: 0.6372, test_loss: 1.1116, test_f1: 0.5531
 epoch: 13, train_loss: 0.6265, test_loss: 1.1978, test_f1: 0.5628
 epoch: 14, train_loss: 0.6086, test_loss: 1.1143, test_f1: 0.6179
 epoch: 15, train_loss: 0.5972, test_loss: 1.0881, test_f1: 0.6290
 epoch: 16, train_loss: 0.5579, test_loss: 1.2616, test_f1: 0.5839
 epoch: 17, train_loss: 0.5540, test_loss: 1.1148, test_f1: 0.6307
 epoch: 18, train_loss: 0.5645, test_loss: 1.1890, test_f1: 0.6191
 epoch: 19, train_loss: 0.5376, test_loss: 1.3505, test_f1: 0.6000
 epoch: 20, train_loss: 0.5148, test_loss: 1.2400, test_f1: 0.6300
 epoch: 21, train_loss: 0.5233, test_loss: 1.2555, test_f1: 0.6369
 epoch: 22, train_loss: 0.4825, test_loss: 1.3141, test_f1: 0.5717
 epoch: 23, train_loss: 0.4918, test_loss: 1.2249, test_f1: 0.6243
 epoch: 24, train_loss: 0.4777, test_loss: 1.4818, test_f1: 0.5798
 epoch: 25, train_loss: 0.4509, test_loss: 1.3492, test_f1: 0.6062
 epoch: 26, train_loss: 0.4529, test_loss: 1.7310, test_f1: 0.5710
 epoch: 27, train_loss: 0.4482, test_loss: 1.5811, test_f1: 0.5177
 epoch: 28, train_loss: 0.4315, test_loss: 1.5781, test_f1: 0.5790
 epoch: 29, train_loss: 0.4234, test_loss: 1.4893, test_f1: 0.5968
 epoch: 30, train_loss: 0.4278, test_loss: 1.5578, test_f1: 0.5781
 epoch: 31, train_loss: 0.4123, test_loss: 1.9902, test_f1: 0.5079
 epoch: 32, train_loss: 0.3788, test_loss: 1.4781, test_f1: 0.6348
 epoch: 33, train_loss: 0.4088, test_loss: 1.5152, test_f1: 0.5944
 epoch: 34, train_loss: 0.4583, test_loss: 1.5701, test_f1: 0.6213
 epoch: 35, train_loss: 0.3749, test_loss: 1.4908, test_f1: 0.6373
 epoch: 36, train_loss: 0.3553, test_loss: 1.4632, test_f1: 0.6291
 epoch: 37, train_loss: 0.3860, test_loss: 1.5631, test_f1: 0.5615
 epoch: 38, train_loss: 0.3349, test_loss: 1.5572, test_f1: 0.6330
 epoch: 39, train_loss: 0.3300, test_loss: 1.5336, test_f1: 0.6498
 epoch: 40, train_loss: 0.3240, test_loss: 1.8764, test_f1: 0.6141
 epoch: 41, train_loss: 0.3263, test_loss: 1.9648, test_f1: 0.6085
 epoch: 42, train_loss: 0.2954, test_loss: 1.6824, test_f1: 0.6538
 epoch: 43, train_loss: 0.3117, test_loss: 1.7934, test_f1: 0.6092
 epoch: 44, train_loss: 0.3113, test_loss: 1.7910, test_f1: 0.6256
 epoch: 45, train_loss: 0.3461, test_loss: 2.0356, test_f1: 0.5315
 epoch: 46, train_loss: 0.3225, test_loss: 1.6037, test_f1: 0.6386
 epoch: 47, train_loss: 0.3037, test_loss: 1.7733, test_f1: 0.6193
 epoch: 48, train_loss: 0.2775, test_loss: 1.7455, test_f1: 0.6552
 epoch: 49, train_loss: 0.2914, test_loss: 1.7710, test_f1: 0.6072
 epoch: 50, train_loss: 0.2634, test_loss: 1.7563, test_f1: 0.6771
 epoch: 51, train_loss: 0.2267, test_loss: 1.8297, test_f1: 0.6575
 epoch: 52, train_loss: 0.2088, test_loss: 1.7850, test_f1: 0.6600
 epoch: 53, train_loss: 0.2166, test_loss: 1.8392, test_f1: 0.6681
 epoch: 54, train_loss: 0.2207, test_loss: 1.9853, test_f1: 0.6564
 epoch: 55, train_loss: 0.2116, test_loss: 1.8814, test_f1: 0.6642
 epoch: 56, train_loss: 0.1898, test_loss: 1.9743, test_f1: 0.6567
 epoch: 57, train_loss: 0.2111, test_loss: 1.9400, test_f1: 0.6687
 epoch: 58, train_loss: 0.1897, test_loss: 1.9875, test_f1: 0.6775
 epoch: 59, train_loss: 0.1756, test_loss: 2.1741, test_f1: 0.5906
 epoch: 60, train_loss: 0.1685, test_loss: 2.2287, test_f1: 0.6222
 epoch: 61, train_loss: 0.1870, test_loss: 2.0725, test_f1: 0.6699
 epoch: 62, train_loss: 0.1679, test_loss: 2.0814, test_f1: 0.6616
 epoch: 63, train_loss: 0.1787, test_loss: 2.0698, test_f1: 0.6576
 epoch: 64, train_loss: 0.1756, test_loss: 2.2260, test_f1: 0.6351
 epoch: 65, train_loss: 0.1771, test_loss: 2.2066, test_f1: 0.6390
 epoch: 66, train_loss: 0.1434, test_loss: 2.2953, test_f1: 0.6208
 epoch: 67, train_loss: 0.1965, test_loss: 2.1223, test_f1: 0.6811
 epoch: 68, train_loss: 0.1556, test_loss: 2.1972, test_f1: 0.6369
 epoch: 69, train_loss: 0.1403, test_loss: 2.2906, test_f1: 0.6593
 epoch: 70, train_loss: 0.1608, test_loss: 2.2231, test_f1: 0.6440
 epoch: 71, train_loss: 0.1601, test_loss: 2.3012, test_f1: 0.6450
 epoch: 72, train_loss: 0.1528, test_loss: 2.5553, test_f1: 0.6013
 epoch: 73, train_loss: 0.1328, test_loss: 2.5422, test_f1: 0.6328
 epoch: 74, train_loss: 0.1431, test_loss: 2.2994, test_f1: 0.6460
 epoch: 75, train_loss: 0.1374, test_loss: 2.4981, test_f1: 0.6407
 epoch: 76, train_loss: 0.1480, test_loss: 2.3671, test_f1: 0.6077
 epoch: 77, train_loss: 0.1279, test_loss: 2.6048, test_f1: 0.6484
 epoch: 78, train_loss: 0.1631, test_loss: 2.3776, test_f1: 0.6484
 epoch: 79, train_loss: 0.1413, test_loss: 2.3890, test_f1: 0.6593
 epoch: 80, train_loss: 0.1359, test_loss: 2.4003, test_f1: 0.6374
 epoch: 81, train_loss: 0.1394, test_loss: 2.2739, test_f1: 0.6574
 epoch: 82, train_loss: 0.1195, test_loss: 2.4812, test_f1: 0.6506
 epoch: 83, train_loss: 0.1546, test_loss: 2.5112, test_f1: 0.6492
 epoch: 84, train_loss: 0.1333, test_loss: 2.4174, test_f1: 0.6289
 epoch: 85, train_loss: 0.1289, test_loss: 2.6254, test_f1: 0.6451
 epoch: 86, train_loss: 0.1463, test_loss: 2.4262, test_f1: 0.6704
 epoch: 87, train_loss: 0.1731, test_loss: 2.6830, test_f1: 0.5926
 epoch: 88, train_loss: 0.1263, test_loss: 2.7213, test_f1: 0.6562
 epoch: 89, train_loss: 0.1262, test_loss: 2.6668, test_f1: 0.6187
 epoch: 90, train_loss: 0.1070, test_loss: 2.5342, test_f1: 0.6769
 epoch: 91, train_loss: 0.1173, test_loss: 2.5970, test_f1: 0.6539
 epoch: 92, train_loss: 0.1014, test_loss: 2.5840, test_f1: 0.6605
 epoch: 93, train_loss: 0.1036, test_loss: 2.8061, test_f1: 0.6388
 epoch: 94, train_loss: 0.0999, test_loss: 2.5853, test_f1: 0.6599
 epoch: 95, train_loss: 0.1491, test_loss: 2.6655, test_f1: 0.6877
 epoch: 96, train_loss: 0.1352, test_loss: 2.6922, test_f1: 0.6763
 epoch: 97, train_loss: 0.1183, test_loss: 2.3864, test_f1: 0.6605
 epoch: 98, train_loss: 0.1104, test_loss: 2.6712, test_f1: 0.6512
 epoch: 99, train_loss: 0.1188, test_loss: 2.5257, test_f1: 0.6646
##################ITERATION #2 ****************************************
 epoch: 0, train_loss: 1.1179, test_loss: 1.7526, test_f1: 0.1365
 epoch: 1, train_loss: 0.9763, test_loss: 1.2495, test_f1: 0.3515
 epoch: 2, train_loss: 0.9045, test_loss: 1.0815, test_f1: 0.5026
 epoch: 3, train_loss: 0.8511, test_loss: 1.0452, test_f1: 0.5462
 epoch: 4, train_loss: 0.8346, test_loss: 1.0298, test_f1: 0.5041
 epoch: 5, train_loss: 0.7920, test_loss: 1.0122, test_f1: 0.5562
 epoch: 6, train_loss: 0.7560, test_loss: 1.0555, test_f1: 0.5832
 epoch: 7, train_loss: 0.7397, test_loss: 1.0415, test_f1: 0.5849
 epoch: 8, train_loss: 0.7196, test_loss: 1.0639, test_f1: 0.5317
 epoch: 9, train_loss: 0.7077, test_loss: 1.0792, test_f1: 0.5785
 epoch: 10, train_loss: 0.6671, test_loss: 1.1251, test_f1: 0.5771
 epoch: 11, train_loss: 0.6736, test_loss: 1.0328, test_f1: 0.6142
 epoch: 12, train_loss: 0.6519, test_loss: 1.0772, test_f1: 0.5704
 epoch: 13, train_loss: 0.6143, test_loss: 1.0704, test_f1: 0.5750
 epoch: 14, train_loss: 0.6010, test_loss: 1.3220, test_f1: 0.4443
 epoch: 15, train_loss: 0.5723, test_loss: 1.1423, test_f1: 0.6097
 epoch: 16, train_loss: 0.6012, test_loss: 1.1631, test_f1: 0.5295
 epoch: 17, train_loss: 0.5705, test_loss: 1.3729, test_f1: 0.4713
 epoch: 18, train_loss: 0.5729, test_loss: 1.1942, test_f1: 0.5602
 epoch: 19, train_loss: 0.5553, test_loss: 1.1317, test_f1: 0.5849
 epoch: 20, train_loss: 0.5526, test_loss: 1.4796, test_f1: 0.5351
 epoch: 21, train_loss: 0.5177, test_loss: 1.1753, test_f1: 0.5838
 epoch: 22, train_loss: 0.5036, test_loss: 1.3477, test_f1: 0.5378
 epoch: 23, train_loss: 0.4725, test_loss: 1.2632, test_f1: 0.5945
 epoch: 24, train_loss: 0.4734, test_loss: 1.2778, test_f1: 0.5748
 epoch: 25, train_loss: 0.4677, test_loss: 1.3184, test_f1: 0.6071
 epoch: 26, train_loss: 0.4773, test_loss: 1.2806, test_f1: 0.5933
 epoch: 27, train_loss: 0.4241, test_loss: 1.2607, test_f1: 0.5958
 epoch: 28, train_loss: 0.4226, test_loss: 1.3257, test_f1: 0.6088
 epoch: 29, train_loss: 0.4347, test_loss: 1.2520, test_f1: 0.6063
 epoch: 30, train_loss: 0.4249, test_loss: 1.4168, test_f1: 0.5785
 epoch: 31, train_loss: 0.3825, test_loss: 1.5077, test_f1: 0.5793
 epoch: 32, train_loss: 0.3924, test_loss: 1.4876, test_f1: 0.5929
 epoch: 33, train_loss: 0.4076, test_loss: 1.6857, test_f1: 0.5746
 epoch: 34, train_loss: 0.3991, test_loss: 1.5310, test_f1: 0.5480
 epoch: 35, train_loss: 0.3988, test_loss: 1.5550, test_f1: 0.6005
 epoch: 36, train_loss: 0.3887, test_loss: 1.6366, test_f1: 0.5753
 epoch: 37, train_loss: 0.3720, test_loss: 1.5646, test_f1: 0.6221
 epoch: 38, train_loss: 0.3737, test_loss: 1.5959, test_f1: 0.6135
 epoch: 39, train_loss: 0.3631, test_loss: 1.5833, test_f1: 0.5878
 epoch: 40, train_loss: 0.3544, test_loss: 1.5961, test_f1: 0.5858
 epoch: 41, train_loss: 0.3539, test_loss: 1.8202, test_f1: 0.5679
 epoch: 42, train_loss: 0.3477, test_loss: 1.6308, test_f1: 0.6170
 epoch: 43, train_loss: 0.3242, test_loss: 1.7425, test_f1: 0.5697
 epoch: 44, train_loss: 0.3360, test_loss: 1.6630, test_f1: 0.6574
 epoch: 45, train_loss: 0.3268, test_loss: 1.7026, test_f1: 0.5871
 epoch: 46, train_loss: 0.3051, test_loss: 1.8103, test_f1: 0.5666
 epoch: 47, train_loss: 0.3151, test_loss: 2.3705, test_f1: 0.5550
 epoch: 48, train_loss: 0.3043, test_loss: 1.7672, test_f1: 0.5594
 epoch: 49, train_loss: 0.2867, test_loss: 1.8346, test_f1: 0.6316
 epoch: 50, train_loss: 0.2845, test_loss: 1.9850, test_f1: 0.5856
 epoch: 51, train_loss: 0.2521, test_loss: 1.8179, test_f1: 0.6133
 epoch: 52, train_loss: 0.2141, test_loss: 2.1542, test_f1: 0.5806
 epoch: 53, train_loss: 0.2197, test_loss: 2.0873, test_f1: 0.5959
 epoch: 54, train_loss: 0.2403, test_loss: 2.0353, test_f1: 0.6140
 epoch: 55, train_loss: 0.2209, test_loss: 2.0175, test_f1: 0.6147
 epoch: 56, train_loss: 0.2160, test_loss: 2.1877, test_f1: 0.5625
 epoch: 57, train_loss: 0.2039, test_loss: 2.0546, test_f1: 0.6066
 epoch: 58, train_loss: 0.2138, test_loss: 2.0909, test_f1: 0.6189
 epoch: 59, train_loss: 0.1905, test_loss: 2.2751, test_f1: 0.5463
 epoch: 60, train_loss: 0.1724, test_loss: 2.1240, test_f1: 0.6061
 epoch: 61, train_loss: 0.1838, test_loss: 2.2384, test_f1: 0.5843
 epoch: 62, train_loss: 0.1779, test_loss: 2.0318, test_f1: 0.6437
 epoch: 63, train_loss: 0.1765, test_loss: 2.2897, test_f1: 0.5727
 epoch: 64, train_loss: 0.1648, test_loss: 2.2942, test_f1: 0.6123
 epoch: 65, train_loss: 0.1571, test_loss: 2.3834, test_f1: 0.5873
 epoch: 66, train_loss: 0.1657, test_loss: 2.3061, test_f1: 0.6166
 epoch: 67, train_loss: 0.1929, test_loss: 2.3193, test_f1: 0.5956
 epoch: 68, train_loss: 0.1598, test_loss: 2.4211, test_f1: 0.5948
 epoch: 69, train_loss: 0.1738, test_loss: 2.2772, test_f1: 0.6106
 epoch: 70, train_loss: 0.1680, test_loss: 2.3694, test_f1: 0.5957
 epoch: 71, train_loss: 0.1624, test_loss: 2.4249, test_f1: 0.6079
 epoch: 72, train_loss: 0.1703, test_loss: 2.4157, test_f1: 0.5889
 epoch: 73, train_loss: 0.1594, test_loss: 2.4806, test_f1: 0.6048
 epoch: 74, train_loss: 0.1905, test_loss: 2.3526, test_f1: 0.6303
 epoch: 75, train_loss: 0.1666, test_loss: 2.2855, test_f1: 0.6184
 epoch: 76, train_loss: 0.1668, test_loss: 2.2526, test_f1: 0.6005
 epoch: 77, train_loss: 0.1557, test_loss: 2.6651, test_f1: 0.5745
 epoch: 78, train_loss: 0.1628, test_loss: 2.2789, test_f1: 0.6144
 epoch: 79, train_loss: 0.1701, test_loss: 2.4953, test_f1: 0.6153
 epoch: 80, train_loss: 0.1669, test_loss: 2.3292, test_f1: 0.6374
 epoch: 81, train_loss: 0.1717, test_loss: 2.4013, test_f1: 0.6216
 epoch: 82, train_loss: 0.1501, test_loss: 2.5428, test_f1: 0.6017
 epoch: 83, train_loss: 0.1328, test_loss: 2.5086, test_f1: 0.6090
 epoch: 84, train_loss: 0.1336, test_loss: 2.4646, test_f1: 0.6203
 epoch: 85, train_loss: 0.1363, test_loss: 2.7502, test_f1: 0.5944
 epoch: 86, train_loss: 0.1480, test_loss: 2.3020, test_f1: 0.6344
 epoch: 87, train_loss: 0.1476, test_loss: 2.6779, test_f1: 0.5931
 epoch: 88, train_loss: 0.1389, test_loss: 2.5890, test_f1: 0.5942
 epoch: 89, train_loss: 0.1381, test_loss: 2.6795, test_f1: 0.5997
 epoch: 90, train_loss: 0.1140, test_loss: 2.5512, test_f1: 0.6123
 epoch: 91, train_loss: 0.1123, test_loss: 2.6032, test_f1: 0.6319
 epoch: 92, train_loss: 0.1237, test_loss: 3.0751, test_f1: 0.5912
 epoch: 93, train_loss: 0.1209, test_loss: 2.7267, test_f1: 0.5861
 epoch: 94, train_loss: 0.1014, test_loss: 2.5991, test_f1: 0.6230
 epoch: 95, train_loss: 0.1142, test_loss: 2.7303, test_f1: 0.6006
 epoch: 96, train_loss: 0.1227, test_loss: 2.6371, test_f1: 0.6217
 epoch: 97, train_loss: 0.1055, test_loss: 2.7558, test_f1: 0.5983
 epoch: 98, train_loss: 0.1046, test_loss: 2.8891, test_f1: 0.5986
 epoch: 99, train_loss: 0.1389, test_loss: 2.7699, test_f1: 0.6288
##################ITERATION #3 ****************************************
 epoch: 0, train_loss: 1.1948, test_loss: 1.5712, test_f1: 0.3470
 epoch: 1, train_loss: 0.9551, test_loss: 1.1485, test_f1: 0.5328
 epoch: 2, train_loss: 0.8938, test_loss: 1.0642, test_f1: 0.5938
 epoch: 3, train_loss: 0.8645, test_loss: 1.0160, test_f1: 0.5315
 epoch: 4, train_loss: 0.8215, test_loss: 1.0084, test_f1: 0.5359
 epoch: 5, train_loss: 0.7916, test_loss: 1.0498, test_f1: 0.5637
 epoch: 6, train_loss: 0.7520, test_loss: 1.0125, test_f1: 0.5707
 epoch: 7, train_loss: 0.7325, test_loss: 1.0689, test_f1: 0.5960
 epoch: 8, train_loss: 0.7137, test_loss: 0.9993, test_f1: 0.6201
 epoch: 9, train_loss: 0.6912, test_loss: 1.0209, test_f1: 0.5882
 epoch: 10, train_loss: 0.6700, test_loss: 1.0673, test_f1: 0.5941
 epoch: 11, train_loss: 0.6433, test_loss: 1.0537, test_f1: 0.6120
 epoch: 12, train_loss: 0.6151, test_loss: 1.1184, test_f1: 0.6121
 epoch: 13, train_loss: 0.6033, test_loss: 1.1609, test_f1: 0.5452
 epoch: 14, train_loss: 0.5871, test_loss: 1.1054, test_f1: 0.6337
 epoch: 15, train_loss: 0.5889, test_loss: 1.1420, test_f1: 0.6308
 epoch: 16, train_loss: 0.5618, test_loss: 1.2046, test_f1: 0.6664
 epoch: 17, train_loss: 0.5619, test_loss: 1.2437, test_f1: 0.5784
 epoch: 18, train_loss: 0.5179, test_loss: 1.3329, test_f1: 0.5516
 epoch: 19, train_loss: 0.5182, test_loss: 1.1935, test_f1: 0.6112
 epoch: 20, train_loss: 0.5144, test_loss: 1.2544, test_f1: 0.6073
 epoch: 21, train_loss: 0.5117, test_loss: 1.3491, test_f1: 0.5922
 epoch: 22, train_loss: 0.4781, test_loss: 1.4296, test_f1: 0.5163
 epoch: 23, train_loss: 0.5013, test_loss: 1.3203, test_f1: 0.5842
 epoch: 24, train_loss: 0.4656, test_loss: 1.1859, test_f1: 0.6315
 epoch: 25, train_loss: 0.4725, test_loss: 1.2488, test_f1: 0.5870
 epoch: 26, train_loss: 0.4609, test_loss: 1.2708, test_f1: 0.6114
 epoch: 27, train_loss: 0.4120, test_loss: 1.3443, test_f1: 0.6137
 epoch: 28, train_loss: 0.3939, test_loss: 1.7042, test_f1: 0.5572
 epoch: 29, train_loss: 0.4064, test_loss: 1.3348, test_f1: 0.6376
 epoch: 30, train_loss: 0.3844, test_loss: 1.5879, test_f1: 0.5801
 epoch: 31, train_loss: 0.3935, test_loss: 1.6751, test_f1: 0.5773
 epoch: 32, train_loss: 0.3945, test_loss: 1.6205, test_f1: 0.6026
 epoch: 33, train_loss: 0.3737, test_loss: 1.4038, test_f1: 0.6597
 epoch: 34, train_loss: 0.3503, test_loss: 1.6555, test_f1: 0.5991
 epoch: 35, train_loss: 0.3348, test_loss: 1.7470, test_f1: 0.5846
 epoch: 36, train_loss: 0.3659, test_loss: 1.9702, test_f1: 0.5459
 epoch: 37, train_loss: 0.3453, test_loss: 1.8236, test_f1: 0.5899
 epoch: 38, train_loss: 0.3200, test_loss: 1.7987, test_f1: 0.5977
 epoch: 39, train_loss: 0.2967, test_loss: 1.8428, test_f1: 0.5827
 epoch: 40, train_loss: 0.3037, test_loss: 2.0666, test_f1: 0.5779
 epoch: 41, train_loss: 0.2867, test_loss: 1.7088, test_f1: 0.6114
 epoch: 42, train_loss: 0.3000, test_loss: 2.1102, test_f1: 0.5370
 epoch: 43, train_loss: 0.2852, test_loss: 2.0117, test_f1: 0.6231
 epoch: 44, train_loss: 0.2711, test_loss: 1.7503, test_f1: 0.6302
 epoch: 45, train_loss: 0.2991, test_loss: 1.7482, test_f1: 0.6157
 epoch: 46, train_loss: 0.2504, test_loss: 2.0928, test_f1: 0.6022
 epoch: 47, train_loss: 0.2536, test_loss: 2.1579, test_f1: 0.6210
 epoch: 48, train_loss: 0.2543, test_loss: 2.0288, test_f1: 0.6281
 epoch: 49, train_loss: 0.2688, test_loss: 2.3684, test_f1: 0.5645
 epoch: 50, train_loss: 0.2465, test_loss: 1.8904, test_f1: 0.6414
 epoch: 51, train_loss: 0.2399, test_loss: 2.1069, test_f1: 0.5991
 epoch: 52, train_loss: 0.1867, test_loss: 2.0686, test_f1: 0.6191
 epoch: 53, train_loss: 0.2224, test_loss: 1.9875, test_f1: 0.6203
 epoch: 54, train_loss: 0.1799, test_loss: 2.1893, test_f1: 0.6001
 epoch: 55, train_loss: 0.1731, test_loss: 2.2115, test_f1: 0.6004
 epoch: 56, train_loss: 0.1633, test_loss: 2.2368, test_f1: 0.6214
 epoch: 57, train_loss: 0.1869, test_loss: 2.1242, test_f1: 0.6004
 epoch: 58, train_loss: 0.1615, test_loss: 2.1433, test_f1: 0.6175
 epoch: 59, train_loss: 0.1756, test_loss: 2.2134, test_f1: 0.6152
 epoch: 60, train_loss: 0.1488, test_loss: 2.1479, test_f1: 0.6240
 epoch: 61, train_loss: 0.1419, test_loss: 2.2948, test_f1: 0.6098
 epoch: 62, train_loss: 0.1504, test_loss: 2.2709, test_f1: 0.5996
 epoch: 63, train_loss: 0.1464, test_loss: 2.4128, test_f1: 0.6057
 epoch: 64, train_loss: 0.1559, test_loss: 2.3622, test_f1: 0.5910
 epoch: 65, train_loss: 0.1563, test_loss: 2.2056, test_f1: 0.6162
 epoch: 66, train_loss: 0.1598, test_loss: 2.3180, test_f1: 0.6020
 epoch: 67, train_loss: 0.1422, test_loss: 2.4412, test_f1: 0.5810
 epoch: 68, train_loss: 0.1427, test_loss: 2.3939, test_f1: 0.6209
 epoch: 69, train_loss: 0.1439, test_loss: 2.3502, test_f1: 0.6344
 epoch: 70, train_loss: 0.1401, test_loss: 2.3055, test_f1: 0.6016
 epoch: 71, train_loss: 0.1503, test_loss: 2.4337, test_f1: 0.6161
 epoch: 72, train_loss: 0.1243, test_loss: 2.4737, test_f1: 0.6137
 epoch: 73, train_loss: 0.1324, test_loss: 2.3407, test_f1: 0.6379
 epoch: 74, train_loss: 0.1226, test_loss: 2.6006, test_f1: 0.5972
 epoch: 75, train_loss: 0.1200, test_loss: 2.4209, test_f1: 0.6154
 epoch: 76, train_loss: 0.1173, test_loss: 2.7645, test_f1: 0.6139
 epoch: 77, train_loss: 0.1176, test_loss: 2.4870, test_f1: 0.6100
 epoch: 78, train_loss: 0.1293, test_loss: 2.4626, test_f1: 0.6136
 epoch: 79, train_loss: 0.1112, test_loss: 2.6128, test_f1: 0.5956
 epoch: 80, train_loss: 0.1219, test_loss: 2.6161, test_f1: 0.6166
 epoch: 81, train_loss: 0.1089, test_loss: 2.6569, test_f1: 0.6131
 epoch: 82, train_loss: 0.1122, test_loss: 2.7982, test_f1: 0.5975
 epoch: 83, train_loss: 0.1508, test_loss: 2.7146, test_f1: 0.6055
 epoch: 84, train_loss: 0.1215, test_loss: 2.8363, test_f1: 0.6033
 epoch: 85, train_loss: 0.1110, test_loss: 2.7073, test_f1: 0.6043
 epoch: 86, train_loss: 0.1125, test_loss: 2.7194, test_f1: 0.6108
 epoch: 87, train_loss: 0.1005, test_loss: 2.8220, test_f1: 0.6252
 epoch: 88, train_loss: 0.0933, test_loss: 2.7080, test_f1: 0.6195
 epoch: 89, train_loss: 0.1125, test_loss: 2.8340, test_f1: 0.6112
 epoch: 90, train_loss: 0.0971, test_loss: 2.7932, test_f1: 0.5976
 epoch: 91, train_loss: 0.0860, test_loss: 2.8989, test_f1: 0.6003
 epoch: 92, train_loss: 0.0985, test_loss: 2.8591, test_f1: 0.6145
 epoch: 93, train_loss: 0.0899, test_loss: 2.8192, test_f1: 0.6216
 epoch: 94, train_loss: 0.0959, test_loss: 2.8546, test_f1: 0.6255
 epoch: 95, train_loss: 0.1029, test_loss: 2.7836, test_f1: 0.6131
 epoch: 96, train_loss: 0.1041, test_loss: 2.8785, test_f1: 0.6120
 epoch: 97, train_loss: 0.1113, test_loss: 3.1078, test_f1: 0.5986
 epoch: 98, train_loss: 0.1047, test_loss: 2.9925, test_f1: 0.6311
 epoch: 99, train_loss: 0.1029, test_loss: 2.9082, test_f1: 0.6031
##################ITERATION #4 ****************************************
 epoch: 0, train_loss: 1.3436, test_loss: 1.6160, test_f1: 0.2281
 epoch: 1, train_loss: 1.0536, test_loss: 1.3020, test_f1: 0.3868
 epoch: 2, train_loss: 0.9058, test_loss: 1.0559, test_f1: 0.5050
 epoch: 3, train_loss: 0.8850, test_loss: 1.0483, test_f1: 0.5463
 epoch: 4, train_loss: 0.8376, test_loss: 1.0670, test_f1: 0.5495
 epoch: 5, train_loss: 0.8018, test_loss: 1.0572, test_f1: 0.5153
 epoch: 6, train_loss: 0.7836, test_loss: 1.0787, test_f1: 0.5395
 epoch: 7, train_loss: 0.7548, test_loss: 1.1087, test_f1: 0.5288
 epoch: 8, train_loss: 0.7529, test_loss: 1.1264, test_f1: 0.5783
 epoch: 9, train_loss: 0.7121, test_loss: 1.0731, test_f1: 0.5298
 epoch: 10, train_loss: 0.7053, test_loss: 1.1230, test_f1: 0.5344
 epoch: 11, train_loss: 0.6941, test_loss: 1.1362, test_f1: 0.5346
 epoch: 12, train_loss: 0.6524, test_loss: 1.0665, test_f1: 0.6180
 epoch: 13, train_loss: 0.6429, test_loss: 1.0851, test_f1: 0.5578
 epoch: 14, train_loss: 0.5962, test_loss: 1.1212, test_f1: 0.5640
 epoch: 15, train_loss: 0.6315, test_loss: 1.1844, test_f1: 0.5174
 epoch: 16, train_loss: 0.6164, test_loss: 1.0538, test_f1: 0.6450
 epoch: 17, train_loss: 0.6087, test_loss: 1.1746, test_f1: 0.5444
 epoch: 18, train_loss: 0.5858, test_loss: 1.1532, test_f1: 0.5872
 epoch: 19, train_loss: 0.5629, test_loss: 1.2161, test_f1: 0.5763
 epoch: 20, train_loss: 0.5591, test_loss: 1.1050, test_f1: 0.6054
 epoch: 21, train_loss: 0.5449, test_loss: 1.2294, test_f1: 0.5875
 epoch: 22, train_loss: 0.5367, test_loss: 1.1926, test_f1: 0.6028
 epoch: 23, train_loss: 0.5029, test_loss: 1.2214, test_f1: 0.6078
 epoch: 24, train_loss: 0.4637, test_loss: 1.1923, test_f1: 0.6271
 epoch: 25, train_loss: 0.4875, test_loss: 1.2343, test_f1: 0.6074
 epoch: 26, train_loss: 0.4515, test_loss: 1.2342, test_f1: 0.6314
 epoch: 27, train_loss: 0.4748, test_loss: 1.1493, test_f1: 0.6577
 epoch: 28, train_loss: 0.4672, test_loss: 1.3198, test_f1: 0.6352
 epoch: 29, train_loss: 0.4734, test_loss: 1.3493, test_f1: 0.6021
 epoch: 30, train_loss: 0.4257, test_loss: 1.4674, test_f1: 0.5446
 epoch: 31, train_loss: 0.4505, test_loss: 1.4398, test_f1: 0.5581
 epoch: 32, train_loss: 0.4384, test_loss: 1.4380, test_f1: 0.5915
 epoch: 33, train_loss: 0.4085, test_loss: 1.3095, test_f1: 0.6505
 epoch: 34, train_loss: 0.3877, test_loss: 1.4491, test_f1: 0.5957
 epoch: 35, train_loss: 0.3877, test_loss: 1.4885, test_f1: 0.5766
 epoch: 36, train_loss: 0.3969, test_loss: 1.4811, test_f1: 0.6125
 epoch: 37, train_loss: 0.3805, test_loss: 1.6958, test_f1: 0.5537
 epoch: 38, train_loss: 0.3890, test_loss: 1.5451, test_f1: 0.6298
 epoch: 39, train_loss: 0.3403, test_loss: 1.3994, test_f1: 0.6304
 epoch: 40, train_loss: 0.3290, test_loss: 1.5309, test_f1: 0.6119
 epoch: 41, train_loss: 0.3549, test_loss: 1.3906, test_f1: 0.5822
 epoch: 42, train_loss: 0.3593, test_loss: 1.7982, test_f1: 0.5800
 epoch: 43, train_loss: 0.3113, test_loss: 1.8214, test_f1: 0.5756
 epoch: 44, train_loss: 0.2890, test_loss: 1.4512, test_f1: 0.6442
 epoch: 45, train_loss: 0.3070, test_loss: 1.8100, test_f1: 0.5659
 epoch: 46, train_loss: 0.3513, test_loss: 1.6903, test_f1: 0.6283
 epoch: 47, train_loss: 0.3032, test_loss: 1.7215, test_f1: 0.5950
 epoch: 48, train_loss: 0.2919, test_loss: 1.5165, test_f1: 0.6579
 epoch: 49, train_loss: 0.2619, test_loss: 1.9058, test_f1: 0.5937
 epoch: 50, train_loss: 0.2783, test_loss: 1.7454, test_f1: 0.6051
 epoch: 51, train_loss: 0.2631, test_loss: 1.8382, test_f1: 0.6062
 epoch: 52, train_loss: 0.2220, test_loss: 1.7706, test_f1: 0.6137
 epoch: 53, train_loss: 0.2211, test_loss: 1.8882, test_f1: 0.6087
 epoch: 54, train_loss: 0.2110, test_loss: 1.9362, test_f1: 0.5955
 epoch: 55, train_loss: 0.2173, test_loss: 1.9238, test_f1: 0.6100
 epoch: 56, train_loss: 0.2185, test_loss: 1.9110, test_f1: 0.6103
 epoch: 57, train_loss: 0.1901, test_loss: 2.0321, test_f1: 0.5983
 epoch: 58, train_loss: 0.1852, test_loss: 2.0230, test_f1: 0.5886
 epoch: 59, train_loss: 0.1780, test_loss: 2.0268, test_f1: 0.6101
 epoch: 60, train_loss: 0.1820, test_loss: 2.0775, test_f1: 0.5861
 epoch: 61, train_loss: 0.1779, test_loss: 2.0912, test_f1: 0.6048
 epoch: 62, train_loss: 0.1801, test_loss: 2.0572, test_f1: 0.6474
 epoch: 63, train_loss: 0.2014, test_loss: 2.1445, test_f1: 0.5845
 epoch: 64, train_loss: 0.1888, test_loss: 2.1373, test_f1: 0.6083
 epoch: 65, train_loss: 0.1877, test_loss: 2.2436, test_f1: 0.6029
 epoch: 66, train_loss: 0.1683, test_loss: 2.0971, test_f1: 0.5976
 epoch: 67, train_loss: 0.1585, test_loss: 2.1042, test_f1: 0.6288
 epoch: 68, train_loss: 0.1674, test_loss: 2.1425, test_f1: 0.5785
 epoch: 69, train_loss: 0.1441, test_loss: 2.1347, test_f1: 0.6200
 epoch: 70, train_loss: 0.1826, test_loss: 2.3394, test_f1: 0.5944
 epoch: 71, train_loss: 0.1664, test_loss: 2.1678, test_f1: 0.5976
 epoch: 72, train_loss: 0.1654, test_loss: 2.2981, test_f1: 0.6052
 epoch: 73, train_loss: 0.1549, test_loss: 2.1845, test_f1: 0.5961
 epoch: 74, train_loss: 0.1484, test_loss: 2.3781, test_f1: 0.6226
 epoch: 75, train_loss: 0.1403, test_loss: 2.4108, test_f1: 0.5895
 epoch: 76, train_loss: 0.1488, test_loss: 2.4138, test_f1: 0.6344
 epoch: 77, train_loss: 0.1511, test_loss: 2.3026, test_f1: 0.6185
 epoch: 78, train_loss: 0.1566, test_loss: 2.2638, test_f1: 0.6101
 epoch: 79, train_loss: 0.1436, test_loss: 2.3554, test_f1: 0.6009
 epoch: 80, train_loss: 0.1409, test_loss: 2.2258, test_f1: 0.6136
 epoch: 81, train_loss: 0.1667, test_loss: 2.2765, test_f1: 0.5837
 epoch: 82, train_loss: 0.1207, test_loss: 2.3562, test_f1: 0.6097
 epoch: 83, train_loss: 0.1433, test_loss: 2.4835, test_f1: 0.6267
 epoch: 84, train_loss: 0.1199, test_loss: 2.3765, test_f1: 0.6635
 epoch: 85, train_loss: 0.1813, test_loss: 2.4029, test_f1: 0.5954
 epoch: 86, train_loss: 0.1310, test_loss: 2.5521, test_f1: 0.6159
 epoch: 87, train_loss: 0.1388, test_loss: 2.2236, test_f1: 0.6492
 epoch: 88, train_loss: 0.1077, test_loss: 2.6991, test_f1: 0.5730
 epoch: 89, train_loss: 0.1034, test_loss: 2.5029, test_f1: 0.6294
 epoch: 90, train_loss: 0.1306, test_loss: 2.6274, test_f1: 0.5959
 epoch: 91, train_loss: 0.1162, test_loss: 2.6009, test_f1: 0.6105
 epoch: 92, train_loss: 0.1610, test_loss: 2.5169, test_f1: 0.5870
 epoch: 93, train_loss: 0.1292, test_loss: 2.6163, test_f1: 0.5953
 epoch: 94, train_loss: 0.1304, test_loss: 2.6029, test_f1: 0.6163
 epoch: 95, train_loss: 0.1283, test_loss: 2.4535, test_f1: 0.6123
 epoch: 96, train_loss: 0.1163, test_loss: 2.5406, test_f1: 0.6036
 epoch: 97, train_loss: 0.1132, test_loss: 2.7951, test_f1: 0.5819
 epoch: 98, train_loss: 0.1101, test_loss: 2.7105, test_f1: 0.5848
 epoch: 99, train_loss: 0.1354, test_loss: 2.7632, test_f1: 0.6235
##################ITERATION #5 ****************************************
 epoch: 0, train_loss: 1.4354, test_loss: 1.3746, test_f1: 0.2281
 epoch: 1, train_loss: 1.0001, test_loss: 1.2041, test_f1: 0.4116
 epoch: 2, train_loss: 0.9360, test_loss: 1.0639, test_f1: 0.5348
 epoch: 3, train_loss: 0.8680, test_loss: 1.0687, test_f1: 0.5490
 epoch: 4, train_loss: 0.8379, test_loss: 1.1012, test_f1: 0.5411
 epoch: 5, train_loss: 0.8104, test_loss: 1.0717, test_f1: 0.5925
 epoch: 6, train_loss: 0.7673, test_loss: 1.1382, test_f1: 0.5120
 epoch: 7, train_loss: 0.7315, test_loss: 1.1564, test_f1: 0.5869
 epoch: 8, train_loss: 0.7125, test_loss: 1.1429, test_f1: 0.5596
 epoch: 9, train_loss: 0.7048, test_loss: 1.2137, test_f1: 0.5589
 epoch: 10, train_loss: 0.7062, test_loss: 1.2167, test_f1: 0.5401
 epoch: 11, train_loss: 0.6488, test_loss: 1.1612, test_f1: 0.6073
 epoch: 12, train_loss: 0.6216, test_loss: 1.2632, test_f1: 0.5583
 epoch: 13, train_loss: 0.6312, test_loss: 1.1960, test_f1: 0.5987
 epoch: 14, train_loss: 0.5982, test_loss: 1.2815, test_f1: 0.5766
 epoch: 15, train_loss: 0.6222, test_loss: 1.3321, test_f1: 0.5943
 epoch: 16, train_loss: 0.5873, test_loss: 1.2693, test_f1: 0.6092
 epoch: 17, train_loss: 0.5979, test_loss: 1.3051, test_f1: 0.5920
 epoch: 18, train_loss: 0.5816, test_loss: 1.2163, test_f1: 0.5935
 epoch: 19, train_loss: 0.5655, test_loss: 1.3185, test_f1: 0.5883
 epoch: 20, train_loss: 0.5352, test_loss: 1.3069, test_f1: 0.6229
 epoch: 21, train_loss: 0.5039, test_loss: 1.3246, test_f1: 0.5717
 epoch: 22, train_loss: 0.5208, test_loss: 1.3744, test_f1: 0.5365
 epoch: 23, train_loss: 0.5053, test_loss: 1.6794, test_f1: 0.5997
 epoch: 24, train_loss: 0.4987, test_loss: 1.4702, test_f1: 0.6266
 epoch: 25, train_loss: 0.4768, test_loss: 1.5989, test_f1: 0.5730
 epoch: 26, train_loss: 0.5149, test_loss: 1.5100, test_f1: 0.5719
 epoch: 27, train_loss: 0.4508, test_loss: 1.5362, test_f1: 0.5383
 epoch: 28, train_loss: 0.4396, test_loss: 1.5553, test_f1: 0.6111
 epoch: 29, train_loss: 0.4549, test_loss: 1.5459, test_f1: 0.5967
 epoch: 30, train_loss: 0.4178, test_loss: 1.4907, test_f1: 0.5856
 epoch: 31, train_loss: 0.4127, test_loss: 1.5821, test_f1: 0.6040
 epoch: 32, train_loss: 0.4062, test_loss: 1.6051, test_f1: 0.5916
 epoch: 33, train_loss: 0.3953, test_loss: 1.7116, test_f1: 0.5302
 epoch: 34, train_loss: 0.3764, test_loss: 1.5850, test_f1: 0.6448
 epoch: 35, train_loss: 0.3738, test_loss: 1.7282, test_f1: 0.5612
 epoch: 36, train_loss: 0.3941, test_loss: 1.6259, test_f1: 0.6305
 epoch: 37, train_loss: 0.3704, test_loss: 1.7672, test_f1: 0.5496
 epoch: 38, train_loss: 0.3754, test_loss: 1.8793, test_f1: 0.5672
 epoch: 39, train_loss: 0.3690, test_loss: 1.8198, test_f1: 0.5928
 epoch: 40, train_loss: 0.3675, test_loss: 1.7585, test_f1: 0.5548
 epoch: 41, train_loss: 0.3554, test_loss: 1.6773, test_f1: 0.5929
 epoch: 42, train_loss: 0.3310, test_loss: 1.8979, test_f1: 0.5518
 epoch: 43, train_loss: 0.3117, test_loss: 1.8744, test_f1: 0.5600
 epoch: 44, train_loss: 0.3188, test_loss: 2.1360, test_f1: 0.5457
 epoch: 45, train_loss: 0.3315, test_loss: 1.8047, test_f1: 0.5660
 epoch: 46, train_loss: 0.3286, test_loss: 1.7617, test_f1: 0.5819
 epoch: 47, train_loss: 0.3123, test_loss: 1.7198, test_f1: 0.5863
 epoch: 48, train_loss: 0.3371, test_loss: 1.7534, test_f1: 0.6072
 epoch: 49, train_loss: 0.2946, test_loss: 1.8349, test_f1: 0.6030
 epoch: 50, train_loss: 0.3491, test_loss: 1.7698, test_f1: 0.6027
 epoch: 51, train_loss: 0.2948, test_loss: 1.6541, test_f1: 0.5816
 epoch: 52, train_loss: 0.2410, test_loss: 1.9209, test_f1: 0.5808
 epoch: 53, train_loss: 0.2361, test_loss: 1.9004, test_f1: 0.5904
 epoch: 54, train_loss: 0.2246, test_loss: 1.9048, test_f1: 0.6069
 epoch: 55, train_loss: 0.2088, test_loss: 1.9917, test_f1: 0.5974
 epoch: 56, train_loss: 0.2204, test_loss: 2.0518, test_f1: 0.5587
 epoch: 57, train_loss: 0.1851, test_loss: 2.0656, test_f1: 0.5840
 epoch: 58, train_loss: 0.2002, test_loss: 1.9802, test_f1: 0.5822
 epoch: 59, train_loss: 0.1987, test_loss: 2.1477, test_f1: 0.5673
 epoch: 60, train_loss: 0.1887, test_loss: 2.2808, test_f1: 0.5712
 epoch: 61, train_loss: 0.1727, test_loss: 2.0555, test_f1: 0.6044
 epoch: 62, train_loss: 0.1769, test_loss: 2.0733, test_f1: 0.6087
 epoch: 63, train_loss: 0.1934, test_loss: 2.3889, test_f1: 0.5942
 epoch: 64, train_loss: 0.1916, test_loss: 2.1451, test_f1: 0.6259
 epoch: 65, train_loss: 0.2035, test_loss: 2.2164, test_f1: 0.5784
 epoch: 66, train_loss: 0.1920, test_loss: 2.1431, test_f1: 0.6118
 epoch: 67, train_loss: 0.1808, test_loss: 2.2643, test_f1: 0.5871
 epoch: 68, train_loss: 0.1695, test_loss: 2.1164, test_f1: 0.6285
 epoch: 69, train_loss: 0.1730, test_loss: 2.1760, test_f1: 0.6103
 epoch: 70, train_loss: 0.1661, test_loss: 2.1809, test_f1: 0.6061
 epoch: 71, train_loss: 0.1725, test_loss: 2.1304, test_f1: 0.6056
 epoch: 72, train_loss: 0.1657, test_loss: 2.2979, test_f1: 0.6198
 epoch: 73, train_loss: 0.1635, test_loss: 2.3430, test_f1: 0.5735
 epoch: 74, train_loss: 0.1686, test_loss: 2.3485, test_f1: 0.5918
 epoch: 75, train_loss: 0.1576, test_loss: 2.1880, test_f1: 0.6119
 epoch: 76, train_loss: 0.1437, test_loss: 2.3400, test_f1: 0.5951
 epoch: 77, train_loss: 0.1710, test_loss: 2.5517, test_f1: 0.5840
 epoch: 78, train_loss: 0.1928, test_loss: 2.3366, test_f1: 0.6051
 epoch: 79, train_loss: 0.1560, test_loss: 2.4689, test_f1: 0.5678
 epoch: 80, train_loss: 0.1377, test_loss: 2.3363, test_f1: 0.5912
 epoch: 81, train_loss: 0.1524, test_loss: 2.2256, test_f1: 0.5908
 epoch: 82, train_loss: 0.1492, test_loss: 2.4537, test_f1: 0.5757
 epoch: 83, train_loss: 0.1687, test_loss: 2.4234, test_f1: 0.5778
 epoch: 84, train_loss: 0.1597, test_loss: 2.4004, test_f1: 0.5583
 epoch: 85, train_loss: 0.1398, test_loss: 2.3015, test_f1: 0.5858
 epoch: 86, train_loss: 0.1369, test_loss: 2.5354, test_f1: 0.5962
 epoch: 87, train_loss: 0.1441, test_loss: 2.3764, test_f1: 0.5913
 epoch: 88, train_loss: 0.1184, test_loss: 2.5091, test_f1: 0.6013
 epoch: 89, train_loss: 0.1371, test_loss: 2.4105, test_f1: 0.5868
 epoch: 90, train_loss: 0.1799, test_loss: 2.4489, test_f1: 0.5839
 epoch: 91, train_loss: 0.1423, test_loss: 2.3719, test_f1: 0.5873
 epoch: 92, train_loss: 0.1343, test_loss: 2.5614, test_f1: 0.5909
 epoch: 93, train_loss: 0.1328, test_loss: 2.3542, test_f1: 0.5938
 epoch: 94, train_loss: 0.1555, test_loss: 2.6512, test_f1: 0.5734
 epoch: 95, train_loss: 0.1297, test_loss: 2.2622, test_f1: 0.6038
 epoch: 96, train_loss: 0.1231, test_loss: 2.4423, test_f1: 0.5802
 epoch: 97, train_loss: 0.1300, test_loss: 2.4038, test_f1: 0.5843
 epoch: 98, train_loss: 0.1312, test_loss: 2.7152, test_f1: 0.5727
 epoch: 99, train_loss: 0.1202, test_loss: 2.4297, test_f1: 0.6069
##################ITERATION #6 ****************************************
 epoch: 0, train_loss: 1.4527, test_loss: 1.5650, test_f1: 0.1425
 epoch: 1, train_loss: 1.0325, test_loss: 1.2354, test_f1: 0.4479
 epoch: 2, train_loss: 0.9030, test_loss: 1.0557, test_f1: 0.5404
 epoch: 3, train_loss: 0.8390, test_loss: 1.0669, test_f1: 0.5135
 epoch: 4, train_loss: 0.8251, test_loss: 1.0714, test_f1: 0.5167
 epoch: 5, train_loss: 0.7738, test_loss: 1.1354, test_f1: 0.5690
 epoch: 6, train_loss: 0.7749, test_loss: 1.0848, test_f1: 0.5761
 epoch: 7, train_loss: 0.7222, test_loss: 1.1314, test_f1: 0.5518
 epoch: 8, train_loss: 0.7228, test_loss: 1.1196, test_f1: 0.5727
 epoch: 9, train_loss: 0.6936, test_loss: 1.1269, test_f1: 0.5808
 epoch: 10, train_loss: 0.7045, test_loss: 1.2253, test_f1: 0.5434
 epoch: 11, train_loss: 0.6617, test_loss: 1.1738, test_f1: 0.5550
 epoch: 12, train_loss: 0.6514, test_loss: 1.2313, test_f1: 0.5264
 epoch: 13, train_loss: 0.6197, test_loss: 1.1682, test_f1: 0.5653
 epoch: 14, train_loss: 0.6202, test_loss: 1.2674, test_f1: 0.5151
 epoch: 15, train_loss: 0.5891, test_loss: 1.2777, test_f1: 0.5492
 epoch: 16, train_loss: 0.6066, test_loss: 1.2430, test_f1: 0.5871
 epoch: 17, train_loss: 0.5743, test_loss: 1.2276, test_f1: 0.5993
 epoch: 18, train_loss: 0.5984, test_loss: 1.3988, test_f1: 0.5179
 epoch: 19, train_loss: 0.5868, test_loss: 1.1841, test_f1: 0.5986
 epoch: 20, train_loss: 0.5290, test_loss: 1.1667, test_f1: 0.6152
 epoch: 21, train_loss: 0.5149, test_loss: 1.4167, test_f1: 0.5739
 epoch: 22, train_loss: 0.5508, test_loss: 1.2905, test_f1: 0.5837
 epoch: 23, train_loss: 0.5102, test_loss: 1.3950, test_f1: 0.5691
 epoch: 24, train_loss: 0.4906, test_loss: 1.5031, test_f1: 0.5690
 epoch: 25, train_loss: 0.4675, test_loss: 1.4529, test_f1: 0.5688
 epoch: 26, train_loss: 0.4770, test_loss: 1.2700, test_f1: 0.6210
 epoch: 27, train_loss: 0.4620, test_loss: 1.6283, test_f1: 0.5775
 epoch: 28, train_loss: 0.4588, test_loss: 1.5214, test_f1: 0.5913
 epoch: 29, train_loss: 0.4451, test_loss: 1.6243, test_f1: 0.6087
 epoch: 30, train_loss: 0.4339, test_loss: 1.8138, test_f1: 0.5975
 epoch: 31, train_loss: 0.4426, test_loss: 1.4427, test_f1: 0.6210
 epoch: 32, train_loss: 0.4513, test_loss: 1.5229, test_f1: 0.5944
 epoch: 33, train_loss: 0.4311, test_loss: 1.5808, test_f1: 0.5976
 epoch: 34, train_loss: 0.4225, test_loss: 1.5638, test_f1: 0.5995
 epoch: 35, train_loss: 0.3949, test_loss: 1.6052, test_f1: 0.6349
 epoch: 36, train_loss: 0.4093, test_loss: 1.4765, test_f1: 0.5830
 epoch: 37, train_loss: 0.3951, test_loss: 1.6947, test_f1: 0.6080
 epoch: 38, train_loss: 0.3704, test_loss: 1.5949, test_f1: 0.5870
 epoch: 39, train_loss: 0.3439, test_loss: 1.7330, test_f1: 0.6123
 epoch: 40, train_loss: 0.3544, test_loss: 1.7900, test_f1: 0.5919
 epoch: 41, train_loss: 0.3322, test_loss: 1.9607, test_f1: 0.6222
 epoch: 42, train_loss: 0.3143, test_loss: 1.8164, test_f1: 0.5885
 epoch: 43, train_loss: 0.3335, test_loss: 1.7305, test_f1: 0.5817
 epoch: 44, train_loss: 0.3249, test_loss: 1.6169, test_f1: 0.6621
 epoch: 45, train_loss: 0.3206, test_loss: 1.7708, test_f1: 0.6317
 epoch: 46, train_loss: 0.3189, test_loss: 1.6438, test_f1: 0.6504
 epoch: 47, train_loss: 0.3128, test_loss: 1.9143, test_f1: 0.5980
 epoch: 48, train_loss: 0.2899, test_loss: 1.9079, test_f1: 0.6137
 epoch: 49, train_loss: 0.3486, test_loss: 1.6183, test_f1: 0.5874
 epoch: 50, train_loss: 0.3304, test_loss: 1.7863, test_f1: 0.6290
 epoch: 51, train_loss: 0.2815, test_loss: 1.7728, test_f1: 0.6333
 epoch: 52, train_loss: 0.2472, test_loss: 1.7907, test_f1: 0.6228
 epoch: 53, train_loss: 0.2147, test_loss: 1.8772, test_f1: 0.6223
 epoch: 54, train_loss: 0.2264, test_loss: 1.7625, test_f1: 0.6515
 epoch: 55, train_loss: 0.2083, test_loss: 1.7718, test_f1: 0.6306
 epoch: 56, train_loss: 0.2175, test_loss: 1.9267, test_f1: 0.6167
 epoch: 57, train_loss: 0.2026, test_loss: 1.8218, test_f1: 0.6308
 epoch: 58, train_loss: 0.1973, test_loss: 1.9729, test_f1: 0.6430
 epoch: 59, train_loss: 0.1740, test_loss: 1.9011, test_f1: 0.6024
 epoch: 60, train_loss: 0.2128, test_loss: 2.0369, test_f1: 0.5850
 epoch: 61, train_loss: 0.1755, test_loss: 1.9293, test_f1: 0.6340
 epoch: 62, train_loss: 0.1719, test_loss: 2.1687, test_f1: 0.6140
 epoch: 63, train_loss: 0.1851, test_loss: 2.0465, test_f1: 0.6550
 epoch: 64, train_loss: 0.1885, test_loss: 1.9682, test_f1: 0.6210
 epoch: 65, train_loss: 0.1817, test_loss: 2.1034, test_f1: 0.6151
 epoch: 66, train_loss: 0.1994, test_loss: 2.0096, test_f1: 0.5984
 epoch: 67, train_loss: 0.1738, test_loss: 2.0613, test_f1: 0.6162
 epoch: 68, train_loss: 0.1706, test_loss: 2.1218, test_f1: 0.6207
 epoch: 69, train_loss: 0.1601, test_loss: 2.1523, test_f1: 0.5953
 epoch: 70, train_loss: 0.1871, test_loss: 2.1791, test_f1: 0.5904
 epoch: 71, train_loss: 0.1561, test_loss: 2.0327, test_f1: 0.6368
 epoch: 72, train_loss: 0.1883, test_loss: 2.1731, test_f1: 0.6011
 epoch: 73, train_loss: 0.1837, test_loss: 2.1566, test_f1: 0.6366
 epoch: 74, train_loss: 0.1634, test_loss: 2.1797, test_f1: 0.5999
 epoch: 75, train_loss: 0.1692, test_loss: 2.1355, test_f1: 0.6277
 epoch: 76, train_loss: 0.1653, test_loss: 2.2954, test_f1: 0.5898
 epoch: 77, train_loss: 0.1635, test_loss: 2.1050, test_f1: 0.6481
 epoch: 78, train_loss: 0.1697, test_loss: 2.2076, test_f1: 0.5831
 epoch: 79, train_loss: 0.1529, test_loss: 2.2719, test_f1: 0.5704
 epoch: 80, train_loss: 0.1698, test_loss: 2.0982, test_f1: 0.6126
 epoch: 81, train_loss: 0.1947, test_loss: 2.2519, test_f1: 0.6238
 epoch: 82, train_loss: 0.1550, test_loss: 2.4699, test_f1: 0.5863
 epoch: 83, train_loss: 0.1501, test_loss: 2.4729, test_f1: 0.5540
 epoch: 84, train_loss: 0.1602, test_loss: 2.4104, test_f1: 0.5829
 epoch: 85, train_loss: 0.1532, test_loss: 2.6093, test_f1: 0.5961
 epoch: 86, train_loss: 0.1702, test_loss: 2.1357, test_f1: 0.6542
 epoch: 87, train_loss: 0.1461, test_loss: 2.3078, test_f1: 0.5781
 epoch: 88, train_loss: 0.1442, test_loss: 2.8020, test_f1: 0.5736
 epoch: 89, train_loss: 0.1279, test_loss: 2.3564, test_f1: 0.5719
 epoch: 90, train_loss: 0.1131, test_loss: 2.3599, test_f1: 0.6126
 epoch: 91, train_loss: 0.1319, test_loss: 2.6783, test_f1: 0.6023
 epoch: 92, train_loss: 0.1146, test_loss: 2.4478, test_f1: 0.5981
 epoch: 93, train_loss: 0.1115, test_loss: 2.5787, test_f1: 0.5554
 epoch: 94, train_loss: 0.1381, test_loss: 2.7425, test_f1: 0.5887
 epoch: 95, train_loss: 0.1203, test_loss: 2.4337, test_f1: 0.6215
 epoch: 96, train_loss: 0.1199, test_loss: 2.5903, test_f1: 0.5748
 epoch: 97, train_loss: 0.1275, test_loss: 2.4146, test_f1: 0.5989
 epoch: 98, train_loss: 0.0987, test_loss: 2.4878, test_f1: 0.5724
 epoch: 99, train_loss: 0.1104, test_loss: 2.5179, test_f1: 0.6009
##################ITERATION #7 ****************************************
 epoch: 0, train_loss: 1.4560, test_loss: 1.9540, test_f1: 0.2281
 epoch: 1, train_loss: 1.0584, test_loss: 1.2518, test_f1: 0.3964
 epoch: 2, train_loss: 0.9447, test_loss: 1.0650, test_f1: 0.5758
 epoch: 3, train_loss: 0.8684, test_loss: 1.0910, test_f1: 0.5628
 epoch: 4, train_loss: 0.8537, test_loss: 1.1059, test_f1: 0.5749
 epoch: 5, train_loss: 0.7990, test_loss: 1.0978, test_f1: 0.5932
 epoch: 6, train_loss: 0.7788, test_loss: 1.1510, test_f1: 0.5946
 epoch: 7, train_loss: 0.7641, test_loss: 1.1552, test_f1: 0.6305
 epoch: 8, train_loss: 0.7477, test_loss: 1.1311, test_f1: 0.5941
 epoch: 9, train_loss: 0.7130, test_loss: 1.2268, test_f1: 0.5706
 epoch: 10, train_loss: 0.7133, test_loss: 1.2020, test_f1: 0.5767
 epoch: 11, train_loss: 0.6617, test_loss: 1.1489, test_f1: 0.6193
 epoch: 12, train_loss: 0.6602, test_loss: 1.1877, test_f1: 0.5511
 epoch: 13, train_loss: 0.6404, test_loss: 1.1984, test_f1: 0.6217
 epoch: 14, train_loss: 0.6031, test_loss: 1.2231, test_f1: 0.6108
 epoch: 15, train_loss: 0.6105, test_loss: 1.1919, test_f1: 0.6127
 epoch: 16, train_loss: 0.5714, test_loss: 1.3336, test_f1: 0.6280
 epoch: 17, train_loss: 0.5842, test_loss: 1.2173, test_f1: 0.6457
 epoch: 18, train_loss: 0.5438, test_loss: 1.3145, test_f1: 0.5843
 epoch: 19, train_loss: 0.5491, test_loss: 1.3340, test_f1: 0.5950
 epoch: 20, train_loss: 0.5113, test_loss: 1.3856, test_f1: 0.5728
 epoch: 21, train_loss: 0.5125, test_loss: 1.4486, test_f1: 0.6102
 epoch: 22, train_loss: 0.5039, test_loss: 1.4039, test_f1: 0.5789
 epoch: 23, train_loss: 0.4844, test_loss: 1.4277, test_f1: 0.5976
 epoch: 24, train_loss: 0.5041, test_loss: 1.4490, test_f1: 0.5715
 epoch: 25, train_loss: 0.5064, test_loss: 1.5367, test_f1: 0.5459
 epoch: 26, train_loss: 0.4553, test_loss: 1.4481, test_f1: 0.6280
 epoch: 27, train_loss: 0.4766, test_loss: 1.3366, test_f1: 0.5943
 epoch: 28, train_loss: 0.4609, test_loss: 1.5198, test_f1: 0.5723
 epoch: 29, train_loss: 0.4551, test_loss: 1.5927, test_f1: 0.6393
 epoch: 30, train_loss: 0.4340, test_loss: 1.7320, test_f1: 0.5699
 epoch: 31, train_loss: 0.4465, test_loss: 1.5350, test_f1: 0.5640
 epoch: 32, train_loss: 0.4196, test_loss: 1.5883, test_f1: 0.5812
 epoch: 33, train_loss: 0.3854, test_loss: 1.7649, test_f1: 0.6004
 epoch: 34, train_loss: 0.3994, test_loss: 1.6758, test_f1: 0.6027
 epoch: 35, train_loss: 0.3625, test_loss: 1.7736, test_f1: 0.5724
 epoch: 36, train_loss: 0.3527, test_loss: 1.9411, test_f1: 0.5913
 epoch: 37, train_loss: 0.3711, test_loss: 1.8766, test_f1: 0.5794
 epoch: 38, train_loss: 0.3690, test_loss: 1.8363, test_f1: 0.5816
 epoch: 39, train_loss: 0.3730, test_loss: 1.9730, test_f1: 0.5987
 epoch: 40, train_loss: 0.3255, test_loss: 2.0271, test_f1: 0.5457
 epoch: 41, train_loss: 0.3110, test_loss: 2.0200, test_f1: 0.6153
 epoch: 42, train_loss: 0.3400, test_loss: 1.9081, test_f1: 0.6022
 epoch: 43, train_loss: 0.3530, test_loss: 1.9163, test_f1: 0.5965
 epoch: 44, train_loss: 0.3289, test_loss: 2.1620, test_f1: 0.5905
 epoch: 45, train_loss: 0.3281, test_loss: 1.9148, test_f1: 0.6210
 epoch: 46, train_loss: 0.2924, test_loss: 1.8747, test_f1: 0.5900
 epoch: 47, train_loss: 0.3049, test_loss: 2.0158, test_f1: 0.6002
 epoch: 48, train_loss: 0.3159, test_loss: 1.9522, test_f1: 0.5970
 epoch: 49, train_loss: 0.2964, test_loss: 1.9275, test_f1: 0.5992
 epoch: 50, train_loss: 0.2611, test_loss: 1.9657, test_f1: 0.6345
 epoch: 51, train_loss: 0.2371, test_loss: 2.0545, test_f1: 0.5914
 epoch: 52, train_loss: 0.2231, test_loss: 2.0233, test_f1: 0.5989
 epoch: 53, train_loss: 0.2024, test_loss: 2.1049, test_f1: 0.6294
 epoch: 54, train_loss: 0.1939, test_loss: 2.0237, test_f1: 0.6248
 epoch: 55, train_loss: 0.2034, test_loss: 2.1718, test_f1: 0.6366
 epoch: 56, train_loss: 0.1961, test_loss: 2.2765, test_f1: 0.6174
 epoch: 57, train_loss: 0.1964, test_loss: 2.2826, test_f1: 0.5973
 epoch: 58, train_loss: 0.1971, test_loss: 2.1795, test_f1: 0.6536
 epoch: 59, train_loss: 0.2116, test_loss: 2.2213, test_f1: 0.6585
 epoch: 60, train_loss: 0.1644, test_loss: 2.1557, test_f1: 0.6226
 epoch: 61, train_loss: 0.2014, test_loss: 2.4197, test_f1: 0.6069
 epoch: 62, train_loss: 0.2094, test_loss: 2.3034, test_f1: 0.6009
 epoch: 63, train_loss: 0.1909, test_loss: 2.1967, test_f1: 0.6407
 epoch: 64, train_loss: 0.1609, test_loss: 2.3055, test_f1: 0.6039
 epoch: 65, train_loss: 0.1587, test_loss: 2.3860, test_f1: 0.6335
 epoch: 66, train_loss: 0.1443, test_loss: 2.4929, test_f1: 0.6240
 epoch: 67, train_loss: 0.1679, test_loss: 2.2522, test_f1: 0.6392
 epoch: 68, train_loss: 0.1495, test_loss: 2.3580, test_f1: 0.6352
 epoch: 69, train_loss: 0.1674, test_loss: 2.5613, test_f1: 0.6239
 epoch: 70, train_loss: 0.1480, test_loss: 2.6744, test_f1: 0.5989
 epoch: 71, train_loss: 0.1425, test_loss: 2.6598, test_f1: 0.6150
 epoch: 72, train_loss: 0.1858, test_loss: 2.4430, test_f1: 0.6132
 epoch: 73, train_loss: 0.1825, test_loss: 2.2907, test_f1: 0.6510
 epoch: 74, train_loss: 0.1544, test_loss: 2.3369, test_f1: 0.6416
 epoch: 75, train_loss: 0.1503, test_loss: 2.3991, test_f1: 0.6661
 epoch: 76, train_loss: 0.1356, test_loss: 2.5354, test_f1: 0.6264
 epoch: 77, train_loss: 0.1568, test_loss: 2.3393, test_f1: 0.6356
 epoch: 78, train_loss: 0.1291, test_loss: 2.4598, test_f1: 0.6482
 epoch: 79, train_loss: 0.1418, test_loss: 2.3484, test_f1: 0.6423
 epoch: 80, train_loss: 0.1277, test_loss: 2.6317, test_f1: 0.6470
 epoch: 81, train_loss: 0.1276, test_loss: 2.8908, test_f1: 0.5822
 epoch: 82, train_loss: 0.1302, test_loss: 2.6250, test_f1: 0.6329
 epoch: 83, train_loss: 0.1433, test_loss: 2.7894, test_f1: 0.5940
 epoch: 84, train_loss: 0.1526, test_loss: 2.5440, test_f1: 0.6370
 epoch: 85, train_loss: 0.1557, test_loss: 2.5868, test_f1: 0.6401
 epoch: 86, train_loss: 0.1669, test_loss: 2.7291, test_f1: 0.6249
 epoch: 87, train_loss: 0.1361, test_loss: 2.7883, test_f1: 0.5991
 epoch: 88, train_loss: 0.1372, test_loss: 2.8620, test_f1: 0.6127
 epoch: 89, train_loss: 0.1443, test_loss: 2.5606, test_f1: 0.6355
 epoch: 90, train_loss: 0.1504, test_loss: 2.8994, test_f1: 0.6116
 epoch: 91, train_loss: 0.1426, test_loss: 2.6402, test_f1: 0.6600
 epoch: 92, train_loss: 0.1462, test_loss: 2.6371, test_f1: 0.6281
 epoch: 93, train_loss: 0.1174, test_loss: 2.5850, test_f1: 0.6417
 epoch: 94, train_loss: 0.1363, test_loss: 2.7760, test_f1: 0.6156
 epoch: 95, train_loss: 0.1278, test_loss: 2.7647, test_f1: 0.6242
 epoch: 96, train_loss: 0.1368, test_loss: 2.8005, test_f1: 0.6184
 epoch: 97, train_loss: 0.1351, test_loss: 2.6594, test_f1: 0.6398
 epoch: 98, train_loss: 0.1186, test_loss: 2.7815, test_f1: 0.6242
 epoch: 99, train_loss: 0.1546, test_loss: 2.5949, test_f1: 0.6382
##################ITERATION #8 ****************************************
 epoch: 0, train_loss: 1.6655, test_loss: 1.7523, test_f1: 0.2583
 epoch: 1, train_loss: 1.1221, test_loss: 1.2582, test_f1: 0.5079
 epoch: 2, train_loss: 0.9587, test_loss: 1.1393, test_f1: 0.5745
 epoch: 3, train_loss: 0.9185, test_loss: 1.1079, test_f1: 0.5863
 epoch: 4, train_loss: 0.8381, test_loss: 1.1351, test_f1: 0.5558
 epoch: 5, train_loss: 0.8317, test_loss: 1.1770, test_f1: 0.5079
 epoch: 6, train_loss: 0.8010, test_loss: 1.1242, test_f1: 0.5407
 epoch: 7, train_loss: 0.7762, test_loss: 1.1751, test_f1: 0.5305
 epoch: 8, train_loss: 0.7662, test_loss: 1.1749, test_f1: 0.5311
 epoch: 9, train_loss: 0.7211, test_loss: 1.0746, test_f1: 0.5676
 epoch: 10, train_loss: 0.7192, test_loss: 1.0892, test_f1: 0.5640
 epoch: 11, train_loss: 0.6828, test_loss: 1.1882, test_f1: 0.5632
 epoch: 12, train_loss: 0.6670, test_loss: 1.2004, test_f1: 0.5686
 epoch: 13, train_loss: 0.6505, test_loss: 1.2650, test_f1: 0.5635
 epoch: 14, train_loss: 0.6218, test_loss: 1.2160, test_f1: 0.5989
 epoch: 15, train_loss: 0.6499, test_loss: 1.1848, test_f1: 0.6217
 epoch: 16, train_loss: 0.5936, test_loss: 1.4373, test_f1: 0.5489
 epoch: 17, train_loss: 0.5853, test_loss: 1.2966, test_f1: 0.5893
 epoch: 18, train_loss: 0.5954, test_loss: 1.3035, test_f1: 0.5742
 epoch: 19, train_loss: 0.5614, test_loss: 1.3613, test_f1: 0.5940
 epoch: 20, train_loss: 0.5820, test_loss: 1.3680, test_f1: 0.6067
 epoch: 21, train_loss: 0.5650, test_loss: 1.2621, test_f1: 0.6086
 epoch: 22, train_loss: 0.5260, test_loss: 1.3172, test_f1: 0.6271
 epoch: 23, train_loss: 0.5129, test_loss: 1.3367, test_f1: 0.6399
 epoch: 24, train_loss: 0.5337, test_loss: 1.3910, test_f1: 0.5481
 epoch: 25, train_loss: 0.4936, test_loss: 1.5213, test_f1: 0.5634
 epoch: 26, train_loss: 0.5028, test_loss: 1.3033, test_f1: 0.6237
 epoch: 27, train_loss: 0.4772, test_loss: 1.5205, test_f1: 0.6286
 epoch: 28, train_loss: 0.4661, test_loss: 1.5235, test_f1: 0.5918
 epoch: 29, train_loss: 0.4793, test_loss: 1.3475, test_f1: 0.6210
 epoch: 30, train_loss: 0.4554, test_loss: 1.5609, test_f1: 0.5496
 epoch: 31, train_loss: 0.4517, test_loss: 1.5955, test_f1: 0.5971
 epoch: 32, train_loss: 0.4313, test_loss: 1.6185, test_f1: 0.5694
 epoch: 33, train_loss: 0.4244, test_loss: 1.4690, test_f1: 0.6323
 epoch: 34, train_loss: 0.3973, test_loss: 1.5008, test_f1: 0.6177
 epoch: 35, train_loss: 0.3887, test_loss: 1.5168, test_f1: 0.6603
 epoch: 36, train_loss: 0.4226, test_loss: 1.6583, test_f1: 0.6202
 epoch: 37, train_loss: 0.3947, test_loss: 1.7056, test_f1: 0.6024
 epoch: 38, train_loss: 0.3914, test_loss: 1.5570, test_f1: 0.5690
 epoch: 39, train_loss: 0.3887, test_loss: 1.5665, test_f1: 0.5977
 epoch: 40, train_loss: 0.3516, test_loss: 1.6169, test_f1: 0.5614
 epoch: 41, train_loss: 0.3994, test_loss: 1.7792, test_f1: 0.5374
 epoch: 42, train_loss: 0.3662, test_loss: 1.7162, test_f1: 0.6277
 epoch: 43, train_loss: 0.3486, test_loss: 1.8650, test_f1: 0.5425
 epoch: 44, train_loss: 0.3209, test_loss: 1.6431, test_f1: 0.6396
 epoch: 45, train_loss: 0.3552, test_loss: 1.6300, test_f1: 0.5962
 epoch: 46, train_loss: 0.3822, test_loss: 1.8794, test_f1: 0.5858
 epoch: 47, train_loss: 0.3268, test_loss: 1.6912, test_f1: 0.5830
 epoch: 48, train_loss: 0.3338, test_loss: 1.7176, test_f1: 0.5886
 epoch: 49, train_loss: 0.3246, test_loss: 1.6536, test_f1: 0.6340
 epoch: 50, train_loss: 0.3189, test_loss: 1.8189, test_f1: 0.6298
 epoch: 51, train_loss: 0.2730, test_loss: 1.8420, test_f1: 0.6298
 epoch: 52, train_loss: 0.2410, test_loss: 1.8388, test_f1: 0.6477
 epoch: 53, train_loss: 0.2618, test_loss: 1.9301, test_f1: 0.5890
 epoch: 54, train_loss: 0.2276, test_loss: 1.8244, test_f1: 0.6474
 epoch: 55, train_loss: 0.2099, test_loss: 1.9582, test_f1: 0.6183
 epoch: 56, train_loss: 0.2506, test_loss: 2.0176, test_f1: 0.6159
 epoch: 57, train_loss: 0.2160, test_loss: 2.0244, test_f1: 0.6130
 epoch: 58, train_loss: 0.2300, test_loss: 2.0607, test_f1: 0.6208
 epoch: 59, train_loss: 0.2215, test_loss: 1.9858, test_f1: 0.6150
 epoch: 60, train_loss: 0.2275, test_loss: 2.0762, test_f1: 0.6009
 epoch: 61, train_loss: 0.1944, test_loss: 2.0184, test_f1: 0.5944
 epoch: 62, train_loss: 0.2097, test_loss: 2.1262, test_f1: 0.6123
 epoch: 63, train_loss: 0.1992, test_loss: 2.2349, test_f1: 0.6211
 epoch: 64, train_loss: 0.2166, test_loss: 1.9720, test_f1: 0.6051
 epoch: 65, train_loss: 0.2107, test_loss: 2.1303, test_f1: 0.5967
 epoch: 66, train_loss: 0.2011, test_loss: 2.1640, test_f1: 0.6195
 epoch: 67, train_loss: 0.1917, test_loss: 2.0366, test_f1: 0.6219
 epoch: 68, train_loss: 0.1966, test_loss: 2.0758, test_f1: 0.6073
 epoch: 69, train_loss: 0.1818, test_loss: 2.1340, test_f1: 0.6119
 epoch: 70, train_loss: 0.1907, test_loss: 2.2830, test_f1: 0.6060
 epoch: 71, train_loss: 0.2093, test_loss: 2.2374, test_f1: 0.6098
 epoch: 72, train_loss: 0.1863, test_loss: 2.1283, test_f1: 0.5838
 epoch: 73, train_loss: 0.1672, test_loss: 2.2418, test_f1: 0.6098
 epoch: 74, train_loss: 0.1944, test_loss: 2.2729, test_f1: 0.5868
 epoch: 75, train_loss: 0.1687, test_loss: 2.4004, test_f1: 0.5951
 epoch: 76, train_loss: 0.1943, test_loss: 2.3265, test_f1: 0.5732
 epoch: 77, train_loss: 0.1675, test_loss: 2.2206, test_f1: 0.5955
 epoch: 78, train_loss: 0.1846, test_loss: 2.2829, test_f1: 0.5973
 epoch: 79, train_loss: 0.1673, test_loss: 2.3380, test_f1: 0.6161
 epoch: 80, train_loss: 0.1615, test_loss: 2.4163, test_f1: 0.5835
 epoch: 81, train_loss: 0.1757, test_loss: 2.2477, test_f1: 0.6345
 epoch: 82, train_loss: 0.1524, test_loss: 2.3820, test_f1: 0.6105
 epoch: 83, train_loss: 0.1450, test_loss: 2.3266, test_f1: 0.6004
 epoch: 84, train_loss: 0.1491, test_loss: 2.3856, test_f1: 0.6272
 epoch: 85, train_loss: 0.1482, test_loss: 2.5338, test_f1: 0.5965
 epoch: 86, train_loss: 0.1468, test_loss: 2.4836, test_f1: 0.5720
 epoch: 87, train_loss: 0.1593, test_loss: 2.5299, test_f1: 0.5835
 epoch: 88, train_loss: 0.1684, test_loss: 2.4344, test_f1: 0.6187
 epoch: 89, train_loss: 0.1487, test_loss: 2.5163, test_f1: 0.6139
 epoch: 90, train_loss: 0.1783, test_loss: 2.4674, test_f1: 0.5876
 epoch: 91, train_loss: 0.1657, test_loss: 2.5311, test_f1: 0.6117
 epoch: 92, train_loss: 0.1785, test_loss: 2.4551, test_f1: 0.5975
 epoch: 93, train_loss: 0.1443, test_loss: 2.5777, test_f1: 0.5888
 epoch: 94, train_loss: 0.1494, test_loss: 2.6080, test_f1: 0.5874
 epoch: 95, train_loss: 0.1502, test_loss: 2.5411, test_f1: 0.5996
 epoch: 96, train_loss: 0.1335, test_loss: 2.6677, test_f1: 0.5748
 epoch: 97, train_loss: 0.1497, test_loss: 2.7262, test_f1: 0.6125
 epoch: 98, train_loss: 0.1322, test_loss: 2.7434, test_f1: 0.5905
 epoch: 99, train_loss: 0.1294, test_loss: 2.7817, test_f1: 0.5881
##################ITERATION #9 ****************************************
 epoch: 0, train_loss: 1.6955, test_loss: 1.8388, test_f1: 0.3091
 epoch: 1, train_loss: 1.1028, test_loss: 1.3029, test_f1: 0.3917
 epoch: 2, train_loss: 0.9631, test_loss: 1.1379, test_f1: 0.5325
 epoch: 3, train_loss: 0.9230, test_loss: 1.0861, test_f1: 0.5264
 epoch: 4, train_loss: 0.8419, test_loss: 1.0636, test_f1: 0.5178
 epoch: 5, train_loss: 0.8368, test_loss: 1.0536, test_f1: 0.6122
 epoch: 6, train_loss: 0.7736, test_loss: 1.0914, test_f1: 0.5357
 epoch: 7, train_loss: 0.7454, test_loss: 1.0757, test_f1: 0.5539
 epoch: 8, train_loss: 0.7243, test_loss: 1.1106, test_f1: 0.5419
 epoch: 9, train_loss: 0.7260, test_loss: 1.1302, test_f1: 0.5449
 epoch: 10, train_loss: 0.6951, test_loss: 1.1506, test_f1: 0.5716
 epoch: 11, train_loss: 0.6795, test_loss: 1.1396, test_f1: 0.5667
 epoch: 12, train_loss: 0.6695, test_loss: 1.1683, test_f1: 0.5970
 epoch: 13, train_loss: 0.6387, test_loss: 1.1399, test_f1: 0.5815
 epoch: 14, train_loss: 0.6338, test_loss: 1.0549, test_f1: 0.5980
 epoch: 15, train_loss: 0.6125, test_loss: 1.3381, test_f1: 0.4936
 epoch: 16, train_loss: 0.6239, test_loss: 1.1858, test_f1: 0.6095
 epoch: 17, train_loss: 0.5996, test_loss: 1.1892, test_f1: 0.5869
 epoch: 18, train_loss: 0.5610, test_loss: 1.2682, test_f1: 0.5324
 epoch: 19, train_loss: 0.5760, test_loss: 1.2252, test_f1: 0.5957
 epoch: 20, train_loss: 0.5679, test_loss: 1.3202, test_f1: 0.5781
 epoch: 21, train_loss: 0.5645, test_loss: 1.2804, test_f1: 0.6271
 epoch: 22, train_loss: 0.5080, test_loss: 1.2490, test_f1: 0.5550
 epoch: 23, train_loss: 0.5006, test_loss: 1.2132, test_f1: 0.6318
 epoch: 24, train_loss: 0.5046, test_loss: 1.3105, test_f1: 0.6345
 epoch: 25, train_loss: 0.4801, test_loss: 1.3166, test_f1: 0.6192
 epoch: 26, train_loss: 0.4757, test_loss: 1.3602, test_f1: 0.6309
 epoch: 27, train_loss: 0.4747, test_loss: 1.3019, test_f1: 0.6234
 epoch: 28, train_loss: 0.4633, test_loss: 1.4373, test_f1: 0.6137
 epoch: 29, train_loss: 0.4397, test_loss: 1.3512, test_f1: 0.6013
 epoch: 30, train_loss: 0.4497, test_loss: 1.3353, test_f1: 0.6394
 epoch: 31, train_loss: 0.4109, test_loss: 1.3440, test_f1: 0.6232
 epoch: 32, train_loss: 0.3757, test_loss: 1.5593, test_f1: 0.6154
 epoch: 33, train_loss: 0.4061, test_loss: 1.5841, test_f1: 0.5958
 epoch: 34, train_loss: 0.4410, test_loss: 1.6072, test_f1: 0.5519
 epoch: 35, train_loss: 0.4232, test_loss: 1.4503, test_f1: 0.6116
 epoch: 36, train_loss: 0.3629, test_loss: 1.5629, test_f1: 0.6172
 epoch: 37, train_loss: 0.3587, test_loss: 1.8839, test_f1: 0.5950
 epoch: 38, train_loss: 0.3840, test_loss: 1.4950, test_f1: 0.6007
 epoch: 39, train_loss: 0.3424, test_loss: 1.6842, test_f1: 0.6286
 epoch: 40, train_loss: 0.3596, test_loss: 1.5912, test_f1: 0.6082
 epoch: 41, train_loss: 0.3363, test_loss: 1.7220, test_f1: 0.6370
 epoch: 42, train_loss: 0.2937, test_loss: 1.7835, test_f1: 0.6123
 epoch: 43, train_loss: 0.3227, test_loss: 1.7380, test_f1: 0.6081
 epoch: 44, train_loss: 0.3524, test_loss: 1.7240, test_f1: 0.6123
 epoch: 45, train_loss: 0.3210, test_loss: 1.7741, test_f1: 0.6408
 epoch: 46, train_loss: 0.3259, test_loss: 1.7646, test_f1: 0.6044
 epoch: 47, train_loss: 0.3415, test_loss: 1.6912, test_f1: 0.5983
 epoch: 48, train_loss: 0.2974, test_loss: 1.8336, test_f1: 0.6359
 epoch: 49, train_loss: 0.3092, test_loss: 1.8498, test_f1: 0.5789
 epoch: 50, train_loss: 0.2765, test_loss: 1.7896, test_f1: 0.6453
 epoch: 51, train_loss: 0.2845, test_loss: 1.9493, test_f1: 0.5953
 epoch: 52, train_loss: 0.2575, test_loss: 1.8384, test_f1: 0.6056
 epoch: 53, train_loss: 0.2045, test_loss: 1.8107, test_f1: 0.6439
 epoch: 54, train_loss: 0.2204, test_loss: 1.9456, test_f1: 0.6173
 epoch: 55, train_loss: 0.2065, test_loss: 1.9550, test_f1: 0.6365
 epoch: 56, train_loss: 0.2177, test_loss: 1.9598, test_f1: 0.6303
 epoch: 57, train_loss: 0.1931, test_loss: 2.0740, test_f1: 0.5961
 epoch: 58, train_loss: 0.1669, test_loss: 2.1544, test_f1: 0.6134
 epoch: 59, train_loss: 0.1691, test_loss: 2.1366, test_f1: 0.6168
 epoch: 60, train_loss: 0.1709, test_loss: 2.0588, test_f1: 0.6252
 epoch: 61, train_loss: 0.1523, test_loss: 2.1203, test_f1: 0.6290
 epoch: 62, train_loss: 0.1979, test_loss: 2.0684, test_f1: 0.6296
 epoch: 63, train_loss: 0.1618, test_loss: 2.0983, test_f1: 0.6371
 epoch: 64, train_loss: 0.1577, test_loss: 2.0914, test_f1: 0.6176
 epoch: 65, train_loss: 0.1962, test_loss: 2.0025, test_f1: 0.6624
 epoch: 66, train_loss: 0.1667, test_loss: 2.0418, test_f1: 0.6428
 epoch: 67, train_loss: 0.1738, test_loss: 2.2146, test_f1: 0.6135
 epoch: 68, train_loss: 0.1686, test_loss: 2.1373, test_f1: 0.6141
 epoch: 69, train_loss: 0.1727, test_loss: 2.1244, test_f1: 0.6395
 epoch: 70, train_loss: 0.1521, test_loss: 2.1855, test_f1: 0.6546
 epoch: 71, train_loss: 0.1705, test_loss: 2.2390, test_f1: 0.6127
 epoch: 72, train_loss: 0.1435, test_loss: 2.1588, test_f1: 0.6511
 epoch: 73, train_loss: 0.1687, test_loss: 2.2272, test_f1: 0.6319
 epoch: 74, train_loss: 0.1724, test_loss: 2.0707, test_f1: 0.6564
 epoch: 75, train_loss: 0.1687, test_loss: 2.1989, test_f1: 0.6634
 epoch: 76, train_loss: 0.1573, test_loss: 2.2458, test_f1: 0.6434
 epoch: 77, train_loss: 0.1456, test_loss: 2.2968, test_f1: 0.6364
 epoch: 78, train_loss: 0.1280, test_loss: 2.3119, test_f1: 0.6565
 epoch: 79, train_loss: 0.1530, test_loss: 2.3952, test_f1: 0.6567
 epoch: 80, train_loss: 0.1520, test_loss: 2.2853, test_f1: 0.6400
 epoch: 81, train_loss: 0.1356, test_loss: 2.4293, test_f1: 0.6229
 epoch: 82, train_loss: 0.1376, test_loss: 2.4794, test_f1: 0.6113
 epoch: 83, train_loss: 0.1451, test_loss: 2.4413, test_f1: 0.6538
 epoch: 84, train_loss: 0.1388, test_loss: 2.5403, test_f1: 0.6423
 epoch: 85, train_loss: 0.1218, test_loss: 2.4050, test_f1: 0.6293
 epoch: 86, train_loss: 0.1372, test_loss: 2.3317, test_f1: 0.6378
 epoch: 87, train_loss: 0.1206, test_loss: 2.3132, test_f1: 0.6364
 epoch: 88, train_loss: 0.0983, test_loss: 2.6081, test_f1: 0.6068
 epoch: 89, train_loss: 0.1172, test_loss: 2.5525, test_f1: 0.6174
 epoch: 90, train_loss: 0.1511, test_loss: 2.3456, test_f1: 0.6541
 epoch: 91, train_loss: 0.1654, test_loss: 2.3146, test_f1: 0.6514
 epoch: 92, train_loss: 0.1433, test_loss: 2.3601, test_f1: 0.6436
 epoch: 93, train_loss: 0.1242, test_loss: 2.3922, test_f1: 0.6180
 epoch: 94, train_loss: 0.1166, test_loss: 2.4113, test_f1: 0.6451
 epoch: 95, train_loss: 0.1304, test_loss: 2.5225, test_f1: 0.6254
 epoch: 96, train_loss: 0.1392, test_loss: 2.3758, test_f1: 0.6184
 epoch: 97, train_loss: 0.1265, test_loss: 2.4380, test_f1: 0.6281
 epoch: 98, train_loss: 0.1284, test_loss: 2.5343, test_f1: 0.6169
 epoch: 99, train_loss: 0.1387, test_loss: 2.3923, test_f1: 0.6218

Training completed in 389.29 seconds
Best F1: 0.6877 at epoch 95
Mean F1 across iterations: 0.6647  0.0106
========================FINAL RESULTS================================
FEGIN weighted F1: 0.6877  0.0106
python main.py --data ltspice_demos --representation component_pin_net --model FEGIN --layers 2 --hiddens 128 --batch_size 64 --lr 0.001 --emb_size 128 --epochs 100 --save_appendix component_pin_net_L2_H128_BS64_LR0.001_E128 --no_val
-----



STDERR:
  File "main.py", line 370, in <module>
    main()
  File "main.py", line 254, in main
    dataset = dataset_class(
  File "/home/philip/projects/ltspice_examples_code_repo/Circuit-Completion-Using-GNNs/component_classification_with_link_prediction_head/evaluation/FEGIN/kernel/circuit_datasets.py", line 15, in __init__
    self.data, self.slices = torch.load(self.processed_paths[0])
  File "/home/philip/.local/lib/python3.8/site-packages/torch/serialization.py", line 1040, in load
    warnings.warn(
  File "/usr/lib/python3.8/warnings.py", line 109, in _showwarnmsg
    sw(msg.message, msg.category, msg.filename, msg.lineno,
  File "main.py", line 47, in warn_with_traceback
    traceback.print_stack(file=log)
/home/philip/projects/ltspice_examples_code_repo/Circuit-Completion-Using-GNNs/component_classification_with_link_prediction_head/evaluation/FEGIN/kernel/circuit_datasets.py:15: FutureWarning: You are using `torch.load` with `weights_only=False` (the current default value), which uses the default pickle module implicitly. It is possible to construct malicious pickle data which will execute arbitrary code during unpickling (See https://github.com/pytorch/pytorch/blob/main/SECURITY.md#untrusted-models for more details). In a future release, the default value for `weights_only` will be flipped to `True`. This limits the functions that could be executed during unpickling. Arbitrary objects will no longer be allowed to be loaded via this mode unless they are explicitly allowlisted by the user via `torch.serialization.add_safe_globals`. We recommend you start setting `weights_only=True` for any use case where you don't have full control of the loaded file. Please open an issue on GitHub for any issues related to this experimental feature.
  self.data, self.slices = torch.load(self.processed_paths[0])
