STDOUT:
Results will be saved in /home/philip/projects/ltspice_examples_code_repo/Circuit-Completion-Using-GNNs/component_classification_with_link_prediction_head/evaluation/FEGIN/results/model_FEGIN_dataset_ltspice_examples
Command line input: python main.py --data ltspice_examples --representation component_pin --model FEGIN --layers 3 --hiddens 128 --batch_size 32 --lr 0.001 --emb_size 128 --epochs 100 --save_appendix component_pin_L3_H128_BS32_LR0.001_E128 --no_val
 is saved.
-----
ltspice_examples - FEGIN
Using 3 layers, 128 hidden units, h = 2
Loading component_pin representation dataset
ENTERED
Training FEGIN on component_pin representation
Train: 3560, Test: 848
##################ITERATION #0 ****************************************
 epoch: 0, train_loss: 1.1199, test_loss: 1.1030, test_f1: 0.3844
 epoch: 1, train_loss: 0.9888, test_loss: 0.9534, test_f1: 0.4786
 epoch: 2, train_loss: 0.9149, test_loss: 0.8678, test_f1: 0.5134
 epoch: 3, train_loss: 0.8799, test_loss: 0.9125, test_f1: 0.5030
 epoch: 4, train_loss: 0.8522, test_loss: 0.9471, test_f1: 0.4984
 epoch: 5, train_loss: 0.8295, test_loss: 0.8409, test_f1: 0.5997
 epoch: 6, train_loss: 0.8094, test_loss: 0.7948, test_f1: 0.5855
 epoch: 7, train_loss: 0.7982, test_loss: 0.8519, test_f1: 0.5591
 epoch: 8, train_loss: 0.7696, test_loss: 0.8630, test_f1: 0.5580
 epoch: 9, train_loss: 0.7686, test_loss: 0.7861, test_f1: 0.6354
 epoch: 10, train_loss: 0.7312, test_loss: 0.7778, test_f1: 0.6250
 epoch: 11, train_loss: 0.7267, test_loss: 0.8496, test_f1: 0.6034
 epoch: 12, train_loss: 0.7315, test_loss: 0.8176, test_f1: 0.5829
 epoch: 13, train_loss: 0.7248, test_loss: 0.8517, test_f1: 0.6345
 epoch: 14, train_loss: 0.7071, test_loss: 0.7681, test_f1: 0.6318
 epoch: 15, train_loss: 0.6843, test_loss: 0.8507, test_f1: 0.6102
 epoch: 16, train_loss: 0.6831, test_loss: 0.7847, test_f1: 0.6298
 epoch: 17, train_loss: 0.6565, test_loss: 0.7933, test_f1: 0.6295
 epoch: 18, train_loss: 0.6378, test_loss: 1.0135, test_f1: 0.6050
 epoch: 19, train_loss: 0.6473, test_loss: 0.8016, test_f1: 0.6287
 epoch: 20, train_loss: 0.6288, test_loss: 0.8436, test_f1: 0.6577
 epoch: 21, train_loss: 0.6142, test_loss: 0.7828, test_f1: 0.6481
 epoch: 22, train_loss: 0.6119, test_loss: 0.8509, test_f1: 0.6153
 epoch: 23, train_loss: 0.6079, test_loss: 0.7909, test_f1: 0.6578
 epoch: 24, train_loss: 0.5918, test_loss: 0.8352, test_f1: 0.6475
 epoch: 25, train_loss: 0.5832, test_loss: 1.2244, test_f1: 0.5926
 epoch: 26, train_loss: 0.5746, test_loss: 0.8613, test_f1: 0.6449
 epoch: 27, train_loss: 0.5649, test_loss: 0.8745, test_f1: 0.6529
 epoch: 28, train_loss: 0.5591, test_loss: 0.8172, test_f1: 0.6462
 epoch: 29, train_loss: 0.5373, test_loss: 0.7431, test_f1: 0.6653
 epoch: 30, train_loss: 0.5145, test_loss: 0.8108, test_f1: 0.6700
 epoch: 31, train_loss: 0.5136, test_loss: 0.8324, test_f1: 0.6505
 epoch: 32, train_loss: 0.5231, test_loss: 0.8679, test_f1: 0.6441
 epoch: 33, train_loss: 0.4969, test_loss: 0.9349, test_f1: 0.6235
 epoch: 34, train_loss: 0.4897, test_loss: 0.9927, test_f1: 0.6739
 epoch: 35, train_loss: 0.5056, test_loss: 0.9810, test_f1: 0.6344
 epoch: 36, train_loss: 0.4838, test_loss: 0.8730, test_f1: 0.6445
 epoch: 37, train_loss: 0.4914, test_loss: 0.9593, test_f1: 0.6469
 epoch: 38, train_loss: 0.4549, test_loss: 0.9749, test_f1: 0.6689
 epoch: 39, train_loss: 0.4537, test_loss: 0.9653, test_f1: 0.6725
 epoch: 40, train_loss: 0.4499, test_loss: 0.9377, test_f1: 0.6691
 epoch: 41, train_loss: 0.4535, test_loss: 0.9369, test_f1: 0.6663
 epoch: 42, train_loss: 0.4292, test_loss: 1.0720, test_f1: 0.6134
 epoch: 43, train_loss: 0.4381, test_loss: 1.0376, test_f1: 0.6595
 epoch: 44, train_loss: 0.4198, test_loss: 1.0043, test_f1: 0.6696
 epoch: 45, train_loss: 0.4036, test_loss: 0.9828, test_f1: 0.6782
 epoch: 46, train_loss: 0.3936, test_loss: 1.1201, test_f1: 0.6626
 epoch: 47, train_loss: 0.4049, test_loss: 1.0009, test_f1: 0.6582
 epoch: 48, train_loss: 0.3916, test_loss: 1.0218, test_f1: 0.6538
 epoch: 49, train_loss: 0.3899, test_loss: 0.9821, test_f1: 0.6370
 epoch: 50, train_loss: 0.3815, test_loss: 1.0107, test_f1: 0.6908
 epoch: 51, train_loss: 0.3382, test_loss: 1.0665, test_f1: 0.6606
 epoch: 52, train_loss: 0.3158, test_loss: 0.9985, test_f1: 0.6643
 epoch: 53, train_loss: 0.2962, test_loss: 1.0973, test_f1: 0.6881
 epoch: 54, train_loss: 0.2768, test_loss: 1.1432, test_f1: 0.7096
 epoch: 55, train_loss: 0.2827, test_loss: 1.1141, test_f1: 0.6812
 epoch: 56, train_loss: 0.2946, test_loss: 1.1265, test_f1: 0.7027
 epoch: 57, train_loss: 0.2808, test_loss: 1.1358, test_f1: 0.6857
 epoch: 58, train_loss: 0.2697, test_loss: 1.2331, test_f1: 0.6856
 epoch: 59, train_loss: 0.2818, test_loss: 1.1721, test_f1: 0.6974
 epoch: 60, train_loss: 0.2479, test_loss: 1.2355, test_f1: 0.6956
 epoch: 61, train_loss: 0.2640, test_loss: 1.1925, test_f1: 0.6512
 epoch: 62, train_loss: 0.2787, test_loss: 1.1001, test_f1: 0.6733
 epoch: 63, train_loss: 0.2328, test_loss: 1.2870, test_f1: 0.6941
 epoch: 64, train_loss: 0.2473, test_loss: 1.4108, test_f1: 0.6635
 epoch: 65, train_loss: 0.2254, test_loss: 1.3365, test_f1: 0.6790
 epoch: 66, train_loss: 0.2216, test_loss: 1.2482, test_f1: 0.6659
 epoch: 67, train_loss: 0.2454, test_loss: 1.3041, test_f1: 0.6766
 epoch: 68, train_loss: 0.2478, test_loss: 1.4008, test_f1: 0.6462
 epoch: 69, train_loss: 0.2481, test_loss: 1.3164, test_f1: 0.6855
 epoch: 70, train_loss: 0.2207, test_loss: 1.4244, test_f1: 0.6917
 epoch: 71, train_loss: 0.2183, test_loss: 1.3091, test_f1: 0.6753
 epoch: 72, train_loss: 0.2195, test_loss: 1.4492, test_f1: 0.6599
 epoch: 73, train_loss: 0.2162, test_loss: 1.2548, test_f1: 0.6590
 epoch: 74, train_loss: 0.2119, test_loss: 1.4050, test_f1: 0.6858
 epoch: 75, train_loss: 0.2067, test_loss: 1.4017, test_f1: 0.6917
 epoch: 76, train_loss: 0.1991, test_loss: 1.3378, test_f1: 0.6889
 epoch: 77, train_loss: 0.2139, test_loss: 1.4120, test_f1: 0.6761
 epoch: 78, train_loss: 0.2178, test_loss: 1.4453, test_f1: 0.6711
 epoch: 79, train_loss: 0.2149, test_loss: 1.3630, test_f1: 0.6926
 epoch: 80, train_loss: 0.1985, test_loss: 1.4366, test_f1: 0.6590
 epoch: 81, train_loss: 0.1818, test_loss: 1.4139, test_f1: 0.6888
 epoch: 82, train_loss: 0.1853, test_loss: 1.5117, test_f1: 0.6663
 epoch: 83, train_loss: 0.1838, test_loss: 1.5418, test_f1: 0.6623
 epoch: 84, train_loss: 0.1955, test_loss: 1.5784, test_f1: 0.6761
 epoch: 85, train_loss: 0.1849, test_loss: 1.5408, test_f1: 0.6833
 epoch: 86, train_loss: 0.1789, test_loss: 1.5377, test_f1: 0.6724
 epoch: 87, train_loss: 0.1775, test_loss: 1.3825, test_f1: 0.6785
 epoch: 88, train_loss: 0.1906, test_loss: 1.4522, test_f1: 0.6671
 epoch: 89, train_loss: 0.2021, test_loss: 1.4672, test_f1: 0.6614
 epoch: 90, train_loss: 0.1931, test_loss: 1.3796, test_f1: 0.6740
 epoch: 91, train_loss: 0.1739, test_loss: 1.6051, test_f1: 0.6778
 epoch: 92, train_loss: 0.1801, test_loss: 1.4887, test_f1: 0.6665
 epoch: 93, train_loss: 0.1818, test_loss: 1.5851, test_f1: 0.6524
 epoch: 94, train_loss: 0.1761, test_loss: 1.4673, test_f1: 0.6797
 epoch: 95, train_loss: 0.1503, test_loss: 1.6161, test_f1: 0.6726
 epoch: 96, train_loss: 0.1546, test_loss: 1.5281, test_f1: 0.6763
 epoch: 97, train_loss: 0.1624, test_loss: 1.6053, test_f1: 0.6791
 epoch: 98, train_loss: 0.1778, test_loss: 1.6547, test_f1: 0.6960
 epoch: 99, train_loss: 0.1584, test_loss: 1.7223, test_f1: 0.6806
##################ITERATION #1 ****************************************
 epoch: 0, train_loss: 1.0718, test_loss: 0.9585, test_f1: 0.5084
 epoch: 1, train_loss: 0.9448, test_loss: 0.9316, test_f1: 0.4833
 epoch: 2, train_loss: 0.9041, test_loss: 0.9401, test_f1: 0.5194
 epoch: 3, train_loss: 0.8668, test_loss: 0.9533, test_f1: 0.5226
 epoch: 4, train_loss: 0.8384, test_loss: 0.9421, test_f1: 0.5257
 epoch: 5, train_loss: 0.8288, test_loss: 0.8230, test_f1: 0.5909
 epoch: 6, train_loss: 0.7936, test_loss: 0.8195, test_f1: 0.5722
 epoch: 7, train_loss: 0.7664, test_loss: 0.8354, test_f1: 0.6174
 epoch: 8, train_loss: 0.7560, test_loss: 0.8570, test_f1: 0.5910
 epoch: 9, train_loss: 0.7640, test_loss: 0.8788, test_f1: 0.5717
 epoch: 10, train_loss: 0.7166, test_loss: 0.9875, test_f1: 0.5822
 epoch: 11, train_loss: 0.7047, test_loss: 0.8548, test_f1: 0.6379
 epoch: 12, train_loss: 0.7017, test_loss: 0.9093, test_f1: 0.6193
 epoch: 13, train_loss: 0.6881, test_loss: 0.8430, test_f1: 0.6451
 epoch: 14, train_loss: 0.6690, test_loss: 0.8354, test_f1: 0.5940
 epoch: 15, train_loss: 0.6538, test_loss: 0.8043, test_f1: 0.6410
 epoch: 16, train_loss: 0.6322, test_loss: 0.8118, test_f1: 0.6367
 epoch: 17, train_loss: 0.6308, test_loss: 0.9104, test_f1: 0.6077
 epoch: 18, train_loss: 0.6213, test_loss: 0.8571, test_f1: 0.6210
 epoch: 19, train_loss: 0.6150, test_loss: 0.8833, test_f1: 0.6322
 epoch: 20, train_loss: 0.6166, test_loss: 0.9469, test_f1: 0.6330
 epoch: 21, train_loss: 0.5872, test_loss: 0.9272, test_f1: 0.6163
 epoch: 22, train_loss: 0.5848, test_loss: 0.8674, test_f1: 0.6188
 epoch: 23, train_loss: 0.5515, test_loss: 0.8940, test_f1: 0.6388
 epoch: 24, train_loss: 0.5620, test_loss: 0.9881, test_f1: 0.6022
 epoch: 25, train_loss: 0.5461, test_loss: 0.9027, test_f1: 0.6562
 epoch: 26, train_loss: 0.5282, test_loss: 1.0048, test_f1: 0.6498
 epoch: 27, train_loss: 0.5156, test_loss: 1.0574, test_f1: 0.6202
 epoch: 28, train_loss: 0.5175, test_loss: 1.0068, test_f1: 0.6079
 epoch: 29, train_loss: 0.5020, test_loss: 0.8493, test_f1: 0.6517
 epoch: 30, train_loss: 0.4796, test_loss: 0.8816, test_f1: 0.6512
 epoch: 31, train_loss: 0.4931, test_loss: 1.0221, test_f1: 0.6188
 epoch: 32, train_loss: 0.4689, test_loss: 1.1040, test_f1: 0.6322
 epoch: 33, train_loss: 0.4688, test_loss: 0.8630, test_f1: 0.6703
 epoch: 34, train_loss: 0.4619, test_loss: 0.8412, test_f1: 0.6498
 epoch: 35, train_loss: 0.4485, test_loss: 0.9606, test_f1: 0.6658
 epoch: 36, train_loss: 0.4592, test_loss: 1.2219, test_f1: 0.6545
 epoch: 37, train_loss: 0.4389, test_loss: 0.9701, test_f1: 0.6820
 epoch: 38, train_loss: 0.4427, test_loss: 1.1211, test_f1: 0.6613
 epoch: 39, train_loss: 0.4241, test_loss: 1.1353, test_f1: 0.6536
 epoch: 40, train_loss: 0.3964, test_loss: 0.9753, test_f1: 0.6412
 epoch: 41, train_loss: 0.4362, test_loss: 0.9868, test_f1: 0.6719
 epoch: 42, train_loss: 0.3656, test_loss: 1.1884, test_f1: 0.6957
 epoch: 43, train_loss: 0.3886, test_loss: 0.9372, test_f1: 0.6884
 epoch: 44, train_loss: 0.3937, test_loss: 1.1448, test_f1: 0.6722
 epoch: 45, train_loss: 0.3735, test_loss: 1.0344, test_f1: 0.6521
 epoch: 46, train_loss: 0.3787, test_loss: 1.0396, test_f1: 0.6602
 epoch: 47, train_loss: 0.3716, test_loss: 1.0623, test_f1: 0.6773
 epoch: 48, train_loss: 0.3586, test_loss: 1.2271, test_f1: 0.6393
 epoch: 49, train_loss: 0.3633, test_loss: 0.9991, test_f1: 0.6458
 epoch: 50, train_loss: 0.3448, test_loss: 0.9902, test_f1: 0.6779
 epoch: 51, train_loss: 0.3111, test_loss: 1.0998, test_f1: 0.6890
 epoch: 52, train_loss: 0.2835, test_loss: 1.0941, test_f1: 0.6938
 epoch: 53, train_loss: 0.2786, test_loss: 1.1981, test_f1: 0.6665
 epoch: 54, train_loss: 0.2586, test_loss: 1.2493, test_f1: 0.6728
 epoch: 55, train_loss: 0.2425, test_loss: 1.2621, test_f1: 0.6779
 epoch: 56, train_loss: 0.2494, test_loss: 1.2356, test_f1: 0.6939
 epoch: 57, train_loss: 0.2357, test_loss: 1.4061, test_f1: 0.6691
 epoch: 58, train_loss: 0.2410, test_loss: 1.1536, test_f1: 0.6835
 epoch: 59, train_loss: 0.2384, test_loss: 1.4362, test_f1: 0.6330
 epoch: 60, train_loss: 0.2276, test_loss: 1.3932, test_f1: 0.6682
 epoch: 61, train_loss: 0.2428, test_loss: 1.5994, test_f1: 0.6778
 epoch: 62, train_loss: 0.2270, test_loss: 1.3638, test_f1: 0.6843
 epoch: 63, train_loss: 0.2315, test_loss: 1.3598, test_f1: 0.6706
 epoch: 64, train_loss: 0.2096, test_loss: 1.3357, test_f1: 0.6517
 epoch: 65, train_loss: 0.2168, test_loss: 1.4424, test_f1: 0.6908
 epoch: 66, train_loss: 0.2383, test_loss: 1.2956, test_f1: 0.6887
 epoch: 67, train_loss: 0.2138, test_loss: 1.4012, test_f1: 0.6612
 epoch: 68, train_loss: 0.2157, test_loss: 1.2697, test_f1: 0.6609
 epoch: 69, train_loss: 0.2084, test_loss: 1.3452, test_f1: 0.6669
 epoch: 70, train_loss: 0.1884, test_loss: 1.3785, test_f1: 0.6687
 epoch: 71, train_loss: 0.2154, test_loss: 1.3162, test_f1: 0.6472
 epoch: 72, train_loss: 0.2242, test_loss: 1.3161, test_f1: 0.6662
 epoch: 73, train_loss: 0.1894, test_loss: 1.3767, test_f1: 0.6716
 epoch: 74, train_loss: 0.2054, test_loss: 1.3283, test_f1: 0.7126
 epoch: 75, train_loss: 0.2145, test_loss: 1.4134, test_f1: 0.6568
 epoch: 76, train_loss: 0.2087, test_loss: 1.3985, test_f1: 0.6813
 epoch: 77, train_loss: 0.1910, test_loss: 1.5805, test_f1: 0.6388
 epoch: 78, train_loss: 0.1890, test_loss: 1.5830, test_f1: 0.6662
 epoch: 79, train_loss: 0.1747, test_loss: 1.3963, test_f1: 0.6741
 epoch: 80, train_loss: 0.1702, test_loss: 1.5140, test_f1: 0.6432
 epoch: 81, train_loss: 0.1701, test_loss: 1.5482, test_f1: 0.6598
 epoch: 82, train_loss: 0.1750, test_loss: 1.5814, test_f1: 0.6603
 epoch: 83, train_loss: 0.1757, test_loss: 1.5149, test_f1: 0.6485
 epoch: 84, train_loss: 0.1821, test_loss: 1.5006, test_f1: 0.6896
 epoch: 85, train_loss: 0.1683, test_loss: 1.3820, test_f1: 0.6549
 epoch: 86, train_loss: 0.1765, test_loss: 1.5017, test_f1: 0.6767
 epoch: 87, train_loss: 0.1786, test_loss: 1.5216, test_f1: 0.6789
 epoch: 88, train_loss: 0.1783, test_loss: 1.4782, test_f1: 0.6785
 epoch: 89, train_loss: 0.1499, test_loss: 1.6318, test_f1: 0.6796
 epoch: 90, train_loss: 0.1645, test_loss: 1.7243, test_f1: 0.6884
 epoch: 91, train_loss: 0.1500, test_loss: 1.8539, test_f1: 0.6786
 epoch: 92, train_loss: 0.1763, test_loss: 1.5309, test_f1: 0.6712
 epoch: 93, train_loss: 0.1562, test_loss: 1.7416, test_f1: 0.6610
 epoch: 94, train_loss: 0.1470, test_loss: 1.6023, test_f1: 0.6747
 epoch: 95, train_loss: 0.1525, test_loss: 1.4676, test_f1: 0.6819
 epoch: 96, train_loss: 0.1424, test_loss: 1.4188, test_f1: 0.6722
 epoch: 97, train_loss: 0.1580, test_loss: 1.6092, test_f1: 0.6489
 epoch: 98, train_loss: 0.1394, test_loss: 1.5791, test_f1: 0.6627
 epoch: 99, train_loss: 0.1486, test_loss: 1.6149, test_f1: 0.6696
##################ITERATION #2 ****************************************
 epoch: 0, train_loss: 1.1256, test_loss: 0.9799, test_f1: 0.4631
 epoch: 1, train_loss: 0.9484, test_loss: 1.0067, test_f1: 0.4818
 epoch: 2, train_loss: 0.9082, test_loss: 0.8961, test_f1: 0.5110
 epoch: 3, train_loss: 0.8811, test_loss: 0.9011, test_f1: 0.5101
 epoch: 4, train_loss: 0.8504, test_loss: 0.9345, test_f1: 0.5342
 epoch: 5, train_loss: 0.8453, test_loss: 1.1492, test_f1: 0.5037
 epoch: 6, train_loss: 0.8210, test_loss: 0.8326, test_f1: 0.5951
 epoch: 7, train_loss: 0.8029, test_loss: 0.9240, test_f1: 0.4861
 epoch: 8, train_loss: 0.7812, test_loss: 0.8724, test_f1: 0.5490
 epoch: 9, train_loss: 0.7650, test_loss: 0.8457, test_f1: 0.6390
 epoch: 10, train_loss: 0.7529, test_loss: 0.8360, test_f1: 0.5999
 epoch: 11, train_loss: 0.7351, test_loss: 0.8203, test_f1: 0.6530
 epoch: 12, train_loss: 0.7085, test_loss: 0.8452, test_f1: 0.6099
 epoch: 13, train_loss: 0.7247, test_loss: 0.9771, test_f1: 0.5695
 epoch: 14, train_loss: 0.6835, test_loss: 0.8464, test_f1: 0.6453
 epoch: 15, train_loss: 0.6867, test_loss: 0.8802, test_f1: 0.6101
 epoch: 16, train_loss: 0.6777, test_loss: 0.8428, test_f1: 0.6255
 epoch: 17, train_loss: 0.6590, test_loss: 0.8857, test_f1: 0.6113
 epoch: 18, train_loss: 0.6471, test_loss: 0.8369, test_f1: 0.6229
 epoch: 19, train_loss: 0.6386, test_loss: 0.9115, test_f1: 0.6140
 epoch: 20, train_loss: 0.6115, test_loss: 0.8110, test_f1: 0.6627
 epoch: 21, train_loss: 0.6005, test_loss: 0.9236, test_f1: 0.6282
 epoch: 22, train_loss: 0.5825, test_loss: 1.2280, test_f1: 0.5329
 epoch: 23, train_loss: 0.5821, test_loss: 0.8461, test_f1: 0.6541
 epoch: 24, train_loss: 0.5552, test_loss: 0.8045, test_f1: 0.6770
 epoch: 25, train_loss: 0.5812, test_loss: 0.9283, test_f1: 0.6448
 epoch: 26, train_loss: 0.5486, test_loss: 0.7966, test_f1: 0.6643
 epoch: 27, train_loss: 0.5261, test_loss: 0.8496, test_f1: 0.6385
 epoch: 28, train_loss: 0.5357, test_loss: 0.8575, test_f1: 0.6712
 epoch: 29, train_loss: 0.5197, test_loss: 0.7609, test_f1: 0.6645
 epoch: 30, train_loss: 0.5088, test_loss: 0.9045, test_f1: 0.6731
 epoch: 31, train_loss: 0.5010, test_loss: 0.9207, test_f1: 0.6877
 epoch: 32, train_loss: 0.4730, test_loss: 0.8966, test_f1: 0.6130
 epoch: 33, train_loss: 0.4800, test_loss: 0.8522, test_f1: 0.6635
 epoch: 34, train_loss: 0.4714, test_loss: 1.0354, test_f1: 0.6202
 epoch: 35, train_loss: 0.4558, test_loss: 0.9519, test_f1: 0.6600
 epoch: 36, train_loss: 0.4371, test_loss: 0.9333, test_f1: 0.6734
 epoch: 37, train_loss: 0.4253, test_loss: 1.0536, test_f1: 0.6849
 epoch: 38, train_loss: 0.4077, test_loss: 0.9287, test_f1: 0.6829
 epoch: 39, train_loss: 0.4133, test_loss: 1.0864, test_f1: 0.6662
 epoch: 40, train_loss: 0.4131, test_loss: 1.0858, test_f1: 0.6663
 epoch: 41, train_loss: 0.3938, test_loss: 1.1419, test_f1: 0.6683
 epoch: 42, train_loss: 0.4124, test_loss: 1.0480, test_f1: 0.6745
 epoch: 43, train_loss: 0.4198, test_loss: 1.0368, test_f1: 0.6744
 epoch: 44, train_loss: 0.3934, test_loss: 1.2324, test_f1: 0.6684
 epoch: 45, train_loss: 0.3728, test_loss: 0.9339, test_f1: 0.6864
 epoch: 46, train_loss: 0.3584, test_loss: 1.0810, test_f1: 0.6793
 epoch: 47, train_loss: 0.3776, test_loss: 1.1420, test_f1: 0.6723
 epoch: 48, train_loss: 0.3587, test_loss: 1.0088, test_f1: 0.6735
 epoch: 49, train_loss: 0.3441, test_loss: 1.0782, test_f1: 0.6438
 epoch: 50, train_loss: 0.3469, test_loss: 1.0039, test_f1: 0.6907
 epoch: 51, train_loss: 0.2935, test_loss: 1.1081, test_f1: 0.6805
 epoch: 52, train_loss: 0.2754, test_loss: 1.1561, test_f1: 0.6742
 epoch: 53, train_loss: 0.2964, test_loss: 1.2216, test_f1: 0.7011
 epoch: 54, train_loss: 0.2425, test_loss: 1.2141, test_f1: 0.6795
 epoch: 55, train_loss: 0.2751, test_loss: 1.1577, test_f1: 0.6741
 epoch: 56, train_loss: 0.2449, test_loss: 1.2972, test_f1: 0.6731
 epoch: 57, train_loss: 0.2368, test_loss: 1.2934, test_f1: 0.6516
 epoch: 58, train_loss: 0.2574, test_loss: 1.2402, test_f1: 0.6732
 epoch: 59, train_loss: 0.2365, test_loss: 1.2591, test_f1: 0.6857
 epoch: 60, train_loss: 0.2437, test_loss: 1.3296, test_f1: 0.6882
 epoch: 61, train_loss: 0.2344, test_loss: 1.4230, test_f1: 0.6845
 epoch: 62, train_loss: 0.2534, test_loss: 1.2985, test_f1: 0.6734
 epoch: 63, train_loss: 0.2322, test_loss: 1.2533, test_f1: 0.6908
 epoch: 64, train_loss: 0.2169, test_loss: 1.3527, test_f1: 0.6650
 epoch: 65, train_loss: 0.2193, test_loss: 1.4284, test_f1: 0.6462
 epoch: 66, train_loss: 0.2446, test_loss: 1.4483, test_f1: 0.6528
 epoch: 67, train_loss: 0.2059, test_loss: 1.5213, test_f1: 0.6576
 epoch: 68, train_loss: 0.2252, test_loss: 1.4193, test_f1: 0.6653
 epoch: 69, train_loss: 0.2146, test_loss: 1.3462, test_f1: 0.6636
 epoch: 70, train_loss: 0.2136, test_loss: 1.4778, test_f1: 0.6334
 epoch: 71, train_loss: 0.2086, test_loss: 1.4339, test_f1: 0.6544
 epoch: 72, train_loss: 0.1870, test_loss: 1.4555, test_f1: 0.6778
 epoch: 73, train_loss: 0.1788, test_loss: 1.4830, test_f1: 0.6910
 epoch: 74, train_loss: 0.2152, test_loss: 1.3444, test_f1: 0.6484
 epoch: 75, train_loss: 0.2014, test_loss: 1.3939, test_f1: 0.6666
 epoch: 76, train_loss: 0.1894, test_loss: 1.5190, test_f1: 0.6683
 epoch: 77, train_loss: 0.1947, test_loss: 1.5224, test_f1: 0.6825
 epoch: 78, train_loss: 0.2090, test_loss: 1.4560, test_f1: 0.6560
 epoch: 79, train_loss: 0.1987, test_loss: 1.5474, test_f1: 0.6640
 epoch: 80, train_loss: 0.1879, test_loss: 1.4839, test_f1: 0.6674
 epoch: 81, train_loss: 0.1825, test_loss: 1.5314, test_f1: 0.6609
 epoch: 82, train_loss: 0.1905, test_loss: 1.3731, test_f1: 0.6883
 epoch: 83, train_loss: 0.1968, test_loss: 1.4721, test_f1: 0.6572
 epoch: 84, train_loss: 0.1691, test_loss: 1.5205, test_f1: 0.6720
 epoch: 85, train_loss: 0.1952, test_loss: 1.6202, test_f1: 0.6467
 epoch: 86, train_loss: 0.1652, test_loss: 1.7747, test_f1: 0.6811
 epoch: 87, train_loss: 0.1875, test_loss: 1.5066, test_f1: 0.6782
 epoch: 88, train_loss: 0.1790, test_loss: 1.5440, test_f1: 0.6798
 epoch: 89, train_loss: 0.1690, test_loss: 1.5953, test_f1: 0.6745
 epoch: 90, train_loss: 0.1712, test_loss: 1.5232, test_f1: 0.6819
 epoch: 91, train_loss: 0.1626, test_loss: 1.5934, test_f1: 0.6954
 epoch: 92, train_loss: 0.1894, test_loss: 1.4790, test_f1: 0.6958
 epoch: 93, train_loss: 0.1718, test_loss: 1.5330, test_f1: 0.6943
 epoch: 94, train_loss: 0.1669, test_loss: 1.5082, test_f1: 0.6785
 epoch: 95, train_loss: 0.1659, test_loss: 1.4974, test_f1: 0.6686
 epoch: 96, train_loss: 0.1610, test_loss: 1.5951, test_f1: 0.6843
 epoch: 97, train_loss: 0.1589, test_loss: 1.4366, test_f1: 0.6888
 epoch: 98, train_loss: 0.1596, test_loss: 1.5095, test_f1: 0.6798
 epoch: 99, train_loss: 0.1795, test_loss: 1.6213, test_f1: 0.6600
##################ITERATION #3 ****************************************
 epoch: 0, train_loss: 1.1730, test_loss: 1.0613, test_f1: 0.4957
 epoch: 1, train_loss: 0.9604, test_loss: 0.9504, test_f1: 0.5283
 epoch: 2, train_loss: 0.9157, test_loss: 1.0293, test_f1: 0.5203
 epoch: 3, train_loss: 0.8777, test_loss: 0.8462, test_f1: 0.5322
 epoch: 4, train_loss: 0.8542, test_loss: 0.8313, test_f1: 0.5529
 epoch: 5, train_loss: 0.8500, test_loss: 1.1330, test_f1: 0.4597
 epoch: 6, train_loss: 0.8239, test_loss: 0.8775, test_f1: 0.5501
 epoch: 7, train_loss: 0.8011, test_loss: 0.9253, test_f1: 0.5150
 epoch: 8, train_loss: 0.7843, test_loss: 0.7630, test_f1: 0.5880
 epoch: 9, train_loss: 0.7674, test_loss: 0.7929, test_f1: 0.5844
 epoch: 10, train_loss: 0.7405, test_loss: 0.8031, test_f1: 0.5563
 epoch: 11, train_loss: 0.7392, test_loss: 0.8871, test_f1: 0.5680
 epoch: 12, train_loss: 0.7212, test_loss: 0.8322, test_f1: 0.5962
 epoch: 13, train_loss: 0.7086, test_loss: 0.8743, test_f1: 0.5443
 epoch: 14, train_loss: 0.6945, test_loss: 0.7754, test_f1: 0.5789
 epoch: 15, train_loss: 0.6826, test_loss: 0.8626, test_f1: 0.6243
 epoch: 16, train_loss: 0.6821, test_loss: 0.7960, test_f1: 0.6408
 epoch: 17, train_loss: 0.6716, test_loss: 0.8432, test_f1: 0.6288
 epoch: 18, train_loss: 0.6396, test_loss: 0.8891, test_f1: 0.6023
 epoch: 19, train_loss: 0.6430, test_loss: 0.8449, test_f1: 0.5970
 epoch: 20, train_loss: 0.6313, test_loss: 0.8026, test_f1: 0.6501
 epoch: 21, train_loss: 0.6223, test_loss: 0.7827, test_f1: 0.6151
 epoch: 22, train_loss: 0.6160, test_loss: 0.7516, test_f1: 0.6416
 epoch: 23, train_loss: 0.5917, test_loss: 0.8371, test_f1: 0.6041
 epoch: 24, train_loss: 0.5737, test_loss: 0.8109, test_f1: 0.6117
 epoch: 25, train_loss: 0.5898, test_loss: 0.8430, test_f1: 0.6622
 epoch: 26, train_loss: 0.5663, test_loss: 0.7984, test_f1: 0.6480
 epoch: 27, train_loss: 0.5593, test_loss: 0.7327, test_f1: 0.6623
 epoch: 28, train_loss: 0.5477, test_loss: 0.8039, test_f1: 0.6408
 epoch: 29, train_loss: 0.5356, test_loss: 0.8273, test_f1: 0.6628
 epoch: 30, train_loss: 0.5276, test_loss: 0.8471, test_f1: 0.6490
 epoch: 31, train_loss: 0.5170, test_loss: 0.7903, test_f1: 0.6925
 epoch: 32, train_loss: 0.5216, test_loss: 0.8081, test_f1: 0.6504
 epoch: 33, train_loss: 0.5156, test_loss: 0.7812, test_f1: 0.6535
 epoch: 34, train_loss: 0.4928, test_loss: 0.8292, test_f1: 0.6850
 epoch: 35, train_loss: 0.4859, test_loss: 0.8208, test_f1: 0.6773
 epoch: 36, train_loss: 0.4857, test_loss: 0.8901, test_f1: 0.6583
 epoch: 37, train_loss: 0.4639, test_loss: 0.8490, test_f1: 0.6695
 epoch: 38, train_loss: 0.4754, test_loss: 0.8434, test_f1: 0.6776
 epoch: 39, train_loss: 0.4516, test_loss: 0.9002, test_f1: 0.6930
 epoch: 40, train_loss: 0.4556, test_loss: 0.7970, test_f1: 0.6972
 epoch: 41, train_loss: 0.4462, test_loss: 0.8835, test_f1: 0.6981
 epoch: 42, train_loss: 0.4422, test_loss: 0.8669, test_f1: 0.6717
 epoch: 43, train_loss: 0.4278, test_loss: 0.9481, test_f1: 0.6686
 epoch: 44, train_loss: 0.4405, test_loss: 0.9109, test_f1: 0.6759
 epoch: 45, train_loss: 0.4263, test_loss: 0.9623, test_f1: 0.6652
 epoch: 46, train_loss: 0.4148, test_loss: 0.9421, test_f1: 0.6846
 epoch: 47, train_loss: 0.3946, test_loss: 0.9390, test_f1: 0.6651
 epoch: 48, train_loss: 0.4003, test_loss: 0.9511, test_f1: 0.6784
 epoch: 49, train_loss: 0.3925, test_loss: 0.9260, test_f1: 0.6774
 epoch: 50, train_loss: 0.3960, test_loss: 0.8895, test_f1: 0.6887
 epoch: 51, train_loss: 0.3541, test_loss: 0.9256, test_f1: 0.6782
 epoch: 52, train_loss: 0.3348, test_loss: 0.9914, test_f1: 0.6811
 epoch: 53, train_loss: 0.2987, test_loss: 0.9177, test_f1: 0.6829
 epoch: 54, train_loss: 0.3003, test_loss: 0.9813, test_f1: 0.6988
 epoch: 55, train_loss: 0.2993, test_loss: 0.9697, test_f1: 0.6972
 epoch: 56, train_loss: 0.2842, test_loss: 0.9986, test_f1: 0.6789
 epoch: 57, train_loss: 0.2898, test_loss: 0.9986, test_f1: 0.7066
 epoch: 58, train_loss: 0.2762, test_loss: 1.0074, test_f1: 0.7091
 epoch: 59, train_loss: 0.2945, test_loss: 1.0623, test_f1: 0.6805
 epoch: 60, train_loss: 0.2911, test_loss: 1.0426, test_f1: 0.6933
 epoch: 61, train_loss: 0.2728, test_loss: 1.0466, test_f1: 0.6700
 epoch: 62, train_loss: 0.2637, test_loss: 1.0595, test_f1: 0.6918
 epoch: 63, train_loss: 0.2668, test_loss: 1.0390, test_f1: 0.7075
 epoch: 64, train_loss: 0.2532, test_loss: 1.1047, test_f1: 0.6694
 epoch: 65, train_loss: 0.2459, test_loss: 1.0648, test_f1: 0.6953
 epoch: 66, train_loss: 0.2541, test_loss: 1.0380, test_f1: 0.7147
 epoch: 67, train_loss: 0.2626, test_loss: 0.9948, test_f1: 0.6898
 epoch: 68, train_loss: 0.2490, test_loss: 1.1290, test_f1: 0.7084
 epoch: 69, train_loss: 0.2515, test_loss: 1.1147, test_f1: 0.6976
 epoch: 70, train_loss: 0.2328, test_loss: 1.1401, test_f1: 0.7038
 epoch: 71, train_loss: 0.2307, test_loss: 1.1042, test_f1: 0.6863
 epoch: 72, train_loss: 0.2431, test_loss: 0.9914, test_f1: 0.6955
 epoch: 73, train_loss: 0.2168, test_loss: 1.1978, test_f1: 0.6912
 epoch: 74, train_loss: 0.2333, test_loss: 1.2419, test_f1: 0.6732
 epoch: 75, train_loss: 0.2214, test_loss: 1.1781, test_f1: 0.7091
 epoch: 76, train_loss: 0.2333, test_loss: 1.0913, test_f1: 0.6914
 epoch: 77, train_loss: 0.2321, test_loss: 1.1623, test_f1: 0.6896
 epoch: 78, train_loss: 0.2201, test_loss: 1.1366, test_f1: 0.7087
 epoch: 79, train_loss: 0.2269, test_loss: 1.2102, test_f1: 0.6769
 epoch: 80, train_loss: 0.2179, test_loss: 1.1215, test_f1: 0.7063
 epoch: 81, train_loss: 0.2200, test_loss: 1.1421, test_f1: 0.6886
 epoch: 82, train_loss: 0.2217, test_loss: 1.1703, test_f1: 0.6957
 epoch: 83, train_loss: 0.1928, test_loss: 1.1693, test_f1: 0.6899
 epoch: 84, train_loss: 0.1958, test_loss: 1.2364, test_f1: 0.6837
 epoch: 85, train_loss: 0.2016, test_loss: 1.2089, test_f1: 0.6926
 epoch: 86, train_loss: 0.1942, test_loss: 1.2425, test_f1: 0.7050
 epoch: 87, train_loss: 0.2038, test_loss: 1.2743, test_f1: 0.6878
 epoch: 88, train_loss: 0.1855, test_loss: 1.3149, test_f1: 0.7021
 epoch: 89, train_loss: 0.1867, test_loss: 1.2742, test_f1: 0.6987
 epoch: 90, train_loss: 0.1857, test_loss: 1.3485, test_f1: 0.6842
 epoch: 91, train_loss: 0.1906, test_loss: 1.2897, test_f1: 0.7099
 epoch: 92, train_loss: 0.1810, test_loss: 1.3028, test_f1: 0.6863
 epoch: 93, train_loss: 0.1743, test_loss: 1.4018, test_f1: 0.6843
 epoch: 94, train_loss: 0.1820, test_loss: 1.4456, test_f1: 0.6783
 epoch: 95, train_loss: 0.1684, test_loss: 1.4218, test_f1: 0.6997
 epoch: 96, train_loss: 0.1760, test_loss: 1.3903, test_f1: 0.7045
 epoch: 97, train_loss: 0.1899, test_loss: 1.3743, test_f1: 0.6786
 epoch: 98, train_loss: 0.1750, test_loss: 1.6583, test_f1: 0.6567
 epoch: 99, train_loss: 0.1787, test_loss: 1.5143, test_f1: 0.6646
##################ITERATION #4 ****************************************
 epoch: 0, train_loss: 1.1757, test_loss: 1.0082, test_f1: 0.5176
 epoch: 1, train_loss: 0.9594, test_loss: 0.9438, test_f1: 0.5147
 epoch: 2, train_loss: 0.9173, test_loss: 0.9589, test_f1: 0.5251
 epoch: 3, train_loss: 0.8959, test_loss: 0.9107, test_f1: 0.5024
 epoch: 4, train_loss: 0.8585, test_loss: 0.8475, test_f1: 0.5017
 epoch: 5, train_loss: 0.8398, test_loss: 0.8626, test_f1: 0.5186
 epoch: 6, train_loss: 0.8185, test_loss: 0.8653, test_f1: 0.5405
 epoch: 7, train_loss: 0.8134, test_loss: 0.8896, test_f1: 0.4966
 epoch: 8, train_loss: 0.8026, test_loss: 0.7841, test_f1: 0.5816
 epoch: 9, train_loss: 0.7725, test_loss: 0.9780, test_f1: 0.5322
 epoch: 10, train_loss: 0.7709, test_loss: 0.8417, test_f1: 0.5564
 epoch: 11, train_loss: 0.7644, test_loss: 0.9032, test_f1: 0.5860
 epoch: 12, train_loss: 0.7445, test_loss: 0.8511, test_f1: 0.5813
 epoch: 13, train_loss: 0.7360, test_loss: 0.8364, test_f1: 0.5596
 epoch: 14, train_loss: 0.7094, test_loss: 0.8987, test_f1: 0.5960
 epoch: 15, train_loss: 0.6949, test_loss: 0.8217, test_f1: 0.6407
 epoch: 16, train_loss: 0.6751, test_loss: 0.7585, test_f1: 0.6387
 epoch: 17, train_loss: 0.6600, test_loss: 0.7801, test_f1: 0.5774
 epoch: 18, train_loss: 0.6710, test_loss: 0.8686, test_f1: 0.6090
 epoch: 19, train_loss: 0.6607, test_loss: 0.8203, test_f1: 0.5951
 epoch: 20, train_loss: 0.6485, test_loss: 0.7591, test_f1: 0.6458
 epoch: 21, train_loss: 0.6275, test_loss: 0.8550, test_f1: 0.5978
 epoch: 22, train_loss: 0.6194, test_loss: 0.8124, test_f1: 0.6675
 epoch: 23, train_loss: 0.6186, test_loss: 0.7384, test_f1: 0.6276
 epoch: 24, train_loss: 0.5828, test_loss: 0.7938, test_f1: 0.6515
 epoch: 25, train_loss: 0.5914, test_loss: 0.9048, test_f1: 0.6357
 epoch: 26, train_loss: 0.5898, test_loss: 0.7066, test_f1: 0.6870
 epoch: 27, train_loss: 0.5880, test_loss: 0.8976, test_f1: 0.6511
 epoch: 28, train_loss: 0.5569, test_loss: 1.0534, test_f1: 0.6348
 epoch: 29, train_loss: 0.5422, test_loss: 0.9514, test_f1: 0.6168
 epoch: 30, train_loss: 0.5565, test_loss: 0.8995, test_f1: 0.6372
 epoch: 31, train_loss: 0.5397, test_loss: 0.8446, test_f1: 0.6362
 epoch: 32, train_loss: 0.5278, test_loss: 0.9475, test_f1: 0.6237
 epoch: 33, train_loss: 0.5357, test_loss: 0.9499, test_f1: 0.6570
 epoch: 34, train_loss: 0.5213, test_loss: 0.9949, test_f1: 0.6277
 epoch: 35, train_loss: 0.5039, test_loss: 0.9123, test_f1: 0.6441
 epoch: 36, train_loss: 0.4703, test_loss: 0.8678, test_f1: 0.6552
 epoch: 37, train_loss: 0.4907, test_loss: 0.8005, test_f1: 0.6540
 epoch: 38, train_loss: 0.4822, test_loss: 0.9115, test_f1: 0.6478
 epoch: 39, train_loss: 0.4566, test_loss: 0.8157, test_f1: 0.6762
 epoch: 40, train_loss: 0.4529, test_loss: 0.8996, test_f1: 0.6370
 epoch: 41, train_loss: 0.4518, test_loss: 0.9262, test_f1: 0.6485
 epoch: 42, train_loss: 0.4322, test_loss: 1.0514, test_f1: 0.6424
 epoch: 43, train_loss: 0.4530, test_loss: 0.9227, test_f1: 0.6595
 epoch: 44, train_loss: 0.4265, test_loss: 0.9198, test_f1: 0.6476
 epoch: 45, train_loss: 0.4359, test_loss: 0.8123, test_f1: 0.6665
 epoch: 46, train_loss: 0.4323, test_loss: 0.9050, test_f1: 0.6512
 epoch: 47, train_loss: 0.4189, test_loss: 0.9629, test_f1: 0.6584
 epoch: 48, train_loss: 0.4216, test_loss: 0.9522, test_f1: 0.6859
 epoch: 49, train_loss: 0.3932, test_loss: 1.0168, test_f1: 0.6667
 epoch: 50, train_loss: 0.4162, test_loss: 0.9885, test_f1: 0.6587
 epoch: 51, train_loss: 0.3447, test_loss: 0.9665, test_f1: 0.6574
 epoch: 52, train_loss: 0.3350, test_loss: 1.0460, test_f1: 0.6731
 epoch: 53, train_loss: 0.3255, test_loss: 1.0692, test_f1: 0.6661
 epoch: 54, train_loss: 0.2999, test_loss: 1.0056, test_f1: 0.6773
 epoch: 55, train_loss: 0.2977, test_loss: 0.9825, test_f1: 0.6812
 epoch: 56, train_loss: 0.2750, test_loss: 1.1142, test_f1: 0.6899
 epoch: 57, train_loss: 0.2954, test_loss: 1.1248, test_f1: 0.6540
 epoch: 58, train_loss: 0.2848, test_loss: 1.0881, test_f1: 0.6994
 epoch: 59, train_loss: 0.2828, test_loss: 1.1773, test_f1: 0.6691
 epoch: 60, train_loss: 0.2881, test_loss: 1.1109, test_f1: 0.6926
 epoch: 61, train_loss: 0.2752, test_loss: 1.0968, test_f1: 0.6842
 epoch: 62, train_loss: 0.2918, test_loss: 1.1832, test_f1: 0.6880
 epoch: 63, train_loss: 0.2824, test_loss: 1.1759, test_f1: 0.6687
 epoch: 64, train_loss: 0.2735, test_loss: 1.2310, test_f1: 0.6575
 epoch: 65, train_loss: 0.2659, test_loss: 1.1698, test_f1: 0.6591
 epoch: 66, train_loss: 0.2752, test_loss: 1.1124, test_f1: 0.6853
 epoch: 67, train_loss: 0.2511, test_loss: 1.2360, test_f1: 0.6554
 epoch: 68, train_loss: 0.2750, test_loss: 1.1313, test_f1: 0.6781
 epoch: 69, train_loss: 0.2468, test_loss: 1.2214, test_f1: 0.6631
 epoch: 70, train_loss: 0.2468, test_loss: 1.2056, test_f1: 0.6826
 epoch: 71, train_loss: 0.2486, test_loss: 1.2618, test_f1: 0.6637
 epoch: 72, train_loss: 0.2404, test_loss: 1.2378, test_f1: 0.6728
 epoch: 73, train_loss: 0.2296, test_loss: 1.3696, test_f1: 0.6301
 epoch: 74, train_loss: 0.2124, test_loss: 1.2625, test_f1: 0.6490
 epoch: 75, train_loss: 0.2428, test_loss: 1.2683, test_f1: 0.6669
 epoch: 76, train_loss: 0.2321, test_loss: 1.2269, test_f1: 0.6673
 epoch: 77, train_loss: 0.2342, test_loss: 1.2050, test_f1: 0.6394
 epoch: 78, train_loss: 0.2089, test_loss: 1.2053, test_f1: 0.6515
 epoch: 79, train_loss: 0.2202, test_loss: 1.3306, test_f1: 0.6405
 epoch: 80, train_loss: 0.2280, test_loss: 1.2361, test_f1: 0.6775
 epoch: 81, train_loss: 0.2273, test_loss: 1.1420, test_f1: 0.6653
 epoch: 82, train_loss: 0.2167, test_loss: 1.2915, test_f1: 0.6663
 epoch: 83, train_loss: 0.2254, test_loss: 1.3133, test_f1: 0.6718
 epoch: 84, train_loss: 0.1999, test_loss: 1.3394, test_f1: 0.6730
 epoch: 85, train_loss: 0.1995, test_loss: 1.3518, test_f1: 0.6801
 epoch: 86, train_loss: 0.2164, test_loss: 1.4315, test_f1: 0.6663
 epoch: 87, train_loss: 0.1948, test_loss: 1.4000, test_f1: 0.6702
 epoch: 88, train_loss: 0.2037, test_loss: 1.3555, test_f1: 0.6812
 epoch: 89, train_loss: 0.1942, test_loss: 1.4300, test_f1: 0.6853
 epoch: 90, train_loss: 0.2034, test_loss: 1.5450, test_f1: 0.6513
 epoch: 91, train_loss: 0.2205, test_loss: 1.3350, test_f1: 0.6567
 epoch: 92, train_loss: 0.1819, test_loss: 1.4765, test_f1: 0.6380
 epoch: 93, train_loss: 0.2017, test_loss: 1.3336, test_f1: 0.6818
 epoch: 94, train_loss: 0.1891, test_loss: 1.5211, test_f1: 0.6495
 epoch: 95, train_loss: 0.1965, test_loss: 1.5367, test_f1: 0.6313
 epoch: 96, train_loss: 0.1844, test_loss: 1.5280, test_f1: 0.6795
 epoch: 97, train_loss: 0.1765, test_loss: 1.4451, test_f1: 0.6536
 epoch: 98, train_loss: 0.2042, test_loss: 1.4962, test_f1: 0.6625
 epoch: 99, train_loss: 0.1784, test_loss: 1.4144, test_f1: 0.6751
##################ITERATION #5 ****************************************
 epoch: 0, train_loss: 1.2165, test_loss: 1.0500, test_f1: 0.4873
 epoch: 1, train_loss: 0.9629, test_loss: 0.9903, test_f1: 0.4894
 epoch: 2, train_loss: 0.9171, test_loss: 0.9151, test_f1: 0.5369
 epoch: 3, train_loss: 0.8950, test_loss: 0.9058, test_f1: 0.5153
 epoch: 4, train_loss: 0.8662, test_loss: 0.9114, test_f1: 0.5736
 epoch: 5, train_loss: 0.8409, test_loss: 0.8865, test_f1: 0.5616
 epoch: 6, train_loss: 0.8250, test_loss: 0.8059, test_f1: 0.6009
 epoch: 7, train_loss: 0.7894, test_loss: 0.8379, test_f1: 0.6085
 epoch: 8, train_loss: 0.7584, test_loss: 0.8131, test_f1: 0.6159
 epoch: 9, train_loss: 0.7615, test_loss: 0.7451, test_f1: 0.6158
 epoch: 10, train_loss: 0.7311, test_loss: 0.9078, test_f1: 0.5735
 epoch: 11, train_loss: 0.7465, test_loss: 0.8014, test_f1: 0.6459
 epoch: 12, train_loss: 0.7153, test_loss: 0.8201, test_f1: 0.6178
 epoch: 13, train_loss: 0.7034, test_loss: 0.7087, test_f1: 0.6646
 epoch: 14, train_loss: 0.6867, test_loss: 0.8488, test_f1: 0.6550
 epoch: 15, train_loss: 0.6776, test_loss: 0.8220, test_f1: 0.6453
 epoch: 16, train_loss: 0.6664, test_loss: 0.7857, test_f1: 0.6365
 epoch: 17, train_loss: 0.6480, test_loss: 0.8562, test_f1: 0.6462
 epoch: 18, train_loss: 0.6597, test_loss: 0.7154, test_f1: 0.6393
 epoch: 19, train_loss: 0.6291, test_loss: 0.7972, test_f1: 0.6422
 epoch: 20, train_loss: 0.6262, test_loss: 0.7903, test_f1: 0.6136
 epoch: 21, train_loss: 0.5922, test_loss: 0.7381, test_f1: 0.6584
 epoch: 22, train_loss: 0.6035, test_loss: 0.8011, test_f1: 0.6276
 epoch: 23, train_loss: 0.5927, test_loss: 0.8153, test_f1: 0.6431
 epoch: 24, train_loss: 0.5692, test_loss: 0.8697, test_f1: 0.6332
 epoch: 25, train_loss: 0.5459, test_loss: 0.8213, test_f1: 0.6673
 epoch: 26, train_loss: 0.5341, test_loss: 0.8659, test_f1: 0.6209
 epoch: 27, train_loss: 0.5458, test_loss: 0.7834, test_f1: 0.6687
 epoch: 28, train_loss: 0.5496, test_loss: 0.7717, test_f1: 0.6514
 epoch: 29, train_loss: 0.5506, test_loss: 0.7975, test_f1: 0.6543
 epoch: 30, train_loss: 0.4994, test_loss: 0.8284, test_f1: 0.6543
 epoch: 31, train_loss: 0.5109, test_loss: 0.8641, test_f1: 0.6702
 epoch: 32, train_loss: 0.5101, test_loss: 0.7691, test_f1: 0.6981
 epoch: 33, train_loss: 0.5032, test_loss: 0.8040, test_f1: 0.6898
 epoch: 34, train_loss: 0.4924, test_loss: 0.7502, test_f1: 0.6799
 epoch: 35, train_loss: 0.4581, test_loss: 0.8193, test_f1: 0.6663
 epoch: 36, train_loss: 0.4532, test_loss: 0.8881, test_f1: 0.6437
 epoch: 37, train_loss: 0.4801, test_loss: 0.8023, test_f1: 0.6933
 epoch: 38, train_loss: 0.4714, test_loss: 0.8806, test_f1: 0.6493
 epoch: 39, train_loss: 0.4318, test_loss: 0.7778, test_f1: 0.6651
 epoch: 40, train_loss: 0.4327, test_loss: 0.8867, test_f1: 0.6458
 epoch: 41, train_loss: 0.4381, test_loss: 0.8817, test_f1: 0.6557
 epoch: 42, train_loss: 0.4380, test_loss: 0.9176, test_f1: 0.6891
 epoch: 43, train_loss: 0.4412, test_loss: 0.8832, test_f1: 0.6661
 epoch: 44, train_loss: 0.4045, test_loss: 0.8652, test_f1: 0.6789
 epoch: 45, train_loss: 0.4081, test_loss: 0.8604, test_f1: 0.6833
 epoch: 46, train_loss: 0.3961, test_loss: 0.9178, test_f1: 0.6618
 epoch: 47, train_loss: 0.3967, test_loss: 0.8625, test_f1: 0.6869
 epoch: 48, train_loss: 0.3626, test_loss: 1.0179, test_f1: 0.6851
 epoch: 49, train_loss: 0.3666, test_loss: 1.0239, test_f1: 0.6600
 epoch: 50, train_loss: 0.3734, test_loss: 1.1212, test_f1: 0.6610
 epoch: 51, train_loss: 0.3226, test_loss: 0.9928, test_f1: 0.6975
 epoch: 52, train_loss: 0.3098, test_loss: 0.9835, test_f1: 0.6676
 epoch: 53, train_loss: 0.2853, test_loss: 1.1172, test_f1: 0.6634
 epoch: 54, train_loss: 0.2927, test_loss: 1.0639, test_f1: 0.6618
 epoch: 55, train_loss: 0.2820, test_loss: 1.1403, test_f1: 0.6545
 epoch: 56, train_loss: 0.2739, test_loss: 1.0025, test_f1: 0.6712
 epoch: 57, train_loss: 0.2781, test_loss: 1.0717, test_f1: 0.6669
 epoch: 58, train_loss: 0.2645, test_loss: 1.1117, test_f1: 0.6763
 epoch: 59, train_loss: 0.2618, test_loss: 1.1475, test_f1: 0.6661
 epoch: 60, train_loss: 0.2505, test_loss: 1.0792, test_f1: 0.6869
 epoch: 61, train_loss: 0.2707, test_loss: 1.0409, test_f1: 0.6848
 epoch: 62, train_loss: 0.2537, test_loss: 1.1405, test_f1: 0.6759
 epoch: 63, train_loss: 0.2520, test_loss: 1.2267, test_f1: 0.6524
 epoch: 64, train_loss: 0.2510, test_loss: 1.1087, test_f1: 0.6539
 epoch: 65, train_loss: 0.2540, test_loss: 1.1127, test_f1: 0.6763
 epoch: 66, train_loss: 0.2348, test_loss: 1.1417, test_f1: 0.6726
 epoch: 67, train_loss: 0.2495, test_loss: 1.0710, test_f1: 0.6641
 epoch: 68, train_loss: 0.2502, test_loss: 1.0855, test_f1: 0.6906
 epoch: 69, train_loss: 0.2090, test_loss: 1.1628, test_f1: 0.6748
 epoch: 70, train_loss: 0.2243, test_loss: 1.2467, test_f1: 0.6635
 epoch: 71, train_loss: 0.2463, test_loss: 1.0750, test_f1: 0.6626
 epoch: 72, train_loss: 0.2292, test_loss: 1.1311, test_f1: 0.6862
 epoch: 73, train_loss: 0.2191, test_loss: 1.0915, test_f1: 0.6686
 epoch: 74, train_loss: 0.2148, test_loss: 1.1295, test_f1: 0.6553
 epoch: 75, train_loss: 0.1973, test_loss: 1.3110, test_f1: 0.6640
 epoch: 76, train_loss: 0.2038, test_loss: 1.1867, test_f1: 0.6921
 epoch: 77, train_loss: 0.2040, test_loss: 1.1805, test_f1: 0.6887
 epoch: 78, train_loss: 0.2086, test_loss: 1.2018, test_f1: 0.6627
 epoch: 79, train_loss: 0.2135, test_loss: 1.2126, test_f1: 0.6802
 epoch: 80, train_loss: 0.1995, test_loss: 1.2544, test_f1: 0.6666
 epoch: 81, train_loss: 0.2182, test_loss: 1.2138, test_f1: 0.6873
 epoch: 82, train_loss: 0.1839, test_loss: 1.2090, test_f1: 0.6724
 epoch: 83, train_loss: 0.2089, test_loss: 1.2737, test_f1: 0.6518
 epoch: 84, train_loss: 0.2130, test_loss: 1.1570, test_f1: 0.6852
 epoch: 85, train_loss: 0.1965, test_loss: 1.1534, test_f1: 0.6946
 epoch: 86, train_loss: 0.2012, test_loss: 1.2679, test_f1: 0.6841
 epoch: 87, train_loss: 0.1798, test_loss: 1.2775, test_f1: 0.6752
 epoch: 88, train_loss: 0.1891, test_loss: 1.1406, test_f1: 0.6773
 epoch: 89, train_loss: 0.1805, test_loss: 1.2803, test_f1: 0.6734
 epoch: 90, train_loss: 0.1708, test_loss: 1.3910, test_f1: 0.6661
 epoch: 91, train_loss: 0.1838, test_loss: 1.2477, test_f1: 0.6608
 epoch: 92, train_loss: 0.1693, test_loss: 1.2757, test_f1: 0.6905
 epoch: 93, train_loss: 0.1742, test_loss: 1.2827, test_f1: 0.6656
 epoch: 94, train_loss: 0.2046, test_loss: 1.3425, test_f1: 0.6465
 epoch: 95, train_loss: 0.1694, test_loss: 1.3867, test_f1: 0.6638
 epoch: 96, train_loss: 0.1753, test_loss: 1.3087, test_f1: 0.6600
 epoch: 97, train_loss: 0.1674, test_loss: 1.4274, test_f1: 0.6587
 epoch: 98, train_loss: 0.1678, test_loss: 1.3261, test_f1: 0.6810
 epoch: 99, train_loss: 0.1667, test_loss: 1.3417, test_f1: 0.6678
##################ITERATION #6 ****************************************
 epoch: 0, train_loss: 1.1864, test_loss: 1.0083, test_f1: 0.4890
 epoch: 1, train_loss: 0.9713, test_loss: 0.9729, test_f1: 0.4486
 epoch: 2, train_loss: 0.9139, test_loss: 0.9442, test_f1: 0.5254
 epoch: 3, train_loss: 0.8713, test_loss: 0.8757, test_f1: 0.5345
 epoch: 4, train_loss: 0.8554, test_loss: 0.8924, test_f1: 0.5040
 epoch: 5, train_loss: 0.8447, test_loss: 0.8888, test_f1: 0.5732
 epoch: 6, train_loss: 0.8094, test_loss: 0.7953, test_f1: 0.6025
 epoch: 7, train_loss: 0.7959, test_loss: 0.8172, test_f1: 0.5470
 epoch: 8, train_loss: 0.7669, test_loss: 0.8490, test_f1: 0.5538
 epoch: 9, train_loss: 0.7432, test_loss: 0.7786, test_f1: 0.6397
 epoch: 10, train_loss: 0.7258, test_loss: 0.7815, test_f1: 0.6280
 epoch: 11, train_loss: 0.7123, test_loss: 0.9602, test_f1: 0.5783
 epoch: 12, train_loss: 0.7152, test_loss: 0.8229, test_f1: 0.6231
 epoch: 13, train_loss: 0.7152, test_loss: 0.8470, test_f1: 0.6177
 epoch: 14, train_loss: 0.6854, test_loss: 0.8028, test_f1: 0.6199
 epoch: 15, train_loss: 0.6760, test_loss: 0.9111, test_f1: 0.6189
 epoch: 16, train_loss: 0.6451, test_loss: 0.8398, test_f1: 0.6495
 epoch: 17, train_loss: 0.6467, test_loss: 0.8252, test_f1: 0.6187
 epoch: 18, train_loss: 0.6442, test_loss: 0.8466, test_f1: 0.6341
 epoch: 19, train_loss: 0.6374, test_loss: 0.8163, test_f1: 0.6145
 epoch: 20, train_loss: 0.6004, test_loss: 0.8360, test_f1: 0.6442
 epoch: 21, train_loss: 0.6001, test_loss: 0.8272, test_f1: 0.6638
 epoch: 22, train_loss: 0.5937, test_loss: 0.8451, test_f1: 0.6410
 epoch: 23, train_loss: 0.5850, test_loss: 0.7869, test_f1: 0.6336
 epoch: 24, train_loss: 0.5665, test_loss: 0.8558, test_f1: 0.6136
 epoch: 25, train_loss: 0.5690, test_loss: 0.9100, test_f1: 0.6138
 epoch: 26, train_loss: 0.5449, test_loss: 0.9013, test_f1: 0.6625
 epoch: 27, train_loss: 0.5380, test_loss: 0.9332, test_f1: 0.6196
 epoch: 28, train_loss: 0.4930, test_loss: 0.8738, test_f1: 0.6770
 epoch: 29, train_loss: 0.5254, test_loss: 0.8564, test_f1: 0.6505
 epoch: 30, train_loss: 0.5217, test_loss: 0.8584, test_f1: 0.6774
 epoch: 31, train_loss: 0.5012, test_loss: 0.8578, test_f1: 0.6795
 epoch: 32, train_loss: 0.4931, test_loss: 0.9210, test_f1: 0.6617
 epoch: 33, train_loss: 0.4717, test_loss: 0.8631, test_f1: 0.6847
 epoch: 34, train_loss: 0.4846, test_loss: 0.9132, test_f1: 0.6679
 epoch: 35, train_loss: 0.4758, test_loss: 0.9555, test_f1: 0.6637
 epoch: 36, train_loss: 0.4434, test_loss: 0.9251, test_f1: 0.6413
 epoch: 37, train_loss: 0.4398, test_loss: 0.8983, test_f1: 0.6685
 epoch: 38, train_loss: 0.4447, test_loss: 0.9248, test_f1: 0.6494
 epoch: 39, train_loss: 0.4476, test_loss: 0.9329, test_f1: 0.6556
 epoch: 40, train_loss: 0.4390, test_loss: 0.8391, test_f1: 0.6798
 epoch: 41, train_loss: 0.4550, test_loss: 0.8923, test_f1: 0.6900
 epoch: 42, train_loss: 0.3965, test_loss: 1.0427, test_f1: 0.6692
 epoch: 43, train_loss: 0.4208, test_loss: 0.9478, test_f1: 0.6753
 epoch: 44, train_loss: 0.4096, test_loss: 0.9364, test_f1: 0.6866
 epoch: 45, train_loss: 0.4028, test_loss: 0.9854, test_f1: 0.6428
 epoch: 46, train_loss: 0.3872, test_loss: 1.0001, test_f1: 0.6597
 epoch: 47, train_loss: 0.3859, test_loss: 0.9222, test_f1: 0.6749
 epoch: 48, train_loss: 0.3817, test_loss: 1.0175, test_f1: 0.6694
 epoch: 49, train_loss: 0.3544, test_loss: 0.9947, test_f1: 0.6726
 epoch: 50, train_loss: 0.3817, test_loss: 1.0735, test_f1: 0.6469
 epoch: 51, train_loss: 0.3206, test_loss: 0.9917, test_f1: 0.6907
 epoch: 52, train_loss: 0.3004, test_loss: 1.0312, test_f1: 0.6909
 epoch: 53, train_loss: 0.2951, test_loss: 1.2083, test_f1: 0.6871
 epoch: 54, train_loss: 0.2766, test_loss: 1.0967, test_f1: 0.6733
 epoch: 55, train_loss: 0.2869, test_loss: 1.0461, test_f1: 0.6750
 epoch: 56, train_loss: 0.2738, test_loss: 1.1562, test_f1: 0.6850
 epoch: 57, train_loss: 0.2920, test_loss: 1.1446, test_f1: 0.6650
 epoch: 58, train_loss: 0.2561, test_loss: 1.1508, test_f1: 0.6676
 epoch: 59, train_loss: 0.2769, test_loss: 1.1117, test_f1: 0.6856
 epoch: 60, train_loss: 0.2481, test_loss: 1.1743, test_f1: 0.6614
 epoch: 61, train_loss: 0.2511, test_loss: 1.2499, test_f1: 0.6780
 epoch: 62, train_loss: 0.2604, test_loss: 1.1930, test_f1: 0.6744
 epoch: 63, train_loss: 0.2425, test_loss: 1.2186, test_f1: 0.6660
 epoch: 64, train_loss: 0.2368, test_loss: 1.2048, test_f1: 0.6834
 epoch: 65, train_loss: 0.2259, test_loss: 1.2696, test_f1: 0.6831
 epoch: 66, train_loss: 0.2297, test_loss: 1.3277, test_f1: 0.6734
 epoch: 67, train_loss: 0.2234, test_loss: 1.3044, test_f1: 0.6809
 epoch: 68, train_loss: 0.2292, test_loss: 1.3535, test_f1: 0.6875
 epoch: 69, train_loss: 0.2250, test_loss: 1.3637, test_f1: 0.6612
 epoch: 70, train_loss: 0.2503, test_loss: 1.3352, test_f1: 0.6543
 epoch: 71, train_loss: 0.2548, test_loss: 1.2533, test_f1: 0.6678
 epoch: 72, train_loss: 0.2417, test_loss: 1.3336, test_f1: 0.6536
 epoch: 73, train_loss: 0.2125, test_loss: 1.3072, test_f1: 0.6883
 epoch: 74, train_loss: 0.2233, test_loss: 1.3918, test_f1: 0.6706
 epoch: 75, train_loss: 0.2078, test_loss: 1.5000, test_f1: 0.6402
 epoch: 76, train_loss: 0.2237, test_loss: 1.3058, test_f1: 0.6742
 epoch: 77, train_loss: 0.1990, test_loss: 1.4155, test_f1: 0.6471
 epoch: 78, train_loss: 0.1950, test_loss: 1.4998, test_f1: 0.6422
 epoch: 79, train_loss: 0.2129, test_loss: 1.4201, test_f1: 0.6771
 epoch: 80, train_loss: 0.1969, test_loss: 1.3770, test_f1: 0.6544
 epoch: 81, train_loss: 0.1978, test_loss: 1.4467, test_f1: 0.6459
 epoch: 82, train_loss: 0.2044, test_loss: 1.4942, test_f1: 0.6550
 epoch: 83, train_loss: 0.2020, test_loss: 1.3882, test_f1: 0.6758
 epoch: 84, train_loss: 0.2095, test_loss: 1.4073, test_f1: 0.6806
 epoch: 85, train_loss: 0.1814, test_loss: 1.5061, test_f1: 0.6449
 epoch: 86, train_loss: 0.1777, test_loss: 1.4533, test_f1: 0.6688
 epoch: 87, train_loss: 0.1982, test_loss: 1.4004, test_f1: 0.6735
 epoch: 88, train_loss: 0.1745, test_loss: 1.5002, test_f1: 0.6748
 epoch: 89, train_loss: 0.1856, test_loss: 1.4188, test_f1: 0.6560
 epoch: 90, train_loss: 0.1650, test_loss: 1.4826, test_f1: 0.6590
 epoch: 91, train_loss: 0.1930, test_loss: 1.4291, test_f1: 0.6582
 epoch: 92, train_loss: 0.1866, test_loss: 1.3928, test_f1: 0.6558
 epoch: 93, train_loss: 0.1596, test_loss: 1.4522, test_f1: 0.6704
 epoch: 94, train_loss: 0.1555, test_loss: 1.5010, test_f1: 0.6578
 epoch: 95, train_loss: 0.1594, test_loss: 1.7016, test_f1: 0.6490
 epoch: 96, train_loss: 0.1809, test_loss: 1.5775, test_f1: 0.6413
 epoch: 97, train_loss: 0.1702, test_loss: 1.5865, test_f1: 0.6547
 epoch: 98, train_loss: 0.1652, test_loss: 1.5573, test_f1: 0.6659
 epoch: 99, train_loss: 0.1507, test_loss: 1.5584, test_f1: 0.6726
##################ITERATION #7 ****************************************
 epoch: 0, train_loss: 1.1831, test_loss: 0.9689, test_f1: 0.4386
 epoch: 1, train_loss: 0.9652, test_loss: 0.9604, test_f1: 0.5040
 epoch: 2, train_loss: 0.9371, test_loss: 1.0245, test_f1: 0.4511
 epoch: 3, train_loss: 0.9029, test_loss: 0.9222, test_f1: 0.5197
 epoch: 4, train_loss: 0.8775, test_loss: 0.9318, test_f1: 0.5224
 epoch: 5, train_loss: 0.8441, test_loss: 0.8970, test_f1: 0.5567
 epoch: 6, train_loss: 0.8263, test_loss: 0.8133, test_f1: 0.5675
 epoch: 7, train_loss: 0.8038, test_loss: 0.9151, test_f1: 0.5851
 epoch: 8, train_loss: 0.7890, test_loss: 0.8878, test_f1: 0.5347
 epoch: 9, train_loss: 0.7790, test_loss: 0.8661, test_f1: 0.5488
 epoch: 10, train_loss: 0.7578, test_loss: 1.0005, test_f1: 0.5236
 epoch: 11, train_loss: 0.7470, test_loss: 0.7637, test_f1: 0.6376
 epoch: 12, train_loss: 0.7247, test_loss: 0.8509, test_f1: 0.5982
 epoch: 13, train_loss: 0.7141, test_loss: 0.8189, test_f1: 0.5898
 epoch: 14, train_loss: 0.6903, test_loss: 0.8742, test_f1: 0.6209
 epoch: 15, train_loss: 0.6827, test_loss: 0.8981, test_f1: 0.6028
 epoch: 16, train_loss: 0.6829, test_loss: 0.8171, test_f1: 0.6264
 epoch: 17, train_loss: 0.6676, test_loss: 0.9300, test_f1: 0.6071
 epoch: 18, train_loss: 0.6597, test_loss: 0.8286, test_f1: 0.6070
 epoch: 19, train_loss: 0.6337, test_loss: 0.8279, test_f1: 0.6526
 epoch: 20, train_loss: 0.6375, test_loss: 0.8857, test_f1: 0.6190
 epoch: 21, train_loss: 0.6231, test_loss: 0.7891, test_f1: 0.6583
 epoch: 22, train_loss: 0.6097, test_loss: 0.9069, test_f1: 0.6527
 epoch: 23, train_loss: 0.5936, test_loss: 0.8073, test_f1: 0.6061
 epoch: 24, train_loss: 0.5732, test_loss: 0.7876, test_f1: 0.6536
 epoch: 25, train_loss: 0.5769, test_loss: 0.7530, test_f1: 0.6339
 epoch: 26, train_loss: 0.5629, test_loss: 0.9498, test_f1: 0.6464
 epoch: 27, train_loss: 0.5641, test_loss: 0.7093, test_f1: 0.6779
 epoch: 28, train_loss: 0.5545, test_loss: 0.8354, test_f1: 0.6604
 epoch: 29, train_loss: 0.5350, test_loss: 0.8417, test_f1: 0.6612
 epoch: 30, train_loss: 0.5524, test_loss: 0.7289, test_f1: 0.6712
 epoch: 31, train_loss: 0.5048, test_loss: 0.9605, test_f1: 0.6327
 epoch: 32, train_loss: 0.5271, test_loss: 0.7789, test_f1: 0.6673
 epoch: 33, train_loss: 0.5359, test_loss: 0.8444, test_f1: 0.6465
 epoch: 34, train_loss: 0.4951, test_loss: 0.9206, test_f1: 0.6523
 epoch: 35, train_loss: 0.5152, test_loss: 0.8505, test_f1: 0.6530
 epoch: 36, train_loss: 0.4804, test_loss: 0.8133, test_f1: 0.6878
 epoch: 37, train_loss: 0.5003, test_loss: 0.8212, test_f1: 0.6404
 epoch: 38, train_loss: 0.4677, test_loss: 0.8376, test_f1: 0.6859
 epoch: 39, train_loss: 0.4518, test_loss: 0.7364, test_f1: 0.6830
 epoch: 40, train_loss: 0.4503, test_loss: 0.8027, test_f1: 0.6576
 epoch: 41, train_loss: 0.4346, test_loss: 0.7188, test_f1: 0.6857
 epoch: 42, train_loss: 0.4267, test_loss: 0.7768, test_f1: 0.6981
 epoch: 43, train_loss: 0.4202, test_loss: 0.7592, test_f1: 0.6776
 epoch: 44, train_loss: 0.4403, test_loss: 0.8526, test_f1: 0.6846
 epoch: 45, train_loss: 0.4310, test_loss: 0.9086, test_f1: 0.6608
 epoch: 46, train_loss: 0.4137, test_loss: 0.7389, test_f1: 0.7085
 epoch: 47, train_loss: 0.4056, test_loss: 0.7142, test_f1: 0.6744
 epoch: 48, train_loss: 0.4124, test_loss: 0.8467, test_f1: 0.6613
 epoch: 49, train_loss: 0.3951, test_loss: 0.8889, test_f1: 0.6698
 epoch: 50, train_loss: 0.3882, test_loss: 0.9174, test_f1: 0.6778
 epoch: 51, train_loss: 0.3383, test_loss: 0.8663, test_f1: 0.6986
 epoch: 52, train_loss: 0.3110, test_loss: 0.8922, test_f1: 0.6937
 epoch: 53, train_loss: 0.3091, test_loss: 0.8140, test_f1: 0.7182
 epoch: 54, train_loss: 0.2863, test_loss: 0.9027, test_f1: 0.6985
 epoch: 55, train_loss: 0.2806, test_loss: 1.0037, test_f1: 0.6815
 epoch: 56, train_loss: 0.2873, test_loss: 0.9127, test_f1: 0.6894
 epoch: 57, train_loss: 0.2816, test_loss: 0.9318, test_f1: 0.6844
 epoch: 58, train_loss: 0.2772, test_loss: 0.9031, test_f1: 0.6819
 epoch: 59, train_loss: 0.3026, test_loss: 0.9092, test_f1: 0.6777
 epoch: 60, train_loss: 0.2687, test_loss: 0.8336, test_f1: 0.7152
 epoch: 61, train_loss: 0.2772, test_loss: 0.9131, test_f1: 0.6736
 epoch: 62, train_loss: 0.2665, test_loss: 0.9394, test_f1: 0.6932
 epoch: 63, train_loss: 0.2602, test_loss: 0.9334, test_f1: 0.6838
 epoch: 64, train_loss: 0.2534, test_loss: 0.9805, test_f1: 0.6745
 epoch: 65, train_loss: 0.2361, test_loss: 0.8655, test_f1: 0.6892
 epoch: 66, train_loss: 0.2679, test_loss: 0.8911, test_f1: 0.6925
 epoch: 67, train_loss: 0.2457, test_loss: 0.9686, test_f1: 0.6987
 epoch: 68, train_loss: 0.2487, test_loss: 1.0081, test_f1: 0.6975
 epoch: 69, train_loss: 0.2466, test_loss: 1.0598, test_f1: 0.6764
 epoch: 70, train_loss: 0.2343, test_loss: 1.1297, test_f1: 0.6860
 epoch: 71, train_loss: 0.2407, test_loss: 1.0082, test_f1: 0.6999
 epoch: 72, train_loss: 0.2377, test_loss: 1.0378, test_f1: 0.6863
 epoch: 73, train_loss: 0.2360, test_loss: 0.9605, test_f1: 0.7114
 epoch: 74, train_loss: 0.2201, test_loss: 1.1453, test_f1: 0.6760
 epoch: 75, train_loss: 0.2112, test_loss: 1.1740, test_f1: 0.6832
 epoch: 76, train_loss: 0.2390, test_loss: 1.0475, test_f1: 0.6787
 epoch: 77, train_loss: 0.2272, test_loss: 1.1221, test_f1: 0.6887
 epoch: 78, train_loss: 0.2345, test_loss: 1.1117, test_f1: 0.6735
 epoch: 79, train_loss: 0.2387, test_loss: 1.1582, test_f1: 0.6772
 epoch: 80, train_loss: 0.2169, test_loss: 1.1306, test_f1: 0.6801
 epoch: 81, train_loss: 0.2087, test_loss: 0.9990, test_f1: 0.6771
 epoch: 82, train_loss: 0.2128, test_loss: 1.1312, test_f1: 0.6761
 epoch: 83, train_loss: 0.2113, test_loss: 1.1859, test_f1: 0.6844
 epoch: 84, train_loss: 0.2196, test_loss: 1.0181, test_f1: 0.6933
 epoch: 85, train_loss: 0.2115, test_loss: 1.0486, test_f1: 0.7000
 epoch: 86, train_loss: 0.1955, test_loss: 1.1315, test_f1: 0.6705
 epoch: 87, train_loss: 0.1967, test_loss: 1.1925, test_f1: 0.6724
 epoch: 88, train_loss: 0.1852, test_loss: 1.1666, test_f1: 0.6970
 epoch: 89, train_loss: 0.1924, test_loss: 1.2118, test_f1: 0.6691
 epoch: 90, train_loss: 0.2545, test_loss: 0.9820, test_f1: 0.6893
 epoch: 91, train_loss: 0.2077, test_loss: 1.1016, test_f1: 0.6864
 epoch: 92, train_loss: 0.1878, test_loss: 1.0652, test_f1: 0.6906
 epoch: 93, train_loss: 0.1846, test_loss: 1.1873, test_f1: 0.6886
 epoch: 94, train_loss: 0.2134, test_loss: 1.1114, test_f1: 0.6856
 epoch: 95, train_loss: 0.1993, test_loss: 1.0995, test_f1: 0.6769
 epoch: 96, train_loss: 0.1667, test_loss: 1.2506, test_f1: 0.6871
 epoch: 97, train_loss: 0.1800, test_loss: 1.0733, test_f1: 0.6881
 epoch: 98, train_loss: 0.1722, test_loss: 1.0439, test_f1: 0.7193
 epoch: 99, train_loss: 0.1758, test_loss: 1.1604, test_f1: 0.7062
##################ITERATION #8 ****************************************
 epoch: 0, train_loss: 1.1671, test_loss: 0.9649, test_f1: 0.5029
 epoch: 1, train_loss: 0.9521, test_loss: 0.9226, test_f1: 0.5113
 epoch: 2, train_loss: 0.8923, test_loss: 0.8564, test_f1: 0.5383
 epoch: 3, train_loss: 0.8588, test_loss: 0.8177, test_f1: 0.5362
 epoch: 4, train_loss: 0.8453, test_loss: 0.7910, test_f1: 0.6030
 epoch: 5, train_loss: 0.7939, test_loss: 0.9402, test_f1: 0.5182
 epoch: 6, train_loss: 0.7987, test_loss: 0.9196, test_f1: 0.5626
 epoch: 7, train_loss: 0.7777, test_loss: 0.9010, test_f1: 0.5873
 epoch: 8, train_loss: 0.7777, test_loss: 0.8404, test_f1: 0.6204
 epoch: 9, train_loss: 0.7728, test_loss: 0.8799, test_f1: 0.5738
 epoch: 10, train_loss: 0.7490, test_loss: 0.8527, test_f1: 0.6115
 epoch: 11, train_loss: 0.7160, test_loss: 0.8109, test_f1: 0.5897
 epoch: 12, train_loss: 0.7156, test_loss: 0.8187, test_f1: 0.5949
 epoch: 13, train_loss: 0.6825, test_loss: 0.8579, test_f1: 0.5876
 epoch: 14, train_loss: 0.6755, test_loss: 0.7766, test_f1: 0.6298
 epoch: 15, train_loss: 0.6616, test_loss: 0.8302, test_f1: 0.6020
 epoch: 16, train_loss: 0.6565, test_loss: 0.9252, test_f1: 0.6011
 epoch: 17, train_loss: 0.6414, test_loss: 0.9210, test_f1: 0.5808
 epoch: 18, train_loss: 0.6379, test_loss: 0.8469, test_f1: 0.6452
 epoch: 19, train_loss: 0.6167, test_loss: 0.8916, test_f1: 0.6229
 epoch: 20, train_loss: 0.6141, test_loss: 0.8618, test_f1: 0.6351
 epoch: 21, train_loss: 0.6064, test_loss: 0.8717, test_f1: 0.6749
 epoch: 22, train_loss: 0.6060, test_loss: 0.8350, test_f1: 0.6245
 epoch: 23, train_loss: 0.5805, test_loss: 0.8433, test_f1: 0.6642
 epoch: 24, train_loss: 0.5894, test_loss: 0.9401, test_f1: 0.6150
 epoch: 25, train_loss: 0.5816, test_loss: 0.7730, test_f1: 0.6461
 epoch: 26, train_loss: 0.5620, test_loss: 0.8285, test_f1: 0.6871
 epoch: 27, train_loss: 0.5570, test_loss: 0.7830, test_f1: 0.7016
 epoch: 28, train_loss: 0.5309, test_loss: 0.7689, test_f1: 0.6742
 epoch: 29, train_loss: 0.5344, test_loss: 0.9128, test_f1: 0.6469
 epoch: 30, train_loss: 0.5285, test_loss: 0.9154, test_f1: 0.6696
 epoch: 31, train_loss: 0.5025, test_loss: 0.8117, test_f1: 0.6808
 epoch: 32, train_loss: 0.4875, test_loss: 0.9419, test_f1: 0.6571
 epoch: 33, train_loss: 0.4945, test_loss: 0.8380, test_f1: 0.6902
 epoch: 34, train_loss: 0.4984, test_loss: 0.8396, test_f1: 0.6655
 epoch: 35, train_loss: 0.4713, test_loss: 0.8848, test_f1: 0.6896
 epoch: 36, train_loss: 0.4842, test_loss: 0.9086, test_f1: 0.6349
 epoch: 37, train_loss: 0.5084, test_loss: 0.8325, test_f1: 0.6629
 epoch: 38, train_loss: 0.4592, test_loss: 0.9679, test_f1: 0.6637
 epoch: 39, train_loss: 0.4379, test_loss: 0.7743, test_f1: 0.6889
 epoch: 40, train_loss: 0.4589, test_loss: 0.7479, test_f1: 0.7067
 epoch: 41, train_loss: 0.4420, test_loss: 0.8306, test_f1: 0.6476
 epoch: 42, train_loss: 0.4435, test_loss: 0.8536, test_f1: 0.6720
 epoch: 43, train_loss: 0.4393, test_loss: 0.8320, test_f1: 0.6737
 epoch: 44, train_loss: 0.4331, test_loss: 0.8729, test_f1: 0.6577
 epoch: 45, train_loss: 0.4003, test_loss: 0.9820, test_f1: 0.6734
 epoch: 46, train_loss: 0.4115, test_loss: 0.9425, test_f1: 0.6852
 epoch: 47, train_loss: 0.4203, test_loss: 0.9714, test_f1: 0.6947
 epoch: 48, train_loss: 0.4006, test_loss: 1.0374, test_f1: 0.6579
 epoch: 49, train_loss: 0.3809, test_loss: 1.1012, test_f1: 0.6295
 epoch: 50, train_loss: 0.3962, test_loss: 0.9961, test_f1: 0.6400
 epoch: 51, train_loss: 0.3318, test_loss: 0.9235, test_f1: 0.6881
 epoch: 52, train_loss: 0.3369, test_loss: 0.9518, test_f1: 0.6889
 epoch: 53, train_loss: 0.3020, test_loss: 1.0000, test_f1: 0.6981
 epoch: 54, train_loss: 0.3078, test_loss: 1.0570, test_f1: 0.6830
 epoch: 55, train_loss: 0.2895, test_loss: 1.0363, test_f1: 0.6658
 epoch: 56, train_loss: 0.2792, test_loss: 1.0841, test_f1: 0.6905
 epoch: 57, train_loss: 0.2780, test_loss: 1.0992, test_f1: 0.6673
 epoch: 58, train_loss: 0.2819, test_loss: 1.1351, test_f1: 0.6722
 epoch: 59, train_loss: 0.2754, test_loss: 1.0531, test_f1: 0.6805
 epoch: 60, train_loss: 0.2639, test_loss: 1.0916, test_f1: 0.6865
 epoch: 61, train_loss: 0.2794, test_loss: 1.0400, test_f1: 0.6792
 epoch: 62, train_loss: 0.2577, test_loss: 1.2001, test_f1: 0.6517
 epoch: 63, train_loss: 0.2678, test_loss: 1.0543, test_f1: 0.6613
 epoch: 64, train_loss: 0.2546, test_loss: 1.0593, test_f1: 0.7091
 epoch: 65, train_loss: 0.2626, test_loss: 1.1673, test_f1: 0.6780
 epoch: 66, train_loss: 0.2289, test_loss: 1.1642, test_f1: 0.6851
 epoch: 67, train_loss: 0.2455, test_loss: 1.2538, test_f1: 0.6814
 epoch: 68, train_loss: 0.2462, test_loss: 1.0861, test_f1: 0.6829
 epoch: 69, train_loss: 0.2294, test_loss: 1.1156, test_f1: 0.6611
 epoch: 70, train_loss: 0.2412, test_loss: 1.2165, test_f1: 0.6586
 epoch: 71, train_loss: 0.2280, test_loss: 1.1620, test_f1: 0.6794
 epoch: 72, train_loss: 0.2340, test_loss: 1.2389, test_f1: 0.6648
 epoch: 73, train_loss: 0.2420, test_loss: 1.1619, test_f1: 0.6614
 epoch: 74, train_loss: 0.2209, test_loss: 1.1083, test_f1: 0.7026
 epoch: 75, train_loss: 0.2168, test_loss: 1.0696, test_f1: 0.7326
 epoch: 76, train_loss: 0.2119, test_loss: 1.1867, test_f1: 0.6757
 epoch: 77, train_loss: 0.2383, test_loss: 1.1086, test_f1: 0.6693
 epoch: 78, train_loss: 0.2082, test_loss: 1.2417, test_f1: 0.6750
 epoch: 79, train_loss: 0.2041, test_loss: 1.2536, test_f1: 0.6744
 epoch: 80, train_loss: 0.2106, test_loss: 1.1544, test_f1: 0.6722
 epoch: 81, train_loss: 0.2020, test_loss: 1.1530, test_f1: 0.6743
 epoch: 82, train_loss: 0.2010, test_loss: 1.2519, test_f1: 0.6800
 epoch: 83, train_loss: 0.1876, test_loss: 1.1346, test_f1: 0.6980
 epoch: 84, train_loss: 0.2104, test_loss: 1.2866, test_f1: 0.7043
 epoch: 85, train_loss: 0.2222, test_loss: 1.1394, test_f1: 0.7106
 epoch: 86, train_loss: 0.1938, test_loss: 1.2391, test_f1: 0.6700
 epoch: 87, train_loss: 0.2028, test_loss: 1.2312, test_f1: 0.6703
 epoch: 88, train_loss: 0.1935, test_loss: 1.2158, test_f1: 0.6519
 epoch: 89, train_loss: 0.2037, test_loss: 1.2714, test_f1: 0.6998
 epoch: 90, train_loss: 0.1904, test_loss: 1.2884, test_f1: 0.6736
 epoch: 91, train_loss: 0.1827, test_loss: 1.4331, test_f1: 0.6777
 epoch: 92, train_loss: 0.2185, test_loss: 1.3004, test_f1: 0.6729
 epoch: 93, train_loss: 0.1833, test_loss: 1.2745, test_f1: 0.6785
 epoch: 94, train_loss: 0.1825, test_loss: 1.3798, test_f1: 0.6629
 epoch: 95, train_loss: 0.1662, test_loss: 1.4047, test_f1: 0.6741
 epoch: 96, train_loss: 0.1695, test_loss: 1.3857, test_f1: 0.6769
 epoch: 97, train_loss: 0.1882, test_loss: 1.2939, test_f1: 0.6815
 epoch: 98, train_loss: 0.1733, test_loss: 1.4624, test_f1: 0.6872
 epoch: 99, train_loss: 0.1870, test_loss: 1.3624, test_f1: 0.6598
##################ITERATION #9 ****************************************
 epoch: 0, train_loss: 1.1717, test_loss: 1.1103, test_f1: 0.3826
 epoch: 1, train_loss: 0.9710, test_loss: 0.8771, test_f1: 0.5250
 epoch: 2, train_loss: 0.9024, test_loss: 0.8462, test_f1: 0.5953
 epoch: 3, train_loss: 0.8786, test_loss: 1.0150, test_f1: 0.5103
 epoch: 4, train_loss: 0.8619, test_loss: 0.8660, test_f1: 0.5344
 epoch: 5, train_loss: 0.8369, test_loss: 0.9167, test_f1: 0.5188
 epoch: 6, train_loss: 0.8014, test_loss: 0.9607, test_f1: 0.5240
 epoch: 7, train_loss: 0.7805, test_loss: 0.9279, test_f1: 0.6142
 epoch: 8, train_loss: 0.7705, test_loss: 0.9247, test_f1: 0.5943
 epoch: 9, train_loss: 0.7533, test_loss: 0.8288, test_f1: 0.5776
 epoch: 10, train_loss: 0.7470, test_loss: 0.9252, test_f1: 0.5609
 epoch: 11, train_loss: 0.7269, test_loss: 0.8536, test_f1: 0.6093
 epoch: 12, train_loss: 0.7028, test_loss: 0.9664, test_f1: 0.5898
 epoch: 13, train_loss: 0.7103, test_loss: 0.9071, test_f1: 0.6234
 epoch: 14, train_loss: 0.6990, test_loss: 0.8564, test_f1: 0.6324
 epoch: 15, train_loss: 0.6798, test_loss: 0.7874, test_f1: 0.6425
 epoch: 16, train_loss: 0.6698, test_loss: 0.8085, test_f1: 0.6465
 epoch: 17, train_loss: 0.6910, test_loss: 0.8574, test_f1: 0.6217
 epoch: 18, train_loss: 0.6544, test_loss: 0.7618, test_f1: 0.6380
 epoch: 19, train_loss: 0.6437, test_loss: 0.9071, test_f1: 0.6678
 epoch: 20, train_loss: 0.6327, test_loss: 0.8887, test_f1: 0.6243
 epoch: 21, train_loss: 0.6264, test_loss: 0.8525, test_f1: 0.6547
 epoch: 22, train_loss: 0.6061, test_loss: 0.7938, test_f1: 0.6761
 epoch: 23, train_loss: 0.5726, test_loss: 0.9086, test_f1: 0.6408
 epoch: 24, train_loss: 0.5781, test_loss: 0.9208, test_f1: 0.6658
 epoch: 25, train_loss: 0.5751, test_loss: 0.8113, test_f1: 0.6604
 epoch: 26, train_loss: 0.5771, test_loss: 0.8315, test_f1: 0.6657
 epoch: 27, train_loss: 0.5435, test_loss: 0.8893, test_f1: 0.6817
 epoch: 28, train_loss: 0.5357, test_loss: 0.7581, test_f1: 0.6574
 epoch: 29, train_loss: 0.5201, test_loss: 1.0381, test_f1: 0.6804
 epoch: 30, train_loss: 0.5350, test_loss: 0.9537, test_f1: 0.6675
 epoch: 31, train_loss: 0.5136, test_loss: 0.9920, test_f1: 0.6775
 epoch: 32, train_loss: 0.5211, test_loss: 0.8551, test_f1: 0.6782
 epoch: 33, train_loss: 0.4939, test_loss: 1.0205, test_f1: 0.6516
 epoch: 34, train_loss: 0.4759, test_loss: 0.9656, test_f1: 0.6778
 epoch: 35, train_loss: 0.4693, test_loss: 1.0084, test_f1: 0.6926
 epoch: 36, train_loss: 0.4912, test_loss: 0.8922, test_f1: 0.6773
 epoch: 37, train_loss: 0.4850, test_loss: 0.9347, test_f1: 0.6355
 epoch: 38, train_loss: 0.4595, test_loss: 0.9643, test_f1: 0.6779
 epoch: 39, train_loss: 0.4483, test_loss: 1.0072, test_f1: 0.6806
 epoch: 40, train_loss: 0.4592, test_loss: 0.9157, test_f1: 0.6776
 epoch: 41, train_loss: 0.4382, test_loss: 0.9518, test_f1: 0.7036
 epoch: 42, train_loss: 0.4454, test_loss: 0.8592, test_f1: 0.6897
 epoch: 43, train_loss: 0.4184, test_loss: 0.9922, test_f1: 0.7018
 epoch: 44, train_loss: 0.4123, test_loss: 1.0142, test_f1: 0.6733
 epoch: 45, train_loss: 0.4026, test_loss: 0.9595, test_f1: 0.6491
 epoch: 46, train_loss: 0.4130, test_loss: 0.9662, test_f1: 0.6948
 epoch: 47, train_loss: 0.3876, test_loss: 1.1557, test_f1: 0.6278
 epoch: 48, train_loss: 0.4036, test_loss: 1.0938, test_f1: 0.6547
 epoch: 49, train_loss: 0.3608, test_loss: 1.0963, test_f1: 0.6680
 epoch: 50, train_loss: 0.4020, test_loss: 0.9598, test_f1: 0.6944
 epoch: 51, train_loss: 0.3398, test_loss: 0.9899, test_f1: 0.6814
 epoch: 52, train_loss: 0.3151, test_loss: 1.0017, test_f1: 0.6998
 epoch: 53, train_loss: 0.2950, test_loss: 1.1114, test_f1: 0.6761
 epoch: 54, train_loss: 0.3029, test_loss: 1.0620, test_f1: 0.6716
 epoch: 55, train_loss: 0.2934, test_loss: 1.0802, test_f1: 0.6835
 epoch: 56, train_loss: 0.2845, test_loss: 1.1898, test_f1: 0.6931
 epoch: 57, train_loss: 0.3055, test_loss: 1.0667, test_f1: 0.6951
 epoch: 58, train_loss: 0.2905, test_loss: 1.0773, test_f1: 0.7025
 epoch: 59, train_loss: 0.2573, test_loss: 1.0917, test_f1: 0.6906
 epoch: 60, train_loss: 0.2688, test_loss: 1.1571, test_f1: 0.6849
 epoch: 61, train_loss: 0.2627, test_loss: 1.2317, test_f1: 0.6610
 epoch: 62, train_loss: 0.2704, test_loss: 1.3416, test_f1: 0.6751
 epoch: 63, train_loss: 0.2645, test_loss: 1.2255, test_f1: 0.6755
 epoch: 64, train_loss: 0.2490, test_loss: 1.1520, test_f1: 0.7075
 epoch: 65, train_loss: 0.2355, test_loss: 1.2329, test_f1: 0.6800
 epoch: 66, train_loss: 0.2298, test_loss: 1.3126, test_f1: 0.6605
 epoch: 67, train_loss: 0.2376, test_loss: 1.2570, test_f1: 0.6909
 epoch: 68, train_loss: 0.2534, test_loss: 1.3781, test_f1: 0.6467
 epoch: 69, train_loss: 0.2462, test_loss: 1.2778, test_f1: 0.6709
 epoch: 70, train_loss: 0.2355, test_loss: 1.3526, test_f1: 0.6693
 epoch: 71, train_loss: 0.2247, test_loss: 1.1867, test_f1: 0.6767
 epoch: 72, train_loss: 0.2352, test_loss: 1.2189, test_f1: 0.6781
 epoch: 73, train_loss: 0.2296, test_loss: 1.3880, test_f1: 0.6914
 epoch: 74, train_loss: 0.2522, test_loss: 1.3774, test_f1: 0.6704
 epoch: 75, train_loss: 0.2396, test_loss: 1.2650, test_f1: 0.6593
 epoch: 76, train_loss: 0.2285, test_loss: 1.2807, test_f1: 0.6853
 epoch: 77, train_loss: 0.2151, test_loss: 1.3248, test_f1: 0.6925
 epoch: 78, train_loss: 0.2067, test_loss: 1.3889, test_f1: 0.6628
 epoch: 79, train_loss: 0.2336, test_loss: 1.2734, test_f1: 0.6896
 epoch: 80, train_loss: 0.2215, test_loss: 1.3921, test_f1: 0.6596
 epoch: 81, train_loss: 0.2044, test_loss: 1.4151, test_f1: 0.6806
 epoch: 82, train_loss: 0.1913, test_loss: 1.4065, test_f1: 0.6711
 epoch: 83, train_loss: 0.2029, test_loss: 1.5378, test_f1: 0.6645
 epoch: 84, train_loss: 0.1899, test_loss: 1.4749, test_f1: 0.6812
 epoch: 85, train_loss: 0.1936, test_loss: 1.4838, test_f1: 0.6867
 epoch: 86, train_loss: 0.2037, test_loss: 1.6050, test_f1: 0.6516
 epoch: 87, train_loss: 0.1878, test_loss: 1.4861, test_f1: 0.6559
 epoch: 88, train_loss: 0.1876, test_loss: 1.4456, test_f1: 0.6579
 epoch: 89, train_loss: 0.2039, test_loss: 1.4670, test_f1: 0.6638
 epoch: 90, train_loss: 0.1940, test_loss: 1.3508, test_f1: 0.6847
 epoch: 91, train_loss: 0.1837, test_loss: 1.5128, test_f1: 0.6702
 epoch: 92, train_loss: 0.1760, test_loss: 1.5064, test_f1: 0.6800
 epoch: 93, train_loss: 0.1970, test_loss: 1.4307, test_f1: 0.6883
 epoch: 94, train_loss: 0.1679, test_loss: 1.5033, test_f1: 0.6782
 epoch: 95, train_loss: 0.1866, test_loss: 1.5346, test_f1: 0.6742
 epoch: 96, train_loss: 0.1781, test_loss: 1.6516, test_f1: 0.6683
 epoch: 97, train_loss: 0.1891, test_loss: 1.4732, test_f1: 0.6970
 epoch: 98, train_loss: 0.1440, test_loss: 1.6580, test_f1: 0.6914
 epoch: 99, train_loss: 0.1856, test_loss: 1.4458, test_f1: 0.6901

Training completed in 1010.94 seconds
Best F1: 0.7326 at epoch 75
Mean F1 across iterations: 0.7086  0.0114
========================FINAL RESULTS================================
FEGIN weighted F1: 0.7326  0.0114
python main.py --data ltspice_examples --representation component_pin --model FEGIN --layers 3 --hiddens 128 --batch_size 32 --lr 0.001 --emb_size 128 --epochs 100 --save_appendix component_pin_L3_H128_BS32_LR0.001_E128 --no_val
-----



STDERR:
  File "main.py", line 370, in <module>
    main()
  File "main.py", line 254, in main
    dataset = dataset_class(
  File "/home/philip/projects/ltspice_examples_code_repo/Circuit-Completion-Using-GNNs/component_classification_with_link_prediction_head/evaluation/FEGIN/kernel/circuit_datasets.py", line 15, in __init__
    self.data, self.slices = torch.load(self.processed_paths[0])
  File "/home/philip/.local/lib/python3.8/site-packages/torch/serialization.py", line 1040, in load
    warnings.warn(
  File "/usr/lib/python3.8/warnings.py", line 109, in _showwarnmsg
    sw(msg.message, msg.category, msg.filename, msg.lineno,
  File "main.py", line 47, in warn_with_traceback
    traceback.print_stack(file=log)
/home/philip/projects/ltspice_examples_code_repo/Circuit-Completion-Using-GNNs/component_classification_with_link_prediction_head/evaluation/FEGIN/kernel/circuit_datasets.py:15: FutureWarning: You are using `torch.load` with `weights_only=False` (the current default value), which uses the default pickle module implicitly. It is possible to construct malicious pickle data which will execute arbitrary code during unpickling (See https://github.com/pytorch/pytorch/blob/main/SECURITY.md#untrusted-models for more details). In a future release, the default value for `weights_only` will be flipped to `True`. This limits the functions that could be executed during unpickling. Arbitrary objects will no longer be allowed to be loaded via this mode unless they are explicitly allowlisted by the user via `torch.serialization.add_safe_globals`. We recommend you start setting `weights_only=True` for any use case where you don't have full control of the loaded file. Please open an issue on GitHub for any issues related to this experimental feature.
  self.data, self.slices = torch.load(self.processed_paths[0])
