STDOUT:
Results will be saved in /home/philip/projects/ltspice_examples_code_repo/Circuit-Completion-Using-GNNs/component_classification_with_link_prediction_head/evaluation/FEGIN/results/model_FEGIN_dataset_ltspice_demos
Command line input: python main.py --data ltspice_demos --representation component_component --model FEGIN --layers 3 --hiddens 16 --batch_size 256 --lr 0.001 --emb_size 128 --epochs 100 --save_appendix component_component_L3_H16_BS256_LR0.001_E128 --no_val
 is saved.
-----
ltspice_demos - FEGIN
Using 3 layers, 16 hidden units, h = 2
Loading component_component representation dataset
ENTERED
Training FEGIN on component_component representation
Train: 1565, Test: 383
##################ITERATION #0 ****************************************
 epoch: 0, train_loss: 1.3337, test_loss: 1.3419, test_f1: 0.1836
 epoch: 1, train_loss: 1.3196, test_loss: 1.3360, test_f1: 0.3195
 epoch: 2, train_loss: 1.3084, test_loss: 1.3301, test_f1: 0.2586
 epoch: 3, train_loss: 1.2987, test_loss: 1.3231, test_f1: 0.2289
 epoch: 4, train_loss: 1.2896, test_loss: 1.3153, test_f1: 0.2289
 epoch: 5, train_loss: 1.2808, test_loss: 1.3083, test_f1: 0.2289
 epoch: 6, train_loss: 1.2703, test_loss: 1.3025, test_f1: 0.2289
 epoch: 7, train_loss: 1.2625, test_loss: 1.2987, test_f1: 0.2285
 epoch: 8, train_loss: 1.2572, test_loss: 1.2955, test_f1: 0.2285
 epoch: 9, train_loss: 1.2454, test_loss: 1.2909, test_f1: 0.2285
 epoch: 10, train_loss: 1.2447, test_loss: 1.2877, test_f1: 0.2289
 epoch: 11, train_loss: 1.2384, test_loss: 1.2871, test_f1: 0.2293
 epoch: 12, train_loss: 1.2283, test_loss: 1.2863, test_f1: 0.2293
 epoch: 13, train_loss: 1.2246, test_loss: 1.2843, test_f1: 0.2686
 epoch: 14, train_loss: 1.2187, test_loss: 1.2855, test_f1: 0.2713
 epoch: 15, train_loss: 1.2150, test_loss: 1.2804, test_f1: 0.2645
 epoch: 16, train_loss: 1.2033, test_loss: 1.2761, test_f1: 0.2678
 epoch: 17, train_loss: 1.2007, test_loss: 1.2796, test_f1: 0.2823
 epoch: 18, train_loss: 1.1998, test_loss: 1.2864, test_f1: 0.2821
 epoch: 19, train_loss: 1.1980, test_loss: 1.2933, test_f1: 0.2651
 epoch: 20, train_loss: 1.1901, test_loss: 1.2893, test_f1: 0.2767
 epoch: 21, train_loss: 1.1828, test_loss: 1.2731, test_f1: 0.2917
 epoch: 22, train_loss: 1.1846, test_loss: 1.2720, test_f1: 0.2905
 epoch: 23, train_loss: 1.1704, test_loss: 1.2813, test_f1: 0.2785
 epoch: 24, train_loss: 1.1727, test_loss: 1.2855, test_f1: 0.2673
 epoch: 25, train_loss: 1.1734, test_loss: 1.2912, test_f1: 0.2755
 epoch: 26, train_loss: 1.1665, test_loss: 1.2895, test_f1: 0.2746
 epoch: 27, train_loss: 1.1648, test_loss: 1.2850, test_f1: 0.2815
 epoch: 28, train_loss: 1.1505, test_loss: 1.2875, test_f1: 0.2839
 epoch: 29, train_loss: 1.1506, test_loss: 1.2947, test_f1: 0.2778
 epoch: 30, train_loss: 1.1400, test_loss: 1.2980, test_f1: 0.2831
 epoch: 31, train_loss: 1.1358, test_loss: 1.3146, test_f1: 0.2913
 epoch: 32, train_loss: 1.1313, test_loss: 1.3073, test_f1: 0.3264
 epoch: 33, train_loss: 1.1338, test_loss: 1.3148, test_f1: 0.3495
 epoch: 34, train_loss: 1.1277, test_loss: 1.3138, test_f1: 0.3695
 epoch: 35, train_loss: 1.1272, test_loss: 1.3246, test_f1: 0.3665
 epoch: 36, train_loss: 1.1203, test_loss: 1.3322, test_f1: 0.3540
 epoch: 37, train_loss: 1.1181, test_loss: 1.3222, test_f1: 0.3573
 epoch: 38, train_loss: 1.1129, test_loss: 1.3070, test_f1: 0.4201
 epoch: 39, train_loss: 1.1013, test_loss: 1.3075, test_f1: 0.4114
 epoch: 40, train_loss: 1.1009, test_loss: 1.2987, test_f1: 0.3954
 epoch: 41, train_loss: 1.0964, test_loss: 1.3100, test_f1: 0.3724
 epoch: 42, train_loss: 1.1000, test_loss: 1.2984, test_f1: 0.4020
 epoch: 43, train_loss: 1.0857, test_loss: 1.3244, test_f1: 0.3939
 epoch: 44, train_loss: 1.0839, test_loss: 1.3161, test_f1: 0.4059
 epoch: 45, train_loss: 1.0731, test_loss: 1.2923, test_f1: 0.4076
 epoch: 46, train_loss: 1.0801, test_loss: 1.3377, test_f1: 0.3310
 epoch: 47, train_loss: 1.0611, test_loss: 1.4189, test_f1: 0.3793
 epoch: 48, train_loss: 1.0793, test_loss: 1.4329, test_f1: 0.3561
 epoch: 49, train_loss: 1.0631, test_loss: 1.4024, test_f1: 0.3638
 epoch: 50, train_loss: 1.0616, test_loss: 1.3769, test_f1: 0.3507
 epoch: 51, train_loss: 1.0511, test_loss: 1.3763, test_f1: 0.3707
 epoch: 52, train_loss: 1.0506, test_loss: 1.4241, test_f1: 0.3682
 epoch: 53, train_loss: 1.0557, test_loss: 1.4015, test_f1: 0.3789
 epoch: 54, train_loss: 1.0541, test_loss: 1.3748, test_f1: 0.3965
 epoch: 55, train_loss: 1.0395, test_loss: 1.3753, test_f1: 0.4000
 epoch: 56, train_loss: 1.0472, test_loss: 1.3841, test_f1: 0.3960
 epoch: 57, train_loss: 1.0403, test_loss: 1.4163, test_f1: 0.3970
 epoch: 58, train_loss: 1.0437, test_loss: 1.4314, test_f1: 0.3957
 epoch: 59, train_loss: 1.0399, test_loss: 1.3896, test_f1: 0.4000
 epoch: 60, train_loss: 1.0400, test_loss: 1.4091, test_f1: 0.3968
 epoch: 61, train_loss: 1.0332, test_loss: 1.3972, test_f1: 0.3931
 epoch: 62, train_loss: 1.0352, test_loss: 1.4268, test_f1: 0.4081
 epoch: 63, train_loss: 1.0337, test_loss: 1.4740, test_f1: 0.4107
 epoch: 64, train_loss: 1.0296, test_loss: 1.4476, test_f1: 0.3977
 epoch: 65, train_loss: 1.0352, test_loss: 1.3824, test_f1: 0.4099
 epoch: 66, train_loss: 1.0272, test_loss: 1.4063, test_f1: 0.4069
 epoch: 67, train_loss: 1.0296, test_loss: 1.4276, test_f1: 0.4139
 epoch: 68, train_loss: 1.0297, test_loss: 1.4187, test_f1: 0.4133
 epoch: 69, train_loss: 1.0217, test_loss: 1.4196, test_f1: 0.4096
 epoch: 70, train_loss: 1.0177, test_loss: 1.4299, test_f1: 0.4015
 epoch: 71, train_loss: 1.0122, test_loss: 1.4183, test_f1: 0.4033
 epoch: 72, train_loss: 1.0207, test_loss: 1.4096, test_f1: 0.4114
 epoch: 73, train_loss: 1.0111, test_loss: 1.3741, test_f1: 0.4085
 epoch: 74, train_loss: 1.0068, test_loss: 1.3860, test_f1: 0.4192
 epoch: 75, train_loss: 1.0085, test_loss: 1.4121, test_f1: 0.4105
 epoch: 76, train_loss: 1.0019, test_loss: 1.3889, test_f1: 0.4131
 epoch: 77, train_loss: 1.0149, test_loss: 1.3848, test_f1: 0.4010
 epoch: 78, train_loss: 1.0181, test_loss: 1.4153, test_f1: 0.4016
 epoch: 79, train_loss: 1.0015, test_loss: 1.4053, test_f1: 0.4007
 epoch: 80, train_loss: 1.0134, test_loss: 1.4465, test_f1: 0.4139
 epoch: 81, train_loss: 1.0059, test_loss: 1.4846, test_f1: 0.4115
 epoch: 82, train_loss: 0.9952, test_loss: 1.4302, test_f1: 0.4170
 epoch: 83, train_loss: 1.0099, test_loss: 1.4090, test_f1: 0.4232
 epoch: 84, train_loss: 1.0035, test_loss: 1.4318, test_f1: 0.4142
 epoch: 85, train_loss: 0.9990, test_loss: 1.4711, test_f1: 0.4159
 epoch: 86, train_loss: 0.9911, test_loss: 1.4751, test_f1: 0.4163
 epoch: 87, train_loss: 0.9998, test_loss: 1.4593, test_f1: 0.4122
 epoch: 88, train_loss: 0.9870, test_loss: 1.4734, test_f1: 0.4245
 epoch: 89, train_loss: 0.9889, test_loss: 1.4657, test_f1: 0.4169
 epoch: 90, train_loss: 0.9945, test_loss: 1.4660, test_f1: 0.4137
 epoch: 91, train_loss: 0.9897, test_loss: 1.4472, test_f1: 0.4124
 epoch: 92, train_loss: 0.9816, test_loss: 1.4160, test_f1: 0.4140
 epoch: 93, train_loss: 0.9916, test_loss: 1.4265, test_f1: 0.4163
 epoch: 94, train_loss: 0.9934, test_loss: 1.4262, test_f1: 0.4132
 epoch: 95, train_loss: 0.9798, test_loss: 1.4245, test_f1: 0.4084
 epoch: 96, train_loss: 0.9894, test_loss: 1.4487, test_f1: 0.4050
 epoch: 97, train_loss: 0.9814, test_loss: 1.4472, test_f1: 0.4013
 epoch: 98, train_loss: 0.9791, test_loss: 1.4395, test_f1: 0.3880
 epoch: 99, train_loss: 0.9845, test_loss: 1.4570, test_f1: 0.4104
##################ITERATION #1 ****************************************
 epoch: 0, train_loss: 1.3130, test_loss: 1.3280, test_f1: 0.2172
 epoch: 1, train_loss: 1.2779, test_loss: 1.3201, test_f1: 0.2281
 epoch: 2, train_loss: 1.2660, test_loss: 1.3113, test_f1: 0.2281
 epoch: 3, train_loss: 1.2505, test_loss: 1.3026, test_f1: 0.2281
 epoch: 4, train_loss: 1.2433, test_loss: 1.2905, test_f1: 0.2281
 epoch: 5, train_loss: 1.2302, test_loss: 1.2809, test_f1: 0.2289
 epoch: 6, train_loss: 1.2197, test_loss: 1.2767, test_f1: 0.2289
 epoch: 7, train_loss: 1.2146, test_loss: 1.2714, test_f1: 0.2293
 epoch: 8, train_loss: 1.2066, test_loss: 1.2665, test_f1: 0.2289
 epoch: 9, train_loss: 1.2041, test_loss: 1.2615, test_f1: 0.2289
 epoch: 10, train_loss: 1.1907, test_loss: 1.2578, test_f1: 0.2285
 epoch: 11, train_loss: 1.1838, test_loss: 1.2498, test_f1: 0.2268
 epoch: 12, train_loss: 1.1745, test_loss: 1.2448, test_f1: 0.3085
 epoch: 13, train_loss: 1.1642, test_loss: 1.2425, test_f1: 0.3703
 epoch: 14, train_loss: 1.1568, test_loss: 1.2400, test_f1: 0.3930
 epoch: 15, train_loss: 1.1499, test_loss: 1.2344, test_f1: 0.4019
 epoch: 16, train_loss: 1.1406, test_loss: 1.2374, test_f1: 0.4214
 epoch: 17, train_loss: 1.1418, test_loss: 1.2344, test_f1: 0.4394
 epoch: 18, train_loss: 1.1234, test_loss: 1.2321, test_f1: 0.4386
 epoch: 19, train_loss: 1.1196, test_loss: 1.2240, test_f1: 0.4426
 epoch: 20, train_loss: 1.1184, test_loss: 1.2283, test_f1: 0.4355
 epoch: 21, train_loss: 1.1165, test_loss: 1.2288, test_f1: 0.4251
 epoch: 22, train_loss: 1.1027, test_loss: 1.2252, test_f1: 0.4274
 epoch: 23, train_loss: 1.0890, test_loss: 1.2216, test_f1: 0.4341
 epoch: 24, train_loss: 1.0930, test_loss: 1.2047, test_f1: 0.4282
 epoch: 25, train_loss: 1.0856, test_loss: 1.2065, test_f1: 0.4620
 epoch: 26, train_loss: 1.0789, test_loss: 1.2038, test_f1: 0.4409
 epoch: 27, train_loss: 1.0800, test_loss: 1.2058, test_f1: 0.4570
 epoch: 28, train_loss: 1.0643, test_loss: 1.2164, test_f1: 0.4422
 epoch: 29, train_loss: 1.0660, test_loss: 1.1856, test_f1: 0.4626
 epoch: 30, train_loss: 1.0670, test_loss: 1.1814, test_f1: 0.4786
 epoch: 31, train_loss: 1.0488, test_loss: 1.2034, test_f1: 0.4594
 epoch: 32, train_loss: 1.0607, test_loss: 1.1862, test_f1: 0.4652
 epoch: 33, train_loss: 1.0438, test_loss: 1.1794, test_f1: 0.4836
 epoch: 34, train_loss: 1.0439, test_loss: 1.1829, test_f1: 0.4732
 epoch: 35, train_loss: 1.0502, test_loss: 1.1915, test_f1: 0.4570
 epoch: 36, train_loss: 1.0473, test_loss: 1.2018, test_f1: 0.4441
 epoch: 37, train_loss: 1.0387, test_loss: 1.1950, test_f1: 0.4440
 epoch: 38, train_loss: 1.0254, test_loss: 1.1907, test_f1: 0.4366
 epoch: 39, train_loss: 1.0258, test_loss: 1.1971, test_f1: 0.4441
 epoch: 40, train_loss: 1.0175, test_loss: 1.1877, test_f1: 0.4666
 epoch: 41, train_loss: 1.0229, test_loss: 1.2053, test_f1: 0.4592
 epoch: 42, train_loss: 1.0107, test_loss: 1.2170, test_f1: 0.4491
 epoch: 43, train_loss: 1.0047, test_loss: 1.2345, test_f1: 0.4514
 epoch: 44, train_loss: 1.0180, test_loss: 1.2382, test_f1: 0.4439
 epoch: 45, train_loss: 1.0007, test_loss: 1.2407, test_f1: 0.4445
 epoch: 46, train_loss: 0.9978, test_loss: 1.2363, test_f1: 0.4461
 epoch: 47, train_loss: 0.9853, test_loss: 1.2450, test_f1: 0.4564
 epoch: 48, train_loss: 1.0026, test_loss: 1.2617, test_f1: 0.4471
 epoch: 49, train_loss: 0.9898, test_loss: 1.2577, test_f1: 0.4617
 epoch: 50, train_loss: 0.9905, test_loss: 1.2547, test_f1: 0.4641
 epoch: 51, train_loss: 0.9742, test_loss: 1.2633, test_f1: 0.4444
 epoch: 52, train_loss: 0.9906, test_loss: 1.2656, test_f1: 0.4370
 epoch: 53, train_loss: 0.9868, test_loss: 1.2713, test_f1: 0.4394
 epoch: 54, train_loss: 0.9897, test_loss: 1.2667, test_f1: 0.4542
 epoch: 55, train_loss: 0.9845, test_loss: 1.2715, test_f1: 0.4446
 epoch: 56, train_loss: 0.9770, test_loss: 1.2735, test_f1: 0.4494
 epoch: 57, train_loss: 0.9788, test_loss: 1.2876, test_f1: 0.4353
 epoch: 58, train_loss: 0.9767, test_loss: 1.2929, test_f1: 0.4228
 epoch: 59, train_loss: 0.9799, test_loss: 1.2860, test_f1: 0.4349
 epoch: 60, train_loss: 0.9719, test_loss: 1.2824, test_f1: 0.4369
 epoch: 61, train_loss: 0.9684, test_loss: 1.2861, test_f1: 0.4466
 epoch: 62, train_loss: 0.9685, test_loss: 1.2947, test_f1: 0.4394
 epoch: 63, train_loss: 0.9654, test_loss: 1.3005, test_f1: 0.4444
 epoch: 64, train_loss: 0.9605, test_loss: 1.3033, test_f1: 0.4370
 epoch: 65, train_loss: 0.9588, test_loss: 1.3040, test_f1: 0.4516
 epoch: 66, train_loss: 0.9611, test_loss: 1.3056, test_f1: 0.4442
 epoch: 67, train_loss: 0.9567, test_loss: 1.3091, test_f1: 0.4370
 epoch: 68, train_loss: 0.9583, test_loss: 1.3224, test_f1: 0.4157
 epoch: 69, train_loss: 0.9730, test_loss: 1.3060, test_f1: 0.4297
 epoch: 70, train_loss: 0.9653, test_loss: 1.3010, test_f1: 0.4589
 epoch: 71, train_loss: 0.9668, test_loss: 1.3011, test_f1: 0.4493
 epoch: 72, train_loss: 0.9632, test_loss: 1.3058, test_f1: 0.4393
 epoch: 73, train_loss: 0.9585, test_loss: 1.3269, test_f1: 0.4276
 epoch: 74, train_loss: 0.9664, test_loss: 1.3283, test_f1: 0.4349
 epoch: 75, train_loss: 0.9633, test_loss: 1.3249, test_f1: 0.4324
 epoch: 76, train_loss: 0.9516, test_loss: 1.3125, test_f1: 0.4420
 epoch: 77, train_loss: 0.9433, test_loss: 1.3137, test_f1: 0.4492
 epoch: 78, train_loss: 0.9621, test_loss: 1.3164, test_f1: 0.4375
 epoch: 79, train_loss: 0.9546, test_loss: 1.3250, test_f1: 0.4447
 epoch: 80, train_loss: 0.9528, test_loss: 1.3358, test_f1: 0.4327
 epoch: 81, train_loss: 0.9381, test_loss: 1.3440, test_f1: 0.4305
 epoch: 82, train_loss: 0.9437, test_loss: 1.3513, test_f1: 0.4332
 epoch: 83, train_loss: 0.9565, test_loss: 1.3652, test_f1: 0.4235
 epoch: 84, train_loss: 0.9572, test_loss: 1.3728, test_f1: 0.4118
 epoch: 85, train_loss: 0.9519, test_loss: 1.3624, test_f1: 0.4170
 epoch: 86, train_loss: 0.9487, test_loss: 1.3535, test_f1: 0.4221
 epoch: 87, train_loss: 0.9456, test_loss: 1.3473, test_f1: 0.4324
 epoch: 88, train_loss: 0.9512, test_loss: 1.3393, test_f1: 0.4464
 epoch: 89, train_loss: 0.9430, test_loss: 1.3494, test_f1: 0.4372
 epoch: 90, train_loss: 0.9354, test_loss: 1.3503, test_f1: 0.4404
 epoch: 91, train_loss: 0.9512, test_loss: 1.3530, test_f1: 0.4402
 epoch: 92, train_loss: 0.9366, test_loss: 1.3524, test_f1: 0.4377
 epoch: 93, train_loss: 0.9427, test_loss: 1.3554, test_f1: 0.4392
 epoch: 94, train_loss: 0.9477, test_loss: 1.3612, test_f1: 0.4397
 epoch: 95, train_loss: 0.9385, test_loss: 1.3598, test_f1: 0.4326
 epoch: 96, train_loss: 0.9270, test_loss: 1.3698, test_f1: 0.4325
 epoch: 97, train_loss: 0.9303, test_loss: 1.3834, test_f1: 0.4304
 epoch: 98, train_loss: 0.9432, test_loss: 1.3850, test_f1: 0.4277
 epoch: 99, train_loss: 0.9257, test_loss: 1.3762, test_f1: 0.4266
##################ITERATION #2 ****************************************
 epoch: 0, train_loss: 1.2845, test_loss: 1.3169, test_f1: 0.2285
 epoch: 1, train_loss: 1.2569, test_loss: 1.3088, test_f1: 0.2194
 epoch: 2, train_loss: 1.2423, test_loss: 1.2999, test_f1: 0.2559
 epoch: 3, train_loss: 1.2305, test_loss: 1.2874, test_f1: 0.2618
 epoch: 4, train_loss: 1.2244, test_loss: 1.2752, test_f1: 0.2676
 epoch: 5, train_loss: 1.2214, test_loss: 1.2644, test_f1: 0.3442
 epoch: 6, train_loss: 1.2060, test_loss: 1.2612, test_f1: 0.3498
 epoch: 7, train_loss: 1.1999, test_loss: 1.2610, test_f1: 0.3711
 epoch: 8, train_loss: 1.1910, test_loss: 1.2514, test_f1: 0.3500
 epoch: 9, train_loss: 1.1863, test_loss: 1.2387, test_f1: 0.3807
 epoch: 10, train_loss: 1.1813, test_loss: 1.2318, test_f1: 0.3814
 epoch: 11, train_loss: 1.1693, test_loss: 1.2224, test_f1: 0.4112
 epoch: 12, train_loss: 1.1632, test_loss: 1.2159, test_f1: 0.4174
 epoch: 13, train_loss: 1.1571, test_loss: 1.2188, test_f1: 0.4226
 epoch: 14, train_loss: 1.1463, test_loss: 1.2176, test_f1: 0.4211
 epoch: 15, train_loss: 1.1385, test_loss: 1.2025, test_f1: 0.4335
 epoch: 16, train_loss: 1.1427, test_loss: 1.2025, test_f1: 0.4447
 epoch: 17, train_loss: 1.1359, test_loss: 1.2107, test_f1: 0.4442
 epoch: 18, train_loss: 1.1307, test_loss: 1.2171, test_f1: 0.4441
 epoch: 19, train_loss: 1.1418, test_loss: 1.2236, test_f1: 0.4352
 epoch: 20, train_loss: 1.1271, test_loss: 1.2209, test_f1: 0.4411
 epoch: 21, train_loss: 1.1148, test_loss: 1.2106, test_f1: 0.4583
 epoch: 22, train_loss: 1.1264, test_loss: 1.2156, test_f1: 0.4517
 epoch: 23, train_loss: 1.1198, test_loss: 1.1888, test_f1: 0.4655
 epoch: 24, train_loss: 1.1205, test_loss: 1.1770, test_f1: 0.4588
 epoch: 25, train_loss: 1.1026, test_loss: 1.1881, test_f1: 0.4585
 epoch: 26, train_loss: 1.1020, test_loss: 1.1832, test_f1: 0.4702
 epoch: 27, train_loss: 1.1077, test_loss: 1.1813, test_f1: 0.4120
 epoch: 28, train_loss: 1.1007, test_loss: 1.1813, test_f1: 0.3613
 epoch: 29, train_loss: 1.0859, test_loss: 1.1709, test_f1: 0.3642
 epoch: 30, train_loss: 1.0987, test_loss: 1.1728, test_f1: 0.4253
 epoch: 31, train_loss: 1.0893, test_loss: 1.1688, test_f1: 0.3914
 epoch: 32, train_loss: 1.0860, test_loss: 1.1888, test_f1: 0.3846
 epoch: 33, train_loss: 1.0776, test_loss: 1.1876, test_f1: 0.3947
 epoch: 34, train_loss: 1.0744, test_loss: 1.1943, test_f1: 0.4551
 epoch: 35, train_loss: 1.0684, test_loss: 1.1880, test_f1: 0.4398
 epoch: 36, train_loss: 1.0713, test_loss: 1.1975, test_f1: 0.4304
 epoch: 37, train_loss: 1.0762, test_loss: 1.1992, test_f1: 0.4166
 epoch: 38, train_loss: 1.0707, test_loss: 1.1917, test_f1: 0.4282
 epoch: 39, train_loss: 1.0551, test_loss: 1.1793, test_f1: 0.4220
 epoch: 40, train_loss: 1.0658, test_loss: 1.1787, test_f1: 0.4186
 epoch: 41, train_loss: 1.0524, test_loss: 1.1783, test_f1: 0.3877
 epoch: 42, train_loss: 1.0468, test_loss: 1.1880, test_f1: 0.4075
 epoch: 43, train_loss: 1.0626, test_loss: 1.1859, test_f1: 0.4388
 epoch: 44, train_loss: 1.0471, test_loss: 1.1748, test_f1: 0.4457
 epoch: 45, train_loss: 1.0688, test_loss: 1.1636, test_f1: 0.3884
 epoch: 46, train_loss: 1.0618, test_loss: 1.1821, test_f1: 0.3511
 epoch: 47, train_loss: 1.0475, test_loss: 1.2010, test_f1: 0.3319
 epoch: 48, train_loss: 1.0504, test_loss: 1.2135, test_f1: 0.3262
 epoch: 49, train_loss: 1.0563, test_loss: 1.2198, test_f1: 0.4315
 epoch: 50, train_loss: 1.0482, test_loss: 1.2115, test_f1: 0.4438
 epoch: 51, train_loss: 1.0421, test_loss: 1.2006, test_f1: 0.4265
 epoch: 52, train_loss: 1.0385, test_loss: 1.1838, test_f1: 0.4150
 epoch: 53, train_loss: 1.0452, test_loss: 1.1988, test_f1: 0.4240
 epoch: 54, train_loss: 1.0400, test_loss: 1.2086, test_f1: 0.4226
 epoch: 55, train_loss: 1.0373, test_loss: 1.2169, test_f1: 0.4226
 epoch: 56, train_loss: 1.0346, test_loss: 1.2614, test_f1: 0.4280
 epoch: 57, train_loss: 1.0294, test_loss: 1.2599, test_f1: 0.4282
 epoch: 58, train_loss: 1.0301, test_loss: 1.2762, test_f1: 0.4236
 epoch: 59, train_loss: 1.0371, test_loss: 1.2827, test_f1: 0.4380
 epoch: 60, train_loss: 1.0304, test_loss: 1.3101, test_f1: 0.4181
 epoch: 61, train_loss: 1.0324, test_loss: 1.2980, test_f1: 0.4312
 epoch: 62, train_loss: 1.0262, test_loss: 1.2685, test_f1: 0.4349
 epoch: 63, train_loss: 1.0320, test_loss: 1.2841, test_f1: 0.4356
 epoch: 64, train_loss: 1.0352, test_loss: 1.2905, test_f1: 0.4618
 epoch: 65, train_loss: 1.0234, test_loss: 1.3388, test_f1: 0.4364
 epoch: 66, train_loss: 1.0402, test_loss: 1.2792, test_f1: 0.4446
 epoch: 67, train_loss: 1.0303, test_loss: 1.3631, test_f1: 0.4383
 epoch: 68, train_loss: 1.0279, test_loss: 1.3763, test_f1: 0.4084
 epoch: 69, train_loss: 1.0284, test_loss: 1.4195, test_f1: 0.4236
 epoch: 70, train_loss: 1.0204, test_loss: 1.3589, test_f1: 0.4423
 epoch: 71, train_loss: 1.0205, test_loss: 1.3636, test_f1: 0.4303
 epoch: 72, train_loss: 1.0198, test_loss: 1.4211, test_f1: 0.4096
 epoch: 73, train_loss: 1.0194, test_loss: 1.3573, test_f1: 0.4162
 epoch: 74, train_loss: 1.0253, test_loss: 1.4191, test_f1: 0.4118
 epoch: 75, train_loss: 1.0220, test_loss: 1.4137, test_f1: 0.4282
 epoch: 76, train_loss: 1.0262, test_loss: 1.3624, test_f1: 0.4528
 epoch: 77, train_loss: 1.0247, test_loss: 1.3637, test_f1: 0.4446
 epoch: 78, train_loss: 1.0198, test_loss: 1.3175, test_f1: 0.4389
 epoch: 79, train_loss: 1.0286, test_loss: 1.3100, test_f1: 0.4403
 epoch: 80, train_loss: 1.0108, test_loss: 1.3844, test_f1: 0.4392
 epoch: 81, train_loss: 1.0177, test_loss: 1.4817, test_f1: 0.4410
 epoch: 82, train_loss: 1.0170, test_loss: 1.5635, test_f1: 0.4350
 epoch: 83, train_loss: 1.0152, test_loss: 1.5027, test_f1: 0.4556
 epoch: 84, train_loss: 1.0105, test_loss: 1.4606, test_f1: 0.4241
 epoch: 85, train_loss: 1.0226, test_loss: 1.4701, test_f1: 0.4125
 epoch: 86, train_loss: 1.0050, test_loss: 1.5389, test_f1: 0.4178
 epoch: 87, train_loss: 1.0152, test_loss: 1.5657, test_f1: 0.4131
 epoch: 88, train_loss: 1.0290, test_loss: 1.6279, test_f1: 0.4360
 epoch: 89, train_loss: 1.0131, test_loss: 1.6355, test_f1: 0.4104
 epoch: 90, train_loss: 1.0044, test_loss: 1.5543, test_f1: 0.3861
 epoch: 91, train_loss: 1.0093, test_loss: 1.6458, test_f1: 0.3799
 epoch: 92, train_loss: 1.0079, test_loss: 1.6619, test_f1: 0.3994
 epoch: 93, train_loss: 1.0224, test_loss: 1.5840, test_f1: 0.4076
 epoch: 94, train_loss: 1.0092, test_loss: 1.6052, test_f1: 0.3878
 epoch: 95, train_loss: 1.0149, test_loss: 1.7645, test_f1: 0.3930
 epoch: 96, train_loss: 1.0099, test_loss: 1.6565, test_f1: 0.4020
 epoch: 97, train_loss: 1.0154, test_loss: 1.5480, test_f1: 0.4342
 epoch: 98, train_loss: 1.0102, test_loss: 1.5654, test_f1: 0.4334
 epoch: 99, train_loss: 1.0080, test_loss: 1.6225, test_f1: 0.4253
##################ITERATION #3 ****************************************
 epoch: 0, train_loss: 1.2632, test_loss: 1.3310, test_f1: 0.2281
 epoch: 1, train_loss: 1.2210, test_loss: 1.3225, test_f1: 0.2281
 epoch: 2, train_loss: 1.1951, test_loss: 1.3060, test_f1: 0.2281
 epoch: 3, train_loss: 1.1991, test_loss: 1.2886, test_f1: 0.2281
 epoch: 4, train_loss: 1.1790, test_loss: 1.2657, test_f1: 0.2281
 epoch: 5, train_loss: 1.1723, test_loss: 1.2564, test_f1: 0.2495
 epoch: 6, train_loss: 1.1659, test_loss: 1.2364, test_f1: 0.3181
 epoch: 7, train_loss: 1.1573, test_loss: 1.2227, test_f1: 0.4111
 epoch: 8, train_loss: 1.1423, test_loss: 1.2162, test_f1: 0.4481
 epoch: 9, train_loss: 1.1457, test_loss: 1.2144, test_f1: 0.4370
 epoch: 10, train_loss: 1.1457, test_loss: 1.2084, test_f1: 0.4301
 epoch: 11, train_loss: 1.1234, test_loss: 1.2123, test_f1: 0.4395
 epoch: 12, train_loss: 1.1290, test_loss: 1.2035, test_f1: 0.4294
 epoch: 13, train_loss: 1.1238, test_loss: 1.1869, test_f1: 0.4165
 epoch: 14, train_loss: 1.1060, test_loss: 1.1803, test_f1: 0.4188
 epoch: 15, train_loss: 1.1143, test_loss: 1.1732, test_f1: 0.4312
 epoch: 16, train_loss: 1.1125, test_loss: 1.1666, test_f1: 0.4505
 epoch: 17, train_loss: 1.1051, test_loss: 1.1653, test_f1: 0.4402
 epoch: 18, train_loss: 1.1033, test_loss: 1.1621, test_f1: 0.4551
 epoch: 19, train_loss: 1.0972, test_loss: 1.1571, test_f1: 0.4596
 epoch: 20, train_loss: 1.0957, test_loss: 1.1474, test_f1: 0.4566
 epoch: 21, train_loss: 1.0965, test_loss: 1.1496, test_f1: 0.4533
 epoch: 22, train_loss: 1.0912, test_loss: 1.1579, test_f1: 0.4433
 epoch: 23, train_loss: 1.0797, test_loss: 1.1553, test_f1: 0.4774
 epoch: 24, train_loss: 1.0812, test_loss: 1.1507, test_f1: 0.4968
 epoch: 25, train_loss: 1.0698, test_loss: 1.1514, test_f1: 0.4698
 epoch: 26, train_loss: 1.0706, test_loss: 1.1523, test_f1: 0.4612
 epoch: 27, train_loss: 1.0604, test_loss: 1.1409, test_f1: 0.4655
 epoch: 28, train_loss: 1.0567, test_loss: 1.1381, test_f1: 0.4647
 epoch: 29, train_loss: 1.0502, test_loss: 1.1398, test_f1: 0.4608
 epoch: 30, train_loss: 1.0398, test_loss: 1.1459, test_f1: 0.4707
 epoch: 31, train_loss: 1.0590, test_loss: 1.1436, test_f1: 0.4703
 epoch: 32, train_loss: 1.0405, test_loss: 1.1406, test_f1: 0.4674
 epoch: 33, train_loss: 1.0398, test_loss: 1.1402, test_f1: 0.4753
 epoch: 34, train_loss: 1.0445, test_loss: 1.1367, test_f1: 0.4824
 epoch: 35, train_loss: 1.0522, test_loss: 1.1423, test_f1: 0.4715
 epoch: 36, train_loss: 1.0445, test_loss: 1.1542, test_f1: 0.4597
 epoch: 37, train_loss: 1.0311, test_loss: 1.1676, test_f1: 0.4533
 epoch: 38, train_loss: 1.0451, test_loss: 1.1531, test_f1: 0.4768
 epoch: 39, train_loss: 1.0242, test_loss: 1.1585, test_f1: 0.4596
 epoch: 40, train_loss: 1.0169, test_loss: 1.1513, test_f1: 0.4630
 epoch: 41, train_loss: 1.0242, test_loss: 1.1509, test_f1: 0.4713
 epoch: 42, train_loss: 1.0182, test_loss: 1.1550, test_f1: 0.4704
 epoch: 43, train_loss: 1.0214, test_loss: 1.1519, test_f1: 0.4721
 epoch: 44, train_loss: 1.0151, test_loss: 1.1466, test_f1: 0.4642
 epoch: 45, train_loss: 1.0129, test_loss: 1.1400, test_f1: 0.4803
 epoch: 46, train_loss: 1.0166, test_loss: 1.1367, test_f1: 0.4815
 epoch: 47, train_loss: 0.9987, test_loss: 1.1397, test_f1: 0.4737
 epoch: 48, train_loss: 1.0070, test_loss: 1.1399, test_f1: 0.4736
 epoch: 49, train_loss: 1.0082, test_loss: 1.1343, test_f1: 0.4642
 epoch: 50, train_loss: 0.9922, test_loss: 1.1324, test_f1: 0.4602
 epoch: 51, train_loss: 0.9950, test_loss: 1.1324, test_f1: 0.4794
 epoch: 52, train_loss: 0.9762, test_loss: 1.1359, test_f1: 0.4823
 epoch: 53, train_loss: 0.9872, test_loss: 1.1374, test_f1: 0.4802
 epoch: 54, train_loss: 0.9958, test_loss: 1.1410, test_f1: 0.4919
 epoch: 55, train_loss: 0.9758, test_loss: 1.1461, test_f1: 0.4892
 epoch: 56, train_loss: 1.0004, test_loss: 1.1501, test_f1: 0.4870
 epoch: 57, train_loss: 0.9807, test_loss: 1.1506, test_f1: 0.5007
 epoch: 58, train_loss: 0.9856, test_loss: 1.1497, test_f1: 0.5020
 epoch: 59, train_loss: 0.9728, test_loss: 1.1502, test_f1: 0.5020
 epoch: 60, train_loss: 0.9879, test_loss: 1.1559, test_f1: 0.4989
 epoch: 61, train_loss: 0.9814, test_loss: 1.1637, test_f1: 0.4779
 epoch: 62, train_loss: 0.9762, test_loss: 1.1646, test_f1: 0.4881
 epoch: 63, train_loss: 0.9816, test_loss: 1.1594, test_f1: 0.4960
 epoch: 64, train_loss: 0.9760, test_loss: 1.1613, test_f1: 0.4923
 epoch: 65, train_loss: 0.9746, test_loss: 1.1647, test_f1: 0.4846
 epoch: 66, train_loss: 0.9784, test_loss: 1.1618, test_f1: 0.4969
 epoch: 67, train_loss: 0.9696, test_loss: 1.1540, test_f1: 0.4792
 epoch: 68, train_loss: 0.9781, test_loss: 1.1551, test_f1: 0.4865
 epoch: 69, train_loss: 0.9758, test_loss: 1.1554, test_f1: 0.4895
 epoch: 70, train_loss: 0.9631, test_loss: 1.1574, test_f1: 0.4941
 epoch: 71, train_loss: 0.9792, test_loss: 1.1632, test_f1: 0.4708
 epoch: 72, train_loss: 0.9719, test_loss: 1.1654, test_f1: 0.4858
 epoch: 73, train_loss: 0.9658, test_loss: 1.1694, test_f1: 0.4863
 epoch: 74, train_loss: 0.9687, test_loss: 1.1712, test_f1: 0.5010
 epoch: 75, train_loss: 0.9657, test_loss: 1.1673, test_f1: 0.4833
 epoch: 76, train_loss: 0.9595, test_loss: 1.1651, test_f1: 0.4858
 epoch: 77, train_loss: 0.9698, test_loss: 1.1597, test_f1: 0.4834
 epoch: 78, train_loss: 0.9570, test_loss: 1.1537, test_f1: 0.4835
 epoch: 79, train_loss: 0.9493, test_loss: 1.1529, test_f1: 0.5078
 epoch: 80, train_loss: 0.9587, test_loss: 1.1576, test_f1: 0.5174
 epoch: 81, train_loss: 0.9520, test_loss: 1.1584, test_f1: 0.5276
 epoch: 82, train_loss: 0.9555, test_loss: 1.1656, test_f1: 0.5253
 epoch: 83, train_loss: 0.9619, test_loss: 1.1723, test_f1: 0.5086
 epoch: 84, train_loss: 0.9515, test_loss: 1.1707, test_f1: 0.5039
 epoch: 85, train_loss: 0.9508, test_loss: 1.1620, test_f1: 0.5008
 epoch: 86, train_loss: 0.9454, test_loss: 1.1517, test_f1: 0.5029
 epoch: 87, train_loss: 0.9546, test_loss: 1.1549, test_f1: 0.4956
 epoch: 88, train_loss: 0.9602, test_loss: 1.1604, test_f1: 0.4953
 epoch: 89, train_loss: 0.9471, test_loss: 1.1462, test_f1: 0.5113
 epoch: 90, train_loss: 0.9512, test_loss: 1.1439, test_f1: 0.5214
 epoch: 91, train_loss: 0.9389, test_loss: 1.1448, test_f1: 0.5167
 epoch: 92, train_loss: 0.9491, test_loss: 1.1488, test_f1: 0.5165
 epoch: 93, train_loss: 0.9447, test_loss: 1.1569, test_f1: 0.5120
 epoch: 94, train_loss: 0.9421, test_loss: 1.1637, test_f1: 0.5040
 epoch: 95, train_loss: 0.9390, test_loss: 1.1725, test_f1: 0.5139
 epoch: 96, train_loss: 0.9459, test_loss: 1.1783, test_f1: 0.5227
 epoch: 97, train_loss: 0.9566, test_loss: 1.1678, test_f1: 0.5259
 epoch: 98, train_loss: 0.9345, test_loss: 1.1584, test_f1: 0.5306
 epoch: 99, train_loss: 0.9387, test_loss: 1.1556, test_f1: 0.5215
##################ITERATION #4 ****************************************
 epoch: 0, train_loss: 1.3490, test_loss: 1.3347, test_f1: 0.2281
 epoch: 1, train_loss: 1.2815, test_loss: 1.3257, test_f1: 0.2281
 epoch: 2, train_loss: 1.2567, test_loss: 1.3135, test_f1: 0.2555
 epoch: 3, train_loss: 1.2506, test_loss: 1.3021, test_f1: 0.2573
 epoch: 4, train_loss: 1.2393, test_loss: 1.2928, test_f1: 0.2624
 epoch: 5, train_loss: 1.2334, test_loss: 1.2776, test_f1: 0.2887
 epoch: 6, train_loss: 1.2167, test_loss: 1.2715, test_f1: 0.2844
 epoch: 7, train_loss: 1.2031, test_loss: 1.2636, test_f1: 0.2892
 epoch: 8, train_loss: 1.2138, test_loss: 1.2677, test_f1: 0.3083
 epoch: 9, train_loss: 1.2032, test_loss: 1.2677, test_f1: 0.3191
 epoch: 10, train_loss: 1.1847, test_loss: 1.2593, test_f1: 0.3328
 epoch: 11, train_loss: 1.1876, test_loss: 1.2427, test_f1: 0.3601
 epoch: 12, train_loss: 1.1756, test_loss: 1.2359, test_f1: 0.3734
 epoch: 13, train_loss: 1.1668, test_loss: 1.2369, test_f1: 0.3714
 epoch: 14, train_loss: 1.1610, test_loss: 1.2390, test_f1: 0.3716
 epoch: 15, train_loss: 1.1641, test_loss: 1.2388, test_f1: 0.3753
 epoch: 16, train_loss: 1.1517, test_loss: 1.2299, test_f1: 0.3799
 epoch: 17, train_loss: 1.1443, test_loss: 1.2260, test_f1: 0.3797
 epoch: 18, train_loss: 1.1467, test_loss: 1.2199, test_f1: 0.3685
 epoch: 19, train_loss: 1.1384, test_loss: 1.2167, test_f1: 0.3992
 epoch: 20, train_loss: 1.1320, test_loss: 1.2103, test_f1: 0.3933
 epoch: 21, train_loss: 1.1277, test_loss: 1.2025, test_f1: 0.4198
 epoch: 22, train_loss: 1.1255, test_loss: 1.1961, test_f1: 0.4176
 epoch: 23, train_loss: 1.1099, test_loss: 1.1914, test_f1: 0.4395
 epoch: 24, train_loss: 1.0986, test_loss: 1.1880, test_f1: 0.4484
 epoch: 25, train_loss: 1.1039, test_loss: 1.1846, test_f1: 0.4304
 epoch: 26, train_loss: 1.1066, test_loss: 1.1819, test_f1: 0.4361
 epoch: 27, train_loss: 1.1079, test_loss: 1.1804, test_f1: 0.4394
 epoch: 28, train_loss: 1.1076, test_loss: 1.1960, test_f1: 0.4328
 epoch: 29, train_loss: 1.1012, test_loss: 1.2196, test_f1: 0.4106
 epoch: 30, train_loss: 1.0895, test_loss: 1.2221, test_f1: 0.3908
 epoch: 31, train_loss: 1.0915, test_loss: 1.2074, test_f1: 0.3981
 epoch: 32, train_loss: 1.0775, test_loss: 1.1984, test_f1: 0.3953
 epoch: 33, train_loss: 1.0760, test_loss: 1.1911, test_f1: 0.3928
 epoch: 34, train_loss: 1.0746, test_loss: 1.1888, test_f1: 0.3937
 epoch: 35, train_loss: 1.0648, test_loss: 1.1974, test_f1: 0.4079
 epoch: 36, train_loss: 1.0594, test_loss: 1.2129, test_f1: 0.3920
 epoch: 37, train_loss: 1.0659, test_loss: 1.2035, test_f1: 0.3955
 epoch: 38, train_loss: 1.0641, test_loss: 1.1969, test_f1: 0.4089
 epoch: 39, train_loss: 1.0579, test_loss: 1.1980, test_f1: 0.4071
 epoch: 40, train_loss: 1.0539, test_loss: 1.2051, test_f1: 0.3555
 epoch: 41, train_loss: 1.0411, test_loss: 1.1982, test_f1: 0.3650
 epoch: 42, train_loss: 1.0492, test_loss: 1.2018, test_f1: 0.3746
 epoch: 43, train_loss: 1.0436, test_loss: 1.2076, test_f1: 0.3778
 epoch: 44, train_loss: 1.0387, test_loss: 1.2081, test_f1: 0.3841
 epoch: 45, train_loss: 1.0380, test_loss: 1.2216, test_f1: 0.3860
 epoch: 46, train_loss: 1.0316, test_loss: 1.2194, test_f1: 0.3812
 epoch: 47, train_loss: 1.0363, test_loss: 1.2172, test_f1: 0.3739
 epoch: 48, train_loss: 1.0273, test_loss: 1.2204, test_f1: 0.3996
 epoch: 49, train_loss: 1.0325, test_loss: 1.2165, test_f1: 0.4411
 epoch: 50, train_loss: 1.0240, test_loss: 1.2160, test_f1: 0.4391
 epoch: 51, train_loss: 1.0128, test_loss: 1.2283, test_f1: 0.4318
 epoch: 52, train_loss: 1.0149, test_loss: 1.2323, test_f1: 0.4266
 epoch: 53, train_loss: 1.0154, test_loss: 1.2300, test_f1: 0.4013
 epoch: 54, train_loss: 1.0197, test_loss: 1.2289, test_f1: 0.3912
 epoch: 55, train_loss: 1.0172, test_loss: 1.2317, test_f1: 0.3926
 epoch: 56, train_loss: 1.0022, test_loss: 1.2359, test_f1: 0.3784
 epoch: 57, train_loss: 1.0199, test_loss: 1.2487, test_f1: 0.3740
 epoch: 58, train_loss: 1.0069, test_loss: 1.2573, test_f1: 0.3810
 epoch: 59, train_loss: 0.9959, test_loss: 1.2497, test_f1: 0.4086
 epoch: 60, train_loss: 1.0069, test_loss: 1.2553, test_f1: 0.4041
 epoch: 61, train_loss: 0.9968, test_loss: 1.2666, test_f1: 0.4033
 epoch: 62, train_loss: 1.0136, test_loss: 1.2721, test_f1: 0.3872
 epoch: 63, train_loss: 1.0030, test_loss: 1.2560, test_f1: 0.3954
 epoch: 64, train_loss: 0.9969, test_loss: 1.2595, test_f1: 0.4080
 epoch: 65, train_loss: 0.9890, test_loss: 1.2868, test_f1: 0.3811
 epoch: 66, train_loss: 1.0036, test_loss: 1.2759, test_f1: 0.3881
 epoch: 67, train_loss: 1.0054, test_loss: 1.2493, test_f1: 0.4009
 epoch: 68, train_loss: 1.0104, test_loss: 1.2669, test_f1: 0.4023
 epoch: 69, train_loss: 0.9969, test_loss: 1.2702, test_f1: 0.4068
 epoch: 70, train_loss: 0.9955, test_loss: 1.2796, test_f1: 0.3996
 epoch: 71, train_loss: 0.9968, test_loss: 1.2858, test_f1: 0.3968
 epoch: 72, train_loss: 0.9827, test_loss: 1.2839, test_f1: 0.3907
 epoch: 73, train_loss: 0.9954, test_loss: 1.2815, test_f1: 0.3957
 epoch: 74, train_loss: 0.9827, test_loss: 1.2912, test_f1: 0.4018
 epoch: 75, train_loss: 0.9914, test_loss: 1.2578, test_f1: 0.4009
 epoch: 76, train_loss: 1.0035, test_loss: 1.2688, test_f1: 0.4123
 epoch: 77, train_loss: 0.9882, test_loss: 1.2879, test_f1: 0.4330
 epoch: 78, train_loss: 0.9949, test_loss: 1.3070, test_f1: 0.4329
 epoch: 79, train_loss: 0.9917, test_loss: 1.3391, test_f1: 0.4152
 epoch: 80, train_loss: 0.9902, test_loss: 1.3246, test_f1: 0.4237
 epoch: 81, train_loss: 0.9800, test_loss: 1.3156, test_f1: 0.4150
 epoch: 82, train_loss: 0.9788, test_loss: 1.3164, test_f1: 0.4114
 epoch: 83, train_loss: 0.9768, test_loss: 1.3256, test_f1: 0.4091
 epoch: 84, train_loss: 0.9807, test_loss: 1.3287, test_f1: 0.4132
 epoch: 85, train_loss: 0.9866, test_loss: 1.3266, test_f1: 0.4241
 epoch: 86, train_loss: 0.9809, test_loss: 1.3340, test_f1: 0.4264
 epoch: 87, train_loss: 0.9782, test_loss: 1.3329, test_f1: 0.4353
 epoch: 88, train_loss: 0.9719, test_loss: 1.3196, test_f1: 0.4366
 epoch: 89, train_loss: 0.9902, test_loss: 1.3293, test_f1: 0.4335
 epoch: 90, train_loss: 0.9767, test_loss: 1.3465, test_f1: 0.4261
 epoch: 91, train_loss: 0.9772, test_loss: 1.3344, test_f1: 0.4264
 epoch: 92, train_loss: 0.9673, test_loss: 1.3831, test_f1: 0.4123
 epoch: 93, train_loss: 0.9846, test_loss: 1.3958, test_f1: 0.4247
 epoch: 94, train_loss: 0.9646, test_loss: 1.3978, test_f1: 0.4086
 epoch: 95, train_loss: 0.9703, test_loss: 1.3745, test_f1: 0.4191
 epoch: 96, train_loss: 0.9710, test_loss: 1.3644, test_f1: 0.4464
 epoch: 97, train_loss: 0.9610, test_loss: 1.3727, test_f1: 0.4390
 epoch: 98, train_loss: 0.9650, test_loss: 1.3964, test_f1: 0.4200
 epoch: 99, train_loss: 0.9633, test_loss: 1.3658, test_f1: 0.4309
##################ITERATION #5 ****************************************
 epoch: 0, train_loss: 1.3394, test_loss: 1.3018, test_f1: 0.2281
 epoch: 1, train_loss: 1.2584, test_loss: 1.2994, test_f1: 0.2281
 epoch: 2, train_loss: 1.2453, test_loss: 1.2953, test_f1: 0.2281
 epoch: 3, train_loss: 1.2261, test_loss: 1.2892, test_f1: 0.2281
 epoch: 4, train_loss: 1.2217, test_loss: 1.2731, test_f1: 0.2281
 epoch: 5, train_loss: 1.2149, test_loss: 1.2545, test_f1: 0.2281
 epoch: 6, train_loss: 1.1959, test_loss: 1.2412, test_f1: 0.2445
 epoch: 7, train_loss: 1.1971, test_loss: 1.2309, test_f1: 0.2595
 epoch: 8, train_loss: 1.1879, test_loss: 1.2209, test_f1: 0.2641
 epoch: 9, train_loss: 1.1807, test_loss: 1.2130, test_f1: 0.2798
 epoch: 10, train_loss: 1.1720, test_loss: 1.2079, test_f1: 0.3473
 epoch: 11, train_loss: 1.1756, test_loss: 1.2076, test_f1: 0.3758
 epoch: 12, train_loss: 1.1515, test_loss: 1.2088, test_f1: 0.3991
 epoch: 13, train_loss: 1.1547, test_loss: 1.2170, test_f1: 0.3927
 epoch: 14, train_loss: 1.1476, test_loss: 1.2212, test_f1: 0.3939
 epoch: 15, train_loss: 1.1374, test_loss: 1.2151, test_f1: 0.3903
 epoch: 16, train_loss: 1.1363, test_loss: 1.2059, test_f1: 0.4216
 epoch: 17, train_loss: 1.1384, test_loss: 1.2002, test_f1: 0.4237
 epoch: 18, train_loss: 1.1312, test_loss: 1.2014, test_f1: 0.4073
 epoch: 19, train_loss: 1.1230, test_loss: 1.1967, test_f1: 0.3912
 epoch: 20, train_loss: 1.1155, test_loss: 1.1961, test_f1: 0.3937
 epoch: 21, train_loss: 1.1134, test_loss: 1.1998, test_f1: 0.4014
 epoch: 22, train_loss: 1.0958, test_loss: 1.1979, test_f1: 0.4080
 epoch: 23, train_loss: 1.0978, test_loss: 1.1976, test_f1: 0.4168
 epoch: 24, train_loss: 1.0823, test_loss: 1.1949, test_f1: 0.4381
 epoch: 25, train_loss: 1.0734, test_loss: 1.1845, test_f1: 0.4315
 epoch: 26, train_loss: 1.0814, test_loss: 1.1863, test_f1: 0.4087
 epoch: 27, train_loss: 1.0829, test_loss: 1.1845, test_f1: 0.4090
 epoch: 28, train_loss: 1.0622, test_loss: 1.1916, test_f1: 0.4043
 epoch: 29, train_loss: 1.0648, test_loss: 1.1883, test_f1: 0.4145
 epoch: 30, train_loss: 1.0609, test_loss: 1.1838, test_f1: 0.4058
 epoch: 31, train_loss: 1.0473, test_loss: 1.1857, test_f1: 0.4083
 epoch: 32, train_loss: 1.0478, test_loss: 1.1879, test_f1: 0.4069
 epoch: 33, train_loss: 1.0350, test_loss: 1.1941, test_f1: 0.4106
 epoch: 34, train_loss: 1.0331, test_loss: 1.1848, test_f1: 0.4246
 epoch: 35, train_loss: 1.0271, test_loss: 1.1770, test_f1: 0.4058
 epoch: 36, train_loss: 1.0299, test_loss: 1.1935, test_f1: 0.4269
 epoch: 37, train_loss: 1.0266, test_loss: 1.1968, test_f1: 0.4269
 epoch: 38, train_loss: 1.0246, test_loss: 1.1946, test_f1: 0.4374
 epoch: 39, train_loss: 1.0199, test_loss: 1.1920, test_f1: 0.4247
 epoch: 40, train_loss: 1.0075, test_loss: 1.1925, test_f1: 0.4243
 epoch: 41, train_loss: 1.0195, test_loss: 1.1885, test_f1: 0.4262
 epoch: 42, train_loss: 1.0012, test_loss: 1.1923, test_f1: 0.4438
 epoch: 43, train_loss: 1.0035, test_loss: 1.2122, test_f1: 0.4396
 epoch: 44, train_loss: 1.0089, test_loss: 1.2201, test_f1: 0.4523
 epoch: 45, train_loss: 1.0011, test_loss: 1.2249, test_f1: 0.4516
 epoch: 46, train_loss: 0.9930, test_loss: 1.2125, test_f1: 0.4549
 epoch: 47, train_loss: 0.9952, test_loss: 1.2253, test_f1: 0.4362
 epoch: 48, train_loss: 0.9869, test_loss: 1.2289, test_f1: 0.4529
 epoch: 49, train_loss: 0.9869, test_loss: 1.2031, test_f1: 0.4730
 epoch: 50, train_loss: 0.9883, test_loss: 1.2168, test_f1: 0.4528
 epoch: 51, train_loss: 0.9718, test_loss: 1.2225, test_f1: 0.4519
 epoch: 52, train_loss: 0.9834, test_loss: 1.2076, test_f1: 0.4495
 epoch: 53, train_loss: 0.9793, test_loss: 1.2240, test_f1: 0.4618
 epoch: 54, train_loss: 0.9777, test_loss: 1.2178, test_f1: 0.4662
 epoch: 55, train_loss: 0.9574, test_loss: 1.2018, test_f1: 0.4680
 epoch: 56, train_loss: 0.9751, test_loss: 1.2093, test_f1: 0.4642
 epoch: 57, train_loss: 0.9692, test_loss: 1.2153, test_f1: 0.4681
 epoch: 58, train_loss: 0.9784, test_loss: 1.2058, test_f1: 0.4583
 epoch: 59, train_loss: 0.9743, test_loss: 1.2026, test_f1: 0.4682
 epoch: 60, train_loss: 0.9644, test_loss: 1.1893, test_f1: 0.4718
 epoch: 61, train_loss: 0.9592, test_loss: 1.1964, test_f1: 0.4848
 epoch: 62, train_loss: 0.9618, test_loss: 1.1998, test_f1: 0.4915
 epoch: 63, train_loss: 0.9627, test_loss: 1.2050, test_f1: 0.4829
 epoch: 64, train_loss: 0.9589, test_loss: 1.2089, test_f1: 0.4809
 epoch: 65, train_loss: 0.9546, test_loss: 1.2060, test_f1: 0.4713
 epoch: 66, train_loss: 0.9570, test_loss: 1.1995, test_f1: 0.4939
 epoch: 67, train_loss: 0.9560, test_loss: 1.1897, test_f1: 0.5029
 epoch: 68, train_loss: 0.9529, test_loss: 1.1706, test_f1: 0.5001
 epoch: 69, train_loss: 0.9424, test_loss: 1.1911, test_f1: 0.4970
 epoch: 70, train_loss: 0.9518, test_loss: 1.2063, test_f1: 0.4907
 epoch: 71, train_loss: 0.9402, test_loss: 1.1923, test_f1: 0.4987
 epoch: 72, train_loss: 0.9542, test_loss: 1.2199, test_f1: 0.4997
 epoch: 73, train_loss: 0.9321, test_loss: 1.2310, test_f1: 0.5005
 epoch: 74, train_loss: 0.9319, test_loss: 1.2365, test_f1: 0.4987
 epoch: 75, train_loss: 0.9317, test_loss: 1.2401, test_f1: 0.5073
 epoch: 76, train_loss: 0.9258, test_loss: 1.2323, test_f1: 0.4953
 epoch: 77, train_loss: 0.9287, test_loss: 1.2195, test_f1: 0.4972
 epoch: 78, train_loss: 0.9237, test_loss: 1.2116, test_f1: 0.4971
 epoch: 79, train_loss: 0.9239, test_loss: 1.1919, test_f1: 0.4872
 epoch: 80, train_loss: 0.9229, test_loss: 1.1890, test_f1: 0.4820
 epoch: 81, train_loss: 0.9431, test_loss: 1.1847, test_f1: 0.5000
 epoch: 82, train_loss: 0.9200, test_loss: 1.1919, test_f1: 0.5142
 epoch: 83, train_loss: 0.9178, test_loss: 1.1932, test_f1: 0.5137
 epoch: 84, train_loss: 0.9203, test_loss: 1.2082, test_f1: 0.5300
 epoch: 85, train_loss: 0.9220, test_loss: 1.2069, test_f1: 0.5390
 epoch: 86, train_loss: 0.9088, test_loss: 1.2055, test_f1: 0.5149
 epoch: 87, train_loss: 0.9120, test_loss: 1.1957, test_f1: 0.4964
 epoch: 88, train_loss: 0.9259, test_loss: 1.1935, test_f1: 0.5070
 epoch: 89, train_loss: 0.9112, test_loss: 1.1975, test_f1: 0.5266
 epoch: 90, train_loss: 0.9108, test_loss: 1.1936, test_f1: 0.5252
 epoch: 91, train_loss: 0.9170, test_loss: 1.1876, test_f1: 0.5133
 epoch: 92, train_loss: 0.9097, test_loss: 1.2122, test_f1: 0.5154
 epoch: 93, train_loss: 0.9066, test_loss: 1.2173, test_f1: 0.5144
 epoch: 94, train_loss: 0.9022, test_loss: 1.2150, test_f1: 0.5260
 epoch: 95, train_loss: 0.9002, test_loss: 1.2198, test_f1: 0.5441
 epoch: 96, train_loss: 0.9108, test_loss: 1.2075, test_f1: 0.5419
 epoch: 97, train_loss: 0.9057, test_loss: 1.1803, test_f1: 0.5287
 epoch: 98, train_loss: 0.9004, test_loss: 1.2145, test_f1: 0.5286
 epoch: 99, train_loss: 0.9138, test_loss: 1.2210, test_f1: 0.5453
##################ITERATION #6 ****************************************
 epoch: 0, train_loss: 1.3069, test_loss: 1.3265, test_f1: 0.2281
 epoch: 1, train_loss: 1.2522, test_loss: 1.3220, test_f1: 0.2281
 epoch: 2, train_loss: 1.2391, test_loss: 1.3025, test_f1: 0.2289
 epoch: 3, train_loss: 1.2251, test_loss: 1.2823, test_f1: 0.2310
 epoch: 4, train_loss: 1.2103, test_loss: 1.2837, test_f1: 0.2763
 epoch: 5, train_loss: 1.1840, test_loss: 1.2716, test_f1: 0.3137
 epoch: 6, train_loss: 1.1827, test_loss: 1.2635, test_f1: 0.3697
 epoch: 7, train_loss: 1.1627, test_loss: 1.2469, test_f1: 0.3543
 epoch: 8, train_loss: 1.1609, test_loss: 1.2375, test_f1: 0.3518
 epoch: 9, train_loss: 1.1425, test_loss: 1.2196, test_f1: 0.3549
 epoch: 10, train_loss: 1.1347, test_loss: 1.2139, test_f1: 0.3593
 epoch: 11, train_loss: 1.1331, test_loss: 1.2177, test_f1: 0.3664
 epoch: 12, train_loss: 1.1407, test_loss: 1.2225, test_f1: 0.3675
 epoch: 13, train_loss: 1.1220, test_loss: 1.2336, test_f1: 0.3630
 epoch: 14, train_loss: 1.1212, test_loss: 1.2208, test_f1: 0.3618
 epoch: 15, train_loss: 1.1198, test_loss: 1.2086, test_f1: 0.3597
 epoch: 16, train_loss: 1.1170, test_loss: 1.2197, test_f1: 0.3627
 epoch: 17, train_loss: 1.1067, test_loss: 1.2165, test_f1: 0.3706
 epoch: 18, train_loss: 1.0985, test_loss: 1.2190, test_f1: 0.4021
 epoch: 19, train_loss: 1.0979, test_loss: 1.1998, test_f1: 0.3707
 epoch: 20, train_loss: 1.0887, test_loss: 1.2183, test_f1: 0.3697
 epoch: 21, train_loss: 1.0913, test_loss: 1.2102, test_f1: 0.3812
 epoch: 22, train_loss: 1.1022, test_loss: 1.2181, test_f1: 0.3544
 epoch: 23, train_loss: 1.0760, test_loss: 1.2093, test_f1: 0.3605
 epoch: 24, train_loss: 1.0785, test_loss: 1.2067, test_f1: 0.3701
 epoch: 25, train_loss: 1.0614, test_loss: 1.2046, test_f1: 0.3804
 epoch: 26, train_loss: 1.0722, test_loss: 1.1778, test_f1: 0.3874
 epoch: 27, train_loss: 1.0607, test_loss: 1.1685, test_f1: 0.3715
 epoch: 28, train_loss: 1.0796, test_loss: 1.1972, test_f1: 0.3669
 epoch: 29, train_loss: 1.0717, test_loss: 1.1833, test_f1: 0.3369
 epoch: 30, train_loss: 1.0678, test_loss: 1.1696, test_f1: 0.3759
 epoch: 31, train_loss: 1.0735, test_loss: 1.1585, test_f1: 0.4007
 epoch: 32, train_loss: 1.0604, test_loss: 1.1511, test_f1: 0.3873
 epoch: 33, train_loss: 1.0432, test_loss: 1.1565, test_f1: 0.3791
 epoch: 34, train_loss: 1.0398, test_loss: 1.1599, test_f1: 0.3915
 epoch: 35, train_loss: 1.0367, test_loss: 1.1516, test_f1: 0.3813
 epoch: 36, train_loss: 1.0331, test_loss: 1.1542, test_f1: 0.3980
 epoch: 37, train_loss: 1.0353, test_loss: 1.1606, test_f1: 0.4133
 epoch: 38, train_loss: 1.0268, test_loss: 1.1650, test_f1: 0.4114
 epoch: 39, train_loss: 1.0250, test_loss: 1.1572, test_f1: 0.4144
 epoch: 40, train_loss: 1.0246, test_loss: 1.1638, test_f1: 0.4159
 epoch: 41, train_loss: 1.0242, test_loss: 1.1531, test_f1: 0.4621
 epoch: 42, train_loss: 1.0179, test_loss: 1.1472, test_f1: 0.4403
 epoch: 43, train_loss: 1.0054, test_loss: 1.1521, test_f1: 0.4170
 epoch: 44, train_loss: 1.0062, test_loss: 1.1464, test_f1: 0.4184
 epoch: 45, train_loss: 1.0047, test_loss: 1.1400, test_f1: 0.4507
 epoch: 46, train_loss: 0.9959, test_loss: 1.1506, test_f1: 0.4533
 epoch: 47, train_loss: 1.0086, test_loss: 1.1422, test_f1: 0.4565
 epoch: 48, train_loss: 0.9969, test_loss: 1.1306, test_f1: 0.4700
 epoch: 49, train_loss: 0.9991, test_loss: 1.1393, test_f1: 0.4718
 epoch: 50, train_loss: 0.9928, test_loss: 1.1193, test_f1: 0.4840
 epoch: 51, train_loss: 0.9758, test_loss: 1.1059, test_f1: 0.4924
 epoch: 52, train_loss: 0.9745, test_loss: 1.1083, test_f1: 0.5041
 epoch: 53, train_loss: 0.9703, test_loss: 1.0987, test_f1: 0.5186
 epoch: 54, train_loss: 0.9779, test_loss: 1.0976, test_f1: 0.5238
 epoch: 55, train_loss: 0.9643, test_loss: 1.0988, test_f1: 0.5157
 epoch: 56, train_loss: 0.9645, test_loss: 1.0977, test_f1: 0.5150
 epoch: 57, train_loss: 0.9641, test_loss: 1.1055, test_f1: 0.5177
 epoch: 58, train_loss: 0.9652, test_loss: 1.1199, test_f1: 0.5280
 epoch: 59, train_loss: 0.9659, test_loss: 1.1031, test_f1: 0.5307
 epoch: 60, train_loss: 0.9583, test_loss: 1.1082, test_f1: 0.5550
 epoch: 61, train_loss: 0.9558, test_loss: 1.1084, test_f1: 0.5418
 epoch: 62, train_loss: 0.9664, test_loss: 1.1182, test_f1: 0.5206
 epoch: 63, train_loss: 0.9612, test_loss: 1.1142, test_f1: 0.5297
 epoch: 64, train_loss: 0.9497, test_loss: 1.1038, test_f1: 0.5465
 epoch: 65, train_loss: 0.9534, test_loss: 1.1187, test_f1: 0.5265
 epoch: 66, train_loss: 0.9563, test_loss: 1.1000, test_f1: 0.5150
 epoch: 67, train_loss: 0.9659, test_loss: 1.1015, test_f1: 0.5452
 epoch: 68, train_loss: 0.9519, test_loss: 1.1116, test_f1: 0.5349
 epoch: 69, train_loss: 0.9610, test_loss: 1.1046, test_f1: 0.5443
 epoch: 70, train_loss: 0.9523, test_loss: 1.1037, test_f1: 0.5666
 epoch: 71, train_loss: 0.9544, test_loss: 1.1026, test_f1: 0.5367
 epoch: 72, train_loss: 0.9536, test_loss: 1.1047, test_f1: 0.5352
 epoch: 73, train_loss: 0.9585, test_loss: 1.1120, test_f1: 0.5392
 epoch: 74, train_loss: 0.9543, test_loss: 1.1726, test_f1: 0.5504
 epoch: 75, train_loss: 0.9409, test_loss: 1.1727, test_f1: 0.5436
 epoch: 76, train_loss: 0.9482, test_loss: 1.0898, test_f1: 0.5381
 epoch: 77, train_loss: 0.9360, test_loss: 1.0901, test_f1: 0.5055
 epoch: 78, train_loss: 0.9347, test_loss: 1.0843, test_f1: 0.4903
 epoch: 79, train_loss: 0.9316, test_loss: 1.0990, test_f1: 0.5081
 epoch: 80, train_loss: 0.9383, test_loss: 1.0851, test_f1: 0.4980
 epoch: 81, train_loss: 0.9380, test_loss: 1.0923, test_f1: 0.4718
 epoch: 82, train_loss: 0.9242, test_loss: 1.1268, test_f1: 0.4609
 epoch: 83, train_loss: 0.9347, test_loss: 1.0980, test_f1: 0.4768
 epoch: 84, train_loss: 0.9320, test_loss: 1.0942, test_f1: 0.5133
 epoch: 85, train_loss: 0.9214, test_loss: 1.3424, test_f1: 0.5086
 epoch: 86, train_loss: 0.9322, test_loss: 1.2883, test_f1: 0.5161
 epoch: 87, train_loss: 0.9346, test_loss: 1.2284, test_f1: 0.5032
 epoch: 88, train_loss: 0.9331, test_loss: 1.0898, test_f1: 0.4788
 epoch: 89, train_loss: 0.9267, test_loss: 1.1022, test_f1: 0.4879
 epoch: 90, train_loss: 0.9402, test_loss: 1.1084, test_f1: 0.5127
 epoch: 91, train_loss: 0.9321, test_loss: 1.1126, test_f1: 0.5055
 epoch: 92, train_loss: 0.9286, test_loss: 1.0857, test_f1: 0.5200
 epoch: 93, train_loss: 0.9215, test_loss: 1.0986, test_f1: 0.5085
 epoch: 94, train_loss: 0.9253, test_loss: 1.0694, test_f1: 0.5125
 epoch: 95, train_loss: 0.9207, test_loss: 1.1321, test_f1: 0.5155
 epoch: 96, train_loss: 0.9270, test_loss: 1.2078, test_f1: 0.5174
 epoch: 97, train_loss: 0.9085, test_loss: 1.1131, test_f1: 0.4847
 epoch: 98, train_loss: 0.9034, test_loss: 1.0658, test_f1: 0.4843
 epoch: 99, train_loss: 0.9108, test_loss: 1.0676, test_f1: 0.5102
##################ITERATION #7 ****************************************
 epoch: 0, train_loss: 1.3191, test_loss: 1.4379, test_f1: 0.2224
 epoch: 1, train_loss: 1.2344, test_loss: 1.3686, test_f1: 0.2262
 epoch: 2, train_loss: 1.2292, test_loss: 1.3250, test_f1: 0.2764
 epoch: 3, train_loss: 1.1970, test_loss: 1.2974, test_f1: 0.2766
 epoch: 4, train_loss: 1.2013, test_loss: 1.2900, test_f1: 0.3066
 epoch: 5, train_loss: 1.1890, test_loss: 1.2914, test_f1: 0.3387
 epoch: 6, train_loss: 1.1864, test_loss: 1.3011, test_f1: 0.3405
 epoch: 7, train_loss: 1.1769, test_loss: 1.3042, test_f1: 0.3344
 epoch: 8, train_loss: 1.1678, test_loss: 1.2979, test_f1: 0.3370
 epoch: 9, train_loss: 1.1544, test_loss: 1.2980, test_f1: 0.3208
 epoch: 10, train_loss: 1.1553, test_loss: 1.2961, test_f1: 0.3403
 epoch: 11, train_loss: 1.1500, test_loss: 1.2818, test_f1: 0.3521
 epoch: 12, train_loss: 1.1468, test_loss: 1.2684, test_f1: 0.3527
 epoch: 13, train_loss: 1.1418, test_loss: 1.2650, test_f1: 0.3551
 epoch: 14, train_loss: 1.1356, test_loss: 1.2640, test_f1: 0.3484
 epoch: 15, train_loss: 1.1300, test_loss: 1.2580, test_f1: 0.3551
 epoch: 16, train_loss: 1.1227, test_loss: 1.2680, test_f1: 0.3606
 epoch: 17, train_loss: 1.1182, test_loss: 1.2763, test_f1: 0.3748
 epoch: 18, train_loss: 1.1227, test_loss: 1.3063, test_f1: 0.3763
 epoch: 19, train_loss: 1.1309, test_loss: 1.3389, test_f1: 0.3779
 epoch: 20, train_loss: 1.1165, test_loss: 1.3456, test_f1: 0.3798
 epoch: 21, train_loss: 1.1030, test_loss: 1.3403, test_f1: 0.3808
 epoch: 22, train_loss: 1.1021, test_loss: 1.3400, test_f1: 0.3890
 epoch: 23, train_loss: 1.0969, test_loss: 1.3496, test_f1: 0.3900
 epoch: 24, train_loss: 1.0870, test_loss: 1.3496, test_f1: 0.4051
 epoch: 25, train_loss: 1.0939, test_loss: 1.3572, test_f1: 0.3908
 epoch: 26, train_loss: 1.0880, test_loss: 1.3722, test_f1: 0.3890
 epoch: 27, train_loss: 1.0731, test_loss: 1.3724, test_f1: 0.4070
 epoch: 28, train_loss: 1.0763, test_loss: 1.3472, test_f1: 0.3948
 epoch: 29, train_loss: 1.0701, test_loss: 1.3633, test_f1: 0.3961
 epoch: 30, train_loss: 1.0650, test_loss: 1.3727, test_f1: 0.4013
 epoch: 31, train_loss: 1.0686, test_loss: 1.3867, test_f1: 0.4066
 epoch: 32, train_loss: 1.0610, test_loss: 1.3720, test_f1: 0.3976
 epoch: 33, train_loss: 1.0588, test_loss: 1.3623, test_f1: 0.4073
 epoch: 34, train_loss: 1.0557, test_loss: 1.3722, test_f1: 0.4009
 epoch: 35, train_loss: 1.0594, test_loss: 1.3730, test_f1: 0.4473
 epoch: 36, train_loss: 1.0474, test_loss: 1.3821, test_f1: 0.4371
 epoch: 37, train_loss: 1.0499, test_loss: 1.3837, test_f1: 0.4170
 epoch: 38, train_loss: 1.0440, test_loss: 1.3869, test_f1: 0.4132
 epoch: 39, train_loss: 1.0472, test_loss: 1.3753, test_f1: 0.4444
 epoch: 40, train_loss: 1.0324, test_loss: 1.3560, test_f1: 0.4429
 epoch: 41, train_loss: 1.0344, test_loss: 1.3487, test_f1: 0.4467
 epoch: 42, train_loss: 1.0378, test_loss: 1.3272, test_f1: 0.4611
 epoch: 43, train_loss: 1.0406, test_loss: 1.3193, test_f1: 0.4461
 epoch: 44, train_loss: 1.0210, test_loss: 1.3247, test_f1: 0.4331
 epoch: 45, train_loss: 1.0208, test_loss: 1.3297, test_f1: 0.4622
 epoch: 46, train_loss: 1.0198, test_loss: 1.3165, test_f1: 0.4263
 epoch: 47, train_loss: 1.0019, test_loss: 1.3385, test_f1: 0.3965
 epoch: 48, train_loss: 1.0159, test_loss: 1.3488, test_f1: 0.4247
 epoch: 49, train_loss: 1.0024, test_loss: 1.3285, test_f1: 0.4643
 epoch: 50, train_loss: 1.0135, test_loss: 1.3332, test_f1: 0.4293
 epoch: 51, train_loss: 1.0059, test_loss: 1.3302, test_f1: 0.4265
 epoch: 52, train_loss: 0.9950, test_loss: 1.3354, test_f1: 0.4229
 epoch: 53, train_loss: 0.9923, test_loss: 1.3306, test_f1: 0.4299
 epoch: 54, train_loss: 0.9906, test_loss: 1.3304, test_f1: 0.4290
 epoch: 55, train_loss: 0.9867, test_loss: 1.3216, test_f1: 0.4549
 epoch: 56, train_loss: 1.0042, test_loss: 1.3406, test_f1: 0.4638
 epoch: 57, train_loss: 0.9817, test_loss: 1.3383, test_f1: 0.4609
 epoch: 58, train_loss: 0.9899, test_loss: 1.3386, test_f1: 0.4620
 epoch: 59, train_loss: 0.9796, test_loss: 1.3293, test_f1: 0.4381
 epoch: 60, train_loss: 0.9808, test_loss: 1.3327, test_f1: 0.4132
 epoch: 61, train_loss: 0.9704, test_loss: 1.3123, test_f1: 0.4407
 epoch: 62, train_loss: 0.9797, test_loss: 1.3127, test_f1: 0.4533
 epoch: 63, train_loss: 0.9688, test_loss: 1.3277, test_f1: 0.4354
 epoch: 64, train_loss: 0.9798, test_loss: 1.3341, test_f1: 0.4156
 epoch: 65, train_loss: 0.9770, test_loss: 1.3329, test_f1: 0.4172
 epoch: 66, train_loss: 0.9798, test_loss: 1.3478, test_f1: 0.4183
 epoch: 67, train_loss: 0.9834, test_loss: 1.3681, test_f1: 0.4397
 epoch: 68, train_loss: 0.9755, test_loss: 1.3707, test_f1: 0.4386
 epoch: 69, train_loss: 0.9830, test_loss: 1.3561, test_f1: 0.4520
 epoch: 70, train_loss: 0.9609, test_loss: 1.3149, test_f1: 0.4610
 epoch: 71, train_loss: 0.9695, test_loss: 1.3070, test_f1: 0.4571
 epoch: 72, train_loss: 0.9621, test_loss: 1.3269, test_f1: 0.4557
 epoch: 73, train_loss: 0.9583, test_loss: 1.3448, test_f1: 0.4446
 epoch: 74, train_loss: 0.9661, test_loss: 1.3316, test_f1: 0.4541
 epoch: 75, train_loss: 0.9590, test_loss: 1.3332, test_f1: 0.4202
 epoch: 76, train_loss: 0.9590, test_loss: 1.3395, test_f1: 0.4357
 epoch: 77, train_loss: 0.9622, test_loss: 1.3608, test_f1: 0.4287
 epoch: 78, train_loss: 0.9568, test_loss: 1.3891, test_f1: 0.4228
 epoch: 79, train_loss: 0.9659, test_loss: 1.3758, test_f1: 0.4512
 epoch: 80, train_loss: 0.9654, test_loss: 1.3865, test_f1: 0.4295
 epoch: 81, train_loss: 0.9495, test_loss: 1.3742, test_f1: 0.4351
 epoch: 82, train_loss: 0.9561, test_loss: 1.3624, test_f1: 0.4514
 epoch: 83, train_loss: 0.9493, test_loss: 1.3709, test_f1: 0.4434
 epoch: 84, train_loss: 0.9575, test_loss: 1.3700, test_f1: 0.4369
 epoch: 85, train_loss: 0.9555, test_loss: 1.3802, test_f1: 0.4404
 epoch: 86, train_loss: 0.9473, test_loss: 1.3794, test_f1: 0.4365
 epoch: 87, train_loss: 0.9377, test_loss: 1.3685, test_f1: 0.4714
 epoch: 88, train_loss: 0.9539, test_loss: 1.3530, test_f1: 0.4692
 epoch: 89, train_loss: 0.9418, test_loss: 1.3526, test_f1: 0.4491
 epoch: 90, train_loss: 0.9433, test_loss: 1.3775, test_f1: 0.4529
 epoch: 91, train_loss: 0.9463, test_loss: 1.3955, test_f1: 0.4536
 epoch: 92, train_loss: 0.9385, test_loss: 1.3652, test_f1: 0.4543
 epoch: 93, train_loss: 0.9361, test_loss: 1.3956, test_f1: 0.4655
 epoch: 94, train_loss: 0.9307, test_loss: 1.4240, test_f1: 0.4530
 epoch: 95, train_loss: 0.9358, test_loss: 1.4117, test_f1: 0.4556
 epoch: 96, train_loss: 0.9404, test_loss: 1.4190, test_f1: 0.4507
 epoch: 97, train_loss: 0.9393, test_loss: 1.4126, test_f1: 0.4668
 epoch: 98, train_loss: 0.9284, test_loss: 1.4063, test_f1: 0.4697
 epoch: 99, train_loss: 0.9305, test_loss: 1.3872, test_f1: 0.4645
##################ITERATION #8 ****************************************
 epoch: 0, train_loss: 1.3271, test_loss: 1.3618, test_f1: 0.2281
 epoch: 1, train_loss: 1.2915, test_loss: 1.3479, test_f1: 0.2404
 epoch: 2, train_loss: 1.2692, test_loss: 1.3491, test_f1: 0.2404
 epoch: 3, train_loss: 1.2525, test_loss: 1.3634, test_f1: 0.2404
 epoch: 4, train_loss: 1.2384, test_loss: 1.3795, test_f1: 0.2391
 epoch: 5, train_loss: 1.2405, test_loss: 1.3859, test_f1: 0.2379
 epoch: 6, train_loss: 1.2287, test_loss: 1.3733, test_f1: 0.2379
 epoch: 7, train_loss: 1.2220, test_loss: 1.3716, test_f1: 0.2391
 epoch: 8, train_loss: 1.2261, test_loss: 1.3657, test_f1: 0.2437
 epoch: 9, train_loss: 1.2246, test_loss: 1.3503, test_f1: 0.2469
 epoch: 10, train_loss: 1.2084, test_loss: 1.3515, test_f1: 0.2795
 epoch: 11, train_loss: 1.1951, test_loss: 1.3647, test_f1: 0.2824
 epoch: 12, train_loss: 1.1938, test_loss: 1.3641, test_f1: 0.2880
 epoch: 13, train_loss: 1.1823, test_loss: 1.3587, test_f1: 0.2880
 epoch: 14, train_loss: 1.1812, test_loss: 1.3496, test_f1: 0.2995
 epoch: 15, train_loss: 1.1821, test_loss: 1.3311, test_f1: 0.3210
 epoch: 16, train_loss: 1.1724, test_loss: 1.3119, test_f1: 0.3239
 epoch: 17, train_loss: 1.1634, test_loss: 1.3182, test_f1: 0.3170
 epoch: 18, train_loss: 1.1622, test_loss: 1.3183, test_f1: 0.3305
 epoch: 19, train_loss: 1.1408, test_loss: 1.3298, test_f1: 0.3378
 epoch: 20, train_loss: 1.1348, test_loss: 1.3607, test_f1: 0.3269
 epoch: 21, train_loss: 1.1512, test_loss: 1.3743, test_f1: 0.3237
 epoch: 22, train_loss: 1.1398, test_loss: 1.3736, test_f1: 0.3272
 epoch: 23, train_loss: 1.1372, test_loss: 1.3614, test_f1: 0.3310
 epoch: 24, train_loss: 1.1262, test_loss: 1.3385, test_f1: 0.3699
 epoch: 25, train_loss: 1.1087, test_loss: 1.3191, test_f1: 0.3668
 epoch: 26, train_loss: 1.1153, test_loss: 1.3085, test_f1: 0.3666
 epoch: 27, train_loss: 1.0987, test_loss: 1.3050, test_f1: 0.3681
 epoch: 28, train_loss: 1.0997, test_loss: 1.3267, test_f1: 0.3747
 epoch: 29, train_loss: 1.0984, test_loss: 1.3326, test_f1: 0.3872
 epoch: 30, train_loss: 1.0812, test_loss: 1.3328, test_f1: 0.4208
 epoch: 31, train_loss: 1.0680, test_loss: 1.3838, test_f1: 0.3973
 epoch: 32, train_loss: 1.0719, test_loss: 1.3807, test_f1: 0.3922
 epoch: 33, train_loss: 1.0639, test_loss: 1.3641, test_f1: 0.3978
 epoch: 34, train_loss: 1.0743, test_loss: 1.3811, test_f1: 0.4024
 epoch: 35, train_loss: 1.0731, test_loss: 1.3813, test_f1: 0.4088
 epoch: 36, train_loss: 1.0702, test_loss: 1.3799, test_f1: 0.4070
 epoch: 37, train_loss: 1.0591, test_loss: 1.3879, test_f1: 0.3956
 epoch: 38, train_loss: 1.0499, test_loss: 1.3703, test_f1: 0.4292
 epoch: 39, train_loss: 1.0536, test_loss: 1.3546, test_f1: 0.4308
 epoch: 40, train_loss: 1.0411, test_loss: 1.3676, test_f1: 0.4159
 epoch: 41, train_loss: 1.0367, test_loss: 1.4138, test_f1: 0.4036
 epoch: 42, train_loss: 1.0484, test_loss: 1.3855, test_f1: 0.4117
 epoch: 43, train_loss: 1.0358, test_loss: 1.4100, test_f1: 0.4391
 epoch: 44, train_loss: 1.0159, test_loss: 1.3765, test_f1: 0.4407
 epoch: 45, train_loss: 1.0277, test_loss: 1.4072, test_f1: 0.4314
 epoch: 46, train_loss: 1.0160, test_loss: 1.3778, test_f1: 0.4561
 epoch: 47, train_loss: 1.0188, test_loss: 1.3753, test_f1: 0.4559
 epoch: 48, train_loss: 1.0122, test_loss: 1.3671, test_f1: 0.4429
 epoch: 49, train_loss: 1.0208, test_loss: 1.3778, test_f1: 0.4446
 epoch: 50, train_loss: 1.0129, test_loss: 1.4808, test_f1: 0.4440
 epoch: 51, train_loss: 1.0083, test_loss: 1.4192, test_f1: 0.4511
 epoch: 52, train_loss: 0.9914, test_loss: 1.3880, test_f1: 0.4380
 epoch: 53, train_loss: 1.0023, test_loss: 1.3467, test_f1: 0.4428
 epoch: 54, train_loss: 1.0022, test_loss: 1.3356, test_f1: 0.4464
 epoch: 55, train_loss: 1.0144, test_loss: 1.3570, test_f1: 0.4565
 epoch: 56, train_loss: 0.9955, test_loss: 1.3305, test_f1: 0.4518
 epoch: 57, train_loss: 1.0021, test_loss: 1.3758, test_f1: 0.4427
 epoch: 58, train_loss: 0.9902, test_loss: 1.3574, test_f1: 0.4564
 epoch: 59, train_loss: 0.9998, test_loss: 1.3695, test_f1: 0.4620
 epoch: 60, train_loss: 0.9999, test_loss: 1.3757, test_f1: 0.4621
 epoch: 61, train_loss: 0.9910, test_loss: 1.4187, test_f1: 0.4628
 epoch: 62, train_loss: 0.9949, test_loss: 1.3828, test_f1: 0.4512
 epoch: 63, train_loss: 0.9661, test_loss: 1.4009, test_f1: 0.4523
 epoch: 64, train_loss: 0.9797, test_loss: 1.4100, test_f1: 0.4761
 epoch: 65, train_loss: 0.9845, test_loss: 1.4120, test_f1: 0.4819
 epoch: 66, train_loss: 0.9729, test_loss: 1.4291, test_f1: 0.4646
 epoch: 67, train_loss: 0.9921, test_loss: 1.4297, test_f1: 0.4720
 epoch: 68, train_loss: 0.9659, test_loss: 1.4165, test_f1: 0.4758
 epoch: 69, train_loss: 0.9767, test_loss: 1.4358, test_f1: 0.4606
 epoch: 70, train_loss: 0.9726, test_loss: 1.4182, test_f1: 0.4733
 epoch: 71, train_loss: 0.9638, test_loss: 1.4553, test_f1: 0.4797
 epoch: 72, train_loss: 0.9639, test_loss: 1.3674, test_f1: 0.4897
 epoch: 73, train_loss: 0.9548, test_loss: 1.3572, test_f1: 0.4757
 epoch: 74, train_loss: 0.9610, test_loss: 1.3786, test_f1: 0.4802
 epoch: 75, train_loss: 0.9645, test_loss: 1.3591, test_f1: 0.4785
 epoch: 76, train_loss: 0.9540, test_loss: 1.3499, test_f1: 0.4761
 epoch: 77, train_loss: 0.9579, test_loss: 1.3798, test_f1: 0.4800
 epoch: 78, train_loss: 0.9529, test_loss: 1.4246, test_f1: 0.4832
 epoch: 79, train_loss: 0.9613, test_loss: 1.4326, test_f1: 0.4829
 epoch: 80, train_loss: 0.9562, test_loss: 1.3883, test_f1: 0.4982
 epoch: 81, train_loss: 0.9465, test_loss: 1.3673, test_f1: 0.5056
 epoch: 82, train_loss: 0.9513, test_loss: 1.3437, test_f1: 0.5029
 epoch: 83, train_loss: 0.9556, test_loss: 1.3425, test_f1: 0.4932
 epoch: 84, train_loss: 0.9616, test_loss: 1.3241, test_f1: 0.4987
 epoch: 85, train_loss: 0.9508, test_loss: 1.3098, test_f1: 0.4825
 epoch: 86, train_loss: 0.9429, test_loss: 1.3313, test_f1: 0.4958
 epoch: 87, train_loss: 0.9447, test_loss: 1.3582, test_f1: 0.4918
 epoch: 88, train_loss: 0.9465, test_loss: 1.3827, test_f1: 0.4761
 epoch: 89, train_loss: 0.9455, test_loss: 1.4009, test_f1: 0.4901
 epoch: 90, train_loss: 0.9389, test_loss: 1.3754, test_f1: 0.4936
 epoch: 91, train_loss: 0.9494, test_loss: 1.4197, test_f1: 0.4860
 epoch: 92, train_loss: 0.9400, test_loss: 1.4078, test_f1: 0.4878
 epoch: 93, train_loss: 0.9336, test_loss: 1.4188, test_f1: 0.5003
 epoch: 94, train_loss: 0.9390, test_loss: 1.4204, test_f1: 0.5024
 epoch: 95, train_loss: 0.9268, test_loss: 1.3245, test_f1: 0.4846
 epoch: 96, train_loss: 0.9432, test_loss: 1.2886, test_f1: 0.5001
 epoch: 97, train_loss: 0.9343, test_loss: 1.3143, test_f1: 0.5185
 epoch: 98, train_loss: 0.9387, test_loss: 1.3720, test_f1: 0.5290
 epoch: 99, train_loss: 0.9320, test_loss: 1.4136, test_f1: 0.4844
##################ITERATION #9 ****************************************
 epoch: 0, train_loss: 1.4055, test_loss: 1.4006, test_f1: 0.2416
 epoch: 1, train_loss: 1.3212, test_loss: 1.4117, test_f1: 0.2891
 epoch: 2, train_loss: 1.2938, test_loss: 1.3965, test_f1: 0.2716
 epoch: 3, train_loss: 1.2791, test_loss: 1.3805, test_f1: 0.2694
 epoch: 4, train_loss: 1.2830, test_loss: 1.3624, test_f1: 0.2711
 epoch: 5, train_loss: 1.2509, test_loss: 1.3460, test_f1: 0.2891
 epoch: 6, train_loss: 1.2443, test_loss: 1.3333, test_f1: 0.2942
 epoch: 7, train_loss: 1.2311, test_loss: 1.3195, test_f1: 0.3134
 epoch: 8, train_loss: 1.2338, test_loss: 1.3026, test_f1: 0.3142
 epoch: 9, train_loss: 1.2196, test_loss: 1.2873, test_f1: 0.3399
 epoch: 10, train_loss: 1.2161, test_loss: 1.2755, test_f1: 0.3378
 epoch: 11, train_loss: 1.2127, test_loss: 1.2647, test_f1: 0.3539
 epoch: 12, train_loss: 1.2047, test_loss: 1.2656, test_f1: 0.3527
 epoch: 13, train_loss: 1.1797, test_loss: 1.2668, test_f1: 0.3701
 epoch: 14, train_loss: 1.1966, test_loss: 1.2698, test_f1: 0.3774
 epoch: 15, train_loss: 1.1809, test_loss: 1.2610, test_f1: 0.3855
 epoch: 16, train_loss: 1.1662, test_loss: 1.2331, test_f1: 0.4151
 epoch: 17, train_loss: 1.1513, test_loss: 1.2098, test_f1: 0.4167
 epoch: 18, train_loss: 1.1489, test_loss: 1.2229, test_f1: 0.4291
 epoch: 19, train_loss: 1.1278, test_loss: 1.2582, test_f1: 0.3982
 epoch: 20, train_loss: 1.1257, test_loss: 1.2499, test_f1: 0.4057
 epoch: 21, train_loss: 1.1293, test_loss: 1.2282, test_f1: 0.4141
 epoch: 22, train_loss: 1.1083, test_loss: 1.2123, test_f1: 0.4049
 epoch: 23, train_loss: 1.0894, test_loss: 1.2273, test_f1: 0.4148
 epoch: 24, train_loss: 1.0988, test_loss: 1.2401, test_f1: 0.3805
 epoch: 25, train_loss: 1.0874, test_loss: 1.2515, test_f1: 0.4003
 epoch: 26, train_loss: 1.0703, test_loss: 1.2365, test_f1: 0.4135
 epoch: 27, train_loss: 1.0823, test_loss: 1.2346, test_f1: 0.4323
 epoch: 28, train_loss: 1.0682, test_loss: 1.2255, test_f1: 0.4372
 epoch: 29, train_loss: 1.0793, test_loss: 1.2325, test_f1: 0.4404
 epoch: 30, train_loss: 1.0460, test_loss: 1.2331, test_f1: 0.4218
 epoch: 31, train_loss: 1.0558, test_loss: 1.2435, test_f1: 0.4264
 epoch: 32, train_loss: 1.0425, test_loss: 1.2536, test_f1: 0.4255
 epoch: 33, train_loss: 1.0432, test_loss: 1.2581, test_f1: 0.4347
 epoch: 34, train_loss: 1.0430, test_loss: 1.2647, test_f1: 0.4310
 epoch: 35, train_loss: 1.0552, test_loss: 1.2614, test_f1: 0.4363
 epoch: 36, train_loss: 1.0510, test_loss: 1.2420, test_f1: 0.4196
 epoch: 37, train_loss: 1.0299, test_loss: 1.2357, test_f1: 0.4216
 epoch: 38, train_loss: 1.0362, test_loss: 1.2336, test_f1: 0.4283
 epoch: 39, train_loss: 1.0272, test_loss: 1.2509, test_f1: 0.4319
 epoch: 40, train_loss: 1.0364, test_loss: 1.2782, test_f1: 0.4277
 epoch: 41, train_loss: 1.0152, test_loss: 1.2812, test_f1: 0.4344
 epoch: 42, train_loss: 1.0092, test_loss: 1.2622, test_f1: 0.4511
 epoch: 43, train_loss: 1.0191, test_loss: 1.2602, test_f1: 0.4361
 epoch: 44, train_loss: 1.0146, test_loss: 1.2876, test_f1: 0.4352
 epoch: 45, train_loss: 1.0165, test_loss: 1.3018, test_f1: 0.4379
 epoch: 46, train_loss: 1.0048, test_loss: 1.2910, test_f1: 0.4184
 epoch: 47, train_loss: 1.0130, test_loss: 1.2815, test_f1: 0.4475
 epoch: 48, train_loss: 1.0035, test_loss: 1.2848, test_f1: 0.4556
 epoch: 49, train_loss: 1.0039, test_loss: 1.2576, test_f1: 0.4507
 epoch: 50, train_loss: 0.9978, test_loss: 1.2274, test_f1: 0.4339
 epoch: 51, train_loss: 1.0008, test_loss: 1.2305, test_f1: 0.4421
 epoch: 52, train_loss: 0.9946, test_loss: 1.2437, test_f1: 0.4308
 epoch: 53, train_loss: 0.9946, test_loss: 1.2655, test_f1: 0.4429
 epoch: 54, train_loss: 0.9965, test_loss: 1.2903, test_f1: 0.4403
 epoch: 55, train_loss: 0.9866, test_loss: 1.2954, test_f1: 0.4309
 epoch: 56, train_loss: 0.9943, test_loss: 1.2876, test_f1: 0.4212
 epoch: 57, train_loss: 0.9909, test_loss: 1.2781, test_f1: 0.4390
 epoch: 58, train_loss: 0.9869, test_loss: 1.3043, test_f1: 0.4490
 epoch: 59, train_loss: 0.9953, test_loss: 1.2947, test_f1: 0.4539
 epoch: 60, train_loss: 0.9881, test_loss: 1.2949, test_f1: 0.4549
 epoch: 61, train_loss: 0.9951, test_loss: 1.3017, test_f1: 0.4553
 epoch: 62, train_loss: 0.9736, test_loss: 1.2963, test_f1: 0.4568
 epoch: 63, train_loss: 0.9753, test_loss: 1.2881, test_f1: 0.4619
 epoch: 64, train_loss: 0.9808, test_loss: 1.2833, test_f1: 0.4512
 epoch: 65, train_loss: 0.9828, test_loss: 1.2799, test_f1: 0.4439
 epoch: 66, train_loss: 0.9784, test_loss: 1.2930, test_f1: 0.4484
 epoch: 67, train_loss: 0.9831, test_loss: 1.3036, test_f1: 0.4431
 epoch: 68, train_loss: 0.9859, test_loss: 1.3376, test_f1: 0.4580
 epoch: 69, train_loss: 0.9719, test_loss: 1.3641, test_f1: 0.4630
 epoch: 70, train_loss: 0.9808, test_loss: 1.3292, test_f1: 0.4627
 epoch: 71, train_loss: 0.9754, test_loss: 1.3362, test_f1: 0.4527
 epoch: 72, train_loss: 0.9725, test_loss: 1.3475, test_f1: 0.4623
 epoch: 73, train_loss: 0.9914, test_loss: 1.3468, test_f1: 0.4626
 epoch: 74, train_loss: 0.9770, test_loss: 1.3537, test_f1: 0.4608
 epoch: 75, train_loss: 0.9708, test_loss: 1.3504, test_f1: 0.4583
 epoch: 76, train_loss: 0.9674, test_loss: 1.3264, test_f1: 0.4557
 epoch: 77, train_loss: 0.9775, test_loss: 1.3467, test_f1: 0.4558
 epoch: 78, train_loss: 0.9666, test_loss: 1.3472, test_f1: 0.4602
 epoch: 79, train_loss: 0.9742, test_loss: 1.3726, test_f1: 0.4631
 epoch: 80, train_loss: 0.9591, test_loss: 1.3642, test_f1: 0.4679
 epoch: 81, train_loss: 0.9683, test_loss: 1.3470, test_f1: 0.4627
 epoch: 82, train_loss: 0.9625, test_loss: 1.3396, test_f1: 0.4603
 epoch: 83, train_loss: 0.9741, test_loss: 1.3605, test_f1: 0.4506
 epoch: 84, train_loss: 0.9570, test_loss: 1.3653, test_f1: 0.4557
 epoch: 85, train_loss: 0.9661, test_loss: 1.3533, test_f1: 0.4530
 epoch: 86, train_loss: 0.9551, test_loss: 1.3532, test_f1: 0.4597
 epoch: 87, train_loss: 0.9689, test_loss: 1.3837, test_f1: 0.4595
 epoch: 88, train_loss: 0.9650, test_loss: 1.4012, test_f1: 0.4601
 epoch: 89, train_loss: 0.9643, test_loss: 1.3941, test_f1: 0.4700
 epoch: 90, train_loss: 0.9503, test_loss: 1.3448, test_f1: 0.4494
 epoch: 91, train_loss: 0.9500, test_loss: 1.3461, test_f1: 0.4616
 epoch: 92, train_loss: 0.9637, test_loss: 1.3743, test_f1: 0.4652
 epoch: 93, train_loss: 0.9552, test_loss: 1.3694, test_f1: 0.4708
 epoch: 94, train_loss: 0.9601, test_loss: 1.3441, test_f1: 0.4578
 epoch: 95, train_loss: 0.9525, test_loss: 1.3292, test_f1: 0.4676
 epoch: 96, train_loss: 0.9523, test_loss: 1.3320, test_f1: 0.4649
 epoch: 97, train_loss: 0.9591, test_loss: 1.3157, test_f1: 0.4585
 epoch: 98, train_loss: 0.9528, test_loss: 1.3357, test_f1: 0.4510
 epoch: 99, train_loss: 0.9534, test_loss: 1.3657, test_f1: 0.4719

Training completed in 286.89 seconds
Best F1: 0.5666 at epoch 70
Mean F1 across iterations: 0.4941  0.0436
========================FINAL RESULTS================================
FEGIN weighted F1: 0.5666  0.0436
python main.py --data ltspice_demos --representation component_component --model FEGIN --layers 3 --hiddens 16 --batch_size 256 --lr 0.001 --emb_size 128 --epochs 100 --save_appendix component_component_L3_H16_BS256_LR0.001_E128 --no_val
-----



STDERR:
  File "main.py", line 370, in <module>
    main()
  File "main.py", line 254, in main
    dataset = dataset_class(
  File "/home/philip/projects/ltspice_examples_code_repo/Circuit-Completion-Using-GNNs/component_classification_with_link_prediction_head/evaluation/FEGIN/kernel/circuit_datasets.py", line 15, in __init__
    self.data, self.slices = torch.load(self.processed_paths[0])
  File "/home/philip/.local/lib/python3.8/site-packages/torch/serialization.py", line 1040, in load
    warnings.warn(
  File "/usr/lib/python3.8/warnings.py", line 109, in _showwarnmsg
    sw(msg.message, msg.category, msg.filename, msg.lineno,
  File "main.py", line 47, in warn_with_traceback
    traceback.print_stack(file=log)
/home/philip/projects/ltspice_examples_code_repo/Circuit-Completion-Using-GNNs/component_classification_with_link_prediction_head/evaluation/FEGIN/kernel/circuit_datasets.py:15: FutureWarning: You are using `torch.load` with `weights_only=False` (the current default value), which uses the default pickle module implicitly. It is possible to construct malicious pickle data which will execute arbitrary code during unpickling (See https://github.com/pytorch/pytorch/blob/main/SECURITY.md#untrusted-models for more details). In a future release, the default value for `weights_only` will be flipped to `True`. This limits the functions that could be executed during unpickling. Arbitrary objects will no longer be allowed to be loaded via this mode unless they are explicitly allowlisted by the user via `torch.serialization.add_safe_globals`. We recommend you start setting `weights_only=True` for any use case where you don't have full control of the loaded file. Please open an issue on GitHub for any issues related to this experimental feature.
  self.data, self.slices = torch.load(self.processed_paths[0])
