STDOUT:
Results will be saved in /home/philip/projects/llm_inference_code_repo/Circuit-Completion-Using-GNNs/component_classification_with_link_prediction_head/evaluation/FEGIN/results/model_FEGIN_dataset_ltspice_examples
Command line input: python main.py --data ltspice_examples --representation component_pin --model FEGIN --layers 3 --hiddens 128 --batch_size 64 --lr 0.01 --emb_size 512 --epochs 100 --save_appendix component_pin_L3_H128_BS64_LR0.01_E512 --no_val
 is saved.
-----
ltspice_examples - FEGIN
Using 3 layers, 128 hidden units, h = 2
Loading component_pin representation dataset
ENTERED
Training FEGIN on component_pin representation
Train: 3560, Test: 848
##################ITERATION #0 ****************************************
 epoch: 0, train_loss: 1.1666, test_loss: 1.3287, test_f1: 0.3049
 epoch: 1, train_loss: 1.0475, test_loss: 1.1058, test_f1: 0.3627
 epoch: 2, train_loss: 0.9957, test_loss: 1.0025, test_f1: 0.4414
 epoch: 3, train_loss: 0.9712, test_loss: 0.9676, test_f1: 0.4848
 epoch: 4, train_loss: 0.9301, test_loss: 1.0831, test_f1: 0.4450
 epoch: 5, train_loss: 0.8938, test_loss: 0.8887, test_f1: 0.4903
 epoch: 6, train_loss: 0.8804, test_loss: 0.8775, test_f1: 0.4968
 epoch: 7, train_loss: 0.8528, test_loss: 0.8713, test_f1: 0.5190
 epoch: 8, train_loss: 0.8670, test_loss: 0.9377, test_f1: 0.4722
 epoch: 9, train_loss: 0.8375, test_loss: 0.8097, test_f1: 0.5690
 epoch: 10, train_loss: 0.8069, test_loss: 0.9960, test_f1: 0.5036
 epoch: 11, train_loss: 0.8224, test_loss: 0.8333, test_f1: 0.5000
 epoch: 12, train_loss: 0.7950, test_loss: 0.8467, test_f1: 0.5105
 epoch: 13, train_loss: 0.7653, test_loss: 0.8122, test_f1: 0.5510
 epoch: 14, train_loss: 0.7775, test_loss: 0.7243, test_f1: 0.5706
 epoch: 15, train_loss: 0.7572, test_loss: 0.8047, test_f1: 0.5428
 epoch: 16, train_loss: 0.7489, test_loss: 0.7547, test_f1: 0.5611
 epoch: 17, train_loss: 0.7358, test_loss: 0.7024, test_f1: 0.6289
 epoch: 18, train_loss: 0.7236, test_loss: 0.7637, test_f1: 0.5487
 epoch: 19, train_loss: 0.7262, test_loss: 0.7314, test_f1: 0.5964
 epoch: 20, train_loss: 0.7002, test_loss: 0.7985, test_f1: 0.6051
 epoch: 21, train_loss: 0.6970, test_loss: 0.7624, test_f1: 0.6165
 epoch: 22, train_loss: 0.7041, test_loss: 0.7694, test_f1: 0.5769
 epoch: 23, train_loss: 0.6790, test_loss: 0.7804, test_f1: 0.6257
 epoch: 24, train_loss: 0.6682, test_loss: 0.6976, test_f1: 0.6251
 epoch: 25, train_loss: 0.6548, test_loss: 0.8206, test_f1: 0.6062
 epoch: 26, train_loss: 0.6708, test_loss: 0.8032, test_f1: 0.6304
 epoch: 27, train_loss: 0.6587, test_loss: 0.7853, test_f1: 0.6315
 epoch: 28, train_loss: 0.6270, test_loss: 0.7419, test_f1: 0.6201
 epoch: 29, train_loss: 0.6338, test_loss: 0.9002, test_f1: 0.6346
 epoch: 30, train_loss: 0.6377, test_loss: 0.9538, test_f1: 0.6454
 epoch: 31, train_loss: 0.6299, test_loss: 0.7752, test_f1: 0.5876
 epoch: 32, train_loss: 0.6228, test_loss: 0.7818, test_f1: 0.6373
 epoch: 33, train_loss: 0.6141, test_loss: 0.8963, test_f1: 0.6113
 epoch: 34, train_loss: 0.6065, test_loss: 0.6532, test_f1: 0.6744
 epoch: 35, train_loss: 0.5907, test_loss: 0.9324, test_f1: 0.6218
 epoch: 36, train_loss: 0.5853, test_loss: 0.8615, test_f1: 0.6053
 epoch: 37, train_loss: 0.5680, test_loss: 0.7568, test_f1: 0.6462
 epoch: 38, train_loss: 0.6111, test_loss: 1.1399, test_f1: 0.6223
 epoch: 39, train_loss: 0.5587, test_loss: 1.0757, test_f1: 0.6195
 epoch: 40, train_loss: 0.5546, test_loss: 0.7619, test_f1: 0.6412
 epoch: 41, train_loss: 0.5672, test_loss: 0.7388, test_f1: 0.6683
 epoch: 42, train_loss: 0.5573, test_loss: 0.7304, test_f1: 0.6534
 epoch: 43, train_loss: 0.5461, test_loss: 0.8521, test_f1: 0.6268
 epoch: 44, train_loss: 0.5501, test_loss: 0.7453, test_f1: 0.6411
 epoch: 45, train_loss: 0.5434, test_loss: 0.8214, test_f1: 0.6033
 epoch: 46, train_loss: 0.5395, test_loss: 0.6307, test_f1: 0.6629
 epoch: 47, train_loss: 0.5307, test_loss: 0.7802, test_f1: 0.6576
 epoch: 48, train_loss: 0.5080, test_loss: 0.8899, test_f1: 0.5958
 epoch: 49, train_loss: 0.5216, test_loss: 0.9108, test_f1: 0.6195
 epoch: 50, train_loss: 0.5103, test_loss: 0.8533, test_f1: 0.6677
 epoch: 51, train_loss: 0.4609, test_loss: 0.7701, test_f1: 0.6682
 epoch: 52, train_loss: 0.4299, test_loss: 0.6922, test_f1: 0.6825
 epoch: 53, train_loss: 0.4268, test_loss: 0.7973, test_f1: 0.6792
 epoch: 54, train_loss: 0.4218, test_loss: 0.7328, test_f1: 0.6822
 epoch: 55, train_loss: 0.4127, test_loss: 0.9040, test_f1: 0.6764
 epoch: 56, train_loss: 0.4009, test_loss: 0.8856, test_f1: 0.6772
 epoch: 57, train_loss: 0.4014, test_loss: 0.7609, test_f1: 0.6769
 epoch: 58, train_loss: 0.3934, test_loss: 0.8284, test_f1: 0.6698
 epoch: 59, train_loss: 0.3812, test_loss: 0.7998, test_f1: 0.7047
 epoch: 60, train_loss: 0.3632, test_loss: 0.7948, test_f1: 0.6885
 epoch: 61, train_loss: 0.4032, test_loss: 0.7693, test_f1: 0.6902
 epoch: 62, train_loss: 0.3813, test_loss: 0.8795, test_f1: 0.6620
 epoch: 63, train_loss: 0.3729, test_loss: 0.7861, test_f1: 0.6758
 epoch: 64, train_loss: 0.3662, test_loss: 0.7404, test_f1: 0.6771
 epoch: 65, train_loss: 0.3597, test_loss: 1.1080, test_f1: 0.6793
 epoch: 66, train_loss: 0.3521, test_loss: 0.8648, test_f1: 0.6805
 epoch: 67, train_loss: 0.3659, test_loss: 0.7897, test_f1: 0.6671
 epoch: 68, train_loss: 0.3350, test_loss: 0.7465, test_f1: 0.7054
 epoch: 69, train_loss: 0.3686, test_loss: 0.7433, test_f1: 0.6944
 epoch: 70, train_loss: 0.3419, test_loss: 0.8886, test_f1: 0.6870
 epoch: 71, train_loss: 0.3511, test_loss: 0.8032, test_f1: 0.6752
 epoch: 72, train_loss: 0.3373, test_loss: 0.7362, test_f1: 0.6927
 epoch: 73, train_loss: 0.3438, test_loss: 0.8397, test_f1: 0.6783
 epoch: 74, train_loss: 0.3328, test_loss: 0.7525, test_f1: 0.7325
 epoch: 75, train_loss: 0.3463, test_loss: 0.7868, test_f1: 0.7115
 epoch: 76, train_loss: 0.3025, test_loss: 0.8160, test_f1: 0.6964
 epoch: 77, train_loss: 0.2879, test_loss: 0.8794, test_f1: 0.7089
 epoch: 78, train_loss: 0.3275, test_loss: 0.7625, test_f1: 0.6763
 epoch: 79, train_loss: 0.2950, test_loss: 0.8380, test_f1: 0.7002
 epoch: 80, train_loss: 0.3017, test_loss: 0.8414, test_f1: 0.7088
 epoch: 81, train_loss: 0.2954, test_loss: 0.8034, test_f1: 0.6935
 epoch: 82, train_loss: 0.3271, test_loss: 0.7935, test_f1: 0.7010
 epoch: 83, train_loss: 0.3042, test_loss: 0.7737, test_f1: 0.7142
 epoch: 84, train_loss: 0.3051, test_loss: 0.7765, test_f1: 0.6959
 epoch: 85, train_loss: 0.2907, test_loss: 0.8281, test_f1: 0.7120
 epoch: 86, train_loss: 0.2937, test_loss: 0.8938, test_f1: 0.6962
 epoch: 87, train_loss: 0.2842, test_loss: 0.8777, test_f1: 0.6972
 epoch: 88, train_loss: 0.2783, test_loss: 0.8504, test_f1: 0.6963
 epoch: 89, train_loss: 0.2687, test_loss: 0.8422, test_f1: 0.6903
 epoch: 90, train_loss: 0.2919, test_loss: 0.8502, test_f1: 0.6974
 epoch: 91, train_loss: 0.2679, test_loss: 0.7962, test_f1: 0.7123
 epoch: 92, train_loss: 0.2838, test_loss: 0.8910, test_f1: 0.6762
 epoch: 93, train_loss: 0.2935, test_loss: 1.1941, test_f1: 0.6765
 epoch: 94, train_loss: 0.2591, test_loss: 0.7757, test_f1: 0.7100
 epoch: 95, train_loss: 0.2723, test_loss: 0.8988, test_f1: 0.7057
 epoch: 96, train_loss: 0.2675, test_loss: 0.8900, test_f1: 0.7000
 epoch: 97, train_loss: 0.2865, test_loss: 0.9342, test_f1: 0.6744
 epoch: 98, train_loss: 0.2655, test_loss: 1.1373, test_f1: 0.6679
 epoch: 99, train_loss: 0.2560, test_loss: 0.9364, test_f1: 0.7043
##################ITERATION #1 ****************************************
 epoch: 0, train_loss: 1.1483, test_loss: 1.2086, test_f1: 0.3781
 epoch: 1, train_loss: 1.0314, test_loss: 1.2224, test_f1: 0.4135
 epoch: 2, train_loss: 0.9737, test_loss: 1.0326, test_f1: 0.4880
 epoch: 3, train_loss: 0.9500, test_loss: 1.1962, test_f1: 0.4498
 epoch: 4, train_loss: 0.9357, test_loss: 1.1574, test_f1: 0.4320
 epoch: 5, train_loss: 0.9080, test_loss: 0.9718, test_f1: 0.5352
 epoch: 6, train_loss: 0.9120, test_loss: 1.0369, test_f1: 0.4542
 epoch: 7, train_loss: 0.8860, test_loss: 0.9403, test_f1: 0.5213
 epoch: 8, train_loss: 0.8594, test_loss: 0.9989, test_f1: 0.5445
 epoch: 9, train_loss: 0.8602, test_loss: 0.8871, test_f1: 0.5536
 epoch: 10, train_loss: 0.8399, test_loss: 0.9759, test_f1: 0.5520
 epoch: 11, train_loss: 0.8146, test_loss: 1.2281, test_f1: 0.4643
 epoch: 12, train_loss: 0.8430, test_loss: 0.9251, test_f1: 0.5061
 epoch: 13, train_loss: 0.8239, test_loss: 1.0580, test_f1: 0.4965
 epoch: 14, train_loss: 0.8257, test_loss: 0.9496, test_f1: 0.5056
 epoch: 15, train_loss: 0.8118, test_loss: 0.9646, test_f1: 0.4820
 epoch: 16, train_loss: 0.7920, test_loss: 0.9410, test_f1: 0.5172
 epoch: 17, train_loss: 0.7989, test_loss: 1.0778, test_f1: 0.5461
 epoch: 18, train_loss: 0.7735, test_loss: 0.8695, test_f1: 0.5417
 epoch: 19, train_loss: 0.7682, test_loss: 0.8373, test_f1: 0.5578
 epoch: 20, train_loss: 0.7527, test_loss: 0.9219, test_f1: 0.5004
 epoch: 21, train_loss: 0.7435, test_loss: 0.8678, test_f1: 0.5891
 epoch: 22, train_loss: 0.7483, test_loss: 1.3152, test_f1: 0.5124
 epoch: 23, train_loss: 0.7402, test_loss: 0.8841, test_f1: 0.5666
 epoch: 24, train_loss: 0.7325, test_loss: 0.9472, test_f1: 0.6098
 epoch: 25, train_loss: 0.7162, test_loss: 0.9071, test_f1: 0.6353
 epoch: 26, train_loss: 0.7283, test_loss: 0.9792, test_f1: 0.5847
 epoch: 27, train_loss: 0.7273, test_loss: 0.9574, test_f1: 0.5372
 epoch: 28, train_loss: 0.7042, test_loss: 0.9119, test_f1: 0.6240
 epoch: 29, train_loss: 0.7003, test_loss: 1.1878, test_f1: 0.5385
 epoch: 30, train_loss: 0.6892, test_loss: 0.9447, test_f1: 0.6028
 epoch: 31, train_loss: 0.6854, test_loss: 0.7787, test_f1: 0.6259
 epoch: 32, train_loss: 0.6959, test_loss: 0.9100, test_f1: 0.5790
 epoch: 33, train_loss: 0.6723, test_loss: 0.8660, test_f1: 0.6127
 epoch: 34, train_loss: 0.6717, test_loss: 0.9654, test_f1: 0.6137
 epoch: 35, train_loss: 0.6536, test_loss: 0.7829, test_f1: 0.6169
 epoch: 36, train_loss: 0.6515, test_loss: 0.8935, test_f1: 0.5880
 epoch: 37, train_loss: 0.6583, test_loss: 1.0468, test_f1: 0.6319
 epoch: 38, train_loss: 0.6369, test_loss: 0.9132, test_f1: 0.6022
 epoch: 39, train_loss: 0.6120, test_loss: 1.0534, test_f1: 0.5979
 epoch: 40, train_loss: 0.6266, test_loss: 1.0067, test_f1: 0.5817
 epoch: 41, train_loss: 0.5974, test_loss: 1.0638, test_f1: 0.6110
 epoch: 42, train_loss: 0.6121, test_loss: 1.0126, test_f1: 0.6303
 epoch: 43, train_loss: 0.6024, test_loss: 0.9010, test_f1: 0.6631
 epoch: 44, train_loss: 0.6196, test_loss: 1.0369, test_f1: 0.6285
 epoch: 45, train_loss: 0.6234, test_loss: 0.9714, test_f1: 0.6367
 epoch: 46, train_loss: 0.5835, test_loss: 0.9988, test_f1: 0.6145
 epoch: 47, train_loss: 0.5672, test_loss: 1.0420, test_f1: 0.6147
 epoch: 48, train_loss: 0.6003, test_loss: 1.0785, test_f1: 0.6573
 epoch: 49, train_loss: 0.5510, test_loss: 1.1771, test_f1: 0.6344
 epoch: 50, train_loss: 0.5689, test_loss: 1.3117, test_f1: 0.5794
 epoch: 51, train_loss: 0.5181, test_loss: 1.0639, test_f1: 0.6478
 epoch: 52, train_loss: 0.4959, test_loss: 1.1821, test_f1: 0.6383
 epoch: 53, train_loss: 0.4877, test_loss: 1.2276, test_f1: 0.6423
 epoch: 54, train_loss: 0.4669, test_loss: 1.3012, test_f1: 0.6498
 epoch: 55, train_loss: 0.4609, test_loss: 1.0848, test_f1: 0.6646
 epoch: 56, train_loss: 0.4675, test_loss: 1.1710, test_f1: 0.6488
 epoch: 57, train_loss: 0.4398, test_loss: 1.1239, test_f1: 0.6408
 epoch: 58, train_loss: 0.4555, test_loss: 1.1664, test_f1: 0.6569
 epoch: 59, train_loss: 0.4570, test_loss: 1.1477, test_f1: 0.6511
 epoch: 60, train_loss: 0.4444, test_loss: 1.2370, test_f1: 0.6280
 epoch: 61, train_loss: 0.4372, test_loss: 1.2833, test_f1: 0.6325
 epoch: 62, train_loss: 0.4318, test_loss: 1.3072, test_f1: 0.6624
 epoch: 63, train_loss: 0.4458, test_loss: 1.3558, test_f1: 0.6307
 epoch: 64, train_loss: 0.4393, test_loss: 1.3066, test_f1: 0.6495
 epoch: 65, train_loss: 0.4179, test_loss: 1.2956, test_f1: 0.6638
 epoch: 66, train_loss: 0.4146, test_loss: 1.3164, test_f1: 0.6276
 epoch: 67, train_loss: 0.4233, test_loss: 1.2724, test_f1: 0.6872
 epoch: 68, train_loss: 0.4074, test_loss: 1.3246, test_f1: 0.6707
 epoch: 69, train_loss: 0.4090, test_loss: 1.3465, test_f1: 0.6688
 epoch: 70, train_loss: 0.4034, test_loss: 1.4085, test_f1: 0.6729
 epoch: 71, train_loss: 0.3810, test_loss: 1.4694, test_f1: 0.6529
 epoch: 72, train_loss: 0.4111, test_loss: 1.3879, test_f1: 0.6823
 epoch: 73, train_loss: 0.3628, test_loss: 1.5357, test_f1: 0.6602
 epoch: 74, train_loss: 0.3754, test_loss: 1.4908, test_f1: 0.6716
 epoch: 75, train_loss: 0.3987, test_loss: 1.3266, test_f1: 0.6596
 epoch: 76, train_loss: 0.3788, test_loss: 1.5349, test_f1: 0.6568
 epoch: 77, train_loss: 0.3860, test_loss: 1.3208, test_f1: 0.6683
 epoch: 78, train_loss: 0.3772, test_loss: 1.2855, test_f1: 0.6828
 epoch: 79, train_loss: 0.3808, test_loss: 1.4733, test_f1: 0.6667
 epoch: 80, train_loss: 0.3883, test_loss: 1.4760, test_f1: 0.6838
 epoch: 81, train_loss: 0.3889, test_loss: 1.4404, test_f1: 0.6650
 epoch: 82, train_loss: 0.3496, test_loss: 1.4029, test_f1: 0.6625
 epoch: 83, train_loss: 0.3645, test_loss: 1.4628, test_f1: 0.6590
 epoch: 84, train_loss: 0.3498, test_loss: 1.3551, test_f1: 0.6953
 epoch: 85, train_loss: 0.3544, test_loss: 1.4772, test_f1: 0.6686
 epoch: 86, train_loss: 0.3403, test_loss: 1.4448, test_f1: 0.6977
 epoch: 87, train_loss: 0.3339, test_loss: 1.4181, test_f1: 0.6777
 epoch: 88, train_loss: 0.3314, test_loss: 1.5353, test_f1: 0.6664
 epoch: 89, train_loss: 0.3581, test_loss: 1.3887, test_f1: 0.6634
 epoch: 90, train_loss: 0.3448, test_loss: 1.4047, test_f1: 0.6676
 epoch: 91, train_loss: 0.3342, test_loss: 1.5596, test_f1: 0.6565
 epoch: 92, train_loss: 0.2979, test_loss: 1.4601, test_f1: 0.6694
 epoch: 93, train_loss: 0.3131, test_loss: 1.5510, test_f1: 0.6648
 epoch: 94, train_loss: 0.3151, test_loss: 1.5926, test_f1: 0.6526
 epoch: 95, train_loss: 0.3263, test_loss: 1.5606, test_f1: 0.6595
 epoch: 96, train_loss: 0.3020, test_loss: 1.5098, test_f1: 0.6563
 epoch: 97, train_loss: 0.2976, test_loss: 1.5534, test_f1: 0.6666
 epoch: 98, train_loss: 0.3181, test_loss: 1.4536, test_f1: 0.6834
 epoch: 99, train_loss: 0.2845, test_loss: 1.6153, test_f1: 0.6880
##################ITERATION #2 ****************************************
 epoch: 0, train_loss: 1.2223, test_loss: 1.4943, test_f1: 0.4101
 epoch: 1, train_loss: 1.0018, test_loss: 1.0649, test_f1: 0.4960
 epoch: 2, train_loss: 0.9710, test_loss: 0.9870, test_f1: 0.4808
 epoch: 3, train_loss: 0.9501, test_loss: 1.0049, test_f1: 0.5057
 epoch: 4, train_loss: 0.9202, test_loss: 1.0531, test_f1: 0.4692
 epoch: 5, train_loss: 0.9055, test_loss: 0.9765, test_f1: 0.5134
 epoch: 6, train_loss: 0.8990, test_loss: 1.1989, test_f1: 0.3872
 epoch: 7, train_loss: 0.8763, test_loss: 0.9232, test_f1: 0.5150
 epoch: 8, train_loss: 0.8677, test_loss: 0.8348, test_f1: 0.5314
 epoch: 9, train_loss: 0.8333, test_loss: 1.4646, test_f1: 0.4042
 epoch: 10, train_loss: 0.8374, test_loss: 0.8848, test_f1: 0.5378
 epoch: 11, train_loss: 0.8241, test_loss: 0.9341, test_f1: 0.5272
 epoch: 12, train_loss: 0.8064, test_loss: 1.0353, test_f1: 0.4737
 epoch: 13, train_loss: 0.8107, test_loss: 0.9460, test_f1: 0.5238
 epoch: 14, train_loss: 0.7845, test_loss: 1.1182, test_f1: 0.5370
 epoch: 15, train_loss: 0.7882, test_loss: 0.9053, test_f1: 0.5920
 epoch: 16, train_loss: 0.7812, test_loss: 1.0300, test_f1: 0.4766
 epoch: 17, train_loss: 0.7586, test_loss: 1.0921, test_f1: 0.4818
 epoch: 18, train_loss: 0.7511, test_loss: 1.7086, test_f1: 0.3961
 epoch: 19, train_loss: 0.7534, test_loss: 0.8578, test_f1: 0.6060
 epoch: 20, train_loss: 0.7392, test_loss: 0.8453, test_f1: 0.6325
 epoch: 21, train_loss: 0.7134, test_loss: 0.8362, test_f1: 0.5736
 epoch: 22, train_loss: 0.7222, test_loss: 0.9440, test_f1: 0.5408
 epoch: 23, train_loss: 0.7134, test_loss: 0.8849, test_f1: 0.5437
 epoch: 24, train_loss: 0.7040, test_loss: 0.7376, test_f1: 0.6192
 epoch: 25, train_loss: 0.6871, test_loss: 0.9014, test_f1: 0.6291
 epoch: 26, train_loss: 0.6719, test_loss: 0.8253, test_f1: 0.5685
 epoch: 27, train_loss: 0.6770, test_loss: 1.0739, test_f1: 0.5572
 epoch: 28, train_loss: 0.6718, test_loss: 0.9084, test_f1: 0.6045
 epoch: 29, train_loss: 0.6772, test_loss: 0.8643, test_f1: 0.6163
 epoch: 30, train_loss: 0.6889, test_loss: 0.8121, test_f1: 0.5952
 epoch: 31, train_loss: 0.6728, test_loss: 1.0205, test_f1: 0.5731
 epoch: 32, train_loss: 0.6458, test_loss: 1.0373, test_f1: 0.6007
 epoch: 33, train_loss: 0.6500, test_loss: 1.1341, test_f1: 0.5781
 epoch: 34, train_loss: 0.6422, test_loss: 0.8569, test_f1: 0.6270
 epoch: 35, train_loss: 0.6264, test_loss: 0.8139, test_f1: 0.6321
 epoch: 36, train_loss: 0.6362, test_loss: 1.0471, test_f1: 0.5711
 epoch: 37, train_loss: 0.6155, test_loss: 0.8366, test_f1: 0.6498
 epoch: 38, train_loss: 0.6428, test_loss: 1.0062, test_f1: 0.5405
 epoch: 39, train_loss: 0.6180, test_loss: 0.9233, test_f1: 0.6518
 epoch: 40, train_loss: 0.6109, test_loss: 0.8635, test_f1: 0.6482
 epoch: 41, train_loss: 0.6012, test_loss: 1.0656, test_f1: 0.5726
 epoch: 42, train_loss: 0.5930, test_loss: 1.0897, test_f1: 0.5878
 epoch: 43, train_loss: 0.5934, test_loss: 0.8574, test_f1: 0.5961
 epoch: 44, train_loss: 0.5976, test_loss: 1.0977, test_f1: 0.6159
 epoch: 45, train_loss: 0.5825, test_loss: 0.9079, test_f1: 0.6450
 epoch: 46, train_loss: 0.5739, test_loss: 0.9506, test_f1: 0.5952
 epoch: 47, train_loss: 0.5448, test_loss: 0.9562, test_f1: 0.6587
 epoch: 48, train_loss: 0.5525, test_loss: 1.0283, test_f1: 0.6539
 epoch: 49, train_loss: 0.5517, test_loss: 0.8492, test_f1: 0.6405
 epoch: 50, train_loss: 0.5577, test_loss: 1.2690, test_f1: 0.6099
 epoch: 51, train_loss: 0.5025, test_loss: 1.0911, test_f1: 0.6486
 epoch: 52, train_loss: 0.4598, test_loss: 1.0468, test_f1: 0.6364
 epoch: 53, train_loss: 0.4815, test_loss: 1.1337, test_f1: 0.6317
 epoch: 54, train_loss: 0.4583, test_loss: 1.0473, test_f1: 0.6488
 epoch: 55, train_loss: 0.4661, test_loss: 1.0735, test_f1: 0.6309
 epoch: 56, train_loss: 0.4455, test_loss: 1.1756, test_f1: 0.6409
 epoch: 57, train_loss: 0.4339, test_loss: 1.1209, test_f1: 0.6718
 epoch: 58, train_loss: 0.4231, test_loss: 1.3366, test_f1: 0.6382
 epoch: 59, train_loss: 0.4464, test_loss: 1.2582, test_f1: 0.6688
 epoch: 60, train_loss: 0.4364, test_loss: 1.3465, test_f1: 0.6723
 epoch: 61, train_loss: 0.4046, test_loss: 1.1598, test_f1: 0.6678
 epoch: 62, train_loss: 0.4148, test_loss: 1.2315, test_f1: 0.6465
 epoch: 63, train_loss: 0.4141, test_loss: 1.2533, test_f1: 0.6455
 epoch: 64, train_loss: 0.4255, test_loss: 1.2964, test_f1: 0.6671
 epoch: 65, train_loss: 0.4189, test_loss: 1.3563, test_f1: 0.6360
 epoch: 66, train_loss: 0.4077, test_loss: 1.1833, test_f1: 0.6760
 epoch: 67, train_loss: 0.4093, test_loss: 1.3361, test_f1: 0.6526
 epoch: 68, train_loss: 0.3816, test_loss: 1.4100, test_f1: 0.6616
 epoch: 69, train_loss: 0.4158, test_loss: 1.3144, test_f1: 0.6581
 epoch: 70, train_loss: 0.3974, test_loss: 1.3781, test_f1: 0.6516
 epoch: 71, train_loss: 0.3780, test_loss: 1.2819, test_f1: 0.6803
 epoch: 72, train_loss: 0.3667, test_loss: 1.2966, test_f1: 0.6510
 epoch: 73, train_loss: 0.3692, test_loss: 1.2997, test_f1: 0.6660
 epoch: 74, train_loss: 0.3840, test_loss: 1.3021, test_f1: 0.6453
 epoch: 75, train_loss: 0.3704, test_loss: 1.2514, test_f1: 0.6634
 epoch: 76, train_loss: 0.3860, test_loss: 1.3439, test_f1: 0.6681
 epoch: 77, train_loss: 0.3733, test_loss: 1.3507, test_f1: 0.6799
 epoch: 78, train_loss: 0.3654, test_loss: 1.4204, test_f1: 0.6781
 epoch: 79, train_loss: 0.3779, test_loss: 1.3190, test_f1: 0.6746
 epoch: 80, train_loss: 0.3653, test_loss: 1.1496, test_f1: 0.6547
 epoch: 81, train_loss: 0.3695, test_loss: 1.3932, test_f1: 0.6472
 epoch: 82, train_loss: 0.3579, test_loss: 1.3593, test_f1: 0.6665
 epoch: 83, train_loss: 0.3401, test_loss: 1.3883, test_f1: 0.6699
 epoch: 84, train_loss: 0.3410, test_loss: 1.4877, test_f1: 0.6534
 epoch: 85, train_loss: 0.3674, test_loss: 1.4000, test_f1: 0.6578
 epoch: 86, train_loss: 0.3692, test_loss: 1.2634, test_f1: 0.6444
 epoch: 87, train_loss: 0.3374, test_loss: 1.8214, test_f1: 0.6675
 epoch: 88, train_loss: 0.3483, test_loss: 1.6514, test_f1: 0.6500
 epoch: 89, train_loss: 0.3427, test_loss: 1.3065, test_f1: 0.6723
 epoch: 90, train_loss: 0.3550, test_loss: 1.4275, test_f1: 0.6739
 epoch: 91, train_loss: 0.3456, test_loss: 1.3712, test_f1: 0.6666
 epoch: 92, train_loss: 0.3276, test_loss: 1.4816, test_f1: 0.6641
 epoch: 93, train_loss: 0.3138, test_loss: 1.2641, test_f1: 0.6922
 epoch: 94, train_loss: 0.3051, test_loss: 1.4425, test_f1: 0.6871
 epoch: 95, train_loss: 0.3240, test_loss: 1.4676, test_f1: 0.6773
 epoch: 96, train_loss: 0.3396, test_loss: 1.4336, test_f1: 0.6743
 epoch: 97, train_loss: 0.3107, test_loss: 1.6472, test_f1: 0.6482
 epoch: 98, train_loss: 0.3513, test_loss: 1.4088, test_f1: 0.6829
 epoch: 99, train_loss: 0.2962, test_loss: 1.5674, test_f1: 0.6829
##################ITERATION #3 ****************************************
 epoch: 0, train_loss: 1.1455, test_loss: 1.0221, test_f1: 0.4914
 epoch: 1, train_loss: 0.9993, test_loss: 0.9946, test_f1: 0.5107
 epoch: 2, train_loss: 0.9621, test_loss: 1.2905, test_f1: 0.4234
 epoch: 3, train_loss: 0.9395, test_loss: 1.0642, test_f1: 0.4555
 epoch: 4, train_loss: 0.9337, test_loss: 0.9936, test_f1: 0.4500
 epoch: 5, train_loss: 0.9349, test_loss: 0.9083, test_f1: 0.5042
 epoch: 6, train_loss: 0.8981, test_loss: 0.8676, test_f1: 0.5245
 epoch: 7, train_loss: 0.9173, test_loss: 0.9817, test_f1: 0.4664
 epoch: 8, train_loss: 0.8799, test_loss: 0.8909, test_f1: 0.5052
 epoch: 9, train_loss: 0.8557, test_loss: 0.9204, test_f1: 0.5156
 epoch: 10, train_loss: 0.8585, test_loss: 0.9985, test_f1: 0.4924
 epoch: 11, train_loss: 0.8186, test_loss: 0.8788, test_f1: 0.4657
 epoch: 12, train_loss: 0.8197, test_loss: 0.8421, test_f1: 0.5402
 epoch: 13, train_loss: 0.8092, test_loss: 0.8825, test_f1: 0.5766
 epoch: 14, train_loss: 0.8147, test_loss: 0.8187, test_f1: 0.5494
 epoch: 15, train_loss: 0.7724, test_loss: 0.8059, test_f1: 0.5665
 epoch: 16, train_loss: 0.7679, test_loss: 0.8271, test_f1: 0.5861
 epoch: 17, train_loss: 0.7596, test_loss: 0.7958, test_f1: 0.5384
 epoch: 18, train_loss: 0.7654, test_loss: 1.0071, test_f1: 0.4662
 epoch: 19, train_loss: 0.7893, test_loss: 0.8314, test_f1: 0.6146
 epoch: 20, train_loss: 0.7534, test_loss: 0.9391, test_f1: 0.5485
 epoch: 21, train_loss: 0.7506, test_loss: 0.8057, test_f1: 0.5459
 epoch: 22, train_loss: 0.7253, test_loss: 0.7508, test_f1: 0.5758
 epoch: 23, train_loss: 0.7246, test_loss: 0.7381, test_f1: 0.6218
 epoch: 24, train_loss: 0.7245, test_loss: 0.8752, test_f1: 0.5726
 epoch: 25, train_loss: 0.7148, test_loss: 0.9189, test_f1: 0.5590
 epoch: 26, train_loss: 0.7314, test_loss: 0.7728, test_f1: 0.5850
 epoch: 27, train_loss: 0.7045, test_loss: 0.8063, test_f1: 0.5854
 epoch: 28, train_loss: 0.7157, test_loss: 1.0036, test_f1: 0.5673
 epoch: 29, train_loss: 0.6897, test_loss: 1.0257, test_f1: 0.5433
 epoch: 30, train_loss: 0.7087, test_loss: 0.8660, test_f1: 0.5911
 epoch: 31, train_loss: 0.6704, test_loss: 0.7944, test_f1: 0.6243
 epoch: 32, train_loss: 0.6810, test_loss: 0.7927, test_f1: 0.5722
 epoch: 33, train_loss: 0.6414, test_loss: 1.1391, test_f1: 0.5634
 epoch: 34, train_loss: 0.6689, test_loss: 0.9425, test_f1: 0.6341
 epoch: 35, train_loss: 0.6783, test_loss: 0.8908, test_f1: 0.5169
 epoch: 36, train_loss: 0.6555, test_loss: 0.8028, test_f1: 0.6091
 epoch: 37, train_loss: 0.6414, test_loss: 0.7390, test_f1: 0.6470
 epoch: 38, train_loss: 0.6544, test_loss: 0.8107, test_f1: 0.5598
 epoch: 39, train_loss: 0.6143, test_loss: 0.7052, test_f1: 0.6263
 epoch: 40, train_loss: 0.6287, test_loss: 0.7351, test_f1: 0.6444
 epoch: 41, train_loss: 0.6252, test_loss: 0.8103, test_f1: 0.6455
 epoch: 42, train_loss: 0.6029, test_loss: 0.7986, test_f1: 0.6188
 epoch: 43, train_loss: 0.6207, test_loss: 0.9795, test_f1: 0.5909
 epoch: 44, train_loss: 0.6149, test_loss: 0.8505, test_f1: 0.6408
 epoch: 45, train_loss: 0.6051, test_loss: 0.6992, test_f1: 0.6430
 epoch: 46, train_loss: 0.6074, test_loss: 0.8222, test_f1: 0.6410
 epoch: 47, train_loss: 0.5882, test_loss: 0.6935, test_f1: 0.6366
 epoch: 48, train_loss: 0.5773, test_loss: 0.7797, test_f1: 0.6067
 epoch: 49, train_loss: 0.5780, test_loss: 0.7707, test_f1: 0.6396
 epoch: 50, train_loss: 0.5831, test_loss: 1.0026, test_f1: 0.6137
 epoch: 51, train_loss: 0.5523, test_loss: 0.7158, test_f1: 0.6401
 epoch: 52, train_loss: 0.4815, test_loss: 0.8268, test_f1: 0.6465
 epoch: 53, train_loss: 0.5005, test_loss: 0.7156, test_f1: 0.6517
 epoch: 54, train_loss: 0.4847, test_loss: 0.7481, test_f1: 0.6669
 epoch: 55, train_loss: 0.4916, test_loss: 0.7397, test_f1: 0.6727
 epoch: 56, train_loss: 0.4771, test_loss: 0.8702, test_f1: 0.6327
 epoch: 57, train_loss: 0.4781, test_loss: 0.8407, test_f1: 0.6448
 epoch: 58, train_loss: 0.4828, test_loss: 0.7555, test_f1: 0.6693
 epoch: 59, train_loss: 0.4784, test_loss: 0.7348, test_f1: 0.7112
 epoch: 60, train_loss: 0.4518, test_loss: 0.8285, test_f1: 0.6632
 epoch: 61, train_loss: 0.4674, test_loss: 0.8594, test_f1: 0.6672
 epoch: 62, train_loss: 0.4552, test_loss: 0.8887, test_f1: 0.6313
 epoch: 63, train_loss: 0.4597, test_loss: 0.7696, test_f1: 0.6815
 epoch: 64, train_loss: 0.4374, test_loss: 0.9289, test_f1: 0.6630
 epoch: 65, train_loss: 0.4488, test_loss: 0.7756, test_f1: 0.6676
 epoch: 66, train_loss: 0.4361, test_loss: 0.9780, test_f1: 0.6536
 epoch: 67, train_loss: 0.4449, test_loss: 0.7113, test_f1: 0.7188
 epoch: 68, train_loss: 0.4259, test_loss: 0.8530, test_f1: 0.7042
 epoch: 69, train_loss: 0.4330, test_loss: 0.8631, test_f1: 0.6662
 epoch: 70, train_loss: 0.4080, test_loss: 0.9238, test_f1: 0.6760
 epoch: 71, train_loss: 0.4221, test_loss: 0.8432, test_f1: 0.6558
 epoch: 72, train_loss: 0.4228, test_loss: 0.7478, test_f1: 0.6507
 epoch: 73, train_loss: 0.4450, test_loss: 0.7802, test_f1: 0.6454
 epoch: 74, train_loss: 0.4032, test_loss: 0.9395, test_f1: 0.6590
 epoch: 75, train_loss: 0.3980, test_loss: 0.8188, test_f1: 0.6869
 epoch: 76, train_loss: 0.3917, test_loss: 0.7731, test_f1: 0.7123
 epoch: 77, train_loss: 0.3848, test_loss: 0.8397, test_f1: 0.6979
 epoch: 78, train_loss: 0.3997, test_loss: 0.8870, test_f1: 0.6795
 epoch: 79, train_loss: 0.3942, test_loss: 0.8247, test_f1: 0.6775
 epoch: 80, train_loss: 0.3940, test_loss: 0.9040, test_f1: 0.6621
 epoch: 81, train_loss: 0.3746, test_loss: 0.8845, test_f1: 0.6733
 epoch: 82, train_loss: 0.3911, test_loss: 0.8957, test_f1: 0.6869
 epoch: 83, train_loss: 0.3994, test_loss: 1.0742, test_f1: 0.6666
 epoch: 84, train_loss: 0.3783, test_loss: 1.0849, test_f1: 0.6691
 epoch: 85, train_loss: 0.3670, test_loss: 1.0274, test_f1: 0.6908
 epoch: 86, train_loss: 0.3509, test_loss: 0.9350, test_f1: 0.6606
 epoch: 87, train_loss: 0.3828, test_loss: 0.9250, test_f1: 0.6502
 epoch: 88, train_loss: 0.3586, test_loss: 0.9389, test_f1: 0.6694
 epoch: 89, train_loss: 0.3605, test_loss: 0.9425, test_f1: 0.6478
 epoch: 90, train_loss: 0.3698, test_loss: 0.8254, test_f1: 0.6864
 epoch: 91, train_loss: 0.3781, test_loss: 1.0327, test_f1: 0.6741
 epoch: 92, train_loss: 0.3654, test_loss: 0.8727, test_f1: 0.6966
 epoch: 93, train_loss: 0.3463, test_loss: 0.9596, test_f1: 0.6623
 epoch: 94, train_loss: 0.3517, test_loss: 0.8026, test_f1: 0.6875
 epoch: 95, train_loss: 0.3495, test_loss: 0.8320, test_f1: 0.6909
 epoch: 96, train_loss: 0.3440, test_loss: 1.1181, test_f1: 0.6440
 epoch: 97, train_loss: 0.3186, test_loss: 0.8868, test_f1: 0.6788
 epoch: 98, train_loss: 0.3426, test_loss: 0.8579, test_f1: 0.7019
 epoch: 99, train_loss: 0.3329, test_loss: 0.9053, test_f1: 0.6882
##################ITERATION #4 ****************************************
 epoch: 0, train_loss: 1.1434, test_loss: 1.0797, test_f1: 0.4994
 epoch: 1, train_loss: 0.9714, test_loss: 1.0121, test_f1: 0.4893
 epoch: 2, train_loss: 0.9385, test_loss: 0.9844, test_f1: 0.5254
 epoch: 3, train_loss: 0.9238, test_loss: 1.0012, test_f1: 0.4206
 epoch: 4, train_loss: 0.9135, test_loss: 0.9030, test_f1: 0.5423
 epoch: 5, train_loss: 0.8838, test_loss: 1.4256, test_f1: 0.4296
 epoch: 6, train_loss: 0.8692, test_loss: 0.9555, test_f1: 0.5229
 epoch: 7, train_loss: 0.8674, test_loss: 0.8949, test_f1: 0.5381
 epoch: 8, train_loss: 0.8547, test_loss: 0.8617, test_f1: 0.5138
 epoch: 9, train_loss: 0.8429, test_loss: 0.8188, test_f1: 0.5447
 epoch: 10, train_loss: 0.8099, test_loss: 0.8792, test_f1: 0.5171
 epoch: 11, train_loss: 0.8002, test_loss: 1.0501, test_f1: 0.4712
 epoch: 12, train_loss: 0.7986, test_loss: 0.8712, test_f1: 0.5495
 epoch: 13, train_loss: 0.7932, test_loss: 1.0537, test_f1: 0.5160
 epoch: 14, train_loss: 0.7880, test_loss: 0.9162, test_f1: 0.5624
 epoch: 15, train_loss: 0.7679, test_loss: 0.9734, test_f1: 0.5922
 epoch: 16, train_loss: 0.7599, test_loss: 0.9751, test_f1: 0.5723
 epoch: 17, train_loss: 0.7537, test_loss: 0.8994, test_f1: 0.5289
 epoch: 18, train_loss: 0.7494, test_loss: 1.0584, test_f1: 0.5790
 epoch: 19, train_loss: 0.7328, test_loss: 0.9556, test_f1: 0.5786
 epoch: 20, train_loss: 0.7151, test_loss: 0.8979, test_f1: 0.5267
 epoch: 21, train_loss: 0.7106, test_loss: 0.8458, test_f1: 0.5702
 epoch: 22, train_loss: 0.6980, test_loss: 1.0127, test_f1: 0.5698
 epoch: 23, train_loss: 0.7216, test_loss: 1.0896, test_f1: 0.5390
 epoch: 24, train_loss: 0.6832, test_loss: 0.8372, test_f1: 0.6052
 epoch: 25, train_loss: 0.6964, test_loss: 0.8821, test_f1: 0.5936
 epoch: 26, train_loss: 0.6852, test_loss: 1.0753, test_f1: 0.6067
 epoch: 27, train_loss: 0.6820, test_loss: 0.9514, test_f1: 0.5590
 epoch: 28, train_loss: 0.6561, test_loss: 1.3973, test_f1: 0.5078
 epoch: 29, train_loss: 0.6578, test_loss: 1.2740, test_f1: 0.5102
 epoch: 30, train_loss: 0.6548, test_loss: 0.9184, test_f1: 0.6011
 epoch: 31, train_loss: 0.6609, test_loss: 0.8683, test_f1: 0.6093
 epoch: 32, train_loss: 0.6252, test_loss: 0.9801, test_f1: 0.6068
 epoch: 33, train_loss: 0.6376, test_loss: 1.1072, test_f1: 0.6136
 epoch: 34, train_loss: 0.6282, test_loss: 0.8861, test_f1: 0.6176
 epoch: 35, train_loss: 0.6221, test_loss: 0.9980, test_f1: 0.5744
 epoch: 36, train_loss: 0.6371, test_loss: 0.9386, test_f1: 0.6347
 epoch: 37, train_loss: 0.6192, test_loss: 0.9875, test_f1: 0.6424
 epoch: 38, train_loss: 0.6288, test_loss: 0.8199, test_f1: 0.6116
 epoch: 39, train_loss: 0.6118, test_loss: 0.9042, test_f1: 0.6266
 epoch: 40, train_loss: 0.6152, test_loss: 1.2340, test_f1: 0.5007
 epoch: 41, train_loss: 0.6478, test_loss: 0.8033, test_f1: 0.6665
 epoch: 42, train_loss: 0.5793, test_loss: 0.9268, test_f1: 0.6195
 epoch: 43, train_loss: 0.5898, test_loss: 0.9723, test_f1: 0.6020
 epoch: 44, train_loss: 0.5855, test_loss: 0.7494, test_f1: 0.6528
 epoch: 45, train_loss: 0.5526, test_loss: 0.8065, test_f1: 0.6500
 epoch: 46, train_loss: 0.5692, test_loss: 0.7640, test_f1: 0.6121
 epoch: 47, train_loss: 0.5699, test_loss: 0.9885, test_f1: 0.6136
 epoch: 48, train_loss: 0.5527, test_loss: 0.7829, test_f1: 0.6159
 epoch: 49, train_loss: 0.5444, test_loss: 0.8597, test_f1: 0.6303
 epoch: 50, train_loss: 0.5473, test_loss: 1.1609, test_f1: 0.6156
 epoch: 51, train_loss: 0.4988, test_loss: 0.9298, test_f1: 0.6686
 epoch: 52, train_loss: 0.4548, test_loss: 0.8993, test_f1: 0.6761
 epoch: 53, train_loss: 0.4571, test_loss: 0.8949, test_f1: 0.6606
 epoch: 54, train_loss: 0.4418, test_loss: 0.9382, test_f1: 0.6683
 epoch: 55, train_loss: 0.4576, test_loss: 0.8698, test_f1: 0.6513
 epoch: 56, train_loss: 0.4244, test_loss: 0.8623, test_f1: 0.6737
 epoch: 57, train_loss: 0.4324, test_loss: 0.9005, test_f1: 0.6766
 epoch: 58, train_loss: 0.4203, test_loss: 1.0069, test_f1: 0.6485
 epoch: 59, train_loss: 0.4298, test_loss: 0.9259, test_f1: 0.6714
 epoch: 60, train_loss: 0.4088, test_loss: 0.8731, test_f1: 0.6888
 epoch: 61, train_loss: 0.3933, test_loss: 0.9313, test_f1: 0.6537
 epoch: 62, train_loss: 0.3869, test_loss: 0.9266, test_f1: 0.6843
 epoch: 63, train_loss: 0.3966, test_loss: 0.9931, test_f1: 0.6860
 epoch: 64, train_loss: 0.3874, test_loss: 0.9248, test_f1: 0.6874
 epoch: 65, train_loss: 0.3936, test_loss: 0.8731, test_f1: 0.6868
 epoch: 66, train_loss: 0.3793, test_loss: 0.9066, test_f1: 0.6449
 epoch: 67, train_loss: 0.4060, test_loss: 0.8345, test_f1: 0.6927
 epoch: 68, train_loss: 0.3647, test_loss: 0.8121, test_f1: 0.6832
 epoch: 69, train_loss: 0.3618, test_loss: 1.0887, test_f1: 0.6525
 epoch: 70, train_loss: 0.3922, test_loss: 0.8781, test_f1: 0.6880
 epoch: 71, train_loss: 0.3739, test_loss: 0.8268, test_f1: 0.6758
 epoch: 72, train_loss: 0.3366, test_loss: 1.0065, test_f1: 0.6515
 epoch: 73, train_loss: 0.3551, test_loss: 0.8395, test_f1: 0.6736
 epoch: 74, train_loss: 0.3470, test_loss: 0.9042, test_f1: 0.6762
 epoch: 75, train_loss: 0.3625, test_loss: 0.8462, test_f1: 0.6855
 epoch: 76, train_loss: 0.3753, test_loss: 0.9214, test_f1: 0.6461
 epoch: 77, train_loss: 0.3515, test_loss: 0.9702, test_f1: 0.6674
 epoch: 78, train_loss: 0.3621, test_loss: 0.8718, test_f1: 0.7070
 epoch: 79, train_loss: 0.3289, test_loss: 0.8051, test_f1: 0.6761
 epoch: 80, train_loss: 0.3492, test_loss: 0.8826, test_f1: 0.6521
 epoch: 81, train_loss: 0.3328, test_loss: 0.8811, test_f1: 0.6864
 epoch: 82, train_loss: 0.3202, test_loss: 0.9368, test_f1: 0.6690
 epoch: 83, train_loss: 0.3314, test_loss: 0.7804, test_f1: 0.6960
 epoch: 84, train_loss: 0.3101, test_loss: 0.8974, test_f1: 0.6985
 epoch: 85, train_loss: 0.3075, test_loss: 1.0150, test_f1: 0.6924
 epoch: 86, train_loss: 0.3386, test_loss: 0.9438, test_f1: 0.6617
 epoch: 87, train_loss: 0.3118, test_loss: 0.8337, test_f1: 0.7181
 epoch: 88, train_loss: 0.3215, test_loss: 0.9552, test_f1: 0.6799
 epoch: 89, train_loss: 0.3008, test_loss: 0.8992, test_f1: 0.6959
 epoch: 90, train_loss: 0.3075, test_loss: 0.8880, test_f1: 0.6685
 epoch: 91, train_loss: 0.3003, test_loss: 0.8670, test_f1: 0.6755
 epoch: 92, train_loss: 0.3185, test_loss: 1.0849, test_f1: 0.6694
 epoch: 93, train_loss: 0.3120, test_loss: 0.8712, test_f1: 0.6734
 epoch: 94, train_loss: 0.3166, test_loss: 0.9352, test_f1: 0.7008
 epoch: 95, train_loss: 0.2931, test_loss: 1.0239, test_f1: 0.6620
 epoch: 96, train_loss: 0.3140, test_loss: 1.2408, test_f1: 0.6760
 epoch: 97, train_loss: 0.3010, test_loss: 0.8419, test_f1: 0.6784
 epoch: 98, train_loss: 0.2878, test_loss: 0.9291, test_f1: 0.6837
 epoch: 99, train_loss: 0.3089, test_loss: 0.9184, test_f1: 0.6664
##################ITERATION #5 ****************************************
 epoch: 0, train_loss: 1.2519, test_loss: 1.1210, test_f1: 0.4157
 epoch: 1, train_loss: 1.0734, test_loss: 1.3231, test_f1: 0.3880
 epoch: 2, train_loss: 1.0262, test_loss: 1.0778, test_f1: 0.3943
 epoch: 3, train_loss: 1.0050, test_loss: 1.2643, test_f1: 0.4262
 epoch: 4, train_loss: 0.9900, test_loss: 1.0581, test_f1: 0.4626
 epoch: 5, train_loss: 0.9652, test_loss: 1.0727, test_f1: 0.4368
 epoch: 6, train_loss: 0.9594, test_loss: 1.0135, test_f1: 0.4746
 epoch: 7, train_loss: 0.9562, test_loss: 1.0266, test_f1: 0.4719
 epoch: 8, train_loss: 0.9740, test_loss: 1.0769, test_f1: 0.4634
 epoch: 9, train_loss: 0.9445, test_loss: 1.0861, test_f1: 0.4623
 epoch: 10, train_loss: 0.9238, test_loss: 1.0437, test_f1: 0.4725
 epoch: 11, train_loss: 0.9285, test_loss: 1.1849, test_f1: 0.4575
 epoch: 12, train_loss: 0.9160, test_loss: 0.9115, test_f1: 0.5007
 epoch: 13, train_loss: 0.8853, test_loss: 1.0497, test_f1: 0.4978
 epoch: 14, train_loss: 0.8614, test_loss: 0.9489, test_f1: 0.5047
 epoch: 15, train_loss: 0.8505, test_loss: 1.0835, test_f1: 0.4858
 epoch: 16, train_loss: 0.8263, test_loss: 1.0271, test_f1: 0.5215
 epoch: 17, train_loss: 0.8438, test_loss: 0.8533, test_f1: 0.5265
 epoch: 18, train_loss: 0.8296, test_loss: 1.0142, test_f1: 0.4994
 epoch: 19, train_loss: 0.8051, test_loss: 0.9318, test_f1: 0.5151
 epoch: 20, train_loss: 0.8125, test_loss: 0.8567, test_f1: 0.5239
 epoch: 21, train_loss: 0.8113, test_loss: 0.9683, test_f1: 0.5473
 epoch: 22, train_loss: 0.7659, test_loss: 1.0184, test_f1: 0.5187
 epoch: 23, train_loss: 0.7785, test_loss: 0.8709, test_f1: 0.5490
 epoch: 24, train_loss: 0.7861, test_loss: 0.8947, test_f1: 0.5192
 epoch: 25, train_loss: 0.7532, test_loss: 0.7758, test_f1: 0.5933
 epoch: 26, train_loss: 0.7441, test_loss: 0.9099, test_f1: 0.5473
 epoch: 27, train_loss: 0.7339, test_loss: 0.8286, test_f1: 0.5576
 epoch: 28, train_loss: 0.7417, test_loss: 0.9794, test_f1: 0.5365
 epoch: 29, train_loss: 0.7364, test_loss: 0.8441, test_f1: 0.5582
 epoch: 30, train_loss: 0.7198, test_loss: 0.8550, test_f1: 0.5652
 epoch: 31, train_loss: 0.7318, test_loss: 1.0481, test_f1: 0.5774
 epoch: 32, train_loss: 0.7298, test_loss: 1.1085, test_f1: 0.5551
 epoch: 33, train_loss: 0.7154, test_loss: 0.8542, test_f1: 0.5613
 epoch: 34, train_loss: 0.7158, test_loss: 1.0542, test_f1: 0.5647
 epoch: 35, train_loss: 0.7004, test_loss: 1.1538, test_f1: 0.5747
 epoch: 36, train_loss: 0.6878, test_loss: 1.0807, test_f1: 0.5765
 epoch: 37, train_loss: 0.6974, test_loss: 1.1955, test_f1: 0.5353
 epoch: 38, train_loss: 0.6888, test_loss: 1.2034, test_f1: 0.5687
 epoch: 39, train_loss: 0.6790, test_loss: 1.3768, test_f1: 0.5641
 epoch: 40, train_loss: 0.6804, test_loss: 1.2206, test_f1: 0.5582
 epoch: 41, train_loss: 0.6605, test_loss: 0.8889, test_f1: 0.6116
 epoch: 42, train_loss: 0.6801, test_loss: 1.1639, test_f1: 0.6089
 epoch: 43, train_loss: 0.6695, test_loss: 1.0554, test_f1: 0.5254
 epoch: 44, train_loss: 0.6736, test_loss: 1.4916, test_f1: 0.5859
 epoch: 45, train_loss: 0.6312, test_loss: 1.2151, test_f1: 0.5763
 epoch: 46, train_loss: 0.6336, test_loss: 1.1997, test_f1: 0.5915
 epoch: 47, train_loss: 0.6487, test_loss: 1.0907, test_f1: 0.5640
 epoch: 48, train_loss: 0.6264, test_loss: 0.8115, test_f1: 0.6147
 epoch: 49, train_loss: 0.6368, test_loss: 0.8443, test_f1: 0.5669
 epoch: 50, train_loss: 0.6387, test_loss: 0.9627, test_f1: 0.5975
 epoch: 51, train_loss: 0.5890, test_loss: 1.0916, test_f1: 0.6263
 epoch: 52, train_loss: 0.5777, test_loss: 0.8907, test_f1: 0.6478
 epoch: 53, train_loss: 0.5484, test_loss: 1.0044, test_f1: 0.6727
 epoch: 54, train_loss: 0.5397, test_loss: 1.1476, test_f1: 0.6641
 epoch: 55, train_loss: 0.5362, test_loss: 0.8664, test_f1: 0.6671
 epoch: 56, train_loss: 0.5439, test_loss: 0.9086, test_f1: 0.6668
 epoch: 57, train_loss: 0.5368, test_loss: 1.4340, test_f1: 0.6667
 epoch: 58, train_loss: 0.5136, test_loss: 1.0233, test_f1: 0.6789
 epoch: 59, train_loss: 0.5235, test_loss: 0.9064, test_f1: 0.6569
 epoch: 60, train_loss: 0.4924, test_loss: 1.0670, test_f1: 0.6669
 epoch: 61, train_loss: 0.4923, test_loss: 1.1643, test_f1: 0.6541
 epoch: 62, train_loss: 0.4992, test_loss: 1.0082, test_f1: 0.6660
 epoch: 63, train_loss: 0.4940, test_loss: 1.3582, test_f1: 0.6671
 epoch: 64, train_loss: 0.4998, test_loss: 1.3275, test_f1: 0.6731
 epoch: 65, train_loss: 0.5116, test_loss: 0.8522, test_f1: 0.6670
 epoch: 66, train_loss: 0.4783, test_loss: 1.2955, test_f1: 0.7013
 epoch: 67, train_loss: 0.4831, test_loss: 0.9808, test_f1: 0.6774
 epoch: 68, train_loss: 0.4646, test_loss: 1.1161, test_f1: 0.7101
 epoch: 69, train_loss: 0.4502, test_loss: 1.0606, test_f1: 0.6644
 epoch: 70, train_loss: 0.4661, test_loss: 1.1781, test_f1: 0.6724
 epoch: 71, train_loss: 0.4656, test_loss: 0.9045, test_f1: 0.7207
 epoch: 72, train_loss: 0.4546, test_loss: 1.0519, test_f1: 0.6734
 epoch: 73, train_loss: 0.4467, test_loss: 1.0736, test_f1: 0.6702
 epoch: 74, train_loss: 0.4361, test_loss: 0.9713, test_f1: 0.6706
 epoch: 75, train_loss: 0.4365, test_loss: 1.3766, test_f1: 0.6846
 epoch: 76, train_loss: 0.4213, test_loss: 1.3378, test_f1: 0.6763
 epoch: 77, train_loss: 0.4242, test_loss: 1.2789, test_f1: 0.6633
 epoch: 78, train_loss: 0.4313, test_loss: 1.4389, test_f1: 0.6845
 epoch: 79, train_loss: 0.4399, test_loss: 1.2572, test_f1: 0.6568
 epoch: 80, train_loss: 0.3993, test_loss: 1.2783, test_f1: 0.6955
 epoch: 81, train_loss: 0.4157, test_loss: 1.7647, test_f1: 0.6614
 epoch: 82, train_loss: 0.4105, test_loss: 1.3681, test_f1: 0.6720
 epoch: 83, train_loss: 0.4074, test_loss: 1.4685, test_f1: 0.6629
 epoch: 84, train_loss: 0.4142, test_loss: 1.2214, test_f1: 0.6955
 epoch: 85, train_loss: 0.4162, test_loss: 1.2961, test_f1: 0.6945
 epoch: 86, train_loss: 0.3787, test_loss: 1.2808, test_f1: 0.6910
 epoch: 87, train_loss: 0.4233, test_loss: 1.2989, test_f1: 0.6499
 epoch: 88, train_loss: 0.3837, test_loss: 1.1323, test_f1: 0.6860
 epoch: 89, train_loss: 0.3785, test_loss: 1.6826, test_f1: 0.6624
 epoch: 90, train_loss: 0.3943, test_loss: 2.0095, test_f1: 0.6213
 epoch: 91, train_loss: 0.3682, test_loss: 1.6010, test_f1: 0.6622
 epoch: 92, train_loss: 0.3689, test_loss: 1.3729, test_f1: 0.6469
 epoch: 93, train_loss: 0.3912, test_loss: 1.5528, test_f1: 0.6402
 epoch: 94, train_loss: 0.3698, test_loss: 1.6182, test_f1: 0.6607
 epoch: 95, train_loss: 0.3849, test_loss: 1.3973, test_f1: 0.6742
 epoch: 96, train_loss: 0.3554, test_loss: 1.2526, test_f1: 0.6741
 epoch: 97, train_loss: 0.3519, test_loss: 1.8578, test_f1: 0.6392
 epoch: 98, train_loss: 0.3617, test_loss: 1.5918, test_f1: 0.6631
 epoch: 99, train_loss: 0.3533, test_loss: 1.7428, test_f1: 0.6631
##################ITERATION #6 ****************************************
 epoch: 0, train_loss: 1.2444, test_loss: 1.3452, test_f1: 0.3940
 epoch: 1, train_loss: 1.0311, test_loss: 1.0727, test_f1: 0.4282
 epoch: 2, train_loss: 1.0032, test_loss: 1.1639, test_f1: 0.4665
 epoch: 3, train_loss: 0.9630, test_loss: 0.9857, test_f1: 0.4460
 epoch: 4, train_loss: 0.9532, test_loss: 1.1503, test_f1: 0.4564
 epoch: 5, train_loss: 0.9256, test_loss: 1.0409, test_f1: 0.4814
 epoch: 6, train_loss: 0.9038, test_loss: 1.0522, test_f1: 0.4161
 epoch: 7, train_loss: 0.9053, test_loss: 0.9090, test_f1: 0.5427
 epoch: 8, train_loss: 0.8753, test_loss: 0.9930, test_f1: 0.5503
 epoch: 9, train_loss: 0.8587, test_loss: 1.0524, test_f1: 0.4745
 epoch: 10, train_loss: 0.8453, test_loss: 1.0073, test_f1: 0.4975
 epoch: 11, train_loss: 0.8563, test_loss: 0.9896, test_f1: 0.5436
 epoch: 12, train_loss: 0.8322, test_loss: 1.0872, test_f1: 0.5167
 epoch: 13, train_loss: 0.8243, test_loss: 0.9185, test_f1: 0.5830
 epoch: 14, train_loss: 0.8056, test_loss: 0.8424, test_f1: 0.5310
 epoch: 15, train_loss: 0.7655, test_loss: 0.9613, test_f1: 0.5426
 epoch: 16, train_loss: 0.7827, test_loss: 1.2118, test_f1: 0.5349
 epoch: 17, train_loss: 0.7909, test_loss: 0.8427, test_f1: 0.5805
 epoch: 18, train_loss: 0.7504, test_loss: 0.9290, test_f1: 0.5604
 epoch: 19, train_loss: 0.7564, test_loss: 0.8569, test_f1: 0.6022
 epoch: 20, train_loss: 0.7513, test_loss: 0.9444, test_f1: 0.5735
 epoch: 21, train_loss: 0.7266, test_loss: 1.1404, test_f1: 0.5518
 epoch: 22, train_loss: 0.7262, test_loss: 0.9457, test_f1: 0.5847
 epoch: 23, train_loss: 0.7234, test_loss: 0.9744, test_f1: 0.6001
 epoch: 24, train_loss: 0.7048, test_loss: 0.8847, test_f1: 0.5562
 epoch: 25, train_loss: 0.7079, test_loss: 0.9711, test_f1: 0.5592
 epoch: 26, train_loss: 0.7074, test_loss: 1.0501, test_f1: 0.5842
 epoch: 27, train_loss: 0.6798, test_loss: 0.9845, test_f1: 0.5994
 epoch: 28, train_loss: 0.7017, test_loss: 0.9541, test_f1: 0.6069
 epoch: 29, train_loss: 0.6799, test_loss: 1.1637, test_f1: 0.5921
 epoch: 30, train_loss: 0.6775, test_loss: 0.9598, test_f1: 0.6438
 epoch: 31, train_loss: 0.6489, test_loss: 0.8790, test_f1: 0.6369
 epoch: 32, train_loss: 0.6564, test_loss: 1.0091, test_f1: 0.5890
 epoch: 33, train_loss: 0.6309, test_loss: 1.0711, test_f1: 0.6499
 epoch: 34, train_loss: 0.6304, test_loss: 0.7547, test_f1: 0.6298
 epoch: 35, train_loss: 0.6208, test_loss: 1.2142, test_f1: 0.6229
 epoch: 36, train_loss: 0.6424, test_loss: 1.0937, test_f1: 0.5972
 epoch: 37, train_loss: 0.5875, test_loss: 1.0062, test_f1: 0.6389
 epoch: 38, train_loss: 0.5967, test_loss: 0.9251, test_f1: 0.6493
 epoch: 39, train_loss: 0.5801, test_loss: 0.7794, test_f1: 0.6655
 epoch: 40, train_loss: 0.5880, test_loss: 1.3326, test_f1: 0.6232
 epoch: 41, train_loss: 0.5979, test_loss: 0.9085, test_f1: 0.6648
 epoch: 42, train_loss: 0.5881, test_loss: 1.1512, test_f1: 0.5979
 epoch: 43, train_loss: 0.5773, test_loss: 0.9335, test_f1: 0.6748
 epoch: 44, train_loss: 0.5532, test_loss: 1.1786, test_f1: 0.6136
 epoch: 45, train_loss: 0.5627, test_loss: 0.9398, test_f1: 0.6455
 epoch: 46, train_loss: 0.5529, test_loss: 0.8952, test_f1: 0.6686
 epoch: 47, train_loss: 0.5263, test_loss: 0.9351, test_f1: 0.6986
 epoch: 48, train_loss: 0.5538, test_loss: 1.1481, test_f1: 0.6449
 epoch: 49, train_loss: 0.5487, test_loss: 0.9015, test_f1: 0.6636
 epoch: 50, train_loss: 0.5259, test_loss: 1.1778, test_f1: 0.6400
 epoch: 51, train_loss: 0.4789, test_loss: 1.0879, test_f1: 0.6777
 epoch: 52, train_loss: 0.4638, test_loss: 1.1354, test_f1: 0.6919
 epoch: 53, train_loss: 0.4512, test_loss: 1.0915, test_f1: 0.7122
 epoch: 54, train_loss: 0.4290, test_loss: 1.0372, test_f1: 0.6970
 epoch: 55, train_loss: 0.4169, test_loss: 1.0287, test_f1: 0.6916
 epoch: 56, train_loss: 0.4174, test_loss: 1.0047, test_f1: 0.7023
 epoch: 57, train_loss: 0.4113, test_loss: 1.0735, test_f1: 0.6898
 epoch: 58, train_loss: 0.4248, test_loss: 1.2112, test_f1: 0.6800
 epoch: 59, train_loss: 0.3941, test_loss: 1.0467, test_f1: 0.7144
 epoch: 60, train_loss: 0.4134, test_loss: 1.0748, test_f1: 0.6851
 epoch: 61, train_loss: 0.3970, test_loss: 1.2161, test_f1: 0.6852
 epoch: 62, train_loss: 0.3986, test_loss: 1.0597, test_f1: 0.7126
 epoch: 63, train_loss: 0.3857, test_loss: 1.0804, test_f1: 0.6749
 epoch: 64, train_loss: 0.4185, test_loss: 0.7887, test_f1: 0.7035
 epoch: 65, train_loss: 0.3991, test_loss: 1.0567, test_f1: 0.6901
 epoch: 66, train_loss: 0.3689, test_loss: 1.0439, test_f1: 0.6947
 epoch: 67, train_loss: 0.3993, test_loss: 0.9749, test_f1: 0.6975
 epoch: 68, train_loss: 0.3702, test_loss: 1.1275, test_f1: 0.6456
 epoch: 69, train_loss: 0.3786, test_loss: 1.2964, test_f1: 0.6760
 epoch: 70, train_loss: 0.3670, test_loss: 0.9553, test_f1: 0.6923
 epoch: 71, train_loss: 0.3552, test_loss: 1.0864, test_f1: 0.6813
 epoch: 72, train_loss: 0.3563, test_loss: 1.3391, test_f1: 0.6469
 epoch: 73, train_loss: 0.3575, test_loss: 0.9508, test_f1: 0.7033
 epoch: 74, train_loss: 0.3482, test_loss: 1.0237, test_f1: 0.6698
 epoch: 75, train_loss: 0.3442, test_loss: 1.0873, test_f1: 0.6986
 epoch: 76, train_loss: 0.3417, test_loss: 1.0442, test_f1: 0.7110
 epoch: 77, train_loss: 0.3377, test_loss: 1.1033, test_f1: 0.6738
 epoch: 78, train_loss: 0.3335, test_loss: 1.1440, test_f1: 0.7017
 epoch: 79, train_loss: 0.3307, test_loss: 1.0023, test_f1: 0.6955
 epoch: 80, train_loss: 0.3193, test_loss: 1.0585, test_f1: 0.7005
 epoch: 81, train_loss: 0.3454, test_loss: 1.0813, test_f1: 0.6971
 epoch: 82, train_loss: 0.3365, test_loss: 1.0241, test_f1: 0.6968
 epoch: 83, train_loss: 0.3265, test_loss: 1.1275, test_f1: 0.7058
 epoch: 84, train_loss: 0.3400, test_loss: 1.1586, test_f1: 0.6874
 epoch: 85, train_loss: 0.2960, test_loss: 1.0870, test_f1: 0.7361
 epoch: 86, train_loss: 0.3200, test_loss: 1.2497, test_f1: 0.6921
 epoch: 87, train_loss: 0.3306, test_loss: 1.1534, test_f1: 0.6972
 epoch: 88, train_loss: 0.3005, test_loss: 1.0729, test_f1: 0.6907
 epoch: 89, train_loss: 0.3008, test_loss: 1.2222, test_f1: 0.6753
 epoch: 90, train_loss: 0.3108, test_loss: 1.1416, test_f1: 0.6834
 epoch: 91, train_loss: 0.3233, test_loss: 1.3204, test_f1: 0.6748
 epoch: 92, train_loss: 0.3413, test_loss: 1.2610, test_f1: 0.6578
 epoch: 93, train_loss: 0.3153, test_loss: 1.3109, test_f1: 0.6875
 epoch: 94, train_loss: 0.2995, test_loss: 1.2379, test_f1: 0.6886
 epoch: 95, train_loss: 0.2969, test_loss: 1.2539, test_f1: 0.6692
 epoch: 96, train_loss: 0.2855, test_loss: 1.2172, test_f1: 0.7024
 epoch: 97, train_loss: 0.2897, test_loss: 1.0317, test_f1: 0.7027
 epoch: 98, train_loss: 0.2760, test_loss: 1.1506, test_f1: 0.7151
 epoch: 99, train_loss: 0.2784, test_loss: 1.3008, test_f1: 0.7057
##################ITERATION #7 ****************************************
 epoch: 0, train_loss: 1.2162, test_loss: 1.2485, test_f1: 0.4228
 epoch: 1, train_loss: 1.0207, test_loss: 1.1725, test_f1: 0.4465
 epoch: 2, train_loss: 0.9699, test_loss: 0.9672, test_f1: 0.4588
 epoch: 3, train_loss: 0.9538, test_loss: 1.0091, test_f1: 0.4682
 epoch: 4, train_loss: 0.9227, test_loss: 0.9025, test_f1: 0.4882
 epoch: 5, train_loss: 0.9101, test_loss: 0.9598, test_f1: 0.4956
 epoch: 6, train_loss: 0.8809, test_loss: 0.8971, test_f1: 0.4901
 epoch: 7, train_loss: 0.8691, test_loss: 0.8482, test_f1: 0.5220
 epoch: 8, train_loss: 0.8689, test_loss: 0.9397, test_f1: 0.5727
 epoch: 9, train_loss: 0.8521, test_loss: 0.8408, test_f1: 0.5227
 epoch: 10, train_loss: 0.8164, test_loss: 0.8027, test_f1: 0.5571
 epoch: 11, train_loss: 0.7980, test_loss: 0.9490, test_f1: 0.5947
 epoch: 12, train_loss: 0.8037, test_loss: 0.8567, test_f1: 0.5541
 epoch: 13, train_loss: 0.7849, test_loss: 0.7746, test_f1: 0.6047
 epoch: 14, train_loss: 0.7767, test_loss: 0.7413, test_f1: 0.6155
 epoch: 15, train_loss: 0.7600, test_loss: 0.8755, test_f1: 0.5404
 epoch: 16, train_loss: 0.7644, test_loss: 0.8096, test_f1: 0.5917
 epoch: 17, train_loss: 0.7294, test_loss: 0.9743, test_f1: 0.5274
 epoch: 18, train_loss: 0.7417, test_loss: 0.8323, test_f1: 0.5786
 epoch: 19, train_loss: 0.7252, test_loss: 0.9794, test_f1: 0.5977
 epoch: 20, train_loss: 0.7277, test_loss: 1.0855, test_f1: 0.5620
 epoch: 21, train_loss: 0.7033, test_loss: 0.8415, test_f1: 0.5209
 epoch: 22, train_loss: 0.6768, test_loss: 0.8678, test_f1: 0.6272
 epoch: 23, train_loss: 0.6749, test_loss: 0.8444, test_f1: 0.5503
 epoch: 24, train_loss: 0.6544, test_loss: 0.7887, test_f1: 0.6056
 epoch: 25, train_loss: 0.6933, test_loss: 0.8592, test_f1: 0.6495
 epoch: 26, train_loss: 0.6621, test_loss: 0.7828, test_f1: 0.5794
 epoch: 27, train_loss: 0.6490, test_loss: 0.9454, test_f1: 0.5598
 epoch: 28, train_loss: 0.6487, test_loss: 0.7452, test_f1: 0.6430
 epoch: 29, train_loss: 0.6339, test_loss: 0.9382, test_f1: 0.6465
 epoch: 30, train_loss: 0.6469, test_loss: 0.7300, test_f1: 0.6335
 epoch: 31, train_loss: 0.6131, test_loss: 0.9058, test_f1: 0.5864
 epoch: 32, train_loss: 0.6200, test_loss: 0.7871, test_f1: 0.6035
 epoch: 33, train_loss: 0.6123, test_loss: 0.8139, test_f1: 0.6323
 epoch: 34, train_loss: 0.5902, test_loss: 0.9222, test_f1: 0.6557
 epoch: 35, train_loss: 0.6035, test_loss: 0.9901, test_f1: 0.6267
 epoch: 36, train_loss: 0.5827, test_loss: 0.9635, test_f1: 0.6451
 epoch: 37, train_loss: 0.5814, test_loss: 0.9352, test_f1: 0.6406
 epoch: 38, train_loss: 0.5654, test_loss: 0.8073, test_f1: 0.6349
 epoch: 39, train_loss: 0.5790, test_loss: 1.1224, test_f1: 0.6255
 epoch: 40, train_loss: 0.5617, test_loss: 0.8216, test_f1: 0.6931
 epoch: 41, train_loss: 0.5813, test_loss: 1.0687, test_f1: 0.6078
 epoch: 42, train_loss: 0.5592, test_loss: 1.0815, test_f1: 0.6128
 epoch: 43, train_loss: 0.5473, test_loss: 0.8957, test_f1: 0.6511
 epoch: 44, train_loss: 0.5333, test_loss: 1.2200, test_f1: 0.6407
 epoch: 45, train_loss: 0.6106, test_loss: 1.2642, test_f1: 0.5923
 epoch: 46, train_loss: 0.6038, test_loss: 1.0069, test_f1: 0.6350
 epoch: 47, train_loss: 0.5732, test_loss: 0.8521, test_f1: 0.6250
 epoch: 48, train_loss: 0.5224, test_loss: 0.9796, test_f1: 0.6498
 epoch: 49, train_loss: 0.5036, test_loss: 0.9147, test_f1: 0.6580
 epoch: 50, train_loss: 0.5359, test_loss: 0.8479, test_f1: 0.6685
 epoch: 51, train_loss: 0.4543, test_loss: 1.0630, test_f1: 0.6491
 epoch: 52, train_loss: 0.4747, test_loss: 1.0047, test_f1: 0.6792
 epoch: 53, train_loss: 0.4502, test_loss: 0.9066, test_f1: 0.6747
 epoch: 54, train_loss: 0.4488, test_loss: 0.9984, test_f1: 0.6778
 epoch: 55, train_loss: 0.4243, test_loss: 1.0198, test_f1: 0.6524
 epoch: 56, train_loss: 0.4174, test_loss: 0.9940, test_f1: 0.6847
 epoch: 57, train_loss: 0.4236, test_loss: 1.0843, test_f1: 0.6938
 epoch: 58, train_loss: 0.4080, test_loss: 1.2683, test_f1: 0.6804
 epoch: 59, train_loss: 0.4224, test_loss: 1.1937, test_f1: 0.6869
 epoch: 60, train_loss: 0.3975, test_loss: 1.1585, test_f1: 0.6905
 epoch: 61, train_loss: 0.3914, test_loss: 1.0885, test_f1: 0.6857
 epoch: 62, train_loss: 0.4061, test_loss: 1.1427, test_f1: 0.6722
 epoch: 63, train_loss: 0.4031, test_loss: 1.0743, test_f1: 0.6830
 epoch: 64, train_loss: 0.4055, test_loss: 1.2432, test_f1: 0.6816
 epoch: 65, train_loss: 0.3943, test_loss: 1.3034, test_f1: 0.6821
 epoch: 66, train_loss: 0.3702, test_loss: 1.2408, test_f1: 0.6858
 epoch: 67, train_loss: 0.3759, test_loss: 1.0506, test_f1: 0.6709
 epoch: 68, train_loss: 0.3703, test_loss: 1.2693, test_f1: 0.6777
 epoch: 69, train_loss: 0.3503, test_loss: 1.3228, test_f1: 0.6783
 epoch: 70, train_loss: 0.3682, test_loss: 1.1847, test_f1: 0.6538
 epoch: 71, train_loss: 0.3684, test_loss: 1.2982, test_f1: 0.6867
 epoch: 72, train_loss: 0.3439, test_loss: 1.3073, test_f1: 0.6721
 epoch: 73, train_loss: 0.3820, test_loss: 1.1768, test_f1: 0.7023
 epoch: 74, train_loss: 0.3500, test_loss: 1.3110, test_f1: 0.6824
 epoch: 75, train_loss: 0.3459, test_loss: 1.3225, test_f1: 0.6618
 epoch: 76, train_loss: 0.3416, test_loss: 1.2137, test_f1: 0.6905
 epoch: 77, train_loss: 0.3423, test_loss: 1.3073, test_f1: 0.6778
 epoch: 78, train_loss: 0.3454, test_loss: 1.2649, test_f1: 0.6810
 epoch: 79, train_loss: 0.3315, test_loss: 1.4163, test_f1: 0.6976
 epoch: 80, train_loss: 0.3243, test_loss: 1.3959, test_f1: 0.6749
 epoch: 81, train_loss: 0.3550, test_loss: 1.2138, test_f1: 0.6767
 epoch: 82, train_loss: 0.3321, test_loss: 1.2191, test_f1: 0.6903
 epoch: 83, train_loss: 0.3256, test_loss: 1.2486, test_f1: 0.6758
 epoch: 84, train_loss: 0.3164, test_loss: 1.4472, test_f1: 0.6763
 epoch: 85, train_loss: 0.3349, test_loss: 1.2836, test_f1: 0.6779
 epoch: 86, train_loss: 0.3346, test_loss: 1.2604, test_f1: 0.6723
 epoch: 87, train_loss: 0.3313, test_loss: 1.1790, test_f1: 0.6791
 epoch: 88, train_loss: 0.3100, test_loss: 1.3494, test_f1: 0.6689
 epoch: 89, train_loss: 0.3026, test_loss: 1.3605, test_f1: 0.6716
 epoch: 90, train_loss: 0.3085, test_loss: 1.3188, test_f1: 0.6685
 epoch: 91, train_loss: 0.3130, test_loss: 1.2556, test_f1: 0.6685
 epoch: 92, train_loss: 0.3086, test_loss: 1.1904, test_f1: 0.6857
 epoch: 93, train_loss: 0.3049, test_loss: 1.3285, test_f1: 0.6678
 epoch: 94, train_loss: 0.2835, test_loss: 1.4356, test_f1: 0.6787
 epoch: 95, train_loss: 0.2836, test_loss: 1.5626, test_f1: 0.6684
 epoch: 96, train_loss: 0.2901, test_loss: 1.4164, test_f1: 0.6675
 epoch: 97, train_loss: 0.2965, test_loss: 1.3306, test_f1: 0.6901
 epoch: 98, train_loss: 0.3083, test_loss: 1.3209, test_f1: 0.6933
 epoch: 99, train_loss: 0.2977, test_loss: 1.2553, test_f1: 0.6880
##################ITERATION #8 ****************************************
 epoch: 0, train_loss: 1.3109, test_loss: 1.0521, test_f1: 0.4482
 epoch: 1, train_loss: 1.0095, test_loss: 0.9698, test_f1: 0.4806
 epoch: 2, train_loss: 0.9607, test_loss: 1.0010, test_f1: 0.4689
 epoch: 3, train_loss: 0.9325, test_loss: 0.9841, test_f1: 0.4807
 epoch: 4, train_loss: 0.9290, test_loss: 0.9552, test_f1: 0.4951
 epoch: 5, train_loss: 0.8925, test_loss: 1.0588, test_f1: 0.5084
 epoch: 6, train_loss: 0.8945, test_loss: 1.2640, test_f1: 0.4557
 epoch: 7, train_loss: 0.8836, test_loss: 0.8995, test_f1: 0.5420
 epoch: 8, train_loss: 0.8800, test_loss: 1.2180, test_f1: 0.4462
 epoch: 9, train_loss: 0.8552, test_loss: 0.9707, test_f1: 0.5295
 epoch: 10, train_loss: 0.8354, test_loss: 1.3148, test_f1: 0.4961
 epoch: 11, train_loss: 0.8505, test_loss: 0.9486, test_f1: 0.5122
 epoch: 12, train_loss: 0.8133, test_loss: 0.8904, test_f1: 0.5789
 epoch: 13, train_loss: 0.8180, test_loss: 1.0305, test_f1: 0.5441
 epoch: 14, train_loss: 0.8207, test_loss: 1.0805, test_f1: 0.5612
 epoch: 15, train_loss: 0.8022, test_loss: 0.8549, test_f1: 0.5292
 epoch: 16, train_loss: 0.7871, test_loss: 0.9603, test_f1: 0.5727
 epoch: 17, train_loss: 0.7943, test_loss: 1.1065, test_f1: 0.5398
 epoch: 18, train_loss: 0.7704, test_loss: 0.9745, test_f1: 0.5396
 epoch: 19, train_loss: 0.7545, test_loss: 0.8029, test_f1: 0.5713
 epoch: 20, train_loss: 0.7268, test_loss: 0.9921, test_f1: 0.5527
 epoch: 21, train_loss: 0.7584, test_loss: 0.8573, test_f1: 0.5971
 epoch: 22, train_loss: 0.7473, test_loss: 0.9302, test_f1: 0.5837
 epoch: 23, train_loss: 0.7157, test_loss: 1.1251, test_f1: 0.5462
 epoch: 24, train_loss: 0.7226, test_loss: 1.1082, test_f1: 0.5697
 epoch: 25, train_loss: 0.7174, test_loss: 1.0823, test_f1: 0.5952
 epoch: 26, train_loss: 0.6805, test_loss: 0.9059, test_f1: 0.6375
 epoch: 27, train_loss: 0.6749, test_loss: 0.9917, test_f1: 0.6248
 epoch: 28, train_loss: 0.6700, test_loss: 1.0699, test_f1: 0.6480
 epoch: 29, train_loss: 0.6617, test_loss: 1.0749, test_f1: 0.5712
 epoch: 30, train_loss: 0.6473, test_loss: 1.1033, test_f1: 0.6281
 epoch: 31, train_loss: 0.6634, test_loss: 0.8508, test_f1: 0.6501
 epoch: 32, train_loss: 0.6350, test_loss: 1.0000, test_f1: 0.5915
 epoch: 33, train_loss: 0.6417, test_loss: 1.0835, test_f1: 0.6444
 epoch: 34, train_loss: 0.6137, test_loss: 1.0427, test_f1: 0.6166
 epoch: 35, train_loss: 0.6616, test_loss: 1.1908, test_f1: 0.6394
 epoch: 36, train_loss: 0.6083, test_loss: 0.9531, test_f1: 0.6753
 epoch: 37, train_loss: 0.6219, test_loss: 0.9949, test_f1: 0.6137
 epoch: 38, train_loss: 0.5889, test_loss: 1.0718, test_f1: 0.6116
 epoch: 39, train_loss: 0.6329, test_loss: 1.1432, test_f1: 0.5378
 epoch: 40, train_loss: 0.5875, test_loss: 1.1518, test_f1: 0.6227
 epoch: 41, train_loss: 0.5791, test_loss: 1.2254, test_f1: 0.5694
 epoch: 42, train_loss: 0.5891, test_loss: 1.3269, test_f1: 0.5811
 epoch: 43, train_loss: 0.5586, test_loss: 1.1573, test_f1: 0.6471
 epoch: 44, train_loss: 0.5645, test_loss: 1.0142, test_f1: 0.6617
 epoch: 45, train_loss: 0.5479, test_loss: 1.1293, test_f1: 0.6192
 epoch: 46, train_loss: 0.5727, test_loss: 1.1260, test_f1: 0.6299
 epoch: 47, train_loss: 0.5380, test_loss: 1.1215, test_f1: 0.6654
 epoch: 48, train_loss: 0.5214, test_loss: 1.1241, test_f1: 0.6188
 epoch: 49, train_loss: 0.5541, test_loss: 1.1546, test_f1: 0.6591
 epoch: 50, train_loss: 0.5276, test_loss: 0.9493, test_f1: 0.6856
 epoch: 51, train_loss: 0.4731, test_loss: 1.1949, test_f1: 0.6276
 epoch: 52, train_loss: 0.4567, test_loss: 1.2857, test_f1: 0.6760
 epoch: 53, train_loss: 0.4458, test_loss: 1.3279, test_f1: 0.6511
 epoch: 54, train_loss: 0.4571, test_loss: 1.2398, test_f1: 0.6777
 epoch: 55, train_loss: 0.4312, test_loss: 1.0980, test_f1: 0.6708
 epoch: 56, train_loss: 0.4069, test_loss: 1.2650, test_f1: 0.6889
 epoch: 57, train_loss: 0.4213, test_loss: 1.3670, test_f1: 0.6662
 epoch: 58, train_loss: 0.4274, test_loss: 1.1527, test_f1: 0.6900
 epoch: 59, train_loss: 0.4046, test_loss: 1.2459, test_f1: 0.6413
 epoch: 60, train_loss: 0.4207, test_loss: 1.2915, test_f1: 0.6845
 epoch: 61, train_loss: 0.3857, test_loss: 1.3265, test_f1: 0.6391
 epoch: 62, train_loss: 0.4064, test_loss: 1.0746, test_f1: 0.6747
 epoch: 63, train_loss: 0.4242, test_loss: 1.2574, test_f1: 0.6530
 epoch: 64, train_loss: 0.4060, test_loss: 1.1633, test_f1: 0.6820
 epoch: 65, train_loss: 0.4014, test_loss: 1.1836, test_f1: 0.6650
 epoch: 66, train_loss: 0.3816, test_loss: 1.1837, test_f1: 0.7140
 epoch: 67, train_loss: 0.3737, test_loss: 1.4101, test_f1: 0.6536
 epoch: 68, train_loss: 0.3599, test_loss: 1.2193, test_f1: 0.6993
 epoch: 69, train_loss: 0.3675, test_loss: 1.1321, test_f1: 0.6962
 epoch: 70, train_loss: 0.3769, test_loss: 1.1922, test_f1: 0.6745
 epoch: 71, train_loss: 0.3860, test_loss: 1.2237, test_f1: 0.6874
 epoch: 72, train_loss: 0.3488, test_loss: 1.3066, test_f1: 0.6615
 epoch: 73, train_loss: 0.3837, test_loss: 1.4256, test_f1: 0.6879
 epoch: 74, train_loss: 0.3661, test_loss: 1.2337, test_f1: 0.6675
 epoch: 75, train_loss: 0.3339, test_loss: 1.3382, test_f1: 0.7074
 epoch: 76, train_loss: 0.3451, test_loss: 1.5801, test_f1: 0.6566
 epoch: 77, train_loss: 0.3455, test_loss: 1.1043, test_f1: 0.7059
 epoch: 78, train_loss: 0.3500, test_loss: 1.4300, test_f1: 0.6865
 epoch: 79, train_loss: 0.3201, test_loss: 1.3978, test_f1: 0.6821
 epoch: 80, train_loss: 0.3448, test_loss: 1.3865, test_f1: 0.6513
 epoch: 81, train_loss: 0.3490, test_loss: 1.5135, test_f1: 0.6218
 epoch: 82, train_loss: 0.3351, test_loss: 1.3407, test_f1: 0.6895
 epoch: 83, train_loss: 0.3140, test_loss: 1.4773, test_f1: 0.6625
 epoch: 84, train_loss: 0.3294, test_loss: 1.4720, test_f1: 0.6338
 epoch: 85, train_loss: 0.3189, test_loss: 1.1308, test_f1: 0.6801
 epoch: 86, train_loss: 0.2883, test_loss: 1.4029, test_f1: 0.6846
 epoch: 87, train_loss: 0.3199, test_loss: 1.4695, test_f1: 0.6725
 epoch: 88, train_loss: 0.2983, test_loss: 1.4744, test_f1: 0.6807
 epoch: 89, train_loss: 0.3424, test_loss: 1.3324, test_f1: 0.6531
 epoch: 90, train_loss: 0.3271, test_loss: 1.3230, test_f1: 0.6683
 epoch: 91, train_loss: 0.3192, test_loss: 1.4356, test_f1: 0.6727
 epoch: 92, train_loss: 0.3097, test_loss: 1.2723, test_f1: 0.6678
 epoch: 93, train_loss: 0.3168, test_loss: 1.1320, test_f1: 0.6700
 epoch: 94, train_loss: 0.2857, test_loss: 1.4847, test_f1: 0.6807
 epoch: 95, train_loss: 0.3135, test_loss: 1.2564, test_f1: 0.6743
 epoch: 96, train_loss: 0.3126, test_loss: 1.3118, test_f1: 0.6453
 epoch: 97, train_loss: 0.2970, test_loss: 1.1380, test_f1: 0.6924
 epoch: 98, train_loss: 0.2578, test_loss: 1.3670, test_f1: 0.6912
 epoch: 99, train_loss: 0.2712, test_loss: 1.2009, test_f1: 0.6801
##################ITERATION #9 ****************************************
 epoch: 0, train_loss: 1.2610, test_loss: 0.9838, test_f1: 0.4741
 epoch: 1, train_loss: 0.9902, test_loss: 1.0239, test_f1: 0.4762
 epoch: 2, train_loss: 0.9634, test_loss: 0.9974, test_f1: 0.4963
 epoch: 3, train_loss: 0.9338, test_loss: 1.0727, test_f1: 0.5166
 epoch: 4, train_loss: 0.9054, test_loss: 1.0555, test_f1: 0.5343
 epoch: 5, train_loss: 0.8892, test_loss: 0.9588, test_f1: 0.4643
 epoch: 6, train_loss: 0.8775, test_loss: 0.8859, test_f1: 0.5323
 epoch: 7, train_loss: 0.8470, test_loss: 0.9001, test_f1: 0.5234
 epoch: 8, train_loss: 0.8428, test_loss: 0.8619, test_f1: 0.5497
 epoch: 9, train_loss: 0.8275, test_loss: 0.9854, test_f1: 0.5388
 epoch: 10, train_loss: 0.8398, test_loss: 0.8743, test_f1: 0.5718
 epoch: 11, train_loss: 0.8049, test_loss: 0.8574, test_f1: 0.5890
 epoch: 12, train_loss: 0.7925, test_loss: 0.9665, test_f1: 0.5946
 epoch: 13, train_loss: 0.7738, test_loss: 1.0218, test_f1: 0.5551
 epoch: 14, train_loss: 0.7878, test_loss: 0.9960, test_f1: 0.5150
 epoch: 15, train_loss: 0.7724, test_loss: 1.0530, test_f1: 0.5286
 epoch: 16, train_loss: 0.7464, test_loss: 0.9110, test_f1: 0.5581
 epoch: 17, train_loss: 0.7397, test_loss: 0.9861, test_f1: 0.5841
 epoch: 18, train_loss: 0.7412, test_loss: 0.9293, test_f1: 0.5707
 epoch: 19, train_loss: 0.7298, test_loss: 0.8638, test_f1: 0.5778
 epoch: 20, train_loss: 0.7267, test_loss: 0.9981, test_f1: 0.5820
 epoch: 21, train_loss: 0.6957, test_loss: 0.9841, test_f1: 0.5615
 epoch: 22, train_loss: 0.7371, test_loss: 0.9355, test_f1: 0.5781
 epoch: 23, train_loss: 0.6912, test_loss: 1.1056, test_f1: 0.5765
 epoch: 24, train_loss: 0.6732, test_loss: 0.9259, test_f1: 0.6179
 epoch: 25, train_loss: 0.6768, test_loss: 0.8714, test_f1: 0.5863
 epoch: 26, train_loss: 0.6715, test_loss: 1.0156, test_f1: 0.5868
 epoch: 27, train_loss: 0.6596, test_loss: 1.1051, test_f1: 0.5645
 epoch: 28, train_loss: 0.6728, test_loss: 1.1011, test_f1: 0.5909
 epoch: 29, train_loss: 0.6614, test_loss: 1.0076, test_f1: 0.6240
 epoch: 30, train_loss: 0.6530, test_loss: 1.1872, test_f1: 0.6324
 epoch: 31, train_loss: 0.6471, test_loss: 0.8231, test_f1: 0.6565
 epoch: 32, train_loss: 0.6321, test_loss: 0.9370, test_f1: 0.6356
 epoch: 33, train_loss: 0.6192, test_loss: 0.9410, test_f1: 0.6319
 epoch: 34, train_loss: 0.6347, test_loss: 0.9447, test_f1: 0.6132
 epoch: 35, train_loss: 0.6223, test_loss: 1.0854, test_f1: 0.6401
 epoch: 36, train_loss: 0.6075, test_loss: 0.9366, test_f1: 0.6131
 epoch: 37, train_loss: 0.6099, test_loss: 1.0403, test_f1: 0.6468
 epoch: 38, train_loss: 0.6148, test_loss: 0.9845, test_f1: 0.6653
 epoch: 39, train_loss: 0.6219, test_loss: 0.9090, test_f1: 0.6699
 epoch: 40, train_loss: 0.5928, test_loss: 1.2118, test_f1: 0.6520
 epoch: 41, train_loss: 0.5719, test_loss: 1.0036, test_f1: 0.6801
 epoch: 42, train_loss: 0.5583, test_loss: 1.0980, test_f1: 0.6465
 epoch: 43, train_loss: 0.5772, test_loss: 1.2325, test_f1: 0.6081
 epoch: 44, train_loss: 0.5620, test_loss: 0.8762, test_f1: 0.6628
 epoch: 45, train_loss: 0.5700, test_loss: 1.0153, test_f1: 0.6626
 epoch: 46, train_loss: 0.5705, test_loss: 0.9936, test_f1: 0.6469
 epoch: 47, train_loss: 0.5676, test_loss: 1.0442, test_f1: 0.6572
 epoch: 48, train_loss: 0.5281, test_loss: 1.0373, test_f1: 0.6797
 epoch: 49, train_loss: 0.5296, test_loss: 1.2292, test_f1: 0.6739
 epoch: 50, train_loss: 0.5473, test_loss: 1.0453, test_f1: 0.6599
 epoch: 51, train_loss: 0.5127, test_loss: 1.0964, test_f1: 0.6668
 epoch: 52, train_loss: 0.4574, test_loss: 1.1281, test_f1: 0.6664
 epoch: 53, train_loss: 0.4736, test_loss: 1.1091, test_f1: 0.6916
 epoch: 54, train_loss: 0.4432, test_loss: 1.1307, test_f1: 0.6682
 epoch: 55, train_loss: 0.4586, test_loss: 1.0958, test_f1: 0.6989
 epoch: 56, train_loss: 0.4365, test_loss: 1.0416, test_f1: 0.6585
 epoch: 57, train_loss: 0.4262, test_loss: 1.2143, test_f1: 0.6682
 epoch: 58, train_loss: 0.4136, test_loss: 1.1227, test_f1: 0.6811
 epoch: 59, train_loss: 0.4101, test_loss: 1.2135, test_f1: 0.6667
 epoch: 60, train_loss: 0.4145, test_loss: 1.1248, test_f1: 0.6673
 epoch: 61, train_loss: 0.4409, test_loss: 1.1392, test_f1: 0.6613
 epoch: 62, train_loss: 0.4260, test_loss: 1.2312, test_f1: 0.6553
 epoch: 63, train_loss: 0.4203, test_loss: 1.1926, test_f1: 0.6561
 epoch: 64, train_loss: 0.3982, test_loss: 1.1666, test_f1: 0.6695
 epoch: 65, train_loss: 0.4002, test_loss: 1.2910, test_f1: 0.6570
 epoch: 66, train_loss: 0.3995, test_loss: 1.2930, test_f1: 0.6642
 epoch: 67, train_loss: 0.4057, test_loss: 1.2304, test_f1: 0.6968
 epoch: 68, train_loss: 0.3947, test_loss: 1.2841, test_f1: 0.6856
 epoch: 69, train_loss: 0.3719, test_loss: 1.2891, test_f1: 0.6972
 epoch: 70, train_loss: 0.3909, test_loss: 1.5102, test_f1: 0.6595
 epoch: 71, train_loss: 0.3582, test_loss: 1.3756, test_f1: 0.6771
 epoch: 72, train_loss: 0.3843, test_loss: 1.2013, test_f1: 0.7031
 epoch: 73, train_loss: 0.3575, test_loss: 1.3310, test_f1: 0.6644
 epoch: 74, train_loss: 0.3728, test_loss: 1.4468, test_f1: 0.6649
 epoch: 75, train_loss: 0.3523, test_loss: 1.3408, test_f1: 0.6634
 epoch: 76, train_loss: 0.3496, test_loss: 1.2603, test_f1: 0.6644
 epoch: 77, train_loss: 0.3340, test_loss: 1.4407, test_f1: 0.6703
 epoch: 78, train_loss: 0.3739, test_loss: 1.3084, test_f1: 0.6831
 epoch: 79, train_loss: 0.3349, test_loss: 1.3988, test_f1: 0.6972
 epoch: 80, train_loss: 0.3514, test_loss: 1.2486, test_f1: 0.6921
 epoch: 81, train_loss: 0.3549, test_loss: 1.3229, test_f1: 0.6899
 epoch: 82, train_loss: 0.3551, test_loss: 1.3595, test_f1: 0.6741
 epoch: 83, train_loss: 0.3177, test_loss: 1.2809, test_f1: 0.7017
 epoch: 84, train_loss: 0.3318, test_loss: 1.2765, test_f1: 0.6805
 epoch: 85, train_loss: 0.3156, test_loss: 1.4857, test_f1: 0.6859
 epoch: 86, train_loss: 0.3279, test_loss: 1.4820, test_f1: 0.6431
 epoch: 87, train_loss: 0.3173, test_loss: 1.5521, test_f1: 0.6612
 epoch: 88, train_loss: 0.3251, test_loss: 1.3314, test_f1: 0.7039
 epoch: 89, train_loss: 0.3139, test_loss: 1.4053, test_f1: 0.6522
 epoch: 90, train_loss: 0.3030, test_loss: 1.6564, test_f1: 0.6640
 epoch: 91, train_loss: 0.3223, test_loss: 1.5505, test_f1: 0.6877
 epoch: 92, train_loss: 0.3121, test_loss: 1.4075, test_f1: 0.6896
 epoch: 93, train_loss: 0.3089, test_loss: 1.4045, test_f1: 0.6720
 epoch: 94, train_loss: 0.2955, test_loss: 1.5322, test_f1: 0.7028
 epoch: 95, train_loss: 0.3114, test_loss: 1.5238, test_f1: 0.6522
 epoch: 96, train_loss: 0.3001, test_loss: 1.3849, test_f1: 0.7058
 epoch: 97, train_loss: 0.2938, test_loss: 1.5883, test_f1: 0.6988
 epoch: 98, train_loss: 0.3135, test_loss: 1.6950, test_f1: 0.6769
 epoch: 99, train_loss: 0.2783, test_loss: 1.3720, test_f1: 0.6653

Training completed in 1291.39 seconds
Best F1: 0.7361 at epoch 85
Mean F1 across iterations: 0.7138  0.0136
========================FINAL RESULTS================================
FEGIN weighted F1: 0.7361  0.0136
python main.py --data ltspice_examples --representation component_pin --model FEGIN --layers 3 --hiddens 128 --batch_size 64 --lr 0.01 --emb_size 512 --epochs 100 --save_appendix component_pin_L3_H128_BS64_LR0.01_E512 --no_val
-----



STDERR:
  File "main.py", line 370, in <module>
    main()
  File "main.py", line 254, in main
    dataset = dataset_class(
  File "/home/philip/projects/llm_inference_code_repo/Circuit-Completion-Using-GNNs/component_classification_with_link_prediction_head/evaluation/FEGIN/kernel/circuit_datasets.py", line 15, in __init__
    self.data, self.slices = torch.load(self.processed_paths[0])
  File "/home/philip/.local/lib/python3.8/site-packages/torch/serialization.py", line 1040, in load
    warnings.warn(
  File "/usr/lib/python3.8/warnings.py", line 109, in _showwarnmsg
    sw(msg.message, msg.category, msg.filename, msg.lineno,
  File "main.py", line 47, in warn_with_traceback
    traceback.print_stack(file=log)
/home/philip/projects/llm_inference_code_repo/Circuit-Completion-Using-GNNs/component_classification_with_link_prediction_head/evaluation/FEGIN/kernel/circuit_datasets.py:15: FutureWarning: You are using `torch.load` with `weights_only=False` (the current default value), which uses the default pickle module implicitly. It is possible to construct malicious pickle data which will execute arbitrary code during unpickling (See https://github.com/pytorch/pytorch/blob/main/SECURITY.md#untrusted-models for more details). In a future release, the default value for `weights_only` will be flipped to `True`. This limits the functions that could be executed during unpickling. Arbitrary objects will no longer be allowed to be loaded via this mode unless they are explicitly allowlisted by the user via `torch.serialization.add_safe_globals`. We recommend you start setting `weights_only=True` for any use case where you don't have full control of the loaded file. Please open an issue on GitHub for any issues related to this experimental feature.
  self.data, self.slices = torch.load(self.processed_paths[0])
