STDOUT:
Results will be saved in /home/philip/projects/ltspice_examples_code_repo/Circuit-Completion-Using-GNNs/component_classification_with_link_prediction_head/evaluation/FEGIN/results/model_FEGIN_dataset_ltspice_examples
Command line input: python main.py --data ltspice_examples --representation component_pin --model FEGIN --layers 6 --hiddens 32 --batch_size 64 --lr 0.01 --emb_size 250 --epochs 100 --save_appendix component_pin_L6_H32_BS64_LR0.01_E250 --no_val
 is saved.
-----
ltspice_examples - FEGIN
Using 6 layers, 32 hidden units, h = 2
Loading component_pin representation dataset
ENTERED
Training FEGIN on component_pin representation
Train: 3560, Test: 848
##################ITERATION #0 ****************************************
 epoch: 0, train_loss: 1.1884, test_loss: 1.2588, test_f1: 0.4493
 epoch: 1, train_loss: 1.0346, test_loss: 1.0364, test_f1: 0.4100
 epoch: 2, train_loss: 0.9856, test_loss: 1.0628, test_f1: 0.5301
 epoch: 3, train_loss: 0.9658, test_loss: 1.1239, test_f1: 0.4445
 epoch: 4, train_loss: 0.9600, test_loss: 1.0221, test_f1: 0.4818
 epoch: 5, train_loss: 0.9333, test_loss: 0.9562, test_f1: 0.5326
 epoch: 6, train_loss: 0.9208, test_loss: 0.8980, test_f1: 0.5274
 epoch: 7, train_loss: 0.8952, test_loss: 0.9574, test_f1: 0.4931
 epoch: 8, train_loss: 0.8918, test_loss: 0.9310, test_f1: 0.5353
 epoch: 9, train_loss: 0.8708, test_loss: 0.8922, test_f1: 0.5235
 epoch: 10, train_loss: 0.8652, test_loss: 0.9099, test_f1: 0.5199
 epoch: 11, train_loss: 0.8551, test_loss: 0.9717, test_f1: 0.4905
 epoch: 12, train_loss: 0.8435, test_loss: 0.9328, test_f1: 0.5351
 epoch: 13, train_loss: 0.8528, test_loss: 0.8724, test_f1: 0.5347
 epoch: 14, train_loss: 0.8253, test_loss: 0.8310, test_f1: 0.5295
 epoch: 15, train_loss: 0.8318, test_loss: 0.8564, test_f1: 0.5518
 epoch: 16, train_loss: 0.8071, test_loss: 0.8852, test_f1: 0.5679
 epoch: 17, train_loss: 0.8032, test_loss: 0.9798, test_f1: 0.5065
 epoch: 18, train_loss: 0.8335, test_loss: 0.9041, test_f1: 0.5760
 epoch: 19, train_loss: 0.8360, test_loss: 0.8529, test_f1: 0.5456
 epoch: 20, train_loss: 0.8044, test_loss: 0.8814, test_f1: 0.5451
 epoch: 21, train_loss: 0.7933, test_loss: 0.8435, test_f1: 0.5643
 epoch: 22, train_loss: 0.7843, test_loss: 0.8088, test_f1: 0.5438
 epoch: 23, train_loss: 0.7707, test_loss: 0.9142, test_f1: 0.5453
 epoch: 24, train_loss: 0.7820, test_loss: 0.8462, test_f1: 0.5746
 epoch: 25, train_loss: 0.7776, test_loss: 0.9332, test_f1: 0.5399
 epoch: 26, train_loss: 0.7726, test_loss: 0.8468, test_f1: 0.5807
 epoch: 27, train_loss: 0.7646, test_loss: 0.8525, test_f1: 0.5503
 epoch: 28, train_loss: 0.7809, test_loss: 0.9067, test_f1: 0.5475
 epoch: 29, train_loss: 0.7767, test_loss: 0.9603, test_f1: 0.5455
 epoch: 30, train_loss: 0.7609, test_loss: 0.9481, test_f1: 0.5563
 epoch: 31, train_loss: 0.7559, test_loss: 0.9052, test_f1: 0.5581
 epoch: 32, train_loss: 0.7469, test_loss: 0.8090, test_f1: 0.5593
 epoch: 33, train_loss: 0.7265, test_loss: 0.8504, test_f1: 0.5462
 epoch: 34, train_loss: 0.7312, test_loss: 0.8292, test_f1: 0.5534
 epoch: 35, train_loss: 0.7397, test_loss: 0.8194, test_f1: 0.5843
 epoch: 36, train_loss: 0.7367, test_loss: 0.8575, test_f1: 0.5548
 epoch: 37, train_loss: 0.7331, test_loss: 0.8661, test_f1: 0.5370
 epoch: 38, train_loss: 0.7375, test_loss: 0.8281, test_f1: 0.5432
 epoch: 39, train_loss: 0.7144, test_loss: 0.8380, test_f1: 0.5611
 epoch: 40, train_loss: 0.7335, test_loss: 0.8796, test_f1: 0.5415
 epoch: 41, train_loss: 0.7080, test_loss: 0.9520, test_f1: 0.5556
 epoch: 42, train_loss: 0.7210, test_loss: 0.7911, test_f1: 0.6000
 epoch: 43, train_loss: 0.7179, test_loss: 0.8259, test_f1: 0.5401
 epoch: 44, train_loss: 0.7084, test_loss: 0.8629, test_f1: 0.5678
 epoch: 45, train_loss: 0.6843, test_loss: 0.8770, test_f1: 0.5740
 epoch: 46, train_loss: 0.6935, test_loss: 0.8969, test_f1: 0.5649
 epoch: 47, train_loss: 0.7169, test_loss: 0.9143, test_f1: 0.5673
 epoch: 48, train_loss: 0.7126, test_loss: 0.8445, test_f1: 0.5930
 epoch: 49, train_loss: 0.7081, test_loss: 0.8073, test_f1: 0.5603
 epoch: 50, train_loss: 0.6991, test_loss: 0.8578, test_f1: 0.6380
 epoch: 51, train_loss: 0.6620, test_loss: 0.7648, test_f1: 0.5928
 epoch: 52, train_loss: 0.6466, test_loss: 0.8876, test_f1: 0.5901
 epoch: 53, train_loss: 0.6624, test_loss: 0.8302, test_f1: 0.6071
 epoch: 54, train_loss: 0.6497, test_loss: 0.7779, test_f1: 0.5975
 epoch: 55, train_loss: 0.6351, test_loss: 0.8281, test_f1: 0.5890
 epoch: 56, train_loss: 0.6442, test_loss: 0.8665, test_f1: 0.5761
 epoch: 57, train_loss: 0.6528, test_loss: 10.0705, test_f1: 0.5683
 epoch: 58, train_loss: 0.6220, test_loss: 0.8493, test_f1: 0.5999
 epoch: 59, train_loss: 0.6125, test_loss: 0.9291, test_f1: 0.5942
 epoch: 60, train_loss: 0.6389, test_loss: 0.8476, test_f1: 0.6119
 epoch: 61, train_loss: 0.6421, test_loss: 0.9023, test_f1: 0.6284
 epoch: 62, train_loss: 0.6242, test_loss: 0.9402, test_f1: 0.5961
 epoch: 63, train_loss: 0.6119, test_loss: 0.8470, test_f1: 0.5832
 epoch: 64, train_loss: 0.6213, test_loss: 0.8535, test_f1: 0.5935
 epoch: 65, train_loss: 0.6280, test_loss: 0.8714, test_f1: 0.6122
 epoch: 66, train_loss: 0.6206, test_loss: 0.8497, test_f1: 0.5997
 epoch: 67, train_loss: 0.6158, test_loss: 0.8930, test_f1: 0.5953
 epoch: 68, train_loss: 0.6220, test_loss: 0.9142, test_f1: 0.5994
 epoch: 69, train_loss: 0.6113, test_loss: 0.9338, test_f1: 0.5776
 epoch: 70, train_loss: 0.6092, test_loss: 0.9120, test_f1: 0.6236
 epoch: 71, train_loss: 0.6022, test_loss: 0.8191, test_f1: 0.6233
 epoch: 72, train_loss: 0.6001, test_loss: 0.9063, test_f1: 0.6289
 epoch: 73, train_loss: 0.6045, test_loss: 0.9240, test_f1: 0.6094
 epoch: 74, train_loss: 0.6070, test_loss: 0.9102, test_f1: 0.6338
 epoch: 75, train_loss: 0.6116, test_loss: 0.9062, test_f1: 0.6026
 epoch: 76, train_loss: 0.5947, test_loss: 0.8901, test_f1: 0.6549
 epoch: 77, train_loss: 0.6044, test_loss: 0.8897, test_f1: 0.6338
 epoch: 78, train_loss: 0.6152, test_loss: 0.8487, test_f1: 0.6348
 epoch: 79, train_loss: 0.5870, test_loss: 0.8332, test_f1: 0.6078
 epoch: 80, train_loss: 0.6039, test_loss: 0.9237, test_f1: 0.6069
 epoch: 81, train_loss: 0.5971, test_loss: 0.8647, test_f1: 0.6179
 epoch: 82, train_loss: 0.5834, test_loss: 0.8944, test_f1: 0.6037
 epoch: 83, train_loss: 0.5978, test_loss: 0.8349, test_f1: 0.6331
 epoch: 84, train_loss: 0.5985, test_loss: 0.8445, test_f1: 0.5965
 epoch: 85, train_loss: 0.5902, test_loss: 0.8238, test_f1: 0.6443
 epoch: 86, train_loss: 0.5940, test_loss: 0.8490, test_f1: 0.6342
 epoch: 87, train_loss: 0.5836, test_loss: 0.9280, test_f1: 0.6041
 epoch: 88, train_loss: 0.5913, test_loss: 0.9095, test_f1: 0.6015
 epoch: 89, train_loss: 0.5721, test_loss: 0.8780, test_f1: 0.6191
 epoch: 90, train_loss: 0.5962, test_loss: 0.9821, test_f1: 0.6074
 epoch: 91, train_loss: 0.5808, test_loss: 0.8188, test_f1: 0.6398
 epoch: 92, train_loss: 0.5703, test_loss: 0.8109, test_f1: 0.6398
 epoch: 93, train_loss: 0.5764, test_loss: 0.9851, test_f1: 0.5962
 epoch: 94, train_loss: 0.5710, test_loss: 0.9031, test_f1: 0.6233
 epoch: 95, train_loss: 0.5467, test_loss: 0.9278, test_f1: 0.6189
 epoch: 96, train_loss: 0.5690, test_loss: 0.9237, test_f1: 0.6083
 epoch: 97, train_loss: 0.5558, test_loss: 0.8859, test_f1: 0.6223
 epoch: 98, train_loss: 0.5534, test_loss: 0.9479, test_f1: 0.6507
 epoch: 99, train_loss: 0.5751, test_loss: 0.9432, test_f1: 0.6143
##################ITERATION #1 ****************************************
 epoch: 0, train_loss: 1.1165, test_loss: 1.0489, test_f1: 0.3636
 epoch: 1, train_loss: 1.0255, test_loss: 1.0694, test_f1: 0.4981
 epoch: 2, train_loss: 0.9961, test_loss: 1.0342, test_f1: 0.4453
 epoch: 3, train_loss: 0.9812, test_loss: 0.9537, test_f1: 0.4981
 epoch: 4, train_loss: 0.9470, test_loss: 1.0029, test_f1: 0.4828
 epoch: 5, train_loss: 0.9419, test_loss: 0.9535, test_f1: 0.5095
 epoch: 6, train_loss: 0.9472, test_loss: 0.9154, test_f1: 0.4956
 epoch: 7, train_loss: 0.9173, test_loss: 0.9519, test_f1: 0.5061
 epoch: 8, train_loss: 0.9019, test_loss: 0.9214, test_f1: 0.4986
 epoch: 9, train_loss: 0.8827, test_loss: 0.9283, test_f1: 0.5060
 epoch: 10, train_loss: 0.8784, test_loss: 0.9367, test_f1: 0.5200
 epoch: 11, train_loss: 0.8744, test_loss: 0.9531, test_f1: 0.5160
 epoch: 12, train_loss: 0.8776, test_loss: 0.9374, test_f1: 0.4961
 epoch: 13, train_loss: 0.8526, test_loss: 0.8754, test_f1: 0.5323
 epoch: 14, train_loss: 0.8472, test_loss: 0.8584, test_f1: 0.5335
 epoch: 15, train_loss: 0.8306, test_loss: 0.8988, test_f1: 0.5357
 epoch: 16, train_loss: 0.8322, test_loss: 0.8470, test_f1: 0.5428
 epoch: 17, train_loss: 0.8266, test_loss: 0.9479, test_f1: 0.5357
 epoch: 18, train_loss: 0.8413, test_loss: 0.8349, test_f1: 0.5468
 epoch: 19, train_loss: 0.8166, test_loss: 0.9492, test_f1: 0.5478
 epoch: 20, train_loss: 0.7989, test_loss: 0.8562, test_f1: 0.5467
 epoch: 21, train_loss: 0.8111, test_loss: 1.0419, test_f1: 0.4806
 epoch: 22, train_loss: 0.7975, test_loss: 0.9733, test_f1: 0.5161
 epoch: 23, train_loss: 0.7850, test_loss: 0.8919, test_f1: 0.5992
 epoch: 24, train_loss: 0.7737, test_loss: 0.8515, test_f1: 0.5522
 epoch: 25, train_loss: 0.7745, test_loss: 0.8471, test_f1: 0.5642
 epoch: 26, train_loss: 0.7759, test_loss: 0.9327, test_f1: 0.5487
 epoch: 27, train_loss: 0.7852, test_loss: 1.0375, test_f1: 0.4982
 epoch: 28, train_loss: 0.7872, test_loss: 0.9292, test_f1: 0.5710
 epoch: 29, train_loss: 0.7601, test_loss: 0.9502, test_f1: 0.5379
 epoch: 30, train_loss: 0.7676, test_loss: 0.8902, test_f1: 0.5859
 epoch: 31, train_loss: 0.7458, test_loss: 0.9042, test_f1: 0.5429
 epoch: 32, train_loss: 0.7586, test_loss: 0.8890, test_f1: 0.6198
 epoch: 33, train_loss: 0.7477, test_loss: 0.8579, test_f1: 0.6315
 epoch: 34, train_loss: 0.7298, test_loss: 0.9148, test_f1: 0.6243
 epoch: 35, train_loss: 0.7407, test_loss: 0.9597, test_f1: 0.5532
 epoch: 36, train_loss: 0.7278, test_loss: 0.8605, test_f1: 0.5809
 epoch: 37, train_loss: 0.7602, test_loss: 0.9489, test_f1: 0.5776
 epoch: 38, train_loss: 0.7419, test_loss: 0.9116, test_f1: 0.6265
 epoch: 39, train_loss: 0.7031, test_loss: 0.9188, test_f1: 0.6246
 epoch: 40, train_loss: 0.7094, test_loss: 0.9949, test_f1: 0.6088
 epoch: 41, train_loss: 0.7164, test_loss: 1.0193, test_f1: 0.6020
 epoch: 42, train_loss: 0.7149, test_loss: 0.9503, test_f1: 0.5889
 epoch: 43, train_loss: 0.6995, test_loss: 0.8947, test_f1: 0.6144
 epoch: 44, train_loss: 0.7091, test_loss: 0.8930, test_f1: 0.5881
 epoch: 45, train_loss: 0.7202, test_loss: 0.9703, test_f1: 0.6213
 epoch: 46, train_loss: 0.7106, test_loss: 1.0175, test_f1: 0.5762
 epoch: 47, train_loss: 0.7069, test_loss: 1.1259, test_f1: 0.5390
 epoch: 48, train_loss: 0.6957, test_loss: 1.0819, test_f1: 0.6029
 epoch: 49, train_loss: 0.6879, test_loss: 1.1060, test_f1: 0.5924
 epoch: 50, train_loss: 0.6868, test_loss: 0.9970, test_f1: 0.6016
 epoch: 51, train_loss: 0.6621, test_loss: 0.9256, test_f1: 0.6112
 epoch: 52, train_loss: 0.6384, test_loss: 0.9943, test_f1: 0.6543
 epoch: 53, train_loss: 0.6374, test_loss: 1.1362, test_f1: 0.6378
 epoch: 54, train_loss: 0.6486, test_loss: 0.8940, test_f1: 0.6245
 epoch: 55, train_loss: 0.6243, test_loss: 1.1281, test_f1: 0.5745
 epoch: 56, train_loss: 0.6274, test_loss: 0.9533, test_f1: 0.6365
 epoch: 57, train_loss: 0.6174, test_loss: 1.1599, test_f1: 0.5814
 epoch: 58, train_loss: 0.6237, test_loss: 0.9556, test_f1: 0.6549
 epoch: 59, train_loss: 0.6131, test_loss: 0.9355, test_f1: 0.6459
 epoch: 60, train_loss: 0.6152, test_loss: 1.0857, test_f1: 0.6248
 epoch: 61, train_loss: 0.6099, test_loss: 1.0099, test_f1: 0.6460
 epoch: 62, train_loss: 0.6160, test_loss: 1.0495, test_f1: 0.6047
 epoch: 63, train_loss: 0.6022, test_loss: 0.9767, test_f1: 0.6243
 epoch: 64, train_loss: 0.6242, test_loss: 1.0208, test_f1: 0.5973
 epoch: 65, train_loss: 0.6028, test_loss: 0.9826, test_f1: 0.6298
 epoch: 66, train_loss: 0.6024, test_loss: 1.0285, test_f1: 0.6425
 epoch: 67, train_loss: 0.5923, test_loss: 1.0801, test_f1: 0.6381
 epoch: 68, train_loss: 0.5914, test_loss: 0.9524, test_f1: 0.6557
 epoch: 69, train_loss: 0.5839, test_loss: 0.9971, test_f1: 0.6298
 epoch: 70, train_loss: 0.6091, test_loss: 1.0540, test_f1: 0.6323
 epoch: 71, train_loss: 0.5973, test_loss: 1.0872, test_f1: 0.6278
 epoch: 72, train_loss: 0.5782, test_loss: 1.0578, test_f1: 0.6433
 epoch: 73, train_loss: 0.5781, test_loss: 0.9696, test_f1: 0.6586
 epoch: 74, train_loss: 0.6028, test_loss: 1.0215, test_f1: 0.6402
 epoch: 75, train_loss: 0.5934, test_loss: 1.0392, test_f1: 0.6726
 epoch: 76, train_loss: 0.5801, test_loss: 1.0035, test_f1: 0.6427
 epoch: 77, train_loss: 0.5713, test_loss: 1.0384, test_f1: 0.6325
 epoch: 78, train_loss: 0.5833, test_loss: 1.0519, test_f1: 0.6358
 epoch: 79, train_loss: 0.5930, test_loss: 1.0529, test_f1: 0.6455
 epoch: 80, train_loss: 0.5884, test_loss: 1.0976, test_f1: 0.6286
 epoch: 81, train_loss: 0.5700, test_loss: 1.0873, test_f1: 0.6393
 epoch: 82, train_loss: 0.5676, test_loss: 1.0854, test_f1: 0.6673
 epoch: 83, train_loss: 0.5845, test_loss: 0.9479, test_f1: 0.6305
 epoch: 84, train_loss: 0.5608, test_loss: 0.8967, test_f1: 0.6408
 epoch: 85, train_loss: 0.5586, test_loss: 1.0873, test_f1: 0.6506
 epoch: 86, train_loss: 0.5512, test_loss: 0.8712, test_f1: 0.6438
 epoch: 87, train_loss: 0.5587, test_loss: 1.1272, test_f1: 0.6105
 epoch: 88, train_loss: 0.5499, test_loss: 1.1485, test_f1: 0.6220
 epoch: 89, train_loss: 0.5605, test_loss: 1.2787, test_f1: 0.6160
 epoch: 90, train_loss: 0.5559, test_loss: 1.0716, test_f1: 0.6070
 epoch: 91, train_loss: 0.5604, test_loss: 1.1878, test_f1: 0.6361
 epoch: 92, train_loss: 0.5657, test_loss: 1.2593, test_f1: 0.5989
 epoch: 93, train_loss: 0.5522, test_loss: 1.0084, test_f1: 0.6579
 epoch: 94, train_loss: 0.5384, test_loss: 1.1866, test_f1: 0.6201
 epoch: 95, train_loss: 0.5613, test_loss: 1.2787, test_f1: 0.6208
 epoch: 96, train_loss: 0.5382, test_loss: 1.1784, test_f1: 0.6384
 epoch: 97, train_loss: 0.5391, test_loss: 1.1169, test_f1: 0.6548
 epoch: 98, train_loss: 0.5338, test_loss: 1.0643, test_f1: 0.6496
 epoch: 99, train_loss: 0.5331, test_loss: 1.3527, test_f1: 0.6472
##################ITERATION #2 ****************************************
 epoch: 0, train_loss: 1.1549, test_loss: 1.1895, test_f1: 0.3816
 epoch: 1, train_loss: 1.0406, test_loss: 1.0122, test_f1: 0.4587
 epoch: 2, train_loss: 1.0192, test_loss: 1.1025, test_f1: 0.3923
 epoch: 3, train_loss: 0.9955, test_loss: 1.0025, test_f1: 0.4645
 epoch: 4, train_loss: 0.9793, test_loss: 1.0536, test_f1: 0.4409
 epoch: 5, train_loss: 0.9593, test_loss: 1.0477, test_f1: 0.4924
 epoch: 6, train_loss: 0.9329, test_loss: 0.9304, test_f1: 0.4973
 epoch: 7, train_loss: 0.9256, test_loss: 1.0753, test_f1: 0.4723
 epoch: 8, train_loss: 0.9235, test_loss: 0.9633, test_f1: 0.4778
 epoch: 9, train_loss: 0.9275, test_loss: 1.0639, test_f1: 0.5071
 epoch: 10, train_loss: 0.8980, test_loss: 1.0054, test_f1: 0.4773
 epoch: 11, train_loss: 0.8815, test_loss: 0.9372, test_f1: 0.4757
 epoch: 12, train_loss: 0.8825, test_loss: 0.9726, test_f1: 0.5260
 epoch: 13, train_loss: 0.8943, test_loss: 0.9490, test_f1: 0.5066
 epoch: 14, train_loss: 0.8591, test_loss: 0.9674, test_f1: 0.5342
 epoch: 15, train_loss: 0.8536, test_loss: 1.0448, test_f1: 0.5304
 epoch: 16, train_loss: 0.8448, test_loss: 1.0272, test_f1: 0.5665
 epoch: 17, train_loss: 0.8695, test_loss: 0.9685, test_f1: 0.4944
 epoch: 18, train_loss: 0.8503, test_loss: 1.0350, test_f1: 0.5619
 epoch: 19, train_loss: 0.8278, test_loss: 0.9574, test_f1: 0.5624
 epoch: 20, train_loss: 0.8335, test_loss: 0.9776, test_f1: 0.5451
 epoch: 21, train_loss: 0.8203, test_loss: 0.9856, test_f1: 0.5651
 epoch: 22, train_loss: 0.8054, test_loss: 0.8449, test_f1: 0.5608
 epoch: 23, train_loss: 0.8018, test_loss: 0.9335, test_f1: 0.5663
 epoch: 24, train_loss: 0.8401, test_loss: 0.9011, test_f1: 0.5915
 epoch: 25, train_loss: 0.8040, test_loss: 0.9716, test_f1: 0.5100
 epoch: 26, train_loss: 0.7923, test_loss: 0.9149, test_f1: 0.5758
 epoch: 27, train_loss: 0.8000, test_loss: 0.8944, test_f1: 0.5673
 epoch: 28, train_loss: 0.7805, test_loss: 1.0044, test_f1: 0.5747
 epoch: 29, train_loss: 0.7904, test_loss: 1.1003, test_f1: 0.5580
 epoch: 30, train_loss: 0.7732, test_loss: 1.1133, test_f1: 0.5351
 epoch: 31, train_loss: 0.7641, test_loss: 1.0128, test_f1: 0.5729
 epoch: 32, train_loss: 0.7769, test_loss: 0.9868, test_f1: 0.6026
 epoch: 33, train_loss: 0.7594, test_loss: 1.1629, test_f1: 0.5268
 epoch: 34, train_loss: 0.7746, test_loss: 0.9838, test_f1: 0.5779
 epoch: 35, train_loss: 0.7537, test_loss: 1.0124, test_f1: 0.5558
 epoch: 36, train_loss: 0.7643, test_loss: 0.9466, test_f1: 0.6211
 epoch: 37, train_loss: 0.7714, test_loss: 0.9014, test_f1: 0.5572
 epoch: 38, train_loss: 0.7429, test_loss: 0.9330, test_f1: 0.5958
 epoch: 39, train_loss: 0.7348, test_loss: 0.9293, test_f1: 0.5728
 epoch: 40, train_loss: 0.7318, test_loss: 1.0874, test_f1: 0.5616
 epoch: 41, train_loss: 0.7372, test_loss: 0.9163, test_f1: 0.6490
 epoch: 42, train_loss: 0.7345, test_loss: 0.9754, test_f1: 0.6175
 epoch: 43, train_loss: 0.7322, test_loss: 1.0551, test_f1: 0.5647
 epoch: 44, train_loss: 0.7226, test_loss: 0.9368, test_f1: 0.6305
 epoch: 45, train_loss: 0.7153, test_loss: 0.9485, test_f1: 0.6341
 epoch: 46, train_loss: 0.6977, test_loss: 1.0052, test_f1: 0.5299
 epoch: 47, train_loss: 0.7228, test_loss: 0.9784, test_f1: 0.6343
 epoch: 48, train_loss: 0.7379, test_loss: 0.9656, test_f1: 0.6031
 epoch: 49, train_loss: 0.6944, test_loss: 0.9134, test_f1: 0.6242
 epoch: 50, train_loss: 0.7035, test_loss: 1.2313, test_f1: 0.5617
 epoch: 51, train_loss: 0.6766, test_loss: 0.9802, test_f1: 0.6361
 epoch: 52, train_loss: 0.6574, test_loss: 1.0127, test_f1: 0.6427
 epoch: 53, train_loss: 0.6367, test_loss: 1.1126, test_f1: 0.6544
 epoch: 54, train_loss: 0.6598, test_loss: 0.9821, test_f1: 0.6447
 epoch: 55, train_loss: 0.6453, test_loss: 0.9495, test_f1: 0.6592
 epoch: 56, train_loss: 0.6481, test_loss: 1.0583, test_f1: 0.6278
 epoch: 57, train_loss: 0.6431, test_loss: 1.0426, test_f1: 0.6450
 epoch: 58, train_loss: 0.6373, test_loss: 0.9240, test_f1: 0.6501
 epoch: 59, train_loss: 0.6357, test_loss: 0.9627, test_f1: 0.6208
 epoch: 60, train_loss: 0.6448, test_loss: 0.9527, test_f1: 0.6527
 epoch: 61, train_loss: 0.6230, test_loss: 1.0290, test_f1: 0.6271
 epoch: 62, train_loss: 0.6356, test_loss: 0.9542, test_f1: 0.6467
 epoch: 63, train_loss: 0.6311, test_loss: 1.0223, test_f1: 0.6283
 epoch: 64, train_loss: 0.6199, test_loss: 0.9430, test_f1: 0.6213
 epoch: 65, train_loss: 0.6343, test_loss: 0.9347, test_f1: 0.6557
 epoch: 66, train_loss: 0.6117, test_loss: 1.0502, test_f1: 0.6353
 epoch: 67, train_loss: 0.6184, test_loss: 1.0025, test_f1: 0.6187
 epoch: 68, train_loss: 0.6109, test_loss: 1.0453, test_f1: 0.6198
 epoch: 69, train_loss: 0.6159, test_loss: 0.9674, test_f1: 0.6733
 epoch: 70, train_loss: 0.6198, test_loss: 1.0575, test_f1: 0.6181
 epoch: 71, train_loss: 0.6078, test_loss: 0.9837, test_f1: 0.6226
 epoch: 72, train_loss: 0.5964, test_loss: 1.0060, test_f1: 0.6423
 epoch: 73, train_loss: 0.6014, test_loss: 1.0813, test_f1: 0.6231
 epoch: 74, train_loss: 0.6093, test_loss: 0.9646, test_f1: 0.6481
 epoch: 75, train_loss: 0.6067, test_loss: 0.9657, test_f1: 0.6370
 epoch: 76, train_loss: 0.5938, test_loss: 0.8651, test_f1: 0.6489
 epoch: 77, train_loss: 0.6076, test_loss: 0.9509, test_f1: 0.6309
 epoch: 78, train_loss: 0.6023, test_loss: 1.1317, test_f1: 0.6219
 epoch: 79, train_loss: 0.6038, test_loss: 1.0869, test_f1: 0.6096
 epoch: 80, train_loss: 0.5990, test_loss: 0.9345, test_f1: 0.6346
 epoch: 81, train_loss: 0.6130, test_loss: 0.8658, test_f1: 0.6354
 epoch: 82, train_loss: 0.5890, test_loss: 1.0435, test_f1: 0.5785
 epoch: 83, train_loss: 0.5902, test_loss: 1.0686, test_f1: 0.6452
 epoch: 84, train_loss: 0.5905, test_loss: 1.0528, test_f1: 0.6549
 epoch: 85, train_loss: 0.5789, test_loss: 0.9223, test_f1: 0.6447
 epoch: 86, train_loss: 0.5768, test_loss: 0.9364, test_f1: 0.6594
 epoch: 87, train_loss: 0.5781, test_loss: 1.0245, test_f1: 0.6437
 epoch: 88, train_loss: 0.5708, test_loss: 1.0213, test_f1: 0.6438
 epoch: 89, train_loss: 0.5821, test_loss: 0.9554, test_f1: 0.6544
 epoch: 90, train_loss: 0.5726, test_loss: 1.0257, test_f1: 0.6375
 epoch: 91, train_loss: 0.5539, test_loss: 1.1282, test_f1: 0.6150
 epoch: 92, train_loss: 0.5685, test_loss: 1.0688, test_f1: 0.6330
 epoch: 93, train_loss: 0.5752, test_loss: 0.9955, test_f1: 0.6460
 epoch: 94, train_loss: 0.5794, test_loss: 1.0674, test_f1: 0.6463
 epoch: 95, train_loss: 0.5509, test_loss: 1.0768, test_f1: 0.6381
 epoch: 96, train_loss: 0.5729, test_loss: 0.9367, test_f1: 0.6539
 epoch: 97, train_loss: 0.5833, test_loss: 1.0047, test_f1: 0.6258
 epoch: 98, train_loss: 0.5656, test_loss: 1.1636, test_f1: 0.6459
 epoch: 99, train_loss: 0.5441, test_loss: 1.0811, test_f1: 0.6141
##################ITERATION #3 ****************************************
 epoch: 0, train_loss: 1.1646, test_loss: 1.1023, test_f1: 0.3347
 epoch: 1, train_loss: 1.0592, test_loss: 1.0805, test_f1: 0.3846
 epoch: 2, train_loss: 1.0339, test_loss: 1.1168, test_f1: 0.4612
 epoch: 3, train_loss: 1.0125, test_loss: 0.9809, test_f1: 0.4807
 epoch: 4, train_loss: 0.9957, test_loss: 1.0390, test_f1: 0.4410
 epoch: 5, train_loss: 0.9736, test_loss: 1.1326, test_f1: 0.4274
 epoch: 6, train_loss: 0.9636, test_loss: 0.9723, test_f1: 0.4866
 epoch: 7, train_loss: 0.9514, test_loss: 0.9317, test_f1: 0.5033
 epoch: 8, train_loss: 0.9461, test_loss: 0.9798, test_f1: 0.5232
 epoch: 9, train_loss: 0.9208, test_loss: 0.9611, test_f1: 0.5168
 epoch: 10, train_loss: 0.8977, test_loss: 1.0137, test_f1: 0.4817
 epoch: 11, train_loss: 0.9119, test_loss: 0.9636, test_f1: 0.5334
 epoch: 12, train_loss: 0.8928, test_loss: 0.9887, test_f1: 0.5226
 epoch: 13, train_loss: 0.8729, test_loss: 1.0875, test_f1: 0.4716
 epoch: 14, train_loss: 0.8681, test_loss: 1.0552, test_f1: 0.5119
 epoch: 15, train_loss: 0.8475, test_loss: 0.9612, test_f1: 0.5131
 epoch: 16, train_loss: 0.8559, test_loss: 1.0831, test_f1: 0.4546
 epoch: 17, train_loss: 0.8520, test_loss: 0.9717, test_f1: 0.5778
 epoch: 18, train_loss: 0.8393, test_loss: 0.9968, test_f1: 0.5333
 epoch: 19, train_loss: 0.8423, test_loss: 1.0166, test_f1: 0.5382
 epoch: 20, train_loss: 0.8338, test_loss: 0.8683, test_f1: 0.5312
 epoch: 21, train_loss: 0.8352, test_loss: 0.9573, test_f1: 0.4941
 epoch: 22, train_loss: 0.8289, test_loss: 0.9862, test_f1: 0.5283
 epoch: 23, train_loss: 0.8012, test_loss: 0.9867, test_f1: 0.5344
 epoch: 24, train_loss: 0.7967, test_loss: 1.0554, test_f1: 0.5072
 epoch: 25, train_loss: 0.8108, test_loss: 0.9252, test_f1: 0.5729
 epoch: 26, train_loss: 0.7930, test_loss: 1.1115, test_f1: 0.5187
 epoch: 27, train_loss: 0.7923, test_loss: 0.8803, test_f1: 0.5625
 epoch: 28, train_loss: 0.7820, test_loss: 0.8527, test_f1: 0.5506
 epoch: 29, train_loss: 0.7999, test_loss: 0.9166, test_f1: 0.5559
 epoch: 30, train_loss: 0.7692, test_loss: 0.9794, test_f1: 0.5452
 epoch: 31, train_loss: 0.7785, test_loss: 0.9336, test_f1: 0.6295
 epoch: 32, train_loss: 0.8019, test_loss: 0.9262, test_f1: 0.5400
 epoch: 33, train_loss: 0.7770, test_loss: 1.0469, test_f1: 0.4947
 epoch: 34, train_loss: 0.7647, test_loss: 0.9441, test_f1: 0.5294
 epoch: 35, train_loss: 0.7578, test_loss: 1.0078, test_f1: 0.5507
 epoch: 36, train_loss: 0.7532, test_loss: 1.3085, test_f1: 0.5120
 epoch: 37, train_loss: 0.7779, test_loss: 1.0039, test_f1: 0.5213
 epoch: 38, train_loss: 0.7641, test_loss: 1.0070, test_f1: 0.5481
 epoch: 39, train_loss: 0.7384, test_loss: 0.9645, test_f1: 0.5656
 epoch: 40, train_loss: 0.7320, test_loss: 0.9982, test_f1: 0.5546
 epoch: 41, train_loss: 0.7347, test_loss: 0.9913, test_f1: 0.5614
 epoch: 42, train_loss: 0.7536, test_loss: 1.0328, test_f1: 0.5306
 epoch: 43, train_loss: 0.7465, test_loss: 0.8393, test_f1: 0.5495
 epoch: 44, train_loss: 0.7268, test_loss: 0.9623, test_f1: 0.5947
 epoch: 45, train_loss: 0.7339, test_loss: 2.2488, test_f1: 0.5431
 epoch: 46, train_loss: 0.7185, test_loss: 1.0048, test_f1: 0.5459
 epoch: 47, train_loss: 0.7210, test_loss: 0.9938, test_f1: 0.5947
 epoch: 48, train_loss: 0.7253, test_loss: 1.0355, test_f1: 0.5407
 epoch: 49, train_loss: 0.7396, test_loss: 0.9984, test_f1: 0.6016
 epoch: 50, train_loss: 0.7229, test_loss: 1.0397, test_f1: 0.5937
 epoch: 51, train_loss: 0.6930, test_loss: 1.1106, test_f1: 0.5679
 epoch: 52, train_loss: 0.6744, test_loss: 0.9939, test_f1: 0.6096
 epoch: 53, train_loss: 0.6748, test_loss: 0.8611, test_f1: 0.6042
 epoch: 54, train_loss: 0.6600, test_loss: 0.8630, test_f1: 0.5866
 epoch: 55, train_loss: 0.6674, test_loss: 0.9221, test_f1: 0.6044
 epoch: 56, train_loss: 0.6538, test_loss: 0.9157, test_f1: 0.6089
 epoch: 57, train_loss: 0.6577, test_loss: 0.9251, test_f1: 0.5898
 epoch: 58, train_loss: 0.6536, test_loss: 0.8922, test_f1: 0.5892
 epoch: 59, train_loss: 0.6372, test_loss: 0.9314, test_f1: 0.6136
 epoch: 60, train_loss: 0.6424, test_loss: 0.9085, test_f1: 0.5979
 epoch: 61, train_loss: 0.6427, test_loss: 0.9656, test_f1: 0.5937
 epoch: 62, train_loss: 0.6393, test_loss: 0.9642, test_f1: 0.6075
 epoch: 63, train_loss: 0.6417, test_loss: 0.9059, test_f1: 0.6274
 epoch: 64, train_loss: 0.6389, test_loss: 0.9318, test_f1: 0.6083
 epoch: 65, train_loss: 0.6343, test_loss: 1.0402, test_f1: 0.5724
 epoch: 66, train_loss: 0.6336, test_loss: 0.9440, test_f1: 0.5965
 epoch: 67, train_loss: 0.6168, test_loss: 0.9202, test_f1: 0.5825
 epoch: 68, train_loss: 0.6186, test_loss: 0.9432, test_f1: 0.6356
 epoch: 69, train_loss: 0.6391, test_loss: 1.0301, test_f1: 0.5447
 epoch: 70, train_loss: 0.6272, test_loss: 1.0469, test_f1: 0.5684
 epoch: 71, train_loss: 0.6193, test_loss: 0.9610, test_f1: 0.6007
 epoch: 72, train_loss: 0.6371, test_loss: 0.9875, test_f1: 0.5830
 epoch: 73, train_loss: 0.6187, test_loss: 1.1336, test_f1: 0.5563
 epoch: 74, train_loss: 0.6138, test_loss: 1.0042, test_f1: 0.6049
 epoch: 75, train_loss: 0.6184, test_loss: 0.9867, test_f1: 0.6149
 epoch: 76, train_loss: 0.6157, test_loss: 0.9703, test_f1: 0.6325
 epoch: 77, train_loss: 0.6184, test_loss: 1.0056, test_f1: 0.6345
 epoch: 78, train_loss: 0.6107, test_loss: 1.0449, test_f1: 0.6434
 epoch: 79, train_loss: 0.6032, test_loss: 0.9499, test_f1: 0.6001
 epoch: 80, train_loss: 0.6217, test_loss: 0.9870, test_f1: 0.6033
 epoch: 81, train_loss: 0.6044, test_loss: 0.9700, test_f1: 0.6421
 epoch: 82, train_loss: 0.5931, test_loss: 1.1147, test_f1: 0.6264
 epoch: 83, train_loss: 0.6034, test_loss: 1.1767, test_f1: 0.5669
 epoch: 84, train_loss: 0.6085, test_loss: 1.0546, test_f1: 0.6226
 epoch: 85, train_loss: 0.5923, test_loss: 1.0307, test_f1: 0.6213
 epoch: 86, train_loss: 0.5837, test_loss: 0.9402, test_f1: 0.6482
 epoch: 87, train_loss: 0.5977, test_loss: 1.0298, test_f1: 0.5971
 epoch: 88, train_loss: 0.6114, test_loss: 1.0642, test_f1: 0.6050
 epoch: 89, train_loss: 0.5886, test_loss: 1.0556, test_f1: 0.6444
 epoch: 90, train_loss: 0.5847, test_loss: 1.0432, test_f1: 0.6113
 epoch: 91, train_loss: 0.6043, test_loss: 1.0297, test_f1: 0.6543
 epoch: 92, train_loss: 0.5799, test_loss: 1.0821, test_f1: 0.5845
 epoch: 93, train_loss: 0.5830, test_loss: 0.9958, test_f1: 0.6417
 epoch: 94, train_loss: 0.5533, test_loss: 1.0707, test_f1: 0.6457
 epoch: 95, train_loss: 0.5907, test_loss: 0.9823, test_f1: 0.6671
 epoch: 96, train_loss: 0.5709, test_loss: 1.1399, test_f1: 0.6352
 epoch: 97, train_loss: 0.5829, test_loss: 1.1351, test_f1: 0.6297
 epoch: 98, train_loss: 0.5855, test_loss: 1.2610, test_f1: 0.6166
 epoch: 99, train_loss: 0.5726, test_loss: 1.1287, test_f1: 0.6316
##################ITERATION #4 ****************************************
 epoch: 0, train_loss: 1.1667, test_loss: 1.0944, test_f1: 0.3750
 epoch: 1, train_loss: 1.0632, test_loss: 1.1586, test_f1: 0.3706
 epoch: 2, train_loss: 1.0252, test_loss: 1.0244, test_f1: 0.4616
 epoch: 3, train_loss: 1.0007, test_loss: 1.0632, test_f1: 0.4425
 epoch: 4, train_loss: 0.9851, test_loss: 0.9954, test_f1: 0.4780
 epoch: 5, train_loss: 0.9511, test_loss: 1.0475, test_f1: 0.4860
 epoch: 6, train_loss: 0.9253, test_loss: 0.9520, test_f1: 0.5224
 epoch: 7, train_loss: 0.9428, test_loss: 1.0001, test_f1: 0.5586
 epoch: 8, train_loss: 0.9227, test_loss: 1.0026, test_f1: 0.5018
 epoch: 9, train_loss: 0.9198, test_loss: 0.9648, test_f1: 0.5343
 epoch: 10, train_loss: 0.9202, test_loss: 1.6089, test_f1: 0.5115
 epoch: 11, train_loss: 0.9060, test_loss: 1.0417, test_f1: 0.4833
 epoch: 12, train_loss: 0.8954, test_loss: 0.9734, test_f1: 0.5226
 epoch: 13, train_loss: 0.8684, test_loss: 1.1400, test_f1: 0.4635
 epoch: 14, train_loss: 0.8868, test_loss: 0.9422, test_f1: 0.5076
 epoch: 15, train_loss: 0.8961, test_loss: 0.9692, test_f1: 0.5287
 epoch: 16, train_loss: 0.8670, test_loss: 0.9188, test_f1: 0.5292
 epoch: 17, train_loss: 0.8762, test_loss: 1.2229, test_f1: 0.4858
 epoch: 18, train_loss: 0.8884, test_loss: 0.9284, test_f1: 0.5321
 epoch: 19, train_loss: 0.8793, test_loss: 0.9019, test_f1: 0.5437
 epoch: 20, train_loss: 0.8489, test_loss: 1.0116, test_f1: 0.5353
 epoch: 21, train_loss: 0.8409, test_loss: 0.9499, test_f1: 0.5185
 epoch: 22, train_loss: 0.8314, test_loss: 0.8801, test_f1: 0.5300
 epoch: 23, train_loss: 0.8411, test_loss: 0.9918, test_f1: 0.5294
 epoch: 24, train_loss: 0.8416, test_loss: 1.1595, test_f1: 0.5115
 epoch: 25, train_loss: 0.8498, test_loss: 0.9106, test_f1: 0.5439
 epoch: 26, train_loss: 0.8376, test_loss: 0.9836, test_f1: 0.5193
 epoch: 27, train_loss: 0.8250, test_loss: 1.0200, test_f1: 0.5061
 epoch: 28, train_loss: 0.8245, test_loss: 0.9131, test_f1: 0.5588
 epoch: 29, train_loss: 0.8167, test_loss: 1.0496, test_f1: 0.5106
 epoch: 30, train_loss: 0.8074, test_loss: 1.0264, test_f1: 0.5232
 epoch: 31, train_loss: 0.8096, test_loss: 0.9258, test_f1: 0.5439
 epoch: 32, train_loss: 0.7936, test_loss: 1.0199, test_f1: 0.5276
 epoch: 33, train_loss: 0.8037, test_loss: 0.9805, test_f1: 0.5772
 epoch: 34, train_loss: 0.7967, test_loss: 0.9034, test_f1: 0.5605
 epoch: 35, train_loss: 0.7951, test_loss: 0.9593, test_f1: 0.5629
 epoch: 36, train_loss: 0.7774, test_loss: 0.9456, test_f1: 0.5406
 epoch: 37, train_loss: 0.7830, test_loss: 0.9330, test_f1: 0.5595
 epoch: 38, train_loss: 0.7795, test_loss: 0.9467, test_f1: 0.5583
 epoch: 39, train_loss: 0.7823, test_loss: 1.1008, test_f1: 0.5353
 epoch: 40, train_loss: 0.7798, test_loss: 0.9516, test_f1: 0.5401
 epoch: 41, train_loss: 0.7751, test_loss: 0.9512, test_f1: 0.5513
 epoch: 42, train_loss: 0.7628, test_loss: 1.0046, test_f1: 0.6082
 epoch: 43, train_loss: 0.7651, test_loss: 0.8961, test_f1: 0.5767
 epoch: 44, train_loss: 0.7611, test_loss: 0.9028, test_f1: 0.5660
 epoch: 45, train_loss: 0.7633, test_loss: 0.9539, test_f1: 0.5946
 epoch: 46, train_loss: 0.7478, test_loss: 0.9423, test_f1: 0.5276
 epoch: 47, train_loss: 0.7447, test_loss: 1.0003, test_f1: 0.5618
 epoch: 48, train_loss: 0.7392, test_loss: 0.9621, test_f1: 0.5715
 epoch: 49, train_loss: 0.7537, test_loss: 0.9883, test_f1: 0.5631
 epoch: 50, train_loss: 0.7306, test_loss: 0.9411, test_f1: 0.5647
 epoch: 51, train_loss: 0.7088, test_loss: 0.9293, test_f1: 0.5744
 epoch: 52, train_loss: 0.7111, test_loss: 0.9333, test_f1: 0.6164
 epoch: 53, train_loss: 0.6775, test_loss: 0.9175, test_f1: 0.5697
 epoch: 54, train_loss: 0.6779, test_loss: 1.0122, test_f1: 0.5534
 epoch: 55, train_loss: 0.6737, test_loss: 0.8758, test_f1: 0.5889
 epoch: 56, train_loss: 0.6763, test_loss: 0.9256, test_f1: 0.5729
 epoch: 57, train_loss: 0.6899, test_loss: 0.9598, test_f1: 0.6475
 epoch: 58, train_loss: 0.6873, test_loss: 0.8677, test_f1: 0.6029
 epoch: 59, train_loss: 0.6705, test_loss: 1.0276, test_f1: 0.6012
 epoch: 60, train_loss: 0.6787, test_loss: 0.9174, test_f1: 0.6053
 epoch: 61, train_loss: 0.6724, test_loss: 0.9837, test_f1: 0.5956
 epoch: 62, train_loss: 0.6785, test_loss: 0.8907, test_f1: 0.6329
 epoch: 63, train_loss: 0.6769, test_loss: 0.9483, test_f1: 0.6358
 epoch: 64, train_loss: 0.6611, test_loss: 0.9805, test_f1: 0.5981
 epoch: 65, train_loss: 0.6640, test_loss: 0.9800, test_f1: 0.6121
 epoch: 66, train_loss: 0.6423, test_loss: 0.9522, test_f1: 0.5912
 epoch: 67, train_loss: 0.6541, test_loss: 0.8594, test_f1: 0.5865
 epoch: 68, train_loss: 0.6511, test_loss: 0.9199, test_f1: 0.5962
 epoch: 69, train_loss: 0.6446, test_loss: 0.9870, test_f1: 0.5985
 epoch: 70, train_loss: 0.6456, test_loss: 0.9990, test_f1: 0.5936
 epoch: 71, train_loss: 0.6578, test_loss: 0.9729, test_f1: 0.6039
 epoch: 72, train_loss: 0.6579, test_loss: 0.9208, test_f1: 0.6343
 epoch: 73, train_loss: 0.6293, test_loss: 0.9725, test_f1: 0.6010
 epoch: 74, train_loss: 0.6353, test_loss: 1.0399, test_f1: 0.6075
 epoch: 75, train_loss: 0.6319, test_loss: 0.8343, test_f1: 0.6123
 epoch: 76, train_loss: 0.6263, test_loss: 1.0568, test_f1: 0.5875
 epoch: 77, train_loss: 0.6484, test_loss: 0.9378, test_f1: 0.6348
 epoch: 78, train_loss: 0.6322, test_loss: 1.0389, test_f1: 0.5817
 epoch: 79, train_loss: 0.6341, test_loss: 0.9613, test_f1: 0.5924
 epoch: 80, train_loss: 0.6453, test_loss: 1.0269, test_f1: 0.5842
 epoch: 81, train_loss: 0.6249, test_loss: 1.0178, test_f1: 0.6467
 epoch: 82, train_loss: 0.6341, test_loss: 1.0238, test_f1: 0.6051
 epoch: 83, train_loss: 0.6332, test_loss: 1.0211, test_f1: 0.5760
 epoch: 84, train_loss: 0.6304, test_loss: 0.9455, test_f1: 0.6182
 epoch: 85, train_loss: 0.6159, test_loss: 1.0013, test_f1: 0.6167
 epoch: 86, train_loss: 0.6068, test_loss: 1.0485, test_f1: 0.6188
 epoch: 87, train_loss: 0.6213, test_loss: 0.9457, test_f1: 0.6302
 epoch: 88, train_loss: 0.6333, test_loss: 1.0129, test_f1: 0.6212
 epoch: 89, train_loss: 0.6181, test_loss: 1.0345, test_f1: 0.6585
 epoch: 90, train_loss: 0.6312, test_loss: 0.9381, test_f1: 0.6154
 epoch: 91, train_loss: 0.6121, test_loss: 0.9308, test_f1: 0.6232
 epoch: 92, train_loss: 0.6196, test_loss: 1.0561, test_f1: 0.6170
 epoch: 93, train_loss: 0.6137, test_loss: 0.9828, test_f1: 0.6072
 epoch: 94, train_loss: 0.6171, test_loss: 1.0109, test_f1: 0.6314
 epoch: 95, train_loss: 0.6068, test_loss: 1.0035, test_f1: 0.6399
 epoch: 96, train_loss: 0.6172, test_loss: 0.9252, test_f1: 0.5953
 epoch: 97, train_loss: 0.6152, test_loss: 0.9851, test_f1: 0.5936
 epoch: 98, train_loss: 0.6095, test_loss: 1.0707, test_f1: 0.5743
 epoch: 99, train_loss: 0.6003, test_loss: 1.0475, test_f1: 0.6166
##################ITERATION #5 ****************************************
 epoch: 0, train_loss: 1.1319, test_loss: 1.1044, test_f1: 0.4738
 epoch: 1, train_loss: 1.0110, test_loss: 1.1871, test_f1: 0.4079
 epoch: 2, train_loss: 0.9931, test_loss: 1.0293, test_f1: 0.4876
 epoch: 3, train_loss: 0.9762, test_loss: 0.9897, test_f1: 0.4684
 epoch: 4, train_loss: 0.9483, test_loss: 1.0872, test_f1: 0.4605
 epoch: 5, train_loss: 0.9521, test_loss: 1.0030, test_f1: 0.4718
 epoch: 6, train_loss: 0.9290, test_loss: 1.0347, test_f1: 0.4869
 epoch: 7, train_loss: 0.9133, test_loss: 1.0485, test_f1: 0.5032
 epoch: 8, train_loss: 0.8962, test_loss: 0.9727, test_f1: 0.5144
 epoch: 9, train_loss: 0.8995, test_loss: 0.9729, test_f1: 0.4954
 epoch: 10, train_loss: 0.8776, test_loss: 0.9655, test_f1: 0.5272
 epoch: 11, train_loss: 0.8701, test_loss: 1.0559, test_f1: 0.4996
 epoch: 12, train_loss: 0.8800, test_loss: 1.0229, test_f1: 0.5077
 epoch: 13, train_loss: 0.8713, test_loss: 0.9818, test_f1: 0.5232
 epoch: 14, train_loss: 0.8600, test_loss: 1.2567, test_f1: 0.3950
 epoch: 15, train_loss: 0.8644, test_loss: 0.9396, test_f1: 0.5257
 epoch: 16, train_loss: 0.8498, test_loss: 1.0140, test_f1: 0.5358
 epoch: 17, train_loss: 0.8451, test_loss: 0.9309, test_f1: 0.5454
 epoch: 18, train_loss: 0.8389, test_loss: 0.9768, test_f1: 0.5178
 epoch: 19, train_loss: 0.8159, test_loss: 0.9406, test_f1: 0.5355
 epoch: 20, train_loss: 0.8339, test_loss: 0.9391, test_f1: 0.5385
 epoch: 21, train_loss: 0.8181, test_loss: 1.0342, test_f1: 0.5154
 epoch: 22, train_loss: 0.8086, test_loss: 0.9353, test_f1: 0.5268
 epoch: 23, train_loss: 0.7944, test_loss: 1.0649, test_f1: 0.5347
 epoch: 24, train_loss: 0.8178, test_loss: 0.8956, test_f1: 0.5384
 epoch: 25, train_loss: 0.8117, test_loss: 0.9807, test_f1: 0.5178
 epoch: 26, train_loss: 0.7826, test_loss: 0.9948, test_f1: 0.6104
 epoch: 27, train_loss: 0.7865, test_loss: 0.9412, test_f1: 0.5520
 epoch: 28, train_loss: 0.7934, test_loss: 0.9157, test_f1: 0.5509
 epoch: 29, train_loss: 0.7672, test_loss: 1.0101, test_f1: 0.5172
 epoch: 30, train_loss: 0.7751, test_loss: 0.9939, test_f1: 0.5453
 epoch: 31, train_loss: 0.7807, test_loss: 1.0509, test_f1: 0.5342
 epoch: 32, train_loss: 0.7782, test_loss: 1.0125, test_f1: 0.5115
 epoch: 33, train_loss: 0.7641, test_loss: 0.9520, test_f1: 0.5594
 epoch: 34, train_loss: 0.7510, test_loss: 0.9301, test_f1: 0.5753
 epoch: 35, train_loss: 0.7476, test_loss: 1.0905, test_f1: 0.5241
 epoch: 36, train_loss: 0.7731, test_loss: 1.0081, test_f1: 0.5433
 epoch: 37, train_loss: 0.7867, test_loss: 0.9145, test_f1: 0.5520
 epoch: 38, train_loss: 0.7506, test_loss: 0.9798, test_f1: 0.5744
 epoch: 39, train_loss: 0.7624, test_loss: 1.0969, test_f1: 0.5689
 epoch: 40, train_loss: 0.7853, test_loss: 0.9654, test_f1: 0.5476
 epoch: 41, train_loss: 0.7425, test_loss: 0.9786, test_f1: 0.5582
 epoch: 42, train_loss: 0.7460, test_loss: 1.0751, test_f1: 0.5707
 epoch: 43, train_loss: 0.7347, test_loss: 0.9425, test_f1: 0.6112
 epoch: 44, train_loss: 0.7354, test_loss: 1.0583, test_f1: 0.5320
 epoch: 45, train_loss: 0.7210, test_loss: 0.9377, test_f1: 0.6239
 epoch: 46, train_loss: 0.7245, test_loss: 0.9853, test_f1: 0.6076
 epoch: 47, train_loss: 0.7376, test_loss: 1.0825, test_f1: 0.4809
 epoch: 48, train_loss: 0.7204, test_loss: 0.9860, test_f1: 0.5727
 epoch: 49, train_loss: 0.7157, test_loss: 0.9537, test_f1: 0.5832
 epoch: 50, train_loss: 0.7118, test_loss: 0.9769, test_f1: 0.6159
 epoch: 51, train_loss: 0.6838, test_loss: 0.9599, test_f1: 0.5950
 epoch: 52, train_loss: 0.6638, test_loss: 0.9713, test_f1: 0.5724
 epoch: 53, train_loss: 0.6586, test_loss: 1.0314, test_f1: 0.5928
 epoch: 54, train_loss: 0.6572, test_loss: 1.0212, test_f1: 0.5724
 epoch: 55, train_loss: 0.6591, test_loss: 1.0690, test_f1: 0.5779
 epoch: 56, train_loss: 0.6500, test_loss: 1.0421, test_f1: 0.6099
 epoch: 57, train_loss: 0.6394, test_loss: 1.0174, test_f1: 0.5904
 epoch: 58, train_loss: 0.6520, test_loss: 1.0150, test_f1: 0.6191
 epoch: 59, train_loss: 0.6384, test_loss: 1.0174, test_f1: 0.6077
 epoch: 60, train_loss: 0.6505, test_loss: 1.0663, test_f1: 0.6152
 epoch: 61, train_loss: 0.6551, test_loss: 1.0301, test_f1: 0.5978
 epoch: 62, train_loss: 0.6486, test_loss: 1.1278, test_f1: 0.6162
 epoch: 63, train_loss: 0.6656, test_loss: 1.0770, test_f1: 0.6035
 epoch: 64, train_loss: 0.6453, test_loss: 1.0119, test_f1: 0.6312
 epoch: 65, train_loss: 0.6366, test_loss: 1.1044, test_f1: 0.5842
 epoch: 66, train_loss: 0.6357, test_loss: 1.0042, test_f1: 0.6102
 epoch: 67, train_loss: 0.6381, test_loss: 1.0338, test_f1: 0.6336
 epoch: 68, train_loss: 0.6342, test_loss: 1.0990, test_f1: 0.6181
 epoch: 69, train_loss: 0.6445, test_loss: 1.0528, test_f1: 0.6355
 epoch: 70, train_loss: 0.6385, test_loss: 1.0411, test_f1: 0.6190
 epoch: 71, train_loss: 0.6296, test_loss: 1.0309, test_f1: 0.6204
 epoch: 72, train_loss: 0.6221, test_loss: 1.0041, test_f1: 0.6452
 epoch: 73, train_loss: 0.6280, test_loss: 0.9926, test_f1: 0.6492
 epoch: 74, train_loss: 0.6022, test_loss: 1.1569, test_f1: 0.6310
 epoch: 75, train_loss: 0.6437, test_loss: 1.1421, test_f1: 0.5585
 epoch: 76, train_loss: 0.6427, test_loss: 1.1096, test_f1: 0.6226
 epoch: 77, train_loss: 0.6503, test_loss: 1.1174, test_f1: 0.6287
 epoch: 78, train_loss: 0.6304, test_loss: 1.1426, test_f1: 0.6321
 epoch: 79, train_loss: 0.6132, test_loss: 1.1095, test_f1: 0.6155
 epoch: 80, train_loss: 0.6063, test_loss: 1.0109, test_f1: 0.6365
 epoch: 81, train_loss: 0.6153, test_loss: 1.0514, test_f1: 0.6357
 epoch: 82, train_loss: 0.6059, test_loss: 1.0828, test_f1: 0.6396
 epoch: 83, train_loss: 0.6116, test_loss: 1.0276, test_f1: 0.6271
 epoch: 84, train_loss: 0.6092, test_loss: 1.0199, test_f1: 0.6217
 epoch: 85, train_loss: 0.6092, test_loss: 1.0343, test_f1: 0.6221
 epoch: 86, train_loss: 0.6101, test_loss: 1.0339, test_f1: 0.6374
 epoch: 87, train_loss: 0.6019, test_loss: 0.9673, test_f1: 0.6368
 epoch: 88, train_loss: 0.6138, test_loss: 1.0963, test_f1: 0.6119
 epoch: 89, train_loss: 0.5822, test_loss: 1.0187, test_f1: 0.6195
 epoch: 90, train_loss: 0.6079, test_loss: 1.0451, test_f1: 0.6018
 epoch: 91, train_loss: 0.6046, test_loss: 1.1703, test_f1: 0.5801
 epoch: 92, train_loss: 0.5942, test_loss: 1.0335, test_f1: 0.6028
 epoch: 93, train_loss: 0.6090, test_loss: 1.0348, test_f1: 0.6000
 epoch: 94, train_loss: 0.6186, test_loss: 1.0169, test_f1: 0.6048
 epoch: 95, train_loss: 0.6103, test_loss: 1.0981, test_f1: 0.5946
 epoch: 96, train_loss: 0.5905, test_loss: 0.9902, test_f1: 0.6403
 epoch: 97, train_loss: 0.5930, test_loss: 0.9626, test_f1: 0.6379
 epoch: 98, train_loss: 0.5770, test_loss: 1.0293, test_f1: 0.6424
 epoch: 99, train_loss: 0.5673, test_loss: 1.0175, test_f1: 0.6184
##################ITERATION #6 ****************************************
 epoch: 0, train_loss: 1.1781, test_loss: 1.1053, test_f1: 0.4766
 epoch: 1, train_loss: 1.0412, test_loss: 1.1221, test_f1: 0.4120
 epoch: 2, train_loss: 0.9995, test_loss: 0.9610, test_f1: 0.4525
 epoch: 3, train_loss: 0.9499, test_loss: 0.9734, test_f1: 0.4696
 epoch: 4, train_loss: 0.9671, test_loss: 1.0196, test_f1: 0.5017
 epoch: 5, train_loss: 0.9547, test_loss: 0.9903, test_f1: 0.4596
 epoch: 6, train_loss: 0.9153, test_loss: 1.0115, test_f1: 0.4940
 epoch: 7, train_loss: 0.9106, test_loss: 0.9067, test_f1: 0.5075
 epoch: 8, train_loss: 0.8770, test_loss: 1.0079, test_f1: 0.4669
 epoch: 9, train_loss: 0.8943, test_loss: 1.0779, test_f1: 0.4355
 epoch: 10, train_loss: 0.9177, test_loss: 0.8911, test_f1: 0.5269
 epoch: 11, train_loss: 0.8738, test_loss: 0.8873, test_f1: 0.5475
 epoch: 12, train_loss: 0.8928, test_loss: 1.0071, test_f1: 0.4728
 epoch: 13, train_loss: 0.8713, test_loss: 0.9394, test_f1: 0.6062
 epoch: 14, train_loss: 0.8404, test_loss: 0.8700, test_f1: 0.5721
 epoch: 15, train_loss: 0.8586, test_loss: 0.9540, test_f1: 0.4951
 epoch: 16, train_loss: 0.8552, test_loss: 0.8401, test_f1: 0.5538
 epoch: 17, train_loss: 0.8335, test_loss: 0.9055, test_f1: 0.5549
 epoch: 18, train_loss: 0.8431, test_loss: 1.0730, test_f1: 0.5284
 epoch: 19, train_loss: 0.8411, test_loss: 0.9126, test_f1: 0.5701
 epoch: 20, train_loss: 0.8217, test_loss: 0.9667, test_f1: 0.5326
 epoch: 21, train_loss: 0.8350, test_loss: 0.8564, test_f1: 0.5555
 epoch: 22, train_loss: 0.8184, test_loss: 1.0481, test_f1: 0.5029
 epoch: 23, train_loss: 0.8110, test_loss: 0.8480, test_f1: 0.6070
 epoch: 24, train_loss: 0.7997, test_loss: 0.8211, test_f1: 0.6322
 epoch: 25, train_loss: 0.8094, test_loss: 0.8665, test_f1: 0.5459
 epoch: 26, train_loss: 0.8003, test_loss: 0.8871, test_f1: 0.5591
 epoch: 27, train_loss: 0.7959, test_loss: 0.9547, test_f1: 0.5408
 epoch: 28, train_loss: 0.8045, test_loss: 0.8571, test_f1: 0.5683
 epoch: 29, train_loss: 0.7875, test_loss: 0.7672, test_f1: 0.5684
 epoch: 30, train_loss: 0.7798, test_loss: 0.8324, test_f1: 0.5488
 epoch: 31, train_loss: 0.7752, test_loss: 0.8148, test_f1: 0.5618
 epoch: 32, train_loss: 0.7992, test_loss: 0.9078, test_f1: 0.5564
 epoch: 33, train_loss: 0.7830, test_loss: 0.9432, test_f1: 0.5119
 epoch: 34, train_loss: 0.7669, test_loss: 0.8368, test_f1: 0.5761
 epoch: 35, train_loss: 0.7650, test_loss: 0.8791, test_f1: 0.5606
 epoch: 36, train_loss: 0.7600, test_loss: 0.8485, test_f1: 0.5670
 epoch: 37, train_loss: 0.7835, test_loss: 0.8801, test_f1: 0.5597
 epoch: 38, train_loss: 0.7621, test_loss: 0.8757, test_f1: 0.5622
 epoch: 39, train_loss: 0.7621, test_loss: 0.8280, test_f1: 0.6195
 epoch: 40, train_loss: 0.7565, test_loss: 0.8170, test_f1: 0.6205
 epoch: 41, train_loss: 0.7565, test_loss: 0.9302, test_f1: 0.5523
 epoch: 42, train_loss: 0.7517, test_loss: 0.9875, test_f1: 0.6001
 epoch: 43, train_loss: 0.7477, test_loss: 0.9232, test_f1: 0.5866
 epoch: 44, train_loss: 0.7948, test_loss: 0.8125, test_f1: 0.6076
 epoch: 45, train_loss: 0.7592, test_loss: 0.8460, test_f1: 0.6090
 epoch: 46, train_loss: 0.7540, test_loss: 0.8164, test_f1: 0.5952
 epoch: 47, train_loss: 0.7380, test_loss: 0.9328, test_f1: 0.5838
 epoch: 48, train_loss: 0.7199, test_loss: 0.8106, test_f1: 0.6307
 epoch: 49, train_loss: 0.7268, test_loss: 0.8893, test_f1: 0.6114
 epoch: 50, train_loss: 0.7199, test_loss: 0.9356, test_f1: 0.5979
 epoch: 51, train_loss: 0.6863, test_loss: 0.8658, test_f1: 0.6227
 epoch: 52, train_loss: 0.6840, test_loss: 0.9044, test_f1: 0.6188
 epoch: 53, train_loss: 0.6665, test_loss: 0.8852, test_f1: 0.6281
 epoch: 54, train_loss: 0.6713, test_loss: 0.8370, test_f1: 0.6326
 epoch: 55, train_loss: 0.6699, test_loss: 0.8304, test_f1: 0.6566
 epoch: 56, train_loss: 0.6472, test_loss: 0.8275, test_f1: 0.6205
 epoch: 57, train_loss: 0.6493, test_loss: 0.8273, test_f1: 0.6205
 epoch: 58, train_loss: 0.6505, test_loss: 0.9657, test_f1: 0.6034
 epoch: 59, train_loss: 0.6727, test_loss: 0.7903, test_f1: 0.6673
 epoch: 60, train_loss: 0.6431, test_loss: 0.9058, test_f1: 0.6383
 epoch: 61, train_loss: 0.6487, test_loss: 0.9265, test_f1: 0.6053
 epoch: 62, train_loss: 0.6690, test_loss: 0.8737, test_f1: 0.6459
 epoch: 63, train_loss: 0.6636, test_loss: 0.8327, test_f1: 0.6620
 epoch: 64, train_loss: 0.6502, test_loss: 0.8223, test_f1: 0.6222
 epoch: 65, train_loss: 0.6463, test_loss: 0.8600, test_f1: 0.6462
 epoch: 66, train_loss: 0.6474, test_loss: 0.8395, test_f1: 0.6514
 epoch: 67, train_loss: 0.6563, test_loss: 0.8457, test_f1: 0.6473
 epoch: 68, train_loss: 0.6196, test_loss: 0.8186, test_f1: 0.6619
 epoch: 69, train_loss: 0.6518, test_loss: 0.7987, test_f1: 0.6282
 epoch: 70, train_loss: 0.6367, test_loss: 0.8527, test_f1: 0.6448
 epoch: 71, train_loss: 0.6243, test_loss: 0.8381, test_f1: 0.6318
 epoch: 72, train_loss: 0.6397, test_loss: 0.8320, test_f1: 0.6471
 epoch: 73, train_loss: 0.6393, test_loss: 0.7878, test_f1: 0.6416
 epoch: 74, train_loss: 0.6497, test_loss: 0.8086, test_f1: 0.6370
 epoch: 75, train_loss: 0.6397, test_loss: 0.7648, test_f1: 0.6327
 epoch: 76, train_loss: 0.6282, test_loss: 0.7966, test_f1: 0.6262
 epoch: 77, train_loss: 0.6096, test_loss: 0.8191, test_f1: 0.6356
 epoch: 78, train_loss: 0.6226, test_loss: 0.8190, test_f1: 0.6422
 epoch: 79, train_loss: 0.6243, test_loss: 0.7655, test_f1: 0.6707
 epoch: 80, train_loss: 0.6197, test_loss: 0.8194, test_f1: 0.6476
 epoch: 81, train_loss: 0.6146, test_loss: 0.8226, test_f1: 0.6318
 epoch: 82, train_loss: 0.6260, test_loss: 0.8140, test_f1: 0.6105
 epoch: 83, train_loss: 0.6076, test_loss: 0.7766, test_f1: 0.6381
 epoch: 84, train_loss: 0.6163, test_loss: 0.7867, test_f1: 0.6589
 epoch: 85, train_loss: 0.6156, test_loss: 0.7808, test_f1: 0.6529
 epoch: 86, train_loss: 0.5888, test_loss: 0.8619, test_f1: 0.6475
 epoch: 87, train_loss: 0.6466, test_loss: 0.8198, test_f1: 0.6388
 epoch: 88, train_loss: 0.6078, test_loss: 0.8019, test_f1: 0.6479
 epoch: 89, train_loss: 0.6017, test_loss: 0.8122, test_f1: 0.6577
 epoch: 90, train_loss: 0.5969, test_loss: 0.8240, test_f1: 0.6428
 epoch: 91, train_loss: 0.5986, test_loss: 0.8194, test_f1: 0.6456
 epoch: 92, train_loss: 0.5890, test_loss: 0.8290, test_f1: 0.6559
 epoch: 93, train_loss: 0.5844, test_loss: 0.8077, test_f1: 0.6652
 epoch: 94, train_loss: 0.5894, test_loss: 0.8215, test_f1: 0.6473
 epoch: 95, train_loss: 0.5752, test_loss: 0.8074, test_f1: 0.6329
 epoch: 96, train_loss: 0.5912, test_loss: 0.7953, test_f1: 0.6428
 epoch: 97, train_loss: 0.5860, test_loss: 0.8562, test_f1: 0.6372
 epoch: 98, train_loss: 0.5691, test_loss: 0.8291, test_f1: 0.6466
 epoch: 99, train_loss: 0.5931, test_loss: 0.8831, test_f1: 0.6318
##################ITERATION #7 ****************************************
 epoch: 0, train_loss: 1.1838, test_loss: 1.1625, test_f1: 0.4029
 epoch: 1, train_loss: 1.0578, test_loss: 1.0827, test_f1: 0.4425
 epoch: 2, train_loss: 1.0270, test_loss: 1.0719, test_f1: 0.4557
 epoch: 3, train_loss: 1.0000, test_loss: 1.0485, test_f1: 0.4626
 epoch: 4, train_loss: 0.9865, test_loss: 1.1032, test_f1: 0.4564
 epoch: 5, train_loss: 0.9797, test_loss: 0.9241, test_f1: 0.4829
 epoch: 6, train_loss: 0.9458, test_loss: 1.0519, test_f1: 0.4857
 epoch: 7, train_loss: 0.9490, test_loss: 1.1494, test_f1: 0.4471
 epoch: 8, train_loss: 0.9280, test_loss: 0.9875, test_f1: 0.4921
 epoch: 9, train_loss: 0.9273, test_loss: 0.9183, test_f1: 0.5036
 epoch: 10, train_loss: 0.9133, test_loss: 0.9691, test_f1: 0.4938
 epoch: 11, train_loss: 0.9218, test_loss: 0.9000, test_f1: 0.5258
 epoch: 12, train_loss: 0.8992, test_loss: 1.0227, test_f1: 0.4766
 epoch: 13, train_loss: 0.8878, test_loss: 0.9749, test_f1: 0.5187
 epoch: 14, train_loss: 0.8756, test_loss: 0.9315, test_f1: 0.5519
 epoch: 15, train_loss: 0.8737, test_loss: 1.0201, test_f1: 0.4888
 epoch: 16, train_loss: 0.8642, test_loss: 0.9453, test_f1: 0.5317
 epoch: 17, train_loss: 0.8588, test_loss: 0.9381, test_f1: 0.5130
 epoch: 18, train_loss: 0.8484, test_loss: 0.9530, test_f1: 0.5813
 epoch: 19, train_loss: 0.8554, test_loss: 0.8661, test_f1: 0.5147
 epoch: 20, train_loss: 0.8463, test_loss: 0.9368, test_f1: 0.5175
 epoch: 21, train_loss: 0.8479, test_loss: 1.0057, test_f1: 0.5057
 epoch: 22, train_loss: 0.8420, test_loss: 0.9661, test_f1: 0.5409
 epoch: 23, train_loss: 0.8310, test_loss: 0.9301, test_f1: 0.5629
 epoch: 24, train_loss: 0.8378, test_loss: 0.9631, test_f1: 0.5713
 epoch: 25, train_loss: 0.8227, test_loss: 0.9611, test_f1: 0.5344
 epoch: 26, train_loss: 0.8390, test_loss: 0.9165, test_f1: 0.5685
 epoch: 27, train_loss: 0.8348, test_loss: 1.0190, test_f1: 0.5155
 epoch: 28, train_loss: 0.8284, test_loss: 1.0132, test_f1: 0.5318
 epoch: 29, train_loss: 0.8057, test_loss: 0.9291, test_f1: 0.5989
 epoch: 30, train_loss: 0.7980, test_loss: 0.9533, test_f1: 0.5675
 epoch: 31, train_loss: 0.7976, test_loss: 0.9253, test_f1: 0.5335
 epoch: 32, train_loss: 0.8128, test_loss: 1.0634, test_f1: 0.5505
 epoch: 33, train_loss: 0.8173, test_loss: 0.9955, test_f1: 0.5452
 epoch: 34, train_loss: 0.7797, test_loss: 0.9830, test_f1: 0.5661
 epoch: 35, train_loss: 0.7846, test_loss: 0.9934, test_f1: 0.5439
 epoch: 36, train_loss: 0.7784, test_loss: 0.9537, test_f1: 0.5423
 epoch: 37, train_loss: 0.7742, test_loss: 1.0006, test_f1: 0.5473
 epoch: 38, train_loss: 0.7763, test_loss: 0.9094, test_f1: 0.5890
 epoch: 39, train_loss: 0.7803, test_loss: 1.2568, test_f1: 0.5233
 epoch: 40, train_loss: 0.7639, test_loss: 0.9898, test_f1: 0.5688
 epoch: 41, train_loss: 0.7800, test_loss: 1.0051, test_f1: 0.5538
 epoch: 42, train_loss: 0.7630, test_loss: 0.9515, test_f1: 0.5555
 epoch: 43, train_loss: 0.7555, test_loss: 1.1631, test_f1: 0.5314
 epoch: 44, train_loss: 0.7554, test_loss: 0.9594, test_f1: 0.5503
 epoch: 45, train_loss: 0.7404, test_loss: 1.0341, test_f1: 0.5599
 epoch: 46, train_loss: 0.7402, test_loss: 1.0161, test_f1: 0.5784
 epoch: 47, train_loss: 0.7567, test_loss: 0.9208, test_f1: 0.5934
 epoch: 48, train_loss: 0.7324, test_loss: 0.8682, test_f1: 0.5819
 epoch: 49, train_loss: 0.7410, test_loss: 1.0107, test_f1: 0.5249
 epoch: 50, train_loss: 0.7496, test_loss: 0.9007, test_f1: 0.5883
 epoch: 51, train_loss: 0.7140, test_loss: 1.0719, test_f1: 0.5678
 epoch: 52, train_loss: 0.6902, test_loss: 1.1047, test_f1: 0.5845
 epoch: 53, train_loss: 0.6779, test_loss: 1.0630, test_f1: 0.5903
 epoch: 54, train_loss: 0.6740, test_loss: 1.0043, test_f1: 0.5446
 epoch: 55, train_loss: 0.6761, test_loss: 1.1611, test_f1: 0.5853
 epoch: 56, train_loss: 0.6675, test_loss: 1.0669, test_f1: 0.5865
 epoch: 57, train_loss: 0.6759, test_loss: 1.2570, test_f1: 0.5634
 epoch: 58, train_loss: 0.6726, test_loss: 1.1771, test_f1: 0.6098
 epoch: 59, train_loss: 0.6744, test_loss: 0.9477, test_f1: 0.5982
 epoch: 60, train_loss: 0.6675, test_loss: 0.9213, test_f1: 0.5971
 epoch: 61, train_loss: 0.6577, test_loss: 1.1902, test_f1: 0.6178
 epoch: 62, train_loss: 0.6648, test_loss: 1.0054, test_f1: 0.5874
 epoch: 63, train_loss: 0.6680, test_loss: 1.1725, test_f1: 0.5908
 epoch: 64, train_loss: 0.6624, test_loss: 1.0496, test_f1: 0.5841
 epoch: 65, train_loss: 0.6623, test_loss: 1.2465, test_f1: 0.5949
 epoch: 66, train_loss: 0.6534, test_loss: 1.1875, test_f1: 0.5890
 epoch: 67, train_loss: 0.6461, test_loss: 1.0900, test_f1: 0.6019
 epoch: 68, train_loss: 0.6316, test_loss: 1.0741, test_f1: 0.6054
 epoch: 69, train_loss: 0.6591, test_loss: 1.2291, test_f1: 0.6044
 epoch: 70, train_loss: 0.6488, test_loss: 1.1150, test_f1: 0.5979
 epoch: 71, train_loss: 0.6442, test_loss: 1.0541, test_f1: 0.6463
 epoch: 72, train_loss: 0.6460, test_loss: 1.0110, test_f1: 0.5993
 epoch: 73, train_loss: 0.6423, test_loss: 1.0350, test_f1: 0.5799
 epoch: 74, train_loss: 0.6298, test_loss: 1.1970, test_f1: 0.5796
 epoch: 75, train_loss: 0.6360, test_loss: 1.0455, test_f1: 0.6100
 epoch: 76, train_loss: 0.6300, test_loss: 1.1835, test_f1: 0.5980
 epoch: 77, train_loss: 0.6276, test_loss: 1.1197, test_f1: 0.5819
 epoch: 78, train_loss: 0.6350, test_loss: 1.0274, test_f1: 0.5875
 epoch: 79, train_loss: 0.6170, test_loss: 1.1282, test_f1: 0.6142
 epoch: 80, train_loss: 0.6181, test_loss: 1.2161, test_f1: 0.5997
 epoch: 81, train_loss: 0.6386, test_loss: 0.9827, test_f1: 0.6196
 epoch: 82, train_loss: 0.6406, test_loss: 1.0590, test_f1: 0.6230
 epoch: 83, train_loss: 0.6211, test_loss: 1.1674, test_f1: 0.5883
 epoch: 84, train_loss: 0.6297, test_loss: 1.2462, test_f1: 0.5837
 epoch: 85, train_loss: 0.6366, test_loss: 1.1070, test_f1: 0.6043
 epoch: 86, train_loss: 0.6247, test_loss: 1.1026, test_f1: 0.5862
 epoch: 87, train_loss: 0.6337, test_loss: 1.0533, test_f1: 0.6078
 epoch: 88, train_loss: 0.6208, test_loss: 1.1414, test_f1: 0.6048
 epoch: 89, train_loss: 0.6005, test_loss: 1.1754, test_f1: 0.6112
 epoch: 90, train_loss: 0.6096, test_loss: 1.1725, test_f1: 0.5987
 epoch: 91, train_loss: 0.6115, test_loss: 1.0407, test_f1: 0.5928
 epoch: 92, train_loss: 0.6050, test_loss: 1.3461, test_f1: 0.6004
 epoch: 93, train_loss: 0.6023, test_loss: 1.2091, test_f1: 0.6072
 epoch: 94, train_loss: 0.6137, test_loss: 1.1893, test_f1: 0.5846
 epoch: 95, train_loss: 0.6015, test_loss: 1.2764, test_f1: 0.5961
 epoch: 96, train_loss: 0.6010, test_loss: 1.1805, test_f1: 0.6083
 epoch: 97, train_loss: 0.5948, test_loss: 1.1911, test_f1: 0.6024
 epoch: 98, train_loss: 0.5804, test_loss: 1.3354, test_f1: 0.6046
 epoch: 99, train_loss: 0.5897, test_loss: 1.2549, test_f1: 0.5965
##################ITERATION #8 ****************************************
 epoch: 0, train_loss: 1.1840, test_loss: 1.1421, test_f1: 0.3500
 epoch: 1, train_loss: 1.0577, test_loss: 1.0574, test_f1: 0.4769
 epoch: 2, train_loss: 1.0336, test_loss: 1.0613, test_f1: 0.4631
 epoch: 3, train_loss: 0.9871, test_loss: 1.0670, test_f1: 0.4354
 epoch: 4, train_loss: 0.9626, test_loss: 0.9959, test_f1: 0.5257
 epoch: 5, train_loss: 0.9559, test_loss: 1.0638, test_f1: 0.4750
 epoch: 6, train_loss: 0.9306, test_loss: 1.0890, test_f1: 0.5037
 epoch: 7, train_loss: 0.9233, test_loss: 0.9270, test_f1: 0.5211
 epoch: 8, train_loss: 0.8946, test_loss: 0.8857, test_f1: 0.5084
 epoch: 9, train_loss: 0.8837, test_loss: 0.9320, test_f1: 0.5474
 epoch: 10, train_loss: 0.8683, test_loss: 1.0057, test_f1: 0.5200
 epoch: 11, train_loss: 0.8713, test_loss: 0.9761, test_f1: 0.5789
 epoch: 12, train_loss: 0.8656, test_loss: 0.8887, test_f1: 0.5318
 epoch: 13, train_loss: 0.8449, test_loss: 0.9479, test_f1: 0.5329
 epoch: 14, train_loss: 0.8575, test_loss: 0.9183, test_f1: 0.5600
 epoch: 15, train_loss: 0.8410, test_loss: 1.0488, test_f1: 0.5312
 epoch: 16, train_loss: 0.8314, test_loss: 0.9846, test_f1: 0.5353
 epoch: 17, train_loss: 0.8185, test_loss: 0.9833, test_f1: 0.5294
 epoch: 18, train_loss: 0.8298, test_loss: 0.9684, test_f1: 0.5371
 epoch: 19, train_loss: 0.8114, test_loss: 0.9032, test_f1: 0.5441
 epoch: 20, train_loss: 0.8200, test_loss: 0.8782, test_f1: 0.5595
 epoch: 21, train_loss: 0.8011, test_loss: 0.9087, test_f1: 0.5780
 epoch: 22, train_loss: 0.8205, test_loss: 0.8624, test_f1: 0.5621
 epoch: 23, train_loss: 0.8049, test_loss: 0.9414, test_f1: 0.5241
 epoch: 24, train_loss: 0.8049, test_loss: 0.8886, test_f1: 0.5765
 epoch: 25, train_loss: 0.7871, test_loss: 0.9234, test_f1: 0.4968
 epoch: 26, train_loss: 0.7870, test_loss: 1.0080, test_f1: 0.5458
 epoch: 27, train_loss: 0.7827, test_loss: 0.8491, test_f1: 0.5808
 epoch: 28, train_loss: 0.7864, test_loss: 0.9603, test_f1: 0.5471
 epoch: 29, train_loss: 0.7743, test_loss: 0.9186, test_f1: 0.5525
 epoch: 30, train_loss: 0.7506, test_loss: 0.8647, test_f1: 0.6001
 epoch: 31, train_loss: 0.7777, test_loss: 0.9224, test_f1: 0.5200
 epoch: 32, train_loss: 0.7817, test_loss: 0.8983, test_f1: 0.5468
 epoch: 33, train_loss: 0.7572, test_loss: 0.9522, test_f1: 0.5691
 epoch: 34, train_loss: 0.7412, test_loss: 0.8304, test_f1: 0.6015
 epoch: 35, train_loss: 0.7634, test_loss: 0.9186, test_f1: 0.5477
 epoch: 36, train_loss: 0.7390, test_loss: 0.8733, test_f1: 0.6497
 epoch: 37, train_loss: 0.7359, test_loss: 0.9349, test_f1: 0.6009
 epoch: 38, train_loss: 0.7284, test_loss: 0.8943, test_f1: 0.5772
 epoch: 39, train_loss: 0.7263, test_loss: 0.9444, test_f1: 0.5372
 epoch: 40, train_loss: 0.7411, test_loss: 0.8384, test_f1: 0.6431
 epoch: 41, train_loss: 0.7242, test_loss: 1.0074, test_f1: 0.6373
 epoch: 42, train_loss: 0.7382, test_loss: 1.1215, test_f1: 0.5506
 epoch: 43, train_loss: 0.7219, test_loss: 0.9426, test_f1: 0.5881
 epoch: 44, train_loss: 0.7275, test_loss: 0.8168, test_f1: 0.5791
 epoch: 45, train_loss: 0.7236, test_loss: 0.8091, test_f1: 0.5567
 epoch: 46, train_loss: 0.7039, test_loss: 0.8879, test_f1: 0.5582
 epoch: 47, train_loss: 0.7262, test_loss: 0.9426, test_f1: 0.6033
 epoch: 48, train_loss: 0.7119, test_loss: 0.8832, test_f1: 0.6047
 epoch: 49, train_loss: 0.7114, test_loss: 0.9652, test_f1: 0.5928
 epoch: 50, train_loss: 0.6938, test_loss: 0.9203, test_f1: 0.6041
 epoch: 51, train_loss: 0.6839, test_loss: 0.9320, test_f1: 0.5910
 epoch: 52, train_loss: 0.6619, test_loss: 0.9347, test_f1: 0.6166
 epoch: 53, train_loss: 0.6418, test_loss: 0.9117, test_f1: 0.6243
 epoch: 54, train_loss: 0.6579, test_loss: 0.9175, test_f1: 0.6236
 epoch: 55, train_loss: 0.6432, test_loss: 0.8737, test_f1: 0.6409
 epoch: 56, train_loss: 0.6454, test_loss: 0.9613, test_f1: 0.6683
 epoch: 57, train_loss: 0.6307, test_loss: 0.8947, test_f1: 0.6577
 epoch: 58, train_loss: 0.6441, test_loss: 0.9967, test_f1: 0.6222
 epoch: 59, train_loss: 0.6273, test_loss: 0.9451, test_f1: 0.6407
 epoch: 60, train_loss: 0.6229, test_loss: 1.0256, test_f1: 0.6074
 epoch: 61, train_loss: 0.6350, test_loss: 0.8168, test_f1: 0.6482
 epoch: 62, train_loss: 0.6350, test_loss: 0.9120, test_f1: 0.6163
 epoch: 63, train_loss: 0.6361, test_loss: 1.0386, test_f1: 0.6314
 epoch: 64, train_loss: 0.6148, test_loss: 0.9568, test_f1: 0.6605
 epoch: 65, train_loss: 0.6277, test_loss: 0.9988, test_f1: 0.6257
 epoch: 66, train_loss: 0.6132, test_loss: 1.0357, test_f1: 0.6106
 epoch: 67, train_loss: 0.6287, test_loss: 0.9664, test_f1: 0.6453
 epoch: 68, train_loss: 0.6312, test_loss: 1.1895, test_f1: 0.6265
 epoch: 69, train_loss: 0.6060, test_loss: 1.0069, test_f1: 0.6402
 epoch: 70, train_loss: 0.6018, test_loss: 1.0242, test_f1: 0.6125
 epoch: 71, train_loss: 0.6196, test_loss: 0.9530, test_f1: 0.6344
 epoch: 72, train_loss: 0.6155, test_loss: 1.0678, test_f1: 0.6455
 epoch: 73, train_loss: 0.6302, test_loss: 1.0815, test_f1: 0.6545
 epoch: 74, train_loss: 0.5927, test_loss: 2.2215, test_f1: 0.6465
 epoch: 75, train_loss: 0.6118, test_loss: 1.0262, test_f1: 0.6354
 epoch: 76, train_loss: 0.6002, test_loss: 1.0130, test_f1: 0.6131
 epoch: 77, train_loss: 0.5959, test_loss: 0.9267, test_f1: 0.6620
 epoch: 78, train_loss: 0.6105, test_loss: 0.9452, test_f1: 0.6031
 epoch: 79, train_loss: 0.6095, test_loss: 0.8826, test_f1: 0.6422
 epoch: 80, train_loss: 0.5877, test_loss: 1.0185, test_f1: 0.6345
 epoch: 81, train_loss: 0.5766, test_loss: 1.0656, test_f1: 0.6284
 epoch: 82, train_loss: 0.5989, test_loss: 0.9211, test_f1: 0.6254
 epoch: 83, train_loss: 0.5901, test_loss: 1.0120, test_f1: 0.6642
 epoch: 84, train_loss: 0.5872, test_loss: 1.0106, test_f1: 0.6342
 epoch: 85, train_loss: 0.6006, test_loss: 0.9847, test_f1: 0.6428
 epoch: 86, train_loss: 0.5880, test_loss: 0.9955, test_f1: 0.6515
 epoch: 87, train_loss: 0.5707, test_loss: 1.0821, test_f1: 0.6639
 epoch: 88, train_loss: 0.5849, test_loss: 0.9937, test_f1: 0.6595
 epoch: 89, train_loss: 0.5708, test_loss: 0.9646, test_f1: 0.6667
 epoch: 90, train_loss: 0.5615, test_loss: 1.0713, test_f1: 0.6287
 epoch: 91, train_loss: 0.5834, test_loss: 0.9721, test_f1: 0.6181
 epoch: 92, train_loss: 0.5727, test_loss: 0.9926, test_f1: 0.6263
 epoch: 93, train_loss: 0.5829, test_loss: 1.1578, test_f1: 0.6389
 epoch: 94, train_loss: 0.5751, test_loss: 1.0108, test_f1: 0.6417
 epoch: 95, train_loss: 0.5927, test_loss: 1.0593, test_f1: 0.6350
 epoch: 96, train_loss: 0.5477, test_loss: 0.9716, test_f1: 0.6615
 epoch: 97, train_loss: 0.5602, test_loss: 1.1271, test_f1: 0.6246
 epoch: 98, train_loss: 0.5666, test_loss: 0.9831, test_f1: 0.6262
 epoch: 99, train_loss: 0.5632, test_loss: 1.1238, test_f1: 0.6432
##################ITERATION #9 ****************************************
 epoch: 0, train_loss: 1.1638, test_loss: 1.1047, test_f1: 0.4640
 epoch: 1, train_loss: 1.0356, test_loss: 1.0690, test_f1: 0.5147
 epoch: 2, train_loss: 0.9934, test_loss: 1.0337, test_f1: 0.5378
 epoch: 3, train_loss: 0.9846, test_loss: 1.0258, test_f1: 0.5294
 epoch: 4, train_loss: 0.9936, test_loss: 1.0591, test_f1: 0.4886
 epoch: 5, train_loss: 0.9654, test_loss: 1.0158, test_f1: 0.4161
 epoch: 6, train_loss: 0.9488, test_loss: 1.0637, test_f1: 0.4648
 epoch: 7, train_loss: 0.9497, test_loss: 1.0381, test_f1: 0.5038
 epoch: 8, train_loss: 0.9287, test_loss: 1.0263, test_f1: 0.5041
 epoch: 9, train_loss: 0.9018, test_loss: 0.9617, test_f1: 0.5036
 epoch: 10, train_loss: 0.9322, test_loss: 1.0340, test_f1: 0.4506
 epoch: 11, train_loss: 0.8899, test_loss: 1.0024, test_f1: 0.5037
 epoch: 12, train_loss: 0.8899, test_loss: 1.0484, test_f1: 0.4627
 epoch: 13, train_loss: 0.8659, test_loss: 0.9472, test_f1: 0.5008
 epoch: 14, train_loss: 0.8678, test_loss: 0.8928, test_f1: 0.5516
 epoch: 15, train_loss: 0.8791, test_loss: 0.9717, test_f1: 0.4980
 epoch: 16, train_loss: 0.8614, test_loss: 0.9169, test_f1: 0.5404
 epoch: 17, train_loss: 0.8481, test_loss: 0.9233, test_f1: 0.5382
 epoch: 18, train_loss: 0.8552, test_loss: 0.9684, test_f1: 0.5383
 epoch: 19, train_loss: 0.8398, test_loss: 0.9373, test_f1: 0.5266
 epoch: 20, train_loss: 0.8613, test_loss: 1.7079, test_f1: 0.2881
 epoch: 21, train_loss: 0.9498, test_loss: 1.0604, test_f1: 0.5125
 epoch: 22, train_loss: 0.9207, test_loss: 1.0653, test_f1: 0.5011
 epoch: 23, train_loss: 0.9008, test_loss: 1.0314, test_f1: 0.4799
 epoch: 24, train_loss: 0.8709, test_loss: 0.9640, test_f1: 0.5327
 epoch: 25, train_loss: 0.8462, test_loss: 0.9742, test_f1: 0.4976
 epoch: 26, train_loss: 0.8432, test_loss: 0.9804, test_f1: 0.5685
 epoch: 27, train_loss: 0.8344, test_loss: 0.9459, test_f1: 0.5532
 epoch: 28, train_loss: 0.8344, test_loss: 0.9707, test_f1: 0.5014
 epoch: 29, train_loss: 0.8096, test_loss: 0.9693, test_f1: 0.5705
 epoch: 30, train_loss: 0.8354, test_loss: 1.0012, test_f1: 0.5570
 epoch: 31, train_loss: 0.8267, test_loss: 0.9405, test_f1: 0.5452
 epoch: 32, train_loss: 0.8044, test_loss: 0.8932, test_f1: 0.5534
 epoch: 33, train_loss: 0.8088, test_loss: 0.9857, test_f1: 0.5416
 epoch: 34, train_loss: 0.7971, test_loss: 0.9266, test_f1: 0.5906
 epoch: 35, train_loss: 0.7841, test_loss: 0.9437, test_f1: 0.5371
 epoch: 36, train_loss: 0.7885, test_loss: 0.9854, test_f1: 0.5299
 epoch: 37, train_loss: 0.7929, test_loss: 0.9472, test_f1: 0.5661
 epoch: 38, train_loss: 0.7916, test_loss: 0.9337, test_f1: 0.5960
 epoch: 39, train_loss: 0.7803, test_loss: 1.0113, test_f1: 0.5324
 epoch: 40, train_loss: 0.7673, test_loss: 1.0137, test_f1: 0.5326
 epoch: 41, train_loss: 0.7645, test_loss: 0.9370, test_f1: 0.5212
 epoch: 42, train_loss: 0.7688, test_loss: 1.0025, test_f1: 0.5239
 epoch: 43, train_loss: 0.7627, test_loss: 0.9524, test_f1: 0.5636
 epoch: 44, train_loss: 0.7561, test_loss: 1.0112, test_f1: 0.5656
 epoch: 45, train_loss: 0.7560, test_loss: 1.0697, test_f1: 0.4941
 epoch: 46, train_loss: 0.7506, test_loss: 0.9933, test_f1: 0.5766
 epoch: 47, train_loss: 0.7521, test_loss: 0.9096, test_f1: 0.6016
 epoch: 48, train_loss: 0.7516, test_loss: 0.9347, test_f1: 0.5691
 epoch: 49, train_loss: 0.7311, test_loss: 0.9395, test_f1: 0.5734
 epoch: 50, train_loss: 0.7357, test_loss: 1.0079, test_f1: 0.5388
 epoch: 51, train_loss: 0.7093, test_loss: 0.9254, test_f1: 0.5742
 epoch: 52, train_loss: 0.6937, test_loss: 0.8760, test_f1: 0.6141
 epoch: 53, train_loss: 0.6838, test_loss: 0.9796, test_f1: 0.6119
 epoch: 54, train_loss: 0.6872, test_loss: 1.0012, test_f1: 0.5713
 epoch: 55, train_loss: 0.6754, test_loss: 0.9264, test_f1: 0.5843
 epoch: 56, train_loss: 0.6712, test_loss: 0.9833, test_f1: 0.5514
 epoch: 57, train_loss: 0.6794, test_loss: 0.9674, test_f1: 0.5927
 epoch: 58, train_loss: 0.6692, test_loss: 0.9388, test_f1: 0.5933
 epoch: 59, train_loss: 0.6750, test_loss: 0.9104, test_f1: 0.6193
 epoch: 60, train_loss: 0.6750, test_loss: 0.9442, test_f1: 0.5999
 epoch: 61, train_loss: 0.6647, test_loss: 0.9335, test_f1: 0.6038
 epoch: 62, train_loss: 0.6759, test_loss: 0.9363, test_f1: 0.5803
 epoch: 63, train_loss: 0.6658, test_loss: 0.9978, test_f1: 0.5964
 epoch: 64, train_loss: 0.6592, test_loss: 0.9873, test_f1: 0.5622
 epoch: 65, train_loss: 0.6649, test_loss: 0.9359, test_f1: 0.6292
 epoch: 66, train_loss: 0.6437, test_loss: 0.9356, test_f1: 0.6100
 epoch: 67, train_loss: 0.6541, test_loss: 0.9156, test_f1: 0.6046
 epoch: 68, train_loss: 0.6433, test_loss: 1.1220, test_f1: 0.5909
 epoch: 69, train_loss: 0.6516, test_loss: 0.9912, test_f1: 0.6357
 epoch: 70, train_loss: 0.6589, test_loss: 0.9671, test_f1: 0.5850
 epoch: 71, train_loss: 0.6560, test_loss: 1.0093, test_f1: 0.5750
 epoch: 72, train_loss: 0.6375, test_loss: 1.0807, test_f1: 0.5546
 epoch: 73, train_loss: 0.6401, test_loss: 1.0088, test_f1: 0.6137
 epoch: 74, train_loss: 0.6299, test_loss: 1.0057, test_f1: 0.5711
 epoch: 75, train_loss: 0.6500, test_loss: 0.9725, test_f1: 0.5724
 epoch: 76, train_loss: 0.6364, test_loss: 0.9979, test_f1: 0.6017
 epoch: 77, train_loss: 0.6391, test_loss: 1.1131, test_f1: 0.5696
 epoch: 78, train_loss: 0.6252, test_loss: 1.0579, test_f1: 0.6144
 epoch: 79, train_loss: 0.6381, test_loss: 1.0300, test_f1: 0.5796
 epoch: 80, train_loss: 0.6235, test_loss: 0.9593, test_f1: 0.6101
 epoch: 81, train_loss: 0.6158, test_loss: 1.1106, test_f1: 0.5677
 epoch: 82, train_loss: 0.6342, test_loss: 0.9229, test_f1: 0.6401
 epoch: 83, train_loss: 0.6099, test_loss: 1.0287, test_f1: 0.6084
 epoch: 84, train_loss: 0.6195, test_loss: 1.0817, test_f1: 0.5834
 epoch: 85, train_loss: 0.6284, test_loss: 1.0697, test_f1: 0.5984
 epoch: 86, train_loss: 0.6160, test_loss: 0.9269, test_f1: 0.5971
 epoch: 87, train_loss: 0.6119, test_loss: 0.9406, test_f1: 0.5952
 epoch: 88, train_loss: 0.5992, test_loss: 1.0624, test_f1: 0.6299
 epoch: 89, train_loss: 0.6125, test_loss: 1.0011, test_f1: 0.6318
 epoch: 90, train_loss: 0.6075, test_loss: 1.0459, test_f1: 0.5776
 epoch: 91, train_loss: 0.5997, test_loss: 1.1970, test_f1: 0.5725
 epoch: 92, train_loss: 0.6007, test_loss: 1.1013, test_f1: 0.5900
 epoch: 93, train_loss: 0.6015, test_loss: 1.1209, test_f1: 0.6082
 epoch: 94, train_loss: 0.6108, test_loss: 1.1793, test_f1: 0.5917
 epoch: 95, train_loss: 0.6060, test_loss: 0.9997, test_f1: 0.6319
 epoch: 96, train_loss: 0.5982, test_loss: 1.0909, test_f1: 0.5968
 epoch: 97, train_loss: 0.6023, test_loss: 1.0725, test_f1: 0.6347
 epoch: 98, train_loss: 0.5927, test_loss: 1.1442, test_f1: 0.5826
 epoch: 99, train_loss: 0.6035, test_loss: 1.2209, test_f1: 0.5669

Training completed in 833.91 seconds
Best F1: 0.6733 at epoch 69
Mean F1 across iterations: 0.6601  0.0114
========================FINAL RESULTS================================
FEGIN weighted F1: 0.6733  0.0114
python main.py --data ltspice_examples --representation component_pin --model FEGIN --layers 6 --hiddens 32 --batch_size 64 --lr 0.01 --emb_size 250 --epochs 100 --save_appendix component_pin_L6_H32_BS64_LR0.01_E250 --no_val
-----



STDERR:
  File "main.py", line 370, in <module>
    main()
  File "main.py", line 254, in main
    dataset = dataset_class(
  File "/home/philip/projects/ltspice_examples_code_repo/Circuit-Completion-Using-GNNs/component_classification_with_link_prediction_head/evaluation/FEGIN/kernel/circuit_datasets.py", line 15, in __init__
    self.data, self.slices = torch.load(self.processed_paths[0])
  File "/home/philip/.local/lib/python3.8/site-packages/torch/serialization.py", line 1040, in load
    warnings.warn(
  File "/usr/lib/python3.8/warnings.py", line 109, in _showwarnmsg
    sw(msg.message, msg.category, msg.filename, msg.lineno,
  File "main.py", line 47, in warn_with_traceback
    traceback.print_stack(file=log)
/home/philip/projects/ltspice_examples_code_repo/Circuit-Completion-Using-GNNs/component_classification_with_link_prediction_head/evaluation/FEGIN/kernel/circuit_datasets.py:15: FutureWarning: You are using `torch.load` with `weights_only=False` (the current default value), which uses the default pickle module implicitly. It is possible to construct malicious pickle data which will execute arbitrary code during unpickling (See https://github.com/pytorch/pytorch/blob/main/SECURITY.md#untrusted-models for more details). In a future release, the default value for `weights_only` will be flipped to `True`. This limits the functions that could be executed during unpickling. Arbitrary objects will no longer be allowed to be loaded via this mode unless they are explicitly allowlisted by the user via `torch.serialization.add_safe_globals`. We recommend you start setting `weights_only=True` for any use case where you don't have full control of the loaded file. Please open an issue on GitHub for any issues related to this experimental feature.
  self.data, self.slices = torch.load(self.processed_paths[0])
