STDOUT:
Results will be saved in /home/philip/projects/ltspice_examples_code_repo/Circuit-Completion-Using-GNNs/component_classification_with_link_prediction_head/evaluation/FEGIN/results/model_FEGIN_dataset_ltspice_demos
Command line input: python main.py --data ltspice_demos --representation component_pin --model FEGIN --layers 2 --hiddens 128 --batch_size 32 --lr 0.0001 --emb_size 128 --epochs 100 --save_appendix component_pin_L2_H128_BS32_LR0.0001_E128 --no_val
 is saved.
-----
ltspice_demos - FEGIN
Using 2 layers, 128 hidden units, h = 2
Loading component_pin representation dataset
ENTERED
Training FEGIN on component_pin representation
Train: 1565, Test: 383
##################ITERATION #0 ****************************************
 epoch: 0, train_loss: 1.3518, test_loss: 1.3472, test_f1: 0.3381
 epoch: 1, train_loss: 1.3004, test_loss: 1.3039, test_f1: 0.2850
 epoch: 2, train_loss: 1.2428, test_loss: 1.2571, test_f1: 0.2872
 epoch: 3, train_loss: 1.1858, test_loss: 1.2236, test_f1: 0.4237
 epoch: 4, train_loss: 1.1398, test_loss: 1.1910, test_f1: 0.4522
 epoch: 5, train_loss: 1.1031, test_loss: 1.1475, test_f1: 0.4486
 epoch: 6, train_loss: 1.0565, test_loss: 1.1161, test_f1: 0.4482
 epoch: 7, train_loss: 1.0253, test_loss: 1.0861, test_f1: 0.4542
 epoch: 8, train_loss: 1.0031, test_loss: 1.0620, test_f1: 0.4623
 epoch: 9, train_loss: 0.9812, test_loss: 1.0494, test_f1: 0.4519
 epoch: 10, train_loss: 0.9642, test_loss: 1.0423, test_f1: 0.4611
 epoch: 11, train_loss: 0.9476, test_loss: 1.0108, test_f1: 0.4515
 epoch: 12, train_loss: 0.9270, test_loss: 1.0183, test_f1: 0.4960
 epoch: 13, train_loss: 0.9066, test_loss: 0.9979, test_f1: 0.5340
 epoch: 14, train_loss: 0.8895, test_loss: 0.9883, test_f1: 0.5431
 epoch: 15, train_loss: 0.8753, test_loss: 0.9730, test_f1: 0.5569
 epoch: 16, train_loss: 0.8568, test_loss: 0.9591, test_f1: 0.5775
 epoch: 17, train_loss: 0.8426, test_loss: 0.9576, test_f1: 0.5981
 epoch: 18, train_loss: 0.8251, test_loss: 0.9640, test_f1: 0.6044
 epoch: 19, train_loss: 0.7993, test_loss: 0.9620, test_f1: 0.6053
 epoch: 20, train_loss: 0.7926, test_loss: 0.9569, test_f1: 0.5873
 epoch: 21, train_loss: 0.7751, test_loss: 0.9420, test_f1: 0.6106
 epoch: 22, train_loss: 0.7618, test_loss: 0.9531, test_f1: 0.6196
 epoch: 23, train_loss: 0.7510, test_loss: 0.9593, test_f1: 0.6073
 epoch: 24, train_loss: 0.7328, test_loss: 0.9442, test_f1: 0.6229
 epoch: 25, train_loss: 0.7138, test_loss: 0.9548, test_f1: 0.5985
 epoch: 26, train_loss: 0.7122, test_loss: 0.9595, test_f1: 0.5907
 epoch: 27, train_loss: 0.6997, test_loss: 0.9576, test_f1: 0.5865
 epoch: 28, train_loss: 0.6853, test_loss: 0.9835, test_f1: 0.5892
 epoch: 29, train_loss: 0.6860, test_loss: 0.9902, test_f1: 0.5957
 epoch: 30, train_loss: 0.6708, test_loss: 0.9747, test_f1: 0.5894
 epoch: 31, train_loss: 0.6650, test_loss: 0.9998, test_f1: 0.5907
 epoch: 32, train_loss: 0.6613, test_loss: 1.0048, test_f1: 0.5904
 epoch: 33, train_loss: 0.6583, test_loss: 1.0078, test_f1: 0.6172
 epoch: 34, train_loss: 0.6421, test_loss: 0.9850, test_f1: 0.5936
 epoch: 35, train_loss: 0.6241, test_loss: 1.0388, test_f1: 0.5862
 epoch: 36, train_loss: 0.6363, test_loss: 1.0210, test_f1: 0.6056
 epoch: 37, train_loss: 0.6238, test_loss: 0.9683, test_f1: 0.5869
 epoch: 38, train_loss: 0.6381, test_loss: 1.0232, test_f1: 0.6051
 epoch: 39, train_loss: 0.6118, test_loss: 1.0260, test_f1: 0.6087
 epoch: 40, train_loss: 0.5978, test_loss: 1.0457, test_f1: 0.5664
 epoch: 41, train_loss: 0.6085, test_loss: 1.0404, test_f1: 0.5616
 epoch: 42, train_loss: 0.5882, test_loss: 1.0613, test_f1: 0.5838
 epoch: 43, train_loss: 0.5682, test_loss: 1.0144, test_f1: 0.5595
 epoch: 44, train_loss: 0.5774, test_loss: 1.0670, test_f1: 0.5615
 epoch: 45, train_loss: 0.5812, test_loss: 1.0315, test_f1: 0.5658
 epoch: 46, train_loss: 0.5625, test_loss: 1.0353, test_f1: 0.5927
 epoch: 47, train_loss: 0.5777, test_loss: 1.0391, test_f1: 0.5967
 epoch: 48, train_loss: 0.5570, test_loss: 1.0363, test_f1: 0.6131
 epoch: 49, train_loss: 0.5436, test_loss: 0.9803, test_f1: 0.6338
 epoch: 50, train_loss: 0.5524, test_loss: 1.1141, test_f1: 0.5670
 epoch: 51, train_loss: 0.5168, test_loss: 1.0551, test_f1: 0.6100
 epoch: 52, train_loss: 0.5190, test_loss: 1.1161, test_f1: 0.5667
 epoch: 53, train_loss: 0.5142, test_loss: 1.0922, test_f1: 0.5790
 epoch: 54, train_loss: 0.5036, test_loss: 1.0529, test_f1: 0.5978
 epoch: 55, train_loss: 0.5161, test_loss: 1.1109, test_f1: 0.6010
 epoch: 56, train_loss: 0.5145, test_loss: 1.0494, test_f1: 0.6013
 epoch: 57, train_loss: 0.4974, test_loss: 1.1060, test_f1: 0.6048
 epoch: 58, train_loss: 0.4949, test_loss: 1.1067, test_f1: 0.5941
 epoch: 59, train_loss: 0.5012, test_loss: 1.1269, test_f1: 0.5752
 epoch: 60, train_loss: 0.4865, test_loss: 1.1351, test_f1: 0.5923
 epoch: 61, train_loss: 0.4748, test_loss: 1.2069, test_f1: 0.5803
 epoch: 62, train_loss: 0.4817, test_loss: 1.2178, test_f1: 0.5746
 epoch: 63, train_loss: 0.4789, test_loss: 1.1527, test_f1: 0.5998
 epoch: 64, train_loss: 0.4852, test_loss: 1.1642, test_f1: 0.5955
 epoch: 65, train_loss: 0.4806, test_loss: 1.1194, test_f1: 0.6210
 epoch: 66, train_loss: 0.4565, test_loss: 1.1815, test_f1: 0.6036
 epoch: 67, train_loss: 0.4716, test_loss: 1.1742, test_f1: 0.6065
 epoch: 68, train_loss: 0.4611, test_loss: 1.1788, test_f1: 0.5995
 epoch: 69, train_loss: 0.4578, test_loss: 1.2325, test_f1: 0.6011
 epoch: 70, train_loss: 0.4602, test_loss: 1.1852, test_f1: 0.6055
 epoch: 71, train_loss: 0.4533, test_loss: 1.2736, test_f1: 0.5767
 epoch: 72, train_loss: 0.4501, test_loss: 1.1244, test_f1: 0.6368
 epoch: 73, train_loss: 0.4482, test_loss: 1.2221, test_f1: 0.5818
 epoch: 74, train_loss: 0.4478, test_loss: 1.2255, test_f1: 0.5856
 epoch: 75, train_loss: 0.4347, test_loss: 1.2499, test_f1: 0.5792
 epoch: 76, train_loss: 0.4269, test_loss: 1.3132, test_f1: 0.5986
 epoch: 77, train_loss: 0.4384, test_loss: 1.2635, test_f1: 0.5842
 epoch: 78, train_loss: 0.4326, test_loss: 1.2464, test_f1: 0.5897
 epoch: 79, train_loss: 0.4181, test_loss: 1.2038, test_f1: 0.6382
 epoch: 80, train_loss: 0.4267, test_loss: 1.2929, test_f1: 0.6069
 epoch: 81, train_loss: 0.4296, test_loss: 1.3189, test_f1: 0.6213
 epoch: 82, train_loss: 0.4095, test_loss: 1.2688, test_f1: 0.6054
 epoch: 83, train_loss: 0.4220, test_loss: 1.3222, test_f1: 0.5890
 epoch: 84, train_loss: 0.4186, test_loss: 1.3018, test_f1: 0.6083
 epoch: 85, train_loss: 0.4256, test_loss: 1.3624, test_f1: 0.6133
 epoch: 86, train_loss: 0.4084, test_loss: 1.3095, test_f1: 0.6138
 epoch: 87, train_loss: 0.3918, test_loss: 1.3428, test_f1: 0.6159
 epoch: 88, train_loss: 0.4226, test_loss: 1.2805, test_f1: 0.6054
 epoch: 89, train_loss: 0.4219, test_loss: 1.3189, test_f1: 0.6302
 epoch: 90, train_loss: 0.4086, test_loss: 1.2845, test_f1: 0.5981
 epoch: 91, train_loss: 0.3914, test_loss: 1.3616, test_f1: 0.5831
 epoch: 92, train_loss: 0.3829, test_loss: 1.3379, test_f1: 0.5945
 epoch: 93, train_loss: 0.3828, test_loss: 1.3373, test_f1: 0.6141
 epoch: 94, train_loss: 0.3785, test_loss: 1.4634, test_f1: 0.5783
 epoch: 95, train_loss: 0.3814, test_loss: 1.3273, test_f1: 0.6254
 epoch: 96, train_loss: 0.3921, test_loss: 1.4329, test_f1: 0.5722
 epoch: 97, train_loss: 0.3823, test_loss: 1.4042, test_f1: 0.6248
 epoch: 98, train_loss: 0.3676, test_loss: 1.3242, test_f1: 0.6256
 epoch: 99, train_loss: 0.3788, test_loss: 1.3967, test_f1: 0.6134
##################ITERATION #1 ****************************************
 epoch: 0, train_loss: 1.2548, test_loss: 1.2929, test_f1: 0.2672
 epoch: 1, train_loss: 1.1777, test_loss: 1.2269, test_f1: 0.4070
 epoch: 2, train_loss: 1.1312, test_loss: 1.1847, test_f1: 0.4269
 epoch: 3, train_loss: 1.0720, test_loss: 1.1360, test_f1: 0.4344
 epoch: 4, train_loss: 1.0288, test_loss: 1.0968, test_f1: 0.4886
 epoch: 5, train_loss: 0.9875, test_loss: 1.0536, test_f1: 0.5159
 epoch: 6, train_loss: 0.9536, test_loss: 1.0371, test_f1: 0.5350
 epoch: 7, train_loss: 0.9203, test_loss: 1.0226, test_f1: 0.5368
 epoch: 8, train_loss: 0.9071, test_loss: 1.0192, test_f1: 0.5815
 epoch: 9, train_loss: 0.8754, test_loss: 0.9986, test_f1: 0.5876
 epoch: 10, train_loss: 0.8592, test_loss: 0.9976, test_f1: 0.5797
 epoch: 11, train_loss: 0.8411, test_loss: 0.9772, test_f1: 0.5866
 epoch: 12, train_loss: 0.8292, test_loss: 0.9885, test_f1: 0.5758
 epoch: 13, train_loss: 0.7979, test_loss: 0.9863, test_f1: 0.5925
 epoch: 14, train_loss: 0.7792, test_loss: 0.9821, test_f1: 0.5793
 epoch: 15, train_loss: 0.7763, test_loss: 0.9692, test_f1: 0.5775
 epoch: 16, train_loss: 0.7518, test_loss: 0.9980, test_f1: 0.5706
 epoch: 17, train_loss: 0.7356, test_loss: 1.0269, test_f1: 0.5776
 epoch: 18, train_loss: 0.7377, test_loss: 1.0105, test_f1: 0.5879
 epoch: 19, train_loss: 0.7187, test_loss: 1.0277, test_f1: 0.5699
 epoch: 20, train_loss: 0.7021, test_loss: 1.0072, test_f1: 0.6078
 epoch: 21, train_loss: 0.7074, test_loss: 0.9772, test_f1: 0.5923
 epoch: 22, train_loss: 0.6675, test_loss: 1.0255, test_f1: 0.5888
 epoch: 23, train_loss: 0.6717, test_loss: 1.0563, test_f1: 0.5993
 epoch: 24, train_loss: 0.6548, test_loss: 1.0406, test_f1: 0.5948
 epoch: 25, train_loss: 0.6560, test_loss: 1.0830, test_f1: 0.5777
 epoch: 26, train_loss: 0.6301, test_loss: 1.0427, test_f1: 0.5971
 epoch: 27, train_loss: 0.6433, test_loss: 1.0715, test_f1: 0.5694
 epoch: 28, train_loss: 0.6236, test_loss: 1.0540, test_f1: 0.6083
 epoch: 29, train_loss: 0.6106, test_loss: 1.0491, test_f1: 0.5854
 epoch: 30, train_loss: 0.6030, test_loss: 1.0382, test_f1: 0.5692
 epoch: 31, train_loss: 0.5811, test_loss: 1.1330, test_f1: 0.6062
 epoch: 32, train_loss: 0.5781, test_loss: 1.1212, test_f1: 0.5937
 epoch: 33, train_loss: 0.5710, test_loss: 1.0805, test_f1: 0.5684
 epoch: 34, train_loss: 0.5669, test_loss: 1.1293, test_f1: 0.5965
 epoch: 35, train_loss: 0.5731, test_loss: 1.1666, test_f1: 0.6132
 epoch: 36, train_loss: 0.5514, test_loss: 1.1514, test_f1: 0.6213
 epoch: 37, train_loss: 0.5489, test_loss: 1.2169, test_f1: 0.6137
 epoch: 38, train_loss: 0.5271, test_loss: 1.2453, test_f1: 0.5984
 epoch: 39, train_loss: 0.5313, test_loss: 1.2274, test_f1: 0.5599
 epoch: 40, train_loss: 0.5282, test_loss: 1.2537, test_f1: 0.5913
 epoch: 41, train_loss: 0.4986, test_loss: 1.2445, test_f1: 0.6014
 epoch: 42, train_loss: 0.4957, test_loss: 1.2774, test_f1: 0.5934
 epoch: 43, train_loss: 0.4906, test_loss: 1.3007, test_f1: 0.5919
 epoch: 44, train_loss: 0.4976, test_loss: 1.2469, test_f1: 0.5932
 epoch: 45, train_loss: 0.4779, test_loss: 1.3398, test_f1: 0.5715
 epoch: 46, train_loss: 0.4905, test_loss: 1.3950, test_f1: 0.5953
 epoch: 47, train_loss: 0.4610, test_loss: 1.4123, test_f1: 0.5815
 epoch: 48, train_loss: 0.4614, test_loss: 1.4236, test_f1: 0.5742
 epoch: 49, train_loss: 0.4632, test_loss: 1.3387, test_f1: 0.5994
 epoch: 50, train_loss: 0.4492, test_loss: 1.4681, test_f1: 0.5931
 epoch: 51, train_loss: 0.4269, test_loss: 1.4272, test_f1: 0.6189
 epoch: 52, train_loss: 0.4240, test_loss: 1.4348, test_f1: 0.6001
 epoch: 53, train_loss: 0.4103, test_loss: 1.4705, test_f1: 0.5832
 epoch: 54, train_loss: 0.4213, test_loss: 1.4654, test_f1: 0.5728
 epoch: 55, train_loss: 0.4213, test_loss: 1.4300, test_f1: 0.5958
 epoch: 56, train_loss: 0.4106, test_loss: 1.4671, test_f1: 0.6129
 epoch: 57, train_loss: 0.4238, test_loss: 1.4487, test_f1: 0.6113
 epoch: 58, train_loss: 0.4041, test_loss: 1.4578, test_f1: 0.5878
 epoch: 59, train_loss: 0.3831, test_loss: 1.5346, test_f1: 0.5850
 epoch: 60, train_loss: 0.3965, test_loss: 1.4517, test_f1: 0.5942
 epoch: 61, train_loss: 0.3825, test_loss: 1.5338, test_f1: 0.6053
 epoch: 62, train_loss: 0.3784, test_loss: 1.4928, test_f1: 0.5872
 epoch: 63, train_loss: 0.3657, test_loss: 1.4906, test_f1: 0.5925
 epoch: 64, train_loss: 0.3783, test_loss: 1.5519, test_f1: 0.5874
 epoch: 65, train_loss: 0.3786, test_loss: 1.5521, test_f1: 0.6006
 epoch: 66, train_loss: 0.3676, test_loss: 1.6363, test_f1: 0.5828
 epoch: 67, train_loss: 0.3645, test_loss: 1.5703, test_f1: 0.5890
 epoch: 68, train_loss: 0.3557, test_loss: 1.6710, test_f1: 0.5958
 epoch: 69, train_loss: 0.3692, test_loss: 1.5944, test_f1: 0.5934
 epoch: 70, train_loss: 0.3662, test_loss: 1.6884, test_f1: 0.5996
 epoch: 71, train_loss: 0.3563, test_loss: 1.6817, test_f1: 0.5940
 epoch: 72, train_loss: 0.3514, test_loss: 1.6066, test_f1: 0.6007
 epoch: 73, train_loss: 0.3452, test_loss: 1.6336, test_f1: 0.5978
 epoch: 74, train_loss: 0.3411, test_loss: 1.6558, test_f1: 0.6150
 epoch: 75, train_loss: 0.3415, test_loss: 1.6837, test_f1: 0.6130
 epoch: 76, train_loss: 0.3343, test_loss: 1.6662, test_f1: 0.6094
 epoch: 77, train_loss: 0.3305, test_loss: 1.8456, test_f1: 0.5948
 epoch: 78, train_loss: 0.3157, test_loss: 1.7952, test_f1: 0.5767
 epoch: 79, train_loss: 0.3207, test_loss: 1.7096, test_f1: 0.5997
 epoch: 80, train_loss: 0.3196, test_loss: 1.9742, test_f1: 0.5926
 epoch: 81, train_loss: 0.3270, test_loss: 1.8214, test_f1: 0.5922
 epoch: 82, train_loss: 0.3289, test_loss: 2.0735, test_f1: 0.5916
 epoch: 83, train_loss: 0.3256, test_loss: 1.7922, test_f1: 0.6131
 epoch: 84, train_loss: 0.3009, test_loss: 1.9964, test_f1: 0.5979
 epoch: 85, train_loss: 0.3146, test_loss: 1.8344, test_f1: 0.5900
 epoch: 86, train_loss: 0.3125, test_loss: 1.8633, test_f1: 0.5878
 epoch: 87, train_loss: 0.3205, test_loss: 1.8988, test_f1: 0.5814
 epoch: 88, train_loss: 0.3076, test_loss: 1.8224, test_f1: 0.6054
 epoch: 89, train_loss: 0.3056, test_loss: 1.8574, test_f1: 0.6059
 epoch: 90, train_loss: 0.2898, test_loss: 1.8696, test_f1: 0.6042
 epoch: 91, train_loss: 0.2860, test_loss: 1.8405, test_f1: 0.5971
 epoch: 92, train_loss: 0.2910, test_loss: 2.1442, test_f1: 0.6105
 epoch: 93, train_loss: 0.2927, test_loss: 1.9187, test_f1: 0.6034
 epoch: 94, train_loss: 0.2715, test_loss: 2.1624, test_f1: 0.6023
 epoch: 95, train_loss: 0.2805, test_loss: 2.0410, test_f1: 0.5937
 epoch: 96, train_loss: 0.2942, test_loss: 1.9307, test_f1: 0.6098
 epoch: 97, train_loss: 0.2874, test_loss: 1.8834, test_f1: 0.6112
 epoch: 98, train_loss: 0.3069, test_loss: 2.0843, test_f1: 0.5943
 epoch: 99, train_loss: 0.2960, test_loss: 2.1727, test_f1: 0.5882
##################ITERATION #2 ****************************************
 epoch: 0, train_loss: 1.2189, test_loss: 1.2572, test_f1: 0.3535
 epoch: 1, train_loss: 1.1250, test_loss: 1.1713, test_f1: 0.4475
 epoch: 2, train_loss: 1.0786, test_loss: 1.1358, test_f1: 0.4612
 epoch: 3, train_loss: 1.0347, test_loss: 1.0984, test_f1: 0.5113
 epoch: 4, train_loss: 0.9963, test_loss: 1.0566, test_f1: 0.5371
 epoch: 5, train_loss: 0.9634, test_loss: 1.0195, test_f1: 0.5506
 epoch: 6, train_loss: 0.9265, test_loss: 0.9949, test_f1: 0.5885
 epoch: 7, train_loss: 0.9116, test_loss: 0.9764, test_f1: 0.5997
 epoch: 8, train_loss: 0.8835, test_loss: 0.9685, test_f1: 0.5875
 epoch: 9, train_loss: 0.8610, test_loss: 0.9506, test_f1: 0.5881
 epoch: 10, train_loss: 0.8356, test_loss: 0.9515, test_f1: 0.6067
 epoch: 11, train_loss: 0.8187, test_loss: 0.9465, test_f1: 0.6165
 epoch: 12, train_loss: 0.7988, test_loss: 0.9441, test_f1: 0.6004
 epoch: 13, train_loss: 0.7904, test_loss: 0.9453, test_f1: 0.6318
 epoch: 14, train_loss: 0.7734, test_loss: 0.9365, test_f1: 0.6059
 epoch: 15, train_loss: 0.7374, test_loss: 0.9420, test_f1: 0.5985
 epoch: 16, train_loss: 0.7438, test_loss: 0.9473, test_f1: 0.6408
 epoch: 17, train_loss: 0.7226, test_loss: 0.9617, test_f1: 0.5961
 epoch: 18, train_loss: 0.7074, test_loss: 1.0061, test_f1: 0.5959
 epoch: 19, train_loss: 0.7004, test_loss: 1.0297, test_f1: 0.5817
 epoch: 20, train_loss: 0.6894, test_loss: 1.0244, test_f1: 0.6194
 epoch: 21, train_loss: 0.6977, test_loss: 0.9836, test_f1: 0.5920
 epoch: 22, train_loss: 0.6747, test_loss: 1.0531, test_f1: 0.5998
 epoch: 23, train_loss: 0.6668, test_loss: 1.0030, test_f1: 0.6235
 epoch: 24, train_loss: 0.6561, test_loss: 1.0427, test_f1: 0.6268
 epoch: 25, train_loss: 0.6469, test_loss: 1.0538, test_f1: 0.6223
 epoch: 26, train_loss: 0.6461, test_loss: 1.0466, test_f1: 0.6222
 epoch: 27, train_loss: 0.6197, test_loss: 1.0865, test_f1: 0.6128
 epoch: 28, train_loss: 0.6227, test_loss: 1.0665, test_f1: 0.6604
 epoch: 29, train_loss: 0.6213, test_loss: 1.0600, test_f1: 0.6259
 epoch: 30, train_loss: 0.6014, test_loss: 1.0843, test_f1: 0.5974
 epoch: 31, train_loss: 0.5867, test_loss: 1.1299, test_f1: 0.6253
 epoch: 32, train_loss: 0.5883, test_loss: 1.1136, test_f1: 0.6397
 epoch: 33, train_loss: 0.5698, test_loss: 1.0722, test_f1: 0.6260
 epoch: 34, train_loss: 0.5707, test_loss: 1.0852, test_f1: 0.6490
 epoch: 35, train_loss: 0.5650, test_loss: 1.2013, test_f1: 0.6310
 epoch: 36, train_loss: 0.5547, test_loss: 1.0833, test_f1: 0.6276
 epoch: 37, train_loss: 0.5535, test_loss: 1.1197, test_f1: 0.6287
 epoch: 38, train_loss: 0.5328, test_loss: 1.2281, test_f1: 0.6035
 epoch: 39, train_loss: 0.5262, test_loss: 1.2302, test_f1: 0.6083
 epoch: 40, train_loss: 0.5464, test_loss: 1.2290, test_f1: 0.6431
 epoch: 41, train_loss: 0.5234, test_loss: 1.2358, test_f1: 0.6266
 epoch: 42, train_loss: 0.5207, test_loss: 1.1307, test_f1: 0.6158
 epoch: 43, train_loss: 0.5076, test_loss: 1.2165, test_f1: 0.6300
 epoch: 44, train_loss: 0.5074, test_loss: 1.2548, test_f1: 0.6366
 epoch: 45, train_loss: 0.5017, test_loss: 1.2622, test_f1: 0.6198
 epoch: 46, train_loss: 0.4985, test_loss: 1.2222, test_f1: 0.6597
 epoch: 47, train_loss: 0.4685, test_loss: 1.2982, test_f1: 0.6297
 epoch: 48, train_loss: 0.4769, test_loss: 1.2669, test_f1: 0.6389
 epoch: 49, train_loss: 0.4808, test_loss: 1.2319, test_f1: 0.6385
 epoch: 50, train_loss: 0.4755, test_loss: 1.2233, test_f1: 0.6471
 epoch: 51, train_loss: 0.4568, test_loss: 1.2463, test_f1: 0.6389
 epoch: 52, train_loss: 0.4305, test_loss: 1.3266, test_f1: 0.6392
 epoch: 53, train_loss: 0.4295, test_loss: 1.3151, test_f1: 0.6552
 epoch: 54, train_loss: 0.4354, test_loss: 1.3168, test_f1: 0.6380
 epoch: 55, train_loss: 0.4282, test_loss: 1.4017, test_f1: 0.6499
 epoch: 56, train_loss: 0.4306, test_loss: 1.2596, test_f1: 0.6419
 epoch: 57, train_loss: 0.4160, test_loss: 1.3011, test_f1: 0.6461
 epoch: 58, train_loss: 0.4000, test_loss: 1.3165, test_f1: 0.6249
 epoch: 59, train_loss: 0.4175, test_loss: 1.4558, test_f1: 0.6327
 epoch: 60, train_loss: 0.3967, test_loss: 1.3542, test_f1: 0.6527
 epoch: 61, train_loss: 0.3956, test_loss: 1.4429, test_f1: 0.6389
 epoch: 62, train_loss: 0.4030, test_loss: 1.3911, test_f1: 0.6491
 epoch: 63, train_loss: 0.3947, test_loss: 1.4026, test_f1: 0.6457
 epoch: 64, train_loss: 0.4020, test_loss: 1.3821, test_f1: 0.6469
 epoch: 65, train_loss: 0.3804, test_loss: 1.4029, test_f1: 0.6562
 epoch: 66, train_loss: 0.3728, test_loss: 1.3701, test_f1: 0.6436
 epoch: 67, train_loss: 0.3812, test_loss: 1.4330, test_f1: 0.6502
 epoch: 68, train_loss: 0.3838, test_loss: 1.5372, test_f1: 0.6453
 epoch: 69, train_loss: 0.3803, test_loss: 1.4812, test_f1: 0.6409
 epoch: 70, train_loss: 0.3749, test_loss: 1.4658, test_f1: 0.6276
 epoch: 71, train_loss: 0.3720, test_loss: 1.4078, test_f1: 0.6502
 epoch: 72, train_loss: 0.3498, test_loss: 1.5250, test_f1: 0.6444
 epoch: 73, train_loss: 0.3615, test_loss: 1.4997, test_f1: 0.6498
 epoch: 74, train_loss: 0.3545, test_loss: 1.4444, test_f1: 0.6319
 epoch: 75, train_loss: 0.3520, test_loss: 1.5052, test_f1: 0.6530
 epoch: 76, train_loss: 0.3359, test_loss: 1.4300, test_f1: 0.6661
 epoch: 77, train_loss: 0.3397, test_loss: 1.4904, test_f1: 0.6508
 epoch: 78, train_loss: 0.3582, test_loss: 1.4636, test_f1: 0.6475
 epoch: 79, train_loss: 0.3570, test_loss: 1.5433, test_f1: 0.6308
 epoch: 80, train_loss: 0.3447, test_loss: 1.5762, test_f1: 0.6404
 epoch: 81, train_loss: 0.3310, test_loss: 1.5804, test_f1: 0.6679
 epoch: 82, train_loss: 0.3335, test_loss: 1.5574, test_f1: 0.6596
 epoch: 83, train_loss: 0.3389, test_loss: 1.6892, test_f1: 0.6061
 epoch: 84, train_loss: 0.3415, test_loss: 1.5587, test_f1: 0.6492
 epoch: 85, train_loss: 0.3309, test_loss: 1.5611, test_f1: 0.6565
 epoch: 86, train_loss: 0.3221, test_loss: 1.6407, test_f1: 0.6441
 epoch: 87, train_loss: 0.3241, test_loss: 1.5247, test_f1: 0.6586
 epoch: 88, train_loss: 0.3191, test_loss: 1.6083, test_f1: 0.6429
 epoch: 89, train_loss: 0.2873, test_loss: 1.5855, test_f1: 0.6493
 epoch: 90, train_loss: 0.3021, test_loss: 1.6828, test_f1: 0.6427
 epoch: 91, train_loss: 0.3020, test_loss: 1.5777, test_f1: 0.6684
 epoch: 92, train_loss: 0.3345, test_loss: 1.7336, test_f1: 0.6498
 epoch: 93, train_loss: 0.3112, test_loss: 1.6443, test_f1: 0.6540
 epoch: 94, train_loss: 0.2831, test_loss: 1.6141, test_f1: 0.6433
 epoch: 95, train_loss: 0.2855, test_loss: 1.7828, test_f1: 0.6223
 epoch: 96, train_loss: 0.3147, test_loss: 1.6793, test_f1: 0.6462
 epoch: 97, train_loss: 0.2927, test_loss: 1.7613, test_f1: 0.6558
 epoch: 98, train_loss: 0.2854, test_loss: 1.6567, test_f1: 0.6582
 epoch: 99, train_loss: 0.2995, test_loss: 1.7391, test_f1: 0.6367
##################ITERATION #3 ****************************************
 epoch: 0, train_loss: 1.2045, test_loss: 1.2320, test_f1: 0.3173
 epoch: 1, train_loss: 1.0909, test_loss: 1.1204, test_f1: 0.4887
 epoch: 2, train_loss: 1.0399, test_loss: 1.0865, test_f1: 0.5019
 epoch: 3, train_loss: 0.9938, test_loss: 1.0458, test_f1: 0.5346
 epoch: 4, train_loss: 0.9532, test_loss: 1.0124, test_f1: 0.5541
 epoch: 5, train_loss: 0.9115, test_loss: 0.9942, test_f1: 0.5902
 epoch: 6, train_loss: 0.8799, test_loss: 0.9979, test_f1: 0.5680
 epoch: 7, train_loss: 0.8475, test_loss: 0.9967, test_f1: 0.5693
 epoch: 8, train_loss: 0.8367, test_loss: 0.9314, test_f1: 0.6052
 epoch: 9, train_loss: 0.8007, test_loss: 0.9686, test_f1: 0.5972
 epoch: 10, train_loss: 0.7835, test_loss: 0.9834, test_f1: 0.5864
 epoch: 11, train_loss: 0.7767, test_loss: 0.9761, test_f1: 0.5843
 epoch: 12, train_loss: 0.7524, test_loss: 0.9702, test_f1: 0.5802
 epoch: 13, train_loss: 0.7487, test_loss: 0.9678, test_f1: 0.5849
 epoch: 14, train_loss: 0.7226, test_loss: 0.9539, test_f1: 0.5805
 epoch: 15, train_loss: 0.7088, test_loss: 0.9510, test_f1: 0.5932
 epoch: 16, train_loss: 0.7264, test_loss: 0.9402, test_f1: 0.5748
 epoch: 17, train_loss: 0.6911, test_loss: 0.9692, test_f1: 0.5671
 epoch: 18, train_loss: 0.6726, test_loss: 0.9710, test_f1: 0.5569
 epoch: 19, train_loss: 0.6751, test_loss: 1.1178, test_f1: 0.5506
 epoch: 20, train_loss: 0.6706, test_loss: 0.9842, test_f1: 0.5782
 epoch: 21, train_loss: 0.6753, test_loss: 0.9329, test_f1: 0.6142
 epoch: 22, train_loss: 0.6541, test_loss: 0.9768, test_f1: 0.5815
 epoch: 23, train_loss: 0.6519, test_loss: 1.0026, test_f1: 0.5553
 epoch: 24, train_loss: 0.6348, test_loss: 1.0599, test_f1: 0.5662
 epoch: 25, train_loss: 0.6200, test_loss: 0.9441, test_f1: 0.5627
 epoch: 26, train_loss: 0.6246, test_loss: 0.9303, test_f1: 0.5814
 epoch: 27, train_loss: 0.6047, test_loss: 1.0176, test_f1: 0.5767
 epoch: 28, train_loss: 0.5906, test_loss: 1.0023, test_f1: 0.5760
 epoch: 29, train_loss: 0.5909, test_loss: 1.0111, test_f1: 0.5869
 epoch: 30, train_loss: 0.5792, test_loss: 1.0185, test_f1: 0.5953
 epoch: 31, train_loss: 0.5827, test_loss: 1.0520, test_f1: 0.5910
 epoch: 32, train_loss: 0.5569, test_loss: 1.0534, test_f1: 0.5697
 epoch: 33, train_loss: 0.5603, test_loss: 0.9886, test_f1: 0.6040
 epoch: 34, train_loss: 0.5489, test_loss: 1.0686, test_f1: 0.6215
 epoch: 35, train_loss: 0.5429, test_loss: 1.0385, test_f1: 0.5971
 epoch: 36, train_loss: 0.5535, test_loss: 1.0621, test_f1: 0.6215
 epoch: 37, train_loss: 0.5380, test_loss: 1.0596, test_f1: 0.6226
 epoch: 38, train_loss: 0.5345, test_loss: 1.1164, test_f1: 0.5507
 epoch: 39, train_loss: 0.5400, test_loss: 1.0863, test_f1: 0.5901
 epoch: 40, train_loss: 0.5080, test_loss: 1.1405, test_f1: 0.6009
 epoch: 41, train_loss: 0.5160, test_loss: 1.1311, test_f1: 0.5959
 epoch: 42, train_loss: 0.5014, test_loss: 1.1174, test_f1: 0.5933
 epoch: 43, train_loss: 0.5082, test_loss: 1.1699, test_f1: 0.5532
 epoch: 44, train_loss: 0.4986, test_loss: 1.1817, test_f1: 0.5921
 epoch: 45, train_loss: 0.4713, test_loss: 1.1993, test_f1: 0.5889
 epoch: 46, train_loss: 0.4701, test_loss: 1.2359, test_f1: 0.5835
 epoch: 47, train_loss: 0.4728, test_loss: 1.2607, test_f1: 0.5911
 epoch: 48, train_loss: 0.4649, test_loss: 1.2259, test_f1: 0.6127
 epoch: 49, train_loss: 0.4690, test_loss: 1.1701, test_f1: 0.6243
 epoch: 50, train_loss: 0.4634, test_loss: 1.4254, test_f1: 0.5818
 epoch: 51, train_loss: 0.4427, test_loss: 1.2894, test_f1: 0.6053
 epoch: 52, train_loss: 0.4394, test_loss: 1.3353, test_f1: 0.5944
 epoch: 53, train_loss: 0.4398, test_loss: 1.2798, test_f1: 0.5984
 epoch: 54, train_loss: 0.4241, test_loss: 1.2671, test_f1: 0.6101
 epoch: 55, train_loss: 0.4169, test_loss: 1.2303, test_f1: 0.6276
 epoch: 56, train_loss: 0.4077, test_loss: 1.2944, test_f1: 0.5931
 epoch: 57, train_loss: 0.4046, test_loss: 1.3584, test_f1: 0.6091
 epoch: 58, train_loss: 0.4040, test_loss: 1.3174, test_f1: 0.5871
 epoch: 59, train_loss: 0.4037, test_loss: 1.3211, test_f1: 0.5838
 epoch: 60, train_loss: 0.4158, test_loss: 1.3817, test_f1: 0.6028
 epoch: 61, train_loss: 0.3827, test_loss: 1.3695, test_f1: 0.6243
 epoch: 62, train_loss: 0.3884, test_loss: 1.2850, test_f1: 0.6278
 epoch: 63, train_loss: 0.4083, test_loss: 1.4299, test_f1: 0.6045
 epoch: 64, train_loss: 0.3827, test_loss: 1.3428, test_f1: 0.6160
 epoch: 65, train_loss: 0.3940, test_loss: 1.4031, test_f1: 0.6324
 epoch: 66, train_loss: 0.3859, test_loss: 1.5348, test_f1: 0.6123
 epoch: 67, train_loss: 0.3742, test_loss: 1.4797, test_f1: 0.5936
 epoch: 68, train_loss: 0.3651, test_loss: 1.4855, test_f1: 0.5891
 epoch: 69, train_loss: 0.3574, test_loss: 1.5250, test_f1: 0.6061
 epoch: 70, train_loss: 0.3685, test_loss: 1.5716, test_f1: 0.6181
 epoch: 71, train_loss: 0.3861, test_loss: 1.4726, test_f1: 0.6173
 epoch: 72, train_loss: 0.3549, test_loss: 1.5402, test_f1: 0.6033
 epoch: 73, train_loss: 0.3734, test_loss: 1.5495, test_f1: 0.6195
 epoch: 74, train_loss: 0.3746, test_loss: 1.6106, test_f1: 0.5971
 epoch: 75, train_loss: 0.3565, test_loss: 1.6364, test_f1: 0.5986
 epoch: 76, train_loss: 0.3596, test_loss: 1.6414, test_f1: 0.5952
 epoch: 77, train_loss: 0.3599, test_loss: 1.5494, test_f1: 0.6065
 epoch: 78, train_loss: 0.3472, test_loss: 1.5157, test_f1: 0.6180
 epoch: 79, train_loss: 0.3562, test_loss: 1.7030, test_f1: 0.6090
 epoch: 80, train_loss: 0.3581, test_loss: 1.6697, test_f1: 0.6173
 epoch: 81, train_loss: 0.3303, test_loss: 1.6519, test_f1: 0.6221
 epoch: 82, train_loss: 0.3225, test_loss: 1.6467, test_f1: 0.6202
 epoch: 83, train_loss: 0.3408, test_loss: 1.7887, test_f1: 0.5974
 epoch: 84, train_loss: 0.3415, test_loss: 1.6333, test_f1: 0.6244
 epoch: 85, train_loss: 0.3119, test_loss: 1.6463, test_f1: 0.6235
 epoch: 86, train_loss: 0.3160, test_loss: 1.6966, test_f1: 0.6111
 epoch: 87, train_loss: 0.3291, test_loss: 1.7875, test_f1: 0.6132
 epoch: 88, train_loss: 0.3331, test_loss: 1.7940, test_f1: 0.6285
 epoch: 89, train_loss: 0.3272, test_loss: 1.7830, test_f1: 0.6234
 epoch: 90, train_loss: 0.3260, test_loss: 1.7634, test_f1: 0.6116
 epoch: 91, train_loss: 0.3042, test_loss: 1.8174, test_f1: 0.6229
 epoch: 92, train_loss: 0.3377, test_loss: 1.8357, test_f1: 0.5803
 epoch: 93, train_loss: 0.3142, test_loss: 1.8601, test_f1: 0.6325
 epoch: 94, train_loss: 0.3126, test_loss: 1.8499, test_f1: 0.6258
 epoch: 95, train_loss: 0.3095, test_loss: 1.8661, test_f1: 0.6184
 epoch: 96, train_loss: 0.3109, test_loss: 1.8748, test_f1: 0.6111
 epoch: 97, train_loss: 0.3107, test_loss: 1.9783, test_f1: 0.6238
 epoch: 98, train_loss: 0.2971, test_loss: 1.9226, test_f1: 0.6338
 epoch: 99, train_loss: 0.2777, test_loss: 1.9160, test_f1: 0.6262
##################ITERATION #4 ****************************************
 epoch: 0, train_loss: 1.1911, test_loss: 1.2039, test_f1: 0.3576
 epoch: 1, train_loss: 1.0786, test_loss: 1.1003, test_f1: 0.5139
 epoch: 2, train_loss: 1.0044, test_loss: 1.0649, test_f1: 0.5203
 epoch: 3, train_loss: 0.9799, test_loss: 1.0361, test_f1: 0.5226
 epoch: 4, train_loss: 0.9472, test_loss: 0.9998, test_f1: 0.5569
 epoch: 5, train_loss: 0.9156, test_loss: 1.0026, test_f1: 0.5274
 epoch: 6, train_loss: 0.8956, test_loss: 0.9693, test_f1: 0.5697
 epoch: 7, train_loss: 0.8747, test_loss: 0.9638, test_f1: 0.5558
 epoch: 8, train_loss: 0.8414, test_loss: 0.9753, test_f1: 0.5479
 epoch: 9, train_loss: 0.8162, test_loss: 0.9844, test_f1: 0.5194
 epoch: 10, train_loss: 0.8132, test_loss: 0.9680, test_f1: 0.5615
 epoch: 11, train_loss: 0.7918, test_loss: 0.9882, test_f1: 0.5560
 epoch: 12, train_loss: 0.7748, test_loss: 0.9971, test_f1: 0.5193
 epoch: 13, train_loss: 0.7566, test_loss: 1.0130, test_f1: 0.5680
 epoch: 14, train_loss: 0.7414, test_loss: 1.0314, test_f1: 0.5616
 epoch: 15, train_loss: 0.7439, test_loss: 0.9756, test_f1: 0.5535
 epoch: 16, train_loss: 0.7200, test_loss: 0.9973, test_f1: 0.5840
 epoch: 17, train_loss: 0.6931, test_loss: 1.0254, test_f1: 0.6022
 epoch: 18, train_loss: 0.7067, test_loss: 1.0423, test_f1: 0.6085
 epoch: 19, train_loss: 0.6959, test_loss: 1.0504, test_f1: 0.5840
 epoch: 20, train_loss: 0.6729, test_loss: 1.0762, test_f1: 0.6011
 epoch: 21, train_loss: 0.6675, test_loss: 1.0646, test_f1: 0.5709
 epoch: 22, train_loss: 0.6516, test_loss: 1.0765, test_f1: 0.5833
 epoch: 23, train_loss: 0.6556, test_loss: 1.0609, test_f1: 0.5618
 epoch: 24, train_loss: 0.6331, test_loss: 1.0862, test_f1: 0.5875
 epoch: 25, train_loss: 0.6282, test_loss: 1.1968, test_f1: 0.5703
 epoch: 26, train_loss: 0.6236, test_loss: 1.0880, test_f1: 0.5883
 epoch: 27, train_loss: 0.6028, test_loss: 1.1313, test_f1: 0.6003
 epoch: 28, train_loss: 0.6077, test_loss: 1.1677, test_f1: 0.5644
 epoch: 29, train_loss: 0.5981, test_loss: 1.1666, test_f1: 0.5745
 epoch: 30, train_loss: 0.5822, test_loss: 1.1859, test_f1: 0.5916
 epoch: 31, train_loss: 0.5866, test_loss: 1.1905, test_f1: 0.5919
 epoch: 32, train_loss: 0.5650, test_loss: 1.2224, test_f1: 0.5664
 epoch: 33, train_loss: 0.5539, test_loss: 1.2006, test_f1: 0.5993
 epoch: 34, train_loss: 0.5481, test_loss: 1.2141, test_f1: 0.5690
 epoch: 35, train_loss: 0.5478, test_loss: 1.3386, test_f1: 0.5876
 epoch: 36, train_loss: 0.5529, test_loss: 1.2596, test_f1: 0.5793
 epoch: 37, train_loss: 0.5528, test_loss: 1.3586, test_f1: 0.5601
 epoch: 38, train_loss: 0.5425, test_loss: 1.2665, test_f1: 0.5659
 epoch: 39, train_loss: 0.5336, test_loss: 1.2883, test_f1: 0.6071
 epoch: 40, train_loss: 0.5350, test_loss: 1.2112, test_f1: 0.5904
 epoch: 41, train_loss: 0.5366, test_loss: 1.4268, test_f1: 0.5854
 epoch: 42, train_loss: 0.4884, test_loss: 1.3950, test_f1: 0.5939
 epoch: 43, train_loss: 0.5116, test_loss: 1.3390, test_f1: 0.6138
 epoch: 44, train_loss: 0.4829, test_loss: 1.3648, test_f1: 0.5895
 epoch: 45, train_loss: 0.4967, test_loss: 1.4644, test_f1: 0.5818
 epoch: 46, train_loss: 0.4946, test_loss: 1.4287, test_f1: 0.5680
 epoch: 47, train_loss: 0.4858, test_loss: 1.4954, test_f1: 0.5915
 epoch: 48, train_loss: 0.4798, test_loss: 1.4590, test_f1: 0.5595
 epoch: 49, train_loss: 0.4465, test_loss: 1.5167, test_f1: 0.5844
 epoch: 50, train_loss: 0.4756, test_loss: 1.4405, test_f1: 0.5908
 epoch: 51, train_loss: 0.4438, test_loss: 1.4720, test_f1: 0.5745
 epoch: 52, train_loss: 0.4302, test_loss: 1.5970, test_f1: 0.5760
 epoch: 53, train_loss: 0.4217, test_loss: 1.5488, test_f1: 0.5865
 epoch: 54, train_loss: 0.4179, test_loss: 1.5848, test_f1: 0.5740
 epoch: 55, train_loss: 0.4171, test_loss: 1.5761, test_f1: 0.5828
 epoch: 56, train_loss: 0.4045, test_loss: 1.5989, test_f1: 0.5890
 epoch: 57, train_loss: 0.4118, test_loss: 1.5608, test_f1: 0.5801
 epoch: 58, train_loss: 0.4403, test_loss: 1.6028, test_f1: 0.5819
 epoch: 59, train_loss: 0.4156, test_loss: 1.6423, test_f1: 0.5959
 epoch: 60, train_loss: 0.3963, test_loss: 1.6458, test_f1: 0.5852
 epoch: 61, train_loss: 0.3894, test_loss: 1.7229, test_f1: 0.5802
 epoch: 62, train_loss: 0.3875, test_loss: 1.6711, test_f1: 0.5782
 epoch: 63, train_loss: 0.4000, test_loss: 1.6973, test_f1: 0.5677
 epoch: 64, train_loss: 0.4061, test_loss: 1.6536, test_f1: 0.5808
 epoch: 65, train_loss: 0.3784, test_loss: 1.5977, test_f1: 0.5798
 epoch: 66, train_loss: 0.3945, test_loss: 1.6707, test_f1: 0.5833
 epoch: 67, train_loss: 0.3719, test_loss: 1.6849, test_f1: 0.5790
 epoch: 68, train_loss: 0.3818, test_loss: 1.6808, test_f1: 0.5868
 epoch: 69, train_loss: 0.3730, test_loss: 1.7074, test_f1: 0.5904
 epoch: 70, train_loss: 0.3610, test_loss: 1.7439, test_f1: 0.5963
 epoch: 71, train_loss: 0.3633, test_loss: 1.7845, test_f1: 0.5622
 epoch: 72, train_loss: 0.3829, test_loss: 1.7643, test_f1: 0.5844
 epoch: 73, train_loss: 0.3633, test_loss: 1.7435, test_f1: 0.5859
 epoch: 74, train_loss: 0.3584, test_loss: 1.7747, test_f1: 0.5944
 epoch: 75, train_loss: 0.3693, test_loss: 1.8348, test_f1: 0.5801
 epoch: 76, train_loss: 0.3617, test_loss: 1.8201, test_f1: 0.5743
 epoch: 77, train_loss: 0.3415, test_loss: 1.8744, test_f1: 0.5835
 epoch: 78, train_loss: 0.3409, test_loss: 1.7975, test_f1: 0.5723
 epoch: 79, train_loss: 0.3457, test_loss: 1.9436, test_f1: 0.5731
 epoch: 80, train_loss: 0.3367, test_loss: 1.8691, test_f1: 0.5917
 epoch: 81, train_loss: 0.3493, test_loss: 1.9208, test_f1: 0.5822
 epoch: 82, train_loss: 0.3372, test_loss: 1.9232, test_f1: 0.5895
 epoch: 83, train_loss: 0.3410, test_loss: 1.9093, test_f1: 0.5863
 epoch: 84, train_loss: 0.3440, test_loss: 1.8903, test_f1: 0.5938
 epoch: 85, train_loss: 0.3301, test_loss: 2.0056, test_f1: 0.5712
 epoch: 86, train_loss: 0.3331, test_loss: 1.9319, test_f1: 0.5913
 epoch: 87, train_loss: 0.3174, test_loss: 1.8636, test_f1: 0.5942
 epoch: 88, train_loss: 0.3217, test_loss: 1.9287, test_f1: 0.5949
 epoch: 89, train_loss: 0.3133, test_loss: 1.9658, test_f1: 0.5808
 epoch: 90, train_loss: 0.3143, test_loss: 1.8508, test_f1: 0.6039
 epoch: 91, train_loss: 0.3085, test_loss: 2.0118, test_f1: 0.5883
 epoch: 92, train_loss: 0.3145, test_loss: 2.0261, test_f1: 0.6002
 epoch: 93, train_loss: 0.3069, test_loss: 2.0329, test_f1: 0.5971
 epoch: 94, train_loss: 0.3143, test_loss: 2.0225, test_f1: 0.5955
 epoch: 95, train_loss: 0.3029, test_loss: 2.0435, test_f1: 0.5824
 epoch: 96, train_loss: 0.2967, test_loss: 1.9895, test_f1: 0.5611
 epoch: 97, train_loss: 0.3049, test_loss: 2.0506, test_f1: 0.5891
 epoch: 98, train_loss: 0.2834, test_loss: 2.1173, test_f1: 0.5806
 epoch: 99, train_loss: 0.2896, test_loss: 2.0082, test_f1: 0.5903
##################ITERATION #5 ****************************************
 epoch: 0, train_loss: 1.1890, test_loss: 1.2485, test_f1: 0.2935
 epoch: 1, train_loss: 1.0684, test_loss: 1.1022, test_f1: 0.5163
 epoch: 2, train_loss: 1.0168, test_loss: 1.0710, test_f1: 0.5336
 epoch: 3, train_loss: 0.9974, test_loss: 1.0353, test_f1: 0.5555
 epoch: 4, train_loss: 0.9412, test_loss: 1.0236, test_f1: 0.5643
 epoch: 5, train_loss: 0.9202, test_loss: 1.0311, test_f1: 0.5679
 epoch: 6, train_loss: 0.8915, test_loss: 1.0135, test_f1: 0.5785
 epoch: 7, train_loss: 0.8619, test_loss: 1.0126, test_f1: 0.5654
 epoch: 8, train_loss: 0.8483, test_loss: 0.9957, test_f1: 0.5650
 epoch: 9, train_loss: 0.8266, test_loss: 1.0162, test_f1: 0.5919
 epoch: 10, train_loss: 0.8328, test_loss: 1.0024, test_f1: 0.5936
 epoch: 11, train_loss: 0.7977, test_loss: 0.9940, test_f1: 0.5912
 epoch: 12, train_loss: 0.7968, test_loss: 1.0059, test_f1: 0.6182
 epoch: 13, train_loss: 0.7636, test_loss: 1.0013, test_f1: 0.6201
 epoch: 14, train_loss: 0.7575, test_loss: 1.0190, test_f1: 0.6069
 epoch: 15, train_loss: 0.7422, test_loss: 1.0463, test_f1: 0.5653
 epoch: 16, train_loss: 0.7255, test_loss: 0.9869, test_f1: 0.6397
 epoch: 17, train_loss: 0.7228, test_loss: 0.9893, test_f1: 0.6432
 epoch: 18, train_loss: 0.7111, test_loss: 1.0128, test_f1: 0.5792
 epoch: 19, train_loss: 0.6980, test_loss: 1.0252, test_f1: 0.6039
 epoch: 20, train_loss: 0.6980, test_loss: 1.0879, test_f1: 0.6155
 epoch: 21, train_loss: 0.6776, test_loss: 1.0530, test_f1: 0.6057
 epoch: 22, train_loss: 0.6699, test_loss: 1.0686, test_f1: 0.5816
 epoch: 23, train_loss: 0.6716, test_loss: 1.0577, test_f1: 0.5997
 epoch: 24, train_loss: 0.6554, test_loss: 1.0311, test_f1: 0.5818
 epoch: 25, train_loss: 0.6531, test_loss: 1.1588, test_f1: 0.5576
 epoch: 26, train_loss: 0.6422, test_loss: 1.0471, test_f1: 0.5930
 epoch: 27, train_loss: 0.6309, test_loss: 1.0325, test_f1: 0.6040
 epoch: 28, train_loss: 0.6245, test_loss: 1.0893, test_f1: 0.6029
 epoch: 29, train_loss: 0.5961, test_loss: 1.0997, test_f1: 0.6154
 epoch: 30, train_loss: 0.6226, test_loss: 1.0521, test_f1: 0.5958
 epoch: 31, train_loss: 0.5978, test_loss: 1.0801, test_f1: 0.5915
 epoch: 32, train_loss: 0.5802, test_loss: 1.0653, test_f1: 0.6111
 epoch: 33, train_loss: 0.5823, test_loss: 1.0099, test_f1: 0.6430
 epoch: 34, train_loss: 0.5731, test_loss: 1.0631, test_f1: 0.6111
 epoch: 35, train_loss: 0.5467, test_loss: 1.1094, test_f1: 0.5938
 epoch: 36, train_loss: 0.5779, test_loss: 1.1048, test_f1: 0.6241
 epoch: 37, train_loss: 0.5534, test_loss: 1.0844, test_f1: 0.6072
 epoch: 38, train_loss: 0.5502, test_loss: 1.1063, test_f1: 0.5939
 epoch: 39, train_loss: 0.5468, test_loss: 1.1514, test_f1: 0.5900
 epoch: 40, train_loss: 0.5303, test_loss: 1.1020, test_f1: 0.6247
 epoch: 41, train_loss: 0.5512, test_loss: 1.1874, test_f1: 0.6073
 epoch: 42, train_loss: 0.5199, test_loss: 1.1265, test_f1: 0.6002
 epoch: 43, train_loss: 0.5293, test_loss: 1.0887, test_f1: 0.6352
 epoch: 44, train_loss: 0.5279, test_loss: 1.1054, test_f1: 0.6320
 epoch: 45, train_loss: 0.5197, test_loss: 1.2104, test_f1: 0.5970
 epoch: 46, train_loss: 0.5225, test_loss: 1.1744, test_f1: 0.6271
 epoch: 47, train_loss: 0.4758, test_loss: 1.2195, test_f1: 0.6048
 epoch: 48, train_loss: 0.4892, test_loss: 1.1587, test_f1: 0.6202
 epoch: 49, train_loss: 0.4790, test_loss: 1.1181, test_f1: 0.6681
 epoch: 50, train_loss: 0.4803, test_loss: 1.1682, test_f1: 0.6503
 epoch: 51, train_loss: 0.4467, test_loss: 1.1902, test_f1: 0.6570
 epoch: 52, train_loss: 0.4607, test_loss: 1.2953, test_f1: 0.6364
 epoch: 53, train_loss: 0.4461, test_loss: 1.1877, test_f1: 0.6476
 epoch: 54, train_loss: 0.4241, test_loss: 1.1844, test_f1: 0.6196
 epoch: 55, train_loss: 0.4545, test_loss: 1.2796, test_f1: 0.6171
 epoch: 56, train_loss: 0.4363, test_loss: 1.2198, test_f1: 0.6378
 epoch: 57, train_loss: 0.4173, test_loss: 1.2403, test_f1: 0.6478
 epoch: 58, train_loss: 0.4476, test_loss: 1.2048, test_f1: 0.6760
 epoch: 59, train_loss: 0.4264, test_loss: 1.2515, test_f1: 0.6680
 epoch: 60, train_loss: 0.4090, test_loss: 1.2983, test_f1: 0.6167
 epoch: 61, train_loss: 0.4214, test_loss: 1.2458, test_f1: 0.6343
 epoch: 62, train_loss: 0.4000, test_loss: 1.2751, test_f1: 0.6473
 epoch: 63, train_loss: 0.4251, test_loss: 1.2647, test_f1: 0.6497
 epoch: 64, train_loss: 0.4053, test_loss: 1.2857, test_f1: 0.6425
 epoch: 65, train_loss: 0.4058, test_loss: 1.3212, test_f1: 0.6697
 epoch: 66, train_loss: 0.4212, test_loss: 1.3632, test_f1: 0.6086
 epoch: 67, train_loss: 0.4024, test_loss: 1.2998, test_f1: 0.6172
 epoch: 68, train_loss: 0.3863, test_loss: 1.2545, test_f1: 0.6344
 epoch: 69, train_loss: 0.4001, test_loss: 1.3549, test_f1: 0.6391
 epoch: 70, train_loss: 0.3980, test_loss: 1.3026, test_f1: 0.6369
 epoch: 71, train_loss: 0.3766, test_loss: 1.3211, test_f1: 0.6379
 epoch: 72, train_loss: 0.3796, test_loss: 1.2831, test_f1: 0.6674
 epoch: 73, train_loss: 0.3802, test_loss: 1.3847, test_f1: 0.6389
 epoch: 74, train_loss: 0.3756, test_loss: 1.3730, test_f1: 0.6215
 epoch: 75, train_loss: 0.3824, test_loss: 1.3866, test_f1: 0.6140
 epoch: 76, train_loss: 0.3901, test_loss: 1.3705, test_f1: 0.6716
 epoch: 77, train_loss: 0.3814, test_loss: 1.4116, test_f1: 0.6389
 epoch: 78, train_loss: 0.3880, test_loss: 1.4092, test_f1: 0.6283
 epoch: 79, train_loss: 0.3700, test_loss: 1.3432, test_f1: 0.6467
 epoch: 80, train_loss: 0.3778, test_loss: 1.4935, test_f1: 0.5982
 epoch: 81, train_loss: 0.3564, test_loss: 1.4016, test_f1: 0.6517
 epoch: 82, train_loss: 0.3725, test_loss: 1.3486, test_f1: 0.6651
 epoch: 83, train_loss: 0.3415, test_loss: 1.4152, test_f1: 0.6379
 epoch: 84, train_loss: 0.3373, test_loss: 1.4727, test_f1: 0.6412
 epoch: 85, train_loss: 0.3330, test_loss: 1.5536, test_f1: 0.6213
 epoch: 86, train_loss: 0.3216, test_loss: 1.4312, test_f1: 0.6524
 epoch: 87, train_loss: 0.3352, test_loss: 1.4910, test_f1: 0.6522
 epoch: 88, train_loss: 0.3202, test_loss: 1.4056, test_f1: 0.6418
 epoch: 89, train_loss: 0.3563, test_loss: 1.4922, test_f1: 0.6287
 epoch: 90, train_loss: 0.3473, test_loss: 1.5585, test_f1: 0.6174
 epoch: 91, train_loss: 0.3319, test_loss: 1.5157, test_f1: 0.6501
 epoch: 92, train_loss: 0.3452, test_loss: 1.5382, test_f1: 0.6301
 epoch: 93, train_loss: 0.3577, test_loss: 1.5267, test_f1: 0.6157
 epoch: 94, train_loss: 0.3112, test_loss: 1.5692, test_f1: 0.6172
 epoch: 95, train_loss: 0.3207, test_loss: 1.5319, test_f1: 0.6334
 epoch: 96, train_loss: 0.3063, test_loss: 1.5507, test_f1: 0.6685
 epoch: 97, train_loss: 0.3129, test_loss: 1.5514, test_f1: 0.6509
 epoch: 98, train_loss: 0.3095, test_loss: 1.5174, test_f1: 0.6420
 epoch: 99, train_loss: 0.3087, test_loss: 1.4967, test_f1: 0.6718
##################ITERATION #6 ****************************************
 epoch: 0, train_loss: 1.2265, test_loss: 1.2337, test_f1: 0.4196
 epoch: 1, train_loss: 1.0760, test_loss: 1.1180, test_f1: 0.5068
 epoch: 2, train_loss: 1.0370, test_loss: 1.0944, test_f1: 0.5306
 epoch: 3, train_loss: 0.9850, test_loss: 1.0418, test_f1: 0.5720
 epoch: 4, train_loss: 0.9610, test_loss: 1.0085, test_f1: 0.5809
 epoch: 5, train_loss: 0.9242, test_loss: 1.0105, test_f1: 0.5556
 epoch: 6, train_loss: 0.8950, test_loss: 0.9856, test_f1: 0.6148
 epoch: 7, train_loss: 0.8828, test_loss: 0.9764, test_f1: 0.5963
 epoch: 8, train_loss: 0.8673, test_loss: 0.9748, test_f1: 0.5896
 epoch: 9, train_loss: 0.8274, test_loss: 0.9618, test_f1: 0.6138
 epoch: 10, train_loss: 0.8111, test_loss: 0.9795, test_f1: 0.5994
 epoch: 11, train_loss: 0.8110, test_loss: 0.9711, test_f1: 0.5989
 epoch: 12, train_loss: 0.7985, test_loss: 0.9549, test_f1: 0.6222
 epoch: 13, train_loss: 0.7905, test_loss: 0.9569, test_f1: 0.6255
 epoch: 14, train_loss: 0.7680, test_loss: 0.9543, test_f1: 0.6113
 epoch: 15, train_loss: 0.7562, test_loss: 0.9497, test_f1: 0.6213
 epoch: 16, train_loss: 0.7405, test_loss: 0.9653, test_f1: 0.6017
 epoch: 17, train_loss: 0.7175, test_loss: 0.9558, test_f1: 0.6260
 epoch: 18, train_loss: 0.7138, test_loss: 0.9625, test_f1: 0.5913
 epoch: 19, train_loss: 0.6989, test_loss: 0.9532, test_f1: 0.6217
 epoch: 20, train_loss: 0.6992, test_loss: 0.9559, test_f1: 0.6078
 epoch: 21, train_loss: 0.6946, test_loss: 1.0236, test_f1: 0.6200
 epoch: 22, train_loss: 0.6831, test_loss: 0.9631, test_f1: 0.6270
 epoch: 23, train_loss: 0.6864, test_loss: 0.9290, test_f1: 0.6184
 epoch: 24, train_loss: 0.6606, test_loss: 0.9493, test_f1: 0.6448
 epoch: 25, train_loss: 0.6623, test_loss: 0.9545, test_f1: 0.6317
 epoch: 26, train_loss: 0.6546, test_loss: 0.9274, test_f1: 0.6311
 epoch: 27, train_loss: 0.6448, test_loss: 1.0221, test_f1: 0.6099
 epoch: 28, train_loss: 0.6139, test_loss: 0.9629, test_f1: 0.6087
 epoch: 29, train_loss: 0.6406, test_loss: 0.9993, test_f1: 0.6256
 epoch: 30, train_loss: 0.6039, test_loss: 0.9741, test_f1: 0.6298
 epoch: 31, train_loss: 0.5999, test_loss: 1.0242, test_f1: 0.6011
 epoch: 32, train_loss: 0.5985, test_loss: 0.9735, test_f1: 0.5916
 epoch: 33, train_loss: 0.5972, test_loss: 0.9992, test_f1: 0.6415
 epoch: 34, train_loss: 0.5684, test_loss: 1.0188, test_f1: 0.5955
 epoch: 35, train_loss: 0.5669, test_loss: 1.0110, test_f1: 0.6167
 epoch: 36, train_loss: 0.5864, test_loss: 1.0770, test_f1: 0.6359
 epoch: 37, train_loss: 0.5672, test_loss: 0.9737, test_f1: 0.6792
 epoch: 38, train_loss: 0.5397, test_loss: 1.0271, test_f1: 0.6190
 epoch: 39, train_loss: 0.5625, test_loss: 1.1567, test_f1: 0.6080
 epoch: 40, train_loss: 0.5558, test_loss: 1.0787, test_f1: 0.6446
 epoch: 41, train_loss: 0.5461, test_loss: 1.1647, test_f1: 0.6003
 epoch: 42, train_loss: 0.5350, test_loss: 1.0930, test_f1: 0.6267
 epoch: 43, train_loss: 0.5372, test_loss: 1.1298, test_f1: 0.5902
 epoch: 44, train_loss: 0.5295, test_loss: 1.1183, test_f1: 0.6387
 epoch: 45, train_loss: 0.5107, test_loss: 1.1779, test_f1: 0.6210
 epoch: 46, train_loss: 0.5118, test_loss: 1.0298, test_f1: 0.6229
 epoch: 47, train_loss: 0.5024, test_loss: 1.1099, test_f1: 0.6043
 epoch: 48, train_loss: 0.5165, test_loss: 1.1452, test_f1: 0.6237
 epoch: 49, train_loss: 0.4915, test_loss: 1.2310, test_f1: 0.6061
 epoch: 50, train_loss: 0.4812, test_loss: 1.1992, test_f1: 0.6072
 epoch: 51, train_loss: 0.4692, test_loss: 1.2061, test_f1: 0.5882
 epoch: 52, train_loss: 0.4574, test_loss: 1.1703, test_f1: 0.6307
 epoch: 53, train_loss: 0.4557, test_loss: 1.1879, test_f1: 0.6287
 epoch: 54, train_loss: 0.4475, test_loss: 1.1643, test_f1: 0.6323
 epoch: 55, train_loss: 0.4780, test_loss: 1.1539, test_f1: 0.6275
 epoch: 56, train_loss: 0.4346, test_loss: 1.1399, test_f1: 0.6357
 epoch: 57, train_loss: 0.4317, test_loss: 1.2062, test_f1: 0.6343
 epoch: 58, train_loss: 0.4440, test_loss: 1.2665, test_f1: 0.6250
 epoch: 59, train_loss: 0.4399, test_loss: 1.2257, test_f1: 0.6168
 epoch: 60, train_loss: 0.4141, test_loss: 1.2417, test_f1: 0.6325
 epoch: 61, train_loss: 0.4216, test_loss: 1.2319, test_f1: 0.6327
 epoch: 62, train_loss: 0.4158, test_loss: 1.2479, test_f1: 0.6332
 epoch: 63, train_loss: 0.4269, test_loss: 1.2289, test_f1: 0.6413
 epoch: 64, train_loss: 0.4263, test_loss: 1.2212, test_f1: 0.6245
 epoch: 65, train_loss: 0.3959, test_loss: 1.2085, test_f1: 0.6383
 epoch: 66, train_loss: 0.4190, test_loss: 1.2856, test_f1: 0.6321
 epoch: 67, train_loss: 0.3907, test_loss: 1.2316, test_f1: 0.6328
 epoch: 68, train_loss: 0.3849, test_loss: 1.2648, test_f1: 0.6421
 epoch: 69, train_loss: 0.3862, test_loss: 1.2179, test_f1: 0.6517
 epoch: 70, train_loss: 0.4030, test_loss: 1.2573, test_f1: 0.6360
 epoch: 71, train_loss: 0.3803, test_loss: 1.3170, test_f1: 0.6381
 epoch: 72, train_loss: 0.4240, test_loss: 1.3811, test_f1: 0.6067
 epoch: 73, train_loss: 0.4076, test_loss: 1.3563, test_f1: 0.6376
 epoch: 74, train_loss: 0.3890, test_loss: 1.3445, test_f1: 0.6355
 epoch: 75, train_loss: 0.4033, test_loss: 1.2481, test_f1: 0.6609
 epoch: 76, train_loss: 0.3790, test_loss: 1.3624, test_f1: 0.6161
 epoch: 77, train_loss: 0.3813, test_loss: 1.3059, test_f1: 0.6454
 epoch: 78, train_loss: 0.3839, test_loss: 1.2800, test_f1: 0.6445
 epoch: 79, train_loss: 0.3732, test_loss: 1.3161, test_f1: 0.6309
 epoch: 80, train_loss: 0.3878, test_loss: 1.3841, test_f1: 0.6293
 epoch: 81, train_loss: 0.3647, test_loss: 1.4059, test_f1: 0.6435
 epoch: 82, train_loss: 0.3939, test_loss: 1.3453, test_f1: 0.6474
 epoch: 83, train_loss: 0.3661, test_loss: 1.3303, test_f1: 0.6595
 epoch: 84, train_loss: 0.3606, test_loss: 1.3684, test_f1: 0.6380
 epoch: 85, train_loss: 0.3745, test_loss: 1.3551, test_f1: 0.6427
 epoch: 86, train_loss: 0.3583, test_loss: 1.4079, test_f1: 0.6370
 epoch: 87, train_loss: 0.3585, test_loss: 1.5156, test_f1: 0.6162
 epoch: 88, train_loss: 0.3395, test_loss: 1.4489, test_f1: 0.6422
 epoch: 89, train_loss: 0.3537, test_loss: 1.4558, test_f1: 0.6371
 epoch: 90, train_loss: 0.3667, test_loss: 1.5865, test_f1: 0.6140
 epoch: 91, train_loss: 0.3415, test_loss: 1.4820, test_f1: 0.6287
 epoch: 92, train_loss: 0.3432, test_loss: 1.4981, test_f1: 0.6587
 epoch: 93, train_loss: 0.3332, test_loss: 1.5444, test_f1: 0.6366
 epoch: 94, train_loss: 0.3263, test_loss: 1.4898, test_f1: 0.6516
 epoch: 95, train_loss: 0.3424, test_loss: 1.5143, test_f1: 0.6380
 epoch: 96, train_loss: 0.3503, test_loss: 1.4485, test_f1: 0.6566
 epoch: 97, train_loss: 0.3342, test_loss: 1.5202, test_f1: 0.6560
 epoch: 98, train_loss: 0.3524, test_loss: 1.5062, test_f1: 0.6329
 epoch: 99, train_loss: 0.3397, test_loss: 1.4847, test_f1: 0.6589
##################ITERATION #7 ****************************************
 epoch: 0, train_loss: 1.2307, test_loss: 1.2813, test_f1: 0.2510
 epoch: 1, train_loss: 1.0601, test_loss: 1.1578, test_f1: 0.5435
 epoch: 2, train_loss: 1.0026, test_loss: 1.1725, test_f1: 0.5252
 epoch: 3, train_loss: 0.9879, test_loss: 1.0953, test_f1: 0.5212
 epoch: 4, train_loss: 0.9616, test_loss: 1.1385, test_f1: 0.5347
 epoch: 5, train_loss: 0.9434, test_loss: 1.0867, test_f1: 0.5312
 epoch: 6, train_loss: 0.9145, test_loss: 1.1403, test_f1: 0.5397
 epoch: 7, train_loss: 0.8756, test_loss: 1.0933, test_f1: 0.5323
 epoch: 8, train_loss: 0.8564, test_loss: 1.1202, test_f1: 0.5544
 epoch: 9, train_loss: 0.8534, test_loss: 1.0918, test_f1: 0.5672
 epoch: 10, train_loss: 0.8273, test_loss: 1.0777, test_f1: 0.5416
 epoch: 11, train_loss: 0.8006, test_loss: 1.0685, test_f1: 0.5750
 epoch: 12, train_loss: 0.7800, test_loss: 1.0348, test_f1: 0.5371
 epoch: 13, train_loss: 0.7754, test_loss: 1.0797, test_f1: 0.5316
 epoch: 14, train_loss: 0.7631, test_loss: 1.0748, test_f1: 0.5917
 epoch: 15, train_loss: 0.7571, test_loss: 1.0600, test_f1: 0.5903
 epoch: 16, train_loss: 0.7395, test_loss: 1.0947, test_f1: 0.6114
 epoch: 17, train_loss: 0.7284, test_loss: 1.1583, test_f1: 0.6063
 epoch: 18, train_loss: 0.7285, test_loss: 1.0646, test_f1: 0.5948
 epoch: 19, train_loss: 0.7053, test_loss: 1.1438, test_f1: 0.5533
 epoch: 20, train_loss: 0.6928, test_loss: 1.1434, test_f1: 0.5711
 epoch: 21, train_loss: 0.6842, test_loss: 1.1257, test_f1: 0.5989
 epoch: 22, train_loss: 0.6851, test_loss: 1.1217, test_f1: 0.6112
 epoch: 23, train_loss: 0.6799, test_loss: 1.1487, test_f1: 0.5720
 epoch: 24, train_loss: 0.6714, test_loss: 1.1267, test_f1: 0.5994
 epoch: 25, train_loss: 0.6745, test_loss: 1.1265, test_f1: 0.5761
 epoch: 26, train_loss: 0.6356, test_loss: 1.1371, test_f1: 0.6251
 epoch: 27, train_loss: 0.6322, test_loss: 1.1344, test_f1: 0.6136
 epoch: 28, train_loss: 0.6405, test_loss: 1.2123, test_f1: 0.6139
 epoch: 29, train_loss: 0.6154, test_loss: 1.1506, test_f1: 0.6147
 epoch: 30, train_loss: 0.6242, test_loss: 1.1357, test_f1: 0.6280
 epoch: 31, train_loss: 0.6056, test_loss: 1.2341, test_f1: 0.6058
 epoch: 32, train_loss: 0.6257, test_loss: 1.2136, test_f1: 0.6087
 epoch: 33, train_loss: 0.6004, test_loss: 1.2373, test_f1: 0.5878
 epoch: 34, train_loss: 0.5968, test_loss: 1.2203, test_f1: 0.6279
 epoch: 35, train_loss: 0.5756, test_loss: 1.1912, test_f1: 0.6390
 epoch: 36, train_loss: 0.5813, test_loss: 1.2276, test_f1: 0.6275
 epoch: 37, train_loss: 0.5616, test_loss: 1.1506, test_f1: 0.6369
 epoch: 38, train_loss: 0.5584, test_loss: 1.1818, test_f1: 0.6450
 epoch: 39, train_loss: 0.5505, test_loss: 1.1841, test_f1: 0.6138
 epoch: 40, train_loss: 0.5627, test_loss: 1.2598, test_f1: 0.6291
 epoch: 41, train_loss: 0.5486, test_loss: 1.2340, test_f1: 0.6303
 epoch: 42, train_loss: 0.5436, test_loss: 1.2695, test_f1: 0.6041
 epoch: 43, train_loss: 0.5248, test_loss: 1.2298, test_f1: 0.6509
 epoch: 44, train_loss: 0.5313, test_loss: 1.2274, test_f1: 0.6436
 epoch: 45, train_loss: 0.5234, test_loss: 1.2204, test_f1: 0.6159
 epoch: 46, train_loss: 0.5177, test_loss: 1.2633, test_f1: 0.6407
 epoch: 47, train_loss: 0.5144, test_loss: 1.2889, test_f1: 0.6220
 epoch: 48, train_loss: 0.5179, test_loss: 1.3459, test_f1: 0.6158
 epoch: 49, train_loss: 0.4926, test_loss: 1.3945, test_f1: 0.6142
 epoch: 50, train_loss: 0.5024, test_loss: 1.3020, test_f1: 0.6535
 epoch: 51, train_loss: 0.4785, test_loss: 1.3160, test_f1: 0.6448
 epoch: 52, train_loss: 0.4764, test_loss: 1.2764, test_f1: 0.6528
 epoch: 53, train_loss: 0.4585, test_loss: 1.3408, test_f1: 0.6322
 epoch: 54, train_loss: 0.4486, test_loss: 1.2829, test_f1: 0.6404
 epoch: 55, train_loss: 0.4567, test_loss: 1.3623, test_f1: 0.6497
 epoch: 56, train_loss: 0.4509, test_loss: 1.3785, test_f1: 0.6508
 epoch: 57, train_loss: 0.4393, test_loss: 1.3729, test_f1: 0.6611
 epoch: 58, train_loss: 0.4409, test_loss: 1.3782, test_f1: 0.6655
 epoch: 59, train_loss: 0.4531, test_loss: 1.4012, test_f1: 0.6347
 epoch: 60, train_loss: 0.4215, test_loss: 1.3811, test_f1: 0.6360
 epoch: 61, train_loss: 0.4162, test_loss: 1.4098, test_f1: 0.6454
 epoch: 62, train_loss: 0.4285, test_loss: 1.4456, test_f1: 0.6347
 epoch: 63, train_loss: 0.4332, test_loss: 1.3919, test_f1: 0.6423
 epoch: 64, train_loss: 0.4221, test_loss: 1.4252, test_f1: 0.6505
 epoch: 65, train_loss: 0.4005, test_loss: 1.4116, test_f1: 0.6499
 epoch: 66, train_loss: 0.4069, test_loss: 1.4372, test_f1: 0.6363
 epoch: 67, train_loss: 0.4213, test_loss: 1.4822, test_f1: 0.6469
 epoch: 68, train_loss: 0.3961, test_loss: 1.4311, test_f1: 0.6449
 epoch: 69, train_loss: 0.4137, test_loss: 1.4665, test_f1: 0.6349
 epoch: 70, train_loss: 0.4013, test_loss: 1.4708, test_f1: 0.6577
 epoch: 71, train_loss: 0.3855, test_loss: 1.4775, test_f1: 0.6448
 epoch: 72, train_loss: 0.3995, test_loss: 1.4889, test_f1: 0.6489
 epoch: 73, train_loss: 0.3952, test_loss: 1.4515, test_f1: 0.6608
 epoch: 74, train_loss: 0.3959, test_loss: 1.4879, test_f1: 0.6450
 epoch: 75, train_loss: 0.3753, test_loss: 1.4863, test_f1: 0.6356
 epoch: 76, train_loss: 0.3738, test_loss: 1.5151, test_f1: 0.6402
 epoch: 77, train_loss: 0.3762, test_loss: 1.5000, test_f1: 0.6473
 epoch: 78, train_loss: 0.3728, test_loss: 1.5552, test_f1: 0.6437
 epoch: 79, train_loss: 0.3601, test_loss: 1.5212, test_f1: 0.6568
 epoch: 80, train_loss: 0.3762, test_loss: 1.5641, test_f1: 0.6457
 epoch: 81, train_loss: 0.3534, test_loss: 1.5781, test_f1: 0.6481
 epoch: 82, train_loss: 0.3707, test_loss: 1.5688, test_f1: 0.6413
 epoch: 83, train_loss: 0.3513, test_loss: 1.5870, test_f1: 0.6446
 epoch: 84, train_loss: 0.3690, test_loss: 1.6153, test_f1: 0.6644
 epoch: 85, train_loss: 0.3336, test_loss: 1.5949, test_f1: 0.6378
 epoch: 86, train_loss: 0.3749, test_loss: 1.6504, test_f1: 0.6488
 epoch: 87, train_loss: 0.3416, test_loss: 1.6994, test_f1: 0.6373
 epoch: 88, train_loss: 0.3412, test_loss: 1.6545, test_f1: 0.6428
 epoch: 89, train_loss: 0.3412, test_loss: 1.7213, test_f1: 0.6392
 epoch: 90, train_loss: 0.3490, test_loss: 1.6532, test_f1: 0.6479
 epoch: 91, train_loss: 0.3442, test_loss: 1.7404, test_f1: 0.6532
 epoch: 92, train_loss: 0.3554, test_loss: 1.7091, test_f1: 0.6474
 epoch: 93, train_loss: 0.3321, test_loss: 1.7199, test_f1: 0.6488
 epoch: 94, train_loss: 0.3293, test_loss: 1.8010, test_f1: 0.6392
 epoch: 95, train_loss: 0.3341, test_loss: 1.7977, test_f1: 0.6454
 epoch: 96, train_loss: 0.3545, test_loss: 1.7291, test_f1: 0.6453
 epoch: 97, train_loss: 0.3177, test_loss: 1.6884, test_f1: 0.6514
 epoch: 98, train_loss: 0.3173, test_loss: 1.7474, test_f1: 0.6420
 epoch: 99, train_loss: 0.3317, test_loss: 1.7222, test_f1: 0.6418
##################ITERATION #8 ****************************************
 epoch: 0, train_loss: 1.2982, test_loss: 1.2552, test_f1: 0.3122
 epoch: 1, train_loss: 1.1023, test_loss: 1.1114, test_f1: 0.4790
 epoch: 2, train_loss: 1.0226, test_loss: 1.0661, test_f1: 0.4988
 epoch: 3, train_loss: 1.0112, test_loss: 1.0538, test_f1: 0.5099
 epoch: 4, train_loss: 0.9584, test_loss: 1.0349, test_f1: 0.5563
 epoch: 5, train_loss: 0.9332, test_loss: 1.0458, test_f1: 0.5603
 epoch: 6, train_loss: 0.9039, test_loss: 1.0375, test_f1: 0.5757
 epoch: 7, train_loss: 0.8874, test_loss: 1.0458, test_f1: 0.5160
 epoch: 8, train_loss: 0.8732, test_loss: 1.0274, test_f1: 0.5764
 epoch: 9, train_loss: 0.8349, test_loss: 1.0089, test_f1: 0.5543
 epoch: 10, train_loss: 0.8307, test_loss: 0.9844, test_f1: 0.5978
 epoch: 11, train_loss: 0.8122, test_loss: 1.0187, test_f1: 0.5629
 epoch: 12, train_loss: 0.8172, test_loss: 1.0262, test_f1: 0.5795
 epoch: 13, train_loss: 0.7905, test_loss: 0.9776, test_f1: 0.5579
 epoch: 14, train_loss: 0.7862, test_loss: 1.0213, test_f1: 0.5704
 epoch: 15, train_loss: 0.7702, test_loss: 0.9765, test_f1: 0.6082
 epoch: 16, train_loss: 0.7336, test_loss: 1.0051, test_f1: 0.6118
 epoch: 17, train_loss: 0.7408, test_loss: 1.0622, test_f1: 0.5930
 epoch: 18, train_loss: 0.7093, test_loss: 1.0614, test_f1: 0.6119
 epoch: 19, train_loss: 0.7324, test_loss: 1.0434, test_f1: 0.6135
 epoch: 20, train_loss: 0.7346, test_loss: 1.0433, test_f1: 0.6252
 epoch: 21, train_loss: 0.6871, test_loss: 1.0311, test_f1: 0.5910
 epoch: 22, train_loss: 0.6942, test_loss: 1.0337, test_f1: 0.6081
 epoch: 23, train_loss: 0.6801, test_loss: 1.0201, test_f1: 0.5868
 epoch: 24, train_loss: 0.6808, test_loss: 1.0636, test_f1: 0.6100
 epoch: 25, train_loss: 0.6699, test_loss: 1.0370, test_f1: 0.6061
 epoch: 26, train_loss: 0.6494, test_loss: 1.0332, test_f1: 0.6080
 epoch: 27, train_loss: 0.6575, test_loss: 1.0378, test_f1: 0.6173
 epoch: 28, train_loss: 0.6365, test_loss: 1.0213, test_f1: 0.6007
 epoch: 29, train_loss: 0.6219, test_loss: 1.0495, test_f1: 0.6046
 epoch: 30, train_loss: 0.6099, test_loss: 1.0674, test_f1: 0.6185
 epoch: 31, train_loss: 0.6120, test_loss: 1.0687, test_f1: 0.5962
 epoch: 32, train_loss: 0.6062, test_loss: 1.0673, test_f1: 0.6268
 epoch: 33, train_loss: 0.5789, test_loss: 1.1083, test_f1: 0.5958
 epoch: 34, train_loss: 0.6005, test_loss: 1.0927, test_f1: 0.6235
 epoch: 35, train_loss: 0.5749, test_loss: 1.1147, test_f1: 0.6136
 epoch: 36, train_loss: 0.5790, test_loss: 1.1179, test_f1: 0.5992
 epoch: 37, train_loss: 0.5605, test_loss: 1.0866, test_f1: 0.6382
 epoch: 38, train_loss: 0.5557, test_loss: 1.1508, test_f1: 0.5755
 epoch: 39, train_loss: 0.5575, test_loss: 1.1423, test_f1: 0.5830
 epoch: 40, train_loss: 0.5473, test_loss: 1.1451, test_f1: 0.5727
 epoch: 41, train_loss: 0.5466, test_loss: 1.1082, test_f1: 0.6051
 epoch: 42, train_loss: 0.5567, test_loss: 1.1214, test_f1: 0.6292
 epoch: 43, train_loss: 0.5083, test_loss: 1.1738, test_f1: 0.6042
 epoch: 44, train_loss: 0.5146, test_loss: 1.1877, test_f1: 0.6048
 epoch: 45, train_loss: 0.5195, test_loss: 1.1991, test_f1: 0.6235
 epoch: 46, train_loss: 0.5021, test_loss: 1.1624, test_f1: 0.5945
 epoch: 47, train_loss: 0.4961, test_loss: 1.2047, test_f1: 0.6125
 epoch: 48, train_loss: 0.4857, test_loss: 1.2203, test_f1: 0.6018
 epoch: 49, train_loss: 0.4880, test_loss: 1.2408, test_f1: 0.5966
 epoch: 50, train_loss: 0.4958, test_loss: 1.2324, test_f1: 0.6157
 epoch: 51, train_loss: 0.4545, test_loss: 1.2221, test_f1: 0.6126
 epoch: 52, train_loss: 0.4419, test_loss: 1.1904, test_f1: 0.6310
 epoch: 53, train_loss: 0.4360, test_loss: 1.2576, test_f1: 0.6111
 epoch: 54, train_loss: 0.4348, test_loss: 1.3245, test_f1: 0.6069
 epoch: 55, train_loss: 0.4346, test_loss: 1.2762, test_f1: 0.6194
 epoch: 56, train_loss: 0.4432, test_loss: 1.2739, test_f1: 0.6000
 epoch: 57, train_loss: 0.4279, test_loss: 1.3468, test_f1: 0.5961
 epoch: 58, train_loss: 0.4245, test_loss: 1.3182, test_f1: 0.6132
 epoch: 59, train_loss: 0.4231, test_loss: 1.2814, test_f1: 0.6188
 epoch: 60, train_loss: 0.4341, test_loss: 1.3310, test_f1: 0.5898
 epoch: 61, train_loss: 0.4306, test_loss: 1.2990, test_f1: 0.6189
 epoch: 62, train_loss: 0.4071, test_loss: 1.3282, test_f1: 0.6189
 epoch: 63, train_loss: 0.4026, test_loss: 1.3610, test_f1: 0.5965
 epoch: 64, train_loss: 0.4017, test_loss: 1.3637, test_f1: 0.5977
 epoch: 65, train_loss: 0.4013, test_loss: 1.3545, test_f1: 0.6309
 epoch: 66, train_loss: 0.3864, test_loss: 1.3982, test_f1: 0.6205
 epoch: 67, train_loss: 0.4042, test_loss: 1.3880, test_f1: 0.6043
 epoch: 68, train_loss: 0.3963, test_loss: 1.3820, test_f1: 0.6192
 epoch: 69, train_loss: 0.3831, test_loss: 1.3131, test_f1: 0.6318
 epoch: 70, train_loss: 0.3885, test_loss: 1.4652, test_f1: 0.6083
 epoch: 71, train_loss: 0.3615, test_loss: 1.3899, test_f1: 0.6315
 epoch: 72, train_loss: 0.3877, test_loss: 1.4287, test_f1: 0.6125
 epoch: 73, train_loss: 0.3660, test_loss: 1.4322, test_f1: 0.6382
 epoch: 74, train_loss: 0.3824, test_loss: 1.4299, test_f1: 0.6142
 epoch: 75, train_loss: 0.3883, test_loss: 1.4591, test_f1: 0.6269
 epoch: 76, train_loss: 0.3677, test_loss: 1.4276, test_f1: 0.6216
 epoch: 77, train_loss: 0.3542, test_loss: 1.4326, test_f1: 0.6158
 epoch: 78, train_loss: 0.3833, test_loss: 1.5034, test_f1: 0.6018
 epoch: 79, train_loss: 0.3504, test_loss: 1.4681, test_f1: 0.6354
 epoch: 80, train_loss: 0.3405, test_loss: 1.4523, test_f1: 0.6603
 epoch: 81, train_loss: 0.3292, test_loss: 1.5412, test_f1: 0.6054
 epoch: 82, train_loss: 0.3482, test_loss: 1.5594, test_f1: 0.5943
 epoch: 83, train_loss: 0.3345, test_loss: 1.4976, test_f1: 0.6245
 epoch: 84, train_loss: 0.3705, test_loss: 1.4838, test_f1: 0.6319
 epoch: 85, train_loss: 0.3454, test_loss: 1.4696, test_f1: 0.6373
 epoch: 86, train_loss: 0.3306, test_loss: 1.5521, test_f1: 0.6193
 epoch: 87, train_loss: 0.3369, test_loss: 1.4656, test_f1: 0.6625
 epoch: 88, train_loss: 0.3353, test_loss: 1.5710, test_f1: 0.6213
 epoch: 89, train_loss: 0.3415, test_loss: 1.5151, test_f1: 0.6432
 epoch: 90, train_loss: 0.3325, test_loss: 1.5398, test_f1: 0.6270
 epoch: 91, train_loss: 0.3309, test_loss: 1.5796, test_f1: 0.6335
 epoch: 92, train_loss: 0.3505, test_loss: 1.6628, test_f1: 0.5985
 epoch: 93, train_loss: 0.3269, test_loss: 1.6250, test_f1: 0.6164
 epoch: 94, train_loss: 0.3282, test_loss: 1.6723, test_f1: 0.6192
 epoch: 95, train_loss: 0.3208, test_loss: 1.5712, test_f1: 0.6239
 epoch: 96, train_loss: 0.2869, test_loss: 1.6090, test_f1: 0.6325
 epoch: 97, train_loss: 0.3299, test_loss: 1.6230, test_f1: 0.6261
 epoch: 98, train_loss: 0.2963, test_loss: 1.6289, test_f1: 0.6299
 epoch: 99, train_loss: 0.3089, test_loss: 1.6392, test_f1: 0.6046
##################ITERATION #9 ****************************************
 epoch: 0, train_loss: 1.2554, test_loss: 1.2493, test_f1: 0.3588
 epoch: 1, train_loss: 1.0412, test_loss: 1.1020, test_f1: 0.5418
 epoch: 2, train_loss: 0.9819, test_loss: 1.0342, test_f1: 0.5626
 epoch: 3, train_loss: 0.9422, test_loss: 1.0185, test_f1: 0.5575
 epoch: 4, train_loss: 0.9245, test_loss: 1.0194, test_f1: 0.5782
 epoch: 5, train_loss: 0.9007, test_loss: 0.9923, test_f1: 0.5952
 epoch: 6, train_loss: 0.8889, test_loss: 0.9960, test_f1: 0.5755
 epoch: 7, train_loss: 0.8574, test_loss: 1.0206, test_f1: 0.5655
 epoch: 8, train_loss: 0.8380, test_loss: 0.9897, test_f1: 0.5894
 epoch: 9, train_loss: 0.8311, test_loss: 0.9905, test_f1: 0.5874
 epoch: 10, train_loss: 0.7961, test_loss: 0.9850, test_f1: 0.5743
 epoch: 11, train_loss: 0.7954, test_loss: 0.9684, test_f1: 0.5908
 epoch: 12, train_loss: 0.7534, test_loss: 0.9824, test_f1: 0.5929
 epoch: 13, train_loss: 0.7577, test_loss: 0.9924, test_f1: 0.6135
 epoch: 14, train_loss: 0.7564, test_loss: 0.9783, test_f1: 0.5925
 epoch: 15, train_loss: 0.7348, test_loss: 0.9955, test_f1: 0.5790
 epoch: 16, train_loss: 0.7155, test_loss: 0.9913, test_f1: 0.5994
 epoch: 17, train_loss: 0.7179, test_loss: 0.9877, test_f1: 0.6053
 epoch: 18, train_loss: 0.6782, test_loss: 0.9611, test_f1: 0.6098
 epoch: 19, train_loss: 0.6839, test_loss: 0.9838, test_f1: 0.6357
 epoch: 20, train_loss: 0.6705, test_loss: 0.9869, test_f1: 0.6158
 epoch: 21, train_loss: 0.6330, test_loss: 1.0067, test_f1: 0.6214
 epoch: 22, train_loss: 0.6419, test_loss: 0.9698, test_f1: 0.6133
 epoch: 23, train_loss: 0.6219, test_loss: 0.9912, test_f1: 0.6298
 epoch: 24, train_loss: 0.6325, test_loss: 1.0143, test_f1: 0.6388
 epoch: 25, train_loss: 0.6308, test_loss: 1.0288, test_f1: 0.6078
 epoch: 26, train_loss: 0.5938, test_loss: 0.9819, test_f1: 0.6283
 epoch: 27, train_loss: 0.6025, test_loss: 1.0363, test_f1: 0.6137
 epoch: 28, train_loss: 0.5895, test_loss: 1.0446, test_f1: 0.6181
 epoch: 29, train_loss: 0.5903, test_loss: 0.9852, test_f1: 0.6377
 epoch: 30, train_loss: 0.5674, test_loss: 1.0246, test_f1: 0.6143
 epoch: 31, train_loss: 0.5698, test_loss: 1.0181, test_f1: 0.6352
 epoch: 32, train_loss: 0.5629, test_loss: 1.0612, test_f1: 0.6069
 epoch: 33, train_loss: 0.5643, test_loss: 1.0932, test_f1: 0.6131
 epoch: 34, train_loss: 0.5532, test_loss: 1.1607, test_f1: 0.6009
 epoch: 35, train_loss: 0.5507, test_loss: 1.0336, test_f1: 0.6233
 epoch: 36, train_loss: 0.5346, test_loss: 1.1084, test_f1: 0.6017
 epoch: 37, train_loss: 0.5173, test_loss: 1.0632, test_f1: 0.6150
 epoch: 38, train_loss: 0.4976, test_loss: 1.1849, test_f1: 0.6166
 epoch: 39, train_loss: 0.5043, test_loss: 1.1552, test_f1: 0.6284
 epoch: 40, train_loss: 0.5043, test_loss: 1.1360, test_f1: 0.6204
 epoch: 41, train_loss: 0.4979, test_loss: 1.1653, test_f1: 0.6006
 epoch: 42, train_loss: 0.4836, test_loss: 1.2315, test_f1: 0.6218
 epoch: 43, train_loss: 0.4829, test_loss: 1.1379, test_f1: 0.6348
 epoch: 44, train_loss: 0.4929, test_loss: 1.1686, test_f1: 0.6459
 epoch: 45, train_loss: 0.4689, test_loss: 1.1506, test_f1: 0.5962
 epoch: 46, train_loss: 0.4443, test_loss: 1.1665, test_f1: 0.5948
 epoch: 47, train_loss: 0.4697, test_loss: 1.2160, test_f1: 0.5660
 epoch: 48, train_loss: 0.4525, test_loss: 1.3270, test_f1: 0.5838
 epoch: 49, train_loss: 0.4547, test_loss: 1.1813, test_f1: 0.6176
 epoch: 50, train_loss: 0.4286, test_loss: 1.2735, test_f1: 0.6041
 epoch: 51, train_loss: 0.4087, test_loss: 1.2202, test_f1: 0.6309
 epoch: 52, train_loss: 0.4410, test_loss: 1.2443, test_f1: 0.6204
 epoch: 53, train_loss: 0.3996, test_loss: 1.2118, test_f1: 0.6190
 epoch: 54, train_loss: 0.4091, test_loss: 1.2435, test_f1: 0.6066
 epoch: 55, train_loss: 0.3892, test_loss: 1.2265, test_f1: 0.6369
 epoch: 56, train_loss: 0.3945, test_loss: 1.2721, test_f1: 0.6325
 epoch: 57, train_loss: 0.3968, test_loss: 1.2874, test_f1: 0.6127
 epoch: 58, train_loss: 0.3826, test_loss: 1.3350, test_f1: 0.6207
 epoch: 59, train_loss: 0.3877, test_loss: 1.2913, test_f1: 0.6090
 epoch: 60, train_loss: 0.3823, test_loss: 1.3054, test_f1: 0.6264
 epoch: 61, train_loss: 0.3770, test_loss: 1.3636, test_f1: 0.6360
 epoch: 62, train_loss: 0.3759, test_loss: 1.3080, test_f1: 0.6000
 epoch: 63, train_loss: 0.3690, test_loss: 1.3466, test_f1: 0.6313
 epoch: 64, train_loss: 0.3565, test_loss: 1.3118, test_f1: 0.6273
 epoch: 65, train_loss: 0.3673, test_loss: 1.4311, test_f1: 0.6186
 epoch: 66, train_loss: 0.3587, test_loss: 1.3858, test_f1: 0.6242
 epoch: 67, train_loss: 0.3473, test_loss: 1.4811, test_f1: 0.5734
 epoch: 68, train_loss: 0.3683, test_loss: 1.3217, test_f1: 0.6347
 epoch: 69, train_loss: 0.3341, test_loss: 1.4545, test_f1: 0.6334
 epoch: 70, train_loss: 0.3690, test_loss: 1.3828, test_f1: 0.6229
 epoch: 71, train_loss: 0.3436, test_loss: 1.4314, test_f1: 0.6201
 epoch: 72, train_loss: 0.3419, test_loss: 1.3592, test_f1: 0.6328
 epoch: 73, train_loss: 0.3450, test_loss: 1.3243, test_f1: 0.6452
 epoch: 74, train_loss: 0.3268, test_loss: 1.3933, test_f1: 0.6005
 epoch: 75, train_loss: 0.3424, test_loss: 1.4282, test_f1: 0.6147
 epoch: 76, train_loss: 0.3369, test_loss: 1.4825, test_f1: 0.5965
 epoch: 77, train_loss: 0.3198, test_loss: 1.4362, test_f1: 0.5972
 epoch: 78, train_loss: 0.3247, test_loss: 1.4647, test_f1: 0.6037
 epoch: 79, train_loss: 0.3205, test_loss: 1.5344, test_f1: 0.6143
 epoch: 80, train_loss: 0.3104, test_loss: 1.5053, test_f1: 0.6281
 epoch: 81, train_loss: 0.3052, test_loss: 1.5045, test_f1: 0.6030
 epoch: 82, train_loss: 0.3080, test_loss: 1.4591, test_f1: 0.6505
 epoch: 83, train_loss: 0.3101, test_loss: 1.4628, test_f1: 0.6363
 epoch: 84, train_loss: 0.3146, test_loss: 1.5762, test_f1: 0.5980
 epoch: 85, train_loss: 0.3033, test_loss: 1.5938, test_f1: 0.5889
 epoch: 86, train_loss: 0.3248, test_loss: 1.4611, test_f1: 0.6217
 epoch: 87, train_loss: 0.3023, test_loss: 1.6186, test_f1: 0.5992
 epoch: 88, train_loss: 0.2903, test_loss: 1.5574, test_f1: 0.6415
 epoch: 89, train_loss: 0.2887, test_loss: 1.5249, test_f1: 0.6259
 epoch: 90, train_loss: 0.2976, test_loss: 1.6102, test_f1: 0.5864
 epoch: 91, train_loss: 0.2929, test_loss: 1.5642, test_f1: 0.6385
 epoch: 92, train_loss: 0.2734, test_loss: 1.6116, test_f1: 0.6175
 epoch: 93, train_loss: 0.3043, test_loss: 1.5760, test_f1: 0.6225
 epoch: 94, train_loss: 0.2834, test_loss: 1.6205, test_f1: 0.6025
 epoch: 95, train_loss: 0.2809, test_loss: 1.6123, test_f1: 0.6121
 epoch: 96, train_loss: 0.2806, test_loss: 1.6281, test_f1: 0.5888
 epoch: 97, train_loss: 0.2849, test_loss: 1.7013, test_f1: 0.5767
 epoch: 98, train_loss: 0.2771, test_loss: 1.5796, test_f1: 0.6061
 epoch: 99, train_loss: 0.2666, test_loss: 1.6095, test_f1: 0.5978

Training completed in 512.54 seconds
Best F1: 0.6792 at epoch 37
Mean F1 across iterations: 0.6509  0.0219
========================FINAL RESULTS================================
FEGIN weighted F1: 0.6792  0.0219
python main.py --data ltspice_demos --representation component_pin --model FEGIN --layers 2 --hiddens 128 --batch_size 32 --lr 0.0001 --emb_size 128 --epochs 100 --save_appendix component_pin_L2_H128_BS32_LR0.0001_E128 --no_val
-----



STDERR:
  File "main.py", line 370, in <module>
    main()
  File "main.py", line 254, in main
    dataset = dataset_class(
  File "/home/philip/projects/ltspice_examples_code_repo/Circuit-Completion-Using-GNNs/component_classification_with_link_prediction_head/evaluation/FEGIN/kernel/circuit_datasets.py", line 15, in __init__
    self.data, self.slices = torch.load(self.processed_paths[0])
  File "/home/philip/.local/lib/python3.8/site-packages/torch/serialization.py", line 1040, in load
    warnings.warn(
  File "/usr/lib/python3.8/warnings.py", line 109, in _showwarnmsg
    sw(msg.message, msg.category, msg.filename, msg.lineno,
  File "main.py", line 47, in warn_with_traceback
    traceback.print_stack(file=log)
/home/philip/projects/ltspice_examples_code_repo/Circuit-Completion-Using-GNNs/component_classification_with_link_prediction_head/evaluation/FEGIN/kernel/circuit_datasets.py:15: FutureWarning: You are using `torch.load` with `weights_only=False` (the current default value), which uses the default pickle module implicitly. It is possible to construct malicious pickle data which will execute arbitrary code during unpickling (See https://github.com/pytorch/pytorch/blob/main/SECURITY.md#untrusted-models for more details). In a future release, the default value for `weights_only` will be flipped to `True`. This limits the functions that could be executed during unpickling. Arbitrary objects will no longer be allowed to be loaded via this mode unless they are explicitly allowlisted by the user via `torch.serialization.add_safe_globals`. We recommend you start setting `weights_only=True` for any use case where you don't have full control of the loaded file. Please open an issue on GitHub for any issues related to this experimental feature.
  self.data, self.slices = torch.load(self.processed_paths[0])
