STDOUT:
Results will be saved in /home/philip/projects/ltspice_examples_code_repo/Circuit-Completion-Using-GNNs/component_classification_with_link_prediction_head/evaluation/FEGIN/results/model_FEGIN_dataset_ltspice_demos
Command line input: python main.py --data ltspice_demos --representation component_net --model FEGIN --layers 2 --hiddens 128 --batch_size 64 --lr 0.0001 --emb_size 128 --epochs 100 --save_appendix component_net_L2_H128_BS64_LR0.0001_E128 --no_val
 is saved.
-----
ltspice_demos - FEGIN
Using 2 layers, 128 hidden units, h = 2
Loading component_net representation dataset
ENTERED
Training FEGIN on component_net representation
Train: 1565, Test: 383
##################ITERATION #0 ****************************************
 epoch: 0, train_loss: 1.3674, test_loss: 1.3694, test_f1: 0.2281
 epoch: 1, train_loss: 1.3356, test_loss: 1.3531, test_f1: 0.2281
 epoch: 2, train_loss: 1.3089, test_loss: 1.3230, test_f1: 0.2281
 epoch: 3, train_loss: 1.2753, test_loss: 1.2916, test_f1: 0.2281
 epoch: 4, train_loss: 1.2339, test_loss: 1.2669, test_f1: 0.2721
 epoch: 5, train_loss: 1.1982, test_loss: 1.2455, test_f1: 0.2775
 epoch: 6, train_loss: 1.1759, test_loss: 1.2330, test_f1: 0.2833
 epoch: 7, train_loss: 1.1481, test_loss: 1.2209, test_f1: 0.2885
 epoch: 8, train_loss: 1.1300, test_loss: 1.2133, test_f1: 0.3179
 epoch: 9, train_loss: 1.1158, test_loss: 1.1977, test_f1: 0.3778
 epoch: 10, train_loss: 1.0988, test_loss: 1.1936, test_f1: 0.4085
 epoch: 11, train_loss: 1.0762, test_loss: 1.1792, test_f1: 0.4095
 epoch: 12, train_loss: 1.0595, test_loss: 1.1700, test_f1: 0.4049
 epoch: 13, train_loss: 1.0402, test_loss: 1.1514, test_f1: 0.4025
 epoch: 14, train_loss: 1.0285, test_loss: 1.1488, test_f1: 0.4170
 epoch: 15, train_loss: 1.0151, test_loss: 1.1275, test_f1: 0.4142
 epoch: 16, train_loss: 1.0022, test_loss: 1.1276, test_f1: 0.4245
 epoch: 17, train_loss: 0.9860, test_loss: 1.1100, test_f1: 0.4483
 epoch: 18, train_loss: 0.9731, test_loss: 1.0922, test_f1: 0.4506
 epoch: 19, train_loss: 0.9633, test_loss: 1.0955, test_f1: 0.4736
 epoch: 20, train_loss: 0.9539, test_loss: 1.0908, test_f1: 0.4711
 epoch: 21, train_loss: 0.9388, test_loss: 1.0732, test_f1: 0.5055
 epoch: 22, train_loss: 0.9331, test_loss: 1.0856, test_f1: 0.4923
 epoch: 23, train_loss: 0.9158, test_loss: 1.0728, test_f1: 0.5028
 epoch: 24, train_loss: 0.9136, test_loss: 1.0923, test_f1: 0.5022
 epoch: 25, train_loss: 0.8978, test_loss: 1.0721, test_f1: 0.5070
 epoch: 26, train_loss: 0.9014, test_loss: 1.0574, test_f1: 0.5078
 epoch: 27, train_loss: 0.8905, test_loss: 1.0609, test_f1: 0.5161
 epoch: 28, train_loss: 0.8803, test_loss: 1.0608, test_f1: 0.5393
 epoch: 29, train_loss: 0.8734, test_loss: 1.0386, test_f1: 0.5422
 epoch: 30, train_loss: 0.8679, test_loss: 1.0320, test_f1: 0.5557
 epoch: 31, train_loss: 0.8612, test_loss: 1.0571, test_f1: 0.5457
 epoch: 32, train_loss: 0.8559, test_loss: 1.0278, test_f1: 0.5670
 epoch: 33, train_loss: 0.8462, test_loss: 1.0203, test_f1: 0.5498
 epoch: 34, train_loss: 0.8399, test_loss: 1.0038, test_f1: 0.5837
 epoch: 35, train_loss: 0.8349, test_loss: 1.0427, test_f1: 0.5766
 epoch: 36, train_loss: 0.8309, test_loss: 1.0331, test_f1: 0.5901
 epoch: 37, train_loss: 0.8237, test_loss: 1.0463, test_f1: 0.5666
 epoch: 38, train_loss: 0.8267, test_loss: 1.0740, test_f1: 0.5556
 epoch: 39, train_loss: 0.8098, test_loss: 1.0188, test_f1: 0.5746
 epoch: 40, train_loss: 0.8092, test_loss: 1.0470, test_f1: 0.5640
 epoch: 41, train_loss: 0.7970, test_loss: 1.0471, test_f1: 0.5701
 epoch: 42, train_loss: 0.7976, test_loss: 1.0436, test_f1: 0.5555
 epoch: 43, train_loss: 0.7908, test_loss: 1.0403, test_f1: 0.5801
 epoch: 44, train_loss: 0.7792, test_loss: 1.0729, test_f1: 0.5490
 epoch: 45, train_loss: 0.7799, test_loss: 1.0200, test_f1: 0.5988
 epoch: 46, train_loss: 0.7757, test_loss: 1.0505, test_f1: 0.5507
 epoch: 47, train_loss: 0.7617, test_loss: 1.0560, test_f1: 0.5858
 epoch: 48, train_loss: 0.7587, test_loss: 1.0511, test_f1: 0.5609
 epoch: 49, train_loss: 0.7500, test_loss: 1.0263, test_f1: 0.5605
 epoch: 50, train_loss: 0.7545, test_loss: 0.9992, test_f1: 0.5648
 epoch: 51, train_loss: 0.7335, test_loss: 1.0248, test_f1: 0.5903
 epoch: 52, train_loss: 0.7294, test_loss: 1.0141, test_f1: 0.6015
 epoch: 53, train_loss: 0.7320, test_loss: 1.0151, test_f1: 0.5906
 epoch: 54, train_loss: 0.7199, test_loss: 1.0263, test_f1: 0.5938
 epoch: 55, train_loss: 0.7214, test_loss: 1.0237, test_f1: 0.5739
 epoch: 56, train_loss: 0.7156, test_loss: 1.0234, test_f1: 0.5742
 epoch: 57, train_loss: 0.7154, test_loss: 1.0339, test_f1: 0.6030
 epoch: 58, train_loss: 0.7162, test_loss: 1.0401, test_f1: 0.5936
 epoch: 59, train_loss: 0.7130, test_loss: 1.0351, test_f1: 0.5744
 epoch: 60, train_loss: 0.7168, test_loss: 1.0075, test_f1: 0.5858
 epoch: 61, train_loss: 0.7065, test_loss: 1.0512, test_f1: 0.5651
 epoch: 62, train_loss: 0.7050, test_loss: 1.0323, test_f1: 0.5748
 epoch: 63, train_loss: 0.7052, test_loss: 1.0272, test_f1: 0.5929
 epoch: 64, train_loss: 0.7066, test_loss: 1.0235, test_f1: 0.5880
 epoch: 65, train_loss: 0.6994, test_loss: 1.0647, test_f1: 0.5855
 epoch: 66, train_loss: 0.6949, test_loss: 1.0229, test_f1: 0.5875
 epoch: 67, train_loss: 0.6988, test_loss: 1.0353, test_f1: 0.5808
 epoch: 68, train_loss: 0.6771, test_loss: 1.0348, test_f1: 0.6088
 epoch: 69, train_loss: 0.6751, test_loss: 1.0242, test_f1: 0.5902
 epoch: 70, train_loss: 0.6857, test_loss: 1.0269, test_f1: 0.5798
 epoch: 71, train_loss: 0.6855, test_loss: 1.0425, test_f1: 0.5981
 epoch: 72, train_loss: 0.6758, test_loss: 1.0368, test_f1: 0.6020
 epoch: 73, train_loss: 0.6768, test_loss: 1.0333, test_f1: 0.5782
 epoch: 74, train_loss: 0.6640, test_loss: 1.0773, test_f1: 0.5979
 epoch: 75, train_loss: 0.6554, test_loss: 1.0410, test_f1: 0.5871
 epoch: 76, train_loss: 0.6619, test_loss: 1.0538, test_f1: 0.6111
 epoch: 77, train_loss: 0.6664, test_loss: 1.0300, test_f1: 0.5790
 epoch: 78, train_loss: 0.6640, test_loss: 1.0317, test_f1: 0.5921
 epoch: 79, train_loss: 0.6567, test_loss: 1.0561, test_f1: 0.5898
 epoch: 80, train_loss: 0.6469, test_loss: 1.0379, test_f1: 0.5834
 epoch: 81, train_loss: 0.6422, test_loss: 1.0416, test_f1: 0.5859
 epoch: 82, train_loss: 0.6482, test_loss: 1.0473, test_f1: 0.5900
 epoch: 83, train_loss: 0.6474, test_loss: 1.0715, test_f1: 0.5993
 epoch: 84, train_loss: 0.6491, test_loss: 1.0313, test_f1: 0.5995
 epoch: 85, train_loss: 0.6468, test_loss: 1.0275, test_f1: 0.6200
 epoch: 86, train_loss: 0.6321, test_loss: 1.0337, test_f1: 0.5917
 epoch: 87, train_loss: 0.6455, test_loss: 1.0464, test_f1: 0.5989
 epoch: 88, train_loss: 0.6354, test_loss: 1.0588, test_f1: 0.6162
 epoch: 89, train_loss: 0.6309, test_loss: 1.0351, test_f1: 0.6042
 epoch: 90, train_loss: 0.6225, test_loss: 1.0949, test_f1: 0.5959
 epoch: 91, train_loss: 0.6290, test_loss: 1.0513, test_f1: 0.6193
 epoch: 92, train_loss: 0.6222, test_loss: 1.0611, test_f1: 0.5977
 epoch: 93, train_loss: 0.6221, test_loss: 1.0546, test_f1: 0.6072
 epoch: 94, train_loss: 0.6130, test_loss: 1.0705, test_f1: 0.6106
 epoch: 95, train_loss: 0.6248, test_loss: 1.0572, test_f1: 0.6127
 epoch: 96, train_loss: 0.6280, test_loss: 1.0784, test_f1: 0.6223
 epoch: 97, train_loss: 0.6096, test_loss: 1.0926, test_f1: 0.6047
 epoch: 98, train_loss: 0.6137, test_loss: 1.0383, test_f1: 0.6258
 epoch: 99, train_loss: 0.6024, test_loss: 1.0992, test_f1: 0.6093
##################ITERATION #1 ****************************************
 epoch: 0, train_loss: 1.2842, test_loss: 1.3221, test_f1: 0.1796
 epoch: 1, train_loss: 1.1888, test_loss: 1.2726, test_f1: 0.3302
 epoch: 2, train_loss: 1.1492, test_loss: 1.2238, test_f1: 0.3527
 epoch: 3, train_loss: 1.1241, test_loss: 1.1899, test_f1: 0.3894
 epoch: 4, train_loss: 1.0932, test_loss: 1.1673, test_f1: 0.4070
 epoch: 5, train_loss: 1.0665, test_loss: 1.1455, test_f1: 0.4301
 epoch: 6, train_loss: 1.0505, test_loss: 1.1269, test_f1: 0.4651
 epoch: 7, train_loss: 1.0239, test_loss: 1.1117, test_f1: 0.4743
 epoch: 8, train_loss: 0.9994, test_loss: 1.0942, test_f1: 0.4861
 epoch: 9, train_loss: 0.9807, test_loss: 1.0803, test_f1: 0.4868
 epoch: 10, train_loss: 0.9695, test_loss: 1.0763, test_f1: 0.4914
 epoch: 11, train_loss: 0.9613, test_loss: 1.0673, test_f1: 0.4951
 epoch: 12, train_loss: 0.9433, test_loss: 1.0524, test_f1: 0.5023
 epoch: 13, train_loss: 0.9355, test_loss: 1.0520, test_f1: 0.5005
 epoch: 14, train_loss: 0.9232, test_loss: 1.0444, test_f1: 0.5042
 epoch: 15, train_loss: 0.9156, test_loss: 1.0353, test_f1: 0.5127
 epoch: 16, train_loss: 0.8970, test_loss: 1.0468, test_f1: 0.5124
 epoch: 17, train_loss: 0.8908, test_loss: 1.0651, test_f1: 0.5108
 epoch: 18, train_loss: 0.8982, test_loss: 1.0645, test_f1: 0.5288
 epoch: 19, train_loss: 0.8843, test_loss: 1.0571, test_f1: 0.5296
 epoch: 20, train_loss: 0.8731, test_loss: 1.0559, test_f1: 0.5272
 epoch: 21, train_loss: 0.8647, test_loss: 1.0406, test_f1: 0.5367
 epoch: 22, train_loss: 0.8535, test_loss: 1.0605, test_f1: 0.5296
 epoch: 23, train_loss: 0.8663, test_loss: 1.0495, test_f1: 0.5438
 epoch: 24, train_loss: 0.8429, test_loss: 1.0664, test_f1: 0.5474
 epoch: 25, train_loss: 0.8491, test_loss: 1.0542, test_f1: 0.5609
 epoch: 26, train_loss: 0.8356, test_loss: 1.0577, test_f1: 0.5696
 epoch: 27, train_loss: 0.8314, test_loss: 1.0514, test_f1: 0.5711
 epoch: 28, train_loss: 0.8213, test_loss: 1.0561, test_f1: 0.5689
 epoch: 29, train_loss: 0.8083, test_loss: 1.0517, test_f1: 0.5665
 epoch: 30, train_loss: 0.8148, test_loss: 1.0476, test_f1: 0.5727
 epoch: 31, train_loss: 0.8159, test_loss: 1.0852, test_f1: 0.5581
 epoch: 32, train_loss: 0.8064, test_loss: 1.0601, test_f1: 0.5736
 epoch: 33, train_loss: 0.7989, test_loss: 1.0486, test_f1: 0.5686
 epoch: 34, train_loss: 0.7966, test_loss: 1.0561, test_f1: 0.5848
 epoch: 35, train_loss: 0.7880, test_loss: 1.0627, test_f1: 0.5731
 epoch: 36, train_loss: 0.7796, test_loss: 1.0773, test_f1: 0.5698
 epoch: 37, train_loss: 0.7807, test_loss: 1.0406, test_f1: 0.5722
 epoch: 38, train_loss: 0.7768, test_loss: 1.0685, test_f1: 0.5941
 epoch: 39, train_loss: 0.7628, test_loss: 1.0413, test_f1: 0.5800
 epoch: 40, train_loss: 0.7543, test_loss: 1.0721, test_f1: 0.5698
 epoch: 41, train_loss: 0.7489, test_loss: 1.0799, test_f1: 0.5776
 epoch: 42, train_loss: 0.7476, test_loss: 1.0850, test_f1: 0.5726
 epoch: 43, train_loss: 0.7460, test_loss: 1.0626, test_f1: 0.5786
 epoch: 44, train_loss: 0.7438, test_loss: 1.0739, test_f1: 0.5666
 epoch: 45, train_loss: 0.7377, test_loss: 1.0966, test_f1: 0.5753
 epoch: 46, train_loss: 0.7321, test_loss: 1.0730, test_f1: 0.5662
 epoch: 47, train_loss: 0.7223, test_loss: 1.1156, test_f1: 0.5901
 epoch: 48, train_loss: 0.7075, test_loss: 1.0902, test_f1: 0.5863
 epoch: 49, train_loss: 0.7150, test_loss: 1.0672, test_f1: 0.5745
 epoch: 50, train_loss: 0.7221, test_loss: 1.1068, test_f1: 0.5687
 epoch: 51, train_loss: 0.6965, test_loss: 1.0847, test_f1: 0.5881
 epoch: 52, train_loss: 0.6946, test_loss: 1.1060, test_f1: 0.5876
 epoch: 53, train_loss: 0.6876, test_loss: 1.0974, test_f1: 0.5894
 epoch: 54, train_loss: 0.6934, test_loss: 1.0897, test_f1: 0.5829
 epoch: 55, train_loss: 0.6812, test_loss: 1.0808, test_f1: 0.5837
 epoch: 56, train_loss: 0.6688, test_loss: 1.1042, test_f1: 0.5952
 epoch: 57, train_loss: 0.6844, test_loss: 1.1262, test_f1: 0.5757
 epoch: 58, train_loss: 0.6765, test_loss: 1.1047, test_f1: 0.5831
 epoch: 59, train_loss: 0.6799, test_loss: 1.1265, test_f1: 0.5686
 epoch: 60, train_loss: 0.6668, test_loss: 1.1343, test_f1: 0.5675
 epoch: 61, train_loss: 0.6745, test_loss: 1.1337, test_f1: 0.5846
 epoch: 62, train_loss: 0.6634, test_loss: 1.1264, test_f1: 0.5826
 epoch: 63, train_loss: 0.6517, test_loss: 1.1348, test_f1: 0.5870
 epoch: 64, train_loss: 0.6512, test_loss: 1.1311, test_f1: 0.5925
 epoch: 65, train_loss: 0.6528, test_loss: 1.1390, test_f1: 0.5956
 epoch: 66, train_loss: 0.6532, test_loss: 1.1692, test_f1: 0.5844
 epoch: 67, train_loss: 0.6485, test_loss: 1.1381, test_f1: 0.5796
 epoch: 68, train_loss: 0.6519, test_loss: 1.1294, test_f1: 0.5883
 epoch: 69, train_loss: 0.6468, test_loss: 1.1720, test_f1: 0.5937
 epoch: 70, train_loss: 0.6450, test_loss: 1.1640, test_f1: 0.5890
 epoch: 71, train_loss: 0.6447, test_loss: 1.1630, test_f1: 0.5841
 epoch: 72, train_loss: 0.6381, test_loss: 1.1913, test_f1: 0.5842
 epoch: 73, train_loss: 0.6383, test_loss: 1.1919, test_f1: 0.5832
 epoch: 74, train_loss: 0.6289, test_loss: 1.1691, test_f1: 0.5933
 epoch: 75, train_loss: 0.6341, test_loss: 1.1811, test_f1: 0.5964
 epoch: 76, train_loss: 0.6265, test_loss: 1.1740, test_f1: 0.5987
 epoch: 77, train_loss: 0.6262, test_loss: 1.1763, test_f1: 0.5841
 epoch: 78, train_loss: 0.6249, test_loss: 1.1861, test_f1: 0.5988
 epoch: 79, train_loss: 0.6197, test_loss: 1.2168, test_f1: 0.5939
 epoch: 80, train_loss: 0.6147, test_loss: 1.1961, test_f1: 0.5965
 epoch: 81, train_loss: 0.6104, test_loss: 1.2344, test_f1: 0.6034
 epoch: 82, train_loss: 0.6161, test_loss: 1.1983, test_f1: 0.5964
 epoch: 83, train_loss: 0.5937, test_loss: 1.1586, test_f1: 0.6083
 epoch: 84, train_loss: 0.6125, test_loss: 1.2277, test_f1: 0.5788
 epoch: 85, train_loss: 0.6065, test_loss: 1.1983, test_f1: 0.5937
 epoch: 86, train_loss: 0.6104, test_loss: 1.2385, test_f1: 0.5918
 epoch: 87, train_loss: 0.6020, test_loss: 1.2242, test_f1: 0.5994
 epoch: 88, train_loss: 0.5960, test_loss: 1.2411, test_f1: 0.5967
 epoch: 89, train_loss: 0.5866, test_loss: 1.2320, test_f1: 0.5933
 epoch: 90, train_loss: 0.5882, test_loss: 1.2346, test_f1: 0.5870
 epoch: 91, train_loss: 0.5894, test_loss: 1.2468, test_f1: 0.5850
 epoch: 92, train_loss: 0.5826, test_loss: 1.2467, test_f1: 0.5936
 epoch: 93, train_loss: 0.5750, test_loss: 1.2701, test_f1: 0.5993
 epoch: 94, train_loss: 0.5683, test_loss: 1.2947, test_f1: 0.6013
 epoch: 95, train_loss: 0.5693, test_loss: 1.2875, test_f1: 0.5776
 epoch: 96, train_loss: 0.5842, test_loss: 1.2677, test_f1: 0.5950
 epoch: 97, train_loss: 0.5617, test_loss: 1.2847, test_f1: 0.6082
 epoch: 98, train_loss: 0.5661, test_loss: 1.2854, test_f1: 0.6033
 epoch: 99, train_loss: 0.5841, test_loss: 1.2581, test_f1: 0.6112
##################ITERATION #2 ****************************************
 epoch: 0, train_loss: 1.2457, test_loss: 1.2929, test_f1: 0.2583
 epoch: 1, train_loss: 1.1653, test_loss: 1.2484, test_f1: 0.3559
 epoch: 2, train_loss: 1.1290, test_loss: 1.2008, test_f1: 0.4052
 epoch: 3, train_loss: 1.0942, test_loss: 1.1706, test_f1: 0.3902
 epoch: 4, train_loss: 1.0716, test_loss: 1.1386, test_f1: 0.4344
 epoch: 5, train_loss: 1.0445, test_loss: 1.1212, test_f1: 0.4514
 epoch: 6, train_loss: 1.0191, test_loss: 1.1103, test_f1: 0.4552
 epoch: 7, train_loss: 1.0068, test_loss: 1.0932, test_f1: 0.4658
 epoch: 8, train_loss: 0.9890, test_loss: 1.0838, test_f1: 0.4720
 epoch: 9, train_loss: 0.9767, test_loss: 1.0778, test_f1: 0.4886
 epoch: 10, train_loss: 0.9632, test_loss: 1.0720, test_f1: 0.4987
 epoch: 11, train_loss: 0.9513, test_loss: 1.0645, test_f1: 0.5086
 epoch: 12, train_loss: 0.9337, test_loss: 1.0605, test_f1: 0.5037
 epoch: 13, train_loss: 0.9299, test_loss: 1.0596, test_f1: 0.5098
 epoch: 14, train_loss: 0.9281, test_loss: 1.0598, test_f1: 0.5231
 epoch: 15, train_loss: 0.9134, test_loss: 1.0490, test_f1: 0.5221
 epoch: 16, train_loss: 0.8981, test_loss: 1.0642, test_f1: 0.5102
 epoch: 17, train_loss: 0.8928, test_loss: 1.0446, test_f1: 0.5105
 epoch: 18, train_loss: 0.8911, test_loss: 1.0471, test_f1: 0.5297
 epoch: 19, train_loss: 0.8808, test_loss: 1.0547, test_f1: 0.5151
 epoch: 20, train_loss: 0.8702, test_loss: 1.0467, test_f1: 0.5398
 epoch: 21, train_loss: 0.8720, test_loss: 1.0454, test_f1: 0.5268
 epoch: 22, train_loss: 0.8551, test_loss: 1.0522, test_f1: 0.5200
 epoch: 23, train_loss: 0.8465, test_loss: 1.0472, test_f1: 0.5220
 epoch: 24, train_loss: 0.8414, test_loss: 1.0457, test_f1: 0.5362
 epoch: 25, train_loss: 0.8525, test_loss: 1.0620, test_f1: 0.5593
 epoch: 26, train_loss: 0.8371, test_loss: 1.0528, test_f1: 0.5416
 epoch: 27, train_loss: 0.8362, test_loss: 1.0461, test_f1: 0.5429
 epoch: 28, train_loss: 0.8238, test_loss: 1.0394, test_f1: 0.5407
 epoch: 29, train_loss: 0.8248, test_loss: 1.0554, test_f1: 0.5403
 epoch: 30, train_loss: 0.8207, test_loss: 1.0497, test_f1: 0.5802
 epoch: 31, train_loss: 0.8175, test_loss: 1.0607, test_f1: 0.5485
 epoch: 32, train_loss: 0.8164, test_loss: 1.0402, test_f1: 0.5775
 epoch: 33, train_loss: 0.8015, test_loss: 1.0491, test_f1: 0.5637
 epoch: 34, train_loss: 0.8000, test_loss: 1.0570, test_f1: 0.5430
 epoch: 35, train_loss: 0.7952, test_loss: 1.0641, test_f1: 0.5576
 epoch: 36, train_loss: 0.7788, test_loss: 1.0392, test_f1: 0.5815
 epoch: 37, train_loss: 0.7797, test_loss: 1.0457, test_f1: 0.5506
 epoch: 38, train_loss: 0.7761, test_loss: 1.0510, test_f1: 0.5613
 epoch: 39, train_loss: 0.7649, test_loss: 1.0940, test_f1: 0.5616
 epoch: 40, train_loss: 0.7526, test_loss: 1.0449, test_f1: 0.5785
 epoch: 41, train_loss: 0.7505, test_loss: 1.0561, test_f1: 0.5727
 epoch: 42, train_loss: 0.7505, test_loss: 1.1079, test_f1: 0.5860
 epoch: 43, train_loss: 0.7470, test_loss: 1.0907, test_f1: 0.5771
 epoch: 44, train_loss: 0.7466, test_loss: 1.1298, test_f1: 0.5705
 epoch: 45, train_loss: 0.7352, test_loss: 1.0464, test_f1: 0.5767
 epoch: 46, train_loss: 0.7360, test_loss: 1.1022, test_f1: 0.6001
 epoch: 47, train_loss: 0.7180, test_loss: 1.0788, test_f1: 0.5901
 epoch: 48, train_loss: 0.7108, test_loss: 1.1113, test_f1: 0.5858
 epoch: 49, train_loss: 0.7085, test_loss: 1.0944, test_f1: 0.6023
 epoch: 50, train_loss: 0.7031, test_loss: 1.0924, test_f1: 0.6035
 epoch: 51, train_loss: 0.6872, test_loss: 1.0841, test_f1: 0.5932
 epoch: 52, train_loss: 0.6821, test_loss: 1.0933, test_f1: 0.6005
 epoch: 53, train_loss: 0.6906, test_loss: 1.1285, test_f1: 0.5913
 epoch: 54, train_loss: 0.6907, test_loss: 1.1146, test_f1: 0.5893
 epoch: 55, train_loss: 0.6738, test_loss: 1.1314, test_f1: 0.5879
 epoch: 56, train_loss: 0.6693, test_loss: 1.1231, test_f1: 0.5824
 epoch: 57, train_loss: 0.6636, test_loss: 1.1367, test_f1: 0.6006
 epoch: 58, train_loss: 0.6550, test_loss: 1.1202, test_f1: 0.5868
 epoch: 59, train_loss: 0.6691, test_loss: 1.1130, test_f1: 0.5958
 epoch: 60, train_loss: 0.6684, test_loss: 1.0990, test_f1: 0.5907
 epoch: 61, train_loss: 0.6532, test_loss: 1.1290, test_f1: 0.5961
 epoch: 62, train_loss: 0.6464, test_loss: 1.1740, test_f1: 0.5909
 epoch: 63, train_loss: 0.6487, test_loss: 1.1504, test_f1: 0.5974
 epoch: 64, train_loss: 0.6499, test_loss: 1.1040, test_f1: 0.5994
 epoch: 65, train_loss: 0.6383, test_loss: 1.1765, test_f1: 0.5824
 epoch: 66, train_loss: 0.6384, test_loss: 1.1455, test_f1: 0.5979
 epoch: 67, train_loss: 0.6321, test_loss: 1.1673, test_f1: 0.5967
 epoch: 68, train_loss: 0.6237, test_loss: 1.1623, test_f1: 0.5993
 epoch: 69, train_loss: 0.6286, test_loss: 1.1648, test_f1: 0.6052
 epoch: 70, train_loss: 0.6299, test_loss: 1.1854, test_f1: 0.5885
 epoch: 71, train_loss: 0.6338, test_loss: 1.1743, test_f1: 0.5996
 epoch: 72, train_loss: 0.6225, test_loss: 1.1566, test_f1: 0.5858
 epoch: 73, train_loss: 0.6187, test_loss: 1.1920, test_f1: 0.5880
 epoch: 74, train_loss: 0.6143, test_loss: 1.1626, test_f1: 0.6034
 epoch: 75, train_loss: 0.5996, test_loss: 1.1921, test_f1: 0.5952
 epoch: 76, train_loss: 0.6181, test_loss: 1.2100, test_f1: 0.5918
 epoch: 77, train_loss: 0.5944, test_loss: 1.1920, test_f1: 0.5945
 epoch: 78, train_loss: 0.6219, test_loss: 1.1908, test_f1: 0.5982
 epoch: 79, train_loss: 0.6081, test_loss: 1.2216, test_f1: 0.5953
 epoch: 80, train_loss: 0.5980, test_loss: 1.2266, test_f1: 0.5919
 epoch: 81, train_loss: 0.6012, test_loss: 1.1853, test_f1: 0.5988
 epoch: 82, train_loss: 0.6029, test_loss: 1.2107, test_f1: 0.5930
 epoch: 83, train_loss: 0.5971, test_loss: 1.2394, test_f1: 0.5887
 epoch: 84, train_loss: 0.5862, test_loss: 1.2344, test_f1: 0.5914
 epoch: 85, train_loss: 0.5861, test_loss: 1.2642, test_f1: 0.6013
 epoch: 86, train_loss: 0.5929, test_loss: 1.2281, test_f1: 0.6061
 epoch: 87, train_loss: 0.5730, test_loss: 1.2756, test_f1: 0.5984
 epoch: 88, train_loss: 0.5893, test_loss: 1.2258, test_f1: 0.5984
 epoch: 89, train_loss: 0.5735, test_loss: 1.2085, test_f1: 0.6087
 epoch: 90, train_loss: 0.5773, test_loss: 1.2809, test_f1: 0.5916
 epoch: 91, train_loss: 0.5707, test_loss: 1.2250, test_f1: 0.5940
 epoch: 92, train_loss: 0.5683, test_loss: 1.2533, test_f1: 0.5962
 epoch: 93, train_loss: 0.5705, test_loss: 1.2387, test_f1: 0.6017
 epoch: 94, train_loss: 0.5738, test_loss: 1.2594, test_f1: 0.6090
 epoch: 95, train_loss: 0.5701, test_loss: 1.2526, test_f1: 0.6019
 epoch: 96, train_loss: 0.5652, test_loss: 1.3369, test_f1: 0.6050
 epoch: 97, train_loss: 0.5632, test_loss: 1.2707, test_f1: 0.6019
 epoch: 98, train_loss: 0.5462, test_loss: 1.2801, test_f1: 0.6014
 epoch: 99, train_loss: 0.5344, test_loss: 1.2893, test_f1: 0.6011
##################ITERATION #3 ****************************************
 epoch: 0, train_loss: 1.2415, test_loss: 1.2852, test_f1: 0.2722
 epoch: 1, train_loss: 1.1366, test_loss: 1.2236, test_f1: 0.3359
 epoch: 2, train_loss: 1.1043, test_loss: 1.1678, test_f1: 0.4141
 epoch: 3, train_loss: 1.0770, test_loss: 1.1409, test_f1: 0.4400
 epoch: 4, train_loss: 1.0433, test_loss: 1.1195, test_f1: 0.4834
 epoch: 5, train_loss: 1.0252, test_loss: 1.1050, test_f1: 0.4935
 epoch: 6, train_loss: 1.0052, test_loss: 1.0937, test_f1: 0.4869
 epoch: 7, train_loss: 0.9909, test_loss: 1.0833, test_f1: 0.4953
 epoch: 8, train_loss: 0.9752, test_loss: 1.0626, test_f1: 0.5039
 epoch: 9, train_loss: 0.9652, test_loss: 1.0613, test_f1: 0.5108
 epoch: 10, train_loss: 0.9420, test_loss: 1.0514, test_f1: 0.5168
 epoch: 11, train_loss: 0.9356, test_loss: 1.0541, test_f1: 0.5140
 epoch: 12, train_loss: 0.9261, test_loss: 1.0451, test_f1: 0.5173
 epoch: 13, train_loss: 0.9296, test_loss: 1.0386, test_f1: 0.5195
 epoch: 14, train_loss: 0.9074, test_loss: 1.0326, test_f1: 0.5248
 epoch: 15, train_loss: 0.9027, test_loss: 1.0326, test_f1: 0.5293
 epoch: 16, train_loss: 0.8956, test_loss: 1.0442, test_f1: 0.5496
 epoch: 17, train_loss: 0.8802, test_loss: 1.0558, test_f1: 0.5207
 epoch: 18, train_loss: 0.8748, test_loss: 1.0361, test_f1: 0.5496
 epoch: 19, train_loss: 0.8614, test_loss: 1.0349, test_f1: 0.5724
 epoch: 20, train_loss: 0.8586, test_loss: 1.0410, test_f1: 0.5494
 epoch: 21, train_loss: 0.8559, test_loss: 1.0450, test_f1: 0.5362
 epoch: 22, train_loss: 0.8441, test_loss: 1.0315, test_f1: 0.5572
 epoch: 23, train_loss: 0.8400, test_loss: 1.0292, test_f1: 0.5571
 epoch: 24, train_loss: 0.8288, test_loss: 1.0336, test_f1: 0.5460
 epoch: 25, train_loss: 0.8241, test_loss: 1.0251, test_f1: 0.5572
 epoch: 26, train_loss: 0.8158, test_loss: 1.0261, test_f1: 0.5715
 epoch: 27, train_loss: 0.8004, test_loss: 1.0258, test_f1: 0.5710
 epoch: 28, train_loss: 0.8082, test_loss: 1.0387, test_f1: 0.5702
 epoch: 29, train_loss: 0.7997, test_loss: 1.0414, test_f1: 0.5569
 epoch: 30, train_loss: 0.7924, test_loss: 1.0379, test_f1: 0.5814
 epoch: 31, train_loss: 0.7858, test_loss: 1.0237, test_f1: 0.5871
 epoch: 32, train_loss: 0.7729, test_loss: 1.0659, test_f1: 0.5828
 epoch: 33, train_loss: 0.7848, test_loss: 1.0310, test_f1: 0.5937
 epoch: 34, train_loss: 0.7610, test_loss: 1.0553, test_f1: 0.5735
 epoch: 35, train_loss: 0.7602, test_loss: 1.0260, test_f1: 0.5873
 epoch: 36, train_loss: 0.7542, test_loss: 1.0470, test_f1: 0.5982
 epoch: 37, train_loss: 0.7494, test_loss: 1.0424, test_f1: 0.6038
 epoch: 38, train_loss: 0.7376, test_loss: 1.0584, test_f1: 0.6007
 epoch: 39, train_loss: 0.7556, test_loss: 1.0723, test_f1: 0.5670
 epoch: 40, train_loss: 0.7338, test_loss: 1.0742, test_f1: 0.5979
 epoch: 41, train_loss: 0.7259, test_loss: 1.0635, test_f1: 0.5715
 epoch: 42, train_loss: 0.7175, test_loss: 1.0470, test_f1: 0.6085
 epoch: 43, train_loss: 0.7040, test_loss: 1.0534, test_f1: 0.6051
 epoch: 44, train_loss: 0.7132, test_loss: 1.0655, test_f1: 0.6208
 epoch: 45, train_loss: 0.7121, test_loss: 1.0691, test_f1: 0.6010
 epoch: 46, train_loss: 0.7034, test_loss: 1.0758, test_f1: 0.5966
 epoch: 47, train_loss: 0.6944, test_loss: 1.0685, test_f1: 0.5862
 epoch: 48, train_loss: 0.6782, test_loss: 1.0493, test_f1: 0.6221
 epoch: 49, train_loss: 0.6780, test_loss: 1.0938, test_f1: 0.6055
 epoch: 50, train_loss: 0.6739, test_loss: 1.1273, test_f1: 0.6074
 epoch: 51, train_loss: 0.6629, test_loss: 1.1050, test_f1: 0.5959
 epoch: 52, train_loss: 0.6553, test_loss: 1.1000, test_f1: 0.6038
 epoch: 53, train_loss: 0.6458, test_loss: 1.0794, test_f1: 0.6155
 epoch: 54, train_loss: 0.6647, test_loss: 1.0869, test_f1: 0.6052
 epoch: 55, train_loss: 0.6542, test_loss: 1.0882, test_f1: 0.5981
 epoch: 56, train_loss: 0.6442, test_loss: 1.0933, test_f1: 0.6144
 epoch: 57, train_loss: 0.6601, test_loss: 1.0938, test_f1: 0.6135
 epoch: 58, train_loss: 0.6393, test_loss: 1.0942, test_f1: 0.6130
 epoch: 59, train_loss: 0.6340, test_loss: 1.0864, test_f1: 0.6098
 epoch: 60, train_loss: 0.6378, test_loss: 1.1303, test_f1: 0.6211
 epoch: 61, train_loss: 0.6308, test_loss: 1.1142, test_f1: 0.6103
 epoch: 62, train_loss: 0.6357, test_loss: 1.1122, test_f1: 0.5931
 epoch: 63, train_loss: 0.6266, test_loss: 1.0964, test_f1: 0.6182
 epoch: 64, train_loss: 0.6297, test_loss: 1.1121, test_f1: 0.6200
 epoch: 65, train_loss: 0.6198, test_loss: 1.0990, test_f1: 0.6323
 epoch: 66, train_loss: 0.6154, test_loss: 1.1319, test_f1: 0.6214
 epoch: 67, train_loss: 0.6103, test_loss: 1.0946, test_f1: 0.6260
 epoch: 68, train_loss: 0.5997, test_loss: 1.1193, test_f1: 0.5943
 epoch: 69, train_loss: 0.6051, test_loss: 1.1263, test_f1: 0.6087
 epoch: 70, train_loss: 0.5955, test_loss: 1.0865, test_f1: 0.6164
 epoch: 71, train_loss: 0.6076, test_loss: 1.1152, test_f1: 0.6076
 epoch: 72, train_loss: 0.5938, test_loss: 1.1804, test_f1: 0.5968
 epoch: 73, train_loss: 0.5957, test_loss: 1.1351, test_f1: 0.6142
 epoch: 74, train_loss: 0.5970, test_loss: 1.1481, test_f1: 0.6246
 epoch: 75, train_loss: 0.5822, test_loss: 1.1467, test_f1: 0.5968
 epoch: 76, train_loss: 0.5910, test_loss: 1.1372, test_f1: 0.6115
 epoch: 77, train_loss: 0.5779, test_loss: 1.1824, test_f1: 0.5914
 epoch: 78, train_loss: 0.5768, test_loss: 1.1579, test_f1: 0.5991
 epoch: 79, train_loss: 0.5779, test_loss: 1.1669, test_f1: 0.6134
 epoch: 80, train_loss: 0.5815, test_loss: 1.1482, test_f1: 0.5972
 epoch: 81, train_loss: 0.5755, test_loss: 1.1799, test_f1: 0.6037
 epoch: 82, train_loss: 0.5546, test_loss: 1.1710, test_f1: 0.6163
 epoch: 83, train_loss: 0.5479, test_loss: 1.1627, test_f1: 0.5827
 epoch: 84, train_loss: 0.5743, test_loss: 1.1649, test_f1: 0.6154
 epoch: 85, train_loss: 0.5463, test_loss: 1.1579, test_f1: 0.6372
 epoch: 86, train_loss: 0.5637, test_loss: 1.1668, test_f1: 0.6173
 epoch: 87, train_loss: 0.5645, test_loss: 1.1818, test_f1: 0.6242
 epoch: 88, train_loss: 0.5704, test_loss: 1.1551, test_f1: 0.6218
 epoch: 89, train_loss: 0.5495, test_loss: 1.1640, test_f1: 0.5930
 epoch: 90, train_loss: 0.5454, test_loss: 1.2092, test_f1: 0.6064
 epoch: 91, train_loss: 0.5716, test_loss: 1.1743, test_f1: 0.6144
 epoch: 92, train_loss: 0.5430, test_loss: 1.1550, test_f1: 0.6104
 epoch: 93, train_loss: 0.5434, test_loss: 1.1570, test_f1: 0.6311
 epoch: 94, train_loss: 0.5527, test_loss: 1.1775, test_f1: 0.6247
 epoch: 95, train_loss: 0.5300, test_loss: 1.1689, test_f1: 0.6097
 epoch: 96, train_loss: 0.5250, test_loss: 1.1744, test_f1: 0.6213
 epoch: 97, train_loss: 0.5239, test_loss: 1.2383, test_f1: 0.6133
 epoch: 98, train_loss: 0.5374, test_loss: 1.2287, test_f1: 0.5952
 epoch: 99, train_loss: 0.5311, test_loss: 1.2290, test_f1: 0.6244
##################ITERATION #4 ****************************************
 epoch: 0, train_loss: 1.2253, test_loss: 1.2970, test_f1: 0.1334
 epoch: 1, train_loss: 1.1271, test_loss: 1.2244, test_f1: 0.3862
 epoch: 2, train_loss: 1.0663, test_loss: 1.1479, test_f1: 0.4581
 epoch: 3, train_loss: 1.0581, test_loss: 1.1238, test_f1: 0.4845
 epoch: 4, train_loss: 1.0349, test_loss: 1.1089, test_f1: 0.5015
 epoch: 5, train_loss: 1.0150, test_loss: 1.0946, test_f1: 0.5155
 epoch: 6, train_loss: 0.9923, test_loss: 1.0807, test_f1: 0.5192
 epoch: 7, train_loss: 0.9829, test_loss: 1.0741, test_f1: 0.5265
 epoch: 8, train_loss: 0.9635, test_loss: 1.0556, test_f1: 0.5319
 epoch: 9, train_loss: 0.9404, test_loss: 1.0567, test_f1: 0.5248
 epoch: 10, train_loss: 0.9429, test_loss: 1.0404, test_f1: 0.5257
 epoch: 11, train_loss: 0.9268, test_loss: 1.0348, test_f1: 0.5252
 epoch: 12, train_loss: 0.9149, test_loss: 1.0526, test_f1: 0.5253
 epoch: 13, train_loss: 0.8974, test_loss: 1.0395, test_f1: 0.5404
 epoch: 14, train_loss: 0.8907, test_loss: 1.0270, test_f1: 0.5268
 epoch: 15, train_loss: 0.9047, test_loss: 1.0085, test_f1: 0.5258
 epoch: 16, train_loss: 0.8890, test_loss: 0.9960, test_f1: 0.5547
 epoch: 17, train_loss: 0.8801, test_loss: 1.0064, test_f1: 0.5490
 epoch: 18, train_loss: 0.8660, test_loss: 0.9982, test_f1: 0.5373
 epoch: 19, train_loss: 0.8585, test_loss: 0.9897, test_f1: 0.5705
 epoch: 20, train_loss: 0.8419, test_loss: 0.9935, test_f1: 0.5640
 epoch: 21, train_loss: 0.8389, test_loss: 0.9912, test_f1: 0.5640
 epoch: 22, train_loss: 0.8283, test_loss: 0.9818, test_f1: 0.5657
 epoch: 23, train_loss: 0.8319, test_loss: 0.9733, test_f1: 0.5755
 epoch: 24, train_loss: 0.8233, test_loss: 0.9974, test_f1: 0.5623
 epoch: 25, train_loss: 0.8268, test_loss: 0.9854, test_f1: 0.5951
 epoch: 26, train_loss: 0.8088, test_loss: 0.9796, test_f1: 0.5875
 epoch: 27, train_loss: 0.8035, test_loss: 0.9812, test_f1: 0.5941
 epoch: 28, train_loss: 0.7817, test_loss: 0.9716, test_f1: 0.5997
 epoch: 29, train_loss: 0.7799, test_loss: 1.0021, test_f1: 0.6027
 epoch: 30, train_loss: 0.7800, test_loss: 0.9974, test_f1: 0.5895
 epoch: 31, train_loss: 0.7757, test_loss: 1.0118, test_f1: 0.6183
 epoch: 32, train_loss: 0.7483, test_loss: 0.9675, test_f1: 0.6212
 epoch: 33, train_loss: 0.7543, test_loss: 0.9915, test_f1: 0.6282
 epoch: 34, train_loss: 0.7503, test_loss: 1.0006, test_f1: 0.6218
 epoch: 35, train_loss: 0.7464, test_loss: 1.0100, test_f1: 0.6092
 epoch: 36, train_loss: 0.7399, test_loss: 0.9874, test_f1: 0.6335
 epoch: 37, train_loss: 0.7371, test_loss: 1.0148, test_f1: 0.6065
 epoch: 38, train_loss: 0.7243, test_loss: 0.9793, test_f1: 0.6153
 epoch: 39, train_loss: 0.7349, test_loss: 1.0120, test_f1: 0.6111
 epoch: 40, train_loss: 0.7086, test_loss: 1.0615, test_f1: 0.6124
 epoch: 41, train_loss: 0.7092, test_loss: 1.0936, test_f1: 0.6072
 epoch: 42, train_loss: 0.7027, test_loss: 1.0621, test_f1: 0.6151
 epoch: 43, train_loss: 0.6895, test_loss: 1.0571, test_f1: 0.5970
 epoch: 44, train_loss: 0.6908, test_loss: 1.1211, test_f1: 0.6150
 epoch: 45, train_loss: 0.6932, test_loss: 1.1061, test_f1: 0.6129
 epoch: 46, train_loss: 0.6718, test_loss: 1.1068, test_f1: 0.6155
 epoch: 47, train_loss: 0.6669, test_loss: 1.1072, test_f1: 0.6088
 epoch: 48, train_loss: 0.6544, test_loss: 1.0780, test_f1: 0.6179
 epoch: 49, train_loss: 0.6578, test_loss: 1.1158, test_f1: 0.5906
 epoch: 50, train_loss: 0.6648, test_loss: 1.1421, test_f1: 0.6105
 epoch: 51, train_loss: 0.6514, test_loss: 1.1425, test_f1: 0.6115
 epoch: 52, train_loss: 0.6393, test_loss: 1.1748, test_f1: 0.6316
 epoch: 53, train_loss: 0.6474, test_loss: 1.1596, test_f1: 0.6144
 epoch: 54, train_loss: 0.6282, test_loss: 1.1638, test_f1: 0.6154
 epoch: 55, train_loss: 0.6201, test_loss: 1.1973, test_f1: 0.6090
 epoch: 56, train_loss: 0.6228, test_loss: 1.2076, test_f1: 0.6236
 epoch: 57, train_loss: 0.6106, test_loss: 1.1652, test_f1: 0.6163
 epoch: 58, train_loss: 0.6148, test_loss: 1.2322, test_f1: 0.5993
 epoch: 59, train_loss: 0.6151, test_loss: 1.2254, test_f1: 0.6195
 epoch: 60, train_loss: 0.6151, test_loss: 1.2161, test_f1: 0.6190
 epoch: 61, train_loss: 0.6016, test_loss: 1.2161, test_f1: 0.6257
 epoch: 62, train_loss: 0.6093, test_loss: 1.2923, test_f1: 0.6087
 epoch: 63, train_loss: 0.6074, test_loss: 1.2546, test_f1: 0.6033
 epoch: 64, train_loss: 0.6063, test_loss: 1.2732, test_f1: 0.6165
 epoch: 65, train_loss: 0.5944, test_loss: 1.2323, test_f1: 0.6315
 epoch: 66, train_loss: 0.5820, test_loss: 1.2786, test_f1: 0.6078
 epoch: 67, train_loss: 0.5814, test_loss: 1.2978, test_f1: 0.6221
 epoch: 68, train_loss: 0.5917, test_loss: 1.2906, test_f1: 0.6245
 epoch: 69, train_loss: 0.5659, test_loss: 1.3090, test_f1: 0.6258
 epoch: 70, train_loss: 0.5884, test_loss: 1.2815, test_f1: 0.6184
 epoch: 71, train_loss: 0.5743, test_loss: 1.2644, test_f1: 0.6085
 epoch: 72, train_loss: 0.5677, test_loss: 1.2848, test_f1: 0.6139
 epoch: 73, train_loss: 0.5593, test_loss: 1.3372, test_f1: 0.6081
 epoch: 74, train_loss: 0.5702, test_loss: 1.3130, test_f1: 0.5875
 epoch: 75, train_loss: 0.5634, test_loss: 1.3151, test_f1: 0.6132
 epoch: 76, train_loss: 0.5598, test_loss: 1.3794, test_f1: 0.5921
 epoch: 77, train_loss: 0.5563, test_loss: 1.3873, test_f1: 0.6170
 epoch: 78, train_loss: 0.5532, test_loss: 1.3552, test_f1: 0.5784
 epoch: 79, train_loss: 0.5620, test_loss: 1.3840, test_f1: 0.5899
 epoch: 80, train_loss: 0.5437, test_loss: 1.3501, test_f1: 0.6229
 epoch: 81, train_loss: 0.5417, test_loss: 1.3834, test_f1: 0.6194
 epoch: 82, train_loss: 0.5353, test_loss: 1.3281, test_f1: 0.6089
 epoch: 83, train_loss: 0.5563, test_loss: 1.3839, test_f1: 0.5881
 epoch: 84, train_loss: 0.5246, test_loss: 1.3348, test_f1: 0.5883
 epoch: 85, train_loss: 0.5405, test_loss: 1.3705, test_f1: 0.5827
 epoch: 86, train_loss: 0.5453, test_loss: 1.3754, test_f1: 0.5828
 epoch: 87, train_loss: 0.5194, test_loss: 1.3611, test_f1: 0.6047
 epoch: 88, train_loss: 0.5349, test_loss: 1.4374, test_f1: 0.5829
 epoch: 89, train_loss: 0.5220, test_loss: 1.4257, test_f1: 0.5745
 epoch: 90, train_loss: 0.5122, test_loss: 1.3948, test_f1: 0.5887
 epoch: 91, train_loss: 0.5309, test_loss: 1.4606, test_f1: 0.5879
 epoch: 92, train_loss: 0.5152, test_loss: 1.4374, test_f1: 0.6187
 epoch: 93, train_loss: 0.5293, test_loss: 1.4857, test_f1: 0.6170
 epoch: 94, train_loss: 0.5004, test_loss: 1.4779, test_f1: 0.5920
 epoch: 95, train_loss: 0.5108, test_loss: 1.4725, test_f1: 0.6303
 epoch: 96, train_loss: 0.5078, test_loss: 1.5610, test_f1: 0.6120
 epoch: 97, train_loss: 0.4906, test_loss: 1.5061, test_f1: 0.5938
 epoch: 98, train_loss: 0.4961, test_loss: 1.4327, test_f1: 0.6293
 epoch: 99, train_loss: 0.5044, test_loss: 1.4729, test_f1: 0.6076
##################ITERATION #5 ****************************************
 epoch: 0, train_loss: 1.2401, test_loss: 1.2951, test_f1: 0.3216
 epoch: 1, train_loss: 1.1112, test_loss: 1.2008, test_f1: 0.3785
 epoch: 2, train_loss: 1.0694, test_loss: 1.1629, test_f1: 0.4462
 epoch: 3, train_loss: 1.0375, test_loss: 1.1374, test_f1: 0.4949
 epoch: 4, train_loss: 1.0240, test_loss: 1.1222, test_f1: 0.4837
 epoch: 5, train_loss: 1.0001, test_loss: 1.1182, test_f1: 0.4759
 epoch: 6, train_loss: 0.9710, test_loss: 1.0943, test_f1: 0.5004
 epoch: 7, train_loss: 0.9727, test_loss: 1.1048, test_f1: 0.5218
 epoch: 8, train_loss: 0.9488, test_loss: 1.0984, test_f1: 0.5110
 epoch: 9, train_loss: 0.9491, test_loss: 1.0931, test_f1: 0.5006
 epoch: 10, train_loss: 0.9284, test_loss: 1.0793, test_f1: 0.5469
 epoch: 11, train_loss: 0.9219, test_loss: 1.0790, test_f1: 0.5169
 epoch: 12, train_loss: 0.9147, test_loss: 1.0703, test_f1: 0.5267
 epoch: 13, train_loss: 0.8939, test_loss: 1.0637, test_f1: 0.5276
 epoch: 14, train_loss: 0.8965, test_loss: 1.0619, test_f1: 0.5644
 epoch: 15, train_loss: 0.8775, test_loss: 1.0604, test_f1: 0.5354
 epoch: 16, train_loss: 0.8690, test_loss: 1.0534, test_f1: 0.5581
 epoch: 17, train_loss: 0.8604, test_loss: 1.0592, test_f1: 0.5558
 epoch: 18, train_loss: 0.8554, test_loss: 1.0554, test_f1: 0.5591
 epoch: 19, train_loss: 0.8477, test_loss: 1.0375, test_f1: 0.5476
 epoch: 20, train_loss: 0.8397, test_loss: 1.0440, test_f1: 0.5713
 epoch: 21, train_loss: 0.8290, test_loss: 1.0416, test_f1: 0.5644
 epoch: 22, train_loss: 0.8226, test_loss: 1.0427, test_f1: 0.5509
 epoch: 23, train_loss: 0.8098, test_loss: 1.0305, test_f1: 0.5697
 epoch: 24, train_loss: 0.8132, test_loss: 1.0323, test_f1: 0.5760
 epoch: 25, train_loss: 0.7947, test_loss: 1.0158, test_f1: 0.5991
 epoch: 26, train_loss: 0.7918, test_loss: 1.0275, test_f1: 0.5843
 epoch: 27, train_loss: 0.7835, test_loss: 1.0263, test_f1: 0.5975
 epoch: 28, train_loss: 0.7700, test_loss: 1.0117, test_f1: 0.6090
 epoch: 29, train_loss: 0.7624, test_loss: 1.0289, test_f1: 0.6211
 epoch: 30, train_loss: 0.7759, test_loss: 1.0077, test_f1: 0.6113
 epoch: 31, train_loss: 0.7604, test_loss: 1.0237, test_f1: 0.6235
 epoch: 32, train_loss: 0.7562, test_loss: 1.0272, test_f1: 0.5810
 epoch: 33, train_loss: 0.7441, test_loss: 1.0210, test_f1: 0.6200
 epoch: 34, train_loss: 0.7513, test_loss: 1.0257, test_f1: 0.6278
 epoch: 35, train_loss: 0.7305, test_loss: 0.9970, test_f1: 0.6116
 epoch: 36, train_loss: 0.7306, test_loss: 1.0362, test_f1: 0.5839
 epoch: 37, train_loss: 0.7161, test_loss: 1.0088, test_f1: 0.6145
 epoch: 38, train_loss: 0.7227, test_loss: 1.0304, test_f1: 0.6084
 epoch: 39, train_loss: 0.6971, test_loss: 1.0302, test_f1: 0.6043
 epoch: 40, train_loss: 0.7082, test_loss: 1.0314, test_f1: 0.6075
 epoch: 41, train_loss: 0.7041, test_loss: 1.0354, test_f1: 0.6121
 epoch: 42, train_loss: 0.7032, test_loss: 1.0140, test_f1: 0.6326
 epoch: 43, train_loss: 0.6832, test_loss: 1.0501, test_f1: 0.6070
 epoch: 44, train_loss: 0.6766, test_loss: 1.0538, test_f1: 0.6105
 epoch: 45, train_loss: 0.6773, test_loss: 1.0424, test_f1: 0.6044
 epoch: 46, train_loss: 0.6748, test_loss: 1.0535, test_f1: 0.6211
 epoch: 47, train_loss: 0.6787, test_loss: 1.0121, test_f1: 0.6253
 epoch: 48, train_loss: 0.6543, test_loss: 1.0718, test_f1: 0.6201
 epoch: 49, train_loss: 0.6570, test_loss: 1.0413, test_f1: 0.6237
 epoch: 50, train_loss: 0.6451, test_loss: 1.0629, test_f1: 0.6098
 epoch: 51, train_loss: 0.6388, test_loss: 1.0678, test_f1: 0.6225
 epoch: 52, train_loss: 0.6276, test_loss: 1.0638, test_f1: 0.6219
 epoch: 53, train_loss: 0.6246, test_loss: 1.0717, test_f1: 0.6218
 epoch: 54, train_loss: 0.6203, test_loss: 1.0597, test_f1: 0.6320
 epoch: 55, train_loss: 0.6234, test_loss: 1.0826, test_f1: 0.6099
 epoch: 56, train_loss: 0.6301, test_loss: 1.0720, test_f1: 0.6277
 epoch: 57, train_loss: 0.5999, test_loss: 1.0542, test_f1: 0.6454
 epoch: 58, train_loss: 0.6161, test_loss: 1.0630, test_f1: 0.6427
 epoch: 59, train_loss: 0.6003, test_loss: 1.0786, test_f1: 0.6376
 epoch: 60, train_loss: 0.6073, test_loss: 1.0752, test_f1: 0.6203
 epoch: 61, train_loss: 0.5931, test_loss: 1.0873, test_f1: 0.6205
 epoch: 62, train_loss: 0.6080, test_loss: 1.0979, test_f1: 0.6148
 epoch: 63, train_loss: 0.5878, test_loss: 1.0947, test_f1: 0.6153
 epoch: 64, train_loss: 0.5894, test_loss: 1.1143, test_f1: 0.6075
 epoch: 65, train_loss: 0.5949, test_loss: 1.0896, test_f1: 0.6126
 epoch: 66, train_loss: 0.5969, test_loss: 1.1081, test_f1: 0.6290
 epoch: 67, train_loss: 0.5822, test_loss: 1.0832, test_f1: 0.6154
 epoch: 68, train_loss: 0.5864, test_loss: 1.1018, test_f1: 0.6252
 epoch: 69, train_loss: 0.5742, test_loss: 1.1223, test_f1: 0.6050
 epoch: 70, train_loss: 0.5862, test_loss: 1.1045, test_f1: 0.6304
 epoch: 71, train_loss: 0.5620, test_loss: 1.1046, test_f1: 0.6448
 epoch: 72, train_loss: 0.5639, test_loss: 1.1261, test_f1: 0.6325
 epoch: 73, train_loss: 0.5731, test_loss: 1.1195, test_f1: 0.6479
 epoch: 74, train_loss: 0.5721, test_loss: 1.1106, test_f1: 0.6308
 epoch: 75, train_loss: 0.5711, test_loss: 1.1585, test_f1: 0.6201
 epoch: 76, train_loss: 0.5664, test_loss: 1.1370, test_f1: 0.6232
 epoch: 77, train_loss: 0.5494, test_loss: 1.1330, test_f1: 0.6223
 epoch: 78, train_loss: 0.5463, test_loss: 1.1224, test_f1: 0.6256
 epoch: 79, train_loss: 0.5633, test_loss: 1.1416, test_f1: 0.6358
 epoch: 80, train_loss: 0.5523, test_loss: 1.1368, test_f1: 0.6285
 epoch: 81, train_loss: 0.5565, test_loss: 1.1582, test_f1: 0.6265
 epoch: 82, train_loss: 0.5292, test_loss: 1.1327, test_f1: 0.6279
 epoch: 83, train_loss: 0.5431, test_loss: 1.1309, test_f1: 0.6310
 epoch: 84, train_loss: 0.5362, test_loss: 1.1418, test_f1: 0.6363
 epoch: 85, train_loss: 0.5336, test_loss: 1.1454, test_f1: 0.6312
 epoch: 86, train_loss: 0.5406, test_loss: 1.1403, test_f1: 0.6275
 epoch: 87, train_loss: 0.5237, test_loss: 1.1495, test_f1: 0.6338
 epoch: 88, train_loss: 0.5251, test_loss: 1.1521, test_f1: 0.6356
 epoch: 89, train_loss: 0.5222, test_loss: 1.1975, test_f1: 0.6312
 epoch: 90, train_loss: 0.5263, test_loss: 1.1479, test_f1: 0.6257
 epoch: 91, train_loss: 0.5152, test_loss: 1.1629, test_f1: 0.6283
 epoch: 92, train_loss: 0.5167, test_loss: 1.1742, test_f1: 0.6229
 epoch: 93, train_loss: 0.5249, test_loss: 1.1627, test_f1: 0.6282
 epoch: 94, train_loss: 0.5329, test_loss: 1.1723, test_f1: 0.6283
 epoch: 95, train_loss: 0.5186, test_loss: 1.1834, test_f1: 0.6283
 epoch: 96, train_loss: 0.5013, test_loss: 1.1979, test_f1: 0.6211
 epoch: 97, train_loss: 0.5081, test_loss: 1.1829, test_f1: 0.6260
 epoch: 98, train_loss: 0.5111, test_loss: 1.2234, test_f1: 0.6129
 epoch: 99, train_loss: 0.4913, test_loss: 1.2291, test_f1: 0.6305
##################ITERATION #6 ****************************************
 epoch: 0, train_loss: 1.2532, test_loss: 1.2665, test_f1: 0.2776
 epoch: 1, train_loss: 1.1108, test_loss: 1.2230, test_f1: 0.3965
 epoch: 2, train_loss: 1.0718, test_loss: 1.1613, test_f1: 0.4654
 epoch: 3, train_loss: 1.0509, test_loss: 1.1234, test_f1: 0.4660
 epoch: 4, train_loss: 1.0264, test_loss: 1.1029, test_f1: 0.4797
 epoch: 5, train_loss: 1.0102, test_loss: 1.0869, test_f1: 0.4860
 epoch: 6, train_loss: 1.0005, test_loss: 1.0828, test_f1: 0.4820
 epoch: 7, train_loss: 0.9842, test_loss: 1.0722, test_f1: 0.5210
 epoch: 8, train_loss: 0.9555, test_loss: 1.0621, test_f1: 0.5110
 epoch: 9, train_loss: 0.9614, test_loss: 1.0536, test_f1: 0.5224
 epoch: 10, train_loss: 0.9426, test_loss: 1.0602, test_f1: 0.5297
 epoch: 11, train_loss: 0.9196, test_loss: 1.0423, test_f1: 0.5287
 epoch: 12, train_loss: 0.9158, test_loss: 1.0317, test_f1: 0.5349
 epoch: 13, train_loss: 0.9106, test_loss: 1.0228, test_f1: 0.5640
 epoch: 14, train_loss: 0.8996, test_loss: 1.0246, test_f1: 0.5425
 epoch: 15, train_loss: 0.8862, test_loss: 1.0173, test_f1: 0.5639
 epoch: 16, train_loss: 0.8732, test_loss: 1.0236, test_f1: 0.5577
 epoch: 17, train_loss: 0.8849, test_loss: 1.0180, test_f1: 0.5634
 epoch: 18, train_loss: 0.8682, test_loss: 1.0188, test_f1: 0.5654
 epoch: 19, train_loss: 0.8622, test_loss: 0.9953, test_f1: 0.5743
 epoch: 20, train_loss: 0.8683, test_loss: 1.0165, test_f1: 0.5540
 epoch: 21, train_loss: 0.8352, test_loss: 0.9947, test_f1: 0.5877
 epoch: 22, train_loss: 0.8417, test_loss: 0.9871, test_f1: 0.5646
 epoch: 23, train_loss: 0.8175, test_loss: 1.0008, test_f1: 0.5915
 epoch: 24, train_loss: 0.8160, test_loss: 1.0018, test_f1: 0.5635
 epoch: 25, train_loss: 0.8050, test_loss: 0.9987, test_f1: 0.5962
 epoch: 26, train_loss: 0.8111, test_loss: 1.0088, test_f1: 0.6177
 epoch: 27, train_loss: 0.7994, test_loss: 0.9878, test_f1: 0.6248
 epoch: 28, train_loss: 0.7944, test_loss: 0.9942, test_f1: 0.5981
 epoch: 29, train_loss: 0.7885, test_loss: 0.9972, test_f1: 0.6075
 epoch: 30, train_loss: 0.7760, test_loss: 0.9949, test_f1: 0.6255
 epoch: 31, train_loss: 0.7691, test_loss: 0.9791, test_f1: 0.6153
 epoch: 32, train_loss: 0.7567, test_loss: 0.9795, test_f1: 0.6210
 epoch: 33, train_loss: 0.7669, test_loss: 0.9907, test_f1: 0.6182
 epoch: 34, train_loss: 0.7607, test_loss: 1.0028, test_f1: 0.5991
 epoch: 35, train_loss: 0.7601, test_loss: 0.9908, test_f1: 0.6380
 epoch: 36, train_loss: 0.7539, test_loss: 0.9650, test_f1: 0.6474
 epoch: 37, train_loss: 0.7425, test_loss: 0.9687, test_f1: 0.6248
 epoch: 38, train_loss: 0.7365, test_loss: 0.9743, test_f1: 0.6181
 epoch: 39, train_loss: 0.7368, test_loss: 0.9924, test_f1: 0.6172
 epoch: 40, train_loss: 0.7191, test_loss: 0.9801, test_f1: 0.6203
 epoch: 41, train_loss: 0.7189, test_loss: 0.9546, test_f1: 0.6259
 epoch: 42, train_loss: 0.7187, test_loss: 0.9848, test_f1: 0.6460
 epoch: 43, train_loss: 0.7020, test_loss: 0.9809, test_f1: 0.6346
 epoch: 44, train_loss: 0.7032, test_loss: 0.9828, test_f1: 0.6397
 epoch: 45, train_loss: 0.6904, test_loss: 0.9902, test_f1: 0.6688
 epoch: 46, train_loss: 0.7063, test_loss: 1.0213, test_f1: 0.6182
 epoch: 47, train_loss: 0.6835, test_loss: 0.9921, test_f1: 0.6368
 epoch: 48, train_loss: 0.6831, test_loss: 1.0068, test_f1: 0.6595
 epoch: 49, train_loss: 0.6664, test_loss: 1.0071, test_f1: 0.6141
 epoch: 50, train_loss: 0.6847, test_loss: 1.0199, test_f1: 0.5950
 epoch: 51, train_loss: 0.6570, test_loss: 1.0168, test_f1: 0.6252
 epoch: 52, train_loss: 0.6520, test_loss: 1.0397, test_f1: 0.6204
 epoch: 53, train_loss: 0.6493, test_loss: 1.0223, test_f1: 0.6598
 epoch: 54, train_loss: 0.6467, test_loss: 1.0343, test_f1: 0.6232
 epoch: 55, train_loss: 0.6342, test_loss: 1.0271, test_f1: 0.6047
 epoch: 56, train_loss: 0.6487, test_loss: 1.0208, test_f1: 0.6153
 epoch: 57, train_loss: 0.6391, test_loss: 1.0188, test_f1: 0.6186
 epoch: 58, train_loss: 0.6216, test_loss: 1.0336, test_f1: 0.6403
 epoch: 59, train_loss: 0.6206, test_loss: 1.0349, test_f1: 0.6203
 epoch: 60, train_loss: 0.6332, test_loss: 1.0158, test_f1: 0.6364
 epoch: 61, train_loss: 0.6129, test_loss: 1.0435, test_f1: 0.6232
 epoch: 62, train_loss: 0.6275, test_loss: 1.0636, test_f1: 0.5924
 epoch: 63, train_loss: 0.6206, test_loss: 1.0710, test_f1: 0.6391
 epoch: 64, train_loss: 0.6109, test_loss: 1.0969, test_f1: 0.6240
 epoch: 65, train_loss: 0.6067, test_loss: 1.0535, test_f1: 0.6137
 epoch: 66, train_loss: 0.6140, test_loss: 1.0663, test_f1: 0.6147
 epoch: 67, train_loss: 0.5960, test_loss: 1.0776, test_f1: 0.6011
 epoch: 68, train_loss: 0.6116, test_loss: 1.0888, test_f1: 0.6006
 epoch: 69, train_loss: 0.5881, test_loss: 1.0704, test_f1: 0.6149
 epoch: 70, train_loss: 0.5992, test_loss: 1.0916, test_f1: 0.6111
 epoch: 71, train_loss: 0.6015, test_loss: 1.0663, test_f1: 0.6365
 epoch: 72, train_loss: 0.5910, test_loss: 1.0912, test_f1: 0.6084
 epoch: 73, train_loss: 0.5992, test_loss: 1.0808, test_f1: 0.6211
 epoch: 74, train_loss: 0.5841, test_loss: 1.1336, test_f1: 0.5956
 epoch: 75, train_loss: 0.5820, test_loss: 1.0782, test_f1: 0.6430
 epoch: 76, train_loss: 0.5865, test_loss: 1.1100, test_f1: 0.6089
 epoch: 77, train_loss: 0.5774, test_loss: 1.1031, test_f1: 0.6342
 epoch: 78, train_loss: 0.5639, test_loss: 1.0959, test_f1: 0.6104
 epoch: 79, train_loss: 0.5681, test_loss: 1.1017, test_f1: 0.6099
 epoch: 80, train_loss: 0.5605, test_loss: 1.1046, test_f1: 0.6033
 epoch: 81, train_loss: 0.5604, test_loss: 1.1342, test_f1: 0.5982
 epoch: 82, train_loss: 0.5641, test_loss: 1.1373, test_f1: 0.6020
 epoch: 83, train_loss: 0.5713, test_loss: 1.1216, test_f1: 0.6297
 epoch: 84, train_loss: 0.5436, test_loss: 1.1403, test_f1: 0.5902
 epoch: 85, train_loss: 0.5627, test_loss: 1.1368, test_f1: 0.6011
 epoch: 86, train_loss: 0.5388, test_loss: 1.1377, test_f1: 0.5885
 epoch: 87, train_loss: 0.5386, test_loss: 1.1651, test_f1: 0.5905
 epoch: 88, train_loss: 0.5512, test_loss: 1.1932, test_f1: 0.5939
 epoch: 89, train_loss: 0.5386, test_loss: 1.1331, test_f1: 0.6274
 epoch: 90, train_loss: 0.5496, test_loss: 1.1710, test_f1: 0.6018
 epoch: 91, train_loss: 0.5406, test_loss: 1.1907, test_f1: 0.5961
 epoch: 92, train_loss: 0.5380, test_loss: 1.1948, test_f1: 0.6020
 epoch: 93, train_loss: 0.5390, test_loss: 1.1680, test_f1: 0.6377
 epoch: 94, train_loss: 0.5395, test_loss: 1.2173, test_f1: 0.6131
 epoch: 95, train_loss: 0.5386, test_loss: 1.2211, test_f1: 0.5701
 epoch: 96, train_loss: 0.5336, test_loss: 1.1848, test_f1: 0.5948
 epoch: 97, train_loss: 0.5214, test_loss: 1.2232, test_f1: 0.5981
 epoch: 98, train_loss: 0.5096, test_loss: 1.1908, test_f1: 0.6133
 epoch: 99, train_loss: 0.5153, test_loss: 1.2475, test_f1: 0.5805
##################ITERATION #7 ****************************************
 epoch: 0, train_loss: 1.2221, test_loss: 1.2693, test_f1: 0.1743
 epoch: 1, train_loss: 1.1085, test_loss: 1.1925, test_f1: 0.4005
 epoch: 2, train_loss: 1.0669, test_loss: 1.1349, test_f1: 0.4727
 epoch: 3, train_loss: 1.0580, test_loss: 1.1120, test_f1: 0.5257
 epoch: 4, train_loss: 1.0212, test_loss: 1.0938, test_f1: 0.5198
 epoch: 5, train_loss: 1.0034, test_loss: 1.1002, test_f1: 0.5224
 epoch: 6, train_loss: 0.9905, test_loss: 1.0744, test_f1: 0.5296
 epoch: 7, train_loss: 0.9689, test_loss: 1.0483, test_f1: 0.5329
 epoch: 8, train_loss: 0.9600, test_loss: 1.0491, test_f1: 0.5349
 epoch: 9, train_loss: 0.9321, test_loss: 1.0512, test_f1: 0.5275
 epoch: 10, train_loss: 0.9365, test_loss: 1.0516, test_f1: 0.5173
 epoch: 11, train_loss: 0.9175, test_loss: 1.0484, test_f1: 0.5062
 epoch: 12, train_loss: 0.9085, test_loss: 1.0407, test_f1: 0.5081
 epoch: 13, train_loss: 0.8879, test_loss: 1.0480, test_f1: 0.5101
 epoch: 14, train_loss: 0.8804, test_loss: 1.0414, test_f1: 0.5201
 epoch: 15, train_loss: 0.8842, test_loss: 1.0315, test_f1: 0.5167
 epoch: 16, train_loss: 0.8672, test_loss: 1.0179, test_f1: 0.5364
 epoch: 17, train_loss: 0.8594, test_loss: 1.0232, test_f1: 0.5230
 epoch: 18, train_loss: 0.8584, test_loss: 1.0316, test_f1: 0.5247
 epoch: 19, train_loss: 0.8546, test_loss: 1.0244, test_f1: 0.5344
 epoch: 20, train_loss: 0.8327, test_loss: 1.0342, test_f1: 0.5597
 epoch: 21, train_loss: 0.8310, test_loss: 1.0459, test_f1: 0.5472
 epoch: 22, train_loss: 0.8313, test_loss: 1.0231, test_f1: 0.5523
 epoch: 23, train_loss: 0.8259, test_loss: 1.0280, test_f1: 0.5712
 epoch: 24, train_loss: 0.8244, test_loss: 1.0204, test_f1: 0.5873
 epoch: 25, train_loss: 0.8055, test_loss: 1.0299, test_f1: 0.5863
 epoch: 26, train_loss: 0.8094, test_loss: 1.0259, test_f1: 0.5695
 epoch: 27, train_loss: 0.7927, test_loss: 1.0225, test_f1: 0.5690
 epoch: 28, train_loss: 0.8015, test_loss: 1.0448, test_f1: 0.5765
 epoch: 29, train_loss: 0.7791, test_loss: 1.0289, test_f1: 0.6025
 epoch: 30, train_loss: 0.7915, test_loss: 1.0673, test_f1: 0.5619
 epoch: 31, train_loss: 0.7713, test_loss: 1.0157, test_f1: 0.5878
 epoch: 32, train_loss: 0.7775, test_loss: 1.0338, test_f1: 0.5761
 epoch: 33, train_loss: 0.7607, test_loss: 1.0758, test_f1: 0.5486
 epoch: 34, train_loss: 0.7562, test_loss: 1.0509, test_f1: 0.5735
 epoch: 35, train_loss: 0.7399, test_loss: 1.0723, test_f1: 0.5998
 epoch: 36, train_loss: 0.7536, test_loss: 1.0494, test_f1: 0.5811
 epoch: 37, train_loss: 0.7330, test_loss: 1.0537, test_f1: 0.6179
 epoch: 38, train_loss: 0.7417, test_loss: 1.0566, test_f1: 0.5905
 epoch: 39, train_loss: 0.7298, test_loss: 1.0704, test_f1: 0.6012
 epoch: 40, train_loss: 0.7168, test_loss: 1.0574, test_f1: 0.5979
 epoch: 41, train_loss: 0.7113, test_loss: 1.0579, test_f1: 0.6134
 epoch: 42, train_loss: 0.7090, test_loss: 1.0530, test_f1: 0.5973
 epoch: 43, train_loss: 0.6940, test_loss: 1.0596, test_f1: 0.5950
 epoch: 44, train_loss: 0.6907, test_loss: 1.0813, test_f1: 0.6107
 epoch: 45, train_loss: 0.6891, test_loss: 1.0931, test_f1: 0.5963
 epoch: 46, train_loss: 0.6955, test_loss: 1.0899, test_f1: 0.6097
 epoch: 47, train_loss: 0.7016, test_loss: 1.1032, test_f1: 0.5888
 epoch: 48, train_loss: 0.6699, test_loss: 1.1381, test_f1: 0.6065
 epoch: 49, train_loss: 0.6763, test_loss: 1.1163, test_f1: 0.6031
 epoch: 50, train_loss: 0.6557, test_loss: 1.0941, test_f1: 0.6003
 epoch: 51, train_loss: 0.6504, test_loss: 1.0905, test_f1: 0.6076
 epoch: 52, train_loss: 0.6416, test_loss: 1.1245, test_f1: 0.5946
 epoch: 53, train_loss: 0.6429, test_loss: 1.0886, test_f1: 0.6057
 epoch: 54, train_loss: 0.6577, test_loss: 1.1039, test_f1: 0.6136
 epoch: 55, train_loss: 0.6421, test_loss: 1.1289, test_f1: 0.5859
 epoch: 56, train_loss: 0.6374, test_loss: 1.1165, test_f1: 0.6112
 epoch: 57, train_loss: 0.6347, test_loss: 1.1202, test_f1: 0.6144
 epoch: 58, train_loss: 0.6258, test_loss: 1.1347, test_f1: 0.6029
 epoch: 59, train_loss: 0.6112, test_loss: 1.1341, test_f1: 0.6179
 epoch: 60, train_loss: 0.6035, test_loss: 1.1335, test_f1: 0.6182
 epoch: 61, train_loss: 0.6312, test_loss: 1.1377, test_f1: 0.6055
 epoch: 62, train_loss: 0.6003, test_loss: 1.1471, test_f1: 0.5942
 epoch: 63, train_loss: 0.6174, test_loss: 1.1480, test_f1: 0.6007
 epoch: 64, train_loss: 0.5865, test_loss: 1.1328, test_f1: 0.6043
 epoch: 65, train_loss: 0.5916, test_loss: 1.1571, test_f1: 0.6077
 epoch: 66, train_loss: 0.6020, test_loss: 1.1556, test_f1: 0.6087
 epoch: 67, train_loss: 0.5959, test_loss: 1.1768, test_f1: 0.6032
 epoch: 68, train_loss: 0.5973, test_loss: 1.1654, test_f1: 0.6014
 epoch: 69, train_loss: 0.5851, test_loss: 1.1655, test_f1: 0.6132
 epoch: 70, train_loss: 0.5865, test_loss: 1.1692, test_f1: 0.6139
 epoch: 71, train_loss: 0.5875, test_loss: 1.1823, test_f1: 0.6140
 epoch: 72, train_loss: 0.5888, test_loss: 1.2001, test_f1: 0.6028
 epoch: 73, train_loss: 0.5933, test_loss: 1.1884, test_f1: 0.5989
 epoch: 74, train_loss: 0.5773, test_loss: 1.1897, test_f1: 0.6106
 epoch: 75, train_loss: 0.5946, test_loss: 1.1771, test_f1: 0.6090
 epoch: 76, train_loss: 0.5771, test_loss: 1.2426, test_f1: 0.5864
 epoch: 77, train_loss: 0.5652, test_loss: 1.2057, test_f1: 0.6111
 epoch: 78, train_loss: 0.5762, test_loss: 1.2398, test_f1: 0.6147
 epoch: 79, train_loss: 0.5541, test_loss: 1.2398, test_f1: 0.6056
 epoch: 80, train_loss: 0.5643, test_loss: 1.2553, test_f1: 0.6088
 epoch: 81, train_loss: 0.5466, test_loss: 1.2377, test_f1: 0.6079
 epoch: 82, train_loss: 0.5539, test_loss: 1.2309, test_f1: 0.6064
 epoch: 83, train_loss: 0.5449, test_loss: 1.2659, test_f1: 0.5944
 epoch: 84, train_loss: 0.5403, test_loss: 1.2553, test_f1: 0.5989
 epoch: 85, train_loss: 0.5276, test_loss: 1.2289, test_f1: 0.5940
 epoch: 86, train_loss: 0.5463, test_loss: 1.2829, test_f1: 0.5922
 epoch: 87, train_loss: 0.5406, test_loss: 1.2440, test_f1: 0.6115
 epoch: 88, train_loss: 0.5321, test_loss: 1.2486, test_f1: 0.6135
 epoch: 89, train_loss: 0.5380, test_loss: 1.2968, test_f1: 0.5820
 epoch: 90, train_loss: 0.5233, test_loss: 1.2568, test_f1: 0.6061
 epoch: 91, train_loss: 0.5223, test_loss: 1.2571, test_f1: 0.5873
 epoch: 92, train_loss: 0.5316, test_loss: 1.2660, test_f1: 0.5945
 epoch: 93, train_loss: 0.5211, test_loss: 1.2997, test_f1: 0.5841
 epoch: 94, train_loss: 0.5254, test_loss: 1.2710, test_f1: 0.6043
 epoch: 95, train_loss: 0.5230, test_loss: 1.2874, test_f1: 0.5855
 epoch: 96, train_loss: 0.5150, test_loss: 1.3302, test_f1: 0.5574
 epoch: 97, train_loss: 0.4945, test_loss: 1.3152, test_f1: 0.5901
 epoch: 98, train_loss: 0.5077, test_loss: 1.2914, test_f1: 0.5918
 epoch: 99, train_loss: 0.5050, test_loss: 1.3370, test_f1: 0.5866
##################ITERATION #8 ****************************************
 epoch: 0, train_loss: 1.2547, test_loss: 1.2501, test_f1: 0.3460
 epoch: 1, train_loss: 1.1108, test_loss: 1.1851, test_f1: 0.4585
 epoch: 2, train_loss: 1.0902, test_loss: 1.1087, test_f1: 0.4899
 epoch: 3, train_loss: 1.0608, test_loss: 1.0928, test_f1: 0.5078
 epoch: 4, train_loss: 1.0087, test_loss: 1.0778, test_f1: 0.5200
 epoch: 5, train_loss: 0.9958, test_loss: 1.0718, test_f1: 0.5027
 epoch: 6, train_loss: 0.9891, test_loss: 1.0593, test_f1: 0.5035
 epoch: 7, train_loss: 0.9713, test_loss: 1.0557, test_f1: 0.4972
 epoch: 8, train_loss: 0.9456, test_loss: 1.0494, test_f1: 0.5027
 epoch: 9, train_loss: 0.9555, test_loss: 1.0383, test_f1: 0.5297
 epoch: 10, train_loss: 0.9355, test_loss: 1.0352, test_f1: 0.5346
 epoch: 11, train_loss: 0.9132, test_loss: 1.0350, test_f1: 0.5406
 epoch: 12, train_loss: 0.9092, test_loss: 1.0271, test_f1: 0.5378
 epoch: 13, train_loss: 0.9079, test_loss: 1.0302, test_f1: 0.5377
 epoch: 14, train_loss: 0.8852, test_loss: 1.0367, test_f1: 0.5521
 epoch: 15, train_loss: 0.8757, test_loss: 1.0359, test_f1: 0.5682
 epoch: 16, train_loss: 0.8806, test_loss: 1.0330, test_f1: 0.5318
 epoch: 17, train_loss: 0.8604, test_loss: 1.0227, test_f1: 0.5793
 epoch: 18, train_loss: 0.8432, test_loss: 1.0247, test_f1: 0.5863
 epoch: 19, train_loss: 0.8421, test_loss: 1.0290, test_f1: 0.5869
 epoch: 20, train_loss: 0.8454, test_loss: 1.0247, test_f1: 0.5814
 epoch: 21, train_loss: 0.8334, test_loss: 1.0421, test_f1: 0.5793
 epoch: 22, train_loss: 0.8262, test_loss: 1.0277, test_f1: 0.5690
 epoch: 23, train_loss: 0.8062, test_loss: 1.0199, test_f1: 0.6032
 epoch: 24, train_loss: 0.8055, test_loss: 1.0135, test_f1: 0.6117
 epoch: 25, train_loss: 0.8118, test_loss: 1.0249, test_f1: 0.5923
 epoch: 26, train_loss: 0.8052, test_loss: 1.0332, test_f1: 0.6025
 epoch: 27, train_loss: 0.7854, test_loss: 1.0284, test_f1: 0.6197
 epoch: 28, train_loss: 0.7778, test_loss: 1.0387, test_f1: 0.6213
 epoch: 29, train_loss: 0.7837, test_loss: 1.0224, test_f1: 0.6340
 epoch: 30, train_loss: 0.7632, test_loss: 1.0234, test_f1: 0.6253
 epoch: 31, train_loss: 0.7561, test_loss: 1.0375, test_f1: 0.6250
 epoch: 32, train_loss: 0.7490, test_loss: 1.0235, test_f1: 0.6438
 epoch: 33, train_loss: 0.7508, test_loss: 1.0151, test_f1: 0.6488
 epoch: 34, train_loss: 0.7473, test_loss: 1.0378, test_f1: 0.6525
 epoch: 35, train_loss: 0.7300, test_loss: 1.0456, test_f1: 0.6454
 epoch: 36, train_loss: 0.7164, test_loss: 1.0485, test_f1: 0.6387
 epoch: 37, train_loss: 0.7379, test_loss: 1.0505, test_f1: 0.6476
 epoch: 38, train_loss: 0.7190, test_loss: 1.0476, test_f1: 0.6237
 epoch: 39, train_loss: 0.7107, test_loss: 1.0599, test_f1: 0.6422
 epoch: 40, train_loss: 0.6833, test_loss: 1.0323, test_f1: 0.6528
 epoch: 41, train_loss: 0.7145, test_loss: 1.0642, test_f1: 0.6417
 epoch: 42, train_loss: 0.7030, test_loss: 1.0630, test_f1: 0.6618
 epoch: 43, train_loss: 0.6922, test_loss: 1.0964, test_f1: 0.6507
 epoch: 44, train_loss: 0.6832, test_loss: 1.0831, test_f1: 0.6698
 epoch: 45, train_loss: 0.6782, test_loss: 1.0934, test_f1: 0.6480
 epoch: 46, train_loss: 0.6819, test_loss: 1.0917, test_f1: 0.6308
 epoch: 47, train_loss: 0.6731, test_loss: 1.1079, test_f1: 0.6459
 epoch: 48, train_loss: 0.6667, test_loss: 1.1037, test_f1: 0.6446
 epoch: 49, train_loss: 0.6442, test_loss: 1.0832, test_f1: 0.6487
 epoch: 50, train_loss: 0.6411, test_loss: 1.0972, test_f1: 0.6762
 epoch: 51, train_loss: 0.6382, test_loss: 1.0935, test_f1: 0.6771
 epoch: 52, train_loss: 0.6262, test_loss: 1.0959, test_f1: 0.6862
 epoch: 53, train_loss: 0.6231, test_loss: 1.1186, test_f1: 0.6850
 epoch: 54, train_loss: 0.6255, test_loss: 1.1246, test_f1: 0.6728
 epoch: 55, train_loss: 0.6238, test_loss: 1.1292, test_f1: 0.6826
 epoch: 56, train_loss: 0.6239, test_loss: 1.1268, test_f1: 0.6612
 epoch: 57, train_loss: 0.6212, test_loss: 1.1459, test_f1: 0.6476
 epoch: 58, train_loss: 0.6160, test_loss: 1.1486, test_f1: 0.6731
 epoch: 59, train_loss: 0.6128, test_loss: 1.1529, test_f1: 0.6565
 epoch: 60, train_loss: 0.6061, test_loss: 1.1479, test_f1: 0.6506
 epoch: 61, train_loss: 0.6273, test_loss: 1.1575, test_f1: 0.6368
 epoch: 62, train_loss: 0.5956, test_loss: 1.1626, test_f1: 0.6774
 epoch: 63, train_loss: 0.6288, test_loss: 1.1429, test_f1: 0.6799
 epoch: 64, train_loss: 0.5888, test_loss: 1.1568, test_f1: 0.6645
 epoch: 65, train_loss: 0.5940, test_loss: 1.1597, test_f1: 0.6803
 epoch: 66, train_loss: 0.5897, test_loss: 1.1524, test_f1: 0.6739
 epoch: 67, train_loss: 0.5764, test_loss: 1.1477, test_f1: 0.6819
 epoch: 68, train_loss: 0.5896, test_loss: 1.1567, test_f1: 0.6767
 epoch: 69, train_loss: 0.5725, test_loss: 1.1825, test_f1: 0.6734
 epoch: 70, train_loss: 0.5573, test_loss: 1.1959, test_f1: 0.6671
 epoch: 71, train_loss: 0.5731, test_loss: 1.1886, test_f1: 0.6715
 epoch: 72, train_loss: 0.5716, test_loss: 1.2374, test_f1: 0.6402
 epoch: 73, train_loss: 0.5720, test_loss: 1.2002, test_f1: 0.6756
 epoch: 74, train_loss: 0.5607, test_loss: 1.1818, test_f1: 0.6947
 epoch: 75, train_loss: 0.5841, test_loss: 1.2215, test_f1: 0.6635
 epoch: 76, train_loss: 0.5571, test_loss: 1.1964, test_f1: 0.6980
 epoch: 77, train_loss: 0.5697, test_loss: 1.2221, test_f1: 0.6666
 epoch: 78, train_loss: 0.5556, test_loss: 1.2101, test_f1: 0.6818
 epoch: 79, train_loss: 0.5518, test_loss: 1.1972, test_f1: 0.6729
 epoch: 80, train_loss: 0.5394, test_loss: 1.2523, test_f1: 0.6563
 epoch: 81, train_loss: 0.5461, test_loss: 1.2378, test_f1: 0.6783
 epoch: 82, train_loss: 0.5434, test_loss: 1.2266, test_f1: 0.6716
 epoch: 83, train_loss: 0.5305, test_loss: 1.2376, test_f1: 0.6691
 epoch: 84, train_loss: 0.5425, test_loss: 1.2470, test_f1: 0.6790
 epoch: 85, train_loss: 0.5499, test_loss: 1.2957, test_f1: 0.6731
 epoch: 86, train_loss: 0.5401, test_loss: 1.2519, test_f1: 0.6589
 epoch: 87, train_loss: 0.5286, test_loss: 1.2459, test_f1: 0.6775
 epoch: 88, train_loss: 0.5269, test_loss: 1.2873, test_f1: 0.6501
 epoch: 89, train_loss: 0.5309, test_loss: 1.3129, test_f1: 0.6684
 epoch: 90, train_loss: 0.5120, test_loss: 1.2902, test_f1: 0.6589
 epoch: 91, train_loss: 0.4992, test_loss: 1.2662, test_f1: 0.6524
 epoch: 92, train_loss: 0.5239, test_loss: 1.2753, test_f1: 0.6705
 epoch: 93, train_loss: 0.5212, test_loss: 1.2837, test_f1: 0.6537
 epoch: 94, train_loss: 0.5312, test_loss: 1.2606, test_f1: 0.6611
 epoch: 95, train_loss: 0.5196, test_loss: 1.2656, test_f1: 0.6849
 epoch: 96, train_loss: 0.5222, test_loss: 1.3263, test_f1: 0.6614
 epoch: 97, train_loss: 0.5009, test_loss: 1.2673, test_f1: 0.6943
 epoch: 98, train_loss: 0.4927, test_loss: 1.3053, test_f1: 0.6612
 epoch: 99, train_loss: 0.4983, test_loss: 1.3149, test_f1: 0.6621
##################ITERATION #9 ****************************************
 epoch: 0, train_loss: 1.3120, test_loss: 1.3564, test_f1: 0.1365
 epoch: 1, train_loss: 1.1474, test_loss: 1.1746, test_f1: 0.4364
 epoch: 2, train_loss: 1.0790, test_loss: 1.1129, test_f1: 0.4935
 epoch: 3, train_loss: 1.0804, test_loss: 1.1230, test_f1: 0.4698
 epoch: 4, train_loss: 1.0519, test_loss: 1.1248, test_f1: 0.4516
 epoch: 5, train_loss: 1.0355, test_loss: 1.1340, test_f1: 0.4617
 epoch: 6, train_loss: 1.0078, test_loss: 1.1272, test_f1: 0.4550
 epoch: 7, train_loss: 0.9829, test_loss: 1.1580, test_f1: 0.4789
 epoch: 8, train_loss: 0.9700, test_loss: 1.1461, test_f1: 0.5007
 epoch: 9, train_loss: 0.9578, test_loss: 1.1394, test_f1: 0.4790
 epoch: 10, train_loss: 0.9542, test_loss: 1.1204, test_f1: 0.5094
 epoch: 11, train_loss: 0.9279, test_loss: 1.1069, test_f1: 0.5058
 epoch: 12, train_loss: 0.9155, test_loss: 1.1047, test_f1: 0.5276
 epoch: 13, train_loss: 0.8978, test_loss: 1.0996, test_f1: 0.5213
 epoch: 14, train_loss: 0.8984, test_loss: 1.1094, test_f1: 0.5317
 epoch: 15, train_loss: 0.8854, test_loss: 1.1050, test_f1: 0.5412
 epoch: 16, train_loss: 0.8807, test_loss: 1.1113, test_f1: 0.5583
 epoch: 17, train_loss: 0.8598, test_loss: 1.0893, test_f1: 0.5694
 epoch: 18, train_loss: 0.8763, test_loss: 1.1177, test_f1: 0.5345
 epoch: 19, train_loss: 0.8597, test_loss: 1.1052, test_f1: 0.5768
 epoch: 20, train_loss: 0.8382, test_loss: 1.1175, test_f1: 0.5696
 epoch: 21, train_loss: 0.8442, test_loss: 1.1156, test_f1: 0.5872
 epoch: 22, train_loss: 0.8269, test_loss: 1.1272, test_f1: 0.5694
 epoch: 23, train_loss: 0.8185, test_loss: 1.1083, test_f1: 0.5784
 epoch: 24, train_loss: 0.8150, test_loss: 1.1483, test_f1: 0.5790
 epoch: 25, train_loss: 0.8115, test_loss: 1.1682, test_f1: 0.5727
 epoch: 26, train_loss: 0.8158, test_loss: 1.1607, test_f1: 0.5793
 epoch: 27, train_loss: 0.7965, test_loss: 1.1840, test_f1: 0.5860
 epoch: 28, train_loss: 0.7960, test_loss: 1.1795, test_f1: 0.5984
 epoch: 29, train_loss: 0.7877, test_loss: 1.1410, test_f1: 0.5947
 epoch: 30, train_loss: 0.7883, test_loss: 1.1237, test_f1: 0.5905
 epoch: 31, train_loss: 0.7606, test_loss: 1.1202, test_f1: 0.6080
 epoch: 32, train_loss: 0.7822, test_loss: 1.1363, test_f1: 0.6301
 epoch: 33, train_loss: 0.7767, test_loss: 1.1317, test_f1: 0.6132
 epoch: 34, train_loss: 0.7604, test_loss: 1.1671, test_f1: 0.6308
 epoch: 35, train_loss: 0.7623, test_loss: 1.1950, test_f1: 0.6144
 epoch: 36, train_loss: 0.7445, test_loss: 1.1508, test_f1: 0.6222
 epoch: 37, train_loss: 0.7363, test_loss: 1.1327, test_f1: 0.6121
 epoch: 38, train_loss: 0.7498, test_loss: 1.1695, test_f1: 0.6200
 epoch: 39, train_loss: 0.7315, test_loss: 1.1687, test_f1: 0.6286
 epoch: 40, train_loss: 0.7324, test_loss: 1.1514, test_f1: 0.6259
 epoch: 41, train_loss: 0.7217, test_loss: 1.1991, test_f1: 0.6216
 epoch: 42, train_loss: 0.7054, test_loss: 1.1546, test_f1: 0.6048
 epoch: 43, train_loss: 0.7253, test_loss: 1.1674, test_f1: 0.6137
 epoch: 44, train_loss: 0.7193, test_loss: 1.1797, test_f1: 0.6076
 epoch: 45, train_loss: 0.7003, test_loss: 1.1706, test_f1: 0.6155
 epoch: 46, train_loss: 0.7086, test_loss: 1.1751, test_f1: 0.5897
 epoch: 47, train_loss: 0.6834, test_loss: 1.1699, test_f1: 0.6189
 epoch: 48, train_loss: 0.6836, test_loss: 1.1496, test_f1: 0.6266
 epoch: 49, train_loss: 0.6864, test_loss: 1.1921, test_f1: 0.6238
 epoch: 50, train_loss: 0.6742, test_loss: 1.1725, test_f1: 0.6184
 epoch: 51, train_loss: 0.6653, test_loss: 1.1899, test_f1: 0.6084
 epoch: 52, train_loss: 0.6634, test_loss: 1.1688, test_f1: 0.6423
 epoch: 53, train_loss: 0.6662, test_loss: 1.1526, test_f1: 0.6446
 epoch: 54, train_loss: 0.6628, test_loss: 1.1698, test_f1: 0.6369
 epoch: 55, train_loss: 0.6441, test_loss: 1.2077, test_f1: 0.6265
 epoch: 56, train_loss: 0.6469, test_loss: 1.2434, test_f1: 0.6133
 epoch: 57, train_loss: 0.6462, test_loss: 1.2238, test_f1: 0.6389
 epoch: 58, train_loss: 0.6391, test_loss: 1.2284, test_f1: 0.6393
 epoch: 59, train_loss: 0.6455, test_loss: 1.2236, test_f1: 0.6265
 epoch: 60, train_loss: 0.6195, test_loss: 1.2434, test_f1: 0.6289
 epoch: 61, train_loss: 0.6237, test_loss: 1.2436, test_f1: 0.6424
 epoch: 62, train_loss: 0.6439, test_loss: 1.2575, test_f1: 0.6318
 epoch: 63, train_loss: 0.6464, test_loss: 1.2489, test_f1: 0.6164
 epoch: 64, train_loss: 0.6348, test_loss: 1.2419, test_f1: 0.6445
 epoch: 65, train_loss: 0.6242, test_loss: 1.2430, test_f1: 0.6241
 epoch: 66, train_loss: 0.6169, test_loss: 1.2497, test_f1: 0.6188
 epoch: 67, train_loss: 0.6133, test_loss: 1.2353, test_f1: 0.6344
 epoch: 68, train_loss: 0.6042, test_loss: 1.2431, test_f1: 0.6344
 epoch: 69, train_loss: 0.6094, test_loss: 1.2804, test_f1: 0.6290
 epoch: 70, train_loss: 0.6108, test_loss: 1.2724, test_f1: 0.6344
 epoch: 71, train_loss: 0.6182, test_loss: 1.2561, test_f1: 0.6294
 epoch: 72, train_loss: 0.6186, test_loss: 1.2614, test_f1: 0.6238
 epoch: 73, train_loss: 0.6015, test_loss: 1.2591, test_f1: 0.6290
 epoch: 74, train_loss: 0.6047, test_loss: 1.2653, test_f1: 0.6313
 epoch: 75, train_loss: 0.5860, test_loss: 1.2790, test_f1: 0.6243
 epoch: 76, train_loss: 0.5800, test_loss: 1.2688, test_f1: 0.6344
 epoch: 77, train_loss: 0.5869, test_loss: 1.2574, test_f1: 0.6343
 epoch: 78, train_loss: 0.5947, test_loss: 1.2718, test_f1: 0.6268
 epoch: 79, train_loss: 0.5850, test_loss: 1.2723, test_f1: 0.6396
 epoch: 80, train_loss: 0.5769, test_loss: 1.2722, test_f1: 0.6343
 epoch: 81, train_loss: 0.5906, test_loss: 1.2766, test_f1: 0.6217
 epoch: 82, train_loss: 0.5625, test_loss: 1.2619, test_f1: 0.6451
 epoch: 83, train_loss: 0.5821, test_loss: 1.2867, test_f1: 0.6238
 epoch: 84, train_loss: 0.5583, test_loss: 1.3234, test_f1: 0.6262
 epoch: 85, train_loss: 0.5600, test_loss: 1.2940, test_f1: 0.6343
 epoch: 86, train_loss: 0.5865, test_loss: 1.3387, test_f1: 0.6237
 epoch: 87, train_loss: 0.5727, test_loss: 1.3268, test_f1: 0.6343
 epoch: 88, train_loss: 0.5727, test_loss: 1.3273, test_f1: 0.6444
 epoch: 89, train_loss: 0.5764, test_loss: 1.3345, test_f1: 0.6289
 epoch: 90, train_loss: 0.5552, test_loss: 1.3266, test_f1: 0.6340
 epoch: 91, train_loss: 0.5442, test_loss: 1.3311, test_f1: 0.6235
 epoch: 92, train_loss: 0.5468, test_loss: 1.3110, test_f1: 0.6315
 epoch: 93, train_loss: 0.5553, test_loss: 1.3377, test_f1: 0.6341
 epoch: 94, train_loss: 0.5561, test_loss: 1.3681, test_f1: 0.6421
 epoch: 95, train_loss: 0.5561, test_loss: 1.3607, test_f1: 0.6346
 epoch: 96, train_loss: 0.5599, test_loss: 1.3432, test_f1: 0.6365
 epoch: 97, train_loss: 0.5300, test_loss: 1.3422, test_f1: 0.6287
 epoch: 98, train_loss: 0.5447, test_loss: 1.3711, test_f1: 0.6344
 epoch: 99, train_loss: 0.5292, test_loss: 1.3661, test_f1: 0.6394

Training completed in 378.83 seconds
Best F1: 0.6980 at epoch 76
Mean F1 across iterations: 0.6395  0.0261
========================FINAL RESULTS================================
FEGIN weighted F1: 0.6980  0.0261
python main.py --data ltspice_demos --representation component_net --model FEGIN --layers 2 --hiddens 128 --batch_size 64 --lr 0.0001 --emb_size 128 --epochs 100 --save_appendix component_net_L2_H128_BS64_LR0.0001_E128 --no_val
-----



STDERR:
  File "main.py", line 370, in <module>
    main()
  File "main.py", line 254, in main
    dataset = dataset_class(
  File "/home/philip/projects/ltspice_examples_code_repo/Circuit-Completion-Using-GNNs/component_classification_with_link_prediction_head/evaluation/FEGIN/kernel/circuit_datasets.py", line 15, in __init__
    self.data, self.slices = torch.load(self.processed_paths[0])
  File "/home/philip/.local/lib/python3.8/site-packages/torch/serialization.py", line 1040, in load
    warnings.warn(
  File "/usr/lib/python3.8/warnings.py", line 109, in _showwarnmsg
    sw(msg.message, msg.category, msg.filename, msg.lineno,
  File "main.py", line 47, in warn_with_traceback
    traceback.print_stack(file=log)
/home/philip/projects/ltspice_examples_code_repo/Circuit-Completion-Using-GNNs/component_classification_with_link_prediction_head/evaluation/FEGIN/kernel/circuit_datasets.py:15: FutureWarning: You are using `torch.load` with `weights_only=False` (the current default value), which uses the default pickle module implicitly. It is possible to construct malicious pickle data which will execute arbitrary code during unpickling (See https://github.com/pytorch/pytorch/blob/main/SECURITY.md#untrusted-models for more details). In a future release, the default value for `weights_only` will be flipped to `True`. This limits the functions that could be executed during unpickling. Arbitrary objects will no longer be allowed to be loaded via this mode unless they are explicitly allowlisted by the user via `torch.serialization.add_safe_globals`. We recommend you start setting `weights_only=True` for any use case where you don't have full control of the loaded file. Please open an issue on GitHub for any issues related to this experimental feature.
  self.data, self.slices = torch.load(self.processed_paths[0])
