STDOUT:
Results will be saved in /home/philip/projects/ltspice_examples_code_repo/Circuit-Completion-Using-GNNs/component_classification_with_link_prediction_head/evaluation/FEGIN/results/model_FEGIN_dataset_ltspice_examples
Command line input: python main.py --data ltspice_examples --representation component_pin --model FEGIN --layers 3 --hiddens 64 --batch_size 64 --lr 0.001 --emb_size 250 --epochs 100 --save_appendix component_pin_L3_H64_BS64_LR0.001_E250 --no_val
 is saved.
-----
ltspice_examples - FEGIN
Using 3 layers, 64 hidden units, h = 2
Loading component_pin representation dataset
ENTERED
Training FEGIN on component_pin representation
Train: 3560, Test: 848
##################ITERATION #0 ****************************************
 epoch: 0, train_loss: 1.2404, test_loss: 1.1848, test_f1: 0.3533
 epoch: 1, train_loss: 1.0422, test_loss: 1.0601, test_f1: 0.3698
 epoch: 2, train_loss: 1.0231, test_loss: 1.0500, test_f1: 0.4930
 epoch: 3, train_loss: 0.9847, test_loss: 1.0300, test_f1: 0.4979
 epoch: 4, train_loss: 0.9585, test_loss: 1.0385, test_f1: 0.4908
 epoch: 5, train_loss: 0.9197, test_loss: 1.0473, test_f1: 0.4697
 epoch: 6, train_loss: 0.9019, test_loss: 0.9749, test_f1: 0.4875
 epoch: 7, train_loss: 0.8609, test_loss: 0.9171, test_f1: 0.5351
 epoch: 8, train_loss: 0.8447, test_loss: 0.9159, test_f1: 0.5551
 epoch: 9, train_loss: 0.8206, test_loss: 1.0200, test_f1: 0.4778
 epoch: 10, train_loss: 0.8083, test_loss: 0.8876, test_f1: 0.5546
 epoch: 11, train_loss: 0.7790, test_loss: 0.8876, test_f1: 0.5867
 epoch: 12, train_loss: 0.7674, test_loss: 0.9065, test_f1: 0.6030
 epoch: 13, train_loss: 0.7626, test_loss: 0.9018, test_f1: 0.5867
 epoch: 14, train_loss: 0.7399, test_loss: 0.9067, test_f1: 0.5933
 epoch: 15, train_loss: 0.7414, test_loss: 0.9585, test_f1: 0.5832
 epoch: 16, train_loss: 0.7207, test_loss: 0.8783, test_f1: 0.5802
 epoch: 17, train_loss: 0.6963, test_loss: 0.8443, test_f1: 0.5902
 epoch: 18, train_loss: 0.6963, test_loss: 0.8949, test_f1: 0.5969
 epoch: 19, train_loss: 0.6781, test_loss: 0.9754, test_f1: 0.5873
 epoch: 20, train_loss: 0.6675, test_loss: 0.9250, test_f1: 0.6134
 epoch: 21, train_loss: 0.6688, test_loss: 0.9269, test_f1: 0.5976
 epoch: 22, train_loss: 0.6395, test_loss: 0.8870, test_f1: 0.6184
 epoch: 23, train_loss: 0.6344, test_loss: 0.8374, test_f1: 0.6178
 epoch: 24, train_loss: 0.6219, test_loss: 0.9711, test_f1: 0.5896
 epoch: 25, train_loss: 0.6236, test_loss: 0.9229, test_f1: 0.6254
 epoch: 26, train_loss: 0.6247, test_loss: 0.8420, test_f1: 0.6591
 epoch: 27, train_loss: 0.6217, test_loss: 0.9798, test_f1: 0.5879
 epoch: 28, train_loss: 0.5996, test_loss: 0.9513, test_f1: 0.6313
 epoch: 29, train_loss: 0.5802, test_loss: 1.1171, test_f1: 0.6118
 epoch: 30, train_loss: 0.5913, test_loss: 1.0319, test_f1: 0.5883
 epoch: 31, train_loss: 0.5618, test_loss: 0.9863, test_f1: 0.6385
 epoch: 32, train_loss: 0.5873, test_loss: 0.9867, test_f1: 0.6298
 epoch: 33, train_loss: 0.5598, test_loss: 1.0530, test_f1: 0.5567
 epoch: 34, train_loss: 0.5627, test_loss: 1.1922, test_f1: 0.5873
 epoch: 35, train_loss: 0.5408, test_loss: 0.9239, test_f1: 0.6639
 epoch: 36, train_loss: 0.5272, test_loss: 1.0542, test_f1: 0.6266
 epoch: 37, train_loss: 0.5431, test_loss: 0.9230, test_f1: 0.6246
 epoch: 38, train_loss: 0.5301, test_loss: 1.1238, test_f1: 0.6126
 epoch: 39, train_loss: 0.5144, test_loss: 0.9447, test_f1: 0.6501
 epoch: 40, train_loss: 0.5050, test_loss: 0.9353, test_f1: 0.6328
 epoch: 41, train_loss: 0.5204, test_loss: 0.8728, test_f1: 0.6635
 epoch: 42, train_loss: 0.5012, test_loss: 1.0577, test_f1: 0.6084
 epoch: 43, train_loss: 0.4943, test_loss: 1.1097, test_f1: 0.6076
 epoch: 44, train_loss: 0.4997, test_loss: 1.0010, test_f1: 0.6433
 epoch: 45, train_loss: 0.4683, test_loss: 1.0970, test_f1: 0.6344
 epoch: 46, train_loss: 0.4656, test_loss: 1.0989, test_f1: 0.6665
 epoch: 47, train_loss: 0.4584, test_loss: 1.1936, test_f1: 0.6620
 epoch: 48, train_loss: 0.5007, test_loss: 1.0861, test_f1: 0.6315
 epoch: 49, train_loss: 0.4616, test_loss: 0.9653, test_f1: 0.6624
 epoch: 50, train_loss: 0.4601, test_loss: 1.1439, test_f1: 0.6549
 epoch: 51, train_loss: 0.4143, test_loss: 1.1117, test_f1: 0.6656
 epoch: 52, train_loss: 0.4106, test_loss: 1.1466, test_f1: 0.6419
 epoch: 53, train_loss: 0.3831, test_loss: 1.1158, test_f1: 0.6522
 epoch: 54, train_loss: 0.3796, test_loss: 1.1055, test_f1: 0.6661
 epoch: 55, train_loss: 0.3763, test_loss: 1.1034, test_f1: 0.6657
 epoch: 56, train_loss: 0.3818, test_loss: 1.2882, test_f1: 0.6252
 epoch: 57, train_loss: 0.3703, test_loss: 1.1731, test_f1: 0.6410
 epoch: 58, train_loss: 0.3618, test_loss: 1.2100, test_f1: 0.6691
 epoch: 59, train_loss: 0.3406, test_loss: 1.1315, test_f1: 0.6636
 epoch: 60, train_loss: 0.3696, test_loss: 1.1217, test_f1: 0.6730
 epoch: 61, train_loss: 0.3617, test_loss: 1.2918, test_f1: 0.6534
 epoch: 62, train_loss: 0.3529, test_loss: 1.2029, test_f1: 0.6636
 epoch: 63, train_loss: 0.3466, test_loss: 1.1684, test_f1: 0.6617
 epoch: 64, train_loss: 0.3286, test_loss: 1.1921, test_f1: 0.6654
 epoch: 65, train_loss: 0.3317, test_loss: 1.3138, test_f1: 0.6603
 epoch: 66, train_loss: 0.3484, test_loss: 1.3691, test_f1: 0.6711
 epoch: 67, train_loss: 0.3438, test_loss: 1.2130, test_f1: 0.6567
 epoch: 68, train_loss: 0.3223, test_loss: 1.3788, test_f1: 0.6461
 epoch: 69, train_loss: 0.3067, test_loss: 1.3909, test_f1: 0.6466
 epoch: 70, train_loss: 0.3310, test_loss: 1.2634, test_f1: 0.6781
 epoch: 71, train_loss: 0.3175, test_loss: 1.2948, test_f1: 0.6811
 epoch: 72, train_loss: 0.3015, test_loss: 1.3053, test_f1: 0.6684
 epoch: 73, train_loss: 0.3141, test_loss: 1.6032, test_f1: 0.6289
 epoch: 74, train_loss: 0.3185, test_loss: 1.3350, test_f1: 0.6684
 epoch: 75, train_loss: 0.3123, test_loss: 1.3584, test_f1: 0.6812
 epoch: 76, train_loss: 0.2954, test_loss: 1.3283, test_f1: 0.6816
 epoch: 77, train_loss: 0.3014, test_loss: 1.3022, test_f1: 0.6891
 epoch: 78, train_loss: 0.2886, test_loss: 1.4569, test_f1: 0.6656
 epoch: 79, train_loss: 0.2779, test_loss: 1.3523, test_f1: 0.6590
 epoch: 80, train_loss: 0.3046, test_loss: 1.3383, test_f1: 0.6632
 epoch: 81, train_loss: 0.2925, test_loss: 1.5076, test_f1: 0.6691
 epoch: 82, train_loss: 0.2767, test_loss: 1.4572, test_f1: 0.6751
 epoch: 83, train_loss: 0.2849, test_loss: 1.4207, test_f1: 0.6501
 epoch: 84, train_loss: 0.2869, test_loss: 1.4423, test_f1: 0.6690
 epoch: 85, train_loss: 0.2936, test_loss: 1.4618, test_f1: 0.6656
 epoch: 86, train_loss: 0.2780, test_loss: 1.3575, test_f1: 0.6618
 epoch: 87, train_loss: 0.2805, test_loss: 1.4053, test_f1: 0.6618
 epoch: 88, train_loss: 0.2632, test_loss: 1.5433, test_f1: 0.6540
 epoch: 89, train_loss: 0.2703, test_loss: 1.5168, test_f1: 0.6745
 epoch: 90, train_loss: 0.2626, test_loss: 1.5375, test_f1: 0.6724
 epoch: 91, train_loss: 0.2620, test_loss: 1.5808, test_f1: 0.6403
 epoch: 92, train_loss: 0.2524, test_loss: 1.5615, test_f1: 0.6644
 epoch: 93, train_loss: 0.2583, test_loss: 1.4581, test_f1: 0.6785
 epoch: 94, train_loss: 0.2658, test_loss: 1.6688, test_f1: 0.6489
 epoch: 95, train_loss: 0.2723, test_loss: 1.5242, test_f1: 0.6777
 epoch: 96, train_loss: 0.2570, test_loss: 1.5671, test_f1: 0.6676
 epoch: 97, train_loss: 0.2471, test_loss: 1.5897, test_f1: 0.6881
 epoch: 98, train_loss: 0.2463, test_loss: 1.5626, test_f1: 0.6987
 epoch: 99, train_loss: 0.2422, test_loss: 1.6332, test_f1: 0.6701
##################ITERATION #1 ****************************************
 epoch: 0, train_loss: 1.1475, test_loss: 1.0707, test_f1: 0.3610
 epoch: 1, train_loss: 0.9687, test_loss: 1.1011, test_f1: 0.4674
 epoch: 2, train_loss: 0.9451, test_loss: 1.0047, test_f1: 0.5154
 epoch: 3, train_loss: 0.9066, test_loss: 0.9559, test_f1: 0.5036
 epoch: 4, train_loss: 0.8784, test_loss: 1.0218, test_f1: 0.5082
 epoch: 5, train_loss: 0.8415, test_loss: 0.9970, test_f1: 0.5192
 epoch: 6, train_loss: 0.8198, test_loss: 1.0769, test_f1: 0.4931
 epoch: 7, train_loss: 0.8174, test_loss: 0.9802, test_f1: 0.5511
 epoch: 8, train_loss: 0.7787, test_loss: 0.9067, test_f1: 0.5682
 epoch: 9, train_loss: 0.7651, test_loss: 0.9457, test_f1: 0.5530
 epoch: 10, train_loss: 0.7478, test_loss: 0.8970, test_f1: 0.5439
 epoch: 11, train_loss: 0.7342, test_loss: 0.9112, test_f1: 0.5512
 epoch: 12, train_loss: 0.7339, test_loss: 0.9330, test_f1: 0.5881
 epoch: 13, train_loss: 0.7251, test_loss: 0.9005, test_f1: 0.6108
 epoch: 14, train_loss: 0.7031, test_loss: 0.9207, test_f1: 0.5951
 epoch: 15, train_loss: 0.6902, test_loss: 0.8995, test_f1: 0.6017
 epoch: 16, train_loss: 0.6834, test_loss: 0.8374, test_f1: 0.5570
 epoch: 17, train_loss: 0.6738, test_loss: 0.8344, test_f1: 0.6109
 epoch: 18, train_loss: 0.6559, test_loss: 1.1615, test_f1: 0.5526
 epoch: 19, train_loss: 0.6599, test_loss: 0.9530, test_f1: 0.5908
 epoch: 20, train_loss: 0.6417, test_loss: 0.9474, test_f1: 0.6069
 epoch: 21, train_loss: 0.6464, test_loss: 0.9263, test_f1: 0.6033
 epoch: 22, train_loss: 0.6145, test_loss: 0.9334, test_f1: 0.6041
 epoch: 23, train_loss: 0.6081, test_loss: 0.9392, test_f1: 0.6080
 epoch: 24, train_loss: 0.6101, test_loss: 0.8751, test_f1: 0.5932
 epoch: 25, train_loss: 0.6131, test_loss: 1.0292, test_f1: 0.5848
 epoch: 26, train_loss: 0.5974, test_loss: 0.9397, test_f1: 0.6125
 epoch: 27, train_loss: 0.5724, test_loss: 0.9269, test_f1: 0.6206
 epoch: 28, train_loss: 0.5815, test_loss: 0.9423, test_f1: 0.6381
 epoch: 29, train_loss: 0.5830, test_loss: 0.9063, test_f1: 0.6228
 epoch: 30, train_loss: 0.5797, test_loss: 0.9215, test_f1: 0.6203
 epoch: 31, train_loss: 0.5566, test_loss: 0.8355, test_f1: 0.6456
 epoch: 32, train_loss: 0.5684, test_loss: 0.8107, test_f1: 0.6414
 epoch: 33, train_loss: 0.5489, test_loss: 0.9261, test_f1: 0.6249
 epoch: 34, train_loss: 0.5342, test_loss: 0.8748, test_f1: 0.6345
 epoch: 35, train_loss: 0.5277, test_loss: 0.9007, test_f1: 0.6266
 epoch: 36, train_loss: 0.5349, test_loss: 0.9727, test_f1: 0.6241
 epoch: 37, train_loss: 0.5202, test_loss: 0.9691, test_f1: 0.6102
 epoch: 38, train_loss: 0.5267, test_loss: 0.8636, test_f1: 0.6336
 epoch: 39, train_loss: 0.5008, test_loss: 0.9534, test_f1: 0.6323
 epoch: 40, train_loss: 0.4988, test_loss: 1.0193, test_f1: 0.6318
 epoch: 41, train_loss: 0.4821, test_loss: 0.9732, test_f1: 0.6359
 epoch: 42, train_loss: 0.5052, test_loss: 0.9429, test_f1: 0.6314
 epoch: 43, train_loss: 0.5026, test_loss: 0.9926, test_f1: 0.6422
 epoch: 44, train_loss: 0.4889, test_loss: 1.0736, test_f1: 0.6198
 epoch: 45, train_loss: 0.4915, test_loss: 1.0364, test_f1: 0.6308
 epoch: 46, train_loss: 0.4780, test_loss: 1.0655, test_f1: 0.6272
 epoch: 47, train_loss: 0.4466, test_loss: 1.0656, test_f1: 0.6084
 epoch: 48, train_loss: 0.4648, test_loss: 1.0742, test_f1: 0.6289
 epoch: 49, train_loss: 0.4439, test_loss: 1.0638, test_f1: 0.6607
 epoch: 50, train_loss: 0.4708, test_loss: 1.0682, test_f1: 0.6290
 epoch: 51, train_loss: 0.4159, test_loss: 1.0792, test_f1: 0.6476
 epoch: 52, train_loss: 0.3861, test_loss: 1.0772, test_f1: 0.6223
 epoch: 53, train_loss: 0.3823, test_loss: 1.0380, test_f1: 0.6509
 epoch: 54, train_loss: 0.3826, test_loss: 1.2118, test_f1: 0.6533
 epoch: 55, train_loss: 0.3542, test_loss: 1.0973, test_f1: 0.6549
 epoch: 56, train_loss: 0.3705, test_loss: 1.0801, test_f1: 0.6731
 epoch: 57, train_loss: 0.3577, test_loss: 1.1772, test_f1: 0.6216
 epoch: 58, train_loss: 0.3567, test_loss: 1.1387, test_f1: 0.6526
 epoch: 59, train_loss: 0.3506, test_loss: 1.2155, test_f1: 0.6308
 epoch: 60, train_loss: 0.3632, test_loss: 1.2090, test_f1: 0.6407
 epoch: 61, train_loss: 0.3512, test_loss: 1.1394, test_f1: 0.6520
 epoch: 62, train_loss: 0.3211, test_loss: 1.3543, test_f1: 0.6232
 epoch: 63, train_loss: 0.3370, test_loss: 1.3303, test_f1: 0.6317
 epoch: 64, train_loss: 0.3330, test_loss: 1.2220, test_f1: 0.6336
 epoch: 65, train_loss: 0.3309, test_loss: 1.3244, test_f1: 0.6263
 epoch: 66, train_loss: 0.3314, test_loss: 1.2732, test_f1: 0.6360
 epoch: 67, train_loss: 0.3167, test_loss: 1.3201, test_f1: 0.6406
 epoch: 68, train_loss: 0.3178, test_loss: 1.4084, test_f1: 0.6295
 epoch: 69, train_loss: 0.3145, test_loss: 1.3091, test_f1: 0.6334
 epoch: 70, train_loss: 0.3174, test_loss: 1.3934, test_f1: 0.6053
 epoch: 71, train_loss: 0.3162, test_loss: 1.3513, test_f1: 0.6410
 epoch: 72, train_loss: 0.3138, test_loss: 1.3828, test_f1: 0.6415
 epoch: 73, train_loss: 0.3103, test_loss: 1.3881, test_f1: 0.6375
 epoch: 74, train_loss: 0.3254, test_loss: 1.5354, test_f1: 0.6240
 epoch: 75, train_loss: 0.3008, test_loss: 1.3585, test_f1: 0.6153
 epoch: 76, train_loss: 0.2871, test_loss: 1.3599, test_f1: 0.6401
 epoch: 77, train_loss: 0.3010, test_loss: 1.4005, test_f1: 0.6346
 epoch: 78, train_loss: 0.2838, test_loss: 1.4081, test_f1: 0.6528
 epoch: 79, train_loss: 0.2853, test_loss: 1.4483, test_f1: 0.6299
 epoch: 80, train_loss: 0.2965, test_loss: 1.3626, test_f1: 0.6455
 epoch: 81, train_loss: 0.2715, test_loss: 1.3982, test_f1: 0.6565
 epoch: 82, train_loss: 0.2648, test_loss: 1.4824, test_f1: 0.6295
 epoch: 83, train_loss: 0.2831, test_loss: 1.4731, test_f1: 0.6321
 epoch: 84, train_loss: 0.2826, test_loss: 1.6171, test_f1: 0.6615
 epoch: 85, train_loss: 0.2853, test_loss: 1.4673, test_f1: 0.6485
 epoch: 86, train_loss: 0.2774, test_loss: 1.5729, test_f1: 0.6116
 epoch: 87, train_loss: 0.2660, test_loss: 1.4967, test_f1: 0.6333
 epoch: 88, train_loss: 0.2679, test_loss: 1.4732, test_f1: 0.6205
 epoch: 89, train_loss: 0.2606, test_loss: 1.7139, test_f1: 0.5968
 epoch: 90, train_loss: 0.2458, test_loss: 1.4650, test_f1: 0.6387
 epoch: 91, train_loss: 0.2582, test_loss: 1.6110, test_f1: 0.6339
 epoch: 92, train_loss: 0.2607, test_loss: 1.6717, test_f1: 0.6402
 epoch: 93, train_loss: 0.2553, test_loss: 1.6697, test_f1: 0.6388
 epoch: 94, train_loss: 0.2708, test_loss: 1.4782, test_f1: 0.6415
 epoch: 95, train_loss: 0.2644, test_loss: 1.5959, test_f1: 0.6374
 epoch: 96, train_loss: 0.2567, test_loss: 1.5892, test_f1: 0.6262
 epoch: 97, train_loss: 0.2498, test_loss: 1.6221, test_f1: 0.6577
 epoch: 98, train_loss: 0.2638, test_loss: 1.7035, test_f1: 0.6221
 epoch: 99, train_loss: 0.2395, test_loss: 1.6611, test_f1: 0.6244
##################ITERATION #2 ****************************************
 epoch: 0, train_loss: 1.1011, test_loss: 1.3010, test_f1: 0.3013
 epoch: 1, train_loss: 0.9674, test_loss: 0.9353, test_f1: 0.4972
 epoch: 2, train_loss: 0.9177, test_loss: 0.9458, test_f1: 0.5396
 epoch: 3, train_loss: 0.8837, test_loss: 0.8730, test_f1: 0.5406
 epoch: 4, train_loss: 0.8717, test_loss: 0.8412, test_f1: 0.5769
 epoch: 5, train_loss: 0.8457, test_loss: 0.8949, test_f1: 0.5376
 epoch: 6, train_loss: 0.8183, test_loss: 0.8589, test_f1: 0.5538
 epoch: 7, train_loss: 0.8136, test_loss: 0.8568, test_f1: 0.5464
 epoch: 8, train_loss: 0.7813, test_loss: 0.8365, test_f1: 0.5645
 epoch: 9, train_loss: 0.7897, test_loss: 0.8797, test_f1: 0.5582
 epoch: 10, train_loss: 0.7504, test_loss: 0.8263, test_f1: 0.6087
 epoch: 11, train_loss: 0.7436, test_loss: 0.8749, test_f1: 0.5806
 epoch: 12, train_loss: 0.7321, test_loss: 0.8122, test_f1: 0.6022
 epoch: 13, train_loss: 0.7142, test_loss: 0.8259, test_f1: 0.5973
 epoch: 14, train_loss: 0.7067, test_loss: 0.8441, test_f1: 0.5899
 epoch: 15, train_loss: 0.7090, test_loss: 0.8320, test_f1: 0.5998
 epoch: 16, train_loss: 0.6837, test_loss: 0.8711, test_f1: 0.5844
 epoch: 17, train_loss: 0.6783, test_loss: 0.8335, test_f1: 0.6223
 epoch: 18, train_loss: 0.6774, test_loss: 0.8254, test_f1: 0.6393
 epoch: 19, train_loss: 0.6669, test_loss: 0.8736, test_f1: 0.5855
 epoch: 20, train_loss: 0.6468, test_loss: 0.8546, test_f1: 0.6218
 epoch: 21, train_loss: 0.6494, test_loss: 0.8504, test_f1: 0.6341
 epoch: 22, train_loss: 0.6424, test_loss: 0.8760, test_f1: 0.6090
 epoch: 23, train_loss: 0.6165, test_loss: 0.8796, test_f1: 0.6408
 epoch: 24, train_loss: 0.6263, test_loss: 0.8540, test_f1: 0.6234
 epoch: 25, train_loss: 0.6057, test_loss: 0.9585, test_f1: 0.5785
 epoch: 26, train_loss: 0.5948, test_loss: 0.8445, test_f1: 0.6399
 epoch: 27, train_loss: 0.5949, test_loss: 0.8661, test_f1: 0.6473
 epoch: 28, train_loss: 0.5800, test_loss: 0.8429, test_f1: 0.6439
 epoch: 29, train_loss: 0.5825, test_loss: 0.9330, test_f1: 0.6135
 epoch: 30, train_loss: 0.5574, test_loss: 0.9140, test_f1: 0.6122
 epoch: 31, train_loss: 0.5741, test_loss: 0.9435, test_f1: 0.5676
 epoch: 32, train_loss: 0.5502, test_loss: 0.8388, test_f1: 0.6374
 epoch: 33, train_loss: 0.5342, test_loss: 0.9440, test_f1: 0.6417
 epoch: 34, train_loss: 0.5484, test_loss: 0.9459, test_f1: 0.6460
 epoch: 35, train_loss: 0.5495, test_loss: 0.8630, test_f1: 0.6385
 epoch: 36, train_loss: 0.5157, test_loss: 1.0024, test_f1: 0.6064
 epoch: 37, train_loss: 0.5414, test_loss: 0.9066, test_f1: 0.6413
 epoch: 38, train_loss: 0.5185, test_loss: 0.8877, test_f1: 0.6424
 epoch: 39, train_loss: 0.5282, test_loss: 0.8787, test_f1: 0.6557
 epoch: 40, train_loss: 0.5119, test_loss: 0.9241, test_f1: 0.6469
 epoch: 41, train_loss: 0.5046, test_loss: 1.0942, test_f1: 0.6203
 epoch: 42, train_loss: 0.5074, test_loss: 0.9252, test_f1: 0.6726
 epoch: 43, train_loss: 0.4689, test_loss: 0.9274, test_f1: 0.6372
 epoch: 44, train_loss: 0.4882, test_loss: 0.8821, test_f1: 0.6386
 epoch: 45, train_loss: 0.4769, test_loss: 1.0285, test_f1: 0.6343
 epoch: 46, train_loss: 0.4609, test_loss: 0.9762, test_f1: 0.6634
 epoch: 47, train_loss: 0.4642, test_loss: 0.9480, test_f1: 0.6554
 epoch: 48, train_loss: 0.4509, test_loss: 1.1068, test_f1: 0.5983
 epoch: 49, train_loss: 0.4655, test_loss: 1.1277, test_f1: 0.6031
 epoch: 50, train_loss: 0.4410, test_loss: 0.9619, test_f1: 0.6602
 epoch: 51, train_loss: 0.4040, test_loss: 1.0263, test_f1: 0.6650
 epoch: 52, train_loss: 0.3917, test_loss: 0.9741, test_f1: 0.6546
 epoch: 53, train_loss: 0.3842, test_loss: 1.0539, test_f1: 0.6488
 epoch: 54, train_loss: 0.3679, test_loss: 1.0218, test_f1: 0.6680
 epoch: 55, train_loss: 0.3776, test_loss: 1.0785, test_f1: 0.6409
 epoch: 56, train_loss: 0.3846, test_loss: 1.1229, test_f1: 0.6583
 epoch: 57, train_loss: 0.3717, test_loss: 1.0700, test_f1: 0.6746
 epoch: 58, train_loss: 0.3623, test_loss: 1.0887, test_f1: 0.6552
 epoch: 59, train_loss: 0.3570, test_loss: 1.0367, test_f1: 0.6624
 epoch: 60, train_loss: 0.3548, test_loss: 1.0982, test_f1: 0.6472
 epoch: 61, train_loss: 0.3514, test_loss: 1.1181, test_f1: 0.6709
 epoch: 62, train_loss: 0.3398, test_loss: 1.1456, test_f1: 0.6744
 epoch: 63, train_loss: 0.3315, test_loss: 1.2428, test_f1: 0.6311
 epoch: 64, train_loss: 0.3571, test_loss: 1.1821, test_f1: 0.6584
 epoch: 65, train_loss: 0.3479, test_loss: 1.0646, test_f1: 0.6859
 epoch: 66, train_loss: 0.3265, test_loss: 1.1815, test_f1: 0.6544
 epoch: 67, train_loss: 0.3369, test_loss: 1.1301, test_f1: 0.6476
 epoch: 68, train_loss: 0.3374, test_loss: 1.2354, test_f1: 0.6461
 epoch: 69, train_loss: 0.3246, test_loss: 1.2506, test_f1: 0.6704
 epoch: 70, train_loss: 0.3230, test_loss: 1.2835, test_f1: 0.6531
 epoch: 71, train_loss: 0.3240, test_loss: 1.2017, test_f1: 0.6580
 epoch: 72, train_loss: 0.3192, test_loss: 1.2492, test_f1: 0.6594
 epoch: 73, train_loss: 0.3164, test_loss: 1.2696, test_f1: 0.6482
 epoch: 74, train_loss: 0.3217, test_loss: 1.2806, test_f1: 0.6601
 epoch: 75, train_loss: 0.3129, test_loss: 1.2683, test_f1: 0.6584
 epoch: 76, train_loss: 0.3088, test_loss: 1.1755, test_f1: 0.6591
 epoch: 77, train_loss: 0.3150, test_loss: 1.4541, test_f1: 0.6504
 epoch: 78, train_loss: 0.3079, test_loss: 1.2165, test_f1: 0.6676
 epoch: 79, train_loss: 0.3053, test_loss: 1.2244, test_f1: 0.6820
 epoch: 80, train_loss: 0.2984, test_loss: 1.3152, test_f1: 0.6467
 epoch: 81, train_loss: 0.2940, test_loss: 1.4359, test_f1: 0.6314
 epoch: 82, train_loss: 0.3016, test_loss: 1.2021, test_f1: 0.6836
 epoch: 83, train_loss: 0.2901, test_loss: 1.2738, test_f1: 0.6672
 epoch: 84, train_loss: 0.2854, test_loss: 1.2869, test_f1: 0.6568
 epoch: 85, train_loss: 0.2808, test_loss: 1.4567, test_f1: 0.6486
 epoch: 86, train_loss: 0.2766, test_loss: 1.4081, test_f1: 0.6623
 epoch: 87, train_loss: 0.2779, test_loss: 1.4515, test_f1: 0.6705
 epoch: 88, train_loss: 0.2847, test_loss: 1.3035, test_f1: 0.6587
 epoch: 89, train_loss: 0.2714, test_loss: 1.5141, test_f1: 0.6344
 epoch: 90, train_loss: 0.2906, test_loss: 1.5297, test_f1: 0.6188
 epoch: 91, train_loss: 0.2730, test_loss: 1.4768, test_f1: 0.6409
 epoch: 92, train_loss: 0.2673, test_loss: 1.4194, test_f1: 0.6380
 epoch: 93, train_loss: 0.2677, test_loss: 1.5963, test_f1: 0.6175
 epoch: 94, train_loss: 0.2694, test_loss: 1.5541, test_f1: 0.6328
 epoch: 95, train_loss: 0.2402, test_loss: 1.3573, test_f1: 0.6655
 epoch: 96, train_loss: 0.2627, test_loss: 1.4909, test_f1: 0.6542
 epoch: 97, train_loss: 0.2332, test_loss: 1.6019, test_f1: 0.6560
 epoch: 98, train_loss: 0.2536, test_loss: 1.3849, test_f1: 0.6744
 epoch: 99, train_loss: 0.2612, test_loss: 1.4779, test_f1: 0.6346
##################ITERATION #3 ****************************************
 epoch: 0, train_loss: 1.1786, test_loss: 0.9873, test_f1: 0.5367
 epoch: 1, train_loss: 0.9825, test_loss: 0.9566, test_f1: 0.5389
 epoch: 2, train_loss: 0.9381, test_loss: 0.9942, test_f1: 0.4930
 epoch: 3, train_loss: 0.8937, test_loss: 0.9027, test_f1: 0.5684
 epoch: 4, train_loss: 0.8712, test_loss: 0.8938, test_f1: 0.5816
 epoch: 5, train_loss: 0.8468, test_loss: 0.9133, test_f1: 0.5609
 epoch: 6, train_loss: 0.8370, test_loss: 0.8937, test_f1: 0.5780
 epoch: 7, train_loss: 0.8092, test_loss: 0.9107, test_f1: 0.5755
 epoch: 8, train_loss: 0.8013, test_loss: 0.9184, test_f1: 0.5602
 epoch: 9, train_loss: 0.7961, test_loss: 0.8675, test_f1: 0.5733
 epoch: 10, train_loss: 0.7722, test_loss: 0.9840, test_f1: 0.5226
 epoch: 11, train_loss: 0.7484, test_loss: 1.0475, test_f1: 0.5819
 epoch: 12, train_loss: 0.7505, test_loss: 0.9243, test_f1: 0.5864
 epoch: 13, train_loss: 0.7395, test_loss: 0.8005, test_f1: 0.5972
 epoch: 14, train_loss: 0.7212, test_loss: 0.8507, test_f1: 0.6270
 epoch: 15, train_loss: 0.7098, test_loss: 1.0074, test_f1: 0.5697
 epoch: 16, train_loss: 0.6897, test_loss: 0.9118, test_f1: 0.6158
 epoch: 17, train_loss: 0.6939, test_loss: 0.8805, test_f1: 0.6114
 epoch: 18, train_loss: 0.6831, test_loss: 0.8131, test_f1: 0.6243
 epoch: 19, train_loss: 0.6650, test_loss: 0.8607, test_f1: 0.6043
 epoch: 20, train_loss: 0.6672, test_loss: 0.8576, test_f1: 0.6458
 epoch: 21, train_loss: 0.6494, test_loss: 0.9185, test_f1: 0.5931
 epoch: 22, train_loss: 0.6559, test_loss: 0.8866, test_f1: 0.5789
 epoch: 23, train_loss: 0.6322, test_loss: 0.8747, test_f1: 0.6311
 epoch: 24, train_loss: 0.6115, test_loss: 0.8432, test_f1: 0.6387
 epoch: 25, train_loss: 0.6170, test_loss: 0.8194, test_f1: 0.6084
 epoch: 26, train_loss: 0.6156, test_loss: 0.8404, test_f1: 0.6259
 epoch: 27, train_loss: 0.5874, test_loss: 0.7912, test_f1: 0.6658
 epoch: 28, train_loss: 0.5775, test_loss: 0.8941, test_f1: 0.5915
 epoch: 29, train_loss: 0.5951, test_loss: 0.8663, test_f1: 0.6075
 epoch: 30, train_loss: 0.5594, test_loss: 0.9299, test_f1: 0.6364
 epoch: 31, train_loss: 0.5628, test_loss: 1.0187, test_f1: 0.5863
 epoch: 32, train_loss: 0.5608, test_loss: 0.9266, test_f1: 0.6309
 epoch: 33, train_loss: 0.5554, test_loss: 0.9642, test_f1: 0.6040
 epoch: 34, train_loss: 0.5577, test_loss: 0.8733, test_f1: 0.6300
 epoch: 35, train_loss: 0.5382, test_loss: 0.8947, test_f1: 0.6384
 epoch: 36, train_loss: 0.5377, test_loss: 0.8903, test_f1: 0.6282
 epoch: 37, train_loss: 0.5284, test_loss: 0.8659, test_f1: 0.6333
 epoch: 38, train_loss: 0.5120, test_loss: 0.9988, test_f1: 0.6374
 epoch: 39, train_loss: 0.5118, test_loss: 0.9950, test_f1: 0.6082
 epoch: 40, train_loss: 0.4983, test_loss: 0.9792, test_f1: 0.6342
 epoch: 41, train_loss: 0.4937, test_loss: 1.0735, test_f1: 0.5748
 epoch: 42, train_loss: 0.4993, test_loss: 0.9588, test_f1: 0.6425
 epoch: 43, train_loss: 0.4788, test_loss: 0.9609, test_f1: 0.6373
 epoch: 44, train_loss: 0.4638, test_loss: 1.0150, test_f1: 0.6165
 epoch: 45, train_loss: 0.4731, test_loss: 0.9891, test_f1: 0.6189
 epoch: 46, train_loss: 0.4731, test_loss: 1.1081, test_f1: 0.6068
 epoch: 47, train_loss: 0.4583, test_loss: 1.0892, test_f1: 0.6076
 epoch: 48, train_loss: 0.4662, test_loss: 1.0064, test_f1: 0.6164
 epoch: 49, train_loss: 0.4534, test_loss: 1.0860, test_f1: 0.6273
 epoch: 50, train_loss: 0.4592, test_loss: 1.0031, test_f1: 0.6231
 epoch: 51, train_loss: 0.4266, test_loss: 0.9954, test_f1: 0.6170
 epoch: 52, train_loss: 0.3836, test_loss: 1.1052, test_f1: 0.6217
 epoch: 53, train_loss: 0.3700, test_loss: 1.1558, test_f1: 0.6173
 epoch: 54, train_loss: 0.3761, test_loss: 1.1425, test_f1: 0.6080
 epoch: 55, train_loss: 0.3781, test_loss: 1.1333, test_f1: 0.6330
 epoch: 56, train_loss: 0.3579, test_loss: 1.2090, test_f1: 0.6484
 epoch: 57, train_loss: 0.3528, test_loss: 1.0889, test_f1: 0.6227
 epoch: 58, train_loss: 0.3618, test_loss: 1.1822, test_f1: 0.6244
 epoch: 59, train_loss: 0.3529, test_loss: 1.2032, test_f1: 0.6390
 epoch: 60, train_loss: 0.3565, test_loss: 1.1191, test_f1: 0.6296
 epoch: 61, train_loss: 0.3515, test_loss: 1.1930, test_f1: 0.6258
 epoch: 62, train_loss: 0.3405, test_loss: 1.3068, test_f1: 0.6409
 epoch: 63, train_loss: 0.3333, test_loss: 1.1589, test_f1: 0.6379
 epoch: 64, train_loss: 0.3502, test_loss: 1.2029, test_f1: 0.6209
 epoch: 65, train_loss: 0.3418, test_loss: 1.1239, test_f1: 0.6573
 epoch: 66, train_loss: 0.3311, test_loss: 1.2226, test_f1: 0.6172
 epoch: 67, train_loss: 0.3496, test_loss: 1.1523, test_f1: 0.6264
 epoch: 68, train_loss: 0.3429, test_loss: 1.2566, test_f1: 0.6428
 epoch: 69, train_loss: 0.3465, test_loss: 1.2320, test_f1: 0.6357
 epoch: 70, train_loss: 0.3174, test_loss: 1.2616, test_f1: 0.6534
 epoch: 71, train_loss: 0.3160, test_loss: 1.2597, test_f1: 0.6383
 epoch: 72, train_loss: 0.3135, test_loss: 1.2974, test_f1: 0.6446
 epoch: 73, train_loss: 0.3076, test_loss: 1.2900, test_f1: 0.6394
 epoch: 74, train_loss: 0.2962, test_loss: 1.3213, test_f1: 0.6266
 epoch: 75, train_loss: 0.3073, test_loss: 1.3261, test_f1: 0.6259
 epoch: 76, train_loss: 0.3006, test_loss: 1.3024, test_f1: 0.6060
 epoch: 77, train_loss: 0.2997, test_loss: 1.3098, test_f1: 0.6222
 epoch: 78, train_loss: 0.2745, test_loss: 1.3837, test_f1: 0.6113
 epoch: 79, train_loss: 0.2727, test_loss: 1.3680, test_f1: 0.6274
 epoch: 80, train_loss: 0.2933, test_loss: 1.3043, test_f1: 0.6324
 epoch: 81, train_loss: 0.2902, test_loss: 1.3988, test_f1: 0.6197
 epoch: 82, train_loss: 0.2890, test_loss: 1.2773, test_f1: 0.6255
 epoch: 83, train_loss: 0.2912, test_loss: 1.2867, test_f1: 0.6494
 epoch: 84, train_loss: 0.2735, test_loss: 1.3128, test_f1: 0.6362
 epoch: 85, train_loss: 0.2638, test_loss: 1.4933, test_f1: 0.6272
 epoch: 86, train_loss: 0.2707, test_loss: 1.3761, test_f1: 0.6435
 epoch: 87, train_loss: 0.2611, test_loss: 1.4129, test_f1: 0.6259
 epoch: 88, train_loss: 0.2507, test_loss: 1.4642, test_f1: 0.6331
 epoch: 89, train_loss: 0.2626, test_loss: 1.4565, test_f1: 0.6411
 epoch: 90, train_loss: 0.2677, test_loss: 1.5504, test_f1: 0.6401
 epoch: 91, train_loss: 0.2577, test_loss: 1.6256, test_f1: 0.6114
 epoch: 92, train_loss: 0.2547, test_loss: 1.4659, test_f1: 0.6444
 epoch: 93, train_loss: 0.2435, test_loss: 1.5236, test_f1: 0.6479
 epoch: 94, train_loss: 0.2587, test_loss: 1.4328, test_f1: 0.6513
 epoch: 95, train_loss: 0.2552, test_loss: 1.5873, test_f1: 0.6227
 epoch: 96, train_loss: 0.2484, test_loss: 1.6588, test_f1: 0.6249
 epoch: 97, train_loss: 0.2569, test_loss: 1.5324, test_f1: 0.6175
 epoch: 98, train_loss: 0.2651, test_loss: 1.6091, test_f1: 0.6229
 epoch: 99, train_loss: 0.2574, test_loss: 1.5394, test_f1: 0.6437
##################ITERATION #4 ****************************************
 epoch: 0, train_loss: 1.2000, test_loss: 1.0699, test_f1: 0.4682
 epoch: 1, train_loss: 0.9696, test_loss: 1.0206, test_f1: 0.4834
 epoch: 2, train_loss: 0.9331, test_loss: 0.9691, test_f1: 0.5390
 epoch: 3, train_loss: 0.9013, test_loss: 0.9630, test_f1: 0.5609
 epoch: 4, train_loss: 0.8635, test_loss: 0.8682, test_f1: 0.6082
 epoch: 5, train_loss: 0.8561, test_loss: 0.9285, test_f1: 0.5357
 epoch: 6, train_loss: 0.8336, test_loss: 0.8350, test_f1: 0.5938
 epoch: 7, train_loss: 0.8301, test_loss: 0.8134, test_f1: 0.6111
 epoch: 8, train_loss: 0.7980, test_loss: 0.8086, test_f1: 0.5887
 epoch: 9, train_loss: 0.7842, test_loss: 0.8794, test_f1: 0.5717
 epoch: 10, train_loss: 0.7823, test_loss: 0.8259, test_f1: 0.6307
 epoch: 11, train_loss: 0.7595, test_loss: 0.8670, test_f1: 0.6025
 epoch: 12, train_loss: 0.7459, test_loss: 0.8271, test_f1: 0.6254
 epoch: 13, train_loss: 0.7422, test_loss: 0.7827, test_f1: 0.6077
 epoch: 14, train_loss: 0.7253, test_loss: 0.8684, test_f1: 0.5533
 epoch: 15, train_loss: 0.7049, test_loss: 0.9242, test_f1: 0.5632
 epoch: 16, train_loss: 0.7049, test_loss: 0.8382, test_f1: 0.6040
 epoch: 17, train_loss: 0.6943, test_loss: 0.8346, test_f1: 0.6363
 epoch: 18, train_loss: 0.6761, test_loss: 0.8347, test_f1: 0.6045
 epoch: 19, train_loss: 0.6716, test_loss: 0.7752, test_f1: 0.6286
 epoch: 20, train_loss: 0.6749, test_loss: 0.7832, test_f1: 0.6290
 epoch: 21, train_loss: 0.6491, test_loss: 0.7960, test_f1: 0.6493
 epoch: 22, train_loss: 0.6547, test_loss: 0.7689, test_f1: 0.6424
 epoch: 23, train_loss: 0.6541, test_loss: 0.8012, test_f1: 0.6177
 epoch: 24, train_loss: 0.6458, test_loss: 0.8690, test_f1: 0.6378
 epoch: 25, train_loss: 0.6181, test_loss: 0.8611, test_f1: 0.6118
 epoch: 26, train_loss: 0.6194, test_loss: 0.9336, test_f1: 0.5660
 epoch: 27, train_loss: 0.6070, test_loss: 0.8598, test_f1: 0.6088
 epoch: 28, train_loss: 0.6207, test_loss: 0.8597, test_f1: 0.6373
 epoch: 29, train_loss: 0.6080, test_loss: 0.8796, test_f1: 0.6255
 epoch: 30, train_loss: 0.5663, test_loss: 0.7426, test_f1: 0.6617
 epoch: 31, train_loss: 0.5887, test_loss: 0.8066, test_f1: 0.6401
 epoch: 32, train_loss: 0.5548, test_loss: 0.8078, test_f1: 0.6452
 epoch: 33, train_loss: 0.5705, test_loss: 0.7767, test_f1: 0.6665
 epoch: 34, train_loss: 0.5846, test_loss: 0.7907, test_f1: 0.6666
 epoch: 35, train_loss: 0.5645, test_loss: 0.8017, test_f1: 0.6134
 epoch: 36, train_loss: 0.5451, test_loss: 1.0271, test_f1: 0.6128
 epoch: 37, train_loss: 0.5495, test_loss: 0.8337, test_f1: 0.6488
 epoch: 38, train_loss: 0.5507, test_loss: 0.7943, test_f1: 0.6405
 epoch: 39, train_loss: 0.5388, test_loss: 0.8130, test_f1: 0.6635
 epoch: 40, train_loss: 0.5289, test_loss: 0.8476, test_f1: 0.6569
 epoch: 41, train_loss: 0.5102, test_loss: 0.8451, test_f1: 0.6514
 epoch: 42, train_loss: 0.5033, test_loss: 0.8042, test_f1: 0.6529
 epoch: 43, train_loss: 0.4989, test_loss: 0.8305, test_f1: 0.6574
 epoch: 44, train_loss: 0.4892, test_loss: 0.8379, test_f1: 0.6605
 epoch: 45, train_loss: 0.5059, test_loss: 0.8026, test_f1: 0.6722
 epoch: 46, train_loss: 0.4901, test_loss: 0.8512, test_f1: 0.6458
 epoch: 47, train_loss: 0.4911, test_loss: 0.8866, test_f1: 0.6293
 epoch: 48, train_loss: 0.4737, test_loss: 0.8133, test_f1: 0.6808
 epoch: 49, train_loss: 0.4708, test_loss: 0.9462, test_f1: 0.6598
 epoch: 50, train_loss: 0.4646, test_loss: 0.9063, test_f1: 0.6659
 epoch: 51, train_loss: 0.4269, test_loss: 0.8805, test_f1: 0.6608
 epoch: 52, train_loss: 0.4148, test_loss: 0.8851, test_f1: 0.6628
 epoch: 53, train_loss: 0.3983, test_loss: 0.9102, test_f1: 0.6507
 epoch: 54, train_loss: 0.3881, test_loss: 0.9043, test_f1: 0.6827
 epoch: 55, train_loss: 0.4029, test_loss: 0.8857, test_f1: 0.6609
 epoch: 56, train_loss: 0.3643, test_loss: 0.9215, test_f1: 0.6775
 epoch: 57, train_loss: 0.3722, test_loss: 0.8938, test_f1: 0.6923
 epoch: 58, train_loss: 0.3708, test_loss: 0.8804, test_f1: 0.6839
 epoch: 59, train_loss: 0.3650, test_loss: 0.8739, test_f1: 0.7087
 epoch: 60, train_loss: 0.3817, test_loss: 0.9690, test_f1: 0.6577
 epoch: 61, train_loss: 0.3606, test_loss: 0.8711, test_f1: 0.6723
 epoch: 62, train_loss: 0.3555, test_loss: 0.9332, test_f1: 0.6672
 epoch: 63, train_loss: 0.3542, test_loss: 0.8754, test_f1: 0.7058
 epoch: 64, train_loss: 0.3626, test_loss: 0.9186, test_f1: 0.6951
 epoch: 65, train_loss: 0.3567, test_loss: 1.0741, test_f1: 0.6624
 epoch: 66, train_loss: 0.3520, test_loss: 0.9725, test_f1: 0.6670
 epoch: 67, train_loss: 0.3381, test_loss: 0.9610, test_f1: 0.6733
 epoch: 68, train_loss: 0.3400, test_loss: 0.9232, test_f1: 0.7136
 epoch: 69, train_loss: 0.3561, test_loss: 0.9124, test_f1: 0.6848
 epoch: 70, train_loss: 0.3400, test_loss: 1.0111, test_f1: 0.6595
 epoch: 71, train_loss: 0.3159, test_loss: 1.0263, test_f1: 0.6469
 epoch: 72, train_loss: 0.3206, test_loss: 1.0382, test_f1: 0.6552
 epoch: 73, train_loss: 0.3350, test_loss: 1.0424, test_f1: 0.6589
 epoch: 74, train_loss: 0.3360, test_loss: 0.9159, test_f1: 0.6784
 epoch: 75, train_loss: 0.3340, test_loss: 1.0590, test_f1: 0.6553
 epoch: 76, train_loss: 0.3240, test_loss: 1.1382, test_f1: 0.6555
 epoch: 77, train_loss: 0.3122, test_loss: 0.9701, test_f1: 0.6721
 epoch: 78, train_loss: 0.3292, test_loss: 1.0563, test_f1: 0.6596
 epoch: 79, train_loss: 0.3185, test_loss: 1.0196, test_f1: 0.6459
 epoch: 80, train_loss: 0.3077, test_loss: 1.0009, test_f1: 0.6791
 epoch: 81, train_loss: 0.3037, test_loss: 1.0920, test_f1: 0.6761
 epoch: 82, train_loss: 0.3295, test_loss: 1.0505, test_f1: 0.6588
 epoch: 83, train_loss: 0.3143, test_loss: 1.1195, test_f1: 0.6397
 epoch: 84, train_loss: 0.3027, test_loss: 1.0366, test_f1: 0.6889
 epoch: 85, train_loss: 0.2904, test_loss: 1.0534, test_f1: 0.6613
 epoch: 86, train_loss: 0.2992, test_loss: 1.1165, test_f1: 0.6457
 epoch: 87, train_loss: 0.3038, test_loss: 1.1417, test_f1: 0.6419
 epoch: 88, train_loss: 0.3021, test_loss: 1.1378, test_f1: 0.6452
 epoch: 89, train_loss: 0.2745, test_loss: 1.1067, test_f1: 0.6582
 epoch: 90, train_loss: 0.2906, test_loss: 1.0643, test_f1: 0.6852
 epoch: 91, train_loss: 0.2764, test_loss: 1.2150, test_f1: 0.6357
 epoch: 92, train_loss: 0.2749, test_loss: 1.1061, test_f1: 0.6781
 epoch: 93, train_loss: 0.2751, test_loss: 1.2694, test_f1: 0.6690
 epoch: 94, train_loss: 0.2800, test_loss: 1.0954, test_f1: 0.6736
 epoch: 95, train_loss: 0.2952, test_loss: 1.1698, test_f1: 0.6557
 epoch: 96, train_loss: 0.2665, test_loss: 1.0728, test_f1: 0.6649
 epoch: 97, train_loss: 0.2651, test_loss: 1.1905, test_f1: 0.6570
 epoch: 98, train_loss: 0.2912, test_loss: 1.1686, test_f1: 0.6443
 epoch: 99, train_loss: 0.2737, test_loss: 1.1178, test_f1: 0.6621
##################ITERATION #5 ****************************************
 epoch: 0, train_loss: 1.2191, test_loss: 1.0300, test_f1: 0.4967
 epoch: 1, train_loss: 1.0011, test_loss: 0.9502, test_f1: 0.5087
 epoch: 2, train_loss: 0.9464, test_loss: 0.9531, test_f1: 0.5148
 epoch: 3, train_loss: 0.9136, test_loss: 0.9873, test_f1: 0.4758
 epoch: 4, train_loss: 0.8934, test_loss: 0.8853, test_f1: 0.5801
 epoch: 5, train_loss: 0.8550, test_loss: 0.8973, test_f1: 0.5570
 epoch: 6, train_loss: 0.8273, test_loss: 0.8331, test_f1: 0.5891
 epoch: 7, train_loss: 0.8221, test_loss: 0.8648, test_f1: 0.5728
 epoch: 8, train_loss: 0.8075, test_loss: 0.9059, test_f1: 0.5303
 epoch: 9, train_loss: 0.8048, test_loss: 0.8688, test_f1: 0.5873
 epoch: 10, train_loss: 0.7866, test_loss: 0.8657, test_f1: 0.5202
 epoch: 11, train_loss: 0.7724, test_loss: 0.8458, test_f1: 0.6043
 epoch: 12, train_loss: 0.7527, test_loss: 0.7784, test_f1: 0.6031
 epoch: 13, train_loss: 0.7438, test_loss: 0.8095, test_f1: 0.6147
 epoch: 14, train_loss: 0.7187, test_loss: 0.9765, test_f1: 0.5445
 epoch: 15, train_loss: 0.7310, test_loss: 0.8204, test_f1: 0.5804
 epoch: 16, train_loss: 0.7085, test_loss: 0.8120, test_f1: 0.5966
 epoch: 17, train_loss: 0.6963, test_loss: 0.7547, test_f1: 0.6340
 epoch: 18, train_loss: 0.6641, test_loss: 0.8678, test_f1: 0.6215
 epoch: 19, train_loss: 0.6634, test_loss: 0.7758, test_f1: 0.6550
 epoch: 20, train_loss: 0.6735, test_loss: 0.8924, test_f1: 0.6124
 epoch: 21, train_loss: 0.6496, test_loss: 0.8471, test_f1: 0.6346
 epoch: 22, train_loss: 0.6427, test_loss: 0.7739, test_f1: 0.6576
 epoch: 23, train_loss: 0.6448, test_loss: 0.7951, test_f1: 0.6242
 epoch: 24, train_loss: 0.6387, test_loss: 0.8646, test_f1: 0.6084
 epoch: 25, train_loss: 0.6069, test_loss: 0.9167, test_f1: 0.5959
 epoch: 26, train_loss: 0.6063, test_loss: 0.8118, test_f1: 0.6454
 epoch: 27, train_loss: 0.6149, test_loss: 0.7380, test_f1: 0.6650
 epoch: 28, train_loss: 0.5998, test_loss: 0.8491, test_f1: 0.6323
 epoch: 29, train_loss: 0.5793, test_loss: 0.8457, test_f1: 0.6505
 epoch: 30, train_loss: 0.5717, test_loss: 0.8397, test_f1: 0.6450
 epoch: 31, train_loss: 0.5649, test_loss: 0.7911, test_f1: 0.6704
 epoch: 32, train_loss: 0.5552, test_loss: 0.8388, test_f1: 0.6491
 epoch: 33, train_loss: 0.5596, test_loss: 0.8540, test_f1: 0.6630
 epoch: 34, train_loss: 0.5406, test_loss: 0.8061, test_f1: 0.6573
 epoch: 35, train_loss: 0.5430, test_loss: 0.8493, test_f1: 0.6551
 epoch: 36, train_loss: 0.5266, test_loss: 0.7563, test_f1: 0.6782
 epoch: 37, train_loss: 0.5352, test_loss: 0.8898, test_f1: 0.6492
 epoch: 38, train_loss: 0.5266, test_loss: 0.8443, test_f1: 0.6428
 epoch: 39, train_loss: 0.5046, test_loss: 0.9181, test_f1: 0.6262
 epoch: 40, train_loss: 0.5173, test_loss: 0.7927, test_f1: 0.6716
 epoch: 41, train_loss: 0.4681, test_loss: 0.8603, test_f1: 0.6704
 epoch: 42, train_loss: 0.4993, test_loss: 0.8515, test_f1: 0.6546
 epoch: 43, train_loss: 0.4762, test_loss: 0.9624, test_f1: 0.6257
 epoch: 44, train_loss: 0.4996, test_loss: 0.9354, test_f1: 0.6511
 epoch: 45, train_loss: 0.4817, test_loss: 0.9128, test_f1: 0.6333
 epoch: 46, train_loss: 0.4837, test_loss: 0.9002, test_f1: 0.6622
 epoch: 47, train_loss: 0.4526, test_loss: 1.0771, test_f1: 0.6220
 epoch: 48, train_loss: 0.4544, test_loss: 0.9292, test_f1: 0.6738
 epoch: 49, train_loss: 0.4370, test_loss: 1.0059, test_f1: 0.6465
 epoch: 50, train_loss: 0.4281, test_loss: 0.9753, test_f1: 0.6411
 epoch: 51, train_loss: 0.4181, test_loss: 0.9288, test_f1: 0.6753
 epoch: 52, train_loss: 0.4020, test_loss: 0.9298, test_f1: 0.6774
 epoch: 53, train_loss: 0.3863, test_loss: 0.9512, test_f1: 0.6692
 epoch: 54, train_loss: 0.3852, test_loss: 0.9769, test_f1: 0.6766
 epoch: 55, train_loss: 0.3779, test_loss: 1.0048, test_f1: 0.6509
 epoch: 56, train_loss: 0.3819, test_loss: 0.9919, test_f1: 0.6507
 epoch: 57, train_loss: 0.3692, test_loss: 0.9621, test_f1: 0.6987
 epoch: 58, train_loss: 0.3741, test_loss: 1.0170, test_f1: 0.6694
 epoch: 59, train_loss: 0.3620, test_loss: 0.9716, test_f1: 0.6587
 epoch: 60, train_loss: 0.3504, test_loss: 1.0080, test_f1: 0.6733
 epoch: 61, train_loss: 0.3352, test_loss: 0.9761, test_f1: 0.6728
 epoch: 62, train_loss: 0.3437, test_loss: 0.9928, test_f1: 0.6681
 epoch: 63, train_loss: 0.3426, test_loss: 0.9796, test_f1: 0.6771
 epoch: 64, train_loss: 0.3540, test_loss: 1.0351, test_f1: 0.6740
 epoch: 65, train_loss: 0.3405, test_loss: 1.0903, test_f1: 0.6229
 epoch: 66, train_loss: 0.3248, test_loss: 1.0391, test_f1: 0.6625
 epoch: 67, train_loss: 0.3198, test_loss: 1.0633, test_f1: 0.6684
 epoch: 68, train_loss: 0.3232, test_loss: 1.0353, test_f1: 0.6874
 epoch: 69, train_loss: 0.3308, test_loss: 1.0120, test_f1: 0.6764
 epoch: 70, train_loss: 0.3305, test_loss: 1.1390, test_f1: 0.6350
 epoch: 71, train_loss: 0.3211, test_loss: 1.1663, test_f1: 0.6372
 epoch: 72, train_loss: 0.3135, test_loss: 1.1139, test_f1: 0.6606
 epoch: 73, train_loss: 0.3093, test_loss: 1.1164, test_f1: 0.6332
 epoch: 74, train_loss: 0.3281, test_loss: 1.0717, test_f1: 0.6442
 epoch: 75, train_loss: 0.3047, test_loss: 1.0764, test_f1: 0.6795
 epoch: 76, train_loss: 0.3113, test_loss: 1.1041, test_f1: 0.6595
 epoch: 77, train_loss: 0.3201, test_loss: 1.1060, test_f1: 0.6640
 epoch: 78, train_loss: 0.3087, test_loss: 1.3115, test_f1: 0.6314
 epoch: 79, train_loss: 0.2988, test_loss: 1.1832, test_f1: 0.6433
 epoch: 80, train_loss: 0.2922, test_loss: 1.1649, test_f1: 0.6608
 epoch: 81, train_loss: 0.3090, test_loss: 1.1544, test_f1: 0.6644
 epoch: 82, train_loss: 0.2945, test_loss: 1.1675, test_f1: 0.6661
 epoch: 83, train_loss: 0.3087, test_loss: 1.2404, test_f1: 0.6543
 epoch: 84, train_loss: 0.2980, test_loss: 1.0962, test_f1: 0.6690
 epoch: 85, train_loss: 0.2880, test_loss: 1.1840, test_f1: 0.6562
 epoch: 86, train_loss: 0.2873, test_loss: 1.1835, test_f1: 0.6604
 epoch: 87, train_loss: 0.2787, test_loss: 1.2619, test_f1: 0.6403
 epoch: 88, train_loss: 0.2851, test_loss: 1.2142, test_f1: 0.6677
 epoch: 89, train_loss: 0.2922, test_loss: 1.1690, test_f1: 0.6648
 epoch: 90, train_loss: 0.2671, test_loss: 1.2199, test_f1: 0.6788
 epoch: 91, train_loss: 0.2627, test_loss: 1.2086, test_f1: 0.6630
 epoch: 92, train_loss: 0.2723, test_loss: 1.2098, test_f1: 0.6705
 epoch: 93, train_loss: 0.2627, test_loss: 1.2976, test_f1: 0.6363
 epoch: 94, train_loss: 0.2755, test_loss: 1.2793, test_f1: 0.6552
 epoch: 95, train_loss: 0.2508, test_loss: 1.2984, test_f1: 0.6683
 epoch: 96, train_loss: 0.2728, test_loss: 1.2532, test_f1: 0.6503
 epoch: 97, train_loss: 0.2798, test_loss: 1.1678, test_f1: 0.6642
 epoch: 98, train_loss: 0.2447, test_loss: 1.2243, test_f1: 0.6667
 epoch: 99, train_loss: 0.2545, test_loss: 1.2729, test_f1: 0.6720
##################ITERATION #6 ****************************************
 epoch: 0, train_loss: 1.3067, test_loss: 1.0382, test_f1: 0.3870
 epoch: 1, train_loss: 1.0080, test_loss: 0.9838, test_f1: 0.5356
 epoch: 2, train_loss: 0.9729, test_loss: 0.9357, test_f1: 0.4853
 epoch: 3, train_loss: 0.9342, test_loss: 0.9694, test_f1: 0.5187
 epoch: 4, train_loss: 0.9154, test_loss: 0.9291, test_f1: 0.5342
 epoch: 5, train_loss: 0.8940, test_loss: 0.9223, test_f1: 0.5232
 epoch: 6, train_loss: 0.8808, test_loss: 1.1147, test_f1: 0.4885
 epoch: 7, train_loss: 0.8476, test_loss: 0.9049, test_f1: 0.5788
 epoch: 8, train_loss: 0.8259, test_loss: 0.9484, test_f1: 0.5396
 epoch: 9, train_loss: 0.8237, test_loss: 0.9061, test_f1: 0.6209
 epoch: 10, train_loss: 0.8090, test_loss: 0.9234, test_f1: 0.5561
 epoch: 11, train_loss: 0.7929, test_loss: 0.9059, test_f1: 0.6085
 epoch: 12, train_loss: 0.7784, test_loss: 0.9461, test_f1: 0.5284
 epoch: 13, train_loss: 0.7579, test_loss: 0.8905, test_f1: 0.5885
 epoch: 14, train_loss: 0.7418, test_loss: 0.8797, test_f1: 0.5969
 epoch: 15, train_loss: 0.7435, test_loss: 0.9053, test_f1: 0.5940
 epoch: 16, train_loss: 0.7395, test_loss: 0.8774, test_f1: 0.6042
 epoch: 17, train_loss: 0.7261, test_loss: 0.8747, test_f1: 0.6188
 epoch: 18, train_loss: 0.7012, test_loss: 0.8803, test_f1: 0.6034
 epoch: 19, train_loss: 0.7168, test_loss: 0.8678, test_f1: 0.6160
 epoch: 20, train_loss: 0.6972, test_loss: 0.8651, test_f1: 0.5992
 epoch: 21, train_loss: 0.6763, test_loss: 0.8037, test_f1: 0.6538
 epoch: 22, train_loss: 0.6820, test_loss: 0.8159, test_f1: 0.6392
 epoch: 23, train_loss: 0.6568, test_loss: 0.8688, test_f1: 0.6262
 epoch: 24, train_loss: 0.6579, test_loss: 0.8802, test_f1: 0.6182
 epoch: 25, train_loss: 0.6456, test_loss: 0.9033, test_f1: 0.6469
 epoch: 26, train_loss: 0.6344, test_loss: 0.9150, test_f1: 0.5998
 epoch: 27, train_loss: 0.6381, test_loss: 0.8994, test_f1: 0.5948
 epoch: 28, train_loss: 0.6188, test_loss: 0.8608, test_f1: 0.6535
 epoch: 29, train_loss: 0.6220, test_loss: 0.8138, test_f1: 0.6294
 epoch: 30, train_loss: 0.6128, test_loss: 0.8557, test_f1: 0.6073
 epoch: 31, train_loss: 0.6159, test_loss: 0.8982, test_f1: 0.6486
 epoch: 32, train_loss: 0.5876, test_loss: 0.8934, test_f1: 0.6307
 epoch: 33, train_loss: 0.5852, test_loss: 0.8781, test_f1: 0.6096
 epoch: 34, train_loss: 0.5838, test_loss: 0.8707, test_f1: 0.6665
 epoch: 35, train_loss: 0.5825, test_loss: 0.8923, test_f1: 0.6090
 epoch: 36, train_loss: 0.5690, test_loss: 0.9292, test_f1: 0.6455
 epoch: 37, train_loss: 0.5681, test_loss: 0.9506, test_f1: 0.6467
 epoch: 38, train_loss: 0.5481, test_loss: 0.9103, test_f1: 0.6114
 epoch: 39, train_loss: 0.5715, test_loss: 0.8959, test_f1: 0.6579
 epoch: 40, train_loss: 0.5407, test_loss: 0.8353, test_f1: 0.6502
 epoch: 41, train_loss: 0.5857, test_loss: 0.8735, test_f1: 0.6448
 epoch: 42, train_loss: 0.5398, test_loss: 0.8926, test_f1: 0.6635
 epoch: 43, train_loss: 0.5480, test_loss: 0.8973, test_f1: 0.6466
 epoch: 44, train_loss: 0.5307, test_loss: 0.8902, test_f1: 0.6349
 epoch: 45, train_loss: 0.5144, test_loss: 0.9172, test_f1: 0.6313
 epoch: 46, train_loss: 0.5073, test_loss: 0.9334, test_f1: 0.6355
 epoch: 47, train_loss: 0.5163, test_loss: 0.9838, test_f1: 0.6480
 epoch: 48, train_loss: 0.4918, test_loss: 0.9283, test_f1: 0.6193
 epoch: 49, train_loss: 0.4866, test_loss: 1.0378, test_f1: 0.6289
 epoch: 50, train_loss: 0.4701, test_loss: 0.9956, test_f1: 0.6183
 epoch: 51, train_loss: 0.4451, test_loss: 0.9816, test_f1: 0.6423
 epoch: 52, train_loss: 0.4428, test_loss: 0.9522, test_f1: 0.6431
 epoch: 53, train_loss: 0.4251, test_loss: 0.9914, test_f1: 0.6456
 epoch: 54, train_loss: 0.4337, test_loss: 0.9464, test_f1: 0.6675
 epoch: 55, train_loss: 0.4071, test_loss: 0.9801, test_f1: 0.6558
 epoch: 56, train_loss: 0.4052, test_loss: 0.9861, test_f1: 0.6473
 epoch: 57, train_loss: 0.3926, test_loss: 0.9775, test_f1: 0.6543
 epoch: 58, train_loss: 0.3997, test_loss: 1.0404, test_f1: 0.6577
 epoch: 59, train_loss: 0.4002, test_loss: 1.0779, test_f1: 0.6370
 epoch: 60, train_loss: 0.3965, test_loss: 1.0017, test_f1: 0.6490
 epoch: 61, train_loss: 0.3985, test_loss: 1.0496, test_f1: 0.6532
 epoch: 62, train_loss: 0.4005, test_loss: 1.0188, test_f1: 0.6649
 epoch: 63, train_loss: 0.3968, test_loss: 1.0332, test_f1: 0.6486
 epoch: 64, train_loss: 0.3878, test_loss: 0.9870, test_f1: 0.6775
 epoch: 65, train_loss: 0.3780, test_loss: 1.0180, test_f1: 0.6672
 epoch: 66, train_loss: 0.3579, test_loss: 1.0828, test_f1: 0.6430
 epoch: 67, train_loss: 0.3618, test_loss: 1.0950, test_f1: 0.6510
 epoch: 68, train_loss: 0.3609, test_loss: 1.0850, test_f1: 0.6572
 epoch: 69, train_loss: 0.3469, test_loss: 1.0762, test_f1: 0.6614
 epoch: 70, train_loss: 0.3598, test_loss: 1.1159, test_f1: 0.6369
 epoch: 71, train_loss: 0.3597, test_loss: 1.0973, test_f1: 0.6699
 epoch: 72, train_loss: 0.3638, test_loss: 1.0978, test_f1: 0.6440
 epoch: 73, train_loss: 0.3470, test_loss: 1.0845, test_f1: 0.6466
 epoch: 74, train_loss: 0.3483, test_loss: 1.0944, test_f1: 0.6666
 epoch: 75, train_loss: 0.3570, test_loss: 1.2326, test_f1: 0.6391
 epoch: 76, train_loss: 0.3315, test_loss: 1.2276, test_f1: 0.6517
 epoch: 77, train_loss: 0.3373, test_loss: 1.1186, test_f1: 0.6478
 epoch: 78, train_loss: 0.3382, test_loss: 1.0869, test_f1: 0.6863
 epoch: 79, train_loss: 0.3321, test_loss: 1.1169, test_f1: 0.6654
 epoch: 80, train_loss: 0.3242, test_loss: 1.1684, test_f1: 0.6511
 epoch: 81, train_loss: 0.3242, test_loss: 1.1193, test_f1: 0.6575
 epoch: 82, train_loss: 0.3120, test_loss: 1.2783, test_f1: 0.6268
 epoch: 83, train_loss: 0.3236, test_loss: 1.1401, test_f1: 0.6614
 epoch: 84, train_loss: 0.3303, test_loss: 1.1164, test_f1: 0.6496
 epoch: 85, train_loss: 0.3351, test_loss: 1.1487, test_f1: 0.6618
 epoch: 86, train_loss: 0.3204, test_loss: 1.1147, test_f1: 0.6828
 epoch: 87, train_loss: 0.3159, test_loss: 1.2049, test_f1: 0.6598
 epoch: 88, train_loss: 0.3204, test_loss: 1.1863, test_f1: 0.6715
 epoch: 89, train_loss: 0.3183, test_loss: 1.2651, test_f1: 0.6317
 epoch: 90, train_loss: 0.3216, test_loss: 1.1018, test_f1: 0.6816
 epoch: 91, train_loss: 0.3251, test_loss: 1.3387, test_f1: 0.6316
 epoch: 92, train_loss: 0.3245, test_loss: 1.3171, test_f1: 0.6391
 epoch: 93, train_loss: 0.2843, test_loss: 1.2227, test_f1: 0.6634
 epoch: 94, train_loss: 0.2955, test_loss: 1.2720, test_f1: 0.6654
 epoch: 95, train_loss: 0.2932, test_loss: 1.1399, test_f1: 0.6730
 epoch: 96, train_loss: 0.3013, test_loss: 1.2085, test_f1: 0.6629
 epoch: 97, train_loss: 0.3019, test_loss: 1.2378, test_f1: 0.6697
 epoch: 98, train_loss: 0.2995, test_loss: 1.1991, test_f1: 0.6732
 epoch: 99, train_loss: 0.3053, test_loss: 1.2123, test_f1: 0.6524
##################ITERATION #7 ****************************************
 epoch: 0, train_loss: 1.2884, test_loss: 1.0367, test_f1: 0.4028
 epoch: 1, train_loss: 1.0085, test_loss: 0.9624, test_f1: 0.4996
 epoch: 2, train_loss: 0.9656, test_loss: 0.9867, test_f1: 0.5116
 epoch: 3, train_loss: 0.9169, test_loss: 0.9477, test_f1: 0.5448
 epoch: 4, train_loss: 0.8987, test_loss: 0.9436, test_f1: 0.5613
 epoch: 5, train_loss: 0.8763, test_loss: 0.9205, test_f1: 0.5570
 epoch: 6, train_loss: 0.8607, test_loss: 0.9562, test_f1: 0.5519
 epoch: 7, train_loss: 0.8420, test_loss: 0.9021, test_f1: 0.5592
 epoch: 8, train_loss: 0.8375, test_loss: 0.9284, test_f1: 0.5899
 epoch: 9, train_loss: 0.7950, test_loss: 0.8918, test_f1: 0.5875
 epoch: 10, train_loss: 0.7858, test_loss: 0.8342, test_f1: 0.5912
 epoch: 11, train_loss: 0.7779, test_loss: 0.8882, test_f1: 0.6089
 epoch: 12, train_loss: 0.7637, test_loss: 0.9168, test_f1: 0.6161
 epoch: 13, train_loss: 0.7450, test_loss: 0.8479, test_f1: 0.6098
 epoch: 14, train_loss: 0.7400, test_loss: 0.9880, test_f1: 0.5827
 epoch: 15, train_loss: 0.7125, test_loss: 0.9070, test_f1: 0.5971
 epoch: 16, train_loss: 0.7190, test_loss: 0.8194, test_f1: 0.6107
 epoch: 17, train_loss: 0.7081, test_loss: 0.9270, test_f1: 0.5976
 epoch: 18, train_loss: 0.7026, test_loss: 0.8490, test_f1: 0.6104
 epoch: 19, train_loss: 0.6996, test_loss: 0.8820, test_f1: 0.6226
 epoch: 20, train_loss: 0.6801, test_loss: 0.8963, test_f1: 0.6461
 epoch: 21, train_loss: 0.6676, test_loss: 0.8709, test_f1: 0.6224
 epoch: 22, train_loss: 0.6527, test_loss: 0.8059, test_f1: 0.6118
 epoch: 23, train_loss: 0.6491, test_loss: 0.8235, test_f1: 0.6305
 epoch: 24, train_loss: 0.6316, test_loss: 0.7844, test_f1: 0.6528
 epoch: 25, train_loss: 0.6305, test_loss: 0.8250, test_f1: 0.6039
 epoch: 26, train_loss: 0.6376, test_loss: 0.8382, test_f1: 0.6392
 epoch: 27, train_loss: 0.6150, test_loss: 0.7913, test_f1: 0.6083
 epoch: 28, train_loss: 0.6110, test_loss: 1.0487, test_f1: 0.5586
 epoch: 29, train_loss: 0.5984, test_loss: 0.8569, test_f1: 0.6329
 epoch: 30, train_loss: 0.5847, test_loss: 0.9160, test_f1: 0.6172
 epoch: 31, train_loss: 0.5796, test_loss: 0.8058, test_f1: 0.6257
 epoch: 32, train_loss: 0.5768, test_loss: 0.9310, test_f1: 0.6149
 epoch: 33, train_loss: 0.5670, test_loss: 0.8750, test_f1: 0.6179
 epoch: 34, train_loss: 0.5599, test_loss: 1.0156, test_f1: 0.6140
 epoch: 35, train_loss: 0.5571, test_loss: 0.9117, test_f1: 0.6316
 epoch: 36, train_loss: 0.5421, test_loss: 0.8720, test_f1: 0.6379
 epoch: 37, train_loss: 0.5289, test_loss: 0.9103, test_f1: 0.6266
 epoch: 38, train_loss: 0.5373, test_loss: 0.8673, test_f1: 0.6231
 epoch: 39, train_loss: 0.5401, test_loss: 0.9548, test_f1: 0.6187
 epoch: 40, train_loss: 0.5212, test_loss: 1.1454, test_f1: 0.5688
 epoch: 41, train_loss: 0.5137, test_loss: 0.8812, test_f1: 0.6265
 epoch: 42, train_loss: 0.5265, test_loss: 0.8680, test_f1: 0.6372
 epoch: 43, train_loss: 0.4993, test_loss: 0.9702, test_f1: 0.6218
 epoch: 44, train_loss: 0.5015, test_loss: 0.9257, test_f1: 0.6294
 epoch: 45, train_loss: 0.5007, test_loss: 0.9169, test_f1: 0.6138
 epoch: 46, train_loss: 0.4803, test_loss: 0.8953, test_f1: 0.6387
 epoch: 47, train_loss: 0.4868, test_loss: 0.9268, test_f1: 0.6324
 epoch: 48, train_loss: 0.4728, test_loss: 0.8805, test_f1: 0.6790
 epoch: 49, train_loss: 0.4786, test_loss: 0.9506, test_f1: 0.6190
 epoch: 50, train_loss: 0.4507, test_loss: 0.9523, test_f1: 0.6434
 epoch: 51, train_loss: 0.4379, test_loss: 1.0338, test_f1: 0.6202
 epoch: 52, train_loss: 0.4100, test_loss: 0.9845, test_f1: 0.6415
 epoch: 53, train_loss: 0.3943, test_loss: 0.9714, test_f1: 0.6355
 epoch: 54, train_loss: 0.4028, test_loss: 1.0219, test_f1: 0.6357
 epoch: 55, train_loss: 0.3952, test_loss: 1.0132, test_f1: 0.6454
 epoch: 56, train_loss: 0.3868, test_loss: 1.0034, test_f1: 0.6283
 epoch: 57, train_loss: 0.3797, test_loss: 1.0243, test_f1: 0.6336
 epoch: 58, train_loss: 0.3811, test_loss: 1.1344, test_f1: 0.6209
 epoch: 59, train_loss: 0.3628, test_loss: 1.1287, test_f1: 0.6252
 epoch: 60, train_loss: 0.3767, test_loss: 1.0140, test_f1: 0.6442
 epoch: 61, train_loss: 0.3573, test_loss: 1.2145, test_f1: 0.6023
 epoch: 62, train_loss: 0.3572, test_loss: 1.0285, test_f1: 0.6634
 epoch: 63, train_loss: 0.3403, test_loss: 1.1736, test_f1: 0.6088
 epoch: 64, train_loss: 0.3863, test_loss: 1.0475, test_f1: 0.6436
 epoch: 65, train_loss: 0.3430, test_loss: 1.1323, test_f1: 0.6452
 epoch: 66, train_loss: 0.3589, test_loss: 1.1556, test_f1: 0.6520
 epoch: 67, train_loss: 0.3484, test_loss: 1.0767, test_f1: 0.6550
 epoch: 68, train_loss: 0.3456, test_loss: 1.1021, test_f1: 0.6566
 epoch: 69, train_loss: 0.3343, test_loss: 1.1061, test_f1: 0.6348
 epoch: 70, train_loss: 0.3460, test_loss: 1.1306, test_f1: 0.6381
 epoch: 71, train_loss: 0.3321, test_loss: 1.1856, test_f1: 0.6469
 epoch: 72, train_loss: 0.3303, test_loss: 1.1558, test_f1: 0.6341
 epoch: 73, train_loss: 0.3190, test_loss: 1.2217, test_f1: 0.6398
 epoch: 74, train_loss: 0.3379, test_loss: 1.2263, test_f1: 0.6199
 epoch: 75, train_loss: 0.3312, test_loss: 1.1284, test_f1: 0.6467
 epoch: 76, train_loss: 0.3134, test_loss: 1.1111, test_f1: 0.6582
 epoch: 77, train_loss: 0.3228, test_loss: 1.1425, test_f1: 0.6647
 epoch: 78, train_loss: 0.3083, test_loss: 1.1674, test_f1: 0.6508
 epoch: 79, train_loss: 0.3119, test_loss: 1.2046, test_f1: 0.6347
 epoch: 80, train_loss: 0.3041, test_loss: 1.1632, test_f1: 0.6544
 epoch: 81, train_loss: 0.3066, test_loss: 1.1709, test_f1: 0.6533
 epoch: 82, train_loss: 0.3030, test_loss: 1.1087, test_f1: 0.6581
 epoch: 83, train_loss: 0.3159, test_loss: 1.2940, test_f1: 0.6123
 epoch: 84, train_loss: 0.3004, test_loss: 1.2460, test_f1: 0.6281
 epoch: 85, train_loss: 0.3005, test_loss: 1.3024, test_f1: 0.6239
 epoch: 86, train_loss: 0.2863, test_loss: 1.4521, test_f1: 0.6000
 epoch: 87, train_loss: 0.2854, test_loss: 1.1793, test_f1: 0.6327
 epoch: 88, train_loss: 0.2988, test_loss: 1.2585, test_f1: 0.6338
 epoch: 89, train_loss: 0.2739, test_loss: 1.3198, test_f1: 0.6391
 epoch: 90, train_loss: 0.2980, test_loss: 1.1884, test_f1: 0.6499
 epoch: 91, train_loss: 0.2735, test_loss: 1.2698, test_f1: 0.6430
 epoch: 92, train_loss: 0.2769, test_loss: 1.6320, test_f1: 0.6088
 epoch: 93, train_loss: 0.2884, test_loss: 1.3259, test_f1: 0.6291
 epoch: 94, train_loss: 0.2855, test_loss: 1.1952, test_f1: 0.6404
 epoch: 95, train_loss: 0.2849, test_loss: 1.3342, test_f1: 0.6265
 epoch: 96, train_loss: 0.2608, test_loss: 1.1806, test_f1: 0.6420
 epoch: 97, train_loss: 0.2648, test_loss: 1.2898, test_f1: 0.6551
 epoch: 98, train_loss: 0.2630, test_loss: 1.3105, test_f1: 0.6336
 epoch: 99, train_loss: 0.2547, test_loss: 1.3587, test_f1: 0.6295
##################ITERATION #8 ****************************************
 epoch: 0, train_loss: 1.2767, test_loss: 1.0189, test_f1: 0.4757
 epoch: 1, train_loss: 1.0106, test_loss: 0.9557, test_f1: 0.5283
 epoch: 2, train_loss: 0.9637, test_loss: 0.9403, test_f1: 0.5354
 epoch: 3, train_loss: 0.9218, test_loss: 0.9309, test_f1: 0.5560
 epoch: 4, train_loss: 0.9068, test_loss: 0.9115, test_f1: 0.5751
 epoch: 5, train_loss: 0.8925, test_loss: 0.9331, test_f1: 0.5039
 epoch: 6, train_loss: 0.8839, test_loss: 0.8768, test_f1: 0.5641
 epoch: 7, train_loss: 0.8570, test_loss: 0.8615, test_f1: 0.5617
 epoch: 8, train_loss: 0.8367, test_loss: 0.9172, test_f1: 0.5508
 epoch: 9, train_loss: 0.8159, test_loss: 0.8630, test_f1: 0.5982
 epoch: 10, train_loss: 0.8081, test_loss: 0.8749, test_f1: 0.5799
 epoch: 11, train_loss: 0.8033, test_loss: 0.8231, test_f1: 0.5984
 epoch: 12, train_loss: 0.7843, test_loss: 0.8396, test_f1: 0.5753
 epoch: 13, train_loss: 0.7682, test_loss: 0.8700, test_f1: 0.5855
 epoch: 14, train_loss: 0.7657, test_loss: 0.7954, test_f1: 0.6063
 epoch: 15, train_loss: 0.7428, test_loss: 0.8539, test_f1: 0.5689
 epoch: 16, train_loss: 0.7452, test_loss: 0.8406, test_f1: 0.6189
 epoch: 17, train_loss: 0.7303, test_loss: 0.9677, test_f1: 0.4964
 epoch: 18, train_loss: 0.7113, test_loss: 0.8619, test_f1: 0.6121
 epoch: 19, train_loss: 0.7210, test_loss: 0.8447, test_f1: 0.6009
 epoch: 20, train_loss: 0.7251, test_loss: 0.8190, test_f1: 0.5952
 epoch: 21, train_loss: 0.6985, test_loss: 0.8533, test_f1: 0.5815
 epoch: 22, train_loss: 0.7011, test_loss: 0.7572, test_f1: 0.6499
 epoch: 23, train_loss: 0.6807, test_loss: 0.8780, test_f1: 0.6020
 epoch: 24, train_loss: 0.6716, test_loss: 0.8418, test_f1: 0.5988
 epoch: 25, train_loss: 0.6681, test_loss: 0.8459, test_f1: 0.6143
 epoch: 26, train_loss: 0.6479, test_loss: 0.8289, test_f1: 0.5921
 epoch: 27, train_loss: 0.6425, test_loss: 0.8545, test_f1: 0.6117
 epoch: 28, train_loss: 0.6407, test_loss: 0.9597, test_f1: 0.6038
 epoch: 29, train_loss: 0.6304, test_loss: 0.8587, test_f1: 0.5996
 epoch: 30, train_loss: 0.6383, test_loss: 0.9454, test_f1: 0.5972
 epoch: 31, train_loss: 0.6215, test_loss: 0.9219, test_f1: 0.6326
 epoch: 32, train_loss: 0.6068, test_loss: 0.9013, test_f1: 0.6076
 epoch: 33, train_loss: 0.6134, test_loss: 0.8662, test_f1: 0.6202
 epoch: 34, train_loss: 0.5824, test_loss: 0.8185, test_f1: 0.6445
 epoch: 35, train_loss: 0.5796, test_loss: 0.9970, test_f1: 0.5951
 epoch: 36, train_loss: 0.5756, test_loss: 0.8588, test_f1: 0.6239
 epoch: 37, train_loss: 0.5874, test_loss: 0.8599, test_f1: 0.5914
 epoch: 38, train_loss: 0.5825, test_loss: 0.8690, test_f1: 0.6185
 epoch: 39, train_loss: 0.5639, test_loss: 0.8954, test_f1: 0.6055
 epoch: 40, train_loss: 0.5410, test_loss: 0.9722, test_f1: 0.6173
 epoch: 41, train_loss: 0.5562, test_loss: 0.9522, test_f1: 0.6082
 epoch: 42, train_loss: 0.5648, test_loss: 0.9162, test_f1: 0.6108
 epoch: 43, train_loss: 0.5325, test_loss: 0.8103, test_f1: 0.6674
 epoch: 44, train_loss: 0.5509, test_loss: 0.9781, test_f1: 0.6178
 epoch: 45, train_loss: 0.5494, test_loss: 0.8570, test_f1: 0.6557
 epoch: 46, train_loss: 0.5167, test_loss: 0.9098, test_f1: 0.6098
 epoch: 47, train_loss: 0.5189, test_loss: 0.7991, test_f1: 0.6533
 epoch: 48, train_loss: 0.5305, test_loss: 0.8576, test_f1: 0.6585
 epoch: 49, train_loss: 0.5122, test_loss: 0.8775, test_f1: 0.6459
 epoch: 50, train_loss: 0.5023, test_loss: 0.8620, test_f1: 0.6336
 epoch: 51, train_loss: 0.4704, test_loss: 0.8707, test_f1: 0.6504
 epoch: 52, train_loss: 0.4407, test_loss: 0.9539, test_f1: 0.6435
 epoch: 53, train_loss: 0.4291, test_loss: 0.9307, test_f1: 0.6502
 epoch: 54, train_loss: 0.4303, test_loss: 0.9608, test_f1: 0.6320
 epoch: 55, train_loss: 0.4304, test_loss: 0.9891, test_f1: 0.6370
 epoch: 56, train_loss: 0.4334, test_loss: 0.9522, test_f1: 0.6524
 epoch: 57, train_loss: 0.4166, test_loss: 0.9138, test_f1: 0.6813
 epoch: 58, train_loss: 0.4145, test_loss: 0.9350, test_f1: 0.6481
 epoch: 59, train_loss: 0.3988, test_loss: 1.0227, test_f1: 0.6356
 epoch: 60, train_loss: 0.4303, test_loss: 0.9069, test_f1: 0.6541
 epoch: 61, train_loss: 0.4149, test_loss: 0.9678, test_f1: 0.6574
 epoch: 62, train_loss: 0.3998, test_loss: 0.9373, test_f1: 0.6329
 epoch: 63, train_loss: 0.3848, test_loss: 1.0323, test_f1: 0.6321
 epoch: 64, train_loss: 0.3749, test_loss: 0.9386, test_f1: 0.6496
 epoch: 65, train_loss: 0.3836, test_loss: 0.9928, test_f1: 0.6541
 epoch: 66, train_loss: 0.3802, test_loss: 1.0841, test_f1: 0.6390
 epoch: 67, train_loss: 0.3813, test_loss: 1.0453, test_f1: 0.6411
 epoch: 68, train_loss: 0.3813, test_loss: 1.0714, test_f1: 0.6442
 epoch: 69, train_loss: 0.3895, test_loss: 0.9922, test_f1: 0.6460
 epoch: 70, train_loss: 0.3788, test_loss: 0.9955, test_f1: 0.6741
 epoch: 71, train_loss: 0.3657, test_loss: 1.0232, test_f1: 0.6371
 epoch: 72, train_loss: 0.3674, test_loss: 1.0525, test_f1: 0.6363
 epoch: 73, train_loss: 0.3704, test_loss: 1.0150, test_f1: 0.6405
 epoch: 74, train_loss: 0.3622, test_loss: 1.0137, test_f1: 0.6461
 epoch: 75, train_loss: 0.3565, test_loss: 1.1032, test_f1: 0.6589
 epoch: 76, train_loss: 0.3586, test_loss: 1.0612, test_f1: 0.6363
 epoch: 77, train_loss: 0.3664, test_loss: 0.9973, test_f1: 0.6639
 epoch: 78, train_loss: 0.3446, test_loss: 0.9986, test_f1: 0.6695
 epoch: 79, train_loss: 0.3585, test_loss: 1.1156, test_f1: 0.6359
 epoch: 80, train_loss: 0.3377, test_loss: 1.1060, test_f1: 0.6302
 epoch: 81, train_loss: 0.3365, test_loss: 1.0080, test_f1: 0.6499
 epoch: 82, train_loss: 0.3658, test_loss: 1.1507, test_f1: 0.6157
 epoch: 83, train_loss: 0.3490, test_loss: 0.9776, test_f1: 0.6731
 epoch: 84, train_loss: 0.3306, test_loss: 1.0524, test_f1: 0.6614
 epoch: 85, train_loss: 0.3346, test_loss: 1.0435, test_f1: 0.6325
 epoch: 86, train_loss: 0.3296, test_loss: 1.0824, test_f1: 0.6824
 epoch: 87, train_loss: 0.3314, test_loss: 1.0087, test_f1: 0.6650
 epoch: 88, train_loss: 0.3410, test_loss: 1.0826, test_f1: 0.6622
 epoch: 89, train_loss: 0.3303, test_loss: 1.0223, test_f1: 0.6585
 epoch: 90, train_loss: 0.3230, test_loss: 1.0979, test_f1: 0.6509
 epoch: 91, train_loss: 0.3355, test_loss: 1.1023, test_f1: 0.6574
 epoch: 92, train_loss: 0.3133, test_loss: 1.1517, test_f1: 0.6058
 epoch: 93, train_loss: 0.3204, test_loss: 1.0811, test_f1: 0.6451
 epoch: 94, train_loss: 0.3052, test_loss: 1.0061, test_f1: 0.6538
 epoch: 95, train_loss: 0.3104, test_loss: 1.0720, test_f1: 0.6712
 epoch: 96, train_loss: 0.3211, test_loss: 1.2158, test_f1: 0.6329
 epoch: 97, train_loss: 0.3098, test_loss: 1.1168, test_f1: 0.6758
 epoch: 98, train_loss: 0.3133, test_loss: 0.9708, test_f1: 0.6789
 epoch: 99, train_loss: 0.3032, test_loss: 1.0904, test_f1: 0.6357
##################ITERATION #9 ****************************************
 epoch: 0, train_loss: 1.2338, test_loss: 1.0942, test_f1: 0.3963
 epoch: 1, train_loss: 1.0275, test_loss: 1.0334, test_f1: 0.5030
 epoch: 2, train_loss: 0.9719, test_loss: 1.0079, test_f1: 0.5159
 epoch: 3, train_loss: 0.9665, test_loss: 1.0216, test_f1: 0.4898
 epoch: 4, train_loss: 0.9341, test_loss: 1.0384, test_f1: 0.5046
 epoch: 5, train_loss: 0.8924, test_loss: 0.9550, test_f1: 0.5630
 epoch: 6, train_loss: 0.8828, test_loss: 0.9632, test_f1: 0.5378
 epoch: 7, train_loss: 0.8572, test_loss: 0.9454, test_f1: 0.5803
 epoch: 8, train_loss: 0.8427, test_loss: 0.9282, test_f1: 0.5492
 epoch: 9, train_loss: 0.8149, test_loss: 0.9707, test_f1: 0.5088
 epoch: 10, train_loss: 0.8014, test_loss: 0.8839, test_f1: 0.5356
 epoch: 11, train_loss: 0.7765, test_loss: 0.9574, test_f1: 0.5171
 epoch: 12, train_loss: 0.7943, test_loss: 0.8633, test_f1: 0.5634
 epoch: 13, train_loss: 0.7695, test_loss: 0.9368, test_f1: 0.5693
 epoch: 14, train_loss: 0.7649, test_loss: 0.8764, test_f1: 0.5535
 epoch: 15, train_loss: 0.7567, test_loss: 0.8469, test_f1: 0.5326
 epoch: 16, train_loss: 0.7303, test_loss: 0.8897, test_f1: 0.5760
 epoch: 17, train_loss: 0.7099, test_loss: 0.9237, test_f1: 0.5870
 epoch: 18, train_loss: 0.7256, test_loss: 0.8666, test_f1: 0.6056
 epoch: 19, train_loss: 0.7109, test_loss: 0.8506, test_f1: 0.5997
 epoch: 20, train_loss: 0.6914, test_loss: 0.9664, test_f1: 0.5749
 epoch: 21, train_loss: 0.6795, test_loss: 0.8608, test_f1: 0.6196
 epoch: 22, train_loss: 0.6673, test_loss: 0.9581, test_f1: 0.5980
 epoch: 23, train_loss: 0.6883, test_loss: 0.9236, test_f1: 0.6106
 epoch: 24, train_loss: 0.6630, test_loss: 0.9447, test_f1: 0.5695
 epoch: 25, train_loss: 0.6589, test_loss: 0.8965, test_f1: 0.6079
 epoch: 26, train_loss: 0.6583, test_loss: 0.8171, test_f1: 0.5930
 epoch: 27, train_loss: 0.6367, test_loss: 0.8843, test_f1: 0.5923
 epoch: 28, train_loss: 0.6290, test_loss: 0.8707, test_f1: 0.6057
 epoch: 29, train_loss: 0.6309, test_loss: 0.9641, test_f1: 0.6036
 epoch: 30, train_loss: 0.6109, test_loss: 0.8619, test_f1: 0.6086
 epoch: 31, train_loss: 0.6153, test_loss: 0.8501, test_f1: 0.6400
 epoch: 32, train_loss: 0.5888, test_loss: 0.9464, test_f1: 0.6085
 epoch: 33, train_loss: 0.5930, test_loss: 0.8947, test_f1: 0.6124
 epoch: 34, train_loss: 0.5923, test_loss: 0.8993, test_f1: 0.6081
 epoch: 35, train_loss: 0.5974, test_loss: 0.8683, test_f1: 0.6414
 epoch: 36, train_loss: 0.5773, test_loss: 1.0018, test_f1: 0.6135
 epoch: 37, train_loss: 0.5722, test_loss: 1.0642, test_f1: 0.5780
 epoch: 38, train_loss: 0.5611, test_loss: 0.9426, test_f1: 0.6096
 epoch: 39, train_loss: 0.5681, test_loss: 0.9566, test_f1: 0.6328
 epoch: 40, train_loss: 0.5620, test_loss: 0.8914, test_f1: 0.6400
 epoch: 41, train_loss: 0.5620, test_loss: 0.9869, test_f1: 0.6297
 epoch: 42, train_loss: 0.5370, test_loss: 0.9537, test_f1: 0.6346
 epoch: 43, train_loss: 0.5292, test_loss: 0.9629, test_f1: 0.6159
 epoch: 44, train_loss: 0.5477, test_loss: 0.9656, test_f1: 0.6598
 epoch: 45, train_loss: 0.5141, test_loss: 0.9832, test_f1: 0.6289
 epoch: 46, train_loss: 0.5354, test_loss: 0.9665, test_f1: 0.6373
 epoch: 47, train_loss: 0.5199, test_loss: 0.9342, test_f1: 0.6509
 epoch: 48, train_loss: 0.5059, test_loss: 0.9474, test_f1: 0.6539
 epoch: 49, train_loss: 0.5285, test_loss: 0.9622, test_f1: 0.6205
 epoch: 50, train_loss: 0.4988, test_loss: 0.9332, test_f1: 0.6702
 epoch: 51, train_loss: 0.4685, test_loss: 0.9238, test_f1: 0.6767
 epoch: 52, train_loss: 0.4464, test_loss: 0.9489, test_f1: 0.6623
 epoch: 53, train_loss: 0.4254, test_loss: 0.9274, test_f1: 0.6609
 epoch: 54, train_loss: 0.4296, test_loss: 1.0658, test_f1: 0.6353
 epoch: 55, train_loss: 0.4525, test_loss: 0.9949, test_f1: 0.6439
 epoch: 56, train_loss: 0.4341, test_loss: 0.9778, test_f1: 0.6634
 epoch: 57, train_loss: 0.4201, test_loss: 0.9845, test_f1: 0.6570
 epoch: 58, train_loss: 0.4269, test_loss: 0.9507, test_f1: 0.6747
 epoch: 59, train_loss: 0.4087, test_loss: 0.9850, test_f1: 0.6619
 epoch: 60, train_loss: 0.4080, test_loss: 0.9215, test_f1: 0.6881
 epoch: 61, train_loss: 0.4145, test_loss: 1.0126, test_f1: 0.6494
 epoch: 62, train_loss: 0.4046, test_loss: 0.9975, test_f1: 0.6667
 epoch: 63, train_loss: 0.4123, test_loss: 0.9295, test_f1: 0.6677
 epoch: 64, train_loss: 0.3981, test_loss: 0.9782, test_f1: 0.6510
 epoch: 65, train_loss: 0.4008, test_loss: 1.0030, test_f1: 0.6712
 epoch: 66, train_loss: 0.3863, test_loss: 1.0186, test_f1: 0.6576
 epoch: 67, train_loss: 0.3803, test_loss: 1.0323, test_f1: 0.6757
 epoch: 68, train_loss: 0.3856, test_loss: 0.9668, test_f1: 0.6682
 epoch: 69, train_loss: 0.3908, test_loss: 1.0112, test_f1: 0.6404
 epoch: 70, train_loss: 0.3816, test_loss: 1.1568, test_f1: 0.6385
 epoch: 71, train_loss: 0.3694, test_loss: 1.0283, test_f1: 0.6574
 epoch: 72, train_loss: 0.3748, test_loss: 0.9918, test_f1: 0.6709
 epoch: 73, train_loss: 0.3877, test_loss: 0.9759, test_f1: 0.6646
 epoch: 74, train_loss: 0.3753, test_loss: 1.0606, test_f1: 0.6475
 epoch: 75, train_loss: 0.3727, test_loss: 0.9448, test_f1: 0.6741
 epoch: 76, train_loss: 0.3607, test_loss: 0.9914, test_f1: 0.6803
 epoch: 77, train_loss: 0.3565, test_loss: 1.0125, test_f1: 0.6674
 epoch: 78, train_loss: 0.3608, test_loss: 1.0563, test_f1: 0.6618
 epoch: 79, train_loss: 0.3614, test_loss: 1.0392, test_f1: 0.6643
 epoch: 80, train_loss: 0.3452, test_loss: 1.0576, test_f1: 0.6608
 epoch: 81, train_loss: 0.3312, test_loss: 1.0698, test_f1: 0.6514
 epoch: 82, train_loss: 0.3431, test_loss: 1.0162, test_f1: 0.6841
 epoch: 83, train_loss: 0.3371, test_loss: 1.1083, test_f1: 0.6599
 epoch: 84, train_loss: 0.3209, test_loss: 1.1238, test_f1: 0.6390
 epoch: 85, train_loss: 0.3361, test_loss: 1.1303, test_f1: 0.6582
 epoch: 86, train_loss: 0.3522, test_loss: 1.0707, test_f1: 0.6718
 epoch: 87, train_loss: 0.3417, test_loss: 1.0379, test_f1: 0.6677
 epoch: 88, train_loss: 0.3251, test_loss: 1.1067, test_f1: 0.6616
 epoch: 89, train_loss: 0.3329, test_loss: 1.1854, test_f1: 0.6459
 epoch: 90, train_loss: 0.3274, test_loss: 1.1157, test_f1: 0.6738
 epoch: 91, train_loss: 0.3094, test_loss: 1.1064, test_f1: 0.6577
 epoch: 92, train_loss: 0.3186, test_loss: 1.2407, test_f1: 0.6395
 epoch: 93, train_loss: 0.3086, test_loss: 1.1290, test_f1: 0.6498
 epoch: 94, train_loss: 0.3156, test_loss: 1.2163, test_f1: 0.6486
 epoch: 95, train_loss: 0.3000, test_loss: 1.2324, test_f1: 0.6449
 epoch: 96, train_loss: 0.3259, test_loss: 1.0910, test_f1: 0.6586
 epoch: 97, train_loss: 0.3129, test_loss: 1.0864, test_f1: 0.6792
 epoch: 98, train_loss: 0.2954, test_loss: 1.2483, test_f1: 0.6529
 epoch: 99, train_loss: 0.3071, test_loss: 1.2171, test_f1: 0.6370

Training completed in 641.47 seconds
Best F1: 0.7136 at epoch 68
Mean F1 across iterations: 0.6872  0.0131
========================FINAL RESULTS================================
FEGIN weighted F1: 0.7136  0.0131
python main.py --data ltspice_examples --representation component_pin --model FEGIN --layers 3 --hiddens 64 --batch_size 64 --lr 0.001 --emb_size 250 --epochs 100 --save_appendix component_pin_L3_H64_BS64_LR0.001_E250 --no_val
-----



STDERR:
  File "main.py", line 370, in <module>
    main()
  File "main.py", line 254, in main
    dataset = dataset_class(
  File "/home/philip/projects/ltspice_examples_code_repo/Circuit-Completion-Using-GNNs/component_classification_with_link_prediction_head/evaluation/FEGIN/kernel/circuit_datasets.py", line 15, in __init__
    self.data, self.slices = torch.load(self.processed_paths[0])
  File "/home/philip/.local/lib/python3.8/site-packages/torch/serialization.py", line 1040, in load
    warnings.warn(
  File "/usr/lib/python3.8/warnings.py", line 109, in _showwarnmsg
    sw(msg.message, msg.category, msg.filename, msg.lineno,
  File "main.py", line 47, in warn_with_traceback
    traceback.print_stack(file=log)
/home/philip/projects/ltspice_examples_code_repo/Circuit-Completion-Using-GNNs/component_classification_with_link_prediction_head/evaluation/FEGIN/kernel/circuit_datasets.py:15: FutureWarning: You are using `torch.load` with `weights_only=False` (the current default value), which uses the default pickle module implicitly. It is possible to construct malicious pickle data which will execute arbitrary code during unpickling (See https://github.com/pytorch/pytorch/blob/main/SECURITY.md#untrusted-models for more details). In a future release, the default value for `weights_only` will be flipped to `True`. This limits the functions that could be executed during unpickling. Arbitrary objects will no longer be allowed to be loaded via this mode unless they are explicitly allowlisted by the user via `torch.serialization.add_safe_globals`. We recommend you start setting `weights_only=True` for any use case where you don't have full control of the loaded file. Please open an issue on GitHub for any issues related to this experimental feature.
  self.data, self.slices = torch.load(self.processed_paths[0])
