STDOUT:
Results will be saved in /home/philip/projects/ltspice_examples_code_repo/Circuit-Completion-Using-GNNs/component_classification_with_link_prediction_head/evaluation/FEGIN/results/model_FEGIN_dataset_ltspice_examples
Command line input: python main.py --data ltspice_examples --representation component_component --model FEGIN --layers 5 --hiddens 32 --batch_size 64 --lr 0.01 --emb_size 250 --epochs 100 --save_appendix component_component_L5_H32_BS64_LR0.01_E250 --no_val
 is saved.
-----
ltspice_examples - FEGIN
Using 5 layers, 32 hidden units, h = 2
Loading component_component representation dataset
ENTERED
Training FEGIN on component_component representation
Train: 3556, Test: 845
##################ITERATION #0 ****************************************
 epoch: 0, train_loss: 1.2653, test_loss: 1.4781, test_f1: 0.3200
 epoch: 1, train_loss: 1.1997, test_loss: 1.1419, test_f1: 0.3707
 epoch: 2, train_loss: 1.1299, test_loss: 1.0702, test_f1: 0.3841
 epoch: 3, train_loss: 1.1138, test_loss: 1.0369, test_f1: 0.4172
 epoch: 4, train_loss: 1.0972, test_loss: 1.0366, test_f1: 0.4354
 epoch: 5, train_loss: 1.0584, test_loss: 1.1813, test_f1: 0.4584
 epoch: 6, train_loss: 1.0384, test_loss: 1.0767, test_f1: 0.4321
 epoch: 7, train_loss: 1.0138, test_loss: 1.0431, test_f1: 0.4630
 epoch: 8, train_loss: 1.0023, test_loss: 1.0062, test_f1: 0.4775
 epoch: 9, train_loss: 0.9818, test_loss: 1.0878, test_f1: 0.4433
 epoch: 10, train_loss: 0.9787, test_loss: 1.0152, test_f1: 0.4670
 epoch: 11, train_loss: 0.9777, test_loss: 0.9416, test_f1: 0.4985
 epoch: 12, train_loss: 0.9355, test_loss: 1.0276, test_f1: 0.5171
 epoch: 13, train_loss: 0.9462, test_loss: 0.9343, test_f1: 0.5166
 epoch: 14, train_loss: 0.9253, test_loss: 0.9659, test_f1: 0.5385
 epoch: 15, train_loss: 0.9170, test_loss: 0.9707, test_f1: 0.4886
 epoch: 16, train_loss: 0.9048, test_loss: 0.9872, test_f1: 0.5029
 epoch: 17, train_loss: 0.9377, test_loss: 0.9589, test_f1: 0.5175
 epoch: 18, train_loss: 0.9297, test_loss: 1.0040, test_f1: 0.4849
 epoch: 19, train_loss: 0.9018, test_loss: 1.0302, test_f1: 0.5135
 epoch: 20, train_loss: 0.9109, test_loss: 0.9135, test_f1: 0.5199
 epoch: 21, train_loss: 0.8831, test_loss: 0.9252, test_f1: 0.5022
 epoch: 22, train_loss: 0.8749, test_loss: 1.0362, test_f1: 0.4849
 epoch: 23, train_loss: 0.8742, test_loss: 1.1358, test_f1: 0.4708
 epoch: 24, train_loss: 0.8799, test_loss: 1.0311, test_f1: 0.4825
 epoch: 25, train_loss: 0.8789, test_loss: 1.1127, test_f1: 0.4932
 epoch: 26, train_loss: 0.8622, test_loss: 1.0330, test_f1: 0.5059
 epoch: 27, train_loss: 0.8699, test_loss: 1.1021, test_f1: 0.4933
 epoch: 28, train_loss: 0.8525, test_loss: 1.0580, test_f1: 0.5042
 epoch: 29, train_loss: 0.8452, test_loss: 1.1260, test_f1: 0.4782
 epoch: 30, train_loss: 0.8557, test_loss: 1.0255, test_f1: 0.5168
 epoch: 31, train_loss: 0.8346, test_loss: 1.0747, test_f1: 0.4888
 epoch: 32, train_loss: 0.8338, test_loss: 1.0421, test_f1: 0.5253
 epoch: 33, train_loss: 0.8339, test_loss: 1.1315, test_f1: 0.5019
 epoch: 34, train_loss: 0.8232, test_loss: 1.2953, test_f1: 0.5151
 epoch: 35, train_loss: 0.8366, test_loss: 1.1324, test_f1: 0.5214
 epoch: 36, train_loss: 0.8511, test_loss: 1.1487, test_f1: 0.5034
 epoch: 37, train_loss: 0.8265, test_loss: 1.0442, test_f1: 0.5589
 epoch: 38, train_loss: 0.8226, test_loss: 1.2092, test_f1: 0.4730
 epoch: 39, train_loss: 0.8171, test_loss: 1.2350, test_f1: 0.4943
 epoch: 40, train_loss: 0.8030, test_loss: 1.1286, test_f1: 0.5115
 epoch: 41, train_loss: 0.8402, test_loss: 1.1062, test_f1: 0.5357
 epoch: 42, train_loss: 0.8350, test_loss: 1.0623, test_f1: 0.5453
 epoch: 43, train_loss: 0.8164, test_loss: 1.2049, test_f1: 0.4972
 epoch: 44, train_loss: 0.8204, test_loss: 1.2732, test_f1: 0.4733
 epoch: 45, train_loss: 0.8299, test_loss: 1.1089, test_f1: 0.5488
 epoch: 46, train_loss: 0.8158, test_loss: 1.0904, test_f1: 0.5554
 epoch: 47, train_loss: 0.8106, test_loss: 1.4393, test_f1: 0.4805
 epoch: 48, train_loss: 0.8158, test_loss: 1.2179, test_f1: 0.5096
 epoch: 49, train_loss: 0.8085, test_loss: 1.2159, test_f1: 0.5049
 epoch: 50, train_loss: 0.7978, test_loss: 1.2315, test_f1: 0.4981
 epoch: 51, train_loss: 0.7752, test_loss: 1.2681, test_f1: 0.5304
 epoch: 52, train_loss: 0.7486, test_loss: 1.3836, test_f1: 0.4805
 epoch: 53, train_loss: 0.7625, test_loss: 1.0548, test_f1: 0.5605
 epoch: 54, train_loss: 0.7488, test_loss: 1.1621, test_f1: 0.5364
 epoch: 55, train_loss: 0.7499, test_loss: 1.1993, test_f1: 0.5477
 epoch: 56, train_loss: 0.7359, test_loss: 1.1891, test_f1: 0.5277
 epoch: 57, train_loss: 0.7564, test_loss: 1.1460, test_f1: 0.5651
 epoch: 58, train_loss: 0.7445, test_loss: 1.2957, test_f1: 0.5088
 epoch: 59, train_loss: 0.7440, test_loss: 1.3400, test_f1: 0.5258
 epoch: 60, train_loss: 0.7636, test_loss: 1.1559, test_f1: 0.5426
 epoch: 61, train_loss: 0.7486, test_loss: 1.2603, test_f1: 0.5200
 epoch: 62, train_loss: 0.7274, test_loss: 1.2542, test_f1: 0.5312
 epoch: 63, train_loss: 0.7263, test_loss: 1.3675, test_f1: 0.5219
 epoch: 64, train_loss: 0.7219, test_loss: 1.1988, test_f1: 0.5524
 epoch: 65, train_loss: 0.7238, test_loss: 1.2844, test_f1: 0.5321
 epoch: 66, train_loss: 0.7137, test_loss: 1.3499, test_f1: 0.5234
 epoch: 67, train_loss: 0.7379, test_loss: 1.4249, test_f1: 0.5311
 epoch: 68, train_loss: 0.7074, test_loss: 1.5094, test_f1: 0.5035
 epoch: 69, train_loss: 0.7072, test_loss: 1.4373, test_f1: 0.5307
 epoch: 70, train_loss: 0.7325, test_loss: 1.4899, test_f1: 0.5043
 epoch: 71, train_loss: 0.6977, test_loss: 1.6053, test_f1: 0.5224
 epoch: 72, train_loss: 0.7072, test_loss: 1.2329, test_f1: 0.5319
 epoch: 73, train_loss: 0.7020, test_loss: 1.3198, test_f1: 0.5430
 epoch: 74, train_loss: 0.7125, test_loss: 1.3583, test_f1: 0.4884
 epoch: 75, train_loss: 0.7092, test_loss: 1.2658, test_f1: 0.5450
 epoch: 76, train_loss: 0.6881, test_loss: 1.3796, test_f1: 0.4853
 epoch: 77, train_loss: 0.6947, test_loss: 1.6301, test_f1: 0.5056
 epoch: 78, train_loss: 0.7112, test_loss: 1.2182, test_f1: 0.5402
 epoch: 79, train_loss: 0.6967, test_loss: 1.3316, test_f1: 0.5378
 epoch: 80, train_loss: 0.6961, test_loss: 1.2322, test_f1: 0.5535
 epoch: 81, train_loss: 0.6872, test_loss: 1.3004, test_f1: 0.5444
 epoch: 82, train_loss: 0.6938, test_loss: 1.5983, test_f1: 0.5355
 epoch: 83, train_loss: 0.6755, test_loss: 1.3648, test_f1: 0.5348
 epoch: 84, train_loss: 0.6802, test_loss: 1.3751, test_f1: 0.5207
 epoch: 85, train_loss: 0.6570, test_loss: 1.3693, test_f1: 0.5413
 epoch: 86, train_loss: 0.6646, test_loss: 1.5660, test_f1: 0.5226
 epoch: 87, train_loss: 0.6837, test_loss: 1.2286, test_f1: 0.5544
 epoch: 88, train_loss: 0.6882, test_loss: 1.2522, test_f1: 0.5528
 epoch: 89, train_loss: 0.6760, test_loss: 1.3513, test_f1: 0.5558
 epoch: 90, train_loss: 0.6755, test_loss: 1.3434, test_f1: 0.5080
 epoch: 91, train_loss: 0.6774, test_loss: 1.2949, test_f1: 0.5254
 epoch: 92, train_loss: 0.6750, test_loss: 1.3124, test_f1: 0.5385
 epoch: 93, train_loss: 0.6754, test_loss: 1.3929, test_f1: 0.5064
 epoch: 94, train_loss: 0.6629, test_loss: 1.4092, test_f1: 0.5424
 epoch: 95, train_loss: 0.6704, test_loss: 1.3105, test_f1: 0.5556
 epoch: 96, train_loss: 0.6663, test_loss: 1.3092, test_f1: 0.5539
 epoch: 97, train_loss: 0.6732, test_loss: 1.5633, test_f1: 0.5080
 epoch: 98, train_loss: 0.6464, test_loss: 1.3622, test_f1: 0.5498
 epoch: 99, train_loss: 0.6669, test_loss: 1.3097, test_f1: 0.5226
##################ITERATION #1 ****************************************
 epoch: 0, train_loss: 1.2649, test_loss: 1.1894, test_f1: 0.3090
 epoch: 1, train_loss: 1.1952, test_loss: 1.1040, test_f1: 0.4588
 epoch: 2, train_loss: 1.1316, test_loss: 1.0511, test_f1: 0.4536
 epoch: 3, train_loss: 1.1016, test_loss: 1.0852, test_f1: 0.4392
 epoch: 4, train_loss: 1.0672, test_loss: 0.9782, test_f1: 0.4844
 epoch: 5, train_loss: 1.0380, test_loss: 1.0306, test_f1: 0.4797
 epoch: 6, train_loss: 1.0288, test_loss: 1.0096, test_f1: 0.4758
 epoch: 7, train_loss: 0.9994, test_loss: 0.9774, test_f1: 0.4930
 epoch: 8, train_loss: 0.9885, test_loss: 0.9847, test_f1: 0.5199
 epoch: 9, train_loss: 0.9804, test_loss: 1.0815, test_f1: 0.4778
 epoch: 10, train_loss: 0.9677, test_loss: 1.0019, test_f1: 0.4888
 epoch: 11, train_loss: 0.9617, test_loss: 0.9868, test_f1: 0.4887
 epoch: 12, train_loss: 0.9424, test_loss: 1.0096, test_f1: 0.4679
 epoch: 13, train_loss: 0.9595, test_loss: 0.9906, test_f1: 0.4998
 epoch: 14, train_loss: 0.9340, test_loss: 1.1231, test_f1: 0.4601
 epoch: 15, train_loss: 0.9276, test_loss: 1.0206, test_f1: 0.5246
 epoch: 16, train_loss: 0.9179, test_loss: 0.9986, test_f1: 0.4702
 epoch: 17, train_loss: 0.9285, test_loss: 0.9874, test_f1: 0.4918
 epoch: 18, train_loss: 0.9228, test_loss: 1.0026, test_f1: 0.5087
 epoch: 19, train_loss: 0.9214, test_loss: 1.0042, test_f1: 0.5514
 epoch: 20, train_loss: 0.9023, test_loss: 1.0347, test_f1: 0.5089
 epoch: 21, train_loss: 0.8889, test_loss: 0.9546, test_f1: 0.5347
 epoch: 22, train_loss: 0.8834, test_loss: 1.0205, test_f1: 0.5106
 epoch: 23, train_loss: 0.8958, test_loss: 1.0617, test_f1: 0.5088
 epoch: 24, train_loss: 0.8788, test_loss: 1.0572, test_f1: 0.5069
 epoch: 25, train_loss: 0.8871, test_loss: 0.9916, test_f1: 0.4947
 epoch: 26, train_loss: 0.8784, test_loss: 1.0569, test_f1: 0.4978
 epoch: 27, train_loss: 0.8614, test_loss: 0.9816, test_f1: 0.5265
 epoch: 28, train_loss: 0.8579, test_loss: 1.0638, test_f1: 0.5328
 epoch: 29, train_loss: 0.8595, test_loss: 0.9925, test_f1: 0.5165
 epoch: 30, train_loss: 0.8558, test_loss: 1.1611, test_f1: 0.4823
 epoch: 31, train_loss: 0.8427, test_loss: 1.2504, test_f1: 0.4986
 epoch: 32, train_loss: 0.8513, test_loss: 1.0869, test_f1: 0.5574
 epoch: 33, train_loss: 0.8507, test_loss: 1.1676, test_f1: 0.5083
 epoch: 34, train_loss: 0.8611, test_loss: 0.9855, test_f1: 0.5429
 epoch: 35, train_loss: 0.8465, test_loss: 1.0777, test_f1: 0.5191
 epoch: 36, train_loss: 0.8594, test_loss: 1.0706, test_f1: 0.5056
 epoch: 37, train_loss: 0.8266, test_loss: 1.1093, test_f1: 0.5110
 epoch: 38, train_loss: 0.8507, test_loss: 1.2554, test_f1: 0.5087
 epoch: 39, train_loss: 0.8560, test_loss: 1.1032, test_f1: 0.5260
 epoch: 40, train_loss: 0.8590, test_loss: 1.2810, test_f1: 0.4666
 epoch: 41, train_loss: 0.8481, test_loss: 0.9977, test_f1: 0.5471
 epoch: 42, train_loss: 0.8352, test_loss: 1.0498, test_f1: 0.5567
 epoch: 43, train_loss: 0.8386, test_loss: 1.1074, test_f1: 0.5414
 epoch: 44, train_loss: 0.8212, test_loss: 1.0873, test_f1: 0.5121
 epoch: 45, train_loss: 0.8200, test_loss: 1.2573, test_f1: 0.5331
 epoch: 46, train_loss: 0.7997, test_loss: 1.1320, test_f1: 0.5375
 epoch: 47, train_loss: 0.8249, test_loss: 0.9867, test_f1: 0.5703
 epoch: 48, train_loss: 0.8125, test_loss: 1.1257, test_f1: 0.5506
 epoch: 49, train_loss: 0.7996, test_loss: 1.4264, test_f1: 0.5009
 epoch: 50, train_loss: 0.8232, test_loss: 1.2137, test_f1: 0.5344
 epoch: 51, train_loss: 0.7843, test_loss: 1.0760, test_f1: 0.5627
 epoch: 52, train_loss: 0.7695, test_loss: 1.1546, test_f1: 0.5442
 epoch: 53, train_loss: 0.7642, test_loss: 1.0940, test_f1: 0.5479
 epoch: 54, train_loss: 0.7555, test_loss: 1.2124, test_f1: 0.5342
 epoch: 55, train_loss: 0.7537, test_loss: 1.0840, test_f1: 0.5407
 epoch: 56, train_loss: 0.7494, test_loss: 1.1391, test_f1: 0.5417
 epoch: 57, train_loss: 0.7510, test_loss: 1.1110, test_f1: 0.5650
 epoch: 58, train_loss: 0.7494, test_loss: 1.2211, test_f1: 0.5231
 epoch: 59, train_loss: 0.7378, test_loss: 1.2249, test_f1: 0.5349
 epoch: 60, train_loss: 0.7421, test_loss: 1.1280, test_f1: 0.5449
 epoch: 61, train_loss: 0.7493, test_loss: 1.1294, test_f1: 0.5503
 epoch: 62, train_loss: 0.7508, test_loss: 1.1012, test_f1: 0.5796
 epoch: 63, train_loss: 0.7333, test_loss: 1.1388, test_f1: 0.5501
 epoch: 64, train_loss: 0.7195, test_loss: 1.1374, test_f1: 0.5612
 epoch: 65, train_loss: 0.7356, test_loss: 1.2049, test_f1: 0.5656
 epoch: 66, train_loss: 0.7248, test_loss: 1.1651, test_f1: 0.5407
 epoch: 67, train_loss: 0.7169, test_loss: 1.1487, test_f1: 0.5778
 epoch: 68, train_loss: 0.7156, test_loss: 1.1532, test_f1: 0.5561
 epoch: 69, train_loss: 0.7170, test_loss: 1.0989, test_f1: 0.5917
 epoch: 70, train_loss: 0.7157, test_loss: 1.0796, test_f1: 0.5779
 epoch: 71, train_loss: 0.7099, test_loss: 1.0671, test_f1: 0.5492
 epoch: 72, train_loss: 0.7078, test_loss: 1.1036, test_f1: 0.5606
 epoch: 73, train_loss: 0.6979, test_loss: 1.1278, test_f1: 0.5840
 epoch: 74, train_loss: 0.7046, test_loss: 1.1207, test_f1: 0.5482
 epoch: 75, train_loss: 0.7116, test_loss: 1.1488, test_f1: 0.5393
 epoch: 76, train_loss: 0.7077, test_loss: 1.0913, test_f1: 0.5676
 epoch: 77, train_loss: 0.6951, test_loss: 1.1295, test_f1: 0.5677
 epoch: 78, train_loss: 0.6949, test_loss: 1.3154, test_f1: 0.4899
 epoch: 79, train_loss: 0.7145, test_loss: 1.0768, test_f1: 0.5755
 epoch: 80, train_loss: 0.7011, test_loss: 1.0981, test_f1: 0.5551
 epoch: 81, train_loss: 0.6904, test_loss: 1.1366, test_f1: 0.5813
 epoch: 82, train_loss: 0.6802, test_loss: 1.1939, test_f1: 0.5782
 epoch: 83, train_loss: 0.7096, test_loss: 1.4325, test_f1: 0.5040
 epoch: 84, train_loss: 0.6837, test_loss: 1.2237, test_f1: 0.5363
 epoch: 85, train_loss: 0.6973, test_loss: 1.1139, test_f1: 0.5600
 epoch: 86, train_loss: 0.6911, test_loss: 1.0927, test_f1: 0.5557
 epoch: 87, train_loss: 0.6849, test_loss: 1.0249, test_f1: 0.5767
 epoch: 88, train_loss: 0.6796, test_loss: 1.1825, test_f1: 0.5573
 epoch: 89, train_loss: 0.6781, test_loss: 1.4001, test_f1: 0.4965
 epoch: 90, train_loss: 0.6810, test_loss: 1.1780, test_f1: 0.5349
 epoch: 91, train_loss: 0.6636, test_loss: 1.1729, test_f1: 0.5677
 epoch: 92, train_loss: 0.6979, test_loss: 1.1418, test_f1: 0.5511
 epoch: 93, train_loss: 0.6858, test_loss: 1.1604, test_f1: 0.5610
 epoch: 94, train_loss: 0.6691, test_loss: 1.1904, test_f1: 0.5596
 epoch: 95, train_loss: 0.6684, test_loss: 1.1316, test_f1: 0.5807
 epoch: 96, train_loss: 0.6768, test_loss: 1.1266, test_f1: 0.5635
 epoch: 97, train_loss: 0.6621, test_loss: 1.2289, test_f1: 0.5747
 epoch: 98, train_loss: 0.6669, test_loss: 1.3028, test_f1: 0.5070
 epoch: 99, train_loss: 0.6611, test_loss: 1.0826, test_f1: 0.5783
##################ITERATION #2 ****************************************
 epoch: 0, train_loss: 1.2874, test_loss: 1.1921, test_f1: 0.3348
 epoch: 1, train_loss: 1.1840, test_loss: 1.0965, test_f1: 0.4013
 epoch: 2, train_loss: 1.1113, test_loss: 1.0843, test_f1: 0.4205
 epoch: 3, train_loss: 1.0607, test_loss: 1.0386, test_f1: 0.4522
 epoch: 4, train_loss: 1.0580, test_loss: 0.9684, test_f1: 0.4600
 epoch: 5, train_loss: 1.0235, test_loss: 0.9639, test_f1: 0.4441
 epoch: 6, train_loss: 1.0052, test_loss: 0.9880, test_f1: 0.5053
 epoch: 7, train_loss: 1.0074, test_loss: 0.9451, test_f1: 0.4728
 epoch: 8, train_loss: 0.9982, test_loss: 1.0385, test_f1: 0.4360
 epoch: 9, train_loss: 0.9950, test_loss: 0.9841, test_f1: 0.5007
 epoch: 10, train_loss: 0.9552, test_loss: 0.9739, test_f1: 0.4965
 epoch: 11, train_loss: 0.9550, test_loss: 0.9302, test_f1: 0.5178
 epoch: 12, train_loss: 0.9639, test_loss: 0.9755, test_f1: 0.4850
 epoch: 13, train_loss: 0.9416, test_loss: 1.0098, test_f1: 0.4891
 epoch: 14, train_loss: 0.9310, test_loss: 0.9913, test_f1: 0.4918
 epoch: 15, train_loss: 0.9168, test_loss: 1.0429, test_f1: 0.5048
 epoch: 16, train_loss: 0.9264, test_loss: 0.9309, test_f1: 0.5339
 epoch: 17, train_loss: 0.9273, test_loss: 0.9921, test_f1: 0.5016
 epoch: 18, train_loss: 0.9073, test_loss: 0.9945, test_f1: 0.5001
 epoch: 19, train_loss: 0.9158, test_loss: 0.9473, test_f1: 0.5119
 epoch: 20, train_loss: 0.9077, test_loss: 0.9974, test_f1: 0.5073
 epoch: 21, train_loss: 0.8780, test_loss: 0.9793, test_f1: 0.5181
 epoch: 22, train_loss: 0.8861, test_loss: 1.1002, test_f1: 0.4833
 epoch: 23, train_loss: 0.8854, test_loss: 0.9590, test_f1: 0.5360
 epoch: 24, train_loss: 0.8819, test_loss: 0.9781, test_f1: 0.4899
 epoch: 25, train_loss: 0.8757, test_loss: 1.0163, test_f1: 0.5196
 epoch: 26, train_loss: 0.8704, test_loss: 1.0988, test_f1: 0.5102
 epoch: 27, train_loss: 0.8434, test_loss: 1.1010, test_f1: 0.4791
 epoch: 28, train_loss: 0.8627, test_loss: 1.0243, test_f1: 0.5186
 epoch: 29, train_loss: 0.8673, test_loss: 1.0150, test_f1: 0.5442
 epoch: 30, train_loss: 0.8527, test_loss: 0.9995, test_f1: 0.5259
 epoch: 31, train_loss: 0.8732, test_loss: 1.0275, test_f1: 0.5192
 epoch: 32, train_loss: 0.8536, test_loss: 0.9311, test_f1: 0.5118
 epoch: 33, train_loss: 0.8397, test_loss: 1.0289, test_f1: 0.5172
 epoch: 34, train_loss: 0.8406, test_loss: 1.0153, test_f1: 0.5213
 epoch: 35, train_loss: 0.8466, test_loss: 1.1037, test_f1: 0.4926
 epoch: 36, train_loss: 0.8204, test_loss: 0.9652, test_f1: 0.5436
 epoch: 37, train_loss: 0.8230, test_loss: 0.9158, test_f1: 0.5196
 epoch: 38, train_loss: 0.8190, test_loss: 1.1549, test_f1: 0.5173
 epoch: 39, train_loss: 0.8291, test_loss: 1.0594, test_f1: 0.5116
 epoch: 40, train_loss: 0.8126, test_loss: 1.0516, test_f1: 0.4935
 epoch: 41, train_loss: 0.8241, test_loss: 0.9954, test_f1: 0.5563
 epoch: 42, train_loss: 0.8062, test_loss: 0.9664, test_f1: 0.5417
 epoch: 43, train_loss: 0.8372, test_loss: 1.0163, test_f1: 0.5299
 epoch: 44, train_loss: 0.8170, test_loss: 0.9640, test_f1: 0.5697
 epoch: 45, train_loss: 0.8166, test_loss: 1.1094, test_f1: 0.5369
 epoch: 46, train_loss: 0.7923, test_loss: 1.0611, test_f1: 0.5277
 epoch: 47, train_loss: 0.7973, test_loss: 1.0228, test_f1: 0.5101
 epoch: 48, train_loss: 0.7914, test_loss: 0.9457, test_f1: 0.5719
 epoch: 49, train_loss: 0.7998, test_loss: 1.0091, test_f1: 0.5268
 epoch: 50, train_loss: 0.7957, test_loss: 1.0504, test_f1: 0.5662
 epoch: 51, train_loss: 0.7810, test_loss: 1.0061, test_f1: 0.5635
 epoch: 52, train_loss: 0.7629, test_loss: 1.0100, test_f1: 0.5495
 epoch: 53, train_loss: 0.7385, test_loss: 1.0933, test_f1: 0.5178
 epoch: 54, train_loss: 0.7423, test_loss: 0.9607, test_f1: 0.5536
 epoch: 55, train_loss: 0.7275, test_loss: 0.9477, test_f1: 0.5730
 epoch: 56, train_loss: 0.7230, test_loss: 1.0177, test_f1: 0.5546
 epoch: 57, train_loss: 0.7267, test_loss: 0.9383, test_f1: 0.5564
 epoch: 58, train_loss: 0.7191, test_loss: 0.9391, test_f1: 0.5866
 epoch: 59, train_loss: 0.7218, test_loss: 0.9901, test_f1: 0.5375
 epoch: 60, train_loss: 0.6949, test_loss: 1.1461, test_f1: 0.5104
 epoch: 61, train_loss: 0.7103, test_loss: 0.9715, test_f1: 0.5836
 epoch: 62, train_loss: 0.7225, test_loss: 1.0149, test_f1: 0.5837
 epoch: 63, train_loss: 0.7161, test_loss: 0.9974, test_f1: 0.5414
 epoch: 64, train_loss: 0.7062, test_loss: 0.9892, test_f1: 0.5596
 epoch: 65, train_loss: 0.7067, test_loss: 0.9617, test_f1: 0.5601
 epoch: 66, train_loss: 0.7074, test_loss: 1.0369, test_f1: 0.5553
 epoch: 67, train_loss: 0.7240, test_loss: 0.9885, test_f1: 0.5641
 epoch: 68, train_loss: 0.6840, test_loss: 1.1745, test_f1: 0.5437
 epoch: 69, train_loss: 0.7016, test_loss: 0.9853, test_f1: 0.5771
 epoch: 70, train_loss: 0.6988, test_loss: 1.1385, test_f1: 0.5366
 epoch: 71, train_loss: 0.6789, test_loss: 1.0668, test_f1: 0.5724
 epoch: 72, train_loss: 0.6904, test_loss: 1.0120, test_f1: 0.5828
 epoch: 73, train_loss: 0.6969, test_loss: 1.0754, test_f1: 0.5581
 epoch: 74, train_loss: 0.6749, test_loss: 1.1115, test_f1: 0.5354
 epoch: 75, train_loss: 0.6636, test_loss: 1.1315, test_f1: 0.5470
 epoch: 76, train_loss: 0.6765, test_loss: 1.0497, test_f1: 0.5712
 epoch: 77, train_loss: 0.6758, test_loss: 1.0334, test_f1: 0.5417
 epoch: 78, train_loss: 0.6745, test_loss: 1.1144, test_f1: 0.5500
 epoch: 79, train_loss: 0.6972, test_loss: 0.9834, test_f1: 0.5810
 epoch: 80, train_loss: 0.6684, test_loss: 1.0571, test_f1: 0.5765
 epoch: 81, train_loss: 0.6674, test_loss: 1.0364, test_f1: 0.5586
 epoch: 82, train_loss: 0.6614, test_loss: 1.0912, test_f1: 0.5639
 epoch: 83, train_loss: 0.6614, test_loss: 1.1250, test_f1: 0.5321
 epoch: 84, train_loss: 0.6607, test_loss: 1.0744, test_f1: 0.5810
 epoch: 85, train_loss: 0.6627, test_loss: 1.0156, test_f1: 0.5748
 epoch: 86, train_loss: 0.6389, test_loss: 1.0364, test_f1: 0.5595
 epoch: 87, train_loss: 0.6541, test_loss: 1.0882, test_f1: 0.5468
 epoch: 88, train_loss: 0.6601, test_loss: 1.0526, test_f1: 0.5553
 epoch: 89, train_loss: 0.6507, test_loss: 1.1573, test_f1: 0.5539
 epoch: 90, train_loss: 0.6633, test_loss: 1.0995, test_f1: 0.5534
 epoch: 91, train_loss: 0.6577, test_loss: 1.0397, test_f1: 0.5742
 epoch: 92, train_loss: 0.6596, test_loss: 1.0718, test_f1: 0.5677
 epoch: 93, train_loss: 0.6454, test_loss: 1.2186, test_f1: 0.5373
 epoch: 94, train_loss: 0.6436, test_loss: 1.2100, test_f1: 0.5566
 epoch: 95, train_loss: 0.6413, test_loss: 1.1888, test_f1: 0.5508
 epoch: 96, train_loss: 0.6400, test_loss: 1.0839, test_f1: 0.5597
 epoch: 97, train_loss: 0.6309, test_loss: 1.2057, test_f1: 0.5429
 epoch: 98, train_loss: 0.6525, test_loss: 1.2141, test_f1: 0.5518
 epoch: 99, train_loss: 0.6341, test_loss: 1.1864, test_f1: 0.5524
##################ITERATION #3 ****************************************
 epoch: 0, train_loss: 1.2631, test_loss: 1.2408, test_f1: 0.3417
 epoch: 1, train_loss: 1.1470, test_loss: 1.0864, test_f1: 0.4958
 epoch: 2, train_loss: 1.0903, test_loss: 1.0368, test_f1: 0.4666
 epoch: 3, train_loss: 1.0511, test_loss: 0.9758, test_f1: 0.5168
 epoch: 4, train_loss: 1.0359, test_loss: 1.0913, test_f1: 0.4059
 epoch: 5, train_loss: 1.0260, test_loss: 0.9218, test_f1: 0.5046
 epoch: 6, train_loss: 1.0161, test_loss: 0.9795, test_f1: 0.4383
 epoch: 7, train_loss: 0.9980, test_loss: 0.9863, test_f1: 0.4709
 epoch: 8, train_loss: 0.9845, test_loss: 1.0334, test_f1: 0.4458
 epoch: 9, train_loss: 0.9609, test_loss: 1.0230, test_f1: 0.4865
 epoch: 10, train_loss: 0.9604, test_loss: 1.0087, test_f1: 0.4616
 epoch: 11, train_loss: 0.9489, test_loss: 1.0244, test_f1: 0.4513
 epoch: 12, train_loss: 0.9516, test_loss: 1.1292, test_f1: 0.4631
 epoch: 13, train_loss: 0.9284, test_loss: 1.0093, test_f1: 0.4543
 epoch: 14, train_loss: 0.9189, test_loss: 0.9881, test_f1: 0.4972
 epoch: 15, train_loss: 0.9124, test_loss: 1.0200, test_f1: 0.5298
 epoch: 16, train_loss: 0.9174, test_loss: 1.0138, test_f1: 0.5231
 epoch: 17, train_loss: 0.9137, test_loss: 0.9977, test_f1: 0.5223
 epoch: 18, train_loss: 0.9205, test_loss: 0.9671, test_f1: 0.5083
 epoch: 19, train_loss: 0.9015, test_loss: 1.0072, test_f1: 0.4776
 epoch: 20, train_loss: 0.8945, test_loss: 0.9196, test_f1: 0.4937
 epoch: 21, train_loss: 0.8989, test_loss: 1.0639, test_f1: 0.4988
 epoch: 22, train_loss: 0.8834, test_loss: 0.9282, test_f1: 0.5339
 epoch: 23, train_loss: 0.8616, test_loss: 0.9859, test_f1: 0.4992
 epoch: 24, train_loss: 0.8816, test_loss: 0.9697, test_f1: 0.5258
 epoch: 25, train_loss: 0.8654, test_loss: 0.9710, test_f1: 0.5279
 epoch: 26, train_loss: 0.8533, test_loss: 0.9833, test_f1: 0.5001
 epoch: 27, train_loss: 0.8593, test_loss: 0.9735, test_f1: 0.4999
 epoch: 28, train_loss: 0.8493, test_loss: 0.9986, test_f1: 0.5324
 epoch: 29, train_loss: 0.8800, test_loss: 0.9449, test_f1: 0.5323
 epoch: 30, train_loss: 0.8606, test_loss: 0.9967, test_f1: 0.5492
 epoch: 31, train_loss: 0.8519, test_loss: 0.9622, test_f1: 0.5415
 epoch: 32, train_loss: 0.8405, test_loss: 0.9367, test_f1: 0.5336
 epoch: 33, train_loss: 0.8436, test_loss: 1.0965, test_f1: 0.4782
 epoch: 34, train_loss: 0.8345, test_loss: 0.9759, test_f1: 0.5725
 epoch: 35, train_loss: 0.8325, test_loss: 0.9614, test_f1: 0.5448
 epoch: 36, train_loss: 0.8173, test_loss: 0.9691, test_f1: 0.5562
 epoch: 37, train_loss: 0.8286, test_loss: 0.9848, test_f1: 0.5102
 epoch: 38, train_loss: 0.8406, test_loss: 0.9943, test_f1: 0.5310
 epoch: 39, train_loss: 0.8315, test_loss: 1.0498, test_f1: 0.5362
 epoch: 40, train_loss: 0.8307, test_loss: 1.0047, test_f1: 0.5367
 epoch: 41, train_loss: 0.8371, test_loss: 0.9774, test_f1: 0.5733
 epoch: 42, train_loss: 0.8197, test_loss: 1.0981, test_f1: 0.5380
 epoch: 43, train_loss: 0.8143, test_loss: 0.9832, test_f1: 0.5724
 epoch: 44, train_loss: 0.8245, test_loss: 1.0235, test_f1: 0.5640
 epoch: 45, train_loss: 0.8306, test_loss: 1.0132, test_f1: 0.5342
 epoch: 46, train_loss: 0.8371, test_loss: 1.1251, test_f1: 0.5257
 epoch: 47, train_loss: 0.7982, test_loss: 0.9824, test_f1: 0.5424
 epoch: 48, train_loss: 0.7923, test_loss: 0.9775, test_f1: 0.5624
 epoch: 49, train_loss: 0.8034, test_loss: 1.0261, test_f1: 0.5377
 epoch: 50, train_loss: 0.8163, test_loss: 0.9789, test_f1: 0.5641
 epoch: 51, train_loss: 0.7835, test_loss: 0.9533, test_f1: 0.5670
 epoch: 52, train_loss: 0.7773, test_loss: 0.9789, test_f1: 0.5464
 epoch: 53, train_loss: 0.7461, test_loss: 0.9649, test_f1: 0.5851
 epoch: 54, train_loss: 0.7522, test_loss: 0.9661, test_f1: 0.5750
 epoch: 55, train_loss: 0.7653, test_loss: 0.9933, test_f1: 0.5637
 epoch: 56, train_loss: 0.7481, test_loss: 1.0016, test_f1: 0.5465
 epoch: 57, train_loss: 0.7316, test_loss: 0.9655, test_f1: 0.5785
 epoch: 58, train_loss: 0.7395, test_loss: 0.9744, test_f1: 0.5867
 epoch: 59, train_loss: 0.7448, test_loss: 1.0148, test_f1: 0.5691
 epoch: 60, train_loss: 0.7434, test_loss: 0.9857, test_f1: 0.5782
 epoch: 61, train_loss: 0.7400, test_loss: 0.9885, test_f1: 0.5881
 epoch: 62, train_loss: 0.7410, test_loss: 1.0160, test_f1: 0.5730
 epoch: 63, train_loss: 0.7316, test_loss: 1.1556, test_f1: 0.5464
 epoch: 64, train_loss: 0.7377, test_loss: 0.9635, test_f1: 0.5684
 epoch: 65, train_loss: 0.7325, test_loss: 1.0226, test_f1: 0.5375
 epoch: 66, train_loss: 0.7151, test_loss: 1.0191, test_f1: 0.5779
 epoch: 67, train_loss: 0.7295, test_loss: 1.0167, test_f1: 0.5691
 epoch: 68, train_loss: 0.7192, test_loss: 1.2009, test_f1: 0.5517
 epoch: 69, train_loss: 0.7238, test_loss: 1.0325, test_f1: 0.5907
 epoch: 70, train_loss: 0.7161, test_loss: 1.0378, test_f1: 0.5701
 epoch: 71, train_loss: 0.7134, test_loss: 1.1074, test_f1: 0.5674
 epoch: 72, train_loss: 0.7203, test_loss: 1.0049, test_f1: 0.5888
 epoch: 73, train_loss: 0.7089, test_loss: 1.0570, test_f1: 0.5785
 epoch: 74, train_loss: 0.7129, test_loss: 1.0576, test_f1: 0.5424
 epoch: 75, train_loss: 0.7082, test_loss: 1.1340, test_f1: 0.5657
 epoch: 76, train_loss: 0.7167, test_loss: 1.0516, test_f1: 0.5512
 epoch: 77, train_loss: 0.7154, test_loss: 1.1118, test_f1: 0.5627
 epoch: 78, train_loss: 0.7191, test_loss: 1.0570, test_f1: 0.5785
 epoch: 79, train_loss: 0.7085, test_loss: 0.9979, test_f1: 0.5813
 epoch: 80, train_loss: 0.7166, test_loss: 1.1165, test_f1: 0.5358
 epoch: 81, train_loss: 0.7002, test_loss: 1.0392, test_f1: 0.5877
 epoch: 82, train_loss: 0.6982, test_loss: 1.0840, test_f1: 0.5597
 epoch: 83, train_loss: 0.6955, test_loss: 1.1706, test_f1: 0.5578
 epoch: 84, train_loss: 0.6841, test_loss: 1.0064, test_f1: 0.6024
 epoch: 85, train_loss: 0.7033, test_loss: 1.1038, test_f1: 0.5660
 epoch: 86, train_loss: 0.7116, test_loss: 1.0243, test_f1: 0.5887
 epoch: 87, train_loss: 0.6889, test_loss: 1.0553, test_f1: 0.5926
 epoch: 88, train_loss: 0.7097, test_loss: 1.3026, test_f1: 0.5662
 epoch: 89, train_loss: 0.6850, test_loss: 1.2067, test_f1: 0.5591
 epoch: 90, train_loss: 0.6841, test_loss: 1.2673, test_f1: 0.5524
 epoch: 91, train_loss: 0.7007, test_loss: 1.0797, test_f1: 0.5628
 epoch: 92, train_loss: 0.6817, test_loss: 1.1218, test_f1: 0.5568
 epoch: 93, train_loss: 0.6911, test_loss: 1.1641, test_f1: 0.5310
 epoch: 94, train_loss: 0.6898, test_loss: 1.2454, test_f1: 0.5194
 epoch: 95, train_loss: 0.6929, test_loss: 1.3230, test_f1: 0.5478
 epoch: 96, train_loss: 0.6755, test_loss: 1.1131, test_f1: 0.5839
 epoch: 97, train_loss: 0.6695, test_loss: 1.1853, test_f1: 0.5542
 epoch: 98, train_loss: 0.6857, test_loss: 1.0819, test_f1: 0.5798
 epoch: 99, train_loss: 0.6822, test_loss: 1.1769, test_f1: 0.5384
##################ITERATION #4 ****************************************
 epoch: 0, train_loss: 1.2826, test_loss: 1.1869, test_f1: 0.3322
 epoch: 1, train_loss: 1.2056, test_loss: 1.1630, test_f1: 0.3766
 epoch: 2, train_loss: 1.1617, test_loss: 1.0946, test_f1: 0.4223
 epoch: 3, train_loss: 1.0902, test_loss: 1.0045, test_f1: 0.4490
 epoch: 4, train_loss: 1.0652, test_loss: 1.0486, test_f1: 0.4176
 epoch: 5, train_loss: 1.0451, test_loss: 1.0913, test_f1: 0.4650
 epoch: 6, train_loss: 1.0174, test_loss: 0.9884, test_f1: 0.4627
 epoch: 7, train_loss: 1.0046, test_loss: 0.9438, test_f1: 0.4729
 epoch: 8, train_loss: 0.9992, test_loss: 1.0720, test_f1: 0.4706
 epoch: 9, train_loss: 0.9925, test_loss: 1.0044, test_f1: 0.4684
 epoch: 10, train_loss: 0.9764, test_loss: 1.0280, test_f1: 0.5024
 epoch: 11, train_loss: 0.9586, test_loss: 1.0106, test_f1: 0.4787
 epoch: 12, train_loss: 0.9596, test_loss: 0.9952, test_f1: 0.4835
 epoch: 13, train_loss: 0.9546, test_loss: 0.9628, test_f1: 0.5029
 epoch: 14, train_loss: 0.9272, test_loss: 1.0448, test_f1: 0.5244
 epoch: 15, train_loss: 0.9471, test_loss: 1.0479, test_f1: 0.4881
 epoch: 16, train_loss: 0.9405, test_loss: 0.9931, test_f1: 0.5099
 epoch: 17, train_loss: 0.9184, test_loss: 0.9732, test_f1: 0.4699
 epoch: 18, train_loss: 0.9011, test_loss: 1.0375, test_f1: 0.5120
 epoch: 19, train_loss: 0.9148, test_loss: 1.0100, test_f1: 0.4789
 epoch: 20, train_loss: 0.9148, test_loss: 0.9804, test_f1: 0.4993
 epoch: 21, train_loss: 0.8884, test_loss: 0.9746, test_f1: 0.4993
 epoch: 22, train_loss: 0.8857, test_loss: 1.0305, test_f1: 0.5028
 epoch: 23, train_loss: 0.8852, test_loss: 1.0121, test_f1: 0.4753
 epoch: 24, train_loss: 0.8918, test_loss: 0.9669, test_f1: 0.5042
 epoch: 25, train_loss: 0.8705, test_loss: 1.0096, test_f1: 0.5218
 epoch: 26, train_loss: 0.8734, test_loss: 1.0019, test_f1: 0.4793
 epoch: 27, train_loss: 0.8679, test_loss: 0.9659, test_f1: 0.5315
 epoch: 28, train_loss: 0.8650, test_loss: 0.9683, test_f1: 0.5354
 epoch: 29, train_loss: 0.8510, test_loss: 1.0066, test_f1: 0.5156
 epoch: 30, train_loss: 0.8628, test_loss: 1.1191, test_f1: 0.5368
 epoch: 31, train_loss: 0.8677, test_loss: 1.0311, test_f1: 0.5309
 epoch: 32, train_loss: 0.8795, test_loss: 0.9954, test_f1: 0.5165
 epoch: 33, train_loss: 0.8446, test_loss: 1.0186, test_f1: 0.5261
 epoch: 34, train_loss: 0.8513, test_loss: 0.9941, test_f1: 0.5100
 epoch: 35, train_loss: 0.8510, test_loss: 1.0786, test_f1: 0.5036
 epoch: 36, train_loss: 0.8530, test_loss: 0.9990, test_f1: 0.5268
 epoch: 37, train_loss: 0.8454, test_loss: 1.0503, test_f1: 0.5237
 epoch: 38, train_loss: 0.8380, test_loss: 0.9613, test_f1: 0.5572
 epoch: 39, train_loss: 0.8234, test_loss: 1.0621, test_f1: 0.5321
 epoch: 40, train_loss: 0.8270, test_loss: 1.0125, test_f1: 0.5626
 epoch: 41, train_loss: 0.8155, test_loss: 1.2845, test_f1: 0.5146
 epoch: 42, train_loss: 0.8174, test_loss: 1.0796, test_f1: 0.5417
 epoch: 43, train_loss: 0.8290, test_loss: 0.9935, test_f1: 0.5337
 epoch: 44, train_loss: 0.8280, test_loss: 0.9898, test_f1: 0.5413
 epoch: 45, train_loss: 0.8324, test_loss: 1.1090, test_f1: 0.5073
 epoch: 46, train_loss: 0.8156, test_loss: 1.0276, test_f1: 0.5632
 epoch: 47, train_loss: 0.8399, test_loss: 0.9881, test_f1: 0.5449
 epoch: 48, train_loss: 0.8183, test_loss: 1.0728, test_f1: 0.5412
 epoch: 49, train_loss: 0.8117, test_loss: 1.1439, test_f1: 0.5162
 epoch: 50, train_loss: 0.7981, test_loss: 1.0874, test_f1: 0.5485
 epoch: 51, train_loss: 0.7800, test_loss: 1.1590, test_f1: 0.5533
 epoch: 52, train_loss: 0.7407, test_loss: 1.0345, test_f1: 0.5467
 epoch: 53, train_loss: 0.7389, test_loss: 1.0908, test_f1: 0.5252
 epoch: 54, train_loss: 0.7492, test_loss: 1.1347, test_f1: 0.5357
 epoch: 55, train_loss: 0.7569, test_loss: 1.1091, test_f1: 0.5336
 epoch: 56, train_loss: 0.7363, test_loss: 1.0933, test_f1: 0.5450
 epoch: 57, train_loss: 0.7519, test_loss: 1.0866, test_f1: 0.5264
 epoch: 58, train_loss: 0.7380, test_loss: 1.1679, test_f1: 0.5250
 epoch: 59, train_loss: 0.7270, test_loss: 1.1251, test_f1: 0.5194
 epoch: 60, train_loss: 0.7290, test_loss: 1.1369, test_f1: 0.5437
 epoch: 61, train_loss: 0.7342, test_loss: 1.1394, test_f1: 0.5445
 epoch: 62, train_loss: 0.7251, test_loss: 1.1670, test_f1: 0.5382
 epoch: 63, train_loss: 0.7433, test_loss: 1.1676, test_f1: 0.5361
 epoch: 64, train_loss: 0.7136, test_loss: 1.2094, test_f1: 0.5524
 epoch: 65, train_loss: 0.7058, test_loss: 0.9936, test_f1: 0.5692
 epoch: 66, train_loss: 0.7090, test_loss: 1.0131, test_f1: 0.5449
 epoch: 67, train_loss: 0.6989, test_loss: 1.0206, test_f1: 0.5679
 epoch: 68, train_loss: 0.7125, test_loss: 1.0310, test_f1: 0.5469
 epoch: 69, train_loss: 0.7249, test_loss: 1.1338, test_f1: 0.5387
 epoch: 70, train_loss: 0.7066, test_loss: 1.0682, test_f1: 0.5459
 epoch: 71, train_loss: 0.7080, test_loss: 1.1676, test_f1: 0.5456
 epoch: 72, train_loss: 0.6886, test_loss: 1.0740, test_f1: 0.5548
 epoch: 73, train_loss: 0.7039, test_loss: 1.0812, test_f1: 0.5494
 epoch: 74, train_loss: 0.6953, test_loss: 1.0339, test_f1: 0.5676
 epoch: 75, train_loss: 0.6904, test_loss: 1.2758, test_f1: 0.5465
 epoch: 76, train_loss: 0.7064, test_loss: 1.0373, test_f1: 0.5634
 epoch: 77, train_loss: 0.7032, test_loss: 1.1017, test_f1: 0.5490
 epoch: 78, train_loss: 0.7018, test_loss: 1.3053, test_f1: 0.5243
 epoch: 79, train_loss: 0.6971, test_loss: 1.0629, test_f1: 0.5369
 epoch: 80, train_loss: 0.6760, test_loss: 1.1887, test_f1: 0.5430
 epoch: 81, train_loss: 0.6737, test_loss: 1.1368, test_f1: 0.5565
 epoch: 82, train_loss: 0.6958, test_loss: 1.0341, test_f1: 0.5499
 epoch: 83, train_loss: 0.6827, test_loss: 1.0468, test_f1: 0.5604
 epoch: 84, train_loss: 0.6771, test_loss: 1.2407, test_f1: 0.5575
 epoch: 85, train_loss: 0.6653, test_loss: 1.0739, test_f1: 0.5501
 epoch: 86, train_loss: 0.6629, test_loss: 1.0424, test_f1: 0.5803
 epoch: 87, train_loss: 0.6754, test_loss: 1.1049, test_f1: 0.5589
 epoch: 88, train_loss: 0.6738, test_loss: 1.0838, test_f1: 0.5713
 epoch: 89, train_loss: 0.6505, test_loss: 1.1433, test_f1: 0.5354
 epoch: 90, train_loss: 0.6564, test_loss: 1.2612, test_f1: 0.5463
 epoch: 91, train_loss: 0.6601, test_loss: 1.2446, test_f1: 0.5491
 epoch: 92, train_loss: 0.6513, test_loss: 1.0774, test_f1: 0.5687
 epoch: 93, train_loss: 0.6528, test_loss: 1.0570, test_f1: 0.5734
 epoch: 94, train_loss: 0.6335, test_loss: 1.2320, test_f1: 0.5492
 epoch: 95, train_loss: 0.6504, test_loss: 1.0573, test_f1: 0.5629
 epoch: 96, train_loss: 0.6467, test_loss: 1.1486, test_f1: 0.5424
 epoch: 97, train_loss: 0.6534, test_loss: 1.1378, test_f1: 0.5316
 epoch: 98, train_loss: 0.6577, test_loss: 1.0752, test_f1: 0.5567
 epoch: 99, train_loss: 0.6230, test_loss: 1.1017, test_f1: 0.5563
##################ITERATION #5 ****************************************
 epoch: 0, train_loss: 1.3002, test_loss: 1.2282, test_f1: 0.3273
 epoch: 1, train_loss: 1.2151, test_loss: 1.1825, test_f1: 0.3873
 epoch: 2, train_loss: 1.1924, test_loss: 1.1092, test_f1: 0.3979
 epoch: 3, train_loss: 1.1487, test_loss: 1.0981, test_f1: 0.3630
 epoch: 4, train_loss: 1.1230, test_loss: 0.9960, test_f1: 0.4874
 epoch: 5, train_loss: 1.0736, test_loss: 0.9506, test_f1: 0.4790
 epoch: 6, train_loss: 1.0580, test_loss: 0.9203, test_f1: 0.4751
 epoch: 7, train_loss: 1.0338, test_loss: 0.9688, test_f1: 0.4865
 epoch: 8, train_loss: 1.0446, test_loss: 1.0289, test_f1: 0.4621
 epoch: 9, train_loss: 1.0317, test_loss: 0.9721, test_f1: 0.4458
 epoch: 10, train_loss: 1.0190, test_loss: 0.9385, test_f1: 0.4613
 epoch: 11, train_loss: 0.9903, test_loss: 0.9540, test_f1: 0.4692
 epoch: 12, train_loss: 0.9781, test_loss: 1.0364, test_f1: 0.4634
 epoch: 13, train_loss: 0.9759, test_loss: 0.9369, test_f1: 0.4929
 epoch: 14, train_loss: 0.9758, test_loss: 1.0240, test_f1: 0.4865
 epoch: 15, train_loss: 0.9581, test_loss: 0.9233, test_f1: 0.4688
 epoch: 16, train_loss: 0.9500, test_loss: 1.0395, test_f1: 0.4748
 epoch: 17, train_loss: 0.9612, test_loss: 0.9053, test_f1: 0.4874
 epoch: 18, train_loss: 0.9348, test_loss: 0.9536, test_f1: 0.5002
 epoch: 19, train_loss: 0.9490, test_loss: 1.0178, test_f1: 0.5009
 epoch: 20, train_loss: 0.9194, test_loss: 0.9886, test_f1: 0.5138
 epoch: 21, train_loss: 0.9196, test_loss: 1.0087, test_f1: 0.4880
 epoch: 22, train_loss: 0.9086, test_loss: 0.9755, test_f1: 0.5010
 epoch: 23, train_loss: 0.9259, test_loss: 0.9814, test_f1: 0.4990
 epoch: 24, train_loss: 0.9024, test_loss: 1.0343, test_f1: 0.5039
 epoch: 25, train_loss: 0.8893, test_loss: 0.9796, test_f1: 0.5128
 epoch: 26, train_loss: 0.8784, test_loss: 0.9909, test_f1: 0.5246
 epoch: 27, train_loss: 0.8925, test_loss: 1.1496, test_f1: 0.4665
 epoch: 28, train_loss: 0.9027, test_loss: 1.0061, test_f1: 0.4912
 epoch: 29, train_loss: 0.8822, test_loss: 1.0585, test_f1: 0.5197
 epoch: 30, train_loss: 0.8718, test_loss: 1.0263, test_f1: 0.5099
 epoch: 31, train_loss: 0.8669, test_loss: 0.9464, test_f1: 0.5094
 epoch: 32, train_loss: 0.8660, test_loss: 1.2090, test_f1: 0.4831
 epoch: 33, train_loss: 0.8788, test_loss: 1.0663, test_f1: 0.5365
 epoch: 34, train_loss: 0.8512, test_loss: 1.0361, test_f1: 0.5240
 epoch: 35, train_loss: 0.8649, test_loss: 1.0038, test_f1: 0.5509
 epoch: 36, train_loss: 0.8528, test_loss: 1.0355, test_f1: 0.5002
 epoch: 37, train_loss: 0.8649, test_loss: 0.9906, test_f1: 0.5276
 epoch: 38, train_loss: 0.8440, test_loss: 1.0012, test_f1: 0.5236
 epoch: 39, train_loss: 0.8426, test_loss: 0.9857, test_f1: 0.5221
 epoch: 40, train_loss: 0.8412, test_loss: 1.0152, test_f1: 0.5303
 epoch: 41, train_loss: 0.8351, test_loss: 1.0694, test_f1: 0.5056
 epoch: 42, train_loss: 0.8196, test_loss: 1.0286, test_f1: 0.5132
 epoch: 43, train_loss: 0.8511, test_loss: 1.0778, test_f1: 0.5087
 epoch: 44, train_loss: 0.8206, test_loss: 0.9516, test_f1: 0.5321
 epoch: 45, train_loss: 0.8299, test_loss: 0.9780, test_f1: 0.5656
 epoch: 46, train_loss: 0.8286, test_loss: 1.0209, test_f1: 0.5033
 epoch: 47, train_loss: 0.8114, test_loss: 1.0283, test_f1: 0.5025
 epoch: 48, train_loss: 0.8209, test_loss: 1.0274, test_f1: 0.5179
 epoch: 49, train_loss: 0.8377, test_loss: 1.1055, test_f1: 0.5308
 epoch: 50, train_loss: 0.8110, test_loss: 1.2015, test_f1: 0.5312
 epoch: 51, train_loss: 0.7764, test_loss: 1.0630, test_f1: 0.5217
 epoch: 52, train_loss: 0.7808, test_loss: 0.9893, test_f1: 0.5383
 epoch: 53, train_loss: 0.7654, test_loss: 0.9754, test_f1: 0.5587
 epoch: 54, train_loss: 0.7611, test_loss: 1.0169, test_f1: 0.5713
 epoch: 55, train_loss: 0.7482, test_loss: 1.0949, test_f1: 0.5285
 epoch: 56, train_loss: 0.7664, test_loss: 1.1999, test_f1: 0.5234
 epoch: 57, train_loss: 0.7642, test_loss: 0.9671, test_f1: 0.5578
 epoch: 58, train_loss: 0.7502, test_loss: 1.0154, test_f1: 0.5414
 epoch: 59, train_loss: 0.7442, test_loss: 1.0320, test_f1: 0.5642
 epoch: 60, train_loss: 0.7572, test_loss: 1.0259, test_f1: 0.5698
 epoch: 61, train_loss: 0.7460, test_loss: 1.0320, test_f1: 0.5531
 epoch: 62, train_loss: 0.7324, test_loss: 1.1581, test_f1: 0.5341
 epoch: 63, train_loss: 0.7255, test_loss: 1.0944, test_f1: 0.5265
 epoch: 64, train_loss: 0.7237, test_loss: 1.0748, test_f1: 0.5521
 epoch: 65, train_loss: 0.7378, test_loss: 1.0613, test_f1: 0.5444
 epoch: 66, train_loss: 0.7292, test_loss: 1.0144, test_f1: 0.5569
 epoch: 67, train_loss: 0.7317, test_loss: 1.0590, test_f1: 0.5450
 epoch: 68, train_loss: 0.7175, test_loss: 1.0595, test_f1: 0.5568
 epoch: 69, train_loss: 0.7138, test_loss: 1.0224, test_f1: 0.5760
 epoch: 70, train_loss: 0.7106, test_loss: 1.0645, test_f1: 0.5482
 epoch: 71, train_loss: 0.7185, test_loss: 1.0662, test_f1: 0.5434
 epoch: 72, train_loss: 0.7284, test_loss: 1.0379, test_f1: 0.5437
 epoch: 73, train_loss: 0.7233, test_loss: 1.1175, test_f1: 0.5253
 epoch: 74, train_loss: 0.7105, test_loss: 1.0593, test_f1: 0.5689
 epoch: 75, train_loss: 0.7219, test_loss: 0.9986, test_f1: 0.5362
 epoch: 76, train_loss: 0.7127, test_loss: 1.0244, test_f1: 0.5682
 epoch: 77, train_loss: 0.7011, test_loss: 1.0833, test_f1: 0.5466
 epoch: 78, train_loss: 0.7079, test_loss: 1.0713, test_f1: 0.5532
 epoch: 79, train_loss: 0.6997, test_loss: 1.0579, test_f1: 0.5602
 epoch: 80, train_loss: 0.6993, test_loss: 1.2122, test_f1: 0.5249
 epoch: 81, train_loss: 0.7005, test_loss: 1.0639, test_f1: 0.5680
 epoch: 82, train_loss: 0.6960, test_loss: 1.0349, test_f1: 0.5679
 epoch: 83, train_loss: 0.6899, test_loss: 1.0484, test_f1: 0.5533
 epoch: 84, train_loss: 0.6978, test_loss: 1.0200, test_f1: 0.5540
 epoch: 85, train_loss: 0.6950, test_loss: 1.0648, test_f1: 0.5401
 epoch: 86, train_loss: 0.6953, test_loss: 1.2459, test_f1: 0.5378
 epoch: 87, train_loss: 0.6913, test_loss: 1.0517, test_f1: 0.5683
 epoch: 88, train_loss: 0.7110, test_loss: 1.0395, test_f1: 0.5709
 epoch: 89, train_loss: 0.6856, test_loss: 1.0934, test_f1: 0.5392
 epoch: 90, train_loss: 0.6694, test_loss: 1.2188, test_f1: 0.5622
 epoch: 91, train_loss: 0.6940, test_loss: 1.0180, test_f1: 0.5670
 epoch: 92, train_loss: 0.6638, test_loss: 1.0899, test_f1: 0.5569
 epoch: 93, train_loss: 0.6766, test_loss: 1.2689, test_f1: 0.5482
 epoch: 94, train_loss: 0.6689, test_loss: 1.0776, test_f1: 0.5683
 epoch: 95, train_loss: 0.6803, test_loss: 1.0557, test_f1: 0.5602
 epoch: 96, train_loss: 0.6755, test_loss: 1.2700, test_f1: 0.5471
 epoch: 97, train_loss: 0.6818, test_loss: 1.0435, test_f1: 0.5812
 epoch: 98, train_loss: 0.6754, test_loss: 1.0110, test_f1: 0.5707
 epoch: 99, train_loss: 0.6810, test_loss: 1.0383, test_f1: 0.5759
##################ITERATION #6 ****************************************
 epoch: 0, train_loss: 1.3163, test_loss: 1.2858, test_f1: 0.2420
 epoch: 1, train_loss: 1.2160, test_loss: 1.1652, test_f1: 0.3849
 epoch: 2, train_loss: 1.1723, test_loss: 1.0780, test_f1: 0.3819
 epoch: 3, train_loss: 1.1442, test_loss: 1.0773, test_f1: 0.3854
 epoch: 4, train_loss: 1.1278, test_loss: 1.0401, test_f1: 0.3902
 epoch: 5, train_loss: 1.0855, test_loss: 1.0336, test_f1: 0.4381
 epoch: 6, train_loss: 1.0839, test_loss: 1.0191, test_f1: 0.4771
 epoch: 7, train_loss: 1.0667, test_loss: 1.0179, test_f1: 0.4478
 epoch: 8, train_loss: 1.0501, test_loss: 0.9897, test_f1: 0.4636
 epoch: 9, train_loss: 1.0245, test_loss: 0.9524, test_f1: 0.4842
 epoch: 10, train_loss: 1.0158, test_loss: 0.9368, test_f1: 0.4973
 epoch: 11, train_loss: 0.9860, test_loss: 0.9750, test_f1: 0.4700
 epoch: 12, train_loss: 0.9841, test_loss: 0.9344, test_f1: 0.4845
 epoch: 13, train_loss: 0.9896, test_loss: 0.9702, test_f1: 0.4835
 epoch: 14, train_loss: 0.9814, test_loss: 1.0055, test_f1: 0.4976
 epoch: 15, train_loss: 0.9847, test_loss: 1.0541, test_f1: 0.4522
 epoch: 16, train_loss: 0.9486, test_loss: 0.9749, test_f1: 0.5072
 epoch: 17, train_loss: 0.9548, test_loss: 0.9934, test_f1: 0.4742
 epoch: 18, train_loss: 0.9390, test_loss: 1.0726, test_f1: 0.4840
 epoch: 19, train_loss: 0.9467, test_loss: 1.0832, test_f1: 0.4701
 epoch: 20, train_loss: 0.9472, test_loss: 1.0191, test_f1: 0.4684
 epoch: 21, train_loss: 0.9633, test_loss: 1.0502, test_f1: 0.4488
 epoch: 22, train_loss: 0.9254, test_loss: 1.0291, test_f1: 0.4606
 epoch: 23, train_loss: 0.9173, test_loss: 1.0303, test_f1: 0.4763
 epoch: 24, train_loss: 0.9005, test_loss: 1.0106, test_f1: 0.4997
 epoch: 25, train_loss: 0.8906, test_loss: 1.0313, test_f1: 0.4983
 epoch: 26, train_loss: 0.9028, test_loss: 1.0533, test_f1: 0.5066
 epoch: 27, train_loss: 0.9070, test_loss: 1.0363, test_f1: 0.5119
 epoch: 28, train_loss: 0.8839, test_loss: 0.9839, test_f1: 0.4981
 epoch: 29, train_loss: 0.9132, test_loss: 0.9901, test_f1: 0.4675
 epoch: 30, train_loss: 0.8879, test_loss: 1.0305, test_f1: 0.4805
 epoch: 31, train_loss: 0.8900, test_loss: 1.0205, test_f1: 0.5176
 epoch: 32, train_loss: 0.8831, test_loss: 0.9924, test_f1: 0.5198
 epoch: 33, train_loss: 0.8854, test_loss: 1.0143, test_f1: 0.5143
 epoch: 34, train_loss: 0.8755, test_loss: 1.0141, test_f1: 0.5122
 epoch: 35, train_loss: 0.9167, test_loss: 1.0083, test_f1: 0.4835
 epoch: 36, train_loss: 0.8955, test_loss: 1.0025, test_f1: 0.5392
 epoch: 37, train_loss: 0.8812, test_loss: 1.0286, test_f1: 0.5324
 epoch: 38, train_loss: 0.8610, test_loss: 1.0621, test_f1: 0.4912
 epoch: 39, train_loss: 0.8629, test_loss: 1.0575, test_f1: 0.4771
 epoch: 40, train_loss: 0.8900, test_loss: 0.9715, test_f1: 0.5315
 epoch: 41, train_loss: 0.8540, test_loss: 0.9837, test_f1: 0.5203
 epoch: 42, train_loss: 0.8579, test_loss: 1.0125, test_f1: 0.5382
 epoch: 43, train_loss: 0.8573, test_loss: 1.0300, test_f1: 0.5332
 epoch: 44, train_loss: 0.8357, test_loss: 1.0039, test_f1: 0.5411
 epoch: 45, train_loss: 0.8460, test_loss: 1.0649, test_f1: 0.5007
 epoch: 46, train_loss: 0.8411, test_loss: 1.0056, test_f1: 0.5419
 epoch: 47, train_loss: 0.8338, test_loss: 1.0094, test_f1: 0.5536
 epoch: 48, train_loss: 0.8476, test_loss: 1.0279, test_f1: 0.5300
 epoch: 49, train_loss: 0.8403, test_loss: 0.9837, test_f1: 0.5377
 epoch: 50, train_loss: 0.8385, test_loss: 1.0357, test_f1: 0.5337
 epoch: 51, train_loss: 0.8289, test_loss: 1.0045, test_f1: 0.5465
 epoch: 52, train_loss: 0.8055, test_loss: 0.9790, test_f1: 0.5387
 epoch: 53, train_loss: 0.7960, test_loss: 0.9590, test_f1: 0.5239
 epoch: 54, train_loss: 0.7884, test_loss: 1.0281, test_f1: 0.5418
 epoch: 55, train_loss: 0.7901, test_loss: 0.9675, test_f1: 0.5710
 epoch: 56, train_loss: 0.7820, test_loss: 1.0133, test_f1: 0.5216
 epoch: 57, train_loss: 0.7714, test_loss: 1.0065, test_f1: 0.5165
 epoch: 58, train_loss: 0.7944, test_loss: 0.9930, test_f1: 0.5584
 epoch: 59, train_loss: 0.7765, test_loss: 0.9729, test_f1: 0.5647
 epoch: 60, train_loss: 0.7857, test_loss: 0.9973, test_f1: 0.5475
 epoch: 61, train_loss: 0.7663, test_loss: 1.0476, test_f1: 0.5274
 epoch: 62, train_loss: 0.7755, test_loss: 1.0316, test_f1: 0.5288
 epoch: 63, train_loss: 0.7497, test_loss: 1.0165, test_f1: 0.5583
 epoch: 64, train_loss: 0.7509, test_loss: 0.9889, test_f1: 0.5333
 epoch: 65, train_loss: 0.7664, test_loss: 1.0117, test_f1: 0.5382
 epoch: 66, train_loss: 0.7737, test_loss: 1.0790, test_f1: 0.5138
 epoch: 67, train_loss: 0.7613, test_loss: 1.0046, test_f1: 0.5482
 epoch: 68, train_loss: 0.7452, test_loss: 1.0068, test_f1: 0.5337
 epoch: 69, train_loss: 0.7492, test_loss: 1.0660, test_f1: 0.5470
 epoch: 70, train_loss: 0.7419, test_loss: 1.0165, test_f1: 0.5288
 epoch: 71, train_loss: 0.7454, test_loss: 1.0242, test_f1: 0.5409
 epoch: 72, train_loss: 0.7460, test_loss: 0.9847, test_f1: 0.5530
 epoch: 73, train_loss: 0.7295, test_loss: 1.0104, test_f1: 0.5744
 epoch: 74, train_loss: 0.7372, test_loss: 1.1620, test_f1: 0.5231
 epoch: 75, train_loss: 0.7542, test_loss: 1.0822, test_f1: 0.5372
 epoch: 76, train_loss: 0.7244, test_loss: 0.9918, test_f1: 0.5707
 epoch: 77, train_loss: 0.7346, test_loss: 1.0123, test_f1: 0.5785
 epoch: 78, train_loss: 0.7275, test_loss: 1.0528, test_f1: 0.5276
 epoch: 79, train_loss: 0.7304, test_loss: 1.0957, test_f1: 0.5276
 epoch: 80, train_loss: 0.7254, test_loss: 1.1255, test_f1: 0.5241
 epoch: 81, train_loss: 0.7207, test_loss: 1.0900, test_f1: 0.5391
 epoch: 82, train_loss: 0.7305, test_loss: 1.0703, test_f1: 0.5416
 epoch: 83, train_loss: 0.7143, test_loss: 1.0187, test_f1: 0.5559
 epoch: 84, train_loss: 0.7335, test_loss: 1.0110, test_f1: 0.5740
 epoch: 85, train_loss: 0.7238, test_loss: 1.0117, test_f1: 0.5696
 epoch: 86, train_loss: 0.7125, test_loss: 1.0624, test_f1: 0.5380
 epoch: 87, train_loss: 0.7178, test_loss: 1.0313, test_f1: 0.5902
 epoch: 88, train_loss: 0.7210, test_loss: 1.0315, test_f1: 0.5548
 epoch: 89, train_loss: 0.7210, test_loss: 1.0483, test_f1: 0.5536
 epoch: 90, train_loss: 0.7233, test_loss: 1.1203, test_f1: 0.5432
 epoch: 91, train_loss: 0.7045, test_loss: 1.0962, test_f1: 0.5470
 epoch: 92, train_loss: 0.7074, test_loss: 1.0391, test_f1: 0.5673
 epoch: 93, train_loss: 0.7253, test_loss: 1.0305, test_f1: 0.5608
 epoch: 94, train_loss: 0.7071, test_loss: 1.0657, test_f1: 0.5656
 epoch: 95, train_loss: 0.7117, test_loss: 1.0371, test_f1: 0.5482
 epoch: 96, train_loss: 0.7212, test_loss: 0.9954, test_f1: 0.5551
 epoch: 97, train_loss: 0.7001, test_loss: 1.0274, test_f1: 0.5771
 epoch: 98, train_loss: 0.7188, test_loss: 0.9872, test_f1: 0.5685
 epoch: 99, train_loss: 0.7022, test_loss: 1.0509, test_f1: 0.5662
##################ITERATION #7 ****************************************
 epoch: 0, train_loss: 1.2963, test_loss: 1.2410, test_f1: 0.2542
 epoch: 1, train_loss: 1.2083, test_loss: 1.1382, test_f1: 0.3927
 epoch: 2, train_loss: 1.1648, test_loss: 1.1026, test_f1: 0.4247
 epoch: 3, train_loss: 1.1252, test_loss: 1.0601, test_f1: 0.4286
 epoch: 4, train_loss: 1.1224, test_loss: 1.0237, test_f1: 0.4603
 epoch: 5, train_loss: 1.0791, test_loss: 1.0742, test_f1: 0.4499
 epoch: 6, train_loss: 1.0475, test_loss: 0.9899, test_f1: 0.4756
 epoch: 7, train_loss: 1.0454, test_loss: 1.1502, test_f1: 0.4034
 epoch: 8, train_loss: 1.0351, test_loss: 0.9650, test_f1: 0.4862
 epoch: 9, train_loss: 1.0028, test_loss: 0.9498, test_f1: 0.4712
 epoch: 10, train_loss: 1.0015, test_loss: 0.9591, test_f1: 0.4535
 epoch: 11, train_loss: 0.9774, test_loss: 0.9393, test_f1: 0.4850
 epoch: 12, train_loss: 0.9835, test_loss: 0.9385, test_f1: 0.4977
 epoch: 13, train_loss: 0.9612, test_loss: 0.9306, test_f1: 0.5099
 epoch: 14, train_loss: 0.9545, test_loss: 1.0373, test_f1: 0.4842
 epoch: 15, train_loss: 0.9458, test_loss: 0.9878, test_f1: 0.5012
 epoch: 16, train_loss: 0.9305, test_loss: 1.0213, test_f1: 0.4800
 epoch: 17, train_loss: 0.9478, test_loss: 0.9746, test_f1: 0.5060
 epoch: 18, train_loss: 0.9064, test_loss: 0.9442, test_f1: 0.5196
 epoch: 19, train_loss: 0.9120, test_loss: 1.0328, test_f1: 0.4839
 epoch: 20, train_loss: 0.9009, test_loss: 1.0073, test_f1: 0.5508
 epoch: 21, train_loss: 0.8943, test_loss: 0.9617, test_f1: 0.5202
 epoch: 22, train_loss: 0.8970, test_loss: 0.9507, test_f1: 0.5628
 epoch: 23, train_loss: 0.8910, test_loss: 0.9605, test_f1: 0.5420
 epoch: 24, train_loss: 0.8827, test_loss: 0.9798, test_f1: 0.5322
 epoch: 25, train_loss: 0.8843, test_loss: 0.9857, test_f1: 0.5508
 epoch: 26, train_loss: 0.8839, test_loss: 0.9643, test_f1: 0.5335
 epoch: 27, train_loss: 0.8688, test_loss: 1.0106, test_f1: 0.5276
 epoch: 28, train_loss: 0.8710, test_loss: 1.0513, test_f1: 0.5027
 epoch: 29, train_loss: 0.8765, test_loss: 0.9682, test_f1: 0.5305
 epoch: 30, train_loss: 0.8731, test_loss: 0.9679, test_f1: 0.5308
 epoch: 31, train_loss: 0.8759, test_loss: 1.0226, test_f1: 0.5072
 epoch: 32, train_loss: 0.8541, test_loss: 1.0517, test_f1: 0.4955
 epoch: 33, train_loss: 0.8577, test_loss: 0.9979, test_f1: 0.5275
 epoch: 34, train_loss: 0.8739, test_loss: 1.0085, test_f1: 0.5171
 epoch: 35, train_loss: 0.8607, test_loss: 0.9511, test_f1: 0.5435
 epoch: 36, train_loss: 0.8342, test_loss: 1.1306, test_f1: 0.4947
 epoch: 37, train_loss: 0.8427, test_loss: 0.9904, test_f1: 0.5181
 epoch: 38, train_loss: 0.8478, test_loss: 1.0413, test_f1: 0.5365
 epoch: 39, train_loss: 0.8356, test_loss: 0.9920, test_f1: 0.5470
 epoch: 40, train_loss: 0.8262, test_loss: 1.0384, test_f1: 0.5350
 epoch: 41, train_loss: 0.8185, test_loss: 1.0334, test_f1: 0.5503
 epoch: 42, train_loss: 0.8188, test_loss: 0.9804, test_f1: 0.5358
 epoch: 43, train_loss: 0.8305, test_loss: 1.0737, test_f1: 0.5273
 epoch: 44, train_loss: 0.8284, test_loss: 1.0769, test_f1: 0.5251
 epoch: 45, train_loss: 0.8210, test_loss: 1.0438, test_f1: 0.5203
 epoch: 46, train_loss: 0.8204, test_loss: 0.9983, test_f1: 0.5280
 epoch: 47, train_loss: 0.8208, test_loss: 1.0045, test_f1: 0.5304
 epoch: 48, train_loss: 0.8178, test_loss: 1.0361, test_f1: 0.5153
 epoch: 49, train_loss: 0.8168, test_loss: 1.1495, test_f1: 0.5084
 epoch: 50, train_loss: 0.8143, test_loss: 1.1191, test_f1: 0.5180
 epoch: 51, train_loss: 0.7955, test_loss: 0.9794, test_f1: 0.5508
 epoch: 52, train_loss: 0.7792, test_loss: 0.9913, test_f1: 0.5620
 epoch: 53, train_loss: 0.7544, test_loss: 1.0441, test_f1: 0.5380
 epoch: 54, train_loss: 0.7583, test_loss: 1.0286, test_f1: 0.5341
 epoch: 55, train_loss: 0.7603, test_loss: 1.0280, test_f1: 0.5282
 epoch: 56, train_loss: 0.7487, test_loss: 1.0374, test_f1: 0.5493
 epoch: 57, train_loss: 0.7492, test_loss: 1.1829, test_f1: 0.5190
 epoch: 58, train_loss: 0.7305, test_loss: 1.1451, test_f1: 0.5341
 epoch: 59, train_loss: 0.7471, test_loss: 1.0051, test_f1: 0.5400
 epoch: 60, train_loss: 0.7402, test_loss: 1.1356, test_f1: 0.5326
 epoch: 61, train_loss: 0.7365, test_loss: 1.1202, test_f1: 0.5320
 epoch: 62, train_loss: 0.7481, test_loss: 1.0331, test_f1: 0.5459
 epoch: 63, train_loss: 0.7362, test_loss: 1.1166, test_f1: 0.5298
 epoch: 64, train_loss: 0.7293, test_loss: 1.1793, test_f1: 0.5388
 epoch: 65, train_loss: 0.7287, test_loss: 1.0633, test_f1: 0.5327
 epoch: 66, train_loss: 0.7266, test_loss: 1.0862, test_f1: 0.5416
 epoch: 67, train_loss: 0.7291, test_loss: 1.0993, test_f1: 0.5418
 epoch: 68, train_loss: 0.7115, test_loss: 0.9923, test_f1: 0.5914
 epoch: 69, train_loss: 0.7077, test_loss: 1.0047, test_f1: 0.5628
 epoch: 70, train_loss: 0.7046, test_loss: 1.1651, test_f1: 0.5238
 epoch: 71, train_loss: 0.7141, test_loss: 1.0152, test_f1: 0.5805
 epoch: 72, train_loss: 0.7191, test_loss: 1.0352, test_f1: 0.5713
 epoch: 73, train_loss: 0.7169, test_loss: 1.1746, test_f1: 0.5449
 epoch: 74, train_loss: 0.7135, test_loss: 1.0304, test_f1: 0.5804
 epoch: 75, train_loss: 0.6889, test_loss: 1.0383, test_f1: 0.5878
 epoch: 76, train_loss: 0.7060, test_loss: 1.0580, test_f1: 0.5664
 epoch: 77, train_loss: 0.6969, test_loss: 1.0187, test_f1: 0.5713
 epoch: 78, train_loss: 0.6772, test_loss: 1.0584, test_f1: 0.5552
 epoch: 79, train_loss: 0.7171, test_loss: 1.0259, test_f1: 0.5673
 epoch: 80, train_loss: 0.7123, test_loss: 1.0426, test_f1: 0.5556
 epoch: 81, train_loss: 0.7102, test_loss: 1.0032, test_f1: 0.5857
 epoch: 82, train_loss: 0.6912, test_loss: 1.0383, test_f1: 0.5722
 epoch: 83, train_loss: 0.6803, test_loss: 1.0333, test_f1: 0.5582
 epoch: 84, train_loss: 0.6735, test_loss: 1.0661, test_f1: 0.5565
 epoch: 85, train_loss: 0.6847, test_loss: 1.0393, test_f1: 0.5578
 epoch: 86, train_loss: 0.6936, test_loss: 1.0425, test_f1: 0.5878
 epoch: 87, train_loss: 0.6834, test_loss: 1.0528, test_f1: 0.5857
 epoch: 88, train_loss: 0.6729, test_loss: 1.0638, test_f1: 0.5718
 epoch: 89, train_loss: 0.6797, test_loss: 1.0340, test_f1: 0.5869
 epoch: 90, train_loss: 0.6855, test_loss: 1.0243, test_f1: 0.5780
 epoch: 91, train_loss: 0.6695, test_loss: 1.0686, test_f1: 0.5594
 epoch: 92, train_loss: 0.6764, test_loss: 1.0272, test_f1: 0.6042
 epoch: 93, train_loss: 0.6722, test_loss: 0.9955, test_f1: 0.5987
 epoch: 94, train_loss: 0.6716, test_loss: 1.0265, test_f1: 0.5814
 epoch: 95, train_loss: 0.6567, test_loss: 1.0401, test_f1: 0.5844
 epoch: 96, train_loss: 0.6503, test_loss: 1.0481, test_f1: 0.5791
 epoch: 97, train_loss: 0.6649, test_loss: 1.0356, test_f1: 0.5712
 epoch: 98, train_loss: 0.6412, test_loss: 1.0696, test_f1: 0.5725
 epoch: 99, train_loss: 0.6672, test_loss: 1.1268, test_f1: 0.5574
##################ITERATION #8 ****************************************
 epoch: 0, train_loss: 1.3040, test_loss: 1.2007, test_f1: 0.3954
 epoch: 1, train_loss: 1.2018, test_loss: 1.1164, test_f1: 0.4446
 epoch: 2, train_loss: 1.1580, test_loss: 1.0840, test_f1: 0.4084
 epoch: 3, train_loss: 1.0933, test_loss: 0.9953, test_f1: 0.4426
 epoch: 4, train_loss: 1.0782, test_loss: 1.0195, test_f1: 0.4574
 epoch: 5, train_loss: 1.0446, test_loss: 0.9545, test_f1: 0.4745
 epoch: 6, train_loss: 1.0266, test_loss: 1.0455, test_f1: 0.4267
 epoch: 7, train_loss: 1.0189, test_loss: 0.9858, test_f1: 0.5251
 epoch: 8, train_loss: 0.9970, test_loss: 1.0778, test_f1: 0.4513
 epoch: 9, train_loss: 0.9905, test_loss: 1.1679, test_f1: 0.4503
 epoch: 10, train_loss: 0.9773, test_loss: 0.9476, test_f1: 0.5090
 epoch: 11, train_loss: 0.9587, test_loss: 0.9587, test_f1: 0.4927
 epoch: 12, train_loss: 0.9568, test_loss: 0.9840, test_f1: 0.4899
 epoch: 13, train_loss: 0.9489, test_loss: 0.9493, test_f1: 0.4866
 epoch: 14, train_loss: 0.9429, test_loss: 0.9942, test_f1: 0.4654
 epoch: 15, train_loss: 0.9420, test_loss: 1.0407, test_f1: 0.4535
 epoch: 16, train_loss: 0.9349, test_loss: 1.0282, test_f1: 0.4852
 epoch: 17, train_loss: 0.9343, test_loss: 1.0376, test_f1: 0.4521
 epoch: 18, train_loss: 0.9139, test_loss: 1.0187, test_f1: 0.4947
 epoch: 19, train_loss: 0.9255, test_loss: 0.9780, test_f1: 0.4850
 epoch: 20, train_loss: 0.9229, test_loss: 1.0848, test_f1: 0.4652
 epoch: 21, train_loss: 0.9104, test_loss: 1.0032, test_f1: 0.5010
 epoch: 22, train_loss: 0.8917, test_loss: 1.0374, test_f1: 0.4786
 epoch: 23, train_loss: 0.8990, test_loss: 1.0385, test_f1: 0.4918
 epoch: 24, train_loss: 0.9079, test_loss: 0.9922, test_f1: 0.4930
 epoch: 25, train_loss: 0.8907, test_loss: 0.9814, test_f1: 0.4940
 epoch: 26, train_loss: 0.8946, test_loss: 0.9777, test_f1: 0.5269
 epoch: 27, train_loss: 0.8769, test_loss: 1.0167, test_f1: 0.5128
 epoch: 28, train_loss: 0.8864, test_loss: 1.0165, test_f1: 0.4853
 epoch: 29, train_loss: 0.8748, test_loss: 0.9313, test_f1: 0.5157
 epoch: 30, train_loss: 0.8701, test_loss: 0.9557, test_f1: 0.5127
 epoch: 31, train_loss: 0.8954, test_loss: 0.9695, test_f1: 0.5183
 epoch: 32, train_loss: 0.8590, test_loss: 0.9857, test_f1: 0.5012
 epoch: 33, train_loss: 0.8733, test_loss: 1.0131, test_f1: 0.5329
 epoch: 34, train_loss: 0.8588, test_loss: 0.9163, test_f1: 0.5419
 epoch: 35, train_loss: 0.8770, test_loss: 1.0367, test_f1: 0.4852
 epoch: 36, train_loss: 0.8723, test_loss: 1.0070, test_f1: 0.5340
 epoch: 37, train_loss: 0.8533, test_loss: 0.9648, test_f1: 0.5577
 epoch: 38, train_loss: 0.8534, test_loss: 1.1023, test_f1: 0.4918
 epoch: 39, train_loss: 0.8668, test_loss: 0.9723, test_f1: 0.5207
 epoch: 40, train_loss: 0.8414, test_loss: 0.8992, test_f1: 0.5226
 epoch: 41, train_loss: 0.8426, test_loss: 0.9847, test_f1: 0.5017
 epoch: 42, train_loss: 0.8433, test_loss: 0.9635, test_f1: 0.5141
 epoch: 43, train_loss: 0.8354, test_loss: 0.9991, test_f1: 0.5051
 epoch: 44, train_loss: 0.8402, test_loss: 1.0401, test_f1: 0.5152
 epoch: 45, train_loss: 0.8578, test_loss: 0.9689, test_f1: 0.5270
 epoch: 46, train_loss: 0.8337, test_loss: 1.0054, test_f1: 0.5197
 epoch: 47, train_loss: 0.8323, test_loss: 0.9625, test_f1: 0.5194
 epoch: 48, train_loss: 0.8136, test_loss: 0.9589, test_f1: 0.5187
 epoch: 49, train_loss: 0.8312, test_loss: 1.0205, test_f1: 0.5195
 epoch: 50, train_loss: 0.8199, test_loss: 1.0080, test_f1: 0.5241
 epoch: 51, train_loss: 0.8068, test_loss: 0.9260, test_f1: 0.5203
 epoch: 52, train_loss: 0.8012, test_loss: 0.9501, test_f1: 0.5472
 epoch: 53, train_loss: 0.7901, test_loss: 0.9582, test_f1: 0.5242
 epoch: 54, train_loss: 0.7924, test_loss: 0.9887, test_f1: 0.5128
 epoch: 55, train_loss: 0.7898, test_loss: 0.9949, test_f1: 0.5047
 epoch: 56, train_loss: 0.7858, test_loss: 0.9122, test_f1: 0.5214
 epoch: 57, train_loss: 0.7817, test_loss: 0.9134, test_f1: 0.5274
 epoch: 58, train_loss: 0.7749, test_loss: 0.9627, test_f1: 0.5245
 epoch: 59, train_loss: 0.7727, test_loss: 0.9520, test_f1: 0.5233
 epoch: 60, train_loss: 0.7602, test_loss: 0.9315, test_f1: 0.5462
 epoch: 61, train_loss: 0.7592, test_loss: 0.9578, test_f1: 0.5133
 epoch: 62, train_loss: 0.7663, test_loss: 0.9390, test_f1: 0.5377
 epoch: 63, train_loss: 0.7627, test_loss: 0.9465, test_f1: 0.5449
 epoch: 64, train_loss: 0.7608, test_loss: 1.0249, test_f1: 0.5465
 epoch: 65, train_loss: 0.7484, test_loss: 0.9564, test_f1: 0.5302
 epoch: 66, train_loss: 0.7781, test_loss: 0.9590, test_f1: 0.5196
 epoch: 67, train_loss: 0.7640, test_loss: 0.9382, test_f1: 0.5556
 epoch: 68, train_loss: 0.7718, test_loss: 0.9177, test_f1: 0.5525
 epoch: 69, train_loss: 0.7449, test_loss: 0.9596, test_f1: 0.5652
 epoch: 70, train_loss: 0.7557, test_loss: 0.9433, test_f1: 0.5438
 epoch: 71, train_loss: 0.7493, test_loss: 0.9390, test_f1: 0.5835
 epoch: 72, train_loss: 0.7393, test_loss: 0.9303, test_f1: 0.5704
 epoch: 73, train_loss: 0.7414, test_loss: 0.9479, test_f1: 0.5701
 epoch: 74, train_loss: 0.7452, test_loss: 0.9354, test_f1: 0.5263
 epoch: 75, train_loss: 0.7339, test_loss: 0.9460, test_f1: 0.5708
 epoch: 76, train_loss: 0.7330, test_loss: 0.9732, test_f1: 0.5706
 epoch: 77, train_loss: 0.7500, test_loss: 0.9531, test_f1: 0.5511
 epoch: 78, train_loss: 0.7461, test_loss: 0.9344, test_f1: 0.5517
 epoch: 79, train_loss: 0.7187, test_loss: 0.9451, test_f1: 0.5671
 epoch: 80, train_loss: 0.7304, test_loss: 0.9720, test_f1: 0.5658
 epoch: 81, train_loss: 0.7380, test_loss: 0.9227, test_f1: 0.5883
 epoch: 82, train_loss: 0.7202, test_loss: 0.8928, test_f1: 0.5836
 epoch: 83, train_loss: 0.7347, test_loss: 0.9458, test_f1: 0.5803
 epoch: 84, train_loss: 0.7302, test_loss: 0.9652, test_f1: 0.5446
 epoch: 85, train_loss: 0.7263, test_loss: 0.9633, test_f1: 0.5718
 epoch: 86, train_loss: 0.7210, test_loss: 0.9070, test_f1: 0.5723
 epoch: 87, train_loss: 0.7093, test_loss: 0.9549, test_f1: 0.5575
 epoch: 88, train_loss: 0.7291, test_loss: 0.9678, test_f1: 0.5866
 epoch: 89, train_loss: 0.7091, test_loss: 1.0134, test_f1: 0.5713
 epoch: 90, train_loss: 0.7357, test_loss: 1.0433, test_f1: 0.5608
 epoch: 91, train_loss: 0.7258, test_loss: 0.9272, test_f1: 0.5756
 epoch: 92, train_loss: 0.7195, test_loss: 0.9999, test_f1: 0.5671
 epoch: 93, train_loss: 0.7262, test_loss: 0.9949, test_f1: 0.5881
 epoch: 94, train_loss: 0.7278, test_loss: 0.9944, test_f1: 0.5711
 epoch: 95, train_loss: 0.7176, test_loss: 0.9664, test_f1: 0.5787
 epoch: 96, train_loss: 0.7043, test_loss: 1.0729, test_f1: 0.5481
 epoch: 97, train_loss: 0.6995, test_loss: 1.0667, test_f1: 0.5482
 epoch: 98, train_loss: 0.7234, test_loss: 1.0657, test_f1: 0.5674
 epoch: 99, train_loss: 0.7061, test_loss: 1.0339, test_f1: 0.5753
##################ITERATION #9 ****************************************
 epoch: 0, train_loss: 1.3208, test_loss: 1.2309, test_f1: 0.3870
 epoch: 1, train_loss: 1.2114, test_loss: 1.1225, test_f1: 0.4101
 epoch: 2, train_loss: 1.1757, test_loss: 1.1096, test_f1: 0.4274
 epoch: 3, train_loss: 1.1416, test_loss: 1.1212, test_f1: 0.4456
 epoch: 4, train_loss: 1.1248, test_loss: 1.1108, test_f1: 0.4458
 epoch: 5, train_loss: 1.0975, test_loss: 1.0575, test_f1: 0.4595
 epoch: 6, train_loss: 1.0799, test_loss: 0.9992, test_f1: 0.4905
 epoch: 7, train_loss: 1.0514, test_loss: 0.9965, test_f1: 0.4441
 epoch: 8, train_loss: 1.0415, test_loss: 1.0783, test_f1: 0.4345
 epoch: 9, train_loss: 1.0543, test_loss: 0.9391, test_f1: 0.4917
 epoch: 10, train_loss: 1.0276, test_loss: 0.9202, test_f1: 0.4992
 epoch: 11, train_loss: 1.0236, test_loss: 0.9132, test_f1: 0.4920
 epoch: 12, train_loss: 0.9894, test_loss: 0.8729, test_f1: 0.5637
 epoch: 13, train_loss: 1.0105, test_loss: 0.8754, test_f1: 0.5034
 epoch: 14, train_loss: 0.9807, test_loss: 0.8602, test_f1: 0.5254
 epoch: 15, train_loss: 0.9837, test_loss: 1.0045, test_f1: 0.4864
 epoch: 16, train_loss: 0.9721, test_loss: 0.9180, test_f1: 0.4905
 epoch: 17, train_loss: 0.9906, test_loss: 0.8645, test_f1: 0.5229
 epoch: 18, train_loss: 0.9665, test_loss: 0.9944, test_f1: 0.4795
 epoch: 19, train_loss: 0.9691, test_loss: 0.9360, test_f1: 0.4964
 epoch: 20, train_loss: 0.9675, test_loss: 0.9156, test_f1: 0.4785
 epoch: 21, train_loss: 0.9561, test_loss: 0.9681, test_f1: 0.4834
 epoch: 22, train_loss: 0.9384, test_loss: 0.9133, test_f1: 0.5070
 epoch: 23, train_loss: 0.9228, test_loss: 0.9084, test_f1: 0.4850
 epoch: 24, train_loss: 0.9294, test_loss: 0.9658, test_f1: 0.5009
 epoch: 25, train_loss: 0.9162, test_loss: 0.9429, test_f1: 0.4912
 epoch: 26, train_loss: 0.9108, test_loss: 0.9856, test_f1: 0.4875
 epoch: 27, train_loss: 0.9190, test_loss: 0.9183, test_f1: 0.5012
 epoch: 28, train_loss: 0.9056, test_loss: 0.9725, test_f1: 0.4801
 epoch: 29, train_loss: 0.9226, test_loss: 0.9288, test_f1: 0.5132
 epoch: 30, train_loss: 0.8951, test_loss: 0.9177, test_f1: 0.4992
 epoch: 31, train_loss: 0.8974, test_loss: 0.9929, test_f1: 0.5080
 epoch: 32, train_loss: 0.8958, test_loss: 0.8690, test_f1: 0.5141
 epoch: 33, train_loss: 0.8924, test_loss: 1.0078, test_f1: 0.5023
 epoch: 34, train_loss: 0.9006, test_loss: 0.9609, test_f1: 0.4757
 epoch: 35, train_loss: 0.8998, test_loss: 0.9824, test_f1: 0.5097
 epoch: 36, train_loss: 0.8782, test_loss: 1.1087, test_f1: 0.4754
 epoch: 37, train_loss: 0.8919, test_loss: 0.9334, test_f1: 0.5044
 epoch: 38, train_loss: 0.8870, test_loss: 0.9647, test_f1: 0.4945
 epoch: 39, train_loss: 0.9022, test_loss: 0.9894, test_f1: 0.4842
 epoch: 40, train_loss: 0.8764, test_loss: 1.0402, test_f1: 0.4892
 epoch: 41, train_loss: 0.8600, test_loss: 1.0164, test_f1: 0.4905
 epoch: 42, train_loss: 0.8724, test_loss: 1.0114, test_f1: 0.5214
 epoch: 43, train_loss: 0.8635, test_loss: 1.0340, test_f1: 0.5024
 epoch: 44, train_loss: 0.8555, test_loss: 0.9945, test_f1: 0.5075
 epoch: 45, train_loss: 0.8483, test_loss: 0.9567, test_f1: 0.5049
 epoch: 46, train_loss: 0.8573, test_loss: 0.9653, test_f1: 0.5186
 epoch: 47, train_loss: 0.8515, test_loss: 1.0658, test_f1: 0.5050
 epoch: 48, train_loss: 0.8382, test_loss: 1.0618, test_f1: 0.5025
 epoch: 49, train_loss: 0.8369, test_loss: 1.0620, test_f1: 0.5190
 epoch: 50, train_loss: 0.8524, test_loss: 0.9695, test_f1: 0.5017
 epoch: 51, train_loss: 0.8124, test_loss: 1.0026, test_f1: 0.5314
 epoch: 52, train_loss: 0.8129, test_loss: 0.9778, test_f1: 0.5558
 epoch: 53, train_loss: 0.8021, test_loss: 1.0206, test_f1: 0.5189
 epoch: 54, train_loss: 0.7920, test_loss: 1.0031, test_f1: 0.5306
 epoch: 55, train_loss: 0.7856, test_loss: 1.0195, test_f1: 0.5446
 epoch: 56, train_loss: 0.7936, test_loss: 1.0290, test_f1: 0.5365
 epoch: 57, train_loss: 0.7915, test_loss: 1.1125, test_f1: 0.4965
 epoch: 58, train_loss: 0.7816, test_loss: 1.0660, test_f1: 0.5084
 epoch: 59, train_loss: 0.7901, test_loss: 1.0385, test_f1: 0.5465
 epoch: 60, train_loss: 0.7856, test_loss: 1.0737, test_f1: 0.5486
 epoch: 61, train_loss: 0.7639, test_loss: 1.1104, test_f1: 0.5412
 epoch: 62, train_loss: 0.7726, test_loss: 1.1092, test_f1: 0.5492
 epoch: 63, train_loss: 0.7715, test_loss: 1.0901, test_f1: 0.5007
 epoch: 64, train_loss: 0.7801, test_loss: 1.1065, test_f1: 0.5459
 epoch: 65, train_loss: 0.7670, test_loss: 1.0588, test_f1: 0.5287
 epoch: 66, train_loss: 0.7804, test_loss: 1.1240, test_f1: 0.5267
 epoch: 67, train_loss: 0.7722, test_loss: 1.1557, test_f1: 0.5416
 epoch: 68, train_loss: 0.7634, test_loss: 1.1315, test_f1: 0.5417
 epoch: 69, train_loss: 0.7582, test_loss: 1.1050, test_f1: 0.5572
 epoch: 70, train_loss: 0.7561, test_loss: 1.1332, test_f1: 0.5392
 epoch: 71, train_loss: 0.7506, test_loss: 1.1157, test_f1: 0.5530
 epoch: 72, train_loss: 0.7434, test_loss: 1.0819, test_f1: 0.5382
 epoch: 73, train_loss: 0.7505, test_loss: 1.0320, test_f1: 0.5729
 epoch: 74, train_loss: 0.7630, test_loss: 1.1612, test_f1: 0.5299
 epoch: 75, train_loss: 0.8674, test_loss: 0.8797, test_f1: 0.5207
 epoch: 76, train_loss: 0.8228, test_loss: 1.0601, test_f1: 0.5379
 epoch: 77, train_loss: 0.8066, test_loss: 1.0266, test_f1: 0.5572
 epoch: 78, train_loss: 0.7790, test_loss: 1.0585, test_f1: 0.5681
 epoch: 79, train_loss: 0.7597, test_loss: 1.0883, test_f1: 0.5493
 epoch: 80, train_loss: 0.7790, test_loss: 1.1234, test_f1: 0.5360
 epoch: 81, train_loss: 0.7564, test_loss: 1.1485, test_f1: 0.5440
 epoch: 82, train_loss: 0.7515, test_loss: 1.1992, test_f1: 0.5458
 epoch: 83, train_loss: 0.7474, test_loss: 1.1892, test_f1: 0.5710
 epoch: 84, train_loss: 0.7529, test_loss: 1.0731, test_f1: 0.5473
 epoch: 85, train_loss: 0.7392, test_loss: 1.1132, test_f1: 0.5552
 epoch: 86, train_loss: 0.7473, test_loss: 1.1258, test_f1: 0.5662
 epoch: 87, train_loss: 0.7274, test_loss: 1.2002, test_f1: 0.5361
 epoch: 88, train_loss: 0.7291, test_loss: 1.2291, test_f1: 0.5583
 epoch: 89, train_loss: 0.7389, test_loss: 1.1121, test_f1: 0.5522
 epoch: 90, train_loss: 0.7315, test_loss: 1.1856, test_f1: 0.5656
 epoch: 91, train_loss: 0.7327, test_loss: 1.1343, test_f1: 0.5583
 epoch: 92, train_loss: 0.7202, test_loss: 1.1704, test_f1: 0.5674
 epoch: 93, train_loss: 0.7274, test_loss: 1.1822, test_f1: 0.5446
 epoch: 94, train_loss: 0.7266, test_loss: 1.2065, test_f1: 0.5600
 epoch: 95, train_loss: 0.7184, test_loss: 1.1743, test_f1: 0.5751
 epoch: 96, train_loss: 0.7116, test_loss: 1.2176, test_f1: 0.5613
 epoch: 97, train_loss: 0.7108, test_loss: 1.2586, test_f1: 0.5752
 epoch: 98, train_loss: 0.7123, test_loss: 1.1825, test_f1: 0.5613
 epoch: 99, train_loss: 0.7039, test_loss: 1.2857, test_f1: 0.5646

Training completed in 737.98 seconds
Best F1: 0.6042 at epoch 92
Mean F1 across iterations: 0.5865  0.0112
========================FINAL RESULTS================================
FEGIN weighted F1: 0.6042  0.0112
python main.py --data ltspice_examples --representation component_component --model FEGIN --layers 5 --hiddens 32 --batch_size 64 --lr 0.01 --emb_size 250 --epochs 100 --save_appendix component_component_L5_H32_BS64_LR0.01_E250 --no_val
-----



STDERR:
  File "main.py", line 370, in <module>
    main()
  File "main.py", line 254, in main
    dataset = dataset_class(
  File "/home/philip/projects/ltspice_examples_code_repo/Circuit-Completion-Using-GNNs/component_classification_with_link_prediction_head/evaluation/FEGIN/kernel/circuit_datasets.py", line 15, in __init__
    self.data, self.slices = torch.load(self.processed_paths[0])
  File "/home/philip/.local/lib/python3.8/site-packages/torch/serialization.py", line 1040, in load
    warnings.warn(
  File "/usr/lib/python3.8/warnings.py", line 109, in _showwarnmsg
    sw(msg.message, msg.category, msg.filename, msg.lineno,
  File "main.py", line 47, in warn_with_traceback
    traceback.print_stack(file=log)
/home/philip/projects/ltspice_examples_code_repo/Circuit-Completion-Using-GNNs/component_classification_with_link_prediction_head/evaluation/FEGIN/kernel/circuit_datasets.py:15: FutureWarning: You are using `torch.load` with `weights_only=False` (the current default value), which uses the default pickle module implicitly. It is possible to construct malicious pickle data which will execute arbitrary code during unpickling (See https://github.com/pytorch/pytorch/blob/main/SECURITY.md#untrusted-models for more details). In a future release, the default value for `weights_only` will be flipped to `True`. This limits the functions that could be executed during unpickling. Arbitrary objects will no longer be allowed to be loaded via this mode unless they are explicitly allowlisted by the user via `torch.serialization.add_safe_globals`. We recommend you start setting `weights_only=True` for any use case where you don't have full control of the loaded file. Please open an issue on GitHub for any issues related to this experimental feature.
  self.data, self.slices = torch.load(self.processed_paths[0])
