STDOUT:
Results will be saved in /home/philip/projects/ltspice_examples_code_repo/Circuit-Completion-Using-GNNs/component_classification_with_link_prediction_head/evaluation/FEGIN/results/model_FEGIN_dataset_ltspice_examples
Command line input: python main.py --data ltspice_examples --representation component_net --model FEGIN --layers 5 --hiddens 64 --batch_size 128 --lr 0.0001 --emb_size 512 --epochs 100 --save_appendix component_net_L5_H64_BS128_LR0.0001_E512 --no_val
 is saved.
-----
ltspice_examples - FEGIN
Using 5 layers, 64 hidden units, h = 2
Loading component_net representation dataset
ENTERED
Training FEGIN on component_net representation
Train: 3558, Test: 846
##################ITERATION #0 ****************************************
 epoch: 0, train_loss: 1.4016, test_loss: 1.3970, test_f1: 0.0793
 epoch: 1, train_loss: 1.3828, test_loss: 1.3818, test_f1: 0.2021
 epoch: 2, train_loss: 1.3662, test_loss: 1.3568, test_f1: 0.3866
 epoch: 3, train_loss: 1.3443, test_loss: 1.3294, test_f1: 0.3638
 epoch: 4, train_loss: 1.3193, test_loss: 1.3019, test_f1: 0.3263
 epoch: 5, train_loss: 1.2908, test_loss: 1.2731, test_f1: 0.3149
 epoch: 6, train_loss: 1.2631, test_loss: 1.2469, test_f1: 0.3139
 epoch: 7, train_loss: 1.2378, test_loss: 1.2245, test_f1: 0.3310
 epoch: 8, train_loss: 1.2161, test_loss: 1.2027, test_f1: 0.3444
 epoch: 9, train_loss: 1.1944, test_loss: 1.1810, test_f1: 0.3434
 epoch: 10, train_loss: 1.1814, test_loss: 1.1649, test_f1: 0.3498
 epoch: 11, train_loss: 1.1649, test_loss: 1.1441, test_f1: 0.3496
 epoch: 12, train_loss: 1.1427, test_loss: 1.1255, test_f1: 0.3469
 epoch: 13, train_loss: 1.1304, test_loss: 1.1099, test_f1: 0.3702
 epoch: 14, train_loss: 1.1158, test_loss: 1.0964, test_f1: 0.3913
 epoch: 15, train_loss: 1.1005, test_loss: 1.0776, test_f1: 0.4300
 epoch: 16, train_loss: 1.0861, test_loss: 1.0696, test_f1: 0.4878
 epoch: 17, train_loss: 1.0767, test_loss: 1.0623, test_f1: 0.4769
 epoch: 18, train_loss: 1.0574, test_loss: 1.0398, test_f1: 0.5024
 epoch: 19, train_loss: 1.0499, test_loss: 1.0377, test_f1: 0.5122
 epoch: 20, train_loss: 1.0287, test_loss: 1.0165, test_f1: 0.5100
 epoch: 21, train_loss: 1.0159, test_loss: 0.9987, test_f1: 0.5232
 epoch: 22, train_loss: 0.9992, test_loss: 0.9874, test_f1: 0.5095
 epoch: 23, train_loss: 0.9975, test_loss: 0.9689, test_f1: 0.5215
 epoch: 24, train_loss: 0.9757, test_loss: 0.9584, test_f1: 0.5298
 epoch: 25, train_loss: 0.9607, test_loss: 0.9804, test_f1: 0.5170
 epoch: 26, train_loss: 0.9439, test_loss: 0.9453, test_f1: 0.5260
 epoch: 27, train_loss: 0.9383, test_loss: 0.9488, test_f1: 0.4966
 epoch: 28, train_loss: 0.9187, test_loss: 0.9373, test_f1: 0.5205
 epoch: 29, train_loss: 0.9098, test_loss: 0.9610, test_f1: 0.4989
 epoch: 30, train_loss: 0.9069, test_loss: 0.9249, test_f1: 0.5303
 epoch: 31, train_loss: 0.8943, test_loss: 0.9561, test_f1: 0.5011
 epoch: 32, train_loss: 0.8923, test_loss: 0.9389, test_f1: 0.5149
 epoch: 33, train_loss: 0.8869, test_loss: 0.9501, test_f1: 0.5118
 epoch: 34, train_loss: 0.8847, test_loss: 0.9179, test_f1: 0.5159
 epoch: 35, train_loss: 0.8723, test_loss: 0.9416, test_f1: 0.5065
 epoch: 36, train_loss: 0.8657, test_loss: 0.9180, test_f1: 0.5168
 epoch: 37, train_loss: 0.8587, test_loss: 0.9517, test_f1: 0.5310
 epoch: 38, train_loss: 0.8572, test_loss: 0.9307, test_f1: 0.5139
 epoch: 39, train_loss: 0.8570, test_loss: 0.9353, test_f1: 0.5262
 epoch: 40, train_loss: 0.8494, test_loss: 0.9548, test_f1: 0.5242
 epoch: 41, train_loss: 0.8443, test_loss: 0.9292, test_f1: 0.5334
 epoch: 42, train_loss: 0.8461, test_loss: 0.9619, test_f1: 0.5319
 epoch: 43, train_loss: 0.8336, test_loss: 0.9488, test_f1: 0.5161
 epoch: 44, train_loss: 0.8252, test_loss: 0.9631, test_f1: 0.5277
 epoch: 45, train_loss: 0.8324, test_loss: 0.9561, test_f1: 0.5200
 epoch: 46, train_loss: 0.8133, test_loss: 0.9553, test_f1: 0.5167
 epoch: 47, train_loss: 0.8118, test_loss: 0.9462, test_f1: 0.5205
 epoch: 48, train_loss: 0.8121, test_loss: 0.9494, test_f1: 0.5213
 epoch: 49, train_loss: 0.8091, test_loss: 0.9332, test_f1: 0.5500
 epoch: 50, train_loss: 0.8062, test_loss: 0.9542, test_f1: 0.5354
 epoch: 51, train_loss: 0.8021, test_loss: 0.9463, test_f1: 0.5367
 epoch: 52, train_loss: 0.7825, test_loss: 0.9464, test_f1: 0.5317
 epoch: 53, train_loss: 0.7810, test_loss: 0.9529, test_f1: 0.5338
 epoch: 54, train_loss: 0.7874, test_loss: 0.9567, test_f1: 0.5519
 epoch: 55, train_loss: 0.7812, test_loss: 0.9588, test_f1: 0.5407
 epoch: 56, train_loss: 0.7872, test_loss: 0.9597, test_f1: 0.5283
 epoch: 57, train_loss: 0.7793, test_loss: 0.9500, test_f1: 0.5388
 epoch: 58, train_loss: 0.7838, test_loss: 0.9791, test_f1: 0.5443
 epoch: 59, train_loss: 0.7859, test_loss: 0.9535, test_f1: 0.5431
 epoch: 60, train_loss: 0.7802, test_loss: 0.9673, test_f1: 0.5262
 epoch: 61, train_loss: 0.7676, test_loss: 0.9693, test_f1: 0.5411
 epoch: 62, train_loss: 0.7664, test_loss: 0.9794, test_f1: 0.5223
 epoch: 63, train_loss: 0.7824, test_loss: 0.9690, test_f1: 0.5417
 epoch: 64, train_loss: 0.7752, test_loss: 0.9751, test_f1: 0.5422
 epoch: 65, train_loss: 0.7644, test_loss: 0.9692, test_f1: 0.5269
 epoch: 66, train_loss: 0.7765, test_loss: 0.9525, test_f1: 0.5375
 epoch: 67, train_loss: 0.7679, test_loss: 0.9753, test_f1: 0.5460
 epoch: 68, train_loss: 0.7709, test_loss: 0.9588, test_f1: 0.5271
 epoch: 69, train_loss: 0.7635, test_loss: 0.9622, test_f1: 0.5487
 epoch: 70, train_loss: 0.7699, test_loss: 0.9431, test_f1: 0.5455
 epoch: 71, train_loss: 0.7669, test_loss: 0.9757, test_f1: 0.5292
 epoch: 72, train_loss: 0.7594, test_loss: 0.9770, test_f1: 0.5499
 epoch: 73, train_loss: 0.7564, test_loss: 0.9631, test_f1: 0.5453
 epoch: 74, train_loss: 0.7545, test_loss: 0.9735, test_f1: 0.5556
 epoch: 75, train_loss: 0.7584, test_loss: 0.9590, test_f1: 0.5641
 epoch: 76, train_loss: 0.7534, test_loss: 0.9744, test_f1: 0.5713
 epoch: 77, train_loss: 0.7523, test_loss: 0.9672, test_f1: 0.5732
 epoch: 78, train_loss: 0.7449, test_loss: 0.9706, test_f1: 0.5671
 epoch: 79, train_loss: 0.7538, test_loss: 0.9793, test_f1: 0.5697
 epoch: 80, train_loss: 0.7521, test_loss: 0.9717, test_f1: 0.5766
 epoch: 81, train_loss: 0.7532, test_loss: 0.9593, test_f1: 0.5725
 epoch: 82, train_loss: 0.7502, test_loss: 0.9837, test_f1: 0.5715
 epoch: 83, train_loss: 0.7511, test_loss: 0.9708, test_f1: 0.5700
 epoch: 84, train_loss: 0.7408, test_loss: 0.9822, test_f1: 0.5742
 epoch: 85, train_loss: 0.7496, test_loss: 0.9848, test_f1: 0.5784
 epoch: 86, train_loss: 0.7351, test_loss: 0.9914, test_f1: 0.5682
 epoch: 87, train_loss: 0.7496, test_loss: 0.9883, test_f1: 0.5805
 epoch: 88, train_loss: 0.7380, test_loss: 0.9712, test_f1: 0.5881
 epoch: 89, train_loss: 0.7363, test_loss: 0.9717, test_f1: 0.5731
 epoch: 90, train_loss: 0.7462, test_loss: 0.9695, test_f1: 0.5718
 epoch: 91, train_loss: 0.7311, test_loss: 0.9803, test_f1: 0.5672
 epoch: 92, train_loss: 0.7304, test_loss: 0.9715, test_f1: 0.5798
 epoch: 93, train_loss: 0.7309, test_loss: 0.9876, test_f1: 0.5801
 epoch: 94, train_loss: 0.7359, test_loss: 0.9760, test_f1: 0.5717
 epoch: 95, train_loss: 0.7306, test_loss: 0.9794, test_f1: 0.5809
 epoch: 96, train_loss: 0.7266, test_loss: 0.9882, test_f1: 0.5907
 epoch: 97, train_loss: 0.7399, test_loss: 0.9881, test_f1: 0.5670
 epoch: 98, train_loss: 0.7259, test_loss: 0.9814, test_f1: 0.5716
 epoch: 99, train_loss: 0.7311, test_loss: 0.9840, test_f1: 0.5775
##################ITERATION #1 ****************************************
 epoch: 0, train_loss: 1.3272, test_loss: 1.3644, test_f1: 0.2270
 epoch: 1, train_loss: 1.2847, test_loss: 1.3190, test_f1: 0.2487
 epoch: 2, train_loss: 1.2597, test_loss: 1.2578, test_f1: 0.3331
 epoch: 3, train_loss: 1.2372, test_loss: 1.2114, test_f1: 0.3826
 epoch: 4, train_loss: 1.2142, test_loss: 1.1830, test_f1: 0.3964
 epoch: 5, train_loss: 1.1899, test_loss: 1.1616, test_f1: 0.4128
 epoch: 6, train_loss: 1.1690, test_loss: 1.1342, test_f1: 0.4341
 epoch: 7, train_loss: 1.1481, test_loss: 1.1115, test_f1: 0.4416
 epoch: 8, train_loss: 1.1232, test_loss: 1.0866, test_f1: 0.4549
 epoch: 9, train_loss: 1.1004, test_loss: 1.0658, test_f1: 0.4580
 epoch: 10, train_loss: 1.0827, test_loss: 1.0482, test_f1: 0.4622
 epoch: 11, train_loss: 1.0585, test_loss: 1.0218, test_f1: 0.4690
 epoch: 12, train_loss: 1.0447, test_loss: 1.0145, test_f1: 0.4752
 epoch: 13, train_loss: 1.0205, test_loss: 0.9902, test_f1: 0.4885
 epoch: 14, train_loss: 1.0090, test_loss: 0.9893, test_f1: 0.4844
 epoch: 15, train_loss: 0.9977, test_loss: 0.9757, test_f1: 0.4818
 epoch: 16, train_loss: 0.9822, test_loss: 0.9615, test_f1: 0.4730
 epoch: 17, train_loss: 0.9668, test_loss: 0.9595, test_f1: 0.4813
 epoch: 18, train_loss: 0.9563, test_loss: 0.9477, test_f1: 0.5057
 epoch: 19, train_loss: 0.9464, test_loss: 0.9292, test_f1: 0.4962
 epoch: 20, train_loss: 0.9314, test_loss: 0.9333, test_f1: 0.5051
 epoch: 21, train_loss: 0.9336, test_loss: 0.9211, test_f1: 0.4902
 epoch: 22, train_loss: 0.9196, test_loss: 0.9268, test_f1: 0.5062
 epoch: 23, train_loss: 0.9216, test_loss: 0.9353, test_f1: 0.5143
 epoch: 24, train_loss: 0.9080, test_loss: 0.9233, test_f1: 0.5012
 epoch: 25, train_loss: 0.8923, test_loss: 0.9321, test_f1: 0.5181
 epoch: 26, train_loss: 0.8950, test_loss: 0.9199, test_f1: 0.5133
 epoch: 27, train_loss: 0.8911, test_loss: 0.9316, test_f1: 0.4948
 epoch: 28, train_loss: 0.8744, test_loss: 0.9183, test_f1: 0.5210
 epoch: 29, train_loss: 0.8754, test_loss: 0.9347, test_f1: 0.5134
 epoch: 30, train_loss: 0.8644, test_loss: 0.9274, test_f1: 0.5169
 epoch: 31, train_loss: 0.8658, test_loss: 0.9081, test_f1: 0.5176
 epoch: 32, train_loss: 0.8585, test_loss: 0.9328, test_f1: 0.5098
 epoch: 33, train_loss: 0.8500, test_loss: 0.9065, test_f1: 0.5187
 epoch: 34, train_loss: 0.8463, test_loss: 0.9201, test_f1: 0.5170
 epoch: 35, train_loss: 0.8314, test_loss: 0.9191, test_f1: 0.5265
 epoch: 36, train_loss: 0.8423, test_loss: 0.9260, test_f1: 0.5229
 epoch: 37, train_loss: 0.8354, test_loss: 0.9397, test_f1: 0.5120
 epoch: 38, train_loss: 0.8332, test_loss: 0.9169, test_f1: 0.5196
 epoch: 39, train_loss: 0.8168, test_loss: 0.9142, test_f1: 0.5318
 epoch: 40, train_loss: 0.8212, test_loss: 0.9350, test_f1: 0.5297
 epoch: 41, train_loss: 0.8212, test_loss: 0.9166, test_f1: 0.5347
 epoch: 42, train_loss: 0.8066, test_loss: 0.9558, test_f1: 0.5336
 epoch: 43, train_loss: 0.8098, test_loss: 0.9115, test_f1: 0.5291
 epoch: 44, train_loss: 0.7982, test_loss: 0.9254, test_f1: 0.5390
 epoch: 45, train_loss: 0.8026, test_loss: 0.9190, test_f1: 0.5454
 epoch: 46, train_loss: 0.7946, test_loss: 0.9447, test_f1: 0.5205
 epoch: 47, train_loss: 0.7931, test_loss: 0.9368, test_f1: 0.5383
 epoch: 48, train_loss: 0.8067, test_loss: 0.9747, test_f1: 0.5162
 epoch: 49, train_loss: 0.7844, test_loss: 0.9292, test_f1: 0.5386
 epoch: 50, train_loss: 0.7881, test_loss: 0.9096, test_f1: 0.5566
 epoch: 51, train_loss: 0.7758, test_loss: 0.9133, test_f1: 0.5504
 epoch: 52, train_loss: 0.7740, test_loss: 0.9322, test_f1: 0.5559
 epoch: 53, train_loss: 0.7621, test_loss: 0.9274, test_f1: 0.5487
 epoch: 54, train_loss: 0.7645, test_loss: 0.9315, test_f1: 0.5556
 epoch: 55, train_loss: 0.7740, test_loss: 0.9358, test_f1: 0.5499
 epoch: 56, train_loss: 0.7849, test_loss: 0.9248, test_f1: 0.5627
 epoch: 57, train_loss: 0.7708, test_loss: 0.9299, test_f1: 0.5594
 epoch: 58, train_loss: 0.7638, test_loss: 0.9268, test_f1: 0.5495
 epoch: 59, train_loss: 0.7671, test_loss: 0.9235, test_f1: 0.5606
 epoch: 60, train_loss: 0.7531, test_loss: 0.9242, test_f1: 0.5660
 epoch: 61, train_loss: 0.7679, test_loss: 0.9203, test_f1: 0.5658
 epoch: 62, train_loss: 0.7604, test_loss: 0.9280, test_f1: 0.5486
 epoch: 63, train_loss: 0.7476, test_loss: 0.9484, test_f1: 0.5562
 epoch: 64, train_loss: 0.7538, test_loss: 0.9197, test_f1: 0.5572
 epoch: 65, train_loss: 0.7487, test_loss: 0.9409, test_f1: 0.5546
 epoch: 66, train_loss: 0.7531, test_loss: 0.9276, test_f1: 0.5623
 epoch: 67, train_loss: 0.7530, test_loss: 0.9436, test_f1: 0.5630
 epoch: 68, train_loss: 0.7511, test_loss: 0.9365, test_f1: 0.5572
 epoch: 69, train_loss: 0.7524, test_loss: 0.9555, test_f1: 0.5613
 epoch: 70, train_loss: 0.7563, test_loss: 0.9371, test_f1: 0.5434
 epoch: 71, train_loss: 0.7487, test_loss: 0.9357, test_f1: 0.5650
 epoch: 72, train_loss: 0.7349, test_loss: 0.9557, test_f1: 0.5730
 epoch: 73, train_loss: 0.7449, test_loss: 0.9278, test_f1: 0.5614
 epoch: 74, train_loss: 0.7438, test_loss: 0.9498, test_f1: 0.5487
 epoch: 75, train_loss: 0.7371, test_loss: 0.9490, test_f1: 0.5669
 epoch: 76, train_loss: 0.7466, test_loss: 0.9275, test_f1: 0.5598
 epoch: 77, train_loss: 0.7379, test_loss: 0.9372, test_f1: 0.5618
 epoch: 78, train_loss: 0.7350, test_loss: 0.9631, test_f1: 0.5638
 epoch: 79, train_loss: 0.7354, test_loss: 0.9765, test_f1: 0.5463
 epoch: 80, train_loss: 0.7410, test_loss: 0.9278, test_f1: 0.5589
 epoch: 81, train_loss: 0.7392, test_loss: 0.9428, test_f1: 0.5646
 epoch: 82, train_loss: 0.7410, test_loss: 0.9408, test_f1: 0.5684
 epoch: 83, train_loss: 0.7295, test_loss: 0.9347, test_f1: 0.5619
 epoch: 84, train_loss: 0.7302, test_loss: 0.9464, test_f1: 0.5649
 epoch: 85, train_loss: 0.7337, test_loss: 0.9497, test_f1: 0.5649
 epoch: 86, train_loss: 0.7283, test_loss: 0.9614, test_f1: 0.5616
 epoch: 87, train_loss: 0.7318, test_loss: 0.9499, test_f1: 0.5697
 epoch: 88, train_loss: 0.7173, test_loss: 0.9480, test_f1: 0.5582
 epoch: 89, train_loss: 0.7341, test_loss: 0.9430, test_f1: 0.5728
 epoch: 90, train_loss: 0.7190, test_loss: 0.9432, test_f1: 0.5688
 epoch: 91, train_loss: 0.7182, test_loss: 0.9442, test_f1: 0.5681
 epoch: 92, train_loss: 0.7164, test_loss: 0.9415, test_f1: 0.5602
 epoch: 93, train_loss: 0.7161, test_loss: 0.9472, test_f1: 0.5708
 epoch: 94, train_loss: 0.7216, test_loss: 0.9379, test_f1: 0.5676
 epoch: 95, train_loss: 0.7171, test_loss: 0.9330, test_f1: 0.5729
 epoch: 96, train_loss: 0.7133, test_loss: 0.9430, test_f1: 0.5625
 epoch: 97, train_loss: 0.7196, test_loss: 0.9648, test_f1: 0.5593
 epoch: 98, train_loss: 0.7139, test_loss: 0.9494, test_f1: 0.5670
 epoch: 99, train_loss: 0.7208, test_loss: 0.9671, test_f1: 0.5594
##################ITERATION #2 ****************************************
 epoch: 0, train_loss: 1.2948, test_loss: 1.3292, test_f1: 0.2270
 epoch: 1, train_loss: 1.2386, test_loss: 1.2523, test_f1: 0.2765
 epoch: 2, train_loss: 1.2101, test_loss: 1.1881, test_f1: 0.3316
 epoch: 3, train_loss: 1.1852, test_loss: 1.1430, test_f1: 0.4193
 epoch: 4, train_loss: 1.1602, test_loss: 1.1120, test_f1: 0.4377
 epoch: 5, train_loss: 1.1339, test_loss: 1.0863, test_f1: 0.4523
 epoch: 6, train_loss: 1.1105, test_loss: 1.0588, test_f1: 0.4685
 epoch: 7, train_loss: 1.0887, test_loss: 1.0417, test_f1: 0.4640
 epoch: 8, train_loss: 1.0748, test_loss: 1.0258, test_f1: 0.4598
 epoch: 9, train_loss: 1.0561, test_loss: 1.0196, test_f1: 0.4626
 epoch: 10, train_loss: 1.0371, test_loss: 0.9879, test_f1: 0.4734
 epoch: 11, train_loss: 1.0153, test_loss: 0.9752, test_f1: 0.4874
 epoch: 12, train_loss: 1.0165, test_loss: 0.9693, test_f1: 0.4970
 epoch: 13, train_loss: 0.9928, test_loss: 0.9556, test_f1: 0.4984
 epoch: 14, train_loss: 0.9790, test_loss: 0.9511, test_f1: 0.4990
 epoch: 15, train_loss: 0.9732, test_loss: 0.9566, test_f1: 0.4932
 epoch: 16, train_loss: 0.9642, test_loss: 0.9571, test_f1: 0.4846
 epoch: 17, train_loss: 0.9588, test_loss: 0.9441, test_f1: 0.4928
 epoch: 18, train_loss: 0.9468, test_loss: 0.9354, test_f1: 0.5035
 epoch: 19, train_loss: 0.9344, test_loss: 0.9341, test_f1: 0.5069
 epoch: 20, train_loss: 0.9382, test_loss: 0.9372, test_f1: 0.4985
 epoch: 21, train_loss: 0.9328, test_loss: 0.9141, test_f1: 0.5049
 epoch: 22, train_loss: 0.9227, test_loss: 0.9336, test_f1: 0.4990
 epoch: 23, train_loss: 0.9153, test_loss: 0.9237, test_f1: 0.5165
 epoch: 24, train_loss: 0.8998, test_loss: 0.9433, test_f1: 0.4976
 epoch: 25, train_loss: 0.8999, test_loss: 0.9372, test_f1: 0.5058
 epoch: 26, train_loss: 0.8901, test_loss: 0.9550, test_f1: 0.5424
 epoch: 27, train_loss: 0.8908, test_loss: 0.9401, test_f1: 0.5065
 epoch: 28, train_loss: 0.8815, test_loss: 0.9281, test_f1: 0.5274
 epoch: 29, train_loss: 0.8701, test_loss: 0.9284, test_f1: 0.5358
 epoch: 30, train_loss: 0.8662, test_loss: 0.9288, test_f1: 0.5415
 epoch: 31, train_loss: 0.8715, test_loss: 0.9504, test_f1: 0.5196
 epoch: 32, train_loss: 0.8665, test_loss: 0.9471, test_f1: 0.5215
 epoch: 33, train_loss: 0.8589, test_loss: 0.9436, test_f1: 0.5348
 epoch: 34, train_loss: 0.8624, test_loss: 0.9469, test_f1: 0.5301
 epoch: 35, train_loss: 0.8499, test_loss: 0.9417, test_f1: 0.5336
 epoch: 36, train_loss: 0.8499, test_loss: 0.9443, test_f1: 0.5267
 epoch: 37, train_loss: 0.8493, test_loss: 0.9258, test_f1: 0.5417
 epoch: 38, train_loss: 0.8540, test_loss: 0.9409, test_f1: 0.5431
 epoch: 39, train_loss: 0.8303, test_loss: 0.9444, test_f1: 0.5282
 epoch: 40, train_loss: 0.8376, test_loss: 0.9495, test_f1: 0.5283
 epoch: 41, train_loss: 0.8362, test_loss: 0.9807, test_f1: 0.4965
 epoch: 42, train_loss: 0.8351, test_loss: 0.9585, test_f1: 0.5255
 epoch: 43, train_loss: 0.8323, test_loss: 0.9631, test_f1: 0.5251
 epoch: 44, train_loss: 0.8274, test_loss: 0.9352, test_f1: 0.5218
 epoch: 45, train_loss: 0.8250, test_loss: 0.9502, test_f1: 0.5315
 epoch: 46, train_loss: 0.8033, test_loss: 0.9437, test_f1: 0.5293
 epoch: 47, train_loss: 0.8134, test_loss: 0.9562, test_f1: 0.5156
 epoch: 48, train_loss: 0.8090, test_loss: 0.9364, test_f1: 0.5610
 epoch: 49, train_loss: 0.8080, test_loss: 0.9339, test_f1: 0.5540
 epoch: 50, train_loss: 0.8006, test_loss: 0.9583, test_f1: 0.5383
 epoch: 51, train_loss: 0.8019, test_loss: 0.9485, test_f1: 0.5359
 epoch: 52, train_loss: 0.8032, test_loss: 0.9405, test_f1: 0.5419
 epoch: 53, train_loss: 0.7918, test_loss: 0.9684, test_f1: 0.5229
 epoch: 54, train_loss: 0.7885, test_loss: 0.9573, test_f1: 0.5358
 epoch: 55, train_loss: 0.7856, test_loss: 0.9634, test_f1: 0.5373
 epoch: 56, train_loss: 0.7789, test_loss: 0.9546, test_f1: 0.5305
 epoch: 57, train_loss: 0.7779, test_loss: 0.9657, test_f1: 0.5288
 epoch: 58, train_loss: 0.7857, test_loss: 0.9657, test_f1: 0.5321
 epoch: 59, train_loss: 0.7776, test_loss: 0.9820, test_f1: 0.5339
 epoch: 60, train_loss: 0.7811, test_loss: 0.9669, test_f1: 0.5359
 epoch: 61, train_loss: 0.7789, test_loss: 0.9689, test_f1: 0.5268
 epoch: 62, train_loss: 0.7855, test_loss: 0.9753, test_f1: 0.5285
 epoch: 63, train_loss: 0.7656, test_loss: 0.9710, test_f1: 0.5268
 epoch: 64, train_loss: 0.7714, test_loss: 0.9662, test_f1: 0.5455
 epoch: 65, train_loss: 0.7858, test_loss: 0.9689, test_f1: 0.5441
 epoch: 66, train_loss: 0.7705, test_loss: 0.9516, test_f1: 0.5387
 epoch: 67, train_loss: 0.7725, test_loss: 0.9620, test_f1: 0.5360
 epoch: 68, train_loss: 0.7616, test_loss: 0.9618, test_f1: 0.5390
 epoch: 69, train_loss: 0.7612, test_loss: 0.9622, test_f1: 0.5338
 epoch: 70, train_loss: 0.7543, test_loss: 0.9627, test_f1: 0.5353
 epoch: 71, train_loss: 0.7649, test_loss: 0.9771, test_f1: 0.5341
 epoch: 72, train_loss: 0.7581, test_loss: 0.9730, test_f1: 0.5443
 epoch: 73, train_loss: 0.7591, test_loss: 0.9595, test_f1: 0.5511
 epoch: 74, train_loss: 0.7663, test_loss: 0.9619, test_f1: 0.5409
 epoch: 75, train_loss: 0.7592, test_loss: 0.9941, test_f1: 0.5400
 epoch: 76, train_loss: 0.7521, test_loss: 0.9689, test_f1: 0.5220
 epoch: 77, train_loss: 0.7574, test_loss: 0.9724, test_f1: 0.5301
 epoch: 78, train_loss: 0.7504, test_loss: 0.9934, test_f1: 0.5401
 epoch: 79, train_loss: 0.7503, test_loss: 0.9766, test_f1: 0.5374
 epoch: 80, train_loss: 0.7496, test_loss: 0.9626, test_f1: 0.5439
 epoch: 81, train_loss: 0.7447, test_loss: 0.9759, test_f1: 0.5247
 epoch: 82, train_loss: 0.7555, test_loss: 0.9665, test_f1: 0.5225
 epoch: 83, train_loss: 0.7397, test_loss: 0.9754, test_f1: 0.5376
 epoch: 84, train_loss: 0.7360, test_loss: 0.9649, test_f1: 0.5303
 epoch: 85, train_loss: 0.7374, test_loss: 0.9490, test_f1: 0.5437
 epoch: 86, train_loss: 0.7404, test_loss: 0.9523, test_f1: 0.5319
 epoch: 87, train_loss: 0.7430, test_loss: 0.9677, test_f1: 0.5383
 epoch: 88, train_loss: 0.7373, test_loss: 0.9492, test_f1: 0.5353
 epoch: 89, train_loss: 0.7373, test_loss: 0.9772, test_f1: 0.5323
 epoch: 90, train_loss: 0.7418, test_loss: 0.9704, test_f1: 0.5315
 epoch: 91, train_loss: 0.7323, test_loss: 0.9719, test_f1: 0.5370
 epoch: 92, train_loss: 0.7328, test_loss: 0.9582, test_f1: 0.5325
 epoch: 93, train_loss: 0.7424, test_loss: 0.9702, test_f1: 0.5361
 epoch: 94, train_loss: 0.7401, test_loss: 0.9601, test_f1: 0.5329
 epoch: 95, train_loss: 0.7382, test_loss: 0.9690, test_f1: 0.5318
 epoch: 96, train_loss: 0.7268, test_loss: 0.9558, test_f1: 0.5466
 epoch: 97, train_loss: 0.7350, test_loss: 0.9690, test_f1: 0.5355
 epoch: 98, train_loss: 0.7292, test_loss: 0.9770, test_f1: 0.5424
 epoch: 99, train_loss: 0.7280, test_loss: 0.9559, test_f1: 0.5378
##################ITERATION #3 ****************************************
 epoch: 0, train_loss: 1.2700, test_loss: 1.3305, test_f1: 0.2320
 epoch: 1, train_loss: 1.2111, test_loss: 1.2223, test_f1: 0.3918
 epoch: 2, train_loss: 1.1830, test_loss: 1.1489, test_f1: 0.4038
 epoch: 3, train_loss: 1.1555, test_loss: 1.1094, test_f1: 0.4498
 epoch: 4, train_loss: 1.1369, test_loss: 1.0802, test_f1: 0.4543
 epoch: 5, train_loss: 1.1162, test_loss: 1.0539, test_f1: 0.4550
 epoch: 6, train_loss: 1.0929, test_loss: 1.0356, test_f1: 0.4571
 epoch: 7, train_loss: 1.0761, test_loss: 1.0126, test_f1: 0.4726
 epoch: 8, train_loss: 1.0581, test_loss: 1.0017, test_f1: 0.4878
 epoch: 9, train_loss: 1.0428, test_loss: 0.9784, test_f1: 0.4977
 epoch: 10, train_loss: 1.0275, test_loss: 0.9654, test_f1: 0.4921
 epoch: 11, train_loss: 1.0157, test_loss: 0.9565, test_f1: 0.4901
 epoch: 12, train_loss: 0.9973, test_loss: 0.9447, test_f1: 0.5037
 epoch: 13, train_loss: 0.9918, test_loss: 0.9429, test_f1: 0.5057
 epoch: 14, train_loss: 0.9879, test_loss: 0.9242, test_f1: 0.5070
 epoch: 15, train_loss: 0.9692, test_loss: 0.9275, test_f1: 0.4913
 epoch: 16, train_loss: 0.9617, test_loss: 0.9221, test_f1: 0.5216
 epoch: 17, train_loss: 0.9502, test_loss: 0.9052, test_f1: 0.5248
 epoch: 18, train_loss: 0.9440, test_loss: 0.9127, test_f1: 0.5153
 epoch: 19, train_loss: 0.9349, test_loss: 0.8975, test_f1: 0.5205
 epoch: 20, train_loss: 0.9377, test_loss: 0.9009, test_f1: 0.5324
 epoch: 21, train_loss: 0.9276, test_loss: 0.8994, test_f1: 0.5308
 epoch: 22, train_loss: 0.9091, test_loss: 0.8955, test_f1: 0.5356
 epoch: 23, train_loss: 0.9083, test_loss: 0.8967, test_f1: 0.5423
 epoch: 24, train_loss: 0.9002, test_loss: 0.8845, test_f1: 0.5444
 epoch: 25, train_loss: 0.8948, test_loss: 0.8986, test_f1: 0.5476
 epoch: 26, train_loss: 0.8908, test_loss: 0.8873, test_f1: 0.5419
 epoch: 27, train_loss: 0.8841, test_loss: 0.8983, test_f1: 0.5380
 epoch: 28, train_loss: 0.8900, test_loss: 0.8910, test_f1: 0.5396
 epoch: 29, train_loss: 0.8784, test_loss: 0.8937, test_f1: 0.5383
 epoch: 30, train_loss: 0.8712, test_loss: 0.8883, test_f1: 0.5429
 epoch: 31, train_loss: 0.8598, test_loss: 0.8835, test_f1: 0.5417
 epoch: 32, train_loss: 0.8635, test_loss: 0.8712, test_f1: 0.5591
 epoch: 33, train_loss: 0.8509, test_loss: 0.8847, test_f1: 0.5384
 epoch: 34, train_loss: 0.8502, test_loss: 0.8974, test_f1: 0.5490
 epoch: 35, train_loss: 0.8481, test_loss: 0.8790, test_f1: 0.5405
 epoch: 36, train_loss: 0.8480, test_loss: 0.8792, test_f1: 0.5734
 epoch: 37, train_loss: 0.8401, test_loss: 0.8918, test_f1: 0.5405
 epoch: 38, train_loss: 0.8396, test_loss: 0.9011, test_f1: 0.5558
 epoch: 39, train_loss: 0.8301, test_loss: 0.8946, test_f1: 0.5591
 epoch: 40, train_loss: 0.8205, test_loss: 0.8917, test_f1: 0.5529
 epoch: 41, train_loss: 0.8273, test_loss: 0.8926, test_f1: 0.5569
 epoch: 42, train_loss: 0.8179, test_loss: 0.8903, test_f1: 0.5453
 epoch: 43, train_loss: 0.8182, test_loss: 0.8807, test_f1: 0.5662
 epoch: 44, train_loss: 0.8252, test_loss: 0.8905, test_f1: 0.5465
 epoch: 45, train_loss: 0.8143, test_loss: 0.9059, test_f1: 0.5719
 epoch: 46, train_loss: 0.8098, test_loss: 0.8940, test_f1: 0.5465
 epoch: 47, train_loss: 0.8083, test_loss: 0.8937, test_f1: 0.5562
 epoch: 48, train_loss: 0.8101, test_loss: 0.9021, test_f1: 0.5716
 epoch: 49, train_loss: 0.7937, test_loss: 0.8625, test_f1: 0.5713
 epoch: 50, train_loss: 0.8033, test_loss: 0.9078, test_f1: 0.5438
 epoch: 51, train_loss: 0.7970, test_loss: 0.8836, test_f1: 0.5702
 epoch: 52, train_loss: 0.7812, test_loss: 0.8803, test_f1: 0.5440
 epoch: 53, train_loss: 0.7886, test_loss: 0.8711, test_f1: 0.5654
 epoch: 54, train_loss: 0.7819, test_loss: 0.8806, test_f1: 0.5512
 epoch: 55, train_loss: 0.7861, test_loss: 0.8868, test_f1: 0.5480
 epoch: 56, train_loss: 0.7789, test_loss: 0.8997, test_f1: 0.5323
 epoch: 57, train_loss: 0.7769, test_loss: 0.8979, test_f1: 0.5501
 epoch: 58, train_loss: 0.7781, test_loss: 0.9182, test_f1: 0.5446
 epoch: 59, train_loss: 0.7810, test_loss: 0.8982, test_f1: 0.5563
 epoch: 60, train_loss: 0.7802, test_loss: 0.8917, test_f1: 0.5611
 epoch: 61, train_loss: 0.7722, test_loss: 0.8996, test_f1: 0.5573
 epoch: 62, train_loss: 0.7613, test_loss: 0.9044, test_f1: 0.5501
 epoch: 63, train_loss: 0.7635, test_loss: 0.8961, test_f1: 0.5562
 epoch: 64, train_loss: 0.7657, test_loss: 0.9074, test_f1: 0.5449
 epoch: 65, train_loss: 0.7621, test_loss: 0.9056, test_f1: 0.5620
 epoch: 66, train_loss: 0.7737, test_loss: 0.9156, test_f1: 0.5430
 epoch: 67, train_loss: 0.7598, test_loss: 0.9118, test_f1: 0.5487
 epoch: 68, train_loss: 0.7597, test_loss: 0.9150, test_f1: 0.5437
 epoch: 69, train_loss: 0.7624, test_loss: 0.8992, test_f1: 0.5810
 epoch: 70, train_loss: 0.7556, test_loss: 0.9194, test_f1: 0.5550
 epoch: 71, train_loss: 0.7534, test_loss: 0.9217, test_f1: 0.5491
 epoch: 72, train_loss: 0.7600, test_loss: 0.8993, test_f1: 0.5593
 epoch: 73, train_loss: 0.7627, test_loss: 0.9005, test_f1: 0.5607
 epoch: 74, train_loss: 0.7489, test_loss: 0.9139, test_f1: 0.5526
 epoch: 75, train_loss: 0.7494, test_loss: 0.9068, test_f1: 0.5756
 epoch: 76, train_loss: 0.7500, test_loss: 0.8947, test_f1: 0.5560
 epoch: 77, train_loss: 0.7410, test_loss: 0.9210, test_f1: 0.5486
 epoch: 78, train_loss: 0.7430, test_loss: 0.8939, test_f1: 0.5714
 epoch: 79, train_loss: 0.7484, test_loss: 0.9206, test_f1: 0.5576
 epoch: 80, train_loss: 0.7434, test_loss: 0.9288, test_f1: 0.5428
 epoch: 81, train_loss: 0.7505, test_loss: 0.9118, test_f1: 0.5541
 epoch: 82, train_loss: 0.7410, test_loss: 0.9308, test_f1: 0.5682
 epoch: 83, train_loss: 0.7393, test_loss: 0.9190, test_f1: 0.5492
 epoch: 84, train_loss: 0.7355, test_loss: 0.9199, test_f1: 0.5736
 epoch: 85, train_loss: 0.7406, test_loss: 0.9376, test_f1: 0.5544
 epoch: 86, train_loss: 0.7422, test_loss: 0.9118, test_f1: 0.5699
 epoch: 87, train_loss: 0.7435, test_loss: 0.9145, test_f1: 0.5771
 epoch: 88, train_loss: 0.7319, test_loss: 0.8998, test_f1: 0.5701
 epoch: 89, train_loss: 0.7281, test_loss: 0.9076, test_f1: 0.5704
 epoch: 90, train_loss: 0.7339, test_loss: 0.9198, test_f1: 0.5671
 epoch: 91, train_loss: 0.7319, test_loss: 0.9089, test_f1: 0.5605
 epoch: 92, train_loss: 0.7264, test_loss: 0.9160, test_f1: 0.5693
 epoch: 93, train_loss: 0.7284, test_loss: 0.9053, test_f1: 0.5828
 epoch: 94, train_loss: 0.7314, test_loss: 0.9114, test_f1: 0.5724
 epoch: 95, train_loss: 0.7263, test_loss: 0.9185, test_f1: 0.5742
 epoch: 96, train_loss: 0.7339, test_loss: 0.9156, test_f1: 0.5643
 epoch: 97, train_loss: 0.7194, test_loss: 0.9314, test_f1: 0.5674
 epoch: 98, train_loss: 0.7205, test_loss: 0.9143, test_f1: 0.5747
 epoch: 99, train_loss: 0.7223, test_loss: 0.9259, test_f1: 0.5723
##################ITERATION #4 ****************************************
 epoch: 0, train_loss: 1.2771, test_loss: 1.3374, test_f1: 0.3201
 epoch: 1, train_loss: 1.1905, test_loss: 1.2049, test_f1: 0.3390
 epoch: 2, train_loss: 1.1557, test_loss: 1.1160, test_f1: 0.4252
 epoch: 3, train_loss: 1.1343, test_loss: 1.0702, test_f1: 0.4394
 epoch: 4, train_loss: 1.1062, test_loss: 1.0430, test_f1: 0.4535
 epoch: 5, train_loss: 1.0793, test_loss: 1.0194, test_f1: 0.4606
 epoch: 6, train_loss: 1.0539, test_loss: 0.9986, test_f1: 0.4653
 epoch: 7, train_loss: 1.0420, test_loss: 0.9792, test_f1: 0.4848
 epoch: 8, train_loss: 1.0275, test_loss: 0.9675, test_f1: 0.4939
 epoch: 9, train_loss: 1.0121, test_loss: 0.9541, test_f1: 0.4934
 epoch: 10, train_loss: 0.9935, test_loss: 0.9432, test_f1: 0.5030
 epoch: 11, train_loss: 0.9859, test_loss: 0.9344, test_f1: 0.5084
 epoch: 12, train_loss: 0.9805, test_loss: 0.9233, test_f1: 0.5011
 epoch: 13, train_loss: 0.9653, test_loss: 0.9226, test_f1: 0.5031
 epoch: 14, train_loss: 0.9481, test_loss: 0.9190, test_f1: 0.5211
 epoch: 15, train_loss: 0.9471, test_loss: 0.9180, test_f1: 0.5240
 epoch: 16, train_loss: 0.9354, test_loss: 0.9048, test_f1: 0.5196
 epoch: 17, train_loss: 0.9355, test_loss: 0.9028, test_f1: 0.5402
 epoch: 18, train_loss: 0.9234, test_loss: 0.9025, test_f1: 0.5331
 epoch: 19, train_loss: 0.9224, test_loss: 0.8995, test_f1: 0.5342
 epoch: 20, train_loss: 0.9116, test_loss: 0.9059, test_f1: 0.5283
 epoch: 21, train_loss: 0.8951, test_loss: 0.9017, test_f1: 0.5440
 epoch: 22, train_loss: 0.8933, test_loss: 0.9028, test_f1: 0.5321
 epoch: 23, train_loss: 0.8989, test_loss: 0.8911, test_f1: 0.5340
 epoch: 24, train_loss: 0.8871, test_loss: 0.8827, test_f1: 0.5434
 epoch: 25, train_loss: 0.8933, test_loss: 0.9030, test_f1: 0.5409
 epoch: 26, train_loss: 0.8759, test_loss: 0.9015, test_f1: 0.5428
 epoch: 27, train_loss: 0.8728, test_loss: 0.8945, test_f1: 0.5381
 epoch: 28, train_loss: 0.8740, test_loss: 0.8915, test_f1: 0.5355
 epoch: 29, train_loss: 0.8599, test_loss: 0.9022, test_f1: 0.5421
 epoch: 30, train_loss: 0.8524, test_loss: 0.9031, test_f1: 0.5349
 epoch: 31, train_loss: 0.8604, test_loss: 0.8952, test_f1: 0.5468
 epoch: 32, train_loss: 0.8486, test_loss: 0.9066, test_f1: 0.5222
 epoch: 33, train_loss: 0.8420, test_loss: 0.9015, test_f1: 0.5491
 epoch: 34, train_loss: 0.8422, test_loss: 0.9059, test_f1: 0.5407
 epoch: 35, train_loss: 0.8384, test_loss: 0.9051, test_f1: 0.5433
 epoch: 36, train_loss: 0.8369, test_loss: 0.8945, test_f1: 0.5360
 epoch: 37, train_loss: 0.8388, test_loss: 0.9048, test_f1: 0.5372
 epoch: 38, train_loss: 0.8324, test_loss: 0.9216, test_f1: 0.5286
 epoch: 39, train_loss: 0.8224, test_loss: 0.8924, test_f1: 0.5378
 epoch: 40, train_loss: 0.8288, test_loss: 0.9104, test_f1: 0.5358
 epoch: 41, train_loss: 0.8162, test_loss: 0.9145, test_f1: 0.5363
 epoch: 42, train_loss: 0.8147, test_loss: 0.9070, test_f1: 0.5431
 epoch: 43, train_loss: 0.8080, test_loss: 0.9136, test_f1: 0.5501
 epoch: 44, train_loss: 0.8095, test_loss: 0.9092, test_f1: 0.5529
 epoch: 45, train_loss: 0.8122, test_loss: 0.9108, test_f1: 0.5444
 epoch: 46, train_loss: 0.8070, test_loss: 0.9225, test_f1: 0.5471
 epoch: 47, train_loss: 0.7972, test_loss: 0.9057, test_f1: 0.5348
 epoch: 48, train_loss: 0.7987, test_loss: 0.9036, test_f1: 0.5414
 epoch: 49, train_loss: 0.7926, test_loss: 0.9163, test_f1: 0.5371
 epoch: 50, train_loss: 0.7976, test_loss: 0.9139, test_f1: 0.5451
 epoch: 51, train_loss: 0.7871, test_loss: 0.9213, test_f1: 0.5488
 epoch: 52, train_loss: 0.7765, test_loss: 0.9153, test_f1: 0.5447
 epoch: 53, train_loss: 0.7709, test_loss: 0.9127, test_f1: 0.5424
 epoch: 54, train_loss: 0.7796, test_loss: 0.9094, test_f1: 0.5378
 epoch: 55, train_loss: 0.7685, test_loss: 0.9071, test_f1: 0.5497
 epoch: 56, train_loss: 0.7714, test_loss: 0.9119, test_f1: 0.5690
 epoch: 57, train_loss: 0.7595, test_loss: 0.9115, test_f1: 0.5754
 epoch: 58, train_loss: 0.7660, test_loss: 0.9203, test_f1: 0.5643
 epoch: 59, train_loss: 0.7672, test_loss: 0.9199, test_f1: 0.5498
 epoch: 60, train_loss: 0.7613, test_loss: 0.9117, test_f1: 0.5615
 epoch: 61, train_loss: 0.7694, test_loss: 0.9232, test_f1: 0.5532
 epoch: 62, train_loss: 0.7609, test_loss: 0.9178, test_f1: 0.5524
 epoch: 63, train_loss: 0.7675, test_loss: 0.9262, test_f1: 0.5533
 epoch: 64, train_loss: 0.7527, test_loss: 0.9175, test_f1: 0.5742
 epoch: 65, train_loss: 0.7618, test_loss: 0.9327, test_f1: 0.5585
 epoch: 66, train_loss: 0.7552, test_loss: 0.9249, test_f1: 0.5623
 epoch: 67, train_loss: 0.7544, test_loss: 0.9236, test_f1: 0.5425
 epoch: 68, train_loss: 0.7528, test_loss: 0.9320, test_f1: 0.5580
 epoch: 69, train_loss: 0.7526, test_loss: 0.9276, test_f1: 0.5484
 epoch: 70, train_loss: 0.7538, test_loss: 0.9352, test_f1: 0.5413
 epoch: 71, train_loss: 0.7559, test_loss: 0.9303, test_f1: 0.5564
 epoch: 72, train_loss: 0.7560, test_loss: 0.9311, test_f1: 0.5547
 epoch: 73, train_loss: 0.7468, test_loss: 0.9271, test_f1: 0.5792
 epoch: 74, train_loss: 0.7480, test_loss: 0.9353, test_f1: 0.5647
 epoch: 75, train_loss: 0.7341, test_loss: 0.9453, test_f1: 0.5422
 epoch: 76, train_loss: 0.7402, test_loss: 0.9234, test_f1: 0.5710
 epoch: 77, train_loss: 0.7451, test_loss: 0.9223, test_f1: 0.5687
 epoch: 78, train_loss: 0.7404, test_loss: 0.9315, test_f1: 0.5680
 epoch: 79, train_loss: 0.7384, test_loss: 0.9353, test_f1: 0.5756
 epoch: 80, train_loss: 0.7445, test_loss: 0.9277, test_f1: 0.5794
 epoch: 81, train_loss: 0.7351, test_loss: 0.9328, test_f1: 0.5699
 epoch: 82, train_loss: 0.7333, test_loss: 0.9331, test_f1: 0.5605
 epoch: 83, train_loss: 0.7385, test_loss: 0.9219, test_f1: 0.5758
 epoch: 84, train_loss: 0.7303, test_loss: 0.9342, test_f1: 0.5676
 epoch: 85, train_loss: 0.7215, test_loss: 0.9234, test_f1: 0.5797
 epoch: 86, train_loss: 0.7418, test_loss: 0.9361, test_f1: 0.5620
 epoch: 87, train_loss: 0.7421, test_loss: 0.9283, test_f1: 0.5642
 epoch: 88, train_loss: 0.7369, test_loss: 0.9338, test_f1: 0.5807
 epoch: 89, train_loss: 0.7284, test_loss: 0.9293, test_f1: 0.5826
 epoch: 90, train_loss: 0.7281, test_loss: 0.9352, test_f1: 0.5783
 epoch: 91, train_loss: 0.7349, test_loss: 0.9323, test_f1: 0.5733
 epoch: 92, train_loss: 0.7251, test_loss: 0.9288, test_f1: 0.5787
 epoch: 93, train_loss: 0.7354, test_loss: 0.9404, test_f1: 0.5661
 epoch: 94, train_loss: 0.7261, test_loss: 0.9237, test_f1: 0.5666
 epoch: 95, train_loss: 0.7202, test_loss: 0.9346, test_f1: 0.5696
 epoch: 96, train_loss: 0.7218, test_loss: 0.9371, test_f1: 0.5869
 epoch: 97, train_loss: 0.7263, test_loss: 0.9319, test_f1: 0.5868
 epoch: 98, train_loss: 0.7177, test_loss: 0.9250, test_f1: 0.5863
 epoch: 99, train_loss: 0.7145, test_loss: 0.9271, test_f1: 0.5755
##################ITERATION #5 ****************************************
 epoch: 0, train_loss: 1.2619, test_loss: 1.3525, test_f1: 0.3257
 epoch: 1, train_loss: 1.1892, test_loss: 1.2285, test_f1: 0.3405
 epoch: 2, train_loss: 1.1613, test_loss: 1.1370, test_f1: 0.3887
 epoch: 3, train_loss: 1.1441, test_loss: 1.1023, test_f1: 0.4081
 epoch: 4, train_loss: 1.1161, test_loss: 1.0817, test_f1: 0.4252
 epoch: 5, train_loss: 1.1048, test_loss: 1.0520, test_f1: 0.4346
 epoch: 6, train_loss: 1.0797, test_loss: 1.0447, test_f1: 0.4371
 epoch: 7, train_loss: 1.0655, test_loss: 1.0126, test_f1: 0.4717
 epoch: 8, train_loss: 1.0438, test_loss: 1.0070, test_f1: 0.4499
 epoch: 9, train_loss: 1.0436, test_loss: 0.9935, test_f1: 0.4641
 epoch: 10, train_loss: 1.0250, test_loss: 0.9945, test_f1: 0.4687
 epoch: 11, train_loss: 1.0119, test_loss: 0.9740, test_f1: 0.4788
 epoch: 12, train_loss: 1.0094, test_loss: 0.9820, test_f1: 0.4744
 epoch: 13, train_loss: 0.9955, test_loss: 0.9716, test_f1: 0.4848
 epoch: 14, train_loss: 0.9770, test_loss: 0.9471, test_f1: 0.4942
 epoch: 15, train_loss: 0.9674, test_loss: 0.9603, test_f1: 0.4982
 epoch: 16, train_loss: 0.9600, test_loss: 0.9385, test_f1: 0.5005
 epoch: 17, train_loss: 0.9561, test_loss: 0.9344, test_f1: 0.5048
 epoch: 18, train_loss: 0.9393, test_loss: 0.9370, test_f1: 0.5100
 epoch: 19, train_loss: 0.9301, test_loss: 0.9281, test_f1: 0.5162
 epoch: 20, train_loss: 0.9309, test_loss: 0.9234, test_f1: 0.5265
 epoch: 21, train_loss: 0.9186, test_loss: 0.9348, test_f1: 0.5189
 epoch: 22, train_loss: 0.9182, test_loss: 0.9510, test_f1: 0.5077
 epoch: 23, train_loss: 0.9140, test_loss: 0.9391, test_f1: 0.5261
 epoch: 24, train_loss: 0.9084, test_loss: 0.9299, test_f1: 0.5260
 epoch: 25, train_loss: 0.9049, test_loss: 0.9224, test_f1: 0.5262
 epoch: 26, train_loss: 0.8982, test_loss: 0.9464, test_f1: 0.5270
 epoch: 27, train_loss: 0.8811, test_loss: 0.9296, test_f1: 0.5346
 epoch: 28, train_loss: 0.8824, test_loss: 0.9199, test_f1: 0.5423
 epoch: 29, train_loss: 0.8846, test_loss: 0.9387, test_f1: 0.5314
 epoch: 30, train_loss: 0.8760, test_loss: 0.9263, test_f1: 0.5382
 epoch: 31, train_loss: 0.8644, test_loss: 0.9428, test_f1: 0.5332
 epoch: 32, train_loss: 0.8610, test_loss: 0.9427, test_f1: 0.5387
 epoch: 33, train_loss: 0.8613, test_loss: 0.9305, test_f1: 0.5495
 epoch: 34, train_loss: 0.8705, test_loss: 0.9387, test_f1: 0.5356
 epoch: 35, train_loss: 0.8575, test_loss: 0.9252, test_f1: 0.5421
 epoch: 36, train_loss: 0.8466, test_loss: 0.9185, test_f1: 0.5424
 epoch: 37, train_loss: 0.8436, test_loss: 0.9381, test_f1: 0.5415
 epoch: 38, train_loss: 0.8337, test_loss: 0.9489, test_f1: 0.5424
 epoch: 39, train_loss: 0.8314, test_loss: 0.9400, test_f1: 0.5478
 epoch: 40, train_loss: 0.8307, test_loss: 0.9334, test_f1: 0.5391
 epoch: 41, train_loss: 0.8256, test_loss: 0.9392, test_f1: 0.5481
 epoch: 42, train_loss: 0.8276, test_loss: 0.9371, test_f1: 0.5553
 epoch: 43, train_loss: 0.8268, test_loss: 0.9449, test_f1: 0.5462
 epoch: 44, train_loss: 0.8147, test_loss: 0.9363, test_f1: 0.5645
 epoch: 45, train_loss: 0.8114, test_loss: 0.9417, test_f1: 0.5453
 epoch: 46, train_loss: 0.8134, test_loss: 0.9276, test_f1: 0.5663
 epoch: 47, train_loss: 0.8104, test_loss: 0.9377, test_f1: 0.5650
 epoch: 48, train_loss: 0.8108, test_loss: 0.9555, test_f1: 0.5443
 epoch: 49, train_loss: 0.8009, test_loss: 0.9534, test_f1: 0.5550
 epoch: 50, train_loss: 0.8062, test_loss: 0.9411, test_f1: 0.5621
 epoch: 51, train_loss: 0.7910, test_loss: 0.9555, test_f1: 0.5427
 epoch: 52, train_loss: 0.7927, test_loss: 0.9418, test_f1: 0.5416
 epoch: 53, train_loss: 0.7886, test_loss: 0.9432, test_f1: 0.5538
 epoch: 54, train_loss: 0.7784, test_loss: 0.9405, test_f1: 0.5586
 epoch: 55, train_loss: 0.7850, test_loss: 0.9493, test_f1: 0.5412
 epoch: 56, train_loss: 0.7882, test_loss: 0.9444, test_f1: 0.5432
 epoch: 57, train_loss: 0.7761, test_loss: 0.9595, test_f1: 0.5482
 epoch: 58, train_loss: 0.7870, test_loss: 0.9364, test_f1: 0.5524
 epoch: 59, train_loss: 0.7738, test_loss: 0.9536, test_f1: 0.5477
 epoch: 60, train_loss: 0.7755, test_loss: 0.9489, test_f1: 0.5532
 epoch: 61, train_loss: 0.7814, test_loss: 0.9355, test_f1: 0.5543
 epoch: 62, train_loss: 0.7772, test_loss: 0.9503, test_f1: 0.5698
 epoch: 63, train_loss: 0.7719, test_loss: 0.9573, test_f1: 0.5451
 epoch: 64, train_loss: 0.7715, test_loss: 0.9491, test_f1: 0.5666
 epoch: 65, train_loss: 0.7662, test_loss: 0.9543, test_f1: 0.5702
 epoch: 66, train_loss: 0.7752, test_loss: 0.9518, test_f1: 0.5644
 epoch: 67, train_loss: 0.7634, test_loss: 0.9621, test_f1: 0.5554
 epoch: 68, train_loss: 0.7615, test_loss: 0.9646, test_f1: 0.5546
 epoch: 69, train_loss: 0.7565, test_loss: 0.9587, test_f1: 0.5588
 epoch: 70, train_loss: 0.7713, test_loss: 0.9643, test_f1: 0.5611
 epoch: 71, train_loss: 0.7616, test_loss: 0.9720, test_f1: 0.5548
 epoch: 72, train_loss: 0.7554, test_loss: 0.9533, test_f1: 0.5589
 epoch: 73, train_loss: 0.7617, test_loss: 0.9584, test_f1: 0.5480
 epoch: 74, train_loss: 0.7461, test_loss: 0.9585, test_f1: 0.5519
 epoch: 75, train_loss: 0.7599, test_loss: 0.9663, test_f1: 0.5479
 epoch: 76, train_loss: 0.7624, test_loss: 0.9472, test_f1: 0.5649
 epoch: 77, train_loss: 0.7502, test_loss: 0.9581, test_f1: 0.5602
 epoch: 78, train_loss: 0.7623, test_loss: 0.9684, test_f1: 0.5534
 epoch: 79, train_loss: 0.7463, test_loss: 0.9488, test_f1: 0.5602
 epoch: 80, train_loss: 0.7626, test_loss: 0.9753, test_f1: 0.5568
 epoch: 81, train_loss: 0.7552, test_loss: 0.9528, test_f1: 0.5654
 epoch: 82, train_loss: 0.7429, test_loss: 0.9650, test_f1: 0.5564
 epoch: 83, train_loss: 0.7497, test_loss: 0.9725, test_f1: 0.5568
 epoch: 84, train_loss: 0.7517, test_loss: 0.9808, test_f1: 0.5565
 epoch: 85, train_loss: 0.7314, test_loss: 0.9637, test_f1: 0.5603
 epoch: 86, train_loss: 0.7354, test_loss: 0.9808, test_f1: 0.5567
 epoch: 87, train_loss: 0.7372, test_loss: 0.9730, test_f1: 0.5562
 epoch: 88, train_loss: 0.7522, test_loss: 0.9775, test_f1: 0.5551
 epoch: 89, train_loss: 0.7325, test_loss: 0.9828, test_f1: 0.5572
 epoch: 90, train_loss: 0.7336, test_loss: 0.9837, test_f1: 0.5500
 epoch: 91, train_loss: 0.7385, test_loss: 0.9614, test_f1: 0.5621
 epoch: 92, train_loss: 0.7262, test_loss: 0.9686, test_f1: 0.5604
 epoch: 93, train_loss: 0.7187, test_loss: 0.9780, test_f1: 0.5519
 epoch: 94, train_loss: 0.7195, test_loss: 0.9804, test_f1: 0.5525
 epoch: 95, train_loss: 0.7283, test_loss: 0.9773, test_f1: 0.5598
 epoch: 96, train_loss: 0.7193, test_loss: 0.9777, test_f1: 0.5577
 epoch: 97, train_loss: 0.7268, test_loss: 0.9762, test_f1: 0.5594
 epoch: 98, train_loss: 0.7224, test_loss: 0.9706, test_f1: 0.5593
 epoch: 99, train_loss: 0.7246, test_loss: 0.9697, test_f1: 0.5643
##################ITERATION #6 ****************************************
 epoch: 0, train_loss: 1.3162, test_loss: 1.3503, test_f1: 0.2684
 epoch: 1, train_loss: 1.2087, test_loss: 1.2271, test_f1: 0.2897
 epoch: 2, train_loss: 1.1698, test_loss: 1.1273, test_f1: 0.4149
 epoch: 3, train_loss: 1.1370, test_loss: 1.0706, test_f1: 0.4579
 epoch: 4, train_loss: 1.1073, test_loss: 1.0380, test_f1: 0.4850
 epoch: 5, train_loss: 1.0857, test_loss: 1.0268, test_f1: 0.4814
 epoch: 6, train_loss: 1.0603, test_loss: 0.9942, test_f1: 0.4843
 epoch: 7, train_loss: 1.0421, test_loss: 0.9735, test_f1: 0.5061
 epoch: 8, train_loss: 1.0417, test_loss: 0.9773, test_f1: 0.5069
 epoch: 9, train_loss: 1.0174, test_loss: 0.9536, test_f1: 0.5096
 epoch: 10, train_loss: 1.0024, test_loss: 0.9478, test_f1: 0.5192
 epoch: 11, train_loss: 0.9996, test_loss: 0.9456, test_f1: 0.5238
 epoch: 12, train_loss: 0.9802, test_loss: 0.9304, test_f1: 0.5213
 epoch: 13, train_loss: 0.9806, test_loss: 0.9286, test_f1: 0.5513
 epoch: 14, train_loss: 0.9640, test_loss: 0.9105, test_f1: 0.5315
 epoch: 15, train_loss: 0.9517, test_loss: 0.9323, test_f1: 0.5198
 epoch: 16, train_loss: 0.9573, test_loss: 0.9224, test_f1: 0.5195
 epoch: 17, train_loss: 0.9347, test_loss: 0.9075, test_f1: 0.5225
 epoch: 18, train_loss: 0.9260, test_loss: 0.9132, test_f1: 0.5214
 epoch: 19, train_loss: 0.9144, test_loss: 0.9182, test_f1: 0.5130
 epoch: 20, train_loss: 0.9102, test_loss: 0.9110, test_f1: 0.5319
 epoch: 21, train_loss: 0.9137, test_loss: 0.9082, test_f1: 0.5228
 epoch: 22, train_loss: 0.9004, test_loss: 0.9023, test_f1: 0.5335
 epoch: 23, train_loss: 0.9041, test_loss: 0.9256, test_f1: 0.5231
 epoch: 24, train_loss: 0.8972, test_loss: 0.9173, test_f1: 0.5443
 epoch: 25, train_loss: 0.8954, test_loss: 0.9087, test_f1: 0.5329
 epoch: 26, train_loss: 0.8845, test_loss: 0.9077, test_f1: 0.5577
 epoch: 27, train_loss: 0.8798, test_loss: 0.9213, test_f1: 0.5272
 epoch: 28, train_loss: 0.8824, test_loss: 0.9035, test_f1: 0.5259
 epoch: 29, train_loss: 0.8741, test_loss: 0.9192, test_f1: 0.5318
 epoch: 30, train_loss: 0.8629, test_loss: 0.9096, test_f1: 0.5452
 epoch: 31, train_loss: 0.8639, test_loss: 0.9043, test_f1: 0.5430
 epoch: 32, train_loss: 0.8608, test_loss: 0.9026, test_f1: 0.5386
 epoch: 33, train_loss: 0.8595, test_loss: 0.9271, test_f1: 0.5235
 epoch: 34, train_loss: 0.8561, test_loss: 0.9364, test_f1: 0.5451
 epoch: 35, train_loss: 0.8443, test_loss: 0.9095, test_f1: 0.5573
 epoch: 36, train_loss: 0.8512, test_loss: 0.9048, test_f1: 0.5203
 epoch: 37, train_loss: 0.8545, test_loss: 0.9139, test_f1: 0.5279
 epoch: 38, train_loss: 0.8396, test_loss: 0.9212, test_f1: 0.5324
 epoch: 39, train_loss: 0.8339, test_loss: 0.9201, test_f1: 0.5414
 epoch: 40, train_loss: 0.8307, test_loss: 0.9293, test_f1: 0.5353
 epoch: 41, train_loss: 0.8302, test_loss: 0.9072, test_f1: 0.5354
 epoch: 42, train_loss: 0.8257, test_loss: 0.9199, test_f1: 0.5425
 epoch: 43, train_loss: 0.8275, test_loss: 0.9359, test_f1: 0.5460
 epoch: 44, train_loss: 0.8152, test_loss: 0.9142, test_f1: 0.5345
 epoch: 45, train_loss: 0.8280, test_loss: 0.9140, test_f1: 0.5329
 epoch: 46, train_loss: 0.8125, test_loss: 0.9012, test_f1: 0.5338
 epoch: 47, train_loss: 0.8194, test_loss: 0.9158, test_f1: 0.5486
 epoch: 48, train_loss: 0.8074, test_loss: 0.9268, test_f1: 0.5430
 epoch: 49, train_loss: 0.7986, test_loss: 0.9303, test_f1: 0.5541
 epoch: 50, train_loss: 0.8053, test_loss: 0.9223, test_f1: 0.5380
 epoch: 51, train_loss: 0.7932, test_loss: 0.9175, test_f1: 0.5547
 epoch: 52, train_loss: 0.8018, test_loss: 0.9332, test_f1: 0.5564
 epoch: 53, train_loss: 0.7927, test_loss: 0.9365, test_f1: 0.5464
 epoch: 54, train_loss: 0.7876, test_loss: 0.9226, test_f1: 0.5634
 epoch: 55, train_loss: 0.7923, test_loss: 0.9243, test_f1: 0.5650
 epoch: 56, train_loss: 0.7822, test_loss: 0.9028, test_f1: 0.5513
 epoch: 57, train_loss: 0.7877, test_loss: 0.9373, test_f1: 0.5608
 epoch: 58, train_loss: 0.7907, test_loss: 0.9330, test_f1: 0.5629
 epoch: 59, train_loss: 0.7737, test_loss: 0.9229, test_f1: 0.5668
 epoch: 60, train_loss: 0.7925, test_loss: 0.9276, test_f1: 0.5589
 epoch: 61, train_loss: 0.7780, test_loss: 0.9171, test_f1: 0.5670
 epoch: 62, train_loss: 0.7836, test_loss: 0.9333, test_f1: 0.5601
 epoch: 63, train_loss: 0.7794, test_loss: 0.9218, test_f1: 0.5678
 epoch: 64, train_loss: 0.7789, test_loss: 0.9207, test_f1: 0.5661
 epoch: 65, train_loss: 0.7753, test_loss: 0.9199, test_f1: 0.5665
 epoch: 66, train_loss: 0.7713, test_loss: 0.9274, test_f1: 0.5557
 epoch: 67, train_loss: 0.7661, test_loss: 0.9218, test_f1: 0.5673
 epoch: 68, train_loss: 0.7710, test_loss: 0.9265, test_f1: 0.5684
 epoch: 69, train_loss: 0.7722, test_loss: 0.9328, test_f1: 0.5744
 epoch: 70, train_loss: 0.7675, test_loss: 0.9224, test_f1: 0.5662
 epoch: 71, train_loss: 0.7694, test_loss: 0.9355, test_f1: 0.5735
 epoch: 72, train_loss: 0.7538, test_loss: 0.9255, test_f1: 0.5715
 epoch: 73, train_loss: 0.7618, test_loss: 0.9289, test_f1: 0.5702
 epoch: 74, train_loss: 0.7566, test_loss: 0.9342, test_f1: 0.5643
 epoch: 75, train_loss: 0.7657, test_loss: 0.9257, test_f1: 0.5790
 epoch: 76, train_loss: 0.7565, test_loss: 0.9378, test_f1: 0.5727
 epoch: 77, train_loss: 0.7619, test_loss: 0.9375, test_f1: 0.5819
 epoch: 78, train_loss: 0.7578, test_loss: 0.9451, test_f1: 0.5561
 epoch: 79, train_loss: 0.7663, test_loss: 0.9411, test_f1: 0.5708
 epoch: 80, train_loss: 0.7475, test_loss: 0.9324, test_f1: 0.5730
 epoch: 81, train_loss: 0.7578, test_loss: 0.9434, test_f1: 0.5694
 epoch: 82, train_loss: 0.7562, test_loss: 0.9463, test_f1: 0.5688
 epoch: 83, train_loss: 0.7545, test_loss: 0.9494, test_f1: 0.5650
 epoch: 84, train_loss: 0.7533, test_loss: 0.9636, test_f1: 0.5661
 epoch: 85, train_loss: 0.7494, test_loss: 0.9378, test_f1: 0.5800
 epoch: 86, train_loss: 0.7510, test_loss: 0.9430, test_f1: 0.5903
 epoch: 87, train_loss: 0.7543, test_loss: 0.9433, test_f1: 0.5836
 epoch: 88, train_loss: 0.7427, test_loss: 0.9456, test_f1: 0.5699
 epoch: 89, train_loss: 0.7510, test_loss: 0.9575, test_f1: 0.5907
 epoch: 90, train_loss: 0.7339, test_loss: 0.9627, test_f1: 0.5809
 epoch: 91, train_loss: 0.7389, test_loss: 0.9473, test_f1: 0.5747
 epoch: 92, train_loss: 0.7397, test_loss: 0.9531, test_f1: 0.5892
 epoch: 93, train_loss: 0.7305, test_loss: 0.9547, test_f1: 0.5860
 epoch: 94, train_loss: 0.7397, test_loss: 0.9574, test_f1: 0.5843
 epoch: 95, train_loss: 0.7478, test_loss: 0.9621, test_f1: 0.6015
 epoch: 96, train_loss: 0.7314, test_loss: 0.9476, test_f1: 0.6011
 epoch: 97, train_loss: 0.7373, test_loss: 0.9688, test_f1: 0.5829
 epoch: 98, train_loss: 0.7355, test_loss: 0.9640, test_f1: 0.5849
 epoch: 99, train_loss: 0.7258, test_loss: 0.9561, test_f1: 0.5918
##################ITERATION #7 ****************************************
 epoch: 0, train_loss: 1.2848, test_loss: 1.2956, test_f1: 0.2527
 epoch: 1, train_loss: 1.1798, test_loss: 1.1962, test_f1: 0.3554
 epoch: 2, train_loss: 1.1463, test_loss: 1.1003, test_f1: 0.4217
 epoch: 3, train_loss: 1.1278, test_loss: 1.0475, test_f1: 0.4530
 epoch: 4, train_loss: 1.0892, test_loss: 1.0365, test_f1: 0.4653
 epoch: 5, train_loss: 1.0737, test_loss: 1.0127, test_f1: 0.4844
 epoch: 6, train_loss: 1.0533, test_loss: 0.9911, test_f1: 0.4846
 epoch: 7, train_loss: 1.0334, test_loss: 0.9776, test_f1: 0.4897
 epoch: 8, train_loss: 1.0217, test_loss: 0.9659, test_f1: 0.4835
 epoch: 9, train_loss: 1.0118, test_loss: 0.9539, test_f1: 0.4820
 epoch: 10, train_loss: 1.0023, test_loss: 0.9383, test_f1: 0.4926
 epoch: 11, train_loss: 0.9876, test_loss: 0.9255, test_f1: 0.5131
 epoch: 12, train_loss: 0.9790, test_loss: 0.9245, test_f1: 0.5078
 epoch: 13, train_loss: 0.9672, test_loss: 0.9151, test_f1: 0.5085
 epoch: 14, train_loss: 0.9647, test_loss: 0.9099, test_f1: 0.5233
 epoch: 15, train_loss: 0.9463, test_loss: 0.9170, test_f1: 0.5143
 epoch: 16, train_loss: 0.9345, test_loss: 0.8946, test_f1: 0.5294
 epoch: 17, train_loss: 0.9282, test_loss: 0.9029, test_f1: 0.5223
 epoch: 18, train_loss: 0.9330, test_loss: 0.8878, test_f1: 0.5318
 epoch: 19, train_loss: 0.9243, test_loss: 0.8881, test_f1: 0.5410
 epoch: 20, train_loss: 0.9070, test_loss: 0.8948, test_f1: 0.5519
 epoch: 21, train_loss: 0.9138, test_loss: 0.8834, test_f1: 0.5367
 epoch: 22, train_loss: 0.9090, test_loss: 0.8851, test_f1: 0.5316
 epoch: 23, train_loss: 0.8851, test_loss: 0.9028, test_f1: 0.5333
 epoch: 24, train_loss: 0.8894, test_loss: 0.8734, test_f1: 0.5353
 epoch: 25, train_loss: 0.8794, test_loss: 0.8778, test_f1: 0.5350
 epoch: 26, train_loss: 0.8863, test_loss: 0.8833, test_f1: 0.5345
 epoch: 27, train_loss: 0.8714, test_loss: 0.8719, test_f1: 0.5502
 epoch: 28, train_loss: 0.8650, test_loss: 0.8834, test_f1: 0.5595
 epoch: 29, train_loss: 0.8561, test_loss: 0.8930, test_f1: 0.5562
 epoch: 30, train_loss: 0.8614, test_loss: 0.8698, test_f1: 0.5615
 epoch: 31, train_loss: 0.8572, test_loss: 0.8789, test_f1: 0.5481
 epoch: 32, train_loss: 0.8523, test_loss: 0.8627, test_f1: 0.5544
 epoch: 33, train_loss: 0.8408, test_loss: 0.8747, test_f1: 0.5468
 epoch: 34, train_loss: 0.8382, test_loss: 0.8637, test_f1: 0.5728
 epoch: 35, train_loss: 0.8352, test_loss: 0.8685, test_f1: 0.5605
 epoch: 36, train_loss: 0.8314, test_loss: 0.8917, test_f1: 0.5503
 epoch: 37, train_loss: 0.8299, test_loss: 0.8697, test_f1: 0.5616
 epoch: 38, train_loss: 0.8249, test_loss: 0.8793, test_f1: 0.5616
 epoch: 39, train_loss: 0.8182, test_loss: 0.8621, test_f1: 0.5699
 epoch: 40, train_loss: 0.8249, test_loss: 0.8524, test_f1: 0.5654
 epoch: 41, train_loss: 0.8189, test_loss: 0.8817, test_f1: 0.5591
 epoch: 42, train_loss: 0.8121, test_loss: 0.8670, test_f1: 0.5844
 epoch: 43, train_loss: 0.8004, test_loss: 0.8979, test_f1: 0.5671
 epoch: 44, train_loss: 0.8101, test_loss: 0.8771, test_f1: 0.5715
 epoch: 45, train_loss: 0.7975, test_loss: 0.8903, test_f1: 0.5692
 epoch: 46, train_loss: 0.7895, test_loss: 0.8761, test_f1: 0.5730
 epoch: 47, train_loss: 0.7911, test_loss: 0.8868, test_f1: 0.5803
 epoch: 48, train_loss: 0.7855, test_loss: 0.8968, test_f1: 0.5700
 epoch: 49, train_loss: 0.7800, test_loss: 0.8848, test_f1: 0.5755
 epoch: 50, train_loss: 0.7722, test_loss: 0.8768, test_f1: 0.5959
 epoch: 51, train_loss: 0.7640, test_loss: 0.8668, test_f1: 0.5922
 epoch: 52, train_loss: 0.7662, test_loss: 0.8711, test_f1: 0.5999
 epoch: 53, train_loss: 0.7660, test_loss: 0.8726, test_f1: 0.5945
 epoch: 54, train_loss: 0.7747, test_loss: 0.8755, test_f1: 0.5939
 epoch: 55, train_loss: 0.7622, test_loss: 0.8789, test_f1: 0.5962
 epoch: 56, train_loss: 0.7538, test_loss: 0.8947, test_f1: 0.5961
 epoch: 57, train_loss: 0.7554, test_loss: 0.8880, test_f1: 0.6009
 epoch: 58, train_loss: 0.7533, test_loss: 0.8971, test_f1: 0.6004
 epoch: 59, train_loss: 0.7639, test_loss: 0.8851, test_f1: 0.5934
 epoch: 60, train_loss: 0.7481, test_loss: 0.8836, test_f1: 0.5865
 epoch: 61, train_loss: 0.7545, test_loss: 0.8908, test_f1: 0.5948
 epoch: 62, train_loss: 0.7459, test_loss: 0.8803, test_f1: 0.6009
 epoch: 63, train_loss: 0.7554, test_loss: 0.8856, test_f1: 0.5961
 epoch: 64, train_loss: 0.7497, test_loss: 0.8913, test_f1: 0.5917
 epoch: 65, train_loss: 0.7497, test_loss: 0.8721, test_f1: 0.5943
 epoch: 66, train_loss: 0.7391, test_loss: 0.8879, test_f1: 0.5914
 epoch: 67, train_loss: 0.7472, test_loss: 0.8739, test_f1: 0.6046
 epoch: 68, train_loss: 0.7444, test_loss: 0.8771, test_f1: 0.6050
 epoch: 69, train_loss: 0.7341, test_loss: 0.8693, test_f1: 0.6015
 epoch: 70, train_loss: 0.7365, test_loss: 0.8801, test_f1: 0.6073
 epoch: 71, train_loss: 0.7372, test_loss: 0.8824, test_f1: 0.5988
 epoch: 72, train_loss: 0.7282, test_loss: 0.8835, test_f1: 0.6060
 epoch: 73, train_loss: 0.7346, test_loss: 0.8873, test_f1: 0.6087
 epoch: 74, train_loss: 0.7342, test_loss: 0.8831, test_f1: 0.6046
 epoch: 75, train_loss: 0.7374, test_loss: 0.8881, test_f1: 0.6032
 epoch: 76, train_loss: 0.7306, test_loss: 0.8853, test_f1: 0.6050
 epoch: 77, train_loss: 0.7196, test_loss: 0.8952, test_f1: 0.6046
 epoch: 78, train_loss: 0.7279, test_loss: 0.8877, test_f1: 0.6058
 epoch: 79, train_loss: 0.7255, test_loss: 0.8883, test_f1: 0.6067
 epoch: 80, train_loss: 0.7199, test_loss: 0.9001, test_f1: 0.6158
 epoch: 81, train_loss: 0.7224, test_loss: 0.9042, test_f1: 0.5981
 epoch: 82, train_loss: 0.7296, test_loss: 0.8872, test_f1: 0.6169
 epoch: 83, train_loss: 0.7242, test_loss: 0.8939, test_f1: 0.6127
 epoch: 84, train_loss: 0.7170, test_loss: 0.8861, test_f1: 0.6079
 epoch: 85, train_loss: 0.7165, test_loss: 0.8934, test_f1: 0.6139
 epoch: 86, train_loss: 0.7178, test_loss: 0.8992, test_f1: 0.6086
 epoch: 87, train_loss: 0.7129, test_loss: 0.8876, test_f1: 0.6130
 epoch: 88, train_loss: 0.7012, test_loss: 0.8946, test_f1: 0.6163
 epoch: 89, train_loss: 0.7170, test_loss: 0.8885, test_f1: 0.6226
 epoch: 90, train_loss: 0.7124, test_loss: 0.8973, test_f1: 0.6157
 epoch: 91, train_loss: 0.7028, test_loss: 0.8968, test_f1: 0.6157
 epoch: 92, train_loss: 0.7043, test_loss: 0.8952, test_f1: 0.6231
 epoch: 93, train_loss: 0.7117, test_loss: 0.8911, test_f1: 0.6232
 epoch: 94, train_loss: 0.6943, test_loss: 0.8919, test_f1: 0.6083
 epoch: 95, train_loss: 0.6981, test_loss: 0.8792, test_f1: 0.6200
 epoch: 96, train_loss: 0.7039, test_loss: 0.8954, test_f1: 0.6186
 epoch: 97, train_loss: 0.7189, test_loss: 0.8881, test_f1: 0.6251
 epoch: 98, train_loss: 0.6988, test_loss: 0.8894, test_f1: 0.6157
 epoch: 99, train_loss: 0.7092, test_loss: 0.9085, test_f1: 0.6096
##################ITERATION #8 ****************************************
 epoch: 0, train_loss: 1.3072, test_loss: 1.3213, test_f1: 0.2270
 epoch: 1, train_loss: 1.1891, test_loss: 1.1728, test_f1: 0.3611
 epoch: 2, train_loss: 1.1447, test_loss: 1.0517, test_f1: 0.4867
 epoch: 3, train_loss: 1.1113, test_loss: 1.0150, test_f1: 0.5035
 epoch: 4, train_loss: 1.0920, test_loss: 1.0014, test_f1: 0.5064
 epoch: 5, train_loss: 1.0714, test_loss: 0.9819, test_f1: 0.5103
 epoch: 6, train_loss: 1.0593, test_loss: 0.9705, test_f1: 0.5100
 epoch: 7, train_loss: 1.0468, test_loss: 0.9749, test_f1: 0.5112
 epoch: 8, train_loss: 1.0287, test_loss: 0.9619, test_f1: 0.5138
 epoch: 9, train_loss: 1.0163, test_loss: 0.9489, test_f1: 0.5191
 epoch: 10, train_loss: 1.0020, test_loss: 0.9529, test_f1: 0.5000
 epoch: 11, train_loss: 1.0001, test_loss: 0.9485, test_f1: 0.5030
 epoch: 12, train_loss: 0.9900, test_loss: 0.9439, test_f1: 0.5305
 epoch: 13, train_loss: 0.9805, test_loss: 0.9544, test_f1: 0.5311
 epoch: 14, train_loss: 0.9763, test_loss: 0.9456, test_f1: 0.5213
 epoch: 15, train_loss: 0.9694, test_loss: 0.9311, test_f1: 0.5268
 epoch: 16, train_loss: 0.9559, test_loss: 0.9369, test_f1: 0.5334
 epoch: 17, train_loss: 0.9600, test_loss: 0.9402, test_f1: 0.5211
 epoch: 18, train_loss: 0.9472, test_loss: 0.9340, test_f1: 0.5212
 epoch: 19, train_loss: 0.9452, test_loss: 0.9387, test_f1: 0.5405
 epoch: 20, train_loss: 0.9327, test_loss: 0.9296, test_f1: 0.5353
 epoch: 21, train_loss: 0.9275, test_loss: 0.9314, test_f1: 0.5330
 epoch: 22, train_loss: 0.9227, test_loss: 0.9266, test_f1: 0.5445
 epoch: 23, train_loss: 0.9193, test_loss: 0.9223, test_f1: 0.5322
 epoch: 24, train_loss: 0.9189, test_loss: 0.9233, test_f1: 0.5473
 epoch: 25, train_loss: 0.9002, test_loss: 0.9214, test_f1: 0.5421
 epoch: 26, train_loss: 0.9106, test_loss: 0.9342, test_f1: 0.5595
 epoch: 27, train_loss: 0.8949, test_loss: 0.9209, test_f1: 0.5472
 epoch: 28, train_loss: 0.8959, test_loss: 0.9320, test_f1: 0.5508
 epoch: 29, train_loss: 0.8917, test_loss: 0.9271, test_f1: 0.5708
 epoch: 30, train_loss: 0.8942, test_loss: 0.9231, test_f1: 0.5529
 epoch: 31, train_loss: 0.8874, test_loss: 0.9313, test_f1: 0.5526
 epoch: 32, train_loss: 0.8778, test_loss: 0.9275, test_f1: 0.5447
 epoch: 33, train_loss: 0.8734, test_loss: 0.9272, test_f1: 0.5568
 epoch: 34, train_loss: 0.8750, test_loss: 0.9321, test_f1: 0.5732
 epoch: 35, train_loss: 0.8666, test_loss: 0.9234, test_f1: 0.5769
 epoch: 36, train_loss: 0.8591, test_loss: 0.9352, test_f1: 0.5696
 epoch: 37, train_loss: 0.8623, test_loss: 0.9314, test_f1: 0.5729
 epoch: 38, train_loss: 0.8574, test_loss: 0.9250, test_f1: 0.5599
 epoch: 39, train_loss: 0.8479, test_loss: 0.9223, test_f1: 0.5775
 epoch: 40, train_loss: 0.8676, test_loss: 0.9482, test_f1: 0.5462
 epoch: 41, train_loss: 0.8446, test_loss: 0.9208, test_f1: 0.5749
 epoch: 42, train_loss: 0.8426, test_loss: 0.9282, test_f1: 0.5805
 epoch: 43, train_loss: 0.8339, test_loss: 0.9532, test_f1: 0.5531
 epoch: 44, train_loss: 0.8258, test_loss: 0.9320, test_f1: 0.5676
 epoch: 45, train_loss: 0.8297, test_loss: 0.9310, test_f1: 0.5689
 epoch: 46, train_loss: 0.8271, test_loss: 0.9353, test_f1: 0.5851
 epoch: 47, train_loss: 0.8187, test_loss: 0.9322, test_f1: 0.5544
 epoch: 48, train_loss: 0.8358, test_loss: 0.9551, test_f1: 0.5521
 epoch: 49, train_loss: 0.8182, test_loss: 0.9276, test_f1: 0.5897
 epoch: 50, train_loss: 0.8189, test_loss: 0.9553, test_f1: 0.5667
 epoch: 51, train_loss: 0.8131, test_loss: 0.9428, test_f1: 0.5850
 epoch: 52, train_loss: 0.8110, test_loss: 0.9471, test_f1: 0.5753
 epoch: 53, train_loss: 0.8043, test_loss: 0.9482, test_f1: 0.5760
 epoch: 54, train_loss: 0.7971, test_loss: 0.9408, test_f1: 0.5694
 epoch: 55, train_loss: 0.8055, test_loss: 0.9527, test_f1: 0.5681
 epoch: 56, train_loss: 0.7961, test_loss: 0.9414, test_f1: 0.5786
 epoch: 57, train_loss: 0.7936, test_loss: 0.9478, test_f1: 0.5776
 epoch: 58, train_loss: 0.7898, test_loss: 0.9400, test_f1: 0.5678
 epoch: 59, train_loss: 0.8002, test_loss: 0.9497, test_f1: 0.5717
 epoch: 60, train_loss: 0.7988, test_loss: 0.9481, test_f1: 0.5902
 epoch: 61, train_loss: 0.7976, test_loss: 0.9440, test_f1: 0.5870
 epoch: 62, train_loss: 0.7740, test_loss: 0.9306, test_f1: 0.5751
 epoch: 63, train_loss: 0.8038, test_loss: 0.9398, test_f1: 0.5744
 epoch: 64, train_loss: 0.8051, test_loss: 0.9500, test_f1: 0.5743
 epoch: 65, train_loss: 0.7929, test_loss: 0.9408, test_f1: 0.5732
 epoch: 66, train_loss: 0.7945, test_loss: 0.9470, test_f1: 0.5722
 epoch: 67, train_loss: 0.7813, test_loss: 0.9541, test_f1: 0.5698
 epoch: 68, train_loss: 0.7917, test_loss: 0.9556, test_f1: 0.5655
 epoch: 69, train_loss: 0.7860, test_loss: 0.9562, test_f1: 0.5653
 epoch: 70, train_loss: 0.7884, test_loss: 0.9411, test_f1: 0.5726
 epoch: 71, train_loss: 0.7787, test_loss: 0.9527, test_f1: 0.5744
 epoch: 72, train_loss: 0.7787, test_loss: 0.9553, test_f1: 0.5740
 epoch: 73, train_loss: 0.7782, test_loss: 0.9560, test_f1: 0.5713
 epoch: 74, train_loss: 0.7798, test_loss: 0.9546, test_f1: 0.5758
 epoch: 75, train_loss: 0.7758, test_loss: 0.9581, test_f1: 0.5682
 epoch: 76, train_loss: 0.7787, test_loss: 0.9717, test_f1: 0.5750
 epoch: 77, train_loss: 0.7738, test_loss: 0.9639, test_f1: 0.5756
 epoch: 78, train_loss: 0.7721, test_loss: 0.9615, test_f1: 0.5774
 epoch: 79, train_loss: 0.7706, test_loss: 0.9672, test_f1: 0.5685
 epoch: 80, train_loss: 0.7728, test_loss: 0.9629, test_f1: 0.5835
 epoch: 81, train_loss: 0.7595, test_loss: 0.9528, test_f1: 0.5791
 epoch: 82, train_loss: 0.7734, test_loss: 0.9605, test_f1: 0.5783
 epoch: 83, train_loss: 0.7679, test_loss: 0.9779, test_f1: 0.5709
 epoch: 84, train_loss: 0.7756, test_loss: 0.9779, test_f1: 0.5671
 epoch: 85, train_loss: 0.7529, test_loss: 0.9726, test_f1: 0.5679
 epoch: 86, train_loss: 0.7627, test_loss: 0.9639, test_f1: 0.5732
 epoch: 87, train_loss: 0.7525, test_loss: 0.9623, test_f1: 0.5781
 epoch: 88, train_loss: 0.7500, test_loss: 0.9649, test_f1: 0.5727
 epoch: 89, train_loss: 0.7648, test_loss: 0.9868, test_f1: 0.5696
 epoch: 90, train_loss: 0.7589, test_loss: 0.9751, test_f1: 0.5808
 epoch: 91, train_loss: 0.7576, test_loss: 0.9749, test_f1: 0.5680
 epoch: 92, train_loss: 0.7513, test_loss: 0.9690, test_f1: 0.5628
 epoch: 93, train_loss: 0.7613, test_loss: 0.9873, test_f1: 0.5799
 epoch: 94, train_loss: 0.7573, test_loss: 0.9673, test_f1: 0.5734
 epoch: 95, train_loss: 0.7442, test_loss: 0.9702, test_f1: 0.5667
 epoch: 96, train_loss: 0.7530, test_loss: 0.9721, test_f1: 0.5669
 epoch: 97, train_loss: 0.7581, test_loss: 0.9769, test_f1: 0.5724
 epoch: 98, train_loss: 0.7508, test_loss: 0.9796, test_f1: 0.5860
 epoch: 99, train_loss: 0.7506, test_loss: 0.9824, test_f1: 0.5829
##################ITERATION #9 ****************************************
 epoch: 0, train_loss: 1.2935, test_loss: 1.3430, test_f1: 0.2843
 epoch: 1, train_loss: 1.1741, test_loss: 1.1541, test_f1: 0.4255
 epoch: 2, train_loss: 1.1449, test_loss: 1.0669, test_f1: 0.4633
 epoch: 3, train_loss: 1.1161, test_loss: 1.0325, test_f1: 0.4592
 epoch: 4, train_loss: 1.0847, test_loss: 1.0049, test_f1: 0.4692
 epoch: 5, train_loss: 1.0747, test_loss: 0.9961, test_f1: 0.4726
 epoch: 6, train_loss: 1.0543, test_loss: 0.9819, test_f1: 0.4780
 epoch: 7, train_loss: 1.0362, test_loss: 0.9747, test_f1: 0.4840
 epoch: 8, train_loss: 1.0128, test_loss: 0.9670, test_f1: 0.4823
 epoch: 9, train_loss: 1.0125, test_loss: 0.9616, test_f1: 0.4831
 epoch: 10, train_loss: 1.0045, test_loss: 0.9540, test_f1: 0.4880
 epoch: 11, train_loss: 0.9947, test_loss: 0.9494, test_f1: 0.4982
 epoch: 12, train_loss: 0.9769, test_loss: 0.9509, test_f1: 0.4931
 epoch: 13, train_loss: 0.9765, test_loss: 0.9482, test_f1: 0.4915
 epoch: 14, train_loss: 0.9610, test_loss: 0.9452, test_f1: 0.5214
 epoch: 15, train_loss: 0.9475, test_loss: 0.9557, test_f1: 0.4988
 epoch: 16, train_loss: 0.9426, test_loss: 0.9537, test_f1: 0.5009
 epoch: 17, train_loss: 0.9386, test_loss: 0.9417, test_f1: 0.5280
 epoch: 18, train_loss: 0.9303, test_loss: 0.9392, test_f1: 0.5198
 epoch: 19, train_loss: 0.9230, test_loss: 0.9500, test_f1: 0.5062
 epoch: 20, train_loss: 0.9237, test_loss: 0.9408, test_f1: 0.5339
 epoch: 21, train_loss: 0.9158, test_loss: 0.9415, test_f1: 0.5292
 epoch: 22, train_loss: 0.9085, test_loss: 0.9433, test_f1: 0.5374
 epoch: 23, train_loss: 0.8976, test_loss: 0.9435, test_f1: 0.5481
 epoch: 24, train_loss: 0.8986, test_loss: 0.9367, test_f1: 0.5555
 epoch: 25, train_loss: 0.8954, test_loss: 0.9423, test_f1: 0.5419
 epoch: 26, train_loss: 0.8909, test_loss: 0.9488, test_f1: 0.5499
 epoch: 27, train_loss: 0.8792, test_loss: 0.9343, test_f1: 0.5732
 epoch: 28, train_loss: 0.8791, test_loss: 0.9451, test_f1: 0.5278
 epoch: 29, train_loss: 0.8817, test_loss: 0.9419, test_f1: 0.5408
 epoch: 30, train_loss: 0.8733, test_loss: 0.9406, test_f1: 0.5515
 epoch: 31, train_loss: 0.8678, test_loss: 0.9364, test_f1: 0.5574
 epoch: 32, train_loss: 0.8705, test_loss: 0.9354, test_f1: 0.5696
 epoch: 33, train_loss: 0.8616, test_loss: 0.9441, test_f1: 0.5400
 epoch: 34, train_loss: 0.8492, test_loss: 0.9515, test_f1: 0.5581
 epoch: 35, train_loss: 0.8446, test_loss: 0.9360, test_f1: 0.5718
 epoch: 36, train_loss: 0.8429, test_loss: 0.9296, test_f1: 0.5721
 epoch: 37, train_loss: 0.8526, test_loss: 0.9405, test_f1: 0.5522
 epoch: 38, train_loss: 0.8376, test_loss: 0.9505, test_f1: 0.5597
 epoch: 39, train_loss: 0.8446, test_loss: 0.9460, test_f1: 0.5603
 epoch: 40, train_loss: 0.8393, test_loss: 0.9377, test_f1: 0.5625
 epoch: 41, train_loss: 0.8372, test_loss: 0.9572, test_f1: 0.5757
 epoch: 42, train_loss: 0.8335, test_loss: 0.9419, test_f1: 0.5798
 epoch: 43, train_loss: 0.8187, test_loss: 0.9564, test_f1: 0.5455
 epoch: 44, train_loss: 0.8134, test_loss: 0.9433, test_f1: 0.5571
 epoch: 45, train_loss: 0.8160, test_loss: 0.9407, test_f1: 0.5891
 epoch: 46, train_loss: 0.8203, test_loss: 0.9469, test_f1: 0.5850
 epoch: 47, train_loss: 0.8031, test_loss: 0.9417, test_f1: 0.5911
 epoch: 48, train_loss: 0.8166, test_loss: 0.9360, test_f1: 0.5790
 epoch: 49, train_loss: 0.8041, test_loss: 0.9668, test_f1: 0.5637
 epoch: 50, train_loss: 0.7971, test_loss: 0.9409, test_f1: 0.5753
 epoch: 51, train_loss: 0.7924, test_loss: 0.9354, test_f1: 0.5829
 epoch: 52, train_loss: 0.7912, test_loss: 0.9459, test_f1: 0.5736
 epoch: 53, train_loss: 0.7775, test_loss: 0.9446, test_f1: 0.5837
 epoch: 54, train_loss: 0.7922, test_loss: 0.9501, test_f1: 0.5660
 epoch: 55, train_loss: 0.7822, test_loss: 0.9515, test_f1: 0.5637
 epoch: 56, train_loss: 0.7852, test_loss: 0.9458, test_f1: 0.5792
 epoch: 57, train_loss: 0.7756, test_loss: 0.9482, test_f1: 0.5776
 epoch: 58, train_loss: 0.7672, test_loss: 0.9501, test_f1: 0.5765
 epoch: 59, train_loss: 0.7702, test_loss: 0.9538, test_f1: 0.5731
 epoch: 60, train_loss: 0.7804, test_loss: 0.9541, test_f1: 0.5808
 epoch: 61, train_loss: 0.7817, test_loss: 0.9407, test_f1: 0.5923
 epoch: 62, train_loss: 0.7734, test_loss: 0.9395, test_f1: 0.5948
 epoch: 63, train_loss: 0.7617, test_loss: 0.9427, test_f1: 0.5859
 epoch: 64, train_loss: 0.7621, test_loss: 0.9456, test_f1: 0.5987
 epoch: 65, train_loss: 0.7663, test_loss: 0.9419, test_f1: 0.5970
 epoch: 66, train_loss: 0.7678, test_loss: 0.9381, test_f1: 0.6019
 epoch: 67, train_loss: 0.7658, test_loss: 0.9436, test_f1: 0.5976
 epoch: 68, train_loss: 0.7653, test_loss: 0.9504, test_f1: 0.5919
 epoch: 69, train_loss: 0.7580, test_loss: 0.9534, test_f1: 0.6127
 epoch: 70, train_loss: 0.7671, test_loss: 0.9501, test_f1: 0.5944
 epoch: 71, train_loss: 0.7647, test_loss: 0.9588, test_f1: 0.5813
 epoch: 72, train_loss: 0.7641, test_loss: 0.9414, test_f1: 0.5865
 epoch: 73, train_loss: 0.7598, test_loss: 0.9566, test_f1: 0.5938
 epoch: 74, train_loss: 0.7515, test_loss: 0.9550, test_f1: 0.5977
 epoch: 75, train_loss: 0.7560, test_loss: 0.9610, test_f1: 0.5894
 epoch: 76, train_loss: 0.7496, test_loss: 0.9580, test_f1: 0.5895
 epoch: 77, train_loss: 0.7475, test_loss: 0.9519, test_f1: 0.5968
 epoch: 78, train_loss: 0.7470, test_loss: 0.9461, test_f1: 0.6077
 epoch: 79, train_loss: 0.7361, test_loss: 0.9508, test_f1: 0.6024
 epoch: 80, train_loss: 0.7566, test_loss: 0.9597, test_f1: 0.5959
 epoch: 81, train_loss: 0.7456, test_loss: 0.9662, test_f1: 0.5985
 epoch: 82, train_loss: 0.7516, test_loss: 0.9590, test_f1: 0.5973
 epoch: 83, train_loss: 0.7332, test_loss: 0.9659, test_f1: 0.6019
 epoch: 84, train_loss: 0.7477, test_loss: 0.9601, test_f1: 0.6020
 epoch: 85, train_loss: 0.7340, test_loss: 0.9508, test_f1: 0.6012
 epoch: 86, train_loss: 0.7464, test_loss: 0.9634, test_f1: 0.5986
 epoch: 87, train_loss: 0.7352, test_loss: 0.9710, test_f1: 0.6005
 epoch: 88, train_loss: 0.7521, test_loss: 0.9626, test_f1: 0.6189
 epoch: 89, train_loss: 0.7267, test_loss: 0.9717, test_f1: 0.6072
 epoch: 90, train_loss: 0.7254, test_loss: 0.9731, test_f1: 0.6081
 epoch: 91, train_loss: 0.7223, test_loss: 0.9585, test_f1: 0.6027
 epoch: 92, train_loss: 0.7178, test_loss: 0.9747, test_f1: 0.6024
 epoch: 93, train_loss: 0.7343, test_loss: 0.9662, test_f1: 0.5947
 epoch: 94, train_loss: 0.7247, test_loss: 0.9623, test_f1: 0.6067
 epoch: 95, train_loss: 0.7231, test_loss: 0.9671, test_f1: 0.5925
 epoch: 96, train_loss: 0.7220, test_loss: 0.9636, test_f1: 0.6097
 epoch: 97, train_loss: 0.7231, test_loss: 0.9809, test_f1: 0.6002
 epoch: 98, train_loss: 0.7134, test_loss: 0.9578, test_f1: 0.6056
 epoch: 99, train_loss: 0.7137, test_loss: 0.9612, test_f1: 0.6200

Training completed in 524.43 seconds
Best F1: 0.6251 at epoch 97
Mean F1 across iterations: 0.5902  0.0196
========================FINAL RESULTS================================
FEGIN weighted F1: 0.6251  0.0196
python main.py --data ltspice_examples --representation component_net --model FEGIN --layers 5 --hiddens 64 --batch_size 128 --lr 0.0001 --emb_size 512 --epochs 100 --save_appendix component_net_L5_H64_BS128_LR0.0001_E512 --no_val
-----



STDERR:
  File "main.py", line 370, in <module>
    main()
  File "main.py", line 254, in main
    dataset = dataset_class(
  File "/home/philip/projects/ltspice_examples_code_repo/Circuit-Completion-Using-GNNs/component_classification_with_link_prediction_head/evaluation/FEGIN/kernel/circuit_datasets.py", line 15, in __init__
    self.data, self.slices = torch.load(self.processed_paths[0])
  File "/home/philip/.local/lib/python3.8/site-packages/torch/serialization.py", line 1040, in load
    warnings.warn(
  File "/usr/lib/python3.8/warnings.py", line 109, in _showwarnmsg
    sw(msg.message, msg.category, msg.filename, msg.lineno,
  File "main.py", line 47, in warn_with_traceback
    traceback.print_stack(file=log)
/home/philip/projects/ltspice_examples_code_repo/Circuit-Completion-Using-GNNs/component_classification_with_link_prediction_head/evaluation/FEGIN/kernel/circuit_datasets.py:15: FutureWarning: You are using `torch.load` with `weights_only=False` (the current default value), which uses the default pickle module implicitly. It is possible to construct malicious pickle data which will execute arbitrary code during unpickling (See https://github.com/pytorch/pytorch/blob/main/SECURITY.md#untrusted-models for more details). In a future release, the default value for `weights_only` will be flipped to `True`. This limits the functions that could be executed during unpickling. Arbitrary objects will no longer be allowed to be loaded via this mode unless they are explicitly allowlisted by the user via `torch.serialization.add_safe_globals`. We recommend you start setting `weights_only=True` for any use case where you don't have full control of the loaded file. Please open an issue on GitHub for any issues related to this experimental feature.
  self.data, self.slices = torch.load(self.processed_paths[0])
