STDOUT:
Results will be saved in /home/philip/projects/ltspice_examples_code_repo/Circuit-Completion-Using-GNNs/component_classification_with_link_prediction_head/evaluation/FEGIN/results/model_FEGIN_dataset_ltspice_examples
Command line input: python main.py --data ltspice_examples --representation component_component --model FEGIN --layers 4 --hiddens 16 --batch_size 128 --lr 0.001 --emb_size 128 --epochs 100 --save_appendix component_component_L4_H16_BS128_LR0.001_E128 --no_val
 is saved.
-----
ltspice_examples - FEGIN
Using 4 layers, 16 hidden units, h = 2
Loading component_component representation dataset
ENTERED
Training FEGIN on component_component representation
Train: 3556, Test: 845
##################ITERATION #0 ****************************************
 epoch: 0, train_loss: 1.3474, test_loss: 1.3455, test_f1: 0.2274
 epoch: 1, train_loss: 1.3261, test_loss: 1.3281, test_f1: 0.2274
 epoch: 2, train_loss: 1.3078, test_loss: 1.3082, test_f1: 0.2274
 epoch: 3, train_loss: 1.2875, test_loss: 1.2833, test_f1: 0.2274
 epoch: 4, train_loss: 1.2691, test_loss: 1.2538, test_f1: 0.2274
 epoch: 5, train_loss: 1.2555, test_loss: 1.2307, test_f1: 0.2274
 epoch: 6, train_loss: 1.2431, test_loss: 1.2223, test_f1: 0.2274
 epoch: 7, train_loss: 1.2366, test_loss: 1.2158, test_f1: 0.2449
 epoch: 8, train_loss: 1.2226, test_loss: 1.2053, test_f1: 0.3113
 epoch: 9, train_loss: 1.2199, test_loss: 1.1976, test_f1: 0.3441
 epoch: 10, train_loss: 1.2134, test_loss: 1.1870, test_f1: 0.3708
 epoch: 11, train_loss: 1.1997, test_loss: 1.1790, test_f1: 0.3518
 epoch: 12, train_loss: 1.1963, test_loss: 1.1716, test_f1: 0.3549
 epoch: 13, train_loss: 1.1831, test_loss: 1.1643, test_f1: 0.3878
 epoch: 14, train_loss: 1.1848, test_loss: 1.1573, test_f1: 0.4144
 epoch: 15, train_loss: 1.1676, test_loss: 1.1512, test_f1: 0.4290
 epoch: 16, train_loss: 1.1602, test_loss: 1.1458, test_f1: 0.4351
 epoch: 17, train_loss: 1.1614, test_loss: 1.1362, test_f1: 0.4287
 epoch: 18, train_loss: 1.1461, test_loss: 1.1252, test_f1: 0.4330
 epoch: 19, train_loss: 1.1399, test_loss: 1.1247, test_f1: 0.4474
 epoch: 20, train_loss: 1.1271, test_loss: 1.1061, test_f1: 0.4748
 epoch: 21, train_loss: 1.1253, test_loss: 1.1002, test_f1: 0.4451
 epoch: 22, train_loss: 1.1128, test_loss: 1.1017, test_f1: 0.4281
 epoch: 23, train_loss: 1.1015, test_loss: 1.1039, test_f1: 0.4315
 epoch: 24, train_loss: 1.0949, test_loss: 1.0976, test_f1: 0.4329
 epoch: 25, train_loss: 1.0898, test_loss: 1.0839, test_f1: 0.4073
 epoch: 26, train_loss: 1.0766, test_loss: 1.0760, test_f1: 0.4293
 epoch: 27, train_loss: 1.0817, test_loss: 1.0647, test_f1: 0.4280
 epoch: 28, train_loss: 1.0647, test_loss: 1.0716, test_f1: 0.4315
 epoch: 29, train_loss: 1.0644, test_loss: 1.0456, test_f1: 0.4432
 epoch: 30, train_loss: 1.0576, test_loss: 1.0499, test_f1: 0.4367
 epoch: 31, train_loss: 1.0487, test_loss: 1.0398, test_f1: 0.4359
 epoch: 32, train_loss: 1.0503, test_loss: 1.0554, test_f1: 0.4272
 epoch: 33, train_loss: 1.0213, test_loss: 1.0283, test_f1: 0.4458
 epoch: 34, train_loss: 1.0326, test_loss: 1.0817, test_f1: 0.4308
 epoch: 35, train_loss: 1.0247, test_loss: 1.0638, test_f1: 0.4311
 epoch: 36, train_loss: 1.0220, test_loss: 1.0670, test_f1: 0.4392
 epoch: 37, train_loss: 1.0159, test_loss: 1.0342, test_f1: 0.4452
 epoch: 38, train_loss: 1.0077, test_loss: 1.0388, test_f1: 0.4535
 epoch: 39, train_loss: 1.0068, test_loss: 1.0881, test_f1: 0.4315
 epoch: 40, train_loss: 0.9997, test_loss: 1.0437, test_f1: 0.4456
 epoch: 41, train_loss: 0.9954, test_loss: 1.1060, test_f1: 0.4339
 epoch: 42, train_loss: 1.0001, test_loss: 1.0207, test_f1: 0.4475
 epoch: 43, train_loss: 0.9860, test_loss: 1.0053, test_f1: 0.4601
 epoch: 44, train_loss: 0.9806, test_loss: 1.0712, test_f1: 0.4463
 epoch: 45, train_loss: 0.9805, test_loss: 1.0376, test_f1: 0.4497
 epoch: 46, train_loss: 0.9775, test_loss: 1.0291, test_f1: 0.4601
 epoch: 47, train_loss: 0.9749, test_loss: 1.0687, test_f1: 0.4481
 epoch: 48, train_loss: 0.9647, test_loss: 1.0887, test_f1: 0.4439
 epoch: 49, train_loss: 0.9682, test_loss: 1.0727, test_f1: 0.4360
 epoch: 50, train_loss: 0.9552, test_loss: 1.0403, test_f1: 0.4622
 epoch: 51, train_loss: 0.9442, test_loss: 1.0538, test_f1: 0.4582
 epoch: 52, train_loss: 0.9432, test_loss: 0.9969, test_f1: 0.4976
 epoch: 53, train_loss: 0.9409, test_loss: 1.0238, test_f1: 0.4978
 epoch: 54, train_loss: 0.9434, test_loss: 1.0471, test_f1: 0.4683
 epoch: 55, train_loss: 0.9414, test_loss: 1.0678, test_f1: 0.4685
 epoch: 56, train_loss: 0.9397, test_loss: 1.0547, test_f1: 0.4786
 epoch: 57, train_loss: 0.9324, test_loss: 1.1189, test_f1: 0.4416
 epoch: 58, train_loss: 0.9467, test_loss: 1.0860, test_f1: 0.4620
 epoch: 59, train_loss: 0.9270, test_loss: 1.0434, test_f1: 0.4712
 epoch: 60, train_loss: 0.9402, test_loss: 1.1324, test_f1: 0.4535
 epoch: 61, train_loss: 0.9266, test_loss: 1.0350, test_f1: 0.4761
 epoch: 62, train_loss: 0.9224, test_loss: 1.0979, test_f1: 0.4706
 epoch: 63, train_loss: 0.9357, test_loss: 1.0920, test_f1: 0.4641
 epoch: 64, train_loss: 0.9235, test_loss: 1.1137, test_f1: 0.4718
 epoch: 65, train_loss: 0.9154, test_loss: 1.0909, test_f1: 0.4602
 epoch: 66, train_loss: 0.9190, test_loss: 1.0011, test_f1: 0.4825
 epoch: 67, train_loss: 0.9133, test_loss: 1.1082, test_f1: 0.4702
 epoch: 68, train_loss: 0.9126, test_loss: 1.0282, test_f1: 0.4864
 epoch: 69, train_loss: 0.9120, test_loss: 1.1075, test_f1: 0.4530
 epoch: 70, train_loss: 0.9148, test_loss: 1.0877, test_f1: 0.4650
 epoch: 71, train_loss: 0.9106, test_loss: 1.0526, test_f1: 0.4775
 epoch: 72, train_loss: 0.9183, test_loss: 1.1003, test_f1: 0.4641
 epoch: 73, train_loss: 0.9060, test_loss: 1.1357, test_f1: 0.4804
 epoch: 74, train_loss: 0.9203, test_loss: 1.1186, test_f1: 0.4701
 epoch: 75, train_loss: 0.9131, test_loss: 1.1613, test_f1: 0.4654
 epoch: 76, train_loss: 0.9027, test_loss: 1.1556, test_f1: 0.4664
 epoch: 77, train_loss: 0.9060, test_loss: 1.0922, test_f1: 0.4678
 epoch: 78, train_loss: 0.9018, test_loss: 1.1141, test_f1: 0.4699
 epoch: 79, train_loss: 0.9004, test_loss: 1.1599, test_f1: 0.4591
 epoch: 80, train_loss: 0.8974, test_loss: 1.1573, test_f1: 0.4810
 epoch: 81, train_loss: 0.9011, test_loss: 1.1843, test_f1: 0.4719
 epoch: 82, train_loss: 0.8958, test_loss: 1.0729, test_f1: 0.4730
 epoch: 83, train_loss: 0.9121, test_loss: 1.0903, test_f1: 0.4731
 epoch: 84, train_loss: 0.8864, test_loss: 1.0975, test_f1: 0.4739
 epoch: 85, train_loss: 0.8871, test_loss: 1.1145, test_f1: 0.4627
 epoch: 86, train_loss: 0.8875, test_loss: 1.1163, test_f1: 0.4652
 epoch: 87, train_loss: 0.8835, test_loss: 1.0759, test_f1: 0.4658
 epoch: 88, train_loss: 0.8986, test_loss: 1.1138, test_f1: 0.4836
 epoch: 89, train_loss: 0.8888, test_loss: 1.1464, test_f1: 0.4823
 epoch: 90, train_loss: 0.8854, test_loss: 1.0696, test_f1: 0.4780
 epoch: 91, train_loss: 0.8906, test_loss: 1.1645, test_f1: 0.4770
 epoch: 92, train_loss: 0.8938, test_loss: 1.2111, test_f1: 0.4694
 epoch: 93, train_loss: 0.8883, test_loss: 1.1705, test_f1: 0.4746
 epoch: 94, train_loss: 0.8828, test_loss: 1.1583, test_f1: 0.4786
 epoch: 95, train_loss: 0.8747, test_loss: 1.0929, test_f1: 0.4804
 epoch: 96, train_loss: 0.8739, test_loss: 1.1528, test_f1: 0.4775
 epoch: 97, train_loss: 0.8788, test_loss: 1.0973, test_f1: 0.4642
 epoch: 98, train_loss: 0.8985, test_loss: 1.0982, test_f1: 0.4827
 epoch: 99, train_loss: 0.8755, test_loss: 1.1678, test_f1: 0.4763
##################ITERATION #1 ****************************************
 epoch: 0, train_loss: 1.3523, test_loss: 1.3134, test_f1: 0.2274
 epoch: 1, train_loss: 1.2789, test_loss: 1.2757, test_f1: 0.2555
 epoch: 2, train_loss: 1.2605, test_loss: 1.2501, test_f1: 0.2713
 epoch: 3, train_loss: 1.2396, test_loss: 1.2217, test_f1: 0.2759
 epoch: 4, train_loss: 1.2233, test_loss: 1.1887, test_f1: 0.3472
 epoch: 5, train_loss: 1.2069, test_loss: 1.1590, test_f1: 0.3994
 epoch: 6, train_loss: 1.1771, test_loss: 1.1270, test_f1: 0.3904
 epoch: 7, train_loss: 1.1705, test_loss: 1.0996, test_f1: 0.4330
 epoch: 8, train_loss: 1.1471, test_loss: 1.0861, test_f1: 0.4401
 epoch: 9, train_loss: 1.1331, test_loss: 1.0635, test_f1: 0.4514
 epoch: 10, train_loss: 1.1156, test_loss: 1.0376, test_f1: 0.4770
 epoch: 11, train_loss: 1.1082, test_loss: 1.0347, test_f1: 0.4560
 epoch: 12, train_loss: 1.0874, test_loss: 1.0080, test_f1: 0.4676
 epoch: 13, train_loss: 1.0691, test_loss: 0.9963, test_f1: 0.4753
 epoch: 14, train_loss: 1.0715, test_loss: 0.9853, test_f1: 0.4727
 epoch: 15, train_loss: 1.0602, test_loss: 0.9907, test_f1: 0.4625
 epoch: 16, train_loss: 1.0490, test_loss: 0.9646, test_f1: 0.4815
 epoch: 17, train_loss: 1.0400, test_loss: 0.9706, test_f1: 0.4728
 epoch: 18, train_loss: 1.0319, test_loss: 0.9546, test_f1: 0.4837
 epoch: 19, train_loss: 1.0212, test_loss: 0.9540, test_f1: 0.4705
 epoch: 20, train_loss: 1.0097, test_loss: 0.9571, test_f1: 0.4584
 epoch: 21, train_loss: 1.0106, test_loss: 0.9549, test_f1: 0.4625
 epoch: 22, train_loss: 1.0093, test_loss: 0.9538, test_f1: 0.4626
 epoch: 23, train_loss: 0.9906, test_loss: 0.9497, test_f1: 0.4666
 epoch: 24, train_loss: 0.9831, test_loss: 0.9401, test_f1: 0.4734
 epoch: 25, train_loss: 0.9863, test_loss: 0.9596, test_f1: 0.4716
 epoch: 26, train_loss: 0.9901, test_loss: 0.9439, test_f1: 0.4743
 epoch: 27, train_loss: 0.9864, test_loss: 0.9548, test_f1: 0.4641
 epoch: 28, train_loss: 0.9774, test_loss: 0.9296, test_f1: 0.4876
 epoch: 29, train_loss: 0.9693, test_loss: 0.9211, test_f1: 0.4778
 epoch: 30, train_loss: 0.9658, test_loss: 0.9459, test_f1: 0.4892
 epoch: 31, train_loss: 0.9490, test_loss: 0.9252, test_f1: 0.4666
 epoch: 32, train_loss: 0.9506, test_loss: 0.9475, test_f1: 0.4768
 epoch: 33, train_loss: 0.9539, test_loss: 0.9203, test_f1: 0.4926
 epoch: 34, train_loss: 0.9437, test_loss: 0.9419, test_f1: 0.4788
 epoch: 35, train_loss: 0.9328, test_loss: 0.9382, test_f1: 0.4795
 epoch: 36, train_loss: 0.9381, test_loss: 0.9603, test_f1: 0.4748
 epoch: 37, train_loss: 0.9265, test_loss: 0.9464, test_f1: 0.4867
 epoch: 38, train_loss: 0.9344, test_loss: 0.9392, test_f1: 0.4779
 epoch: 39, train_loss: 0.9257, test_loss: 0.9558, test_f1: 0.4871
 epoch: 40, train_loss: 0.9230, test_loss: 0.9805, test_f1: 0.4776
 epoch: 41, train_loss: 0.9170, test_loss: 0.9546, test_f1: 0.4737
 epoch: 42, train_loss: 0.9186, test_loss: 0.9557, test_f1: 0.4831
 epoch: 43, train_loss: 0.9233, test_loss: 0.9510, test_f1: 0.4945
 epoch: 44, train_loss: 0.9081, test_loss: 0.9693, test_f1: 0.5083
 epoch: 45, train_loss: 0.9038, test_loss: 0.9532, test_f1: 0.4916
 epoch: 46, train_loss: 0.9041, test_loss: 0.9624, test_f1: 0.4832
 epoch: 47, train_loss: 0.8861, test_loss: 0.9555, test_f1: 0.4908
 epoch: 48, train_loss: 0.9017, test_loss: 0.9666, test_f1: 0.4921
 epoch: 49, train_loss: 0.9012, test_loss: 0.9884, test_f1: 0.4944
 epoch: 50, train_loss: 0.8827, test_loss: 1.0088, test_f1: 0.4900
 epoch: 51, train_loss: 0.8788, test_loss: 0.9876, test_f1: 0.4839
 epoch: 52, train_loss: 0.8761, test_loss: 0.9878, test_f1: 0.4923
 epoch: 53, train_loss: 0.8783, test_loss: 0.9777, test_f1: 0.5104
 epoch: 54, train_loss: 0.8860, test_loss: 1.0118, test_f1: 0.4843
 epoch: 55, train_loss: 0.8702, test_loss: 0.9986, test_f1: 0.4779
 epoch: 56, train_loss: 0.8641, test_loss: 1.0115, test_f1: 0.4895
 epoch: 57, train_loss: 0.8565, test_loss: 1.0003, test_f1: 0.4904
 epoch: 58, train_loss: 0.8593, test_loss: 1.0092, test_f1: 0.4969
 epoch: 59, train_loss: 0.8604, test_loss: 0.9990, test_f1: 0.4946
 epoch: 60, train_loss: 0.8544, test_loss: 1.0248, test_f1: 0.4913
 epoch: 61, train_loss: 0.8667, test_loss: 0.9999, test_f1: 0.4969
 epoch: 62, train_loss: 0.8641, test_loss: 0.9963, test_f1: 0.5035
 epoch: 63, train_loss: 0.8579, test_loss: 1.0169, test_f1: 0.4940
 epoch: 64, train_loss: 0.8506, test_loss: 0.9988, test_f1: 0.5077
 epoch: 65, train_loss: 0.8560, test_loss: 1.0108, test_f1: 0.5093
 epoch: 66, train_loss: 0.8491, test_loss: 1.0318, test_f1: 0.4854
 epoch: 67, train_loss: 0.8576, test_loss: 1.0226, test_f1: 0.4886
 epoch: 68, train_loss: 0.8425, test_loss: 1.0288, test_f1: 0.4915
 epoch: 69, train_loss: 0.8511, test_loss: 1.0329, test_f1: 0.4960
 epoch: 70, train_loss: 0.8503, test_loss: 1.0205, test_f1: 0.5055
 epoch: 71, train_loss: 0.8449, test_loss: 1.0334, test_f1: 0.5047
 epoch: 72, train_loss: 0.8422, test_loss: 1.0202, test_f1: 0.5044
 epoch: 73, train_loss: 0.8451, test_loss: 1.0326, test_f1: 0.4983
 epoch: 74, train_loss: 0.8359, test_loss: 1.0310, test_f1: 0.5083
 epoch: 75, train_loss: 0.8451, test_loss: 1.0341, test_f1: 0.5098
 epoch: 76, train_loss: 0.8406, test_loss: 1.0278, test_f1: 0.4837
 epoch: 77, train_loss: 0.8481, test_loss: 1.0393, test_f1: 0.5056
 epoch: 78, train_loss: 0.8194, test_loss: 1.0510, test_f1: 0.4992
 epoch: 79, train_loss: 0.8321, test_loss: 1.0515, test_f1: 0.4954
 epoch: 80, train_loss: 0.8350, test_loss: 1.0568, test_f1: 0.5068
 epoch: 81, train_loss: 0.8312, test_loss: 1.0363, test_f1: 0.5024
 epoch: 82, train_loss: 0.8309, test_loss: 1.0740, test_f1: 0.4825
 epoch: 83, train_loss: 0.8299, test_loss: 1.0723, test_f1: 0.5060
 epoch: 84, train_loss: 0.8259, test_loss: 1.0416, test_f1: 0.5052
 epoch: 85, train_loss: 0.8197, test_loss: 1.0480, test_f1: 0.5041
 epoch: 86, train_loss: 0.8187, test_loss: 1.1117, test_f1: 0.4960
 epoch: 87, train_loss: 0.8238, test_loss: 1.0524, test_f1: 0.4936
 epoch: 88, train_loss: 0.8236, test_loss: 1.0824, test_f1: 0.5016
 epoch: 89, train_loss: 0.8188, test_loss: 1.0566, test_f1: 0.5112
 epoch: 90, train_loss: 0.8138, test_loss: 1.0842, test_f1: 0.5061
 epoch: 91, train_loss: 0.8218, test_loss: 1.0570, test_f1: 0.5050
 epoch: 92, train_loss: 0.8106, test_loss: 1.0666, test_f1: 0.5086
 epoch: 93, train_loss: 0.8118, test_loss: 1.0513, test_f1: 0.5005
 epoch: 94, train_loss: 0.8002, test_loss: 1.1601, test_f1: 0.5060
 epoch: 95, train_loss: 0.8126, test_loss: 1.0717, test_f1: 0.5072
 epoch: 96, train_loss: 0.8220, test_loss: 1.1069, test_f1: 0.5047
 epoch: 97, train_loss: 0.8293, test_loss: 1.0526, test_f1: 0.5143
 epoch: 98, train_loss: 0.8192, test_loss: 1.0894, test_f1: 0.5028
 epoch: 99, train_loss: 0.8113, test_loss: 1.0572, test_f1: 0.5279
##################ITERATION #2 ****************************************
 epoch: 0, train_loss: 1.3559, test_loss: 1.3012, test_f1: 0.2274
 epoch: 1, train_loss: 1.2755, test_loss: 1.2622, test_f1: 0.2497
 epoch: 2, train_loss: 1.2612, test_loss: 1.2436, test_f1: 0.2869
 epoch: 3, train_loss: 1.2490, test_loss: 1.2297, test_f1: 0.2756
 epoch: 4, train_loss: 1.2336, test_loss: 1.2166, test_f1: 0.2819
 epoch: 5, train_loss: 1.2325, test_loss: 1.2021, test_f1: 0.2863
 epoch: 6, train_loss: 1.2183, test_loss: 1.1948, test_f1: 0.2947
 epoch: 7, train_loss: 1.2047, test_loss: 1.1753, test_f1: 0.3366
 epoch: 8, train_loss: 1.1993, test_loss: 1.1741, test_f1: 0.3529
 epoch: 9, train_loss: 1.1791, test_loss: 1.1645, test_f1: 0.3882
 epoch: 10, train_loss: 1.1821, test_loss: 1.1568, test_f1: 0.3871
 epoch: 11, train_loss: 1.1615, test_loss: 1.1468, test_f1: 0.3843
 epoch: 12, train_loss: 1.1588, test_loss: 1.1274, test_f1: 0.4098
 epoch: 13, train_loss: 1.1449, test_loss: 1.1196, test_f1: 0.4006
 epoch: 14, train_loss: 1.1390, test_loss: 1.0991, test_f1: 0.4195
 epoch: 15, train_loss: 1.1370, test_loss: 1.1024, test_f1: 0.4286
 epoch: 16, train_loss: 1.1241, test_loss: 1.0924, test_f1: 0.4286
 epoch: 17, train_loss: 1.1171, test_loss: 1.0848, test_f1: 0.4452
 epoch: 18, train_loss: 1.1042, test_loss: 1.0842, test_f1: 0.4258
 epoch: 19, train_loss: 1.0980, test_loss: 1.0796, test_f1: 0.4443
 epoch: 20, train_loss: 1.1037, test_loss: 1.0627, test_f1: 0.4600
 epoch: 21, train_loss: 1.0863, test_loss: 1.0655, test_f1: 0.4354
 epoch: 22, train_loss: 1.0811, test_loss: 1.0596, test_f1: 0.4238
 epoch: 23, train_loss: 1.0696, test_loss: 1.0418, test_f1: 0.4305
 epoch: 24, train_loss: 1.0794, test_loss: 1.0539, test_f1: 0.4351
 epoch: 25, train_loss: 1.0655, test_loss: 1.0561, test_f1: 0.4359
 epoch: 26, train_loss: 1.0635, test_loss: 1.0300, test_f1: 0.4548
 epoch: 27, train_loss: 1.0573, test_loss: 1.0369, test_f1: 0.4379
 epoch: 28, train_loss: 1.0486, test_loss: 1.0511, test_f1: 0.4418
 epoch: 29, train_loss: 1.0446, test_loss: 1.0085, test_f1: 0.4554
 epoch: 30, train_loss: 1.0399, test_loss: 1.0306, test_f1: 0.4420
 epoch: 31, train_loss: 1.0410, test_loss: 1.0205, test_f1: 0.4573
 epoch: 32, train_loss: 1.0328, test_loss: 1.0033, test_f1: 0.4607
 epoch: 33, train_loss: 1.0425, test_loss: 1.0065, test_f1: 0.4545
 epoch: 34, train_loss: 1.0285, test_loss: 1.0132, test_f1: 0.4322
 epoch: 35, train_loss: 1.0129, test_loss: 1.0068, test_f1: 0.4482
 epoch: 36, train_loss: 1.0081, test_loss: 1.0265, test_f1: 0.4469
 epoch: 37, train_loss: 1.0057, test_loss: 1.0168, test_f1: 0.4519
 epoch: 38, train_loss: 1.0185, test_loss: 1.0215, test_f1: 0.4544
 epoch: 39, train_loss: 0.9959, test_loss: 1.0098, test_f1: 0.4417
 epoch: 40, train_loss: 0.9973, test_loss: 1.0126, test_f1: 0.4645
 epoch: 41, train_loss: 1.0039, test_loss: 1.0154, test_f1: 0.4605
 epoch: 42, train_loss: 0.9914, test_loss: 0.9740, test_f1: 0.4743
 epoch: 43, train_loss: 0.9945, test_loss: 0.9869, test_f1: 0.4805
 epoch: 44, train_loss: 0.9870, test_loss: 0.9860, test_f1: 0.4720
 epoch: 45, train_loss: 0.9824, test_loss: 0.9963, test_f1: 0.4698
 epoch: 46, train_loss: 0.9944, test_loss: 0.9990, test_f1: 0.4668
 epoch: 47, train_loss: 0.9852, test_loss: 0.9731, test_f1: 0.4765
 epoch: 48, train_loss: 0.9819, test_loss: 1.0026, test_f1: 0.4483
 epoch: 49, train_loss: 0.9784, test_loss: 0.9598, test_f1: 0.4796
 epoch: 50, train_loss: 0.9646, test_loss: 0.9830, test_f1: 0.4664
 epoch: 51, train_loss: 0.9659, test_loss: 0.9784, test_f1: 0.4692
 epoch: 52, train_loss: 0.9637, test_loss: 0.9749, test_f1: 0.4682
 epoch: 53, train_loss: 0.9460, test_loss: 0.9746, test_f1: 0.4723
 epoch: 54, train_loss: 0.9465, test_loss: 0.9666, test_f1: 0.4831
 epoch: 55, train_loss: 0.9584, test_loss: 0.9668, test_f1: 0.4762
 epoch: 56, train_loss: 0.9586, test_loss: 0.9632, test_f1: 0.4841
 epoch: 57, train_loss: 0.9409, test_loss: 0.9689, test_f1: 0.4874
 epoch: 58, train_loss: 0.9435, test_loss: 0.9664, test_f1: 0.4781
 epoch: 59, train_loss: 0.9436, test_loss: 0.9697, test_f1: 0.4848
 epoch: 60, train_loss: 0.9571, test_loss: 0.9731, test_f1: 0.4757
 epoch: 61, train_loss: 0.9429, test_loss: 0.9686, test_f1: 0.4721
 epoch: 62, train_loss: 0.9343, test_loss: 0.9818, test_f1: 0.4581
 epoch: 63, train_loss: 0.9510, test_loss: 0.9624, test_f1: 0.4830
 epoch: 64, train_loss: 0.9340, test_loss: 0.9531, test_f1: 0.4821
 epoch: 65, train_loss: 0.9342, test_loss: 0.9594, test_f1: 0.4898
 epoch: 66, train_loss: 0.9393, test_loss: 0.9462, test_f1: 0.4899
 epoch: 67, train_loss: 0.9398, test_loss: 0.9663, test_f1: 0.4837
 epoch: 68, train_loss: 0.9383, test_loss: 0.9553, test_f1: 0.4836
 epoch: 69, train_loss: 0.9357, test_loss: 0.9503, test_f1: 0.4927
 epoch: 70, train_loss: 0.9309, test_loss: 0.9455, test_f1: 0.4891
 epoch: 71, train_loss: 0.9329, test_loss: 0.9607, test_f1: 0.4876
 epoch: 72, train_loss: 0.9225, test_loss: 0.9583, test_f1: 0.4922
 epoch: 73, train_loss: 0.9368, test_loss: 0.9495, test_f1: 0.4951
 epoch: 74, train_loss: 0.9238, test_loss: 0.9627, test_f1: 0.4856
 epoch: 75, train_loss: 0.9168, test_loss: 0.9509, test_f1: 0.4895
 epoch: 76, train_loss: 0.9283, test_loss: 0.9644, test_f1: 0.4884
 epoch: 77, train_loss: 0.9265, test_loss: 0.9734, test_f1: 0.4747
 epoch: 78, train_loss: 0.9242, test_loss: 0.9460, test_f1: 0.4871
 epoch: 79, train_loss: 0.9116, test_loss: 0.9973, test_f1: 0.4635
 epoch: 80, train_loss: 0.9256, test_loss: 0.9500, test_f1: 0.4921
 epoch: 81, train_loss: 0.9205, test_loss: 0.9548, test_f1: 0.4865
 epoch: 82, train_loss: 0.9188, test_loss: 0.9454, test_f1: 0.4839
 epoch: 83, train_loss: 0.9134, test_loss: 0.9495, test_f1: 0.4850
 epoch: 84, train_loss: 0.9186, test_loss: 0.9463, test_f1: 0.4854
 epoch: 85, train_loss: 0.9067, test_loss: 0.9438, test_f1: 0.4844
 epoch: 86, train_loss: 0.9110, test_loss: 0.9557, test_f1: 0.4849
 epoch: 87, train_loss: 0.9036, test_loss: 0.9678, test_f1: 0.4776
 epoch: 88, train_loss: 0.9093, test_loss: 0.9853, test_f1: 0.4851
 epoch: 89, train_loss: 0.9108, test_loss: 0.9484, test_f1: 0.4986
 epoch: 90, train_loss: 0.9059, test_loss: 0.9571, test_f1: 0.4784
 epoch: 91, train_loss: 0.9028, test_loss: 0.9563, test_f1: 0.4852
 epoch: 92, train_loss: 0.9088, test_loss: 0.9478, test_f1: 0.4808
 epoch: 93, train_loss: 0.9166, test_loss: 0.9686, test_f1: 0.4817
 epoch: 94, train_loss: 0.9040, test_loss: 0.9600, test_f1: 0.4802
 epoch: 95, train_loss: 0.8971, test_loss: 0.9472, test_f1: 0.4830
 epoch: 96, train_loss: 0.9118, test_loss: 0.9557, test_f1: 0.4811
 epoch: 97, train_loss: 0.8903, test_loss: 0.9493, test_f1: 0.4774
 epoch: 98, train_loss: 0.8941, test_loss: 0.9593, test_f1: 0.4872
 epoch: 99, train_loss: 0.9027, test_loss: 0.9474, test_f1: 0.4951
##################ITERATION #3 ****************************************
 epoch: 0, train_loss: 1.3187, test_loss: 1.2830, test_f1: 0.2274
 epoch: 1, train_loss: 1.2616, test_loss: 1.2367, test_f1: 0.2864
 epoch: 2, train_loss: 1.2398, test_loss: 1.2006, test_f1: 0.3284
 epoch: 3, train_loss: 1.2278, test_loss: 1.1849, test_f1: 0.3336
 epoch: 4, train_loss: 1.2146, test_loss: 1.1751, test_f1: 0.3763
 epoch: 5, train_loss: 1.2009, test_loss: 1.1369, test_f1: 0.4159
 epoch: 6, train_loss: 1.1864, test_loss: 1.1232, test_f1: 0.4081
 epoch: 7, train_loss: 1.1788, test_loss: 1.1103, test_f1: 0.4159
 epoch: 8, train_loss: 1.1710, test_loss: 1.0975, test_f1: 0.4457
 epoch: 9, train_loss: 1.1493, test_loss: 1.0814, test_f1: 0.4384
 epoch: 10, train_loss: 1.1422, test_loss: 1.0682, test_f1: 0.4370
 epoch: 11, train_loss: 1.1418, test_loss: 1.0628, test_f1: 0.4512
 epoch: 12, train_loss: 1.1272, test_loss: 1.0452, test_f1: 0.4666
 epoch: 13, train_loss: 1.1223, test_loss: 1.0288, test_f1: 0.4662
 epoch: 14, train_loss: 1.1126, test_loss: 1.0201, test_f1: 0.4726
 epoch: 15, train_loss: 1.1011, test_loss: 1.0238, test_f1: 0.4681
 epoch: 16, train_loss: 1.0959, test_loss: 1.0104, test_f1: 0.4655
 epoch: 17, train_loss: 1.0837, test_loss: 1.0108, test_f1: 0.4730
 epoch: 18, train_loss: 1.0787, test_loss: 1.0006, test_f1: 0.4690
 epoch: 19, train_loss: 1.0701, test_loss: 0.9948, test_f1: 0.4651
 epoch: 20, train_loss: 1.0700, test_loss: 0.9909, test_f1: 0.4798
 epoch: 21, train_loss: 1.0640, test_loss: 1.0011, test_f1: 0.4666
 epoch: 22, train_loss: 1.0624, test_loss: 0.9791, test_f1: 0.4684
 epoch: 23, train_loss: 1.0502, test_loss: 0.9873, test_f1: 0.4720
 epoch: 24, train_loss: 1.0630, test_loss: 0.9906, test_f1: 0.4715
 epoch: 25, train_loss: 1.0469, test_loss: 0.9657, test_f1: 0.4755
 epoch: 26, train_loss: 1.0353, test_loss: 0.9634, test_f1: 0.4756
 epoch: 27, train_loss: 1.0419, test_loss: 0.9724, test_f1: 0.4807
 epoch: 28, train_loss: 1.0420, test_loss: 0.9750, test_f1: 0.4743
 epoch: 29, train_loss: 1.0309, test_loss: 0.9652, test_f1: 0.4843
 epoch: 30, train_loss: 1.0163, test_loss: 0.9657, test_f1: 0.4758
 epoch: 31, train_loss: 1.0131, test_loss: 0.9442, test_f1: 0.4880
 epoch: 32, train_loss: 1.0261, test_loss: 0.9536, test_f1: 0.4766
 epoch: 33, train_loss: 1.0125, test_loss: 0.9471, test_f1: 0.4687
 epoch: 34, train_loss: 1.0079, test_loss: 0.9359, test_f1: 0.4898
 epoch: 35, train_loss: 1.0045, test_loss: 0.9298, test_f1: 0.4917
 epoch: 36, train_loss: 0.9898, test_loss: 0.9292, test_f1: 0.4896
 epoch: 37, train_loss: 1.0031, test_loss: 0.9353, test_f1: 0.4863
 epoch: 38, train_loss: 0.9900, test_loss: 0.9357, test_f1: 0.4932
 epoch: 39, train_loss: 0.9975, test_loss: 0.9249, test_f1: 0.4895
 epoch: 40, train_loss: 0.9903, test_loss: 0.9454, test_f1: 0.4786
 epoch: 41, train_loss: 0.9793, test_loss: 0.9647, test_f1: 0.4726
 epoch: 42, train_loss: 0.9827, test_loss: 0.9588, test_f1: 0.4725
 epoch: 43, train_loss: 0.9772, test_loss: 0.9448, test_f1: 0.4823
 epoch: 44, train_loss: 0.9679, test_loss: 0.9531, test_f1: 0.4852
 epoch: 45, train_loss: 0.9671, test_loss: 0.9507, test_f1: 0.4728
 epoch: 46, train_loss: 0.9634, test_loss: 0.9533, test_f1: 0.4984
 epoch: 47, train_loss: 0.9520, test_loss: 0.9481, test_f1: 0.4781
 epoch: 48, train_loss: 0.9518, test_loss: 0.9706, test_f1: 0.4751
 epoch: 49, train_loss: 0.9397, test_loss: 0.9676, test_f1: 0.4679
 epoch: 50, train_loss: 0.9635, test_loss: 0.9527, test_f1: 0.4850
 epoch: 51, train_loss: 0.9468, test_loss: 0.9629, test_f1: 0.4699
 epoch: 52, train_loss: 0.9390, test_loss: 0.9538, test_f1: 0.4842
 epoch: 53, train_loss: 0.9568, test_loss: 0.9678, test_f1: 0.4711
 epoch: 54, train_loss: 0.9476, test_loss: 0.9564, test_f1: 0.4897
 epoch: 55, train_loss: 0.9374, test_loss: 0.9687, test_f1: 0.4791
 epoch: 56, train_loss: 0.9416, test_loss: 0.9731, test_f1: 0.4818
 epoch: 57, train_loss: 0.9249, test_loss: 0.9520, test_f1: 0.4961
 epoch: 58, train_loss: 0.9304, test_loss: 0.9563, test_f1: 0.4798
 epoch: 59, train_loss: 0.9399, test_loss: 0.9670, test_f1: 0.4912
 epoch: 60, train_loss: 0.9310, test_loss: 0.9661, test_f1: 0.4898
 epoch: 61, train_loss: 0.9331, test_loss: 0.9638, test_f1: 0.4777
 epoch: 62, train_loss: 0.9251, test_loss: 0.9691, test_f1: 0.4839
 epoch: 63, train_loss: 0.9217, test_loss: 0.9657, test_f1: 0.4944
 epoch: 64, train_loss: 0.9207, test_loss: 0.9607, test_f1: 0.4966
 epoch: 65, train_loss: 0.9282, test_loss: 0.9606, test_f1: 0.5062
 epoch: 66, train_loss: 0.9320, test_loss: 0.9539, test_f1: 0.4831
 epoch: 67, train_loss: 0.9234, test_loss: 0.9588, test_f1: 0.4945
 epoch: 68, train_loss: 0.9162, test_loss: 0.9486, test_f1: 0.4957
 epoch: 69, train_loss: 0.9182, test_loss: 0.9654, test_f1: 0.4933
 epoch: 70, train_loss: 0.9176, test_loss: 0.9584, test_f1: 0.4920
 epoch: 71, train_loss: 0.9170, test_loss: 0.9789, test_f1: 0.4788
 epoch: 72, train_loss: 0.9200, test_loss: 0.9822, test_f1: 0.4797
 epoch: 73, train_loss: 0.9116, test_loss: 0.9748, test_f1: 0.4824
 epoch: 74, train_loss: 0.9112, test_loss: 0.9671, test_f1: 0.4956
 epoch: 75, train_loss: 0.9073, test_loss: 0.9870, test_f1: 0.4886
 epoch: 76, train_loss: 0.9096, test_loss: 0.9612, test_f1: 0.4977
 epoch: 77, train_loss: 0.9081, test_loss: 0.9677, test_f1: 0.4987
 epoch: 78, train_loss: 0.9072, test_loss: 0.9769, test_f1: 0.4974
 epoch: 79, train_loss: 0.9113, test_loss: 0.9609, test_f1: 0.4953
 epoch: 80, train_loss: 0.9027, test_loss: 0.9754, test_f1: 0.4950
 epoch: 81, train_loss: 0.9152, test_loss: 0.9839, test_f1: 0.4895
 epoch: 82, train_loss: 0.9072, test_loss: 0.9877, test_f1: 0.4891
 epoch: 83, train_loss: 0.8957, test_loss: 1.0008, test_f1: 0.5060
 epoch: 84, train_loss: 0.9029, test_loss: 0.9628, test_f1: 0.4845
 epoch: 85, train_loss: 0.9010, test_loss: 0.9935, test_f1: 0.4863
 epoch: 86, train_loss: 0.8920, test_loss: 0.9709, test_f1: 0.4905
 epoch: 87, train_loss: 0.8950, test_loss: 0.9846, test_f1: 0.4917
 epoch: 88, train_loss: 0.9079, test_loss: 1.0168, test_f1: 0.4845
 epoch: 89, train_loss: 0.8939, test_loss: 0.9957, test_f1: 0.4826
 epoch: 90, train_loss: 0.9011, test_loss: 0.9915, test_f1: 0.4883
 epoch: 91, train_loss: 0.8925, test_loss: 0.9703, test_f1: 0.4883
 epoch: 92, train_loss: 0.8801, test_loss: 0.9930, test_f1: 0.4881
 epoch: 93, train_loss: 0.8830, test_loss: 0.9982, test_f1: 0.4856
 epoch: 94, train_loss: 0.8852, test_loss: 1.0034, test_f1: 0.5003
 epoch: 95, train_loss: 0.8872, test_loss: 1.0151, test_f1: 0.4972
 epoch: 96, train_loss: 0.8939, test_loss: 0.9968, test_f1: 0.5001
 epoch: 97, train_loss: 0.8817, test_loss: 0.9869, test_f1: 0.4965
 epoch: 98, train_loss: 0.8915, test_loss: 0.9906, test_f1: 0.4980
 epoch: 99, train_loss: 0.8835, test_loss: 1.0105, test_f1: 0.4912
##################ITERATION #4 ****************************************
 epoch: 0, train_loss: 1.3413, test_loss: 1.2955, test_f1: 0.2274
 epoch: 1, train_loss: 1.2571, test_loss: 1.2392, test_f1: 0.2708
 epoch: 2, train_loss: 1.2316, test_loss: 1.2041, test_f1: 0.3005
 epoch: 3, train_loss: 1.2349, test_loss: 1.1928, test_f1: 0.3314
 epoch: 4, train_loss: 1.2201, test_loss: 1.1959, test_f1: 0.3423
 epoch: 5, train_loss: 1.2168, test_loss: 1.1885, test_f1: 0.3223
 epoch: 6, train_loss: 1.2044, test_loss: 1.1776, test_f1: 0.3573
 epoch: 7, train_loss: 1.1986, test_loss: 1.1670, test_f1: 0.3756
 epoch: 8, train_loss: 1.1957, test_loss: 1.1511, test_f1: 0.3800
 epoch: 9, train_loss: 1.1704, test_loss: 1.1525, test_f1: 0.3992
 epoch: 10, train_loss: 1.1708, test_loss: 1.1356, test_f1: 0.4128
 epoch: 11, train_loss: 1.1632, test_loss: 1.1255, test_f1: 0.4285
 epoch: 12, train_loss: 1.1586, test_loss: 1.1242, test_f1: 0.3960
 epoch: 13, train_loss: 1.1521, test_loss: 1.1220, test_f1: 0.4132
 epoch: 14, train_loss: 1.1468, test_loss: 1.1094, test_f1: 0.4151
 epoch: 15, train_loss: 1.1323, test_loss: 1.1145, test_f1: 0.4241
 epoch: 16, train_loss: 1.1388, test_loss: 1.1050, test_f1: 0.4311
 epoch: 17, train_loss: 1.1194, test_loss: 1.0924, test_f1: 0.4248
 epoch: 18, train_loss: 1.1114, test_loss: 1.0761, test_f1: 0.4416
 epoch: 19, train_loss: 1.1115, test_loss: 1.0808, test_f1: 0.4068
 epoch: 20, train_loss: 1.0960, test_loss: 1.0748, test_f1: 0.4472
 epoch: 21, train_loss: 1.1114, test_loss: 1.0701, test_f1: 0.4160
 epoch: 22, train_loss: 1.0958, test_loss: 1.0630, test_f1: 0.4246
 epoch: 23, train_loss: 1.0833, test_loss: 1.0677, test_f1: 0.4229
 epoch: 24, train_loss: 1.0770, test_loss: 1.0568, test_f1: 0.4261
 epoch: 25, train_loss: 1.0705, test_loss: 1.0471, test_f1: 0.4453
 epoch: 26, train_loss: 1.0698, test_loss: 1.0660, test_f1: 0.4312
 epoch: 27, train_loss: 1.0796, test_loss: 1.0450, test_f1: 0.4407
 epoch: 28, train_loss: 1.0666, test_loss: 1.0592, test_f1: 0.4310
 epoch: 29, train_loss: 1.0487, test_loss: 1.0414, test_f1: 0.4449
 epoch: 30, train_loss: 1.0500, test_loss: 1.0534, test_f1: 0.4195
 epoch: 31, train_loss: 1.0634, test_loss: 1.0526, test_f1: 0.4269
 epoch: 32, train_loss: 1.0393, test_loss: 1.0526, test_f1: 0.4324
 epoch: 33, train_loss: 1.0416, test_loss: 1.0271, test_f1: 0.4513
 epoch: 34, train_loss: 1.0396, test_loss: 1.0567, test_f1: 0.4196
 epoch: 35, train_loss: 1.0336, test_loss: 1.0434, test_f1: 0.4319
 epoch: 36, train_loss: 1.0250, test_loss: 1.0631, test_f1: 0.4344
 epoch: 37, train_loss: 1.0199, test_loss: 1.0165, test_f1: 0.4610
 epoch: 38, train_loss: 1.0206, test_loss: 1.0450, test_f1: 0.4489
 epoch: 39, train_loss: 1.0136, test_loss: 1.0530, test_f1: 0.4373
 epoch: 40, train_loss: 1.0187, test_loss: 1.0656, test_f1: 0.4401
 epoch: 41, train_loss: 1.0072, test_loss: 1.0588, test_f1: 0.4329
 epoch: 42, train_loss: 1.0056, test_loss: 1.0286, test_f1: 0.4464
 epoch: 43, train_loss: 1.0121, test_loss: 1.0399, test_f1: 0.4431
 epoch: 44, train_loss: 0.9928, test_loss: 1.0110, test_f1: 0.4427
 epoch: 45, train_loss: 1.0023, test_loss: 1.0354, test_f1: 0.4407
 epoch: 46, train_loss: 0.9965, test_loss: 1.0249, test_f1: 0.4591
 epoch: 47, train_loss: 0.9913, test_loss: 1.0619, test_f1: 0.4212
 epoch: 48, train_loss: 0.9869, test_loss: 1.0335, test_f1: 0.4488
 epoch: 49, train_loss: 0.9803, test_loss: 1.0699, test_f1: 0.4332
 epoch: 50, train_loss: 0.9801, test_loss: 1.0423, test_f1: 0.4419
 epoch: 51, train_loss: 0.9767, test_loss: 1.0295, test_f1: 0.4435
 epoch: 52, train_loss: 0.9637, test_loss: 1.0288, test_f1: 0.4399
 epoch: 53, train_loss: 0.9659, test_loss: 0.9963, test_f1: 0.4646
 epoch: 54, train_loss: 0.9594, test_loss: 1.0067, test_f1: 0.4444
 epoch: 55, train_loss: 0.9659, test_loss: 1.0123, test_f1: 0.4492
 epoch: 56, train_loss: 0.9516, test_loss: 1.0313, test_f1: 0.4588
 epoch: 57, train_loss: 0.9532, test_loss: 1.0185, test_f1: 0.4455
 epoch: 58, train_loss: 0.9604, test_loss: 1.0254, test_f1: 0.4444
 epoch: 59, train_loss: 0.9482, test_loss: 1.0188, test_f1: 0.4440
 epoch: 60, train_loss: 0.9587, test_loss: 1.0101, test_f1: 0.4341
 epoch: 61, train_loss: 0.9607, test_loss: 1.0170, test_f1: 0.4484
 epoch: 62, train_loss: 0.9488, test_loss: 1.0198, test_f1: 0.4393
 epoch: 63, train_loss: 0.9396, test_loss: 1.0340, test_f1: 0.4389
 epoch: 64, train_loss: 0.9541, test_loss: 1.0125, test_f1: 0.4436
 epoch: 65, train_loss: 0.9385, test_loss: 1.0131, test_f1: 0.4467
 epoch: 66, train_loss: 0.9483, test_loss: 1.0174, test_f1: 0.4448
 epoch: 67, train_loss: 0.9363, test_loss: 1.0609, test_f1: 0.4375
 epoch: 68, train_loss: 0.9432, test_loss: 1.0160, test_f1: 0.4478
 epoch: 69, train_loss: 0.9393, test_loss: 1.0550, test_f1: 0.4394
 epoch: 70, train_loss: 0.9436, test_loss: 1.0584, test_f1: 0.4262
 epoch: 71, train_loss: 0.9314, test_loss: 1.0281, test_f1: 0.4421
 epoch: 72, train_loss: 0.9338, test_loss: 1.0841, test_f1: 0.4393
 epoch: 73, train_loss: 0.9372, test_loss: 1.0636, test_f1: 0.4588
 epoch: 74, train_loss: 0.9339, test_loss: 1.0241, test_f1: 0.4496
 epoch: 75, train_loss: 0.9166, test_loss: 1.0397, test_f1: 0.4447
 epoch: 76, train_loss: 0.9386, test_loss: 1.0772, test_f1: 0.4425
 epoch: 77, train_loss: 0.9279, test_loss: 1.0175, test_f1: 0.4487
 epoch: 78, train_loss: 0.9237, test_loss: 1.0297, test_f1: 0.4445
 epoch: 79, train_loss: 0.9337, test_loss: 1.0653, test_f1: 0.4427
 epoch: 80, train_loss: 0.9130, test_loss: 1.0180, test_f1: 0.4491
 epoch: 81, train_loss: 0.9211, test_loss: 1.0593, test_f1: 0.4499
 epoch: 82, train_loss: 0.9228, test_loss: 1.0290, test_f1: 0.4447
 epoch: 83, train_loss: 0.9234, test_loss: 1.0735, test_f1: 0.4471
 epoch: 84, train_loss: 0.9250, test_loss: 1.0350, test_f1: 0.4534
 epoch: 85, train_loss: 0.9233, test_loss: 1.0366, test_f1: 0.4612
 epoch: 86, train_loss: 0.9193, test_loss: 1.0279, test_f1: 0.4814
 epoch: 87, train_loss: 0.9095, test_loss: 1.0630, test_f1: 0.4549
 epoch: 88, train_loss: 0.9203, test_loss: 1.0575, test_f1: 0.4509
 epoch: 89, train_loss: 0.9154, test_loss: 1.0814, test_f1: 0.4509
 epoch: 90, train_loss: 0.9025, test_loss: 1.0638, test_f1: 0.4573
 epoch: 91, train_loss: 0.9085, test_loss: 1.0456, test_f1: 0.4579
 epoch: 92, train_loss: 0.9032, test_loss: 1.0480, test_f1: 0.4564
 epoch: 93, train_loss: 0.8990, test_loss: 1.0337, test_f1: 0.4559
 epoch: 94, train_loss: 0.9097, test_loss: 1.0211, test_f1: 0.4555
 epoch: 95, train_loss: 0.9133, test_loss: 1.0415, test_f1: 0.4514
 epoch: 96, train_loss: 0.9085, test_loss: 1.0468, test_f1: 0.4491
 epoch: 97, train_loss: 0.9037, test_loss: 1.0368, test_f1: 0.4588
 epoch: 98, train_loss: 0.8990, test_loss: 1.0713, test_f1: 0.4474
 epoch: 99, train_loss: 0.9079, test_loss: 1.0330, test_f1: 0.4575
##################ITERATION #5 ****************************************
 epoch: 0, train_loss: 1.3732, test_loss: 1.3234, test_f1: 0.2274
 epoch: 1, train_loss: 1.2664, test_loss: 1.2734, test_f1: 0.2487
 epoch: 2, train_loss: 1.2425, test_loss: 1.2355, test_f1: 0.2978
 epoch: 3, train_loss: 1.2338, test_loss: 1.2141, test_f1: 0.3056
 epoch: 4, train_loss: 1.2055, test_loss: 1.2074, test_f1: 0.3610
 epoch: 5, train_loss: 1.2130, test_loss: 1.1906, test_f1: 0.3611
 epoch: 6, train_loss: 1.1946, test_loss: 1.1723, test_f1: 0.3821
 epoch: 7, train_loss: 1.1885, test_loss: 1.1575, test_f1: 0.3978
 epoch: 8, train_loss: 1.1775, test_loss: 1.1462, test_f1: 0.4121
 epoch: 9, train_loss: 1.1658, test_loss: 1.1314, test_f1: 0.4077
 epoch: 10, train_loss: 1.1554, test_loss: 1.1211, test_f1: 0.4174
 epoch: 11, train_loss: 1.1500, test_loss: 1.1068, test_f1: 0.4330
 epoch: 12, train_loss: 1.1388, test_loss: 1.0944, test_f1: 0.4344
 epoch: 13, train_loss: 1.1311, test_loss: 1.0780, test_f1: 0.4451
 epoch: 14, train_loss: 1.1202, test_loss: 1.0696, test_f1: 0.4742
 epoch: 15, train_loss: 1.1173, test_loss: 1.0520, test_f1: 0.4695
 epoch: 16, train_loss: 1.1077, test_loss: 1.0559, test_f1: 0.4643
 epoch: 17, train_loss: 1.1051, test_loss: 1.0406, test_f1: 0.4693
 epoch: 18, train_loss: 1.0922, test_loss: 1.0462, test_f1: 0.4806
 epoch: 19, train_loss: 1.0814, test_loss: 1.0324, test_f1: 0.4517
 epoch: 20, train_loss: 1.0750, test_loss: 1.0113, test_f1: 0.4858
 epoch: 21, train_loss: 1.0677, test_loss: 1.0152, test_f1: 0.4622
 epoch: 22, train_loss: 1.0669, test_loss: 1.0372, test_f1: 0.4527
 epoch: 23, train_loss: 1.0525, test_loss: 1.0091, test_f1: 0.4730
 epoch: 24, train_loss: 1.0530, test_loss: 0.9951, test_f1: 0.4848
 epoch: 25, train_loss: 1.0338, test_loss: 0.9855, test_f1: 0.4725
 epoch: 26, train_loss: 1.0343, test_loss: 1.0006, test_f1: 0.4834
 epoch: 27, train_loss: 1.0364, test_loss: 0.9875, test_f1: 0.4765
 epoch: 28, train_loss: 1.0278, test_loss: 0.9927, test_f1: 0.4862
 epoch: 29, train_loss: 1.0076, test_loss: 0.9743, test_f1: 0.4671
 epoch: 30, train_loss: 1.0132, test_loss: 0.9958, test_f1: 0.4682
 epoch: 31, train_loss: 1.0020, test_loss: 0.9977, test_f1: 0.4681
 epoch: 32, train_loss: 1.0031, test_loss: 0.9801, test_f1: 0.4801
 epoch: 33, train_loss: 1.0011, test_loss: 1.0202, test_f1: 0.4764
 epoch: 34, train_loss: 0.9987, test_loss: 1.0266, test_f1: 0.4723
 epoch: 35, train_loss: 0.9989, test_loss: 0.9683, test_f1: 0.4887
 epoch: 36, train_loss: 0.9844, test_loss: 0.9766, test_f1: 0.4851
 epoch: 37, train_loss: 0.9873, test_loss: 0.9896, test_f1: 0.4632
 epoch: 38, train_loss: 0.9971, test_loss: 0.9880, test_f1: 0.4675
 epoch: 39, train_loss: 0.9768, test_loss: 0.9891, test_f1: 0.4716
 epoch: 40, train_loss: 0.9723, test_loss: 0.9626, test_f1: 0.4859
 epoch: 41, train_loss: 0.9660, test_loss: 0.9971, test_f1: 0.4768
 epoch: 42, train_loss: 0.9719, test_loss: 1.0087, test_f1: 0.4802
 epoch: 43, train_loss: 0.9647, test_loss: 1.0005, test_f1: 0.4896
 epoch: 44, train_loss: 0.9625, test_loss: 1.0280, test_f1: 0.4757
 epoch: 45, train_loss: 0.9574, test_loss: 0.9766, test_f1: 0.4933
 epoch: 46, train_loss: 0.9550, test_loss: 0.9986, test_f1: 0.4761
 epoch: 47, train_loss: 0.9606, test_loss: 0.9822, test_f1: 0.4903
 epoch: 48, train_loss: 0.9436, test_loss: 0.9814, test_f1: 0.4947
 epoch: 49, train_loss: 0.9444, test_loss: 0.9809, test_f1: 0.4862
 epoch: 50, train_loss: 0.9422, test_loss: 1.0139, test_f1: 0.4782
 epoch: 51, train_loss: 0.9311, test_loss: 0.9766, test_f1: 0.4975
 epoch: 52, train_loss: 0.9266, test_loss: 0.9832, test_f1: 0.4970
 epoch: 53, train_loss: 0.9284, test_loss: 0.9802, test_f1: 0.4985
 epoch: 54, train_loss: 0.9297, test_loss: 0.9672, test_f1: 0.5049
 epoch: 55, train_loss: 0.9166, test_loss: 1.0055, test_f1: 0.4911
 epoch: 56, train_loss: 0.9271, test_loss: 1.0089, test_f1: 0.4834
 epoch: 57, train_loss: 0.9183, test_loss: 0.9804, test_f1: 0.4944
 epoch: 58, train_loss: 0.9273, test_loss: 1.0119, test_f1: 0.4857
 epoch: 59, train_loss: 0.9287, test_loss: 0.9842, test_f1: 0.4954
 epoch: 60, train_loss: 0.9249, test_loss: 1.0108, test_f1: 0.4851
 epoch: 61, train_loss: 0.9202, test_loss: 0.9931, test_f1: 0.4943
 epoch: 62, train_loss: 0.9249, test_loss: 1.0030, test_f1: 0.4945
 epoch: 63, train_loss: 0.9131, test_loss: 0.9955, test_f1: 0.4862
 epoch: 64, train_loss: 0.9052, test_loss: 0.9996, test_f1: 0.4949
 epoch: 65, train_loss: 0.9118, test_loss: 1.0093, test_f1: 0.4937
 epoch: 66, train_loss: 0.9074, test_loss: 1.0257, test_f1: 0.4976
 epoch: 67, train_loss: 0.9129, test_loss: 1.0138, test_f1: 0.4896
 epoch: 68, train_loss: 0.9127, test_loss: 0.9880, test_f1: 0.4971
 epoch: 69, train_loss: 0.8949, test_loss: 1.0234, test_f1: 0.4891
 epoch: 70, train_loss: 0.9033, test_loss: 1.0160, test_f1: 0.4860
 epoch: 71, train_loss: 0.9079, test_loss: 1.0281, test_f1: 0.4772
 epoch: 72, train_loss: 0.9129, test_loss: 0.9931, test_f1: 0.4891
 epoch: 73, train_loss: 0.9071, test_loss: 1.0077, test_f1: 0.4904
 epoch: 74, train_loss: 0.8930, test_loss: 1.0006, test_f1: 0.5028
 epoch: 75, train_loss: 0.8873, test_loss: 1.0278, test_f1: 0.4938
 epoch: 76, train_loss: 0.9085, test_loss: 1.0159, test_f1: 0.4815
 epoch: 77, train_loss: 0.8892, test_loss: 1.0503, test_f1: 0.4799
 epoch: 78, train_loss: 0.8989, test_loss: 1.0381, test_f1: 0.4817
 epoch: 79, train_loss: 0.8980, test_loss: 1.0046, test_f1: 0.4911
 epoch: 80, train_loss: 0.8749, test_loss: 1.0109, test_f1: 0.4865
 epoch: 81, train_loss: 0.8971, test_loss: 1.0346, test_f1: 0.4795
 epoch: 82, train_loss: 0.8840, test_loss: 1.0489, test_f1: 0.4721
 epoch: 83, train_loss: 0.8782, test_loss: 1.0559, test_f1: 0.4770
 epoch: 84, train_loss: 0.8775, test_loss: 1.0458, test_f1: 0.4855
 epoch: 85, train_loss: 0.8846, test_loss: 1.0445, test_f1: 0.4811
 epoch: 86, train_loss: 0.8884, test_loss: 1.0588, test_f1: 0.4907
 epoch: 87, train_loss: 0.8885, test_loss: 1.0030, test_f1: 0.4840
 epoch: 88, train_loss: 0.8892, test_loss: 1.0348, test_f1: 0.4794
 epoch: 89, train_loss: 0.8710, test_loss: 1.0634, test_f1: 0.5145
 epoch: 90, train_loss: 0.8866, test_loss: 1.0189, test_f1: 0.4940
 epoch: 91, train_loss: 0.8812, test_loss: 1.0209, test_f1: 0.5007
 epoch: 92, train_loss: 0.8869, test_loss: 1.0402, test_f1: 0.4919
 epoch: 93, train_loss: 0.8752, test_loss: 1.0374, test_f1: 0.4706
 epoch: 94, train_loss: 0.8690, test_loss: 1.0532, test_f1: 0.4983
 epoch: 95, train_loss: 0.8766, test_loss: 1.0483, test_f1: 0.4794
 epoch: 96, train_loss: 0.8713, test_loss: 1.0822, test_f1: 0.4787
 epoch: 97, train_loss: 0.8710, test_loss: 1.1059, test_f1: 0.4886
 epoch: 98, train_loss: 0.8748, test_loss: 1.0324, test_f1: 0.5125
 epoch: 99, train_loss: 0.8713, test_loss: 1.0537, test_f1: 0.4807
##################ITERATION #6 ****************************************
 epoch: 0, train_loss: 1.4031, test_loss: 1.3227, test_f1: 0.2274
 epoch: 1, train_loss: 1.2934, test_loss: 1.2784, test_f1: 0.2360
 epoch: 2, train_loss: 1.2720, test_loss: 1.2515, test_f1: 0.2494
 epoch: 3, train_loss: 1.2522, test_loss: 1.2350, test_f1: 0.3243
 epoch: 4, train_loss: 1.2516, test_loss: 1.2253, test_f1: 0.3375
 epoch: 5, train_loss: 1.2412, test_loss: 1.2085, test_f1: 0.3557
 epoch: 6, train_loss: 1.2213, test_loss: 1.1917, test_f1: 0.3928
 epoch: 7, train_loss: 1.2192, test_loss: 1.1770, test_f1: 0.4388
 epoch: 8, train_loss: 1.2078, test_loss: 1.1717, test_f1: 0.3870
 epoch: 9, train_loss: 1.1904, test_loss: 1.1455, test_f1: 0.4247
 epoch: 10, train_loss: 1.1896, test_loss: 1.1371, test_f1: 0.3968
 epoch: 11, train_loss: 1.1733, test_loss: 1.1257, test_f1: 0.4176
 epoch: 12, train_loss: 1.1647, test_loss: 1.1004, test_f1: 0.4427
 epoch: 13, train_loss: 1.1529, test_loss: 1.0910, test_f1: 0.4357
 epoch: 14, train_loss: 1.1432, test_loss: 1.0731, test_f1: 0.4375
 epoch: 15, train_loss: 1.1364, test_loss: 1.0683, test_f1: 0.4393
 epoch: 16, train_loss: 1.1403, test_loss: 1.0701, test_f1: 0.4430
 epoch: 17, train_loss: 1.1252, test_loss: 1.0459, test_f1: 0.4660
 epoch: 18, train_loss: 1.1129, test_loss: 1.0473, test_f1: 0.4577
 epoch: 19, train_loss: 1.0985, test_loss: 1.0427, test_f1: 0.4486
 epoch: 20, train_loss: 1.1141, test_loss: 1.0385, test_f1: 0.4466
 epoch: 21, train_loss: 1.0932, test_loss: 1.0437, test_f1: 0.4408
 epoch: 22, train_loss: 1.1004, test_loss: 1.0197, test_f1: 0.4534
 epoch: 23, train_loss: 1.0814, test_loss: 1.0175, test_f1: 0.4514
 epoch: 24, train_loss: 1.0789, test_loss: 1.0216, test_f1: 0.4543
 epoch: 25, train_loss: 1.0750, test_loss: 1.0188, test_f1: 0.4420
 epoch: 26, train_loss: 1.0740, test_loss: 0.9983, test_f1: 0.4848
 epoch: 27, train_loss: 1.0651, test_loss: 0.9957, test_f1: 0.4516
 epoch: 28, train_loss: 1.0650, test_loss: 1.0037, test_f1: 0.4508
 epoch: 29, train_loss: 1.0505, test_loss: 0.9862, test_f1: 0.4750
 epoch: 30, train_loss: 1.0602, test_loss: 0.9917, test_f1: 0.4670
 epoch: 31, train_loss: 1.0339, test_loss: 0.9924, test_f1: 0.4614
 epoch: 32, train_loss: 1.0361, test_loss: 0.9888, test_f1: 0.4661
 epoch: 33, train_loss: 1.0402, test_loss: 0.9832, test_f1: 0.4787
 epoch: 34, train_loss: 1.0415, test_loss: 0.9739, test_f1: 0.4917
 epoch: 35, train_loss: 1.0273, test_loss: 0.9635, test_f1: 0.4727
 epoch: 36, train_loss: 1.0130, test_loss: 0.9719, test_f1: 0.4550
 epoch: 37, train_loss: 1.0232, test_loss: 0.9730, test_f1: 0.4482
 epoch: 38, train_loss: 1.0267, test_loss: 0.9573, test_f1: 0.4615
 epoch: 39, train_loss: 1.0081, test_loss: 0.9446, test_f1: 0.4694
 epoch: 40, train_loss: 1.0135, test_loss: 0.9579, test_f1: 0.4758
 epoch: 41, train_loss: 1.0040, test_loss: 0.9452, test_f1: 0.4808
 epoch: 42, train_loss: 0.9894, test_loss: 0.9391, test_f1: 0.4760
 epoch: 43, train_loss: 0.9960, test_loss: 0.9539, test_f1: 0.4631
 epoch: 44, train_loss: 0.9923, test_loss: 0.9473, test_f1: 0.4798
 epoch: 45, train_loss: 0.9928, test_loss: 0.9521, test_f1: 0.4552
 epoch: 46, train_loss: 0.9803, test_loss: 0.9434, test_f1: 0.4683
 epoch: 47, train_loss: 0.9851, test_loss: 0.9376, test_f1: 0.4800
 epoch: 48, train_loss: 0.9771, test_loss: 0.9255, test_f1: 0.4830
 epoch: 49, train_loss: 0.9809, test_loss: 0.9481, test_f1: 0.4749
 epoch: 50, train_loss: 0.9798, test_loss: 0.9303, test_f1: 0.4768
 epoch: 51, train_loss: 0.9724, test_loss: 0.9426, test_f1: 0.4636
 epoch: 52, train_loss: 0.9730, test_loss: 0.9366, test_f1: 0.4742
 epoch: 53, train_loss: 0.9564, test_loss: 0.9314, test_f1: 0.4764
 epoch: 54, train_loss: 0.9513, test_loss: 0.9289, test_f1: 0.4807
 epoch: 55, train_loss: 0.9612, test_loss: 0.9388, test_f1: 0.4747
 epoch: 56, train_loss: 0.9553, test_loss: 0.9258, test_f1: 0.4829
 epoch: 57, train_loss: 0.9639, test_loss: 0.9311, test_f1: 0.4761
 epoch: 58, train_loss: 0.9522, test_loss: 0.9282, test_f1: 0.4814
 epoch: 59, train_loss: 0.9526, test_loss: 0.9236, test_f1: 0.4768
 epoch: 60, train_loss: 0.9434, test_loss: 0.9100, test_f1: 0.4873
 epoch: 61, train_loss: 0.9549, test_loss: 0.9168, test_f1: 0.4848
 epoch: 62, train_loss: 0.9494, test_loss: 0.9237, test_f1: 0.4670
 epoch: 63, train_loss: 0.9446, test_loss: 0.9245, test_f1: 0.4723
 epoch: 64, train_loss: 0.9506, test_loss: 0.9334, test_f1: 0.4763
 epoch: 65, train_loss: 0.9523, test_loss: 0.9191, test_f1: 0.4805
 epoch: 66, train_loss: 0.9401, test_loss: 0.9156, test_f1: 0.4775
 epoch: 67, train_loss: 0.9443, test_loss: 0.9180, test_f1: 0.4839
 epoch: 68, train_loss: 0.9452, test_loss: 0.9169, test_f1: 0.4818
 epoch: 69, train_loss: 0.9474, test_loss: 0.9264, test_f1: 0.4741
 epoch: 70, train_loss: 0.9361, test_loss: 0.9396, test_f1: 0.4735
 epoch: 71, train_loss: 0.9324, test_loss: 0.9259, test_f1: 0.4999
 epoch: 72, train_loss: 0.9383, test_loss: 0.9171, test_f1: 0.4775
 epoch: 73, train_loss: 0.9270, test_loss: 0.9302, test_f1: 0.4713
 epoch: 74, train_loss: 0.9266, test_loss: 0.9379, test_f1: 0.4786
 epoch: 75, train_loss: 0.9289, test_loss: 0.9409, test_f1: 0.4773
 epoch: 76, train_loss: 0.9351, test_loss: 0.9242, test_f1: 0.4809
 epoch: 77, train_loss: 0.9298, test_loss: 0.9099, test_f1: 0.4906
 epoch: 78, train_loss: 0.9302, test_loss: 0.9280, test_f1: 0.4801
 epoch: 79, train_loss: 0.9196, test_loss: 0.9230, test_f1: 0.4775
 epoch: 80, train_loss: 0.9303, test_loss: 0.9358, test_f1: 0.4805
 epoch: 81, train_loss: 0.9215, test_loss: 0.9131, test_f1: 0.5036
 epoch: 82, train_loss: 0.9206, test_loss: 0.9327, test_f1: 0.4901
 epoch: 83, train_loss: 0.9211, test_loss: 0.9215, test_f1: 0.4853
 epoch: 84, train_loss: 0.9236, test_loss: 0.9332, test_f1: 0.4844
 epoch: 85, train_loss: 0.9215, test_loss: 0.9189, test_f1: 0.4949
 epoch: 86, train_loss: 0.9146, test_loss: 0.9283, test_f1: 0.4820
 epoch: 87, train_loss: 0.9263, test_loss: 0.9358, test_f1: 0.4837
 epoch: 88, train_loss: 0.9146, test_loss: 0.9345, test_f1: 0.4877
 epoch: 89, train_loss: 0.9074, test_loss: 0.9312, test_f1: 0.4861
 epoch: 90, train_loss: 0.9101, test_loss: 0.9523, test_f1: 0.4887
 epoch: 91, train_loss: 0.9122, test_loss: 0.9257, test_f1: 0.4804
 epoch: 92, train_loss: 0.9116, test_loss: 0.9382, test_f1: 0.5042
 epoch: 93, train_loss: 0.9043, test_loss: 0.9384, test_f1: 0.4897
 epoch: 94, train_loss: 0.9187, test_loss: 0.9336, test_f1: 0.4898
 epoch: 95, train_loss: 0.9225, test_loss: 0.9358, test_f1: 0.4790
 epoch: 96, train_loss: 0.9000, test_loss: 0.9286, test_f1: 0.5163
 epoch: 97, train_loss: 0.9032, test_loss: 0.9226, test_f1: 0.4968
 epoch: 98, train_loss: 0.9096, test_loss: 0.9305, test_f1: 0.4949
 epoch: 99, train_loss: 0.9032, test_loss: 0.9197, test_f1: 0.4869
##################ITERATION #7 ****************************************
 epoch: 0, train_loss: 1.4078, test_loss: 1.3276, test_f1: 0.2554
 epoch: 1, train_loss: 1.2770, test_loss: 1.2670, test_f1: 0.2607
 epoch: 2, train_loss: 1.2623, test_loss: 1.2141, test_f1: 0.3339
 epoch: 3, train_loss: 1.2501, test_loss: 1.1970, test_f1: 0.3421
 epoch: 4, train_loss: 1.2386, test_loss: 1.1935, test_f1: 0.3312
 epoch: 5, train_loss: 1.2301, test_loss: 1.1911, test_f1: 0.3512
 epoch: 6, train_loss: 1.2282, test_loss: 1.1827, test_f1: 0.3735
 epoch: 7, train_loss: 1.2178, test_loss: 1.1750, test_f1: 0.3668
 epoch: 8, train_loss: 1.2218, test_loss: 1.1766, test_f1: 0.3910
 epoch: 9, train_loss: 1.2030, test_loss: 1.1723, test_f1: 0.3759
 epoch: 10, train_loss: 1.2053, test_loss: 1.1672, test_f1: 0.3771
 epoch: 11, train_loss: 1.1891, test_loss: 1.1372, test_f1: 0.4155
 epoch: 12, train_loss: 1.1924, test_loss: 1.1436, test_f1: 0.3872
 epoch: 13, train_loss: 1.1809, test_loss: 1.1332, test_f1: 0.4047
 epoch: 14, train_loss: 1.1809, test_loss: 1.1311, test_f1: 0.4092
 epoch: 15, train_loss: 1.1625, test_loss: 1.1177, test_f1: 0.4188
 epoch: 16, train_loss: 1.1566, test_loss: 1.1047, test_f1: 0.4236
 epoch: 17, train_loss: 1.1492, test_loss: 1.0965, test_f1: 0.4222
 epoch: 18, train_loss: 1.1424, test_loss: 1.0820, test_f1: 0.4340
 epoch: 19, train_loss: 1.1363, test_loss: 1.0780, test_f1: 0.4356
 epoch: 20, train_loss: 1.1385, test_loss: 1.0860, test_f1: 0.4299
 epoch: 21, train_loss: 1.1287, test_loss: 1.0674, test_f1: 0.4362
 epoch: 22, train_loss: 1.1330, test_loss: 1.0575, test_f1: 0.4498
 epoch: 23, train_loss: 1.1212, test_loss: 1.0485, test_f1: 0.4741
 epoch: 24, train_loss: 1.1106, test_loss: 1.0581, test_f1: 0.4363
 epoch: 25, train_loss: 1.1071, test_loss: 1.0399, test_f1: 0.4448
 epoch: 26, train_loss: 1.0969, test_loss: 1.0339, test_f1: 0.4690
 epoch: 27, train_loss: 1.0867, test_loss: 1.0239, test_f1: 0.4500
 epoch: 28, train_loss: 1.0885, test_loss: 1.0207, test_f1: 0.4571
 epoch: 29, train_loss: 1.0834, test_loss: 1.0287, test_f1: 0.4547
 epoch: 30, train_loss: 1.0778, test_loss: 1.0132, test_f1: 0.4622
 epoch: 31, train_loss: 1.0771, test_loss: 1.0113, test_f1: 0.4678
 epoch: 32, train_loss: 1.0702, test_loss: 0.9889, test_f1: 0.4693
 epoch: 33, train_loss: 1.0594, test_loss: 0.9972, test_f1: 0.4700
 epoch: 34, train_loss: 1.0624, test_loss: 0.9865, test_f1: 0.4738
 epoch: 35, train_loss: 1.0664, test_loss: 0.9706, test_f1: 0.4780
 epoch: 36, train_loss: 1.0476, test_loss: 0.9824, test_f1: 0.4868
 epoch: 37, train_loss: 1.0479, test_loss: 0.9753, test_f1: 0.4691
 epoch: 38, train_loss: 1.0291, test_loss: 0.9709, test_f1: 0.4763
 epoch: 39, train_loss: 1.0347, test_loss: 0.9586, test_f1: 0.4742
 epoch: 40, train_loss: 1.0355, test_loss: 0.9475, test_f1: 0.4771
 epoch: 41, train_loss: 1.0121, test_loss: 0.9492, test_f1: 0.4663
 epoch: 42, train_loss: 1.0204, test_loss: 0.9407, test_f1: 0.4793
 epoch: 43, train_loss: 1.0218, test_loss: 0.9405, test_f1: 0.4895
 epoch: 44, train_loss: 1.0117, test_loss: 0.9334, test_f1: 0.4992
 epoch: 45, train_loss: 1.0091, test_loss: 0.9511, test_f1: 0.4738
 epoch: 46, train_loss: 1.0072, test_loss: 0.9435, test_f1: 0.4855
 epoch: 47, train_loss: 0.9928, test_loss: 0.9335, test_f1: 0.4760
 epoch: 48, train_loss: 0.9982, test_loss: 0.9191, test_f1: 0.4728
 epoch: 49, train_loss: 0.9904, test_loss: 0.9232, test_f1: 0.5008
 epoch: 50, train_loss: 0.9895, test_loss: 0.9281, test_f1: 0.4918
 epoch: 51, train_loss: 0.9981, test_loss: 0.9244, test_f1: 0.4885
 epoch: 52, train_loss: 0.9778, test_loss: 0.9135, test_f1: 0.4842
 epoch: 53, train_loss: 0.9779, test_loss: 0.9145, test_f1: 0.4900
 epoch: 54, train_loss: 0.9725, test_loss: 0.9274, test_f1: 0.4859
 epoch: 55, train_loss: 0.9750, test_loss: 0.9347, test_f1: 0.4855
 epoch: 56, train_loss: 0.9885, test_loss: 0.9015, test_f1: 0.4904
 epoch: 57, train_loss: 0.9687, test_loss: 0.9040, test_f1: 0.4928
 epoch: 58, train_loss: 0.9694, test_loss: 0.9011, test_f1: 0.4956
 epoch: 59, train_loss: 0.9691, test_loss: 0.9047, test_f1: 0.5103
 epoch: 60, train_loss: 0.9680, test_loss: 0.8982, test_f1: 0.4898
 epoch: 61, train_loss: 0.9758, test_loss: 0.9052, test_f1: 0.5048
 epoch: 62, train_loss: 0.9647, test_loss: 0.9239, test_f1: 0.4989
 epoch: 63, train_loss: 0.9735, test_loss: 0.9058, test_f1: 0.4842
 epoch: 64, train_loss: 0.9747, test_loss: 0.9082, test_f1: 0.4987
 epoch: 65, train_loss: 0.9633, test_loss: 0.9179, test_f1: 0.4984
 epoch: 66, train_loss: 0.9594, test_loss: 0.9063, test_f1: 0.4976
 epoch: 67, train_loss: 0.9579, test_loss: 0.8969, test_f1: 0.4972
 epoch: 68, train_loss: 0.9584, test_loss: 0.9086, test_f1: 0.4953
 epoch: 69, train_loss: 0.9571, test_loss: 0.8975, test_f1: 0.4985
 epoch: 70, train_loss: 0.9510, test_loss: 0.9033, test_f1: 0.5055
 epoch: 71, train_loss: 0.9624, test_loss: 0.9077, test_f1: 0.4937
 epoch: 72, train_loss: 0.9563, test_loss: 0.8974, test_f1: 0.5031
 epoch: 73, train_loss: 0.9555, test_loss: 0.9028, test_f1: 0.4917
 epoch: 74, train_loss: 0.9550, test_loss: 0.8978, test_f1: 0.4929
 epoch: 75, train_loss: 0.9320, test_loss: 0.9208, test_f1: 0.4921
 epoch: 76, train_loss: 0.9425, test_loss: 0.9124, test_f1: 0.5038
 epoch: 77, train_loss: 0.9433, test_loss: 0.9140, test_f1: 0.5008
 epoch: 78, train_loss: 0.9414, test_loss: 0.8974, test_f1: 0.5084
 epoch: 79, train_loss: 0.9504, test_loss: 0.9009, test_f1: 0.5087
 epoch: 80, train_loss: 0.9364, test_loss: 0.9398, test_f1: 0.4926
 epoch: 81, train_loss: 0.9333, test_loss: 0.9072, test_f1: 0.5076
 epoch: 82, train_loss: 0.9386, test_loss: 0.8934, test_f1: 0.5064
 epoch: 83, train_loss: 0.9490, test_loss: 0.9313, test_f1: 0.4879
 epoch: 84, train_loss: 0.9422, test_loss: 0.9201, test_f1: 0.5009
 epoch: 85, train_loss: 0.9419, test_loss: 0.9028, test_f1: 0.5121
 epoch: 86, train_loss: 0.9323, test_loss: 0.8978, test_f1: 0.5013
 epoch: 87, train_loss: 0.9422, test_loss: 0.8915, test_f1: 0.5054
 epoch: 88, train_loss: 0.9269, test_loss: 0.8912, test_f1: 0.5195
 epoch: 89, train_loss: 0.9375, test_loss: 0.8877, test_f1: 0.5096
 epoch: 90, train_loss: 0.9439, test_loss: 0.9507, test_f1: 0.5066
 epoch: 91, train_loss: 0.9385, test_loss: 0.8932, test_f1: 0.5024
 epoch: 92, train_loss: 0.9252, test_loss: 0.8950, test_f1: 0.5137
 epoch: 93, train_loss: 0.9304, test_loss: 0.9114, test_f1: 0.5035
 epoch: 94, train_loss: 0.9408, test_loss: 0.8937, test_f1: 0.5068
 epoch: 95, train_loss: 0.9369, test_loss: 0.9006, test_f1: 0.5017
 epoch: 96, train_loss: 0.9293, test_loss: 0.9054, test_f1: 0.5041
 epoch: 97, train_loss: 0.9278, test_loss: 0.8894, test_f1: 0.5151
 epoch: 98, train_loss: 0.9349, test_loss: 0.9230, test_f1: 0.4998
 epoch: 99, train_loss: 0.9221, test_loss: 0.8874, test_f1: 0.5120
##################ITERATION #8 ****************************************
 epoch: 0, train_loss: 1.8121, test_loss: 1.3446, test_f1: 0.2274
 epoch: 1, train_loss: 1.3811, test_loss: 1.2947, test_f1: 0.2301
 epoch: 2, train_loss: 1.3310, test_loss: 1.2687, test_f1: 0.2968
 epoch: 3, train_loss: 1.3059, test_loss: 1.2486, test_f1: 0.3217
 epoch: 4, train_loss: 1.2804, test_loss: 1.2267, test_f1: 0.3004
 epoch: 5, train_loss: 1.2644, test_loss: 1.2201, test_f1: 0.3171
 epoch: 6, train_loss: 1.2595, test_loss: 1.2100, test_f1: 0.3234
 epoch: 7, train_loss: 1.2348, test_loss: 1.1955, test_f1: 0.3371
 epoch: 8, train_loss: 1.2308, test_loss: 1.1972, test_f1: 0.3742
 epoch: 9, train_loss: 1.2255, test_loss: 1.1902, test_f1: 0.3795
 epoch: 10, train_loss: 1.2165, test_loss: 1.1764, test_f1: 0.3897
 epoch: 11, train_loss: 1.2181, test_loss: 1.1680, test_f1: 0.4068
 epoch: 12, train_loss: 1.1988, test_loss: 1.1545, test_f1: 0.4204
 epoch: 13, train_loss: 1.1848, test_loss: 1.1406, test_f1: 0.4147
 epoch: 14, train_loss: 1.1793, test_loss: 1.1390, test_f1: 0.4451
 epoch: 15, train_loss: 1.1753, test_loss: 1.1252, test_f1: 0.4518
 epoch: 16, train_loss: 1.1649, test_loss: 1.1074, test_f1: 0.4664
 epoch: 17, train_loss: 1.1635, test_loss: 1.1020, test_f1: 0.4652
 epoch: 18, train_loss: 1.1595, test_loss: 1.0925, test_f1: 0.4526
 epoch: 19, train_loss: 1.1461, test_loss: 1.0964, test_f1: 0.4541
 epoch: 20, train_loss: 1.1389, test_loss: 1.0796, test_f1: 0.4748
 epoch: 21, train_loss: 1.1209, test_loss: 1.0617, test_f1: 0.4668
 epoch: 22, train_loss: 1.1195, test_loss: 1.0535, test_f1: 0.4857
 epoch: 23, train_loss: 1.1195, test_loss: 1.0658, test_f1: 0.4621
 epoch: 24, train_loss: 1.1074, test_loss: 1.0343, test_f1: 0.4721
 epoch: 25, train_loss: 1.0924, test_loss: 1.0258, test_f1: 0.4682
 epoch: 26, train_loss: 1.0840, test_loss: 1.0225, test_f1: 0.4707
 epoch: 27, train_loss: 1.0861, test_loss: 1.0166, test_f1: 0.4742
 epoch: 28, train_loss: 1.0758, test_loss: 1.0070, test_f1: 0.4534
 epoch: 29, train_loss: 1.0736, test_loss: 1.0040, test_f1: 0.4697
 epoch: 30, train_loss: 1.0607, test_loss: 0.9859, test_f1: 0.4695
 epoch: 31, train_loss: 1.0665, test_loss: 0.9827, test_f1: 0.4709
 epoch: 32, train_loss: 1.0416, test_loss: 0.9749, test_f1: 0.4721
 epoch: 33, train_loss: 1.0353, test_loss: 0.9738, test_f1: 0.4746
 epoch: 34, train_loss: 1.0505, test_loss: 0.9674, test_f1: 0.4751
 epoch: 35, train_loss: 1.0442, test_loss: 0.9629, test_f1: 0.4791
 epoch: 36, train_loss: 1.0258, test_loss: 0.9594, test_f1: 0.4692
 epoch: 37, train_loss: 1.0232, test_loss: 0.9555, test_f1: 0.4578
 epoch: 38, train_loss: 1.0271, test_loss: 0.9334, test_f1: 0.4769
 epoch: 39, train_loss: 1.0229, test_loss: 0.9565, test_f1: 0.4749
 epoch: 40, train_loss: 1.0025, test_loss: 0.9406, test_f1: 0.4787
 epoch: 41, train_loss: 1.0064, test_loss: 0.9246, test_f1: 0.4893
 epoch: 42, train_loss: 1.0019, test_loss: 0.9314, test_f1: 0.4855
 epoch: 43, train_loss: 1.0037, test_loss: 0.9407, test_f1: 0.4842
 epoch: 44, train_loss: 0.9964, test_loss: 0.9214, test_f1: 0.4949
 epoch: 45, train_loss: 0.9958, test_loss: 0.9374, test_f1: 0.4903
 epoch: 46, train_loss: 0.9807, test_loss: 0.9195, test_f1: 0.4966
 epoch: 47, train_loss: 0.9827, test_loss: 0.9180, test_f1: 0.5081
 epoch: 48, train_loss: 0.9762, test_loss: 0.9084, test_f1: 0.5028
 epoch: 49, train_loss: 0.9713, test_loss: 0.8989, test_f1: 0.5054
 epoch: 50, train_loss: 0.9692, test_loss: 0.9066, test_f1: 0.4912
 epoch: 51, train_loss: 0.9696, test_loss: 0.9143, test_f1: 0.4982
 epoch: 52, train_loss: 0.9579, test_loss: 0.9011, test_f1: 0.5078
 epoch: 53, train_loss: 0.9663, test_loss: 0.8964, test_f1: 0.5037
 epoch: 54, train_loss: 0.9724, test_loss: 0.8968, test_f1: 0.5059
 epoch: 55, train_loss: 0.9614, test_loss: 0.9055, test_f1: 0.4953
 epoch: 56, train_loss: 0.9479, test_loss: 0.8958, test_f1: 0.5076
 epoch: 57, train_loss: 0.9537, test_loss: 0.8978, test_f1: 0.4998
 epoch: 58, train_loss: 0.9430, test_loss: 0.8929, test_f1: 0.5108
 epoch: 59, train_loss: 0.9514, test_loss: 0.9059, test_f1: 0.4926
 epoch: 60, train_loss: 0.9484, test_loss: 0.9001, test_f1: 0.4965
 epoch: 61, train_loss: 0.9371, test_loss: 0.9114, test_f1: 0.5041
 epoch: 62, train_loss: 0.9386, test_loss: 0.8981, test_f1: 0.4972
 epoch: 63, train_loss: 0.9510, test_loss: 0.8926, test_f1: 0.5026
 epoch: 64, train_loss: 0.9479, test_loss: 0.9023, test_f1: 0.5024
 epoch: 65, train_loss: 0.9329, test_loss: 0.8975, test_f1: 0.5049
 epoch: 66, train_loss: 0.9320, test_loss: 0.9147, test_f1: 0.4952
 epoch: 67, train_loss: 0.9363, test_loss: 0.8952, test_f1: 0.4914
 epoch: 68, train_loss: 0.9396, test_loss: 0.8928, test_f1: 0.5017
 epoch: 69, train_loss: 0.9294, test_loss: 0.9013, test_f1: 0.4970
 epoch: 70, train_loss: 0.9343, test_loss: 0.9038, test_f1: 0.4930
 epoch: 71, train_loss: 0.9268, test_loss: 0.9016, test_f1: 0.4962
 epoch: 72, train_loss: 0.9208, test_loss: 0.9100, test_f1: 0.4942
 epoch: 73, train_loss: 0.9280, test_loss: 0.9059, test_f1: 0.4923
 epoch: 74, train_loss: 0.9292, test_loss: 0.9142, test_f1: 0.4848
 epoch: 75, train_loss: 0.9225, test_loss: 0.8980, test_f1: 0.4811
 epoch: 76, train_loss: 0.9114, test_loss: 0.9147, test_f1: 0.4908
 epoch: 77, train_loss: 0.9330, test_loss: 0.8999, test_f1: 0.4897
 epoch: 78, train_loss: 0.9242, test_loss: 0.9247, test_f1: 0.4779
 epoch: 79, train_loss: 0.9272, test_loss: 0.9115, test_f1: 0.4953
 epoch: 80, train_loss: 0.9224, test_loss: 0.9121, test_f1: 0.4918
 epoch: 81, train_loss: 0.9161, test_loss: 0.9100, test_f1: 0.4862
 epoch: 82, train_loss: 0.9154, test_loss: 0.9054, test_f1: 0.4902
 epoch: 83, train_loss: 0.9244, test_loss: 0.9146, test_f1: 0.4908
 epoch: 84, train_loss: 0.9148, test_loss: 0.9224, test_f1: 0.4972
 epoch: 85, train_loss: 0.9026, test_loss: 0.9113, test_f1: 0.4914
 epoch: 86, train_loss: 0.9054, test_loss: 0.9262, test_f1: 0.4837
 epoch: 87, train_loss: 0.9143, test_loss: 0.9306, test_f1: 0.4896
 epoch: 88, train_loss: 0.9212, test_loss: 0.9096, test_f1: 0.4906
 epoch: 89, train_loss: 0.8990, test_loss: 0.9090, test_f1: 0.4980
 epoch: 90, train_loss: 0.8963, test_loss: 0.9142, test_f1: 0.4927
 epoch: 91, train_loss: 0.9111, test_loss: 0.9265, test_f1: 0.4956
 epoch: 92, train_loss: 0.9087, test_loss: 0.9011, test_f1: 0.4923
 epoch: 93, train_loss: 0.9091, test_loss: 0.9205, test_f1: 0.4986
 epoch: 94, train_loss: 0.9019, test_loss: 0.9225, test_f1: 0.4928
 epoch: 95, train_loss: 0.8934, test_loss: 0.9327, test_f1: 0.4972
 epoch: 96, train_loss: 0.9032, test_loss: 0.9080, test_f1: 0.4973
 epoch: 97, train_loss: 0.8957, test_loss: 0.9146, test_f1: 0.4955
 epoch: 98, train_loss: 0.9064, test_loss: 0.9123, test_f1: 0.5019
 epoch: 99, train_loss: 0.8943, test_loss: 0.9243, test_f1: 0.4953
##################ITERATION #9 ****************************************
 epoch: 0, train_loss: 1.7928, test_loss: 1.3558, test_f1: 0.2667
 epoch: 1, train_loss: 1.3769, test_loss: 1.2769, test_f1: 0.2911
 epoch: 2, train_loss: 1.3237, test_loss: 1.2384, test_f1: 0.3142
 epoch: 3, train_loss: 1.2902, test_loss: 1.2192, test_f1: 0.3140
 epoch: 4, train_loss: 1.2604, test_loss: 1.1989, test_f1: 0.3378
 epoch: 5, train_loss: 1.2517, test_loss: 1.1916, test_f1: 0.3513
 epoch: 6, train_loss: 1.2348, test_loss: 1.1881, test_f1: 0.3486
 epoch: 7, train_loss: 1.2261, test_loss: 1.1886, test_f1: 0.3571
 epoch: 8, train_loss: 1.2226, test_loss: 1.1783, test_f1: 0.3729
 epoch: 9, train_loss: 1.2013, test_loss: 1.1638, test_f1: 0.3705
 epoch: 10, train_loss: 1.2044, test_loss: 1.1600, test_f1: 0.3903
 epoch: 11, train_loss: 1.2015, test_loss: 1.1451, test_f1: 0.3851
 epoch: 12, train_loss: 1.1880, test_loss: 1.1414, test_f1: 0.4029
 epoch: 13, train_loss: 1.1847, test_loss: 1.1287, test_f1: 0.3993
 epoch: 14, train_loss: 1.1706, test_loss: 1.1115, test_f1: 0.4223
 epoch: 15, train_loss: 1.1628, test_loss: 1.1033, test_f1: 0.4149
 epoch: 16, train_loss: 1.1585, test_loss: 1.0713, test_f1: 0.4304
 epoch: 17, train_loss: 1.1451, test_loss: 1.0740, test_f1: 0.4313
 epoch: 18, train_loss: 1.1282, test_loss: 1.0435, test_f1: 0.4523
 epoch: 19, train_loss: 1.1210, test_loss: 1.0211, test_f1: 0.4558
 epoch: 20, train_loss: 1.1065, test_loss: 1.0234, test_f1: 0.4602
 epoch: 21, train_loss: 1.0953, test_loss: 1.0100, test_f1: 0.4712
 epoch: 22, train_loss: 1.0902, test_loss: 0.9961, test_f1: 0.4774
 epoch: 23, train_loss: 1.0850, test_loss: 0.9845, test_f1: 0.4835
 epoch: 24, train_loss: 1.0756, test_loss: 0.9853, test_f1: 0.4709
 epoch: 25, train_loss: 1.0720, test_loss: 0.9838, test_f1: 0.4640
 epoch: 26, train_loss: 1.0696, test_loss: 0.9816, test_f1: 0.4858
 epoch: 27, train_loss: 1.0526, test_loss: 0.9695, test_f1: 0.4817
 epoch: 28, train_loss: 1.0491, test_loss: 0.9645, test_f1: 0.4655
 epoch: 29, train_loss: 1.0405, test_loss: 0.9679, test_f1: 0.4659
 epoch: 30, train_loss: 1.0395, test_loss: 0.9612, test_f1: 0.4848
 epoch: 31, train_loss: 1.0293, test_loss: 0.9691, test_f1: 0.4645
 epoch: 32, train_loss: 1.0236, test_loss: 0.9689, test_f1: 0.4771
 epoch: 33, train_loss: 1.0225, test_loss: 0.9636, test_f1: 0.4543
 epoch: 34, train_loss: 1.0149, test_loss: 0.9473, test_f1: 0.4729
 epoch: 35, train_loss: 1.0052, test_loss: 0.9470, test_f1: 0.4816
 epoch: 36, train_loss: 0.9923, test_loss: 0.9500, test_f1: 0.4735
 epoch: 37, train_loss: 0.9964, test_loss: 0.9237, test_f1: 0.4840
 epoch: 38, train_loss: 0.9970, test_loss: 0.9389, test_f1: 0.5026
 epoch: 39, train_loss: 0.9932, test_loss: 0.9379, test_f1: 0.4914
 epoch: 40, train_loss: 0.9784, test_loss: 0.9354, test_f1: 0.4949
 epoch: 41, train_loss: 0.9952, test_loss: 0.9313, test_f1: 0.5054
 epoch: 42, train_loss: 0.9826, test_loss: 0.9224, test_f1: 0.4970
 epoch: 43, train_loss: 0.9787, test_loss: 0.9416, test_f1: 0.4902
 epoch: 44, train_loss: 0.9789, test_loss: 0.9833, test_f1: 0.4591
 epoch: 45, train_loss: 0.9727, test_loss: 0.9728, test_f1: 0.4788
 epoch: 46, train_loss: 0.9724, test_loss: 0.9460, test_f1: 0.4829
 epoch: 47, train_loss: 0.9697, test_loss: 0.9546, test_f1: 0.4857
 epoch: 48, train_loss: 0.9711, test_loss: 0.9450, test_f1: 0.4677
 epoch: 49, train_loss: 0.9583, test_loss: 0.9570, test_f1: 0.4813
 epoch: 50, train_loss: 0.9644, test_loss: 0.9415, test_f1: 0.4722
 epoch: 51, train_loss: 0.9524, test_loss: 0.9358, test_f1: 0.4837
 epoch: 52, train_loss: 0.9559, test_loss: 0.9390, test_f1: 0.4705
 epoch: 53, train_loss: 0.9497, test_loss: 0.9601, test_f1: 0.4674
 epoch: 54, train_loss: 0.9480, test_loss: 0.9416, test_f1: 0.4834
 epoch: 55, train_loss: 0.9398, test_loss: 0.9564, test_f1: 0.4813
 epoch: 56, train_loss: 0.9477, test_loss: 0.9525, test_f1: 0.4723
 epoch: 57, train_loss: 0.9406, test_loss: 0.9553, test_f1: 0.4743
 epoch: 58, train_loss: 0.9436, test_loss: 0.9616, test_f1: 0.4842
 epoch: 59, train_loss: 0.9451, test_loss: 0.9386, test_f1: 0.4755
 epoch: 60, train_loss: 0.9374, test_loss: 0.9551, test_f1: 0.4791
 epoch: 61, train_loss: 0.9426, test_loss: 0.9732, test_f1: 0.4717
 epoch: 62, train_loss: 0.9293, test_loss: 0.9913, test_f1: 0.4757
 epoch: 63, train_loss: 0.9255, test_loss: 0.9516, test_f1: 0.4843
 epoch: 64, train_loss: 0.9361, test_loss: 0.9533, test_f1: 0.4796
 epoch: 65, train_loss: 0.9320, test_loss: 0.9791, test_f1: 0.4797
 epoch: 66, train_loss: 0.9210, test_loss: 1.0071, test_f1: 0.4746
 epoch: 67, train_loss: 0.9371, test_loss: 0.9850, test_f1: 0.4769
 epoch: 68, train_loss: 0.9237, test_loss: 0.9785, test_f1: 0.4826
 epoch: 69, train_loss: 0.9172, test_loss: 0.9790, test_f1: 0.4904
 epoch: 70, train_loss: 0.9184, test_loss: 0.9771, test_f1: 0.4938
 epoch: 71, train_loss: 0.9084, test_loss: 0.9843, test_f1: 0.4803
 epoch: 72, train_loss: 0.9244, test_loss: 0.9844, test_f1: 0.4774
 epoch: 73, train_loss: 0.9184, test_loss: 0.9689, test_f1: 0.4976
 epoch: 74, train_loss: 0.9140, test_loss: 0.9789, test_f1: 0.4860
 epoch: 75, train_loss: 0.9157, test_loss: 1.0094, test_f1: 0.4800
 epoch: 76, train_loss: 0.9038, test_loss: 1.0010, test_f1: 0.4865
 epoch: 77, train_loss: 0.9107, test_loss: 1.0091, test_f1: 0.4838
 epoch: 78, train_loss: 0.9147, test_loss: 0.9696, test_f1: 0.4922
 epoch: 79, train_loss: 0.9132, test_loss: 1.0211, test_f1: 0.4855
 epoch: 80, train_loss: 0.9224, test_loss: 0.9983, test_f1: 0.4835
 epoch: 81, train_loss: 0.9144, test_loss: 1.0161, test_f1: 0.4724
 epoch: 82, train_loss: 0.9045, test_loss: 1.0063, test_f1: 0.4888
 epoch: 83, train_loss: 0.9072, test_loss: 0.9942, test_f1: 0.4846
 epoch: 84, train_loss: 0.8959, test_loss: 0.9916, test_f1: 0.4977
 epoch: 85, train_loss: 0.9181, test_loss: 1.0211, test_f1: 0.4922
 epoch: 86, train_loss: 0.8931, test_loss: 1.0111, test_f1: 0.4880
 epoch: 87, train_loss: 0.9037, test_loss: 1.0291, test_f1: 0.4896
 epoch: 88, train_loss: 0.9101, test_loss: 1.0008, test_f1: 0.4883
 epoch: 89, train_loss: 0.9038, test_loss: 0.9992, test_f1: 0.4921
 epoch: 90, train_loss: 0.9014, test_loss: 0.9777, test_f1: 0.4877
 epoch: 91, train_loss: 0.9038, test_loss: 0.9786, test_f1: 0.4875
 epoch: 92, train_loss: 0.8969, test_loss: 0.9997, test_f1: 0.4919
 epoch: 93, train_loss: 0.8947, test_loss: 0.9717, test_f1: 0.4936
 epoch: 94, train_loss: 0.8939, test_loss: 0.9938, test_f1: 0.4889
 epoch: 95, train_loss: 0.9017, test_loss: 1.0184, test_f1: 0.4942
 epoch: 96, train_loss: 0.8861, test_loss: 1.0030, test_f1: 0.4883
 epoch: 97, train_loss: 0.9001, test_loss: 1.0193, test_f1: 0.4855
 epoch: 98, train_loss: 0.8868, test_loss: 1.0349, test_f1: 0.4855
 epoch: 99, train_loss: 0.8926, test_loss: 0.9774, test_f1: 0.5002

Training completed in 482.09 seconds
Best F1: 0.5279 at epoch 99
Mean F1 across iterations: 0.5078  0.0125
========================FINAL RESULTS================================
FEGIN weighted F1: 0.5279  0.0125
python main.py --data ltspice_examples --representation component_component --model FEGIN --layers 4 --hiddens 16 --batch_size 128 --lr 0.001 --emb_size 128 --epochs 100 --save_appendix component_component_L4_H16_BS128_LR0.001_E128 --no_val
-----



STDERR:
  File "main.py", line 370, in <module>
    main()
  File "main.py", line 254, in main
    dataset = dataset_class(
  File "/home/philip/projects/ltspice_examples_code_repo/Circuit-Completion-Using-GNNs/component_classification_with_link_prediction_head/evaluation/FEGIN/kernel/circuit_datasets.py", line 15, in __init__
    self.data, self.slices = torch.load(self.processed_paths[0])
  File "/home/philip/.local/lib/python3.8/site-packages/torch/serialization.py", line 1040, in load
    warnings.warn(
  File "/usr/lib/python3.8/warnings.py", line 109, in _showwarnmsg
    sw(msg.message, msg.category, msg.filename, msg.lineno,
  File "main.py", line 47, in warn_with_traceback
    traceback.print_stack(file=log)
/home/philip/projects/ltspice_examples_code_repo/Circuit-Completion-Using-GNNs/component_classification_with_link_prediction_head/evaluation/FEGIN/kernel/circuit_datasets.py:15: FutureWarning: You are using `torch.load` with `weights_only=False` (the current default value), which uses the default pickle module implicitly. It is possible to construct malicious pickle data which will execute arbitrary code during unpickling (See https://github.com/pytorch/pytorch/blob/main/SECURITY.md#untrusted-models for more details). In a future release, the default value for `weights_only` will be flipped to `True`. This limits the functions that could be executed during unpickling. Arbitrary objects will no longer be allowed to be loaded via this mode unless they are explicitly allowlisted by the user via `torch.serialization.add_safe_globals`. We recommend you start setting `weights_only=True` for any use case where you don't have full control of the loaded file. Please open an issue on GitHub for any issues related to this experimental feature.
  self.data, self.slices = torch.load(self.processed_paths[0])
