STDOUT:
Results will be saved in /home/philip/projects/ltspice_examples_code_repo/Circuit-Completion-Using-GNNs/component_classification_with_link_prediction_head/evaluation/FEGIN/results/model_FEGIN_dataset_ltspice_examples
Command line input: python main.py --data ltspice_examples --representation component_pin --model FEGIN --layers 3 --hiddens 32 --batch_size 128 --lr 0.01 --emb_size 128 --epochs 100 --save_appendix component_pin_L3_H32_BS128_LR0.01_E128 --no_val
 is saved.
-----
ltspice_examples - FEGIN
Using 3 layers, 32 hidden units, h = 2
Loading component_pin representation dataset
ENTERED
Training FEGIN on component_pin representation
Train: 3560, Test: 848
##################ITERATION #0 ****************************************
 epoch: 0, train_loss: 1.2491, test_loss: 1.3207, test_f1: 0.2260
 epoch: 1, train_loss: 1.1026, test_loss: 1.1295, test_f1: 0.3269
 epoch: 2, train_loss: 1.0235, test_loss: 1.0962, test_f1: 0.4311
 epoch: 3, train_loss: 0.9675, test_loss: 1.0833, test_f1: 0.4378
 epoch: 4, train_loss: 0.9309, test_loss: 1.1245, test_f1: 0.4735
 epoch: 5, train_loss: 0.9087, test_loss: 0.9743, test_f1: 0.4894
 epoch: 6, train_loss: 0.9125, test_loss: 0.9703, test_f1: 0.5227
 epoch: 7, train_loss: 0.8873, test_loss: 1.4033, test_f1: 0.3720
 epoch: 8, train_loss: 0.8678, test_loss: 0.9298, test_f1: 0.5259
 epoch: 9, train_loss: 0.8395, test_loss: 1.0539, test_f1: 0.4845
 epoch: 10, train_loss: 0.8570, test_loss: 0.8508, test_f1: 0.5320
 epoch: 11, train_loss: 0.8210, test_loss: 0.8432, test_f1: 0.5279
 epoch: 12, train_loss: 0.8130, test_loss: 0.8427, test_f1: 0.5477
 epoch: 13, train_loss: 0.8045, test_loss: 0.8671, test_f1: 0.5356
 epoch: 14, train_loss: 0.8327, test_loss: 0.9747, test_f1: 0.4779
 epoch: 15, train_loss: 0.8000, test_loss: 0.7900, test_f1: 0.5478
 epoch: 16, train_loss: 0.7924, test_loss: 0.8971, test_f1: 0.5266
 epoch: 17, train_loss: 0.7870, test_loss: 0.8975, test_f1: 0.5106
 epoch: 18, train_loss: 0.7808, test_loss: 1.0233, test_f1: 0.5010
 epoch: 19, train_loss: 0.7743, test_loss: 0.9061, test_f1: 0.5082
 epoch: 20, train_loss: 0.7690, test_loss: 0.8081, test_f1: 0.5398
 epoch: 21, train_loss: 0.7562, test_loss: 0.7896, test_f1: 0.5632
 epoch: 22, train_loss: 0.7420, test_loss: 0.8455, test_f1: 0.5603
 epoch: 23, train_loss: 0.7582, test_loss: 0.9573, test_f1: 0.5323
 epoch: 24, train_loss: 0.7287, test_loss: 0.8038, test_f1: 0.5513
 epoch: 25, train_loss: 0.7525, test_loss: 0.8716, test_f1: 0.5471
 epoch: 26, train_loss: 0.7370, test_loss: 0.9306, test_f1: 0.5845
 epoch: 27, train_loss: 0.7530, test_loss: 0.7425, test_f1: 0.5665
 epoch: 28, train_loss: 0.7536, test_loss: 0.8431, test_f1: 0.6125
 epoch: 29, train_loss: 0.7354, test_loss: 0.7975, test_f1: 0.5955
 epoch: 30, train_loss: 0.7183, test_loss: 0.7946, test_f1: 0.6231
 epoch: 31, train_loss: 0.7026, test_loss: 0.7681, test_f1: 0.5740
 epoch: 32, train_loss: 0.6945, test_loss: 0.8706, test_f1: 0.6139
 epoch: 33, train_loss: 0.7130, test_loss: 0.8385, test_f1: 0.5592
 epoch: 34, train_loss: 0.7164, test_loss: 0.9178, test_f1: 0.5438
 epoch: 35, train_loss: 0.6993, test_loss: 0.9713, test_f1: 0.5690
 epoch: 36, train_loss: 0.6935, test_loss: 0.9079, test_f1: 0.5476
 epoch: 37, train_loss: 0.6938, test_loss: 0.8527, test_f1: 0.5908
 epoch: 38, train_loss: 0.6754, test_loss: 0.8775, test_f1: 0.5404
 epoch: 39, train_loss: 0.6953, test_loss: 0.9985, test_f1: 0.5675
 epoch: 40, train_loss: 0.6898, test_loss: 0.7197, test_f1: 0.5649
 epoch: 41, train_loss: 0.6845, test_loss: 0.8367, test_f1: 0.6212
 epoch: 42, train_loss: 0.6870, test_loss: 0.8458, test_f1: 0.5979
 epoch: 43, train_loss: 0.6697, test_loss: 0.9869, test_f1: 0.5633
 epoch: 44, train_loss: 0.6675, test_loss: 0.8237, test_f1: 0.5871
 epoch: 45, train_loss: 0.6537, test_loss: 0.7666, test_f1: 0.5799
 epoch: 46, train_loss: 0.6654, test_loss: 1.1022, test_f1: 0.4904
 epoch: 47, train_loss: 0.6676, test_loss: 0.8839, test_f1: 0.6406
 epoch: 48, train_loss: 0.6560, test_loss: 0.8479, test_f1: 0.5917
 epoch: 49, train_loss: 0.6403, test_loss: 0.8468, test_f1: 0.5638
 epoch: 50, train_loss: 0.6387, test_loss: 0.7911, test_f1: 0.5917
 epoch: 51, train_loss: 0.5991, test_loss: 0.7943, test_f1: 0.6413
 epoch: 52, train_loss: 0.6016, test_loss: 0.8518, test_f1: 0.6329
 epoch: 53, train_loss: 0.5743, test_loss: 0.8785, test_f1: 0.6553
 epoch: 54, train_loss: 0.5833, test_loss: 0.9293, test_f1: 0.6346
 epoch: 55, train_loss: 0.5838, test_loss: 0.8677, test_f1: 0.6652
 epoch: 56, train_loss: 0.5734, test_loss: 1.0347, test_f1: 0.6004
 epoch: 57, train_loss: 0.5941, test_loss: 0.9052, test_f1: 0.6461
 epoch: 58, train_loss: 0.5993, test_loss: 0.9272, test_f1: 0.6248
 epoch: 59, train_loss: 0.5844, test_loss: 0.9026, test_f1: 0.6247
 epoch: 60, train_loss: 0.5816, test_loss: 0.8720, test_f1: 0.6397
 epoch: 61, train_loss: 0.5712, test_loss: 0.8800, test_f1: 0.6676
 epoch: 62, train_loss: 0.5619, test_loss: 0.8848, test_f1: 0.6412
 epoch: 63, train_loss: 0.5650, test_loss: 0.8814, test_f1: 0.6455
 epoch: 64, train_loss: 0.5665, test_loss: 0.8749, test_f1: 0.6583
 epoch: 65, train_loss: 0.5537, test_loss: 0.8507, test_f1: 0.6616
 epoch: 66, train_loss: 0.5598, test_loss: 0.8984, test_f1: 0.6656
 epoch: 67, train_loss: 0.5450, test_loss: 0.9461, test_f1: 0.6673
 epoch: 68, train_loss: 0.5442, test_loss: 0.9110, test_f1: 0.6552
 epoch: 69, train_loss: 0.5649, test_loss: 0.9348, test_f1: 0.6551
 epoch: 70, train_loss: 0.5439, test_loss: 0.9273, test_f1: 0.6469
 epoch: 71, train_loss: 0.5486, test_loss: 0.8864, test_f1: 0.6136
 epoch: 72, train_loss: 0.5471, test_loss: 0.8560, test_f1: 0.6496
 epoch: 73, train_loss: 0.5443, test_loss: 0.8785, test_f1: 0.6522
 epoch: 74, train_loss: 0.5280, test_loss: 0.9821, test_f1: 0.6321
 epoch: 75, train_loss: 0.5321, test_loss: 0.9585, test_f1: 0.6424
 epoch: 76, train_loss: 0.5232, test_loss: 0.9295, test_f1: 0.6251
 epoch: 77, train_loss: 0.5194, test_loss: 0.9219, test_f1: 0.6533
 epoch: 78, train_loss: 0.5501, test_loss: 0.9322, test_f1: 0.6743
 epoch: 79, train_loss: 0.5145, test_loss: 0.9815, test_f1: 0.6665
 epoch: 80, train_loss: 0.5267, test_loss: 0.9631, test_f1: 0.6570
 epoch: 81, train_loss: 0.5144, test_loss: 0.9393, test_f1: 0.6514
 epoch: 82, train_loss: 0.5205, test_loss: 1.0331, test_f1: 0.6455
 epoch: 83, train_loss: 0.5245, test_loss: 0.9953, test_f1: 0.6738
 epoch: 84, train_loss: 0.5153, test_loss: 0.9914, test_f1: 0.6728
 epoch: 85, train_loss: 0.5117, test_loss: 1.0437, test_f1: 0.6501
 epoch: 86, train_loss: 0.5116, test_loss: 1.0227, test_f1: 0.6368
 epoch: 87, train_loss: 0.5162, test_loss: 1.0140, test_f1: 0.6777
 epoch: 88, train_loss: 0.4995, test_loss: 0.8958, test_f1: 0.6607
 epoch: 89, train_loss: 0.5135, test_loss: 0.9315, test_f1: 0.6569
 epoch: 90, train_loss: 0.4980, test_loss: 1.0081, test_f1: 0.6473
 epoch: 91, train_loss: 0.4872, test_loss: 0.9797, test_f1: 0.6817
 epoch: 92, train_loss: 0.4871, test_loss: 1.0531, test_f1: 0.6597
 epoch: 93, train_loss: 0.4921, test_loss: 0.9705, test_f1: 0.6887
 epoch: 94, train_loss: 0.5038, test_loss: 0.9844, test_f1: 0.6670
 epoch: 95, train_loss: 0.4914, test_loss: 1.0968, test_f1: 0.6414
 epoch: 96, train_loss: 0.4883, test_loss: 0.9596, test_f1: 0.6687
 epoch: 97, train_loss: 0.4802, test_loss: 1.0795, test_f1: 0.6610
 epoch: 98, train_loss: 0.4706, test_loss: 1.0731, test_f1: 0.6483
 epoch: 99, train_loss: 0.4762, test_loss: 0.9996, test_f1: 0.6561
##################ITERATION #1 ****************************************
 epoch: 0, train_loss: 1.1822, test_loss: 1.3717, test_f1: 0.2260
 epoch: 1, train_loss: 1.0443, test_loss: 1.0783, test_f1: 0.4016
 epoch: 2, train_loss: 1.0039, test_loss: 1.0038, test_f1: 0.4808
 epoch: 3, train_loss: 0.9750, test_loss: 1.2314, test_f1: 0.3506
 epoch: 4, train_loss: 0.9424, test_loss: 1.0438, test_f1: 0.4642
 epoch: 5, train_loss: 0.9228, test_loss: 1.0578, test_f1: 0.4621
 epoch: 6, train_loss: 0.9060, test_loss: 0.9420, test_f1: 0.5160
 epoch: 7, train_loss: 0.8884, test_loss: 0.8436, test_f1: 0.5464
 epoch: 8, train_loss: 0.8623, test_loss: 0.8738, test_f1: 0.5973
 epoch: 9, train_loss: 0.8470, test_loss: 0.8943, test_f1: 0.5881
 epoch: 10, train_loss: 0.8524, test_loss: 0.8876, test_f1: 0.5411
 epoch: 11, train_loss: 0.8441, test_loss: 0.8986, test_f1: 0.5372
 epoch: 12, train_loss: 0.8259, test_loss: 0.8627, test_f1: 0.5241
 epoch: 13, train_loss: 0.8292, test_loss: 0.9321, test_f1: 0.5683
 epoch: 14, train_loss: 0.8230, test_loss: 0.9587, test_f1: 0.5871
 epoch: 15, train_loss: 0.7980, test_loss: 0.9133, test_f1: 0.5145
 epoch: 16, train_loss: 0.7844, test_loss: 1.1517, test_f1: 0.5378
 epoch: 17, train_loss: 0.7904, test_loss: 0.9052, test_f1: 0.6116
 epoch: 18, train_loss: 0.7770, test_loss: 0.8916, test_f1: 0.5882
 epoch: 19, train_loss: 0.7691, test_loss: 0.8246, test_f1: 0.5403
 epoch: 20, train_loss: 0.7673, test_loss: 0.9452, test_f1: 0.5295
 epoch: 21, train_loss: 0.7670, test_loss: 0.8017, test_f1: 0.6342
 epoch: 22, train_loss: 0.7568, test_loss: 0.9768, test_f1: 0.5831
 epoch: 23, train_loss: 0.7564, test_loss: 1.0692, test_f1: 0.5121
 epoch: 24, train_loss: 0.7513, test_loss: 1.0853, test_f1: 0.5199
 epoch: 25, train_loss: 0.7529, test_loss: 1.0021, test_f1: 0.5114
 epoch: 26, train_loss: 0.7322, test_loss: 0.9672, test_f1: 0.5400
 epoch: 27, train_loss: 0.7371, test_loss: 1.0184, test_f1: 0.5249
 epoch: 28, train_loss: 0.7246, test_loss: 0.9865, test_f1: 0.6023
 epoch: 29, train_loss: 0.7203, test_loss: 0.9450, test_f1: 0.5476
 epoch: 30, train_loss: 0.7243, test_loss: 0.9124, test_f1: 0.5945
 epoch: 31, train_loss: 0.7173, test_loss: 1.0623, test_f1: 0.5389
 epoch: 32, train_loss: 0.6988, test_loss: 1.0434, test_f1: 0.5280
 epoch: 33, train_loss: 0.7127, test_loss: 0.9482, test_f1: 0.5906
 epoch: 34, train_loss: 0.7237, test_loss: 0.9332, test_f1: 0.6221
 epoch: 35, train_loss: 0.7033, test_loss: 0.9139, test_f1: 0.6308
 epoch: 36, train_loss: 0.7081, test_loss: 1.0035, test_f1: 0.6012
 epoch: 37, train_loss: 0.6996, test_loss: 0.9096, test_f1: 0.6148
 epoch: 38, train_loss: 0.7105, test_loss: 0.9293, test_f1: 0.5944
 epoch: 39, train_loss: 0.6844, test_loss: 1.2257, test_f1: 0.4893
 epoch: 40, train_loss: 0.6788, test_loss: 0.9204, test_f1: 0.6114
 epoch: 41, train_loss: 0.6692, test_loss: 1.0442, test_f1: 0.4602
 epoch: 42, train_loss: 0.6892, test_loss: 0.9107, test_f1: 0.6077
 epoch: 43, train_loss: 0.6736, test_loss: 1.0365, test_f1: 0.6075
 epoch: 44, train_loss: 0.6841, test_loss: 0.9262, test_f1: 0.5811
 epoch: 45, train_loss: 0.6647, test_loss: 0.8938, test_f1: 0.6215
 epoch: 46, train_loss: 0.6670, test_loss: 0.8798, test_f1: 0.5714
 epoch: 47, train_loss: 0.6500, test_loss: 0.9731, test_f1: 0.5896
 epoch: 48, train_loss: 0.6571, test_loss: 0.8955, test_f1: 0.5984
 epoch: 49, train_loss: 0.6518, test_loss: 1.1205, test_f1: 0.5539
 epoch: 50, train_loss: 0.6356, test_loss: 0.9545, test_f1: 0.5788
 epoch: 51, train_loss: 0.6193, test_loss: 0.9520, test_f1: 0.6430
 epoch: 52, train_loss: 0.6057, test_loss: 1.0204, test_f1: 0.6119
 epoch: 53, train_loss: 0.6042, test_loss: 0.8634, test_f1: 0.6536
 epoch: 54, train_loss: 0.5843, test_loss: 0.8793, test_f1: 0.6288
 epoch: 55, train_loss: 0.5755, test_loss: 0.9109, test_f1: 0.6123
 epoch: 56, train_loss: 0.5782, test_loss: 0.9714, test_f1: 0.6528
 epoch: 57, train_loss: 0.5865, test_loss: 0.9324, test_f1: 0.6008
 epoch: 58, train_loss: 0.5847, test_loss: 1.1150, test_f1: 0.5598
 epoch: 59, train_loss: 0.5835, test_loss: 0.8935, test_f1: 0.6126
 epoch: 60, train_loss: 0.5615, test_loss: 1.0882, test_f1: 0.5624
 epoch: 61, train_loss: 0.5906, test_loss: 1.1049, test_f1: 0.5864
 epoch: 62, train_loss: 0.5848, test_loss: 0.8806, test_f1: 0.6377
 epoch: 63, train_loss: 0.5559, test_loss: 1.0279, test_f1: 0.5866
 epoch: 64, train_loss: 0.5760, test_loss: 0.8750, test_f1: 0.6523
 epoch: 65, train_loss: 0.5478, test_loss: 1.0521, test_f1: 0.5918
 epoch: 66, train_loss: 0.5585, test_loss: 0.9029, test_f1: 0.6201
 epoch: 67, train_loss: 0.5633, test_loss: 0.8893, test_f1: 0.6283
 epoch: 68, train_loss: 0.5441, test_loss: 0.9297, test_f1: 0.6375
 epoch: 69, train_loss: 0.5481, test_loss: 1.0134, test_f1: 0.6249
 epoch: 70, train_loss: 0.5531, test_loss: 0.9386, test_f1: 0.6355
 epoch: 71, train_loss: 0.5451, test_loss: 1.0307, test_f1: 0.6098
 epoch: 72, train_loss: 0.5387, test_loss: 0.9260, test_f1: 0.6363
 epoch: 73, train_loss: 0.5463, test_loss: 0.8884, test_f1: 0.6543
 epoch: 74, train_loss: 0.5498, test_loss: 0.8833, test_f1: 0.6130
 epoch: 75, train_loss: 0.5303, test_loss: 1.0829, test_f1: 0.6373
 epoch: 76, train_loss: 0.5403, test_loss: 0.8966, test_f1: 0.6256
 epoch: 77, train_loss: 0.5465, test_loss: 0.9191, test_f1: 0.6103
 epoch: 78, train_loss: 0.5343, test_loss: 0.9404, test_f1: 0.6488
 epoch: 79, train_loss: 0.5459, test_loss: 0.8922, test_f1: 0.6262
 epoch: 80, train_loss: 0.5443, test_loss: 0.9134, test_f1: 0.6184
 epoch: 81, train_loss: 0.5507, test_loss: 0.9069, test_f1: 0.6610
 epoch: 82, train_loss: 0.5153, test_loss: 0.8876, test_f1: 0.6458
 epoch: 83, train_loss: 0.5197, test_loss: 0.9430, test_f1: 0.6436
 epoch: 84, train_loss: 0.5111, test_loss: 0.9718, test_f1: 0.6421
 epoch: 85, train_loss: 0.5209, test_loss: 1.0070, test_f1: 0.6361
 epoch: 86, train_loss: 0.5248, test_loss: 0.8724, test_f1: 0.6489
 epoch: 87, train_loss: 0.5388, test_loss: 0.9580, test_f1: 0.6456
 epoch: 88, train_loss: 0.5105, test_loss: 0.9697, test_f1: 0.6053
 epoch: 89, train_loss: 0.4967, test_loss: 0.9988, test_f1: 0.6250
 epoch: 90, train_loss: 0.4920, test_loss: 0.9159, test_f1: 0.6390
 epoch: 91, train_loss: 0.5152, test_loss: 0.9285, test_f1: 0.6386
 epoch: 92, train_loss: 0.4975, test_loss: 0.9669, test_f1: 0.6016
 epoch: 93, train_loss: 0.5199, test_loss: 1.0439, test_f1: 0.6257
 epoch: 94, train_loss: 0.5210, test_loss: 0.9180, test_f1: 0.6562
 epoch: 95, train_loss: 0.5008, test_loss: 0.9066, test_f1: 0.6528
 epoch: 96, train_loss: 0.4853, test_loss: 1.1028, test_f1: 0.6140
 epoch: 97, train_loss: 0.5014, test_loss: 0.8741, test_f1: 0.6593
 epoch: 98, train_loss: 0.5055, test_loss: 0.9705, test_f1: 0.6463
 epoch: 99, train_loss: 0.5157, test_loss: 0.8671, test_f1: 0.6575
##################ITERATION #2 ****************************************
 epoch: 0, train_loss: 1.1222, test_loss: 1.0428, test_f1: 0.5018
 epoch: 1, train_loss: 0.9942, test_loss: 1.0223, test_f1: 0.4701
 epoch: 2, train_loss: 0.9420, test_loss: 0.9694, test_f1: 0.5212
 epoch: 3, train_loss: 0.9134, test_loss: 0.9540, test_f1: 0.5043
 epoch: 4, train_loss: 0.9120, test_loss: 0.9222, test_f1: 0.4914
 epoch: 5, train_loss: 0.8853, test_loss: 0.9287, test_f1: 0.5147
 epoch: 6, train_loss: 0.8756, test_loss: 0.9648, test_f1: 0.4747
 epoch: 7, train_loss: 0.8866, test_loss: 0.9116, test_f1: 0.5405
 epoch: 8, train_loss: 0.8491, test_loss: 0.9328, test_f1: 0.5925
 epoch: 9, train_loss: 0.8500, test_loss: 0.9873, test_f1: 0.4837
 epoch: 10, train_loss: 0.8327, test_loss: 0.9149, test_f1: 0.5275
 epoch: 11, train_loss: 0.8211, test_loss: 0.9162, test_f1: 0.5441
 epoch: 12, train_loss: 0.8188, test_loss: 0.9530, test_f1: 0.5379
 epoch: 13, train_loss: 0.8184, test_loss: 0.9388, test_f1: 0.5118
 epoch: 14, train_loss: 0.8116, test_loss: 0.9795, test_f1: 0.5222
 epoch: 15, train_loss: 0.7941, test_loss: 0.9424, test_f1: 0.5651
 epoch: 16, train_loss: 0.7893, test_loss: 1.0160, test_f1: 0.4812
 epoch: 17, train_loss: 0.8018, test_loss: 1.0396, test_f1: 0.5532
 epoch: 18, train_loss: 0.7790, test_loss: 0.9209, test_f1: 0.5354
 epoch: 19, train_loss: 0.7860, test_loss: 0.9783, test_f1: 0.5162
 epoch: 20, train_loss: 0.7692, test_loss: 0.8391, test_f1: 0.5544
 epoch: 21, train_loss: 0.7718, test_loss: 1.3240, test_f1: 0.4641
 epoch: 22, train_loss: 0.7772, test_loss: 0.8796, test_f1: 0.5930
 epoch: 23, train_loss: 0.7747, test_loss: 0.8288, test_f1: 0.5689
 epoch: 24, train_loss: 0.7452, test_loss: 0.8410, test_f1: 0.5929
 epoch: 25, train_loss: 0.7648, test_loss: 0.8471, test_f1: 0.5606
 epoch: 26, train_loss: 0.7409, test_loss: 1.0581, test_f1: 0.5202
 epoch: 27, train_loss: 0.7591, test_loss: 0.8447, test_f1: 0.5505
 epoch: 28, train_loss: 0.7605, test_loss: 0.9036, test_f1: 0.5606
 epoch: 29, train_loss: 0.7338, test_loss: 0.8896, test_f1: 0.5349
 epoch: 30, train_loss: 0.7248, test_loss: 0.8416, test_f1: 0.5851
 epoch: 31, train_loss: 0.7418, test_loss: 0.9544, test_f1: 0.5872
 epoch: 32, train_loss: 0.7194, test_loss: 0.9449, test_f1: 0.5994
 epoch: 33, train_loss: 0.7126, test_loss: 0.8491, test_f1: 0.5580
 epoch: 34, train_loss: 0.7108, test_loss: 0.9044, test_f1: 0.6081
 epoch: 35, train_loss: 0.7004, test_loss: 0.9593, test_f1: 0.5307
 epoch: 36, train_loss: 0.7149, test_loss: 0.8274, test_f1: 0.5780
 epoch: 37, train_loss: 0.6981, test_loss: 0.8406, test_f1: 0.6266
 epoch: 38, train_loss: 0.6966, test_loss: 0.8619, test_f1: 0.6199
 epoch: 39, train_loss: 0.7027, test_loss: 0.9367, test_f1: 0.5611
 epoch: 40, train_loss: 0.7006, test_loss: 0.9575, test_f1: 0.5864
 epoch: 41, train_loss: 0.7028, test_loss: 0.8667, test_f1: 0.5726
 epoch: 42, train_loss: 0.6743, test_loss: 0.9599, test_f1: 0.5800
 epoch: 43, train_loss: 0.7055, test_loss: 0.9562, test_f1: 0.5861
 epoch: 44, train_loss: 0.6862, test_loss: 0.7908, test_f1: 0.6128
 epoch: 45, train_loss: 0.6933, test_loss: 0.8310, test_f1: 0.5619
 epoch: 46, train_loss: 0.6785, test_loss: 0.8171, test_f1: 0.6288
 epoch: 47, train_loss: 0.6583, test_loss: 0.8211, test_f1: 0.6308
 epoch: 48, train_loss: 0.6797, test_loss: 0.9817, test_f1: 0.5020
 epoch: 49, train_loss: 0.6789, test_loss: 0.8127, test_f1: 0.6215
 epoch: 50, train_loss: 0.6684, test_loss: 0.9272, test_f1: 0.5174
 epoch: 51, train_loss: 0.6619, test_loss: 0.7998, test_f1: 0.6049
 epoch: 52, train_loss: 0.6138, test_loss: 0.7820, test_f1: 0.6402
 epoch: 53, train_loss: 0.6180, test_loss: 0.7430, test_f1: 0.6391
 epoch: 54, train_loss: 0.6009, test_loss: 0.8215, test_f1: 0.5998
 epoch: 55, train_loss: 0.6176, test_loss: 0.8886, test_f1: 0.5909
 epoch: 56, train_loss: 0.6069, test_loss: 0.8810, test_f1: 0.5893
 epoch: 57, train_loss: 0.6009, test_loss: 0.7647, test_f1: 0.6546
 epoch: 58, train_loss: 0.6006, test_loss: 0.8479, test_f1: 0.6108
 epoch: 59, train_loss: 0.6117, test_loss: 0.8170, test_f1: 0.6313
 epoch: 60, train_loss: 0.6001, test_loss: 0.8042, test_f1: 0.6315
 epoch: 61, train_loss: 0.5902, test_loss: 0.9093, test_f1: 0.5877
 epoch: 62, train_loss: 0.5984, test_loss: 0.7580, test_f1: 0.6196
 epoch: 63, train_loss: 0.5892, test_loss: 0.7857, test_f1: 0.6337
 epoch: 64, train_loss: 0.5833, test_loss: 0.8507, test_f1: 0.6142
 epoch: 65, train_loss: 0.5793, test_loss: 0.7650, test_f1: 0.6247
 epoch: 66, train_loss: 0.5751, test_loss: 0.7981, test_f1: 0.6296
 epoch: 67, train_loss: 0.5805, test_loss: 0.8116, test_f1: 0.6222
 epoch: 68, train_loss: 0.5779, test_loss: 0.7551, test_f1: 0.5912
 epoch: 69, train_loss: 0.6066, test_loss: 0.7313, test_f1: 0.6521
 epoch: 70, train_loss: 0.5830, test_loss: 0.8797, test_f1: 0.5960
 epoch: 71, train_loss: 0.5911, test_loss: 0.8688, test_f1: 0.6101
 epoch: 72, train_loss: 0.5924, test_loss: 0.7829, test_f1: 0.6555
 epoch: 73, train_loss: 0.5647, test_loss: 0.8115, test_f1: 0.6323
 epoch: 74, train_loss: 0.5455, test_loss: 0.8810, test_f1: 0.6149
 epoch: 75, train_loss: 0.5713, test_loss: 0.8609, test_f1: 0.6034
 epoch: 76, train_loss: 0.5626, test_loss: 0.7660, test_f1: 0.6602
 epoch: 77, train_loss: 0.5702, test_loss: 0.8293, test_f1: 0.6286
 epoch: 78, train_loss: 0.5636, test_loss: 0.8464, test_f1: 0.6477
 epoch: 79, train_loss: 0.5452, test_loss: 0.8469, test_f1: 0.6234
 epoch: 80, train_loss: 0.5557, test_loss: 0.8861, test_f1: 0.6413
 epoch: 81, train_loss: 0.5582, test_loss: 0.7636, test_f1: 0.6515
 epoch: 82, train_loss: 0.5648, test_loss: 0.7339, test_f1: 0.6524
 epoch: 83, train_loss: 0.5483, test_loss: 0.8764, test_f1: 0.5860
 epoch: 84, train_loss: 0.5564, test_loss: 0.9053, test_f1: 0.6275
 epoch: 85, train_loss: 0.5569, test_loss: 0.8035, test_f1: 0.6396
 epoch: 86, train_loss: 0.5534, test_loss: 0.7336, test_f1: 0.6628
 epoch: 87, train_loss: 0.5481, test_loss: 0.7462, test_f1: 0.6430
 epoch: 88, train_loss: 0.5338, test_loss: 0.7976, test_f1: 0.6548
 epoch: 89, train_loss: 0.5393, test_loss: 0.9527, test_f1: 0.6068
 epoch: 90, train_loss: 0.5298, test_loss: 0.8201, test_f1: 0.6153
 epoch: 91, train_loss: 0.5317, test_loss: 0.7693, test_f1: 0.6254
 epoch: 92, train_loss: 0.5436, test_loss: 0.7802, test_f1: 0.6248
 epoch: 93, train_loss: 0.5253, test_loss: 0.7358, test_f1: 0.6561
 epoch: 94, train_loss: 0.5203, test_loss: 0.7478, test_f1: 0.6376
 epoch: 95, train_loss: 0.5394, test_loss: 0.7437, test_f1: 0.6537
 epoch: 96, train_loss: 0.5379, test_loss: 0.8736, test_f1: 0.6248
 epoch: 97, train_loss: 0.5321, test_loss: 0.8453, test_f1: 0.6093
 epoch: 98, train_loss: 0.5170, test_loss: 0.7540, test_f1: 0.6551
 epoch: 99, train_loss: 0.5408, test_loss: 0.9444, test_f1: 0.5825
##################ITERATION #3 ****************************************
 epoch: 0, train_loss: 1.1424, test_loss: 1.1279, test_f1: 0.3385
 epoch: 1, train_loss: 1.0183, test_loss: 1.1926, test_f1: 0.3795
 epoch: 2, train_loss: 0.9763, test_loss: 0.9918, test_f1: 0.4680
 epoch: 3, train_loss: 0.9522, test_loss: 1.0199, test_f1: 0.4707
 epoch: 4, train_loss: 0.9553, test_loss: 1.4338, test_f1: 0.3755
 epoch: 5, train_loss: 0.9292, test_loss: 1.0142, test_f1: 0.4866
 epoch: 6, train_loss: 0.9162, test_loss: 1.0000, test_f1: 0.4818
 epoch: 7, train_loss: 0.9095, test_loss: 0.9121, test_f1: 0.5186
 epoch: 8, train_loss: 0.8835, test_loss: 1.0205, test_f1: 0.4568
 epoch: 9, train_loss: 0.8717, test_loss: 0.9788, test_f1: 0.5117
 epoch: 10, train_loss: 0.8519, test_loss: 0.9146, test_f1: 0.5267
 epoch: 11, train_loss: 0.8417, test_loss: 0.9617, test_f1: 0.5222
 epoch: 12, train_loss: 0.8309, test_loss: 0.8526, test_f1: 0.5729
 epoch: 13, train_loss: 0.8240, test_loss: 1.1161, test_f1: 0.5005
 epoch: 14, train_loss: 0.8400, test_loss: 0.8014, test_f1: 0.5285
 epoch: 15, train_loss: 0.8066, test_loss: 0.9330, test_f1: 0.5083
 epoch: 16, train_loss: 0.7990, test_loss: 0.7911, test_f1: 0.5672
 epoch: 17, train_loss: 0.7770, test_loss: 0.9011, test_f1: 0.5439
 epoch: 18, train_loss: 0.7942, test_loss: 0.9343, test_f1: 0.5144
 epoch: 19, train_loss: 0.7860, test_loss: 0.9443, test_f1: 0.5728
 epoch: 20, train_loss: 0.7863, test_loss: 0.9992, test_f1: 0.4521
 epoch: 21, train_loss: 0.7717, test_loss: 0.8864, test_f1: 0.5467
 epoch: 22, train_loss: 0.7468, test_loss: 0.9302, test_f1: 0.5545
 epoch: 23, train_loss: 0.7421, test_loss: 1.2508, test_f1: 0.4217
 epoch: 24, train_loss: 0.7402, test_loss: 0.8658, test_f1: 0.5919
 epoch: 25, train_loss: 0.7444, test_loss: 0.9038, test_f1: 0.5340
 epoch: 26, train_loss: 0.7290, test_loss: 0.8576, test_f1: 0.5495
 epoch: 27, train_loss: 0.7353, test_loss: 0.8410, test_f1: 0.6062
 epoch: 28, train_loss: 0.7335, test_loss: 0.9015, test_f1: 0.5159
 epoch: 29, train_loss: 0.7198, test_loss: 0.9319, test_f1: 0.5632
 epoch: 30, train_loss: 0.7035, test_loss: 0.8937, test_f1: 0.5899
 epoch: 31, train_loss: 0.7212, test_loss: 0.8503, test_f1: 0.5747
 epoch: 32, train_loss: 0.7163, test_loss: 0.8767, test_f1: 0.6012
 epoch: 33, train_loss: 0.7015, test_loss: 0.8461, test_f1: 0.6288
 epoch: 34, train_loss: 0.7057, test_loss: 1.1117, test_f1: 0.5932
 epoch: 35, train_loss: 0.6939, test_loss: 0.9379, test_f1: 0.6128
 epoch: 36, train_loss: 0.6851, test_loss: 0.8514, test_f1: 0.6275
 epoch: 37, train_loss: 0.6917, test_loss: 0.8726, test_f1: 0.5412
 epoch: 38, train_loss: 0.6968, test_loss: 0.8733, test_f1: 0.5934
 epoch: 39, train_loss: 0.6791, test_loss: 0.8136, test_f1: 0.6491
 epoch: 40, train_loss: 0.6828, test_loss: 0.8848, test_f1: 0.6134
 epoch: 41, train_loss: 0.6745, test_loss: 0.9072, test_f1: 0.5777
 epoch: 42, train_loss: 0.6846, test_loss: 0.8265, test_f1: 0.6087
 epoch: 43, train_loss: 0.6917, test_loss: 1.0115, test_f1: 0.6046
 epoch: 44, train_loss: 0.6721, test_loss: 0.9596, test_f1: 0.6107
 epoch: 45, train_loss: 0.6716, test_loss: 0.9086, test_f1: 0.6303
 epoch: 46, train_loss: 0.6560, test_loss: 0.8920, test_f1: 0.6145
 epoch: 47, train_loss: 0.6854, test_loss: 1.1752, test_f1: 0.5311
 epoch: 48, train_loss: 0.6775, test_loss: 0.9051, test_f1: 0.6064
 epoch: 49, train_loss: 0.6585, test_loss: 0.9480, test_f1: 0.6185
 epoch: 50, train_loss: 0.6630, test_loss: 0.9235, test_f1: 0.5690
 epoch: 51, train_loss: 0.6381, test_loss: 0.8684, test_f1: 0.6490
 epoch: 52, train_loss: 0.6243, test_loss: 0.9836, test_f1: 0.6321
 epoch: 53, train_loss: 0.6183, test_loss: 0.8468, test_f1: 0.6399
 epoch: 54, train_loss: 0.5849, test_loss: 0.9205, test_f1: 0.6455
 epoch: 55, train_loss: 0.5951, test_loss: 0.8829, test_f1: 0.6619
 epoch: 56, train_loss: 0.5840, test_loss: 0.8101, test_f1: 0.6570
 epoch: 57, train_loss: 0.5783, test_loss: 0.9460, test_f1: 0.6051
 epoch: 58, train_loss: 0.5796, test_loss: 0.8642, test_f1: 0.6510
 epoch: 59, train_loss: 0.6067, test_loss: 0.9474, test_f1: 0.5892
 epoch: 60, train_loss: 0.5761, test_loss: 0.8970, test_f1: 0.6530
 epoch: 61, train_loss: 0.5775, test_loss: 0.9594, test_f1: 0.6421
 epoch: 62, train_loss: 0.5802, test_loss: 0.9150, test_f1: 0.6041
 epoch: 63, train_loss: 0.5748, test_loss: 0.9114, test_f1: 0.6541
 epoch: 64, train_loss: 0.5800, test_loss: 0.9200, test_f1: 0.6493
 epoch: 65, train_loss: 0.5779, test_loss: 0.9724, test_f1: 0.5973
 epoch: 66, train_loss: 0.5824, test_loss: 0.9001, test_f1: 0.6236
 epoch: 67, train_loss: 0.5601, test_loss: 0.9613, test_f1: 0.6216
 epoch: 68, train_loss: 0.5676, test_loss: 1.0086, test_f1: 0.6363
 epoch: 69, train_loss: 0.5624, test_loss: 0.9611, test_f1: 0.6245
 epoch: 70, train_loss: 0.5619, test_loss: 0.8633, test_f1: 0.6437
 epoch: 71, train_loss: 0.5554, test_loss: 1.0023, test_f1: 0.6013
 epoch: 72, train_loss: 0.5683, test_loss: 0.9939, test_f1: 0.6311
 epoch: 73, train_loss: 0.5606, test_loss: 0.8573, test_f1: 0.6481
 epoch: 74, train_loss: 0.5635, test_loss: 0.8351, test_f1: 0.6565
 epoch: 75, train_loss: 0.5492, test_loss: 0.9771, test_f1: 0.6194
 epoch: 76, train_loss: 0.5611, test_loss: 0.9013, test_f1: 0.6299
 epoch: 77, train_loss: 0.5537, test_loss: 1.0204, test_f1: 0.5999
 epoch: 78, train_loss: 0.5518, test_loss: 0.8897, test_f1: 0.6241
 epoch: 79, train_loss: 0.5390, test_loss: 0.9254, test_f1: 0.6333
 epoch: 80, train_loss: 0.5334, test_loss: 0.9443, test_f1: 0.6178
 epoch: 81, train_loss: 0.5205, test_loss: 1.0072, test_f1: 0.6163
 epoch: 82, train_loss: 0.5325, test_loss: 0.8988, test_f1: 0.6318
 epoch: 83, train_loss: 0.5182, test_loss: 0.9943, test_f1: 0.6113
 epoch: 84, train_loss: 0.5386, test_loss: 0.9169, test_f1: 0.6152
 epoch: 85, train_loss: 0.5264, test_loss: 0.9252, test_f1: 0.6383
 epoch: 86, train_loss: 0.5313, test_loss: 1.1328, test_f1: 0.5963
 epoch: 87, train_loss: 0.5182, test_loss: 0.9887, test_f1: 0.6308
 epoch: 88, train_loss: 0.5280, test_loss: 0.9068, test_f1: 0.6029
 epoch: 89, train_loss: 0.5159, test_loss: 0.9207, test_f1: 0.6244
 epoch: 90, train_loss: 0.5166, test_loss: 1.1752, test_f1: 0.6039
 epoch: 91, train_loss: 0.5198, test_loss: 0.9741, test_f1: 0.5843
 epoch: 92, train_loss: 0.5187, test_loss: 0.8613, test_f1: 0.6415
 epoch: 93, train_loss: 0.5040, test_loss: 0.9228, test_f1: 0.6504
 epoch: 94, train_loss: 0.5050, test_loss: 0.8852, test_f1: 0.6377
 epoch: 95, train_loss: 0.5080, test_loss: 1.1497, test_f1: 0.5833
 epoch: 96, train_loss: 0.5003, test_loss: 0.8347, test_f1: 0.6642
 epoch: 97, train_loss: 0.5159, test_loss: 0.9333, test_f1: 0.6222
 epoch: 98, train_loss: 0.5057, test_loss: 0.9214, test_f1: 0.6171
 epoch: 99, train_loss: 0.4927, test_loss: 0.9021, test_f1: 0.6164
##################ITERATION #4 ****************************************
 epoch: 0, train_loss: 1.2112, test_loss: 1.0913, test_f1: 0.3887
 epoch: 1, train_loss: 1.0507, test_loss: 1.0370, test_f1: 0.4128
 epoch: 2, train_loss: 1.0081, test_loss: 1.0944, test_f1: 0.4576
 epoch: 3, train_loss: 0.9839, test_loss: 1.1085, test_f1: 0.4191
 epoch: 4, train_loss: 0.9645, test_loss: 0.9440, test_f1: 0.4856
 epoch: 5, train_loss: 0.9324, test_loss: 1.0907, test_f1: 0.4947
 epoch: 6, train_loss: 0.9179, test_loss: 1.0689, test_f1: 0.4884
 epoch: 7, train_loss: 0.8919, test_loss: 1.0295, test_f1: 0.5364
 epoch: 8, train_loss: 0.8875, test_loss: 0.9986, test_f1: 0.5222
 epoch: 9, train_loss: 0.8770, test_loss: 0.9583, test_f1: 0.5270
 epoch: 10, train_loss: 0.8594, test_loss: 1.2175, test_f1: 0.4643
 epoch: 11, train_loss: 0.8493, test_loss: 0.9470, test_f1: 0.4814
 epoch: 12, train_loss: 0.8389, test_loss: 1.0699, test_f1: 0.4990
 epoch: 13, train_loss: 0.8128, test_loss: 1.0912, test_f1: 0.4943
 epoch: 14, train_loss: 0.8219, test_loss: 0.8938, test_f1: 0.6030
 epoch: 15, train_loss: 0.8242, test_loss: 0.9124, test_f1: 0.5666
 epoch: 16, train_loss: 0.7892, test_loss: 0.9174, test_f1: 0.5922
 epoch: 17, train_loss: 0.7920, test_loss: 0.9743, test_f1: 0.5022
 epoch: 18, train_loss: 0.7781, test_loss: 0.9111, test_f1: 0.5750
 epoch: 19, train_loss: 0.7862, test_loss: 0.9657, test_f1: 0.5474
 epoch: 20, train_loss: 0.7654, test_loss: 0.9354, test_f1: 0.5620
 epoch: 21, train_loss: 0.7708, test_loss: 1.1249, test_f1: 0.5819
 epoch: 22, train_loss: 0.7610, test_loss: 0.9290, test_f1: 0.5584
 epoch: 23, train_loss: 0.7597, test_loss: 0.9418, test_f1: 0.5914
 epoch: 24, train_loss: 0.7486, test_loss: 1.0144, test_f1: 0.5046
 epoch: 25, train_loss: 0.7190, test_loss: 0.8843, test_f1: 0.6243
 epoch: 26, train_loss: 0.7537, test_loss: 1.4718, test_f1: 0.4529
 epoch: 27, train_loss: 0.7291, test_loss: 0.8833, test_f1: 0.5946
 epoch: 28, train_loss: 0.7195, test_loss: 0.9196, test_f1: 0.5887
 epoch: 29, train_loss: 0.7208, test_loss: 0.9209, test_f1: 0.5588
 epoch: 30, train_loss: 0.7224, test_loss: 0.8681, test_f1: 0.6230
 epoch: 31, train_loss: 0.6987, test_loss: 0.8882, test_f1: 0.5808
 epoch: 32, train_loss: 0.6780, test_loss: 0.9770, test_f1: 0.5851
 epoch: 33, train_loss: 0.6868, test_loss: 0.8604, test_f1: 0.6041
 epoch: 34, train_loss: 0.6930, test_loss: 0.9284, test_f1: 0.5480
 epoch: 35, train_loss: 0.7172, test_loss: 0.9281, test_f1: 0.5463
 epoch: 36, train_loss: 0.6969, test_loss: 0.8449, test_f1: 0.6059
 epoch: 37, train_loss: 0.6855, test_loss: 0.9490, test_f1: 0.5747
 epoch: 38, train_loss: 0.6689, test_loss: 0.8383, test_f1: 0.6530
 epoch: 39, train_loss: 0.6924, test_loss: 0.9155, test_f1: 0.5627
 epoch: 40, train_loss: 0.6667, test_loss: 0.8668, test_f1: 0.6264
 epoch: 41, train_loss: 0.6532, test_loss: 0.8229, test_f1: 0.6164
 epoch: 42, train_loss: 0.6414, test_loss: 0.8719, test_f1: 0.6239
 epoch: 43, train_loss: 0.6598, test_loss: 1.1054, test_f1: 0.5920
 epoch: 44, train_loss: 0.6688, test_loss: 0.8455, test_f1: 0.5567
 epoch: 45, train_loss: 0.6462, test_loss: 0.9457, test_f1: 0.5727
 epoch: 46, train_loss: 0.6671, test_loss: 0.8450, test_f1: 0.5742
 epoch: 47, train_loss: 0.6569, test_loss: 0.9289, test_f1: 0.5925
 epoch: 48, train_loss: 0.6683, test_loss: 0.7820, test_f1: 0.6545
 epoch: 49, train_loss: 0.6485, test_loss: 0.9614, test_f1: 0.5733
 epoch: 50, train_loss: 0.6556, test_loss: 0.8528, test_f1: 0.6331
 epoch: 51, train_loss: 0.6362, test_loss: 0.8329, test_f1: 0.6168
 epoch: 52, train_loss: 0.6139, test_loss: 1.0663, test_f1: 0.5372
 epoch: 53, train_loss: 0.5946, test_loss: 0.8919, test_f1: 0.6506
 epoch: 54, train_loss: 0.5877, test_loss: 0.8713, test_f1: 0.6515
 epoch: 55, train_loss: 0.5821, test_loss: 0.8605, test_f1: 0.6394
 epoch: 56, train_loss: 0.5949, test_loss: 0.8611, test_f1: 0.6436
 epoch: 57, train_loss: 0.5792, test_loss: 0.8330, test_f1: 0.6743
 epoch: 58, train_loss: 0.5692, test_loss: 0.8225, test_f1: 0.6804
 epoch: 59, train_loss: 0.5720, test_loss: 0.8428, test_f1: 0.6598
 epoch: 60, train_loss: 0.5440, test_loss: 0.8515, test_f1: 0.6235
 epoch: 61, train_loss: 0.5716, test_loss: 0.9287, test_f1: 0.6213
 epoch: 62, train_loss: 0.5658, test_loss: 0.9608, test_f1: 0.6247
 epoch: 63, train_loss: 0.5734, test_loss: 0.9045, test_f1: 0.6585
 epoch: 64, train_loss: 0.5528, test_loss: 0.8607, test_f1: 0.6389
 epoch: 65, train_loss: 0.5627, test_loss: 0.9069, test_f1: 0.6390
 epoch: 66, train_loss: 0.5615, test_loss: 0.8934, test_f1: 0.6237
 epoch: 67, train_loss: 0.5717, test_loss: 0.8566, test_f1: 0.6626
 epoch: 68, train_loss: 0.5632, test_loss: 0.8581, test_f1: 0.6347
 epoch: 69, train_loss: 0.5380, test_loss: 0.8899, test_f1: 0.6540
 epoch: 70, train_loss: 0.5384, test_loss: 0.8501, test_f1: 0.6739
 epoch: 71, train_loss: 0.5474, test_loss: 0.8686, test_f1: 0.6589
 epoch: 72, train_loss: 0.5501, test_loss: 0.9004, test_f1: 0.6196
 epoch: 73, train_loss: 0.5339, test_loss: 0.8546, test_f1: 0.6589
 epoch: 74, train_loss: 0.5503, test_loss: 0.9534, test_f1: 0.6242
 epoch: 75, train_loss: 0.5529, test_loss: 0.8960, test_f1: 0.6332
 epoch: 76, train_loss: 0.5352, test_loss: 0.9301, test_f1: 0.6566
 epoch: 77, train_loss: 0.5559, test_loss: 1.0214, test_f1: 0.6144
 epoch: 78, train_loss: 0.5508, test_loss: 0.8760, test_f1: 0.6403
 epoch: 79, train_loss: 0.5404, test_loss: 0.9535, test_f1: 0.6538
 epoch: 80, train_loss: 0.5309, test_loss: 0.9302, test_f1: 0.6595
 epoch: 81, train_loss: 0.5238, test_loss: 1.0077, test_f1: 0.6313
 epoch: 82, train_loss: 0.5244, test_loss: 0.9105, test_f1: 0.6494
 epoch: 83, train_loss: 0.5360, test_loss: 0.9753, test_f1: 0.6465
 epoch: 84, train_loss: 0.5197, test_loss: 0.8887, test_f1: 0.6465
 epoch: 85, train_loss: 0.5185, test_loss: 0.9144, test_f1: 0.6478
 epoch: 86, train_loss: 0.5305, test_loss: 0.8727, test_f1: 0.6608
 epoch: 87, train_loss: 0.5200, test_loss: 0.9699, test_f1: 0.6379
 epoch: 88, train_loss: 0.5283, test_loss: 0.8968, test_f1: 0.6642
 epoch: 89, train_loss: 0.5101, test_loss: 1.0679, test_f1: 0.6028
 epoch: 90, train_loss: 0.5132, test_loss: 0.9094, test_f1: 0.6695
 epoch: 91, train_loss: 0.5096, test_loss: 0.9380, test_f1: 0.6528
 epoch: 92, train_loss: 0.5276, test_loss: 0.9104, test_f1: 0.6538
 epoch: 93, train_loss: 0.5203, test_loss: 0.8388, test_f1: 0.6818
 epoch: 94, train_loss: 0.4971, test_loss: 0.9835, test_f1: 0.6607
 epoch: 95, train_loss: 0.5095, test_loss: 0.8645, test_f1: 0.6668
 epoch: 96, train_loss: 0.5121, test_loss: 1.0008, test_f1: 0.6414
 epoch: 97, train_loss: 0.4885, test_loss: 0.9884, test_f1: 0.6664
 epoch: 98, train_loss: 0.5009, test_loss: 0.9050, test_f1: 0.6473
 epoch: 99, train_loss: 0.4980, test_loss: 0.9919, test_f1: 0.6416
##################ITERATION #5 ****************************************
 epoch: 0, train_loss: 1.1938, test_loss: 1.1026, test_f1: 0.3902
 epoch: 1, train_loss: 1.0329, test_loss: 1.0994, test_f1: 0.4909
 epoch: 2, train_loss: 0.9877, test_loss: 1.0668, test_f1: 0.4781
 epoch: 3, train_loss: 0.9726, test_loss: 0.9823, test_f1: 0.4753
 epoch: 4, train_loss: 0.9548, test_loss: 0.9826, test_f1: 0.4900
 epoch: 5, train_loss: 0.9321, test_loss: 0.9975, test_f1: 0.4608
 epoch: 6, train_loss: 0.9014, test_loss: 0.9785, test_f1: 0.5179
 epoch: 7, train_loss: 0.9159, test_loss: 1.1396, test_f1: 0.4250
 epoch: 8, train_loss: 0.8996, test_loss: 1.0106, test_f1: 0.5143
 epoch: 9, train_loss: 0.8850, test_loss: 0.9225, test_f1: 0.5410
 epoch: 10, train_loss: 0.8845, test_loss: 0.9792, test_f1: 0.4982
 epoch: 11, train_loss: 0.8762, test_loss: 0.9465, test_f1: 0.5491
 epoch: 12, train_loss: 0.8415, test_loss: 0.9653, test_f1: 0.5045
 epoch: 13, train_loss: 0.8339, test_loss: 0.9685, test_f1: 0.5149
 epoch: 14, train_loss: 0.8392, test_loss: 0.8822, test_f1: 0.5587
 epoch: 15, train_loss: 0.8234, test_loss: 1.0212, test_f1: 0.5274
 epoch: 16, train_loss: 0.8142, test_loss: 1.0720, test_f1: 0.5481
 epoch: 17, train_loss: 0.7930, test_loss: 0.9163, test_f1: 0.5163
 epoch: 18, train_loss: 0.7912, test_loss: 0.9624, test_f1: 0.5258
 epoch: 19, train_loss: 0.7942, test_loss: 0.8802, test_f1: 0.5509
 epoch: 20, train_loss: 0.7828, test_loss: 0.9234, test_f1: 0.5449
 epoch: 21, train_loss: 0.7853, test_loss: 0.9280, test_f1: 0.5326
 epoch: 22, train_loss: 0.7500, test_loss: 0.9072, test_f1: 0.5239
 epoch: 23, train_loss: 0.7787, test_loss: 0.8979, test_f1: 0.5538
 epoch: 24, train_loss: 0.7544, test_loss: 1.0590, test_f1: 0.4961
 epoch: 25, train_loss: 0.7455, test_loss: 0.9002, test_f1: 0.6205
 epoch: 26, train_loss: 0.7450, test_loss: 0.9429, test_f1: 0.5275
 epoch: 27, train_loss: 0.7601, test_loss: 0.9648, test_f1: 0.5736
 epoch: 28, train_loss: 0.7563, test_loss: 1.0407, test_f1: 0.5259
 epoch: 29, train_loss: 0.7341, test_loss: 0.8954, test_f1: 0.6178
 epoch: 30, train_loss: 0.7305, test_loss: 1.0451, test_f1: 0.5269
 epoch: 31, train_loss: 0.7530, test_loss: 0.8868, test_f1: 0.6045
 epoch: 32, train_loss: 0.7330, test_loss: 0.9848, test_f1: 0.5588
 epoch: 33, train_loss: 0.7118, test_loss: 0.9654, test_f1: 0.5941
 epoch: 34, train_loss: 0.7313, test_loss: 0.9332, test_f1: 0.6153
 epoch: 35, train_loss: 0.7287, test_loss: 1.0630, test_f1: 0.5790
 epoch: 36, train_loss: 0.7271, test_loss: 1.1824, test_f1: 0.5204
 epoch: 37, train_loss: 0.7093, test_loss: 0.8950, test_f1: 0.5736
 epoch: 38, train_loss: 0.7236, test_loss: 1.2169, test_f1: 0.4730
 epoch: 39, train_loss: 0.7021, test_loss: 0.9313, test_f1: 0.5895
 epoch: 40, train_loss: 0.6918, test_loss: 1.0307, test_f1: 0.5707
 epoch: 41, train_loss: 0.6859, test_loss: 0.9179, test_f1: 0.6146
 epoch: 42, train_loss: 0.6906, test_loss: 0.8589, test_f1: 0.6311
 epoch: 43, train_loss: 0.7060, test_loss: 0.8784, test_f1: 0.5984
 epoch: 44, train_loss: 0.7018, test_loss: 1.0341, test_f1: 0.5282
 epoch: 45, train_loss: 0.7058, test_loss: 0.9782, test_f1: 0.6010
 epoch: 46, train_loss: 0.6939, test_loss: 1.0664, test_f1: 0.5948
 epoch: 47, train_loss: 0.6725, test_loss: 0.9189, test_f1: 0.6228
 epoch: 48, train_loss: 0.6607, test_loss: 0.9515, test_f1: 0.5840
 epoch: 49, train_loss: 0.6718, test_loss: 0.9383, test_f1: 0.6029
 epoch: 50, train_loss: 0.6854, test_loss: 1.0069, test_f1: 0.5799
 epoch: 51, train_loss: 0.6532, test_loss: 0.9475, test_f1: 0.6192
 epoch: 52, train_loss: 0.6389, test_loss: 1.0184, test_f1: 0.5946
 epoch: 53, train_loss: 0.6351, test_loss: 0.9650, test_f1: 0.5994
 epoch: 54, train_loss: 0.6175, test_loss: 0.9993, test_f1: 0.6027
 epoch: 55, train_loss: 0.6109, test_loss: 0.9297, test_f1: 0.6334
 epoch: 56, train_loss: 0.6240, test_loss: 0.9270, test_f1: 0.6421
 epoch: 57, train_loss: 0.6124, test_loss: 0.9619, test_f1: 0.6285
 epoch: 58, train_loss: 0.6154, test_loss: 0.9263, test_f1: 0.6348
 epoch: 59, train_loss: 0.5978, test_loss: 0.9448, test_f1: 0.6199
 epoch: 60, train_loss: 0.6109, test_loss: 0.9472, test_f1: 0.6224
 epoch: 61, train_loss: 0.5926, test_loss: 0.9246, test_f1: 0.6446
 epoch: 62, train_loss: 0.6022, test_loss: 0.9627, test_f1: 0.6424
 epoch: 63, train_loss: 0.5995, test_loss: 0.9410, test_f1: 0.6269
 epoch: 64, train_loss: 0.6118, test_loss: 0.9260, test_f1: 0.6325
 epoch: 65, train_loss: 0.6169, test_loss: 0.9790, test_f1: 0.6495
 epoch: 66, train_loss: 0.6188, test_loss: 0.8824, test_f1: 0.6229
 epoch: 67, train_loss: 0.5994, test_loss: 0.9236, test_f1: 0.6654
 epoch: 68, train_loss: 0.5902, test_loss: 1.0495, test_f1: 0.6210
 epoch: 69, train_loss: 0.5873, test_loss: 0.9813, test_f1: 0.5988
 epoch: 70, train_loss: 0.5929, test_loss: 1.0264, test_f1: 0.6310
 epoch: 71, train_loss: 0.6076, test_loss: 0.9514, test_f1: 0.6180
 epoch: 72, train_loss: 0.5787, test_loss: 0.9486, test_f1: 0.6355
 epoch: 73, train_loss: 0.6018, test_loss: 0.9894, test_f1: 0.6346
 epoch: 74, train_loss: 0.5789, test_loss: 0.9372, test_f1: 0.6679
 epoch: 75, train_loss: 0.5710, test_loss: 0.9830, test_f1: 0.6319
 epoch: 76, train_loss: 0.5796, test_loss: 0.9463, test_f1: 0.6565
 epoch: 77, train_loss: 0.5777, test_loss: 0.9130, test_f1: 0.6572
 epoch: 78, train_loss: 0.5746, test_loss: 1.0346, test_f1: 0.6120
 epoch: 79, train_loss: 0.5705, test_loss: 0.9553, test_f1: 0.6371
 epoch: 80, train_loss: 0.5803, test_loss: 0.9724, test_f1: 0.6489
 epoch: 81, train_loss: 0.5804, test_loss: 0.9541, test_f1: 0.6524
 epoch: 82, train_loss: 0.5755, test_loss: 0.9578, test_f1: 0.6273
 epoch: 83, train_loss: 0.5561, test_loss: 1.1694, test_f1: 0.6202
 epoch: 84, train_loss: 0.5558, test_loss: 0.9911, test_f1: 0.6262
 epoch: 85, train_loss: 0.5416, test_loss: 1.0629, test_f1: 0.6195
 epoch: 86, train_loss: 0.5613, test_loss: 1.0288, test_f1: 0.6403
 epoch: 87, train_loss: 0.5689, test_loss: 1.0926, test_f1: 0.6216
 epoch: 88, train_loss: 0.5522, test_loss: 1.0119, test_f1: 0.6260
 epoch: 89, train_loss: 0.5671, test_loss: 0.9516, test_f1: 0.6365
 epoch: 90, train_loss: 0.5480, test_loss: 1.0600, test_f1: 0.6205
 epoch: 91, train_loss: 0.5487, test_loss: 1.0886, test_f1: 0.6322
 epoch: 92, train_loss: 0.5396, test_loss: 1.0370, test_f1: 0.6378
 epoch: 93, train_loss: 0.5479, test_loss: 1.0774, test_f1: 0.6349
 epoch: 94, train_loss: 0.5483, test_loss: 1.0349, test_f1: 0.6314
 epoch: 95, train_loss: 0.5450, test_loss: 0.9607, test_f1: 0.6420
 epoch: 96, train_loss: 0.5396, test_loss: 0.9801, test_f1: 0.6319
 epoch: 97, train_loss: 0.5407, test_loss: 0.9438, test_f1: 0.6509
 epoch: 98, train_loss: 0.5355, test_loss: 1.0341, test_f1: 0.6165
 epoch: 99, train_loss: 0.5400, test_loss: 0.9728, test_f1: 0.6236
##################ITERATION #6 ****************************************
 epoch: 0, train_loss: 1.2050, test_loss: 1.1340, test_f1: 0.3437
 epoch: 1, train_loss: 1.0286, test_loss: 1.1388, test_f1: 0.4557
 epoch: 2, train_loss: 1.0018, test_loss: 1.0486, test_f1: 0.5186
 epoch: 3, train_loss: 0.9705, test_loss: 1.0320, test_f1: 0.5023
 epoch: 4, train_loss: 0.9573, test_loss: 0.9988, test_f1: 0.5277
 epoch: 5, train_loss: 0.9476, test_loss: 1.0234, test_f1: 0.5013
 epoch: 6, train_loss: 0.9350, test_loss: 0.9725, test_f1: 0.5382
 epoch: 7, train_loss: 0.8971, test_loss: 1.0108, test_f1: 0.4903
 epoch: 8, train_loss: 0.9069, test_loss: 0.9820, test_f1: 0.5103
 epoch: 9, train_loss: 0.8731, test_loss: 1.0376, test_f1: 0.4860
 epoch: 10, train_loss: 0.8696, test_loss: 1.0318, test_f1: 0.5019
 epoch: 11, train_loss: 0.8515, test_loss: 1.0120, test_f1: 0.5053
 epoch: 12, train_loss: 0.8308, test_loss: 0.8955, test_f1: 0.5397
 epoch: 13, train_loss: 0.8167, test_loss: 0.9726, test_f1: 0.5037
 epoch: 14, train_loss: 0.8374, test_loss: 0.9057, test_f1: 0.5688
 epoch: 15, train_loss: 0.8250, test_loss: 0.9018, test_f1: 0.5554
 epoch: 16, train_loss: 0.7911, test_loss: 0.9996, test_f1: 0.4904
 epoch: 17, train_loss: 0.7842, test_loss: 1.0139, test_f1: 0.5500
 epoch: 18, train_loss: 0.7842, test_loss: 0.9441, test_f1: 0.5250
 epoch: 19, train_loss: 0.7881, test_loss: 0.9282, test_f1: 0.6059
 epoch: 20, train_loss: 0.7870, test_loss: 0.9120, test_f1: 0.5439
 epoch: 21, train_loss: 0.7726, test_loss: 0.9057, test_f1: 0.5167
 epoch: 22, train_loss: 0.7835, test_loss: 0.9356, test_f1: 0.5738
 epoch: 23, train_loss: 0.7802, test_loss: 0.9784, test_f1: 0.5693
 epoch: 24, train_loss: 0.7829, test_loss: 0.9463, test_f1: 0.5087
 epoch: 25, train_loss: 0.7469, test_loss: 0.9476, test_f1: 0.5429
 epoch: 26, train_loss: 0.7360, test_loss: 0.9283, test_f1: 0.5322
 epoch: 27, train_loss: 0.7329, test_loss: 0.8831, test_f1: 0.6118
 epoch: 28, train_loss: 0.7214, test_loss: 0.8629, test_f1: 0.6235
 epoch: 29, train_loss: 0.7258, test_loss: 0.8602, test_f1: 0.5688
 epoch: 30, train_loss: 0.7305, test_loss: 0.9733, test_f1: 0.5829
 epoch: 31, train_loss: 0.7067, test_loss: 0.9650, test_f1: 0.5897
 epoch: 32, train_loss: 0.7310, test_loss: 0.9061, test_f1: 0.5803
 epoch: 33, train_loss: 0.7042, test_loss: 0.8585, test_f1: 0.6294
 epoch: 34, train_loss: 0.7076, test_loss: 0.8958, test_f1: 0.6013
 epoch: 35, train_loss: 0.6931, test_loss: 0.9827, test_f1: 0.5979
 epoch: 36, train_loss: 0.6696, test_loss: 1.0038, test_f1: 0.5990
 epoch: 37, train_loss: 0.6891, test_loss: 0.8969, test_f1: 0.6085
 epoch: 38, train_loss: 0.6877, test_loss: 0.9190, test_f1: 0.6174
 epoch: 39, train_loss: 0.6875, test_loss: 0.9977, test_f1: 0.5422
 epoch: 40, train_loss: 0.6866, test_loss: 0.8841, test_f1: 0.6332
 epoch: 41, train_loss: 0.6767, test_loss: 0.8902, test_f1: 0.6111
 epoch: 42, train_loss: 0.6762, test_loss: 0.9190, test_f1: 0.5877
 epoch: 43, train_loss: 0.6823, test_loss: 0.9102, test_f1: 0.6030
 epoch: 44, train_loss: 0.6820, test_loss: 0.8647, test_f1: 0.6522
 epoch: 45, train_loss: 0.6713, test_loss: 0.8863, test_f1: 0.6100
 epoch: 46, train_loss: 0.6682, test_loss: 0.8510, test_f1: 0.6479
 epoch: 47, train_loss: 0.6489, test_loss: 1.0081, test_f1: 0.6007
 epoch: 48, train_loss: 0.6663, test_loss: 0.9988, test_f1: 0.5993
 epoch: 49, train_loss: 0.6555, test_loss: 0.9850, test_f1: 0.5441
 epoch: 50, train_loss: 0.6753, test_loss: 0.9079, test_f1: 0.6486
 epoch: 51, train_loss: 0.6241, test_loss: 0.9198, test_f1: 0.6228
 epoch: 52, train_loss: 0.6187, test_loss: 0.9254, test_f1: 0.6471
 epoch: 53, train_loss: 0.5929, test_loss: 0.9160, test_f1: 0.6434
 epoch: 54, train_loss: 0.5882, test_loss: 0.9374, test_f1: 0.6372
 epoch: 55, train_loss: 0.5855, test_loss: 0.9272, test_f1: 0.6614
 epoch: 56, train_loss: 0.5696, test_loss: 0.9127, test_f1: 0.6598
 epoch: 57, train_loss: 0.5804, test_loss: 0.9416, test_f1: 0.6398
 epoch: 58, train_loss: 0.5653, test_loss: 0.9013, test_f1: 0.6409
 epoch: 59, train_loss: 0.5851, test_loss: 0.9578, test_f1: 0.6501
 epoch: 60, train_loss: 0.5803, test_loss: 0.9111, test_f1: 0.6495
 epoch: 61, train_loss: 0.5651, test_loss: 0.9446, test_f1: 0.6662
 epoch: 62, train_loss: 0.5400, test_loss: 1.0112, test_f1: 0.6569
 epoch: 63, train_loss: 0.5474, test_loss: 0.9315, test_f1: 0.6376
 epoch: 64, train_loss: 0.5588, test_loss: 0.9546, test_f1: 0.6540
 epoch: 65, train_loss: 0.5523, test_loss: 0.9382, test_f1: 0.6667
 epoch: 66, train_loss: 0.5561, test_loss: 0.9136, test_f1: 0.6296
 epoch: 67, train_loss: 0.5609, test_loss: 0.9209, test_f1: 0.6702
 epoch: 68, train_loss: 0.5501, test_loss: 0.9566, test_f1: 0.6506
 epoch: 69, train_loss: 0.5424, test_loss: 1.0317, test_f1: 0.6300
 epoch: 70, train_loss: 0.5540, test_loss: 0.9282, test_f1: 0.6663
 epoch: 71, train_loss: 0.5485, test_loss: 0.9123, test_f1: 0.6573
 epoch: 72, train_loss: 0.5313, test_loss: 0.9358, test_f1: 0.6467
 epoch: 73, train_loss: 0.5309, test_loss: 0.9119, test_f1: 0.6467
 epoch: 74, train_loss: 0.5389, test_loss: 0.9692, test_f1: 0.6606
 epoch: 75, train_loss: 0.5481, test_loss: 1.0185, test_f1: 0.6464
 epoch: 76, train_loss: 0.5373, test_loss: 0.9969, test_f1: 0.6391
 epoch: 77, train_loss: 0.5364, test_loss: 0.9663, test_f1: 0.6507
 epoch: 78, train_loss: 0.5382, test_loss: 0.9583, test_f1: 0.6718
 epoch: 79, train_loss: 0.5163, test_loss: 1.0615, test_f1: 0.6449
 epoch: 80, train_loss: 0.5314, test_loss: 1.0862, test_f1: 0.6570
 epoch: 81, train_loss: 0.5146, test_loss: 0.9977, test_f1: 0.6555
 epoch: 82, train_loss: 0.5274, test_loss: 1.0607, test_f1: 0.6783
 epoch: 83, train_loss: 0.5146, test_loss: 1.0685, test_f1: 0.6059
 epoch: 84, train_loss: 0.5138, test_loss: 0.9949, test_f1: 0.6228
 epoch: 85, train_loss: 0.5103, test_loss: 0.9900, test_f1: 0.6515
 epoch: 86, train_loss: 0.5182, test_loss: 0.9978, test_f1: 0.6505
 epoch: 87, train_loss: 0.5323, test_loss: 0.9014, test_f1: 0.6814
 epoch: 88, train_loss: 0.5140, test_loss: 0.9546, test_f1: 0.6660
 epoch: 89, train_loss: 0.5018, test_loss: 1.0268, test_f1: 0.6626
 epoch: 90, train_loss: 0.5050, test_loss: 1.0507, test_f1: 0.6758
 epoch: 91, train_loss: 0.5063, test_loss: 1.0434, test_f1: 0.6525
 epoch: 92, train_loss: 0.5049, test_loss: 1.0570, test_f1: 0.6745
 epoch: 93, train_loss: 0.5079, test_loss: 1.0337, test_f1: 0.6338
 epoch: 94, train_loss: 0.5033, test_loss: 0.9918, test_f1: 0.6777
 epoch: 95, train_loss: 0.4882, test_loss: 0.9711, test_f1: 0.6512
 epoch: 96, train_loss: 0.4919, test_loss: 1.0809, test_f1: 0.6426
 epoch: 97, train_loss: 0.4915, test_loss: 1.0836, test_f1: 0.6347
 epoch: 98, train_loss: 0.5019, test_loss: 1.0252, test_f1: 0.6464
 epoch: 99, train_loss: 0.4812, test_loss: 0.9682, test_f1: 0.6644
##################ITERATION #7 ****************************************
 epoch: 0, train_loss: 1.1433, test_loss: 1.1121, test_f1: 0.4497
 epoch: 1, train_loss: 0.9974, test_loss: 1.0112, test_f1: 0.5090
 epoch: 2, train_loss: 0.9691, test_loss: 0.9387, test_f1: 0.5336
 epoch: 3, train_loss: 0.9373, test_loss: 1.0353, test_f1: 0.4709
 epoch: 4, train_loss: 0.9200, test_loss: 1.3119, test_f1: 0.4205
 epoch: 5, train_loss: 0.9375, test_loss: 0.9252, test_f1: 0.4950
 epoch: 6, train_loss: 0.8911, test_loss: 0.9181, test_f1: 0.5834
 epoch: 7, train_loss: 0.8693, test_loss: 0.9495, test_f1: 0.5388
 epoch: 8, train_loss: 0.8820, test_loss: 0.9733, test_f1: 0.5032
 epoch: 9, train_loss: 0.8639, test_loss: 1.0012, test_f1: 0.5304
 epoch: 10, train_loss: 0.8339, test_loss: 0.9059, test_f1: 0.6103
 epoch: 11, train_loss: 0.8390, test_loss: 1.0539, test_f1: 0.5055
 epoch: 12, train_loss: 0.8348, test_loss: 0.9347, test_f1: 0.5467
 epoch: 13, train_loss: 0.8325, test_loss: 0.9058, test_f1: 0.5591
 epoch: 14, train_loss: 0.8200, test_loss: 0.9777, test_f1: 0.5426
 epoch: 15, train_loss: 0.8095, test_loss: 0.9339, test_f1: 0.5683
 epoch: 16, train_loss: 0.8056, test_loss: 0.9131, test_f1: 0.5814
 epoch: 17, train_loss: 0.7929, test_loss: 0.9523, test_f1: 0.5124
 epoch: 18, train_loss: 0.8027, test_loss: 0.9469, test_f1: 0.5262
 epoch: 19, train_loss: 0.7741, test_loss: 0.8872, test_f1: 0.5798
 epoch: 20, train_loss: 0.7658, test_loss: 0.9176, test_f1: 0.5524
 epoch: 21, train_loss: 0.7715, test_loss: 1.2009, test_f1: 0.4861
 epoch: 22, train_loss: 0.7626, test_loss: 0.9177, test_f1: 0.5340
 epoch: 23, train_loss: 0.7704, test_loss: 0.8817, test_f1: 0.5730
 epoch: 24, train_loss: 0.7491, test_loss: 0.8588, test_f1: 0.5806
 epoch: 25, train_loss: 0.7766, test_loss: 0.9654, test_f1: 0.5208
 epoch: 26, train_loss: 0.7362, test_loss: 0.8764, test_f1: 0.5996
 epoch: 27, train_loss: 0.7341, test_loss: 0.9006, test_f1: 0.6138
 epoch: 28, train_loss: 0.7236, test_loss: 0.9320, test_f1: 0.5875
 epoch: 29, train_loss: 0.7196, test_loss: 0.9048, test_f1: 0.5791
 epoch: 30, train_loss: 0.7023, test_loss: 0.9442, test_f1: 0.5668
 epoch: 31, train_loss: 0.7242, test_loss: 1.0107, test_f1: 0.5446
 epoch: 32, train_loss: 0.7139, test_loss: 0.9227, test_f1: 0.5155
 epoch: 33, train_loss: 0.7392, test_loss: 1.2677, test_f1: 0.5345
 epoch: 34, train_loss: 0.7043, test_loss: 0.9039, test_f1: 0.5970
 epoch: 35, train_loss: 0.7034, test_loss: 0.8421, test_f1: 0.5858
 epoch: 36, train_loss: 0.6934, test_loss: 0.9222, test_f1: 0.6030
 epoch: 37, train_loss: 0.7040, test_loss: 1.0144, test_f1: 0.6082
 epoch: 38, train_loss: 0.7088, test_loss: 1.1494, test_f1: 0.5465
 epoch: 39, train_loss: 0.7252, test_loss: 0.9626, test_f1: 0.6074
 epoch: 40, train_loss: 0.7121, test_loss: 0.9191, test_f1: 0.5700
 epoch: 41, train_loss: 0.7130, test_loss: 0.9199, test_f1: 0.6279
 epoch: 42, train_loss: 0.6966, test_loss: 1.0020, test_f1: 0.5544
 epoch: 43, train_loss: 0.7011, test_loss: 0.9765, test_f1: 0.5736
 epoch: 44, train_loss: 0.6930, test_loss: 0.9662, test_f1: 0.5731
 epoch: 45, train_loss: 0.6975, test_loss: 0.9655, test_f1: 0.6057
 epoch: 46, train_loss: 0.6838, test_loss: 1.2056, test_f1: 0.5350
 epoch: 47, train_loss: 0.6681, test_loss: 0.9340, test_f1: 0.6014
 epoch: 48, train_loss: 0.6717, test_loss: 0.9596, test_f1: 0.6033
 epoch: 49, train_loss: 0.6564, test_loss: 1.1102, test_f1: 0.5377
 epoch: 50, train_loss: 0.6753, test_loss: 0.9187, test_f1: 0.6166
 epoch: 51, train_loss: 0.6484, test_loss: 0.9475, test_f1: 0.6306
 epoch: 52, train_loss: 0.6274, test_loss: 0.9100, test_f1: 0.6553
 epoch: 53, train_loss: 0.6249, test_loss: 1.0193, test_f1: 0.6255
 epoch: 54, train_loss: 0.6110, test_loss: 0.9479, test_f1: 0.6357
 epoch: 55, train_loss: 0.6060, test_loss: 0.9647, test_f1: 0.6167
 epoch: 56, train_loss: 0.6084, test_loss: 0.9500, test_f1: 0.6108
 epoch: 57, train_loss: 0.6011, test_loss: 0.9497, test_f1: 0.6437
 epoch: 58, train_loss: 0.6161, test_loss: 0.9898, test_f1: 0.6390
 epoch: 59, train_loss: 0.5981, test_loss: 1.0068, test_f1: 0.6145
 epoch: 60, train_loss: 0.6092, test_loss: 0.9266, test_f1: 0.6178
 epoch: 61, train_loss: 0.6024, test_loss: 0.9362, test_f1: 0.6365
 epoch: 62, train_loss: 0.5828, test_loss: 0.9480, test_f1: 0.6456
 epoch: 63, train_loss: 0.5847, test_loss: 1.0278, test_f1: 0.6150
 epoch: 64, train_loss: 0.5849, test_loss: 0.9871, test_f1: 0.6651
 epoch: 65, train_loss: 0.5859, test_loss: 1.0453, test_f1: 0.6166
 epoch: 66, train_loss: 0.6074, test_loss: 1.0245, test_f1: 0.6314
 epoch: 67, train_loss: 0.6024, test_loss: 1.0079, test_f1: 0.6077
 epoch: 68, train_loss: 0.5765, test_loss: 1.0019, test_f1: 0.6396
 epoch: 69, train_loss: 0.5817, test_loss: 0.9866, test_f1: 0.6345
 epoch: 70, train_loss: 0.5698, test_loss: 0.9790, test_f1: 0.6731
 epoch: 71, train_loss: 0.5807, test_loss: 0.9801, test_f1: 0.6617
 epoch: 72, train_loss: 0.5839, test_loss: 0.9747, test_f1: 0.6715
 epoch: 73, train_loss: 0.5781, test_loss: 0.9631, test_f1: 0.5992
 epoch: 74, train_loss: 0.5830, test_loss: 0.9527, test_f1: 0.6565
 epoch: 75, train_loss: 0.5748, test_loss: 1.0042, test_f1: 0.6269
 epoch: 76, train_loss: 0.5758, test_loss: 0.9392, test_f1: 0.6297
 epoch: 77, train_loss: 0.5648, test_loss: 1.0909, test_f1: 0.6252
 epoch: 78, train_loss: 0.5635, test_loss: 0.9333, test_f1: 0.6604
 epoch: 79, train_loss: 0.5574, test_loss: 0.9451, test_f1: 0.6386
 epoch: 80, train_loss: 0.5373, test_loss: 1.0603, test_f1: 0.6181
 epoch: 81, train_loss: 0.5735, test_loss: 1.0315, test_f1: 0.6349
 epoch: 82, train_loss: 0.5624, test_loss: 0.9570, test_f1: 0.6663
 epoch: 83, train_loss: 0.5523, test_loss: 0.9469, test_f1: 0.6548
 epoch: 84, train_loss: 0.5463, test_loss: 1.1218, test_f1: 0.6496
 epoch: 85, train_loss: 0.5539, test_loss: 0.9907, test_f1: 0.6441
 epoch: 86, train_loss: 0.5550, test_loss: 1.0153, test_f1: 0.6006
 epoch: 87, train_loss: 0.5642, test_loss: 1.0677, test_f1: 0.6501
 epoch: 88, train_loss: 0.5537, test_loss: 1.0190, test_f1: 0.6353
 epoch: 89, train_loss: 0.5275, test_loss: 1.0005, test_f1: 0.6603
 epoch: 90, train_loss: 0.5462, test_loss: 0.9642, test_f1: 0.6422
 epoch: 91, train_loss: 0.5368, test_loss: 1.1811, test_f1: 0.6062
 epoch: 92, train_loss: 0.5414, test_loss: 1.0540, test_f1: 0.6491
 epoch: 93, train_loss: 0.5446, test_loss: 1.0113, test_f1: 0.6259
 epoch: 94, train_loss: 0.5275, test_loss: 1.0608, test_f1: 0.6700
 epoch: 95, train_loss: 0.5421, test_loss: 1.0844, test_f1: 0.6372
 epoch: 96, train_loss: 0.5660, test_loss: 0.9588, test_f1: 0.6553
 epoch: 97, train_loss: 0.5254, test_loss: 1.0124, test_f1: 0.6564
 epoch: 98, train_loss: 0.5215, test_loss: 0.9938, test_f1: 0.6252
 epoch: 99, train_loss: 0.5444, test_loss: 0.9737, test_f1: 0.6484
##################ITERATION #8 ****************************************
 epoch: 0, train_loss: 1.1821, test_loss: 1.1016, test_f1: 0.3804
 epoch: 1, train_loss: 1.0069, test_loss: 1.0172, test_f1: 0.4654
 epoch: 2, train_loss: 0.9468, test_loss: 1.0769, test_f1: 0.4460
 epoch: 3, train_loss: 0.9402, test_loss: 0.9500, test_f1: 0.4566
 epoch: 4, train_loss: 0.9250, test_loss: 0.9620, test_f1: 0.5413
 epoch: 5, train_loss: 0.9020, test_loss: 1.0295, test_f1: 0.5247
 epoch: 6, train_loss: 0.8876, test_loss: 0.9041, test_f1: 0.5554
 epoch: 7, train_loss: 0.8541, test_loss: 1.0387, test_f1: 0.4817
 epoch: 8, train_loss: 0.8641, test_loss: 0.9616, test_f1: 0.5226
 epoch: 9, train_loss: 0.8355, test_loss: 1.2716, test_f1: 0.4319
 epoch: 10, train_loss: 0.8558, test_loss: 1.0109, test_f1: 0.5123
 epoch: 11, train_loss: 0.8517, test_loss: 1.5616, test_f1: 0.3803
 epoch: 12, train_loss: 0.8291, test_loss: 0.8671, test_f1: 0.5633
 epoch: 13, train_loss: 0.8220, test_loss: 1.1298, test_f1: 0.4648
 epoch: 14, train_loss: 0.8305, test_loss: 0.9896, test_f1: 0.5241
 epoch: 15, train_loss: 0.8233, test_loss: 0.9604, test_f1: 0.6122
 epoch: 16, train_loss: 0.8046, test_loss: 0.9061, test_f1: 0.5475
 epoch: 17, train_loss: 0.7866, test_loss: 1.1566, test_f1: 0.4985
 epoch: 18, train_loss: 0.7979, test_loss: 0.8948, test_f1: 0.5443
 epoch: 19, train_loss: 0.7856, test_loss: 1.1185, test_f1: 0.4703
 epoch: 20, train_loss: 0.7749, test_loss: 1.0483, test_f1: 0.5782
 epoch: 21, train_loss: 0.7726, test_loss: 0.9187, test_f1: 0.5514
 epoch: 22, train_loss: 0.7702, test_loss: 0.9646, test_f1: 0.5614
 epoch: 23, train_loss: 0.7703, test_loss: 1.3136, test_f1: 0.4741
 epoch: 24, train_loss: 0.7621, test_loss: 0.8340, test_f1: 0.5638
 epoch: 25, train_loss: 0.7740, test_loss: 0.9629, test_f1: 0.5567
 epoch: 26, train_loss: 0.7874, test_loss: 0.9479, test_f1: 0.5461
 epoch: 27, train_loss: 0.7462, test_loss: 0.9072, test_f1: 0.6024
 epoch: 28, train_loss: 0.7309, test_loss: 0.9873, test_f1: 0.5697
 epoch: 29, train_loss: 0.7614, test_loss: 0.9150, test_f1: 0.5766
 epoch: 30, train_loss: 0.7278, test_loss: 1.0278, test_f1: 0.5871
 epoch: 31, train_loss: 0.7361, test_loss: 1.2979, test_f1: 0.5677
 epoch: 32, train_loss: 0.7336, test_loss: 0.9373, test_f1: 0.6127
 epoch: 33, train_loss: 0.7247, test_loss: 0.9943, test_f1: 0.5406
 epoch: 34, train_loss: 0.7243, test_loss: 1.0572, test_f1: 0.5932
 epoch: 35, train_loss: 0.7410, test_loss: 1.0833, test_f1: 0.6248
 epoch: 36, train_loss: 0.7281, test_loss: 1.0069, test_f1: 0.5992
 epoch: 37, train_loss: 0.7210, test_loss: 1.0049, test_f1: 0.6168
 epoch: 38, train_loss: 0.6944, test_loss: 0.9530, test_f1: 0.6241
 epoch: 39, train_loss: 0.7190, test_loss: 0.9637, test_f1: 0.5901
 epoch: 40, train_loss: 0.7068, test_loss: 1.0804, test_f1: 0.6163
 epoch: 41, train_loss: 0.6917, test_loss: 0.9812, test_f1: 0.6436
 epoch: 42, train_loss: 0.6647, test_loss: 1.0140, test_f1: 0.6144
 epoch: 43, train_loss: 0.6767, test_loss: 1.3990, test_f1: 0.5333
 epoch: 44, train_loss: 0.6929, test_loss: 0.9574, test_f1: 0.6019
 epoch: 45, train_loss: 0.6831, test_loss: 0.9789, test_f1: 0.5844
 epoch: 46, train_loss: 0.6506, test_loss: 1.2626, test_f1: 0.6109
 epoch: 47, train_loss: 0.6812, test_loss: 1.1132, test_f1: 0.6001
 epoch: 48, train_loss: 0.6891, test_loss: 0.8202, test_f1: 0.6062
 epoch: 49, train_loss: 0.6761, test_loss: 0.9406, test_f1: 0.6094
 epoch: 50, train_loss: 0.6829, test_loss: 0.9610, test_f1: 0.5929
 epoch: 51, train_loss: 0.6480, test_loss: 1.0610, test_f1: 0.6221
 epoch: 52, train_loss: 0.6252, test_loss: 1.0637, test_f1: 0.6187
 epoch: 53, train_loss: 0.6123, test_loss: 1.0141, test_f1: 0.6323
 epoch: 54, train_loss: 0.5988, test_loss: 1.0813, test_f1: 0.6240
 epoch: 55, train_loss: 0.6194, test_loss: 0.9634, test_f1: 0.6353
 epoch: 56, train_loss: 0.6213, test_loss: 1.0461, test_f1: 0.6310
 epoch: 57, train_loss: 0.6058, test_loss: 1.0378, test_f1: 0.6667
 epoch: 58, train_loss: 0.6067, test_loss: 1.0178, test_f1: 0.6577
 epoch: 59, train_loss: 0.5809, test_loss: 0.9700, test_f1: 0.6443
 epoch: 60, train_loss: 0.6018, test_loss: 0.9813, test_f1: 0.6239
 epoch: 61, train_loss: 0.5900, test_loss: 1.0856, test_f1: 0.6388
 epoch: 62, train_loss: 0.6106, test_loss: 1.0207, test_f1: 0.6256
 epoch: 63, train_loss: 0.5755, test_loss: 0.9545, test_f1: 0.6495
 epoch: 64, train_loss: 0.5822, test_loss: 1.0954, test_f1: 0.6367
 epoch: 65, train_loss: 0.5913, test_loss: 0.9856, test_f1: 0.6497
 epoch: 66, train_loss: 0.5894, test_loss: 1.1151, test_f1: 0.6331
 epoch: 67, train_loss: 0.5781, test_loss: 1.0486, test_f1: 0.6497
 epoch: 68, train_loss: 0.5650, test_loss: 1.0795, test_f1: 0.6495
 epoch: 69, train_loss: 0.5866, test_loss: 1.0235, test_f1: 0.6373
 epoch: 70, train_loss: 0.5905, test_loss: 1.2585, test_f1: 0.5980
 epoch: 71, train_loss: 0.5612, test_loss: 1.0607, test_f1: 0.6504
 epoch: 72, train_loss: 0.5671, test_loss: 1.0871, test_f1: 0.6388
 epoch: 73, train_loss: 0.5500, test_loss: 1.0451, test_f1: 0.6402
 epoch: 74, train_loss: 0.5408, test_loss: 1.1772, test_f1: 0.6500
 epoch: 75, train_loss: 0.5578, test_loss: 1.1129, test_f1: 0.6259
 epoch: 76, train_loss: 0.5426, test_loss: 1.3074, test_f1: 0.6380
 epoch: 77, train_loss: 0.5509, test_loss: 1.3290, test_f1: 0.6215
 epoch: 78, train_loss: 0.5459, test_loss: 1.3737, test_f1: 0.6307
 epoch: 79, train_loss: 0.5402, test_loss: 1.1917, test_f1: 0.6291
 epoch: 80, train_loss: 0.5502, test_loss: 1.2532, test_f1: 0.6330
 epoch: 81, train_loss: 0.5358, test_loss: 1.3280, test_f1: 0.6330
 epoch: 82, train_loss: 0.5406, test_loss: 1.2533, test_f1: 0.6422
 epoch: 83, train_loss: 0.5396, test_loss: 1.2017, test_f1: 0.6107
 epoch: 84, train_loss: 0.5594, test_loss: 1.0571, test_f1: 0.6528
 epoch: 85, train_loss: 0.5465, test_loss: 1.1222, test_f1: 0.6320
 epoch: 86, train_loss: 0.5556, test_loss: 1.1844, test_f1: 0.6379
 epoch: 87, train_loss: 0.5325, test_loss: 1.0347, test_f1: 0.6572
 epoch: 88, train_loss: 0.5279, test_loss: 1.2632, test_f1: 0.6457
 epoch: 89, train_loss: 0.5345, test_loss: 1.0798, test_f1: 0.6551
 epoch: 90, train_loss: 0.5234, test_loss: 1.0395, test_f1: 0.6690
 epoch: 91, train_loss: 0.5172, test_loss: 1.1900, test_f1: 0.6320
 epoch: 92, train_loss: 0.5225, test_loss: 1.2476, test_f1: 0.6552
 epoch: 93, train_loss: 0.5328, test_loss: 1.0979, test_f1: 0.6697
 epoch: 94, train_loss: 0.5119, test_loss: 1.1360, test_f1: 0.6238
 epoch: 95, train_loss: 0.5155, test_loss: 1.2043, test_f1: 0.6598
 epoch: 96, train_loss: 0.5314, test_loss: 1.1560, test_f1: 0.6210
 epoch: 97, train_loss: 0.4825, test_loss: 1.1444, test_f1: 0.6716
 epoch: 98, train_loss: 0.5021, test_loss: 1.1924, test_f1: 0.6456
 epoch: 99, train_loss: 0.4992, test_loss: 1.0874, test_f1: 0.6673
##################ITERATION #9 ****************************************
 epoch: 0, train_loss: 1.2116, test_loss: 1.1418, test_f1: 0.4239
 epoch: 1, train_loss: 1.0613, test_loss: 1.0741, test_f1: 0.4617
 epoch: 2, train_loss: 1.0202, test_loss: 1.1348, test_f1: 0.4466
 epoch: 3, train_loss: 1.0043, test_loss: 1.0918, test_f1: 0.4878
 epoch: 4, train_loss: 0.9796, test_loss: 1.0408, test_f1: 0.4898
 epoch: 5, train_loss: 0.9805, test_loss: 1.0636, test_f1: 0.4814
 epoch: 6, train_loss: 0.9526, test_loss: 1.0667, test_f1: 0.4971
 epoch: 7, train_loss: 0.9370, test_loss: 1.1974, test_f1: 0.4118
 epoch: 8, train_loss: 0.9241, test_loss: 1.0068, test_f1: 0.5185
 epoch: 9, train_loss: 0.8997, test_loss: 1.0431, test_f1: 0.5055
 epoch: 10, train_loss: 0.8917, test_loss: 1.3166, test_f1: 0.4509
 epoch: 11, train_loss: 0.9009, test_loss: 1.1530, test_f1: 0.4955
 epoch: 12, train_loss: 0.8851, test_loss: 0.9202, test_f1: 0.5365
 epoch: 13, train_loss: 0.8530, test_loss: 0.9361, test_f1: 0.5441
 epoch: 14, train_loss: 0.8657, test_loss: 0.9647, test_f1: 0.4914
 epoch: 15, train_loss: 0.8362, test_loss: 0.8837, test_f1: 0.5607
 epoch: 16, train_loss: 0.8397, test_loss: 0.9537, test_f1: 0.5250
 epoch: 17, train_loss: 0.8324, test_loss: 0.9108, test_f1: 0.5808
 epoch: 18, train_loss: 0.8021, test_loss: 0.9948, test_f1: 0.5201
 epoch: 19, train_loss: 0.8314, test_loss: 0.9932, test_f1: 0.5146
 epoch: 20, train_loss: 0.8084, test_loss: 0.8919, test_f1: 0.5774
 epoch: 21, train_loss: 0.7842, test_loss: 0.8285, test_f1: 0.5937
 epoch: 22, train_loss: 0.7751, test_loss: 0.9325, test_f1: 0.5676
 epoch: 23, train_loss: 0.7938, test_loss: 0.9787, test_f1: 0.5795
 epoch: 24, train_loss: 0.7846, test_loss: 0.9207, test_f1: 0.5767
 epoch: 25, train_loss: 0.7962, test_loss: 1.1693, test_f1: 0.4484
 epoch: 26, train_loss: 0.7567, test_loss: 0.8550, test_f1: 0.5510
 epoch: 27, train_loss: 0.7470, test_loss: 0.9940, test_f1: 0.5437
 epoch: 28, train_loss: 0.7692, test_loss: 0.9521, test_f1: 0.5601
 epoch: 29, train_loss: 0.7555, test_loss: 0.9145, test_f1: 0.5580
 epoch: 30, train_loss: 0.7302, test_loss: 0.9353, test_f1: 0.5469
 epoch: 31, train_loss: 0.7251, test_loss: 0.9292, test_f1: 0.6000
 epoch: 32, train_loss: 0.7203, test_loss: 1.0154, test_f1: 0.5579
 epoch: 33, train_loss: 0.7320, test_loss: 0.9812, test_f1: 0.5857
 epoch: 34, train_loss: 0.7288, test_loss: 0.9916, test_f1: 0.5654
 epoch: 35, train_loss: 0.7181, test_loss: 0.9469, test_f1: 0.5414
 epoch: 36, train_loss: 0.7051, test_loss: 0.9907, test_f1: 0.5282
 epoch: 37, train_loss: 0.6968, test_loss: 1.2820, test_f1: 0.5147
 epoch: 38, train_loss: 0.7312, test_loss: 0.8979, test_f1: 0.5591
 epoch: 39, train_loss: 0.7188, test_loss: 0.9016, test_f1: 0.5135
 epoch: 40, train_loss: 0.6960, test_loss: 0.8997, test_f1: 0.5664
 epoch: 41, train_loss: 0.6957, test_loss: 1.0151, test_f1: 0.5650
 epoch: 42, train_loss: 0.6735, test_loss: 0.8851, test_f1: 0.5843
 epoch: 43, train_loss: 0.6794, test_loss: 0.8438, test_f1: 0.5733
 epoch: 44, train_loss: 0.6792, test_loss: 0.9138, test_f1: 0.5513
 epoch: 45, train_loss: 0.6895, test_loss: 0.9685, test_f1: 0.6187
 epoch: 46, train_loss: 0.7066, test_loss: 1.0243, test_f1: 0.6110
 epoch: 47, train_loss: 0.6916, test_loss: 0.9073, test_f1: 0.5712
 epoch: 48, train_loss: 0.6767, test_loss: 0.8996, test_f1: 0.6080
 epoch: 49, train_loss: 0.6564, test_loss: 1.0495, test_f1: 0.5585
 epoch: 50, train_loss: 0.7253, test_loss: 0.9250, test_f1: 0.6162
 epoch: 51, train_loss: 0.6546, test_loss: 0.9502, test_f1: 0.6045
 epoch: 52, train_loss: 0.6331, test_loss: 0.9669, test_f1: 0.6008
 epoch: 53, train_loss: 0.6179, test_loss: 0.9428, test_f1: 0.6440
 epoch: 54, train_loss: 0.6152, test_loss: 0.9633, test_f1: 0.5969
 epoch: 55, train_loss: 0.6162, test_loss: 0.9212, test_f1: 0.6352
 epoch: 56, train_loss: 0.6088, test_loss: 0.9451, test_f1: 0.6214
 epoch: 57, train_loss: 0.6013, test_loss: 0.9034, test_f1: 0.6507
 epoch: 58, train_loss: 0.6163, test_loss: 0.9856, test_f1: 0.6019
 epoch: 59, train_loss: 0.5956, test_loss: 0.9639, test_f1: 0.6310
 epoch: 60, train_loss: 0.6025, test_loss: 0.9559, test_f1: 0.6541
 epoch: 61, train_loss: 0.6045, test_loss: 0.9381, test_f1: 0.6215
 epoch: 62, train_loss: 0.6070, test_loss: 0.9459, test_f1: 0.5999
 epoch: 63, train_loss: 0.5992, test_loss: 0.9513, test_f1: 0.6294
 epoch: 64, train_loss: 0.5792, test_loss: 0.8894, test_f1: 0.6434
 epoch: 65, train_loss: 0.5880, test_loss: 0.9588, test_f1: 0.6100
 epoch: 66, train_loss: 0.5846, test_loss: 0.9518, test_f1: 0.6187
 epoch: 67, train_loss: 0.5840, test_loss: 0.9443, test_f1: 0.6445
 epoch: 68, train_loss: 0.5743, test_loss: 0.9862, test_f1: 0.6262
 epoch: 69, train_loss: 0.5787, test_loss: 0.9178, test_f1: 0.6255
 epoch: 70, train_loss: 0.5724, test_loss: 0.9564, test_f1: 0.6518
 epoch: 71, train_loss: 0.5595, test_loss: 1.1800, test_f1: 0.5891
 epoch: 72, train_loss: 0.5761, test_loss: 0.9660, test_f1: 0.6069
 epoch: 73, train_loss: 0.5772, test_loss: 0.9907, test_f1: 0.6524
 epoch: 74, train_loss: 0.5818, test_loss: 0.9999, test_f1: 0.6261
 epoch: 75, train_loss: 0.5639, test_loss: 0.9569, test_f1: 0.6041
 epoch: 76, train_loss: 0.5631, test_loss: 1.0161, test_f1: 0.6317
 epoch: 77, train_loss: 0.5760, test_loss: 0.9441, test_f1: 0.6605
 epoch: 78, train_loss: 0.5639, test_loss: 0.9718, test_f1: 0.6361
 epoch: 79, train_loss: 0.5597, test_loss: 1.0014, test_f1: 0.5967
 epoch: 80, train_loss: 0.5644, test_loss: 1.0217, test_f1: 0.6176
 epoch: 81, train_loss: 0.5454, test_loss: 1.0667, test_f1: 0.6071
 epoch: 82, train_loss: 0.5474, test_loss: 1.0856, test_f1: 0.6153
 epoch: 83, train_loss: 0.5380, test_loss: 0.9518, test_f1: 0.6448
 epoch: 84, train_loss: 0.5497, test_loss: 0.9862, test_f1: 0.6356
 epoch: 85, train_loss: 0.5700, test_loss: 1.1000, test_f1: 0.6185
 epoch: 86, train_loss: 0.5791, test_loss: 1.0378, test_f1: 0.6258
 epoch: 87, train_loss: 0.5271, test_loss: 1.0600, test_f1: 0.6015
 epoch: 88, train_loss: 0.5496, test_loss: 1.0164, test_f1: 0.6231
 epoch: 89, train_loss: 0.5335, test_loss: 1.0322, test_f1: 0.6226
 epoch: 90, train_loss: 0.5440, test_loss: 1.2274, test_f1: 0.5879
 epoch: 91, train_loss: 0.5339, test_loss: 0.9825, test_f1: 0.6208
 epoch: 92, train_loss: 0.5360, test_loss: 1.0126, test_f1: 0.6222
 epoch: 93, train_loss: 0.5348, test_loss: 1.1505, test_f1: 0.6056
 epoch: 94, train_loss: 0.5444, test_loss: 1.0791, test_f1: 0.6331
 epoch: 95, train_loss: 0.5184, test_loss: 1.2131, test_f1: 0.6152
 epoch: 96, train_loss: 0.5265, test_loss: 1.0236, test_f1: 0.6547
 epoch: 97, train_loss: 0.5132, test_loss: 1.1435, test_f1: 0.6282
 epoch: 98, train_loss: 0.5261, test_loss: 1.0457, test_f1: 0.6351
 epoch: 99, train_loss: 0.5301, test_loss: 1.1055, test_f1: 0.6302

Training completed in 482.81 seconds
Best F1: 0.6887 at epoch 93
Mean F1 across iterations: 0.6713  0.0094
========================FINAL RESULTS================================
FEGIN weighted F1: 0.6887  0.0094
python main.py --data ltspice_examples --representation component_pin --model FEGIN --layers 3 --hiddens 32 --batch_size 128 --lr 0.01 --emb_size 128 --epochs 100 --save_appendix component_pin_L3_H32_BS128_LR0.01_E128 --no_val
-----



STDERR:
  File "main.py", line 370, in <module>
    main()
  File "main.py", line 254, in main
    dataset = dataset_class(
  File "/home/philip/projects/ltspice_examples_code_repo/Circuit-Completion-Using-GNNs/component_classification_with_link_prediction_head/evaluation/FEGIN/kernel/circuit_datasets.py", line 15, in __init__
    self.data, self.slices = torch.load(self.processed_paths[0])
  File "/home/philip/.local/lib/python3.8/site-packages/torch/serialization.py", line 1040, in load
    warnings.warn(
  File "/usr/lib/python3.8/warnings.py", line 109, in _showwarnmsg
    sw(msg.message, msg.category, msg.filename, msg.lineno,
  File "main.py", line 47, in warn_with_traceback
    traceback.print_stack(file=log)
/home/philip/projects/ltspice_examples_code_repo/Circuit-Completion-Using-GNNs/component_classification_with_link_prediction_head/evaluation/FEGIN/kernel/circuit_datasets.py:15: FutureWarning: You are using `torch.load` with `weights_only=False` (the current default value), which uses the default pickle module implicitly. It is possible to construct malicious pickle data which will execute arbitrary code during unpickling (See https://github.com/pytorch/pytorch/blob/main/SECURITY.md#untrusted-models for more details). In a future release, the default value for `weights_only` will be flipped to `True`. This limits the functions that could be executed during unpickling. Arbitrary objects will no longer be allowed to be loaded via this mode unless they are explicitly allowlisted by the user via `torch.serialization.add_safe_globals`. We recommend you start setting `weights_only=True` for any use case where you don't have full control of the loaded file. Please open an issue on GitHub for any issues related to this experimental feature.
  self.data, self.slices = torch.load(self.processed_paths[0])
