STDOUT:
Results will be saved in /home/philip/projects/ltspice_examples_code_repo/Circuit-Completion-Using-GNNs/component_classification_with_link_prediction_head/evaluation/FEGIN/results/model_FEGIN_dataset_ltspice_examples
Command line input: python main.py --data ltspice_examples --representation component_pin_net --model FEGIN --layers 2 --hiddens 64 --batch_size 256 --lr 0.0001 --emb_size 250 --epochs 100 --save_appendix component_pin_net_L2_H64_BS256_LR0.0001_E250 --no_val
 is saved.
-----
ltspice_examples - FEGIN
Using 2 layers, 64 hidden units, h = 2
Loading component_pin_net representation dataset
ENTERED
Training FEGIN on component_pin_net representation
Train: 3558, Test: 846
##################ITERATION #0 ****************************************
 epoch: 0, train_loss: 1.3938, test_loss: 1.3924, test_f1: 0.1004
 epoch: 1, train_loss: 1.3854, test_loss: 1.3878, test_f1: 0.1004
 epoch: 2, train_loss: 1.3799, test_loss: 1.3824, test_f1: 0.1004
 epoch: 3, train_loss: 1.3731, test_loss: 1.3739, test_f1: 0.1162
 epoch: 4, train_loss: 1.3657, test_loss: 1.3633, test_f1: 0.1264
 epoch: 5, train_loss: 1.3557, test_loss: 1.3520, test_f1: 0.1471
 epoch: 6, train_loss: 1.3466, test_loss: 1.3395, test_f1: 0.2654
 epoch: 7, train_loss: 1.3338, test_loss: 1.3259, test_f1: 0.2777
 epoch: 8, train_loss: 1.3191, test_loss: 1.3113, test_f1: 0.2586
 epoch: 9, train_loss: 1.3049, test_loss: 1.2959, test_f1: 0.2555
 epoch: 10, train_loss: 1.2914, test_loss: 1.2799, test_f1: 0.2304
 epoch: 11, train_loss: 1.2741, test_loss: 1.2643, test_f1: 0.2302
 epoch: 12, train_loss: 1.2608, test_loss: 1.2503, test_f1: 0.2295
 epoch: 13, train_loss: 1.2504, test_loss: 1.2367, test_f1: 0.2270
 epoch: 14, train_loss: 1.2345, test_loss: 1.2236, test_f1: 0.2270
 epoch: 15, train_loss: 1.2271, test_loss: 1.2115, test_f1: 0.2270
 epoch: 16, train_loss: 1.2158, test_loss: 1.1998, test_f1: 0.2270
 epoch: 17, train_loss: 1.2086, test_loss: 1.1895, test_f1: 0.2679
 epoch: 18, train_loss: 1.1965, test_loss: 1.1792, test_f1: 0.2979
 epoch: 19, train_loss: 1.1889, test_loss: 1.1689, test_f1: 0.3155
 epoch: 20, train_loss: 1.1786, test_loss: 1.1591, test_f1: 0.3462
 epoch: 21, train_loss: 1.1732, test_loss: 1.1490, test_f1: 0.3697
 epoch: 22, train_loss: 1.1622, test_loss: 1.1387, test_f1: 0.3912
 epoch: 23, train_loss: 1.1538, test_loss: 1.1294, test_f1: 0.4081
 epoch: 24, train_loss: 1.1431, test_loss: 1.1192, test_f1: 0.4260
 epoch: 25, train_loss: 1.1345, test_loss: 1.1079, test_f1: 0.4272
 epoch: 26, train_loss: 1.1257, test_loss: 1.0975, test_f1: 0.4615
 epoch: 27, train_loss: 1.1123, test_loss: 1.0852, test_f1: 0.4577
 epoch: 28, train_loss: 1.1036, test_loss: 1.0737, test_f1: 0.4577
 epoch: 29, train_loss: 1.0920, test_loss: 1.0634, test_f1: 0.4741
 epoch: 30, train_loss: 1.0802, test_loss: 1.0531, test_f1: 0.4766
 epoch: 31, train_loss: 1.0726, test_loss: 1.0443, test_f1: 0.4768
 epoch: 32, train_loss: 1.0593, test_loss: 1.0340, test_f1: 0.4810
 epoch: 33, train_loss: 1.0567, test_loss: 1.0261, test_f1: 0.4826
 epoch: 34, train_loss: 1.0396, test_loss: 1.0197, test_f1: 0.4859
 epoch: 35, train_loss: 1.0377, test_loss: 1.0141, test_f1: 0.4838
 epoch: 36, train_loss: 1.0271, test_loss: 1.0069, test_f1: 0.4915
 epoch: 37, train_loss: 1.0180, test_loss: 1.0008, test_f1: 0.4945
 epoch: 38, train_loss: 1.0171, test_loss: 0.9981, test_f1: 0.4986
 epoch: 39, train_loss: 1.0050, test_loss: 0.9929, test_f1: 0.4980
 epoch: 40, train_loss: 1.0048, test_loss: 0.9922, test_f1: 0.4995
 epoch: 41, train_loss: 0.9966, test_loss: 0.9861, test_f1: 0.5016
 epoch: 42, train_loss: 0.9934, test_loss: 0.9829, test_f1: 0.5031
 epoch: 43, train_loss: 0.9904, test_loss: 0.9804, test_f1: 0.5042
 epoch: 44, train_loss: 0.9888, test_loss: 0.9794, test_f1: 0.4989
 epoch: 45, train_loss: 0.9859, test_loss: 0.9776, test_f1: 0.4998
 epoch: 46, train_loss: 0.9766, test_loss: 0.9710, test_f1: 0.5088
 epoch: 47, train_loss: 0.9775, test_loss: 0.9672, test_f1: 0.4953
 epoch: 48, train_loss: 0.9733, test_loss: 0.9650, test_f1: 0.5083
 epoch: 49, train_loss: 0.9759, test_loss: 0.9635, test_f1: 0.5002
 epoch: 50, train_loss: 0.9660, test_loss: 0.9690, test_f1: 0.5046
 epoch: 51, train_loss: 0.9621, test_loss: 0.9616, test_f1: 0.5081
 epoch: 52, train_loss: 0.9671, test_loss: 0.9595, test_f1: 0.5059
 epoch: 53, train_loss: 0.9640, test_loss: 0.9579, test_f1: 0.5067
 epoch: 54, train_loss: 0.9583, test_loss: 0.9572, test_f1: 0.5077
 epoch: 55, train_loss: 0.9581, test_loss: 0.9562, test_f1: 0.5070
 epoch: 56, train_loss: 0.9609, test_loss: 0.9553, test_f1: 0.5079
 epoch: 57, train_loss: 0.9564, test_loss: 0.9540, test_f1: 0.5067
 epoch: 58, train_loss: 0.9540, test_loss: 0.9521, test_f1: 0.5095
 epoch: 59, train_loss: 0.9550, test_loss: 0.9549, test_f1: 0.5073
 epoch: 60, train_loss: 0.9570, test_loss: 0.9521, test_f1: 0.5060
 epoch: 61, train_loss: 0.9531, test_loss: 0.9500, test_f1: 0.5135
 epoch: 62, train_loss: 0.9571, test_loss: 0.9518, test_f1: 0.5152
 epoch: 63, train_loss: 0.9509, test_loss: 0.9488, test_f1: 0.5137
 epoch: 64, train_loss: 0.9497, test_loss: 0.9475, test_f1: 0.5110
 epoch: 65, train_loss: 0.9488, test_loss: 0.9475, test_f1: 0.5151
 epoch: 66, train_loss: 0.9484, test_loss: 0.9494, test_f1: 0.5160
 epoch: 67, train_loss: 0.9491, test_loss: 0.9443, test_f1: 0.5176
 epoch: 68, train_loss: 0.9429, test_loss: 0.9447, test_f1: 0.5073
 epoch: 69, train_loss: 0.9460, test_loss: 0.9434, test_f1: 0.5055
 epoch: 70, train_loss: 0.9476, test_loss: 0.9434, test_f1: 0.5175
 epoch: 71, train_loss: 0.9384, test_loss: 0.9447, test_f1: 0.5127
 epoch: 72, train_loss: 0.9405, test_loss: 0.9426, test_f1: 0.5193
 epoch: 73, train_loss: 0.9394, test_loss: 0.9395, test_f1: 0.5145
 epoch: 74, train_loss: 0.9464, test_loss: 0.9384, test_f1: 0.5109
 epoch: 75, train_loss: 0.9335, test_loss: 0.9384, test_f1: 0.5073
 epoch: 76, train_loss: 0.9387, test_loss: 0.9361, test_f1: 0.5169
 epoch: 77, train_loss: 0.9350, test_loss: 0.9361, test_f1: 0.5190
 epoch: 78, train_loss: 0.9394, test_loss: 0.9337, test_f1: 0.5205
 epoch: 79, train_loss: 0.9330, test_loss: 0.9368, test_f1: 0.5078
 epoch: 80, train_loss: 0.9341, test_loss: 0.9363, test_f1: 0.5216
 epoch: 81, train_loss: 0.9279, test_loss: 0.9345, test_f1: 0.5138
 epoch: 82, train_loss: 0.9275, test_loss: 0.9341, test_f1: 0.5134
 epoch: 83, train_loss: 0.9285, test_loss: 0.9295, test_f1: 0.5120
 epoch: 84, train_loss: 0.9331, test_loss: 0.9313, test_f1: 0.5223
 epoch: 85, train_loss: 0.9312, test_loss: 0.9368, test_f1: 0.5250
 epoch: 86, train_loss: 0.9285, test_loss: 0.9325, test_f1: 0.5133
 epoch: 87, train_loss: 0.9298, test_loss: 0.9318, test_f1: 0.5227
 epoch: 88, train_loss: 0.9265, test_loss: 0.9330, test_f1: 0.5157
 epoch: 89, train_loss: 0.9225, test_loss: 0.9292, test_f1: 0.5322
 epoch: 90, train_loss: 0.9217, test_loss: 0.9301, test_f1: 0.5170
 epoch: 91, train_loss: 0.9267, test_loss: 0.9283, test_f1: 0.5247
 epoch: 92, train_loss: 0.9207, test_loss: 0.9313, test_f1: 0.5139
 epoch: 93, train_loss: 0.9148, test_loss: 0.9284, test_f1: 0.5132
 epoch: 94, train_loss: 0.9184, test_loss: 0.9271, test_f1: 0.5224
 epoch: 95, train_loss: 0.9193, test_loss: 0.9267, test_f1: 0.5190
 epoch: 96, train_loss: 0.9228, test_loss: 0.9242, test_f1: 0.5275
 epoch: 97, train_loss: 0.9140, test_loss: 0.9259, test_f1: 0.5316
 epoch: 98, train_loss: 0.9079, test_loss: 0.9213, test_f1: 0.5258
 epoch: 99, train_loss: 0.9147, test_loss: 0.9231, test_f1: 0.5236
##################ITERATION #1 ****************************************
 epoch: 0, train_loss: 1.3556, test_loss: 1.3668, test_f1: 0.1004
 epoch: 1, train_loss: 1.3352, test_loss: 1.3582, test_f1: 0.1004
 epoch: 2, train_loss: 1.3219, test_loss: 1.3467, test_f1: 0.2103
 epoch: 3, train_loss: 1.3073, test_loss: 1.3255, test_f1: 0.2481
 epoch: 4, train_loss: 1.2901, test_loss: 1.2911, test_f1: 0.2423
 epoch: 5, train_loss: 1.2745, test_loss: 1.2615, test_f1: 0.3144
 epoch: 6, train_loss: 1.2558, test_loss: 1.2370, test_f1: 0.3499
 epoch: 7, train_loss: 1.2353, test_loss: 1.2148, test_f1: 0.3403
 epoch: 8, train_loss: 1.2176, test_loss: 1.1937, test_f1: 0.3432
 epoch: 9, train_loss: 1.1999, test_loss: 1.1733, test_f1: 0.3460
 epoch: 10, train_loss: 1.1817, test_loss: 1.1540, test_f1: 0.3460
 epoch: 11, train_loss: 1.1639, test_loss: 1.1360, test_f1: 0.3460
 epoch: 12, train_loss: 1.1471, test_loss: 1.1200, test_f1: 0.3448
 epoch: 13, train_loss: 1.1313, test_loss: 1.1042, test_f1: 0.3438
 epoch: 14, train_loss: 1.1152, test_loss: 1.0900, test_f1: 0.3429
 epoch: 15, train_loss: 1.1053, test_loss: 1.0788, test_f1: 0.3428
 epoch: 16, train_loss: 1.0891, test_loss: 1.0692, test_f1: 0.3451
 epoch: 17, train_loss: 1.0828, test_loss: 1.0601, test_f1: 0.3502
 epoch: 18, train_loss: 1.0761, test_loss: 1.0516, test_f1: 0.3596
 epoch: 19, train_loss: 1.0659, test_loss: 1.0453, test_f1: 0.3637
 epoch: 20, train_loss: 1.0600, test_loss: 1.0395, test_f1: 0.3808
 epoch: 21, train_loss: 1.0531, test_loss: 1.0339, test_f1: 0.3863
 epoch: 22, train_loss: 1.0478, test_loss: 1.0287, test_f1: 0.3914
 epoch: 23, train_loss: 1.0390, test_loss: 1.0246, test_f1: 0.3994
 epoch: 24, train_loss: 1.0326, test_loss: 1.0191, test_f1: 0.4065
 epoch: 25, train_loss: 1.0294, test_loss: 1.0141, test_f1: 0.4145
 epoch: 26, train_loss: 1.0225, test_loss: 1.0099, test_f1: 0.4108
 epoch: 27, train_loss: 1.0233, test_loss: 1.0046, test_f1: 0.4155
 epoch: 28, train_loss: 1.0128, test_loss: 1.0009, test_f1: 0.4270
 epoch: 29, train_loss: 1.0072, test_loss: 0.9944, test_f1: 0.4353
 epoch: 30, train_loss: 1.0047, test_loss: 0.9911, test_f1: 0.4486
 epoch: 31, train_loss: 1.0050, test_loss: 0.9881, test_f1: 0.4471
 epoch: 32, train_loss: 1.0029, test_loss: 0.9871, test_f1: 0.4658
 epoch: 33, train_loss: 0.9929, test_loss: 0.9815, test_f1: 0.4720
 epoch: 34, train_loss: 0.9932, test_loss: 0.9801, test_f1: 0.4725
 epoch: 35, train_loss: 0.9822, test_loss: 0.9730, test_f1: 0.4775
 epoch: 36, train_loss: 0.9837, test_loss: 0.9674, test_f1: 0.4842
 epoch: 37, train_loss: 0.9819, test_loss: 0.9642, test_f1: 0.4743
 epoch: 38, train_loss: 0.9720, test_loss: 0.9606, test_f1: 0.4829
 epoch: 39, train_loss: 0.9744, test_loss: 0.9592, test_f1: 0.4869
 epoch: 40, train_loss: 0.9685, test_loss: 0.9548, test_f1: 0.4843
 epoch: 41, train_loss: 0.9649, test_loss: 0.9538, test_f1: 0.4965
 epoch: 42, train_loss: 0.9642, test_loss: 0.9512, test_f1: 0.4922
 epoch: 43, train_loss: 0.9588, test_loss: 0.9481, test_f1: 0.4899
 epoch: 44, train_loss: 0.9625, test_loss: 0.9447, test_f1: 0.4966
 epoch: 45, train_loss: 0.9560, test_loss: 0.9406, test_f1: 0.5052
 epoch: 46, train_loss: 0.9525, test_loss: 0.9366, test_f1: 0.4985
 epoch: 47, train_loss: 0.9497, test_loss: 0.9338, test_f1: 0.5022
 epoch: 48, train_loss: 0.9511, test_loss: 0.9368, test_f1: 0.5064
 epoch: 49, train_loss: 0.9466, test_loss: 0.9300, test_f1: 0.5038
 epoch: 50, train_loss: 0.9433, test_loss: 0.9294, test_f1: 0.5067
 epoch: 51, train_loss: 0.9337, test_loss: 0.9277, test_f1: 0.5084
 epoch: 52, train_loss: 0.9387, test_loss: 0.9239, test_f1: 0.5104
 epoch: 53, train_loss: 0.9342, test_loss: 0.9240, test_f1: 0.5057
 epoch: 54, train_loss: 0.9320, test_loss: 0.9245, test_f1: 0.5090
 epoch: 55, train_loss: 0.9346, test_loss: 0.9223, test_f1: 0.5082
 epoch: 56, train_loss: 0.9345, test_loss: 0.9206, test_f1: 0.5127
 epoch: 57, train_loss: 0.9281, test_loss: 0.9219, test_f1: 0.5114
 epoch: 58, train_loss: 0.9255, test_loss: 0.9212, test_f1: 0.5114
 epoch: 59, train_loss: 0.9232, test_loss: 0.9192, test_f1: 0.5094
 epoch: 60, train_loss: 0.9323, test_loss: 0.9169, test_f1: 0.5097
 epoch: 61, train_loss: 0.9287, test_loss: 0.9160, test_f1: 0.5157
 epoch: 62, train_loss: 0.9287, test_loss: 0.9136, test_f1: 0.5193
 epoch: 63, train_loss: 0.9252, test_loss: 0.9144, test_f1: 0.5112
 epoch: 64, train_loss: 0.9260, test_loss: 0.9121, test_f1: 0.5177
 epoch: 65, train_loss: 0.9223, test_loss: 0.9111, test_f1: 0.5210
 epoch: 66, train_loss: 0.9210, test_loss: 0.9115, test_f1: 0.5198
 epoch: 67, train_loss: 0.9204, test_loss: 0.9114, test_f1: 0.5118
 epoch: 68, train_loss: 0.9189, test_loss: 0.9099, test_f1: 0.5128
 epoch: 69, train_loss: 0.9149, test_loss: 0.9051, test_f1: 0.5278
 epoch: 70, train_loss: 0.9141, test_loss: 0.9058, test_f1: 0.5244
 epoch: 71, train_loss: 0.9175, test_loss: 0.9060, test_f1: 0.5211
 epoch: 72, train_loss: 0.9157, test_loss: 0.9061, test_f1: 0.5272
 epoch: 73, train_loss: 0.9086, test_loss: 0.9007, test_f1: 0.5281
 epoch: 74, train_loss: 0.9066, test_loss: 0.9042, test_f1: 0.5244
 epoch: 75, train_loss: 0.9114, test_loss: 0.9049, test_f1: 0.5253
 epoch: 76, train_loss: 0.9040, test_loss: 0.9014, test_f1: 0.5226
 epoch: 77, train_loss: 0.9089, test_loss: 0.9005, test_f1: 0.5285
 epoch: 78, train_loss: 0.8988, test_loss: 0.9001, test_f1: 0.5272
 epoch: 79, train_loss: 0.9066, test_loss: 0.8994, test_f1: 0.5213
 epoch: 80, train_loss: 0.9033, test_loss: 0.8969, test_f1: 0.5333
 epoch: 81, train_loss: 0.9014, test_loss: 0.8943, test_f1: 0.5335
 epoch: 82, train_loss: 0.8976, test_loss: 0.8931, test_f1: 0.5318
 epoch: 83, train_loss: 0.8959, test_loss: 0.8932, test_f1: 0.5336
 epoch: 84, train_loss: 0.8910, test_loss: 0.8941, test_f1: 0.5352
 epoch: 85, train_loss: 0.8945, test_loss: 0.8934, test_f1: 0.5307
 epoch: 86, train_loss: 0.8920, test_loss: 0.8920, test_f1: 0.5331
 epoch: 87, train_loss: 0.8995, test_loss: 0.8908, test_f1: 0.5291
 epoch: 88, train_loss: 0.8944, test_loss: 0.8893, test_f1: 0.5341
 epoch: 89, train_loss: 0.8857, test_loss: 0.8883, test_f1: 0.5368
 epoch: 90, train_loss: 0.8891, test_loss: 0.8875, test_f1: 0.5401
 epoch: 91, train_loss: 0.8859, test_loss: 0.8879, test_f1: 0.5406
 epoch: 92, train_loss: 0.8885, test_loss: 0.8888, test_f1: 0.5408
 epoch: 93, train_loss: 0.8837, test_loss: 0.8898, test_f1: 0.5352
 epoch: 94, train_loss: 0.8802, test_loss: 0.8854, test_f1: 0.5356
 epoch: 95, train_loss: 0.8790, test_loss: 0.8803, test_f1: 0.5379
 epoch: 96, train_loss: 0.8816, test_loss: 0.8819, test_f1: 0.5425
 epoch: 97, train_loss: 0.8778, test_loss: 0.8822, test_f1: 0.5382
 epoch: 98, train_loss: 0.8841, test_loss: 0.8813, test_f1: 0.5446
 epoch: 99, train_loss: 0.8764, test_loss: 0.8804, test_f1: 0.5438
##################ITERATION #2 ****************************************
 epoch: 0, train_loss: 1.3507, test_loss: 1.3595, test_f1: 0.2270
 epoch: 1, train_loss: 1.3230, test_loss: 1.3511, test_f1: 0.2270
 epoch: 2, train_loss: 1.3027, test_loss: 1.3341, test_f1: 0.2270
 epoch: 3, train_loss: 1.2859, test_loss: 1.3049, test_f1: 0.2506
 epoch: 4, train_loss: 1.2667, test_loss: 1.2666, test_f1: 0.3299
 epoch: 5, train_loss: 1.2448, test_loss: 1.2304, test_f1: 0.3471
 epoch: 6, train_loss: 1.2254, test_loss: 1.1990, test_f1: 0.3536
 epoch: 7, train_loss: 1.2055, test_loss: 1.1723, test_f1: 0.3441
 epoch: 8, train_loss: 1.1825, test_loss: 1.1466, test_f1: 0.3441
 epoch: 9, train_loss: 1.1653, test_loss: 1.1265, test_f1: 0.3460
 epoch: 10, train_loss: 1.1444, test_loss: 1.1086, test_f1: 0.3460
 epoch: 11, train_loss: 1.1308, test_loss: 1.0926, test_f1: 0.3460
 epoch: 12, train_loss: 1.1152, test_loss: 1.0798, test_f1: 0.3429
 epoch: 13, train_loss: 1.0985, test_loss: 1.0680, test_f1: 0.3438
 epoch: 14, train_loss: 1.0877, test_loss: 1.0590, test_f1: 0.3428
 epoch: 15, train_loss: 1.0780, test_loss: 1.0490, test_f1: 0.3458
 epoch: 16, train_loss: 1.0706, test_loss: 1.0427, test_f1: 0.3590
 epoch: 17, train_loss: 1.0596, test_loss: 1.0348, test_f1: 0.3741
 epoch: 18, train_loss: 1.0507, test_loss: 1.0319, test_f1: 0.3982
 epoch: 19, train_loss: 1.0442, test_loss: 1.0252, test_f1: 0.4048
 epoch: 20, train_loss: 1.0380, test_loss: 1.0192, test_f1: 0.4105
 epoch: 21, train_loss: 1.0334, test_loss: 1.0140, test_f1: 0.4144
 epoch: 22, train_loss: 1.0258, test_loss: 1.0116, test_f1: 0.4227
 epoch: 23, train_loss: 1.0215, test_loss: 1.0065, test_f1: 0.4255
 epoch: 24, train_loss: 1.0173, test_loss: 1.0029, test_f1: 0.4239
 epoch: 25, train_loss: 1.0108, test_loss: 0.9968, test_f1: 0.4322
 epoch: 26, train_loss: 1.0107, test_loss: 0.9918, test_f1: 0.4412
 epoch: 27, train_loss: 1.0041, test_loss: 0.9898, test_f1: 0.4393
 epoch: 28, train_loss: 0.9933, test_loss: 0.9859, test_f1: 0.4644
 epoch: 29, train_loss: 0.9911, test_loss: 0.9774, test_f1: 0.4640
 epoch: 30, train_loss: 0.9897, test_loss: 0.9739, test_f1: 0.4715
 epoch: 31, train_loss: 0.9872, test_loss: 0.9729, test_f1: 0.4818
 epoch: 32, train_loss: 0.9847, test_loss: 0.9705, test_f1: 0.4813
 epoch: 33, train_loss: 0.9734, test_loss: 0.9641, test_f1: 0.4839
 epoch: 34, train_loss: 0.9765, test_loss: 0.9577, test_f1: 0.4872
 epoch: 35, train_loss: 0.9735, test_loss: 0.9539, test_f1: 0.4883
 epoch: 36, train_loss: 0.9712, test_loss: 0.9562, test_f1: 0.4911
 epoch: 37, train_loss: 0.9682, test_loss: 0.9525, test_f1: 0.4913
 epoch: 38, train_loss: 0.9647, test_loss: 0.9525, test_f1: 0.4954
 epoch: 39, train_loss: 0.9590, test_loss: 0.9423, test_f1: 0.4906
 epoch: 40, train_loss: 0.9542, test_loss: 0.9431, test_f1: 0.5002
 epoch: 41, train_loss: 0.9502, test_loss: 0.9412, test_f1: 0.4968
 epoch: 42, train_loss: 0.9533, test_loss: 0.9452, test_f1: 0.4990
 epoch: 43, train_loss: 0.9420, test_loss: 0.9357, test_f1: 0.4998
 epoch: 44, train_loss: 0.9447, test_loss: 0.9337, test_f1: 0.4971
 epoch: 45, train_loss: 0.9389, test_loss: 0.9357, test_f1: 0.4912
 epoch: 46, train_loss: 0.9345, test_loss: 0.9273, test_f1: 0.4982
 epoch: 47, train_loss: 0.9328, test_loss: 0.9252, test_f1: 0.4988
 epoch: 48, train_loss: 0.9299, test_loss: 0.9261, test_f1: 0.5079
 epoch: 49, train_loss: 0.9288, test_loss: 0.9170, test_f1: 0.5168
 epoch: 50, train_loss: 0.9237, test_loss: 0.9155, test_f1: 0.5110
 epoch: 51, train_loss: 0.9180, test_loss: 0.9161, test_f1: 0.5128
 epoch: 52, train_loss: 0.9186, test_loss: 0.9156, test_f1: 0.5110
 epoch: 53, train_loss: 0.9167, test_loss: 0.9151, test_f1: 0.5181
 epoch: 54, train_loss: 0.9208, test_loss: 0.9159, test_f1: 0.5152
 epoch: 55, train_loss: 0.9145, test_loss: 0.9105, test_f1: 0.5150
 epoch: 56, train_loss: 0.9156, test_loss: 0.9161, test_f1: 0.5134
 epoch: 57, train_loss: 0.9104, test_loss: 0.9131, test_f1: 0.5180
 epoch: 58, train_loss: 0.9116, test_loss: 0.9098, test_f1: 0.5218
 epoch: 59, train_loss: 0.9098, test_loss: 0.9108, test_f1: 0.5206
 epoch: 60, train_loss: 0.9120, test_loss: 0.9054, test_f1: 0.5195
 epoch: 61, train_loss: 0.9108, test_loss: 0.9089, test_f1: 0.5228
 epoch: 62, train_loss: 0.8992, test_loss: 0.9038, test_f1: 0.5228
 epoch: 63, train_loss: 0.9054, test_loss: 0.9061, test_f1: 0.5245
 epoch: 64, train_loss: 0.9014, test_loss: 0.9061, test_f1: 0.5184
 epoch: 65, train_loss: 0.9034, test_loss: 0.9081, test_f1: 0.5236
 epoch: 66, train_loss: 0.8979, test_loss: 0.9006, test_f1: 0.5261
 epoch: 67, train_loss: 0.8976, test_loss: 0.9005, test_f1: 0.5290
 epoch: 68, train_loss: 0.8920, test_loss: 0.9001, test_f1: 0.5228
 epoch: 69, train_loss: 0.9001, test_loss: 0.9030, test_f1: 0.5294
 epoch: 70, train_loss: 0.8932, test_loss: 0.8936, test_f1: 0.5183
 epoch: 71, train_loss: 0.8918, test_loss: 0.8979, test_f1: 0.5318
 epoch: 72, train_loss: 0.8887, test_loss: 0.8940, test_f1: 0.5300
 epoch: 73, train_loss: 0.8882, test_loss: 0.8986, test_f1: 0.5281
 epoch: 74, train_loss: 0.8931, test_loss: 0.8924, test_f1: 0.5331
 epoch: 75, train_loss: 0.8892, test_loss: 0.8941, test_f1: 0.5290
 epoch: 76, train_loss: 0.8874, test_loss: 0.8929, test_f1: 0.5237
 epoch: 77, train_loss: 0.8862, test_loss: 0.8959, test_f1: 0.5349
 epoch: 78, train_loss: 0.8780, test_loss: 0.8934, test_f1: 0.5316
 epoch: 79, train_loss: 0.8789, test_loss: 0.8901, test_f1: 0.5345
 epoch: 80, train_loss: 0.8778, test_loss: 0.8875, test_f1: 0.5365
 epoch: 81, train_loss: 0.8768, test_loss: 0.8856, test_f1: 0.5336
 epoch: 82, train_loss: 0.8771, test_loss: 0.8954, test_f1: 0.5307
 epoch: 83, train_loss: 0.8799, test_loss: 0.8788, test_f1: 0.5251
 epoch: 84, train_loss: 0.8789, test_loss: 0.8842, test_f1: 0.5351
 epoch: 85, train_loss: 0.8737, test_loss: 0.8813, test_f1: 0.5393
 epoch: 86, train_loss: 0.8736, test_loss: 0.8843, test_f1: 0.5289
 epoch: 87, train_loss: 0.8653, test_loss: 0.8795, test_f1: 0.5284
 epoch: 88, train_loss: 0.8760, test_loss: 0.8809, test_f1: 0.5338
 epoch: 89, train_loss: 0.8679, test_loss: 0.8841, test_f1: 0.5271
 epoch: 90, train_loss: 0.8679, test_loss: 0.8790, test_f1: 0.5409
 epoch: 91, train_loss: 0.8657, test_loss: 0.8749, test_f1: 0.5355
 epoch: 92, train_loss: 0.8672, test_loss: 0.8830, test_f1: 0.5310
 epoch: 93, train_loss: 0.8638, test_loss: 0.8870, test_f1: 0.5351
 epoch: 94, train_loss: 0.8589, test_loss: 0.8822, test_f1: 0.5383
 epoch: 95, train_loss: 0.8626, test_loss: 0.8762, test_f1: 0.5345
 epoch: 96, train_loss: 0.8603, test_loss: 0.8777, test_f1: 0.5349
 epoch: 97, train_loss: 0.8599, test_loss: 0.8742, test_f1: 0.5430
 epoch: 98, train_loss: 0.8543, test_loss: 0.8776, test_f1: 0.5295
 epoch: 99, train_loss: 0.8618, test_loss: 0.8726, test_f1: 0.5412
##################ITERATION #3 ****************************************
 epoch: 0, train_loss: 1.3077, test_loss: 1.3171, test_f1: 0.2270
 epoch: 1, train_loss: 1.2738, test_loss: 1.2995, test_f1: 0.2270
 epoch: 2, train_loss: 1.2538, test_loss: 1.2724, test_f1: 0.2270
 epoch: 3, train_loss: 1.2374, test_loss: 1.2342, test_f1: 0.2270
 epoch: 4, train_loss: 1.2185, test_loss: 1.1992, test_f1: 0.3299
 epoch: 5, train_loss: 1.1967, test_loss: 1.1676, test_f1: 0.3429
 epoch: 6, train_loss: 1.1774, test_loss: 1.1409, test_f1: 0.3474
 epoch: 7, train_loss: 1.1574, test_loss: 1.1167, test_f1: 0.3478
 epoch: 8, train_loss: 1.1370, test_loss: 1.0963, test_f1: 0.3634
 epoch: 9, train_loss: 1.1144, test_loss: 1.0797, test_f1: 0.3918
 epoch: 10, train_loss: 1.0991, test_loss: 1.0645, test_f1: 0.3993
 epoch: 11, train_loss: 1.0850, test_loss: 1.0503, test_f1: 0.4144
 epoch: 12, train_loss: 1.0722, test_loss: 1.0381, test_f1: 0.4201
 epoch: 13, train_loss: 1.0577, test_loss: 1.0299, test_f1: 0.4251
 epoch: 14, train_loss: 1.0508, test_loss: 1.0211, test_f1: 0.4365
 epoch: 15, train_loss: 1.0452, test_loss: 1.0146, test_f1: 0.4335
 epoch: 16, train_loss: 1.0399, test_loss: 1.0072, test_f1: 0.4414
 epoch: 17, train_loss: 1.0278, test_loss: 1.0015, test_f1: 0.4382
 epoch: 18, train_loss: 1.0222, test_loss: 0.9969, test_f1: 0.4518
 epoch: 19, train_loss: 1.0145, test_loss: 0.9901, test_f1: 0.4559
 epoch: 20, train_loss: 1.0077, test_loss: 0.9835, test_f1: 0.4644
 epoch: 21, train_loss: 1.0049, test_loss: 0.9818, test_f1: 0.4732
 epoch: 22, train_loss: 0.9999, test_loss: 0.9773, test_f1: 0.4734
 epoch: 23, train_loss: 0.9938, test_loss: 0.9751, test_f1: 0.4761
 epoch: 24, train_loss: 0.9863, test_loss: 0.9715, test_f1: 0.4900
 epoch: 25, train_loss: 0.9858, test_loss: 0.9641, test_f1: 0.4862
 epoch: 26, train_loss: 0.9796, test_loss: 0.9601, test_f1: 0.4920
 epoch: 27, train_loss: 0.9753, test_loss: 0.9578, test_f1: 0.4921
 epoch: 28, train_loss: 0.9687, test_loss: 0.9537, test_f1: 0.4913
 epoch: 29, train_loss: 0.9676, test_loss: 0.9501, test_f1: 0.4935
 epoch: 30, train_loss: 0.9631, test_loss: 0.9456, test_f1: 0.4913
 epoch: 31, train_loss: 0.9618, test_loss: 0.9430, test_f1: 0.4899
 epoch: 32, train_loss: 0.9619, test_loss: 0.9408, test_f1: 0.4962
 epoch: 33, train_loss: 0.9483, test_loss: 0.9391, test_f1: 0.4928
 epoch: 34, train_loss: 0.9469, test_loss: 0.9341, test_f1: 0.5118
 epoch: 35, train_loss: 0.9424, test_loss: 0.9338, test_f1: 0.5139
 epoch: 36, train_loss: 0.9413, test_loss: 0.9314, test_f1: 0.5142
 epoch: 37, train_loss: 0.9398, test_loss: 0.9269, test_f1: 0.5214
 epoch: 38, train_loss: 0.9354, test_loss: 0.9253, test_f1: 0.5147
 epoch: 39, train_loss: 0.9335, test_loss: 0.9249, test_f1: 0.5163
 epoch: 40, train_loss: 0.9217, test_loss: 0.9170, test_f1: 0.5138
 epoch: 41, train_loss: 0.9237, test_loss: 0.9164, test_f1: 0.5233
 epoch: 42, train_loss: 0.9175, test_loss: 0.9093, test_f1: 0.5187
 epoch: 43, train_loss: 0.9148, test_loss: 0.9097, test_f1: 0.5185
 epoch: 44, train_loss: 0.9128, test_loss: 0.9070, test_f1: 0.5215
 epoch: 45, train_loss: 0.9191, test_loss: 0.9039, test_f1: 0.5246
 epoch: 46, train_loss: 0.9068, test_loss: 0.8954, test_f1: 0.5303
 epoch: 47, train_loss: 0.9067, test_loss: 0.8991, test_f1: 0.5156
 epoch: 48, train_loss: 0.9006, test_loss: 0.8932, test_f1: 0.5293
 epoch: 49, train_loss: 0.9022, test_loss: 0.8871, test_f1: 0.5235
 epoch: 50, train_loss: 0.9019, test_loss: 0.8834, test_f1: 0.5324
 epoch: 51, train_loss: 0.8880, test_loss: 0.8844, test_f1: 0.5239
 epoch: 52, train_loss: 0.8939, test_loss: 0.8849, test_f1: 0.5213
 epoch: 53, train_loss: 0.8867, test_loss: 0.8807, test_f1: 0.5262
 epoch: 54, train_loss: 0.8860, test_loss: 0.8788, test_f1: 0.5246
 epoch: 55, train_loss: 0.8876, test_loss: 0.8763, test_f1: 0.5357
 epoch: 56, train_loss: 0.8843, test_loss: 0.8783, test_f1: 0.5323
 epoch: 57, train_loss: 0.8861, test_loss: 0.8781, test_f1: 0.5311
 epoch: 58, train_loss: 0.8787, test_loss: 0.8790, test_f1: 0.5339
 epoch: 59, train_loss: 0.8822, test_loss: 0.8787, test_f1: 0.5298
 epoch: 60, train_loss: 0.8801, test_loss: 0.8766, test_f1: 0.5283
 epoch: 61, train_loss: 0.8782, test_loss: 0.8742, test_f1: 0.5322
 epoch: 62, train_loss: 0.8733, test_loss: 0.8739, test_f1: 0.5301
 epoch: 63, train_loss: 0.8745, test_loss: 0.8712, test_f1: 0.5314
 epoch: 64, train_loss: 0.8727, test_loss: 0.8704, test_f1: 0.5340
 epoch: 65, train_loss: 0.8671, test_loss: 0.8686, test_f1: 0.5292
 epoch: 66, train_loss: 0.8690, test_loss: 0.8676, test_f1: 0.5252
 epoch: 67, train_loss: 0.8670, test_loss: 0.8671, test_f1: 0.5254
 epoch: 68, train_loss: 0.8667, test_loss: 0.8651, test_f1: 0.5288
 epoch: 69, train_loss: 0.8699, test_loss: 0.8662, test_f1: 0.5246
 epoch: 70, train_loss: 0.8630, test_loss: 0.8646, test_f1: 0.5384
 epoch: 71, train_loss: 0.8629, test_loss: 0.8624, test_f1: 0.5277
 epoch: 72, train_loss: 0.8640, test_loss: 0.8609, test_f1: 0.5275
 epoch: 73, train_loss: 0.8609, test_loss: 0.8597, test_f1: 0.5392
 epoch: 74, train_loss: 0.8608, test_loss: 0.8611, test_f1: 0.5366
 epoch: 75, train_loss: 0.8558, test_loss: 0.8599, test_f1: 0.5307
 epoch: 76, train_loss: 0.8589, test_loss: 0.8583, test_f1: 0.5372
 epoch: 77, train_loss: 0.8593, test_loss: 0.8590, test_f1: 0.5349
 epoch: 78, train_loss: 0.8599, test_loss: 0.8564, test_f1: 0.5328
 epoch: 79, train_loss: 0.8542, test_loss: 0.8529, test_f1: 0.5439
 epoch: 80, train_loss: 0.8524, test_loss: 0.8567, test_f1: 0.5300
 epoch: 81, train_loss: 0.8516, test_loss: 0.8543, test_f1: 0.5446
 epoch: 82, train_loss: 0.8416, test_loss: 0.8531, test_f1: 0.5333
 epoch: 83, train_loss: 0.8443, test_loss: 0.8531, test_f1: 0.5332
 epoch: 84, train_loss: 0.8524, test_loss: 0.8502, test_f1: 0.5360
 epoch: 85, train_loss: 0.8453, test_loss: 0.8511, test_f1: 0.5353
 epoch: 86, train_loss: 0.8488, test_loss: 0.8512, test_f1: 0.5481
 epoch: 87, train_loss: 0.8496, test_loss: 0.8504, test_f1: 0.5446
 epoch: 88, train_loss: 0.8439, test_loss: 0.8525, test_f1: 0.5287
 epoch: 89, train_loss: 0.8476, test_loss: 0.8505, test_f1: 0.5316
 epoch: 90, train_loss: 0.8427, test_loss: 0.8467, test_f1: 0.5411
 epoch: 91, train_loss: 0.8456, test_loss: 0.8491, test_f1: 0.5353
 epoch: 92, train_loss: 0.8389, test_loss: 0.8483, test_f1: 0.5354
 epoch: 93, train_loss: 0.8334, test_loss: 0.8461, test_f1: 0.5375
 epoch: 94, train_loss: 0.8330, test_loss: 0.8448, test_f1: 0.5435
 epoch: 95, train_loss: 0.8315, test_loss: 0.8447, test_f1: 0.5413
 epoch: 96, train_loss: 0.8363, test_loss: 0.8382, test_f1: 0.5379
 epoch: 97, train_loss: 0.8362, test_loss: 0.8423, test_f1: 0.5342
 epoch: 98, train_loss: 0.8325, test_loss: 0.8392, test_f1: 0.5368
 epoch: 99, train_loss: 0.8290, test_loss: 0.8379, test_f1: 0.5425
##################ITERATION #4 ****************************************
 epoch: 0, train_loss: 1.3167, test_loss: 1.3352, test_f1: 0.2270
 epoch: 1, train_loss: 1.2813, test_loss: 1.3236, test_f1: 0.2270
 epoch: 2, train_loss: 1.2556, test_loss: 1.3013, test_f1: 0.2270
 epoch: 3, train_loss: 1.2361, test_loss: 1.2630, test_f1: 0.2320
 epoch: 4, train_loss: 1.2150, test_loss: 1.2200, test_f1: 0.3245
 epoch: 5, train_loss: 1.1982, test_loss: 1.1786, test_f1: 0.4202
 epoch: 6, train_loss: 1.1694, test_loss: 1.1436, test_f1: 0.4264
 epoch: 7, train_loss: 1.1519, test_loss: 1.1183, test_f1: 0.4298
 epoch: 8, train_loss: 1.1369, test_loss: 1.0965, test_f1: 0.4353
 epoch: 9, train_loss: 1.1172, test_loss: 1.0790, test_f1: 0.4318
 epoch: 10, train_loss: 1.1001, test_loss: 1.0648, test_f1: 0.4314
 epoch: 11, train_loss: 1.0892, test_loss: 1.0523, test_f1: 0.4308
 epoch: 12, train_loss: 1.0744, test_loss: 1.0423, test_f1: 0.4320
 epoch: 13, train_loss: 1.0679, test_loss: 1.0340, test_f1: 0.4346
 epoch: 14, train_loss: 1.0613, test_loss: 1.0272, test_f1: 0.4437
 epoch: 15, train_loss: 1.0452, test_loss: 1.0217, test_f1: 0.4393
 epoch: 16, train_loss: 1.0425, test_loss: 1.0153, test_f1: 0.4361
 epoch: 17, train_loss: 1.0293, test_loss: 1.0090, test_f1: 0.4356
 epoch: 18, train_loss: 1.0272, test_loss: 1.0049, test_f1: 0.4466
 epoch: 19, train_loss: 1.0206, test_loss: 0.9991, test_f1: 0.4526
 epoch: 20, train_loss: 1.0165, test_loss: 0.9941, test_f1: 0.4648
 epoch: 21, train_loss: 1.0118, test_loss: 0.9900, test_f1: 0.4675
 epoch: 22, train_loss: 1.0029, test_loss: 0.9857, test_f1: 0.4696
 epoch: 23, train_loss: 1.0009, test_loss: 0.9825, test_f1: 0.4713
 epoch: 24, train_loss: 1.0002, test_loss: 0.9785, test_f1: 0.4735
 epoch: 25, train_loss: 0.9888, test_loss: 0.9761, test_f1: 0.4737
 epoch: 26, train_loss: 0.9844, test_loss: 0.9693, test_f1: 0.4734
 epoch: 27, train_loss: 0.9843, test_loss: 0.9668, test_f1: 0.4793
 epoch: 28, train_loss: 0.9825, test_loss: 0.9658, test_f1: 0.4774
 epoch: 29, train_loss: 0.9767, test_loss: 0.9625, test_f1: 0.4778
 epoch: 30, train_loss: 0.9695, test_loss: 0.9607, test_f1: 0.4778
 epoch: 31, train_loss: 0.9645, test_loss: 0.9581, test_f1: 0.4882
 epoch: 32, train_loss: 0.9589, test_loss: 0.9511, test_f1: 0.4882
 epoch: 33, train_loss: 0.9614, test_loss: 0.9513, test_f1: 0.4848
 epoch: 34, train_loss: 0.9572, test_loss: 0.9478, test_f1: 0.4941
 epoch: 35, train_loss: 0.9538, test_loss: 0.9430, test_f1: 0.4779
 epoch: 36, train_loss: 0.9497, test_loss: 0.9386, test_f1: 0.4982
 epoch: 37, train_loss: 0.9486, test_loss: 0.9363, test_f1: 0.4995
 epoch: 38, train_loss: 0.9424, test_loss: 0.9343, test_f1: 0.5026
 epoch: 39, train_loss: 0.9424, test_loss: 0.9319, test_f1: 0.4965
 epoch: 40, train_loss: 0.9354, test_loss: 0.9220, test_f1: 0.4986
 epoch: 41, train_loss: 0.9308, test_loss: 0.9250, test_f1: 0.4929
 epoch: 42, train_loss: 0.9347, test_loss: 0.9205, test_f1: 0.4992
 epoch: 43, train_loss: 0.9216, test_loss: 0.9143, test_f1: 0.4969
 epoch: 44, train_loss: 0.9262, test_loss: 0.9166, test_f1: 0.4990
 epoch: 45, train_loss: 0.9218, test_loss: 0.9095, test_f1: 0.4968
 epoch: 46, train_loss: 0.9207, test_loss: 0.9087, test_f1: 0.5025
 epoch: 47, train_loss: 0.9154, test_loss: 0.9041, test_f1: 0.5074
 epoch: 48, train_loss: 0.9079, test_loss: 0.9029, test_f1: 0.5095
 epoch: 49, train_loss: 0.9110, test_loss: 0.8989, test_f1: 0.5004
 epoch: 50, train_loss: 0.9073, test_loss: 0.9059, test_f1: 0.5112
 epoch: 51, train_loss: 0.9064, test_loss: 0.8950, test_f1: 0.5091
 epoch: 52, train_loss: 0.8976, test_loss: 0.8903, test_f1: 0.5077
 epoch: 53, train_loss: 0.8956, test_loss: 0.8920, test_f1: 0.5142
 epoch: 54, train_loss: 0.9021, test_loss: 0.8901, test_f1: 0.5119
 epoch: 55, train_loss: 0.8983, test_loss: 0.8925, test_f1: 0.5113
 epoch: 56, train_loss: 0.8957, test_loss: 0.8913, test_f1: 0.5107
 epoch: 57, train_loss: 0.8917, test_loss: 0.8872, test_f1: 0.5239
 epoch: 58, train_loss: 0.8899, test_loss: 0.8866, test_f1: 0.5204
 epoch: 59, train_loss: 0.8840, test_loss: 0.8840, test_f1: 0.5168
 epoch: 60, train_loss: 0.8903, test_loss: 0.8848, test_f1: 0.5161
 epoch: 61, train_loss: 0.8851, test_loss: 0.8829, test_f1: 0.5231
 epoch: 62, train_loss: 0.8826, test_loss: 0.8795, test_f1: 0.5281
 epoch: 63, train_loss: 0.8841, test_loss: 0.8807, test_f1: 0.5332
 epoch: 64, train_loss: 0.8806, test_loss: 0.8830, test_f1: 0.5313
 epoch: 65, train_loss: 0.8855, test_loss: 0.8819, test_f1: 0.5304
 epoch: 66, train_loss: 0.8765, test_loss: 0.8788, test_f1: 0.5302
 epoch: 67, train_loss: 0.8787, test_loss: 0.8761, test_f1: 0.5272
 epoch: 68, train_loss: 0.8744, test_loss: 0.8723, test_f1: 0.5276
 epoch: 69, train_loss: 0.8741, test_loss: 0.8751, test_f1: 0.5348
 epoch: 70, train_loss: 0.8743, test_loss: 0.8729, test_f1: 0.5390
 epoch: 71, train_loss: 0.8729, test_loss: 0.8743, test_f1: 0.5352
 epoch: 72, train_loss: 0.8719, test_loss: 0.8704, test_f1: 0.5381
 epoch: 73, train_loss: 0.8680, test_loss: 0.8679, test_f1: 0.5423
 epoch: 74, train_loss: 0.8654, test_loss: 0.8691, test_f1: 0.5355
 epoch: 75, train_loss: 0.8739, test_loss: 0.8686, test_f1: 0.5358
 epoch: 76, train_loss: 0.8664, test_loss: 0.8669, test_f1: 0.5395
 epoch: 77, train_loss: 0.8634, test_loss: 0.8673, test_f1: 0.5396
 epoch: 78, train_loss: 0.8600, test_loss: 0.8642, test_f1: 0.5345
 epoch: 79, train_loss: 0.8538, test_loss: 0.8618, test_f1: 0.5408
 epoch: 80, train_loss: 0.8574, test_loss: 0.8650, test_f1: 0.5404
 epoch: 81, train_loss: 0.8542, test_loss: 0.8632, test_f1: 0.5403
 epoch: 82, train_loss: 0.8602, test_loss: 0.8617, test_f1: 0.5387
 epoch: 83, train_loss: 0.8621, test_loss: 0.8657, test_f1: 0.5426
 epoch: 84, train_loss: 0.8557, test_loss: 0.8631, test_f1: 0.5385
 epoch: 85, train_loss: 0.8538, test_loss: 0.8600, test_f1: 0.5492
 epoch: 86, train_loss: 0.8506, test_loss: 0.8605, test_f1: 0.5432
 epoch: 87, train_loss: 0.8515, test_loss: 0.8659, test_f1: 0.5490
 epoch: 88, train_loss: 0.8512, test_loss: 0.8580, test_f1: 0.5459
 epoch: 89, train_loss: 0.8592, test_loss: 0.8670, test_f1: 0.5441
 epoch: 90, train_loss: 0.8447, test_loss: 0.8579, test_f1: 0.5495
 epoch: 91, train_loss: 0.8458, test_loss: 0.8607, test_f1: 0.5475
 epoch: 92, train_loss: 0.8493, test_loss: 0.8599, test_f1: 0.5497
 epoch: 93, train_loss: 0.8468, test_loss: 0.8576, test_f1: 0.5527
 epoch: 94, train_loss: 0.8448, test_loss: 0.8569, test_f1: 0.5452
 epoch: 95, train_loss: 0.8465, test_loss: 0.8566, test_f1: 0.5499
 epoch: 96, train_loss: 0.8370, test_loss: 0.8529, test_f1: 0.5493
 epoch: 97, train_loss: 0.8428, test_loss: 0.8549, test_f1: 0.5467
 epoch: 98, train_loss: 0.8449, test_loss: 0.8586, test_f1: 0.5473
 epoch: 99, train_loss: 0.8443, test_loss: 0.8502, test_f1: 0.5555
##################ITERATION #5 ****************************************
 epoch: 0, train_loss: 1.3117, test_loss: 1.3172, test_f1: 0.2270
 epoch: 1, train_loss: 1.2513, test_loss: 1.2991, test_f1: 0.2270
 epoch: 2, train_loss: 1.2191, test_loss: 1.2635, test_f1: 0.2270
 epoch: 3, train_loss: 1.1946, test_loss: 1.2077, test_f1: 0.3068
 epoch: 4, train_loss: 1.1666, test_loss: 1.1459, test_f1: 0.3497
 epoch: 5, train_loss: 1.1371, test_loss: 1.1044, test_f1: 0.3833
 epoch: 6, train_loss: 1.1178, test_loss: 1.0808, test_f1: 0.4125
 epoch: 7, train_loss: 1.1046, test_loss: 1.0618, test_f1: 0.4275
 epoch: 8, train_loss: 1.0868, test_loss: 1.0493, test_f1: 0.4384
 epoch: 9, train_loss: 1.0757, test_loss: 1.0394, test_f1: 0.4488
 epoch: 10, train_loss: 1.0574, test_loss: 1.0301, test_f1: 0.4502
 epoch: 11, train_loss: 1.0544, test_loss: 1.0214, test_f1: 0.4394
 epoch: 12, train_loss: 1.0426, test_loss: 1.0157, test_f1: 0.4408
 epoch: 13, train_loss: 1.0284, test_loss: 1.0073, test_f1: 0.4515
 epoch: 14, train_loss: 1.0276, test_loss: 1.0006, test_f1: 0.4612
 epoch: 15, train_loss: 1.0171, test_loss: 0.9930, test_f1: 0.4642
 epoch: 16, train_loss: 1.0110, test_loss: 0.9875, test_f1: 0.4737
 epoch: 17, train_loss: 0.9982, test_loss: 0.9849, test_f1: 0.4763
 epoch: 18, train_loss: 1.0036, test_loss: 0.9793, test_f1: 0.4818
 epoch: 19, train_loss: 0.9949, test_loss: 0.9790, test_f1: 0.4844
 epoch: 20, train_loss: 0.9932, test_loss: 0.9739, test_f1: 0.4876
 epoch: 21, train_loss: 0.9842, test_loss: 0.9685, test_f1: 0.4826
 epoch: 22, train_loss: 0.9790, test_loss: 0.9670, test_f1: 0.4846
 epoch: 23, train_loss: 0.9712, test_loss: 0.9615, test_f1: 0.4896
 epoch: 24, train_loss: 0.9674, test_loss: 0.9593, test_f1: 0.4892
 epoch: 25, train_loss: 0.9655, test_loss: 0.9547, test_f1: 0.4879
 epoch: 26, train_loss: 0.9707, test_loss: 0.9515, test_f1: 0.4885
 epoch: 27, train_loss: 0.9616, test_loss: 0.9493, test_f1: 0.4797
 epoch: 28, train_loss: 0.9562, test_loss: 0.9474, test_f1: 0.4806
 epoch: 29, train_loss: 0.9482, test_loss: 0.9497, test_f1: 0.4973
 epoch: 30, train_loss: 0.9523, test_loss: 0.9441, test_f1: 0.5032
 epoch: 31, train_loss: 0.9500, test_loss: 0.9415, test_f1: 0.5037
 epoch: 32, train_loss: 0.9450, test_loss: 0.9367, test_f1: 0.5144
 epoch: 33, train_loss: 0.9403, test_loss: 0.9363, test_f1: 0.5025
 epoch: 34, train_loss: 0.9300, test_loss: 0.9356, test_f1: 0.5096
 epoch: 35, train_loss: 0.9258, test_loss: 0.9293, test_f1: 0.5076
 epoch: 36, train_loss: 0.9311, test_loss: 0.9267, test_f1: 0.5099
 epoch: 37, train_loss: 0.9272, test_loss: 0.9198, test_f1: 0.5177
 epoch: 38, train_loss: 0.9221, test_loss: 0.9202, test_f1: 0.5215
 epoch: 39, train_loss: 0.9213, test_loss: 0.9200, test_f1: 0.5168
 epoch: 40, train_loss: 0.9223, test_loss: 0.9165, test_f1: 0.5237
 epoch: 41, train_loss: 0.9102, test_loss: 0.9124, test_f1: 0.5366
 epoch: 42, train_loss: 0.9116, test_loss: 0.9062, test_f1: 0.5335
 epoch: 43, train_loss: 0.9105, test_loss: 0.9111, test_f1: 0.5318
 epoch: 44, train_loss: 0.9109, test_loss: 0.9067, test_f1: 0.5302
 epoch: 45, train_loss: 0.9046, test_loss: 0.9078, test_f1: 0.5354
 epoch: 46, train_loss: 0.8985, test_loss: 0.9077, test_f1: 0.5356
 epoch: 47, train_loss: 0.8958, test_loss: 0.8994, test_f1: 0.5220
 epoch: 48, train_loss: 0.8947, test_loss: 0.8998, test_f1: 0.5362
 epoch: 49, train_loss: 0.9001, test_loss: 0.9012, test_f1: 0.5339
 epoch: 50, train_loss: 0.8961, test_loss: 0.8948, test_f1: 0.5372
 epoch: 51, train_loss: 0.8889, test_loss: 0.8991, test_f1: 0.5292
 epoch: 52, train_loss: 0.8833, test_loss: 0.8906, test_f1: 0.5305
 epoch: 53, train_loss: 0.8809, test_loss: 0.8905, test_f1: 0.5262
 epoch: 54, train_loss: 0.8827, test_loss: 0.8924, test_f1: 0.5354
 epoch: 55, train_loss: 0.8857, test_loss: 0.8938, test_f1: 0.5290
 epoch: 56, train_loss: 0.8838, test_loss: 0.8918, test_f1: 0.5367
 epoch: 57, train_loss: 0.8839, test_loss: 0.8918, test_f1: 0.5345
 epoch: 58, train_loss: 0.8731, test_loss: 0.8923, test_f1: 0.5376
 epoch: 59, train_loss: 0.8840, test_loss: 0.8918, test_f1: 0.5413
 epoch: 60, train_loss: 0.8839, test_loss: 0.8907, test_f1: 0.5389
 epoch: 61, train_loss: 0.8758, test_loss: 0.8857, test_f1: 0.5318
 epoch: 62, train_loss: 0.8762, test_loss: 0.8834, test_f1: 0.5398
 epoch: 63, train_loss: 0.8645, test_loss: 0.8819, test_f1: 0.5324
 epoch: 64, train_loss: 0.8706, test_loss: 0.8820, test_f1: 0.5433
 epoch: 65, train_loss: 0.8743, test_loss: 0.8809, test_f1: 0.5394
 epoch: 66, train_loss: 0.8731, test_loss: 0.8809, test_f1: 0.5379
 epoch: 67, train_loss: 0.8740, test_loss: 0.8804, test_f1: 0.5418
 epoch: 68, train_loss: 0.8674, test_loss: 0.8764, test_f1: 0.5300
 epoch: 69, train_loss: 0.8696, test_loss: 0.8763, test_f1: 0.5416
 epoch: 70, train_loss: 0.8681, test_loss: 0.8740, test_f1: 0.5411
 epoch: 71, train_loss: 0.8634, test_loss: 0.8792, test_f1: 0.5380
 epoch: 72, train_loss: 0.8650, test_loss: 0.8755, test_f1: 0.5354
 epoch: 73, train_loss: 0.8598, test_loss: 0.8703, test_f1: 0.5417
 epoch: 74, train_loss: 0.8579, test_loss: 0.8703, test_f1: 0.5382
 epoch: 75, train_loss: 0.8536, test_loss: 0.8743, test_f1: 0.5391
 epoch: 76, train_loss: 0.8541, test_loss: 0.8773, test_f1: 0.5341
 epoch: 77, train_loss: 0.8585, test_loss: 0.8675, test_f1: 0.5452
 epoch: 78, train_loss: 0.8530, test_loss: 0.8693, test_f1: 0.5393
 epoch: 79, train_loss: 0.8552, test_loss: 0.8715, test_f1: 0.5400
 epoch: 80, train_loss: 0.8543, test_loss: 0.8682, test_f1: 0.5402
 epoch: 81, train_loss: 0.8573, test_loss: 0.8666, test_f1: 0.5391
 epoch: 82, train_loss: 0.8517, test_loss: 0.8685, test_f1: 0.5434
 epoch: 83, train_loss: 0.8533, test_loss: 0.8671, test_f1: 0.5417
 epoch: 84, train_loss: 0.8477, test_loss: 0.8681, test_f1: 0.5382
 epoch: 85, train_loss: 0.8492, test_loss: 0.8636, test_f1: 0.5403
 epoch: 86, train_loss: 0.8475, test_loss: 0.8648, test_f1: 0.5444
 epoch: 87, train_loss: 0.8493, test_loss: 0.8617, test_f1: 0.5447
 epoch: 88, train_loss: 0.8514, test_loss: 0.8597, test_f1: 0.5438
 epoch: 89, train_loss: 0.8409, test_loss: 0.8614, test_f1: 0.5453
 epoch: 90, train_loss: 0.8556, test_loss: 0.8609, test_f1: 0.5536
 epoch: 91, train_loss: 0.8431, test_loss: 0.8582, test_f1: 0.5494
 epoch: 92, train_loss: 0.8387, test_loss: 0.8609, test_f1: 0.5443
 epoch: 93, train_loss: 0.8348, test_loss: 0.8581, test_f1: 0.5477
 epoch: 94, train_loss: 0.8332, test_loss: 0.8556, test_f1: 0.5440
 epoch: 95, train_loss: 0.8431, test_loss: 0.8544, test_f1: 0.5447
 epoch: 96, train_loss: 0.8383, test_loss: 0.8556, test_f1: 0.5526
 epoch: 97, train_loss: 0.8304, test_loss: 0.8569, test_f1: 0.5499
 epoch: 98, train_loss: 0.8267, test_loss: 0.8555, test_f1: 0.5487
 epoch: 99, train_loss: 0.8346, test_loss: 0.8526, test_f1: 0.5523
##################ITERATION #6 ****************************************
 epoch: 0, train_loss: 1.3045, test_loss: 1.3150, test_f1: 0.2270
 epoch: 1, train_loss: 1.2322, test_loss: 1.2939, test_f1: 0.2270
 epoch: 2, train_loss: 1.2058, test_loss: 1.2298, test_f1: 0.2251
 epoch: 3, train_loss: 1.1759, test_loss: 1.1585, test_f1: 0.3358
 epoch: 4, train_loss: 1.1534, test_loss: 1.1136, test_f1: 0.4052
 epoch: 5, train_loss: 1.1273, test_loss: 1.0851, test_f1: 0.4260
 epoch: 6, train_loss: 1.1118, test_loss: 1.0620, test_f1: 0.4292
 epoch: 7, train_loss: 1.0901, test_loss: 1.0445, test_f1: 0.4271
 epoch: 8, train_loss: 1.0808, test_loss: 1.0325, test_f1: 0.4551
 epoch: 9, train_loss: 1.0663, test_loss: 1.0243, test_f1: 0.4540
 epoch: 10, train_loss: 1.0542, test_loss: 1.0172, test_f1: 0.4517
 epoch: 11, train_loss: 1.0487, test_loss: 1.0106, test_f1: 0.4615
 epoch: 12, train_loss: 1.0379, test_loss: 1.0045, test_f1: 0.4635
 epoch: 13, train_loss: 1.0329, test_loss: 0.9985, test_f1: 0.4608
 epoch: 14, train_loss: 1.0231, test_loss: 0.9968, test_f1: 0.4612
 epoch: 15, train_loss: 1.0169, test_loss: 0.9930, test_f1: 0.4699
 epoch: 16, train_loss: 1.0107, test_loss: 0.9872, test_f1: 0.4731
 epoch: 17, train_loss: 1.0108, test_loss: 0.9818, test_f1: 0.4730
 epoch: 18, train_loss: 1.0035, test_loss: 0.9804, test_f1: 0.4732
 epoch: 19, train_loss: 0.9959, test_loss: 0.9771, test_f1: 0.4796
 epoch: 20, train_loss: 0.9988, test_loss: 0.9748, test_f1: 0.4756
 epoch: 21, train_loss: 0.9982, test_loss: 0.9704, test_f1: 0.4833
 epoch: 22, train_loss: 0.9851, test_loss: 0.9661, test_f1: 0.4841
 epoch: 23, train_loss: 0.9831, test_loss: 0.9655, test_f1: 0.4821
 epoch: 24, train_loss: 0.9782, test_loss: 0.9674, test_f1: 0.4892
 epoch: 25, train_loss: 0.9736, test_loss: 0.9647, test_f1: 0.4861
 epoch: 26, train_loss: 0.9680, test_loss: 0.9584, test_f1: 0.4832
 epoch: 27, train_loss: 0.9698, test_loss: 0.9580, test_f1: 0.4875
 epoch: 28, train_loss: 0.9680, test_loss: 0.9572, test_f1: 0.4948
 epoch: 29, train_loss: 0.9666, test_loss: 0.9556, test_f1: 0.4984
 epoch: 30, train_loss: 0.9631, test_loss: 0.9533, test_f1: 0.4912
 epoch: 31, train_loss: 0.9610, test_loss: 0.9533, test_f1: 0.4872
 epoch: 32, train_loss: 0.9471, test_loss: 0.9494, test_f1: 0.4929
 epoch: 33, train_loss: 0.9467, test_loss: 0.9492, test_f1: 0.4926
 epoch: 34, train_loss: 0.9451, test_loss: 0.9414, test_f1: 0.5027
 epoch: 35, train_loss: 0.9392, test_loss: 0.9408, test_f1: 0.5037
 epoch: 36, train_loss: 0.9419, test_loss: 0.9401, test_f1: 0.4996
 epoch: 37, train_loss: 0.9350, test_loss: 0.9419, test_f1: 0.5090
 epoch: 38, train_loss: 0.9353, test_loss: 0.9302, test_f1: 0.5105
 epoch: 39, train_loss: 0.9360, test_loss: 0.9410, test_f1: 0.5123
 epoch: 40, train_loss: 0.9306, test_loss: 0.9263, test_f1: 0.5160
 epoch: 41, train_loss: 0.9228, test_loss: 0.9309, test_f1: 0.5188
 epoch: 42, train_loss: 0.9260, test_loss: 0.9279, test_f1: 0.4977
 epoch: 43, train_loss: 0.9184, test_loss: 0.9197, test_f1: 0.5275
 epoch: 44, train_loss: 0.9140, test_loss: 0.9182, test_f1: 0.5154
 epoch: 45, train_loss: 0.9162, test_loss: 0.9177, test_f1: 0.5189
 epoch: 46, train_loss: 0.9114, test_loss: 0.9132, test_f1: 0.5240
 epoch: 47, train_loss: 0.9081, test_loss: 0.9194, test_f1: 0.5372
 epoch: 48, train_loss: 0.9047, test_loss: 0.9085, test_f1: 0.5145
 epoch: 49, train_loss: 0.9102, test_loss: 0.9074, test_f1: 0.5259
 epoch: 50, train_loss: 0.9029, test_loss: 0.9191, test_f1: 0.5356
 epoch: 51, train_loss: 0.8969, test_loss: 0.9134, test_f1: 0.5420
 epoch: 52, train_loss: 0.8926, test_loss: 0.9057, test_f1: 0.5346
 epoch: 53, train_loss: 0.8947, test_loss: 0.9010, test_f1: 0.5413
 epoch: 54, train_loss: 0.8897, test_loss: 0.8980, test_f1: 0.5417
 epoch: 55, train_loss: 0.8890, test_loss: 0.9032, test_f1: 0.5375
 epoch: 56, train_loss: 0.8900, test_loss: 0.8970, test_f1: 0.5450
 epoch: 57, train_loss: 0.8940, test_loss: 0.8944, test_f1: 0.5447
 epoch: 58, train_loss: 0.8850, test_loss: 0.8980, test_f1: 0.5437
 epoch: 59, train_loss: 0.8903, test_loss: 0.9034, test_f1: 0.5362
 epoch: 60, train_loss: 0.8846, test_loss: 0.9032, test_f1: 0.5396
 epoch: 61, train_loss: 0.8851, test_loss: 0.8988, test_f1: 0.5305
 epoch: 62, train_loss: 0.8849, test_loss: 0.8944, test_f1: 0.5322
 epoch: 63, train_loss: 0.8732, test_loss: 0.8922, test_f1: 0.5445
 epoch: 64, train_loss: 0.8774, test_loss: 0.8926, test_f1: 0.5513
 epoch: 65, train_loss: 0.8739, test_loss: 0.8954, test_f1: 0.5542
 epoch: 66, train_loss: 0.8755, test_loss: 0.8922, test_f1: 0.5331
 epoch: 67, train_loss: 0.8717, test_loss: 0.8928, test_f1: 0.5566
 epoch: 68, train_loss: 0.8762, test_loss: 0.8911, test_f1: 0.5453
 epoch: 69, train_loss: 0.8772, test_loss: 0.8982, test_f1: 0.5314
 epoch: 70, train_loss: 0.8681, test_loss: 0.8868, test_f1: 0.5312
 epoch: 71, train_loss: 0.8679, test_loss: 0.8958, test_f1: 0.5429
 epoch: 72, train_loss: 0.8753, test_loss: 0.8857, test_f1: 0.5539
 epoch: 73, train_loss: 0.8695, test_loss: 0.8847, test_f1: 0.5536
 epoch: 74, train_loss: 0.8726, test_loss: 0.8929, test_f1: 0.5424
 epoch: 75, train_loss: 0.8682, test_loss: 0.8806, test_f1: 0.5353
 epoch: 76, train_loss: 0.8640, test_loss: 0.8890, test_f1: 0.5499
 epoch: 77, train_loss: 0.8650, test_loss: 0.8782, test_f1: 0.5467
 epoch: 78, train_loss: 0.8623, test_loss: 0.8863, test_f1: 0.5457
 epoch: 79, train_loss: 0.8554, test_loss: 0.8815, test_f1: 0.5434
 epoch: 80, train_loss: 0.8523, test_loss: 0.8793, test_f1: 0.5438
 epoch: 81, train_loss: 0.8560, test_loss: 0.8767, test_f1: 0.5565
 epoch: 82, train_loss: 0.8559, test_loss: 0.8777, test_f1: 0.5485
 epoch: 83, train_loss: 0.8503, test_loss: 0.8806, test_f1: 0.5569
 epoch: 84, train_loss: 0.8399, test_loss: 0.8786, test_f1: 0.5480
 epoch: 85, train_loss: 0.8516, test_loss: 0.8700, test_f1: 0.5509
 epoch: 86, train_loss: 0.8535, test_loss: 0.8838, test_f1: 0.5462
 epoch: 87, train_loss: 0.8506, test_loss: 0.8759, test_f1: 0.5506
 epoch: 88, train_loss: 0.8481, test_loss: 0.8725, test_f1: 0.5509
 epoch: 89, train_loss: 0.8471, test_loss: 0.8713, test_f1: 0.5468
 epoch: 90, train_loss: 0.8459, test_loss: 0.8718, test_f1: 0.5594
 epoch: 91, train_loss: 0.8417, test_loss: 0.8769, test_f1: 0.5559
 epoch: 92, train_loss: 0.8449, test_loss: 0.8719, test_f1: 0.5524
 epoch: 93, train_loss: 0.8396, test_loss: 0.8639, test_f1: 0.5749
 epoch: 94, train_loss: 0.8411, test_loss: 0.8747, test_f1: 0.5571
 epoch: 95, train_loss: 0.8391, test_loss: 0.8793, test_f1: 0.5601
 epoch: 96, train_loss: 0.8384, test_loss: 0.8700, test_f1: 0.5592
 epoch: 97, train_loss: 0.8351, test_loss: 0.8702, test_f1: 0.5591
 epoch: 98, train_loss: 0.8419, test_loss: 0.8776, test_f1: 0.5572
 epoch: 99, train_loss: 0.8376, test_loss: 0.8761, test_f1: 0.5609
##################ITERATION #7 ****************************************
 epoch: 0, train_loss: 1.2882, test_loss: 1.3062, test_f1: 0.2270
 epoch: 1, train_loss: 1.2226, test_loss: 1.2801, test_f1: 0.2270
 epoch: 2, train_loss: 1.1844, test_loss: 1.2379, test_f1: 0.2270
 epoch: 3, train_loss: 1.1589, test_loss: 1.1737, test_f1: 0.2362
 epoch: 4, train_loss: 1.1233, test_loss: 1.1131, test_f1: 0.4252
 epoch: 5, train_loss: 1.1038, test_loss: 1.0766, test_f1: 0.4410
 epoch: 6, train_loss: 1.0880, test_loss: 1.0546, test_f1: 0.4668
 epoch: 7, train_loss: 1.0802, test_loss: 1.0402, test_f1: 0.4730
 epoch: 8, train_loss: 1.0650, test_loss: 1.0335, test_f1: 0.4714
 epoch: 9, train_loss: 1.0484, test_loss: 1.0223, test_f1: 0.4714
 epoch: 10, train_loss: 1.0362, test_loss: 1.0169, test_f1: 0.4725
 epoch: 11, train_loss: 1.0292, test_loss: 1.0089, test_f1: 0.4747
 epoch: 12, train_loss: 1.0224, test_loss: 1.0027, test_f1: 0.4773
 epoch: 13, train_loss: 1.0144, test_loss: 0.9985, test_f1: 0.4799
 epoch: 14, train_loss: 1.0142, test_loss: 0.9933, test_f1: 0.4789
 epoch: 15, train_loss: 1.0022, test_loss: 0.9823, test_f1: 0.4827
 epoch: 16, train_loss: 0.9957, test_loss: 0.9786, test_f1: 0.4867
 epoch: 17, train_loss: 0.9904, test_loss: 0.9751, test_f1: 0.4905
 epoch: 18, train_loss: 0.9811, test_loss: 0.9690, test_f1: 0.4958
 epoch: 19, train_loss: 0.9776, test_loss: 0.9631, test_f1: 0.4889
 epoch: 20, train_loss: 0.9679, test_loss: 0.9580, test_f1: 0.5169
 epoch: 21, train_loss: 0.9675, test_loss: 0.9553, test_f1: 0.5110
 epoch: 22, train_loss: 0.9624, test_loss: 0.9524, test_f1: 0.5084
 epoch: 23, train_loss: 0.9520, test_loss: 0.9476, test_f1: 0.5158
 epoch: 24, train_loss: 0.9463, test_loss: 0.9376, test_f1: 0.5201
 epoch: 25, train_loss: 0.9442, test_loss: 0.9385, test_f1: 0.5238
 epoch: 26, train_loss: 0.9347, test_loss: 0.9335, test_f1: 0.5283
 epoch: 27, train_loss: 0.9324, test_loss: 0.9254, test_f1: 0.5286
 epoch: 28, train_loss: 0.9314, test_loss: 0.9300, test_f1: 0.5310
 epoch: 29, train_loss: 0.9273, test_loss: 0.9299, test_f1: 0.5215
 epoch: 30, train_loss: 0.9250, test_loss: 0.9288, test_f1: 0.5074
 epoch: 31, train_loss: 0.9188, test_loss: 0.9227, test_f1: 0.5249
 epoch: 32, train_loss: 0.9144, test_loss: 0.9223, test_f1: 0.5212
 epoch: 33, train_loss: 0.9066, test_loss: 0.9176, test_f1: 0.5222
 epoch: 34, train_loss: 0.9038, test_loss: 0.9164, test_f1: 0.5274
 epoch: 35, train_loss: 0.9046, test_loss: 0.9146, test_f1: 0.5320
 epoch: 36, train_loss: 0.9011, test_loss: 0.9122, test_f1: 0.5250
 epoch: 37, train_loss: 0.8955, test_loss: 0.9142, test_f1: 0.5313
 epoch: 38, train_loss: 0.8954, test_loss: 0.9090, test_f1: 0.5309
 epoch: 39, train_loss: 0.8946, test_loss: 0.9031, test_f1: 0.5400
 epoch: 40, train_loss: 0.8820, test_loss: 0.9015, test_f1: 0.5327
 epoch: 41, train_loss: 0.8841, test_loss: 0.9077, test_f1: 0.5369
 epoch: 42, train_loss: 0.8817, test_loss: 0.9046, test_f1: 0.5337
 epoch: 43, train_loss: 0.8735, test_loss: 0.9031, test_f1: 0.5386
 epoch: 44, train_loss: 0.8757, test_loss: 0.8955, test_f1: 0.5401
 epoch: 45, train_loss: 0.8656, test_loss: 0.9050, test_f1: 0.5366
 epoch: 46, train_loss: 0.8684, test_loss: 0.8968, test_f1: 0.5478
 epoch: 47, train_loss: 0.8710, test_loss: 0.8946, test_f1: 0.5523
 epoch: 48, train_loss: 0.8564, test_loss: 0.8943, test_f1: 0.5436
 epoch: 49, train_loss: 0.8610, test_loss: 0.8919, test_f1: 0.5545
 epoch: 50, train_loss: 0.8542, test_loss: 0.8937, test_f1: 0.5536
 epoch: 51, train_loss: 0.8583, test_loss: 0.8886, test_f1: 0.5552
 epoch: 52, train_loss: 0.8530, test_loss: 0.8886, test_f1: 0.5589
 epoch: 53, train_loss: 0.8556, test_loss: 0.8908, test_f1: 0.5544
 epoch: 54, train_loss: 0.8461, test_loss: 0.8894, test_f1: 0.5539
 epoch: 55, train_loss: 0.8439, test_loss: 0.8851, test_f1: 0.5522
 epoch: 56, train_loss: 0.8450, test_loss: 0.8885, test_f1: 0.5510
 epoch: 57, train_loss: 0.8409, test_loss: 0.8837, test_f1: 0.5512
 epoch: 58, train_loss: 0.8410, test_loss: 0.8786, test_f1: 0.5537
 epoch: 59, train_loss: 0.8389, test_loss: 0.8820, test_f1: 0.5532
 epoch: 60, train_loss: 0.8433, test_loss: 0.8868, test_f1: 0.5547
 epoch: 61, train_loss: 0.8399, test_loss: 0.8810, test_f1: 0.5538
 epoch: 62, train_loss: 0.8356, test_loss: 0.8771, test_f1: 0.5590
 epoch: 63, train_loss: 0.8426, test_loss: 0.8810, test_f1: 0.5603
 epoch: 64, train_loss: 0.8361, test_loss: 0.8782, test_f1: 0.5543
 epoch: 65, train_loss: 0.8326, test_loss: 0.8796, test_f1: 0.5570
 epoch: 66, train_loss: 0.8339, test_loss: 0.8763, test_f1: 0.5570
 epoch: 67, train_loss: 0.8349, test_loss: 0.8787, test_f1: 0.5607
 epoch: 68, train_loss: 0.8344, test_loss: 0.8780, test_f1: 0.5637
 epoch: 69, train_loss: 0.8287, test_loss: 0.8785, test_f1: 0.5599
 epoch: 70, train_loss: 0.8175, test_loss: 0.8746, test_f1: 0.5577
 epoch: 71, train_loss: 0.8206, test_loss: 0.8778, test_f1: 0.5607
 epoch: 72, train_loss: 0.8271, test_loss: 0.8742, test_f1: 0.5646
 epoch: 73, train_loss: 0.8209, test_loss: 0.8740, test_f1: 0.5604
 epoch: 74, train_loss: 0.8219, test_loss: 0.8814, test_f1: 0.5620
 epoch: 75, train_loss: 0.8212, test_loss: 0.8738, test_f1: 0.5625
 epoch: 76, train_loss: 0.8198, test_loss: 0.8708, test_f1: 0.5618
 epoch: 77, train_loss: 0.8164, test_loss: 0.8768, test_f1: 0.5640
 epoch: 78, train_loss: 0.8121, test_loss: 0.8751, test_f1: 0.5638
 epoch: 79, train_loss: 0.8112, test_loss: 0.8715, test_f1: 0.5660
 epoch: 80, train_loss: 0.8103, test_loss: 0.8685, test_f1: 0.5625
 epoch: 81, train_loss: 0.8100, test_loss: 0.8716, test_f1: 0.5636
 epoch: 82, train_loss: 0.8127, test_loss: 0.8670, test_f1: 0.5643
 epoch: 83, train_loss: 0.8088, test_loss: 0.8681, test_f1: 0.5631
 epoch: 84, train_loss: 0.8037, test_loss: 0.8700, test_f1: 0.5610
 epoch: 85, train_loss: 0.8042, test_loss: 0.8638, test_f1: 0.5578
 epoch: 86, train_loss: 0.8125, test_loss: 0.8682, test_f1: 0.5655
 epoch: 87, train_loss: 0.8061, test_loss: 0.8688, test_f1: 0.5595
 epoch: 88, train_loss: 0.7967, test_loss: 0.8646, test_f1: 0.5645
 epoch: 89, train_loss: 0.7976, test_loss: 0.8633, test_f1: 0.5642
 epoch: 90, train_loss: 0.8045, test_loss: 0.8647, test_f1: 0.5592
 epoch: 91, train_loss: 0.7955, test_loss: 0.8621, test_f1: 0.5624
 epoch: 92, train_loss: 0.8054, test_loss: 0.8649, test_f1: 0.5653
 epoch: 93, train_loss: 0.7969, test_loss: 0.8609, test_f1: 0.5654
 epoch: 94, train_loss: 0.7961, test_loss: 0.8597, test_f1: 0.5645
 epoch: 95, train_loss: 0.7966, test_loss: 0.8667, test_f1: 0.5613
 epoch: 96, train_loss: 0.7966, test_loss: 0.8614, test_f1: 0.5675
 epoch: 97, train_loss: 0.7957, test_loss: 0.8624, test_f1: 0.5625
 epoch: 98, train_loss: 0.7875, test_loss: 0.8645, test_f1: 0.5646
 epoch: 99, train_loss: 0.7835, test_loss: 0.8649, test_f1: 0.5650
##################ITERATION #8 ****************************************
 epoch: 0, train_loss: 1.3153, test_loss: 1.3453, test_f1: 0.2270
 epoch: 1, train_loss: 1.1946, test_loss: 1.3165, test_f1: 0.2270
 epoch: 2, train_loss: 1.1516, test_loss: 1.2429, test_f1: 0.2270
 epoch: 3, train_loss: 1.1204, test_loss: 1.1428, test_f1: 0.3116
 epoch: 4, train_loss: 1.0953, test_loss: 1.0696, test_f1: 0.3778
 epoch: 5, train_loss: 1.0814, test_loss: 1.0405, test_f1: 0.4233
 epoch: 6, train_loss: 1.0609, test_loss: 1.0291, test_f1: 0.4469
 epoch: 7, train_loss: 1.0479, test_loss: 1.0234, test_f1: 0.4534
 epoch: 8, train_loss: 1.0424, test_loss: 1.0168, test_f1: 0.4596
 epoch: 9, train_loss: 1.0376, test_loss: 1.0139, test_f1: 0.4568
 epoch: 10, train_loss: 1.0336, test_loss: 1.0075, test_f1: 0.4654
 epoch: 11, train_loss: 1.0232, test_loss: 1.0038, test_f1: 0.4699
 epoch: 12, train_loss: 1.0111, test_loss: 0.9988, test_f1: 0.4684
 epoch: 13, train_loss: 1.0105, test_loss: 0.9909, test_f1: 0.4881
 epoch: 14, train_loss: 1.0020, test_loss: 0.9863, test_f1: 0.5000
 epoch: 15, train_loss: 0.9976, test_loss: 0.9842, test_f1: 0.5044
 epoch: 16, train_loss: 0.9921, test_loss: 0.9793, test_f1: 0.5130
 epoch: 17, train_loss: 0.9881, test_loss: 0.9716, test_f1: 0.5192
 epoch: 18, train_loss: 0.9840, test_loss: 0.9679, test_f1: 0.5130
 epoch: 19, train_loss: 0.9745, test_loss: 0.9708, test_f1: 0.5178
 epoch: 20, train_loss: 0.9741, test_loss: 0.9619, test_f1: 0.5103
 epoch: 21, train_loss: 0.9747, test_loss: 0.9565, test_f1: 0.5083
 epoch: 22, train_loss: 0.9693, test_loss: 0.9545, test_f1: 0.5154
 epoch: 23, train_loss: 0.9656, test_loss: 0.9514, test_f1: 0.5225
 epoch: 24, train_loss: 0.9602, test_loss: 0.9493, test_f1: 0.5147
 epoch: 25, train_loss: 0.9499, test_loss: 0.9468, test_f1: 0.5153
 epoch: 26, train_loss: 0.9551, test_loss: 0.9483, test_f1: 0.5200
 epoch: 27, train_loss: 0.9426, test_loss: 0.9437, test_f1: 0.5195
 epoch: 28, train_loss: 0.9489, test_loss: 0.9374, test_f1: 0.5210
 epoch: 29, train_loss: 0.9444, test_loss: 0.9383, test_f1: 0.5220
 epoch: 30, train_loss: 0.9436, test_loss: 0.9351, test_f1: 0.5265
 epoch: 31, train_loss: 0.9335, test_loss: 0.9332, test_f1: 0.5344
 epoch: 32, train_loss: 0.9355, test_loss: 0.9334, test_f1: 0.5304
 epoch: 33, train_loss: 0.9315, test_loss: 0.9282, test_f1: 0.5265
 epoch: 34, train_loss: 0.9294, test_loss: 0.9288, test_f1: 0.5335
 epoch: 35, train_loss: 0.9273, test_loss: 0.9267, test_f1: 0.5248
 epoch: 36, train_loss: 0.9241, test_loss: 0.9251, test_f1: 0.5265
 epoch: 37, train_loss: 0.9146, test_loss: 0.9153, test_f1: 0.5262
 epoch: 38, train_loss: 0.9182, test_loss: 0.9155, test_f1: 0.5351
 epoch: 39, train_loss: 0.9162, test_loss: 0.9100, test_f1: 0.5377
 epoch: 40, train_loss: 0.9127, test_loss: 0.9183, test_f1: 0.5319
 epoch: 41, train_loss: 0.9056, test_loss: 0.9061, test_f1: 0.5310
 epoch: 42, train_loss: 0.9020, test_loss: 0.9092, test_f1: 0.5432
 epoch: 43, train_loss: 0.8989, test_loss: 0.9065, test_f1: 0.5469
 epoch: 44, train_loss: 0.9022, test_loss: 0.9055, test_f1: 0.5490
 epoch: 45, train_loss: 0.8953, test_loss: 0.8979, test_f1: 0.5369
 epoch: 46, train_loss: 0.8933, test_loss: 0.8978, test_f1: 0.5442
 epoch: 47, train_loss: 0.8953, test_loss: 0.8915, test_f1: 0.5426
 epoch: 48, train_loss: 0.8849, test_loss: 0.8982, test_f1: 0.5377
 epoch: 49, train_loss: 0.8810, test_loss: 0.8951, test_f1: 0.5463
 epoch: 50, train_loss: 0.8867, test_loss: 0.8944, test_f1: 0.5415
 epoch: 51, train_loss: 0.8709, test_loss: 0.8941, test_f1: 0.5365
 epoch: 52, train_loss: 0.8703, test_loss: 0.8930, test_f1: 0.5489
 epoch: 53, train_loss: 0.8724, test_loss: 0.8874, test_f1: 0.5513
 epoch: 54, train_loss: 0.8739, test_loss: 0.8838, test_f1: 0.5513
 epoch: 55, train_loss: 0.8706, test_loss: 0.8863, test_f1: 0.5438
 epoch: 56, train_loss: 0.8722, test_loss: 0.8866, test_f1: 0.5476
 epoch: 57, train_loss: 0.8724, test_loss: 0.8799, test_f1: 0.5524
 epoch: 58, train_loss: 0.8696, test_loss: 0.8849, test_f1: 0.5524
 epoch: 59, train_loss: 0.8696, test_loss: 0.8865, test_f1: 0.5490
 epoch: 60, train_loss: 0.8726, test_loss: 0.8839, test_f1: 0.5454
 epoch: 61, train_loss: 0.8653, test_loss: 0.8804, test_f1: 0.5556
 epoch: 62, train_loss: 0.8587, test_loss: 0.8805, test_f1: 0.5558
 epoch: 63, train_loss: 0.8622, test_loss: 0.8819, test_f1: 0.5560
 epoch: 64, train_loss: 0.8559, test_loss: 0.8809, test_f1: 0.5582
 epoch: 65, train_loss: 0.8661, test_loss: 0.8763, test_f1: 0.5571
 epoch: 66, train_loss: 0.8628, test_loss: 0.8795, test_f1: 0.5602
 epoch: 67, train_loss: 0.8605, test_loss: 0.8733, test_f1: 0.5667
 epoch: 68, train_loss: 0.8576, test_loss: 0.8788, test_f1: 0.5619
 epoch: 69, train_loss: 0.8556, test_loss: 0.8734, test_f1: 0.5688
 epoch: 70, train_loss: 0.8599, test_loss: 0.8727, test_f1: 0.5708
 epoch: 71, train_loss: 0.8575, test_loss: 0.8722, test_f1: 0.5710
 epoch: 72, train_loss: 0.8508, test_loss: 0.8739, test_f1: 0.5549
 epoch: 73, train_loss: 0.8477, test_loss: 0.8658, test_f1: 0.5632
 epoch: 74, train_loss: 0.8536, test_loss: 0.8721, test_f1: 0.5721
 epoch: 75, train_loss: 0.8532, test_loss: 0.8655, test_f1: 0.5706
 epoch: 76, train_loss: 0.8485, test_loss: 0.8663, test_f1: 0.5734
 epoch: 77, train_loss: 0.8465, test_loss: 0.8681, test_f1: 0.5733
 epoch: 78, train_loss: 0.8464, test_loss: 0.8672, test_f1: 0.5720
 epoch: 79, train_loss: 0.8462, test_loss: 0.8684, test_f1: 0.5712
 epoch: 80, train_loss: 0.8411, test_loss: 0.8653, test_f1: 0.5636
 epoch: 81, train_loss: 0.8413, test_loss: 0.8682, test_f1: 0.5690
 epoch: 82, train_loss: 0.8421, test_loss: 0.8667, test_f1: 0.5726
 epoch: 83, train_loss: 0.8399, test_loss: 0.8725, test_f1: 0.5736
 epoch: 84, train_loss: 0.8362, test_loss: 0.8693, test_f1: 0.5722
 epoch: 85, train_loss: 0.8352, test_loss: 0.8665, test_f1: 0.5750
 epoch: 86, train_loss: 0.8382, test_loss: 0.8674, test_f1: 0.5672
 epoch: 87, train_loss: 0.8298, test_loss: 0.8668, test_f1: 0.5714
 epoch: 88, train_loss: 0.8341, test_loss: 0.8693, test_f1: 0.5756
 epoch: 89, train_loss: 0.8301, test_loss: 0.8718, test_f1: 0.5687
 epoch: 90, train_loss: 0.8342, test_loss: 0.8639, test_f1: 0.5744
 epoch: 91, train_loss: 0.8353, test_loss: 0.8678, test_f1: 0.5743
 epoch: 92, train_loss: 0.8368, test_loss: 0.8710, test_f1: 0.5691
 epoch: 93, train_loss: 0.8354, test_loss: 0.8639, test_f1: 0.5744
 epoch: 94, train_loss: 0.8341, test_loss: 0.8665, test_f1: 0.5745
 epoch: 95, train_loss: 0.8282, test_loss: 0.8612, test_f1: 0.5758
 epoch: 96, train_loss: 0.8239, test_loss: 0.8634, test_f1: 0.5748
 epoch: 97, train_loss: 0.8225, test_loss: 0.8641, test_f1: 0.5725
 epoch: 98, train_loss: 0.8243, test_loss: 0.8622, test_f1: 0.5727
 epoch: 99, train_loss: 0.8239, test_loss: 0.8618, test_f1: 0.5781
##################ITERATION #9 ****************************************
 epoch: 0, train_loss: 1.3331, test_loss: 1.3186, test_f1: 0.2270
 epoch: 1, train_loss: 1.2239, test_loss: 1.2848, test_f1: 0.2270
 epoch: 2, train_loss: 1.1843, test_loss: 1.2404, test_f1: 0.2270
 epoch: 3, train_loss: 1.1489, test_loss: 1.1718, test_f1: 0.2781
 epoch: 4, train_loss: 1.1231, test_loss: 1.0981, test_f1: 0.3823
 epoch: 5, train_loss: 1.1061, test_loss: 1.0573, test_f1: 0.4307
 epoch: 6, train_loss: 1.0827, test_loss: 1.0349, test_f1: 0.4366
 epoch: 7, train_loss: 1.0738, test_loss: 1.0200, test_f1: 0.4291
 epoch: 8, train_loss: 1.0595, test_loss: 1.0088, test_f1: 0.4386
 epoch: 9, train_loss: 1.0548, test_loss: 1.0004, test_f1: 0.4476
 epoch: 10, train_loss: 1.0446, test_loss: 0.9938, test_f1: 0.4514
 epoch: 11, train_loss: 1.0327, test_loss: 0.9861, test_f1: 0.4586
 epoch: 12, train_loss: 1.0269, test_loss: 0.9811, test_f1: 0.4615
 epoch: 13, train_loss: 1.0179, test_loss: 0.9758, test_f1: 0.4622
 epoch: 14, train_loss: 1.0122, test_loss: 0.9728, test_f1: 0.4672
 epoch: 15, train_loss: 0.9965, test_loss: 0.9654, test_f1: 0.4797
 epoch: 16, train_loss: 1.0011, test_loss: 0.9607, test_f1: 0.4806
 epoch: 17, train_loss: 0.9923, test_loss: 0.9587, test_f1: 0.4797
 epoch: 18, train_loss: 0.9842, test_loss: 0.9537, test_f1: 0.4796
 epoch: 19, train_loss: 0.9789, test_loss: 0.9491, test_f1: 0.4811
 epoch: 20, train_loss: 0.9740, test_loss: 0.9476, test_f1: 0.4813
 epoch: 21, train_loss: 0.9669, test_loss: 0.9437, test_f1: 0.4900
 epoch: 22, train_loss: 0.9644, test_loss: 0.9413, test_f1: 0.4913
 epoch: 23, train_loss: 0.9662, test_loss: 0.9383, test_f1: 0.5059
 epoch: 24, train_loss: 0.9601, test_loss: 0.9339, test_f1: 0.5049
 epoch: 25, train_loss: 0.9533, test_loss: 0.9350, test_f1: 0.5043
 epoch: 26, train_loss: 0.9494, test_loss: 0.9301, test_f1: 0.5063
 epoch: 27, train_loss: 0.9486, test_loss: 0.9300, test_f1: 0.5132
 epoch: 28, train_loss: 0.9432, test_loss: 0.9281, test_f1: 0.5174
 epoch: 29, train_loss: 0.9424, test_loss: 0.9244, test_f1: 0.5154
 epoch: 30, train_loss: 0.9355, test_loss: 0.9196, test_f1: 0.5186
 epoch: 31, train_loss: 0.9334, test_loss: 0.9182, test_f1: 0.5182
 epoch: 32, train_loss: 0.9372, test_loss: 0.9149, test_f1: 0.5220
 epoch: 33, train_loss: 0.9264, test_loss: 0.9135, test_f1: 0.5240
 epoch: 34, train_loss: 0.9190, test_loss: 0.9100, test_f1: 0.5234
 epoch: 35, train_loss: 0.9268, test_loss: 0.9061, test_f1: 0.5270
 epoch: 36, train_loss: 0.9207, test_loss: 0.9095, test_f1: 0.5271
 epoch: 37, train_loss: 0.9183, test_loss: 0.9025, test_f1: 0.5255
 epoch: 38, train_loss: 0.9120, test_loss: 0.9046, test_f1: 0.5320
 epoch: 39, train_loss: 0.9056, test_loss: 0.9028, test_f1: 0.5383
 epoch: 40, train_loss: 0.9080, test_loss: 0.8972, test_f1: 0.5342
 epoch: 41, train_loss: 0.9053, test_loss: 0.8946, test_f1: 0.5322
 epoch: 42, train_loss: 0.9051, test_loss: 0.8908, test_f1: 0.5382
 epoch: 43, train_loss: 0.8954, test_loss: 0.8905, test_f1: 0.5486
 epoch: 44, train_loss: 0.8977, test_loss: 0.8879, test_f1: 0.5453
 epoch: 45, train_loss: 0.8920, test_loss: 0.8869, test_f1: 0.5423
 epoch: 46, train_loss: 0.8862, test_loss: 0.8846, test_f1: 0.5450
 epoch: 47, train_loss: 0.8863, test_loss: 0.8785, test_f1: 0.5418
 epoch: 48, train_loss: 0.8898, test_loss: 0.8772, test_f1: 0.5403
 epoch: 49, train_loss: 0.8775, test_loss: 0.8768, test_f1: 0.5498
 epoch: 50, train_loss: 0.8782, test_loss: 0.8717, test_f1: 0.5459
 epoch: 51, train_loss: 0.8696, test_loss: 0.8712, test_f1: 0.5570
 epoch: 52, train_loss: 0.8751, test_loss: 0.8743, test_f1: 0.5519
 epoch: 53, train_loss: 0.8737, test_loss: 0.8734, test_f1: 0.5515
 epoch: 54, train_loss: 0.8667, test_loss: 0.8721, test_f1: 0.5495
 epoch: 55, train_loss: 0.8696, test_loss: 0.8712, test_f1: 0.5576
 epoch: 56, train_loss: 0.8688, test_loss: 0.8693, test_f1: 0.5617
 epoch: 57, train_loss: 0.8747, test_loss: 0.8693, test_f1: 0.5592
 epoch: 58, train_loss: 0.8670, test_loss: 0.8705, test_f1: 0.5600
 epoch: 59, train_loss: 0.8681, test_loss: 0.8677, test_f1: 0.5529
 epoch: 60, train_loss: 0.8651, test_loss: 0.8671, test_f1: 0.5561
 epoch: 61, train_loss: 0.8620, test_loss: 0.8666, test_f1: 0.5626
 epoch: 62, train_loss: 0.8543, test_loss: 0.8674, test_f1: 0.5659
 epoch: 63, train_loss: 0.8541, test_loss: 0.8652, test_f1: 0.5670
 epoch: 64, train_loss: 0.8658, test_loss: 0.8650, test_f1: 0.5648
 epoch: 65, train_loss: 0.8514, test_loss: 0.8651, test_f1: 0.5685
 epoch: 66, train_loss: 0.8576, test_loss: 0.8627, test_f1: 0.5650
 epoch: 67, train_loss: 0.8531, test_loss: 0.8590, test_f1: 0.5675
 epoch: 68, train_loss: 0.8607, test_loss: 0.8598, test_f1: 0.5678
 epoch: 69, train_loss: 0.8562, test_loss: 0.8565, test_f1: 0.5645
 epoch: 70, train_loss: 0.8519, test_loss: 0.8587, test_f1: 0.5642
 epoch: 71, train_loss: 0.8540, test_loss: 0.8596, test_f1: 0.5677
 epoch: 72, train_loss: 0.8477, test_loss: 0.8595, test_f1: 0.5680
 epoch: 73, train_loss: 0.8407, test_loss: 0.8584, test_f1: 0.5658
 epoch: 74, train_loss: 0.8443, test_loss: 0.8580, test_f1: 0.5661
 epoch: 75, train_loss: 0.8569, test_loss: 0.8551, test_f1: 0.5717
 epoch: 76, train_loss: 0.8478, test_loss: 0.8559, test_f1: 0.5696
 epoch: 77, train_loss: 0.8462, test_loss: 0.8552, test_f1: 0.5696
 epoch: 78, train_loss: 0.8429, test_loss: 0.8556, test_f1: 0.5681
 epoch: 79, train_loss: 0.8399, test_loss: 0.8574, test_f1: 0.5700
 epoch: 80, train_loss: 0.8456, test_loss: 0.8573, test_f1: 0.5720
 epoch: 81, train_loss: 0.8413, test_loss: 0.8562, test_f1: 0.5692
 epoch: 82, train_loss: 0.8383, test_loss: 0.8574, test_f1: 0.5702
 epoch: 83, train_loss: 0.8325, test_loss: 0.8550, test_f1: 0.5703
 epoch: 84, train_loss: 0.8377, test_loss: 0.8562, test_f1: 0.5691
 epoch: 85, train_loss: 0.8370, test_loss: 0.8550, test_f1: 0.5708
 epoch: 86, train_loss: 0.8354, test_loss: 0.8548, test_f1: 0.5701
 epoch: 87, train_loss: 0.8275, test_loss: 0.8547, test_f1: 0.5669
 epoch: 88, train_loss: 0.8313, test_loss: 0.8533, test_f1: 0.5712
 epoch: 89, train_loss: 0.8332, test_loss: 0.8503, test_f1: 0.5707
 epoch: 90, train_loss: 0.8313, test_loss: 0.8496, test_f1: 0.5613
 epoch: 91, train_loss: 0.8341, test_loss: 0.8508, test_f1: 0.5698
 epoch: 92, train_loss: 0.8331, test_loss: 0.8485, test_f1: 0.5695
 epoch: 93, train_loss: 0.8284, test_loss: 0.8489, test_f1: 0.5654
 epoch: 94, train_loss: 0.8227, test_loss: 0.8492, test_f1: 0.5709
 epoch: 95, train_loss: 0.8217, test_loss: 0.8516, test_f1: 0.5643
 epoch: 96, train_loss: 0.8268, test_loss: 0.8488, test_f1: 0.5698
 epoch: 97, train_loss: 0.8320, test_loss: 0.8484, test_f1: 0.5648
 epoch: 98, train_loss: 0.8225, test_loss: 0.8543, test_f1: 0.5695
 epoch: 99, train_loss: 0.8219, test_loss: 0.8516, test_f1: 0.5705

Training completed in 409.72 seconds
Best F1: 0.5781 at epoch 99
Mean F1 across iterations: 0.5570  0.0147
========================FINAL RESULTS================================
FEGIN weighted F1: 0.5781  0.0147
python main.py --data ltspice_examples --representation component_pin_net --model FEGIN --layers 2 --hiddens 64 --batch_size 256 --lr 0.0001 --emb_size 250 --epochs 100 --save_appendix component_pin_net_L2_H64_BS256_LR0.0001_E250 --no_val
-----



STDERR:
  File "main.py", line 370, in <module>
    main()
  File "main.py", line 254, in main
    dataset = dataset_class(
  File "/home/philip/projects/ltspice_examples_code_repo/Circuit-Completion-Using-GNNs/component_classification_with_link_prediction_head/evaluation/FEGIN/kernel/circuit_datasets.py", line 15, in __init__
    self.data, self.slices = torch.load(self.processed_paths[0])
  File "/home/philip/.local/lib/python3.8/site-packages/torch/serialization.py", line 1040, in load
    warnings.warn(
  File "/usr/lib/python3.8/warnings.py", line 109, in _showwarnmsg
    sw(msg.message, msg.category, msg.filename, msg.lineno,
  File "main.py", line 47, in warn_with_traceback
    traceback.print_stack(file=log)
/home/philip/projects/ltspice_examples_code_repo/Circuit-Completion-Using-GNNs/component_classification_with_link_prediction_head/evaluation/FEGIN/kernel/circuit_datasets.py:15: FutureWarning: You are using `torch.load` with `weights_only=False` (the current default value), which uses the default pickle module implicitly. It is possible to construct malicious pickle data which will execute arbitrary code during unpickling (See https://github.com/pytorch/pytorch/blob/main/SECURITY.md#untrusted-models for more details). In a future release, the default value for `weights_only` will be flipped to `True`. This limits the functions that could be executed during unpickling. Arbitrary objects will no longer be allowed to be loaded via this mode unless they are explicitly allowlisted by the user via `torch.serialization.add_safe_globals`. We recommend you start setting `weights_only=True` for any use case where you don't have full control of the loaded file. Please open an issue on GitHub for any issues related to this experimental feature.
  self.data, self.slices = torch.load(self.processed_paths[0])
