STDOUT:
Results will be saved in /home/philip/projects/ltspice_examples_code_repo/Circuit-Completion-Using-GNNs/component_classification_with_link_prediction_head/evaluation/FEGIN/results/model_FEGIN_dataset_ltspice_demos
Command line input: python main.py --data ltspice_demos --representation component_pin_net --model FEGIN --layers 4 --hiddens 16 --batch_size 32 --lr 0.01 --emb_size 250 --epochs 100 --save_appendix component_pin_net_L4_H16_BS32_LR0.01_E250 --no_val
 is saved.
-----
ltspice_demos - FEGIN
Using 4 layers, 16 hidden units, h = 2
Loading component_pin_net representation dataset
ENTERED
Training FEGIN on component_pin_net representation
Train: 1565, Test: 383
##################ITERATION #0 ****************************************
 epoch: 0, train_loss: 1.2290, test_loss: 1.2200, test_f1: 0.3668
 epoch: 1, train_loss: 1.1116, test_loss: 1.1707, test_f1: 0.3757
 epoch: 2, train_loss: 1.0534, test_loss: 1.1630, test_f1: 0.3258
 epoch: 3, train_loss: 1.0423, test_loss: 1.1832, test_f1: 0.4336
 epoch: 4, train_loss: 1.0308, test_loss: 1.1148, test_f1: 0.3734
 epoch: 5, train_loss: 1.0325, test_loss: 1.0875, test_f1: 0.3427
 epoch: 6, train_loss: 1.0116, test_loss: 1.4182, test_f1: 0.4267
 epoch: 7, train_loss: 1.0056, test_loss: 1.0752, test_f1: 0.4453
 epoch: 8, train_loss: 1.0044, test_loss: 1.1103, test_f1: 0.3290
 epoch: 9, train_loss: 1.0032, test_loss: 1.0742, test_f1: 0.4908
 epoch: 10, train_loss: 0.9893, test_loss: 1.0683, test_f1: 0.4791
 epoch: 11, train_loss: 0.9972, test_loss: 1.0639, test_f1: 0.4626
 epoch: 12, train_loss: 0.9761, test_loss: 1.1647, test_f1: 0.5079
 epoch: 13, train_loss: 0.9646, test_loss: 1.0706, test_f1: 0.4701
 epoch: 14, train_loss: 0.9508, test_loss: 1.1096, test_f1: 0.4260
 epoch: 15, train_loss: 0.9614, test_loss: 1.0665, test_f1: 0.4586
 epoch: 16, train_loss: 0.9435, test_loss: 1.0576, test_f1: 0.5421
 epoch: 17, train_loss: 0.9358, test_loss: 1.0136, test_f1: 0.5171
 epoch: 18, train_loss: 0.9317, test_loss: 1.1042, test_f1: 0.5153
 epoch: 19, train_loss: 0.9157, test_loss: 1.0720, test_f1: 0.4050
 epoch: 20, train_loss: 0.9136, test_loss: 1.0835, test_f1: 0.5181
 epoch: 21, train_loss: 0.9307, test_loss: 1.0815, test_f1: 0.5226
 epoch: 22, train_loss: 0.9021, test_loss: 1.0782, test_f1: 0.4487
 epoch: 23, train_loss: 0.9149, test_loss: 1.0749, test_f1: 0.5003
 epoch: 24, train_loss: 0.9087, test_loss: 1.0879, test_f1: 0.4844
 epoch: 25, train_loss: 0.9120, test_loss: 1.1667, test_f1: 0.5082
 epoch: 26, train_loss: 0.8945, test_loss: 1.0410, test_f1: 0.4479
 epoch: 27, train_loss: 0.8757, test_loss: 1.0277, test_f1: 0.5606
 epoch: 28, train_loss: 0.8674, test_loss: 0.9595, test_f1: 0.5506
 epoch: 29, train_loss: 0.8641, test_loss: 1.1898, test_f1: 0.4956
 epoch: 30, train_loss: 0.8642, test_loss: 1.1903, test_f1: 0.5053
 epoch: 31, train_loss: 0.8613, test_loss: 0.9614, test_f1: 0.5932
 epoch: 32, train_loss: 0.8568, test_loss: 1.0344, test_f1: 0.5655
 epoch: 33, train_loss: 0.8357, test_loss: 0.9278, test_f1: 0.5446
 epoch: 34, train_loss: 0.8462, test_loss: 0.9258, test_f1: 0.6111
 epoch: 35, train_loss: 0.8272, test_loss: 0.9683, test_f1: 0.6128
 epoch: 36, train_loss: 0.8134, test_loss: 1.0301, test_f1: 0.5123
 epoch: 37, train_loss: 0.8383, test_loss: 1.0153, test_f1: 0.5534
 epoch: 38, train_loss: 0.8337, test_loss: 0.9275, test_f1: 0.5789
 epoch: 39, train_loss: 0.8250, test_loss: 1.0276, test_f1: 0.5169
 epoch: 40, train_loss: 0.8225, test_loss: 0.9608, test_f1: 0.5905
 epoch: 41, train_loss: 0.8201, test_loss: 0.9856, test_f1: 0.5834
 epoch: 42, train_loss: 0.7899, test_loss: 0.9640, test_f1: 0.5715
 epoch: 43, train_loss: 0.8234, test_loss: 1.0417, test_f1: 0.5649
 epoch: 44, train_loss: 0.8119, test_loss: 1.1936, test_f1: 0.5486
 epoch: 45, train_loss: 0.7992, test_loss: 0.9980, test_f1: 0.5633
 epoch: 46, train_loss: 0.8265, test_loss: 0.9405, test_f1: 0.5936
 epoch: 47, train_loss: 0.7984, test_loss: 0.9761, test_f1: 0.5597
 epoch: 48, train_loss: 0.8053, test_loss: 1.0872, test_f1: 0.5617
 epoch: 49, train_loss: 0.7801, test_loss: 1.0088, test_f1: 0.5322
 epoch: 50, train_loss: 0.7812, test_loss: 0.9545, test_f1: 0.5537
 epoch: 51, train_loss: 0.7739, test_loss: 0.9877, test_f1: 0.5704
 epoch: 52, train_loss: 0.7699, test_loss: 0.9302, test_f1: 0.5897
 epoch: 53, train_loss: 0.7541, test_loss: 0.9399, test_f1: 0.5916
 epoch: 54, train_loss: 0.7372, test_loss: 0.9565, test_f1: 0.6008
 epoch: 55, train_loss: 0.7427, test_loss: 0.9159, test_f1: 0.6080
 epoch: 56, train_loss: 0.7261, test_loss: 0.9876, test_f1: 0.5528
 epoch: 57, train_loss: 0.7343, test_loss: 0.9461, test_f1: 0.5858
 epoch: 58, train_loss: 0.7392, test_loss: 0.9464, test_f1: 0.5932
 epoch: 59, train_loss: 0.7277, test_loss: 0.9789, test_f1: 0.5897
 epoch: 60, train_loss: 0.7444, test_loss: 1.0123, test_f1: 0.5754
 epoch: 61, train_loss: 0.7253, test_loss: 0.9996, test_f1: 0.5677
 epoch: 62, train_loss: 0.7418, test_loss: 0.9637, test_f1: 0.5833
 epoch: 63, train_loss: 0.7283, test_loss: 1.0010, test_f1: 0.5470
 epoch: 64, train_loss: 0.6980, test_loss: 1.0030, test_f1: 0.5504
 epoch: 65, train_loss: 0.7109, test_loss: 0.9832, test_f1: 0.5960
 epoch: 66, train_loss: 0.7263, test_loss: 1.0220, test_f1: 0.6072
 epoch: 67, train_loss: 0.7156, test_loss: 0.9669, test_f1: 0.5987
 epoch: 68, train_loss: 0.7030, test_loss: 1.0556, test_f1: 0.5881
 epoch: 69, train_loss: 0.7357, test_loss: 1.0729, test_f1: 0.5380
 epoch: 70, train_loss: 0.7191, test_loss: 0.9948, test_f1: 0.5857
 epoch: 71, train_loss: 0.7345, test_loss: 1.0466, test_f1: 0.5987
 epoch: 72, train_loss: 0.7301, test_loss: 1.0754, test_f1: 0.5446
 epoch: 73, train_loss: 0.7230, test_loss: 0.9858, test_f1: 0.5949
 epoch: 74, train_loss: 0.7136, test_loss: 1.0291, test_f1: 0.5666
 epoch: 75, train_loss: 0.7182, test_loss: 1.0370, test_f1: 0.5962
 epoch: 76, train_loss: 0.7092, test_loss: 1.0594, test_f1: 0.5543
 epoch: 77, train_loss: 0.6945, test_loss: 1.0806, test_f1: 0.5768
 epoch: 78, train_loss: 0.6869, test_loss: 1.0765, test_f1: 0.5852
 epoch: 79, train_loss: 0.6894, test_loss: 1.0749, test_f1: 0.5628
 epoch: 80, train_loss: 0.6855, test_loss: 1.0309, test_f1: 0.6014
 epoch: 81, train_loss: 0.6863, test_loss: 1.0697, test_f1: 0.5608
 epoch: 82, train_loss: 0.6737, test_loss: 1.0511, test_f1: 0.5777
 epoch: 83, train_loss: 0.6936, test_loss: 1.0145, test_f1: 0.6044
 epoch: 84, train_loss: 0.6875, test_loss: 1.1281, test_f1: 0.5532
 epoch: 85, train_loss: 0.6567, test_loss: 1.0393, test_f1: 0.5765
 epoch: 86, train_loss: 0.6670, test_loss: 1.1770, test_f1: 0.5654
 epoch: 87, train_loss: 0.6701, test_loss: 1.0205, test_f1: 0.5950
 epoch: 88, train_loss: 0.6710, test_loss: 1.0302, test_f1: 0.6025
 epoch: 89, train_loss: 0.7032, test_loss: 0.9605, test_f1: 0.6187
 epoch: 90, train_loss: 0.6803, test_loss: 1.0240, test_f1: 0.6284
 epoch: 91, train_loss: 0.6561, test_loss: 1.1076, test_f1: 0.5690
 epoch: 92, train_loss: 0.6667, test_loss: 1.0913, test_f1: 0.5965
 epoch: 93, train_loss: 0.6779, test_loss: 1.0454, test_f1: 0.6000
 epoch: 94, train_loss: 0.6513, test_loss: 1.1035, test_f1: 0.5782
 epoch: 95, train_loss: 0.6852, test_loss: 1.0509, test_f1: 0.6177
 epoch: 96, train_loss: 0.6771, test_loss: 1.0770, test_f1: 0.6019
 epoch: 97, train_loss: 0.6834, test_loss: 1.0673, test_f1: 0.6111
 epoch: 98, train_loss: 0.6634, test_loss: 1.1566, test_f1: 0.5604
 epoch: 99, train_loss: 0.6693, test_loss: 1.0735, test_f1: 0.6028
##################ITERATION #1 ****************************************
 epoch: 0, train_loss: 1.0710, test_loss: 1.1607, test_f1: 0.3874
 epoch: 1, train_loss: 1.0008, test_loss: 1.1124, test_f1: 0.5358
 epoch: 2, train_loss: 0.9788, test_loss: 1.1056, test_f1: 0.3995
 epoch: 3, train_loss: 0.9475, test_loss: 1.0168, test_f1: 0.5307
 epoch: 4, train_loss: 0.9559, test_loss: 1.0046, test_f1: 0.5576
 epoch: 5, train_loss: 0.9014, test_loss: 1.0514, test_f1: 0.4260
 epoch: 6, train_loss: 0.8809, test_loss: 1.0287, test_f1: 0.4959
 epoch: 7, train_loss: 0.8934, test_loss: 1.0162, test_f1: 0.4296
 epoch: 8, train_loss: 0.8927, test_loss: 0.9824, test_f1: 0.5392
 epoch: 9, train_loss: 0.8932, test_loss: 1.0085, test_f1: 0.5734
 epoch: 10, train_loss: 0.8619, test_loss: 1.0498, test_f1: 0.4511
 epoch: 11, train_loss: 0.8448, test_loss: 1.0150, test_f1: 0.5680
 epoch: 12, train_loss: 0.8775, test_loss: 1.0116, test_f1: 0.5556
 epoch: 13, train_loss: 0.8623, test_loss: 1.0405, test_f1: 0.5643
 epoch: 14, train_loss: 0.8286, test_loss: 1.0062, test_f1: 0.5706
 epoch: 15, train_loss: 0.8434, test_loss: 1.0773, test_f1: 0.3889
 epoch: 16, train_loss: 0.8508, test_loss: 0.9626, test_f1: 0.5791
 epoch: 17, train_loss: 0.8388, test_loss: 1.0017, test_f1: 0.5652
 epoch: 18, train_loss: 0.8323, test_loss: 0.9641, test_f1: 0.5484
 epoch: 19, train_loss: 0.8280, test_loss: 0.9864, test_f1: 0.5613
 epoch: 20, train_loss: 0.8286, test_loss: 1.0357, test_f1: 0.5005
 epoch: 21, train_loss: 0.8173, test_loss: 0.9807, test_f1: 0.5852
 epoch: 22, train_loss: 0.8196, test_loss: 0.9836, test_f1: 0.5928
 epoch: 23, train_loss: 0.8353, test_loss: 0.9668, test_f1: 0.6000
 epoch: 24, train_loss: 0.8073, test_loss: 0.9280, test_f1: 0.6279
 epoch: 25, train_loss: 0.8074, test_loss: 1.0206, test_f1: 0.4766
 epoch: 26, train_loss: 0.7896, test_loss: 1.2609, test_f1: 0.4707
 epoch: 27, train_loss: 0.7891, test_loss: 1.0889, test_f1: 0.5744
 epoch: 28, train_loss: 0.8223, test_loss: 1.0461, test_f1: 0.5133
 epoch: 29, train_loss: 0.7969, test_loss: 0.9519, test_f1: 0.6085
 epoch: 30, train_loss: 0.7852, test_loss: 1.0129, test_f1: 0.5631
 epoch: 31, train_loss: 0.7914, test_loss: 1.0374, test_f1: 0.4941
 epoch: 32, train_loss: 0.7639, test_loss: 1.1597, test_f1: 0.5601
 epoch: 33, train_loss: 0.7735, test_loss: 0.9559, test_f1: 0.5771
 epoch: 34, train_loss: 0.7694, test_loss: 1.0376, test_f1: 0.5698
 epoch: 35, train_loss: 0.7822, test_loss: 1.1139, test_f1: 0.5774
 epoch: 36, train_loss: 0.7628, test_loss: 1.0820, test_f1: 0.5721
 epoch: 37, train_loss: 0.7852, test_loss: 1.1400, test_f1: 0.5393
 epoch: 38, train_loss: 0.7442, test_loss: 1.0278, test_f1: 0.5605
 epoch: 39, train_loss: 0.7554, test_loss: 1.0693, test_f1: 0.5820
 epoch: 40, train_loss: 0.7500, test_loss: 1.0766, test_f1: 0.5741
 epoch: 41, train_loss: 0.7383, test_loss: 1.1532, test_f1: 0.5078
 epoch: 42, train_loss: 0.7854, test_loss: 1.0893, test_f1: 0.5915
 epoch: 43, train_loss: 0.7813, test_loss: 1.0138, test_f1: 0.6126
 epoch: 44, train_loss: 0.7627, test_loss: 1.0628, test_f1: 0.5787
 epoch: 45, train_loss: 0.7260, test_loss: 1.3128, test_f1: 0.4870
 epoch: 46, train_loss: 0.7549, test_loss: 1.0879, test_f1: 0.5691
 epoch: 47, train_loss: 0.7253, test_loss: 1.4252, test_f1: 0.5814
 epoch: 48, train_loss: 0.7718, test_loss: 1.0471, test_f1: 0.6072
 epoch: 49, train_loss: 0.7781, test_loss: 1.2041, test_f1: 0.4697
 epoch: 50, train_loss: 0.7518, test_loss: 1.0385, test_f1: 0.6413
 epoch: 51, train_loss: 0.7063, test_loss: 1.0420, test_f1: 0.6034
 epoch: 52, train_loss: 0.7062, test_loss: 1.0498, test_f1: 0.5959
 epoch: 53, train_loss: 0.6801, test_loss: 1.0719, test_f1: 0.5809
 epoch: 54, train_loss: 0.6576, test_loss: 1.1074, test_f1: 0.5798
 epoch: 55, train_loss: 0.6676, test_loss: 1.1494, test_f1: 0.5973
 epoch: 56, train_loss: 0.6759, test_loss: 1.1058, test_f1: 0.6139
 epoch: 57, train_loss: 0.6842, test_loss: 1.0589, test_f1: 0.6174
 epoch: 58, train_loss: 0.6755, test_loss: 1.0713, test_f1: 0.6296
 epoch: 59, train_loss: 0.6460, test_loss: 1.0044, test_f1: 0.6274
 epoch: 60, train_loss: 0.6418, test_loss: 1.0666, test_f1: 0.6405
 epoch: 61, train_loss: 0.6561, test_loss: 1.0026, test_f1: 0.6164
 epoch: 62, train_loss: 0.6438, test_loss: 1.1292, test_f1: 0.5906
 epoch: 63, train_loss: 0.6347, test_loss: 1.0717, test_f1: 0.6272
 epoch: 64, train_loss: 0.6509, test_loss: 1.0700, test_f1: 0.6112
 epoch: 65, train_loss: 0.6585, test_loss: 1.2740, test_f1: 0.5372
 epoch: 66, train_loss: 0.6381, test_loss: 1.1165, test_f1: 0.6051
 epoch: 67, train_loss: 0.6705, test_loss: 1.1121, test_f1: 0.6378
 epoch: 68, train_loss: 0.6434, test_loss: 1.0979, test_f1: 0.5861
 epoch: 69, train_loss: 0.6513, test_loss: 1.0918, test_f1: 0.5799
 epoch: 70, train_loss: 0.6493, test_loss: 1.0602, test_f1: 0.6365
 epoch: 71, train_loss: 0.6394, test_loss: 1.0996, test_f1: 0.6215
 epoch: 72, train_loss: 0.6341, test_loss: 1.0741, test_f1: 0.6120
 epoch: 73, train_loss: 0.6234, test_loss: 1.0612, test_f1: 0.6276
 epoch: 74, train_loss: 0.6038, test_loss: 1.1355, test_f1: 0.6597
 epoch: 75, train_loss: 0.6344, test_loss: 1.1561, test_f1: 0.5810
 epoch: 76, train_loss: 0.6425, test_loss: 1.0786, test_f1: 0.6149
 epoch: 77, train_loss: 0.6321, test_loss: 1.0826, test_f1: 0.6262
 epoch: 78, train_loss: 0.6092, test_loss: 1.0937, test_f1: 0.6321
 epoch: 79, train_loss: 0.6635, test_loss: 1.0030, test_f1: 0.6460
 epoch: 80, train_loss: 0.6435, test_loss: 1.2243, test_f1: 0.5569
 epoch: 81, train_loss: 0.6160, test_loss: 1.0500, test_f1: 0.6516
 epoch: 82, train_loss: 0.6321, test_loss: 1.0620, test_f1: 0.6614
 epoch: 83, train_loss: 0.5985, test_loss: 1.1340, test_f1: 0.5894
 epoch: 84, train_loss: 0.6028, test_loss: 1.0925, test_f1: 0.6471
 epoch: 85, train_loss: 0.6304, test_loss: 1.1279, test_f1: 0.6249
 epoch: 86, train_loss: 0.6193, test_loss: 1.0730, test_f1: 0.6462
 epoch: 87, train_loss: 0.5824, test_loss: 1.0608, test_f1: 0.6485
 epoch: 88, train_loss: 0.5901, test_loss: 1.0774, test_f1: 0.6339
 epoch: 89, train_loss: 0.6695, test_loss: 1.0307, test_f1: 0.6080
 epoch: 90, train_loss: 0.6464, test_loss: 0.9723, test_f1: 0.6575
 epoch: 91, train_loss: 0.6213, test_loss: 1.0186, test_f1: 0.6574
 epoch: 92, train_loss: 0.6243, test_loss: 1.0271, test_f1: 0.6505
 epoch: 93, train_loss: 0.6054, test_loss: 0.9458, test_f1: 0.6802
 epoch: 94, train_loss: 0.5868, test_loss: 1.0548, test_f1: 0.6382
 epoch: 95, train_loss: 0.6058, test_loss: 1.1026, test_f1: 0.6288
 epoch: 96, train_loss: 0.6141, test_loss: 0.9995, test_f1: 0.6553
 epoch: 97, train_loss: 0.5988, test_loss: 1.0909, test_f1: 0.6288
 epoch: 98, train_loss: 0.6137, test_loss: 1.1245, test_f1: 0.6238
 epoch: 99, train_loss: 0.5841, test_loss: 1.0624, test_f1: 0.6465
##################ITERATION #2 ****************************************
 epoch: 0, train_loss: 1.1593, test_loss: 1.1704, test_f1: 0.4207
 epoch: 1, train_loss: 1.0600, test_loss: 1.0672, test_f1: 0.5188
 epoch: 2, train_loss: 0.9939, test_loss: 1.1002, test_f1: 0.5032
 epoch: 3, train_loss: 0.9483, test_loss: 1.0035, test_f1: 0.5403
 epoch: 4, train_loss: 0.9142, test_loss: 1.0761, test_f1: 0.5147
 epoch: 5, train_loss: 0.9266, test_loss: 1.0410, test_f1: 0.5053
 epoch: 6, train_loss: 0.9042, test_loss: 1.0434, test_f1: 0.5472
 epoch: 7, train_loss: 0.8845, test_loss: 1.0293, test_f1: 0.4682
 epoch: 8, train_loss: 0.8868, test_loss: 1.0007, test_f1: 0.5557
 epoch: 9, train_loss: 0.9022, test_loss: 1.0568, test_f1: 0.5149
 epoch: 10, train_loss: 0.9203, test_loss: 1.2316, test_f1: 0.3854
 epoch: 11, train_loss: 0.9002, test_loss: 1.0376, test_f1: 0.5557
 epoch: 12, train_loss: 0.8834, test_loss: 0.9739, test_f1: 0.5521
 epoch: 13, train_loss: 0.8916, test_loss: 0.9878, test_f1: 0.5624
 epoch: 14, train_loss: 0.8831, test_loss: 1.0234, test_f1: 0.5622
 epoch: 15, train_loss: 0.8721, test_loss: 0.9964, test_f1: 0.5713
 epoch: 16, train_loss: 0.8631, test_loss: 1.0054, test_f1: 0.5617
 epoch: 17, train_loss: 0.8450, test_loss: 1.1156, test_f1: 0.5419
 epoch: 18, train_loss: 0.8532, test_loss: 0.9701, test_f1: 0.4435
 epoch: 19, train_loss: 0.8510, test_loss: 1.0158, test_f1: 0.4870
 epoch: 20, train_loss: 0.8523, test_loss: 1.0263, test_f1: 0.5550
 epoch: 21, train_loss: 0.8503, test_loss: 0.9931, test_f1: 0.5616
 epoch: 22, train_loss: 0.8555, test_loss: 0.9702, test_f1: 0.5597
 epoch: 23, train_loss: 0.8297, test_loss: 1.0094, test_f1: 0.5700
 epoch: 24, train_loss: 0.8710, test_loss: 1.3771, test_f1: 0.4794
 epoch: 25, train_loss: 0.8725, test_loss: 1.0090, test_f1: 0.5431
 epoch: 26, train_loss: 0.8769, test_loss: 1.0604, test_f1: 0.5606
 epoch: 27, train_loss: 0.8607, test_loss: 1.0023, test_f1: 0.5384
 epoch: 28, train_loss: 0.8356, test_loss: 1.0372, test_f1: 0.5659
 epoch: 29, train_loss: 0.8280, test_loss: 1.0150, test_f1: 0.5779
 epoch: 30, train_loss: 0.8246, test_loss: 0.9927, test_f1: 0.5862
 epoch: 31, train_loss: 0.8414, test_loss: 1.0090, test_f1: 0.5474
 epoch: 32, train_loss: 0.8440, test_loss: 1.0328, test_f1: 0.5804
 epoch: 33, train_loss: 0.8465, test_loss: 1.0047, test_f1: 0.5924
 epoch: 34, train_loss: 0.8480, test_loss: 0.9880, test_f1: 0.5566
 epoch: 35, train_loss: 0.8201, test_loss: 0.9832, test_f1: 0.5830
 epoch: 36, train_loss: 0.8471, test_loss: 1.0318, test_f1: 0.5634
 epoch: 37, train_loss: 0.8469, test_loss: 1.0083, test_f1: 0.5784
 epoch: 38, train_loss: 0.8323, test_loss: 0.9831, test_f1: 0.5624
 epoch: 39, train_loss: 0.8384, test_loss: 1.0073, test_f1: 0.5547
 epoch: 40, train_loss: 0.8370, test_loss: 0.9847, test_f1: 0.5461
 epoch: 41, train_loss: 0.8274, test_loss: 1.0026, test_f1: 0.5916
 epoch: 42, train_loss: 0.8171, test_loss: 1.0038, test_f1: 0.5670
 epoch: 43, train_loss: 0.8214, test_loss: 1.0698, test_f1: 0.5758
 epoch: 44, train_loss: 0.8077, test_loss: 0.9816, test_f1: 0.5745
 epoch: 45, train_loss: 0.8068, test_loss: 0.9608, test_f1: 0.5823
 epoch: 46, train_loss: 0.8069, test_loss: 0.9876, test_f1: 0.5651
 epoch: 47, train_loss: 0.8064, test_loss: 1.0406, test_f1: 0.4643
 epoch: 48, train_loss: 0.8116, test_loss: 0.9665, test_f1: 0.5985
 epoch: 49, train_loss: 0.7923, test_loss: 1.1700, test_f1: 0.5184
 epoch: 50, train_loss: 0.8188, test_loss: 1.0142, test_f1: 0.5458
 epoch: 51, train_loss: 0.7880, test_loss: 0.9838, test_f1: 0.5965
 epoch: 52, train_loss: 0.7813, test_loss: 0.9683, test_f1: 0.6202
 epoch: 53, train_loss: 0.7823, test_loss: 0.9602, test_f1: 0.5882
 epoch: 54, train_loss: 0.7642, test_loss: 0.9736, test_f1: 0.6080
 epoch: 55, train_loss: 0.7814, test_loss: 0.9757, test_f1: 0.6011
 epoch: 56, train_loss: 0.7922, test_loss: 0.9486, test_f1: 0.6001
 epoch: 57, train_loss: 0.7848, test_loss: 0.9930, test_f1: 0.6098
 epoch: 58, train_loss: 0.7648, test_loss: 1.0021, test_f1: 0.5990
 epoch: 59, train_loss: 0.7726, test_loss: 0.9800, test_f1: 0.5962
 epoch: 60, train_loss: 0.7691, test_loss: 0.9647, test_f1: 0.5917
 epoch: 61, train_loss: 0.7656, test_loss: 0.9607, test_f1: 0.6029
 epoch: 62, train_loss: 0.7626, test_loss: 1.0076, test_f1: 0.6032
 epoch: 63, train_loss: 0.7515, test_loss: 0.9974, test_f1: 0.6074
 epoch: 64, train_loss: 0.7521, test_loss: 1.0156, test_f1: 0.5988
 epoch: 65, train_loss: 0.7501, test_loss: 0.9719, test_f1: 0.6236
 epoch: 66, train_loss: 0.7646, test_loss: 1.0260, test_f1: 0.5586
 epoch: 67, train_loss: 0.7627, test_loss: 1.0006, test_f1: 0.6196
 epoch: 68, train_loss: 0.7425, test_loss: 1.0216, test_f1: 0.6154
 epoch: 69, train_loss: 0.7486, test_loss: 1.0499, test_f1: 0.5937
 epoch: 70, train_loss: 0.7818, test_loss: 1.0286, test_f1: 0.5847
 epoch: 71, train_loss: 0.7580, test_loss: 1.0323, test_f1: 0.5705
 epoch: 72, train_loss: 0.7595, test_loss: 0.9946, test_f1: 0.6219
 epoch: 73, train_loss: 0.7537, test_loss: 1.0747, test_f1: 0.5392
 epoch: 74, train_loss: 0.7471, test_loss: 0.9638, test_f1: 0.6431
 epoch: 75, train_loss: 0.7463, test_loss: 0.9687, test_f1: 0.6128
 epoch: 76, train_loss: 0.7615, test_loss: 1.0132, test_f1: 0.6009
 epoch: 77, train_loss: 0.7437, test_loss: 1.0398, test_f1: 0.6290
 epoch: 78, train_loss: 0.7438, test_loss: 1.0050, test_f1: 0.5954
 epoch: 79, train_loss: 0.7313, test_loss: 1.0129, test_f1: 0.6479
 epoch: 80, train_loss: 0.7421, test_loss: 0.9970, test_f1: 0.6461
 epoch: 81, train_loss: 0.7279, test_loss: 0.9730, test_f1: 0.6308
 epoch: 82, train_loss: 0.7237, test_loss: 0.9825, test_f1: 0.5918
 epoch: 83, train_loss: 0.7463, test_loss: 0.9903, test_f1: 0.6364
 epoch: 84, train_loss: 0.7252, test_loss: 1.0409, test_f1: 0.6489
 epoch: 85, train_loss: 0.7145, test_loss: 1.0128, test_f1: 0.6155
 epoch: 86, train_loss: 0.7296, test_loss: 1.0459, test_f1: 0.6080
 epoch: 87, train_loss: 0.7391, test_loss: 1.0136, test_f1: 0.6233
 epoch: 88, train_loss: 0.7258, test_loss: 1.0489, test_f1: 0.6119
 epoch: 89, train_loss: 0.7057, test_loss: 1.0403, test_f1: 0.6003
 epoch: 90, train_loss: 0.7053, test_loss: 1.0203, test_f1: 0.5946
 epoch: 91, train_loss: 0.7185, test_loss: 1.1035, test_f1: 0.5531
 epoch: 92, train_loss: 0.7321, test_loss: 1.0089, test_f1: 0.6232
 epoch: 93, train_loss: 0.7071, test_loss: 0.9953, test_f1: 0.6276
 epoch: 94, train_loss: 0.7182, test_loss: 1.0418, test_f1: 0.5241
 epoch: 95, train_loss: 0.7207, test_loss: 1.0138, test_f1: 0.6111
 epoch: 96, train_loss: 0.6895, test_loss: 1.0265, test_f1: 0.6393
 epoch: 97, train_loss: 0.6889, test_loss: 1.0376, test_f1: 0.6168
 epoch: 98, train_loss: 0.7063, test_loss: 1.0835, test_f1: 0.6337
 epoch: 99, train_loss: 0.7015, test_loss: 1.0562, test_f1: 0.6365
##################ITERATION #3 ****************************************
 epoch: 0, train_loss: 1.1668, test_loss: 1.1922, test_f1: 0.4536
 epoch: 1, train_loss: 1.0234, test_loss: 1.1046, test_f1: 0.4815
 epoch: 2, train_loss: 0.9682, test_loss: 1.0618, test_f1: 0.4914
 epoch: 3, train_loss: 0.9619, test_loss: 1.0556, test_f1: 0.4866
 epoch: 4, train_loss: 0.9496, test_loss: 1.0849, test_f1: 0.5559
 epoch: 5, train_loss: 0.9446, test_loss: 0.9842, test_f1: 0.5071
 epoch: 6, train_loss: 0.8922, test_loss: 0.9839, test_f1: 0.5514
 epoch: 7, train_loss: 0.8762, test_loss: 0.9876, test_f1: 0.5530
 epoch: 8, train_loss: 0.8943, test_loss: 0.9467, test_f1: 0.5693
 epoch: 9, train_loss: 0.8758, test_loss: 0.9852, test_f1: 0.5521
 epoch: 10, train_loss: 0.8773, test_loss: 0.9668, test_f1: 0.5437
 epoch: 11, train_loss: 0.8791, test_loss: 1.0013, test_f1: 0.5556
 epoch: 12, train_loss: 0.8621, test_loss: 0.9874, test_f1: 0.5539
 epoch: 13, train_loss: 0.8698, test_loss: 0.9676, test_f1: 0.5393
 epoch: 14, train_loss: 0.8427, test_loss: 1.2544, test_f1: 0.4701
 epoch: 15, train_loss: 0.8593, test_loss: 1.0492, test_f1: 0.5642
 epoch: 16, train_loss: 0.8655, test_loss: 1.0017, test_f1: 0.5649
 epoch: 17, train_loss: 0.8318, test_loss: 1.0313, test_f1: 0.5475
 epoch: 18, train_loss: 0.8504, test_loss: 0.9796, test_f1: 0.5798
 epoch: 19, train_loss: 0.8344, test_loss: 1.0496, test_f1: 0.4973
 epoch: 20, train_loss: 0.8408, test_loss: 1.0381, test_f1: 0.5187
 epoch: 21, train_loss: 0.8383, test_loss: 1.0110, test_f1: 0.5884
 epoch: 22, train_loss: 0.8153, test_loss: 1.0017, test_f1: 0.5695
 epoch: 23, train_loss: 0.8219, test_loss: 1.0211, test_f1: 0.5424
 epoch: 24, train_loss: 0.8214, test_loss: 1.0287, test_f1: 0.5318
 epoch: 25, train_loss: 0.8091, test_loss: 0.9877, test_f1: 0.5771
 epoch: 26, train_loss: 0.8138, test_loss: 0.9756, test_f1: 0.6164
 epoch: 27, train_loss: 0.7921, test_loss: 0.9863, test_f1: 0.5763
 epoch: 28, train_loss: 0.7877, test_loss: 1.0377, test_f1: 0.5013
 epoch: 29, train_loss: 0.8113, test_loss: 1.0657, test_f1: 0.5217
 epoch: 30, train_loss: 0.8107, test_loss: 0.9899, test_f1: 0.5545
 epoch: 31, train_loss: 0.8018, test_loss: 1.2131, test_f1: 0.5262
 epoch: 32, train_loss: 0.7978, test_loss: 1.0932, test_f1: 0.5181
 epoch: 33, train_loss: 0.7886, test_loss: 1.0561, test_f1: 0.5507
 epoch: 34, train_loss: 0.7735, test_loss: 1.0925, test_f1: 0.5189
 epoch: 35, train_loss: 0.7857, test_loss: 1.1209, test_f1: 0.5268
 epoch: 36, train_loss: 0.7917, test_loss: 0.9419, test_f1: 0.6003
 epoch: 37, train_loss: 0.7843, test_loss: 1.0355, test_f1: 0.5534
 epoch: 38, train_loss: 0.7829, test_loss: 1.0345, test_f1: 0.5274
 epoch: 39, train_loss: 0.7815, test_loss: 1.2361, test_f1: 0.5231
 epoch: 40, train_loss: 0.7989, test_loss: 0.9898, test_f1: 0.6026
 epoch: 41, train_loss: 0.7704, test_loss: 1.1098, test_f1: 0.5359
 epoch: 42, train_loss: 0.7940, test_loss: 1.1587, test_f1: 0.4874
 epoch: 43, train_loss: 0.7931, test_loss: 1.2682, test_f1: 0.5568
 epoch: 44, train_loss: 0.7841, test_loss: 1.0092, test_f1: 0.4889
 epoch: 45, train_loss: 0.7785, test_loss: 1.0042, test_f1: 0.5447
 epoch: 46, train_loss: 0.7671, test_loss: 1.0302, test_f1: 0.5375
 epoch: 47, train_loss: 0.7854, test_loss: 1.0441, test_f1: 0.4944
 epoch: 48, train_loss: 0.7941, test_loss: 1.0591, test_f1: 0.5911
 epoch: 49, train_loss: 0.7906, test_loss: 0.9800, test_f1: 0.5193
 epoch: 50, train_loss: 0.7655, test_loss: 0.9902, test_f1: 0.6027
 epoch: 51, train_loss: 0.7442, test_loss: 0.9784, test_f1: 0.6058
 epoch: 52, train_loss: 0.7264, test_loss: 0.9633, test_f1: 0.6110
 epoch: 53, train_loss: 0.7324, test_loss: 0.9924, test_f1: 0.6079
 epoch: 54, train_loss: 0.7234, test_loss: 0.9763, test_f1: 0.6199
 epoch: 55, train_loss: 0.7161, test_loss: 0.9564, test_f1: 0.6240
 epoch: 56, train_loss: 0.7123, test_loss: 0.9723, test_f1: 0.6443
 epoch: 57, train_loss: 0.7281, test_loss: 0.9798, test_f1: 0.6128
 epoch: 58, train_loss: 0.7117, test_loss: 1.0380, test_f1: 0.5711
 epoch: 59, train_loss: 0.7033, test_loss: 0.9878, test_f1: 0.6054
 epoch: 60, train_loss: 0.7114, test_loss: 0.9925, test_f1: 0.6151
 epoch: 61, train_loss: 0.7161, test_loss: 0.9956, test_f1: 0.6210
 epoch: 62, train_loss: 0.6925, test_loss: 1.0103, test_f1: 0.6086
 epoch: 63, train_loss: 0.7060, test_loss: 0.9946, test_f1: 0.6146
 epoch: 64, train_loss: 0.7017, test_loss: 0.9912, test_f1: 0.6004
 epoch: 65, train_loss: 0.6940, test_loss: 0.9587, test_f1: 0.6288
 epoch: 66, train_loss: 0.6952, test_loss: 1.0584, test_f1: 0.6063
 epoch: 67, train_loss: 0.7006, test_loss: 1.0302, test_f1: 0.5898
 epoch: 68, train_loss: 0.6754, test_loss: 1.0509, test_f1: 0.5950
 epoch: 69, train_loss: 0.7056, test_loss: 0.9844, test_f1: 0.6168
 epoch: 70, train_loss: 0.6790, test_loss: 1.0189, test_f1: 0.5773
 epoch: 71, train_loss: 0.6820, test_loss: 1.0561, test_f1: 0.6175
 epoch: 72, train_loss: 0.6839, test_loss: 1.0178, test_f1: 0.6238
 epoch: 73, train_loss: 0.6864, test_loss: 0.9883, test_f1: 0.6133
 epoch: 74, train_loss: 0.6822, test_loss: 0.9789, test_f1: 0.6178
 epoch: 75, train_loss: 0.6739, test_loss: 1.0304, test_f1: 0.5825
 epoch: 76, train_loss: 0.6893, test_loss: 1.0288, test_f1: 0.5772
 epoch: 77, train_loss: 0.6785, test_loss: 0.9376, test_f1: 0.6267
 epoch: 78, train_loss: 0.6590, test_loss: 0.9806, test_f1: 0.6262
 epoch: 79, train_loss: 0.6574, test_loss: 0.9672, test_f1: 0.6278
 epoch: 80, train_loss: 0.6517, test_loss: 0.9641, test_f1: 0.6301
 epoch: 81, train_loss: 0.6396, test_loss: 0.9993, test_f1: 0.6483
 epoch: 82, train_loss: 0.6674, test_loss: 0.9632, test_f1: 0.6382
 epoch: 83, train_loss: 0.6934, test_loss: 0.9891, test_f1: 0.6075
 epoch: 84, train_loss: 0.6575, test_loss: 1.4991, test_f1: 0.5706
 epoch: 85, train_loss: 0.6620, test_loss: 1.0151, test_f1: 0.6421
 epoch: 86, train_loss: 0.6642, test_loss: 0.9802, test_f1: 0.6258
 epoch: 87, train_loss: 0.6570, test_loss: 1.0132, test_f1: 0.5983
 epoch: 88, train_loss: 0.6444, test_loss: 1.0507, test_f1: 0.6047
 epoch: 89, train_loss: 0.6570, test_loss: 1.0007, test_f1: 0.6173
 epoch: 90, train_loss: 0.6555, test_loss: 1.0082, test_f1: 0.6047
 epoch: 91, train_loss: 0.6591, test_loss: 0.9552, test_f1: 0.6376
 epoch: 92, train_loss: 0.6515, test_loss: 1.0168, test_f1: 0.6271
 epoch: 93, train_loss: 0.6233, test_loss: 0.9831, test_f1: 0.5913
 epoch: 94, train_loss: 0.6694, test_loss: 0.9766, test_f1: 0.6149
 epoch: 95, train_loss: 0.6450, test_loss: 1.0281, test_f1: 0.5927
 epoch: 96, train_loss: 0.6478, test_loss: 0.9649, test_f1: 0.6238
 epoch: 97, train_loss: 0.6308, test_loss: 0.9326, test_f1: 0.6368
 epoch: 98, train_loss: 0.6362, test_loss: 0.9682, test_f1: 0.6248
 epoch: 99, train_loss: 0.6290, test_loss: 0.9751, test_f1: 0.6243
##################ITERATION #4 ****************************************
 epoch: 0, train_loss: 1.1084, test_loss: 1.4829, test_f1: 0.2364
 epoch: 1, train_loss: 0.9903, test_loss: 1.0815, test_f1: 0.4148
 epoch: 2, train_loss: 0.9535, test_loss: 0.9790, test_f1: 0.5654
 epoch: 3, train_loss: 0.9389, test_loss: 1.9307, test_f1: 0.4004
 epoch: 4, train_loss: 0.9366, test_loss: 1.0325, test_f1: 0.4878
 epoch: 5, train_loss: 0.9181, test_loss: 1.5414, test_f1: 0.3914
 epoch: 6, train_loss: 0.9326, test_loss: 1.0594, test_f1: 0.5156
 epoch: 7, train_loss: 0.9095, test_loss: 0.9897, test_f1: 0.4905
 epoch: 8, train_loss: 0.8871, test_loss: 1.8918, test_f1: 0.3822
 epoch: 9, train_loss: 0.8644, test_loss: 0.9453, test_f1: 0.5120
 epoch: 10, train_loss: 0.9052, test_loss: 1.1139, test_f1: 0.5039
 epoch: 11, train_loss: 0.8900, test_loss: 1.0130, test_f1: 0.5324
 epoch: 12, train_loss: 0.8909, test_loss: 1.0377, test_f1: 0.5300
 epoch: 13, train_loss: 0.8862, test_loss: 0.9524, test_f1: 0.5406
 epoch: 14, train_loss: 0.8594, test_loss: 0.9841, test_f1: 0.5664
 epoch: 15, train_loss: 0.8701, test_loss: 1.0318, test_f1: 0.5520
 epoch: 16, train_loss: 0.8661, test_loss: 1.0417, test_f1: 0.6040
 epoch: 17, train_loss: 0.8512, test_loss: 1.0657, test_f1: 0.5336
 epoch: 18, train_loss: 0.8747, test_loss: 3.8225, test_f1: 0.2867
 epoch: 19, train_loss: 0.8943, test_loss: 0.9714, test_f1: 0.5726
 epoch: 20, train_loss: 0.8674, test_loss: 0.9808, test_f1: 0.5283
 epoch: 21, train_loss: 0.8711, test_loss: 0.9640, test_f1: 0.5463
 epoch: 22, train_loss: 0.8601, test_loss: 1.1130, test_f1: 0.5271
 epoch: 23, train_loss: 0.8670, test_loss: 0.9839, test_f1: 0.5544
 epoch: 24, train_loss: 0.8525, test_loss: 1.0052, test_f1: 0.5486
 epoch: 25, train_loss: 0.8475, test_loss: 1.0380, test_f1: 0.5283
 epoch: 26, train_loss: 0.8483, test_loss: 0.9941, test_f1: 0.5639
 epoch: 27, train_loss: 0.8392, test_loss: 0.9913, test_f1: 0.5004
 epoch: 28, train_loss: 0.8206, test_loss: 0.9497, test_f1: 0.5160
 epoch: 29, train_loss: 0.8184, test_loss: 0.9523, test_f1: 0.5784
 epoch: 30, train_loss: 0.8444, test_loss: 1.2555, test_f1: 0.5085
 epoch: 31, train_loss: 0.8389, test_loss: 1.0692, test_f1: 0.4909
 epoch: 32, train_loss: 0.8169, test_loss: 0.9995, test_f1: 0.5393
 epoch: 33, train_loss: 0.8235, test_loss: 1.0015, test_f1: 0.5253
 epoch: 34, train_loss: 0.8053, test_loss: 0.9908, test_f1: 0.5789
 epoch: 35, train_loss: 0.8089, test_loss: 1.1206, test_f1: 0.5239
 epoch: 36, train_loss: 0.8185, test_loss: 1.1938, test_f1: 0.5246
 epoch: 37, train_loss: 0.8028, test_loss: 1.1840, test_f1: 0.5596
 epoch: 38, train_loss: 0.8098, test_loss: 1.1664, test_f1: 0.4951
 epoch: 39, train_loss: 0.7980, test_loss: 1.0424, test_f1: 0.5109
 epoch: 40, train_loss: 0.7970, test_loss: 0.9628, test_f1: 0.5886
 epoch: 41, train_loss: 0.7891, test_loss: 2.3225, test_f1: 0.3965
 epoch: 42, train_loss: 0.7808, test_loss: 1.0928, test_f1: 0.5283
 epoch: 43, train_loss: 0.8286, test_loss: 0.9494, test_f1: 0.5803
 epoch: 44, train_loss: 0.7846, test_loss: 1.0565, test_f1: 0.5485
 epoch: 45, train_loss: 0.8080, test_loss: 1.0135, test_f1: 0.5945
 epoch: 46, train_loss: 0.7751, test_loss: 1.1590, test_f1: 0.5864
 epoch: 47, train_loss: 0.7640, test_loss: 1.0583, test_f1: 0.5729
 epoch: 48, train_loss: 0.7732, test_loss: 0.9883, test_f1: 0.6116
 epoch: 49, train_loss: 0.7757, test_loss: 1.0443, test_f1: 0.5630
 epoch: 50, train_loss: 0.7859, test_loss: 1.0118, test_f1: 0.5841
 epoch: 51, train_loss: 0.7696, test_loss: 1.0280, test_f1: 0.6113
 epoch: 52, train_loss: 0.7536, test_loss: 1.0676, test_f1: 0.5324
 epoch: 53, train_loss: 0.7352, test_loss: 1.0091, test_f1: 0.5894
 epoch: 54, train_loss: 0.7245, test_loss: 1.0564, test_f1: 0.5674
 epoch: 55, train_loss: 0.7371, test_loss: 1.0590, test_f1: 0.5566
 epoch: 56, train_loss: 0.7050, test_loss: 1.0316, test_f1: 0.5676
 epoch: 57, train_loss: 0.7199, test_loss: 1.0311, test_f1: 0.5839
 epoch: 58, train_loss: 0.7179, test_loss: 0.9988, test_f1: 0.5952
 epoch: 59, train_loss: 0.7067, test_loss: 1.1323, test_f1: 0.5564
 epoch: 60, train_loss: 0.7119, test_loss: 1.0051, test_f1: 0.6328
 epoch: 61, train_loss: 0.7076, test_loss: 1.0096, test_f1: 0.6201
 epoch: 62, train_loss: 0.7133, test_loss: 1.0659, test_f1: 0.5628
 epoch: 63, train_loss: 0.7041, test_loss: 1.0941, test_f1: 0.5796
 epoch: 64, train_loss: 0.7101, test_loss: 1.0352, test_f1: 0.6074
 epoch: 65, train_loss: 0.7103, test_loss: 1.1135, test_f1: 0.5886
 epoch: 66, train_loss: 0.7109, test_loss: 1.0797, test_f1: 0.5807
 epoch: 67, train_loss: 0.7091, test_loss: 1.0346, test_f1: 0.6132
 epoch: 68, train_loss: 0.7001, test_loss: 1.1347, test_f1: 0.5666
 epoch: 69, train_loss: 0.7076, test_loss: 1.0456, test_f1: 0.6065
 epoch: 70, train_loss: 0.6821, test_loss: 1.1302, test_f1: 0.5782
 epoch: 71, train_loss: 0.6879, test_loss: 1.0316, test_f1: 0.6181
 epoch: 72, train_loss: 0.7211, test_loss: 1.2697, test_f1: 0.5395
 epoch: 73, train_loss: 0.6984, test_loss: 1.0258, test_f1: 0.6090
 epoch: 74, train_loss: 0.6897, test_loss: 1.1345, test_f1: 0.5327
 epoch: 75, train_loss: 0.6814, test_loss: 1.0405, test_f1: 0.6175
 epoch: 76, train_loss: 0.6891, test_loss: 1.0922, test_f1: 0.5890
 epoch: 77, train_loss: 0.6508, test_loss: 1.1039, test_f1: 0.5999
 epoch: 78, train_loss: 0.6622, test_loss: 1.1325, test_f1: 0.5942
 epoch: 79, train_loss: 0.6696, test_loss: 1.2783, test_f1: 0.5737
 epoch: 80, train_loss: 0.6985, test_loss: 1.2025, test_f1: 0.5490
 epoch: 81, train_loss: 0.6745, test_loss: 1.1081, test_f1: 0.6003
 epoch: 82, train_loss: 0.6540, test_loss: 1.1025, test_f1: 0.5786
 epoch: 83, train_loss: 0.6589, test_loss: 1.1259, test_f1: 0.5690
 epoch: 84, train_loss: 0.6624, test_loss: 1.2081, test_f1: 0.5559
 epoch: 85, train_loss: 0.6690, test_loss: 1.1404, test_f1: 0.5613
 epoch: 86, train_loss: 0.6841, test_loss: 1.1322, test_f1: 0.5366
 epoch: 87, train_loss: 0.6775, test_loss: 1.0906, test_f1: 0.5857
 epoch: 88, train_loss: 0.6701, test_loss: 1.0831, test_f1: 0.5865
 epoch: 89, train_loss: 0.6389, test_loss: 1.1181, test_f1: 0.5428
 epoch: 90, train_loss: 0.6519, test_loss: 1.2410, test_f1: 0.5926
 epoch: 91, train_loss: 0.6837, test_loss: 1.1030, test_f1: 0.6115
 epoch: 92, train_loss: 0.6593, test_loss: 1.1734, test_f1: 0.5471
 epoch: 93, train_loss: 0.6755, test_loss: 1.1233, test_f1: 0.6034
 epoch: 94, train_loss: 0.6547, test_loss: 1.2450, test_f1: 0.5731
 epoch: 95, train_loss: 0.6877, test_loss: 1.2768, test_f1: 0.5187
 epoch: 96, train_loss: 0.6396, test_loss: 1.0903, test_f1: 0.5876
 epoch: 97, train_loss: 0.6552, test_loss: 1.1234, test_f1: 0.6154
 epoch: 98, train_loss: 0.6488, test_loss: 1.2606, test_f1: 0.5380
 epoch: 99, train_loss: 0.6602, test_loss: 1.1237, test_f1: 0.6043
##################ITERATION #5 ****************************************
 epoch: 0, train_loss: 1.1583, test_loss: 1.2586, test_f1: 0.3687
 epoch: 1, train_loss: 1.0205, test_loss: 1.1652, test_f1: 0.4859
 epoch: 2, train_loss: 0.9863, test_loss: 1.0340, test_f1: 0.5221
 epoch: 3, train_loss: 0.9815, test_loss: 1.0899, test_f1: 0.4550
 epoch: 4, train_loss: 0.9645, test_loss: 1.0438, test_f1: 0.4302
 epoch: 5, train_loss: 0.9546, test_loss: 1.0525, test_f1: 0.5575
 epoch: 6, train_loss: 0.9408, test_loss: 1.0571, test_f1: 0.5050
 epoch: 7, train_loss: 0.9306, test_loss: 1.2449, test_f1: 0.4100
 epoch: 8, train_loss: 0.9434, test_loss: 1.0152, test_f1: 0.4365
 epoch: 9, train_loss: 0.9208, test_loss: 1.6305, test_f1: 0.4135
 epoch: 10, train_loss: 0.9112, test_loss: 1.0711, test_f1: 0.4371
 epoch: 11, train_loss: 0.9040, test_loss: 1.0110, test_f1: 0.5333
 epoch: 12, train_loss: 0.8957, test_loss: 1.0826, test_f1: 0.5507
 epoch: 13, train_loss: 0.8680, test_loss: 1.0024, test_f1: 0.5416
 epoch: 14, train_loss: 0.8996, test_loss: 1.0280, test_f1: 0.4505
 epoch: 15, train_loss: 0.8745, test_loss: 1.0646, test_f1: 0.5730
 epoch: 16, train_loss: 0.8549, test_loss: 1.0190, test_f1: 0.5733
 epoch: 17, train_loss: 0.8571, test_loss: 1.0612, test_f1: 0.5123
 epoch: 18, train_loss: 0.8516, test_loss: 1.0107, test_f1: 0.5568
 epoch: 19, train_loss: 0.8690, test_loss: 1.5317, test_f1: 0.4151
 epoch: 20, train_loss: 0.8547, test_loss: 1.0255, test_f1: 0.5294
 epoch: 21, train_loss: 0.8712, test_loss: 1.0515, test_f1: 0.4402
 epoch: 22, train_loss: 0.8344, test_loss: 0.9663, test_f1: 0.5274
 epoch: 23, train_loss: 0.8453, test_loss: 1.0415, test_f1: 0.4669
 epoch: 24, train_loss: 0.8314, test_loss: 1.0513, test_f1: 0.5657
 epoch: 25, train_loss: 0.8147, test_loss: 1.3414, test_f1: 0.4347
 epoch: 26, train_loss: 0.8431, test_loss: 1.1417, test_f1: 0.5153
 epoch: 27, train_loss: 0.8311, test_loss: 1.0239, test_f1: 0.5312
 epoch: 28, train_loss: 0.8251, test_loss: 1.0320, test_f1: 0.5424
 epoch: 29, train_loss: 0.7961, test_loss: 1.0147, test_f1: 0.5736
 epoch: 30, train_loss: 0.8135, test_loss: 1.0070, test_f1: 0.4960
 epoch: 31, train_loss: 0.8274, test_loss: 1.0048, test_f1: 0.5770
 epoch: 32, train_loss: 0.8162, test_loss: 1.0188, test_f1: 0.5263
 epoch: 33, train_loss: 0.8223, test_loss: 1.0412, test_f1: 0.5795
 epoch: 34, train_loss: 0.8047, test_loss: 1.0568, test_f1: 0.5446
 epoch: 35, train_loss: 0.8101, test_loss: 1.1522, test_f1: 0.4868
 epoch: 36, train_loss: 0.7912, test_loss: 1.2245, test_f1: 0.5279
 epoch: 37, train_loss: 0.7968, test_loss: 0.9667, test_f1: 0.6227
 epoch: 38, train_loss: 0.8392, test_loss: 1.1083, test_f1: 0.5302
 epoch: 39, train_loss: 0.8127, test_loss: 1.0272, test_f1: 0.5331
 epoch: 40, train_loss: 0.8001, test_loss: 1.1047, test_f1: 0.4644
 epoch: 41, train_loss: 0.8009, test_loss: 1.0418, test_f1: 0.5672
 epoch: 42, train_loss: 0.7658, test_loss: 0.9627, test_f1: 0.6175
 epoch: 43, train_loss: 0.7864, test_loss: 1.1847, test_f1: 0.5224
 epoch: 44, train_loss: 0.7908, test_loss: 1.0600, test_f1: 0.5424
 epoch: 45, train_loss: 0.8067, test_loss: 1.0081, test_f1: 0.5620
 epoch: 46, train_loss: 0.7885, test_loss: 1.2443, test_f1: 0.5148
 epoch: 47, train_loss: 0.7981, test_loss: 1.0035, test_f1: 0.5592
 epoch: 48, train_loss: 0.7855, test_loss: 1.1906, test_f1: 0.4739
 epoch: 49, train_loss: 0.8021, test_loss: 1.5446, test_f1: 0.4832
 epoch: 50, train_loss: 0.7907, test_loss: 1.0162, test_f1: 0.6142
 epoch: 51, train_loss: 0.7651, test_loss: 0.9684, test_f1: 0.6333
 epoch: 52, train_loss: 0.7500, test_loss: 0.9881, test_f1: 0.6538
 epoch: 53, train_loss: 0.7490, test_loss: 1.2808, test_f1: 0.5183
 epoch: 54, train_loss: 0.7663, test_loss: 0.9947, test_f1: 0.5985
 epoch: 55, train_loss: 0.7455, test_loss: 0.9566, test_f1: 0.6188
 epoch: 56, train_loss: 0.7391, test_loss: 0.9518, test_f1: 0.6009
 epoch: 57, train_loss: 0.7485, test_loss: 0.9906, test_f1: 0.5888
 epoch: 58, train_loss: 0.7488, test_loss: 0.9970, test_f1: 0.5981
 epoch: 59, train_loss: 0.7268, test_loss: 1.0012, test_f1: 0.5541
 epoch: 60, train_loss: 0.7349, test_loss: 1.0222, test_f1: 0.5996
 epoch: 61, train_loss: 0.7418, test_loss: 1.0346, test_f1: 0.6230
 epoch: 62, train_loss: 0.7255, test_loss: 1.0645, test_f1: 0.5334
 epoch: 63, train_loss: 0.7192, test_loss: 0.9470, test_f1: 0.6106
 epoch: 64, train_loss: 0.7157, test_loss: 0.9998, test_f1: 0.5792
 epoch: 65, train_loss: 0.7288, test_loss: 1.0268, test_f1: 0.5876
 epoch: 66, train_loss: 0.7303, test_loss: 1.0007, test_f1: 0.5816
 epoch: 67, train_loss: 0.7207, test_loss: 1.0171, test_f1: 0.6022
 epoch: 68, train_loss: 0.7018, test_loss: 1.0028, test_f1: 0.5194
 epoch: 69, train_loss: 0.7165, test_loss: 1.0742, test_f1: 0.5927
 epoch: 70, train_loss: 0.6923, test_loss: 1.0023, test_f1: 0.6088
 epoch: 71, train_loss: 0.7088, test_loss: 0.9609, test_f1: 0.6293
 epoch: 72, train_loss: 0.6975, test_loss: 1.2356, test_f1: 0.5406
 epoch: 73, train_loss: 0.6993, test_loss: 1.1121, test_f1: 0.5865
 epoch: 74, train_loss: 0.6930, test_loss: 1.0726, test_f1: 0.5745
 epoch: 75, train_loss: 0.7062, test_loss: 1.1558, test_f1: 0.5581
 epoch: 76, train_loss: 0.6807, test_loss: 1.1257, test_f1: 0.5457
 epoch: 77, train_loss: 0.7107, test_loss: 1.0278, test_f1: 0.6387
 epoch: 78, train_loss: 0.7141, test_loss: 1.0998, test_f1: 0.5993
 epoch: 79, train_loss: 0.6953, test_loss: 1.0646, test_f1: 0.5998
 epoch: 80, train_loss: 0.6745, test_loss: 1.0972, test_f1: 0.5533
 epoch: 81, train_loss: 0.6818, test_loss: 1.0116, test_f1: 0.6001
 epoch: 82, train_loss: 0.6604, test_loss: 1.0303, test_f1: 0.6027
 epoch: 83, train_loss: 0.6816, test_loss: 1.0796, test_f1: 0.5672
 epoch: 84, train_loss: 0.6700, test_loss: 1.2368, test_f1: 0.5436
 epoch: 85, train_loss: 0.6816, test_loss: 1.1132, test_f1: 0.6258
 epoch: 86, train_loss: 0.6580, test_loss: 1.3350, test_f1: 0.5691
 epoch: 87, train_loss: 0.6756, test_loss: 1.0606, test_f1: 0.6128
 epoch: 88, train_loss: 0.6829, test_loss: 1.0941, test_f1: 0.6035
 epoch: 89, train_loss: 0.6998, test_loss: 1.4338, test_f1: 0.5544
 epoch: 90, train_loss: 0.6843, test_loss: 1.0619, test_f1: 0.5999
 epoch: 91, train_loss: 0.6774, test_loss: 1.1043, test_f1: 0.5834
 epoch: 92, train_loss: 0.6839, test_loss: 1.0015, test_f1: 0.5910
 epoch: 93, train_loss: 0.6722, test_loss: 1.0434, test_f1: 0.6178
 epoch: 94, train_loss: 0.6547, test_loss: 1.0362, test_f1: 0.6014
 epoch: 95, train_loss: 0.6646, test_loss: 1.2448, test_f1: 0.5834
 epoch: 96, train_loss: 0.6614, test_loss: 1.0404, test_f1: 0.6140
 epoch: 97, train_loss: 0.6619, test_loss: 1.3616, test_f1: 0.5940
 epoch: 98, train_loss: 0.6713, test_loss: 1.3256, test_f1: 0.5959
 epoch: 99, train_loss: 0.6492, test_loss: 1.2426, test_f1: 0.5646
##################ITERATION #6 ****************************************
 epoch: 0, train_loss: 1.1512, test_loss: 1.1003, test_f1: 0.4302
 epoch: 1, train_loss: 1.0188, test_loss: 1.0921, test_f1: 0.5083
 epoch: 2, train_loss: 0.9773, test_loss: 1.0772, test_f1: 0.4165
 epoch: 3, train_loss: 0.9652, test_loss: 1.1061, test_f1: 0.4432
 epoch: 4, train_loss: 0.9293, test_loss: 1.2094, test_f1: 0.4604
 epoch: 5, train_loss: 0.9197, test_loss: 1.0803, test_f1: 0.5259
 epoch: 6, train_loss: 0.9146, test_loss: 1.1120, test_f1: 0.5297
 epoch: 7, train_loss: 0.8852, test_loss: 1.3052, test_f1: 0.4315
 epoch: 8, train_loss: 0.8816, test_loss: 1.2617, test_f1: 0.4757
 epoch: 9, train_loss: 0.8792, test_loss: 1.0994, test_f1: 0.5262
 epoch: 10, train_loss: 0.8821, test_loss: 1.0444, test_f1: 0.4839
 epoch: 11, train_loss: 0.8848, test_loss: 1.0386, test_f1: 0.5611
 epoch: 12, train_loss: 0.8777, test_loss: 0.9846, test_f1: 0.5402
 epoch: 13, train_loss: 0.8683, test_loss: 1.0088, test_f1: 0.5475
 epoch: 14, train_loss: 0.8500, test_loss: 1.0349, test_f1: 0.5592
 epoch: 15, train_loss: 0.8521, test_loss: 0.9617, test_f1: 0.5465
 epoch: 16, train_loss: 0.8568, test_loss: 0.9942, test_f1: 0.5263
 epoch: 17, train_loss: 0.8427, test_loss: 1.0333, test_f1: 0.4843
 epoch: 18, train_loss: 0.8488, test_loss: 0.9876, test_f1: 0.5650
 epoch: 19, train_loss: 0.8344, test_loss: 1.0081, test_f1: 0.5706
 epoch: 20, train_loss: 0.8380, test_loss: 0.9947, test_f1: 0.5683
 epoch: 21, train_loss: 0.8627, test_loss: 0.9601, test_f1: 0.5526
 epoch: 22, train_loss: 0.8319, test_loss: 1.0001, test_f1: 0.5637
 epoch: 23, train_loss: 0.8390, test_loss: 0.9477, test_f1: 0.6077
 epoch: 24, train_loss: 0.8339, test_loss: 0.9860, test_f1: 0.5466
 epoch: 25, train_loss: 0.8303, test_loss: 0.9784, test_f1: 0.6047
 epoch: 26, train_loss: 0.8228, test_loss: 0.9587, test_f1: 0.6189
 epoch: 27, train_loss: 0.8404, test_loss: 1.0931, test_f1: 0.5315
 epoch: 28, train_loss: 0.8545, test_loss: 1.0404, test_f1: 0.5895
 epoch: 29, train_loss: 0.8450, test_loss: 1.0061, test_f1: 0.5986
 epoch: 30, train_loss: 0.8435, test_loss: 1.0853, test_f1: 0.5110
 epoch: 31, train_loss: 0.8134, test_loss: 1.0225, test_f1: 0.5620
 epoch: 32, train_loss: 0.8098, test_loss: 1.0912, test_f1: 0.5452
 epoch: 33, train_loss: 0.8457, test_loss: 1.0655, test_f1: 0.5143
 epoch: 34, train_loss: 0.8202, test_loss: 0.9951, test_f1: 0.5910
 epoch: 35, train_loss: 0.8162, test_loss: 0.9658, test_f1: 0.5992
 epoch: 36, train_loss: 0.8138, test_loss: 1.1299, test_f1: 0.4861
 epoch: 37, train_loss: 0.8100, test_loss: 0.9497, test_f1: 0.6003
 epoch: 38, train_loss: 0.7994, test_loss: 0.9610, test_f1: 0.6115
 epoch: 39, train_loss: 0.8506, test_loss: 1.0068, test_f1: 0.5656
 epoch: 40, train_loss: 0.8450, test_loss: 1.0406, test_f1: 0.4888
 epoch: 41, train_loss: 0.8315, test_loss: 1.0031, test_f1: 0.5443
 epoch: 42, train_loss: 0.8043, test_loss: 1.1499, test_f1: 0.5559
 epoch: 43, train_loss: 0.7975, test_loss: 1.1428, test_f1: 0.5985
 epoch: 44, train_loss: 0.8107, test_loss: 0.9623, test_f1: 0.6016
 epoch: 45, train_loss: 0.7718, test_loss: 0.9996, test_f1: 0.5332
 epoch: 46, train_loss: 0.7995, test_loss: 0.9904, test_f1: 0.5926
 epoch: 47, train_loss: 0.7849, test_loss: 1.0008, test_f1: 0.5963
 epoch: 48, train_loss: 0.7814, test_loss: 1.0060, test_f1: 0.5476
 epoch: 49, train_loss: 0.8018, test_loss: 1.1368, test_f1: 0.4518
 epoch: 50, train_loss: 0.7933, test_loss: 0.9641, test_f1: 0.5979
 epoch: 51, train_loss: 0.7679, test_loss: 0.9510, test_f1: 0.6263
 epoch: 52, train_loss: 0.7418, test_loss: 0.9305, test_f1: 0.5989
 epoch: 53, train_loss: 0.7238, test_loss: 0.9408, test_f1: 0.6093
 epoch: 54, train_loss: 0.7209, test_loss: 0.9299, test_f1: 0.6449
 epoch: 55, train_loss: 0.7396, test_loss: 0.9891, test_f1: 0.5937
 epoch: 56, train_loss: 0.7243, test_loss: 0.9978, test_f1: 0.5818
 epoch: 57, train_loss: 0.7230, test_loss: 0.9762, test_f1: 0.5937
 epoch: 58, train_loss: 0.7385, test_loss: 0.9759, test_f1: 0.5727
 epoch: 59, train_loss: 0.7346, test_loss: 0.9897, test_f1: 0.6108
 epoch: 60, train_loss: 0.7301, test_loss: 1.0428, test_f1: 0.6061
 epoch: 61, train_loss: 0.7361, test_loss: 1.0096, test_f1: 0.6026
 epoch: 62, train_loss: 0.7177, test_loss: 0.9331, test_f1: 0.6332
 epoch: 63, train_loss: 0.7475, test_loss: 0.9020, test_f1: 0.6529
 epoch: 64, train_loss: 0.7154, test_loss: 0.9975, test_f1: 0.6139
 epoch: 65, train_loss: 0.7265, test_loss: 1.0099, test_f1: 0.5711
 epoch: 66, train_loss: 0.7192, test_loss: 1.5466, test_f1: 0.5211
 epoch: 67, train_loss: 0.7409, test_loss: 0.9748, test_f1: 0.6262
 epoch: 68, train_loss: 0.7043, test_loss: 0.9658, test_f1: 0.6426
 epoch: 69, train_loss: 0.6939, test_loss: 0.9630, test_f1: 0.6191
 epoch: 70, train_loss: 0.7022, test_loss: 0.9972, test_f1: 0.6307
 epoch: 71, train_loss: 0.7029, test_loss: 1.0934, test_f1: 0.6240
 epoch: 72, train_loss: 0.7079, test_loss: 1.1200, test_f1: 0.5976
 epoch: 73, train_loss: 0.7062, test_loss: 0.9465, test_f1: 0.6268
 epoch: 74, train_loss: 0.6669, test_loss: 0.9820, test_f1: 0.6153
 epoch: 75, train_loss: 0.6846, test_loss: 0.9973, test_f1: 0.6056
 epoch: 76, train_loss: 0.6642, test_loss: 1.0814, test_f1: 0.6426
 epoch: 77, train_loss: 0.6947, test_loss: 0.9591, test_f1: 0.6199
 epoch: 78, train_loss: 0.6824, test_loss: 1.0510, test_f1: 0.5962
 epoch: 79, train_loss: 0.6842, test_loss: 1.1047, test_f1: 0.5768
 epoch: 80, train_loss: 0.6645, test_loss: 0.8962, test_f1: 0.6974
 epoch: 81, train_loss: 0.6690, test_loss: 0.9850, test_f1: 0.6242
 epoch: 82, train_loss: 0.6710, test_loss: 0.9512, test_f1: 0.6776
 epoch: 83, train_loss: 0.6476, test_loss: 0.9390, test_f1: 0.6632
 epoch: 84, train_loss: 0.6786, test_loss: 1.1214, test_f1: 0.5649
 epoch: 85, train_loss: 0.6714, test_loss: 1.0851, test_f1: 0.5773
 epoch: 86, train_loss: 0.6681, test_loss: 1.0389, test_f1: 0.6284
 epoch: 87, train_loss: 0.6637, test_loss: 1.3868, test_f1: 0.5373
 epoch: 88, train_loss: 0.6861, test_loss: 1.0594, test_f1: 0.6364
 epoch: 89, train_loss: 0.6646, test_loss: 0.9958, test_f1: 0.6020
 epoch: 90, train_loss: 0.6567, test_loss: 1.1231, test_f1: 0.5916
 epoch: 91, train_loss: 0.6629, test_loss: 1.0176, test_f1: 0.6333
 epoch: 92, train_loss: 0.6540, test_loss: 0.9779, test_f1: 0.6411
 epoch: 93, train_loss: 0.6821, test_loss: 1.1110, test_f1: 0.5721
 epoch: 94, train_loss: 0.6455, test_loss: 1.0151, test_f1: 0.6366
 epoch: 95, train_loss: 0.6402, test_loss: 1.0624, test_f1: 0.6099
 epoch: 96, train_loss: 0.6461, test_loss: 0.9970, test_f1: 0.6824
 epoch: 97, train_loss: 0.6528, test_loss: 0.9506, test_f1: 0.6641
 epoch: 98, train_loss: 0.6614, test_loss: 0.9592, test_f1: 0.6459
 epoch: 99, train_loss: 0.6513, test_loss: 1.0611, test_f1: 0.6140
##################ITERATION #7 ****************************************
 epoch: 0, train_loss: 1.1465, test_loss: 1.2500, test_f1: 0.3125
 epoch: 1, train_loss: 1.0450, test_loss: 1.0750, test_f1: 0.4441
 epoch: 2, train_loss: 1.0060, test_loss: 1.0984, test_f1: 0.4990
 epoch: 3, train_loss: 1.0083, test_loss: 1.0873, test_f1: 0.5005
 epoch: 4, train_loss: 0.9783, test_loss: 1.0703, test_f1: 0.5212
 epoch: 5, train_loss: 0.9520, test_loss: 1.0067, test_f1: 0.5841
 epoch: 6, train_loss: 0.9553, test_loss: 0.9861, test_f1: 0.5260
 epoch: 7, train_loss: 0.9293, test_loss: 1.0043, test_f1: 0.5432
 epoch: 8, train_loss: 0.9325, test_loss: 0.9896, test_f1: 0.5586
 epoch: 9, train_loss: 0.9091, test_loss: 1.0536, test_f1: 0.5601
 epoch: 10, train_loss: 0.9111, test_loss: 0.9650, test_f1: 0.5437
 epoch: 11, train_loss: 0.9023, test_loss: 0.9898, test_f1: 0.5703
 epoch: 12, train_loss: 0.9083, test_loss: 0.9335, test_f1: 0.5660
 epoch: 13, train_loss: 0.8887, test_loss: 0.9808, test_f1: 0.5620
 epoch: 14, train_loss: 0.8661, test_loss: 1.0172, test_f1: 0.5433
 epoch: 15, train_loss: 0.8567, test_loss: 0.9557, test_f1: 0.5586
 epoch: 16, train_loss: 0.8538, test_loss: 0.9883, test_f1: 0.5857
 epoch: 17, train_loss: 0.8456, test_loss: 1.0322, test_f1: 0.5705
 epoch: 18, train_loss: 0.8776, test_loss: 0.9388, test_f1: 0.5671
 epoch: 19, train_loss: 0.8492, test_loss: 1.0253, test_f1: 0.5505
 epoch: 20, train_loss: 0.8165, test_loss: 1.0231, test_f1: 0.5312
 epoch: 21, train_loss: 0.8516, test_loss: 1.0149, test_f1: 0.5372
 epoch: 22, train_loss: 0.8592, test_loss: 0.9973, test_f1: 0.5761
 epoch: 23, train_loss: 0.8397, test_loss: 1.0558, test_f1: 0.5295
 epoch: 24, train_loss: 0.8215, test_loss: 0.9618, test_f1: 0.5876
 epoch: 25, train_loss: 0.8267, test_loss: 0.9814, test_f1: 0.6035
 epoch: 26, train_loss: 0.8353, test_loss: 0.9957, test_f1: 0.6054
 epoch: 27, train_loss: 0.8132, test_loss: 0.9781, test_f1: 0.5760
 epoch: 28, train_loss: 0.8186, test_loss: 1.0415, test_f1: 0.5544
 epoch: 29, train_loss: 0.7904, test_loss: 1.0096, test_f1: 0.5367
 epoch: 30, train_loss: 0.8070, test_loss: 0.9924, test_f1: 0.5503
 epoch: 31, train_loss: 0.8379, test_loss: 0.9791, test_f1: 0.6050
 epoch: 32, train_loss: 0.7920, test_loss: 1.0426, test_f1: 0.5645
 epoch: 33, train_loss: 0.8090, test_loss: 0.9907, test_f1: 0.5620
 epoch: 34, train_loss: 0.7876, test_loss: 1.0488, test_f1: 0.5253
 epoch: 35, train_loss: 0.7922, test_loss: 0.9991, test_f1: 0.6213
 epoch: 36, train_loss: 0.7792, test_loss: 0.9922, test_f1: 0.5892
 epoch: 37, train_loss: 0.7793, test_loss: 1.0207, test_f1: 0.4917
 epoch: 38, train_loss: 0.8014, test_loss: 1.0452, test_f1: 0.5941
 epoch: 39, train_loss: 0.7795, test_loss: 0.9612, test_f1: 0.6102
 epoch: 40, train_loss: 0.8070, test_loss: 0.9771, test_f1: 0.5982
 epoch: 41, train_loss: 0.7541, test_loss: 0.9902, test_f1: 0.5886
 epoch: 42, train_loss: 0.7611, test_loss: 1.0156, test_f1: 0.6142
 epoch: 43, train_loss: 0.7704, test_loss: 0.9928, test_f1: 0.5148
 epoch: 44, train_loss: 0.7907, test_loss: 0.9804, test_f1: 0.6398
 epoch: 45, train_loss: 0.7525, test_loss: 0.9918, test_f1: 0.5905
 epoch: 46, train_loss: 0.7669, test_loss: 1.0521, test_f1: 0.5449
 epoch: 47, train_loss: 0.7848, test_loss: 1.0272, test_f1: 0.5707
 epoch: 48, train_loss: 0.7721, test_loss: 1.0311, test_f1: 0.5904
 epoch: 49, train_loss: 0.7565, test_loss: 1.0182, test_f1: 0.6204
 epoch: 50, train_loss: 0.7424, test_loss: 1.1191, test_f1: 0.5527
 epoch: 51, train_loss: 0.7137, test_loss: 1.0976, test_f1: 0.5691
 epoch: 52, train_loss: 0.7188, test_loss: 1.0188, test_f1: 0.6024
 epoch: 53, train_loss: 0.7213, test_loss: 1.0372, test_f1: 0.5810
 epoch: 54, train_loss: 0.7258, test_loss: 1.0274, test_f1: 0.6291
 epoch: 55, train_loss: 0.7143, test_loss: 1.0453, test_f1: 0.5996
 epoch: 56, train_loss: 0.7112, test_loss: 1.0084, test_f1: 0.6052
 epoch: 57, train_loss: 0.7124, test_loss: 1.0581, test_f1: 0.6049
 epoch: 58, train_loss: 0.7166, test_loss: 1.0353, test_f1: 0.5804
 epoch: 59, train_loss: 0.7070, test_loss: 1.0165, test_f1: 0.6297
 epoch: 60, train_loss: 0.7322, test_loss: 1.0612, test_f1: 0.6313
 epoch: 61, train_loss: 0.7044, test_loss: 0.9731, test_f1: 0.6484
 epoch: 62, train_loss: 0.7038, test_loss: 1.0120, test_f1: 0.6375
 epoch: 63, train_loss: 0.6968, test_loss: 1.0223, test_f1: 0.5950
 epoch: 64, train_loss: 0.6934, test_loss: 1.0595, test_f1: 0.6104
 epoch: 65, train_loss: 0.6980, test_loss: 1.0344, test_f1: 0.6214
 epoch: 66, train_loss: 0.6777, test_loss: 1.0762, test_f1: 0.5987
 epoch: 67, train_loss: 0.6700, test_loss: 1.0706, test_f1: 0.6237
 epoch: 68, train_loss: 0.6754, test_loss: 1.0802, test_f1: 0.6046
 epoch: 69, train_loss: 0.6894, test_loss: 1.1175, test_f1: 0.5879
 epoch: 70, train_loss: 0.7131, test_loss: 1.0565, test_f1: 0.6163
 epoch: 71, train_loss: 0.6874, test_loss: 1.0539, test_f1: 0.5878
 epoch: 72, train_loss: 0.6821, test_loss: 1.0037, test_f1: 0.6442
 epoch: 73, train_loss: 0.6761, test_loss: 1.0569, test_f1: 0.6139
 epoch: 74, train_loss: 0.6849, test_loss: 1.0414, test_f1: 0.6253
 epoch: 75, train_loss: 0.6863, test_loss: 1.0466, test_f1: 0.6383
 epoch: 76, train_loss: 0.6597, test_loss: 1.1113, test_f1: 0.6070
 epoch: 77, train_loss: 0.6879, test_loss: 0.9976, test_f1: 0.6228
 epoch: 78, train_loss: 0.6660, test_loss: 1.1646, test_f1: 0.4880
 epoch: 79, train_loss: 0.6771, test_loss: 1.1260, test_f1: 0.6065
 epoch: 80, train_loss: 0.6759, test_loss: 1.0845, test_f1: 0.6248
 epoch: 81, train_loss: 0.6603, test_loss: 1.0345, test_f1: 0.6151
 epoch: 82, train_loss: 0.6315, test_loss: 1.1983, test_f1: 0.6369
 epoch: 83, train_loss: 0.6792, test_loss: 1.0197, test_f1: 0.6407
 epoch: 84, train_loss: 0.6723, test_loss: 1.0699, test_f1: 0.6288
 epoch: 85, train_loss: 0.6605, test_loss: 1.0957, test_f1: 0.5915
 epoch: 86, train_loss: 0.6656, test_loss: 1.1061, test_f1: 0.5697
 epoch: 87, train_loss: 0.6596, test_loss: 1.1034, test_f1: 0.5974
 epoch: 88, train_loss: 0.6405, test_loss: 1.1289, test_f1: 0.6268
 epoch: 89, train_loss: 0.6524, test_loss: 1.1508, test_f1: 0.6393
 epoch: 90, train_loss: 0.6439, test_loss: 1.1353, test_f1: 0.6201
 epoch: 91, train_loss: 0.6389, test_loss: 1.0853, test_f1: 0.5995
 epoch: 92, train_loss: 0.6514, test_loss: 1.1193, test_f1: 0.6192
 epoch: 93, train_loss: 0.6499, test_loss: 1.0223, test_f1: 0.6298
 epoch: 94, train_loss: 0.6173, test_loss: 1.0781, test_f1: 0.6347
 epoch: 95, train_loss: 0.6384, test_loss: 1.0560, test_f1: 0.6114
 epoch: 96, train_loss: 0.6092, test_loss: 1.1504, test_f1: 0.6440
 epoch: 97, train_loss: 0.6601, test_loss: 1.0929, test_f1: 0.6159
 epoch: 98, train_loss: 0.6458, test_loss: 1.0653, test_f1: 0.6381
 epoch: 99, train_loss: 0.6196, test_loss: 1.1095, test_f1: 0.6231
##################ITERATION #8 ****************************************
 epoch: 0, train_loss: 1.1432, test_loss: 1.1158, test_f1: 0.4402
 epoch: 1, train_loss: 0.9980, test_loss: 1.0792, test_f1: 0.4784
 epoch: 2, train_loss: 0.9548, test_loss: 1.0355, test_f1: 0.5404
 epoch: 3, train_loss: 0.9382, test_loss: 0.9900, test_f1: 0.4541
 epoch: 4, train_loss: 0.9223, test_loss: 1.0094, test_f1: 0.4788
 epoch: 5, train_loss: 0.9220, test_loss: 1.0779, test_f1: 0.5112
 epoch: 6, train_loss: 0.8833, test_loss: 1.0001, test_f1: 0.5224
 epoch: 7, train_loss: 0.8952, test_loss: 1.0709, test_f1: 0.4860
 epoch: 8, train_loss: 0.8786, test_loss: 1.0549, test_f1: 0.4838
 epoch: 9, train_loss: 0.8924, test_loss: 0.9619, test_f1: 0.5436
 epoch: 10, train_loss: 0.8824, test_loss: 0.9809, test_f1: 0.5100
 epoch: 11, train_loss: 0.8839, test_loss: 1.0205, test_f1: 0.5507
 epoch: 12, train_loss: 0.8769, test_loss: 0.9838, test_f1: 0.5417
 epoch: 13, train_loss: 0.8562, test_loss: 0.9838, test_f1: 0.5441
 epoch: 14, train_loss: 0.8520, test_loss: 0.9767, test_f1: 0.5202
 epoch: 15, train_loss: 0.8755, test_loss: 1.0675, test_f1: 0.5579
 epoch: 16, train_loss: 0.8635, test_loss: 1.0307, test_f1: 0.5342
 epoch: 17, train_loss: 0.8667, test_loss: 1.0827, test_f1: 0.4585
 epoch: 18, train_loss: 0.8685, test_loss: 1.0014, test_f1: 0.5143
 epoch: 19, train_loss: 0.8708, test_loss: 0.9755, test_f1: 0.4889
 epoch: 20, train_loss: 0.8519, test_loss: 0.9844, test_f1: 0.5668
 epoch: 21, train_loss: 0.8450, test_loss: 0.9549, test_f1: 0.5963
 epoch: 22, train_loss: 0.8315, test_loss: 0.9928, test_f1: 0.5733
 epoch: 23, train_loss: 0.8424, test_loss: 1.0054, test_f1: 0.5807
 epoch: 24, train_loss: 0.8440, test_loss: 1.0134, test_f1: 0.5616
 epoch: 25, train_loss: 0.8459, test_loss: 0.9815, test_f1: 0.5622
 epoch: 26, train_loss: 0.8154, test_loss: 0.9966, test_f1: 0.5358
 epoch: 27, train_loss: 0.8322, test_loss: 0.9856, test_f1: 0.5861
 epoch: 28, train_loss: 0.8283, test_loss: 1.0306, test_f1: 0.5430
 epoch: 29, train_loss: 0.8365, test_loss: 0.9513, test_f1: 0.5691
 epoch: 30, train_loss: 0.8209, test_loss: 1.0844, test_f1: 0.5270
 epoch: 31, train_loss: 0.8235, test_loss: 1.0110, test_f1: 0.6069
 epoch: 32, train_loss: 0.8462, test_loss: 1.0436, test_f1: 0.5765
 epoch: 33, train_loss: 0.8381, test_loss: 0.9819, test_f1: 0.5816
 epoch: 34, train_loss: 0.8150, test_loss: 1.0132, test_f1: 0.5725
 epoch: 35, train_loss: 0.8066, test_loss: 0.9930, test_f1: 0.5148
 epoch: 36, train_loss: 0.8251, test_loss: 0.9744, test_f1: 0.5785
 epoch: 37, train_loss: 0.8051, test_loss: 1.0059, test_f1: 0.5687
 epoch: 38, train_loss: 0.8072, test_loss: 1.0642, test_f1: 0.5365
 epoch: 39, train_loss: 0.8215, test_loss: 0.9743, test_f1: 0.5845
 epoch: 40, train_loss: 0.8208, test_loss: 1.0082, test_f1: 0.5705
 epoch: 41, train_loss: 0.8046, test_loss: 0.9719, test_f1: 0.5721
 epoch: 42, train_loss: 0.8082, test_loss: 0.9942, test_f1: 0.5553
 epoch: 43, train_loss: 0.7885, test_loss: 1.0542, test_f1: 0.5854
 epoch: 44, train_loss: 0.8046, test_loss: 1.1231, test_f1: 0.5401
 epoch: 45, train_loss: 0.8239, test_loss: 1.0423, test_f1: 0.5295
 epoch: 46, train_loss: 0.7923, test_loss: 1.0138, test_f1: 0.5632
 epoch: 47, train_loss: 0.7887, test_loss: 0.9969, test_f1: 0.5765
 epoch: 48, train_loss: 0.8000, test_loss: 1.1932, test_f1: 0.5473
 epoch: 49, train_loss: 0.7897, test_loss: 0.9601, test_f1: 0.5760
 epoch: 50, train_loss: 0.7895, test_loss: 1.0075, test_f1: 0.6196
 epoch: 51, train_loss: 0.7565, test_loss: 1.0949, test_f1: 0.5663
 epoch: 52, train_loss: 0.7649, test_loss: 0.9964, test_f1: 0.5928
 epoch: 53, train_loss: 0.7604, test_loss: 1.0217, test_f1: 0.5714
 epoch: 54, train_loss: 0.7443, test_loss: 1.0160, test_f1: 0.5954
 epoch: 55, train_loss: 0.7635, test_loss: 1.0001, test_f1: 0.5950
 epoch: 56, train_loss: 0.7380, test_loss: 1.0456, test_f1: 0.5662
 epoch: 57, train_loss: 0.7238, test_loss: 0.9813, test_f1: 0.6103
 epoch: 58, train_loss: 0.7486, test_loss: 1.0215, test_f1: 0.6027
 epoch: 59, train_loss: 0.7278, test_loss: 1.1200, test_f1: 0.5901
 epoch: 60, train_loss: 0.7274, test_loss: 1.0484, test_f1: 0.5904
 epoch: 61, train_loss: 0.7326, test_loss: 1.0096, test_f1: 0.5901
 epoch: 62, train_loss: 0.7308, test_loss: 1.0470, test_f1: 0.6039
 epoch: 63, train_loss: 0.7233, test_loss: 1.0010, test_f1: 0.6369
 epoch: 64, train_loss: 0.7328, test_loss: 1.0666, test_f1: 0.5957
 epoch: 65, train_loss: 0.7067, test_loss: 1.0972, test_f1: 0.5860
 epoch: 66, train_loss: 0.7180, test_loss: 1.0149, test_f1: 0.6318
 epoch: 67, train_loss: 0.7261, test_loss: 0.9912, test_f1: 0.6005
 epoch: 68, train_loss: 0.7143, test_loss: 1.0431, test_f1: 0.5987
 epoch: 69, train_loss: 0.7143, test_loss: 1.0718, test_f1: 0.6228
 epoch: 70, train_loss: 0.7058, test_loss: 1.0975, test_f1: 0.5918
 epoch: 71, train_loss: 0.7147, test_loss: 1.1063, test_f1: 0.5420
 epoch: 72, train_loss: 0.6849, test_loss: 1.1026, test_f1: 0.6206
 epoch: 73, train_loss: 0.7068, test_loss: 1.1958, test_f1: 0.5586
 epoch: 74, train_loss: 0.6870, test_loss: 1.0595, test_f1: 0.6166
 epoch: 75, train_loss: 0.6897, test_loss: 1.0059, test_f1: 0.6276
 epoch: 76, train_loss: 0.6874, test_loss: 1.0119, test_f1: 0.6056
 epoch: 77, train_loss: 0.6793, test_loss: 1.2637, test_f1: 0.5670
 epoch: 78, train_loss: 0.6847, test_loss: 1.1030, test_f1: 0.6003
 epoch: 79, train_loss: 0.6918, test_loss: 1.2959, test_f1: 0.5171
 epoch: 80, train_loss: 0.7124, test_loss: 0.9966, test_f1: 0.6269
 epoch: 81, train_loss: 0.6887, test_loss: 1.0890, test_f1: 0.5599
 epoch: 82, train_loss: 0.6870, test_loss: 1.2523, test_f1: 0.5197
 epoch: 83, train_loss: 0.6734, test_loss: 1.2642, test_f1: 0.5928
 epoch: 84, train_loss: 0.6904, test_loss: 1.1602, test_f1: 0.5582
 epoch: 85, train_loss: 0.6769, test_loss: 1.1958, test_f1: 0.5653
 epoch: 86, train_loss: 0.6753, test_loss: 1.1487, test_f1: 0.5982
 epoch: 87, train_loss: 0.6707, test_loss: 1.0392, test_f1: 0.6221
 epoch: 88, train_loss: 0.6555, test_loss: 1.3539, test_f1: 0.6188
 epoch: 89, train_loss: 0.6829, test_loss: 1.1713, test_f1: 0.5696
 epoch: 90, train_loss: 0.6654, test_loss: 1.1144, test_f1: 0.5946
 epoch: 91, train_loss: 0.6711, test_loss: 0.9896, test_f1: 0.6431
 epoch: 92, train_loss: 0.6613, test_loss: 1.0431, test_f1: 0.5995
 epoch: 93, train_loss: 0.6700, test_loss: 1.0496, test_f1: 0.6243
 epoch: 94, train_loss: 0.6533, test_loss: 1.3972, test_f1: 0.5713
 epoch: 95, train_loss: 0.6573, test_loss: 1.2690, test_f1: 0.5691
 epoch: 96, train_loss: 0.6760, test_loss: 1.3286, test_f1: 0.5870
 epoch: 97, train_loss: 0.6560, test_loss: 1.0845, test_f1: 0.6198
 epoch: 98, train_loss: 0.6778, test_loss: 1.3056, test_f1: 0.5675
 epoch: 99, train_loss: 0.6445, test_loss: 1.1431, test_f1: 0.5743
##################ITERATION #9 ****************************************
 epoch: 0, train_loss: 1.1596, test_loss: 1.2327, test_f1: 0.3629
 epoch: 1, train_loss: 1.0433, test_loss: 1.0682, test_f1: 0.4570
 epoch: 2, train_loss: 1.0121, test_loss: 1.1136, test_f1: 0.4618
 epoch: 3, train_loss: 1.0029, test_loss: 1.0523, test_f1: 0.5094
 epoch: 4, train_loss: 0.9722, test_loss: 1.0095, test_f1: 0.5115
 epoch: 5, train_loss: 0.9434, test_loss: 1.0663, test_f1: 0.5563
 epoch: 6, train_loss: 0.9386, test_loss: 1.0069, test_f1: 0.4445
 epoch: 7, train_loss: 0.9478, test_loss: 1.0086, test_f1: 0.4222
 epoch: 8, train_loss: 0.9170, test_loss: 1.0573, test_f1: 0.5059
 epoch: 9, train_loss: 0.9202, test_loss: 1.0069, test_f1: 0.5173
 epoch: 10, train_loss: 0.8913, test_loss: 1.0615, test_f1: 0.5428
 epoch: 11, train_loss: 0.8755, test_loss: 1.0512, test_f1: 0.5221
 epoch: 12, train_loss: 0.8677, test_loss: 1.0313, test_f1: 0.5443
 epoch: 13, train_loss: 0.8857, test_loss: 0.9973, test_f1: 0.5583
 epoch: 14, train_loss: 0.8947, test_loss: 1.0016, test_f1: 0.5393
 epoch: 15, train_loss: 0.8729, test_loss: 0.9706, test_f1: 0.5247
 epoch: 16, train_loss: 0.8760, test_loss: 0.9925, test_f1: 0.5765
 epoch: 17, train_loss: 0.8714, test_loss: 0.9985, test_f1: 0.5657
 epoch: 18, train_loss: 0.8695, test_loss: 1.0034, test_f1: 0.5345
 epoch: 19, train_loss: 0.8772, test_loss: 1.0067, test_f1: 0.5298
 epoch: 20, train_loss: 0.8735, test_loss: 0.9505, test_f1: 0.5543
 epoch: 21, train_loss: 0.8641, test_loss: 0.9535, test_f1: 0.5702
 epoch: 22, train_loss: 0.8661, test_loss: 0.9846, test_f1: 0.5194
 epoch: 23, train_loss: 0.8514, test_loss: 0.9562, test_f1: 0.5421
 epoch: 24, train_loss: 0.8641, test_loss: 0.9565, test_f1: 0.5680
 epoch: 25, train_loss: 0.8486, test_loss: 0.9898, test_f1: 0.5378
 epoch: 26, train_loss: 0.8523, test_loss: 0.9858, test_f1: 0.5631
 epoch: 27, train_loss: 0.8515, test_loss: 1.0345, test_f1: 0.5670
 epoch: 28, train_loss: 0.8960, test_loss: 0.9356, test_f1: 0.5051
 epoch: 29, train_loss: 0.8480, test_loss: 0.9664, test_f1: 0.5636
 epoch: 30, train_loss: 0.8459, test_loss: 1.0170, test_f1: 0.5374
 epoch: 31, train_loss: 0.8583, test_loss: 1.0007, test_f1: 0.5730
 epoch: 32, train_loss: 0.8478, test_loss: 0.9529, test_f1: 0.5703
 epoch: 33, train_loss: 0.8416, test_loss: 0.9424, test_f1: 0.5808
 epoch: 34, train_loss: 0.8398, test_loss: 0.9795, test_f1: 0.5722
 epoch: 35, train_loss: 0.8198, test_loss: 0.9601, test_f1: 0.5684
 epoch: 36, train_loss: 0.8274, test_loss: 0.9562, test_f1: 0.5818
 epoch: 37, train_loss: 0.8326, test_loss: 0.9476, test_f1: 0.5871
 epoch: 38, train_loss: 0.8367, test_loss: 1.0048, test_f1: 0.5675
 epoch: 39, train_loss: 0.8205, test_loss: 0.9948, test_f1: 0.5853
 epoch: 40, train_loss: 0.8336, test_loss: 0.9464, test_f1: 0.5848
 epoch: 41, train_loss: 0.8201, test_loss: 0.9273, test_f1: 0.5893
 epoch: 42, train_loss: 0.8355, test_loss: 0.9887, test_f1: 0.5773
 epoch: 43, train_loss: 0.8572, test_loss: 0.9717, test_f1: 0.5788
 epoch: 44, train_loss: 0.8355, test_loss: 1.1905, test_f1: 0.4766
 epoch: 45, train_loss: 0.8516, test_loss: 0.9795, test_f1: 0.5425
 epoch: 46, train_loss: 0.8347, test_loss: 0.9789, test_f1: 0.5432
 epoch: 47, train_loss: 0.8179, test_loss: 0.9511, test_f1: 0.5797
 epoch: 48, train_loss: 0.8364, test_loss: 0.9569, test_f1: 0.5800
 epoch: 49, train_loss: 0.8181, test_loss: 0.9818, test_f1: 0.5847
 epoch: 50, train_loss: 0.8167, test_loss: 0.9896, test_f1: 0.5548
 epoch: 51, train_loss: 0.7958, test_loss: 0.9760, test_f1: 0.5826
 epoch: 52, train_loss: 0.8062, test_loss: 0.9612, test_f1: 0.5936
 epoch: 53, train_loss: 0.7976, test_loss: 1.0230, test_f1: 0.5619
 epoch: 54, train_loss: 0.8025, test_loss: 0.9758, test_f1: 0.5530
 epoch: 55, train_loss: 0.8082, test_loss: 0.9570, test_f1: 0.5825
 epoch: 56, train_loss: 0.8015, test_loss: 0.9711, test_f1: 0.5969
 epoch: 57, train_loss: 0.7951, test_loss: 0.9667, test_f1: 0.5773
 epoch: 58, train_loss: 0.7864, test_loss: 0.9672, test_f1: 0.5815
 epoch: 59, train_loss: 0.7807, test_loss: 0.9834, test_f1: 0.5757
 epoch: 60, train_loss: 0.7944, test_loss: 1.0131, test_f1: 0.5480
 epoch: 61, train_loss: 0.7982, test_loss: 1.0062, test_f1: 0.5560
 epoch: 62, train_loss: 0.7846, test_loss: 0.9962, test_f1: 0.5543
 epoch: 63, train_loss: 0.7743, test_loss: 1.0464, test_f1: 0.5298
 epoch: 64, train_loss: 0.7841, test_loss: 1.0127, test_f1: 0.5636
 epoch: 65, train_loss: 0.7762, test_loss: 0.9938, test_f1: 0.5700
 epoch: 66, train_loss: 0.7857, test_loss: 0.9517, test_f1: 0.6033
 epoch: 67, train_loss: 0.7771, test_loss: 1.1173, test_f1: 0.5136
 epoch: 68, train_loss: 0.7891, test_loss: 1.0225, test_f1: 0.5527
 epoch: 69, train_loss: 0.7748, test_loss: 0.9976, test_f1: 0.5793
 epoch: 70, train_loss: 0.7733, test_loss: 1.4458, test_f1: 0.5005
 epoch: 71, train_loss: 0.7705, test_loss: 1.0173, test_f1: 0.5695
 epoch: 72, train_loss: 0.7729, test_loss: 1.0616, test_f1: 0.6103
 epoch: 73, train_loss: 0.7785, test_loss: 1.2842, test_f1: 0.5229
 epoch: 74, train_loss: 0.7584, test_loss: 0.9989, test_f1: 0.5906
 epoch: 75, train_loss: 0.7811, test_loss: 1.0634, test_f1: 0.5600
 epoch: 76, train_loss: 0.7689, test_loss: 1.1350, test_f1: 0.5393
 epoch: 77, train_loss: 0.7704, test_loss: 1.0928, test_f1: 0.5327
 epoch: 78, train_loss: 0.7645, test_loss: 1.1291, test_f1: 0.5576
 epoch: 79, train_loss: 0.7589, test_loss: 1.0332, test_f1: 0.5689
 epoch: 80, train_loss: 0.7496, test_loss: 1.1623, test_f1: 0.5443
 epoch: 81, train_loss: 0.7633, test_loss: 1.0114, test_f1: 0.5774
 epoch: 82, train_loss: 0.7648, test_loss: 1.1308, test_f1: 0.5474
 epoch: 83, train_loss: 0.7818, test_loss: 0.9655, test_f1: 0.5936
 epoch: 84, train_loss: 0.7705, test_loss: 0.9821, test_f1: 0.5652
 epoch: 85, train_loss: 0.7660, test_loss: 1.0564, test_f1: 0.5686
 epoch: 86, train_loss: 0.7663, test_loss: 0.9915, test_f1: 0.5841
 epoch: 87, train_loss: 0.7811, test_loss: 1.1578, test_f1: 0.5416
 epoch: 88, train_loss: 0.7793, test_loss: 1.1224, test_f1: 0.5214
 epoch: 89, train_loss: 0.7728, test_loss: 1.2382, test_f1: 0.5297
 epoch: 90, train_loss: 0.7561, test_loss: 1.1341, test_f1: 0.5152
 epoch: 91, train_loss: 0.7610, test_loss: 1.0199, test_f1: 0.5572
 epoch: 92, train_loss: 0.7555, test_loss: 1.0722, test_f1: 0.5665
 epoch: 93, train_loss: 0.7519, test_loss: 1.0521, test_f1: 0.5695
 epoch: 94, train_loss: 0.7536, test_loss: 1.0703, test_f1: 0.5367
 epoch: 95, train_loss: 0.7407, test_loss: 1.4309, test_f1: 0.5296
 epoch: 96, train_loss: 0.7468, test_loss: 1.8839, test_f1: 0.5207
 epoch: 97, train_loss: 0.7271, test_loss: 1.0955, test_f1: 0.5529
 epoch: 98, train_loss: 0.7390, test_loss: 1.2494, test_f1: 0.5277
 epoch: 99, train_loss: 0.7398, test_loss: 1.0920, test_f1: 0.5561

Training completed in 678.33 seconds
Best F1: 0.6974 at epoch 80
Mean F1 across iterations: 0.6492  0.0236
========================FINAL RESULTS================================
FEGIN weighted F1: 0.6974  0.0236
python main.py --data ltspice_demos --representation component_pin_net --model FEGIN --layers 4 --hiddens 16 --batch_size 32 --lr 0.01 --emb_size 250 --epochs 100 --save_appendix component_pin_net_L4_H16_BS32_LR0.01_E250 --no_val
-----



STDERR:
  File "main.py", line 370, in <module>
    main()
  File "main.py", line 254, in main
    dataset = dataset_class(
  File "/home/philip/projects/ltspice_examples_code_repo/Circuit-Completion-Using-GNNs/component_classification_with_link_prediction_head/evaluation/FEGIN/kernel/circuit_datasets.py", line 15, in __init__
    self.data, self.slices = torch.load(self.processed_paths[0])
  File "/home/philip/.local/lib/python3.8/site-packages/torch/serialization.py", line 1040, in load
    warnings.warn(
  File "/usr/lib/python3.8/warnings.py", line 109, in _showwarnmsg
    sw(msg.message, msg.category, msg.filename, msg.lineno,
  File "main.py", line 47, in warn_with_traceback
    traceback.print_stack(file=log)
/home/philip/projects/ltspice_examples_code_repo/Circuit-Completion-Using-GNNs/component_classification_with_link_prediction_head/evaluation/FEGIN/kernel/circuit_datasets.py:15: FutureWarning: You are using `torch.load` with `weights_only=False` (the current default value), which uses the default pickle module implicitly. It is possible to construct malicious pickle data which will execute arbitrary code during unpickling (See https://github.com/pytorch/pytorch/blob/main/SECURITY.md#untrusted-models for more details). In a future release, the default value for `weights_only` will be flipped to `True`. This limits the functions that could be executed during unpickling. Arbitrary objects will no longer be allowed to be loaded via this mode unless they are explicitly allowlisted by the user via `torch.serialization.add_safe_globals`. We recommend you start setting `weights_only=True` for any use case where you don't have full control of the loaded file. Please open an issue on GitHub for any issues related to this experimental feature.
  self.data, self.slices = torch.load(self.processed_paths[0])
