STDOUT:
Results will be saved in /home/philip/projects/ltspice_examples_code_repo/Circuit-Completion-Using-GNNs/component_classification_with_link_prediction_head/evaluation/FEGIN/results/model_FEGIN_dataset_ltspice_examples
Command line input: python main.py --data ltspice_examples --representation component_component --model FEGIN --layers 5 --hiddens 16 --batch_size 128 --lr 0.001 --emb_size 128 --epochs 100 --save_appendix component_component_L5_H16_BS128_LR0.001_E128 --no_val
 is saved.
-----
ltspice_examples - FEGIN
Using 5 layers, 16 hidden units, h = 2
Loading component_component representation dataset
Loading component_component representation data...
Loaded 4401 examples (component_component)
saving path: data/processed/ltspice_examples_component_component_processed.pt
ENTERED
Training FEGIN on component_component representation
Train: 3556, Test: 845
##################ITERATION #0 ****************************************
 epoch: 0, train_loss: 1.3935, test_loss: 1.3672, test_f1: 0.2220
 epoch: 1, train_loss: 1.3380, test_loss: 1.3257, test_f1: 0.2274
 epoch: 2, train_loss: 1.3094, test_loss: 1.3081, test_f1: 0.2274
 epoch: 3, train_loss: 1.2899, test_loss: 1.2889, test_f1: 0.2274
 epoch: 4, train_loss: 1.2746, test_loss: 1.2721, test_f1: 0.2274
 epoch: 5, train_loss: 1.2608, test_loss: 1.2544, test_f1: 0.2274
 epoch: 6, train_loss: 1.2498, test_loss: 1.2421, test_f1: 0.2274
 epoch: 7, train_loss: 1.2390, test_loss: 1.2274, test_f1: 0.2274
 epoch: 8, train_loss: 1.2326, test_loss: 1.2089, test_f1: 0.2274
 epoch: 9, train_loss: 1.2129, test_loss: 1.1967, test_f1: 0.2788
 epoch: 10, train_loss: 1.2066, test_loss: 1.1811, test_f1: 0.4056
 epoch: 11, train_loss: 1.1931, test_loss: 1.1674, test_f1: 0.4372
 epoch: 12, train_loss: 1.1779, test_loss: 1.1488, test_f1: 0.4408
 epoch: 13, train_loss: 1.1720, test_loss: 1.1384, test_f1: 0.4387
 epoch: 14, train_loss: 1.1726, test_loss: 1.1358, test_f1: 0.4331
 epoch: 15, train_loss: 1.1579, test_loss: 1.1172, test_f1: 0.4601
 epoch: 16, train_loss: 1.1479, test_loss: 1.1053, test_f1: 0.4658
 epoch: 17, train_loss: 1.1367, test_loss: 1.0992, test_f1: 0.4719
 epoch: 18, train_loss: 1.1257, test_loss: 1.0969, test_f1: 0.4542
 epoch: 19, train_loss: 1.1167, test_loss: 1.0840, test_f1: 0.4729
 epoch: 20, train_loss: 1.1178, test_loss: 1.0772, test_f1: 0.4722
 epoch: 21, train_loss: 1.1069, test_loss: 1.0699, test_f1: 0.4574
 epoch: 22, train_loss: 1.0979, test_loss: 1.0603, test_f1: 0.4614
 epoch: 23, train_loss: 1.0863, test_loss: 1.0658, test_f1: 0.4537
 epoch: 24, train_loss: 1.0697, test_loss: 1.0508, test_f1: 0.4695
 epoch: 25, train_loss: 1.0771, test_loss: 1.0478, test_f1: 0.4729
 epoch: 26, train_loss: 1.0563, test_loss: 1.0370, test_f1: 0.4628
 epoch: 27, train_loss: 1.0613, test_loss: 1.0232, test_f1: 0.4592
 epoch: 28, train_loss: 1.0566, test_loss: 1.0292, test_f1: 0.4664
 epoch: 29, train_loss: 1.0402, test_loss: 1.0203, test_f1: 0.4563
 epoch: 30, train_loss: 1.0389, test_loss: 1.0273, test_f1: 0.4658
 epoch: 31, train_loss: 1.0206, test_loss: 1.0047, test_f1: 0.4664
 epoch: 32, train_loss: 1.0042, test_loss: 1.0048, test_f1: 0.4776
 epoch: 33, train_loss: 1.0060, test_loss: 0.9886, test_f1: 0.4906
 epoch: 34, train_loss: 1.0141, test_loss: 1.0157, test_f1: 0.4735
 epoch: 35, train_loss: 0.9994, test_loss: 1.0049, test_f1: 0.4619
 epoch: 36, train_loss: 0.9894, test_loss: 0.9881, test_f1: 0.4951
 epoch: 37, train_loss: 0.9982, test_loss: 0.9884, test_f1: 0.4579
 epoch: 38, train_loss: 0.9952, test_loss: 0.9913, test_f1: 0.4936
 epoch: 39, train_loss: 0.9890, test_loss: 0.9884, test_f1: 0.4883
 epoch: 40, train_loss: 0.9797, test_loss: 1.0098, test_f1: 0.4889
 epoch: 41, train_loss: 0.9548, test_loss: 0.9833, test_f1: 0.5047
 epoch: 42, train_loss: 0.9684, test_loss: 0.9877, test_f1: 0.5074
 epoch: 43, train_loss: 0.9667, test_loss: 1.0040, test_f1: 0.4993
 epoch: 44, train_loss: 0.9653, test_loss: 1.0025, test_f1: 0.4741
 epoch: 45, train_loss: 0.9597, test_loss: 1.0148, test_f1: 0.4887
 epoch: 46, train_loss: 0.9452, test_loss: 1.0049, test_f1: 0.4831
 epoch: 47, train_loss: 0.9409, test_loss: 1.0065, test_f1: 0.5100
 epoch: 48, train_loss: 0.9563, test_loss: 0.9922, test_f1: 0.5074
 epoch: 49, train_loss: 0.9397, test_loss: 1.0201, test_f1: 0.5080
 epoch: 50, train_loss: 0.9447, test_loss: 1.0155, test_f1: 0.4978
 epoch: 51, train_loss: 0.9229, test_loss: 0.9956, test_f1: 0.5084
 epoch: 52, train_loss: 0.9205, test_loss: 1.0077, test_f1: 0.4965
 epoch: 53, train_loss: 0.9295, test_loss: 1.0287, test_f1: 0.4927
 epoch: 54, train_loss: 0.9151, test_loss: 1.0081, test_f1: 0.4929
 epoch: 55, train_loss: 0.9244, test_loss: 0.9857, test_f1: 0.5078
 epoch: 56, train_loss: 0.9113, test_loss: 1.0371, test_f1: 0.4912
 epoch: 57, train_loss: 0.9184, test_loss: 1.0117, test_f1: 0.4982
 epoch: 58, train_loss: 0.9168, test_loss: 0.9906, test_f1: 0.5041
 epoch: 59, train_loss: 0.8992, test_loss: 1.0162, test_f1: 0.5120
 epoch: 60, train_loss: 0.9100, test_loss: 1.0549, test_f1: 0.4670
 epoch: 61, train_loss: 0.9150, test_loss: 1.0288, test_f1: 0.4988
 epoch: 62, train_loss: 0.9067, test_loss: 1.0199, test_f1: 0.4940
 epoch: 63, train_loss: 0.9043, test_loss: 1.0577, test_f1: 0.5036
 epoch: 64, train_loss: 0.9101, test_loss: 1.0501, test_f1: 0.4756
 epoch: 65, train_loss: 0.8931, test_loss: 1.0457, test_f1: 0.4883
 epoch: 66, train_loss: 0.9025, test_loss: 1.0551, test_f1: 0.4801
 epoch: 67, train_loss: 0.8906, test_loss: 1.1135, test_f1: 0.4738
 epoch: 68, train_loss: 0.8923, test_loss: 1.0560, test_f1: 0.4692
 epoch: 69, train_loss: 0.8963, test_loss: 1.0901, test_f1: 0.4866
 epoch: 70, train_loss: 0.8842, test_loss: 1.0409, test_f1: 0.4940
 epoch: 71, train_loss: 0.8878, test_loss: 1.0657, test_f1: 0.4793
 epoch: 72, train_loss: 0.9042, test_loss: 1.0497, test_f1: 0.4829
 epoch: 73, train_loss: 0.8975, test_loss: 1.1090, test_f1: 0.4589
 epoch: 74, train_loss: 0.8865, test_loss: 1.0580, test_f1: 0.4843
 epoch: 75, train_loss: 0.8860, test_loss: 1.0444, test_f1: 0.4819
 epoch: 76, train_loss: 0.8879, test_loss: 1.0341, test_f1: 0.5148
 epoch: 77, train_loss: 0.8885, test_loss: 1.0279, test_f1: 0.5081
 epoch: 78, train_loss: 0.8934, test_loss: 1.0655, test_f1: 0.4909
 epoch: 79, train_loss: 0.8865, test_loss: 1.0467, test_f1: 0.4870
 epoch: 80, train_loss: 0.8803, test_loss: 1.0683, test_f1: 0.4838
 epoch: 81, train_loss: 0.8843, test_loss: 1.0880, test_f1: 0.4758
 epoch: 82, train_loss: 0.8873, test_loss: 1.1422, test_f1: 0.4888
 epoch: 83, train_loss: 0.8898, test_loss: 1.0998, test_f1: 0.4724
 epoch: 84, train_loss: 0.8650, test_loss: 1.1178, test_f1: 0.4703
 epoch: 85, train_loss: 0.8720, test_loss: 1.0619, test_f1: 0.4774
 epoch: 86, train_loss: 0.8774, test_loss: 1.0409, test_f1: 0.4854
 epoch: 87, train_loss: 0.8743, test_loss: 1.0573, test_f1: 0.4798
 epoch: 88, train_loss: 0.8771, test_loss: 1.0787, test_f1: 0.4765
 epoch: 89, train_loss: 0.8769, test_loss: 1.0874, test_f1: 0.4729
 epoch: 90, train_loss: 0.8773, test_loss: 1.0692, test_f1: 0.4931
 epoch: 91, train_loss: 0.8717, test_loss: 1.1268, test_f1: 0.4764
 epoch: 92, train_loss: 0.8624, test_loss: 1.0760, test_f1: 0.4667
 epoch: 93, train_loss: 0.8599, test_loss: 1.1015, test_f1: 0.4804
 epoch: 94, train_loss: 0.8653, test_loss: 1.0995, test_f1: 0.4855
 epoch: 95, train_loss: 0.8667, test_loss: 1.1412, test_f1: 0.4737
 epoch: 96, train_loss: 0.8704, test_loss: 1.0271, test_f1: 0.5247
 epoch: 97, train_loss: 0.8616, test_loss: 1.0701, test_f1: 0.4903
 epoch: 98, train_loss: 0.8661, test_loss: 1.0860, test_f1: 0.4743
 epoch: 99, train_loss: 0.8675, test_loss: 1.0863, test_f1: 0.4753
##################ITERATION #1 ****************************************
 epoch: 0, train_loss: 1.3312, test_loss: 1.3074, test_f1: 0.2274
 epoch: 1, train_loss: 1.2835, test_loss: 1.2832, test_f1: 0.2274
 epoch: 2, train_loss: 1.2676, test_loss: 1.2536, test_f1: 0.2399
 epoch: 3, train_loss: 1.2514, test_loss: 1.2346, test_f1: 0.2589
 epoch: 4, train_loss: 1.2458, test_loss: 1.2221, test_f1: 0.2694
 epoch: 5, train_loss: 1.2298, test_loss: 1.2100, test_f1: 0.2755
 epoch: 6, train_loss: 1.2225, test_loss: 1.1925, test_f1: 0.3560
 epoch: 7, train_loss: 1.2129, test_loss: 1.1791, test_f1: 0.3532
 epoch: 8, train_loss: 1.2067, test_loss: 1.1686, test_f1: 0.3823
 epoch: 9, train_loss: 1.1958, test_loss: 1.1613, test_f1: 0.4065
 epoch: 10, train_loss: 1.1886, test_loss: 1.1456, test_f1: 0.4118
 epoch: 11, train_loss: 1.1737, test_loss: 1.1340, test_f1: 0.3950
 epoch: 12, train_loss: 1.1651, test_loss: 1.1166, test_f1: 0.4182
 epoch: 13, train_loss: 1.1625, test_loss: 1.1113, test_f1: 0.4089
 epoch: 14, train_loss: 1.1609, test_loss: 1.1326, test_f1: 0.4042
 epoch: 15, train_loss: 1.1455, test_loss: 1.1197, test_f1: 0.4082
 epoch: 16, train_loss: 1.1410, test_loss: 1.0869, test_f1: 0.4288
 epoch: 17, train_loss: 1.1376, test_loss: 1.0967, test_f1: 0.4281
 epoch: 18, train_loss: 1.1329, test_loss: 1.0844, test_f1: 0.4258
 epoch: 19, train_loss: 1.1255, test_loss: 1.1037, test_f1: 0.4093
 epoch: 20, train_loss: 1.1202, test_loss: 1.1198, test_f1: 0.4099
 epoch: 21, train_loss: 1.1058, test_loss: 1.0871, test_f1: 0.4296
 epoch: 22, train_loss: 1.0957, test_loss: 1.0804, test_f1: 0.4276
 epoch: 23, train_loss: 1.1028, test_loss: 1.0836, test_f1: 0.4385
 epoch: 24, train_loss: 1.1064, test_loss: 1.0737, test_f1: 0.4274
 epoch: 25, train_loss: 1.0944, test_loss: 1.0815, test_f1: 0.4288
 epoch: 26, train_loss: 1.0833, test_loss: 1.0705, test_f1: 0.4266
 epoch: 27, train_loss: 1.0767, test_loss: 1.0700, test_f1: 0.4406
 epoch: 28, train_loss: 1.0757, test_loss: 1.0703, test_f1: 0.4300
 epoch: 29, train_loss: 1.0782, test_loss: 1.0887, test_f1: 0.4289
 epoch: 30, train_loss: 1.0773, test_loss: 1.0600, test_f1: 0.4388
 epoch: 31, train_loss: 1.0768, test_loss: 1.0540, test_f1: 0.4392
 epoch: 32, train_loss: 1.0740, test_loss: 1.0666, test_f1: 0.4320
 epoch: 33, train_loss: 1.0673, test_loss: 1.0602, test_f1: 0.4098
 epoch: 34, train_loss: 1.0638, test_loss: 1.0319, test_f1: 0.4368
 epoch: 35, train_loss: 1.0561, test_loss: 1.0383, test_f1: 0.4286
 epoch: 36, train_loss: 1.0562, test_loss: 1.1464, test_f1: 0.4201
 epoch: 37, train_loss: 1.0602, test_loss: 1.0326, test_f1: 0.4333
 epoch: 38, train_loss: 1.0378, test_loss: 1.0434, test_f1: 0.4232
 epoch: 39, train_loss: 1.0403, test_loss: 1.0231, test_f1: 0.4663
 epoch: 40, train_loss: 1.0404, test_loss: 1.0292, test_f1: 0.4336
 epoch: 41, train_loss: 1.0362, test_loss: 1.0394, test_f1: 0.4406
 epoch: 42, train_loss: 1.0342, test_loss: 1.0340, test_f1: 0.4344
 epoch: 43, train_loss: 1.0334, test_loss: 1.0152, test_f1: 0.4547
 epoch: 44, train_loss: 1.0160, test_loss: 1.0262, test_f1: 0.4441
 epoch: 45, train_loss: 1.0141, test_loss: 1.0126, test_f1: 0.4698
 epoch: 46, train_loss: 1.0208, test_loss: 1.0171, test_f1: 0.4575
 epoch: 47, train_loss: 1.0131, test_loss: 1.0386, test_f1: 0.4231
 epoch: 48, train_loss: 1.0183, test_loss: 1.0180, test_f1: 0.4584
 epoch: 49, train_loss: 1.0172, test_loss: 1.0014, test_f1: 0.4680
 epoch: 50, train_loss: 1.0074, test_loss: 1.0087, test_f1: 0.4656
 epoch: 51, train_loss: 1.0024, test_loss: 1.0077, test_f1: 0.4682
 epoch: 52, train_loss: 0.9978, test_loss: 0.9998, test_f1: 0.4712
 epoch: 53, train_loss: 0.9901, test_loss: 0.9917, test_f1: 0.4730
 epoch: 54, train_loss: 0.9960, test_loss: 0.9980, test_f1: 0.4538
 epoch: 55, train_loss: 0.9913, test_loss: 0.9950, test_f1: 0.4636
 epoch: 56, train_loss: 0.9853, test_loss: 0.9931, test_f1: 0.4640
 epoch: 57, train_loss: 0.9914, test_loss: 0.9884, test_f1: 0.4818
 epoch: 58, train_loss: 0.9798, test_loss: 0.9942, test_f1: 0.4639
 epoch: 59, train_loss: 0.9842, test_loss: 0.9834, test_f1: 0.4739
 epoch: 60, train_loss: 0.9803, test_loss: 1.0017, test_f1: 0.4668
 epoch: 61, train_loss: 0.9910, test_loss: 1.0153, test_f1: 0.4607
 epoch: 62, train_loss: 0.9805, test_loss: 0.9967, test_f1: 0.4632
 epoch: 63, train_loss: 0.9739, test_loss: 0.9945, test_f1: 0.4706
 epoch: 64, train_loss: 0.9710, test_loss: 1.0050, test_f1: 0.4589
 epoch: 65, train_loss: 0.9764, test_loss: 1.0198, test_f1: 0.4510
 epoch: 66, train_loss: 0.9748, test_loss: 1.0271, test_f1: 0.4470
 epoch: 67, train_loss: 0.9713, test_loss: 1.0177, test_f1: 0.4627
 epoch: 68, train_loss: 0.9687, test_loss: 1.0182, test_f1: 0.4562
 epoch: 69, train_loss: 0.9775, test_loss: 0.9994, test_f1: 0.4622
 epoch: 70, train_loss: 0.9669, test_loss: 1.0194, test_f1: 0.4558
 epoch: 71, train_loss: 0.9636, test_loss: 0.9850, test_f1: 0.4745
 epoch: 72, train_loss: 0.9667, test_loss: 1.0158, test_f1: 0.4554
 epoch: 73, train_loss: 0.9631, test_loss: 0.9964, test_f1: 0.4796
 epoch: 74, train_loss: 0.9645, test_loss: 1.0047, test_f1: 0.4808
 epoch: 75, train_loss: 0.9596, test_loss: 1.0126, test_f1: 0.4651
 epoch: 76, train_loss: 0.9680, test_loss: 0.9830, test_f1: 0.4706
 epoch: 77, train_loss: 0.9611, test_loss: 0.9869, test_f1: 0.4876
 epoch: 78, train_loss: 0.9630, test_loss: 1.0158, test_f1: 0.4634
 epoch: 79, train_loss: 0.9569, test_loss: 0.9948, test_f1: 0.4686
 epoch: 80, train_loss: 0.9498, test_loss: 1.0106, test_f1: 0.4703
 epoch: 81, train_loss: 0.9685, test_loss: 1.0113, test_f1: 0.4702
 epoch: 82, train_loss: 0.9558, test_loss: 1.0061, test_f1: 0.4695
 epoch: 83, train_loss: 0.9479, test_loss: 1.0033, test_f1: 0.4514
 epoch: 84, train_loss: 0.9570, test_loss: 0.9956, test_f1: 0.4728
 epoch: 85, train_loss: 0.9513, test_loss: 1.0153, test_f1: 0.4725
 epoch: 86, train_loss: 0.9452, test_loss: 1.0096, test_f1: 0.4675
 epoch: 87, train_loss: 0.9538, test_loss: 1.0209, test_f1: 0.4526
 epoch: 88, train_loss: 0.9524, test_loss: 1.0178, test_f1: 0.4392
 epoch: 89, train_loss: 0.9426, test_loss: 1.0406, test_f1: 0.4522
 epoch: 90, train_loss: 0.9505, test_loss: 0.9854, test_f1: 0.4881
 epoch: 91, train_loss: 0.9495, test_loss: 0.9930, test_f1: 0.4842
 epoch: 92, train_loss: 0.9534, test_loss: 1.0012, test_f1: 0.4777
 epoch: 93, train_loss: 0.9417, test_loss: 1.0256, test_f1: 0.4452
 epoch: 94, train_loss: 0.9525, test_loss: 1.0318, test_f1: 0.4624
 epoch: 95, train_loss: 0.9458, test_loss: 1.0257, test_f1: 0.4668
 epoch: 96, train_loss: 0.9373, test_loss: 0.9971, test_f1: 0.4897
 epoch: 97, train_loss: 0.9395, test_loss: 1.0301, test_f1: 0.4471
 epoch: 98, train_loss: 0.9473, test_loss: 1.0227, test_f1: 0.4632
 epoch: 99, train_loss: 0.9378, test_loss: 1.0162, test_f1: 0.4745
##################ITERATION #2 ****************************************
 epoch: 0, train_loss: 1.3632, test_loss: 1.2957, test_f1: 0.2274
 epoch: 1, train_loss: 1.2773, test_loss: 1.2531, test_f1: 0.2555
 epoch: 2, train_loss: 1.2535, test_loss: 1.2260, test_f1: 0.2557
 epoch: 3, train_loss: 1.2430, test_loss: 1.2176, test_f1: 0.2558
 epoch: 4, train_loss: 1.2385, test_loss: 1.2192, test_f1: 0.2557
 epoch: 5, train_loss: 1.2309, test_loss: 1.2222, test_f1: 0.2546
 epoch: 6, train_loss: 1.2239, test_loss: 1.2115, test_f1: 0.2835
 epoch: 7, train_loss: 1.2157, test_loss: 1.2100, test_f1: 0.2936
 epoch: 8, train_loss: 1.2116, test_loss: 1.2078, test_f1: 0.3128
 epoch: 9, train_loss: 1.2008, test_loss: 1.2047, test_f1: 0.3344
 epoch: 10, train_loss: 1.1954, test_loss: 1.1945, test_f1: 0.3615
 epoch: 11, train_loss: 1.1883, test_loss: 1.2043, test_f1: 0.3565
 epoch: 12, train_loss: 1.1823, test_loss: 1.1877, test_f1: 0.3702
 epoch: 13, train_loss: 1.1767, test_loss: 1.1867, test_f1: 0.3866
 epoch: 14, train_loss: 1.1610, test_loss: 1.1736, test_f1: 0.3928
 epoch: 15, train_loss: 1.1597, test_loss: 1.1640, test_f1: 0.4071
 epoch: 16, train_loss: 1.1469, test_loss: 1.1813, test_f1: 0.3865
 epoch: 17, train_loss: 1.1338, test_loss: 1.1676, test_f1: 0.3924
 epoch: 18, train_loss: 1.1314, test_loss: 1.1815, test_f1: 0.3846
 epoch: 19, train_loss: 1.1268, test_loss: 1.1560, test_f1: 0.4253
 epoch: 20, train_loss: 1.1310, test_loss: 1.1443, test_f1: 0.4289
 epoch: 21, train_loss: 1.1182, test_loss: 1.1238, test_f1: 0.4220
 epoch: 22, train_loss: 1.0952, test_loss: 1.1164, test_f1: 0.4288
 epoch: 23, train_loss: 1.0988, test_loss: 1.1374, test_f1: 0.4207
 epoch: 24, train_loss: 1.0948, test_loss: 1.1481, test_f1: 0.4071
 epoch: 25, train_loss: 1.0961, test_loss: 1.1294, test_f1: 0.4444
 epoch: 26, train_loss: 1.0806, test_loss: 1.1173, test_f1: 0.4249
 epoch: 27, train_loss: 1.0816, test_loss: 1.1173, test_f1: 0.4383
 epoch: 28, train_loss: 1.0741, test_loss: 1.0956, test_f1: 0.4286
 epoch: 29, train_loss: 1.0651, test_loss: 1.0951, test_f1: 0.4199
 epoch: 30, train_loss: 1.0589, test_loss: 1.0913, test_f1: 0.4422
 epoch: 31, train_loss: 1.0630, test_loss: 1.0856, test_f1: 0.4293
 epoch: 32, train_loss: 1.0608, test_loss: 1.0912, test_f1: 0.4240
 epoch: 33, train_loss: 1.0609, test_loss: 1.0904, test_f1: 0.4278
 epoch: 34, train_loss: 1.0489, test_loss: 1.0803, test_f1: 0.4494
 epoch: 35, train_loss: 1.0388, test_loss: 1.0753, test_f1: 0.4596
 epoch: 36, train_loss: 1.0349, test_loss: 1.0554, test_f1: 0.4444
 epoch: 37, train_loss: 1.0448, test_loss: 1.0526, test_f1: 0.4481
 epoch: 38, train_loss: 1.0355, test_loss: 1.0607, test_f1: 0.4432
 epoch: 39, train_loss: 1.0370, test_loss: 1.0523, test_f1: 0.4608
 epoch: 40, train_loss: 1.0376, test_loss: 1.0593, test_f1: 0.4505
 epoch: 41, train_loss: 1.0231, test_loss: 1.0794, test_f1: 0.4485
 epoch: 42, train_loss: 1.0114, test_loss: 1.0541, test_f1: 0.4660
 epoch: 43, train_loss: 1.0256, test_loss: 1.0546, test_f1: 0.4587
 epoch: 44, train_loss: 1.0126, test_loss: 1.0820, test_f1: 0.4363
 epoch: 45, train_loss: 1.0211, test_loss: 1.0370, test_f1: 0.4532
 epoch: 46, train_loss: 1.0034, test_loss: 1.0456, test_f1: 0.4444
 epoch: 47, train_loss: 1.0076, test_loss: 1.0553, test_f1: 0.4413
 epoch: 48, train_loss: 1.0158, test_loss: 1.0284, test_f1: 0.4757
 epoch: 49, train_loss: 1.0019, test_loss: 1.0441, test_f1: 0.4510
 epoch: 50, train_loss: 1.0020, test_loss: 1.0477, test_f1: 0.4722
 epoch: 51, train_loss: 0.9952, test_loss: 1.0349, test_f1: 0.4551
 epoch: 52, train_loss: 0.9839, test_loss: 1.0287, test_f1: 0.4616
 epoch: 53, train_loss: 0.9711, test_loss: 1.0222, test_f1: 0.4614
 epoch: 54, train_loss: 0.9854, test_loss: 1.0296, test_f1: 0.4563
 epoch: 55, train_loss: 0.9796, test_loss: 1.0418, test_f1: 0.4548
 epoch: 56, train_loss: 0.9766, test_loss: 1.0352, test_f1: 0.4668
 epoch: 57, train_loss: 0.9763, test_loss: 1.0329, test_f1: 0.4657
 epoch: 58, train_loss: 0.9792, test_loss: 1.0198, test_f1: 0.4629
 epoch: 59, train_loss: 0.9746, test_loss: 1.0222, test_f1: 0.4631
 epoch: 60, train_loss: 0.9627, test_loss: 1.0231, test_f1: 0.4566
 epoch: 61, train_loss: 0.9697, test_loss: 1.0181, test_f1: 0.4731
 epoch: 62, train_loss: 0.9593, test_loss: 1.0283, test_f1: 0.4597
 epoch: 63, train_loss: 0.9715, test_loss: 1.0191, test_f1: 0.4677
 epoch: 64, train_loss: 0.9579, test_loss: 1.0199, test_f1: 0.4649
 epoch: 65, train_loss: 0.9489, test_loss: 1.0364, test_f1: 0.4584
 epoch: 66, train_loss: 0.9449, test_loss: 1.0327, test_f1: 0.4599
 epoch: 67, train_loss: 0.9510, test_loss: 1.0398, test_f1: 0.4645
 epoch: 68, train_loss: 0.9530, test_loss: 1.0506, test_f1: 0.4564
 epoch: 69, train_loss: 0.9516, test_loss: 1.0455, test_f1: 0.4576
 epoch: 70, train_loss: 0.9607, test_loss: 1.0123, test_f1: 0.4736
 epoch: 71, train_loss: 0.9681, test_loss: 1.0235, test_f1: 0.4747
 epoch: 72, train_loss: 0.9494, test_loss: 1.0452, test_f1: 0.4641
 epoch: 73, train_loss: 0.9411, test_loss: 1.0542, test_f1: 0.4645
 epoch: 74, train_loss: 0.9530, test_loss: 1.0380, test_f1: 0.5016
 epoch: 75, train_loss: 0.9525, test_loss: 1.0462, test_f1: 0.4779
 epoch: 76, train_loss: 0.9382, test_loss: 1.0324, test_f1: 0.4819
 epoch: 77, train_loss: 0.9426, test_loss: 1.0309, test_f1: 0.4713
 epoch: 78, train_loss: 0.9357, test_loss: 1.0408, test_f1: 0.4515
 epoch: 79, train_loss: 0.9384, test_loss: 1.0345, test_f1: 0.4673
 epoch: 80, train_loss: 0.9336, test_loss: 1.0257, test_f1: 0.4728
 epoch: 81, train_loss: 0.9393, test_loss: 1.0565, test_f1: 0.4659
 epoch: 82, train_loss: 0.9404, test_loss: 1.0260, test_f1: 0.4842
 epoch: 83, train_loss: 0.9439, test_loss: 1.0382, test_f1: 0.4640
 epoch: 84, train_loss: 0.9317, test_loss: 0.9992, test_f1: 0.4853
 epoch: 85, train_loss: 0.9423, test_loss: 1.0236, test_f1: 0.4772
 epoch: 86, train_loss: 0.9340, test_loss: 1.0196, test_f1: 0.4812
 epoch: 87, train_loss: 0.9205, test_loss: 1.0271, test_f1: 0.4759
 epoch: 88, train_loss: 0.9437, test_loss: 1.0372, test_f1: 0.4914
 epoch: 89, train_loss: 0.9224, test_loss: 1.0164, test_f1: 0.4820
 epoch: 90, train_loss: 0.9198, test_loss: 1.0386, test_f1: 0.4731
 epoch: 91, train_loss: 0.9278, test_loss: 1.0463, test_f1: 0.4768
 epoch: 92, train_loss: 0.9278, test_loss: 1.0604, test_f1: 0.4662
 epoch: 93, train_loss: 0.9170, test_loss: 1.0294, test_f1: 0.4863
 epoch: 94, train_loss: 0.9123, test_loss: 1.0688, test_f1: 0.4706
 epoch: 95, train_loss: 0.9096, test_loss: 1.0435, test_f1: 0.4787
 epoch: 96, train_loss: 0.9178, test_loss: 1.0378, test_f1: 0.4756
 epoch: 97, train_loss: 0.9164, test_loss: 1.0371, test_f1: 0.4879
 epoch: 98, train_loss: 0.9068, test_loss: 1.0627, test_f1: 0.4769
 epoch: 99, train_loss: 0.9135, test_loss: 1.0667, test_f1: 0.4911
##################ITERATION #3 ****************************************
 epoch: 0, train_loss: 1.4721, test_loss: 1.2916, test_f1: 0.2278
 epoch: 1, train_loss: 1.2941, test_loss: 1.2743, test_f1: 0.2557
 epoch: 2, train_loss: 1.2643, test_loss: 1.2500, test_f1: 0.2440
 epoch: 3, train_loss: 1.2547, test_loss: 1.2321, test_f1: 0.2672
 epoch: 4, train_loss: 1.2503, test_loss: 1.2250, test_f1: 0.2821
 epoch: 5, train_loss: 1.2388, test_loss: 1.2096, test_f1: 0.2982
 epoch: 6, train_loss: 1.2332, test_loss: 1.2001, test_f1: 0.3090
 epoch: 7, train_loss: 1.2193, test_loss: 1.1932, test_f1: 0.3227
 epoch: 8, train_loss: 1.2144, test_loss: 1.1803, test_f1: 0.3151
 epoch: 9, train_loss: 1.2106, test_loss: 1.1679, test_f1: 0.3455
 epoch: 10, train_loss: 1.1936, test_loss: 1.1599, test_f1: 0.3493
 epoch: 11, train_loss: 1.1883, test_loss: 1.1573, test_f1: 0.3666
 epoch: 12, train_loss: 1.1880, test_loss: 1.1398, test_f1: 0.3686
 epoch: 13, train_loss: 1.1720, test_loss: 1.1231, test_f1: 0.3839
 epoch: 14, train_loss: 1.1699, test_loss: 1.1233, test_f1: 0.3837
 epoch: 15, train_loss: 1.1744, test_loss: 1.1208, test_f1: 0.4125
 epoch: 16, train_loss: 1.1650, test_loss: 1.1165, test_f1: 0.4143
 epoch: 17, train_loss: 1.1559, test_loss: 1.0999, test_f1: 0.4343
 epoch: 18, train_loss: 1.1452, test_loss: 1.0894, test_f1: 0.4109
 epoch: 19, train_loss: 1.1434, test_loss: 1.0886, test_f1: 0.4129
 epoch: 20, train_loss: 1.1246, test_loss: 1.0948, test_f1: 0.4079
 epoch: 21, train_loss: 1.1204, test_loss: 1.0899, test_f1: 0.4279
 epoch: 22, train_loss: 1.1139, test_loss: 1.0563, test_f1: 0.4470
 epoch: 23, train_loss: 1.1071, test_loss: 1.0410, test_f1: 0.4469
 epoch: 24, train_loss: 1.0993, test_loss: 1.0463, test_f1: 0.4308
 epoch: 25, train_loss: 1.0824, test_loss: 1.0655, test_f1: 0.4251
 epoch: 26, train_loss: 1.0983, test_loss: 1.0479, test_f1: 0.4331
 epoch: 27, train_loss: 1.0805, test_loss: 1.0453, test_f1: 0.4457
 epoch: 28, train_loss: 1.0824, test_loss: 1.0320, test_f1: 0.4373
 epoch: 29, train_loss: 1.0650, test_loss: 1.0550, test_f1: 0.4376
 epoch: 30, train_loss: 1.0536, test_loss: 1.0490, test_f1: 0.4471
 epoch: 31, train_loss: 1.0440, test_loss: 1.0376, test_f1: 0.4419
 epoch: 32, train_loss: 1.0507, test_loss: 1.0364, test_f1: 0.4336
 epoch: 33, train_loss: 1.0384, test_loss: 1.0415, test_f1: 0.4492
 epoch: 34, train_loss: 1.0446, test_loss: 1.0405, test_f1: 0.4327
 epoch: 35, train_loss: 1.0301, test_loss: 1.0047, test_f1: 0.4587
 epoch: 36, train_loss: 1.0348, test_loss: 1.0334, test_f1: 0.4554
 epoch: 37, train_loss: 1.0184, test_loss: 1.0163, test_f1: 0.4616
 epoch: 38, train_loss: 1.0297, test_loss: 1.0078, test_f1: 0.4610
 epoch: 39, train_loss: 1.0221, test_loss: 1.0025, test_f1: 0.4590
 epoch: 40, train_loss: 1.0113, test_loss: 1.0089, test_f1: 0.4640
 epoch: 41, train_loss: 1.0192, test_loss: 1.0144, test_f1: 0.4644
 epoch: 42, train_loss: 1.0133, test_loss: 1.0033, test_f1: 0.4639
 epoch: 43, train_loss: 0.9996, test_loss: 1.0451, test_f1: 0.4514
 epoch: 44, train_loss: 1.0039, test_loss: 0.9784, test_f1: 0.4807
 epoch: 45, train_loss: 0.9863, test_loss: 1.0221, test_f1: 0.4673
 epoch: 46, train_loss: 0.9834, test_loss: 1.0026, test_f1: 0.4713
 epoch: 47, train_loss: 0.9771, test_loss: 0.9972, test_f1: 0.4813
 epoch: 48, train_loss: 0.9960, test_loss: 1.0020, test_f1: 0.4833
 epoch: 49, train_loss: 0.9766, test_loss: 1.0013, test_f1: 0.4883
 epoch: 50, train_loss: 0.9624, test_loss: 1.0342, test_f1: 0.4674
 epoch: 51, train_loss: 0.9731, test_loss: 1.0008, test_f1: 0.4720
 epoch: 52, train_loss: 0.9539, test_loss: 1.0180, test_f1: 0.4808
 epoch: 53, train_loss: 0.9660, test_loss: 1.0346, test_f1: 0.4938
 epoch: 54, train_loss: 0.9505, test_loss: 1.0418, test_f1: 0.4714
 epoch: 55, train_loss: 0.9475, test_loss: 1.0454, test_f1: 0.4778
 epoch: 56, train_loss: 0.9482, test_loss: 1.0311, test_f1: 0.4710
 epoch: 57, train_loss: 0.9445, test_loss: 1.0182, test_f1: 0.4705
 epoch: 58, train_loss: 0.9388, test_loss: 1.0419, test_f1: 0.4501
 epoch: 59, train_loss: 0.9456, test_loss: 1.0999, test_f1: 0.4481
 epoch: 60, train_loss: 0.9411, test_loss: 1.0386, test_f1: 0.4839
 epoch: 61, train_loss: 0.9416, test_loss: 1.0297, test_f1: 0.4816
 epoch: 62, train_loss: 0.9393, test_loss: 1.0522, test_f1: 0.4534
 epoch: 63, train_loss: 0.9460, test_loss: 1.0468, test_f1: 0.4758
 epoch: 64, train_loss: 0.9364, test_loss: 1.0454, test_f1: 0.4567
 epoch: 65, train_loss: 0.9352, test_loss: 1.0883, test_f1: 0.4667
 epoch: 66, train_loss: 0.9292, test_loss: 1.0534, test_f1: 0.4616
 epoch: 67, train_loss: 0.9370, test_loss: 1.0463, test_f1: 0.4538
 epoch: 68, train_loss: 0.9354, test_loss: 1.1077, test_f1: 0.4677
 epoch: 69, train_loss: 0.9371, test_loss: 1.1075, test_f1: 0.4540
 epoch: 70, train_loss: 0.9239, test_loss: 1.0272, test_f1: 0.4701
 epoch: 71, train_loss: 0.9241, test_loss: 1.0635, test_f1: 0.4615
 epoch: 72, train_loss: 0.9249, test_loss: 1.0480, test_f1: 0.4571
 epoch: 73, train_loss: 0.9317, test_loss: 1.0601, test_f1: 0.4594
 epoch: 74, train_loss: 0.9251, test_loss: 1.0431, test_f1: 0.4582
 epoch: 75, train_loss: 0.9259, test_loss: 1.0592, test_f1: 0.4671
 epoch: 76, train_loss: 0.9243, test_loss: 1.1932, test_f1: 0.4598
 epoch: 77, train_loss: 0.9102, test_loss: 1.0890, test_f1: 0.4552
 epoch: 78, train_loss: 0.9087, test_loss: 1.1392, test_f1: 0.4546
 epoch: 79, train_loss: 0.9306, test_loss: 1.3283, test_f1: 0.4372
 epoch: 80, train_loss: 0.9271, test_loss: 1.1401, test_f1: 0.4529
 epoch: 81, train_loss: 0.9206, test_loss: 1.0986, test_f1: 0.4522
 epoch: 82, train_loss: 0.9159, test_loss: 1.0883, test_f1: 0.4670
 epoch: 83, train_loss: 0.9214, test_loss: 1.2093, test_f1: 0.4599
 epoch: 84, train_loss: 0.9150, test_loss: 1.1325, test_f1: 0.4763
 epoch: 85, train_loss: 0.9192, test_loss: 1.1554, test_f1: 0.4673
 epoch: 86, train_loss: 0.9165, test_loss: 1.0399, test_f1: 0.4849
 epoch: 87, train_loss: 0.9095, test_loss: 1.0963, test_f1: 0.4570
 epoch: 88, train_loss: 0.9004, test_loss: 1.1040, test_f1: 0.4644
 epoch: 89, train_loss: 0.9203, test_loss: 1.0530, test_f1: 0.5017
 epoch: 90, train_loss: 0.9057, test_loss: 1.1328, test_f1: 0.4574
 epoch: 91, train_loss: 0.9137, test_loss: 1.0752, test_f1: 0.4620
 epoch: 92, train_loss: 0.8904, test_loss: 1.1526, test_f1: 0.4624
 epoch: 93, train_loss: 0.8934, test_loss: 1.1224, test_f1: 0.4673
 epoch: 94, train_loss: 0.9007, test_loss: 1.0768, test_f1: 0.4641
 epoch: 95, train_loss: 0.9030, test_loss: 1.0371, test_f1: 0.4987
 epoch: 96, train_loss: 0.8909, test_loss: 1.0963, test_f1: 0.4717
 epoch: 97, train_loss: 0.9032, test_loss: 1.0250, test_f1: 0.4729
 epoch: 98, train_loss: 0.8988, test_loss: 1.1251, test_f1: 0.4835
 epoch: 99, train_loss: 0.8850, test_loss: 1.2012, test_f1: 0.4725
##################ITERATION #4 ****************************************
 epoch: 0, train_loss: 1.3272, test_loss: 1.2621, test_f1: 0.2274
 epoch: 1, train_loss: 1.2553, test_loss: 1.2128, test_f1: 0.2771
 epoch: 2, train_loss: 1.2409, test_loss: 1.1791, test_f1: 0.3249
 epoch: 3, train_loss: 1.2088, test_loss: 1.1699, test_f1: 0.3528
 epoch: 4, train_loss: 1.1940, test_loss: 1.1507, test_f1: 0.3742
 epoch: 5, train_loss: 1.1777, test_loss: 1.1317, test_f1: 0.3833
 epoch: 6, train_loss: 1.1839, test_loss: 1.1266, test_f1: 0.3947
 epoch: 7, train_loss: 1.1504, test_loss: 1.1077, test_f1: 0.4135
 epoch: 8, train_loss: 1.1500, test_loss: 1.0953, test_f1: 0.4016
 epoch: 9, train_loss: 1.1315, test_loss: 1.0882, test_f1: 0.4271
 epoch: 10, train_loss: 1.1273, test_loss: 1.0852, test_f1: 0.4138
 epoch: 11, train_loss: 1.1259, test_loss: 1.0751, test_f1: 0.4191
 epoch: 12, train_loss: 1.1161, test_loss: 1.0662, test_f1: 0.4246
 epoch: 13, train_loss: 1.1006, test_loss: 1.0594, test_f1: 0.4297
 epoch: 14, train_loss: 1.0981, test_loss: 1.0481, test_f1: 0.4299
 epoch: 15, train_loss: 1.0883, test_loss: 1.0366, test_f1: 0.4430
 epoch: 16, train_loss: 1.0845, test_loss: 1.0291, test_f1: 0.4402
 epoch: 17, train_loss: 1.0682, test_loss: 1.0233, test_f1: 0.4531
 epoch: 18, train_loss: 1.0553, test_loss: 1.0076, test_f1: 0.4705
 epoch: 19, train_loss: 1.0519, test_loss: 1.0003, test_f1: 0.4452
 epoch: 20, train_loss: 1.0374, test_loss: 1.0077, test_f1: 0.4538
 epoch: 21, train_loss: 1.0392, test_loss: 1.0065, test_f1: 0.4498
 epoch: 22, train_loss: 1.0338, test_loss: 1.0017, test_f1: 0.4569
 epoch: 23, train_loss: 1.0172, test_loss: 0.9914, test_f1: 0.4525
 epoch: 24, train_loss: 1.0318, test_loss: 0.9963, test_f1: 0.4715
 epoch: 25, train_loss: 1.0164, test_loss: 0.9712, test_f1: 0.4574
 epoch: 26, train_loss: 1.0196, test_loss: 0.9613, test_f1: 0.4748
 epoch: 27, train_loss: 1.0006, test_loss: 0.9610, test_f1: 0.4729
 epoch: 28, train_loss: 1.0109, test_loss: 0.9692, test_f1: 0.4811
 epoch: 29, train_loss: 1.0042, test_loss: 0.9679, test_f1: 0.4670
 epoch: 30, train_loss: 0.9905, test_loss: 0.9744, test_f1: 0.4623
 epoch: 31, train_loss: 0.9847, test_loss: 0.9814, test_f1: 0.4611
 epoch: 32, train_loss: 0.9817, test_loss: 0.9661, test_f1: 0.4673
 epoch: 33, train_loss: 0.9759, test_loss: 0.9428, test_f1: 0.4774
 epoch: 34, train_loss: 0.9748, test_loss: 0.9804, test_f1: 0.4779
 epoch: 35, train_loss: 0.9794, test_loss: 0.9661, test_f1: 0.4729
 epoch: 36, train_loss: 0.9615, test_loss: 0.9627, test_f1: 0.4888
 epoch: 37, train_loss: 0.9762, test_loss: 0.9506, test_f1: 0.4881
 epoch: 38, train_loss: 0.9700, test_loss: 0.9600, test_f1: 0.4942
 epoch: 39, train_loss: 0.9570, test_loss: 1.0236, test_f1: 0.4559
 epoch: 40, train_loss: 0.9495, test_loss: 0.9419, test_f1: 0.4918
 epoch: 41, train_loss: 0.9438, test_loss: 0.9519, test_f1: 0.4906
 epoch: 42, train_loss: 0.9338, test_loss: 0.9857, test_f1: 0.4859
 epoch: 43, train_loss: 0.9476, test_loss: 0.9505, test_f1: 0.4992
 epoch: 44, train_loss: 0.9379, test_loss: 0.9748, test_f1: 0.4770
 epoch: 45, train_loss: 0.9357, test_loss: 0.9375, test_f1: 0.4863
 epoch: 46, train_loss: 0.9416, test_loss: 0.9503, test_f1: 0.4860
 epoch: 47, train_loss: 0.9263, test_loss: 0.9416, test_f1: 0.4972
 epoch: 48, train_loss: 0.9456, test_loss: 0.9563, test_f1: 0.4783
 epoch: 49, train_loss: 0.9255, test_loss: 0.9343, test_f1: 0.5027
 epoch: 50, train_loss: 0.9347, test_loss: 0.9467, test_f1: 0.5211
 epoch: 51, train_loss: 0.9085, test_loss: 0.9517, test_f1: 0.4837
 epoch: 52, train_loss: 0.9002, test_loss: 0.9516, test_f1: 0.4912
 epoch: 53, train_loss: 0.9055, test_loss: 0.9577, test_f1: 0.4901
 epoch: 54, train_loss: 0.9062, test_loss: 0.9626, test_f1: 0.4866
 epoch: 55, train_loss: 0.8969, test_loss: 0.9635, test_f1: 0.4958
 epoch: 56, train_loss: 0.9084, test_loss: 0.9632, test_f1: 0.4816
 epoch: 57, train_loss: 0.8942, test_loss: 0.9683, test_f1: 0.4830
 epoch: 58, train_loss: 0.9029, test_loss: 0.9547, test_f1: 0.5038
 epoch: 59, train_loss: 0.8917, test_loss: 0.9828, test_f1: 0.4926
 epoch: 60, train_loss: 0.9034, test_loss: 0.9426, test_f1: 0.5005
 epoch: 61, train_loss: 0.8939, test_loss: 0.9603, test_f1: 0.4957
 epoch: 62, train_loss: 0.9073, test_loss: 0.9720, test_f1: 0.4938
 epoch: 63, train_loss: 0.9014, test_loss: 0.9783, test_f1: 0.4927
 epoch: 64, train_loss: 0.8814, test_loss: 0.9541, test_f1: 0.4978
 epoch: 65, train_loss: 0.8809, test_loss: 0.9809, test_f1: 0.5088
 epoch: 66, train_loss: 0.8924, test_loss: 0.9638, test_f1: 0.5042
 epoch: 67, train_loss: 0.8815, test_loss: 0.9693, test_f1: 0.5060
 epoch: 68, train_loss: 0.8776, test_loss: 0.9808, test_f1: 0.4963
 epoch: 69, train_loss: 0.8901, test_loss: 0.9748, test_f1: 0.4954
 epoch: 70, train_loss: 0.8847, test_loss: 0.9654, test_f1: 0.5072
 epoch: 71, train_loss: 0.8829, test_loss: 0.9647, test_f1: 0.5078
 epoch: 72, train_loss: 0.8815, test_loss: 0.9495, test_f1: 0.5175
 epoch: 73, train_loss: 0.8769, test_loss: 0.9720, test_f1: 0.4979
 epoch: 74, train_loss: 0.8887, test_loss: 0.9535, test_f1: 0.4967
 epoch: 75, train_loss: 0.8776, test_loss: 0.9394, test_f1: 0.5285
 epoch: 76, train_loss: 0.8679, test_loss: 0.9698, test_f1: 0.5058
 epoch: 77, train_loss: 0.8843, test_loss: 0.9655, test_f1: 0.4858
 epoch: 78, train_loss: 0.8713, test_loss: 0.9684, test_f1: 0.4809
 epoch: 79, train_loss: 0.8729, test_loss: 0.9743, test_f1: 0.4897
 epoch: 80, train_loss: 0.8707, test_loss: 0.9725, test_f1: 0.4870
 epoch: 81, train_loss: 0.8671, test_loss: 0.9837, test_f1: 0.4927
 epoch: 82, train_loss: 0.8600, test_loss: 0.9903, test_f1: 0.4851
 epoch: 83, train_loss: 0.8734, test_loss: 0.9533, test_f1: 0.5005
 epoch: 84, train_loss: 0.8688, test_loss: 0.9578, test_f1: 0.4987
 epoch: 85, train_loss: 0.8609, test_loss: 0.9948, test_f1: 0.4967
 epoch: 86, train_loss: 0.8572, test_loss: 0.9861, test_f1: 0.4920
 epoch: 87, train_loss: 0.8662, test_loss: 0.9743, test_f1: 0.5155
 epoch: 88, train_loss: 0.8515, test_loss: 0.9784, test_f1: 0.4929
 epoch: 89, train_loss: 0.8465, test_loss: 0.9793, test_f1: 0.5051
 epoch: 90, train_loss: 0.8551, test_loss: 0.9849, test_f1: 0.5196
 epoch: 91, train_loss: 0.8531, test_loss: 0.9955, test_f1: 0.5127
 epoch: 92, train_loss: 0.8591, test_loss: 0.9646, test_f1: 0.5187
 epoch: 93, train_loss: 0.8543, test_loss: 0.9721, test_f1: 0.5078
 epoch: 94, train_loss: 0.8586, test_loss: 0.9984, test_f1: 0.5236
 epoch: 95, train_loss: 0.8502, test_loss: 0.9775, test_f1: 0.5283
 epoch: 96, train_loss: 0.8507, test_loss: 1.0067, test_f1: 0.5238
 epoch: 97, train_loss: 0.8483, test_loss: 0.9863, test_f1: 0.5259
 epoch: 98, train_loss: 0.8403, test_loss: 1.0222, test_f1: 0.5204
 epoch: 99, train_loss: 0.8507, test_loss: 0.9822, test_f1: 0.4986
##################ITERATION #5 ****************************************
 epoch: 0, train_loss: 1.4080, test_loss: 1.2958, test_f1: 0.2677
 epoch: 1, train_loss: 1.3043, test_loss: 1.2344, test_f1: 0.3019
 epoch: 2, train_loss: 1.2654, test_loss: 1.2163, test_f1: 0.3057
 epoch: 3, train_loss: 1.2462, test_loss: 1.2038, test_f1: 0.3232
 epoch: 4, train_loss: 1.2324, test_loss: 1.1996, test_f1: 0.3268
 epoch: 5, train_loss: 1.2240, test_loss: 1.1894, test_f1: 0.3689
 epoch: 6, train_loss: 1.2202, test_loss: 1.1759, test_f1: 0.3400
 epoch: 7, train_loss: 1.2190, test_loss: 1.1647, test_f1: 0.3695
 epoch: 8, train_loss: 1.2040, test_loss: 1.1636, test_f1: 0.3956
 epoch: 9, train_loss: 1.1935, test_loss: 1.1501, test_f1: 0.3649
 epoch: 10, train_loss: 1.1851, test_loss: 1.1329, test_f1: 0.3864
 epoch: 11, train_loss: 1.1798, test_loss: 1.1245, test_f1: 0.3939
 epoch: 12, train_loss: 1.1675, test_loss: 1.1216, test_f1: 0.4248
 epoch: 13, train_loss: 1.1610, test_loss: 1.1042, test_f1: 0.4197
 epoch: 14, train_loss: 1.1586, test_loss: 1.1017, test_f1: 0.4182
 epoch: 15, train_loss: 1.1433, test_loss: 1.0930, test_f1: 0.4235
 epoch: 16, train_loss: 1.1451, test_loss: 1.0820, test_f1: 0.4301
 epoch: 17, train_loss: 1.1333, test_loss: 1.0697, test_f1: 0.4208
 epoch: 18, train_loss: 1.1228, test_loss: 1.0541, test_f1: 0.4402
 epoch: 19, train_loss: 1.1160, test_loss: 1.0454, test_f1: 0.4566
 epoch: 20, train_loss: 1.1092, test_loss: 1.0463, test_f1: 0.4734
 epoch: 21, train_loss: 1.1044, test_loss: 1.0346, test_f1: 0.4621
 epoch: 22, train_loss: 1.1101, test_loss: 1.0260, test_f1: 0.4775
 epoch: 23, train_loss: 1.0971, test_loss: 1.0127, test_f1: 0.4594
 epoch: 24, train_loss: 1.0820, test_loss: 1.0109, test_f1: 0.4572
 epoch: 25, train_loss: 1.0721, test_loss: 1.0037, test_f1: 0.4636
 epoch: 26, train_loss: 1.0744, test_loss: 1.0028, test_f1: 0.4708
 epoch: 27, train_loss: 1.0654, test_loss: 1.0022, test_f1: 0.4744
 epoch: 28, train_loss: 1.0588, test_loss: 0.9910, test_f1: 0.4909
 epoch: 29, train_loss: 1.0472, test_loss: 0.9894, test_f1: 0.4838
 epoch: 30, train_loss: 1.0535, test_loss: 0.9811, test_f1: 0.4885
 epoch: 31, train_loss: 1.0287, test_loss: 0.9535, test_f1: 0.4759
 epoch: 32, train_loss: 1.0346, test_loss: 0.9492, test_f1: 0.4922
 epoch: 33, train_loss: 1.0336, test_loss: 0.9462, test_f1: 0.5169
 epoch: 34, train_loss: 1.0231, test_loss: 0.9423, test_f1: 0.4960
 epoch: 35, train_loss: 1.0247, test_loss: 0.9801, test_f1: 0.4828
 epoch: 36, train_loss: 1.0131, test_loss: 0.9457, test_f1: 0.5040
 epoch: 37, train_loss: 1.0092, test_loss: 0.9747, test_f1: 0.5016
 epoch: 38, train_loss: 1.0052, test_loss: 0.9471, test_f1: 0.5007
 epoch: 39, train_loss: 1.0029, test_loss: 0.9485, test_f1: 0.4982
 epoch: 40, train_loss: 0.9993, test_loss: 0.9178, test_f1: 0.5384
 epoch: 41, train_loss: 0.9948, test_loss: 0.9083, test_f1: 0.5150
 epoch: 42, train_loss: 0.9971, test_loss: 0.9550, test_f1: 0.5078
 epoch: 43, train_loss: 0.9913, test_loss: 0.9480, test_f1: 0.5024
 epoch: 44, train_loss: 0.9775, test_loss: 0.9337, test_f1: 0.5244
 epoch: 45, train_loss: 0.9869, test_loss: 0.9226, test_f1: 0.5043
 epoch: 46, train_loss: 0.9751, test_loss: 0.9202, test_f1: 0.5089
 epoch: 47, train_loss: 0.9687, test_loss: 0.9081, test_f1: 0.5270
 epoch: 48, train_loss: 0.9783, test_loss: 0.9278, test_f1: 0.5189
 epoch: 49, train_loss: 0.9630, test_loss: 0.9115, test_f1: 0.5275
 epoch: 50, train_loss: 0.9615, test_loss: 0.9277, test_f1: 0.5199
 epoch: 51, train_loss: 0.9584, test_loss: 0.9146, test_f1: 0.5149
 epoch: 52, train_loss: 0.9495, test_loss: 0.9005, test_f1: 0.5200
 epoch: 53, train_loss: 0.9503, test_loss: 0.9120, test_f1: 0.5216
 epoch: 54, train_loss: 0.9448, test_loss: 0.9184, test_f1: 0.5107
 epoch: 55, train_loss: 0.9498, test_loss: 0.9061, test_f1: 0.5308
 epoch: 56, train_loss: 0.9399, test_loss: 0.9139, test_f1: 0.5298
 epoch: 57, train_loss: 0.9346, test_loss: 0.9292, test_f1: 0.5111
 epoch: 58, train_loss: 0.9469, test_loss: 0.9164, test_f1: 0.5098
 epoch: 59, train_loss: 0.9378, test_loss: 0.9058, test_f1: 0.5230
 epoch: 60, train_loss: 0.9371, test_loss: 0.9291, test_f1: 0.5199
 epoch: 61, train_loss: 0.9309, test_loss: 0.9136, test_f1: 0.5359
 epoch: 62, train_loss: 0.9333, test_loss: 0.9135, test_f1: 0.5266
 epoch: 63, train_loss: 0.9367, test_loss: 0.8972, test_f1: 0.5356
 epoch: 64, train_loss: 0.9398, test_loss: 0.9181, test_f1: 0.5260
 epoch: 65, train_loss: 0.9294, test_loss: 0.9382, test_f1: 0.5190
 epoch: 66, train_loss: 0.9304, test_loss: 0.9076, test_f1: 0.5281
 epoch: 67, train_loss: 0.9315, test_loss: 0.9135, test_f1: 0.5186
 epoch: 68, train_loss: 0.9343, test_loss: 0.9375, test_f1: 0.5100
 epoch: 69, train_loss: 0.9307, test_loss: 0.9091, test_f1: 0.5192
 epoch: 70, train_loss: 0.9292, test_loss: 0.9436, test_f1: 0.5163
 epoch: 71, train_loss: 0.9262, test_loss: 0.9211, test_f1: 0.5241
 epoch: 72, train_loss: 0.9226, test_loss: 0.9139, test_f1: 0.5272
 epoch: 73, train_loss: 0.9166, test_loss: 0.9203, test_f1: 0.5202
 epoch: 74, train_loss: 0.9222, test_loss: 0.9072, test_f1: 0.5287
 epoch: 75, train_loss: 0.9224, test_loss: 0.9315, test_f1: 0.5159
 epoch: 76, train_loss: 0.9245, test_loss: 0.8956, test_f1: 0.5281
 epoch: 77, train_loss: 0.9141, test_loss: 0.9039, test_f1: 0.5272
 epoch: 78, train_loss: 0.9169, test_loss: 0.9112, test_f1: 0.5242
 epoch: 79, train_loss: 0.9206, test_loss: 0.9014, test_f1: 0.5321
 epoch: 80, train_loss: 0.9221, test_loss: 0.8978, test_f1: 0.5103
 epoch: 81, train_loss: 0.9240, test_loss: 0.9350, test_f1: 0.5002
 epoch: 82, train_loss: 0.9185, test_loss: 0.9040, test_f1: 0.5010
 epoch: 83, train_loss: 0.9106, test_loss: 0.8896, test_f1: 0.5079
 epoch: 84, train_loss: 0.9070, test_loss: 0.9004, test_f1: 0.5334
 epoch: 85, train_loss: 0.9070, test_loss: 0.9093, test_f1: 0.5193
 epoch: 86, train_loss: 0.9060, test_loss: 0.8905, test_f1: 0.5209
 epoch: 87, train_loss: 0.9039, test_loss: 0.8880, test_f1: 0.5131
 epoch: 88, train_loss: 0.8973, test_loss: 0.9013, test_f1: 0.5086
 epoch: 89, train_loss: 0.9045, test_loss: 0.9008, test_f1: 0.5256
 epoch: 90, train_loss: 0.8982, test_loss: 0.8792, test_f1: 0.5183
 epoch: 91, train_loss: 0.9006, test_loss: 0.9041, test_f1: 0.5027
 epoch: 92, train_loss: 0.8924, test_loss: 0.8918, test_f1: 0.5200
 epoch: 93, train_loss: 0.9087, test_loss: 0.8742, test_f1: 0.5324
 epoch: 94, train_loss: 0.9023, test_loss: 0.8927, test_f1: 0.5302
 epoch: 95, train_loss: 0.9049, test_loss: 0.8902, test_f1: 0.5228
 epoch: 96, train_loss: 0.8933, test_loss: 0.9307, test_f1: 0.5210
 epoch: 97, train_loss: 0.8942, test_loss: 0.9069, test_f1: 0.5122
 epoch: 98, train_loss: 0.8934, test_loss: 0.9135, test_f1: 0.5176
 epoch: 99, train_loss: 0.8838, test_loss: 0.9051, test_f1: 0.5038
##################ITERATION #6 ****************************************
 epoch: 0, train_loss: 1.4125, test_loss: 1.3357, test_f1: 0.2274
 epoch: 1, train_loss: 1.2740, test_loss: 1.2447, test_f1: 0.2650
 epoch: 2, train_loss: 1.2556, test_loss: 1.2161, test_f1: 0.3733
 epoch: 3, train_loss: 1.2234, test_loss: 1.1967, test_f1: 0.3355
 epoch: 4, train_loss: 1.2238, test_loss: 1.1906, test_f1: 0.3807
 epoch: 5, train_loss: 1.2000, test_loss: 1.1800, test_f1: 0.3749
 epoch: 6, train_loss: 1.1946, test_loss: 1.1724, test_f1: 0.4031
 epoch: 7, train_loss: 1.1869, test_loss: 1.1594, test_f1: 0.4012
 epoch: 8, train_loss: 1.1837, test_loss: 1.1590, test_f1: 0.3984
 epoch: 9, train_loss: 1.1745, test_loss: 1.1452, test_f1: 0.4294
 epoch: 10, train_loss: 1.1525, test_loss: 1.1337, test_f1: 0.4082
 epoch: 11, train_loss: 1.1571, test_loss: 1.1282, test_f1: 0.4018
 epoch: 12, train_loss: 1.1340, test_loss: 1.1065, test_f1: 0.4439
 epoch: 13, train_loss: 1.1307, test_loss: 1.1164, test_f1: 0.4431
 epoch: 14, train_loss: 1.1310, test_loss: 1.1207, test_f1: 0.4504
 epoch: 15, train_loss: 1.1166, test_loss: 1.0843, test_f1: 0.4414
 epoch: 16, train_loss: 1.1121, test_loss: 1.0734, test_f1: 0.4409
 epoch: 17, train_loss: 1.1003, test_loss: 1.0688, test_f1: 0.4206
 epoch: 18, train_loss: 1.1008, test_loss: 1.0817, test_f1: 0.4684
 epoch: 19, train_loss: 1.0806, test_loss: 1.0389, test_f1: 0.4914
 epoch: 20, train_loss: 1.0840, test_loss: 1.0442, test_f1: 0.4696
 epoch: 21, train_loss: 1.0749, test_loss: 1.0920, test_f1: 0.4492
 epoch: 22, train_loss: 1.0725, test_loss: 1.0237, test_f1: 0.4674
 epoch: 23, train_loss: 1.0662, test_loss: 1.0312, test_f1: 0.4857
 epoch: 24, train_loss: 1.0575, test_loss: 1.0150, test_f1: 0.4897
 epoch: 25, train_loss: 1.0485, test_loss: 1.0088, test_f1: 0.4682
 epoch: 26, train_loss: 1.0405, test_loss: 1.0041, test_f1: 0.4651
 epoch: 27, train_loss: 1.0374, test_loss: 1.0299, test_f1: 0.4456
 epoch: 28, train_loss: 1.0378, test_loss: 0.9840, test_f1: 0.4782
 epoch: 29, train_loss: 1.0387, test_loss: 0.9857, test_f1: 0.5006
 epoch: 30, train_loss: 1.0263, test_loss: 0.9976, test_f1: 0.4867
 epoch: 31, train_loss: 1.0152, test_loss: 0.9833, test_f1: 0.4808
 epoch: 32, train_loss: 1.0156, test_loss: 0.9708, test_f1: 0.4992
 epoch: 33, train_loss: 1.0025, test_loss: 0.9842, test_f1: 0.4874
 epoch: 34, train_loss: 1.0067, test_loss: 0.9935, test_f1: 0.4872
 epoch: 35, train_loss: 0.9992, test_loss: 0.9983, test_f1: 0.4493
 epoch: 36, train_loss: 0.9995, test_loss: 0.9660, test_f1: 0.5137
 epoch: 37, train_loss: 0.9939, test_loss: 0.9878, test_f1: 0.4834
 epoch: 38, train_loss: 0.9926, test_loss: 0.9914, test_f1: 0.4770
 epoch: 39, train_loss: 1.0040, test_loss: 0.9877, test_f1: 0.4804
 epoch: 40, train_loss: 0.9847, test_loss: 0.9626, test_f1: 0.5028
 epoch: 41, train_loss: 0.9873, test_loss: 0.9493, test_f1: 0.4892
 epoch: 42, train_loss: 0.9794, test_loss: 0.9754, test_f1: 0.5021
 epoch: 43, train_loss: 0.9815, test_loss: 0.9802, test_f1: 0.4797
 epoch: 44, train_loss: 0.9737, test_loss: 0.9787, test_f1: 0.4814
 epoch: 45, train_loss: 0.9660, test_loss: 0.9509, test_f1: 0.5185
 epoch: 46, train_loss: 0.9772, test_loss: 0.9999, test_f1: 0.4773
 epoch: 47, train_loss: 0.9546, test_loss: 0.9534, test_f1: 0.4885
 epoch: 48, train_loss: 0.9618, test_loss: 0.9765, test_f1: 0.4831
 epoch: 49, train_loss: 0.9492, test_loss: 1.0727, test_f1: 0.4523
 epoch: 50, train_loss: 0.9564, test_loss: 0.9451, test_f1: 0.5248
 epoch: 51, train_loss: 0.9492, test_loss: 0.9438, test_f1: 0.4998
 epoch: 52, train_loss: 0.9433, test_loss: 0.9315, test_f1: 0.5040
 epoch: 53, train_loss: 0.9402, test_loss: 0.9530, test_f1: 0.4887
 epoch: 54, train_loss: 0.9423, test_loss: 0.9447, test_f1: 0.5010
 epoch: 55, train_loss: 0.9415, test_loss: 0.9409, test_f1: 0.4882
 epoch: 56, train_loss: 0.9438, test_loss: 0.9625, test_f1: 0.4904
 epoch: 57, train_loss: 0.9328, test_loss: 0.9383, test_f1: 0.5031
 epoch: 58, train_loss: 0.9421, test_loss: 0.9612, test_f1: 0.4855
 epoch: 59, train_loss: 0.9454, test_loss: 0.9359, test_f1: 0.4839
 epoch: 60, train_loss: 0.9343, test_loss: 0.9431, test_f1: 0.4860
 epoch: 61, train_loss: 0.9343, test_loss: 0.9601, test_f1: 0.4819
 epoch: 62, train_loss: 0.9332, test_loss: 0.9510, test_f1: 0.4989
 epoch: 63, train_loss: 0.9232, test_loss: 0.9291, test_f1: 0.4956
 epoch: 64, train_loss: 0.9268, test_loss: 0.9540, test_f1: 0.4979
 epoch: 65, train_loss: 0.9266, test_loss: 0.9350, test_f1: 0.4891
 epoch: 66, train_loss: 0.9248, test_loss: 0.9551, test_f1: 0.4897
 epoch: 67, train_loss: 0.9202, test_loss: 0.9454, test_f1: 0.4855
 epoch: 68, train_loss: 0.9286, test_loss: 0.9232, test_f1: 0.4948
 epoch: 69, train_loss: 0.9295, test_loss: 0.9445, test_f1: 0.4804
 epoch: 70, train_loss: 0.9219, test_loss: 0.9505, test_f1: 0.5048
 epoch: 71, train_loss: 0.9172, test_loss: 0.9491, test_f1: 0.4873
 epoch: 72, train_loss: 0.9190, test_loss: 0.9353, test_f1: 0.4819
 epoch: 73, train_loss: 0.9261, test_loss: 0.9298, test_f1: 0.4993
 epoch: 74, train_loss: 0.9088, test_loss: 0.9395, test_f1: 0.5093
 epoch: 75, train_loss: 0.9202, test_loss: 0.9649, test_f1: 0.4847
 epoch: 76, train_loss: 0.9084, test_loss: 0.9427, test_f1: 0.4851
 epoch: 77, train_loss: 0.9117, test_loss: 0.9405, test_f1: 0.4803
 epoch: 78, train_loss: 0.9105, test_loss: 0.9596, test_f1: 0.4880
 epoch: 79, train_loss: 0.9143, test_loss: 0.9609, test_f1: 0.4907
 epoch: 80, train_loss: 0.9119, test_loss: 0.9560, test_f1: 0.5061
 epoch: 81, train_loss: 0.9063, test_loss: 0.9177, test_f1: 0.5014
 epoch: 82, train_loss: 0.9149, test_loss: 0.9292, test_f1: 0.4992
 epoch: 83, train_loss: 0.9148, test_loss: 0.9295, test_f1: 0.5006
 epoch: 84, train_loss: 0.9095, test_loss: 0.9456, test_f1: 0.5076
 epoch: 85, train_loss: 0.9020, test_loss: 0.9343, test_f1: 0.5162
 epoch: 86, train_loss: 0.9076, test_loss: 0.9381, test_f1: 0.5187
 epoch: 87, train_loss: 0.9077, test_loss: 0.9410, test_f1: 0.4884
 epoch: 88, train_loss: 0.8991, test_loss: 0.9496, test_f1: 0.5049
 epoch: 89, train_loss: 0.8935, test_loss: 0.9441, test_f1: 0.4911
 epoch: 90, train_loss: 0.8954, test_loss: 0.9580, test_f1: 0.5134
 epoch: 91, train_loss: 0.9020, test_loss: 1.1035, test_f1: 0.4733
 epoch: 92, train_loss: 0.9092, test_loss: 0.9330, test_f1: 0.4915
 epoch: 93, train_loss: 0.8905, test_loss: 0.9315, test_f1: 0.5053
 epoch: 94, train_loss: 0.9106, test_loss: 0.9433, test_f1: 0.4960
 epoch: 95, train_loss: 0.8939, test_loss: 0.9370, test_f1: 0.4974
 epoch: 96, train_loss: 0.8808, test_loss: 0.9394, test_f1: 0.5033
 epoch: 97, train_loss: 0.8856, test_loss: 0.9453, test_f1: 0.4972
 epoch: 98, train_loss: 0.8962, test_loss: 0.9420, test_f1: 0.4941
 epoch: 99, train_loss: 0.8963, test_loss: 0.9441, test_f1: 0.5028
##################ITERATION #7 ****************************************
 epoch: 0, train_loss: 1.4203, test_loss: 1.2786, test_f1: 0.2411
 epoch: 1, train_loss: 1.2614, test_loss: 1.1931, test_f1: 0.3471
 epoch: 2, train_loss: 1.2464, test_loss: 1.2147, test_f1: 0.3661
 epoch: 3, train_loss: 1.2216, test_loss: 1.1626, test_f1: 0.4149
 epoch: 4, train_loss: 1.2028, test_loss: 1.1734, test_f1: 0.4493
 epoch: 5, train_loss: 1.1956, test_loss: 1.1508, test_f1: 0.4373
 epoch: 6, train_loss: 1.1852, test_loss: 1.1409, test_f1: 0.4414
 epoch: 7, train_loss: 1.1700, test_loss: 1.1205, test_f1: 0.4363
 epoch: 8, train_loss: 1.1676, test_loss: 1.0951, test_f1: 0.4598
 epoch: 9, train_loss: 1.1476, test_loss: 1.0817, test_f1: 0.4652
 epoch: 10, train_loss: 1.1373, test_loss: 1.0731, test_f1: 0.4609
 epoch: 11, train_loss: 1.1251, test_loss: 1.0760, test_f1: 0.4657
 epoch: 12, train_loss: 1.1259, test_loss: 1.0577, test_f1: 0.4571
 epoch: 13, train_loss: 1.1076, test_loss: 1.0417, test_f1: 0.4730
 epoch: 14, train_loss: 1.1053, test_loss: 1.0413, test_f1: 0.4688
 epoch: 15, train_loss: 1.1016, test_loss: 1.0453, test_f1: 0.4836
 epoch: 16, train_loss: 1.0937, test_loss: 1.0439, test_f1: 0.4696
 epoch: 17, train_loss: 1.0827, test_loss: 1.0366, test_f1: 0.4650
 epoch: 18, train_loss: 1.0736, test_loss: 1.0139, test_f1: 0.4799
 epoch: 19, train_loss: 1.0735, test_loss: 1.0286, test_f1: 0.4789
 epoch: 20, train_loss: 1.0694, test_loss: 1.0247, test_f1: 0.4746
 epoch: 21, train_loss: 1.0699, test_loss: 0.9986, test_f1: 0.4730
 epoch: 22, train_loss: 1.0720, test_loss: 1.0047, test_f1: 0.4715
 epoch: 23, train_loss: 1.0735, test_loss: 0.9902, test_f1: 0.4762
 epoch: 24, train_loss: 1.0526, test_loss: 1.0374, test_f1: 0.4647
 epoch: 25, train_loss: 1.0565, test_loss: 0.9918, test_f1: 0.4741
 epoch: 26, train_loss: 1.0490, test_loss: 0.9862, test_f1: 0.4595
 epoch: 27, train_loss: 1.0423, test_loss: 0.9840, test_f1: 0.4710
 epoch: 28, train_loss: 1.0310, test_loss: 0.9718, test_f1: 0.4691
 epoch: 29, train_loss: 1.0219, test_loss: 0.9796, test_f1: 0.4693
 epoch: 30, train_loss: 1.0301, test_loss: 0.9704, test_f1: 0.4622
 epoch: 31, train_loss: 1.0213, test_loss: 0.9732, test_f1: 0.4570
 epoch: 32, train_loss: 1.0172, test_loss: 0.9657, test_f1: 0.4588
 epoch: 33, train_loss: 1.0095, test_loss: 0.9682, test_f1: 0.4588
 epoch: 34, train_loss: 1.0118, test_loss: 0.9710, test_f1: 0.4536
 epoch: 35, train_loss: 1.0078, test_loss: 0.9671, test_f1: 0.4582
 epoch: 36, train_loss: 1.0083, test_loss: 0.9594, test_f1: 0.4728
 epoch: 37, train_loss: 0.9995, test_loss: 0.9663, test_f1: 0.4653
 epoch: 38, train_loss: 0.9915, test_loss: 0.9548, test_f1: 0.4624
 epoch: 39, train_loss: 0.9941, test_loss: 0.9495, test_f1: 0.4709
 epoch: 40, train_loss: 0.9913, test_loss: 0.9459, test_f1: 0.4681
 epoch: 41, train_loss: 0.9913, test_loss: 0.9571, test_f1: 0.4627
 epoch: 42, train_loss: 0.9655, test_loss: 0.9704, test_f1: 0.4574
 epoch: 43, train_loss: 0.9731, test_loss: 0.9784, test_f1: 0.4586
 epoch: 44, train_loss: 0.9801, test_loss: 0.9557, test_f1: 0.4700
 epoch: 45, train_loss: 0.9784, test_loss: 0.9562, test_f1: 0.4780
 epoch: 46, train_loss: 0.9795, test_loss: 0.9387, test_f1: 0.4692
 epoch: 47, train_loss: 0.9611, test_loss: 0.9566, test_f1: 0.4661
 epoch: 48, train_loss: 0.9528, test_loss: 0.9615, test_f1: 0.4567
 epoch: 49, train_loss: 0.9577, test_loss: 1.0229, test_f1: 0.4590
 epoch: 50, train_loss: 0.9690, test_loss: 0.9364, test_f1: 0.4749
 epoch: 51, train_loss: 0.9528, test_loss: 0.9380, test_f1: 0.4752
 epoch: 52, train_loss: 0.9383, test_loss: 0.9428, test_f1: 0.4702
 epoch: 53, train_loss: 0.9505, test_loss: 0.9434, test_f1: 0.4593
 epoch: 54, train_loss: 0.9414, test_loss: 0.9601, test_f1: 0.4562
 epoch: 55, train_loss: 0.9487, test_loss: 0.9411, test_f1: 0.4740
 epoch: 56, train_loss: 0.9548, test_loss: 0.9640, test_f1: 0.4633
 epoch: 57, train_loss: 0.9478, test_loss: 0.9735, test_f1: 0.4534
 epoch: 58, train_loss: 0.9415, test_loss: 0.9661, test_f1: 0.4715
 epoch: 59, train_loss: 0.9413, test_loss: 0.9595, test_f1: 0.4741
 epoch: 60, train_loss: 0.9561, test_loss: 0.9519, test_f1: 0.4774
 epoch: 61, train_loss: 0.9310, test_loss: 0.9772, test_f1: 0.4717
 epoch: 62, train_loss: 0.9336, test_loss: 0.9493, test_f1: 0.4696
 epoch: 63, train_loss: 0.9309, test_loss: 0.9850, test_f1: 0.4679
 epoch: 64, train_loss: 0.9343, test_loss: 0.9548, test_f1: 0.4722
 epoch: 65, train_loss: 0.9327, test_loss: 0.9458, test_f1: 0.4654
 epoch: 66, train_loss: 0.9229, test_loss: 0.9508, test_f1: 0.4744
 epoch: 67, train_loss: 0.9333, test_loss: 0.9404, test_f1: 0.4648
 epoch: 68, train_loss: 0.9310, test_loss: 0.9523, test_f1: 0.4747
 epoch: 69, train_loss: 0.9248, test_loss: 0.9867, test_f1: 0.4671
 epoch: 70, train_loss: 0.9224, test_loss: 0.9649, test_f1: 0.4682
 epoch: 71, train_loss: 0.9122, test_loss: 0.9727, test_f1: 0.4662
 epoch: 72, train_loss: 0.9145, test_loss: 0.9675, test_f1: 0.4606
 epoch: 73, train_loss: 0.9202, test_loss: 0.9750, test_f1: 0.4636
 epoch: 74, train_loss: 0.9236, test_loss: 0.9822, test_f1: 0.4675
 epoch: 75, train_loss: 0.9147, test_loss: 0.9602, test_f1: 0.4614
 epoch: 76, train_loss: 0.9162, test_loss: 0.9583, test_f1: 0.4713
 epoch: 77, train_loss: 0.9069, test_loss: 0.9364, test_f1: 0.4757
 epoch: 78, train_loss: 0.9132, test_loss: 0.9409, test_f1: 0.4716
 epoch: 79, train_loss: 0.9088, test_loss: 0.9601, test_f1: 0.4708
 epoch: 80, train_loss: 0.9090, test_loss: 0.9692, test_f1: 0.4676
 epoch: 81, train_loss: 0.9249, test_loss: 0.9449, test_f1: 0.4725
 epoch: 82, train_loss: 0.9088, test_loss: 0.9439, test_f1: 0.4735
 epoch: 83, train_loss: 0.9142, test_loss: 0.9497, test_f1: 0.4704
 epoch: 84, train_loss: 0.9146, test_loss: 0.9549, test_f1: 0.4711
 epoch: 85, train_loss: 0.9069, test_loss: 0.9696, test_f1: 0.4761
 epoch: 86, train_loss: 0.9240, test_loss: 0.9526, test_f1: 0.4793
 epoch: 87, train_loss: 0.9008, test_loss: 0.9707, test_f1: 0.4753
 epoch: 88, train_loss: 0.8989, test_loss: 0.9437, test_f1: 0.4766
 epoch: 89, train_loss: 0.9034, test_loss: 0.9789, test_f1: 0.4660
 epoch: 90, train_loss: 0.8914, test_loss: 0.9766, test_f1: 0.4623
 epoch: 91, train_loss: 0.9032, test_loss: 0.9894, test_f1: 0.4739
 epoch: 92, train_loss: 0.9014, test_loss: 0.9375, test_f1: 0.4807
 epoch: 93, train_loss: 0.8951, test_loss: 1.0124, test_f1: 0.4661
 epoch: 94, train_loss: 0.9179, test_loss: 0.9317, test_f1: 0.4784
 epoch: 95, train_loss: 0.8898, test_loss: 0.9664, test_f1: 0.4739
 epoch: 96, train_loss: 0.8871, test_loss: 0.9394, test_f1: 0.4800
 epoch: 97, train_loss: 0.8999, test_loss: 0.9509, test_f1: 0.4812
 epoch: 98, train_loss: 0.9057, test_loss: 0.9625, test_f1: 0.4772
 epoch: 99, train_loss: 0.9012, test_loss: 0.9795, test_f1: 0.4764
##################ITERATION #8 ****************************************
 epoch: 0, train_loss: 1.4886, test_loss: 1.3113, test_f1: 0.2330
 epoch: 1, train_loss: 1.2721, test_loss: 1.2393, test_f1: 0.2971
 epoch: 2, train_loss: 1.2672, test_loss: 1.2107, test_f1: 0.3171
 epoch: 3, train_loss: 1.2421, test_loss: 1.1948, test_f1: 0.3338
 epoch: 4, train_loss: 1.2395, test_loss: 1.1712, test_f1: 0.3663
 epoch: 5, train_loss: 1.2151, test_loss: 1.1588, test_f1: 0.3675
 epoch: 6, train_loss: 1.2085, test_loss: 1.1541, test_f1: 0.3689
 epoch: 7, train_loss: 1.1992, test_loss: 1.1430, test_f1: 0.3850
 epoch: 8, train_loss: 1.2047, test_loss: 1.1442, test_f1: 0.3760
 epoch: 9, train_loss: 1.1912, test_loss: 1.1248, test_f1: 0.4073
 epoch: 10, train_loss: 1.1744, test_loss: 1.1161, test_f1: 0.3863
 epoch: 11, train_loss: 1.1616, test_loss: 1.1138, test_f1: 0.3812
 epoch: 12, train_loss: 1.1592, test_loss: 1.1017, test_f1: 0.3898
 epoch: 13, train_loss: 1.1311, test_loss: 1.0954, test_f1: 0.4014
 epoch: 14, train_loss: 1.1349, test_loss: 1.0663, test_f1: 0.4116
 epoch: 15, train_loss: 1.1150, test_loss: 1.0454, test_f1: 0.4216
 epoch: 16, train_loss: 1.1065, test_loss: 1.0790, test_f1: 0.4249
 epoch: 17, train_loss: 1.1045, test_loss: 1.0572, test_f1: 0.4052
 epoch: 18, train_loss: 1.0976, test_loss: 1.0430, test_f1: 0.4181
 epoch: 19, train_loss: 1.0860, test_loss: 1.0470, test_f1: 0.4208
 epoch: 20, train_loss: 1.0858, test_loss: 1.0141, test_f1: 0.4410
 epoch: 21, train_loss: 1.0730, test_loss: 1.0195, test_f1: 0.4286
 epoch: 22, train_loss: 1.0661, test_loss: 1.0057, test_f1: 0.4563
 epoch: 23, train_loss: 1.0501, test_loss: 1.0078, test_f1: 0.4356
 epoch: 24, train_loss: 1.0583, test_loss: 0.9901, test_f1: 0.4577
 epoch: 25, train_loss: 1.0461, test_loss: 0.9990, test_f1: 0.4511
 epoch: 26, train_loss: 1.0430, test_loss: 0.9935, test_f1: 0.4622
 epoch: 27, train_loss: 1.0332, test_loss: 1.0119, test_f1: 0.4666
 epoch: 28, train_loss: 1.0304, test_loss: 0.9953, test_f1: 0.4642
 epoch: 29, train_loss: 1.0317, test_loss: 0.9963, test_f1: 0.4521
 epoch: 30, train_loss: 1.0291, test_loss: 0.9906, test_f1: 0.4595
 epoch: 31, train_loss: 1.0111, test_loss: 0.9860, test_f1: 0.4483
 epoch: 32, train_loss: 1.0093, test_loss: 0.9535, test_f1: 0.4639
 epoch: 33, train_loss: 1.0117, test_loss: 0.9748, test_f1: 0.4612
 epoch: 34, train_loss: 1.0017, test_loss: 0.9952, test_f1: 0.4717
 epoch: 35, train_loss: 0.9914, test_loss: 0.9729, test_f1: 0.4577
 epoch: 36, train_loss: 0.9965, test_loss: 0.9813, test_f1: 0.4551
 epoch: 37, train_loss: 1.0013, test_loss: 0.9579, test_f1: 0.4655
 epoch: 38, train_loss: 0.9904, test_loss: 0.9728, test_f1: 0.4577
 epoch: 39, train_loss: 0.9817, test_loss: 0.9701, test_f1: 0.4705
 epoch: 40, train_loss: 0.9744, test_loss: 0.9628, test_f1: 0.4564
 epoch: 41, train_loss: 0.9704, test_loss: 0.9549, test_f1: 0.4910
 epoch: 42, train_loss: 0.9743, test_loss: 0.9666, test_f1: 0.4796
 epoch: 43, train_loss: 0.9630, test_loss: 0.9547, test_f1: 0.4757
 epoch: 44, train_loss: 0.9649, test_loss: 0.9601, test_f1: 0.4948
 epoch: 45, train_loss: 0.9549, test_loss: 0.9284, test_f1: 0.5153
 epoch: 46, train_loss: 0.9568, test_loss: 0.9753, test_f1: 0.4796
 epoch: 47, train_loss: 0.9627, test_loss: 1.0061, test_f1: 0.4632
 epoch: 48, train_loss: 0.9508, test_loss: 0.9515, test_f1: 0.4892
 epoch: 49, train_loss: 0.9315, test_loss: 0.9688, test_f1: 0.4871
 epoch: 50, train_loss: 0.9405, test_loss: 0.9558, test_f1: 0.4754
 epoch: 51, train_loss: 0.9447, test_loss: 0.9720, test_f1: 0.4872
 epoch: 52, train_loss: 0.9287, test_loss: 0.9573, test_f1: 0.4834
 epoch: 53, train_loss: 0.9261, test_loss: 0.9591, test_f1: 0.4892
 epoch: 54, train_loss: 0.9256, test_loss: 0.9630, test_f1: 0.4927
 epoch: 55, train_loss: 0.9370, test_loss: 0.9638, test_f1: 0.4874
 epoch: 56, train_loss: 0.9247, test_loss: 0.9730, test_f1: 0.4887
 epoch: 57, train_loss: 0.9200, test_loss: 0.9396, test_f1: 0.4887
 epoch: 58, train_loss: 0.9290, test_loss: 0.9560, test_f1: 0.4954
 epoch: 59, train_loss: 0.9167, test_loss: 0.9762, test_f1: 0.4848
 epoch: 60, train_loss: 0.9099, test_loss: 0.9336, test_f1: 0.5045
 epoch: 61, train_loss: 0.9196, test_loss: 0.9608, test_f1: 0.4952
 epoch: 62, train_loss: 0.9134, test_loss: 0.9981, test_f1: 0.4903
 epoch: 63, train_loss: 0.9181, test_loss: 0.9647, test_f1: 0.4978
 epoch: 64, train_loss: 0.9115, test_loss: 0.9793, test_f1: 0.4848
 epoch: 65, train_loss: 0.9073, test_loss: 0.9822, test_f1: 0.4934
 epoch: 66, train_loss: 0.9142, test_loss: 0.9335, test_f1: 0.4899
 epoch: 67, train_loss: 0.9161, test_loss: 0.9396, test_f1: 0.5018
 epoch: 68, train_loss: 0.8991, test_loss: 0.9720, test_f1: 0.4956
 epoch: 69, train_loss: 0.9015, test_loss: 0.9544, test_f1: 0.4954
 epoch: 70, train_loss: 0.9012, test_loss: 0.9632, test_f1: 0.5060
 epoch: 71, train_loss: 0.8990, test_loss: 0.9464, test_f1: 0.5032
 epoch: 72, train_loss: 0.9004, test_loss: 0.9525, test_f1: 0.5086
 epoch: 73, train_loss: 0.8955, test_loss: 0.9670, test_f1: 0.5041
 epoch: 74, train_loss: 0.8880, test_loss: 0.9632, test_f1: 0.5014
 epoch: 75, train_loss: 0.8992, test_loss: 0.9485, test_f1: 0.4959
 epoch: 76, train_loss: 0.8941, test_loss: 0.9912, test_f1: 0.4892
 epoch: 77, train_loss: 0.8894, test_loss: 0.9679, test_f1: 0.5014
 epoch: 78, train_loss: 0.8975, test_loss: 0.9621, test_f1: 0.5088
 epoch: 79, train_loss: 0.8914, test_loss: 0.9593, test_f1: 0.4954
 epoch: 80, train_loss: 0.8926, test_loss: 0.9392, test_f1: 0.5120
 epoch: 81, train_loss: 0.8866, test_loss: 0.9801, test_f1: 0.4993
 epoch: 82, train_loss: 0.8927, test_loss: 0.9880, test_f1: 0.4965
 epoch: 83, train_loss: 0.8963, test_loss: 0.9614, test_f1: 0.4938
 epoch: 84, train_loss: 0.8965, test_loss: 0.9634, test_f1: 0.4972
 epoch: 85, train_loss: 0.8723, test_loss: 0.9899, test_f1: 0.4852
 epoch: 86, train_loss: 0.8847, test_loss: 0.9515, test_f1: 0.4998
 epoch: 87, train_loss: 0.8797, test_loss: 0.9701, test_f1: 0.5050
 epoch: 88, train_loss: 0.8747, test_loss: 0.9608, test_f1: 0.5092
 epoch: 89, train_loss: 0.8849, test_loss: 0.9677, test_f1: 0.5032
 epoch: 90, train_loss: 0.8755, test_loss: 0.9848, test_f1: 0.5028
 epoch: 91, train_loss: 0.8781, test_loss: 0.9920, test_f1: 0.4881
 epoch: 92, train_loss: 0.8784, test_loss: 0.9581, test_f1: 0.5027
 epoch: 93, train_loss: 0.8889, test_loss: 0.9682, test_f1: 0.4975
 epoch: 94, train_loss: 0.8764, test_loss: 0.9999, test_f1: 0.5146
 epoch: 95, train_loss: 0.8712, test_loss: 1.0002, test_f1: 0.5006
 epoch: 96, train_loss: 0.8744, test_loss: 0.9901, test_f1: 0.4976
 epoch: 97, train_loss: 0.8740, test_loss: 0.9851, test_f1: 0.5037
 epoch: 98, train_loss: 0.8629, test_loss: 0.9848, test_f1: 0.5005
 epoch: 99, train_loss: 0.8648, test_loss: 0.9655, test_f1: 0.5065
##################ITERATION #9 ****************************************
 epoch: 0, train_loss: 1.5653, test_loss: 1.3086, test_f1: 0.2895
 epoch: 1, train_loss: 1.3259, test_loss: 1.2493, test_f1: 0.3860
 epoch: 2, train_loss: 1.2741, test_loss: 1.2188, test_f1: 0.3899
 epoch: 3, train_loss: 1.2562, test_loss: 1.2118, test_f1: 0.3943
 epoch: 4, train_loss: 1.2430, test_loss: 1.1796, test_f1: 0.3823
 epoch: 5, train_loss: 1.2207, test_loss: 1.1758, test_f1: 0.4055
 epoch: 6, train_loss: 1.2045, test_loss: 1.1670, test_f1: 0.4065
 epoch: 7, train_loss: 1.1980, test_loss: 1.1440, test_f1: 0.4245
 epoch: 8, train_loss: 1.1858, test_loss: 1.1420, test_f1: 0.4316
 epoch: 9, train_loss: 1.1835, test_loss: 1.1232, test_f1: 0.4027
 epoch: 10, train_loss: 1.1573, test_loss: 1.1045, test_f1: 0.4235
 epoch: 11, train_loss: 1.1616, test_loss: 1.1079, test_f1: 0.4418
 epoch: 12, train_loss: 1.1579, test_loss: 1.1024, test_f1: 0.4320
 epoch: 13, train_loss: 1.1497, test_loss: 1.1052, test_f1: 0.4372
 epoch: 14, train_loss: 1.1406, test_loss: 1.0883, test_f1: 0.4242
 epoch: 15, train_loss: 1.1367, test_loss: 1.0840, test_f1: 0.4422
 epoch: 16, train_loss: 1.1354, test_loss: 1.0774, test_f1: 0.4437
 epoch: 17, train_loss: 1.1176, test_loss: 1.0670, test_f1: 0.4497
 epoch: 18, train_loss: 1.1130, test_loss: 1.0738, test_f1: 0.4457
 epoch: 19, train_loss: 1.1146, test_loss: 1.0683, test_f1: 0.4390
 epoch: 20, train_loss: 1.1096, test_loss: 1.0636, test_f1: 0.4544
 epoch: 21, train_loss: 1.0988, test_loss: 1.0505, test_f1: 0.4458
 epoch: 22, train_loss: 1.1104, test_loss: 1.0565, test_f1: 0.4430
 epoch: 23, train_loss: 1.1053, test_loss: 1.0542, test_f1: 0.4512
 epoch: 24, train_loss: 1.0941, test_loss: 1.0439, test_f1: 0.4636
 epoch: 25, train_loss: 1.0829, test_loss: 1.0366, test_f1: 0.4666
 epoch: 26, train_loss: 1.0881, test_loss: 1.0398, test_f1: 0.4698
 epoch: 27, train_loss: 1.0803, test_loss: 1.0218, test_f1: 0.4749
 epoch: 28, train_loss: 1.0797, test_loss: 1.0314, test_f1: 0.4582
 epoch: 29, train_loss: 1.0768, test_loss: 1.0284, test_f1: 0.4542
 epoch: 30, train_loss: 1.0761, test_loss: 1.0250, test_f1: 0.4633
 epoch: 31, train_loss: 1.0676, test_loss: 1.0198, test_f1: 0.4572
 epoch: 32, train_loss: 1.0749, test_loss: 1.0240, test_f1: 0.4600
 epoch: 33, train_loss: 1.0661, test_loss: 1.0294, test_f1: 0.4549
 epoch: 34, train_loss: 1.0494, test_loss: 1.0130, test_f1: 0.4663
 epoch: 35, train_loss: 1.0497, test_loss: 1.0092, test_f1: 0.4746
 epoch: 36, train_loss: 1.0543, test_loss: 1.0176, test_f1: 0.4685
 epoch: 37, train_loss: 1.0500, test_loss: 1.0096, test_f1: 0.4758
 epoch: 38, train_loss: 1.0508, test_loss: 1.0201, test_f1: 0.4736
 epoch: 39, train_loss: 1.0372, test_loss: 1.0124, test_f1: 0.4808
 epoch: 40, train_loss: 1.0327, test_loss: 1.0022, test_f1: 0.4757
 epoch: 41, train_loss: 1.0356, test_loss: 1.0124, test_f1: 0.4787
 epoch: 42, train_loss: 1.0326, test_loss: 0.9967, test_f1: 0.4574
 epoch: 43, train_loss: 1.0303, test_loss: 0.9906, test_f1: 0.4818
 epoch: 44, train_loss: 1.0313, test_loss: 0.9959, test_f1: 0.4828
 epoch: 45, train_loss: 1.0224, test_loss: 1.0032, test_f1: 0.4695
 epoch: 46, train_loss: 1.0129, test_loss: 0.9853, test_f1: 0.4903
 epoch: 47, train_loss: 1.0113, test_loss: 0.9890, test_f1: 0.4719
 epoch: 48, train_loss: 1.0054, test_loss: 0.9929, test_f1: 0.4763
 epoch: 49, train_loss: 1.0108, test_loss: 0.9857, test_f1: 0.4875
 epoch: 50, train_loss: 1.0075, test_loss: 0.9825, test_f1: 0.4862
 epoch: 51, train_loss: 0.9891, test_loss: 0.9923, test_f1: 0.4621
 epoch: 52, train_loss: 0.9902, test_loss: 0.9929, test_f1: 0.4769
 epoch: 53, train_loss: 0.9992, test_loss: 0.9938, test_f1: 0.4832
 epoch: 54, train_loss: 0.9955, test_loss: 0.9759, test_f1: 0.4887
 epoch: 55, train_loss: 0.9811, test_loss: 0.9858, test_f1: 0.4802
 epoch: 56, train_loss: 0.9919, test_loss: 0.9810, test_f1: 0.4931
 epoch: 57, train_loss: 0.9827, test_loss: 0.9787, test_f1: 0.4776
 epoch: 58, train_loss: 0.9878, test_loss: 0.9766, test_f1: 0.4837
 epoch: 59, train_loss: 0.9809, test_loss: 0.9789, test_f1: 0.4761
 epoch: 60, train_loss: 0.9833, test_loss: 0.9636, test_f1: 0.4903
 epoch: 61, train_loss: 0.9872, test_loss: 0.9842, test_f1: 0.4706
 epoch: 62, train_loss: 0.9760, test_loss: 0.9748, test_f1: 0.4857
 epoch: 63, train_loss: 0.9725, test_loss: 0.9766, test_f1: 0.4813
 epoch: 64, train_loss: 0.9705, test_loss: 0.9678, test_f1: 0.4934
 epoch: 65, train_loss: 0.9678, test_loss: 0.9796, test_f1: 0.4753
 epoch: 66, train_loss: 0.9628, test_loss: 0.9746, test_f1: 0.4765
 epoch: 67, train_loss: 0.9770, test_loss: 0.9790, test_f1: 0.4808
 epoch: 68, train_loss: 0.9516, test_loss: 0.9799, test_f1: 0.4741
 epoch: 69, train_loss: 0.9672, test_loss: 0.9664, test_f1: 0.4808
 epoch: 70, train_loss: 0.9625, test_loss: 0.9666, test_f1: 0.4859
 epoch: 71, train_loss: 0.9652, test_loss: 0.9644, test_f1: 0.4952
 epoch: 72, train_loss: 0.9554, test_loss: 0.9694, test_f1: 0.4946
 epoch: 73, train_loss: 0.9648, test_loss: 0.9464, test_f1: 0.4870
 epoch: 74, train_loss: 0.9613, test_loss: 0.9743, test_f1: 0.4908
 epoch: 75, train_loss: 0.9560, test_loss: 0.9778, test_f1: 0.4793
 epoch: 76, train_loss: 0.9604, test_loss: 0.9644, test_f1: 0.4839
 epoch: 77, train_loss: 0.9546, test_loss: 0.9641, test_f1: 0.4820
 epoch: 78, train_loss: 0.9491, test_loss: 0.9626, test_f1: 0.4844
 epoch: 79, train_loss: 0.9622, test_loss: 0.9642, test_f1: 0.4841
 epoch: 80, train_loss: 0.9593, test_loss: 0.9622, test_f1: 0.4943
 epoch: 81, train_loss: 0.9471, test_loss: 0.9610, test_f1: 0.4857
 epoch: 82, train_loss: 0.9375, test_loss: 0.9585, test_f1: 0.4806
 epoch: 83, train_loss: 0.9419, test_loss: 0.9668, test_f1: 0.4846
 epoch: 84, train_loss: 0.9325, test_loss: 0.9544, test_f1: 0.4830
 epoch: 85, train_loss: 0.9454, test_loss: 0.9772, test_f1: 0.4848
 epoch: 86, train_loss: 0.9338, test_loss: 0.9760, test_f1: 0.4850
 epoch: 87, train_loss: 0.9506, test_loss: 0.9800, test_f1: 0.4882
 epoch: 88, train_loss: 0.9476, test_loss: 0.9598, test_f1: 0.4889
 epoch: 89, train_loss: 0.9373, test_loss: 0.9684, test_f1: 0.4895
 epoch: 90, train_loss: 0.9392, test_loss: 0.9581, test_f1: 0.4892
 epoch: 91, train_loss: 0.9309, test_loss: 0.9627, test_f1: 0.4890
 epoch: 92, train_loss: 0.9310, test_loss: 0.9676, test_f1: 0.4941
 epoch: 93, train_loss: 0.9365, test_loss: 0.9548, test_f1: 0.4980
 epoch: 94, train_loss: 0.9338, test_loss: 0.9620, test_f1: 0.4929
 epoch: 95, train_loss: 0.9307, test_loss: 0.9649, test_f1: 0.4933
 epoch: 96, train_loss: 0.9376, test_loss: 0.9517, test_f1: 0.4883
 epoch: 97, train_loss: 0.9209, test_loss: 0.9517, test_f1: 0.4976
 epoch: 98, train_loss: 0.9300, test_loss: 0.9608, test_f1: 0.4862
 epoch: 99, train_loss: 0.9286, test_loss: 0.9520, test_f1: 0.4840

Training completed in 519.90 seconds
Best F1: 0.5384 at epoch 40
Mean F1 across iterations: 0.5106  0.0173
========================FINAL RESULTS================================
FEGIN weighted F1: 0.5384  0.0173
python main.py --data ltspice_examples --representation component_component --model FEGIN --layers 5 --hiddens 16 --batch_size 128 --lr 0.001 --emb_size 128 --epochs 100 --save_appendix component_component_L5_H16_BS128_LR0.001_E128 --no_val
-----



STDERR:
Processing...
Done!
  File "main.py", line 370, in <module>
    main()
  File "main.py", line 254, in main
    dataset = dataset_class(
  File "/home/philip/projects/ltspice_examples_code_repo/Circuit-Completion-Using-GNNs/component_classification_with_link_prediction_head/evaluation/FEGIN/kernel/circuit_datasets.py", line 15, in __init__
    self.data, self.slices = torch.load(self.processed_paths[0])
  File "/home/philip/.local/lib/python3.8/site-packages/torch/serialization.py", line 1040, in load
    warnings.warn(
  File "/usr/lib/python3.8/warnings.py", line 109, in _showwarnmsg
    sw(msg.message, msg.category, msg.filename, msg.lineno,
  File "main.py", line 47, in warn_with_traceback
    traceback.print_stack(file=log)
/home/philip/projects/ltspice_examples_code_repo/Circuit-Completion-Using-GNNs/component_classification_with_link_prediction_head/evaluation/FEGIN/kernel/circuit_datasets.py:15: FutureWarning: You are using `torch.load` with `weights_only=False` (the current default value), which uses the default pickle module implicitly. It is possible to construct malicious pickle data which will execute arbitrary code during unpickling (See https://github.com/pytorch/pytorch/blob/main/SECURITY.md#untrusted-models for more details). In a future release, the default value for `weights_only` will be flipped to `True`. This limits the functions that could be executed during unpickling. Arbitrary objects will no longer be allowed to be loaded via this mode unless they are explicitly allowlisted by the user via `torch.serialization.add_safe_globals`. We recommend you start setting `weights_only=True` for any use case where you don't have full control of the loaded file. Please open an issue on GitHub for any issues related to this experimental feature.
  self.data, self.slices = torch.load(self.processed_paths[0])
