STDOUT:
Results will be saved in /home/philip/projects/ltspice_examples_code_repo/Circuit-Completion-Using-GNNs/component_classification_with_link_prediction_head/evaluation/FEGIN/results/model_FEGIN_dataset_ltspice_examples
Command line input: python main.py --data ltspice_examples --representation component_net --model FEGIN --layers 5 --hiddens 16 --batch_size 256 --lr 0.001 --emb_size 512 --epochs 100 --save_appendix component_net_L5_H16_BS256_LR0.001_E512 --no_val
 is saved.
-----
ltspice_examples - FEGIN
Using 5 layers, 16 hidden units, h = 2
Loading component_net representation dataset
ENTERED
Training FEGIN on component_net representation
Train: 3558, Test: 846
##################ITERATION #0 ****************************************
 epoch: 0, train_loss: 1.4114, test_loss: 1.4057, test_f1: 0.1004
 epoch: 1, train_loss: 1.3881, test_loss: 1.3946, test_f1: 0.1004
 epoch: 2, train_loss: 1.3664, test_loss: 1.3768, test_f1: 0.2153
 epoch: 3, train_loss: 1.3428, test_loss: 1.3430, test_f1: 0.2913
 epoch: 4, train_loss: 1.3147, test_loss: 1.3115, test_f1: 0.2794
 epoch: 5, train_loss: 1.2873, test_loss: 1.2815, test_f1: 0.2843
 epoch: 6, train_loss: 1.2722, test_loss: 1.2596, test_f1: 0.2844
 epoch: 7, train_loss: 1.2550, test_loss: 1.2382, test_f1: 0.3281
 epoch: 8, train_loss: 1.2417, test_loss: 1.2238, test_f1: 0.3438
 epoch: 9, train_loss: 1.2295, test_loss: 1.2093, test_f1: 0.3236
 epoch: 10, train_loss: 1.2223, test_loss: 1.1961, test_f1: 0.3219
 epoch: 11, train_loss: 1.2094, test_loss: 1.1855, test_f1: 0.3646
 epoch: 12, train_loss: 1.2064, test_loss: 1.1745, test_f1: 0.3705
 epoch: 13, train_loss: 1.1893, test_loss: 1.1619, test_f1: 0.3417
 epoch: 14, train_loss: 1.1784, test_loss: 1.1521, test_f1: 0.3508
 epoch: 15, train_loss: 1.1636, test_loss: 1.1375, test_f1: 0.3543
 epoch: 16, train_loss: 1.1574, test_loss: 1.1273, test_f1: 0.3541
 epoch: 17, train_loss: 1.1483, test_loss: 1.1115, test_f1: 0.3593
 epoch: 18, train_loss: 1.1309, test_loss: 1.1100, test_f1: 0.4264
 epoch: 19, train_loss: 1.1261, test_loss: 1.0819, test_f1: 0.3632
 epoch: 20, train_loss: 1.1192, test_loss: 1.0766, test_f1: 0.3678
 epoch: 21, train_loss: 1.1027, test_loss: 1.0576, test_f1: 0.3697
 epoch: 22, train_loss: 1.0842, test_loss: 1.0588, test_f1: 0.3832
 epoch: 23, train_loss: 1.0884, test_loss: 1.0465, test_f1: 0.4372
 epoch: 24, train_loss: 1.0811, test_loss: 1.0280, test_f1: 0.4767
 epoch: 25, train_loss: 1.0636, test_loss: 1.0325, test_f1: 0.4686
 epoch: 26, train_loss: 1.0663, test_loss: 1.0196, test_f1: 0.5008
 epoch: 27, train_loss: 1.0448, test_loss: 1.0046, test_f1: 0.4982
 epoch: 28, train_loss: 1.0453, test_loss: 1.0054, test_f1: 0.4990
 epoch: 29, train_loss: 1.0333, test_loss: 0.9903, test_f1: 0.5023
 epoch: 30, train_loss: 1.0087, test_loss: 0.9927, test_f1: 0.5129
 epoch: 31, train_loss: 1.0160, test_loss: 0.9821, test_f1: 0.4971
 epoch: 32, train_loss: 1.0041, test_loss: 0.9580, test_f1: 0.5615
 epoch: 33, train_loss: 0.9922, test_loss: 0.9514, test_f1: 0.5093
 epoch: 34, train_loss: 0.9828, test_loss: 0.9414, test_f1: 0.5081
 epoch: 35, train_loss: 0.9726, test_loss: 0.9459, test_f1: 0.5021
 epoch: 36, train_loss: 0.9596, test_loss: 0.9521, test_f1: 0.5332
 epoch: 37, train_loss: 0.9694, test_loss: 0.9232, test_f1: 0.5421
 epoch: 38, train_loss: 0.9558, test_loss: 0.9250, test_f1: 0.5007
 epoch: 39, train_loss: 0.9538, test_loss: 0.9190, test_f1: 0.5511
 epoch: 40, train_loss: 0.9383, test_loss: 0.9103, test_f1: 0.5168
 epoch: 41, train_loss: 0.9373, test_loss: 0.9215, test_f1: 0.5229
 epoch: 42, train_loss: 0.9339, test_loss: 0.9185, test_f1: 0.5133
 epoch: 43, train_loss: 0.9371, test_loss: 0.9257, test_f1: 0.5107
 epoch: 44, train_loss: 0.9337, test_loss: 0.9296, test_f1: 0.4917
 epoch: 45, train_loss: 0.9338, test_loss: 0.9177, test_f1: 0.4988
 epoch: 46, train_loss: 0.9254, test_loss: 0.9315, test_f1: 0.4861
 epoch: 47, train_loss: 0.9206, test_loss: 0.9208, test_f1: 0.5492
 epoch: 48, train_loss: 0.9212, test_loss: 0.9202, test_f1: 0.5485
 epoch: 49, train_loss: 0.9109, test_loss: 0.9030, test_f1: 0.5589
 epoch: 50, train_loss: 0.9114, test_loss: 0.9027, test_f1: 0.5652
 epoch: 51, train_loss: 0.8889, test_loss: 0.9065, test_f1: 0.5655
 epoch: 52, train_loss: 0.8908, test_loss: 0.8938, test_f1: 0.5417
 epoch: 53, train_loss: 0.8792, test_loss: 0.8909, test_f1: 0.5694
 epoch: 54, train_loss: 0.8843, test_loss: 0.8918, test_f1: 0.5606
 epoch: 55, train_loss: 0.8888, test_loss: 0.9020, test_f1: 0.5648
 epoch: 56, train_loss: 0.8886, test_loss: 0.8928, test_f1: 0.5650
 epoch: 57, train_loss: 0.8819, test_loss: 0.9120, test_f1: 0.5564
 epoch: 58, train_loss: 0.8744, test_loss: 0.9142, test_f1: 0.5473
 epoch: 59, train_loss: 0.8774, test_loss: 0.9160, test_f1: 0.5428
 epoch: 60, train_loss: 0.8750, test_loss: 0.9077, test_f1: 0.5569
 epoch: 61, train_loss: 0.8643, test_loss: 0.9021, test_f1: 0.5676
 epoch: 62, train_loss: 0.8671, test_loss: 0.9037, test_f1: 0.5647
 epoch: 63, train_loss: 0.8678, test_loss: 0.9349, test_f1: 0.5266
 epoch: 64, train_loss: 0.8664, test_loss: 0.9200, test_f1: 0.5470
 epoch: 65, train_loss: 0.8673, test_loss: 0.9232, test_f1: 0.5480
 epoch: 66, train_loss: 0.8591, test_loss: 0.8999, test_f1: 0.5489
 epoch: 67, train_loss: 0.8689, test_loss: 0.9117, test_f1: 0.5470
 epoch: 68, train_loss: 0.8577, test_loss: 0.8980, test_f1: 0.5531
 epoch: 69, train_loss: 0.8600, test_loss: 0.9128, test_f1: 0.5554
 epoch: 70, train_loss: 0.8571, test_loss: 0.9297, test_f1: 0.5504
 epoch: 71, train_loss: 0.8667, test_loss: 0.9102, test_f1: 0.5539
 epoch: 72, train_loss: 0.8600, test_loss: 0.9236, test_f1: 0.5433
 epoch: 73, train_loss: 0.8454, test_loss: 0.9149, test_f1: 0.5540
 epoch: 74, train_loss: 0.8520, test_loss: 0.9056, test_f1: 0.5494
 epoch: 75, train_loss: 0.8562, test_loss: 0.8988, test_f1: 0.5452
 epoch: 76, train_loss: 0.8482, test_loss: 0.9397, test_f1: 0.5343
 epoch: 77, train_loss: 0.8455, test_loss: 0.9155, test_f1: 0.5544
 epoch: 78, train_loss: 0.8407, test_loss: 0.9178, test_f1: 0.5517
 epoch: 79, train_loss: 0.8347, test_loss: 0.9170, test_f1: 0.5600
 epoch: 80, train_loss: 0.8393, test_loss: 0.9179, test_f1: 0.5459
 epoch: 81, train_loss: 0.8442, test_loss: 0.9158, test_f1: 0.5533
 epoch: 82, train_loss: 0.8414, test_loss: 0.9173, test_f1: 0.5619
 epoch: 83, train_loss: 0.8431, test_loss: 0.9257, test_f1: 0.5529
 epoch: 84, train_loss: 0.8383, test_loss: 0.8911, test_f1: 0.5653
 epoch: 85, train_loss: 0.8414, test_loss: 0.9366, test_f1: 0.5460
 epoch: 86, train_loss: 0.8452, test_loss: 0.9033, test_f1: 0.5690
 epoch: 87, train_loss: 0.8275, test_loss: 0.9132, test_f1: 0.5606
 epoch: 88, train_loss: 0.8323, test_loss: 0.9124, test_f1: 0.5607
 epoch: 89, train_loss: 0.8319, test_loss: 0.9067, test_f1: 0.5653
 epoch: 90, train_loss: 0.8445, test_loss: 0.9058, test_f1: 0.5708
 epoch: 91, train_loss: 0.8276, test_loss: 0.9254, test_f1: 0.5465
 epoch: 92, train_loss: 0.8292, test_loss: 0.9090, test_f1: 0.5358
 epoch: 93, train_loss: 0.8323, test_loss: 0.9180, test_f1: 0.5542
 epoch: 94, train_loss: 0.8258, test_loss: 0.9173, test_f1: 0.5591
 epoch: 95, train_loss: 0.8287, test_loss: 0.9017, test_f1: 0.5648
 epoch: 96, train_loss: 0.8230, test_loss: 0.9240, test_f1: 0.5609
 epoch: 97, train_loss: 0.8290, test_loss: 0.9047, test_f1: 0.5639
 epoch: 98, train_loss: 0.8220, test_loss: 0.9280, test_f1: 0.5651
 epoch: 99, train_loss: 0.8113, test_loss: 0.9110, test_f1: 0.5640
##################ITERATION #1 ****************************************
 epoch: 0, train_loss: 1.3747, test_loss: 1.3719, test_f1: 0.2270
 epoch: 1, train_loss: 1.2774, test_loss: 1.3287, test_f1: 0.2270
 epoch: 2, train_loss: 1.2553, test_loss: 1.2949, test_f1: 0.2292
 epoch: 3, train_loss: 1.2213, test_loss: 1.2578, test_f1: 0.2711
 epoch: 4, train_loss: 1.1997, test_loss: 1.2076, test_f1: 0.3490
 epoch: 5, train_loss: 1.1761, test_loss: 1.1449, test_f1: 0.4025
 epoch: 6, train_loss: 1.1482, test_loss: 1.1134, test_f1: 0.4143
 epoch: 7, train_loss: 1.1210, test_loss: 1.0711, test_f1: 0.4357
 epoch: 8, train_loss: 1.0978, test_loss: 1.0373, test_f1: 0.4596
 epoch: 9, train_loss: 1.0704, test_loss: 1.0166, test_f1: 0.4416
 epoch: 10, train_loss: 1.0523, test_loss: 1.0077, test_f1: 0.4658
 epoch: 11, train_loss: 1.0351, test_loss: 0.9704, test_f1: 0.4836
 epoch: 12, train_loss: 1.0219, test_loss: 0.9789, test_f1: 0.4773
 epoch: 13, train_loss: 1.0089, test_loss: 0.9823, test_f1: 0.4649
 epoch: 14, train_loss: 1.0033, test_loss: 0.9714, test_f1: 0.4816
 epoch: 15, train_loss: 0.9914, test_loss: 0.9660, test_f1: 0.4752
 epoch: 16, train_loss: 0.9777, test_loss: 0.9711, test_f1: 0.4758
 epoch: 17, train_loss: 0.9809, test_loss: 0.9574, test_f1: 0.4906
 epoch: 18, train_loss: 0.9699, test_loss: 0.9637, test_f1: 0.4743
 epoch: 19, train_loss: 0.9595, test_loss: 0.9453, test_f1: 0.4968
 epoch: 20, train_loss: 0.9515, test_loss: 0.9606, test_f1: 0.4956
 epoch: 21, train_loss: 0.9523, test_loss: 0.9605, test_f1: 0.4944
 epoch: 22, train_loss: 0.9442, test_loss: 0.9516, test_f1: 0.4919
 epoch: 23, train_loss: 0.9390, test_loss: 0.9636, test_f1: 0.5170
 epoch: 24, train_loss: 0.9294, test_loss: 0.9745, test_f1: 0.4880
 epoch: 25, train_loss: 0.9217, test_loss: 0.9658, test_f1: 0.5088
 epoch: 26, train_loss: 0.9093, test_loss: 0.9582, test_f1: 0.5096
 epoch: 27, train_loss: 0.9195, test_loss: 0.9829, test_f1: 0.4956
 epoch: 28, train_loss: 0.9218, test_loss: 0.9756, test_f1: 0.4934
 epoch: 29, train_loss: 0.9230, test_loss: 0.9731, test_f1: 0.5108
 epoch: 30, train_loss: 0.9108, test_loss: 0.9838, test_f1: 0.4992
 epoch: 31, train_loss: 0.8909, test_loss: 0.9571, test_f1: 0.5038
 epoch: 32, train_loss: 0.8992, test_loss: 0.9620, test_f1: 0.5008
 epoch: 33, train_loss: 0.8935, test_loss: 0.9817, test_f1: 0.5097
 epoch: 34, train_loss: 0.8846, test_loss: 0.9506, test_f1: 0.5174
 epoch: 35, train_loss: 0.8858, test_loss: 0.9866, test_f1: 0.5149
 epoch: 36, train_loss: 0.8911, test_loss: 0.9674, test_f1: 0.5076
 epoch: 37, train_loss: 0.8824, test_loss: 0.9552, test_f1: 0.5192
 epoch: 38, train_loss: 0.8782, test_loss: 1.0043, test_f1: 0.5007
 epoch: 39, train_loss: 0.8752, test_loss: 0.9636, test_f1: 0.5153
 epoch: 40, train_loss: 0.8608, test_loss: 0.9528, test_f1: 0.5280
 epoch: 41, train_loss: 0.8697, test_loss: 0.9933, test_f1: 0.5177
 epoch: 42, train_loss: 0.8677, test_loss: 0.9981, test_f1: 0.5074
 epoch: 43, train_loss: 0.8576, test_loss: 0.9815, test_f1: 0.5077
 epoch: 44, train_loss: 0.8747, test_loss: 1.0025, test_f1: 0.5054
 epoch: 45, train_loss: 0.8560, test_loss: 1.0023, test_f1: 0.5269
 epoch: 46, train_loss: 0.8546, test_loss: 1.0236, test_f1: 0.5272
 epoch: 47, train_loss: 0.8530, test_loss: 0.9568, test_f1: 0.5107
 epoch: 48, train_loss: 0.8414, test_loss: 0.9602, test_f1: 0.5315
 epoch: 49, train_loss: 0.8542, test_loss: 0.9861, test_f1: 0.5122
 epoch: 50, train_loss: 0.8406, test_loss: 0.9988, test_f1: 0.5302
 epoch: 51, train_loss: 0.8518, test_loss: 0.9513, test_f1: 0.5282
 epoch: 52, train_loss: 0.8315, test_loss: 0.9615, test_f1: 0.5348
 epoch: 53, train_loss: 0.8352, test_loss: 0.9940, test_f1: 0.5303
 epoch: 54, train_loss: 0.8303, test_loss: 0.9963, test_f1: 0.5293
 epoch: 55, train_loss: 0.8417, test_loss: 0.9803, test_f1: 0.5259
 epoch: 56, train_loss: 0.8336, test_loss: 0.9791, test_f1: 0.5307
 epoch: 57, train_loss: 0.8362, test_loss: 0.9712, test_f1: 0.5283
 epoch: 58, train_loss: 0.8235, test_loss: 0.9805, test_f1: 0.5322
 epoch: 59, train_loss: 0.8294, test_loss: 0.9915, test_f1: 0.5269
 epoch: 60, train_loss: 0.8150, test_loss: 1.0058, test_f1: 0.5215
 epoch: 61, train_loss: 0.8199, test_loss: 0.9947, test_f1: 0.5311
 epoch: 62, train_loss: 0.8244, test_loss: 0.9798, test_f1: 0.5276
 epoch: 63, train_loss: 0.8259, test_loss: 0.9770, test_f1: 0.5308
 epoch: 64, train_loss: 0.8217, test_loss: 0.9891, test_f1: 0.5293
 epoch: 65, train_loss: 0.8200, test_loss: 1.0110, test_f1: 0.5347
 epoch: 66, train_loss: 0.8140, test_loss: 0.9851, test_f1: 0.5349
 epoch: 67, train_loss: 0.8132, test_loss: 0.9973, test_f1: 0.5257
 epoch: 68, train_loss: 0.8087, test_loss: 0.9894, test_f1: 0.5306
 epoch: 69, train_loss: 0.8119, test_loss: 1.0134, test_f1: 0.5255
 epoch: 70, train_loss: 0.8073, test_loss: 1.0039, test_f1: 0.5307
 epoch: 71, train_loss: 0.8189, test_loss: 0.9818, test_f1: 0.5343
 epoch: 72, train_loss: 0.8202, test_loss: 0.9791, test_f1: 0.5280
 epoch: 73, train_loss: 0.8132, test_loss: 0.9867, test_f1: 0.5375
 epoch: 74, train_loss: 0.8141, test_loss: 1.0066, test_f1: 0.5259
 epoch: 75, train_loss: 0.8167, test_loss: 0.9909, test_f1: 0.5396
 epoch: 76, train_loss: 0.8140, test_loss: 0.9980, test_f1: 0.5380
 epoch: 77, train_loss: 0.8135, test_loss: 0.9899, test_f1: 0.5328
 epoch: 78, train_loss: 0.8091, test_loss: 1.0135, test_f1: 0.5209
 epoch: 79, train_loss: 0.8060, test_loss: 1.0044, test_f1: 0.5228
 epoch: 80, train_loss: 0.8075, test_loss: 0.9938, test_f1: 0.5168
 epoch: 81, train_loss: 0.8128, test_loss: 1.0264, test_f1: 0.5256
 epoch: 82, train_loss: 0.8058, test_loss: 0.9968, test_f1: 0.5264
 epoch: 83, train_loss: 0.8062, test_loss: 1.0170, test_f1: 0.5250
 epoch: 84, train_loss: 0.8022, test_loss: 1.0173, test_f1: 0.5319
 epoch: 85, train_loss: 0.8115, test_loss: 0.9969, test_f1: 0.5320
 epoch: 86, train_loss: 0.7974, test_loss: 1.0185, test_f1: 0.5233
 epoch: 87, train_loss: 0.8013, test_loss: 0.9993, test_f1: 0.5345
 epoch: 88, train_loss: 0.7971, test_loss: 0.9875, test_f1: 0.5227
 epoch: 89, train_loss: 0.7850, test_loss: 1.0038, test_f1: 0.5170
 epoch: 90, train_loss: 0.7997, test_loss: 1.0064, test_f1: 0.5290
 epoch: 91, train_loss: 0.7926, test_loss: 0.9945, test_f1: 0.5256
 epoch: 92, train_loss: 0.7889, test_loss: 0.9635, test_f1: 0.5422
 epoch: 93, train_loss: 0.7835, test_loss: 1.0033, test_f1: 0.5298
 epoch: 94, train_loss: 0.8034, test_loss: 0.9954, test_f1: 0.5244
 epoch: 95, train_loss: 0.7941, test_loss: 1.0093, test_f1: 0.5207
 epoch: 96, train_loss: 0.7975, test_loss: 1.0053, test_f1: 0.5381
 epoch: 97, train_loss: 0.7840, test_loss: 0.9758, test_f1: 0.5425
 epoch: 98, train_loss: 0.7936, test_loss: 1.0217, test_f1: 0.5209
 epoch: 99, train_loss: 0.7877, test_loss: 1.0176, test_f1: 0.5233
##################ITERATION #2 ****************************************
 epoch: 0, train_loss: 1.3217, test_loss: 1.3561, test_f1: 0.2270
 epoch: 1, train_loss: 1.2684, test_loss: 1.3406, test_f1: 0.2270
 epoch: 2, train_loss: 1.2410, test_loss: 1.3100, test_f1: 0.2270
 epoch: 3, train_loss: 1.2171, test_loss: 1.2481, test_f1: 0.2582
 epoch: 4, train_loss: 1.1979, test_loss: 1.1935, test_f1: 0.3586
 epoch: 5, train_loss: 1.1705, test_loss: 1.1337, test_f1: 0.4112
 epoch: 6, train_loss: 1.1551, test_loss: 1.1029, test_f1: 0.4266
 epoch: 7, train_loss: 1.1287, test_loss: 1.0772, test_f1: 0.4474
 epoch: 8, train_loss: 1.1132, test_loss: 1.0528, test_f1: 0.4663
 epoch: 9, train_loss: 1.0886, test_loss: 1.0340, test_f1: 0.4706
 epoch: 10, train_loss: 1.0773, test_loss: 1.0222, test_f1: 0.4937
 epoch: 11, train_loss: 1.0642, test_loss: 1.0210, test_f1: 0.4895
 epoch: 12, train_loss: 1.0509, test_loss: 0.9952, test_f1: 0.5133
 epoch: 13, train_loss: 1.0337, test_loss: 0.9966, test_f1: 0.4770
 epoch: 14, train_loss: 1.0314, test_loss: 0.9749, test_f1: 0.5109
 epoch: 15, train_loss: 1.0105, test_loss: 0.9570, test_f1: 0.5084
 epoch: 16, train_loss: 1.0060, test_loss: 0.9791, test_f1: 0.4886
 epoch: 17, train_loss: 0.9932, test_loss: 0.9485, test_f1: 0.5009
 epoch: 18, train_loss: 0.9723, test_loss: 0.9468, test_f1: 0.5032
 epoch: 19, train_loss: 0.9877, test_loss: 0.9322, test_f1: 0.5215
 epoch: 20, train_loss: 0.9778, test_loss: 0.9521, test_f1: 0.5015
 epoch: 21, train_loss: 0.9661, test_loss: 0.9396, test_f1: 0.4965
 epoch: 22, train_loss: 0.9551, test_loss: 0.9568, test_f1: 0.5063
 epoch: 23, train_loss: 0.9600, test_loss: 0.9265, test_f1: 0.5075
 epoch: 24, train_loss: 0.9445, test_loss: 0.9289, test_f1: 0.5060
 epoch: 25, train_loss: 0.9469, test_loss: 0.9317, test_f1: 0.5081
 epoch: 26, train_loss: 0.9445, test_loss: 0.9454, test_f1: 0.4907
 epoch: 27, train_loss: 0.9315, test_loss: 0.9343, test_f1: 0.5044
 epoch: 28, train_loss: 0.9329, test_loss: 0.9019, test_f1: 0.5185
 epoch: 29, train_loss: 0.9251, test_loss: 0.9378, test_f1: 0.4931
 epoch: 30, train_loss: 0.9220, test_loss: 0.9189, test_f1: 0.4992
 epoch: 31, train_loss: 0.9279, test_loss: 0.9180, test_f1: 0.5242
 epoch: 32, train_loss: 0.9055, test_loss: 0.9094, test_f1: 0.5163
 epoch: 33, train_loss: 0.9103, test_loss: 0.9306, test_f1: 0.5154
 epoch: 34, train_loss: 0.9094, test_loss: 0.9067, test_f1: 0.5052
 epoch: 35, train_loss: 0.9127, test_loss: 0.8907, test_f1: 0.5230
 epoch: 36, train_loss: 0.9127, test_loss: 0.8927, test_f1: 0.5136
 epoch: 37, train_loss: 0.9091, test_loss: 0.9326, test_f1: 0.5183
 epoch: 38, train_loss: 0.8886, test_loss: 0.9191, test_f1: 0.5293
 epoch: 39, train_loss: 0.8917, test_loss: 0.9230, test_f1: 0.5143
 epoch: 40, train_loss: 0.8845, test_loss: 0.8885, test_f1: 0.5347
 epoch: 41, train_loss: 0.8981, test_loss: 0.9136, test_f1: 0.5260
 epoch: 42, train_loss: 0.9066, test_loss: 0.8860, test_f1: 0.5221
 epoch: 43, train_loss: 0.8922, test_loss: 0.9081, test_f1: 0.5044
 epoch: 44, train_loss: 0.8878, test_loss: 0.8757, test_f1: 0.5595
 epoch: 45, train_loss: 0.8878, test_loss: 0.9170, test_f1: 0.5215
 epoch: 46, train_loss: 0.8881, test_loss: 0.9017, test_f1: 0.5084
 epoch: 47, train_loss: 0.8780, test_loss: 0.9014, test_f1: 0.5359
 epoch: 48, train_loss: 0.8735, test_loss: 0.9110, test_f1: 0.5159
 epoch: 49, train_loss: 0.8783, test_loss: 0.9474, test_f1: 0.5137
 epoch: 50, train_loss: 0.8711, test_loss: 0.8797, test_f1: 0.5402
 epoch: 51, train_loss: 0.8738, test_loss: 0.8930, test_f1: 0.5164
 epoch: 52, train_loss: 0.8609, test_loss: 0.8958, test_f1: 0.5129
 epoch: 53, train_loss: 0.8646, test_loss: 0.9234, test_f1: 0.5161
 epoch: 54, train_loss: 0.8566, test_loss: 0.9246, test_f1: 0.5297
 epoch: 55, train_loss: 0.8586, test_loss: 0.9147, test_f1: 0.5234
 epoch: 56, train_loss: 0.8511, test_loss: 0.8929, test_f1: 0.5265
 epoch: 57, train_loss: 0.8584, test_loss: 0.9112, test_f1: 0.5257
 epoch: 58, train_loss: 0.8507, test_loss: 0.9022, test_f1: 0.5276
 epoch: 59, train_loss: 0.8411, test_loss: 0.8812, test_f1: 0.5294
 epoch: 60, train_loss: 0.8570, test_loss: 0.9072, test_f1: 0.5241
 epoch: 61, train_loss: 0.8440, test_loss: 0.9030, test_f1: 0.5250
 epoch: 62, train_loss: 0.8373, test_loss: 0.9234, test_f1: 0.5403
 epoch: 63, train_loss: 0.8474, test_loss: 0.8818, test_f1: 0.5303
 epoch: 64, train_loss: 0.8478, test_loss: 0.9017, test_f1: 0.5265
 epoch: 65, train_loss: 0.8370, test_loss: 0.8951, test_f1: 0.5221
 epoch: 66, train_loss: 0.8370, test_loss: 0.8922, test_f1: 0.5320
 epoch: 67, train_loss: 0.8402, test_loss: 0.8958, test_f1: 0.5275
 epoch: 68, train_loss: 0.8364, test_loss: 0.8961, test_f1: 0.5273
 epoch: 69, train_loss: 0.8646, test_loss: 0.9099, test_f1: 0.5322
 epoch: 70, train_loss: 0.8508, test_loss: 0.9270, test_f1: 0.5564
 epoch: 71, train_loss: 0.8406, test_loss: 0.9149, test_f1: 0.5348
 epoch: 72, train_loss: 0.8397, test_loss: 0.9152, test_f1: 0.5517
 epoch: 73, train_loss: 0.8447, test_loss: 0.9182, test_f1: 0.5459
 epoch: 74, train_loss: 0.8365, test_loss: 0.9225, test_f1: 0.5504
 epoch: 75, train_loss: 0.8296, test_loss: 0.9154, test_f1: 0.5326
 epoch: 76, train_loss: 0.8327, test_loss: 0.9327, test_f1: 0.5463
 epoch: 77, train_loss: 0.8335, test_loss: 0.9303, test_f1: 0.5399
 epoch: 78, train_loss: 0.8247, test_loss: 0.9260, test_f1: 0.5604
 epoch: 79, train_loss: 0.8405, test_loss: 0.9153, test_f1: 0.5577
 epoch: 80, train_loss: 0.8308, test_loss: 0.9474, test_f1: 0.5471
 epoch: 81, train_loss: 0.8140, test_loss: 0.9352, test_f1: 0.5446
 epoch: 82, train_loss: 0.8216, test_loss: 0.9217, test_f1: 0.5500
 epoch: 83, train_loss: 0.8282, test_loss: 0.9282, test_f1: 0.5551
 epoch: 84, train_loss: 0.8250, test_loss: 0.9272, test_f1: 0.5560
 epoch: 85, train_loss: 0.8330, test_loss: 0.9179, test_f1: 0.5463
 epoch: 86, train_loss: 0.8219, test_loss: 0.9267, test_f1: 0.5313
 epoch: 87, train_loss: 0.8178, test_loss: 0.9202, test_f1: 0.5493
 epoch: 88, train_loss: 0.8196, test_loss: 0.9301, test_f1: 0.5463
 epoch: 89, train_loss: 0.8333, test_loss: 0.9209, test_f1: 0.5434
 epoch: 90, train_loss: 0.8205, test_loss: 0.9399, test_f1: 0.5506
 epoch: 91, train_loss: 0.8227, test_loss: 0.9446, test_f1: 0.5462
 epoch: 92, train_loss: 0.8331, test_loss: 0.9725, test_f1: 0.5221
 epoch: 93, train_loss: 0.8141, test_loss: 0.9815, test_f1: 0.5201
 epoch: 94, train_loss: 0.8288, test_loss: 0.9788, test_f1: 0.5221
 epoch: 95, train_loss: 0.8144, test_loss: 0.9575, test_f1: 0.5478
 epoch: 96, train_loss: 0.8202, test_loss: 0.9501, test_f1: 0.5459
 epoch: 97, train_loss: 0.8019, test_loss: 0.9640, test_f1: 0.5387
 epoch: 98, train_loss: 0.8143, test_loss: 0.9542, test_f1: 0.5267
 epoch: 99, train_loss: 0.8113, test_loss: 0.9554, test_f1: 0.5404
##################ITERATION #3 ****************************************
 epoch: 0, train_loss: 1.3169, test_loss: 1.3053, test_f1: 0.2270
 epoch: 1, train_loss: 1.2298, test_loss: 1.2966, test_f1: 0.2270
 epoch: 2, train_loss: 1.2017, test_loss: 1.2551, test_f1: 0.2798
 epoch: 3, train_loss: 1.1862, test_loss: 1.1901, test_f1: 0.3278
 epoch: 4, train_loss: 1.1593, test_loss: 1.1310, test_f1: 0.3980
 epoch: 5, train_loss: 1.1345, test_loss: 1.0899, test_f1: 0.4172
 epoch: 6, train_loss: 1.1166, test_loss: 1.0752, test_f1: 0.4269
 epoch: 7, train_loss: 1.0955, test_loss: 1.0647, test_f1: 0.4428
 epoch: 8, train_loss: 1.0865, test_loss: 1.0575, test_f1: 0.4392
 epoch: 9, train_loss: 1.0597, test_loss: 1.0603, test_f1: 0.4418
 epoch: 10, train_loss: 1.0501, test_loss: 1.0266, test_f1: 0.4572
 epoch: 11, train_loss: 1.0475, test_loss: 1.0378, test_f1: 0.4618
 epoch: 12, train_loss: 1.0452, test_loss: 1.0323, test_f1: 0.4683
 epoch: 13, train_loss: 1.0320, test_loss: 1.0340, test_f1: 0.4583
 epoch: 14, train_loss: 1.0187, test_loss: 1.0170, test_f1: 0.4753
 epoch: 15, train_loss: 1.0049, test_loss: 1.0272, test_f1: 0.4800
 epoch: 16, train_loss: 1.0044, test_loss: 1.0141, test_f1: 0.4842
 epoch: 17, train_loss: 0.9965, test_loss: 1.0239, test_f1: 0.4662
 epoch: 18, train_loss: 0.9896, test_loss: 1.0157, test_f1: 0.4954
 epoch: 19, train_loss: 0.9835, test_loss: 1.0196, test_f1: 0.5018
 epoch: 20, train_loss: 0.9749, test_loss: 1.0105, test_f1: 0.4752
 epoch: 21, train_loss: 0.9698, test_loss: 1.0194, test_f1: 0.5165
 epoch: 22, train_loss: 0.9622, test_loss: 1.0342, test_f1: 0.4700
 epoch: 23, train_loss: 0.9650, test_loss: 1.0262, test_f1: 0.4998
 epoch: 24, train_loss: 0.9623, test_loss: 1.0221, test_f1: 0.4674
 epoch: 25, train_loss: 0.9554, test_loss: 1.0188, test_f1: 0.4883
 epoch: 26, train_loss: 0.9552, test_loss: 1.0244, test_f1: 0.4885
 epoch: 27, train_loss: 0.9558, test_loss: 1.0075, test_f1: 0.5401
 epoch: 28, train_loss: 0.9575, test_loss: 1.0011, test_f1: 0.4898
 epoch: 29, train_loss: 0.9531, test_loss: 1.0123, test_f1: 0.4854
 epoch: 30, train_loss: 0.9465, test_loss: 1.0094, test_f1: 0.5289
 epoch: 31, train_loss: 0.9531, test_loss: 1.0241, test_f1: 0.5331
 epoch: 32, train_loss: 0.9382, test_loss: 0.9990, test_f1: 0.5179
 epoch: 33, train_loss: 0.9314, test_loss: 0.9735, test_f1: 0.5093
 epoch: 34, train_loss: 0.9281, test_loss: 0.9854, test_f1: 0.5077
 epoch: 35, train_loss: 0.9196, test_loss: 0.9905, test_f1: 0.5291
 epoch: 36, train_loss: 0.9178, test_loss: 0.9977, test_f1: 0.5130
 epoch: 37, train_loss: 0.9103, test_loss: 1.0067, test_f1: 0.5069
 epoch: 38, train_loss: 0.9191, test_loss: 0.9860, test_f1: 0.4998
 epoch: 39, train_loss: 0.9019, test_loss: 0.9938, test_f1: 0.5224
 epoch: 40, train_loss: 0.9008, test_loss: 1.0167, test_f1: 0.5181
 epoch: 41, train_loss: 0.9034, test_loss: 0.9928, test_f1: 0.5124
 epoch: 42, train_loss: 0.9042, test_loss: 1.0050, test_f1: 0.5244
 epoch: 43, train_loss: 0.8983, test_loss: 1.0603, test_f1: 0.4886
 epoch: 44, train_loss: 0.8989, test_loss: 0.9869, test_f1: 0.5233
 epoch: 45, train_loss: 0.9010, test_loss: 1.0133, test_f1: 0.5215
 epoch: 46, train_loss: 0.8978, test_loss: 0.9748, test_f1: 0.5282
 epoch: 47, train_loss: 0.9060, test_loss: 1.0071, test_f1: 0.5170
 epoch: 48, train_loss: 0.8965, test_loss: 0.9493, test_f1: 0.5766
 epoch: 49, train_loss: 0.8952, test_loss: 1.0194, test_f1: 0.5186
 epoch: 50, train_loss: 0.8889, test_loss: 0.9968, test_f1: 0.5186
 epoch: 51, train_loss: 0.8822, test_loss: 0.9663, test_f1: 0.5345
 epoch: 52, train_loss: 0.8843, test_loss: 0.9784, test_f1: 0.5283
 epoch: 53, train_loss: 0.8756, test_loss: 0.9741, test_f1: 0.5228
 epoch: 54, train_loss: 0.8814, test_loss: 0.9908, test_f1: 0.5318
 epoch: 55, train_loss: 0.8781, test_loss: 0.9930, test_f1: 0.5245
 epoch: 56, train_loss: 0.8816, test_loss: 0.9727, test_f1: 0.5186
 epoch: 57, train_loss: 0.8530, test_loss: 0.9908, test_f1: 0.5294
 epoch: 58, train_loss: 0.8676, test_loss: 0.9700, test_f1: 0.5347
 epoch: 59, train_loss: 0.8605, test_loss: 0.9865, test_f1: 0.5325
 epoch: 60, train_loss: 0.8764, test_loss: 0.9738, test_f1: 0.5294
 epoch: 61, train_loss: 0.8723, test_loss: 0.9975, test_f1: 0.5171
 epoch: 62, train_loss: 0.8645, test_loss: 0.9831, test_f1: 0.5263
 epoch: 63, train_loss: 0.8668, test_loss: 1.0001, test_f1: 0.5206
 epoch: 64, train_loss: 0.8644, test_loss: 1.0143, test_f1: 0.5236
 epoch: 65, train_loss: 0.8648, test_loss: 0.9924, test_f1: 0.5235
 epoch: 66, train_loss: 0.8655, test_loss: 0.9891, test_f1: 0.5232
 epoch: 67, train_loss: 0.8608, test_loss: 0.9962, test_f1: 0.5299
 epoch: 68, train_loss: 0.8455, test_loss: 0.9775, test_f1: 0.5262
 epoch: 69, train_loss: 0.8699, test_loss: 0.9961, test_f1: 0.5267
 epoch: 70, train_loss: 0.8572, test_loss: 1.0023, test_f1: 0.5219
 epoch: 71, train_loss: 0.8552, test_loss: 0.9900, test_f1: 0.5328
 epoch: 72, train_loss: 0.8432, test_loss: 0.9811, test_f1: 0.5224
 epoch: 73, train_loss: 0.8414, test_loss: 1.0079, test_f1: 0.5217
 epoch: 74, train_loss: 0.8466, test_loss: 0.9810, test_f1: 0.5217
 epoch: 75, train_loss: 0.8558, test_loss: 0.9783, test_f1: 0.5304
 epoch: 76, train_loss: 0.8432, test_loss: 0.9878, test_f1: 0.5296
 epoch: 77, train_loss: 0.8454, test_loss: 0.9826, test_f1: 0.5294
 epoch: 78, train_loss: 0.8408, test_loss: 0.9930, test_f1: 0.5049
 epoch: 79, train_loss: 0.8451, test_loss: 0.9877, test_f1: 0.5150
 epoch: 80, train_loss: 0.8510, test_loss: 1.0008, test_f1: 0.5266
 epoch: 81, train_loss: 0.8428, test_loss: 0.9901, test_f1: 0.5275
 epoch: 82, train_loss: 0.8298, test_loss: 0.9962, test_f1: 0.5196
 epoch: 83, train_loss: 0.8418, test_loss: 0.9819, test_f1: 0.5164
 epoch: 84, train_loss: 0.8335, test_loss: 0.9952, test_f1: 0.5239
 epoch: 85, train_loss: 0.8442, test_loss: 0.9974, test_f1: 0.5329
 epoch: 86, train_loss: 0.8343, test_loss: 0.9861, test_f1: 0.5278
 epoch: 87, train_loss: 0.8393, test_loss: 1.0028, test_f1: 0.5154
 epoch: 88, train_loss: 0.8425, test_loss: 0.9905, test_f1: 0.5309
 epoch: 89, train_loss: 0.8419, test_loss: 0.9871, test_f1: 0.5261
 epoch: 90, train_loss: 0.8333, test_loss: 0.9852, test_f1: 0.5277
 epoch: 91, train_loss: 0.8281, test_loss: 0.9916, test_f1: 0.5303
 epoch: 92, train_loss: 0.8440, test_loss: 1.0102, test_f1: 0.5231
 epoch: 93, train_loss: 0.8288, test_loss: 0.9923, test_f1: 0.5229
 epoch: 94, train_loss: 0.8280, test_loss: 0.9787, test_f1: 0.5053
 epoch: 95, train_loss: 0.8260, test_loss: 0.9761, test_f1: 0.5256
 epoch: 96, train_loss: 0.8336, test_loss: 0.9944, test_f1: 0.5266
 epoch: 97, train_loss: 0.8278, test_loss: 0.9954, test_f1: 0.5078
 epoch: 98, train_loss: 0.8240, test_loss: 0.9949, test_f1: 0.5309
 epoch: 99, train_loss: 0.8196, test_loss: 0.9875, test_f1: 0.5196
##################ITERATION #4 ****************************************
 epoch: 0, train_loss: 1.2933, test_loss: 1.3555, test_f1: 0.2270
 epoch: 1, train_loss: 1.2195, test_loss: 1.3219, test_f1: 0.2270
 epoch: 2, train_loss: 1.2072, test_loss: 1.2704, test_f1: 0.2270
 epoch: 3, train_loss: 1.1825, test_loss: 1.2245, test_f1: 0.2270
 epoch: 4, train_loss: 1.1585, test_loss: 1.1789, test_f1: 0.2449
 epoch: 5, train_loss: 1.1403, test_loss: 1.1255, test_f1: 0.3630
 epoch: 6, train_loss: 1.1245, test_loss: 1.0889, test_f1: 0.4185
 epoch: 7, train_loss: 1.1129, test_loss: 1.0608, test_f1: 0.4646
 epoch: 8, train_loss: 1.0924, test_loss: 1.0473, test_f1: 0.4669
 epoch: 9, train_loss: 1.0737, test_loss: 1.0185, test_f1: 0.4894
 epoch: 10, train_loss: 1.0574, test_loss: 0.9910, test_f1: 0.4948
 epoch: 11, train_loss: 1.0340, test_loss: 0.9866, test_f1: 0.4909
 epoch: 12, train_loss: 1.0193, test_loss: 0.9903, test_f1: 0.4975
 epoch: 13, train_loss: 1.0252, test_loss: 0.9715, test_f1: 0.5249
 epoch: 14, train_loss: 1.0042, test_loss: 0.9674, test_f1: 0.4953
 epoch: 15, train_loss: 0.9995, test_loss: 0.9875, test_f1: 0.4694
 epoch: 16, train_loss: 0.9856, test_loss: 0.9547, test_f1: 0.5016
 epoch: 17, train_loss: 0.9721, test_loss: 0.9552, test_f1: 0.4871
 epoch: 18, train_loss: 0.9706, test_loss: 0.9382, test_f1: 0.5150
 epoch: 19, train_loss: 0.9640, test_loss: 0.9277, test_f1: 0.5129
 epoch: 20, train_loss: 0.9572, test_loss: 0.9343, test_f1: 0.5085
 epoch: 21, train_loss: 0.9465, test_loss: 0.9478, test_f1: 0.4981
 epoch: 22, train_loss: 0.9361, test_loss: 0.9301, test_f1: 0.5079
 epoch: 23, train_loss: 0.9360, test_loss: 0.9374, test_f1: 0.5254
 epoch: 24, train_loss: 0.9227, test_loss: 0.9387, test_f1: 0.5244
 epoch: 25, train_loss: 0.9180, test_loss: 0.9328, test_f1: 0.5432
 epoch: 26, train_loss: 0.9196, test_loss: 0.9143, test_f1: 0.5502
 epoch: 27, train_loss: 0.9160, test_loss: 0.9407, test_f1: 0.5443
 epoch: 28, train_loss: 0.9176, test_loss: 0.9796, test_f1: 0.5417
 epoch: 29, train_loss: 0.9220, test_loss: 0.9531, test_f1: 0.5298
 epoch: 30, train_loss: 0.9071, test_loss: 0.9497, test_f1: 0.5378
 epoch: 31, train_loss: 0.9049, test_loss: 0.9517, test_f1: 0.5405
 epoch: 32, train_loss: 0.8972, test_loss: 0.9613, test_f1: 0.5337
 epoch: 33, train_loss: 0.8946, test_loss: 0.9223, test_f1: 0.5404
 epoch: 34, train_loss: 0.8777, test_loss: 0.9197, test_f1: 0.5551
 epoch: 35, train_loss: 0.8752, test_loss: 0.9897, test_f1: 0.5431
 epoch: 36, train_loss: 0.8765, test_loss: 0.9464, test_f1: 0.5372
 epoch: 37, train_loss: 0.8814, test_loss: 0.9296, test_f1: 0.5265
 epoch: 38, train_loss: 0.8710, test_loss: 0.9464, test_f1: 0.5380
 epoch: 39, train_loss: 0.8860, test_loss: 0.9529, test_f1: 0.5395
 epoch: 40, train_loss: 0.8605, test_loss: 0.9610, test_f1: 0.5461
 epoch: 41, train_loss: 0.8763, test_loss: 0.9533, test_f1: 0.5580
 epoch: 42, train_loss: 0.8670, test_loss: 0.9406, test_f1: 0.5659
 epoch: 43, train_loss: 0.8678, test_loss: 0.9470, test_f1: 0.5460
 epoch: 44, train_loss: 0.8638, test_loss: 0.9602, test_f1: 0.5632
 epoch: 45, train_loss: 0.8579, test_loss: 0.9440, test_f1: 0.5464
 epoch: 46, train_loss: 0.8614, test_loss: 0.9657, test_f1: 0.5525
 epoch: 47, train_loss: 0.8575, test_loss: 0.9461, test_f1: 0.5475
 epoch: 48, train_loss: 0.8451, test_loss: 0.9529, test_f1: 0.5550
 epoch: 49, train_loss: 0.8489, test_loss: 0.9658, test_f1: 0.5451
 epoch: 50, train_loss: 0.8387, test_loss: 0.9631, test_f1: 0.5489
 epoch: 51, train_loss: 0.8382, test_loss: 0.9473, test_f1: 0.5446
 epoch: 52, train_loss: 0.8283, test_loss: 0.9402, test_f1: 0.5581
 epoch: 53, train_loss: 0.8258, test_loss: 0.9478, test_f1: 0.5665
 epoch: 54, train_loss: 0.8344, test_loss: 0.9417, test_f1: 0.5698
 epoch: 55, train_loss: 0.8270, test_loss: 0.9430, test_f1: 0.5794
 epoch: 56, train_loss: 0.8258, test_loss: 0.9499, test_f1: 0.5548
 epoch: 57, train_loss: 0.8332, test_loss: 0.9484, test_f1: 0.5508
 epoch: 58, train_loss: 0.8167, test_loss: 0.9444, test_f1: 0.5697
 epoch: 59, train_loss: 0.8165, test_loss: 0.9480, test_f1: 0.5570
 epoch: 60, train_loss: 0.8088, test_loss: 0.9493, test_f1: 0.5867
 epoch: 61, train_loss: 0.8062, test_loss: 0.9496, test_f1: 0.5593
 epoch: 62, train_loss: 0.8149, test_loss: 0.9472, test_f1: 0.5600
 epoch: 63, train_loss: 0.8024, test_loss: 0.9499, test_f1: 0.5553
 epoch: 64, train_loss: 0.8171, test_loss: 0.9507, test_f1: 0.5665
 epoch: 65, train_loss: 0.8200, test_loss: 0.9661, test_f1: 0.5643
 epoch: 66, train_loss: 0.8094, test_loss: 0.9603, test_f1: 0.5557
 epoch: 67, train_loss: 0.8109, test_loss: 0.9506, test_f1: 0.5595
 epoch: 68, train_loss: 0.8024, test_loss: 0.9390, test_f1: 0.5690
 epoch: 69, train_loss: 0.8175, test_loss: 0.9518, test_f1: 0.5649
 epoch: 70, train_loss: 0.8021, test_loss: 0.9619, test_f1: 0.5789
 epoch: 71, train_loss: 0.8004, test_loss: 0.9684, test_f1: 0.5608
 epoch: 72, train_loss: 0.8020, test_loss: 0.9444, test_f1: 0.5616
 epoch: 73, train_loss: 0.7966, test_loss: 0.9516, test_f1: 0.5597
 epoch: 74, train_loss: 0.7981, test_loss: 0.9466, test_f1: 0.5552
 epoch: 75, train_loss: 0.7964, test_loss: 0.9703, test_f1: 0.5576
 epoch: 76, train_loss: 0.7942, test_loss: 0.9705, test_f1: 0.5580
 epoch: 77, train_loss: 0.7956, test_loss: 0.9625, test_f1: 0.5597
 epoch: 78, train_loss: 0.7885, test_loss: 0.9987, test_f1: 0.5433
 epoch: 79, train_loss: 0.7930, test_loss: 0.9722, test_f1: 0.5494
 epoch: 80, train_loss: 0.7839, test_loss: 0.9502, test_f1: 0.5776
 epoch: 81, train_loss: 0.7938, test_loss: 0.9837, test_f1: 0.5660
 epoch: 82, train_loss: 0.7890, test_loss: 0.9685, test_f1: 0.5690
 epoch: 83, train_loss: 0.7893, test_loss: 0.9631, test_f1: 0.5638
 epoch: 84, train_loss: 0.7786, test_loss: 0.9691, test_f1: 0.5681
 epoch: 85, train_loss: 0.7823, test_loss: 0.9842, test_f1: 0.5739
 epoch: 86, train_loss: 0.7841, test_loss: 0.9845, test_f1: 0.5649
 epoch: 87, train_loss: 0.7810, test_loss: 0.9884, test_f1: 0.5646
 epoch: 88, train_loss: 0.7813, test_loss: 0.9701, test_f1: 0.5558
 epoch: 89, train_loss: 0.7838, test_loss: 0.9761, test_f1: 0.5576
 epoch: 90, train_loss: 0.7862, test_loss: 0.9778, test_f1: 0.5547
 epoch: 91, train_loss: 0.7854, test_loss: 0.9988, test_f1: 0.5583
 epoch: 92, train_loss: 0.7775, test_loss: 0.9935, test_f1: 0.5477
 epoch: 93, train_loss: 0.7844, test_loss: 0.9868, test_f1: 0.5585
 epoch: 94, train_loss: 0.7817, test_loss: 0.9795, test_f1: 0.5465
 epoch: 95, train_loss: 0.7708, test_loss: 0.9816, test_f1: 0.5595
 epoch: 96, train_loss: 0.7836, test_loss: 0.9915, test_f1: 0.5635
 epoch: 97, train_loss: 0.7794, test_loss: 1.0197, test_f1: 0.5570
 epoch: 98, train_loss: 0.7732, test_loss: 0.9894, test_f1: 0.5430
 epoch: 99, train_loss: 0.7769, test_loss: 0.9865, test_f1: 0.5560
##################ITERATION #5 ****************************************
 epoch: 0, train_loss: 1.3153, test_loss: 1.3274, test_f1: 0.2270
 epoch: 1, train_loss: 1.2076, test_loss: 1.2956, test_f1: 0.2270
 epoch: 2, train_loss: 1.1878, test_loss: 1.2544, test_f1: 0.2270
 epoch: 3, train_loss: 1.1541, test_loss: 1.1443, test_f1: 0.3820
 epoch: 4, train_loss: 1.1288, test_loss: 1.0942, test_f1: 0.4231
 epoch: 5, train_loss: 1.1024, test_loss: 1.0530, test_f1: 0.4510
 epoch: 6, train_loss: 1.0693, test_loss: 1.0098, test_f1: 0.4479
 epoch: 7, train_loss: 1.0638, test_loss: 0.9979, test_f1: 0.4576
 epoch: 8, train_loss: 1.0452, test_loss: 0.9769, test_f1: 0.4669
 epoch: 9, train_loss: 1.0403, test_loss: 0.9733, test_f1: 0.4644
 epoch: 10, train_loss: 1.0183, test_loss: 0.9807, test_f1: 0.4702
 epoch: 11, train_loss: 1.0184, test_loss: 0.9940, test_f1: 0.4604
 epoch: 12, train_loss: 1.0169, test_loss: 0.9831, test_f1: 0.4661
 epoch: 13, train_loss: 0.9982, test_loss: 0.9772, test_f1: 0.4853
 epoch: 14, train_loss: 0.9916, test_loss: 0.9809, test_f1: 0.4833
 epoch: 15, train_loss: 0.9946, test_loss: 0.9782, test_f1: 0.4876
 epoch: 16, train_loss: 0.9855, test_loss: 1.0274, test_f1: 0.4577
 epoch: 17, train_loss: 0.9884, test_loss: 0.9896, test_f1: 0.4834
 epoch: 18, train_loss: 0.9844, test_loss: 0.9684, test_f1: 0.4808
 epoch: 19, train_loss: 0.9890, test_loss: 0.9802, test_f1: 0.4620
 epoch: 20, train_loss: 0.9743, test_loss: 1.0036, test_f1: 0.4729
 epoch: 21, train_loss: 0.9588, test_loss: 0.9794, test_f1: 0.4827
 epoch: 22, train_loss: 0.9567, test_loss: 0.9795, test_f1: 0.4917
 epoch: 23, train_loss: 0.9471, test_loss: 0.9953, test_f1: 0.4665
 epoch: 24, train_loss: 0.9565, test_loss: 0.9709, test_f1: 0.5012
 epoch: 25, train_loss: 0.9543, test_loss: 0.9599, test_f1: 0.4966
 epoch: 26, train_loss: 0.9370, test_loss: 0.9521, test_f1: 0.5078
 epoch: 27, train_loss: 0.9441, test_loss: 0.9577, test_f1: 0.5003
 epoch: 28, train_loss: 0.9430, test_loss: 0.9562, test_f1: 0.4961
 epoch: 29, train_loss: 0.9367, test_loss: 0.9740, test_f1: 0.5049
 epoch: 30, train_loss: 0.9384, test_loss: 0.9745, test_f1: 0.5081
 epoch: 31, train_loss: 0.9345, test_loss: 0.9773, test_f1: 0.5045
 epoch: 32, train_loss: 0.9225, test_loss: 0.9915, test_f1: 0.4819
 epoch: 33, train_loss: 0.9145, test_loss: 0.9462, test_f1: 0.5083
 epoch: 34, train_loss: 0.9216, test_loss: 0.9656, test_f1: 0.5025
 epoch: 35, train_loss: 0.9105, test_loss: 0.9685, test_f1: 0.5104
 epoch: 36, train_loss: 0.9082, test_loss: 0.9681, test_f1: 0.5121
 epoch: 37, train_loss: 0.9066, test_loss: 0.9663, test_f1: 0.5059
 epoch: 38, train_loss: 0.9225, test_loss: 0.9446, test_f1: 0.5191
 epoch: 39, train_loss: 0.9169, test_loss: 0.9505, test_f1: 0.5155
 epoch: 40, train_loss: 0.9000, test_loss: 0.9571, test_f1: 0.5128
 epoch: 41, train_loss: 0.9079, test_loss: 0.9754, test_f1: 0.5141
 epoch: 42, train_loss: 0.9128, test_loss: 0.9737, test_f1: 0.5107
 epoch: 43, train_loss: 0.9078, test_loss: 0.9291, test_f1: 0.5069
 epoch: 44, train_loss: 0.8942, test_loss: 0.9495, test_f1: 0.5178
 epoch: 45, train_loss: 0.8950, test_loss: 0.9350, test_f1: 0.5224
 epoch: 46, train_loss: 0.8880, test_loss: 0.9421, test_f1: 0.5155
 epoch: 47, train_loss: 0.8912, test_loss: 0.9430, test_f1: 0.5224
 epoch: 48, train_loss: 0.8820, test_loss: 0.9358, test_f1: 0.5131
 epoch: 49, train_loss: 0.8797, test_loss: 0.9548, test_f1: 0.5277
 epoch: 50, train_loss: 0.8723, test_loss: 0.9442, test_f1: 0.5249
 epoch: 51, train_loss: 0.8760, test_loss: 0.9238, test_f1: 0.5329
 epoch: 52, train_loss: 0.8642, test_loss: 0.9175, test_f1: 0.5311
 epoch: 53, train_loss: 0.8724, test_loss: 0.9355, test_f1: 0.5420
 epoch: 54, train_loss: 0.8659, test_loss: 0.9365, test_f1: 0.5419
 epoch: 55, train_loss: 0.8811, test_loss: 0.9492, test_f1: 0.5403
 epoch: 56, train_loss: 0.8603, test_loss: 0.9453, test_f1: 0.5395
 epoch: 57, train_loss: 0.8598, test_loss: 0.9424, test_f1: 0.5391
 epoch: 58, train_loss: 0.8604, test_loss: 0.9308, test_f1: 0.5378
 epoch: 59, train_loss: 0.8590, test_loss: 0.9374, test_f1: 0.5412
 epoch: 60, train_loss: 0.8551, test_loss: 0.9243, test_f1: 0.5384
 epoch: 61, train_loss: 0.8613, test_loss: 0.9508, test_f1: 0.5290
 epoch: 62, train_loss: 0.8606, test_loss: 0.9522, test_f1: 0.5300
 epoch: 63, train_loss: 0.8570, test_loss: 0.9246, test_f1: 0.5393
 epoch: 64, train_loss: 0.8563, test_loss: 0.9470, test_f1: 0.5245
 epoch: 65, train_loss: 0.8456, test_loss: 0.9362, test_f1: 0.5336
 epoch: 66, train_loss: 0.8538, test_loss: 0.9432, test_f1: 0.5401
 epoch: 67, train_loss: 0.8510, test_loss: 0.9200, test_f1: 0.5389
 epoch: 68, train_loss: 0.8532, test_loss: 0.9397, test_f1: 0.5320
 epoch: 69, train_loss: 0.8397, test_loss: 0.9493, test_f1: 0.5338
 epoch: 70, train_loss: 0.8431, test_loss: 0.9379, test_f1: 0.5223
 epoch: 71, train_loss: 0.8411, test_loss: 0.9327, test_f1: 0.5389
 epoch: 72, train_loss: 0.8418, test_loss: 0.9355, test_f1: 0.5427
 epoch: 73, train_loss: 0.8405, test_loss: 0.9284, test_f1: 0.5376
 epoch: 74, train_loss: 0.8386, test_loss: 0.9453, test_f1: 0.5318
 epoch: 75, train_loss: 0.8330, test_loss: 0.9350, test_f1: 0.5351
 epoch: 76, train_loss: 0.8322, test_loss: 0.9330, test_f1: 0.5289
 epoch: 77, train_loss: 0.8380, test_loss: 0.9565, test_f1: 0.5390
 epoch: 78, train_loss: 0.8334, test_loss: 0.9278, test_f1: 0.5325
 epoch: 79, train_loss: 0.8564, test_loss: 0.9634, test_f1: 0.5363
 epoch: 80, train_loss: 0.8380, test_loss: 0.9283, test_f1: 0.5503
 epoch: 81, train_loss: 0.8378, test_loss: 0.9391, test_f1: 0.5445
 epoch: 82, train_loss: 0.8199, test_loss: 0.9293, test_f1: 0.5418
 epoch: 83, train_loss: 0.8271, test_loss: 0.9395, test_f1: 0.5342
 epoch: 84, train_loss: 0.8239, test_loss: 0.9463, test_f1: 0.5354
 epoch: 85, train_loss: 0.8366, test_loss: 0.9291, test_f1: 0.5445
 epoch: 86, train_loss: 0.8422, test_loss: 0.9435, test_f1: 0.5356
 epoch: 87, train_loss: 0.8269, test_loss: 0.9269, test_f1: 0.5462
 epoch: 88, train_loss: 0.8313, test_loss: 0.9499, test_f1: 0.5348
 epoch: 89, train_loss: 0.8264, test_loss: 0.9457, test_f1: 0.5435
 epoch: 90, train_loss: 0.8250, test_loss: 0.9375, test_f1: 0.5483
 epoch: 91, train_loss: 0.8237, test_loss: 0.9491, test_f1: 0.5439
 epoch: 92, train_loss: 0.8277, test_loss: 0.9534, test_f1: 0.5356
 epoch: 93, train_loss: 0.8182, test_loss: 0.9558, test_f1: 0.5401
 epoch: 94, train_loss: 0.8210, test_loss: 0.9562, test_f1: 0.5434
 epoch: 95, train_loss: 0.8163, test_loss: 0.9612, test_f1: 0.5360
 epoch: 96, train_loss: 0.8153, test_loss: 0.9531, test_f1: 0.5425
 epoch: 97, train_loss: 0.8203, test_loss: 0.9455, test_f1: 0.5459
 epoch: 98, train_loss: 0.8168, test_loss: 0.9503, test_f1: 0.5391
 epoch: 99, train_loss: 0.8149, test_loss: 0.9516, test_f1: 0.5460
##################ITERATION #6 ****************************************
 epoch: 0, train_loss: 1.4032, test_loss: 1.3013, test_f1: 0.2270
 epoch: 1, train_loss: 1.2407, test_loss: 1.2713, test_f1: 0.2270
 epoch: 2, train_loss: 1.2115, test_loss: 1.2319, test_f1: 0.2703
 epoch: 3, train_loss: 1.1784, test_loss: 1.1832, test_f1: 0.3166
 epoch: 4, train_loss: 1.1616, test_loss: 1.1228, test_f1: 0.3522
 epoch: 5, train_loss: 1.1362, test_loss: 1.0804, test_f1: 0.3967
 epoch: 6, train_loss: 1.1205, test_loss: 1.0483, test_f1: 0.4389
 epoch: 7, train_loss: 1.1120, test_loss: 1.0212, test_f1: 0.4674
 epoch: 8, train_loss: 1.0864, test_loss: 1.0051, test_f1: 0.4766
 epoch: 9, train_loss: 1.0754, test_loss: 0.9878, test_f1: 0.4890
 epoch: 10, train_loss: 1.0634, test_loss: 0.9731, test_f1: 0.4944
 epoch: 11, train_loss: 1.0531, test_loss: 0.9662, test_f1: 0.4882
 epoch: 12, train_loss: 1.0390, test_loss: 0.9614, test_f1: 0.4903
 epoch: 13, train_loss: 1.0286, test_loss: 0.9547, test_f1: 0.4874
 epoch: 14, train_loss: 1.0218, test_loss: 0.9467, test_f1: 0.4944
 epoch: 15, train_loss: 1.0062, test_loss: 0.9513, test_f1: 0.4855
 epoch: 16, train_loss: 1.0007, test_loss: 0.9418, test_f1: 0.4851
 epoch: 17, train_loss: 0.9980, test_loss: 0.9402, test_f1: 0.4932
 epoch: 18, train_loss: 0.9914, test_loss: 0.9262, test_f1: 0.5025
 epoch: 19, train_loss: 0.9909, test_loss: 0.9298, test_f1: 0.4953
 epoch: 20, train_loss: 0.9789, test_loss: 0.9309, test_f1: 0.4980
 epoch: 21, train_loss: 0.9774, test_loss: 0.9384, test_f1: 0.5009
 epoch: 22, train_loss: 0.9747, test_loss: 0.9439, test_f1: 0.4900
 epoch: 23, train_loss: 0.9570, test_loss: 0.9253, test_f1: 0.4844
 epoch: 24, train_loss: 0.9563, test_loss: 0.9351, test_f1: 0.4903
 epoch: 25, train_loss: 0.9569, test_loss: 0.9403, test_f1: 0.4990
 epoch: 26, train_loss: 0.9510, test_loss: 0.9417, test_f1: 0.5002
 epoch: 27, train_loss: 0.9446, test_loss: 0.9259, test_f1: 0.4890
 epoch: 28, train_loss: 0.9487, test_loss: 0.9267, test_f1: 0.4830
 epoch: 29, train_loss: 0.9374, test_loss: 0.9036, test_f1: 0.5031
 epoch: 30, train_loss: 0.9251, test_loss: 0.9356, test_f1: 0.5063
 epoch: 31, train_loss: 0.9296, test_loss: 0.9055, test_f1: 0.5105
 epoch: 32, train_loss: 0.9265, test_loss: 0.9343, test_f1: 0.4897
 epoch: 33, train_loss: 0.9309, test_loss: 0.9218, test_f1: 0.5158
 epoch: 34, train_loss: 0.9206, test_loss: 0.9191, test_f1: 0.5088
 epoch: 35, train_loss: 0.9093, test_loss: 0.9126, test_f1: 0.4981
 epoch: 36, train_loss: 0.9207, test_loss: 0.9382, test_f1: 0.5100
 epoch: 37, train_loss: 0.9067, test_loss: 0.9006, test_f1: 0.5174
 epoch: 38, train_loss: 0.9118, test_loss: 0.9364, test_f1: 0.5445
 epoch: 39, train_loss: 0.9086, test_loss: 0.9346, test_f1: 0.5171
 epoch: 40, train_loss: 0.9057, test_loss: 0.9427, test_f1: 0.4973
 epoch: 41, train_loss: 0.9042, test_loss: 0.9572, test_f1: 0.4954
 epoch: 42, train_loss: 0.8946, test_loss: 0.9456, test_f1: 0.4994
 epoch: 43, train_loss: 0.9044, test_loss: 0.9418, test_f1: 0.5046
 epoch: 44, train_loss: 0.9076, test_loss: 0.9276, test_f1: 0.5037
 epoch: 45, train_loss: 0.8979, test_loss: 0.9382, test_f1: 0.5105
 epoch: 46, train_loss: 0.8936, test_loss: 0.9547, test_f1: 0.5060
 epoch: 47, train_loss: 0.8904, test_loss: 0.9612, test_f1: 0.5405
 epoch: 48, train_loss: 0.8974, test_loss: 0.9613, test_f1: 0.4874
 epoch: 49, train_loss: 0.8901, test_loss: 0.9722, test_f1: 0.5247
 epoch: 50, train_loss: 0.8925, test_loss: 0.9544, test_f1: 0.5197
 epoch: 51, train_loss: 0.8794, test_loss: 0.9441, test_f1: 0.5346
 epoch: 52, train_loss: 0.8836, test_loss: 0.9462, test_f1: 0.5343
 epoch: 53, train_loss: 0.8727, test_loss: 0.9619, test_f1: 0.5138
 epoch: 54, train_loss: 0.8713, test_loss: 0.9599, test_f1: 0.5213
 epoch: 55, train_loss: 0.8794, test_loss: 0.9443, test_f1: 0.5531
 epoch: 56, train_loss: 0.8705, test_loss: 0.9443, test_f1: 0.5437
 epoch: 57, train_loss: 0.8658, test_loss: 0.9526, test_f1: 0.4934
 epoch: 58, train_loss: 0.8584, test_loss: 0.9435, test_f1: 0.5129
 epoch: 59, train_loss: 0.8707, test_loss: 0.9380, test_f1: 0.5505
 epoch: 60, train_loss: 0.8634, test_loss: 0.9492, test_f1: 0.5355
 epoch: 61, train_loss: 0.8575, test_loss: 0.9353, test_f1: 0.5458
 epoch: 62, train_loss: 0.8683, test_loss: 0.9567, test_f1: 0.5211
 epoch: 63, train_loss: 0.8596, test_loss: 0.9558, test_f1: 0.5173
 epoch: 64, train_loss: 0.8658, test_loss: 0.9547, test_f1: 0.5209
 epoch: 65, train_loss: 0.8563, test_loss: 0.9513, test_f1: 0.5362
 epoch: 66, train_loss: 0.8597, test_loss: 0.9519, test_f1: 0.5125
 epoch: 67, train_loss: 0.8527, test_loss: 0.9435, test_f1: 0.5208
 epoch: 68, train_loss: 0.8500, test_loss: 0.9369, test_f1: 0.5205
 epoch: 69, train_loss: 0.8557, test_loss: 0.9466, test_f1: 0.5196
 epoch: 70, train_loss: 0.8633, test_loss: 0.9486, test_f1: 0.5159
 epoch: 71, train_loss: 0.8517, test_loss: 0.9520, test_f1: 0.5337
 epoch: 72, train_loss: 0.8540, test_loss: 0.9556, test_f1: 0.5150
 epoch: 73, train_loss: 0.8608, test_loss: 0.9576, test_f1: 0.5125
 epoch: 74, train_loss: 0.8490, test_loss: 0.9579, test_f1: 0.5304
 epoch: 75, train_loss: 0.8583, test_loss: 0.9529, test_f1: 0.5334
 epoch: 76, train_loss: 0.8518, test_loss: 0.9520, test_f1: 0.5331
 epoch: 77, train_loss: 0.8407, test_loss: 0.9600, test_f1: 0.5182
 epoch: 78, train_loss: 0.8540, test_loss: 0.9897, test_f1: 0.5157
 epoch: 79, train_loss: 0.8452, test_loss: 0.9519, test_f1: 0.5283
 epoch: 80, train_loss: 0.8388, test_loss: 0.9649, test_f1: 0.5305
 epoch: 81, train_loss: 0.8400, test_loss: 0.9715, test_f1: 0.5132
 epoch: 82, train_loss: 0.8515, test_loss: 0.9678, test_f1: 0.5199
 epoch: 83, train_loss: 0.8446, test_loss: 0.9845, test_f1: 0.5038
 epoch: 84, train_loss: 0.8386, test_loss: 0.9620, test_f1: 0.5330
 epoch: 85, train_loss: 0.8497, test_loss: 0.9802, test_f1: 0.5220
 epoch: 86, train_loss: 0.8452, test_loss: 0.9586, test_f1: 0.5260
 epoch: 87, train_loss: 0.8387, test_loss: 0.9786, test_f1: 0.5136
 epoch: 88, train_loss: 0.8470, test_loss: 0.9606, test_f1: 0.5295
 epoch: 89, train_loss: 0.8268, test_loss: 0.9659, test_f1: 0.5304
 epoch: 90, train_loss: 0.8262, test_loss: 0.9661, test_f1: 0.5222
 epoch: 91, train_loss: 0.8253, test_loss: 0.9622, test_f1: 0.5278
 epoch: 92, train_loss: 0.8312, test_loss: 0.9681, test_f1: 0.5155
 epoch: 93, train_loss: 0.8301, test_loss: 0.9631, test_f1: 0.5267
 epoch: 94, train_loss: 0.8454, test_loss: 0.9809, test_f1: 0.5045
 epoch: 95, train_loss: 0.8365, test_loss: 0.9834, test_f1: 0.5199
 epoch: 96, train_loss: 0.8249, test_loss: 0.9728, test_f1: 0.5323
 epoch: 97, train_loss: 0.8351, test_loss: 0.9723, test_f1: 0.5234
 epoch: 98, train_loss: 0.8371, test_loss: 0.9542, test_f1: 0.5355
 epoch: 99, train_loss: 0.8356, test_loss: 0.9784, test_f1: 0.5233
##################ITERATION #7 ****************************************
 epoch: 0, train_loss: 1.3601, test_loss: 1.3389, test_f1: 0.2270
 epoch: 1, train_loss: 1.2366, test_loss: 1.3032, test_f1: 0.2270
 epoch: 2, train_loss: 1.1937, test_loss: 1.2085, test_f1: 0.2887
 epoch: 3, train_loss: 1.1670, test_loss: 1.1334, test_f1: 0.3682
 epoch: 4, train_loss: 1.1427, test_loss: 1.0967, test_f1: 0.4060
 epoch: 5, train_loss: 1.1284, test_loss: 1.0583, test_f1: 0.4287
 epoch: 6, train_loss: 1.0989, test_loss: 1.0371, test_f1: 0.4556
 epoch: 7, train_loss: 1.0902, test_loss: 1.0318, test_f1: 0.4342
 epoch: 8, train_loss: 1.0784, test_loss: 1.0157, test_f1: 0.4618
 epoch: 9, train_loss: 1.0675, test_loss: 1.0058, test_f1: 0.4479
 epoch: 10, train_loss: 1.0480, test_loss: 0.9897, test_f1: 0.4634
 epoch: 11, train_loss: 1.0355, test_loss: 0.9862, test_f1: 0.4686
 epoch: 12, train_loss: 1.0275, test_loss: 0.9921, test_f1: 0.4653
 epoch: 13, train_loss: 1.0150, test_loss: 0.9794, test_f1: 0.4680
 epoch: 14, train_loss: 1.0060, test_loss: 0.9804, test_f1: 0.4642
 epoch: 15, train_loss: 1.0064, test_loss: 0.9787, test_f1: 0.4632
 epoch: 16, train_loss: 0.9804, test_loss: 0.9642, test_f1: 0.4655
 epoch: 17, train_loss: 0.9941, test_loss: 1.0131, test_f1: 0.4589
 epoch: 18, train_loss: 0.9723, test_loss: 0.9659, test_f1: 0.4715
 epoch: 19, train_loss: 0.9709, test_loss: 0.9611, test_f1: 0.4722
 epoch: 20, train_loss: 0.9586, test_loss: 0.9616, test_f1: 0.4799
 epoch: 21, train_loss: 0.9607, test_loss: 0.9572, test_f1: 0.4877
 epoch: 22, train_loss: 0.9514, test_loss: 0.9558, test_f1: 0.5011
 epoch: 23, train_loss: 0.9492, test_loss: 0.9673, test_f1: 0.4928
 epoch: 24, train_loss: 0.9474, test_loss: 0.9379, test_f1: 0.4931
 epoch: 25, train_loss: 0.9361, test_loss: 0.9727, test_f1: 0.5091
 epoch: 26, train_loss: 0.9330, test_loss: 1.0126, test_f1: 0.5151
 epoch: 27, train_loss: 0.9224, test_loss: 0.9466, test_f1: 0.5106
 epoch: 28, train_loss: 0.9269, test_loss: 0.9956, test_f1: 0.5048
 epoch: 29, train_loss: 0.9194, test_loss: 0.9856, test_f1: 0.5037
 epoch: 30, train_loss: 0.9219, test_loss: 0.9552, test_f1: 0.5237
 epoch: 31, train_loss: 0.9057, test_loss: 0.9658, test_f1: 0.5181
 epoch: 32, train_loss: 0.9162, test_loss: 0.9474, test_f1: 0.5251
 epoch: 33, train_loss: 0.8997, test_loss: 0.9447, test_f1: 0.5195
 epoch: 34, train_loss: 0.9107, test_loss: 0.9816, test_f1: 0.5063
 epoch: 35, train_loss: 0.9041, test_loss: 0.9543, test_f1: 0.5200
 epoch: 36, train_loss: 0.8862, test_loss: 0.9694, test_f1: 0.5149
 epoch: 37, train_loss: 0.8933, test_loss: 0.9637, test_f1: 0.5302
 epoch: 38, train_loss: 0.8905, test_loss: 1.0163, test_f1: 0.5087
 epoch: 39, train_loss: 0.8908, test_loss: 0.9706, test_f1: 0.5283
 epoch: 40, train_loss: 0.8866, test_loss: 0.9773, test_f1: 0.5046
 epoch: 41, train_loss: 0.8965, test_loss: 0.9818, test_f1: 0.5154
 epoch: 42, train_loss: 0.8840, test_loss: 0.9863, test_f1: 0.5120
 epoch: 43, train_loss: 0.8777, test_loss: 0.9705, test_f1: 0.5167
 epoch: 44, train_loss: 0.8798, test_loss: 0.9588, test_f1: 0.5217
 epoch: 45, train_loss: 0.8639, test_loss: 0.9643, test_f1: 0.5237
 epoch: 46, train_loss: 0.8645, test_loss: 0.9614, test_f1: 0.5217
 epoch: 47, train_loss: 0.8702, test_loss: 0.9993, test_f1: 0.5201
 epoch: 48, train_loss: 0.8564, test_loss: 0.9440, test_f1: 0.5180
 epoch: 49, train_loss: 0.8638, test_loss: 0.9839, test_f1: 0.5148
 epoch: 50, train_loss: 0.8599, test_loss: 0.9665, test_f1: 0.5164
 epoch: 51, train_loss: 0.8526, test_loss: 0.9842, test_f1: 0.5148
 epoch: 52, train_loss: 0.8582, test_loss: 1.0023, test_f1: 0.5076
 epoch: 53, train_loss: 0.8526, test_loss: 0.9733, test_f1: 0.5238
 epoch: 54, train_loss: 0.8380, test_loss: 0.9716, test_f1: 0.5152
 epoch: 55, train_loss: 0.8554, test_loss: 0.9737, test_f1: 0.5218
 epoch: 56, train_loss: 0.8463, test_loss: 0.9650, test_f1: 0.5332
 epoch: 57, train_loss: 0.8464, test_loss: 0.9824, test_f1: 0.5234
 epoch: 58, train_loss: 0.8326, test_loss: 0.9818, test_f1: 0.5288
 epoch: 59, train_loss: 0.8423, test_loss: 0.9786, test_f1: 0.5280
 epoch: 60, train_loss: 0.8182, test_loss: 0.9834, test_f1: 0.5162
 epoch: 61, train_loss: 0.8342, test_loss: 0.9901, test_f1: 0.5256
 epoch: 62, train_loss: 0.8401, test_loss: 0.9751, test_f1: 0.5359
 epoch: 63, train_loss: 0.8390, test_loss: 0.9921, test_f1: 0.5298
 epoch: 64, train_loss: 0.8374, test_loss: 1.0021, test_f1: 0.5137
 epoch: 65, train_loss: 0.8352, test_loss: 0.9829, test_f1: 0.5104
 epoch: 66, train_loss: 0.8245, test_loss: 0.9868, test_f1: 0.5226
 epoch: 67, train_loss: 0.8282, test_loss: 0.9810, test_f1: 0.5335
 epoch: 68, train_loss: 0.8343, test_loss: 0.9819, test_f1: 0.5260
 epoch: 69, train_loss: 0.8224, test_loss: 0.9822, test_f1: 0.5116
 epoch: 70, train_loss: 0.8251, test_loss: 0.9774, test_f1: 0.5288
 epoch: 71, train_loss: 0.8208, test_loss: 0.9903, test_f1: 0.5448
 epoch: 72, train_loss: 0.8214, test_loss: 0.9472, test_f1: 0.5320
 epoch: 73, train_loss: 0.8241, test_loss: 0.9737, test_f1: 0.5510
 epoch: 74, train_loss: 0.8159, test_loss: 0.9845, test_f1: 0.5461
 epoch: 75, train_loss: 0.8212, test_loss: 0.9951, test_f1: 0.5433
 epoch: 76, train_loss: 0.8190, test_loss: 0.9720, test_f1: 0.5422
 epoch: 77, train_loss: 0.8144, test_loss: 0.9742, test_f1: 0.5353
 epoch: 78, train_loss: 0.8055, test_loss: 0.9634, test_f1: 0.5400
 epoch: 79, train_loss: 0.8322, test_loss: 0.9593, test_f1: 0.5205
 epoch: 80, train_loss: 0.8217, test_loss: 1.0166, test_f1: 0.5197
 epoch: 81, train_loss: 0.8176, test_loss: 1.0010, test_f1: 0.5315
 epoch: 82, train_loss: 0.8114, test_loss: 0.9985, test_f1: 0.5388
 epoch: 83, train_loss: 0.8181, test_loss: 1.0006, test_f1: 0.5294
 epoch: 84, train_loss: 0.8049, test_loss: 0.9890, test_f1: 0.5196
 epoch: 85, train_loss: 0.7907, test_loss: 0.9812, test_f1: 0.5468
 epoch: 86, train_loss: 0.8056, test_loss: 0.9900, test_f1: 0.5517
 epoch: 87, train_loss: 0.8077, test_loss: 1.0050, test_f1: 0.5212
 epoch: 88, train_loss: 0.7932, test_loss: 1.0381, test_f1: 0.5475
 epoch: 89, train_loss: 0.8025, test_loss: 0.9808, test_f1: 0.5420
 epoch: 90, train_loss: 0.8081, test_loss: 0.9800, test_f1: 0.5276
 epoch: 91, train_loss: 0.8076, test_loss: 1.0097, test_f1: 0.5366
 epoch: 92, train_loss: 0.8113, test_loss: 0.9912, test_f1: 0.5336
 epoch: 93, train_loss: 0.7994, test_loss: 0.9882, test_f1: 0.5423
 epoch: 94, train_loss: 0.7990, test_loss: 0.9935, test_f1: 0.5418
 epoch: 95, train_loss: 0.7912, test_loss: 0.9884, test_f1: 0.5291
 epoch: 96, train_loss: 0.8040, test_loss: 0.9915, test_f1: 0.5365
 epoch: 97, train_loss: 0.7951, test_loss: 1.0111, test_f1: 0.5350
 epoch: 98, train_loss: 0.8009, test_loss: 1.0138, test_f1: 0.5321
 epoch: 99, train_loss: 0.7823, test_loss: 0.9847, test_f1: 0.5413
##################ITERATION #8 ****************************************
 epoch: 0, train_loss: 1.6142, test_loss: 1.4353, test_f1: 0.2270
 epoch: 1, train_loss: 1.3119, test_loss: 1.3587, test_f1: 0.2295
 epoch: 2, train_loss: 1.2356, test_loss: 1.3037, test_f1: 0.2948
 epoch: 3, train_loss: 1.2057, test_loss: 1.2515, test_f1: 0.3136
 epoch: 4, train_loss: 1.1950, test_loss: 1.1786, test_f1: 0.3510
 epoch: 5, train_loss: 1.1632, test_loss: 1.1104, test_f1: 0.4039
 epoch: 6, train_loss: 1.1473, test_loss: 1.0781, test_f1: 0.4312
 epoch: 7, train_loss: 1.1343, test_loss: 1.0559, test_f1: 0.4469
 epoch: 8, train_loss: 1.1128, test_loss: 1.0379, test_f1: 0.4508
 epoch: 9, train_loss: 1.1020, test_loss: 1.0233, test_f1: 0.4512
 epoch: 10, train_loss: 1.0977, test_loss: 1.0134, test_f1: 0.4648
 epoch: 11, train_loss: 1.0772, test_loss: 0.9990, test_f1: 0.4708
 epoch: 12, train_loss: 1.0702, test_loss: 0.9917, test_f1: 0.4712
 epoch: 13, train_loss: 1.0650, test_loss: 0.9884, test_f1: 0.4641
 epoch: 14, train_loss: 1.0515, test_loss: 0.9851, test_f1: 0.4664
 epoch: 15, train_loss: 1.0416, test_loss: 0.9754, test_f1: 0.4781
 epoch: 16, train_loss: 1.0424, test_loss: 0.9663, test_f1: 0.4910
 epoch: 17, train_loss: 1.0340, test_loss: 0.9598, test_f1: 0.4770
 epoch: 18, train_loss: 1.0248, test_loss: 0.9560, test_f1: 0.4760
 epoch: 19, train_loss: 1.0229, test_loss: 0.9639, test_f1: 0.4650
 epoch: 20, train_loss: 1.0118, test_loss: 0.9676, test_f1: 0.4798
 epoch: 21, train_loss: 1.0171, test_loss: 0.9436, test_f1: 0.4875
 epoch: 22, train_loss: 1.0049, test_loss: 0.9400, test_f1: 0.5015
 epoch: 23, train_loss: 1.0034, test_loss: 0.9452, test_f1: 0.5054
 epoch: 24, train_loss: 0.9979, test_loss: 0.9780, test_f1: 0.4742
 epoch: 25, train_loss: 0.9991, test_loss: 0.9591, test_f1: 0.4872
 epoch: 26, train_loss: 0.9841, test_loss: 0.9531, test_f1: 0.4858
 epoch: 27, train_loss: 0.9790, test_loss: 0.9630, test_f1: 0.4874
 epoch: 28, train_loss: 0.9883, test_loss: 0.9640, test_f1: 0.4916
 epoch: 29, train_loss: 0.9744, test_loss: 0.9582, test_f1: 0.4747
 epoch: 30, train_loss: 0.9794, test_loss: 0.9469, test_f1: 0.4911
 epoch: 31, train_loss: 0.9708, test_loss: 0.9777, test_f1: 0.4926
 epoch: 32, train_loss: 0.9641, test_loss: 0.9522, test_f1: 0.4982
 epoch: 33, train_loss: 0.9681, test_loss: 0.9466, test_f1: 0.4965
 epoch: 34, train_loss: 0.9687, test_loss: 0.9384, test_f1: 0.4997
 epoch: 35, train_loss: 0.9693, test_loss: 0.9884, test_f1: 0.4964
 epoch: 36, train_loss: 0.9620, test_loss: 0.9769, test_f1: 0.4971
 epoch: 37, train_loss: 0.9560, test_loss: 0.9536, test_f1: 0.5127
 epoch: 38, train_loss: 0.9541, test_loss: 0.9453, test_f1: 0.4983
 epoch: 39, train_loss: 0.9506, test_loss: 0.9807, test_f1: 0.5077
 epoch: 40, train_loss: 0.9419, test_loss: 0.9674, test_f1: 0.5099
 epoch: 41, train_loss: 0.9440, test_loss: 0.9683, test_f1: 0.5069
 epoch: 42, train_loss: 0.9491, test_loss: 1.0006, test_f1: 0.5018
 epoch: 43, train_loss: 0.9334, test_loss: 0.9635, test_f1: 0.5108
 epoch: 44, train_loss: 0.9387, test_loss: 0.9650, test_f1: 0.5057
 epoch: 45, train_loss: 0.9305, test_loss: 0.9575, test_f1: 0.5076
 epoch: 46, train_loss: 0.9280, test_loss: 0.9710, test_f1: 0.4982
 epoch: 47, train_loss: 0.9219, test_loss: 0.9339, test_f1: 0.5116
 epoch: 48, train_loss: 0.9264, test_loss: 0.9942, test_f1: 0.5126
 epoch: 49, train_loss: 0.9227, test_loss: 1.0188, test_f1: 0.5136
 epoch: 50, train_loss: 0.9112, test_loss: 0.9894, test_f1: 0.5171
 epoch: 51, train_loss: 0.9042, test_loss: 0.9664, test_f1: 0.5191
 epoch: 52, train_loss: 0.9074, test_loss: 0.9576, test_f1: 0.5101
 epoch: 53, train_loss: 0.9077, test_loss: 0.9662, test_f1: 0.5117
 epoch: 54, train_loss: 0.8986, test_loss: 0.9765, test_f1: 0.5046
 epoch: 55, train_loss: 0.9064, test_loss: 0.9848, test_f1: 0.5151
 epoch: 56, train_loss: 0.9004, test_loss: 0.9675, test_f1: 0.5179
 epoch: 57, train_loss: 0.8980, test_loss: 0.9837, test_f1: 0.5091
 epoch: 58, train_loss: 0.8995, test_loss: 0.9833, test_f1: 0.5195
 epoch: 59, train_loss: 0.9030, test_loss: 0.9844, test_f1: 0.5147
 epoch: 60, train_loss: 0.8899, test_loss: 0.9786, test_f1: 0.5186
 epoch: 61, train_loss: 0.9008, test_loss: 0.9642, test_f1: 0.5211
 epoch: 62, train_loss: 0.9042, test_loss: 0.9776, test_f1: 0.5093
 epoch: 63, train_loss: 0.8893, test_loss: 0.9685, test_f1: 0.5169
 epoch: 64, train_loss: 0.8996, test_loss: 0.9742, test_f1: 0.5239
 epoch: 65, train_loss: 0.8985, test_loss: 0.9735, test_f1: 0.5139
 epoch: 66, train_loss: 0.8918, test_loss: 0.9747, test_f1: 0.5286
 epoch: 67, train_loss: 0.8875, test_loss: 0.9817, test_f1: 0.5147
 epoch: 68, train_loss: 0.8871, test_loss: 0.9399, test_f1: 0.5064
 epoch: 69, train_loss: 0.8869, test_loss: 0.9712, test_f1: 0.5161
 epoch: 70, train_loss: 0.8896, test_loss: 0.9626, test_f1: 0.5211
 epoch: 71, train_loss: 0.8859, test_loss: 0.9827, test_f1: 0.5215
 epoch: 72, train_loss: 0.8806, test_loss: 0.9794, test_f1: 0.5231
 epoch: 73, train_loss: 0.8825, test_loss: 0.9806, test_f1: 0.5224
 epoch: 74, train_loss: 0.8756, test_loss: 0.9672, test_f1: 0.5243
 epoch: 75, train_loss: 0.8763, test_loss: 0.9651, test_f1: 0.5181
 epoch: 76, train_loss: 0.8795, test_loss: 0.9764, test_f1: 0.5273
 epoch: 77, train_loss: 0.8806, test_loss: 0.9942, test_f1: 0.5082
 epoch: 78, train_loss: 0.8842, test_loss: 0.9811, test_f1: 0.5284
 epoch: 79, train_loss: 0.8811, test_loss: 0.9941, test_f1: 0.5109
 epoch: 80, train_loss: 0.8673, test_loss: 0.9634, test_f1: 0.5226
 epoch: 81, train_loss: 0.8756, test_loss: 0.9791, test_f1: 0.5240
 epoch: 82, train_loss: 0.8748, test_loss: 0.9547, test_f1: 0.5272
 epoch: 83, train_loss: 0.8684, test_loss: 0.9744, test_f1: 0.5192
 epoch: 84, train_loss: 0.8649, test_loss: 0.9865, test_f1: 0.5287
 epoch: 85, train_loss: 0.8634, test_loss: 0.9803, test_f1: 0.5030
 epoch: 86, train_loss: 0.8658, test_loss: 0.9958, test_f1: 0.5162
 epoch: 87, train_loss: 0.8755, test_loss: 1.0028, test_f1: 0.5122
 epoch: 88, train_loss: 0.8608, test_loss: 0.9821, test_f1: 0.5159
 epoch: 89, train_loss: 0.8691, test_loss: 1.0034, test_f1: 0.5153
 epoch: 90, train_loss: 0.8623, test_loss: 1.0046, test_f1: 0.5076
 epoch: 91, train_loss: 0.8678, test_loss: 0.9738, test_f1: 0.5183
 epoch: 92, train_loss: 0.8577, test_loss: 0.9821, test_f1: 0.5070
 epoch: 93, train_loss: 0.8688, test_loss: 0.9889, test_f1: 0.5314
 epoch: 94, train_loss: 0.8508, test_loss: 0.9931, test_f1: 0.5219
 epoch: 95, train_loss: 0.8507, test_loss: 0.9770, test_f1: 0.5210
 epoch: 96, train_loss: 0.8532, test_loss: 0.9836, test_f1: 0.5160
 epoch: 97, train_loss: 0.8541, test_loss: 0.9987, test_f1: 0.5316
 epoch: 98, train_loss: 0.8615, test_loss: 0.9643, test_f1: 0.5218
 epoch: 99, train_loss: 0.8574, test_loss: 0.9534, test_f1: 0.5303
##################ITERATION #9 ****************************************
 epoch: 0, train_loss: 1.4699, test_loss: 1.3310, test_f1: 0.2270
 epoch: 1, train_loss: 1.2880, test_loss: 1.3520, test_f1: 0.2270
 epoch: 2, train_loss: 1.2242, test_loss: 1.3458, test_f1: 0.2283
 epoch: 3, train_loss: 1.1942, test_loss: 1.3143, test_f1: 0.2982
 epoch: 4, train_loss: 1.1840, test_loss: 1.1518, test_f1: 0.4187
 epoch: 5, train_loss: 1.1632, test_loss: 1.0845, test_f1: 0.4546
 epoch: 6, train_loss: 1.1436, test_loss: 1.0372, test_f1: 0.4945
 epoch: 7, train_loss: 1.1131, test_loss: 1.0119, test_f1: 0.4826
 epoch: 8, train_loss: 1.1058, test_loss: 0.9972, test_f1: 0.4765
 epoch: 9, train_loss: 1.0865, test_loss: 0.9949, test_f1: 0.4788
 epoch: 10, train_loss: 1.0800, test_loss: 0.9765, test_f1: 0.4814
 epoch: 11, train_loss: 1.0614, test_loss: 0.9773, test_f1: 0.4906
 epoch: 12, train_loss: 1.0594, test_loss: 0.9752, test_f1: 0.4855
 epoch: 13, train_loss: 1.0530, test_loss: 0.9680, test_f1: 0.4862
 epoch: 14, train_loss: 1.0441, test_loss: 0.9578, test_f1: 0.5017
 epoch: 15, train_loss: 1.0222, test_loss: 0.9431, test_f1: 0.4967
 epoch: 16, train_loss: 1.0150, test_loss: 0.9439, test_f1: 0.5018
 epoch: 17, train_loss: 1.0117, test_loss: 0.9336, test_f1: 0.4956
 epoch: 18, train_loss: 1.0089, test_loss: 0.9553, test_f1: 0.4953
 epoch: 19, train_loss: 1.0078, test_loss: 0.9255, test_f1: 0.5018
 epoch: 20, train_loss: 0.9801, test_loss: 0.9120, test_f1: 0.5019
 epoch: 21, train_loss: 0.9784, test_loss: 0.9226, test_f1: 0.5081
 epoch: 22, train_loss: 0.9801, test_loss: 0.9060, test_f1: 0.5075
 epoch: 23, train_loss: 0.9679, test_loss: 0.9325, test_f1: 0.5032
 epoch: 24, train_loss: 0.9588, test_loss: 0.9046, test_f1: 0.5081
 epoch: 25, train_loss: 0.9571, test_loss: 0.9113, test_f1: 0.5138
 epoch: 26, train_loss: 0.9637, test_loss: 0.9492, test_f1: 0.5069
 epoch: 27, train_loss: 0.9545, test_loss: 0.9606, test_f1: 0.5014
 epoch: 28, train_loss: 0.9416, test_loss: 0.9234, test_f1: 0.5196
 epoch: 29, train_loss: 0.9398, test_loss: 0.9047, test_f1: 0.5160
 epoch: 30, train_loss: 0.9449, test_loss: 0.9119, test_f1: 0.5133
 epoch: 31, train_loss: 0.9330, test_loss: 0.9088, test_f1: 0.5196
 epoch: 32, train_loss: 0.9204, test_loss: 0.9364, test_f1: 0.5166
 epoch: 33, train_loss: 0.9316, test_loss: 0.9019, test_f1: 0.5182
 epoch: 34, train_loss: 0.9214, test_loss: 0.8913, test_f1: 0.5258
 epoch: 35, train_loss: 0.9198, test_loss: 0.9072, test_f1: 0.5144
 epoch: 36, train_loss: 0.9103, test_loss: 0.9233, test_f1: 0.5316
 epoch: 37, train_loss: 0.9109, test_loss: 0.9427, test_f1: 0.5234
 epoch: 38, train_loss: 0.9170, test_loss: 0.9032, test_f1: 0.5176
 epoch: 39, train_loss: 0.9081, test_loss: 0.9247, test_f1: 0.5369
 epoch: 40, train_loss: 0.9048, test_loss: 0.9510, test_f1: 0.5226
 epoch: 41, train_loss: 0.9012, test_loss: 0.9478, test_f1: 0.5248
 epoch: 42, train_loss: 0.8915, test_loss: 0.9335, test_f1: 0.5100
 epoch: 43, train_loss: 0.9021, test_loss: 0.9105, test_f1: 0.5300
 epoch: 44, train_loss: 0.8859, test_loss: 0.9093, test_f1: 0.5362
 epoch: 45, train_loss: 0.8867, test_loss: 0.9273, test_f1: 0.5147
 epoch: 46, train_loss: 0.8806, test_loss: 0.8886, test_f1: 0.5348
 epoch: 47, train_loss: 0.8880, test_loss: 0.9384, test_f1: 0.5305
 epoch: 48, train_loss: 0.8885, test_loss: 0.9393, test_f1: 0.5374
 epoch: 49, train_loss: 0.8839, test_loss: 0.9077, test_f1: 0.5361
 epoch: 50, train_loss: 0.8752, test_loss: 0.9782, test_f1: 0.5021
 epoch: 51, train_loss: 0.8787, test_loss: 0.9325, test_f1: 0.5404
 epoch: 52, train_loss: 0.8734, test_loss: 0.9150, test_f1: 0.5522
 epoch: 53, train_loss: 0.8605, test_loss: 0.9415, test_f1: 0.5365
 epoch: 54, train_loss: 0.8756, test_loss: 0.9275, test_f1: 0.5321
 epoch: 55, train_loss: 0.8629, test_loss: 0.9071, test_f1: 0.5385
 epoch: 56, train_loss: 0.8514, test_loss: 0.9087, test_f1: 0.5339
 epoch: 57, train_loss: 0.8572, test_loss: 0.9310, test_f1: 0.5360
 epoch: 58, train_loss: 0.8585, test_loss: 0.9442, test_f1: 0.5499
 epoch: 59, train_loss: 0.8600, test_loss: 0.9286, test_f1: 0.5459
 epoch: 60, train_loss: 0.8515, test_loss: 0.9385, test_f1: 0.5377
 epoch: 61, train_loss: 0.8536, test_loss: 0.9393, test_f1: 0.5297
 epoch: 62, train_loss: 0.8578, test_loss: 0.9440, test_f1: 0.5410
 epoch: 63, train_loss: 0.8450, test_loss: 0.9498, test_f1: 0.5324
 epoch: 64, train_loss: 0.8539, test_loss: 0.9268, test_f1: 0.5429
 epoch: 65, train_loss: 0.8423, test_loss: 0.9304, test_f1: 0.5420
 epoch: 66, train_loss: 0.8482, test_loss: 0.9262, test_f1: 0.5496
 epoch: 67, train_loss: 0.8518, test_loss: 0.9471, test_f1: 0.5342
 epoch: 68, train_loss: 0.8519, test_loss: 0.9424, test_f1: 0.5334
 epoch: 69, train_loss: 0.8464, test_loss: 0.9434, test_f1: 0.5507
 epoch: 70, train_loss: 0.8506, test_loss: 0.9441, test_f1: 0.5488
 epoch: 71, train_loss: 0.8404, test_loss: 0.9396, test_f1: 0.5497
 epoch: 72, train_loss: 0.8397, test_loss: 0.9411, test_f1: 0.5351
 epoch: 73, train_loss: 0.8465, test_loss: 0.9479, test_f1: 0.5442
 epoch: 74, train_loss: 0.8411, test_loss: 0.9452, test_f1: 0.5426
 epoch: 75, train_loss: 0.8480, test_loss: 0.9493, test_f1: 0.5529
 epoch: 76, train_loss: 0.8332, test_loss: 0.9447, test_f1: 0.5464
 epoch: 77, train_loss: 0.8506, test_loss: 0.9550, test_f1: 0.5312
 epoch: 78, train_loss: 0.8322, test_loss: 0.9509, test_f1: 0.5757
 epoch: 79, train_loss: 0.8396, test_loss: 0.9581, test_f1: 0.5398
 epoch: 80, train_loss: 0.8271, test_loss: 0.9476, test_f1: 0.5408
 epoch: 81, train_loss: 0.8227, test_loss: 0.9712, test_f1: 0.5478
 epoch: 82, train_loss: 0.8476, test_loss: 0.9797, test_f1: 0.5656
 epoch: 83, train_loss: 0.8380, test_loss: 0.9136, test_f1: 0.5606
 epoch: 84, train_loss: 0.8325, test_loss: 0.9495, test_f1: 0.5483
 epoch: 85, train_loss: 0.8313, test_loss: 0.9330, test_f1: 0.5654
 epoch: 86, train_loss: 0.8228, test_loss: 0.9396, test_f1: 0.5497
 epoch: 87, train_loss: 0.8230, test_loss: 0.9373, test_f1: 0.5628
 epoch: 88, train_loss: 0.8203, test_loss: 0.9508, test_f1: 0.5637
 epoch: 89, train_loss: 0.8261, test_loss: 0.9615, test_f1: 0.5550
 epoch: 90, train_loss: 0.8141, test_loss: 0.9474, test_f1: 0.5472
 epoch: 91, train_loss: 0.8220, test_loss: 0.9674, test_f1: 0.5557
 epoch: 92, train_loss: 0.8217, test_loss: 0.9781, test_f1: 0.5644
 epoch: 93, train_loss: 0.8157, test_loss: 0.9443, test_f1: 0.5738
 epoch: 94, train_loss: 0.8209, test_loss: 0.9433, test_f1: 0.5558
 epoch: 95, train_loss: 0.8215, test_loss: 0.9584, test_f1: 0.5566
 epoch: 96, train_loss: 0.8101, test_loss: 0.9650, test_f1: 0.5664
 epoch: 97, train_loss: 0.8218, test_loss: 0.9659, test_f1: 0.5451
 epoch: 98, train_loss: 0.8134, test_loss: 0.9479, test_f1: 0.5889
 epoch: 99, train_loss: 0.8115, test_loss: 0.9505, test_f1: 0.6118

Training completed in 423.17 seconds
Best F1: 0.6118 at epoch 99
Mean F1 across iterations: 0.5635  0.0223
========================FINAL RESULTS================================
FEGIN weighted F1: 0.6118  0.0223
python main.py --data ltspice_examples --representation component_net --model FEGIN --layers 5 --hiddens 16 --batch_size 256 --lr 0.001 --emb_size 512 --epochs 100 --save_appendix component_net_L5_H16_BS256_LR0.001_E512 --no_val
-----



STDERR:
  File "main.py", line 370, in <module>
    main()
  File "main.py", line 254, in main
    dataset = dataset_class(
  File "/home/philip/projects/ltspice_examples_code_repo/Circuit-Completion-Using-GNNs/component_classification_with_link_prediction_head/evaluation/FEGIN/kernel/circuit_datasets.py", line 15, in __init__
    self.data, self.slices = torch.load(self.processed_paths[0])
  File "/home/philip/.local/lib/python3.8/site-packages/torch/serialization.py", line 1040, in load
    warnings.warn(
  File "/usr/lib/python3.8/warnings.py", line 109, in _showwarnmsg
    sw(msg.message, msg.category, msg.filename, msg.lineno,
  File "main.py", line 47, in warn_with_traceback
    traceback.print_stack(file=log)
/home/philip/projects/ltspice_examples_code_repo/Circuit-Completion-Using-GNNs/component_classification_with_link_prediction_head/evaluation/FEGIN/kernel/circuit_datasets.py:15: FutureWarning: You are using `torch.load` with `weights_only=False` (the current default value), which uses the default pickle module implicitly. It is possible to construct malicious pickle data which will execute arbitrary code during unpickling (See https://github.com/pytorch/pytorch/blob/main/SECURITY.md#untrusted-models for more details). In a future release, the default value for `weights_only` will be flipped to `True`. This limits the functions that could be executed during unpickling. Arbitrary objects will no longer be allowed to be loaded via this mode unless they are explicitly allowlisted by the user via `torch.serialization.add_safe_globals`. We recommend you start setting `weights_only=True` for any use case where you don't have full control of the loaded file. Please open an issue on GitHub for any issues related to this experimental feature.
  self.data, self.slices = torch.load(self.processed_paths[0])
