STDOUT:
Results will be saved in /home/philip/projects/llm_inference_code_repo/Circuit-Completion-Using-GNNs/component_classification_with_link_prediction_head/evaluation/FEGIN/results/model_FEGIN_dataset_ltspice_examples
Command line input: python main.py --data ltspice_examples --representation component_pin --model FEGIN --layers 5 --hiddens 16 --batch_size 256 --lr 0.001 --emb_size 128 --epochs 100 --save_appendix component_pin_L5_H16_BS256_LR0.001_E128 --no_val
 is saved.
-----
ltspice_examples - FEGIN
Using 5 layers, 16 hidden units, h = 2
Loading component_pin representation dataset
ENTERED
Training FEGIN on component_pin representation
Train: 3560, Test: 848
##################ITERATION #0 ****************************************
 epoch: 0, train_loss: 1.4402, test_loss: 1.4270, test_f1: 0.1017
 epoch: 1, train_loss: 1.4260, test_loss: 1.4173, test_f1: 0.1017
 epoch: 2, train_loss: 1.4114, test_loss: 1.4008, test_f1: 0.1017
 epoch: 3, train_loss: 1.3890, test_loss: 1.3753, test_f1: 0.1017
 epoch: 4, train_loss: 1.3575, test_loss: 1.3411, test_f1: 0.2366
 epoch: 5, train_loss: 1.3206, test_loss: 1.3057, test_f1: 0.2602
 epoch: 6, train_loss: 1.2938, test_loss: 1.2773, test_f1: 0.2424
 epoch: 7, train_loss: 1.2699, test_loss: 1.2594, test_f1: 0.2511
 epoch: 8, train_loss: 1.2578, test_loss: 1.2438, test_f1: 0.2425
 epoch: 9, train_loss: 1.2400, test_loss: 1.2273, test_f1: 0.2896
 epoch: 10, train_loss: 1.2291, test_loss: 1.2107, test_f1: 0.2820
 epoch: 11, train_loss: 1.2232, test_loss: 1.2019, test_f1: 0.2956
 epoch: 12, train_loss: 1.2192, test_loss: 1.1950, test_f1: 0.2864
 epoch: 13, train_loss: 1.2087, test_loss: 1.1877, test_f1: 0.2914
 epoch: 14, train_loss: 1.2089, test_loss: 1.1751, test_f1: 0.2910
 epoch: 15, train_loss: 1.1946, test_loss: 1.1773, test_f1: 0.2892
 epoch: 16, train_loss: 1.1860, test_loss: 1.1538, test_f1: 0.3619
 epoch: 17, train_loss: 1.1700, test_loss: 1.1383, test_f1: 0.4180
 epoch: 18, train_loss: 1.1472, test_loss: 1.1173, test_f1: 0.3758
 epoch: 19, train_loss: 1.1109, test_loss: 1.0838, test_f1: 0.3665
 epoch: 20, train_loss: 1.0893, test_loss: 1.0610, test_f1: 0.3817
 epoch: 21, train_loss: 1.0733, test_loss: 1.0269, test_f1: 0.3900
 epoch: 22, train_loss: 1.0648, test_loss: 1.0500, test_f1: 0.3881
 epoch: 23, train_loss: 1.0542, test_loss: 1.0593, test_f1: 0.3616
 epoch: 24, train_loss: 1.0536, test_loss: 1.0314, test_f1: 0.3555
 epoch: 25, train_loss: 1.0381, test_loss: 0.9974, test_f1: 0.3874
 epoch: 26, train_loss: 1.0267, test_loss: 1.0238, test_f1: 0.3542
 epoch: 27, train_loss: 1.0200, test_loss: 1.0180, test_f1: 0.3747
 epoch: 28, train_loss: 1.0064, test_loss: 0.9856, test_f1: 0.3914
 epoch: 29, train_loss: 1.0070, test_loss: 0.9959, test_f1: 0.3654
 epoch: 30, train_loss: 1.0057, test_loss: 1.0521, test_f1: 0.3749
 epoch: 31, train_loss: 0.9987, test_loss: 1.0056, test_f1: 0.3639
 epoch: 32, train_loss: 0.9931, test_loss: 1.0128, test_f1: 0.3772
 epoch: 33, train_loss: 0.9844, test_loss: 1.0556, test_f1: 0.3531
 epoch: 34, train_loss: 0.9876, test_loss: 1.0018, test_f1: 0.4233
 epoch: 35, train_loss: 0.9896, test_loss: 1.0014, test_f1: 0.4109
 epoch: 36, train_loss: 0.9826, test_loss: 0.9694, test_f1: 0.4227
 epoch: 37, train_loss: 0.9806, test_loss: 1.0093, test_f1: 0.4342
 epoch: 38, train_loss: 0.9706, test_loss: 1.0044, test_f1: 0.4150
 epoch: 39, train_loss: 0.9719, test_loss: 0.9948, test_f1: 0.4397
 epoch: 40, train_loss: 0.9574, test_loss: 1.0299, test_f1: 0.4252
 epoch: 41, train_loss: 0.9722, test_loss: 0.9452, test_f1: 0.4782
 epoch: 42, train_loss: 0.9580, test_loss: 0.9776, test_f1: 0.4613
 epoch: 43, train_loss: 0.9545, test_loss: 0.9786, test_f1: 0.4550
 epoch: 44, train_loss: 0.9574, test_loss: 0.9897, test_f1: 0.4528
 epoch: 45, train_loss: 0.9637, test_loss: 0.9805, test_f1: 0.4490
 epoch: 46, train_loss: 0.9659, test_loss: 1.0356, test_f1: 0.4056
 epoch: 47, train_loss: 0.9523, test_loss: 0.9892, test_f1: 0.4289
 epoch: 48, train_loss: 0.9452, test_loss: 1.0750, test_f1: 0.4281
 epoch: 49, train_loss: 0.9425, test_loss: 1.0255, test_f1: 0.4521
 epoch: 50, train_loss: 0.9321, test_loss: 0.9884, test_f1: 0.4845
 epoch: 51, train_loss: 0.9372, test_loss: 0.9850, test_f1: 0.4713
 epoch: 52, train_loss: 0.9184, test_loss: 0.9688, test_f1: 0.4851
 epoch: 53, train_loss: 0.9277, test_loss: 0.9824, test_f1: 0.4829
 epoch: 54, train_loss: 0.9199, test_loss: 1.0088, test_f1: 0.4779
 epoch: 55, train_loss: 0.9143, test_loss: 0.9709, test_f1: 0.4766
 epoch: 56, train_loss: 0.9099, test_loss: 0.9820, test_f1: 0.4998
 epoch: 57, train_loss: 0.9168, test_loss: 0.9509, test_f1: 0.5031
 epoch: 58, train_loss: 0.9123, test_loss: 0.9785, test_f1: 0.4840
 epoch: 59, train_loss: 0.9065, test_loss: 0.9518, test_f1: 0.5033
 epoch: 60, train_loss: 0.9095, test_loss: 0.9607, test_f1: 0.4972
 epoch: 61, train_loss: 0.8993, test_loss: 0.9714, test_f1: 0.4955
 epoch: 62, train_loss: 0.8964, test_loss: 0.9698, test_f1: 0.4949
 epoch: 63, train_loss: 0.8973, test_loss: 0.9420, test_f1: 0.4976
 epoch: 64, train_loss: 0.9007, test_loss: 0.9939, test_f1: 0.4910
 epoch: 65, train_loss: 0.8948, test_loss: 1.0059, test_f1: 0.4678
 epoch: 66, train_loss: 0.8876, test_loss: 1.0056, test_f1: 0.4799
 epoch: 67, train_loss: 0.8885, test_loss: 0.9619, test_f1: 0.5009
 epoch: 68, train_loss: 0.8819, test_loss: 0.9437, test_f1: 0.4970
 epoch: 69, train_loss: 0.8851, test_loss: 1.0302, test_f1: 0.4865
 epoch: 70, train_loss: 0.8897, test_loss: 0.9501, test_f1: 0.4962
 epoch: 71, train_loss: 0.8813, test_loss: 1.0273, test_f1: 0.4988
 epoch: 72, train_loss: 0.8735, test_loss: 0.9430, test_f1: 0.5057
 epoch: 73, train_loss: 0.8786, test_loss: 0.9747, test_f1: 0.5096
 epoch: 74, train_loss: 0.8724, test_loss: 0.9985, test_f1: 0.4952
 epoch: 75, train_loss: 0.8809, test_loss: 0.9959, test_f1: 0.5054
 epoch: 76, train_loss: 0.8745, test_loss: 0.9690, test_f1: 0.5103
 epoch: 77, train_loss: 0.8723, test_loss: 0.9678, test_f1: 0.4943
 epoch: 78, train_loss: 0.8698, test_loss: 0.9405, test_f1: 0.5119
 epoch: 79, train_loss: 0.8692, test_loss: 1.0024, test_f1: 0.4919
 epoch: 80, train_loss: 0.8753, test_loss: 0.9352, test_f1: 0.5122
 epoch: 81, train_loss: 0.8703, test_loss: 0.9834, test_f1: 0.4921
 epoch: 82, train_loss: 0.8724, test_loss: 1.0216, test_f1: 0.5019
 epoch: 83, train_loss: 0.8621, test_loss: 0.9198, test_f1: 0.5189
 epoch: 84, train_loss: 0.8642, test_loss: 0.9481, test_f1: 0.5151
 epoch: 85, train_loss: 0.8530, test_loss: 0.9666, test_f1: 0.5015
 epoch: 86, train_loss: 0.8595, test_loss: 0.9770, test_f1: 0.5025
 epoch: 87, train_loss: 0.8592, test_loss: 0.9749, test_f1: 0.5202
 epoch: 88, train_loss: 0.8554, test_loss: 0.9439, test_f1: 0.5153
 epoch: 89, train_loss: 0.8556, test_loss: 1.0048, test_f1: 0.5152
 epoch: 90, train_loss: 0.8445, test_loss: 0.9784, test_f1: 0.5007
 epoch: 91, train_loss: 0.8410, test_loss: 0.9486, test_f1: 0.5085
 epoch: 92, train_loss: 0.8482, test_loss: 0.9399, test_f1: 0.5104
 epoch: 93, train_loss: 0.8418, test_loss: 1.0102, test_f1: 0.4980
 epoch: 94, train_loss: 0.8388, test_loss: 0.9808, test_f1: 0.5149
 epoch: 95, train_loss: 0.8427, test_loss: 0.9767, test_f1: 0.5090
 epoch: 96, train_loss: 0.8504, test_loss: 0.9207, test_f1: 0.5228
 epoch: 97, train_loss: 0.8421, test_loss: 0.9449, test_f1: 0.5103
 epoch: 98, train_loss: 0.8296, test_loss: 1.0187, test_f1: 0.4947
 epoch: 99, train_loss: 0.8423, test_loss: 0.9919, test_f1: 0.5130
##################ITERATION #1 ****************************************
 epoch: 0, train_loss: 1.3662, test_loss: 1.3631, test_f1: 0.1017
 epoch: 1, train_loss: 1.2970, test_loss: 1.3360, test_f1: 0.2207
 epoch: 2, train_loss: 1.2702, test_loss: 1.3012, test_f1: 0.2260
 epoch: 3, train_loss: 1.2260, test_loss: 1.2393, test_f1: 0.3280
 epoch: 4, train_loss: 1.1884, test_loss: 1.1688, test_f1: 0.3429
 epoch: 5, train_loss: 1.1550, test_loss: 1.1220, test_f1: 0.3214
 epoch: 6, train_loss: 1.1283, test_loss: 1.0949, test_f1: 0.3315
 epoch: 7, train_loss: 1.1068, test_loss: 1.0896, test_f1: 0.3264
 epoch: 8, train_loss: 1.0918, test_loss: 1.0944, test_f1: 0.3211
 epoch: 9, train_loss: 1.0772, test_loss: 1.0852, test_f1: 0.3270
 epoch: 10, train_loss: 1.0687, test_loss: 1.0711, test_f1: 0.3557
 epoch: 11, train_loss: 1.0562, test_loss: 1.0863, test_f1: 0.3391
 epoch: 12, train_loss: 1.0507, test_loss: 1.0547, test_f1: 0.3743
 epoch: 13, train_loss: 1.0362, test_loss: 1.0816, test_f1: 0.3700
 epoch: 14, train_loss: 1.0342, test_loss: 1.1170, test_f1: 0.3263
 epoch: 15, train_loss: 1.0277, test_loss: 1.0930, test_f1: 0.3567
 epoch: 16, train_loss: 1.0171, test_loss: 1.0515, test_f1: 0.3746
 epoch: 17, train_loss: 1.0176, test_loss: 1.1462, test_f1: 0.3397
 epoch: 18, train_loss: 1.0120, test_loss: 1.1033, test_f1: 0.3783
 epoch: 19, train_loss: 1.0154, test_loss: 1.1196, test_f1: 0.3584
 epoch: 20, train_loss: 1.0059, test_loss: 1.1177, test_f1: 0.3902
 epoch: 21, train_loss: 0.9998, test_loss: 1.0969, test_f1: 0.4107
 epoch: 22, train_loss: 0.9967, test_loss: 1.1155, test_f1: 0.3992
 epoch: 23, train_loss: 1.0021, test_loss: 1.1045, test_f1: 0.3924
 epoch: 24, train_loss: 0.9909, test_loss: 1.1181, test_f1: 0.3925
 epoch: 25, train_loss: 0.9811, test_loss: 1.0211, test_f1: 0.4384
 epoch: 26, train_loss: 0.9876, test_loss: 1.0588, test_f1: 0.4236
 epoch: 27, train_loss: 0.9861, test_loss: 1.1872, test_f1: 0.3778
 epoch: 28, train_loss: 0.9846, test_loss: 1.1222, test_f1: 0.4062
 epoch: 29, train_loss: 0.9711, test_loss: 1.1083, test_f1: 0.4194
 epoch: 30, train_loss: 0.9634, test_loss: 1.0574, test_f1: 0.4512
 epoch: 31, train_loss: 0.9661, test_loss: 1.1184, test_f1: 0.4236
 epoch: 32, train_loss: 0.9673, test_loss: 1.0796, test_f1: 0.4345
 epoch: 33, train_loss: 0.9526, test_loss: 1.0909, test_f1: 0.4331
 epoch: 34, train_loss: 0.9594, test_loss: 1.0962, test_f1: 0.4461
 epoch: 35, train_loss: 0.9568, test_loss: 1.0492, test_f1: 0.4518
 epoch: 36, train_loss: 0.9495, test_loss: 1.0854, test_f1: 0.4477
 epoch: 37, train_loss: 0.9449, test_loss: 1.0923, test_f1: 0.4351
 epoch: 38, train_loss: 0.9410, test_loss: 1.0736, test_f1: 0.4507
 epoch: 39, train_loss: 0.9438, test_loss: 1.0705, test_f1: 0.4575
 epoch: 40, train_loss: 0.9294, test_loss: 1.0425, test_f1: 0.4528
 epoch: 41, train_loss: 0.9284, test_loss: 1.0896, test_f1: 0.4529
 epoch: 42, train_loss: 0.9289, test_loss: 1.0499, test_f1: 0.4533
 epoch: 43, train_loss: 0.9287, test_loss: 1.0500, test_f1: 0.4527
 epoch: 44, train_loss: 0.9188, test_loss: 1.0440, test_f1: 0.4600
 epoch: 45, train_loss: 0.9175, test_loss: 1.1784, test_f1: 0.3993
 epoch: 46, train_loss: 0.9256, test_loss: 1.0514, test_f1: 0.4690
 epoch: 47, train_loss: 0.9199, test_loss: 1.0139, test_f1: 0.4747
 epoch: 48, train_loss: 0.9127, test_loss: 1.1529, test_f1: 0.4370
 epoch: 49, train_loss: 0.9181, test_loss: 1.0876, test_f1: 0.4299
 epoch: 50, train_loss: 0.9131, test_loss: 1.0448, test_f1: 0.4522
 epoch: 51, train_loss: 0.9091, test_loss: 1.0332, test_f1: 0.4619
 epoch: 52, train_loss: 0.8969, test_loss: 1.0520, test_f1: 0.4641
 epoch: 53, train_loss: 0.8849, test_loss: 0.9794, test_f1: 0.4822
 epoch: 54, train_loss: 0.8862, test_loss: 1.0482, test_f1: 0.4771
 epoch: 55, train_loss: 0.8769, test_loss: 0.9957, test_f1: 0.4868
 epoch: 56, train_loss: 0.8856, test_loss: 0.9854, test_f1: 0.4963
 epoch: 57, train_loss: 0.8765, test_loss: 0.9980, test_f1: 0.4632
 epoch: 58, train_loss: 0.8753, test_loss: 1.0798, test_f1: 0.4493
 epoch: 59, train_loss: 0.8819, test_loss: 1.0556, test_f1: 0.4815
 epoch: 60, train_loss: 0.8782, test_loss: 1.0019, test_f1: 0.4928
 epoch: 61, train_loss: 0.8668, test_loss: 1.0169, test_f1: 0.5001
 epoch: 62, train_loss: 0.8691, test_loss: 1.0125, test_f1: 0.4842
 epoch: 63, train_loss: 0.8710, test_loss: 1.0009, test_f1: 0.4824
 epoch: 64, train_loss: 0.8777, test_loss: 1.0135, test_f1: 0.4947
 epoch: 65, train_loss: 0.8638, test_loss: 1.0100, test_f1: 0.4885
 epoch: 66, train_loss: 0.8641, test_loss: 1.0274, test_f1: 0.4827
 epoch: 67, train_loss: 0.8696, test_loss: 1.0040, test_f1: 0.4733
 epoch: 68, train_loss: 0.8645, test_loss: 1.0008, test_f1: 0.4851
 epoch: 69, train_loss: 0.8735, test_loss: 0.9996, test_f1: 0.4714
 epoch: 70, train_loss: 0.8675, test_loss: 0.9801, test_f1: 0.5017
 epoch: 71, train_loss: 0.8506, test_loss: 1.0055, test_f1: 0.4871
 epoch: 72, train_loss: 0.8576, test_loss: 1.0308, test_f1: 0.4805
 epoch: 73, train_loss: 0.8535, test_loss: 0.9763, test_f1: 0.4843
 epoch: 74, train_loss: 0.8454, test_loss: 1.0076, test_f1: 0.4731
 epoch: 75, train_loss: 0.8547, test_loss: 1.0377, test_f1: 0.4540
 epoch: 76, train_loss: 0.8537, test_loss: 1.0459, test_f1: 0.4892
 epoch: 77, train_loss: 0.8488, test_loss: 0.9977, test_f1: 0.4827
 epoch: 78, train_loss: 0.8525, test_loss: 0.9662, test_f1: 0.4931
 epoch: 79, train_loss: 0.8592, test_loss: 0.9719, test_f1: 0.5031
 epoch: 80, train_loss: 0.8426, test_loss: 0.9943, test_f1: 0.4863
 epoch: 81, train_loss: 0.8496, test_loss: 1.0261, test_f1: 0.4731
 epoch: 82, train_loss: 0.8411, test_loss: 0.9869, test_f1: 0.4958
 epoch: 83, train_loss: 0.8412, test_loss: 1.0603, test_f1: 0.4933
 epoch: 84, train_loss: 0.8446, test_loss: 1.0144, test_f1: 0.4834
 epoch: 85, train_loss: 0.8359, test_loss: 1.0189, test_f1: 0.4832
 epoch: 86, train_loss: 0.8382, test_loss: 0.9641, test_f1: 0.4949
 epoch: 87, train_loss: 0.8256, test_loss: 0.9773, test_f1: 0.4942
 epoch: 88, train_loss: 0.8452, test_loss: 1.0007, test_f1: 0.4854
 epoch: 89, train_loss: 0.8314, test_loss: 1.0384, test_f1: 0.4915
 epoch: 90, train_loss: 0.8371, test_loss: 1.0197, test_f1: 0.5009
 epoch: 91, train_loss: 0.8268, test_loss: 1.0115, test_f1: 0.4935
 epoch: 92, train_loss: 0.8257, test_loss: 0.9632, test_f1: 0.4858
 epoch: 93, train_loss: 0.8251, test_loss: 0.9971, test_f1: 0.5051
 epoch: 94, train_loss: 0.8249, test_loss: 0.9523, test_f1: 0.5006
 epoch: 95, train_loss: 0.8262, test_loss: 1.0034, test_f1: 0.4908
 epoch: 96, train_loss: 0.8169, test_loss: 1.0147, test_f1: 0.5083
 epoch: 97, train_loss: 0.8272, test_loss: 1.0004, test_f1: 0.5120
 epoch: 98, train_loss: 0.8260, test_loss: 1.0350, test_f1: 0.4842
 epoch: 99, train_loss: 0.8124, test_loss: 0.9686, test_f1: 0.5054
##################ITERATION #2 ****************************************
 epoch: 0, train_loss: 1.3310, test_loss: 1.3219, test_f1: 0.2260
 epoch: 1, train_loss: 1.2305, test_loss: 1.2808, test_f1: 0.2260
 epoch: 2, train_loss: 1.1885, test_loss: 1.2214, test_f1: 0.2260
 epoch: 3, train_loss: 1.1469, test_loss: 1.1409, test_f1: 0.3270
 epoch: 4, train_loss: 1.1126, test_loss: 1.0838, test_f1: 0.3415
 epoch: 5, train_loss: 1.0939, test_loss: 1.0660, test_f1: 0.3429
 epoch: 6, train_loss: 1.0784, test_loss: 1.0511, test_f1: 0.3507
 epoch: 7, train_loss: 1.0591, test_loss: 1.0499, test_f1: 0.3613
 epoch: 8, train_loss: 1.0550, test_loss: 1.0462, test_f1: 0.3764
 epoch: 9, train_loss: 1.0383, test_loss: 1.0394, test_f1: 0.3818
 epoch: 10, train_loss: 1.0355, test_loss: 1.0309, test_f1: 0.3874
 epoch: 11, train_loss: 1.0301, test_loss: 1.0508, test_f1: 0.3868
 epoch: 12, train_loss: 1.0237, test_loss: 1.0266, test_f1: 0.3859
 epoch: 13, train_loss: 1.0117, test_loss: 1.0557, test_f1: 0.3843
 epoch: 14, train_loss: 1.0064, test_loss: 1.0561, test_f1: 0.4051
 epoch: 15, train_loss: 0.9988, test_loss: 1.0377, test_f1: 0.4300
 epoch: 16, train_loss: 1.0077, test_loss: 1.0382, test_f1: 0.4182
 epoch: 17, train_loss: 0.9929, test_loss: 1.0310, test_f1: 0.4268
 epoch: 18, train_loss: 0.9902, test_loss: 1.0647, test_f1: 0.4141
 epoch: 19, train_loss: 0.9771, test_loss: 1.0418, test_f1: 0.3955
 epoch: 20, train_loss: 0.9822, test_loss: 1.0299, test_f1: 0.4251
 epoch: 21, train_loss: 0.9770, test_loss: 1.0189, test_f1: 0.4428
 epoch: 22, train_loss: 0.9790, test_loss: 1.0177, test_f1: 0.4002
 epoch: 23, train_loss: 0.9712, test_loss: 1.0311, test_f1: 0.4439
 epoch: 24, train_loss: 0.9601, test_loss: 1.0162, test_f1: 0.4386
 epoch: 25, train_loss: 0.9522, test_loss: 1.0448, test_f1: 0.4253
 epoch: 26, train_loss: 0.9517, test_loss: 1.0097, test_f1: 0.4843
 epoch: 27, train_loss: 0.9498, test_loss: 1.0360, test_f1: 0.4435
 epoch: 28, train_loss: 0.9395, test_loss: 1.0168, test_f1: 0.4511
 epoch: 29, train_loss: 0.9458, test_loss: 1.0100, test_f1: 0.4651
 epoch: 30, train_loss: 0.9368, test_loss: 1.0127, test_f1: 0.4910
 epoch: 31, train_loss: 0.9389, test_loss: 1.0100, test_f1: 0.4652
 epoch: 32, train_loss: 0.9312, test_loss: 1.0210, test_f1: 0.4611
 epoch: 33, train_loss: 0.9193, test_loss: 0.9990, test_f1: 0.4835
 epoch: 34, train_loss: 0.9193, test_loss: 1.0166, test_f1: 0.4796
 epoch: 35, train_loss: 0.9174, test_loss: 0.9946, test_f1: 0.4794
 epoch: 36, train_loss: 0.9104, test_loss: 1.0055, test_f1: 0.4736
 epoch: 37, train_loss: 0.9155, test_loss: 1.0061, test_f1: 0.4695
 epoch: 38, train_loss: 0.9072, test_loss: 0.9868, test_f1: 0.4977
 epoch: 39, train_loss: 0.9059, test_loss: 0.9861, test_f1: 0.4972
 epoch: 40, train_loss: 0.9024, test_loss: 1.0379, test_f1: 0.4788
 epoch: 41, train_loss: 0.9055, test_loss: 1.0141, test_f1: 0.4884
 epoch: 42, train_loss: 0.8925, test_loss: 1.0435, test_f1: 0.4676
 epoch: 43, train_loss: 0.8964, test_loss: 1.0769, test_f1: 0.4377
 epoch: 44, train_loss: 0.9056, test_loss: 1.0013, test_f1: 0.4882
 epoch: 45, train_loss: 0.8890, test_loss: 1.0086, test_f1: 0.4852
 epoch: 46, train_loss: 0.8899, test_loss: 1.0004, test_f1: 0.4914
 epoch: 47, train_loss: 0.8836, test_loss: 1.0517, test_f1: 0.4729
 epoch: 48, train_loss: 0.8973, test_loss: 1.0243, test_f1: 0.4896
 epoch: 49, train_loss: 0.8708, test_loss: 1.0176, test_f1: 0.4823
 epoch: 50, train_loss: 0.8782, test_loss: 1.0161, test_f1: 0.4946
 epoch: 51, train_loss: 0.8700, test_loss: 1.0026, test_f1: 0.4981
 epoch: 52, train_loss: 0.8714, test_loss: 1.0069, test_f1: 0.4927
 epoch: 53, train_loss: 0.8699, test_loss: 1.0115, test_f1: 0.4948
 epoch: 54, train_loss: 0.8602, test_loss: 1.0048, test_f1: 0.5022
 epoch: 55, train_loss: 0.8516, test_loss: 1.0049, test_f1: 0.4945
 epoch: 56, train_loss: 0.8544, test_loss: 0.9987, test_f1: 0.4953
 epoch: 57, train_loss: 0.8582, test_loss: 0.9981, test_f1: 0.4999
 epoch: 58, train_loss: 0.8611, test_loss: 1.0276, test_f1: 0.4938
 epoch: 59, train_loss: 0.8519, test_loss: 1.0035, test_f1: 0.4927
 epoch: 60, train_loss: 0.8593, test_loss: 1.0003, test_f1: 0.4947
 epoch: 61, train_loss: 0.8625, test_loss: 1.0194, test_f1: 0.5046
 epoch: 62, train_loss: 0.8514, test_loss: 1.0061, test_f1: 0.4999
 epoch: 63, train_loss: 0.8406, test_loss: 1.0061, test_f1: 0.5016
 epoch: 64, train_loss: 0.8539, test_loss: 0.9995, test_f1: 0.5006
 epoch: 65, train_loss: 0.8466, test_loss: 1.0300, test_f1: 0.4917
 epoch: 66, train_loss: 0.8414, test_loss: 1.0125, test_f1: 0.4894
 epoch: 67, train_loss: 0.8490, test_loss: 1.0129, test_f1: 0.4985
 epoch: 68, train_loss: 0.8344, test_loss: 1.0154, test_f1: 0.4892
 epoch: 69, train_loss: 0.8412, test_loss: 1.0023, test_f1: 0.4961
 epoch: 70, train_loss: 0.8382, test_loss: 1.0055, test_f1: 0.4972
 epoch: 71, train_loss: 0.8453, test_loss: 1.0108, test_f1: 0.5014
 epoch: 72, train_loss: 0.8407, test_loss: 1.0513, test_f1: 0.4799
 epoch: 73, train_loss: 0.8436, test_loss: 1.0048, test_f1: 0.5069
 epoch: 74, train_loss: 0.8481, test_loss: 1.0107, test_f1: 0.5042
 epoch: 75, train_loss: 0.8411, test_loss: 1.0231, test_f1: 0.4915
 epoch: 76, train_loss: 0.8343, test_loss: 1.0151, test_f1: 0.5093
 epoch: 77, train_loss: 0.8270, test_loss: 1.0193, test_f1: 0.4989
 epoch: 78, train_loss: 0.8369, test_loss: 1.0224, test_f1: 0.4944
 epoch: 79, train_loss: 0.8317, test_loss: 1.0083, test_f1: 0.5021
 epoch: 80, train_loss: 0.8386, test_loss: 1.0196, test_f1: 0.5098
 epoch: 81, train_loss: 0.8308, test_loss: 1.0126, test_f1: 0.5054
 epoch: 82, train_loss: 0.8311, test_loss: 1.0119, test_f1: 0.5092
 epoch: 83, train_loss: 0.8412, test_loss: 1.0088, test_f1: 0.5043
 epoch: 84, train_loss: 0.8167, test_loss: 1.0186, test_f1: 0.5081
 epoch: 85, train_loss: 0.8279, test_loss: 1.0157, test_f1: 0.5112
 epoch: 86, train_loss: 0.8221, test_loss: 1.0135, test_f1: 0.4934
 epoch: 87, train_loss: 0.8231, test_loss: 1.0078, test_f1: 0.5025
 epoch: 88, train_loss: 0.8334, test_loss: 1.0129, test_f1: 0.4933
 epoch: 89, train_loss: 0.8166, test_loss: 1.0186, test_f1: 0.5048
 epoch: 90, train_loss: 0.8206, test_loss: 1.0245, test_f1: 0.5014
 epoch: 91, train_loss: 0.8248, test_loss: 1.0083, test_f1: 0.5081
 epoch: 92, train_loss: 0.8242, test_loss: 1.0311, test_f1: 0.5007
 epoch: 93, train_loss: 0.8204, test_loss: 1.0047, test_f1: 0.5177
 epoch: 94, train_loss: 0.8069, test_loss: 1.0092, test_f1: 0.5112
 epoch: 95, train_loss: 0.8214, test_loss: 1.0072, test_f1: 0.5151
 epoch: 96, train_loss: 0.8208, test_loss: 1.0059, test_f1: 0.5202
 epoch: 97, train_loss: 0.8175, test_loss: 1.0127, test_f1: 0.5186
 epoch: 98, train_loss: 0.8135, test_loss: 1.0301, test_f1: 0.5139
 epoch: 99, train_loss: 0.8203, test_loss: 1.0170, test_f1: 0.5035
##################ITERATION #3 ****************************************
 epoch: 0, train_loss: 1.3238, test_loss: 1.3263, test_f1: 0.2260
 epoch: 1, train_loss: 1.2400, test_loss: 1.2893, test_f1: 0.2260
 epoch: 2, train_loss: 1.2095, test_loss: 1.2420, test_f1: 0.2260
 epoch: 3, train_loss: 1.1737, test_loss: 1.1783, test_f1: 0.2728
 epoch: 4, train_loss: 1.1464, test_loss: 1.1136, test_f1: 0.4032
 epoch: 5, train_loss: 1.1172, test_loss: 1.0665, test_f1: 0.4226
 epoch: 6, train_loss: 1.0882, test_loss: 1.0526, test_f1: 0.4624
 epoch: 7, train_loss: 1.0738, test_loss: 1.0385, test_f1: 0.4616
 epoch: 8, train_loss: 1.0664, test_loss: 1.0317, test_f1: 0.4301
 epoch: 9, train_loss: 1.0497, test_loss: 1.0173, test_f1: 0.4489
 epoch: 10, train_loss: 1.0426, test_loss: 1.0025, test_f1: 0.4530
 epoch: 11, train_loss: 1.0269, test_loss: 0.9962, test_f1: 0.4520
 epoch: 12, train_loss: 1.0212, test_loss: 1.0194, test_f1: 0.4361
 epoch: 13, train_loss: 1.0101, test_loss: 0.9955, test_f1: 0.4560
 epoch: 14, train_loss: 1.0054, test_loss: 0.9858, test_f1: 0.4418
 epoch: 15, train_loss: 1.0042, test_loss: 0.9920, test_f1: 0.4700
 epoch: 16, train_loss: 0.9910, test_loss: 0.9796, test_f1: 0.4541
 epoch: 17, train_loss: 0.9809, test_loss: 0.9684, test_f1: 0.4602
 epoch: 18, train_loss: 0.9841, test_loss: 0.9812, test_f1: 0.4549
 epoch: 19, train_loss: 0.9749, test_loss: 1.0234, test_f1: 0.4307
 epoch: 20, train_loss: 0.9730, test_loss: 0.9610, test_f1: 0.4597
 epoch: 21, train_loss: 0.9601, test_loss: 0.9692, test_f1: 0.4563
 epoch: 22, train_loss: 0.9555, test_loss: 0.9973, test_f1: 0.4689
 epoch: 23, train_loss: 0.9502, test_loss: 0.9802, test_f1: 0.4589
 epoch: 24, train_loss: 0.9491, test_loss: 0.9747, test_f1: 0.4635
 epoch: 25, train_loss: 0.9358, test_loss: 0.9500, test_f1: 0.4695
 epoch: 26, train_loss: 0.9356, test_loss: 0.9977, test_f1: 0.4511
 epoch: 27, train_loss: 0.9347, test_loss: 0.9810, test_f1: 0.4903
 epoch: 28, train_loss: 0.9206, test_loss: 0.9833, test_f1: 0.4610
 epoch: 29, train_loss: 0.9138, test_loss: 0.9640, test_f1: 0.4705
 epoch: 30, train_loss: 0.9176, test_loss: 0.9554, test_f1: 0.4738
 epoch: 31, train_loss: 0.9223, test_loss: 0.9736, test_f1: 0.4572
 epoch: 32, train_loss: 0.9176, test_loss: 0.9783, test_f1: 0.4738
 epoch: 33, train_loss: 0.9185, test_loss: 0.9667, test_f1: 0.4609
 epoch: 34, train_loss: 0.9135, test_loss: 0.9481, test_f1: 0.4736
 epoch: 35, train_loss: 0.9220, test_loss: 0.9598, test_f1: 0.4851
 epoch: 36, train_loss: 0.8975, test_loss: 0.9490, test_f1: 0.4618
 epoch: 37, train_loss: 0.8909, test_loss: 0.9889, test_f1: 0.4772
 epoch: 38, train_loss: 0.8801, test_loss: 0.9118, test_f1: 0.5173
 epoch: 39, train_loss: 0.8881, test_loss: 0.9238, test_f1: 0.4822
 epoch: 40, train_loss: 0.8826, test_loss: 0.9534, test_f1: 0.4749
 epoch: 41, train_loss: 0.8826, test_loss: 0.9852, test_f1: 0.4734
 epoch: 42, train_loss: 0.8817, test_loss: 0.9866, test_f1: 0.4931
 epoch: 43, train_loss: 0.8704, test_loss: 0.9690, test_f1: 0.4863
 epoch: 44, train_loss: 0.8575, test_loss: 0.9186, test_f1: 0.5107
 epoch: 45, train_loss: 0.8595, test_loss: 0.9584, test_f1: 0.4799
 epoch: 46, train_loss: 0.8626, test_loss: 0.9373, test_f1: 0.4747
 epoch: 47, train_loss: 0.8551, test_loss: 0.9508, test_f1: 0.4781
 epoch: 48, train_loss: 0.8571, test_loss: 0.9344, test_f1: 0.4846
 epoch: 49, train_loss: 0.8475, test_loss: 0.9018, test_f1: 0.5192
 epoch: 50, train_loss: 0.8553, test_loss: 0.9262, test_f1: 0.5228
 epoch: 51, train_loss: 0.8386, test_loss: 0.9295, test_f1: 0.5011
 epoch: 52, train_loss: 0.8509, test_loss: 0.8986, test_f1: 0.5185
 epoch: 53, train_loss: 0.8326, test_loss: 0.8809, test_f1: 0.5277
 epoch: 54, train_loss: 0.8357, test_loss: 0.9278, test_f1: 0.5032
 epoch: 55, train_loss: 0.8236, test_loss: 0.9012, test_f1: 0.5284
 epoch: 56, train_loss: 0.8250, test_loss: 0.9087, test_f1: 0.5245
 epoch: 57, train_loss: 0.8277, test_loss: 0.8969, test_f1: 0.5216
 epoch: 58, train_loss: 0.8186, test_loss: 0.8933, test_f1: 0.5095
 epoch: 59, train_loss: 0.8167, test_loss: 0.8898, test_f1: 0.5098
 epoch: 60, train_loss: 0.8116, test_loss: 0.8987, test_f1: 0.5074
 epoch: 61, train_loss: 0.8195, test_loss: 0.8837, test_f1: 0.5294
 epoch: 62, train_loss: 0.8107, test_loss: 0.8841, test_f1: 0.5249
 epoch: 63, train_loss: 0.8240, test_loss: 0.8866, test_f1: 0.5324
 epoch: 64, train_loss: 0.8186, test_loss: 0.8891, test_f1: 0.5311
 epoch: 65, train_loss: 0.8128, test_loss: 0.8939, test_f1: 0.5167
 epoch: 66, train_loss: 0.8062, test_loss: 0.8952, test_f1: 0.5150
 epoch: 67, train_loss: 0.8032, test_loss: 0.8873, test_f1: 0.5275
 epoch: 68, train_loss: 0.8127, test_loss: 0.9118, test_f1: 0.5199
 epoch: 69, train_loss: 0.8029, test_loss: 0.9078, test_f1: 0.5269
 epoch: 70, train_loss: 0.7950, test_loss: 0.9225, test_f1: 0.5048
 epoch: 71, train_loss: 0.7990, test_loss: 0.8948, test_f1: 0.5122
 epoch: 72, train_loss: 0.8011, test_loss: 0.9736, test_f1: 0.4820
 epoch: 73, train_loss: 0.8094, test_loss: 0.8922, test_f1: 0.5126
 epoch: 74, train_loss: 0.8070, test_loss: 0.9027, test_f1: 0.5113
 epoch: 75, train_loss: 0.8016, test_loss: 0.8702, test_f1: 0.5373
 epoch: 76, train_loss: 0.7873, test_loss: 0.8675, test_f1: 0.5345
 epoch: 77, train_loss: 0.8014, test_loss: 0.8917, test_f1: 0.5271
 epoch: 78, train_loss: 0.7903, test_loss: 0.9048, test_f1: 0.5314
 epoch: 79, train_loss: 0.7951, test_loss: 0.8866, test_f1: 0.5325
 epoch: 80, train_loss: 0.7915, test_loss: 0.8901, test_f1: 0.5314
 epoch: 81, train_loss: 0.7932, test_loss: 0.8707, test_f1: 0.5228
 epoch: 82, train_loss: 0.7919, test_loss: 0.8731, test_f1: 0.5188
 epoch: 83, train_loss: 0.7749, test_loss: 0.9043, test_f1: 0.5177
 epoch: 84, train_loss: 0.7828, test_loss: 0.8848, test_f1: 0.5247
 epoch: 85, train_loss: 0.7857, test_loss: 0.8851, test_f1: 0.5150
 epoch: 86, train_loss: 0.7887, test_loss: 0.8676, test_f1: 0.5132
 epoch: 87, train_loss: 0.7823, test_loss: 0.8644, test_f1: 0.5266
 epoch: 88, train_loss: 0.7835, test_loss: 0.9432, test_f1: 0.5014
 epoch: 89, train_loss: 0.7800, test_loss: 0.9285, test_f1: 0.5149
 epoch: 90, train_loss: 0.7960, test_loss: 0.9267, test_f1: 0.5166
 epoch: 91, train_loss: 0.7788, test_loss: 0.8697, test_f1: 0.5167
 epoch: 92, train_loss: 0.7796, test_loss: 0.8926, test_f1: 0.5172
 epoch: 93, train_loss: 0.7863, test_loss: 0.8994, test_f1: 0.5253
 epoch: 94, train_loss: 0.7840, test_loss: 0.9329, test_f1: 0.5163
 epoch: 95, train_loss: 0.7732, test_loss: 0.8832, test_f1: 0.5260
 epoch: 96, train_loss: 0.7673, test_loss: 0.8810, test_f1: 0.5242
 epoch: 97, train_loss: 0.7597, test_loss: 0.8924, test_f1: 0.5207
 epoch: 98, train_loss: 0.7639, test_loss: 0.8977, test_f1: 0.5067
 epoch: 99, train_loss: 0.7709, test_loss: 0.8872, test_f1: 0.5252
##################ITERATION #4 ****************************************
 epoch: 0, train_loss: 1.3130, test_loss: 1.3212, test_f1: 0.2260
 epoch: 1, train_loss: 1.2623, test_loss: 1.3054, test_f1: 0.2260
 epoch: 2, train_loss: 1.2380, test_loss: 1.2829, test_f1: 0.2260
 epoch: 3, train_loss: 1.2145, test_loss: 1.2618, test_f1: 0.2260
 epoch: 4, train_loss: 1.1906, test_loss: 1.2284, test_f1: 0.2411
 epoch: 5, train_loss: 1.1439, test_loss: 1.1739, test_f1: 0.3755
 epoch: 6, train_loss: 1.0987, test_loss: 1.0890, test_f1: 0.3986
 epoch: 7, train_loss: 1.0698, test_loss: 1.0862, test_f1: 0.3659
 epoch: 8, train_loss: 1.0497, test_loss: 1.0265, test_f1: 0.3835
 epoch: 9, train_loss: 1.0300, test_loss: 1.1143, test_f1: 0.3595
 epoch: 10, train_loss: 1.0151, test_loss: 0.9995, test_f1: 0.4649
 epoch: 11, train_loss: 1.0116, test_loss: 1.2842, test_f1: 0.3369
 epoch: 12, train_loss: 0.9917, test_loss: 1.0012, test_f1: 0.4536
 epoch: 13, train_loss: 0.9867, test_loss: 1.2259, test_f1: 0.3990
 epoch: 14, train_loss: 0.9895, test_loss: 0.9874, test_f1: 0.4643
 epoch: 15, train_loss: 0.9799, test_loss: 1.1247, test_f1: 0.4229
 epoch: 16, train_loss: 0.9683, test_loss: 0.9891, test_f1: 0.4705
 epoch: 17, train_loss: 0.9660, test_loss: 1.0009, test_f1: 0.4770
 epoch: 18, train_loss: 0.9650, test_loss: 1.4233, test_f1: 0.3826
 epoch: 19, train_loss: 0.9590, test_loss: 0.9917, test_f1: 0.4637
 epoch: 20, train_loss: 0.9462, test_loss: 0.9920, test_f1: 0.4905
 epoch: 21, train_loss: 0.9502, test_loss: 0.9616, test_f1: 0.4651
 epoch: 22, train_loss: 0.9449, test_loss: 1.0181, test_f1: 0.4886
 epoch: 23, train_loss: 0.9474, test_loss: 0.9949, test_f1: 0.4902
 epoch: 24, train_loss: 0.9372, test_loss: 0.9950, test_f1: 0.4703
 epoch: 25, train_loss: 0.9292, test_loss: 0.9912, test_f1: 0.4895
 epoch: 26, train_loss: 0.9174, test_loss: 1.0232, test_f1: 0.4640
 epoch: 27, train_loss: 0.9131, test_loss: 1.0022, test_f1: 0.4710
 epoch: 28, train_loss: 0.9156, test_loss: 0.9751, test_f1: 0.4858
 epoch: 29, train_loss: 0.9096, test_loss: 1.0187, test_f1: 0.4862
 epoch: 30, train_loss: 0.9108, test_loss: 0.9252, test_f1: 0.4852
 epoch: 31, train_loss: 0.8979, test_loss: 1.0163, test_f1: 0.4939
 epoch: 32, train_loss: 0.8996, test_loss: 1.0017, test_f1: 0.4988
 epoch: 33, train_loss: 0.8896, test_loss: 1.0292, test_f1: 0.4695
 epoch: 34, train_loss: 0.8954, test_loss: 0.9556, test_f1: 0.4902
 epoch: 35, train_loss: 0.8913, test_loss: 0.9856, test_f1: 0.4764
 epoch: 36, train_loss: 0.8771, test_loss: 0.9803, test_f1: 0.5046
 epoch: 37, train_loss: 0.8737, test_loss: 1.0526, test_f1: 0.4664
 epoch: 38, train_loss: 0.8772, test_loss: 0.9997, test_f1: 0.4888
 epoch: 39, train_loss: 0.8648, test_loss: 1.0057, test_f1: 0.4801
 epoch: 40, train_loss: 0.8691, test_loss: 0.9633, test_f1: 0.4987
 epoch: 41, train_loss: 0.8702, test_loss: 1.0644, test_f1: 0.4732
 epoch: 42, train_loss: 0.8757, test_loss: 1.0259, test_f1: 0.4833
 epoch: 43, train_loss: 0.8617, test_loss: 0.9813, test_f1: 0.4986
 epoch: 44, train_loss: 0.8572, test_loss: 0.9992, test_f1: 0.4940
 epoch: 45, train_loss: 0.8606, test_loss: 1.0442, test_f1: 0.4842
 epoch: 46, train_loss: 0.8591, test_loss: 0.9206, test_f1: 0.5178
 epoch: 47, train_loss: 0.8607, test_loss: 1.0046, test_f1: 0.4920
 epoch: 48, train_loss: 0.8526, test_loss: 0.9915, test_f1: 0.5036
 epoch: 49, train_loss: 0.8725, test_loss: 1.1572, test_f1: 0.4539
 epoch: 50, train_loss: 0.8641, test_loss: 0.9747, test_f1: 0.4735
 epoch: 51, train_loss: 0.8391, test_loss: 0.9891, test_f1: 0.5001
 epoch: 52, train_loss: 0.8381, test_loss: 0.9723, test_f1: 0.5001
 epoch: 53, train_loss: 0.8392, test_loss: 0.9796, test_f1: 0.5061
 epoch: 54, train_loss: 0.8321, test_loss: 0.9832, test_f1: 0.5059
 epoch: 55, train_loss: 0.8331, test_loss: 0.9921, test_f1: 0.5087
 epoch: 56, train_loss: 0.8307, test_loss: 1.0017, test_f1: 0.4955
 epoch: 57, train_loss: 0.8330, test_loss: 0.9917, test_f1: 0.5063
 epoch: 58, train_loss: 0.8288, test_loss: 0.9668, test_f1: 0.5098
 epoch: 59, train_loss: 0.8367, test_loss: 0.9869, test_f1: 0.5091
 epoch: 60, train_loss: 0.8240, test_loss: 1.0035, test_f1: 0.5147
 epoch: 61, train_loss: 0.8301, test_loss: 0.9633, test_f1: 0.5053
 epoch: 62, train_loss: 0.8227, test_loss: 0.9681, test_f1: 0.5016
 epoch: 63, train_loss: 0.8252, test_loss: 1.0255, test_f1: 0.4977
 epoch: 64, train_loss: 0.8297, test_loss: 1.0440, test_f1: 0.4868
 epoch: 65, train_loss: 0.8305, test_loss: 0.9404, test_f1: 0.5046
 epoch: 66, train_loss: 0.8149, test_loss: 0.9824, test_f1: 0.5082
 epoch: 67, train_loss: 0.8163, test_loss: 0.9895, test_f1: 0.5032
 epoch: 68, train_loss: 0.8137, test_loss: 0.9776, test_f1: 0.5072
 epoch: 69, train_loss: 0.8120, test_loss: 0.9823, test_f1: 0.5062
 epoch: 70, train_loss: 0.8191, test_loss: 0.9565, test_f1: 0.5162
 epoch: 71, train_loss: 0.8093, test_loss: 1.0056, test_f1: 0.5015
 epoch: 72, train_loss: 0.8122, test_loss: 0.9812, test_f1: 0.5196
 epoch: 73, train_loss: 0.8125, test_loss: 0.9980, test_f1: 0.5108
 epoch: 74, train_loss: 0.8205, test_loss: 0.9767, test_f1: 0.5137
 epoch: 75, train_loss: 0.8060, test_loss: 1.0281, test_f1: 0.5030
 epoch: 76, train_loss: 0.8136, test_loss: 0.9771, test_f1: 0.5068
 epoch: 77, train_loss: 0.8059, test_loss: 1.0024, test_f1: 0.5053
 epoch: 78, train_loss: 0.8020, test_loss: 0.9295, test_f1: 0.5023
 epoch: 79, train_loss: 0.8040, test_loss: 1.0079, test_f1: 0.5114
 epoch: 80, train_loss: 0.8066, test_loss: 1.0308, test_f1: 0.5089
 epoch: 81, train_loss: 0.7949, test_loss: 1.0173, test_f1: 0.5003
 epoch: 82, train_loss: 0.7973, test_loss: 1.0313, test_f1: 0.4948
 epoch: 83, train_loss: 0.7875, test_loss: 1.0566, test_f1: 0.4852
 epoch: 84, train_loss: 0.7921, test_loss: 0.9761, test_f1: 0.5039
 epoch: 85, train_loss: 0.7910, test_loss: 0.9756, test_f1: 0.5216
 epoch: 86, train_loss: 0.7862, test_loss: 1.0277, test_f1: 0.4977
 epoch: 87, train_loss: 0.8016, test_loss: 1.0019, test_f1: 0.5022
 epoch: 88, train_loss: 0.7942, test_loss: 1.0097, test_f1: 0.4915
 epoch: 89, train_loss: 0.8061, test_loss: 1.0025, test_f1: 0.4744
 epoch: 90, train_loss: 0.8105, test_loss: 0.9184, test_f1: 0.5074
 epoch: 91, train_loss: 0.7945, test_loss: 0.9518, test_f1: 0.5037
 epoch: 92, train_loss: 0.8038, test_loss: 0.9723, test_f1: 0.5077
 epoch: 93, train_loss: 0.7942, test_loss: 1.0334, test_f1: 0.4975
 epoch: 94, train_loss: 0.7921, test_loss: 0.9937, test_f1: 0.5096
 epoch: 95, train_loss: 0.7873, test_loss: 1.0197, test_f1: 0.4933
 epoch: 96, train_loss: 0.7972, test_loss: 1.0414, test_f1: 0.5118
 epoch: 97, train_loss: 0.7735, test_loss: 0.9771, test_f1: 0.4971
 epoch: 98, train_loss: 0.7768, test_loss: 1.0056, test_f1: 0.5118
 epoch: 99, train_loss: 0.7756, test_loss: 0.9845, test_f1: 0.5052
##################ITERATION #5 ****************************************
 epoch: 0, train_loss: 1.3212, test_loss: 1.3255, test_f1: 0.2260
 epoch: 1, train_loss: 1.2632, test_loss: 1.3021, test_f1: 0.2260
 epoch: 2, train_loss: 1.2363, test_loss: 1.2537, test_f1: 0.2292
 epoch: 3, train_loss: 1.2044, test_loss: 1.2051, test_f1: 0.3243
 epoch: 4, train_loss: 1.1767, test_loss: 1.1660, test_f1: 0.3478
 epoch: 5, train_loss: 1.1369, test_loss: 1.1177, test_f1: 0.3812
 epoch: 6, train_loss: 1.1074, test_loss: 1.0865, test_f1: 0.3929
 epoch: 7, train_loss: 1.0832, test_loss: 1.1142, test_f1: 0.3708
 epoch: 8, train_loss: 1.0646, test_loss: 1.0589, test_f1: 0.4091
 epoch: 9, train_loss: 1.0536, test_loss: 1.0220, test_f1: 0.4100
 epoch: 10, train_loss: 1.0397, test_loss: 1.0193, test_f1: 0.4346
 epoch: 11, train_loss: 1.0301, test_loss: 0.9974, test_f1: 0.4486
 epoch: 12, train_loss: 1.0178, test_loss: 0.9951, test_f1: 0.4539
 epoch: 13, train_loss: 1.0084, test_loss: 0.9822, test_f1: 0.4468
 epoch: 14, train_loss: 0.9907, test_loss: 1.0018, test_f1: 0.4555
 epoch: 15, train_loss: 0.9889, test_loss: 0.9615, test_f1: 0.4623
 epoch: 16, train_loss: 0.9900, test_loss: 0.9728, test_f1: 0.4662
 epoch: 17, train_loss: 0.9834, test_loss: 0.9831, test_f1: 0.4730
 epoch: 18, train_loss: 0.9766, test_loss: 0.9600, test_f1: 0.4682
 epoch: 19, train_loss: 0.9727, test_loss: 0.9746, test_f1: 0.4735
 epoch: 20, train_loss: 0.9672, test_loss: 0.9841, test_f1: 0.4708
 epoch: 21, train_loss: 0.9567, test_loss: 0.9645, test_f1: 0.4827
 epoch: 22, train_loss: 0.9635, test_loss: 1.0113, test_f1: 0.4697
 epoch: 23, train_loss: 0.9642, test_loss: 1.0511, test_f1: 0.4764
 epoch: 24, train_loss: 0.9647, test_loss: 1.0508, test_f1: 0.4608
 epoch: 25, train_loss: 0.9444, test_loss: 0.9997, test_f1: 0.4745
 epoch: 26, train_loss: 0.9373, test_loss: 1.0035, test_f1: 0.4755
 epoch: 27, train_loss: 0.9546, test_loss: 0.9786, test_f1: 0.4886
 epoch: 28, train_loss: 0.9360, test_loss: 1.0150, test_f1: 0.4833
 epoch: 29, train_loss: 0.9395, test_loss: 1.0083, test_f1: 0.4756
 epoch: 30, train_loss: 0.9205, test_loss: 1.0485, test_f1: 0.4760
 epoch: 31, train_loss: 0.9213, test_loss: 1.0200, test_f1: 0.4912
 epoch: 32, train_loss: 0.9236, test_loss: 1.0155, test_f1: 0.4756
 epoch: 33, train_loss: 0.9153, test_loss: 1.1490, test_f1: 0.4653
 epoch: 34, train_loss: 0.9052, test_loss: 1.0979, test_f1: 0.4833
 epoch: 35, train_loss: 0.9001, test_loss: 1.0415, test_f1: 0.4953
 epoch: 36, train_loss: 0.9062, test_loss: 0.9992, test_f1: 0.5037
 epoch: 37, train_loss: 0.8857, test_loss: 0.9895, test_f1: 0.4957
 epoch: 38, train_loss: 0.9109, test_loss: 0.9847, test_f1: 0.5202
 epoch: 39, train_loss: 0.9012, test_loss: 1.2125, test_f1: 0.4689
 epoch: 40, train_loss: 0.8913, test_loss: 1.0322, test_f1: 0.4946
 epoch: 41, train_loss: 0.8888, test_loss: 1.0274, test_f1: 0.5011
 epoch: 42, train_loss: 0.8857, test_loss: 0.9819, test_f1: 0.5322
 epoch: 43, train_loss: 0.8813, test_loss: 0.9909, test_f1: 0.5199
 epoch: 44, train_loss: 0.8862, test_loss: 1.0513, test_f1: 0.5091
 epoch: 45, train_loss: 0.8825, test_loss: 0.9963, test_f1: 0.4843
 epoch: 46, train_loss: 0.8727, test_loss: 0.9984, test_f1: 0.4953
 epoch: 47, train_loss: 0.8768, test_loss: 1.0178, test_f1: 0.4865
 epoch: 48, train_loss: 0.8615, test_loss: 1.0329, test_f1: 0.4832
 epoch: 49, train_loss: 0.8719, test_loss: 1.0236, test_f1: 0.4880
 epoch: 50, train_loss: 0.8560, test_loss: 1.1174, test_f1: 0.4747
 epoch: 51, train_loss: 0.8648, test_loss: 1.0031, test_f1: 0.4938
 epoch: 52, train_loss: 0.8551, test_loss: 1.0067, test_f1: 0.5006
 epoch: 53, train_loss: 0.8544, test_loss: 0.9982, test_f1: 0.5096
 epoch: 54, train_loss: 0.8454, test_loss: 1.0140, test_f1: 0.5158
 epoch: 55, train_loss: 0.8399, test_loss: 1.0240, test_f1: 0.5115
 epoch: 56, train_loss: 0.8470, test_loss: 0.9996, test_f1: 0.5131
 epoch: 57, train_loss: 0.8403, test_loss: 1.0283, test_f1: 0.4989
 epoch: 58, train_loss: 0.8325, test_loss: 1.0283, test_f1: 0.4951
 epoch: 59, train_loss: 0.8290, test_loss: 1.0170, test_f1: 0.4909
 epoch: 60, train_loss: 0.8413, test_loss: 1.0496, test_f1: 0.5021
 epoch: 61, train_loss: 0.8248, test_loss: 1.0325, test_f1: 0.4904
 epoch: 62, train_loss: 0.8277, test_loss: 1.0150, test_f1: 0.5169
 epoch: 63, train_loss: 0.8329, test_loss: 1.1112, test_f1: 0.4904
 epoch: 64, train_loss: 0.8302, test_loss: 1.0100, test_f1: 0.5114
 epoch: 65, train_loss: 0.8254, test_loss: 1.0297, test_f1: 0.5052
 epoch: 66, train_loss: 0.8224, test_loss: 1.0383, test_f1: 0.4892
 epoch: 67, train_loss: 0.8232, test_loss: 1.0556, test_f1: 0.4929
 epoch: 68, train_loss: 0.8168, test_loss: 1.0221, test_f1: 0.5009
 epoch: 69, train_loss: 0.8220, test_loss: 1.0493, test_f1: 0.4814
 epoch: 70, train_loss: 0.8197, test_loss: 1.0383, test_f1: 0.4925
 epoch: 71, train_loss: 0.8281, test_loss: 1.0306, test_f1: 0.4992
 epoch: 72, train_loss: 0.8234, test_loss: 1.0600, test_f1: 0.4961
 epoch: 73, train_loss: 0.8294, test_loss: 1.0395, test_f1: 0.4839
 epoch: 74, train_loss: 0.8230, test_loss: 1.0943, test_f1: 0.4968
 epoch: 75, train_loss: 0.8197, test_loss: 1.0453, test_f1: 0.5015
 epoch: 76, train_loss: 0.8039, test_loss: 1.0629, test_f1: 0.4805
 epoch: 77, train_loss: 0.8086, test_loss: 1.0675, test_f1: 0.5102
 epoch: 78, train_loss: 0.8019, test_loss: 1.0240, test_f1: 0.5010
 epoch: 79, train_loss: 0.8094, test_loss: 1.0449, test_f1: 0.5046
 epoch: 80, train_loss: 0.8084, test_loss: 1.0236, test_f1: 0.5046
 epoch: 81, train_loss: 0.8097, test_loss: 1.0376, test_f1: 0.5015
 epoch: 82, train_loss: 0.8042, test_loss: 1.0476, test_f1: 0.4856
 epoch: 83, train_loss: 0.7983, test_loss: 1.0219, test_f1: 0.5000
 epoch: 84, train_loss: 0.8112, test_loss: 1.1180, test_f1: 0.4975
 epoch: 85, train_loss: 0.8138, test_loss: 1.0515, test_f1: 0.4969
 epoch: 86, train_loss: 0.8082, test_loss: 1.0479, test_f1: 0.5009
 epoch: 87, train_loss: 0.8076, test_loss: 1.0555, test_f1: 0.4938
 epoch: 88, train_loss: 0.8066, test_loss: 1.0565, test_f1: 0.4964
 epoch: 89, train_loss: 0.8060, test_loss: 1.0729, test_f1: 0.4900
 epoch: 90, train_loss: 0.8104, test_loss: 1.0512, test_f1: 0.5093
 epoch: 91, train_loss: 0.8011, test_loss: 1.0534, test_f1: 0.5083
 epoch: 92, train_loss: 0.7913, test_loss: 1.1010, test_f1: 0.4927
 epoch: 93, train_loss: 0.8013, test_loss: 1.0983, test_f1: 0.4883
 epoch: 94, train_loss: 0.8010, test_loss: 1.0701, test_f1: 0.5041
 epoch: 95, train_loss: 0.8010, test_loss: 1.0624, test_f1: 0.5096
 epoch: 96, train_loss: 0.8069, test_loss: 1.0763, test_f1: 0.4981
 epoch: 97, train_loss: 0.8186, test_loss: 1.0862, test_f1: 0.4796
 epoch: 98, train_loss: 0.8005, test_loss: 1.0614, test_f1: 0.4985
 epoch: 99, train_loss: 0.7956, test_loss: 1.0589, test_f1: 0.4967
##################ITERATION #6 ****************************************
 epoch: 0, train_loss: 1.3831, test_loss: 1.3767, test_f1: 0.2260
 epoch: 1, train_loss: 1.2681, test_loss: 1.3238, test_f1: 0.2540
 epoch: 2, train_loss: 1.2231, test_loss: 1.2309, test_f1: 0.2692
 epoch: 3, train_loss: 1.1695, test_loss: 1.1375, test_f1: 0.3521
 epoch: 4, train_loss: 1.1309, test_loss: 1.0589, test_f1: 0.3866
 epoch: 5, train_loss: 1.0918, test_loss: 1.0498, test_f1: 0.3856
 epoch: 6, train_loss: 1.0674, test_loss: 1.0346, test_f1: 0.4023
 epoch: 7, train_loss: 1.0493, test_loss: 1.0258, test_f1: 0.4177
 epoch: 8, train_loss: 1.0273, test_loss: 1.0067, test_f1: 0.4541
 epoch: 9, train_loss: 1.0196, test_loss: 0.9917, test_f1: 0.4218
 epoch: 10, train_loss: 1.0042, test_loss: 0.9874, test_f1: 0.4022
 epoch: 11, train_loss: 0.9911, test_loss: 0.9963, test_f1: 0.4629
 epoch: 12, train_loss: 0.9898, test_loss: 0.9840, test_f1: 0.4887
 epoch: 13, train_loss: 0.9684, test_loss: 0.9780, test_f1: 0.4634
 epoch: 14, train_loss: 0.9674, test_loss: 0.9822, test_f1: 0.4723
 epoch: 15, train_loss: 0.9616, test_loss: 0.9630, test_f1: 0.4728
 epoch: 16, train_loss: 0.9464, test_loss: 0.9676, test_f1: 0.4717
 epoch: 17, train_loss: 0.9371, test_loss: 0.9736, test_f1: 0.4780
 epoch: 18, train_loss: 0.9338, test_loss: 0.9780, test_f1: 0.4652
 epoch: 19, train_loss: 0.9350, test_loss: 0.9809, test_f1: 0.4760
 epoch: 20, train_loss: 0.9167, test_loss: 0.9724, test_f1: 0.4777
 epoch: 21, train_loss: 0.9126, test_loss: 0.9654, test_f1: 0.4912
 epoch: 22, train_loss: 0.9055, test_loss: 0.9768, test_f1: 0.4641
 epoch: 23, train_loss: 0.9037, test_loss: 0.9863, test_f1: 0.4635
 epoch: 24, train_loss: 0.9088, test_loss: 0.9746, test_f1: 0.4838
 epoch: 25, train_loss: 0.9034, test_loss: 0.9702, test_f1: 0.4860
 epoch: 26, train_loss: 0.8980, test_loss: 1.0350, test_f1: 0.4761
 epoch: 27, train_loss: 0.9017, test_loss: 0.9921, test_f1: 0.4882
 epoch: 28, train_loss: 0.8912, test_loss: 0.9535, test_f1: 0.4486
 epoch: 29, train_loss: 0.8859, test_loss: 0.9589, test_f1: 0.4535
 epoch: 30, train_loss: 0.8851, test_loss: 0.9672, test_f1: 0.4788
 epoch: 31, train_loss: 0.8752, test_loss: 0.9428, test_f1: 0.4679
 epoch: 32, train_loss: 0.8783, test_loss: 1.0717, test_f1: 0.4903
 epoch: 33, train_loss: 0.8755, test_loss: 0.9581, test_f1: 0.4828
 epoch: 34, train_loss: 0.8711, test_loss: 0.9936, test_f1: 0.4861
 epoch: 35, train_loss: 0.8766, test_loss: 0.9322, test_f1: 0.5090
 epoch: 36, train_loss: 0.8706, test_loss: 1.0183, test_f1: 0.4960
 epoch: 37, train_loss: 0.8589, test_loss: 0.9405, test_f1: 0.4792
 epoch: 38, train_loss: 0.8532, test_loss: 0.9856, test_f1: 0.4937
 epoch: 39, train_loss: 0.8576, test_loss: 0.9572, test_f1: 0.4905
 epoch: 40, train_loss: 0.8508, test_loss: 0.9309, test_f1: 0.5140
 epoch: 41, train_loss: 0.8562, test_loss: 0.9148, test_f1: 0.4861
 epoch: 42, train_loss: 0.8465, test_loss: 1.0797, test_f1: 0.4916
 epoch: 43, train_loss: 0.8415, test_loss: 0.9241, test_f1: 0.5028
 epoch: 44, train_loss: 0.8443, test_loss: 0.9657, test_f1: 0.5026
 epoch: 45, train_loss: 0.8396, test_loss: 0.9652, test_f1: 0.5003
 epoch: 46, train_loss: 0.8250, test_loss: 0.9949, test_f1: 0.4717
 epoch: 47, train_loss: 0.8300, test_loss: 0.9820, test_f1: 0.5039
 epoch: 48, train_loss: 0.8406, test_loss: 0.9216, test_f1: 0.5332
 epoch: 49, train_loss: 0.8266, test_loss: 0.9312, test_f1: 0.5224
 epoch: 50, train_loss: 0.8342, test_loss: 1.0045, test_f1: 0.4887
 epoch: 51, train_loss: 0.8187, test_loss: 0.9201, test_f1: 0.5257
 epoch: 52, train_loss: 0.8078, test_loss: 0.9159, test_f1: 0.5347
 epoch: 53, train_loss: 0.8112, test_loss: 0.9770, test_f1: 0.4849
 epoch: 54, train_loss: 0.8039, test_loss: 0.9590, test_f1: 0.5129
 epoch: 55, train_loss: 0.8141, test_loss: 0.9475, test_f1: 0.5132
 epoch: 56, train_loss: 0.8057, test_loss: 0.9652, test_f1: 0.4962
 epoch: 57, train_loss: 0.8081, test_loss: 0.9228, test_f1: 0.5293
 epoch: 58, train_loss: 0.8015, test_loss: 0.9428, test_f1: 0.5238
 epoch: 59, train_loss: 0.7971, test_loss: 0.9356, test_f1: 0.5227
 epoch: 60, train_loss: 0.8006, test_loss: 0.9220, test_f1: 0.5212
 epoch: 61, train_loss: 0.8014, test_loss: 0.9333, test_f1: 0.5246
 epoch: 62, train_loss: 0.8026, test_loss: 0.9229, test_f1: 0.5058
 epoch: 63, train_loss: 0.7986, test_loss: 1.0098, test_f1: 0.5088
 epoch: 64, train_loss: 0.7899, test_loss: 0.9724, test_f1: 0.4933
 epoch: 65, train_loss: 0.8041, test_loss: 0.9218, test_f1: 0.5085
 epoch: 66, train_loss: 0.7996, test_loss: 0.9246, test_f1: 0.5132
 epoch: 67, train_loss: 0.7870, test_loss: 0.9527, test_f1: 0.5056
 epoch: 68, train_loss: 0.7961, test_loss: 0.9414, test_f1: 0.5132
 epoch: 69, train_loss: 0.7830, test_loss: 0.9687, test_f1: 0.4980
 epoch: 70, train_loss: 0.7882, test_loss: 0.9157, test_f1: 0.5202
 epoch: 71, train_loss: 0.7999, test_loss: 0.9789, test_f1: 0.5005
 epoch: 72, train_loss: 0.7958, test_loss: 1.0062, test_f1: 0.5006
 epoch: 73, train_loss: 0.7851, test_loss: 0.9469, test_f1: 0.5233
 epoch: 74, train_loss: 0.7885, test_loss: 0.9307, test_f1: 0.5079
 epoch: 75, train_loss: 0.7838, test_loss: 0.9906, test_f1: 0.5133
 epoch: 76, train_loss: 0.7843, test_loss: 0.9666, test_f1: 0.5114
 epoch: 77, train_loss: 0.7804, test_loss: 0.9205, test_f1: 0.5066
 epoch: 78, train_loss: 0.7807, test_loss: 1.0073, test_f1: 0.4918
 epoch: 79, train_loss: 0.7731, test_loss: 0.9886, test_f1: 0.5142
 epoch: 80, train_loss: 0.7708, test_loss: 1.0072, test_f1: 0.4993
 epoch: 81, train_loss: 0.7732, test_loss: 0.9654, test_f1: 0.5093
 epoch: 82, train_loss: 0.7708, test_loss: 0.9808, test_f1: 0.5083
 epoch: 83, train_loss: 0.7677, test_loss: 0.9212, test_f1: 0.5035
 epoch: 84, train_loss: 0.7655, test_loss: 0.9197, test_f1: 0.5309
 epoch: 85, train_loss: 0.7781, test_loss: 0.9541, test_f1: 0.5155
 epoch: 86, train_loss: 0.7628, test_loss: 0.9420, test_f1: 0.5159
 epoch: 87, train_loss: 0.7700, test_loss: 0.9595, test_f1: 0.4908
 epoch: 88, train_loss: 0.7648, test_loss: 1.0101, test_f1: 0.5010
 epoch: 89, train_loss: 0.7745, test_loss: 0.9783, test_f1: 0.5132
 epoch: 90, train_loss: 0.7706, test_loss: 0.9556, test_f1: 0.4914
 epoch: 91, train_loss: 0.7705, test_loss: 1.0024, test_f1: 0.4898
 epoch: 92, train_loss: 0.7688, test_loss: 0.9353, test_f1: 0.5098
 epoch: 93, train_loss: 0.7699, test_loss: 0.9821, test_f1: 0.5011
 epoch: 94, train_loss: 0.7513, test_loss: 0.9394, test_f1: 0.5127
 epoch: 95, train_loss: 0.7589, test_loss: 1.0188, test_f1: 0.4948
 epoch: 96, train_loss: 0.7561, test_loss: 0.9862, test_f1: 0.4946
 epoch: 97, train_loss: 0.7660, test_loss: 0.9815, test_f1: 0.5171
 epoch: 98, train_loss: 0.7530, test_loss: 0.9348, test_f1: 0.5107
 epoch: 99, train_loss: 0.7548, test_loss: 0.9776, test_f1: 0.5107
##################ITERATION #7 ****************************************
 epoch: 0, train_loss: 1.2673, test_loss: 1.3089, test_f1: 0.2260
 epoch: 1, train_loss: 1.1771, test_loss: 1.3036, test_f1: 0.2379
 epoch: 2, train_loss: 1.1422, test_loss: 1.2607, test_f1: 0.2875
 epoch: 3, train_loss: 1.1070, test_loss: 1.1300, test_f1: 0.3842
 epoch: 4, train_loss: 1.0865, test_loss: 1.0563, test_f1: 0.4100
 epoch: 5, train_loss: 1.0676, test_loss: 1.0310, test_f1: 0.4442
 epoch: 6, train_loss: 1.0473, test_loss: 1.0269, test_f1: 0.4349
 epoch: 7, train_loss: 1.0419, test_loss: 1.0105, test_f1: 0.4323
 epoch: 8, train_loss: 1.0296, test_loss: 1.0297, test_f1: 0.4400
 epoch: 9, train_loss: 1.0160, test_loss: 1.0089, test_f1: 0.4484
 epoch: 10, train_loss: 0.9977, test_loss: 1.0047, test_f1: 0.4509
 epoch: 11, train_loss: 0.9920, test_loss: 1.0877, test_f1: 0.4165
 epoch: 12, train_loss: 0.9749, test_loss: 1.0138, test_f1: 0.4620
 epoch: 13, train_loss: 0.9656, test_loss: 0.9743, test_f1: 0.4757
 epoch: 14, train_loss: 0.9621, test_loss: 0.9801, test_f1: 0.4710
 epoch: 15, train_loss: 0.9466, test_loss: 0.9860, test_f1: 0.4541
 epoch: 16, train_loss: 0.9423, test_loss: 0.9601, test_f1: 0.4926
 epoch: 17, train_loss: 0.9373, test_loss: 0.9631, test_f1: 0.4751
 epoch: 18, train_loss: 0.9290, test_loss: 0.9836, test_f1: 0.4863
 epoch: 19, train_loss: 0.9281, test_loss: 1.0444, test_f1: 0.4610
 epoch: 20, train_loss: 0.9257, test_loss: 0.9939, test_f1: 0.4724
 epoch: 21, train_loss: 0.9137, test_loss: 0.9902, test_f1: 0.4727
 epoch: 22, train_loss: 0.9074, test_loss: 0.9501, test_f1: 0.4882
 epoch: 23, train_loss: 0.8981, test_loss: 0.9870, test_f1: 0.4790
 epoch: 24, train_loss: 0.8946, test_loss: 0.9542, test_f1: 0.4695
 epoch: 25, train_loss: 0.8912, test_loss: 0.9933, test_f1: 0.4799
 epoch: 26, train_loss: 0.8923, test_loss: 0.9912, test_f1: 0.4750
 epoch: 27, train_loss: 0.8888, test_loss: 0.9685, test_f1: 0.4967
 epoch: 28, train_loss: 0.8761, test_loss: 0.9445, test_f1: 0.5053
 epoch: 29, train_loss: 0.8772, test_loss: 0.9535, test_f1: 0.4927
 epoch: 30, train_loss: 0.8749, test_loss: 0.9701, test_f1: 0.5076
 epoch: 31, train_loss: 0.8767, test_loss: 0.9371, test_f1: 0.5059
 epoch: 32, train_loss: 0.8586, test_loss: 0.9148, test_f1: 0.4908
 epoch: 33, train_loss: 0.8471, test_loss: 0.9563, test_f1: 0.4979
 epoch: 34, train_loss: 0.8425, test_loss: 1.0413, test_f1: 0.4796
 epoch: 35, train_loss: 0.8473, test_loss: 1.0943, test_f1: 0.4695
 epoch: 36, train_loss: 0.8525, test_loss: 0.9527, test_f1: 0.4995
 epoch: 37, train_loss: 0.8504, test_loss: 0.9675, test_f1: 0.5235
 epoch: 38, train_loss: 0.8354, test_loss: 0.9481, test_f1: 0.5186
 epoch: 39, train_loss: 0.8401, test_loss: 1.0789, test_f1: 0.4602
 epoch: 40, train_loss: 0.8190, test_loss: 0.9408, test_f1: 0.5271
 epoch: 41, train_loss: 0.8263, test_loss: 0.9617, test_f1: 0.5174
 epoch: 42, train_loss: 0.8208, test_loss: 0.9576, test_f1: 0.5212
 epoch: 43, train_loss: 0.8299, test_loss: 0.9893, test_f1: 0.5121
 epoch: 44, train_loss: 0.8300, test_loss: 1.0136, test_f1: 0.4971
 epoch: 45, train_loss: 0.8148, test_loss: 0.9351, test_f1: 0.5147
 epoch: 46, train_loss: 0.8112, test_loss: 0.9722, test_f1: 0.5045
 epoch: 47, train_loss: 0.8113, test_loss: 0.9721, test_f1: 0.5185
 epoch: 48, train_loss: 0.8063, test_loss: 0.9915, test_f1: 0.4988
 epoch: 49, train_loss: 0.8098, test_loss: 0.9603, test_f1: 0.5083
 epoch: 50, train_loss: 0.7955, test_loss: 0.9801, test_f1: 0.5192
 epoch: 51, train_loss: 0.7963, test_loss: 0.9676, test_f1: 0.5282
 epoch: 52, train_loss: 0.7892, test_loss: 0.9758, test_f1: 0.5153
 epoch: 53, train_loss: 0.7855, test_loss: 0.9684, test_f1: 0.5264
 epoch: 54, train_loss: 0.7935, test_loss: 0.9556, test_f1: 0.5350
 epoch: 55, train_loss: 0.7768, test_loss: 0.9669, test_f1: 0.5150
 epoch: 56, train_loss: 0.7840, test_loss: 0.9768, test_f1: 0.5262
 epoch: 57, train_loss: 0.7800, test_loss: 0.9599, test_f1: 0.5363
 epoch: 58, train_loss: 0.7799, test_loss: 0.9733, test_f1: 0.5268
 epoch: 59, train_loss: 0.7732, test_loss: 0.9779, test_f1: 0.5158
 epoch: 60, train_loss: 0.7813, test_loss: 0.9769, test_f1: 0.5246
 epoch: 61, train_loss: 0.7667, test_loss: 0.9715, test_f1: 0.5272
 epoch: 62, train_loss: 0.7672, test_loss: 0.9660, test_f1: 0.5229
 epoch: 63, train_loss: 0.7772, test_loss: 0.9585, test_f1: 0.5316
 epoch: 64, train_loss: 0.7723, test_loss: 0.9775, test_f1: 0.5141
 epoch: 65, train_loss: 0.7679, test_loss: 0.9593, test_f1: 0.5352
 epoch: 66, train_loss: 0.7573, test_loss: 1.0038, test_f1: 0.5066
 epoch: 67, train_loss: 0.7542, test_loss: 0.9588, test_f1: 0.5182
 epoch: 68, train_loss: 0.7581, test_loss: 1.0002, test_f1: 0.5111
 epoch: 69, train_loss: 0.7714, test_loss: 0.9769, test_f1: 0.5233
 epoch: 70, train_loss: 0.7630, test_loss: 0.9600, test_f1: 0.5187
 epoch: 71, train_loss: 0.7682, test_loss: 0.9631, test_f1: 0.5254
 epoch: 72, train_loss: 0.7478, test_loss: 0.9644, test_f1: 0.5263
 epoch: 73, train_loss: 0.7525, test_loss: 0.9684, test_f1: 0.5284
 epoch: 74, train_loss: 0.7566, test_loss: 0.9891, test_f1: 0.5200
 epoch: 75, train_loss: 0.7655, test_loss: 0.9762, test_f1: 0.5312
 epoch: 76, train_loss: 0.7588, test_loss: 0.9547, test_f1: 0.5320
 epoch: 77, train_loss: 0.7494, test_loss: 0.9860, test_f1: 0.5198
 epoch: 78, train_loss: 0.7478, test_loss: 1.0043, test_f1: 0.5245
 epoch: 79, train_loss: 0.7608, test_loss: 0.9840, test_f1: 0.5245
 epoch: 80, train_loss: 0.7577, test_loss: 0.9836, test_f1: 0.5254
 epoch: 81, train_loss: 0.7571, test_loss: 0.9943, test_f1: 0.5144
 epoch: 82, train_loss: 0.7466, test_loss: 0.9831, test_f1: 0.5210
 epoch: 83, train_loss: 0.7359, test_loss: 1.0026, test_f1: 0.5199
 epoch: 84, train_loss: 0.7475, test_loss: 0.9719, test_f1: 0.5269
 epoch: 85, train_loss: 0.7436, test_loss: 0.9750, test_f1: 0.5255
 epoch: 86, train_loss: 0.7351, test_loss: 0.9826, test_f1: 0.5216
 epoch: 87, train_loss: 0.7358, test_loss: 0.9800, test_f1: 0.5472
 epoch: 88, train_loss: 0.7354, test_loss: 0.9946, test_f1: 0.5279
 epoch: 89, train_loss: 0.7315, test_loss: 1.0006, test_f1: 0.5165
 epoch: 90, train_loss: 0.7399, test_loss: 0.9774, test_f1: 0.5423
 epoch: 91, train_loss: 0.7519, test_loss: 1.0180, test_f1: 0.5233
 epoch: 92, train_loss: 0.7258, test_loss: 0.9664, test_f1: 0.5366
 epoch: 93, train_loss: 0.7430, test_loss: 0.9872, test_f1: 0.5319
 epoch: 94, train_loss: 0.7340, test_loss: 1.0214, test_f1: 0.5253
 epoch: 95, train_loss: 0.7314, test_loss: 0.9962, test_f1: 0.5266
 epoch: 96, train_loss: 0.7313, test_loss: 1.0140, test_f1: 0.5289
 epoch: 97, train_loss: 0.7326, test_loss: 1.0244, test_f1: 0.5230
 epoch: 98, train_loss: 0.7323, test_loss: 1.0060, test_f1: 0.5265
 epoch: 99, train_loss: 0.7505, test_loss: 0.9873, test_f1: 0.5302
##################ITERATION #8 ****************************************
 epoch: 0, train_loss: 1.3747, test_loss: 1.4149, test_f1: 0.2260
 epoch: 1, train_loss: 1.2128, test_loss: 1.4157, test_f1: 0.2260
 epoch: 2, train_loss: 1.1698, test_loss: 1.3738, test_f1: 0.2260
 epoch: 3, train_loss: 1.1266, test_loss: 1.2345, test_f1: 0.2303
 epoch: 4, train_loss: 1.0872, test_loss: 1.0471, test_f1: 0.3714
 epoch: 5, train_loss: 1.0776, test_loss: 1.0509, test_f1: 0.3964
 epoch: 6, train_loss: 1.0565, test_loss: 1.0497, test_f1: 0.4101
 epoch: 7, train_loss: 1.0395, test_loss: 1.0643, test_f1: 0.4105
 epoch: 8, train_loss: 1.0235, test_loss: 1.0451, test_f1: 0.4289
 epoch: 9, train_loss: 1.0203, test_loss: 1.0443, test_f1: 0.4541
 epoch: 10, train_loss: 1.0033, test_loss: 1.0426, test_f1: 0.4414
 epoch: 11, train_loss: 1.0045, test_loss: 1.0496, test_f1: 0.4187
 epoch: 12, train_loss: 0.9939, test_loss: 1.0353, test_f1: 0.4530
 epoch: 13, train_loss: 0.9897, test_loss: 1.0287, test_f1: 0.4611
 epoch: 14, train_loss: 0.9838, test_loss: 1.0231, test_f1: 0.4693
 epoch: 15, train_loss: 0.9757, test_loss: 1.0098, test_f1: 0.4740
 epoch: 16, train_loss: 0.9637, test_loss: 1.0007, test_f1: 0.4708
 epoch: 17, train_loss: 0.9620, test_loss: 1.0147, test_f1: 0.4862
 epoch: 18, train_loss: 0.9534, test_loss: 1.0709, test_f1: 0.4521
 epoch: 19, train_loss: 0.9554, test_loss: 1.0042, test_f1: 0.4965
 epoch: 20, train_loss: 0.9350, test_loss: 1.0622, test_f1: 0.4664
 epoch: 21, train_loss: 0.9447, test_loss: 0.9977, test_f1: 0.5022
 epoch: 22, train_loss: 0.9287, test_loss: 0.9597, test_f1: 0.5117
 epoch: 23, train_loss: 0.9277, test_loss: 0.9762, test_f1: 0.5049
 epoch: 24, train_loss: 0.9301, test_loss: 0.9894, test_f1: 0.4936
 epoch: 25, train_loss: 0.9157, test_loss: 1.0235, test_f1: 0.4879
 epoch: 26, train_loss: 0.9180, test_loss: 0.9594, test_f1: 0.5089
 epoch: 27, train_loss: 0.9034, test_loss: 0.9773, test_f1: 0.5084
 epoch: 28, train_loss: 0.9064, test_loss: 0.9554, test_f1: 0.5176
 epoch: 29, train_loss: 0.9056, test_loss: 1.0220, test_f1: 0.4903
 epoch: 30, train_loss: 0.9064, test_loss: 0.9744, test_f1: 0.5088
 epoch: 31, train_loss: 0.8891, test_loss: 0.9477, test_f1: 0.5142
 epoch: 32, train_loss: 0.9001, test_loss: 0.9975, test_f1: 0.4976
 epoch: 33, train_loss: 0.8968, test_loss: 1.0745, test_f1: 0.4805
 epoch: 34, train_loss: 0.9054, test_loss: 1.1183, test_f1: 0.4770
 epoch: 35, train_loss: 0.9006, test_loss: 1.0034, test_f1: 0.5000
 epoch: 36, train_loss: 0.8792, test_loss: 0.9741, test_f1: 0.5237
 epoch: 37, train_loss: 0.8720, test_loss: 0.9735, test_f1: 0.5193
 epoch: 38, train_loss: 0.8602, test_loss: 1.0195, test_f1: 0.5009
 epoch: 39, train_loss: 0.8647, test_loss: 0.9896, test_f1: 0.5127
 epoch: 40, train_loss: 0.8554, test_loss: 0.9883, test_f1: 0.4988
 epoch: 41, train_loss: 0.8575, test_loss: 0.9771, test_f1: 0.5206
 epoch: 42, train_loss: 0.8550, test_loss: 0.9646, test_f1: 0.5257
 epoch: 43, train_loss: 0.8589, test_loss: 0.9728, test_f1: 0.5278
 epoch: 44, train_loss: 0.8530, test_loss: 1.0215, test_f1: 0.5057
 epoch: 45, train_loss: 0.8462, test_loss: 0.9750, test_f1: 0.5245
 epoch: 46, train_loss: 0.8456, test_loss: 0.9819, test_f1: 0.5141
 epoch: 47, train_loss: 0.8523, test_loss: 0.9777, test_f1: 0.5123
 epoch: 48, train_loss: 0.8338, test_loss: 0.9796, test_f1: 0.5206
 epoch: 49, train_loss: 0.8282, test_loss: 0.9611, test_f1: 0.5147
 epoch: 50, train_loss: 0.8276, test_loss: 0.9752, test_f1: 0.5271
 epoch: 51, train_loss: 0.8132, test_loss: 0.9834, test_f1: 0.5221
 epoch: 52, train_loss: 0.8150, test_loss: 0.9798, test_f1: 0.5221
 epoch: 53, train_loss: 0.8063, test_loss: 0.9558, test_f1: 0.5280
 epoch: 54, train_loss: 0.8109, test_loss: 0.9962, test_f1: 0.5179
 epoch: 55, train_loss: 0.8056, test_loss: 1.0021, test_f1: 0.5129
 epoch: 56, train_loss: 0.8045, test_loss: 0.9804, test_f1: 0.5195
 epoch: 57, train_loss: 0.8050, test_loss: 1.0217, test_f1: 0.5127
 epoch: 58, train_loss: 0.8009, test_loss: 1.0098, test_f1: 0.5145
 epoch: 59, train_loss: 0.7884, test_loss: 0.9767, test_f1: 0.5193
 epoch: 60, train_loss: 0.7998, test_loss: 0.9907, test_f1: 0.5201
 epoch: 61, train_loss: 0.8132, test_loss: 0.9969, test_f1: 0.5173
 epoch: 62, train_loss: 0.7929, test_loss: 1.0119, test_f1: 0.5230
 epoch: 63, train_loss: 0.7894, test_loss: 0.9841, test_f1: 0.5330
 epoch: 64, train_loss: 0.7903, test_loss: 1.0128, test_f1: 0.5203
 epoch: 65, train_loss: 0.7777, test_loss: 0.9943, test_f1: 0.5214
 epoch: 66, train_loss: 0.7873, test_loss: 0.9839, test_f1: 0.5301
 epoch: 67, train_loss: 0.7947, test_loss: 0.9796, test_f1: 0.5321
 epoch: 68, train_loss: 0.7935, test_loss: 0.9904, test_f1: 0.5188
 epoch: 69, train_loss: 0.7892, test_loss: 0.9985, test_f1: 0.5134
 epoch: 70, train_loss: 0.7746, test_loss: 0.9886, test_f1: 0.5234
 epoch: 71, train_loss: 0.7782, test_loss: 0.9723, test_f1: 0.5291
 epoch: 72, train_loss: 0.7804, test_loss: 0.9826, test_f1: 0.5292
 epoch: 73, train_loss: 0.7835, test_loss: 0.9786, test_f1: 0.5308
 epoch: 74, train_loss: 0.7862, test_loss: 0.9948, test_f1: 0.5153
 epoch: 75, train_loss: 0.7733, test_loss: 0.9842, test_f1: 0.5323
 epoch: 76, train_loss: 0.7925, test_loss: 0.9902, test_f1: 0.5236
 epoch: 77, train_loss: 0.7775, test_loss: 1.0034, test_f1: 0.5170
 epoch: 78, train_loss: 0.7738, test_loss: 0.9711, test_f1: 0.5278
 epoch: 79, train_loss: 0.7688, test_loss: 1.0044, test_f1: 0.5153
 epoch: 80, train_loss: 0.7786, test_loss: 0.9748, test_f1: 0.5318
 epoch: 81, train_loss: 0.7638, test_loss: 1.0164, test_f1: 0.5152
 epoch: 82, train_loss: 0.7803, test_loss: 0.9905, test_f1: 0.5275
 epoch: 83, train_loss: 0.7702, test_loss: 0.9847, test_f1: 0.5335
 epoch: 84, train_loss: 0.7583, test_loss: 1.0210, test_f1: 0.5332
 epoch: 85, train_loss: 0.7736, test_loss: 0.9944, test_f1: 0.5298
 epoch: 86, train_loss: 0.7739, test_loss: 1.0155, test_f1: 0.5193
 epoch: 87, train_loss: 0.7629, test_loss: 1.0133, test_f1: 0.5226
 epoch: 88, train_loss: 0.7734, test_loss: 0.9710, test_f1: 0.5326
 epoch: 89, train_loss: 0.7521, test_loss: 1.0209, test_f1: 0.5257
 epoch: 90, train_loss: 0.7639, test_loss: 0.9726, test_f1: 0.5300
 epoch: 91, train_loss: 0.7657, test_loss: 1.0295, test_f1: 0.5169
 epoch: 92, train_loss: 0.7611, test_loss: 1.0234, test_f1: 0.5221
 epoch: 93, train_loss: 0.7493, test_loss: 0.9944, test_f1: 0.5255
 epoch: 94, train_loss: 0.7388, test_loss: 1.0179, test_f1: 0.5245
 epoch: 95, train_loss: 0.7405, test_loss: 1.0082, test_f1: 0.5232
 epoch: 96, train_loss: 0.7528, test_loss: 0.9963, test_f1: 0.5374
 epoch: 97, train_loss: 0.7501, test_loss: 1.0615, test_f1: 0.5241
 epoch: 98, train_loss: 0.7531, test_loss: 0.9628, test_f1: 0.5397
 epoch: 99, train_loss: 0.7501, test_loss: 1.0083, test_f1: 0.5226
##################ITERATION #9 ****************************************
 epoch: 0, train_loss: 1.5550, test_loss: 1.4236, test_f1: 0.2551
 epoch: 1, train_loss: 1.2876, test_loss: 1.3839, test_f1: 0.2260
 epoch: 2, train_loss: 1.2367, test_loss: 1.3142, test_f1: 0.2266
 epoch: 3, train_loss: 1.1806, test_loss: 1.2718, test_f1: 0.2274
 epoch: 4, train_loss: 1.1421, test_loss: 1.1851, test_f1: 0.2510
 epoch: 5, train_loss: 1.1038, test_loss: 1.1007, test_f1: 0.3284
 epoch: 6, train_loss: 1.0903, test_loss: 1.0545, test_f1: 0.3442
 epoch: 7, train_loss: 1.0454, test_loss: 1.0422, test_f1: 0.3529
 epoch: 8, train_loss: 1.0389, test_loss: 1.0402, test_f1: 0.3748
 epoch: 9, train_loss: 1.0174, test_loss: 1.0370, test_f1: 0.3886
 epoch: 10, train_loss: 1.0102, test_loss: 1.0311, test_f1: 0.3887
 epoch: 11, train_loss: 0.9964, test_loss: 1.0297, test_f1: 0.4115
 epoch: 12, train_loss: 0.9844, test_loss: 1.0474, test_f1: 0.4280
 epoch: 13, train_loss: 0.9754, test_loss: 1.0336, test_f1: 0.4042
 epoch: 14, train_loss: 0.9651, test_loss: 1.0275, test_f1: 0.4549
 epoch: 15, train_loss: 0.9695, test_loss: 1.0138, test_f1: 0.4683
 epoch: 16, train_loss: 0.9569, test_loss: 1.0081, test_f1: 0.4871
 epoch: 17, train_loss: 0.9575, test_loss: 0.9943, test_f1: 0.4716
 epoch: 18, train_loss: 0.9544, test_loss: 0.9840, test_f1: 0.4914
 epoch: 19, train_loss: 0.9432, test_loss: 0.9828, test_f1: 0.5086
 epoch: 20, train_loss: 0.9384, test_loss: 0.9635, test_f1: 0.4909
 epoch: 21, train_loss: 0.9329, test_loss: 1.0102, test_f1: 0.4888
 epoch: 22, train_loss: 0.9165, test_loss: 0.9877, test_f1: 0.4903
 epoch: 23, train_loss: 0.9099, test_loss: 0.9583, test_f1: 0.5065
 epoch: 24, train_loss: 0.9195, test_loss: 0.9732, test_f1: 0.4969
 epoch: 25, train_loss: 0.8986, test_loss: 0.9440, test_f1: 0.5041
 epoch: 26, train_loss: 0.8996, test_loss: 0.9767, test_f1: 0.4727
 epoch: 27, train_loss: 0.8966, test_loss: 0.9701, test_f1: 0.5132
 epoch: 28, train_loss: 0.8960, test_loss: 0.9454, test_f1: 0.5009
 epoch: 29, train_loss: 0.8919, test_loss: 0.9569, test_f1: 0.5005
 epoch: 30, train_loss: 0.8856, test_loss: 0.9671, test_f1: 0.4905
 epoch: 31, train_loss: 0.8812, test_loss: 0.9380, test_f1: 0.5120
 epoch: 32, train_loss: 0.8746, test_loss: 0.9571, test_f1: 0.5018
 epoch: 33, train_loss: 0.8793, test_loss: 0.9222, test_f1: 0.5063
 epoch: 34, train_loss: 0.8815, test_loss: 0.9435, test_f1: 0.4909
 epoch: 35, train_loss: 0.8742, test_loss: 0.9404, test_f1: 0.5067
 epoch: 36, train_loss: 0.8719, test_loss: 0.9370, test_f1: 0.5102
 epoch: 37, train_loss: 0.8607, test_loss: 0.9349, test_f1: 0.5130
 epoch: 38, train_loss: 0.8574, test_loss: 0.9310, test_f1: 0.5117
 epoch: 39, train_loss: 0.8609, test_loss: 0.9231, test_f1: 0.5200
 epoch: 40, train_loss: 0.8435, test_loss: 0.9396, test_f1: 0.5020
 epoch: 41, train_loss: 0.8461, test_loss: 0.9544, test_f1: 0.5122
 epoch: 42, train_loss: 0.8474, test_loss: 0.9505, test_f1: 0.5177
 epoch: 43, train_loss: 0.8475, test_loss: 0.9252, test_f1: 0.5179
 epoch: 44, train_loss: 0.8353, test_loss: 0.9867, test_f1: 0.4860
 epoch: 45, train_loss: 0.8314, test_loss: 0.8816, test_f1: 0.5191
 epoch: 46, train_loss: 0.8434, test_loss: 0.9199, test_f1: 0.5073
 epoch: 47, train_loss: 0.8333, test_loss: 1.0103, test_f1: 0.5012
 epoch: 48, train_loss: 0.8253, test_loss: 0.9224, test_f1: 0.5137
 epoch: 49, train_loss: 0.8134, test_loss: 0.9402, test_f1: 0.5061
 epoch: 50, train_loss: 0.8206, test_loss: 0.9233, test_f1: 0.5017
 epoch: 51, train_loss: 0.8139, test_loss: 0.9365, test_f1: 0.5105
 epoch: 52, train_loss: 0.8081, test_loss: 0.9245, test_f1: 0.5149
 epoch: 53, train_loss: 0.8005, test_loss: 0.9047, test_f1: 0.5278
 epoch: 54, train_loss: 0.7910, test_loss: 0.9092, test_f1: 0.5119
 epoch: 55, train_loss: 0.8093, test_loss: 0.8980, test_f1: 0.5129
 epoch: 56, train_loss: 0.8085, test_loss: 0.9604, test_f1: 0.4881
 epoch: 57, train_loss: 0.8009, test_loss: 0.9702, test_f1: 0.4944
 epoch: 58, train_loss: 0.7941, test_loss: 0.9067, test_f1: 0.5294
 epoch: 59, train_loss: 0.7998, test_loss: 0.9089, test_f1: 0.5213
 epoch: 60, train_loss: 0.8056, test_loss: 0.9300, test_f1: 0.5062
 epoch: 61, train_loss: 0.7959, test_loss: 0.9411, test_f1: 0.5190
 epoch: 62, train_loss: 0.7940, test_loss: 0.9228, test_f1: 0.5231
 epoch: 63, train_loss: 0.7919, test_loss: 0.9481, test_f1: 0.5096
 epoch: 64, train_loss: 0.7977, test_loss: 0.9280, test_f1: 0.5256
 epoch: 65, train_loss: 0.7963, test_loss: 0.9259, test_f1: 0.5337
 epoch: 66, train_loss: 0.7873, test_loss: 0.9047, test_f1: 0.5131
 epoch: 67, train_loss: 0.7766, test_loss: 0.9714, test_f1: 0.5006
 epoch: 68, train_loss: 0.7756, test_loss: 0.9021, test_f1: 0.5471
 epoch: 69, train_loss: 0.7789, test_loss: 0.9292, test_f1: 0.5284
 epoch: 70, train_loss: 0.7822, test_loss: 0.9582, test_f1: 0.5259
 epoch: 71, train_loss: 0.7816, test_loss: 0.9235, test_f1: 0.5295
 epoch: 72, train_loss: 0.7776, test_loss: 0.9313, test_f1: 0.5304
 epoch: 73, train_loss: 0.7752, test_loss: 0.8921, test_f1: 0.5349
 epoch: 74, train_loss: 0.7645, test_loss: 0.9044, test_f1: 0.5324
 epoch: 75, train_loss: 0.7707, test_loss: 0.9298, test_f1: 0.5202
 epoch: 76, train_loss: 0.7700, test_loss: 0.9466, test_f1: 0.5138
 epoch: 77, train_loss: 0.7613, test_loss: 0.9093, test_f1: 0.5238
 epoch: 78, train_loss: 0.7623, test_loss: 0.9044, test_f1: 0.5260
 epoch: 79, train_loss: 0.7586, test_loss: 0.9061, test_f1: 0.5302
 epoch: 80, train_loss: 0.7589, test_loss: 0.9258, test_f1: 0.5321
 epoch: 81, train_loss: 0.7516, test_loss: 0.9307, test_f1: 0.5358
 epoch: 82, train_loss: 0.7628, test_loss: 0.9486, test_f1: 0.5275
 epoch: 83, train_loss: 0.7610, test_loss: 0.9556, test_f1: 0.5294
 epoch: 84, train_loss: 0.7692, test_loss: 0.9070, test_f1: 0.5163
 epoch: 85, train_loss: 0.7566, test_loss: 0.9412, test_f1: 0.5218
 epoch: 86, train_loss: 0.7551, test_loss: 0.9517, test_f1: 0.5170
 epoch: 87, train_loss: 0.7604, test_loss: 0.9016, test_f1: 0.5361
 epoch: 88, train_loss: 0.7495, test_loss: 0.8937, test_f1: 0.5381
 epoch: 89, train_loss: 0.7626, test_loss: 0.9096, test_f1: 0.5243
 epoch: 90, train_loss: 0.7558, test_loss: 0.9054, test_f1: 0.5349
 epoch: 91, train_loss: 0.7482, test_loss: 0.9358, test_f1: 0.5169
 epoch: 92, train_loss: 0.7567, test_loss: 0.9593, test_f1: 0.5130
 epoch: 93, train_loss: 0.7422, test_loss: 0.9280, test_f1: 0.5320
 epoch: 94, train_loss: 0.7462, test_loss: 0.9237, test_f1: 0.5211
 epoch: 95, train_loss: 0.7445, test_loss: 0.9424, test_f1: 0.5207
 epoch: 96, train_loss: 0.7418, test_loss: 0.9275, test_f1: 0.5268
 epoch: 97, train_loss: 0.7355, test_loss: 0.9457, test_f1: 0.5223
 epoch: 98, train_loss: 0.7379, test_loss: 0.9314, test_f1: 0.5205
 epoch: 99, train_loss: 0.7351, test_loss: 0.9523, test_f1: 0.5206

Training completed in 604.68 seconds
Best F1: 0.5472 at epoch 87
Mean F1 across iterations: 0.5315  0.0113
========================FINAL RESULTS================================
FEGIN weighted F1: 0.5472  0.0113
python main.py --data ltspice_examples --representation component_pin --model FEGIN --layers 5 --hiddens 16 --batch_size 256 --lr 0.001 --emb_size 128 --epochs 100 --save_appendix component_pin_L5_H16_BS256_LR0.001_E128 --no_val
-----



STDERR:
  File "main.py", line 370, in <module>
    main()
  File "main.py", line 254, in main
    dataset = dataset_class(
  File "/home/philip/projects/llm_inference_code_repo/Circuit-Completion-Using-GNNs/component_classification_with_link_prediction_head/evaluation/FEGIN/kernel/circuit_datasets.py", line 15, in __init__
    self.data, self.slices = torch.load(self.processed_paths[0])
  File "/home/philip/.local/lib/python3.8/site-packages/torch/serialization.py", line 1040, in load
    warnings.warn(
  File "/usr/lib/python3.8/warnings.py", line 109, in _showwarnmsg
    sw(msg.message, msg.category, msg.filename, msg.lineno,
  File "main.py", line 47, in warn_with_traceback
    traceback.print_stack(file=log)
/home/philip/projects/llm_inference_code_repo/Circuit-Completion-Using-GNNs/component_classification_with_link_prediction_head/evaluation/FEGIN/kernel/circuit_datasets.py:15: FutureWarning: You are using `torch.load` with `weights_only=False` (the current default value), which uses the default pickle module implicitly. It is possible to construct malicious pickle data which will execute arbitrary code during unpickling (See https://github.com/pytorch/pytorch/blob/main/SECURITY.md#untrusted-models for more details). In a future release, the default value for `weights_only` will be flipped to `True`. This limits the functions that could be executed during unpickling. Arbitrary objects will no longer be allowed to be loaded via this mode unless they are explicitly allowlisted by the user via `torch.serialization.add_safe_globals`. We recommend you start setting `weights_only=True` for any use case where you don't have full control of the loaded file. Please open an issue on GitHub for any issues related to this experimental feature.
  self.data, self.slices = torch.load(self.processed_paths[0])
