STDOUT:
Results will be saved in /home/philip/projects/ltspice_examples_code_repo/Circuit-Completion-Using-GNNs/component_classification_with_link_prediction_head/evaluation/FEGIN/results/model_FEGIN_dataset_ltspice_examples
Command line input: python main.py --data ltspice_examples --representation component_component --model FEGIN --layers 2 --hiddens 64 --batch_size 32 --lr 0.0001 --emb_size 128 --epochs 100 --save_appendix component_component_L2_H64_BS32_LR0.0001_E128 --no_val
 is saved.
-----
ltspice_examples - FEGIN
Using 2 layers, 64 hidden units, h = 2
Loading component_component representation dataset
ENTERED
Training FEGIN on component_component representation
Train: 3556, Test: 845
##################ITERATION #0 ****************************************
 epoch: 0, train_loss: 1.3779, test_loss: 1.3513, test_f1: 0.2659
 epoch: 1, train_loss: 1.3336, test_loss: 1.3074, test_f1: 0.2541
 epoch: 2, train_loss: 1.2919, test_loss: 1.2635, test_f1: 0.2585
 epoch: 3, train_loss: 1.2592, test_loss: 1.2280, test_f1: 0.3044
 epoch: 4, train_loss: 1.2352, test_loss: 1.2008, test_f1: 0.3286
 epoch: 5, train_loss: 1.2218, test_loss: 1.1819, test_f1: 0.3527
 epoch: 6, train_loss: 1.2045, test_loss: 1.1660, test_f1: 0.3522
 epoch: 7, train_loss: 1.1906, test_loss: 1.1557, test_f1: 0.3501
 epoch: 8, train_loss: 1.1756, test_loss: 1.1420, test_f1: 0.3582
 epoch: 9, train_loss: 1.1696, test_loss: 1.1266, test_f1: 0.3842
 epoch: 10, train_loss: 1.1547, test_loss: 1.1147, test_f1: 0.3982
 epoch: 11, train_loss: 1.1446, test_loss: 1.1007, test_f1: 0.4168
 epoch: 12, train_loss: 1.1366, test_loss: 1.0907, test_f1: 0.4402
 epoch: 13, train_loss: 1.1208, test_loss: 1.0810, test_f1: 0.4362
 epoch: 14, train_loss: 1.1128, test_loss: 1.0796, test_f1: 0.4314
 epoch: 15, train_loss: 1.1041, test_loss: 1.0654, test_f1: 0.4489
 epoch: 16, train_loss: 1.1020, test_loss: 1.0497, test_f1: 0.4567
 epoch: 17, train_loss: 1.0897, test_loss: 1.0489, test_f1: 0.4441
 epoch: 18, train_loss: 1.0798, test_loss: 1.0306, test_f1: 0.4667
 epoch: 19, train_loss: 1.0729, test_loss: 1.0243, test_f1: 0.4353
 epoch: 20, train_loss: 1.0687, test_loss: 1.0108, test_f1: 0.4674
 epoch: 21, train_loss: 1.0622, test_loss: 1.0165, test_f1: 0.4601
 epoch: 22, train_loss: 1.0518, test_loss: 1.0088, test_f1: 0.4828
 epoch: 23, train_loss: 1.0428, test_loss: 0.9908, test_f1: 0.4606
 epoch: 24, train_loss: 1.0380, test_loss: 0.9898, test_f1: 0.4748
 epoch: 25, train_loss: 1.0289, test_loss: 0.9853, test_f1: 0.4823
 epoch: 26, train_loss: 1.0310, test_loss: 0.9828, test_f1: 0.4873
 epoch: 27, train_loss: 1.0077, test_loss: 0.9699, test_f1: 0.4840
 epoch: 28, train_loss: 1.0145, test_loss: 0.9626, test_f1: 0.4932
 epoch: 29, train_loss: 1.0035, test_loss: 0.9558, test_f1: 0.5099
 epoch: 30, train_loss: 1.0055, test_loss: 0.9614, test_f1: 0.4861
 epoch: 31, train_loss: 1.0075, test_loss: 0.9488, test_f1: 0.5084
 epoch: 32, train_loss: 0.9903, test_loss: 0.9670, test_f1: 0.4988
 epoch: 33, train_loss: 0.9811, test_loss: 0.9489, test_f1: 0.4945
 epoch: 34, train_loss: 0.9966, test_loss: 0.9401, test_f1: 0.5108
 epoch: 35, train_loss: 0.9895, test_loss: 0.9450, test_f1: 0.5049
 epoch: 36, train_loss: 0.9819, test_loss: 0.9520, test_f1: 0.4837
 epoch: 37, train_loss: 0.9757, test_loss: 0.9445, test_f1: 0.4950
 epoch: 38, train_loss: 0.9682, test_loss: 0.9294, test_f1: 0.5135
 epoch: 39, train_loss: 0.9610, test_loss: 0.9332, test_f1: 0.5155
 epoch: 40, train_loss: 0.9687, test_loss: 0.9281, test_f1: 0.5303
 epoch: 41, train_loss: 0.9596, test_loss: 0.9298, test_f1: 0.5142
 epoch: 42, train_loss: 0.9592, test_loss: 0.9305, test_f1: 0.5060
 epoch: 43, train_loss: 0.9462, test_loss: 0.9231, test_f1: 0.5176
 epoch: 44, train_loss: 0.9407, test_loss: 0.9295, test_f1: 0.5170
 epoch: 45, train_loss: 0.9527, test_loss: 0.9233, test_f1: 0.5055
 epoch: 46, train_loss: 0.9382, test_loss: 0.9247, test_f1: 0.5029
 epoch: 47, train_loss: 0.9525, test_loss: 0.9129, test_f1: 0.5109
 epoch: 48, train_loss: 0.9365, test_loss: 0.9348, test_f1: 0.5018
 epoch: 49, train_loss: 0.9377, test_loss: 0.9268, test_f1: 0.5109
 epoch: 50, train_loss: 0.9296, test_loss: 0.9340, test_f1: 0.5102
 epoch: 51, train_loss: 0.9252, test_loss: 0.9217, test_f1: 0.5087
 epoch: 52, train_loss: 0.9166, test_loss: 0.9196, test_f1: 0.5217
 epoch: 53, train_loss: 0.9181, test_loss: 0.9107, test_f1: 0.5247
 epoch: 54, train_loss: 0.9151, test_loss: 0.9354, test_f1: 0.5113
 epoch: 55, train_loss: 0.9144, test_loss: 0.9164, test_f1: 0.5078
 epoch: 56, train_loss: 0.9168, test_loss: 0.9117, test_f1: 0.5186
 epoch: 57, train_loss: 0.9084, test_loss: 0.9109, test_f1: 0.5257
 epoch: 58, train_loss: 0.9118, test_loss: 0.9211, test_f1: 0.5318
 epoch: 59, train_loss: 0.9024, test_loss: 0.9176, test_f1: 0.5202
 epoch: 60, train_loss: 0.9057, test_loss: 0.9098, test_f1: 0.5328
 epoch: 61, train_loss: 0.9073, test_loss: 0.9125, test_f1: 0.5184
 epoch: 62, train_loss: 0.9079, test_loss: 0.9141, test_f1: 0.5334
 epoch: 63, train_loss: 0.9088, test_loss: 0.9332, test_f1: 0.5173
 epoch: 64, train_loss: 0.8996, test_loss: 0.9270, test_f1: 0.5313
 epoch: 65, train_loss: 0.9076, test_loss: 0.9130, test_f1: 0.5303
 epoch: 66, train_loss: 0.8930, test_loss: 0.9162, test_f1: 0.5377
 epoch: 67, train_loss: 0.8992, test_loss: 0.9064, test_f1: 0.5348
 epoch: 68, train_loss: 0.9000, test_loss: 0.9200, test_f1: 0.5303
 epoch: 69, train_loss: 0.9034, test_loss: 0.9226, test_f1: 0.5190
 epoch: 70, train_loss: 0.8947, test_loss: 0.9184, test_f1: 0.5363
 epoch: 71, train_loss: 0.8906, test_loss: 0.9148, test_f1: 0.5325
 epoch: 72, train_loss: 0.8942, test_loss: 0.9155, test_f1: 0.5312
 epoch: 73, train_loss: 0.8980, test_loss: 0.9168, test_f1: 0.5310
 epoch: 74, train_loss: 0.8892, test_loss: 0.9275, test_f1: 0.5114
 epoch: 75, train_loss: 0.8925, test_loss: 0.9260, test_f1: 0.5229
 epoch: 76, train_loss: 0.8857, test_loss: 0.9223, test_f1: 0.5318
 epoch: 77, train_loss: 0.8862, test_loss: 0.9324, test_f1: 0.5232
 epoch: 78, train_loss: 0.8789, test_loss: 0.9260, test_f1: 0.5195
 epoch: 79, train_loss: 0.8826, test_loss: 0.9305, test_f1: 0.5279
 epoch: 80, train_loss: 0.8911, test_loss: 0.9386, test_f1: 0.5253
 epoch: 81, train_loss: 0.8754, test_loss: 0.9416, test_f1: 0.5188
 epoch: 82, train_loss: 0.8752, test_loss: 0.9296, test_f1: 0.5370
 epoch: 83, train_loss: 0.8705, test_loss: 0.9375, test_f1: 0.5323
 epoch: 84, train_loss: 0.8694, test_loss: 0.9307, test_f1: 0.5280
 epoch: 85, train_loss: 0.8795, test_loss: 0.9312, test_f1: 0.5309
 epoch: 86, train_loss: 0.8697, test_loss: 0.9294, test_f1: 0.5340
 epoch: 87, train_loss: 0.8726, test_loss: 0.9275, test_f1: 0.5269
 epoch: 88, train_loss: 0.8740, test_loss: 0.9409, test_f1: 0.5245
 epoch: 89, train_loss: 0.8720, test_loss: 0.9455, test_f1: 0.5044
 epoch: 90, train_loss: 0.8618, test_loss: 0.9376, test_f1: 0.5204
 epoch: 91, train_loss: 0.8658, test_loss: 0.9446, test_f1: 0.5347
 epoch: 92, train_loss: 0.8723, test_loss: 0.9241, test_f1: 0.5393
 epoch: 93, train_loss: 0.8661, test_loss: 0.9458, test_f1: 0.5326
 epoch: 94, train_loss: 0.8706, test_loss: 0.9327, test_f1: 0.5303
 epoch: 95, train_loss: 0.8648, test_loss: 0.9570, test_f1: 0.5253
 epoch: 96, train_loss: 0.8659, test_loss: 0.9397, test_f1: 0.5225
 epoch: 97, train_loss: 0.8604, test_loss: 0.9512, test_f1: 0.5242
 epoch: 98, train_loss: 0.8677, test_loss: 0.9520, test_f1: 0.5318
 epoch: 99, train_loss: 0.8625, test_loss: 0.9388, test_f1: 0.5089
##################ITERATION #1 ****************************************
 epoch: 0, train_loss: 1.3092, test_loss: 1.2411, test_f1: 0.3574
 epoch: 1, train_loss: 1.2391, test_loss: 1.2048, test_f1: 0.3880
 epoch: 2, train_loss: 1.2098, test_loss: 1.1759, test_f1: 0.4020
 epoch: 3, train_loss: 1.1856, test_loss: 1.1441, test_f1: 0.4244
 epoch: 4, train_loss: 1.1650, test_loss: 1.1242, test_f1: 0.4286
 epoch: 5, train_loss: 1.1457, test_loss: 1.1017, test_f1: 0.4301
 epoch: 6, train_loss: 1.1238, test_loss: 1.0802, test_f1: 0.4359
 epoch: 7, train_loss: 1.1101, test_loss: 1.0706, test_f1: 0.4397
 epoch: 8, train_loss: 1.0988, test_loss: 1.0534, test_f1: 0.4506
 epoch: 9, train_loss: 1.0869, test_loss: 1.0394, test_f1: 0.4496
 epoch: 10, train_loss: 1.0744, test_loss: 1.0329, test_f1: 0.4514
 epoch: 11, train_loss: 1.0698, test_loss: 1.0297, test_f1: 0.4469
 epoch: 12, train_loss: 1.0570, test_loss: 1.0053, test_f1: 0.4654
 epoch: 13, train_loss: 1.0452, test_loss: 1.0159, test_f1: 0.4566
 epoch: 14, train_loss: 1.0325, test_loss: 0.9978, test_f1: 0.4799
 epoch: 15, train_loss: 1.0369, test_loss: 0.9955, test_f1: 0.4526
 epoch: 16, train_loss: 1.0282, test_loss: 1.0055, test_f1: 0.4700
 epoch: 17, train_loss: 1.0127, test_loss: 0.9695, test_f1: 0.4935
 epoch: 18, train_loss: 1.0105, test_loss: 0.9728, test_f1: 0.5007
 epoch: 19, train_loss: 0.9957, test_loss: 0.9683, test_f1: 0.4879
 epoch: 20, train_loss: 0.9970, test_loss: 0.9759, test_f1: 0.4861
 epoch: 21, train_loss: 0.9882, test_loss: 0.9707, test_f1: 0.4859
 epoch: 22, train_loss: 0.9881, test_loss: 0.9511, test_f1: 0.4960
 epoch: 23, train_loss: 0.9812, test_loss: 0.9562, test_f1: 0.4931
 epoch: 24, train_loss: 0.9713, test_loss: 0.9562, test_f1: 0.4590
 epoch: 25, train_loss: 0.9679, test_loss: 0.9632, test_f1: 0.4775
 epoch: 26, train_loss: 0.9569, test_loss: 0.9496, test_f1: 0.4679
 epoch: 27, train_loss: 0.9657, test_loss: 0.9476, test_f1: 0.4688
 epoch: 28, train_loss: 0.9637, test_loss: 0.9515, test_f1: 0.5028
 epoch: 29, train_loss: 0.9469, test_loss: 0.9474, test_f1: 0.4848
 epoch: 30, train_loss: 0.9460, test_loss: 0.9372, test_f1: 0.5004
 epoch: 31, train_loss: 0.9342, test_loss: 0.9492, test_f1: 0.4930
 epoch: 32, train_loss: 0.9361, test_loss: 0.9432, test_f1: 0.5014
 epoch: 33, train_loss: 0.9306, test_loss: 0.9521, test_f1: 0.4777
 epoch: 34, train_loss: 0.9267, test_loss: 0.9402, test_f1: 0.4971
 epoch: 35, train_loss: 0.9266, test_loss: 0.9447, test_f1: 0.5141
 epoch: 36, train_loss: 0.9231, test_loss: 0.9282, test_f1: 0.5204
 epoch: 37, train_loss: 0.9155, test_loss: 0.9321, test_f1: 0.5156
 epoch: 38, train_loss: 0.9006, test_loss: 0.9595, test_f1: 0.5098
 epoch: 39, train_loss: 0.9001, test_loss: 0.9496, test_f1: 0.5223
 epoch: 40, train_loss: 0.9083, test_loss: 0.9697, test_f1: 0.5028
 epoch: 41, train_loss: 0.9030, test_loss: 0.9572, test_f1: 0.5195
 epoch: 42, train_loss: 0.8975, test_loss: 0.9512, test_f1: 0.5119
 epoch: 43, train_loss: 0.8932, test_loss: 0.9615, test_f1: 0.5095
 epoch: 44, train_loss: 0.8853, test_loss: 0.9514, test_f1: 0.5092
 epoch: 45, train_loss: 0.8842, test_loss: 0.9553, test_f1: 0.5099
 epoch: 46, train_loss: 0.8948, test_loss: 0.9542, test_f1: 0.5255
 epoch: 47, train_loss: 0.8666, test_loss: 0.9646, test_f1: 0.5274
 epoch: 48, train_loss: 0.8765, test_loss: 0.9611, test_f1: 0.5147
 epoch: 49, train_loss: 0.8795, test_loss: 0.9650, test_f1: 0.5202
 epoch: 50, train_loss: 0.8795, test_loss: 0.9502, test_f1: 0.5318
 epoch: 51, train_loss: 0.8625, test_loss: 0.9595, test_f1: 0.5238
 epoch: 52, train_loss: 0.8613, test_loss: 0.9699, test_f1: 0.5193
 epoch: 53, train_loss: 0.8746, test_loss: 0.9595, test_f1: 0.5297
 epoch: 54, train_loss: 0.8614, test_loss: 0.9633, test_f1: 0.5224
 epoch: 55, train_loss: 0.8582, test_loss: 0.9498, test_f1: 0.5320
 epoch: 56, train_loss: 0.8577, test_loss: 0.9655, test_f1: 0.5144
 epoch: 57, train_loss: 0.8557, test_loss: 0.9665, test_f1: 0.5378
 epoch: 58, train_loss: 0.8540, test_loss: 0.9634, test_f1: 0.5212
 epoch: 59, train_loss: 0.8462, test_loss: 0.9712, test_f1: 0.5081
 epoch: 60, train_loss: 0.8388, test_loss: 0.9722, test_f1: 0.5380
 epoch: 61, train_loss: 0.8526, test_loss: 0.9823, test_f1: 0.5443
 epoch: 62, train_loss: 0.8472, test_loss: 0.9690, test_f1: 0.5099
 epoch: 63, train_loss: 0.8425, test_loss: 0.9689, test_f1: 0.5368
 epoch: 64, train_loss: 0.8336, test_loss: 0.9661, test_f1: 0.5387
 epoch: 65, train_loss: 0.8426, test_loss: 0.9636, test_f1: 0.5359
 epoch: 66, train_loss: 0.8448, test_loss: 0.9705, test_f1: 0.5287
 epoch: 67, train_loss: 0.8338, test_loss: 0.9621, test_f1: 0.5416
 epoch: 68, train_loss: 0.8269, test_loss: 0.9786, test_f1: 0.5210
 epoch: 69, train_loss: 0.8313, test_loss: 0.9764, test_f1: 0.5419
 epoch: 70, train_loss: 0.8355, test_loss: 0.9768, test_f1: 0.5352
 epoch: 71, train_loss: 0.8327, test_loss: 0.9884, test_f1: 0.5442
 epoch: 72, train_loss: 0.8280, test_loss: 0.9780, test_f1: 0.5436
 epoch: 73, train_loss: 0.8425, test_loss: 0.9898, test_f1: 0.5343
 epoch: 74, train_loss: 0.8332, test_loss: 1.0018, test_f1: 0.5363
 epoch: 75, train_loss: 0.8429, test_loss: 0.9805, test_f1: 0.5318
 epoch: 76, train_loss: 0.8266, test_loss: 0.9832, test_f1: 0.5307
 epoch: 77, train_loss: 0.8157, test_loss: 0.9690, test_f1: 0.5315
 epoch: 78, train_loss: 0.8265, test_loss: 0.9871, test_f1: 0.5305
 epoch: 79, train_loss: 0.8301, test_loss: 0.9739, test_f1: 0.5381
 epoch: 80, train_loss: 0.8092, test_loss: 0.9815, test_f1: 0.5285
 epoch: 81, train_loss: 0.8170, test_loss: 0.9874, test_f1: 0.5311
 epoch: 82, train_loss: 0.8338, test_loss: 0.9909, test_f1: 0.5364
 epoch: 83, train_loss: 0.8108, test_loss: 0.9802, test_f1: 0.5395
 epoch: 84, train_loss: 0.8166, test_loss: 1.0187, test_f1: 0.5362
 epoch: 85, train_loss: 0.8146, test_loss: 0.9890, test_f1: 0.5379
 epoch: 86, train_loss: 0.8122, test_loss: 1.0078, test_f1: 0.5379
 epoch: 87, train_loss: 0.8006, test_loss: 1.0107, test_f1: 0.5247
 epoch: 88, train_loss: 0.8074, test_loss: 1.0090, test_f1: 0.5393
 epoch: 89, train_loss: 0.8144, test_loss: 0.9943, test_f1: 0.5488
 epoch: 90, train_loss: 0.8074, test_loss: 1.0055, test_f1: 0.5401
 epoch: 91, train_loss: 0.8082, test_loss: 1.0153, test_f1: 0.5440
 epoch: 92, train_loss: 0.8050, test_loss: 1.0227, test_f1: 0.5329
 epoch: 93, train_loss: 0.7992, test_loss: 1.0176, test_f1: 0.5504
 epoch: 94, train_loss: 0.8011, test_loss: 0.9978, test_f1: 0.5493
 epoch: 95, train_loss: 0.8103, test_loss: 1.0247, test_f1: 0.5366
 epoch: 96, train_loss: 0.7941, test_loss: 1.0327, test_f1: 0.5303
 epoch: 97, train_loss: 0.7866, test_loss: 1.0141, test_f1: 0.5224
 epoch: 98, train_loss: 0.7947, test_loss: 1.0951, test_f1: 0.5486
 epoch: 99, train_loss: 0.7994, test_loss: 1.0412, test_f1: 0.5616
##################ITERATION #2 ****************************************
 epoch: 0, train_loss: 1.3039, test_loss: 1.2355, test_f1: 0.3371
 epoch: 1, train_loss: 1.2446, test_loss: 1.2078, test_f1: 0.3421
 epoch: 2, train_loss: 1.2148, test_loss: 1.1849, test_f1: 0.4038
 epoch: 3, train_loss: 1.1981, test_loss: 1.1561, test_f1: 0.4379
 epoch: 4, train_loss: 1.1778, test_loss: 1.1390, test_f1: 0.4497
 epoch: 5, train_loss: 1.1553, test_loss: 1.1139, test_f1: 0.4574
 epoch: 6, train_loss: 1.1487, test_loss: 1.0983, test_f1: 0.4511
 epoch: 7, train_loss: 1.1273, test_loss: 1.0739, test_f1: 0.4677
 epoch: 8, train_loss: 1.1145, test_loss: 1.0579, test_f1: 0.4603
 epoch: 9, train_loss: 1.0957, test_loss: 1.0449, test_f1: 0.4638
 epoch: 10, train_loss: 1.0878, test_loss: 1.0346, test_f1: 0.4645
 epoch: 11, train_loss: 1.0824, test_loss: 1.0211, test_f1: 0.4685
 epoch: 12, train_loss: 1.0634, test_loss: 1.0064, test_f1: 0.4716
 epoch: 13, train_loss: 1.0634, test_loss: 1.0021, test_f1: 0.4782
 epoch: 14, train_loss: 1.0427, test_loss: 0.9844, test_f1: 0.4800
 epoch: 15, train_loss: 1.0286, test_loss: 0.9777, test_f1: 0.4793
 epoch: 16, train_loss: 1.0310, test_loss: 0.9718, test_f1: 0.4838
 epoch: 17, train_loss: 1.0201, test_loss: 0.9671, test_f1: 0.4861
 epoch: 18, train_loss: 1.0138, test_loss: 0.9582, test_f1: 0.4953
 epoch: 19, train_loss: 1.0049, test_loss: 0.9536, test_f1: 0.4856
 epoch: 20, train_loss: 0.9966, test_loss: 0.9623, test_f1: 0.4937
 epoch: 21, train_loss: 0.9926, test_loss: 0.9507, test_f1: 0.4961
 epoch: 22, train_loss: 0.9862, test_loss: 0.9486, test_f1: 0.4948
 epoch: 23, train_loss: 0.9817, test_loss: 0.9471, test_f1: 0.4880
 epoch: 24, train_loss: 0.9799, test_loss: 0.9526, test_f1: 0.5030
 epoch: 25, train_loss: 0.9676, test_loss: 0.9429, test_f1: 0.5010
 epoch: 26, train_loss: 0.9769, test_loss: 0.9293, test_f1: 0.5130
 epoch: 27, train_loss: 0.9695, test_loss: 0.9277, test_f1: 0.5063
 epoch: 28, train_loss: 0.9698, test_loss: 0.9348, test_f1: 0.4924
 epoch: 29, train_loss: 0.9585, test_loss: 0.9243, test_f1: 0.5081
 epoch: 30, train_loss: 0.9467, test_loss: 0.9422, test_f1: 0.4942
 epoch: 31, train_loss: 0.9435, test_loss: 0.9430, test_f1: 0.5015
 epoch: 32, train_loss: 0.9373, test_loss: 0.9319, test_f1: 0.5042
 epoch: 33, train_loss: 0.9273, test_loss: 0.9466, test_f1: 0.5097
 epoch: 34, train_loss: 0.9310, test_loss: 0.9338, test_f1: 0.5156
 epoch: 35, train_loss: 0.9242, test_loss: 0.9317, test_f1: 0.5133
 epoch: 36, train_loss: 0.9301, test_loss: 0.9250, test_f1: 0.5155
 epoch: 37, train_loss: 0.9276, test_loss: 0.9428, test_f1: 0.5144
 epoch: 38, train_loss: 0.9182, test_loss: 0.9392, test_f1: 0.5234
 epoch: 39, train_loss: 0.9141, test_loss: 0.9415, test_f1: 0.5164
 epoch: 40, train_loss: 0.9021, test_loss: 0.9282, test_f1: 0.5164
 epoch: 41, train_loss: 0.9021, test_loss: 0.9366, test_f1: 0.5178
 epoch: 42, train_loss: 0.8910, test_loss: 0.9447, test_f1: 0.5133
 epoch: 43, train_loss: 0.9006, test_loss: 0.9449, test_f1: 0.5187
 epoch: 44, train_loss: 0.8971, test_loss: 0.9493, test_f1: 0.5213
 epoch: 45, train_loss: 0.8878, test_loss: 0.9700, test_f1: 0.4952
 epoch: 46, train_loss: 0.8790, test_loss: 0.9437, test_f1: 0.5249
 epoch: 47, train_loss: 0.8809, test_loss: 0.9364, test_f1: 0.5220
 epoch: 48, train_loss: 0.8850, test_loss: 0.9519, test_f1: 0.5236
 epoch: 49, train_loss: 0.8753, test_loss: 0.9626, test_f1: 0.5195
 epoch: 50, train_loss: 0.8815, test_loss: 0.9276, test_f1: 0.5435
 epoch: 51, train_loss: 0.8686, test_loss: 0.9480, test_f1: 0.5283
 epoch: 52, train_loss: 0.8726, test_loss: 0.9475, test_f1: 0.5243
 epoch: 53, train_loss: 0.8605, test_loss: 0.9521, test_f1: 0.5370
 epoch: 54, train_loss: 0.8696, test_loss: 0.9545, test_f1: 0.5158
 epoch: 55, train_loss: 0.8587, test_loss: 0.9524, test_f1: 0.5126
 epoch: 56, train_loss: 0.8645, test_loss: 0.9656, test_f1: 0.5326
 epoch: 57, train_loss: 0.8639, test_loss: 0.9709, test_f1: 0.5238
 epoch: 58, train_loss: 0.8666, test_loss: 0.9747, test_f1: 0.5252
 epoch: 59, train_loss: 0.8537, test_loss: 0.9610, test_f1: 0.5318
 epoch: 60, train_loss: 0.8589, test_loss: 0.9682, test_f1: 0.5319
 epoch: 61, train_loss: 0.8521, test_loss: 0.9526, test_f1: 0.5326
 epoch: 62, train_loss: 0.8581, test_loss: 0.9664, test_f1: 0.5308
 epoch: 63, train_loss: 0.8462, test_loss: 0.9806, test_f1: 0.5198
 epoch: 64, train_loss: 0.8493, test_loss: 0.9717, test_f1: 0.5208
 epoch: 65, train_loss: 0.8450, test_loss: 0.9600, test_f1: 0.5413
 epoch: 66, train_loss: 0.8472, test_loss: 0.9574, test_f1: 0.5340
 epoch: 67, train_loss: 0.8388, test_loss: 0.9732, test_f1: 0.5329
 epoch: 68, train_loss: 0.8410, test_loss: 0.9900, test_f1: 0.5142
 epoch: 69, train_loss: 0.8390, test_loss: 0.9598, test_f1: 0.5266
 epoch: 70, train_loss: 0.8382, test_loss: 0.9680, test_f1: 0.5336
 epoch: 71, train_loss: 0.8278, test_loss: 0.9631, test_f1: 0.5275
 epoch: 72, train_loss: 0.8287, test_loss: 0.9801, test_f1: 0.5320
 epoch: 73, train_loss: 0.8339, test_loss: 0.9944, test_f1: 0.5269
 epoch: 74, train_loss: 0.8360, test_loss: 0.9691, test_f1: 0.5239
 epoch: 75, train_loss: 0.8314, test_loss: 0.9761, test_f1: 0.5271
 epoch: 76, train_loss: 0.8368, test_loss: 0.9896, test_f1: 0.5304
 epoch: 77, train_loss: 0.8364, test_loss: 1.0060, test_f1: 0.5332
 epoch: 78, train_loss: 0.8305, test_loss: 0.9794, test_f1: 0.5237
 epoch: 79, train_loss: 0.8254, test_loss: 0.9695, test_f1: 0.5380
 epoch: 80, train_loss: 0.8275, test_loss: 0.9976, test_f1: 0.5179
 epoch: 81, train_loss: 0.8283, test_loss: 0.9812, test_f1: 0.5151
 epoch: 82, train_loss: 0.8227, test_loss: 0.9966, test_f1: 0.5258
 epoch: 83, train_loss: 0.8218, test_loss: 1.0063, test_f1: 0.5363
 epoch: 84, train_loss: 0.8273, test_loss: 1.0129, test_f1: 0.5279
 epoch: 85, train_loss: 0.8174, test_loss: 1.0019, test_f1: 0.5294
 epoch: 86, train_loss: 0.8251, test_loss: 0.9986, test_f1: 0.5421
 epoch: 87, train_loss: 0.8165, test_loss: 0.9946, test_f1: 0.5337
 epoch: 88, train_loss: 0.8177, test_loss: 1.0040, test_f1: 0.5226
 epoch: 89, train_loss: 0.8113, test_loss: 0.9825, test_f1: 0.5356
 epoch: 90, train_loss: 0.8087, test_loss: 0.9974, test_f1: 0.5228
 epoch: 91, train_loss: 0.8158, test_loss: 0.9934, test_f1: 0.5242
 epoch: 92, train_loss: 0.8104, test_loss: 0.9897, test_f1: 0.5269
 epoch: 93, train_loss: 0.8196, test_loss: 0.9952, test_f1: 0.5439
 epoch: 94, train_loss: 0.8187, test_loss: 1.0118, test_f1: 0.5193
 epoch: 95, train_loss: 0.8123, test_loss: 1.0126, test_f1: 0.5249
 epoch: 96, train_loss: 0.8181, test_loss: 0.9970, test_f1: 0.5248
 epoch: 97, train_loss: 0.8163, test_loss: 1.0030, test_f1: 0.5276
 epoch: 98, train_loss: 0.8139, test_loss: 1.0161, test_f1: 0.5205
 epoch: 99, train_loss: 0.8087, test_loss: 1.0463, test_f1: 0.5287
##################ITERATION #3 ****************************************
 epoch: 0, train_loss: 1.3010, test_loss: 1.2115, test_f1: 0.3526
 epoch: 1, train_loss: 1.2281, test_loss: 1.1738, test_f1: 0.4141
 epoch: 2, train_loss: 1.2093, test_loss: 1.1675, test_f1: 0.4232
 epoch: 3, train_loss: 1.1852, test_loss: 1.1422, test_f1: 0.4534
 epoch: 4, train_loss: 1.1808, test_loss: 1.1262, test_f1: 0.4637
 epoch: 5, train_loss: 1.1726, test_loss: 1.1236, test_f1: 0.4487
 epoch: 6, train_loss: 1.1502, test_loss: 1.1097, test_f1: 0.4638
 epoch: 7, train_loss: 1.1396, test_loss: 1.0882, test_f1: 0.4600
 epoch: 8, train_loss: 1.1206, test_loss: 1.0865, test_f1: 0.4725
 epoch: 9, train_loss: 1.1204, test_loss: 1.0706, test_f1: 0.4751
 epoch: 10, train_loss: 1.1073, test_loss: 1.0675, test_f1: 0.4712
 epoch: 11, train_loss: 1.1043, test_loss: 1.0644, test_f1: 0.4676
 epoch: 12, train_loss: 1.0981, test_loss: 1.0491, test_f1: 0.4772
 epoch: 13, train_loss: 1.0821, test_loss: 1.0561, test_f1: 0.4628
 epoch: 14, train_loss: 1.0802, test_loss: 1.0354, test_f1: 0.4670
 epoch: 15, train_loss: 1.0689, test_loss: 1.0273, test_f1: 0.4778
 epoch: 16, train_loss: 1.0716, test_loss: 1.0252, test_f1: 0.4710
 epoch: 17, train_loss: 1.0546, test_loss: 1.0269, test_f1: 0.4816
 epoch: 18, train_loss: 1.0464, test_loss: 1.0049, test_f1: 0.4737
 epoch: 19, train_loss: 1.0420, test_loss: 1.0012, test_f1: 0.4735
 epoch: 20, train_loss: 1.0400, test_loss: 1.0032, test_f1: 0.4564
 epoch: 21, train_loss: 1.0232, test_loss: 0.9928, test_f1: 0.4741
 epoch: 22, train_loss: 1.0211, test_loss: 0.9961, test_f1: 0.4815
 epoch: 23, train_loss: 1.0235, test_loss: 1.0004, test_f1: 0.4644
 epoch: 24, train_loss: 1.0190, test_loss: 0.9844, test_f1: 0.4686
 epoch: 25, train_loss: 1.0080, test_loss: 0.9761, test_f1: 0.4643
 epoch: 26, train_loss: 1.0063, test_loss: 0.9737, test_f1: 0.4944
 epoch: 27, train_loss: 1.0107, test_loss: 0.9742, test_f1: 0.4910
 epoch: 28, train_loss: 1.0024, test_loss: 0.9805, test_f1: 0.4939
 epoch: 29, train_loss: 0.9969, test_loss: 0.9798, test_f1: 0.4857
 epoch: 30, train_loss: 0.9846, test_loss: 0.9794, test_f1: 0.4883
 epoch: 31, train_loss: 0.9822, test_loss: 0.9917, test_f1: 0.4832
 epoch: 32, train_loss: 0.9742, test_loss: 0.9801, test_f1: 0.4886
 epoch: 33, train_loss: 0.9794, test_loss: 0.9982, test_f1: 0.4870
 epoch: 34, train_loss: 0.9688, test_loss: 0.9878, test_f1: 0.5010
 epoch: 35, train_loss: 0.9696, test_loss: 0.9730, test_f1: 0.5019
 epoch: 36, train_loss: 0.9753, test_loss: 0.9764, test_f1: 0.5098
 epoch: 37, train_loss: 0.9661, test_loss: 0.9864, test_f1: 0.4924
 epoch: 38, train_loss: 0.9601, test_loss: 0.9834, test_f1: 0.4982
 epoch: 39, train_loss: 0.9560, test_loss: 1.0137, test_f1: 0.5006
 epoch: 40, train_loss: 0.9551, test_loss: 0.9845, test_f1: 0.5179
 epoch: 41, train_loss: 0.9571, test_loss: 1.0017, test_f1: 0.5020
 epoch: 42, train_loss: 0.9458, test_loss: 0.9784, test_f1: 0.5143
 epoch: 43, train_loss: 0.9491, test_loss: 0.9867, test_f1: 0.5043
 epoch: 44, train_loss: 0.9423, test_loss: 0.9769, test_f1: 0.5276
 epoch: 45, train_loss: 0.9257, test_loss: 0.9898, test_f1: 0.5176
 epoch: 46, train_loss: 0.9201, test_loss: 0.9927, test_f1: 0.5041
 epoch: 47, train_loss: 0.9295, test_loss: 0.9992, test_f1: 0.4989
 epoch: 48, train_loss: 0.9186, test_loss: 0.9784, test_f1: 0.5209
 epoch: 49, train_loss: 0.9296, test_loss: 0.9959, test_f1: 0.5069
 epoch: 50, train_loss: 0.9104, test_loss: 0.9695, test_f1: 0.5277
 epoch: 51, train_loss: 0.9124, test_loss: 0.9743, test_f1: 0.5184
 epoch: 52, train_loss: 0.9060, test_loss: 0.9889, test_f1: 0.5079
 epoch: 53, train_loss: 0.9048, test_loss: 1.0010, test_f1: 0.5165
 epoch: 54, train_loss: 0.9136, test_loss: 0.9985, test_f1: 0.5159
 epoch: 55, train_loss: 0.9068, test_loss: 0.9909, test_f1: 0.5097
 epoch: 56, train_loss: 0.8893, test_loss: 0.9801, test_f1: 0.5177
 epoch: 57, train_loss: 0.9071, test_loss: 1.0087, test_f1: 0.5189
 epoch: 58, train_loss: 0.9047, test_loss: 0.9841, test_f1: 0.5172
 epoch: 59, train_loss: 0.9013, test_loss: 0.9861, test_f1: 0.5134
 epoch: 60, train_loss: 0.9018, test_loss: 1.0003, test_f1: 0.5141
 epoch: 61, train_loss: 0.8900, test_loss: 0.9721, test_f1: 0.5114
 epoch: 62, train_loss: 0.8967, test_loss: 1.0057, test_f1: 0.5099
 epoch: 63, train_loss: 0.9013, test_loss: 0.9797, test_f1: 0.5141
 epoch: 64, train_loss: 0.8976, test_loss: 1.0039, test_f1: 0.5176
 epoch: 65, train_loss: 0.9017, test_loss: 0.9974, test_f1: 0.5181
 epoch: 66, train_loss: 0.8938, test_loss: 0.9817, test_f1: 0.5209
 epoch: 67, train_loss: 0.8955, test_loss: 0.9647, test_f1: 0.5314
 epoch: 68, train_loss: 0.8897, test_loss: 0.9705, test_f1: 0.5276
 epoch: 69, train_loss: 0.8919, test_loss: 0.9731, test_f1: 0.5159
 epoch: 70, train_loss: 0.8891, test_loss: 0.9788, test_f1: 0.5138
 epoch: 71, train_loss: 0.8932, test_loss: 0.9838, test_f1: 0.5154
 epoch: 72, train_loss: 0.8764, test_loss: 0.9980, test_f1: 0.5206
 epoch: 73, train_loss: 0.8927, test_loss: 0.9963, test_f1: 0.5242
 epoch: 74, train_loss: 0.8669, test_loss: 0.9985, test_f1: 0.5203
 epoch: 75, train_loss: 0.8785, test_loss: 1.0142, test_f1: 0.5106
 epoch: 76, train_loss: 0.8741, test_loss: 1.0114, test_f1: 0.5182
 epoch: 77, train_loss: 0.8672, test_loss: 0.9886, test_f1: 0.5273
 epoch: 78, train_loss: 0.8729, test_loss: 0.9926, test_f1: 0.5309
 epoch: 79, train_loss: 0.8714, test_loss: 0.9782, test_f1: 0.5247
 epoch: 80, train_loss: 0.8816, test_loss: 1.0047, test_f1: 0.5301
 epoch: 81, train_loss: 0.8718, test_loss: 1.0073, test_f1: 0.5225
 epoch: 82, train_loss: 0.8747, test_loss: 1.0126, test_f1: 0.5294
 epoch: 83, train_loss: 0.8750, test_loss: 1.0058, test_f1: 0.5328
 epoch: 84, train_loss: 0.8645, test_loss: 0.9778, test_f1: 0.5339
 epoch: 85, train_loss: 0.8634, test_loss: 1.0299, test_f1: 0.5154
 epoch: 86, train_loss: 0.8524, test_loss: 1.0109, test_f1: 0.5345
 epoch: 87, train_loss: 0.8722, test_loss: 0.9989, test_f1: 0.5433
 epoch: 88, train_loss: 0.8696, test_loss: 1.0114, test_f1: 0.5366
 epoch: 89, train_loss: 0.8526, test_loss: 0.9937, test_f1: 0.5321
 epoch: 90, train_loss: 0.8619, test_loss: 1.0188, test_f1: 0.5202
 epoch: 91, train_loss: 0.8517, test_loss: 1.0223, test_f1: 0.5273
 epoch: 92, train_loss: 0.8521, test_loss: 0.9966, test_f1: 0.5322
 epoch: 93, train_loss: 0.8514, test_loss: 0.9647, test_f1: 0.5389
 epoch: 94, train_loss: 0.8508, test_loss: 0.9981, test_f1: 0.5281
 epoch: 95, train_loss: 0.8510, test_loss: 1.0226, test_f1: 0.5252
 epoch: 96, train_loss: 0.8457, test_loss: 1.0283, test_f1: 0.5277
 epoch: 97, train_loss: 0.8462, test_loss: 1.0012, test_f1: 0.5264
 epoch: 98, train_loss: 0.8507, test_loss: 1.0102, test_f1: 0.5341
 epoch: 99, train_loss: 0.8453, test_loss: 1.0157, test_f1: 0.5376
##################ITERATION #4 ****************************************
 epoch: 0, train_loss: 1.2805, test_loss: 1.2049, test_f1: 0.3719
 epoch: 1, train_loss: 1.2323, test_loss: 1.1884, test_f1: 0.3763
 epoch: 2, train_loss: 1.2014, test_loss: 1.1569, test_f1: 0.4083
 epoch: 3, train_loss: 1.1886, test_loss: 1.1330, test_f1: 0.4481
 epoch: 4, train_loss: 1.1778, test_loss: 1.1174, test_f1: 0.4319
 epoch: 5, train_loss: 1.1608, test_loss: 1.1014, test_f1: 0.4402
 epoch: 6, train_loss: 1.1534, test_loss: 1.0886, test_f1: 0.4523
 epoch: 7, train_loss: 1.1335, test_loss: 1.0764, test_f1: 0.4590
 epoch: 8, train_loss: 1.1147, test_loss: 1.0642, test_f1: 0.4453
 epoch: 9, train_loss: 1.1074, test_loss: 1.0476, test_f1: 0.4476
 epoch: 10, train_loss: 1.1060, test_loss: 1.0330, test_f1: 0.4634
 epoch: 11, train_loss: 1.0832, test_loss: 1.0381, test_f1: 0.4597
 epoch: 12, train_loss: 1.0780, test_loss: 1.0413, test_f1: 0.4527
 epoch: 13, train_loss: 1.0746, test_loss: 1.0127, test_f1: 0.4728
 epoch: 14, train_loss: 1.0616, test_loss: 1.0206, test_f1: 0.4557
 epoch: 15, train_loss: 1.0567, test_loss: 1.0048, test_f1: 0.4610
 epoch: 16, train_loss: 1.0456, test_loss: 0.9968, test_f1: 0.4674
 epoch: 17, train_loss: 1.0362, test_loss: 1.0026, test_f1: 0.4618
 epoch: 18, train_loss: 1.0363, test_loss: 0.9985, test_f1: 0.4602
 epoch: 19, train_loss: 1.0322, test_loss: 0.9899, test_f1: 0.4649
 epoch: 20, train_loss: 1.0251, test_loss: 0.9811, test_f1: 0.4645
 epoch: 21, train_loss: 1.0162, test_loss: 0.9890, test_f1: 0.4610
 epoch: 22, train_loss: 1.0122, test_loss: 0.9814, test_f1: 0.4665
 epoch: 23, train_loss: 0.9960, test_loss: 0.9603, test_f1: 0.4911
 epoch: 24, train_loss: 1.0012, test_loss: 0.9647, test_f1: 0.4858
 epoch: 25, train_loss: 0.9994, test_loss: 0.9650, test_f1: 0.4867
 epoch: 26, train_loss: 0.9834, test_loss: 0.9594, test_f1: 0.4928
 epoch: 27, train_loss: 0.9905, test_loss: 0.9591, test_f1: 0.4854
 epoch: 28, train_loss: 0.9788, test_loss: 0.9699, test_f1: 0.4842
 epoch: 29, train_loss: 0.9768, test_loss: 0.9720, test_f1: 0.4873
 epoch: 30, train_loss: 0.9722, test_loss: 0.9542, test_f1: 0.4732
 epoch: 31, train_loss: 0.9728, test_loss: 0.9563, test_f1: 0.4994
 epoch: 32, train_loss: 0.9753, test_loss: 0.9815, test_f1: 0.4815
 epoch: 33, train_loss: 0.9610, test_loss: 0.9726, test_f1: 0.5076
 epoch: 34, train_loss: 0.9589, test_loss: 0.9738, test_f1: 0.5032
 epoch: 35, train_loss: 0.9635, test_loss: 0.9627, test_f1: 0.4931
 epoch: 36, train_loss: 0.9595, test_loss: 0.9685, test_f1: 0.4797
 epoch: 37, train_loss: 0.9555, test_loss: 0.9790, test_f1: 0.4882
 epoch: 38, train_loss: 0.9552, test_loss: 0.9776, test_f1: 0.4789
 epoch: 39, train_loss: 0.9527, test_loss: 0.9484, test_f1: 0.5116
 epoch: 40, train_loss: 0.9475, test_loss: 0.9293, test_f1: 0.4753
 epoch: 41, train_loss: 0.9401, test_loss: 0.9580, test_f1: 0.5038
 epoch: 42, train_loss: 0.9359, test_loss: 0.9382, test_f1: 0.4676
 epoch: 43, train_loss: 0.9259, test_loss: 0.9680, test_f1: 0.4878
 epoch: 44, train_loss: 0.9432, test_loss: 0.9477, test_f1: 0.5094
 epoch: 45, train_loss: 0.9363, test_loss: 0.9523, test_f1: 0.4702
 epoch: 46, train_loss: 0.9218, test_loss: 0.9600, test_f1: 0.4852
 epoch: 47, train_loss: 0.9213, test_loss: 0.9428, test_f1: 0.4927
 epoch: 48, train_loss: 0.9253, test_loss: 0.9638, test_f1: 0.4897
 epoch: 49, train_loss: 0.9252, test_loss: 0.9387, test_f1: 0.4828
 epoch: 50, train_loss: 0.9152, test_loss: 0.9611, test_f1: 0.4739
 epoch: 51, train_loss: 0.9181, test_loss: 0.9584, test_f1: 0.5027
 epoch: 52, train_loss: 0.9262, test_loss: 0.9440, test_f1: 0.5053
 epoch: 53, train_loss: 0.8976, test_loss: 0.9511, test_f1: 0.4993
 epoch: 54, train_loss: 0.9091, test_loss: 0.9494, test_f1: 0.4933
 epoch: 55, train_loss: 0.8961, test_loss: 0.9236, test_f1: 0.4913
 epoch: 56, train_loss: 0.8947, test_loss: 0.9621, test_f1: 0.4913
 epoch: 57, train_loss: 0.8907, test_loss: 0.9439, test_f1: 0.4939
 epoch: 58, train_loss: 0.9080, test_loss: 0.9385, test_f1: 0.4815
 epoch: 59, train_loss: 0.9023, test_loss: 0.9486, test_f1: 0.5070
 epoch: 60, train_loss: 0.8848, test_loss: 0.9408, test_f1: 0.4929
 epoch: 61, train_loss: 0.8926, test_loss: 0.9545, test_f1: 0.4812
 epoch: 62, train_loss: 0.8946, test_loss: 0.9769, test_f1: 0.5040
 epoch: 63, train_loss: 0.8965, test_loss: 0.9449, test_f1: 0.4879
 epoch: 64, train_loss: 0.9011, test_loss: 0.9332, test_f1: 0.4941
 epoch: 65, train_loss: 0.8882, test_loss: 0.9483, test_f1: 0.4884
 epoch: 66, train_loss: 0.8925, test_loss: 0.9472, test_f1: 0.4885
 epoch: 67, train_loss: 0.8952, test_loss: 0.9358, test_f1: 0.5120
 epoch: 68, train_loss: 0.8899, test_loss: 0.9645, test_f1: 0.4811
 epoch: 69, train_loss: 0.8919, test_loss: 0.9681, test_f1: 0.4959
 epoch: 70, train_loss: 0.8797, test_loss: 0.9419, test_f1: 0.4857
 epoch: 71, train_loss: 0.8780, test_loss: 0.9553, test_f1: 0.4866
 epoch: 72, train_loss: 0.8852, test_loss: 0.9423, test_f1: 0.5058
 epoch: 73, train_loss: 0.8893, test_loss: 0.9518, test_f1: 0.4913
 epoch: 74, train_loss: 0.8862, test_loss: 0.9586, test_f1: 0.4901
 epoch: 75, train_loss: 0.8705, test_loss: 0.9628, test_f1: 0.4843
 epoch: 76, train_loss: 0.8767, test_loss: 0.9498, test_f1: 0.4856
 epoch: 77, train_loss: 0.8804, test_loss: 0.9419, test_f1: 0.4996
 epoch: 78, train_loss: 0.8736, test_loss: 0.9528, test_f1: 0.4882
 epoch: 79, train_loss: 0.8786, test_loss: 0.9637, test_f1: 0.4955
 epoch: 80, train_loss: 0.8714, test_loss: 0.9488, test_f1: 0.5119
 epoch: 81, train_loss: 0.8770, test_loss: 0.9506, test_f1: 0.5044
 epoch: 82, train_loss: 0.8787, test_loss: 0.9527, test_f1: 0.4923
 epoch: 83, train_loss: 0.8782, test_loss: 0.9488, test_f1: 0.4967
 epoch: 84, train_loss: 0.8807, test_loss: 0.9759, test_f1: 0.5049
 epoch: 85, train_loss: 0.8719, test_loss: 0.9313, test_f1: 0.5140
 epoch: 86, train_loss: 0.8758, test_loss: 0.9660, test_f1: 0.5076
 epoch: 87, train_loss: 0.8723, test_loss: 0.9869, test_f1: 0.5053
 epoch: 88, train_loss: 0.8635, test_loss: 0.9543, test_f1: 0.5015
 epoch: 89, train_loss: 0.8637, test_loss: 0.9835, test_f1: 0.4960
 epoch: 90, train_loss: 0.8683, test_loss: 0.9611, test_f1: 0.5167
 epoch: 91, train_loss: 0.8660, test_loss: 0.9761, test_f1: 0.5057
 epoch: 92, train_loss: 0.8685, test_loss: 0.9778, test_f1: 0.5003
 epoch: 93, train_loss: 0.8618, test_loss: 0.9775, test_f1: 0.5217
 epoch: 94, train_loss: 0.8624, test_loss: 0.9346, test_f1: 0.5071
 epoch: 95, train_loss: 0.8535, test_loss: 0.9552, test_f1: 0.4974
 epoch: 96, train_loss: 0.8572, test_loss: 0.9792, test_f1: 0.4901
 epoch: 97, train_loss: 0.8502, test_loss: 0.9791, test_f1: 0.4952
 epoch: 98, train_loss: 0.8486, test_loss: 0.9476, test_f1: 0.5040
 epoch: 99, train_loss: 0.8729, test_loss: 0.9691, test_f1: 0.4876
##################ITERATION #5 ****************************************
 epoch: 0, train_loss: 1.2993, test_loss: 1.1814, test_f1: 0.3758
 epoch: 1, train_loss: 1.2126, test_loss: 1.1452, test_f1: 0.4499
 epoch: 2, train_loss: 1.1912, test_loss: 1.1214, test_f1: 0.4615
 epoch: 3, train_loss: 1.1776, test_loss: 1.1135, test_f1: 0.4495
 epoch: 4, train_loss: 1.1521, test_loss: 1.1112, test_f1: 0.4350
 epoch: 5, train_loss: 1.1425, test_loss: 1.0841, test_f1: 0.4878
 epoch: 6, train_loss: 1.1270, test_loss: 1.0633, test_f1: 0.4808
 epoch: 7, train_loss: 1.1135, test_loss: 1.0576, test_f1: 0.4822
 epoch: 8, train_loss: 1.1005, test_loss: 1.0501, test_f1: 0.4915
 epoch: 9, train_loss: 1.0964, test_loss: 1.0322, test_f1: 0.4864
 epoch: 10, train_loss: 1.0939, test_loss: 1.0325, test_f1: 0.4607
 epoch: 11, train_loss: 1.0913, test_loss: 1.0228, test_f1: 0.4679
 epoch: 12, train_loss: 1.0759, test_loss: 1.0247, test_f1: 0.4630
 epoch: 13, train_loss: 1.0680, test_loss: 1.0045, test_f1: 0.4782
 epoch: 14, train_loss: 1.0489, test_loss: 1.0061, test_f1: 0.4771
 epoch: 15, train_loss: 1.0547, test_loss: 1.0215, test_f1: 0.4576
 epoch: 16, train_loss: 1.0471, test_loss: 1.0060, test_f1: 0.4663
 epoch: 17, train_loss: 1.0350, test_loss: 0.9909, test_f1: 0.4676
 epoch: 18, train_loss: 1.0280, test_loss: 1.0078, test_f1: 0.4560
 epoch: 19, train_loss: 1.0393, test_loss: 0.9902, test_f1: 0.4808
 epoch: 20, train_loss: 1.0267, test_loss: 0.9883, test_f1: 0.4760
 epoch: 21, train_loss: 1.0233, test_loss: 0.9974, test_f1: 0.4684
 epoch: 22, train_loss: 1.0185, test_loss: 0.9853, test_f1: 0.4631
 epoch: 23, train_loss: 1.0182, test_loss: 0.9838, test_f1: 0.4663
 epoch: 24, train_loss: 1.0166, test_loss: 0.9966, test_f1: 0.4592
 epoch: 25, train_loss: 1.0074, test_loss: 0.9655, test_f1: 0.4643
 epoch: 26, train_loss: 0.9973, test_loss: 0.9699, test_f1: 0.4515
 epoch: 27, train_loss: 0.9945, test_loss: 0.9884, test_f1: 0.4984
 epoch: 28, train_loss: 1.0080, test_loss: 0.9826, test_f1: 0.4615
 epoch: 29, train_loss: 0.9815, test_loss: 0.9675, test_f1: 0.4642
 epoch: 30, train_loss: 0.9922, test_loss: 0.9844, test_f1: 0.4605
 epoch: 31, train_loss: 0.9748, test_loss: 0.9767, test_f1: 0.4599
 epoch: 32, train_loss: 0.9838, test_loss: 0.9896, test_f1: 0.4453
 epoch: 33, train_loss: 0.9783, test_loss: 0.9780, test_f1: 0.4704
 epoch: 34, train_loss: 0.9748, test_loss: 1.0083, test_f1: 0.4440
 epoch: 35, train_loss: 0.9775, test_loss: 0.9692, test_f1: 0.4547
 epoch: 36, train_loss: 0.9646, test_loss: 0.9746, test_f1: 0.4697
 epoch: 37, train_loss: 0.9715, test_loss: 0.9705, test_f1: 0.4549
 epoch: 38, train_loss: 0.9553, test_loss: 0.9600, test_f1: 0.4638
 epoch: 39, train_loss: 0.9484, test_loss: 0.9506, test_f1: 0.4705
 epoch: 40, train_loss: 0.9599, test_loss: 1.0005, test_f1: 0.4437
 epoch: 41, train_loss: 0.9532, test_loss: 0.9557, test_f1: 0.4573
 epoch: 42, train_loss: 0.9436, test_loss: 0.9869, test_f1: 0.4527
 epoch: 43, train_loss: 0.9447, test_loss: 0.9624, test_f1: 0.4517
 epoch: 44, train_loss: 0.9394, test_loss: 0.9522, test_f1: 0.4425
 epoch: 45, train_loss: 0.9452, test_loss: 0.9650, test_f1: 0.4565
 epoch: 46, train_loss: 0.9340, test_loss: 0.9711, test_f1: 0.4697
 epoch: 47, train_loss: 0.9163, test_loss: 0.9477, test_f1: 0.4857
 epoch: 48, train_loss: 0.9361, test_loss: 0.9671, test_f1: 0.4719
 epoch: 49, train_loss: 0.9297, test_loss: 0.9686, test_f1: 0.4732
 epoch: 50, train_loss: 0.9269, test_loss: 0.9581, test_f1: 0.4714
 epoch: 51, train_loss: 0.9081, test_loss: 0.9528, test_f1: 0.4664
 epoch: 52, train_loss: 0.9070, test_loss: 0.9608, test_f1: 0.4726
 epoch: 53, train_loss: 0.9128, test_loss: 0.9732, test_f1: 0.4710
 epoch: 54, train_loss: 0.9088, test_loss: 0.9955, test_f1: 0.4763
 epoch: 55, train_loss: 0.9060, test_loss: 0.9507, test_f1: 0.4668
 epoch: 56, train_loss: 0.9101, test_loss: 0.9912, test_f1: 0.4683
 epoch: 57, train_loss: 0.9029, test_loss: 0.9630, test_f1: 0.4680
 epoch: 58, train_loss: 0.9044, test_loss: 0.9565, test_f1: 0.4731
 epoch: 59, train_loss: 0.9010, test_loss: 0.9655, test_f1: 0.4693
 epoch: 60, train_loss: 0.8964, test_loss: 0.9718, test_f1: 0.4716
 epoch: 61, train_loss: 0.9140, test_loss: 0.9563, test_f1: 0.4615
 epoch: 62, train_loss: 0.9026, test_loss: 0.9570, test_f1: 0.4799
 epoch: 63, train_loss: 0.8968, test_loss: 0.9594, test_f1: 0.4718
 epoch: 64, train_loss: 0.9057, test_loss: 0.9398, test_f1: 0.4666
 epoch: 65, train_loss: 0.9070, test_loss: 0.9815, test_f1: 0.4752
 epoch: 66, train_loss: 0.8870, test_loss: 0.9609, test_f1: 0.4775
 epoch: 67, train_loss: 0.8969, test_loss: 1.0315, test_f1: 0.4623
 epoch: 68, train_loss: 0.8958, test_loss: 0.9749, test_f1: 0.4608
 epoch: 69, train_loss: 0.8907, test_loss: 0.9670, test_f1: 0.4803
 epoch: 70, train_loss: 0.8949, test_loss: 0.9860, test_f1: 0.4698
 epoch: 71, train_loss: 0.8894, test_loss: 1.0210, test_f1: 0.4587
 epoch: 72, train_loss: 0.8901, test_loss: 0.9714, test_f1: 0.4832
 epoch: 73, train_loss: 0.8977, test_loss: 0.9892, test_f1: 0.4735
 epoch: 74, train_loss: 0.8801, test_loss: 0.9498, test_f1: 0.4751
 epoch: 75, train_loss: 0.8752, test_loss: 0.9654, test_f1: 0.4823
 epoch: 76, train_loss: 0.8803, test_loss: 0.9588, test_f1: 0.4732
 epoch: 77, train_loss: 0.8786, test_loss: 0.9901, test_f1: 0.4689
 epoch: 78, train_loss: 0.8869, test_loss: 0.9464, test_f1: 0.4794
 epoch: 79, train_loss: 0.8716, test_loss: 0.9839, test_f1: 0.4736
 epoch: 80, train_loss: 0.8738, test_loss: 0.9834, test_f1: 0.4702
 epoch: 81, train_loss: 0.8765, test_loss: 1.0362, test_f1: 0.4553
 epoch: 82, train_loss: 0.8692, test_loss: 1.0082, test_f1: 0.4754
 epoch: 83, train_loss: 0.8692, test_loss: 0.9909, test_f1: 0.4695
 epoch: 84, train_loss: 0.8707, test_loss: 0.9634, test_f1: 0.4694
 epoch: 85, train_loss: 0.8637, test_loss: 0.9877, test_f1: 0.4592
 epoch: 86, train_loss: 0.8766, test_loss: 0.9740, test_f1: 0.4841
 epoch: 87, train_loss: 0.8815, test_loss: 0.9731, test_f1: 0.4822
 epoch: 88, train_loss: 0.8688, test_loss: 0.9830, test_f1: 0.4742
 epoch: 89, train_loss: 0.8674, test_loss: 0.9664, test_f1: 0.4940
 epoch: 90, train_loss: 0.8691, test_loss: 1.0065, test_f1: 0.4762
 epoch: 91, train_loss: 0.8631, test_loss: 0.9642, test_f1: 0.5006
 epoch: 92, train_loss: 0.8586, test_loss: 0.9845, test_f1: 0.4973
 epoch: 93, train_loss: 0.8736, test_loss: 0.9818, test_f1: 0.4793
 epoch: 94, train_loss: 0.8568, test_loss: 1.0321, test_f1: 0.4836
 epoch: 95, train_loss: 0.8734, test_loss: 0.9599, test_f1: 0.4919
 epoch: 96, train_loss: 0.8593, test_loss: 0.9930, test_f1: 0.4833
 epoch: 97, train_loss: 0.8698, test_loss: 0.9859, test_f1: 0.4854
 epoch: 98, train_loss: 0.8633, test_loss: 0.9640, test_f1: 0.5015
 epoch: 99, train_loss: 0.8467, test_loss: 0.9733, test_f1: 0.4806
##################ITERATION #6 ****************************************
 epoch: 0, train_loss: 1.3399, test_loss: 1.1795, test_f1: 0.3768
 epoch: 1, train_loss: 1.2339, test_loss: 1.1596, test_f1: 0.4462
 epoch: 2, train_loss: 1.2068, test_loss: 1.1418, test_f1: 0.4393
 epoch: 3, train_loss: 1.1982, test_loss: 1.1262, test_f1: 0.4542
 epoch: 4, train_loss: 1.1879, test_loss: 1.1150, test_f1: 0.4480
 epoch: 5, train_loss: 1.1630, test_loss: 1.1048, test_f1: 0.4261
 epoch: 6, train_loss: 1.1482, test_loss: 1.0960, test_f1: 0.4502
 epoch: 7, train_loss: 1.1317, test_loss: 1.0845, test_f1: 0.4566
 epoch: 8, train_loss: 1.1317, test_loss: 1.0785, test_f1: 0.4383
 epoch: 9, train_loss: 1.1200, test_loss: 1.0757, test_f1: 0.4613
 epoch: 10, train_loss: 1.1193, test_loss: 1.0643, test_f1: 0.4474
 epoch: 11, train_loss: 1.1017, test_loss: 1.0653, test_f1: 0.4476
 epoch: 12, train_loss: 1.1073, test_loss: 1.0591, test_f1: 0.4625
 epoch: 13, train_loss: 1.0834, test_loss: 1.0585, test_f1: 0.4416
 epoch: 14, train_loss: 1.0897, test_loss: 1.0463, test_f1: 0.4452
 epoch: 15, train_loss: 1.0736, test_loss: 1.0345, test_f1: 0.4431
 epoch: 16, train_loss: 1.0682, test_loss: 1.0355, test_f1: 0.4487
 epoch: 17, train_loss: 1.0664, test_loss: 1.0188, test_f1: 0.4537
 epoch: 18, train_loss: 1.0664, test_loss: 1.0278, test_f1: 0.4487
 epoch: 19, train_loss: 1.0516, test_loss: 1.0143, test_f1: 0.4608
 epoch: 20, train_loss: 1.0568, test_loss: 1.0139, test_f1: 0.4385
 epoch: 21, train_loss: 1.0421, test_loss: 0.9998, test_f1: 0.4723
 epoch: 22, train_loss: 1.0335, test_loss: 1.0132, test_f1: 0.4594
 epoch: 23, train_loss: 1.0328, test_loss: 1.0079, test_f1: 0.4630
 epoch: 24, train_loss: 1.0333, test_loss: 1.0020, test_f1: 0.4454
 epoch: 25, train_loss: 1.0166, test_loss: 0.9963, test_f1: 0.4739
 epoch: 26, train_loss: 1.0207, test_loss: 0.9871, test_f1: 0.4519
 epoch: 27, train_loss: 1.0102, test_loss: 1.0058, test_f1: 0.4639
 epoch: 28, train_loss: 1.0096, test_loss: 1.0007, test_f1: 0.4450
 epoch: 29, train_loss: 1.0089, test_loss: 0.9927, test_f1: 0.4781
 epoch: 30, train_loss: 0.9979, test_loss: 0.9894, test_f1: 0.4723
 epoch: 31, train_loss: 0.9925, test_loss: 0.9910, test_f1: 0.4734
 epoch: 32, train_loss: 0.9881, test_loss: 1.0058, test_f1: 0.4430
 epoch: 33, train_loss: 0.9766, test_loss: 1.0169, test_f1: 0.4632
 epoch: 34, train_loss: 0.9909, test_loss: 1.0112, test_f1: 0.4551
 epoch: 35, train_loss: 0.9761, test_loss: 1.0059, test_f1: 0.4402
 epoch: 36, train_loss: 0.9842, test_loss: 0.9981, test_f1: 0.4365
 epoch: 37, train_loss: 0.9636, test_loss: 1.0039, test_f1: 0.4559
 epoch: 38, train_loss: 0.9643, test_loss: 0.9954, test_f1: 0.4570
 epoch: 39, train_loss: 0.9612, test_loss: 1.0026, test_f1: 0.4560
 epoch: 40, train_loss: 0.9565, test_loss: 1.0031, test_f1: 0.4695
 epoch: 41, train_loss: 0.9546, test_loss: 1.0003, test_f1: 0.4675
 epoch: 42, train_loss: 0.9511, test_loss: 0.9892, test_f1: 0.4604
 epoch: 43, train_loss: 0.9489, test_loss: 0.9996, test_f1: 0.4655
 epoch: 44, train_loss: 0.9437, test_loss: 0.9999, test_f1: 0.4598
 epoch: 45, train_loss: 0.9450, test_loss: 1.0043, test_f1: 0.4622
 epoch: 46, train_loss: 0.9271, test_loss: 1.0069, test_f1: 0.4673
 epoch: 47, train_loss: 0.9332, test_loss: 0.9973, test_f1: 0.4653
 epoch: 48, train_loss: 0.9297, test_loss: 0.9963, test_f1: 0.4670
 epoch: 49, train_loss: 0.9199, test_loss: 1.0163, test_f1: 0.4741
 epoch: 50, train_loss: 0.9184, test_loss: 1.0187, test_f1: 0.4749
 epoch: 51, train_loss: 0.9183, test_loss: 1.0084, test_f1: 0.4844
 epoch: 52, train_loss: 0.9096, test_loss: 1.0129, test_f1: 0.4703
 epoch: 53, train_loss: 0.9207, test_loss: 1.0421, test_f1: 0.4569
 epoch: 54, train_loss: 0.9075, test_loss: 1.0417, test_f1: 0.4601
 epoch: 55, train_loss: 0.9115, test_loss: 1.0208, test_f1: 0.4768
 epoch: 56, train_loss: 0.9060, test_loss: 1.0267, test_f1: 0.4564
 epoch: 57, train_loss: 0.8998, test_loss: 1.0300, test_f1: 0.4521
 epoch: 58, train_loss: 0.9101, test_loss: 1.0111, test_f1: 0.4733
 epoch: 59, train_loss: 0.8960, test_loss: 1.0303, test_f1: 0.4612
 epoch: 60, train_loss: 0.9061, test_loss: 1.0343, test_f1: 0.4411
 epoch: 61, train_loss: 0.9001, test_loss: 1.0497, test_f1: 0.4356
 epoch: 62, train_loss: 0.8911, test_loss: 1.0437, test_f1: 0.4531
 epoch: 63, train_loss: 0.8836, test_loss: 1.0465, test_f1: 0.4363
 epoch: 64, train_loss: 0.9029, test_loss: 1.0395, test_f1: 0.4521
 epoch: 65, train_loss: 0.8904, test_loss: 1.0358, test_f1: 0.4572
 epoch: 66, train_loss: 0.8895, test_loss: 1.0302, test_f1: 0.4700
 epoch: 67, train_loss: 0.9034, test_loss: 1.0579, test_f1: 0.4474
 epoch: 68, train_loss: 0.8941, test_loss: 1.0538, test_f1: 0.4321
 epoch: 69, train_loss: 0.8903, test_loss: 1.0400, test_f1: 0.4358
 epoch: 70, train_loss: 0.8931, test_loss: 1.0619, test_f1: 0.4453
 epoch: 71, train_loss: 0.8893, test_loss: 1.0445, test_f1: 0.4615
 epoch: 72, train_loss: 0.8915, test_loss: 1.0285, test_f1: 0.4728
 epoch: 73, train_loss: 0.8747, test_loss: 1.0683, test_f1: 0.4581
 epoch: 74, train_loss: 0.8761, test_loss: 1.0732, test_f1: 0.4569
 epoch: 75, train_loss: 0.8773, test_loss: 1.0349, test_f1: 0.4575
 epoch: 76, train_loss: 0.8716, test_loss: 1.0613, test_f1: 0.4528
 epoch: 77, train_loss: 0.8655, test_loss: 1.0278, test_f1: 0.4738
 epoch: 78, train_loss: 0.8846, test_loss: 1.0760, test_f1: 0.4399
 epoch: 79, train_loss: 0.8730, test_loss: 1.0486, test_f1: 0.4564
 epoch: 80, train_loss: 0.8588, test_loss: 1.0633, test_f1: 0.4442
 epoch: 81, train_loss: 0.8664, test_loss: 1.0706, test_f1: 0.4451
 epoch: 82, train_loss: 0.8654, test_loss: 1.0337, test_f1: 0.4577
 epoch: 83, train_loss: 0.8659, test_loss: 1.0796, test_f1: 0.4554
 epoch: 84, train_loss: 0.8757, test_loss: 1.0342, test_f1: 0.4631
 epoch: 85, train_loss: 0.8719, test_loss: 1.0444, test_f1: 0.4698
 epoch: 86, train_loss: 0.8523, test_loss: 1.0537, test_f1: 0.4706
 epoch: 87, train_loss: 0.8746, test_loss: 1.0574, test_f1: 0.4720
 epoch: 88, train_loss: 0.8664, test_loss: 1.0909, test_f1: 0.4617
 epoch: 89, train_loss: 0.8729, test_loss: 1.0836, test_f1: 0.4739
 epoch: 90, train_loss: 0.8569, test_loss: 1.1188, test_f1: 0.4614
 epoch: 91, train_loss: 0.8563, test_loss: 1.1198, test_f1: 0.4511
 epoch: 92, train_loss: 0.8565, test_loss: 1.1075, test_f1: 0.4835
 epoch: 93, train_loss: 0.8597, test_loss: 1.0672, test_f1: 0.4554
 epoch: 94, train_loss: 0.8531, test_loss: 1.0484, test_f1: 0.4692
 epoch: 95, train_loss: 0.8495, test_loss: 1.0845, test_f1: 0.4616
 epoch: 96, train_loss: 0.8530, test_loss: 1.0719, test_f1: 0.4625
 epoch: 97, train_loss: 0.8505, test_loss: 1.1201, test_f1: 0.4657
 epoch: 98, train_loss: 0.8583, test_loss: 1.0877, test_f1: 0.4641
 epoch: 99, train_loss: 0.8510, test_loss: 1.0506, test_f1: 0.4611
##################ITERATION #7 ****************************************
 epoch: 0, train_loss: 1.3317, test_loss: 1.2053, test_f1: 0.3977
 epoch: 1, train_loss: 1.2521, test_loss: 1.1816, test_f1: 0.3881
 epoch: 2, train_loss: 1.2315, test_loss: 1.1693, test_f1: 0.3654
 epoch: 3, train_loss: 1.2277, test_loss: 1.1589, test_f1: 0.3949
 epoch: 4, train_loss: 1.2054, test_loss: 1.1394, test_f1: 0.4026
 epoch: 5, train_loss: 1.1782, test_loss: 1.1309, test_f1: 0.4137
 epoch: 6, train_loss: 1.1744, test_loss: 1.1194, test_f1: 0.4213
 epoch: 7, train_loss: 1.1618, test_loss: 1.1057, test_f1: 0.4326
 epoch: 8, train_loss: 1.1460, test_loss: 1.0887, test_f1: 0.4324
 epoch: 9, train_loss: 1.1408, test_loss: 1.0774, test_f1: 0.4384
 epoch: 10, train_loss: 1.1290, test_loss: 1.0735, test_f1: 0.4339
 epoch: 11, train_loss: 1.1253, test_loss: 1.0678, test_f1: 0.4236
 epoch: 12, train_loss: 1.1165, test_loss: 1.0524, test_f1: 0.4259
 epoch: 13, train_loss: 1.1052, test_loss: 1.0489, test_f1: 0.4147
 epoch: 14, train_loss: 1.0991, test_loss: 1.0407, test_f1: 0.4198
 epoch: 15, train_loss: 1.0912, test_loss: 1.0331, test_f1: 0.4215
 epoch: 16, train_loss: 1.0801, test_loss: 1.0336, test_f1: 0.4168
 epoch: 17, train_loss: 1.0758, test_loss: 1.0156, test_f1: 0.4271
 epoch: 18, train_loss: 1.0705, test_loss: 1.0160, test_f1: 0.4295
 epoch: 19, train_loss: 1.0655, test_loss: 1.0104, test_f1: 0.4338
 epoch: 20, train_loss: 1.0625, test_loss: 1.0029, test_f1: 0.4424
 epoch: 21, train_loss: 1.0555, test_loss: 0.9955, test_f1: 0.4396
 epoch: 22, train_loss: 1.0505, test_loss: 0.9964, test_f1: 0.4476
 epoch: 23, train_loss: 1.0411, test_loss: 0.9932, test_f1: 0.4562
 epoch: 24, train_loss: 1.0305, test_loss: 1.0020, test_f1: 0.4496
 epoch: 25, train_loss: 1.0303, test_loss: 0.9900, test_f1: 0.4499
 epoch: 26, train_loss: 1.0265, test_loss: 0.9765, test_f1: 0.4615
 epoch: 27, train_loss: 1.0240, test_loss: 0.9859, test_f1: 0.4399
 epoch: 28, train_loss: 1.0245, test_loss: 0.9820, test_f1: 0.4508
 epoch: 29, train_loss: 1.0122, test_loss: 0.9712, test_f1: 0.4628
 epoch: 30, train_loss: 1.0080, test_loss: 0.9643, test_f1: 0.4516
 epoch: 31, train_loss: 1.0005, test_loss: 0.9666, test_f1: 0.4574
 epoch: 32, train_loss: 1.0011, test_loss: 0.9760, test_f1: 0.4395
 epoch: 33, train_loss: 0.9889, test_loss: 0.9645, test_f1: 0.4680
 epoch: 34, train_loss: 0.9935, test_loss: 0.9681, test_f1: 0.4731
 epoch: 35, train_loss: 0.9841, test_loss: 0.9633, test_f1: 0.4564
 epoch: 36, train_loss: 0.9909, test_loss: 0.9570, test_f1: 0.4560
 epoch: 37, train_loss: 0.9822, test_loss: 0.9651, test_f1: 0.4516
 epoch: 38, train_loss: 0.9731, test_loss: 0.9630, test_f1: 0.4356
 epoch: 39, train_loss: 0.9730, test_loss: 0.9692, test_f1: 0.4597
 epoch: 40, train_loss: 0.9634, test_loss: 0.9510, test_f1: 0.4782
 epoch: 41, train_loss: 0.9742, test_loss: 0.9489, test_f1: 0.4616
 epoch: 42, train_loss: 0.9641, test_loss: 0.9539, test_f1: 0.4590
 epoch: 43, train_loss: 0.9516, test_loss: 0.9478, test_f1: 0.4870
 epoch: 44, train_loss: 0.9525, test_loss: 0.9320, test_f1: 0.4818
 epoch: 45, train_loss: 0.9539, test_loss: 0.9390, test_f1: 0.4788
 epoch: 46, train_loss: 0.9426, test_loss: 0.9518, test_f1: 0.4572
 epoch: 47, train_loss: 0.9385, test_loss: 0.9516, test_f1: 0.4931
 epoch: 48, train_loss: 0.9436, test_loss: 0.9521, test_f1: 0.4700
 epoch: 49, train_loss: 0.9395, test_loss: 0.9501, test_f1: 0.4686
 epoch: 50, train_loss: 0.9438, test_loss: 0.9542, test_f1: 0.4689
 epoch: 51, train_loss: 0.9369, test_loss: 0.9554, test_f1: 0.4619
 epoch: 52, train_loss: 0.9417, test_loss: 0.9445, test_f1: 0.4883
 epoch: 53, train_loss: 0.9272, test_loss: 0.9474, test_f1: 0.4893
 epoch: 54, train_loss: 0.9262, test_loss: 0.9528, test_f1: 0.4751
 epoch: 55, train_loss: 0.9188, test_loss: 0.9563, test_f1: 0.5035
 epoch: 56, train_loss: 0.9149, test_loss: 0.9311, test_f1: 0.4730
 epoch: 57, train_loss: 0.9177, test_loss: 0.9465, test_f1: 0.4925
 epoch: 58, train_loss: 0.9306, test_loss: 0.9436, test_f1: 0.4937
 epoch: 59, train_loss: 0.9170, test_loss: 0.9486, test_f1: 0.4791
 epoch: 60, train_loss: 0.9146, test_loss: 0.9533, test_f1: 0.4664
 epoch: 61, train_loss: 0.9185, test_loss: 0.9423, test_f1: 0.4735
 epoch: 62, train_loss: 0.9078, test_loss: 0.9570, test_f1: 0.4806
 epoch: 63, train_loss: 0.9094, test_loss: 0.9382, test_f1: 0.4895
 epoch: 64, train_loss: 0.9068, test_loss: 0.9518, test_f1: 0.5068
 epoch: 65, train_loss: 0.9105, test_loss: 0.9348, test_f1: 0.4808
 epoch: 66, train_loss: 0.9173, test_loss: 0.9575, test_f1: 0.4934
 epoch: 67, train_loss: 0.9086, test_loss: 0.9456, test_f1: 0.4866
 epoch: 68, train_loss: 0.9100, test_loss: 0.9462, test_f1: 0.4819
 epoch: 69, train_loss: 0.9043, test_loss: 0.9525, test_f1: 0.4792
 epoch: 70, train_loss: 0.9132, test_loss: 0.9502, test_f1: 0.5043
 epoch: 71, train_loss: 0.8986, test_loss: 0.9485, test_f1: 0.4878
 epoch: 72, train_loss: 0.9063, test_loss: 0.9451, test_f1: 0.4969
 epoch: 73, train_loss: 0.9068, test_loss: 0.9547, test_f1: 0.4950
 epoch: 74, train_loss: 0.9050, test_loss: 0.9679, test_f1: 0.4854
 epoch: 75, train_loss: 0.9014, test_loss: 0.9506, test_f1: 0.5021
 epoch: 76, train_loss: 0.8882, test_loss: 0.9609, test_f1: 0.4900
 epoch: 77, train_loss: 0.8946, test_loss: 0.9624, test_f1: 0.4977
 epoch: 78, train_loss: 0.8948, test_loss: 0.9700, test_f1: 0.4859
 epoch: 79, train_loss: 0.8909, test_loss: 0.9544, test_f1: 0.5063
 epoch: 80, train_loss: 0.8967, test_loss: 0.9537, test_f1: 0.5032
 epoch: 81, train_loss: 0.8757, test_loss: 0.9719, test_f1: 0.4896
 epoch: 82, train_loss: 0.8860, test_loss: 0.9649, test_f1: 0.4990
 epoch: 83, train_loss: 0.8798, test_loss: 0.9747, test_f1: 0.5028
 epoch: 84, train_loss: 0.8969, test_loss: 0.9580, test_f1: 0.5052
 epoch: 85, train_loss: 0.8869, test_loss: 0.9465, test_f1: 0.4949
 epoch: 86, train_loss: 0.8776, test_loss: 0.9733, test_f1: 0.5030
 epoch: 87, train_loss: 0.8910, test_loss: 0.9665, test_f1: 0.4947
 epoch: 88, train_loss: 0.8811, test_loss: 0.9479, test_f1: 0.5109
 epoch: 89, train_loss: 0.8825, test_loss: 0.9701, test_f1: 0.5031
 epoch: 90, train_loss: 0.8858, test_loss: 0.9573, test_f1: 0.5030
 epoch: 91, train_loss: 0.8813, test_loss: 0.9792, test_f1: 0.4984
 epoch: 92, train_loss: 0.8821, test_loss: 0.9629, test_f1: 0.5040
 epoch: 93, train_loss: 0.8858, test_loss: 0.9466, test_f1: 0.5240
 epoch: 94, train_loss: 0.8760, test_loss: 0.9527, test_f1: 0.5150
 epoch: 95, train_loss: 0.8871, test_loss: 0.9623, test_f1: 0.5166
 epoch: 96, train_loss: 0.8740, test_loss: 0.9752, test_f1: 0.4985
 epoch: 97, train_loss: 0.8838, test_loss: 0.9557, test_f1: 0.5028
 epoch: 98, train_loss: 0.8782, test_loss: 0.9589, test_f1: 0.5117
 epoch: 99, train_loss: 0.8714, test_loss: 0.9822, test_f1: 0.5073
##################ITERATION #8 ****************************************
 epoch: 0, train_loss: 1.3583, test_loss: 1.2054, test_f1: 0.3455
 epoch: 1, train_loss: 1.2596, test_loss: 1.1748, test_f1: 0.3884
 epoch: 2, train_loss: 1.2309, test_loss: 1.1459, test_f1: 0.3961
 epoch: 3, train_loss: 1.2122, test_loss: 1.1392, test_f1: 0.4275
 epoch: 4, train_loss: 1.2027, test_loss: 1.1232, test_f1: 0.4295
 epoch: 5, train_loss: 1.1766, test_loss: 1.1083, test_f1: 0.4479
 epoch: 6, train_loss: 1.1799, test_loss: 1.1047, test_f1: 0.4427
 epoch: 7, train_loss: 1.1599, test_loss: 1.0911, test_f1: 0.4370
 epoch: 8, train_loss: 1.1517, test_loss: 1.0738, test_f1: 0.4371
 epoch: 9, train_loss: 1.1394, test_loss: 1.0711, test_f1: 0.4491
 epoch: 10, train_loss: 1.1268, test_loss: 1.0504, test_f1: 0.4693
 epoch: 11, train_loss: 1.1160, test_loss: 1.0453, test_f1: 0.4791
 epoch: 12, train_loss: 1.1066, test_loss: 1.0278, test_f1: 0.4906
 epoch: 13, train_loss: 1.0904, test_loss: 1.0247, test_f1: 0.4637
 epoch: 14, train_loss: 1.0876, test_loss: 1.0243, test_f1: 0.4865
 epoch: 15, train_loss: 1.0865, test_loss: 1.0022, test_f1: 0.4782
 epoch: 16, train_loss: 1.0725, test_loss: 1.0297, test_f1: 0.4824
 epoch: 17, train_loss: 1.0580, test_loss: 1.0102, test_f1: 0.4717
 epoch: 18, train_loss: 1.0582, test_loss: 0.9882, test_f1: 0.4920
 epoch: 19, train_loss: 1.0588, test_loss: 0.9856, test_f1: 0.4792
 epoch: 20, train_loss: 1.0447, test_loss: 0.9679, test_f1: 0.4903
 epoch: 21, train_loss: 1.0311, test_loss: 0.9664, test_f1: 0.5154
 epoch: 22, train_loss: 1.0324, test_loss: 0.9685, test_f1: 0.4911
 epoch: 23, train_loss: 1.0265, test_loss: 0.9622, test_f1: 0.4763
 epoch: 24, train_loss: 1.0215, test_loss: 0.9620, test_f1: 0.4889
 epoch: 25, train_loss: 1.0202, test_loss: 0.9563, test_f1: 0.4873
 epoch: 26, train_loss: 1.0112, test_loss: 0.9649, test_f1: 0.4835
 epoch: 27, train_loss: 1.0007, test_loss: 0.9682, test_f1: 0.4923
 epoch: 28, train_loss: 0.9899, test_loss: 0.9513, test_f1: 0.4690
 epoch: 29, train_loss: 0.9950, test_loss: 0.9431, test_f1: 0.4916
 epoch: 30, train_loss: 0.9898, test_loss: 0.9368, test_f1: 0.4776
 epoch: 31, train_loss: 0.9799, test_loss: 0.9377, test_f1: 0.4907
 epoch: 32, train_loss: 0.9853, test_loss: 0.9355, test_f1: 0.4957
 epoch: 33, train_loss: 0.9800, test_loss: 0.9489, test_f1: 0.4638
 epoch: 34, train_loss: 0.9805, test_loss: 0.9500, test_f1: 0.4708
 epoch: 35, train_loss: 0.9748, test_loss: 0.9387, test_f1: 0.4861
 epoch: 36, train_loss: 0.9649, test_loss: 0.9221, test_f1: 0.4956
 epoch: 37, train_loss: 0.9574, test_loss: 0.9240, test_f1: 0.4757
 epoch: 38, train_loss: 0.9452, test_loss: 0.9360, test_f1: 0.4835
 epoch: 39, train_loss: 0.9437, test_loss: 0.9278, test_f1: 0.4878
 epoch: 40, train_loss: 0.9466, test_loss: 0.9073, test_f1: 0.5104
 epoch: 41, train_loss: 0.9357, test_loss: 0.9101, test_f1: 0.5034
 epoch: 42, train_loss: 0.9269, test_loss: 0.8991, test_f1: 0.5138
 epoch: 43, train_loss: 0.9287, test_loss: 0.9202, test_f1: 0.4875
 epoch: 44, train_loss: 0.9229, test_loss: 0.9175, test_f1: 0.5014
 epoch: 45, train_loss: 0.9355, test_loss: 0.9363, test_f1: 0.4888
 epoch: 46, train_loss: 0.9252, test_loss: 0.9279, test_f1: 0.4857
 epoch: 47, train_loss: 0.9173, test_loss: 0.9107, test_f1: 0.5087
 epoch: 48, train_loss: 0.9108, test_loss: 0.9219, test_f1: 0.5134
 epoch: 49, train_loss: 0.9090, test_loss: 0.9374, test_f1: 0.4929
 epoch: 50, train_loss: 0.8998, test_loss: 0.9194, test_f1: 0.5053
 epoch: 51, train_loss: 0.9015, test_loss: 0.9349, test_f1: 0.5193
 epoch: 52, train_loss: 0.9024, test_loss: 0.9063, test_f1: 0.5306
 epoch: 53, train_loss: 0.8893, test_loss: 0.9159, test_f1: 0.5054
 epoch: 54, train_loss: 0.8953, test_loss: 0.9097, test_f1: 0.5325
 epoch: 55, train_loss: 0.8927, test_loss: 0.9375, test_f1: 0.4998
 epoch: 56, train_loss: 0.8889, test_loss: 0.9084, test_f1: 0.5101
 epoch: 57, train_loss: 0.8782, test_loss: 0.9251, test_f1: 0.4940
 epoch: 58, train_loss: 0.8918, test_loss: 0.9379, test_f1: 0.4976
 epoch: 59, train_loss: 0.8862, test_loss: 0.9251, test_f1: 0.5187
 epoch: 60, train_loss: 0.8808, test_loss: 0.9342, test_f1: 0.5288
 epoch: 61, train_loss: 0.8836, test_loss: 0.9082, test_f1: 0.5193
 epoch: 62, train_loss: 0.8803, test_loss: 0.9339, test_f1: 0.5145
 epoch: 63, train_loss: 0.8825, test_loss: 0.9272, test_f1: 0.5160
 epoch: 64, train_loss: 0.8830, test_loss: 0.9282, test_f1: 0.5142
 epoch: 65, train_loss: 0.8826, test_loss: 0.9269, test_f1: 0.4991
 epoch: 66, train_loss: 0.8720, test_loss: 0.9321, test_f1: 0.5150
 epoch: 67, train_loss: 0.8815, test_loss: 0.9381, test_f1: 0.5123
 epoch: 68, train_loss: 0.8816, test_loss: 0.9169, test_f1: 0.5090
 epoch: 69, train_loss: 0.8825, test_loss: 0.9206, test_f1: 0.4964
 epoch: 70, train_loss: 0.8684, test_loss: 0.9313, test_f1: 0.5069
 epoch: 71, train_loss: 0.8653, test_loss: 0.9269, test_f1: 0.5230
 epoch: 72, train_loss: 0.8720, test_loss: 0.9304, test_f1: 0.5077
 epoch: 73, train_loss: 0.8667, test_loss: 0.9233, test_f1: 0.5167
 epoch: 74, train_loss: 0.8571, test_loss: 0.9231, test_f1: 0.5113
 epoch: 75, train_loss: 0.8614, test_loss: 0.9148, test_f1: 0.5333
 epoch: 76, train_loss: 0.8659, test_loss: 0.9325, test_f1: 0.5247
 epoch: 77, train_loss: 0.8614, test_loss: 0.9240, test_f1: 0.5315
 epoch: 78, train_loss: 0.8542, test_loss: 0.9219, test_f1: 0.5215
 epoch: 79, train_loss: 0.8532, test_loss: 0.9228, test_f1: 0.5252
 epoch: 80, train_loss: 0.8559, test_loss: 0.9693, test_f1: 0.4981
 epoch: 81, train_loss: 0.8626, test_loss: 0.9420, test_f1: 0.5139
 epoch: 82, train_loss: 0.8684, test_loss: 0.9450, test_f1: 0.5137
 epoch: 83, train_loss: 0.8609, test_loss: 0.9327, test_f1: 0.5229
 epoch: 84, train_loss: 0.8561, test_loss: 0.9355, test_f1: 0.5151
 epoch: 85, train_loss: 0.8487, test_loss: 0.9543, test_f1: 0.5314
 epoch: 86, train_loss: 0.8533, test_loss: 0.9396, test_f1: 0.5175
 epoch: 87, train_loss: 0.8550, test_loss: 0.9680, test_f1: 0.4731
 epoch: 88, train_loss: 0.8439, test_loss: 0.9434, test_f1: 0.5203
 epoch: 89, train_loss: 0.8508, test_loss: 0.9381, test_f1: 0.5253
 epoch: 90, train_loss: 0.8439, test_loss: 0.9459, test_f1: 0.5181
 epoch: 91, train_loss: 0.8399, test_loss: 0.9482, test_f1: 0.5194
 epoch: 92, train_loss: 0.8384, test_loss: 0.9358, test_f1: 0.5181
 epoch: 93, train_loss: 0.8453, test_loss: 0.9265, test_f1: 0.5279
 epoch: 94, train_loss: 0.8397, test_loss: 0.9351, test_f1: 0.5234
 epoch: 95, train_loss: 0.8254, test_loss: 0.9402, test_f1: 0.5191
 epoch: 96, train_loss: 0.8363, test_loss: 0.9475, test_f1: 0.5302
 epoch: 97, train_loss: 0.8436, test_loss: 0.9765, test_f1: 0.5021
 epoch: 98, train_loss: 0.8272, test_loss: 0.9692, test_f1: 0.5320
 epoch: 99, train_loss: 0.8256, test_loss: 0.9735, test_f1: 0.5176
##################ITERATION #9 ****************************************
 epoch: 0, train_loss: 1.3572, test_loss: 1.2190, test_f1: 0.3189
 epoch: 1, train_loss: 1.2588, test_loss: 1.1731, test_f1: 0.3611
 epoch: 2, train_loss: 1.2379, test_loss: 1.2192, test_f1: 0.3761
 epoch: 3, train_loss: 1.2264, test_loss: 1.3033, test_f1: 0.3923
 epoch: 4, train_loss: 1.2058, test_loss: 1.4983, test_f1: 0.3985
 epoch: 5, train_loss: 1.1831, test_loss: 1.7583, test_f1: 0.4193
 epoch: 6, train_loss: 1.1602, test_loss: 1.4939, test_f1: 0.4187
 epoch: 7, train_loss: 1.1463, test_loss: 1.1991, test_f1: 0.4421
 epoch: 8, train_loss: 1.1408, test_loss: 1.3171, test_f1: 0.4389
 epoch: 9, train_loss: 1.1300, test_loss: 1.2266, test_f1: 0.4496
 epoch: 10, train_loss: 1.1041, test_loss: 1.2345, test_f1: 0.4398
 epoch: 11, train_loss: 1.1038, test_loss: 1.5793, test_f1: 0.4547
 epoch: 12, train_loss: 1.0995, test_loss: 1.2436, test_f1: 0.4459
 epoch: 13, train_loss: 1.0943, test_loss: 1.0203, test_f1: 0.4618
 epoch: 14, train_loss: 1.0834, test_loss: 1.0147, test_f1: 0.4769
 epoch: 15, train_loss: 1.0798, test_loss: 1.0121, test_f1: 0.4784
 epoch: 16, train_loss: 1.0594, test_loss: 1.0051, test_f1: 0.4827
 epoch: 17, train_loss: 1.0521, test_loss: 1.0031, test_f1: 0.4637
 epoch: 18, train_loss: 1.0437, test_loss: 1.1096, test_f1: 0.4671
 epoch: 19, train_loss: 1.0413, test_loss: 1.0203, test_f1: 0.4349
 epoch: 20, train_loss: 1.0338, test_loss: 1.3624, test_f1: 0.4508
 epoch: 21, train_loss: 1.0343, test_loss: 1.0495, test_f1: 0.4745
 epoch: 22, train_loss: 1.0218, test_loss: 0.9899, test_f1: 0.4687
 epoch: 23, train_loss: 1.0130, test_loss: 0.9732, test_f1: 0.4885
 epoch: 24, train_loss: 1.0186, test_loss: 0.9721, test_f1: 0.4900
 epoch: 25, train_loss: 1.0086, test_loss: 0.9793, test_f1: 0.4569
 epoch: 26, train_loss: 1.0096, test_loss: 0.9505, test_f1: 0.4832
 epoch: 27, train_loss: 1.0002, test_loss: 0.9509, test_f1: 0.4796
 epoch: 28, train_loss: 1.0126, test_loss: 0.9490, test_f1: 0.4969
 epoch: 29, train_loss: 0.9960, test_loss: 0.9489, test_f1: 0.4561
 epoch: 30, train_loss: 0.9978, test_loss: 0.9457, test_f1: 0.4858
 epoch: 31, train_loss: 0.9919, test_loss: 0.9486, test_f1: 0.4861
 epoch: 32, train_loss: 0.9849, test_loss: 0.9537, test_f1: 0.4781
 epoch: 33, train_loss: 0.9760, test_loss: 0.9531, test_f1: 0.4710
 epoch: 34, train_loss: 0.9846, test_loss: 0.9441, test_f1: 0.4754
 epoch: 35, train_loss: 0.9721, test_loss: 0.9702, test_f1: 0.4714
 epoch: 36, train_loss: 0.9650, test_loss: 0.9411, test_f1: 0.4754
 epoch: 37, train_loss: 0.9546, test_loss: 0.9398, test_f1: 0.4655
 epoch: 38, train_loss: 0.9615, test_loss: 0.9255, test_f1: 0.4837
 epoch: 39, train_loss: 0.9507, test_loss: 0.9185, test_f1: 0.4815
 epoch: 40, train_loss: 0.9415, test_loss: 0.9135, test_f1: 0.5034
 epoch: 41, train_loss: 0.9555, test_loss: 0.9411, test_f1: 0.4714
 epoch: 42, train_loss: 0.9419, test_loss: 0.9303, test_f1: 0.4843
 epoch: 43, train_loss: 0.9458, test_loss: 0.9394, test_f1: 0.4859
 epoch: 44, train_loss: 0.9479, test_loss: 0.9296, test_f1: 0.4978
 epoch: 45, train_loss: 0.9397, test_loss: 0.9241, test_f1: 0.4825
 epoch: 46, train_loss: 0.9254, test_loss: 0.9120, test_f1: 0.4951
 epoch: 47, train_loss: 0.9276, test_loss: 0.9116, test_f1: 0.4968
 epoch: 48, train_loss: 0.9231, test_loss: 0.9272, test_f1: 0.4867
 epoch: 49, train_loss: 0.9264, test_loss: 0.9186, test_f1: 0.4963
 epoch: 50, train_loss: 0.9169, test_loss: 0.9278, test_f1: 0.4921
 epoch: 51, train_loss: 0.9086, test_loss: 0.9245, test_f1: 0.5083
 epoch: 52, train_loss: 0.9132, test_loss: 0.9121, test_f1: 0.5013
 epoch: 53, train_loss: 0.9042, test_loss: 0.9287, test_f1: 0.4963
 epoch: 54, train_loss: 0.9044, test_loss: 0.9143, test_f1: 0.4964
 epoch: 55, train_loss: 0.9137, test_loss: 0.9262, test_f1: 0.4839
 epoch: 56, train_loss: 0.9076, test_loss: 0.9150, test_f1: 0.5009
 epoch: 57, train_loss: 0.9015, test_loss: 0.9257, test_f1: 0.4907
 epoch: 58, train_loss: 0.8993, test_loss: 0.9194, test_f1: 0.5028
 epoch: 59, train_loss: 0.9009, test_loss: 0.9300, test_f1: 0.4902
 epoch: 60, train_loss: 0.9000, test_loss: 0.9307, test_f1: 0.4999
 epoch: 61, train_loss: 0.8964, test_loss: 0.9230, test_f1: 0.4969
 epoch: 62, train_loss: 0.9070, test_loss: 0.9325, test_f1: 0.4901
 epoch: 63, train_loss: 0.8937, test_loss: 0.9244, test_f1: 0.4967
 epoch: 64, train_loss: 0.9000, test_loss: 0.9334, test_f1: 0.4953
 epoch: 65, train_loss: 0.8987, test_loss: 0.9298, test_f1: 0.5126
 epoch: 66, train_loss: 0.9007, test_loss: 0.9274, test_f1: 0.5027
 epoch: 67, train_loss: 0.9000, test_loss: 0.9350, test_f1: 0.5160
 epoch: 68, train_loss: 0.8910, test_loss: 0.9264, test_f1: 0.5014
 epoch: 69, train_loss: 0.8839, test_loss: 0.9197, test_f1: 0.5038
 epoch: 70, train_loss: 0.8749, test_loss: 0.9385, test_f1: 0.4985
 epoch: 71, train_loss: 0.8862, test_loss: 0.9329, test_f1: 0.4914
 epoch: 72, train_loss: 0.8994, test_loss: 0.9427, test_f1: 0.5076
 epoch: 73, train_loss: 0.8777, test_loss: 0.9264, test_f1: 0.5027
 epoch: 74, train_loss: 0.8845, test_loss: 0.9314, test_f1: 0.4789
 epoch: 75, train_loss: 0.8733, test_loss: 0.9398, test_f1: 0.5097
 epoch: 76, train_loss: 0.8814, test_loss: 0.9399, test_f1: 0.4897
 epoch: 77, train_loss: 0.8875, test_loss: 0.9349, test_f1: 0.4995
 epoch: 78, train_loss: 0.8759, test_loss: 0.9360, test_f1: 0.5147
 epoch: 79, train_loss: 0.8844, test_loss: 0.9449, test_f1: 0.5177
 epoch: 80, train_loss: 0.8735, test_loss: 0.9467, test_f1: 0.5011
 epoch: 81, train_loss: 0.8684, test_loss: 0.9447, test_f1: 0.4995
 epoch: 82, train_loss: 0.8745, test_loss: 0.9452, test_f1: 0.5068
 epoch: 83, train_loss: 0.8653, test_loss: 0.9291, test_f1: 0.4933
 epoch: 84, train_loss: 0.8743, test_loss: 0.9423, test_f1: 0.5025
 epoch: 85, train_loss: 0.8637, test_loss: 0.9328, test_f1: 0.5054
 epoch: 86, train_loss: 0.8690, test_loss: 0.9419, test_f1: 0.5188
 epoch: 87, train_loss: 0.8738, test_loss: 0.9690, test_f1: 0.4859
 epoch: 88, train_loss: 0.8639, test_loss: 0.9486, test_f1: 0.5224
 epoch: 89, train_loss: 0.8667, test_loss: 0.9446, test_f1: 0.5119
 epoch: 90, train_loss: 0.8649, test_loss: 0.9679, test_f1: 0.5163
 epoch: 91, train_loss: 0.8628, test_loss: 0.9417, test_f1: 0.5275
 epoch: 92, train_loss: 0.8596, test_loss: 0.9394, test_f1: 0.5097
 epoch: 93, train_loss: 0.8462, test_loss: 0.9468, test_f1: 0.5133
 epoch: 94, train_loss: 0.8543, test_loss: 0.9454, test_f1: 0.5098
 epoch: 95, train_loss: 0.8645, test_loss: 0.9494, test_f1: 0.4979
 epoch: 96, train_loss: 0.8665, test_loss: 0.9398, test_f1: 0.5181
 epoch: 97, train_loss: 0.8655, test_loss: 0.9523, test_f1: 0.4848
 epoch: 98, train_loss: 0.8512, test_loss: 0.9530, test_f1: 0.5026
 epoch: 99, train_loss: 0.8429, test_loss: 0.9402, test_f1: 0.5291

Training completed in 792.11 seconds
Best F1: 0.5616 at epoch 99
Mean F1 across iterations: 0.5282  0.0210
========================FINAL RESULTS================================
FEGIN weighted F1: 0.5616  0.0210
python main.py --data ltspice_examples --representation component_component --model FEGIN --layers 2 --hiddens 64 --batch_size 32 --lr 0.0001 --emb_size 128 --epochs 100 --save_appendix component_component_L2_H64_BS32_LR0.0001_E128 --no_val
-----



STDERR:
  File "main.py", line 370, in <module>
    main()
  File "main.py", line 254, in main
    dataset = dataset_class(
  File "/home/philip/projects/ltspice_examples_code_repo/Circuit-Completion-Using-GNNs/component_classification_with_link_prediction_head/evaluation/FEGIN/kernel/circuit_datasets.py", line 15, in __init__
    self.data, self.slices = torch.load(self.processed_paths[0])
  File "/home/philip/.local/lib/python3.8/site-packages/torch/serialization.py", line 1040, in load
    warnings.warn(
  File "/usr/lib/python3.8/warnings.py", line 109, in _showwarnmsg
    sw(msg.message, msg.category, msg.filename, msg.lineno,
  File "main.py", line 47, in warn_with_traceback
    traceback.print_stack(file=log)
/home/philip/projects/ltspice_examples_code_repo/Circuit-Completion-Using-GNNs/component_classification_with_link_prediction_head/evaluation/FEGIN/kernel/circuit_datasets.py:15: FutureWarning: You are using `torch.load` with `weights_only=False` (the current default value), which uses the default pickle module implicitly. It is possible to construct malicious pickle data which will execute arbitrary code during unpickling (See https://github.com/pytorch/pytorch/blob/main/SECURITY.md#untrusted-models for more details). In a future release, the default value for `weights_only` will be flipped to `True`. This limits the functions that could be executed during unpickling. Arbitrary objects will no longer be allowed to be loaded via this mode unless they are explicitly allowlisted by the user via `torch.serialization.add_safe_globals`. We recommend you start setting `weights_only=True` for any use case where you don't have full control of the loaded file. Please open an issue on GitHub for any issues related to this experimental feature.
  self.data, self.slices = torch.load(self.processed_paths[0])
