STDOUT:
Results will be saved in /home/philip/projects/ltspice_examples_code_repo/Circuit-Completion-Using-GNNs/component_classification_with_link_prediction_head/evaluation/FEGIN/results/model_FEGIN_dataset_ltspice_examples
Command line input: python main.py --data ltspice_examples --representation component_component --model FEGIN --layers 4 --hiddens 16 --batch_size 128 --lr 0.001 --emb_size 128 --epochs 100 --save_appendix component_component_L4_H16_BS128_LR0.001_E128 --no_val
 is saved.
-----
ltspice_examples - FEGIN
Using 4 layers, 16 hidden units, h = 2
Loading component_component representation dataset
ENTERED
Training FEGIN on component_component representation
Train: 3556, Test: 845
##################ITERATION #0 ****************************************
 epoch: 0, train_loss: 1.3474, test_loss: 1.3455, test_f1: 0.2274
 epoch: 1, train_loss: 1.3260, test_loss: 1.3282, test_f1: 0.2274
 epoch: 2, train_loss: 1.3081, test_loss: 1.3081, test_f1: 0.2274
 epoch: 3, train_loss: 1.2877, test_loss: 1.2839, test_f1: 0.2274
 epoch: 4, train_loss: 1.2689, test_loss: 1.2542, test_f1: 0.2274
 epoch: 5, train_loss: 1.2542, test_loss: 1.2277, test_f1: 0.2274
 epoch: 6, train_loss: 1.2419, test_loss: 1.2211, test_f1: 0.2274
 epoch: 7, train_loss: 1.2360, test_loss: 1.2128, test_f1: 0.2491
 epoch: 8, train_loss: 1.2224, test_loss: 1.2050, test_f1: 0.3047
 epoch: 9, train_loss: 1.2195, test_loss: 1.1992, test_f1: 0.3290
 epoch: 10, train_loss: 1.2074, test_loss: 1.1874, test_f1: 0.3468
 epoch: 11, train_loss: 1.1966, test_loss: 1.1718, test_f1: 0.3580
 epoch: 12, train_loss: 1.1901, test_loss: 1.1652, test_f1: 0.3364
 epoch: 13, train_loss: 1.1741, test_loss: 1.1535, test_f1: 0.3970
 epoch: 14, train_loss: 1.1727, test_loss: 1.1479, test_f1: 0.4179
 epoch: 15, train_loss: 1.1557, test_loss: 1.1278, test_f1: 0.4339
 epoch: 16, train_loss: 1.1458, test_loss: 1.1163, test_f1: 0.4549
 epoch: 17, train_loss: 1.1384, test_loss: 1.1063, test_f1: 0.4495
 epoch: 18, train_loss: 1.1234, test_loss: 1.1196, test_f1: 0.4377
 epoch: 19, train_loss: 1.1178, test_loss: 1.0893, test_f1: 0.4445
 epoch: 20, train_loss: 1.1025, test_loss: 1.0756, test_f1: 0.4838
 epoch: 21, train_loss: 1.0955, test_loss: 1.0993, test_f1: 0.4321
 epoch: 22, train_loss: 1.0933, test_loss: 1.0797, test_f1: 0.4420
 epoch: 23, train_loss: 1.0747, test_loss: 1.0499, test_f1: 0.4853
 epoch: 24, train_loss: 1.0709, test_loss: 1.0688, test_f1: 0.4437
 epoch: 25, train_loss: 1.0658, test_loss: 1.0332, test_f1: 0.4680
 epoch: 26, train_loss: 1.0578, test_loss: 1.0231, test_f1: 0.4656
 epoch: 27, train_loss: 1.0515, test_loss: 1.0118, test_f1: 0.4512
 epoch: 28, train_loss: 1.0375, test_loss: 1.0304, test_f1: 0.4552
 epoch: 29, train_loss: 1.0286, test_loss: 1.0076, test_f1: 0.4712
 epoch: 30, train_loss: 1.0289, test_loss: 1.0119, test_f1: 0.4452
 epoch: 31, train_loss: 1.0118, test_loss: 1.0244, test_f1: 0.4425
 epoch: 32, train_loss: 1.0126, test_loss: 1.0409, test_f1: 0.4373
 epoch: 33, train_loss: 0.9875, test_loss: 1.0107, test_f1: 0.4543
 epoch: 34, train_loss: 0.9967, test_loss: 1.0064, test_f1: 0.4667
 epoch: 35, train_loss: 0.9880, test_loss: 0.9935, test_f1: 0.4627
 epoch: 36, train_loss: 0.9817, test_loss: 0.9796, test_f1: 0.4805
 epoch: 37, train_loss: 0.9805, test_loss: 0.9874, test_f1: 0.4731
 epoch: 38, train_loss: 0.9652, test_loss: 0.9902, test_f1: 0.4729
 epoch: 39, train_loss: 0.9564, test_loss: 1.0059, test_f1: 0.4632
 epoch: 40, train_loss: 0.9532, test_loss: 0.9654, test_f1: 0.4957
 epoch: 41, train_loss: 0.9552, test_loss: 1.0058, test_f1: 0.4910
 epoch: 42, train_loss: 0.9548, test_loss: 1.0003, test_f1: 0.4880
 epoch: 43, train_loss: 0.9452, test_loss: 0.9857, test_f1: 0.4797
 epoch: 44, train_loss: 0.9347, test_loss: 1.0329, test_f1: 0.4766
 epoch: 45, train_loss: 0.9420, test_loss: 0.9698, test_f1: 0.4763
 epoch: 46, train_loss: 0.9423, test_loss: 0.9929, test_f1: 0.4654
 epoch: 47, train_loss: 0.9309, test_loss: 0.9802, test_f1: 0.4849
 epoch: 48, train_loss: 0.9272, test_loss: 1.0012, test_f1: 0.4820
 epoch: 49, train_loss: 0.9283, test_loss: 1.0223, test_f1: 0.4752
 epoch: 50, train_loss: 0.9170, test_loss: 0.9615, test_f1: 0.4817
 epoch: 51, train_loss: 0.9159, test_loss: 1.0054, test_f1: 0.4741
 epoch: 52, train_loss: 0.9050, test_loss: 0.9823, test_f1: 0.4884
 epoch: 53, train_loss: 0.9010, test_loss: 1.0029, test_f1: 0.4737
 epoch: 54, train_loss: 0.9087, test_loss: 1.0194, test_f1: 0.4699
 epoch: 55, train_loss: 0.9040, test_loss: 0.9945, test_f1: 0.4756
 epoch: 56, train_loss: 0.9030, test_loss: 0.9890, test_f1: 0.4767
 epoch: 57, train_loss: 0.8996, test_loss: 0.9986, test_f1: 0.4567
 epoch: 58, train_loss: 0.8921, test_loss: 1.0323, test_f1: 0.4676
 epoch: 59, train_loss: 0.8976, test_loss: 1.0191, test_f1: 0.4683
 epoch: 60, train_loss: 0.8974, test_loss: 1.0211, test_f1: 0.4551
 epoch: 61, train_loss: 0.8830, test_loss: 1.0115, test_f1: 0.4858
 epoch: 62, train_loss: 0.8868, test_loss: 1.0321, test_f1: 0.4902
 epoch: 63, train_loss: 0.8849, test_loss: 0.9998, test_f1: 0.4813
 epoch: 64, train_loss: 0.8913, test_loss: 1.0374, test_f1: 0.4789
 epoch: 65, train_loss: 0.8808, test_loss: 1.0309, test_f1: 0.4766
 epoch: 66, train_loss: 0.8872, test_loss: 1.0140, test_f1: 0.4731
 epoch: 67, train_loss: 0.8792, test_loss: 1.0542, test_f1: 0.4662
 epoch: 68, train_loss: 0.8891, test_loss: 1.0078, test_f1: 0.4881
 epoch: 69, train_loss: 0.8732, test_loss: 1.0202, test_f1: 0.4847
 epoch: 70, train_loss: 0.8802, test_loss: 1.0388, test_f1: 0.4728
 epoch: 71, train_loss: 0.8848, test_loss: 1.0511, test_f1: 0.4695
 epoch: 72, train_loss: 0.8769, test_loss: 1.0283, test_f1: 0.4783
 epoch: 73, train_loss: 0.8677, test_loss: 1.0538, test_f1: 0.4833
 epoch: 74, train_loss: 0.8802, test_loss: 1.0493, test_f1: 0.4847
 epoch: 75, train_loss: 0.8862, test_loss: 1.0341, test_f1: 0.4651
 epoch: 76, train_loss: 0.8640, test_loss: 1.0215, test_f1: 0.4760
 epoch: 77, train_loss: 0.8683, test_loss: 1.0488, test_f1: 0.4692
 epoch: 78, train_loss: 0.8635, test_loss: 1.0171, test_f1: 0.4979
 epoch: 79, train_loss: 0.8641, test_loss: 1.0611, test_f1: 0.4817
 epoch: 80, train_loss: 0.8671, test_loss: 1.0542, test_f1: 0.4784
 epoch: 81, train_loss: 0.8602, test_loss: 1.0615, test_f1: 0.4664
 epoch: 82, train_loss: 0.8625, test_loss: 1.0251, test_f1: 0.4803
 epoch: 83, train_loss: 0.8668, test_loss: 1.0419, test_f1: 0.4862
 epoch: 84, train_loss: 0.8606, test_loss: 1.0354, test_f1: 0.4701
 epoch: 85, train_loss: 0.8493, test_loss: 1.0758, test_f1: 0.4580
 epoch: 86, train_loss: 0.8613, test_loss: 1.0865, test_f1: 0.4738
 epoch: 87, train_loss: 0.8581, test_loss: 1.0696, test_f1: 0.4929
 epoch: 88, train_loss: 0.8643, test_loss: 1.0768, test_f1: 0.4801
 epoch: 89, train_loss: 0.8557, test_loss: 1.0913, test_f1: 0.4593
 epoch: 90, train_loss: 0.8574, test_loss: 1.0802, test_f1: 0.4615
 epoch: 91, train_loss: 0.8547, test_loss: 1.0721, test_f1: 0.4602
 epoch: 92, train_loss: 0.8554, test_loss: 1.0788, test_f1: 0.4724
 epoch: 93, train_loss: 0.8524, test_loss: 1.0719, test_f1: 0.4723
 epoch: 94, train_loss: 0.8540, test_loss: 1.0902, test_f1: 0.4628
 epoch: 95, train_loss: 0.8414, test_loss: 1.0889, test_f1: 0.4582
 epoch: 96, train_loss: 0.8444, test_loss: 1.0679, test_f1: 0.4675
 epoch: 97, train_loss: 0.8485, test_loss: 1.0715, test_f1: 0.4758
 epoch: 98, train_loss: 0.8596, test_loss: 1.0880, test_f1: 0.4667
 epoch: 99, train_loss: 0.8463, test_loss: 1.1040, test_f1: 0.4587
##################ITERATION #1 ****************************************
 epoch: 0, train_loss: 1.3594, test_loss: 1.3186, test_f1: 0.2274
 epoch: 1, train_loss: 1.2807, test_loss: 1.2758, test_f1: 0.2555
 epoch: 2, train_loss: 1.2621, test_loss: 1.2396, test_f1: 0.2713
 epoch: 3, train_loss: 1.2439, test_loss: 1.2171, test_f1: 0.2657
 epoch: 4, train_loss: 1.2209, test_loss: 1.2238, test_f1: 0.3335
 epoch: 5, train_loss: 1.2068, test_loss: 1.1774, test_f1: 0.3951
 epoch: 6, train_loss: 1.1824, test_loss: 1.1318, test_f1: 0.4206
 epoch: 7, train_loss: 1.1679, test_loss: 1.1097, test_f1: 0.4389
 epoch: 8, train_loss: 1.1429, test_loss: 1.0985, test_f1: 0.4345
 epoch: 9, train_loss: 1.1264, test_loss: 1.0759, test_f1: 0.4398
 epoch: 10, train_loss: 1.1073, test_loss: 1.0680, test_f1: 0.4593
 epoch: 11, train_loss: 1.0959, test_loss: 1.0632, test_f1: 0.4435
 epoch: 12, train_loss: 1.0863, test_loss: 1.0471, test_f1: 0.4610
 epoch: 13, train_loss: 1.0712, test_loss: 1.0380, test_f1: 0.4624
 epoch: 14, train_loss: 1.0788, test_loss: 1.0399, test_f1: 0.4660
 epoch: 15, train_loss: 1.0613, test_loss: 1.0453, test_f1: 0.4503
 epoch: 16, train_loss: 1.0499, test_loss: 1.0539, test_f1: 0.4485
 epoch: 17, train_loss: 1.0452, test_loss: 1.0145, test_f1: 0.4732
 epoch: 18, train_loss: 1.0322, test_loss: 1.0281, test_f1: 0.4717
 epoch: 19, train_loss: 1.0301, test_loss: 1.0623, test_f1: 0.4459
 epoch: 20, train_loss: 1.0089, test_loss: 1.0133, test_f1: 0.4766
 epoch: 21, train_loss: 1.0090, test_loss: 1.0184, test_f1: 0.4855
 epoch: 22, train_loss: 1.0079, test_loss: 1.0279, test_f1: 0.4636
 epoch: 23, train_loss: 0.9952, test_loss: 0.9991, test_f1: 0.4867
 epoch: 24, train_loss: 0.9931, test_loss: 1.0215, test_f1: 0.4695
 epoch: 25, train_loss: 0.9899, test_loss: 1.0337, test_f1: 0.4638
 epoch: 26, train_loss: 0.9848, test_loss: 1.0071, test_f1: 0.4747
 epoch: 27, train_loss: 0.9883, test_loss: 1.0399, test_f1: 0.4637
 epoch: 28, train_loss: 0.9795, test_loss: 1.0328, test_f1: 0.4689
 epoch: 29, train_loss: 0.9723, test_loss: 1.0485, test_f1: 0.4632
 epoch: 30, train_loss: 0.9702, test_loss: 1.0245, test_f1: 0.4812
 epoch: 31, train_loss: 0.9568, test_loss: 1.0131, test_f1: 0.4801
 epoch: 32, train_loss: 0.9639, test_loss: 1.0610, test_f1: 0.4601
 epoch: 33, train_loss: 0.9620, test_loss: 1.0845, test_f1: 0.4713
 epoch: 34, train_loss: 0.9620, test_loss: 1.0626, test_f1: 0.4514
 epoch: 35, train_loss: 0.9493, test_loss: 1.0214, test_f1: 0.4859
 epoch: 36, train_loss: 0.9453, test_loss: 1.0190, test_f1: 0.4842
 epoch: 37, train_loss: 0.9394, test_loss: 1.0269, test_f1: 0.4824
 epoch: 38, train_loss: 0.9353, test_loss: 1.0320, test_f1: 0.4750
 epoch: 39, train_loss: 0.9298, test_loss: 1.0534, test_f1: 0.4705
 epoch: 40, train_loss: 0.9367, test_loss: 1.0456, test_f1: 0.4833
 epoch: 41, train_loss: 0.9183, test_loss: 1.0463, test_f1: 0.4853
 epoch: 42, train_loss: 0.9144, test_loss: 1.0964, test_f1: 0.4798
 epoch: 43, train_loss: 0.9290, test_loss: 1.0826, test_f1: 0.4777
 epoch: 44, train_loss: 0.9287, test_loss: 1.1193, test_f1: 0.4709
 epoch: 45, train_loss: 0.9249, test_loss: 1.0696, test_f1: 0.4817
 epoch: 46, train_loss: 0.9188, test_loss: 1.0819, test_f1: 0.4632
 epoch: 47, train_loss: 0.9086, test_loss: 1.0735, test_f1: 0.4619
 epoch: 48, train_loss: 0.9062, test_loss: 1.1033, test_f1: 0.4627
 epoch: 49, train_loss: 0.9057, test_loss: 1.0726, test_f1: 0.4970
 epoch: 50, train_loss: 0.8881, test_loss: 1.1299, test_f1: 0.4804
 epoch: 51, train_loss: 0.8908, test_loss: 1.0957, test_f1: 0.4793
 epoch: 52, train_loss: 0.8890, test_loss: 1.1114, test_f1: 0.4488
 epoch: 53, train_loss: 0.8813, test_loss: 1.0800, test_f1: 0.4815
 epoch: 54, train_loss: 0.8890, test_loss: 1.0729, test_f1: 0.4728
 epoch: 55, train_loss: 0.8757, test_loss: 1.1021, test_f1: 0.4723
 epoch: 56, train_loss: 0.8725, test_loss: 1.1387, test_f1: 0.4670
 epoch: 57, train_loss: 0.8646, test_loss: 1.1256, test_f1: 0.4580
 epoch: 58, train_loss: 0.8741, test_loss: 1.0903, test_f1: 0.4790
 epoch: 59, train_loss: 0.8687, test_loss: 1.1350, test_f1: 0.4889
 epoch: 60, train_loss: 0.8611, test_loss: 1.1128, test_f1: 0.4894
 epoch: 61, train_loss: 0.8655, test_loss: 1.0710, test_f1: 0.4982
 epoch: 62, train_loss: 0.8602, test_loss: 1.1065, test_f1: 0.4923
 epoch: 63, train_loss: 0.8586, test_loss: 1.1027, test_f1: 0.4936
 epoch: 64, train_loss: 0.8642, test_loss: 1.0984, test_f1: 0.4923
 epoch: 65, train_loss: 0.8619, test_loss: 1.0991, test_f1: 0.5011
 epoch: 66, train_loss: 0.8594, test_loss: 1.0758, test_f1: 0.4967
 epoch: 67, train_loss: 0.8535, test_loss: 1.1398, test_f1: 0.4773
 epoch: 68, train_loss: 0.8447, test_loss: 1.1184, test_f1: 0.4846
 epoch: 69, train_loss: 0.8579, test_loss: 1.0969, test_f1: 0.4908
 epoch: 70, train_loss: 0.8653, test_loss: 1.1381, test_f1: 0.4860
 epoch: 71, train_loss: 0.8610, test_loss: 1.0922, test_f1: 0.4937
 epoch: 72, train_loss: 0.8546, test_loss: 1.1153, test_f1: 0.4925
 epoch: 73, train_loss: 0.8508, test_loss: 1.1038, test_f1: 0.4917
 epoch: 74, train_loss: 0.8489, test_loss: 1.0931, test_f1: 0.5099
 epoch: 75, train_loss: 0.8416, test_loss: 1.1176, test_f1: 0.4982
 epoch: 76, train_loss: 0.8300, test_loss: 1.0961, test_f1: 0.4901
 epoch: 77, train_loss: 0.8500, test_loss: 1.1056, test_f1: 0.4886
 epoch: 78, train_loss: 0.8442, test_loss: 1.1140, test_f1: 0.5066
 epoch: 79, train_loss: 0.8471, test_loss: 1.1222, test_f1: 0.4966
 epoch: 80, train_loss: 0.8341, test_loss: 1.1196, test_f1: 0.5084
 epoch: 81, train_loss: 0.8419, test_loss: 1.1136, test_f1: 0.5090
 epoch: 82, train_loss: 0.8298, test_loss: 1.1557, test_f1: 0.4823
 epoch: 83, train_loss: 0.8421, test_loss: 1.1274, test_f1: 0.5131
 epoch: 84, train_loss: 0.8304, test_loss: 1.1586, test_f1: 0.5003
 epoch: 85, train_loss: 0.8362, test_loss: 1.1060, test_f1: 0.5028
 epoch: 86, train_loss: 0.8295, test_loss: 1.2274, test_f1: 0.4987
 epoch: 87, train_loss: 0.8347, test_loss: 1.0975, test_f1: 0.5106
 epoch: 88, train_loss: 0.8343, test_loss: 1.1544, test_f1: 0.5045
 epoch: 89, train_loss: 0.8280, test_loss: 1.0922, test_f1: 0.5060
 epoch: 90, train_loss: 0.8395, test_loss: 1.1168, test_f1: 0.5276
 epoch: 91, train_loss: 0.8274, test_loss: 1.2741, test_f1: 0.5011
 epoch: 92, train_loss: 0.8124, test_loss: 1.1172, test_f1: 0.5042
 epoch: 93, train_loss: 0.8166, test_loss: 1.1117, test_f1: 0.5067
 epoch: 94, train_loss: 0.8113, test_loss: 1.1902, test_f1: 0.5050
 epoch: 95, train_loss: 0.8171, test_loss: 1.1453, test_f1: 0.5080
 epoch: 96, train_loss: 0.8283, test_loss: 1.1330, test_f1: 0.4957
 epoch: 97, train_loss: 0.8189, test_loss: 1.1297, test_f1: 0.4843
 epoch: 98, train_loss: 0.8161, test_loss: 1.1291, test_f1: 0.4976
 epoch: 99, train_loss: 0.8058, test_loss: 1.1216, test_f1: 0.5087
##################ITERATION #2 ****************************************
 epoch: 0, train_loss: 1.3888, test_loss: 1.3183, test_f1: 0.2274
 epoch: 1, train_loss: 1.2886, test_loss: 1.2764, test_f1: 0.2274
 epoch: 2, train_loss: 1.2649, test_loss: 1.2500, test_f1: 0.2779
 epoch: 3, train_loss: 1.2540, test_loss: 1.2378, test_f1: 0.2555
 epoch: 4, train_loss: 1.2413, test_loss: 1.2267, test_f1: 0.2571
 epoch: 5, train_loss: 1.2378, test_loss: 1.2103, test_f1: 0.2668
 epoch: 6, train_loss: 1.2308, test_loss: 1.1913, test_f1: 0.3098
 epoch: 7, train_loss: 1.2087, test_loss: 1.1764, test_f1: 0.3512
 epoch: 8, train_loss: 1.2017, test_loss: 1.1691, test_f1: 0.3929
 epoch: 9, train_loss: 1.1943, test_loss: 1.1614, test_f1: 0.4118
 epoch: 10, train_loss: 1.1842, test_loss: 1.1551, test_f1: 0.3991
 epoch: 11, train_loss: 1.1711, test_loss: 1.1413, test_f1: 0.4200
 epoch: 12, train_loss: 1.1737, test_loss: 1.1358, test_f1: 0.3997
 epoch: 13, train_loss: 1.1574, test_loss: 1.1272, test_f1: 0.4084
 epoch: 14, train_loss: 1.1493, test_loss: 1.1106, test_f1: 0.4196
 epoch: 15, train_loss: 1.1416, test_loss: 1.1113, test_f1: 0.4199
 epoch: 16, train_loss: 1.1404, test_loss: 1.1097, test_f1: 0.4140
 epoch: 17, train_loss: 1.1396, test_loss: 1.1084, test_f1: 0.4222
 epoch: 18, train_loss: 1.1328, test_loss: 1.0918, test_f1: 0.4247
 epoch: 19, train_loss: 1.1237, test_loss: 1.0862, test_f1: 0.4249
 epoch: 20, train_loss: 1.1166, test_loss: 1.0780, test_f1: 0.4304
 epoch: 21, train_loss: 1.1070, test_loss: 1.0621, test_f1: 0.4429
 epoch: 22, train_loss: 1.1032, test_loss: 1.0626, test_f1: 0.4304
 epoch: 23, train_loss: 1.0940, test_loss: 1.0551, test_f1: 0.4463
 epoch: 24, train_loss: 1.1023, test_loss: 1.0583, test_f1: 0.4373
 epoch: 25, train_loss: 1.0885, test_loss: 1.0534, test_f1: 0.4468
 epoch: 26, train_loss: 1.0842, test_loss: 1.0580, test_f1: 0.4379
 epoch: 27, train_loss: 1.0825, test_loss: 1.0393, test_f1: 0.4645
 epoch: 28, train_loss: 1.0626, test_loss: 1.0503, test_f1: 0.4378
 epoch: 29, train_loss: 1.0641, test_loss: 1.0323, test_f1: 0.4626
 epoch: 30, train_loss: 1.0618, test_loss: 1.0297, test_f1: 0.4659
 epoch: 31, train_loss: 1.0543, test_loss: 1.0272, test_f1: 0.4487
 epoch: 32, train_loss: 1.0563, test_loss: 1.0322, test_f1: 0.4602
 epoch: 33, train_loss: 1.0584, test_loss: 1.0276, test_f1: 0.4655
 epoch: 34, train_loss: 1.0444, test_loss: 1.0028, test_f1: 0.4612
 epoch: 35, train_loss: 1.0324, test_loss: 1.0283, test_f1: 0.4515
 epoch: 36, train_loss: 1.0352, test_loss: 1.0154, test_f1: 0.4493
 epoch: 37, train_loss: 1.0341, test_loss: 0.9997, test_f1: 0.4661
 epoch: 38, train_loss: 1.0300, test_loss: 1.0064, test_f1: 0.4427
 epoch: 39, train_loss: 1.0220, test_loss: 0.9986, test_f1: 0.4707
 epoch: 40, train_loss: 1.0180, test_loss: 1.0232, test_f1: 0.4538
 epoch: 41, train_loss: 1.0220, test_loss: 1.0243, test_f1: 0.4561
 epoch: 42, train_loss: 1.0125, test_loss: 1.0545, test_f1: 0.4417
 epoch: 43, train_loss: 1.0121, test_loss: 0.9911, test_f1: 0.4570
 epoch: 44, train_loss: 1.0059, test_loss: 0.9944, test_f1: 0.4580
 epoch: 45, train_loss: 1.0052, test_loss: 0.9894, test_f1: 0.4656
 epoch: 46, train_loss: 1.0028, test_loss: 0.9897, test_f1: 0.4682
 epoch: 47, train_loss: 1.0051, test_loss: 1.0034, test_f1: 0.4805
 epoch: 48, train_loss: 0.9928, test_loss: 1.0133, test_f1: 0.4632
 epoch: 49, train_loss: 0.9954, test_loss: 1.0210, test_f1: 0.4475
 epoch: 50, train_loss: 0.9944, test_loss: 0.9765, test_f1: 0.4715
 epoch: 51, train_loss: 0.9902, test_loss: 0.9886, test_f1: 0.4633
 epoch: 52, train_loss: 0.9853, test_loss: 0.9859, test_f1: 0.4703
 epoch: 53, train_loss: 0.9611, test_loss: 0.9862, test_f1: 0.4812
 epoch: 54, train_loss: 0.9663, test_loss: 0.9716, test_f1: 0.4770
 epoch: 55, train_loss: 0.9707, test_loss: 0.9856, test_f1: 0.4813
 epoch: 56, train_loss: 0.9744, test_loss: 0.9807, test_f1: 0.4671
 epoch: 57, train_loss: 0.9626, test_loss: 0.9808, test_f1: 0.4862
 epoch: 58, train_loss: 0.9588, test_loss: 0.9817, test_f1: 0.4738
 epoch: 59, train_loss: 0.9672, test_loss: 0.9736, test_f1: 0.4734
 epoch: 60, train_loss: 0.9728, test_loss: 0.9720, test_f1: 0.4792
 epoch: 61, train_loss: 0.9562, test_loss: 0.9773, test_f1: 0.4752
 epoch: 62, train_loss: 0.9571, test_loss: 1.0106, test_f1: 0.4708
 epoch: 63, train_loss: 0.9652, test_loss: 0.9745, test_f1: 0.4803
 epoch: 64, train_loss: 0.9519, test_loss: 0.9779, test_f1: 0.4797
 epoch: 65, train_loss: 0.9495, test_loss: 0.9913, test_f1: 0.4769
 epoch: 66, train_loss: 0.9547, test_loss: 0.9728, test_f1: 0.4818
 epoch: 67, train_loss: 0.9560, test_loss: 0.9814, test_f1: 0.4781
 epoch: 68, train_loss: 0.9425, test_loss: 0.9804, test_f1: 0.4852
 epoch: 69, train_loss: 0.9436, test_loss: 0.9628, test_f1: 0.4896
 epoch: 70, train_loss: 0.9437, test_loss: 0.9794, test_f1: 0.4830
 epoch: 71, train_loss: 0.9479, test_loss: 0.9823, test_f1: 0.4877
 epoch: 72, train_loss: 0.9339, test_loss: 0.9864, test_f1: 0.4790
 epoch: 73, train_loss: 0.9417, test_loss: 0.9764, test_f1: 0.4799
 epoch: 74, train_loss: 0.9408, test_loss: 1.0058, test_f1: 0.4705
 epoch: 75, train_loss: 0.9256, test_loss: 0.9775, test_f1: 0.4842
 epoch: 76, train_loss: 0.9387, test_loss: 0.9805, test_f1: 0.4844
 epoch: 77, train_loss: 0.9425, test_loss: 0.9974, test_f1: 0.4746
 epoch: 78, train_loss: 0.9345, test_loss: 0.9764, test_f1: 0.4872
 epoch: 79, train_loss: 0.9292, test_loss: 0.9960, test_f1: 0.4732
 epoch: 80, train_loss: 0.9233, test_loss: 1.0128, test_f1: 0.4733
 epoch: 81, train_loss: 0.9322, test_loss: 1.0085, test_f1: 0.4702
 epoch: 82, train_loss: 0.9287, test_loss: 0.9878, test_f1: 0.4793
 epoch: 83, train_loss: 0.9137, test_loss: 1.0007, test_f1: 0.4798
 epoch: 84, train_loss: 0.9294, test_loss: 1.0404, test_f1: 0.4663
 epoch: 85, train_loss: 0.9300, test_loss: 0.9847, test_f1: 0.4734
 epoch: 86, train_loss: 0.9179, test_loss: 0.9988, test_f1: 0.4876
 epoch: 87, train_loss: 0.9170, test_loss: 1.0011, test_f1: 0.4682
 epoch: 88, train_loss: 0.9147, test_loss: 1.0074, test_f1: 0.4769
 epoch: 89, train_loss: 0.9258, test_loss: 1.0227, test_f1: 0.4775
 epoch: 90, train_loss: 0.9050, test_loss: 0.9923, test_f1: 0.4764
 epoch: 91, train_loss: 0.9166, test_loss: 1.0120, test_f1: 0.4736
 epoch: 92, train_loss: 0.9143, test_loss: 1.0195, test_f1: 0.4733
 epoch: 93, train_loss: 0.9080, test_loss: 1.0107, test_f1: 0.4837
 epoch: 94, train_loss: 0.9121, test_loss: 1.0031, test_f1: 0.4795
 epoch: 95, train_loss: 0.8998, test_loss: 1.0108, test_f1: 0.4815
 epoch: 96, train_loss: 0.9191, test_loss: 1.0066, test_f1: 0.4867
 epoch: 97, train_loss: 0.8977, test_loss: 1.0163, test_f1: 0.4753
 epoch: 98, train_loss: 0.9094, test_loss: 1.0228, test_f1: 0.4687
 epoch: 99, train_loss: 0.9102, test_loss: 1.0155, test_f1: 0.4845
##################ITERATION #3 ****************************************
 epoch: 0, train_loss: 1.3318, test_loss: 1.2874, test_f1: 0.2274
 epoch: 1, train_loss: 1.2688, test_loss: 1.2590, test_f1: 0.2397
 epoch: 2, train_loss: 1.2486, test_loss: 1.2229, test_f1: 0.2989
 epoch: 3, train_loss: 1.2382, test_loss: 1.2037, test_f1: 0.3139
 epoch: 4, train_loss: 1.2154, test_loss: 1.1899, test_f1: 0.3621
 epoch: 5, train_loss: 1.2131, test_loss: 1.1731, test_f1: 0.3744
 epoch: 6, train_loss: 1.1999, test_loss: 1.1546, test_f1: 0.4058
 epoch: 7, train_loss: 1.1901, test_loss: 1.1472, test_f1: 0.4130
 epoch: 8, train_loss: 1.1808, test_loss: 1.1223, test_f1: 0.4388
 epoch: 9, train_loss: 1.1661, test_loss: 1.1091, test_f1: 0.4375
 epoch: 10, train_loss: 1.1619, test_loss: 1.1003, test_f1: 0.4415
 epoch: 11, train_loss: 1.1576, test_loss: 1.0976, test_f1: 0.4412
 epoch: 12, train_loss: 1.1455, test_loss: 1.0790, test_f1: 0.4505
 epoch: 13, train_loss: 1.1431, test_loss: 1.0763, test_f1: 0.4440
 epoch: 14, train_loss: 1.1353, test_loss: 1.0685, test_f1: 0.4379
 epoch: 15, train_loss: 1.1270, test_loss: 1.0542, test_f1: 0.4567
 epoch: 16, train_loss: 1.1135, test_loss: 1.0563, test_f1: 0.4458
 epoch: 17, train_loss: 1.1064, test_loss: 1.0431, test_f1: 0.4421
 epoch: 18, train_loss: 1.1061, test_loss: 1.0379, test_f1: 0.4516
 epoch: 19, train_loss: 1.0959, test_loss: 1.0256, test_f1: 0.4536
 epoch: 20, train_loss: 1.0932, test_loss: 1.0218, test_f1: 0.4592
 epoch: 21, train_loss: 1.0848, test_loss: 1.0124, test_f1: 0.4662
 epoch: 22, train_loss: 1.0788, test_loss: 1.0006, test_f1: 0.4759
 epoch: 23, train_loss: 1.0757, test_loss: 1.0140, test_f1: 0.4586
 epoch: 24, train_loss: 1.0679, test_loss: 1.0135, test_f1: 0.4436
 epoch: 25, train_loss: 1.0640, test_loss: 1.0017, test_f1: 0.4707
 epoch: 26, train_loss: 1.0520, test_loss: 0.9985, test_f1: 0.4687
 epoch: 27, train_loss: 1.0522, test_loss: 0.9863, test_f1: 0.4575
 epoch: 28, train_loss: 1.0527, test_loss: 0.9805, test_f1: 0.4661
 epoch: 29, train_loss: 1.0506, test_loss: 0.9797, test_f1: 0.4756
 epoch: 30, train_loss: 1.0295, test_loss: 0.9693, test_f1: 0.4764
 epoch: 31, train_loss: 1.0311, test_loss: 0.9717, test_f1: 0.4706
 epoch: 32, train_loss: 1.0318, test_loss: 0.9745, test_f1: 0.4622
 epoch: 33, train_loss: 1.0191, test_loss: 0.9654, test_f1: 0.4640
 epoch: 34, train_loss: 1.0251, test_loss: 0.9736, test_f1: 0.4615
 epoch: 35, train_loss: 1.0253, test_loss: 0.9686, test_f1: 0.4694
 epoch: 36, train_loss: 1.0088, test_loss: 0.9840, test_f1: 0.4484
 epoch: 37, train_loss: 1.0126, test_loss: 0.9806, test_f1: 0.4594
 epoch: 38, train_loss: 1.0212, test_loss: 0.9615, test_f1: 0.4722
 epoch: 39, train_loss: 1.0215, test_loss: 0.9612, test_f1: 0.4597
 epoch: 40, train_loss: 1.0148, test_loss: 0.9693, test_f1: 0.4661
 epoch: 41, train_loss: 0.9977, test_loss: 0.9760, test_f1: 0.4632
 epoch: 42, train_loss: 1.0008, test_loss: 0.9629, test_f1: 0.4587
 epoch: 43, train_loss: 1.0033, test_loss: 0.9618, test_f1: 0.4649
 epoch: 44, train_loss: 0.9872, test_loss: 0.9585, test_f1: 0.4590
 epoch: 45, train_loss: 0.9847, test_loss: 0.9715, test_f1: 0.4615
 epoch: 46, train_loss: 0.9861, test_loss: 0.9581, test_f1: 0.4618
 epoch: 47, train_loss: 0.9922, test_loss: 0.9689, test_f1: 0.4621
 epoch: 48, train_loss: 0.9799, test_loss: 0.9709, test_f1: 0.4704
 epoch: 49, train_loss: 0.9772, test_loss: 0.9644, test_f1: 0.4637
 epoch: 50, train_loss: 0.9857, test_loss: 0.9637, test_f1: 0.4628
 epoch: 51, train_loss: 0.9765, test_loss: 0.9578, test_f1: 0.4714
 epoch: 52, train_loss: 0.9674, test_loss: 0.9626, test_f1: 0.4572
 epoch: 53, train_loss: 0.9705, test_loss: 0.9494, test_f1: 0.4732
 epoch: 54, train_loss: 0.9666, test_loss: 0.9519, test_f1: 0.4753
 epoch: 55, train_loss: 0.9646, test_loss: 0.9516, test_f1: 0.4717
 epoch: 56, train_loss: 0.9635, test_loss: 0.9586, test_f1: 0.4724
 epoch: 57, train_loss: 0.9506, test_loss: 0.9737, test_f1: 0.4585
 epoch: 58, train_loss: 0.9573, test_loss: 0.9579, test_f1: 0.4718
 epoch: 59, train_loss: 0.9605, test_loss: 0.9485, test_f1: 0.4756
 epoch: 60, train_loss: 0.9585, test_loss: 0.9511, test_f1: 0.4693
 epoch: 61, train_loss: 0.9521, test_loss: 0.9623, test_f1: 0.4717
 epoch: 62, train_loss: 0.9523, test_loss: 0.9653, test_f1: 0.4701
 epoch: 63, train_loss: 0.9439, test_loss: 0.9685, test_f1: 0.4737
 epoch: 64, train_loss: 0.9400, test_loss: 0.9489, test_f1: 0.4678
 epoch: 65, train_loss: 0.9564, test_loss: 0.9584, test_f1: 0.4668
 epoch: 66, train_loss: 0.9511, test_loss: 0.9563, test_f1: 0.4871
 epoch: 67, train_loss: 0.9502, test_loss: 0.9659, test_f1: 0.4719
 epoch: 68, train_loss: 0.9371, test_loss: 0.9610, test_f1: 0.4654
 epoch: 69, train_loss: 0.9494, test_loss: 0.9618, test_f1: 0.4802
 epoch: 70, train_loss: 0.9339, test_loss: 0.9611, test_f1: 0.4743
 epoch: 71, train_loss: 0.9458, test_loss: 0.9512, test_f1: 0.4759
 epoch: 72, train_loss: 0.9522, test_loss: 0.9585, test_f1: 0.4745
 epoch: 73, train_loss: 0.9320, test_loss: 0.9564, test_f1: 0.4776
 epoch: 74, train_loss: 0.9448, test_loss: 0.9566, test_f1: 0.4648
 epoch: 75, train_loss: 0.9301, test_loss: 0.9582, test_f1: 0.4723
 epoch: 76, train_loss: 0.9386, test_loss: 0.9661, test_f1: 0.4698
 epoch: 77, train_loss: 0.9277, test_loss: 0.9640, test_f1: 0.4819
 epoch: 78, train_loss: 0.9304, test_loss: 0.9638, test_f1: 0.4697
 epoch: 79, train_loss: 0.9280, test_loss: 0.9588, test_f1: 0.4724
 epoch: 80, train_loss: 0.9283, test_loss: 0.9478, test_f1: 0.4730
 epoch: 81, train_loss: 0.9217, test_loss: 0.9597, test_f1: 0.4812
 epoch: 82, train_loss: 0.9282, test_loss: 0.9630, test_f1: 0.4778
 epoch: 83, train_loss: 0.9206, test_loss: 0.9609, test_f1: 0.4885
 epoch: 84, train_loss: 0.9217, test_loss: 0.9515, test_f1: 0.4813
 epoch: 85, train_loss: 0.9262, test_loss: 0.9481, test_f1: 0.4821
 epoch: 86, train_loss: 0.9194, test_loss: 0.9563, test_f1: 0.4808
 epoch: 87, train_loss: 0.9264, test_loss: 0.9579, test_f1: 0.4910
 epoch: 88, train_loss: 0.9297, test_loss: 0.9538, test_f1: 0.4799
 epoch: 89, train_loss: 0.9217, test_loss: 0.9580, test_f1: 0.4722
 epoch: 90, train_loss: 0.9264, test_loss: 0.9629, test_f1: 0.4864
 epoch: 91, train_loss: 0.9152, test_loss: 0.9511, test_f1: 0.4887
 epoch: 92, train_loss: 0.9121, test_loss: 0.9458, test_f1: 0.4759
 epoch: 93, train_loss: 0.9080, test_loss: 0.9627, test_f1: 0.4763
 epoch: 94, train_loss: 0.9054, test_loss: 0.9389, test_f1: 0.4736
 epoch: 95, train_loss: 0.9102, test_loss: 0.9465, test_f1: 0.4800
 epoch: 96, train_loss: 0.9110, test_loss: 0.9429, test_f1: 0.4792
 epoch: 97, train_loss: 0.9144, test_loss: 0.9559, test_f1: 0.4780
 epoch: 98, train_loss: 0.9105, test_loss: 0.9465, test_f1: 0.4811
 epoch: 99, train_loss: 0.9010, test_loss: 0.9447, test_f1: 0.4932
##################ITERATION #4 ****************************************
 epoch: 0, train_loss: 1.3644, test_loss: 1.3036, test_f1: 0.2274
 epoch: 1, train_loss: 1.2630, test_loss: 1.2590, test_f1: 0.2264
 epoch: 2, train_loss: 1.2409, test_loss: 1.2254, test_f1: 0.2441
 epoch: 3, train_loss: 1.2412, test_loss: 1.2099, test_f1: 0.2940
 epoch: 4, train_loss: 1.2209, test_loss: 1.1974, test_f1: 0.2977
 epoch: 5, train_loss: 1.2199, test_loss: 1.1857, test_f1: 0.3494
 epoch: 6, train_loss: 1.2059, test_loss: 1.1810, test_f1: 0.3565
 epoch: 7, train_loss: 1.2003, test_loss: 1.1805, test_f1: 0.3664
 epoch: 8, train_loss: 1.1952, test_loss: 1.1644, test_f1: 0.3772
 epoch: 9, train_loss: 1.1843, test_loss: 1.1654, test_f1: 0.3860
 epoch: 10, train_loss: 1.1795, test_loss: 1.1513, test_f1: 0.3874
 epoch: 11, train_loss: 1.1696, test_loss: 1.1419, test_f1: 0.4000
 epoch: 12, train_loss: 1.1667, test_loss: 1.1422, test_f1: 0.3596
 epoch: 13, train_loss: 1.1554, test_loss: 1.1368, test_f1: 0.3865
 epoch: 14, train_loss: 1.1497, test_loss: 1.1393, test_f1: 0.4028
 epoch: 15, train_loss: 1.1451, test_loss: 1.1182, test_f1: 0.4075
 epoch: 16, train_loss: 1.1384, test_loss: 1.1077, test_f1: 0.4023
 epoch: 17, train_loss: 1.1212, test_loss: 1.1112, test_f1: 0.4107
 epoch: 18, train_loss: 1.1194, test_loss: 1.1176, test_f1: 0.4048
 epoch: 19, train_loss: 1.1275, test_loss: 1.0896, test_f1: 0.4086
 epoch: 20, train_loss: 1.1020, test_loss: 1.0929, test_f1: 0.4233
 epoch: 21, train_loss: 1.1146, test_loss: 1.1022, test_f1: 0.4060
 epoch: 22, train_loss: 1.1051, test_loss: 1.0813, test_f1: 0.4125
 epoch: 23, train_loss: 1.0888, test_loss: 1.0839, test_f1: 0.4104
 epoch: 24, train_loss: 1.0871, test_loss: 1.0666, test_f1: 0.4426
 epoch: 25, train_loss: 1.0816, test_loss: 1.0765, test_f1: 0.4277
 epoch: 26, train_loss: 1.0807, test_loss: 1.0728, test_f1: 0.4134
 epoch: 27, train_loss: 1.0896, test_loss: 1.0853, test_f1: 0.3983
 epoch: 28, train_loss: 1.0725, test_loss: 1.0656, test_f1: 0.4220
 epoch: 29, train_loss: 1.0649, test_loss: 1.0702, test_f1: 0.4453
 epoch: 30, train_loss: 1.0490, test_loss: 1.0578, test_f1: 0.4173
 epoch: 31, train_loss: 1.0576, test_loss: 1.0804, test_f1: 0.4030
 epoch: 32, train_loss: 1.0529, test_loss: 1.0613, test_f1: 0.4055
 epoch: 33, train_loss: 1.0429, test_loss: 1.0602, test_f1: 0.4256
 epoch: 34, train_loss: 1.0392, test_loss: 1.0746, test_f1: 0.4194
 epoch: 35, train_loss: 1.0411, test_loss: 1.0541, test_f1: 0.4228
 epoch: 36, train_loss: 1.0286, test_loss: 1.0531, test_f1: 0.4160
 epoch: 37, train_loss: 1.0305, test_loss: 1.0346, test_f1: 0.4208
 epoch: 38, train_loss: 1.0337, test_loss: 1.0613, test_f1: 0.4055
 epoch: 39, train_loss: 1.0258, test_loss: 1.0381, test_f1: 0.4255
 epoch: 40, train_loss: 1.0226, test_loss: 1.0353, test_f1: 0.4407
 epoch: 41, train_loss: 1.0146, test_loss: 1.0566, test_f1: 0.4313
 epoch: 42, train_loss: 1.0090, test_loss: 1.0459, test_f1: 0.4393
 epoch: 43, train_loss: 1.0080, test_loss: 1.0659, test_f1: 0.4314
 epoch: 44, train_loss: 1.0179, test_loss: 1.0493, test_f1: 0.4292
 epoch: 45, train_loss: 1.0050, test_loss: 1.0347, test_f1: 0.4610
 epoch: 46, train_loss: 1.0028, test_loss: 1.0540, test_f1: 0.4423
 epoch: 47, train_loss: 0.9932, test_loss: 1.0480, test_f1: 0.4438
 epoch: 48, train_loss: 0.9891, test_loss: 1.0533, test_f1: 0.4515
 epoch: 49, train_loss: 0.9978, test_loss: 1.0573, test_f1: 0.4341
 epoch: 50, train_loss: 0.9850, test_loss: 1.0355, test_f1: 0.4470
 epoch: 51, train_loss: 0.9848, test_loss: 1.0341, test_f1: 0.4502
 epoch: 52, train_loss: 0.9631, test_loss: 1.0373, test_f1: 0.4449
 epoch: 53, train_loss: 0.9712, test_loss: 1.0313, test_f1: 0.4480
 epoch: 54, train_loss: 0.9656, test_loss: 1.0230, test_f1: 0.4557
 epoch: 55, train_loss: 0.9601, test_loss: 1.0392, test_f1: 0.4498
 epoch: 56, train_loss: 0.9598, test_loss: 1.0443, test_f1: 0.4391
 epoch: 57, train_loss: 0.9540, test_loss: 1.0550, test_f1: 0.4365
 epoch: 58, train_loss: 0.9676, test_loss: 1.0601, test_f1: 0.4506
 epoch: 59, train_loss: 0.9547, test_loss: 1.0287, test_f1: 0.4442
 epoch: 60, train_loss: 0.9602, test_loss: 1.0405, test_f1: 0.4556
 epoch: 61, train_loss: 0.9660, test_loss: 1.0509, test_f1: 0.4494
 epoch: 62, train_loss: 0.9552, test_loss: 1.0422, test_f1: 0.4490
 epoch: 63, train_loss: 0.9515, test_loss: 1.0505, test_f1: 0.4491
 epoch: 64, train_loss: 0.9504, test_loss: 1.0516, test_f1: 0.4581
 epoch: 65, train_loss: 0.9517, test_loss: 1.0469, test_f1: 0.4428
 epoch: 66, train_loss: 0.9514, test_loss: 1.0672, test_f1: 0.4470
 epoch: 67, train_loss: 0.9420, test_loss: 1.0389, test_f1: 0.4459
 epoch: 68, train_loss: 0.9548, test_loss: 1.0569, test_f1: 0.4395
 epoch: 69, train_loss: 0.9439, test_loss: 1.0472, test_f1: 0.4581
 epoch: 70, train_loss: 0.9419, test_loss: 1.0505, test_f1: 0.4501
 epoch: 71, train_loss: 0.9467, test_loss: 1.0387, test_f1: 0.4600
 epoch: 72, train_loss: 0.9459, test_loss: 1.0398, test_f1: 0.4553
 epoch: 73, train_loss: 0.9369, test_loss: 1.0457, test_f1: 0.4548
 epoch: 74, train_loss: 0.9404, test_loss: 1.0325, test_f1: 0.4636
 epoch: 75, train_loss: 0.9382, test_loss: 1.0286, test_f1: 0.4559
 epoch: 76, train_loss: 0.9379, test_loss: 1.0499, test_f1: 0.4518
 epoch: 77, train_loss: 0.9310, test_loss: 1.0375, test_f1: 0.4549
 epoch: 78, train_loss: 0.9303, test_loss: 1.0444, test_f1: 0.4628
 epoch: 79, train_loss: 0.9381, test_loss: 1.0331, test_f1: 0.4569
 epoch: 80, train_loss: 0.9295, test_loss: 1.0346, test_f1: 0.4604
 epoch: 81, train_loss: 0.9280, test_loss: 1.0260, test_f1: 0.4566
 epoch: 82, train_loss: 0.9363, test_loss: 1.0428, test_f1: 0.4507
 epoch: 83, train_loss: 0.9270, test_loss: 1.0322, test_f1: 0.4571
 epoch: 84, train_loss: 0.9270, test_loss: 1.0491, test_f1: 0.4574
 epoch: 85, train_loss: 0.9214, test_loss: 1.0369, test_f1: 0.4589
 epoch: 86, train_loss: 0.9220, test_loss: 1.0264, test_f1: 0.4596
 epoch: 87, train_loss: 0.9190, test_loss: 1.0471, test_f1: 0.4477
 epoch: 88, train_loss: 0.9216, test_loss: 1.0436, test_f1: 0.4537
 epoch: 89, train_loss: 0.9229, test_loss: 1.0451, test_f1: 0.4669
 epoch: 90, train_loss: 0.9182, test_loss: 1.0594, test_f1: 0.4605
 epoch: 91, train_loss: 0.9106, test_loss: 1.0575, test_f1: 0.4486
 epoch: 92, train_loss: 0.9070, test_loss: 1.0446, test_f1: 0.4474
 epoch: 93, train_loss: 0.9042, test_loss: 1.0582, test_f1: 0.4655
 epoch: 94, train_loss: 0.9090, test_loss: 1.0390, test_f1: 0.4675
 epoch: 95, train_loss: 0.9143, test_loss: 1.0462, test_f1: 0.4477
 epoch: 96, train_loss: 0.9099, test_loss: 1.0473, test_f1: 0.4476
 epoch: 97, train_loss: 0.9025, test_loss: 1.0328, test_f1: 0.4614
 epoch: 98, train_loss: 0.8960, test_loss: 1.0663, test_f1: 0.4613
 epoch: 99, train_loss: 0.9028, test_loss: 1.0234, test_f1: 0.4611
##################ITERATION #5 ****************************************
 epoch: 0, train_loss: 1.3738, test_loss: 1.3209, test_f1: 0.2274
 epoch: 1, train_loss: 1.2610, test_loss: 1.2634, test_f1: 0.2470
 epoch: 2, train_loss: 1.2395, test_loss: 1.2225, test_f1: 0.3007
 epoch: 3, train_loss: 1.2253, test_loss: 1.1984, test_f1: 0.3293
 epoch: 4, train_loss: 1.2012, test_loss: 1.1794, test_f1: 0.3771
 epoch: 5, train_loss: 1.2050, test_loss: 1.1575, test_f1: 0.3785
 epoch: 6, train_loss: 1.1834, test_loss: 1.1388, test_f1: 0.4227
 epoch: 7, train_loss: 1.1815, test_loss: 1.1305, test_f1: 0.4126
 epoch: 8, train_loss: 1.1730, test_loss: 1.1194, test_f1: 0.4087
 epoch: 9, train_loss: 1.1630, test_loss: 1.0989, test_f1: 0.4326
 epoch: 10, train_loss: 1.1445, test_loss: 1.0879, test_f1: 0.4253
 epoch: 11, train_loss: 1.1479, test_loss: 1.0757, test_f1: 0.4282
 epoch: 12, train_loss: 1.1328, test_loss: 1.0785, test_f1: 0.4330
 epoch: 13, train_loss: 1.1257, test_loss: 1.0515, test_f1: 0.4425
 epoch: 14, train_loss: 1.1216, test_loss: 1.0522, test_f1: 0.4655
 epoch: 15, train_loss: 1.1141, test_loss: 1.0525, test_f1: 0.4607
 epoch: 16, train_loss: 1.1012, test_loss: 1.0270, test_f1: 0.4541
 epoch: 17, train_loss: 1.0960, test_loss: 1.0259, test_f1: 0.4693
 epoch: 18, train_loss: 1.0853, test_loss: 1.0085, test_f1: 0.4744
 epoch: 19, train_loss: 1.0735, test_loss: 1.0071, test_f1: 0.4621
 epoch: 20, train_loss: 1.0688, test_loss: 1.0040, test_f1: 0.4621
 epoch: 21, train_loss: 1.0629, test_loss: 0.9983, test_f1: 0.4715
 epoch: 22, train_loss: 1.0566, test_loss: 1.0081, test_f1: 0.4754
 epoch: 23, train_loss: 1.0389, test_loss: 0.9870, test_f1: 0.4734
 epoch: 24, train_loss: 1.0484, test_loss: 0.9862, test_f1: 0.4711
 epoch: 25, train_loss: 1.0297, test_loss: 0.9659, test_f1: 0.4860
 epoch: 26, train_loss: 1.0234, test_loss: 0.9844, test_f1: 0.4674
 epoch: 27, train_loss: 1.0333, test_loss: 0.9721, test_f1: 0.4822
 epoch: 28, train_loss: 1.0187, test_loss: 0.9834, test_f1: 0.5013
 epoch: 29, train_loss: 1.0060, test_loss: 0.9689, test_f1: 0.4786
 epoch: 30, train_loss: 1.0074, test_loss: 0.9753, test_f1: 0.4940
 epoch: 31, train_loss: 0.9937, test_loss: 0.9519, test_f1: 0.4990
 epoch: 32, train_loss: 0.9923, test_loss: 0.9683, test_f1: 0.4739
 epoch: 33, train_loss: 0.9966, test_loss: 0.9838, test_f1: 0.4678
 epoch: 34, train_loss: 0.9941, test_loss: 1.0112, test_f1: 0.4749
 epoch: 35, train_loss: 0.9923, test_loss: 0.9773, test_f1: 0.4725
 epoch: 36, train_loss: 0.9835, test_loss: 0.9683, test_f1: 0.4879
 epoch: 37, train_loss: 0.9741, test_loss: 0.9735, test_f1: 0.4794
 epoch: 38, train_loss: 0.9928, test_loss: 0.9870, test_f1: 0.4824
 epoch: 39, train_loss: 0.9693, test_loss: 1.0044, test_f1: 0.4883
 epoch: 40, train_loss: 0.9660, test_loss: 0.9390, test_f1: 0.4970
 epoch: 41, train_loss: 0.9612, test_loss: 0.9745, test_f1: 0.4797
 epoch: 42, train_loss: 0.9629, test_loss: 1.0231, test_f1: 0.4775
 epoch: 43, train_loss: 0.9686, test_loss: 1.0374, test_f1: 0.4767
 epoch: 44, train_loss: 0.9623, test_loss: 1.0407, test_f1: 0.4576
 epoch: 45, train_loss: 0.9607, test_loss: 0.9775, test_f1: 0.4861
 epoch: 46, train_loss: 0.9583, test_loss: 0.9769, test_f1: 0.4984
 epoch: 47, train_loss: 0.9556, test_loss: 0.9781, test_f1: 0.4783
 epoch: 48, train_loss: 0.9438, test_loss: 0.9678, test_f1: 0.5152
 epoch: 49, train_loss: 0.9382, test_loss: 0.9432, test_f1: 0.4781
 epoch: 50, train_loss: 0.9395, test_loss: 1.0201, test_f1: 0.4674
 epoch: 51, train_loss: 0.9209, test_loss: 0.9805, test_f1: 0.4778
 epoch: 52, train_loss: 0.9273, test_loss: 0.9936, test_f1: 0.4849
 epoch: 53, train_loss: 0.9288, test_loss: 0.9865, test_f1: 0.4913
 epoch: 54, train_loss: 0.9319, test_loss: 1.0112, test_f1: 0.4774
 epoch: 55, train_loss: 0.9225, test_loss: 0.9908, test_f1: 0.5079
 epoch: 56, train_loss: 0.9235, test_loss: 1.0036, test_f1: 0.4820
 epoch: 57, train_loss: 0.9223, test_loss: 0.9858, test_f1: 0.4885
 epoch: 58, train_loss: 0.9207, test_loss: 0.9954, test_f1: 0.4908
 epoch: 59, train_loss: 0.9165, test_loss: 0.9667, test_f1: 0.4935
 epoch: 60, train_loss: 0.9073, test_loss: 0.9813, test_f1: 0.4765
 epoch: 61, train_loss: 0.9188, test_loss: 0.9763, test_f1: 0.4718
 epoch: 62, train_loss: 0.9220, test_loss: 0.9892, test_f1: 0.4893
 epoch: 63, train_loss: 0.9053, test_loss: 0.9978, test_f1: 0.4834
 epoch: 64, train_loss: 0.9054, test_loss: 1.0002, test_f1: 0.4881
 epoch: 65, train_loss: 0.9143, test_loss: 0.9986, test_f1: 0.4878
 epoch: 66, train_loss: 0.8974, test_loss: 0.9945, test_f1: 0.4958
 epoch: 67, train_loss: 0.9040, test_loss: 0.9812, test_f1: 0.5018
 epoch: 68, train_loss: 0.9101, test_loss: 1.0040, test_f1: 0.4770
 epoch: 69, train_loss: 0.9003, test_loss: 0.9855, test_f1: 0.4907
 epoch: 70, train_loss: 0.9087, test_loss: 0.9588, test_f1: 0.4888
 epoch: 71, train_loss: 0.9094, test_loss: 0.9798, test_f1: 0.4965
 epoch: 72, train_loss: 0.9100, test_loss: 0.9920, test_f1: 0.5098
 epoch: 73, train_loss: 0.9067, test_loss: 0.9902, test_f1: 0.4911
 epoch: 74, train_loss: 0.8912, test_loss: 1.0008, test_f1: 0.4980
 epoch: 75, train_loss: 0.8844, test_loss: 1.0226, test_f1: 0.4670
 epoch: 76, train_loss: 0.8952, test_loss: 0.9984, test_f1: 0.4935
 epoch: 77, train_loss: 0.8952, test_loss: 1.0086, test_f1: 0.4772
 epoch: 78, train_loss: 0.8873, test_loss: 0.9928, test_f1: 0.4896
 epoch: 79, train_loss: 0.8916, test_loss: 1.0050, test_f1: 0.4809
 epoch: 80, train_loss: 0.8796, test_loss: 1.0135, test_f1: 0.5021
 epoch: 81, train_loss: 0.8930, test_loss: 1.0009, test_f1: 0.4783
 epoch: 82, train_loss: 0.8779, test_loss: 1.0108, test_f1: 0.5001
 epoch: 83, train_loss: 0.8889, test_loss: 1.0205, test_f1: 0.4777
 epoch: 84, train_loss: 0.8754, test_loss: 1.0095, test_f1: 0.4904
 epoch: 85, train_loss: 0.8802, test_loss: 1.0136, test_f1: 0.4772
 epoch: 86, train_loss: 0.8946, test_loss: 1.0417, test_f1: 0.4801
 epoch: 87, train_loss: 0.8891, test_loss: 1.0113, test_f1: 0.5043
 epoch: 88, train_loss: 0.8873, test_loss: 1.0159, test_f1: 0.4748
 epoch: 89, train_loss: 0.8699, test_loss: 1.0147, test_f1: 0.4883
 epoch: 90, train_loss: 0.8827, test_loss: 1.0466, test_f1: 0.4760
 epoch: 91, train_loss: 0.8737, test_loss: 1.0129, test_f1: 0.4878
 epoch: 92, train_loss: 0.8765, test_loss: 1.0234, test_f1: 0.4788
 epoch: 93, train_loss: 0.8689, test_loss: 1.0379, test_f1: 0.4796
 epoch: 94, train_loss: 0.8612, test_loss: 1.0329, test_f1: 0.4764
 epoch: 95, train_loss: 0.8785, test_loss: 1.0358, test_f1: 0.4779
 epoch: 96, train_loss: 0.8816, test_loss: 1.0462, test_f1: 0.4890
 epoch: 97, train_loss: 0.8723, test_loss: 1.0436, test_f1: 0.4876
 epoch: 98, train_loss: 0.8787, test_loss: 1.0517, test_f1: 0.4715
 epoch: 99, train_loss: 0.8702, test_loss: 1.0530, test_f1: 0.4767
##################ITERATION #6 ****************************************
 epoch: 0, train_loss: 1.3883, test_loss: 1.3129, test_f1: 0.2274
 epoch: 1, train_loss: 1.2950, test_loss: 1.2659, test_f1: 0.2847
 epoch: 2, train_loss: 1.2727, test_loss: 1.2465, test_f1: 0.3099
 epoch: 3, train_loss: 1.2511, test_loss: 1.2257, test_f1: 0.3448
 epoch: 4, train_loss: 1.2439, test_loss: 1.1979, test_f1: 0.3618
 epoch: 5, train_loss: 1.2321, test_loss: 1.1967, test_f1: 0.3844
 epoch: 6, train_loss: 1.2140, test_loss: 1.1828, test_f1: 0.3806
 epoch: 7, train_loss: 1.2181, test_loss: 1.1917, test_f1: 0.3754
 epoch: 8, train_loss: 1.2125, test_loss: 1.1754, test_f1: 0.4012
 epoch: 9, train_loss: 1.1983, test_loss: 1.1702, test_f1: 0.4224
 epoch: 10, train_loss: 1.2001, test_loss: 1.1618, test_f1: 0.4051
 epoch: 11, train_loss: 1.1879, test_loss: 1.1479, test_f1: 0.4159
 epoch: 12, train_loss: 1.1793, test_loss: 1.1394, test_f1: 0.4419
 epoch: 13, train_loss: 1.1745, test_loss: 1.1403, test_f1: 0.4060
 epoch: 14, train_loss: 1.1595, test_loss: 1.1161, test_f1: 0.4271
 epoch: 15, train_loss: 1.1542, test_loss: 1.1148, test_f1: 0.4457
 epoch: 16, train_loss: 1.1558, test_loss: 1.1037, test_f1: 0.4472
 epoch: 17, train_loss: 1.1488, test_loss: 1.1085, test_f1: 0.4299
 epoch: 18, train_loss: 1.1426, test_loss: 1.0890, test_f1: 0.4549
 epoch: 19, train_loss: 1.1281, test_loss: 1.0831, test_f1: 0.4408
 epoch: 20, train_loss: 1.1254, test_loss: 1.0722, test_f1: 0.4329
 epoch: 21, train_loss: 1.1103, test_loss: 1.0553, test_f1: 0.4468
 epoch: 22, train_loss: 1.1189, test_loss: 1.0776, test_f1: 0.4441
 epoch: 23, train_loss: 1.1031, test_loss: 1.0391, test_f1: 0.4513
 epoch: 24, train_loss: 1.0968, test_loss: 1.0524, test_f1: 0.4425
 epoch: 25, train_loss: 1.0981, test_loss: 1.0500, test_f1: 0.4510
 epoch: 26, train_loss: 1.0830, test_loss: 1.0296, test_f1: 0.4579
 epoch: 27, train_loss: 1.0685, test_loss: 1.0248, test_f1: 0.4499
 epoch: 28, train_loss: 1.0720, test_loss: 1.0162, test_f1: 0.4579
 epoch: 29, train_loss: 1.0624, test_loss: 1.0063, test_f1: 0.4618
 epoch: 30, train_loss: 1.0591, test_loss: 1.0084, test_f1: 0.4602
 epoch: 31, train_loss: 1.0541, test_loss: 1.0072, test_f1: 0.4903
 epoch: 32, train_loss: 1.0509, test_loss: 1.0164, test_f1: 0.4880
 epoch: 33, train_loss: 1.0498, test_loss: 0.9997, test_f1: 0.4668
 epoch: 34, train_loss: 1.0473, test_loss: 1.0150, test_f1: 0.4946
 epoch: 35, train_loss: 1.0313, test_loss: 0.9850, test_f1: 0.5038
 epoch: 36, train_loss: 1.0167, test_loss: 0.9951, test_f1: 0.4958
 epoch: 37, train_loss: 1.0257, test_loss: 0.9987, test_f1: 0.4600
 epoch: 38, train_loss: 1.0118, test_loss: 0.9867, test_f1: 0.4978
 epoch: 39, train_loss: 1.0137, test_loss: 0.9864, test_f1: 0.4723
 epoch: 40, train_loss: 1.0161, test_loss: 1.0058, test_f1: 0.4585
 epoch: 41, train_loss: 1.0077, test_loss: 0.9629, test_f1: 0.4833
 epoch: 42, train_loss: 0.9900, test_loss: 0.9509, test_f1: 0.4984
 epoch: 43, train_loss: 1.0046, test_loss: 1.0106, test_f1: 0.4640
 epoch: 44, train_loss: 0.9882, test_loss: 0.9495, test_f1: 0.4957
 epoch: 45, train_loss: 0.9885, test_loss: 0.9980, test_f1: 0.4763
 epoch: 46, train_loss: 0.9832, test_loss: 0.9868, test_f1: 0.4891
 epoch: 47, train_loss: 0.9914, test_loss: 0.9542, test_f1: 0.4962
 epoch: 48, train_loss: 0.9789, test_loss: 0.9754, test_f1: 0.4872
 epoch: 49, train_loss: 0.9826, test_loss: 0.9423, test_f1: 0.5086
 epoch: 50, train_loss: 0.9802, test_loss: 0.9492, test_f1: 0.4946
 epoch: 51, train_loss: 0.9643, test_loss: 0.9409, test_f1: 0.4942
 epoch: 52, train_loss: 0.9717, test_loss: 0.9569, test_f1: 0.4969
 epoch: 53, train_loss: 0.9610, test_loss: 0.9571, test_f1: 0.4911
 epoch: 54, train_loss: 0.9571, test_loss: 0.9370, test_f1: 0.4916
 epoch: 55, train_loss: 0.9618, test_loss: 0.9467, test_f1: 0.4983
 epoch: 56, train_loss: 0.9508, test_loss: 0.9609, test_f1: 0.4931
 epoch: 57, train_loss: 0.9579, test_loss: 0.9343, test_f1: 0.4805
 epoch: 58, train_loss: 0.9506, test_loss: 0.9421, test_f1: 0.5060
 epoch: 59, train_loss: 0.9477, test_loss: 0.9401, test_f1: 0.4915
 epoch: 60, train_loss: 0.9446, test_loss: 0.9402, test_f1: 0.4993
 epoch: 61, train_loss: 0.9503, test_loss: 0.9509, test_f1: 0.4789
 epoch: 62, train_loss: 0.9558, test_loss: 1.0335, test_f1: 0.4775
 epoch: 63, train_loss: 0.9464, test_loss: 0.9473, test_f1: 0.4816
 epoch: 64, train_loss: 0.9459, test_loss: 0.9509, test_f1: 0.4973
 epoch: 65, train_loss: 0.9409, test_loss: 0.9414, test_f1: 0.4989
 epoch: 66, train_loss: 0.9410, test_loss: 0.9435, test_f1: 0.5061
 epoch: 67, train_loss: 0.9476, test_loss: 0.9563, test_f1: 0.4858
 epoch: 68, train_loss: 0.9379, test_loss: 0.9451, test_f1: 0.4988
 epoch: 69, train_loss: 0.9422, test_loss: 0.9580, test_f1: 0.4890
 epoch: 70, train_loss: 0.9323, test_loss: 0.9693, test_f1: 0.4750
 epoch: 71, train_loss: 0.9289, test_loss: 0.9481, test_f1: 0.5158
 epoch: 72, train_loss: 0.9253, test_loss: 0.9729, test_f1: 0.4998
 epoch: 73, train_loss: 0.9429, test_loss: 0.9575, test_f1: 0.4931
 epoch: 74, train_loss: 0.9303, test_loss: 0.9574, test_f1: 0.4842
 epoch: 75, train_loss: 0.9311, test_loss: 0.9688, test_f1: 0.4870
 epoch: 76, train_loss: 0.9254, test_loss: 1.0431, test_f1: 0.4785
 epoch: 77, train_loss: 0.9232, test_loss: 0.9512, test_f1: 0.5050
 epoch: 78, train_loss: 0.9178, test_loss: 0.9616, test_f1: 0.4765
 epoch: 79, train_loss: 0.9199, test_loss: 0.9560, test_f1: 0.5150
 epoch: 80, train_loss: 0.9267, test_loss: 0.9633, test_f1: 0.4847
 epoch: 81, train_loss: 0.9183, test_loss: 0.9450, test_f1: 0.5006
 epoch: 82, train_loss: 0.9127, test_loss: 0.9638, test_f1: 0.4862
 epoch: 83, train_loss: 0.9172, test_loss: 0.9630, test_f1: 0.4988
 epoch: 84, train_loss: 0.9284, test_loss: 0.9603, test_f1: 0.4914
 epoch: 85, train_loss: 0.9215, test_loss: 0.9417, test_f1: 0.5121
 epoch: 86, train_loss: 0.9156, test_loss: 0.9844, test_f1: 0.4853
 epoch: 87, train_loss: 0.9213, test_loss: 0.9623, test_f1: 0.4748
 epoch: 88, train_loss: 0.9127, test_loss: 0.9545, test_f1: 0.4942
 epoch: 89, train_loss: 0.9061, test_loss: 0.9498, test_f1: 0.4955
 epoch: 90, train_loss: 0.9068, test_loss: 0.9669, test_f1: 0.4763
 epoch: 91, train_loss: 0.9200, test_loss: 0.9704, test_f1: 0.4687
 epoch: 92, train_loss: 0.9134, test_loss: 0.9614, test_f1: 0.5102
 epoch: 93, train_loss: 0.9082, test_loss: 0.9667, test_f1: 0.4858
 epoch: 94, train_loss: 0.9064, test_loss: 1.0162, test_f1: 0.4807
 epoch: 95, train_loss: 0.9101, test_loss: 1.0417, test_f1: 0.4703
 epoch: 96, train_loss: 0.9025, test_loss: 0.9798, test_f1: 0.4952
 epoch: 97, train_loss: 0.9013, test_loss: 0.9696, test_f1: 0.4880
 epoch: 98, train_loss: 0.9145, test_loss: 0.9585, test_f1: 0.4959
 epoch: 99, train_loss: 0.8999, test_loss: 0.9598, test_f1: 0.4774
##################ITERATION #7 ****************************************
 epoch: 0, train_loss: 1.3971, test_loss: 1.3219, test_f1: 0.2693
 epoch: 1, train_loss: 1.2714, test_loss: 1.2699, test_f1: 0.2426
 epoch: 2, train_loss: 1.2511, test_loss: 1.2200, test_f1: 0.2911
 epoch: 3, train_loss: 1.2463, test_loss: 1.2021, test_f1: 0.2881
 epoch: 4, train_loss: 1.2271, test_loss: 1.1898, test_f1: 0.3149
 epoch: 5, train_loss: 1.2276, test_loss: 1.1832, test_f1: 0.3336
 epoch: 6, train_loss: 1.2210, test_loss: 1.1713, test_f1: 0.3457
 epoch: 7, train_loss: 1.2099, test_loss: 1.1659, test_f1: 0.3561
 epoch: 8, train_loss: 1.2089, test_loss: 1.1492, test_f1: 0.4108
 epoch: 9, train_loss: 1.1913, test_loss: 1.1514, test_f1: 0.3934
 epoch: 10, train_loss: 1.1904, test_loss: 1.1373, test_f1: 0.3871
 epoch: 11, train_loss: 1.1730, test_loss: 1.1173, test_f1: 0.4156
 epoch: 12, train_loss: 1.1730, test_loss: 1.1041, test_f1: 0.4278
 epoch: 13, train_loss: 1.1540, test_loss: 1.1015, test_f1: 0.4245
 epoch: 14, train_loss: 1.1604, test_loss: 1.1054, test_f1: 0.4296
 epoch: 15, train_loss: 1.1446, test_loss: 1.0935, test_f1: 0.4276
 epoch: 16, train_loss: 1.1453, test_loss: 1.0817, test_f1: 0.4498
 epoch: 17, train_loss: 1.1323, test_loss: 1.0823, test_f1: 0.4391
 epoch: 18, train_loss: 1.1235, test_loss: 1.0635, test_f1: 0.4506
 epoch: 19, train_loss: 1.1313, test_loss: 1.0608, test_f1: 0.4491
 epoch: 20, train_loss: 1.1253, test_loss: 1.0667, test_f1: 0.4440
 epoch: 21, train_loss: 1.1170, test_loss: 1.0588, test_f1: 0.4428
 epoch: 22, train_loss: 1.1238, test_loss: 1.0532, test_f1: 0.4379
 epoch: 23, train_loss: 1.1122, test_loss: 1.0419, test_f1: 0.4567
 epoch: 24, train_loss: 1.1006, test_loss: 1.0487, test_f1: 0.4477
 epoch: 25, train_loss: 1.0946, test_loss: 1.0338, test_f1: 0.4683
 epoch: 26, train_loss: 1.0958, test_loss: 1.0268, test_f1: 0.4520
 epoch: 27, train_loss: 1.0795, test_loss: 1.0069, test_f1: 0.4678
 epoch: 28, train_loss: 1.0854, test_loss: 1.0021, test_f1: 0.4612
 epoch: 29, train_loss: 1.0861, test_loss: 1.0121, test_f1: 0.4682
 epoch: 30, train_loss: 1.0671, test_loss: 0.9960, test_f1: 0.4955
 epoch: 31, train_loss: 1.0738, test_loss: 0.9929, test_f1: 0.4669
 epoch: 32, train_loss: 1.0624, test_loss: 0.9936, test_f1: 0.4601
 epoch: 33, train_loss: 1.0518, test_loss: 0.9861, test_f1: 0.4864
 epoch: 34, train_loss: 1.0480, test_loss: 0.9765, test_f1: 0.4681
 epoch: 35, train_loss: 1.0557, test_loss: 0.9537, test_f1: 0.4773
 epoch: 36, train_loss: 1.0426, test_loss: 0.9870, test_f1: 0.4885
 epoch: 37, train_loss: 1.0364, test_loss: 0.9419, test_f1: 0.4852
 epoch: 38, train_loss: 1.0371, test_loss: 0.9625, test_f1: 0.4665
 epoch: 39, train_loss: 1.0268, test_loss: 0.9654, test_f1: 0.4623
 epoch: 40, train_loss: 1.0202, test_loss: 0.9299, test_f1: 0.4917
 epoch: 41, train_loss: 1.0118, test_loss: 0.9310, test_f1: 0.5086
 epoch: 42, train_loss: 1.0205, test_loss: 0.9286, test_f1: 0.4817
 epoch: 43, train_loss: 1.0081, test_loss: 0.9302, test_f1: 0.4927
 epoch: 44, train_loss: 0.9949, test_loss: 0.9317, test_f1: 0.5160
 epoch: 45, train_loss: 1.0057, test_loss: 0.9606, test_f1: 0.4894
 epoch: 46, train_loss: 0.9967, test_loss: 0.9236, test_f1: 0.5189
 epoch: 47, train_loss: 0.9870, test_loss: 0.9224, test_f1: 0.4988
 epoch: 48, train_loss: 0.9816, test_loss: 0.9099, test_f1: 0.5127
 epoch: 49, train_loss: 0.9781, test_loss: 0.9010, test_f1: 0.5019
 epoch: 50, train_loss: 0.9798, test_loss: 0.8945, test_f1: 0.5192
 epoch: 51, train_loss: 0.9862, test_loss: 0.8994, test_f1: 0.5107
 epoch: 52, train_loss: 0.9671, test_loss: 0.8904, test_f1: 0.5150
 epoch: 53, train_loss: 0.9718, test_loss: 0.9082, test_f1: 0.5037
 epoch: 54, train_loss: 0.9676, test_loss: 0.9016, test_f1: 0.4976
 epoch: 55, train_loss: 0.9661, test_loss: 0.8954, test_f1: 0.5131
 epoch: 56, train_loss: 0.9685, test_loss: 0.9094, test_f1: 0.4927
 epoch: 57, train_loss: 0.9514, test_loss: 0.8963, test_f1: 0.5222
 epoch: 58, train_loss: 0.9552, test_loss: 0.8913, test_f1: 0.5228
 epoch: 59, train_loss: 0.9566, test_loss: 0.8994, test_f1: 0.5054
 epoch: 60, train_loss: 0.9556, test_loss: 0.8797, test_f1: 0.5101
 epoch: 61, train_loss: 0.9580, test_loss: 0.8879, test_f1: 0.5180
 epoch: 62, train_loss: 0.9537, test_loss: 0.8935, test_f1: 0.5109
 epoch: 63, train_loss: 0.9627, test_loss: 0.8814, test_f1: 0.5288
 epoch: 64, train_loss: 0.9580, test_loss: 0.9017, test_f1: 0.5096
 epoch: 65, train_loss: 0.9606, test_loss: 0.8916, test_f1: 0.5322
 epoch: 66, train_loss: 0.9491, test_loss: 0.8891, test_f1: 0.5066
 epoch: 67, train_loss: 0.9398, test_loss: 0.8780, test_f1: 0.5113
 epoch: 68, train_loss: 0.9496, test_loss: 0.9025, test_f1: 0.5124
 epoch: 69, train_loss: 0.9447, test_loss: 0.8915, test_f1: 0.5217
 epoch: 70, train_loss: 0.9438, test_loss: 0.8998, test_f1: 0.4963
 epoch: 71, train_loss: 0.9435, test_loss: 0.8890, test_f1: 0.5218
 epoch: 72, train_loss: 0.9498, test_loss: 0.8826, test_f1: 0.5196
 epoch: 73, train_loss: 0.9382, test_loss: 0.8962, test_f1: 0.5114
 epoch: 74, train_loss: 0.9360, test_loss: 0.8914, test_f1: 0.5117
 epoch: 75, train_loss: 0.9283, test_loss: 0.8915, test_f1: 0.5145
 epoch: 76, train_loss: 0.9333, test_loss: 0.8895, test_f1: 0.5153
 epoch: 77, train_loss: 0.9365, test_loss: 0.8925, test_f1: 0.5235
 epoch: 78, train_loss: 0.9321, test_loss: 0.8992, test_f1: 0.5175
 epoch: 79, train_loss: 0.9386, test_loss: 0.8858, test_f1: 0.5088
 epoch: 80, train_loss: 0.9232, test_loss: 0.9085, test_f1: 0.5039
 epoch: 81, train_loss: 0.9170, test_loss: 0.8811, test_f1: 0.5100
 epoch: 82, train_loss: 0.9261, test_loss: 0.9087, test_f1: 0.5143
 epoch: 83, train_loss: 0.9318, test_loss: 0.9129, test_f1: 0.4935
 epoch: 84, train_loss: 0.9241, test_loss: 0.9248, test_f1: 0.4971
 epoch: 85, train_loss: 0.9328, test_loss: 0.9222, test_f1: 0.5061
 epoch: 86, train_loss: 0.9198, test_loss: 0.9023, test_f1: 0.5205
 epoch: 87, train_loss: 0.9256, test_loss: 0.8985, test_f1: 0.5040
 epoch: 88, train_loss: 0.9203, test_loss: 0.9075, test_f1: 0.5066
 epoch: 89, train_loss: 0.9261, test_loss: 0.8835, test_f1: 0.5295
 epoch: 90, train_loss: 0.9284, test_loss: 0.9007, test_f1: 0.5180
 epoch: 91, train_loss: 0.9282, test_loss: 0.8908, test_f1: 0.5213
 epoch: 92, train_loss: 0.9133, test_loss: 0.9154, test_f1: 0.5011
 epoch: 93, train_loss: 0.9103, test_loss: 0.9081, test_f1: 0.4980
 epoch: 94, train_loss: 0.9264, test_loss: 0.9008, test_f1: 0.5152
 epoch: 95, train_loss: 0.9158, test_loss: 0.8993, test_f1: 0.5213
 epoch: 96, train_loss: 0.9223, test_loss: 0.9388, test_f1: 0.5115
 epoch: 97, train_loss: 0.9216, test_loss: 0.9183, test_f1: 0.5077
 epoch: 98, train_loss: 0.9193, test_loss: 0.9082, test_f1: 0.5154
 epoch: 99, train_loss: 0.9157, test_loss: 0.9146, test_f1: 0.5170
##################ITERATION #8 ****************************************
 epoch: 0, train_loss: 1.7022, test_loss: 1.3669, test_f1: 0.2274
 epoch: 1, train_loss: 1.3797, test_loss: 1.2774, test_f1: 0.2715
 epoch: 2, train_loss: 1.3237, test_loss: 1.2479, test_f1: 0.3372
 epoch: 3, train_loss: 1.2936, test_loss: 1.2256, test_f1: 0.3602
 epoch: 4, train_loss: 1.2561, test_loss: 1.1947, test_f1: 0.3412
 epoch: 5, train_loss: 1.2435, test_loss: 1.1952, test_f1: 0.3426
 epoch: 6, train_loss: 1.2428, test_loss: 1.1638, test_f1: 0.3478
 epoch: 7, train_loss: 1.2133, test_loss: 1.1565, test_f1: 0.4077
 epoch: 8, train_loss: 1.1971, test_loss: 1.1432, test_f1: 0.3975
 epoch: 9, train_loss: 1.1998, test_loss: 1.1292, test_f1: 0.4297
 epoch: 10, train_loss: 1.1776, test_loss: 1.1192, test_f1: 0.4259
 epoch: 11, train_loss: 1.1731, test_loss: 1.0964, test_f1: 0.4377
 epoch: 12, train_loss: 1.1613, test_loss: 1.0897, test_f1: 0.4390
 epoch: 13, train_loss: 1.1487, test_loss: 1.0822, test_f1: 0.4361
 epoch: 14, train_loss: 1.1424, test_loss: 1.0659, test_f1: 0.4792
 epoch: 15, train_loss: 1.1280, test_loss: 1.0467, test_f1: 0.4745
 epoch: 16, train_loss: 1.1224, test_loss: 1.0505, test_f1: 0.4766
 epoch: 17, train_loss: 1.1155, test_loss: 1.0403, test_f1: 0.4685
 epoch: 18, train_loss: 1.1126, test_loss: 1.0378, test_f1: 0.4720
 epoch: 19, train_loss: 1.0986, test_loss: 1.0250, test_f1: 0.4785
 epoch: 20, train_loss: 1.0878, test_loss: 1.0032, test_f1: 0.4822
 epoch: 21, train_loss: 1.0727, test_loss: 0.9944, test_f1: 0.4826
 epoch: 22, train_loss: 1.0832, test_loss: 0.9954, test_f1: 0.4814
 epoch: 23, train_loss: 1.0689, test_loss: 0.9678, test_f1: 0.4977
 epoch: 24, train_loss: 1.0660, test_loss: 0.9601, test_f1: 0.5034
 epoch: 25, train_loss: 1.0483, test_loss: 0.9642, test_f1: 0.4780
 epoch: 26, train_loss: 1.0496, test_loss: 0.9723, test_f1: 0.4939
 epoch: 27, train_loss: 1.0468, test_loss: 0.9724, test_f1: 0.4958
 epoch: 28, train_loss: 1.0340, test_loss: 0.9423, test_f1: 0.4739
 epoch: 29, train_loss: 1.0345, test_loss: 0.9417, test_f1: 0.4979
 epoch: 30, train_loss: 1.0201, test_loss: 0.9310, test_f1: 0.4966
 epoch: 31, train_loss: 1.0176, test_loss: 0.9301, test_f1: 0.4967
 epoch: 32, train_loss: 1.0118, test_loss: 0.9300, test_f1: 0.4914
 epoch: 33, train_loss: 1.0050, test_loss: 0.9386, test_f1: 0.4791
 epoch: 34, train_loss: 1.0087, test_loss: 0.9094, test_f1: 0.4897
 epoch: 35, train_loss: 1.0013, test_loss: 0.9199, test_f1: 0.4873
 epoch: 36, train_loss: 0.9941, test_loss: 0.9073, test_f1: 0.4774
 epoch: 37, train_loss: 0.9960, test_loss: 0.9131, test_f1: 0.5015
 epoch: 38, train_loss: 0.9871, test_loss: 0.8969, test_f1: 0.4983
 epoch: 39, train_loss: 0.9896, test_loss: 0.8941, test_f1: 0.4981
 epoch: 40, train_loss: 0.9792, test_loss: 0.9041, test_f1: 0.4799
 epoch: 41, train_loss: 0.9768, test_loss: 0.8950, test_f1: 0.4798
 epoch: 42, train_loss: 0.9695, test_loss: 0.8955, test_f1: 0.4833
 epoch: 43, train_loss: 0.9808, test_loss: 0.9168, test_f1: 0.4839
 epoch: 44, train_loss: 0.9736, test_loss: 0.8907, test_f1: 0.4904
 epoch: 45, train_loss: 0.9689, test_loss: 0.8828, test_f1: 0.5014
 epoch: 46, train_loss: 0.9520, test_loss: 0.8983, test_f1: 0.4915
 epoch: 47, train_loss: 0.9641, test_loss: 0.8852, test_f1: 0.5002
 epoch: 48, train_loss: 0.9585, test_loss: 0.8814, test_f1: 0.4903
 epoch: 49, train_loss: 0.9578, test_loss: 0.8915, test_f1: 0.4879
 epoch: 50, train_loss: 0.9516, test_loss: 0.8978, test_f1: 0.4859
 epoch: 51, train_loss: 0.9512, test_loss: 0.8772, test_f1: 0.4984
 epoch: 52, train_loss: 0.9490, test_loss: 0.8736, test_f1: 0.5022
 epoch: 53, train_loss: 0.9426, test_loss: 0.8785, test_f1: 0.5125
 epoch: 54, train_loss: 0.9438, test_loss: 0.8806, test_f1: 0.5012
 epoch: 55, train_loss: 0.9416, test_loss: 0.8876, test_f1: 0.4989
 epoch: 56, train_loss: 0.9305, test_loss: 0.8814, test_f1: 0.5036
 epoch: 57, train_loss: 0.9302, test_loss: 0.8740, test_f1: 0.5190
 epoch: 58, train_loss: 0.9275, test_loss: 0.8753, test_f1: 0.5112
 epoch: 59, train_loss: 0.9333, test_loss: 0.8854, test_f1: 0.4937
 epoch: 60, train_loss: 0.9263, test_loss: 0.8900, test_f1: 0.5029
 epoch: 61, train_loss: 0.9303, test_loss: 0.8834, test_f1: 0.5044
 epoch: 62, train_loss: 0.9259, test_loss: 0.8991, test_f1: 0.4881
 epoch: 63, train_loss: 0.9314, test_loss: 0.8890, test_f1: 0.4918
 epoch: 64, train_loss: 0.9349, test_loss: 0.8940, test_f1: 0.4945
 epoch: 65, train_loss: 0.9233, test_loss: 0.8930, test_f1: 0.4958
 epoch: 66, train_loss: 0.9188, test_loss: 0.8866, test_f1: 0.4934
 epoch: 67, train_loss: 0.9249, test_loss: 0.8977, test_f1: 0.4997
 epoch: 68, train_loss: 0.9204, test_loss: 0.8908, test_f1: 0.4891
 epoch: 69, train_loss: 0.9193, test_loss: 0.8973, test_f1: 0.4905
 epoch: 70, train_loss: 0.9218, test_loss: 0.8953, test_f1: 0.5066
 epoch: 71, train_loss: 0.9167, test_loss: 0.9057, test_f1: 0.4936
 epoch: 72, train_loss: 0.9177, test_loss: 0.9022, test_f1: 0.4899
 epoch: 73, train_loss: 0.9166, test_loss: 0.9124, test_f1: 0.4777
 epoch: 74, train_loss: 0.9129, test_loss: 0.8901, test_f1: 0.5005
 epoch: 75, train_loss: 0.9149, test_loss: 0.8986, test_f1: 0.5013
 epoch: 76, train_loss: 0.9143, test_loss: 0.9043, test_f1: 0.4988
 epoch: 77, train_loss: 0.9213, test_loss: 0.8930, test_f1: 0.5080
 epoch: 78, train_loss: 0.9164, test_loss: 0.9082, test_f1: 0.4975
 epoch: 79, train_loss: 0.9114, test_loss: 0.9055, test_f1: 0.4932
 epoch: 80, train_loss: 0.9129, test_loss: 0.9154, test_f1: 0.4809
 epoch: 81, train_loss: 0.9098, test_loss: 0.9139, test_f1: 0.4821
 epoch: 82, train_loss: 0.9007, test_loss: 0.9109, test_f1: 0.4967
 epoch: 83, train_loss: 0.9153, test_loss: 0.9340, test_f1: 0.4955
 epoch: 84, train_loss: 0.8987, test_loss: 0.9107, test_f1: 0.4945
 epoch: 85, train_loss: 0.9037, test_loss: 0.9046, test_f1: 0.4980
 epoch: 86, train_loss: 0.9018, test_loss: 0.9252, test_f1: 0.4833
 epoch: 87, train_loss: 0.9118, test_loss: 0.9023, test_f1: 0.4951
 epoch: 88, train_loss: 0.9099, test_loss: 0.9033, test_f1: 0.5088
 epoch: 89, train_loss: 0.9040, test_loss: 0.9029, test_f1: 0.4970
 epoch: 90, train_loss: 0.9022, test_loss: 0.8920, test_f1: 0.4967
 epoch: 91, train_loss: 0.9045, test_loss: 0.9250, test_f1: 0.4929
 epoch: 92, train_loss: 0.9047, test_loss: 0.8988, test_f1: 0.4984
 epoch: 93, train_loss: 0.8991, test_loss: 0.9076, test_f1: 0.4929
 epoch: 94, train_loss: 0.9020, test_loss: 0.9116, test_f1: 0.4834
 epoch: 95, train_loss: 0.8890, test_loss: 0.9284, test_f1: 0.4911
 epoch: 96, train_loss: 0.9057, test_loss: 0.8959, test_f1: 0.5144
 epoch: 97, train_loss: 0.9019, test_loss: 0.9187, test_f1: 0.4929
 epoch: 98, train_loss: 0.8857, test_loss: 0.9212, test_f1: 0.4926
 epoch: 99, train_loss: 0.8987, test_loss: 0.9062, test_f1: 0.4998
##################ITERATION #9 ****************************************
 epoch: 0, train_loss: 1.5700, test_loss: 1.3221, test_f1: 0.2290
 epoch: 1, train_loss: 1.3244, test_loss: 1.2479, test_f1: 0.2873
 epoch: 2, train_loss: 1.2753, test_loss: 1.2039, test_f1: 0.3153
 epoch: 3, train_loss: 1.2568, test_loss: 1.1878, test_f1: 0.3653
 epoch: 4, train_loss: 1.2312, test_loss: 1.1667, test_f1: 0.3591
 epoch: 5, train_loss: 1.2184, test_loss: 1.1612, test_f1: 0.3733
 epoch: 6, train_loss: 1.2070, test_loss: 1.1425, test_f1: 0.4063
 epoch: 7, train_loss: 1.2002, test_loss: 1.1403, test_f1: 0.4038
 epoch: 8, train_loss: 1.1928, test_loss: 1.1276, test_f1: 0.3982
 epoch: 9, train_loss: 1.1747, test_loss: 1.1196, test_f1: 0.4270
 epoch: 10, train_loss: 1.1736, test_loss: 1.0949, test_f1: 0.4266
 epoch: 11, train_loss: 1.1504, test_loss: 1.0993, test_f1: 0.4120
 epoch: 12, train_loss: 1.1479, test_loss: 1.0771, test_f1: 0.4399
 epoch: 13, train_loss: 1.1379, test_loss: 1.0720, test_f1: 0.4385
 epoch: 14, train_loss: 1.1306, test_loss: 1.0588, test_f1: 0.4459
 epoch: 15, train_loss: 1.1140, test_loss: 1.0589, test_f1: 0.4298
 epoch: 16, train_loss: 1.1078, test_loss: 1.0117, test_f1: 0.4616
 epoch: 17, train_loss: 1.0859, test_loss: 0.9916, test_f1: 0.4554
 epoch: 18, train_loss: 1.0743, test_loss: 0.9748, test_f1: 0.4696
 epoch: 19, train_loss: 1.0526, test_loss: 0.9702, test_f1: 0.4642
 epoch: 20, train_loss: 1.0585, test_loss: 0.9589, test_f1: 0.4804
 epoch: 21, train_loss: 1.0383, test_loss: 0.9525, test_f1: 0.4932
 epoch: 22, train_loss: 1.0413, test_loss: 0.9748, test_f1: 0.4704
 epoch: 23, train_loss: 1.0262, test_loss: 0.9647, test_f1: 0.4898
 epoch: 24, train_loss: 1.0272, test_loss: 0.9619, test_f1: 0.4812
 epoch: 25, train_loss: 1.0159, test_loss: 0.9514, test_f1: 0.4775
 epoch: 26, train_loss: 1.0185, test_loss: 0.9561, test_f1: 0.4974
 epoch: 27, train_loss: 1.0181, test_loss: 0.9726, test_f1: 0.4632
 epoch: 28, train_loss: 1.0096, test_loss: 0.9667, test_f1: 0.4911
 epoch: 29, train_loss: 1.0011, test_loss: 0.9755, test_f1: 0.4728
 epoch: 30, train_loss: 1.0000, test_loss: 0.9396, test_f1: 0.4794
 epoch: 31, train_loss: 0.9893, test_loss: 0.9878, test_f1: 0.4539
 epoch: 32, train_loss: 0.9864, test_loss: 0.9358, test_f1: 0.4953
 epoch: 33, train_loss: 0.9820, test_loss: 0.9853, test_f1: 0.4694
 epoch: 34, train_loss: 0.9752, test_loss: 0.9682, test_f1: 0.4819
 epoch: 35, train_loss: 0.9821, test_loss: 0.9133, test_f1: 0.4980
 epoch: 36, train_loss: 0.9701, test_loss: 0.9715, test_f1: 0.4704
 epoch: 37, train_loss: 0.9598, test_loss: 0.9538, test_f1: 0.4853
 epoch: 38, train_loss: 0.9698, test_loss: 0.9463, test_f1: 0.4868
 epoch: 39, train_loss: 0.9585, test_loss: 0.9622, test_f1: 0.4801
 epoch: 40, train_loss: 0.9564, test_loss: 0.9725, test_f1: 0.4923
 epoch: 41, train_loss: 0.9588, test_loss: 0.9527, test_f1: 0.4825
 epoch: 42, train_loss: 0.9534, test_loss: 0.9685, test_f1: 0.4690
 epoch: 43, train_loss: 0.9539, test_loss: 0.9886, test_f1: 0.4725
 epoch: 44, train_loss: 0.9396, test_loss: 0.9609, test_f1: 0.4899
 epoch: 45, train_loss: 0.9491, test_loss: 0.9539, test_f1: 0.4895
 epoch: 46, train_loss: 0.9447, test_loss: 0.9323, test_f1: 0.4937
 epoch: 47, train_loss: 0.9446, test_loss: 0.9641, test_f1: 0.4806
 epoch: 48, train_loss: 0.9339, test_loss: 0.9911, test_f1: 0.4695
 epoch: 49, train_loss: 0.9246, test_loss: 1.0033, test_f1: 0.4838
 epoch: 50, train_loss: 0.9393, test_loss: 0.9740, test_f1: 0.4747
 epoch: 51, train_loss: 0.9258, test_loss: 0.9722, test_f1: 0.4862
 epoch: 52, train_loss: 0.9263, test_loss: 0.9630, test_f1: 0.4962
 epoch: 53, train_loss: 0.9225, test_loss: 0.9650, test_f1: 0.4981
 epoch: 54, train_loss: 0.9295, test_loss: 0.9776, test_f1: 0.4962
 epoch: 55, train_loss: 0.9147, test_loss: 1.0016, test_f1: 0.4885
 epoch: 56, train_loss: 0.9155, test_loss: 0.9881, test_f1: 0.4894
 epoch: 57, train_loss: 0.9185, test_loss: 0.9924, test_f1: 0.4756
 epoch: 58, train_loss: 0.9264, test_loss: 0.9824, test_f1: 0.4808
 epoch: 59, train_loss: 0.9284, test_loss: 0.9696, test_f1: 0.4997
 epoch: 60, train_loss: 0.9168, test_loss: 0.9715, test_f1: 0.4966
 epoch: 61, train_loss: 0.9182, test_loss: 0.9833, test_f1: 0.4945
 epoch: 62, train_loss: 0.9143, test_loss: 0.9568, test_f1: 0.4940
 epoch: 63, train_loss: 0.9125, test_loss: 0.9884, test_f1: 0.5012
 epoch: 64, train_loss: 0.9184, test_loss: 0.9837, test_f1: 0.4952
 epoch: 65, train_loss: 0.9034, test_loss: 0.9927, test_f1: 0.4856
 epoch: 66, train_loss: 0.9127, test_loss: 0.9825, test_f1: 0.4975
 epoch: 67, train_loss: 0.9216, test_loss: 0.9857, test_f1: 0.4877
 epoch: 68, train_loss: 0.9088, test_loss: 0.9829, test_f1: 0.4920
 epoch: 69, train_loss: 0.9006, test_loss: 0.9740, test_f1: 0.4935
 epoch: 70, train_loss: 0.9054, test_loss: 0.9849, test_f1: 0.4918
 epoch: 71, train_loss: 0.9033, test_loss: 0.9769, test_f1: 0.5011
 epoch: 72, train_loss: 0.9086, test_loss: 0.9887, test_f1: 0.4863
 epoch: 73, train_loss: 0.9041, test_loss: 0.9789, test_f1: 0.5039
 epoch: 74, train_loss: 0.9031, test_loss: 0.9753, test_f1: 0.4995
 epoch: 75, train_loss: 0.8945, test_loss: 0.9701, test_f1: 0.4968
 epoch: 76, train_loss: 0.9098, test_loss: 1.0041, test_f1: 0.4924
 epoch: 77, train_loss: 0.8985, test_loss: 0.9887, test_f1: 0.4940
 epoch: 78, train_loss: 0.9033, test_loss: 0.9862, test_f1: 0.4937
 epoch: 79, train_loss: 0.8927, test_loss: 0.9784, test_f1: 0.5031
 epoch: 80, train_loss: 0.9080, test_loss: 0.9978, test_f1: 0.4810
 epoch: 81, train_loss: 0.9003, test_loss: 1.0022, test_f1: 0.4953
 epoch: 82, train_loss: 0.8943, test_loss: 0.9850, test_f1: 0.4861
 epoch: 83, train_loss: 0.8977, test_loss: 0.9884, test_f1: 0.4992
 epoch: 84, train_loss: 0.8888, test_loss: 1.0008, test_f1: 0.4965
 epoch: 85, train_loss: 0.9017, test_loss: 1.0285, test_f1: 0.4781
 epoch: 86, train_loss: 0.8847, test_loss: 1.0107, test_f1: 0.4880
 epoch: 87, train_loss: 0.8877, test_loss: 1.0020, test_f1: 0.4922
 epoch: 88, train_loss: 0.8972, test_loss: 0.9993, test_f1: 0.4961
 epoch: 89, train_loss: 0.8965, test_loss: 0.9976, test_f1: 0.4850
 epoch: 90, train_loss: 0.8908, test_loss: 1.0037, test_f1: 0.4857
 epoch: 91, train_loss: 0.8994, test_loss: 0.9850, test_f1: 0.4947
 epoch: 92, train_loss: 0.8930, test_loss: 0.9883, test_f1: 0.4872
 epoch: 93, train_loss: 0.8890, test_loss: 0.9928, test_f1: 0.4895
 epoch: 94, train_loss: 0.8794, test_loss: 0.9805, test_f1: 0.4955
 epoch: 95, train_loss: 0.8793, test_loss: 0.9975, test_f1: 0.4987
 epoch: 96, train_loss: 0.8849, test_loss: 1.0232, test_f1: 0.4888
 epoch: 97, train_loss: 0.8958, test_loss: 0.9932, test_f1: 0.4879
 epoch: 98, train_loss: 0.8871, test_loss: 1.0069, test_f1: 0.4908
 epoch: 99, train_loss: 0.8837, test_loss: 0.9918, test_f1: 0.4910

Training completed in 479.11 seconds
Best F1: 0.5322 at epoch 65
Mean F1 across iterations: 0.5062  0.0186
========================FINAL RESULTS================================
FEGIN weighted F1: 0.5322  0.0186
python main.py --data ltspice_examples --representation component_component --model FEGIN --layers 4 --hiddens 16 --batch_size 128 --lr 0.001 --emb_size 128 --epochs 100 --save_appendix component_component_L4_H16_BS128_LR0.001_E128 --no_val
-----



STDERR:
  File "main.py", line 370, in <module>
    main()
  File "main.py", line 254, in main
    dataset = dataset_class(
  File "/home/philip/projects/ltspice_examples_code_repo/Circuit-Completion-Using-GNNs/component_classification_with_link_prediction_head/evaluation/FEGIN/kernel/circuit_datasets.py", line 15, in __init__
    self.data, self.slices = torch.load(self.processed_paths[0])
  File "/home/philip/.local/lib/python3.8/site-packages/torch/serialization.py", line 1040, in load
    warnings.warn(
  File "/usr/lib/python3.8/warnings.py", line 109, in _showwarnmsg
    sw(msg.message, msg.category, msg.filename, msg.lineno,
  File "main.py", line 47, in warn_with_traceback
    traceback.print_stack(file=log)
/home/philip/projects/ltspice_examples_code_repo/Circuit-Completion-Using-GNNs/component_classification_with_link_prediction_head/evaluation/FEGIN/kernel/circuit_datasets.py:15: FutureWarning: You are using `torch.load` with `weights_only=False` (the current default value), which uses the default pickle module implicitly. It is possible to construct malicious pickle data which will execute arbitrary code during unpickling (See https://github.com/pytorch/pytorch/blob/main/SECURITY.md#untrusted-models for more details). In a future release, the default value for `weights_only` will be flipped to `True`. This limits the functions that could be executed during unpickling. Arbitrary objects will no longer be allowed to be loaded via this mode unless they are explicitly allowlisted by the user via `torch.serialization.add_safe_globals`. We recommend you start setting `weights_only=True` for any use case where you don't have full control of the loaded file. Please open an issue on GitHub for any issues related to this experimental feature.
  self.data, self.slices = torch.load(self.processed_paths[0])
