STDOUT:
Results will be saved in /home/philip/projects/ltspice_examples_code_repo/Circuit-Completion-Using-GNNs/component_classification_with_link_prediction_head/evaluation/FEGIN/results/model_FEGIN_dataset_ltspice_demos
Command line input: python main.py --data ltspice_demos --representation component_component --model FEGIN --layers 2 --hiddens 64 --batch_size 128 --lr 0.001 --emb_size 250 --epochs 100 --save_appendix component_component_L2_H64_BS128_LR0.001_E250 --no_val
 is saved.
-----
ltspice_demos - FEGIN
Using 2 layers, 64 hidden units, h = 2
Loading component_component representation dataset
ENTERED
Training FEGIN on component_component representation
Train: 1565, Test: 383
##################ITERATION #0 ****************************************
 epoch: 0, train_loss: 1.3633, test_loss: 1.3471, test_f1: 0.2281
 epoch: 1, train_loss: 1.2465, test_loss: 1.2924, test_f1: 0.2674
 epoch: 2, train_loss: 1.1965, test_loss: 1.2832, test_f1: 0.2706
 epoch: 3, train_loss: 1.1580, test_loss: 1.2544, test_f1: 0.2835
 epoch: 4, train_loss: 1.1333, test_loss: 1.2299, test_f1: 0.3893
 epoch: 5, train_loss: 1.0967, test_loss: 1.1928, test_f1: 0.4085
 epoch: 6, train_loss: 1.0622, test_loss: 1.1786, test_f1: 0.4212
 epoch: 7, train_loss: 1.0240, test_loss: 1.1980, test_f1: 0.4553
 epoch: 8, train_loss: 1.0058, test_loss: 1.2606, test_f1: 0.4368
 epoch: 9, train_loss: 0.9791, test_loss: 1.2174, test_f1: 0.4726
 epoch: 10, train_loss: 0.9481, test_loss: 1.1876, test_f1: 0.4912
 epoch: 11, train_loss: 0.9289, test_loss: 1.1743, test_f1: 0.5268
 epoch: 12, train_loss: 0.9084, test_loss: 1.2598, test_f1: 0.4698
 epoch: 13, train_loss: 0.9022, test_loss: 1.1701, test_f1: 0.5152
 epoch: 14, train_loss: 0.8630, test_loss: 1.2788, test_f1: 0.4837
 epoch: 15, train_loss: 0.8619, test_loss: 1.2687, test_f1: 0.5543
 epoch: 16, train_loss: 0.8512, test_loss: 1.2672, test_f1: 0.4996
 epoch: 17, train_loss: 0.8492, test_loss: 1.3781, test_f1: 0.5200
 epoch: 18, train_loss: 0.8169, test_loss: 1.2607, test_f1: 0.4866
 epoch: 19, train_loss: 0.7724, test_loss: 1.2314, test_f1: 0.5559
 epoch: 20, train_loss: 0.7420, test_loss: 1.2148, test_f1: 0.5626
 epoch: 21, train_loss: 0.7593, test_loss: 1.3143, test_f1: 0.5095
 epoch: 22, train_loss: 0.7319, test_loss: 1.3592, test_f1: 0.5235
 epoch: 23, train_loss: 0.7042, test_loss: 1.2955, test_f1: 0.5720
 epoch: 24, train_loss: 0.6946, test_loss: 1.3381, test_f1: 0.5687
 epoch: 25, train_loss: 0.6869, test_loss: 1.3126, test_f1: 0.5169
 epoch: 26, train_loss: 0.6487, test_loss: 1.3528, test_f1: 0.5713
 epoch: 27, train_loss: 0.6491, test_loss: 1.5295, test_f1: 0.5722
 epoch: 28, train_loss: 0.6305, test_loss: 1.4020, test_f1: 0.5270
 epoch: 29, train_loss: 0.6159, test_loss: 1.5064, test_f1: 0.4971
 epoch: 30, train_loss: 0.6009, test_loss: 1.5010, test_f1: 0.5527
 epoch: 31, train_loss: 0.5897, test_loss: 1.4864, test_f1: 0.5329
 epoch: 32, train_loss: 0.5867, test_loss: 1.6453, test_f1: 0.5625
 epoch: 33, train_loss: 0.5817, test_loss: 1.5343, test_f1: 0.5356
 epoch: 34, train_loss: 0.5761, test_loss: 1.4580, test_f1: 0.6160
 epoch: 35, train_loss: 0.5798, test_loss: 1.8253, test_f1: 0.5331
 epoch: 36, train_loss: 0.5483, test_loss: 1.6113, test_f1: 0.5393
 epoch: 37, train_loss: 0.5352, test_loss: 1.5343, test_f1: 0.5600
 epoch: 38, train_loss: 0.5316, test_loss: 1.7478, test_f1: 0.5450
 epoch: 39, train_loss: 0.5396, test_loss: 1.6562, test_f1: 0.5239
 epoch: 40, train_loss: 0.5935, test_loss: 1.8255, test_f1: 0.5346
 epoch: 41, train_loss: 0.5107, test_loss: 1.7482, test_f1: 0.5014
 epoch: 42, train_loss: 0.5263, test_loss: 1.6667, test_f1: 0.5327
 epoch: 43, train_loss: 0.5258, test_loss: 1.7404, test_f1: 0.5228
 epoch: 44, train_loss: 0.5028, test_loss: 1.8244, test_f1: 0.5791
 epoch: 45, train_loss: 0.4974, test_loss: 1.7148, test_f1: 0.5941
 epoch: 46, train_loss: 0.4924, test_loss: 2.2196, test_f1: 0.5330
 epoch: 47, train_loss: 0.4605, test_loss: 1.8383, test_f1: 0.5814
 epoch: 48, train_loss: 0.4662, test_loss: 2.0306, test_f1: 0.5128
 epoch: 49, train_loss: 0.4545, test_loss: 2.0722, test_f1: 0.5178
 epoch: 50, train_loss: 0.4313, test_loss: 1.8672, test_f1: 0.5715
 epoch: 51, train_loss: 0.4153, test_loss: 1.8764, test_f1: 0.5495
 epoch: 52, train_loss: 0.3981, test_loss: 2.0198, test_f1: 0.5397
 epoch: 53, train_loss: 0.4017, test_loss: 2.3375, test_f1: 0.5391
 epoch: 54, train_loss: 0.3949, test_loss: 2.0745, test_f1: 0.5594
 epoch: 55, train_loss: 0.4004, test_loss: 2.0067, test_f1: 0.5322
 epoch: 56, train_loss: 0.3868, test_loss: 2.1231, test_f1: 0.5131
 epoch: 57, train_loss: 0.3809, test_loss: 1.9969, test_f1: 0.5881
 epoch: 58, train_loss: 0.3648, test_loss: 2.1560, test_f1: 0.5400
 epoch: 59, train_loss: 0.3682, test_loss: 1.9457, test_f1: 0.5527
 epoch: 60, train_loss: 0.3650, test_loss: 2.2729, test_f1: 0.5374
 epoch: 61, train_loss: 0.3526, test_loss: 2.2671, test_f1: 0.5383
 epoch: 62, train_loss: 0.3481, test_loss: 2.1140, test_f1: 0.5594
 epoch: 63, train_loss: 0.3391, test_loss: 2.3392, test_f1: 0.5721
 epoch: 64, train_loss: 0.3754, test_loss: 2.4277, test_f1: 0.5012
 epoch: 65, train_loss: 0.3680, test_loss: 2.7023, test_f1: 0.5356
 epoch: 66, train_loss: 0.3512, test_loss: 2.5010, test_f1: 0.5621
 epoch: 67, train_loss: 0.3393, test_loss: 2.6360, test_f1: 0.5251
 epoch: 68, train_loss: 0.3565, test_loss: 2.6116, test_f1: 0.5413
 epoch: 69, train_loss: 0.3415, test_loss: 2.8956, test_f1: 0.5392
 epoch: 70, train_loss: 0.3274, test_loss: 2.4166, test_f1: 0.5595
 epoch: 71, train_loss: 0.3245, test_loss: 2.5332, test_f1: 0.5431
 epoch: 72, train_loss: 0.3164, test_loss: 2.7094, test_f1: 0.5637
 epoch: 73, train_loss: 0.3061, test_loss: 2.8500, test_f1: 0.5266
 epoch: 74, train_loss: 0.3040, test_loss: 2.7524, test_f1: 0.5536
 epoch: 75, train_loss: 0.3166, test_loss: 2.9813, test_f1: 0.5200
 epoch: 76, train_loss: 0.3234, test_loss: 2.7038, test_f1: 0.5301
 epoch: 77, train_loss: 0.2840, test_loss: 2.5570, test_f1: 0.5673
 epoch: 78, train_loss: 0.3018, test_loss: 3.6832, test_f1: 0.5633
 epoch: 79, train_loss: 0.3015, test_loss: 2.9049, test_f1: 0.5720
 epoch: 80, train_loss: 0.2839, test_loss: 2.8592, test_f1: 0.5220
 epoch: 81, train_loss: 0.2829, test_loss: 3.1025, test_f1: 0.5607
 epoch: 82, train_loss: 0.2744, test_loss: 3.0983, test_f1: 0.5079
 epoch: 83, train_loss: 0.2978, test_loss: 2.6332, test_f1: 0.5609
 epoch: 84, train_loss: 0.2861, test_loss: 2.7713, test_f1: 0.5361
 epoch: 85, train_loss: 0.2726, test_loss: 2.8969, test_f1: 0.5477
 epoch: 86, train_loss: 0.2954, test_loss: 2.7521, test_f1: 0.5537
 epoch: 87, train_loss: 0.2587, test_loss: 2.8285, test_f1: 0.5362
 epoch: 88, train_loss: 0.2653, test_loss: 2.7347, test_f1: 0.5538
 epoch: 89, train_loss: 0.2793, test_loss: 2.7696, test_f1: 0.5178
 epoch: 90, train_loss: 0.2761, test_loss: 2.7483, test_f1: 0.5580
 epoch: 91, train_loss: 0.2823, test_loss: 2.7285, test_f1: 0.5540
 epoch: 92, train_loss: 0.2466, test_loss: 2.7654, test_f1: 0.5678
 epoch: 93, train_loss: 0.2455, test_loss: 3.0297, test_f1: 0.5428
 epoch: 94, train_loss: 0.2221, test_loss: 3.2852, test_f1: 0.5431
 epoch: 95, train_loss: 0.2375, test_loss: 3.3378, test_f1: 0.5449
 epoch: 96, train_loss: 0.2616, test_loss: 3.1252, test_f1: 0.5504
 epoch: 97, train_loss: 0.2530, test_loss: 3.5412, test_f1: 0.5239
 epoch: 98, train_loss: 0.2526, test_loss: 3.4613, test_f1: 0.5326
 epoch: 99, train_loss: 0.2426, test_loss: 3.6478, test_f1: 0.5224
##################ITERATION #1 ****************************************
 epoch: 0, train_loss: 1.2849, test_loss: 1.3207, test_f1: 0.3379
 epoch: 1, train_loss: 1.1619, test_loss: 1.3014, test_f1: 0.3681
 epoch: 2, train_loss: 1.1108, test_loss: 1.2313, test_f1: 0.4142
 epoch: 3, train_loss: 1.0577, test_loss: 1.1853, test_f1: 0.4222
 epoch: 4, train_loss: 1.0262, test_loss: 1.2001, test_f1: 0.5405
 epoch: 5, train_loss: 0.9767, test_loss: 1.2576, test_f1: 0.4769
 epoch: 6, train_loss: 0.9455, test_loss: 1.2491, test_f1: 0.5000
 epoch: 7, train_loss: 0.9143, test_loss: 1.2574, test_f1: 0.5512
 epoch: 8, train_loss: 0.8919, test_loss: 1.2836, test_f1: 0.5268
 epoch: 9, train_loss: 0.8770, test_loss: 1.3016, test_f1: 0.5530
 epoch: 10, train_loss: 0.8487, test_loss: 1.3273, test_f1: 0.5158
 epoch: 11, train_loss: 0.8284, test_loss: 1.4140, test_f1: 0.5014
 epoch: 12, train_loss: 0.8138, test_loss: 1.3200, test_f1: 0.5541
 epoch: 13, train_loss: 0.8012, test_loss: 1.3896, test_f1: 0.5197
 epoch: 14, train_loss: 0.7827, test_loss: 1.3125, test_f1: 0.5845
 epoch: 15, train_loss: 0.7624, test_loss: 1.3748, test_f1: 0.6051
 epoch: 16, train_loss: 0.7588, test_loss: 1.4837, test_f1: 0.5584
 epoch: 17, train_loss: 0.7319, test_loss: 1.3728, test_f1: 0.5175
 epoch: 18, train_loss: 0.7219, test_loss: 1.3677, test_f1: 0.5519
 epoch: 19, train_loss: 0.7159, test_loss: 1.5373, test_f1: 0.5571
 epoch: 20, train_loss: 0.7083, test_loss: 1.5533, test_f1: 0.5602
 epoch: 21, train_loss: 0.6750, test_loss: 1.5379, test_f1: 0.6151
 epoch: 22, train_loss: 0.6893, test_loss: 1.6379, test_f1: 0.5249
 epoch: 23, train_loss: 0.6745, test_loss: 1.5405, test_f1: 0.5645
 epoch: 24, train_loss: 0.6460, test_loss: 1.6746, test_f1: 0.5467
 epoch: 25, train_loss: 0.6356, test_loss: 1.6980, test_f1: 0.5934
 epoch: 26, train_loss: 0.6390, test_loss: 1.6465, test_f1: 0.5525
 epoch: 27, train_loss: 0.6251, test_loss: 1.7609, test_f1: 0.5243
 epoch: 28, train_loss: 0.6369, test_loss: 1.6998, test_f1: 0.5687
 epoch: 29, train_loss: 0.6217, test_loss: 1.7758, test_f1: 0.5411
 epoch: 30, train_loss: 0.5940, test_loss: 1.6421, test_f1: 0.5936
 epoch: 31, train_loss: 0.6013, test_loss: 1.7247, test_f1: 0.5934
 epoch: 32, train_loss: 0.5694, test_loss: 1.9873, test_f1: 0.5543
 epoch: 33, train_loss: 0.5774, test_loss: 1.7226, test_f1: 0.5614
 epoch: 34, train_loss: 0.5604, test_loss: 1.9294, test_f1: 0.5326
 epoch: 35, train_loss: 0.5633, test_loss: 2.0551, test_f1: 0.5707
 epoch: 36, train_loss: 0.5391, test_loss: 1.8329, test_f1: 0.5850
 epoch: 37, train_loss: 0.5297, test_loss: 1.9351, test_f1: 0.5589
 epoch: 38, train_loss: 0.5084, test_loss: 2.0244, test_f1: 0.5588
 epoch: 39, train_loss: 0.4900, test_loss: 2.0100, test_f1: 0.5435
 epoch: 40, train_loss: 0.5024, test_loss: 2.1664, test_f1: 0.5233
 epoch: 41, train_loss: 0.4919, test_loss: 2.0921, test_f1: 0.6032
 epoch: 42, train_loss: 0.4709, test_loss: 2.2404, test_f1: 0.5583
 epoch: 43, train_loss: 0.4777, test_loss: 2.1756, test_f1: 0.6202
 epoch: 44, train_loss: 0.4914, test_loss: 2.3234, test_f1: 0.5231
 epoch: 45, train_loss: 0.4391, test_loss: 2.1502, test_f1: 0.5286
 epoch: 46, train_loss: 0.4565, test_loss: 2.3751, test_f1: 0.5986
 epoch: 47, train_loss: 0.4989, test_loss: 2.4326, test_f1: 0.5721
 epoch: 48, train_loss: 0.4934, test_loss: 2.2420, test_f1: 0.5417
 epoch: 49, train_loss: 0.4472, test_loss: 2.2934, test_f1: 0.5881
 epoch: 50, train_loss: 0.4365, test_loss: 2.6409, test_f1: 0.4864
 epoch: 51, train_loss: 0.4402, test_loss: 2.3253, test_f1: 0.5829
 epoch: 52, train_loss: 0.4159, test_loss: 2.2021, test_f1: 0.5791
 epoch: 53, train_loss: 0.3830, test_loss: 2.3559, test_f1: 0.5796
 epoch: 54, train_loss: 0.3651, test_loss: 2.6000, test_f1: 0.5662
 epoch: 55, train_loss: 0.3783, test_loss: 2.7898, test_f1: 0.5763
 epoch: 56, train_loss: 0.3776, test_loss: 2.3830, test_f1: 0.6055
 epoch: 57, train_loss: 0.3700, test_loss: 2.4170, test_f1: 0.5498
 epoch: 58, train_loss: 0.3725, test_loss: 2.6293, test_f1: 0.5745
 epoch: 59, train_loss: 0.3609, test_loss: 2.5517, test_f1: 0.5861
 epoch: 60, train_loss: 0.3592, test_loss: 2.5949, test_f1: 0.5771
 epoch: 61, train_loss: 0.3547, test_loss: 2.5099, test_f1: 0.5854
 epoch: 62, train_loss: 0.3430, test_loss: 2.8926, test_f1: 0.5505
 epoch: 63, train_loss: 0.3191, test_loss: 2.7094, test_f1: 0.5582
 epoch: 64, train_loss: 0.3257, test_loss: 2.6421, test_f1: 0.5801
 epoch: 65, train_loss: 0.3679, test_loss: 3.0877, test_f1: 0.5929
 epoch: 66, train_loss: 0.3583, test_loss: 2.7009, test_f1: 0.5889
 epoch: 67, train_loss: 0.3632, test_loss: 2.7011, test_f1: 0.5615
 epoch: 68, train_loss: 0.3373, test_loss: 2.6969, test_f1: 0.5594
 epoch: 69, train_loss: 0.3298, test_loss: 2.6491, test_f1: 0.5513
 epoch: 70, train_loss: 0.3015, test_loss: 2.7757, test_f1: 0.5369
 epoch: 71, train_loss: 0.3497, test_loss: 2.9072, test_f1: 0.5751
 epoch: 72, train_loss: 0.3106, test_loss: 3.0129, test_f1: 0.5172
 epoch: 73, train_loss: 0.3227, test_loss: 2.8330, test_f1: 0.5703
 epoch: 74, train_loss: 0.3110, test_loss: 2.8702, test_f1: 0.5714
 epoch: 75, train_loss: 0.2868, test_loss: 3.2268, test_f1: 0.5430
 epoch: 76, train_loss: 0.2927, test_loss: 2.9710, test_f1: 0.5931
 epoch: 77, train_loss: 0.3223, test_loss: 3.0510, test_f1: 0.5822
 epoch: 78, train_loss: 0.3052, test_loss: 3.0608, test_f1: 0.5449
 epoch: 79, train_loss: 0.3033, test_loss: 2.9650, test_f1: 0.6115
 epoch: 80, train_loss: 0.2812, test_loss: 3.1210, test_f1: 0.5811
 epoch: 81, train_loss: 0.2887, test_loss: 3.3479, test_f1: 0.5589
 epoch: 82, train_loss: 0.3150, test_loss: 3.1490, test_f1: 0.5672
 epoch: 83, train_loss: 0.2733, test_loss: 3.2288, test_f1: 0.5692
 epoch: 84, train_loss: 0.2693, test_loss: 3.5172, test_f1: 0.5758
 epoch: 85, train_loss: 0.2809, test_loss: 3.6190, test_f1: 0.5377
 epoch: 86, train_loss: 0.3004, test_loss: 3.1993, test_f1: 0.5977
 epoch: 87, train_loss: 0.3522, test_loss: 3.2279, test_f1: 0.5787
 epoch: 88, train_loss: 0.3328, test_loss: 3.6357, test_f1: 0.5107
 epoch: 89, train_loss: 0.2703, test_loss: 3.0051, test_f1: 0.5344
 epoch: 90, train_loss: 0.2726, test_loss: 3.1526, test_f1: 0.5725
 epoch: 91, train_loss: 0.2827, test_loss: 3.3199, test_f1: 0.5595
 epoch: 92, train_loss: 0.2438, test_loss: 3.2948, test_f1: 0.5640
 epoch: 93, train_loss: 0.2540, test_loss: 3.4289, test_f1: 0.5949
 epoch: 94, train_loss: 0.2724, test_loss: 3.5164, test_f1: 0.5691
 epoch: 95, train_loss: 0.2737, test_loss: 3.7819, test_f1: 0.5676
 epoch: 96, train_loss: 0.2617, test_loss: 3.4385, test_f1: 0.6011
 epoch: 97, train_loss: 0.2379, test_loss: 3.7269, test_f1: 0.5941
 epoch: 98, train_loss: 0.2525, test_loss: 4.0444, test_f1: 0.5770
 epoch: 99, train_loss: 0.2686, test_loss: 3.8607, test_f1: 0.5791
##################ITERATION #2 ****************************************
 epoch: 0, train_loss: 1.3134, test_loss: 1.3477, test_f1: 0.3409
 epoch: 1, train_loss: 1.1516, test_loss: 1.2736, test_f1: 0.4586
 epoch: 2, train_loss: 1.1116, test_loss: 1.2167, test_f1: 0.4945
 epoch: 3, train_loss: 1.0771, test_loss: 1.1915, test_f1: 0.4866
 epoch: 4, train_loss: 1.0246, test_loss: 1.1351, test_f1: 0.4896
 epoch: 5, train_loss: 0.9899, test_loss: 1.1286, test_f1: 0.5390
 epoch: 6, train_loss: 0.9611, test_loss: 1.1033, test_f1: 0.5363
 epoch: 7, train_loss: 0.9499, test_loss: 1.0985, test_f1: 0.5635
 epoch: 8, train_loss: 0.9283, test_loss: 1.1660, test_f1: 0.5160
 epoch: 9, train_loss: 0.8998, test_loss: 1.0992, test_f1: 0.5777
 epoch: 10, train_loss: 0.8713, test_loss: 1.1147, test_f1: 0.5655
 epoch: 11, train_loss: 0.8670, test_loss: 1.1557, test_f1: 0.5042
 epoch: 12, train_loss: 0.8383, test_loss: 1.1625, test_f1: 0.5332
 epoch: 13, train_loss: 0.8259, test_loss: 1.1884, test_f1: 0.5298
 epoch: 14, train_loss: 0.8023, test_loss: 1.1723, test_f1: 0.5420
 epoch: 15, train_loss: 0.7933, test_loss: 1.1550, test_f1: 0.5652
 epoch: 16, train_loss: 0.7826, test_loss: 1.1779, test_f1: 0.5202
 epoch: 17, train_loss: 0.7661, test_loss: 1.1889, test_f1: 0.5461
 epoch: 18, train_loss: 0.7595, test_loss: 1.2383, test_f1: 0.5933
 epoch: 19, train_loss: 0.7541, test_loss: 1.2423, test_f1: 0.5207
 epoch: 20, train_loss: 0.7418, test_loss: 1.2602, test_f1: 0.5692
 epoch: 21, train_loss: 0.7489, test_loss: 1.1117, test_f1: 0.5886
 epoch: 22, train_loss: 0.7434, test_loss: 1.3016, test_f1: 0.5326
 epoch: 23, train_loss: 0.7197, test_loss: 1.2486, test_f1: 0.6106
 epoch: 24, train_loss: 0.7209, test_loss: 1.3396, test_f1: 0.5381
 epoch: 25, train_loss: 0.7025, test_loss: 1.2130, test_f1: 0.5923
 epoch: 26, train_loss: 0.6842, test_loss: 1.2759, test_f1: 0.5627
 epoch: 27, train_loss: 0.6910, test_loss: 1.4916, test_f1: 0.5529
 epoch: 28, train_loss: 0.6787, test_loss: 1.2821, test_f1: 0.5794
 epoch: 29, train_loss: 0.6628, test_loss: 1.5275, test_f1: 0.5114
 epoch: 30, train_loss: 0.6483, test_loss: 1.4279, test_f1: 0.5793
 epoch: 31, train_loss: 0.6481, test_loss: 1.4044, test_f1: 0.5232
 epoch: 32, train_loss: 0.6435, test_loss: 1.3816, test_f1: 0.5459
 epoch: 33, train_loss: 0.6424, test_loss: 1.3899, test_f1: 0.5681
 epoch: 34, train_loss: 0.6296, test_loss: 1.4588, test_f1: 0.5377
 epoch: 35, train_loss: 0.6051, test_loss: 1.4125, test_f1: 0.5800
 epoch: 36, train_loss: 0.6051, test_loss: 1.5238, test_f1: 0.5945
 epoch: 37, train_loss: 0.5970, test_loss: 1.5092, test_f1: 0.5775
 epoch: 38, train_loss: 0.6140, test_loss: 1.4411, test_f1: 0.5251
 epoch: 39, train_loss: 0.5842, test_loss: 1.5285, test_f1: 0.5547
 epoch: 40, train_loss: 0.5945, test_loss: 1.5299, test_f1: 0.5345
 epoch: 41, train_loss: 0.5747, test_loss: 1.3659, test_f1: 0.5933
 epoch: 42, train_loss: 0.5526, test_loss: 1.5192, test_f1: 0.5869
 epoch: 43, train_loss: 0.5568, test_loss: 1.7033, test_f1: 0.5484
 epoch: 44, train_loss: 0.5620, test_loss: 1.5280, test_f1: 0.5562
 epoch: 45, train_loss: 0.5517, test_loss: 1.4610, test_f1: 0.5753
 epoch: 46, train_loss: 0.5332, test_loss: 1.3905, test_f1: 0.5579
 epoch: 47, train_loss: 0.5221, test_loss: 1.5139, test_f1: 0.5794
 epoch: 48, train_loss: 0.5080, test_loss: 1.4984, test_f1: 0.6023
 epoch: 49, train_loss: 0.4942, test_loss: 1.6333, test_f1: 0.5703
 epoch: 50, train_loss: 0.5096, test_loss: 1.5052, test_f1: 0.6067
 epoch: 51, train_loss: 0.5089, test_loss: 1.7096, test_f1: 0.5698
 epoch: 52, train_loss: 0.4701, test_loss: 1.6507, test_f1: 0.6034
 epoch: 53, train_loss: 0.4531, test_loss: 1.5200, test_f1: 0.6308
 epoch: 54, train_loss: 0.4294, test_loss: 1.6488, test_f1: 0.5872
 epoch: 55, train_loss: 0.4654, test_loss: 1.5637, test_f1: 0.6065
 epoch: 56, train_loss: 0.4968, test_loss: 1.6315, test_f1: 0.5556
 epoch: 57, train_loss: 0.4535, test_loss: 1.6154, test_f1: 0.5959
 epoch: 58, train_loss: 0.4216, test_loss: 1.7994, test_f1: 0.5384
 epoch: 59, train_loss: 0.4387, test_loss: 1.6612, test_f1: 0.5637
 epoch: 60, train_loss: 0.4231, test_loss: 1.7196, test_f1: 0.6054
 epoch: 61, train_loss: 0.4323, test_loss: 1.6781, test_f1: 0.5540
 epoch: 62, train_loss: 0.4156, test_loss: 1.6678, test_f1: 0.5980
 epoch: 63, train_loss: 0.3953, test_loss: 1.5164, test_f1: 0.6119
 epoch: 64, train_loss: 0.4114, test_loss: 1.8010, test_f1: 0.5612
 epoch: 65, train_loss: 0.3945, test_loss: 1.9487, test_f1: 0.5377
 epoch: 66, train_loss: 0.4008, test_loss: 1.6694, test_f1: 0.5889
 epoch: 67, train_loss: 0.4148, test_loss: 1.9044, test_f1: 0.5685
 epoch: 68, train_loss: 0.3874, test_loss: 1.8749, test_f1: 0.5823
 epoch: 69, train_loss: 0.3877, test_loss: 1.8446, test_f1: 0.5428
 epoch: 70, train_loss: 0.4092, test_loss: 1.8287, test_f1: 0.6040
 epoch: 71, train_loss: 0.4063, test_loss: 1.8797, test_f1: 0.5887
 epoch: 72, train_loss: 0.3880, test_loss: 1.7417, test_f1: 0.6003
 epoch: 73, train_loss: 0.4029, test_loss: 1.9031, test_f1: 0.5875
 epoch: 74, train_loss: 0.4028, test_loss: 2.0345, test_f1: 0.5636
 epoch: 75, train_loss: 0.3879, test_loss: 1.9901, test_f1: 0.5610
 epoch: 76, train_loss: 0.3677, test_loss: 1.7120, test_f1: 0.6002
 epoch: 77, train_loss: 0.3855, test_loss: 1.8293, test_f1: 0.5711
 epoch: 78, train_loss: 0.3824, test_loss: 1.9461, test_f1: 0.5665
 epoch: 79, train_loss: 0.3408, test_loss: 1.9690, test_f1: 0.5990
 epoch: 80, train_loss: 0.3505, test_loss: 2.3525, test_f1: 0.5593
 epoch: 81, train_loss: 0.3574, test_loss: 2.4999, test_f1: 0.5710
 epoch: 82, train_loss: 0.3475, test_loss: 2.6470, test_f1: 0.5484
 epoch: 83, train_loss: 0.3681, test_loss: 2.7250, test_f1: 0.5645
 epoch: 84, train_loss: 0.3509, test_loss: 1.9535, test_f1: 0.5909
 epoch: 85, train_loss: 0.3482, test_loss: 2.0849, test_f1: 0.5732
 epoch: 86, train_loss: 0.3588, test_loss: 2.8432, test_f1: 0.5836
 epoch: 87, train_loss: 0.3742, test_loss: 2.2385, test_f1: 0.5532
 epoch: 88, train_loss: 0.3785, test_loss: 2.2158, test_f1: 0.5665
 epoch: 89, train_loss: 0.3812, test_loss: 1.9014, test_f1: 0.5837
 epoch: 90, train_loss: 0.3640, test_loss: 1.9106, test_f1: 0.5859
 epoch: 91, train_loss: 0.3416, test_loss: 2.0348, test_f1: 0.5529
 epoch: 92, train_loss: 0.3509, test_loss: 1.8982, test_f1: 0.5898
 epoch: 93, train_loss: 0.3313, test_loss: 1.9593, test_f1: 0.5981
 epoch: 94, train_loss: 0.3549, test_loss: 1.9231, test_f1: 0.6026
 epoch: 95, train_loss: 0.3220, test_loss: 2.2044, test_f1: 0.5839
 epoch: 96, train_loss: 0.3300, test_loss: 2.0369, test_f1: 0.5905
 epoch: 97, train_loss: 0.3441, test_loss: 1.9890, test_f1: 0.5936
 epoch: 98, train_loss: 0.3460, test_loss: 2.6762, test_f1: 0.6165
 epoch: 99, train_loss: 0.3085, test_loss: 2.1987, test_f1: 0.5755
##################ITERATION #3 ****************************************
 epoch: 0, train_loss: 1.3881, test_loss: 1.4172, test_f1: 0.2249
 epoch: 1, train_loss: 1.1529, test_loss: 1.3774, test_f1: 0.1685
 epoch: 2, train_loss: 1.0917, test_loss: 1.2667, test_f1: 0.3753
 epoch: 3, train_loss: 1.0639, test_loss: 1.2037, test_f1: 0.4883
 epoch: 4, train_loss: 1.0325, test_loss: 1.2095, test_f1: 0.5012
 epoch: 5, train_loss: 0.9850, test_loss: 1.1993, test_f1: 0.4975
 epoch: 6, train_loss: 0.9705, test_loss: 1.2452, test_f1: 0.4958
 epoch: 7, train_loss: 0.9476, test_loss: 1.2041, test_f1: 0.5001
 epoch: 8, train_loss: 0.9359, test_loss: 1.1961, test_f1: 0.5633
 epoch: 9, train_loss: 0.9441, test_loss: 1.2239, test_f1: 0.4887
 epoch: 10, train_loss: 0.9153, test_loss: 1.2496, test_f1: 0.4896
 epoch: 11, train_loss: 0.9101, test_loss: 1.1838, test_f1: 0.5172
 epoch: 12, train_loss: 0.8948, test_loss: 1.1559, test_f1: 0.5018
 epoch: 13, train_loss: 0.8774, test_loss: 1.2261, test_f1: 0.5060
 epoch: 14, train_loss: 0.8578, test_loss: 1.2121, test_f1: 0.4864
 epoch: 15, train_loss: 0.8628, test_loss: 1.3207, test_f1: 0.4610
 epoch: 16, train_loss: 0.8555, test_loss: 1.2637, test_f1: 0.5164
 epoch: 17, train_loss: 0.8193, test_loss: 1.2294, test_f1: 0.4965
 epoch: 18, train_loss: 0.8429, test_loss: 1.1990, test_f1: 0.5936
 epoch: 19, train_loss: 0.8193, test_loss: 1.5427, test_f1: 0.4634
 epoch: 20, train_loss: 0.8041, test_loss: 1.1640, test_f1: 0.5733
 epoch: 21, train_loss: 0.7907, test_loss: 1.1961, test_f1: 0.5647
 epoch: 22, train_loss: 0.7828, test_loss: 1.2191, test_f1: 0.5379
 epoch: 23, train_loss: 0.7867, test_loss: 1.2705, test_f1: 0.5314
 epoch: 24, train_loss: 0.7553, test_loss: 1.2601, test_f1: 0.5142
 epoch: 25, train_loss: 0.7368, test_loss: 1.2177, test_f1: 0.5373
 epoch: 26, train_loss: 0.7377, test_loss: 1.2564, test_f1: 0.5817
 epoch: 27, train_loss: 0.7475, test_loss: 1.2608, test_f1: 0.5516
 epoch: 28, train_loss: 0.7221, test_loss: 1.1921, test_f1: 0.5690
 epoch: 29, train_loss: 0.7107, test_loss: 1.3204, test_f1: 0.5393
 epoch: 30, train_loss: 0.6988, test_loss: 1.2607, test_f1: 0.5600
 epoch: 31, train_loss: 0.6903, test_loss: 1.5263, test_f1: 0.5633
 epoch: 32, train_loss: 0.6896, test_loss: 1.3970, test_f1: 0.5347
 epoch: 33, train_loss: 0.6665, test_loss: 1.3287, test_f1: 0.4791
 epoch: 34, train_loss: 0.6827, test_loss: 1.3659, test_f1: 0.5444
 epoch: 35, train_loss: 0.6381, test_loss: 1.2869, test_f1: 0.5601
 epoch: 36, train_loss: 0.6772, test_loss: 1.5493, test_f1: 0.5127
 epoch: 37, train_loss: 0.6775, test_loss: 1.4098, test_f1: 0.5340
 epoch: 38, train_loss: 0.6647, test_loss: 1.3799, test_f1: 0.5513
 epoch: 39, train_loss: 0.6362, test_loss: 1.5397, test_f1: 0.5108
 epoch: 40, train_loss: 0.6353, test_loss: 1.4021, test_f1: 0.5653
 epoch: 41, train_loss: 0.6129, test_loss: 1.4404, test_f1: 0.5336
 epoch: 42, train_loss: 0.6371, test_loss: 1.4751, test_f1: 0.5114
 epoch: 43, train_loss: 0.6111, test_loss: 1.4321, test_f1: 0.5720
 epoch: 44, train_loss: 0.6000, test_loss: 1.5322, test_f1: 0.5188
 epoch: 45, train_loss: 0.5839, test_loss: 1.7260, test_f1: 0.5273
 epoch: 46, train_loss: 0.5817, test_loss: 1.6007, test_f1: 0.5471
 epoch: 47, train_loss: 0.5890, test_loss: 1.8034, test_f1: 0.4738
 epoch: 48, train_loss: 0.6072, test_loss: 1.4621, test_f1: 0.5069
 epoch: 49, train_loss: 0.6197, test_loss: 1.6625, test_f1: 0.5131
 epoch: 50, train_loss: 0.5795, test_loss: 1.8045, test_f1: 0.5041
 epoch: 51, train_loss: 0.5785, test_loss: 1.4822, test_f1: 0.5466
 epoch: 52, train_loss: 0.5288, test_loss: 1.5755, test_f1: 0.5307
 epoch: 53, train_loss: 0.5435, test_loss: 1.5940, test_f1: 0.5708
 epoch: 54, train_loss: 0.5043, test_loss: 1.5248, test_f1: 0.5728
 epoch: 55, train_loss: 0.4842, test_loss: 1.6245, test_f1: 0.5550
 epoch: 56, train_loss: 0.4909, test_loss: 1.6418, test_f1: 0.5468
 epoch: 57, train_loss: 0.4985, test_loss: 1.6846, test_f1: 0.5299
 epoch: 58, train_loss: 0.5102, test_loss: 1.7622, test_f1: 0.5604
 epoch: 59, train_loss: 0.4910, test_loss: 1.5929, test_f1: 0.5434
 epoch: 60, train_loss: 0.4925, test_loss: 1.7217, test_f1: 0.5463
 epoch: 61, train_loss: 0.4908, test_loss: 1.6986, test_f1: 0.5422
 epoch: 62, train_loss: 0.4754, test_loss: 1.8042, test_f1: 0.5225
 epoch: 63, train_loss: 0.5036, test_loss: 1.8094, test_f1: 0.5219
 epoch: 64, train_loss: 0.4717, test_loss: 1.7173, test_f1: 0.5372
 epoch: 65, train_loss: 0.4906, test_loss: 1.8725, test_f1: 0.5413
 epoch: 66, train_loss: 0.4805, test_loss: 1.7610, test_f1: 0.5452
 epoch: 67, train_loss: 0.4388, test_loss: 1.8903, test_f1: 0.5547
 epoch: 68, train_loss: 0.4402, test_loss: 1.7014, test_f1: 0.5551
 epoch: 69, train_loss: 0.4500, test_loss: 1.7813, test_f1: 0.5271
 epoch: 70, train_loss: 0.4649, test_loss: 1.7797, test_f1: 0.5330
 epoch: 71, train_loss: 0.4448, test_loss: 1.9801, test_f1: 0.5573
 epoch: 72, train_loss: 0.4645, test_loss: 1.8156, test_f1: 0.5293
 epoch: 73, train_loss: 0.4331, test_loss: 1.7784, test_f1: 0.5392
 epoch: 74, train_loss: 0.4647, test_loss: 1.9886, test_f1: 0.5534
 epoch: 75, train_loss: 0.4371, test_loss: 1.9600, test_f1: 0.5153
 epoch: 76, train_loss: 0.4337, test_loss: 1.9716, test_f1: 0.5573
 epoch: 77, train_loss: 0.4295, test_loss: 2.0557, test_f1: 0.5440
 epoch: 78, train_loss: 0.4178, test_loss: 1.9060, test_f1: 0.5506
 epoch: 79, train_loss: 0.4294, test_loss: 2.1107, test_f1: 0.5312
 epoch: 80, train_loss: 0.4083, test_loss: 1.9659, test_f1: 0.5600
 epoch: 81, train_loss: 0.4229, test_loss: 1.9234, test_f1: 0.5192
 epoch: 82, train_loss: 0.4134, test_loss: 1.9304, test_f1: 0.5587
 epoch: 83, train_loss: 0.4195, test_loss: 2.0900, test_f1: 0.5288
 epoch: 84, train_loss: 0.3989, test_loss: 2.1523, test_f1: 0.5458
 epoch: 85, train_loss: 0.4004, test_loss: 2.0758, test_f1: 0.5434
 epoch: 86, train_loss: 0.3805, test_loss: 1.9938, test_f1: 0.5330
 epoch: 87, train_loss: 0.3923, test_loss: 2.2009, test_f1: 0.5485
 epoch: 88, train_loss: 0.3895, test_loss: 2.1481, test_f1: 0.5528
 epoch: 89, train_loss: 0.4267, test_loss: 2.2213, test_f1: 0.5446
 epoch: 90, train_loss: 0.4173, test_loss: 2.1523, test_f1: 0.5337
 epoch: 91, train_loss: 0.4175, test_loss: 2.0973, test_f1: 0.5337
 epoch: 92, train_loss: 0.4014, test_loss: 2.1051, test_f1: 0.5738
 epoch: 93, train_loss: 0.3630, test_loss: 2.1625, test_f1: 0.5478
 epoch: 94, train_loss: 0.3568, test_loss: 2.1780, test_f1: 0.5361
 epoch: 95, train_loss: 0.3842, test_loss: 2.3116, test_f1: 0.5498
 epoch: 96, train_loss: 0.3964, test_loss: 2.3969, test_f1: 0.5427
 epoch: 97, train_loss: 0.3803, test_loss: 2.3985, test_f1: 0.5230
 epoch: 98, train_loss: 0.3816, test_loss: 2.2136, test_f1: 0.5820
 epoch: 99, train_loss: 0.3727, test_loss: 2.4118, test_f1: 0.5609
##################ITERATION #4 ****************************************
 epoch: 0, train_loss: 1.3051, test_loss: 1.3360, test_f1: 0.3432
 epoch: 1, train_loss: 1.1247, test_loss: 1.2999, test_f1: 0.3532
 epoch: 2, train_loss: 1.0554, test_loss: 1.2028, test_f1: 0.4872
 epoch: 3, train_loss: 1.0194, test_loss: 1.1446, test_f1: 0.5603
 epoch: 4, train_loss: 0.9719, test_loss: 1.1259, test_f1: 0.5450
 epoch: 5, train_loss: 0.9651, test_loss: 1.1633, test_f1: 0.5253
 epoch: 6, train_loss: 0.9409, test_loss: 1.1335, test_f1: 0.5222
 epoch: 7, train_loss: 0.9043, test_loss: 1.1437, test_f1: 0.5544
 epoch: 8, train_loss: 0.9056, test_loss: 1.1817, test_f1: 0.5363
 epoch: 9, train_loss: 0.8605, test_loss: 1.1306, test_f1: 0.5635
 epoch: 10, train_loss: 0.8332, test_loss: 1.1480, test_f1: 0.5018
 epoch: 11, train_loss: 0.8459, test_loss: 1.1437, test_f1: 0.5510
 epoch: 12, train_loss: 0.8064, test_loss: 1.1990, test_f1: 0.5407
 epoch: 13, train_loss: 0.8022, test_loss: 1.1408, test_f1: 0.5920
 epoch: 14, train_loss: 0.7754, test_loss: 1.2108, test_f1: 0.5949
 epoch: 15, train_loss: 0.7771, test_loss: 1.3006, test_f1: 0.5173
 epoch: 16, train_loss: 0.7525, test_loss: 1.2592, test_f1: 0.5413
 epoch: 17, train_loss: 0.7594, test_loss: 1.1948, test_f1: 0.5971
 epoch: 18, train_loss: 0.7403, test_loss: 1.2425, test_f1: 0.5457
 epoch: 19, train_loss: 0.7202, test_loss: 1.2237, test_f1: 0.5878
 epoch: 20, train_loss: 0.7074, test_loss: 1.4294, test_f1: 0.5208
 epoch: 21, train_loss: 0.6984, test_loss: 1.4080, test_f1: 0.5063
 epoch: 22, train_loss: 0.7097, test_loss: 1.2489, test_f1: 0.6027
 epoch: 23, train_loss: 0.6657, test_loss: 1.4928, test_f1: 0.5448
 epoch: 24, train_loss: 0.6928, test_loss: 1.4636, test_f1: 0.5470
 epoch: 25, train_loss: 0.6495, test_loss: 1.2302, test_f1: 0.5980
 epoch: 26, train_loss: 0.6235, test_loss: 1.5984, test_f1: 0.5179
 epoch: 27, train_loss: 0.6301, test_loss: 1.6825, test_f1: 0.5424
 epoch: 28, train_loss: 0.6327, test_loss: 1.7351, test_f1: 0.5361
 epoch: 29, train_loss: 0.6307, test_loss: 1.7148, test_f1: 0.5094
 epoch: 30, train_loss: 0.6128, test_loss: 1.7559, test_f1: 0.5230
 epoch: 31, train_loss: 0.5885, test_loss: 1.7239, test_f1: 0.5319
 epoch: 32, train_loss: 0.6014, test_loss: 1.6978, test_f1: 0.5276
 epoch: 33, train_loss: 0.5691, test_loss: 1.8223, test_f1: 0.5220
 epoch: 34, train_loss: 0.5827, test_loss: 1.6692, test_f1: 0.5275
 epoch: 35, train_loss: 0.5752, test_loss: 1.6761, test_f1: 0.5857
 epoch: 36, train_loss: 0.5479, test_loss: 1.6893, test_f1: 0.5250
 epoch: 37, train_loss: 0.5408, test_loss: 2.2349, test_f1: 0.5191
 epoch: 38, train_loss: 0.5337, test_loss: 1.8557, test_f1: 0.5148
 epoch: 39, train_loss: 0.5495, test_loss: 1.6783, test_f1: 0.5702
 epoch: 40, train_loss: 0.5693, test_loss: 1.9726, test_f1: 0.5290
 epoch: 41, train_loss: 0.5873, test_loss: 1.8322, test_f1: 0.5793
 epoch: 42, train_loss: 0.5141, test_loss: 1.6930, test_f1: 0.5591
 epoch: 43, train_loss: 0.5166, test_loss: 1.8741, test_f1: 0.5458
 epoch: 44, train_loss: 0.4865, test_loss: 1.9105, test_f1: 0.5809
 epoch: 45, train_loss: 0.5333, test_loss: 1.8118, test_f1: 0.6052
 epoch: 46, train_loss: 0.4999, test_loss: 1.9303, test_f1: 0.5475
 epoch: 47, train_loss: 0.5136, test_loss: 2.0809, test_f1: 0.5229
 epoch: 48, train_loss: 0.4781, test_loss: 2.1121, test_f1: 0.5462
 epoch: 49, train_loss: 0.4905, test_loss: 1.8360, test_f1: 0.5984
 epoch: 50, train_loss: 0.4584, test_loss: 1.9956, test_f1: 0.5483
 epoch: 51, train_loss: 0.4426, test_loss: 1.8813, test_f1: 0.5545
 epoch: 52, train_loss: 0.4290, test_loss: 1.8056, test_f1: 0.5462
 epoch: 53, train_loss: 0.4030, test_loss: 1.7971, test_f1: 0.5454
 epoch: 54, train_loss: 0.3991, test_loss: 2.0794, test_f1: 0.5530
 epoch: 55, train_loss: 0.3886, test_loss: 2.0970, test_f1: 0.5745
 epoch: 56, train_loss: 0.3899, test_loss: 2.0212, test_f1: 0.5610
 epoch: 57, train_loss: 0.3662, test_loss: 2.2587, test_f1: 0.5320
 epoch: 58, train_loss: 0.3683, test_loss: 2.0328, test_f1: 0.5839
 epoch: 59, train_loss: 0.3843, test_loss: 2.0968, test_f1: 0.5433
 epoch: 60, train_loss: 0.3772, test_loss: 2.1520, test_f1: 0.5577
 epoch: 61, train_loss: 0.3752, test_loss: 2.2067, test_f1: 0.5241
 epoch: 62, train_loss: 0.3519, test_loss: 2.3494, test_f1: 0.5361
 epoch: 63, train_loss: 0.3789, test_loss: 2.2853, test_f1: 0.5225
 epoch: 64, train_loss: 0.3680, test_loss: 2.1888, test_f1: 0.5618
 epoch: 65, train_loss: 0.3618, test_loss: 2.2691, test_f1: 0.5407
 epoch: 66, train_loss: 0.3259, test_loss: 2.1167, test_f1: 0.5508
 epoch: 67, train_loss: 0.3629, test_loss: 2.0560, test_f1: 0.5725
 epoch: 68, train_loss: 0.3460, test_loss: 2.2510, test_f1: 0.5510
 epoch: 69, train_loss: 0.3211, test_loss: 2.1457, test_f1: 0.5599
 epoch: 70, train_loss: 0.3454, test_loss: 2.3295, test_f1: 0.5244
 epoch: 71, train_loss: 0.3650, test_loss: 2.0212, test_f1: 0.5627
 epoch: 72, train_loss: 0.3769, test_loss: 2.2871, test_f1: 0.5557
 epoch: 73, train_loss: 0.3342, test_loss: 2.1154, test_f1: 0.5529
 epoch: 74, train_loss: 0.3399, test_loss: 2.3368, test_f1: 0.5351
 epoch: 75, train_loss: 0.3629, test_loss: 2.1418, test_f1: 0.5500
 epoch: 76, train_loss: 0.3483, test_loss: 2.2826, test_f1: 0.5457
 epoch: 77, train_loss: 0.3347, test_loss: 2.3694, test_f1: 0.5227
 epoch: 78, train_loss: 0.3430, test_loss: 2.3119, test_f1: 0.5518
 epoch: 79, train_loss: 0.3440, test_loss: 2.2000, test_f1: 0.5475
 epoch: 80, train_loss: 0.3209, test_loss: 2.2786, test_f1: 0.5542
 epoch: 81, train_loss: 0.3221, test_loss: 2.8877, test_f1: 0.5516
 epoch: 82, train_loss: 0.3356, test_loss: 2.1365, test_f1: 0.5569
 epoch: 83, train_loss: 0.3066, test_loss: 2.1020, test_f1: 0.5675
 epoch: 84, train_loss: 0.3057, test_loss: 2.2189, test_f1: 0.5732
 epoch: 85, train_loss: 0.3169, test_loss: 2.2347, test_f1: 0.5517
 epoch: 86, train_loss: 0.2971, test_loss: 2.4190, test_f1: 0.5779
 epoch: 87, train_loss: 0.3101, test_loss: 2.2884, test_f1: 0.5552
 epoch: 88, train_loss: 0.3097, test_loss: 2.0662, test_f1: 0.6154
 epoch: 89, train_loss: 0.3137, test_loss: 2.4055, test_f1: 0.5439
 epoch: 90, train_loss: 0.3268, test_loss: 2.3292, test_f1: 0.5582
 epoch: 91, train_loss: 0.3319, test_loss: 2.1715, test_f1: 0.5613
 epoch: 92, train_loss: 0.3032, test_loss: 2.4344, test_f1: 0.5555
 epoch: 93, train_loss: 0.3071, test_loss: 2.2191, test_f1: 0.5876
 epoch: 94, train_loss: 0.2862, test_loss: 2.4009, test_f1: 0.5279
 epoch: 95, train_loss: 0.2902, test_loss: 2.6328, test_f1: 0.5357
 epoch: 96, train_loss: 0.2858, test_loss: 2.4072, test_f1: 0.5347
 epoch: 97, train_loss: 0.2850, test_loss: 2.3330, test_f1: 0.5775
 epoch: 98, train_loss: 0.2806, test_loss: 2.4295, test_f1: 0.5682
 epoch: 99, train_loss: 0.3342, test_loss: 2.2647, test_f1: 0.5676
##################ITERATION #5 ****************************************
 epoch: 0, train_loss: 1.3995, test_loss: 1.3269, test_f1: 0.2702
 epoch: 1, train_loss: 1.1857, test_loss: 1.2936, test_f1: 0.2916
 epoch: 2, train_loss: 1.1145, test_loss: 1.2265, test_f1: 0.4408
 epoch: 3, train_loss: 1.0842, test_loss: 1.1805, test_f1: 0.4881
 epoch: 4, train_loss: 1.0384, test_loss: 1.1595, test_f1: 0.4899
 epoch: 5, train_loss: 0.9912, test_loss: 1.2266, test_f1: 0.4950
 epoch: 6, train_loss: 0.9862, test_loss: 1.2268, test_f1: 0.4816
 epoch: 7, train_loss: 0.9578, test_loss: 1.2891, test_f1: 0.4942
 epoch: 8, train_loss: 0.9384, test_loss: 1.2851, test_f1: 0.4783
 epoch: 9, train_loss: 0.9469, test_loss: 1.3203, test_f1: 0.4699
 epoch: 10, train_loss: 0.9328, test_loss: 1.2391, test_f1: 0.5423
 epoch: 11, train_loss: 0.9107, test_loss: 1.2415, test_f1: 0.5163
 epoch: 12, train_loss: 0.8880, test_loss: 1.2484, test_f1: 0.5423
 epoch: 13, train_loss: 0.8751, test_loss: 1.2602, test_f1: 0.5100
 epoch: 14, train_loss: 0.8530, test_loss: 1.2085, test_f1: 0.5464
 epoch: 15, train_loss: 0.8429, test_loss: 1.3002, test_f1: 0.5292
 epoch: 16, train_loss: 0.8313, test_loss: 1.2510, test_f1: 0.5765
 epoch: 17, train_loss: 0.8077, test_loss: 1.3037, test_f1: 0.5502
 epoch: 18, train_loss: 0.8255, test_loss: 1.3377, test_f1: 0.4915
 epoch: 19, train_loss: 0.7983, test_loss: 1.2363, test_f1: 0.5902
 epoch: 20, train_loss: 0.8027, test_loss: 1.2798, test_f1: 0.6057
 epoch: 21, train_loss: 0.7845, test_loss: 1.3620, test_f1: 0.5846
 epoch: 22, train_loss: 0.7809, test_loss: 1.3209, test_f1: 0.5844
 epoch: 23, train_loss: 0.7572, test_loss: 1.4366, test_f1: 0.5148
 epoch: 24, train_loss: 0.7466, test_loss: 1.2804, test_f1: 0.5979
 epoch: 25, train_loss: 0.7136, test_loss: 1.2577, test_f1: 0.5846
 epoch: 26, train_loss: 0.7280, test_loss: 1.3635, test_f1: 0.6006
 epoch: 27, train_loss: 0.7256, test_loss: 1.4752, test_f1: 0.5917
 epoch: 28, train_loss: 0.7208, test_loss: 1.3084, test_f1: 0.6136
 epoch: 29, train_loss: 0.7062, test_loss: 1.3722, test_f1: 0.5818
 epoch: 30, train_loss: 0.7140, test_loss: 1.4605, test_f1: 0.5700
 epoch: 31, train_loss: 0.6997, test_loss: 1.5153, test_f1: 0.5946
 epoch: 32, train_loss: 0.6946, test_loss: 1.4982, test_f1: 0.5926
 epoch: 33, train_loss: 0.7000, test_loss: 1.6690, test_f1: 0.5941
 epoch: 34, train_loss: 0.6538, test_loss: 1.4661, test_f1: 0.5823
 epoch: 35, train_loss: 0.6609, test_loss: 1.4591, test_f1: 0.6005
 epoch: 36, train_loss: 0.6522, test_loss: 1.6388, test_f1: 0.5463
 epoch: 37, train_loss: 0.6464, test_loss: 1.6788, test_f1: 0.5496
 epoch: 38, train_loss: 0.6467, test_loss: 1.6105, test_f1: 0.5780
 epoch: 39, train_loss: 0.6358, test_loss: 1.5389, test_f1: 0.5502
 epoch: 40, train_loss: 0.6431, test_loss: 1.5629, test_f1: 0.5729
 epoch: 41, train_loss: 0.6794, test_loss: 1.7014, test_f1: 0.5497
 epoch: 42, train_loss: 0.6330, test_loss: 1.7227, test_f1: 0.5873
 epoch: 43, train_loss: 0.6243, test_loss: 1.6561, test_f1: 0.5756
 epoch: 44, train_loss: 0.6050, test_loss: 1.5978, test_f1: 0.6097
 epoch: 45, train_loss: 0.6051, test_loss: 1.7085, test_f1: 0.5669
 epoch: 46, train_loss: 0.5991, test_loss: 1.6579, test_f1: 0.5770
 epoch: 47, train_loss: 0.5836, test_loss: 1.8040, test_f1: 0.5795
 epoch: 48, train_loss: 0.5634, test_loss: 1.9442, test_f1: 0.5322
 epoch: 49, train_loss: 0.6039, test_loss: 1.8127, test_f1: 0.5776
 epoch: 50, train_loss: 0.6057, test_loss: 1.7298, test_f1: 0.5704
 epoch: 51, train_loss: 0.5909, test_loss: 1.7566, test_f1: 0.5675
 epoch: 52, train_loss: 0.5600, test_loss: 1.9171, test_f1: 0.5633
 epoch: 53, train_loss: 0.5236, test_loss: 1.8102, test_f1: 0.5622
 epoch: 54, train_loss: 0.5062, test_loss: 1.9171, test_f1: 0.5777
 epoch: 55, train_loss: 0.5123, test_loss: 1.9249, test_f1: 0.5838
 epoch: 56, train_loss: 0.4895, test_loss: 1.9308, test_f1: 0.5963
 epoch: 57, train_loss: 0.5136, test_loss: 1.8737, test_f1: 0.5907
 epoch: 58, train_loss: 0.4946, test_loss: 2.1368, test_f1: 0.5700
 epoch: 59, train_loss: 0.5126, test_loss: 2.0424, test_f1: 0.5634
 epoch: 60, train_loss: 0.4917, test_loss: 2.1113, test_f1: 0.5800
 epoch: 61, train_loss: 0.5016, test_loss: 2.3283, test_f1: 0.5688
 epoch: 62, train_loss: 0.4923, test_loss: 2.2612, test_f1: 0.5874
 epoch: 63, train_loss: 0.4896, test_loss: 2.3217, test_f1: 0.5657
 epoch: 64, train_loss: 0.4755, test_loss: 2.2071, test_f1: 0.6308
 epoch: 65, train_loss: 0.4678, test_loss: 2.3302, test_f1: 0.6061
 epoch: 66, train_loss: 0.4641, test_loss: 2.3439, test_f1: 0.5805
 epoch: 67, train_loss: 0.4463, test_loss: 2.3626, test_f1: 0.5804
 epoch: 68, train_loss: 0.4778, test_loss: 2.3149, test_f1: 0.6012
 epoch: 69, train_loss: 0.4600, test_loss: 2.2743, test_f1: 0.5987
 epoch: 70, train_loss: 0.4573, test_loss: 2.2188, test_f1: 0.5782
 epoch: 71, train_loss: 0.4717, test_loss: 2.6496, test_f1: 0.5861
 epoch: 72, train_loss: 0.4675, test_loss: 2.9395, test_f1: 0.5766
 epoch: 73, train_loss: 0.4506, test_loss: 3.2598, test_f1: 0.5833
 epoch: 74, train_loss: 0.4454, test_loss: 2.9071, test_f1: 0.5339
 epoch: 75, train_loss: 0.4473, test_loss: 2.7783, test_f1: 0.5542
 epoch: 76, train_loss: 0.4417, test_loss: 3.1860, test_f1: 0.5724
 epoch: 77, train_loss: 0.4296, test_loss: 3.6885, test_f1: 0.5773
 epoch: 78, train_loss: 0.4361, test_loss: 3.6631, test_f1: 0.5836
 epoch: 79, train_loss: 0.4318, test_loss: 2.3976, test_f1: 0.5899
 epoch: 80, train_loss: 0.4322, test_loss: 2.6793, test_f1: 0.5697
 epoch: 81, train_loss: 0.4167, test_loss: 3.0306, test_f1: 0.5928
 epoch: 82, train_loss: 0.4109, test_loss: 3.1617, test_f1: 0.5773
 epoch: 83, train_loss: 0.4256, test_loss: 2.4864, test_f1: 0.5652
 epoch: 84, train_loss: 0.4178, test_loss: 3.0040, test_f1: 0.5426
 epoch: 85, train_loss: 0.4370, test_loss: 3.1590, test_f1: 0.5787
 epoch: 86, train_loss: 0.4277, test_loss: 2.7352, test_f1: 0.5995
 epoch: 87, train_loss: 0.4044, test_loss: 2.9248, test_f1: 0.5759
 epoch: 88, train_loss: 0.4158, test_loss: 2.9568, test_f1: 0.5722
 epoch: 89, train_loss: 0.4228, test_loss: 3.1007, test_f1: 0.5668
 epoch: 90, train_loss: 0.3850, test_loss: 2.6409, test_f1: 0.5701
 epoch: 91, train_loss: 0.3974, test_loss: 2.4504, test_f1: 0.5925
 epoch: 92, train_loss: 0.3929, test_loss: 2.7464, test_f1: 0.5648
 epoch: 93, train_loss: 0.3779, test_loss: 3.0664, test_f1: 0.5890
 epoch: 94, train_loss: 0.3869, test_loss: 2.8622, test_f1: 0.5819
 epoch: 95, train_loss: 0.3717, test_loss: 2.9399, test_f1: 0.5858
 epoch: 96, train_loss: 0.4121, test_loss: 3.5570, test_f1: 0.5844
 epoch: 97, train_loss: 0.4304, test_loss: 3.2663, test_f1: 0.5727
 epoch: 98, train_loss: 0.4022, test_loss: 2.6427, test_f1: 0.5771
 epoch: 99, train_loss: 0.4318, test_loss: 2.9559, test_f1: 0.5951
##################ITERATION #6 ****************************************
 epoch: 0, train_loss: 1.4066, test_loss: 1.5801, test_f1: 0.1647
 epoch: 1, train_loss: 1.1944, test_loss: 1.3938, test_f1: 0.3602
 epoch: 2, train_loss: 1.1196, test_loss: 1.3255, test_f1: 0.4070
 epoch: 3, train_loss: 1.0826, test_loss: 1.2023, test_f1: 0.4531
 epoch: 4, train_loss: 1.0279, test_loss: 1.2170, test_f1: 0.5257
 epoch: 5, train_loss: 1.0081, test_loss: 1.1901, test_f1: 0.5163
 epoch: 6, train_loss: 0.9898, test_loss: 1.2000, test_f1: 0.4731
 epoch: 7, train_loss: 0.9460, test_loss: 1.2405, test_f1: 0.5560
 epoch: 8, train_loss: 0.9382, test_loss: 1.2567, test_f1: 0.5489
 epoch: 9, train_loss: 0.9214, test_loss: 1.1984, test_f1: 0.5788
 epoch: 10, train_loss: 0.8944, test_loss: 1.2828, test_f1: 0.5050
 epoch: 11, train_loss: 0.8886, test_loss: 1.2005, test_f1: 0.5769
 epoch: 12, train_loss: 0.8551, test_loss: 1.1832, test_f1: 0.6017
 epoch: 13, train_loss: 0.8585, test_loss: 1.2053, test_f1: 0.5845
 epoch: 14, train_loss: 0.8434, test_loss: 1.1825, test_f1: 0.5437
 epoch: 15, train_loss: 0.8141, test_loss: 1.1262, test_f1: 0.5732
 epoch: 16, train_loss: 0.7757, test_loss: 1.2163, test_f1: 0.5821
 epoch: 17, train_loss: 0.7830, test_loss: 1.2344, test_f1: 0.5706
 epoch: 18, train_loss: 0.7849, test_loss: 1.0844, test_f1: 0.5745
 epoch: 19, train_loss: 0.7462, test_loss: 1.1427, test_f1: 0.6153
 epoch: 20, train_loss: 0.7531, test_loss: 1.2160, test_f1: 0.5955
 epoch: 21, train_loss: 0.7455, test_loss: 1.2487, test_f1: 0.5620
 epoch: 22, train_loss: 0.7556, test_loss: 1.2618, test_f1: 0.5932
 epoch: 23, train_loss: 0.7361, test_loss: 1.1752, test_f1: 0.6180
 epoch: 24, train_loss: 0.7133, test_loss: 1.3721, test_f1: 0.5732
 epoch: 25, train_loss: 0.6926, test_loss: 1.2756, test_f1: 0.6063
 epoch: 26, train_loss: 0.6790, test_loss: 1.3523, test_f1: 0.6211
 epoch: 27, train_loss: 0.6794, test_loss: 1.2776, test_f1: 0.6192
 epoch: 28, train_loss: 0.6547, test_loss: 1.3671, test_f1: 0.6005
 epoch: 29, train_loss: 0.6655, test_loss: 1.3461, test_f1: 0.5844
 epoch: 30, train_loss: 0.6455, test_loss: 1.3687, test_f1: 0.6167
 epoch: 31, train_loss: 0.6511, test_loss: 1.4549, test_f1: 0.6060
 epoch: 32, train_loss: 0.6262, test_loss: 1.4012, test_f1: 0.5958
 epoch: 33, train_loss: 0.6213, test_loss: 1.3611, test_f1: 0.6318
 epoch: 34, train_loss: 0.6249, test_loss: 1.6719, test_f1: 0.5567
 epoch: 35, train_loss: 0.6164, test_loss: 1.3853, test_f1: 0.6036
 epoch: 36, train_loss: 0.6630, test_loss: 1.3625, test_f1: 0.6094
 epoch: 37, train_loss: 0.5816, test_loss: 1.4567, test_f1: 0.5963
 epoch: 38, train_loss: 0.5670, test_loss: 1.4166, test_f1: 0.5767
 epoch: 39, train_loss: 0.5775, test_loss: 1.6130, test_f1: 0.6608
 epoch: 40, train_loss: 0.5675, test_loss: 1.5600, test_f1: 0.6236
 epoch: 41, train_loss: 0.5510, test_loss: 1.5601, test_f1: 0.6040
 epoch: 42, train_loss: 0.5496, test_loss: 1.4703, test_f1: 0.6173
 epoch: 43, train_loss: 0.5569, test_loss: 1.6998, test_f1: 0.5473
 epoch: 44, train_loss: 0.5334, test_loss: 1.6269, test_f1: 0.5701
 epoch: 45, train_loss: 0.5351, test_loss: 1.4306, test_f1: 0.6195
 epoch: 46, train_loss: 0.5234, test_loss: 1.5755, test_f1: 0.6109
 epoch: 47, train_loss: 0.5130, test_loss: 1.8225, test_f1: 0.5483
 epoch: 48, train_loss: 0.5434, test_loss: 1.6059, test_f1: 0.6081
 epoch: 49, train_loss: 0.5500, test_loss: 1.6801, test_f1: 0.5573
 epoch: 50, train_loss: 0.5271, test_loss: 1.6541, test_f1: 0.5875
 epoch: 51, train_loss: 0.4803, test_loss: 1.6302, test_f1: 0.6020
 epoch: 52, train_loss: 0.4626, test_loss: 1.7466, test_f1: 0.5925
 epoch: 53, train_loss: 0.4787, test_loss: 1.6341, test_f1: 0.6003
 epoch: 54, train_loss: 0.4560, test_loss: 1.6810, test_f1: 0.5641
 epoch: 55, train_loss: 0.4490, test_loss: 1.7398, test_f1: 0.5945
 epoch: 56, train_loss: 0.4149, test_loss: 1.7798, test_f1: 0.5949
 epoch: 57, train_loss: 0.4317, test_loss: 1.7544, test_f1: 0.6136
 epoch: 58, train_loss: 0.4249, test_loss: 1.8439, test_f1: 0.5679
 epoch: 59, train_loss: 0.4005, test_loss: 1.8380, test_f1: 0.5913
 epoch: 60, train_loss: 0.4281, test_loss: 1.8053, test_f1: 0.5698
 epoch: 61, train_loss: 0.4232, test_loss: 1.9360, test_f1: 0.6008
 epoch: 62, train_loss: 0.4287, test_loss: 1.8832, test_f1: 0.6236
 epoch: 63, train_loss: 0.4043, test_loss: 1.8780, test_f1: 0.5675
 epoch: 64, train_loss: 0.3986, test_loss: 1.8455, test_f1: 0.6006
 epoch: 65, train_loss: 0.3837, test_loss: 1.9826, test_f1: 0.6096
 epoch: 66, train_loss: 0.4004, test_loss: 1.9476, test_f1: 0.5847
 epoch: 67, train_loss: 0.3925, test_loss: 2.0157, test_f1: 0.5705
 epoch: 68, train_loss: 0.4097, test_loss: 2.0524, test_f1: 0.5865
 epoch: 69, train_loss: 0.3846, test_loss: 1.9641, test_f1: 0.6002
 epoch: 70, train_loss: 0.3922, test_loss: 2.1351, test_f1: 0.5340
 epoch: 71, train_loss: 0.3861, test_loss: 1.9484, test_f1: 0.6113
 epoch: 72, train_loss: 0.4407, test_loss: 1.9752, test_f1: 0.5832
 epoch: 73, train_loss: 0.3982, test_loss: 1.9837, test_f1: 0.5696
 epoch: 74, train_loss: 0.3854, test_loss: 2.0873, test_f1: 0.5590
 epoch: 75, train_loss: 0.3699, test_loss: 2.0624, test_f1: 0.6024
 epoch: 76, train_loss: 0.3596, test_loss: 2.0416, test_f1: 0.5784
 epoch: 77, train_loss: 0.3594, test_loss: 2.0456, test_f1: 0.5942
 epoch: 78, train_loss: 0.3297, test_loss: 2.1050, test_f1: 0.5553
 epoch: 79, train_loss: 0.3526, test_loss: 2.2506, test_f1: 0.5432
 epoch: 80, train_loss: 0.3470, test_loss: 2.0286, test_f1: 0.5770
 epoch: 81, train_loss: 0.3215, test_loss: 2.1385, test_f1: 0.5745
 epoch: 82, train_loss: 0.3248, test_loss: 2.1372, test_f1: 0.5699
 epoch: 83, train_loss: 0.3413, test_loss: 2.1459, test_f1: 0.6329
 epoch: 84, train_loss: 0.3491, test_loss: 2.1473, test_f1: 0.5650
 epoch: 85, train_loss: 0.3374, test_loss: 2.1764, test_f1: 0.5750
 epoch: 86, train_loss: 0.3365, test_loss: 2.2155, test_f1: 0.6051
 epoch: 87, train_loss: 0.3394, test_loss: 2.3691, test_f1: 0.5651
 epoch: 88, train_loss: 0.3184, test_loss: 2.2760, test_f1: 0.5803
 epoch: 89, train_loss: 0.3083, test_loss: 2.1886, test_f1: 0.6279
 epoch: 90, train_loss: 0.3207, test_loss: 2.1304, test_f1: 0.5800
 epoch: 91, train_loss: 0.3495, test_loss: 2.2511, test_f1: 0.6051
 epoch: 92, train_loss: 0.3408, test_loss: 2.1298, test_f1: 0.6133
 epoch: 93, train_loss: 0.3216, test_loss: 2.3437, test_f1: 0.5820
 epoch: 94, train_loss: 0.3380, test_loss: 2.3709, test_f1: 0.5508
 epoch: 95, train_loss: 0.3401, test_loss: 2.2179, test_f1: 0.6235
 epoch: 96, train_loss: 0.3384, test_loss: 2.0801, test_f1: 0.5934
 epoch: 97, train_loss: 0.3046, test_loss: 2.1975, test_f1: 0.5995
 epoch: 98, train_loss: 0.3118, test_loss: 2.2699, test_f1: 0.5735
 epoch: 99, train_loss: 0.3045, test_loss: 2.2185, test_f1: 0.6007
##################ITERATION #7 ****************************************
 epoch: 0, train_loss: 1.4392, test_loss: 1.3256, test_f1: 0.2754
 epoch: 1, train_loss: 1.1872, test_loss: 1.3183, test_f1: 0.4192
 epoch: 2, train_loss: 1.0732, test_loss: 1.2325, test_f1: 0.4639
 epoch: 3, train_loss: 1.0341, test_loss: 1.2708, test_f1: 0.5143
 epoch: 4, train_loss: 0.9984, test_loss: 1.4619, test_f1: 0.5293
 epoch: 5, train_loss: 0.9532, test_loss: 1.4430, test_f1: 0.5421
 epoch: 6, train_loss: 0.9387, test_loss: 1.4984, test_f1: 0.5654
 epoch: 7, train_loss: 0.9272, test_loss: 1.4763, test_f1: 0.5255
 epoch: 8, train_loss: 0.8973, test_loss: 1.3455, test_f1: 0.5243
 epoch: 9, train_loss: 0.8773, test_loss: 1.4372, test_f1: 0.5631
 epoch: 10, train_loss: 0.8555, test_loss: 1.2441, test_f1: 0.5533
 epoch: 11, train_loss: 0.8670, test_loss: 1.1366, test_f1: 0.6018
 epoch: 12, train_loss: 0.8560, test_loss: 1.4389, test_f1: 0.5978
 epoch: 13, train_loss: 0.8334, test_loss: 1.5187, test_f1: 0.5543
 epoch: 14, train_loss: 0.8042, test_loss: 1.2948, test_f1: 0.5665
 epoch: 15, train_loss: 0.8103, test_loss: 1.4114, test_f1: 0.5615
 epoch: 16, train_loss: 0.8077, test_loss: 1.2456, test_f1: 0.5824
 epoch: 17, train_loss: 0.7822, test_loss: 1.4968, test_f1: 0.5097
 epoch: 18, train_loss: 0.7846, test_loss: 1.5129, test_f1: 0.5416
 epoch: 19, train_loss: 0.7776, test_loss: 1.7257, test_f1: 0.5176
 epoch: 20, train_loss: 0.7551, test_loss: 1.2047, test_f1: 0.5878
 epoch: 21, train_loss: 0.7554, test_loss: 1.2157, test_f1: 0.5940
 epoch: 22, train_loss: 0.7404, test_loss: 1.3371, test_f1: 0.5966
 epoch: 23, train_loss: 0.7327, test_loss: 1.3874, test_f1: 0.5588
 epoch: 24, train_loss: 0.7290, test_loss: 1.3139, test_f1: 0.5838
 epoch: 25, train_loss: 0.7308, test_loss: 1.2706, test_f1: 0.5758
 epoch: 26, train_loss: 0.7092, test_loss: 1.3559, test_f1: 0.6096
 epoch: 27, train_loss: 0.7272, test_loss: 1.3988, test_f1: 0.5887
 epoch: 28, train_loss: 0.6836, test_loss: 1.2888, test_f1: 0.5794
 epoch: 29, train_loss: 0.6748, test_loss: 1.3317, test_f1: 0.5876
 epoch: 30, train_loss: 0.6588, test_loss: 1.3783, test_f1: 0.5921
 epoch: 31, train_loss: 0.6702, test_loss: 1.4205, test_f1: 0.5529
 epoch: 32, train_loss: 0.6894, test_loss: 1.5490, test_f1: 0.5387
 epoch: 33, train_loss: 0.6617, test_loss: 1.5791, test_f1: 0.4954
 epoch: 34, train_loss: 0.6669, test_loss: 1.4587, test_f1: 0.5471
 epoch: 35, train_loss: 0.6471, test_loss: 1.5931, test_f1: 0.5682
 epoch: 36, train_loss: 0.6228, test_loss: 1.6868, test_f1: 0.5730
 epoch: 37, train_loss: 0.6388, test_loss: 1.7626, test_f1: 0.5441
 epoch: 38, train_loss: 0.6076, test_loss: 1.6336, test_f1: 0.5434
 epoch: 39, train_loss: 0.6050, test_loss: 1.7460, test_f1: 0.5418
 epoch: 40, train_loss: 0.6172, test_loss: 1.5991, test_f1: 0.5535
 epoch: 41, train_loss: 0.6174, test_loss: 1.5717, test_f1: 0.5700
 epoch: 42, train_loss: 0.6185, test_loss: 1.6295, test_f1: 0.5948
 epoch: 43, train_loss: 0.6178, test_loss: 1.8209, test_f1: 0.5639
 epoch: 44, train_loss: 0.5923, test_loss: 1.6931, test_f1: 0.5649
 epoch: 45, train_loss: 0.5553, test_loss: 1.6682, test_f1: 0.5687
 epoch: 46, train_loss: 0.5622, test_loss: 1.7425, test_f1: 0.5650
 epoch: 47, train_loss: 0.5398, test_loss: 1.8195, test_f1: 0.5614
 epoch: 48, train_loss: 0.5370, test_loss: 2.0718, test_f1: 0.5575
 epoch: 49, train_loss: 0.5202, test_loss: 1.9439, test_f1: 0.5708
 epoch: 50, train_loss: 0.5335, test_loss: 2.0371, test_f1: 0.5632
 epoch: 51, train_loss: 0.5152, test_loss: 2.0684, test_f1: 0.5617
 epoch: 52, train_loss: 0.5024, test_loss: 2.0335, test_f1: 0.5679
 epoch: 53, train_loss: 0.4940, test_loss: 2.1206, test_f1: 0.5599
 epoch: 54, train_loss: 0.4826, test_loss: 2.1586, test_f1: 0.5768
 epoch: 55, train_loss: 0.4647, test_loss: 2.2261, test_f1: 0.5802
 epoch: 56, train_loss: 0.4580, test_loss: 2.1536, test_f1: 0.5800
 epoch: 57, train_loss: 0.4785, test_loss: 2.2407, test_f1: 0.5618
 epoch: 58, train_loss: 0.4657, test_loss: 2.3003, test_f1: 0.5878
 epoch: 59, train_loss: 0.4681, test_loss: 2.2386, test_f1: 0.5827
 epoch: 60, train_loss: 0.4676, test_loss: 2.2648, test_f1: 0.5860
 epoch: 61, train_loss: 0.4363, test_loss: 2.1052, test_f1: 0.6030
 epoch: 62, train_loss: 0.4626, test_loss: 2.2096, test_f1: 0.5874
 epoch: 63, train_loss: 0.4991, test_loss: 2.1557, test_f1: 0.6031
 epoch: 64, train_loss: 0.4627, test_loss: 2.2441, test_f1: 0.5886
 epoch: 65, train_loss: 0.4685, test_loss: 2.3194, test_f1: 0.5765
 epoch: 66, train_loss: 0.4465, test_loss: 2.1861, test_f1: 0.5833
 epoch: 67, train_loss: 0.4429, test_loss: 2.2501, test_f1: 0.5906
 epoch: 68, train_loss: 0.4119, test_loss: 2.3834, test_f1: 0.5771
 epoch: 69, train_loss: 0.4098, test_loss: 2.4842, test_f1: 0.5876
 epoch: 70, train_loss: 0.4061, test_loss: 2.3925, test_f1: 0.5967
 epoch: 71, train_loss: 0.3989, test_loss: 2.5234, test_f1: 0.5817
 epoch: 72, train_loss: 0.4206, test_loss: 2.4175, test_f1: 0.5932
 epoch: 73, train_loss: 0.4119, test_loss: 2.6635, test_f1: 0.5819
 epoch: 74, train_loss: 0.3932, test_loss: 2.5572, test_f1: 0.5978
 epoch: 75, train_loss: 0.3649, test_loss: 2.4222, test_f1: 0.5987
 epoch: 76, train_loss: 0.3715, test_loss: 2.6789, test_f1: 0.5617
 epoch: 77, train_loss: 0.3841, test_loss: 2.5450, test_f1: 0.5759
 epoch: 78, train_loss: 0.3657, test_loss: 2.3760, test_f1: 0.5926
 epoch: 79, train_loss: 0.3752, test_loss: 2.6939, test_f1: 0.5573
 epoch: 80, train_loss: 0.3805, test_loss: 2.5832, test_f1: 0.5632
 epoch: 81, train_loss: 0.3749, test_loss: 2.4971, test_f1: 0.5749
 epoch: 82, train_loss: 0.3543, test_loss: 2.6821, test_f1: 0.5891
 epoch: 83, train_loss: 0.3649, test_loss: 2.8234, test_f1: 0.5734
 epoch: 84, train_loss: 0.3374, test_loss: 2.5356, test_f1: 0.5683
 epoch: 85, train_loss: 0.3667, test_loss: 3.0700, test_f1: 0.5965
 epoch: 86, train_loss: 0.3563, test_loss: 2.9746, test_f1: 0.5815
 epoch: 87, train_loss: 0.3516, test_loss: 2.9059, test_f1: 0.5827
 epoch: 88, train_loss: 0.4001, test_loss: 2.9355, test_f1: 0.5770
 epoch: 89, train_loss: 0.3371, test_loss: 2.8148, test_f1: 0.5884
 epoch: 90, train_loss: 0.3421, test_loss: 2.8367, test_f1: 0.5897
 epoch: 91, train_loss: 0.3279, test_loss: 2.8027, test_f1: 0.5691
 epoch: 92, train_loss: 0.3317, test_loss: 2.7748, test_f1: 0.5618
 epoch: 93, train_loss: 0.3510, test_loss: 2.9577, test_f1: 0.5791
 epoch: 94, train_loss: 0.3471, test_loss: 3.3892, test_f1: 0.5751
 epoch: 95, train_loss: 0.3584, test_loss: 2.8038, test_f1: 0.5867
 epoch: 96, train_loss: 0.3605, test_loss: 2.5366, test_f1: 0.5831
 epoch: 97, train_loss: 0.3303, test_loss: 2.8964, test_f1: 0.5859
 epoch: 98, train_loss: 0.3217, test_loss: 2.9473, test_f1: 0.5792
 epoch: 99, train_loss: 0.3167, test_loss: 2.9865, test_f1: 0.5969
##################ITERATION #8 ****************************************
 epoch: 0, train_loss: 1.5138, test_loss: 1.3174, test_f1: 0.3526
 epoch: 1, train_loss: 1.2166, test_loss: 1.3161, test_f1: 0.3827
 epoch: 2, train_loss: 1.1542, test_loss: 1.2429, test_f1: 0.5386
 epoch: 3, train_loss: 1.0995, test_loss: 1.1852, test_f1: 0.5727
 epoch: 4, train_loss: 1.0423, test_loss: 1.1081, test_f1: 0.5410
 epoch: 5, train_loss: 0.9900, test_loss: 1.1153, test_f1: 0.5389
 epoch: 6, train_loss: 0.9845, test_loss: 1.1448, test_f1: 0.5360
 epoch: 7, train_loss: 0.9642, test_loss: 1.1416, test_f1: 0.5726
 epoch: 8, train_loss: 0.9300, test_loss: 1.1105, test_f1: 0.5985
 epoch: 9, train_loss: 0.9162, test_loss: 1.1098, test_f1: 0.5531
 epoch: 10, train_loss: 0.9082, test_loss: 1.1191, test_f1: 0.6005
 epoch: 11, train_loss: 0.8700, test_loss: 1.1421, test_f1: 0.5605
 epoch: 12, train_loss: 0.8723, test_loss: 1.1428, test_f1: 0.5970
 epoch: 13, train_loss: 0.8609, test_loss: 1.1578, test_f1: 0.5337
 epoch: 14, train_loss: 0.8665, test_loss: 1.1278, test_f1: 0.5746
 epoch: 15, train_loss: 0.8382, test_loss: 1.2087, test_f1: 0.5776
 epoch: 16, train_loss: 0.8060, test_loss: 1.0865, test_f1: 0.5961
 epoch: 17, train_loss: 0.8010, test_loss: 1.0610, test_f1: 0.5982
 epoch: 18, train_loss: 0.8111, test_loss: 1.0837, test_f1: 0.6086
 epoch: 19, train_loss: 0.7812, test_loss: 1.0436, test_f1: 0.6135
 epoch: 20, train_loss: 0.7664, test_loss: 1.0626, test_f1: 0.6498
 epoch: 21, train_loss: 0.7452, test_loss: 1.1059, test_f1: 0.5710
 epoch: 22, train_loss: 0.7591, test_loss: 1.0757, test_f1: 0.5761
 epoch: 23, train_loss: 0.7355, test_loss: 1.1100, test_f1: 0.5651
 epoch: 24, train_loss: 0.7389, test_loss: 1.0183, test_f1: 0.6146
 epoch: 25, train_loss: 0.7222, test_loss: 1.2431, test_f1: 0.5388
 epoch: 26, train_loss: 0.7251, test_loss: 1.1170, test_f1: 0.6068
 epoch: 27, train_loss: 0.7260, test_loss: 1.0886, test_f1: 0.6515
 epoch: 28, train_loss: 0.7067, test_loss: 1.1099, test_f1: 0.5904
 epoch: 29, train_loss: 0.7115, test_loss: 1.2363, test_f1: 0.5549
 epoch: 30, train_loss: 0.6782, test_loss: 1.2133, test_f1: 0.5935
 epoch: 31, train_loss: 0.6777, test_loss: 1.1232, test_f1: 0.5952
 epoch: 32, train_loss: 0.6612, test_loss: 1.4913, test_f1: 0.4792
 epoch: 33, train_loss: 0.6785, test_loss: 1.2197, test_f1: 0.5757
 epoch: 34, train_loss: 0.6413, test_loss: 1.2140, test_f1: 0.5861
 epoch: 35, train_loss: 0.6614, test_loss: 1.2958, test_f1: 0.5753
 epoch: 36, train_loss: 0.6476, test_loss: 1.2950, test_f1: 0.5370
 epoch: 37, train_loss: 0.6299, test_loss: 1.1561, test_f1: 0.5251
 epoch: 38, train_loss: 0.6365, test_loss: 1.3936, test_f1: 0.5403
 epoch: 39, train_loss: 0.6323, test_loss: 1.3621, test_f1: 0.5570
 epoch: 40, train_loss: 0.6155, test_loss: 1.1855, test_f1: 0.5705
 epoch: 41, train_loss: 0.5983, test_loss: 1.2926, test_f1: 0.5733
 epoch: 42, train_loss: 0.5880, test_loss: 1.2465, test_f1: 0.5697
 epoch: 43, train_loss: 0.5781, test_loss: 1.3005, test_f1: 0.5630
 epoch: 44, train_loss: 0.5577, test_loss: 1.4134, test_f1: 0.5686
 epoch: 45, train_loss: 0.5520, test_loss: 1.3222, test_f1: 0.5599
 epoch: 46, train_loss: 0.5411, test_loss: 1.3812, test_f1: 0.5658
 epoch: 47, train_loss: 0.5690, test_loss: 1.3736, test_f1: 0.5626
 epoch: 48, train_loss: 0.5624, test_loss: 1.5146, test_f1: 0.4984
 epoch: 49, train_loss: 0.5662, test_loss: 1.4860, test_f1: 0.5598
 epoch: 50, train_loss: 0.5215, test_loss: 1.4384, test_f1: 0.5567
 epoch: 51, train_loss: 0.5248, test_loss: 1.4485, test_f1: 0.5801
 epoch: 52, train_loss: 0.4825, test_loss: 1.4698, test_f1: 0.5479
 epoch: 53, train_loss: 0.4735, test_loss: 1.4716, test_f1: 0.5684
 epoch: 54, train_loss: 0.4845, test_loss: 1.4583, test_f1: 0.5890
 epoch: 55, train_loss: 0.4933, test_loss: 1.4392, test_f1: 0.5484
 epoch: 56, train_loss: 0.4906, test_loss: 1.5920, test_f1: 0.5209
 epoch: 57, train_loss: 0.4791, test_loss: 1.5154, test_f1: 0.5756
 epoch: 58, train_loss: 0.4722, test_loss: 1.5455, test_f1: 0.5462
 epoch: 59, train_loss: 0.4479, test_loss: 1.4654, test_f1: 0.5831
 epoch: 60, train_loss: 0.4341, test_loss: 1.5049, test_f1: 0.5744
 epoch: 61, train_loss: 0.4445, test_loss: 1.5858, test_f1: 0.5613
 epoch: 62, train_loss: 0.4473, test_loss: 1.5979, test_f1: 0.5467
 epoch: 63, train_loss: 0.4602, test_loss: 1.5017, test_f1: 0.5663
 epoch: 64, train_loss: 0.4539, test_loss: 1.5787, test_f1: 0.6038
 epoch: 65, train_loss: 0.4379, test_loss: 1.5347, test_f1: 0.5760
 epoch: 66, train_loss: 0.4443, test_loss: 1.5770, test_f1: 0.5664
 epoch: 67, train_loss: 0.4285, test_loss: 1.6145, test_f1: 0.5414
 epoch: 68, train_loss: 0.4411, test_loss: 1.6223, test_f1: 0.5691
 epoch: 69, train_loss: 0.4267, test_loss: 1.6246, test_f1: 0.5575
 epoch: 70, train_loss: 0.4266, test_loss: 1.6483, test_f1: 0.5780
 epoch: 71, train_loss: 0.4304, test_loss: 1.6584, test_f1: 0.5942
 epoch: 72, train_loss: 0.4322, test_loss: 1.6702, test_f1: 0.5745
 epoch: 73, train_loss: 0.3918, test_loss: 1.7210, test_f1: 0.5698
 epoch: 74, train_loss: 0.3787, test_loss: 1.8046, test_f1: 0.5637
 epoch: 75, train_loss: 0.3787, test_loss: 1.7495, test_f1: 0.5543
 epoch: 76, train_loss: 0.4079, test_loss: 1.8531, test_f1: 0.5399
 epoch: 77, train_loss: 0.4016, test_loss: 1.7343, test_f1: 0.5351
 epoch: 78, train_loss: 0.4074, test_loss: 1.7184, test_f1: 0.5463
 epoch: 79, train_loss: 0.3966, test_loss: 1.5356, test_f1: 0.5745
 epoch: 80, train_loss: 0.3882, test_loss: 1.7501, test_f1: 0.5631
 epoch: 81, train_loss: 0.3925, test_loss: 1.6832, test_f1: 0.5565
 epoch: 82, train_loss: 0.3821, test_loss: 1.8328, test_f1: 0.5204
 epoch: 83, train_loss: 0.4052, test_loss: 1.7733, test_f1: 0.5746
 epoch: 84, train_loss: 0.3824, test_loss: 1.8873, test_f1: 0.5490
 epoch: 85, train_loss: 0.3582, test_loss: 1.7352, test_f1: 0.6089
 epoch: 86, train_loss: 0.3741, test_loss: 1.7931, test_f1: 0.6010
 epoch: 87, train_loss: 0.3829, test_loss: 1.8202, test_f1: 0.5599
 epoch: 88, train_loss: 0.3578, test_loss: 1.7288, test_f1: 0.5573
 epoch: 89, train_loss: 0.3963, test_loss: 1.9307, test_f1: 0.5508
 epoch: 90, train_loss: 0.3828, test_loss: 1.7921, test_f1: 0.5661
 epoch: 91, train_loss: 0.3530, test_loss: 1.8310, test_f1: 0.5710
 epoch: 92, train_loss: 0.3578, test_loss: 1.7377, test_f1: 0.5746
 epoch: 93, train_loss: 0.3545, test_loss: 1.7683, test_f1: 0.5781
 epoch: 94, train_loss: 0.3569, test_loss: 1.7824, test_f1: 0.5781
 epoch: 95, train_loss: 0.3486, test_loss: 1.8357, test_f1: 0.5646
 epoch: 96, train_loss: 0.3330, test_loss: 1.9826, test_f1: 0.5854
 epoch: 97, train_loss: 0.3207, test_loss: 1.9649, test_f1: 0.5707
 epoch: 98, train_loss: 0.3509, test_loss: 1.8906, test_f1: 0.5763
 epoch: 99, train_loss: 0.3951, test_loss: 1.7769, test_f1: 0.5865
##################ITERATION #9 ****************************************
 epoch: 0, train_loss: 1.5149, test_loss: 1.4286, test_f1: 0.2152
 epoch: 1, train_loss: 1.2082, test_loss: 1.3545, test_f1: 0.3103
 epoch: 2, train_loss: 1.1541, test_loss: 1.3058, test_f1: 0.4350
 epoch: 3, train_loss: 1.1068, test_loss: 1.2206, test_f1: 0.5141
 epoch: 4, train_loss: 1.0528, test_loss: 1.2062, test_f1: 0.5322
 epoch: 5, train_loss: 1.0203, test_loss: 1.1540, test_f1: 0.5194
 epoch: 6, train_loss: 1.0158, test_loss: 1.1508, test_f1: 0.5416
 epoch: 7, train_loss: 0.9952, test_loss: 1.1909, test_f1: 0.5272
 epoch: 8, train_loss: 0.9538, test_loss: 1.1997, test_f1: 0.5005
 epoch: 9, train_loss: 0.9509, test_loss: 1.2059, test_f1: 0.5235
 epoch: 10, train_loss: 0.9274, test_loss: 1.1853, test_f1: 0.5368
 epoch: 11, train_loss: 0.9167, test_loss: 1.1763, test_f1: 0.5955
 epoch: 12, train_loss: 0.9013, test_loss: 1.1798, test_f1: 0.5887
 epoch: 13, train_loss: 0.8734, test_loss: 1.1060, test_f1: 0.6059
 epoch: 14, train_loss: 0.8583, test_loss: 1.1427, test_f1: 0.5714
 epoch: 15, train_loss: 0.8492, test_loss: 1.0839, test_f1: 0.6259
 epoch: 16, train_loss: 0.8306, test_loss: 1.1500, test_f1: 0.5875
 epoch: 17, train_loss: 0.8472, test_loss: 1.1743, test_f1: 0.5838
 epoch: 18, train_loss: 0.8150, test_loss: 1.1019, test_f1: 0.5856
 epoch: 19, train_loss: 0.8068, test_loss: 1.1492, test_f1: 0.5572
 epoch: 20, train_loss: 0.8203, test_loss: 1.1196, test_f1: 0.5887
 epoch: 21, train_loss: 0.7941, test_loss: 1.0949, test_f1: 0.5925
 epoch: 22, train_loss: 0.7694, test_loss: 1.1948, test_f1: 0.5865
 epoch: 23, train_loss: 0.7404, test_loss: 1.0905, test_f1: 0.5895
 epoch: 24, train_loss: 0.7443, test_loss: 1.1476, test_f1: 0.5919
 epoch: 25, train_loss: 0.7056, test_loss: 1.2050, test_f1: 0.5873
 epoch: 26, train_loss: 0.7451, test_loss: 1.1986, test_f1: 0.6002
 epoch: 27, train_loss: 0.7500, test_loss: 1.2022, test_f1: 0.5819
 epoch: 28, train_loss: 0.7086, test_loss: 1.1328, test_f1: 0.5978
 epoch: 29, train_loss: 0.6775, test_loss: 1.2219, test_f1: 0.5847
 epoch: 30, train_loss: 0.6857, test_loss: 1.1829, test_f1: 0.5661
 epoch: 31, train_loss: 0.7037, test_loss: 1.2180, test_f1: 0.5900
 epoch: 32, train_loss: 0.6838, test_loss: 1.1933, test_f1: 0.6062
 epoch: 33, train_loss: 0.6532, test_loss: 1.2401, test_f1: 0.5747
 epoch: 34, train_loss: 0.6320, test_loss: 1.2653, test_f1: 0.5773
 epoch: 35, train_loss: 0.6244, test_loss: 1.2993, test_f1: 0.6286
 epoch: 36, train_loss: 0.6284, test_loss: 1.3651, test_f1: 0.5805
 epoch: 37, train_loss: 0.6021, test_loss: 1.2873, test_f1: 0.5825
 epoch: 38, train_loss: 0.5861, test_loss: 1.4129, test_f1: 0.5510
 epoch: 39, train_loss: 0.5810, test_loss: 1.3408, test_f1: 0.6247
 epoch: 40, train_loss: 0.6026, test_loss: 1.5008, test_f1: 0.6283
 epoch: 41, train_loss: 0.6089, test_loss: 1.3289, test_f1: 0.5939
 epoch: 42, train_loss: 0.5791, test_loss: 1.3177, test_f1: 0.6196
 epoch: 43, train_loss: 0.5872, test_loss: 1.3447, test_f1: 0.5881
 epoch: 44, train_loss: 0.5670, test_loss: 1.3688, test_f1: 0.6399
 epoch: 45, train_loss: 0.5511, test_loss: 1.3046, test_f1: 0.6090
 epoch: 46, train_loss: 0.5342, test_loss: 1.2969, test_f1: 0.6147
 epoch: 47, train_loss: 0.5274, test_loss: 1.5320, test_f1: 0.5711
 epoch: 48, train_loss: 0.5489, test_loss: 1.5354, test_f1: 0.5231
 epoch: 49, train_loss: 0.5247, test_loss: 1.4907, test_f1: 0.6135
 epoch: 50, train_loss: 0.5341, test_loss: 1.4544, test_f1: 0.6001
 epoch: 51, train_loss: 0.5129, test_loss: 1.3904, test_f1: 0.6306
 epoch: 52, train_loss: 0.4788, test_loss: 1.4034, test_f1: 0.6529
 epoch: 53, train_loss: 0.4639, test_loss: 1.5104, test_f1: 0.6066
 epoch: 54, train_loss: 0.4674, test_loss: 1.3925, test_f1: 0.6161
 epoch: 55, train_loss: 0.4581, test_loss: 1.3361, test_f1: 0.6203
 epoch: 56, train_loss: 0.4545, test_loss: 1.5053, test_f1: 0.6020
 epoch: 57, train_loss: 0.4398, test_loss: 1.5059, test_f1: 0.5942
 epoch: 58, train_loss: 0.4471, test_loss: 1.4101, test_f1: 0.6094
 epoch: 59, train_loss: 0.4681, test_loss: 1.5474, test_f1: 0.6190
 epoch: 60, train_loss: 0.4322, test_loss: 1.5151, test_f1: 0.6108
 epoch: 61, train_loss: 0.4314, test_loss: 1.4592, test_f1: 0.6343
 epoch: 62, train_loss: 0.4339, test_loss: 1.4228, test_f1: 0.6240
 epoch: 63, train_loss: 0.4451, test_loss: 1.4342, test_f1: 0.6316
 epoch: 64, train_loss: 0.4236, test_loss: 1.4920, test_f1: 0.6591
 epoch: 65, train_loss: 0.4126, test_loss: 1.5307, test_f1: 0.6225
 epoch: 66, train_loss: 0.4101, test_loss: 1.5714, test_f1: 0.6287
 epoch: 67, train_loss: 0.4194, test_loss: 1.6927, test_f1: 0.6130
 epoch: 68, train_loss: 0.3980, test_loss: 1.5204, test_f1: 0.6021
 epoch: 69, train_loss: 0.4091, test_loss: 1.5089, test_f1: 0.6057
 epoch: 70, train_loss: 0.4057, test_loss: 1.6813, test_f1: 0.6023
 epoch: 71, train_loss: 0.3793, test_loss: 1.5371, test_f1: 0.6021
 epoch: 72, train_loss: 0.3788, test_loss: 1.5409, test_f1: 0.6172
 epoch: 73, train_loss: 0.3898, test_loss: 1.6548, test_f1: 0.6112
 epoch: 74, train_loss: 0.3920, test_loss: 1.6940, test_f1: 0.6187
 epoch: 75, train_loss: 0.3822, test_loss: 1.6434, test_f1: 0.6296
 epoch: 76, train_loss: 0.3908, test_loss: 1.6226, test_f1: 0.6154
 epoch: 77, train_loss: 0.3823, test_loss: 1.6182, test_f1: 0.6387
 epoch: 78, train_loss: 0.3784, test_loss: 1.5529, test_f1: 0.6369
 epoch: 79, train_loss: 0.3735, test_loss: 1.8820, test_f1: 0.5952
 epoch: 80, train_loss: 0.3696, test_loss: 1.6911, test_f1: 0.6252
 epoch: 81, train_loss: 0.3884, test_loss: 1.6497, test_f1: 0.6390
 epoch: 82, train_loss: 0.3687, test_loss: 1.7326, test_f1: 0.6493
 epoch: 83, train_loss: 0.3598, test_loss: 1.6939, test_f1: 0.6364
 epoch: 84, train_loss: 0.3637, test_loss: 1.7669, test_f1: 0.6161
 epoch: 85, train_loss: 0.3616, test_loss: 1.6596, test_f1: 0.6201
 epoch: 86, train_loss: 0.3904, test_loss: 1.6177, test_f1: 0.6486
 epoch: 87, train_loss: 0.3749, test_loss: 1.9125, test_f1: 0.6025
 epoch: 88, train_loss: 0.3429, test_loss: 1.6865, test_f1: 0.6492
 epoch: 89, train_loss: 0.3089, test_loss: 1.7185, test_f1: 0.6363
 epoch: 90, train_loss: 0.3380, test_loss: 1.6529, test_f1: 0.6539
 epoch: 91, train_loss: 0.3606, test_loss: 1.8112, test_f1: 0.6088
 epoch: 92, train_loss: 0.3612, test_loss: 1.7588, test_f1: 0.6366
 epoch: 93, train_loss: 0.3525, test_loss: 1.9441, test_f1: 0.6124
 epoch: 94, train_loss: 0.3669, test_loss: 1.8171, test_f1: 0.6264
 epoch: 95, train_loss: 0.3356, test_loss: 1.7181, test_f1: 0.6600
 epoch: 96, train_loss: 0.3260, test_loss: 1.7942, test_f1: 0.6224
 epoch: 97, train_loss: 0.3289, test_loss: 1.8196, test_f1: 0.6506
 epoch: 98, train_loss: 0.3368, test_loss: 1.8650, test_f1: 0.6401
 epoch: 99, train_loss: 0.3522, test_loss: 1.8702, test_f1: 0.6185

Training completed in 308.56 seconds
Best F1: 0.6608 at epoch 39
Mean F1 across iterations: 0.6289  0.0213
========================FINAL RESULTS================================
FEGIN weighted F1: 0.6608  0.0213
python main.py --data ltspice_demos --representation component_component --model FEGIN --layers 2 --hiddens 64 --batch_size 128 --lr 0.001 --emb_size 250 --epochs 100 --save_appendix component_component_L2_H64_BS128_LR0.001_E250 --no_val
-----



STDERR:
  File "main.py", line 370, in <module>
    main()
  File "main.py", line 254, in main
    dataset = dataset_class(
  File "/home/philip/projects/ltspice_examples_code_repo/Circuit-Completion-Using-GNNs/component_classification_with_link_prediction_head/evaluation/FEGIN/kernel/circuit_datasets.py", line 15, in __init__
    self.data, self.slices = torch.load(self.processed_paths[0])
  File "/home/philip/.local/lib/python3.8/site-packages/torch/serialization.py", line 1040, in load
    warnings.warn(
  File "/usr/lib/python3.8/warnings.py", line 109, in _showwarnmsg
    sw(msg.message, msg.category, msg.filename, msg.lineno,
  File "main.py", line 47, in warn_with_traceback
    traceback.print_stack(file=log)
/home/philip/projects/ltspice_examples_code_repo/Circuit-Completion-Using-GNNs/component_classification_with_link_prediction_head/evaluation/FEGIN/kernel/circuit_datasets.py:15: FutureWarning: You are using `torch.load` with `weights_only=False` (the current default value), which uses the default pickle module implicitly. It is possible to construct malicious pickle data which will execute arbitrary code during unpickling (See https://github.com/pytorch/pytorch/blob/main/SECURITY.md#untrusted-models for more details). In a future release, the default value for `weights_only` will be flipped to `True`. This limits the functions that could be executed during unpickling. Arbitrary objects will no longer be allowed to be loaded via this mode unless they are explicitly allowlisted by the user via `torch.serialization.add_safe_globals`. We recommend you start setting `weights_only=True` for any use case where you don't have full control of the loaded file. Please open an issue on GitHub for any issues related to this experimental feature.
  self.data, self.slices = torch.load(self.processed_paths[0])
