STDOUT:
Results will be saved in /home/philip/projects/ltspice_examples_code_repo/Circuit-Completion-Using-GNNs/component_classification_with_link_prediction_head/evaluation/FEGIN/results/model_FEGIN_dataset_ltspice_examples
Command line input: python main.py --data ltspice_examples --representation component_net --model FEGIN --layers 5 --hiddens 32 --batch_size 128 --lr 0.0001 --emb_size 250 --epochs 100 --save_appendix component_net_L5_H32_BS128_LR0.0001_E250 --no_val
 is saved.
-----
ltspice_examples - FEGIN
Using 5 layers, 32 hidden units, h = 2
Loading component_net representation dataset
ENTERED
Training FEGIN on component_net representation
Train: 3558, Test: 846
##################ITERATION #0 ****************************************
 epoch: 0, train_loss: 1.4192, test_loss: 1.4162, test_f1: 0.1004
 epoch: 1, train_loss: 1.4100, test_loss: 1.4047, test_f1: 0.1004
 epoch: 2, train_loss: 1.4039, test_loss: 1.3992, test_f1: 0.1117
 epoch: 3, train_loss: 1.3974, test_loss: 1.3919, test_f1: 0.1099
 epoch: 4, train_loss: 1.3915, test_loss: 1.3846, test_f1: 0.1004
 epoch: 5, train_loss: 1.3835, test_loss: 1.3762, test_f1: 0.1442
 epoch: 6, train_loss: 1.3755, test_loss: 1.3682, test_f1: 0.2201
 epoch: 7, train_loss: 1.3658, test_loss: 1.3584, test_f1: 0.2816
 epoch: 8, train_loss: 1.3561, test_loss: 1.3471, test_f1: 0.3309
 epoch: 9, train_loss: 1.3454, test_loss: 1.3366, test_f1: 0.3320
 epoch: 10, train_loss: 1.3325, test_loss: 1.3240, test_f1: 0.3356
 epoch: 11, train_loss: 1.3220, test_loss: 1.3114, test_f1: 0.3335
 epoch: 12, train_loss: 1.3072, test_loss: 1.2990, test_f1: 0.3313
 epoch: 13, train_loss: 1.2969, test_loss: 1.2865, test_f1: 0.3274
 epoch: 14, train_loss: 1.2820, test_loss: 1.2738, test_f1: 0.3232
 epoch: 15, train_loss: 1.2715, test_loss: 1.2627, test_f1: 0.3246
 epoch: 16, train_loss: 1.2543, test_loss: 1.2482, test_f1: 0.3322
 epoch: 17, train_loss: 1.2430, test_loss: 1.2373, test_f1: 0.3317
 epoch: 18, train_loss: 1.2330, test_loss: 1.2249, test_f1: 0.3398
 epoch: 19, train_loss: 1.2211, test_loss: 1.2186, test_f1: 0.3438
 epoch: 20, train_loss: 1.2118, test_loss: 1.2052, test_f1: 0.3472
 epoch: 21, train_loss: 1.1969, test_loss: 1.1929, test_f1: 0.3454
 epoch: 22, train_loss: 1.1941, test_loss: 1.1848, test_f1: 0.3645
 epoch: 23, train_loss: 1.1800, test_loss: 1.1787, test_f1: 0.3657
 epoch: 24, train_loss: 1.1727, test_loss: 1.1700, test_f1: 0.3692
 epoch: 25, train_loss: 1.1658, test_loss: 1.1607, test_f1: 0.3779
 epoch: 26, train_loss: 1.1628, test_loss: 1.1504, test_f1: 0.3942
 epoch: 27, train_loss: 1.1520, test_loss: 1.1469, test_f1: 0.4116
 epoch: 28, train_loss: 1.1429, test_loss: 1.1410, test_f1: 0.4173
 epoch: 29, train_loss: 1.1383, test_loss: 1.1356, test_f1: 0.4278
 epoch: 30, train_loss: 1.1257, test_loss: 1.1230, test_f1: 0.4459
 epoch: 31, train_loss: 1.1254, test_loss: 1.1191, test_f1: 0.4555
 epoch: 32, train_loss: 1.1236, test_loss: 1.1113, test_f1: 0.4582
 epoch: 33, train_loss: 1.1114, test_loss: 1.1032, test_f1: 0.4529
 epoch: 34, train_loss: 1.1106, test_loss: 1.0919, test_f1: 0.4645
 epoch: 35, train_loss: 1.1016, test_loss: 1.0868, test_f1: 0.4648
 epoch: 36, train_loss: 1.0944, test_loss: 1.0874, test_f1: 0.4636
 epoch: 37, train_loss: 1.0968, test_loss: 1.0724, test_f1: 0.4903
 epoch: 38, train_loss: 1.0858, test_loss: 1.0663, test_f1: 0.4947
 epoch: 39, train_loss: 1.0767, test_loss: 1.0668, test_f1: 0.4929
 epoch: 40, train_loss: 1.0681, test_loss: 1.0559, test_f1: 0.5166
 epoch: 41, train_loss: 1.0674, test_loss: 1.0450, test_f1: 0.5225
 epoch: 42, train_loss: 1.0587, test_loss: 1.0380, test_f1: 0.5144
 epoch: 43, train_loss: 1.0506, test_loss: 1.0331, test_f1: 0.5359
 epoch: 44, train_loss: 1.0488, test_loss: 1.0285, test_f1: 0.5407
 epoch: 45, train_loss: 1.0357, test_loss: 1.0228, test_f1: 0.5467
 epoch: 46, train_loss: 1.0311, test_loss: 1.0177, test_f1: 0.5345
 epoch: 47, train_loss: 1.0245, test_loss: 1.0069, test_f1: 0.5494
 epoch: 48, train_loss: 1.0224, test_loss: 1.0003, test_f1: 0.5455
 epoch: 49, train_loss: 1.0076, test_loss: 0.9951, test_f1: 0.5273
 epoch: 50, train_loss: 1.0078, test_loss: 0.9918, test_f1: 0.5332
 epoch: 51, train_loss: 1.0032, test_loss: 0.9867, test_f1: 0.5359
 epoch: 52, train_loss: 0.9983, test_loss: 0.9847, test_f1: 0.5317
 epoch: 53, train_loss: 0.9942, test_loss: 0.9776, test_f1: 0.5345
 epoch: 54, train_loss: 0.9826, test_loss: 0.9803, test_f1: 0.5163
 epoch: 55, train_loss: 0.9842, test_loss: 0.9754, test_f1: 0.5086
 epoch: 56, train_loss: 0.9894, test_loss: 0.9704, test_f1: 0.5275
 epoch: 57, train_loss: 0.9795, test_loss: 0.9697, test_f1: 0.5278
 epoch: 58, train_loss: 0.9902, test_loss: 0.9680, test_f1: 0.5285
 epoch: 59, train_loss: 0.9769, test_loss: 0.9643, test_f1: 0.5080
 epoch: 60, train_loss: 0.9749, test_loss: 0.9653, test_f1: 0.5058
 epoch: 61, train_loss: 0.9737, test_loss: 0.9600, test_f1: 0.5045
 epoch: 62, train_loss: 0.9672, test_loss: 0.9606, test_f1: 0.5048
 epoch: 63, train_loss: 0.9753, test_loss: 0.9545, test_f1: 0.5098
 epoch: 64, train_loss: 0.9722, test_loss: 0.9552, test_f1: 0.5310
 epoch: 65, train_loss: 0.9625, test_loss: 0.9522, test_f1: 0.5281
 epoch: 66, train_loss: 0.9590, test_loss: 0.9475, test_f1: 0.5218
 epoch: 67, train_loss: 0.9601, test_loss: 0.9496, test_f1: 0.5100
 epoch: 68, train_loss: 0.9536, test_loss: 0.9462, test_f1: 0.5135
 epoch: 69, train_loss: 0.9632, test_loss: 0.9401, test_f1: 0.5171
 epoch: 70, train_loss: 0.9575, test_loss: 0.9427, test_f1: 0.5396
 epoch: 71, train_loss: 0.9582, test_loss: 0.9408, test_f1: 0.5389
 epoch: 72, train_loss: 0.9483, test_loss: 0.9357, test_f1: 0.5290
 epoch: 73, train_loss: 0.9474, test_loss: 0.9339, test_f1: 0.5440
 epoch: 74, train_loss: 0.9456, test_loss: 0.9348, test_f1: 0.5271
 epoch: 75, train_loss: 0.9484, test_loss: 0.9335, test_f1: 0.5395
 epoch: 76, train_loss: 0.9366, test_loss: 0.9304, test_f1: 0.5267
 epoch: 77, train_loss: 0.9316, test_loss: 0.9280, test_f1: 0.5280
 epoch: 78, train_loss: 0.9324, test_loss: 0.9284, test_f1: 0.5275
 epoch: 79, train_loss: 0.9352, test_loss: 0.9314, test_f1: 0.5215
 epoch: 80, train_loss: 0.9315, test_loss: 0.9263, test_f1: 0.5246
 epoch: 81, train_loss: 0.9240, test_loss: 0.9201, test_f1: 0.5195
 epoch: 82, train_loss: 0.9351, test_loss: 0.9236, test_f1: 0.5263
 epoch: 83, train_loss: 0.9368, test_loss: 0.9266, test_f1: 0.5260
 epoch: 84, train_loss: 0.9307, test_loss: 0.9199, test_f1: 0.5192
 epoch: 85, train_loss: 0.9224, test_loss: 0.9208, test_f1: 0.5165
 epoch: 86, train_loss: 0.9245, test_loss: 0.9157, test_f1: 0.5144
 epoch: 87, train_loss: 0.9153, test_loss: 0.9219, test_f1: 0.5129
 epoch: 88, train_loss: 0.9203, test_loss: 0.9219, test_f1: 0.5143
 epoch: 89, train_loss: 0.9214, test_loss: 0.9215, test_f1: 0.5073
 epoch: 90, train_loss: 0.9168, test_loss: 0.9094, test_f1: 0.5401
 epoch: 91, train_loss: 0.9209, test_loss: 0.9191, test_f1: 0.5508
 epoch: 92, train_loss: 0.9077, test_loss: 0.9140, test_f1: 0.5352
 epoch: 93, train_loss: 0.9160, test_loss: 0.9206, test_f1: 0.5393
 epoch: 94, train_loss: 0.9067, test_loss: 0.9125, test_f1: 0.5280
 epoch: 95, train_loss: 0.9128, test_loss: 0.9065, test_f1: 0.5160
 epoch: 96, train_loss: 0.9117, test_loss: 0.9076, test_f1: 0.5268
 epoch: 97, train_loss: 0.9077, test_loss: 0.9076, test_f1: 0.5275
 epoch: 98, train_loss: 0.9051, test_loss: 0.9018, test_f1: 0.5179
 epoch: 99, train_loss: 0.9022, test_loss: 0.9106, test_f1: 0.5351
##################ITERATION #1 ****************************************
 epoch: 0, train_loss: 1.3823, test_loss: 1.3900, test_f1: 0.1004
 epoch: 1, train_loss: 1.3578, test_loss: 1.3640, test_f1: 0.1001
 epoch: 2, train_loss: 1.3422, test_loss: 1.3395, test_f1: 0.2957
 epoch: 3, train_loss: 1.3239, test_loss: 1.3189, test_f1: 0.3261
 epoch: 4, train_loss: 1.3081, test_loss: 1.3014, test_f1: 0.3426
 epoch: 5, train_loss: 1.2920, test_loss: 1.2850, test_f1: 0.3274
 epoch: 6, train_loss: 1.2813, test_loss: 1.2692, test_f1: 0.3541
 epoch: 7, train_loss: 1.2666, test_loss: 1.2514, test_f1: 0.3532
 epoch: 8, train_loss: 1.2551, test_loss: 1.2359, test_f1: 0.3469
 epoch: 9, train_loss: 1.2409, test_loss: 1.2223, test_f1: 0.3545
 epoch: 10, train_loss: 1.2322, test_loss: 1.2092, test_f1: 0.3616
 epoch: 11, train_loss: 1.2216, test_loss: 1.1947, test_f1: 0.3707
 epoch: 12, train_loss: 1.2132, test_loss: 1.1811, test_f1: 0.3814
 epoch: 13, train_loss: 1.1981, test_loss: 1.1689, test_f1: 0.3823
 epoch: 14, train_loss: 1.1929, test_loss: 1.1599, test_f1: 0.4047
 epoch: 15, train_loss: 1.1802, test_loss: 1.1465, test_f1: 0.4195
 epoch: 16, train_loss: 1.1731, test_loss: 1.1351, test_f1: 0.4317
 epoch: 17, train_loss: 1.1672, test_loss: 1.1256, test_f1: 0.4470
 epoch: 18, train_loss: 1.1573, test_loss: 1.1162, test_f1: 0.4553
 epoch: 19, train_loss: 1.1440, test_loss: 1.1070, test_f1: 0.4639
 epoch: 20, train_loss: 1.1402, test_loss: 1.0937, test_f1: 0.4559
 epoch: 21, train_loss: 1.1299, test_loss: 1.0823, test_f1: 0.4640
 epoch: 22, train_loss: 1.1234, test_loss: 1.0749, test_f1: 0.4667
 epoch: 23, train_loss: 1.1168, test_loss: 1.0654, test_f1: 0.4695
 epoch: 24, train_loss: 1.1051, test_loss: 1.0565, test_f1: 0.4708
 epoch: 25, train_loss: 1.0974, test_loss: 1.0472, test_f1: 0.4730
 epoch: 26, train_loss: 1.0851, test_loss: 1.0327, test_f1: 0.4807
 epoch: 27, train_loss: 1.0836, test_loss: 1.0292, test_f1: 0.4800
 epoch: 28, train_loss: 1.0761, test_loss: 1.0192, test_f1: 0.4871
 epoch: 29, train_loss: 1.0620, test_loss: 1.0131, test_f1: 0.4834
 epoch: 30, train_loss: 1.0574, test_loss: 0.9997, test_f1: 0.4929
 epoch: 31, train_loss: 1.0536, test_loss: 0.9977, test_f1: 0.4856
 epoch: 32, train_loss: 1.0462, test_loss: 0.9947, test_f1: 0.4858
 epoch: 33, train_loss: 1.0498, test_loss: 0.9878, test_f1: 0.4770
 epoch: 34, train_loss: 1.0331, test_loss: 0.9794, test_f1: 0.4972
 epoch: 35, train_loss: 1.0313, test_loss: 0.9777, test_f1: 0.4938
 epoch: 36, train_loss: 1.0223, test_loss: 0.9784, test_f1: 0.4917
 epoch: 37, train_loss: 1.0225, test_loss: 0.9665, test_f1: 0.5002
 epoch: 38, train_loss: 1.0161, test_loss: 0.9588, test_f1: 0.5002
 epoch: 39, train_loss: 1.0144, test_loss: 0.9568, test_f1: 0.5006
 epoch: 40, train_loss: 1.0058, test_loss: 0.9469, test_f1: 0.4960
 epoch: 41, train_loss: 0.9962, test_loss: 0.9455, test_f1: 0.5094
 epoch: 42, train_loss: 0.9958, test_loss: 0.9438, test_f1: 0.5082
 epoch: 43, train_loss: 0.9961, test_loss: 0.9508, test_f1: 0.4924
 epoch: 44, train_loss: 0.9845, test_loss: 0.9514, test_f1: 0.5053
 epoch: 45, train_loss: 0.9851, test_loss: 0.9461, test_f1: 0.4995
 epoch: 46, train_loss: 0.9783, test_loss: 0.9421, test_f1: 0.5206
 epoch: 47, train_loss: 0.9767, test_loss: 0.9275, test_f1: 0.5163
 epoch: 48, train_loss: 0.9744, test_loss: 0.9267, test_f1: 0.5155
 epoch: 49, train_loss: 0.9672, test_loss: 0.9307, test_f1: 0.5202
 epoch: 50, train_loss: 0.9679, test_loss: 0.9379, test_f1: 0.5227
 epoch: 51, train_loss: 0.9545, test_loss: 0.9348, test_f1: 0.5225
 epoch: 52, train_loss: 0.9664, test_loss: 0.9297, test_f1: 0.5243
 epoch: 53, train_loss: 0.9602, test_loss: 0.9275, test_f1: 0.5285
 epoch: 54, train_loss: 0.9581, test_loss: 0.9274, test_f1: 0.5241
 epoch: 55, train_loss: 0.9599, test_loss: 0.9249, test_f1: 0.5185
 epoch: 56, train_loss: 0.9542, test_loss: 0.9248, test_f1: 0.5286
 epoch: 57, train_loss: 0.9487, test_loss: 0.9216, test_f1: 0.5227
 epoch: 58, train_loss: 0.9521, test_loss: 0.9227, test_f1: 0.5318
 epoch: 59, train_loss: 0.9474, test_loss: 0.9209, test_f1: 0.5227
 epoch: 60, train_loss: 0.9407, test_loss: 0.9126, test_f1: 0.5274
 epoch: 61, train_loss: 0.9486, test_loss: 0.9133, test_f1: 0.5353
 epoch: 62, train_loss: 0.9418, test_loss: 0.9189, test_f1: 0.5308
 epoch: 63, train_loss: 0.9421, test_loss: 0.9121, test_f1: 0.5257
 epoch: 64, train_loss: 0.9484, test_loss: 0.9269, test_f1: 0.5268
 epoch: 65, train_loss: 0.9379, test_loss: 0.9189, test_f1: 0.5300
 epoch: 66, train_loss: 0.9402, test_loss: 0.9272, test_f1: 0.5294
 epoch: 67, train_loss: 0.9460, test_loss: 0.9260, test_f1: 0.5254
 epoch: 68, train_loss: 0.9409, test_loss: 0.9191, test_f1: 0.5267
 epoch: 69, train_loss: 0.9353, test_loss: 0.9235, test_f1: 0.5353
 epoch: 70, train_loss: 0.9347, test_loss: 0.9131, test_f1: 0.5247
 epoch: 71, train_loss: 0.9383, test_loss: 0.9138, test_f1: 0.5276
 epoch: 72, train_loss: 0.9356, test_loss: 0.9192, test_f1: 0.5292
 epoch: 73, train_loss: 0.9323, test_loss: 0.9272, test_f1: 0.5203
 epoch: 74, train_loss: 0.9408, test_loss: 0.9190, test_f1: 0.5238
 epoch: 75, train_loss: 0.9403, test_loss: 0.9222, test_f1: 0.5333
 epoch: 76, train_loss: 0.9304, test_loss: 0.9198, test_f1: 0.5328
 epoch: 77, train_loss: 0.9391, test_loss: 0.9302, test_f1: 0.5270
 epoch: 78, train_loss: 0.9289, test_loss: 0.9197, test_f1: 0.5344
 epoch: 79, train_loss: 0.9260, test_loss: 0.9212, test_f1: 0.5284
 epoch: 80, train_loss: 0.9232, test_loss: 0.9155, test_f1: 0.5336
 epoch: 81, train_loss: 0.9233, test_loss: 0.9152, test_f1: 0.5304
 epoch: 82, train_loss: 0.9268, test_loss: 0.9157, test_f1: 0.5285
 epoch: 83, train_loss: 0.9155, test_loss: 0.9162, test_f1: 0.5309
 epoch: 84, train_loss: 0.9128, test_loss: 0.9155, test_f1: 0.5295
 epoch: 85, train_loss: 0.9256, test_loss: 0.9105, test_f1: 0.5259
 epoch: 86, train_loss: 0.9193, test_loss: 0.9115, test_f1: 0.5329
 epoch: 87, train_loss: 0.9155, test_loss: 0.9153, test_f1: 0.5292
 epoch: 88, train_loss: 0.9154, test_loss: 0.9043, test_f1: 0.5227
 epoch: 89, train_loss: 0.9198, test_loss: 0.9138, test_f1: 0.5379
 epoch: 90, train_loss: 0.9223, test_loss: 0.9032, test_f1: 0.5238
 epoch: 91, train_loss: 0.9065, test_loss: 0.9153, test_f1: 0.5316
 epoch: 92, train_loss: 0.9220, test_loss: 0.9159, test_f1: 0.5290
 epoch: 93, train_loss: 0.9100, test_loss: 0.9161, test_f1: 0.5279
 epoch: 94, train_loss: 0.9170, test_loss: 0.9156, test_f1: 0.5257
 epoch: 95, train_loss: 0.9017, test_loss: 0.9250, test_f1: 0.5268
 epoch: 96, train_loss: 0.9083, test_loss: 0.9167, test_f1: 0.5290
 epoch: 97, train_loss: 0.9073, test_loss: 0.9086, test_f1: 0.5331
 epoch: 98, train_loss: 0.9158, test_loss: 0.9198, test_f1: 0.5294
 epoch: 99, train_loss: 0.9004, test_loss: 0.9170, test_f1: 0.5279
##################ITERATION #2 ****************************************
 epoch: 0, train_loss: 1.3348, test_loss: 1.3506, test_f1: 0.2270
 epoch: 1, train_loss: 1.3030, test_loss: 1.3265, test_f1: 0.2270
 epoch: 2, train_loss: 1.2872, test_loss: 1.2965, test_f1: 0.2295
 epoch: 3, train_loss: 1.2768, test_loss: 1.2714, test_f1: 0.2484
 epoch: 4, train_loss: 1.2650, test_loss: 1.2600, test_f1: 0.2631
 epoch: 5, train_loss: 1.2513, test_loss: 1.2490, test_f1: 0.2741
 epoch: 6, train_loss: 1.2464, test_loss: 1.2416, test_f1: 0.2847
 epoch: 7, train_loss: 1.2338, test_loss: 1.2286, test_f1: 0.3003
 epoch: 8, train_loss: 1.2234, test_loss: 1.2153, test_f1: 0.3131
 epoch: 9, train_loss: 1.2171, test_loss: 1.2018, test_f1: 0.3274
 epoch: 10, train_loss: 1.2082, test_loss: 1.1903, test_f1: 0.3465
 epoch: 11, train_loss: 1.1954, test_loss: 1.1772, test_f1: 0.3613
 epoch: 12, train_loss: 1.1861, test_loss: 1.1609, test_f1: 0.3724
 epoch: 13, train_loss: 1.1796, test_loss: 1.1503, test_f1: 0.3796
 epoch: 14, train_loss: 1.1638, test_loss: 1.1375, test_f1: 0.3881
 epoch: 15, train_loss: 1.1532, test_loss: 1.1286, test_f1: 0.3940
 epoch: 16, train_loss: 1.1420, test_loss: 1.1150, test_f1: 0.4094
 epoch: 17, train_loss: 1.1347, test_loss: 1.1023, test_f1: 0.4295
 epoch: 18, train_loss: 1.1222, test_loss: 1.0909, test_f1: 0.4529
 epoch: 19, train_loss: 1.1180, test_loss: 1.0776, test_f1: 0.4530
 epoch: 20, train_loss: 1.1077, test_loss: 1.0653, test_f1: 0.4611
 epoch: 21, train_loss: 1.0945, test_loss: 1.0513, test_f1: 0.4694
 epoch: 22, train_loss: 1.0953, test_loss: 1.0444, test_f1: 0.4697
 epoch: 23, train_loss: 1.0838, test_loss: 1.0331, test_f1: 0.4783
 epoch: 24, train_loss: 1.0770, test_loss: 1.0214, test_f1: 0.4846
 epoch: 25, train_loss: 1.0610, test_loss: 1.0156, test_f1: 0.4808
 epoch: 26, train_loss: 1.0626, test_loss: 1.0071, test_f1: 0.4720
 epoch: 27, train_loss: 1.0503, test_loss: 0.9950, test_f1: 0.4795
 epoch: 28, train_loss: 1.0493, test_loss: 0.9860, test_f1: 0.4798
 epoch: 29, train_loss: 1.0450, test_loss: 0.9845, test_f1: 0.4850
 epoch: 30, train_loss: 1.0360, test_loss: 0.9773, test_f1: 0.4791
 epoch: 31, train_loss: 1.0300, test_loss: 0.9700, test_f1: 0.4914
 epoch: 32, train_loss: 1.0260, test_loss: 0.9612, test_f1: 0.4899
 epoch: 33, train_loss: 1.0087, test_loss: 0.9603, test_f1: 0.4840
 epoch: 34, train_loss: 1.0064, test_loss: 0.9561, test_f1: 0.4899
 epoch: 35, train_loss: 1.0072, test_loss: 0.9516, test_f1: 0.4956
 epoch: 36, train_loss: 1.0004, test_loss: 0.9507, test_f1: 0.5001
 epoch: 37, train_loss: 1.0040, test_loss: 0.9449, test_f1: 0.5133
 epoch: 38, train_loss: 0.9897, test_loss: 0.9452, test_f1: 0.5021
 epoch: 39, train_loss: 0.9882, test_loss: 0.9465, test_f1: 0.4929
 epoch: 40, train_loss: 0.9835, test_loss: 0.9336, test_f1: 0.5146
 epoch: 41, train_loss: 0.9754, test_loss: 0.9310, test_f1: 0.5148
 epoch: 42, train_loss: 0.9700, test_loss: 0.9287, test_f1: 0.5262
 epoch: 43, train_loss: 0.9749, test_loss: 0.9327, test_f1: 0.5140
 epoch: 44, train_loss: 0.9681, test_loss: 0.9301, test_f1: 0.5142
 epoch: 45, train_loss: 0.9729, test_loss: 0.9267, test_f1: 0.5127
 epoch: 46, train_loss: 0.9667, test_loss: 0.9384, test_f1: 0.5119
 epoch: 47, train_loss: 0.9580, test_loss: 0.9338, test_f1: 0.5128
 epoch: 48, train_loss: 0.9609, test_loss: 0.9276, test_f1: 0.5086
 epoch: 49, train_loss: 0.9593, test_loss: 0.9249, test_f1: 0.5188
 epoch: 50, train_loss: 0.9426, test_loss: 0.9324, test_f1: 0.5078
 epoch: 51, train_loss: 0.9417, test_loss: 0.9214, test_f1: 0.5167
 epoch: 52, train_loss: 0.9466, test_loss: 0.9208, test_f1: 0.5156
 epoch: 53, train_loss: 0.9417, test_loss: 0.9260, test_f1: 0.5117
 epoch: 54, train_loss: 0.9471, test_loss: 0.9194, test_f1: 0.5141
 epoch: 55, train_loss: 0.9333, test_loss: 0.9172, test_f1: 0.5142
 epoch: 56, train_loss: 0.9402, test_loss: 0.9181, test_f1: 0.5203
 epoch: 57, train_loss: 0.9348, test_loss: 0.9245, test_f1: 0.5178
 epoch: 58, train_loss: 0.9338, test_loss: 0.9242, test_f1: 0.5168
 epoch: 59, train_loss: 0.9300, test_loss: 0.9215, test_f1: 0.5161
 epoch: 60, train_loss: 0.9372, test_loss: 0.9175, test_f1: 0.5164
 epoch: 61, train_loss: 0.9301, test_loss: 0.9108, test_f1: 0.5226
 epoch: 62, train_loss: 0.9291, test_loss: 0.9103, test_f1: 0.5199
 epoch: 63, train_loss: 0.9277, test_loss: 0.9076, test_f1: 0.5211
 epoch: 64, train_loss: 0.9300, test_loss: 0.9078, test_f1: 0.5250
 epoch: 65, train_loss: 0.9274, test_loss: 0.9103, test_f1: 0.5235
 epoch: 66, train_loss: 0.9233, test_loss: 0.9186, test_f1: 0.5160
 epoch: 67, train_loss: 0.9206, test_loss: 0.9086, test_f1: 0.5207
 epoch: 68, train_loss: 0.9233, test_loss: 0.9110, test_f1: 0.5203
 epoch: 69, train_loss: 0.9147, test_loss: 0.9092, test_f1: 0.5251
 epoch: 70, train_loss: 0.9186, test_loss: 0.9107, test_f1: 0.5249
 epoch: 71, train_loss: 0.9218, test_loss: 0.9120, test_f1: 0.5251
 epoch: 72, train_loss: 0.9152, test_loss: 0.9071, test_f1: 0.5300
 epoch: 73, train_loss: 0.9212, test_loss: 0.9192, test_f1: 0.5270
 epoch: 74, train_loss: 0.9140, test_loss: 0.9077, test_f1: 0.5286
 epoch: 75, train_loss: 0.9104, test_loss: 0.9150, test_f1: 0.5186
 epoch: 76, train_loss: 0.9104, test_loss: 0.9142, test_f1: 0.5248
 epoch: 77, train_loss: 0.9116, test_loss: 0.9084, test_f1: 0.5292
 epoch: 78, train_loss: 0.9022, test_loss: 0.9055, test_f1: 0.5265
 epoch: 79, train_loss: 0.9198, test_loss: 0.9118, test_f1: 0.5221
 epoch: 80, train_loss: 0.9077, test_loss: 0.9030, test_f1: 0.5293
 epoch: 81, train_loss: 0.9062, test_loss: 0.9027, test_f1: 0.5338
 epoch: 82, train_loss: 0.9094, test_loss: 0.9013, test_f1: 0.5285
 epoch: 83, train_loss: 0.9099, test_loss: 0.8973, test_f1: 0.5325
 epoch: 84, train_loss: 0.9025, test_loss: 0.9173, test_f1: 0.5212
 epoch: 85, train_loss: 0.9090, test_loss: 0.9100, test_f1: 0.5268
 epoch: 86, train_loss: 0.9107, test_loss: 0.9048, test_f1: 0.5376
 epoch: 87, train_loss: 0.9027, test_loss: 0.9050, test_f1: 0.5282
 epoch: 88, train_loss: 0.8950, test_loss: 0.9053, test_f1: 0.5283
 epoch: 89, train_loss: 0.9015, test_loss: 0.9074, test_f1: 0.5216
 epoch: 90, train_loss: 0.8994, test_loss: 0.9034, test_f1: 0.5260
 epoch: 91, train_loss: 0.8947, test_loss: 0.9094, test_f1: 0.5193
 epoch: 92, train_loss: 0.8941, test_loss: 0.9076, test_f1: 0.5279
 epoch: 93, train_loss: 0.8880, test_loss: 0.9043, test_f1: 0.5273
 epoch: 94, train_loss: 0.8979, test_loss: 0.9021, test_f1: 0.5258
 epoch: 95, train_loss: 0.9072, test_loss: 0.9078, test_f1: 0.5235
 epoch: 96, train_loss: 0.8910, test_loss: 0.9043, test_f1: 0.5275
 epoch: 97, train_loss: 0.8910, test_loss: 0.9063, test_f1: 0.5278
 epoch: 98, train_loss: 0.8969, test_loss: 0.9101, test_f1: 0.5196
 epoch: 99, train_loss: 0.8898, test_loss: 0.9035, test_f1: 0.5231
##################ITERATION #3 ****************************************
 epoch: 0, train_loss: 1.3152, test_loss: 1.3470, test_f1: 0.2265
 epoch: 1, train_loss: 1.2822, test_loss: 1.3097, test_f1: 0.2259
 epoch: 2, train_loss: 1.2642, test_loss: 1.2660, test_f1: 0.2335
 epoch: 3, train_loss: 1.2493, test_loss: 1.2392, test_f1: 0.2344
 epoch: 4, train_loss: 1.2360, test_loss: 1.2233, test_f1: 0.2464
 epoch: 5, train_loss: 1.2255, test_loss: 1.2084, test_f1: 0.2441
 epoch: 6, train_loss: 1.2169, test_loss: 1.1964, test_f1: 0.3035
 epoch: 7, train_loss: 1.2035, test_loss: 1.1810, test_f1: 0.3187
 epoch: 8, train_loss: 1.1977, test_loss: 1.1670, test_f1: 0.3509
 epoch: 9, train_loss: 1.1794, test_loss: 1.1541, test_f1: 0.3758
 epoch: 10, train_loss: 1.1751, test_loss: 1.1426, test_f1: 0.3941
 epoch: 11, train_loss: 1.1622, test_loss: 1.1300, test_f1: 0.3873
 epoch: 12, train_loss: 1.1571, test_loss: 1.1186, test_f1: 0.4268
 epoch: 13, train_loss: 1.1465, test_loss: 1.1066, test_f1: 0.4291
 epoch: 14, train_loss: 1.1408, test_loss: 1.1001, test_f1: 0.4362
 epoch: 15, train_loss: 1.1270, test_loss: 1.0880, test_f1: 0.4335
 epoch: 16, train_loss: 1.1170, test_loss: 1.0761, test_f1: 0.4336
 epoch: 17, train_loss: 1.1131, test_loss: 1.0672, test_f1: 0.4307
 epoch: 18, train_loss: 1.0955, test_loss: 1.0568, test_f1: 0.4416
 epoch: 19, train_loss: 1.0932, test_loss: 1.0526, test_f1: 0.4377
 epoch: 20, train_loss: 1.0873, test_loss: 1.0416, test_f1: 0.4500
 epoch: 21, train_loss: 1.0780, test_loss: 1.0361, test_f1: 0.4494
 epoch: 22, train_loss: 1.0695, test_loss: 1.0254, test_f1: 0.4437
 epoch: 23, train_loss: 1.0590, test_loss: 1.0198, test_f1: 0.4466
 epoch: 24, train_loss: 1.0506, test_loss: 1.0140, test_f1: 0.4558
 epoch: 25, train_loss: 1.0426, test_loss: 1.0112, test_f1: 0.4526
 epoch: 26, train_loss: 1.0489, test_loss: 1.0056, test_f1: 0.4652
 epoch: 27, train_loss: 1.0338, test_loss: 0.9954, test_f1: 0.4540
 epoch: 28, train_loss: 1.0244, test_loss: 0.9959, test_f1: 0.4556
 epoch: 29, train_loss: 1.0273, test_loss: 0.9938, test_f1: 0.4648
 epoch: 30, train_loss: 1.0093, test_loss: 0.9795, test_f1: 0.4623
 epoch: 31, train_loss: 1.0061, test_loss: 0.9872, test_f1: 0.4578
 epoch: 32, train_loss: 0.9971, test_loss: 0.9730, test_f1: 0.4794
 epoch: 33, train_loss: 0.9943, test_loss: 0.9811, test_f1: 0.4729
 epoch: 34, train_loss: 1.0016, test_loss: 0.9752, test_f1: 0.4782
 epoch: 35, train_loss: 0.9917, test_loss: 0.9671, test_f1: 0.4719
 epoch: 36, train_loss: 0.9815, test_loss: 0.9704, test_f1: 0.4818
 epoch: 37, train_loss: 0.9809, test_loss: 0.9685, test_f1: 0.4773
 epoch: 38, train_loss: 0.9808, test_loss: 0.9716, test_f1: 0.4765
 epoch: 39, train_loss: 0.9733, test_loss: 0.9628, test_f1: 0.4946
 epoch: 40, train_loss: 0.9630, test_loss: 0.9657, test_f1: 0.4789
 epoch: 41, train_loss: 0.9588, test_loss: 0.9592, test_f1: 0.4949
 epoch: 42, train_loss: 0.9511, test_loss: 0.9614, test_f1: 0.4865
 epoch: 43, train_loss: 0.9541, test_loss: 0.9707, test_f1: 0.4794
 epoch: 44, train_loss: 0.9550, test_loss: 0.9633, test_f1: 0.4898
 epoch: 45, train_loss: 0.9455, test_loss: 0.9642, test_f1: 0.4892
 epoch: 46, train_loss: 0.9455, test_loss: 0.9632, test_f1: 0.4900
 epoch: 47, train_loss: 0.9398, test_loss: 0.9602, test_f1: 0.4885
 epoch: 48, train_loss: 0.9342, test_loss: 0.9598, test_f1: 0.4901
 epoch: 49, train_loss: 0.9455, test_loss: 0.9531, test_f1: 0.4951
 epoch: 50, train_loss: 0.9392, test_loss: 0.9586, test_f1: 0.4876
 epoch: 51, train_loss: 0.9331, test_loss: 0.9609, test_f1: 0.4844
 epoch: 52, train_loss: 0.9276, test_loss: 0.9564, test_f1: 0.4924
 epoch: 53, train_loss: 0.9324, test_loss: 0.9651, test_f1: 0.4843
 epoch: 54, train_loss: 0.9243, test_loss: 0.9578, test_f1: 0.4904
 epoch: 55, train_loss: 0.9322, test_loss: 0.9634, test_f1: 0.4895
 epoch: 56, train_loss: 0.9157, test_loss: 0.9642, test_f1: 0.4848
 epoch: 57, train_loss: 0.9215, test_loss: 0.9630, test_f1: 0.4832
 epoch: 58, train_loss: 0.9226, test_loss: 0.9575, test_f1: 0.4918
 epoch: 59, train_loss: 0.9149, test_loss: 0.9628, test_f1: 0.4907
 epoch: 60, train_loss: 0.9213, test_loss: 0.9600, test_f1: 0.4851
 epoch: 61, train_loss: 0.9186, test_loss: 0.9674, test_f1: 0.4889
 epoch: 62, train_loss: 0.9147, test_loss: 0.9581, test_f1: 0.4852
 epoch: 63, train_loss: 0.9235, test_loss: 0.9566, test_f1: 0.4960
 epoch: 64, train_loss: 0.9098, test_loss: 0.9511, test_f1: 0.4951
 epoch: 65, train_loss: 0.9186, test_loss: 0.9573, test_f1: 0.4973
 epoch: 66, train_loss: 0.9137, test_loss: 0.9579, test_f1: 0.4915
 epoch: 67, train_loss: 0.9140, test_loss: 0.9660, test_f1: 0.4852
 epoch: 68, train_loss: 0.9097, test_loss: 0.9586, test_f1: 0.4909
 epoch: 69, train_loss: 0.8992, test_loss: 0.9592, test_f1: 0.4969
 epoch: 70, train_loss: 0.9070, test_loss: 0.9578, test_f1: 0.4959
 epoch: 71, train_loss: 0.9051, test_loss: 0.9594, test_f1: 0.4927
 epoch: 72, train_loss: 0.9080, test_loss: 0.9657, test_f1: 0.4946
 epoch: 73, train_loss: 0.9089, test_loss: 0.9546, test_f1: 0.4904
 epoch: 74, train_loss: 0.9032, test_loss: 0.9572, test_f1: 0.4902
 epoch: 75, train_loss: 0.8999, test_loss: 0.9464, test_f1: 0.5043
 epoch: 76, train_loss: 0.8987, test_loss: 0.9615, test_f1: 0.4898
 epoch: 77, train_loss: 0.9033, test_loss: 0.9621, test_f1: 0.4935
 epoch: 78, train_loss: 0.8914, test_loss: 0.9564, test_f1: 0.4909
 epoch: 79, train_loss: 0.8943, test_loss: 0.9633, test_f1: 0.4967
 epoch: 80, train_loss: 0.8998, test_loss: 0.9569, test_f1: 0.4990
 epoch: 81, train_loss: 0.8956, test_loss: 0.9568, test_f1: 0.4918
 epoch: 82, train_loss: 0.9020, test_loss: 0.9498, test_f1: 0.4970
 epoch: 83, train_loss: 0.8939, test_loss: 0.9514, test_f1: 0.5023
 epoch: 84, train_loss: 0.8940, test_loss: 0.9568, test_f1: 0.4991
 epoch: 85, train_loss: 0.9006, test_loss: 0.9437, test_f1: 0.5049
 epoch: 86, train_loss: 0.8830, test_loss: 0.9537, test_f1: 0.4975
 epoch: 87, train_loss: 0.8771, test_loss: 0.9547, test_f1: 0.4960
 epoch: 88, train_loss: 0.8839, test_loss: 0.9507, test_f1: 0.5037
 epoch: 89, train_loss: 0.8879, test_loss: 0.9516, test_f1: 0.5119
 epoch: 90, train_loss: 0.8816, test_loss: 0.9513, test_f1: 0.4973
 epoch: 91, train_loss: 0.8712, test_loss: 0.9526, test_f1: 0.5004
 epoch: 92, train_loss: 0.8796, test_loss: 0.9559, test_f1: 0.5004
 epoch: 93, train_loss: 0.8878, test_loss: 0.9562, test_f1: 0.5045
 epoch: 94, train_loss: 0.8797, test_loss: 0.9573, test_f1: 0.5086
 epoch: 95, train_loss: 0.8833, test_loss: 0.9668, test_f1: 0.4944
 epoch: 96, train_loss: 0.8792, test_loss: 0.9609, test_f1: 0.4991
 epoch: 97, train_loss: 0.8810, test_loss: 0.9532, test_f1: 0.4993
 epoch: 98, train_loss: 0.8888, test_loss: 0.9668, test_f1: 0.5095
 epoch: 99, train_loss: 0.8686, test_loss: 0.9656, test_f1: 0.5096
##################ITERATION #4 ****************************************
 epoch: 0, train_loss: 1.2943, test_loss: 1.3461, test_f1: 0.2270
 epoch: 1, train_loss: 1.2518, test_loss: 1.2716, test_f1: 0.3469
 epoch: 2, train_loss: 1.2433, test_loss: 1.2109, test_f1: 0.3589
 epoch: 3, train_loss: 1.2248, test_loss: 1.1842, test_f1: 0.3703
 epoch: 4, train_loss: 1.2095, test_loss: 1.1648, test_f1: 0.3791
 epoch: 5, train_loss: 1.2008, test_loss: 1.1496, test_f1: 0.3833
 epoch: 6, train_loss: 1.1804, test_loss: 1.1307, test_f1: 0.3909
 epoch: 7, train_loss: 1.1680, test_loss: 1.1153, test_f1: 0.3948
 epoch: 8, train_loss: 1.1544, test_loss: 1.0997, test_f1: 0.4052
 epoch: 9, train_loss: 1.1547, test_loss: 1.0878, test_f1: 0.4186
 epoch: 10, train_loss: 1.1345, test_loss: 1.0716, test_f1: 0.4415
 epoch: 11, train_loss: 1.1295, test_loss: 1.0637, test_f1: 0.4325
 epoch: 12, train_loss: 1.1104, test_loss: 1.0513, test_f1: 0.4376
 epoch: 13, train_loss: 1.1073, test_loss: 1.0369, test_f1: 0.4527
 epoch: 14, train_loss: 1.0951, test_loss: 1.0242, test_f1: 0.4636
 epoch: 15, train_loss: 1.0852, test_loss: 1.0149, test_f1: 0.4746
 epoch: 16, train_loss: 1.0772, test_loss: 1.0047, test_f1: 0.4679
 epoch: 17, train_loss: 1.0716, test_loss: 0.9948, test_f1: 0.4728
 epoch: 18, train_loss: 1.0604, test_loss: 0.9864, test_f1: 0.4788
 epoch: 19, train_loss: 1.0533, test_loss: 0.9803, test_f1: 0.4860
 epoch: 20, train_loss: 1.0449, test_loss: 0.9680, test_f1: 0.4790
 epoch: 21, train_loss: 1.0395, test_loss: 0.9581, test_f1: 0.4977
 epoch: 22, train_loss: 1.0275, test_loss: 0.9501, test_f1: 0.4945
 epoch: 23, train_loss: 1.0236, test_loss: 0.9516, test_f1: 0.4969
 epoch: 24, train_loss: 1.0090, test_loss: 0.9415, test_f1: 0.5032
 epoch: 25, train_loss: 1.0109, test_loss: 0.9382, test_f1: 0.5050
 epoch: 26, train_loss: 1.0003, test_loss: 0.9374, test_f1: 0.5057
 epoch: 27, train_loss: 0.9948, test_loss: 0.9391, test_f1: 0.5095
 epoch: 28, train_loss: 0.9988, test_loss: 0.9239, test_f1: 0.5074
 epoch: 29, train_loss: 0.9864, test_loss: 0.9227, test_f1: 0.5085
 epoch: 30, train_loss: 0.9754, test_loss: 0.9215, test_f1: 0.5132
 epoch: 31, train_loss: 0.9809, test_loss: 0.9184, test_f1: 0.5079
 epoch: 32, train_loss: 0.9731, test_loss: 0.9163, test_f1: 0.4989
 epoch: 33, train_loss: 0.9628, test_loss: 0.9113, test_f1: 0.5227
 epoch: 34, train_loss: 0.9740, test_loss: 0.9124, test_f1: 0.5262
 epoch: 35, train_loss: 0.9563, test_loss: 0.9078, test_f1: 0.5229
 epoch: 36, train_loss: 0.9615, test_loss: 0.9077, test_f1: 0.5258
 epoch: 37, train_loss: 0.9487, test_loss: 0.9075, test_f1: 0.5225
 epoch: 38, train_loss: 0.9556, test_loss: 0.9071, test_f1: 0.5267
 epoch: 39, train_loss: 0.9368, test_loss: 0.9053, test_f1: 0.5224
 epoch: 40, train_loss: 0.9398, test_loss: 0.9066, test_f1: 0.5318
 epoch: 41, train_loss: 0.9282, test_loss: 0.9046, test_f1: 0.5263
 epoch: 42, train_loss: 0.9412, test_loss: 0.9057, test_f1: 0.5205
 epoch: 43, train_loss: 0.9330, test_loss: 0.9036, test_f1: 0.5273
 epoch: 44, train_loss: 0.9178, test_loss: 0.9033, test_f1: 0.5202
 epoch: 45, train_loss: 0.9262, test_loss: 0.9012, test_f1: 0.5307
 epoch: 46, train_loss: 0.9241, test_loss: 0.9030, test_f1: 0.5284
 epoch: 47, train_loss: 0.9274, test_loss: 0.9064, test_f1: 0.5250
 epoch: 48, train_loss: 0.9149, test_loss: 0.9043, test_f1: 0.5270
 epoch: 49, train_loss: 0.9166, test_loss: 0.8990, test_f1: 0.5241
 epoch: 50, train_loss: 0.9126, test_loss: 0.9040, test_f1: 0.5274
 epoch: 51, train_loss: 0.9158, test_loss: 0.9078, test_f1: 0.5334
 epoch: 52, train_loss: 0.9017, test_loss: 0.9007, test_f1: 0.5279
 epoch: 53, train_loss: 0.8947, test_loss: 0.9017, test_f1: 0.5315
 epoch: 54, train_loss: 0.9061, test_loss: 0.9041, test_f1: 0.5264
 epoch: 55, train_loss: 0.9003, test_loss: 0.9076, test_f1: 0.5264
 epoch: 56, train_loss: 0.8875, test_loss: 0.9074, test_f1: 0.5234
 epoch: 57, train_loss: 0.8997, test_loss: 0.9067, test_f1: 0.5276
 epoch: 58, train_loss: 0.9056, test_loss: 0.9067, test_f1: 0.5246
 epoch: 59, train_loss: 0.9013, test_loss: 0.9045, test_f1: 0.5271
 epoch: 60, train_loss: 0.8924, test_loss: 0.9105, test_f1: 0.5226
 epoch: 61, train_loss: 0.8959, test_loss: 0.9030, test_f1: 0.5297
 epoch: 62, train_loss: 0.8945, test_loss: 0.8998, test_f1: 0.5300
 epoch: 63, train_loss: 0.8890, test_loss: 0.8989, test_f1: 0.5266
 epoch: 64, train_loss: 0.8892, test_loss: 0.9024, test_f1: 0.5246
 epoch: 65, train_loss: 0.8824, test_loss: 0.9101, test_f1: 0.5248
 epoch: 66, train_loss: 0.8914, test_loss: 0.9027, test_f1: 0.5227
 epoch: 67, train_loss: 0.8829, test_loss: 0.9031, test_f1: 0.5315
 epoch: 68, train_loss: 0.8844, test_loss: 0.9047, test_f1: 0.5306
 epoch: 69, train_loss: 0.8828, test_loss: 0.9120, test_f1: 0.5238
 epoch: 70, train_loss: 0.8742, test_loss: 0.9091, test_f1: 0.5231
 epoch: 71, train_loss: 0.8730, test_loss: 0.9129, test_f1: 0.5237
 epoch: 72, train_loss: 0.8795, test_loss: 0.9101, test_f1: 0.5202
 epoch: 73, train_loss: 0.8801, test_loss: 0.9147, test_f1: 0.5195
 epoch: 74, train_loss: 0.8780, test_loss: 0.9135, test_f1: 0.5263
 epoch: 75, train_loss: 0.8754, test_loss: 0.9111, test_f1: 0.5303
 epoch: 76, train_loss: 0.8808, test_loss: 0.9101, test_f1: 0.5262
 epoch: 77, train_loss: 0.8797, test_loss: 0.9158, test_f1: 0.5192
 epoch: 78, train_loss: 0.8715, test_loss: 0.9096, test_f1: 0.5278
 epoch: 79, train_loss: 0.8800, test_loss: 0.9167, test_f1: 0.5227
 epoch: 80, train_loss: 0.8860, test_loss: 0.9158, test_f1: 0.5180
 epoch: 81, train_loss: 0.8706, test_loss: 0.9136, test_f1: 0.5263
 epoch: 82, train_loss: 0.8660, test_loss: 0.9194, test_f1: 0.5219
 epoch: 83, train_loss: 0.8722, test_loss: 0.9114, test_f1: 0.5217
 epoch: 84, train_loss: 0.8766, test_loss: 0.9092, test_f1: 0.5224
 epoch: 85, train_loss: 0.8716, test_loss: 0.9115, test_f1: 0.5179
 epoch: 86, train_loss: 0.8622, test_loss: 0.9129, test_f1: 0.5159
 epoch: 87, train_loss: 0.8605, test_loss: 0.9184, test_f1: 0.5142
 epoch: 88, train_loss: 0.8748, test_loss: 0.9127, test_f1: 0.5171
 epoch: 89, train_loss: 0.8710, test_loss: 0.9126, test_f1: 0.5251
 epoch: 90, train_loss: 0.8690, test_loss: 0.9145, test_f1: 0.5220
 epoch: 91, train_loss: 0.8716, test_loss: 0.9176, test_f1: 0.5184
 epoch: 92, train_loss: 0.8620, test_loss: 0.9189, test_f1: 0.5209
 epoch: 93, train_loss: 0.8469, test_loss: 0.9271, test_f1: 0.5222
 epoch: 94, train_loss: 0.8637, test_loss: 0.9221, test_f1: 0.5195
 epoch: 95, train_loss: 0.8615, test_loss: 0.9209, test_f1: 0.5144
 epoch: 96, train_loss: 0.8526, test_loss: 0.9196, test_f1: 0.5282
 epoch: 97, train_loss: 0.8549, test_loss: 0.9279, test_f1: 0.5171
 epoch: 98, train_loss: 0.8601, test_loss: 0.9286, test_f1: 0.5176
 epoch: 99, train_loss: 0.8572, test_loss: 0.9204, test_f1: 0.5177
##################ITERATION #5 ****************************************
 epoch: 0, train_loss: 1.3000, test_loss: 1.3831, test_f1: 0.2352
 epoch: 1, train_loss: 1.2635, test_loss: 1.2925, test_f1: 0.2744
 epoch: 2, train_loss: 1.2445, test_loss: 1.2421, test_f1: 0.2859
 epoch: 3, train_loss: 1.2303, test_loss: 1.2035, test_f1: 0.3062
 epoch: 4, train_loss: 1.2225, test_loss: 1.1836, test_f1: 0.3466
 epoch: 5, train_loss: 1.2065, test_loss: 1.1669, test_f1: 0.3788
 epoch: 6, train_loss: 1.1917, test_loss: 1.1532, test_f1: 0.4037
 epoch: 7, train_loss: 1.1795, test_loss: 1.1389, test_f1: 0.4194
 epoch: 8, train_loss: 1.1701, test_loss: 1.1255, test_f1: 0.4281
 epoch: 9, train_loss: 1.1621, test_loss: 1.1148, test_f1: 0.4314
 epoch: 10, train_loss: 1.1526, test_loss: 1.1004, test_f1: 0.4440
 epoch: 11, train_loss: 1.1434, test_loss: 1.0948, test_f1: 0.4524
 epoch: 12, train_loss: 1.1317, test_loss: 1.0820, test_f1: 0.4628
 epoch: 13, train_loss: 1.1290, test_loss: 1.0675, test_f1: 0.4610
 epoch: 14, train_loss: 1.1033, test_loss: 1.0605, test_f1: 0.4643
 epoch: 15, train_loss: 1.1017, test_loss: 1.0482, test_f1: 0.4600
 epoch: 16, train_loss: 1.0937, test_loss: 1.0294, test_f1: 0.4795
 epoch: 17, train_loss: 1.0891, test_loss: 1.0224, test_f1: 0.4883
 epoch: 18, train_loss: 1.0771, test_loss: 1.0180, test_f1: 0.4701
 epoch: 19, train_loss: 1.0686, test_loss: 1.0089, test_f1: 0.4699
 epoch: 20, train_loss: 1.0591, test_loss: 1.0011, test_f1: 0.4699
 epoch: 21, train_loss: 1.0499, test_loss: 1.0004, test_f1: 0.4550
 epoch: 22, train_loss: 1.0440, test_loss: 0.9965, test_f1: 0.4491
 epoch: 23, train_loss: 1.0386, test_loss: 0.9917, test_f1: 0.4649
 epoch: 24, train_loss: 1.0304, test_loss: 0.9840, test_f1: 0.4746
 epoch: 25, train_loss: 1.0297, test_loss: 0.9690, test_f1: 0.4832
 epoch: 26, train_loss: 1.0262, test_loss: 0.9749, test_f1: 0.4639
 epoch: 27, train_loss: 1.0237, test_loss: 0.9703, test_f1: 0.4682
 epoch: 28, train_loss: 1.0062, test_loss: 0.9686, test_f1: 0.4786
 epoch: 29, train_loss: 1.0114, test_loss: 0.9549, test_f1: 0.4949
 epoch: 30, train_loss: 0.9999, test_loss: 0.9616, test_f1: 0.4680
 epoch: 31, train_loss: 0.9861, test_loss: 0.9551, test_f1: 0.4730
 epoch: 32, train_loss: 0.9987, test_loss: 0.9564, test_f1: 0.4651
 epoch: 33, train_loss: 0.9884, test_loss: 0.9573, test_f1: 0.4675
 epoch: 34, train_loss: 0.9870, test_loss: 0.9498, test_f1: 0.4630
 epoch: 35, train_loss: 0.9850, test_loss: 0.9417, test_f1: 0.4834
 epoch: 36, train_loss: 0.9823, test_loss: 0.9409, test_f1: 0.4816
 epoch: 37, train_loss: 0.9702, test_loss: 0.9416, test_f1: 0.4818
 epoch: 38, train_loss: 0.9674, test_loss: 0.9384, test_f1: 0.4877
 epoch: 39, train_loss: 0.9642, test_loss: 0.9508, test_f1: 0.4831
 epoch: 40, train_loss: 0.9637, test_loss: 0.9388, test_f1: 0.4948
 epoch: 41, train_loss: 0.9567, test_loss: 0.9350, test_f1: 0.4808
 epoch: 42, train_loss: 0.9622, test_loss: 0.9284, test_f1: 0.4937
 epoch: 43, train_loss: 0.9578, test_loss: 0.9167, test_f1: 0.5185
 epoch: 44, train_loss: 0.9475, test_loss: 0.9263, test_f1: 0.5016
 epoch: 45, train_loss: 0.9412, test_loss: 0.9206, test_f1: 0.5024
 epoch: 46, train_loss: 0.9374, test_loss: 0.9200, test_f1: 0.5012
 epoch: 47, train_loss: 0.9417, test_loss: 0.9320, test_f1: 0.4980
 epoch: 48, train_loss: 0.9405, test_loss: 0.9249, test_f1: 0.4910
 epoch: 49, train_loss: 0.9368, test_loss: 0.9186, test_f1: 0.5061
 epoch: 50, train_loss: 0.9343, test_loss: 0.9234, test_f1: 0.5048
 epoch: 51, train_loss: 0.9333, test_loss: 0.9228, test_f1: 0.5004
 epoch: 52, train_loss: 0.9276, test_loss: 0.9205, test_f1: 0.4958
 epoch: 53, train_loss: 0.9254, test_loss: 0.9285, test_f1: 0.5106
 epoch: 54, train_loss: 0.9220, test_loss: 0.9331, test_f1: 0.5114
 epoch: 55, train_loss: 0.9196, test_loss: 0.9253, test_f1: 0.4997
 epoch: 56, train_loss: 0.9290, test_loss: 0.9262, test_f1: 0.4989
 epoch: 57, train_loss: 0.9212, test_loss: 0.9224, test_f1: 0.5095
 epoch: 58, train_loss: 0.9220, test_loss: 0.9155, test_f1: 0.5122
 epoch: 59, train_loss: 0.9307, test_loss: 0.9118, test_f1: 0.5153
 epoch: 60, train_loss: 0.9086, test_loss: 0.9260, test_f1: 0.5071
 epoch: 61, train_loss: 0.9212, test_loss: 0.9175, test_f1: 0.5042
 epoch: 62, train_loss: 0.9150, test_loss: 0.9224, test_f1: 0.5117
 epoch: 63, train_loss: 0.9136, test_loss: 0.9275, test_f1: 0.5147
 epoch: 64, train_loss: 0.9193, test_loss: 0.9231, test_f1: 0.5066
 epoch: 65, train_loss: 0.9134, test_loss: 0.9221, test_f1: 0.5131
 epoch: 66, train_loss: 0.9064, test_loss: 0.9305, test_f1: 0.5158
 epoch: 67, train_loss: 0.9085, test_loss: 0.9342, test_f1: 0.5004
 epoch: 68, train_loss: 0.9092, test_loss: 0.9251, test_f1: 0.5092
 epoch: 69, train_loss: 0.9051, test_loss: 0.9214, test_f1: 0.5117
 epoch: 70, train_loss: 0.8992, test_loss: 0.9365, test_f1: 0.5025
 epoch: 71, train_loss: 0.9120, test_loss: 0.9223, test_f1: 0.5212
 epoch: 72, train_loss: 0.9028, test_loss: 0.9314, test_f1: 0.5106
 epoch: 73, train_loss: 0.8986, test_loss: 0.9250, test_f1: 0.5077
 epoch: 74, train_loss: 0.9069, test_loss: 0.9353, test_f1: 0.5075
 epoch: 75, train_loss: 0.9078, test_loss: 0.9273, test_f1: 0.5137
 epoch: 76, train_loss: 0.8962, test_loss: 0.9251, test_f1: 0.5130
 epoch: 77, train_loss: 0.8969, test_loss: 0.9378, test_f1: 0.5139
 epoch: 78, train_loss: 0.9041, test_loss: 0.9274, test_f1: 0.5163
 epoch: 79, train_loss: 0.8998, test_loss: 0.9270, test_f1: 0.5110
 epoch: 80, train_loss: 0.8944, test_loss: 0.9228, test_f1: 0.5096
 epoch: 81, train_loss: 0.8954, test_loss: 0.9264, test_f1: 0.5133
 epoch: 82, train_loss: 0.8934, test_loss: 0.9295, test_f1: 0.5060
 epoch: 83, train_loss: 0.8981, test_loss: 0.9276, test_f1: 0.5079
 epoch: 84, train_loss: 0.8899, test_loss: 0.9292, test_f1: 0.5126
 epoch: 85, train_loss: 0.8925, test_loss: 0.9274, test_f1: 0.5196
 epoch: 86, train_loss: 0.8937, test_loss: 0.9314, test_f1: 0.5145
 epoch: 87, train_loss: 0.8837, test_loss: 0.9242, test_f1: 0.5171
 epoch: 88, train_loss: 0.8923, test_loss: 0.9276, test_f1: 0.5082
 epoch: 89, train_loss: 0.8930, test_loss: 0.9172, test_f1: 0.5154
 epoch: 90, train_loss: 0.8833, test_loss: 0.9268, test_f1: 0.5224
 epoch: 91, train_loss: 0.8901, test_loss: 0.9290, test_f1: 0.5114
 epoch: 92, train_loss: 0.8825, test_loss: 0.9342, test_f1: 0.5122
 epoch: 93, train_loss: 0.8944, test_loss: 0.9258, test_f1: 0.5030
 epoch: 94, train_loss: 0.8841, test_loss: 0.9371, test_f1: 0.5067
 epoch: 95, train_loss: 0.8791, test_loss: 0.9224, test_f1: 0.5153
 epoch: 96, train_loss: 0.8836, test_loss: 0.9455, test_f1: 0.5020
 epoch: 97, train_loss: 0.8710, test_loss: 0.9385, test_f1: 0.5130
 epoch: 98, train_loss: 0.8760, test_loss: 0.9520, test_f1: 0.5072
 epoch: 99, train_loss: 0.8705, test_loss: 0.9249, test_f1: 0.5122
##################ITERATION #6 ****************************************
 epoch: 0, train_loss: 1.3298, test_loss: 1.3074, test_f1: 0.2270
 epoch: 1, train_loss: 1.2688, test_loss: 1.2479, test_f1: 0.2767
 epoch: 2, train_loss: 1.2530, test_loss: 1.2171, test_f1: 0.2983
 epoch: 3, train_loss: 1.2275, test_loss: 1.1981, test_f1: 0.2987
 epoch: 4, train_loss: 1.2079, test_loss: 1.1833, test_f1: 0.3119
 epoch: 5, train_loss: 1.1997, test_loss: 1.1725, test_f1: 0.3344
 epoch: 6, train_loss: 1.1887, test_loss: 1.1551, test_f1: 0.3623
 epoch: 7, train_loss: 1.1697, test_loss: 1.1409, test_f1: 0.3816
 epoch: 8, train_loss: 1.1628, test_loss: 1.1256, test_f1: 0.3948
 epoch: 9, train_loss: 1.1566, test_loss: 1.1113, test_f1: 0.4123
 epoch: 10, train_loss: 1.1384, test_loss: 1.1005, test_f1: 0.4010
 epoch: 11, train_loss: 1.1275, test_loss: 1.0862, test_f1: 0.4195
 epoch: 12, train_loss: 1.1208, test_loss: 1.0737, test_f1: 0.4147
 epoch: 13, train_loss: 1.0993, test_loss: 1.0669, test_f1: 0.4297
 epoch: 14, train_loss: 1.1019, test_loss: 1.0521, test_f1: 0.4364
 epoch: 15, train_loss: 1.0948, test_loss: 1.0405, test_f1: 0.4478
 epoch: 16, train_loss: 1.0849, test_loss: 1.0315, test_f1: 0.4463
 epoch: 17, train_loss: 1.0762, test_loss: 1.0241, test_f1: 0.4607
 epoch: 18, train_loss: 1.0644, test_loss: 1.0152, test_f1: 0.4487
 epoch: 19, train_loss: 1.0581, test_loss: 1.0112, test_f1: 0.4398
 epoch: 20, train_loss: 1.0487, test_loss: 1.0088, test_f1: 0.4425
 epoch: 21, train_loss: 1.0461, test_loss: 1.0018, test_f1: 0.4574
 epoch: 22, train_loss: 1.0403, test_loss: 0.9997, test_f1: 0.4514
 epoch: 23, train_loss: 1.0416, test_loss: 0.9954, test_f1: 0.4468
 epoch: 24, train_loss: 1.0310, test_loss: 0.9899, test_f1: 0.4756
 epoch: 25, train_loss: 1.0292, test_loss: 0.9878, test_f1: 0.4670
 epoch: 26, train_loss: 1.0162, test_loss: 0.9877, test_f1: 0.4709
 epoch: 27, train_loss: 1.0123, test_loss: 0.9879, test_f1: 0.4609
 epoch: 28, train_loss: 1.0176, test_loss: 0.9882, test_f1: 0.4690
 epoch: 29, train_loss: 1.0066, test_loss: 0.9866, test_f1: 0.4526
 epoch: 30, train_loss: 1.0114, test_loss: 0.9759, test_f1: 0.4676
 epoch: 31, train_loss: 0.9963, test_loss: 0.9796, test_f1: 0.4746
 epoch: 32, train_loss: 0.9984, test_loss: 0.9725, test_f1: 0.4835
 epoch: 33, train_loss: 0.9934, test_loss: 0.9695, test_f1: 0.4877
 epoch: 34, train_loss: 0.9925, test_loss: 0.9676, test_f1: 0.4891
 epoch: 35, train_loss: 0.9902, test_loss: 0.9642, test_f1: 0.4915
 epoch: 36, train_loss: 0.9764, test_loss: 0.9745, test_f1: 0.4878
 epoch: 37, train_loss: 0.9751, test_loss: 0.9598, test_f1: 0.4706
 epoch: 38, train_loss: 0.9769, test_loss: 0.9622, test_f1: 0.4854
 epoch: 39, train_loss: 0.9688, test_loss: 0.9587, test_f1: 0.4889
 epoch: 40, train_loss: 0.9705, test_loss: 0.9620, test_f1: 0.4917
 epoch: 41, train_loss: 0.9687, test_loss: 0.9680, test_f1: 0.5015
 epoch: 42, train_loss: 0.9722, test_loss: 0.9607, test_f1: 0.4840
 epoch: 43, train_loss: 0.9634, test_loss: 0.9695, test_f1: 0.4749
 epoch: 44, train_loss: 0.9607, test_loss: 0.9508, test_f1: 0.5112
 epoch: 45, train_loss: 0.9555, test_loss: 0.9543, test_f1: 0.4907
 epoch: 46, train_loss: 0.9522, test_loss: 0.9617, test_f1: 0.5066
 epoch: 47, train_loss: 0.9549, test_loss: 0.9607, test_f1: 0.4865
 epoch: 48, train_loss: 0.9571, test_loss: 0.9660, test_f1: 0.4798
 epoch: 49, train_loss: 0.9465, test_loss: 0.9618, test_f1: 0.5184
 epoch: 50, train_loss: 0.9462, test_loss: 0.9654, test_f1: 0.5099
 epoch: 51, train_loss: 0.9445, test_loss: 0.9554, test_f1: 0.5086
 epoch: 52, train_loss: 0.9447, test_loss: 0.9650, test_f1: 0.5185
 epoch: 53, train_loss: 0.9440, test_loss: 0.9615, test_f1: 0.5036
 epoch: 54, train_loss: 0.9404, test_loss: 0.9622, test_f1: 0.4901
 epoch: 55, train_loss: 0.9399, test_loss: 0.9627, test_f1: 0.5024
 epoch: 56, train_loss: 0.9346, test_loss: 0.9643, test_f1: 0.5060
 epoch: 57, train_loss: 0.9479, test_loss: 0.9696, test_f1: 0.5103
 epoch: 58, train_loss: 0.9350, test_loss: 0.9585, test_f1: 0.5183
 epoch: 59, train_loss: 0.9442, test_loss: 0.9729, test_f1: 0.4999
 epoch: 60, train_loss: 0.9394, test_loss: 0.9674, test_f1: 0.5011
 epoch: 61, train_loss: 0.9431, test_loss: 0.9740, test_f1: 0.5130
 epoch: 62, train_loss: 0.9415, test_loss: 0.9665, test_f1: 0.5199
 epoch: 63, train_loss: 0.9427, test_loss: 0.9634, test_f1: 0.5225
 epoch: 64, train_loss: 0.9425, test_loss: 0.9669, test_f1: 0.4973
 epoch: 65, train_loss: 0.9352, test_loss: 0.9650, test_f1: 0.4905
 epoch: 66, train_loss: 0.9354, test_loss: 0.9657, test_f1: 0.5197
 epoch: 67, train_loss: 0.9357, test_loss: 0.9709, test_f1: 0.4963
 epoch: 68, train_loss: 0.9228, test_loss: 0.9737, test_f1: 0.5134
 epoch: 69, train_loss: 0.9313, test_loss: 0.9761, test_f1: 0.4922
 epoch: 70, train_loss: 0.9342, test_loss: 0.9637, test_f1: 0.5146
 epoch: 71, train_loss: 0.9280, test_loss: 0.9692, test_f1: 0.5217
 epoch: 72, train_loss: 0.9299, test_loss: 0.9729, test_f1: 0.5106
 epoch: 73, train_loss: 0.9251, test_loss: 0.9737, test_f1: 0.4987
 epoch: 74, train_loss: 0.9381, test_loss: 0.9683, test_f1: 0.5013
 epoch: 75, train_loss: 0.9135, test_loss: 0.9817, test_f1: 0.4944
 epoch: 76, train_loss: 0.9234, test_loss: 0.9776, test_f1: 0.5253
 epoch: 77, train_loss: 0.9255, test_loss: 0.9674, test_f1: 0.5156
 epoch: 78, train_loss: 0.9261, test_loss: 0.9731, test_f1: 0.5191
 epoch: 79, train_loss: 0.9288, test_loss: 0.9690, test_f1: 0.5014
 epoch: 80, train_loss: 0.9203, test_loss: 0.9725, test_f1: 0.5093
 epoch: 81, train_loss: 0.9208, test_loss: 0.9694, test_f1: 0.5015
 epoch: 82, train_loss: 0.9146, test_loss: 0.9599, test_f1: 0.5143
 epoch: 83, train_loss: 0.9245, test_loss: 0.9698, test_f1: 0.5069
 epoch: 84, train_loss: 0.9133, test_loss: 0.9685, test_f1: 0.5018
 epoch: 85, train_loss: 0.9250, test_loss: 0.9755, test_f1: 0.5039
 epoch: 86, train_loss: 0.9128, test_loss: 0.9788, test_f1: 0.5084
 epoch: 87, train_loss: 0.9189, test_loss: 0.9677, test_f1: 0.5024
 epoch: 88, train_loss: 0.9103, test_loss: 0.9742, test_f1: 0.5051
 epoch: 89, train_loss: 0.9220, test_loss: 0.9777, test_f1: 0.5007
 epoch: 90, train_loss: 0.9046, test_loss: 0.9807, test_f1: 0.5346
 epoch: 91, train_loss: 0.9208, test_loss: 0.9763, test_f1: 0.5049
 epoch: 92, train_loss: 0.9094, test_loss: 0.9760, test_f1: 0.5080
 epoch: 93, train_loss: 0.9199, test_loss: 0.9778, test_f1: 0.5157
 epoch: 94, train_loss: 0.9009, test_loss: 0.9748, test_f1: 0.5233
 epoch: 95, train_loss: 0.9082, test_loss: 0.9749, test_f1: 0.5282
 epoch: 96, train_loss: 0.9142, test_loss: 0.9801, test_f1: 0.5228
 epoch: 97, train_loss: 0.9128, test_loss: 0.9867, test_f1: 0.5073
 epoch: 98, train_loss: 0.9075, test_loss: 0.9807, test_f1: 0.5109
 epoch: 99, train_loss: 0.9111, test_loss: 0.9799, test_f1: 0.5022
##################ITERATION #7 ****************************************
 epoch: 0, train_loss: 1.3314, test_loss: 1.3005, test_f1: 0.2270
 epoch: 1, train_loss: 1.2808, test_loss: 1.2458, test_f1: 0.2549
 epoch: 2, train_loss: 1.2524, test_loss: 1.2221, test_f1: 0.2977
 epoch: 3, train_loss: 1.2267, test_loss: 1.1995, test_f1: 0.3030
 epoch: 4, train_loss: 1.2244, test_loss: 1.1812, test_f1: 0.3199
 epoch: 5, train_loss: 1.2071, test_loss: 1.1695, test_f1: 0.3291
 epoch: 6, train_loss: 1.1975, test_loss: 1.1533, test_f1: 0.3476
 epoch: 7, train_loss: 1.1863, test_loss: 1.1388, test_f1: 0.3555
 epoch: 8, train_loss: 1.1707, test_loss: 1.1316, test_f1: 0.3689
 epoch: 9, train_loss: 1.1627, test_loss: 1.1167, test_f1: 0.3790
 epoch: 10, train_loss: 1.1576, test_loss: 1.1058, test_f1: 0.3890
 epoch: 11, train_loss: 1.1420, test_loss: 1.0936, test_f1: 0.4056
 epoch: 12, train_loss: 1.1355, test_loss: 1.0813, test_f1: 0.4191
 epoch: 13, train_loss: 1.1279, test_loss: 1.0662, test_f1: 0.4296
 epoch: 14, train_loss: 1.1107, test_loss: 1.0617, test_f1: 0.4349
 epoch: 15, train_loss: 1.1044, test_loss: 1.0496, test_f1: 0.4477
 epoch: 16, train_loss: 1.0917, test_loss: 1.0386, test_f1: 0.4510
 epoch: 17, train_loss: 1.0920, test_loss: 1.0327, test_f1: 0.4475
 epoch: 18, train_loss: 1.0838, test_loss: 1.0292, test_f1: 0.4324
 epoch: 19, train_loss: 1.0708, test_loss: 1.0200, test_f1: 0.4377
 epoch: 20, train_loss: 1.0570, test_loss: 1.0060, test_f1: 0.4494
 epoch: 21, train_loss: 1.0518, test_loss: 0.9990, test_f1: 0.4676
 epoch: 22, train_loss: 1.0428, test_loss: 0.9949, test_f1: 0.4612
 epoch: 23, train_loss: 1.0432, test_loss: 0.9827, test_f1: 0.4618
 epoch: 24, train_loss: 1.0307, test_loss: 0.9757, test_f1: 0.4762
 epoch: 25, train_loss: 1.0251, test_loss: 0.9739, test_f1: 0.4768
 epoch: 26, train_loss: 1.0197, test_loss: 0.9683, test_f1: 0.4786
 epoch: 27, train_loss: 1.0172, test_loss: 0.9562, test_f1: 0.4879
 epoch: 28, train_loss: 1.0181, test_loss: 0.9621, test_f1: 0.4784
 epoch: 29, train_loss: 1.0082, test_loss: 0.9573, test_f1: 0.5016
 epoch: 30, train_loss: 1.0043, test_loss: 0.9469, test_f1: 0.4928
 epoch: 31, train_loss: 0.9979, test_loss: 0.9459, test_f1: 0.4920
 epoch: 32, train_loss: 0.9940, test_loss: 0.9485, test_f1: 0.4995
 epoch: 33, train_loss: 0.9895, test_loss: 0.9358, test_f1: 0.5085
 epoch: 34, train_loss: 0.9836, test_loss: 0.9340, test_f1: 0.5065
 epoch: 35, train_loss: 0.9803, test_loss: 0.9295, test_f1: 0.5056
 epoch: 36, train_loss: 0.9709, test_loss: 0.9243, test_f1: 0.5010
 epoch: 37, train_loss: 0.9751, test_loss: 0.9205, test_f1: 0.5019
 epoch: 38, train_loss: 0.9665, test_loss: 0.9164, test_f1: 0.5127
 epoch: 39, train_loss: 0.9653, test_loss: 0.9126, test_f1: 0.5090
 epoch: 40, train_loss: 0.9607, test_loss: 0.9119, test_f1: 0.5113
 epoch: 41, train_loss: 0.9569, test_loss: 0.9192, test_f1: 0.5196
 epoch: 42, train_loss: 0.9503, test_loss: 0.9137, test_f1: 0.5076
 epoch: 43, train_loss: 0.9558, test_loss: 0.9088, test_f1: 0.5381
 epoch: 44, train_loss: 0.9484, test_loss: 0.9031, test_f1: 0.5363
 epoch: 45, train_loss: 0.9424, test_loss: 0.8979, test_f1: 0.5271
 epoch: 46, train_loss: 0.9487, test_loss: 0.9039, test_f1: 0.5172
 epoch: 47, train_loss: 0.9309, test_loss: 0.9006, test_f1: 0.5341
 epoch: 48, train_loss: 0.9346, test_loss: 0.8943, test_f1: 0.5078
 epoch: 49, train_loss: 0.9360, test_loss: 0.8961, test_f1: 0.5290
 epoch: 50, train_loss: 0.9217, test_loss: 0.9023, test_f1: 0.5306
 epoch: 51, train_loss: 0.9311, test_loss: 0.8880, test_f1: 0.5436
 epoch: 52, train_loss: 0.9187, test_loss: 0.8869, test_f1: 0.5423
 epoch: 53, train_loss: 0.9257, test_loss: 0.8903, test_f1: 0.5339
 epoch: 54, train_loss: 0.9153, test_loss: 0.8885, test_f1: 0.5410
 epoch: 55, train_loss: 0.9114, test_loss: 0.8866, test_f1: 0.5432
 epoch: 56, train_loss: 0.9099, test_loss: 0.8910, test_f1: 0.5296
 epoch: 57, train_loss: 0.9180, test_loss: 0.8873, test_f1: 0.5347
 epoch: 58, train_loss: 0.9148, test_loss: 0.8913, test_f1: 0.5270
 epoch: 59, train_loss: 0.9137, test_loss: 0.8939, test_f1: 0.5343
 epoch: 60, train_loss: 0.9138, test_loss: 0.8866, test_f1: 0.5386
 epoch: 61, train_loss: 0.9075, test_loss: 0.8910, test_f1: 0.5419
 epoch: 62, train_loss: 0.9087, test_loss: 0.8877, test_f1: 0.5439
 epoch: 63, train_loss: 0.9131, test_loss: 0.8906, test_f1: 0.5410
 epoch: 64, train_loss: 0.9057, test_loss: 0.8886, test_f1: 0.5388
 epoch: 65, train_loss: 0.9043, test_loss: 0.8855, test_f1: 0.5268
 epoch: 66, train_loss: 0.9090, test_loss: 0.8839, test_f1: 0.5236
 epoch: 67, train_loss: 0.9025, test_loss: 0.8914, test_f1: 0.5296
 epoch: 68, train_loss: 0.9094, test_loss: 0.8816, test_f1: 0.5487
 epoch: 69, train_loss: 0.8932, test_loss: 0.8830, test_f1: 0.5474
 epoch: 70, train_loss: 0.8971, test_loss: 0.8847, test_f1: 0.5365
 epoch: 71, train_loss: 0.9029, test_loss: 0.8836, test_f1: 0.5436
 epoch: 72, train_loss: 0.8976, test_loss: 0.8800, test_f1: 0.5414
 epoch: 73, train_loss: 0.8925, test_loss: 0.8822, test_f1: 0.5428
 epoch: 74, train_loss: 0.9018, test_loss: 0.8853, test_f1: 0.5388
 epoch: 75, train_loss: 0.9081, test_loss: 0.8839, test_f1: 0.5402
 epoch: 76, train_loss: 0.8932, test_loss: 0.8797, test_f1: 0.5457
 epoch: 77, train_loss: 0.8944, test_loss: 0.8824, test_f1: 0.5504
 epoch: 78, train_loss: 0.8945, test_loss: 0.8793, test_f1: 0.5442
 epoch: 79, train_loss: 0.8958, test_loss: 0.8827, test_f1: 0.5431
 epoch: 80, train_loss: 0.8988, test_loss: 0.8793, test_f1: 0.5508
 epoch: 81, train_loss: 0.8877, test_loss: 0.8806, test_f1: 0.5389
 epoch: 82, train_loss: 0.8815, test_loss: 0.8835, test_f1: 0.5515
 epoch: 83, train_loss: 0.8846, test_loss: 0.8888, test_f1: 0.5449
 epoch: 84, train_loss: 0.8939, test_loss: 0.8906, test_f1: 0.5496
 epoch: 85, train_loss: 0.8880, test_loss: 0.8768, test_f1: 0.5625
 epoch: 86, train_loss: 0.8887, test_loss: 0.8828, test_f1: 0.5530
 epoch: 87, train_loss: 0.8828, test_loss: 0.8776, test_f1: 0.5600
 epoch: 88, train_loss: 0.8837, test_loss: 0.8857, test_f1: 0.5520
 epoch: 89, train_loss: 0.8822, test_loss: 0.8776, test_f1: 0.5471
 epoch: 90, train_loss: 0.8752, test_loss: 0.8802, test_f1: 0.5571
 epoch: 91, train_loss: 0.8818, test_loss: 0.8770, test_f1: 0.5518
 epoch: 92, train_loss: 0.8810, test_loss: 0.8794, test_f1: 0.5591
 epoch: 93, train_loss: 0.8703, test_loss: 0.8767, test_f1: 0.5502
 epoch: 94, train_loss: 0.8820, test_loss: 0.8803, test_f1: 0.5496
 epoch: 95, train_loss: 0.8794, test_loss: 0.8760, test_f1: 0.5523
 epoch: 96, train_loss: 0.8797, test_loss: 0.8780, test_f1: 0.5469
 epoch: 97, train_loss: 0.8685, test_loss: 0.8752, test_f1: 0.5477
 epoch: 98, train_loss: 0.8697, test_loss: 0.8782, test_f1: 0.5521
 epoch: 99, train_loss: 0.8749, test_loss: 0.8753, test_f1: 0.5532
##################ITERATION #8 ****************************************
 epoch: 0, train_loss: 1.2982, test_loss: 1.3683, test_f1: 0.2613
 epoch: 1, train_loss: 1.2516, test_loss: 1.2405, test_f1: 0.2843
 epoch: 2, train_loss: 1.2276, test_loss: 1.1980, test_f1: 0.3170
 epoch: 3, train_loss: 1.2087, test_loss: 1.1774, test_f1: 0.3722
 epoch: 4, train_loss: 1.1960, test_loss: 1.1696, test_f1: 0.3831
 epoch: 5, train_loss: 1.1880, test_loss: 1.1577, test_f1: 0.3763
 epoch: 6, train_loss: 1.1673, test_loss: 1.1364, test_f1: 0.3882
 epoch: 7, train_loss: 1.1600, test_loss: 1.1212, test_f1: 0.3919
 epoch: 8, train_loss: 1.1506, test_loss: 1.1175, test_f1: 0.3817
 epoch: 9, train_loss: 1.1405, test_loss: 1.0975, test_f1: 0.3965
 epoch: 10, train_loss: 1.1289, test_loss: 1.0922, test_f1: 0.3864
 epoch: 11, train_loss: 1.1170, test_loss: 1.0785, test_f1: 0.4016
 epoch: 12, train_loss: 1.1131, test_loss: 1.0664, test_f1: 0.4061
 epoch: 13, train_loss: 1.1060, test_loss: 1.0716, test_f1: 0.4188
 epoch: 14, train_loss: 1.1053, test_loss: 1.0627, test_f1: 0.4130
 epoch: 15, train_loss: 1.0941, test_loss: 1.0652, test_f1: 0.4231
 epoch: 16, train_loss: 1.0912, test_loss: 1.0409, test_f1: 0.4304
 epoch: 17, train_loss: 1.0845, test_loss: 1.0444, test_f1: 0.4335
 epoch: 18, train_loss: 1.0643, test_loss: 1.0302, test_f1: 0.4501
 epoch: 19, train_loss: 1.0571, test_loss: 1.0367, test_f1: 0.4352
 epoch: 20, train_loss: 1.0639, test_loss: 1.0314, test_f1: 0.4586
 epoch: 21, train_loss: 1.0533, test_loss: 1.0411, test_f1: 0.4448
 epoch: 22, train_loss: 1.0415, test_loss: 1.0439, test_f1: 0.4446
 epoch: 23, train_loss: 1.0398, test_loss: 1.0188, test_f1: 0.4550
 epoch: 24, train_loss: 1.0411, test_loss: 1.0791, test_f1: 0.4252
 epoch: 25, train_loss: 1.0378, test_loss: 1.0138, test_f1: 0.4576
 epoch: 26, train_loss: 1.0272, test_loss: 1.0121, test_f1: 0.4654
 epoch: 27, train_loss: 1.0247, test_loss: 1.0352, test_f1: 0.4493
 epoch: 28, train_loss: 1.0276, test_loss: 1.0411, test_f1: 0.4499
 epoch: 29, train_loss: 1.0178, test_loss: 1.0198, test_f1: 0.4662
 epoch: 30, train_loss: 1.0076, test_loss: 1.0157, test_f1: 0.4661
 epoch: 31, train_loss: 1.0028, test_loss: 1.0073, test_f1: 0.4857
 epoch: 32, train_loss: 1.0042, test_loss: 1.0078, test_f1: 0.4805
 epoch: 33, train_loss: 1.0068, test_loss: 1.0181, test_f1: 0.4785
 epoch: 34, train_loss: 0.9968, test_loss: 1.0220, test_f1: 0.4543
 epoch: 35, train_loss: 0.9930, test_loss: 0.9938, test_f1: 0.4772
 epoch: 36, train_loss: 0.9876, test_loss: 1.0237, test_f1: 0.4783
 epoch: 37, train_loss: 0.9859, test_loss: 1.0033, test_f1: 0.4927
 epoch: 38, train_loss: 0.9949, test_loss: 1.0120, test_f1: 0.4895
 epoch: 39, train_loss: 0.9844, test_loss: 1.0043, test_f1: 0.4779
 epoch: 40, train_loss: 0.9806, test_loss: 1.0012, test_f1: 0.4821
 epoch: 41, train_loss: 0.9702, test_loss: 1.0122, test_f1: 0.4602
 epoch: 42, train_loss: 0.9819, test_loss: 1.0388, test_f1: 0.4558
 epoch: 43, train_loss: 0.9803, test_loss: 0.9975, test_f1: 0.4955
 epoch: 44, train_loss: 0.9706, test_loss: 0.9982, test_f1: 0.4990
 epoch: 45, train_loss: 0.9637, test_loss: 1.0033, test_f1: 0.5051
 epoch: 46, train_loss: 0.9743, test_loss: 1.0025, test_f1: 0.5006
 epoch: 47, train_loss: 0.9593, test_loss: 1.0144, test_f1: 0.4763
 epoch: 48, train_loss: 0.9605, test_loss: 0.9913, test_f1: 0.4990
 epoch: 49, train_loss: 0.9548, test_loss: 0.9903, test_f1: 0.5054
 epoch: 50, train_loss: 0.9603, test_loss: 0.9985, test_f1: 0.5043
 epoch: 51, train_loss: 0.9576, test_loss: 0.9903, test_f1: 0.5010
 epoch: 52, train_loss: 0.9461, test_loss: 0.9867, test_f1: 0.5224
 epoch: 53, train_loss: 0.9409, test_loss: 0.9919, test_f1: 0.5069
 epoch: 54, train_loss: 0.9492, test_loss: 0.9981, test_f1: 0.5057
 epoch: 55, train_loss: 0.9455, test_loss: 0.9875, test_f1: 0.5142
 epoch: 56, train_loss: 0.9375, test_loss: 0.9814, test_f1: 0.5152
 epoch: 57, train_loss: 0.9499, test_loss: 0.9802, test_f1: 0.5163
 epoch: 58, train_loss: 0.9357, test_loss: 0.9836, test_f1: 0.5127
 epoch: 59, train_loss: 0.9384, test_loss: 0.9866, test_f1: 0.5142
 epoch: 60, train_loss: 0.9324, test_loss: 0.9829, test_f1: 0.4919
 epoch: 61, train_loss: 0.9379, test_loss: 0.9863, test_f1: 0.5152
 epoch: 62, train_loss: 0.9403, test_loss: 0.9909, test_f1: 0.5010
 epoch: 63, train_loss: 0.9230, test_loss: 0.9899, test_f1: 0.5142
 epoch: 64, train_loss: 0.9411, test_loss: 0.9867, test_f1: 0.5043
 epoch: 65, train_loss: 0.9347, test_loss: 0.9854, test_f1: 0.5073
 epoch: 66, train_loss: 0.9283, test_loss: 0.9881, test_f1: 0.5042
 epoch: 67, train_loss: 0.9355, test_loss: 0.9817, test_f1: 0.5075
 epoch: 68, train_loss: 0.9283, test_loss: 0.9870, test_f1: 0.5061
 epoch: 69, train_loss: 0.9230, test_loss: 0.9888, test_f1: 0.5167
 epoch: 70, train_loss: 0.9262, test_loss: 0.9872, test_f1: 0.5023
 epoch: 71, train_loss: 0.9279, test_loss: 0.9861, test_f1: 0.5185
 epoch: 72, train_loss: 0.9309, test_loss: 0.9822, test_f1: 0.5222
 epoch: 73, train_loss: 0.9234, test_loss: 0.9849, test_f1: 0.5102
 epoch: 74, train_loss: 0.9223, test_loss: 0.9750, test_f1: 0.5218
 epoch: 75, train_loss: 0.9122, test_loss: 0.9867, test_f1: 0.5238
 epoch: 76, train_loss: 0.9252, test_loss: 0.9861, test_f1: 0.5185
 epoch: 77, train_loss: 0.9181, test_loss: 0.9797, test_f1: 0.5055
 epoch: 78, train_loss: 0.9172, test_loss: 0.9811, test_f1: 0.5035
 epoch: 79, train_loss: 0.9122, test_loss: 0.9827, test_f1: 0.5194
 epoch: 80, train_loss: 0.9137, test_loss: 0.9732, test_f1: 0.5162
 epoch: 81, train_loss: 0.9100, test_loss: 0.9803, test_f1: 0.5125
 epoch: 82, train_loss: 0.9174, test_loss: 0.9638, test_f1: 0.5213
 epoch: 83, train_loss: 0.9114, test_loss: 0.9695, test_f1: 0.5221
 epoch: 84, train_loss: 0.9084, test_loss: 0.9839, test_f1: 0.5150
 epoch: 85, train_loss: 0.9088, test_loss: 0.9789, test_f1: 0.5168
 epoch: 86, train_loss: 0.9091, test_loss: 0.9804, test_f1: 0.5198
 epoch: 87, train_loss: 0.9039, test_loss: 0.9643, test_f1: 0.5184
 epoch: 88, train_loss: 0.9069, test_loss: 0.9723, test_f1: 0.5253
 epoch: 89, train_loss: 0.9104, test_loss: 0.9739, test_f1: 0.5232
 epoch: 90, train_loss: 0.9020, test_loss: 0.9792, test_f1: 0.5190
 epoch: 91, train_loss: 0.8977, test_loss: 0.9838, test_f1: 0.5232
 epoch: 92, train_loss: 0.8965, test_loss: 0.9770, test_f1: 0.5319
 epoch: 93, train_loss: 0.8965, test_loss: 0.9789, test_f1: 0.5117
 epoch: 94, train_loss: 0.9002, test_loss: 0.9822, test_f1: 0.5256
 epoch: 95, train_loss: 0.8962, test_loss: 0.9755, test_f1: 0.5212
 epoch: 96, train_loss: 0.9028, test_loss: 0.9749, test_f1: 0.5228
 epoch: 97, train_loss: 0.9048, test_loss: 0.9759, test_f1: 0.5254
 epoch: 98, train_loss: 0.8967, test_loss: 0.9785, test_f1: 0.5169
 epoch: 99, train_loss: 0.9023, test_loss: 0.9842, test_f1: 0.5237
##################ITERATION #9 ****************************************
 epoch: 0, train_loss: 1.3708, test_loss: 1.3434, test_f1: 0.2270
 epoch: 1, train_loss: 1.2917, test_loss: 1.3202, test_f1: 0.3282
 epoch: 2, train_loss: 1.2639, test_loss: 1.2583, test_f1: 0.3254
 epoch: 3, train_loss: 1.2484, test_loss: 1.2144, test_f1: 0.3727
 epoch: 4, train_loss: 1.2355, test_loss: 1.2004, test_f1: 0.3813
 epoch: 5, train_loss: 1.2114, test_loss: 1.1833, test_f1: 0.4009
 epoch: 6, train_loss: 1.2024, test_loss: 1.1656, test_f1: 0.4055
 epoch: 7, train_loss: 1.1949, test_loss: 1.1428, test_f1: 0.4089
 epoch: 8, train_loss: 1.1790, test_loss: 1.1321, test_f1: 0.4123
 epoch: 9, train_loss: 1.1729, test_loss: 1.1199, test_f1: 0.4224
 epoch: 10, train_loss: 1.1537, test_loss: 1.1085, test_f1: 0.4283
 epoch: 11, train_loss: 1.1466, test_loss: 1.0930, test_f1: 0.4252
 epoch: 12, train_loss: 1.1508, test_loss: 1.0852, test_f1: 0.4431
 epoch: 13, train_loss: 1.1398, test_loss: 1.0772, test_f1: 0.4557
 epoch: 14, train_loss: 1.1392, test_loss: 1.0685, test_f1: 0.4542
 epoch: 15, train_loss: 1.1191, test_loss: 1.0581, test_f1: 0.4607
 epoch: 16, train_loss: 1.1094, test_loss: 1.0440, test_f1: 0.4641
 epoch: 17, train_loss: 1.1056, test_loss: 1.0480, test_f1: 0.4499
 epoch: 18, train_loss: 1.1033, test_loss: 1.0287, test_f1: 0.4781
 epoch: 19, train_loss: 1.0935, test_loss: 1.0251, test_f1: 0.4700
 epoch: 20, train_loss: 1.0853, test_loss: 1.0157, test_f1: 0.4787
 epoch: 21, train_loss: 1.0891, test_loss: 1.0101, test_f1: 0.4841
 epoch: 22, train_loss: 1.0747, test_loss: 1.0134, test_f1: 0.4612
 epoch: 23, train_loss: 1.0697, test_loss: 1.0055, test_f1: 0.4812
 epoch: 24, train_loss: 1.0671, test_loss: 0.9992, test_f1: 0.4888
 epoch: 25, train_loss: 1.0608, test_loss: 0.9910, test_f1: 0.4976
 epoch: 26, train_loss: 1.0625, test_loss: 0.9857, test_f1: 0.4926
 epoch: 27, train_loss: 1.0566, test_loss: 0.9816, test_f1: 0.4987
 epoch: 28, train_loss: 1.0409, test_loss: 0.9693, test_f1: 0.5030
 epoch: 29, train_loss: 1.0433, test_loss: 0.9818, test_f1: 0.4825
 epoch: 30, train_loss: 1.0441, test_loss: 0.9681, test_f1: 0.4844
 epoch: 31, train_loss: 1.0303, test_loss: 0.9704, test_f1: 0.4978
 epoch: 32, train_loss: 1.0318, test_loss: 0.9553, test_f1: 0.5122
 epoch: 33, train_loss: 1.0273, test_loss: 0.9555, test_f1: 0.4914
 epoch: 34, train_loss: 1.0187, test_loss: 0.9539, test_f1: 0.4929
 epoch: 35, train_loss: 1.0286, test_loss: 0.9555, test_f1: 0.4897
 epoch: 36, train_loss: 1.0197, test_loss: 0.9472, test_f1: 0.4924
 epoch: 37, train_loss: 1.0056, test_loss: 0.9494, test_f1: 0.4917
 epoch: 38, train_loss: 1.0052, test_loss: 0.9422, test_f1: 0.4924
 epoch: 39, train_loss: 1.0059, test_loss: 0.9290, test_f1: 0.4983
 epoch: 40, train_loss: 1.0001, test_loss: 0.9454, test_f1: 0.4917
 epoch: 41, train_loss: 1.0038, test_loss: 0.9290, test_f1: 0.4970
 epoch: 42, train_loss: 1.0009, test_loss: 0.9421, test_f1: 0.4947
 epoch: 43, train_loss: 0.9950, test_loss: 0.9278, test_f1: 0.4892
 epoch: 44, train_loss: 0.9982, test_loss: 0.9331, test_f1: 0.4925
 epoch: 45, train_loss: 0.9887, test_loss: 0.9328, test_f1: 0.4884
 epoch: 46, train_loss: 0.9734, test_loss: 0.9344, test_f1: 0.4897
 epoch: 47, train_loss: 0.9817, test_loss: 0.9243, test_f1: 0.4954
 epoch: 48, train_loss: 0.9680, test_loss: 0.9190, test_f1: 0.4935
 epoch: 49, train_loss: 0.9712, test_loss: 0.9296, test_f1: 0.4813
 epoch: 50, train_loss: 0.9785, test_loss: 0.9276, test_f1: 0.4841
 epoch: 51, train_loss: 0.9693, test_loss: 0.9237, test_f1: 0.4853
 epoch: 52, train_loss: 0.9701, test_loss: 0.9278, test_f1: 0.4889
 epoch: 53, train_loss: 0.9667, test_loss: 0.9286, test_f1: 0.4836
 epoch: 54, train_loss: 0.9685, test_loss: 0.9282, test_f1: 0.4811
 epoch: 55, train_loss: 0.9642, test_loss: 0.9307, test_f1: 0.4854
 epoch: 56, train_loss: 0.9617, test_loss: 0.9184, test_f1: 0.4878
 epoch: 57, train_loss: 0.9579, test_loss: 0.9281, test_f1: 0.4917
 epoch: 58, train_loss: 0.9505, test_loss: 0.9214, test_f1: 0.4916
 epoch: 59, train_loss: 0.9543, test_loss: 0.9274, test_f1: 0.4847
 epoch: 60, train_loss: 0.9613, test_loss: 0.9323, test_f1: 0.4881
 epoch: 61, train_loss: 0.9531, test_loss: 0.9210, test_f1: 0.4924
 epoch: 62, train_loss: 0.9440, test_loss: 0.9230, test_f1: 0.4954
 epoch: 63, train_loss: 0.9509, test_loss: 0.9196, test_f1: 0.4924
 epoch: 64, train_loss: 0.9462, test_loss: 0.9183, test_f1: 0.4953
 epoch: 65, train_loss: 0.9453, test_loss: 0.9224, test_f1: 0.4939
 epoch: 66, train_loss: 0.9481, test_loss: 0.9349, test_f1: 0.4889
 epoch: 67, train_loss: 0.9468, test_loss: 0.9235, test_f1: 0.4895
 epoch: 68, train_loss: 0.9353, test_loss: 0.9140, test_f1: 0.4942
 epoch: 69, train_loss: 0.9428, test_loss: 0.9245, test_f1: 0.4897
 epoch: 70, train_loss: 0.9492, test_loss: 0.9213, test_f1: 0.4958
 epoch: 71, train_loss: 0.9395, test_loss: 0.9201, test_f1: 0.4964
 epoch: 72, train_loss: 0.9445, test_loss: 0.9245, test_f1: 0.4916
 epoch: 73, train_loss: 0.9303, test_loss: 0.9160, test_f1: 0.4986
 epoch: 74, train_loss: 0.9373, test_loss: 0.9141, test_f1: 0.4966
 epoch: 75, train_loss: 0.9373, test_loss: 0.9265, test_f1: 0.4882
 epoch: 76, train_loss: 0.9332, test_loss: 0.9139, test_f1: 0.5014
 epoch: 77, train_loss: 0.9346, test_loss: 0.9220, test_f1: 0.4986
 epoch: 78, train_loss: 0.9371, test_loss: 0.9184, test_f1: 0.4994
 epoch: 79, train_loss: 0.9423, test_loss: 0.9329, test_f1: 0.4899
 epoch: 80, train_loss: 0.9280, test_loss: 0.9343, test_f1: 0.4947
 epoch: 81, train_loss: 0.9259, test_loss: 0.9346, test_f1: 0.4958
 epoch: 82, train_loss: 0.9347, test_loss: 0.9329, test_f1: 0.4939
 epoch: 83, train_loss: 0.9374, test_loss: 0.9256, test_f1: 0.4912
 epoch: 84, train_loss: 0.9262, test_loss: 0.9213, test_f1: 0.4937
 epoch: 85, train_loss: 0.9299, test_loss: 0.9251, test_f1: 0.4921
 epoch: 86, train_loss: 0.9370, test_loss: 0.9302, test_f1: 0.4948
 epoch: 87, train_loss: 0.9236, test_loss: 0.9205, test_f1: 0.5017
 epoch: 88, train_loss: 0.9172, test_loss: 0.9198, test_f1: 0.4972
 epoch: 89, train_loss: 0.9227, test_loss: 0.9240, test_f1: 0.5016
 epoch: 90, train_loss: 0.9253, test_loss: 0.9304, test_f1: 0.5032
 epoch: 91, train_loss: 0.9214, test_loss: 0.9356, test_f1: 0.4983
 epoch: 92, train_loss: 0.9324, test_loss: 0.9207, test_f1: 0.5059
 epoch: 93, train_loss: 0.9274, test_loss: 0.9150, test_f1: 0.5013
 epoch: 94, train_loss: 0.9159, test_loss: 0.9125, test_f1: 0.5021
 epoch: 95, train_loss: 0.9269, test_loss: 0.9280, test_f1: 0.4959
 epoch: 96, train_loss: 0.9205, test_loss: 0.9337, test_f1: 0.4949
 epoch: 97, train_loss: 0.9172, test_loss: 0.9218, test_f1: 0.4988
 epoch: 98, train_loss: 0.9163, test_loss: 0.9303, test_f1: 0.4958
 epoch: 99, train_loss: 0.9152, test_loss: 0.9325, test_f1: 0.4974

Training completed in 521.76 seconds
Best F1: 0.5625 at epoch 85
Mean F1 across iterations: 0.5335  0.0149
========================FINAL RESULTS================================
FEGIN weighted F1: 0.5625  0.0149
python main.py --data ltspice_examples --representation component_net --model FEGIN --layers 5 --hiddens 32 --batch_size 128 --lr 0.0001 --emb_size 250 --epochs 100 --save_appendix component_net_L5_H32_BS128_LR0.0001_E250 --no_val
-----



STDERR:
  File "main.py", line 370, in <module>
    main()
  File "main.py", line 254, in main
    dataset = dataset_class(
  File "/home/philip/projects/ltspice_examples_code_repo/Circuit-Completion-Using-GNNs/component_classification_with_link_prediction_head/evaluation/FEGIN/kernel/circuit_datasets.py", line 15, in __init__
    self.data, self.slices = torch.load(self.processed_paths[0])
  File "/home/philip/.local/lib/python3.8/site-packages/torch/serialization.py", line 1040, in load
    warnings.warn(
  File "/usr/lib/python3.8/warnings.py", line 109, in _showwarnmsg
    sw(msg.message, msg.category, msg.filename, msg.lineno,
  File "main.py", line 47, in warn_with_traceback
    traceback.print_stack(file=log)
/home/philip/projects/ltspice_examples_code_repo/Circuit-Completion-Using-GNNs/component_classification_with_link_prediction_head/evaluation/FEGIN/kernel/circuit_datasets.py:15: FutureWarning: You are using `torch.load` with `weights_only=False` (the current default value), which uses the default pickle module implicitly. It is possible to construct malicious pickle data which will execute arbitrary code during unpickling (See https://github.com/pytorch/pytorch/blob/main/SECURITY.md#untrusted-models for more details). In a future release, the default value for `weights_only` will be flipped to `True`. This limits the functions that could be executed during unpickling. Arbitrary objects will no longer be allowed to be loaded via this mode unless they are explicitly allowlisted by the user via `torch.serialization.add_safe_globals`. We recommend you start setting `weights_only=True` for any use case where you don't have full control of the loaded file. Please open an issue on GitHub for any issues related to this experimental feature.
  self.data, self.slices = torch.load(self.processed_paths[0])
