STDOUT:
Results will be saved in /home/philip/projects/ltspice_examples_code_repo/Circuit-Completion-Using-GNNs/component_classification_with_link_prediction_head/evaluation/FEGIN/results/model_FEGIN_dataset_ltspice_demos
Command line input: python main.py --data ltspice_demos --representation component_component --model FEGIN --layers 5 --hiddens 32 --batch_size 64 --lr 0.01 --emb_size 128 --epochs 100 --save_appendix component_component_L5_H32_BS64_LR0.01_E128 --no_val
 is saved.
-----
ltspice_demos - FEGIN
Using 5 layers, 32 hidden units, h = 2
Loading component_component representation dataset
ENTERED
Training FEGIN on component_component representation
Train: 1565, Test: 383
##################ITERATION #0 ****************************************
 epoch: 0, train_loss: 1.2468, test_loss: 1.2954, test_f1: 0.3341
 epoch: 1, train_loss: 1.1598, test_loss: 1.2834, test_f1: 0.4037
 epoch: 2, train_loss: 1.1259, test_loss: 1.2205, test_f1: 0.4271
 epoch: 3, train_loss: 1.1071, test_loss: 1.1984, test_f1: 0.3085
 epoch: 4, train_loss: 1.0445, test_loss: 1.2696, test_f1: 0.4403
 epoch: 5, train_loss: 0.9952, test_loss: 1.2803, test_f1: 0.4256
 epoch: 6, train_loss: 0.9539, test_loss: 1.1654, test_f1: 0.4676
 epoch: 7, train_loss: 0.9701, test_loss: 1.0964, test_f1: 0.4288
 epoch: 8, train_loss: 0.9306, test_loss: 1.3447, test_f1: 0.4698
 epoch: 9, train_loss: 0.9025, test_loss: 1.3375, test_f1: 0.3728
 epoch: 10, train_loss: 0.8900, test_loss: 1.0208, test_f1: 0.4557
 epoch: 11, train_loss: 0.8686, test_loss: 1.0644, test_f1: 0.4761
 epoch: 12, train_loss: 0.8628, test_loss: 1.2988, test_f1: 0.4274
 epoch: 13, train_loss: 0.8730, test_loss: 1.1101, test_f1: 0.4339
 epoch: 14, train_loss: 0.8470, test_loss: 1.0715, test_f1: 0.4403
 epoch: 15, train_loss: 0.8367, test_loss: 1.0255, test_f1: 0.5411
 epoch: 16, train_loss: 0.8167, test_loss: 1.1176, test_f1: 0.4328
 epoch: 17, train_loss: 0.8269, test_loss: 1.0783, test_f1: 0.5199
 epoch: 18, train_loss: 0.8269, test_loss: 1.1748, test_f1: 0.5338
 epoch: 19, train_loss: 0.8342, test_loss: 1.2228, test_f1: 0.4202
 epoch: 20, train_loss: 0.8117, test_loss: 0.9823, test_f1: 0.4685
 epoch: 21, train_loss: 0.7898, test_loss: 1.2024, test_f1: 0.5149
 epoch: 22, train_loss: 0.7878, test_loss: 1.1189, test_f1: 0.5043
 epoch: 23, train_loss: 0.8026, test_loss: 1.2706, test_f1: 0.5350
 epoch: 24, train_loss: 0.7890, test_loss: 1.2012, test_f1: 0.5236
 epoch: 25, train_loss: 0.7611, test_loss: 1.1401, test_f1: 0.5199
 epoch: 26, train_loss: 0.7734, test_loss: 1.0447, test_f1: 0.5697
 epoch: 27, train_loss: 0.8028, test_loss: 1.0672, test_f1: 0.5636
 epoch: 28, train_loss: 0.7653, test_loss: 1.1487, test_f1: 0.5691
 epoch: 29, train_loss: 0.7555, test_loss: 1.2711, test_f1: 0.5222
 epoch: 30, train_loss: 0.7427, test_loss: 1.4897, test_f1: 0.5228
 epoch: 31, train_loss: 0.7751, test_loss: 1.3333, test_f1: 0.4476
 epoch: 32, train_loss: 0.7415, test_loss: 1.0343, test_f1: 0.5588
 epoch: 33, train_loss: 0.7366, test_loss: 1.1214, test_f1: 0.6114
 epoch: 34, train_loss: 0.7242, test_loss: 1.1092, test_f1: 0.5823
 epoch: 35, train_loss: 0.7214, test_loss: 1.2271, test_f1: 0.5875
 epoch: 36, train_loss: 0.7192, test_loss: 1.4530, test_f1: 0.4478
 epoch: 37, train_loss: 0.7373, test_loss: 1.1625, test_f1: 0.6007
 epoch: 38, train_loss: 0.7328, test_loss: 1.5137, test_f1: 0.5024
 epoch: 39, train_loss: 0.7155, test_loss: 1.1166, test_f1: 0.5767
 epoch: 40, train_loss: 0.7249, test_loss: 1.2128, test_f1: 0.6052
 epoch: 41, train_loss: 0.6838, test_loss: 1.1018, test_f1: 0.5880
 epoch: 42, train_loss: 0.6964, test_loss: 1.1219, test_f1: 0.5816
 epoch: 43, train_loss: 0.6928, test_loss: 1.6173, test_f1: 0.4437
 epoch: 44, train_loss: 0.7008, test_loss: 1.2969, test_f1: 0.5530
 epoch: 45, train_loss: 0.6938, test_loss: 1.2006, test_f1: 0.5738
 epoch: 46, train_loss: 0.7306, test_loss: 1.1779, test_f1: 0.5307
 epoch: 47, train_loss: 0.6731, test_loss: 1.4762, test_f1: 0.5002
 epoch: 48, train_loss: 0.7292, test_loss: 1.0985, test_f1: 0.5350
 epoch: 49, train_loss: 0.6815, test_loss: 1.1235, test_f1: 0.5926
 epoch: 50, train_loss: 0.6670, test_loss: 1.3262, test_f1: 0.5943
 epoch: 51, train_loss: 0.6514, test_loss: 1.1160, test_f1: 0.6048
 epoch: 52, train_loss: 0.6321, test_loss: 1.1953, test_f1: 0.5966
 epoch: 53, train_loss: 0.6230, test_loss: 1.2390, test_f1: 0.5692
 epoch: 54, train_loss: 0.5936, test_loss: 1.3413, test_f1: 0.5561
 epoch: 55, train_loss: 0.5994, test_loss: 1.3613, test_f1: 0.5816
 epoch: 56, train_loss: 0.5972, test_loss: 1.3557, test_f1: 0.5756
 epoch: 57, train_loss: 0.6147, test_loss: 1.3929, test_f1: 0.5634
 epoch: 58, train_loss: 0.5967, test_loss: 1.2742, test_f1: 0.5571
 epoch: 59, train_loss: 0.5972, test_loss: 1.3750, test_f1: 0.5663
 epoch: 60, train_loss: 0.5822, test_loss: 1.3357, test_f1: 0.5879
 epoch: 61, train_loss: 0.5935, test_loss: 1.4574, test_f1: 0.5234
 epoch: 62, train_loss: 0.5714, test_loss: 1.3475, test_f1: 0.5551
 epoch: 63, train_loss: 0.5936, test_loss: 1.5320, test_f1: 0.5952
 epoch: 64, train_loss: 0.5892, test_loss: 1.5982, test_f1: 0.5256
 epoch: 65, train_loss: 0.5645, test_loss: 1.4999, test_f1: 0.5967
 epoch: 66, train_loss: 0.5584, test_loss: 1.4982, test_f1: 0.5340
 epoch: 67, train_loss: 0.5595, test_loss: 1.4438, test_f1: 0.5413
 epoch: 68, train_loss: 0.5771, test_loss: 1.4886, test_f1: 0.5357
 epoch: 69, train_loss: 0.5545, test_loss: 1.4122, test_f1: 0.5553
 epoch: 70, train_loss: 0.5613, test_loss: 1.5677, test_f1: 0.5673
 epoch: 71, train_loss: 0.5557, test_loss: 1.7777, test_f1: 0.4824
 epoch: 72, train_loss: 0.5472, test_loss: 1.4880, test_f1: 0.5460
 epoch: 73, train_loss: 0.5207, test_loss: 1.7389, test_f1: 0.5257
 epoch: 74, train_loss: 0.5369, test_loss: 1.4639, test_f1: 0.5588
 epoch: 75, train_loss: 0.5178, test_loss: 1.7685, test_f1: 0.5084
 epoch: 76, train_loss: 0.5381, test_loss: 1.6853, test_f1: 0.4792
 epoch: 77, train_loss: 0.5168, test_loss: 1.6092, test_f1: 0.5772
 epoch: 78, train_loss: 0.5296, test_loss: 1.7366, test_f1: 0.5090
 epoch: 79, train_loss: 0.5059, test_loss: 1.5522, test_f1: 0.5611
 epoch: 80, train_loss: 0.5363, test_loss: 1.6379, test_f1: 0.5885
 epoch: 81, train_loss: 0.5379, test_loss: 1.6585, test_f1: 0.5409
 epoch: 82, train_loss: 0.5440, test_loss: 1.3798, test_f1: 0.5809
 epoch: 83, train_loss: 0.5342, test_loss: 1.5783, test_f1: 0.5417
 epoch: 84, train_loss: 0.5139, test_loss: 1.7516, test_f1: 0.5290
 epoch: 85, train_loss: 0.5201, test_loss: 1.6591, test_f1: 0.5479
 epoch: 86, train_loss: 0.5184, test_loss: 1.6621, test_f1: 0.5304
 epoch: 87, train_loss: 0.4920, test_loss: 1.8645, test_f1: 0.5325
 epoch: 88, train_loss: 0.5011, test_loss: 1.7035, test_f1: 0.5578
 epoch: 89, train_loss: 0.4991, test_loss: 1.7924, test_f1: 0.5379
 epoch: 90, train_loss: 0.4927, test_loss: 2.1802, test_f1: 0.4949
 epoch: 91, train_loss: 0.5463, test_loss: 1.6608, test_f1: 0.5713
 epoch: 92, train_loss: 0.5044, test_loss: 1.6964, test_f1: 0.5057
 epoch: 93, train_loss: 0.4857, test_loss: 1.6294, test_f1: 0.5523
 epoch: 94, train_loss: 0.4914, test_loss: 1.5484, test_f1: 0.5729
 epoch: 95, train_loss: 0.4737, test_loss: 1.7326, test_f1: 0.5476
 epoch: 96, train_loss: 0.4610, test_loss: 1.8924, test_f1: 0.5899
 epoch: 97, train_loss: 0.5252, test_loss: 1.6885, test_f1: 0.5271
 epoch: 98, train_loss: 0.4880, test_loss: 1.5998, test_f1: 0.6028
 epoch: 99, train_loss: 0.5090, test_loss: 1.7022, test_f1: 0.5374
##################ITERATION #1 ****************************************
 epoch: 0, train_loss: 1.2529, test_loss: 1.5701, test_f1: 0.3359
 epoch: 1, train_loss: 1.1584, test_loss: 1.2583, test_f1: 0.3509
 epoch: 2, train_loss: 1.1093, test_loss: 1.2400, test_f1: 0.4215
 epoch: 3, train_loss: 1.0858, test_loss: 1.3008, test_f1: 0.3883
 epoch: 4, train_loss: 1.0459, test_loss: 1.1876, test_f1: 0.4532
 epoch: 5, train_loss: 1.0125, test_loss: 1.2148, test_f1: 0.4164
 epoch: 6, train_loss: 1.0000, test_loss: 1.2030, test_f1: 0.3720
 epoch: 7, train_loss: 0.9671, test_loss: 1.3262, test_f1: 0.3977
 epoch: 8, train_loss: 0.9608, test_loss: 1.1085, test_f1: 0.4169
 epoch: 9, train_loss: 0.9435, test_loss: 1.3644, test_f1: 0.3867
 epoch: 10, train_loss: 0.9298, test_loss: 2.0982, test_f1: 0.5718
 epoch: 11, train_loss: 0.9103, test_loss: 1.0290, test_f1: 0.5259
 epoch: 12, train_loss: 0.8973, test_loss: 1.1478, test_f1: 0.4213
 epoch: 13, train_loss: 0.9040, test_loss: 1.1696, test_f1: 0.4349
 epoch: 14, train_loss: 0.8874, test_loss: 1.1314, test_f1: 0.4188
 epoch: 15, train_loss: 0.8546, test_loss: 1.7269, test_f1: 0.3657
 epoch: 16, train_loss: 0.8703, test_loss: 1.0951, test_f1: 0.4909
 epoch: 17, train_loss: 0.8793, test_loss: 1.0422, test_f1: 0.5565
 epoch: 18, train_loss: 0.8993, test_loss: 1.1481, test_f1: 0.4606
 epoch: 19, train_loss: 0.9022, test_loss: 1.0969, test_f1: 0.4729
 epoch: 20, train_loss: 0.8632, test_loss: 1.1851, test_f1: 0.5479
 epoch: 21, train_loss: 0.8633, test_loss: 1.0951, test_f1: 0.5091
 epoch: 22, train_loss: 0.8503, test_loss: 1.0263, test_f1: 0.4809
 epoch: 23, train_loss: 0.8431, test_loss: 1.0886, test_f1: 0.4607
 epoch: 24, train_loss: 0.8519, test_loss: 1.0924, test_f1: 0.5779
 epoch: 25, train_loss: 0.8433, test_loss: 1.0439, test_f1: 0.5086
 epoch: 26, train_loss: 0.8042, test_loss: 1.1299, test_f1: 0.5552
 epoch: 27, train_loss: 0.8123, test_loss: 1.2371, test_f1: 0.4518
 epoch: 28, train_loss: 0.7935, test_loss: 1.1763, test_f1: 0.5376
 epoch: 29, train_loss: 0.8083, test_loss: 1.0635, test_f1: 0.5709
 epoch: 30, train_loss: 0.7809, test_loss: 1.2049, test_f1: 0.5372
 epoch: 31, train_loss: 0.7855, test_loss: 1.2075, test_f1: 0.4591
 epoch: 32, train_loss: 0.8170, test_loss: 1.0552, test_f1: 0.5046
 epoch: 33, train_loss: 0.8084, test_loss: 1.0177, test_f1: 0.5579
 epoch: 34, train_loss: 0.7897, test_loss: 1.0388, test_f1: 0.5670
 epoch: 35, train_loss: 0.7730, test_loss: 1.1614, test_f1: 0.5838
 epoch: 36, train_loss: 0.7965, test_loss: 0.9938, test_f1: 0.6213
 epoch: 37, train_loss: 0.7544, test_loss: 1.1951, test_f1: 0.5381
 epoch: 38, train_loss: 0.7556, test_loss: 1.1459, test_f1: 0.5604
 epoch: 39, train_loss: 0.7727, test_loss: 0.9769, test_f1: 0.5974
 epoch: 40, train_loss: 0.7811, test_loss: 1.1707, test_f1: 0.5187
 epoch: 41, train_loss: 0.7768, test_loss: 1.1192, test_f1: 0.5302
 epoch: 42, train_loss: 0.7360, test_loss: 1.1446, test_f1: 0.5278
 epoch: 43, train_loss: 0.7195, test_loss: 1.0786, test_f1: 0.5316
 epoch: 44, train_loss: 0.7356, test_loss: 1.1506, test_f1: 0.5794
 epoch: 45, train_loss: 0.7565, test_loss: 1.3773, test_f1: 0.4962
 epoch: 46, train_loss: 0.7599, test_loss: 1.1589, test_f1: 0.5059
 epoch: 47, train_loss: 0.7591, test_loss: 1.1172, test_f1: 0.5505
 epoch: 48, train_loss: 0.7227, test_loss: 1.1375, test_f1: 0.5720
 epoch: 49, train_loss: 0.7172, test_loss: 1.3637, test_f1: 0.5539
 epoch: 50, train_loss: 0.7330, test_loss: 1.4372, test_f1: 0.5568
 epoch: 51, train_loss: 0.6913, test_loss: 1.1236, test_f1: 0.5626
 epoch: 52, train_loss: 0.6689, test_loss: 1.2087, test_f1: 0.5908
 epoch: 53, train_loss: 0.6815, test_loss: 1.3387, test_f1: 0.6054
 epoch: 54, train_loss: 0.6445, test_loss: 1.2253, test_f1: 0.5821
 epoch: 55, train_loss: 0.6615, test_loss: 1.2292, test_f1: 0.5875
 epoch: 56, train_loss: 0.6410, test_loss: 1.2142, test_f1: 0.5844
 epoch: 57, train_loss: 0.6404, test_loss: 1.5188, test_f1: 0.5437
 epoch: 58, train_loss: 0.6269, test_loss: 1.2454, test_f1: 0.5655
 epoch: 59, train_loss: 0.6355, test_loss: 1.3438, test_f1: 0.5986
 epoch: 60, train_loss: 0.6149, test_loss: 1.5899, test_f1: 0.5442
 epoch: 61, train_loss: 0.6252, test_loss: 1.3639, test_f1: 0.6031
 epoch: 62, train_loss: 0.6279, test_loss: 1.3590, test_f1: 0.5988
 epoch: 63, train_loss: 0.5894, test_loss: 1.5415, test_f1: 0.5438
 epoch: 64, train_loss: 0.6198, test_loss: 1.3801, test_f1: 0.5828
 epoch: 65, train_loss: 0.5742, test_loss: 1.2969, test_f1: 0.5964
 epoch: 66, train_loss: 0.5681, test_loss: 1.6517, test_f1: 0.5769
 epoch: 67, train_loss: 0.5866, test_loss: 1.6514, test_f1: 0.5548
 epoch: 68, train_loss: 0.6003, test_loss: 1.6252, test_f1: 0.5746
 epoch: 69, train_loss: 0.5971, test_loss: 1.3503, test_f1: 0.5823
 epoch: 70, train_loss: 0.6023, test_loss: 1.5893, test_f1: 0.5256
 epoch: 71, train_loss: 0.5852, test_loss: 1.6904, test_f1: 0.5550
 epoch: 72, train_loss: 0.5548, test_loss: 1.5455, test_f1: 0.6127
 epoch: 73, train_loss: 0.5622, test_loss: 1.6602, test_f1: 0.5988
 epoch: 74, train_loss: 0.5814, test_loss: 1.5599, test_f1: 0.5590
 epoch: 75, train_loss: 0.5420, test_loss: 1.6289, test_f1: 0.5868
 epoch: 76, train_loss: 0.5779, test_loss: 1.4441, test_f1: 0.5554
 epoch: 77, train_loss: 0.5339, test_loss: 1.5605, test_f1: 0.5733
 epoch: 78, train_loss: 0.5305, test_loss: 1.6122, test_f1: 0.5723
 epoch: 79, train_loss: 0.5408, test_loss: 1.4912, test_f1: 0.5603
 epoch: 80, train_loss: 0.5292, test_loss: 1.7233, test_f1: 0.5933
 epoch: 81, train_loss: 0.5276, test_loss: 1.8474, test_f1: 0.6117
 epoch: 82, train_loss: 0.5414, test_loss: 1.4252, test_f1: 0.6037
 epoch: 83, train_loss: 0.5328, test_loss: 1.3948, test_f1: 0.5862
 epoch: 84, train_loss: 0.5166, test_loss: 1.4650, test_f1: 0.6049
 epoch: 85, train_loss: 0.5001, test_loss: 1.5925, test_f1: 0.5811
 epoch: 86, train_loss: 0.5498, test_loss: 1.5888, test_f1: 0.5449
 epoch: 87, train_loss: 0.5331, test_loss: 1.6128, test_f1: 0.6026
 epoch: 88, train_loss: 0.5235, test_loss: 1.4976, test_f1: 0.5770
 epoch: 89, train_loss: 0.4941, test_loss: 1.5555, test_f1: 0.6193
 epoch: 90, train_loss: 0.5089, test_loss: 1.5161, test_f1: 0.6099
 epoch: 91, train_loss: 0.5212, test_loss: 1.3744, test_f1: 0.5867
 epoch: 92, train_loss: 0.5014, test_loss: 1.6188, test_f1: 0.6128
 epoch: 93, train_loss: 0.5430, test_loss: 1.3125, test_f1: 0.5606
 epoch: 94, train_loss: 0.5391, test_loss: 1.5107, test_f1: 0.5896
 epoch: 95, train_loss: 0.5013, test_loss: 1.4657, test_f1: 0.5425
 epoch: 96, train_loss: 0.4829, test_loss: 1.4214, test_f1: 0.6035
 epoch: 97, train_loss: 0.4506, test_loss: 1.4568, test_f1: 0.6000
 epoch: 98, train_loss: 0.4982, test_loss: 1.5032, test_f1: 0.5962
 epoch: 99, train_loss: 0.5098, test_loss: 1.4096, test_f1: 0.5915
##################ITERATION #2 ****************************************
 epoch: 0, train_loss: 1.3326, test_loss: 1.3787, test_f1: 0.2517
 epoch: 1, train_loss: 1.1969, test_loss: 1.2574, test_f1: 0.3270
 epoch: 2, train_loss: 1.1561, test_loss: 1.3546, test_f1: 0.2587
 epoch: 3, train_loss: 1.1205, test_loss: 1.2745, test_f1: 0.3299
 epoch: 4, train_loss: 1.0761, test_loss: 1.2751, test_f1: 0.3538
 epoch: 5, train_loss: 1.0502, test_loss: 1.2058, test_f1: 0.4046
 epoch: 6, train_loss: 1.0590, test_loss: 1.1777, test_f1: 0.3255
 epoch: 7, train_loss: 1.0437, test_loss: 1.2719, test_f1: 0.3360
 epoch: 8, train_loss: 1.0789, test_loss: 1.1653, test_f1: 0.4594
 epoch: 9, train_loss: 1.0442, test_loss: 1.1162, test_f1: 0.3857
 epoch: 10, train_loss: 1.0166, test_loss: 1.2196, test_f1: 0.3635
 epoch: 11, train_loss: 0.9825, test_loss: 1.1503, test_f1: 0.4222
 epoch: 12, train_loss: 0.9538, test_loss: 1.1078, test_f1: 0.4505
 epoch: 13, train_loss: 0.9252, test_loss: 1.1308, test_f1: 0.4215
 epoch: 14, train_loss: 0.9090, test_loss: 1.0870, test_f1: 0.5172
 epoch: 15, train_loss: 0.9216, test_loss: 1.0503, test_f1: 0.4963
 epoch: 16, train_loss: 0.9121, test_loss: 1.1113, test_f1: 0.4974
 epoch: 17, train_loss: 0.8883, test_loss: 1.6787, test_f1: 0.3715
 epoch: 18, train_loss: 0.8791, test_loss: 1.0094, test_f1: 0.4865
 epoch: 19, train_loss: 0.8691, test_loss: 1.1761, test_f1: 0.4701
 epoch: 20, train_loss: 0.8736, test_loss: 1.1060, test_f1: 0.5290
 epoch: 21, train_loss: 0.8689, test_loss: 1.1847, test_f1: 0.4861
 epoch: 22, train_loss: 0.8548, test_loss: 1.2096, test_f1: 0.5133
 epoch: 23, train_loss: 0.8579, test_loss: 1.1931, test_f1: 0.5098
 epoch: 24, train_loss: 0.8546, test_loss: 1.0117, test_f1: 0.5964
 epoch: 25, train_loss: 0.8605, test_loss: 1.7041, test_f1: 0.3299
 epoch: 26, train_loss: 0.8711, test_loss: 1.0451, test_f1: 0.5638
 epoch: 27, train_loss: 0.8433, test_loss: 1.0026, test_f1: 0.5106
 epoch: 28, train_loss: 0.8342, test_loss: 1.0532, test_f1: 0.5416
 epoch: 29, train_loss: 0.8282, test_loss: 1.0195, test_f1: 0.5111
 epoch: 30, train_loss: 0.8289, test_loss: 1.0266, test_f1: 0.5115
 epoch: 31, train_loss: 0.8191, test_loss: 1.2469, test_f1: 0.4940
 epoch: 32, train_loss: 0.8178, test_loss: 1.0130, test_f1: 0.5639
 epoch: 33, train_loss: 0.8169, test_loss: 1.2967, test_f1: 0.4516
 epoch: 34, train_loss: 0.8228, test_loss: 1.1595, test_f1: 0.5545
 epoch: 35, train_loss: 0.8107, test_loss: 1.0700, test_f1: 0.4280
 epoch: 36, train_loss: 0.7984, test_loss: 1.2268, test_f1: 0.5539
 epoch: 37, train_loss: 0.7878, test_loss: 0.9788, test_f1: 0.5203
 epoch: 38, train_loss: 0.8137, test_loss: 0.9786, test_f1: 0.6038
 epoch: 39, train_loss: 0.7825, test_loss: 1.0187, test_f1: 0.5852
 epoch: 40, train_loss: 0.7578, test_loss: 1.0127, test_f1: 0.5949
 epoch: 41, train_loss: 0.7981, test_loss: 1.0639, test_f1: 0.5748
 epoch: 42, train_loss: 0.7944, test_loss: 1.0677, test_f1: 0.5334
 epoch: 43, train_loss: 0.7848, test_loss: 1.4433, test_f1: 0.5167
 epoch: 44, train_loss: 0.7657, test_loss: 1.5348, test_f1: 0.4871
 epoch: 45, train_loss: 0.7673, test_loss: 0.9810, test_f1: 0.6020
 epoch: 46, train_loss: 0.7474, test_loss: 1.5078, test_f1: 0.5353
 epoch: 47, train_loss: 0.7566, test_loss: 1.1745, test_f1: 0.5349
 epoch: 48, train_loss: 0.7736, test_loss: 1.0111, test_f1: 0.6001
 epoch: 49, train_loss: 0.7661, test_loss: 1.1127, test_f1: 0.5917
 epoch: 50, train_loss: 0.7346, test_loss: 1.1085, test_f1: 0.5503
 epoch: 51, train_loss: 0.7189, test_loss: 1.0529, test_f1: 0.5978
 epoch: 52, train_loss: 0.6783, test_loss: 1.1189, test_f1: 0.5945
 epoch: 53, train_loss: 0.6959, test_loss: 1.0485, test_f1: 0.5889
 epoch: 54, train_loss: 0.7145, test_loss: 1.0823, test_f1: 0.5641
 epoch: 55, train_loss: 0.6750, test_loss: 1.1179, test_f1: 0.5947
 epoch: 56, train_loss: 0.6877, test_loss: 1.1021, test_f1: 0.5884
 epoch: 57, train_loss: 0.6690, test_loss: 1.3285, test_f1: 0.5340
 epoch: 58, train_loss: 0.6964, test_loss: 1.1552, test_f1: 0.5853
 epoch: 59, train_loss: 0.6536, test_loss: 1.1063, test_f1: 0.6037
 epoch: 60, train_loss: 0.6650, test_loss: 1.1299, test_f1: 0.5818
 epoch: 61, train_loss: 0.6646, test_loss: 1.1415, test_f1: 0.6174
 epoch: 62, train_loss: 0.6496, test_loss: 1.3258, test_f1: 0.5427
 epoch: 63, train_loss: 0.6291, test_loss: 1.2153, test_f1: 0.5624
 epoch: 64, train_loss: 0.6380, test_loss: 1.2377, test_f1: 0.5177
 epoch: 65, train_loss: 0.6256, test_loss: 1.5530, test_f1: 0.5331
 epoch: 66, train_loss: 0.6478, test_loss: 1.3718, test_f1: 0.5436
 epoch: 67, train_loss: 0.6234, test_loss: 1.2615, test_f1: 0.5991
 epoch: 68, train_loss: 0.6301, test_loss: 1.4815, test_f1: 0.5516
 epoch: 69, train_loss: 0.6545, test_loss: 1.2164, test_f1: 0.5640
 epoch: 70, train_loss: 0.6219, test_loss: 1.3674, test_f1: 0.5905
 epoch: 71, train_loss: 0.6341, test_loss: 1.3818, test_f1: 0.5645
 epoch: 72, train_loss: 0.6019, test_loss: 1.2972, test_f1: 0.5090
 epoch: 73, train_loss: 0.6232, test_loss: 1.4323, test_f1: 0.5391
 epoch: 74, train_loss: 0.6233, test_loss: 1.3356, test_f1: 0.5590
 epoch: 75, train_loss: 0.6276, test_loss: 1.3869, test_f1: 0.5541
 epoch: 76, train_loss: 0.6046, test_loss: 1.2039, test_f1: 0.5424
 epoch: 77, train_loss: 0.6013, test_loss: 1.4446, test_f1: 0.5608
 epoch: 78, train_loss: 0.5951, test_loss: 1.5390, test_f1: 0.5054
 epoch: 79, train_loss: 0.6085, test_loss: 1.3570, test_f1: 0.5671
 epoch: 80, train_loss: 0.6162, test_loss: 1.2849, test_f1: 0.5339
 epoch: 81, train_loss: 0.5986, test_loss: 1.5170, test_f1: 0.5035
 epoch: 82, train_loss: 0.5760, test_loss: 1.2937, test_f1: 0.5426
 epoch: 83, train_loss: 0.5931, test_loss: 1.3612, test_f1: 0.5421
 epoch: 84, train_loss: 0.6076, test_loss: 1.4698, test_f1: 0.5347
 epoch: 85, train_loss: 0.6237, test_loss: 1.3842, test_f1: 0.5733
 epoch: 86, train_loss: 0.6014, test_loss: 1.5601, test_f1: 0.5637
 epoch: 87, train_loss: 0.5962, test_loss: 1.3813, test_f1: 0.5445
 epoch: 88, train_loss: 0.6080, test_loss: 1.4390, test_f1: 0.5144
 epoch: 89, train_loss: 0.6211, test_loss: 1.3061, test_f1: 0.5854
 epoch: 90, train_loss: 0.6163, test_loss: 1.4336, test_f1: 0.5465
 epoch: 91, train_loss: 0.5948, test_loss: 1.3720, test_f1: 0.5895
 epoch: 92, train_loss: 0.5765, test_loss: 1.3117, test_f1: 0.5768
 epoch: 93, train_loss: 0.5791, test_loss: 1.5750, test_f1: 0.5612
 epoch: 94, train_loss: 0.6020, test_loss: 1.4023, test_f1: 0.5408
 epoch: 95, train_loss: 0.5934, test_loss: 1.5396, test_f1: 0.5357
 epoch: 96, train_loss: 0.6281, test_loss: 1.2373, test_f1: 0.5924
 epoch: 97, train_loss: 0.6032, test_loss: 1.5237, test_f1: 0.5524
 epoch: 98, train_loss: 0.6020, test_loss: 1.4139, test_f1: 0.5589
 epoch: 99, train_loss: 0.5501, test_loss: 1.4530, test_f1: 0.5453
##################ITERATION #3 ****************************************
 epoch: 0, train_loss: 1.2901, test_loss: 1.3545, test_f1: 0.2595
 epoch: 1, train_loss: 1.1463, test_loss: 1.2222, test_f1: 0.3164
 epoch: 2, train_loss: 1.1353, test_loss: 1.2439, test_f1: 0.3269
 epoch: 3, train_loss: 1.0889, test_loss: 1.3743, test_f1: 0.3339
 epoch: 4, train_loss: 1.0444, test_loss: 1.1486, test_f1: 0.3744
 epoch: 5, train_loss: 1.0157, test_loss: 1.2126, test_f1: 0.4226
 epoch: 6, train_loss: 0.9991, test_loss: 1.0732, test_f1: 0.5465
 epoch: 7, train_loss: 0.9628, test_loss: 1.1208, test_f1: 0.4057
 epoch: 8, train_loss: 0.9749, test_loss: 1.1910, test_f1: 0.4422
 epoch: 9, train_loss: 0.9523, test_loss: 1.1751, test_f1: 0.4746
 epoch: 10, train_loss: 0.9345, test_loss: 1.0530, test_f1: 0.4959
 epoch: 11, train_loss: 0.9083, test_loss: 1.0480, test_f1: 0.4478
 epoch: 12, train_loss: 0.9245, test_loss: 1.2287, test_f1: 0.4236
 epoch: 13, train_loss: 0.8987, test_loss: 1.0531, test_f1: 0.4322
 epoch: 14, train_loss: 0.9231, test_loss: 1.0424, test_f1: 0.5289
 epoch: 15, train_loss: 0.8961, test_loss: 1.0113, test_f1: 0.4997
 epoch: 16, train_loss: 0.8867, test_loss: 1.0709, test_f1: 0.5557
 epoch: 17, train_loss: 0.8692, test_loss: 1.1385, test_f1: 0.5611
 epoch: 18, train_loss: 0.8373, test_loss: 1.3547, test_f1: 0.4727
 epoch: 19, train_loss: 0.8283, test_loss: 1.1599, test_f1: 0.5356
 epoch: 20, train_loss: 0.8514, test_loss: 1.0634, test_f1: 0.4255
 epoch: 21, train_loss: 0.8357, test_loss: 1.1699, test_f1: 0.5759
 epoch: 22, train_loss: 0.8267, test_loss: 1.1538, test_f1: 0.5831
 epoch: 23, train_loss: 0.8151, test_loss: 1.2011, test_f1: 0.5446
 epoch: 24, train_loss: 0.8198, test_loss: 1.0780, test_f1: 0.5874
 epoch: 25, train_loss: 0.8287, test_loss: 1.1562, test_f1: 0.5996
 epoch: 26, train_loss: 0.8487, test_loss: 1.1330, test_f1: 0.5494
 epoch: 27, train_loss: 0.8087, test_loss: 1.0776, test_f1: 0.6011
 epoch: 28, train_loss: 0.8146, test_loss: 1.0120, test_f1: 0.5871
 epoch: 29, train_loss: 0.7943, test_loss: 1.1250, test_f1: 0.5221
 epoch: 30, train_loss: 0.7910, test_loss: 1.1590, test_f1: 0.5792
 epoch: 31, train_loss: 0.8061, test_loss: 1.0315, test_f1: 0.5969
 epoch: 32, train_loss: 0.8029, test_loss: 1.0795, test_f1: 0.5798
 epoch: 33, train_loss: 0.7919, test_loss: 1.0597, test_f1: 0.5757
 epoch: 34, train_loss: 0.7749, test_loss: 1.0358, test_f1: 0.6083
 epoch: 35, train_loss: 0.7861, test_loss: 1.0758, test_f1: 0.5904
 epoch: 36, train_loss: 0.7924, test_loss: 1.0302, test_f1: 0.6187
 epoch: 37, train_loss: 0.7585, test_loss: 1.0975, test_f1: 0.5886
 epoch: 38, train_loss: 0.7585, test_loss: 1.1093, test_f1: 0.5667
 epoch: 39, train_loss: 0.7515, test_loss: 1.1443, test_f1: 0.5857
 epoch: 40, train_loss: 0.7701, test_loss: 1.2509, test_f1: 0.5466
 epoch: 41, train_loss: 0.7529, test_loss: 1.4608, test_f1: 0.4834
 epoch: 42, train_loss: 0.7536, test_loss: 1.3415, test_f1: 0.5874
 epoch: 43, train_loss: 0.7242, test_loss: 1.3793, test_f1: 0.5668
 epoch: 44, train_loss: 0.7459, test_loss: 1.1266, test_f1: 0.6003
 epoch: 45, train_loss: 0.7711, test_loss: 0.9979, test_f1: 0.6040
 epoch: 46, train_loss: 0.7080, test_loss: 1.3526, test_f1: 0.5952
 epoch: 47, train_loss: 0.7197, test_loss: 1.1317, test_f1: 0.6176
 epoch: 48, train_loss: 0.7516, test_loss: 1.2988, test_f1: 0.5512
 epoch: 49, train_loss: 0.7291, test_loss: 1.0979, test_f1: 0.6259
 epoch: 50, train_loss: 0.7159, test_loss: 0.9762, test_f1: 0.6435
 epoch: 51, train_loss: 0.6873, test_loss: 1.0769, test_f1: 0.6054
 epoch: 52, train_loss: 0.6683, test_loss: 1.0908, test_f1: 0.6261
 epoch: 53, train_loss: 0.6578, test_loss: 1.0516, test_f1: 0.6000
 epoch: 54, train_loss: 0.6464, test_loss: 1.0548, test_f1: 0.5839
 epoch: 55, train_loss: 0.6332, test_loss: 1.0614, test_f1: 0.6067
 epoch: 56, train_loss: 0.6403, test_loss: 1.1075, test_f1: 0.6189
 epoch: 57, train_loss: 0.6209, test_loss: 1.1126, test_f1: 0.6074
 epoch: 58, train_loss: 0.6395, test_loss: 1.1341, test_f1: 0.6377
 epoch: 59, train_loss: 0.6080, test_loss: 1.1321, test_f1: 0.6163
 epoch: 60, train_loss: 0.6252, test_loss: 1.1833, test_f1: 0.6147
 epoch: 61, train_loss: 0.6259, test_loss: 1.3168, test_f1: 0.5632
 epoch: 62, train_loss: 0.6375, test_loss: 1.1987, test_f1: 0.6211
 epoch: 63, train_loss: 0.6208, test_loss: 1.3388, test_f1: 0.5890
 epoch: 64, train_loss: 0.5887, test_loss: 1.4166, test_f1: 0.5795
 epoch: 65, train_loss: 0.6063, test_loss: 1.2789, test_f1: 0.6251
 epoch: 66, train_loss: 0.6069, test_loss: 1.4366, test_f1: 0.5840
 epoch: 67, train_loss: 0.5910, test_loss: 1.2734, test_f1: 0.6379
 epoch: 68, train_loss: 0.6035, test_loss: 1.5021, test_f1: 0.5805
 epoch: 69, train_loss: 0.5753, test_loss: 1.4456, test_f1: 0.5878
 epoch: 70, train_loss: 0.5926, test_loss: 1.4435, test_f1: 0.5917
 epoch: 71, train_loss: 0.5926, test_loss: 1.3594, test_f1: 0.5865
 epoch: 72, train_loss: 0.5844, test_loss: 1.5419, test_f1: 0.5882
 epoch: 73, train_loss: 0.5893, test_loss: 1.5210, test_f1: 0.5776
 epoch: 74, train_loss: 0.5889, test_loss: 1.2985, test_f1: 0.5576
 epoch: 75, train_loss: 0.5902, test_loss: 1.3405, test_f1: 0.6099
 epoch: 76, train_loss: 0.5657, test_loss: 1.8409, test_f1: 0.6005
 epoch: 77, train_loss: 0.5434, test_loss: 1.3775, test_f1: 0.5987
 epoch: 78, train_loss: 0.5590, test_loss: 1.6438, test_f1: 0.5873
 epoch: 79, train_loss: 0.6077, test_loss: 1.6098, test_f1: 0.5587
 epoch: 80, train_loss: 0.5689, test_loss: 1.2189, test_f1: 0.6146
 epoch: 81, train_loss: 0.5671, test_loss: 1.3434, test_f1: 0.5966
 epoch: 82, train_loss: 0.5723, test_loss: 1.3321, test_f1: 0.5953
 epoch: 83, train_loss: 0.5337, test_loss: 1.5332, test_f1: 0.5835
 epoch: 84, train_loss: 0.5353, test_loss: 1.5969, test_f1: 0.6162
 epoch: 85, train_loss: 0.5513, test_loss: 1.4392, test_f1: 0.6237
 epoch: 86, train_loss: 0.5392, test_loss: 1.2893, test_f1: 0.5863
 epoch: 87, train_loss: 0.5480, test_loss: 1.4479, test_f1: 0.6237
 epoch: 88, train_loss: 0.5383, test_loss: 1.5475, test_f1: 0.5942
 epoch: 89, train_loss: 0.5636, test_loss: 1.6231, test_f1: 0.6103
 epoch: 90, train_loss: 0.5386, test_loss: 1.5021, test_f1: 0.5963
 epoch: 91, train_loss: 0.5491, test_loss: 1.6365, test_f1: 0.6229
 epoch: 92, train_loss: 0.5368, test_loss: 1.7293, test_f1: 0.5925
 epoch: 93, train_loss: 0.4915, test_loss: 2.1281, test_f1: 0.5800
 epoch: 94, train_loss: 0.5685, test_loss: 2.1359, test_f1: 0.5368
 epoch: 95, train_loss: 0.5517, test_loss: 1.4370, test_f1: 0.5816
 epoch: 96, train_loss: 0.5410, test_loss: 1.3433, test_f1: 0.6081
 epoch: 97, train_loss: 0.5917, test_loss: 1.4085, test_f1: 0.5743
 epoch: 98, train_loss: 0.5191, test_loss: 1.4040, test_f1: 0.5919
 epoch: 99, train_loss: 0.5052, test_loss: 1.5737, test_f1: 0.5993
##################ITERATION #4 ****************************************
 epoch: 0, train_loss: 1.3075, test_loss: 1.2943, test_f1: 0.3431
 epoch: 1, train_loss: 1.1954, test_loss: 1.2302, test_f1: 0.3127
 epoch: 2, train_loss: 1.1328, test_loss: 1.2591, test_f1: 0.4041
 epoch: 3, train_loss: 1.0801, test_loss: 1.1655, test_f1: 0.4832
 epoch: 4, train_loss: 1.0485, test_loss: 1.1398, test_f1: 0.4383
 epoch: 5, train_loss: 1.0354, test_loss: 1.1382, test_f1: 0.4689
 epoch: 6, train_loss: 0.9790, test_loss: 1.1185, test_f1: 0.4943
 epoch: 7, train_loss: 0.9640, test_loss: 1.1328, test_f1: 0.4700
 epoch: 8, train_loss: 0.9463, test_loss: 1.0126, test_f1: 0.5327
 epoch: 9, train_loss: 0.9238, test_loss: 1.1133, test_f1: 0.4147
 epoch: 10, train_loss: 0.9159, test_loss: 1.0781, test_f1: 0.5550
 epoch: 11, train_loss: 0.9151, test_loss: 1.0296, test_f1: 0.5407
 epoch: 12, train_loss: 0.9002, test_loss: 1.2924, test_f1: 0.4388
 epoch: 13, train_loss: 0.8999, test_loss: 1.0776, test_f1: 0.4223
 epoch: 14, train_loss: 0.8826, test_loss: 1.0408, test_f1: 0.5323
 epoch: 15, train_loss: 0.8616, test_loss: 1.1266, test_f1: 0.4855
 epoch: 16, train_loss: 0.8818, test_loss: 1.0502, test_f1: 0.5177
 epoch: 17, train_loss: 0.8837, test_loss: 1.2161, test_f1: 0.4413
 epoch: 18, train_loss: 0.9035, test_loss: 1.0679, test_f1: 0.5554
 epoch: 19, train_loss: 0.8963, test_loss: 1.0485, test_f1: 0.5111
 epoch: 20, train_loss: 0.8789, test_loss: 1.1368, test_f1: 0.4294
 epoch: 21, train_loss: 0.8750, test_loss: 1.0312, test_f1: 0.5705
 epoch: 22, train_loss: 0.8264, test_loss: 1.0915, test_f1: 0.5397
 epoch: 23, train_loss: 0.8480, test_loss: 1.0368, test_f1: 0.5271
 epoch: 24, train_loss: 0.8592, test_loss: 1.6037, test_f1: 0.4051
 epoch: 25, train_loss: 0.8211, test_loss: 1.0258, test_f1: 0.5956
 epoch: 26, train_loss: 0.8196, test_loss: 0.9787, test_f1: 0.5961
 epoch: 27, train_loss: 0.8501, test_loss: 1.1233, test_f1: 0.5292
 epoch: 28, train_loss: 0.8459, test_loss: 1.1562, test_f1: 0.5121
 epoch: 29, train_loss: 0.8035, test_loss: 1.0930, test_f1: 0.5084
 epoch: 30, train_loss: 0.7860, test_loss: 1.0398, test_f1: 0.5332
 epoch: 31, train_loss: 0.7927, test_loss: 1.3128, test_f1: 0.5452
 epoch: 32, train_loss: 0.8014, test_loss: 1.1490, test_f1: 0.5296
 epoch: 33, train_loss: 0.8116, test_loss: 1.1154, test_f1: 0.5560
 epoch: 34, train_loss: 0.7774, test_loss: 1.1915, test_f1: 0.5297
 epoch: 35, train_loss: 0.7856, test_loss: 1.0721, test_f1: 0.5685
 epoch: 36, train_loss: 0.7788, test_loss: 1.1041, test_f1: 0.5641
 epoch: 37, train_loss: 0.7687, test_loss: 1.1531, test_f1: 0.5630
 epoch: 38, train_loss: 0.7514, test_loss: 1.1311, test_f1: 0.5361
 epoch: 39, train_loss: 0.7646, test_loss: 1.3700, test_f1: 0.4775
 epoch: 40, train_loss: 0.7632, test_loss: 1.5569, test_f1: 0.5353
 epoch: 41, train_loss: 0.7897, test_loss: 1.3211, test_f1: 0.5552
 epoch: 42, train_loss: 0.7554, test_loss: 1.1091, test_f1: 0.5725
 epoch: 43, train_loss: 0.7647, test_loss: 1.1665, test_f1: 0.5172
 epoch: 44, train_loss: 0.7628, test_loss: 1.6656, test_f1: 0.4938
 epoch: 45, train_loss: 0.8026, test_loss: 1.0978, test_f1: 0.5883
 epoch: 46, train_loss: 0.7591, test_loss: 1.5557, test_f1: 0.4557
 epoch: 47, train_loss: 0.7663, test_loss: 1.1902, test_f1: 0.5971
 epoch: 48, train_loss: 0.7320, test_loss: 1.4584, test_f1: 0.5356
 epoch: 49, train_loss: 0.7241, test_loss: 1.3094, test_f1: 0.5569
 epoch: 50, train_loss: 0.7042, test_loss: 1.0824, test_f1: 0.5737
 epoch: 51, train_loss: 0.6960, test_loss: 1.2150, test_f1: 0.5693
 epoch: 52, train_loss: 0.6897, test_loss: 1.1912, test_f1: 0.5875
 epoch: 53, train_loss: 0.6980, test_loss: 1.2203, test_f1: 0.5575
 epoch: 54, train_loss: 0.6755, test_loss: 1.1256, test_f1: 0.5926
 epoch: 55, train_loss: 0.6596, test_loss: 1.2524, test_f1: 0.5542
 epoch: 56, train_loss: 0.6598, test_loss: 1.1174, test_f1: 0.5807
 epoch: 57, train_loss: 0.6460, test_loss: 1.2086, test_f1: 0.5902
 epoch: 58, train_loss: 0.6475, test_loss: 1.2498, test_f1: 0.5701
 epoch: 59, train_loss: 0.6461, test_loss: 1.2767, test_f1: 0.5511
 epoch: 60, train_loss: 0.6518, test_loss: 1.2102, test_f1: 0.5896
 epoch: 61, train_loss: 0.6523, test_loss: 1.3215, test_f1: 0.5783
 epoch: 62, train_loss: 0.6519, test_loss: 1.3195, test_f1: 0.5853
 epoch: 63, train_loss: 0.6514, test_loss: 1.4453, test_f1: 0.5587
 epoch: 64, train_loss: 0.6550, test_loss: 1.2496, test_f1: 0.5931
 epoch: 65, train_loss: 0.6381, test_loss: 1.2963, test_f1: 0.5986
 epoch: 66, train_loss: 0.6594, test_loss: 1.5275, test_f1: 0.5392
 epoch: 67, train_loss: 0.6214, test_loss: 1.4208, test_f1: 0.5792
 epoch: 68, train_loss: 0.6270, test_loss: 1.3116, test_f1: 0.5677
 epoch: 69, train_loss: 0.6635, test_loss: 1.3665, test_f1: 0.5562
 epoch: 70, train_loss: 0.6274, test_loss: 1.2832, test_f1: 0.5422
 epoch: 71, train_loss: 0.6220, test_loss: 1.4603, test_f1: 0.5663
 epoch: 72, train_loss: 0.6184, test_loss: 1.4302, test_f1: 0.5699
 epoch: 73, train_loss: 0.5999, test_loss: 1.4193, test_f1: 0.5443
 epoch: 74, train_loss: 0.6045, test_loss: 1.3558, test_f1: 0.5553
 epoch: 75, train_loss: 0.6135, test_loss: 1.4205, test_f1: 0.5889
 epoch: 76, train_loss: 0.6139, test_loss: 1.3184, test_f1: 0.5819
 epoch: 77, train_loss: 0.6079, test_loss: 1.3322, test_f1: 0.5974
 epoch: 78, train_loss: 0.6075, test_loss: 1.3876, test_f1: 0.5889
 epoch: 79, train_loss: 0.6074, test_loss: 1.4585, test_f1: 0.5987
 epoch: 80, train_loss: 0.5779, test_loss: 1.3785, test_f1: 0.6013
 epoch: 81, train_loss: 0.6010, test_loss: 1.4835, test_f1: 0.5937
 epoch: 82, train_loss: 0.6080, test_loss: 1.6235, test_f1: 0.5346
 epoch: 83, train_loss: 0.6188, test_loss: 1.3008, test_f1: 0.5479
 epoch: 84, train_loss: 0.5915, test_loss: 1.5161, test_f1: 0.5580
 epoch: 85, train_loss: 0.5558, test_loss: 1.4385, test_f1: 0.5692
 epoch: 86, train_loss: 0.5624, test_loss: 1.3288, test_f1: 0.5731
 epoch: 87, train_loss: 0.5819, test_loss: 1.6877, test_f1: 0.5894
 epoch: 88, train_loss: 0.5865, test_loss: 1.5039, test_f1: 0.5934
 epoch: 89, train_loss: 0.5694, test_loss: 1.2902, test_f1: 0.6185
 epoch: 90, train_loss: 0.5700, test_loss: 1.4829, test_f1: 0.5572
 epoch: 91, train_loss: 0.5692, test_loss: 1.4553, test_f1: 0.6145
 epoch: 92, train_loss: 0.5602, test_loss: 1.4118, test_f1: 0.5808
 epoch: 93, train_loss: 0.5690, test_loss: 1.5886, test_f1: 0.5594
 epoch: 94, train_loss: 0.5550, test_loss: 1.4286, test_f1: 0.6234
 epoch: 95, train_loss: 0.5952, test_loss: 1.7267, test_f1: 0.5934
 epoch: 96, train_loss: 0.5563, test_loss: 1.8704, test_f1: 0.5226
 epoch: 97, train_loss: 0.5570, test_loss: 1.3987, test_f1: 0.5773
 epoch: 98, train_loss: 0.6008, test_loss: 1.3160, test_f1: 0.5977
 epoch: 99, train_loss: 0.5477, test_loss: 1.6117, test_f1: 0.5881
##################ITERATION #5 ****************************************
 epoch: 0, train_loss: 1.3159, test_loss: 1.2762, test_f1: 0.2248
 epoch: 1, train_loss: 1.1986, test_loss: 1.2187, test_f1: 0.3936
 epoch: 2, train_loss: 1.1431, test_loss: 1.1934, test_f1: 0.4088
 epoch: 3, train_loss: 1.0791, test_loss: 1.2173, test_f1: 0.4599
 epoch: 4, train_loss: 1.0665, test_loss: 1.2467, test_f1: 0.4436
 epoch: 5, train_loss: 1.0589, test_loss: 1.1728, test_f1: 0.4884
 epoch: 6, train_loss: 1.0160, test_loss: 1.2865, test_f1: 0.3234
 epoch: 7, train_loss: 1.0051, test_loss: 1.0972, test_f1: 0.5415
 epoch: 8, train_loss: 0.9887, test_loss: 1.1095, test_f1: 0.3775
 epoch: 9, train_loss: 1.0309, test_loss: 1.0690, test_f1: 0.4605
 epoch: 10, train_loss: 0.9849, test_loss: 1.1209, test_f1: 0.3882
 epoch: 11, train_loss: 0.9360, test_loss: 1.0560, test_f1: 0.4769
 epoch: 12, train_loss: 0.9383, test_loss: 1.1573, test_f1: 0.4591
 epoch: 13, train_loss: 0.9031, test_loss: 1.0617, test_f1: 0.5388
 epoch: 14, train_loss: 0.9299, test_loss: 1.0544, test_f1: 0.4954
 epoch: 15, train_loss: 0.9320, test_loss: 1.2113, test_f1: 0.4271
 epoch: 16, train_loss: 0.9252, test_loss: 1.0712, test_f1: 0.5089
 epoch: 17, train_loss: 0.9116, test_loss: 1.0160, test_f1: 0.5159
 epoch: 18, train_loss: 0.8836, test_loss: 1.0350, test_f1: 0.5244
 epoch: 19, train_loss: 0.8825, test_loss: 1.0255, test_f1: 0.5383
 epoch: 20, train_loss: 0.9024, test_loss: 1.0676, test_f1: 0.4727
 epoch: 21, train_loss: 0.8642, test_loss: 1.0413, test_f1: 0.5467
 epoch: 22, train_loss: 0.8508, test_loss: 1.0321, test_f1: 0.5327
 epoch: 23, train_loss: 0.8499, test_loss: 1.1573, test_f1: 0.4929
 epoch: 24, train_loss: 0.8884, test_loss: 1.0749, test_f1: 0.5547
 epoch: 25, train_loss: 0.8570, test_loss: 1.1222, test_f1: 0.5544
 epoch: 26, train_loss: 0.8593, test_loss: 1.0552, test_f1: 0.5407
 epoch: 27, train_loss: 0.8369, test_loss: 1.0778, test_f1: 0.5556
 epoch: 28, train_loss: 0.8458, test_loss: 1.2873, test_f1: 0.5155
 epoch: 29, train_loss: 0.8637, test_loss: 1.0750, test_f1: 0.5591
 epoch: 30, train_loss: 0.8635, test_loss: 1.0968, test_f1: 0.5360
 epoch: 31, train_loss: 0.8329, test_loss: 1.1660, test_f1: 0.4596
 epoch: 32, train_loss: 0.8288, test_loss: 1.1093, test_f1: 0.5310
 epoch: 33, train_loss: 0.8050, test_loss: 1.0833, test_f1: 0.5666
 epoch: 34, train_loss: 0.8480, test_loss: 1.0663, test_f1: 0.5312
 epoch: 35, train_loss: 0.8212, test_loss: 1.1365, test_f1: 0.5340
 epoch: 36, train_loss: 0.7972, test_loss: 1.4048, test_f1: 0.4789
 epoch: 37, train_loss: 0.8020, test_loss: 1.1255, test_f1: 0.5681
 epoch: 38, train_loss: 0.8265, test_loss: 1.1578, test_f1: 0.4789
 epoch: 39, train_loss: 0.8547, test_loss: 1.1697, test_f1: 0.5613
 epoch: 40, train_loss: 0.8383, test_loss: 1.0068, test_f1: 0.4497
 epoch: 41, train_loss: 0.8256, test_loss: 1.0300, test_f1: 0.5685
 epoch: 42, train_loss: 0.8034, test_loss: 1.0896, test_f1: 0.5281
 epoch: 43, train_loss: 0.7857, test_loss: 1.0891, test_f1: 0.5382
 epoch: 44, train_loss: 0.7909, test_loss: 1.0242, test_f1: 0.5725
 epoch: 45, train_loss: 0.8691, test_loss: 1.0876, test_f1: 0.5050
 epoch: 46, train_loss: 0.8482, test_loss: 1.0426, test_f1: 0.5420
 epoch: 47, train_loss: 0.8019, test_loss: 1.0246, test_f1: 0.5455
 epoch: 48, train_loss: 0.7977, test_loss: 1.0650, test_f1: 0.5302
 epoch: 49, train_loss: 0.7880, test_loss: 1.1376, test_f1: 0.5311
 epoch: 50, train_loss: 0.7879, test_loss: 1.0687, test_f1: 0.5362
 epoch: 51, train_loss: 0.7702, test_loss: 1.1449, test_f1: 0.5325
 epoch: 52, train_loss: 0.7561, test_loss: 1.2469, test_f1: 0.4375
 epoch: 53, train_loss: 0.7362, test_loss: 1.1422, test_f1: 0.5608
 epoch: 54, train_loss: 0.7528, test_loss: 1.1556, test_f1: 0.5652
 epoch: 55, train_loss: 0.7423, test_loss: 1.2509, test_f1: 0.5141
 epoch: 56, train_loss: 0.7322, test_loss: 1.1719, test_f1: 0.5599
 epoch: 57, train_loss: 0.7469, test_loss: 1.2194, test_f1: 0.5225
 epoch: 58, train_loss: 0.7282, test_loss: 1.1949, test_f1: 0.5424
 epoch: 59, train_loss: 0.7468, test_loss: 1.2379, test_f1: 0.5700
 epoch: 60, train_loss: 0.7103, test_loss: 1.2863, test_f1: 0.5673
 epoch: 61, train_loss: 0.7325, test_loss: 1.1836, test_f1: 0.5600
 epoch: 62, train_loss: 0.7102, test_loss: 1.2241, test_f1: 0.5709
 epoch: 63, train_loss: 0.7154, test_loss: 1.1972, test_f1: 0.5383
 epoch: 64, train_loss: 0.7281, test_loss: 1.2441, test_f1: 0.5851
 epoch: 65, train_loss: 0.7113, test_loss: 1.2372, test_f1: 0.5460
 epoch: 66, train_loss: 0.7049, test_loss: 1.3921, test_f1: 0.5445
 epoch: 67, train_loss: 0.6868, test_loss: 1.4146, test_f1: 0.5250
 epoch: 68, train_loss: 0.7000, test_loss: 1.3262, test_f1: 0.5572
 epoch: 69, train_loss: 0.6907, test_loss: 1.2671, test_f1: 0.5743
 epoch: 70, train_loss: 0.7042, test_loss: 1.4923, test_f1: 0.5237
 epoch: 71, train_loss: 0.6676, test_loss: 1.4008, test_f1: 0.5288
 epoch: 72, train_loss: 0.6880, test_loss: 1.3322, test_f1: 0.5944
 epoch: 73, train_loss: 0.6735, test_loss: 1.5613, test_f1: 0.5218
 epoch: 74, train_loss: 0.6873, test_loss: 1.3276, test_f1: 0.5534
 epoch: 75, train_loss: 0.7027, test_loss: 1.2338, test_f1: 0.6027
 epoch: 76, train_loss: 0.6729, test_loss: 1.3526, test_f1: 0.5417
 epoch: 77, train_loss: 0.6589, test_loss: 1.4559, test_f1: 0.5559
 epoch: 78, train_loss: 0.6666, test_loss: 1.4739, test_f1: 0.5491
 epoch: 79, train_loss: 0.6518, test_loss: 1.2819, test_f1: 0.5908
 epoch: 80, train_loss: 0.6538, test_loss: 1.5063, test_f1: 0.5490
 epoch: 81, train_loss: 0.6493, test_loss: 1.6048, test_f1: 0.4922
 epoch: 82, train_loss: 0.6584, test_loss: 1.5765, test_f1: 0.5513
 epoch: 83, train_loss: 0.6727, test_loss: 1.5656, test_f1: 0.5470
 epoch: 84, train_loss: 0.6839, test_loss: 1.3976, test_f1: 0.6025
 epoch: 85, train_loss: 0.6521, test_loss: 1.4192, test_f1: 0.5721
 epoch: 86, train_loss: 0.6599, test_loss: 1.4318, test_f1: 0.5678
 epoch: 87, train_loss: 0.6569, test_loss: 1.3775, test_f1: 0.5382
 epoch: 88, train_loss: 0.6370, test_loss: 1.3584, test_f1: 0.5823
 epoch: 89, train_loss: 0.6231, test_loss: 1.4233, test_f1: 0.5365
 epoch: 90, train_loss: 0.6286, test_loss: 1.3131, test_f1: 0.5545
 epoch: 91, train_loss: 0.6240, test_loss: 1.4636, test_f1: 0.5464
 epoch: 92, train_loss: 0.6232, test_loss: 1.2848, test_f1: 0.6017
 epoch: 93, train_loss: 0.6307, test_loss: 1.6082, test_f1: 0.5403
 epoch: 94, train_loss: 0.6153, test_loss: 1.2154, test_f1: 0.6284
 epoch: 95, train_loss: 0.6133, test_loss: 1.4137, test_f1: 0.5574
 epoch: 96, train_loss: 0.6311, test_loss: 1.4377, test_f1: 0.5440
 epoch: 97, train_loss: 0.6090, test_loss: 1.4484, test_f1: 0.5797
 epoch: 98, train_loss: 0.6045, test_loss: 1.6867, test_f1: 0.5088
 epoch: 99, train_loss: 0.6239, test_loss: 1.4900, test_f1: 0.5592
##################ITERATION #6 ****************************************
 epoch: 0, train_loss: 1.3154, test_loss: 1.3154, test_f1: 0.3481
 epoch: 1, train_loss: 1.1735, test_loss: 1.4025, test_f1: 0.3135
 epoch: 2, train_loss: 1.1314, test_loss: 1.2036, test_f1: 0.3180
 epoch: 3, train_loss: 1.0784, test_loss: 1.2019, test_f1: 0.3937
 epoch: 4, train_loss: 1.0319, test_loss: 1.2301, test_f1: 0.5025
 epoch: 5, train_loss: 1.0118, test_loss: 1.2142, test_f1: 0.4175
 epoch: 6, train_loss: 1.0049, test_loss: 1.1849, test_f1: 0.5172
 epoch: 7, train_loss: 0.9868, test_loss: 1.0882, test_f1: 0.5098
 epoch: 8, train_loss: 0.9475, test_loss: 1.1271, test_f1: 0.5016
 epoch: 9, train_loss: 0.9436, test_loss: 1.0901, test_f1: 0.5206
 epoch: 10, train_loss: 0.9130, test_loss: 1.0593, test_f1: 0.4654
 epoch: 11, train_loss: 0.9144, test_loss: 0.9913, test_f1: 0.5592
 epoch: 12, train_loss: 0.9118, test_loss: 1.3822, test_f1: 0.5172
 epoch: 13, train_loss: 0.9140, test_loss: 2.3576, test_f1: 0.5009
 epoch: 14, train_loss: 0.8946, test_loss: 1.0378, test_f1: 0.5633
 epoch: 15, train_loss: 0.8996, test_loss: 1.0076, test_f1: 0.5159
 epoch: 16, train_loss: 0.8772, test_loss: 1.1163, test_f1: 0.4962
 epoch: 17, train_loss: 0.8647, test_loss: 1.0501, test_f1: 0.5606
 epoch: 18, train_loss: 0.8537, test_loss: 1.0693, test_f1: 0.4922
 epoch: 19, train_loss: 0.8531, test_loss: 1.0404, test_f1: 0.5497
 epoch: 20, train_loss: 0.8485, test_loss: 1.0620, test_f1: 0.5540
 epoch: 21, train_loss: 0.8285, test_loss: 1.0839, test_f1: 0.5258
 epoch: 22, train_loss: 0.8264, test_loss: 1.0505, test_f1: 0.5515
 epoch: 23, train_loss: 0.8651, test_loss: 1.1350, test_f1: 0.5241
 epoch: 24, train_loss: 0.8374, test_loss: 1.0108, test_f1: 0.5708
 epoch: 25, train_loss: 0.8430, test_loss: 1.2871, test_f1: 0.4568
 epoch: 26, train_loss: 0.8259, test_loss: 1.0886, test_f1: 0.5339
 epoch: 27, train_loss: 0.8518, test_loss: 1.0112, test_f1: 0.5641
 epoch: 28, train_loss: 0.8303, test_loss: 1.0466, test_f1: 0.5613
 epoch: 29, train_loss: 0.8216, test_loss: 1.1229, test_f1: 0.5756
 epoch: 30, train_loss: 0.8146, test_loss: 0.9920, test_f1: 0.5421
 epoch: 31, train_loss: 0.8183, test_loss: 1.0824, test_f1: 0.5583
 epoch: 32, train_loss: 0.8389, test_loss: 0.9714, test_f1: 0.5608
 epoch: 33, train_loss: 0.8311, test_loss: 1.0287, test_f1: 0.6025
 epoch: 34, train_loss: 0.7987, test_loss: 1.0824, test_f1: 0.4911
 epoch: 35, train_loss: 0.8163, test_loss: 1.1164, test_f1: 0.5632
 epoch: 36, train_loss: 0.8049, test_loss: 1.1030, test_f1: 0.5366
 epoch: 37, train_loss: 0.7936, test_loss: 1.0402, test_f1: 0.5812
 epoch: 38, train_loss: 0.7814, test_loss: 1.0358, test_f1: 0.5792
 epoch: 39, train_loss: 0.7735, test_loss: 1.1012, test_f1: 0.5499
 epoch: 40, train_loss: 0.7736, test_loss: 1.1493, test_f1: 0.5903
 epoch: 41, train_loss: 0.7935, test_loss: 1.0838, test_f1: 0.5601
 epoch: 42, train_loss: 0.7821, test_loss: 1.3623, test_f1: 0.5116
 epoch: 43, train_loss: 0.7636, test_loss: 1.0442, test_f1: 0.5687
 epoch: 44, train_loss: 0.7646, test_loss: 1.1178, test_f1: 0.5405
 epoch: 45, train_loss: 0.7729, test_loss: 1.0292, test_f1: 0.5725
 epoch: 46, train_loss: 0.7523, test_loss: 1.0619, test_f1: 0.6155
 epoch: 47, train_loss: 0.7854, test_loss: 1.0815, test_f1: 0.5883
 epoch: 48, train_loss: 0.7808, test_loss: 1.1814, test_f1: 0.4819
 epoch: 49, train_loss: 0.7527, test_loss: 1.1176, test_f1: 0.5877
 epoch: 50, train_loss: 0.7371, test_loss: 1.2903, test_f1: 0.5716
 epoch: 51, train_loss: 0.7251, test_loss: 1.1045, test_f1: 0.5899
 epoch: 52, train_loss: 0.7042, test_loss: 1.0702, test_f1: 0.5778
 epoch: 53, train_loss: 0.6867, test_loss: 1.0800, test_f1: 0.5808
 epoch: 54, train_loss: 0.7040, test_loss: 1.2008, test_f1: 0.6084
 epoch: 55, train_loss: 0.6853, test_loss: 1.1937, test_f1: 0.5922
 epoch: 56, train_loss: 0.6832, test_loss: 1.2842, test_f1: 0.5701
 epoch: 57, train_loss: 0.6871, test_loss: 1.2450, test_f1: 0.6145
 epoch: 58, train_loss: 0.6905, test_loss: 1.2059, test_f1: 0.6017
 epoch: 59, train_loss: 0.6502, test_loss: 1.3848, test_f1: 0.6063
 epoch: 60, train_loss: 0.6785, test_loss: 1.2489, test_f1: 0.5917
 epoch: 61, train_loss: 0.6854, test_loss: 1.1596, test_f1: 0.5702
 epoch: 62, train_loss: 0.7233, test_loss: 1.2575, test_f1: 0.5902
 epoch: 63, train_loss: 0.7052, test_loss: 1.2286, test_f1: 0.5839
 epoch: 64, train_loss: 0.6928, test_loss: 1.1154, test_f1: 0.5907
 epoch: 65, train_loss: 0.6837, test_loss: 1.3773, test_f1: 0.5835
 epoch: 66, train_loss: 0.6703, test_loss: 1.2664, test_f1: 0.5810
 epoch: 67, train_loss: 0.6725, test_loss: 1.2953, test_f1: 0.6087
 epoch: 68, train_loss: 0.6706, test_loss: 1.2239, test_f1: 0.6130
 epoch: 69, train_loss: 0.6823, test_loss: 1.2086, test_f1: 0.6132
 epoch: 70, train_loss: 0.6511, test_loss: 1.1980, test_f1: 0.6207
 epoch: 71, train_loss: 0.6590, test_loss: 1.4225, test_f1: 0.5826
 epoch: 72, train_loss: 0.6694, test_loss: 1.4922, test_f1: 0.5188
 epoch: 73, train_loss: 0.6372, test_loss: 1.4262, test_f1: 0.5793
 epoch: 74, train_loss: 0.6652, test_loss: 1.1585, test_f1: 0.5905
 epoch: 75, train_loss: 0.6790, test_loss: 1.6600, test_f1: 0.5363
 epoch: 76, train_loss: 0.6553, test_loss: 1.2275, test_f1: 0.6344
 epoch: 77, train_loss: 0.6127, test_loss: 1.2367, test_f1: 0.6090
 epoch: 78, train_loss: 0.6502, test_loss: 1.2656, test_f1: 0.6216
 epoch: 79, train_loss: 0.6419, test_loss: 1.2205, test_f1: 0.6311
 epoch: 80, train_loss: 0.6061, test_loss: 1.4415, test_f1: 0.5617
 epoch: 81, train_loss: 0.6293, test_loss: 1.4246, test_f1: 0.6222
 epoch: 82, train_loss: 0.6167, test_loss: 1.3152, test_f1: 0.6244
 epoch: 83, train_loss: 0.6122, test_loss: 1.3186, test_f1: 0.6122
 epoch: 84, train_loss: 0.6233, test_loss: 1.2655, test_f1: 0.6091
 epoch: 85, train_loss: 0.6040, test_loss: 1.4337, test_f1: 0.6145
 epoch: 86, train_loss: 0.5919, test_loss: 1.2856, test_f1: 0.5977
 epoch: 87, train_loss: 0.6108, test_loss: 1.4564, test_f1: 0.6186
 epoch: 88, train_loss: 0.5961, test_loss: 1.4068, test_f1: 0.6294
 epoch: 89, train_loss: 0.5849, test_loss: 1.4531, test_f1: 0.5875
 epoch: 90, train_loss: 0.5549, test_loss: 1.3893, test_f1: 0.6082
 epoch: 91, train_loss: 0.5839, test_loss: 1.4131, test_f1: 0.6344
 epoch: 92, train_loss: 0.5966, test_loss: 1.5227, test_f1: 0.6108
 epoch: 93, train_loss: 0.5758, test_loss: 1.4050, test_f1: 0.6387
 epoch: 94, train_loss: 0.5633, test_loss: 1.5907, test_f1: 0.5701
 epoch: 95, train_loss: 0.5770, test_loss: 1.4649, test_f1: 0.6146
 epoch: 96, train_loss: 0.5288, test_loss: 1.3726, test_f1: 0.5955
 epoch: 97, train_loss: 0.5503, test_loss: 1.3540, test_f1: 0.6188
 epoch: 98, train_loss: 0.6394, test_loss: 1.4003, test_f1: 0.6296
 epoch: 99, train_loss: 0.6002, test_loss: 1.3492, test_f1: 0.5727
##################ITERATION #7 ****************************************
 epoch: 0, train_loss: 1.3497, test_loss: 1.5108, test_f1: 0.2733
 epoch: 1, train_loss: 1.2368, test_loss: 1.3526, test_f1: 0.3702
 epoch: 2, train_loss: 1.1695, test_loss: 1.3516, test_f1: 0.2848
 epoch: 3, train_loss: 1.1400, test_loss: 1.2278, test_f1: 0.4237
 epoch: 4, train_loss: 1.0983, test_loss: 1.2553, test_f1: 0.4065
 epoch: 5, train_loss: 1.0806, test_loss: 1.2182, test_f1: 0.3900
 epoch: 6, train_loss: 1.0035, test_loss: 1.1995, test_f1: 0.4654
 epoch: 7, train_loss: 0.9794, test_loss: 1.1928, test_f1: 0.4953
 epoch: 8, train_loss: 0.9795, test_loss: 1.0869, test_f1: 0.5693
 epoch: 9, train_loss: 0.9446, test_loss: 1.1441, test_f1: 0.4592
 epoch: 10, train_loss: 0.9023, test_loss: 1.3029, test_f1: 0.4202
 epoch: 11, train_loss: 0.9132, test_loss: 1.0849, test_f1: 0.5542
 epoch: 12, train_loss: 0.8926, test_loss: 1.1155, test_f1: 0.4992
 epoch: 13, train_loss: 0.9140, test_loss: 1.1061, test_f1: 0.4769
 epoch: 14, train_loss: 0.8629, test_loss: 1.3021, test_f1: 0.4194
 epoch: 15, train_loss: 0.8598, test_loss: 1.1232, test_f1: 0.5001
 epoch: 16, train_loss: 0.8443, test_loss: 1.0767, test_f1: 0.4879
 epoch: 17, train_loss: 0.8400, test_loss: 0.9846, test_f1: 0.5613
 epoch: 18, train_loss: 0.8291, test_loss: 1.1054, test_f1: 0.5317
 epoch: 19, train_loss: 0.8593, test_loss: 1.4642, test_f1: 0.3812
 epoch: 20, train_loss: 0.8303, test_loss: 1.0440, test_f1: 0.6050
 epoch: 21, train_loss: 0.8052, test_loss: 1.2422, test_f1: 0.5027
 epoch: 22, train_loss: 0.8418, test_loss: 1.0747, test_f1: 0.5426
 epoch: 23, train_loss: 0.8418, test_loss: 1.1905, test_f1: 0.5443
 epoch: 24, train_loss: 0.8257, test_loss: 2.3300, test_f1: 0.5131
 epoch: 25, train_loss: 0.8157, test_loss: 1.1714, test_f1: 0.5460
 epoch: 26, train_loss: 0.8071, test_loss: 1.1302, test_f1: 0.5573
 epoch: 27, train_loss: 0.7930, test_loss: 2.0383, test_f1: 0.3931
 epoch: 28, train_loss: 0.8200, test_loss: 1.1305, test_f1: 0.5510
 epoch: 29, train_loss: 0.7764, test_loss: 1.0567, test_f1: 0.5938
 epoch: 30, train_loss: 0.7803, test_loss: 1.1078, test_f1: 0.5239
 epoch: 31, train_loss: 0.7634, test_loss: 1.4109, test_f1: 0.4773
 epoch: 32, train_loss: 0.7771, test_loss: 1.1113, test_f1: 0.5700
 epoch: 33, train_loss: 0.7388, test_loss: 1.2225, test_f1: 0.5687
 epoch: 34, train_loss: 0.7549, test_loss: 1.2527, test_f1: 0.5111
 epoch: 35, train_loss: 0.7310, test_loss: 1.3187, test_f1: 0.5688
 epoch: 36, train_loss: 0.7530, test_loss: 1.1487, test_f1: 0.5963
 epoch: 37, train_loss: 0.7853, test_loss: 1.2056, test_f1: 0.5233
 epoch: 38, train_loss: 0.7510, test_loss: 1.4722, test_f1: 0.5320
 epoch: 39, train_loss: 0.7595, test_loss: 1.3312, test_f1: 0.5485
 epoch: 40, train_loss: 0.7302, test_loss: 1.3124, test_f1: 0.5095
 epoch: 41, train_loss: 0.7229, test_loss: 1.3554, test_f1: 0.5387
 epoch: 42, train_loss: 0.7427, test_loss: 1.5178, test_f1: 0.5882
 epoch: 43, train_loss: 0.7714, test_loss: 1.2917, test_f1: 0.5003
 epoch: 44, train_loss: 0.7210, test_loss: 1.1656, test_f1: 0.5864
 epoch: 45, train_loss: 0.7302, test_loss: 1.1718, test_f1: 0.5779
 epoch: 46, train_loss: 0.6974, test_loss: 1.3060, test_f1: 0.6076
 epoch: 47, train_loss: 0.6764, test_loss: 1.2446, test_f1: 0.5825
 epoch: 48, train_loss: 0.7003, test_loss: 1.3424, test_f1: 0.5622
 epoch: 49, train_loss: 0.7138, test_loss: 2.1298, test_f1: 0.4660
 epoch: 50, train_loss: 0.7040, test_loss: 1.1764, test_f1: 0.5526
 epoch: 51, train_loss: 0.6572, test_loss: 1.2993, test_f1: 0.5900
 epoch: 52, train_loss: 0.6442, test_loss: 1.2594, test_f1: 0.5838
 epoch: 53, train_loss: 0.6486, test_loss: 1.4295, test_f1: 0.5897
 epoch: 54, train_loss: 0.6441, test_loss: 1.3008, test_f1: 0.5842
 epoch: 55, train_loss: 0.6473, test_loss: 1.3999, test_f1: 0.5667
 epoch: 56, train_loss: 0.6455, test_loss: 1.3712, test_f1: 0.5783
 epoch: 57, train_loss: 0.6585, test_loss: 1.6412, test_f1: 0.5457
 epoch: 58, train_loss: 0.6182, test_loss: 1.3751, test_f1: 0.5927
 epoch: 59, train_loss: 0.6049, test_loss: 1.5038, test_f1: 0.5747
 epoch: 60, train_loss: 0.6112, test_loss: 1.7828, test_f1: 0.5989
 epoch: 61, train_loss: 0.6167, test_loss: 1.3923, test_f1: 0.5932
 epoch: 62, train_loss: 0.6136, test_loss: 1.5450, test_f1: 0.6253
 epoch: 63, train_loss: 0.6008, test_loss: 1.5143, test_f1: 0.5836
 epoch: 64, train_loss: 0.6031, test_loss: 1.5050, test_f1: 0.6312
 epoch: 65, train_loss: 0.6007, test_loss: 1.4600, test_f1: 0.5727
 epoch: 66, train_loss: 0.6151, test_loss: 1.3963, test_f1: 0.5984
 epoch: 67, train_loss: 0.5853, test_loss: 1.5439, test_f1: 0.5985
 epoch: 68, train_loss: 0.6159, test_loss: 1.4875, test_f1: 0.6165
 epoch: 69, train_loss: 0.6198, test_loss: 1.6218, test_f1: 0.5738
 epoch: 70, train_loss: 0.5963, test_loss: 1.4010, test_f1: 0.5729
 epoch: 71, train_loss: 0.5843, test_loss: 1.4506, test_f1: 0.5959
 epoch: 72, train_loss: 0.5706, test_loss: 1.5224, test_f1: 0.5925
 epoch: 73, train_loss: 0.5642, test_loss: 1.8240, test_f1: 0.5447
 epoch: 74, train_loss: 0.5970, test_loss: 1.4297, test_f1: 0.5941
 epoch: 75, train_loss: 0.5802, test_loss: 1.6458, test_f1: 0.6084
 epoch: 76, train_loss: 0.5715, test_loss: 1.4421, test_f1: 0.5687
 epoch: 77, train_loss: 0.5660, test_loss: 1.6315, test_f1: 0.6060
 epoch: 78, train_loss: 0.5737, test_loss: 1.6641, test_f1: 0.6057
 epoch: 79, train_loss: 0.5433, test_loss: 1.8246, test_f1: 0.5810
 epoch: 80, train_loss: 0.5640, test_loss: 1.6050, test_f1: 0.5479
 epoch: 81, train_loss: 0.5450, test_loss: 1.6272, test_f1: 0.5841
 epoch: 82, train_loss: 0.5491, test_loss: 1.6926, test_f1: 0.6213
 epoch: 83, train_loss: 0.5987, test_loss: 1.7033, test_f1: 0.5766
 epoch: 84, train_loss: 0.5464, test_loss: 1.6564, test_f1: 0.6078
 epoch: 85, train_loss: 0.5607, test_loss: 1.7906, test_f1: 0.6077
 epoch: 86, train_loss: 0.5431, test_loss: 1.7779, test_f1: 0.5790
 epoch: 87, train_loss: 0.5785, test_loss: 1.6042, test_f1: 0.5820
 epoch: 88, train_loss: 0.5676, test_loss: 1.6489, test_f1: 0.5604
 epoch: 89, train_loss: 0.5490, test_loss: 1.3893, test_f1: 0.6131
 epoch: 90, train_loss: 0.5396, test_loss: 1.5562, test_f1: 0.5634
 epoch: 91, train_loss: 0.5242, test_loss: 1.6627, test_f1: 0.6192
 epoch: 92, train_loss: 0.5304, test_loss: 1.6877, test_f1: 0.6077
 epoch: 93, train_loss: 0.5105, test_loss: 1.6669, test_f1: 0.5754
 epoch: 94, train_loss: 0.5218, test_loss: 1.7134, test_f1: 0.6033
 epoch: 95, train_loss: 0.5105, test_loss: 1.6826, test_f1: 0.5229
 epoch: 96, train_loss: 0.5275, test_loss: 1.5236, test_f1: 0.6081
 epoch: 97, train_loss: 0.5647, test_loss: 1.7341, test_f1: 0.5476
 epoch: 98, train_loss: 0.5497, test_loss: 1.4015, test_f1: 0.6001
 epoch: 99, train_loss: 0.5210, test_loss: 1.5885, test_f1: 0.5877
##################ITERATION #8 ****************************************
 epoch: 0, train_loss: 1.3304, test_loss: 1.3167, test_f1: 0.2773
 epoch: 1, train_loss: 1.1679, test_loss: 1.2431, test_f1: 0.3656
 epoch: 2, train_loss: 1.1142, test_loss: 1.2553, test_f1: 0.4302
 epoch: 3, train_loss: 1.0666, test_loss: 1.3310, test_f1: 0.3422
 epoch: 4, train_loss: 1.0206, test_loss: 1.1814, test_f1: 0.4187
 epoch: 5, train_loss: 0.9900, test_loss: 1.1611, test_f1: 0.4706
 epoch: 6, train_loss: 0.9646, test_loss: 1.4262, test_f1: 0.3574
 epoch: 7, train_loss: 0.9914, test_loss: 1.1221, test_f1: 0.5348
 epoch: 8, train_loss: 0.9271, test_loss: 1.1086, test_f1: 0.4675
 epoch: 9, train_loss: 0.9311, test_loss: 1.3059, test_f1: 0.4304
 epoch: 10, train_loss: 0.9108, test_loss: 1.1833, test_f1: 0.5183
 epoch: 11, train_loss: 0.9339, test_loss: 1.0862, test_f1: 0.5109
 epoch: 12, train_loss: 0.9127, test_loss: 1.3178, test_f1: 0.4497
 epoch: 13, train_loss: 0.8939, test_loss: 1.2124, test_f1: 0.5665
 epoch: 14, train_loss: 0.8874, test_loss: 1.1276, test_f1: 0.5528
 epoch: 15, train_loss: 0.8655, test_loss: 1.0341, test_f1: 0.5393
 epoch: 16, train_loss: 0.8425, test_loss: 1.1820, test_f1: 0.4364
 epoch: 17, train_loss: 0.8780, test_loss: 1.0633, test_f1: 0.5182
 epoch: 18, train_loss: 0.8568, test_loss: 1.1293, test_f1: 0.4538
 epoch: 19, train_loss: 0.8450, test_loss: 1.2116, test_f1: 0.5507
 epoch: 20, train_loss: 0.8610, test_loss: 1.1146, test_f1: 0.5235
 epoch: 21, train_loss: 0.8969, test_loss: 1.1034, test_f1: 0.5656
 epoch: 22, train_loss: 0.8554, test_loss: 1.1779, test_f1: 0.4968
 epoch: 23, train_loss: 0.8361, test_loss: 1.0934, test_f1: 0.5697
 epoch: 24, train_loss: 0.8373, test_loss: 1.4569, test_f1: 0.4514
 epoch: 25, train_loss: 0.8341, test_loss: 1.3165, test_f1: 0.4820
 epoch: 26, train_loss: 0.8528, test_loss: 1.1048, test_f1: 0.5366
 epoch: 27, train_loss: 0.8428, test_loss: 1.0145, test_f1: 0.5708
 epoch: 28, train_loss: 0.8274, test_loss: 1.2517, test_f1: 0.5443
 epoch: 29, train_loss: 0.8055, test_loss: 1.3437, test_f1: 0.4818
 epoch: 30, train_loss: 0.8193, test_loss: 1.2155, test_f1: 0.4980
 epoch: 31, train_loss: 0.8028, test_loss: 1.0536, test_f1: 0.5808
 epoch: 32, train_loss: 0.8230, test_loss: 1.3301, test_f1: 0.4713
 epoch: 33, train_loss: 0.8066, test_loss: 1.1223, test_f1: 0.5575
 epoch: 34, train_loss: 0.8138, test_loss: 1.1505, test_f1: 0.5481
 epoch: 35, train_loss: 0.7692, test_loss: 1.1601, test_f1: 0.5574
 epoch: 36, train_loss: 0.8219, test_loss: 1.1034, test_f1: 0.5655
 epoch: 37, train_loss: 0.8363, test_loss: 1.0490, test_f1: 0.5636
 epoch: 38, train_loss: 0.8164, test_loss: 1.1514, test_f1: 0.4501
 epoch: 39, train_loss: 0.7892, test_loss: 1.1489, test_f1: 0.4928
 epoch: 40, train_loss: 0.7842, test_loss: 1.0505, test_f1: 0.5895
 epoch: 41, train_loss: 0.7588, test_loss: 1.2156, test_f1: 0.5537
 epoch: 42, train_loss: 0.7879, test_loss: 1.0384, test_f1: 0.6154
 epoch: 43, train_loss: 0.7956, test_loss: 1.0859, test_f1: 0.6130
 epoch: 44, train_loss: 0.7596, test_loss: 1.0264, test_f1: 0.5814
 epoch: 45, train_loss: 0.7457, test_loss: 1.1429, test_f1: 0.5984
 epoch: 46, train_loss: 0.7403, test_loss: 1.4396, test_f1: 0.5501
 epoch: 47, train_loss: 0.7442, test_loss: 1.1184, test_f1: 0.5775
 epoch: 48, train_loss: 0.7278, test_loss: 1.3105, test_f1: 0.5723
 epoch: 49, train_loss: 0.7306, test_loss: 1.2124, test_f1: 0.5297
 epoch: 50, train_loss: 0.7115, test_loss: 1.2367, test_f1: 0.5299
 epoch: 51, train_loss: 0.6913, test_loss: 1.1717, test_f1: 0.5698
 epoch: 52, train_loss: 0.6891, test_loss: 1.3314, test_f1: 0.5723
 epoch: 53, train_loss: 0.6702, test_loss: 1.2273, test_f1: 0.5918
 epoch: 54, train_loss: 0.6510, test_loss: 1.3438, test_f1: 0.5443
 epoch: 55, train_loss: 0.6716, test_loss: 1.2372, test_f1: 0.5879
 epoch: 56, train_loss: 0.6576, test_loss: 1.2040, test_f1: 0.5930
 epoch: 57, train_loss: 0.6623, test_loss: 1.4501, test_f1: 0.5678
 epoch: 58, train_loss: 0.6363, test_loss: 1.1960, test_f1: 0.6145
 epoch: 59, train_loss: 0.6397, test_loss: 1.4983, test_f1: 0.5535
 epoch: 60, train_loss: 0.6469, test_loss: 1.3830, test_f1: 0.5839
 epoch: 61, train_loss: 0.6257, test_loss: 1.3566, test_f1: 0.5646
 epoch: 62, train_loss: 0.6186, test_loss: 1.4097, test_f1: 0.5274
 epoch: 63, train_loss: 0.6370, test_loss: 1.5238, test_f1: 0.5825
 epoch: 64, train_loss: 0.6096, test_loss: 1.3382, test_f1: 0.5665
 epoch: 65, train_loss: 0.6122, test_loss: 1.4627, test_f1: 0.5514
 epoch: 66, train_loss: 0.5885, test_loss: 1.6067, test_f1: 0.5747
 epoch: 67, train_loss: 0.6229, test_loss: 1.4897, test_f1: 0.5277
 epoch: 68, train_loss: 0.6378, test_loss: 1.2413, test_f1: 0.5293
 epoch: 69, train_loss: 0.6059, test_loss: 1.3219, test_f1: 0.5660
 epoch: 70, train_loss: 0.6034, test_loss: 1.3875, test_f1: 0.6059
 epoch: 71, train_loss: 0.5735, test_loss: 1.6867, test_f1: 0.5345
 epoch: 72, train_loss: 0.5952, test_loss: 1.5712, test_f1: 0.6245
 epoch: 73, train_loss: 0.6062, test_loss: 1.5320, test_f1: 0.5902
 epoch: 74, train_loss: 0.5815, test_loss: 1.5993, test_f1: 0.5686
 epoch: 75, train_loss: 0.5834, test_loss: 1.4017, test_f1: 0.5916
 epoch: 76, train_loss: 0.5567, test_loss: 1.5654, test_f1: 0.5576
 epoch: 77, train_loss: 0.5687, test_loss: 1.5448, test_f1: 0.5099
 epoch: 78, train_loss: 0.5762, test_loss: 1.6192, test_f1: 0.6278
 epoch: 79, train_loss: 0.5641, test_loss: 1.8014, test_f1: 0.5363
 epoch: 80, train_loss: 0.5792, test_loss: 1.5866, test_f1: 0.5745
 epoch: 81, train_loss: 0.5954, test_loss: 1.6518, test_f1: 0.5868
 epoch: 82, train_loss: 0.5940, test_loss: 1.4389, test_f1: 0.5405
 epoch: 83, train_loss: 0.5565, test_loss: 1.7944, test_f1: 0.5527
 epoch: 84, train_loss: 0.5530, test_loss: 1.7014, test_f1: 0.4989
 epoch: 85, train_loss: 0.5926, test_loss: 1.6426, test_f1: 0.5492
 epoch: 86, train_loss: 0.5489, test_loss: 1.7853, test_f1: 0.5784
 epoch: 87, train_loss: 0.5642, test_loss: 1.5589, test_f1: 0.5451
 epoch: 88, train_loss: 0.5537, test_loss: 1.6922, test_f1: 0.5500
 epoch: 89, train_loss: 0.5595, test_loss: 1.5733, test_f1: 0.5543
 epoch: 90, train_loss: 0.5647, test_loss: 1.6853, test_f1: 0.5505
 epoch: 91, train_loss: 0.5381, test_loss: 1.6187, test_f1: 0.5946
 epoch: 92, train_loss: 0.5256, test_loss: 1.6502, test_f1: 0.5868
 epoch: 93, train_loss: 0.5532, test_loss: 2.1027, test_f1: 0.5599
 epoch: 94, train_loss: 0.5404, test_loss: 1.6843, test_f1: 0.5791
 epoch: 95, train_loss: 0.5125, test_loss: 1.8695, test_f1: 0.5677
 epoch: 96, train_loss: 0.5103, test_loss: 1.8232, test_f1: 0.5838
 epoch: 97, train_loss: 0.5158, test_loss: 1.7776, test_f1: 0.5969
 epoch: 98, train_loss: 0.5067, test_loss: 1.7126, test_f1: 0.5503
 epoch: 99, train_loss: 0.5132, test_loss: 2.0087, test_f1: 0.5567
##################ITERATION #9 ****************************************
 epoch: 0, train_loss: 1.3260, test_loss: 1.3402, test_f1: 0.2358
 epoch: 1, train_loss: 1.1844, test_loss: 1.2035, test_f1: 0.4380
 epoch: 2, train_loss: 1.0956, test_loss: 1.1839, test_f1: 0.4800
 epoch: 3, train_loss: 1.0436, test_loss: 1.1491, test_f1: 0.5102
 epoch: 4, train_loss: 1.0317, test_loss: 1.1304, test_f1: 0.5066
 epoch: 5, train_loss: 0.9744, test_loss: 1.1137, test_f1: 0.4887
 epoch: 6, train_loss: 0.9651, test_loss: 1.4037, test_f1: 0.4636
 epoch: 7, train_loss: 0.9928, test_loss: 1.0922, test_f1: 0.4974
 epoch: 8, train_loss: 0.9242, test_loss: 1.0325, test_f1: 0.5728
 epoch: 9, train_loss: 0.9271, test_loss: 1.0488, test_f1: 0.5448
 epoch: 10, train_loss: 0.9279, test_loss: 1.0162, test_f1: 0.5886
 epoch: 11, train_loss: 0.9051, test_loss: 1.0099, test_f1: 0.5527
 epoch: 12, train_loss: 0.8859, test_loss: 0.9827, test_f1: 0.5247
 epoch: 13, train_loss: 0.8716, test_loss: 1.0832, test_f1: 0.5650
 epoch: 14, train_loss: 0.8601, test_loss: 0.9976, test_f1: 0.5373
 epoch: 15, train_loss: 0.8508, test_loss: 1.1018, test_f1: 0.5555
 epoch: 16, train_loss: 0.8778, test_loss: 1.0792, test_f1: 0.5579
 epoch: 17, train_loss: 0.8508, test_loss: 0.9894, test_f1: 0.5634
 epoch: 18, train_loss: 0.8606, test_loss: 1.0950, test_f1: 0.5279
 epoch: 19, train_loss: 0.8572, test_loss: 1.0744, test_f1: 0.5024
 epoch: 20, train_loss: 0.8556, test_loss: 1.0055, test_f1: 0.6074
 epoch: 21, train_loss: 0.8494, test_loss: 1.0142, test_f1: 0.5372
 epoch: 22, train_loss: 0.8388, test_loss: 1.0387, test_f1: 0.5324
 epoch: 23, train_loss: 0.8207, test_loss: 1.0379, test_f1: 0.5407
 epoch: 24, train_loss: 0.8203, test_loss: 1.0698, test_f1: 0.5275
 epoch: 25, train_loss: 0.8140, test_loss: 1.0683, test_f1: 0.5418
 epoch: 26, train_loss: 0.8053, test_loss: 1.1554, test_f1: 0.5260
 epoch: 27, train_loss: 0.8326, test_loss: 1.1709, test_f1: 0.5848
 epoch: 28, train_loss: 0.7935, test_loss: 1.0878, test_f1: 0.5328
 epoch: 29, train_loss: 0.7948, test_loss: 1.0808, test_f1: 0.5225
 epoch: 30, train_loss: 0.8034, test_loss: 1.0808, test_f1: 0.5480
 epoch: 31, train_loss: 0.7939, test_loss: 1.0407, test_f1: 0.5396
 epoch: 32, train_loss: 0.7790, test_loss: 0.9899, test_f1: 0.6001
 epoch: 33, train_loss: 0.7646, test_loss: 1.0766, test_f1: 0.5570
 epoch: 34, train_loss: 0.7656, test_loss: 1.1331, test_f1: 0.5487
 epoch: 35, train_loss: 0.7499, test_loss: 1.2895, test_f1: 0.4811
 epoch: 36, train_loss: 0.7930, test_loss: 1.0375, test_f1: 0.6057
 epoch: 37, train_loss: 0.7860, test_loss: 0.9755, test_f1: 0.5543
 epoch: 38, train_loss: 0.7620, test_loss: 1.0112, test_f1: 0.5822
 epoch: 39, train_loss: 0.7536, test_loss: 1.0334, test_f1: 0.6443
 epoch: 40, train_loss: 0.7564, test_loss: 1.1138, test_f1: 0.5469
 epoch: 41, train_loss: 0.7668, test_loss: 1.1242, test_f1: 0.5827
 epoch: 42, train_loss: 0.7525, test_loss: 1.0121, test_f1: 0.5688
 epoch: 43, train_loss: 0.7277, test_loss: 1.0779, test_f1: 0.5079
 epoch: 44, train_loss: 0.7171, test_loss: 1.0777, test_f1: 0.5519
 epoch: 45, train_loss: 0.6925, test_loss: 1.1014, test_f1: 0.5700
 epoch: 46, train_loss: 0.7620, test_loss: 1.0540, test_f1: 0.5434
 epoch: 47, train_loss: 0.7135, test_loss: 1.0846, test_f1: 0.5987
 epoch: 48, train_loss: 0.7126, test_loss: 1.1912, test_f1: 0.5397
 epoch: 49, train_loss: 0.7069, test_loss: 1.1099, test_f1: 0.5876
 epoch: 50, train_loss: 0.6943, test_loss: 1.0836, test_f1: 0.5337
 epoch: 51, train_loss: 0.6742, test_loss: 1.0901, test_f1: 0.5721
 epoch: 52, train_loss: 0.6532, test_loss: 1.0562, test_f1: 0.5718
 epoch: 53, train_loss: 0.6297, test_loss: 1.1181, test_f1: 0.5870
 epoch: 54, train_loss: 0.6206, test_loss: 1.2916, test_f1: 0.5727
 epoch: 55, train_loss: 0.6576, test_loss: 1.2102, test_f1: 0.5991
 epoch: 56, train_loss: 0.6408, test_loss: 1.0958, test_f1: 0.5863
 epoch: 57, train_loss: 0.6345, test_loss: 1.1792, test_f1: 0.5798
 epoch: 58, train_loss: 0.6137, test_loss: 1.1153, test_f1: 0.6293
 epoch: 59, train_loss: 0.6209, test_loss: 1.1254, test_f1: 0.6564
 epoch: 60, train_loss: 0.5944, test_loss: 1.1824, test_f1: 0.5866
 epoch: 61, train_loss: 0.5924, test_loss: 1.2403, test_f1: 0.5894
 epoch: 62, train_loss: 0.6156, test_loss: 1.2367, test_f1: 0.6032
 epoch: 63, train_loss: 0.5939, test_loss: 1.1173, test_f1: 0.6183
 epoch: 64, train_loss: 0.6040, test_loss: 1.1267, test_f1: 0.6312
 epoch: 65, train_loss: 0.5894, test_loss: 1.1773, test_f1: 0.5222
 epoch: 66, train_loss: 0.5573, test_loss: 1.3258, test_f1: 0.5760
 epoch: 67, train_loss: 0.5880, test_loss: 1.7295, test_f1: 0.5469
 epoch: 68, train_loss: 0.5913, test_loss: 1.1862, test_f1: 0.6177
 epoch: 69, train_loss: 0.5528, test_loss: 1.4543, test_f1: 0.4987
 epoch: 70, train_loss: 0.5764, test_loss: 1.3688, test_f1: 0.6126
 epoch: 71, train_loss: 0.5645, test_loss: 1.5065, test_f1: 0.6241
 epoch: 72, train_loss: 0.5701, test_loss: 2.1424, test_f1: 0.5648
 epoch: 73, train_loss: 0.5756, test_loss: 1.7924, test_f1: 0.5527
 epoch: 74, train_loss: 0.5757, test_loss: 1.5180, test_f1: 0.5917
 epoch: 75, train_loss: 0.5746, test_loss: 1.3467, test_f1: 0.5880
 epoch: 76, train_loss: 0.5837, test_loss: 1.2116, test_f1: 0.6028
 epoch: 77, train_loss: 0.5617, test_loss: 1.1929, test_f1: 0.5690
 epoch: 78, train_loss: 0.5443, test_loss: 1.5077, test_f1: 0.5059
 epoch: 79, train_loss: 0.5361, test_loss: 1.5037, test_f1: 0.5436
 epoch: 80, train_loss: 0.5327, test_loss: 1.3819, test_f1: 0.5812
 epoch: 81, train_loss: 0.5659, test_loss: 1.2656, test_f1: 0.5934
 epoch: 82, train_loss: 0.5543, test_loss: 1.2998, test_f1: 0.6252
 epoch: 83, train_loss: 0.5307, test_loss: 1.7850, test_f1: 0.5658
 epoch: 84, train_loss: 0.5921, test_loss: 1.4926, test_f1: 0.5174
 epoch: 85, train_loss: 0.5470, test_loss: 1.4636, test_f1: 0.5940
 epoch: 86, train_loss: 0.5394, test_loss: 1.6611, test_f1: 0.5831
 epoch: 87, train_loss: 0.5855, test_loss: 1.4063, test_f1: 0.5706
 epoch: 88, train_loss: 0.5065, test_loss: 1.3315, test_f1: 0.5982
 epoch: 89, train_loss: 0.5255, test_loss: 1.6287, test_f1: 0.5767
 epoch: 90, train_loss: 0.5390, test_loss: 1.4608, test_f1: 0.5692
 epoch: 91, train_loss: 0.5223, test_loss: 1.3911, test_f1: 0.5653
 epoch: 92, train_loss: 0.5162, test_loss: 1.3794, test_f1: 0.5833
 epoch: 93, train_loss: 0.5392, test_loss: 1.3114, test_f1: 0.5628
 epoch: 94, train_loss: 0.5009, test_loss: 1.3584, test_f1: 0.6067
 epoch: 95, train_loss: 0.5227, test_loss: 1.3331, test_f1: 0.6254
 epoch: 96, train_loss: 0.4971, test_loss: 1.4657, test_f1: 0.5502
 epoch: 97, train_loss: 0.5022, test_loss: 1.5239, test_f1: 0.5687
 epoch: 98, train_loss: 0.5109, test_loss: 1.3597, test_f1: 0.6024
 epoch: 99, train_loss: 0.5025, test_loss: 1.3150, test_f1: 0.5734

Training completed in 486.08 seconds
Best F1: 0.6564 at epoch 59
Mean F1 across iterations: 0.6299  0.0126
========================FINAL RESULTS================================
FEGIN weighted F1: 0.6564  0.0126
python main.py --data ltspice_demos --representation component_component --model FEGIN --layers 5 --hiddens 32 --batch_size 64 --lr 0.01 --emb_size 128 --epochs 100 --save_appendix component_component_L5_H32_BS64_LR0.01_E128 --no_val
-----



STDERR:
  File "main.py", line 370, in <module>
    main()
  File "main.py", line 254, in main
    dataset = dataset_class(
  File "/home/philip/projects/ltspice_examples_code_repo/Circuit-Completion-Using-GNNs/component_classification_with_link_prediction_head/evaluation/FEGIN/kernel/circuit_datasets.py", line 15, in __init__
    self.data, self.slices = torch.load(self.processed_paths[0])
  File "/home/philip/.local/lib/python3.8/site-packages/torch/serialization.py", line 1040, in load
    warnings.warn(
  File "/usr/lib/python3.8/warnings.py", line 109, in _showwarnmsg
    sw(msg.message, msg.category, msg.filename, msg.lineno,
  File "main.py", line 47, in warn_with_traceback
    traceback.print_stack(file=log)
/home/philip/projects/ltspice_examples_code_repo/Circuit-Completion-Using-GNNs/component_classification_with_link_prediction_head/evaluation/FEGIN/kernel/circuit_datasets.py:15: FutureWarning: You are using `torch.load` with `weights_only=False` (the current default value), which uses the default pickle module implicitly. It is possible to construct malicious pickle data which will execute arbitrary code during unpickling (See https://github.com/pytorch/pytorch/blob/main/SECURITY.md#untrusted-models for more details). In a future release, the default value for `weights_only` will be flipped to `True`. This limits the functions that could be executed during unpickling. Arbitrary objects will no longer be allowed to be loaded via this mode unless they are explicitly allowlisted by the user via `torch.serialization.add_safe_globals`. We recommend you start setting `weights_only=True` for any use case where you don't have full control of the loaded file. Please open an issue on GitHub for any issues related to this experimental feature.
  self.data, self.slices = torch.load(self.processed_paths[0])
