STDOUT:
Results will be saved in /home/philip/projects/ltspice_examples_code_repo/Circuit-Completion-Using-GNNs/component_classification_with_link_prediction_head/evaluation/FEGIN/results/model_FEGIN_dataset_ltspice_examples
Command line input: python main.py --data ltspice_examples --representation component_pin --model FEGIN --layers 2 --hiddens 32 --batch_size 32 --lr 0.001 --emb_size 512 --epochs 100 --save_appendix component_pin_L2_H32_BS32_LR0.001_E512 --no_val
 is saved.
-----
ltspice_examples - FEGIN
Using 2 layers, 32 hidden units, h = 2
Loading component_pin representation dataset
ENTERED
Training FEGIN on component_pin representation
Train: 3560, Test: 848
##################ITERATION #0 ****************************************
 epoch: 0, train_loss: 1.2480, test_loss: 1.1141, test_f1: 0.3745
 epoch: 1, train_loss: 1.0538, test_loss: 1.0697, test_f1: 0.3578
 epoch: 2, train_loss: 1.0179, test_loss: 1.0494, test_f1: 0.4436
 epoch: 3, train_loss: 1.0078, test_loss: 1.0474, test_f1: 0.4854
 epoch: 4, train_loss: 0.9851, test_loss: 0.9899, test_f1: 0.4989
 epoch: 5, train_loss: 0.9495, test_loss: 0.9621, test_f1: 0.5295
 epoch: 6, train_loss: 0.9351, test_loss: 1.0255, test_f1: 0.4806
 epoch: 7, train_loss: 0.9230, test_loss: 0.9031, test_f1: 0.5159
 epoch: 8, train_loss: 0.9067, test_loss: 0.9273, test_f1: 0.5171
 epoch: 9, train_loss: 0.8940, test_loss: 0.9186, test_f1: 0.5030
 epoch: 10, train_loss: 0.8650, test_loss: 0.9289, test_f1: 0.5543
 epoch: 11, train_loss: 0.8644, test_loss: 0.9344, test_f1: 0.5013
 epoch: 12, train_loss: 0.8435, test_loss: 0.9284, test_f1: 0.5246
 epoch: 13, train_loss: 0.8259, test_loss: 0.8756, test_f1: 0.5338
 epoch: 14, train_loss: 0.8227, test_loss: 0.9215, test_f1: 0.4905
 epoch: 15, train_loss: 0.8133, test_loss: 0.8360, test_f1: 0.5515
 epoch: 16, train_loss: 0.8000, test_loss: 0.8741, test_f1: 0.5328
 epoch: 17, train_loss: 0.7877, test_loss: 0.8045, test_f1: 0.5501
 epoch: 18, train_loss: 0.7799, test_loss: 0.8398, test_f1: 0.5458
 epoch: 19, train_loss: 0.7783, test_loss: 0.7842, test_f1: 0.6052
 epoch: 20, train_loss: 0.7786, test_loss: 0.8400, test_f1: 0.5741
 epoch: 21, train_loss: 0.7665, test_loss: 0.8572, test_f1: 0.5524
 epoch: 22, train_loss: 0.7523, test_loss: 0.8493, test_f1: 0.5248
 epoch: 23, train_loss: 0.7556, test_loss: 0.7886, test_f1: 0.5675
 epoch: 24, train_loss: 0.7451, test_loss: 0.8663, test_f1: 0.5331
 epoch: 25, train_loss: 0.7588, test_loss: 0.8733, test_f1: 0.5548
 epoch: 26, train_loss: 0.7343, test_loss: 0.7892, test_f1: 0.5729
 epoch: 27, train_loss: 0.7375, test_loss: 0.7975, test_f1: 0.5667
 epoch: 28, train_loss: 0.7341, test_loss: 0.7989, test_f1: 0.5723
 epoch: 29, train_loss: 0.7292, test_loss: 0.8540, test_f1: 0.5829
 epoch: 30, train_loss: 0.7316, test_loss: 0.8510, test_f1: 0.5745
 epoch: 31, train_loss: 0.7185, test_loss: 0.9195, test_f1: 0.5541
 epoch: 32, train_loss: 0.7156, test_loss: 0.8312, test_f1: 0.5941
 epoch: 33, train_loss: 0.7102, test_loss: 0.8389, test_f1: 0.6013
 epoch: 34, train_loss: 0.7149, test_loss: 0.8139, test_f1: 0.5857
 epoch: 35, train_loss: 0.7223, test_loss: 0.8491, test_f1: 0.5614
 epoch: 36, train_loss: 0.7047, test_loss: 0.8472, test_f1: 0.5670
 epoch: 37, train_loss: 0.7104, test_loss: 0.7744, test_f1: 0.6244
 epoch: 38, train_loss: 0.6914, test_loss: 0.8398, test_f1: 0.5731
 epoch: 39, train_loss: 0.6983, test_loss: 0.8467, test_f1: 0.5714
 epoch: 40, train_loss: 0.6962, test_loss: 0.8403, test_f1: 0.5957
 epoch: 41, train_loss: 0.6825, test_loss: 0.7819, test_f1: 0.6093
 epoch: 42, train_loss: 0.6826, test_loss: 0.9094, test_f1: 0.5683
 epoch: 43, train_loss: 0.6844, test_loss: 0.8460, test_f1: 0.6291
 epoch: 44, train_loss: 0.6694, test_loss: 0.8469, test_f1: 0.6085
 epoch: 45, train_loss: 0.6844, test_loss: 0.9075, test_f1: 0.5742
 epoch: 46, train_loss: 0.6603, test_loss: 0.8519, test_f1: 0.6146
 epoch: 47, train_loss: 0.6678, test_loss: 0.8535, test_f1: 0.6034
 epoch: 48, train_loss: 0.6581, test_loss: 0.7861, test_f1: 0.6185
 epoch: 49, train_loss: 0.6559, test_loss: 0.8821, test_f1: 0.6079
 epoch: 50, train_loss: 0.6587, test_loss: 0.9043, test_f1: 0.6250
 epoch: 51, train_loss: 0.6401, test_loss: 0.8910, test_f1: 0.5968
 epoch: 52, train_loss: 0.6447, test_loss: 0.8312, test_f1: 0.6055
 epoch: 53, train_loss: 0.6308, test_loss: 0.9259, test_f1: 0.6211
 epoch: 54, train_loss: 0.6314, test_loss: 0.8559, test_f1: 0.6193
 epoch: 55, train_loss: 0.6310, test_loss: 0.9131, test_f1: 0.5996
 epoch: 56, train_loss: 0.6201, test_loss: 0.8825, test_f1: 0.6106
 epoch: 57, train_loss: 0.6177, test_loss: 0.8665, test_f1: 0.6001
 epoch: 58, train_loss: 0.6183, test_loss: 0.8421, test_f1: 0.6420
 epoch: 59, train_loss: 0.6234, test_loss: 0.8705, test_f1: 0.6017
 epoch: 60, train_loss: 0.6190, test_loss: 0.8738, test_f1: 0.6178
 epoch: 61, train_loss: 0.6201, test_loss: 0.8597, test_f1: 0.6209
 epoch: 62, train_loss: 0.6131, test_loss: 0.8575, test_f1: 0.6437
 epoch: 63, train_loss: 0.6110, test_loss: 0.9186, test_f1: 0.6248
 epoch: 64, train_loss: 0.6160, test_loss: 0.8888, test_f1: 0.6175
 epoch: 65, train_loss: 0.6144, test_loss: 0.8898, test_f1: 0.6329
 epoch: 66, train_loss: 0.6136, test_loss: 0.8088, test_f1: 0.6329
 epoch: 67, train_loss: 0.6127, test_loss: 0.8899, test_f1: 0.6327
 epoch: 68, train_loss: 0.6134, test_loss: 0.8586, test_f1: 0.6209
 epoch: 69, train_loss: 0.5818, test_loss: 0.8538, test_f1: 0.6045
 epoch: 70, train_loss: 0.6014, test_loss: 0.8657, test_f1: 0.6166
 epoch: 71, train_loss: 0.5882, test_loss: 0.9538, test_f1: 0.6234
 epoch: 72, train_loss: 0.5877, test_loss: 0.8258, test_f1: 0.6318
 epoch: 73, train_loss: 0.6042, test_loss: 0.8509, test_f1: 0.6457
 epoch: 74, train_loss: 0.5927, test_loss: 0.9229, test_f1: 0.6182
 epoch: 75, train_loss: 0.5921, test_loss: 0.9280, test_f1: 0.6247
 epoch: 76, train_loss: 0.5910, test_loss: 0.8329, test_f1: 0.6470
 epoch: 77, train_loss: 0.5962, test_loss: 0.8495, test_f1: 0.6327
 epoch: 78, train_loss: 0.5910, test_loss: 0.9159, test_f1: 0.6326
 epoch: 79, train_loss: 0.5989, test_loss: 0.8667, test_f1: 0.6240
 epoch: 80, train_loss: 0.5891, test_loss: 0.9909, test_f1: 0.6323
 epoch: 81, train_loss: 0.5844, test_loss: 0.8513, test_f1: 0.6216
 epoch: 82, train_loss: 0.5888, test_loss: 0.9053, test_f1: 0.6278
 epoch: 83, train_loss: 0.5984, test_loss: 0.8862, test_f1: 0.6327
 epoch: 84, train_loss: 0.5823, test_loss: 0.8884, test_f1: 0.6344
 epoch: 85, train_loss: 0.5774, test_loss: 0.8893, test_f1: 0.6302
 epoch: 86, train_loss: 0.5707, test_loss: 0.8781, test_f1: 0.6396
 epoch: 87, train_loss: 0.5694, test_loss: 0.9313, test_f1: 0.6321
 epoch: 88, train_loss: 0.5651, test_loss: 0.9752, test_f1: 0.6229
 epoch: 89, train_loss: 0.5825, test_loss: 0.9634, test_f1: 0.6320
 epoch: 90, train_loss: 0.5661, test_loss: 0.8730, test_f1: 0.6426
 epoch: 91, train_loss: 0.5638, test_loss: 0.9678, test_f1: 0.6206
 epoch: 92, train_loss: 0.5875, test_loss: 0.9449, test_f1: 0.6401
 epoch: 93, train_loss: 0.5623, test_loss: 0.9496, test_f1: 0.6260
 epoch: 94, train_loss: 0.5665, test_loss: 0.9368, test_f1: 0.6271
 epoch: 95, train_loss: 0.5701, test_loss: 0.9836, test_f1: 0.6385
 epoch: 96, train_loss: 0.5700, test_loss: 0.8408, test_f1: 0.6418
 epoch: 97, train_loss: 0.5624, test_loss: 0.9871, test_f1: 0.6108
 epoch: 98, train_loss: 0.5750, test_loss: 0.8820, test_f1: 0.6458
 epoch: 99, train_loss: 0.5663, test_loss: 0.9251, test_f1: 0.6350
##################ITERATION #1 ****************************************
 epoch: 0, train_loss: 1.1388, test_loss: 1.0123, test_f1: 0.4425
 epoch: 1, train_loss: 1.0120, test_loss: 1.0041, test_f1: 0.4764
 epoch: 2, train_loss: 0.9706, test_loss: 0.9856, test_f1: 0.4811
 epoch: 3, train_loss: 0.9552, test_loss: 0.9338, test_f1: 0.5011
 epoch: 4, train_loss: 0.9375, test_loss: 0.9487, test_f1: 0.5060
 epoch: 5, train_loss: 0.9189, test_loss: 0.8900, test_f1: 0.5226
 epoch: 6, train_loss: 0.9058, test_loss: 0.8883, test_f1: 0.5412
 epoch: 7, train_loss: 0.9007, test_loss: 0.8696, test_f1: 0.5399
 epoch: 8, train_loss: 0.8906, test_loss: 0.8478, test_f1: 0.5232
 epoch: 9, train_loss: 0.8750, test_loss: 0.8432, test_f1: 0.5465
 epoch: 10, train_loss: 0.8730, test_loss: 0.8262, test_f1: 0.5591
 epoch: 11, train_loss: 0.8648, test_loss: 0.8862, test_f1: 0.5220
 epoch: 12, train_loss: 0.8716, test_loss: 0.8704, test_f1: 0.5463
 epoch: 13, train_loss: 0.8534, test_loss: 0.8166, test_f1: 0.5622
 epoch: 14, train_loss: 0.8402, test_loss: 0.8449, test_f1: 0.5499
 epoch: 15, train_loss: 0.8227, test_loss: 0.8007, test_f1: 0.5473
 epoch: 16, train_loss: 0.8275, test_loss: 0.8429, test_f1: 0.5537
 epoch: 17, train_loss: 0.8010, test_loss: 0.8288, test_f1: 0.5505
 epoch: 18, train_loss: 0.8204, test_loss: 0.8266, test_f1: 0.5719
 epoch: 19, train_loss: 0.8019, test_loss: 0.8574, test_f1: 0.5321
 epoch: 20, train_loss: 0.7935, test_loss: 0.8541, test_f1: 0.5264
 epoch: 21, train_loss: 0.7975, test_loss: 0.9362, test_f1: 0.5300
 epoch: 22, train_loss: 0.7900, test_loss: 0.7545, test_f1: 0.6034
 epoch: 23, train_loss: 0.7850, test_loss: 0.7711, test_f1: 0.5809
 epoch: 24, train_loss: 0.7757, test_loss: 0.7998, test_f1: 0.6009
 epoch: 25, train_loss: 0.7668, test_loss: 0.7871, test_f1: 0.6097
 epoch: 26, train_loss: 0.7732, test_loss: 0.7773, test_f1: 0.5647
 epoch: 27, train_loss: 0.7488, test_loss: 0.7578, test_f1: 0.5769
 epoch: 28, train_loss: 0.7446, test_loss: 0.7485, test_f1: 0.6377
 epoch: 29, train_loss: 0.7508, test_loss: 0.7700, test_f1: 0.6329
 epoch: 30, train_loss: 0.7361, test_loss: 0.7799, test_f1: 0.6042
 epoch: 31, train_loss: 0.7381, test_loss: 0.7667, test_f1: 0.5916
 epoch: 32, train_loss: 0.7310, test_loss: 0.7427, test_f1: 0.6089
 epoch: 33, train_loss: 0.7391, test_loss: 0.7704, test_f1: 0.6148
 epoch: 34, train_loss: 0.7140, test_loss: 0.7895, test_f1: 0.5930
 epoch: 35, train_loss: 0.7166, test_loss: 0.7858, test_f1: 0.5691
 epoch: 36, train_loss: 0.7222, test_loss: 0.7728, test_f1: 0.6162
 epoch: 37, train_loss: 0.7072, test_loss: 0.8260, test_f1: 0.5917
 epoch: 38, train_loss: 0.7091, test_loss: 0.8599, test_f1: 0.5709
 epoch: 39, train_loss: 0.6979, test_loss: 0.7423, test_f1: 0.6354
 epoch: 40, train_loss: 0.6972, test_loss: 0.7679, test_f1: 0.6467
 epoch: 41, train_loss: 0.7031, test_loss: 0.7660, test_f1: 0.6263
 epoch: 42, train_loss: 0.6892, test_loss: 0.7939, test_f1: 0.6199
 epoch: 43, train_loss: 0.6983, test_loss: 0.7995, test_f1: 0.5900
 epoch: 44, train_loss: 0.6935, test_loss: 0.7795, test_f1: 0.6205
 epoch: 45, train_loss: 0.6781, test_loss: 0.7688, test_f1: 0.6205
 epoch: 46, train_loss: 0.6924, test_loss: 0.7798, test_f1: 0.6114
 epoch: 47, train_loss: 0.6784, test_loss: 0.7782, test_f1: 0.6401
 epoch: 48, train_loss: 0.6717, test_loss: 0.7899, test_f1: 0.6200
 epoch: 49, train_loss: 0.6927, test_loss: 0.7744, test_f1: 0.6258
 epoch: 50, train_loss: 0.6589, test_loss: 0.7954, test_f1: 0.6285
 epoch: 51, train_loss: 0.6383, test_loss: 0.7935, test_f1: 0.6411
 epoch: 52, train_loss: 0.6479, test_loss: 0.7677, test_f1: 0.6293
 epoch: 53, train_loss: 0.6427, test_loss: 0.8393, test_f1: 0.6349
 epoch: 54, train_loss: 0.6274, test_loss: 0.8133, test_f1: 0.6343
 epoch: 55, train_loss: 0.6301, test_loss: 0.8154, test_f1: 0.5987
 epoch: 56, train_loss: 0.6270, test_loss: 0.7779, test_f1: 0.6264
 epoch: 57, train_loss: 0.6258, test_loss: 0.7950, test_f1: 0.6268
 epoch: 58, train_loss: 0.6231, test_loss: 0.7827, test_f1: 0.6070
 epoch: 59, train_loss: 0.6257, test_loss: 0.8126, test_f1: 0.6109
 epoch: 60, train_loss: 0.6116, test_loss: 0.7947, test_f1: 0.6317
 epoch: 61, train_loss: 0.6144, test_loss: 0.8204, test_f1: 0.6216
 epoch: 62, train_loss: 0.6239, test_loss: 0.8056, test_f1: 0.6290
 epoch: 63, train_loss: 0.6046, test_loss: 0.7890, test_f1: 0.6398
 epoch: 64, train_loss: 0.6153, test_loss: 0.7796, test_f1: 0.6280
 epoch: 65, train_loss: 0.6162, test_loss: 0.8203, test_f1: 0.6078
 epoch: 66, train_loss: 0.6152, test_loss: 0.8071, test_f1: 0.6212
 epoch: 67, train_loss: 0.6064, test_loss: 0.8114, test_f1: 0.6175
 epoch: 68, train_loss: 0.6045, test_loss: 0.7712, test_f1: 0.6502
 epoch: 69, train_loss: 0.5915, test_loss: 0.8247, test_f1: 0.6180
 epoch: 70, train_loss: 0.5998, test_loss: 0.8255, test_f1: 0.6326
 epoch: 71, train_loss: 0.5787, test_loss: 0.8308, test_f1: 0.6330
 epoch: 72, train_loss: 0.5850, test_loss: 0.7904, test_f1: 0.6380
 epoch: 73, train_loss: 0.6016, test_loss: 0.8377, test_f1: 0.6151
 epoch: 74, train_loss: 0.5869, test_loss: 0.8421, test_f1: 0.6434
 epoch: 75, train_loss: 0.5890, test_loss: 0.8247, test_f1: 0.6404
 epoch: 76, train_loss: 0.5814, test_loss: 0.8150, test_f1: 0.6374
 epoch: 77, train_loss: 0.5849, test_loss: 0.8477, test_f1: 0.6216
 epoch: 78, train_loss: 0.5788, test_loss: 0.8211, test_f1: 0.6242
 epoch: 79, train_loss: 0.5730, test_loss: 0.8136, test_f1: 0.6299
 epoch: 80, train_loss: 0.5807, test_loss: 0.7894, test_f1: 0.6433
 epoch: 81, train_loss: 0.5804, test_loss: 0.8347, test_f1: 0.6216
 epoch: 82, train_loss: 0.5771, test_loss: 0.7970, test_f1: 0.6446
 epoch: 83, train_loss: 0.5651, test_loss: 0.8293, test_f1: 0.6101
 epoch: 84, train_loss: 0.5888, test_loss: 0.8360, test_f1: 0.6189
 epoch: 85, train_loss: 0.5594, test_loss: 0.8724, test_f1: 0.6219
 epoch: 86, train_loss: 0.5556, test_loss: 0.8449, test_f1: 0.6232
 epoch: 87, train_loss: 0.5762, test_loss: 0.8459, test_f1: 0.6184
 epoch: 88, train_loss: 0.5626, test_loss: 0.8271, test_f1: 0.6231
 epoch: 89, train_loss: 0.5841, test_loss: 0.8017, test_f1: 0.6514
 epoch: 90, train_loss: 0.5627, test_loss: 0.8670, test_f1: 0.6045
 epoch: 91, train_loss: 0.5668, test_loss: 0.8226, test_f1: 0.6442
 epoch: 92, train_loss: 0.5573, test_loss: 0.8410, test_f1: 0.6308
 epoch: 93, train_loss: 0.5596, test_loss: 0.8389, test_f1: 0.6256
 epoch: 94, train_loss: 0.5540, test_loss: 0.7914, test_f1: 0.6471
 epoch: 95, train_loss: 0.5705, test_loss: 0.7942, test_f1: 0.6548
 epoch: 96, train_loss: 0.5506, test_loss: 0.8717, test_f1: 0.6064
 epoch: 97, train_loss: 0.5743, test_loss: 0.8378, test_f1: 0.6043
 epoch: 98, train_loss: 0.5527, test_loss: 0.8918, test_f1: 0.6029
 epoch: 99, train_loss: 0.5557, test_loss: 0.8595, test_f1: 0.6261
##################ITERATION #2 ****************************************
 epoch: 0, train_loss: 1.1136, test_loss: 1.0391, test_f1: 0.3740
 epoch: 1, train_loss: 0.9990, test_loss: 1.0000, test_f1: 0.4718
 epoch: 2, train_loss: 0.9715, test_loss: 0.9763, test_f1: 0.5162
 epoch: 3, train_loss: 0.9438, test_loss: 0.9608, test_f1: 0.5217
 epoch: 4, train_loss: 0.9303, test_loss: 0.9469, test_f1: 0.5247
 epoch: 5, train_loss: 0.9224, test_loss: 0.9847, test_f1: 0.5068
 epoch: 6, train_loss: 0.9069, test_loss: 0.9662, test_f1: 0.4741
 epoch: 7, train_loss: 0.8899, test_loss: 0.9312, test_f1: 0.5171
 epoch: 8, train_loss: 0.8798, test_loss: 0.9261, test_f1: 0.5256
 epoch: 9, train_loss: 0.8814, test_loss: 0.9846, test_f1: 0.4871
 epoch: 10, train_loss: 0.8707, test_loss: 0.9974, test_f1: 0.5230
 epoch: 11, train_loss: 0.8642, test_loss: 0.9447, test_f1: 0.5259
 epoch: 12, train_loss: 0.8591, test_loss: 0.9084, test_f1: 0.5259
 epoch: 13, train_loss: 0.8526, test_loss: 0.8802, test_f1: 0.5466
 epoch: 14, train_loss: 0.8285, test_loss: 0.9401, test_f1: 0.5127
 epoch: 15, train_loss: 0.8476, test_loss: 0.9417, test_f1: 0.5255
 epoch: 16, train_loss: 0.8324, test_loss: 0.9843, test_f1: 0.4902
 epoch: 17, train_loss: 0.8194, test_loss: 0.8815, test_f1: 0.5465
 epoch: 18, train_loss: 0.8144, test_loss: 0.8934, test_f1: 0.5588
 epoch: 19, train_loss: 0.8092, test_loss: 0.8813, test_f1: 0.5405
 epoch: 20, train_loss: 0.8116, test_loss: 0.9096, test_f1: 0.5878
 epoch: 21, train_loss: 0.7980, test_loss: 0.9649, test_f1: 0.4918
 epoch: 22, train_loss: 0.7986, test_loss: 0.8663, test_f1: 0.5553
 epoch: 23, train_loss: 0.7899, test_loss: 0.8731, test_f1: 0.5307
 epoch: 24, train_loss: 0.7937, test_loss: 0.8905, test_f1: 0.5581
 epoch: 25, train_loss: 0.7796, test_loss: 0.9381, test_f1: 0.5158
 epoch: 26, train_loss: 0.7727, test_loss: 1.0109, test_f1: 0.5167
 epoch: 27, train_loss: 0.7726, test_loss: 0.8546, test_f1: 0.5864
 epoch: 28, train_loss: 0.7562, test_loss: 0.8628, test_f1: 0.5721
 epoch: 29, train_loss: 0.7684, test_loss: 0.8651, test_f1: 0.5670
 epoch: 30, train_loss: 0.7537, test_loss: 0.8172, test_f1: 0.6084
 epoch: 31, train_loss: 0.7463, test_loss: 0.8642, test_f1: 0.5730
 epoch: 32, train_loss: 0.7532, test_loss: 0.8038, test_f1: 0.6001
 epoch: 33, train_loss: 0.7385, test_loss: 0.8360, test_f1: 0.6015
 epoch: 34, train_loss: 0.7322, test_loss: 0.8549, test_f1: 0.6011
 epoch: 35, train_loss: 0.7364, test_loss: 0.8398, test_f1: 0.6003
 epoch: 36, train_loss: 0.7223, test_loss: 0.8157, test_f1: 0.6138
 epoch: 37, train_loss: 0.7490, test_loss: 0.8417, test_f1: 0.5945
 epoch: 38, train_loss: 0.7300, test_loss: 0.8879, test_f1: 0.6135
 epoch: 39, train_loss: 0.7203, test_loss: 0.9080, test_f1: 0.5535
 epoch: 40, train_loss: 0.7437, test_loss: 0.8277, test_f1: 0.6317
 epoch: 41, train_loss: 0.7157, test_loss: 0.8608, test_f1: 0.6132
 epoch: 42, train_loss: 0.7099, test_loss: 0.8874, test_f1: 0.5960
 epoch: 43, train_loss: 0.7129, test_loss: 0.8699, test_f1: 0.6012
 epoch: 44, train_loss: 0.7067, test_loss: 0.8056, test_f1: 0.6135
 epoch: 45, train_loss: 0.6996, test_loss: 0.8371, test_f1: 0.6112
 epoch: 46, train_loss: 0.7080, test_loss: 0.8491, test_f1: 0.6294
 epoch: 47, train_loss: 0.7007, test_loss: 0.9224, test_f1: 0.5780
 epoch: 48, train_loss: 0.6980, test_loss: 0.8473, test_f1: 0.6124
 epoch: 49, train_loss: 0.6775, test_loss: 0.8858, test_f1: 0.6070
 epoch: 50, train_loss: 0.7053, test_loss: 0.9839, test_f1: 0.5510
 epoch: 51, train_loss: 0.6704, test_loss: 0.8628, test_f1: 0.6007
 epoch: 52, train_loss: 0.6664, test_loss: 0.8296, test_f1: 0.6312
 epoch: 53, train_loss: 0.6628, test_loss: 0.8920, test_f1: 0.5836
 epoch: 54, train_loss: 0.6596, test_loss: 0.8416, test_f1: 0.6286
 epoch: 55, train_loss: 0.6589, test_loss: 0.8433, test_f1: 0.6283
 epoch: 56, train_loss: 0.6577, test_loss: 0.8801, test_f1: 0.5938
 epoch: 57, train_loss: 0.6539, test_loss: 0.8497, test_f1: 0.6111
 epoch: 58, train_loss: 0.6454, test_loss: 0.8222, test_f1: 0.6582
 epoch: 59, train_loss: 0.6546, test_loss: 0.8571, test_f1: 0.6417
 epoch: 60, train_loss: 0.6319, test_loss: 0.8435, test_f1: 0.6331
 epoch: 61, train_loss: 0.6438, test_loss: 0.8761, test_f1: 0.6144
 epoch: 62, train_loss: 0.6481, test_loss: 0.9273, test_f1: 0.6026
 epoch: 63, train_loss: 0.6336, test_loss: 0.8989, test_f1: 0.6146
 epoch: 64, train_loss: 0.6372, test_loss: 0.8381, test_f1: 0.6629
 epoch: 65, train_loss: 0.6425, test_loss: 0.8519, test_f1: 0.6448
 epoch: 66, train_loss: 0.6337, test_loss: 0.8924, test_f1: 0.6058
 epoch: 67, train_loss: 0.6178, test_loss: 0.8633, test_f1: 0.6330
 epoch: 68, train_loss: 0.6267, test_loss: 0.8654, test_f1: 0.6338
 epoch: 69, train_loss: 0.6396, test_loss: 0.8856, test_f1: 0.6265
 epoch: 70, train_loss: 0.6173, test_loss: 0.9080, test_f1: 0.6171
 epoch: 71, train_loss: 0.6171, test_loss: 0.8853, test_f1: 0.6394
 epoch: 72, train_loss: 0.6271, test_loss: 0.8813, test_f1: 0.6315
 epoch: 73, train_loss: 0.6142, test_loss: 0.9235, test_f1: 0.6149
 epoch: 74, train_loss: 0.6054, test_loss: 0.9162, test_f1: 0.6280
 epoch: 75, train_loss: 0.6176, test_loss: 0.9401, test_f1: 0.6081
 epoch: 76, train_loss: 0.6189, test_loss: 0.8722, test_f1: 0.6130
 epoch: 77, train_loss: 0.6348, test_loss: 0.9047, test_f1: 0.6072
 epoch: 78, train_loss: 0.6118, test_loss: 0.9269, test_f1: 0.6215
 epoch: 79, train_loss: 0.6140, test_loss: 0.9144, test_f1: 0.6255
 epoch: 80, train_loss: 0.6174, test_loss: 0.8951, test_f1: 0.6329
 epoch: 81, train_loss: 0.6059, test_loss: 0.8862, test_f1: 0.6361
 epoch: 82, train_loss: 0.6084, test_loss: 0.8775, test_f1: 0.6611
 epoch: 83, train_loss: 0.5987, test_loss: 0.9094, test_f1: 0.6348
 epoch: 84, train_loss: 0.5976, test_loss: 0.8905, test_f1: 0.6440
 epoch: 85, train_loss: 0.5973, test_loss: 0.8714, test_f1: 0.6492
 epoch: 86, train_loss: 0.6023, test_loss: 0.9062, test_f1: 0.6221
 epoch: 87, train_loss: 0.6105, test_loss: 0.9126, test_f1: 0.6170
 epoch: 88, train_loss: 0.6056, test_loss: 0.8552, test_f1: 0.6478
 epoch: 89, train_loss: 0.5944, test_loss: 0.8858, test_f1: 0.6243
 epoch: 90, train_loss: 0.5923, test_loss: 0.9142, test_f1: 0.6361
 epoch: 91, train_loss: 0.6011, test_loss: 0.9047, test_f1: 0.6202
 epoch: 92, train_loss: 0.5968, test_loss: 0.8826, test_f1: 0.6378
 epoch: 93, train_loss: 0.5913, test_loss: 0.8854, test_f1: 0.6423
 epoch: 94, train_loss: 0.5931, test_loss: 0.8921, test_f1: 0.6349
 epoch: 95, train_loss: 0.5795, test_loss: 0.8762, test_f1: 0.6337
 epoch: 96, train_loss: 0.5809, test_loss: 0.9106, test_f1: 0.6476
 epoch: 97, train_loss: 0.5901, test_loss: 0.9275, test_f1: 0.6187
 epoch: 98, train_loss: 0.5928, test_loss: 0.8726, test_f1: 0.6374
 epoch: 99, train_loss: 0.5742, test_loss: 0.9176, test_f1: 0.6219
##################ITERATION #3 ****************************************
 epoch: 0, train_loss: 1.1639, test_loss: 1.0169, test_f1: 0.4789
 epoch: 1, train_loss: 1.0380, test_loss: 0.9988, test_f1: 0.5234
 epoch: 2, train_loss: 0.9938, test_loss: 0.9781, test_f1: 0.5078
 epoch: 3, train_loss: 0.9804, test_loss: 0.9739, test_f1: 0.5191
 epoch: 4, train_loss: 0.9527, test_loss: 1.0536, test_f1: 0.4926
 epoch: 5, train_loss: 0.9415, test_loss: 0.9050, test_f1: 0.5209
 epoch: 6, train_loss: 0.9224, test_loss: 0.9686, test_f1: 0.5012
 epoch: 7, train_loss: 0.9034, test_loss: 0.9587, test_f1: 0.5328
 epoch: 8, train_loss: 0.8889, test_loss: 0.9634, test_f1: 0.5228
 epoch: 9, train_loss: 0.8672, test_loss: 0.8838, test_f1: 0.5282
 epoch: 10, train_loss: 0.8755, test_loss: 0.9229, test_f1: 0.5722
 epoch: 11, train_loss: 0.8492, test_loss: 0.9162, test_f1: 0.5615
 epoch: 12, train_loss: 0.8426, test_loss: 1.0134, test_f1: 0.4996
 epoch: 13, train_loss: 0.8400, test_loss: 0.8640, test_f1: 0.5583
 epoch: 14, train_loss: 0.8302, test_loss: 0.8169, test_f1: 0.5896
 epoch: 15, train_loss: 0.8251, test_loss: 0.8294, test_f1: 0.5865
 epoch: 16, train_loss: 0.8108, test_loss: 0.8760, test_f1: 0.5528
 epoch: 17, train_loss: 0.8026, test_loss: 0.8563, test_f1: 0.5532
 epoch: 18, train_loss: 0.8057, test_loss: 0.9032, test_f1: 0.5749
 epoch: 19, train_loss: 0.7906, test_loss: 0.8278, test_f1: 0.5930
 epoch: 20, train_loss: 0.7953, test_loss: 0.8186, test_f1: 0.5738
 epoch: 21, train_loss: 0.7869, test_loss: 0.8115, test_f1: 0.6148
 epoch: 22, train_loss: 0.7952, test_loss: 0.8204, test_f1: 0.5839
 epoch: 23, train_loss: 0.7750, test_loss: 0.8411, test_f1: 0.5747
 epoch: 24, train_loss: 0.7815, test_loss: 0.8592, test_f1: 0.5905
 epoch: 25, train_loss: 0.7739, test_loss: 0.8078, test_f1: 0.6275
 epoch: 26, train_loss: 0.7675, test_loss: 0.8607, test_f1: 0.5684
 epoch: 27, train_loss: 0.7541, test_loss: 0.8897, test_f1: 0.5918
 epoch: 28, train_loss: 0.7560, test_loss: 0.8420, test_f1: 0.5731
 epoch: 29, train_loss: 0.7491, test_loss: 0.7891, test_f1: 0.5965
 epoch: 30, train_loss: 0.7417, test_loss: 0.8383, test_f1: 0.6062
 epoch: 31, train_loss: 0.7442, test_loss: 0.8126, test_f1: 0.5847
 epoch: 32, train_loss: 0.7525, test_loss: 0.8571, test_f1: 0.5932
 epoch: 33, train_loss: 0.7289, test_loss: 0.7454, test_f1: 0.6350
 epoch: 34, train_loss: 0.7419, test_loss: 0.7426, test_f1: 0.6138
 epoch: 35, train_loss: 0.7203, test_loss: 0.7431, test_f1: 0.6087
 epoch: 36, train_loss: 0.7358, test_loss: 0.8234, test_f1: 0.6002
 epoch: 37, train_loss: 0.7238, test_loss: 0.9281, test_f1: 0.5661
 epoch: 38, train_loss: 0.7169, test_loss: 0.7968, test_f1: 0.6220
 epoch: 39, train_loss: 0.7337, test_loss: 0.8378, test_f1: 0.5922
 epoch: 40, train_loss: 0.7136, test_loss: 0.8887, test_f1: 0.5649
 epoch: 41, train_loss: 0.7068, test_loss: 0.8558, test_f1: 0.5799
 epoch: 42, train_loss: 0.7183, test_loss: 0.8037, test_f1: 0.6198
 epoch: 43, train_loss: 0.7095, test_loss: 0.8531, test_f1: 0.6142
 epoch: 44, train_loss: 0.7069, test_loss: 0.8835, test_f1: 0.6105
 epoch: 45, train_loss: 0.7107, test_loss: 0.8785, test_f1: 0.6047
 epoch: 46, train_loss: 0.6888, test_loss: 0.8607, test_f1: 0.5845
 epoch: 47, train_loss: 0.6937, test_loss: 0.8177, test_f1: 0.5856
 epoch: 48, train_loss: 0.6975, test_loss: 0.8165, test_f1: 0.5976
 epoch: 49, train_loss: 0.6866, test_loss: 0.8049, test_f1: 0.5859
 epoch: 50, train_loss: 0.6829, test_loss: 0.8204, test_f1: 0.6142
 epoch: 51, train_loss: 0.6780, test_loss: 0.7949, test_f1: 0.6507
 epoch: 52, train_loss: 0.6596, test_loss: 0.7302, test_f1: 0.6468
 epoch: 53, train_loss: 0.6586, test_loss: 0.8281, test_f1: 0.6267
 epoch: 54, train_loss: 0.6579, test_loss: 0.7702, test_f1: 0.6527
 epoch: 55, train_loss: 0.6500, test_loss: 0.8604, test_f1: 0.6313
 epoch: 56, train_loss: 0.6624, test_loss: 0.8323, test_f1: 0.6264
 epoch: 57, train_loss: 0.6453, test_loss: 0.7860, test_f1: 0.6150
 epoch: 58, train_loss: 0.6492, test_loss: 0.7416, test_f1: 0.6463
 epoch: 59, train_loss: 0.6542, test_loss: 0.7229, test_f1: 0.6458
 epoch: 60, train_loss: 0.6416, test_loss: 0.7536, test_f1: 0.6375
 epoch: 61, train_loss: 0.6340, test_loss: 0.7300, test_f1: 0.6616
 epoch: 62, train_loss: 0.6395, test_loss: 0.7645, test_f1: 0.6283
 epoch: 63, train_loss: 0.6384, test_loss: 0.7360, test_f1: 0.6416
 epoch: 64, train_loss: 0.6432, test_loss: 0.7437, test_f1: 0.6394
 epoch: 65, train_loss: 0.6329, test_loss: 0.7451, test_f1: 0.6549
 epoch: 66, train_loss: 0.6286, test_loss: 0.8292, test_f1: 0.6412
 epoch: 67, train_loss: 0.6237, test_loss: 0.8100, test_f1: 0.6328
 epoch: 68, train_loss: 0.6242, test_loss: 0.7175, test_f1: 0.6686
 epoch: 69, train_loss: 0.6318, test_loss: 0.7253, test_f1: 0.6494
 epoch: 70, train_loss: 0.6234, test_loss: 0.7042, test_f1: 0.6737
 epoch: 71, train_loss: 0.6162, test_loss: 0.8488, test_f1: 0.6266
 epoch: 72, train_loss: 0.6173, test_loss: 0.7985, test_f1: 0.6364
 epoch: 73, train_loss: 0.6342, test_loss: 0.8423, test_f1: 0.6438
 epoch: 74, train_loss: 0.6236, test_loss: 0.8072, test_f1: 0.6275
 epoch: 75, train_loss: 0.6204, test_loss: 0.7580, test_f1: 0.6399
 epoch: 76, train_loss: 0.6219, test_loss: 0.7761, test_f1: 0.6348
 epoch: 77, train_loss: 0.6160, test_loss: 0.8619, test_f1: 0.6264
 epoch: 78, train_loss: 0.6100, test_loss: 0.8621, test_f1: 0.6289
 epoch: 79, train_loss: 0.6070, test_loss: 0.8977, test_f1: 0.6309
 epoch: 80, train_loss: 0.6098, test_loss: 0.8716, test_f1: 0.6218
 epoch: 81, train_loss: 0.6077, test_loss: 0.7437, test_f1: 0.6449
 epoch: 82, train_loss: 0.6044, test_loss: 0.8381, test_f1: 0.6393
 epoch: 83, train_loss: 0.6193, test_loss: 0.8192, test_f1: 0.6280
 epoch: 84, train_loss: 0.6041, test_loss: 0.8640, test_f1: 0.6371
 epoch: 85, train_loss: 0.6118, test_loss: 0.7479, test_f1: 0.6560
 epoch: 86, train_loss: 0.6075, test_loss: 0.7839, test_f1: 0.6503
 epoch: 87, train_loss: 0.6091, test_loss: 0.8161, test_f1: 0.6411
 epoch: 88, train_loss: 0.6128, test_loss: 0.7331, test_f1: 0.6528
 epoch: 89, train_loss: 0.6050, test_loss: 0.7779, test_f1: 0.6419
 epoch: 90, train_loss: 0.6013, test_loss: 0.8511, test_f1: 0.6363
 epoch: 91, train_loss: 0.5985, test_loss: 0.7812, test_f1: 0.6545
 epoch: 92, train_loss: 0.5805, test_loss: 0.8480, test_f1: 0.6434
 epoch: 93, train_loss: 0.5942, test_loss: 0.7944, test_f1: 0.6617
 epoch: 94, train_loss: 0.5845, test_loss: 0.7465, test_f1: 0.6521
 epoch: 95, train_loss: 0.5787, test_loss: 0.7672, test_f1: 0.6649
 epoch: 96, train_loss: 0.5924, test_loss: 0.7445, test_f1: 0.6673
 epoch: 97, train_loss: 0.6031, test_loss: 0.8270, test_f1: 0.6568
 epoch: 98, train_loss: 0.5852, test_loss: 0.8646, test_f1: 0.6387
 epoch: 99, train_loss: 0.5992, test_loss: 0.7229, test_f1: 0.6593
##################ITERATION #4 ****************************************
 epoch: 0, train_loss: 1.1544, test_loss: 0.9713, test_f1: 0.5239
 epoch: 1, train_loss: 1.0113, test_loss: 0.9600, test_f1: 0.4898
 epoch: 2, train_loss: 0.9836, test_loss: 0.9667, test_f1: 0.5162
 epoch: 3, train_loss: 0.9680, test_loss: 0.9177, test_f1: 0.5411
 epoch: 4, train_loss: 0.9413, test_loss: 0.8728, test_f1: 0.5536
 epoch: 5, train_loss: 0.9382, test_loss: 0.9767, test_f1: 0.5110
 epoch: 6, train_loss: 0.9209, test_loss: 0.9179, test_f1: 0.5308
 epoch: 7, train_loss: 0.9064, test_loss: 0.9674, test_f1: 0.5172
 epoch: 8, train_loss: 0.9051, test_loss: 0.8972, test_f1: 0.5540
 epoch: 9, train_loss: 0.8808, test_loss: 0.8652, test_f1: 0.5696
 epoch: 10, train_loss: 0.8835, test_loss: 0.8704, test_f1: 0.5625
 epoch: 11, train_loss: 0.8680, test_loss: 0.9161, test_f1: 0.5300
 epoch: 12, train_loss: 0.8612, test_loss: 0.8434, test_f1: 0.5598
 epoch: 13, train_loss: 0.8570, test_loss: 0.8517, test_f1: 0.5965
 epoch: 14, train_loss: 0.8506, test_loss: 0.8878, test_f1: 0.5633
 epoch: 15, train_loss: 0.8365, test_loss: 0.8769, test_f1: 0.5549
 epoch: 16, train_loss: 0.8350, test_loss: 0.8686, test_f1: 0.5834
 epoch: 17, train_loss: 0.8182, test_loss: 0.8601, test_f1: 0.5620
 epoch: 18, train_loss: 0.8288, test_loss: 0.8360, test_f1: 0.5801
 epoch: 19, train_loss: 0.8216, test_loss: 0.8564, test_f1: 0.5575
 epoch: 20, train_loss: 0.8123, test_loss: 0.8639, test_f1: 0.5650
 epoch: 21, train_loss: 0.7869, test_loss: 0.8559, test_f1: 0.5530
 epoch: 22, train_loss: 0.7914, test_loss: 0.8416, test_f1: 0.5634
 epoch: 23, train_loss: 0.7983, test_loss: 0.9066, test_f1: 0.5425
 epoch: 24, train_loss: 0.7758, test_loss: 0.8942, test_f1: 0.5498
 epoch: 25, train_loss: 0.7824, test_loss: 0.8514, test_f1: 0.5483
 epoch: 26, train_loss: 0.7735, test_loss: 0.8643, test_f1: 0.5417
 epoch: 27, train_loss: 0.7728, test_loss: 0.8765, test_f1: 0.5787
 epoch: 28, train_loss: 0.7739, test_loss: 0.8741, test_f1: 0.5602
 epoch: 29, train_loss: 0.7712, test_loss: 0.8745, test_f1: 0.5565
 epoch: 30, train_loss: 0.7514, test_loss: 0.8623, test_f1: 0.5600
 epoch: 31, train_loss: 0.7519, test_loss: 0.8565, test_f1: 0.5768
 epoch: 32, train_loss: 0.7490, test_loss: 0.8870, test_f1: 0.5518
 epoch: 33, train_loss: 0.7494, test_loss: 0.8475, test_f1: 0.5775
 epoch: 34, train_loss: 0.7408, test_loss: 0.7879, test_f1: 0.6046
 epoch: 35, train_loss: 0.7429, test_loss: 0.8529, test_f1: 0.5560
 epoch: 36, train_loss: 0.7505, test_loss: 0.8240, test_f1: 0.5976
 epoch: 37, train_loss: 0.7456, test_loss: 0.8348, test_f1: 0.5866
 epoch: 38, train_loss: 0.7315, test_loss: 0.8573, test_f1: 0.5507
 epoch: 39, train_loss: 0.7346, test_loss: 0.7976, test_f1: 0.6232
 epoch: 40, train_loss: 0.7247, test_loss: 0.8544, test_f1: 0.5859
 epoch: 41, train_loss: 0.7148, test_loss: 0.8811, test_f1: 0.6059
 epoch: 42, train_loss: 0.7321, test_loss: 0.9629, test_f1: 0.5855
 epoch: 43, train_loss: 0.7263, test_loss: 0.7896, test_f1: 0.6092
 epoch: 44, train_loss: 0.7183, test_loss: 0.8153, test_f1: 0.5817
 epoch: 45, train_loss: 0.7090, test_loss: 0.8060, test_f1: 0.6336
 epoch: 46, train_loss: 0.7134, test_loss: 0.8139, test_f1: 0.6085
 epoch: 47, train_loss: 0.6971, test_loss: 0.8131, test_f1: 0.6115
 epoch: 48, train_loss: 0.6969, test_loss: 0.8155, test_f1: 0.6406
 epoch: 49, train_loss: 0.7093, test_loss: 0.8004, test_f1: 0.6229
 epoch: 50, train_loss: 0.7013, test_loss: 0.8721, test_f1: 0.5944
 epoch: 51, train_loss: 0.6856, test_loss: 0.8144, test_f1: 0.6331
 epoch: 52, train_loss: 0.6653, test_loss: 0.8700, test_f1: 0.6224
 epoch: 53, train_loss: 0.6602, test_loss: 0.7905, test_f1: 0.6306
 epoch: 54, train_loss: 0.6537, test_loss: 0.8072, test_f1: 0.6081
 epoch: 55, train_loss: 0.6683, test_loss: 0.8143, test_f1: 0.6398
 epoch: 56, train_loss: 0.6554, test_loss: 0.8153, test_f1: 0.6300
 epoch: 57, train_loss: 0.6632, test_loss: 0.8448, test_f1: 0.6068
 epoch: 58, train_loss: 0.6482, test_loss: 0.8059, test_f1: 0.5997
 epoch: 59, train_loss: 0.6505, test_loss: 0.8248, test_f1: 0.6410
 epoch: 60, train_loss: 0.6366, test_loss: 0.7932, test_f1: 0.6278
 epoch: 61, train_loss: 0.6532, test_loss: 0.7735, test_f1: 0.6401
 epoch: 62, train_loss: 0.6641, test_loss: 0.7769, test_f1: 0.6131
 epoch: 63, train_loss: 0.6552, test_loss: 0.7899, test_f1: 0.6515
 epoch: 64, train_loss: 0.6472, test_loss: 0.7970, test_f1: 0.6322
 epoch: 65, train_loss: 0.6400, test_loss: 0.7968, test_f1: 0.6490
 epoch: 66, train_loss: 0.6488, test_loss: 0.7962, test_f1: 0.6176
 epoch: 67, train_loss: 0.6433, test_loss: 0.8056, test_f1: 0.6330
 epoch: 68, train_loss: 0.6470, test_loss: 0.7928, test_f1: 0.6246
 epoch: 69, train_loss: 0.6402, test_loss: 0.8525, test_f1: 0.6160
 epoch: 70, train_loss: 0.6328, test_loss: 0.8271, test_f1: 0.6369
 epoch: 71, train_loss: 0.6373, test_loss: 0.7888, test_f1: 0.6523
 epoch: 72, train_loss: 0.6310, test_loss: 0.7832, test_f1: 0.6189
 epoch: 73, train_loss: 0.6344, test_loss: 0.7846, test_f1: 0.6333
 epoch: 74, train_loss: 0.6290, test_loss: 0.7745, test_f1: 0.6500
 epoch: 75, train_loss: 0.6256, test_loss: 0.7974, test_f1: 0.6343
 epoch: 76, train_loss: 0.6247, test_loss: 0.7896, test_f1: 0.5999
 epoch: 77, train_loss: 0.6215, test_loss: 0.8134, test_f1: 0.6374
 epoch: 78, train_loss: 0.6216, test_loss: 0.8411, test_f1: 0.6193
 epoch: 79, train_loss: 0.6215, test_loss: 0.7940, test_f1: 0.6267
 epoch: 80, train_loss: 0.6194, test_loss: 0.7935, test_f1: 0.6261
 epoch: 81, train_loss: 0.6159, test_loss: 0.8383, test_f1: 0.6123
 epoch: 82, train_loss: 0.6234, test_loss: 0.8161, test_f1: 0.6274
 epoch: 83, train_loss: 0.6165, test_loss: 0.7973, test_f1: 0.6073
 epoch: 84, train_loss: 0.6091, test_loss: 0.7978, test_f1: 0.6506
 epoch: 85, train_loss: 0.6107, test_loss: 0.7969, test_f1: 0.6304
 epoch: 86, train_loss: 0.6029, test_loss: 0.8343, test_f1: 0.6161
 epoch: 87, train_loss: 0.6092, test_loss: 0.8062, test_f1: 0.6369
 epoch: 88, train_loss: 0.6152, test_loss: 0.8221, test_f1: 0.6215
 epoch: 89, train_loss: 0.6278, test_loss: 0.7914, test_f1: 0.6310
 epoch: 90, train_loss: 0.5971, test_loss: 0.8015, test_f1: 0.6340
 epoch: 91, train_loss: 0.6112, test_loss: 0.7645, test_f1: 0.6498
 epoch: 92, train_loss: 0.6141, test_loss: 0.8061, test_f1: 0.6505
 epoch: 93, train_loss: 0.6025, test_loss: 0.8117, test_f1: 0.6300
 epoch: 94, train_loss: 0.5936, test_loss: 0.7855, test_f1: 0.6400
 epoch: 95, train_loss: 0.5965, test_loss: 0.8192, test_f1: 0.6345
 epoch: 96, train_loss: 0.6012, test_loss: 0.8258, test_f1: 0.6299
 epoch: 97, train_loss: 0.6019, test_loss: 0.7469, test_f1: 0.6508
 epoch: 98, train_loss: 0.6017, test_loss: 0.8132, test_f1: 0.6384
 epoch: 99, train_loss: 0.5926, test_loss: 0.7916, test_f1: 0.6416
##################ITERATION #5 ****************************************
 epoch: 0, train_loss: 1.1455, test_loss: 0.9681, test_f1: 0.4753
 epoch: 1, train_loss: 1.0116, test_loss: 0.9924, test_f1: 0.5100
 epoch: 2, train_loss: 0.9875, test_loss: 0.9557, test_f1: 0.5104
 epoch: 3, train_loss: 0.9713, test_loss: 0.9359, test_f1: 0.5277
 epoch: 4, train_loss: 0.9552, test_loss: 0.8874, test_f1: 0.5259
 epoch: 5, train_loss: 0.9334, test_loss: 0.8708, test_f1: 0.5474
 epoch: 6, train_loss: 0.9248, test_loss: 0.8777, test_f1: 0.5221
 epoch: 7, train_loss: 0.9188, test_loss: 0.8607, test_f1: 0.5878
 epoch: 8, train_loss: 0.8829, test_loss: 0.8469, test_f1: 0.5452
 epoch: 9, train_loss: 0.8768, test_loss: 0.8216, test_f1: 0.5673
 epoch: 10, train_loss: 0.8643, test_loss: 0.8133, test_f1: 0.5635
 epoch: 11, train_loss: 0.8574, test_loss: 0.8256, test_f1: 0.5317
 epoch: 12, train_loss: 0.8500, test_loss: 0.8554, test_f1: 0.5504
 epoch: 13, train_loss: 0.8571, test_loss: 0.9004, test_f1: 0.5503
 epoch: 14, train_loss: 0.8313, test_loss: 0.8372, test_f1: 0.5583
 epoch: 15, train_loss: 0.8220, test_loss: 0.8265, test_f1: 0.5794
 epoch: 16, train_loss: 0.8214, test_loss: 0.8119, test_f1: 0.5732
 epoch: 17, train_loss: 0.8161, test_loss: 0.8512, test_f1: 0.5351
 epoch: 18, train_loss: 0.8060, test_loss: 0.8132, test_f1: 0.5859
 epoch: 19, train_loss: 0.8039, test_loss: 0.8382, test_f1: 0.5673
 epoch: 20, train_loss: 0.7914, test_loss: 0.8370, test_f1: 0.5634
 epoch: 21, train_loss: 0.7901, test_loss: 0.8101, test_f1: 0.5867
 epoch: 22, train_loss: 0.7922, test_loss: 0.8288, test_f1: 0.5970
 epoch: 23, train_loss: 0.7775, test_loss: 0.8309, test_f1: 0.5811
 epoch: 24, train_loss: 0.7770, test_loss: 0.8117, test_f1: 0.5847
 epoch: 25, train_loss: 0.7719, test_loss: 0.8536, test_f1: 0.5719
 epoch: 26, train_loss: 0.7809, test_loss: 0.8163, test_f1: 0.5827
 epoch: 27, train_loss: 0.7598, test_loss: 0.8424, test_f1: 0.5786
 epoch: 28, train_loss: 0.7539, test_loss: 0.8396, test_f1: 0.5926
 epoch: 29, train_loss: 0.7599, test_loss: 0.8377, test_f1: 0.5947
 epoch: 30, train_loss: 0.7447, test_loss: 0.8429, test_f1: 0.5727
 epoch: 31, train_loss: 0.7559, test_loss: 0.8361, test_f1: 0.5928
 epoch: 32, train_loss: 0.7353, test_loss: 0.8512, test_f1: 0.5785
 epoch: 33, train_loss: 0.7354, test_loss: 0.8217, test_f1: 0.5994
 epoch: 34, train_loss: 0.7306, test_loss: 0.8314, test_f1: 0.6032
 epoch: 35, train_loss: 0.7263, test_loss: 0.8139, test_f1: 0.6380
 epoch: 36, train_loss: 0.7241, test_loss: 0.8538, test_f1: 0.5915
 epoch: 37, train_loss: 0.7237, test_loss: 0.8517, test_f1: 0.5831
 epoch: 38, train_loss: 0.7197, test_loss: 0.8180, test_f1: 0.6300
 epoch: 39, train_loss: 0.7075, test_loss: 0.8277, test_f1: 0.6042
 epoch: 40, train_loss: 0.6966, test_loss: 0.8168, test_f1: 0.5912
 epoch: 41, train_loss: 0.7151, test_loss: 0.8241, test_f1: 0.6051
 epoch: 42, train_loss: 0.7140, test_loss: 0.8214, test_f1: 0.6161
 epoch: 43, train_loss: 0.6827, test_loss: 0.8424, test_f1: 0.6334
 epoch: 44, train_loss: 0.6896, test_loss: 0.8719, test_f1: 0.5672
 epoch: 45, train_loss: 0.7119, test_loss: 0.7945, test_f1: 0.6100
 epoch: 46, train_loss: 0.6906, test_loss: 0.8384, test_f1: 0.6195
 epoch: 47, train_loss: 0.7112, test_loss: 0.8229, test_f1: 0.6354
 epoch: 48, train_loss: 0.6916, test_loss: 0.8823, test_f1: 0.6004
 epoch: 49, train_loss: 0.6727, test_loss: 0.8116, test_f1: 0.6179
 epoch: 50, train_loss: 0.6777, test_loss: 0.8258, test_f1: 0.6146
 epoch: 51, train_loss: 0.6664, test_loss: 0.8175, test_f1: 0.6170
 epoch: 52, train_loss: 0.6576, test_loss: 0.7984, test_f1: 0.6320
 epoch: 53, train_loss: 0.6600, test_loss: 0.7938, test_f1: 0.6365
 epoch: 54, train_loss: 0.6414, test_loss: 0.8360, test_f1: 0.6254
 epoch: 55, train_loss: 0.6429, test_loss: 0.8180, test_f1: 0.6286
 epoch: 56, train_loss: 0.6533, test_loss: 0.8376, test_f1: 0.6146
 epoch: 57, train_loss: 0.6577, test_loss: 0.8395, test_f1: 0.6134
 epoch: 58, train_loss: 0.6494, test_loss: 0.8163, test_f1: 0.6346
 epoch: 59, train_loss: 0.6339, test_loss: 0.8349, test_f1: 0.6270
 epoch: 60, train_loss: 0.6463, test_loss: 0.8075, test_f1: 0.6055
 epoch: 61, train_loss: 0.6518, test_loss: 0.8244, test_f1: 0.6158
 epoch: 62, train_loss: 0.6342, test_loss: 0.8101, test_f1: 0.6365
 epoch: 63, train_loss: 0.6356, test_loss: 0.8453, test_f1: 0.6241
 epoch: 64, train_loss: 0.6485, test_loss: 0.8158, test_f1: 0.6266
 epoch: 65, train_loss: 0.6260, test_loss: 0.8447, test_f1: 0.6299
 epoch: 66, train_loss: 0.6214, test_loss: 0.8248, test_f1: 0.6342
 epoch: 67, train_loss: 0.6217, test_loss: 0.8278, test_f1: 0.6318
 epoch: 68, train_loss: 0.6393, test_loss: 0.8404, test_f1: 0.6419
 epoch: 69, train_loss: 0.6204, test_loss: 0.8166, test_f1: 0.6397
 epoch: 70, train_loss: 0.6199, test_loss: 0.8126, test_f1: 0.6339
 epoch: 71, train_loss: 0.6280, test_loss: 0.8779, test_f1: 0.6114
 epoch: 72, train_loss: 0.6220, test_loss: 0.8606, test_f1: 0.6249
 epoch: 73, train_loss: 0.6182, test_loss: 0.8429, test_f1: 0.6358
 epoch: 74, train_loss: 0.6065, test_loss: 0.8444, test_f1: 0.6235
 epoch: 75, train_loss: 0.6133, test_loss: 0.8687, test_f1: 0.6242
 epoch: 76, train_loss: 0.6263, test_loss: 0.8259, test_f1: 0.6381
 epoch: 77, train_loss: 0.6123, test_loss: 0.8045, test_f1: 0.6461
 epoch: 78, train_loss: 0.6114, test_loss: 0.8901, test_f1: 0.6318
 epoch: 79, train_loss: 0.6119, test_loss: 0.8052, test_f1: 0.6465
 epoch: 80, train_loss: 0.6122, test_loss: 0.8250, test_f1: 0.6334
 epoch: 81, train_loss: 0.6139, test_loss: 0.8308, test_f1: 0.6471
 epoch: 82, train_loss: 0.6166, test_loss: 0.8290, test_f1: 0.6582
 epoch: 83, train_loss: 0.6061, test_loss: 0.8739, test_f1: 0.6339
 epoch: 84, train_loss: 0.6073, test_loss: 0.8451, test_f1: 0.6334
 epoch: 85, train_loss: 0.6052, test_loss: 0.8248, test_f1: 0.6446
 epoch: 86, train_loss: 0.6024, test_loss: 0.8642, test_f1: 0.6339
 epoch: 87, train_loss: 0.5941, test_loss: 0.8231, test_f1: 0.6559
 epoch: 88, train_loss: 0.5974, test_loss: 0.8632, test_f1: 0.6382
 epoch: 89, train_loss: 0.6037, test_loss: 0.8395, test_f1: 0.6190
 epoch: 90, train_loss: 0.5998, test_loss: 0.8521, test_f1: 0.6270
 epoch: 91, train_loss: 0.5930, test_loss: 0.8475, test_f1: 0.6488
 epoch: 92, train_loss: 0.5991, test_loss: 0.8173, test_f1: 0.6238
 epoch: 93, train_loss: 0.5814, test_loss: 0.8484, test_f1: 0.6369
 epoch: 94, train_loss: 0.5970, test_loss: 0.8085, test_f1: 0.6453
 epoch: 95, train_loss: 0.6018, test_loss: 0.8321, test_f1: 0.6505
 epoch: 96, train_loss: 0.5869, test_loss: 0.8855, test_f1: 0.6329
 epoch: 97, train_loss: 0.6029, test_loss: 0.8471, test_f1: 0.6368
 epoch: 98, train_loss: 0.5907, test_loss: 0.8863, test_f1: 0.6285
 epoch: 99, train_loss: 0.6048, test_loss: 0.8921, test_f1: 0.6269
##################ITERATION #6 ****************************************
 epoch: 0, train_loss: 1.1988, test_loss: 1.0225, test_f1: 0.4618
 epoch: 1, train_loss: 1.0432, test_loss: 1.0120, test_f1: 0.4926
 epoch: 2, train_loss: 1.0100, test_loss: 0.9873, test_f1: 0.5017
 epoch: 3, train_loss: 1.0076, test_loss: 0.9937, test_f1: 0.4863
 epoch: 4, train_loss: 0.9740, test_loss: 0.9791, test_f1: 0.5372
 epoch: 5, train_loss: 0.9473, test_loss: 0.9446, test_f1: 0.5402
 epoch: 6, train_loss: 0.9362, test_loss: 0.9438, test_f1: 0.5416
 epoch: 7, train_loss: 0.9246, test_loss: 0.9366, test_f1: 0.5408
 epoch: 8, train_loss: 0.9243, test_loss: 0.9220, test_f1: 0.5804
 epoch: 9, train_loss: 0.9064, test_loss: 0.9222, test_f1: 0.5291
 epoch: 10, train_loss: 0.8898, test_loss: 0.9402, test_f1: 0.5430
 epoch: 11, train_loss: 0.8749, test_loss: 0.8897, test_f1: 0.5744
 epoch: 12, train_loss: 0.8716, test_loss: 0.9166, test_f1: 0.5123
 epoch: 13, train_loss: 0.8558, test_loss: 0.9207, test_f1: 0.5138
 epoch: 14, train_loss: 0.8584, test_loss: 0.8868, test_f1: 0.5564
 epoch: 15, train_loss: 0.8490, test_loss: 0.9197, test_f1: 0.5606
 epoch: 16, train_loss: 0.8340, test_loss: 0.8983, test_f1: 0.5477
 epoch: 17, train_loss: 0.8337, test_loss: 0.8999, test_f1: 0.5356
 epoch: 18, train_loss: 0.8186, test_loss: 0.8963, test_f1: 0.5106
 epoch: 19, train_loss: 0.8046, test_loss: 0.8914, test_f1: 0.5537
 epoch: 20, train_loss: 0.8195, test_loss: 0.8718, test_f1: 0.5577
 epoch: 21, train_loss: 0.8058, test_loss: 0.8756, test_f1: 0.5793
 epoch: 22, train_loss: 0.7918, test_loss: 0.8642, test_f1: 0.5638
 epoch: 23, train_loss: 0.7797, test_loss: 0.8611, test_f1: 0.5931
 epoch: 24, train_loss: 0.7939, test_loss: 0.8636, test_f1: 0.5859
 epoch: 25, train_loss: 0.7746, test_loss: 0.8779, test_f1: 0.5602
 epoch: 26, train_loss: 0.7726, test_loss: 0.9098, test_f1: 0.5464
 epoch: 27, train_loss: 0.7648, test_loss: 0.9055, test_f1: 0.5715
 epoch: 28, train_loss: 0.7606, test_loss: 1.0452, test_f1: 0.5188
 epoch: 29, train_loss: 0.7796, test_loss: 0.8812, test_f1: 0.5490
 epoch: 30, train_loss: 0.7588, test_loss: 0.8650, test_f1: 0.5717
 epoch: 31, train_loss: 0.7556, test_loss: 0.9173, test_f1: 0.5738
 epoch: 32, train_loss: 0.7528, test_loss: 0.8152, test_f1: 0.5847
 epoch: 33, train_loss: 0.7385, test_loss: 0.8672, test_f1: 0.5753
 epoch: 34, train_loss: 0.7349, test_loss: 0.8744, test_f1: 0.5828
 epoch: 35, train_loss: 0.7472, test_loss: 0.8710, test_f1: 0.5827
 epoch: 36, train_loss: 0.7321, test_loss: 0.7949, test_f1: 0.5881
 epoch: 37, train_loss: 0.7354, test_loss: 0.8896, test_f1: 0.5308
 epoch: 38, train_loss: 0.7123, test_loss: 0.8606, test_f1: 0.5817
 epoch: 39, train_loss: 0.7256, test_loss: 0.8591, test_f1: 0.6011
 epoch: 40, train_loss: 0.7113, test_loss: 0.8519, test_f1: 0.5921
 epoch: 41, train_loss: 0.7141, test_loss: 0.8866, test_f1: 0.5922
 epoch: 42, train_loss: 0.7125, test_loss: 0.8644, test_f1: 0.6191
 epoch: 43, train_loss: 0.7093, test_loss: 0.8543, test_f1: 0.6072
 epoch: 44, train_loss: 0.7013, test_loss: 0.8628, test_f1: 0.6100
 epoch: 45, train_loss: 0.6935, test_loss: 0.8623, test_f1: 0.5839
 epoch: 46, train_loss: 0.7002, test_loss: 0.8582, test_f1: 0.6171
 epoch: 47, train_loss: 0.6843, test_loss: 0.8819, test_f1: 0.5985
 epoch: 48, train_loss: 0.7004, test_loss: 0.9227, test_f1: 0.5562
 epoch: 49, train_loss: 0.6928, test_loss: 0.8526, test_f1: 0.5856
 epoch: 50, train_loss: 0.6750, test_loss: 0.9230, test_f1: 0.5810
 epoch: 51, train_loss: 0.6663, test_loss: 0.8933, test_f1: 0.6142
 epoch: 52, train_loss: 0.6396, test_loss: 0.8526, test_f1: 0.6167
 epoch: 53, train_loss: 0.6481, test_loss: 0.8422, test_f1: 0.5985
 epoch: 54, train_loss: 0.6511, test_loss: 0.9165, test_f1: 0.6019
 epoch: 55, train_loss: 0.6618, test_loss: 0.8700, test_f1: 0.6002
 epoch: 56, train_loss: 0.6515, test_loss: 0.8615, test_f1: 0.5999
 epoch: 57, train_loss: 0.6392, test_loss: 0.8369, test_f1: 0.6354
 epoch: 58, train_loss: 0.6466, test_loss: 0.8990, test_f1: 0.6191
 epoch: 59, train_loss: 0.6364, test_loss: 0.8493, test_f1: 0.6195
 epoch: 60, train_loss: 0.6429, test_loss: 0.9239, test_f1: 0.6021
 epoch: 61, train_loss: 0.6389, test_loss: 0.9083, test_f1: 0.5997
 epoch: 62, train_loss: 0.6406, test_loss: 0.8622, test_f1: 0.6155
 epoch: 63, train_loss: 0.6178, test_loss: 0.9270, test_f1: 0.6037
 epoch: 64, train_loss: 0.6133, test_loss: 0.8830, test_f1: 0.6116
 epoch: 65, train_loss: 0.6377, test_loss: 0.9112, test_f1: 0.6324
 epoch: 66, train_loss: 0.6326, test_loss: 0.8515, test_f1: 0.6079
 epoch: 67, train_loss: 0.6259, test_loss: 0.8915, test_f1: 0.6196
 epoch: 68, train_loss: 0.6251, test_loss: 0.9491, test_f1: 0.5992
 epoch: 69, train_loss: 0.6353, test_loss: 0.8703, test_f1: 0.6089
 epoch: 70, train_loss: 0.6052, test_loss: 0.8437, test_f1: 0.6277
 epoch: 71, train_loss: 0.6159, test_loss: 0.8542, test_f1: 0.6341
 epoch: 72, train_loss: 0.6061, test_loss: 0.8740, test_f1: 0.6297
 epoch: 73, train_loss: 0.6134, test_loss: 0.8683, test_f1: 0.6133
 epoch: 74, train_loss: 0.6229, test_loss: 0.8932, test_f1: 0.6269
 epoch: 75, train_loss: 0.6110, test_loss: 0.9355, test_f1: 0.6084
 epoch: 76, train_loss: 0.6051, test_loss: 0.8495, test_f1: 0.6162
 epoch: 77, train_loss: 0.6026, test_loss: 0.8644, test_f1: 0.6253
 epoch: 78, train_loss: 0.6040, test_loss: 0.8526, test_f1: 0.6376
 epoch: 79, train_loss: 0.6022, test_loss: 0.8430, test_f1: 0.6270
 epoch: 80, train_loss: 0.5975, test_loss: 0.8674, test_f1: 0.6277
 epoch: 81, train_loss: 0.5946, test_loss: 0.8871, test_f1: 0.6309
 epoch: 82, train_loss: 0.5987, test_loss: 0.8857, test_f1: 0.6426
 epoch: 83, train_loss: 0.6077, test_loss: 0.8722, test_f1: 0.6336
 epoch: 84, train_loss: 0.6039, test_loss: 0.9197, test_f1: 0.6229
 epoch: 85, train_loss: 0.6024, test_loss: 0.8866, test_f1: 0.6164
 epoch: 86, train_loss: 0.6060, test_loss: 0.9097, test_f1: 0.6304
 epoch: 87, train_loss: 0.6084, test_loss: 0.9118, test_f1: 0.6428
 epoch: 88, train_loss: 0.5941, test_loss: 0.8954, test_f1: 0.6201
 epoch: 89, train_loss: 0.5999, test_loss: 0.9061, test_f1: 0.6026
 epoch: 90, train_loss: 0.5826, test_loss: 0.9227, test_f1: 0.6233
 epoch: 91, train_loss: 0.5859, test_loss: 0.8732, test_f1: 0.6419
 epoch: 92, train_loss: 0.5815, test_loss: 0.9360, test_f1: 0.6042
 epoch: 93, train_loss: 0.5805, test_loss: 0.9397, test_f1: 0.6085
 epoch: 94, train_loss: 0.5867, test_loss: 0.8658, test_f1: 0.6233
 epoch: 95, train_loss: 0.5864, test_loss: 0.9483, test_f1: 0.6107
 epoch: 96, train_loss: 0.5795, test_loss: 0.8765, test_f1: 0.6243
 epoch: 97, train_loss: 0.5914, test_loss: 0.8282, test_f1: 0.6603
 epoch: 98, train_loss: 0.5865, test_loss: 0.8318, test_f1: 0.6340
 epoch: 99, train_loss: 0.5684, test_loss: 0.8222, test_f1: 0.6376
##################ITERATION #7 ****************************************
 epoch: 0, train_loss: 1.2137, test_loss: 1.0205, test_f1: 0.4720
 epoch: 1, train_loss: 1.0321, test_loss: 1.0182, test_f1: 0.4761
 epoch: 2, train_loss: 0.9898, test_loss: 0.9906, test_f1: 0.4988
 epoch: 3, train_loss: 0.9789, test_loss: 0.9739, test_f1: 0.5041
 epoch: 4, train_loss: 0.9481, test_loss: 0.9897, test_f1: 0.4974
 epoch: 5, train_loss: 0.9368, test_loss: 0.9661, test_f1: 0.5570
 epoch: 6, train_loss: 0.9245, test_loss: 0.9365, test_f1: 0.5467
 epoch: 7, train_loss: 0.9021, test_loss: 0.9597, test_f1: 0.5187
 epoch: 8, train_loss: 0.8987, test_loss: 0.9641, test_f1: 0.5452
 epoch: 9, train_loss: 0.8771, test_loss: 0.9697, test_f1: 0.5167
 epoch: 10, train_loss: 0.8864, test_loss: 0.9250, test_f1: 0.5583
 epoch: 11, train_loss: 0.8601, test_loss: 0.9077, test_f1: 0.5537
 epoch: 12, train_loss: 0.8563, test_loss: 0.9067, test_f1: 0.5591
 epoch: 13, train_loss: 0.8617, test_loss: 0.9172, test_f1: 0.5863
 epoch: 14, train_loss: 0.8440, test_loss: 0.8746, test_f1: 0.5724
 epoch: 15, train_loss: 0.8506, test_loss: 0.9296, test_f1: 0.5517
 epoch: 16, train_loss: 0.8287, test_loss: 0.9343, test_f1: 0.5528
 epoch: 17, train_loss: 0.8290, test_loss: 0.8839, test_f1: 0.5778
 epoch: 18, train_loss: 0.8167, test_loss: 0.9056, test_f1: 0.5476
 epoch: 19, train_loss: 0.8222, test_loss: 0.9138, test_f1: 0.5530
 epoch: 20, train_loss: 0.8107, test_loss: 0.8675, test_f1: 0.5419
 epoch: 21, train_loss: 0.8023, test_loss: 0.8939, test_f1: 0.5540
 epoch: 22, train_loss: 0.8156, test_loss: 0.9192, test_f1: 0.5414
 epoch: 23, train_loss: 0.7925, test_loss: 0.9733, test_f1: 0.5283
 epoch: 24, train_loss: 0.7983, test_loss: 0.8891, test_f1: 0.5521
 epoch: 25, train_loss: 0.7805, test_loss: 0.9084, test_f1: 0.5586
 epoch: 26, train_loss: 0.7710, test_loss: 0.8908, test_f1: 0.5786
 epoch: 27, train_loss: 0.7761, test_loss: 0.9200, test_f1: 0.5659
 epoch: 28, train_loss: 0.7738, test_loss: 0.9182, test_f1: 0.5370
 epoch: 29, train_loss: 0.7664, test_loss: 0.8723, test_f1: 0.5443
 epoch: 30, train_loss: 0.7768, test_loss: 0.9210, test_f1: 0.5329
 epoch: 31, train_loss: 0.7661, test_loss: 0.9594, test_f1: 0.5174
 epoch: 32, train_loss: 0.7630, test_loss: 0.9291, test_f1: 0.5393
 epoch: 33, train_loss: 0.7603, test_loss: 0.9358, test_f1: 0.5369
 epoch: 34, train_loss: 0.7404, test_loss: 0.9556, test_f1: 0.5529
 epoch: 35, train_loss: 0.7481, test_loss: 0.9382, test_f1: 0.5470
 epoch: 36, train_loss: 0.7582, test_loss: 0.9382, test_f1: 0.5419
 epoch: 37, train_loss: 0.7285, test_loss: 0.9569, test_f1: 0.5225
 epoch: 38, train_loss: 0.7405, test_loss: 1.0087, test_f1: 0.5363
 epoch: 39, train_loss: 0.7419, test_loss: 0.9958, test_f1: 0.5531
 epoch: 40, train_loss: 0.7248, test_loss: 0.9390, test_f1: 0.5548
 epoch: 41, train_loss: 0.7260, test_loss: 1.1001, test_f1: 0.5171
 epoch: 42, train_loss: 0.7252, test_loss: 0.8784, test_f1: 0.5458
 epoch: 43, train_loss: 0.7256, test_loss: 0.9285, test_f1: 0.5705
 epoch: 44, train_loss: 0.7235, test_loss: 0.8773, test_f1: 0.5783
 epoch: 45, train_loss: 0.7065, test_loss: 0.9270, test_f1: 0.5340
 epoch: 46, train_loss: 0.7140, test_loss: 0.9122, test_f1: 0.5642
 epoch: 47, train_loss: 0.7094, test_loss: 0.9039, test_f1: 0.5473
 epoch: 48, train_loss: 0.7139, test_loss: 0.9602, test_f1: 0.5545
 epoch: 49, train_loss: 0.6991, test_loss: 0.9643, test_f1: 0.5900
 epoch: 50, train_loss: 0.7005, test_loss: 0.9332, test_f1: 0.6285
 epoch: 51, train_loss: 0.6839, test_loss: 0.9640, test_f1: 0.5501
 epoch: 52, train_loss: 0.6733, test_loss: 0.9282, test_f1: 0.5954
 epoch: 53, train_loss: 0.6730, test_loss: 0.9077, test_f1: 0.5691
 epoch: 54, train_loss: 0.6724, test_loss: 0.9666, test_f1: 0.5736
 epoch: 55, train_loss: 0.6625, test_loss: 0.9460, test_f1: 0.5845
 epoch: 56, train_loss: 0.6685, test_loss: 0.9912, test_f1: 0.5743
 epoch: 57, train_loss: 0.6962, test_loss: 0.8851, test_f1: 0.5840
 epoch: 58, train_loss: 0.6610, test_loss: 0.9403, test_f1: 0.6038
 epoch: 59, train_loss: 0.6549, test_loss: 0.9390, test_f1: 0.6050
 epoch: 60, train_loss: 0.6473, test_loss: 0.9628, test_f1: 0.5902
 epoch: 61, train_loss: 0.6529, test_loss: 0.9387, test_f1: 0.6007
 epoch: 62, train_loss: 0.6673, test_loss: 0.9473, test_f1: 0.5899
 epoch: 63, train_loss: 0.6483, test_loss: 0.9187, test_f1: 0.6251
 epoch: 64, train_loss: 0.6589, test_loss: 0.9971, test_f1: 0.5546
 epoch: 65, train_loss: 0.6544, test_loss: 0.9786, test_f1: 0.5955
 epoch: 66, train_loss: 0.6532, test_loss: 0.9324, test_f1: 0.5881
 epoch: 67, train_loss: 0.6491, test_loss: 0.9541, test_f1: 0.5841
 epoch: 68, train_loss: 0.6478, test_loss: 0.9873, test_f1: 0.6028
 epoch: 69, train_loss: 0.6412, test_loss: 0.9426, test_f1: 0.5838
 epoch: 70, train_loss: 0.6577, test_loss: 0.9786, test_f1: 0.6081
 epoch: 71, train_loss: 0.6498, test_loss: 0.9411, test_f1: 0.5912
 epoch: 72, train_loss: 0.6489, test_loss: 0.9264, test_f1: 0.6185
 epoch: 73, train_loss: 0.6406, test_loss: 0.9475, test_f1: 0.5603
 epoch: 74, train_loss: 0.6508, test_loss: 0.9135, test_f1: 0.6089
 epoch: 75, train_loss: 0.6299, test_loss: 0.9133, test_f1: 0.6092
 epoch: 76, train_loss: 0.6332, test_loss: 0.9957, test_f1: 0.5924
 epoch: 77, train_loss: 0.6333, test_loss: 0.9535, test_f1: 0.6084
 epoch: 78, train_loss: 0.6365, test_loss: 0.9409, test_f1: 0.6071
 epoch: 79, train_loss: 0.6327, test_loss: 0.9451, test_f1: 0.6064
 epoch: 80, train_loss: 0.6235, test_loss: 0.9819, test_f1: 0.5982
 epoch: 81, train_loss: 0.6253, test_loss: 0.9252, test_f1: 0.6349
 epoch: 82, train_loss: 0.6242, test_loss: 0.9940, test_f1: 0.5615
 epoch: 83, train_loss: 0.6296, test_loss: 0.9945, test_f1: 0.5834
 epoch: 84, train_loss: 0.6480, test_loss: 0.9406, test_f1: 0.6082
 epoch: 85, train_loss: 0.6188, test_loss: 0.9896, test_f1: 0.5819
 epoch: 86, train_loss: 0.6254, test_loss: 0.9286, test_f1: 0.6095
 epoch: 87, train_loss: 0.6434, test_loss: 0.9413, test_f1: 0.6032
 epoch: 88, train_loss: 0.6223, test_loss: 0.9017, test_f1: 0.6304
 epoch: 89, train_loss: 0.6218, test_loss: 0.9410, test_f1: 0.6071
 epoch: 90, train_loss: 0.6325, test_loss: 1.0466, test_f1: 0.5747
 epoch: 91, train_loss: 0.6198, test_loss: 0.9896, test_f1: 0.5948
 epoch: 92, train_loss: 0.6251, test_loss: 0.9643, test_f1: 0.5944
 epoch: 93, train_loss: 0.6187, test_loss: 0.9591, test_f1: 0.5886
 epoch: 94, train_loss: 0.6223, test_loss: 1.0002, test_f1: 0.5807
 epoch: 95, train_loss: 0.6225, test_loss: 0.9875, test_f1: 0.5873
 epoch: 96, train_loss: 0.6266, test_loss: 0.9746, test_f1: 0.5768
 epoch: 97, train_loss: 0.6147, test_loss: 0.9757, test_f1: 0.6010
 epoch: 98, train_loss: 0.6221, test_loss: 0.9249, test_f1: 0.6216
 epoch: 99, train_loss: 0.6134, test_loss: 0.9289, test_f1: 0.6246
##################ITERATION #8 ****************************************
 epoch: 0, train_loss: 1.1896, test_loss: 1.0153, test_f1: 0.5002
 epoch: 1, train_loss: 1.0362, test_loss: 1.0090, test_f1: 0.5017
 epoch: 2, train_loss: 1.0067, test_loss: 0.9996, test_f1: 0.5175
 epoch: 3, train_loss: 0.9873, test_loss: 0.9970, test_f1: 0.4870
 epoch: 4, train_loss: 0.9777, test_loss: 0.9884, test_f1: 0.5133
 epoch: 5, train_loss: 0.9654, test_loss: 1.0166, test_f1: 0.4825
 epoch: 6, train_loss: 0.9536, test_loss: 0.9402, test_f1: 0.5204
 epoch: 7, train_loss: 0.9536, test_loss: 0.9741, test_f1: 0.4929
 epoch: 8, train_loss: 0.9262, test_loss: 1.0553, test_f1: 0.4624
 epoch: 9, train_loss: 0.9216, test_loss: 0.9519, test_f1: 0.5077
 epoch: 10, train_loss: 0.8970, test_loss: 1.0173, test_f1: 0.4676
 epoch: 11, train_loss: 0.8846, test_loss: 0.9960, test_f1: 0.4950
 epoch: 12, train_loss: 0.8963, test_loss: 0.9345, test_f1: 0.4996
 epoch: 13, train_loss: 0.8771, test_loss: 0.8905, test_f1: 0.5192
 epoch: 14, train_loss: 0.8632, test_loss: 0.8982, test_f1: 0.5525
 epoch: 15, train_loss: 0.8550, test_loss: 0.9293, test_f1: 0.5143
 epoch: 16, train_loss: 0.8424, test_loss: 0.8815, test_f1: 0.5523
 epoch: 17, train_loss: 0.8461, test_loss: 0.8831, test_f1: 0.5629
 epoch: 18, train_loss: 0.8379, test_loss: 0.9510, test_f1: 0.5158
 epoch: 19, train_loss: 0.8464, test_loss: 0.8663, test_f1: 0.5845
 epoch: 20, train_loss: 0.8152, test_loss: 0.9991, test_f1: 0.5258
 epoch: 21, train_loss: 0.8389, test_loss: 0.8735, test_f1: 0.5744
 epoch: 22, train_loss: 0.8129, test_loss: 0.9266, test_f1: 0.5527
 epoch: 23, train_loss: 0.8205, test_loss: 0.8849, test_f1: 0.5236
 epoch: 24, train_loss: 0.8043, test_loss: 1.0402, test_f1: 0.4852
 epoch: 25, train_loss: 0.7972, test_loss: 0.9664, test_f1: 0.5285
 epoch: 26, train_loss: 0.8078, test_loss: 0.8365, test_f1: 0.6103
 epoch: 27, train_loss: 0.7940, test_loss: 0.9170, test_f1: 0.5479
 epoch: 28, train_loss: 0.7974, test_loss: 0.8975, test_f1: 0.5445
 epoch: 29, train_loss: 0.7778, test_loss: 0.9356, test_f1: 0.5379
 epoch: 30, train_loss: 0.7762, test_loss: 0.8404, test_f1: 0.6138
 epoch: 31, train_loss: 0.7846, test_loss: 0.8257, test_f1: 0.5998
 epoch: 32, train_loss: 0.7735, test_loss: 0.8897, test_f1: 0.5832
 epoch: 33, train_loss: 0.7762, test_loss: 0.9390, test_f1: 0.5417
 epoch: 34, train_loss: 0.7657, test_loss: 1.0185, test_f1: 0.4957
 epoch: 35, train_loss: 0.7817, test_loss: 0.8706, test_f1: 0.5899
 epoch: 36, train_loss: 0.7725, test_loss: 0.8262, test_f1: 0.6220
 epoch: 37, train_loss: 0.7699, test_loss: 0.8596, test_f1: 0.5656
 epoch: 38, train_loss: 0.7747, test_loss: 0.8371, test_f1: 0.5805
 epoch: 39, train_loss: 0.7576, test_loss: 0.8908, test_f1: 0.5932
 epoch: 40, train_loss: 0.7368, test_loss: 1.0431, test_f1: 0.5278
 epoch: 41, train_loss: 0.7706, test_loss: 0.8548, test_f1: 0.5780
 epoch: 42, train_loss: 0.7377, test_loss: 0.8330, test_f1: 0.5840
 epoch: 43, train_loss: 0.7502, test_loss: 0.7810, test_f1: 0.6339
 epoch: 44, train_loss: 0.7432, test_loss: 0.8612, test_f1: 0.6165
 epoch: 45, train_loss: 0.7261, test_loss: 0.8352, test_f1: 0.6514
 epoch: 46, train_loss: 0.7335, test_loss: 0.8267, test_f1: 0.6326
 epoch: 47, train_loss: 0.7285, test_loss: 0.8017, test_f1: 0.6237
 epoch: 48, train_loss: 0.7225, test_loss: 0.8246, test_f1: 0.6174
 epoch: 49, train_loss: 0.7205, test_loss: 0.8532, test_f1: 0.6067
 epoch: 50, train_loss: 0.7268, test_loss: 0.8523, test_f1: 0.5979
 epoch: 51, train_loss: 0.7125, test_loss: 0.8289, test_f1: 0.6048
 epoch: 52, train_loss: 0.7041, test_loss: 0.8219, test_f1: 0.6248
 epoch: 53, train_loss: 0.6897, test_loss: 0.8663, test_f1: 0.6021
 epoch: 54, train_loss: 0.6781, test_loss: 0.9740, test_f1: 0.5899
 epoch: 55, train_loss: 0.6904, test_loss: 0.8922, test_f1: 0.6035
 epoch: 56, train_loss: 0.6767, test_loss: 0.8827, test_f1: 0.5646
 epoch: 57, train_loss: 0.6855, test_loss: 0.9467, test_f1: 0.5876
 epoch: 58, train_loss: 0.6830, test_loss: 0.9171, test_f1: 0.6024
 epoch: 59, train_loss: 0.6903, test_loss: 0.8531, test_f1: 0.6217
 epoch: 60, train_loss: 0.6825, test_loss: 0.9212, test_f1: 0.5877
 epoch: 61, train_loss: 0.6849, test_loss: 0.9696, test_f1: 0.5577
 epoch: 62, train_loss: 0.6785, test_loss: 0.8790, test_f1: 0.5903
 epoch: 63, train_loss: 0.6763, test_loss: 0.8620, test_f1: 0.6190
 epoch: 64, train_loss: 0.6739, test_loss: 1.0295, test_f1: 0.5828
 epoch: 65, train_loss: 0.6705, test_loss: 0.8608, test_f1: 0.6148
 epoch: 66, train_loss: 0.6711, test_loss: 0.9868, test_f1: 0.5599
 epoch: 67, train_loss: 0.6647, test_loss: 0.9422, test_f1: 0.5929
 epoch: 68, train_loss: 0.6657, test_loss: 0.8504, test_f1: 0.6164
 epoch: 69, train_loss: 0.6744, test_loss: 0.9400, test_f1: 0.5842
 epoch: 70, train_loss: 0.6587, test_loss: 0.8725, test_f1: 0.6049
 epoch: 71, train_loss: 0.6638, test_loss: 0.9310, test_f1: 0.5755
 epoch: 72, train_loss: 0.6526, test_loss: 0.8586, test_f1: 0.6386
 epoch: 73, train_loss: 0.6474, test_loss: 0.9124, test_f1: 0.6070
 epoch: 74, train_loss: 0.6640, test_loss: 0.9121, test_f1: 0.6102
 epoch: 75, train_loss: 0.6646, test_loss: 0.9152, test_f1: 0.6124
 epoch: 76, train_loss: 0.6719, test_loss: 0.8821, test_f1: 0.6192
 epoch: 77, train_loss: 0.6699, test_loss: 0.9174, test_f1: 0.6019
 epoch: 78, train_loss: 0.6590, test_loss: 0.9275, test_f1: 0.5950
 epoch: 79, train_loss: 0.6388, test_loss: 0.8962, test_f1: 0.5997
 epoch: 80, train_loss: 0.6602, test_loss: 0.8442, test_f1: 0.6259
 epoch: 81, train_loss: 0.6516, test_loss: 0.8799, test_f1: 0.6255
 epoch: 82, train_loss: 0.6453, test_loss: 0.8426, test_f1: 0.6293
 epoch: 83, train_loss: 0.6566, test_loss: 0.9346, test_f1: 0.6019
 epoch: 84, train_loss: 0.6560, test_loss: 0.9234, test_f1: 0.5798
 epoch: 85, train_loss: 0.6355, test_loss: 0.9100, test_f1: 0.6102
 epoch: 86, train_loss: 0.6363, test_loss: 0.8832, test_f1: 0.6214
 epoch: 87, train_loss: 0.6529, test_loss: 0.8816, test_f1: 0.6218
 epoch: 88, train_loss: 0.6328, test_loss: 0.9776, test_f1: 0.5916
 epoch: 89, train_loss: 0.6436, test_loss: 0.8206, test_f1: 0.6293
 epoch: 90, train_loss: 0.6345, test_loss: 0.8575, test_f1: 0.6373
 epoch: 91, train_loss: 0.6439, test_loss: 0.9023, test_f1: 0.6081
 epoch: 92, train_loss: 0.6382, test_loss: 0.9187, test_f1: 0.6136
 epoch: 93, train_loss: 0.6315, test_loss: 0.9120, test_f1: 0.6106
 epoch: 94, train_loss: 0.6376, test_loss: 0.8753, test_f1: 0.6231
 epoch: 95, train_loss: 0.6145, test_loss: 0.8842, test_f1: 0.6218
 epoch: 96, train_loss: 0.6173, test_loss: 0.8995, test_f1: 0.6212
 epoch: 97, train_loss: 0.6286, test_loss: 1.0049, test_f1: 0.5897
 epoch: 98, train_loss: 0.6255, test_loss: 0.8922, test_f1: 0.6291
 epoch: 99, train_loss: 0.6334, test_loss: 0.8228, test_f1: 0.6232
##################ITERATION #9 ****************************************
 epoch: 0, train_loss: 1.2159, test_loss: 1.0164, test_f1: 0.4905
 epoch: 1, train_loss: 1.0129, test_loss: 0.9926, test_f1: 0.4879
 epoch: 2, train_loss: 0.9901, test_loss: 1.0025, test_f1: 0.5140
 epoch: 3, train_loss: 0.9675, test_loss: 0.9618, test_f1: 0.5081
 epoch: 4, train_loss: 0.9371, test_loss: 0.9650, test_f1: 0.5314
 epoch: 5, train_loss: 0.9267, test_loss: 0.9813, test_f1: 0.5238
 epoch: 6, train_loss: 0.9053, test_loss: 0.9137, test_f1: 0.5491
 epoch: 7, train_loss: 0.9045, test_loss: 0.9464, test_f1: 0.5148
 epoch: 8, train_loss: 0.8865, test_loss: 0.8962, test_f1: 0.5546
 epoch: 9, train_loss: 0.8760, test_loss: 0.9273, test_f1: 0.5312
 epoch: 10, train_loss: 0.8746, test_loss: 0.8943, test_f1: 0.5503
 epoch: 11, train_loss: 0.8558, test_loss: 0.8988, test_f1: 0.5755
 epoch: 12, train_loss: 0.8378, test_loss: 0.9099, test_f1: 0.5374
 epoch: 13, train_loss: 0.8370, test_loss: 0.8971, test_f1: 0.5489
 epoch: 14, train_loss: 0.8432, test_loss: 0.9373, test_f1: 0.5415
 epoch: 15, train_loss: 0.8323, test_loss: 0.8707, test_f1: 0.5549
 epoch: 16, train_loss: 0.8203, test_loss: 0.9213, test_f1: 0.5438
 epoch: 17, train_loss: 0.8230, test_loss: 0.9165, test_f1: 0.5472
 epoch: 18, train_loss: 0.8243, test_loss: 0.8901, test_f1: 0.5520
 epoch: 19, train_loss: 0.8083, test_loss: 0.9000, test_f1: 0.5637
 epoch: 20, train_loss: 0.7988, test_loss: 0.9335, test_f1: 0.5136
 epoch: 21, train_loss: 0.8139, test_loss: 0.9135, test_f1: 0.5536
 epoch: 22, train_loss: 0.7912, test_loss: 0.9444, test_f1: 0.5570
 epoch: 23, train_loss: 0.7955, test_loss: 0.8779, test_f1: 0.5739
 epoch: 24, train_loss: 0.7820, test_loss: 0.8784, test_f1: 0.5671
 epoch: 25, train_loss: 0.7687, test_loss: 0.8436, test_f1: 0.5840
 epoch: 26, train_loss: 0.7794, test_loss: 0.8883, test_f1: 0.5651
 epoch: 27, train_loss: 0.7563, test_loss: 0.9558, test_f1: 0.5485
 epoch: 28, train_loss: 0.7569, test_loss: 0.8635, test_f1: 0.5764
 epoch: 29, train_loss: 0.7467, test_loss: 0.9112, test_f1: 0.5496
 epoch: 30, train_loss: 0.7521, test_loss: 0.8695, test_f1: 0.5723
 epoch: 31, train_loss: 0.7366, test_loss: 1.0036, test_f1: 0.5745
 epoch: 32, train_loss: 0.7536, test_loss: 0.8663, test_f1: 0.5762
 epoch: 33, train_loss: 0.7348, test_loss: 0.8182, test_f1: 0.5793
 epoch: 34, train_loss: 0.7318, test_loss: 0.8907, test_f1: 0.6152
 epoch: 35, train_loss: 0.7428, test_loss: 0.8825, test_f1: 0.5988
 epoch: 36, train_loss: 0.7325, test_loss: 0.9473, test_f1: 0.5645
 epoch: 37, train_loss: 0.7427, test_loss: 0.8823, test_f1: 0.6054
 epoch: 38, train_loss: 0.7259, test_loss: 0.8608, test_f1: 0.5754
 epoch: 39, train_loss: 0.7182, test_loss: 0.8712, test_f1: 0.5933
 epoch: 40, train_loss: 0.7173, test_loss: 0.8529, test_f1: 0.6127
 epoch: 41, train_loss: 0.7138, test_loss: 0.8784, test_f1: 0.5992
 epoch: 42, train_loss: 0.7225, test_loss: 0.9017, test_f1: 0.5600
 epoch: 43, train_loss: 0.7045, test_loss: 0.8318, test_f1: 0.6044
 epoch: 44, train_loss: 0.7157, test_loss: 1.0009, test_f1: 0.5420
 epoch: 45, train_loss: 0.6939, test_loss: 0.8800, test_f1: 0.5642
 epoch: 46, train_loss: 0.6904, test_loss: 0.8873, test_f1: 0.6187
 epoch: 47, train_loss: 0.6900, test_loss: 0.9317, test_f1: 0.5766
 epoch: 48, train_loss: 0.6972, test_loss: 1.1094, test_f1: 0.5103
 epoch: 49, train_loss: 0.6939, test_loss: 0.8515, test_f1: 0.6424
 epoch: 50, train_loss: 0.6911, test_loss: 0.8512, test_f1: 0.6104
 epoch: 51, train_loss: 0.6728, test_loss: 0.8424, test_f1: 0.6140
 epoch: 52, train_loss: 0.6589, test_loss: 0.8382, test_f1: 0.6016
 epoch: 53, train_loss: 0.6544, test_loss: 0.8428, test_f1: 0.6289
 epoch: 54, train_loss: 0.6511, test_loss: 0.8377, test_f1: 0.6137
 epoch: 55, train_loss: 0.6495, test_loss: 0.8634, test_f1: 0.5977
 epoch: 56, train_loss: 0.6522, test_loss: 0.8003, test_f1: 0.6395
 epoch: 57, train_loss: 0.6383, test_loss: 0.8177, test_f1: 0.6139
 epoch: 58, train_loss: 0.6515, test_loss: 0.8155, test_f1: 0.6362
 epoch: 59, train_loss: 0.6468, test_loss: 0.8378, test_f1: 0.6818
 epoch: 60, train_loss: 0.6344, test_loss: 0.8693, test_f1: 0.6248
 epoch: 61, train_loss: 0.6437, test_loss: 0.8953, test_f1: 0.6252
 epoch: 62, train_loss: 0.6353, test_loss: 0.8444, test_f1: 0.6432
 epoch: 63, train_loss: 0.6431, test_loss: 0.8664, test_f1: 0.6579
 epoch: 64, train_loss: 0.6298, test_loss: 0.8481, test_f1: 0.6559
 epoch: 65, train_loss: 0.6300, test_loss: 0.8505, test_f1: 0.6592
 epoch: 66, train_loss: 0.6355, test_loss: 0.8600, test_f1: 0.6474
 epoch: 67, train_loss: 0.6420, test_loss: 0.8682, test_f1: 0.5749
 epoch: 68, train_loss: 0.6355, test_loss: 0.8844, test_f1: 0.6317
 epoch: 69, train_loss: 0.6326, test_loss: 0.8432, test_f1: 0.6486
 epoch: 70, train_loss: 0.6275, test_loss: 0.8325, test_f1: 0.6697
 epoch: 71, train_loss: 0.6264, test_loss: 0.8621, test_f1: 0.6594
 epoch: 72, train_loss: 0.6140, test_loss: 0.8617, test_f1: 0.6418
 epoch: 73, train_loss: 0.6219, test_loss: 0.8378, test_f1: 0.6579
 epoch: 74, train_loss: 0.6119, test_loss: 0.8226, test_f1: 0.6605
 epoch: 75, train_loss: 0.6197, test_loss: 0.8767, test_f1: 0.6282
 epoch: 76, train_loss: 0.6136, test_loss: 0.8926, test_f1: 0.6185
 epoch: 77, train_loss: 0.6093, test_loss: 0.8578, test_f1: 0.6482
 epoch: 78, train_loss: 0.6009, test_loss: 0.8199, test_f1: 0.6634
 epoch: 79, train_loss: 0.6094, test_loss: 0.8885, test_f1: 0.6314
 epoch: 80, train_loss: 0.6192, test_loss: 0.8524, test_f1: 0.6676
 epoch: 81, train_loss: 0.6268, test_loss: 0.8479, test_f1: 0.6604
 epoch: 82, train_loss: 0.5945, test_loss: 0.8701, test_f1: 0.6454
 epoch: 83, train_loss: 0.6144, test_loss: 0.8985, test_f1: 0.6224
 epoch: 84, train_loss: 0.6010, test_loss: 0.8503, test_f1: 0.6448
 epoch: 85, train_loss: 0.6106, test_loss: 0.8665, test_f1: 0.6459
 epoch: 86, train_loss: 0.5984, test_loss: 0.8555, test_f1: 0.6496
 epoch: 87, train_loss: 0.6058, test_loss: 0.8803, test_f1: 0.6613
 epoch: 88, train_loss: 0.6044, test_loss: 0.8289, test_f1: 0.6542
 epoch: 89, train_loss: 0.6001, test_loss: 0.8888, test_f1: 0.6406
 epoch: 90, train_loss: 0.5902, test_loss: 0.8839, test_f1: 0.6513
 epoch: 91, train_loss: 0.6161, test_loss: 0.8738, test_f1: 0.6397
 epoch: 92, train_loss: 0.5983, test_loss: 0.8685, test_f1: 0.6386
 epoch: 93, train_loss: 0.6001, test_loss: 0.8537, test_f1: 0.6389
 epoch: 94, train_loss: 0.5900, test_loss: 0.8945, test_f1: 0.6524
 epoch: 95, train_loss: 0.5963, test_loss: 0.8448, test_f1: 0.6760
 epoch: 96, train_loss: 0.5926, test_loss: 0.8505, test_f1: 0.6587
 epoch: 97, train_loss: 0.5894, test_loss: 0.8986, test_f1: 0.6508
 epoch: 98, train_loss: 0.5886, test_loss: 0.8437, test_f1: 0.6588
 epoch: 99, train_loss: 0.5934, test_loss: 0.8956, test_f1: 0.6610

Training completed in 810.90 seconds
Best F1: 0.6818 at epoch 59
Mean F1 across iterations: 0.6577  0.0126
========================FINAL RESULTS================================
FEGIN weighted F1: 0.6818  0.0126
python main.py --data ltspice_examples --representation component_pin --model FEGIN --layers 2 --hiddens 32 --batch_size 32 --lr 0.001 --emb_size 512 --epochs 100 --save_appendix component_pin_L2_H32_BS32_LR0.001_E512 --no_val
-----



STDERR:
  File "main.py", line 370, in <module>
    main()
  File "main.py", line 254, in main
    dataset = dataset_class(
  File "/home/philip/projects/ltspice_examples_code_repo/Circuit-Completion-Using-GNNs/component_classification_with_link_prediction_head/evaluation/FEGIN/kernel/circuit_datasets.py", line 15, in __init__
    self.data, self.slices = torch.load(self.processed_paths[0])
  File "/home/philip/.local/lib/python3.8/site-packages/torch/serialization.py", line 1040, in load
    warnings.warn(
  File "/usr/lib/python3.8/warnings.py", line 109, in _showwarnmsg
    sw(msg.message, msg.category, msg.filename, msg.lineno,
  File "main.py", line 47, in warn_with_traceback
    traceback.print_stack(file=log)
/home/philip/projects/ltspice_examples_code_repo/Circuit-Completion-Using-GNNs/component_classification_with_link_prediction_head/evaluation/FEGIN/kernel/circuit_datasets.py:15: FutureWarning: You are using `torch.load` with `weights_only=False` (the current default value), which uses the default pickle module implicitly. It is possible to construct malicious pickle data which will execute arbitrary code during unpickling (See https://github.com/pytorch/pytorch/blob/main/SECURITY.md#untrusted-models for more details). In a future release, the default value for `weights_only` will be flipped to `True`. This limits the functions that could be executed during unpickling. Arbitrary objects will no longer be allowed to be loaded via this mode unless they are explicitly allowlisted by the user via `torch.serialization.add_safe_globals`. We recommend you start setting `weights_only=True` for any use case where you don't have full control of the loaded file. Please open an issue on GitHub for any issues related to this experimental feature.
  self.data, self.slices = torch.load(self.processed_paths[0])
