STDOUT:
Results will be saved in /home/philip/projects/llm_inference_code_repo/Circuit-Completion-Using-GNNs/component_classification_with_link_prediction_head/evaluation/FEGIN/results/model_FEGIN_dataset_ltspice_examples
Command line input: python main.py --data ltspice_examples --representation component_pin --model FEGIN --layers 4 --hiddens 32 --batch_size 256 --lr 0.001 --emb_size 128 --epochs 100 --save_appendix component_pin_L4_H32_BS256_LR0.001_E128 --no_val
 is saved.
-----
ltspice_examples - FEGIN
Using 4 layers, 32 hidden units, h = 2
Loading component_pin representation dataset
ENTERED
Training FEGIN on component_pin representation
Train: 3560, Test: 848
##################ITERATION #0 ****************************************
 epoch: 0, train_loss: 1.3471, test_loss: 1.3436, test_f1: 0.2260
 epoch: 1, train_loss: 1.3075, test_loss: 1.3201, test_f1: 0.2260
 epoch: 2, train_loss: 1.2634, test_loss: 1.2976, test_f1: 0.2260
 epoch: 3, train_loss: 1.2157, test_loss: 1.2322, test_f1: 0.2260
 epoch: 4, train_loss: 1.1680, test_loss: 1.1321, test_f1: 0.3444
 epoch: 5, train_loss: 1.1107, test_loss: 1.0584, test_f1: 0.3898
 epoch: 6, train_loss: 1.0609, test_loss: 1.0121, test_f1: 0.4113
 epoch: 7, train_loss: 1.0297, test_loss: 1.0093, test_f1: 0.4109
 epoch: 8, train_loss: 1.0107, test_loss: 1.0194, test_f1: 0.4421
 epoch: 9, train_loss: 0.9977, test_loss: 1.0162, test_f1: 0.4436
 epoch: 10, train_loss: 0.9857, test_loss: 0.9800, test_f1: 0.4318
 epoch: 11, train_loss: 0.9644, test_loss: 0.9783, test_f1: 0.4581
 epoch: 12, train_loss: 0.9552, test_loss: 0.9772, test_f1: 0.4494
 epoch: 13, train_loss: 0.9419, test_loss: 0.9510, test_f1: 0.4766
 epoch: 14, train_loss: 0.9233, test_loss: 0.9423, test_f1: 0.4994
 epoch: 15, train_loss: 0.9151, test_loss: 0.9160, test_f1: 0.4902
 epoch: 16, train_loss: 0.9025, test_loss: 0.9109, test_f1: 0.4854
 epoch: 17, train_loss: 0.9024, test_loss: 0.9799, test_f1: 0.4805
 epoch: 18, train_loss: 0.8900, test_loss: 0.9383, test_f1: 0.4966
 epoch: 19, train_loss: 0.8669, test_loss: 0.9124, test_f1: 0.5077
 epoch: 20, train_loss: 0.8556, test_loss: 0.9426, test_f1: 0.5168
 epoch: 21, train_loss: 0.8777, test_loss: 0.9346, test_f1: 0.5017
 epoch: 22, train_loss: 0.8496, test_loss: 0.8951, test_f1: 0.5051
 epoch: 23, train_loss: 0.8360, test_loss: 1.0003, test_f1: 0.4748
 epoch: 24, train_loss: 0.8284, test_loss: 0.8734, test_f1: 0.5206
 epoch: 25, train_loss: 0.8223, test_loss: 0.8860, test_f1: 0.5250
 epoch: 26, train_loss: 0.8121, test_loss: 0.9006, test_f1: 0.5270
 epoch: 27, train_loss: 0.8134, test_loss: 1.0417, test_f1: 0.4836
 epoch: 28, train_loss: 0.8017, test_loss: 0.9777, test_f1: 0.5089
 epoch: 29, train_loss: 0.8090, test_loss: 0.8991, test_f1: 0.5291
 epoch: 30, train_loss: 0.7990, test_loss: 0.8993, test_f1: 0.5193
 epoch: 31, train_loss: 0.7831, test_loss: 0.9183, test_f1: 0.5139
 epoch: 32, train_loss: 0.7733, test_loss: 0.9353, test_f1: 0.5177
 epoch: 33, train_loss: 0.7711, test_loss: 0.8959, test_f1: 0.5492
 epoch: 34, train_loss: 0.7626, test_loss: 0.9036, test_f1: 0.5355
 epoch: 35, train_loss: 0.7531, test_loss: 0.9398, test_f1: 0.5255
 epoch: 36, train_loss: 0.7535, test_loss: 0.9076, test_f1: 0.5343
 epoch: 37, train_loss: 0.7462, test_loss: 0.9291, test_f1: 0.5385
 epoch: 38, train_loss: 0.7405, test_loss: 0.9307, test_f1: 0.5352
 epoch: 39, train_loss: 0.7350, test_loss: 0.9500, test_f1: 0.5207
 epoch: 40, train_loss: 0.7309, test_loss: 0.8841, test_f1: 0.5470
 epoch: 41, train_loss: 0.7347, test_loss: 0.9880, test_f1: 0.5261
 epoch: 42, train_loss: 0.7257, test_loss: 0.9734, test_f1: 0.5168
 epoch: 43, train_loss: 0.7144, test_loss: 0.9626, test_f1: 0.5278
 epoch: 44, train_loss: 0.7284, test_loss: 0.9599, test_f1: 0.5506
 epoch: 45, train_loss: 0.7146, test_loss: 0.9295, test_f1: 0.5330
 epoch: 46, train_loss: 0.7235, test_loss: 0.9519, test_f1: 0.5264
 epoch: 47, train_loss: 0.7303, test_loss: 0.9445, test_f1: 0.5493
 epoch: 48, train_loss: 0.7105, test_loss: 0.9037, test_f1: 0.5381
 epoch: 49, train_loss: 0.6997, test_loss: 0.9900, test_f1: 0.5396
 epoch: 50, train_loss: 0.6795, test_loss: 0.9526, test_f1: 0.5501
 epoch: 51, train_loss: 0.6749, test_loss: 0.9608, test_f1: 0.5477
 epoch: 52, train_loss: 0.6678, test_loss: 0.9769, test_f1: 0.5385
 epoch: 53, train_loss: 0.6679, test_loss: 0.9696, test_f1: 0.5526
 epoch: 54, train_loss: 0.6758, test_loss: 0.9565, test_f1: 0.5390
 epoch: 55, train_loss: 0.6719, test_loss: 1.0063, test_f1: 0.5216
 epoch: 56, train_loss: 0.6613, test_loss: 0.9797, test_f1: 0.5486
 epoch: 57, train_loss: 0.6511, test_loss: 0.9593, test_f1: 0.5620
 epoch: 58, train_loss: 0.6529, test_loss: 1.0106, test_f1: 0.5441
 epoch: 59, train_loss: 0.6572, test_loss: 1.0030, test_f1: 0.5461
 epoch: 60, train_loss: 0.6502, test_loss: 1.0197, test_f1: 0.5254
 epoch: 61, train_loss: 0.6485, test_loss: 0.9184, test_f1: 0.5658
 epoch: 62, train_loss: 0.6452, test_loss: 0.9788, test_f1: 0.5578
 epoch: 63, train_loss: 0.6406, test_loss: 0.9711, test_f1: 0.5733
 epoch: 64, train_loss: 0.6441, test_loss: 0.9870, test_f1: 0.5581
 epoch: 65, train_loss: 0.6368, test_loss: 1.0189, test_f1: 0.5483
 epoch: 66, train_loss: 0.6453, test_loss: 1.0032, test_f1: 0.5662
 epoch: 67, train_loss: 0.6245, test_loss: 1.0195, test_f1: 0.5372
 epoch: 68, train_loss: 0.6352, test_loss: 1.0621, test_f1: 0.5291
 epoch: 69, train_loss: 0.6514, test_loss: 0.9734, test_f1: 0.5639
 epoch: 70, train_loss: 0.6222, test_loss: 0.9939, test_f1: 0.5623
 epoch: 71, train_loss: 0.6409, test_loss: 1.0425, test_f1: 0.5205
 epoch: 72, train_loss: 0.6231, test_loss: 1.0271, test_f1: 0.5451
 epoch: 73, train_loss: 0.6142, test_loss: 0.9916, test_f1: 0.5661
 epoch: 74, train_loss: 0.6152, test_loss: 1.0048, test_f1: 0.5675
 epoch: 75, train_loss: 0.6032, test_loss: 1.0155, test_f1: 0.5523
 epoch: 76, train_loss: 0.6015, test_loss: 1.0067, test_f1: 0.5850
 epoch: 77, train_loss: 0.6121, test_loss: 1.0567, test_f1: 0.5607
 epoch: 78, train_loss: 0.6048, test_loss: 0.9911, test_f1: 0.5787
 epoch: 79, train_loss: 0.6205, test_loss: 1.0165, test_f1: 0.5789
 epoch: 80, train_loss: 0.6278, test_loss: 1.0000, test_f1: 0.5631
 epoch: 81, train_loss: 0.6095, test_loss: 0.9596, test_f1: 0.5635
 epoch: 82, train_loss: 0.6022, test_loss: 1.0294, test_f1: 0.5766
 epoch: 83, train_loss: 0.6063, test_loss: 0.9884, test_f1: 0.5785
 epoch: 84, train_loss: 0.5991, test_loss: 1.0253, test_f1: 0.5757
 epoch: 85, train_loss: 0.5795, test_loss: 1.0241, test_f1: 0.5810
 epoch: 86, train_loss: 0.5917, test_loss: 1.0194, test_f1: 0.5989
 epoch: 87, train_loss: 0.5954, test_loss: 1.0038, test_f1: 0.5851
 epoch: 88, train_loss: 0.5969, test_loss: 1.0455, test_f1: 0.5737
 epoch: 89, train_loss: 0.5909, test_loss: 1.0532, test_f1: 0.5667
 epoch: 90, train_loss: 0.6026, test_loss: 1.0260, test_f1: 0.5797
 epoch: 91, train_loss: 0.6080, test_loss: 0.9487, test_f1: 0.6032
 epoch: 92, train_loss: 0.6089, test_loss: 0.9121, test_f1: 0.6061
 epoch: 93, train_loss: 0.5936, test_loss: 1.0277, test_f1: 0.5852
 epoch: 94, train_loss: 0.5836, test_loss: 1.0478, test_f1: 0.5737
 epoch: 95, train_loss: 0.6050, test_loss: 0.9863, test_f1: 0.5874
 epoch: 96, train_loss: 0.5984, test_loss: 1.0256, test_f1: 0.5785
 epoch: 97, train_loss: 0.5927, test_loss: 1.0544, test_f1: 0.5678
 epoch: 98, train_loss: 0.5736, test_loss: 1.0306, test_f1: 0.5854
 epoch: 99, train_loss: 0.5828, test_loss: 1.0289, test_f1: 0.5762
##################ITERATION #1 ****************************************
 epoch: 0, train_loss: 1.2743, test_loss: 1.3046, test_f1: 0.2260
 epoch: 1, train_loss: 1.1871, test_loss: 1.2647, test_f1: 0.2260
 epoch: 2, train_loss: 1.1315, test_loss: 1.1522, test_f1: 0.3370
 epoch: 3, train_loss: 1.0744, test_loss: 1.0550, test_f1: 0.3778
 epoch: 4, train_loss: 1.0348, test_loss: 1.0248, test_f1: 0.4291
 epoch: 5, train_loss: 1.0079, test_loss: 0.9830, test_f1: 0.4476
 epoch: 6, train_loss: 0.9873, test_loss: 0.9720, test_f1: 0.4553
 epoch: 7, train_loss: 0.9675, test_loss: 0.9926, test_f1: 0.4292
 epoch: 8, train_loss: 0.9516, test_loss: 0.9428, test_f1: 0.4773
 epoch: 9, train_loss: 0.9261, test_loss: 0.9620, test_f1: 0.4461
 epoch: 10, train_loss: 0.9129, test_loss: 0.9498, test_f1: 0.4732
 epoch: 11, train_loss: 0.8976, test_loss: 0.9558, test_f1: 0.4774
 epoch: 12, train_loss: 0.8836, test_loss: 0.9474, test_f1: 0.4929
 epoch: 13, train_loss: 0.8832, test_loss: 0.8939, test_f1: 0.5164
 epoch: 14, train_loss: 0.8721, test_loss: 0.9119, test_f1: 0.5022
 epoch: 15, train_loss: 0.8644, test_loss: 0.9015, test_f1: 0.5224
 epoch: 16, train_loss: 0.8474, test_loss: 0.9388, test_f1: 0.5019
 epoch: 17, train_loss: 0.8342, test_loss: 0.8821, test_f1: 0.5273
 epoch: 18, train_loss: 0.8340, test_loss: 0.9624, test_f1: 0.4990
 epoch: 19, train_loss: 0.8146, test_loss: 0.9346, test_f1: 0.5019
 epoch: 20, train_loss: 0.8041, test_loss: 0.9095, test_f1: 0.5350
 epoch: 21, train_loss: 0.8018, test_loss: 0.9092, test_f1: 0.5325
 epoch: 22, train_loss: 0.8089, test_loss: 0.9349, test_f1: 0.5114
 epoch: 23, train_loss: 0.7939, test_loss: 0.9942, test_f1: 0.5005
 epoch: 24, train_loss: 0.7948, test_loss: 0.8766, test_f1: 0.5324
 epoch: 25, train_loss: 0.7780, test_loss: 0.8918, test_f1: 0.5129
 epoch: 26, train_loss: 0.7719, test_loss: 0.8870, test_f1: 0.5520
 epoch: 27, train_loss: 0.7546, test_loss: 0.8907, test_f1: 0.5327
 epoch: 28, train_loss: 0.7484, test_loss: 0.9143, test_f1: 0.5306
 epoch: 29, train_loss: 0.7560, test_loss: 0.8950, test_f1: 0.5315
 epoch: 30, train_loss: 0.7595, test_loss: 1.0230, test_f1: 0.4731
 epoch: 31, train_loss: 0.7585, test_loss: 0.9519, test_f1: 0.5306
 epoch: 32, train_loss: 0.7402, test_loss: 0.9173, test_f1: 0.5416
 epoch: 33, train_loss: 0.7285, test_loss: 0.9830, test_f1: 0.5041
 epoch: 34, train_loss: 0.7218, test_loss: 0.8924, test_f1: 0.5242
 epoch: 35, train_loss: 0.7295, test_loss: 1.1464, test_f1: 0.4626
 epoch: 36, train_loss: 0.7279, test_loss: 1.0125, test_f1: 0.5176
 epoch: 37, train_loss: 0.7147, test_loss: 0.8848, test_f1: 0.5454
 epoch: 38, train_loss: 0.7011, test_loss: 1.0220, test_f1: 0.4859
 epoch: 39, train_loss: 0.6951, test_loss: 1.0467, test_f1: 0.5040
 epoch: 40, train_loss: 0.6882, test_loss: 0.8852, test_f1: 0.5232
 epoch: 41, train_loss: 0.6902, test_loss: 0.8975, test_f1: 0.5552
 epoch: 42, train_loss: 0.6782, test_loss: 0.8807, test_f1: 0.5495
 epoch: 43, train_loss: 0.6783, test_loss: 0.9866, test_f1: 0.5334
 epoch: 44, train_loss: 0.6851, test_loss: 0.8872, test_f1: 0.5561
 epoch: 45, train_loss: 0.6734, test_loss: 0.9699, test_f1: 0.5034
 epoch: 46, train_loss: 0.6545, test_loss: 0.9233, test_f1: 0.5483
 epoch: 47, train_loss: 0.6551, test_loss: 1.0600, test_f1: 0.5122
 epoch: 48, train_loss: 0.6538, test_loss: 0.9384, test_f1: 0.5310
 epoch: 49, train_loss: 0.6444, test_loss: 0.9167, test_f1: 0.5387
 epoch: 50, train_loss: 0.6445, test_loss: 0.8779, test_f1: 0.5430
 epoch: 51, train_loss: 0.6267, test_loss: 0.9768, test_f1: 0.5189
 epoch: 52, train_loss: 0.6257, test_loss: 0.9776, test_f1: 0.5441
 epoch: 53, train_loss: 0.6065, test_loss: 0.9453, test_f1: 0.5355
 epoch: 54, train_loss: 0.6041, test_loss: 0.9113, test_f1: 0.5483
 epoch: 55, train_loss: 0.6080, test_loss: 1.0833, test_f1: 0.5169
 epoch: 56, train_loss: 0.6119, test_loss: 0.9495, test_f1: 0.5435
 epoch: 57, train_loss: 0.5989, test_loss: 0.9883, test_f1: 0.5479
 epoch: 58, train_loss: 0.5990, test_loss: 0.9544, test_f1: 0.5442
 epoch: 59, train_loss: 0.6002, test_loss: 0.8925, test_f1: 0.5648
 epoch: 60, train_loss: 0.6031, test_loss: 0.9156, test_f1: 0.5654
 epoch: 61, train_loss: 0.6011, test_loss: 1.0218, test_f1: 0.5353
 epoch: 62, train_loss: 0.5834, test_loss: 0.9665, test_f1: 0.5496
 epoch: 63, train_loss: 0.5924, test_loss: 0.9977, test_f1: 0.5454
 epoch: 64, train_loss: 0.5859, test_loss: 0.9614, test_f1: 0.5538
 epoch: 65, train_loss: 0.5776, test_loss: 0.9791, test_f1: 0.5549
 epoch: 66, train_loss: 0.5969, test_loss: 1.1170, test_f1: 0.5168
 epoch: 67, train_loss: 0.5901, test_loss: 0.9593, test_f1: 0.5601
 epoch: 68, train_loss: 0.5843, test_loss: 1.0296, test_f1: 0.5383
 epoch: 69, train_loss: 0.5653, test_loss: 1.0117, test_f1: 0.5483
 epoch: 70, train_loss: 0.5759, test_loss: 1.0074, test_f1: 0.5656
 epoch: 71, train_loss: 0.5973, test_loss: 0.9062, test_f1: 0.5650
 epoch: 72, train_loss: 0.5867, test_loss: 0.9666, test_f1: 0.5611
 epoch: 73, train_loss: 0.5865, test_loss: 0.9362, test_f1: 0.5671
 epoch: 74, train_loss: 0.5755, test_loss: 0.9471, test_f1: 0.5607
 epoch: 75, train_loss: 0.5759, test_loss: 1.0428, test_f1: 0.5458
 epoch: 76, train_loss: 0.5518, test_loss: 0.9584, test_f1: 0.5629
 epoch: 77, train_loss: 0.5569, test_loss: 1.0377, test_f1: 0.5458
 epoch: 78, train_loss: 0.5699, test_loss: 0.9415, test_f1: 0.5639
 epoch: 79, train_loss: 0.5655, test_loss: 1.0639, test_f1: 0.5500
 epoch: 80, train_loss: 0.5701, test_loss: 1.0568, test_f1: 0.5550
 epoch: 81, train_loss: 0.5702, test_loss: 0.9866, test_f1: 0.5656
 epoch: 82, train_loss: 0.5612, test_loss: 0.9711, test_f1: 0.5633
 epoch: 83, train_loss: 0.5471, test_loss: 0.9807, test_f1: 0.5545
 epoch: 84, train_loss: 0.5595, test_loss: 1.0620, test_f1: 0.5771
 epoch: 85, train_loss: 0.5495, test_loss: 0.9677, test_f1: 0.5671
 epoch: 86, train_loss: 0.5475, test_loss: 1.0906, test_f1: 0.5488
 epoch: 87, train_loss: 0.5477, test_loss: 0.9939, test_f1: 0.5499
 epoch: 88, train_loss: 0.5498, test_loss: 1.0933, test_f1: 0.5540
 epoch: 89, train_loss: 0.5575, test_loss: 1.0978, test_f1: 0.5470
 epoch: 90, train_loss: 0.5482, test_loss: 0.9830, test_f1: 0.5681
 epoch: 91, train_loss: 0.5462, test_loss: 0.9913, test_f1: 0.5777
 epoch: 92, train_loss: 0.5422, test_loss: 1.0509, test_f1: 0.5645
 epoch: 93, train_loss: 0.5278, test_loss: 0.9466, test_f1: 0.5869
 epoch: 94, train_loss: 0.5429, test_loss: 1.0486, test_f1: 0.5633
 epoch: 95, train_loss: 0.5299, test_loss: 1.0058, test_f1: 0.5860
 epoch: 96, train_loss: 0.5311, test_loss: 1.0377, test_f1: 0.5450
 epoch: 97, train_loss: 0.5352, test_loss: 0.9308, test_f1: 0.5840
 epoch: 98, train_loss: 0.5393, test_loss: 1.0421, test_f1: 0.5466
 epoch: 99, train_loss: 0.5362, test_loss: 0.9441, test_f1: 0.5927
##################ITERATION #2 ****************************************
 epoch: 0, train_loss: 1.2538, test_loss: 1.2968, test_f1: 0.2260
 epoch: 1, train_loss: 1.1487, test_loss: 1.2685, test_f1: 0.2772
 epoch: 2, train_loss: 1.0771, test_loss: 1.2397, test_f1: 0.2821
 epoch: 3, train_loss: 1.0318, test_loss: 1.2353, test_f1: 0.2906
 epoch: 4, train_loss: 0.9889, test_loss: 1.1335, test_f1: 0.3735
 epoch: 5, train_loss: 0.9708, test_loss: 1.0140, test_f1: 0.4255
 epoch: 6, train_loss: 0.9532, test_loss: 0.9795, test_f1: 0.4700
 epoch: 7, train_loss: 0.9312, test_loss: 0.9517, test_f1: 0.5095
 epoch: 8, train_loss: 0.9101, test_loss: 0.9660, test_f1: 0.4847
 epoch: 9, train_loss: 0.9063, test_loss: 0.9246, test_f1: 0.5077
 epoch: 10, train_loss: 0.8927, test_loss: 0.8830, test_f1: 0.5233
 epoch: 11, train_loss: 0.8779, test_loss: 0.8704, test_f1: 0.5224
 epoch: 12, train_loss: 0.8608, test_loss: 0.8883, test_f1: 0.5155
 epoch: 13, train_loss: 0.8567, test_loss: 0.8550, test_f1: 0.5359
 epoch: 14, train_loss: 0.8364, test_loss: 0.8881, test_f1: 0.5247
 epoch: 15, train_loss: 0.8277, test_loss: 0.8637, test_f1: 0.5220
 epoch: 16, train_loss: 0.8257, test_loss: 0.8423, test_f1: 0.5402
 epoch: 17, train_loss: 0.8255, test_loss: 0.8279, test_f1: 0.5561
 epoch: 18, train_loss: 0.8129, test_loss: 0.8803, test_f1: 0.5053
 epoch: 19, train_loss: 0.8047, test_loss: 0.8340, test_f1: 0.5312
 epoch: 20, train_loss: 0.7944, test_loss: 0.8228, test_f1: 0.5686
 epoch: 21, train_loss: 0.7811, test_loss: 0.8188, test_f1: 0.5473
 epoch: 22, train_loss: 0.7685, test_loss: 0.8366, test_f1: 0.5417
 epoch: 23, train_loss: 0.7763, test_loss: 0.8391, test_f1: 0.5503
 epoch: 24, train_loss: 0.7684, test_loss: 0.8116, test_f1: 0.5370
 epoch: 25, train_loss: 0.7568, test_loss: 0.8264, test_f1: 0.5373
 epoch: 26, train_loss: 0.7455, test_loss: 0.8305, test_f1: 0.5493
 epoch: 27, train_loss: 0.7480, test_loss: 0.8528, test_f1: 0.5358
 epoch: 28, train_loss: 0.7326, test_loss: 0.8243, test_f1: 0.5380
 epoch: 29, train_loss: 0.7315, test_loss: 0.7997, test_f1: 0.5646
 epoch: 30, train_loss: 0.7212, test_loss: 0.8109, test_f1: 0.5697
 epoch: 31, train_loss: 0.7234, test_loss: 0.8522, test_f1: 0.5442
 epoch: 32, train_loss: 0.7185, test_loss: 0.8264, test_f1: 0.5667
 epoch: 33, train_loss: 0.7137, test_loss: 0.8315, test_f1: 0.5734
 epoch: 34, train_loss: 0.7071, test_loss: 0.8279, test_f1: 0.5664
 epoch: 35, train_loss: 0.7000, test_loss: 0.8186, test_f1: 0.5837
 epoch: 36, train_loss: 0.6913, test_loss: 0.8063, test_f1: 0.5711
 epoch: 37, train_loss: 0.6999, test_loss: 0.8422, test_f1: 0.5843
 epoch: 38, train_loss: 0.6704, test_loss: 0.8324, test_f1: 0.5729
 epoch: 39, train_loss: 0.6868, test_loss: 0.8540, test_f1: 0.5718
 epoch: 40, train_loss: 0.6826, test_loss: 0.8333, test_f1: 0.5657
 epoch: 41, train_loss: 0.6737, test_loss: 0.8433, test_f1: 0.5777
 epoch: 42, train_loss: 0.6587, test_loss: 0.8481, test_f1: 0.5701
 epoch: 43, train_loss: 0.6591, test_loss: 0.8495, test_f1: 0.5599
 epoch: 44, train_loss: 0.6471, test_loss: 0.9338, test_f1: 0.5409
 epoch: 45, train_loss: 0.6612, test_loss: 0.8250, test_f1: 0.5860
 epoch: 46, train_loss: 0.6463, test_loss: 0.8367, test_f1: 0.5789
 epoch: 47, train_loss: 0.6411, test_loss: 0.8782, test_f1: 0.5783
 epoch: 48, train_loss: 0.6461, test_loss: 0.8192, test_f1: 0.5825
 epoch: 49, train_loss: 0.6301, test_loss: 0.9109, test_f1: 0.5607
 epoch: 50, train_loss: 0.6236, test_loss: 0.8757, test_f1: 0.5763
 epoch: 51, train_loss: 0.6160, test_loss: 0.8667, test_f1: 0.5692
 epoch: 52, train_loss: 0.6040, test_loss: 0.8542, test_f1: 0.5700
 epoch: 53, train_loss: 0.5954, test_loss: 0.8254, test_f1: 0.5835
 epoch: 54, train_loss: 0.5966, test_loss: 0.8400, test_f1: 0.5813
 epoch: 55, train_loss: 0.5825, test_loss: 0.8103, test_f1: 0.5864
 epoch: 56, train_loss: 0.5758, test_loss: 0.8433, test_f1: 0.5914
 epoch: 57, train_loss: 0.5713, test_loss: 0.8804, test_f1: 0.5936
 epoch: 58, train_loss: 0.5810, test_loss: 0.8752, test_f1: 0.5679
 epoch: 59, train_loss: 0.5878, test_loss: 0.8770, test_f1: 0.5771
 epoch: 60, train_loss: 0.5661, test_loss: 0.8219, test_f1: 0.5951
 epoch: 61, train_loss: 0.5744, test_loss: 0.9172, test_f1: 0.5650
 epoch: 62, train_loss: 0.5619, test_loss: 0.8433, test_f1: 0.6105
 epoch: 63, train_loss: 0.5676, test_loss: 0.9265, test_f1: 0.5662
 epoch: 64, train_loss: 0.5533, test_loss: 0.9144, test_f1: 0.5700
 epoch: 65, train_loss: 0.5735, test_loss: 0.8663, test_f1: 0.6064
 epoch: 66, train_loss: 0.5504, test_loss: 0.9311, test_f1: 0.5766
 epoch: 67, train_loss: 0.5631, test_loss: 0.9652, test_f1: 0.5614
 epoch: 68, train_loss: 0.5527, test_loss: 0.9107, test_f1: 0.5711
 epoch: 69, train_loss: 0.5524, test_loss: 0.8775, test_f1: 0.6060
 epoch: 70, train_loss: 0.5537, test_loss: 0.9035, test_f1: 0.5918
 epoch: 71, train_loss: 0.5498, test_loss: 0.8912, test_f1: 0.5755
 epoch: 72, train_loss: 0.5507, test_loss: 0.9335, test_f1: 0.5706
 epoch: 73, train_loss: 0.5356, test_loss: 0.9283, test_f1: 0.5896
 epoch: 74, train_loss: 0.5335, test_loss: 0.9045, test_f1: 0.5944
 epoch: 75, train_loss: 0.5378, test_loss: 0.8695, test_f1: 0.6053
 epoch: 76, train_loss: 0.5281, test_loss: 0.9033, test_f1: 0.5945
 epoch: 77, train_loss: 0.5231, test_loss: 0.9225, test_f1: 0.5832
 epoch: 78, train_loss: 0.5143, test_loss: 0.9651, test_f1: 0.5702
 epoch: 79, train_loss: 0.5143, test_loss: 0.9567, test_f1: 0.5811
 epoch: 80, train_loss: 0.5210, test_loss: 0.9751, test_f1: 0.5835
 epoch: 81, train_loss: 0.5166, test_loss: 0.9401, test_f1: 0.5953
 epoch: 82, train_loss: 0.5274, test_loss: 0.9560, test_f1: 0.5961
 epoch: 83, train_loss: 0.5318, test_loss: 0.8978, test_f1: 0.6037
 epoch: 84, train_loss: 0.5332, test_loss: 0.9336, test_f1: 0.5963
 epoch: 85, train_loss: 0.5122, test_loss: 0.9678, test_f1: 0.5980
 epoch: 86, train_loss: 0.5167, test_loss: 0.9473, test_f1: 0.5807
 epoch: 87, train_loss: 0.5083, test_loss: 0.9140, test_f1: 0.5948
 epoch: 88, train_loss: 0.5271, test_loss: 0.9497, test_f1: 0.5816
 epoch: 89, train_loss: 0.5232, test_loss: 0.9728, test_f1: 0.6007
 epoch: 90, train_loss: 0.5111, test_loss: 0.9032, test_f1: 0.6056
 epoch: 91, train_loss: 0.5126, test_loss: 0.9105, test_f1: 0.6097
 epoch: 92, train_loss: 0.5101, test_loss: 0.9493, test_f1: 0.5973
 epoch: 93, train_loss: 0.4870, test_loss: 0.9980, test_f1: 0.5917
 epoch: 94, train_loss: 0.5019, test_loss: 0.9573, test_f1: 0.6030
 epoch: 95, train_loss: 0.5078, test_loss: 0.9489, test_f1: 0.5867
 epoch: 96, train_loss: 0.5052, test_loss: 1.0362, test_f1: 0.5829
 epoch: 97, train_loss: 0.4979, test_loss: 0.9374, test_f1: 0.6063
 epoch: 98, train_loss: 0.4887, test_loss: 1.0446, test_f1: 0.5899
 epoch: 99, train_loss: 0.4966, test_loss: 0.9594, test_f1: 0.6138
##################ITERATION #3 ****************************************
 epoch: 0, train_loss: 1.2320, test_loss: 1.3560, test_f1: 0.2260
 epoch: 1, train_loss: 1.1168, test_loss: 1.3446, test_f1: 0.2260
 epoch: 2, train_loss: 1.0720, test_loss: 1.2443, test_f1: 0.2410
 epoch: 3, train_loss: 1.0307, test_loss: 1.0822, test_f1: 0.3758
 epoch: 4, train_loss: 1.0032, test_loss: 1.0139, test_f1: 0.4003
 epoch: 5, train_loss: 0.9727, test_loss: 0.9651, test_f1: 0.4228
 epoch: 6, train_loss: 0.9645, test_loss: 0.9575, test_f1: 0.4700
 epoch: 7, train_loss: 0.9525, test_loss: 0.9327, test_f1: 0.4827
 epoch: 8, train_loss: 0.9270, test_loss: 0.9117, test_f1: 0.5352
 epoch: 9, train_loss: 0.9204, test_loss: 0.9263, test_f1: 0.5246
 epoch: 10, train_loss: 0.9067, test_loss: 0.9402, test_f1: 0.5061
 epoch: 11, train_loss: 0.9052, test_loss: 1.0796, test_f1: 0.4693
 epoch: 12, train_loss: 0.8783, test_loss: 0.8836, test_f1: 0.5409
 epoch: 13, train_loss: 0.8597, test_loss: 0.8624, test_f1: 0.5630
 epoch: 14, train_loss: 0.8419, test_loss: 0.9037, test_f1: 0.5418
 epoch: 15, train_loss: 0.8383, test_loss: 0.9410, test_f1: 0.5306
 epoch: 16, train_loss: 0.8246, test_loss: 0.9049, test_f1: 0.5574
 epoch: 17, train_loss: 0.8236, test_loss: 0.9216, test_f1: 0.5482
 epoch: 18, train_loss: 0.8070, test_loss: 0.9080, test_f1: 0.5523
 epoch: 19, train_loss: 0.7957, test_loss: 0.8998, test_f1: 0.5551
 epoch: 20, train_loss: 0.7798, test_loss: 0.9251, test_f1: 0.5421
 epoch: 21, train_loss: 0.7700, test_loss: 0.9006, test_f1: 0.5549
 epoch: 22, train_loss: 0.7698, test_loss: 0.9137, test_f1: 0.5613
 epoch: 23, train_loss: 0.7567, test_loss: 0.9432, test_f1: 0.5497
 epoch: 24, train_loss: 0.7426, test_loss: 0.9801, test_f1: 0.5540
 epoch: 25, train_loss: 0.7451, test_loss: 0.9359, test_f1: 0.5503
 epoch: 26, train_loss: 0.7359, test_loss: 0.9594, test_f1: 0.5370
 epoch: 27, train_loss: 0.7226, test_loss: 0.9333, test_f1: 0.5505
 epoch: 28, train_loss: 0.7164, test_loss: 0.9759, test_f1: 0.5696
 epoch: 29, train_loss: 0.7072, test_loss: 0.9163, test_f1: 0.5719
 epoch: 30, train_loss: 0.7058, test_loss: 1.0525, test_f1: 0.5661
 epoch: 31, train_loss: 0.7126, test_loss: 0.9769, test_f1: 0.5531
 epoch: 32, train_loss: 0.6965, test_loss: 1.0275, test_f1: 0.5542
 epoch: 33, train_loss: 0.6916, test_loss: 0.9585, test_f1: 0.5889
 epoch: 34, train_loss: 0.6832, test_loss: 0.9580, test_f1: 0.5693
 epoch: 35, train_loss: 0.6687, test_loss: 0.9784, test_f1: 0.5747
 epoch: 36, train_loss: 0.6846, test_loss: 0.9948, test_f1: 0.5526
 epoch: 37, train_loss: 0.6553, test_loss: 1.0629, test_f1: 0.5646
 epoch: 38, train_loss: 0.6760, test_loss: 1.0388, test_f1: 0.5900
 epoch: 39, train_loss: 0.6638, test_loss: 0.9982, test_f1: 0.5854
 epoch: 40, train_loss: 0.6477, test_loss: 1.0205, test_f1: 0.5759
 epoch: 41, train_loss: 0.6471, test_loss: 1.0769, test_f1: 0.5789
 epoch: 42, train_loss: 0.6377, test_loss: 0.9931, test_f1: 0.5668
 epoch: 43, train_loss: 0.6398, test_loss: 1.0061, test_f1: 0.5862
 epoch: 44, train_loss: 0.6232, test_loss: 1.0477, test_f1: 0.5548
 epoch: 45, train_loss: 0.6244, test_loss: 0.9681, test_f1: 0.6105
 epoch: 46, train_loss: 0.6293, test_loss: 1.0926, test_f1: 0.5758
 epoch: 47, train_loss: 0.6224, test_loss: 0.9501, test_f1: 0.5858
 epoch: 48, train_loss: 0.5964, test_loss: 1.0399, test_f1: 0.5969
 epoch: 49, train_loss: 0.5958, test_loss: 1.1368, test_f1: 0.5980
 epoch: 50, train_loss: 0.6065, test_loss: 1.0206, test_f1: 0.5891
 epoch: 51, train_loss: 0.5917, test_loss: 1.0190, test_f1: 0.6131
 epoch: 52, train_loss: 0.5849, test_loss: 1.0342, test_f1: 0.6168
 epoch: 53, train_loss: 0.5672, test_loss: 1.0431, test_f1: 0.6107
 epoch: 54, train_loss: 0.5640, test_loss: 1.0155, test_f1: 0.6303
 epoch: 55, train_loss: 0.5567, test_loss: 1.0418, test_f1: 0.6056
 epoch: 56, train_loss: 0.5653, test_loss: 1.0256, test_f1: 0.6350
 epoch: 57, train_loss: 0.5470, test_loss: 1.1441, test_f1: 0.6218
 epoch: 58, train_loss: 0.5580, test_loss: 1.1005, test_f1: 0.6129
 epoch: 59, train_loss: 0.5422, test_loss: 1.0670, test_f1: 0.6066
 epoch: 60, train_loss: 0.5445, test_loss: 1.0605, test_f1: 0.6103
 epoch: 61, train_loss: 0.5586, test_loss: 1.1237, test_f1: 0.6014
 epoch: 62, train_loss: 0.5522, test_loss: 1.1336, test_f1: 0.5793
 epoch: 63, train_loss: 0.5381, test_loss: 1.0642, test_f1: 0.6130
 epoch: 64, train_loss: 0.5286, test_loss: 1.1214, test_f1: 0.6074
 epoch: 65, train_loss: 0.5452, test_loss: 1.1374, test_f1: 0.6225
 epoch: 66, train_loss: 0.5157, test_loss: 1.1702, test_f1: 0.5880
 epoch: 67, train_loss: 0.5339, test_loss: 1.0785, test_f1: 0.6066
 epoch: 68, train_loss: 0.5262, test_loss: 1.2269, test_f1: 0.5811
 epoch: 69, train_loss: 0.5264, test_loss: 1.0917, test_f1: 0.5932
 epoch: 70, train_loss: 0.5226, test_loss: 1.1394, test_f1: 0.5993
 epoch: 71, train_loss: 0.5115, test_loss: 1.0735, test_f1: 0.6292
 epoch: 72, train_loss: 0.5266, test_loss: 1.1256, test_f1: 0.5896
 epoch: 73, train_loss: 0.5270, test_loss: 1.1021, test_f1: 0.6189
 epoch: 74, train_loss: 0.5207, test_loss: 1.1592, test_f1: 0.5747
 epoch: 75, train_loss: 0.5073, test_loss: 1.1688, test_f1: 0.5815
 epoch: 76, train_loss: 0.5280, test_loss: 1.1262, test_f1: 0.5875
 epoch: 77, train_loss: 0.5019, test_loss: 1.1379, test_f1: 0.5877
 epoch: 78, train_loss: 0.5130, test_loss: 1.1465, test_f1: 0.6109
 epoch: 79, train_loss: 0.4897, test_loss: 1.2357, test_f1: 0.5858
 epoch: 80, train_loss: 0.4951, test_loss: 1.1589, test_f1: 0.5950
 epoch: 81, train_loss: 0.4983, test_loss: 1.2187, test_f1: 0.5971
 epoch: 82, train_loss: 0.4866, test_loss: 1.2107, test_f1: 0.5909
 epoch: 83, train_loss: 0.4839, test_loss: 1.3169, test_f1: 0.5732
 epoch: 84, train_loss: 0.4694, test_loss: 1.1722, test_f1: 0.5789
 epoch: 85, train_loss: 0.4889, test_loss: 1.2753, test_f1: 0.5859
 epoch: 86, train_loss: 0.4786, test_loss: 1.2417, test_f1: 0.5864
 epoch: 87, train_loss: 0.4739, test_loss: 1.2303, test_f1: 0.5982
 epoch: 88, train_loss: 0.4855, test_loss: 1.2897, test_f1: 0.5824
 epoch: 89, train_loss: 0.4817, test_loss: 1.1697, test_f1: 0.5941
 epoch: 90, train_loss: 0.4781, test_loss: 1.3106, test_f1: 0.5618
 epoch: 91, train_loss: 0.4687, test_loss: 1.2825, test_f1: 0.5657
 epoch: 92, train_loss: 0.4604, test_loss: 1.1978, test_f1: 0.5885
 epoch: 93, train_loss: 0.4737, test_loss: 1.2260, test_f1: 0.5843
 epoch: 94, train_loss: 0.4670, test_loss: 1.3105, test_f1: 0.5741
 epoch: 95, train_loss: 0.4686, test_loss: 1.2388, test_f1: 0.5840
 epoch: 96, train_loss: 0.4711, test_loss: 1.3236, test_f1: 0.5783
 epoch: 97, train_loss: 0.4711, test_loss: 1.2851, test_f1: 0.5889
 epoch: 98, train_loss: 0.4684, test_loss: 1.2755, test_f1: 0.5696
 epoch: 99, train_loss: 0.4652, test_loss: 1.2497, test_f1: 0.5817
##################ITERATION #4 ****************************************
 epoch: 0, train_loss: 1.3076, test_loss: 1.3522, test_f1: 0.2260
 epoch: 1, train_loss: 1.1463, test_loss: 1.2372, test_f1: 0.2260
 epoch: 2, train_loss: 1.0954, test_loss: 1.1455, test_f1: 0.3238
 epoch: 3, train_loss: 1.0430, test_loss: 1.0870, test_f1: 0.3735
 epoch: 4, train_loss: 1.0070, test_loss: 1.0158, test_f1: 0.4308
 epoch: 5, train_loss: 0.9777, test_loss: 0.9601, test_f1: 0.4462
 epoch: 6, train_loss: 0.9595, test_loss: 0.9414, test_f1: 0.4777
 epoch: 7, train_loss: 0.9395, test_loss: 0.9631, test_f1: 0.4889
 epoch: 8, train_loss: 0.9269, test_loss: 0.9300, test_f1: 0.4896
 epoch: 9, train_loss: 0.9154, test_loss: 0.9188, test_f1: 0.4948
 epoch: 10, train_loss: 0.8986, test_loss: 0.9383, test_f1: 0.5121
 epoch: 11, train_loss: 0.8868, test_loss: 0.9969, test_f1: 0.4876
 epoch: 12, train_loss: 0.8794, test_loss: 0.9455, test_f1: 0.5200
 epoch: 13, train_loss: 0.8706, test_loss: 0.9203, test_f1: 0.5222
 epoch: 14, train_loss: 0.8563, test_loss: 0.8919, test_f1: 0.5234
 epoch: 15, train_loss: 0.8495, test_loss: 0.9316, test_f1: 0.5115
 epoch: 16, train_loss: 0.8306, test_loss: 0.9315, test_f1: 0.4964
 epoch: 17, train_loss: 0.8184, test_loss: 0.8842, test_f1: 0.5430
 epoch: 18, train_loss: 0.8173, test_loss: 0.8859, test_f1: 0.5546
 epoch: 19, train_loss: 0.8199, test_loss: 0.9378, test_f1: 0.5268
 epoch: 20, train_loss: 0.8055, test_loss: 0.8635, test_f1: 0.5497
 epoch: 21, train_loss: 0.8111, test_loss: 0.9113, test_f1: 0.5423
 epoch: 22, train_loss: 0.7979, test_loss: 0.9246, test_f1: 0.5264
 epoch: 23, train_loss: 0.7820, test_loss: 0.9028, test_f1: 0.5401
 epoch: 24, train_loss: 0.7817, test_loss: 0.9015, test_f1: 0.5549
 epoch: 25, train_loss: 0.7793, test_loss: 0.9132, test_f1: 0.5630
 epoch: 26, train_loss: 0.7687, test_loss: 0.9106, test_f1: 0.5347
 epoch: 27, train_loss: 0.7708, test_loss: 0.8942, test_f1: 0.5641
 epoch: 28, train_loss: 0.7672, test_loss: 0.8959, test_f1: 0.5782
 epoch: 29, train_loss: 0.7548, test_loss: 0.9083, test_f1: 0.5680
 epoch: 30, train_loss: 0.7591, test_loss: 0.9059, test_f1: 0.5562
 epoch: 31, train_loss: 0.7474, test_loss: 0.9740, test_f1: 0.5559
 epoch: 32, train_loss: 0.7371, test_loss: 0.9860, test_f1: 0.5374
 epoch: 33, train_loss: 0.7392, test_loss: 0.9258, test_f1: 0.5568
 epoch: 34, train_loss: 0.7163, test_loss: 0.9309, test_f1: 0.5501
 epoch: 35, train_loss: 0.7229, test_loss: 0.9232, test_f1: 0.5429
 epoch: 36, train_loss: 0.7187, test_loss: 0.8510, test_f1: 0.5725
 epoch: 37, train_loss: 0.7198, test_loss: 0.9246, test_f1: 0.5490
 epoch: 38, train_loss: 0.6944, test_loss: 0.9025, test_f1: 0.5582
 epoch: 39, train_loss: 0.6971, test_loss: 0.9207, test_f1: 0.5715
 epoch: 40, train_loss: 0.6957, test_loss: 0.9128, test_f1: 0.5631
 epoch: 41, train_loss: 0.6881, test_loss: 0.9122, test_f1: 0.5703
 epoch: 42, train_loss: 0.6832, test_loss: 0.8754, test_f1: 0.5799
 epoch: 43, train_loss: 0.6861, test_loss: 0.8746, test_f1: 0.5852
 epoch: 44, train_loss: 0.6859, test_loss: 0.9340, test_f1: 0.5494
 epoch: 45, train_loss: 0.6736, test_loss: 0.9422, test_f1: 0.5697
 epoch: 46, train_loss: 0.6732, test_loss: 0.9633, test_f1: 0.5529
 epoch: 47, train_loss: 0.6642, test_loss: 1.0298, test_f1: 0.5467
 epoch: 48, train_loss: 0.6557, test_loss: 0.9127, test_f1: 0.5609
 epoch: 49, train_loss: 0.6654, test_loss: 0.9142, test_f1: 0.5741
 epoch: 50, train_loss: 0.6520, test_loss: 1.0465, test_f1: 0.5601
 epoch: 51, train_loss: 0.6514, test_loss: 0.9435, test_f1: 0.5781
 epoch: 52, train_loss: 0.6247, test_loss: 0.9191, test_f1: 0.5788
 epoch: 53, train_loss: 0.6208, test_loss: 0.9522, test_f1: 0.5787
 epoch: 54, train_loss: 0.6197, test_loss: 0.9185, test_f1: 0.5702
 epoch: 55, train_loss: 0.6227, test_loss: 0.9825, test_f1: 0.5660
 epoch: 56, train_loss: 0.6116, test_loss: 0.9612, test_f1: 0.5669
 epoch: 57, train_loss: 0.6003, test_loss: 0.9951, test_f1: 0.5561
 epoch: 58, train_loss: 0.6111, test_loss: 0.9871, test_f1: 0.5663
 epoch: 59, train_loss: 0.6116, test_loss: 0.9999, test_f1: 0.5747
 epoch: 60, train_loss: 0.6057, test_loss: 1.0122, test_f1: 0.5649
 epoch: 61, train_loss: 0.6066, test_loss: 1.0460, test_f1: 0.5690
 epoch: 62, train_loss: 0.6052, test_loss: 0.9625, test_f1: 0.5816
 epoch: 63, train_loss: 0.5973, test_loss: 1.0119, test_f1: 0.5745
 epoch: 64, train_loss: 0.5960, test_loss: 1.0242, test_f1: 0.5701
 epoch: 65, train_loss: 0.6087, test_loss: 0.9809, test_f1: 0.5772
 epoch: 66, train_loss: 0.5911, test_loss: 1.0490, test_f1: 0.5658
 epoch: 67, train_loss: 0.5970, test_loss: 1.0455, test_f1: 0.5753
 epoch: 68, train_loss: 0.5881, test_loss: 1.0269, test_f1: 0.5759
 epoch: 69, train_loss: 0.5918, test_loss: 1.0672, test_f1: 0.5598
 epoch: 70, train_loss: 0.5805, test_loss: 0.9857, test_f1: 0.5755
 epoch: 71, train_loss: 0.5842, test_loss: 1.0851, test_f1: 0.5709
 epoch: 72, train_loss: 0.5799, test_loss: 1.0488, test_f1: 0.5722
 epoch: 73, train_loss: 0.5888, test_loss: 1.1172, test_f1: 0.5658
 epoch: 74, train_loss: 0.5864, test_loss: 1.1544, test_f1: 0.5346
 epoch: 75, train_loss: 0.5788, test_loss: 1.0538, test_f1: 0.5677
 epoch: 76, train_loss: 0.5781, test_loss: 1.0554, test_f1: 0.5711
 epoch: 77, train_loss: 0.5792, test_loss: 1.0467, test_f1: 0.5636
 epoch: 78, train_loss: 0.5736, test_loss: 1.0880, test_f1: 0.5659
 epoch: 79, train_loss: 0.5822, test_loss: 1.0511, test_f1: 0.5789
 epoch: 80, train_loss: 0.5668, test_loss: 1.1026, test_f1: 0.5761
 epoch: 81, train_loss: 0.5685, test_loss: 1.0905, test_f1: 0.5709
 epoch: 82, train_loss: 0.5620, test_loss: 1.1156, test_f1: 0.5662
 epoch: 83, train_loss: 0.5850, test_loss: 1.0734, test_f1: 0.5747
 epoch: 84, train_loss: 0.5661, test_loss: 1.1032, test_f1: 0.5874
 epoch: 85, train_loss: 0.5644, test_loss: 1.1081, test_f1: 0.5774
 epoch: 86, train_loss: 0.5647, test_loss: 1.0792, test_f1: 0.5858
 epoch: 87, train_loss: 0.5686, test_loss: 1.1810, test_f1: 0.5685
 epoch: 88, train_loss: 0.5630, test_loss: 1.0875, test_f1: 0.5722
 epoch: 89, train_loss: 0.5424, test_loss: 1.2245, test_f1: 0.5518
 epoch: 90, train_loss: 0.5652, test_loss: 1.4024, test_f1: 0.5524
 epoch: 91, train_loss: 0.5437, test_loss: 1.1758, test_f1: 0.5595
 epoch: 92, train_loss: 0.5404, test_loss: 1.0513, test_f1: 0.5783
 epoch: 93, train_loss: 0.5646, test_loss: 1.5049, test_f1: 0.5300
 epoch: 94, train_loss: 0.5375, test_loss: 1.1504, test_f1: 0.5866
 epoch: 95, train_loss: 0.5328, test_loss: 1.1628, test_f1: 0.5703
 epoch: 96, train_loss: 0.5317, test_loss: 1.3170, test_f1: 0.5517
 epoch: 97, train_loss: 0.5494, test_loss: 1.2554, test_f1: 0.5561
 epoch: 98, train_loss: 0.5372, test_loss: 1.1161, test_f1: 0.5793
 epoch: 99, train_loss: 0.5157, test_loss: 1.2234, test_f1: 0.5668
##################ITERATION #5 ****************************************
 epoch: 0, train_loss: 1.2502, test_loss: 1.4194, test_f1: 0.2260
 epoch: 1, train_loss: 1.0989, test_loss: 1.4565, test_f1: 0.2849
 epoch: 2, train_loss: 1.0631, test_loss: 1.4439, test_f1: 0.2562
 epoch: 3, train_loss: 1.0268, test_loss: 1.2070, test_f1: 0.3450
 epoch: 4, train_loss: 1.0060, test_loss: 1.1162, test_f1: 0.4011
 epoch: 5, train_loss: 0.9846, test_loss: 1.0475, test_f1: 0.4395
 epoch: 6, train_loss: 0.9688, test_loss: 1.0168, test_f1: 0.4705
 epoch: 7, train_loss: 0.9464, test_loss: 0.9611, test_f1: 0.5422
 epoch: 8, train_loss: 0.9373, test_loss: 0.9405, test_f1: 0.5233
 epoch: 9, train_loss: 0.9365, test_loss: 0.9293, test_f1: 0.5426
 epoch: 10, train_loss: 0.9087, test_loss: 0.9656, test_f1: 0.5422
 epoch: 11, train_loss: 0.9043, test_loss: 0.9720, test_f1: 0.5194
 epoch: 12, train_loss: 0.9030, test_loss: 0.9453, test_f1: 0.5122
 epoch: 13, train_loss: 0.8941, test_loss: 0.9168, test_f1: 0.5346
 epoch: 14, train_loss: 0.8816, test_loss: 1.0039, test_f1: 0.5013
 epoch: 15, train_loss: 0.8707, test_loss: 0.9288, test_f1: 0.5377
 epoch: 16, train_loss: 0.8674, test_loss: 0.9291, test_f1: 0.5381
 epoch: 17, train_loss: 0.8469, test_loss: 0.8979, test_f1: 0.5519
 epoch: 18, train_loss: 0.8453, test_loss: 0.9192, test_f1: 0.5606
 epoch: 19, train_loss: 0.8424, test_loss: 0.9243, test_f1: 0.5490
 epoch: 20, train_loss: 0.8431, test_loss: 0.9453, test_f1: 0.5037
 epoch: 21, train_loss: 0.8251, test_loss: 0.9166, test_f1: 0.5286
 epoch: 22, train_loss: 0.8278, test_loss: 0.9479, test_f1: 0.5352
 epoch: 23, train_loss: 0.8189, test_loss: 0.8984, test_f1: 0.5304
 epoch: 24, train_loss: 0.8127, test_loss: 0.9789, test_f1: 0.5194
 epoch: 25, train_loss: 0.8096, test_loss: 0.9113, test_f1: 0.5347
 epoch: 26, train_loss: 0.8049, test_loss: 0.8785, test_f1: 0.5651
 epoch: 27, train_loss: 0.8058, test_loss: 0.8974, test_f1: 0.5345
 epoch: 28, train_loss: 0.7857, test_loss: 1.0730, test_f1: 0.5051
 epoch: 29, train_loss: 0.7870, test_loss: 1.0329, test_f1: 0.4692
 epoch: 30, train_loss: 0.7849, test_loss: 0.9660, test_f1: 0.5632
 epoch: 31, train_loss: 0.7741, test_loss: 0.9526, test_f1: 0.5339
 epoch: 32, train_loss: 0.7816, test_loss: 0.8938, test_f1: 0.5569
 epoch: 33, train_loss: 0.7827, test_loss: 0.9684, test_f1: 0.5296
 epoch: 34, train_loss: 0.7677, test_loss: 0.9912, test_f1: 0.5560
 epoch: 35, train_loss: 0.7758, test_loss: 0.8988, test_f1: 0.5485
 epoch: 36, train_loss: 0.7574, test_loss: 0.9173, test_f1: 0.5612
 epoch: 37, train_loss: 0.7595, test_loss: 0.8890, test_f1: 0.5811
 epoch: 38, train_loss: 0.7513, test_loss: 0.9693, test_f1: 0.5289
 epoch: 39, train_loss: 0.7489, test_loss: 0.8885, test_f1: 0.5630
 epoch: 40, train_loss: 0.7410, test_loss: 0.9177, test_f1: 0.5616
 epoch: 41, train_loss: 0.7534, test_loss: 0.9196, test_f1: 0.5765
 epoch: 42, train_loss: 0.7308, test_loss: 0.8819, test_f1: 0.5976
 epoch: 43, train_loss: 0.7192, test_loss: 1.0143, test_f1: 0.5392
 epoch: 44, train_loss: 0.7165, test_loss: 0.9666, test_f1: 0.5430
 epoch: 45, train_loss: 0.7211, test_loss: 0.9451, test_f1: 0.5324
 epoch: 46, train_loss: 0.7015, test_loss: 0.9396, test_f1: 0.5725
 epoch: 47, train_loss: 0.7198, test_loss: 0.9042, test_f1: 0.5908
 epoch: 48, train_loss: 0.6972, test_loss: 1.0323, test_f1: 0.5251
 epoch: 49, train_loss: 0.7008, test_loss: 1.0747, test_f1: 0.5478
 epoch: 50, train_loss: 0.7052, test_loss: 0.9661, test_f1: 0.5781
 epoch: 51, train_loss: 0.6886, test_loss: 0.9225, test_f1: 0.5713
 epoch: 52, train_loss: 0.6726, test_loss: 0.8932, test_f1: 0.5872
 epoch: 53, train_loss: 0.6714, test_loss: 0.9475, test_f1: 0.5799
 epoch: 54, train_loss: 0.6579, test_loss: 0.9284, test_f1: 0.5724
 epoch: 55, train_loss: 0.6578, test_loss: 0.9563, test_f1: 0.5718
 epoch: 56, train_loss: 0.6626, test_loss: 0.9460, test_f1: 0.5580
 epoch: 57, train_loss: 0.6474, test_loss: 1.0029, test_f1: 0.5531
 epoch: 58, train_loss: 0.6572, test_loss: 0.8906, test_f1: 0.5841
 epoch: 59, train_loss: 0.6472, test_loss: 0.9963, test_f1: 0.5735
 epoch: 60, train_loss: 0.6622, test_loss: 0.9583, test_f1: 0.5505
 epoch: 61, train_loss: 0.6500, test_loss: 0.9543, test_f1: 0.5744
 epoch: 62, train_loss: 0.6429, test_loss: 0.9590, test_f1: 0.5759
 epoch: 63, train_loss: 0.6593, test_loss: 1.0512, test_f1: 0.5488
 epoch: 64, train_loss: 0.6512, test_loss: 0.9297, test_f1: 0.5846
 epoch: 65, train_loss: 0.6469, test_loss: 0.9876, test_f1: 0.5913
 epoch: 66, train_loss: 0.6385, test_loss: 0.9712, test_f1: 0.5720
 epoch: 67, train_loss: 0.6367, test_loss: 1.0151, test_f1: 0.5735
 epoch: 68, train_loss: 0.6258, test_loss: 0.9755, test_f1: 0.5770
 epoch: 69, train_loss: 0.6360, test_loss: 1.0245, test_f1: 0.5584
 epoch: 70, train_loss: 0.6365, test_loss: 0.9519, test_f1: 0.5975
 epoch: 71, train_loss: 0.6344, test_loss: 0.9453, test_f1: 0.5890
 epoch: 72, train_loss: 0.6291, test_loss: 1.0053, test_f1: 0.5657
 epoch: 73, train_loss: 0.6315, test_loss: 0.9887, test_f1: 0.5858
 epoch: 74, train_loss: 0.6300, test_loss: 0.9981, test_f1: 0.5952
 epoch: 75, train_loss: 0.6245, test_loss: 1.0179, test_f1: 0.5474
 epoch: 76, train_loss: 0.6317, test_loss: 1.0545, test_f1: 0.5526
 epoch: 77, train_loss: 0.6256, test_loss: 0.9809, test_f1: 0.5809
 epoch: 78, train_loss: 0.6076, test_loss: 0.9992, test_f1: 0.5718
 epoch: 79, train_loss: 0.6047, test_loss: 1.0373, test_f1: 0.5756
 epoch: 80, train_loss: 0.6175, test_loss: 0.9638, test_f1: 0.5723
 epoch: 81, train_loss: 0.5970, test_loss: 1.0197, test_f1: 0.5559
 epoch: 82, train_loss: 0.6047, test_loss: 1.0370, test_f1: 0.5686
 epoch: 83, train_loss: 0.5959, test_loss: 1.0288, test_f1: 0.5555
 epoch: 84, train_loss: 0.6009, test_loss: 1.0739, test_f1: 0.5822
 epoch: 85, train_loss: 0.5951, test_loss: 0.9656, test_f1: 0.5885
 epoch: 86, train_loss: 0.5980, test_loss: 1.0497, test_f1: 0.5905
 epoch: 87, train_loss: 0.6101, test_loss: 1.0585, test_f1: 0.5611
 epoch: 88, train_loss: 0.5971, test_loss: 1.0329, test_f1: 0.5781
 epoch: 89, train_loss: 0.5893, test_loss: 0.9821, test_f1: 0.5903
 epoch: 90, train_loss: 0.5906, test_loss: 0.9876, test_f1: 0.5722
 epoch: 91, train_loss: 0.5835, test_loss: 1.0231, test_f1: 0.5892
 epoch: 92, train_loss: 0.5965, test_loss: 0.9990, test_f1: 0.5977
 epoch: 93, train_loss: 0.5936, test_loss: 1.0730, test_f1: 0.5640
 epoch: 94, train_loss: 0.5909, test_loss: 1.0142, test_f1: 0.6037
 epoch: 95, train_loss: 0.5860, test_loss: 1.0380, test_f1: 0.5773
 epoch: 96, train_loss: 0.5779, test_loss: 1.0221, test_f1: 0.5802
 epoch: 97, train_loss: 0.5682, test_loss: 1.0493, test_f1: 0.5706
 epoch: 98, train_loss: 0.5651, test_loss: 1.0422, test_f1: 0.5831
 epoch: 99, train_loss: 0.5821, test_loss: 1.0674, test_f1: 0.5931
##################ITERATION #6 ****************************************
 epoch: 0, train_loss: 1.2991, test_loss: 1.3029, test_f1: 0.2260
 epoch: 1, train_loss: 1.1446, test_loss: 1.2914, test_f1: 0.3201
 epoch: 2, train_loss: 1.0546, test_loss: 1.2727, test_f1: 0.3410
 epoch: 3, train_loss: 1.0194, test_loss: 1.1844, test_f1: 0.3956
 epoch: 4, train_loss: 0.9841, test_loss: 1.0697, test_f1: 0.4351
 epoch: 5, train_loss: 0.9731, test_loss: 1.0007, test_f1: 0.4740
 epoch: 6, train_loss: 0.9622, test_loss: 0.9921, test_f1: 0.4727
 epoch: 7, train_loss: 0.9312, test_loss: 0.9690, test_f1: 0.4924
 epoch: 8, train_loss: 0.9164, test_loss: 0.9584, test_f1: 0.4869
 epoch: 9, train_loss: 0.8985, test_loss: 0.9470, test_f1: 0.5117
 epoch: 10, train_loss: 0.8802, test_loss: 0.9720, test_f1: 0.4891
 epoch: 11, train_loss: 0.8782, test_loss: 0.9462, test_f1: 0.4917
 epoch: 12, train_loss: 0.8513, test_loss: 0.9471, test_f1: 0.5138
 epoch: 13, train_loss: 0.8611, test_loss: 0.9247, test_f1: 0.5149
 epoch: 14, train_loss: 0.8501, test_loss: 0.9430, test_f1: 0.5260
 epoch: 15, train_loss: 0.8304, test_loss: 0.9686, test_f1: 0.5000
 epoch: 16, train_loss: 0.8288, test_loss: 0.9002, test_f1: 0.5399
 epoch: 17, train_loss: 0.8096, test_loss: 0.9278, test_f1: 0.5473
 epoch: 18, train_loss: 0.7996, test_loss: 0.9058, test_f1: 0.5483
 epoch: 19, train_loss: 0.7844, test_loss: 0.9745, test_f1: 0.5390
 epoch: 20, train_loss: 0.7768, test_loss: 0.9031, test_f1: 0.5505
 epoch: 21, train_loss: 0.7794, test_loss: 0.9174, test_f1: 0.5475
 epoch: 22, train_loss: 0.7681, test_loss: 1.0191, test_f1: 0.4980
 epoch: 23, train_loss: 0.7697, test_loss: 1.0410, test_f1: 0.4958
 epoch: 24, train_loss: 0.7564, test_loss: 0.8861, test_f1: 0.5551
 epoch: 25, train_loss: 0.7484, test_loss: 0.9120, test_f1: 0.5373
 epoch: 26, train_loss: 0.7491, test_loss: 0.9297, test_f1: 0.5398
 epoch: 27, train_loss: 0.7417, test_loss: 0.9462, test_f1: 0.5584
 epoch: 28, train_loss: 0.7349, test_loss: 0.9122, test_f1: 0.5654
 epoch: 29, train_loss: 0.7365, test_loss: 0.9572, test_f1: 0.5397
 epoch: 30, train_loss: 0.7196, test_loss: 1.0279, test_f1: 0.5025
 epoch: 31, train_loss: 0.7089, test_loss: 0.8934, test_f1: 0.5445
 epoch: 32, train_loss: 0.7105, test_loss: 0.9267, test_f1: 0.5717
 epoch: 33, train_loss: 0.7018, test_loss: 0.9629, test_f1: 0.5119
 epoch: 34, train_loss: 0.7024, test_loss: 0.9736, test_f1: 0.5394
 epoch: 35, train_loss: 0.7006, test_loss: 1.0640, test_f1: 0.5289
 epoch: 36, train_loss: 0.6937, test_loss: 0.9417, test_f1: 0.5567
 epoch: 37, train_loss: 0.6901, test_loss: 0.8911, test_f1: 0.5597
 epoch: 38, train_loss: 0.6783, test_loss: 0.9319, test_f1: 0.5461
 epoch: 39, train_loss: 0.6689, test_loss: 0.9224, test_f1: 0.5705
 epoch: 40, train_loss: 0.6669, test_loss: 0.9737, test_f1: 0.5452
 epoch: 41, train_loss: 0.6602, test_loss: 0.9165, test_f1: 0.5946
 epoch: 42, train_loss: 0.6615, test_loss: 0.9819, test_f1: 0.5649
 epoch: 43, train_loss: 0.6584, test_loss: 0.9904, test_f1: 0.5625
 epoch: 44, train_loss: 0.6593, test_loss: 0.9693, test_f1: 0.5570
 epoch: 45, train_loss: 0.6525, test_loss: 0.9812, test_f1: 0.5845
 epoch: 46, train_loss: 0.6530, test_loss: 0.9632, test_f1: 0.5837
 epoch: 47, train_loss: 0.6392, test_loss: 0.9853, test_f1: 0.5499
 epoch: 48, train_loss: 0.6354, test_loss: 1.2067, test_f1: 0.4787
 epoch: 49, train_loss: 0.6166, test_loss: 0.9118, test_f1: 0.5532
 epoch: 50, train_loss: 0.6439, test_loss: 0.9447, test_f1: 0.6042
 epoch: 51, train_loss: 0.6219, test_loss: 0.9336, test_f1: 0.5897
 epoch: 52, train_loss: 0.6125, test_loss: 0.9620, test_f1: 0.5751
 epoch: 53, train_loss: 0.5971, test_loss: 0.9436, test_f1: 0.5811
 epoch: 54, train_loss: 0.5927, test_loss: 0.9344, test_f1: 0.6194
 epoch: 55, train_loss: 0.5823, test_loss: 0.8969, test_f1: 0.5849
 epoch: 56, train_loss: 0.5893, test_loss: 0.9722, test_f1: 0.5942
 epoch: 57, train_loss: 0.5758, test_loss: 0.9543, test_f1: 0.5992
 epoch: 58, train_loss: 0.5839, test_loss: 0.9723, test_f1: 0.5983
 epoch: 59, train_loss: 0.5891, test_loss: 1.0166, test_f1: 0.6048
 epoch: 60, train_loss: 0.5862, test_loss: 0.9516, test_f1: 0.6349
 epoch: 61, train_loss: 0.5768, test_loss: 1.0263, test_f1: 0.5795
 epoch: 62, train_loss: 0.5875, test_loss: 0.9702, test_f1: 0.6221
 epoch: 63, train_loss: 0.5638, test_loss: 0.9526, test_f1: 0.5986
 epoch: 64, train_loss: 0.5711, test_loss: 0.9969, test_f1: 0.5940
 epoch: 65, train_loss: 0.5601, test_loss: 0.9785, test_f1: 0.6087
 epoch: 66, train_loss: 0.5740, test_loss: 1.0460, test_f1: 0.6028
 epoch: 67, train_loss: 0.5535, test_loss: 0.9802, test_f1: 0.6003
 epoch: 68, train_loss: 0.5566, test_loss: 1.0544, test_f1: 0.5810
 epoch: 69, train_loss: 0.5476, test_loss: 0.9733, test_f1: 0.6175
 epoch: 70, train_loss: 0.5531, test_loss: 0.9881, test_f1: 0.6055
 epoch: 71, train_loss: 0.5494, test_loss: 1.0166, test_f1: 0.6083
 epoch: 72, train_loss: 0.5472, test_loss: 1.0211, test_f1: 0.6174
 epoch: 73, train_loss: 0.5466, test_loss: 1.0637, test_f1: 0.5933
 epoch: 74, train_loss: 0.5480, test_loss: 1.0318, test_f1: 0.6046
 epoch: 75, train_loss: 0.5391, test_loss: 0.9438, test_f1: 0.6180
 epoch: 76, train_loss: 0.5325, test_loss: 1.0289, test_f1: 0.6120
 epoch: 77, train_loss: 0.5437, test_loss: 1.0449, test_f1: 0.6037
 epoch: 78, train_loss: 0.5189, test_loss: 1.0370, test_f1: 0.5958
 epoch: 79, train_loss: 0.5281, test_loss: 1.0857, test_f1: 0.6119
 epoch: 80, train_loss: 0.5250, test_loss: 1.0329, test_f1: 0.5844
 epoch: 81, train_loss: 0.5244, test_loss: 1.0472, test_f1: 0.5948
 epoch: 82, train_loss: 0.5392, test_loss: 1.0523, test_f1: 0.6161
 epoch: 83, train_loss: 0.5429, test_loss: 1.0364, test_f1: 0.6036
 epoch: 84, train_loss: 0.5307, test_loss: 1.0687, test_f1: 0.6099
 epoch: 85, train_loss: 0.5336, test_loss: 1.1279, test_f1: 0.5906
 epoch: 86, train_loss: 0.5290, test_loss: 1.0428, test_f1: 0.6137
 epoch: 87, train_loss: 0.5336, test_loss: 1.1296, test_f1: 0.5912
 epoch: 88, train_loss: 0.5196, test_loss: 1.0094, test_f1: 0.6273
 epoch: 89, train_loss: 0.5251, test_loss: 1.0874, test_f1: 0.5989
 epoch: 90, train_loss: 0.5133, test_loss: 1.0885, test_f1: 0.6014
 epoch: 91, train_loss: 0.5193, test_loss: 1.0702, test_f1: 0.5954
 epoch: 92, train_loss: 0.5015, test_loss: 1.0762, test_f1: 0.6143
 epoch: 93, train_loss: 0.5069, test_loss: 1.0523, test_f1: 0.6005
 epoch: 94, train_loss: 0.5042, test_loss: 1.0969, test_f1: 0.5811
 epoch: 95, train_loss: 0.5055, test_loss: 1.0769, test_f1: 0.5949
 epoch: 96, train_loss: 0.5108, test_loss: 1.1601, test_f1: 0.5860
 epoch: 97, train_loss: 0.5020, test_loss: 1.0395, test_f1: 0.6263
 epoch: 98, train_loss: 0.4961, test_loss: 1.0792, test_f1: 0.6094
 epoch: 99, train_loss: 0.5069, test_loss: 1.1305, test_f1: 0.5833
##################ITERATION #7 ****************************************
 epoch: 0, train_loss: 1.2140, test_loss: 1.4062, test_f1: 0.2260
 epoch: 1, train_loss: 1.0657, test_loss: 1.3734, test_f1: 0.2286
 epoch: 2, train_loss: 1.0370, test_loss: 1.1771, test_f1: 0.2841
 epoch: 3, train_loss: 0.9937, test_loss: 1.0310, test_f1: 0.3969
 epoch: 4, train_loss: 0.9619, test_loss: 0.9959, test_f1: 0.4176
 epoch: 5, train_loss: 0.9494, test_loss: 1.0054, test_f1: 0.4260
 epoch: 6, train_loss: 0.9325, test_loss: 0.9641, test_f1: 0.4854
 epoch: 7, train_loss: 0.9135, test_loss: 0.9629, test_f1: 0.4946
 epoch: 8, train_loss: 0.9093, test_loss: 0.9749, test_f1: 0.4938
 epoch: 9, train_loss: 0.8866, test_loss: 0.9232, test_f1: 0.5169
 epoch: 10, train_loss: 0.8748, test_loss: 0.9487, test_f1: 0.5030
 epoch: 11, train_loss: 0.8702, test_loss: 0.9314, test_f1: 0.4957
 epoch: 12, train_loss: 0.8487, test_loss: 0.9858, test_f1: 0.4978
 epoch: 13, train_loss: 0.8467, test_loss: 0.9313, test_f1: 0.5221
 epoch: 14, train_loss: 0.8377, test_loss: 0.9394, test_f1: 0.4950
 epoch: 15, train_loss: 0.8094, test_loss: 0.9165, test_f1: 0.5176
 epoch: 16, train_loss: 0.8008, test_loss: 0.9080, test_f1: 0.5330
 epoch: 17, train_loss: 0.8116, test_loss: 0.9834, test_f1: 0.5069
 epoch: 18, train_loss: 0.7848, test_loss: 0.9075, test_f1: 0.5108
 epoch: 19, train_loss: 0.7886, test_loss: 0.9698, test_f1: 0.5150
 epoch: 20, train_loss: 0.7801, test_loss: 0.9060, test_f1: 0.5338
 epoch: 21, train_loss: 0.7693, test_loss: 0.9170, test_f1: 0.5142
 epoch: 22, train_loss: 0.7649, test_loss: 0.9696, test_f1: 0.5271
 epoch: 23, train_loss: 0.7592, test_loss: 0.8774, test_f1: 0.5235
 epoch: 24, train_loss: 0.7561, test_loss: 0.8994, test_f1: 0.5110
 epoch: 25, train_loss: 0.7308, test_loss: 0.8790, test_f1: 0.5462
 epoch: 26, train_loss: 0.7456, test_loss: 0.9048, test_f1: 0.5401
 epoch: 27, train_loss: 0.7405, test_loss: 0.8971, test_f1: 0.5728
 epoch: 28, train_loss: 0.7284, test_loss: 0.9241, test_f1: 0.5145
 epoch: 29, train_loss: 0.7258, test_loss: 0.9438, test_f1: 0.5461
 epoch: 30, train_loss: 0.7219, test_loss: 0.9398, test_f1: 0.5380
 epoch: 31, train_loss: 0.7162, test_loss: 1.0070, test_f1: 0.5288
 epoch: 32, train_loss: 0.7086, test_loss: 0.9385, test_f1: 0.5278
 epoch: 33, train_loss: 0.7060, test_loss: 0.9059, test_f1: 0.5730
 epoch: 34, train_loss: 0.7037, test_loss: 0.9465, test_f1: 0.5360
 epoch: 35, train_loss: 0.6916, test_loss: 0.9336, test_f1: 0.5550
 epoch: 36, train_loss: 0.6832, test_loss: 0.8405, test_f1: 0.5580
 epoch: 37, train_loss: 0.6799, test_loss: 0.9449, test_f1: 0.5753
 epoch: 38, train_loss: 0.6645, test_loss: 0.8902, test_f1: 0.5637
 epoch: 39, train_loss: 0.6705, test_loss: 0.9491, test_f1: 0.5401
 epoch: 40, train_loss: 0.6726, test_loss: 0.9175, test_f1: 0.5396
 epoch: 41, train_loss: 0.6768, test_loss: 0.9777, test_f1: 0.5246
 epoch: 42, train_loss: 0.6757, test_loss: 0.9928, test_f1: 0.5676
 epoch: 43, train_loss: 0.6765, test_loss: 0.8582, test_f1: 0.5653
 epoch: 44, train_loss: 0.6625, test_loss: 0.9764, test_f1: 0.5679
 epoch: 45, train_loss: 0.6449, test_loss: 0.9052, test_f1: 0.5702
 epoch: 46, train_loss: 0.6588, test_loss: 0.9767, test_f1: 0.5625
 epoch: 47, train_loss: 0.6408, test_loss: 1.0754, test_f1: 0.5355
 epoch: 48, train_loss: 0.6340, test_loss: 0.9200, test_f1: 0.5765
 epoch: 49, train_loss: 0.6327, test_loss: 0.9215, test_f1: 0.5710
 epoch: 50, train_loss: 0.6250, test_loss: 0.9490, test_f1: 0.5990
 epoch: 51, train_loss: 0.6186, test_loss: 0.8919, test_f1: 0.5952
 epoch: 52, train_loss: 0.6067, test_loss: 0.8997, test_f1: 0.5588
 epoch: 53, train_loss: 0.6000, test_loss: 0.9314, test_f1: 0.6018
 epoch: 54, train_loss: 0.5941, test_loss: 0.9474, test_f1: 0.5915
 epoch: 55, train_loss: 0.5890, test_loss: 0.9522, test_f1: 0.6036
 epoch: 56, train_loss: 0.5891, test_loss: 0.9221, test_f1: 0.5910
 epoch: 57, train_loss: 0.5963, test_loss: 1.0208, test_f1: 0.5968
 epoch: 58, train_loss: 0.5886, test_loss: 0.9287, test_f1: 0.5773
 epoch: 59, train_loss: 0.5903, test_loss: 0.9359, test_f1: 0.6008
 epoch: 60, train_loss: 0.5805, test_loss: 0.9589, test_f1: 0.5869
 epoch: 61, train_loss: 0.5678, test_loss: 0.9991, test_f1: 0.6013
 epoch: 62, train_loss: 0.5861, test_loss: 1.0277, test_f1: 0.5906
 epoch: 63, train_loss: 0.5811, test_loss: 0.9898, test_f1: 0.6026
 epoch: 64, train_loss: 0.5795, test_loss: 1.0309, test_f1: 0.6066
 epoch: 65, train_loss: 0.5706, test_loss: 1.0054, test_f1: 0.5945
 epoch: 66, train_loss: 0.5701, test_loss: 0.9915, test_f1: 0.5987
 epoch: 67, train_loss: 0.5739, test_loss: 1.0667, test_f1: 0.6041
 epoch: 68, train_loss: 0.5646, test_loss: 1.0175, test_f1: 0.5994
 epoch: 69, train_loss: 0.5718, test_loss: 1.0022, test_f1: 0.5887
 epoch: 70, train_loss: 0.5734, test_loss: 1.0396, test_f1: 0.5896
 epoch: 71, train_loss: 0.5602, test_loss: 0.9642, test_f1: 0.6095
 epoch: 72, train_loss: 0.5641, test_loss: 0.9671, test_f1: 0.6165
 epoch: 73, train_loss: 0.5728, test_loss: 1.0195, test_f1: 0.6018
 epoch: 74, train_loss: 0.5562, test_loss: 0.9808, test_f1: 0.5925
 epoch: 75, train_loss: 0.5477, test_loss: 1.0177, test_f1: 0.6066
 epoch: 76, train_loss: 0.5506, test_loss: 1.0414, test_f1: 0.5936
 epoch: 77, train_loss: 0.5428, test_loss: 1.0103, test_f1: 0.5939
 epoch: 78, train_loss: 0.5508, test_loss: 1.0336, test_f1: 0.5963
 epoch: 79, train_loss: 0.5528, test_loss: 1.0226, test_f1: 0.5993
 epoch: 80, train_loss: 0.5413, test_loss: 1.0754, test_f1: 0.5921
 epoch: 81, train_loss: 0.5578, test_loss: 1.0742, test_f1: 0.5981
 epoch: 82, train_loss: 0.5429, test_loss: 1.0232, test_f1: 0.6097
 epoch: 83, train_loss: 0.5355, test_loss: 1.0588, test_f1: 0.6071
 epoch: 84, train_loss: 0.5398, test_loss: 1.0540, test_f1: 0.5955
 epoch: 85, train_loss: 0.5409, test_loss: 1.0381, test_f1: 0.6000
 epoch: 86, train_loss: 0.5386, test_loss: 1.0497, test_f1: 0.6030
 epoch: 87, train_loss: 0.5396, test_loss: 1.0027, test_f1: 0.5944
 epoch: 88, train_loss: 0.5323, test_loss: 1.0465, test_f1: 0.6076
 epoch: 89, train_loss: 0.5428, test_loss: 1.0481, test_f1: 0.6027
 epoch: 90, train_loss: 0.5190, test_loss: 1.0038, test_f1: 0.6008
 epoch: 91, train_loss: 0.5250, test_loss: 0.9957, test_f1: 0.6227
 epoch: 92, train_loss: 0.5229, test_loss: 1.0719, test_f1: 0.6268
 epoch: 93, train_loss: 0.5439, test_loss: 1.0338, test_f1: 0.6055
 epoch: 94, train_loss: 0.5379, test_loss: 1.0570, test_f1: 0.6386
 epoch: 95, train_loss: 0.5341, test_loss: 1.0823, test_f1: 0.5959
 epoch: 96, train_loss: 0.5241, test_loss: 1.0094, test_f1: 0.6270
 epoch: 97, train_loss: 0.5265, test_loss: 1.0138, test_f1: 0.6256
 epoch: 98, train_loss: 0.5117, test_loss: 1.0931, test_f1: 0.6428
 epoch: 99, train_loss: 0.5031, test_loss: 1.0409, test_f1: 0.6119
##################ITERATION #8 ****************************************
 epoch: 0, train_loss: 1.5336, test_loss: 1.3870, test_f1: 0.2260
 epoch: 1, train_loss: 1.1903, test_loss: 1.3959, test_f1: 0.2260
 epoch: 2, train_loss: 1.1212, test_loss: 1.4066, test_f1: 0.2303
 epoch: 3, train_loss: 1.0671, test_loss: 1.2168, test_f1: 0.2848
 epoch: 4, train_loss: 1.0237, test_loss: 1.0233, test_f1: 0.3838
 epoch: 5, train_loss: 1.0134, test_loss: 1.0161, test_f1: 0.4457
 epoch: 6, train_loss: 0.9934, test_loss: 1.0406, test_f1: 0.4321
 epoch: 7, train_loss: 0.9813, test_loss: 1.0034, test_f1: 0.4539
 epoch: 8, train_loss: 0.9681, test_loss: 0.9994, test_f1: 0.4765
 epoch: 9, train_loss: 0.9543, test_loss: 1.0345, test_f1: 0.4664
 epoch: 10, train_loss: 0.9318, test_loss: 0.9934, test_f1: 0.4909
 epoch: 11, train_loss: 0.9205, test_loss: 0.9701, test_f1: 0.5095
 epoch: 12, train_loss: 0.9066, test_loss: 1.0339, test_f1: 0.4772
 epoch: 13, train_loss: 0.9072, test_loss: 1.0016, test_f1: 0.4985
 epoch: 14, train_loss: 0.8744, test_loss: 0.9924, test_f1: 0.5006
 epoch: 15, train_loss: 0.8850, test_loss: 0.9678, test_f1: 0.5256
 epoch: 16, train_loss: 0.8695, test_loss: 1.0326, test_f1: 0.4901
 epoch: 17, train_loss: 0.8571, test_loss: 0.9714, test_f1: 0.5446
 epoch: 18, train_loss: 0.8502, test_loss: 0.9837, test_f1: 0.5323
 epoch: 19, train_loss: 0.8474, test_loss: 0.9958, test_f1: 0.5280
 epoch: 20, train_loss: 0.8324, test_loss: 0.9558, test_f1: 0.5426
 epoch: 21, train_loss: 0.8235, test_loss: 0.9787, test_f1: 0.5318
 epoch: 22, train_loss: 0.8034, test_loss: 1.0017, test_f1: 0.5412
 epoch: 23, train_loss: 0.7944, test_loss: 0.9879, test_f1: 0.5440
 epoch: 24, train_loss: 0.7963, test_loss: 1.0027, test_f1: 0.5623
 epoch: 25, train_loss: 0.7946, test_loss: 1.0388, test_f1: 0.5384
 epoch: 26, train_loss: 0.7825, test_loss: 1.0404, test_f1: 0.5113
 epoch: 27, train_loss: 0.7952, test_loss: 0.9946, test_f1: 0.5438
 epoch: 28, train_loss: 0.7711, test_loss: 0.9831, test_f1: 0.5725
 epoch: 29, train_loss: 0.7623, test_loss: 1.0351, test_f1: 0.5422
 epoch: 30, train_loss: 0.7615, test_loss: 1.1106, test_f1: 0.5376
 epoch: 31, train_loss: 0.7572, test_loss: 0.9511, test_f1: 0.5598
 epoch: 32, train_loss: 0.7675, test_loss: 1.0058, test_f1: 0.5839
 epoch: 33, train_loss: 0.7342, test_loss: 1.0348, test_f1: 0.5560
 epoch: 34, train_loss: 0.7429, test_loss: 0.9893, test_f1: 0.5439
 epoch: 35, train_loss: 0.7251, test_loss: 1.0436, test_f1: 0.5615
 epoch: 36, train_loss: 0.7167, test_loss: 1.1128, test_f1: 0.5382
 epoch: 37, train_loss: 0.7377, test_loss: 1.0103, test_f1: 0.5512
 epoch: 38, train_loss: 0.7273, test_loss: 1.0648, test_f1: 0.5534
 epoch: 39, train_loss: 0.7177, test_loss: 1.0283, test_f1: 0.5436
 epoch: 40, train_loss: 0.7249, test_loss: 1.0556, test_f1: 0.5576
 epoch: 41, train_loss: 0.7098, test_loss: 1.2162, test_f1: 0.5021
 epoch: 42, train_loss: 0.7056, test_loss: 1.1091, test_f1: 0.5403
 epoch: 43, train_loss: 0.7215, test_loss: 1.0874, test_f1: 0.5394
 epoch: 44, train_loss: 0.7255, test_loss: 1.0172, test_f1: 0.5655
 epoch: 45, train_loss: 0.6981, test_loss: 1.0796, test_f1: 0.5476
 epoch: 46, train_loss: 0.7024, test_loss: 1.0326, test_f1: 0.5459
 epoch: 47, train_loss: 0.6791, test_loss: 1.0932, test_f1: 0.5716
 epoch: 48, train_loss: 0.6847, test_loss: 1.0225, test_f1: 0.5717
 epoch: 49, train_loss: 0.6714, test_loss: 1.1191, test_f1: 0.5550
 epoch: 50, train_loss: 0.6825, test_loss: 1.0733, test_f1: 0.5647
 epoch: 51, train_loss: 0.6619, test_loss: 1.0216, test_f1: 0.5722
 epoch: 52, train_loss: 0.6479, test_loss: 1.0535, test_f1: 0.5625
 epoch: 53, train_loss: 0.6547, test_loss: 1.0491, test_f1: 0.5667
 epoch: 54, train_loss: 0.6322, test_loss: 1.0809, test_f1: 0.5553
 epoch: 55, train_loss: 0.6358, test_loss: 1.0627, test_f1: 0.5749
 epoch: 56, train_loss: 0.6351, test_loss: 1.1164, test_f1: 0.5584
 epoch: 57, train_loss: 0.6345, test_loss: 1.0887, test_f1: 0.5720
 epoch: 58, train_loss: 0.6316, test_loss: 1.1082, test_f1: 0.5716
 epoch: 59, train_loss: 0.6203, test_loss: 1.0692, test_f1: 0.5781
 epoch: 60, train_loss: 0.6154, test_loss: 1.1027, test_f1: 0.5801
 epoch: 61, train_loss: 0.6369, test_loss: 1.1271, test_f1: 0.5629
 epoch: 62, train_loss: 0.6179, test_loss: 1.1305, test_f1: 0.5508
 epoch: 63, train_loss: 0.6346, test_loss: 1.0948, test_f1: 0.5707
 epoch: 64, train_loss: 0.6254, test_loss: 1.1450, test_f1: 0.5510
 epoch: 65, train_loss: 0.6213, test_loss: 1.1446, test_f1: 0.5469
 epoch: 66, train_loss: 0.6108, test_loss: 1.1337, test_f1: 0.5741
 epoch: 67, train_loss: 0.6078, test_loss: 1.1292, test_f1: 0.5663
 epoch: 68, train_loss: 0.6018, test_loss: 1.1505, test_f1: 0.5623
 epoch: 69, train_loss: 0.6093, test_loss: 1.0803, test_f1: 0.5858
 epoch: 70, train_loss: 0.6139, test_loss: 1.0684, test_f1: 0.5648
 epoch: 71, train_loss: 0.5981, test_loss: 1.1315, test_f1: 0.5736
 epoch: 72, train_loss: 0.5978, test_loss: 1.1077, test_f1: 0.5670
 epoch: 73, train_loss: 0.6055, test_loss: 1.1344, test_f1: 0.5731
 epoch: 74, train_loss: 0.6024, test_loss: 1.1743, test_f1: 0.5625
 epoch: 75, train_loss: 0.5870, test_loss: 1.0943, test_f1: 0.5753
 epoch: 76, train_loss: 0.5805, test_loss: 1.1215, test_f1: 0.5814
 epoch: 77, train_loss: 0.5747, test_loss: 1.1646, test_f1: 0.5645
 epoch: 78, train_loss: 0.5904, test_loss: 1.1777, test_f1: 0.5699
 epoch: 79, train_loss: 0.5872, test_loss: 1.1656, test_f1: 0.5705
 epoch: 80, train_loss: 0.5846, test_loss: 1.1612, test_f1: 0.5910
 epoch: 81, train_loss: 0.5834, test_loss: 1.1550, test_f1: 0.5589
 epoch: 82, train_loss: 0.5693, test_loss: 1.1805, test_f1: 0.5639
 epoch: 83, train_loss: 0.5731, test_loss: 1.1131, test_f1: 0.5773
 epoch: 84, train_loss: 0.5794, test_loss: 1.2445, test_f1: 0.5538
 epoch: 85, train_loss: 0.5768, test_loss: 1.1302, test_f1: 0.5887
 epoch: 86, train_loss: 0.5768, test_loss: 1.1573, test_f1: 0.5649
 epoch: 87, train_loss: 0.5733, test_loss: 1.1647, test_f1: 0.5965
 epoch: 88, train_loss: 0.5737, test_loss: 1.1905, test_f1: 0.5818
 epoch: 89, train_loss: 0.5768, test_loss: 1.1948, test_f1: 0.5870
 epoch: 90, train_loss: 0.5582, test_loss: 1.2250, test_f1: 0.5812
 epoch: 91, train_loss: 0.5611, test_loss: 1.1987, test_f1: 0.5839
 epoch: 92, train_loss: 0.5600, test_loss: 1.1936, test_f1: 0.5664
 epoch: 93, train_loss: 0.5613, test_loss: 1.1866, test_f1: 0.5812
 epoch: 94, train_loss: 0.5555, test_loss: 1.2718, test_f1: 0.5715
 epoch: 95, train_loss: 0.5456, test_loss: 1.2591, test_f1: 0.5618
 epoch: 96, train_loss: 0.5571, test_loss: 1.3432, test_f1: 0.5475
 epoch: 97, train_loss: 0.5666, test_loss: 1.2805, test_f1: 0.5462
 epoch: 98, train_loss: 0.5498, test_loss: 1.1556, test_f1: 0.5893
 epoch: 99, train_loss: 0.5507, test_loss: 1.2871, test_f1: 0.5474
##################ITERATION #9 ****************************************
 epoch: 0, train_loss: 1.4117, test_loss: 1.4855, test_f1: 0.2260
 epoch: 1, train_loss: 1.1253, test_loss: 1.2806, test_f1: 0.2268
 epoch: 2, train_loss: 1.0561, test_loss: 1.1673, test_f1: 0.3177
 epoch: 3, train_loss: 1.0236, test_loss: 1.0513, test_f1: 0.3959
 epoch: 4, train_loss: 0.9823, test_loss: 1.0127, test_f1: 0.4562
 epoch: 5, train_loss: 0.9654, test_loss: 1.0003, test_f1: 0.4548
 epoch: 6, train_loss: 0.9458, test_loss: 0.9778, test_f1: 0.4848
 epoch: 7, train_loss: 0.9276, test_loss: 0.9827, test_f1: 0.4844
 epoch: 8, train_loss: 0.9113, test_loss: 0.9695, test_f1: 0.5118
 epoch: 9, train_loss: 0.8941, test_loss: 0.9879, test_f1: 0.5209
 epoch: 10, train_loss: 0.8816, test_loss: 0.9680, test_f1: 0.5215
 epoch: 11, train_loss: 0.8787, test_loss: 0.9437, test_f1: 0.5215
 epoch: 12, train_loss: 0.8528, test_loss: 0.9667, test_f1: 0.5139
 epoch: 13, train_loss: 0.8509, test_loss: 0.9511, test_f1: 0.5169
 epoch: 14, train_loss: 0.8375, test_loss: 0.9358, test_f1: 0.5376
 epoch: 15, train_loss: 0.8343, test_loss: 0.9538, test_f1: 0.5390
 epoch: 16, train_loss: 0.8175, test_loss: 0.9640, test_f1: 0.5225
 epoch: 17, train_loss: 0.8276, test_loss: 0.9406, test_f1: 0.5405
 epoch: 18, train_loss: 0.8099, test_loss: 0.9836, test_f1: 0.5190
 epoch: 19, train_loss: 0.7998, test_loss: 0.9732, test_f1: 0.5007
 epoch: 20, train_loss: 0.7791, test_loss: 0.9926, test_f1: 0.5243
 epoch: 21, train_loss: 0.7780, test_loss: 0.9212, test_f1: 0.5450
 epoch: 22, train_loss: 0.7683, test_loss: 0.9297, test_f1: 0.5510
 epoch: 23, train_loss: 0.7615, test_loss: 0.9257, test_f1: 0.5321
 epoch: 24, train_loss: 0.7408, test_loss: 0.9733, test_f1: 0.5170
 epoch: 25, train_loss: 0.7403, test_loss: 0.9153, test_f1: 0.5449
 epoch: 26, train_loss: 0.7518, test_loss: 0.9300, test_f1: 0.5514
 epoch: 27, train_loss: 0.7462, test_loss: 0.9855, test_f1: 0.5342
 epoch: 28, train_loss: 0.7363, test_loss: 0.9476, test_f1: 0.4994
 epoch: 29, train_loss: 0.7252, test_loss: 0.9085, test_f1: 0.5429
 epoch: 30, train_loss: 0.7127, test_loss: 0.9249, test_f1: 0.5770
 epoch: 31, train_loss: 0.7023, test_loss: 1.0163, test_f1: 0.5154
 epoch: 32, train_loss: 0.7021, test_loss: 0.9489, test_f1: 0.5495
 epoch: 33, train_loss: 0.6949, test_loss: 0.9296, test_f1: 0.5632
 epoch: 34, train_loss: 0.7003, test_loss: 0.9549, test_f1: 0.5417
 epoch: 35, train_loss: 0.6727, test_loss: 0.9260, test_f1: 0.5385
 epoch: 36, train_loss: 0.6702, test_loss: 0.9609, test_f1: 0.5572
 epoch: 37, train_loss: 0.6664, test_loss: 0.9249, test_f1: 0.5784
 epoch: 38, train_loss: 0.6687, test_loss: 1.0622, test_f1: 0.5151
 epoch: 39, train_loss: 0.6579, test_loss: 0.9887, test_f1: 0.5326
 epoch: 40, train_loss: 0.6444, test_loss: 0.9629, test_f1: 0.5567
 epoch: 41, train_loss: 0.6578, test_loss: 0.9703, test_f1: 0.5220
 epoch: 42, train_loss: 0.6547, test_loss: 0.9246, test_f1: 0.5809
 epoch: 43, train_loss: 0.6477, test_loss: 0.9688, test_f1: 0.5562
 epoch: 44, train_loss: 0.6360, test_loss: 0.9600, test_f1: 0.5862
 epoch: 45, train_loss: 0.6350, test_loss: 0.9538, test_f1: 0.5535
 epoch: 46, train_loss: 0.6148, test_loss: 0.9907, test_f1: 0.5590
 epoch: 47, train_loss: 0.5967, test_loss: 1.0035, test_f1: 0.5197
 epoch: 48, train_loss: 0.6308, test_loss: 0.8904, test_f1: 0.5844
 epoch: 49, train_loss: 0.6229, test_loss: 0.9321, test_f1: 0.5532
 epoch: 50, train_loss: 0.6095, test_loss: 0.9072, test_f1: 0.5976
 epoch: 51, train_loss: 0.6082, test_loss: 0.9034, test_f1: 0.5761
 epoch: 52, train_loss: 0.5805, test_loss: 0.9269, test_f1: 0.5606
 epoch: 53, train_loss: 0.5725, test_loss: 0.9362, test_f1: 0.5884
 epoch: 54, train_loss: 0.5649, test_loss: 0.9180, test_f1: 0.5924
 epoch: 55, train_loss: 0.5669, test_loss: 0.9603, test_f1: 0.5732
 epoch: 56, train_loss: 0.5522, test_loss: 0.9741, test_f1: 0.5936
 epoch: 57, train_loss: 0.5432, test_loss: 0.9814, test_f1: 0.5799
 epoch: 58, train_loss: 0.5619, test_loss: 0.9228, test_f1: 0.6020
 epoch: 59, train_loss: 0.5563, test_loss: 0.9581, test_f1: 0.5661
 epoch: 60, train_loss: 0.5485, test_loss: 0.9530, test_f1: 0.5979
 epoch: 61, train_loss: 0.5358, test_loss: 0.9526, test_f1: 0.6047
 epoch: 62, train_loss: 0.5365, test_loss: 1.0706, test_f1: 0.5950
 epoch: 63, train_loss: 0.5480, test_loss: 0.9436, test_f1: 0.6120
 epoch: 64, train_loss: 0.5381, test_loss: 0.9644, test_f1: 0.6188
 epoch: 65, train_loss: 0.5371, test_loss: 0.9813, test_f1: 0.5994
 epoch: 66, train_loss: 0.5316, test_loss: 0.9476, test_f1: 0.6046
 epoch: 67, train_loss: 0.5265, test_loss: 1.0267, test_f1: 0.5826
 epoch: 68, train_loss: 0.5337, test_loss: 0.9630, test_f1: 0.5848
 epoch: 69, train_loss: 0.5432, test_loss: 0.9722, test_f1: 0.5901
 epoch: 70, train_loss: 0.5123, test_loss: 0.9903, test_f1: 0.5939
 epoch: 71, train_loss: 0.5174, test_loss: 1.0403, test_f1: 0.5918
 epoch: 72, train_loss: 0.5101, test_loss: 1.1100, test_f1: 0.5813
 epoch: 73, train_loss: 0.5174, test_loss: 0.9771, test_f1: 0.6023
 epoch: 74, train_loss: 0.5138, test_loss: 1.0033, test_f1: 0.6020
 epoch: 75, train_loss: 0.5195, test_loss: 1.0551, test_f1: 0.5860
 epoch: 76, train_loss: 0.5237, test_loss: 1.0282, test_f1: 0.5792
 epoch: 77, train_loss: 0.5208, test_loss: 1.0502, test_f1: 0.5844
 epoch: 78, train_loss: 0.5281, test_loss: 0.9873, test_f1: 0.6163
 epoch: 79, train_loss: 0.5157, test_loss: 1.0935, test_f1: 0.5797
 epoch: 80, train_loss: 0.5047, test_loss: 0.9445, test_f1: 0.6279
 epoch: 81, train_loss: 0.4830, test_loss: 1.0154, test_f1: 0.5921
 epoch: 82, train_loss: 0.5135, test_loss: 0.9912, test_f1: 0.6242
 epoch: 83, train_loss: 0.5107, test_loss: 1.0533, test_f1: 0.6079
 epoch: 84, train_loss: 0.4873, test_loss: 1.0504, test_f1: 0.6154
 epoch: 85, train_loss: 0.4859, test_loss: 1.1617, test_f1: 0.5844
 epoch: 86, train_loss: 0.5015, test_loss: 1.0476, test_f1: 0.6061
 epoch: 87, train_loss: 0.4945, test_loss: 1.0431, test_f1: 0.5912
 epoch: 88, train_loss: 0.4674, test_loss: 1.0889, test_f1: 0.5872
 epoch: 89, train_loss: 0.4710, test_loss: 1.0953, test_f1: 0.6142
 epoch: 90, train_loss: 0.4783, test_loss: 1.1537, test_f1: 0.5909
 epoch: 91, train_loss: 0.4730, test_loss: 1.1055, test_f1: 0.5879
 epoch: 92, train_loss: 0.4677, test_loss: 1.1845, test_f1: 0.5824
 epoch: 93, train_loss: 0.4677, test_loss: 1.1753, test_f1: 0.5663
 epoch: 94, train_loss: 0.4736, test_loss: 1.0720, test_f1: 0.5846
 epoch: 95, train_loss: 0.4694, test_loss: 1.1204, test_f1: 0.6178
 epoch: 96, train_loss: 0.4697, test_loss: 1.1136, test_f1: 0.5999
 epoch: 97, train_loss: 0.4583, test_loss: 1.2172, test_f1: 0.5672
 epoch: 98, train_loss: 0.4655, test_loss: 1.2096, test_f1: 0.5704
 epoch: 99, train_loss: 0.4511, test_loss: 1.1396, test_f1: 0.5819

Training completed in 638.64 seconds
Best F1: 0.6428 at epoch 98
Mean F1 across iterations: 0.6141  0.0188
========================FINAL RESULTS================================
FEGIN weighted F1: 0.6428  0.0188
python main.py --data ltspice_examples --representation component_pin --model FEGIN --layers 4 --hiddens 32 --batch_size 256 --lr 0.001 --emb_size 128 --epochs 100 --save_appendix component_pin_L4_H32_BS256_LR0.001_E128 --no_val
-----



STDERR:
  File "main.py", line 370, in <module>
    main()
  File "main.py", line 254, in main
    dataset = dataset_class(
  File "/home/philip/projects/llm_inference_code_repo/Circuit-Completion-Using-GNNs/component_classification_with_link_prediction_head/evaluation/FEGIN/kernel/circuit_datasets.py", line 15, in __init__
    self.data, self.slices = torch.load(self.processed_paths[0])
  File "/home/philip/.local/lib/python3.8/site-packages/torch/serialization.py", line 1040, in load
    warnings.warn(
  File "/usr/lib/python3.8/warnings.py", line 109, in _showwarnmsg
    sw(msg.message, msg.category, msg.filename, msg.lineno,
  File "main.py", line 47, in warn_with_traceback
    traceback.print_stack(file=log)
/home/philip/projects/llm_inference_code_repo/Circuit-Completion-Using-GNNs/component_classification_with_link_prediction_head/evaluation/FEGIN/kernel/circuit_datasets.py:15: FutureWarning: You are using `torch.load` with `weights_only=False` (the current default value), which uses the default pickle module implicitly. It is possible to construct malicious pickle data which will execute arbitrary code during unpickling (See https://github.com/pytorch/pytorch/blob/main/SECURITY.md#untrusted-models for more details). In a future release, the default value for `weights_only` will be flipped to `True`. This limits the functions that could be executed during unpickling. Arbitrary objects will no longer be allowed to be loaded via this mode unless they are explicitly allowlisted by the user via `torch.serialization.add_safe_globals`. We recommend you start setting `weights_only=True` for any use case where you don't have full control of the loaded file. Please open an issue on GitHub for any issues related to this experimental feature.
  self.data, self.slices = torch.load(self.processed_paths[0])
