STDOUT:
Results will be saved in /home/philip/projects/ltspice_examples_code_repo/Circuit-Completion-Using-GNNs/component_classification_with_link_prediction_head/evaluation/FEGIN/results/model_FEGIN_dataset_ltspice_examples
Command line input: python main.py --data ltspice_examples --representation component_pin --model FEGIN --layers 3 --hiddens 64 --batch_size 256 --lr 0.01 --emb_size 250 --epochs 100 --save_appendix component_pin_L3_H64_BS256_LR0.01_E250 --no_val
 is saved.
-----
ltspice_examples - FEGIN
Using 3 layers, 64 hidden units, h = 2
Loading component_pin representation dataset
ENTERED
Training FEGIN on component_pin representation
Train: 3560, Test: 848
##################ITERATION #0 ****************************************
 epoch: 0, train_loss: 1.2572, test_loss: 1.4136, test_f1: 0.2260
 epoch: 1, train_loss: 1.0500, test_loss: 1.0673, test_f1: 0.3629
 epoch: 2, train_loss: 0.9880, test_loss: 0.9974, test_f1: 0.4966
 epoch: 3, train_loss: 0.9419, test_loss: 0.9398, test_f1: 0.5400
 epoch: 4, train_loss: 0.9005, test_loss: 0.9259, test_f1: 0.4827
 epoch: 5, train_loss: 0.8684, test_loss: 0.9462, test_f1: 0.5391
 epoch: 6, train_loss: 0.8659, test_loss: 0.9792, test_f1: 0.4956
 epoch: 7, train_loss: 0.8300, test_loss: 0.8956, test_f1: 0.5826
 epoch: 8, train_loss: 0.7924, test_loss: 0.8725, test_f1: 0.5815
 epoch: 9, train_loss: 0.7839, test_loss: 0.9158, test_f1: 0.5254
 epoch: 10, train_loss: 0.7850, test_loss: 0.8790, test_f1: 0.5364
 epoch: 11, train_loss: 0.7786, test_loss: 1.5344, test_f1: 0.4050
 epoch: 12, train_loss: 0.7712, test_loss: 0.8664, test_f1: 0.5908
 epoch: 13, train_loss: 0.7667, test_loss: 0.8701, test_f1: 0.5691
 epoch: 14, train_loss: 0.7277, test_loss: 0.8898, test_f1: 0.5621
 epoch: 15, train_loss: 0.7198, test_loss: 0.9319, test_f1: 0.5982
 epoch: 16, train_loss: 0.6944, test_loss: 1.1833, test_f1: 0.5084
 epoch: 17, train_loss: 0.7029, test_loss: 0.8342, test_f1: 0.5834
 epoch: 18, train_loss: 0.6897, test_loss: 1.0049, test_f1: 0.5482
 epoch: 19, train_loss: 0.6602, test_loss: 1.0236, test_f1: 0.5602
 epoch: 20, train_loss: 0.6649, test_loss: 0.9461, test_f1: 0.6118
 epoch: 21, train_loss: 0.6667, test_loss: 0.9653, test_f1: 0.5932
 epoch: 22, train_loss: 0.6424, test_loss: 0.9539, test_f1: 0.5727
 epoch: 23, train_loss: 0.6259, test_loss: 1.0139, test_f1: 0.5164
 epoch: 24, train_loss: 0.6222, test_loss: 1.0121, test_f1: 0.5414
 epoch: 25, train_loss: 0.6107, test_loss: 1.0684, test_f1: 0.5612
 epoch: 26, train_loss: 0.6140, test_loss: 0.9900, test_f1: 0.5683
 epoch: 27, train_loss: 0.6129, test_loss: 0.9249, test_f1: 0.5798
 epoch: 28, train_loss: 0.5980, test_loss: 1.2114, test_f1: 0.5445
 epoch: 29, train_loss: 0.6142, test_loss: 0.9185, test_f1: 0.5619
 epoch: 30, train_loss: 0.5890, test_loss: 1.3607, test_f1: 0.5366
 epoch: 31, train_loss: 0.5853, test_loss: 1.0404, test_f1: 0.5855
 epoch: 32, train_loss: 0.5808, test_loss: 0.8204, test_f1: 0.6463
 epoch: 33, train_loss: 0.5802, test_loss: 0.9404, test_f1: 0.6304
 epoch: 34, train_loss: 0.5492, test_loss: 0.8943, test_f1: 0.6275
 epoch: 35, train_loss: 0.5281, test_loss: 0.9900, test_f1: 0.6280
 epoch: 36, train_loss: 0.5283, test_loss: 1.2214, test_f1: 0.6058
 epoch: 37, train_loss: 0.5253, test_loss: 0.9069, test_f1: 0.6606
 epoch: 38, train_loss: 0.5415, test_loss: 0.9637, test_f1: 0.6166
 epoch: 39, train_loss: 0.5236, test_loss: 1.2184, test_f1: 0.5634
 epoch: 40, train_loss: 0.5098, test_loss: 0.9423, test_f1: 0.6393
 epoch: 41, train_loss: 0.5021, test_loss: 1.0214, test_f1: 0.6379
 epoch: 42, train_loss: 0.4910, test_loss: 1.0636, test_f1: 0.6644
 epoch: 43, train_loss: 0.4895, test_loss: 1.0037, test_f1: 0.6325
 epoch: 44, train_loss: 0.4865, test_loss: 1.0793, test_f1: 0.6273
 epoch: 45, train_loss: 0.4694, test_loss: 1.1278, test_f1: 0.6148
 epoch: 46, train_loss: 0.4563, test_loss: 1.0936, test_f1: 0.6103
 epoch: 47, train_loss: 0.4391, test_loss: 1.1121, test_f1: 0.6402
 epoch: 48, train_loss: 0.4437, test_loss: 1.1363, test_f1: 0.6371
 epoch: 49, train_loss: 0.4473, test_loss: 1.1866, test_f1: 0.5875
 epoch: 50, train_loss: 0.4458, test_loss: 0.9076, test_f1: 0.6588
 epoch: 51, train_loss: 0.4175, test_loss: 1.3146, test_f1: 0.6210
 epoch: 52, train_loss: 0.3820, test_loss: 1.1778, test_f1: 0.6646
 epoch: 53, train_loss: 0.3705, test_loss: 1.1575, test_f1: 0.6673
 epoch: 54, train_loss: 0.3493, test_loss: 1.1879, test_f1: 0.6281
 epoch: 55, train_loss: 0.3438, test_loss: 1.2459, test_f1: 0.6517
 epoch: 56, train_loss: 0.3402, test_loss: 1.1930, test_f1: 0.6533
 epoch: 57, train_loss: 0.3265, test_loss: 1.1593, test_f1: 0.6725
 epoch: 58, train_loss: 0.3248, test_loss: 1.1954, test_f1: 0.6619
 epoch: 59, train_loss: 0.3086, test_loss: 1.3105, test_f1: 0.6240
 epoch: 60, train_loss: 0.3242, test_loss: 1.2063, test_f1: 0.6337
 epoch: 61, train_loss: 0.3331, test_loss: 1.2665, test_f1: 0.6452
 epoch: 62, train_loss: 0.3293, test_loss: 1.3043, test_f1: 0.6380
 epoch: 63, train_loss: 0.3179, test_loss: 1.1588, test_f1: 0.6651
 epoch: 64, train_loss: 0.3118, test_loss: 1.3744, test_f1: 0.6427
 epoch: 65, train_loss: 0.3119, test_loss: 1.3630, test_f1: 0.6264
 epoch: 66, train_loss: 0.2861, test_loss: 1.5104, test_f1: 0.6442
 epoch: 67, train_loss: 0.3068, test_loss: 1.2490, test_f1: 0.6824
 epoch: 68, train_loss: 0.3310, test_loss: 1.5551, test_f1: 0.6190
 epoch: 69, train_loss: 0.3015, test_loss: 1.3440, test_f1: 0.6347
 epoch: 70, train_loss: 0.3017, test_loss: 1.3265, test_f1: 0.6590
 epoch: 71, train_loss: 0.2919, test_loss: 1.1899, test_f1: 0.6801
 epoch: 72, train_loss: 0.2839, test_loss: 1.2575, test_f1: 0.6648
 epoch: 73, train_loss: 0.2518, test_loss: 1.3871, test_f1: 0.6406
 epoch: 74, train_loss: 0.2462, test_loss: 1.5990, test_f1: 0.6501
 epoch: 75, train_loss: 0.2763, test_loss: 1.4183, test_f1: 0.6476
 epoch: 76, train_loss: 0.2756, test_loss: 1.4020, test_f1: 0.6279
 epoch: 77, train_loss: 0.2797, test_loss: 1.1424, test_f1: 0.6660
 epoch: 78, train_loss: 0.2545, test_loss: 1.3697, test_f1: 0.6432
 epoch: 79, train_loss: 0.2502, test_loss: 1.4783, test_f1: 0.6212
 epoch: 80, train_loss: 0.2434, test_loss: 1.6688, test_f1: 0.6237
 epoch: 81, train_loss: 0.2441, test_loss: 1.4314, test_f1: 0.6680
 epoch: 82, train_loss: 0.2450, test_loss: 1.7179, test_f1: 0.6333
 epoch: 83, train_loss: 0.2542, test_loss: 1.5488, test_f1: 0.6323
 epoch: 84, train_loss: 0.2481, test_loss: 1.3006, test_f1: 0.6554
 epoch: 85, train_loss: 0.2811, test_loss: 1.6438, test_f1: 0.6276
 epoch: 86, train_loss: 0.2673, test_loss: 1.5993, test_f1: 0.6402
 epoch: 87, train_loss: 0.2473, test_loss: 1.3776, test_f1: 0.6650
 epoch: 88, train_loss: 0.2535, test_loss: 1.6732, test_f1: 0.6588
 epoch: 89, train_loss: 0.2358, test_loss: 1.6203, test_f1: 0.6520
 epoch: 90, train_loss: 0.2578, test_loss: 1.6245, test_f1: 0.6599
 epoch: 91, train_loss: 0.2503, test_loss: 1.5784, test_f1: 0.6102
 epoch: 92, train_loss: 0.2569, test_loss: 1.3997, test_f1: 0.6218
 epoch: 93, train_loss: 0.2443, test_loss: 1.6253, test_f1: 0.6045
 epoch: 94, train_loss: 0.2342, test_loss: 1.3878, test_f1: 0.6784
 epoch: 95, train_loss: 0.2203, test_loss: 1.4993, test_f1: 0.6681
 epoch: 96, train_loss: 0.2164, test_loss: 1.7754, test_f1: 0.6109
 epoch: 97, train_loss: 0.2271, test_loss: 1.5816, test_f1: 0.6609
 epoch: 98, train_loss: 0.2200, test_loss: 1.8501, test_f1: 0.6214
 epoch: 99, train_loss: 0.2200, test_loss: 1.6049, test_f1: 0.6616
##################ITERATION #1 ****************************************
 epoch: 0, train_loss: 1.2039, test_loss: 1.4301, test_f1: 0.2260
 epoch: 1, train_loss: 1.0256, test_loss: 1.0596, test_f1: 0.3711
 epoch: 2, train_loss: 0.9880, test_loss: 1.0863, test_f1: 0.4451
 epoch: 3, train_loss: 0.9472, test_loss: 0.9887, test_f1: 0.5050
 epoch: 4, train_loss: 0.9167, test_loss: 1.0456, test_f1: 0.5320
 epoch: 5, train_loss: 0.9000, test_loss: 1.0821, test_f1: 0.4801
 epoch: 6, train_loss: 0.8654, test_loss: 1.0031, test_f1: 0.5317
 epoch: 7, train_loss: 0.8503, test_loss: 1.0028, test_f1: 0.5498
 epoch: 8, train_loss: 0.8313, test_loss: 0.9644, test_f1: 0.5123
 epoch: 9, train_loss: 0.8317, test_loss: 0.9406, test_f1: 0.5482
 epoch: 10, train_loss: 0.8023, test_loss: 0.9738, test_f1: 0.5693
 epoch: 11, train_loss: 0.7778, test_loss: 0.9818, test_f1: 0.5151
 epoch: 12, train_loss: 0.7641, test_loss: 0.9366, test_f1: 0.5798
 epoch: 13, train_loss: 0.7473, test_loss: 0.9633, test_f1: 0.5741
 epoch: 14, train_loss: 0.7252, test_loss: 0.9532, test_f1: 0.5557
 epoch: 15, train_loss: 0.7227, test_loss: 0.9227, test_f1: 0.5632
 epoch: 16, train_loss: 0.7424, test_loss: 1.0238, test_f1: 0.5606
 epoch: 17, train_loss: 0.7304, test_loss: 1.0144, test_f1: 0.5537
 epoch: 18, train_loss: 0.7160, test_loss: 0.9927, test_f1: 0.5856
 epoch: 19, train_loss: 0.7098, test_loss: 0.8928, test_f1: 0.5709
 epoch: 20, train_loss: 0.6633, test_loss: 1.0089, test_f1: 0.6018
 epoch: 21, train_loss: 0.6881, test_loss: 0.9883, test_f1: 0.5538
 epoch: 22, train_loss: 0.6676, test_loss: 1.0200, test_f1: 0.5895
 epoch: 23, train_loss: 0.6467, test_loss: 1.0319, test_f1: 0.5625
 epoch: 24, train_loss: 0.6453, test_loss: 0.9670, test_f1: 0.5865
 epoch: 25, train_loss: 0.6297, test_loss: 1.0502, test_f1: 0.5780
 epoch: 26, train_loss: 0.6372, test_loss: 0.9676, test_f1: 0.5730
 epoch: 27, train_loss: 0.6489, test_loss: 1.1836, test_f1: 0.5537
 epoch: 28, train_loss: 0.6219, test_loss: 1.0330, test_f1: 0.6121
 epoch: 29, train_loss: 0.6097, test_loss: 0.9039, test_f1: 0.6205
 epoch: 30, train_loss: 0.5982, test_loss: 0.9763, test_f1: 0.5975
 epoch: 31, train_loss: 0.6170, test_loss: 0.8994, test_f1: 0.6178
 epoch: 32, train_loss: 0.6241, test_loss: 1.0002, test_f1: 0.5772
 epoch: 33, train_loss: 0.6443, test_loss: 1.1605, test_f1: 0.5578
 epoch: 34, train_loss: 0.6192, test_loss: 1.0004, test_f1: 0.6307
 epoch: 35, train_loss: 0.5670, test_loss: 1.0446, test_f1: 0.5975
 epoch: 36, train_loss: 0.5623, test_loss: 1.0900, test_f1: 0.5821
 epoch: 37, train_loss: 0.5439, test_loss: 0.8912, test_f1: 0.6164
 epoch: 38, train_loss: 0.5496, test_loss: 1.0772, test_f1: 0.5728
 epoch: 39, train_loss: 0.5682, test_loss: 1.1808, test_f1: 0.5677
 epoch: 40, train_loss: 0.5528, test_loss: 1.1288, test_f1: 0.5840
 epoch: 41, train_loss: 0.5440, test_loss: 0.9807, test_f1: 0.6182
 epoch: 42, train_loss: 0.5423, test_loss: 1.1987, test_f1: 0.5975
 epoch: 43, train_loss: 0.5201, test_loss: 1.1561, test_f1: 0.6167
 epoch: 44, train_loss: 0.5382, test_loss: 1.0123, test_f1: 0.6268
 epoch: 45, train_loss: 0.5320, test_loss: 1.1660, test_f1: 0.6099
 epoch: 46, train_loss: 0.5189, test_loss: 1.0190, test_f1: 0.6227
 epoch: 47, train_loss: 0.5190, test_loss: 0.9901, test_f1: 0.6572
 epoch: 48, train_loss: 0.5019, test_loss: 1.0946, test_f1: 0.6063
 epoch: 49, train_loss: 0.4816, test_loss: 1.0230, test_f1: 0.6125
 epoch: 50, train_loss: 0.5167, test_loss: 1.0937, test_f1: 0.6120
 epoch: 51, train_loss: 0.4879, test_loss: 1.0369, test_f1: 0.6412
 epoch: 52, train_loss: 0.4307, test_loss: 1.1204, test_f1: 0.6366
 epoch: 53, train_loss: 0.4203, test_loss: 1.2329, test_f1: 0.6213
 epoch: 54, train_loss: 0.4283, test_loss: 1.0483, test_f1: 0.6716
 epoch: 55, train_loss: 0.3976, test_loss: 1.0096, test_f1: 0.6625
 epoch: 56, train_loss: 0.4146, test_loss: 1.3633, test_f1: 0.5659
 epoch: 57, train_loss: 0.3978, test_loss: 1.0605, test_f1: 0.6624
 epoch: 58, train_loss: 0.3968, test_loss: 1.1623, test_f1: 0.6517
 epoch: 59, train_loss: 0.3924, test_loss: 1.0788, test_f1: 0.6439
 epoch: 60, train_loss: 0.3861, test_loss: 1.1986, test_f1: 0.6567
 epoch: 61, train_loss: 0.3730, test_loss: 1.2065, test_f1: 0.6481
 epoch: 62, train_loss: 0.3749, test_loss: 1.2182, test_f1: 0.6451
 epoch: 63, train_loss: 0.3641, test_loss: 1.1277, test_f1: 0.6579
 epoch: 64, train_loss: 0.3707, test_loss: 1.2429, test_f1: 0.6479
 epoch: 65, train_loss: 0.3813, test_loss: 1.3864, test_f1: 0.5826
 epoch: 66, train_loss: 0.3794, test_loss: 1.2672, test_f1: 0.6267
 epoch: 67, train_loss: 0.3675, test_loss: 1.2624, test_f1: 0.6423
 epoch: 68, train_loss: 0.3706, test_loss: 1.1605, test_f1: 0.6771
 epoch: 69, train_loss: 0.3776, test_loss: 1.1609, test_f1: 0.6743
 epoch: 70, train_loss: 0.3612, test_loss: 1.1910, test_f1: 0.6695
 epoch: 71, train_loss: 0.3627, test_loss: 1.3553, test_f1: 0.6670
 epoch: 72, train_loss: 0.3561, test_loss: 1.2599, test_f1: 0.6162
 epoch: 73, train_loss: 0.3826, test_loss: 1.2502, test_f1: 0.6570
 epoch: 74, train_loss: 0.3649, test_loss: 1.3543, test_f1: 0.6331
 epoch: 75, train_loss: 0.3532, test_loss: 1.3577, test_f1: 0.6487
 epoch: 76, train_loss: 0.3649, test_loss: 1.1683, test_f1: 0.6559
 epoch: 77, train_loss: 0.3266, test_loss: 1.3023, test_f1: 0.6378
 epoch: 78, train_loss: 0.3309, test_loss: 1.3006, test_f1: 0.6686
 epoch: 79, train_loss: 0.3551, test_loss: 1.2975, test_f1: 0.6483
 epoch: 80, train_loss: 0.3522, test_loss: 1.3925, test_f1: 0.6570
 epoch: 81, train_loss: 0.3298, test_loss: 1.2976, test_f1: 0.6587
 epoch: 82, train_loss: 0.3311, test_loss: 1.1625, test_f1: 0.6908
 epoch: 83, train_loss: 0.3491, test_loss: 1.4305, test_f1: 0.5997
 epoch: 84, train_loss: 0.3215, test_loss: 1.3014, test_f1: 0.6523
 epoch: 85, train_loss: 0.3162, test_loss: 1.2216, test_f1: 0.6768
 epoch: 86, train_loss: 0.3153, test_loss: 1.4984, test_f1: 0.5862
 epoch: 87, train_loss: 0.3340, test_loss: 1.3149, test_f1: 0.6577
 epoch: 88, train_loss: 0.3243, test_loss: 1.4648, test_f1: 0.5969
 epoch: 89, train_loss: 0.3363, test_loss: 1.4401, test_f1: 0.6381
 epoch: 90, train_loss: 0.3054, test_loss: 1.3106, test_f1: 0.6691
 epoch: 91, train_loss: 0.3384, test_loss: 1.8661, test_f1: 0.6054
 epoch: 92, train_loss: 0.3043, test_loss: 1.3350, test_f1: 0.6628
 epoch: 93, train_loss: 0.3008, test_loss: 1.4040, test_f1: 0.6454
 epoch: 94, train_loss: 0.3023, test_loss: 1.4218, test_f1: 0.6663
 epoch: 95, train_loss: 0.3019, test_loss: 1.4682, test_f1: 0.6449
 epoch: 96, train_loss: 0.2968, test_loss: 1.6844, test_f1: 0.6534
 epoch: 97, train_loss: 0.2957, test_loss: 1.4490, test_f1: 0.6645
 epoch: 98, train_loss: 0.3059, test_loss: 1.4309, test_f1: 0.6399
 epoch: 99, train_loss: 0.3109, test_loss: 1.2989, test_f1: 0.6481
##################ITERATION #2 ****************************************
 epoch: 0, train_loss: 1.3126, test_loss: 1.1441, test_f1: 0.3646
 epoch: 1, train_loss: 1.0084, test_loss: 1.0783, test_f1: 0.3828
 epoch: 2, train_loss: 0.9471, test_loss: 1.0692, test_f1: 0.4333
 epoch: 3, train_loss: 0.9401, test_loss: 0.9893, test_f1: 0.4849
 epoch: 4, train_loss: 0.9296, test_loss: 1.0704, test_f1: 0.4528
 epoch: 5, train_loss: 0.8891, test_loss: 1.0237, test_f1: 0.4374
 epoch: 6, train_loss: 0.8796, test_loss: 1.0848, test_f1: 0.5123
 epoch: 7, train_loss: 0.8599, test_loss: 0.8741, test_f1: 0.5285
 epoch: 8, train_loss: 0.8242, test_loss: 0.9574, test_f1: 0.5544
 epoch: 9, train_loss: 0.8365, test_loss: 1.0740, test_f1: 0.5341
 epoch: 10, train_loss: 0.8432, test_loss: 0.9645, test_f1: 0.5014
 epoch: 11, train_loss: 0.8015, test_loss: 0.9047, test_f1: 0.5243
 epoch: 12, train_loss: 0.7966, test_loss: 0.8998, test_f1: 0.5060
 epoch: 13, train_loss: 0.7896, test_loss: 0.8693, test_f1: 0.5900
 epoch: 14, train_loss: 0.7643, test_loss: 0.9575, test_f1: 0.5161
 epoch: 15, train_loss: 0.7431, test_loss: 1.0117, test_f1: 0.5396
 epoch: 16, train_loss: 0.7344, test_loss: 1.1066, test_f1: 0.5155
 epoch: 17, train_loss: 0.7255, test_loss: 1.1696, test_f1: 0.4911
 epoch: 18, train_loss: 0.7164, test_loss: 0.8466, test_f1: 0.5785
 epoch: 19, train_loss: 0.7150, test_loss: 0.9393, test_f1: 0.5289
 epoch: 20, train_loss: 0.7054, test_loss: 1.0299, test_f1: 0.5404
 epoch: 21, train_loss: 0.6889, test_loss: 1.1479, test_f1: 0.4915
 epoch: 22, train_loss: 0.6987, test_loss: 0.9254, test_f1: 0.5417
 epoch: 23, train_loss: 0.6728, test_loss: 1.0186, test_f1: 0.5977
 epoch: 24, train_loss: 0.6664, test_loss: 0.8693, test_f1: 0.5963
 epoch: 25, train_loss: 0.6676, test_loss: 0.9190, test_f1: 0.6229
 epoch: 26, train_loss: 0.6523, test_loss: 0.8641, test_f1: 0.6123
 epoch: 27, train_loss: 0.6517, test_loss: 0.9479, test_f1: 0.5983
 epoch: 28, train_loss: 0.6174, test_loss: 0.9386, test_f1: 0.6129
 epoch: 29, train_loss: 0.6394, test_loss: 0.8573, test_f1: 0.5818
 epoch: 30, train_loss: 0.6210, test_loss: 0.8845, test_f1: 0.6072
 epoch: 31, train_loss: 0.6161, test_loss: 2.0217, test_f1: 0.4708
 epoch: 32, train_loss: 0.6133, test_loss: 1.1202, test_f1: 0.5258
 epoch: 33, train_loss: 0.6169, test_loss: 1.2244, test_f1: 0.5836
 epoch: 34, train_loss: 0.6271, test_loss: 0.9351, test_f1: 0.6264
 epoch: 35, train_loss: 0.6207, test_loss: 1.0340, test_f1: 0.5835
 epoch: 36, train_loss: 0.6304, test_loss: 1.3769, test_f1: 0.5532
 epoch: 37, train_loss: 0.6379, test_loss: 0.9581, test_f1: 0.6404
 epoch: 38, train_loss: 0.5747, test_loss: 1.0891, test_f1: 0.5579
 epoch: 39, train_loss: 0.5583, test_loss: 1.1010, test_f1: 0.5682
 epoch: 40, train_loss: 0.5663, test_loss: 0.9435, test_f1: 0.6262
 epoch: 41, train_loss: 0.5900, test_loss: 1.5826, test_f1: 0.4868
 epoch: 42, train_loss: 0.5853, test_loss: 0.9732, test_f1: 0.6182
 epoch: 43, train_loss: 0.5741, test_loss: 0.8987, test_f1: 0.6357
 epoch: 44, train_loss: 0.5550, test_loss: 1.2111, test_f1: 0.5834
 epoch: 45, train_loss: 0.5408, test_loss: 0.8706, test_f1: 0.5890
 epoch: 46, train_loss: 0.5318, test_loss: 0.8802, test_f1: 0.6334
 epoch: 47, train_loss: 0.5418, test_loss: 0.8809, test_f1: 0.6435
 epoch: 48, train_loss: 0.5474, test_loss: 1.0248, test_f1: 0.5756
 epoch: 49, train_loss: 0.5244, test_loss: 0.9102, test_f1: 0.6575
 epoch: 50, train_loss: 0.5026, test_loss: 1.2539, test_f1: 0.5588
 epoch: 51, train_loss: 0.4741, test_loss: 0.8845, test_f1: 0.6441
 epoch: 52, train_loss: 0.4443, test_loss: 0.9315, test_f1: 0.6530
 epoch: 53, train_loss: 0.4555, test_loss: 0.8871, test_f1: 0.6411
 epoch: 54, train_loss: 0.4354, test_loss: 0.9928, test_f1: 0.6590
 epoch: 55, train_loss: 0.4295, test_loss: 1.0675, test_f1: 0.6282
 epoch: 56, train_loss: 0.4291, test_loss: 1.0085, test_f1: 0.6406
 epoch: 57, train_loss: 0.4349, test_loss: 0.9621, test_f1: 0.6611
 epoch: 58, train_loss: 0.4242, test_loss: 0.9453, test_f1: 0.6461
 epoch: 59, train_loss: 0.4142, test_loss: 0.9611, test_f1: 0.6656
 epoch: 60, train_loss: 0.4219, test_loss: 0.9728, test_f1: 0.6537
 epoch: 61, train_loss: 0.4109, test_loss: 0.9284, test_f1: 0.6443
 epoch: 62, train_loss: 0.4085, test_loss: 0.9757, test_f1: 0.6761
 epoch: 63, train_loss: 0.4117, test_loss: 1.0436, test_f1: 0.6543
 epoch: 64, train_loss: 0.4160, test_loss: 1.0786, test_f1: 0.6450
 epoch: 65, train_loss: 0.3961, test_loss: 0.9375, test_f1: 0.6703
 epoch: 66, train_loss: 0.4022, test_loss: 1.0306, test_f1: 0.6266
 epoch: 67, train_loss: 0.3809, test_loss: 0.9976, test_f1: 0.6315
 epoch: 68, train_loss: 0.3786, test_loss: 0.9566, test_f1: 0.6493
 epoch: 69, train_loss: 0.3854, test_loss: 1.1252, test_f1: 0.6489
 epoch: 70, train_loss: 0.3889, test_loss: 1.1304, test_f1: 0.6426
 epoch: 71, train_loss: 0.3829, test_loss: 1.2295, test_f1: 0.6416
 epoch: 72, train_loss: 0.3673, test_loss: 1.0762, test_f1: 0.6647
 epoch: 73, train_loss: 0.3688, test_loss: 1.0391, test_f1: 0.6284
 epoch: 74, train_loss: 0.3644, test_loss: 1.0358, test_f1: 0.6453
 epoch: 75, train_loss: 0.3782, test_loss: 0.9802, test_f1: 0.6415
 epoch: 76, train_loss: 0.4001, test_loss: 0.9775, test_f1: 0.6617
 epoch: 77, train_loss: 0.3714, test_loss: 1.0176, test_f1: 0.6631
 epoch: 78, train_loss: 0.3481, test_loss: 1.3570, test_f1: 0.5940
 epoch: 79, train_loss: 0.3517, test_loss: 0.9887, test_f1: 0.6472
 epoch: 80, train_loss: 0.3421, test_loss: 1.0989, test_f1: 0.6282
 epoch: 81, train_loss: 0.3466, test_loss: 0.9080, test_f1: 0.6764
 epoch: 82, train_loss: 0.3600, test_loss: 1.0656, test_f1: 0.6585
 epoch: 83, train_loss: 0.3728, test_loss: 1.1421, test_f1: 0.6114
 epoch: 84, train_loss: 0.3620, test_loss: 1.1429, test_f1: 0.6249
 epoch: 85, train_loss: 0.3583, test_loss: 1.0991, test_f1: 0.6587
 epoch: 86, train_loss: 0.3424, test_loss: 1.1251, test_f1: 0.6522
 epoch: 87, train_loss: 0.3376, test_loss: 1.1597, test_f1: 0.6509
 epoch: 88, train_loss: 0.3690, test_loss: 1.3206, test_f1: 0.6071
 epoch: 89, train_loss: 0.3400, test_loss: 1.0652, test_f1: 0.6571
 epoch: 90, train_loss: 0.3338, test_loss: 1.2799, test_f1: 0.5996
 epoch: 91, train_loss: 0.3254, test_loss: 1.3192, test_f1: 0.6118
 epoch: 92, train_loss: 0.3272, test_loss: 1.0963, test_f1: 0.6642
 epoch: 93, train_loss: 0.3343, test_loss: 1.1033, test_f1: 0.6733
 epoch: 94, train_loss: 0.3161, test_loss: 1.2218, test_f1: 0.6433
 epoch: 95, train_loss: 0.3168, test_loss: 1.0980, test_f1: 0.6342
 epoch: 96, train_loss: 0.3123, test_loss: 1.1214, test_f1: 0.6541
 epoch: 97, train_loss: 0.2886, test_loss: 1.1326, test_f1: 0.6509
 epoch: 98, train_loss: 0.3138, test_loss: 1.1336, test_f1: 0.6558
 epoch: 99, train_loss: 0.3305, test_loss: 1.1802, test_f1: 0.6227
##################ITERATION #3 ****************************************
 epoch: 0, train_loss: 1.4159, test_loss: 1.1644, test_f1: 0.3805
 epoch: 1, train_loss: 1.0147, test_loss: 1.1442, test_f1: 0.3169
 epoch: 2, train_loss: 0.9682, test_loss: 1.0986, test_f1: 0.4684
 epoch: 3, train_loss: 0.9328, test_loss: 1.0098, test_f1: 0.5033
 epoch: 4, train_loss: 0.9227, test_loss: 1.0784, test_f1: 0.4582
 epoch: 5, train_loss: 0.8852, test_loss: 1.0056, test_f1: 0.5556
 epoch: 6, train_loss: 0.8769, test_loss: 0.9608, test_f1: 0.5589
 epoch: 7, train_loss: 0.8482, test_loss: 0.9882, test_f1: 0.5265
 epoch: 8, train_loss: 0.8344, test_loss: 0.9748, test_f1: 0.5342
 epoch: 9, train_loss: 0.8213, test_loss: 0.9190, test_f1: 0.5645
 epoch: 10, train_loss: 0.7916, test_loss: 1.0324, test_f1: 0.5378
 epoch: 11, train_loss: 0.7802, test_loss: 0.9312, test_f1: 0.5572
 epoch: 12, train_loss: 0.7594, test_loss: 0.9554, test_f1: 0.5628
 epoch: 13, train_loss: 0.7676, test_loss: 1.0348, test_f1: 0.5019
 epoch: 14, train_loss: 0.7695, test_loss: 0.9500, test_f1: 0.5873
 epoch: 15, train_loss: 0.7435, test_loss: 1.3460, test_f1: 0.5053
 epoch: 16, train_loss: 0.7427, test_loss: 0.9662, test_f1: 0.5817
 epoch: 17, train_loss: 0.7274, test_loss: 0.9255, test_f1: 0.5767
 epoch: 18, train_loss: 0.7267, test_loss: 0.9863, test_f1: 0.5375
 epoch: 19, train_loss: 0.7176, test_loss: 0.9519, test_f1: 0.5841
 epoch: 20, train_loss: 0.7187, test_loss: 0.9686, test_f1: 0.6113
 epoch: 21, train_loss: 0.7098, test_loss: 0.9318, test_f1: 0.6194
 epoch: 22, train_loss: 0.6811, test_loss: 0.8964, test_f1: 0.6136
 epoch: 23, train_loss: 0.6789, test_loss: 1.0503, test_f1: 0.5714
 epoch: 24, train_loss: 0.6764, test_loss: 0.9790, test_f1: 0.6271
 epoch: 25, train_loss: 0.6817, test_loss: 0.9807, test_f1: 0.5358
 epoch: 26, train_loss: 0.6561, test_loss: 0.8988, test_f1: 0.6365
 epoch: 27, train_loss: 0.6532, test_loss: 1.0499, test_f1: 0.6570
 epoch: 28, train_loss: 0.6574, test_loss: 0.8795, test_f1: 0.6586
 epoch: 29, train_loss: 0.6327, test_loss: 0.9770, test_f1: 0.6117
 epoch: 30, train_loss: 0.6363, test_loss: 0.9337, test_f1: 0.6122
 epoch: 31, train_loss: 0.5968, test_loss: 0.9161, test_f1: 0.6480
 epoch: 32, train_loss: 0.6026, test_loss: 1.0019, test_f1: 0.5941
 epoch: 33, train_loss: 0.5911, test_loss: 0.9240, test_f1: 0.6324
 epoch: 34, train_loss: 0.5970, test_loss: 0.9865, test_f1: 0.6032
 epoch: 35, train_loss: 0.5936, test_loss: 1.2930, test_f1: 0.5250
 epoch: 36, train_loss: 0.6384, test_loss: 1.1584, test_f1: 0.6039
 epoch: 37, train_loss: 0.6016, test_loss: 0.9123, test_f1: 0.6075
 epoch: 38, train_loss: 0.5971, test_loss: 1.0956, test_f1: 0.6003
 epoch: 39, train_loss: 0.5864, test_loss: 1.1642, test_f1: 0.5496
 epoch: 40, train_loss: 0.5983, test_loss: 1.0132, test_f1: 0.6383
 epoch: 41, train_loss: 0.5772, test_loss: 0.9456, test_f1: 0.6386
 epoch: 42, train_loss: 0.5613, test_loss: 0.9273, test_f1: 0.6462
 epoch: 43, train_loss: 0.5870, test_loss: 1.0133, test_f1: 0.6322
 epoch: 44, train_loss: 0.5503, test_loss: 1.0772, test_f1: 0.6096
 epoch: 45, train_loss: 0.5434, test_loss: 1.0839, test_f1: 0.6175
 epoch: 46, train_loss: 0.5592, test_loss: 1.1697, test_f1: 0.5800
 epoch: 47, train_loss: 0.5552, test_loss: 0.9718, test_f1: 0.6171
 epoch: 48, train_loss: 0.5310, test_loss: 1.0388, test_f1: 0.6372
 epoch: 49, train_loss: 0.5225, test_loss: 1.2295, test_f1: 0.5593
 epoch: 50, train_loss: 0.5359, test_loss: 1.0894, test_f1: 0.6262
 epoch: 51, train_loss: 0.5073, test_loss: 1.1386, test_f1: 0.6228
 epoch: 52, train_loss: 0.4712, test_loss: 1.2602, test_f1: 0.6022
 epoch: 53, train_loss: 0.4446, test_loss: 1.0467, test_f1: 0.6281
 epoch: 54, train_loss: 0.4574, test_loss: 0.9873, test_f1: 0.6151
 epoch: 55, train_loss: 0.4476, test_loss: 1.2184, test_f1: 0.6269
 epoch: 56, train_loss: 0.4275, test_loss: 1.2846, test_f1: 0.6216
 epoch: 57, train_loss: 0.4175, test_loss: 1.4537, test_f1: 0.5622
 epoch: 58, train_loss: 0.4379, test_loss: 1.2355, test_f1: 0.6136
 epoch: 59, train_loss: 0.4201, test_loss: 1.1430, test_f1: 0.6311
 epoch: 60, train_loss: 0.4227, test_loss: 1.1696, test_f1: 0.6438
 epoch: 61, train_loss: 0.3976, test_loss: 1.3831, test_f1: 0.5878
 epoch: 62, train_loss: 0.4084, test_loss: 1.0887, test_f1: 0.6164
 epoch: 63, train_loss: 0.4053, test_loss: 1.1064, test_f1: 0.6425
 epoch: 64, train_loss: 0.4165, test_loss: 1.0435, test_f1: 0.6435
 epoch: 65, train_loss: 0.4015, test_loss: 1.1672, test_f1: 0.6404
 epoch: 66, train_loss: 0.4003, test_loss: 1.2005, test_f1: 0.5908
 epoch: 67, train_loss: 0.3947, test_loss: 1.2964, test_f1: 0.6031
 epoch: 68, train_loss: 0.4015, test_loss: 1.3275, test_f1: 0.5970
 epoch: 69, train_loss: 0.4183, test_loss: 1.1584, test_f1: 0.6148
 epoch: 70, train_loss: 0.3852, test_loss: 1.0665, test_f1: 0.6570
 epoch: 71, train_loss: 0.3822, test_loss: 1.1423, test_f1: 0.6326
 epoch: 72, train_loss: 0.3829, test_loss: 1.1522, test_f1: 0.6361
 epoch: 73, train_loss: 0.3901, test_loss: 1.0332, test_f1: 0.6477
 epoch: 74, train_loss: 0.3681, test_loss: 1.5249, test_f1: 0.5884
 epoch: 75, train_loss: 0.3703, test_loss: 1.4190, test_f1: 0.5993
 epoch: 76, train_loss: 0.3656, test_loss: 1.1427, test_f1: 0.6384
 epoch: 77, train_loss: 0.3983, test_loss: 1.1687, test_f1: 0.5956
 epoch: 78, train_loss: 0.3822, test_loss: 1.1224, test_f1: 0.6389
 epoch: 79, train_loss: 0.3687, test_loss: 1.3478, test_f1: 0.6250
 epoch: 80, train_loss: 0.3616, test_loss: 1.2144, test_f1: 0.6416
 epoch: 81, train_loss: 0.3511, test_loss: 1.3610, test_f1: 0.5855
 epoch: 82, train_loss: 0.3612, test_loss: 1.2735, test_f1: 0.6129
 epoch: 83, train_loss: 0.3494, test_loss: 1.3135, test_f1: 0.6316
 epoch: 84, train_loss: 0.3722, test_loss: 1.1911, test_f1: 0.6120
 epoch: 85, train_loss: 0.3626, test_loss: 1.3044, test_f1: 0.6326
 epoch: 86, train_loss: 0.3375, test_loss: 1.2635, test_f1: 0.6623
 epoch: 87, train_loss: 0.3388, test_loss: 1.1425, test_f1: 0.6148
 epoch: 88, train_loss: 0.3453, test_loss: 1.4313, test_f1: 0.6401
 epoch: 89, train_loss: 0.3303, test_loss: 1.3273, test_f1: 0.6278
 epoch: 90, train_loss: 0.3065, test_loss: 1.5086, test_f1: 0.6157
 epoch: 91, train_loss: 0.3387, test_loss: 1.2192, test_f1: 0.5926
 epoch: 92, train_loss: 0.3143, test_loss: 1.0912, test_f1: 0.6232
 epoch: 93, train_loss: 0.3379, test_loss: 1.3376, test_f1: 0.6058
 epoch: 94, train_loss: 0.3486, test_loss: 1.4152, test_f1: 0.6283
 epoch: 95, train_loss: 0.3470, test_loss: 1.3893, test_f1: 0.5839
 epoch: 96, train_loss: 0.3370, test_loss: 1.4882, test_f1: 0.5894
 epoch: 97, train_loss: 0.3190, test_loss: 1.6038, test_f1: 0.5975
 epoch: 98, train_loss: 0.3173, test_loss: 1.4568, test_f1: 0.5950
 epoch: 99, train_loss: 0.3058, test_loss: 1.7838, test_f1: 0.6098
##################ITERATION #4 ****************************************
 epoch: 0, train_loss: 1.4370, test_loss: 1.2362, test_f1: 0.3728
 epoch: 1, train_loss: 1.0357, test_loss: 1.1017, test_f1: 0.4532
 epoch: 2, train_loss: 0.9817, test_loss: 1.1213, test_f1: 0.4156
 epoch: 3, train_loss: 0.9519, test_loss: 1.0309, test_f1: 0.5037
 epoch: 4, train_loss: 0.9185, test_loss: 1.0438, test_f1: 0.5280
 epoch: 5, train_loss: 0.8936, test_loss: 0.9569, test_f1: 0.5540
 epoch: 6, train_loss: 0.8801, test_loss: 1.0054, test_f1: 0.5562
 epoch: 7, train_loss: 0.8898, test_loss: 1.0331, test_f1: 0.5069
 epoch: 8, train_loss: 0.8570, test_loss: 0.9663, test_f1: 0.5346
 epoch: 9, train_loss: 0.8251, test_loss: 0.9246, test_f1: 0.5763
 epoch: 10, train_loss: 0.7984, test_loss: 1.2351, test_f1: 0.5282
 epoch: 11, train_loss: 0.7878, test_loss: 0.9826, test_f1: 0.5378
 epoch: 12, train_loss: 0.7834, test_loss: 0.9718, test_f1: 0.5239
 epoch: 13, train_loss: 0.7625, test_loss: 1.0038, test_f1: 0.5025
 epoch: 14, train_loss: 0.7745, test_loss: 0.9475, test_f1: 0.5718
 epoch: 15, train_loss: 0.7449, test_loss: 1.0062, test_f1: 0.5533
 epoch: 16, train_loss: 0.7470, test_loss: 1.0867, test_f1: 0.5422
 epoch: 17, train_loss: 0.7345, test_loss: 0.9441, test_f1: 0.5787
 epoch: 18, train_loss: 0.6994, test_loss: 0.9048, test_f1: 0.6121
 epoch: 19, train_loss: 0.6939, test_loss: 0.9229, test_f1: 0.5704
 epoch: 20, train_loss: 0.6862, test_loss: 0.9984, test_f1: 0.5696
 epoch: 21, train_loss: 0.6729, test_loss: 0.8697, test_f1: 0.5899
 epoch: 22, train_loss: 0.6670, test_loss: 1.0465, test_f1: 0.5635
 epoch: 23, train_loss: 0.6631, test_loss: 0.9196, test_f1: 0.5849
 epoch: 24, train_loss: 0.6477, test_loss: 1.0329, test_f1: 0.5394
 epoch: 25, train_loss: 0.6557, test_loss: 0.9251, test_f1: 0.6194
 epoch: 26, train_loss: 0.6486, test_loss: 0.9412, test_f1: 0.6146
 epoch: 27, train_loss: 0.6290, test_loss: 1.0017, test_f1: 0.5929
 epoch: 28, train_loss: 0.6219, test_loss: 0.9708, test_f1: 0.5861
 epoch: 29, train_loss: 0.6458, test_loss: 0.9542, test_f1: 0.6082
 epoch: 30, train_loss: 0.6249, test_loss: 0.9803, test_f1: 0.5722
 epoch: 31, train_loss: 0.6424, test_loss: 0.9021, test_f1: 0.5813
 epoch: 32, train_loss: 0.6099, test_loss: 1.0405, test_f1: 0.5941
 epoch: 33, train_loss: 0.5948, test_loss: 0.9165, test_f1: 0.5980
 epoch: 34, train_loss: 0.6094, test_loss: 0.9110, test_f1: 0.5904
 epoch: 35, train_loss: 0.6000, test_loss: 0.8306, test_f1: 0.6292
 epoch: 36, train_loss: 0.5874, test_loss: 1.0563, test_f1: 0.5937
 epoch: 37, train_loss: 0.6280, test_loss: 0.9816, test_f1: 0.5728
 epoch: 38, train_loss: 0.6349, test_loss: 1.0228, test_f1: 0.5806
 epoch: 39, train_loss: 0.5945, test_loss: 1.0981, test_f1: 0.5558
 epoch: 40, train_loss: 0.5923, test_loss: 0.8998, test_f1: 0.6468
 epoch: 41, train_loss: 0.6082, test_loss: 1.0881, test_f1: 0.5422
 epoch: 42, train_loss: 0.5724, test_loss: 0.8512, test_f1: 0.6247
 epoch: 43, train_loss: 0.5723, test_loss: 1.0808, test_f1: 0.5891
 epoch: 44, train_loss: 0.5529, test_loss: 0.9974, test_f1: 0.6131
 epoch: 45, train_loss: 0.5563, test_loss: 1.0392, test_f1: 0.5745
 epoch: 46, train_loss: 0.5564, test_loss: 1.0667, test_f1: 0.6393
 epoch: 47, train_loss: 0.5457, test_loss: 1.0664, test_f1: 0.5679
 epoch: 48, train_loss: 0.5243, test_loss: 1.0938, test_f1: 0.6116
 epoch: 49, train_loss: 0.5138, test_loss: 0.9462, test_f1: 0.6301
 epoch: 50, train_loss: 0.5337, test_loss: 0.9714, test_f1: 0.6498
 epoch: 51, train_loss: 0.4827, test_loss: 0.9182, test_f1: 0.6612
 epoch: 52, train_loss: 0.4460, test_loss: 0.9024, test_f1: 0.6711
 epoch: 53, train_loss: 0.4229, test_loss: 0.9513, test_f1: 0.6497
 epoch: 54, train_loss: 0.4214, test_loss: 1.0135, test_f1: 0.6734
 epoch: 55, train_loss: 0.4386, test_loss: 0.9619, test_f1: 0.6644
 epoch: 56, train_loss: 0.4031, test_loss: 1.0354, test_f1: 0.6515
 epoch: 57, train_loss: 0.4218, test_loss: 0.8981, test_f1: 0.6722
 epoch: 58, train_loss: 0.4078, test_loss: 1.0861, test_f1: 0.6432
 epoch: 59, train_loss: 0.4094, test_loss: 0.9404, test_f1: 0.6783
 epoch: 60, train_loss: 0.4012, test_loss: 1.0672, test_f1: 0.6285
 epoch: 61, train_loss: 0.4000, test_loss: 1.0443, test_f1: 0.6389
 epoch: 62, train_loss: 0.3887, test_loss: 1.1633, test_f1: 0.6076
 epoch: 63, train_loss: 0.4056, test_loss: 1.1077, test_f1: 0.6349
 epoch: 64, train_loss: 0.3959, test_loss: 1.3376, test_f1: 0.6214
 epoch: 65, train_loss: 0.3902, test_loss: 0.9413, test_f1: 0.6667
 epoch: 66, train_loss: 0.3803, test_loss: 1.0293, test_f1: 0.6532
 epoch: 67, train_loss: 0.3641, test_loss: 1.0526, test_f1: 0.6769
 epoch: 68, train_loss: 0.3715, test_loss: 1.2954, test_f1: 0.6247
 epoch: 69, train_loss: 0.3898, test_loss: 1.0020, test_f1: 0.6589
 epoch: 70, train_loss: 0.3695, test_loss: 1.0289, test_f1: 0.6499
 epoch: 71, train_loss: 0.3635, test_loss: 0.9967, test_f1: 0.6799
 epoch: 72, train_loss: 0.3650, test_loss: 1.1803, test_f1: 0.6473
 epoch: 73, train_loss: 0.3360, test_loss: 1.1774, test_f1: 0.6288
 epoch: 74, train_loss: 0.3457, test_loss: 1.1462, test_f1: 0.6715
 epoch: 75, train_loss: 0.3490, test_loss: 1.2182, test_f1: 0.6356
 epoch: 76, train_loss: 0.3512, test_loss: 1.2391, test_f1: 0.6526
 epoch: 77, train_loss: 0.3388, test_loss: 1.4357, test_f1: 0.6336
 epoch: 78, train_loss: 0.3454, test_loss: 1.2911, test_f1: 0.6381
 epoch: 79, train_loss: 0.3662, test_loss: 1.0144, test_f1: 0.6812
 epoch: 80, train_loss: 0.3659, test_loss: 1.4780, test_f1: 0.6216
 epoch: 81, train_loss: 0.3384, test_loss: 1.0959, test_f1: 0.6771
 epoch: 82, train_loss: 0.3518, test_loss: 1.1501, test_f1: 0.6511
 epoch: 83, train_loss: 0.3521, test_loss: 1.4345, test_f1: 0.6231
 epoch: 84, train_loss: 0.3384, test_loss: 1.1669, test_f1: 0.6746
 epoch: 85, train_loss: 0.3090, test_loss: 1.3508, test_f1: 0.6600
 epoch: 86, train_loss: 0.3057, test_loss: 1.3155, test_f1: 0.6622
 epoch: 87, train_loss: 0.3194, test_loss: 1.0120, test_f1: 0.7112
 epoch: 88, train_loss: 0.3137, test_loss: 1.3009, test_f1: 0.6569
 epoch: 89, train_loss: 0.3161, test_loss: 1.3813, test_f1: 0.6294
 epoch: 90, train_loss: 0.3016, test_loss: 1.2958, test_f1: 0.6507
 epoch: 91, train_loss: 0.3241, test_loss: 1.2534, test_f1: 0.6728
 epoch: 92, train_loss: 0.2998, test_loss: 1.3966, test_f1: 0.6399
 epoch: 93, train_loss: 0.3085, test_loss: 1.4323, test_f1: 0.6061
 epoch: 94, train_loss: 0.2768, test_loss: 1.2549, test_f1: 0.6770
 epoch: 95, train_loss: 0.2936, test_loss: 1.2726, test_f1: 0.6517
 epoch: 96, train_loss: 0.2831, test_loss: 1.2598, test_f1: 0.6632
 epoch: 97, train_loss: 0.2802, test_loss: 1.3650, test_f1: 0.6363
 epoch: 98, train_loss: 0.2711, test_loss: 1.3643, test_f1: 0.6549
 epoch: 99, train_loss: 0.3252, test_loss: 1.6848, test_f1: 0.6033
##################ITERATION #5 ****************************************
 epoch: 0, train_loss: 1.6541, test_loss: 1.3976, test_f1: 0.2260
 epoch: 1, train_loss: 1.0398, test_loss: 1.1673, test_f1: 0.3750
 epoch: 2, train_loss: 0.9913, test_loss: 1.0485, test_f1: 0.5024
 epoch: 3, train_loss: 0.9398, test_loss: 1.0390, test_f1: 0.4850
 epoch: 4, train_loss: 0.9189, test_loss: 0.9667, test_f1: 0.5398
 epoch: 5, train_loss: 0.8922, test_loss: 1.1297, test_f1: 0.4655
 epoch: 6, train_loss: 0.8509, test_loss: 0.9470, test_f1: 0.5204
 epoch: 7, train_loss: 0.8255, test_loss: 1.0850, test_f1: 0.4904
 epoch: 8, train_loss: 0.8077, test_loss: 0.9844, test_f1: 0.5346
 epoch: 9, train_loss: 0.7877, test_loss: 0.9249, test_f1: 0.5578
 epoch: 10, train_loss: 0.7575, test_loss: 0.9751, test_f1: 0.5479
 epoch: 11, train_loss: 0.7618, test_loss: 1.0201, test_f1: 0.5923
 epoch: 12, train_loss: 0.7587, test_loss: 1.0261, test_f1: 0.5663
 epoch: 13, train_loss: 0.7485, test_loss: 1.2181, test_f1: 0.5116
 epoch: 14, train_loss: 0.7376, test_loss: 0.8464, test_f1: 0.6216
 epoch: 15, train_loss: 0.7236, test_loss: 0.9096, test_f1: 0.6062
 epoch: 16, train_loss: 0.7162, test_loss: 0.8679, test_f1: 0.6003
 epoch: 17, train_loss: 0.7101, test_loss: 0.8848, test_f1: 0.5821
 epoch: 18, train_loss: 0.6993, test_loss: 1.2758, test_f1: 0.5116
 epoch: 19, train_loss: 0.7011, test_loss: 0.8548, test_f1: 0.5940
 epoch: 20, train_loss: 0.6816, test_loss: 0.8631, test_f1: 0.5896
 epoch: 21, train_loss: 0.6730, test_loss: 1.2485, test_f1: 0.5358
 epoch: 22, train_loss: 0.6646, test_loss: 0.9968, test_f1: 0.5593
 epoch: 23, train_loss: 0.6451, test_loss: 1.0100, test_f1: 0.5526
 epoch: 24, train_loss: 0.6464, test_loss: 0.8740, test_f1: 0.6259
 epoch: 25, train_loss: 0.6388, test_loss: 0.9462, test_f1: 0.6219
 epoch: 26, train_loss: 0.6227, test_loss: 1.0096, test_f1: 0.5560
 epoch: 27, train_loss: 0.6090, test_loss: 0.7991, test_f1: 0.6497
 epoch: 28, train_loss: 0.6010, test_loss: 1.0143, test_f1: 0.6185
 epoch: 29, train_loss: 0.6032, test_loss: 0.8331, test_f1: 0.6211
 epoch: 30, train_loss: 0.6035, test_loss: 0.9003, test_f1: 0.6099
 epoch: 31, train_loss: 0.5962, test_loss: 1.0942, test_f1: 0.5705
 epoch: 32, train_loss: 0.5766, test_loss: 0.7960, test_f1: 0.6491
 epoch: 33, train_loss: 0.5708, test_loss: 0.8204, test_f1: 0.6297
 epoch: 34, train_loss: 0.5701, test_loss: 0.9867, test_f1: 0.5929
 epoch: 35, train_loss: 0.5702, test_loss: 0.9044, test_f1: 0.6002
 epoch: 36, train_loss: 0.5823, test_loss: 0.9797, test_f1: 0.5863
 epoch: 37, train_loss: 0.5543, test_loss: 0.9076, test_f1: 0.6188
 epoch: 38, train_loss: 0.5547, test_loss: 1.0449, test_f1: 0.5826
 epoch: 39, train_loss: 0.5375, test_loss: 1.1410, test_f1: 0.5721
 epoch: 40, train_loss: 0.5289, test_loss: 0.8846, test_f1: 0.6363
 epoch: 41, train_loss: 0.5100, test_loss: 0.9185, test_f1: 0.6309
 epoch: 42, train_loss: 0.5284, test_loss: 1.1171, test_f1: 0.5806
 epoch: 43, train_loss: 0.5185, test_loss: 1.0118, test_f1: 0.6278
 epoch: 44, train_loss: 0.5176, test_loss: 0.9182, test_f1: 0.6549
 epoch: 45, train_loss: 0.5257, test_loss: 0.8972, test_f1: 0.6523
 epoch: 46, train_loss: 0.5227, test_loss: 0.9419, test_f1: 0.6358
 epoch: 47, train_loss: 0.5033, test_loss: 1.0239, test_f1: 0.6199
 epoch: 48, train_loss: 0.4821, test_loss: 0.9389, test_f1: 0.6021
 epoch: 49, train_loss: 0.5021, test_loss: 1.0362, test_f1: 0.5994
 epoch: 50, train_loss: 0.4827, test_loss: 1.8692, test_f1: 0.4358
 epoch: 51, train_loss: 0.4672, test_loss: 0.9798, test_f1: 0.6503
 epoch: 52, train_loss: 0.4353, test_loss: 0.9081, test_f1: 0.6722
 epoch: 53, train_loss: 0.4160, test_loss: 0.9269, test_f1: 0.6687
 epoch: 54, train_loss: 0.3993, test_loss: 0.9694, test_f1: 0.6664
 epoch: 55, train_loss: 0.4025, test_loss: 0.9085, test_f1: 0.6780
 epoch: 56, train_loss: 0.3992, test_loss: 1.0516, test_f1: 0.6374
 epoch: 57, train_loss: 0.4134, test_loss: 1.0219, test_f1: 0.6513
 epoch: 58, train_loss: 0.3918, test_loss: 0.9223, test_f1: 0.6896
 epoch: 59, train_loss: 0.3777, test_loss: 1.0068, test_f1: 0.6695
 epoch: 60, train_loss: 0.3871, test_loss: 1.0219, test_f1: 0.6528
 epoch: 61, train_loss: 0.3482, test_loss: 0.9918, test_f1: 0.6723
 epoch: 62, train_loss: 0.3749, test_loss: 0.9805, test_f1: 0.6798
 epoch: 63, train_loss: 0.3559, test_loss: 1.1435, test_f1: 0.6186
 epoch: 64, train_loss: 0.3645, test_loss: 1.0933, test_f1: 0.6497
 epoch: 65, train_loss: 0.3465, test_loss: 1.0717, test_f1: 0.6610
 epoch: 66, train_loss: 0.3572, test_loss: 0.9797, test_f1: 0.6731
 epoch: 67, train_loss: 0.3483, test_loss: 1.0350, test_f1: 0.6449
 epoch: 68, train_loss: 0.3530, test_loss: 1.0099, test_f1: 0.6671
 epoch: 69, train_loss: 0.3407, test_loss: 1.1025, test_f1: 0.6724
 epoch: 70, train_loss: 0.3370, test_loss: 1.1180, test_f1: 0.6353
 epoch: 71, train_loss: 0.3453, test_loss: 1.0617, test_f1: 0.6510
 epoch: 72, train_loss: 0.3305, test_loss: 1.0636, test_f1: 0.6310
 epoch: 73, train_loss: 0.3274, test_loss: 1.2441, test_f1: 0.6237
 epoch: 74, train_loss: 0.3393, test_loss: 1.0202, test_f1: 0.6545
 epoch: 75, train_loss: 0.3259, test_loss: 1.0801, test_f1: 0.6684
 epoch: 76, train_loss: 0.3223, test_loss: 1.3023, test_f1: 0.6255
 epoch: 77, train_loss: 0.3211, test_loss: 1.1034, test_f1: 0.6576
 epoch: 78, train_loss: 0.3374, test_loss: 1.1636, test_f1: 0.6771
 epoch: 79, train_loss: 0.3468, test_loss: 1.1696, test_f1: 0.6668
 epoch: 80, train_loss: 0.3151, test_loss: 1.1484, test_f1: 0.6117
 epoch: 81, train_loss: 0.3288, test_loss: 1.0910, test_f1: 0.6734
 epoch: 82, train_loss: 0.3019, test_loss: 1.1184, test_f1: 0.6972
 epoch: 83, train_loss: 0.3005, test_loss: 1.0953, test_f1: 0.6703
 epoch: 84, train_loss: 0.3007, test_loss: 1.1035, test_f1: 0.6503
 epoch: 85, train_loss: 0.3223, test_loss: 1.1236, test_f1: 0.6743
 epoch: 86, train_loss: 0.3363, test_loss: 1.3669, test_f1: 0.6369
 epoch: 87, train_loss: 0.3189, test_loss: 1.0811, test_f1: 0.6730
 epoch: 88, train_loss: 0.2950, test_loss: 1.1915, test_f1: 0.6771
 epoch: 89, train_loss: 0.2902, test_loss: 1.1406, test_f1: 0.6405
 epoch: 90, train_loss: 0.3063, test_loss: 1.1735, test_f1: 0.6442
 epoch: 91, train_loss: 0.2798, test_loss: 1.2066, test_f1: 0.6457
 epoch: 92, train_loss: 0.2857, test_loss: 1.2477, test_f1: 0.6467
 epoch: 93, train_loss: 0.2761, test_loss: 1.1082, test_f1: 0.6721
 epoch: 94, train_loss: 0.2759, test_loss: 1.1734, test_f1: 0.6693
 epoch: 95, train_loss: 0.2735, test_loss: 1.2352, test_f1: 0.6620
 epoch: 96, train_loss: 0.2836, test_loss: 1.1682, test_f1: 0.6721
 epoch: 97, train_loss: 0.2826, test_loss: 1.2838, test_f1: 0.6447
 epoch: 98, train_loss: 0.2724, test_loss: 1.1603, test_f1: 0.6786
 epoch: 99, train_loss: 0.2642, test_loss: 1.2579, test_f1: 0.6518
##################ITERATION #6 ****************************************
 epoch: 0, train_loss: 1.7867, test_loss: 1.2719, test_f1: 0.3529
 epoch: 1, train_loss: 1.1018, test_loss: 1.1058, test_f1: 0.5004
 epoch: 2, train_loss: 1.0396, test_loss: 1.0684, test_f1: 0.5300
 epoch: 3, train_loss: 1.0032, test_loss: 0.9926, test_f1: 0.5180
 epoch: 4, train_loss: 0.9786, test_loss: 1.0904, test_f1: 0.5034
 epoch: 5, train_loss: 0.9299, test_loss: 1.0300, test_f1: 0.5484
 epoch: 6, train_loss: 0.9424, test_loss: 1.0076, test_f1: 0.5170
 epoch: 7, train_loss: 0.9277, test_loss: 1.0447, test_f1: 0.5185
 epoch: 8, train_loss: 0.8890, test_loss: 1.1448, test_f1: 0.5241
 epoch: 9, train_loss: 0.8674, test_loss: 1.0667, test_f1: 0.5304
 epoch: 10, train_loss: 0.8465, test_loss: 0.8907, test_f1: 0.5727
 epoch: 11, train_loss: 0.8260, test_loss: 0.9193, test_f1: 0.5662
 epoch: 12, train_loss: 0.8077, test_loss: 0.9813, test_f1: 0.5580
 epoch: 13, train_loss: 0.7980, test_loss: 0.9868, test_f1: 0.5532
 epoch: 14, train_loss: 0.7853, test_loss: 1.1885, test_f1: 0.4515
 epoch: 15, train_loss: 0.7665, test_loss: 0.9105, test_f1: 0.5832
 epoch: 16, train_loss: 0.7662, test_loss: 0.9324, test_f1: 0.5791
 epoch: 17, train_loss: 0.7860, test_loss: 1.0147, test_f1: 0.5783
 epoch: 18, train_loss: 0.7459, test_loss: 1.2295, test_f1: 0.5016
 epoch: 19, train_loss: 0.7367, test_loss: 1.3390, test_f1: 0.4977
 epoch: 20, train_loss: 0.7491, test_loss: 1.0602, test_f1: 0.5512
 epoch: 21, train_loss: 0.7300, test_loss: 0.9930, test_f1: 0.5597
 epoch: 22, train_loss: 0.7115, test_loss: 1.1011, test_f1: 0.5539
 epoch: 23, train_loss: 0.7146, test_loss: 1.0153, test_f1: 0.5711
 epoch: 24, train_loss: 0.7135, test_loss: 0.8269, test_f1: 0.6285
 epoch: 25, train_loss: 0.6979, test_loss: 0.9576, test_f1: 0.5313
 epoch: 26, train_loss: 0.7003, test_loss: 1.1843, test_f1: 0.5646
 epoch: 27, train_loss: 0.6926, test_loss: 0.8491, test_f1: 0.6046
 epoch: 28, train_loss: 0.6791, test_loss: 1.1802, test_f1: 0.5249
 epoch: 29, train_loss: 0.6916, test_loss: 0.9676, test_f1: 0.6122
 epoch: 30, train_loss: 0.6662, test_loss: 0.9144, test_f1: 0.6068
 epoch: 31, train_loss: 0.6596, test_loss: 0.8664, test_f1: 0.5874
 epoch: 32, train_loss: 0.6614, test_loss: 0.8756, test_f1: 0.6096
 epoch: 33, train_loss: 0.6328, test_loss: 1.3410, test_f1: 0.5637
 epoch: 34, train_loss: 0.6257, test_loss: 0.9510, test_f1: 0.6094
 epoch: 35, train_loss: 0.6373, test_loss: 0.8110, test_f1: 0.6475
 epoch: 36, train_loss: 0.6282, test_loss: 1.0341, test_f1: 0.5989
 epoch: 37, train_loss: 0.6278, test_loss: 1.1388, test_f1: 0.6205
 epoch: 38, train_loss: 0.6064, test_loss: 1.0465, test_f1: 0.6073
 epoch: 39, train_loss: 0.5934, test_loss: 1.1882, test_f1: 0.5997
 epoch: 40, train_loss: 0.6197, test_loss: 0.8343, test_f1: 0.6225
 epoch: 41, train_loss: 0.6212, test_loss: 1.2999, test_f1: 0.5683
 epoch: 42, train_loss: 0.6209, test_loss: 0.9455, test_f1: 0.5930
 epoch: 43, train_loss: 0.6240, test_loss: 1.0149, test_f1: 0.5791
 epoch: 44, train_loss: 0.5897, test_loss: 0.8944, test_f1: 0.6395
 epoch: 45, train_loss: 0.5635, test_loss: 0.7980, test_f1: 0.6646
 epoch: 46, train_loss: 0.5603, test_loss: 1.0687, test_f1: 0.6316
 epoch: 47, train_loss: 0.5894, test_loss: 0.9888, test_f1: 0.5664
 epoch: 48, train_loss: 0.6180, test_loss: 1.6080, test_f1: 0.4391
 epoch: 49, train_loss: 0.6227, test_loss: 0.9906, test_f1: 0.5932
 epoch: 50, train_loss: 0.5838, test_loss: 0.9143, test_f1: 0.6437
 epoch: 51, train_loss: 0.5451, test_loss: 0.9442, test_f1: 0.6405
 epoch: 52, train_loss: 0.5141, test_loss: 0.8390, test_f1: 0.6598
 epoch: 53, train_loss: 0.4920, test_loss: 0.9107, test_f1: 0.6709
 epoch: 54, train_loss: 0.4972, test_loss: 0.8852, test_f1: 0.6630
 epoch: 55, train_loss: 0.4856, test_loss: 0.9978, test_f1: 0.6592
 epoch: 56, train_loss: 0.4669, test_loss: 0.8881, test_f1: 0.6672
 epoch: 57, train_loss: 0.4541, test_loss: 0.9429, test_f1: 0.6661
 epoch: 58, train_loss: 0.4726, test_loss: 0.9560, test_f1: 0.6640
 epoch: 59, train_loss: 0.4519, test_loss: 0.9485, test_f1: 0.6710
 epoch: 60, train_loss: 0.4650, test_loss: 0.9170, test_f1: 0.6636
 epoch: 61, train_loss: 0.4509, test_loss: 0.8831, test_f1: 0.6894
 epoch: 62, train_loss: 0.4647, test_loss: 0.9545, test_f1: 0.6880
 epoch: 63, train_loss: 0.4700, test_loss: 1.0471, test_f1: 0.6396
 epoch: 64, train_loss: 0.4572, test_loss: 1.0373, test_f1: 0.6267
 epoch: 65, train_loss: 0.4533, test_loss: 0.9582, test_f1: 0.6469
 epoch: 66, train_loss: 0.4272, test_loss: 0.9327, test_f1: 0.6634
 epoch: 67, train_loss: 0.4382, test_loss: 0.9476, test_f1: 0.6708
 epoch: 68, train_loss: 0.4249, test_loss: 1.1005, test_f1: 0.6373
 epoch: 69, train_loss: 0.4209, test_loss: 0.9708, test_f1: 0.6655
 epoch: 70, train_loss: 0.4107, test_loss: 1.0445, test_f1: 0.6689
 epoch: 71, train_loss: 0.4217, test_loss: 0.9400, test_f1: 0.6700
 epoch: 72, train_loss: 0.4254, test_loss: 1.0140, test_f1: 0.6468
 epoch: 73, train_loss: 0.4156, test_loss: 0.9325, test_f1: 0.6679
 epoch: 74, train_loss: 0.4255, test_loss: 1.0799, test_f1: 0.6112
 epoch: 75, train_loss: 0.4079, test_loss: 0.9819, test_f1: 0.6934
 epoch: 76, train_loss: 0.4097, test_loss: 1.0119, test_f1: 0.6523
 epoch: 77, train_loss: 0.3973, test_loss: 1.0384, test_f1: 0.6218
 epoch: 78, train_loss: 0.3934, test_loss: 0.9744, test_f1: 0.6605
 epoch: 79, train_loss: 0.3879, test_loss: 1.0055, test_f1: 0.6453
 epoch: 80, train_loss: 0.3830, test_loss: 1.0863, test_f1: 0.6426
 epoch: 81, train_loss: 0.3967, test_loss: 0.9533, test_f1: 0.6439
 epoch: 82, train_loss: 0.4007, test_loss: 1.0137, test_f1: 0.6415
 epoch: 83, train_loss: 0.3951, test_loss: 0.9563, test_f1: 0.6655
 epoch: 84, train_loss: 0.4176, test_loss: 1.1779, test_f1: 0.6246
 epoch: 85, train_loss: 0.3861, test_loss: 1.0157, test_f1: 0.6632
 epoch: 86, train_loss: 0.3723, test_loss: 1.0475, test_f1: 0.6654
 epoch: 87, train_loss: 0.3739, test_loss: 1.0765, test_f1: 0.6553
 epoch: 88, train_loss: 0.3674, test_loss: 1.3524, test_f1: 0.6020
 epoch: 89, train_loss: 0.3635, test_loss: 1.1011, test_f1: 0.6661
 epoch: 90, train_loss: 0.3603, test_loss: 1.0932, test_f1: 0.6514
 epoch: 91, train_loss: 0.3885, test_loss: 1.0888, test_f1: 0.6457
 epoch: 92, train_loss: 0.3610, test_loss: 1.0366, test_f1: 0.6651
 epoch: 93, train_loss: 0.3619, test_loss: 1.0866, test_f1: 0.6503
 epoch: 94, train_loss: 0.3737, test_loss: 0.9324, test_f1: 0.6592
 epoch: 95, train_loss: 0.3599, test_loss: 1.0602, test_f1: 0.6586
 epoch: 96, train_loss: 0.3554, test_loss: 1.0692, test_f1: 0.6307
 epoch: 97, train_loss: 0.3724, test_loss: 1.1121, test_f1: 0.6305
 epoch: 98, train_loss: 0.3644, test_loss: 1.1528, test_f1: 0.6477
 epoch: 99, train_loss: 0.3431, test_loss: 1.1436, test_f1: 0.6482
##################ITERATION #7 ****************************************
 epoch: 0, train_loss: 1.4140, test_loss: 1.3640, test_f1: 0.2787
 epoch: 1, train_loss: 1.0342, test_loss: 1.1477, test_f1: 0.3470
 epoch: 2, train_loss: 0.9687, test_loss: 1.1733, test_f1: 0.3525
 epoch: 3, train_loss: 0.9419, test_loss: 1.0986, test_f1: 0.4305
 epoch: 4, train_loss: 0.8962, test_loss: 1.0540, test_f1: 0.4451
 epoch: 5, train_loss: 0.9003, test_loss: 0.9023, test_f1: 0.5260
 epoch: 6, train_loss: 0.8685, test_loss: 1.0827, test_f1: 0.5230
 epoch: 7, train_loss: 0.8495, test_loss: 0.9387, test_f1: 0.5200
 epoch: 8, train_loss: 0.8176, test_loss: 0.9376, test_f1: 0.5378
 epoch: 9, train_loss: 0.8012, test_loss: 0.9026, test_f1: 0.5592
 epoch: 10, train_loss: 0.8054, test_loss: 0.8854, test_f1: 0.5697
 epoch: 11, train_loss: 0.7819, test_loss: 1.1131, test_f1: 0.4956
 epoch: 12, train_loss: 0.7725, test_loss: 0.7808, test_f1: 0.5623
 epoch: 13, train_loss: 0.7556, test_loss: 1.0819, test_f1: 0.4790
 epoch: 14, train_loss: 0.7362, test_loss: 0.9707, test_f1: 0.5741
 epoch: 15, train_loss: 0.7266, test_loss: 0.8877, test_f1: 0.5585
 epoch: 16, train_loss: 0.7162, test_loss: 0.9462, test_f1: 0.5536
 epoch: 17, train_loss: 0.7210, test_loss: 1.0830, test_f1: 0.5829
 epoch: 18, train_loss: 0.7089, test_loss: 1.0620, test_f1: 0.5301
 epoch: 19, train_loss: 0.6830, test_loss: 1.1371, test_f1: 0.5962
 epoch: 20, train_loss: 0.6963, test_loss: 1.0016, test_f1: 0.5815
 epoch: 21, train_loss: 0.6713, test_loss: 0.9835, test_f1: 0.6086
 epoch: 22, train_loss: 0.6540, test_loss: 0.9869, test_f1: 0.6489
 epoch: 23, train_loss: 0.6504, test_loss: 1.1125, test_f1: 0.6166
 epoch: 24, train_loss: 0.6457, test_loss: 1.1148, test_f1: 0.5710
 epoch: 25, train_loss: 0.6485, test_loss: 1.7023, test_f1: 0.4648
 epoch: 26, train_loss: 0.6611, test_loss: 1.1549, test_f1: 0.5422
 epoch: 27, train_loss: 0.6436, test_loss: 1.0218, test_f1: 0.5811
 epoch: 28, train_loss: 0.6317, test_loss: 1.5273, test_f1: 0.5607
 epoch: 29, train_loss: 0.6306, test_loss: 1.1872, test_f1: 0.5905
 epoch: 30, train_loss: 0.6136, test_loss: 1.0582, test_f1: 0.6236
 epoch: 31, train_loss: 0.6055, test_loss: 1.2458, test_f1: 0.5835
 epoch: 32, train_loss: 0.5942, test_loss: 1.0058, test_f1: 0.5933
 epoch: 33, train_loss: 0.6002, test_loss: 1.0447, test_f1: 0.6528
 epoch: 34, train_loss: 0.5663, test_loss: 1.2080, test_f1: 0.6111
 epoch: 35, train_loss: 0.5660, test_loss: 1.0475, test_f1: 0.6132
 epoch: 36, train_loss: 0.5906, test_loss: 1.0244, test_f1: 0.6727
 epoch: 37, train_loss: 0.5673, test_loss: 1.1037, test_f1: 0.6079
 epoch: 38, train_loss: 0.5547, test_loss: 1.2280, test_f1: 0.5694
 epoch: 39, train_loss: 0.5568, test_loss: 1.0179, test_f1: 0.6559
 epoch: 40, train_loss: 0.5720, test_loss: 1.9141, test_f1: 0.4473
 epoch: 41, train_loss: 0.5488, test_loss: 1.4111, test_f1: 0.5977
 epoch: 42, train_loss: 0.5535, test_loss: 1.1297, test_f1: 0.6207
 epoch: 43, train_loss: 0.5342, test_loss: 1.0403, test_f1: 0.6181
 epoch: 44, train_loss: 0.5242, test_loss: 1.2787, test_f1: 0.5731
 epoch: 45, train_loss: 0.5117, test_loss: 1.1757, test_f1: 0.6012
 epoch: 46, train_loss: 0.5163, test_loss: 1.1831, test_f1: 0.6536
 epoch: 47, train_loss: 0.5223, test_loss: 1.1046, test_f1: 0.6433
 epoch: 48, train_loss: 0.5220, test_loss: 1.0237, test_f1: 0.6392
 epoch: 49, train_loss: 0.5147, test_loss: 1.1399, test_f1: 0.6208
 epoch: 50, train_loss: 0.5152, test_loss: 1.1152, test_f1: 0.6554
 epoch: 51, train_loss: 0.4751, test_loss: 1.3798, test_f1: 0.6441
 epoch: 52, train_loss: 0.4473, test_loss: 1.2443, test_f1: 0.6791
 epoch: 53, train_loss: 0.4124, test_loss: 1.1352, test_f1: 0.6969
 epoch: 54, train_loss: 0.4118, test_loss: 1.1576, test_f1: 0.6721
 epoch: 55, train_loss: 0.4050, test_loss: 1.2492, test_f1: 0.6414
 epoch: 56, train_loss: 0.4117, test_loss: 1.2603, test_f1: 0.6652
 epoch: 57, train_loss: 0.4085, test_loss: 1.1552, test_f1: 0.6693
 epoch: 58, train_loss: 0.3964, test_loss: 1.5427, test_f1: 0.6200
 epoch: 59, train_loss: 0.3797, test_loss: 1.3273, test_f1: 0.6524
 epoch: 60, train_loss: 0.3813, test_loss: 1.2136, test_f1: 0.6720
 epoch: 61, train_loss: 0.3869, test_loss: 1.3717, test_f1: 0.6553
 epoch: 62, train_loss: 0.3835, test_loss: 1.2383, test_f1: 0.6536
 epoch: 63, train_loss: 0.3798, test_loss: 1.2060, test_f1: 0.6514
 epoch: 64, train_loss: 0.3827, test_loss: 1.5192, test_f1: 0.6425
 epoch: 65, train_loss: 0.3889, test_loss: 1.3354, test_f1: 0.6520
 epoch: 66, train_loss: 0.3865, test_loss: 1.2895, test_f1: 0.6724
 epoch: 67, train_loss: 0.3938, test_loss: 1.4728, test_f1: 0.6356
 epoch: 68, train_loss: 0.3762, test_loss: 1.1580, test_f1: 0.6790
 epoch: 69, train_loss: 0.3597, test_loss: 1.6030, test_f1: 0.6020
 epoch: 70, train_loss: 0.3638, test_loss: 1.1898, test_f1: 0.6783
 epoch: 71, train_loss: 0.3910, test_loss: 1.2980, test_f1: 0.6695
 epoch: 72, train_loss: 0.3652, test_loss: 1.6012, test_f1: 0.6315
 epoch: 73, train_loss: 0.3512, test_loss: 1.4952, test_f1: 0.6470
 epoch: 74, train_loss: 0.3585, test_loss: 1.4763, test_f1: 0.6427
 epoch: 75, train_loss: 0.3521, test_loss: 1.3000, test_f1: 0.6800
 epoch: 76, train_loss: 0.3533, test_loss: 1.6509, test_f1: 0.6359
 epoch: 77, train_loss: 0.3659, test_loss: 1.5171, test_f1: 0.6371
 epoch: 78, train_loss: 0.3464, test_loss: 1.3720, test_f1: 0.6868
 epoch: 79, train_loss: 0.3362, test_loss: 1.5124, test_f1: 0.6597
 epoch: 80, train_loss: 0.3580, test_loss: 1.6082, test_f1: 0.6602
 epoch: 81, train_loss: 0.3465, test_loss: 1.5973, test_f1: 0.6050
 epoch: 82, train_loss: 0.3323, test_loss: 1.6097, test_f1: 0.6478
 epoch: 83, train_loss: 0.3295, test_loss: 1.4977, test_f1: 0.6731
 epoch: 84, train_loss: 0.3149, test_loss: 1.3925, test_f1: 0.6682
 epoch: 85, train_loss: 0.3154, test_loss: 1.7970, test_f1: 0.6590
 epoch: 86, train_loss: 0.3181, test_loss: 1.4054, test_f1: 0.7102
 epoch: 87, train_loss: 0.3234, test_loss: 1.7647, test_f1: 0.6200
 epoch: 88, train_loss: 0.3221, test_loss: 1.3549, test_f1: 0.6649
 epoch: 89, train_loss: 0.3419, test_loss: 1.8575, test_f1: 0.6481
 epoch: 90, train_loss: 0.3215, test_loss: 1.6097, test_f1: 0.6513
 epoch: 91, train_loss: 0.3052, test_loss: 1.3305, test_f1: 0.6830
 epoch: 92, train_loss: 0.3023, test_loss: 1.4344, test_f1: 0.7011
 epoch: 93, train_loss: 0.3059, test_loss: 1.5827, test_f1: 0.6390
 epoch: 94, train_loss: 0.3090, test_loss: 1.6688, test_f1: 0.6816
 epoch: 95, train_loss: 0.2983, test_loss: 1.3974, test_f1: 0.7050
 epoch: 96, train_loss: 0.2891, test_loss: 1.5649, test_f1: 0.6709
 epoch: 97, train_loss: 0.2797, test_loss: 1.5476, test_f1: 0.6676
 epoch: 98, train_loss: 0.3062, test_loss: 2.0162, test_f1: 0.6190
 epoch: 99, train_loss: 0.3128, test_loss: 1.4138, test_f1: 0.6772
##################ITERATION #8 ****************************************
 epoch: 0, train_loss: 1.5116, test_loss: 1.3560, test_f1: 0.3312
 epoch: 1, train_loss: 1.0172, test_loss: 1.1688, test_f1: 0.3893
 epoch: 2, train_loss: 0.9647, test_loss: 1.0487, test_f1: 0.4680
 epoch: 3, train_loss: 0.9246, test_loss: 0.9432, test_f1: 0.5467
 epoch: 4, train_loss: 0.8906, test_loss: 1.2555, test_f1: 0.4246
 epoch: 5, train_loss: 0.8783, test_loss: 0.8711, test_f1: 0.5467
 epoch: 6, train_loss: 0.8432, test_loss: 0.9835, test_f1: 0.5374
 epoch: 7, train_loss: 0.8234, test_loss: 1.1042, test_f1: 0.4866
 epoch: 8, train_loss: 0.7935, test_loss: 1.1300, test_f1: 0.5158
 epoch: 9, train_loss: 0.7933, test_loss: 1.0249, test_f1: 0.4939
 epoch: 10, train_loss: 0.7863, test_loss: 0.9111, test_f1: 0.5569
 epoch: 11, train_loss: 0.7870, test_loss: 0.9749, test_f1: 0.5426
 epoch: 12, train_loss: 0.7609, test_loss: 0.9004, test_f1: 0.5439
 epoch: 13, train_loss: 0.7433, test_loss: 1.0457, test_f1: 0.5215
 epoch: 14, train_loss: 0.7448, test_loss: 0.9068, test_f1: 0.5567
 epoch: 15, train_loss: 0.7332, test_loss: 0.8570, test_f1: 0.5832
 epoch: 16, train_loss: 0.7414, test_loss: 0.8242, test_f1: 0.5656
 epoch: 17, train_loss: 0.7011, test_loss: 0.9349, test_f1: 0.5551
 epoch: 18, train_loss: 0.6767, test_loss: 0.8845, test_f1: 0.5997
 epoch: 19, train_loss: 0.6870, test_loss: 1.0489, test_f1: 0.5421
 epoch: 20, train_loss: 0.6754, test_loss: 0.9728, test_f1: 0.5882
 epoch: 21, train_loss: 0.6730, test_loss: 0.8899, test_f1: 0.5543
 epoch: 22, train_loss: 0.6646, test_loss: 0.8986, test_f1: 0.6152
 epoch: 23, train_loss: 0.6476, test_loss: 1.2647, test_f1: 0.5134
 epoch: 24, train_loss: 0.6462, test_loss: 1.0099, test_f1: 0.5656
 epoch: 25, train_loss: 0.6424, test_loss: 0.8739, test_f1: 0.6171
 epoch: 26, train_loss: 0.6090, test_loss: 0.9610, test_f1: 0.5592
 epoch: 27, train_loss: 0.6088, test_loss: 1.0077, test_f1: 0.5012
 epoch: 28, train_loss: 0.6024, test_loss: 1.0138, test_f1: 0.5881
 epoch: 29, train_loss: 0.6082, test_loss: 0.8331, test_f1: 0.5934
 epoch: 30, train_loss: 0.6163, test_loss: 0.9370, test_f1: 0.5945
 epoch: 31, train_loss: 0.5867, test_loss: 0.9324, test_f1: 0.6326
 epoch: 32, train_loss: 0.5593, test_loss: 1.0695, test_f1: 0.5481
 epoch: 33, train_loss: 0.5674, test_loss: 0.9548, test_f1: 0.6219
 epoch: 34, train_loss: 0.5673, test_loss: 1.0925, test_f1: 0.5142
 epoch: 35, train_loss: 0.5552, test_loss: 0.9672, test_f1: 0.5910
 epoch: 36, train_loss: 0.5380, test_loss: 0.9350, test_f1: 0.6223
 epoch: 37, train_loss: 0.5504, test_loss: 0.8435, test_f1: 0.6433
 epoch: 38, train_loss: 0.5670, test_loss: 1.0872, test_f1: 0.5642
 epoch: 39, train_loss: 0.5402, test_loss: 1.1185, test_f1: 0.5663
 epoch: 40, train_loss: 0.5200, test_loss: 1.1151, test_f1: 0.5516
 epoch: 41, train_loss: 0.5107, test_loss: 1.0370, test_f1: 0.6421
 epoch: 42, train_loss: 0.5536, test_loss: 1.0585, test_f1: 0.5956
 epoch: 43, train_loss: 0.5691, test_loss: 1.0720, test_f1: 0.6298
 epoch: 44, train_loss: 0.5268, test_loss: 1.0519, test_f1: 0.6333
 epoch: 45, train_loss: 0.4971, test_loss: 0.8917, test_f1: 0.6734
 epoch: 46, train_loss: 0.4986, test_loss: 0.8725, test_f1: 0.6268
 epoch: 47, train_loss: 0.5162, test_loss: 1.0329, test_f1: 0.6033
 epoch: 48, train_loss: 0.4852, test_loss: 0.9984, test_f1: 0.6781
 epoch: 49, train_loss: 0.4748, test_loss: 1.0558, test_f1: 0.5763
 epoch: 50, train_loss: 0.4832, test_loss: 1.1841, test_f1: 0.6668
 epoch: 51, train_loss: 0.4424, test_loss: 0.9389, test_f1: 0.6567
 epoch: 52, train_loss: 0.4164, test_loss: 0.8814, test_f1: 0.6874
 epoch: 53, train_loss: 0.3957, test_loss: 0.9103, test_f1: 0.6736
 epoch: 54, train_loss: 0.3847, test_loss: 0.9050, test_f1: 0.6685
 epoch: 55, train_loss: 0.3752, test_loss: 0.9719, test_f1: 0.6649
 epoch: 56, train_loss: 0.3749, test_loss: 1.0565, test_f1: 0.6771
 epoch: 57, train_loss: 0.3788, test_loss: 1.0348, test_f1: 0.6503
 epoch: 58, train_loss: 0.3846, test_loss: 1.2644, test_f1: 0.6510
 epoch: 59, train_loss: 0.3702, test_loss: 0.9724, test_f1: 0.6738
 epoch: 60, train_loss: 0.3701, test_loss: 1.0148, test_f1: 0.6448
 epoch: 61, train_loss: 0.3749, test_loss: 0.9269, test_f1: 0.6822
 epoch: 62, train_loss: 0.3487, test_loss: 1.0371, test_f1: 0.6624
 epoch: 63, train_loss: 0.3320, test_loss: 0.9025, test_f1: 0.6871
 epoch: 64, train_loss: 0.3418, test_loss: 1.0423, test_f1: 0.6666
 epoch: 65, train_loss: 0.3386, test_loss: 1.1026, test_f1: 0.7061
 epoch: 66, train_loss: 0.3581, test_loss: 0.9871, test_f1: 0.6643
 epoch: 67, train_loss: 0.3336, test_loss: 0.9210, test_f1: 0.6933
 epoch: 68, train_loss: 0.3585, test_loss: 1.1385, test_f1: 0.6463
 epoch: 69, train_loss: 0.3599, test_loss: 0.8813, test_f1: 0.6890
 epoch: 70, train_loss: 0.3438, test_loss: 1.1294, test_f1: 0.6505
 epoch: 71, train_loss: 0.3755, test_loss: 1.0823, test_f1: 0.6431
 epoch: 72, train_loss: 0.3501, test_loss: 1.3566, test_f1: 0.6375
 epoch: 73, train_loss: 0.3222, test_loss: 0.9609, test_f1: 0.6378
 epoch: 74, train_loss: 0.3292, test_loss: 1.0448, test_f1: 0.6595
 epoch: 75, train_loss: 0.3200, test_loss: 1.2245, test_f1: 0.6558
 epoch: 76, train_loss: 0.3446, test_loss: 1.1110, test_f1: 0.6726
 epoch: 77, train_loss: 0.3144, test_loss: 1.0058, test_f1: 0.6712
 epoch: 78, train_loss: 0.3127, test_loss: 1.1539, test_f1: 0.6708
 epoch: 79, train_loss: 0.3087, test_loss: 1.1240, test_f1: 0.6798
 epoch: 80, train_loss: 0.3115, test_loss: 1.1736, test_f1: 0.6775
 epoch: 81, train_loss: 0.3008, test_loss: 1.0159, test_f1: 0.6703
 epoch: 82, train_loss: 0.3028, test_loss: 1.5619, test_f1: 0.5781
 epoch: 83, train_loss: 0.3326, test_loss: 1.1214, test_f1: 0.6483
 epoch: 84, train_loss: 0.3151, test_loss: 1.0060, test_f1: 0.6778
 epoch: 85, train_loss: 0.3129, test_loss: 1.8326, test_f1: 0.6181
 epoch: 86, train_loss: 0.3091, test_loss: 1.2764, test_f1: 0.6514
 epoch: 87, train_loss: 0.2863, test_loss: 1.0596, test_f1: 0.6833
 epoch: 88, train_loss: 0.3240, test_loss: 1.1385, test_f1: 0.6540
 epoch: 89, train_loss: 0.3109, test_loss: 1.4845, test_f1: 0.6392
 epoch: 90, train_loss: 0.3002, test_loss: 1.1100, test_f1: 0.6928
 epoch: 91, train_loss: 0.3078, test_loss: 1.3118, test_f1: 0.6405
 epoch: 92, train_loss: 0.3106, test_loss: 1.3015, test_f1: 0.6259
 epoch: 93, train_loss: 0.2949, test_loss: 1.3276, test_f1: 0.6706
 epoch: 94, train_loss: 0.2862, test_loss: 1.1465, test_f1: 0.6728
 epoch: 95, train_loss: 0.2669, test_loss: 1.4065, test_f1: 0.6084
 epoch: 96, train_loss: 0.2708, test_loss: 1.3644, test_f1: 0.6609
 epoch: 97, train_loss: 0.2833, test_loss: 1.2364, test_f1: 0.6701
 epoch: 98, train_loss: 0.2811, test_loss: 1.0857, test_f1: 0.6736
 epoch: 99, train_loss: 0.2871, test_loss: 1.1900, test_f1: 0.6488
##################ITERATION #9 ****************************************
 epoch: 0, train_loss: 1.8157, test_loss: 1.4446, test_f1: 0.3303
 epoch: 1, train_loss: 1.0712, test_loss: 1.2047, test_f1: 0.3994
 epoch: 2, train_loss: 1.0183, test_loss: 1.0610, test_f1: 0.4860
 epoch: 3, train_loss: 1.0123, test_loss: 1.0820, test_f1: 0.4943
 epoch: 4, train_loss: 0.9722, test_loss: 1.0190, test_f1: 0.5280
 epoch: 5, train_loss: 0.9430, test_loss: 1.0295, test_f1: 0.5308
 epoch: 6, train_loss: 0.9210, test_loss: 1.0558, test_f1: 0.4824
 epoch: 7, train_loss: 0.8946, test_loss: 0.9921, test_f1: 0.5013
 epoch: 8, train_loss: 0.8739, test_loss: 1.2232, test_f1: 0.5079
 epoch: 9, train_loss: 0.8557, test_loss: 1.1121, test_f1: 0.4895
 epoch: 10, train_loss: 0.8461, test_loss: 0.9495, test_f1: 0.5262
 epoch: 11, train_loss: 0.8193, test_loss: 0.9073, test_f1: 0.5554
 epoch: 12, train_loss: 0.7951, test_loss: 1.0619, test_f1: 0.4908
 epoch: 13, train_loss: 0.8154, test_loss: 0.9593, test_f1: 0.5537
 epoch: 14, train_loss: 0.7858, test_loss: 0.9068, test_f1: 0.5738
 epoch: 15, train_loss: 0.7724, test_loss: 0.9471, test_f1: 0.5717
 epoch: 16, train_loss: 0.7603, test_loss: 0.9287, test_f1: 0.5824
 epoch: 17, train_loss: 0.7367, test_loss: 0.8337, test_f1: 0.5613
 epoch: 18, train_loss: 0.7452, test_loss: 1.1192, test_f1: 0.4807
 epoch: 19, train_loss: 0.7319, test_loss: 0.8557, test_f1: 0.5962
 epoch: 20, train_loss: 0.7199, test_loss: 0.9948, test_f1: 0.5764
 epoch: 21, train_loss: 0.7197, test_loss: 0.9457, test_f1: 0.5175
 epoch: 22, train_loss: 0.7104, test_loss: 0.8280, test_f1: 0.5848
 epoch: 23, train_loss: 0.7013, test_loss: 1.0087, test_f1: 0.5482
 epoch: 24, train_loss: 0.6915, test_loss: 0.9343, test_f1: 0.5772
 epoch: 25, train_loss: 0.6929, test_loss: 0.9782, test_f1: 0.5862
 epoch: 26, train_loss: 0.6781, test_loss: 0.8762, test_f1: 0.6107
 epoch: 27, train_loss: 0.6645, test_loss: 1.0165, test_f1: 0.5927
 epoch: 28, train_loss: 0.6424, test_loss: 1.0375, test_f1: 0.5753
 epoch: 29, train_loss: 0.6670, test_loss: 0.8810, test_f1: 0.6222
 epoch: 30, train_loss: 0.6245, test_loss: 0.9275, test_f1: 0.5578
 epoch: 31, train_loss: 0.6202, test_loss: 0.9755, test_f1: 0.5909
 epoch: 32, train_loss: 0.6174, test_loss: 1.0043, test_f1: 0.6178
 epoch: 33, train_loss: 0.6233, test_loss: 1.0580, test_f1: 0.6030
 epoch: 34, train_loss: 0.6165, test_loss: 1.3027, test_f1: 0.5132
 epoch: 35, train_loss: 0.6224, test_loss: 0.9967, test_f1: 0.5845
 epoch: 36, train_loss: 0.6263, test_loss: 0.9497, test_f1: 0.6069
 epoch: 37, train_loss: 0.6288, test_loss: 0.8814, test_f1: 0.6325
 epoch: 38, train_loss: 0.5951, test_loss: 1.0746, test_f1: 0.5875
 epoch: 39, train_loss: 0.6026, test_loss: 1.0046, test_f1: 0.6212
 epoch: 40, train_loss: 0.5728, test_loss: 0.9734, test_f1: 0.5995
 epoch: 41, train_loss: 0.5876, test_loss: 1.6492, test_f1: 0.4751
 epoch: 42, train_loss: 0.5935, test_loss: 0.8863, test_f1: 0.6466
 epoch: 43, train_loss: 0.5681, test_loss: 1.3165, test_f1: 0.6054
 epoch: 44, train_loss: 0.5617, test_loss: 0.9648, test_f1: 0.6310
 epoch: 45, train_loss: 0.5558, test_loss: 0.8438, test_f1: 0.6661
 epoch: 46, train_loss: 0.5501, test_loss: 0.8950, test_f1: 0.6342
 epoch: 47, train_loss: 0.5420, test_loss: 1.1837, test_f1: 0.5054
 epoch: 48, train_loss: 0.5488, test_loss: 0.8909, test_f1: 0.6149
 epoch: 49, train_loss: 0.5607, test_loss: 1.0046, test_f1: 0.5785
 epoch: 50, train_loss: 0.5556, test_loss: 0.9313, test_f1: 0.6113
 epoch: 51, train_loss: 0.5228, test_loss: 0.9751, test_f1: 0.6431
 epoch: 52, train_loss: 0.4765, test_loss: 1.0068, test_f1: 0.6255
 epoch: 53, train_loss: 0.4882, test_loss: 0.9161, test_f1: 0.6429
 epoch: 54, train_loss: 0.4577, test_loss: 1.1612, test_f1: 0.5946
 epoch: 55, train_loss: 0.4346, test_loss: 0.9733, test_f1: 0.6290
 epoch: 56, train_loss: 0.4264, test_loss: 0.9552, test_f1: 0.6223
 epoch: 57, train_loss: 0.4188, test_loss: 0.9854, test_f1: 0.6469
 epoch: 58, train_loss: 0.4361, test_loss: 0.9709, test_f1: 0.6339
 epoch: 59, train_loss: 0.4187, test_loss: 0.9691, test_f1: 0.6292
 epoch: 60, train_loss: 0.4193, test_loss: 1.0020, test_f1: 0.6123
 epoch: 61, train_loss: 0.4305, test_loss: 1.0859, test_f1: 0.5899
 epoch: 62, train_loss: 0.4064, test_loss: 0.9977, test_f1: 0.6008
 epoch: 63, train_loss: 0.4086, test_loss: 1.0284, test_f1: 0.6280
 epoch: 64, train_loss: 0.4157, test_loss: 0.9339, test_f1: 0.6408
 epoch: 65, train_loss: 0.4161, test_loss: 1.1558, test_f1: 0.6066
 epoch: 66, train_loss: 0.3869, test_loss: 1.0095, test_f1: 0.6305
 epoch: 67, train_loss: 0.3860, test_loss: 1.1104, test_f1: 0.6194
 epoch: 68, train_loss: 0.3880, test_loss: 1.0335, test_f1: 0.6419
 epoch: 69, train_loss: 0.3993, test_loss: 1.1924, test_f1: 0.6084
 epoch: 70, train_loss: 0.3864, test_loss: 0.9163, test_f1: 0.6360
 epoch: 71, train_loss: 0.3672, test_loss: 1.3238, test_f1: 0.6118
 epoch: 72, train_loss: 0.3894, test_loss: 1.2510, test_f1: 0.6104
 epoch: 73, train_loss: 0.4057, test_loss: 1.1181, test_f1: 0.6372
 epoch: 74, train_loss: 0.3821, test_loss: 1.1734, test_f1: 0.6660
 epoch: 75, train_loss: 0.3652, test_loss: 1.0884, test_f1: 0.6199
 epoch: 76, train_loss: 0.3708, test_loss: 1.0540, test_f1: 0.6363
 epoch: 77, train_loss: 0.3737, test_loss: 1.0890, test_f1: 0.6200
 epoch: 78, train_loss: 0.3705, test_loss: 1.1005, test_f1: 0.6403
 epoch: 79, train_loss: 0.3835, test_loss: 1.2444, test_f1: 0.6377
 epoch: 80, train_loss: 0.3732, test_loss: 1.0667, test_f1: 0.6284
 epoch: 81, train_loss: 0.3441, test_loss: 1.1632, test_f1: 0.6433
 epoch: 82, train_loss: 0.3741, test_loss: 1.0359, test_f1: 0.6551
 epoch: 83, train_loss: 0.3653, test_loss: 1.3645, test_f1: 0.6254
 epoch: 84, train_loss: 0.3438, test_loss: 1.1053, test_f1: 0.6387
 epoch: 85, train_loss: 0.3495, test_loss: 0.9725, test_f1: 0.6805
 epoch: 86, train_loss: 0.3457, test_loss: 1.2250, test_f1: 0.6344
 epoch: 87, train_loss: 0.3478, test_loss: 1.1565, test_f1: 0.6317
 epoch: 88, train_loss: 0.3326, test_loss: 1.1232, test_f1: 0.6470
 epoch: 89, train_loss: 0.3364, test_loss: 1.1210, test_f1: 0.6610
 epoch: 90, train_loss: 0.3265, test_loss: 1.1979, test_f1: 0.6612
 epoch: 91, train_loss: 0.3263, test_loss: 1.2842, test_f1: 0.6462
 epoch: 92, train_loss: 0.3402, test_loss: 1.0815, test_f1: 0.6473
 epoch: 93, train_loss: 0.3357, test_loss: 1.0822, test_f1: 0.6680
 epoch: 94, train_loss: 0.3187, test_loss: 1.2329, test_f1: 0.6631
 epoch: 95, train_loss: 0.3094, test_loss: 1.2773, test_f1: 0.6314
 epoch: 96, train_loss: 0.3569, test_loss: 1.1731, test_f1: 0.6743
 epoch: 97, train_loss: 0.3515, test_loss: 1.1943, test_f1: 0.6704
 epoch: 98, train_loss: 0.3154, test_loss: 1.2143, test_f1: 0.6339
 epoch: 99, train_loss: 0.3126, test_loss: 1.1323, test_f1: 0.6505

Training completed in 424.82 seconds
Best F1: 0.7112 at epoch 87
Mean F1 across iterations: 0.6911  0.0151
========================FINAL RESULTS================================
FEGIN weighted F1: 0.7112  0.0151
python main.py --data ltspice_examples --representation component_pin --model FEGIN --layers 3 --hiddens 64 --batch_size 256 --lr 0.01 --emb_size 250 --epochs 100 --save_appendix component_pin_L3_H64_BS256_LR0.01_E250 --no_val
-----



STDERR:
  File "main.py", line 370, in <module>
    main()
  File "main.py", line 254, in main
    dataset = dataset_class(
  File "/home/philip/projects/ltspice_examples_code_repo/Circuit-Completion-Using-GNNs/component_classification_with_link_prediction_head/evaluation/FEGIN/kernel/circuit_datasets.py", line 15, in __init__
    self.data, self.slices = torch.load(self.processed_paths[0])
  File "/home/philip/.local/lib/python3.8/site-packages/torch/serialization.py", line 1040, in load
    warnings.warn(
  File "/usr/lib/python3.8/warnings.py", line 109, in _showwarnmsg
    sw(msg.message, msg.category, msg.filename, msg.lineno,
  File "main.py", line 47, in warn_with_traceback
    traceback.print_stack(file=log)
/home/philip/projects/ltspice_examples_code_repo/Circuit-Completion-Using-GNNs/component_classification_with_link_prediction_head/evaluation/FEGIN/kernel/circuit_datasets.py:15: FutureWarning: You are using `torch.load` with `weights_only=False` (the current default value), which uses the default pickle module implicitly. It is possible to construct malicious pickle data which will execute arbitrary code during unpickling (See https://github.com/pytorch/pytorch/blob/main/SECURITY.md#untrusted-models for more details). In a future release, the default value for `weights_only` will be flipped to `True`. This limits the functions that could be executed during unpickling. Arbitrary objects will no longer be allowed to be loaded via this mode unless they are explicitly allowlisted by the user via `torch.serialization.add_safe_globals`. We recommend you start setting `weights_only=True` for any use case where you don't have full control of the loaded file. Please open an issue on GitHub for any issues related to this experimental feature.
  self.data, self.slices = torch.load(self.processed_paths[0])
