STDOUT:
Results will be saved in /home/philip/projects/ltspice_examples_code_repo/Circuit-Completion-Using-GNNs/component_classification_with_link_prediction_head/evaluation/FEGIN/results/model_FEGIN_dataset_ltspice_examples
Command line input: python main.py --data ltspice_examples --representation component_component --model FEGIN --layers 4 --hiddens 16 --batch_size 128 --lr 0.001 --emb_size 250 --epochs 100 --save_appendix component_component_L4_H16_BS128_LR0.001_E250 --no_val
 is saved.
-----
ltspice_examples - FEGIN
Using 4 layers, 16 hidden units, h = 2
Loading component_component representation dataset
ENTERED
Training FEGIN on component_component representation
Train: 3556, Test: 845
##################ITERATION #0 ****************************************
 epoch: 0, train_loss: 1.3474, test_loss: 1.3455, test_f1: 0.2274
 epoch: 1, train_loss: 1.3261, test_loss: 1.3282, test_f1: 0.2274
 epoch: 2, train_loss: 1.3078, test_loss: 1.3086, test_f1: 0.2274
 epoch: 3, train_loss: 1.2875, test_loss: 1.2835, test_f1: 0.2274
 epoch: 4, train_loss: 1.2690, test_loss: 1.2546, test_f1: 0.2274
 epoch: 5, train_loss: 1.2553, test_loss: 1.2310, test_f1: 0.2274
 epoch: 6, train_loss: 1.2431, test_loss: 1.2226, test_f1: 0.2274
 epoch: 7, train_loss: 1.2368, test_loss: 1.2158, test_f1: 0.2491
 epoch: 8, train_loss: 1.2227, test_loss: 1.2069, test_f1: 0.3063
 epoch: 9, train_loss: 1.2190, test_loss: 1.1969, test_f1: 0.3251
 epoch: 10, train_loss: 1.2106, test_loss: 1.1905, test_f1: 0.3580
 epoch: 11, train_loss: 1.1960, test_loss: 1.1798, test_f1: 0.3515
 epoch: 12, train_loss: 1.1924, test_loss: 1.1652, test_f1: 0.3487
 epoch: 13, train_loss: 1.1773, test_loss: 1.1657, test_f1: 0.3904
 epoch: 14, train_loss: 1.1779, test_loss: 1.1697, test_f1: 0.4119
 epoch: 15, train_loss: 1.1622, test_loss: 1.1553, test_f1: 0.4085
 epoch: 16, train_loss: 1.1514, test_loss: 1.1540, test_f1: 0.4072
 epoch: 17, train_loss: 1.1486, test_loss: 1.1298, test_f1: 0.4326
 epoch: 18, train_loss: 1.1351, test_loss: 1.1377, test_f1: 0.4305
 epoch: 19, train_loss: 1.1277, test_loss: 1.1347, test_f1: 0.4167
 epoch: 20, train_loss: 1.1161, test_loss: 1.0986, test_f1: 0.4526
 epoch: 21, train_loss: 1.1105, test_loss: 1.0900, test_f1: 0.4596
 epoch: 22, train_loss: 1.0990, test_loss: 1.1009, test_f1: 0.4229
 epoch: 23, train_loss: 1.0834, test_loss: 1.0856, test_f1: 0.4343
 epoch: 24, train_loss: 1.0797, test_loss: 1.0869, test_f1: 0.4488
 epoch: 25, train_loss: 1.0831, test_loss: 1.0878, test_f1: 0.4373
 epoch: 26, train_loss: 1.0661, test_loss: 1.0573, test_f1: 0.4353
 epoch: 27, train_loss: 1.0617, test_loss: 1.0487, test_f1: 0.4399
 epoch: 28, train_loss: 1.0515, test_loss: 1.0498, test_f1: 0.4597
 epoch: 29, train_loss: 1.0508, test_loss: 1.0365, test_f1: 0.4443
 epoch: 30, train_loss: 1.0439, test_loss: 1.0325, test_f1: 0.4475
 epoch: 31, train_loss: 1.0388, test_loss: 1.0444, test_f1: 0.4383
 epoch: 32, train_loss: 1.0377, test_loss: 1.0395, test_f1: 0.4477
 epoch: 33, train_loss: 1.0116, test_loss: 1.0310, test_f1: 0.4366
 epoch: 34, train_loss: 1.0153, test_loss: 1.0247, test_f1: 0.4599
 epoch: 35, train_loss: 1.0044, test_loss: 1.0271, test_f1: 0.4447
 epoch: 36, train_loss: 1.0033, test_loss: 1.0086, test_f1: 0.4527
 epoch: 37, train_loss: 1.0001, test_loss: 1.0102, test_f1: 0.4603
 epoch: 38, train_loss: 0.9886, test_loss: 1.0153, test_f1: 0.4512
 epoch: 39, train_loss: 0.9852, test_loss: 1.0564, test_f1: 0.4194
 epoch: 40, train_loss: 0.9794, test_loss: 1.0115, test_f1: 0.4687
 epoch: 41, train_loss: 0.9752, test_loss: 1.0049, test_f1: 0.4746
 epoch: 42, train_loss: 0.9850, test_loss: 0.9933, test_f1: 0.4563
 epoch: 43, train_loss: 0.9707, test_loss: 0.9952, test_f1: 0.4761
 epoch: 44, train_loss: 0.9587, test_loss: 1.0133, test_f1: 0.4436
 epoch: 45, train_loss: 0.9542, test_loss: 1.0309, test_f1: 0.4467
 epoch: 46, train_loss: 0.9595, test_loss: 1.0016, test_f1: 0.4687
 epoch: 47, train_loss: 0.9443, test_loss: 0.9908, test_f1: 0.4532
 epoch: 48, train_loss: 0.9432, test_loss: 1.0041, test_f1: 0.4521
 epoch: 49, train_loss: 0.9483, test_loss: 0.9954, test_f1: 0.4781
 epoch: 50, train_loss: 0.9332, test_loss: 0.9765, test_f1: 0.4730
 epoch: 51, train_loss: 0.9262, test_loss: 1.0129, test_f1: 0.4639
 epoch: 52, train_loss: 0.9322, test_loss: 1.0039, test_f1: 0.4668
 epoch: 53, train_loss: 0.9189, test_loss: 1.0140, test_f1: 0.4551
 epoch: 54, train_loss: 0.9239, test_loss: 1.0119, test_f1: 0.4560
 epoch: 55, train_loss: 0.9143, test_loss: 1.0171, test_f1: 0.4648
 epoch: 56, train_loss: 0.9276, test_loss: 0.9983, test_f1: 0.4669
 epoch: 57, train_loss: 0.9160, test_loss: 1.0003, test_f1: 0.4563
 epoch: 58, train_loss: 0.9185, test_loss: 1.0054, test_f1: 0.4666
 epoch: 59, train_loss: 0.9011, test_loss: 1.0111, test_f1: 0.4624
 epoch: 60, train_loss: 0.9078, test_loss: 1.0428, test_f1: 0.4497
 epoch: 61, train_loss: 0.9014, test_loss: 1.0074, test_f1: 0.4931
 epoch: 62, train_loss: 0.8935, test_loss: 1.0327, test_f1: 0.4568
 epoch: 63, train_loss: 0.8946, test_loss: 1.0354, test_f1: 0.4514
 epoch: 64, train_loss: 0.9037, test_loss: 1.0288, test_f1: 0.4528
 epoch: 65, train_loss: 0.8889, test_loss: 1.0158, test_f1: 0.4738
 epoch: 66, train_loss: 0.9039, test_loss: 1.0195, test_f1: 0.4652
 epoch: 67, train_loss: 0.8915, test_loss: 1.0196, test_f1: 0.4712
 epoch: 68, train_loss: 0.8883, test_loss: 1.0449, test_f1: 0.4582
 epoch: 69, train_loss: 0.8928, test_loss: 1.0753, test_f1: 0.4417
 epoch: 70, train_loss: 0.8922, test_loss: 1.0612, test_f1: 0.4361
 epoch: 71, train_loss: 0.8906, test_loss: 1.0552, test_f1: 0.4724
 epoch: 72, train_loss: 0.8934, test_loss: 1.0564, test_f1: 0.4644
 epoch: 73, train_loss: 0.8821, test_loss: 1.0273, test_f1: 0.4468
 epoch: 74, train_loss: 0.8878, test_loss: 1.0374, test_f1: 0.4548
 epoch: 75, train_loss: 0.8933, test_loss: 1.0557, test_f1: 0.4597
 epoch: 76, train_loss: 0.8819, test_loss: 1.0744, test_f1: 0.4391
 epoch: 77, train_loss: 0.8795, test_loss: 1.0549, test_f1: 0.4880
 epoch: 78, train_loss: 0.8842, test_loss: 1.0585, test_f1: 0.4431
 epoch: 79, train_loss: 0.8805, test_loss: 1.0551, test_f1: 0.4775
 epoch: 80, train_loss: 0.8787, test_loss: 1.0350, test_f1: 0.4769
 epoch: 81, train_loss: 0.8788, test_loss: 1.0841, test_f1: 0.4746
 epoch: 82, train_loss: 0.8739, test_loss: 1.0446, test_f1: 0.4823
 epoch: 83, train_loss: 0.8872, test_loss: 1.0466, test_f1: 0.4419
 epoch: 84, train_loss: 0.8709, test_loss: 1.0316, test_f1: 0.4818
 epoch: 85, train_loss: 0.8684, test_loss: 1.0661, test_f1: 0.4747
 epoch: 86, train_loss: 0.8711, test_loss: 1.1100, test_f1: 0.4436
 epoch: 87, train_loss: 0.8730, test_loss: 1.0409, test_f1: 0.4893
 epoch: 88, train_loss: 0.8605, test_loss: 1.1246, test_f1: 0.4440
 epoch: 89, train_loss: 0.8564, test_loss: 1.0614, test_f1: 0.4805
 epoch: 90, train_loss: 0.8592, test_loss: 1.0579, test_f1: 0.4769
 epoch: 91, train_loss: 0.8639, test_loss: 1.0855, test_f1: 0.4567
 epoch: 92, train_loss: 0.8572, test_loss: 1.1385, test_f1: 0.4518
 epoch: 93, train_loss: 0.8634, test_loss: 1.0608, test_f1: 0.4896
 epoch: 94, train_loss: 0.8548, test_loss: 1.0780, test_f1: 0.4741
 epoch: 95, train_loss: 0.8554, test_loss: 1.0766, test_f1: 0.4547
 epoch: 96, train_loss: 0.8634, test_loss: 1.0925, test_f1: 0.4855
 epoch: 97, train_loss: 0.8615, test_loss: 1.1031, test_f1: 0.4693
 epoch: 98, train_loss: 0.8647, test_loss: 1.0905, test_f1: 0.4572
 epoch: 99, train_loss: 0.8544, test_loss: 1.1239, test_f1: 0.4470
##################ITERATION #1 ****************************************
 epoch: 0, train_loss: 1.3507, test_loss: 1.3140, test_f1: 0.2274
 epoch: 1, train_loss: 1.2765, test_loss: 1.2709, test_f1: 0.2613
 epoch: 2, train_loss: 1.2567, test_loss: 1.2404, test_f1: 0.2642
 epoch: 3, train_loss: 1.2372, test_loss: 1.2059, test_f1: 0.2878
 epoch: 4, train_loss: 1.2173, test_loss: 1.1765, test_f1: 0.3853
 epoch: 5, train_loss: 1.1968, test_loss: 1.1428, test_f1: 0.3968
 epoch: 6, train_loss: 1.1688, test_loss: 1.1264, test_f1: 0.4108
 epoch: 7, train_loss: 1.1593, test_loss: 1.0925, test_f1: 0.4272
 epoch: 8, train_loss: 1.1348, test_loss: 1.0945, test_f1: 0.4278
 epoch: 9, train_loss: 1.1213, test_loss: 1.0791, test_f1: 0.4326
 epoch: 10, train_loss: 1.1029, test_loss: 1.0524, test_f1: 0.4448
 epoch: 11, train_loss: 1.0977, test_loss: 1.0523, test_f1: 0.4321
 epoch: 12, train_loss: 1.0842, test_loss: 1.0443, test_f1: 0.4427
 epoch: 13, train_loss: 1.0722, test_loss: 1.0369, test_f1: 0.4575
 epoch: 14, train_loss: 1.0805, test_loss: 1.0394, test_f1: 0.4623
 epoch: 15, train_loss: 1.0625, test_loss: 1.0483, test_f1: 0.4408
 epoch: 16, train_loss: 1.0515, test_loss: 1.0119, test_f1: 0.4664
 epoch: 17, train_loss: 1.0503, test_loss: 1.0094, test_f1: 0.4609
 epoch: 18, train_loss: 1.0445, test_loss: 1.0153, test_f1: 0.4605
 epoch: 19, train_loss: 1.0284, test_loss: 1.0031, test_f1: 0.4422
 epoch: 20, train_loss: 1.0171, test_loss: 1.0094, test_f1: 0.4678
 epoch: 21, train_loss: 1.0200, test_loss: 0.9930, test_f1: 0.4627
 epoch: 22, train_loss: 1.0135, test_loss: 1.0173, test_f1: 0.4351
 epoch: 23, train_loss: 1.0018, test_loss: 0.9998, test_f1: 0.4702
 epoch: 24, train_loss: 0.9990, test_loss: 1.0057, test_f1: 0.4493
 epoch: 25, train_loss: 0.9955, test_loss: 1.0272, test_f1: 0.4645
 epoch: 26, train_loss: 0.9958, test_loss: 0.9915, test_f1: 0.4633
 epoch: 27, train_loss: 0.9921, test_loss: 1.0071, test_f1: 0.4495
 epoch: 28, train_loss: 0.9801, test_loss: 0.9614, test_f1: 0.4786
 epoch: 29, train_loss: 0.9755, test_loss: 0.9708, test_f1: 0.4744
 epoch: 30, train_loss: 0.9769, test_loss: 0.9851, test_f1: 0.4825
 epoch: 31, train_loss: 0.9704, test_loss: 0.9607, test_f1: 0.4665
 epoch: 32, train_loss: 0.9599, test_loss: 0.9714, test_f1: 0.4763
 epoch: 33, train_loss: 0.9647, test_loss: 0.9818, test_f1: 0.4718
 epoch: 34, train_loss: 0.9604, test_loss: 0.9811, test_f1: 0.4764
 epoch: 35, train_loss: 0.9428, test_loss: 0.9801, test_f1: 0.4711
 epoch: 36, train_loss: 0.9611, test_loss: 0.9614, test_f1: 0.4752
 epoch: 37, train_loss: 0.9462, test_loss: 0.9546, test_f1: 0.4763
 epoch: 38, train_loss: 0.9417, test_loss: 0.9312, test_f1: 0.4813
 epoch: 39, train_loss: 0.9367, test_loss: 1.0019, test_f1: 0.4877
 epoch: 40, train_loss: 0.9367, test_loss: 0.9648, test_f1: 0.5056
 epoch: 41, train_loss: 0.9293, test_loss: 0.9863, test_f1: 0.4769
 epoch: 42, train_loss: 0.9293, test_loss: 0.9637, test_f1: 0.4776
 epoch: 43, train_loss: 0.9327, test_loss: 1.0153, test_f1: 0.4995
 epoch: 44, train_loss: 0.9237, test_loss: 0.9698, test_f1: 0.4889
 epoch: 45, train_loss: 0.9150, test_loss: 0.9770, test_f1: 0.5086
 epoch: 46, train_loss: 0.9231, test_loss: 0.9961, test_f1: 0.4612
 epoch: 47, train_loss: 0.9085, test_loss: 1.0111, test_f1: 0.4965
 epoch: 48, train_loss: 0.9120, test_loss: 0.9630, test_f1: 0.4783
 epoch: 49, train_loss: 0.9047, test_loss: 1.0125, test_f1: 0.4883
 epoch: 50, train_loss: 0.9019, test_loss: 0.9746, test_f1: 0.4788
 epoch: 51, train_loss: 0.8934, test_loss: 1.0192, test_f1: 0.4775
 epoch: 52, train_loss: 0.8920, test_loss: 1.0074, test_f1: 0.4580
 epoch: 53, train_loss: 0.8957, test_loss: 1.0059, test_f1: 0.4886
 epoch: 54, train_loss: 0.8953, test_loss: 0.9973, test_f1: 0.4887
 epoch: 55, train_loss: 0.8782, test_loss: 1.0265, test_f1: 0.4864
 epoch: 56, train_loss: 0.8843, test_loss: 1.0243, test_f1: 0.4650
 epoch: 57, train_loss: 0.8777, test_loss: 1.0160, test_f1: 0.4888
 epoch: 58, train_loss: 0.8822, test_loss: 1.0141, test_f1: 0.4882
 epoch: 59, train_loss: 0.8782, test_loss: 1.0246, test_f1: 0.4757
 epoch: 60, train_loss: 0.8743, test_loss: 1.0162, test_f1: 0.4768
 epoch: 61, train_loss: 0.8788, test_loss: 1.0172, test_f1: 0.5050
 epoch: 62, train_loss: 0.8773, test_loss: 1.0206, test_f1: 0.4750
 epoch: 63, train_loss: 0.8668, test_loss: 1.0114, test_f1: 0.5172
 epoch: 64, train_loss: 0.8677, test_loss: 1.0469, test_f1: 0.4975
 epoch: 65, train_loss: 0.8718, test_loss: 1.0298, test_f1: 0.5120
 epoch: 66, train_loss: 0.8729, test_loss: 1.0382, test_f1: 0.5124
 epoch: 67, train_loss: 0.8768, test_loss: 1.0228, test_f1: 0.4815
 epoch: 68, train_loss: 0.8584, test_loss: 1.0386, test_f1: 0.5047
 epoch: 69, train_loss: 0.8694, test_loss: 1.0235, test_f1: 0.4829
 epoch: 70, train_loss: 0.8708, test_loss: 1.0673, test_f1: 0.4798
 epoch: 71, train_loss: 0.8727, test_loss: 1.0248, test_f1: 0.5027
 epoch: 72, train_loss: 0.8501, test_loss: 1.0456, test_f1: 0.5158
 epoch: 73, train_loss: 0.8652, test_loss: 1.0116, test_f1: 0.5267
 epoch: 74, train_loss: 0.8630, test_loss: 1.0477, test_f1: 0.4925
 epoch: 75, train_loss: 0.8605, test_loss: 1.0375, test_f1: 0.4790
 epoch: 76, train_loss: 0.8539, test_loss: 1.0601, test_f1: 0.4911
 epoch: 77, train_loss: 0.8680, test_loss: 1.0342, test_f1: 0.4856
 epoch: 78, train_loss: 0.8548, test_loss: 1.0498, test_f1: 0.5057
 epoch: 79, train_loss: 0.8494, test_loss: 1.0268, test_f1: 0.4935
 epoch: 80, train_loss: 0.8496, test_loss: 1.0422, test_f1: 0.4832
 epoch: 81, train_loss: 0.8516, test_loss: 1.0564, test_f1: 0.5134
 epoch: 82, train_loss: 0.8472, test_loss: 1.0506, test_f1: 0.4869
 epoch: 83, train_loss: 0.8619, test_loss: 1.0437, test_f1: 0.4559
 epoch: 84, train_loss: 0.8490, test_loss: 1.0874, test_f1: 0.4668
 epoch: 85, train_loss: 0.8452, test_loss: 1.1000, test_f1: 0.4691
 epoch: 86, train_loss: 0.8461, test_loss: 1.0502, test_f1: 0.4948
 epoch: 87, train_loss: 0.8485, test_loss: 1.0699, test_f1: 0.4938
 epoch: 88, train_loss: 0.8333, test_loss: 1.0657, test_f1: 0.4805
 epoch: 89, train_loss: 0.8344, test_loss: 1.0800, test_f1: 0.4983
 epoch: 90, train_loss: 0.8337, test_loss: 1.0741, test_f1: 0.5016
 epoch: 91, train_loss: 0.8448, test_loss: 1.0707, test_f1: 0.4776
 epoch: 92, train_loss: 0.8345, test_loss: 1.0816, test_f1: 0.4817
 epoch: 93, train_loss: 0.8330, test_loss: 1.1021, test_f1: 0.4973
 epoch: 94, train_loss: 0.8330, test_loss: 1.0797, test_f1: 0.5019
 epoch: 95, train_loss: 0.8263, test_loss: 1.0952, test_f1: 0.4980
 epoch: 96, train_loss: 0.8267, test_loss: 1.0818, test_f1: 0.4911
 epoch: 97, train_loss: 0.8390, test_loss: 1.1095, test_f1: 0.4663
 epoch: 98, train_loss: 0.8307, test_loss: 1.0824, test_f1: 0.4963
 epoch: 99, train_loss: 0.8312, test_loss: 1.0875, test_f1: 0.4988
##################ITERATION #2 ****************************************
 epoch: 0, train_loss: 1.3913, test_loss: 1.3221, test_f1: 0.2274
 epoch: 1, train_loss: 1.2878, test_loss: 1.2644, test_f1: 0.2332
 epoch: 2, train_loss: 1.2649, test_loss: 1.2427, test_f1: 0.2938
 epoch: 3, train_loss: 1.2525, test_loss: 1.2287, test_f1: 0.2613
 epoch: 4, train_loss: 1.2395, test_loss: 1.2163, test_f1: 0.2863
 epoch: 5, train_loss: 1.2357, test_loss: 1.2020, test_f1: 0.3101
 epoch: 6, train_loss: 1.2289, test_loss: 1.1906, test_f1: 0.3592
 epoch: 7, train_loss: 1.2133, test_loss: 1.1797, test_f1: 0.3467
 epoch: 8, train_loss: 1.2080, test_loss: 1.1750, test_f1: 0.3537
 epoch: 9, train_loss: 1.1958, test_loss: 1.1607, test_f1: 0.3905
 epoch: 10, train_loss: 1.1914, test_loss: 1.1499, test_f1: 0.3864
 epoch: 11, train_loss: 1.1804, test_loss: 1.1430, test_f1: 0.3873
 epoch: 12, train_loss: 1.1739, test_loss: 1.1374, test_f1: 0.4002
 epoch: 13, train_loss: 1.1569, test_loss: 1.1180, test_f1: 0.4178
 epoch: 14, train_loss: 1.1585, test_loss: 1.1050, test_f1: 0.4436
 epoch: 15, train_loss: 1.1526, test_loss: 1.1044, test_f1: 0.4232
 epoch: 16, train_loss: 1.1453, test_loss: 1.1000, test_f1: 0.4106
 epoch: 17, train_loss: 1.1324, test_loss: 1.0869, test_f1: 0.4329
 epoch: 18, train_loss: 1.1308, test_loss: 1.0793, test_f1: 0.4293
 epoch: 19, train_loss: 1.1233, test_loss: 1.0728, test_f1: 0.4409
 epoch: 20, train_loss: 1.1240, test_loss: 1.0577, test_f1: 0.4410
 epoch: 21, train_loss: 1.1081, test_loss: 1.0579, test_f1: 0.4426
 epoch: 22, train_loss: 1.0999, test_loss: 1.0492, test_f1: 0.4318
 epoch: 23, train_loss: 1.0980, test_loss: 1.0459, test_f1: 0.4592
 epoch: 24, train_loss: 1.1034, test_loss: 1.0362, test_f1: 0.4384
 epoch: 25, train_loss: 1.0876, test_loss: 1.0327, test_f1: 0.4704
 epoch: 26, train_loss: 1.0891, test_loss: 1.0480, test_f1: 0.4292
 epoch: 27, train_loss: 1.0865, test_loss: 1.0209, test_f1: 0.4507
 epoch: 28, train_loss: 1.0736, test_loss: 1.0221, test_f1: 0.4548
 epoch: 29, train_loss: 1.0732, test_loss: 1.0111, test_f1: 0.4664
 epoch: 30, train_loss: 1.0573, test_loss: 1.0216, test_f1: 0.4624
 epoch: 31, train_loss: 1.0544, test_loss: 1.0090, test_f1: 0.4580
 epoch: 32, train_loss: 1.0591, test_loss: 1.0089, test_f1: 0.4710
 epoch: 33, train_loss: 1.0619, test_loss: 1.0006, test_f1: 0.4611
 epoch: 34, train_loss: 1.0479, test_loss: 1.0061, test_f1: 0.4485
 epoch: 35, train_loss: 1.0297, test_loss: 0.9964, test_f1: 0.4666
 epoch: 36, train_loss: 1.0349, test_loss: 0.9894, test_f1: 0.4550
 epoch: 37, train_loss: 1.0375, test_loss: 0.9839, test_f1: 0.4745
 epoch: 38, train_loss: 1.0329, test_loss: 1.0056, test_f1: 0.4664
 epoch: 39, train_loss: 1.0280, test_loss: 0.9915, test_f1: 0.4729
 epoch: 40, train_loss: 1.0298, test_loss: 0.9808, test_f1: 0.4601
 epoch: 41, train_loss: 1.0252, test_loss: 0.9884, test_f1: 0.4527
 epoch: 42, train_loss: 1.0083, test_loss: 0.9788, test_f1: 0.4707
 epoch: 43, train_loss: 1.0115, test_loss: 0.9863, test_f1: 0.4635
 epoch: 44, train_loss: 1.0072, test_loss: 0.9689, test_f1: 0.4794
 epoch: 45, train_loss: 1.0045, test_loss: 0.9772, test_f1: 0.4745
 epoch: 46, train_loss: 0.9993, test_loss: 0.9818, test_f1: 0.4843
 epoch: 47, train_loss: 1.0046, test_loss: 0.9715, test_f1: 0.4714
 epoch: 48, train_loss: 0.9905, test_loss: 0.9619, test_f1: 0.4789
 epoch: 49, train_loss: 0.9879, test_loss: 0.9822, test_f1: 0.4511
 epoch: 50, train_loss: 0.9910, test_loss: 0.9564, test_f1: 0.4788
 epoch: 51, train_loss: 0.9868, test_loss: 0.9611, test_f1: 0.4682
 epoch: 52, train_loss: 0.9856, test_loss: 0.9632, test_f1: 0.4743
 epoch: 53, train_loss: 0.9720, test_loss: 0.9594, test_f1: 0.4706
 epoch: 54, train_loss: 0.9655, test_loss: 0.9637, test_f1: 0.4639
 epoch: 55, train_loss: 0.9796, test_loss: 0.9590, test_f1: 0.4687
 epoch: 56, train_loss: 0.9773, test_loss: 0.9771, test_f1: 0.4547
 epoch: 57, train_loss: 0.9618, test_loss: 0.9658, test_f1: 0.4697
 epoch: 58, train_loss: 0.9675, test_loss: 0.9639, test_f1: 0.4781
 epoch: 59, train_loss: 0.9670, test_loss: 0.9575, test_f1: 0.4705
 epoch: 60, train_loss: 0.9640, test_loss: 0.9768, test_f1: 0.4603
 epoch: 61, train_loss: 0.9671, test_loss: 0.9603, test_f1: 0.4743
 epoch: 62, train_loss: 0.9543, test_loss: 0.9748, test_f1: 0.4702
 epoch: 63, train_loss: 0.9605, test_loss: 0.9731, test_f1: 0.4606
 epoch: 64, train_loss: 0.9538, test_loss: 0.9582, test_f1: 0.4649
 epoch: 65, train_loss: 0.9505, test_loss: 0.9788, test_f1: 0.4795
 epoch: 66, train_loss: 0.9634, test_loss: 0.9706, test_f1: 0.4810
 epoch: 67, train_loss: 0.9435, test_loss: 0.9737, test_f1: 0.4702
 epoch: 68, train_loss: 0.9485, test_loss: 0.9662, test_f1: 0.4712
 epoch: 69, train_loss: 0.9391, test_loss: 0.9756, test_f1: 0.4659
 epoch: 70, train_loss: 0.9474, test_loss: 0.9667, test_f1: 0.4737
 epoch: 71, train_loss: 0.9464, test_loss: 0.9766, test_f1: 0.4581
 epoch: 72, train_loss: 0.9376, test_loss: 0.9792, test_f1: 0.4686
 epoch: 73, train_loss: 0.9415, test_loss: 0.9788, test_f1: 0.4724
 epoch: 74, train_loss: 0.9330, test_loss: 0.9965, test_f1: 0.4671
 epoch: 75, train_loss: 0.9312, test_loss: 0.9696, test_f1: 0.4761
 epoch: 76, train_loss: 0.9439, test_loss: 0.9773, test_f1: 0.4768
 epoch: 77, train_loss: 0.9446, test_loss: 0.9786, test_f1: 0.4669
 epoch: 78, train_loss: 0.9321, test_loss: 0.9781, test_f1: 0.4758
 epoch: 79, train_loss: 0.9426, test_loss: 0.9666, test_f1: 0.4695
 epoch: 80, train_loss: 0.9291, test_loss: 0.9827, test_f1: 0.4693
 epoch: 81, train_loss: 0.9293, test_loss: 0.9856, test_f1: 0.4670
 epoch: 82, train_loss: 0.9338, test_loss: 0.9905, test_f1: 0.4599
 epoch: 83, train_loss: 0.9152, test_loss: 0.9880, test_f1: 0.4751
 epoch: 84, train_loss: 0.9306, test_loss: 0.9761, test_f1: 0.4734
 epoch: 85, train_loss: 0.9304, test_loss: 0.9911, test_f1: 0.4749
 epoch: 86, train_loss: 0.9268, test_loss: 0.9872, test_f1: 0.4792
 epoch: 87, train_loss: 0.9203, test_loss: 0.9751, test_f1: 0.4776
 epoch: 88, train_loss: 0.9178, test_loss: 0.9915, test_f1: 0.4730
 epoch: 89, train_loss: 0.9264, test_loss: 0.9991, test_f1: 0.4800
 epoch: 90, train_loss: 0.9201, test_loss: 0.9978, test_f1: 0.4667
 epoch: 91, train_loss: 0.9169, test_loss: 0.9942, test_f1: 0.4824
 epoch: 92, train_loss: 0.9249, test_loss: 0.9905, test_f1: 0.4811
 epoch: 93, train_loss: 0.9250, test_loss: 1.0193, test_f1: 0.4764
 epoch: 94, train_loss: 0.9104, test_loss: 1.0137, test_f1: 0.4750
 epoch: 95, train_loss: 0.9044, test_loss: 1.0034, test_f1: 0.4800
 epoch: 96, train_loss: 0.9302, test_loss: 1.0113, test_f1: 0.4667
 epoch: 97, train_loss: 0.8997, test_loss: 1.0066, test_f1: 0.4769
 epoch: 98, train_loss: 0.9135, test_loss: 1.0350, test_f1: 0.4838
 epoch: 99, train_loss: 0.9149, test_loss: 1.0256, test_f1: 0.4877
##################ITERATION #3 ****************************************
 epoch: 0, train_loss: 1.3178, test_loss: 1.2838, test_f1: 0.2274
 epoch: 1, train_loss: 1.2584, test_loss: 1.2439, test_f1: 0.2907
 epoch: 2, train_loss: 1.2446, test_loss: 1.2053, test_f1: 0.3741
 epoch: 3, train_loss: 1.2309, test_loss: 1.1827, test_f1: 0.3734
 epoch: 4, train_loss: 1.2092, test_loss: 1.1697, test_f1: 0.3954
 epoch: 5, train_loss: 1.2022, test_loss: 1.1495, test_f1: 0.4078
 epoch: 6, train_loss: 1.1891, test_loss: 1.1331, test_f1: 0.4086
 epoch: 7, train_loss: 1.1760, test_loss: 1.1224, test_f1: 0.4330
 epoch: 8, train_loss: 1.1656, test_loss: 1.1041, test_f1: 0.4499
 epoch: 9, train_loss: 1.1573, test_loss: 1.0920, test_f1: 0.4380
 epoch: 10, train_loss: 1.1487, test_loss: 1.0821, test_f1: 0.4420
 epoch: 11, train_loss: 1.1417, test_loss: 1.0671, test_f1: 0.4614
 epoch: 12, train_loss: 1.1285, test_loss: 1.0506, test_f1: 0.4744
 epoch: 13, train_loss: 1.1284, test_loss: 1.0412, test_f1: 0.4845
 epoch: 14, train_loss: 1.1218, test_loss: 1.0334, test_f1: 0.4807
 epoch: 15, train_loss: 1.1182, test_loss: 1.0216, test_f1: 0.4779
 epoch: 16, train_loss: 1.1067, test_loss: 1.0296, test_f1: 0.4757
 epoch: 17, train_loss: 1.0979, test_loss: 1.0109, test_f1: 0.4782
 epoch: 18, train_loss: 1.0967, test_loss: 1.0076, test_f1: 0.4848
 epoch: 19, train_loss: 1.0866, test_loss: 1.0089, test_f1: 0.4847
 epoch: 20, train_loss: 1.0921, test_loss: 0.9918, test_f1: 0.4916
 epoch: 21, train_loss: 1.0744, test_loss: 0.9838, test_f1: 0.4884
 epoch: 22, train_loss: 1.0630, test_loss: 0.9786, test_f1: 0.4954
 epoch: 23, train_loss: 1.0671, test_loss: 0.9838, test_f1: 0.4862
 epoch: 24, train_loss: 1.0634, test_loss: 0.9658, test_f1: 0.5027
 epoch: 25, train_loss: 1.0654, test_loss: 0.9705, test_f1: 0.4903
 epoch: 26, train_loss: 1.0525, test_loss: 0.9614, test_f1: 0.4857
 epoch: 27, train_loss: 1.0495, test_loss: 0.9622, test_f1: 0.4872
 epoch: 28, train_loss: 1.0620, test_loss: 0.9497, test_f1: 0.5007
 epoch: 29, train_loss: 1.0460, test_loss: 0.9631, test_f1: 0.4926
 epoch: 30, train_loss: 1.0345, test_loss: 0.9566, test_f1: 0.4752
 epoch: 31, train_loss: 1.0327, test_loss: 0.9425, test_f1: 0.4939
 epoch: 32, train_loss: 1.0327, test_loss: 0.9477, test_f1: 0.4958
 epoch: 33, train_loss: 1.0245, test_loss: 0.9429, test_f1: 0.5013
 epoch: 34, train_loss: 1.0280, test_loss: 0.9447, test_f1: 0.4884
 epoch: 35, train_loss: 1.0172, test_loss: 0.9376, test_f1: 0.4891
 epoch: 36, train_loss: 1.0057, test_loss: 0.9252, test_f1: 0.4922
 epoch: 37, train_loss: 1.0125, test_loss: 0.9399, test_f1: 0.5053
 epoch: 38, train_loss: 1.0145, test_loss: 0.9268, test_f1: 0.5104
 epoch: 39, train_loss: 1.0091, test_loss: 0.9304, test_f1: 0.5052
 epoch: 40, train_loss: 1.0068, test_loss: 0.9407, test_f1: 0.5023
 epoch: 41, train_loss: 0.9940, test_loss: 0.9227, test_f1: 0.5027
 epoch: 42, train_loss: 1.0059, test_loss: 0.9216, test_f1: 0.4949
 epoch: 43, train_loss: 0.9921, test_loss: 0.9365, test_f1: 0.4880
 epoch: 44, train_loss: 0.9932, test_loss: 0.9109, test_f1: 0.4986
 epoch: 45, train_loss: 0.9830, test_loss: 0.9260, test_f1: 0.4865
 epoch: 46, train_loss: 0.9859, test_loss: 0.9275, test_f1: 0.5023
 epoch: 47, train_loss: 0.9897, test_loss: 0.9180, test_f1: 0.4977
 epoch: 48, train_loss: 0.9693, test_loss: 0.9343, test_f1: 0.4853
 epoch: 49, train_loss: 0.9714, test_loss: 0.9256, test_f1: 0.5012
 epoch: 50, train_loss: 0.9824, test_loss: 0.9206, test_f1: 0.4883
 epoch: 51, train_loss: 0.9706, test_loss: 0.9245, test_f1: 0.4781
 epoch: 52, train_loss: 0.9704, test_loss: 0.9231, test_f1: 0.5008
 epoch: 53, train_loss: 0.9677, test_loss: 0.9074, test_f1: 0.5110
 epoch: 54, train_loss: 0.9640, test_loss: 0.9184, test_f1: 0.4943
 epoch: 55, train_loss: 0.9610, test_loss: 0.9246, test_f1: 0.4918
 epoch: 56, train_loss: 0.9615, test_loss: 0.9243, test_f1: 0.4884
 epoch: 57, train_loss: 0.9561, test_loss: 0.9218, test_f1: 0.5014
 epoch: 58, train_loss: 0.9602, test_loss: 0.9166, test_f1: 0.4867
 epoch: 59, train_loss: 0.9712, test_loss: 0.9236, test_f1: 0.5123
 epoch: 60, train_loss: 0.9593, test_loss: 0.9071, test_f1: 0.5124
 epoch: 61, train_loss: 0.9595, test_loss: 0.9201, test_f1: 0.4940
 epoch: 62, train_loss: 0.9532, test_loss: 0.9119, test_f1: 0.5000
 epoch: 63, train_loss: 0.9517, test_loss: 0.9260, test_f1: 0.4939
 epoch: 64, train_loss: 0.9498, test_loss: 0.9195, test_f1: 0.5002
 epoch: 65, train_loss: 0.9529, test_loss: 0.9109, test_f1: 0.4982
 epoch: 66, train_loss: 0.9520, test_loss: 0.9206, test_f1: 0.4952
 epoch: 67, train_loss: 0.9567, test_loss: 0.9186, test_f1: 0.4937
 epoch: 68, train_loss: 0.9453, test_loss: 0.9152, test_f1: 0.5037
 epoch: 69, train_loss: 0.9497, test_loss: 0.9139, test_f1: 0.4980
 epoch: 70, train_loss: 0.9345, test_loss: 0.9210, test_f1: 0.5022
 epoch: 71, train_loss: 0.9449, test_loss: 0.9286, test_f1: 0.5071
 epoch: 72, train_loss: 0.9457, test_loss: 0.9168, test_f1: 0.4975
 epoch: 73, train_loss: 0.9374, test_loss: 0.9159, test_f1: 0.5012
 epoch: 74, train_loss: 0.9483, test_loss: 0.9128, test_f1: 0.5052
 epoch: 75, train_loss: 0.9381, test_loss: 0.9181, test_f1: 0.5046
 epoch: 76, train_loss: 0.9393, test_loss: 0.9151, test_f1: 0.5132
 epoch: 77, train_loss: 0.9383, test_loss: 0.9189, test_f1: 0.5143
 epoch: 78, train_loss: 0.9414, test_loss: 0.9118, test_f1: 0.5135
 epoch: 79, train_loss: 0.9348, test_loss: 0.9189, test_f1: 0.5056
 epoch: 80, train_loss: 0.9391, test_loss: 0.9103, test_f1: 0.5186
 epoch: 81, train_loss: 0.9421, test_loss: 0.9272, test_f1: 0.5117
 epoch: 82, train_loss: 0.9333, test_loss: 0.9228, test_f1: 0.5008
 epoch: 83, train_loss: 0.9312, test_loss: 0.9250, test_f1: 0.4921
 epoch: 84, train_loss: 0.9307, test_loss: 0.9155, test_f1: 0.5022
 epoch: 85, train_loss: 0.9285, test_loss: 0.9257, test_f1: 0.4900
 epoch: 86, train_loss: 0.9245, test_loss: 0.9167, test_f1: 0.5016
 epoch: 87, train_loss: 0.9276, test_loss: 0.9176, test_f1: 0.4970
 epoch: 88, train_loss: 0.9327, test_loss: 0.9292, test_f1: 0.4929
 epoch: 89, train_loss: 0.9229, test_loss: 0.9143, test_f1: 0.5089
 epoch: 90, train_loss: 0.9308, test_loss: 0.9070, test_f1: 0.5145
 epoch: 91, train_loss: 0.9288, test_loss: 0.9103, test_f1: 0.5016
 epoch: 92, train_loss: 0.9201, test_loss: 0.9211, test_f1: 0.5032
 epoch: 93, train_loss: 0.9079, test_loss: 0.9199, test_f1: 0.4953
 epoch: 94, train_loss: 0.9189, test_loss: 0.9213, test_f1: 0.5114
 epoch: 95, train_loss: 0.9155, test_loss: 0.9328, test_f1: 0.4949
 epoch: 96, train_loss: 0.9114, test_loss: 0.9312, test_f1: 0.4987
 epoch: 97, train_loss: 0.9149, test_loss: 0.9222, test_f1: 0.5156
 epoch: 98, train_loss: 0.9126, test_loss: 0.9245, test_f1: 0.5090
 epoch: 99, train_loss: 0.9166, test_loss: 0.9132, test_f1: 0.5060
##################ITERATION #4 ****************************************
 epoch: 0, train_loss: 1.3847, test_loss: 1.3134, test_f1: 0.2274
 epoch: 1, train_loss: 1.2682, test_loss: 1.2625, test_f1: 0.2276
 epoch: 2, train_loss: 1.2477, test_loss: 1.2307, test_f1: 0.2294
 epoch: 3, train_loss: 1.2517, test_loss: 1.2164, test_f1: 0.2802
 epoch: 4, train_loss: 1.2344, test_loss: 1.2029, test_f1: 0.3044
 epoch: 5, train_loss: 1.2260, test_loss: 1.1890, test_f1: 0.3545
 epoch: 6, train_loss: 1.2179, test_loss: 1.1931, test_f1: 0.3754
 epoch: 7, train_loss: 1.2117, test_loss: 1.1789, test_f1: 0.4183
 epoch: 8, train_loss: 1.2036, test_loss: 1.1752, test_f1: 0.3841
 epoch: 9, train_loss: 1.1919, test_loss: 1.1673, test_f1: 0.4107
 epoch: 10, train_loss: 1.1871, test_loss: 1.1641, test_f1: 0.4042
 epoch: 11, train_loss: 1.1817, test_loss: 1.1551, test_f1: 0.4258
 epoch: 12, train_loss: 1.1824, test_loss: 1.1620, test_f1: 0.4128
 epoch: 13, train_loss: 1.1628, test_loss: 1.1483, test_f1: 0.4226
 epoch: 14, train_loss: 1.1595, test_loss: 1.1458, test_f1: 0.4199
 epoch: 15, train_loss: 1.1511, test_loss: 1.1411, test_f1: 0.4344
 epoch: 16, train_loss: 1.1512, test_loss: 1.1341, test_f1: 0.4146
 epoch: 17, train_loss: 1.1418, test_loss: 1.1260, test_f1: 0.4497
 epoch: 18, train_loss: 1.1351, test_loss: 1.1260, test_f1: 0.4529
 epoch: 19, train_loss: 1.1318, test_loss: 1.1063, test_f1: 0.4507
 epoch: 20, train_loss: 1.1100, test_loss: 1.1007, test_f1: 0.4509
 epoch: 21, train_loss: 1.1216, test_loss: 1.0878, test_f1: 0.4317
 epoch: 22, train_loss: 1.1114, test_loss: 1.0872, test_f1: 0.4298
 epoch: 23, train_loss: 1.1114, test_loss: 1.0942, test_f1: 0.4319
 epoch: 24, train_loss: 1.1003, test_loss: 1.0713, test_f1: 0.4361
 epoch: 25, train_loss: 1.0876, test_loss: 1.0525, test_f1: 0.4457
 epoch: 26, train_loss: 1.0841, test_loss: 1.0554, test_f1: 0.4393
 epoch: 27, train_loss: 1.0933, test_loss: 1.5427, test_f1: 0.4747
 epoch: 28, train_loss: 1.0788, test_loss: 1.1620, test_f1: 0.4917
 epoch: 29, train_loss: 1.0695, test_loss: 1.2784, test_f1: 0.4821
 epoch: 30, train_loss: 1.0548, test_loss: 1.1101, test_f1: 0.4685
 epoch: 31, train_loss: 1.0567, test_loss: 1.0669, test_f1: 0.4705
 epoch: 32, train_loss: 1.0536, test_loss: 1.2422, test_f1: 0.4752
 epoch: 33, train_loss: 1.0584, test_loss: 1.1484, test_f1: 0.4852
 epoch: 34, train_loss: 1.0539, test_loss: 1.1369, test_f1: 0.4668
 epoch: 35, train_loss: 1.0504, test_loss: 1.0216, test_f1: 0.4702
 epoch: 36, train_loss: 1.0355, test_loss: 1.0272, test_f1: 0.4570
 epoch: 37, train_loss: 1.0342, test_loss: 1.0378, test_f1: 0.4605
 epoch: 38, train_loss: 1.0295, test_loss: 1.0237, test_f1: 0.5014
 epoch: 39, train_loss: 1.0261, test_loss: 1.0081, test_f1: 0.4804
 epoch: 40, train_loss: 1.0160, test_loss: 1.0300, test_f1: 0.4749
 epoch: 41, train_loss: 1.0222, test_loss: 0.9921, test_f1: 0.4654
 epoch: 42, train_loss: 1.0197, test_loss: 1.0370, test_f1: 0.4639
 epoch: 43, train_loss: 1.0079, test_loss: 1.0239, test_f1: 0.4773
 epoch: 44, train_loss: 1.0109, test_loss: 1.0130, test_f1: 0.4667
 epoch: 45, train_loss: 1.0044, test_loss: 1.0058, test_f1: 0.4735
 epoch: 46, train_loss: 0.9996, test_loss: 1.0069, test_f1: 0.4752
 epoch: 47, train_loss: 0.9990, test_loss: 1.0238, test_f1: 0.4529
 epoch: 48, train_loss: 0.9927, test_loss: 1.0126, test_f1: 0.4580
 epoch: 49, train_loss: 0.9863, test_loss: 0.9934, test_f1: 0.4579
 epoch: 50, train_loss: 0.9796, test_loss: 0.9846, test_f1: 0.4699
 epoch: 51, train_loss: 0.9782, test_loss: 1.0156, test_f1: 0.4772
 epoch: 52, train_loss: 0.9696, test_loss: 1.0071, test_f1: 0.4766
 epoch: 53, train_loss: 0.9667, test_loss: 0.9871, test_f1: 0.4796
 epoch: 54, train_loss: 0.9646, test_loss: 0.9936, test_f1: 0.4685
 epoch: 55, train_loss: 0.9653, test_loss: 1.0219, test_f1: 0.4601
 epoch: 56, train_loss: 0.9662, test_loss: 1.0012, test_f1: 0.4778
 epoch: 57, train_loss: 0.9670, test_loss: 1.0276, test_f1: 0.4542
 epoch: 58, train_loss: 0.9650, test_loss: 1.0112, test_f1: 0.4560
 epoch: 59, train_loss: 0.9432, test_loss: 1.0598, test_f1: 0.4489
 epoch: 60, train_loss: 0.9561, test_loss: 1.0232, test_f1: 0.4652
 epoch: 61, train_loss: 0.9627, test_loss: 1.0268, test_f1: 0.4686
 epoch: 62, train_loss: 0.9537, test_loss: 1.0111, test_f1: 0.4598
 epoch: 63, train_loss: 0.9538, test_loss: 1.0169, test_f1: 0.4767
 epoch: 64, train_loss: 0.9509, test_loss: 1.0599, test_f1: 0.4567
 epoch: 65, train_loss: 0.9451, test_loss: 1.0807, test_f1: 0.4501
 epoch: 66, train_loss: 0.9414, test_loss: 1.0865, test_f1: 0.4502
 epoch: 67, train_loss: 0.9419, test_loss: 1.0575, test_f1: 0.4494
 epoch: 68, train_loss: 0.9345, test_loss: 1.0345, test_f1: 0.4523
 epoch: 69, train_loss: 0.9411, test_loss: 1.0746, test_f1: 0.4649
 epoch: 70, train_loss: 0.9431, test_loss: 1.0939, test_f1: 0.4511
 epoch: 71, train_loss: 0.9421, test_loss: 1.0720, test_f1: 0.4457
 epoch: 72, train_loss: 0.9248, test_loss: 1.0355, test_f1: 0.4481
 epoch: 73, train_loss: 0.9310, test_loss: 1.0642, test_f1: 0.4487
 epoch: 74, train_loss: 0.9395, test_loss: 1.0597, test_f1: 0.4552
 epoch: 75, train_loss: 0.9300, test_loss: 1.0388, test_f1: 0.4523
 epoch: 76, train_loss: 0.9290, test_loss: 1.0334, test_f1: 0.4614
 epoch: 77, train_loss: 0.9210, test_loss: 1.0494, test_f1: 0.4890
 epoch: 78, train_loss: 0.9057, test_loss: 1.0708, test_f1: 0.4430
 epoch: 79, train_loss: 0.9239, test_loss: 1.0640, test_f1: 0.4401
 epoch: 80, train_loss: 0.9226, test_loss: 1.0209, test_f1: 0.4474
 epoch: 81, train_loss: 0.9187, test_loss: 1.0192, test_f1: 0.4650
 epoch: 82, train_loss: 0.9166, test_loss: 0.9946, test_f1: 0.4657
 epoch: 83, train_loss: 0.9094, test_loss: 1.0332, test_f1: 0.5048
 epoch: 84, train_loss: 0.9214, test_loss: 1.0493, test_f1: 0.5047
 epoch: 85, train_loss: 0.9161, test_loss: 1.0048, test_f1: 0.5047
 epoch: 86, train_loss: 0.9087, test_loss: 1.0782, test_f1: 0.4627
 epoch: 87, train_loss: 0.8957, test_loss: 1.0630, test_f1: 0.4648
 epoch: 88, train_loss: 0.9015, test_loss: 1.0462, test_f1: 0.4822
 epoch: 89, train_loss: 0.9025, test_loss: 1.0525, test_f1: 0.4729
 epoch: 90, train_loss: 0.9043, test_loss: 1.0296, test_f1: 0.4642
 epoch: 91, train_loss: 0.8953, test_loss: 1.0727, test_f1: 0.4814
 epoch: 92, train_loss: 0.8969, test_loss: 1.0413, test_f1: 0.4930
 epoch: 93, train_loss: 0.8904, test_loss: 1.1706, test_f1: 0.4810
 epoch: 94, train_loss: 0.8932, test_loss: 1.0953, test_f1: 0.4880
 epoch: 95, train_loss: 0.8932, test_loss: 1.1202, test_f1: 0.4650
 epoch: 96, train_loss: 0.8899, test_loss: 1.0633, test_f1: 0.4776
 epoch: 97, train_loss: 0.8885, test_loss: 1.0460, test_f1: 0.5169
 epoch: 98, train_loss: 0.8834, test_loss: 1.1263, test_f1: 0.4862
 epoch: 99, train_loss: 0.8925, test_loss: 1.0497, test_f1: 0.4977
##################ITERATION #5 ****************************************
 epoch: 0, train_loss: 1.3358, test_loss: 1.3125, test_f1: 0.2274
 epoch: 1, train_loss: 1.2569, test_loss: 1.2678, test_f1: 0.2434
 epoch: 2, train_loss: 1.2430, test_loss: 1.2323, test_f1: 0.2924
 epoch: 3, train_loss: 1.2270, test_loss: 1.2060, test_f1: 0.3235
 epoch: 4, train_loss: 1.2031, test_loss: 1.1936, test_f1: 0.3802
 epoch: 5, train_loss: 1.2123, test_loss: 1.1837, test_f1: 0.3986
 epoch: 6, train_loss: 1.1907, test_loss: 1.1740, test_f1: 0.3965
 epoch: 7, train_loss: 1.1946, test_loss: 1.1728, test_f1: 0.3826
 epoch: 8, train_loss: 1.1882, test_loss: 1.1537, test_f1: 0.3940
 epoch: 9, train_loss: 1.1743, test_loss: 1.1381, test_f1: 0.4240
 epoch: 10, train_loss: 1.1603, test_loss: 1.1321, test_f1: 0.4057
 epoch: 11, train_loss: 1.1593, test_loss: 1.1283, test_f1: 0.3904
 epoch: 12, train_loss: 1.1495, test_loss: 1.1101, test_f1: 0.4354
 epoch: 13, train_loss: 1.1375, test_loss: 1.0915, test_f1: 0.4183
 epoch: 14, train_loss: 1.1275, test_loss: 1.0929, test_f1: 0.4349
 epoch: 15, train_loss: 1.1200, test_loss: 1.0813, test_f1: 0.4427
 epoch: 16, train_loss: 1.1099, test_loss: 1.0703, test_f1: 0.4530
 epoch: 17, train_loss: 1.0984, test_loss: 1.0586, test_f1: 0.4518
 epoch: 18, train_loss: 1.0939, test_loss: 1.0580, test_f1: 0.4578
 epoch: 19, train_loss: 1.0874, test_loss: 1.0458, test_f1: 0.4676
 epoch: 20, train_loss: 1.0784, test_loss: 1.0391, test_f1: 0.4598
 epoch: 21, train_loss: 1.0667, test_loss: 1.0266, test_f1: 0.4606
 epoch: 22, train_loss: 1.0630, test_loss: 1.0255, test_f1: 0.4700
 epoch: 23, train_loss: 1.0520, test_loss: 1.0202, test_f1: 0.4630
 epoch: 24, train_loss: 1.0476, test_loss: 1.0133, test_f1: 0.4746
 epoch: 25, train_loss: 1.0371, test_loss: 1.0130, test_f1: 0.4961
 epoch: 26, train_loss: 1.0320, test_loss: 1.0130, test_f1: 0.4791
 epoch: 27, train_loss: 1.0364, test_loss: 1.0132, test_f1: 0.4855
 epoch: 28, train_loss: 1.0242, test_loss: 1.0160, test_f1: 0.4763
 epoch: 29, train_loss: 1.0073, test_loss: 1.0237, test_f1: 0.4702
 epoch: 30, train_loss: 1.0170, test_loss: 1.0356, test_f1: 0.4798
 epoch: 31, train_loss: 1.0069, test_loss: 0.9952, test_f1: 0.4941
 epoch: 32, train_loss: 1.0030, test_loss: 1.0080, test_f1: 0.4801
 epoch: 33, train_loss: 1.0000, test_loss: 1.0307, test_f1: 0.4643
 epoch: 34, train_loss: 0.9895, test_loss: 1.0088, test_f1: 0.4872
 epoch: 35, train_loss: 1.0016, test_loss: 1.0200, test_f1: 0.4800
 epoch: 36, train_loss: 0.9805, test_loss: 1.0047, test_f1: 0.4958
 epoch: 37, train_loss: 0.9773, test_loss: 1.0311, test_f1: 0.4833
 epoch: 38, train_loss: 0.9884, test_loss: 1.0304, test_f1: 0.4754
 epoch: 39, train_loss: 0.9652, test_loss: 1.0380, test_f1: 0.4869
 epoch: 40, train_loss: 0.9672, test_loss: 1.0255, test_f1: 0.4887
 epoch: 41, train_loss: 0.9576, test_loss: 1.0209, test_f1: 0.4866
 epoch: 42, train_loss: 0.9680, test_loss: 1.0231, test_f1: 0.4774
 epoch: 43, train_loss: 0.9641, test_loss: 1.0079, test_f1: 0.4924
 epoch: 44, train_loss: 0.9562, test_loss: 1.0318, test_f1: 0.4854
 epoch: 45, train_loss: 0.9508, test_loss: 1.0196, test_f1: 0.4937
 epoch: 46, train_loss: 0.9556, test_loss: 1.0177, test_f1: 0.5018
 epoch: 47, train_loss: 0.9429, test_loss: 1.0153, test_f1: 0.4954
 epoch: 48, train_loss: 0.9356, test_loss: 1.0087, test_f1: 0.5052
 epoch: 49, train_loss: 0.9383, test_loss: 1.0137, test_f1: 0.4873
 epoch: 50, train_loss: 0.9406, test_loss: 1.0409, test_f1: 0.4924
 epoch: 51, train_loss: 0.9158, test_loss: 1.0393, test_f1: 0.4961
 epoch: 52, train_loss: 0.9246, test_loss: 1.0402, test_f1: 0.4955
 epoch: 53, train_loss: 0.9243, test_loss: 1.0469, test_f1: 0.4877
 epoch: 54, train_loss: 0.9242, test_loss: 1.0469, test_f1: 0.5038
 epoch: 55, train_loss: 0.9142, test_loss: 1.0244, test_f1: 0.4982
 epoch: 56, train_loss: 0.9265, test_loss: 1.0526, test_f1: 0.4961
 epoch: 57, train_loss: 0.9115, test_loss: 1.0638, test_f1: 0.4881
 epoch: 58, train_loss: 0.9104, test_loss: 1.0553, test_f1: 0.4788
 epoch: 59, train_loss: 0.9252, test_loss: 1.0331, test_f1: 0.4928
 epoch: 60, train_loss: 0.9063, test_loss: 1.0479, test_f1: 0.4957
 epoch: 61, train_loss: 0.9200, test_loss: 1.0780, test_f1: 0.4810
 epoch: 62, train_loss: 0.9139, test_loss: 1.0566, test_f1: 0.4822
 epoch: 63, train_loss: 0.9047, test_loss: 1.0482, test_f1: 0.4933
 epoch: 64, train_loss: 0.8978, test_loss: 1.0497, test_f1: 0.5013
 epoch: 65, train_loss: 0.9183, test_loss: 1.0513, test_f1: 0.4897
 epoch: 66, train_loss: 0.9024, test_loss: 1.0734, test_f1: 0.4878
 epoch: 67, train_loss: 0.9041, test_loss: 1.0677, test_f1: 0.5046
 epoch: 68, train_loss: 0.9099, test_loss: 1.0654, test_f1: 0.4829
 epoch: 69, train_loss: 0.8948, test_loss: 1.0580, test_f1: 0.4832
 epoch: 70, train_loss: 0.8958, test_loss: 1.0667, test_f1: 0.4830
 epoch: 71, train_loss: 0.8948, test_loss: 1.0710, test_f1: 0.4941
 epoch: 72, train_loss: 0.9020, test_loss: 1.0880, test_f1: 0.4741
 epoch: 73, train_loss: 0.8960, test_loss: 1.0918, test_f1: 0.4834
 epoch: 74, train_loss: 0.8853, test_loss: 1.1277, test_f1: 0.4632
 epoch: 75, train_loss: 0.8924, test_loss: 1.0933, test_f1: 0.5023
 epoch: 76, train_loss: 0.8934, test_loss: 1.0611, test_f1: 0.4810
 epoch: 77, train_loss: 0.8990, test_loss: 1.1022, test_f1: 0.4866
 epoch: 78, train_loss: 0.8923, test_loss: 1.0540, test_f1: 0.5025
 epoch: 79, train_loss: 0.8842, test_loss: 1.0513, test_f1: 0.4923
 epoch: 80, train_loss: 0.8771, test_loss: 1.0647, test_f1: 0.4912
 epoch: 81, train_loss: 0.8904, test_loss: 1.0818, test_f1: 0.4888
 epoch: 82, train_loss: 0.8807, test_loss: 1.0909, test_f1: 0.4862
 epoch: 83, train_loss: 0.8802, test_loss: 1.0744, test_f1: 0.4893
 epoch: 84, train_loss: 0.8645, test_loss: 1.0778, test_f1: 0.5031
 epoch: 85, train_loss: 0.8838, test_loss: 1.0848, test_f1: 0.4958
 epoch: 86, train_loss: 0.8935, test_loss: 1.1340, test_f1: 0.4937
 epoch: 87, train_loss: 0.8859, test_loss: 1.1051, test_f1: 0.4862
 epoch: 88, train_loss: 0.8878, test_loss: 1.1114, test_f1: 0.4954
 epoch: 89, train_loss: 0.8673, test_loss: 1.1142, test_f1: 0.4895
 epoch: 90, train_loss: 0.8767, test_loss: 1.1005, test_f1: 0.4933
 epoch: 91, train_loss: 0.8748, test_loss: 1.1033, test_f1: 0.5056
 epoch: 92, train_loss: 0.8753, test_loss: 1.1277, test_f1: 0.4862
 epoch: 93, train_loss: 0.8676, test_loss: 1.1337, test_f1: 0.4993
 epoch: 94, train_loss: 0.8575, test_loss: 1.1102, test_f1: 0.4899
 epoch: 95, train_loss: 0.8832, test_loss: 1.1482, test_f1: 0.4890
 epoch: 96, train_loss: 0.8701, test_loss: 1.1286, test_f1: 0.4902
 epoch: 97, train_loss: 0.8662, test_loss: 1.1558, test_f1: 0.4709
 epoch: 98, train_loss: 0.8773, test_loss: 1.1264, test_f1: 0.4968
 epoch: 99, train_loss: 0.8711, test_loss: 1.1323, test_f1: 0.4856
##################ITERATION #6 ****************************************
 epoch: 0, train_loss: 1.4033, test_loss: 1.3206, test_f1: 0.2274
 epoch: 1, train_loss: 1.3100, test_loss: 1.2902, test_f1: 0.2385
 epoch: 2, train_loss: 1.2763, test_loss: 1.2593, test_f1: 0.2781
 epoch: 3, train_loss: 1.2544, test_loss: 1.2432, test_f1: 0.2902
 epoch: 4, train_loss: 1.2530, test_loss: 1.2178, test_f1: 0.3214
 epoch: 5, train_loss: 1.2392, test_loss: 1.2084, test_f1: 0.3499
 epoch: 6, train_loss: 1.2263, test_loss: 1.2027, test_f1: 0.3643
 epoch: 7, train_loss: 1.2233, test_loss: 1.2011, test_f1: 0.3878
 epoch: 8, train_loss: 1.2154, test_loss: 1.1823, test_f1: 0.3632
 epoch: 9, train_loss: 1.2091, test_loss: 1.1942, test_f1: 0.3941
 epoch: 10, train_loss: 1.2132, test_loss: 1.1700, test_f1: 0.3846
 epoch: 11, train_loss: 1.1969, test_loss: 1.1578, test_f1: 0.3840
 epoch: 12, train_loss: 1.1859, test_loss: 1.1620, test_f1: 0.3917
 epoch: 13, train_loss: 1.1864, test_loss: 1.1500, test_f1: 0.3884
 epoch: 14, train_loss: 1.1782, test_loss: 1.1409, test_f1: 0.3983
 epoch: 15, train_loss: 1.1654, test_loss: 1.1158, test_f1: 0.4033
 epoch: 16, train_loss: 1.1646, test_loss: 1.1138, test_f1: 0.4224
 epoch: 17, train_loss: 1.1641, test_loss: 1.1059, test_f1: 0.4206
 epoch: 18, train_loss: 1.1488, test_loss: 1.1009, test_f1: 0.4108
 epoch: 19, train_loss: 1.1378, test_loss: 1.0947, test_f1: 0.4296
 epoch: 20, train_loss: 1.1519, test_loss: 1.0833, test_f1: 0.4656
 epoch: 21, train_loss: 1.1354, test_loss: 1.1065, test_f1: 0.4531
 epoch: 22, train_loss: 1.1420, test_loss: 1.0738, test_f1: 0.4530
 epoch: 23, train_loss: 1.1246, test_loss: 1.0746, test_f1: 0.4348
 epoch: 24, train_loss: 1.1252, test_loss: 1.0574, test_f1: 0.4464
 epoch: 25, train_loss: 1.1245, test_loss: 1.0580, test_f1: 0.4398
 epoch: 26, train_loss: 1.1168, test_loss: 1.0322, test_f1: 0.4627
 epoch: 27, train_loss: 1.1046, test_loss: 1.0471, test_f1: 0.4395
 epoch: 28, train_loss: 1.1022, test_loss: 1.0189, test_f1: 0.4538
 epoch: 29, train_loss: 1.0808, test_loss: 1.0153, test_f1: 0.4716
 epoch: 30, train_loss: 1.0906, test_loss: 1.0060, test_f1: 0.4613
 epoch: 31, train_loss: 1.0708, test_loss: 1.0145, test_f1: 0.4732
 epoch: 32, train_loss: 1.0659, test_loss: 1.0051, test_f1: 0.4735
 epoch: 33, train_loss: 1.0731, test_loss: 0.9945, test_f1: 0.4719
 epoch: 34, train_loss: 1.0769, test_loss: 1.0015, test_f1: 0.4643
 epoch: 35, train_loss: 1.0563, test_loss: 0.9983, test_f1: 0.4953
 epoch: 36, train_loss: 1.0469, test_loss: 0.9961, test_f1: 0.4777
 epoch: 37, train_loss: 1.0575, test_loss: 0.9863, test_f1: 0.4849
 epoch: 38, train_loss: 1.0426, test_loss: 0.9699, test_f1: 0.4876
 epoch: 39, train_loss: 1.0308, test_loss: 0.9681, test_f1: 0.4848
 epoch: 40, train_loss: 1.0431, test_loss: 0.9697, test_f1: 0.4819
 epoch: 41, train_loss: 1.0267, test_loss: 0.9709, test_f1: 0.5075
 epoch: 42, train_loss: 1.0170, test_loss: 0.9544, test_f1: 0.5001
 epoch: 43, train_loss: 1.0278, test_loss: 0.9735, test_f1: 0.4772
 epoch: 44, train_loss: 1.0203, test_loss: 0.9691, test_f1: 0.5058
 epoch: 45, train_loss: 1.0160, test_loss: 0.9775, test_f1: 0.4869
 epoch: 46, train_loss: 1.0167, test_loss: 0.9470, test_f1: 0.4929
 epoch: 47, train_loss: 1.0115, test_loss: 0.9493, test_f1: 0.4896
 epoch: 48, train_loss: 1.0080, test_loss: 0.9554, test_f1: 0.4770
 epoch: 49, train_loss: 1.0028, test_loss: 0.9730, test_f1: 0.4827
 epoch: 50, train_loss: 0.9991, test_loss: 0.9510, test_f1: 0.5174
 epoch: 51, train_loss: 0.9978, test_loss: 0.9465, test_f1: 0.5035
 epoch: 52, train_loss: 0.9933, test_loss: 0.9551, test_f1: 0.4590
 epoch: 53, train_loss: 0.9750, test_loss: 0.9389, test_f1: 0.4866
 epoch: 54, train_loss: 0.9879, test_loss: 0.9524, test_f1: 0.4969
 epoch: 55, train_loss: 0.9825, test_loss: 0.9405, test_f1: 0.4820
 epoch: 56, train_loss: 0.9782, test_loss: 0.9474, test_f1: 0.4725
 epoch: 57, train_loss: 0.9792, test_loss: 0.9465, test_f1: 0.4801
 epoch: 58, train_loss: 0.9774, test_loss: 0.9618, test_f1: 0.4857
 epoch: 59, train_loss: 0.9741, test_loss: 0.9476, test_f1: 0.4805
 epoch: 60, train_loss: 0.9725, test_loss: 0.9521, test_f1: 0.4788
 epoch: 61, train_loss: 0.9773, test_loss: 0.9362, test_f1: 0.4775
 epoch: 62, train_loss: 0.9817, test_loss: 0.9688, test_f1: 0.4943
 epoch: 63, train_loss: 0.9686, test_loss: 0.9556, test_f1: 0.4911
 epoch: 64, train_loss: 0.9729, test_loss: 0.9591, test_f1: 0.4767
 epoch: 65, train_loss: 0.9749, test_loss: 0.9633, test_f1: 0.5066
 epoch: 66, train_loss: 0.9753, test_loss: 0.9490, test_f1: 0.5160
 epoch: 67, train_loss: 0.9594, test_loss: 0.9532, test_f1: 0.4744
 epoch: 68, train_loss: 0.9604, test_loss: 0.9561, test_f1: 0.4824
 epoch: 69, train_loss: 0.9549, test_loss: 0.9464, test_f1: 0.4776
 epoch: 70, train_loss: 0.9602, test_loss: 0.9510, test_f1: 0.4798
 epoch: 71, train_loss: 0.9514, test_loss: 0.9366, test_f1: 0.4856
 epoch: 72, train_loss: 0.9541, test_loss: 0.9461, test_f1: 0.4907
 epoch: 73, train_loss: 0.9573, test_loss: 0.9500, test_f1: 0.4741
 epoch: 74, train_loss: 0.9459, test_loss: 0.9458, test_f1: 0.4811
 epoch: 75, train_loss: 0.9532, test_loss: 0.9480, test_f1: 0.4799
 epoch: 76, train_loss: 0.9547, test_loss: 0.9405, test_f1: 0.4768
 epoch: 77, train_loss: 0.9484, test_loss: 0.9406, test_f1: 0.4759
 epoch: 78, train_loss: 0.9458, test_loss: 0.9545, test_f1: 0.4821
 epoch: 79, train_loss: 0.9436, test_loss: 0.9701, test_f1: 0.4549
 epoch: 80, train_loss: 0.9486, test_loss: 0.9455, test_f1: 0.5006
 epoch: 81, train_loss: 0.9442, test_loss: 0.9498, test_f1: 0.4940
 epoch: 82, train_loss: 0.9415, test_loss: 0.9516, test_f1: 0.4765
 epoch: 83, train_loss: 0.9406, test_loss: 0.9505, test_f1: 0.4788
 epoch: 84, train_loss: 0.9444, test_loss: 0.9543, test_f1: 0.4871
 epoch: 85, train_loss: 0.9390, test_loss: 0.9513, test_f1: 0.4763
 epoch: 86, train_loss: 0.9330, test_loss: 0.9602, test_f1: 0.4664
 epoch: 87, train_loss: 0.9388, test_loss: 0.9687, test_f1: 0.4854
 epoch: 88, train_loss: 0.9357, test_loss: 0.9759, test_f1: 0.4668
 epoch: 89, train_loss: 0.9264, test_loss: 0.9601, test_f1: 0.4940
 epoch: 90, train_loss: 0.9264, test_loss: 0.9630, test_f1: 0.4717
 epoch: 91, train_loss: 0.9322, test_loss: 0.9444, test_f1: 0.4718
 epoch: 92, train_loss: 0.9350, test_loss: 0.9632, test_f1: 0.4611
 epoch: 93, train_loss: 0.9318, test_loss: 0.9846, test_f1: 0.4681
 epoch: 94, train_loss: 0.9289, test_loss: 0.9874, test_f1: 0.4765
 epoch: 95, train_loss: 0.9428, test_loss: 0.9994, test_f1: 0.4820
 epoch: 96, train_loss: 0.9179, test_loss: 0.9871, test_f1: 0.4551
 epoch: 97, train_loss: 0.9210, test_loss: 0.9805, test_f1: 0.4659
 epoch: 98, train_loss: 0.9324, test_loss: 0.9904, test_f1: 0.4610
 epoch: 99, train_loss: 0.9181, test_loss: 0.9799, test_f1: 0.4942
##################ITERATION #7 ****************************************
 epoch: 0, train_loss: 1.4226, test_loss: 1.3594, test_f1: 0.2587
 epoch: 1, train_loss: 1.2861, test_loss: 1.2778, test_f1: 0.3020
 epoch: 2, train_loss: 1.2685, test_loss: 1.2195, test_f1: 0.3247
 epoch: 3, train_loss: 1.2509, test_loss: 1.1989, test_f1: 0.3461
 epoch: 4, train_loss: 1.2317, test_loss: 1.1942, test_f1: 0.3587
 epoch: 5, train_loss: 1.2215, test_loss: 1.1778, test_f1: 0.3569
 epoch: 6, train_loss: 1.2197, test_loss: 1.1684, test_f1: 0.3689
 epoch: 7, train_loss: 1.2098, test_loss: 1.1687, test_f1: 0.3683
 epoch: 8, train_loss: 1.2114, test_loss: 1.1596, test_f1: 0.3859
 epoch: 9, train_loss: 1.1953, test_loss: 1.1536, test_f1: 0.3892
 epoch: 10, train_loss: 1.1954, test_loss: 1.1389, test_f1: 0.3818
 epoch: 11, train_loss: 1.1803, test_loss: 1.1323, test_f1: 0.3884
 epoch: 12, train_loss: 1.1718, test_loss: 1.1215, test_f1: 0.4024
 epoch: 13, train_loss: 1.1724, test_loss: 1.1236, test_f1: 0.3956
 epoch: 14, train_loss: 1.1658, test_loss: 1.1091, test_f1: 0.4079
 epoch: 15, train_loss: 1.1565, test_loss: 1.0958, test_f1: 0.4187
 epoch: 16, train_loss: 1.1471, test_loss: 1.1006, test_f1: 0.4186
 epoch: 17, train_loss: 1.1457, test_loss: 1.0785, test_f1: 0.4140
 epoch: 18, train_loss: 1.1301, test_loss: 1.0670, test_f1: 0.4226
 epoch: 19, train_loss: 1.1277, test_loss: 1.0779, test_f1: 0.4231
 epoch: 20, train_loss: 1.1248, test_loss: 1.0623, test_f1: 0.4311
 epoch: 21, train_loss: 1.1145, test_loss: 1.0604, test_f1: 0.4265
 epoch: 22, train_loss: 1.1174, test_loss: 1.0453, test_f1: 0.4426
 epoch: 23, train_loss: 1.1029, test_loss: 1.0412, test_f1: 0.4415
 epoch: 24, train_loss: 1.1017, test_loss: 1.0532, test_f1: 0.4328
 epoch: 25, train_loss: 1.0911, test_loss: 1.0164, test_f1: 0.4315
 epoch: 26, train_loss: 1.0884, test_loss: 1.0337, test_f1: 0.4409
 epoch: 27, train_loss: 1.0909, test_loss: 1.0132, test_f1: 0.4423
 epoch: 28, train_loss: 1.0888, test_loss: 1.0097, test_f1: 0.4517
 epoch: 29, train_loss: 1.0888, test_loss: 0.9994, test_f1: 0.4764
 epoch: 30, train_loss: 1.0753, test_loss: 1.0174, test_f1: 0.4703
 epoch: 31, train_loss: 1.0746, test_loss: 0.9991, test_f1: 0.4665
 epoch: 32, train_loss: 1.0706, test_loss: 0.9950, test_f1: 0.4666
 epoch: 33, train_loss: 1.0651, test_loss: 0.9920, test_f1: 0.4712
 epoch: 34, train_loss: 1.0622, test_loss: 0.9867, test_f1: 0.4690
 epoch: 35, train_loss: 1.0650, test_loss: 0.9895, test_f1: 0.4591
 epoch: 36, train_loss: 1.0663, test_loss: 0.9874, test_f1: 0.4787
 epoch: 37, train_loss: 1.0561, test_loss: 0.9995, test_f1: 0.4433
 epoch: 38, train_loss: 1.0494, test_loss: 0.9854, test_f1: 0.4719
 epoch: 39, train_loss: 1.0475, test_loss: 0.9850, test_f1: 0.4643
 epoch: 40, train_loss: 1.0300, test_loss: 0.9801, test_f1: 0.4595
 epoch: 41, train_loss: 1.0320, test_loss: 0.9707, test_f1: 0.4866
 epoch: 42, train_loss: 1.0252, test_loss: 0.9700, test_f1: 0.4804
 epoch: 43, train_loss: 1.0383, test_loss: 0.9667, test_f1: 0.4774
 epoch: 44, train_loss: 1.0307, test_loss: 0.9970, test_f1: 0.4516
 epoch: 45, train_loss: 1.0280, test_loss: 0.9633, test_f1: 0.4920
 epoch: 46, train_loss: 1.0273, test_loss: 0.9626, test_f1: 0.4903
 epoch: 47, train_loss: 1.0100, test_loss: 0.9794, test_f1: 0.4548
 epoch: 48, train_loss: 1.0100, test_loss: 0.9614, test_f1: 0.4702
 epoch: 49, train_loss: 1.0098, test_loss: 0.9571, test_f1: 0.4649
 epoch: 50, train_loss: 0.9999, test_loss: 0.9582, test_f1: 0.4699
 epoch: 51, train_loss: 1.0051, test_loss: 0.9571, test_f1: 0.4669
 epoch: 52, train_loss: 0.9913, test_loss: 0.9506, test_f1: 0.4694
 epoch: 53, train_loss: 0.9995, test_loss: 0.9548, test_f1: 0.4604
 epoch: 54, train_loss: 0.9910, test_loss: 0.9521, test_f1: 0.4719
 epoch: 55, train_loss: 0.9957, test_loss: 0.9424, test_f1: 0.4711
 epoch: 56, train_loss: 1.0036, test_loss: 0.9346, test_f1: 0.5192
 epoch: 57, train_loss: 0.9841, test_loss: 0.9412, test_f1: 0.4703
 epoch: 58, train_loss: 0.9830, test_loss: 0.9546, test_f1: 0.4758
 epoch: 59, train_loss: 0.9907, test_loss: 0.9332, test_f1: 0.4732
 epoch: 60, train_loss: 0.9880, test_loss: 0.9278, test_f1: 0.4830
 epoch: 61, train_loss: 0.9932, test_loss: 0.9417, test_f1: 0.4804
 epoch: 62, train_loss: 0.9779, test_loss: 0.9558, test_f1: 0.4653
 epoch: 63, train_loss: 0.9798, test_loss: 0.9454, test_f1: 0.4704
 epoch: 64, train_loss: 0.9849, test_loss: 0.9704, test_f1: 0.4617
 epoch: 65, train_loss: 0.9760, test_loss: 0.9329, test_f1: 0.4880
 epoch: 66, train_loss: 0.9691, test_loss: 0.9427, test_f1: 0.4687
 epoch: 67, train_loss: 0.9730, test_loss: 0.9226, test_f1: 0.4878
 epoch: 68, train_loss: 0.9751, test_loss: 0.9371, test_f1: 0.5020
 epoch: 69, train_loss: 0.9729, test_loss: 0.9318, test_f1: 0.4878
 epoch: 70, train_loss: 0.9792, test_loss: 0.9422, test_f1: 0.4776
 epoch: 71, train_loss: 0.9760, test_loss: 0.9273, test_f1: 0.5054
 epoch: 72, train_loss: 0.9723, test_loss: 0.9307, test_f1: 0.4844
 epoch: 73, train_loss: 0.9736, test_loss: 0.9238, test_f1: 0.4910
 epoch: 74, train_loss: 0.9728, test_loss: 0.9241, test_f1: 0.5211
 epoch: 75, train_loss: 0.9501, test_loss: 0.9283, test_f1: 0.4853
 epoch: 76, train_loss: 0.9654, test_loss: 0.9323, test_f1: 0.4806
 epoch: 77, train_loss: 0.9528, test_loss: 0.9333, test_f1: 0.4885
 epoch: 78, train_loss: 0.9617, test_loss: 0.9276, test_f1: 0.4866
 epoch: 79, train_loss: 0.9753, test_loss: 0.9396, test_f1: 0.4807
 epoch: 80, train_loss: 0.9657, test_loss: 0.9200, test_f1: 0.4930
 epoch: 81, train_loss: 0.9589, test_loss: 0.9174, test_f1: 0.4864
 epoch: 82, train_loss: 0.9541, test_loss: 0.9216, test_f1: 0.4923
 epoch: 83, train_loss: 0.9617, test_loss: 0.9374, test_f1: 0.4862
 epoch: 84, train_loss: 0.9532, test_loss: 0.9540, test_f1: 0.4752
 epoch: 85, train_loss: 0.9569, test_loss: 0.9253, test_f1: 0.4869
 epoch: 86, train_loss: 0.9481, test_loss: 0.9200, test_f1: 0.4832
 epoch: 87, train_loss: 0.9444, test_loss: 0.9569, test_f1: 0.4842
 epoch: 88, train_loss: 0.9521, test_loss: 0.9343, test_f1: 0.4939
 epoch: 89, train_loss: 0.9507, test_loss: 0.9336, test_f1: 0.4860
 epoch: 90, train_loss: 0.9510, test_loss: 0.9432, test_f1: 0.4836
 epoch: 91, train_loss: 0.9544, test_loss: 0.9305, test_f1: 0.4887
 epoch: 92, train_loss: 0.9432, test_loss: 0.9310, test_f1: 0.4928
 epoch: 93, train_loss: 0.9517, test_loss: 0.9371, test_f1: 0.4879
 epoch: 94, train_loss: 0.9650, test_loss: 0.9016, test_f1: 0.5063
 epoch: 95, train_loss: 0.9512, test_loss: 0.9291, test_f1: 0.4893
 epoch: 96, train_loss: 0.9407, test_loss: 0.9102, test_f1: 0.4890
 epoch: 97, train_loss: 0.9473, test_loss: 0.9300, test_f1: 0.4895
 epoch: 98, train_loss: 0.9490, test_loss: 0.9109, test_f1: 0.5016
 epoch: 99, train_loss: 0.9448, test_loss: 0.9236, test_f1: 0.5019
##################ITERATION #8 ****************************************
 epoch: 0, train_loss: 1.7977, test_loss: 1.4038, test_f1: 0.2274
 epoch: 1, train_loss: 1.3957, test_loss: 1.3342, test_f1: 0.2278
 epoch: 2, train_loss: 1.3405, test_loss: 1.2683, test_f1: 0.2863
 epoch: 3, train_loss: 1.3164, test_loss: 1.2504, test_f1: 0.2994
 epoch: 4, train_loss: 1.2893, test_loss: 1.2381, test_f1: 0.2950
 epoch: 5, train_loss: 1.2795, test_loss: 1.2385, test_f1: 0.3163
 epoch: 6, train_loss: 1.2691, test_loss: 1.2260, test_f1: 0.3064
 epoch: 7, train_loss: 1.2566, test_loss: 1.2235, test_f1: 0.3158
 epoch: 8, train_loss: 1.2333, test_loss: 1.2086, test_f1: 0.3267
 epoch: 9, train_loss: 1.2362, test_loss: 1.2141, test_f1: 0.3285
 epoch: 10, train_loss: 1.2335, test_loss: 1.1955, test_f1: 0.3553
 epoch: 11, train_loss: 1.2278, test_loss: 1.1850, test_f1: 0.3560
 epoch: 12, train_loss: 1.2114, test_loss: 1.1760, test_f1: 0.3542
 epoch: 13, train_loss: 1.2009, test_loss: 1.1709, test_f1: 0.3796
 epoch: 14, train_loss: 1.1939, test_loss: 1.1604, test_f1: 0.4051
 epoch: 15, train_loss: 1.1820, test_loss: 1.1470, test_f1: 0.3815
 epoch: 16, train_loss: 1.1718, test_loss: 1.1413, test_f1: 0.4043
 epoch: 17, train_loss: 1.1653, test_loss: 1.1280, test_f1: 0.4530
 epoch: 18, train_loss: 1.1601, test_loss: 1.1210, test_f1: 0.4419
 epoch: 19, train_loss: 1.1499, test_loss: 1.1204, test_f1: 0.4309
 epoch: 20, train_loss: 1.1502, test_loss: 1.1030, test_f1: 0.4237
 epoch: 21, train_loss: 1.1276, test_loss: 1.0862, test_f1: 0.4401
 epoch: 22, train_loss: 1.1325, test_loss: 1.0828, test_f1: 0.4361
 epoch: 23, train_loss: 1.1255, test_loss: 1.0694, test_f1: 0.4448
 epoch: 24, train_loss: 1.1101, test_loss: 1.0674, test_f1: 0.4337
 epoch: 25, train_loss: 1.0960, test_loss: 1.0519, test_f1: 0.4503
 epoch: 26, train_loss: 1.0938, test_loss: 1.0438, test_f1: 0.4559
 epoch: 27, train_loss: 1.0891, test_loss: 1.0379, test_f1: 0.4645
 epoch: 28, train_loss: 1.0848, test_loss: 1.0327, test_f1: 0.4454
 epoch: 29, train_loss: 1.0750, test_loss: 1.0355, test_f1: 0.4573
 epoch: 30, train_loss: 1.0606, test_loss: 1.0147, test_f1: 0.4730
 epoch: 31, train_loss: 1.0683, test_loss: 1.0123, test_f1: 0.4549
 epoch: 32, train_loss: 1.0374, test_loss: 0.9995, test_f1: 0.4570
 epoch: 33, train_loss: 1.0400, test_loss: 1.0052, test_f1: 0.4498
 epoch: 34, train_loss: 1.0399, test_loss: 0.9864, test_f1: 0.4670
 epoch: 35, train_loss: 1.0396, test_loss: 0.9868, test_f1: 0.4518
 epoch: 36, train_loss: 1.0216, test_loss: 0.9769, test_f1: 0.4824
 epoch: 37, train_loss: 1.0138, test_loss: 0.9698, test_f1: 0.4547
 epoch: 38, train_loss: 1.0188, test_loss: 0.9537, test_f1: 0.4829
 epoch: 39, train_loss: 1.0116, test_loss: 0.9551, test_f1: 0.4648
 epoch: 40, train_loss: 0.9975, test_loss: 0.9502, test_f1: 0.4751
 epoch: 41, train_loss: 0.9885, test_loss: 0.9521, test_f1: 0.4826
 epoch: 42, train_loss: 0.9912, test_loss: 0.9389, test_f1: 0.4904
 epoch: 43, train_loss: 0.9939, test_loss: 0.9469, test_f1: 0.4765
 epoch: 44, train_loss: 0.9804, test_loss: 0.9359, test_f1: 0.4715
 epoch: 45, train_loss: 0.9880, test_loss: 0.9777, test_f1: 0.4509
 epoch: 46, train_loss: 0.9725, test_loss: 0.9362, test_f1: 0.4775
 epoch: 47, train_loss: 0.9832, test_loss: 0.9370, test_f1: 0.4904
 epoch: 48, train_loss: 0.9709, test_loss: 0.9201, test_f1: 0.4936
 epoch: 49, train_loss: 0.9602, test_loss: 0.9358, test_f1: 0.4865
 epoch: 50, train_loss: 0.9597, test_loss: 0.9303, test_f1: 0.5022
 epoch: 51, train_loss: 0.9687, test_loss: 0.9295, test_f1: 0.5038
 epoch: 52, train_loss: 0.9559, test_loss: 0.9363, test_f1: 0.4916
 epoch: 53, train_loss: 0.9585, test_loss: 0.9136, test_f1: 0.5081
 epoch: 54, train_loss: 0.9550, test_loss: 0.9067, test_f1: 0.5141
 epoch: 55, train_loss: 0.9414, test_loss: 0.9210, test_f1: 0.4984
 epoch: 56, train_loss: 0.9492, test_loss: 0.9104, test_f1: 0.5053
 epoch: 57, train_loss: 0.9466, test_loss: 0.9396, test_f1: 0.4955
 epoch: 58, train_loss: 0.9348, test_loss: 0.9082, test_f1: 0.5090
 epoch: 59, train_loss: 0.9445, test_loss: 0.9167, test_f1: 0.4964
 epoch: 60, train_loss: 0.9378, test_loss: 0.9181, test_f1: 0.5084
 epoch: 61, train_loss: 0.9337, test_loss: 0.9195, test_f1: 0.4989
 epoch: 62, train_loss: 0.9379, test_loss: 0.9147, test_f1: 0.5044
 epoch: 63, train_loss: 0.9435, test_loss: 0.9296, test_f1: 0.4892
 epoch: 64, train_loss: 0.9324, test_loss: 0.9260, test_f1: 0.5012
 epoch: 65, train_loss: 0.9242, test_loss: 0.9086, test_f1: 0.5083
 epoch: 66, train_loss: 0.9351, test_loss: 0.9319, test_f1: 0.5016
 epoch: 67, train_loss: 0.9222, test_loss: 0.9270, test_f1: 0.5226
 epoch: 68, train_loss: 0.9259, test_loss: 0.9473, test_f1: 0.5023
 epoch: 69, train_loss: 0.9224, test_loss: 0.9211, test_f1: 0.5108
 epoch: 70, train_loss: 0.9191, test_loss: 0.9192, test_f1: 0.5030
 epoch: 71, train_loss: 0.9088, test_loss: 0.9342, test_f1: 0.5073
 epoch: 72, train_loss: 0.9257, test_loss: 0.9218, test_f1: 0.5094
 epoch: 73, train_loss: 0.9273, test_loss: 0.9145, test_f1: 0.5109
 epoch: 74, train_loss: 0.9271, test_loss: 0.9184, test_f1: 0.5119
 epoch: 75, train_loss: 0.9199, test_loss: 0.9191, test_f1: 0.5213
 epoch: 76, train_loss: 0.9190, test_loss: 0.9312, test_f1: 0.5056
 epoch: 77, train_loss: 0.9191, test_loss: 0.9473, test_f1: 0.4976
 epoch: 78, train_loss: 0.9125, test_loss: 0.9263, test_f1: 0.5017
 epoch: 79, train_loss: 0.9184, test_loss: 0.9132, test_f1: 0.5074
 epoch: 80, train_loss: 0.9162, test_loss: 0.9250, test_f1: 0.5090
 epoch: 81, train_loss: 0.9134, test_loss: 0.9294, test_f1: 0.5055
 epoch: 82, train_loss: 0.9118, test_loss: 0.9203, test_f1: 0.5082
 epoch: 83, train_loss: 0.9103, test_loss: 0.9200, test_f1: 0.4966
 epoch: 84, train_loss: 0.8974, test_loss: 0.9136, test_f1: 0.5050
 epoch: 85, train_loss: 0.9127, test_loss: 0.9163, test_f1: 0.5142
 epoch: 86, train_loss: 0.9045, test_loss: 0.9144, test_f1: 0.5118
 epoch: 87, train_loss: 0.9141, test_loss: 0.9208, test_f1: 0.5088
 epoch: 88, train_loss: 0.9148, test_loss: 0.9207, test_f1: 0.5112
 epoch: 89, train_loss: 0.9032, test_loss: 0.9197, test_f1: 0.5093
 epoch: 90, train_loss: 0.8897, test_loss: 0.9214, test_f1: 0.5121
 epoch: 91, train_loss: 0.8971, test_loss: 0.9457, test_f1: 0.5057
 epoch: 92, train_loss: 0.9035, test_loss: 0.9242, test_f1: 0.5070
 epoch: 93, train_loss: 0.9015, test_loss: 0.9462, test_f1: 0.5128
 epoch: 94, train_loss: 0.8965, test_loss: 0.9352, test_f1: 0.5156
 epoch: 95, train_loss: 0.8963, test_loss: 0.9394, test_f1: 0.5132
 epoch: 96, train_loss: 0.8944, test_loss: 0.9270, test_f1: 0.5038
 epoch: 97, train_loss: 0.8990, test_loss: 0.9432, test_f1: 0.5080
 epoch: 98, train_loss: 0.8988, test_loss: 0.9249, test_f1: 0.5067
 epoch: 99, train_loss: 0.8841, test_loss: 0.9437, test_f1: 0.5003
##################ITERATION #9 ****************************************
 epoch: 0, train_loss: 1.6790, test_loss: 1.3558, test_f1: 0.2608
 epoch: 1, train_loss: 1.3574, test_loss: 1.2687, test_f1: 0.2687
 epoch: 2, train_loss: 1.3101, test_loss: 1.2299, test_f1: 0.2728
 epoch: 3, train_loss: 1.2812, test_loss: 1.2015, test_f1: 0.3216
 epoch: 4, train_loss: 1.2447, test_loss: 1.1898, test_f1: 0.3544
 epoch: 5, train_loss: 1.2347, test_loss: 1.1705, test_f1: 0.3726
 epoch: 6, train_loss: 1.2109, test_loss: 1.1583, test_f1: 0.3796
 epoch: 7, train_loss: 1.1982, test_loss: 1.1506, test_f1: 0.3842
 epoch: 8, train_loss: 1.1906, test_loss: 1.1457, test_f1: 0.3959
 epoch: 9, train_loss: 1.1732, test_loss: 1.1316, test_f1: 0.4076
 epoch: 10, train_loss: 1.1736, test_loss: 1.1224, test_f1: 0.4110
 epoch: 11, train_loss: 1.1577, test_loss: 1.1091, test_f1: 0.4143
 epoch: 12, train_loss: 1.1544, test_loss: 1.0968, test_f1: 0.4318
 epoch: 13, train_loss: 1.1383, test_loss: 1.1032, test_f1: 0.4172
 epoch: 14, train_loss: 1.1405, test_loss: 1.0870, test_f1: 0.4239
 epoch: 15, train_loss: 1.1282, test_loss: 1.0837, test_f1: 0.4212
 epoch: 16, train_loss: 1.1246, test_loss: 1.0766, test_f1: 0.4336
 epoch: 17, train_loss: 1.1174, test_loss: 1.0743, test_f1: 0.4288
 epoch: 18, train_loss: 1.1083, test_loss: 1.0684, test_f1: 0.4303
 epoch: 19, train_loss: 1.0995, test_loss: 1.0651, test_f1: 0.4270
 epoch: 20, train_loss: 1.1050, test_loss: 1.0595, test_f1: 0.4375
 epoch: 21, train_loss: 1.0947, test_loss: 1.0534, test_f1: 0.4451
 epoch: 22, train_loss: 1.1038, test_loss: 1.0472, test_f1: 0.4316
 epoch: 23, train_loss: 1.0981, test_loss: 1.0413, test_f1: 0.4498
 epoch: 24, train_loss: 1.0878, test_loss: 1.0374, test_f1: 0.4424
 epoch: 25, train_loss: 1.0836, test_loss: 1.0481, test_f1: 0.4335
 epoch: 26, train_loss: 1.0778, test_loss: 1.0352, test_f1: 0.4363
 epoch: 27, train_loss: 1.0732, test_loss: 1.0427, test_f1: 0.4491
 epoch: 28, train_loss: 1.0755, test_loss: 1.0398, test_f1: 0.4384
 epoch: 29, train_loss: 1.0608, test_loss: 1.0263, test_f1: 0.4433
 epoch: 30, train_loss: 1.0652, test_loss: 1.0319, test_f1: 0.4445
 epoch: 31, train_loss: 1.0548, test_loss: 1.0258, test_f1: 0.4313
 epoch: 32, train_loss: 1.0465, test_loss: 1.0266, test_f1: 0.4463
 epoch: 33, train_loss: 1.0584, test_loss: 1.0257, test_f1: 0.4377
 epoch: 34, train_loss: 1.0518, test_loss: 1.0412, test_f1: 0.4446
 epoch: 35, train_loss: 1.0467, test_loss: 1.0220, test_f1: 0.4497
 epoch: 36, train_loss: 1.0491, test_loss: 1.0010, test_f1: 0.4454
 epoch: 37, train_loss: 1.0311, test_loss: 1.0062, test_f1: 0.4412
 epoch: 38, train_loss: 1.0329, test_loss: 1.0159, test_f1: 0.4559
 epoch: 39, train_loss: 1.0251, test_loss: 1.0102, test_f1: 0.4604
 epoch: 40, train_loss: 1.0291, test_loss: 1.0025, test_f1: 0.4727
 epoch: 41, train_loss: 1.0279, test_loss: 1.0106, test_f1: 0.4590
 epoch: 42, train_loss: 1.0205, test_loss: 0.9979, test_f1: 0.4485
 epoch: 43, train_loss: 1.0295, test_loss: 0.9998, test_f1: 0.4531
 epoch: 44, train_loss: 1.0184, test_loss: 1.0047, test_f1: 0.4888
 epoch: 45, train_loss: 1.0127, test_loss: 1.0010, test_f1: 0.4729
 epoch: 46, train_loss: 1.0043, test_loss: 0.9901, test_f1: 0.4578
 epoch: 47, train_loss: 1.0100, test_loss: 1.0051, test_f1: 0.4715
 epoch: 48, train_loss: 0.9935, test_loss: 1.0169, test_f1: 0.4659
 epoch: 49, train_loss: 0.9905, test_loss: 0.9742, test_f1: 0.4564
 epoch: 50, train_loss: 0.9961, test_loss: 0.9847, test_f1: 0.4652
 epoch: 51, train_loss: 0.9939, test_loss: 0.9850, test_f1: 0.4975
 epoch: 52, train_loss: 0.9844, test_loss: 0.9928, test_f1: 0.4558
 epoch: 53, train_loss: 0.9843, test_loss: 0.9881, test_f1: 0.4665
 epoch: 54, train_loss: 0.9864, test_loss: 1.0001, test_f1: 0.4733
 epoch: 55, train_loss: 0.9820, test_loss: 0.9878, test_f1: 0.4579
 epoch: 56, train_loss: 0.9793, test_loss: 0.9940, test_f1: 0.4698
 epoch: 57, train_loss: 0.9683, test_loss: 0.9930, test_f1: 0.4671
 epoch: 58, train_loss: 0.9675, test_loss: 0.9908, test_f1: 0.4652
 epoch: 59, train_loss: 0.9790, test_loss: 0.9899, test_f1: 0.4733
 epoch: 60, train_loss: 0.9753, test_loss: 0.9846, test_f1: 0.4688
 epoch: 61, train_loss: 0.9641, test_loss: 1.0145, test_f1: 0.4711
 epoch: 62, train_loss: 0.9583, test_loss: 0.9899, test_f1: 0.4689
 epoch: 63, train_loss: 0.9617, test_loss: 1.0053, test_f1: 0.4699
 epoch: 64, train_loss: 0.9693, test_loss: 0.9821, test_f1: 0.4744
 epoch: 65, train_loss: 0.9622, test_loss: 1.0057, test_f1: 0.5073
 epoch: 66, train_loss: 0.9563, test_loss: 1.0095, test_f1: 0.4721
 epoch: 67, train_loss: 0.9618, test_loss: 1.0057, test_f1: 0.4813
 epoch: 68, train_loss: 0.9588, test_loss: 0.9942, test_f1: 0.4730
 epoch: 69, train_loss: 0.9538, test_loss: 0.9951, test_f1: 0.4666
 epoch: 70, train_loss: 0.9524, test_loss: 1.0097, test_f1: 0.4863
 epoch: 71, train_loss: 0.9487, test_loss: 1.0094, test_f1: 0.4809
 epoch: 72, train_loss: 0.9378, test_loss: 1.0078, test_f1: 0.4981
 epoch: 73, train_loss: 0.9358, test_loss: 1.0194, test_f1: 0.4734
 epoch: 74, train_loss: 0.9450, test_loss: 1.0022, test_f1: 0.4721
 epoch: 75, train_loss: 0.9546, test_loss: 1.0164, test_f1: 0.4762
 epoch: 76, train_loss: 0.9443, test_loss: 1.0080, test_f1: 0.4792
 epoch: 77, train_loss: 0.9400, test_loss: 1.0039, test_f1: 0.4706
 epoch: 78, train_loss: 0.9395, test_loss: 0.9944, test_f1: 0.4753
 epoch: 79, train_loss: 0.9414, test_loss: 1.0127, test_f1: 0.4787
 epoch: 80, train_loss: 0.9426, test_loss: 1.0050, test_f1: 0.4784
 epoch: 81, train_loss: 0.9443, test_loss: 1.0050, test_f1: 0.4796
 epoch: 82, train_loss: 0.9402, test_loss: 1.0153, test_f1: 0.4850
 epoch: 83, train_loss: 0.9419, test_loss: 1.0141, test_f1: 0.4701
 epoch: 84, train_loss: 0.9295, test_loss: 1.0131, test_f1: 0.4727
 epoch: 85, train_loss: 0.9418, test_loss: 0.9997, test_f1: 0.4712
 epoch: 86, train_loss: 0.9314, test_loss: 1.0202, test_f1: 0.4661
 epoch: 87, train_loss: 0.9302, test_loss: 1.0170, test_f1: 0.4750
 epoch: 88, train_loss: 0.9412, test_loss: 1.0224, test_f1: 0.4791
 epoch: 89, train_loss: 0.9243, test_loss: 1.0123, test_f1: 0.4736
 epoch: 90, train_loss: 0.9269, test_loss: 1.0019, test_f1: 0.4849
 epoch: 91, train_loss: 0.9206, test_loss: 1.0116, test_f1: 0.4811
 epoch: 92, train_loss: 0.9194, test_loss: 1.0148, test_f1: 0.4886
 epoch: 93, train_loss: 0.9203, test_loss: 1.0147, test_f1: 0.4780
 epoch: 94, train_loss: 0.9213, test_loss: 1.0243, test_f1: 0.4741
 epoch: 95, train_loss: 0.9147, test_loss: 1.0237, test_f1: 0.4828
 epoch: 96, train_loss: 0.9093, test_loss: 1.0282, test_f1: 0.4825
 epoch: 97, train_loss: 0.9222, test_loss: 1.0191, test_f1: 0.4759
 epoch: 98, train_loss: 0.9206, test_loss: 1.0143, test_f1: 0.4810
 epoch: 99, train_loss: 0.9211, test_loss: 1.0281, test_f1: 0.4697

Training completed in 481.69 seconds
Best F1: 0.5267 at epoch 73
Mean F1 across iterations: 0.5117  0.0123
========================FINAL RESULTS================================
FEGIN weighted F1: 0.5267  0.0123
python main.py --data ltspice_examples --representation component_component --model FEGIN --layers 4 --hiddens 16 --batch_size 128 --lr 0.001 --emb_size 250 --epochs 100 --save_appendix component_component_L4_H16_BS128_LR0.001_E250 --no_val
-----



STDERR:
  File "main.py", line 370, in <module>
    main()
  File "main.py", line 254, in main
    dataset = dataset_class(
  File "/home/philip/projects/ltspice_examples_code_repo/Circuit-Completion-Using-GNNs/component_classification_with_link_prediction_head/evaluation/FEGIN/kernel/circuit_datasets.py", line 15, in __init__
    self.data, self.slices = torch.load(self.processed_paths[0])
  File "/home/philip/.local/lib/python3.8/site-packages/torch/serialization.py", line 1040, in load
    warnings.warn(
  File "/usr/lib/python3.8/warnings.py", line 109, in _showwarnmsg
    sw(msg.message, msg.category, msg.filename, msg.lineno,
  File "main.py", line 47, in warn_with_traceback
    traceback.print_stack(file=log)
/home/philip/projects/ltspice_examples_code_repo/Circuit-Completion-Using-GNNs/component_classification_with_link_prediction_head/evaluation/FEGIN/kernel/circuit_datasets.py:15: FutureWarning: You are using `torch.load` with `weights_only=False` (the current default value), which uses the default pickle module implicitly. It is possible to construct malicious pickle data which will execute arbitrary code during unpickling (See https://github.com/pytorch/pytorch/blob/main/SECURITY.md#untrusted-models for more details). In a future release, the default value for `weights_only` will be flipped to `True`. This limits the functions that could be executed during unpickling. Arbitrary objects will no longer be allowed to be loaded via this mode unless they are explicitly allowlisted by the user via `torch.serialization.add_safe_globals`. We recommend you start setting `weights_only=True` for any use case where you don't have full control of the loaded file. Please open an issue on GitHub for any issues related to this experimental feature.
  self.data, self.slices = torch.load(self.processed_paths[0])
