STDOUT:
Results will be saved in /home/philip/projects/ltspice_examples_code_repo/Circuit-Completion-Using-GNNs/component_classification_with_link_prediction_head/evaluation/FEGIN/results/model_FEGIN_dataset_ltspice_demos
Command line input: python main.py --data ltspice_demos --representation component_pin --model FEGIN --layers 2 --hiddens 128 --batch_size 64 --lr 0.01 --emb_size 512 --epochs 100 --save_appendix component_pin_L2_H128_BS64_LR0.01_E512 --no_val
 is saved.
-----
ltspice_demos - FEGIN
Using 2 layers, 128 hidden units, h = 2
Loading component_pin representation dataset
ENTERED
Training FEGIN on component_pin representation
Train: 1565, Test: 383
##################ITERATION #0 ****************************************
 epoch: 0, train_loss: 1.1838, test_loss: 1.5894, test_f1: 0.1365
 epoch: 1, train_loss: 1.0429, test_loss: 1.1734, test_f1: 0.4677
 epoch: 2, train_loss: 0.9289, test_loss: 1.2677, test_f1: 0.4796
 epoch: 3, train_loss: 0.8821, test_loss: 1.0272, test_f1: 0.5471
 epoch: 4, train_loss: 0.8380, test_loss: 1.7225, test_f1: 0.4408
 epoch: 5, train_loss: 0.8261, test_loss: 1.0094, test_f1: 0.5387
 epoch: 6, train_loss: 0.8164, test_loss: 1.0618, test_f1: 0.5897
 epoch: 7, train_loss: 0.7853, test_loss: 1.0502, test_f1: 0.5987
 epoch: 8, train_loss: 0.7621, test_loss: 1.0703, test_f1: 0.5574
 epoch: 9, train_loss: 0.7875, test_loss: 1.0293, test_f1: 0.5045
 epoch: 10, train_loss: 0.7615, test_loss: 1.1806, test_f1: 0.5419
 epoch: 11, train_loss: 0.7844, test_loss: 0.9142, test_f1: 0.5791
 epoch: 12, train_loss: 0.7319, test_loss: 1.5408, test_f1: 0.4750
 epoch: 13, train_loss: 0.7436, test_loss: 1.0340, test_f1: 0.6181
 epoch: 14, train_loss: 0.7162, test_loss: 1.0045, test_f1: 0.5316
 epoch: 15, train_loss: 0.7380, test_loss: 1.0838, test_f1: 0.4921
 epoch: 16, train_loss: 0.7179, test_loss: 0.9557, test_f1: 0.4999
 epoch: 17, train_loss: 0.7165, test_loss: 1.6630, test_f1: 0.4920
 epoch: 18, train_loss: 0.7054, test_loss: 1.5074, test_f1: 0.5324
 epoch: 19, train_loss: 0.6553, test_loss: 1.2266, test_f1: 0.5807
 epoch: 20, train_loss: 0.6295, test_loss: 1.0421, test_f1: 0.6195
 epoch: 21, train_loss: 0.6266, test_loss: 1.2698, test_f1: 0.6293
 epoch: 22, train_loss: 0.6253, test_loss: 0.9791, test_f1: 0.6101
 epoch: 23, train_loss: 0.5920, test_loss: 1.0566, test_f1: 0.6336
 epoch: 24, train_loss: 0.5854, test_loss: 1.0574, test_f1: 0.5954
 epoch: 25, train_loss: 0.6221, test_loss: 1.1654, test_f1: 0.5808
 epoch: 26, train_loss: 0.6056, test_loss: 1.0468, test_f1: 0.6576
 epoch: 27, train_loss: 0.5960, test_loss: 1.2397, test_f1: 0.6052
 epoch: 28, train_loss: 0.5712, test_loss: 1.4773, test_f1: 0.5715
 epoch: 29, train_loss: 0.5768, test_loss: 1.1090, test_f1: 0.6154
 epoch: 30, train_loss: 0.5622, test_loss: 1.2128, test_f1: 0.5553
 epoch: 31, train_loss: 0.5626, test_loss: 1.3192, test_f1: 0.6204
 epoch: 32, train_loss: 0.5382, test_loss: 1.0711, test_f1: 0.6314
 epoch: 33, train_loss: 0.5394, test_loss: 1.5665, test_f1: 0.5928
 epoch: 34, train_loss: 0.5992, test_loss: 1.2443, test_f1: 0.5346
 epoch: 35, train_loss: 0.6070, test_loss: 1.0184, test_f1: 0.6172
 epoch: 36, train_loss: 0.5369, test_loss: 1.0641, test_f1: 0.6216
 epoch: 37, train_loss: 0.4920, test_loss: 1.5291, test_f1: 0.6259
 epoch: 38, train_loss: 0.5156, test_loss: 1.2573, test_f1: 0.5865
 epoch: 39, train_loss: 0.4928, test_loss: 1.1792, test_f1: 0.5641
 epoch: 40, train_loss: 0.4899, test_loss: 1.3650, test_f1: 0.6193
 epoch: 41, train_loss: 0.4453, test_loss: 1.4704, test_f1: 0.6439
 epoch: 42, train_loss: 0.4384, test_loss: 1.6060, test_f1: 0.6291
 epoch: 43, train_loss: 0.5114, test_loss: 1.5718, test_f1: 0.5939
 epoch: 44, train_loss: 0.4565, test_loss: 1.7405, test_f1: 0.5286
 epoch: 45, train_loss: 0.4587, test_loss: 1.4430, test_f1: 0.6113
 epoch: 46, train_loss: 0.4084, test_loss: 1.5177, test_f1: 0.6155
 epoch: 47, train_loss: 0.4403, test_loss: 1.3461, test_f1: 0.5308
 epoch: 48, train_loss: 0.4449, test_loss: 1.7287, test_f1: 0.5713
 epoch: 49, train_loss: 0.3988, test_loss: 1.4135, test_f1: 0.6300
 epoch: 50, train_loss: 0.3958, test_loss: 1.6308, test_f1: 0.6310
 epoch: 51, train_loss: 0.3548, test_loss: 1.6323, test_f1: 0.6105
 epoch: 52, train_loss: 0.3141, test_loss: 1.7057, test_f1: 0.6514
 epoch: 53, train_loss: 0.2887, test_loss: 2.0218, test_f1: 0.6474
 epoch: 54, train_loss: 0.2751, test_loss: 1.8992, test_f1: 0.6266
 epoch: 55, train_loss: 0.3042, test_loss: 2.0020, test_f1: 0.6788
 epoch: 56, train_loss: 0.2715, test_loss: 2.2152, test_f1: 0.6316
 epoch: 57, train_loss: 0.2939, test_loss: 2.0775, test_f1: 0.6013
 epoch: 58, train_loss: 0.2768, test_loss: 2.1422, test_f1: 0.6421
 epoch: 59, train_loss: 0.2756, test_loss: 2.0569, test_f1: 0.6658
 epoch: 60, train_loss: 0.2998, test_loss: 1.8884, test_f1: 0.6480
 epoch: 61, train_loss: 0.2786, test_loss: 2.2483, test_f1: 0.6293
 epoch: 62, train_loss: 0.2742, test_loss: 2.1368, test_f1: 0.6587
 epoch: 63, train_loss: 0.2506, test_loss: 2.1427, test_f1: 0.6436
 epoch: 64, train_loss: 0.2570, test_loss: 2.1838, test_f1: 0.6066
 epoch: 65, train_loss: 0.2445, test_loss: 2.6416, test_f1: 0.6200
 epoch: 66, train_loss: 0.2566, test_loss: 2.4556, test_f1: 0.6429
 epoch: 67, train_loss: 0.2373, test_loss: 2.3327, test_f1: 0.6417
 epoch: 68, train_loss: 0.2033, test_loss: 2.5974, test_f1: 0.6451
 epoch: 69, train_loss: 0.2488, test_loss: 2.2329, test_f1: 0.6350
 epoch: 70, train_loss: 0.2364, test_loss: 2.4276, test_f1: 0.6259
 epoch: 71, train_loss: 0.2059, test_loss: 2.2898, test_f1: 0.6563
 epoch: 72, train_loss: 0.1945, test_loss: 2.5411, test_f1: 0.6509
 epoch: 73, train_loss: 0.2140, test_loss: 2.4973, test_f1: 0.6345
 epoch: 74, train_loss: 0.1981, test_loss: 2.5345, test_f1: 0.6674
 epoch: 75, train_loss: 0.1971, test_loss: 2.4350, test_f1: 0.6413
 epoch: 76, train_loss: 0.1683, test_loss: 2.8615, test_f1: 0.6453
 epoch: 77, train_loss: 0.1830, test_loss: 3.2016, test_f1: 0.6339
 epoch: 78, train_loss: 0.1529, test_loss: 3.2183, test_f1: 0.6188
 epoch: 79, train_loss: 0.1695, test_loss: 2.7909, test_f1: 0.6250
 epoch: 80, train_loss: 0.2242, test_loss: 2.6759, test_f1: 0.6404
 epoch: 81, train_loss: 0.1904, test_loss: 2.7774, test_f1: 0.6423
 epoch: 82, train_loss: 0.1861, test_loss: 2.7382, test_f1: 0.6436
 epoch: 83, train_loss: 0.1863, test_loss: 2.6272, test_f1: 0.6622
 epoch: 84, train_loss: 0.1920, test_loss: 2.5664, test_f1: 0.6498
 epoch: 85, train_loss: 0.1799, test_loss: 2.8306, test_f1: 0.6194
 epoch: 86, train_loss: 0.1895, test_loss: 2.5394, test_f1: 0.6620
 epoch: 87, train_loss: 0.1922, test_loss: 2.5078, test_f1: 0.6416
 epoch: 88, train_loss: 0.2069, test_loss: 2.9577, test_f1: 0.6397
 epoch: 89, train_loss: 0.1945, test_loss: 2.5435, test_f1: 0.6321
 epoch: 90, train_loss: 0.1657, test_loss: 2.7658, test_f1: 0.6131
 epoch: 91, train_loss: 0.1184, test_loss: 3.2631, test_f1: 0.6234
 epoch: 92, train_loss: 0.1423, test_loss: 3.1156, test_f1: 0.6661
 epoch: 93, train_loss: 0.1331, test_loss: 3.1671, test_f1: 0.6711
 epoch: 94, train_loss: 0.1599, test_loss: 2.5552, test_f1: 0.6382
 epoch: 95, train_loss: 0.1263, test_loss: 2.9868, test_f1: 0.6479
 epoch: 96, train_loss: 0.1663, test_loss: 2.9814, test_f1: 0.6818
 epoch: 97, train_loss: 0.1111, test_loss: 3.3039, test_f1: 0.6265
 epoch: 98, train_loss: 0.1720, test_loss: 2.8655, test_f1: 0.6356
 epoch: 99, train_loss: 0.1650, test_loss: 3.1434, test_f1: 0.6411
##################ITERATION #1 ****************************************
 epoch: 0, train_loss: 1.1846, test_loss: 1.4061, test_f1: 0.3517
 epoch: 1, train_loss: 0.9349, test_loss: 1.0931, test_f1: 0.4932
 epoch: 2, train_loss: 0.8544, test_loss: 1.2658, test_f1: 0.3790
 epoch: 3, train_loss: 0.8206, test_loss: 1.1933, test_f1: 0.4583
 epoch: 4, train_loss: 0.8318, test_loss: 1.2896, test_f1: 0.4709
 epoch: 5, train_loss: 0.8020, test_loss: 1.1237, test_f1: 0.5352
 epoch: 6, train_loss: 0.7868, test_loss: 0.9595, test_f1: 0.5966
 epoch: 7, train_loss: 0.7767, test_loss: 1.1481, test_f1: 0.4707
 epoch: 8, train_loss: 0.7693, test_loss: 0.9910, test_f1: 0.5457
 epoch: 9, train_loss: 0.7801, test_loss: 1.0395, test_f1: 0.5304
 epoch: 10, train_loss: 0.7470, test_loss: 1.1111, test_f1: 0.5384
 epoch: 11, train_loss: 0.7321, test_loss: 1.2187, test_f1: 0.5603
 epoch: 12, train_loss: 0.7168, test_loss: 1.0279, test_f1: 0.5495
 epoch: 13, train_loss: 0.7171, test_loss: 1.3839, test_f1: 0.4799
 epoch: 14, train_loss: 0.7294, test_loss: 1.0091, test_f1: 0.5458
 epoch: 15, train_loss: 0.6933, test_loss: 1.0611, test_f1: 0.6454
 epoch: 16, train_loss: 0.6368, test_loss: 0.9715, test_f1: 0.5678
 epoch: 17, train_loss: 0.7075, test_loss: 1.9236, test_f1: 0.4119
 epoch: 18, train_loss: 0.6897, test_loss: 1.0981, test_f1: 0.5808
 epoch: 19, train_loss: 0.6507, test_loss: 1.0521, test_f1: 0.5804
 epoch: 20, train_loss: 0.6381, test_loss: 1.3598, test_f1: 0.5465
 epoch: 21, train_loss: 0.6252, test_loss: 0.9747, test_f1: 0.6084
 epoch: 22, train_loss: 0.6172, test_loss: 1.2588, test_f1: 0.5874
 epoch: 23, train_loss: 0.6755, test_loss: 1.0445, test_f1: 0.5376
 epoch: 24, train_loss: 0.6266, test_loss: 1.1746, test_f1: 0.5505
 epoch: 25, train_loss: 0.6202, test_loss: 1.6687, test_f1: 0.5147
 epoch: 26, train_loss: 0.5811, test_loss: 1.0368, test_f1: 0.6099
 epoch: 27, train_loss: 0.5894, test_loss: 1.5957, test_f1: 0.5363
 epoch: 28, train_loss: 0.6068, test_loss: 1.0051, test_f1: 0.5709
 epoch: 29, train_loss: 0.6605, test_loss: 1.0710, test_f1: 0.5586
 epoch: 30, train_loss: 0.5857, test_loss: 1.2757, test_f1: 0.5621
 epoch: 31, train_loss: 0.5568, test_loss: 1.4788, test_f1: 0.5879
 epoch: 32, train_loss: 0.5600, test_loss: 1.4191, test_f1: 0.5979
 epoch: 33, train_loss: 0.5507, test_loss: 1.6992, test_f1: 0.4883
 epoch: 34, train_loss: 0.5678, test_loss: 1.2965, test_f1: 0.5381
 epoch: 35, train_loss: 0.5564, test_loss: 1.4346, test_f1: 0.5769
 epoch: 36, train_loss: 0.4863, test_loss: 1.6308, test_f1: 0.6097
 epoch: 37, train_loss: 0.5479, test_loss: 1.5360, test_f1: 0.5592
 epoch: 38, train_loss: 0.4748, test_loss: 1.7204, test_f1: 0.5496
 epoch: 39, train_loss: 0.5196, test_loss: 1.4030, test_f1: 0.5195
 epoch: 40, train_loss: 0.5000, test_loss: 1.4699, test_f1: 0.5297
 epoch: 41, train_loss: 0.4784, test_loss: 1.6710, test_f1: 0.5969
 epoch: 42, train_loss: 0.4759, test_loss: 1.5925, test_f1: 0.5359
 epoch: 43, train_loss: 0.5811, test_loss: 1.2394, test_f1: 0.5742
 epoch: 44, train_loss: 0.4946, test_loss: 1.4009, test_f1: 0.5782
 epoch: 45, train_loss: 0.4634, test_loss: 1.3946, test_f1: 0.5937
 epoch: 46, train_loss: 0.4493, test_loss: 1.6291, test_f1: 0.5448
 epoch: 47, train_loss: 0.4645, test_loss: 1.4466, test_f1: 0.5927
 epoch: 48, train_loss: 0.4248, test_loss: 1.6755, test_f1: 0.5751
 epoch: 49, train_loss: 0.4424, test_loss: 1.5157, test_f1: 0.6058
 epoch: 50, train_loss: 0.4183, test_loss: 1.7729, test_f1: 0.5921
 epoch: 51, train_loss: 0.3904, test_loss: 1.7704, test_f1: 0.5793
 epoch: 52, train_loss: 0.3328, test_loss: 1.7798, test_f1: 0.6426
 epoch: 53, train_loss: 0.3300, test_loss: 2.0047, test_f1: 0.6058
 epoch: 54, train_loss: 0.3018, test_loss: 2.1265, test_f1: 0.6187
 epoch: 55, train_loss: 0.3018, test_loss: 2.1655, test_f1: 0.5992
 epoch: 56, train_loss: 0.2905, test_loss: 2.2437, test_f1: 0.5857
 epoch: 57, train_loss: 0.2880, test_loss: 2.1138, test_f1: 0.5886
 epoch: 58, train_loss: 0.2928, test_loss: 2.2219, test_f1: 0.5747
 epoch: 59, train_loss: 0.3027, test_loss: 2.1294, test_f1: 0.5822
 epoch: 60, train_loss: 0.2569, test_loss: 2.1732, test_f1: 0.6257
 epoch: 61, train_loss: 0.2753, test_loss: 2.3662, test_f1: 0.6207
 epoch: 62, train_loss: 0.2475, test_loss: 3.1026, test_f1: 0.5885
 epoch: 63, train_loss: 0.2774, test_loss: 2.0786, test_f1: 0.6075
 epoch: 64, train_loss: 0.2689, test_loss: 2.1274, test_f1: 0.6127
 epoch: 65, train_loss: 0.2550, test_loss: 2.4384, test_f1: 0.6089
 epoch: 66, train_loss: 0.2320, test_loss: 2.5961, test_f1: 0.6040
 epoch: 67, train_loss: 0.3381, test_loss: 1.8027, test_f1: 0.6302
 epoch: 68, train_loss: 0.2576, test_loss: 2.0123, test_f1: 0.6366
 epoch: 69, train_loss: 0.1964, test_loss: 2.4877, test_f1: 0.6035
 epoch: 70, train_loss: 0.2129, test_loss: 2.2630, test_f1: 0.6177
 epoch: 71, train_loss: 0.2184, test_loss: 2.3648, test_f1: 0.6103
 epoch: 72, train_loss: 0.1870, test_loss: 2.6003, test_f1: 0.6400
 epoch: 73, train_loss: 0.2146, test_loss: 2.4625, test_f1: 0.6021
 epoch: 74, train_loss: 0.2355, test_loss: 2.7485, test_f1: 0.5816
 epoch: 75, train_loss: 0.2422, test_loss: 2.3374, test_f1: 0.6026
 epoch: 76, train_loss: 0.2517, test_loss: 2.4897, test_f1: 0.6025
 epoch: 77, train_loss: 0.1928, test_loss: 2.7104, test_f1: 0.6078
 epoch: 78, train_loss: 0.2274, test_loss: 2.4168, test_f1: 0.6491
 epoch: 79, train_loss: 0.2280, test_loss: 2.3465, test_f1: 0.6402
 epoch: 80, train_loss: 0.2081, test_loss: 2.3968, test_f1: 0.5857
 epoch: 81, train_loss: 0.2230, test_loss: 2.5152, test_f1: 0.6067
 epoch: 82, train_loss: 0.1828, test_loss: 2.7733, test_f1: 0.5880
 epoch: 83, train_loss: 0.2090, test_loss: 2.6086, test_f1: 0.5679
 epoch: 84, train_loss: 0.1766, test_loss: 2.9232, test_f1: 0.6096
 epoch: 85, train_loss: 0.1928, test_loss: 2.8928, test_f1: 0.6005
 epoch: 86, train_loss: 0.1847, test_loss: 2.6688, test_f1: 0.6609
 epoch: 87, train_loss: 0.1517, test_loss: 2.7642, test_f1: 0.6275
 epoch: 88, train_loss: 0.1639, test_loss: 2.8115, test_f1: 0.6685
 epoch: 89, train_loss: 0.1962, test_loss: 2.4114, test_f1: 0.5920
 epoch: 90, train_loss: 0.1569, test_loss: 3.0066, test_f1: 0.6087
 epoch: 91, train_loss: 0.1852, test_loss: 2.9047, test_f1: 0.5869
 epoch: 92, train_loss: 0.1752, test_loss: 2.6219, test_f1: 0.6199
 epoch: 93, train_loss: 0.1363, test_loss: 3.1624, test_f1: 0.6178
 epoch: 94, train_loss: 0.1385, test_loss: 3.1365, test_f1: 0.6084
 epoch: 95, train_loss: 0.1524, test_loss: 3.3264, test_f1: 0.6486
 epoch: 96, train_loss: 0.1498, test_loss: 3.5552, test_f1: 0.5966
 epoch: 97, train_loss: 0.1611, test_loss: 2.9390, test_f1: 0.6102
 epoch: 98, train_loss: 0.1560, test_loss: 2.8708, test_f1: 0.5731
 epoch: 99, train_loss: 0.1655, test_loss: 2.8629, test_f1: 0.5877
##################ITERATION #2 ****************************************
 epoch: 0, train_loss: 1.2291, test_loss: 1.3624, test_f1: 0.4200
 epoch: 1, train_loss: 1.0287, test_loss: 1.1824, test_f1: 0.4065
 epoch: 2, train_loss: 0.9880, test_loss: 1.1475, test_f1: 0.4886
 epoch: 3, train_loss: 0.8888, test_loss: 1.0924, test_f1: 0.5397
 epoch: 4, train_loss: 0.8546, test_loss: 1.0897, test_f1: 0.5597
 epoch: 5, train_loss: 0.8092, test_loss: 1.0812, test_f1: 0.5739
 epoch: 6, train_loss: 0.7894, test_loss: 0.9572, test_f1: 0.5873
 epoch: 7, train_loss: 0.7850, test_loss: 1.0891, test_f1: 0.5884
 epoch: 8, train_loss: 0.7854, test_loss: 1.1299, test_f1: 0.5631
 epoch: 9, train_loss: 0.7520, test_loss: 2.0130, test_f1: 0.3585
 epoch: 10, train_loss: 0.7397, test_loss: 0.9506, test_f1: 0.5283
 epoch: 11, train_loss: 0.7596, test_loss: 1.0744, test_f1: 0.5225
 epoch: 12, train_loss: 0.7758, test_loss: 1.0707, test_f1: 0.5717
 epoch: 13, train_loss: 0.7475, test_loss: 1.1099, test_f1: 0.4957
 epoch: 14, train_loss: 0.7321, test_loss: 1.0260, test_f1: 0.5395
 epoch: 15, train_loss: 0.7259, test_loss: 1.1386, test_f1: 0.5301
 epoch: 16, train_loss: 0.7394, test_loss: 1.2672, test_f1: 0.5284
 epoch: 17, train_loss: 0.7080, test_loss: 1.1086, test_f1: 0.5659
 epoch: 18, train_loss: 0.6824, test_loss: 1.2909, test_f1: 0.5613
 epoch: 19, train_loss: 0.6627, test_loss: 1.0679, test_f1: 0.5570
 epoch: 20, train_loss: 0.6660, test_loss: 1.2408, test_f1: 0.4328
 epoch: 21, train_loss: 0.6812, test_loss: 1.0340, test_f1: 0.5869
 epoch: 22, train_loss: 0.6864, test_loss: 1.0179, test_f1: 0.5866
 epoch: 23, train_loss: 0.6813, test_loss: 1.6240, test_f1: 0.4853
 epoch: 24, train_loss: 0.6485, test_loss: 1.0882, test_f1: 0.6115
 epoch: 25, train_loss: 0.6226, test_loss: 1.0420, test_f1: 0.5738
 epoch: 26, train_loss: 0.6325, test_loss: 1.3424, test_f1: 0.5498
 epoch: 27, train_loss: 0.6220, test_loss: 1.2539, test_f1: 0.5258
 epoch: 28, train_loss: 0.6400, test_loss: 1.1905, test_f1: 0.5472
 epoch: 29, train_loss: 0.6410, test_loss: 1.2547, test_f1: 0.5879
 epoch: 30, train_loss: 0.6116, test_loss: 1.3744, test_f1: 0.6121
 epoch: 31, train_loss: 0.6116, test_loss: 1.1600, test_f1: 0.5618
 epoch: 32, train_loss: 0.5983, test_loss: 1.2663, test_f1: 0.5040
 epoch: 33, train_loss: 0.5906, test_loss: 1.1683, test_f1: 0.5680
 epoch: 34, train_loss: 0.6110, test_loss: 1.1478, test_f1: 0.6039
 epoch: 35, train_loss: 0.5620, test_loss: 1.3909, test_f1: 0.5064
 epoch: 36, train_loss: 0.5609, test_loss: 1.0695, test_f1: 0.5934
 epoch: 37, train_loss: 0.5584, test_loss: 1.1217, test_f1: 0.5439
 epoch: 38, train_loss: 0.5631, test_loss: 1.3189, test_f1: 0.6069
 epoch: 39, train_loss: 0.5781, test_loss: 0.9585, test_f1: 0.6363
 epoch: 40, train_loss: 0.5789, test_loss: 1.3824, test_f1: 0.5677
 epoch: 41, train_loss: 0.5447, test_loss: 1.0990, test_f1: 0.5803
 epoch: 42, train_loss: 0.5039, test_loss: 1.3305, test_f1: 0.6272
 epoch: 43, train_loss: 0.5385, test_loss: 1.6749, test_f1: 0.5053
 epoch: 44, train_loss: 0.5765, test_loss: 1.3126, test_f1: 0.6471
 epoch: 45, train_loss: 0.5242, test_loss: 1.3486, test_f1: 0.6109
 epoch: 46, train_loss: 0.5199, test_loss: 1.3542, test_f1: 0.5708
 epoch: 47, train_loss: 0.5089, test_loss: 1.4194, test_f1: 0.6376
 epoch: 48, train_loss: 0.5374, test_loss: 1.6559, test_f1: 0.4981
 epoch: 49, train_loss: 0.4990, test_loss: 1.1686, test_f1: 0.6107
 epoch: 50, train_loss: 0.4650, test_loss: 1.4277, test_f1: 0.6230
 epoch: 51, train_loss: 0.4277, test_loss: 1.2487, test_f1: 0.6706
 epoch: 52, train_loss: 0.3776, test_loss: 1.6635, test_f1: 0.6329
 epoch: 53, train_loss: 0.4267, test_loss: 1.4417, test_f1: 0.6287
 epoch: 54, train_loss: 0.3939, test_loss: 1.5182, test_f1: 0.6282
 epoch: 55, train_loss: 0.4029, test_loss: 1.5316, test_f1: 0.5955
 epoch: 56, train_loss: 0.3911, test_loss: 1.2758, test_f1: 0.6459
 epoch: 57, train_loss: 0.3411, test_loss: 1.8097, test_f1: 0.6553
 epoch: 58, train_loss: 0.3266, test_loss: 1.5744, test_f1: 0.6603
 epoch: 59, train_loss: 0.3547, test_loss: 1.5935, test_f1: 0.6502
 epoch: 60, train_loss: 0.3402, test_loss: 1.9139, test_f1: 0.6687
 epoch: 61, train_loss: 0.3206, test_loss: 1.8940, test_f1: 0.6548
 epoch: 62, train_loss: 0.3300, test_loss: 1.6431, test_f1: 0.6229
 epoch: 63, train_loss: 0.3073, test_loss: 1.9690, test_f1: 0.6093
 epoch: 64, train_loss: 0.2959, test_loss: 1.7812, test_f1: 0.6732
 epoch: 65, train_loss: 0.2726, test_loss: 2.2818, test_f1: 0.6518
 epoch: 66, train_loss: 0.2915, test_loss: 2.0806, test_f1: 0.6455
 epoch: 67, train_loss: 0.3310, test_loss: 1.8238, test_f1: 0.6348
 epoch: 68, train_loss: 0.2560, test_loss: 2.0574, test_f1: 0.6752
 epoch: 69, train_loss: 0.2384, test_loss: 2.1828, test_f1: 0.6457
 epoch: 70, train_loss: 0.2881, test_loss: 2.1696, test_f1: 0.6351
 epoch: 71, train_loss: 0.2550, test_loss: 2.0548, test_f1: 0.6437
 epoch: 72, train_loss: 0.2629, test_loss: 1.9664, test_f1: 0.6569
 epoch: 73, train_loss: 0.3039, test_loss: 2.0354, test_f1: 0.6431
 epoch: 74, train_loss: 0.2559, test_loss: 2.5161, test_f1: 0.6449
 epoch: 75, train_loss: 0.2621, test_loss: 2.6376, test_f1: 0.6374
 epoch: 76, train_loss: 0.2622, test_loss: 1.9019, test_f1: 0.6612
 epoch: 77, train_loss: 0.2291, test_loss: 2.0851, test_f1: 0.6801
 epoch: 78, train_loss: 0.2253, test_loss: 2.0743, test_f1: 0.6508
 epoch: 79, train_loss: 0.2453, test_loss: 2.1219, test_f1: 0.6677
 epoch: 80, train_loss: 0.2583, test_loss: 2.4868, test_f1: 0.6262
 epoch: 81, train_loss: 0.2467, test_loss: 2.2034, test_f1: 0.6395
 epoch: 82, train_loss: 0.2011, test_loss: 2.1965, test_f1: 0.6516
 epoch: 83, train_loss: 0.2162, test_loss: 2.3882, test_f1: 0.6323
 epoch: 84, train_loss: 0.2207, test_loss: 2.4444, test_f1: 0.5947
 epoch: 85, train_loss: 0.2034, test_loss: 2.5553, test_f1: 0.6456
 epoch: 86, train_loss: 0.1990, test_loss: 2.1243, test_f1: 0.6236
 epoch: 87, train_loss: 0.2122, test_loss: 2.0017, test_f1: 0.6577
 epoch: 88, train_loss: 0.2190, test_loss: 2.1608, test_f1: 0.6681
 epoch: 89, train_loss: 0.2039, test_loss: 2.5309, test_f1: 0.6069
 epoch: 90, train_loss: 0.2054, test_loss: 2.3311, test_f1: 0.6485
 epoch: 91, train_loss: 0.1791, test_loss: 2.5579, test_f1: 0.6412
 epoch: 92, train_loss: 0.2147, test_loss: 2.7930, test_f1: 0.6084
 epoch: 93, train_loss: 0.2443, test_loss: 2.1755, test_f1: 0.6185
 epoch: 94, train_loss: 0.2001, test_loss: 2.1044, test_f1: 0.6523
 epoch: 95, train_loss: 0.1747, test_loss: 2.5068, test_f1: 0.6488
 epoch: 96, train_loss: 0.1478, test_loss: 2.7811, test_f1: 0.6130
 epoch: 97, train_loss: 0.1290, test_loss: 2.8171, test_f1: 0.6462
 epoch: 98, train_loss: 0.1767, test_loss: 2.8750, test_f1: 0.6280
 epoch: 99, train_loss: 0.1317, test_loss: 2.8524, test_f1: 0.6426
##################ITERATION #3 ****************************************
 epoch: 0, train_loss: 1.2570, test_loss: 1.1035, test_f1: 0.4421
 epoch: 1, train_loss: 0.9239, test_loss: 1.0455, test_f1: 0.5460
 epoch: 2, train_loss: 0.8563, test_loss: 1.1049, test_f1: 0.5146
 epoch: 3, train_loss: 0.8505, test_loss: 1.2618, test_f1: 0.4514
 epoch: 4, train_loss: 0.8266, test_loss: 1.0669, test_f1: 0.5826
 epoch: 5, train_loss: 0.8054, test_loss: 0.9619, test_f1: 0.5611
 epoch: 6, train_loss: 0.7864, test_loss: 0.9977, test_f1: 0.5890
 epoch: 7, train_loss: 0.7817, test_loss: 1.3444, test_f1: 0.5014
 epoch: 8, train_loss: 0.7966, test_loss: 0.9900, test_f1: 0.5509
 epoch: 9, train_loss: 0.7843, test_loss: 1.0840, test_f1: 0.5464
 epoch: 10, train_loss: 0.7263, test_loss: 2.0281, test_f1: 0.5002
 epoch: 11, train_loss: 0.7827, test_loss: 1.0452, test_f1: 0.6008
 epoch: 12, train_loss: 0.7180, test_loss: 0.9102, test_f1: 0.6039
 epoch: 13, train_loss: 0.7332, test_loss: 1.8484, test_f1: 0.4499
 epoch: 14, train_loss: 0.7222, test_loss: 0.9078, test_f1: 0.6320
 epoch: 15, train_loss: 0.6916, test_loss: 1.0012, test_f1: 0.5726
 epoch: 16, train_loss: 0.6849, test_loss: 1.2391, test_f1: 0.5409
 epoch: 17, train_loss: 0.6806, test_loss: 1.1211, test_f1: 0.6072
 epoch: 18, train_loss: 0.6759, test_loss: 1.0613, test_f1: 0.5505
 epoch: 19, train_loss: 0.6575, test_loss: 1.1764, test_f1: 0.6050
 epoch: 20, train_loss: 0.6450, test_loss: 1.0823, test_f1: 0.5124
 epoch: 21, train_loss: 0.6399, test_loss: 1.1422, test_f1: 0.6332
 epoch: 22, train_loss: 0.6197, test_loss: 1.1423, test_f1: 0.6016
 epoch: 23, train_loss: 0.6519, test_loss: 1.1078, test_f1: 0.6085
 epoch: 24, train_loss: 0.6534, test_loss: 1.3648, test_f1: 0.5977
 epoch: 25, train_loss: 0.6265, test_loss: 1.0261, test_f1: 0.6401
 epoch: 26, train_loss: 0.6394, test_loss: 1.2406, test_f1: 0.5938
 epoch: 27, train_loss: 0.6316, test_loss: 1.1714, test_f1: 0.6143
 epoch: 28, train_loss: 0.6036, test_loss: 0.9136, test_f1: 0.6799
 epoch: 29, train_loss: 0.5994, test_loss: 1.7733, test_f1: 0.5590
 epoch: 30, train_loss: 0.5734, test_loss: 1.2980, test_f1: 0.5948
 epoch: 31, train_loss: 0.5689, test_loss: 1.7108, test_f1: 0.6265
 epoch: 32, train_loss: 0.5576, test_loss: 1.4722, test_f1: 0.6048
 epoch: 33, train_loss: 0.5565, test_loss: 1.2598, test_f1: 0.5776
 epoch: 34, train_loss: 0.5501, test_loss: 1.2759, test_f1: 0.6172
 epoch: 35, train_loss: 0.5489, test_loss: 1.0670, test_f1: 0.6159
 epoch: 36, train_loss: 0.6022, test_loss: 0.9220, test_f1: 0.6184
 epoch: 37, train_loss: 0.5876, test_loss: 1.1681, test_f1: 0.5681
 epoch: 38, train_loss: 0.5190, test_loss: 1.3031, test_f1: 0.6207
 epoch: 39, train_loss: 0.5190, test_loss: 1.2563, test_f1: 0.5924
 epoch: 40, train_loss: 0.5211, test_loss: 1.3988, test_f1: 0.6246
 epoch: 41, train_loss: 0.5311, test_loss: 1.1375, test_f1: 0.6209
 epoch: 42, train_loss: 0.5246, test_loss: 1.3426, test_f1: 0.5396
 epoch: 43, train_loss: 0.5221, test_loss: 1.2758, test_f1: 0.5880
 epoch: 44, train_loss: 0.5139, test_loss: 1.3209, test_f1: 0.6427
 epoch: 45, train_loss: 0.5282, test_loss: 1.1012, test_f1: 0.6158
 epoch: 46, train_loss: 0.4862, test_loss: 1.1398, test_f1: 0.6403
 epoch: 47, train_loss: 0.4590, test_loss: 1.1721, test_f1: 0.6113
 epoch: 48, train_loss: 0.4296, test_loss: 1.1185, test_f1: 0.5777
 epoch: 49, train_loss: 0.5564, test_loss: 1.2510, test_f1: 0.5581
 epoch: 50, train_loss: 0.5611, test_loss: 1.2655, test_f1: 0.5925
 epoch: 51, train_loss: 0.4714, test_loss: 1.1762, test_f1: 0.6075
 epoch: 52, train_loss: 0.4144, test_loss: 1.2562, test_f1: 0.6057
 epoch: 53, train_loss: 0.4267, test_loss: 1.3282, test_f1: 0.6088
 epoch: 54, train_loss: 0.3856, test_loss: 1.5909, test_f1: 0.5886
 epoch: 55, train_loss: 0.3855, test_loss: 1.4102, test_f1: 0.6279
 epoch: 56, train_loss: 0.3753, test_loss: 1.4986, test_f1: 0.5906
 epoch: 57, train_loss: 0.3764, test_loss: 1.4646, test_f1: 0.5748
 epoch: 58, train_loss: 0.4176, test_loss: 1.5420, test_f1: 0.6001
 epoch: 59, train_loss: 0.4145, test_loss: 1.4934, test_f1: 0.5768
 epoch: 60, train_loss: 0.3667, test_loss: 1.5001, test_f1: 0.6039
 epoch: 61, train_loss: 0.3387, test_loss: 1.8193, test_f1: 0.6077
 epoch: 62, train_loss: 0.3277, test_loss: 1.6086, test_f1: 0.6329
 epoch: 63, train_loss: 0.3375, test_loss: 1.6809, test_f1: 0.6077
 epoch: 64, train_loss: 0.3206, test_loss: 1.6522, test_f1: 0.6064
 epoch: 65, train_loss: 0.3088, test_loss: 1.8334, test_f1: 0.6206
 epoch: 66, train_loss: 0.3117, test_loss: 1.6343, test_f1: 0.6474
 epoch: 67, train_loss: 0.3172, test_loss: 1.7213, test_f1: 0.6152
 epoch: 68, train_loss: 0.3036, test_loss: 1.7219, test_f1: 0.6198
 epoch: 69, train_loss: 0.2972, test_loss: 1.6264, test_f1: 0.6296
 epoch: 70, train_loss: 0.2966, test_loss: 1.8834, test_f1: 0.6015
 epoch: 71, train_loss: 0.2794, test_loss: 1.6914, test_f1: 0.6229
 epoch: 72, train_loss: 0.2850, test_loss: 1.7431, test_f1: 0.6224
 epoch: 73, train_loss: 0.2684, test_loss: 1.7653, test_f1: 0.6274
 epoch: 74, train_loss: 0.2569, test_loss: 1.7877, test_f1: 0.5848
 epoch: 75, train_loss: 0.2687, test_loss: 1.9068, test_f1: 0.6240
 epoch: 76, train_loss: 0.2575, test_loss: 2.1954, test_f1: 0.6172
 epoch: 77, train_loss: 0.2584, test_loss: 2.1726, test_f1: 0.6239
 epoch: 78, train_loss: 0.3283, test_loss: 1.6184, test_f1: 0.6234
 epoch: 79, train_loss: 0.2687, test_loss: 1.7417, test_f1: 0.6384
 epoch: 80, train_loss: 0.2607, test_loss: 1.9789, test_f1: 0.6232
 epoch: 81, train_loss: 0.3056, test_loss: 1.8381, test_f1: 0.6060
 epoch: 82, train_loss: 0.2555, test_loss: 1.6642, test_f1: 0.6536
 epoch: 83, train_loss: 0.2713, test_loss: 1.9265, test_f1: 0.6060
 epoch: 84, train_loss: 0.2205, test_loss: 2.1065, test_f1: 0.6288
 epoch: 85, train_loss: 0.2326, test_loss: 2.2159, test_f1: 0.6068
 epoch: 86, train_loss: 0.1853, test_loss: 2.0757, test_f1: 0.6403
 epoch: 87, train_loss: 0.2120, test_loss: 2.0191, test_f1: 0.6178
 epoch: 88, train_loss: 0.2636, test_loss: 2.0377, test_f1: 0.6310
 epoch: 89, train_loss: 0.2026, test_loss: 2.2399, test_f1: 0.5865
 epoch: 90, train_loss: 0.2337, test_loss: 1.9855, test_f1: 0.6521
 epoch: 91, train_loss: 0.1914, test_loss: 2.3860, test_f1: 0.6369
 epoch: 92, train_loss: 0.1967, test_loss: 2.0889, test_f1: 0.6402
 epoch: 93, train_loss: 0.1876, test_loss: 2.2110, test_f1: 0.6221
 epoch: 94, train_loss: 0.1710, test_loss: 2.2428, test_f1: 0.6100
 epoch: 95, train_loss: 0.2194, test_loss: 2.0471, test_f1: 0.6419
 epoch: 96, train_loss: 0.1891, test_loss: 2.0520, test_f1: 0.5991
 epoch: 97, train_loss: 0.2185, test_loss: 2.0871, test_f1: 0.6470
 epoch: 98, train_loss: 0.1780, test_loss: 2.2829, test_f1: 0.6168
 epoch: 99, train_loss: 0.1896, test_loss: 2.0656, test_f1: 0.6356
##################ITERATION #4 ****************************************
 epoch: 0, train_loss: 1.3148, test_loss: 1.2427, test_f1: 0.3824
 epoch: 1, train_loss: 1.0318, test_loss: 1.1563, test_f1: 0.4330
 epoch: 2, train_loss: 0.9959, test_loss: 1.0924, test_f1: 0.4290
 epoch: 3, train_loss: 0.9607, test_loss: 1.1118, test_f1: 0.5215
 epoch: 4, train_loss: 0.9184, test_loss: 1.0734, test_f1: 0.5117
 epoch: 5, train_loss: 0.8492, test_loss: 1.2944, test_f1: 0.4738
 epoch: 6, train_loss: 0.8243, test_loss: 1.4033, test_f1: 0.4765
 epoch: 7, train_loss: 0.8029, test_loss: 0.9982, test_f1: 0.5202
 epoch: 8, train_loss: 0.8351, test_loss: 1.4163, test_f1: 0.4681
 epoch: 9, train_loss: 0.7957, test_loss: 1.0114, test_f1: 0.5776
 epoch: 10, train_loss: 0.7877, test_loss: 1.1000, test_f1: 0.5157
 epoch: 11, train_loss: 0.7624, test_loss: 1.0683, test_f1: 0.5746
 epoch: 12, train_loss: 0.7509, test_loss: 1.0799, test_f1: 0.5020
 epoch: 13, train_loss: 0.7360, test_loss: 1.0138, test_f1: 0.6289
 epoch: 14, train_loss: 0.7147, test_loss: 1.1747, test_f1: 0.5298
 epoch: 15, train_loss: 0.7357, test_loss: 1.0318, test_f1: 0.5375
 epoch: 16, train_loss: 0.7130, test_loss: 0.9739, test_f1: 0.6146
 epoch: 17, train_loss: 0.6956, test_loss: 1.0345, test_f1: 0.5865
 epoch: 18, train_loss: 0.6910, test_loss: 0.9757, test_f1: 0.6245
 epoch: 19, train_loss: 0.6793, test_loss: 1.6132, test_f1: 0.5808
 epoch: 20, train_loss: 0.6680, test_loss: 0.9720, test_f1: 0.5576
 epoch: 21, train_loss: 0.6954, test_loss: 1.0538, test_f1: 0.5337
 epoch: 22, train_loss: 0.6817, test_loss: 1.0023, test_f1: 0.6164
 epoch: 23, train_loss: 0.6668, test_loss: 0.9752, test_f1: 0.6219
 epoch: 24, train_loss: 0.6358, test_loss: 1.4012, test_f1: 0.4958
 epoch: 25, train_loss: 0.6616, test_loss: 1.1270, test_f1: 0.5513
 epoch: 26, train_loss: 0.6927, test_loss: 0.9190, test_f1: 0.6540
 epoch: 27, train_loss: 0.6424, test_loss: 1.0378, test_f1: 0.6589
 epoch: 28, train_loss: 0.6231, test_loss: 1.3596, test_f1: 0.5322
 epoch: 29, train_loss: 0.6281, test_loss: 1.0905, test_f1: 0.6190
 epoch: 30, train_loss: 0.6240, test_loss: 1.2393, test_f1: 0.5844
 epoch: 31, train_loss: 0.6154, test_loss: 0.9756, test_f1: 0.5979
 epoch: 32, train_loss: 0.5997, test_loss: 1.1569, test_f1: 0.6406
 epoch: 33, train_loss: 0.5947, test_loss: 1.1332, test_f1: 0.6742
 epoch: 34, train_loss: 0.5608, test_loss: 1.2696, test_f1: 0.5681
 epoch: 35, train_loss: 0.5563, test_loss: 1.0866, test_f1: 0.5888
 epoch: 36, train_loss: 0.5665, test_loss: 1.1716, test_f1: 0.6330
 epoch: 37, train_loss: 0.5750, test_loss: 1.3813, test_f1: 0.5904
 epoch: 38, train_loss: 0.5699, test_loss: 0.9425, test_f1: 0.6155
 epoch: 39, train_loss: 0.5200, test_loss: 1.3958, test_f1: 0.6339
 epoch: 40, train_loss: 0.5445, test_loss: 1.1575, test_f1: 0.6516
 epoch: 41, train_loss: 0.5323, test_loss: 1.2359, test_f1: 0.5706
 epoch: 42, train_loss: 0.5165, test_loss: 1.3008, test_f1: 0.5987
 epoch: 43, train_loss: 0.5385, test_loss: 1.2828, test_f1: 0.5865
 epoch: 44, train_loss: 0.5227, test_loss: 1.1649, test_f1: 0.6259
 epoch: 45, train_loss: 0.5087, test_loss: 1.1936, test_f1: 0.6314
 epoch: 46, train_loss: 0.5029, test_loss: 1.1030, test_f1: 0.6194
 epoch: 47, train_loss: 0.4996, test_loss: 1.5404, test_f1: 0.6019
 epoch: 48, train_loss: 0.5251, test_loss: 1.2976, test_f1: 0.6164
 epoch: 49, train_loss: 0.5094, test_loss: 1.1289, test_f1: 0.6274
 epoch: 50, train_loss: 0.4992, test_loss: 1.1031, test_f1: 0.6774
 epoch: 51, train_loss: 0.4290, test_loss: 1.2401, test_f1: 0.6442
 epoch: 52, train_loss: 0.4011, test_loss: 1.3406, test_f1: 0.6534
 epoch: 53, train_loss: 0.3653, test_loss: 1.5103, test_f1: 0.6226
 epoch: 54, train_loss: 0.3687, test_loss: 1.4938, test_f1: 0.6312
 epoch: 55, train_loss: 0.3532, test_loss: 1.7032, test_f1: 0.6009
 epoch: 56, train_loss: 0.3540, test_loss: 1.5230, test_f1: 0.6306
 epoch: 57, train_loss: 0.3212, test_loss: 1.7190, test_f1: 0.6017
 epoch: 58, train_loss: 0.3725, test_loss: 1.5257, test_f1: 0.6184
 epoch: 59, train_loss: 0.3041, test_loss: 1.6602, test_f1: 0.6397
 epoch: 60, train_loss: 0.3221, test_loss: 1.7516, test_f1: 0.6217
 epoch: 61, train_loss: 0.3083, test_loss: 1.7317, test_f1: 0.6050
 epoch: 62, train_loss: 0.3006, test_loss: 1.7441, test_f1: 0.6524
 epoch: 63, train_loss: 0.3008, test_loss: 1.7643, test_f1: 0.6289
 epoch: 64, train_loss: 0.3391, test_loss: 1.4095, test_f1: 0.6502
 epoch: 65, train_loss: 0.3065, test_loss: 1.6399, test_f1: 0.6308
 epoch: 66, train_loss: 0.2910, test_loss: 1.7030, test_f1: 0.6418
 epoch: 67, train_loss: 0.2484, test_loss: 1.9313, test_f1: 0.6419
 epoch: 68, train_loss: 0.2734, test_loss: 1.9477, test_f1: 0.6346
 epoch: 69, train_loss: 0.2497, test_loss: 1.8312, test_f1: 0.6544
 epoch: 70, train_loss: 0.2475, test_loss: 1.8710, test_f1: 0.6532
 epoch: 71, train_loss: 0.2423, test_loss: 1.9011, test_f1: 0.6441
 epoch: 72, train_loss: 0.2471, test_loss: 1.8707, test_f1: 0.6193
 epoch: 73, train_loss: 0.2843, test_loss: 1.7815, test_f1: 0.6348
 epoch: 74, train_loss: 0.2531, test_loss: 1.9958, test_f1: 0.6811
 epoch: 75, train_loss: 0.2352, test_loss: 1.9597, test_f1: 0.6498
 epoch: 76, train_loss: 0.2407, test_loss: 2.1289, test_f1: 0.6400
 epoch: 77, train_loss: 0.2412, test_loss: 1.9127, test_f1: 0.6565
 epoch: 78, train_loss: 0.2338, test_loss: 1.9233, test_f1: 0.6491
 epoch: 79, train_loss: 0.2254, test_loss: 2.2614, test_f1: 0.6310
 epoch: 80, train_loss: 0.2209, test_loss: 1.8844, test_f1: 0.6253
 epoch: 81, train_loss: 0.2548, test_loss: 2.1068, test_f1: 0.6215
 epoch: 82, train_loss: 0.2181, test_loss: 1.8088, test_f1: 0.6632
 epoch: 83, train_loss: 0.2122, test_loss: 2.1993, test_f1: 0.6235
 epoch: 84, train_loss: 0.2120, test_loss: 2.1794, test_f1: 0.6592
 epoch: 85, train_loss: 0.2259, test_loss: 2.3052, test_f1: 0.6315
 epoch: 86, train_loss: 0.1982, test_loss: 2.1603, test_f1: 0.6069
 epoch: 87, train_loss: 0.2492, test_loss: 1.9673, test_f1: 0.6465
 epoch: 88, train_loss: 0.1943, test_loss: 2.2428, test_f1: 0.6331
 epoch: 89, train_loss: 0.1784, test_loss: 2.1282, test_f1: 0.6428
 epoch: 90, train_loss: 0.1777, test_loss: 2.4618, test_f1: 0.6361
 epoch: 91, train_loss: 0.1915, test_loss: 2.4157, test_f1: 0.6332
 epoch: 92, train_loss: 0.2273, test_loss: 2.2170, test_f1: 0.6096
 epoch: 93, train_loss: 0.1799, test_loss: 2.0280, test_f1: 0.6152
 epoch: 94, train_loss: 0.2171, test_loss: 2.1837, test_f1: 0.6467
 epoch: 95, train_loss: 0.2048, test_loss: 2.2791, test_f1: 0.6519
 epoch: 96, train_loss: 0.1729, test_loss: 2.2095, test_f1: 0.5925
 epoch: 97, train_loss: 0.1676, test_loss: 2.5003, test_f1: 0.6338
 epoch: 98, train_loss: 0.1373, test_loss: 2.5389, test_f1: 0.6159
 epoch: 99, train_loss: 0.1882, test_loss: 2.7138, test_f1: 0.6233
##################ITERATION #5 ****************************************
 epoch: 0, train_loss: 1.2224, test_loss: 1.4301, test_f1: 0.2120
 epoch: 1, train_loss: 0.9308, test_loss: 1.1703, test_f1: 0.4318
 epoch: 2, train_loss: 0.8854, test_loss: 1.4758, test_f1: 0.3892
 epoch: 3, train_loss: 0.8935, test_loss: 1.5593, test_f1: 0.4134
 epoch: 4, train_loss: 0.8519, test_loss: 1.0946, test_f1: 0.5574
 epoch: 5, train_loss: 0.7977, test_loss: 1.4548, test_f1: 0.4031
 epoch: 6, train_loss: 0.8341, test_loss: 1.0709, test_f1: 0.5033
 epoch: 7, train_loss: 0.7883, test_loss: 1.2516, test_f1: 0.5308
 epoch: 8, train_loss: 0.7974, test_loss: 1.4754, test_f1: 0.5248
 epoch: 9, train_loss: 0.7744, test_loss: 1.1633, test_f1: 0.5533
 epoch: 10, train_loss: 0.7465, test_loss: 1.1755, test_f1: 0.5622
 epoch: 11, train_loss: 0.7529, test_loss: 1.0443, test_f1: 0.5994
 epoch: 12, train_loss: 0.7098, test_loss: 1.4465, test_f1: 0.5196
 epoch: 13, train_loss: 0.6935, test_loss: 1.1059, test_f1: 0.5283
 epoch: 14, train_loss: 0.6784, test_loss: 1.0300, test_f1: 0.5782
 epoch: 15, train_loss: 0.7284, test_loss: 1.1513, test_f1: 0.5274
 epoch: 16, train_loss: 0.6740, test_loss: 1.5850, test_f1: 0.5475
 epoch: 17, train_loss: 0.6726, test_loss: 1.0076, test_f1: 0.5773
 epoch: 18, train_loss: 0.6679, test_loss: 1.0130, test_f1: 0.5998
 epoch: 19, train_loss: 0.6519, test_loss: 1.4500, test_f1: 0.4969
 epoch: 20, train_loss: 0.6491, test_loss: 1.2440, test_f1: 0.6163
 epoch: 21, train_loss: 0.6429, test_loss: 1.0365, test_f1: 0.6080
 epoch: 22, train_loss: 0.6332, test_loss: 1.2073, test_f1: 0.5862
 epoch: 23, train_loss: 0.6306, test_loss: 1.7591, test_f1: 0.4989
 epoch: 24, train_loss: 0.6314, test_loss: 1.2861, test_f1: 0.6288
 epoch: 25, train_loss: 0.6150, test_loss: 1.1840, test_f1: 0.6068
 epoch: 26, train_loss: 0.6020, test_loss: 1.0975, test_f1: 0.5958
 epoch: 27, train_loss: 0.5471, test_loss: 1.2077, test_f1: 0.4947
 epoch: 28, train_loss: 0.5958, test_loss: 2.3635, test_f1: 0.5679
 epoch: 29, train_loss: 0.5802, test_loss: 1.3549, test_f1: 0.6129
 epoch: 30, train_loss: 0.5746, test_loss: 1.4908, test_f1: 0.5871
 epoch: 31, train_loss: 0.5509, test_loss: 1.6321, test_f1: 0.5520
 epoch: 32, train_loss: 0.5215, test_loss: 1.4955, test_f1: 0.5559
 epoch: 33, train_loss: 0.5796, test_loss: 1.3828, test_f1: 0.5296
 epoch: 34, train_loss: 0.5573, test_loss: 1.0318, test_f1: 0.6595
 epoch: 35, train_loss: 0.5258, test_loss: 1.6885, test_f1: 0.5683
 epoch: 36, train_loss: 0.5325, test_loss: 1.2180, test_f1: 0.5866
 epoch: 37, train_loss: 0.5389, test_loss: 1.4449, test_f1: 0.5050
 epoch: 38, train_loss: 0.5138, test_loss: 1.7103, test_f1: 0.5155
 epoch: 39, train_loss: 0.4904, test_loss: 1.3829, test_f1: 0.5840
 epoch: 40, train_loss: 0.5139, test_loss: 1.4220, test_f1: 0.5765
 epoch: 41, train_loss: 0.4952, test_loss: 1.1704, test_f1: 0.6279
 epoch: 42, train_loss: 0.5050, test_loss: 1.3284, test_f1: 0.6531
 epoch: 43, train_loss: 0.5078, test_loss: 1.3083, test_f1: 0.6000
 epoch: 44, train_loss: 0.4502, test_loss: 1.4547, test_f1: 0.5959
 epoch: 45, train_loss: 0.4466, test_loss: 1.5879, test_f1: 0.5861
 epoch: 46, train_loss: 0.4345, test_loss: 1.8405, test_f1: 0.5640
 epoch: 47, train_loss: 0.4303, test_loss: 1.8993, test_f1: 0.5412
 epoch: 48, train_loss: 0.4419, test_loss: 1.5325, test_f1: 0.5716
 epoch: 49, train_loss: 0.4500, test_loss: 1.3030, test_f1: 0.5812
 epoch: 50, train_loss: 0.4849, test_loss: 2.7339, test_f1: 0.3954
 epoch: 51, train_loss: 0.4223, test_loss: 1.8672, test_f1: 0.5855
 epoch: 52, train_loss: 0.3664, test_loss: 1.6870, test_f1: 0.5880
 epoch: 53, train_loss: 0.3199, test_loss: 2.0505, test_f1: 0.5879
 epoch: 54, train_loss: 0.3356, test_loss: 2.1543, test_f1: 0.5691
 epoch: 55, train_loss: 0.3519, test_loss: 1.8093, test_f1: 0.5853
 epoch: 56, train_loss: 0.3390, test_loss: 2.2094, test_f1: 0.5832
 epoch: 57, train_loss: 0.2972, test_loss: 2.1611, test_f1: 0.5592
 epoch: 58, train_loss: 0.3399, test_loss: 2.1486, test_f1: 0.6168
 epoch: 59, train_loss: 0.2821, test_loss: 2.0654, test_f1: 0.6207
 epoch: 60, train_loss: 0.2833, test_loss: 1.9334, test_f1: 0.5779
 epoch: 61, train_loss: 0.2856, test_loss: 2.1537, test_f1: 0.6074
 epoch: 62, train_loss: 0.3176, test_loss: 2.3394, test_f1: 0.6044
 epoch: 63, train_loss: 0.3574, test_loss: 2.1752, test_f1: 0.5941
 epoch: 64, train_loss: 0.2947, test_loss: 2.0686, test_f1: 0.6184
 epoch: 65, train_loss: 0.2794, test_loss: 1.9769, test_f1: 0.6182
 epoch: 66, train_loss: 0.2916, test_loss: 2.0313, test_f1: 0.5998
 epoch: 67, train_loss: 0.2850, test_loss: 2.3527, test_f1: 0.6041
 epoch: 68, train_loss: 0.2705, test_loss: 2.0392, test_f1: 0.6069
 epoch: 69, train_loss: 0.2686, test_loss: 2.6934, test_f1: 0.5997
 epoch: 70, train_loss: 0.2582, test_loss: 2.0880, test_f1: 0.6024
 epoch: 71, train_loss: 0.2349, test_loss: 2.6391, test_f1: 0.6220
 epoch: 72, train_loss: 0.2267, test_loss: 2.6627, test_f1: 0.6183
 epoch: 73, train_loss: 0.2621, test_loss: 2.1203, test_f1: 0.5991
 epoch: 74, train_loss: 0.2395, test_loss: 2.2473, test_f1: 0.6197
 epoch: 75, train_loss: 0.2386, test_loss: 2.3393, test_f1: 0.6162
 epoch: 76, train_loss: 0.2001, test_loss: 2.7770, test_f1: 0.6172
 epoch: 77, train_loss: 0.2225, test_loss: 2.2820, test_f1: 0.6079
 epoch: 78, train_loss: 0.2769, test_loss: 2.2269, test_f1: 0.6157
 epoch: 79, train_loss: 0.2648, test_loss: 2.5978, test_f1: 0.5620
 epoch: 80, train_loss: 0.1884, test_loss: 2.7336, test_f1: 0.6106
 epoch: 81, train_loss: 0.2229, test_loss: 2.5976, test_f1: 0.6081
 epoch: 82, train_loss: 0.2109, test_loss: 2.5801, test_f1: 0.6056
 epoch: 83, train_loss: 0.2308, test_loss: 2.6395, test_f1: 0.6166
 epoch: 84, train_loss: 0.2347, test_loss: 2.1536, test_f1: 0.6235
 epoch: 85, train_loss: 0.2320, test_loss: 2.2402, test_f1: 0.6050
 epoch: 86, train_loss: 0.2145, test_loss: 2.6983, test_f1: 0.6205
 epoch: 87, train_loss: 0.2001, test_loss: 2.4670, test_f1: 0.6053
 epoch: 88, train_loss: 0.1730, test_loss: 2.5597, test_f1: 0.6352
 epoch: 89, train_loss: 0.1870, test_loss: 2.9099, test_f1: 0.6084
 epoch: 90, train_loss: 0.2838, test_loss: 2.5231, test_f1: 0.6083
 epoch: 91, train_loss: 0.2582, test_loss: 2.7712, test_f1: 0.6116
 epoch: 92, train_loss: 0.2140, test_loss: 2.7171, test_f1: 0.6065
 epoch: 93, train_loss: 0.2059, test_loss: 2.6054, test_f1: 0.6077
 epoch: 94, train_loss: 0.1949, test_loss: 2.3865, test_f1: 0.6054
 epoch: 95, train_loss: 0.1405, test_loss: 2.5604, test_f1: 0.6415
 epoch: 96, train_loss: 0.1880, test_loss: 2.5757, test_f1: 0.6149
 epoch: 97, train_loss: 0.2409, test_loss: 2.3535, test_f1: 0.6393
 epoch: 98, train_loss: 0.2174, test_loss: 2.9162, test_f1: 0.6034
 epoch: 99, train_loss: 0.1570, test_loss: 2.5832, test_f1: 0.6355
##################ITERATION #6 ****************************************
 epoch: 0, train_loss: 1.3144, test_loss: 1.1641, test_f1: 0.5020
 epoch: 1, train_loss: 0.9534, test_loss: 1.0603, test_f1: 0.5460
 epoch: 2, train_loss: 0.8728, test_loss: 1.1139, test_f1: 0.5467
 epoch: 3, train_loss: 0.8459, test_loss: 1.5309, test_f1: 0.4273
 epoch: 4, train_loss: 0.8220, test_loss: 1.1314, test_f1: 0.5936
 epoch: 5, train_loss: 0.8004, test_loss: 1.0327, test_f1: 0.5051
 epoch: 6, train_loss: 0.7887, test_loss: 1.0779, test_f1: 0.5649
 epoch: 7, train_loss: 0.7536, test_loss: 1.0737, test_f1: 0.5670
 epoch: 8, train_loss: 0.7831, test_loss: 1.9460, test_f1: 0.5018
 epoch: 9, train_loss: 0.8009, test_loss: 1.0776, test_f1: 0.6053
 epoch: 10, train_loss: 0.7538, test_loss: 1.0870, test_f1: 0.5261
 epoch: 11, train_loss: 0.7316, test_loss: 0.9918, test_f1: 0.6029
 epoch: 12, train_loss: 0.7907, test_loss: 1.0992, test_f1: 0.5188
 epoch: 13, train_loss: 0.7181, test_loss: 0.9859, test_f1: 0.6725
 epoch: 14, train_loss: 0.7053, test_loss: 1.0914, test_f1: 0.5726
 epoch: 15, train_loss: 0.6904, test_loss: 1.2469, test_f1: 0.5771
 epoch: 16, train_loss: 0.6725, test_loss: 0.9824, test_f1: 0.5853
 epoch: 17, train_loss: 0.6966, test_loss: 1.1801, test_f1: 0.5928
 epoch: 18, train_loss: 0.6814, test_loss: 1.3396, test_f1: 0.5141
 epoch: 19, train_loss: 0.6603, test_loss: 1.3882, test_f1: 0.4608
 epoch: 20, train_loss: 0.6861, test_loss: 1.0943, test_f1: 0.5550
 epoch: 21, train_loss: 0.6691, test_loss: 1.0836, test_f1: 0.5913
 epoch: 22, train_loss: 0.6651, test_loss: 1.2331, test_f1: 0.5725
 epoch: 23, train_loss: 0.6562, test_loss: 1.1681, test_f1: 0.5198
 epoch: 24, train_loss: 0.6386, test_loss: 1.0187, test_f1: 0.5951
 epoch: 25, train_loss: 0.6218, test_loss: 1.2049, test_f1: 0.5847
 epoch: 26, train_loss: 0.6109, test_loss: 1.2590, test_f1: 0.5037
 epoch: 27, train_loss: 0.5926, test_loss: 1.1101, test_f1: 0.6237
 epoch: 28, train_loss: 0.5778, test_loss: 1.2393, test_f1: 0.5851
 epoch: 29, train_loss: 0.5637, test_loss: 1.2473, test_f1: 0.5336
 epoch: 30, train_loss: 0.5751, test_loss: 1.2270, test_f1: 0.5281
 epoch: 31, train_loss: 0.6101, test_loss: 1.4432, test_f1: 0.6012
 epoch: 32, train_loss: 0.5908, test_loss: 1.0412, test_f1: 0.5955
 epoch: 33, train_loss: 0.5607, test_loss: 1.3870, test_f1: 0.5714
 epoch: 34, train_loss: 0.5629, test_loss: 1.1555, test_f1: 0.5959
 epoch: 35, train_loss: 0.5586, test_loss: 1.3803, test_f1: 0.5677
 epoch: 36, train_loss: 0.5719, test_loss: 1.1675, test_f1: 0.5869
 epoch: 37, train_loss: 0.5106, test_loss: 1.2352, test_f1: 0.5970
 epoch: 38, train_loss: 0.5015, test_loss: 1.5368, test_f1: 0.5914
 epoch: 39, train_loss: 0.5517, test_loss: 1.3895, test_f1: 0.5275
 epoch: 40, train_loss: 0.5078, test_loss: 1.2922, test_f1: 0.6578
 epoch: 41, train_loss: 0.5481, test_loss: 1.2655, test_f1: 0.5782
 epoch: 42, train_loss: 0.5735, test_loss: 1.4134, test_f1: 0.5491
 epoch: 43, train_loss: 0.5390, test_loss: 1.0835, test_f1: 0.5627
 epoch: 44, train_loss: 0.5345, test_loss: 1.1747, test_f1: 0.6201
 epoch: 45, train_loss: 0.4769, test_loss: 1.2941, test_f1: 0.5685
 epoch: 46, train_loss: 0.4453, test_loss: 1.1982, test_f1: 0.5831
 epoch: 47, train_loss: 0.4556, test_loss: 1.5831, test_f1: 0.5743
 epoch: 48, train_loss: 0.4431, test_loss: 1.1860, test_f1: 0.5624
 epoch: 49, train_loss: 0.4815, test_loss: 1.1798, test_f1: 0.6091
 epoch: 50, train_loss: 0.4898, test_loss: 1.7377, test_f1: 0.4764
 epoch: 51, train_loss: 0.4785, test_loss: 1.1845, test_f1: 0.5987
 epoch: 52, train_loss: 0.3986, test_loss: 1.4834, test_f1: 0.6055
 epoch: 53, train_loss: 0.3842, test_loss: 1.5238, test_f1: 0.5856
 epoch: 54, train_loss: 0.4022, test_loss: 1.4683, test_f1: 0.5978
 epoch: 55, train_loss: 0.4017, test_loss: 1.3732, test_f1: 0.5918
 epoch: 56, train_loss: 0.3443, test_loss: 1.4863, test_f1: 0.5607
 epoch: 57, train_loss: 0.3276, test_loss: 2.1474, test_f1: 0.5495
 epoch: 58, train_loss: 0.3373, test_loss: 1.9215, test_f1: 0.5792
 epoch: 59, train_loss: 0.3531, test_loss: 1.7894, test_f1: 0.5600
 epoch: 60, train_loss: 0.3218, test_loss: 1.9732, test_f1: 0.5686
 epoch: 61, train_loss: 0.3209, test_loss: 1.7529, test_f1: 0.5626
 epoch: 62, train_loss: 0.3310, test_loss: 1.8696, test_f1: 0.5801
 epoch: 63, train_loss: 0.3056, test_loss: 1.9228, test_f1: 0.6255
 epoch: 64, train_loss: 0.3193, test_loss: 1.7576, test_f1: 0.5765
 epoch: 65, train_loss: 0.3051, test_loss: 1.8280, test_f1: 0.5900
 epoch: 66, train_loss: 0.3015, test_loss: 1.7979, test_f1: 0.5992
 epoch: 67, train_loss: 0.2896, test_loss: 1.8892, test_f1: 0.5936
 epoch: 68, train_loss: 0.3146, test_loss: 2.2512, test_f1: 0.5965
 epoch: 69, train_loss: 0.2889, test_loss: 2.0967, test_f1: 0.5999
 epoch: 70, train_loss: 0.2864, test_loss: 2.4151, test_f1: 0.5337
 epoch: 71, train_loss: 0.2884, test_loss: 2.2118, test_f1: 0.5999
 epoch: 72, train_loss: 0.3167, test_loss: 2.2797, test_f1: 0.6144
 epoch: 73, train_loss: 0.3023, test_loss: 2.1317, test_f1: 0.6049
 epoch: 74, train_loss: 0.2668, test_loss: 1.8241, test_f1: 0.6128
 epoch: 75, train_loss: 0.2631, test_loss: 2.3102, test_f1: 0.6065
 epoch: 76, train_loss: 0.2345, test_loss: 2.1358, test_f1: 0.6114
 epoch: 77, train_loss: 0.2638, test_loss: 2.3264, test_f1: 0.6178
 epoch: 78, train_loss: 0.2574, test_loss: 1.9172, test_f1: 0.6029
 epoch: 79, train_loss: 0.2200, test_loss: 2.1785, test_f1: 0.6191
 epoch: 80, train_loss: 0.2736, test_loss: 2.0018, test_f1: 0.6211
 epoch: 81, train_loss: 0.2855, test_loss: 1.8698, test_f1: 0.6185
 epoch: 82, train_loss: 0.2840, test_loss: 1.8709, test_f1: 0.6214
 epoch: 83, train_loss: 0.2686, test_loss: 1.6997, test_f1: 0.6051
 epoch: 84, train_loss: 0.2542, test_loss: 1.7777, test_f1: 0.6050
 epoch: 85, train_loss: 0.2385, test_loss: 1.8087, test_f1: 0.6307
 epoch: 86, train_loss: 0.2200, test_loss: 2.1626, test_f1: 0.5908
 epoch: 87, train_loss: 0.2209, test_loss: 2.3052, test_f1: 0.6235
 epoch: 88, train_loss: 0.1954, test_loss: 2.2117, test_f1: 0.6102
 epoch: 89, train_loss: 0.2483, test_loss: 2.1275, test_f1: 0.6171
 epoch: 90, train_loss: 0.2142, test_loss: 2.2851, test_f1: 0.5728
 epoch: 91, train_loss: 0.2493, test_loss: 2.0711, test_f1: 0.5939
 epoch: 92, train_loss: 0.2116, test_loss: 2.3254, test_f1: 0.5964
 epoch: 93, train_loss: 0.2232, test_loss: 2.1165, test_f1: 0.6173
 epoch: 94, train_loss: 0.2153, test_loss: 2.6249, test_f1: 0.5873
 epoch: 95, train_loss: 0.2328, test_loss: 2.5004, test_f1: 0.6187
 epoch: 96, train_loss: 0.2128, test_loss: 2.1990, test_f1: 0.5996
 epoch: 97, train_loss: 0.2263, test_loss: 2.1627, test_f1: 0.5919
 epoch: 98, train_loss: 0.1895, test_loss: 2.5705, test_f1: 0.6005
 epoch: 99, train_loss: 0.1845, test_loss: 2.4953, test_f1: 0.6187
##################ITERATION #7 ****************************************
 epoch: 0, train_loss: 1.2923, test_loss: 1.1758, test_f1: 0.3138
 epoch: 1, train_loss: 0.9682, test_loss: 1.1356, test_f1: 0.4636
 epoch: 2, train_loss: 0.8822, test_loss: 1.1597, test_f1: 0.4503
 epoch: 3, train_loss: 0.8526, test_loss: 1.2853, test_f1: 0.4754
 epoch: 4, train_loss: 0.8033, test_loss: 1.1155, test_f1: 0.5148
 epoch: 5, train_loss: 0.7859, test_loss: 0.9786, test_f1: 0.6138
 epoch: 6, train_loss: 0.7796, test_loss: 1.0808, test_f1: 0.5116
 epoch: 7, train_loss: 0.7298, test_loss: 1.0829, test_f1: 0.5525
 epoch: 8, train_loss: 0.7296, test_loss: 1.1453, test_f1: 0.4566
 epoch: 9, train_loss: 0.7361, test_loss: 1.1075, test_f1: 0.5042
 epoch: 10, train_loss: 0.7235, test_loss: 1.0356, test_f1: 0.6308
 epoch: 11, train_loss: 0.6928, test_loss: 2.9094, test_f1: 0.4414
 epoch: 12, train_loss: 0.7314, test_loss: 1.0812, test_f1: 0.5285
 epoch: 13, train_loss: 0.6866, test_loss: 1.1170, test_f1: 0.5112
 epoch: 14, train_loss: 0.7339, test_loss: 1.2734, test_f1: 0.5340
 epoch: 15, train_loss: 0.6823, test_loss: 0.9571, test_f1: 0.5959
 epoch: 16, train_loss: 0.6641, test_loss: 1.0935, test_f1: 0.5952
 epoch: 17, train_loss: 0.6605, test_loss: 1.0257, test_f1: 0.5855
 epoch: 18, train_loss: 0.7010, test_loss: 0.8797, test_f1: 0.6394
 epoch: 19, train_loss: 0.6432, test_loss: 1.2625, test_f1: 0.5045
 epoch: 20, train_loss: 0.6465, test_loss: 1.0015, test_f1: 0.5871
 epoch: 21, train_loss: 0.6106, test_loss: 1.2376, test_f1: 0.5752
 epoch: 22, train_loss: 0.5957, test_loss: 1.1026, test_f1: 0.5637
 epoch: 23, train_loss: 0.6014, test_loss: 1.2222, test_f1: 0.5943
 epoch: 24, train_loss: 0.6348, test_loss: 1.1941, test_f1: 0.5582
 epoch: 25, train_loss: 0.6029, test_loss: 1.1711, test_f1: 0.5871
 epoch: 26, train_loss: 0.5539, test_loss: 1.2671, test_f1: 0.5717
 epoch: 27, train_loss: 0.5899, test_loss: 1.0184, test_f1: 0.6604
 epoch: 28, train_loss: 0.5413, test_loss: 2.0906, test_f1: 0.4522
 epoch: 29, train_loss: 0.5540, test_loss: 1.0808, test_f1: 0.5980
 epoch: 30, train_loss: 0.5594, test_loss: 1.9412, test_f1: 0.4657
 epoch: 31, train_loss: 0.5765, test_loss: 1.2199, test_f1: 0.5943
 epoch: 32, train_loss: 0.5399, test_loss: 1.0825, test_f1: 0.6221
 epoch: 33, train_loss: 0.5116, test_loss: 1.3548, test_f1: 0.5491
 epoch: 34, train_loss: 0.5120, test_loss: 1.1318, test_f1: 0.6001
 epoch: 35, train_loss: 0.5039, test_loss: 1.1222, test_f1: 0.6192
 epoch: 36, train_loss: 0.4847, test_loss: 1.4038, test_f1: 0.5940
 epoch: 37, train_loss: 0.5857, test_loss: 1.1007, test_f1: 0.5712
 epoch: 38, train_loss: 0.5234, test_loss: 1.4077, test_f1: 0.5796
 epoch: 39, train_loss: 0.4925, test_loss: 1.2319, test_f1: 0.5384
 epoch: 40, train_loss: 0.4826, test_loss: 1.0809, test_f1: 0.6327
 epoch: 41, train_loss: 0.4955, test_loss: 1.0868, test_f1: 0.5997
 epoch: 42, train_loss: 0.4842, test_loss: 1.1268, test_f1: 0.6204
 epoch: 43, train_loss: 0.4664, test_loss: 1.5793, test_f1: 0.5588
 epoch: 44, train_loss: 0.4784, test_loss: 1.2369, test_f1: 0.6122
 epoch: 45, train_loss: 0.5124, test_loss: 1.0794, test_f1: 0.6577
 epoch: 46, train_loss: 0.4770, test_loss: 1.2840, test_f1: 0.6041
 epoch: 47, train_loss: 0.4267, test_loss: 1.2986, test_f1: 0.6442
 epoch: 48, train_loss: 0.4529, test_loss: 1.6031, test_f1: 0.5808
 epoch: 49, train_loss: 0.4093, test_loss: 1.5014, test_f1: 0.5962
 epoch: 50, train_loss: 0.4603, test_loss: 1.1682, test_f1: 0.6258
 epoch: 51, train_loss: 0.3791, test_loss: 1.4669, test_f1: 0.5937
 epoch: 52, train_loss: 0.3356, test_loss: 1.5627, test_f1: 0.6345
 epoch: 53, train_loss: 0.3098, test_loss: 1.4489, test_f1: 0.5942
 epoch: 54, train_loss: 0.3130, test_loss: 1.3904, test_f1: 0.6421
 epoch: 55, train_loss: 0.3014, test_loss: 1.6946, test_f1: 0.6253
 epoch: 56, train_loss: 0.3396, test_loss: 1.5632, test_f1: 0.6081
 epoch: 57, train_loss: 0.3150, test_loss: 1.4533, test_f1: 0.6229
 epoch: 58, train_loss: 0.3173, test_loss: 1.4989, test_f1: 0.6243
 epoch: 59, train_loss: 0.3123, test_loss: 1.8969, test_f1: 0.5468
 epoch: 60, train_loss: 0.3007, test_loss: 1.7696, test_f1: 0.6253
 epoch: 61, train_loss: 0.2758, test_loss: 1.8777, test_f1: 0.6359
 epoch: 62, train_loss: 0.2725, test_loss: 2.0464, test_f1: 0.6302
 epoch: 63, train_loss: 0.3115, test_loss: 1.5729, test_f1: 0.6111
 epoch: 64, train_loss: 0.2610, test_loss: 2.0204, test_f1: 0.6149
 epoch: 65, train_loss: 0.2448, test_loss: 1.8738, test_f1: 0.6465
 epoch: 66, train_loss: 0.2454, test_loss: 1.6428, test_f1: 0.6316
 epoch: 67, train_loss: 0.2692, test_loss: 2.0366, test_f1: 0.6173
 epoch: 68, train_loss: 0.2399, test_loss: 1.7863, test_f1: 0.6435
 epoch: 69, train_loss: 0.2505, test_loss: 1.8146, test_f1: 0.6309
 epoch: 70, train_loss: 0.2401, test_loss: 1.4719, test_f1: 0.6491
 epoch: 71, train_loss: 0.2120, test_loss: 2.0760, test_f1: 0.6269
 epoch: 72, train_loss: 0.2480, test_loss: 1.9780, test_f1: 0.6157
 epoch: 73, train_loss: 0.2145, test_loss: 1.9025, test_f1: 0.6241
 epoch: 74, train_loss: 0.2368, test_loss: 2.2667, test_f1: 0.5963
 epoch: 75, train_loss: 0.2057, test_loss: 2.1098, test_f1: 0.6449
 epoch: 76, train_loss: 0.2382, test_loss: 1.9124, test_f1: 0.6088
 epoch: 77, train_loss: 0.2220, test_loss: 1.8246, test_f1: 0.5821
 epoch: 78, train_loss: 0.2261, test_loss: 1.9672, test_f1: 0.6159
 epoch: 79, train_loss: 0.2470, test_loss: 1.8647, test_f1: 0.6111
 epoch: 80, train_loss: 0.2110, test_loss: 2.2779, test_f1: 0.6172
 epoch: 81, train_loss: 0.1931, test_loss: 2.0580, test_f1: 0.6638
 epoch: 82, train_loss: 0.1891, test_loss: 2.3702, test_f1: 0.5994
 epoch: 83, train_loss: 0.1785, test_loss: 2.1363, test_f1: 0.5915
 epoch: 84, train_loss: 0.2057, test_loss: 1.9031, test_f1: 0.6202
 epoch: 85, train_loss: 0.2541, test_loss: 1.9615, test_f1: 0.6354
 epoch: 86, train_loss: 0.2228, test_loss: 1.7984, test_f1: 0.6487
 epoch: 87, train_loss: 0.2183, test_loss: 2.0033, test_f1: 0.6457
 epoch: 88, train_loss: 0.1851, test_loss: 2.1897, test_f1: 0.6282
 epoch: 89, train_loss: 0.2088, test_loss: 1.9880, test_f1: 0.6198
 epoch: 90, train_loss: 0.1848, test_loss: 2.0720, test_f1: 0.6396
 epoch: 91, train_loss: 0.1962, test_loss: 2.0203, test_f1: 0.6416
 epoch: 92, train_loss: 0.2466, test_loss: 2.1112, test_f1: 0.5937
 epoch: 93, train_loss: 0.1738, test_loss: 1.9052, test_f1: 0.6443
 epoch: 94, train_loss: 0.1931, test_loss: 2.2184, test_f1: 0.6276
 epoch: 95, train_loss: 0.1542, test_loss: 2.5012, test_f1: 0.6239
 epoch: 96, train_loss: 0.1815, test_loss: 2.1840, test_f1: 0.6137
 epoch: 97, train_loss: 0.1922, test_loss: 2.3000, test_f1: 0.6178
 epoch: 98, train_loss: 0.1420, test_loss: 2.3329, test_f1: 0.6273
 epoch: 99, train_loss: 0.1766, test_loss: 2.0836, test_f1: 0.6115
##################ITERATION #8 ****************************************
 epoch: 0, train_loss: 1.3559, test_loss: 1.3582, test_f1: 0.3282
 epoch: 1, train_loss: 1.0702, test_loss: 1.0934, test_f1: 0.4513
 epoch: 2, train_loss: 1.0107, test_loss: 1.1614, test_f1: 0.3732
 epoch: 3, train_loss: 0.9615, test_loss: 1.2069, test_f1: 0.4282
 epoch: 4, train_loss: 0.9107, test_loss: 1.2614, test_f1: 0.4622
 epoch: 5, train_loss: 0.8814, test_loss: 1.1471, test_f1: 0.4603
 epoch: 6, train_loss: 0.8779, test_loss: 1.0078, test_f1: 0.5431
 epoch: 7, train_loss: 0.8461, test_loss: 1.0693, test_f1: 0.4946
 epoch: 8, train_loss: 0.8216, test_loss: 0.9359, test_f1: 0.5982
 epoch: 9, train_loss: 0.7915, test_loss: 0.9638, test_f1: 0.5562
 epoch: 10, train_loss: 0.7769, test_loss: 0.9380, test_f1: 0.5801
 epoch: 11, train_loss: 0.7536, test_loss: 0.9830, test_f1: 0.5771
 epoch: 12, train_loss: 0.7501, test_loss: 1.0680, test_f1: 0.5279
 epoch: 13, train_loss: 0.7484, test_loss: 1.5291, test_f1: 0.3639
 epoch: 14, train_loss: 0.7208, test_loss: 0.8893, test_f1: 0.6686
 epoch: 15, train_loss: 0.7540, test_loss: 1.0103, test_f1: 0.5486
 epoch: 16, train_loss: 0.6941, test_loss: 1.5627, test_f1: 0.4986
 epoch: 17, train_loss: 0.7069, test_loss: 1.1328, test_f1: 0.5382
 epoch: 18, train_loss: 0.6722, test_loss: 1.0468, test_f1: 0.6112
 epoch: 19, train_loss: 0.6544, test_loss: 1.0269, test_f1: 0.5970
 epoch: 20, train_loss: 0.6867, test_loss: 0.8830, test_f1: 0.6022
 epoch: 21, train_loss: 0.6773, test_loss: 0.9009, test_f1: 0.5848
 epoch: 22, train_loss: 0.6601, test_loss: 1.3427, test_f1: 0.5514
 epoch: 23, train_loss: 0.6525, test_loss: 1.0390, test_f1: 0.6151
 epoch: 24, train_loss: 0.6437, test_loss: 0.9199, test_f1: 0.6470
 epoch: 25, train_loss: 0.6372, test_loss: 1.0287, test_f1: 0.5944
 epoch: 26, train_loss: 0.6491, test_loss: 0.9372, test_f1: 0.6409
 epoch: 27, train_loss: 0.6113, test_loss: 1.0175, test_f1: 0.6196
 epoch: 28, train_loss: 0.6128, test_loss: 0.9131, test_f1: 0.6760
 epoch: 29, train_loss: 0.6052, test_loss: 0.8474, test_f1: 0.6659
 epoch: 30, train_loss: 0.5776, test_loss: 1.0750, test_f1: 0.6157
 epoch: 31, train_loss: 0.5829, test_loss: 1.0393, test_f1: 0.5618
 epoch: 32, train_loss: 0.5725, test_loss: 1.1816, test_f1: 0.5663
 epoch: 33, train_loss: 0.6074, test_loss: 0.9612, test_f1: 0.6442
 epoch: 34, train_loss: 0.5803, test_loss: 1.1839, test_f1: 0.6155
 epoch: 35, train_loss: 0.5719, test_loss: 0.9346, test_f1: 0.6655
 epoch: 36, train_loss: 0.5761, test_loss: 0.9426, test_f1: 0.6060
 epoch: 37, train_loss: 0.5602, test_loss: 1.0002, test_f1: 0.5955
 epoch: 38, train_loss: 0.5707, test_loss: 1.1031, test_f1: 0.6286
 epoch: 39, train_loss: 0.5959, test_loss: 0.9781, test_f1: 0.6470
 epoch: 40, train_loss: 0.5964, test_loss: 1.2100, test_f1: 0.6210
 epoch: 41, train_loss: 0.5605, test_loss: 0.8872, test_f1: 0.6624
 epoch: 42, train_loss: 0.5530, test_loss: 1.0068, test_f1: 0.6457
 epoch: 43, train_loss: 0.5891, test_loss: 0.9835, test_f1: 0.6252
 epoch: 44, train_loss: 0.5423, test_loss: 0.8813, test_f1: 0.6689
 epoch: 45, train_loss: 0.5238, test_loss: 1.0270, test_f1: 0.6361
 epoch: 46, train_loss: 0.5364, test_loss: 1.0598, test_f1: 0.6410
 epoch: 47, train_loss: 0.5262, test_loss: 1.1658, test_f1: 0.6409
 epoch: 48, train_loss: 0.5725, test_loss: 0.9577, test_f1: 0.6195
 epoch: 49, train_loss: 0.5371, test_loss: 0.9408, test_f1: 0.6505
 epoch: 50, train_loss: 0.5005, test_loss: 1.0731, test_f1: 0.6124
 epoch: 51, train_loss: 0.4744, test_loss: 1.0480, test_f1: 0.6689
 epoch: 52, train_loss: 0.4300, test_loss: 1.0891, test_f1: 0.6109
 epoch: 53, train_loss: 0.4313, test_loss: 1.1590, test_f1: 0.6622
 epoch: 54, train_loss: 0.4345, test_loss: 1.0801, test_f1: 0.6456
 epoch: 55, train_loss: 0.4314, test_loss: 1.0327, test_f1: 0.6417
 epoch: 56, train_loss: 0.3981, test_loss: 1.1950, test_f1: 0.6634
 epoch: 57, train_loss: 0.3764, test_loss: 1.1849, test_f1: 0.6382
 epoch: 58, train_loss: 0.3681, test_loss: 1.1539, test_f1: 0.6517
 epoch: 59, train_loss: 0.3702, test_loss: 1.2285, test_f1: 0.6599
 epoch: 60, train_loss: 0.3771, test_loss: 1.5525, test_f1: 0.5787
 epoch: 61, train_loss: 0.3997, test_loss: 1.2066, test_f1: 0.6418
 epoch: 62, train_loss: 0.3964, test_loss: 1.3872, test_f1: 0.5956
 epoch: 63, train_loss: 0.3394, test_loss: 1.4130, test_f1: 0.6269
 epoch: 64, train_loss: 0.3736, test_loss: 1.1176, test_f1: 0.6380
 epoch: 65, train_loss: 0.3663, test_loss: 1.3857, test_f1: 0.6646
 epoch: 66, train_loss: 0.3228, test_loss: 1.2520, test_f1: 0.6465
 epoch: 67, train_loss: 0.3534, test_loss: 1.2103, test_f1: 0.6398
 epoch: 68, train_loss: 0.3482, test_loss: 1.3039, test_f1: 0.6454
 epoch: 69, train_loss: 0.3275, test_loss: 1.0566, test_f1: 0.6439
 epoch: 70, train_loss: 0.3112, test_loss: 1.3362, test_f1: 0.6021
 epoch: 71, train_loss: 0.3173, test_loss: 1.3651, test_f1: 0.6184
 epoch: 72, train_loss: 0.3425, test_loss: 1.3088, test_f1: 0.6292
 epoch: 73, train_loss: 0.3329, test_loss: 1.2491, test_f1: 0.6109
 epoch: 74, train_loss: 0.2844, test_loss: 1.2507, test_f1: 0.6612
 epoch: 75, train_loss: 0.3043, test_loss: 1.3634, test_f1: 0.6265
 epoch: 76, train_loss: 0.3034, test_loss: 1.4278, test_f1: 0.6145
 epoch: 77, train_loss: 0.2737, test_loss: 1.5626, test_f1: 0.6157
 epoch: 78, train_loss: 0.2898, test_loss: 1.5456, test_f1: 0.6376
 epoch: 79, train_loss: 0.2838, test_loss: 1.5146, test_f1: 0.5963
 epoch: 80, train_loss: 0.3001, test_loss: 1.5435, test_f1: 0.6029
 epoch: 81, train_loss: 0.2350, test_loss: 1.8082, test_f1: 0.6175
 epoch: 82, train_loss: 0.2425, test_loss: 1.6548, test_f1: 0.6298
 epoch: 83, train_loss: 0.2650, test_loss: 1.6968, test_f1: 0.6166
 epoch: 84, train_loss: 0.2841, test_loss: 1.5778, test_f1: 0.6324
 epoch: 85, train_loss: 0.2606, test_loss: 1.6289, test_f1: 0.5987
 epoch: 86, train_loss: 0.2572, test_loss: 1.5146, test_f1: 0.6306
 epoch: 87, train_loss: 0.2670, test_loss: 1.4074, test_f1: 0.6559
 epoch: 88, train_loss: 0.2772, test_loss: 1.3533, test_f1: 0.6489
 epoch: 89, train_loss: 0.2926, test_loss: 1.3531, test_f1: 0.6329
 epoch: 90, train_loss: 0.2919, test_loss: 1.3722, test_f1: 0.6007
 epoch: 91, train_loss: 0.2703, test_loss: 1.5077, test_f1: 0.6192
 epoch: 92, train_loss: 0.2337, test_loss: 1.4094, test_f1: 0.6285
 epoch: 93, train_loss: 0.2272, test_loss: 1.5879, test_f1: 0.6081
 epoch: 94, train_loss: 0.2333, test_loss: 1.6510, test_f1: 0.5918
 epoch: 95, train_loss: 0.2022, test_loss: 1.7639, test_f1: 0.6410
 epoch: 96, train_loss: 0.2017, test_loss: 1.7942, test_f1: 0.6494
 epoch: 97, train_loss: 0.2014, test_loss: 1.6843, test_f1: 0.6568
 epoch: 98, train_loss: 0.2167, test_loss: 1.5272, test_f1: 0.6299
 epoch: 99, train_loss: 0.2263, test_loss: 1.5455, test_f1: 0.6643
##################ITERATION #9 ****************************************
 epoch: 0, train_loss: 1.1855, test_loss: 1.1214, test_f1: 0.4228
 epoch: 1, train_loss: 0.9606, test_loss: 1.1018, test_f1: 0.5307
 epoch: 2, train_loss: 0.8778, test_loss: 1.0118, test_f1: 0.5621
 epoch: 3, train_loss: 0.8369, test_loss: 1.3387, test_f1: 0.4675
 epoch: 4, train_loss: 0.8509, test_loss: 1.2072, test_f1: 0.4778
 epoch: 5, train_loss: 0.8438, test_loss: 0.9649, test_f1: 0.5958
 epoch: 6, train_loss: 0.8234, test_loss: 1.0436, test_f1: 0.5809
 epoch: 7, train_loss: 0.7855, test_loss: 0.9057, test_f1: 0.6026
 epoch: 8, train_loss: 0.7891, test_loss: 0.9528, test_f1: 0.5738
 epoch: 9, train_loss: 0.7642, test_loss: 1.2148, test_f1: 0.5236
 epoch: 10, train_loss: 0.7549, test_loss: 1.2399, test_f1: 0.5500
 epoch: 11, train_loss: 0.7356, test_loss: 1.0187, test_f1: 0.5915
 epoch: 12, train_loss: 0.7239, test_loss: 1.1200, test_f1: 0.6174
 epoch: 13, train_loss: 0.7370, test_loss: 1.1998, test_f1: 0.5645
 epoch: 14, train_loss: 0.7488, test_loss: 1.1067, test_f1: 0.5678
 epoch: 15, train_loss: 0.7560, test_loss: 0.9326, test_f1: 0.5903
 epoch: 16, train_loss: 0.7244, test_loss: 0.9724, test_f1: 0.6559
 epoch: 17, train_loss: 0.7119, test_loss: 1.3029, test_f1: 0.5122
 epoch: 18, train_loss: 0.6731, test_loss: 0.9965, test_f1: 0.5428
 epoch: 19, train_loss: 0.6830, test_loss: 1.1096, test_f1: 0.5936
 epoch: 20, train_loss: 0.6502, test_loss: 0.9532, test_f1: 0.6149
 epoch: 21, train_loss: 0.6643, test_loss: 1.1921, test_f1: 0.4693
 epoch: 22, train_loss: 0.6486, test_loss: 0.9999, test_f1: 0.6008
 epoch: 23, train_loss: 0.6761, test_loss: 1.1382, test_f1: 0.5987
 epoch: 24, train_loss: 0.6692, test_loss: 1.1529, test_f1: 0.4861
 epoch: 25, train_loss: 0.6699, test_loss: 0.9509, test_f1: 0.5901
 epoch: 26, train_loss: 0.6481, test_loss: 1.0636, test_f1: 0.6323
 epoch: 27, train_loss: 0.6452, test_loss: 0.9938, test_f1: 0.6367
 epoch: 28, train_loss: 0.6451, test_loss: 1.4879, test_f1: 0.6141
 epoch: 29, train_loss: 0.6208, test_loss: 1.2431, test_f1: 0.4955
 epoch: 30, train_loss: 0.6391, test_loss: 1.7699, test_f1: 0.4886
 epoch: 31, train_loss: 0.6129, test_loss: 0.9408, test_f1: 0.6697
 epoch: 32, train_loss: 0.5673, test_loss: 1.0133, test_f1: 0.6195
 epoch: 33, train_loss: 0.5619, test_loss: 1.0486, test_f1: 0.6200
 epoch: 34, train_loss: 0.5642, test_loss: 1.2345, test_f1: 0.4724
 epoch: 35, train_loss: 0.5777, test_loss: 1.1254, test_f1: 0.5517
 epoch: 36, train_loss: 0.5789, test_loss: 1.2509, test_f1: 0.6001
 epoch: 37, train_loss: 0.5567, test_loss: 1.0307, test_f1: 0.6122
 epoch: 38, train_loss: 0.5366, test_loss: 1.2326, test_f1: 0.6073
 epoch: 39, train_loss: 0.5338, test_loss: 1.1211, test_f1: 0.6104
 epoch: 40, train_loss: 0.5423, test_loss: 1.1839, test_f1: 0.6358
 epoch: 41, train_loss: 0.5510, test_loss: 1.9509, test_f1: 0.5186
 epoch: 42, train_loss: 0.5385, test_loss: 1.2762, test_f1: 0.5932
 epoch: 43, train_loss: 0.5620, test_loss: 1.1800, test_f1: 0.5851
 epoch: 44, train_loss: 0.5313, test_loss: 1.3085, test_f1: 0.5384
 epoch: 45, train_loss: 0.4987, test_loss: 1.2246, test_f1: 0.5832
 epoch: 46, train_loss: 0.4856, test_loss: 1.1513, test_f1: 0.6538
 epoch: 47, train_loss: 0.5360, test_loss: 1.2261, test_f1: 0.5839
 epoch: 48, train_loss: 0.4879, test_loss: 1.2184, test_f1: 0.6120
 epoch: 49, train_loss: 0.4923, test_loss: 1.2695, test_f1: 0.6084
 epoch: 50, train_loss: 0.4732, test_loss: 1.3193, test_f1: 0.6029
 epoch: 51, train_loss: 0.4252, test_loss: 1.3500, test_f1: 0.6252
 epoch: 52, train_loss: 0.4284, test_loss: 1.1286, test_f1: 0.6003
 epoch: 53, train_loss: 0.4087, test_loss: 1.3675, test_f1: 0.6217
 epoch: 54, train_loss: 0.4034, test_loss: 1.3275, test_f1: 0.6236
 epoch: 55, train_loss: 0.4101, test_loss: 1.2073, test_f1: 0.6585
 epoch: 56, train_loss: 0.3650, test_loss: 1.2980, test_f1: 0.6500
 epoch: 57, train_loss: 0.3460, test_loss: 1.4870, test_f1: 0.6298
 epoch: 58, train_loss: 0.3280, test_loss: 1.7424, test_f1: 0.6257
 epoch: 59, train_loss: 0.3299, test_loss: 1.4684, test_f1: 0.6390
 epoch: 60, train_loss: 0.3172, test_loss: 1.6119, test_f1: 0.6663
 epoch: 61, train_loss: 0.3569, test_loss: 1.6750, test_f1: 0.6261
 epoch: 62, train_loss: 0.3522, test_loss: 1.2568, test_f1: 0.6212
 epoch: 63, train_loss: 0.3176, test_loss: 1.7358, test_f1: 0.6234
 epoch: 64, train_loss: 0.3427, test_loss: 1.5598, test_f1: 0.6160
 epoch: 65, train_loss: 0.3309, test_loss: 1.7959, test_f1: 0.6172
 epoch: 66, train_loss: 0.3398, test_loss: 1.8485, test_f1: 0.5958
 epoch: 67, train_loss: 0.2955, test_loss: 1.5652, test_f1: 0.6449
 epoch: 68, train_loss: 0.3252, test_loss: 1.6713, test_f1: 0.6298
 epoch: 69, train_loss: 0.3041, test_loss: 1.8097, test_f1: 0.6407
 epoch: 70, train_loss: 0.2911, test_loss: 1.7152, test_f1: 0.6243
 epoch: 71, train_loss: 0.3009, test_loss: 1.9205, test_f1: 0.5479
 epoch: 72, train_loss: 0.2819, test_loss: 1.5262, test_f1: 0.6668
 epoch: 73, train_loss: 0.2729, test_loss: 1.7223, test_f1: 0.6217
 epoch: 74, train_loss: 0.2930, test_loss: 1.5884, test_f1: 0.6314
 epoch: 75, train_loss: 0.2906, test_loss: 1.7125, test_f1: 0.6128
 epoch: 76, train_loss: 0.2849, test_loss: 1.9515, test_f1: 0.6177
 epoch: 77, train_loss: 0.2802, test_loss: 1.6149, test_f1: 0.6240
 epoch: 78, train_loss: 0.2648, test_loss: 1.9153, test_f1: 0.6252
 epoch: 79, train_loss: 0.3142, test_loss: 1.5115, test_f1: 0.6179
 epoch: 80, train_loss: 0.2482, test_loss: 2.2888, test_f1: 0.6173
 epoch: 81, train_loss: 0.2455, test_loss: 1.7877, test_f1: 0.6227
 epoch: 82, train_loss: 0.2592, test_loss: 1.7965, test_f1: 0.6774
 epoch: 83, train_loss: 0.2320, test_loss: 2.0332, test_f1: 0.6389
 epoch: 84, train_loss: 0.2536, test_loss: 1.4870, test_f1: 0.6868
 epoch: 85, train_loss: 0.2165, test_loss: 2.2161, test_f1: 0.5991
 epoch: 86, train_loss: 0.2532, test_loss: 1.8811, test_f1: 0.6196
 epoch: 87, train_loss: 0.2376, test_loss: 2.0310, test_f1: 0.6393
 epoch: 88, train_loss: 0.2128, test_loss: 2.4359, test_f1: 0.6329
 epoch: 89, train_loss: 0.1980, test_loss: 2.0223, test_f1: 0.6216
 epoch: 90, train_loss: 0.2466, test_loss: 2.1880, test_f1: 0.6253
 epoch: 91, train_loss: 0.2881, test_loss: 2.1098, test_f1: 0.6181
 epoch: 92, train_loss: 0.2325, test_loss: 1.8884, test_f1: 0.6286
 epoch: 93, train_loss: 0.2030, test_loss: 2.0510, test_f1: 0.6495
 epoch: 94, train_loss: 0.1931, test_loss: 1.8183, test_f1: 0.6501
 epoch: 95, train_loss: 0.2104, test_loss: 2.2688, test_f1: 0.6248
 epoch: 96, train_loss: 0.2230, test_loss: 2.0313, test_f1: 0.6158
 epoch: 97, train_loss: 0.2168, test_loss: 1.8780, test_f1: 0.6558
 epoch: 98, train_loss: 0.1988, test_loss: 2.0863, test_f1: 0.6448
 epoch: 99, train_loss: 0.1835, test_loss: 1.9513, test_f1: 0.6274

Training completed in 389.75 seconds
Best F1: 0.6868 at epoch 84
Mean F1 across iterations: 0.6750  0.0083
========================FINAL RESULTS================================
FEGIN weighted F1: 0.6868  0.0083
python main.py --data ltspice_demos --representation component_pin --model FEGIN --layers 2 --hiddens 128 --batch_size 64 --lr 0.01 --emb_size 512 --epochs 100 --save_appendix component_pin_L2_H128_BS64_LR0.01_E512 --no_val
-----



STDERR:
  File "main.py", line 370, in <module>
    main()
  File "main.py", line 254, in main
    dataset = dataset_class(
  File "/home/philip/projects/ltspice_examples_code_repo/Circuit-Completion-Using-GNNs/component_classification_with_link_prediction_head/evaluation/FEGIN/kernel/circuit_datasets.py", line 15, in __init__
    self.data, self.slices = torch.load(self.processed_paths[0])
  File "/home/philip/.local/lib/python3.8/site-packages/torch/serialization.py", line 1040, in load
    warnings.warn(
  File "/usr/lib/python3.8/warnings.py", line 109, in _showwarnmsg
    sw(msg.message, msg.category, msg.filename, msg.lineno,
  File "main.py", line 47, in warn_with_traceback
    traceback.print_stack(file=log)
/home/philip/projects/ltspice_examples_code_repo/Circuit-Completion-Using-GNNs/component_classification_with_link_prediction_head/evaluation/FEGIN/kernel/circuit_datasets.py:15: FutureWarning: You are using `torch.load` with `weights_only=False` (the current default value), which uses the default pickle module implicitly. It is possible to construct malicious pickle data which will execute arbitrary code during unpickling (See https://github.com/pytorch/pytorch/blob/main/SECURITY.md#untrusted-models for more details). In a future release, the default value for `weights_only` will be flipped to `True`. This limits the functions that could be executed during unpickling. Arbitrary objects will no longer be allowed to be loaded via this mode unless they are explicitly allowlisted by the user via `torch.serialization.add_safe_globals`. We recommend you start setting `weights_only=True` for any use case where you don't have full control of the loaded file. Please open an issue on GitHub for any issues related to this experimental feature.
  self.data, self.slices = torch.load(self.processed_paths[0])
