STDOUT:
Results will be saved in /home/philip/projects/ltspice_examples_code_repo/Circuit-Completion-Using-GNNs/component_classification_with_link_prediction_head/evaluation/FEGIN/results/model_FEGIN_dataset_ltspice_demos
Command line input: python main.py --data ltspice_demos --representation component_component --model FEGIN --layers 2 --hiddens 128 --batch_size 256 --lr 0.0001 --emb_size 128 --epochs 100 --save_appendix component_component_L2_H128_BS256_LR0.0001_E128 --no_val
 is saved.
-----
ltspice_demos - FEGIN
Using 2 layers, 128 hidden units, h = 2
Loading component_component representation dataset
ENTERED
Training FEGIN on component_component representation
Train: 1565, Test: 383
##################ITERATION #0 ****************************************
 epoch: 0, train_loss: 1.3788, test_loss: 1.3778, test_f1: 0.2281
 epoch: 1, train_loss: 1.3667, test_loss: 1.3746, test_f1: 0.2281
 epoch: 2, train_loss: 1.3594, test_loss: 1.3705, test_f1: 0.2281
 epoch: 3, train_loss: 1.3531, test_loss: 1.3655, test_f1: 0.2281
 epoch: 4, train_loss: 1.3455, test_loss: 1.3593, test_f1: 0.2281
 epoch: 5, train_loss: 1.3383, test_loss: 1.3522, test_f1: 0.2281
 epoch: 6, train_loss: 1.3299, test_loss: 1.3442, test_f1: 0.2281
 epoch: 7, train_loss: 1.3206, test_loss: 1.3352, test_f1: 0.2281
 epoch: 8, train_loss: 1.3115, test_loss: 1.3266, test_f1: 0.2281
 epoch: 9, train_loss: 1.3014, test_loss: 1.3176, test_f1: 0.2281
 epoch: 10, train_loss: 1.2893, test_loss: 1.3090, test_f1: 0.2281
 epoch: 11, train_loss: 1.2786, test_loss: 1.3017, test_f1: 0.2281
 epoch: 12, train_loss: 1.2645, test_loss: 1.2945, test_f1: 0.2281
 epoch: 13, train_loss: 1.2546, test_loss: 1.2878, test_f1: 0.2281
 epoch: 14, train_loss: 1.2411, test_loss: 1.2820, test_f1: 0.2281
 epoch: 15, train_loss: 1.2295, test_loss: 1.2760, test_f1: 0.2281
 epoch: 16, train_loss: 1.2205, test_loss: 1.2706, test_f1: 0.2281
 epoch: 17, train_loss: 1.2111, test_loss: 1.2656, test_f1: 0.2281
 epoch: 18, train_loss: 1.2037, test_loss: 1.2630, test_f1: 0.2281
 epoch: 19, train_loss: 1.1953, test_loss: 1.2578, test_f1: 0.2654
 epoch: 20, train_loss: 1.1842, test_loss: 1.2536, test_f1: 0.2587
 epoch: 21, train_loss: 1.1778, test_loss: 1.2507, test_f1: 0.2587
 epoch: 22, train_loss: 1.1691, test_loss: 1.2478, test_f1: 0.2587
 epoch: 23, train_loss: 1.1606, test_loss: 1.2410, test_f1: 0.2587
 epoch: 24, train_loss: 1.1572, test_loss: 1.2381, test_f1: 0.2587
 epoch: 25, train_loss: 1.1524, test_loss: 1.2378, test_f1: 0.2587
 epoch: 26, train_loss: 1.1465, test_loss: 1.2309, test_f1: 0.2587
 epoch: 27, train_loss: 1.1397, test_loss: 1.2292, test_f1: 0.2587
 epoch: 28, train_loss: 1.1315, test_loss: 1.2220, test_f1: 0.2801
 epoch: 29, train_loss: 1.1254, test_loss: 1.2192, test_f1: 0.2948
 epoch: 30, train_loss: 1.1211, test_loss: 1.2132, test_f1: 0.3124
 epoch: 31, train_loss: 1.1186, test_loss: 1.2080, test_f1: 0.3148
 epoch: 32, train_loss: 1.1114, test_loss: 1.2071, test_f1: 0.3380
 epoch: 33, train_loss: 1.1064, test_loss: 1.2063, test_f1: 0.3631
 epoch: 34, train_loss: 1.0953, test_loss: 1.2003, test_f1: 0.3630
 epoch: 35, train_loss: 1.0902, test_loss: 1.1958, test_f1: 0.3623
 epoch: 36, train_loss: 1.0879, test_loss: 1.1885, test_f1: 0.3559
 epoch: 37, train_loss: 1.0768, test_loss: 1.1858, test_f1: 0.3622
 epoch: 38, train_loss: 1.0717, test_loss: 1.1807, test_f1: 0.3560
 epoch: 39, train_loss: 1.0641, test_loss: 1.1820, test_f1: 0.3732
 epoch: 40, train_loss: 1.0602, test_loss: 1.1811, test_f1: 0.3648
 epoch: 41, train_loss: 1.0520, test_loss: 1.1787, test_f1: 0.4005
 epoch: 42, train_loss: 1.0481, test_loss: 1.1709, test_f1: 0.3755
 epoch: 43, train_loss: 1.0402, test_loss: 1.1670, test_f1: 0.3660
 epoch: 44, train_loss: 1.0329, test_loss: 1.1623, test_f1: 0.3910
 epoch: 45, train_loss: 1.0242, test_loss: 1.1635, test_f1: 0.3946
 epoch: 46, train_loss: 1.0154, test_loss: 1.1607, test_f1: 0.4077
 epoch: 47, train_loss: 1.0055, test_loss: 1.1575, test_f1: 0.4025
 epoch: 48, train_loss: 0.9969, test_loss: 1.1508, test_f1: 0.4120
 epoch: 49, train_loss: 0.9897, test_loss: 1.1461, test_f1: 0.4131
 epoch: 50, train_loss: 0.9800, test_loss: 1.1475, test_f1: 0.4208
 epoch: 51, train_loss: 0.9815, test_loss: 1.1520, test_f1: 0.4210
 epoch: 52, train_loss: 0.9704, test_loss: 1.1552, test_f1: 0.4125
 epoch: 53, train_loss: 0.9635, test_loss: 1.1545, test_f1: 0.4247
 epoch: 54, train_loss: 0.9605, test_loss: 1.1490, test_f1: 0.4175
 epoch: 55, train_loss: 0.9571, test_loss: 1.1507, test_f1: 0.4348
 epoch: 56, train_loss: 0.9489, test_loss: 1.1497, test_f1: 0.4408
 epoch: 57, train_loss: 0.9516, test_loss: 1.1492, test_f1: 0.4337
 epoch: 58, train_loss: 0.9524, test_loss: 1.1484, test_f1: 0.4447
 epoch: 59, train_loss: 0.9426, test_loss: 1.1522, test_f1: 0.4243
 epoch: 60, train_loss: 0.9354, test_loss: 1.1505, test_f1: 0.4290
 epoch: 61, train_loss: 0.9330, test_loss: 1.1548, test_f1: 0.4503
 epoch: 62, train_loss: 0.9316, test_loss: 1.1501, test_f1: 0.4700
 epoch: 63, train_loss: 0.9251, test_loss: 1.1510, test_f1: 0.4730
 epoch: 64, train_loss: 0.9207, test_loss: 1.1600, test_f1: 0.4704
 epoch: 65, train_loss: 0.9188, test_loss: 1.1618, test_f1: 0.4814
 epoch: 66, train_loss: 0.9184, test_loss: 1.1583, test_f1: 0.4760
 epoch: 67, train_loss: 0.9202, test_loss: 1.1604, test_f1: 0.4737
 epoch: 68, train_loss: 0.9094, test_loss: 1.1647, test_f1: 0.4765
 epoch: 69, train_loss: 0.9151, test_loss: 1.1587, test_f1: 0.4825
 epoch: 70, train_loss: 0.9020, test_loss: 1.1581, test_f1: 0.4973
 epoch: 71, train_loss: 0.8992, test_loss: 1.1550, test_f1: 0.5043
 epoch: 72, train_loss: 0.8969, test_loss: 1.1553, test_f1: 0.5007
 epoch: 73, train_loss: 0.8998, test_loss: 1.1644, test_f1: 0.5112
 epoch: 74, train_loss: 0.8955, test_loss: 1.1702, test_f1: 0.4972
 epoch: 75, train_loss: 0.8887, test_loss: 1.1678, test_f1: 0.5063
 epoch: 76, train_loss: 0.8832, test_loss: 1.1734, test_f1: 0.5043
 epoch: 77, train_loss: 0.8804, test_loss: 1.1725, test_f1: 0.5143
 epoch: 78, train_loss: 0.8756, test_loss: 1.1798, test_f1: 0.5081
 epoch: 79, train_loss: 0.8800, test_loss: 1.1744, test_f1: 0.5125
 epoch: 80, train_loss: 0.8738, test_loss: 1.1714, test_f1: 0.5118
 epoch: 81, train_loss: 0.8688, test_loss: 1.1722, test_f1: 0.5008
 epoch: 82, train_loss: 0.8612, test_loss: 1.1656, test_f1: 0.5115
 epoch: 83, train_loss: 0.8638, test_loss: 1.1801, test_f1: 0.5065
 epoch: 84, train_loss: 0.8653, test_loss: 1.1825, test_f1: 0.5085
 epoch: 85, train_loss: 0.8630, test_loss: 1.1911, test_f1: 0.4960
 epoch: 86, train_loss: 0.8576, test_loss: 1.1844, test_f1: 0.4945
 epoch: 87, train_loss: 0.8476, test_loss: 1.1844, test_f1: 0.4975
 epoch: 88, train_loss: 0.8519, test_loss: 1.1756, test_f1: 0.4892
 epoch: 89, train_loss: 0.8442, test_loss: 1.1814, test_f1: 0.4932
 epoch: 90, train_loss: 0.8439, test_loss: 1.1952, test_f1: 0.4944
 epoch: 91, train_loss: 0.8336, test_loss: 1.1986, test_f1: 0.5031
 epoch: 92, train_loss: 0.8334, test_loss: 1.2015, test_f1: 0.5158
 epoch: 93, train_loss: 0.8306, test_loss: 1.2008, test_f1: 0.5034
 epoch: 94, train_loss: 0.8308, test_loss: 1.1997, test_f1: 0.5066
 epoch: 95, train_loss: 0.8289, test_loss: 1.1917, test_f1: 0.5214
 epoch: 96, train_loss: 0.8270, test_loss: 1.1975, test_f1: 0.5190
 epoch: 97, train_loss: 0.8304, test_loss: 1.2059, test_f1: 0.5075
 epoch: 98, train_loss: 0.8235, test_loss: 1.2070, test_f1: 0.5069
 epoch: 99, train_loss: 0.8156, test_loss: 1.2125, test_f1: 0.5083
##################ITERATION #1 ****************************************
 epoch: 0, train_loss: 1.3465, test_loss: 1.3563, test_f1: 0.2281
 epoch: 1, train_loss: 1.3168, test_loss: 1.3514, test_f1: 0.2281
 epoch: 2, train_loss: 1.3034, test_loss: 1.3428, test_f1: 0.2281
 epoch: 3, train_loss: 1.2901, test_loss: 1.3327, test_f1: 0.2281
 epoch: 4, train_loss: 1.2752, test_loss: 1.3239, test_f1: 0.2281
 epoch: 5, train_loss: 1.2640, test_loss: 1.3160, test_f1: 0.2281
 epoch: 6, train_loss: 1.2526, test_loss: 1.3066, test_f1: 0.2281
 epoch: 7, train_loss: 1.2400, test_loss: 1.3009, test_f1: 0.2281
 epoch: 8, train_loss: 1.2271, test_loss: 1.2910, test_f1: 0.2281
 epoch: 9, train_loss: 1.2145, test_loss: 1.2852, test_f1: 0.2281
 epoch: 10, train_loss: 1.2081, test_loss: 1.2785, test_f1: 0.2281
 epoch: 11, train_loss: 1.2021, test_loss: 1.2751, test_f1: 0.2396
 epoch: 12, train_loss: 1.1910, test_loss: 1.2736, test_f1: 0.2536
 epoch: 13, train_loss: 1.1849, test_loss: 1.2715, test_f1: 0.2931
 epoch: 14, train_loss: 1.1762, test_loss: 1.2665, test_f1: 0.3062
 epoch: 15, train_loss: 1.1659, test_loss: 1.2604, test_f1: 0.3062
 epoch: 16, train_loss: 1.1570, test_loss: 1.2570, test_f1: 0.3260
 epoch: 17, train_loss: 1.1479, test_loss: 1.2529, test_f1: 0.3394
 epoch: 18, train_loss: 1.1386, test_loss: 1.2420, test_f1: 0.3466
 epoch: 19, train_loss: 1.1262, test_loss: 1.2361, test_f1: 0.3455
 epoch: 20, train_loss: 1.1193, test_loss: 1.2293, test_f1: 0.3437
 epoch: 21, train_loss: 1.1134, test_loss: 1.2234, test_f1: 0.3315
 epoch: 22, train_loss: 1.1051, test_loss: 1.2192, test_f1: 0.3259
 epoch: 23, train_loss: 1.0988, test_loss: 1.2171, test_f1: 0.3241
 epoch: 24, train_loss: 1.0863, test_loss: 1.2116, test_f1: 0.3236
 epoch: 25, train_loss: 1.0758, test_loss: 1.2071, test_f1: 0.3343
 epoch: 26, train_loss: 1.0691, test_loss: 1.2024, test_f1: 0.3539
 epoch: 27, train_loss: 1.0610, test_loss: 1.2027, test_f1: 0.3532
 epoch: 28, train_loss: 1.0507, test_loss: 1.2016, test_f1: 0.3509
 epoch: 29, train_loss: 1.0398, test_loss: 1.1965, test_f1: 0.3527
 epoch: 30, train_loss: 1.0435, test_loss: 1.1940, test_f1: 0.3780
 epoch: 31, train_loss: 1.0241, test_loss: 1.1912, test_f1: 0.3862
 epoch: 32, train_loss: 1.0129, test_loss: 1.1837, test_f1: 0.4072
 epoch: 33, train_loss: 1.0087, test_loss: 1.1856, test_f1: 0.4109
 epoch: 34, train_loss: 1.0011, test_loss: 1.1892, test_f1: 0.4067
 epoch: 35, train_loss: 0.9962, test_loss: 1.1848, test_f1: 0.4239
 epoch: 36, train_loss: 0.9946, test_loss: 1.1802, test_f1: 0.4530
 epoch: 37, train_loss: 0.9834, test_loss: 1.1756, test_f1: 0.4619
 epoch: 38, train_loss: 0.9693, test_loss: 1.1734, test_f1: 0.4574
 epoch: 39, train_loss: 0.9724, test_loss: 1.1784, test_f1: 0.4706
 epoch: 40, train_loss: 0.9541, test_loss: 1.1769, test_f1: 0.4820
 epoch: 41, train_loss: 0.9541, test_loss: 1.1743, test_f1: 0.4849
 epoch: 42, train_loss: 0.9456, test_loss: 1.1558, test_f1: 0.4914
 epoch: 43, train_loss: 0.9353, test_loss: 1.1507, test_f1: 0.4948
 epoch: 44, train_loss: 0.9202, test_loss: 1.1550, test_f1: 0.5090
 epoch: 45, train_loss: 0.9217, test_loss: 1.1613, test_f1: 0.5375
 epoch: 46, train_loss: 0.9184, test_loss: 1.1673, test_f1: 0.5575
 epoch: 47, train_loss: 0.9114, test_loss: 1.1621, test_f1: 0.5477
 epoch: 48, train_loss: 0.9052, test_loss: 1.1497, test_f1: 0.5580
 epoch: 49, train_loss: 0.8913, test_loss: 1.1366, test_f1: 0.5577
 epoch: 50, train_loss: 0.8798, test_loss: 1.1345, test_f1: 0.5428
 epoch: 51, train_loss: 0.8784, test_loss: 1.1323, test_f1: 0.5643
 epoch: 52, train_loss: 0.8748, test_loss: 1.1379, test_f1: 0.5616
 epoch: 53, train_loss: 0.8735, test_loss: 1.1322, test_f1: 0.5677
 epoch: 54, train_loss: 0.8660, test_loss: 1.1321, test_f1: 0.5479
 epoch: 55, train_loss: 0.8590, test_loss: 1.1268, test_f1: 0.5537
 epoch: 56, train_loss: 0.8590, test_loss: 1.1299, test_f1: 0.5500
 epoch: 57, train_loss: 0.8585, test_loss: 1.1333, test_f1: 0.5558
 epoch: 58, train_loss: 0.8560, test_loss: 1.1337, test_f1: 0.5611
 epoch: 59, train_loss: 0.8519, test_loss: 1.1318, test_f1: 0.5701
 epoch: 60, train_loss: 0.8426, test_loss: 1.1350, test_f1: 0.5597
 epoch: 61, train_loss: 0.8427, test_loss: 1.1303, test_f1: 0.5600
 epoch: 62, train_loss: 0.8488, test_loss: 1.1292, test_f1: 0.5601
 epoch: 63, train_loss: 0.8398, test_loss: 1.1237, test_f1: 0.5654
 epoch: 64, train_loss: 0.8412, test_loss: 1.1204, test_f1: 0.5675
 epoch: 65, train_loss: 0.8347, test_loss: 1.1239, test_f1: 0.5545
 epoch: 66, train_loss: 0.8291, test_loss: 1.1173, test_f1: 0.5626
 epoch: 67, train_loss: 0.8330, test_loss: 1.1186, test_f1: 0.5702
 epoch: 68, train_loss: 0.8224, test_loss: 1.1171, test_f1: 0.5706
 epoch: 69, train_loss: 0.8220, test_loss: 1.1123, test_f1: 0.5819
 epoch: 70, train_loss: 0.8228, test_loss: 1.1116, test_f1: 0.5896
 epoch: 71, train_loss: 0.8151, test_loss: 1.1171, test_f1: 0.5871
 epoch: 72, train_loss: 0.8163, test_loss: 1.1121, test_f1: 0.5891
 epoch: 73, train_loss: 0.8112, test_loss: 1.1162, test_f1: 0.5874
 epoch: 74, train_loss: 0.8075, test_loss: 1.1152, test_f1: 0.5541
 epoch: 75, train_loss: 0.8104, test_loss: 1.1212, test_f1: 0.5761
 epoch: 76, train_loss: 0.8105, test_loss: 1.1197, test_f1: 0.5973
 epoch: 77, train_loss: 0.7988, test_loss: 1.1126, test_f1: 0.6053
 epoch: 78, train_loss: 0.7913, test_loss: 1.1145, test_f1: 0.6002
 epoch: 79, train_loss: 0.7961, test_loss: 1.1270, test_f1: 0.5891
 epoch: 80, train_loss: 0.7943, test_loss: 1.1250, test_f1: 0.5943
 epoch: 81, train_loss: 0.7923, test_loss: 1.1226, test_f1: 0.5660
 epoch: 82, train_loss: 0.7898, test_loss: 1.1270, test_f1: 0.5689
 epoch: 83, train_loss: 0.7802, test_loss: 1.1317, test_f1: 0.5773
 epoch: 84, train_loss: 0.7798, test_loss: 1.1349, test_f1: 0.5949
 epoch: 85, train_loss: 0.7836, test_loss: 1.1382, test_f1: 0.5814
 epoch: 86, train_loss: 0.7810, test_loss: 1.1281, test_f1: 0.5864
 epoch: 87, train_loss: 0.7707, test_loss: 1.1357, test_f1: 0.5684
 epoch: 88, train_loss: 0.7707, test_loss: 1.1461, test_f1: 0.5464
 epoch: 89, train_loss: 0.7674, test_loss: 1.1587, test_f1: 0.5408
 epoch: 90, train_loss: 0.7741, test_loss: 1.1565, test_f1: 0.5772
 epoch: 91, train_loss: 0.7738, test_loss: 1.1463, test_f1: 0.5517
 epoch: 92, train_loss: 0.7673, test_loss: 1.1451, test_f1: 0.5518
 epoch: 93, train_loss: 0.7679, test_loss: 1.1397, test_f1: 0.5694
 epoch: 94, train_loss: 0.7597, test_loss: 1.1412, test_f1: 0.5652
 epoch: 95, train_loss: 0.7624, test_loss: 1.1453, test_f1: 0.5716
 epoch: 96, train_loss: 0.7500, test_loss: 1.1553, test_f1: 0.5653
 epoch: 97, train_loss: 0.7460, test_loss: 1.1532, test_f1: 0.5811
 epoch: 98, train_loss: 0.7479, test_loss: 1.1509, test_f1: 0.5747
 epoch: 99, train_loss: 0.7457, test_loss: 1.1544, test_f1: 0.5732
##################ITERATION #2 ****************************************
 epoch: 0, train_loss: 1.3209, test_loss: 1.3446, test_f1: 0.2290
 epoch: 1, train_loss: 1.2817, test_loss: 1.3437, test_f1: 0.2329
 epoch: 2, train_loss: 1.2686, test_loss: 1.3370, test_f1: 0.2294
 epoch: 3, train_loss: 1.2499, test_loss: 1.3300, test_f1: 0.2341
 epoch: 4, train_loss: 1.2362, test_loss: 1.3204, test_f1: 0.2443
 epoch: 5, train_loss: 1.2215, test_loss: 1.3083, test_f1: 0.2842
 epoch: 6, train_loss: 1.2089, test_loss: 1.2935, test_f1: 0.3131
 epoch: 7, train_loss: 1.1925, test_loss: 1.2770, test_f1: 0.3457
 epoch: 8, train_loss: 1.1846, test_loss: 1.2654, test_f1: 0.3531
 epoch: 9, train_loss: 1.1730, test_loss: 1.2461, test_f1: 0.3360
 epoch: 10, train_loss: 1.1596, test_loss: 1.2372, test_f1: 0.3552
 epoch: 11, train_loss: 1.1519, test_loss: 1.2291, test_f1: 0.3522
 epoch: 12, train_loss: 1.1372, test_loss: 1.2252, test_f1: 0.4189
 epoch: 13, train_loss: 1.1271, test_loss: 1.2151, test_f1: 0.4307
 epoch: 14, train_loss: 1.1157, test_loss: 1.2100, test_f1: 0.4229
 epoch: 15, train_loss: 1.1076, test_loss: 1.2000, test_f1: 0.4230
 epoch: 16, train_loss: 1.0922, test_loss: 1.1925, test_f1: 0.4189
 epoch: 17, train_loss: 1.0865, test_loss: 1.1869, test_f1: 0.4266
 epoch: 18, train_loss: 1.0721, test_loss: 1.1860, test_f1: 0.4397
 epoch: 19, train_loss: 1.0734, test_loss: 1.1820, test_f1: 0.4511
 epoch: 20, train_loss: 1.0609, test_loss: 1.1805, test_f1: 0.4445
 epoch: 21, train_loss: 1.0566, test_loss: 1.1727, test_f1: 0.4478
 epoch: 22, train_loss: 1.0425, test_loss: 1.1678, test_f1: 0.4589
 epoch: 23, train_loss: 1.0358, test_loss: 1.1635, test_f1: 0.4712
 epoch: 24, train_loss: 1.0263, test_loss: 1.1576, test_f1: 0.4762
 epoch: 25, train_loss: 1.0186, test_loss: 1.1514, test_f1: 0.4908
 epoch: 26, train_loss: 1.0180, test_loss: 1.1467, test_f1: 0.4915
 epoch: 27, train_loss: 1.0089, test_loss: 1.1419, test_f1: 0.5047
 epoch: 28, train_loss: 1.0050, test_loss: 1.1346, test_f1: 0.5023
 epoch: 29, train_loss: 0.9958, test_loss: 1.1379, test_f1: 0.4921
 epoch: 30, train_loss: 0.9856, test_loss: 1.1328, test_f1: 0.5040
 epoch: 31, train_loss: 0.9820, test_loss: 1.1387, test_f1: 0.4883
 epoch: 32, train_loss: 0.9655, test_loss: 1.1314, test_f1: 0.5042
 epoch: 33, train_loss: 0.9644, test_loss: 1.1342, test_f1: 0.5102
 epoch: 34, train_loss: 0.9601, test_loss: 1.1357, test_f1: 0.5049
 epoch: 35, train_loss: 0.9600, test_loss: 1.1240, test_f1: 0.5228
 epoch: 36, train_loss: 0.9492, test_loss: 1.1212, test_f1: 0.5221
 epoch: 37, train_loss: 0.9426, test_loss: 1.1148, test_f1: 0.5261
 epoch: 38, train_loss: 0.9390, test_loss: 1.1085, test_f1: 0.5303
 epoch: 39, train_loss: 0.9303, test_loss: 1.1051, test_f1: 0.5284
 epoch: 40, train_loss: 0.9200, test_loss: 1.1066, test_f1: 0.5193
 epoch: 41, train_loss: 0.9223, test_loss: 1.1091, test_f1: 0.5239
 epoch: 42, train_loss: 0.9144, test_loss: 1.1016, test_f1: 0.5266
 epoch: 43, train_loss: 0.9088, test_loss: 1.0976, test_f1: 0.5239
 epoch: 44, train_loss: 0.9074, test_loss: 1.0993, test_f1: 0.5350
 epoch: 45, train_loss: 0.9017, test_loss: 1.1051, test_f1: 0.5317
 epoch: 46, train_loss: 0.8954, test_loss: 1.0991, test_f1: 0.5303
 epoch: 47, train_loss: 0.8855, test_loss: 1.0998, test_f1: 0.5325
 epoch: 48, train_loss: 0.8833, test_loss: 1.0999, test_f1: 0.5353
 epoch: 49, train_loss: 0.8740, test_loss: 1.0909, test_f1: 0.5329
 epoch: 50, train_loss: 0.8693, test_loss: 1.0788, test_f1: 0.5440
 epoch: 51, train_loss: 0.8729, test_loss: 1.0862, test_f1: 0.5378
 epoch: 52, train_loss: 0.8667, test_loss: 1.0826, test_f1: 0.5381
 epoch: 53, train_loss: 0.8637, test_loss: 1.0880, test_f1: 0.5397
 epoch: 54, train_loss: 0.8550, test_loss: 1.0905, test_f1: 0.5423
 epoch: 55, train_loss: 0.8625, test_loss: 1.0939, test_f1: 0.5449
 epoch: 56, train_loss: 0.8573, test_loss: 1.0916, test_f1: 0.5450
 epoch: 57, train_loss: 0.8494, test_loss: 1.0974, test_f1: 0.5421
 epoch: 58, train_loss: 0.8537, test_loss: 1.0961, test_f1: 0.5523
 epoch: 59, train_loss: 0.8424, test_loss: 1.0904, test_f1: 0.5525
 epoch: 60, train_loss: 0.8508, test_loss: 1.0916, test_f1: 0.5575
 epoch: 61, train_loss: 0.8450, test_loss: 1.0922, test_f1: 0.5494
 epoch: 62, train_loss: 0.8458, test_loss: 1.0927, test_f1: 0.5497
 epoch: 63, train_loss: 0.8370, test_loss: 1.0892, test_f1: 0.5451
 epoch: 64, train_loss: 0.8448, test_loss: 1.0827, test_f1: 0.5482
 epoch: 65, train_loss: 0.8361, test_loss: 1.0963, test_f1: 0.5479
 epoch: 66, train_loss: 0.8349, test_loss: 1.0943, test_f1: 0.5427
 epoch: 67, train_loss: 0.8293, test_loss: 1.0977, test_f1: 0.5456
 epoch: 68, train_loss: 0.8345, test_loss: 1.1093, test_f1: 0.5399
 epoch: 69, train_loss: 0.8281, test_loss: 1.1114, test_f1: 0.5348
 epoch: 70, train_loss: 0.8251, test_loss: 1.1169, test_f1: 0.5329
 epoch: 71, train_loss: 0.8238, test_loss: 1.1073, test_f1: 0.5372
 epoch: 72, train_loss: 0.8144, test_loss: 1.1033, test_f1: 0.5398
 epoch: 73, train_loss: 0.8163, test_loss: 1.0915, test_f1: 0.5400
 epoch: 74, train_loss: 0.8190, test_loss: 1.0912, test_f1: 0.5432
 epoch: 75, train_loss: 0.8158, test_loss: 1.1013, test_f1: 0.5454
 epoch: 76, train_loss: 0.8216, test_loss: 1.1017, test_f1: 0.5429
 epoch: 77, train_loss: 0.8101, test_loss: 1.1291, test_f1: 0.5400
 epoch: 78, train_loss: 0.8089, test_loss: 1.1270, test_f1: 0.5400
 epoch: 79, train_loss: 0.8090, test_loss: 1.1344, test_f1: 0.5452
 epoch: 80, train_loss: 0.7983, test_loss: 1.1184, test_f1: 0.5428
 epoch: 81, train_loss: 0.8000, test_loss: 1.1077, test_f1: 0.5402
 epoch: 82, train_loss: 0.8018, test_loss: 1.1019, test_f1: 0.5478
 epoch: 83, train_loss: 0.8058, test_loss: 1.1073, test_f1: 0.5480
 epoch: 84, train_loss: 0.7995, test_loss: 1.1077, test_f1: 0.5578
 epoch: 85, train_loss: 0.7933, test_loss: 1.1025, test_f1: 0.5554
 epoch: 86, train_loss: 0.7841, test_loss: 1.0996, test_f1: 0.5427
 epoch: 87, train_loss: 0.7900, test_loss: 1.1090, test_f1: 0.5374
 epoch: 88, train_loss: 0.7968, test_loss: 1.1101, test_f1: 0.5496
 epoch: 89, train_loss: 0.7904, test_loss: 1.1111, test_f1: 0.5474
 epoch: 90, train_loss: 0.7800, test_loss: 1.1095, test_f1: 0.5423
 epoch: 91, train_loss: 0.7859, test_loss: 1.1198, test_f1: 0.5494
 epoch: 92, train_loss: 0.7740, test_loss: 1.1120, test_f1: 0.5580
 epoch: 93, train_loss: 0.7732, test_loss: 1.1125, test_f1: 0.5616
 epoch: 94, train_loss: 0.7756, test_loss: 1.1178, test_f1: 0.5597
 epoch: 95, train_loss: 0.7754, test_loss: 1.1200, test_f1: 0.5670
 epoch: 96, train_loss: 0.7707, test_loss: 1.1374, test_f1: 0.5663
 epoch: 97, train_loss: 0.7751, test_loss: 1.1306, test_f1: 0.5722
 epoch: 98, train_loss: 0.7656, test_loss: 1.1667, test_f1: 0.5390
 epoch: 99, train_loss: 0.7608, test_loss: 1.1609, test_f1: 0.5570
##################ITERATION #3 ****************************************
 epoch: 0, train_loss: 1.2930, test_loss: 1.3244, test_f1: 0.3582
 epoch: 1, train_loss: 1.2533, test_loss: 1.3254, test_f1: 0.3190
 epoch: 2, train_loss: 1.2355, test_loss: 1.3211, test_f1: 0.3048
 epoch: 3, train_loss: 1.2194, test_loss: 1.3109, test_f1: 0.3083
 epoch: 4, train_loss: 1.2141, test_loss: 1.2976, test_f1: 0.3315
 epoch: 5, train_loss: 1.1975, test_loss: 1.2846, test_f1: 0.3439
 epoch: 6, train_loss: 1.1880, test_loss: 1.2686, test_f1: 0.3644
 epoch: 7, train_loss: 1.1799, test_loss: 1.2564, test_f1: 0.4074
 epoch: 8, train_loss: 1.1706, test_loss: 1.2443, test_f1: 0.4300
 epoch: 9, train_loss: 1.1623, test_loss: 1.2340, test_f1: 0.4500
 epoch: 10, train_loss: 1.1492, test_loss: 1.2245, test_f1: 0.4440
 epoch: 11, train_loss: 1.1394, test_loss: 1.2210, test_f1: 0.4366
 epoch: 12, train_loss: 1.1273, test_loss: 1.2113, test_f1: 0.4282
 epoch: 13, train_loss: 1.1162, test_loss: 1.1978, test_f1: 0.4432
 epoch: 14, train_loss: 1.1048, test_loss: 1.1956, test_f1: 0.4414
 epoch: 15, train_loss: 1.0962, test_loss: 1.1816, test_f1: 0.4521
 epoch: 16, train_loss: 1.0883, test_loss: 1.1818, test_f1: 0.4575
 epoch: 17, train_loss: 1.0825, test_loss: 1.1702, test_f1: 0.4715
 epoch: 18, train_loss: 1.0633, test_loss: 1.1505, test_f1: 0.4739
 epoch: 19, train_loss: 1.0580, test_loss: 1.1467, test_f1: 0.4682
 epoch: 20, train_loss: 1.0515, test_loss: 1.1441, test_f1: 0.4621
 epoch: 21, train_loss: 1.0397, test_loss: 1.1448, test_f1: 0.4565
 epoch: 22, train_loss: 1.0397, test_loss: 1.1397, test_f1: 0.4661
 epoch: 23, train_loss: 1.0301, test_loss: 1.1319, test_f1: 0.4833
 epoch: 24, train_loss: 1.0210, test_loss: 1.1351, test_f1: 0.4928
 epoch: 25, train_loss: 1.0175, test_loss: 1.1370, test_f1: 0.4980
 epoch: 26, train_loss: 1.0101, test_loss: 1.1340, test_f1: 0.4953
 epoch: 27, train_loss: 0.9879, test_loss: 1.1195, test_f1: 0.5065
 epoch: 28, train_loss: 0.9892, test_loss: 1.1168, test_f1: 0.5053
 epoch: 29, train_loss: 0.9790, test_loss: 1.1181, test_f1: 0.5134
 epoch: 30, train_loss: 0.9790, test_loss: 1.1172, test_f1: 0.5185
 epoch: 31, train_loss: 0.9643, test_loss: 1.1149, test_f1: 0.5293
 epoch: 32, train_loss: 0.9721, test_loss: 1.1096, test_f1: 0.5141
 epoch: 33, train_loss: 0.9676, test_loss: 1.1114, test_f1: 0.4997
 epoch: 34, train_loss: 0.9513, test_loss: 1.1158, test_f1: 0.4997
 epoch: 35, train_loss: 0.9466, test_loss: 1.1153, test_f1: 0.4943
 epoch: 36, train_loss: 0.9399, test_loss: 1.1152, test_f1: 0.4944
 epoch: 37, train_loss: 0.9445, test_loss: 1.1140, test_f1: 0.4980
 epoch: 38, train_loss: 0.9284, test_loss: 1.1122, test_f1: 0.5082
 epoch: 39, train_loss: 0.9233, test_loss: 1.1042, test_f1: 0.5058
 epoch: 40, train_loss: 0.9154, test_loss: 1.1134, test_f1: 0.5060
 epoch: 41, train_loss: 0.9159, test_loss: 1.1144, test_f1: 0.5207
 epoch: 42, train_loss: 0.9050, test_loss: 1.1108, test_f1: 0.5310
 epoch: 43, train_loss: 0.8987, test_loss: 1.1133, test_f1: 0.5171
 epoch: 44, train_loss: 0.8963, test_loss: 1.1193, test_f1: 0.5298
 epoch: 45, train_loss: 0.8823, test_loss: 1.1220, test_f1: 0.5246
 epoch: 46, train_loss: 0.8897, test_loss: 1.1245, test_f1: 0.5294
 epoch: 47, train_loss: 0.8759, test_loss: 1.1219, test_f1: 0.5353
 epoch: 48, train_loss: 0.8782, test_loss: 1.1239, test_f1: 0.5380
 epoch: 49, train_loss: 0.8658, test_loss: 1.1155, test_f1: 0.5428
 epoch: 50, train_loss: 0.8606, test_loss: 1.1174, test_f1: 0.5355
 epoch: 51, train_loss: 0.8657, test_loss: 1.1211, test_f1: 0.5431
 epoch: 52, train_loss: 0.8606, test_loss: 1.1217, test_f1: 0.5406
 epoch: 53, train_loss: 0.8526, test_loss: 1.1266, test_f1: 0.5374
 epoch: 54, train_loss: 0.8510, test_loss: 1.1327, test_f1: 0.5323
 epoch: 55, train_loss: 0.8547, test_loss: 1.1278, test_f1: 0.5379
 epoch: 56, train_loss: 0.8447, test_loss: 1.1176, test_f1: 0.5299
 epoch: 57, train_loss: 0.8391, test_loss: 1.1101, test_f1: 0.5347
 epoch: 58, train_loss: 0.8398, test_loss: 1.1064, test_f1: 0.5454
 epoch: 59, train_loss: 0.8371, test_loss: 1.1050, test_f1: 0.5507
 epoch: 60, train_loss: 0.8365, test_loss: 1.1135, test_f1: 0.5435
 epoch: 61, train_loss: 0.8313, test_loss: 1.1081, test_f1: 0.5582
 epoch: 62, train_loss: 0.8332, test_loss: 1.1056, test_f1: 0.5504
 epoch: 63, train_loss: 0.8328, test_loss: 1.1091, test_f1: 0.5404
 epoch: 64, train_loss: 0.8147, test_loss: 1.1139, test_f1: 0.5434
 epoch: 65, train_loss: 0.8290, test_loss: 1.1152, test_f1: 0.5382
 epoch: 66, train_loss: 0.8212, test_loss: 1.1077, test_f1: 0.5432
 epoch: 67, train_loss: 0.8227, test_loss: 1.1087, test_f1: 0.5378
 epoch: 68, train_loss: 0.8105, test_loss: 1.1076, test_f1: 0.5457
 epoch: 69, train_loss: 0.8200, test_loss: 1.1128, test_f1: 0.5403
 epoch: 70, train_loss: 0.8093, test_loss: 1.1195, test_f1: 0.5329
 epoch: 71, train_loss: 0.8047, test_loss: 1.1173, test_f1: 0.5273
 epoch: 72, train_loss: 0.8003, test_loss: 1.1137, test_f1: 0.5349
 epoch: 73, train_loss: 0.8078, test_loss: 1.1114, test_f1: 0.5456
 epoch: 74, train_loss: 0.8061, test_loss: 1.1168, test_f1: 0.5533
 epoch: 75, train_loss: 0.8004, test_loss: 1.1159, test_f1: 0.5510
 epoch: 76, train_loss: 0.8155, test_loss: 1.1115, test_f1: 0.5535
 epoch: 77, train_loss: 0.7995, test_loss: 1.1200, test_f1: 0.5459
 epoch: 78, train_loss: 0.7994, test_loss: 1.1197, test_f1: 0.5486
 epoch: 79, train_loss: 0.7949, test_loss: 1.1171, test_f1: 0.5460
 epoch: 80, train_loss: 0.7817, test_loss: 1.1151, test_f1: 0.5591
 epoch: 81, train_loss: 0.7898, test_loss: 1.1157, test_f1: 0.5537
 epoch: 82, train_loss: 0.7844, test_loss: 1.1227, test_f1: 0.5456
 epoch: 83, train_loss: 0.7863, test_loss: 1.1296, test_f1: 0.5451
 epoch: 84, train_loss: 0.7807, test_loss: 1.1303, test_f1: 0.5428
 epoch: 85, train_loss: 0.7772, test_loss: 1.1372, test_f1: 0.5574
 epoch: 86, train_loss: 0.7721, test_loss: 1.1427, test_f1: 0.5471
 epoch: 87, train_loss: 0.7773, test_loss: 1.1354, test_f1: 0.5489
 epoch: 88, train_loss: 0.7759, test_loss: 1.1281, test_f1: 0.5527
 epoch: 89, train_loss: 0.7627, test_loss: 1.1344, test_f1: 0.5516
 epoch: 90, train_loss: 0.7777, test_loss: 1.1375, test_f1: 0.5404
 epoch: 91, train_loss: 0.7781, test_loss: 1.1221, test_f1: 0.5545
 epoch: 92, train_loss: 0.7743, test_loss: 1.1181, test_f1: 0.5697
 epoch: 93, train_loss: 0.7543, test_loss: 1.1219, test_f1: 0.5590
 epoch: 94, train_loss: 0.7479, test_loss: 1.1241, test_f1: 0.5610
 epoch: 95, train_loss: 0.7613, test_loss: 1.1362, test_f1: 0.5621
 epoch: 96, train_loss: 0.7486, test_loss: 1.1441, test_f1: 0.5675
 epoch: 97, train_loss: 0.7422, test_loss: 1.1472, test_f1: 0.5781
 epoch: 98, train_loss: 0.7598, test_loss: 1.1447, test_f1: 0.5874
 epoch: 99, train_loss: 0.7459, test_loss: 1.1402, test_f1: 0.5920
##################ITERATION #4 ****************************************
 epoch: 0, train_loss: 1.2803, test_loss: 1.3470, test_f1: 0.1387
 epoch: 1, train_loss: 1.2345, test_loss: 1.3344, test_f1: 0.2766
 epoch: 2, train_loss: 1.2143, test_loss: 1.3212, test_f1: 0.3385
 epoch: 3, train_loss: 1.1969, test_loss: 1.3070, test_f1: 0.3429
 epoch: 4, train_loss: 1.1674, test_loss: 1.2868, test_f1: 0.3446
 epoch: 5, train_loss: 1.1592, test_loss: 1.2695, test_f1: 0.3926
 epoch: 6, train_loss: 1.1493, test_loss: 1.2429, test_f1: 0.4428
 epoch: 7, train_loss: 1.1383, test_loss: 1.2202, test_f1: 0.4512
 epoch: 8, train_loss: 1.1110, test_loss: 1.2046, test_f1: 0.4573
 epoch: 9, train_loss: 1.1087, test_loss: 1.1890, test_f1: 0.4736
 epoch: 10, train_loss: 1.0887, test_loss: 1.1749, test_f1: 0.4796
 epoch: 11, train_loss: 1.0724, test_loss: 1.1650, test_f1: 0.4846
 epoch: 12, train_loss: 1.0710, test_loss: 1.1656, test_f1: 0.4918
 epoch: 13, train_loss: 1.0684, test_loss: 1.1565, test_f1: 0.4920
 epoch: 14, train_loss: 1.0478, test_loss: 1.1532, test_f1: 0.4785
 epoch: 15, train_loss: 1.0352, test_loss: 1.1511, test_f1: 0.4845
 epoch: 16, train_loss: 1.0355, test_loss: 1.1417, test_f1: 0.4753
 epoch: 17, train_loss: 1.0224, test_loss: 1.1308, test_f1: 0.4873
 epoch: 18, train_loss: 1.0060, test_loss: 1.1199, test_f1: 0.4907
 epoch: 19, train_loss: 1.0023, test_loss: 1.1197, test_f1: 0.5081
 epoch: 20, train_loss: 0.9941, test_loss: 1.1207, test_f1: 0.4988
 epoch: 21, train_loss: 0.9946, test_loss: 1.1202, test_f1: 0.4923
 epoch: 22, train_loss: 0.9868, test_loss: 1.1199, test_f1: 0.5070
 epoch: 23, train_loss: 0.9742, test_loss: 1.1106, test_f1: 0.5299
 epoch: 24, train_loss: 0.9644, test_loss: 1.1090, test_f1: 0.5462
 epoch: 25, train_loss: 0.9632, test_loss: 1.1085, test_f1: 0.5608
 epoch: 26, train_loss: 0.9597, test_loss: 1.1089, test_f1: 0.5268
 epoch: 27, train_loss: 0.9395, test_loss: 1.1130, test_f1: 0.5552
 epoch: 28, train_loss: 0.9358, test_loss: 1.1220, test_f1: 0.5281
 epoch: 29, train_loss: 0.9276, test_loss: 1.1294, test_f1: 0.5420
 epoch: 30, train_loss: 0.9247, test_loss: 1.1245, test_f1: 0.5398
 epoch: 31, train_loss: 0.9197, test_loss: 1.1166, test_f1: 0.5565
 epoch: 32, train_loss: 0.9248, test_loss: 1.1130, test_f1: 0.5530
 epoch: 33, train_loss: 0.9134, test_loss: 1.1138, test_f1: 0.5600
 epoch: 34, train_loss: 0.9005, test_loss: 1.1339, test_f1: 0.5525
 epoch: 35, train_loss: 0.8978, test_loss: 1.1359, test_f1: 0.5372
 epoch: 36, train_loss: 0.8920, test_loss: 1.1300, test_f1: 0.5549
 epoch: 37, train_loss: 0.8897, test_loss: 1.1149, test_f1: 0.5676
 epoch: 38, train_loss: 0.8803, test_loss: 1.1155, test_f1: 0.5868
 epoch: 39, train_loss: 0.8731, test_loss: 1.1048, test_f1: 0.5843
 epoch: 40, train_loss: 0.8783, test_loss: 1.1096, test_f1: 0.5770
 epoch: 41, train_loss: 0.8657, test_loss: 1.1192, test_f1: 0.5788
 epoch: 42, train_loss: 0.8577, test_loss: 1.1623, test_f1: 0.5222
 epoch: 43, train_loss: 0.8537, test_loss: 1.1704, test_f1: 0.5558
 epoch: 44, train_loss: 0.8591, test_loss: 1.1446, test_f1: 0.5910
 epoch: 45, train_loss: 0.8468, test_loss: 1.1345, test_f1: 0.5715
 epoch: 46, train_loss: 0.8289, test_loss: 1.1396, test_f1: 0.5389
 epoch: 47, train_loss: 0.8374, test_loss: 1.1570, test_f1: 0.5492
 epoch: 48, train_loss: 0.8228, test_loss: 1.1926, test_f1: 0.5411
 epoch: 49, train_loss: 0.8326, test_loss: 1.1850, test_f1: 0.5482
 epoch: 50, train_loss: 0.8341, test_loss: 1.1615, test_f1: 0.5568
 epoch: 51, train_loss: 0.8210, test_loss: 1.1785, test_f1: 0.5117
 epoch: 52, train_loss: 0.8240, test_loss: 1.1832, test_f1: 0.5040
 epoch: 53, train_loss: 0.8085, test_loss: 1.1852, test_f1: 0.4943
 epoch: 54, train_loss: 0.8055, test_loss: 1.1941, test_f1: 0.4890
 epoch: 55, train_loss: 0.7979, test_loss: 1.1974, test_f1: 0.5115
 epoch: 56, train_loss: 0.8051, test_loss: 1.1917, test_f1: 0.5370
 epoch: 57, train_loss: 0.7991, test_loss: 1.2071, test_f1: 0.5441
 epoch: 58, train_loss: 0.8057, test_loss: 1.2152, test_f1: 0.5356
 epoch: 59, train_loss: 0.8081, test_loss: 1.1884, test_f1: 0.5459
 epoch: 60, train_loss: 0.7953, test_loss: 1.1867, test_f1: 0.5283
 epoch: 61, train_loss: 0.8043, test_loss: 1.2088, test_f1: 0.5272
 epoch: 62, train_loss: 0.7894, test_loss: 1.2233, test_f1: 0.5485
 epoch: 63, train_loss: 0.7770, test_loss: 1.2170, test_f1: 0.5438
 epoch: 64, train_loss: 0.7898, test_loss: 1.1936, test_f1: 0.5358
 epoch: 65, train_loss: 0.7932, test_loss: 1.2037, test_f1: 0.5442
 epoch: 66, train_loss: 0.7836, test_loss: 1.1919, test_f1: 0.5512
 epoch: 67, train_loss: 0.7849, test_loss: 1.1953, test_f1: 0.5330
 epoch: 68, train_loss: 0.7802, test_loss: 1.2106, test_f1: 0.5377
 epoch: 69, train_loss: 0.7705, test_loss: 1.2126, test_f1: 0.5430
 epoch: 70, train_loss: 0.7718, test_loss: 1.2334, test_f1: 0.5485
 epoch: 71, train_loss: 0.7613, test_loss: 1.2307, test_f1: 0.5222
 epoch: 72, train_loss: 0.7828, test_loss: 1.2360, test_f1: 0.5384
 epoch: 73, train_loss: 0.7686, test_loss: 1.2369, test_f1: 0.5088
 epoch: 74, train_loss: 0.7661, test_loss: 1.2412, test_f1: 0.4978
 epoch: 75, train_loss: 0.7671, test_loss: 1.2178, test_f1: 0.5434
 epoch: 76, train_loss: 0.7684, test_loss: 1.1952, test_f1: 0.5505
 epoch: 77, train_loss: 0.7621, test_loss: 1.2174, test_f1: 0.5242
 epoch: 78, train_loss: 0.7579, test_loss: 1.2433, test_f1: 0.5099
 epoch: 79, train_loss: 0.7542, test_loss: 1.2792, test_f1: 0.5117
 epoch: 80, train_loss: 0.7617, test_loss: 1.2819, test_f1: 0.5563
 epoch: 81, train_loss: 0.7610, test_loss: 1.2692, test_f1: 0.5641
 epoch: 82, train_loss: 0.7525, test_loss: 1.2626, test_f1: 0.5595
 epoch: 83, train_loss: 0.7455, test_loss: 1.2401, test_f1: 0.5562
 epoch: 84, train_loss: 0.7447, test_loss: 1.2418, test_f1: 0.5612
 epoch: 85, train_loss: 0.7462, test_loss: 1.2900, test_f1: 0.5533
 epoch: 86, train_loss: 0.7443, test_loss: 1.3291, test_f1: 0.5404
 epoch: 87, train_loss: 0.7407, test_loss: 1.2884, test_f1: 0.5483
 epoch: 88, train_loss: 0.7377, test_loss: 1.2557, test_f1: 0.5587
 epoch: 89, train_loss: 0.7315, test_loss: 1.2559, test_f1: 0.5378
 epoch: 90, train_loss: 0.7423, test_loss: 1.2695, test_f1: 0.5185
 epoch: 91, train_loss: 0.7355, test_loss: 1.2492, test_f1: 0.5331
 epoch: 92, train_loss: 0.7368, test_loss: 1.2461, test_f1: 0.5452
 epoch: 93, train_loss: 0.7265, test_loss: 1.2746, test_f1: 0.5340
 epoch: 94, train_loss: 0.7256, test_loss: 1.2452, test_f1: 0.5341
 epoch: 95, train_loss: 0.7332, test_loss: 1.2514, test_f1: 0.5484
 epoch: 96, train_loss: 0.7313, test_loss: 1.2357, test_f1: 0.5560
 epoch: 97, train_loss: 0.7354, test_loss: 1.2510, test_f1: 0.5564
 epoch: 98, train_loss: 0.7281, test_loss: 1.2795, test_f1: 0.5456
 epoch: 99, train_loss: 0.7157, test_loss: 1.2835, test_f1: 0.5221
##################ITERATION #5 ****************************************
 epoch: 0, train_loss: 1.2752, test_loss: 1.3339, test_f1: 0.2464
 epoch: 1, train_loss: 1.2305, test_loss: 1.3297, test_f1: 0.3305
 epoch: 2, train_loss: 1.2157, test_loss: 1.3280, test_f1: 0.3313
 epoch: 3, train_loss: 1.1969, test_loss: 1.3287, test_f1: 0.3438
 epoch: 4, train_loss: 1.1789, test_loss: 1.3255, test_f1: 0.3687
 epoch: 5, train_loss: 1.1703, test_loss: 1.3107, test_f1: 0.4059
 epoch: 6, train_loss: 1.1555, test_loss: 1.2865, test_f1: 0.4262
 epoch: 7, train_loss: 1.1392, test_loss: 1.2641, test_f1: 0.4269
 epoch: 8, train_loss: 1.1301, test_loss: 1.2442, test_f1: 0.4119
 epoch: 9, train_loss: 1.1115, test_loss: 1.2265, test_f1: 0.4057
 epoch: 10, train_loss: 1.1037, test_loss: 1.2179, test_f1: 0.4034
 epoch: 11, train_loss: 1.1050, test_loss: 1.2116, test_f1: 0.4037
 epoch: 12, train_loss: 1.0905, test_loss: 1.2094, test_f1: 0.4238
 epoch: 13, train_loss: 1.0701, test_loss: 1.2107, test_f1: 0.4269
 epoch: 14, train_loss: 1.0584, test_loss: 1.2110, test_f1: 0.4295
 epoch: 15, train_loss: 1.0655, test_loss: 1.2173, test_f1: 0.4469
 epoch: 16, train_loss: 1.0463, test_loss: 1.2195, test_f1: 0.4581
 epoch: 17, train_loss: 1.0323, test_loss: 1.2127, test_f1: 0.4560
 epoch: 18, train_loss: 1.0229, test_loss: 1.2088, test_f1: 0.4646
 epoch: 19, train_loss: 1.0139, test_loss: 1.2114, test_f1: 0.4725
 epoch: 20, train_loss: 1.0114, test_loss: 1.2268, test_f1: 0.4624
 epoch: 21, train_loss: 1.0069, test_loss: 1.2255, test_f1: 0.4805
 epoch: 22, train_loss: 0.9994, test_loss: 1.2242, test_f1: 0.4977
 epoch: 23, train_loss: 0.9961, test_loss: 1.2253, test_f1: 0.4932
 epoch: 24, train_loss: 0.9772, test_loss: 1.2201, test_f1: 0.4957
 epoch: 25, train_loss: 0.9696, test_loss: 1.2260, test_f1: 0.4997
 epoch: 26, train_loss: 0.9687, test_loss: 1.2384, test_f1: 0.5189
 epoch: 27, train_loss: 0.9639, test_loss: 1.2291, test_f1: 0.5346
 epoch: 28, train_loss: 0.9422, test_loss: 1.2374, test_f1: 0.5427
 epoch: 29, train_loss: 0.9510, test_loss: 1.2433, test_f1: 0.5518
 epoch: 30, train_loss: 0.9374, test_loss: 1.2584, test_f1: 0.5170
 epoch: 31, train_loss: 0.9329, test_loss: 1.2358, test_f1: 0.5356
 epoch: 32, train_loss: 0.9339, test_loss: 1.2361, test_f1: 0.5355
 epoch: 33, train_loss: 0.9241, test_loss: 1.2462, test_f1: 0.5348
 epoch: 34, train_loss: 0.9155, test_loss: 1.2674, test_f1: 0.5089
 epoch: 35, train_loss: 0.9154, test_loss: 1.2878, test_f1: 0.5063
 epoch: 36, train_loss: 0.9123, test_loss: 1.2802, test_f1: 0.5124
 epoch: 37, train_loss: 0.9017, test_loss: 1.2595, test_f1: 0.5458
 epoch: 38, train_loss: 0.8954, test_loss: 1.2631, test_f1: 0.5459
 epoch: 39, train_loss: 0.8884, test_loss: 1.2584, test_f1: 0.5647
 epoch: 40, train_loss: 0.8884, test_loss: 1.2728, test_f1: 0.5203
 epoch: 41, train_loss: 0.8736, test_loss: 1.2772, test_f1: 0.5166
 epoch: 42, train_loss: 0.8761, test_loss: 1.2856, test_f1: 0.5157
 epoch: 43, train_loss: 0.8669, test_loss: 1.2660, test_f1: 0.5316
 epoch: 44, train_loss: 0.8539, test_loss: 1.2764, test_f1: 0.5467
 epoch: 45, train_loss: 0.8590, test_loss: 1.2879, test_f1: 0.5377
 epoch: 46, train_loss: 0.8488, test_loss: 1.2923, test_f1: 0.5357
 epoch: 47, train_loss: 0.8487, test_loss: 1.2963, test_f1: 0.5288
 epoch: 48, train_loss: 0.8413, test_loss: 1.3246, test_f1: 0.5118
 epoch: 49, train_loss: 0.8393, test_loss: 1.3364, test_f1: 0.5052
 epoch: 50, train_loss: 0.8415, test_loss: 1.3312, test_f1: 0.5320
 epoch: 51, train_loss: 0.8342, test_loss: 1.3411, test_f1: 0.5344
 epoch: 52, train_loss: 0.8298, test_loss: 1.3366, test_f1: 0.5410
 epoch: 53, train_loss: 0.8127, test_loss: 1.3386, test_f1: 0.5345
 epoch: 54, train_loss: 0.8201, test_loss: 1.3377, test_f1: 0.5370
 epoch: 55, train_loss: 0.8258, test_loss: 1.3267, test_f1: 0.5383
 epoch: 56, train_loss: 0.8247, test_loss: 1.3430, test_f1: 0.5237
 epoch: 57, train_loss: 0.8132, test_loss: 1.3447, test_f1: 0.5368
 epoch: 58, train_loss: 0.8167, test_loss: 1.3491, test_f1: 0.5335
 epoch: 59, train_loss: 0.8089, test_loss: 1.3646, test_f1: 0.5184
 epoch: 60, train_loss: 0.8065, test_loss: 1.3603, test_f1: 0.5325
 epoch: 61, train_loss: 0.8014, test_loss: 1.3330, test_f1: 0.5419
 epoch: 62, train_loss: 0.8045, test_loss: 1.3359, test_f1: 0.5420
 epoch: 63, train_loss: 0.7959, test_loss: 1.3448, test_f1: 0.5362
 epoch: 64, train_loss: 0.7887, test_loss: 1.3552, test_f1: 0.5424
 epoch: 65, train_loss: 0.7972, test_loss: 1.3570, test_f1: 0.5499
 epoch: 66, train_loss: 0.7970, test_loss: 1.3562, test_f1: 0.5447
 epoch: 67, train_loss: 0.7917, test_loss: 1.3616, test_f1: 0.5441
 epoch: 68, train_loss: 0.7859, test_loss: 1.3738, test_f1: 0.5197
 epoch: 69, train_loss: 0.7811, test_loss: 1.3854, test_f1: 0.5167
 epoch: 70, train_loss: 0.7863, test_loss: 1.3825, test_f1: 0.5215
 epoch: 71, train_loss: 0.7765, test_loss: 1.3639, test_f1: 0.5528
 epoch: 72, train_loss: 0.7828, test_loss: 1.3869, test_f1: 0.5399
 epoch: 73, train_loss: 0.7720, test_loss: 1.3780, test_f1: 0.5521
 epoch: 74, train_loss: 0.7712, test_loss: 1.3900, test_f1: 0.5333
 epoch: 75, train_loss: 0.7788, test_loss: 1.3803, test_f1: 0.5470
 epoch: 76, train_loss: 0.7715, test_loss: 1.3920, test_f1: 0.5554
 epoch: 77, train_loss: 0.7745, test_loss: 1.3876, test_f1: 0.5605
 epoch: 78, train_loss: 0.7708, test_loss: 1.3986, test_f1: 0.5534
 epoch: 79, train_loss: 0.7622, test_loss: 1.4007, test_f1: 0.5536
 epoch: 80, train_loss: 0.7665, test_loss: 1.3954, test_f1: 0.5554
 epoch: 81, train_loss: 0.7625, test_loss: 1.3994, test_f1: 0.5460
 epoch: 82, train_loss: 0.7589, test_loss: 1.3725, test_f1: 0.5614
 epoch: 83, train_loss: 0.7555, test_loss: 1.3898, test_f1: 0.5563
 epoch: 84, train_loss: 0.7550, test_loss: 1.3966, test_f1: 0.5461
 epoch: 85, train_loss: 0.7611, test_loss: 1.4323, test_f1: 0.4936
 epoch: 86, train_loss: 0.7487, test_loss: 1.4131, test_f1: 0.5407
 epoch: 87, train_loss: 0.7449, test_loss: 1.4184, test_f1: 0.5539
 epoch: 88, train_loss: 0.7502, test_loss: 1.4015, test_f1: 0.5491
 epoch: 89, train_loss: 0.7510, test_loss: 1.4166, test_f1: 0.5531
 epoch: 90, train_loss: 0.7470, test_loss: 1.4458, test_f1: 0.5459
 epoch: 91, train_loss: 0.7525, test_loss: 1.4785, test_f1: 0.5440
 epoch: 92, train_loss: 0.7495, test_loss: 1.4627, test_f1: 0.5282
 epoch: 93, train_loss: 0.7351, test_loss: 1.4578, test_f1: 0.5405
 epoch: 94, train_loss: 0.7349, test_loss: 1.4512, test_f1: 0.5458
 epoch: 95, train_loss: 0.7287, test_loss: 1.4267, test_f1: 0.5491
 epoch: 96, train_loss: 0.7226, test_loss: 1.4443, test_f1: 0.5458
 epoch: 97, train_loss: 0.7250, test_loss: 1.4573, test_f1: 0.5539
 epoch: 98, train_loss: 0.7207, test_loss: 1.4671, test_f1: 0.5487
 epoch: 99, train_loss: 0.7239, test_loss: 1.4532, test_f1: 0.5515
##################ITERATION #6 ****************************************
 epoch: 0, train_loss: 1.2906, test_loss: 1.3345, test_f1: 0.3109
 epoch: 1, train_loss: 1.2246, test_loss: 1.3339, test_f1: 0.3454
 epoch: 2, train_loss: 1.2152, test_loss: 1.3294, test_f1: 0.3385
 epoch: 3, train_loss: 1.1906, test_loss: 1.3302, test_f1: 0.3432
 epoch: 4, train_loss: 1.1736, test_loss: 1.3227, test_f1: 0.3238
 epoch: 5, train_loss: 1.1554, test_loss: 1.3118, test_f1: 0.3079
 epoch: 6, train_loss: 1.1474, test_loss: 1.3011, test_f1: 0.3652
 epoch: 7, train_loss: 1.1294, test_loss: 1.2743, test_f1: 0.4006
 epoch: 8, train_loss: 1.1160, test_loss: 1.2452, test_f1: 0.4065
 epoch: 9, train_loss: 1.1176, test_loss: 1.2280, test_f1: 0.4255
 epoch: 10, train_loss: 1.1098, test_loss: 1.2072, test_f1: 0.4452
 epoch: 11, train_loss: 1.0909, test_loss: 1.1902, test_f1: 0.4328
 epoch: 12, train_loss: 1.0956, test_loss: 1.1875, test_f1: 0.4677
 epoch: 13, train_loss: 1.0723, test_loss: 1.1850, test_f1: 0.4872
 epoch: 14, train_loss: 1.0664, test_loss: 1.1824, test_f1: 0.4846
 epoch: 15, train_loss: 1.0569, test_loss: 1.1746, test_f1: 0.4711
 epoch: 16, train_loss: 1.0444, test_loss: 1.1801, test_f1: 0.4753
 epoch: 17, train_loss: 1.0313, test_loss: 1.1803, test_f1: 0.4715
 epoch: 18, train_loss: 1.0254, test_loss: 1.1818, test_f1: 0.4668
 epoch: 19, train_loss: 1.0274, test_loss: 1.1757, test_f1: 0.4634
 epoch: 20, train_loss: 1.0081, test_loss: 1.1677, test_f1: 0.4712
 epoch: 21, train_loss: 0.9988, test_loss: 1.1770, test_f1: 0.4809
 epoch: 22, train_loss: 1.0021, test_loss: 1.1865, test_f1: 0.4630
 epoch: 23, train_loss: 0.9825, test_loss: 1.1889, test_f1: 0.4833
 epoch: 24, train_loss: 0.9748, test_loss: 1.1965, test_f1: 0.4875
 epoch: 25, train_loss: 0.9791, test_loss: 1.2016, test_f1: 0.4999
 epoch: 26, train_loss: 0.9623, test_loss: 1.2077, test_f1: 0.5012
 epoch: 27, train_loss: 0.9503, test_loss: 1.2051, test_f1: 0.5013
 epoch: 28, train_loss: 0.9341, test_loss: 1.2035, test_f1: 0.5082
 epoch: 29, train_loss: 0.9416, test_loss: 1.1750, test_f1: 0.5180
 epoch: 30, train_loss: 0.9322, test_loss: 1.1582, test_f1: 0.5160
 epoch: 31, train_loss: 0.9352, test_loss: 1.1588, test_f1: 0.5094
 epoch: 32, train_loss: 0.9242, test_loss: 1.1837, test_f1: 0.5221
 epoch: 33, train_loss: 0.9124, test_loss: 1.1844, test_f1: 0.5120
 epoch: 34, train_loss: 0.9141, test_loss: 1.1823, test_f1: 0.5148
 epoch: 35, train_loss: 0.8970, test_loss: 1.1864, test_f1: 0.5181
 epoch: 36, train_loss: 0.9046, test_loss: 1.2330, test_f1: 0.5233
 epoch: 37, train_loss: 0.8831, test_loss: 1.2146, test_f1: 0.5208
 epoch: 38, train_loss: 0.8827, test_loss: 1.2404, test_f1: 0.5165
 epoch: 39, train_loss: 0.8834, test_loss: 1.2301, test_f1: 0.5146
 epoch: 40, train_loss: 0.8910, test_loss: 1.2280, test_f1: 0.4986
 epoch: 41, train_loss: 0.8613, test_loss: 1.2561, test_f1: 0.4848
 epoch: 42, train_loss: 0.8627, test_loss: 1.2650, test_f1: 0.4763
 epoch: 43, train_loss: 0.8603, test_loss: 1.2600, test_f1: 0.5107
 epoch: 44, train_loss: 0.8579, test_loss: 1.3045, test_f1: 0.5063
 epoch: 45, train_loss: 0.8385, test_loss: 1.2779, test_f1: 0.5344
 epoch: 46, train_loss: 0.8502, test_loss: 1.2663, test_f1: 0.5392
 epoch: 47, train_loss: 0.8441, test_loss: 1.2324, test_f1: 0.5451
 epoch: 48, train_loss: 0.8372, test_loss: 1.2071, test_f1: 0.5323
 epoch: 49, train_loss: 0.8485, test_loss: 1.2418, test_f1: 0.5284
 epoch: 50, train_loss: 0.8330, test_loss: 1.2583, test_f1: 0.5389
 epoch: 51, train_loss: 0.8299, test_loss: 1.3035, test_f1: 0.5379
 epoch: 52, train_loss: 0.8227, test_loss: 1.4152, test_f1: 0.5278
 epoch: 53, train_loss: 0.8126, test_loss: 1.3811, test_f1: 0.5392
 epoch: 54, train_loss: 0.8128, test_loss: 1.3733, test_f1: 0.5402
 epoch: 55, train_loss: 0.8181, test_loss: 1.2657, test_f1: 0.5367
 epoch: 56, train_loss: 0.8122, test_loss: 1.2635, test_f1: 0.5380
 epoch: 57, train_loss: 0.8016, test_loss: 1.2726, test_f1: 0.5343
 epoch: 58, train_loss: 0.7940, test_loss: 1.3039, test_f1: 0.5318
 epoch: 59, train_loss: 0.8026, test_loss: 1.3951, test_f1: 0.5327
 epoch: 60, train_loss: 0.8035, test_loss: 1.3619, test_f1: 0.5344
 epoch: 61, train_loss: 0.8066, test_loss: 1.3581, test_f1: 0.5242
 epoch: 62, train_loss: 0.7954, test_loss: 1.3697, test_f1: 0.5242
 epoch: 63, train_loss: 0.7959, test_loss: 1.3323, test_f1: 0.5322
 epoch: 64, train_loss: 0.7925, test_loss: 1.3534, test_f1: 0.5299
 epoch: 65, train_loss: 0.7855, test_loss: 1.3306, test_f1: 0.5375
 epoch: 66, train_loss: 0.7844, test_loss: 1.3229, test_f1: 0.5297
 epoch: 67, train_loss: 0.7947, test_loss: 1.3203, test_f1: 0.5346
 epoch: 68, train_loss: 0.7888, test_loss: 1.3550, test_f1: 0.5397
 epoch: 69, train_loss: 0.7734, test_loss: 1.3593, test_f1: 0.5325
 epoch: 70, train_loss: 0.7821, test_loss: 1.3512, test_f1: 0.5266
 epoch: 71, train_loss: 0.7643, test_loss: 1.3037, test_f1: 0.5320
 epoch: 72, train_loss: 0.7697, test_loss: 1.3492, test_f1: 0.5400
 epoch: 73, train_loss: 0.7736, test_loss: 1.3642, test_f1: 0.5377
 epoch: 74, train_loss: 0.7648, test_loss: 1.3567, test_f1: 0.5278
 epoch: 75, train_loss: 0.7735, test_loss: 1.3619, test_f1: 0.5376
 epoch: 76, train_loss: 0.7801, test_loss: 1.3553, test_f1: 0.5218
 epoch: 77, train_loss: 0.7665, test_loss: 1.3314, test_f1: 0.5345
 epoch: 78, train_loss: 0.7695, test_loss: 1.3295, test_f1: 0.5247
 epoch: 79, train_loss: 0.7493, test_loss: 1.3820, test_f1: 0.5325
 epoch: 80, train_loss: 0.7614, test_loss: 1.4859, test_f1: 0.5151
 epoch: 81, train_loss: 0.7528, test_loss: 1.4329, test_f1: 0.5123
 epoch: 82, train_loss: 0.7591, test_loss: 1.3892, test_f1: 0.5332
 epoch: 83, train_loss: 0.7517, test_loss: 1.3940, test_f1: 0.5377
 epoch: 84, train_loss: 0.7478, test_loss: 1.4023, test_f1: 0.5433
 epoch: 85, train_loss: 0.7418, test_loss: 1.4733, test_f1: 0.5332
 epoch: 86, train_loss: 0.7463, test_loss: 1.4731, test_f1: 0.5363
 epoch: 87, train_loss: 0.7454, test_loss: 1.4000, test_f1: 0.5436
 epoch: 88, train_loss: 0.7533, test_loss: 1.4160, test_f1: 0.5374
 epoch: 89, train_loss: 0.7415, test_loss: 1.4924, test_f1: 0.5374
 epoch: 90, train_loss: 0.7456, test_loss: 1.4938, test_f1: 0.5418
 epoch: 91, train_loss: 0.7382, test_loss: 1.4286, test_f1: 0.5321
 epoch: 92, train_loss: 0.7387, test_loss: 1.4691, test_f1: 0.5346
 epoch: 93, train_loss: 0.7291, test_loss: 1.5249, test_f1: 0.5305
 epoch: 94, train_loss: 0.7292, test_loss: 1.5134, test_f1: 0.5361
 epoch: 95, train_loss: 0.7333, test_loss: 1.5624, test_f1: 0.5460
 epoch: 96, train_loss: 0.7250, test_loss: 1.5329, test_f1: 0.5433
 epoch: 97, train_loss: 0.7252, test_loss: 1.4929, test_f1: 0.5459
 epoch: 98, train_loss: 0.7314, test_loss: 1.5115, test_f1: 0.5464
 epoch: 99, train_loss: 0.7215, test_loss: 1.5524, test_f1: 0.5435
##################ITERATION #7 ****************************************
 epoch: 0, train_loss: 1.2934, test_loss: 1.3300, test_f1: 0.2490
 epoch: 1, train_loss: 1.2125, test_loss: 1.3220, test_f1: 0.3046
 epoch: 2, train_loss: 1.1932, test_loss: 1.3106, test_f1: 0.3302
 epoch: 3, train_loss: 1.1688, test_loss: 1.2952, test_f1: 0.3666
 epoch: 4, train_loss: 1.1527, test_loss: 1.2783, test_f1: 0.4106
 epoch: 5, train_loss: 1.1241, test_loss: 1.2570, test_f1: 0.4410
 epoch: 6, train_loss: 1.1230, test_loss: 1.2320, test_f1: 0.4422
 epoch: 7, train_loss: 1.1095, test_loss: 1.2119, test_f1: 0.4566
 epoch: 8, train_loss: 1.0869, test_loss: 1.1953, test_f1: 0.4726
 epoch: 9, train_loss: 1.0756, test_loss: 1.1816, test_f1: 0.4833
 epoch: 10, train_loss: 1.0553, test_loss: 1.1705, test_f1: 0.4861
 epoch: 11, train_loss: 1.0512, test_loss: 1.1635, test_f1: 0.4875
 epoch: 12, train_loss: 1.0394, test_loss: 1.1666, test_f1: 0.4898
 epoch: 13, train_loss: 1.0320, test_loss: 1.1627, test_f1: 0.5010
 epoch: 14, train_loss: 1.0245, test_loss: 1.1644, test_f1: 0.5018
 epoch: 15, train_loss: 1.0107, test_loss: 1.1664, test_f1: 0.5125
 epoch: 16, train_loss: 0.9998, test_loss: 1.1712, test_f1: 0.5064
 epoch: 17, train_loss: 1.0027, test_loss: 1.1752, test_f1: 0.4989
 epoch: 18, train_loss: 0.9829, test_loss: 1.1838, test_f1: 0.5238
 epoch: 19, train_loss: 0.9735, test_loss: 1.1876, test_f1: 0.5351
 epoch: 20, train_loss: 0.9804, test_loss: 1.1853, test_f1: 0.5527
 epoch: 21, train_loss: 0.9593, test_loss: 1.1840, test_f1: 0.5467
 epoch: 22, train_loss: 0.9678, test_loss: 1.1815, test_f1: 0.5452
 epoch: 23, train_loss: 0.9556, test_loss: 1.1824, test_f1: 0.5286
 epoch: 24, train_loss: 0.9376, test_loss: 1.1838, test_f1: 0.5286
 epoch: 25, train_loss: 0.9383, test_loss: 1.1935, test_f1: 0.5156
 epoch: 26, train_loss: 0.9317, test_loss: 1.1928, test_f1: 0.5596
 epoch: 27, train_loss: 0.9271, test_loss: 1.1833, test_f1: 0.5777
 epoch: 28, train_loss: 0.9156, test_loss: 1.1713, test_f1: 0.5802
 epoch: 29, train_loss: 0.9164, test_loss: 1.1648, test_f1: 0.5715
 epoch: 30, train_loss: 0.9065, test_loss: 1.1649, test_f1: 0.5503
 epoch: 31, train_loss: 0.9115, test_loss: 1.1778, test_f1: 0.5307
 epoch: 32, train_loss: 0.9027, test_loss: 1.1747, test_f1: 0.5590
 epoch: 33, train_loss: 0.8776, test_loss: 1.1550, test_f1: 0.5794
 epoch: 34, train_loss: 0.8814, test_loss: 1.1529, test_f1: 0.5745
 epoch: 35, train_loss: 0.8842, test_loss: 1.1560, test_f1: 0.5771
 epoch: 36, train_loss: 0.8660, test_loss: 1.1520, test_f1: 0.5652
 epoch: 37, train_loss: 0.8681, test_loss: 1.1432, test_f1: 0.5713
 epoch: 38, train_loss: 0.8614, test_loss: 1.1378, test_f1: 0.5827
 epoch: 39, train_loss: 0.8506, test_loss: 1.1517, test_f1: 0.5814
 epoch: 40, train_loss: 0.8484, test_loss: 1.1794, test_f1: 0.5532
 epoch: 41, train_loss: 0.8376, test_loss: 1.1992, test_f1: 0.5797
 epoch: 42, train_loss: 0.8519, test_loss: 1.2080, test_f1: 0.5747
 epoch: 43, train_loss: 0.8537, test_loss: 1.1978, test_f1: 0.5634
 epoch: 44, train_loss: 0.8289, test_loss: 1.2095, test_f1: 0.5691
 epoch: 45, train_loss: 0.8354, test_loss: 1.2383, test_f1: 0.5586
 epoch: 46, train_loss: 0.8213, test_loss: 1.2648, test_f1: 0.5567
 epoch: 47, train_loss: 0.8143, test_loss: 1.2463, test_f1: 0.5563
 epoch: 48, train_loss: 0.8217, test_loss: 1.1839, test_f1: 0.5610
 epoch: 49, train_loss: 0.8168, test_loss: 1.1989, test_f1: 0.5630
 epoch: 50, train_loss: 0.8157, test_loss: 1.2245, test_f1: 0.5559
 epoch: 51, train_loss: 0.7965, test_loss: 1.1940, test_f1: 0.5548
 epoch: 52, train_loss: 0.8142, test_loss: 1.2093, test_f1: 0.5551
 epoch: 53, train_loss: 0.7959, test_loss: 1.2368, test_f1: 0.5575
 epoch: 54, train_loss: 0.7895, test_loss: 1.2623, test_f1: 0.5514
 epoch: 55, train_loss: 0.8003, test_loss: 1.2544, test_f1: 0.5532
 epoch: 56, train_loss: 0.7921, test_loss: 1.2566, test_f1: 0.5563
 epoch: 57, train_loss: 0.7932, test_loss: 1.2385, test_f1: 0.5690
 epoch: 58, train_loss: 0.7831, test_loss: 1.2434, test_f1: 0.5659
 epoch: 59, train_loss: 0.7898, test_loss: 1.2403, test_f1: 0.5649
 epoch: 60, train_loss: 0.7823, test_loss: 1.2675, test_f1: 0.5621
 epoch: 61, train_loss: 0.7856, test_loss: 1.2836, test_f1: 0.5371
 epoch: 62, train_loss: 0.7765, test_loss: 1.2579, test_f1: 0.5682
 epoch: 63, train_loss: 0.7855, test_loss: 1.2454, test_f1: 0.5672
 epoch: 64, train_loss: 0.7735, test_loss: 1.2454, test_f1: 0.5689
 epoch: 65, train_loss: 0.7794, test_loss: 1.2501, test_f1: 0.5770
 epoch: 66, train_loss: 0.7717, test_loss: 1.2340, test_f1: 0.5689
 epoch: 67, train_loss: 0.7711, test_loss: 1.2373, test_f1: 0.5714
 epoch: 68, train_loss: 0.7644, test_loss: 1.2628, test_f1: 0.5583
 epoch: 69, train_loss: 0.7615, test_loss: 1.2921, test_f1: 0.5529
 epoch: 70, train_loss: 0.7576, test_loss: 1.2896, test_f1: 0.5630
 epoch: 71, train_loss: 0.7629, test_loss: 1.2712, test_f1: 0.5669
 epoch: 72, train_loss: 0.7597, test_loss: 1.2421, test_f1: 0.5616
 epoch: 73, train_loss: 0.7639, test_loss: 1.2341, test_f1: 0.5614
 epoch: 74, train_loss: 0.7561, test_loss: 1.2381, test_f1: 0.5616
 epoch: 75, train_loss: 0.7435, test_loss: 1.2410, test_f1: 0.5660
 epoch: 76, train_loss: 0.7589, test_loss: 1.2652, test_f1: 0.5701
 epoch: 77, train_loss: 0.7539, test_loss: 1.2808, test_f1: 0.5713
 epoch: 78, train_loss: 0.7466, test_loss: 1.2694, test_f1: 0.5612
 epoch: 79, train_loss: 0.7569, test_loss: 1.2579, test_f1: 0.5755
 epoch: 80, train_loss: 0.7490, test_loss: 1.2466, test_f1: 0.5710
 epoch: 81, train_loss: 0.7439, test_loss: 1.2389, test_f1: 0.5586
 epoch: 82, train_loss: 0.7330, test_loss: 1.2478, test_f1: 0.5635
 epoch: 83, train_loss: 0.7460, test_loss: 1.2535, test_f1: 0.5732
 epoch: 84, train_loss: 0.7392, test_loss: 1.2739, test_f1: 0.5600
 epoch: 85, train_loss: 0.7430, test_loss: 1.2828, test_f1: 0.5657
 epoch: 86, train_loss: 0.7410, test_loss: 1.2428, test_f1: 0.5812
 epoch: 87, train_loss: 0.7200, test_loss: 1.2583, test_f1: 0.5629
 epoch: 88, train_loss: 0.7295, test_loss: 1.2749, test_f1: 0.5608
 epoch: 89, train_loss: 0.7307, test_loss: 1.2743, test_f1: 0.5631
 epoch: 90, train_loss: 0.7161, test_loss: 1.2633, test_f1: 0.5675
 epoch: 91, train_loss: 0.7163, test_loss: 1.2779, test_f1: 0.5786
 epoch: 92, train_loss: 0.7106, test_loss: 1.2553, test_f1: 0.5662
 epoch: 93, train_loss: 0.7118, test_loss: 1.2666, test_f1: 0.5634
 epoch: 94, train_loss: 0.7376, test_loss: 1.2729, test_f1: 0.5664
 epoch: 95, train_loss: 0.7089, test_loss: 1.2850, test_f1: 0.5601
 epoch: 96, train_loss: 0.7067, test_loss: 1.2951, test_f1: 0.5592
 epoch: 97, train_loss: 0.7220, test_loss: 1.3241, test_f1: 0.5583
 epoch: 98, train_loss: 0.7165, test_loss: 1.3283, test_f1: 0.5722
 epoch: 99, train_loss: 0.7175, test_loss: 1.3246, test_f1: 0.5686
##################ITERATION #8 ****************************************
 epoch: 0, train_loss: 1.2542, test_loss: 1.3539, test_f1: 0.1365
 epoch: 1, train_loss: 1.1960, test_loss: 1.3349, test_f1: 0.2250
 epoch: 2, train_loss: 1.1715, test_loss: 1.3203, test_f1: 0.2896
 epoch: 3, train_loss: 1.1483, test_loss: 1.2990, test_f1: 0.3637
 epoch: 4, train_loss: 1.1317, test_loss: 1.2692, test_f1: 0.4203
 epoch: 5, train_loss: 1.1285, test_loss: 1.2379, test_f1: 0.4448
 epoch: 6, train_loss: 1.1111, test_loss: 1.2105, test_f1: 0.4521
 epoch: 7, train_loss: 1.0935, test_loss: 1.1839, test_f1: 0.4821
 epoch: 8, train_loss: 1.0787, test_loss: 1.1775, test_f1: 0.4604
 epoch: 9, train_loss: 1.0539, test_loss: 1.1708, test_f1: 0.4614
 epoch: 10, train_loss: 1.0480, test_loss: 1.1703, test_f1: 0.4819
 epoch: 11, train_loss: 1.0358, test_loss: 1.1739, test_f1: 0.4980
 epoch: 12, train_loss: 1.0376, test_loss: 1.1766, test_f1: 0.5013
 epoch: 13, train_loss: 1.0349, test_loss: 1.1640, test_f1: 0.5088
 epoch: 14, train_loss: 1.0145, test_loss: 1.1447, test_f1: 0.5108
 epoch: 15, train_loss: 1.0137, test_loss: 1.1385, test_f1: 0.5198
 epoch: 16, train_loss: 1.0017, test_loss: 1.1423, test_f1: 0.5045
 epoch: 17, train_loss: 0.9870, test_loss: 1.1368, test_f1: 0.5099
 epoch: 18, train_loss: 0.9809, test_loss: 1.1512, test_f1: 0.4904
 epoch: 19, train_loss: 0.9888, test_loss: 1.1641, test_f1: 0.4828
 epoch: 20, train_loss: 0.9570, test_loss: 1.1629, test_f1: 0.4963
 epoch: 21, train_loss: 0.9709, test_loss: 1.1568, test_f1: 0.5089
 epoch: 22, train_loss: 0.9613, test_loss: 1.1494, test_f1: 0.5068
 epoch: 23, train_loss: 0.9558, test_loss: 1.1436, test_f1: 0.4943
 epoch: 24, train_loss: 0.9503, test_loss: 1.1503, test_f1: 0.5011
 epoch: 25, train_loss: 0.9378, test_loss: 1.1484, test_f1: 0.4962
 epoch: 26, train_loss: 0.9354, test_loss: 1.1464, test_f1: 0.5093
 epoch: 27, train_loss: 0.9351, test_loss: 1.1509, test_f1: 0.5238
 epoch: 28, train_loss: 0.9213, test_loss: 1.1565, test_f1: 0.5295
 epoch: 29, train_loss: 0.9327, test_loss: 1.1652, test_f1: 0.5320
 epoch: 30, train_loss: 0.9177, test_loss: 1.1749, test_f1: 0.5174
 epoch: 31, train_loss: 0.9219, test_loss: 1.1800, test_f1: 0.5038
 epoch: 32, train_loss: 0.8993, test_loss: 1.1974, test_f1: 0.5005
 epoch: 33, train_loss: 0.9001, test_loss: 1.1866, test_f1: 0.4996
 epoch: 34, train_loss: 0.9041, test_loss: 1.1898, test_f1: 0.4786
 epoch: 35, train_loss: 0.8998, test_loss: 1.1997, test_f1: 0.4866
 epoch: 36, train_loss: 0.8848, test_loss: 1.1860, test_f1: 0.4809
 epoch: 37, train_loss: 0.8889, test_loss: 1.1732, test_f1: 0.5039
 epoch: 38, train_loss: 0.8881, test_loss: 1.1857, test_f1: 0.5031
 epoch: 39, train_loss: 0.8715, test_loss: 1.1948, test_f1: 0.5157
 epoch: 40, train_loss: 0.8678, test_loss: 1.2054, test_f1: 0.5014
 epoch: 41, train_loss: 0.8696, test_loss: 1.2083, test_f1: 0.5123
 epoch: 42, train_loss: 0.8631, test_loss: 1.1963, test_f1: 0.5123
 epoch: 43, train_loss: 0.8700, test_loss: 1.2014, test_f1: 0.5234
 epoch: 44, train_loss: 0.8688, test_loss: 1.2367, test_f1: 0.4710
 epoch: 45, train_loss: 0.8465, test_loss: 1.2304, test_f1: 0.4812
 epoch: 46, train_loss: 0.8550, test_loss: 1.2183, test_f1: 0.5042
 epoch: 47, train_loss: 0.8515, test_loss: 1.1986, test_f1: 0.5143
 epoch: 48, train_loss: 0.8331, test_loss: 1.2049, test_f1: 0.5203
 epoch: 49, train_loss: 0.8420, test_loss: 1.2009, test_f1: 0.5274
 epoch: 50, train_loss: 0.8306, test_loss: 1.1942, test_f1: 0.5354
 epoch: 51, train_loss: 0.8380, test_loss: 1.2044, test_f1: 0.5379
 epoch: 52, train_loss: 0.8311, test_loss: 1.2141, test_f1: 0.5303
 epoch: 53, train_loss: 0.8346, test_loss: 1.2223, test_f1: 0.5175
 epoch: 54, train_loss: 0.8192, test_loss: 1.2136, test_f1: 0.5229
 epoch: 55, train_loss: 0.8289, test_loss: 1.2191, test_f1: 0.5176
 epoch: 56, train_loss: 0.8180, test_loss: 1.2270, test_f1: 0.5096
 epoch: 57, train_loss: 0.8241, test_loss: 1.2182, test_f1: 0.5091
 epoch: 58, train_loss: 0.8264, test_loss: 1.2399, test_f1: 0.5011
 epoch: 59, train_loss: 0.8236, test_loss: 1.2377, test_f1: 0.5144
 epoch: 60, train_loss: 0.8127, test_loss: 1.2316, test_f1: 0.5280
 epoch: 61, train_loss: 0.8107, test_loss: 1.2276, test_f1: 0.5180
 epoch: 62, train_loss: 0.8074, test_loss: 1.2385, test_f1: 0.5234
 epoch: 63, train_loss: 0.8158, test_loss: 1.2422, test_f1: 0.5310
 epoch: 64, train_loss: 0.8019, test_loss: 1.2379, test_f1: 0.5387
 epoch: 65, train_loss: 0.8104, test_loss: 1.2296, test_f1: 0.5227
 epoch: 66, train_loss: 0.8054, test_loss: 1.2525, test_f1: 0.5169
 epoch: 67, train_loss: 0.8077, test_loss: 1.2529, test_f1: 0.5221
 epoch: 68, train_loss: 0.8021, test_loss: 1.2504, test_f1: 0.5223
 epoch: 69, train_loss: 0.7943, test_loss: 1.2623, test_f1: 0.5276
 epoch: 70, train_loss: 0.7977, test_loss: 1.2338, test_f1: 0.5300
 epoch: 71, train_loss: 0.7913, test_loss: 1.2355, test_f1: 0.5439
 epoch: 72, train_loss: 0.7874, test_loss: 1.2401, test_f1: 0.5418
 epoch: 73, train_loss: 0.8001, test_loss: 1.2573, test_f1: 0.5155
 epoch: 74, train_loss: 0.7859, test_loss: 1.2630, test_f1: 0.5204
 epoch: 75, train_loss: 0.7952, test_loss: 1.2633, test_f1: 0.5380
 epoch: 76, train_loss: 0.7869, test_loss: 1.2615, test_f1: 0.5356
 epoch: 77, train_loss: 0.8077, test_loss: 1.2755, test_f1: 0.5228
 epoch: 78, train_loss: 0.7840, test_loss: 1.2792, test_f1: 0.5238
 epoch: 79, train_loss: 0.7806, test_loss: 1.2945, test_f1: 0.4995
 epoch: 80, train_loss: 0.7900, test_loss: 1.2919, test_f1: 0.5111
 epoch: 81, train_loss: 0.7847, test_loss: 1.3043, test_f1: 0.5127
 epoch: 82, train_loss: 0.7717, test_loss: 1.2980, test_f1: 0.5275
 epoch: 83, train_loss: 0.7578, test_loss: 1.2892, test_f1: 0.5361
 epoch: 84, train_loss: 0.7666, test_loss: 1.2731, test_f1: 0.5172
 epoch: 85, train_loss: 0.7730, test_loss: 1.2659, test_f1: 0.5249
 epoch: 86, train_loss: 0.7657, test_loss: 1.2717, test_f1: 0.5459
 epoch: 87, train_loss: 0.7724, test_loss: 1.2877, test_f1: 0.5514
 epoch: 88, train_loss: 0.7672, test_loss: 1.2981, test_f1: 0.5438
 epoch: 89, train_loss: 0.7704, test_loss: 1.2828, test_f1: 0.5486
 epoch: 90, train_loss: 0.7640, test_loss: 1.2884, test_f1: 0.5647
 epoch: 91, train_loss: 0.7562, test_loss: 1.2982, test_f1: 0.5588
 epoch: 92, train_loss: 0.7615, test_loss: 1.3083, test_f1: 0.5531
 epoch: 93, train_loss: 0.7664, test_loss: 1.3174, test_f1: 0.5509
 epoch: 94, train_loss: 0.7562, test_loss: 1.3065, test_f1: 0.5514
 epoch: 95, train_loss: 0.7652, test_loss: 1.3190, test_f1: 0.5330
 epoch: 96, train_loss: 0.7680, test_loss: 1.3032, test_f1: 0.5502
 epoch: 97, train_loss: 0.7432, test_loss: 1.3027, test_f1: 0.5548
 epoch: 98, train_loss: 0.7560, test_loss: 1.3155, test_f1: 0.5480
 epoch: 99, train_loss: 0.7564, test_loss: 1.3276, test_f1: 0.5402
##################ITERATION #9 ****************************************
 epoch: 0, train_loss: 1.2380, test_loss: 1.3317, test_f1: 0.2416
 epoch: 1, train_loss: 1.1865, test_loss: 1.3374, test_f1: 0.3065
 epoch: 2, train_loss: 1.1686, test_loss: 1.3327, test_f1: 0.3133
 epoch: 3, train_loss: 1.1547, test_loss: 1.3232, test_f1: 0.3458
 epoch: 4, train_loss: 1.1298, test_loss: 1.3072, test_f1: 0.4130
 epoch: 5, train_loss: 1.1111, test_loss: 1.2818, test_f1: 0.4140
 epoch: 6, train_loss: 1.1168, test_loss: 1.2637, test_f1: 0.4062
 epoch: 7, train_loss: 1.0942, test_loss: 1.2467, test_f1: 0.4350
 epoch: 8, train_loss: 1.0842, test_loss: 1.2372, test_f1: 0.4607
 epoch: 9, train_loss: 1.0733, test_loss: 1.2339, test_f1: 0.4825
 epoch: 10, train_loss: 1.0559, test_loss: 1.2266, test_f1: 0.4849
 epoch: 11, train_loss: 1.0651, test_loss: 1.2255, test_f1: 0.4745
 epoch: 12, train_loss: 1.0453, test_loss: 1.2159, test_f1: 0.4934
 epoch: 13, train_loss: 1.0268, test_loss: 1.2113, test_f1: 0.5067
 epoch: 14, train_loss: 1.0256, test_loss: 1.2059, test_f1: 0.5188
 epoch: 15, train_loss: 1.0279, test_loss: 1.2024, test_f1: 0.5189
 epoch: 16, train_loss: 1.0189, test_loss: 1.2033, test_f1: 0.5105
 epoch: 17, train_loss: 1.0035, test_loss: 1.2086, test_f1: 0.5227
 epoch: 18, train_loss: 1.0017, test_loss: 1.2041, test_f1: 0.5068
 epoch: 19, train_loss: 0.9947, test_loss: 1.2170, test_f1: 0.5297
 epoch: 20, train_loss: 0.9822, test_loss: 1.2282, test_f1: 0.5411
 epoch: 21, train_loss: 0.9880, test_loss: 1.2682, test_f1: 0.5467
 epoch: 22, train_loss: 0.9660, test_loss: 1.2019, test_f1: 0.5380
 epoch: 23, train_loss: 0.9530, test_loss: 1.2141, test_f1: 0.5411
 epoch: 24, train_loss: 0.9525, test_loss: 1.2213, test_f1: 0.5408
 epoch: 25, train_loss: 0.9436, test_loss: 1.2142, test_f1: 0.5433
 epoch: 26, train_loss: 0.9434, test_loss: 1.2154, test_f1: 0.5513
 epoch: 27, train_loss: 0.9383, test_loss: 1.2261, test_f1: 0.5615
 epoch: 28, train_loss: 0.9409, test_loss: 1.2156, test_f1: 0.5539
 epoch: 29, train_loss: 0.9288, test_loss: 1.2223, test_f1: 0.5512
 epoch: 30, train_loss: 0.9206, test_loss: 1.2079, test_f1: 0.5639
 epoch: 31, train_loss: 0.9309, test_loss: 1.2276, test_f1: 0.5466
 epoch: 32, train_loss: 0.9035, test_loss: 1.2455, test_f1: 0.5183
 epoch: 33, train_loss: 0.9072, test_loss: 1.2240, test_f1: 0.5333
 epoch: 34, train_loss: 0.9042, test_loss: 1.2973, test_f1: 0.5129
 epoch: 35, train_loss: 0.8945, test_loss: 1.2772, test_f1: 0.5065
 epoch: 36, train_loss: 0.8958, test_loss: 1.2878, test_f1: 0.5380
 epoch: 37, train_loss: 0.8707, test_loss: 1.3243, test_f1: 0.5384
 epoch: 38, train_loss: 0.8816, test_loss: 1.2961, test_f1: 0.5304
 epoch: 39, train_loss: 0.8782, test_loss: 1.2214, test_f1: 0.5459
 epoch: 40, train_loss: 0.8742, test_loss: 1.2490, test_f1: 0.5352
 epoch: 41, train_loss: 0.8753, test_loss: 1.2534, test_f1: 0.5226
 epoch: 42, train_loss: 0.8690, test_loss: 1.2844, test_f1: 0.5136
 epoch: 43, train_loss: 0.8533, test_loss: 1.2944, test_f1: 0.5239
 epoch: 44, train_loss: 0.8497, test_loss: 1.2675, test_f1: 0.5190
 epoch: 45, train_loss: 0.8433, test_loss: 1.2514, test_f1: 0.5483
 epoch: 46, train_loss: 0.8536, test_loss: 1.2511, test_f1: 0.5346
 epoch: 47, train_loss: 0.8419, test_loss: 1.2695, test_f1: 0.5154
 epoch: 48, train_loss: 0.8309, test_loss: 1.2947, test_f1: 0.5271
 epoch: 49, train_loss: 0.8455, test_loss: 1.2977, test_f1: 0.5294
 epoch: 50, train_loss: 0.8289, test_loss: 1.3401, test_f1: 0.5021
 epoch: 51, train_loss: 0.8294, test_loss: 1.3777, test_f1: 0.5033
 epoch: 52, train_loss: 0.8245, test_loss: 1.4048, test_f1: 0.5029
 epoch: 53, train_loss: 0.8234, test_loss: 1.4069, test_f1: 0.5118
 epoch: 54, train_loss: 0.8280, test_loss: 1.3680, test_f1: 0.5226
 epoch: 55, train_loss: 0.8109, test_loss: 1.3887, test_f1: 0.5226
 epoch: 56, train_loss: 0.8314, test_loss: 1.3806, test_f1: 0.5057
 epoch: 57, train_loss: 0.8163, test_loss: 1.3900, test_f1: 0.4967
 epoch: 58, train_loss: 0.8104, test_loss: 1.3757, test_f1: 0.5080
 epoch: 59, train_loss: 0.8086, test_loss: 1.3515, test_f1: 0.5375
 epoch: 60, train_loss: 0.7996, test_loss: 1.3153, test_f1: 0.5379
 epoch: 61, train_loss: 0.8050, test_loss: 1.3184, test_f1: 0.5261
 epoch: 62, train_loss: 0.7950, test_loss: 1.3096, test_f1: 0.5201
 epoch: 63, train_loss: 0.7916, test_loss: 1.2794, test_f1: 0.5228
 epoch: 64, train_loss: 0.8065, test_loss: 1.3263, test_f1: 0.5171
 epoch: 65, train_loss: 0.7868, test_loss: 1.3424, test_f1: 0.4956
 epoch: 66, train_loss: 0.8012, test_loss: 1.3565, test_f1: 0.5252
 epoch: 67, train_loss: 0.7960, test_loss: 1.3477, test_f1: 0.5316
 epoch: 68, train_loss: 0.7819, test_loss: 1.3529, test_f1: 0.5425
 epoch: 69, train_loss: 0.7830, test_loss: 1.3477, test_f1: 0.5380
 epoch: 70, train_loss: 0.7866, test_loss: 1.3797, test_f1: 0.5135
 epoch: 71, train_loss: 0.7914, test_loss: 1.3883, test_f1: 0.5145
 epoch: 72, train_loss: 0.7892, test_loss: 1.3583, test_f1: 0.5118
 epoch: 73, train_loss: 0.7825, test_loss: 1.3694, test_f1: 0.4968
 epoch: 74, train_loss: 0.7867, test_loss: 1.3686, test_f1: 0.4979
 epoch: 75, train_loss: 0.7896, test_loss: 1.3697, test_f1: 0.5267
 epoch: 76, train_loss: 0.7764, test_loss: 1.3418, test_f1: 0.5479
 epoch: 77, train_loss: 0.7810, test_loss: 1.3792, test_f1: 0.5219
 epoch: 78, train_loss: 0.7754, test_loss: 1.3522, test_f1: 0.5321
 epoch: 79, train_loss: 0.7612, test_loss: 1.3680, test_f1: 0.5263
 epoch: 80, train_loss: 0.7730, test_loss: 1.3246, test_f1: 0.5313
 epoch: 81, train_loss: 0.7611, test_loss: 1.3282, test_f1: 0.5287
 epoch: 82, train_loss: 0.7717, test_loss: 1.4169, test_f1: 0.5123
 epoch: 83, train_loss: 0.7624, test_loss: 1.3670, test_f1: 0.5233
 epoch: 84, train_loss: 0.7598, test_loss: 1.3741, test_f1: 0.5162
 epoch: 85, train_loss: 0.7537, test_loss: 1.3644, test_f1: 0.5405
 epoch: 86, train_loss: 0.7613, test_loss: 1.3881, test_f1: 0.5272
 epoch: 87, train_loss: 0.7533, test_loss: 1.4103, test_f1: 0.5267
 epoch: 88, train_loss: 0.7609, test_loss: 1.4225, test_f1: 0.5265
 epoch: 89, train_loss: 0.7545, test_loss: 1.3951, test_f1: 0.5330
 epoch: 90, train_loss: 0.7570, test_loss: 1.3683, test_f1: 0.5317
 epoch: 91, train_loss: 0.7588, test_loss: 1.3591, test_f1: 0.5352
 epoch: 92, train_loss: 0.7418, test_loss: 1.3520, test_f1: 0.5259
 epoch: 93, train_loss: 0.7503, test_loss: 1.3575, test_f1: 0.5222
 epoch: 94, train_loss: 0.7519, test_loss: 1.3921, test_f1: 0.5206
 epoch: 95, train_loss: 0.7441, test_loss: 1.4374, test_f1: 0.4929
 epoch: 96, train_loss: 0.7373, test_loss: 1.3995, test_f1: 0.5304
 epoch: 97, train_loss: 0.7352, test_loss: 1.4099, test_f1: 0.5399
 epoch: 98, train_loss: 0.7317, test_loss: 1.3659, test_f1: 0.5508
 epoch: 99, train_loss: 0.7420, test_loss: 1.3942, test_f1: 0.5385

Training completed in 278.98 seconds
Best F1: 0.6053 at epoch 77
Mean F1 across iterations: 0.5704  0.0231
========================FINAL RESULTS================================
FEGIN weighted F1: 0.6053  0.0231
python main.py --data ltspice_demos --representation component_component --model FEGIN --layers 2 --hiddens 128 --batch_size 256 --lr 0.0001 --emb_size 128 --epochs 100 --save_appendix component_component_L2_H128_BS256_LR0.0001_E128 --no_val
-----



STDERR:
  File "main.py", line 370, in <module>
    main()
  File "main.py", line 254, in main
    dataset = dataset_class(
  File "/home/philip/projects/ltspice_examples_code_repo/Circuit-Completion-Using-GNNs/component_classification_with_link_prediction_head/evaluation/FEGIN/kernel/circuit_datasets.py", line 15, in __init__
    self.data, self.slices = torch.load(self.processed_paths[0])
  File "/home/philip/.local/lib/python3.8/site-packages/torch/serialization.py", line 1040, in load
    warnings.warn(
  File "/usr/lib/python3.8/warnings.py", line 109, in _showwarnmsg
    sw(msg.message, msg.category, msg.filename, msg.lineno,
  File "main.py", line 47, in warn_with_traceback
    traceback.print_stack(file=log)
/home/philip/projects/ltspice_examples_code_repo/Circuit-Completion-Using-GNNs/component_classification_with_link_prediction_head/evaluation/FEGIN/kernel/circuit_datasets.py:15: FutureWarning: You are using `torch.load` with `weights_only=False` (the current default value), which uses the default pickle module implicitly. It is possible to construct malicious pickle data which will execute arbitrary code during unpickling (See https://github.com/pytorch/pytorch/blob/main/SECURITY.md#untrusted-models for more details). In a future release, the default value for `weights_only` will be flipped to `True`. This limits the functions that could be executed during unpickling. Arbitrary objects will no longer be allowed to be loaded via this mode unless they are explicitly allowlisted by the user via `torch.serialization.add_safe_globals`. We recommend you start setting `weights_only=True` for any use case where you don't have full control of the loaded file. Please open an issue on GitHub for any issues related to this experimental feature.
  self.data, self.slices = torch.load(self.processed_paths[0])
