STDOUT:
Results will be saved in /home/philip/projects/ltspice_examples_code_repo/Circuit-Completion-Using-GNNs/component_classification_with_link_prediction_head/evaluation/FEGIN/results/model_FEGIN_dataset_ltspice_examples
Command line input: python main.py --data ltspice_examples --representation component_pin_net --model FEGIN --layers 5 --hiddens 32 --batch_size 32 --lr 0.001 --emb_size 128 --epochs 100 --save_appendix component_pin_net_L5_H32_BS32_LR0.001_E128 --no_val
 is saved.
-----
ltspice_examples - FEGIN
Using 5 layers, 32 hidden units, h = 2
Loading component_pin_net representation dataset
ENTERED
Training FEGIN on component_pin_net representation
Train: 3558, Test: 846
##################ITERATION #0 ****************************************
 epoch: 0, train_loss: 1.2141, test_loss: 1.0770, test_f1: 0.3939
 epoch: 1, train_loss: 1.0493, test_loss: 1.0512, test_f1: 0.4616
 epoch: 2, train_loss: 1.0168, test_loss: 1.0268, test_f1: 0.5179
 epoch: 3, train_loss: 1.0103, test_loss: 0.9964, test_f1: 0.4915
 epoch: 4, train_loss: 0.9818, test_loss: 1.0099, test_f1: 0.4848
 epoch: 5, train_loss: 0.9626, test_loss: 0.9658, test_f1: 0.4737
 epoch: 6, train_loss: 0.9598, test_loss: 0.9800, test_f1: 0.4862
 epoch: 7, train_loss: 0.9346, test_loss: 0.9581, test_f1: 0.5267
 epoch: 8, train_loss: 0.9315, test_loss: 0.9550, test_f1: 0.5339
 epoch: 9, train_loss: 0.9191, test_loss: 0.9124, test_f1: 0.5507
 epoch: 10, train_loss: 0.9125, test_loss: 0.9587, test_f1: 0.5134
 epoch: 11, train_loss: 0.9013, test_loss: 0.9010, test_f1: 0.5323
 epoch: 12, train_loss: 0.9021, test_loss: 0.8993, test_f1: 0.5251
 epoch: 13, train_loss: 0.8793, test_loss: 0.8906, test_f1: 0.5419
 epoch: 14, train_loss: 0.8708, test_loss: 0.9204, test_f1: 0.5510
 epoch: 15, train_loss: 0.8641, test_loss: 0.8956, test_f1: 0.5361
 epoch: 16, train_loss: 0.8414, test_loss: 0.8761, test_f1: 0.5573
 epoch: 17, train_loss: 0.8474, test_loss: 0.9039, test_f1: 0.5460
 epoch: 18, train_loss: 0.8317, test_loss: 0.8563, test_f1: 0.5273
 epoch: 19, train_loss: 0.8290, test_loss: 0.8915, test_f1: 0.5472
 epoch: 20, train_loss: 0.8185, test_loss: 0.9185, test_f1: 0.5577
 epoch: 21, train_loss: 0.8045, test_loss: 0.8854, test_f1: 0.5613
 epoch: 22, train_loss: 0.8078, test_loss: 0.9164, test_f1: 0.5311
 epoch: 23, train_loss: 0.7853, test_loss: 0.9605, test_f1: 0.5728
 epoch: 24, train_loss: 0.7933, test_loss: 0.7963, test_f1: 0.5761
 epoch: 25, train_loss: 0.7668, test_loss: 0.8818, test_f1: 0.5469
 epoch: 26, train_loss: 0.7623, test_loss: 0.9102, test_f1: 0.5943
 epoch: 27, train_loss: 0.7717, test_loss: 0.8564, test_f1: 0.5608
 epoch: 28, train_loss: 0.7579, test_loss: 0.8108, test_f1: 0.6023
 epoch: 29, train_loss: 0.7466, test_loss: 0.8015, test_f1: 0.5704
 epoch: 30, train_loss: 0.7575, test_loss: 0.7826, test_f1: 0.6169
 epoch: 31, train_loss: 0.7274, test_loss: 0.8221, test_f1: 0.5766
 epoch: 32, train_loss: 0.7322, test_loss: 0.8833, test_f1: 0.6044
 epoch: 33, train_loss: 0.7303, test_loss: 0.8532, test_f1: 0.6025
 epoch: 34, train_loss: 0.7245, test_loss: 0.8410, test_f1: 0.5781
 epoch: 35, train_loss: 0.7358, test_loss: 0.9700, test_f1: 0.5813
 epoch: 36, train_loss: 0.7228, test_loss: 0.8743, test_f1: 0.6068
 epoch: 37, train_loss: 0.7126, test_loss: 0.8548, test_f1: 0.6282
 epoch: 38, train_loss: 0.7061, test_loss: 0.8496, test_f1: 0.5980
 epoch: 39, train_loss: 0.6983, test_loss: 0.8800, test_f1: 0.5839
 epoch: 40, train_loss: 0.7165, test_loss: 0.7847, test_f1: 0.6315
 epoch: 41, train_loss: 0.6871, test_loss: 0.8995, test_f1: 0.5893
 epoch: 42, train_loss: 0.6658, test_loss: 0.8462, test_f1: 0.6076
 epoch: 43, train_loss: 0.6819, test_loss: 0.8769, test_f1: 0.5735
 epoch: 44, train_loss: 0.6849, test_loss: 0.8312, test_f1: 0.6354
 epoch: 45, train_loss: 0.6691, test_loss: 0.8293, test_f1: 0.6286
 epoch: 46, train_loss: 0.6600, test_loss: 0.8845, test_f1: 0.6505
 epoch: 47, train_loss: 0.6711, test_loss: 0.7837, test_f1: 0.6356
 epoch: 48, train_loss: 0.6431, test_loss: 0.8999, test_f1: 0.5965
 epoch: 49, train_loss: 0.6658, test_loss: 0.8556, test_f1: 0.6254
 epoch: 50, train_loss: 0.6447, test_loss: 0.8313, test_f1: 0.6160
 epoch: 51, train_loss: 0.6388, test_loss: 0.8527, test_f1: 0.6272
 epoch: 52, train_loss: 0.6176, test_loss: 0.8077, test_f1: 0.6262
 epoch: 53, train_loss: 0.6068, test_loss: 0.8667, test_f1: 0.6318
 epoch: 54, train_loss: 0.6182, test_loss: 0.8199, test_f1: 0.6227
 epoch: 55, train_loss: 0.6347, test_loss: 0.7891, test_f1: 0.6433
 epoch: 56, train_loss: 0.6071, test_loss: 0.8019, test_f1: 0.6492
 epoch: 57, train_loss: 0.5917, test_loss: 0.8773, test_f1: 0.6707
 epoch: 58, train_loss: 0.5886, test_loss: 0.9300, test_f1: 0.6538
 epoch: 59, train_loss: 0.5913, test_loss: 0.8543, test_f1: 0.6322
 epoch: 60, train_loss: 0.5802, test_loss: 0.8459, test_f1: 0.6440
 epoch: 61, train_loss: 0.5936, test_loss: 0.8682, test_f1: 0.6490
 epoch: 62, train_loss: 0.6013, test_loss: 0.8614, test_f1: 0.6371
 epoch: 63, train_loss: 0.5970, test_loss: 0.8766, test_f1: 0.6465
 epoch: 64, train_loss: 0.5902, test_loss: 0.8940, test_f1: 0.6342
 epoch: 65, train_loss: 0.5823, test_loss: 0.9053, test_f1: 0.6488
 epoch: 66, train_loss: 0.5873, test_loss: 0.8576, test_f1: 0.6280
 epoch: 67, train_loss: 0.5884, test_loss: 0.8124, test_f1: 0.6388
 epoch: 68, train_loss: 0.5731, test_loss: 0.8739, test_f1: 0.6226
 epoch: 69, train_loss: 0.5816, test_loss: 0.8638, test_f1: 0.6364
 epoch: 70, train_loss: 0.5746, test_loss: 0.8750, test_f1: 0.6438
 epoch: 71, train_loss: 0.5724, test_loss: 0.8463, test_f1: 0.6434
 epoch: 72, train_loss: 0.5785, test_loss: 0.7937, test_f1: 0.6362
 epoch: 73, train_loss: 0.5593, test_loss: 0.8322, test_f1: 0.6308
 epoch: 74, train_loss: 0.5690, test_loss: 0.7837, test_f1: 0.6426
 epoch: 75, train_loss: 0.5718, test_loss: 0.8262, test_f1: 0.6477
 epoch: 76, train_loss: 0.5605, test_loss: 0.7762, test_f1: 0.6342
 epoch: 77, train_loss: 0.5624, test_loss: 0.8677, test_f1: 0.6262
 epoch: 78, train_loss: 0.5523, test_loss: 0.9047, test_f1: 0.6320
 epoch: 79, train_loss: 0.5498, test_loss: 0.8578, test_f1: 0.6626
 epoch: 80, train_loss: 0.5502, test_loss: 0.9897, test_f1: 0.6387
 epoch: 81, train_loss: 0.5605, test_loss: 0.8634, test_f1: 0.6548
 epoch: 82, train_loss: 0.5428, test_loss: 0.8340, test_f1: 0.6459
 epoch: 83, train_loss: 0.5327, test_loss: 0.9224, test_f1: 0.6261
 epoch: 84, train_loss: 0.5323, test_loss: 0.9406, test_f1: 0.6279
 epoch: 85, train_loss: 0.5428, test_loss: 0.8409, test_f1: 0.6355
 epoch: 86, train_loss: 0.5515, test_loss: 0.8567, test_f1: 0.6377
 epoch: 87, train_loss: 0.5444, test_loss: 0.9249, test_f1: 0.6385
 epoch: 88, train_loss: 0.5234, test_loss: 0.8251, test_f1: 0.6328
 epoch: 89, train_loss: 0.5283, test_loss: 0.7989, test_f1: 0.6447
 epoch: 90, train_loss: 0.5534, test_loss: 0.8941, test_f1: 0.6390
 epoch: 91, train_loss: 0.5329, test_loss: 0.9266, test_f1: 0.6148
 epoch: 92, train_loss: 0.5315, test_loss: 0.8820, test_f1: 0.6484
 epoch: 93, train_loss: 0.5440, test_loss: 0.9182, test_f1: 0.6327
 epoch: 94, train_loss: 0.5466, test_loss: 0.8752, test_f1: 0.6402
 epoch: 95, train_loss: 0.5297, test_loss: 0.9390, test_f1: 0.6321
 epoch: 96, train_loss: 0.5303, test_loss: 0.8424, test_f1: 0.6495
 epoch: 97, train_loss: 0.5021, test_loss: 0.9170, test_f1: 0.6501
 epoch: 98, train_loss: 0.5393, test_loss: 0.9598, test_f1: 0.6473
 epoch: 99, train_loss: 0.5054, test_loss: 0.9125, test_f1: 0.6485
##################ITERATION #1 ****************************************
 epoch: 0, train_loss: 1.1255, test_loss: 1.0302, test_f1: 0.4723
 epoch: 1, train_loss: 1.0018, test_loss: 1.0150, test_f1: 0.4891
 epoch: 2, train_loss: 0.9798, test_loss: 0.9202, test_f1: 0.5119
 epoch: 3, train_loss: 0.9580, test_loss: 0.8932, test_f1: 0.5342
 epoch: 4, train_loss: 0.9388, test_loss: 0.9058, test_f1: 0.5252
 epoch: 5, train_loss: 0.9327, test_loss: 0.8691, test_f1: 0.5460
 epoch: 6, train_loss: 0.9217, test_loss: 0.8614, test_f1: 0.5300
 epoch: 7, train_loss: 0.8992, test_loss: 0.8469, test_f1: 0.5509
 epoch: 8, train_loss: 0.8938, test_loss: 0.8354, test_f1: 0.5695
 epoch: 9, train_loss: 0.8788, test_loss: 0.8121, test_f1: 0.5954
 epoch: 10, train_loss: 0.8699, test_loss: 0.8373, test_f1: 0.5645
 epoch: 11, train_loss: 0.8413, test_loss: 0.8043, test_f1: 0.5755
 epoch: 12, train_loss: 0.8529, test_loss: 0.8348, test_f1: 0.5795
 epoch: 13, train_loss: 0.8372, test_loss: 0.8731, test_f1: 0.5454
 epoch: 14, train_loss: 0.8222, test_loss: 0.7732, test_f1: 0.5885
 epoch: 15, train_loss: 0.8035, test_loss: 0.7711, test_f1: 0.5683
 epoch: 16, train_loss: 0.8061, test_loss: 0.8459, test_f1: 0.5742
 epoch: 17, train_loss: 0.8014, test_loss: 0.7439, test_f1: 0.6185
 epoch: 18, train_loss: 0.7804, test_loss: 0.8127, test_f1: 0.5721
 epoch: 19, train_loss: 0.7704, test_loss: 0.7677, test_f1: 0.5955
 epoch: 20, train_loss: 0.7685, test_loss: 0.7457, test_f1: 0.6298
 epoch: 21, train_loss: 0.7541, test_loss: 0.7570, test_f1: 0.6063
 epoch: 22, train_loss: 0.7418, test_loss: 0.7252, test_f1: 0.6414
 epoch: 23, train_loss: 0.7530, test_loss: 0.7622, test_f1: 0.6179
 epoch: 24, train_loss: 0.7360, test_loss: 0.7190, test_f1: 0.6640
 epoch: 25, train_loss: 0.7420, test_loss: 0.7615, test_f1: 0.6156
 epoch: 26, train_loss: 0.7338, test_loss: 0.7663, test_f1: 0.6423
 epoch: 27, train_loss: 0.7290, test_loss: 0.7404, test_f1: 0.6291
 epoch: 28, train_loss: 0.7390, test_loss: 0.7611, test_f1: 0.6622
 epoch: 29, train_loss: 0.7194, test_loss: 0.7424, test_f1: 0.6204
 epoch: 30, train_loss: 0.7000, test_loss: 0.6925, test_f1: 0.6657
 epoch: 31, train_loss: 0.7071, test_loss: 0.7488, test_f1: 0.6258
 epoch: 32, train_loss: 0.6950, test_loss: 0.7870, test_f1: 0.6144
 epoch: 33, train_loss: 0.6922, test_loss: 0.7520, test_f1: 0.6424
 epoch: 34, train_loss: 0.7009, test_loss: 0.7874, test_f1: 0.6276
 epoch: 35, train_loss: 0.6936, test_loss: 0.7056, test_f1: 0.6533
 epoch: 36, train_loss: 0.6670, test_loss: 0.7298, test_f1: 0.6485
 epoch: 37, train_loss: 0.6644, test_loss: 0.7745, test_f1: 0.6290
 epoch: 38, train_loss: 0.6787, test_loss: 0.7673, test_f1: 0.6531
 epoch: 39, train_loss: 0.6552, test_loss: 0.7938, test_f1: 0.6499
 epoch: 40, train_loss: 0.6578, test_loss: 0.7823, test_f1: 0.6376
 epoch: 41, train_loss: 0.6551, test_loss: 0.8038, test_f1: 0.6325
 epoch: 42, train_loss: 0.6566, test_loss: 0.7445, test_f1: 0.6631
 epoch: 43, train_loss: 0.6377, test_loss: 0.6970, test_f1: 0.6523
 epoch: 44, train_loss: 0.6401, test_loss: 0.7861, test_f1: 0.6554
 epoch: 45, train_loss: 0.6419, test_loss: 0.8154, test_f1: 0.6386
 epoch: 46, train_loss: 0.6499, test_loss: 0.7824, test_f1: 0.6660
 epoch: 47, train_loss: 0.6402, test_loss: 0.7904, test_f1: 0.6659
 epoch: 48, train_loss: 0.6297, test_loss: 0.8006, test_f1: 0.6691
 epoch: 49, train_loss: 0.6168, test_loss: 0.7439, test_f1: 0.6466
 epoch: 50, train_loss: 0.6193, test_loss: 0.7581, test_f1: 0.6370
 epoch: 51, train_loss: 0.6008, test_loss: 0.7769, test_f1: 0.6328
 epoch: 52, train_loss: 0.5872, test_loss: 0.7736, test_f1: 0.6710
 epoch: 53, train_loss: 0.5707, test_loss: 0.7281, test_f1: 0.6752
 epoch: 54, train_loss: 0.5691, test_loss: 0.8088, test_f1: 0.6424
 epoch: 55, train_loss: 0.5601, test_loss: 0.7106, test_f1: 0.6639
 epoch: 56, train_loss: 0.5507, test_loss: 0.7794, test_f1: 0.6558
 epoch: 57, train_loss: 0.5632, test_loss: 0.7236, test_f1: 0.6680
 epoch: 58, train_loss: 0.5562, test_loss: 0.8121, test_f1: 0.6591
 epoch: 59, train_loss: 0.5548, test_loss: 0.8059, test_f1: 0.6604
 epoch: 60, train_loss: 0.5429, test_loss: 0.8076, test_f1: 0.6462
 epoch: 61, train_loss: 0.5353, test_loss: 0.8220, test_f1: 0.6508
 epoch: 62, train_loss: 0.5371, test_loss: 0.7793, test_f1: 0.6740
 epoch: 63, train_loss: 0.5477, test_loss: 0.8009, test_f1: 0.6642
 epoch: 64, train_loss: 0.5334, test_loss: 0.7635, test_f1: 0.6822
 epoch: 65, train_loss: 0.5313, test_loss: 0.8511, test_f1: 0.6517
 epoch: 66, train_loss: 0.5329, test_loss: 0.7719, test_f1: 0.6564
 epoch: 67, train_loss: 0.5255, test_loss: 0.8516, test_f1: 0.6644
 epoch: 68, train_loss: 0.5333, test_loss: 0.9088, test_f1: 0.6316
 epoch: 69, train_loss: 0.5349, test_loss: 0.7817, test_f1: 0.6698
 epoch: 70, train_loss: 0.5180, test_loss: 0.9068, test_f1: 0.6530
 epoch: 71, train_loss: 0.5278, test_loss: 0.8086, test_f1: 0.6754
 epoch: 72, train_loss: 0.5069, test_loss: 0.8371, test_f1: 0.6613
 epoch: 73, train_loss: 0.5202, test_loss: 0.9110, test_f1: 0.6446
 epoch: 74, train_loss: 0.5139, test_loss: 0.8735, test_f1: 0.6367
 epoch: 75, train_loss: 0.5327, test_loss: 0.8133, test_f1: 0.6650
 epoch: 76, train_loss: 0.5018, test_loss: 0.7152, test_f1: 0.6913
 epoch: 77, train_loss: 0.5078, test_loss: 0.8258, test_f1: 0.6547
 epoch: 78, train_loss: 0.5092, test_loss: 0.7497, test_f1: 0.6806
 epoch: 79, train_loss: 0.5143, test_loss: 0.7685, test_f1: 0.6721
 epoch: 80, train_loss: 0.5109, test_loss: 0.8122, test_f1: 0.6466
 epoch: 81, train_loss: 0.4954, test_loss: 0.8244, test_f1: 0.6517
 epoch: 82, train_loss: 0.4917, test_loss: 0.8474, test_f1: 0.6531
 epoch: 83, train_loss: 0.4882, test_loss: 0.8414, test_f1: 0.6526
 epoch: 84, train_loss: 0.4938, test_loss: 0.8762, test_f1: 0.6669
 epoch: 85, train_loss: 0.4872, test_loss: 0.8076, test_f1: 0.6674
 epoch: 86, train_loss: 0.4898, test_loss: 0.7956, test_f1: 0.6627
 epoch: 87, train_loss: 0.4921, test_loss: 0.8110, test_f1: 0.6750
 epoch: 88, train_loss: 0.4851, test_loss: 0.8670, test_f1: 0.6584
 epoch: 89, train_loss: 0.4722, test_loss: 0.9993, test_f1: 0.6551
 epoch: 90, train_loss: 0.4725, test_loss: 0.8686, test_f1: 0.6489
 epoch: 91, train_loss: 0.4828, test_loss: 0.9019, test_f1: 0.6556
 epoch: 92, train_loss: 0.4707, test_loss: 0.9719, test_f1: 0.6805
 epoch: 93, train_loss: 0.4706, test_loss: 0.8424, test_f1: 0.6580
 epoch: 94, train_loss: 0.4732, test_loss: 0.8564, test_f1: 0.6523
 epoch: 95, train_loss: 0.4722, test_loss: 0.9386, test_f1: 0.6738
 epoch: 96, train_loss: 0.4945, test_loss: 0.8494, test_f1: 0.6514
 epoch: 97, train_loss: 0.4812, test_loss: 0.8903, test_f1: 0.6729
 epoch: 98, train_loss: 0.4717, test_loss: 0.9868, test_f1: 0.6723
 epoch: 99, train_loss: 0.4625, test_loss: 0.9419, test_f1: 0.6600
##################ITERATION #2 ****************************************
 epoch: 0, train_loss: 1.1278, test_loss: 0.9582, test_f1: 0.4721
 epoch: 1, train_loss: 0.9896, test_loss: 0.9187, test_f1: 0.5206
 epoch: 2, train_loss: 0.9577, test_loss: 0.8784, test_f1: 0.5293
 epoch: 3, train_loss: 0.9409, test_loss: 0.8824, test_f1: 0.5631
 epoch: 4, train_loss: 0.9217, test_loss: 0.8896, test_f1: 0.5662
 epoch: 5, train_loss: 0.9119, test_loss: 0.8561, test_f1: 0.5771
 epoch: 6, train_loss: 0.8975, test_loss: 0.8425, test_f1: 0.5639
 epoch: 7, train_loss: 0.8759, test_loss: 0.8152, test_f1: 0.5923
 epoch: 8, train_loss: 0.8695, test_loss: 0.8235, test_f1: 0.5662
 epoch: 9, train_loss: 0.8652, test_loss: 0.8000, test_f1: 0.5974
 epoch: 10, train_loss: 0.8431, test_loss: 0.8166, test_f1: 0.5819
 epoch: 11, train_loss: 0.8383, test_loss: 0.7930, test_f1: 0.6106
 epoch: 12, train_loss: 0.8126, test_loss: 0.8191, test_f1: 0.5757
 epoch: 13, train_loss: 0.8163, test_loss: 0.8598, test_f1: 0.5898
 epoch: 14, train_loss: 0.7994, test_loss: 0.8348, test_f1: 0.6113
 epoch: 15, train_loss: 0.7862, test_loss: 0.8217, test_f1: 0.5974
 epoch: 16, train_loss: 0.7861, test_loss: 0.7484, test_f1: 0.6325
 epoch: 17, train_loss: 0.7846, test_loss: 0.7888, test_f1: 0.6241
 epoch: 18, train_loss: 0.7738, test_loss: 0.7676, test_f1: 0.5919
 epoch: 19, train_loss: 0.7634, test_loss: 0.7964, test_f1: 0.6155
 epoch: 20, train_loss: 0.7463, test_loss: 0.8174, test_f1: 0.6338
 epoch: 21, train_loss: 0.7417, test_loss: 0.7991, test_f1: 0.6062
 epoch: 22, train_loss: 0.7504, test_loss: 0.8338, test_f1: 0.6072
 epoch: 23, train_loss: 0.7439, test_loss: 0.8381, test_f1: 0.5918
 epoch: 24, train_loss: 0.7376, test_loss: 0.9049, test_f1: 0.6162
 epoch: 25, train_loss: 0.7238, test_loss: 0.8764, test_f1: 0.6274
 epoch: 26, train_loss: 0.7181, test_loss: 0.8770, test_f1: 0.5869
 epoch: 27, train_loss: 0.7155, test_loss: 0.7590, test_f1: 0.6538
 epoch: 28, train_loss: 0.6978, test_loss: 0.8562, test_f1: 0.6202
 epoch: 29, train_loss: 0.6990, test_loss: 0.8616, test_f1: 0.6194
 epoch: 30, train_loss: 0.6949, test_loss: 0.7989, test_f1: 0.6340
 epoch: 31, train_loss: 0.6830, test_loss: 0.8128, test_f1: 0.6378
 epoch: 32, train_loss: 0.6877, test_loss: 0.7614, test_f1: 0.6434
 epoch: 33, train_loss: 0.6791, test_loss: 0.7997, test_f1: 0.6508
 epoch: 34, train_loss: 0.6660, test_loss: 0.8446, test_f1: 0.6134
 epoch: 35, train_loss: 0.6758, test_loss: 0.8085, test_f1: 0.6601
 epoch: 36, train_loss: 0.6646, test_loss: 0.8049, test_f1: 0.6417
 epoch: 37, train_loss: 0.6653, test_loss: 0.8428, test_f1: 0.6625
 epoch: 38, train_loss: 0.6566, test_loss: 0.8536, test_f1: 0.6172
 epoch: 39, train_loss: 0.6734, test_loss: 0.8198, test_f1: 0.6473
 epoch: 40, train_loss: 0.6530, test_loss: 0.7268, test_f1: 0.6797
 epoch: 41, train_loss: 0.6374, test_loss: 0.8638, test_f1: 0.6435
 epoch: 42, train_loss: 0.6457, test_loss: 0.8509, test_f1: 0.6433
 epoch: 43, train_loss: 0.6505, test_loss: 0.8161, test_f1: 0.6352
 epoch: 44, train_loss: 0.6520, test_loss: 0.8342, test_f1: 0.6205
 epoch: 45, train_loss: 0.6439, test_loss: 0.7976, test_f1: 0.6534
 epoch: 46, train_loss: 0.6314, test_loss: 0.8229, test_f1: 0.6369
 epoch: 47, train_loss: 0.6244, test_loss: 0.8137, test_f1: 0.6668
 epoch: 48, train_loss: 0.6502, test_loss: 0.8758, test_f1: 0.6362
 epoch: 49, train_loss: 0.6330, test_loss: 0.8090, test_f1: 0.6679
 epoch: 50, train_loss: 0.6200, test_loss: 0.7934, test_f1: 0.6615
 epoch: 51, train_loss: 0.5941, test_loss: 0.7824, test_f1: 0.6559
 epoch: 52, train_loss: 0.5783, test_loss: 0.7968, test_f1: 0.6791
 epoch: 53, train_loss: 0.5815, test_loss: 0.8085, test_f1: 0.6771
 epoch: 54, train_loss: 0.5792, test_loss: 0.7620, test_f1: 0.6627
 epoch: 55, train_loss: 0.5571, test_loss: 0.7778, test_f1: 0.6696
 epoch: 56, train_loss: 0.5774, test_loss: 0.7744, test_f1: 0.6982
 epoch: 57, train_loss: 0.5602, test_loss: 0.8322, test_f1: 0.6878
 epoch: 58, train_loss: 0.5553, test_loss: 0.7929, test_f1: 0.6598
 epoch: 59, train_loss: 0.5457, test_loss: 0.8032, test_f1: 0.6743
 epoch: 60, train_loss: 0.5612, test_loss: 0.7843, test_f1: 0.6674
 epoch: 61, train_loss: 0.5425, test_loss: 0.7638, test_f1: 0.6717
 epoch: 62, train_loss: 0.5354, test_loss: 0.8729, test_f1: 0.6515
 epoch: 63, train_loss: 0.5401, test_loss: 0.7932, test_f1: 0.6902
 epoch: 64, train_loss: 0.5382, test_loss: 0.7767, test_f1: 0.6665
 epoch: 65, train_loss: 0.5367, test_loss: 0.8055, test_f1: 0.6711
 epoch: 66, train_loss: 0.5384, test_loss: 0.8346, test_f1: 0.6482
 epoch: 67, train_loss: 0.5296, test_loss: 0.8690, test_f1: 0.6470
 epoch: 68, train_loss: 0.5308, test_loss: 0.8787, test_f1: 0.6759
 epoch: 69, train_loss: 0.5296, test_loss: 0.8410, test_f1: 0.6814
 epoch: 70, train_loss: 0.5249, test_loss: 0.8429, test_f1: 0.6604
 epoch: 71, train_loss: 0.5213, test_loss: 0.8394, test_f1: 0.6616
 epoch: 72, train_loss: 0.5117, test_loss: 0.8128, test_f1: 0.6990
 epoch: 73, train_loss: 0.5148, test_loss: 0.9074, test_f1: 0.6665
 epoch: 74, train_loss: 0.4971, test_loss: 0.8990, test_f1: 0.6473
 epoch: 75, train_loss: 0.5142, test_loss: 0.9839, test_f1: 0.6537
 epoch: 76, train_loss: 0.5044, test_loss: 0.8224, test_f1: 0.6791
 epoch: 77, train_loss: 0.5061, test_loss: 0.8319, test_f1: 0.6822
 epoch: 78, train_loss: 0.4883, test_loss: 0.8840, test_f1: 0.6705
 epoch: 79, train_loss: 0.5051, test_loss: 0.8684, test_f1: 0.6620
 epoch: 80, train_loss: 0.4897, test_loss: 0.9135, test_f1: 0.6584
 epoch: 81, train_loss: 0.4959, test_loss: 0.8926, test_f1: 0.6865
 epoch: 82, train_loss: 0.4883, test_loss: 0.8778, test_f1: 0.7020
 epoch: 83, train_loss: 0.5032, test_loss: 0.9213, test_f1: 0.6579
 epoch: 84, train_loss: 0.4930, test_loss: 0.9881, test_f1: 0.6466
 epoch: 85, train_loss: 0.4739, test_loss: 0.9490, test_f1: 0.6575
 epoch: 86, train_loss: 0.4807, test_loss: 0.9321, test_f1: 0.6648
 epoch: 87, train_loss: 0.4986, test_loss: 0.8837, test_f1: 0.6719
 epoch: 88, train_loss: 0.4800, test_loss: 0.8429, test_f1: 0.6893
 epoch: 89, train_loss: 0.4817, test_loss: 0.9668, test_f1: 0.6623
 epoch: 90, train_loss: 0.4731, test_loss: 0.9186, test_f1: 0.6708
 epoch: 91, train_loss: 0.4931, test_loss: 0.8617, test_f1: 0.6957
 epoch: 92, train_loss: 0.4909, test_loss: 1.0041, test_f1: 0.6620
 epoch: 93, train_loss: 0.4727, test_loss: 0.9034, test_f1: 0.6845
 epoch: 94, train_loss: 0.4664, test_loss: 0.9229, test_f1: 0.6646
 epoch: 95, train_loss: 0.4670, test_loss: 0.9662, test_f1: 0.6688
 epoch: 96, train_loss: 0.4678, test_loss: 0.8524, test_f1: 0.6761
 epoch: 97, train_loss: 0.4518, test_loss: 0.8417, test_f1: 0.7107
 epoch: 98, train_loss: 0.4590, test_loss: 0.8644, test_f1: 0.6777
 epoch: 99, train_loss: 0.4560, test_loss: 0.9717, test_f1: 0.6692
##################ITERATION #3 ****************************************
 epoch: 0, train_loss: 1.1543, test_loss: 1.0146, test_f1: 0.5044
 epoch: 1, train_loss: 1.0285, test_loss: 1.0023, test_f1: 0.5164
 epoch: 2, train_loss: 1.0022, test_loss: 0.9766, test_f1: 0.4810
 epoch: 3, train_loss: 0.9785, test_loss: 0.9719, test_f1: 0.4889
 epoch: 4, train_loss: 0.9586, test_loss: 0.9863, test_f1: 0.5160
 epoch: 5, train_loss: 0.9411, test_loss: 0.9834, test_f1: 0.5268
 epoch: 6, train_loss: 0.9409, test_loss: 0.9584, test_f1: 0.5183
 epoch: 7, train_loss: 0.9152, test_loss: 0.9405, test_f1: 0.5434
 epoch: 8, train_loss: 0.9007, test_loss: 0.8916, test_f1: 0.5330
 epoch: 9, train_loss: 0.8959, test_loss: 0.8649, test_f1: 0.5209
 epoch: 10, train_loss: 0.8790, test_loss: 0.8511, test_f1: 0.5566
 epoch: 11, train_loss: 0.8658, test_loss: 0.8678, test_f1: 0.5512
 epoch: 12, train_loss: 0.8524, test_loss: 0.8216, test_f1: 0.5479
 epoch: 13, train_loss: 0.8584, test_loss: 0.8726, test_f1: 0.5488
 epoch: 14, train_loss: 0.8434, test_loss: 0.7873, test_f1: 0.5872
 epoch: 15, train_loss: 0.8331, test_loss: 0.8050, test_f1: 0.5756
 epoch: 16, train_loss: 0.8253, test_loss: 0.8193, test_f1: 0.5689
 epoch: 17, train_loss: 0.7905, test_loss: 0.7926, test_f1: 0.5796
 epoch: 18, train_loss: 0.8072, test_loss: 0.7956, test_f1: 0.5833
 epoch: 19, train_loss: 0.8062, test_loss: 0.8349, test_f1: 0.5531
 epoch: 20, train_loss: 0.7845, test_loss: 0.8047, test_f1: 0.5807
 epoch: 21, train_loss: 0.7634, test_loss: 0.7358, test_f1: 0.6149
 epoch: 22, train_loss: 0.7665, test_loss: 0.8367, test_f1: 0.5960
 epoch: 23, train_loss: 0.7520, test_loss: 0.7413, test_f1: 0.6025
 epoch: 24, train_loss: 0.7358, test_loss: 0.7655, test_f1: 0.5992
 epoch: 25, train_loss: 0.7173, test_loss: 0.7841, test_f1: 0.5937
 epoch: 26, train_loss: 0.7649, test_loss: 0.7195, test_f1: 0.6275
 epoch: 27, train_loss: 0.7252, test_loss: 0.7363, test_f1: 0.6319
 epoch: 28, train_loss: 0.7143, test_loss: 0.7622, test_f1: 0.5943
 epoch: 29, train_loss: 0.7254, test_loss: 0.7786, test_f1: 0.5769
 epoch: 30, train_loss: 0.7131, test_loss: 0.7376, test_f1: 0.6549
 epoch: 31, train_loss: 0.7130, test_loss: 0.6818, test_f1: 0.6396
 epoch: 32, train_loss: 0.7093, test_loss: 0.7043, test_f1: 0.6433
 epoch: 33, train_loss: 0.6909, test_loss: 0.6844, test_f1: 0.6599
 epoch: 34, train_loss: 0.6916, test_loss: 0.8072, test_f1: 0.5993
 epoch: 35, train_loss: 0.6910, test_loss: 0.7288, test_f1: 0.6237
 epoch: 36, train_loss: 0.6812, test_loss: 0.6918, test_f1: 0.6656
 epoch: 37, train_loss: 0.6689, test_loss: 0.7471, test_f1: 0.6708
 epoch: 38, train_loss: 0.6704, test_loss: 0.7347, test_f1: 0.6390
 epoch: 39, train_loss: 0.6677, test_loss: 0.7169, test_f1: 0.6611
 epoch: 40, train_loss: 0.6815, test_loss: 0.7622, test_f1: 0.6413
 epoch: 41, train_loss: 0.6684, test_loss: 0.7354, test_f1: 0.6644
 epoch: 42, train_loss: 0.6635, test_loss: 0.7055, test_f1: 0.6976
 epoch: 43, train_loss: 0.6655, test_loss: 0.7247, test_f1: 0.6555
 epoch: 44, train_loss: 0.6549, test_loss: 0.7325, test_f1: 0.6667
 epoch: 45, train_loss: 0.6446, test_loss: 0.7654, test_f1: 0.6601
 epoch: 46, train_loss: 0.6229, test_loss: 0.7297, test_f1: 0.6426
 epoch: 47, train_loss: 0.6355, test_loss: 0.7589, test_f1: 0.6667
 epoch: 48, train_loss: 0.6607, test_loss: 0.7685, test_f1: 0.6630
 epoch: 49, train_loss: 0.6346, test_loss: 0.7290, test_f1: 0.6498
 epoch: 50, train_loss: 0.6208, test_loss: 0.8151, test_f1: 0.6574
 epoch: 51, train_loss: 0.5993, test_loss: 0.7566, test_f1: 0.6652
 epoch: 52, train_loss: 0.5823, test_loss: 0.7817, test_f1: 0.6568
 epoch: 53, train_loss: 0.5872, test_loss: 0.7269, test_f1: 0.6791
 epoch: 54, train_loss: 0.5813, test_loss: 0.7417, test_f1: 0.6766
 epoch: 55, train_loss: 0.5728, test_loss: 0.7564, test_f1: 0.6574
 epoch: 56, train_loss: 0.5838, test_loss: 0.7080, test_f1: 0.6937
 epoch: 57, train_loss: 0.5817, test_loss: 0.7541, test_f1: 0.6735
 epoch: 58, train_loss: 0.5671, test_loss: 0.7543, test_f1: 0.6731
 epoch: 59, train_loss: 0.5571, test_loss: 0.8069, test_f1: 0.6629
 epoch: 60, train_loss: 0.5769, test_loss: 0.7455, test_f1: 0.6952
 epoch: 61, train_loss: 0.5706, test_loss: 0.7758, test_f1: 0.6623
 epoch: 62, train_loss: 0.5508, test_loss: 0.8171, test_f1: 0.6560
 epoch: 63, train_loss: 0.5619, test_loss: 0.7791, test_f1: 0.6706
 epoch: 64, train_loss: 0.5603, test_loss: 0.8013, test_f1: 0.6433
 epoch: 65, train_loss: 0.5604, test_loss: 0.8035, test_f1: 0.6617
 epoch: 66, train_loss: 0.5521, test_loss: 0.8149, test_f1: 0.6734
 epoch: 67, train_loss: 0.5481, test_loss: 0.7930, test_f1: 0.6722
 epoch: 68, train_loss: 0.5505, test_loss: 0.7922, test_f1: 0.6919
 epoch: 69, train_loss: 0.5302, test_loss: 0.8109, test_f1: 0.6586
 epoch: 70, train_loss: 0.5399, test_loss: 0.8080, test_f1: 0.6775
 epoch: 71, train_loss: 0.5343, test_loss: 0.8474, test_f1: 0.6532
 epoch: 72, train_loss: 0.5407, test_loss: 0.8086, test_f1: 0.6753
 epoch: 73, train_loss: 0.5174, test_loss: 0.8297, test_f1: 0.6642
 epoch: 74, train_loss: 0.5414, test_loss: 0.7937, test_f1: 0.6849
 epoch: 75, train_loss: 0.5302, test_loss: 0.8342, test_f1: 0.6605
 epoch: 76, train_loss: 0.5104, test_loss: 0.8228, test_f1: 0.6696
 epoch: 77, train_loss: 0.5336, test_loss: 0.8593, test_f1: 0.6727
 epoch: 78, train_loss: 0.5138, test_loss: 0.8398, test_f1: 0.6778
 epoch: 79, train_loss: 0.5054, test_loss: 0.8658, test_f1: 0.6584
 epoch: 80, train_loss: 0.5313, test_loss: 0.8477, test_f1: 0.6645
 epoch: 81, train_loss: 0.5280, test_loss: 0.8728, test_f1: 0.6677
 epoch: 82, train_loss: 0.5202, test_loss: 0.9404, test_f1: 0.6825
 epoch: 83, train_loss: 0.5124, test_loss: 0.8185, test_f1: 0.6814
 epoch: 84, train_loss: 0.5014, test_loss: 0.8456, test_f1: 0.6667
 epoch: 85, train_loss: 0.5002, test_loss: 0.8188, test_f1: 0.6721
 epoch: 86, train_loss: 0.5077, test_loss: 0.8527, test_f1: 0.6822
 epoch: 87, train_loss: 0.5358, test_loss: 0.8772, test_f1: 0.6547
 epoch: 88, train_loss: 0.4925, test_loss: 0.8171, test_f1: 0.6793
 epoch: 89, train_loss: 0.5004, test_loss: 0.8464, test_f1: 0.6645
 epoch: 90, train_loss: 0.4972, test_loss: 0.8173, test_f1: 0.6901
 epoch: 91, train_loss: 0.5098, test_loss: 0.8274, test_f1: 0.6837
 epoch: 92, train_loss: 0.4858, test_loss: 0.8466, test_f1: 0.6754
 epoch: 93, train_loss: 0.4919, test_loss: 0.9562, test_f1: 0.6396
 epoch: 94, train_loss: 0.5114, test_loss: 0.8978, test_f1: 0.6557
 epoch: 95, train_loss: 0.4912, test_loss: 0.9154, test_f1: 0.6506
 epoch: 96, train_loss: 0.4750, test_loss: 0.9023, test_f1: 0.6714
 epoch: 97, train_loss: 0.4860, test_loss: 0.9261, test_f1: 0.6595
 epoch: 98, train_loss: 0.4805, test_loss: 0.9518, test_f1: 0.6448
 epoch: 99, train_loss: 0.4914, test_loss: 0.8740, test_f1: 0.6846
##################ITERATION #4 ****************************************
 epoch: 0, train_loss: 1.1771, test_loss: 0.9908, test_f1: 0.4860
 epoch: 1, train_loss: 1.0102, test_loss: 0.9619, test_f1: 0.4862
 epoch: 2, train_loss: 0.9616, test_loss: 0.9514, test_f1: 0.4958
 epoch: 3, train_loss: 0.9597, test_loss: 0.9458, test_f1: 0.4789
 epoch: 4, train_loss: 0.9332, test_loss: 0.9110, test_f1: 0.5044
 epoch: 5, train_loss: 0.9264, test_loss: 0.8695, test_f1: 0.5050
 epoch: 6, train_loss: 0.9150, test_loss: 0.8778, test_f1: 0.5137
 epoch: 7, train_loss: 0.9120, test_loss: 0.8687, test_f1: 0.5321
 epoch: 8, train_loss: 0.8954, test_loss: 0.8876, test_f1: 0.5501
 epoch: 9, train_loss: 0.8768, test_loss: 0.8569, test_f1: 0.5484
 epoch: 10, train_loss: 0.8593, test_loss: 0.8777, test_f1: 0.5354
 epoch: 11, train_loss: 0.8805, test_loss: 0.8199, test_f1: 0.5681
 epoch: 12, train_loss: 0.8550, test_loss: 0.8321, test_f1: 0.5577
 epoch: 13, train_loss: 0.8443, test_loss: 0.7638, test_f1: 0.5697
 epoch: 14, train_loss: 0.8204, test_loss: 0.8090, test_f1: 0.5542
 epoch: 15, train_loss: 0.8122, test_loss: 0.7805, test_f1: 0.5798
 epoch: 16, train_loss: 0.8126, test_loss: 0.7782, test_f1: 0.5913
 epoch: 17, train_loss: 0.8132, test_loss: 0.7892, test_f1: 0.5989
 epoch: 18, train_loss: 0.7927, test_loss: 0.8235, test_f1: 0.5513
 epoch: 19, train_loss: 0.7897, test_loss: 0.8167, test_f1: 0.6191
 epoch: 20, train_loss: 0.7711, test_loss: 0.7969, test_f1: 0.5991
 epoch: 21, train_loss: 0.7776, test_loss: 0.8233, test_f1: 0.6042
 epoch: 22, train_loss: 0.7745, test_loss: 0.7412, test_f1: 0.6405
 epoch: 23, train_loss: 0.7644, test_loss: 0.7443, test_f1: 0.6497
 epoch: 24, train_loss: 0.7462, test_loss: 0.7270, test_f1: 0.6479
 epoch: 25, train_loss: 0.7599, test_loss: 0.7163, test_f1: 0.6357
 epoch: 26, train_loss: 0.7542, test_loss: 0.7895, test_f1: 0.6276
 epoch: 27, train_loss: 0.7507, test_loss: 0.6967, test_f1: 0.6471
 epoch: 28, train_loss: 0.7183, test_loss: 0.7430, test_f1: 0.6196
 epoch: 29, train_loss: 0.7437, test_loss: 0.7523, test_f1: 0.6253
 epoch: 30, train_loss: 0.7382, test_loss: 0.6909, test_f1: 0.6777
 epoch: 31, train_loss: 0.7225, test_loss: 0.7187, test_f1: 0.6488
 epoch: 32, train_loss: 0.7173, test_loss: 0.7092, test_f1: 0.6598
 epoch: 33, train_loss: 0.7155, test_loss: 0.7470, test_f1: 0.6691
 epoch: 34, train_loss: 0.7171, test_loss: 0.7406, test_f1: 0.6459
 epoch: 35, train_loss: 0.7128, test_loss: 0.7459, test_f1: 0.6365
 epoch: 36, train_loss: 0.7226, test_loss: 0.7745, test_f1: 0.6740
 epoch: 37, train_loss: 0.7098, test_loss: 0.7178, test_f1: 0.6805
 epoch: 38, train_loss: 0.6988, test_loss: 0.7955, test_f1: 0.6224
 epoch: 39, train_loss: 0.6935, test_loss: 0.7356, test_f1: 0.6427
 epoch: 40, train_loss: 0.6919, test_loss: 0.7048, test_f1: 0.6594
 epoch: 41, train_loss: 0.6786, test_loss: 0.7365, test_f1: 0.6378
 epoch: 42, train_loss: 0.6719, test_loss: 0.7283, test_f1: 0.6456
 epoch: 43, train_loss: 0.6857, test_loss: 0.7233, test_f1: 0.6442
 epoch: 44, train_loss: 0.6910, test_loss: 0.7391, test_f1: 0.6515
 epoch: 45, train_loss: 0.6763, test_loss: 0.7065, test_f1: 0.6644
 epoch: 46, train_loss: 0.6605, test_loss: 0.7179, test_f1: 0.6712
 epoch: 47, train_loss: 0.6604, test_loss: 0.7896, test_f1: 0.6717
 epoch: 48, train_loss: 0.6540, test_loss: 0.7974, test_f1: 0.6031
 epoch: 49, train_loss: 0.6758, test_loss: 0.7445, test_f1: 0.6644
 epoch: 50, train_loss: 0.6555, test_loss: 0.7519, test_f1: 0.6518
 epoch: 51, train_loss: 0.6339, test_loss: 0.7724, test_f1: 0.6569
 epoch: 52, train_loss: 0.6249, test_loss: 0.7082, test_f1: 0.6699
 epoch: 53, train_loss: 0.6277, test_loss: 0.7259, test_f1: 0.6408
 epoch: 54, train_loss: 0.5899, test_loss: 0.7596, test_f1: 0.6610
 epoch: 55, train_loss: 0.6068, test_loss: 0.7759, test_f1: 0.6664
 epoch: 56, train_loss: 0.5966, test_loss: 0.7774, test_f1: 0.6604
 epoch: 57, train_loss: 0.5997, test_loss: 0.7070, test_f1: 0.6626
 epoch: 58, train_loss: 0.5813, test_loss: 0.7585, test_f1: 0.6484
 epoch: 59, train_loss: 0.5995, test_loss: 0.7701, test_f1: 0.6555
 epoch: 60, train_loss: 0.5930, test_loss: 0.7402, test_f1: 0.6420
 epoch: 61, train_loss: 0.5829, test_loss: 0.7498, test_f1: 0.6782
 epoch: 62, train_loss: 0.6014, test_loss: 0.7301, test_f1: 0.6663
 epoch: 63, train_loss: 0.5789, test_loss: 0.7953, test_f1: 0.6638
 epoch: 64, train_loss: 0.5745, test_loss: 0.7513, test_f1: 0.6710
 epoch: 65, train_loss: 0.5698, test_loss: 0.7681, test_f1: 0.6589
 epoch: 66, train_loss: 0.5833, test_loss: 0.7157, test_f1: 0.6631
 epoch: 67, train_loss: 0.5777, test_loss: 0.8363, test_f1: 0.6490
 epoch: 68, train_loss: 0.5817, test_loss: 0.8056, test_f1: 0.6514
 epoch: 69, train_loss: 0.5701, test_loss: 0.8387, test_f1: 0.6405
 epoch: 70, train_loss: 0.5725, test_loss: 0.7690, test_f1: 0.6563
 epoch: 71, train_loss: 0.5632, test_loss: 0.7209, test_f1: 0.6861
 epoch: 72, train_loss: 0.5555, test_loss: 0.8622, test_f1: 0.6395
 epoch: 73, train_loss: 0.5533, test_loss: 0.7314, test_f1: 0.6693
 epoch: 74, train_loss: 0.5476, test_loss: 0.8004, test_f1: 0.6658
 epoch: 75, train_loss: 0.5457, test_loss: 0.8511, test_f1: 0.6437
 epoch: 76, train_loss: 0.5541, test_loss: 0.7779, test_f1: 0.6426
 epoch: 77, train_loss: 0.5481, test_loss: 0.7587, test_f1: 0.6618
 epoch: 78, train_loss: 0.5489, test_loss: 0.7687, test_f1: 0.6568
 epoch: 79, train_loss: 0.5300, test_loss: 0.7741, test_f1: 0.6634
 epoch: 80, train_loss: 0.5276, test_loss: 0.7483, test_f1: 0.6632
 epoch: 81, train_loss: 0.5461, test_loss: 0.7403, test_f1: 0.6840
 epoch: 82, train_loss: 0.5365, test_loss: 0.8210, test_f1: 0.6611
 epoch: 83, train_loss: 0.5524, test_loss: 0.7995, test_f1: 0.6790
 epoch: 84, train_loss: 0.5187, test_loss: 0.8003, test_f1: 0.6745
 epoch: 85, train_loss: 0.5243, test_loss: 0.7919, test_f1: 0.6678
 epoch: 86, train_loss: 0.5112, test_loss: 0.8286, test_f1: 0.6492
 epoch: 87, train_loss: 0.5364, test_loss: 0.8375, test_f1: 0.6624
 epoch: 88, train_loss: 0.5202, test_loss: 0.7819, test_f1: 0.6597
 epoch: 89, train_loss: 0.5157, test_loss: 0.8148, test_f1: 0.6468
 epoch: 90, train_loss: 0.5485, test_loss: 0.7961, test_f1: 0.6444
 epoch: 91, train_loss: 0.5171, test_loss: 0.8630, test_f1: 0.6464
 epoch: 92, train_loss: 0.5110, test_loss: 0.9094, test_f1: 0.6593
 epoch: 93, train_loss: 0.4945, test_loss: 0.8349, test_f1: 0.6784
 epoch: 94, train_loss: 0.5004, test_loss: 0.8422, test_f1: 0.6703
 epoch: 95, train_loss: 0.5080, test_loss: 0.8695, test_f1: 0.6645
 epoch: 96, train_loss: 0.4996, test_loss: 0.8727, test_f1: 0.6697
 epoch: 97, train_loss: 0.4998, test_loss: 0.9248, test_f1: 0.6640
 epoch: 98, train_loss: 0.5000, test_loss: 0.8862, test_f1: 0.6634
 epoch: 99, train_loss: 0.4911, test_loss: 0.8908, test_f1: 0.6600
##################ITERATION #5 ****************************************
 epoch: 0, train_loss: 1.2039, test_loss: 1.0222, test_f1: 0.5074
 epoch: 1, train_loss: 1.0370, test_loss: 1.0257, test_f1: 0.4909
 epoch: 2, train_loss: 0.9968, test_loss: 0.9725, test_f1: 0.5150
 epoch: 3, train_loss: 0.9668, test_loss: 0.9620, test_f1: 0.5260
 epoch: 4, train_loss: 0.9420, test_loss: 0.9751, test_f1: 0.5086
 epoch: 5, train_loss: 0.9194, test_loss: 0.8726, test_f1: 0.5134
 epoch: 6, train_loss: 0.9046, test_loss: 0.9488, test_f1: 0.4999
 epoch: 7, train_loss: 0.8965, test_loss: 0.9223, test_f1: 0.5239
 epoch: 8, train_loss: 0.8779, test_loss: 0.8616, test_f1: 0.5874
 epoch: 9, train_loss: 0.8810, test_loss: 0.8519, test_f1: 0.5964
 epoch: 10, train_loss: 0.8635, test_loss: 0.8481, test_f1: 0.5600
 epoch: 11, train_loss: 0.8475, test_loss: 0.8663, test_f1: 0.5486
 epoch: 12, train_loss: 0.8464, test_loss: 0.8529, test_f1: 0.5639
 epoch: 13, train_loss: 0.8356, test_loss: 0.8579, test_f1: 0.5952
 epoch: 14, train_loss: 0.8178, test_loss: 0.7796, test_f1: 0.6163
 epoch: 15, train_loss: 0.8136, test_loss: 0.8095, test_f1: 0.5915
 epoch: 16, train_loss: 0.8072, test_loss: 0.7904, test_f1: 0.6160
 epoch: 17, train_loss: 0.7772, test_loss: 0.7941, test_f1: 0.6552
 epoch: 18, train_loss: 0.7795, test_loss: 0.8004, test_f1: 0.6453
 epoch: 19, train_loss: 0.7755, test_loss: 0.8258, test_f1: 0.6378
 epoch: 20, train_loss: 0.7762, test_loss: 0.8534, test_f1: 0.6097
 epoch: 21, train_loss: 0.7593, test_loss: 0.7832, test_f1: 0.6399
 epoch: 22, train_loss: 0.7655, test_loss: 0.7902, test_f1: 0.6244
 epoch: 23, train_loss: 0.7617, test_loss: 0.7840, test_f1: 0.6282
 epoch: 24, train_loss: 0.7438, test_loss: 0.7526, test_f1: 0.6127
 epoch: 25, train_loss: 0.7387, test_loss: 0.8219, test_f1: 0.6347
 epoch: 26, train_loss: 0.7380, test_loss: 0.8345, test_f1: 0.6487
 epoch: 27, train_loss: 0.7270, test_loss: 0.8305, test_f1: 0.6273
 epoch: 28, train_loss: 0.7176, test_loss: 0.8503, test_f1: 0.6268
 epoch: 29, train_loss: 0.7273, test_loss: 0.8100, test_f1: 0.6304
 epoch: 30, train_loss: 0.7131, test_loss: 0.7848, test_f1: 0.6445
 epoch: 31, train_loss: 0.7168, test_loss: 0.7087, test_f1: 0.6592
 epoch: 32, train_loss: 0.7037, test_loss: 0.7640, test_f1: 0.6415
 epoch: 33, train_loss: 0.6968, test_loss: 0.7981, test_f1: 0.6376
 epoch: 34, train_loss: 0.6913, test_loss: 0.7917, test_f1: 0.6632
 epoch: 35, train_loss: 0.6937, test_loss: 0.8538, test_f1: 0.6354
 epoch: 36, train_loss: 0.6855, test_loss: 0.8943, test_f1: 0.6179
 epoch: 37, train_loss: 0.6817, test_loss: 0.8638, test_f1: 0.6354
 epoch: 38, train_loss: 0.6976, test_loss: 0.8516, test_f1: 0.6205
 epoch: 39, train_loss: 0.6678, test_loss: 0.8278, test_f1: 0.6539
 epoch: 40, train_loss: 0.6722, test_loss: 0.8613, test_f1: 0.6293
 epoch: 41, train_loss: 0.6994, test_loss: 0.8278, test_f1: 0.6299
 epoch: 42, train_loss: 0.6934, test_loss: 0.7910, test_f1: 0.6326
 epoch: 43, train_loss: 0.6712, test_loss: 0.7986, test_f1: 0.6605
 epoch: 44, train_loss: 0.6510, test_loss: 0.8687, test_f1: 0.6340
 epoch: 45, train_loss: 0.6545, test_loss: 0.8489, test_f1: 0.6380
 epoch: 46, train_loss: 0.6507, test_loss: 0.8658, test_f1: 0.6752
 epoch: 47, train_loss: 0.6448, test_loss: 0.8403, test_f1: 0.6474
 epoch: 48, train_loss: 0.6505, test_loss: 0.7850, test_f1: 0.6586
 epoch: 49, train_loss: 0.6576, test_loss: 0.8596, test_f1: 0.6531
 epoch: 50, train_loss: 0.6395, test_loss: 0.8510, test_f1: 0.6292
 epoch: 51, train_loss: 0.6194, test_loss: 0.8788, test_f1: 0.6467
 epoch: 52, train_loss: 0.5988, test_loss: 0.9412, test_f1: 0.6625
 epoch: 53, train_loss: 0.6090, test_loss: 0.8892, test_f1: 0.6645
 epoch: 54, train_loss: 0.6026, test_loss: 0.8335, test_f1: 0.6603
 epoch: 55, train_loss: 0.5871, test_loss: 0.8712, test_f1: 0.6575
 epoch: 56, train_loss: 0.5836, test_loss: 0.8792, test_f1: 0.6771
 epoch: 57, train_loss: 0.5832, test_loss: 0.8776, test_f1: 0.6701
 epoch: 58, train_loss: 0.5671, test_loss: 0.9921, test_f1: 0.6560
 epoch: 59, train_loss: 0.5864, test_loss: 0.8847, test_f1: 0.6606
 epoch: 60, train_loss: 0.5828, test_loss: 0.8572, test_f1: 0.6556
 epoch: 61, train_loss: 0.5811, test_loss: 0.9629, test_f1: 0.6579
 epoch: 62, train_loss: 0.5833, test_loss: 0.9070, test_f1: 0.6612
 epoch: 63, train_loss: 0.5542, test_loss: 0.9389, test_f1: 0.6718
 epoch: 64, train_loss: 0.5500, test_loss: 0.9905, test_f1: 0.6730
 epoch: 65, train_loss: 0.5597, test_loss: 0.8524, test_f1: 0.6871
 epoch: 66, train_loss: 0.5639, test_loss: 0.9294, test_f1: 0.6620
 epoch: 67, train_loss: 0.5556, test_loss: 0.8726, test_f1: 0.6554
 epoch: 68, train_loss: 0.5728, test_loss: 0.9426, test_f1: 0.6365
 epoch: 69, train_loss: 0.5647, test_loss: 0.9782, test_f1: 0.6444
 epoch: 70, train_loss: 0.5570, test_loss: 0.9523, test_f1: 0.6767
 epoch: 71, train_loss: 0.5612, test_loss: 0.9446, test_f1: 0.6880
 epoch: 72, train_loss: 0.5656, test_loss: 0.9516, test_f1: 0.6673
 epoch: 73, train_loss: 0.5614, test_loss: 1.0400, test_f1: 0.6678
 epoch: 74, train_loss: 0.5595, test_loss: 0.9532, test_f1: 0.6667
 epoch: 75, train_loss: 0.5495, test_loss: 0.9651, test_f1: 0.6416
 epoch: 76, train_loss: 0.5438, test_loss: 0.9945, test_f1: 0.6489
 epoch: 77, train_loss: 0.5386, test_loss: 0.9019, test_f1: 0.6942
 epoch: 78, train_loss: 0.5415, test_loss: 0.9916, test_f1: 0.6597
 epoch: 79, train_loss: 0.5538, test_loss: 1.0432, test_f1: 0.6526
 epoch: 80, train_loss: 0.5419, test_loss: 0.9064, test_f1: 0.7053
 epoch: 81, train_loss: 0.5267, test_loss: 0.9568, test_f1: 0.6674
 epoch: 82, train_loss: 0.5401, test_loss: 0.9922, test_f1: 0.6836
 epoch: 83, train_loss: 0.5228, test_loss: 0.9298, test_f1: 0.6418
 epoch: 84, train_loss: 0.5271, test_loss: 1.0071, test_f1: 0.6823
 epoch: 85, train_loss: 0.5301, test_loss: 0.9528, test_f1: 0.6835
 epoch: 86, train_loss: 0.5384, test_loss: 0.9753, test_f1: 0.6774
 epoch: 87, train_loss: 0.5208, test_loss: 0.9974, test_f1: 0.6618
 epoch: 88, train_loss: 0.5375, test_loss: 1.0150, test_f1: 0.6422
 epoch: 89, train_loss: 0.5304, test_loss: 1.0031, test_f1: 0.6642
 epoch: 90, train_loss: 0.5155, test_loss: 0.8904, test_f1: 0.6868
 epoch: 91, train_loss: 0.5332, test_loss: 0.9876, test_f1: 0.6879
 epoch: 92, train_loss: 0.5129, test_loss: 0.9676, test_f1: 0.6917
 epoch: 93, train_loss: 0.5054, test_loss: 1.0211, test_f1: 0.6737
 epoch: 94, train_loss: 0.5143, test_loss: 1.0311, test_f1: 0.6749
 epoch: 95, train_loss: 0.5076, test_loss: 1.0366, test_f1: 0.6969
 epoch: 96, train_loss: 0.4966, test_loss: 0.9045, test_f1: 0.6815
 epoch: 97, train_loss: 0.5219, test_loss: 1.0032, test_f1: 0.6614
 epoch: 98, train_loss: 0.5106, test_loss: 1.0800, test_f1: 0.6603
 epoch: 99, train_loss: 0.4970, test_loss: 1.0129, test_f1: 0.6676
##################ITERATION #6 ****************************************
 epoch: 0, train_loss: 1.2240, test_loss: 0.9446, test_f1: 0.4942
 epoch: 1, train_loss: 1.0063, test_loss: 0.9452, test_f1: 0.5092
 epoch: 2, train_loss: 0.9737, test_loss: 0.9177, test_f1: 0.5155
 epoch: 3, train_loss: 0.9426, test_loss: 0.8817, test_f1: 0.5409
 epoch: 4, train_loss: 0.9352, test_loss: 0.8987, test_f1: 0.5283
 epoch: 5, train_loss: 0.9036, test_loss: 0.8708, test_f1: 0.5598
 epoch: 6, train_loss: 0.8977, test_loss: 0.8501, test_f1: 0.5341
 epoch: 7, train_loss: 0.8872, test_loss: 0.8739, test_f1: 0.5428
 epoch: 8, train_loss: 0.8718, test_loss: 0.8344, test_f1: 0.5644
 epoch: 9, train_loss: 0.8638, test_loss: 0.8340, test_f1: 0.6029
 epoch: 10, train_loss: 0.8510, test_loss: 0.8662, test_f1: 0.5716
 epoch: 11, train_loss: 0.8442, test_loss: 0.8650, test_f1: 0.5825
 epoch: 12, train_loss: 0.8362, test_loss: 0.8407, test_f1: 0.5996
 epoch: 13, train_loss: 0.8173, test_loss: 0.8504, test_f1: 0.5847
 epoch: 14, train_loss: 0.8165, test_loss: 0.8428, test_f1: 0.6117
 epoch: 15, train_loss: 0.8054, test_loss: 0.7887, test_f1: 0.6176
 epoch: 16, train_loss: 0.8038, test_loss: 0.7698, test_f1: 0.6452
 epoch: 17, train_loss: 0.7746, test_loss: 0.7629, test_f1: 0.6465
 epoch: 18, train_loss: 0.7806, test_loss: 0.8656, test_f1: 0.6090
 epoch: 19, train_loss: 0.7586, test_loss: 0.7498, test_f1: 0.6320
 epoch: 20, train_loss: 0.7855, test_loss: 0.8205, test_f1: 0.6195
 epoch: 21, train_loss: 0.7519, test_loss: 0.8105, test_f1: 0.6289
 epoch: 22, train_loss: 0.7481, test_loss: 0.7959, test_f1: 0.6160
 epoch: 23, train_loss: 0.7284, test_loss: 0.7882, test_f1: 0.6254
 epoch: 24, train_loss: 0.7365, test_loss: 0.7419, test_f1: 0.6538
 epoch: 25, train_loss: 0.7190, test_loss: 0.7823, test_f1: 0.6149
 epoch: 26, train_loss: 0.7053, test_loss: 0.7844, test_f1: 0.6367
 epoch: 27, train_loss: 0.7266, test_loss: 0.7927, test_f1: 0.6350
 epoch: 28, train_loss: 0.7151, test_loss: 0.7978, test_f1: 0.6571
 epoch: 29, train_loss: 0.7242, test_loss: 0.7478, test_f1: 0.6470
 epoch: 30, train_loss: 0.7128, test_loss: 0.8113, test_f1: 0.6352
 epoch: 31, train_loss: 0.6917, test_loss: 0.7513, test_f1: 0.6448
 epoch: 32, train_loss: 0.7008, test_loss: 0.7840, test_f1: 0.6390
 epoch: 33, train_loss: 0.7037, test_loss: 0.7633, test_f1: 0.6595
 epoch: 34, train_loss: 0.6938, test_loss: 0.8000, test_f1: 0.6434
 epoch: 35, train_loss: 0.6896, test_loss: 0.7328, test_f1: 0.6820
 epoch: 36, train_loss: 0.6715, test_loss: 0.7754, test_f1: 0.6714
 epoch: 37, train_loss: 0.6655, test_loss: 0.7469, test_f1: 0.6697
 epoch: 38, train_loss: 0.6761, test_loss: 0.8481, test_f1: 0.6197
 epoch: 39, train_loss: 0.6701, test_loss: 0.7806, test_f1: 0.6766
 epoch: 40, train_loss: 0.6413, test_loss: 0.7767, test_f1: 0.6663
 epoch: 41, train_loss: 0.6440, test_loss: 0.8442, test_f1: 0.6459
 epoch: 42, train_loss: 0.6672, test_loss: 0.7930, test_f1: 0.6515
 epoch: 43, train_loss: 0.6461, test_loss: 0.7688, test_f1: 0.6649
 epoch: 44, train_loss: 0.6485, test_loss: 0.7677, test_f1: 0.6563
 epoch: 45, train_loss: 0.6458, test_loss: 0.7758, test_f1: 0.6469
 epoch: 46, train_loss: 0.6386, test_loss: 0.8118, test_f1: 0.6363
 epoch: 47, train_loss: 0.6360, test_loss: 0.7987, test_f1: 0.6510
 epoch: 48, train_loss: 0.6332, test_loss: 0.7802, test_f1: 0.6375
 epoch: 49, train_loss: 0.6270, test_loss: 0.8213, test_f1: 0.6359
 epoch: 50, train_loss: 0.6224, test_loss: 0.8210, test_f1: 0.6428
 epoch: 51, train_loss: 0.6050, test_loss: 0.7980, test_f1: 0.6566
 epoch: 52, train_loss: 0.5697, test_loss: 0.7634, test_f1: 0.6591
 epoch: 53, train_loss: 0.5734, test_loss: 0.7668, test_f1: 0.6716
 epoch: 54, train_loss: 0.5760, test_loss: 0.7856, test_f1: 0.6605
 epoch: 55, train_loss: 0.5676, test_loss: 0.7738, test_f1: 0.6676
 epoch: 56, train_loss: 0.5705, test_loss: 0.8054, test_f1: 0.6608
 epoch: 57, train_loss: 0.5414, test_loss: 0.7916, test_f1: 0.6502
 epoch: 58, train_loss: 0.5636, test_loss: 0.8187, test_f1: 0.6679
 epoch: 59, train_loss: 0.5625, test_loss: 0.8309, test_f1: 0.6670
 epoch: 60, train_loss: 0.5429, test_loss: 0.8229, test_f1: 0.6785
 epoch: 61, train_loss: 0.5551, test_loss: 0.7808, test_f1: 0.6702
 epoch: 62, train_loss: 0.5450, test_loss: 0.7748, test_f1: 0.6663
 epoch: 63, train_loss: 0.5350, test_loss: 0.8278, test_f1: 0.6549
 epoch: 64, train_loss: 0.5376, test_loss: 0.7966, test_f1: 0.6608
 epoch: 65, train_loss: 0.5304, test_loss: 0.8255, test_f1: 0.6741
 epoch: 66, train_loss: 0.5241, test_loss: 0.8845, test_f1: 0.6637
 epoch: 67, train_loss: 0.5473, test_loss: 0.8330, test_f1: 0.6499
 epoch: 68, train_loss: 0.5348, test_loss: 0.8383, test_f1: 0.6608
 epoch: 69, train_loss: 0.5414, test_loss: 0.8386, test_f1: 0.6601
 epoch: 70, train_loss: 0.5406, test_loss: 0.8383, test_f1: 0.6709
 epoch: 71, train_loss: 0.5252, test_loss: 0.8414, test_f1: 0.6832
 epoch: 72, train_loss: 0.5379, test_loss: 0.8602, test_f1: 0.6628
 epoch: 73, train_loss: 0.5268, test_loss: 0.9102, test_f1: 0.6726
 epoch: 74, train_loss: 0.5271, test_loss: 0.8190, test_f1: 0.6723
 epoch: 75, train_loss: 0.5255, test_loss: 0.8706, test_f1: 0.6432
 epoch: 76, train_loss: 0.5131, test_loss: 0.8651, test_f1: 0.6759
 epoch: 77, train_loss: 0.5001, test_loss: 0.8337, test_f1: 0.6727
 epoch: 78, train_loss: 0.5132, test_loss: 0.8668, test_f1: 0.6621
 epoch: 79, train_loss: 0.5106, test_loss: 0.8627, test_f1: 0.6791
 epoch: 80, train_loss: 0.4990, test_loss: 0.8647, test_f1: 0.6893
 epoch: 81, train_loss: 0.5041, test_loss: 0.8612, test_f1: 0.6783
 epoch: 82, train_loss: 0.5156, test_loss: 0.8089, test_f1: 0.6851
 epoch: 83, train_loss: 0.5035, test_loss: 0.8717, test_f1: 0.6570
 epoch: 84, train_loss: 0.4898, test_loss: 0.8643, test_f1: 0.6816
 epoch: 85, train_loss: 0.5103, test_loss: 0.8833, test_f1: 0.6591
 epoch: 86, train_loss: 0.4983, test_loss: 0.8856, test_f1: 0.6795
 epoch: 87, train_loss: 0.4909, test_loss: 0.8910, test_f1: 0.6757
 epoch: 88, train_loss: 0.5034, test_loss: 0.9079, test_f1: 0.6694
 epoch: 89, train_loss: 0.4973, test_loss: 0.9272, test_f1: 0.6582
 epoch: 90, train_loss: 0.4931, test_loss: 0.9034, test_f1: 0.6776
 epoch: 91, train_loss: 0.4783, test_loss: 0.8868, test_f1: 0.6661
 epoch: 92, train_loss: 0.4744, test_loss: 0.8868, test_f1: 0.6944
 epoch: 93, train_loss: 0.4897, test_loss: 0.9281, test_f1: 0.6657
 epoch: 94, train_loss: 0.4889, test_loss: 0.9022, test_f1: 0.6883
 epoch: 95, train_loss: 0.4709, test_loss: 0.8854, test_f1: 0.6845
 epoch: 96, train_loss: 0.4812, test_loss: 0.9065, test_f1: 0.6624
 epoch: 97, train_loss: 0.4703, test_loss: 0.9622, test_f1: 0.6591
 epoch: 98, train_loss: 0.4645, test_loss: 0.9419, test_f1: 0.6853
 epoch: 99, train_loss: 0.4748, test_loss: 0.9182, test_f1: 0.6660
##################ITERATION #7 ****************************************
 epoch: 0, train_loss: 1.2658, test_loss: 1.0348, test_f1: 0.3817
 epoch: 1, train_loss: 1.0417, test_loss: 0.9641, test_f1: 0.4689
 epoch: 2, train_loss: 0.9901, test_loss: 0.9355, test_f1: 0.5206
 epoch: 3, train_loss: 0.9867, test_loss: 0.9402, test_f1: 0.5228
 epoch: 4, train_loss: 0.9614, test_loss: 0.9366, test_f1: 0.5056
 epoch: 5, train_loss: 0.9477, test_loss: 0.9430, test_f1: 0.5276
 epoch: 6, train_loss: 0.9373, test_loss: 0.9597, test_f1: 0.5385
 epoch: 7, train_loss: 0.9085, test_loss: 0.9324, test_f1: 0.5287
 epoch: 8, train_loss: 0.9021, test_loss: 0.8986, test_f1: 0.5534
 epoch: 9, train_loss: 0.8907, test_loss: 0.8536, test_f1: 0.5640
 epoch: 10, train_loss: 0.8867, test_loss: 0.9134, test_f1: 0.5490
 epoch: 11, train_loss: 0.8756, test_loss: 0.8960, test_f1: 0.5530
 epoch: 12, train_loss: 0.8729, test_loss: 0.9036, test_f1: 0.5313
 epoch: 13, train_loss: 0.8562, test_loss: 0.8663, test_f1: 0.5373
 epoch: 14, train_loss: 0.8349, test_loss: 0.8671, test_f1: 0.5767
 epoch: 15, train_loss: 0.8387, test_loss: 0.8538, test_f1: 0.5661
 epoch: 16, train_loss: 0.8417, test_loss: 0.8865, test_f1: 0.5619
 epoch: 17, train_loss: 0.8194, test_loss: 0.8472, test_f1: 0.5869
 epoch: 18, train_loss: 0.8215, test_loss: 0.8229, test_f1: 0.5734
 epoch: 19, train_loss: 0.8339, test_loss: 0.9191, test_f1: 0.5855
 epoch: 20, train_loss: 0.8071, test_loss: 0.7983, test_f1: 0.5903
 epoch: 21, train_loss: 0.7994, test_loss: 0.8290, test_f1: 0.5816
 epoch: 22, train_loss: 0.7905, test_loss: 0.8319, test_f1: 0.6001
 epoch: 23, train_loss: 0.7809, test_loss: 0.8404, test_f1: 0.5842
 epoch: 24, train_loss: 0.7872, test_loss: 0.8328, test_f1: 0.5810
 epoch: 25, train_loss: 0.7677, test_loss: 0.8201, test_f1: 0.6006
 epoch: 26, train_loss: 0.7609, test_loss: 0.8086, test_f1: 0.6313
 epoch: 27, train_loss: 0.7666, test_loss: 0.8024, test_f1: 0.5936
 epoch: 28, train_loss: 0.7645, test_loss: 0.7759, test_f1: 0.6122
 epoch: 29, train_loss: 0.7598, test_loss: 0.7677, test_f1: 0.6169
 epoch: 30, train_loss: 0.7446, test_loss: 0.7452, test_f1: 0.6149
 epoch: 31, train_loss: 0.7378, test_loss: 0.7190, test_f1: 0.6540
 epoch: 32, train_loss: 0.7375, test_loss: 0.8727, test_f1: 0.6246
 epoch: 33, train_loss: 0.7266, test_loss: 0.7814, test_f1: 0.6619
 epoch: 34, train_loss: 0.7135, test_loss: 0.7961, test_f1: 0.6238
 epoch: 35, train_loss: 0.7182, test_loss: 0.7178, test_f1: 0.6419
 epoch: 36, train_loss: 0.7045, test_loss: 0.7618, test_f1: 0.6708
 epoch: 37, train_loss: 0.7082, test_loss: 0.7665, test_f1: 0.6540
 epoch: 38, train_loss: 0.6958, test_loss: 0.7573, test_f1: 0.6402
 epoch: 39, train_loss: 0.7053, test_loss: 0.7474, test_f1: 0.6422
 epoch: 40, train_loss: 0.7192, test_loss: 0.7253, test_f1: 0.6677
 epoch: 41, train_loss: 0.6937, test_loss: 0.7720, test_f1: 0.6268
 epoch: 42, train_loss: 0.6773, test_loss: 0.7635, test_f1: 0.6362
 epoch: 43, train_loss: 0.6809, test_loss: 0.7932, test_f1: 0.6232
 epoch: 44, train_loss: 0.6625, test_loss: 0.7914, test_f1: 0.6575
 epoch: 45, train_loss: 0.6842, test_loss: 0.8010, test_f1: 0.6760
 epoch: 46, train_loss: 0.6748, test_loss: 0.7729, test_f1: 0.6398
 epoch: 47, train_loss: 0.6574, test_loss: 0.7926, test_f1: 0.6525
 epoch: 48, train_loss: 0.6761, test_loss: 0.7442, test_f1: 0.6794
 epoch: 49, train_loss: 0.6607, test_loss: 0.7821, test_f1: 0.6527
 epoch: 50, train_loss: 0.6673, test_loss: 0.7782, test_f1: 0.6557
 epoch: 51, train_loss: 0.6324, test_loss: 0.7544, test_f1: 0.6825
 epoch: 52, train_loss: 0.6233, test_loss: 0.7967, test_f1: 0.6613
 epoch: 53, train_loss: 0.6150, test_loss: 0.7935, test_f1: 0.6649
 epoch: 54, train_loss: 0.6084, test_loss: 0.8507, test_f1: 0.6502
 epoch: 55, train_loss: 0.6158, test_loss: 0.7773, test_f1: 0.6593
 epoch: 56, train_loss: 0.6209, test_loss: 0.8499, test_f1: 0.6652
 epoch: 57, train_loss: 0.6275, test_loss: 0.8414, test_f1: 0.6637
 epoch: 58, train_loss: 0.6031, test_loss: 0.7995, test_f1: 0.6723
 epoch: 59, train_loss: 0.5907, test_loss: 0.7942, test_f1: 0.6516
 epoch: 60, train_loss: 0.5861, test_loss: 0.8647, test_f1: 0.6563
 epoch: 61, train_loss: 0.5920, test_loss: 0.8108, test_f1: 0.6787
 epoch: 62, train_loss: 0.6048, test_loss: 0.8165, test_f1: 0.6675
 epoch: 63, train_loss: 0.5933, test_loss: 0.8678, test_f1: 0.6629
 epoch: 64, train_loss: 0.5730, test_loss: 0.8244, test_f1: 0.6748
 epoch: 65, train_loss: 0.5735, test_loss: 0.8870, test_f1: 0.6779
 epoch: 66, train_loss: 0.5679, test_loss: 0.8927, test_f1: 0.6748
 epoch: 67, train_loss: 0.5717, test_loss: 0.9284, test_f1: 0.6628
 epoch: 68, train_loss: 0.5646, test_loss: 0.8536, test_f1: 0.6966
 epoch: 69, train_loss: 0.5546, test_loss: 0.8921, test_f1: 0.6559
 epoch: 70, train_loss: 0.5814, test_loss: 0.8490, test_f1: 0.6598
 epoch: 71, train_loss: 0.5615, test_loss: 0.9208, test_f1: 0.6599
 epoch: 72, train_loss: 0.5478, test_loss: 0.9291, test_f1: 0.6638
 epoch: 73, train_loss: 0.5500, test_loss: 0.9455, test_f1: 0.6463
 epoch: 74, train_loss: 0.5548, test_loss: 0.8751, test_f1: 0.6617
 epoch: 75, train_loss: 0.5387, test_loss: 0.8941, test_f1: 0.6636
 epoch: 76, train_loss: 0.5399, test_loss: 0.8854, test_f1: 0.6654
 epoch: 77, train_loss: 0.5551, test_loss: 0.9575, test_f1: 0.6517
 epoch: 78, train_loss: 0.5376, test_loss: 0.9373, test_f1: 0.6599
 epoch: 79, train_loss: 0.5334, test_loss: 0.9325, test_f1: 0.6701
 epoch: 80, train_loss: 0.5297, test_loss: 0.9390, test_f1: 0.6472
 epoch: 81, train_loss: 0.5203, test_loss: 1.0159, test_f1: 0.6512
 epoch: 82, train_loss: 0.5471, test_loss: 1.0209, test_f1: 0.6465
 epoch: 83, train_loss: 0.5248, test_loss: 0.9458, test_f1: 0.6540
 epoch: 84, train_loss: 0.5240, test_loss: 0.9655, test_f1: 0.6749
 epoch: 85, train_loss: 0.5237, test_loss: 0.8996, test_f1: 0.6896
 epoch: 86, train_loss: 0.5371, test_loss: 1.0036, test_f1: 0.6791
 epoch: 87, train_loss: 0.5238, test_loss: 1.0034, test_f1: 0.6526
 epoch: 88, train_loss: 0.5169, test_loss: 1.0265, test_f1: 0.6540
 epoch: 89, train_loss: 0.5064, test_loss: 1.0355, test_f1: 0.6269
 epoch: 90, train_loss: 0.5490, test_loss: 1.0309, test_f1: 0.6457
 epoch: 91, train_loss: 0.5132, test_loss: 0.9854, test_f1: 0.6277
 epoch: 92, train_loss: 0.5122, test_loss: 1.0101, test_f1: 0.6611
 epoch: 93, train_loss: 0.5066, test_loss: 1.0023, test_f1: 0.6357
 epoch: 94, train_loss: 0.5010, test_loss: 1.0599, test_f1: 0.6733
 epoch: 95, train_loss: 0.4854, test_loss: 1.0682, test_f1: 0.6661
 epoch: 96, train_loss: 0.4985, test_loss: 1.0079, test_f1: 0.6760
 epoch: 97, train_loss: 0.4831, test_loss: 1.1211, test_f1: 0.6341
 epoch: 98, train_loss: 0.4942, test_loss: 1.0589, test_f1: 0.6946
 epoch: 99, train_loss: 0.4952, test_loss: 1.0165, test_f1: 0.6592
##################ITERATION #8 ****************************************
 epoch: 0, train_loss: 1.2188, test_loss: 1.0373, test_f1: 0.4793
 epoch: 1, train_loss: 1.0280, test_loss: 0.9646, test_f1: 0.5043
 epoch: 2, train_loss: 0.9893, test_loss: 0.9723, test_f1: 0.4886
 epoch: 3, train_loss: 0.9580, test_loss: 0.9263, test_f1: 0.5265
 epoch: 4, train_loss: 0.9533, test_loss: 0.9432, test_f1: 0.4806
 epoch: 5, train_loss: 0.9239, test_loss: 0.9239, test_f1: 0.5537
 epoch: 6, train_loss: 0.9298, test_loss: 0.8858, test_f1: 0.5353
 epoch: 7, train_loss: 0.8977, test_loss: 0.9130, test_f1: 0.5291
 epoch: 8, train_loss: 0.8916, test_loss: 0.8815, test_f1: 0.5564
 epoch: 9, train_loss: 0.9067, test_loss: 0.8596, test_f1: 0.5385
 epoch: 10, train_loss: 0.8771, test_loss: 0.8331, test_f1: 0.5505
 epoch: 11, train_loss: 0.8583, test_loss: 0.8750, test_f1: 0.5651
 epoch: 12, train_loss: 0.8433, test_loss: 0.8414, test_f1: 0.5620
 epoch: 13, train_loss: 0.8191, test_loss: 0.7800, test_f1: 0.5778
 epoch: 14, train_loss: 0.8372, test_loss: 0.7621, test_f1: 0.6269
 epoch: 15, train_loss: 0.8186, test_loss: 0.8507, test_f1: 0.5794
 epoch: 16, train_loss: 0.8215, test_loss: 0.8507, test_f1: 0.5973
 epoch: 17, train_loss: 0.8265, test_loss: 0.8408, test_f1: 0.5967
 epoch: 18, train_loss: 0.7964, test_loss: 0.8191, test_f1: 0.6291
 epoch: 19, train_loss: 0.7709, test_loss: 0.8733, test_f1: 0.5986
 epoch: 20, train_loss: 0.7819, test_loss: 0.8303, test_f1: 0.6236
 epoch: 21, train_loss: 0.7546, test_loss: 0.8335, test_f1: 0.6487
 epoch: 22, train_loss: 0.7604, test_loss: 0.8286, test_f1: 0.6341
 epoch: 23, train_loss: 0.7548, test_loss: 0.8359, test_f1: 0.5937
 epoch: 24, train_loss: 0.7453, test_loss: 0.7427, test_f1: 0.6210
 epoch: 25, train_loss: 0.7372, test_loss: 0.8563, test_f1: 0.6094
 epoch: 26, train_loss: 0.7424, test_loss: 0.8003, test_f1: 0.6280
 epoch: 27, train_loss: 0.7311, test_loss: 0.8281, test_f1: 0.6258
 epoch: 28, train_loss: 0.7299, test_loss: 0.8058, test_f1: 0.6426
 epoch: 29, train_loss: 0.7187, test_loss: 0.8061, test_f1: 0.6370
 epoch: 30, train_loss: 0.6990, test_loss: 0.7711, test_f1: 0.6480
 epoch: 31, train_loss: 0.7050, test_loss: 0.7270, test_f1: 0.6615
 epoch: 32, train_loss: 0.7045, test_loss: 0.8016, test_f1: 0.6622
 epoch: 33, train_loss: 0.6874, test_loss: 0.7804, test_f1: 0.6582
 epoch: 34, train_loss: 0.6900, test_loss: 0.8006, test_f1: 0.6311
 epoch: 35, train_loss: 0.6941, test_loss: 0.7770, test_f1: 0.6300
 epoch: 36, train_loss: 0.6821, test_loss: 0.8302, test_f1: 0.6253
 epoch: 37, train_loss: 0.6983, test_loss: 0.7721, test_f1: 0.6768
 epoch: 38, train_loss: 0.6796, test_loss: 0.8402, test_f1: 0.6608
 epoch: 39, train_loss: 0.6762, test_loss: 0.8863, test_f1: 0.6370
 epoch: 40, train_loss: 0.6648, test_loss: 0.8048, test_f1: 0.6445
 epoch: 41, train_loss: 0.6446, test_loss: 0.8075, test_f1: 0.6344
 epoch: 42, train_loss: 0.6619, test_loss: 0.7756, test_f1: 0.6431
 epoch: 43, train_loss: 0.6513, test_loss: 0.8268, test_f1: 0.6457
 epoch: 44, train_loss: 0.6435, test_loss: 0.8443, test_f1: 0.6317
 epoch: 45, train_loss: 0.6369, test_loss: 0.8201, test_f1: 0.6511
 epoch: 46, train_loss: 0.6449, test_loss: 0.9069, test_f1: 0.6246
 epoch: 47, train_loss: 0.6286, test_loss: 0.8397, test_f1: 0.6600
 epoch: 48, train_loss: 0.6428, test_loss: 0.8503, test_f1: 0.6306
 epoch: 49, train_loss: 0.6521, test_loss: 0.7928, test_f1: 0.6457
 epoch: 50, train_loss: 0.6347, test_loss: 0.8130, test_f1: 0.6308
 epoch: 51, train_loss: 0.6061, test_loss: 0.7836, test_f1: 0.6596
 epoch: 52, train_loss: 0.5971, test_loss: 0.7949, test_f1: 0.6618
 epoch: 53, train_loss: 0.5776, test_loss: 0.7755, test_f1: 0.6403
 epoch: 54, train_loss: 0.5751, test_loss: 0.7714, test_f1: 0.6595
 epoch: 55, train_loss: 0.5795, test_loss: 0.8104, test_f1: 0.6563
 epoch: 56, train_loss: 0.5571, test_loss: 0.8215, test_f1: 0.6566
 epoch: 57, train_loss: 0.5655, test_loss: 0.8307, test_f1: 0.6501
 epoch: 58, train_loss: 0.5689, test_loss: 0.7980, test_f1: 0.6767
 epoch: 59, train_loss: 0.5652, test_loss: 0.8082, test_f1: 0.6627
 epoch: 60, train_loss: 0.5560, test_loss: 0.8343, test_f1: 0.6485
 epoch: 61, train_loss: 0.5511, test_loss: 0.8363, test_f1: 0.6610
 epoch: 62, train_loss: 0.5433, test_loss: 0.8415, test_f1: 0.6755
 epoch: 63, train_loss: 0.5639, test_loss: 0.8732, test_f1: 0.6669
 epoch: 64, train_loss: 0.5495, test_loss: 0.8980, test_f1: 0.6678
 epoch: 65, train_loss: 0.5427, test_loss: 0.9166, test_f1: 0.6415
 epoch: 66, train_loss: 0.5508, test_loss: 0.8846, test_f1: 0.6668
 epoch: 67, train_loss: 0.5217, test_loss: 0.8783, test_f1: 0.6543
 epoch: 68, train_loss: 0.5389, test_loss: 0.9075, test_f1: 0.6554
 epoch: 69, train_loss: 0.5367, test_loss: 0.9375, test_f1: 0.6739
 epoch: 70, train_loss: 0.5263, test_loss: 0.9627, test_f1: 0.6563
 epoch: 71, train_loss: 0.5374, test_loss: 0.8995, test_f1: 0.6747
 epoch: 72, train_loss: 0.5387, test_loss: 0.9021, test_f1: 0.6725
 epoch: 73, train_loss: 0.5189, test_loss: 0.9311, test_f1: 0.6608
 epoch: 74, train_loss: 0.5171, test_loss: 0.9128, test_f1: 0.6803
 epoch: 75, train_loss: 0.5142, test_loss: 0.9048, test_f1: 0.6728
 epoch: 76, train_loss: 0.5209, test_loss: 0.9483, test_f1: 0.6776
 epoch: 77, train_loss: 0.5139, test_loss: 0.9889, test_f1: 0.6756
 epoch: 78, train_loss: 0.5185, test_loss: 0.9295, test_f1: 0.6589
 epoch: 79, train_loss: 0.5137, test_loss: 0.9678, test_f1: 0.6669
 epoch: 80, train_loss: 0.5315, test_loss: 0.9433, test_f1: 0.6771
 epoch: 81, train_loss: 0.5059, test_loss: 0.8923, test_f1: 0.6632
 epoch: 82, train_loss: 0.5191, test_loss: 0.8848, test_f1: 0.6908
 epoch: 83, train_loss: 0.4961, test_loss: 0.9003, test_f1: 0.6757
 epoch: 84, train_loss: 0.4862, test_loss: 0.9411, test_f1: 0.6887
 epoch: 85, train_loss: 0.5015, test_loss: 0.9656, test_f1: 0.6624
 epoch: 86, train_loss: 0.5012, test_loss: 0.9403, test_f1: 0.6818
 epoch: 87, train_loss: 0.4846, test_loss: 0.9181, test_f1: 0.6847
 epoch: 88, train_loss: 0.4951, test_loss: 0.9983, test_f1: 0.6797
 epoch: 89, train_loss: 0.4840, test_loss: 0.9593, test_f1: 0.6898
 epoch: 90, train_loss: 0.5018, test_loss: 0.8932, test_f1: 0.6724
 epoch: 91, train_loss: 0.4748, test_loss: 0.9788, test_f1: 0.6667
 epoch: 92, train_loss: 0.4917, test_loss: 0.9428, test_f1: 0.6722
 epoch: 93, train_loss: 0.4964, test_loss: 0.9812, test_f1: 0.6623
 epoch: 94, train_loss: 0.4974, test_loss: 0.9633, test_f1: 0.6608
 epoch: 95, train_loss: 0.4860, test_loss: 0.9819, test_f1: 0.6756
 epoch: 96, train_loss: 0.4842, test_loss: 0.9736, test_f1: 0.6729
 epoch: 97, train_loss: 0.4800, test_loss: 0.9790, test_f1: 0.6652
 epoch: 98, train_loss: 0.4717, test_loss: 1.0265, test_f1: 0.6820
 epoch: 99, train_loss: 0.4888, test_loss: 0.9972, test_f1: 0.6755
##################ITERATION #9 ****************************************
 epoch: 0, train_loss: 1.2217, test_loss: 1.0546, test_f1: 0.4528
 epoch: 1, train_loss: 1.0373, test_loss: 0.9948, test_f1: 0.4939
 epoch: 2, train_loss: 1.0108, test_loss: 0.9786, test_f1: 0.4906
 epoch: 3, train_loss: 0.9827, test_loss: 0.9215, test_f1: 0.5057
 epoch: 4, train_loss: 0.9574, test_loss: 0.8987, test_f1: 0.5261
 epoch: 5, train_loss: 0.9485, test_loss: 0.9462, test_f1: 0.5153
 epoch: 6, train_loss: 0.9457, test_loss: 0.9619, test_f1: 0.5174
 epoch: 7, train_loss: 0.9427, test_loss: 0.9451, test_f1: 0.5052
 epoch: 8, train_loss: 0.9281, test_loss: 0.8953, test_f1: 0.5326
 epoch: 9, train_loss: 0.9340, test_loss: 0.8706, test_f1: 0.5604
 epoch: 10, train_loss: 0.9004, test_loss: 0.8860, test_f1: 0.5466
 epoch: 11, train_loss: 0.9008, test_loss: 0.8452, test_f1: 0.5533
 epoch: 12, train_loss: 0.8891, test_loss: 0.9034, test_f1: 0.5376
 epoch: 13, train_loss: 0.8833, test_loss: 0.8818, test_f1: 0.5444
 epoch: 14, train_loss: 0.8616, test_loss: 0.8772, test_f1: 0.5684
 epoch: 15, train_loss: 0.8506, test_loss: 0.7987, test_f1: 0.5879
 epoch: 16, train_loss: 0.8451, test_loss: 0.8175, test_f1: 0.5796
 epoch: 17, train_loss: 0.8357, test_loss: 0.8155, test_f1: 0.5886
 epoch: 18, train_loss: 0.8369, test_loss: 0.8098, test_f1: 0.5730
 epoch: 19, train_loss: 0.8258, test_loss: 0.7762, test_f1: 0.5950
 epoch: 20, train_loss: 0.8131, test_loss: 0.8509, test_f1: 0.5585
 epoch: 21, train_loss: 0.8173, test_loss: 0.8438, test_f1: 0.5950
 epoch: 22, train_loss: 0.7972, test_loss: 0.8844, test_f1: 0.6064
 epoch: 23, train_loss: 0.8089, test_loss: 0.8688, test_f1: 0.6172
 epoch: 24, train_loss: 0.7717, test_loss: 0.8906, test_f1: 0.5734
 epoch: 25, train_loss: 0.7854, test_loss: 0.7833, test_f1: 0.6298
 epoch: 26, train_loss: 0.7735, test_loss: 0.7642, test_f1: 0.6252
 epoch: 27, train_loss: 0.7635, test_loss: 0.8061, test_f1: 0.6138
 epoch: 28, train_loss: 0.7647, test_loss: 0.8123, test_f1: 0.6249
 epoch: 29, train_loss: 0.7640, test_loss: 0.7015, test_f1: 0.6703
 epoch: 30, train_loss: 0.7578, test_loss: 0.8381, test_f1: 0.6121
 epoch: 31, train_loss: 0.7545, test_loss: 0.8250, test_f1: 0.6106
 epoch: 32, train_loss: 0.7501, test_loss: 0.7623, test_f1: 0.6670
 epoch: 33, train_loss: 0.7504, test_loss: 0.7719, test_f1: 0.6327
 epoch: 34, train_loss: 0.7211, test_loss: 0.7896, test_f1: 0.6475
 epoch: 35, train_loss: 0.7197, test_loss: 0.8020, test_f1: 0.6444
 epoch: 36, train_loss: 0.7222, test_loss: 0.8264, test_f1: 0.6406
 epoch: 37, train_loss: 0.7173, test_loss: 0.7882, test_f1: 0.6396
 epoch: 38, train_loss: 0.7071, test_loss: 0.7959, test_f1: 0.6663
 epoch: 39, train_loss: 0.7199, test_loss: 0.7919, test_f1: 0.6662
 epoch: 40, train_loss: 0.6966, test_loss: 0.7790, test_f1: 0.6567
 epoch: 41, train_loss: 0.7040, test_loss: 0.7425, test_f1: 0.6691
 epoch: 42, train_loss: 0.6944, test_loss: 0.7726, test_f1: 0.6842
 epoch: 43, train_loss: 0.6852, test_loss: 0.7630, test_f1: 0.6700
 epoch: 44, train_loss: 0.7000, test_loss: 0.7663, test_f1: 0.6590
 epoch: 45, train_loss: 0.6662, test_loss: 0.7916, test_f1: 0.6264
 epoch: 46, train_loss: 0.6763, test_loss: 0.7974, test_f1: 0.6654
 epoch: 47, train_loss: 0.6871, test_loss: 0.7532, test_f1: 0.6597
 epoch: 48, train_loss: 0.6623, test_loss: 0.7629, test_f1: 0.6668
 epoch: 49, train_loss: 0.6814, test_loss: 0.7284, test_f1: 0.6529
 epoch: 50, train_loss: 0.6497, test_loss: 0.7985, test_f1: 0.6502
 epoch: 51, train_loss: 0.6429, test_loss: 0.7657, test_f1: 0.6584
 epoch: 52, train_loss: 0.6300, test_loss: 0.7905, test_f1: 0.6776
 epoch: 53, train_loss: 0.6198, test_loss: 0.7908, test_f1: 0.6748
 epoch: 54, train_loss: 0.6154, test_loss: 0.7910, test_f1: 0.6613
 epoch: 55, train_loss: 0.6242, test_loss: 0.8104, test_f1: 0.6600
 epoch: 56, train_loss: 0.6116, test_loss: 0.7789, test_f1: 0.6511
 epoch: 57, train_loss: 0.6076, test_loss: 0.8065, test_f1: 0.6515
 epoch: 58, train_loss: 0.6165, test_loss: 0.8034, test_f1: 0.6556
 epoch: 59, train_loss: 0.6001, test_loss: 0.7779, test_f1: 0.6792
 epoch: 60, train_loss: 0.5990, test_loss: 0.8239, test_f1: 0.6500
 epoch: 61, train_loss: 0.6002, test_loss: 0.8224, test_f1: 0.6535
 epoch: 62, train_loss: 0.5963, test_loss: 0.8786, test_f1: 0.6690
 epoch: 63, train_loss: 0.6051, test_loss: 0.7837, test_f1: 0.6696
 epoch: 64, train_loss: 0.5880, test_loss: 0.8125, test_f1: 0.6612
 epoch: 65, train_loss: 0.5938, test_loss: 0.8408, test_f1: 0.6669
 epoch: 66, train_loss: 0.6004, test_loss: 0.8656, test_f1: 0.6682
 epoch: 67, train_loss: 0.5938, test_loss: 0.8350, test_f1: 0.6597
 epoch: 68, train_loss: 0.5916, test_loss: 0.8456, test_f1: 0.6516
 epoch: 69, train_loss: 0.5820, test_loss: 0.8018, test_f1: 0.6682
 epoch: 70, train_loss: 0.5719, test_loss: 0.8316, test_f1: 0.6431
 epoch: 71, train_loss: 0.5889, test_loss: 0.9261, test_f1: 0.6416
 epoch: 72, train_loss: 0.5751, test_loss: 0.8633, test_f1: 0.6452
 epoch: 73, train_loss: 0.5865, test_loss: 0.8181, test_f1: 0.6538
 epoch: 74, train_loss: 0.5884, test_loss: 0.8304, test_f1: 0.6715
 epoch: 75, train_loss: 0.5761, test_loss: 0.7868, test_f1: 0.6921
 epoch: 76, train_loss: 0.5788, test_loss: 0.8207, test_f1: 0.6554
 epoch: 77, train_loss: 0.5683, test_loss: 0.8414, test_f1: 0.6610
 epoch: 78, train_loss: 0.5802, test_loss: 0.8647, test_f1: 0.6682
 epoch: 79, train_loss: 0.5542, test_loss: 0.8877, test_f1: 0.6576
 epoch: 80, train_loss: 0.5746, test_loss: 0.8680, test_f1: 0.6522
 epoch: 81, train_loss: 0.5695, test_loss: 0.8473, test_f1: 0.6653
 epoch: 82, train_loss: 0.5741, test_loss: 0.8593, test_f1: 0.6618
 epoch: 83, train_loss: 0.5560, test_loss: 0.8936, test_f1: 0.6562
 epoch: 84, train_loss: 0.5551, test_loss: 0.8166, test_f1: 0.6573
 epoch: 85, train_loss: 0.5581, test_loss: 0.8597, test_f1: 0.6994
 epoch: 86, train_loss: 0.5625, test_loss: 0.8649, test_f1: 0.6572
 epoch: 87, train_loss: 0.5561, test_loss: 0.8345, test_f1: 0.6776
 epoch: 88, train_loss: 0.5565, test_loss: 0.8748, test_f1: 0.6680
 epoch: 89, train_loss: 0.5545, test_loss: 0.9011, test_f1: 0.6534
 epoch: 90, train_loss: 0.5457, test_loss: 0.8944, test_f1: 0.6728
 epoch: 91, train_loss: 0.5590, test_loss: 0.8468, test_f1: 0.6670
 epoch: 92, train_loss: 0.5547, test_loss: 0.8451, test_f1: 0.6439
 epoch: 93, train_loss: 0.5478, test_loss: 0.8632, test_f1: 0.6594
 epoch: 94, train_loss: 0.5535, test_loss: 0.9004, test_f1: 0.6680
 epoch: 95, train_loss: 0.5469, test_loss: 0.8986, test_f1: 0.6591
 epoch: 96, train_loss: 0.5402, test_loss: 0.8999, test_f1: 0.6573
 epoch: 97, train_loss: 0.5549, test_loss: 0.8824, test_f1: 0.6649
 epoch: 98, train_loss: 0.5318, test_loss: 0.8673, test_f1: 0.6740
 epoch: 99, train_loss: 0.5370, test_loss: 0.8975, test_f1: 0.6676

Training completed in 2262.21 seconds
Best F1: 0.7107 at epoch 97
Mean F1 across iterations: 0.6943  0.0104
========================FINAL RESULTS================================
FEGIN weighted F1: 0.7107  0.0104
python main.py --data ltspice_examples --representation component_pin_net --model FEGIN --layers 5 --hiddens 32 --batch_size 32 --lr 0.001 --emb_size 128 --epochs 100 --save_appendix component_pin_net_L5_H32_BS32_LR0.001_E128 --no_val
-----



STDERR:
  File "main.py", line 370, in <module>
    main()
  File "main.py", line 254, in main
    dataset = dataset_class(
  File "/home/philip/projects/ltspice_examples_code_repo/Circuit-Completion-Using-GNNs/component_classification_with_link_prediction_head/evaluation/FEGIN/kernel/circuit_datasets.py", line 15, in __init__
    self.data, self.slices = torch.load(self.processed_paths[0])
  File "/home/philip/.local/lib/python3.8/site-packages/torch/serialization.py", line 1040, in load
    warnings.warn(
  File "/usr/lib/python3.8/warnings.py", line 109, in _showwarnmsg
    sw(msg.message, msg.category, msg.filename, msg.lineno,
  File "main.py", line 47, in warn_with_traceback
    traceback.print_stack(file=log)
/home/philip/projects/ltspice_examples_code_repo/Circuit-Completion-Using-GNNs/component_classification_with_link_prediction_head/evaluation/FEGIN/kernel/circuit_datasets.py:15: FutureWarning: You are using `torch.load` with `weights_only=False` (the current default value), which uses the default pickle module implicitly. It is possible to construct malicious pickle data which will execute arbitrary code during unpickling (See https://github.com/pytorch/pytorch/blob/main/SECURITY.md#untrusted-models for more details). In a future release, the default value for `weights_only` will be flipped to `True`. This limits the functions that could be executed during unpickling. Arbitrary objects will no longer be allowed to be loaded via this mode unless they are explicitly allowlisted by the user via `torch.serialization.add_safe_globals`. We recommend you start setting `weights_only=True` for any use case where you don't have full control of the loaded file. Please open an issue on GitHub for any issues related to this experimental feature.
  self.data, self.slices = torch.load(self.processed_paths[0])
