STDOUT:
Results will be saved in /home/philip/projects/ltspice_examples_code_repo/Circuit-Completion-Using-GNNs/component_classification_with_link_prediction_head/evaluation/FEGIN/results/model_FEGIN_dataset_ltspice_demos
Command line input: python main.py --data ltspice_demos --representation component_pin_net --model FEGIN --layers 2 --hiddens 64 --batch_size 32 --lr 0.001 --emb_size 128 --epochs 100 --save_appendix component_pin_net_L2_H64_BS32_LR0.001_E128 --no_val
 is saved.
-----
ltspice_demos - FEGIN
Using 2 layers, 64 hidden units, h = 2
Loading component_pin_net representation dataset
ENTERED
Training FEGIN on component_pin_net representation
Train: 1565, Test: 383
##################ITERATION #0 ****************************************
 epoch: 0, train_loss: 1.2237, test_loss: 1.2949, test_f1: 0.3394
 epoch: 1, train_loss: 1.0480, test_loss: 1.0957, test_f1: 0.4481
 epoch: 2, train_loss: 1.0107, test_loss: 1.0756, test_f1: 0.4617
 epoch: 3, train_loss: 0.9808, test_loss: 1.0348, test_f1: 0.5000
 epoch: 4, train_loss: 0.9647, test_loss: 1.0556, test_f1: 0.4978
 epoch: 5, train_loss: 0.9430, test_loss: 1.0457, test_f1: 0.5470
 epoch: 6, train_loss: 0.9127, test_loss: 1.0440, test_f1: 0.5473
 epoch: 7, train_loss: 0.8984, test_loss: 0.9858, test_f1: 0.5677
 epoch: 8, train_loss: 0.8829, test_loss: 0.9939, test_f1: 0.5716
 epoch: 9, train_loss: 0.8584, test_loss: 0.9642, test_f1: 0.5746
 epoch: 10, train_loss: 0.8502, test_loss: 1.0289, test_f1: 0.5170
 epoch: 11, train_loss: 0.8324, test_loss: 0.9533, test_f1: 0.5879
 epoch: 12, train_loss: 0.8126, test_loss: 0.9331, test_f1: 0.6214
 epoch: 13, train_loss: 0.7878, test_loss: 0.9373, test_f1: 0.6183
 epoch: 14, train_loss: 0.7792, test_loss: 0.9368, test_f1: 0.6355
 epoch: 15, train_loss: 0.7487, test_loss: 0.9221, test_f1: 0.6111
 epoch: 16, train_loss: 0.7341, test_loss: 0.9297, test_f1: 0.6619
 epoch: 17, train_loss: 0.7305, test_loss: 0.9183, test_f1: 0.6377
 epoch: 18, train_loss: 0.7058, test_loss: 0.9882, test_f1: 0.5502
 epoch: 19, train_loss: 0.7065, test_loss: 0.9406, test_f1: 0.5641
 epoch: 20, train_loss: 0.6753, test_loss: 1.0447, test_f1: 0.5710
 epoch: 21, train_loss: 0.6729, test_loss: 1.0183, test_f1: 0.6162
 epoch: 22, train_loss: 0.6589, test_loss: 1.0218, test_f1: 0.5577
 epoch: 23, train_loss: 0.6504, test_loss: 1.0649, test_f1: 0.5461
 epoch: 24, train_loss: 0.6571, test_loss: 0.9774, test_f1: 0.5955
 epoch: 25, train_loss: 0.6347, test_loss: 0.9862, test_f1: 0.6562
 epoch: 26, train_loss: 0.6261, test_loss: 1.0286, test_f1: 0.6163
 epoch: 27, train_loss: 0.6146, test_loss: 0.9909, test_f1: 0.6626
 epoch: 28, train_loss: 0.5965, test_loss: 0.9993, test_f1: 0.6435
 epoch: 29, train_loss: 0.6083, test_loss: 1.0161, test_f1: 0.6350
 epoch: 30, train_loss: 0.5829, test_loss: 1.2198, test_f1: 0.5125
 epoch: 31, train_loss: 0.5739, test_loss: 1.1034, test_f1: 0.5934
 epoch: 32, train_loss: 0.5823, test_loss: 1.0673, test_f1: 0.6606
 epoch: 33, train_loss: 0.5464, test_loss: 1.1055, test_f1: 0.6124
 epoch: 34, train_loss: 0.5543, test_loss: 1.1179, test_f1: 0.6379
 epoch: 35, train_loss: 0.5341, test_loss: 1.1912, test_f1: 0.6139
 epoch: 36, train_loss: 0.5278, test_loss: 1.1961, test_f1: 0.5768
 epoch: 37, train_loss: 0.5300, test_loss: 1.2384, test_f1: 0.6515
 epoch: 38, train_loss: 0.5126, test_loss: 1.1033, test_f1: 0.6466
 epoch: 39, train_loss: 0.5222, test_loss: 1.3150, test_f1: 0.5918
 epoch: 40, train_loss: 0.4817, test_loss: 1.1877, test_f1: 0.6302
 epoch: 41, train_loss: 0.4936, test_loss: 1.2758, test_f1: 0.6250
 epoch: 42, train_loss: 0.5157, test_loss: 1.1060, test_f1: 0.5959
 epoch: 43, train_loss: 0.4661, test_loss: 1.1102, test_f1: 0.6167
 epoch: 44, train_loss: 0.4714, test_loss: 1.1190, test_f1: 0.6473
 epoch: 45, train_loss: 0.4342, test_loss: 1.2854, test_f1: 0.6517
 epoch: 46, train_loss: 0.4506, test_loss: 1.3377, test_f1: 0.6466
 epoch: 47, train_loss: 0.4466, test_loss: 1.3199, test_f1: 0.5848
 epoch: 48, train_loss: 0.4260, test_loss: 1.3225, test_f1: 0.6616
 epoch: 49, train_loss: 0.4406, test_loss: 1.2975, test_f1: 0.5981
 epoch: 50, train_loss: 0.4147, test_loss: 1.3162, test_f1: 0.6285
 epoch: 51, train_loss: 0.3790, test_loss: 1.3184, test_f1: 0.6134
 epoch: 52, train_loss: 0.3490, test_loss: 1.3470, test_f1: 0.6338
 epoch: 53, train_loss: 0.3680, test_loss: 1.4339, test_f1: 0.6527
 epoch: 54, train_loss: 0.3554, test_loss: 1.4924, test_f1: 0.6303
 epoch: 55, train_loss: 0.3353, test_loss: 1.3608, test_f1: 0.6590
 epoch: 56, train_loss: 0.3227, test_loss: 1.5274, test_f1: 0.6215
 epoch: 57, train_loss: 0.3258, test_loss: 1.5320, test_f1: 0.6279
 epoch: 58, train_loss: 0.3154, test_loss: 1.5368, test_f1: 0.6850
 epoch: 59, train_loss: 0.3050, test_loss: 1.4008, test_f1: 0.6239
 epoch: 60, train_loss: 0.3453, test_loss: 1.5939, test_f1: 0.6170
 epoch: 61, train_loss: 0.3021, test_loss: 1.6339, test_f1: 0.6287
 epoch: 62, train_loss: 0.3183, test_loss: 1.6390, test_f1: 0.6696
 epoch: 63, train_loss: 0.3246, test_loss: 1.6128, test_f1: 0.6579
 epoch: 64, train_loss: 0.2875, test_loss: 1.5569, test_f1: 0.6682
 epoch: 65, train_loss: 0.2983, test_loss: 1.6111, test_f1: 0.6693
 epoch: 66, train_loss: 0.2877, test_loss: 1.6410, test_f1: 0.6196
 epoch: 67, train_loss: 0.2871, test_loss: 1.6076, test_f1: 0.6719
 epoch: 68, train_loss: 0.2867, test_loss: 1.7683, test_f1: 0.5995
 epoch: 69, train_loss: 0.2779, test_loss: 1.7492, test_f1: 0.6373
 epoch: 70, train_loss: 0.2773, test_loss: 1.8176, test_f1: 0.6320
 epoch: 71, train_loss: 0.2825, test_loss: 1.8703, test_f1: 0.6193
 epoch: 72, train_loss: 0.2747, test_loss: 1.9031, test_f1: 0.6038
 epoch: 73, train_loss: 0.2739, test_loss: 1.8032, test_f1: 0.6011
 epoch: 74, train_loss: 0.2484, test_loss: 1.6750, test_f1: 0.6409
 epoch: 75, train_loss: 0.2524, test_loss: 2.0549, test_f1: 0.6011
 epoch: 76, train_loss: 0.2794, test_loss: 1.9343, test_f1: 0.6256
 epoch: 77, train_loss: 0.2635, test_loss: 1.8230, test_f1: 0.6429
 epoch: 78, train_loss: 0.2243, test_loss: 1.9667, test_f1: 0.6231
 epoch: 79, train_loss: 0.2614, test_loss: 1.9705, test_f1: 0.5796
 epoch: 80, train_loss: 0.2635, test_loss: 1.8819, test_f1: 0.6249
 epoch: 81, train_loss: 0.2378, test_loss: 2.0565, test_f1: 0.5980
 epoch: 82, train_loss: 0.2122, test_loss: 1.9204, test_f1: 0.6305
 epoch: 83, train_loss: 0.2120, test_loss: 1.9510, test_f1: 0.6300
 epoch: 84, train_loss: 0.2396, test_loss: 1.9131, test_f1: 0.6698
 epoch: 85, train_loss: 0.2386, test_loss: 2.2184, test_f1: 0.6022
 epoch: 86, train_loss: 0.2400, test_loss: 2.0487, test_f1: 0.6443
 epoch: 87, train_loss: 0.2392, test_loss: 2.1018, test_f1: 0.6327
 epoch: 88, train_loss: 0.2068, test_loss: 2.1205, test_f1: 0.6189
 epoch: 89, train_loss: 0.2129, test_loss: 2.3351, test_f1: 0.6417
 epoch: 90, train_loss: 0.2316, test_loss: 2.1236, test_f1: 0.6363
 epoch: 91, train_loss: 0.2216, test_loss: 2.1719, test_f1: 0.6040
 epoch: 92, train_loss: 0.2337, test_loss: 2.3854, test_f1: 0.6318
 epoch: 93, train_loss: 0.2161, test_loss: 2.2805, test_f1: 0.6233
 epoch: 94, train_loss: 0.2175, test_loss: 2.1888, test_f1: 0.6272
 epoch: 95, train_loss: 0.2153, test_loss: 2.2116, test_f1: 0.6010
 epoch: 96, train_loss: 0.2438, test_loss: 2.1689, test_f1: 0.6206
 epoch: 97, train_loss: 0.2147, test_loss: 2.4339, test_f1: 0.6126
 epoch: 98, train_loss: 0.1943, test_loss: 1.9739, test_f1: 0.6528
 epoch: 99, train_loss: 0.1923, test_loss: 2.3311, test_f1: 0.6062
##################ITERATION #1 ****************************************
 epoch: 0, train_loss: 1.1171, test_loss: 1.0989, test_f1: 0.5625
 epoch: 1, train_loss: 0.9707, test_loss: 1.0426, test_f1: 0.5563
 epoch: 2, train_loss: 0.9294, test_loss: 0.9917, test_f1: 0.5096
 epoch: 3, train_loss: 0.9016, test_loss: 0.9879, test_f1: 0.5892
 epoch: 4, train_loss: 0.8739, test_loss: 1.0128, test_f1: 0.5127
 epoch: 5, train_loss: 0.8512, test_loss: 0.9975, test_f1: 0.5944
 epoch: 6, train_loss: 0.8151, test_loss: 0.9760, test_f1: 0.5728
 epoch: 7, train_loss: 0.8001, test_loss: 0.9856, test_f1: 0.5718
 epoch: 8, train_loss: 0.7774, test_loss: 0.9772, test_f1: 0.5697
 epoch: 9, train_loss: 0.7665, test_loss: 0.9580, test_f1: 0.5951
 epoch: 10, train_loss: 0.7339, test_loss: 1.0166, test_f1: 0.5427
 epoch: 11, train_loss: 0.7365, test_loss: 1.1424, test_f1: 0.5055
 epoch: 12, train_loss: 0.7298, test_loss: 0.9931, test_f1: 0.5795
 epoch: 13, train_loss: 0.7249, test_loss: 0.9460, test_f1: 0.6118
 epoch: 14, train_loss: 0.6890, test_loss: 1.0058, test_f1: 0.6403
 epoch: 15, train_loss: 0.6945, test_loss: 0.9544, test_f1: 0.6060
 epoch: 16, train_loss: 0.6639, test_loss: 1.0252, test_f1: 0.6199
 epoch: 17, train_loss: 0.6720, test_loss: 1.0300, test_f1: 0.5613
 epoch: 18, train_loss: 0.6593, test_loss: 0.9436, test_f1: 0.6351
 epoch: 19, train_loss: 0.6422, test_loss: 0.9978, test_f1: 0.5857
 epoch: 20, train_loss: 0.6331, test_loss: 1.0542, test_f1: 0.6058
 epoch: 21, train_loss: 0.6457, test_loss: 0.9939, test_f1: 0.6116
 epoch: 22, train_loss: 0.6057, test_loss: 0.9752, test_f1: 0.6212
 epoch: 23, train_loss: 0.6235, test_loss: 1.0321, test_f1: 0.5858
 epoch: 24, train_loss: 0.6084, test_loss: 1.0347, test_f1: 0.5564
 epoch: 25, train_loss: 0.5989, test_loss: 0.9967, test_f1: 0.5671
 epoch: 26, train_loss: 0.5950, test_loss: 1.0534, test_f1: 0.6309
 epoch: 27, train_loss: 0.5955, test_loss: 1.0038, test_f1: 0.6098
 epoch: 28, train_loss: 0.5774, test_loss: 0.9884, test_f1: 0.6449
 epoch: 29, train_loss: 0.5547, test_loss: 1.0081, test_f1: 0.6277
 epoch: 30, train_loss: 0.5405, test_loss: 1.0282, test_f1: 0.6310
 epoch: 31, train_loss: 0.5846, test_loss: 1.0303, test_f1: 0.6073
 epoch: 32, train_loss: 0.5402, test_loss: 1.0217, test_f1: 0.6375
 epoch: 33, train_loss: 0.5704, test_loss: 1.1145, test_f1: 0.6042
 epoch: 34, train_loss: 0.5496, test_loss: 1.1041, test_f1: 0.5718
 epoch: 35, train_loss: 0.5486, test_loss: 1.0034, test_f1: 0.6013
 epoch: 36, train_loss: 0.5373, test_loss: 1.0273, test_f1: 0.6412
 epoch: 37, train_loss: 0.5245, test_loss: 1.0943, test_f1: 0.6218
 epoch: 38, train_loss: 0.5249, test_loss: 1.1449, test_f1: 0.6369
 epoch: 39, train_loss: 0.5159, test_loss: 1.2107, test_f1: 0.5565
 epoch: 40, train_loss: 0.4897, test_loss: 1.1367, test_f1: 0.6110
 epoch: 41, train_loss: 0.5080, test_loss: 1.0254, test_f1: 0.6510
 epoch: 42, train_loss: 0.5054, test_loss: 1.1751, test_f1: 0.6210
 epoch: 43, train_loss: 0.4988, test_loss: 1.0519, test_f1: 0.6501
 epoch: 44, train_loss: 0.4415, test_loss: 1.2204, test_f1: 0.6012
 epoch: 45, train_loss: 0.4576, test_loss: 1.1006, test_f1: 0.6435
 epoch: 46, train_loss: 0.4725, test_loss: 1.1102, test_f1: 0.6295
 epoch: 47, train_loss: 0.4738, test_loss: 1.1104, test_f1: 0.6149
 epoch: 48, train_loss: 0.4669, test_loss: 1.3266, test_f1: 0.5578
 epoch: 49, train_loss: 0.5002, test_loss: 1.3278, test_f1: 0.5659
 epoch: 50, train_loss: 0.4652, test_loss: 1.2791, test_f1: 0.6327
 epoch: 51, train_loss: 0.4171, test_loss: 1.1882, test_f1: 0.6227
 epoch: 52, train_loss: 0.4031, test_loss: 1.1882, test_f1: 0.6361
 epoch: 53, train_loss: 0.3939, test_loss: 1.2061, test_f1: 0.6218
 epoch: 54, train_loss: 0.3797, test_loss: 1.1755, test_f1: 0.6498
 epoch: 55, train_loss: 0.3692, test_loss: 1.1887, test_f1: 0.6373
 epoch: 56, train_loss: 0.3591, test_loss: 1.3165, test_f1: 0.6142
 epoch: 57, train_loss: 0.3689, test_loss: 1.1988, test_f1: 0.6396
 epoch: 58, train_loss: 0.3830, test_loss: 1.2715, test_f1: 0.6025
 epoch: 59, train_loss: 0.3660, test_loss: 1.1440, test_f1: 0.6591
 epoch: 60, train_loss: 0.3745, test_loss: 1.2981, test_f1: 0.6058
 epoch: 61, train_loss: 0.3721, test_loss: 1.2636, test_f1: 0.6505
 epoch: 62, train_loss: 0.3494, test_loss: 1.2323, test_f1: 0.6599
 epoch: 63, train_loss: 0.3401, test_loss: 1.4217, test_f1: 0.6024
 epoch: 64, train_loss: 0.3594, test_loss: 1.3609, test_f1: 0.6076
 epoch: 65, train_loss: 0.3413, test_loss: 1.2613, test_f1: 0.6473
 epoch: 66, train_loss: 0.3129, test_loss: 1.3665, test_f1: 0.6156
 epoch: 67, train_loss: 0.3609, test_loss: 1.3924, test_f1: 0.5884
 epoch: 68, train_loss: 0.3183, test_loss: 1.3575, test_f1: 0.6413
 epoch: 69, train_loss: 0.3134, test_loss: 1.3585, test_f1: 0.6233
 epoch: 70, train_loss: 0.3220, test_loss: 1.4197, test_f1: 0.6742
 epoch: 71, train_loss: 0.3303, test_loss: 1.3634, test_f1: 0.6565
 epoch: 72, train_loss: 0.2881, test_loss: 1.4429, test_f1: 0.6261
 epoch: 73, train_loss: 0.3255, test_loss: 1.5738, test_f1: 0.6083
 epoch: 74, train_loss: 0.3659, test_loss: 1.4589, test_f1: 0.6342
 epoch: 75, train_loss: 0.3218, test_loss: 1.3636, test_f1: 0.6577
 epoch: 76, train_loss: 0.3217, test_loss: 1.4308, test_f1: 0.6493
 epoch: 77, train_loss: 0.2689, test_loss: 1.5484, test_f1: 0.6164
 epoch: 78, train_loss: 0.3012, test_loss: 1.4447, test_f1: 0.6386
 epoch: 79, train_loss: 0.3477, test_loss: 1.4049, test_f1: 0.6064
 epoch: 80, train_loss: 0.2810, test_loss: 1.5185, test_f1: 0.6217
 epoch: 81, train_loss: 0.3122, test_loss: 1.5484, test_f1: 0.6223
 epoch: 82, train_loss: 0.3073, test_loss: 1.4593, test_f1: 0.6484
 epoch: 83, train_loss: 0.2869, test_loss: 1.4464, test_f1: 0.6398
 epoch: 84, train_loss: 0.2998, test_loss: 1.5378, test_f1: 0.6571
 epoch: 85, train_loss: 0.2920, test_loss: 1.4899, test_f1: 0.6302
 epoch: 86, train_loss: 0.2794, test_loss: 1.5817, test_f1: 0.6021
 epoch: 87, train_loss: 0.2809, test_loss: 1.6051, test_f1: 0.6215
 epoch: 88, train_loss: 0.2706, test_loss: 1.7682, test_f1: 0.5858
 epoch: 89, train_loss: 0.2784, test_loss: 1.7587, test_f1: 0.5913
 epoch: 90, train_loss: 0.2784, test_loss: 1.6351, test_f1: 0.6470
 epoch: 91, train_loss: 0.2817, test_loss: 1.7074, test_f1: 0.6175
 epoch: 92, train_loss: 0.2968, test_loss: 1.7492, test_f1: 0.6107
 epoch: 93, train_loss: 0.2660, test_loss: 1.7758, test_f1: 0.6152
 epoch: 94, train_loss: 0.3042, test_loss: 1.5896, test_f1: 0.6381
 epoch: 95, train_loss: 0.2348, test_loss: 1.6571, test_f1: 0.6541
 epoch: 96, train_loss: 0.2561, test_loss: 1.7578, test_f1: 0.6222
 epoch: 97, train_loss: 0.2681, test_loss: 1.6801, test_f1: 0.6108
 epoch: 98, train_loss: 0.2816, test_loss: 1.7148, test_f1: 0.6362
 epoch: 99, train_loss: 0.2503, test_loss: 1.8140, test_f1: 0.6066
##################ITERATION #2 ****************************************
 epoch: 0, train_loss: 1.1038, test_loss: 1.2876, test_f1: 0.2523
 epoch: 1, train_loss: 0.9597, test_loss: 1.0151, test_f1: 0.5561
 epoch: 2, train_loss: 0.9101, test_loss: 0.9704, test_f1: 0.5539
 epoch: 3, train_loss: 0.8835, test_loss: 0.9636, test_f1: 0.5702
 epoch: 4, train_loss: 0.8333, test_loss: 0.9958, test_f1: 0.5707
 epoch: 5, train_loss: 0.8189, test_loss: 0.9442, test_f1: 0.6028
 epoch: 6, train_loss: 0.7913, test_loss: 0.9777, test_f1: 0.5627
 epoch: 7, train_loss: 0.7694, test_loss: 0.9758, test_f1: 0.5854
 epoch: 8, train_loss: 0.7373, test_loss: 1.0229, test_f1: 0.5835
 epoch: 9, train_loss: 0.7511, test_loss: 0.9864, test_f1: 0.5979
 epoch: 10, train_loss: 0.7136, test_loss: 0.9821, test_f1: 0.5943
 epoch: 11, train_loss: 0.7149, test_loss: 0.9886, test_f1: 0.6261
 epoch: 12, train_loss: 0.7021, test_loss: 1.0044, test_f1: 0.6373
 epoch: 13, train_loss: 0.7101, test_loss: 1.0325, test_f1: 0.5681
 epoch: 14, train_loss: 0.6789, test_loss: 0.9463, test_f1: 0.6198
 epoch: 15, train_loss: 0.6607, test_loss: 1.0418, test_f1: 0.5743
 epoch: 16, train_loss: 0.6441, test_loss: 0.9908, test_f1: 0.6297
 epoch: 17, train_loss: 0.6381, test_loss: 1.0112, test_f1: 0.5951
 epoch: 18, train_loss: 0.6410, test_loss: 1.1307, test_f1: 0.5504
 epoch: 19, train_loss: 0.6232, test_loss: 1.0185, test_f1: 0.5951
 epoch: 20, train_loss: 0.6115, test_loss: 1.0759, test_f1: 0.5901
 epoch: 21, train_loss: 0.5913, test_loss: 1.1740, test_f1: 0.5856
 epoch: 22, train_loss: 0.5780, test_loss: 1.1061, test_f1: 0.5501
 epoch: 23, train_loss: 0.5712, test_loss: 1.1317, test_f1: 0.6291
 epoch: 24, train_loss: 0.5867, test_loss: 1.1351, test_f1: 0.5963
 epoch: 25, train_loss: 0.5559, test_loss: 1.0610, test_f1: 0.5885
 epoch: 26, train_loss: 0.5788, test_loss: 1.1707, test_f1: 0.5728
 epoch: 27, train_loss: 0.5427, test_loss: 1.1633, test_f1: 0.5793
 epoch: 28, train_loss: 0.5501, test_loss: 1.1907, test_f1: 0.5868
 epoch: 29, train_loss: 0.5198, test_loss: 1.1900, test_f1: 0.6142
 epoch: 30, train_loss: 0.4978, test_loss: 1.2840, test_f1: 0.5452
 epoch: 31, train_loss: 0.5308, test_loss: 1.2159, test_f1: 0.5566
 epoch: 32, train_loss: 0.5224, test_loss: 1.2137, test_f1: 0.5665
 epoch: 33, train_loss: 0.4858, test_loss: 1.1672, test_f1: 0.5787
 epoch: 34, train_loss: 0.5065, test_loss: 1.1968, test_f1: 0.5638
 epoch: 35, train_loss: 0.4759, test_loss: 1.3940, test_f1: 0.5939
 epoch: 36, train_loss: 0.4786, test_loss: 1.1488, test_f1: 0.5885
 epoch: 37, train_loss: 0.4675, test_loss: 1.2624, test_f1: 0.6178
 epoch: 38, train_loss: 0.4863, test_loss: 1.2140, test_f1: 0.6306
 epoch: 39, train_loss: 0.4204, test_loss: 1.2959, test_f1: 0.6348
 epoch: 40, train_loss: 0.4716, test_loss: 1.3140, test_f1: 0.5931
 epoch: 41, train_loss: 0.4840, test_loss: 1.2979, test_f1: 0.5577
 epoch: 42, train_loss: 0.4359, test_loss: 1.4208, test_f1: 0.5775
 epoch: 43, train_loss: 0.4312, test_loss: 1.2553, test_f1: 0.6337
 epoch: 44, train_loss: 0.4299, test_loss: 1.3009, test_f1: 0.6094
 epoch: 45, train_loss: 0.4071, test_loss: 1.2831, test_f1: 0.6104
 epoch: 46, train_loss: 0.4023, test_loss: 1.4095, test_f1: 0.5756
 epoch: 47, train_loss: 0.4077, test_loss: 1.4287, test_f1: 0.5271
 epoch: 48, train_loss: 0.4005, test_loss: 1.3907, test_f1: 0.6100
 epoch: 49, train_loss: 0.3845, test_loss: 1.2890, test_f1: 0.6355
 epoch: 50, train_loss: 0.3848, test_loss: 1.2946, test_f1: 0.6368
 epoch: 51, train_loss: 0.3605, test_loss: 1.3626, test_f1: 0.6185
 epoch: 52, train_loss: 0.3496, test_loss: 1.3901, test_f1: 0.6252
 epoch: 53, train_loss: 0.3270, test_loss: 1.4283, test_f1: 0.6039
 epoch: 54, train_loss: 0.3140, test_loss: 1.4569, test_f1: 0.6170
 epoch: 55, train_loss: 0.3386, test_loss: 1.4371, test_f1: 0.6510
 epoch: 56, train_loss: 0.3038, test_loss: 1.4889, test_f1: 0.6280
 epoch: 57, train_loss: 0.3352, test_loss: 1.4292, test_f1: 0.6103
 epoch: 58, train_loss: 0.3202, test_loss: 1.6167, test_f1: 0.6101
 epoch: 59, train_loss: 0.3065, test_loss: 1.4395, test_f1: 0.6369
 epoch: 60, train_loss: 0.2869, test_loss: 1.5883, test_f1: 0.5952
 epoch: 61, train_loss: 0.2748, test_loss: 1.5252, test_f1: 0.6277
 epoch: 62, train_loss: 0.2883, test_loss: 1.5778, test_f1: 0.6193
 epoch: 63, train_loss: 0.3041, test_loss: 1.5775, test_f1: 0.6115
 epoch: 64, train_loss: 0.2919, test_loss: 1.4642, test_f1: 0.6380
 epoch: 65, train_loss: 0.2997, test_loss: 1.4896, test_f1: 0.6218
 epoch: 66, train_loss: 0.3115, test_loss: 1.4620, test_f1: 0.6667
 epoch: 67, train_loss: 0.2766, test_loss: 1.5380, test_f1: 0.6336
 epoch: 68, train_loss: 0.2693, test_loss: 1.6673, test_f1: 0.6047
 epoch: 69, train_loss: 0.2810, test_loss: 1.5501, test_f1: 0.6483
 epoch: 70, train_loss: 0.2777, test_loss: 1.7603, test_f1: 0.6388
 epoch: 71, train_loss: 0.2591, test_loss: 1.6464, test_f1: 0.6210
 epoch: 72, train_loss: 0.2882, test_loss: 1.6163, test_f1: 0.6373
 epoch: 73, train_loss: 0.2474, test_loss: 1.6399, test_f1: 0.6133
 epoch: 74, train_loss: 0.2437, test_loss: 1.6343, test_f1: 0.6271
 epoch: 75, train_loss: 0.2735, test_loss: 1.7662, test_f1: 0.6067
 epoch: 76, train_loss: 0.2527, test_loss: 1.7220, test_f1: 0.6431
 epoch: 77, train_loss: 0.2795, test_loss: 1.7725, test_f1: 0.6089
 epoch: 78, train_loss: 0.2503, test_loss: 1.6502, test_f1: 0.6275
 epoch: 79, train_loss: 0.2644, test_loss: 1.8791, test_f1: 0.5882
 epoch: 80, train_loss: 0.2456, test_loss: 1.7835, test_f1: 0.6116
 epoch: 81, train_loss: 0.2302, test_loss: 1.7707, test_f1: 0.5969
 epoch: 82, train_loss: 0.2357, test_loss: 1.8181, test_f1: 0.6176
 epoch: 83, train_loss: 0.2270, test_loss: 1.6950, test_f1: 0.6526
 epoch: 84, train_loss: 0.2579, test_loss: 1.9309, test_f1: 0.6092
 epoch: 85, train_loss: 0.2469, test_loss: 1.7852, test_f1: 0.5910
 epoch: 86, train_loss: 0.2428, test_loss: 1.8497, test_f1: 0.6123
 epoch: 87, train_loss: 0.2513, test_loss: 1.7796, test_f1: 0.6147
 epoch: 88, train_loss: 0.2587, test_loss: 1.7894, test_f1: 0.6257
 epoch: 89, train_loss: 0.2377, test_loss: 1.8460, test_f1: 0.6270
 epoch: 90, train_loss: 0.2396, test_loss: 1.8225, test_f1: 0.6364
 epoch: 91, train_loss: 0.2348, test_loss: 1.8600, test_f1: 0.6146
 epoch: 92, train_loss: 0.2234, test_loss: 1.9218, test_f1: 0.6167
 epoch: 93, train_loss: 0.2260, test_loss: 1.8783, test_f1: 0.6044
 epoch: 94, train_loss: 0.2515, test_loss: 2.0451, test_f1: 0.6062
 epoch: 95, train_loss: 0.2210, test_loss: 1.8211, test_f1: 0.6205
 epoch: 96, train_loss: 0.2179, test_loss: 1.7536, test_f1: 0.6211
 epoch: 97, train_loss: 0.1986, test_loss: 1.8428, test_f1: 0.6290
 epoch: 98, train_loss: 0.2068, test_loss: 1.8242, test_f1: 0.6223
 epoch: 99, train_loss: 0.2062, test_loss: 2.0385, test_f1: 0.6215
##################ITERATION #3 ****************************************
 epoch: 0, train_loss: 1.1199, test_loss: 1.4965, test_f1: 0.2441
 epoch: 1, train_loss: 0.9621, test_loss: 1.0421, test_f1: 0.4611
 epoch: 2, train_loss: 0.9326, test_loss: 1.0086, test_f1: 0.5148
 epoch: 3, train_loss: 0.9102, test_loss: 1.0470, test_f1: 0.5275
 epoch: 4, train_loss: 0.8602, test_loss: 1.0160, test_f1: 0.5743
 epoch: 5, train_loss: 0.8476, test_loss: 0.9977, test_f1: 0.5872
 epoch: 6, train_loss: 0.8328, test_loss: 1.0140, test_f1: 0.5714
 epoch: 7, train_loss: 0.7944, test_loss: 1.0240, test_f1: 0.5497
 epoch: 8, train_loss: 0.7972, test_loss: 1.0020, test_f1: 0.6492
 epoch: 9, train_loss: 0.7551, test_loss: 1.0316, test_f1: 0.5875
 epoch: 10, train_loss: 0.7375, test_loss: 1.1285, test_f1: 0.5461
 epoch: 11, train_loss: 0.7445, test_loss: 1.0502, test_f1: 0.5717
 epoch: 12, train_loss: 0.7173, test_loss: 1.0655, test_f1: 0.5973
 epoch: 13, train_loss: 0.7129, test_loss: 1.0211, test_f1: 0.5733
 epoch: 14, train_loss: 0.6828, test_loss: 1.0738, test_f1: 0.5722
 epoch: 15, train_loss: 0.7013, test_loss: 1.1047, test_f1: 0.5543
 epoch: 16, train_loss: 0.6705, test_loss: 1.0660, test_f1: 0.5760
 epoch: 17, train_loss: 0.6638, test_loss: 1.0675, test_f1: 0.6017
 epoch: 18, train_loss: 0.6540, test_loss: 1.0731, test_f1: 0.5971
 epoch: 19, train_loss: 0.6401, test_loss: 1.0838, test_f1: 0.6054
 epoch: 20, train_loss: 0.6294, test_loss: 1.1006, test_f1: 0.6075
 epoch: 21, train_loss: 0.6238, test_loss: 1.1456, test_f1: 0.5982
 epoch: 22, train_loss: 0.6048, test_loss: 1.1712, test_f1: 0.5970
 epoch: 23, train_loss: 0.6164, test_loss: 1.0855, test_f1: 0.6539
 epoch: 24, train_loss: 0.6235, test_loss: 1.2127, test_f1: 0.5838
 epoch: 25, train_loss: 0.6178, test_loss: 1.1586, test_f1: 0.5750
 epoch: 26, train_loss: 0.5885, test_loss: 1.1472, test_f1: 0.6027
 epoch: 27, train_loss: 0.5846, test_loss: 1.0587, test_f1: 0.6373
 epoch: 28, train_loss: 0.5824, test_loss: 1.2347, test_f1: 0.6173
 epoch: 29, train_loss: 0.5874, test_loss: 1.0612, test_f1: 0.6475
 epoch: 30, train_loss: 0.5483, test_loss: 1.1045, test_f1: 0.6432
 epoch: 31, train_loss: 0.5420, test_loss: 1.1212, test_f1: 0.6586
 epoch: 32, train_loss: 0.5329, test_loss: 1.2335, test_f1: 0.6208
 epoch: 33, train_loss: 0.5043, test_loss: 1.1763, test_f1: 0.5945
 epoch: 34, train_loss: 0.5324, test_loss: 1.2610, test_f1: 0.5987
 epoch: 35, train_loss: 0.5036, test_loss: 1.2106, test_f1: 0.6578
 epoch: 36, train_loss: 0.5027, test_loss: 1.3155, test_f1: 0.6169
 epoch: 37, train_loss: 0.4780, test_loss: 1.1847, test_f1: 0.6366
 epoch: 38, train_loss: 0.4814, test_loss: 1.2287, test_f1: 0.6641
 epoch: 39, train_loss: 0.5131, test_loss: 1.3975, test_f1: 0.5259
 epoch: 40, train_loss: 0.5475, test_loss: 1.3711, test_f1: 0.5786
 epoch: 41, train_loss: 0.4489, test_loss: 1.3579, test_f1: 0.5197
 epoch: 42, train_loss: 0.4300, test_loss: 1.3223, test_f1: 0.6205
 epoch: 43, train_loss: 0.4774, test_loss: 1.2730, test_f1: 0.6418
 epoch: 44, train_loss: 0.4289, test_loss: 1.3198, test_f1: 0.6563
 epoch: 45, train_loss: 0.4719, test_loss: 1.3424, test_f1: 0.5957
 epoch: 46, train_loss: 0.4204, test_loss: 1.2402, test_f1: 0.6375
 epoch: 47, train_loss: 0.4337, test_loss: 1.3133, test_f1: 0.5857
 epoch: 48, train_loss: 0.4361, test_loss: 1.5194, test_f1: 0.5966
 epoch: 49, train_loss: 0.4207, test_loss: 1.3795, test_f1: 0.5603
 epoch: 50, train_loss: 0.4272, test_loss: 1.5593, test_f1: 0.6126
 epoch: 51, train_loss: 0.3802, test_loss: 1.3642, test_f1: 0.6254
 epoch: 52, train_loss: 0.3620, test_loss: 1.3645, test_f1: 0.6364
 epoch: 53, train_loss: 0.3424, test_loss: 1.4110, test_f1: 0.6216
 epoch: 54, train_loss: 0.3519, test_loss: 1.4879, test_f1: 0.6407
 epoch: 55, train_loss: 0.3622, test_loss: 1.5124, test_f1: 0.6269
 epoch: 56, train_loss: 0.3478, test_loss: 1.4829, test_f1: 0.6433
 epoch: 57, train_loss: 0.3340, test_loss: 1.5189, test_f1: 0.6518
 epoch: 58, train_loss: 0.3362, test_loss: 1.5860, test_f1: 0.6059
 epoch: 59, train_loss: 0.3191, test_loss: 1.4980, test_f1: 0.6367
 epoch: 60, train_loss: 0.3482, test_loss: 1.4576, test_f1: 0.6609
 epoch: 61, train_loss: 0.3211, test_loss: 1.5590, test_f1: 0.6601
 epoch: 62, train_loss: 0.3301, test_loss: 1.5460, test_f1: 0.6372
 epoch: 63, train_loss: 0.3233, test_loss: 1.5260, test_f1: 0.6385
 epoch: 64, train_loss: 0.2955, test_loss: 1.6124, test_f1: 0.6471
 epoch: 65, train_loss: 0.3229, test_loss: 1.4937, test_f1: 0.6703
 epoch: 66, train_loss: 0.2997, test_loss: 1.5765, test_f1: 0.6179
 epoch: 67, train_loss: 0.3012, test_loss: 1.6170, test_f1: 0.6263
 epoch: 68, train_loss: 0.2874, test_loss: 1.6041, test_f1: 0.6281
 epoch: 69, train_loss: 0.2881, test_loss: 1.6983, test_f1: 0.5916
 epoch: 70, train_loss: 0.3094, test_loss: 1.8117, test_f1: 0.5719
 epoch: 71, train_loss: 0.3270, test_loss: 1.7227, test_f1: 0.5965
 epoch: 72, train_loss: 0.2842, test_loss: 1.6310, test_f1: 0.6379
 epoch: 73, train_loss: 0.2797, test_loss: 1.7971, test_f1: 0.5867
 epoch: 74, train_loss: 0.2944, test_loss: 1.7101, test_f1: 0.6067
 epoch: 75, train_loss: 0.2960, test_loss: 1.7461, test_f1: 0.6141
 epoch: 76, train_loss: 0.2928, test_loss: 1.7159, test_f1: 0.6059
 epoch: 77, train_loss: 0.2475, test_loss: 1.7457, test_f1: 0.6390
 epoch: 78, train_loss: 0.2471, test_loss: 1.6769, test_f1: 0.6679
 epoch: 79, train_loss: 0.2804, test_loss: 1.6114, test_f1: 0.6635
 epoch: 80, train_loss: 0.2905, test_loss: 1.7550, test_f1: 0.6429
 epoch: 81, train_loss: 0.2646, test_loss: 1.6092, test_f1: 0.6593
 epoch: 82, train_loss: 0.2583, test_loss: 1.7952, test_f1: 0.6202
 epoch: 83, train_loss: 0.2477, test_loss: 1.6841, test_f1: 0.6652
 epoch: 84, train_loss: 0.2892, test_loss: 1.7525, test_f1: 0.6549
 epoch: 85, train_loss: 0.2412, test_loss: 1.7817, test_f1: 0.6061
 epoch: 86, train_loss: 0.2467, test_loss: 1.7184, test_f1: 0.6625
 epoch: 87, train_loss: 0.2700, test_loss: 1.6531, test_f1: 0.6381
 epoch: 88, train_loss: 0.2549, test_loss: 1.9299, test_f1: 0.6180
 epoch: 89, train_loss: 0.2613, test_loss: 1.7481, test_f1: 0.6793
 epoch: 90, train_loss: 0.2379, test_loss: 1.8302, test_f1: 0.5940
 epoch: 91, train_loss: 0.2483, test_loss: 1.8566, test_f1: 0.5985
 epoch: 92, train_loss: 0.2193, test_loss: 1.7897, test_f1: 0.6435
 epoch: 93, train_loss: 0.2439, test_loss: 1.9781, test_f1: 0.6219
 epoch: 94, train_loss: 0.2425, test_loss: 1.6987, test_f1: 0.6404
 epoch: 95, train_loss: 0.2106, test_loss: 1.9483, test_f1: 0.6348
 epoch: 96, train_loss: 0.2567, test_loss: 1.8082, test_f1: 0.6499
 epoch: 97, train_loss: 0.2265, test_loss: 2.1002, test_f1: 0.5999
 epoch: 98, train_loss: 0.2839, test_loss: 1.8989, test_f1: 0.6227
 epoch: 99, train_loss: 0.2267, test_loss: 1.8844, test_f1: 0.6274
##################ITERATION #4 ****************************************
 epoch: 0, train_loss: 1.2455, test_loss: 1.3930, test_f1: 0.2441
 epoch: 1, train_loss: 0.9916, test_loss: 1.0404, test_f1: 0.5140
 epoch: 2, train_loss: 0.9265, test_loss: 0.9983, test_f1: 0.5688
 epoch: 3, train_loss: 0.9122, test_loss: 0.9960, test_f1: 0.5896
 epoch: 4, train_loss: 0.8802, test_loss: 1.0185, test_f1: 0.5765
 epoch: 5, train_loss: 0.8716, test_loss: 1.0388, test_f1: 0.5478
 epoch: 6, train_loss: 0.8394, test_loss: 1.0018, test_f1: 0.5866
 epoch: 7, train_loss: 0.8235, test_loss: 0.9965, test_f1: 0.6127
 epoch: 8, train_loss: 0.7773, test_loss: 1.0115, test_f1: 0.5695
 epoch: 9, train_loss: 0.7757, test_loss: 1.0366, test_f1: 0.5842
 epoch: 10, train_loss: 0.7612, test_loss: 1.0325, test_f1: 0.6000
 epoch: 11, train_loss: 0.7526, test_loss: 1.0356, test_f1: 0.5806
 epoch: 12, train_loss: 0.7607, test_loss: 1.0084, test_f1: 0.6073
 epoch: 13, train_loss: 0.7186, test_loss: 1.1000, test_f1: 0.5731
 epoch: 14, train_loss: 0.7137, test_loss: 1.0629, test_f1: 0.5701
 epoch: 15, train_loss: 0.7042, test_loss: 1.1649, test_f1: 0.5576
 epoch: 16, train_loss: 0.7038, test_loss: 1.1523, test_f1: 0.5625
 epoch: 17, train_loss: 0.7008, test_loss: 1.0748, test_f1: 0.5749
 epoch: 18, train_loss: 0.6700, test_loss: 1.1113, test_f1: 0.5891
 epoch: 19, train_loss: 0.6600, test_loss: 1.2103, test_f1: 0.5694
 epoch: 20, train_loss: 0.6452, test_loss: 1.0904, test_f1: 0.5716
 epoch: 21, train_loss: 0.6216, test_loss: 1.1138, test_f1: 0.5438
 epoch: 22, train_loss: 0.6223, test_loss: 1.4344, test_f1: 0.5124
 epoch: 23, train_loss: 0.6192, test_loss: 1.1489, test_f1: 0.5473
 epoch: 24, train_loss: 0.6026, test_loss: 1.2152, test_f1: 0.5463
 epoch: 25, train_loss: 0.5959, test_loss: 1.0999, test_f1: 0.6030
 epoch: 26, train_loss: 0.6106, test_loss: 1.3603, test_f1: 0.5816
 epoch: 27, train_loss: 0.5950, test_loss: 1.1620, test_f1: 0.5850
 epoch: 28, train_loss: 0.5568, test_loss: 1.1997, test_f1: 0.5659
 epoch: 29, train_loss: 0.5548, test_loss: 1.1972, test_f1: 0.5731
 epoch: 30, train_loss: 0.5388, test_loss: 1.3626, test_f1: 0.5457
 epoch: 31, train_loss: 0.5496, test_loss: 1.1732, test_f1: 0.5922
 epoch: 32, train_loss: 0.5625, test_loss: 1.1449, test_f1: 0.5899
 epoch: 33, train_loss: 0.5381, test_loss: 1.2359, test_f1: 0.6009
 epoch: 34, train_loss: 0.5137, test_loss: 1.1716, test_f1: 0.6334
 epoch: 35, train_loss: 0.5399, test_loss: 1.1754, test_f1: 0.5853
 epoch: 36, train_loss: 0.5148, test_loss: 1.1420, test_f1: 0.6008
 epoch: 37, train_loss: 0.5047, test_loss: 1.3386, test_f1: 0.6041
 epoch: 38, train_loss: 0.4828, test_loss: 1.2854, test_f1: 0.5818
 epoch: 39, train_loss: 0.4938, test_loss: 1.3485, test_f1: 0.6089
 epoch: 40, train_loss: 0.4773, test_loss: 1.3756, test_f1: 0.6045
 epoch: 41, train_loss: 0.4855, test_loss: 1.3314, test_f1: 0.5735
 epoch: 42, train_loss: 0.4654, test_loss: 1.3833, test_f1: 0.5880
 epoch: 43, train_loss: 0.4677, test_loss: 1.3304, test_f1: 0.5957
 epoch: 44, train_loss: 0.4386, test_loss: 1.3332, test_f1: 0.5949
 epoch: 45, train_loss: 0.4416, test_loss: 1.3619, test_f1: 0.5913
 epoch: 46, train_loss: 0.4501, test_loss: 1.6402, test_f1: 0.6043
 epoch: 47, train_loss: 0.4030, test_loss: 1.4392, test_f1: 0.6137
 epoch: 48, train_loss: 0.4277, test_loss: 1.6290, test_f1: 0.5675
 epoch: 49, train_loss: 0.4231, test_loss: 1.4019, test_f1: 0.6031
 epoch: 50, train_loss: 0.4164, test_loss: 1.4085, test_f1: 0.5932
 epoch: 51, train_loss: 0.3982, test_loss: 1.4274, test_f1: 0.6190
 epoch: 52, train_loss: 0.3529, test_loss: 1.4437, test_f1: 0.6324
 epoch: 53, train_loss: 0.3656, test_loss: 1.5664, test_f1: 0.6064
 epoch: 54, train_loss: 0.3307, test_loss: 1.6345, test_f1: 0.5940
 epoch: 55, train_loss: 0.3673, test_loss: 1.6474, test_f1: 0.5707
 epoch: 56, train_loss: 0.3532, test_loss: 1.5848, test_f1: 0.5899
 epoch: 57, train_loss: 0.3586, test_loss: 1.7293, test_f1: 0.5800
 epoch: 58, train_loss: 0.3456, test_loss: 1.5521, test_f1: 0.5791
 epoch: 59, train_loss: 0.3321, test_loss: 1.5989, test_f1: 0.6078
 epoch: 60, train_loss: 0.3274, test_loss: 1.7732, test_f1: 0.6143
 epoch: 61, train_loss: 0.3120, test_loss: 1.7547, test_f1: 0.5782
 epoch: 62, train_loss: 0.3219, test_loss: 1.7182, test_f1: 0.5787
 epoch: 63, train_loss: 0.3085, test_loss: 1.6150, test_f1: 0.6278
 epoch: 64, train_loss: 0.3283, test_loss: 1.6705, test_f1: 0.6291
 epoch: 65, train_loss: 0.3173, test_loss: 1.7182, test_f1: 0.6202
 epoch: 66, train_loss: 0.3123, test_loss: 1.7111, test_f1: 0.5929
 epoch: 67, train_loss: 0.3198, test_loss: 1.7507, test_f1: 0.6032
 epoch: 68, train_loss: 0.2984, test_loss: 1.6806, test_f1: 0.6477
 epoch: 69, train_loss: 0.2971, test_loss: 1.8501, test_f1: 0.5751
 epoch: 70, train_loss: 0.2936, test_loss: 1.8429, test_f1: 0.5894
 epoch: 71, train_loss: 0.2912, test_loss: 1.7667, test_f1: 0.6272
 epoch: 72, train_loss: 0.3052, test_loss: 1.6161, test_f1: 0.5858
 epoch: 73, train_loss: 0.3088, test_loss: 1.7703, test_f1: 0.5940
 epoch: 74, train_loss: 0.2948, test_loss: 1.6728, test_f1: 0.6301
 epoch: 75, train_loss: 0.2811, test_loss: 1.8985, test_f1: 0.6132
 epoch: 76, train_loss: 0.2775, test_loss: 1.7874, test_f1: 0.6164
 epoch: 77, train_loss: 0.2707, test_loss: 1.7814, test_f1: 0.6150
 epoch: 78, train_loss: 0.2753, test_loss: 1.8473, test_f1: 0.6110
 epoch: 79, train_loss: 0.2544, test_loss: 1.8709, test_f1: 0.6263
 epoch: 80, train_loss: 0.2763, test_loss: 1.7919, test_f1: 0.6101
 epoch: 81, train_loss: 0.2767, test_loss: 1.9248, test_f1: 0.5860
 epoch: 82, train_loss: 0.2767, test_loss: 1.9336, test_f1: 0.6217
 epoch: 83, train_loss: 0.2788, test_loss: 1.9528, test_f1: 0.5822
 epoch: 84, train_loss: 0.2741, test_loss: 1.9351, test_f1: 0.6205
 epoch: 85, train_loss: 0.2708, test_loss: 2.0754, test_f1: 0.6117
 epoch: 86, train_loss: 0.2485, test_loss: 1.8225, test_f1: 0.6256
 epoch: 87, train_loss: 0.2703, test_loss: 2.0968, test_f1: 0.6131
 epoch: 88, train_loss: 0.2456, test_loss: 1.9916, test_f1: 0.5936
 epoch: 89, train_loss: 0.2412, test_loss: 2.0395, test_f1: 0.6082
 epoch: 90, train_loss: 0.2594, test_loss: 2.0515, test_f1: 0.6002
 epoch: 91, train_loss: 0.2667, test_loss: 2.0742, test_f1: 0.6036
 epoch: 92, train_loss: 0.2586, test_loss: 2.2031, test_f1: 0.5798
 epoch: 93, train_loss: 0.2521, test_loss: 1.9995, test_f1: 0.6055
 epoch: 94, train_loss: 0.2317, test_loss: 2.1294, test_f1: 0.5883
 epoch: 95, train_loss: 0.2166, test_loss: 2.0024, test_f1: 0.6221
 epoch: 96, train_loss: 0.2222, test_loss: 2.1144, test_f1: 0.6106
 epoch: 97, train_loss: 0.2523, test_loss: 2.0594, test_f1: 0.6339
 epoch: 98, train_loss: 0.2335, test_loss: 2.1238, test_f1: 0.6107
 epoch: 99, train_loss: 0.2489, test_loss: 2.2429, test_f1: 0.5711
##################ITERATION #5 ****************************************
 epoch: 0, train_loss: 1.3245, test_loss: 1.4254, test_f1: 0.2147
 epoch: 1, train_loss: 0.9931, test_loss: 1.0856, test_f1: 0.4995
 epoch: 2, train_loss: 0.9425, test_loss: 1.0411, test_f1: 0.5667
 epoch: 3, train_loss: 0.8929, test_loss: 1.0402, test_f1: 0.5245
 epoch: 4, train_loss: 0.8774, test_loss: 0.9971, test_f1: 0.5147
 epoch: 5, train_loss: 0.8582, test_loss: 0.9961, test_f1: 0.5548
 epoch: 6, train_loss: 0.8446, test_loss: 1.0444, test_f1: 0.5549
 epoch: 7, train_loss: 0.8314, test_loss: 1.0170, test_f1: 0.5776
 epoch: 8, train_loss: 0.7836, test_loss: 1.0120, test_f1: 0.5342
 epoch: 9, train_loss: 0.7863, test_loss: 1.0121, test_f1: 0.5344
 epoch: 10, train_loss: 0.7507, test_loss: 1.0312, test_f1: 0.5576
 epoch: 11, train_loss: 0.7789, test_loss: 1.0586, test_f1: 0.5678
 epoch: 12, train_loss: 0.7553, test_loss: 1.0457, test_f1: 0.5683
 epoch: 13, train_loss: 0.7325, test_loss: 1.0279, test_f1: 0.5983
 epoch: 14, train_loss: 0.7178, test_loss: 1.0925, test_f1: 0.5568
 epoch: 15, train_loss: 0.7223, test_loss: 1.0682, test_f1: 0.5756
 epoch: 16, train_loss: 0.6878, test_loss: 1.1004, test_f1: 0.5558
 epoch: 17, train_loss: 0.7028, test_loss: 1.0726, test_f1: 0.5287
 epoch: 18, train_loss: 0.6725, test_loss: 1.1067, test_f1: 0.5619
 epoch: 19, train_loss: 0.6654, test_loss: 1.0366, test_f1: 0.5874
 epoch: 20, train_loss: 0.6373, test_loss: 1.1166, test_f1: 0.5792
 epoch: 21, train_loss: 0.6364, test_loss: 1.0647, test_f1: 0.6082
 epoch: 22, train_loss: 0.6455, test_loss: 1.1654, test_f1: 0.6061
 epoch: 23, train_loss: 0.6112, test_loss: 1.2361, test_f1: 0.5570
 epoch: 24, train_loss: 0.6254, test_loss: 1.1333, test_f1: 0.6100
 epoch: 25, train_loss: 0.6137, test_loss: 1.2127, test_f1: 0.5643
 epoch: 26, train_loss: 0.6036, test_loss: 1.2003, test_f1: 0.5522
 epoch: 27, train_loss: 0.5761, test_loss: 1.2316, test_f1: 0.5703
 epoch: 28, train_loss: 0.5856, test_loss: 1.2941, test_f1: 0.5792
 epoch: 29, train_loss: 0.5648, test_loss: 1.3246, test_f1: 0.5541
 epoch: 30, train_loss: 0.5700, test_loss: 1.2787, test_f1: 0.5507
 epoch: 31, train_loss: 0.5588, test_loss: 1.5178, test_f1: 0.5865
 epoch: 32, train_loss: 0.5714, test_loss: 1.2507, test_f1: 0.6319
 epoch: 33, train_loss: 0.5576, test_loss: 1.4913, test_f1: 0.5822
 epoch: 34, train_loss: 0.5075, test_loss: 1.4264, test_f1: 0.5545
 epoch: 35, train_loss: 0.5584, test_loss: 1.3070, test_f1: 0.5612
 epoch: 36, train_loss: 0.5251, test_loss: 1.2301, test_f1: 0.6009
 epoch: 37, train_loss: 0.5158, test_loss: 1.4072, test_f1: 0.6038
 epoch: 38, train_loss: 0.5279, test_loss: 1.3008, test_f1: 0.6159
 epoch: 39, train_loss: 0.4974, test_loss: 1.2987, test_f1: 0.5752
 epoch: 40, train_loss: 0.5055, test_loss: 1.6687, test_f1: 0.6118
 epoch: 41, train_loss: 0.5182, test_loss: 1.3280, test_f1: 0.6103
 epoch: 42, train_loss: 0.4850, test_loss: 1.3057, test_f1: 0.6249
 epoch: 43, train_loss: 0.4869, test_loss: 1.3766, test_f1: 0.6243
 epoch: 44, train_loss: 0.4584, test_loss: 1.6841, test_f1: 0.5344
 epoch: 45, train_loss: 0.4614, test_loss: 1.4897, test_f1: 0.5741
 epoch: 46, train_loss: 0.4695, test_loss: 1.4688, test_f1: 0.5616
 epoch: 47, train_loss: 0.4485, test_loss: 1.5648, test_f1: 0.5289
 epoch: 48, train_loss: 0.4541, test_loss: 1.6088, test_f1: 0.5587
 epoch: 49, train_loss: 0.4219, test_loss: 1.4415, test_f1: 0.6473
 epoch: 50, train_loss: 0.4192, test_loss: 1.5620, test_f1: 0.6138
 epoch: 51, train_loss: 0.3641, test_loss: 1.6886, test_f1: 0.5552
 epoch: 52, train_loss: 0.3952, test_loss: 1.5956, test_f1: 0.5942
 epoch: 53, train_loss: 0.3731, test_loss: 1.5984, test_f1: 0.5954
 epoch: 54, train_loss: 0.3616, test_loss: 1.7477, test_f1: 0.5937
 epoch: 55, train_loss: 0.3494, test_loss: 1.5159, test_f1: 0.6326
 epoch: 56, train_loss: 0.3690, test_loss: 1.7906, test_f1: 0.5991
 epoch: 57, train_loss: 0.3339, test_loss: 1.5979, test_f1: 0.6083
 epoch: 58, train_loss: 0.3539, test_loss: 1.9048, test_f1: 0.5850
 epoch: 59, train_loss: 0.3502, test_loss: 1.8299, test_f1: 0.5491
 epoch: 60, train_loss: 0.3428, test_loss: 1.8300, test_f1: 0.6103
 epoch: 61, train_loss: 0.3233, test_loss: 1.7861, test_f1: 0.5994
 epoch: 62, train_loss: 0.3257, test_loss: 1.9824, test_f1: 0.5650
 epoch: 63, train_loss: 0.3342, test_loss: 2.0410, test_f1: 0.5349
 epoch: 64, train_loss: 0.3204, test_loss: 1.8761, test_f1: 0.5834
 epoch: 65, train_loss: 0.3250, test_loss: 1.7792, test_f1: 0.6076
 epoch: 66, train_loss: 0.3219, test_loss: 1.8226, test_f1: 0.6114
 epoch: 67, train_loss: 0.3364, test_loss: 1.7835, test_f1: 0.6257
 epoch: 68, train_loss: 0.3095, test_loss: 2.0481, test_f1: 0.5898
 epoch: 69, train_loss: 0.3140, test_loss: 1.8772, test_f1: 0.5930
 epoch: 70, train_loss: 0.3240, test_loss: 1.9054, test_f1: 0.5800
 epoch: 71, train_loss: 0.3343, test_loss: 1.9438, test_f1: 0.6082
 epoch: 72, train_loss: 0.3011, test_loss: 1.7081, test_f1: 0.6115
 epoch: 73, train_loss: 0.3289, test_loss: 1.8546, test_f1: 0.6081
 epoch: 74, train_loss: 0.2911, test_loss: 1.9291, test_f1: 0.6057
 epoch: 75, train_loss: 0.2921, test_loss: 2.1071, test_f1: 0.5833
 epoch: 76, train_loss: 0.3028, test_loss: 1.8623, test_f1: 0.5985
 epoch: 77, train_loss: 0.3146, test_loss: 1.8993, test_f1: 0.5935
 epoch: 78, train_loss: 0.3048, test_loss: 2.1111, test_f1: 0.5649
 epoch: 79, train_loss: 0.2760, test_loss: 1.9735, test_f1: 0.6229
 epoch: 80, train_loss: 0.2958, test_loss: 2.0003, test_f1: 0.5752
 epoch: 81, train_loss: 0.2995, test_loss: 1.9388, test_f1: 0.5770
 epoch: 82, train_loss: 0.2593, test_loss: 2.0989, test_f1: 0.6092
 epoch: 83, train_loss: 0.2883, test_loss: 2.1695, test_f1: 0.5905
 epoch: 84, train_loss: 0.2788, test_loss: 2.2985, test_f1: 0.6018
 epoch: 85, train_loss: 0.2762, test_loss: 2.3354, test_f1: 0.5508
 epoch: 86, train_loss: 0.2773, test_loss: 2.3545, test_f1: 0.5796
 epoch: 87, train_loss: 0.2976, test_loss: 2.1857, test_f1: 0.5753
 epoch: 88, train_loss: 0.2750, test_loss: 2.1654, test_f1: 0.5696
 epoch: 89, train_loss: 0.2714, test_loss: 2.1902, test_f1: 0.5857
 epoch: 90, train_loss: 0.2882, test_loss: 2.1659, test_f1: 0.6065
 epoch: 91, train_loss: 0.2542, test_loss: 2.2360, test_f1: 0.6144
 epoch: 92, train_loss: 0.2912, test_loss: 2.1388, test_f1: 0.6169
 epoch: 93, train_loss: 0.2389, test_loss: 2.1553, test_f1: 0.5927
 epoch: 94, train_loss: 0.2758, test_loss: 2.1999, test_f1: 0.5746
 epoch: 95, train_loss: 0.2664, test_loss: 2.2345, test_f1: 0.5804
 epoch: 96, train_loss: 0.2605, test_loss: 2.1857, test_f1: 0.6171
 epoch: 97, train_loss: 0.2645, test_loss: 2.0520, test_f1: 0.5936
 epoch: 98, train_loss: 0.2564, test_loss: 2.1169, test_f1: 0.5998
 epoch: 99, train_loss: 0.2614, test_loss: 2.0785, test_f1: 0.5975
##################ITERATION #6 ****************************************
 epoch: 0, train_loss: 1.3488, test_loss: 1.3025, test_f1: 0.2731
 epoch: 1, train_loss: 1.0498, test_loss: 1.1153, test_f1: 0.5194
 epoch: 2, train_loss: 0.9684, test_loss: 1.0762, test_f1: 0.5543
 epoch: 3, train_loss: 0.9176, test_loss: 1.0647, test_f1: 0.5547
 epoch: 4, train_loss: 0.9006, test_loss: 1.1165, test_f1: 0.4974
 epoch: 5, train_loss: 0.8892, test_loss: 1.0759, test_f1: 0.5692
 epoch: 6, train_loss: 0.8574, test_loss: 1.1316, test_f1: 0.5743
 epoch: 7, train_loss: 0.7998, test_loss: 1.1355, test_f1: 0.5261
 epoch: 8, train_loss: 0.7988, test_loss: 1.0821, test_f1: 0.5986
 epoch: 9, train_loss: 0.7877, test_loss: 1.1139, test_f1: 0.6141
 epoch: 10, train_loss: 0.7763, test_loss: 1.0906, test_f1: 0.5685
 epoch: 11, train_loss: 0.7531, test_loss: 1.1067, test_f1: 0.5775
 epoch: 12, train_loss: 0.7602, test_loss: 1.2224, test_f1: 0.5826
 epoch: 13, train_loss: 0.7369, test_loss: 1.0966, test_f1: 0.5976
 epoch: 14, train_loss: 0.7394, test_loss: 1.0865, test_f1: 0.5985
 epoch: 15, train_loss: 0.7098, test_loss: 1.0951, test_f1: 0.5762
 epoch: 16, train_loss: 0.7095, test_loss: 1.1701, test_f1: 0.5711
 epoch: 17, train_loss: 0.7108, test_loss: 1.1457, test_f1: 0.5771
 epoch: 18, train_loss: 0.6915, test_loss: 1.1510, test_f1: 0.5693
 epoch: 19, train_loss: 0.6797, test_loss: 1.1834, test_f1: 0.5757
 epoch: 20, train_loss: 0.6554, test_loss: 1.1231, test_f1: 0.6345
 epoch: 21, train_loss: 0.6645, test_loss: 1.2522, test_f1: 0.6287
 epoch: 22, train_loss: 0.6438, test_loss: 1.1508, test_f1: 0.6111
 epoch: 23, train_loss: 0.6285, test_loss: 1.2054, test_f1: 0.6079
 epoch: 24, train_loss: 0.6077, test_loss: 1.2735, test_f1: 0.5606
 epoch: 25, train_loss: 0.6116, test_loss: 1.1690, test_f1: 0.6019
 epoch: 26, train_loss: 0.6089, test_loss: 1.3068, test_f1: 0.5623
 epoch: 27, train_loss: 0.5915, test_loss: 1.5861, test_f1: 0.5437
 epoch: 28, train_loss: 0.6051, test_loss: 1.1092, test_f1: 0.6088
 epoch: 29, train_loss: 0.5910, test_loss: 1.3423, test_f1: 0.5911
 epoch: 30, train_loss: 0.5819, test_loss: 1.2394, test_f1: 0.5501
 epoch: 31, train_loss: 0.5604, test_loss: 1.2645, test_f1: 0.5997
 epoch: 32, train_loss: 0.5721, test_loss: 1.3689, test_f1: 0.5950
 epoch: 33, train_loss: 0.5596, test_loss: 1.4589, test_f1: 0.6136
 epoch: 34, train_loss: 0.5345, test_loss: 1.2500, test_f1: 0.6113
 epoch: 35, train_loss: 0.5249, test_loss: 1.3013, test_f1: 0.6038
 epoch: 36, train_loss: 0.5505, test_loss: 1.3286, test_f1: 0.6235
 epoch: 37, train_loss: 0.5360, test_loss: 1.1684, test_f1: 0.6294
 epoch: 38, train_loss: 0.4861, test_loss: 1.2939, test_f1: 0.5882
 epoch: 39, train_loss: 0.5229, test_loss: 1.6126, test_f1: 0.5864
 epoch: 40, train_loss: 0.5288, test_loss: 1.2759, test_f1: 0.6439
 epoch: 41, train_loss: 0.4598, test_loss: 1.6345, test_f1: 0.6113
 epoch: 42, train_loss: 0.4918, test_loss: 1.8033, test_f1: 0.6038
 epoch: 43, train_loss: 0.4673, test_loss: 1.3934, test_f1: 0.6055
 epoch: 44, train_loss: 0.4533, test_loss: 1.4697, test_f1: 0.5979
 epoch: 45, train_loss: 0.4835, test_loss: 1.6039, test_f1: 0.5719
 epoch: 46, train_loss: 0.4398, test_loss: 1.4386, test_f1: 0.6265
 epoch: 47, train_loss: 0.4390, test_loss: 1.3238, test_f1: 0.6195
 epoch: 48, train_loss: 0.4555, test_loss: 1.6024, test_f1: 0.5615
 epoch: 49, train_loss: 0.4704, test_loss: 1.3255, test_f1: 0.6278
 epoch: 50, train_loss: 0.4393, test_loss: 1.5294, test_f1: 0.5762
 epoch: 51, train_loss: 0.3992, test_loss: 1.4961, test_f1: 0.6185
 epoch: 52, train_loss: 0.3715, test_loss: 1.7147, test_f1: 0.6179
 epoch: 53, train_loss: 0.3905, test_loss: 1.5675, test_f1: 0.6047
 epoch: 54, train_loss: 0.3460, test_loss: 1.5327, test_f1: 0.6051
 epoch: 55, train_loss: 0.3491, test_loss: 1.6085, test_f1: 0.6068
 epoch: 56, train_loss: 0.3598, test_loss: 1.7305, test_f1: 0.6192
 epoch: 57, train_loss: 0.3403, test_loss: 1.5716, test_f1: 0.6404
 epoch: 58, train_loss: 0.3377, test_loss: 1.5947, test_f1: 0.6118
 epoch: 59, train_loss: 0.3487, test_loss: 1.7746, test_f1: 0.5524
 epoch: 60, train_loss: 0.3312, test_loss: 1.6545, test_f1: 0.6339
 epoch: 61, train_loss: 0.3233, test_loss: 1.7286, test_f1: 0.6076
 epoch: 62, train_loss: 0.3313, test_loss: 2.1044, test_f1: 0.5928
 epoch: 63, train_loss: 0.3433, test_loss: 1.7196, test_f1: 0.6118
 epoch: 64, train_loss: 0.3291, test_loss: 1.8426, test_f1: 0.5938
 epoch: 65, train_loss: 0.3305, test_loss: 1.8020, test_f1: 0.6140
 epoch: 66, train_loss: 0.3127, test_loss: 1.6138, test_f1: 0.6042
 epoch: 67, train_loss: 0.3337, test_loss: 1.9318, test_f1: 0.6008
 epoch: 68, train_loss: 0.3378, test_loss: 1.7397, test_f1: 0.5763
 epoch: 69, train_loss: 0.3070, test_loss: 1.8739, test_f1: 0.5791
 epoch: 70, train_loss: 0.2905, test_loss: 1.8984, test_f1: 0.6000
 epoch: 71, train_loss: 0.2754, test_loss: 1.8816, test_f1: 0.5848
 epoch: 72, train_loss: 0.2982, test_loss: 1.9650, test_f1: 0.5553
 epoch: 73, train_loss: 0.3473, test_loss: 1.9907, test_f1: 0.6187
 epoch: 74, train_loss: 0.3063, test_loss: 1.8257, test_f1: 0.5997
 epoch: 75, train_loss: 0.3120, test_loss: 2.0217, test_f1: 0.5879
 epoch: 76, train_loss: 0.2801, test_loss: 1.8398, test_f1: 0.6318
 epoch: 77, train_loss: 0.2904, test_loss: 1.9387, test_f1: 0.6151
 epoch: 78, train_loss: 0.3045, test_loss: 1.8457, test_f1: 0.6262
 epoch: 79, train_loss: 0.2772, test_loss: 1.8357, test_f1: 0.6400
 epoch: 80, train_loss: 0.3065, test_loss: 1.8895, test_f1: 0.6054
 epoch: 81, train_loss: 0.2903, test_loss: 1.9475, test_f1: 0.5995
 epoch: 82, train_loss: 0.2903, test_loss: 1.9809, test_f1: 0.6210
 epoch: 83, train_loss: 0.2863, test_loss: 1.9493, test_f1: 0.6209
 epoch: 84, train_loss: 0.3031, test_loss: 1.9674, test_f1: 0.6267
 epoch: 85, train_loss: 0.2747, test_loss: 2.1130, test_f1: 0.5930
 epoch: 86, train_loss: 0.2744, test_loss: 2.0969, test_f1: 0.5789
 epoch: 87, train_loss: 0.2716, test_loss: 2.0104, test_f1: 0.6019
 epoch: 88, train_loss: 0.2780, test_loss: 2.0289, test_f1: 0.6226
 epoch: 89, train_loss: 0.2621, test_loss: 1.9198, test_f1: 0.5846
 epoch: 90, train_loss: 0.2501, test_loss: 1.9387, test_f1: 0.6249
 epoch: 91, train_loss: 0.2673, test_loss: 2.0442, test_f1: 0.6303
 epoch: 92, train_loss: 0.2503, test_loss: 2.1487, test_f1: 0.6056
 epoch: 93, train_loss: 0.2540, test_loss: 2.0413, test_f1: 0.6185
 epoch: 94, train_loss: 0.2513, test_loss: 2.1897, test_f1: 0.6032
 epoch: 95, train_loss: 0.2590, test_loss: 2.1054, test_f1: 0.6244
 epoch: 96, train_loss: 0.2646, test_loss: 2.1842, test_f1: 0.5943
 epoch: 97, train_loss: 0.2441, test_loss: 2.1930, test_f1: 0.6031
 epoch: 98, train_loss: 0.2631, test_loss: 2.3036, test_f1: 0.5602
 epoch: 99, train_loss: 0.2635, test_loss: 2.3291, test_f1: 0.5738
##################ITERATION #7 ****************************************
 epoch: 0, train_loss: 1.5235, test_loss: 1.2860, test_f1: 0.3117
 epoch: 1, train_loss: 1.1101, test_loss: 1.1500, test_f1: 0.4185
 epoch: 2, train_loss: 1.0162, test_loss: 1.1148, test_f1: 0.5246
 epoch: 3, train_loss: 0.9741, test_loss: 1.0839, test_f1: 0.4656
 epoch: 4, train_loss: 0.9100, test_loss: 1.0800, test_f1: 0.5566
 epoch: 5, train_loss: 0.8687, test_loss: 1.0919, test_f1: 0.5279
 epoch: 6, train_loss: 0.8246, test_loss: 1.0773, test_f1: 0.5721
 epoch: 7, train_loss: 0.8248, test_loss: 1.1343, test_f1: 0.5726
 epoch: 8, train_loss: 0.7999, test_loss: 1.1009, test_f1: 0.5667
 epoch: 9, train_loss: 0.7980, test_loss: 1.1335, test_f1: 0.4811
 epoch: 10, train_loss: 0.7592, test_loss: 1.1010, test_f1: 0.6047
 epoch: 11, train_loss: 0.7718, test_loss: 1.0830, test_f1: 0.5552
 epoch: 12, train_loss: 0.7520, test_loss: 1.1794, test_f1: 0.5096
 epoch: 13, train_loss: 0.7283, test_loss: 1.2329, test_f1: 0.5400
 epoch: 14, train_loss: 0.7095, test_loss: 1.2446, test_f1: 0.5603
 epoch: 15, train_loss: 0.7111, test_loss: 1.2379, test_f1: 0.5572
 epoch: 16, train_loss: 0.7097, test_loss: 1.2230, test_f1: 0.5772
 epoch: 17, train_loss: 0.6742, test_loss: 1.3076, test_f1: 0.5573
 epoch: 18, train_loss: 0.6853, test_loss: 1.2739, test_f1: 0.6123
 epoch: 19, train_loss: 0.6909, test_loss: 1.1159, test_f1: 0.5964
 epoch: 20, train_loss: 0.6742, test_loss: 1.1878, test_f1: 0.5865
 epoch: 21, train_loss: 0.6433, test_loss: 1.0919, test_f1: 0.6197
 epoch: 22, train_loss: 0.6599, test_loss: 1.1892, test_f1: 0.6158
 epoch: 23, train_loss: 0.6481, test_loss: 1.2568, test_f1: 0.6304
 epoch: 24, train_loss: 0.6270, test_loss: 1.1781, test_f1: 0.6178
 epoch: 25, train_loss: 0.6360, test_loss: 1.2834, test_f1: 0.6102
 epoch: 26, train_loss: 0.6377, test_loss: 1.2213, test_f1: 0.5848
 epoch: 27, train_loss: 0.6026, test_loss: 1.3026, test_f1: 0.5735
 epoch: 28, train_loss: 0.6086, test_loss: 1.4382, test_f1: 0.5866
 epoch: 29, train_loss: 0.6055, test_loss: 1.2815, test_f1: 0.5989
 epoch: 30, train_loss: 0.5924, test_loss: 1.4580, test_f1: 0.5235
 epoch: 31, train_loss: 0.5811, test_loss: 1.6351, test_f1: 0.5741
 epoch: 32, train_loss: 0.5955, test_loss: 1.6698, test_f1: 0.5932
 epoch: 33, train_loss: 0.5639, test_loss: 1.4210, test_f1: 0.6013
 epoch: 34, train_loss: 0.5925, test_loss: 1.5284, test_f1: 0.5504
 epoch: 35, train_loss: 0.5556, test_loss: 1.4714, test_f1: 0.6009
 epoch: 36, train_loss: 0.5394, test_loss: 1.4931, test_f1: 0.5996
 epoch: 37, train_loss: 0.5554, test_loss: 1.4583, test_f1: 0.5815
 epoch: 38, train_loss: 0.5163, test_loss: 1.5264, test_f1: 0.5848
 epoch: 39, train_loss: 0.5252, test_loss: 1.3173, test_f1: 0.5650
 epoch: 40, train_loss: 0.5330, test_loss: 1.6101, test_f1: 0.5914
 epoch: 41, train_loss: 0.5450, test_loss: 1.5004, test_f1: 0.5873
 epoch: 42, train_loss: 0.5461, test_loss: 1.4340, test_f1: 0.5862
 epoch: 43, train_loss: 0.5122, test_loss: 1.4431, test_f1: 0.6030
 epoch: 44, train_loss: 0.5066, test_loss: 1.5243, test_f1: 0.6195
 epoch: 45, train_loss: 0.5049, test_loss: 1.6746, test_f1: 0.5554
 epoch: 46, train_loss: 0.5102, test_loss: 1.5081, test_f1: 0.6248
 epoch: 47, train_loss: 0.4962, test_loss: 1.6259, test_f1: 0.5743
 epoch: 48, train_loss: 0.5021, test_loss: 1.5462, test_f1: 0.6024
 epoch: 49, train_loss: 0.4533, test_loss: 1.4382, test_f1: 0.5540
 epoch: 50, train_loss: 0.4604, test_loss: 1.6916, test_f1: 0.6035
 epoch: 51, train_loss: 0.4314, test_loss: 1.4657, test_f1: 0.5933
 epoch: 52, train_loss: 0.4174, test_loss: 1.6530, test_f1: 0.5797
 epoch: 53, train_loss: 0.3947, test_loss: 1.5998, test_f1: 0.5972
 epoch: 54, train_loss: 0.4114, test_loss: 1.6002, test_f1: 0.5845
 epoch: 55, train_loss: 0.4106, test_loss: 1.7623, test_f1: 0.5832
 epoch: 56, train_loss: 0.3917, test_loss: 1.6265, test_f1: 0.5912
 epoch: 57, train_loss: 0.3876, test_loss: 1.8222, test_f1: 0.6062
 epoch: 58, train_loss: 0.3736, test_loss: 1.5945, test_f1: 0.6034
 epoch: 59, train_loss: 0.3686, test_loss: 1.6485, test_f1: 0.5819
 epoch: 60, train_loss: 0.3817, test_loss: 1.7858, test_f1: 0.5928
 epoch: 61, train_loss: 0.3482, test_loss: 1.8607, test_f1: 0.5799
 epoch: 62, train_loss: 0.3453, test_loss: 1.8230, test_f1: 0.5978
 epoch: 63, train_loss: 0.3565, test_loss: 1.6595, test_f1: 0.5935
 epoch: 64, train_loss: 0.3393, test_loss: 1.9245, test_f1: 0.5866
 epoch: 65, train_loss: 0.3723, test_loss: 1.7509, test_f1: 0.5877
 epoch: 66, train_loss: 0.3537, test_loss: 1.7474, test_f1: 0.6018
 epoch: 67, train_loss: 0.3707, test_loss: 1.8081, test_f1: 0.5912
 epoch: 68, train_loss: 0.3517, test_loss: 1.8242, test_f1: 0.5917
 epoch: 69, train_loss: 0.3322, test_loss: 1.9279, test_f1: 0.6016
 epoch: 70, train_loss: 0.3486, test_loss: 1.8617, test_f1: 0.5971
 epoch: 71, train_loss: 0.3349, test_loss: 2.0745, test_f1: 0.5912
 epoch: 72, train_loss: 0.3480, test_loss: 1.8543, test_f1: 0.6078
 epoch: 73, train_loss: 0.3183, test_loss: 1.8901, test_f1: 0.6027
 epoch: 74, train_loss: 0.3202, test_loss: 1.9071, test_f1: 0.5595
 epoch: 75, train_loss: 0.3119, test_loss: 2.0411, test_f1: 0.5764
 epoch: 76, train_loss: 0.3068, test_loss: 1.9875, test_f1: 0.5917
 epoch: 77, train_loss: 0.3015, test_loss: 2.0184, test_f1: 0.5804
 epoch: 78, train_loss: 0.3329, test_loss: 2.1799, test_f1: 0.5457
 epoch: 79, train_loss: 0.2957, test_loss: 2.0077, test_f1: 0.5738
 epoch: 80, train_loss: 0.2806, test_loss: 2.0102, test_f1: 0.5918
 epoch: 81, train_loss: 0.3074, test_loss: 1.9606, test_f1: 0.5660
 epoch: 82, train_loss: 0.3086, test_loss: 1.9072, test_f1: 0.5921
 epoch: 83, train_loss: 0.3068, test_loss: 2.0709, test_f1: 0.5819
 epoch: 84, train_loss: 0.2889, test_loss: 2.0504, test_f1: 0.5965
 epoch: 85, train_loss: 0.3008, test_loss: 1.9812, test_f1: 0.5824
 epoch: 86, train_loss: 0.2902, test_loss: 2.1600, test_f1: 0.5776
 epoch: 87, train_loss: 0.2731, test_loss: 2.0850, test_f1: 0.5813
 epoch: 88, train_loss: 0.2955, test_loss: 1.9734, test_f1: 0.5639
 epoch: 89, train_loss: 0.3145, test_loss: 1.9902, test_f1: 0.6130
 epoch: 90, train_loss: 0.2895, test_loss: 2.1381, test_f1: 0.5776
 epoch: 91, train_loss: 0.2954, test_loss: 2.0405, test_f1: 0.5929
 epoch: 92, train_loss: 0.2677, test_loss: 2.0671, test_f1: 0.5752
 epoch: 93, train_loss: 0.2883, test_loss: 2.1523, test_f1: 0.5841
 epoch: 94, train_loss: 0.2927, test_loss: 2.0051, test_f1: 0.5837
 epoch: 95, train_loss: 0.2683, test_loss: 2.1023, test_f1: 0.5834
 epoch: 96, train_loss: 0.2717, test_loss: 2.0207, test_f1: 0.6118
 epoch: 97, train_loss: 0.2441, test_loss: 1.9589, test_f1: 0.5796
 epoch: 98, train_loss: 0.2734, test_loss: 2.2699, test_f1: 0.5725
 epoch: 99, train_loss: 0.2482, test_loss: 2.1125, test_f1: 0.6105
##################ITERATION #8 ****************************************
 epoch: 0, train_loss: 1.5816, test_loss: 1.1747, test_f1: 0.3914
 epoch: 1, train_loss: 1.0243, test_loss: 1.1397, test_f1: 0.5054
 epoch: 2, train_loss: 0.9620, test_loss: 1.0779, test_f1: 0.5217
 epoch: 3, train_loss: 0.9226, test_loss: 1.0993, test_f1: 0.5157
 epoch: 4, train_loss: 0.8481, test_loss: 1.0987, test_f1: 0.5418
 epoch: 5, train_loss: 0.8338, test_loss: 1.1486, test_f1: 0.5299
 epoch: 6, train_loss: 0.8130, test_loss: 1.1263, test_f1: 0.5190
 epoch: 7, train_loss: 0.8094, test_loss: 1.0923, test_f1: 0.5322
 epoch: 8, train_loss: 0.7856, test_loss: 1.1316, test_f1: 0.5069
 epoch: 9, train_loss: 0.7809, test_loss: 1.1253, test_f1: 0.5372
 epoch: 10, train_loss: 0.7529, test_loss: 1.1688, test_f1: 0.5460
 epoch: 11, train_loss: 0.7490, test_loss: 1.1531, test_f1: 0.5765
 epoch: 12, train_loss: 0.7136, test_loss: 1.1654, test_f1: 0.5727
 epoch: 13, train_loss: 0.7140, test_loss: 1.1430, test_f1: 0.5375
 epoch: 14, train_loss: 0.6962, test_loss: 1.1548, test_f1: 0.5807
 epoch: 15, train_loss: 0.6763, test_loss: 1.3334, test_f1: 0.5227
 epoch: 16, train_loss: 0.6807, test_loss: 1.2525, test_f1: 0.6059
 epoch: 17, train_loss: 0.6838, test_loss: 1.1332, test_f1: 0.5919
 epoch: 18, train_loss: 0.6526, test_loss: 1.2515, test_f1: 0.5734
 epoch: 19, train_loss: 0.6656, test_loss: 1.3668, test_f1: 0.5372
 epoch: 20, train_loss: 0.6386, test_loss: 1.1913, test_f1: 0.5803
 epoch: 21, train_loss: 0.6372, test_loss: 1.2301, test_f1: 0.5028
 epoch: 22, train_loss: 0.6359, test_loss: 1.2363, test_f1: 0.6005
 epoch: 23, train_loss: 0.6303, test_loss: 1.3068, test_f1: 0.5710
 epoch: 24, train_loss: 0.6117, test_loss: 1.2578, test_f1: 0.5722
 epoch: 25, train_loss: 0.5993, test_loss: 1.2593, test_f1: 0.5671
 epoch: 26, train_loss: 0.5959, test_loss: 1.3774, test_f1: 0.5786
 epoch: 27, train_loss: 0.5924, test_loss: 1.3343, test_f1: 0.5966
 epoch: 28, train_loss: 0.6094, test_loss: 1.3096, test_f1: 0.6176
 epoch: 29, train_loss: 0.5878, test_loss: 1.3136, test_f1: 0.5562
 epoch: 30, train_loss: 0.5740, test_loss: 1.3977, test_f1: 0.5917
 epoch: 31, train_loss: 0.5561, test_loss: 1.4346, test_f1: 0.5749
 epoch: 32, train_loss: 0.5636, test_loss: 1.3051, test_f1: 0.6061
 epoch: 33, train_loss: 0.5348, test_loss: 1.4620, test_f1: 0.6108
 epoch: 34, train_loss: 0.4974, test_loss: 1.4421, test_f1: 0.6061
 epoch: 35, train_loss: 0.5411, test_loss: 1.5983, test_f1: 0.6119
 epoch: 36, train_loss: 0.5242, test_loss: 1.5583, test_f1: 0.5865
 epoch: 37, train_loss: 0.5000, test_loss: 1.5522, test_f1: 0.6037
 epoch: 38, train_loss: 0.5039, test_loss: 1.4163, test_f1: 0.6486
 epoch: 39, train_loss: 0.5140, test_loss: 1.3431, test_f1: 0.6171
 epoch: 40, train_loss: 0.4862, test_loss: 1.5097, test_f1: 0.5759
 epoch: 41, train_loss: 0.5006, test_loss: 1.5563, test_f1: 0.5883
 epoch: 42, train_loss: 0.5017, test_loss: 1.5549, test_f1: 0.6082
 epoch: 43, train_loss: 0.5043, test_loss: 1.5804, test_f1: 0.5737
 epoch: 44, train_loss: 0.4769, test_loss: 1.5717, test_f1: 0.5878
 epoch: 45, train_loss: 0.4892, test_loss: 1.8778, test_f1: 0.5380
 epoch: 46, train_loss: 0.5195, test_loss: 1.6011, test_f1: 0.6121
 epoch: 47, train_loss: 0.4668, test_loss: 1.8436, test_f1: 0.5918
 epoch: 48, train_loss: 0.4465, test_loss: 1.7469, test_f1: 0.5703
 epoch: 49, train_loss: 0.4631, test_loss: 1.7209, test_f1: 0.5457
 epoch: 50, train_loss: 0.4368, test_loss: 1.5531, test_f1: 0.6146
 epoch: 51, train_loss: 0.4156, test_loss: 1.6293, test_f1: 0.5859
 epoch: 52, train_loss: 0.3972, test_loss: 1.7934, test_f1: 0.6262
 epoch: 53, train_loss: 0.4012, test_loss: 1.6392, test_f1: 0.5947
 epoch: 54, train_loss: 0.3857, test_loss: 1.7237, test_f1: 0.5769
 epoch: 55, train_loss: 0.3530, test_loss: 1.6910, test_f1: 0.5876
 epoch: 56, train_loss: 0.3738, test_loss: 1.7023, test_f1: 0.6265
 epoch: 57, train_loss: 0.3664, test_loss: 1.7611, test_f1: 0.5895
 epoch: 58, train_loss: 0.3468, test_loss: 1.6773, test_f1: 0.6346
 epoch: 59, train_loss: 0.3386, test_loss: 1.9361, test_f1: 0.5620
 epoch: 60, train_loss: 0.3579, test_loss: 1.8922, test_f1: 0.5753
 epoch: 61, train_loss: 0.3373, test_loss: 1.8022, test_f1: 0.5979
 epoch: 62, train_loss: 0.3448, test_loss: 1.8969, test_f1: 0.5952
 epoch: 63, train_loss: 0.3350, test_loss: 1.8908, test_f1: 0.5949
 epoch: 64, train_loss: 0.3335, test_loss: 2.0729, test_f1: 0.5748
 epoch: 65, train_loss: 0.3246, test_loss: 2.1108, test_f1: 0.5885
 epoch: 66, train_loss: 0.3015, test_loss: 2.1986, test_f1: 0.5819
 epoch: 67, train_loss: 0.3019, test_loss: 1.9257, test_f1: 0.6241
 epoch: 68, train_loss: 0.3308, test_loss: 1.9543, test_f1: 0.6216
 epoch: 69, train_loss: 0.3331, test_loss: 2.0946, test_f1: 0.6001
 epoch: 70, train_loss: 0.2814, test_loss: 2.0226, test_f1: 0.5988
 epoch: 71, train_loss: 0.2977, test_loss: 2.3339, test_f1: 0.5468
 epoch: 72, train_loss: 0.3097, test_loss: 2.2094, test_f1: 0.5652
 epoch: 73, train_loss: 0.2926, test_loss: 1.9623, test_f1: 0.6161
 epoch: 74, train_loss: 0.2998, test_loss: 2.0882, test_f1: 0.5820
 epoch: 75, train_loss: 0.2773, test_loss: 2.3810, test_f1: 0.5959
 epoch: 76, train_loss: 0.2817, test_loss: 2.2824, test_f1: 0.6091
 epoch: 77, train_loss: 0.3077, test_loss: 2.1116, test_f1: 0.6268
 epoch: 78, train_loss: 0.2908, test_loss: 2.2346, test_f1: 0.6150
 epoch: 79, train_loss: 0.2921, test_loss: 2.1135, test_f1: 0.6144
 epoch: 80, train_loss: 0.2989, test_loss: 2.3313, test_f1: 0.5828
 epoch: 81, train_loss: 0.2967, test_loss: 2.4979, test_f1: 0.5768
 epoch: 82, train_loss: 0.3022, test_loss: 2.4282, test_f1: 0.5904
 epoch: 83, train_loss: 0.2825, test_loss: 2.4197, test_f1: 0.6014
 epoch: 84, train_loss: 0.2773, test_loss: 2.4131, test_f1: 0.5933
 epoch: 85, train_loss: 0.2767, test_loss: 2.1601, test_f1: 0.5950
 epoch: 86, train_loss: 0.2604, test_loss: 2.2876, test_f1: 0.5903
 epoch: 87, train_loss: 0.2635, test_loss: 2.3504, test_f1: 0.5762
 epoch: 88, train_loss: 0.2488, test_loss: 2.5322, test_f1: 0.6219
 epoch: 89, train_loss: 0.2673, test_loss: 2.4071, test_f1: 0.6098
 epoch: 90, train_loss: 0.2648, test_loss: 2.2764, test_f1: 0.6238
 epoch: 91, train_loss: 0.2815, test_loss: 2.2584, test_f1: 0.5809
 epoch: 92, train_loss: 0.2651, test_loss: 2.2871, test_f1: 0.6046
 epoch: 93, train_loss: 0.2252, test_loss: 2.5073, test_f1: 0.6223
 epoch: 94, train_loss: 0.2497, test_loss: 2.3753, test_f1: 0.6037
 epoch: 95, train_loss: 0.2412, test_loss: 2.5253, test_f1: 0.5749
 epoch: 96, train_loss: 0.2409, test_loss: 2.3028, test_f1: 0.6187
 epoch: 97, train_loss: 0.2704, test_loss: 2.2409, test_f1: 0.6344
 epoch: 98, train_loss: 0.2632, test_loss: 2.3050, test_f1: 0.6062
 epoch: 99, train_loss: 0.2791, test_loss: 2.4053, test_f1: 0.5642
##################ITERATION #9 ****************************************
 epoch: 0, train_loss: 1.4538, test_loss: 1.4908, test_f1: 0.2773
 epoch: 1, train_loss: 1.0733, test_loss: 1.0305, test_f1: 0.6061
 epoch: 2, train_loss: 0.9665, test_loss: 1.0678, test_f1: 0.5511
 epoch: 3, train_loss: 0.9496, test_loss: 1.0368, test_f1: 0.6014
 epoch: 4, train_loss: 0.8654, test_loss: 1.0357, test_f1: 0.5619
 epoch: 5, train_loss: 0.8587, test_loss: 1.0232, test_f1: 0.6144
 epoch: 6, train_loss: 0.8305, test_loss: 1.0333, test_f1: 0.5991
 epoch: 7, train_loss: 0.8320, test_loss: 1.0206, test_f1: 0.6083
 epoch: 8, train_loss: 0.7990, test_loss: 1.1165, test_f1: 0.5500
 epoch: 9, train_loss: 0.7862, test_loss: 1.0336, test_f1: 0.5638
 epoch: 10, train_loss: 0.7817, test_loss: 1.0662, test_f1: 0.5775
 epoch: 11, train_loss: 0.7589, test_loss: 1.0698, test_f1: 0.5947
 epoch: 12, train_loss: 0.7380, test_loss: 1.0863, test_f1: 0.5317
 epoch: 13, train_loss: 0.7358, test_loss: 1.1677, test_f1: 0.5232
 epoch: 14, train_loss: 0.7162, test_loss: 0.9734, test_f1: 0.6174
 epoch: 15, train_loss: 0.7193, test_loss: 1.0875, test_f1: 0.5608
 epoch: 16, train_loss: 0.6990, test_loss: 1.0293, test_f1: 0.6339
 epoch: 17, train_loss: 0.6769, test_loss: 1.1175, test_f1: 0.5715
 epoch: 18, train_loss: 0.6807, test_loss: 1.1044, test_f1: 0.6156
 epoch: 19, train_loss: 0.6801, test_loss: 1.3319, test_f1: 0.5114
 epoch: 20, train_loss: 0.6682, test_loss: 1.1352, test_f1: 0.5554
 epoch: 21, train_loss: 0.6388, test_loss: 1.1019, test_f1: 0.6350
 epoch: 22, train_loss: 0.6321, test_loss: 1.0851, test_f1: 0.6157
 epoch: 23, train_loss: 0.6398, test_loss: 1.1619, test_f1: 0.5456
 epoch: 24, train_loss: 0.6467, test_loss: 1.1381, test_f1: 0.5489
 epoch: 25, train_loss: 0.6063, test_loss: 1.2409, test_f1: 0.6009
 epoch: 26, train_loss: 0.6410, test_loss: 1.0604, test_f1: 0.6415
 epoch: 27, train_loss: 0.6171, test_loss: 1.0761, test_f1: 0.6603
 epoch: 28, train_loss: 0.5915, test_loss: 1.0332, test_f1: 0.6323
 epoch: 29, train_loss: 0.6005, test_loss: 1.0850, test_f1: 0.6011
 epoch: 30, train_loss: 0.5730, test_loss: 1.1316, test_f1: 0.5983
 epoch: 31, train_loss: 0.5595, test_loss: 1.1117, test_f1: 0.6411
 epoch: 32, train_loss: 0.5798, test_loss: 1.2130, test_f1: 0.5374
 epoch: 33, train_loss: 0.5454, test_loss: 1.1879, test_f1: 0.6335
 epoch: 34, train_loss: 0.5868, test_loss: 1.1841, test_f1: 0.5681
 epoch: 35, train_loss: 0.5853, test_loss: 1.2008, test_f1: 0.5509
 epoch: 36, train_loss: 0.5563, test_loss: 1.1520, test_f1: 0.6302
 epoch: 37, train_loss: 0.5445, test_loss: 1.2028, test_f1: 0.6750
 epoch: 38, train_loss: 0.5460, test_loss: 1.3800, test_f1: 0.5467
 epoch: 39, train_loss: 0.4964, test_loss: 1.2106, test_f1: 0.6180
 epoch: 40, train_loss: 0.5170, test_loss: 1.2399, test_f1: 0.6430
 epoch: 41, train_loss: 0.4968, test_loss: 1.2351, test_f1: 0.6229
 epoch: 42, train_loss: 0.5114, test_loss: 1.1452, test_f1: 0.6533
 epoch: 43, train_loss: 0.4805, test_loss: 1.3235, test_f1: 0.6042
 epoch: 44, train_loss: 0.4699, test_loss: 1.3764, test_f1: 0.6218
 epoch: 45, train_loss: 0.4816, test_loss: 1.2020, test_f1: 0.6486
 epoch: 46, train_loss: 0.4714, test_loss: 1.2463, test_f1: 0.6405
 epoch: 47, train_loss: 0.4981, test_loss: 1.2416, test_f1: 0.6262
 epoch: 48, train_loss: 0.4618, test_loss: 1.3622, test_f1: 0.5998
 epoch: 49, train_loss: 0.4465, test_loss: 1.4519, test_f1: 0.5960
 epoch: 50, train_loss: 0.4318, test_loss: 1.4028, test_f1: 0.6045
 epoch: 51, train_loss: 0.4221, test_loss: 1.3869, test_f1: 0.5958
 epoch: 52, train_loss: 0.3783, test_loss: 1.4591, test_f1: 0.6128
 epoch: 53, train_loss: 0.3931, test_loss: 1.4657, test_f1: 0.6115
 epoch: 54, train_loss: 0.3975, test_loss: 1.3786, test_f1: 0.6302
 epoch: 55, train_loss: 0.3698, test_loss: 1.5213, test_f1: 0.6411
 epoch: 56, train_loss: 0.3745, test_loss: 1.4694, test_f1: 0.6139
 epoch: 57, train_loss: 0.3639, test_loss: 1.4637, test_f1: 0.6455
 epoch: 58, train_loss: 0.3660, test_loss: 1.5976, test_f1: 0.6289
 epoch: 59, train_loss: 0.3754, test_loss: 1.4190, test_f1: 0.6640
 epoch: 60, train_loss: 0.3246, test_loss: 1.6063, test_f1: 0.5954
 epoch: 61, train_loss: 0.3397, test_loss: 1.5423, test_f1: 0.6248
 epoch: 62, train_loss: 0.3453, test_loss: 1.4623, test_f1: 0.6133
 epoch: 63, train_loss: 0.3457, test_loss: 1.5893, test_f1: 0.6166
 epoch: 64, train_loss: 0.3328, test_loss: 1.4873, test_f1: 0.6385
 epoch: 65, train_loss: 0.3264, test_loss: 1.5519, test_f1: 0.6189
 epoch: 66, train_loss: 0.3264, test_loss: 1.4723, test_f1: 0.6639
 epoch: 67, train_loss: 0.3401, test_loss: 1.4917, test_f1: 0.6345
 epoch: 68, train_loss: 0.3228, test_loss: 1.5894, test_f1: 0.6122
 epoch: 69, train_loss: 0.3483, test_loss: 1.4814, test_f1: 0.6526
 epoch: 70, train_loss: 0.3176, test_loss: 1.5288, test_f1: 0.6324
 epoch: 71, train_loss: 0.3186, test_loss: 1.7493, test_f1: 0.6090
 epoch: 72, train_loss: 0.3019, test_loss: 1.4922, test_f1: 0.6066
 epoch: 73, train_loss: 0.3110, test_loss: 1.6100, test_f1: 0.6073
 epoch: 74, train_loss: 0.3431, test_loss: 1.5178, test_f1: 0.6478
 epoch: 75, train_loss: 0.3139, test_loss: 1.4866, test_f1: 0.6705
 epoch: 76, train_loss: 0.3180, test_loss: 1.6265, test_f1: 0.6171
 epoch: 77, train_loss: 0.3073, test_loss: 1.5744, test_f1: 0.6491
 epoch: 78, train_loss: 0.3242, test_loss: 1.5697, test_f1: 0.6071
 epoch: 79, train_loss: 0.2943, test_loss: 1.6658, test_f1: 0.6671
 epoch: 80, train_loss: 0.2671, test_loss: 1.7070, test_f1: 0.6503
 epoch: 81, train_loss: 0.2749, test_loss: 1.6383, test_f1: 0.6467
 epoch: 82, train_loss: 0.2902, test_loss: 1.8088, test_f1: 0.6284
 epoch: 83, train_loss: 0.2853, test_loss: 1.7108, test_f1: 0.6021
 epoch: 84, train_loss: 0.2856, test_loss: 1.7600, test_f1: 0.6114
 epoch: 85, train_loss: 0.2927, test_loss: 1.6925, test_f1: 0.6827
 epoch: 86, train_loss: 0.2627, test_loss: 1.7806, test_f1: 0.6444
 epoch: 87, train_loss: 0.2663, test_loss: 1.7036, test_f1: 0.6563
 epoch: 88, train_loss: 0.2987, test_loss: 1.7575, test_f1: 0.6620
 epoch: 89, train_loss: 0.2981, test_loss: 1.8729, test_f1: 0.6253
 epoch: 90, train_loss: 0.2600, test_loss: 1.6875, test_f1: 0.6195
 epoch: 91, train_loss: 0.2495, test_loss: 1.8756, test_f1: 0.6153
 epoch: 92, train_loss: 0.2384, test_loss: 1.9440, test_f1: 0.6456
 epoch: 93, train_loss: 0.2747, test_loss: 1.8747, test_f1: 0.6230
 epoch: 94, train_loss: 0.2642, test_loss: 1.9048, test_f1: 0.6409
 epoch: 95, train_loss: 0.2612, test_loss: 1.8252, test_f1: 0.6476
 epoch: 96, train_loss: 0.2341, test_loss: 1.9436, test_f1: 0.6236
 epoch: 97, train_loss: 0.2756, test_loss: 1.7581, test_f1: 0.6603
 epoch: 98, train_loss: 0.2518, test_loss: 1.7227, test_f1: 0.6425
 epoch: 99, train_loss: 0.2330, test_loss: 1.8425, test_f1: 0.6224

Training completed in 784.40 seconds
Best F1: 0.6850 at epoch 58
Mean F1 across iterations: 0.6606  0.0183
========================FINAL RESULTS================================
FEGIN weighted F1: 0.6850  0.0183
python main.py --data ltspice_demos --representation component_pin_net --model FEGIN --layers 2 --hiddens 64 --batch_size 32 --lr 0.001 --emb_size 128 --epochs 100 --save_appendix component_pin_net_L2_H64_BS32_LR0.001_E128 --no_val
-----



STDERR:
  File "main.py", line 370, in <module>
    main()
  File "main.py", line 254, in main
    dataset = dataset_class(
  File "/home/philip/projects/ltspice_examples_code_repo/Circuit-Completion-Using-GNNs/component_classification_with_link_prediction_head/evaluation/FEGIN/kernel/circuit_datasets.py", line 15, in __init__
    self.data, self.slices = torch.load(self.processed_paths[0])
  File "/home/philip/.local/lib/python3.8/site-packages/torch/serialization.py", line 1040, in load
    warnings.warn(
  File "/usr/lib/python3.8/warnings.py", line 109, in _showwarnmsg
    sw(msg.message, msg.category, msg.filename, msg.lineno,
  File "main.py", line 47, in warn_with_traceback
    traceback.print_stack(file=log)
/home/philip/projects/ltspice_examples_code_repo/Circuit-Completion-Using-GNNs/component_classification_with_link_prediction_head/evaluation/FEGIN/kernel/circuit_datasets.py:15: FutureWarning: You are using `torch.load` with `weights_only=False` (the current default value), which uses the default pickle module implicitly. It is possible to construct malicious pickle data which will execute arbitrary code during unpickling (See https://github.com/pytorch/pytorch/blob/main/SECURITY.md#untrusted-models for more details). In a future release, the default value for `weights_only` will be flipped to `True`. This limits the functions that could be executed during unpickling. Arbitrary objects will no longer be allowed to be loaded via this mode unless they are explicitly allowlisted by the user via `torch.serialization.add_safe_globals`. We recommend you start setting `weights_only=True` for any use case where you don't have full control of the loaded file. Please open an issue on GitHub for any issues related to this experimental feature.
  self.data, self.slices = torch.load(self.processed_paths[0])
