STDOUT:
Results will be saved in /home/philip/projects/llm_inference_code_repo/Circuit-Completion-Using-GNNs/component_classification_with_link_prediction_head/evaluation/FEGIN/results/model_FEGIN_dataset_ltspice_examples
Command line input: python main.py --data ltspice_examples --representation component_net --model FEGIN --layers 2 --hiddens 64 --batch_size 64 --lr 0.0001 --emb_size 128 --epochs 100 --save_appendix component_net_L2_H64_BS64_LR0.0001_E128 --no_val
 is saved.
-----
ltspice_examples - FEGIN
Using 2 layers, 64 hidden units, h = 2
Loading component_net representation dataset
ENTERED
Training FEGIN on component_net representation
Train: 3558, Test: 846
##################ITERATION #0 ****************************************
 epoch: 0, train_loss: 1.3538, test_loss: 1.3456, test_f1: 0.2270
 epoch: 1, train_loss: 1.3357, test_loss: 1.3303, test_f1: 0.2270
 epoch: 2, train_loss: 1.3201, test_loss: 1.3120, test_f1: 0.2270
 epoch: 3, train_loss: 1.3007, test_loss: 1.2908, test_f1: 0.2270
 epoch: 4, train_loss: 1.2797, test_loss: 1.2655, test_f1: 0.2270
 epoch: 5, train_loss: 1.2576, test_loss: 1.2397, test_f1: 0.2270
 epoch: 6, train_loss: 1.2368, test_loss: 1.2210, test_f1: 0.2270
 epoch: 7, train_loss: 1.2234, test_loss: 1.1993, test_f1: 0.2512
 epoch: 8, train_loss: 1.2034, test_loss: 1.1790, test_f1: 0.2835
 epoch: 9, train_loss: 1.1836, test_loss: 1.1515, test_f1: 0.3431
 epoch: 10, train_loss: 1.1634, test_loss: 1.1222, test_f1: 0.3708
 epoch: 11, train_loss: 1.1364, test_loss: 1.0911, test_f1: 0.3928
 epoch: 12, train_loss: 1.1035, test_loss: 1.0596, test_f1: 0.4173
 epoch: 13, train_loss: 1.0864, test_loss: 1.0418, test_f1: 0.4018
 epoch: 14, train_loss: 1.0673, test_loss: 1.0163, test_f1: 0.4115
 epoch: 15, train_loss: 1.0479, test_loss: 1.0019, test_f1: 0.4341
 epoch: 16, train_loss: 1.0350, test_loss: 0.9962, test_f1: 0.4369
 epoch: 17, train_loss: 1.0217, test_loss: 0.9797, test_f1: 0.4570
 epoch: 18, train_loss: 1.0069, test_loss: 0.9746, test_f1: 0.4626
 epoch: 19, train_loss: 0.9998, test_loss: 0.9694, test_f1: 0.4685
 epoch: 20, train_loss: 0.9889, test_loss: 0.9684, test_f1: 0.4720
 epoch: 21, train_loss: 0.9788, test_loss: 0.9503, test_f1: 0.4885
 epoch: 22, train_loss: 0.9660, test_loss: 0.9440, test_f1: 0.5002
 epoch: 23, train_loss: 0.9581, test_loss: 0.9477, test_f1: 0.4860
 epoch: 24, train_loss: 0.9542, test_loss: 0.9403, test_f1: 0.4883
 epoch: 25, train_loss: 0.9404, test_loss: 0.9378, test_f1: 0.4694
 epoch: 26, train_loss: 0.9396, test_loss: 0.9241, test_f1: 0.5032
 epoch: 27, train_loss: 0.9322, test_loss: 0.9372, test_f1: 0.4979
 epoch: 28, train_loss: 0.9281, test_loss: 0.9447, test_f1: 0.5058
 epoch: 29, train_loss: 0.9211, test_loss: 0.9298, test_f1: 0.5155
 epoch: 30, train_loss: 0.9119, test_loss: 0.9282, test_f1: 0.5205
 epoch: 31, train_loss: 0.9036, test_loss: 0.9297, test_f1: 0.5057
 epoch: 32, train_loss: 0.9050, test_loss: 0.9258, test_f1: 0.5149
 epoch: 33, train_loss: 0.8942, test_loss: 0.9392, test_f1: 0.4989
 epoch: 34, train_loss: 0.8949, test_loss: 0.9239, test_f1: 0.5180
 epoch: 35, train_loss: 0.8999, test_loss: 0.9385, test_f1: 0.4998
 epoch: 36, train_loss: 0.8942, test_loss: 0.9278, test_f1: 0.5051
 epoch: 37, train_loss: 0.8820, test_loss: 0.9032, test_f1: 0.5226
 epoch: 38, train_loss: 0.8888, test_loss: 0.9355, test_f1: 0.5104
 epoch: 39, train_loss: 0.8738, test_loss: 0.9259, test_f1: 0.5243
 epoch: 40, train_loss: 0.8855, test_loss: 0.9407, test_f1: 0.5132
 epoch: 41, train_loss: 0.8720, test_loss: 0.9308, test_f1: 0.5237
 epoch: 42, train_loss: 0.8695, test_loss: 0.9078, test_f1: 0.5300
 epoch: 43, train_loss: 0.8632, test_loss: 0.9089, test_f1: 0.5250
 epoch: 44, train_loss: 0.8652, test_loss: 0.9113, test_f1: 0.5319
 epoch: 45, train_loss: 0.8558, test_loss: 0.9180, test_f1: 0.5189
 epoch: 46, train_loss: 0.8600, test_loss: 0.9229, test_f1: 0.5258
 epoch: 47, train_loss: 0.8595, test_loss: 0.9288, test_f1: 0.5211
 epoch: 48, train_loss: 0.8511, test_loss: 0.9086, test_f1: 0.5335
 epoch: 49, train_loss: 0.8527, test_loss: 0.9038, test_f1: 0.5290
 epoch: 50, train_loss: 0.8401, test_loss: 0.9317, test_f1: 0.5274
 epoch: 51, train_loss: 0.8415, test_loss: 0.9405, test_f1: 0.5291
 epoch: 52, train_loss: 0.8391, test_loss: 0.9301, test_f1: 0.5330
 epoch: 53, train_loss: 0.8403, test_loss: 0.9333, test_f1: 0.5313
 epoch: 54, train_loss: 0.8409, test_loss: 0.9145, test_f1: 0.5351
 epoch: 55, train_loss: 0.8375, test_loss: 0.9254, test_f1: 0.5351
 epoch: 56, train_loss: 0.8389, test_loss: 0.9414, test_f1: 0.5317
 epoch: 57, train_loss: 0.8336, test_loss: 0.9165, test_f1: 0.5393
 epoch: 58, train_loss: 0.8369, test_loss: 0.9244, test_f1: 0.5357
 epoch: 59, train_loss: 0.8338, test_loss: 0.9232, test_f1: 0.5392
 epoch: 60, train_loss: 0.8303, test_loss: 0.9356, test_f1: 0.5298
 epoch: 61, train_loss: 0.8322, test_loss: 0.9432, test_f1: 0.5233
 epoch: 62, train_loss: 0.8277, test_loss: 0.9386, test_f1: 0.5283
 epoch: 63, train_loss: 0.8348, test_loss: 0.9268, test_f1: 0.5331
 epoch: 64, train_loss: 0.8306, test_loss: 0.9405, test_f1: 0.5355
 epoch: 65, train_loss: 0.8281, test_loss: 0.9343, test_f1: 0.5315
 epoch: 66, train_loss: 0.8348, test_loss: 0.9395, test_f1: 0.5390
 epoch: 67, train_loss: 0.8288, test_loss: 0.9447, test_f1: 0.5305
 epoch: 68, train_loss: 0.8213, test_loss: 0.9455, test_f1: 0.5371
 epoch: 69, train_loss: 0.8234, test_loss: 0.9319, test_f1: 0.5385
 epoch: 70, train_loss: 0.8211, test_loss: 0.9360, test_f1: 0.5301
 epoch: 71, train_loss: 0.8158, test_loss: 0.9451, test_f1: 0.5456
 epoch: 72, train_loss: 0.8164, test_loss: 0.9409, test_f1: 0.5389
 epoch: 73, train_loss: 0.8156, test_loss: 0.9351, test_f1: 0.5500
 epoch: 74, train_loss: 0.8165, test_loss: 0.9409, test_f1: 0.5385
 epoch: 75, train_loss: 0.8128, test_loss: 0.9351, test_f1: 0.5399
 epoch: 76, train_loss: 0.8149, test_loss: 0.9431, test_f1: 0.5415
 epoch: 77, train_loss: 0.8166, test_loss: 0.9338, test_f1: 0.5416
 epoch: 78, train_loss: 0.8123, test_loss: 0.9391, test_f1: 0.5403
 epoch: 79, train_loss: 0.8082, test_loss: 0.9462, test_f1: 0.5464
 epoch: 80, train_loss: 0.8203, test_loss: 0.9518, test_f1: 0.5389
 epoch: 81, train_loss: 0.8139, test_loss: 0.9494, test_f1: 0.5377
 epoch: 82, train_loss: 0.8058, test_loss: 0.9377, test_f1: 0.5413
 epoch: 83, train_loss: 0.8094, test_loss: 0.9303, test_f1: 0.5362
 epoch: 84, train_loss: 0.8025, test_loss: 0.9381, test_f1: 0.5373
 epoch: 85, train_loss: 0.8042, test_loss: 0.9483, test_f1: 0.5409
 epoch: 86, train_loss: 0.8118, test_loss: 0.9560, test_f1: 0.5422
 epoch: 87, train_loss: 0.8058, test_loss: 0.9433, test_f1: 0.5393
 epoch: 88, train_loss: 0.8060, test_loss: 0.9553, test_f1: 0.5350
 epoch: 89, train_loss: 0.8005, test_loss: 0.9537, test_f1: 0.5416
 epoch: 90, train_loss: 0.7982, test_loss: 0.9466, test_f1: 0.5399
 epoch: 91, train_loss: 0.7934, test_loss: 0.9446, test_f1: 0.5435
 epoch: 92, train_loss: 0.7932, test_loss: 0.9449, test_f1: 0.5520
 epoch: 93, train_loss: 0.7989, test_loss: 0.9469, test_f1: 0.5475
 epoch: 94, train_loss: 0.7972, test_loss: 0.9454, test_f1: 0.5411
 epoch: 95, train_loss: 0.7962, test_loss: 0.9492, test_f1: 0.5465
 epoch: 96, train_loss: 0.7927, test_loss: 0.9591, test_f1: 0.5471
 epoch: 97, train_loss: 0.7913, test_loss: 0.9424, test_f1: 0.5433
 epoch: 98, train_loss: 0.7828, test_loss: 0.9550, test_f1: 0.5448
 epoch: 99, train_loss: 0.7977, test_loss: 0.9517, test_f1: 0.5526
##################ITERATION #1 ****************************************
 epoch: 0, train_loss: 1.3012, test_loss: 1.2823, test_f1: 0.2270
 epoch: 1, train_loss: 1.2533, test_loss: 1.2288, test_f1: 0.2270
 epoch: 2, train_loss: 1.2261, test_loss: 1.1912, test_f1: 0.2903
 epoch: 3, train_loss: 1.1961, test_loss: 1.1569, test_f1: 0.3337
 epoch: 4, train_loss: 1.1640, test_loss: 1.1213, test_f1: 0.3764
 epoch: 5, train_loss: 1.1368, test_loss: 1.0852, test_f1: 0.4046
 epoch: 6, train_loss: 1.1089, test_loss: 1.0588, test_f1: 0.4205
 epoch: 7, train_loss: 1.0829, test_loss: 1.0360, test_f1: 0.4319
 epoch: 8, train_loss: 1.0590, test_loss: 1.0184, test_f1: 0.4498
 epoch: 9, train_loss: 1.0432, test_loss: 1.0010, test_f1: 0.4793
 epoch: 10, train_loss: 1.0224, test_loss: 0.9954, test_f1: 0.4666
 epoch: 11, train_loss: 1.0131, test_loss: 0.9847, test_f1: 0.4763
 epoch: 12, train_loss: 0.9953, test_loss: 0.9760, test_f1: 0.4814
 epoch: 13, train_loss: 0.9853, test_loss: 0.9629, test_f1: 0.4851
 epoch: 14, train_loss: 0.9795, test_loss: 0.9629, test_f1: 0.4818
 epoch: 15, train_loss: 0.9673, test_loss: 0.9682, test_f1: 0.4779
 epoch: 16, train_loss: 0.9647, test_loss: 0.9557, test_f1: 0.4936
 epoch: 17, train_loss: 0.9576, test_loss: 0.9499, test_f1: 0.4969
 epoch: 18, train_loss: 0.9563, test_loss: 0.9452, test_f1: 0.4854
 epoch: 19, train_loss: 0.9513, test_loss: 0.9486, test_f1: 0.4905
 epoch: 20, train_loss: 0.9378, test_loss: 0.9344, test_f1: 0.4909
 epoch: 21, train_loss: 0.9387, test_loss: 0.9456, test_f1: 0.4959
 epoch: 22, train_loss: 0.9361, test_loss: 0.9448, test_f1: 0.4838
 epoch: 23, train_loss: 0.9273, test_loss: 0.9291, test_f1: 0.4921
 epoch: 24, train_loss: 0.9239, test_loss: 0.9587, test_f1: 0.4909
 epoch: 25, train_loss: 0.9335, test_loss: 0.9351, test_f1: 0.4929
 epoch: 26, train_loss: 0.9148, test_loss: 0.9444, test_f1: 0.4882
 epoch: 27, train_loss: 0.9172, test_loss: 0.9187, test_f1: 0.4968
 epoch: 28, train_loss: 0.9079, test_loss: 0.9319, test_f1: 0.5193
 epoch: 29, train_loss: 0.9054, test_loss: 0.9349, test_f1: 0.4972
 epoch: 30, train_loss: 0.9024, test_loss: 0.9382, test_f1: 0.4992
 epoch: 31, train_loss: 0.9040, test_loss: 0.9268, test_f1: 0.5010
 epoch: 32, train_loss: 0.8918, test_loss: 0.9346, test_f1: 0.4956
 epoch: 33, train_loss: 0.9083, test_loss: 0.9296, test_f1: 0.5105
 epoch: 34, train_loss: 0.8962, test_loss: 0.9211, test_f1: 0.5149
 epoch: 35, train_loss: 0.8888, test_loss: 0.9140, test_f1: 0.5134
 epoch: 36, train_loss: 0.8832, test_loss: 0.9315, test_f1: 0.5096
 epoch: 37, train_loss: 0.8874, test_loss: 0.9302, test_f1: 0.5041
 epoch: 38, train_loss: 0.8859, test_loss: 0.9117, test_f1: 0.5131
 epoch: 39, train_loss: 0.8784, test_loss: 0.9424, test_f1: 0.5015
 epoch: 40, train_loss: 0.8738, test_loss: 0.9147, test_f1: 0.5264
 epoch: 41, train_loss: 0.8755, test_loss: 0.9367, test_f1: 0.5139
 epoch: 42, train_loss: 0.8715, test_loss: 0.9148, test_f1: 0.5141
 epoch: 43, train_loss: 0.8723, test_loss: 0.9111, test_f1: 0.5199
 epoch: 44, train_loss: 0.8670, test_loss: 0.9288, test_f1: 0.5140
 epoch: 45, train_loss: 0.8676, test_loss: 0.9093, test_f1: 0.5184
 epoch: 46, train_loss: 0.8595, test_loss: 0.9074, test_f1: 0.5242
 epoch: 47, train_loss: 0.8700, test_loss: 0.9100, test_f1: 0.5097
 epoch: 48, train_loss: 0.8640, test_loss: 0.9106, test_f1: 0.5264
 epoch: 49, train_loss: 0.8572, test_loss: 0.9106, test_f1: 0.5350
 epoch: 50, train_loss: 0.8562, test_loss: 0.9103, test_f1: 0.5322
 epoch: 51, train_loss: 0.8540, test_loss: 0.9040, test_f1: 0.5267
 epoch: 52, train_loss: 0.8441, test_loss: 0.9061, test_f1: 0.5290
 epoch: 53, train_loss: 0.8496, test_loss: 0.9082, test_f1: 0.5246
 epoch: 54, train_loss: 0.8436, test_loss: 0.9098, test_f1: 0.5293
 epoch: 55, train_loss: 0.8483, test_loss: 0.9007, test_f1: 0.5288
 epoch: 56, train_loss: 0.8357, test_loss: 0.8933, test_f1: 0.5319
 epoch: 57, train_loss: 0.8388, test_loss: 0.9019, test_f1: 0.5309
 epoch: 58, train_loss: 0.8376, test_loss: 0.9070, test_f1: 0.5236
 epoch: 59, train_loss: 0.8375, test_loss: 0.9080, test_f1: 0.5260
 epoch: 60, train_loss: 0.8467, test_loss: 0.9175, test_f1: 0.5228
 epoch: 61, train_loss: 0.8301, test_loss: 0.9077, test_f1: 0.5283
 epoch: 62, train_loss: 0.8295, test_loss: 0.9075, test_f1: 0.5296
 epoch: 63, train_loss: 0.8317, test_loss: 0.9038, test_f1: 0.5386
 epoch: 64, train_loss: 0.8279, test_loss: 0.9084, test_f1: 0.5351
 epoch: 65, train_loss: 0.8337, test_loss: 0.9145, test_f1: 0.5355
 epoch: 66, train_loss: 0.8334, test_loss: 0.9135, test_f1: 0.5304
 epoch: 67, train_loss: 0.8222, test_loss: 0.8985, test_f1: 0.5367
 epoch: 68, train_loss: 0.8239, test_loss: 0.9176, test_f1: 0.5237
 epoch: 69, train_loss: 0.8253, test_loss: 0.9224, test_f1: 0.5238
 epoch: 70, train_loss: 0.8198, test_loss: 0.9181, test_f1: 0.5349
 epoch: 71, train_loss: 0.8236, test_loss: 0.9022, test_f1: 0.5295
 epoch: 72, train_loss: 0.8139, test_loss: 0.9118, test_f1: 0.5262
 epoch: 73, train_loss: 0.8159, test_loss: 0.9143, test_f1: 0.5296
 epoch: 74, train_loss: 0.8241, test_loss: 0.9182, test_f1: 0.5241
 epoch: 75, train_loss: 0.8218, test_loss: 0.9130, test_f1: 0.5255
 epoch: 76, train_loss: 0.8231, test_loss: 0.9139, test_f1: 0.5275
 epoch: 77, train_loss: 0.8094, test_loss: 0.9131, test_f1: 0.5256
 epoch: 78, train_loss: 0.8156, test_loss: 0.9226, test_f1: 0.5359
 epoch: 79, train_loss: 0.8202, test_loss: 0.9058, test_f1: 0.5286
 epoch: 80, train_loss: 0.8103, test_loss: 0.9084, test_f1: 0.5332
 epoch: 81, train_loss: 0.8135, test_loss: 0.9074, test_f1: 0.5360
 epoch: 82, train_loss: 0.8160, test_loss: 0.9037, test_f1: 0.5332
 epoch: 83, train_loss: 0.8134, test_loss: 0.9159, test_f1: 0.5397
 epoch: 84, train_loss: 0.8181, test_loss: 0.9103, test_f1: 0.5457
 epoch: 85, train_loss: 0.8105, test_loss: 0.9137, test_f1: 0.5319
 epoch: 86, train_loss: 0.8112, test_loss: 0.9169, test_f1: 0.5345
 epoch: 87, train_loss: 0.8110, test_loss: 0.9147, test_f1: 0.5391
 epoch: 88, train_loss: 0.8102, test_loss: 0.9123, test_f1: 0.5438
 epoch: 89, train_loss: 0.8052, test_loss: 0.9119, test_f1: 0.5364
 epoch: 90, train_loss: 0.8045, test_loss: 0.9124, test_f1: 0.5383
 epoch: 91, train_loss: 0.8042, test_loss: 0.9185, test_f1: 0.5415
 epoch: 92, train_loss: 0.7993, test_loss: 0.9052, test_f1: 0.5519
 epoch: 93, train_loss: 0.8012, test_loss: 0.9058, test_f1: 0.5368
 epoch: 94, train_loss: 0.7953, test_loss: 0.9181, test_f1: 0.5384
 epoch: 95, train_loss: 0.7989, test_loss: 0.9156, test_f1: 0.5388
 epoch: 96, train_loss: 0.8087, test_loss: 0.9201, test_f1: 0.5386
 epoch: 97, train_loss: 0.7936, test_loss: 0.9193, test_f1: 0.5424
 epoch: 98, train_loss: 0.7974, test_loss: 0.9076, test_f1: 0.5358
 epoch: 99, train_loss: 0.7949, test_loss: 0.8921, test_f1: 0.5488
##################ITERATION #2 ****************************************
 epoch: 0, train_loss: 1.2717, test_loss: 1.2398, test_f1: 0.2799
 epoch: 1, train_loss: 1.2091, test_loss: 1.1643, test_f1: 0.3815
 epoch: 2, train_loss: 1.1766, test_loss: 1.1263, test_f1: 0.4069
 epoch: 3, train_loss: 1.1508, test_loss: 1.0937, test_f1: 0.4316
 epoch: 4, train_loss: 1.1226, test_loss: 1.0621, test_f1: 0.4452
 epoch: 5, train_loss: 1.0974, test_loss: 1.0341, test_f1: 0.4416
 epoch: 6, train_loss: 1.0696, test_loss: 1.0201, test_f1: 0.4466
 epoch: 7, train_loss: 1.0503, test_loss: 1.0097, test_f1: 0.4416
 epoch: 8, train_loss: 1.0288, test_loss: 0.9951, test_f1: 0.4514
 epoch: 9, train_loss: 1.0103, test_loss: 0.9863, test_f1: 0.4676
 epoch: 10, train_loss: 1.0002, test_loss: 0.9815, test_f1: 0.4570
 epoch: 11, train_loss: 0.9898, test_loss: 0.9821, test_f1: 0.4727
 epoch: 12, train_loss: 0.9868, test_loss: 0.9766, test_f1: 0.4823
 epoch: 13, train_loss: 0.9721, test_loss: 0.9738, test_f1: 0.4896
 epoch: 14, train_loss: 0.9674, test_loss: 0.9669, test_f1: 0.4870
 epoch: 15, train_loss: 0.9642, test_loss: 0.9646, test_f1: 0.4911
 epoch: 16, train_loss: 0.9559, test_loss: 0.9708, test_f1: 0.4874
 epoch: 17, train_loss: 0.9511, test_loss: 0.9569, test_f1: 0.4980
 epoch: 18, train_loss: 0.9371, test_loss: 0.9664, test_f1: 0.4843
 epoch: 19, train_loss: 0.9420, test_loss: 0.9587, test_f1: 0.4958
 epoch: 20, train_loss: 0.9361, test_loss: 0.9585, test_f1: 0.4923
 epoch: 21, train_loss: 0.9264, test_loss: 0.9515, test_f1: 0.4999
 epoch: 22, train_loss: 0.9210, test_loss: 0.9497, test_f1: 0.5025
 epoch: 23, train_loss: 0.9135, test_loss: 0.9419, test_f1: 0.5118
 epoch: 24, train_loss: 0.9178, test_loss: 0.9357, test_f1: 0.5056
 epoch: 25, train_loss: 0.9071, test_loss: 0.9574, test_f1: 0.4976
 epoch: 26, train_loss: 0.9036, test_loss: 0.9457, test_f1: 0.5020
 epoch: 27, train_loss: 0.9032, test_loss: 0.9293, test_f1: 0.5062
 epoch: 28, train_loss: 0.8997, test_loss: 0.9454, test_f1: 0.5030
 epoch: 29, train_loss: 0.9014, test_loss: 0.9425, test_f1: 0.5155
 epoch: 30, train_loss: 0.8822, test_loss: 0.9432, test_f1: 0.4968
 epoch: 31, train_loss: 0.8837, test_loss: 0.9654, test_f1: 0.5038
 epoch: 32, train_loss: 0.8813, test_loss: 0.9341, test_f1: 0.5121
 epoch: 33, train_loss: 0.8832, test_loss: 0.9403, test_f1: 0.5079
 epoch: 34, train_loss: 0.8785, test_loss: 0.9476, test_f1: 0.5008
 epoch: 35, train_loss: 0.8671, test_loss: 0.9402, test_f1: 0.5033
 epoch: 36, train_loss: 0.8691, test_loss: 0.9490, test_f1: 0.4986
 epoch: 37, train_loss: 0.8623, test_loss: 0.9333, test_f1: 0.5129
 epoch: 38, train_loss: 0.8635, test_loss: 0.9478, test_f1: 0.5112
 epoch: 39, train_loss: 0.8540, test_loss: 0.9325, test_f1: 0.5207
 epoch: 40, train_loss: 0.8586, test_loss: 0.9551, test_f1: 0.5136
 epoch: 41, train_loss: 0.8586, test_loss: 0.9145, test_f1: 0.5264
 epoch: 42, train_loss: 0.8438, test_loss: 0.9089, test_f1: 0.5299
 epoch: 43, train_loss: 0.8521, test_loss: 0.9120, test_f1: 0.5191
 epoch: 44, train_loss: 0.8503, test_loss: 0.9384, test_f1: 0.5253
 epoch: 45, train_loss: 0.8400, test_loss: 0.9191, test_f1: 0.5250
 epoch: 46, train_loss: 0.8394, test_loss: 0.9257, test_f1: 0.5237
 epoch: 47, train_loss: 0.8333, test_loss: 0.9151, test_f1: 0.5273
 epoch: 48, train_loss: 0.8299, test_loss: 0.9221, test_f1: 0.5128
 epoch: 49, train_loss: 0.8381, test_loss: 0.9174, test_f1: 0.5220
 epoch: 50, train_loss: 0.8152, test_loss: 0.9408, test_f1: 0.5194
 epoch: 51, train_loss: 0.8205, test_loss: 0.9090, test_f1: 0.5310
 epoch: 52, train_loss: 0.8178, test_loss: 0.9298, test_f1: 0.5132
 epoch: 53, train_loss: 0.8107, test_loss: 0.9318, test_f1: 0.5239
 epoch: 54, train_loss: 0.8139, test_loss: 0.9394, test_f1: 0.5274
 epoch: 55, train_loss: 0.8163, test_loss: 0.9354, test_f1: 0.5236
 epoch: 56, train_loss: 0.8136, test_loss: 0.9384, test_f1: 0.5234
 epoch: 57, train_loss: 0.8132, test_loss: 0.9151, test_f1: 0.5176
 epoch: 58, train_loss: 0.8177, test_loss: 0.9279, test_f1: 0.5282
 epoch: 59, train_loss: 0.8081, test_loss: 0.9233, test_f1: 0.5237
 epoch: 60, train_loss: 0.8017, test_loss: 0.9210, test_f1: 0.5252
 epoch: 61, train_loss: 0.7978, test_loss: 0.9164, test_f1: 0.5335
 epoch: 62, train_loss: 0.8053, test_loss: 0.9280, test_f1: 0.5245
 epoch: 63, train_loss: 0.7996, test_loss: 0.9170, test_f1: 0.5220
 epoch: 64, train_loss: 0.8110, test_loss: 0.9289, test_f1: 0.5228
 epoch: 65, train_loss: 0.8013, test_loss: 0.9086, test_f1: 0.5263
 epoch: 66, train_loss: 0.8011, test_loss: 0.9325, test_f1: 0.5279
 epoch: 67, train_loss: 0.7994, test_loss: 0.9245, test_f1: 0.5337
 epoch: 68, train_loss: 0.7924, test_loss: 0.9238, test_f1: 0.5317
 epoch: 69, train_loss: 0.7906, test_loss: 0.9179, test_f1: 0.5235
 epoch: 70, train_loss: 0.7936, test_loss: 0.9152, test_f1: 0.5236
 epoch: 71, train_loss: 0.7969, test_loss: 0.9334, test_f1: 0.5255
 epoch: 72, train_loss: 0.8024, test_loss: 0.9561, test_f1: 0.5313
 epoch: 73, train_loss: 0.7957, test_loss: 0.9397, test_f1: 0.5241
 epoch: 74, train_loss: 0.7878, test_loss: 0.9216, test_f1: 0.5332
 epoch: 75, train_loss: 0.7838, test_loss: 0.9199, test_f1: 0.5285
 epoch: 76, train_loss: 0.7859, test_loss: 0.9395, test_f1: 0.5304
 epoch: 77, train_loss: 0.7875, test_loss: 0.9345, test_f1: 0.5344
 epoch: 78, train_loss: 0.7899, test_loss: 0.9156, test_f1: 0.5247
 epoch: 79, train_loss: 0.7819, test_loss: 0.9336, test_f1: 0.5352
 epoch: 80, train_loss: 0.7859, test_loss: 0.9237, test_f1: 0.5292
 epoch: 81, train_loss: 0.7716, test_loss: 0.9259, test_f1: 0.5324
 epoch: 82, train_loss: 0.7774, test_loss: 0.9102, test_f1: 0.5417
 epoch: 83, train_loss: 0.7762, test_loss: 0.9535, test_f1: 0.5466
 epoch: 84, train_loss: 0.7760, test_loss: 0.9464, test_f1: 0.5385
 epoch: 85, train_loss: 0.7731, test_loss: 0.9463, test_f1: 0.5277
 epoch: 86, train_loss: 0.7777, test_loss: 0.9402, test_f1: 0.5197
 epoch: 87, train_loss: 0.7764, test_loss: 0.9329, test_f1: 0.5283
 epoch: 88, train_loss: 0.7739, test_loss: 0.9414, test_f1: 0.5306
 epoch: 89, train_loss: 0.7746, test_loss: 0.9356, test_f1: 0.5428
 epoch: 90, train_loss: 0.7754, test_loss: 0.9573, test_f1: 0.5332
 epoch: 91, train_loss: 0.7620, test_loss: 0.9224, test_f1: 0.5398
 epoch: 92, train_loss: 0.7700, test_loss: 0.9483, test_f1: 0.5411
 epoch: 93, train_loss: 0.7670, test_loss: 0.9289, test_f1: 0.5492
 epoch: 94, train_loss: 0.7653, test_loss: 0.9275, test_f1: 0.5433
 epoch: 95, train_loss: 0.7667, test_loss: 0.9415, test_f1: 0.5324
 epoch: 96, train_loss: 0.7609, test_loss: 0.9468, test_f1: 0.5428
 epoch: 97, train_loss: 0.7651, test_loss: 0.9467, test_f1: 0.5303
 epoch: 98, train_loss: 0.7643, test_loss: 0.9276, test_f1: 0.5394
 epoch: 99, train_loss: 0.7606, test_loss: 0.9270, test_f1: 0.5284
##################ITERATION #3 ****************************************
 epoch: 0, train_loss: 1.2593, test_loss: 1.2311, test_f1: 0.2287
 epoch: 1, train_loss: 1.1976, test_loss: 1.1615, test_f1: 0.3385
 epoch: 2, train_loss: 1.1747, test_loss: 1.1323, test_f1: 0.3671
 epoch: 3, train_loss: 1.1485, test_loss: 1.1082, test_f1: 0.3948
 epoch: 4, train_loss: 1.1258, test_loss: 1.0827, test_f1: 0.4221
 epoch: 5, train_loss: 1.1046, test_loss: 1.0634, test_f1: 0.4360
 epoch: 6, train_loss: 1.0837, test_loss: 1.0470, test_f1: 0.4443
 epoch: 7, train_loss: 1.0686, test_loss: 1.0266, test_f1: 0.4525
 epoch: 8, train_loss: 1.0531, test_loss: 1.0149, test_f1: 0.4681
 epoch: 9, train_loss: 1.0276, test_loss: 1.0028, test_f1: 0.4688
 epoch: 10, train_loss: 1.0168, test_loss: 0.9988, test_f1: 0.4733
 epoch: 11, train_loss: 1.0108, test_loss: 0.9825, test_f1: 0.4775
 epoch: 12, train_loss: 1.0029, test_loss: 0.9797, test_f1: 0.4798
 epoch: 13, train_loss: 0.9991, test_loss: 0.9766, test_f1: 0.4758
 epoch: 14, train_loss: 0.9836, test_loss: 0.9670, test_f1: 0.5031
 epoch: 15, train_loss: 0.9693, test_loss: 0.9585, test_f1: 0.4913
 epoch: 16, train_loss: 0.9645, test_loss: 0.9558, test_f1: 0.4941
 epoch: 17, train_loss: 0.9645, test_loss: 0.9650, test_f1: 0.5047
 epoch: 18, train_loss: 0.9553, test_loss: 0.9617, test_f1: 0.5177
 epoch: 19, train_loss: 0.9514, test_loss: 0.9519, test_f1: 0.5128
 epoch: 20, train_loss: 0.9503, test_loss: 0.9711, test_f1: 0.5018
 epoch: 21, train_loss: 0.9453, test_loss: 0.9544, test_f1: 0.5073
 epoch: 22, train_loss: 0.9372, test_loss: 0.9504, test_f1: 0.5176
 epoch: 23, train_loss: 0.9283, test_loss: 0.9647, test_f1: 0.5202
 epoch: 24, train_loss: 0.9310, test_loss: 0.9469, test_f1: 0.5294
 epoch: 25, train_loss: 0.9152, test_loss: 0.9307, test_f1: 0.5355
 epoch: 26, train_loss: 0.9191, test_loss: 0.9571, test_f1: 0.5272
 epoch: 27, train_loss: 0.9077, test_loss: 0.9549, test_f1: 0.5340
 epoch: 28, train_loss: 0.9068, test_loss: 0.9601, test_f1: 0.5213
 epoch: 29, train_loss: 0.9040, test_loss: 0.9508, test_f1: 0.5311
 epoch: 30, train_loss: 0.8951, test_loss: 0.9457, test_f1: 0.5315
 epoch: 31, train_loss: 0.8998, test_loss: 0.9527, test_f1: 0.5188
 epoch: 32, train_loss: 0.8907, test_loss: 0.9433, test_f1: 0.5369
 epoch: 33, train_loss: 0.8832, test_loss: 0.9648, test_f1: 0.5259
 epoch: 34, train_loss: 0.8847, test_loss: 0.9515, test_f1: 0.5321
 epoch: 35, train_loss: 0.8836, test_loss: 0.9649, test_f1: 0.5294
 epoch: 36, train_loss: 0.8901, test_loss: 0.9594, test_f1: 0.5362
 epoch: 37, train_loss: 0.8716, test_loss: 0.9563, test_f1: 0.5227
 epoch: 38, train_loss: 0.8781, test_loss: 0.9642, test_f1: 0.5269
 epoch: 39, train_loss: 0.8687, test_loss: 0.9533, test_f1: 0.5314
 epoch: 40, train_loss: 0.8684, test_loss: 0.9397, test_f1: 0.5428
 epoch: 41, train_loss: 0.8632, test_loss: 0.9729, test_f1: 0.5302
 epoch: 42, train_loss: 0.8529, test_loss: 0.9426, test_f1: 0.5475
 epoch: 43, train_loss: 0.8591, test_loss: 0.9511, test_f1: 0.5359
 epoch: 44, train_loss: 0.8550, test_loss: 0.9411, test_f1: 0.5347
 epoch: 45, train_loss: 0.8523, test_loss: 0.9513, test_f1: 0.5311
 epoch: 46, train_loss: 0.8458, test_loss: 0.9576, test_f1: 0.5364
 epoch: 47, train_loss: 0.8564, test_loss: 0.9447, test_f1: 0.5340
 epoch: 48, train_loss: 0.8521, test_loss: 0.9631, test_f1: 0.5442
 epoch: 49, train_loss: 0.8378, test_loss: 0.9636, test_f1: 0.5264
 epoch: 50, train_loss: 0.8392, test_loss: 0.9642, test_f1: 0.5417
 epoch: 51, train_loss: 0.8341, test_loss: 0.9451, test_f1: 0.5427
 epoch: 52, train_loss: 0.8265, test_loss: 0.9588, test_f1: 0.5443
 epoch: 53, train_loss: 0.8245, test_loss: 0.9640, test_f1: 0.5436
 epoch: 54, train_loss: 0.8310, test_loss: 0.9630, test_f1: 0.5446
 epoch: 55, train_loss: 0.8302, test_loss: 0.9611, test_f1: 0.5428
 epoch: 56, train_loss: 0.8232, test_loss: 0.9739, test_f1: 0.5436
 epoch: 57, train_loss: 0.8216, test_loss: 0.9695, test_f1: 0.5454
 epoch: 58, train_loss: 0.8169, test_loss: 0.9641, test_f1: 0.5469
 epoch: 59, train_loss: 0.8227, test_loss: 0.9729, test_f1: 0.5420
 epoch: 60, train_loss: 0.8207, test_loss: 0.9701, test_f1: 0.5456
 epoch: 61, train_loss: 0.8259, test_loss: 0.9696, test_f1: 0.5423
 epoch: 62, train_loss: 0.8138, test_loss: 0.9573, test_f1: 0.5444
 epoch: 63, train_loss: 0.8139, test_loss: 0.9570, test_f1: 0.5355
 epoch: 64, train_loss: 0.8038, test_loss: 0.9736, test_f1: 0.5485
 epoch: 65, train_loss: 0.7994, test_loss: 0.9671, test_f1: 0.5468
 epoch: 66, train_loss: 0.8037, test_loss: 0.9637, test_f1: 0.5499
 epoch: 67, train_loss: 0.8106, test_loss: 0.9628, test_f1: 0.5433
 epoch: 68, train_loss: 0.8103, test_loss: 0.9664, test_f1: 0.5521
 epoch: 69, train_loss: 0.8118, test_loss: 0.9553, test_f1: 0.5483
 epoch: 70, train_loss: 0.7993, test_loss: 0.9611, test_f1: 0.5488
 epoch: 71, train_loss: 0.8064, test_loss: 0.9694, test_f1: 0.5500
 epoch: 72, train_loss: 0.8018, test_loss: 0.9709, test_f1: 0.5456
 epoch: 73, train_loss: 0.8017, test_loss: 0.9679, test_f1: 0.5455
 epoch: 74, train_loss: 0.7992, test_loss: 0.9591, test_f1: 0.5526
 epoch: 75, train_loss: 0.8018, test_loss: 0.9605, test_f1: 0.5460
 epoch: 76, train_loss: 0.7990, test_loss: 0.9639, test_f1: 0.5533
 epoch: 77, train_loss: 0.7934, test_loss: 0.9723, test_f1: 0.5491
 epoch: 78, train_loss: 0.7872, test_loss: 0.9780, test_f1: 0.5535
 epoch: 79, train_loss: 0.7882, test_loss: 0.9552, test_f1: 0.5474
 epoch: 80, train_loss: 0.7919, test_loss: 0.9596, test_f1: 0.5493
 epoch: 81, train_loss: 0.7964, test_loss: 0.9672, test_f1: 0.5504
 epoch: 82, train_loss: 0.7955, test_loss: 0.9554, test_f1: 0.5548
 epoch: 83, train_loss: 0.7812, test_loss: 0.9630, test_f1: 0.5478
 epoch: 84, train_loss: 0.7946, test_loss: 0.9665, test_f1: 0.5571
 epoch: 85, train_loss: 0.7862, test_loss: 0.9639, test_f1: 0.5500
 epoch: 86, train_loss: 0.7970, test_loss: 0.9596, test_f1: 0.5641
 epoch: 87, train_loss: 0.7947, test_loss: 0.9664, test_f1: 0.5565
 epoch: 88, train_loss: 0.7806, test_loss: 0.9663, test_f1: 0.5506
 epoch: 89, train_loss: 0.7799, test_loss: 0.9631, test_f1: 0.5497
 epoch: 90, train_loss: 0.7864, test_loss: 0.9649, test_f1: 0.5500
 epoch: 91, train_loss: 0.7870, test_loss: 0.9755, test_f1: 0.5560
 epoch: 92, train_loss: 0.7760, test_loss: 0.9621, test_f1: 0.5468
 epoch: 93, train_loss: 0.7699, test_loss: 0.9964, test_f1: 0.5595
 epoch: 94, train_loss: 0.7835, test_loss: 0.9609, test_f1: 0.5656
 epoch: 95, train_loss: 0.7786, test_loss: 0.9737, test_f1: 0.5580
 epoch: 96, train_loss: 0.7732, test_loss: 0.9692, test_f1: 0.5609
 epoch: 97, train_loss: 0.7714, test_loss: 0.9784, test_f1: 0.5589
 epoch: 98, train_loss: 0.7719, test_loss: 0.9836, test_f1: 0.5532
 epoch: 99, train_loss: 0.7768, test_loss: 0.9773, test_f1: 0.5535
##################ITERATION #4 ****************************************
 epoch: 0, train_loss: 1.2745, test_loss: 1.2273, test_f1: 0.2392
 epoch: 1, train_loss: 1.1816, test_loss: 1.1103, test_f1: 0.3781
 epoch: 2, train_loss: 1.1485, test_loss: 1.0823, test_f1: 0.4307
 epoch: 3, train_loss: 1.1337, test_loss: 1.0551, test_f1: 0.4404
 epoch: 4, train_loss: 1.1016, test_loss: 1.0351, test_f1: 0.4576
 epoch: 5, train_loss: 1.0814, test_loss: 1.0135, test_f1: 0.4706
 epoch: 6, train_loss: 1.0598, test_loss: 0.9966, test_f1: 0.4569
 epoch: 7, train_loss: 1.0469, test_loss: 0.9824, test_f1: 0.4700
 epoch: 8, train_loss: 1.0346, test_loss: 0.9665, test_f1: 0.4765
 epoch: 9, train_loss: 1.0198, test_loss: 0.9625, test_f1: 0.4803
 epoch: 10, train_loss: 1.0106, test_loss: 0.9589, test_f1: 0.4927
 epoch: 11, train_loss: 0.9924, test_loss: 0.9454, test_f1: 0.4863
 epoch: 12, train_loss: 0.9862, test_loss: 0.9427, test_f1: 0.4907
 epoch: 13, train_loss: 0.9777, test_loss: 0.9449, test_f1: 0.4947
 epoch: 14, train_loss: 0.9680, test_loss: 0.9375, test_f1: 0.5041
 epoch: 15, train_loss: 0.9537, test_loss: 0.9321, test_f1: 0.4989
 epoch: 16, train_loss: 0.9585, test_loss: 0.9276, test_f1: 0.5023
 epoch: 17, train_loss: 0.9555, test_loss: 0.9223, test_f1: 0.4980
 epoch: 18, train_loss: 0.9341, test_loss: 0.9178, test_f1: 0.5126
 epoch: 19, train_loss: 0.9333, test_loss: 0.9278, test_f1: 0.5130
 epoch: 20, train_loss: 0.9356, test_loss: 0.9156, test_f1: 0.5181
 epoch: 21, train_loss: 0.9328, test_loss: 0.9194, test_f1: 0.5163
 epoch: 22, train_loss: 0.9172, test_loss: 0.9217, test_f1: 0.5182
 epoch: 23, train_loss: 0.9204, test_loss: 0.9199, test_f1: 0.5163
 epoch: 24, train_loss: 0.9122, test_loss: 0.9146, test_f1: 0.5204
 epoch: 25, train_loss: 0.9107, test_loss: 0.9220, test_f1: 0.5201
 epoch: 26, train_loss: 0.9021, test_loss: 0.9261, test_f1: 0.5331
 epoch: 27, train_loss: 0.8964, test_loss: 0.9240, test_f1: 0.5477
 epoch: 28, train_loss: 0.9065, test_loss: 0.9213, test_f1: 0.5391
 epoch: 29, train_loss: 0.8853, test_loss: 0.9236, test_f1: 0.5372
 epoch: 30, train_loss: 0.8807, test_loss: 0.9181, test_f1: 0.5340
 epoch: 31, train_loss: 0.8808, test_loss: 0.9206, test_f1: 0.5516
 epoch: 32, train_loss: 0.8808, test_loss: 0.9206, test_f1: 0.5287
 epoch: 33, train_loss: 0.8796, test_loss: 0.9421, test_f1: 0.5347
 epoch: 34, train_loss: 0.8836, test_loss: 0.9144, test_f1: 0.5356
 epoch: 35, train_loss: 0.8860, test_loss: 0.9317, test_f1: 0.5297
 epoch: 36, train_loss: 0.8725, test_loss: 0.9412, test_f1: 0.5305
 epoch: 37, train_loss: 0.8678, test_loss: 0.9208, test_f1: 0.5483
 epoch: 38, train_loss: 0.8764, test_loss: 0.9334, test_f1: 0.5499
 epoch: 39, train_loss: 0.8670, test_loss: 0.9377, test_f1: 0.5582
 epoch: 40, train_loss: 0.8674, test_loss: 0.9287, test_f1: 0.5510
 epoch: 41, train_loss: 0.8575, test_loss: 0.9353, test_f1: 0.5487
 epoch: 42, train_loss: 0.8577, test_loss: 0.9247, test_f1: 0.5519
 epoch: 43, train_loss: 0.8619, test_loss: 0.9276, test_f1: 0.5388
 epoch: 44, train_loss: 0.8554, test_loss: 0.9324, test_f1: 0.5462
 epoch: 45, train_loss: 0.8413, test_loss: 0.9394, test_f1: 0.5485
 epoch: 46, train_loss: 0.8541, test_loss: 0.9251, test_f1: 0.5631
 epoch: 47, train_loss: 0.8386, test_loss: 0.9138, test_f1: 0.5454
 epoch: 48, train_loss: 0.8367, test_loss: 0.9285, test_f1: 0.5470
 epoch: 49, train_loss: 0.8441, test_loss: 0.9289, test_f1: 0.5543
 epoch: 50, train_loss: 0.8379, test_loss: 0.9153, test_f1: 0.5472
 epoch: 51, train_loss: 0.8380, test_loss: 0.9358, test_f1: 0.5642
 epoch: 52, train_loss: 0.8293, test_loss: 0.9223, test_f1: 0.5577
 epoch: 53, train_loss: 0.8263, test_loss: 0.9204, test_f1: 0.5489
 epoch: 54, train_loss: 0.8376, test_loss: 0.9254, test_f1: 0.5466
 epoch: 55, train_loss: 0.8261, test_loss: 0.9298, test_f1: 0.5678
 epoch: 56, train_loss: 0.8209, test_loss: 0.9238, test_f1: 0.5610
 epoch: 57, train_loss: 0.8287, test_loss: 0.9301, test_f1: 0.5500
 epoch: 58, train_loss: 0.8186, test_loss: 0.9185, test_f1: 0.5405
 epoch: 59, train_loss: 0.8203, test_loss: 0.9289, test_f1: 0.5372
 epoch: 60, train_loss: 0.8205, test_loss: 0.9111, test_f1: 0.5507
 epoch: 61, train_loss: 0.8174, test_loss: 0.9200, test_f1: 0.5483
 epoch: 62, train_loss: 0.8332, test_loss: 0.9330, test_f1: 0.5469
 epoch: 63, train_loss: 0.8108, test_loss: 0.9248, test_f1: 0.5444
 epoch: 64, train_loss: 0.8113, test_loss: 0.9235, test_f1: 0.5483
 epoch: 65, train_loss: 0.8131, test_loss: 0.9245, test_f1: 0.5454
 epoch: 66, train_loss: 0.8129, test_loss: 0.9236, test_f1: 0.5533
 epoch: 67, train_loss: 0.8111, test_loss: 0.9282, test_f1: 0.5562
 epoch: 68, train_loss: 0.8115, test_loss: 0.9218, test_f1: 0.5599
 epoch: 69, train_loss: 0.8073, test_loss: 0.9138, test_f1: 0.5574
 epoch: 70, train_loss: 0.8087, test_loss: 0.9193, test_f1: 0.5449
 epoch: 71, train_loss: 0.8015, test_loss: 0.9235, test_f1: 0.5622
 epoch: 72, train_loss: 0.8193, test_loss: 0.9253, test_f1: 0.5554
 epoch: 73, train_loss: 0.8046, test_loss: 0.9333, test_f1: 0.5430
 epoch: 74, train_loss: 0.8020, test_loss: 0.9224, test_f1: 0.5574
 epoch: 75, train_loss: 0.8025, test_loss: 0.9292, test_f1: 0.5463
 epoch: 76, train_loss: 0.8053, test_loss: 0.9338, test_f1: 0.5377
 epoch: 77, train_loss: 0.8109, test_loss: 0.9269, test_f1: 0.5491
 epoch: 78, train_loss: 0.8087, test_loss: 0.9321, test_f1: 0.5481
 epoch: 79, train_loss: 0.7980, test_loss: 0.9239, test_f1: 0.5544
 epoch: 80, train_loss: 0.7958, test_loss: 0.9283, test_f1: 0.5487
 epoch: 81, train_loss: 0.8021, test_loss: 0.9210, test_f1: 0.5522
 epoch: 82, train_loss: 0.8001, test_loss: 0.9193, test_f1: 0.5524
 epoch: 83, train_loss: 0.7917, test_loss: 0.9361, test_f1: 0.5557
 epoch: 84, train_loss: 0.7995, test_loss: 0.9365, test_f1: 0.5523
 epoch: 85, train_loss: 0.7924, test_loss: 0.9313, test_f1: 0.5536
 epoch: 86, train_loss: 0.7939, test_loss: 0.9215, test_f1: 0.5601
 epoch: 87, train_loss: 0.7925, test_loss: 0.9258, test_f1: 0.5715
 epoch: 88, train_loss: 0.7939, test_loss: 0.9190, test_f1: 0.5697
 epoch: 89, train_loss: 0.7942, test_loss: 0.9313, test_f1: 0.5626
 epoch: 90, train_loss: 0.7897, test_loss: 0.9290, test_f1: 0.5404
 epoch: 91, train_loss: 0.7892, test_loss: 0.9159, test_f1: 0.5598
 epoch: 92, train_loss: 0.7821, test_loss: 0.9205, test_f1: 0.5581
 epoch: 93, train_loss: 0.7961, test_loss: 0.9274, test_f1: 0.5578
 epoch: 94, train_loss: 0.7898, test_loss: 0.9172, test_f1: 0.5509
 epoch: 95, train_loss: 0.7773, test_loss: 0.9159, test_f1: 0.5482
 epoch: 96, train_loss: 0.7760, test_loss: 0.9232, test_f1: 0.5712
 epoch: 97, train_loss: 0.7910, test_loss: 0.9137, test_f1: 0.5551
 epoch: 98, train_loss: 0.7801, test_loss: 0.9291, test_f1: 0.5526
 epoch: 99, train_loss: 0.7745, test_loss: 0.9251, test_f1: 0.5548
##################ITERATION #5 ****************************************
 epoch: 0, train_loss: 1.2679, test_loss: 1.1859, test_f1: 0.3200
 epoch: 1, train_loss: 1.1699, test_loss: 1.1147, test_f1: 0.3825
 epoch: 2, train_loss: 1.1352, test_loss: 1.0852, test_f1: 0.3753
 epoch: 3, train_loss: 1.1091, test_loss: 1.0618, test_f1: 0.4178
 epoch: 4, train_loss: 1.0929, test_loss: 1.0434, test_f1: 0.4253
 epoch: 5, train_loss: 1.0623, test_loss: 1.0273, test_f1: 0.4497
 epoch: 6, train_loss: 1.0476, test_loss: 1.0155, test_f1: 0.4472
 epoch: 7, train_loss: 1.0375, test_loss: 1.0065, test_f1: 0.4534
 epoch: 8, train_loss: 1.0253, test_loss: 0.9954, test_f1: 0.4521
 epoch: 9, train_loss: 1.0111, test_loss: 0.9875, test_f1: 0.4596
 epoch: 10, train_loss: 0.9998, test_loss: 0.9815, test_f1: 0.4638
 epoch: 11, train_loss: 0.9935, test_loss: 0.9708, test_f1: 0.4662
 epoch: 12, train_loss: 0.9885, test_loss: 0.9722, test_f1: 0.4694
 epoch: 13, train_loss: 0.9729, test_loss: 0.9643, test_f1: 0.4710
 epoch: 14, train_loss: 0.9668, test_loss: 0.9559, test_f1: 0.4744
 epoch: 15, train_loss: 0.9605, test_loss: 0.9530, test_f1: 0.4801
 epoch: 16, train_loss: 0.9517, test_loss: 0.9567, test_f1: 0.4791
 epoch: 17, train_loss: 0.9455, test_loss: 0.9479, test_f1: 0.4721
 epoch: 18, train_loss: 0.9549, test_loss: 0.9474, test_f1: 0.4827
 epoch: 19, train_loss: 0.9405, test_loss: 0.9475, test_f1: 0.4858
 epoch: 20, train_loss: 0.9361, test_loss: 0.9280, test_f1: 0.5083
 epoch: 21, train_loss: 0.9240, test_loss: 0.9413, test_f1: 0.4906
 epoch: 22, train_loss: 0.9169, test_loss: 0.9272, test_f1: 0.5051
 epoch: 23, train_loss: 0.9203, test_loss: 0.9289, test_f1: 0.5019
 epoch: 24, train_loss: 0.9171, test_loss: 0.9324, test_f1: 0.4962
 epoch: 25, train_loss: 0.9171, test_loss: 0.9339, test_f1: 0.5132
 epoch: 26, train_loss: 0.9011, test_loss: 0.9254, test_f1: 0.5001
 epoch: 27, train_loss: 0.9044, test_loss: 0.9181, test_f1: 0.5147
 epoch: 28, train_loss: 0.9078, test_loss: 0.9214, test_f1: 0.5038
 epoch: 29, train_loss: 0.9011, test_loss: 0.9196, test_f1: 0.5124
 epoch: 30, train_loss: 0.8908, test_loss: 0.9074, test_f1: 0.5171
 epoch: 31, train_loss: 0.8875, test_loss: 0.9139, test_f1: 0.5085
 epoch: 32, train_loss: 0.8902, test_loss: 0.9142, test_f1: 0.5139
 epoch: 33, train_loss: 0.8765, test_loss: 0.9177, test_f1: 0.5093
 epoch: 34, train_loss: 0.8832, test_loss: 0.9212, test_f1: 0.5170
 epoch: 35, train_loss: 0.8777, test_loss: 0.9128, test_f1: 0.5153
 epoch: 36, train_loss: 0.8802, test_loss: 0.9031, test_f1: 0.5220
 epoch: 37, train_loss: 0.8793, test_loss: 0.9078, test_f1: 0.5247
 epoch: 38, train_loss: 0.8618, test_loss: 0.9143, test_f1: 0.5149
 epoch: 39, train_loss: 0.8672, test_loss: 0.9131, test_f1: 0.5333
 epoch: 40, train_loss: 0.8651, test_loss: 0.9139, test_f1: 0.5135
 epoch: 41, train_loss: 0.8635, test_loss: 0.9186, test_f1: 0.5164
 epoch: 42, train_loss: 0.8541, test_loss: 0.9070, test_f1: 0.5267
 epoch: 43, train_loss: 0.8513, test_loss: 0.9106, test_f1: 0.5292
 epoch: 44, train_loss: 0.8509, test_loss: 0.9118, test_f1: 0.5186
 epoch: 45, train_loss: 0.8502, test_loss: 0.9085, test_f1: 0.5293
 epoch: 46, train_loss: 0.8444, test_loss: 0.9131, test_f1: 0.5303
 epoch: 47, train_loss: 0.8402, test_loss: 0.9140, test_f1: 0.5234
 epoch: 48, train_loss: 0.8471, test_loss: 0.9066, test_f1: 0.5145
 epoch: 49, train_loss: 0.8297, test_loss: 0.9126, test_f1: 0.5210
 epoch: 50, train_loss: 0.8276, test_loss: 0.9185, test_f1: 0.5389
 epoch: 51, train_loss: 0.8273, test_loss: 0.9099, test_f1: 0.5316
 epoch: 52, train_loss: 0.8274, test_loss: 0.9074, test_f1: 0.5366
 epoch: 53, train_loss: 0.8191, test_loss: 0.9107, test_f1: 0.5270
 epoch: 54, train_loss: 0.8146, test_loss: 0.9143, test_f1: 0.5466
 epoch: 55, train_loss: 0.8190, test_loss: 0.9156, test_f1: 0.5445
 epoch: 56, train_loss: 0.8206, test_loss: 0.9134, test_f1: 0.5346
 epoch: 57, train_loss: 0.8138, test_loss: 0.9122, test_f1: 0.5393
 epoch: 58, train_loss: 0.8111, test_loss: 0.9194, test_f1: 0.5324
 epoch: 59, train_loss: 0.8133, test_loss: 0.9167, test_f1: 0.5234
 epoch: 60, train_loss: 0.8142, test_loss: 0.9120, test_f1: 0.5399
 epoch: 61, train_loss: 0.8158, test_loss: 0.9142, test_f1: 0.5259
 epoch: 62, train_loss: 0.8164, test_loss: 0.9101, test_f1: 0.5590
 epoch: 63, train_loss: 0.8172, test_loss: 0.9214, test_f1: 0.5350
 epoch: 64, train_loss: 0.8030, test_loss: 0.9098, test_f1: 0.5317
 epoch: 65, train_loss: 0.8060, test_loss: 0.9181, test_f1: 0.5497
 epoch: 66, train_loss: 0.8034, test_loss: 0.9147, test_f1: 0.5364
 epoch: 67, train_loss: 0.8154, test_loss: 0.9173, test_f1: 0.5306
 epoch: 68, train_loss: 0.8073, test_loss: 0.9177, test_f1: 0.5355
 epoch: 69, train_loss: 0.8024, test_loss: 0.9183, test_f1: 0.5428
 epoch: 70, train_loss: 0.8018, test_loss: 0.9218, test_f1: 0.5407
 epoch: 71, train_loss: 0.7972, test_loss: 0.9178, test_f1: 0.5387
 epoch: 72, train_loss: 0.8144, test_loss: 0.9190, test_f1: 0.5409
 epoch: 73, train_loss: 0.7906, test_loss: 0.9153, test_f1: 0.5283
 epoch: 74, train_loss: 0.7945, test_loss: 0.9157, test_f1: 0.5470
 epoch: 75, train_loss: 0.7994, test_loss: 0.9087, test_f1: 0.5391
 epoch: 76, train_loss: 0.7898, test_loss: 0.9148, test_f1: 0.5454
 epoch: 77, train_loss: 0.7980, test_loss: 0.9070, test_f1: 0.5530
 epoch: 78, train_loss: 0.7851, test_loss: 0.9018, test_f1: 0.5451
 epoch: 79, train_loss: 0.7937, test_loss: 0.9132, test_f1: 0.5432
 epoch: 80, train_loss: 0.7858, test_loss: 0.9090, test_f1: 0.5516
 epoch: 81, train_loss: 0.7815, test_loss: 0.9138, test_f1: 0.5421
 epoch: 82, train_loss: 0.7910, test_loss: 0.9137, test_f1: 0.5496
 epoch: 83, train_loss: 0.7832, test_loss: 0.9012, test_f1: 0.5505
 epoch: 84, train_loss: 0.7822, test_loss: 0.9204, test_f1: 0.5389
 epoch: 85, train_loss: 0.7878, test_loss: 0.9089, test_f1: 0.5453
 epoch: 86, train_loss: 0.7914, test_loss: 0.9044, test_f1: 0.5552
 epoch: 87, train_loss: 0.7814, test_loss: 0.9156, test_f1: 0.5450
 epoch: 88, train_loss: 0.7852, test_loss: 0.9102, test_f1: 0.5533
 epoch: 89, train_loss: 0.7884, test_loss: 0.9087, test_f1: 0.5468
 epoch: 90, train_loss: 0.7828, test_loss: 0.9122, test_f1: 0.5577
 epoch: 91, train_loss: 0.7737, test_loss: 0.9051, test_f1: 0.5618
 epoch: 92, train_loss: 0.7758, test_loss: 0.9142, test_f1: 0.5628
 epoch: 93, train_loss: 0.7808, test_loss: 0.9076, test_f1: 0.5574
 epoch: 94, train_loss: 0.7750, test_loss: 0.9102, test_f1: 0.5543
 epoch: 95, train_loss: 0.7862, test_loss: 0.9142, test_f1: 0.5634
 epoch: 96, train_loss: 0.7743, test_loss: 0.9076, test_f1: 0.5615
 epoch: 97, train_loss: 0.7765, test_loss: 0.9172, test_f1: 0.5472
 epoch: 98, train_loss: 0.7745, test_loss: 0.9039, test_f1: 0.5536
 epoch: 99, train_loss: 0.7788, test_loss: 0.9049, test_f1: 0.5626
##################ITERATION #6 ****************************************
 epoch: 0, train_loss: 1.2509, test_loss: 1.2278, test_f1: 0.2600
 epoch: 1, train_loss: 1.1443, test_loss: 1.0486, test_f1: 0.4070
 epoch: 2, train_loss: 1.1020, test_loss: 1.0252, test_f1: 0.4119
 epoch: 3, train_loss: 1.0712, test_loss: 1.0082, test_f1: 0.4355
 epoch: 4, train_loss: 1.0557, test_loss: 0.9975, test_f1: 0.4328
 epoch: 5, train_loss: 1.0379, test_loss: 0.9842, test_f1: 0.4548
 epoch: 6, train_loss: 1.0205, test_loss: 0.9800, test_f1: 0.4562
 epoch: 7, train_loss: 1.0103, test_loss: 0.9785, test_f1: 0.4607
 epoch: 8, train_loss: 0.9945, test_loss: 0.9708, test_f1: 0.4599
 epoch: 9, train_loss: 0.9884, test_loss: 0.9648, test_f1: 0.4778
 epoch: 10, train_loss: 0.9801, test_loss: 0.9599, test_f1: 0.4818
 epoch: 11, train_loss: 0.9794, test_loss: 0.9491, test_f1: 0.5050
 epoch: 12, train_loss: 0.9643, test_loss: 0.9554, test_f1: 0.4715
 epoch: 13, train_loss: 0.9680, test_loss: 0.9501, test_f1: 0.4935
 epoch: 14, train_loss: 0.9560, test_loss: 0.9375, test_f1: 0.5064
 epoch: 15, train_loss: 0.9516, test_loss: 0.9383, test_f1: 0.5134
 epoch: 16, train_loss: 0.9419, test_loss: 0.9460, test_f1: 0.5073
 epoch: 17, train_loss: 0.9354, test_loss: 0.9246, test_f1: 0.5153
 epoch: 18, train_loss: 0.9280, test_loss: 0.9254, test_f1: 0.5232
 epoch: 19, train_loss: 0.9295, test_loss: 0.9203, test_f1: 0.5253
 epoch: 20, train_loss: 0.9252, test_loss: 0.9256, test_f1: 0.5115
 epoch: 21, train_loss: 0.9159, test_loss: 0.9182, test_f1: 0.5179
 epoch: 22, train_loss: 0.9105, test_loss: 0.9168, test_f1: 0.5189
 epoch: 23, train_loss: 0.9124, test_loss: 0.9205, test_f1: 0.5255
 epoch: 24, train_loss: 0.9039, test_loss: 0.9088, test_f1: 0.5268
 epoch: 25, train_loss: 0.9057, test_loss: 0.9137, test_f1: 0.5363
 epoch: 26, train_loss: 0.8898, test_loss: 0.9070, test_f1: 0.5320
 epoch: 27, train_loss: 0.9016, test_loss: 0.9318, test_f1: 0.5055
 epoch: 28, train_loss: 0.8926, test_loss: 0.9158, test_f1: 0.5248
 epoch: 29, train_loss: 0.9003, test_loss: 0.9072, test_f1: 0.5221
 epoch: 30, train_loss: 0.8862, test_loss: 0.9111, test_f1: 0.5194
 epoch: 31, train_loss: 0.8885, test_loss: 0.9183, test_f1: 0.5136
 epoch: 32, train_loss: 0.8875, test_loss: 0.9073, test_f1: 0.5283
 epoch: 33, train_loss: 0.8748, test_loss: 0.8998, test_f1: 0.5337
 epoch: 34, train_loss: 0.8798, test_loss: 0.9165, test_f1: 0.5340
 epoch: 35, train_loss: 0.8756, test_loss: 0.9112, test_f1: 0.5321
 epoch: 36, train_loss: 0.8718, test_loss: 0.9070, test_f1: 0.5357
 epoch: 37, train_loss: 0.8678, test_loss: 0.9044, test_f1: 0.5253
 epoch: 38, train_loss: 0.8754, test_loss: 0.9054, test_f1: 0.5368
 epoch: 39, train_loss: 0.8621, test_loss: 0.9062, test_f1: 0.5458
 epoch: 40, train_loss: 0.8598, test_loss: 0.9011, test_f1: 0.5353
 epoch: 41, train_loss: 0.8553, test_loss: 0.8907, test_f1: 0.5323
 epoch: 42, train_loss: 0.8552, test_loss: 0.8968, test_f1: 0.5389
 epoch: 43, train_loss: 0.8546, test_loss: 0.9236, test_f1: 0.5216
 epoch: 44, train_loss: 0.8591, test_loss: 0.8975, test_f1: 0.5398
 epoch: 45, train_loss: 0.8518, test_loss: 0.8906, test_f1: 0.5291
 epoch: 46, train_loss: 0.8423, test_loss: 0.8856, test_f1: 0.5456
 epoch: 47, train_loss: 0.8393, test_loss: 0.9065, test_f1: 0.5356
 epoch: 48, train_loss: 0.8415, test_loss: 0.8875, test_f1: 0.5370
 epoch: 49, train_loss: 0.8352, test_loss: 0.9186, test_f1: 0.5283
 epoch: 50, train_loss: 0.8405, test_loss: 0.8735, test_f1: 0.5386
 epoch: 51, train_loss: 0.8397, test_loss: 0.9009, test_f1: 0.5316
 epoch: 52, train_loss: 0.8421, test_loss: 0.8920, test_f1: 0.5310
 epoch: 53, train_loss: 0.8273, test_loss: 0.9039, test_f1: 0.5371
 epoch: 54, train_loss: 0.8240, test_loss: 0.8917, test_f1: 0.5496
 epoch: 55, train_loss: 0.8209, test_loss: 0.9005, test_f1: 0.5459
 epoch: 56, train_loss: 0.8217, test_loss: 0.9211, test_f1: 0.5401
 epoch: 57, train_loss: 0.8274, test_loss: 0.9011, test_f1: 0.5430
 epoch: 58, train_loss: 0.8224, test_loss: 0.9016, test_f1: 0.5543
 epoch: 59, train_loss: 0.8203, test_loss: 0.9100, test_f1: 0.5394
 epoch: 60, train_loss: 0.8213, test_loss: 0.9044, test_f1: 0.5325
 epoch: 61, train_loss: 0.8182, test_loss: 0.8974, test_f1: 0.5423
 epoch: 62, train_loss: 0.8147, test_loss: 0.8873, test_f1: 0.5355
 epoch: 63, train_loss: 0.8077, test_loss: 0.9014, test_f1: 0.5265
 epoch: 64, train_loss: 0.8138, test_loss: 0.9029, test_f1: 0.5486
 epoch: 65, train_loss: 0.8169, test_loss: 0.9094, test_f1: 0.5497
 epoch: 66, train_loss: 0.8149, test_loss: 0.8857, test_f1: 0.5439
 epoch: 67, train_loss: 0.8242, test_loss: 0.8891, test_f1: 0.5447
 epoch: 68, train_loss: 0.8100, test_loss: 0.8992, test_f1: 0.5308
 epoch: 69, train_loss: 0.8219, test_loss: 0.9108, test_f1: 0.5442
 epoch: 70, train_loss: 0.8061, test_loss: 0.9135, test_f1: 0.5418
 epoch: 71, train_loss: 0.8096, test_loss: 0.9055, test_f1: 0.5433
 epoch: 72, train_loss: 0.7980, test_loss: 0.9157, test_f1: 0.5396
 epoch: 73, train_loss: 0.8051, test_loss: 0.9073, test_f1: 0.5434
 epoch: 74, train_loss: 0.8014, test_loss: 0.9113, test_f1: 0.5418
 epoch: 75, train_loss: 0.8092, test_loss: 0.8765, test_f1: 0.5575
 epoch: 76, train_loss: 0.7950, test_loss: 0.8950, test_f1: 0.5450
 epoch: 77, train_loss: 0.8056, test_loss: 0.9104, test_f1: 0.5435
 epoch: 78, train_loss: 0.8106, test_loss: 0.8846, test_f1: 0.5397
 epoch: 79, train_loss: 0.8020, test_loss: 0.8991, test_f1: 0.5382
 epoch: 80, train_loss: 0.8004, test_loss: 0.8954, test_f1: 0.5308
 epoch: 81, train_loss: 0.8040, test_loss: 0.9003, test_f1: 0.5415
 epoch: 82, train_loss: 0.7974, test_loss: 0.8923, test_f1: 0.5503
 epoch: 83, train_loss: 0.7995, test_loss: 0.8845, test_f1: 0.5406
 epoch: 84, train_loss: 0.7997, test_loss: 0.9061, test_f1: 0.5480
 epoch: 85, train_loss: 0.7871, test_loss: 0.9058, test_f1: 0.5483
 epoch: 86, train_loss: 0.7988, test_loss: 0.9075, test_f1: 0.5431
 epoch: 87, train_loss: 0.7915, test_loss: 0.8829, test_f1: 0.5545
 epoch: 88, train_loss: 0.7918, test_loss: 0.8992, test_f1: 0.5455
 epoch: 89, train_loss: 0.7854, test_loss: 0.8946, test_f1: 0.5536
 epoch: 90, train_loss: 0.7897, test_loss: 0.8937, test_f1: 0.5498
 epoch: 91, train_loss: 0.7929, test_loss: 0.9008, test_f1: 0.5439
 epoch: 92, train_loss: 0.7915, test_loss: 0.9178, test_f1: 0.5367
 epoch: 93, train_loss: 0.7946, test_loss: 0.9138, test_f1: 0.5334
 epoch: 94, train_loss: 0.7922, test_loss: 0.8926, test_f1: 0.5433
 epoch: 95, train_loss: 0.7785, test_loss: 0.8982, test_f1: 0.5443
 epoch: 96, train_loss: 0.7848, test_loss: 0.8947, test_f1: 0.5475
 epoch: 97, train_loss: 0.7819, test_loss: 0.9000, test_f1: 0.5454
 epoch: 98, train_loss: 0.7853, test_loss: 0.8863, test_f1: 0.5431
 epoch: 99, train_loss: 0.7822, test_loss: 0.8869, test_f1: 0.5489
##################ITERATION #7 ****************************************
 epoch: 0, train_loss: 1.3236, test_loss: 1.1710, test_f1: 0.3301
 epoch: 1, train_loss: 1.1819, test_loss: 1.0980, test_f1: 0.4308
 epoch: 2, train_loss: 1.1549, test_loss: 1.0623, test_f1: 0.4487
 epoch: 3, train_loss: 1.1250, test_loss: 1.0417, test_f1: 0.4451
 epoch: 4, train_loss: 1.0829, test_loss: 1.0237, test_f1: 0.4472
 epoch: 5, train_loss: 1.0674, test_loss: 1.0018, test_f1: 0.4606
 epoch: 6, train_loss: 1.0498, test_loss: 0.9908, test_f1: 0.4607
 epoch: 7, train_loss: 1.0420, test_loss: 0.9782, test_f1: 0.4640
 epoch: 8, train_loss: 1.0226, test_loss: 0.9662, test_f1: 0.4634
 epoch: 9, train_loss: 1.0173, test_loss: 0.9582, test_f1: 0.4654
 epoch: 10, train_loss: 0.9936, test_loss: 0.9575, test_f1: 0.4636
 epoch: 11, train_loss: 0.9942, test_loss: 0.9492, test_f1: 0.4792
 epoch: 12, train_loss: 0.9764, test_loss: 0.9473, test_f1: 0.4741
 epoch: 13, train_loss: 0.9677, test_loss: 0.9416, test_f1: 0.4843
 epoch: 14, train_loss: 0.9649, test_loss: 0.9314, test_f1: 0.4982
 epoch: 15, train_loss: 0.9555, test_loss: 0.9279, test_f1: 0.4890
 epoch: 16, train_loss: 0.9530, test_loss: 0.9211, test_f1: 0.4876
 epoch: 17, train_loss: 0.9500, test_loss: 0.9253, test_f1: 0.4934
 epoch: 18, train_loss: 0.9338, test_loss: 0.9125, test_f1: 0.5073
 epoch: 19, train_loss: 0.9356, test_loss: 0.9189, test_f1: 0.5030
 epoch: 20, train_loss: 0.9263, test_loss: 0.9102, test_f1: 0.5035
 epoch: 21, train_loss: 0.9237, test_loss: 0.9111, test_f1: 0.5161
 epoch: 22, train_loss: 0.9215, test_loss: 0.9082, test_f1: 0.5107
 epoch: 23, train_loss: 0.9193, test_loss: 0.9183, test_f1: 0.5032
 epoch: 24, train_loss: 0.9120, test_loss: 0.9169, test_f1: 0.5087
 epoch: 25, train_loss: 0.9154, test_loss: 0.9095, test_f1: 0.5138
 epoch: 26, train_loss: 0.9059, test_loss: 0.9052, test_f1: 0.5151
 epoch: 27, train_loss: 0.9066, test_loss: 0.8920, test_f1: 0.5136
 epoch: 28, train_loss: 0.8939, test_loss: 0.8867, test_f1: 0.5255
 epoch: 29, train_loss: 0.8946, test_loss: 0.8984, test_f1: 0.5156
 epoch: 30, train_loss: 0.8926, test_loss: 0.9120, test_f1: 0.5206
 epoch: 31, train_loss: 0.8849, test_loss: 0.8987, test_f1: 0.5195
 epoch: 32, train_loss: 0.8820, test_loss: 0.9027, test_f1: 0.5263
 epoch: 33, train_loss: 0.8814, test_loss: 0.9031, test_f1: 0.5280
 epoch: 34, train_loss: 0.8785, test_loss: 0.8983, test_f1: 0.5303
 epoch: 35, train_loss: 0.8721, test_loss: 0.8858, test_f1: 0.5253
 epoch: 36, train_loss: 0.8720, test_loss: 0.9058, test_f1: 0.5241
 epoch: 37, train_loss: 0.8715, test_loss: 0.8718, test_f1: 0.5366
 epoch: 38, train_loss: 0.8655, test_loss: 0.8981, test_f1: 0.5257
 epoch: 39, train_loss: 0.8551, test_loss: 0.9029, test_f1: 0.5243
 epoch: 40, train_loss: 0.8640, test_loss: 0.8922, test_f1: 0.5386
 epoch: 41, train_loss: 0.8574, test_loss: 0.9001, test_f1: 0.5267
 epoch: 42, train_loss: 0.8487, test_loss: 0.8847, test_f1: 0.5317
 epoch: 43, train_loss: 0.8490, test_loss: 0.9033, test_f1: 0.5323
 epoch: 44, train_loss: 0.8490, test_loss: 0.8728, test_f1: 0.5382
 epoch: 45, train_loss: 0.8475, test_loss: 0.8710, test_f1: 0.5342
 epoch: 46, train_loss: 0.8476, test_loss: 0.8818, test_f1: 0.5318
 epoch: 47, train_loss: 0.8444, test_loss: 0.8913, test_f1: 0.5314
 epoch: 48, train_loss: 0.8386, test_loss: 0.8815, test_f1: 0.5362
 epoch: 49, train_loss: 0.8392, test_loss: 0.8794, test_f1: 0.5346
 epoch: 50, train_loss: 0.8347, test_loss: 0.8874, test_f1: 0.5368
 epoch: 51, train_loss: 0.8313, test_loss: 0.8829, test_f1: 0.5415
 epoch: 52, train_loss: 0.8254, test_loss: 0.8793, test_f1: 0.5402
 epoch: 53, train_loss: 0.8307, test_loss: 0.8689, test_f1: 0.5423
 epoch: 54, train_loss: 0.8277, test_loss: 0.8715, test_f1: 0.5408
 epoch: 55, train_loss: 0.8302, test_loss: 0.8797, test_f1: 0.5402
 epoch: 56, train_loss: 0.8306, test_loss: 0.8783, test_f1: 0.5324
 epoch: 57, train_loss: 0.8169, test_loss: 0.8701, test_f1: 0.5454
 epoch: 58, train_loss: 0.8300, test_loss: 0.8844, test_f1: 0.5398
 epoch: 59, train_loss: 0.8173, test_loss: 0.8857, test_f1: 0.5309
 epoch: 60, train_loss: 0.8211, test_loss: 0.8789, test_f1: 0.5451
 epoch: 61, train_loss: 0.8172, test_loss: 0.8817, test_f1: 0.5421
 epoch: 62, train_loss: 0.8261, test_loss: 0.8799, test_f1: 0.5416
 epoch: 63, train_loss: 0.8161, test_loss: 0.8819, test_f1: 0.5317
 epoch: 64, train_loss: 0.8155, test_loss: 0.8900, test_f1: 0.5396
 epoch: 65, train_loss: 0.8146, test_loss: 0.8982, test_f1: 0.5378
 epoch: 66, train_loss: 0.8051, test_loss: 0.8925, test_f1: 0.5368
 epoch: 67, train_loss: 0.8166, test_loss: 0.8760, test_f1: 0.5431
 epoch: 68, train_loss: 0.8064, test_loss: 0.8663, test_f1: 0.5466
 epoch: 69, train_loss: 0.8044, test_loss: 0.8785, test_f1: 0.5368
 epoch: 70, train_loss: 0.8052, test_loss: 0.8766, test_f1: 0.5415
 epoch: 71, train_loss: 0.8016, test_loss: 0.8975, test_f1: 0.5374
 epoch: 72, train_loss: 0.7983, test_loss: 0.8806, test_f1: 0.5452
 epoch: 73, train_loss: 0.8080, test_loss: 0.8798, test_f1: 0.5435
 epoch: 74, train_loss: 0.8076, test_loss: 0.8698, test_f1: 0.5387
 epoch: 75, train_loss: 0.7990, test_loss: 0.8769, test_f1: 0.5554
 epoch: 76, train_loss: 0.8053, test_loss: 0.8853, test_f1: 0.5357
 epoch: 77, train_loss: 0.7989, test_loss: 0.8882, test_f1: 0.5457
 epoch: 78, train_loss: 0.7941, test_loss: 0.8849, test_f1: 0.5490
 epoch: 79, train_loss: 0.7991, test_loss: 0.8971, test_f1: 0.5363
 epoch: 80, train_loss: 0.8059, test_loss: 0.8995, test_f1: 0.5406
 epoch: 81, train_loss: 0.7893, test_loss: 0.8858, test_f1: 0.5443
 epoch: 82, train_loss: 0.7955, test_loss: 0.8844, test_f1: 0.5437
 epoch: 83, train_loss: 0.7914, test_loss: 0.8952, test_f1: 0.5372
 epoch: 84, train_loss: 0.7986, test_loss: 0.8995, test_f1: 0.5421
 epoch: 85, train_loss: 0.7958, test_loss: 0.9051, test_f1: 0.5416
 epoch: 86, train_loss: 0.7970, test_loss: 0.8917, test_f1: 0.5394
 epoch: 87, train_loss: 0.7769, test_loss: 0.8849, test_f1: 0.5513
 epoch: 88, train_loss: 0.7871, test_loss: 0.9004, test_f1: 0.5405
 epoch: 89, train_loss: 0.7837, test_loss: 0.8922, test_f1: 0.5522
 epoch: 90, train_loss: 0.7821, test_loss: 0.8924, test_f1: 0.5552
 epoch: 91, train_loss: 0.7786, test_loss: 0.8921, test_f1: 0.5453
 epoch: 92, train_loss: 0.7821, test_loss: 0.8947, test_f1: 0.5393
 epoch: 93, train_loss: 0.7830, test_loss: 0.8922, test_f1: 0.5457
 epoch: 94, train_loss: 0.7791, test_loss: 0.9052, test_f1: 0.5516
 epoch: 95, train_loss: 0.7837, test_loss: 0.9061, test_f1: 0.5540
 epoch: 96, train_loss: 0.7785, test_loss: 0.9025, test_f1: 0.5513
 epoch: 97, train_loss: 0.7667, test_loss: 0.8952, test_f1: 0.5601
 epoch: 98, train_loss: 0.7816, test_loss: 0.8936, test_f1: 0.5628
 epoch: 99, train_loss: 0.7751, test_loss: 0.8996, test_f1: 0.5514
##################ITERATION #8 ****************************************
 epoch: 0, train_loss: 1.3103, test_loss: 1.1299, test_f1: 0.3572
 epoch: 1, train_loss: 1.1739, test_loss: 1.0658, test_f1: 0.4139
 epoch: 2, train_loss: 1.1357, test_loss: 1.0412, test_f1: 0.4178
 epoch: 3, train_loss: 1.1037, test_loss: 1.0272, test_f1: 0.4253
 epoch: 4, train_loss: 1.0722, test_loss: 1.0215, test_f1: 0.4272
 epoch: 5, train_loss: 1.0503, test_loss: 1.0050, test_f1: 0.4479
 epoch: 6, train_loss: 1.0366, test_loss: 1.0021, test_f1: 0.4435
 epoch: 7, train_loss: 1.0274, test_loss: 0.9918, test_f1: 0.4494
 epoch: 8, train_loss: 0.9996, test_loss: 0.9868, test_f1: 0.4528
 epoch: 9, train_loss: 1.0047, test_loss: 0.9772, test_f1: 0.4868
 epoch: 10, train_loss: 0.9978, test_loss: 0.9736, test_f1: 0.4803
 epoch: 11, train_loss: 0.9878, test_loss: 0.9700, test_f1: 0.4671
 epoch: 12, train_loss: 0.9802, test_loss: 0.9711, test_f1: 0.4785
 epoch: 13, train_loss: 0.9729, test_loss: 0.9684, test_f1: 0.4948
 epoch: 14, train_loss: 0.9625, test_loss: 0.9594, test_f1: 0.5082
 epoch: 15, train_loss: 0.9611, test_loss: 0.9628, test_f1: 0.4811
 epoch: 16, train_loss: 0.9590, test_loss: 0.9585, test_f1: 0.5083
 epoch: 17, train_loss: 0.9516, test_loss: 0.9534, test_f1: 0.5082
 epoch: 18, train_loss: 0.9434, test_loss: 0.9508, test_f1: 0.5097
 epoch: 19, train_loss: 0.9375, test_loss: 0.9578, test_f1: 0.5099
 epoch: 20, train_loss: 0.9351, test_loss: 0.9474, test_f1: 0.5110
 epoch: 21, train_loss: 0.9347, test_loss: 0.9380, test_f1: 0.5137
 epoch: 22, train_loss: 0.9287, test_loss: 0.9434, test_f1: 0.5125
 epoch: 23, train_loss: 0.9177, test_loss: 0.9470, test_f1: 0.5164
 epoch: 24, train_loss: 0.9261, test_loss: 0.9456, test_f1: 0.5220
 epoch: 25, train_loss: 0.9184, test_loss: 0.9394, test_f1: 0.5111
 epoch: 26, train_loss: 0.9141, test_loss: 0.9342, test_f1: 0.5253
 epoch: 27, train_loss: 0.9105, test_loss: 0.9283, test_f1: 0.5109
 epoch: 28, train_loss: 0.9071, test_loss: 0.9392, test_f1: 0.5089
 epoch: 29, train_loss: 0.9075, test_loss: 0.9207, test_f1: 0.5051
 epoch: 30, train_loss: 0.9008, test_loss: 0.9361, test_f1: 0.5231
 epoch: 31, train_loss: 0.9015, test_loss: 0.9318, test_f1: 0.5262
 epoch: 32, train_loss: 0.8995, test_loss: 0.9433, test_f1: 0.5232
 epoch: 33, train_loss: 0.8951, test_loss: 0.9372, test_f1: 0.5269
 epoch: 34, train_loss: 0.8896, test_loss: 0.9322, test_f1: 0.5262
 epoch: 35, train_loss: 0.8902, test_loss: 0.9241, test_f1: 0.5268
 epoch: 36, train_loss: 0.8925, test_loss: 0.9208, test_f1: 0.5322
 epoch: 37, train_loss: 0.8934, test_loss: 0.9301, test_f1: 0.5285
 epoch: 38, train_loss: 0.8788, test_loss: 0.9105, test_f1: 0.5280
 epoch: 39, train_loss: 0.8769, test_loss: 0.9167, test_f1: 0.5309
 epoch: 40, train_loss: 0.8635, test_loss: 0.9192, test_f1: 0.5265
 epoch: 41, train_loss: 0.8721, test_loss: 0.9113, test_f1: 0.5367
 epoch: 42, train_loss: 0.8622, test_loss: 0.8966, test_f1: 0.5370
 epoch: 43, train_loss: 0.8619, test_loss: 0.9142, test_f1: 0.5354
 epoch: 44, train_loss: 0.8528, test_loss: 0.9060, test_f1: 0.5387
 epoch: 45, train_loss: 0.8492, test_loss: 0.9198, test_f1: 0.5300
 epoch: 46, train_loss: 0.8454, test_loss: 0.9110, test_f1: 0.5369
 epoch: 47, train_loss: 0.8434, test_loss: 0.8962, test_f1: 0.5341
 epoch: 48, train_loss: 0.8415, test_loss: 0.9136, test_f1: 0.5316
 epoch: 49, train_loss: 0.8411, test_loss: 0.9250, test_f1: 0.5308
 epoch: 50, train_loss: 0.8450, test_loss: 0.9333, test_f1: 0.5257
 epoch: 51, train_loss: 0.8391, test_loss: 0.9140, test_f1: 0.5352
 epoch: 52, train_loss: 0.8300, test_loss: 0.9152, test_f1: 0.5341
 epoch: 53, train_loss: 0.8298, test_loss: 0.9207, test_f1: 0.5367
 epoch: 54, train_loss: 0.8317, test_loss: 0.9065, test_f1: 0.5367
 epoch: 55, train_loss: 0.8313, test_loss: 0.9056, test_f1: 0.5401
 epoch: 56, train_loss: 0.8327, test_loss: 0.9050, test_f1: 0.5344
 epoch: 57, train_loss: 0.8249, test_loss: 0.9013, test_f1: 0.5376
 epoch: 58, train_loss: 0.8219, test_loss: 0.9142, test_f1: 0.5333
 epoch: 59, train_loss: 0.8287, test_loss: 0.9167, test_f1: 0.5337
 epoch: 60, train_loss: 0.8340, test_loss: 0.9053, test_f1: 0.5372
 epoch: 61, train_loss: 0.8237, test_loss: 0.9050, test_f1: 0.5388
 epoch: 62, train_loss: 0.8272, test_loss: 0.9100, test_f1: 0.5373
 epoch: 63, train_loss: 0.8247, test_loss: 0.9076, test_f1: 0.5435
 epoch: 64, train_loss: 0.8312, test_loss: 0.9074, test_f1: 0.5300
 epoch: 65, train_loss: 0.8125, test_loss: 0.9009, test_f1: 0.5443
 epoch: 66, train_loss: 0.8115, test_loss: 0.8962, test_f1: 0.5397
 epoch: 67, train_loss: 0.8201, test_loss: 0.9111, test_f1: 0.5400
 epoch: 68, train_loss: 0.8158, test_loss: 0.8979, test_f1: 0.5429
 epoch: 69, train_loss: 0.8148, test_loss: 0.9069, test_f1: 0.5445
 epoch: 70, train_loss: 0.8102, test_loss: 0.9030, test_f1: 0.5415
 epoch: 71, train_loss: 0.8076, test_loss: 0.9118, test_f1: 0.5354
 epoch: 72, train_loss: 0.8114, test_loss: 0.9015, test_f1: 0.5450
 epoch: 73, train_loss: 0.8075, test_loss: 0.9113, test_f1: 0.5382
 epoch: 74, train_loss: 0.8040, test_loss: 0.9062, test_f1: 0.5471
 epoch: 75, train_loss: 0.8258, test_loss: 0.8867, test_f1: 0.5427
 epoch: 76, train_loss: 0.8061, test_loss: 0.8853, test_f1: 0.5486
 epoch: 77, train_loss: 0.8092, test_loss: 0.8863, test_f1: 0.5456
 epoch: 78, train_loss: 0.8011, test_loss: 0.8925, test_f1: 0.5447
 epoch: 79, train_loss: 0.8022, test_loss: 0.8766, test_f1: 0.5496
 epoch: 80, train_loss: 0.8023, test_loss: 0.8954, test_f1: 0.5431
 epoch: 81, train_loss: 0.8001, test_loss: 0.8882, test_f1: 0.5418
 epoch: 82, train_loss: 0.8049, test_loss: 0.8911, test_f1: 0.5444
 epoch: 83, train_loss: 0.8018, test_loss: 0.8865, test_f1: 0.5421
 epoch: 84, train_loss: 0.7996, test_loss: 0.8979, test_f1: 0.5415
 epoch: 85, train_loss: 0.7957, test_loss: 0.8787, test_f1: 0.5575
 epoch: 86, train_loss: 0.7997, test_loss: 0.8839, test_f1: 0.5439
 epoch: 87, train_loss: 0.7923, test_loss: 0.8939, test_f1: 0.5507
 epoch: 88, train_loss: 0.8002, test_loss: 0.8908, test_f1: 0.5478
 epoch: 89, train_loss: 0.7907, test_loss: 0.8824, test_f1: 0.5554
 epoch: 90, train_loss: 0.7924, test_loss: 0.8941, test_f1: 0.5436
 epoch: 91, train_loss: 0.7901, test_loss: 0.8846, test_f1: 0.5517
 epoch: 92, train_loss: 0.7910, test_loss: 0.8979, test_f1: 0.5491
 epoch: 93, train_loss: 0.7935, test_loss: 0.9134, test_f1: 0.5395
 epoch: 94, train_loss: 0.7836, test_loss: 0.9042, test_f1: 0.5424
 epoch: 95, train_loss: 0.7945, test_loss: 0.8808, test_f1: 0.5512
 epoch: 96, train_loss: 0.7996, test_loss: 0.8911, test_f1: 0.5454
 epoch: 97, train_loss: 0.7821, test_loss: 0.8882, test_f1: 0.5421
 epoch: 98, train_loss: 0.7867, test_loss: 0.8884, test_f1: 0.5535
 epoch: 99, train_loss: 0.7874, test_loss: 0.8702, test_f1: 0.5430
##################ITERATION #9 ****************************************
 epoch: 0, train_loss: 1.3243, test_loss: 1.2329, test_f1: 0.2271
 epoch: 1, train_loss: 1.2031, test_loss: 1.1088, test_f1: 0.3545
 epoch: 2, train_loss: 1.1593, test_loss: 1.0836, test_f1: 0.4254
 epoch: 3, train_loss: 1.1382, test_loss: 1.0616, test_f1: 0.4633
 epoch: 4, train_loss: 1.1262, test_loss: 1.0485, test_f1: 0.4626
 epoch: 5, train_loss: 1.0835, test_loss: 1.0317, test_f1: 0.4737
 epoch: 6, train_loss: 1.0808, test_loss: 1.0250, test_f1: 0.4822
 epoch: 7, train_loss: 1.0560, test_loss: 1.0170, test_f1: 0.4798
 epoch: 8, train_loss: 1.0493, test_loss: 1.0040, test_f1: 0.4791
 epoch: 9, train_loss: 1.0253, test_loss: 1.0037, test_f1: 0.4822
 epoch: 10, train_loss: 1.0109, test_loss: 0.9980, test_f1: 0.4802
 epoch: 11, train_loss: 1.0099, test_loss: 0.9937, test_f1: 0.4863
 epoch: 12, train_loss: 1.0003, test_loss: 0.9853, test_f1: 0.4883
 epoch: 13, train_loss: 0.9971, test_loss: 0.9762, test_f1: 0.4886
 epoch: 14, train_loss: 0.9819, test_loss: 0.9700, test_f1: 0.4940
 epoch: 15, train_loss: 0.9750, test_loss: 0.9776, test_f1: 0.4920
 epoch: 16, train_loss: 0.9633, test_loss: 0.9733, test_f1: 0.4910
 epoch: 17, train_loss: 0.9575, test_loss: 0.9640, test_f1: 0.4862
 epoch: 18, train_loss: 0.9515, test_loss: 0.9645, test_f1: 0.4927
 epoch: 19, train_loss: 0.9508, test_loss: 0.9668, test_f1: 0.4952
 epoch: 20, train_loss: 0.9442, test_loss: 0.9657, test_f1: 0.4947
 epoch: 21, train_loss: 0.9358, test_loss: 0.9651, test_f1: 0.4948
 epoch: 22, train_loss: 0.9359, test_loss: 0.9450, test_f1: 0.5005
 epoch: 23, train_loss: 0.9287, test_loss: 0.9411, test_f1: 0.5062
 epoch: 24, train_loss: 0.9317, test_loss: 0.9431, test_f1: 0.4865
 epoch: 25, train_loss: 0.9158, test_loss: 0.9395, test_f1: 0.4997
 epoch: 26, train_loss: 0.9202, test_loss: 0.9470, test_f1: 0.5025
 epoch: 27, train_loss: 0.9177, test_loss: 0.9441, test_f1: 0.5153
 epoch: 28, train_loss: 0.9075, test_loss: 0.9489, test_f1: 0.5138
 epoch: 29, train_loss: 0.9167, test_loss: 0.9398, test_f1: 0.5133
 epoch: 30, train_loss: 0.9009, test_loss: 0.9335, test_f1: 0.5146
 epoch: 31, train_loss: 0.8997, test_loss: 0.9430, test_f1: 0.5254
 epoch: 32, train_loss: 0.8897, test_loss: 0.9349, test_f1: 0.5155
 epoch: 33, train_loss: 0.8809, test_loss: 0.9352, test_f1: 0.5219
 epoch: 34, train_loss: 0.8949, test_loss: 0.9333, test_f1: 0.5180
 epoch: 35, train_loss: 0.8934, test_loss: 0.9412, test_f1: 0.5191
 epoch: 36, train_loss: 0.8895, test_loss: 0.9366, test_f1: 0.5173
 epoch: 37, train_loss: 0.8830, test_loss: 0.9363, test_f1: 0.5227
 epoch: 38, train_loss: 0.8690, test_loss: 0.9558, test_f1: 0.5096
 epoch: 39, train_loss: 0.8714, test_loss: 0.9354, test_f1: 0.5223
 epoch: 40, train_loss: 0.8741, test_loss: 0.9325, test_f1: 0.5173
 epoch: 41, train_loss: 0.8824, test_loss: 0.9324, test_f1: 0.5229
 epoch: 42, train_loss: 0.8668, test_loss: 0.9193, test_f1: 0.5169
 epoch: 43, train_loss: 0.8539, test_loss: 0.9189, test_f1: 0.5134
 epoch: 44, train_loss: 0.8608, test_loss: 0.9304, test_f1: 0.5219
 epoch: 45, train_loss: 0.8634, test_loss: 0.9479, test_f1: 0.5203
 epoch: 46, train_loss: 0.8647, test_loss: 0.9354, test_f1: 0.5261
 epoch: 47, train_loss: 0.8549, test_loss: 0.9206, test_f1: 0.5227
 epoch: 48, train_loss: 0.8557, test_loss: 0.9319, test_f1: 0.5184
 epoch: 49, train_loss: 0.8434, test_loss: 0.9349, test_f1: 0.5260
 epoch: 50, train_loss: 0.8473, test_loss: 0.9448, test_f1: 0.5100
 epoch: 51, train_loss: 0.8393, test_loss: 0.9426, test_f1: 0.5128
 epoch: 52, train_loss: 0.8403, test_loss: 0.9256, test_f1: 0.5250
 epoch: 53, train_loss: 0.8392, test_loss: 0.9244, test_f1: 0.5313
 epoch: 54, train_loss: 0.8419, test_loss: 0.9224, test_f1: 0.5312
 epoch: 55, train_loss: 0.8327, test_loss: 0.9326, test_f1: 0.5244
 epoch: 56, train_loss: 0.8429, test_loss: 0.9341, test_f1: 0.5217
 epoch: 57, train_loss: 0.8341, test_loss: 0.9443, test_f1: 0.5191
 epoch: 58, train_loss: 0.8273, test_loss: 0.9435, test_f1: 0.5205
 epoch: 59, train_loss: 0.8351, test_loss: 0.9432, test_f1: 0.5314
 epoch: 60, train_loss: 0.8273, test_loss: 0.9381, test_f1: 0.5235
 epoch: 61, train_loss: 0.8293, test_loss: 0.9389, test_f1: 0.5235
 epoch: 62, train_loss: 0.8307, test_loss: 0.9322, test_f1: 0.5251
 epoch: 63, train_loss: 0.8280, test_loss: 0.9328, test_f1: 0.5303
 epoch: 64, train_loss: 0.8226, test_loss: 0.9320, test_f1: 0.5295
 epoch: 65, train_loss: 0.8283, test_loss: 0.9339, test_f1: 0.5268
 epoch: 66, train_loss: 0.8227, test_loss: 0.9472, test_f1: 0.5214
 epoch: 67, train_loss: 0.8269, test_loss: 0.9235, test_f1: 0.5345
 epoch: 68, train_loss: 0.8100, test_loss: 0.9409, test_f1: 0.5217
 epoch: 69, train_loss: 0.8179, test_loss: 0.9561, test_f1: 0.5156
 epoch: 70, train_loss: 0.8253, test_loss: 0.9516, test_f1: 0.5168
 epoch: 71, train_loss: 0.8231, test_loss: 0.9373, test_f1: 0.5200
 epoch: 72, train_loss: 0.8119, test_loss: 0.9482, test_f1: 0.5169
 epoch: 73, train_loss: 0.8155, test_loss: 0.9358, test_f1: 0.5272
 epoch: 74, train_loss: 0.8176, test_loss: 0.9398, test_f1: 0.5224
 epoch: 75, train_loss: 0.8134, test_loss: 0.9397, test_f1: 0.5241
 epoch: 76, train_loss: 0.8205, test_loss: 0.9418, test_f1: 0.5250
 epoch: 77, train_loss: 0.8110, test_loss: 0.9453, test_f1: 0.5266
 epoch: 78, train_loss: 0.8120, test_loss: 0.9598, test_f1: 0.5275
 epoch: 79, train_loss: 0.8018, test_loss: 0.9378, test_f1: 0.5299
 epoch: 80, train_loss: 0.8066, test_loss: 0.9326, test_f1: 0.5342
 epoch: 81, train_loss: 0.8151, test_loss: 0.9535, test_f1: 0.5370
 epoch: 82, train_loss: 0.8064, test_loss: 0.9402, test_f1: 0.5309
 epoch: 83, train_loss: 0.7999, test_loss: 0.9492, test_f1: 0.5370
 epoch: 84, train_loss: 0.8133, test_loss: 0.9744, test_f1: 0.5244
 epoch: 85, train_loss: 0.7980, test_loss: 0.9503, test_f1: 0.5347
 epoch: 86, train_loss: 0.7933, test_loss: 0.9513, test_f1: 0.5250
 epoch: 87, train_loss: 0.7962, test_loss: 0.9396, test_f1: 0.5472
 epoch: 88, train_loss: 0.7994, test_loss: 0.9692, test_f1: 0.5242
 epoch: 89, train_loss: 0.7978, test_loss: 0.9503, test_f1: 0.5315
 epoch: 90, train_loss: 0.7957, test_loss: 0.9464, test_f1: 0.5307
 epoch: 91, train_loss: 0.7993, test_loss: 0.9489, test_f1: 0.5359
 epoch: 92, train_loss: 0.7954, test_loss: 0.9614, test_f1: 0.5210
 epoch: 93, train_loss: 0.7941, test_loss: 0.9601, test_f1: 0.5329
 epoch: 94, train_loss: 0.7994, test_loss: 0.9510, test_f1: 0.5389
 epoch: 95, train_loss: 0.7998, test_loss: 0.9661, test_f1: 0.5351
 epoch: 96, train_loss: 0.7826, test_loss: 0.9965, test_f1: 0.5236
 epoch: 97, train_loss: 0.7893, test_loss: 0.9719, test_f1: 0.5263
 epoch: 98, train_loss: 0.7945, test_loss: 0.9680, test_f1: 0.5253
 epoch: 99, train_loss: 0.7879, test_loss: 0.9703, test_f1: 0.5363

Training completed in 712.19 seconds
Best F1: 0.5715 at epoch 87
Mean F1 across iterations: 0.5579  0.0075
========================FINAL RESULTS================================
FEGIN weighted F1: 0.5715  0.0075
python main.py --data ltspice_examples --representation component_net --model FEGIN --layers 2 --hiddens 64 --batch_size 64 --lr 0.0001 --emb_size 128 --epochs 100 --save_appendix component_net_L2_H64_BS64_LR0.0001_E128 --no_val
-----



STDERR:
  File "main.py", line 370, in <module>
    main()
  File "main.py", line 254, in main
    dataset = dataset_class(
  File "/home/philip/projects/llm_inference_code_repo/Circuit-Completion-Using-GNNs/component_classification_with_link_prediction_head/evaluation/FEGIN/kernel/circuit_datasets.py", line 15, in __init__
    self.data, self.slices = torch.load(self.processed_paths[0])
  File "/home/philip/.local/lib/python3.8/site-packages/torch/serialization.py", line 1040, in load
    warnings.warn(
  File "/usr/lib/python3.8/warnings.py", line 109, in _showwarnmsg
    sw(msg.message, msg.category, msg.filename, msg.lineno,
  File "main.py", line 47, in warn_with_traceback
    traceback.print_stack(file=log)
/home/philip/projects/llm_inference_code_repo/Circuit-Completion-Using-GNNs/component_classification_with_link_prediction_head/evaluation/FEGIN/kernel/circuit_datasets.py:15: FutureWarning: You are using `torch.load` with `weights_only=False` (the current default value), which uses the default pickle module implicitly. It is possible to construct malicious pickle data which will execute arbitrary code during unpickling (See https://github.com/pytorch/pytorch/blob/main/SECURITY.md#untrusted-models for more details). In a future release, the default value for `weights_only` will be flipped to `True`. This limits the functions that could be executed during unpickling. Arbitrary objects will no longer be allowed to be loaded via this mode unless they are explicitly allowlisted by the user via `torch.serialization.add_safe_globals`. We recommend you start setting `weights_only=True` for any use case where you don't have full control of the loaded file. Please open an issue on GitHub for any issues related to this experimental feature.
  self.data, self.slices = torch.load(self.processed_paths[0])
