STDOUT:
Results will be saved in /home/philip/projects/ltspice_examples_code_repo/Circuit-Completion-Using-GNNs/component_classification_with_link_prediction_head/evaluation/FEGIN/results/model_FEGIN_dataset_ltspice_examples
Command line input: python main.py --data ltspice_examples --representation component_pin_net --model FEGIN --layers 3 --hiddens 128 --batch_size 256 --lr 0.0001 --emb_size 128 --epochs 100 --save_appendix component_pin_net_L3_H128_BS256_LR0.0001_E128 --no_val
 is saved.
-----
ltspice_examples - FEGIN
Using 3 layers, 128 hidden units, h = 2
Loading component_pin_net representation dataset
ENTERED
Training FEGIN on component_pin_net representation
Train: 3558, Test: 846
##################ITERATION #0 ****************************************
 epoch: 0, train_loss: 1.3891, test_loss: 1.3914, test_f1: 0.0304
 epoch: 1, train_loss: 1.3687, test_loss: 1.3830, test_f1: 0.2117
 epoch: 2, train_loss: 1.3500, test_loss: 1.3684, test_f1: 0.2270
 epoch: 3, train_loss: 1.3258, test_loss: 1.3400, test_f1: 0.2270
 epoch: 4, train_loss: 1.2943, test_loss: 1.2921, test_f1: 0.2270
 epoch: 5, train_loss: 1.2611, test_loss: 1.2444, test_f1: 0.2439
 epoch: 6, train_loss: 1.2351, test_loss: 1.2129, test_f1: 0.2651
 epoch: 7, train_loss: 1.2117, test_loss: 1.1884, test_f1: 0.2903
 epoch: 8, train_loss: 1.1928, test_loss: 1.1695, test_f1: 0.3360
 epoch: 9, train_loss: 1.1760, test_loss: 1.1544, test_f1: 0.3467
 epoch: 10, train_loss: 1.1638, test_loss: 1.1400, test_f1: 0.3536
 epoch: 11, train_loss: 1.1485, test_loss: 1.1263, test_f1: 0.3545
 epoch: 12, train_loss: 1.1340, test_loss: 1.1079, test_f1: 0.3811
 epoch: 13, train_loss: 1.1130, test_loss: 1.0906, test_f1: 0.3984
 epoch: 14, train_loss: 1.0915, test_loss: 1.0678, test_f1: 0.4409
 epoch: 15, train_loss: 1.0655, test_loss: 1.0458, test_f1: 0.4604
 epoch: 16, train_loss: 1.0419, test_loss: 1.0221, test_f1: 0.4619
 epoch: 17, train_loss: 1.0192, test_loss: 1.0086, test_f1: 0.4695
 epoch: 18, train_loss: 1.0003, test_loss: 0.9889, test_f1: 0.4971
 epoch: 19, train_loss: 0.9834, test_loss: 0.9882, test_f1: 0.4826
 epoch: 20, train_loss: 0.9651, test_loss: 0.9797, test_f1: 0.4851
 epoch: 21, train_loss: 0.9528, test_loss: 0.9628, test_f1: 0.4990
 epoch: 22, train_loss: 0.9429, test_loss: 0.9544, test_f1: 0.5251
 epoch: 23, train_loss: 0.9240, test_loss: 0.9359, test_f1: 0.5221
 epoch: 24, train_loss: 0.9125, test_loss: 0.9411, test_f1: 0.5416
 epoch: 25, train_loss: 0.9062, test_loss: 0.9314, test_f1: 0.5225
 epoch: 26, train_loss: 0.8995, test_loss: 0.9183, test_f1: 0.5290
 epoch: 27, train_loss: 0.8821, test_loss: 0.9249, test_f1: 0.5276
 epoch: 28, train_loss: 0.8753, test_loss: 0.9109, test_f1: 0.5455
 epoch: 29, train_loss: 0.8672, test_loss: 0.9107, test_f1: 0.5295
 epoch: 30, train_loss: 0.8598, test_loss: 0.8911, test_f1: 0.5421
 epoch: 31, train_loss: 0.8537, test_loss: 0.9084, test_f1: 0.5383
 epoch: 32, train_loss: 0.8502, test_loss: 0.9182, test_f1: 0.5308
 epoch: 33, train_loss: 0.8416, test_loss: 0.9149, test_f1: 0.5390
 epoch: 34, train_loss: 0.8329, test_loss: 0.8980, test_f1: 0.5424
 epoch: 35, train_loss: 0.8306, test_loss: 0.9025, test_f1: 0.5484
 epoch: 36, train_loss: 0.8242, test_loss: 0.8864, test_f1: 0.5420
 epoch: 37, train_loss: 0.8156, test_loss: 0.9049, test_f1: 0.5414
 epoch: 38, train_loss: 0.8104, test_loss: 0.9027, test_f1: 0.5411
 epoch: 39, train_loss: 0.8033, test_loss: 0.8855, test_f1: 0.5535
 epoch: 40, train_loss: 0.7978, test_loss: 0.9197, test_f1: 0.5388
 epoch: 41, train_loss: 0.7977, test_loss: 0.8738, test_f1: 0.5502
 epoch: 42, train_loss: 0.7921, test_loss: 0.8946, test_f1: 0.5422
 epoch: 43, train_loss: 0.7889, test_loss: 0.9007, test_f1: 0.5551
 epoch: 44, train_loss: 0.7902, test_loss: 0.8848, test_f1: 0.5505
 epoch: 45, train_loss: 0.7742, test_loss: 0.9710, test_f1: 0.5140
 epoch: 46, train_loss: 0.7786, test_loss: 0.8709, test_f1: 0.5400
 epoch: 47, train_loss: 0.7754, test_loss: 0.8913, test_f1: 0.5632
 epoch: 48, train_loss: 0.7703, test_loss: 0.9118, test_f1: 0.5609
 epoch: 49, train_loss: 0.7761, test_loss: 0.9196, test_f1: 0.5411
 epoch: 50, train_loss: 0.7674, test_loss: 0.8876, test_f1: 0.5420
 epoch: 51, train_loss: 0.7509, test_loss: 0.8922, test_f1: 0.5536
 epoch: 52, train_loss: 0.7502, test_loss: 0.8898, test_f1: 0.5474
 epoch: 53, train_loss: 0.7432, test_loss: 0.8953, test_f1: 0.5559
 epoch: 54, train_loss: 0.7486, test_loss: 0.9031, test_f1: 0.5596
 epoch: 55, train_loss: 0.7534, test_loss: 0.9007, test_f1: 0.5588
 epoch: 56, train_loss: 0.7382, test_loss: 0.8805, test_f1: 0.5565
 epoch: 57, train_loss: 0.7324, test_loss: 0.8983, test_f1: 0.5479
 epoch: 58, train_loss: 0.7365, test_loss: 0.9018, test_f1: 0.5673
 epoch: 59, train_loss: 0.7351, test_loss: 0.9228, test_f1: 0.5462
 epoch: 60, train_loss: 0.7288, test_loss: 0.9061, test_f1: 0.5623
 epoch: 61, train_loss: 0.7300, test_loss: 0.8951, test_f1: 0.5636
 epoch: 62, train_loss: 0.7298, test_loss: 0.9064, test_f1: 0.5555
 epoch: 63, train_loss: 0.7307, test_loss: 0.8907, test_f1: 0.5623
 epoch: 64, train_loss: 0.7260, test_loss: 0.9016, test_f1: 0.5613
 epoch: 65, train_loss: 0.7211, test_loss: 0.8931, test_f1: 0.5519
 epoch: 66, train_loss: 0.7169, test_loss: 0.9090, test_f1: 0.5535
 epoch: 67, train_loss: 0.7136, test_loss: 0.8916, test_f1: 0.5693
 epoch: 68, train_loss: 0.7195, test_loss: 0.9144, test_f1: 0.5568
 epoch: 69, train_loss: 0.7121, test_loss: 0.9060, test_f1: 0.5727
 epoch: 70, train_loss: 0.7145, test_loss: 0.8896, test_f1: 0.5794
 epoch: 71, train_loss: 0.7087, test_loss: 0.8867, test_f1: 0.5654
 epoch: 72, train_loss: 0.7085, test_loss: 0.9055, test_f1: 0.5550
 epoch: 73, train_loss: 0.7080, test_loss: 0.9012, test_f1: 0.5661
 epoch: 74, train_loss: 0.7027, test_loss: 0.9021, test_f1: 0.5631
 epoch: 75, train_loss: 0.7025, test_loss: 0.9300, test_f1: 0.5632
 epoch: 76, train_loss: 0.7105, test_loss: 0.8832, test_f1: 0.5537
 epoch: 77, train_loss: 0.7060, test_loss: 0.9358, test_f1: 0.5732
 epoch: 78, train_loss: 0.7000, test_loss: 0.9025, test_f1: 0.5622
 epoch: 79, train_loss: 0.6931, test_loss: 0.9106, test_f1: 0.5612
 epoch: 80, train_loss: 0.6914, test_loss: 0.9196, test_f1: 0.5646
 epoch: 81, train_loss: 0.6954, test_loss: 0.9005, test_f1: 0.5672
 epoch: 82, train_loss: 0.6877, test_loss: 0.9260, test_f1: 0.5631
 epoch: 83, train_loss: 0.6903, test_loss: 0.9093, test_f1: 0.5693
 epoch: 84, train_loss: 0.6940, test_loss: 0.9161, test_f1: 0.5782
 epoch: 85, train_loss: 0.6875, test_loss: 0.9027, test_f1: 0.5704
 epoch: 86, train_loss: 0.6873, test_loss: 0.9210, test_f1: 0.5747
 epoch: 87, train_loss: 0.6936, test_loss: 0.9168, test_f1: 0.5692
 epoch: 88, train_loss: 0.6819, test_loss: 0.8947, test_f1: 0.5784
 epoch: 89, train_loss: 0.6794, test_loss: 0.9152, test_f1: 0.5735
 epoch: 90, train_loss: 0.6882, test_loss: 0.9154, test_f1: 0.5674
 epoch: 91, train_loss: 0.6654, test_loss: 0.9057, test_f1: 0.5734
 epoch: 92, train_loss: 0.6701, test_loss: 0.9201, test_f1: 0.5704
 epoch: 93, train_loss: 0.6741, test_loss: 0.9378, test_f1: 0.5822
 epoch: 94, train_loss: 0.6658, test_loss: 0.9173, test_f1: 0.5721
 epoch: 95, train_loss: 0.6726, test_loss: 0.9175, test_f1: 0.5737
 epoch: 96, train_loss: 0.6714, test_loss: 0.9264, test_f1: 0.5810
 epoch: 97, train_loss: 0.6622, test_loss: 0.9272, test_f1: 0.5785
 epoch: 98, train_loss: 0.6658, test_loss: 0.9307, test_f1: 0.5879
 epoch: 99, train_loss: 0.6572, test_loss: 0.9286, test_f1: 0.5844
##################ITERATION #1 ****************************************
 epoch: 0, train_loss: 1.3432, test_loss: 1.3689, test_f1: 0.2270
 epoch: 1, train_loss: 1.2786, test_loss: 1.3377, test_f1: 0.2270
 epoch: 2, train_loss: 1.2348, test_loss: 1.2986, test_f1: 0.2270
 epoch: 3, train_loss: 1.1885, test_loss: 1.2290, test_f1: 0.2270
 epoch: 4, train_loss: 1.1497, test_loss: 1.1411, test_f1: 0.3811
 epoch: 5, train_loss: 1.1123, test_loss: 1.0856, test_f1: 0.4254
 epoch: 6, train_loss: 1.0773, test_loss: 1.0510, test_f1: 0.4353
 epoch: 7, train_loss: 1.0531, test_loss: 1.0286, test_f1: 0.4627
 epoch: 8, train_loss: 1.0277, test_loss: 1.0100, test_f1: 0.4826
 epoch: 9, train_loss: 1.0044, test_loss: 0.9937, test_f1: 0.5024
 epoch: 10, train_loss: 0.9900, test_loss: 0.9870, test_f1: 0.5034
 epoch: 11, train_loss: 0.9724, test_loss: 0.9743, test_f1: 0.5077
 epoch: 12, train_loss: 0.9619, test_loss: 0.9587, test_f1: 0.5210
 epoch: 13, train_loss: 0.9493, test_loss: 0.9561, test_f1: 0.5268
 epoch: 14, train_loss: 0.9381, test_loss: 0.9380, test_f1: 0.5392
 epoch: 15, train_loss: 0.9295, test_loss: 0.9617, test_f1: 0.5195
 epoch: 16, train_loss: 0.9240, test_loss: 0.9254, test_f1: 0.5252
 epoch: 17, train_loss: 0.9150, test_loss: 0.9381, test_f1: 0.5416
 epoch: 18, train_loss: 0.8987, test_loss: 0.9169, test_f1: 0.5437
 epoch: 19, train_loss: 0.8904, test_loss: 0.9011, test_f1: 0.5534
 epoch: 20, train_loss: 0.8862, test_loss: 0.9125, test_f1: 0.5510
 epoch: 21, train_loss: 0.8771, test_loss: 0.8947, test_f1: 0.5550
 epoch: 22, train_loss: 0.8700, test_loss: 0.9062, test_f1: 0.5501
 epoch: 23, train_loss: 0.8674, test_loss: 0.8806, test_f1: 0.5528
 epoch: 24, train_loss: 0.8547, test_loss: 0.8860, test_f1: 0.5447
 epoch: 25, train_loss: 0.8449, test_loss: 0.9147, test_f1: 0.5358
 epoch: 26, train_loss: 0.8521, test_loss: 0.8634, test_f1: 0.5588
 epoch: 27, train_loss: 0.8371, test_loss: 0.8767, test_f1: 0.5648
 epoch: 28, train_loss: 0.8294, test_loss: 0.8909, test_f1: 0.5481
 epoch: 29, train_loss: 0.8311, test_loss: 0.8745, test_f1: 0.5522
 epoch: 30, train_loss: 0.8277, test_loss: 0.9012, test_f1: 0.5731
 epoch: 31, train_loss: 0.8172, test_loss: 0.8601, test_f1: 0.5332
 epoch: 32, train_loss: 0.8069, test_loss: 0.8516, test_f1: 0.5610
 epoch: 33, train_loss: 0.8024, test_loss: 0.8648, test_f1: 0.5515
 epoch: 34, train_loss: 0.8056, test_loss: 0.8449, test_f1: 0.5599
 epoch: 35, train_loss: 0.7940, test_loss: 0.9266, test_f1: 0.5389
 epoch: 36, train_loss: 0.7922, test_loss: 0.8510, test_f1: 0.5683
 epoch: 37, train_loss: 0.7825, test_loss: 0.8639, test_f1: 0.5456
 epoch: 38, train_loss: 0.7807, test_loss: 0.8398, test_f1: 0.5708
 epoch: 39, train_loss: 0.7705, test_loss: 0.8713, test_f1: 0.5566
 epoch: 40, train_loss: 0.7641, test_loss: 0.8378, test_f1: 0.5771
 epoch: 41, train_loss: 0.7491, test_loss: 0.8564, test_f1: 0.5683
 epoch: 42, train_loss: 0.7534, test_loss: 0.8550, test_f1: 0.5622
 epoch: 43, train_loss: 0.7473, test_loss: 0.8275, test_f1: 0.5681
 epoch: 44, train_loss: 0.7445, test_loss: 0.8343, test_f1: 0.5816
 epoch: 45, train_loss: 0.7535, test_loss: 0.8553, test_f1: 0.5770
 epoch: 46, train_loss: 0.7381, test_loss: 0.8419, test_f1: 0.5675
 epoch: 47, train_loss: 0.7348, test_loss: 0.8352, test_f1: 0.5754
 epoch: 48, train_loss: 0.7338, test_loss: 0.8566, test_f1: 0.5747
 epoch: 49, train_loss: 0.7250, test_loss: 0.8377, test_f1: 0.5642
 epoch: 50, train_loss: 0.7280, test_loss: 0.8416, test_f1: 0.5806
 epoch: 51, train_loss: 0.7070, test_loss: 0.8442, test_f1: 0.5646
 epoch: 52, train_loss: 0.7022, test_loss: 0.8454, test_f1: 0.5586
 epoch: 53, train_loss: 0.6986, test_loss: 0.8366, test_f1: 0.5721
 epoch: 54, train_loss: 0.7008, test_loss: 0.8516, test_f1: 0.5791
 epoch: 55, train_loss: 0.7035, test_loss: 0.8272, test_f1: 0.5746
 epoch: 56, train_loss: 0.6925, test_loss: 0.8387, test_f1: 0.5635
 epoch: 57, train_loss: 0.6920, test_loss: 0.8526, test_f1: 0.5794
 epoch: 58, train_loss: 0.6851, test_loss: 0.8407, test_f1: 0.5687
 epoch: 59, train_loss: 0.6891, test_loss: 0.8627, test_f1: 0.5663
 epoch: 60, train_loss: 0.6832, test_loss: 0.8389, test_f1: 0.5737
 epoch: 61, train_loss: 0.6845, test_loss: 0.8621, test_f1: 0.5704
 epoch: 62, train_loss: 0.6788, test_loss: 0.8586, test_f1: 0.5731
 epoch: 63, train_loss: 0.6785, test_loss: 0.8565, test_f1: 0.5717
 epoch: 64, train_loss: 0.6793, test_loss: 0.8536, test_f1: 0.5687
 epoch: 65, train_loss: 0.6687, test_loss: 0.8532, test_f1: 0.5838
 epoch: 66, train_loss: 0.6688, test_loss: 0.8507, test_f1: 0.5718
 epoch: 67, train_loss: 0.6684, test_loss: 0.8637, test_f1: 0.5718
 epoch: 68, train_loss: 0.6604, test_loss: 0.8533, test_f1: 0.5747
 epoch: 69, train_loss: 0.6619, test_loss: 0.8517, test_f1: 0.5910
 epoch: 70, train_loss: 0.6636, test_loss: 0.8622, test_f1: 0.5861
 epoch: 71, train_loss: 0.6628, test_loss: 0.8593, test_f1: 0.5833
 epoch: 72, train_loss: 0.6533, test_loss: 0.8594, test_f1: 0.5794
 epoch: 73, train_loss: 0.6561, test_loss: 0.8704, test_f1: 0.5884
 epoch: 74, train_loss: 0.6461, test_loss: 0.8738, test_f1: 0.5730
 epoch: 75, train_loss: 0.6471, test_loss: 0.8521, test_f1: 0.5755
 epoch: 76, train_loss: 0.6490, test_loss: 0.8571, test_f1: 0.5937
 epoch: 77, train_loss: 0.6488, test_loss: 0.8740, test_f1: 0.6035
 epoch: 78, train_loss: 0.6385, test_loss: 0.8981, test_f1: 0.5722
 epoch: 79, train_loss: 0.6447, test_loss: 0.8625, test_f1: 0.6064
 epoch: 80, train_loss: 0.6465, test_loss: 0.8790, test_f1: 0.5914
 epoch: 81, train_loss: 0.6334, test_loss: 0.8803, test_f1: 0.5859
 epoch: 82, train_loss: 0.6396, test_loss: 0.8716, test_f1: 0.6006
 epoch: 83, train_loss: 0.6273, test_loss: 0.8814, test_f1: 0.5917
 epoch: 84, train_loss: 0.6300, test_loss: 0.8870, test_f1: 0.6064
 epoch: 85, train_loss: 0.6372, test_loss: 0.8780, test_f1: 0.5862
 epoch: 86, train_loss: 0.6371, test_loss: 0.8805, test_f1: 0.5871
 epoch: 87, train_loss: 0.6364, test_loss: 0.8899, test_f1: 0.5868
 epoch: 88, train_loss: 0.6287, test_loss: 0.8690, test_f1: 0.5872
 epoch: 89, train_loss: 0.6276, test_loss: 0.8811, test_f1: 0.6061
 epoch: 90, train_loss: 0.6223, test_loss: 0.8924, test_f1: 0.5804
 epoch: 91, train_loss: 0.6225, test_loss: 0.8768, test_f1: 0.5992
 epoch: 92, train_loss: 0.6194, test_loss: 0.8744, test_f1: 0.5988
 epoch: 93, train_loss: 0.6239, test_loss: 0.8928, test_f1: 0.5992
 epoch: 94, train_loss: 0.6139, test_loss: 0.8859, test_f1: 0.5829
 epoch: 95, train_loss: 0.6151, test_loss: 0.8925, test_f1: 0.5911
 epoch: 96, train_loss: 0.6050, test_loss: 0.9074, test_f1: 0.5983
 epoch: 97, train_loss: 0.6071, test_loss: 0.8931, test_f1: 0.6083
 epoch: 98, train_loss: 0.5995, test_loss: 0.8956, test_f1: 0.5870
 epoch: 99, train_loss: 0.6132, test_loss: 0.8988, test_f1: 0.5986
##################ITERATION #2 ****************************************
 epoch: 0, train_loss: 1.3085, test_loss: 1.3519, test_f1: 0.2270
 epoch: 1, train_loss: 1.2258, test_loss: 1.3157, test_f1: 0.2270
 epoch: 2, train_loss: 1.1752, test_loss: 1.2801, test_f1: 0.2270
 epoch: 3, train_loss: 1.1292, test_loss: 1.1928, test_f1: 0.2345
 epoch: 4, train_loss: 1.0875, test_loss: 1.0834, test_f1: 0.4029
 epoch: 5, train_loss: 1.0535, test_loss: 1.0305, test_f1: 0.4535
 epoch: 6, train_loss: 1.0307, test_loss: 1.0032, test_f1: 0.4873
 epoch: 7, train_loss: 1.0053, test_loss: 0.9871, test_f1: 0.4922
 epoch: 8, train_loss: 0.9912, test_loss: 0.9725, test_f1: 0.4967
 epoch: 9, train_loss: 0.9752, test_loss: 0.9598, test_f1: 0.5031
 epoch: 10, train_loss: 0.9649, test_loss: 0.9531, test_f1: 0.4993
 epoch: 11, train_loss: 0.9578, test_loss: 0.9439, test_f1: 0.5160
 epoch: 12, train_loss: 0.9475, test_loss: 0.9386, test_f1: 0.5282
 epoch: 13, train_loss: 0.9297, test_loss: 0.9296, test_f1: 0.5284
 epoch: 14, train_loss: 0.9270, test_loss: 0.9197, test_f1: 0.5292
 epoch: 15, train_loss: 0.9159, test_loss: 0.9159, test_f1: 0.5415
 epoch: 16, train_loss: 0.9078, test_loss: 0.9149, test_f1: 0.5290
 epoch: 17, train_loss: 0.8983, test_loss: 0.9090, test_f1: 0.5354
 epoch: 18, train_loss: 0.8888, test_loss: 0.8917, test_f1: 0.5540
 epoch: 19, train_loss: 0.8871, test_loss: 0.8937, test_f1: 0.5491
 epoch: 20, train_loss: 0.8793, test_loss: 0.8778, test_f1: 0.5610
 epoch: 21, train_loss: 0.8746, test_loss: 0.8880, test_f1: 0.5173
 epoch: 22, train_loss: 0.8620, test_loss: 0.8818, test_f1: 0.5527
 epoch: 23, train_loss: 0.8618, test_loss: 0.8738, test_f1: 0.5453
 epoch: 24, train_loss: 0.8427, test_loss: 0.8623, test_f1: 0.5502
 epoch: 25, train_loss: 0.8444, test_loss: 0.8854, test_f1: 0.5382
 epoch: 26, train_loss: 0.8358, test_loss: 0.8604, test_f1: 0.5565
 epoch: 27, train_loss: 0.8264, test_loss: 0.8492, test_f1: 0.5585
 epoch: 28, train_loss: 0.8185, test_loss: 0.8785, test_f1: 0.5438
 epoch: 29, train_loss: 0.8174, test_loss: 0.8443, test_f1: 0.5571
 epoch: 30, train_loss: 0.8058, test_loss: 0.8445, test_f1: 0.5476
 epoch: 31, train_loss: 0.7995, test_loss: 0.8556, test_f1: 0.5423
 epoch: 32, train_loss: 0.7960, test_loss: 0.8633, test_f1: 0.5580
 epoch: 33, train_loss: 0.7901, test_loss: 0.8535, test_f1: 0.5617
 epoch: 34, train_loss: 0.7898, test_loss: 0.8465, test_f1: 0.5480
 epoch: 35, train_loss: 0.7776, test_loss: 0.8420, test_f1: 0.5656
 epoch: 36, train_loss: 0.7762, test_loss: 0.8372, test_f1: 0.5565
 epoch: 37, train_loss: 0.7580, test_loss: 0.8542, test_f1: 0.5478
 epoch: 38, train_loss: 0.7593, test_loss: 0.8599, test_f1: 0.5597
 epoch: 39, train_loss: 0.7558, test_loss: 0.8334, test_f1: 0.5509
 epoch: 40, train_loss: 0.7504, test_loss: 0.8362, test_f1: 0.5578
 epoch: 41, train_loss: 0.7376, test_loss: 0.8535, test_f1: 0.5530
 epoch: 42, train_loss: 0.7341, test_loss: 0.8327, test_f1: 0.5711
 epoch: 43, train_loss: 0.7327, test_loss: 0.8654, test_f1: 0.5608
 epoch: 44, train_loss: 0.7293, test_loss: 0.8457, test_f1: 0.5739
 epoch: 45, train_loss: 0.7209, test_loss: 0.8608, test_f1: 0.5460
 epoch: 46, train_loss: 0.7142, test_loss: 0.8384, test_f1: 0.5569
 epoch: 47, train_loss: 0.7141, test_loss: 0.8614, test_f1: 0.5637
 epoch: 48, train_loss: 0.7060, test_loss: 0.8461, test_f1: 0.5624
 epoch: 49, train_loss: 0.6992, test_loss: 0.8879, test_f1: 0.5533
 epoch: 50, train_loss: 0.7019, test_loss: 0.8461, test_f1: 0.5705
 epoch: 51, train_loss: 0.6911, test_loss: 0.8431, test_f1: 0.5682
 epoch: 52, train_loss: 0.6816, test_loss: 0.8555, test_f1: 0.5745
 epoch: 53, train_loss: 0.6876, test_loss: 0.8543, test_f1: 0.5688
 epoch: 54, train_loss: 0.6702, test_loss: 0.8595, test_f1: 0.5654
 epoch: 55, train_loss: 0.6716, test_loss: 0.8480, test_f1: 0.5695
 epoch: 56, train_loss: 0.6723, test_loss: 0.8573, test_f1: 0.5722
 epoch: 57, train_loss: 0.6732, test_loss: 0.8667, test_f1: 0.5701
 epoch: 58, train_loss: 0.6663, test_loss: 0.8540, test_f1: 0.5620
 epoch: 59, train_loss: 0.6594, test_loss: 0.8605, test_f1: 0.5798
 epoch: 60, train_loss: 0.6600, test_loss: 0.8504, test_f1: 0.5695
 epoch: 61, train_loss: 0.6609, test_loss: 0.8584, test_f1: 0.5823
 epoch: 62, train_loss: 0.6623, test_loss: 0.8606, test_f1: 0.5677
 epoch: 63, train_loss: 0.6549, test_loss: 0.8648, test_f1: 0.5844
 epoch: 64, train_loss: 0.6529, test_loss: 0.8588, test_f1: 0.5616
 epoch: 65, train_loss: 0.6479, test_loss: 0.8750, test_f1: 0.5766
 epoch: 66, train_loss: 0.6528, test_loss: 0.8713, test_f1: 0.5698
 epoch: 67, train_loss: 0.6459, test_loss: 0.8538, test_f1: 0.5816
 epoch: 68, train_loss: 0.6384, test_loss: 0.8626, test_f1: 0.5746
 epoch: 69, train_loss: 0.6389, test_loss: 0.8732, test_f1: 0.5771
 epoch: 70, train_loss: 0.6324, test_loss: 0.8667, test_f1: 0.5806
 epoch: 71, train_loss: 0.6378, test_loss: 0.8691, test_f1: 0.5737
 epoch: 72, train_loss: 0.6325, test_loss: 0.8838, test_f1: 0.5694
 epoch: 73, train_loss: 0.6229, test_loss: 0.8716, test_f1: 0.5709
 epoch: 74, train_loss: 0.6271, test_loss: 0.8918, test_f1: 0.5882
 epoch: 75, train_loss: 0.6240, test_loss: 0.8847, test_f1: 0.5658
 epoch: 76, train_loss: 0.6183, test_loss: 0.8829, test_f1: 0.5829
 epoch: 77, train_loss: 0.6221, test_loss: 0.8821, test_f1: 0.5797
 epoch: 78, train_loss: 0.6184, test_loss: 0.8933, test_f1: 0.5781
 epoch: 79, train_loss: 0.6142, test_loss: 0.8893, test_f1: 0.5805
 epoch: 80, train_loss: 0.6194, test_loss: 0.8970, test_f1: 0.5809
 epoch: 81, train_loss: 0.6160, test_loss: 0.8985, test_f1: 0.5855
 epoch: 82, train_loss: 0.6136, test_loss: 0.9010, test_f1: 0.5763
 epoch: 83, train_loss: 0.6127, test_loss: 0.8914, test_f1: 0.5853
 epoch: 84, train_loss: 0.6061, test_loss: 0.9032, test_f1: 0.5827
 epoch: 85, train_loss: 0.6093, test_loss: 0.9194, test_f1: 0.5734
 epoch: 86, train_loss: 0.5905, test_loss: 0.9047, test_f1: 0.5839
 epoch: 87, train_loss: 0.5970, test_loss: 0.9125, test_f1: 0.5735
 epoch: 88, train_loss: 0.6018, test_loss: 0.9152, test_f1: 0.5861
 epoch: 89, train_loss: 0.5945, test_loss: 0.9390, test_f1: 0.5929
 epoch: 90, train_loss: 0.5994, test_loss: 0.8974, test_f1: 0.5886
 epoch: 91, train_loss: 0.5813, test_loss: 0.9435, test_f1: 0.5719
 epoch: 92, train_loss: 0.5926, test_loss: 0.9154, test_f1: 0.5817
 epoch: 93, train_loss: 0.5920, test_loss: 0.9166, test_f1: 0.5924
 epoch: 94, train_loss: 0.5864, test_loss: 0.9252, test_f1: 0.5763
 epoch: 95, train_loss: 0.5898, test_loss: 0.9331, test_f1: 0.5783
 epoch: 96, train_loss: 0.5770, test_loss: 0.9512, test_f1: 0.5862
 epoch: 97, train_loss: 0.6014, test_loss: 0.9267, test_f1: 0.5739
 epoch: 98, train_loss: 0.5751, test_loss: 0.9469, test_f1: 0.5812
 epoch: 99, train_loss: 0.5878, test_loss: 0.9315, test_f1: 0.5899
##################ITERATION #3 ****************************************
 epoch: 0, train_loss: 1.2671, test_loss: 1.3306, test_f1: 0.2270
 epoch: 1, train_loss: 1.1646, test_loss: 1.2813, test_f1: 0.2270
 epoch: 2, train_loss: 1.1092, test_loss: 1.1987, test_f1: 0.2461
 epoch: 3, train_loss: 1.0713, test_loss: 1.0924, test_f1: 0.3658
 epoch: 4, train_loss: 1.0410, test_loss: 1.0445, test_f1: 0.4562
 epoch: 5, train_loss: 1.0161, test_loss: 1.0188, test_f1: 0.4699
 epoch: 6, train_loss: 0.9938, test_loss: 1.0007, test_f1: 0.4973
 epoch: 7, train_loss: 0.9779, test_loss: 0.9819, test_f1: 0.5099
 epoch: 8, train_loss: 0.9692, test_loss: 0.9672, test_f1: 0.5211
 epoch: 9, train_loss: 0.9540, test_loss: 0.9578, test_f1: 0.5129
 epoch: 10, train_loss: 0.9437, test_loss: 0.9521, test_f1: 0.5274
 epoch: 11, train_loss: 0.9290, test_loss: 0.9474, test_f1: 0.5273
 epoch: 12, train_loss: 0.9292, test_loss: 0.9499, test_f1: 0.5297
 epoch: 13, train_loss: 0.9131, test_loss: 0.9325, test_f1: 0.5295
 epoch: 14, train_loss: 0.9087, test_loss: 0.9283, test_f1: 0.5236
 epoch: 15, train_loss: 0.8991, test_loss: 0.9278, test_f1: 0.5301
 epoch: 16, train_loss: 0.8923, test_loss: 0.9169, test_f1: 0.5398
 epoch: 17, train_loss: 0.8882, test_loss: 0.9234, test_f1: 0.5333
 epoch: 18, train_loss: 0.8735, test_loss: 0.9261, test_f1: 0.5322
 epoch: 19, train_loss: 0.8644, test_loss: 0.9144, test_f1: 0.5417
 epoch: 20, train_loss: 0.8527, test_loss: 0.9032, test_f1: 0.5366
 epoch: 21, train_loss: 0.8512, test_loss: 0.9069, test_f1: 0.5394
 epoch: 22, train_loss: 0.8514, test_loss: 0.9095, test_f1: 0.5345
 epoch: 23, train_loss: 0.8409, test_loss: 0.9206, test_f1: 0.5416
 epoch: 24, train_loss: 0.8342, test_loss: 0.8828, test_f1: 0.5388
 epoch: 25, train_loss: 0.8189, test_loss: 0.8847, test_f1: 0.5533
 epoch: 26, train_loss: 0.8087, test_loss: 0.8809, test_f1: 0.5497
 epoch: 27, train_loss: 0.8115, test_loss: 0.9135, test_f1: 0.5450
 epoch: 28, train_loss: 0.8051, test_loss: 0.9339, test_f1: 0.5177
 epoch: 29, train_loss: 0.8034, test_loss: 0.8745, test_f1: 0.5564
 epoch: 30, train_loss: 0.8003, test_loss: 0.8537, test_f1: 0.5523
 epoch: 31, train_loss: 0.7809, test_loss: 0.8603, test_f1: 0.5462
 epoch: 32, train_loss: 0.7786, test_loss: 0.8482, test_f1: 0.5629
 epoch: 33, train_loss: 0.7698, test_loss: 0.8719, test_f1: 0.5573
 epoch: 34, train_loss: 0.7628, test_loss: 0.8619, test_f1: 0.5632
 epoch: 35, train_loss: 0.7615, test_loss: 0.8493, test_f1: 0.5632
 epoch: 36, train_loss: 0.7508, test_loss: 0.8627, test_f1: 0.5630
 epoch: 37, train_loss: 0.7437, test_loss: 0.8422, test_f1: 0.5706
 epoch: 38, train_loss: 0.7404, test_loss: 0.8596, test_f1: 0.5753
 epoch: 39, train_loss: 0.7359, test_loss: 0.8389, test_f1: 0.5757
 epoch: 40, train_loss: 0.7303, test_loss: 0.8580, test_f1: 0.5682
 epoch: 41, train_loss: 0.7194, test_loss: 0.8765, test_f1: 0.5529
 epoch: 42, train_loss: 0.7243, test_loss: 0.8642, test_f1: 0.5718
 epoch: 43, train_loss: 0.7144, test_loss: 0.8664, test_f1: 0.5763
 epoch: 44, train_loss: 0.7132, test_loss: 0.8709, test_f1: 0.5700
 epoch: 45, train_loss: 0.7077, test_loss: 0.8448, test_f1: 0.5728
 epoch: 46, train_loss: 0.6926, test_loss: 0.8577, test_f1: 0.5881
 epoch: 47, train_loss: 0.7045, test_loss: 0.8428, test_f1: 0.5980
 epoch: 48, train_loss: 0.6899, test_loss: 0.8746, test_f1: 0.5946
 epoch: 49, train_loss: 0.6935, test_loss: 0.8948, test_f1: 0.5813
 epoch: 50, train_loss: 0.6813, test_loss: 0.8512, test_f1: 0.5984
 epoch: 51, train_loss: 0.6761, test_loss: 0.8467, test_f1: 0.5938
 epoch: 52, train_loss: 0.6654, test_loss: 0.8452, test_f1: 0.5906
 epoch: 53, train_loss: 0.6606, test_loss: 0.8609, test_f1: 0.5841
 epoch: 54, train_loss: 0.6614, test_loss: 0.8464, test_f1: 0.5892
 epoch: 55, train_loss: 0.6505, test_loss: 0.8561, test_f1: 0.5878
 epoch: 56, train_loss: 0.6578, test_loss: 0.8496, test_f1: 0.5918
 epoch: 57, train_loss: 0.6572, test_loss: 0.8624, test_f1: 0.5824
 epoch: 58, train_loss: 0.6530, test_loss: 0.8621, test_f1: 0.5810
 epoch: 59, train_loss: 0.6604, test_loss: 0.8571, test_f1: 0.5901
 epoch: 60, train_loss: 0.6487, test_loss: 0.8455, test_f1: 0.5840
 epoch: 61, train_loss: 0.6497, test_loss: 0.8563, test_f1: 0.5903
 epoch: 62, train_loss: 0.6426, test_loss: 0.8479, test_f1: 0.5894
 epoch: 63, train_loss: 0.6362, test_loss: 0.8583, test_f1: 0.5837
 epoch: 64, train_loss: 0.6389, test_loss: 0.8602, test_f1: 0.5916
 epoch: 65, train_loss: 0.6396, test_loss: 0.8717, test_f1: 0.5984
 epoch: 66, train_loss: 0.6315, test_loss: 0.8683, test_f1: 0.5857
 epoch: 67, train_loss: 0.6376, test_loss: 0.8755, test_f1: 0.5889
 epoch: 68, train_loss: 0.6404, test_loss: 0.8583, test_f1: 0.5937
 epoch: 69, train_loss: 0.6359, test_loss: 0.8780, test_f1: 0.5821
 epoch: 70, train_loss: 0.6217, test_loss: 0.8777, test_f1: 0.5904
 epoch: 71, train_loss: 0.6291, test_loss: 0.8687, test_f1: 0.5929
 epoch: 72, train_loss: 0.6179, test_loss: 0.8830, test_f1: 0.5814
 epoch: 73, train_loss: 0.6180, test_loss: 0.8700, test_f1: 0.5949
 epoch: 74, train_loss: 0.6181, test_loss: 0.8649, test_f1: 0.5950
 epoch: 75, train_loss: 0.6136, test_loss: 0.8786, test_f1: 0.5904
 epoch: 76, train_loss: 0.6068, test_loss: 0.8856, test_f1: 0.5844
 epoch: 77, train_loss: 0.6084, test_loss: 0.8936, test_f1: 0.5865
 epoch: 78, train_loss: 0.6084, test_loss: 0.8865, test_f1: 0.5858
 epoch: 79, train_loss: 0.6066, test_loss: 0.8886, test_f1: 0.5821
 epoch: 80, train_loss: 0.6116, test_loss: 0.8811, test_f1: 0.5951
 epoch: 81, train_loss: 0.6039, test_loss: 0.9116, test_f1: 0.5943
 epoch: 82, train_loss: 0.6074, test_loss: 0.8874, test_f1: 0.6016
 epoch: 83, train_loss: 0.5975, test_loss: 0.8931, test_f1: 0.5964
 epoch: 84, train_loss: 0.5938, test_loss: 0.8935, test_f1: 0.5997
 epoch: 85, train_loss: 0.5970, test_loss: 0.8928, test_f1: 0.5965
 epoch: 86, train_loss: 0.6011, test_loss: 0.8985, test_f1: 0.6012
 epoch: 87, train_loss: 0.5915, test_loss: 0.9129, test_f1: 0.6087
 epoch: 88, train_loss: 0.5992, test_loss: 0.8953, test_f1: 0.6041
 epoch: 89, train_loss: 0.5925, test_loss: 0.8944, test_f1: 0.6069
 epoch: 90, train_loss: 0.5927, test_loss: 0.9051, test_f1: 0.6064
 epoch: 91, train_loss: 0.5787, test_loss: 0.9096, test_f1: 0.6007
 epoch: 92, train_loss: 0.5847, test_loss: 0.8966, test_f1: 0.5982
 epoch: 93, train_loss: 0.6025, test_loss: 0.8955, test_f1: 0.6054
 epoch: 94, train_loss: 0.5799, test_loss: 0.8914, test_f1: 0.5992
 epoch: 95, train_loss: 0.5810, test_loss: 0.9215, test_f1: 0.6178
 epoch: 96, train_loss: 0.5792, test_loss: 0.9031, test_f1: 0.5951
 epoch: 97, train_loss: 0.5755, test_loss: 0.9124, test_f1: 0.6091
 epoch: 98, train_loss: 0.5770, test_loss: 0.9077, test_f1: 0.6018
 epoch: 99, train_loss: 0.5624, test_loss: 0.9153, test_f1: 0.6128
##################ITERATION #4 ****************************************
 epoch: 0, train_loss: 1.2539, test_loss: 1.3257, test_f1: 0.2270
 epoch: 1, train_loss: 1.1277, test_loss: 1.3011, test_f1: 0.2270
 epoch: 2, train_loss: 1.0737, test_loss: 1.2266, test_f1: 0.2570
 epoch: 3, train_loss: 1.0368, test_loss: 1.1116, test_f1: 0.3620
 epoch: 4, train_loss: 1.0078, test_loss: 1.0450, test_f1: 0.4613
 epoch: 5, train_loss: 0.9855, test_loss: 0.9915, test_f1: 0.4965
 epoch: 6, train_loss: 0.9673, test_loss: 0.9581, test_f1: 0.5168
 epoch: 7, train_loss: 0.9568, test_loss: 0.9347, test_f1: 0.5287
 epoch: 8, train_loss: 0.9396, test_loss: 0.9240, test_f1: 0.5373
 epoch: 9, train_loss: 0.9335, test_loss: 0.9160, test_f1: 0.5427
 epoch: 10, train_loss: 0.9236, test_loss: 0.9057, test_f1: 0.5368
 epoch: 11, train_loss: 0.9100, test_loss: 0.9024, test_f1: 0.5497
 epoch: 12, train_loss: 0.8988, test_loss: 0.8881, test_f1: 0.5325
 epoch: 13, train_loss: 0.8908, test_loss: 0.8834, test_f1: 0.5416
 epoch: 14, train_loss: 0.8888, test_loss: 0.8780, test_f1: 0.5475
 epoch: 15, train_loss: 0.8761, test_loss: 0.8669, test_f1: 0.5457
 epoch: 16, train_loss: 0.8702, test_loss: 0.8607, test_f1: 0.5546
 epoch: 17, train_loss: 0.8638, test_loss: 0.8617, test_f1: 0.5530
 epoch: 18, train_loss: 0.8495, test_loss: 0.8450, test_f1: 0.5514
 epoch: 19, train_loss: 0.8419, test_loss: 0.8452, test_f1: 0.5470
 epoch: 20, train_loss: 0.8329, test_loss: 0.8365, test_f1: 0.5528
 epoch: 21, train_loss: 0.8311, test_loss: 0.8443, test_f1: 0.5556
 epoch: 22, train_loss: 0.8204, test_loss: 0.8299, test_f1: 0.5532
 epoch: 23, train_loss: 0.8128, test_loss: 0.8217, test_f1: 0.5618
 epoch: 24, train_loss: 0.7971, test_loss: 0.8139, test_f1: 0.5534
 epoch: 25, train_loss: 0.7904, test_loss: 0.8211, test_f1: 0.5661
 epoch: 26, train_loss: 0.7865, test_loss: 0.8107, test_f1: 0.5735
 epoch: 27, train_loss: 0.7770, test_loss: 0.8225, test_f1: 0.5569
 epoch: 28, train_loss: 0.7789, test_loss: 0.7980, test_f1: 0.5580
 epoch: 29, train_loss: 0.7602, test_loss: 0.8026, test_f1: 0.5663
 epoch: 30, train_loss: 0.7658, test_loss: 0.8082, test_f1: 0.5738
 epoch: 31, train_loss: 0.7583, test_loss: 0.8006, test_f1: 0.5960
 epoch: 32, train_loss: 0.7470, test_loss: 0.7977, test_f1: 0.5684
 epoch: 33, train_loss: 0.7494, test_loss: 0.7875, test_f1: 0.5734
 epoch: 34, train_loss: 0.7320, test_loss: 0.7906, test_f1: 0.5787
 epoch: 35, train_loss: 0.7290, test_loss: 0.8001, test_f1: 0.5882
 epoch: 36, train_loss: 0.7235, test_loss: 0.7783, test_f1: 0.5835
 epoch: 37, train_loss: 0.7257, test_loss: 0.7898, test_f1: 0.5772
 epoch: 38, train_loss: 0.7098, test_loss: 0.7792, test_f1: 0.5884
 epoch: 39, train_loss: 0.7115, test_loss: 0.7906, test_f1: 0.5855
 epoch: 40, train_loss: 0.7013, test_loss: 0.7922, test_f1: 0.5853
 epoch: 41, train_loss: 0.7047, test_loss: 0.7769, test_f1: 0.6131
 epoch: 42, train_loss: 0.6930, test_loss: 0.8051, test_f1: 0.5860
 epoch: 43, train_loss: 0.6963, test_loss: 0.8148, test_f1: 0.5680
 epoch: 44, train_loss: 0.6875, test_loss: 0.7961, test_f1: 0.6024
 epoch: 45, train_loss: 0.6781, test_loss: 0.7821, test_f1: 0.5959
 epoch: 46, train_loss: 0.6671, test_loss: 0.7753, test_f1: 0.5956
 epoch: 47, train_loss: 0.6663, test_loss: 0.7945, test_f1: 0.5873
 epoch: 48, train_loss: 0.6660, test_loss: 0.8024, test_f1: 0.5923
 epoch: 49, train_loss: 0.6622, test_loss: 0.7744, test_f1: 0.5926
 epoch: 50, train_loss: 0.6535, test_loss: 0.7648, test_f1: 0.6190
 epoch: 51, train_loss: 0.6532, test_loss: 0.7828, test_f1: 0.5982
 epoch: 52, train_loss: 0.6460, test_loss: 0.7895, test_f1: 0.6018
 epoch: 53, train_loss: 0.6315, test_loss: 0.7712, test_f1: 0.6044
 epoch: 54, train_loss: 0.6339, test_loss: 0.7736, test_f1: 0.6131
 epoch: 55, train_loss: 0.6391, test_loss: 0.7793, test_f1: 0.6062
 epoch: 56, train_loss: 0.6341, test_loss: 0.7868, test_f1: 0.6029
 epoch: 57, train_loss: 0.6333, test_loss: 0.7834, test_f1: 0.6128
 epoch: 58, train_loss: 0.6124, test_loss: 0.7867, test_f1: 0.5988
 epoch: 59, train_loss: 0.6180, test_loss: 0.7856, test_f1: 0.6146
 epoch: 60, train_loss: 0.6234, test_loss: 0.7952, test_f1: 0.6098
 epoch: 61, train_loss: 0.6126, test_loss: 0.8034, test_f1: 0.6173
 epoch: 62, train_loss: 0.6067, test_loss: 0.7975, test_f1: 0.6143
 epoch: 63, train_loss: 0.6094, test_loss: 0.7946, test_f1: 0.6253
 epoch: 64, train_loss: 0.6125, test_loss: 0.7907, test_f1: 0.6162
 epoch: 65, train_loss: 0.5997, test_loss: 0.7913, test_f1: 0.6076
 epoch: 66, train_loss: 0.6059, test_loss: 0.7886, test_f1: 0.6271
 epoch: 67, train_loss: 0.6056, test_loss: 0.7978, test_f1: 0.6168
 epoch: 68, train_loss: 0.6009, test_loss: 0.7857, test_f1: 0.6244
 epoch: 69, train_loss: 0.5979, test_loss: 0.8015, test_f1: 0.6257
 epoch: 70, train_loss: 0.5919, test_loss: 0.8065, test_f1: 0.6242
 epoch: 71, train_loss: 0.5898, test_loss: 0.8045, test_f1: 0.6185
 epoch: 72, train_loss: 0.5857, test_loss: 0.8046, test_f1: 0.6311
 epoch: 73, train_loss: 0.5952, test_loss: 0.8012, test_f1: 0.6382
 epoch: 74, train_loss: 0.5811, test_loss: 0.7986, test_f1: 0.6334
 epoch: 75, train_loss: 0.5801, test_loss: 0.8060, test_f1: 0.6364
 epoch: 76, train_loss: 0.5890, test_loss: 0.8065, test_f1: 0.6573
 epoch: 77, train_loss: 0.5891, test_loss: 0.8196, test_f1: 0.6230
 epoch: 78, train_loss: 0.5833, test_loss: 0.8220, test_f1: 0.6335
 epoch: 79, train_loss: 0.5876, test_loss: 0.8036, test_f1: 0.6338
 epoch: 80, train_loss: 0.5760, test_loss: 0.8098, test_f1: 0.6628
 epoch: 81, train_loss: 0.5720, test_loss: 0.8180, test_f1: 0.6264
 epoch: 82, train_loss: 0.5744, test_loss: 0.8079, test_f1: 0.6379
 epoch: 83, train_loss: 0.5642, test_loss: 0.8392, test_f1: 0.6446
 epoch: 84, train_loss: 0.5693, test_loss: 0.8091, test_f1: 0.6650
 epoch: 85, train_loss: 0.5667, test_loss: 0.8337, test_f1: 0.6362
 epoch: 86, train_loss: 0.5680, test_loss: 0.8462, test_f1: 0.6474
 epoch: 87, train_loss: 0.5653, test_loss: 0.8139, test_f1: 0.6640
 epoch: 88, train_loss: 0.5518, test_loss: 0.8170, test_f1: 0.6601
 epoch: 89, train_loss: 0.5550, test_loss: 0.8263, test_f1: 0.6603
 epoch: 90, train_loss: 0.5457, test_loss: 0.8497, test_f1: 0.6591
 epoch: 91, train_loss: 0.5583, test_loss: 0.8461, test_f1: 0.6676
 epoch: 92, train_loss: 0.5487, test_loss: 0.8368, test_f1: 0.6687
 epoch: 93, train_loss: 0.5506, test_loss: 0.8402, test_f1: 0.6584
 epoch: 94, train_loss: 0.5463, test_loss: 0.8432, test_f1: 0.6680
 epoch: 95, train_loss: 0.5388, test_loss: 0.8555, test_f1: 0.6629
 epoch: 96, train_loss: 0.5465, test_loss: 0.8380, test_f1: 0.6536
 epoch: 97, train_loss: 0.5450, test_loss: 0.8437, test_f1: 0.6741
 epoch: 98, train_loss: 0.5335, test_loss: 0.8407, test_f1: 0.6731
 epoch: 99, train_loss: 0.5373, test_loss: 0.8602, test_f1: 0.6312
##################ITERATION #5 ****************************************
 epoch: 0, train_loss: 1.2100, test_loss: 1.3096, test_f1: 0.2270
 epoch: 1, train_loss: 1.0868, test_loss: 1.2770, test_f1: 0.2396
 epoch: 2, train_loss: 1.0466, test_loss: 1.1910, test_f1: 0.3037
 epoch: 3, train_loss: 1.0212, test_loss: 1.0653, test_f1: 0.4704
 epoch: 4, train_loss: 0.9972, test_loss: 0.9991, test_f1: 0.4978
 epoch: 5, train_loss: 0.9859, test_loss: 0.9797, test_f1: 0.5243
 epoch: 6, train_loss: 0.9659, test_loss: 0.9685, test_f1: 0.5343
 epoch: 7, train_loss: 0.9586, test_loss: 0.9530, test_f1: 0.5424
 epoch: 8, train_loss: 0.9441, test_loss: 0.9455, test_f1: 0.5444
 epoch: 9, train_loss: 0.9338, test_loss: 0.9396, test_f1: 0.5282
 epoch: 10, train_loss: 0.9189, test_loss: 0.9385, test_f1: 0.5394
 epoch: 11, train_loss: 0.9113, test_loss: 0.9331, test_f1: 0.5427
 epoch: 12, train_loss: 0.8999, test_loss: 0.9177, test_f1: 0.5407
 epoch: 13, train_loss: 0.8925, test_loss: 0.9056, test_f1: 0.5436
 epoch: 14, train_loss: 0.8860, test_loss: 0.9083, test_f1: 0.5479
 epoch: 15, train_loss: 0.8743, test_loss: 0.9017, test_f1: 0.5568
 epoch: 16, train_loss: 0.8622, test_loss: 0.8941, test_f1: 0.5608
 epoch: 17, train_loss: 0.8601, test_loss: 0.8959, test_f1: 0.5568
 epoch: 18, train_loss: 0.8577, test_loss: 0.9001, test_f1: 0.5546
 epoch: 19, train_loss: 0.8386, test_loss: 0.8857, test_f1: 0.5582
 epoch: 20, train_loss: 0.8439, test_loss: 0.8928, test_f1: 0.5500
 epoch: 21, train_loss: 0.8348, test_loss: 0.8876, test_f1: 0.5575
 epoch: 22, train_loss: 0.8238, test_loss: 0.8812, test_f1: 0.5631
 epoch: 23, train_loss: 0.8148, test_loss: 0.8694, test_f1: 0.5750
 epoch: 24, train_loss: 0.8026, test_loss: 0.8818, test_f1: 0.5595
 epoch: 25, train_loss: 0.8008, test_loss: 0.8926, test_f1: 0.5567
 epoch: 26, train_loss: 0.7860, test_loss: 0.8703, test_f1: 0.5677
 epoch: 27, train_loss: 0.7828, test_loss: 0.8736, test_f1: 0.5819
 epoch: 28, train_loss: 0.7860, test_loss: 0.8868, test_f1: 0.5658
 epoch: 29, train_loss: 0.7796, test_loss: 0.8634, test_f1: 0.5756
 epoch: 30, train_loss: 0.7598, test_loss: 0.8738, test_f1: 0.5834
 epoch: 31, train_loss: 0.7613, test_loss: 0.8913, test_f1: 0.5720
 epoch: 32, train_loss: 0.7547, test_loss: 0.8629, test_f1: 0.5664
 epoch: 33, train_loss: 0.7469, test_loss: 0.8757, test_f1: 0.5861
 epoch: 34, train_loss: 0.7453, test_loss: 0.8568, test_f1: 0.5773
 epoch: 35, train_loss: 0.7365, test_loss: 0.8663, test_f1: 0.5640
 epoch: 36, train_loss: 0.7261, test_loss: 0.8666, test_f1: 0.5802
 epoch: 37, train_loss: 0.7247, test_loss: 0.8735, test_f1: 0.5897
 epoch: 38, train_loss: 0.7182, test_loss: 0.8444, test_f1: 0.5922
 epoch: 39, train_loss: 0.7133, test_loss: 0.8767, test_f1: 0.5869
 epoch: 40, train_loss: 0.7093, test_loss: 0.8745, test_f1: 0.5874
 epoch: 41, train_loss: 0.6990, test_loss: 0.8617, test_f1: 0.6074
 epoch: 42, train_loss: 0.6903, test_loss: 0.8418, test_f1: 0.6210
 epoch: 43, train_loss: 0.6873, test_loss: 0.8635, test_f1: 0.6212
 epoch: 44, train_loss: 0.6859, test_loss: 0.8623, test_f1: 0.6114
 epoch: 45, train_loss: 0.6804, test_loss: 0.8631, test_f1: 0.6199
 epoch: 46, train_loss: 0.6655, test_loss: 0.8858, test_f1: 0.6255
 epoch: 47, train_loss: 0.6643, test_loss: 0.8900, test_f1: 0.6133
 epoch: 48, train_loss: 0.6716, test_loss: 0.8581, test_f1: 0.6261
 epoch: 49, train_loss: 0.6693, test_loss: 0.8763, test_f1: 0.6283
 epoch: 50, train_loss: 0.6484, test_loss: 0.8966, test_f1: 0.6132
 epoch: 51, train_loss: 0.6570, test_loss: 0.8848, test_f1: 0.6297
 epoch: 52, train_loss: 0.6340, test_loss: 0.8769, test_f1: 0.6439
 epoch: 53, train_loss: 0.6366, test_loss: 0.8909, test_f1: 0.6333
 epoch: 54, train_loss: 0.6388, test_loss: 0.8983, test_f1: 0.6474
 epoch: 55, train_loss: 0.6263, test_loss: 0.8945, test_f1: 0.6454
 epoch: 56, train_loss: 0.6217, test_loss: 0.8989, test_f1: 0.6539
 epoch: 57, train_loss: 0.6265, test_loss: 0.8989, test_f1: 0.6430
 epoch: 58, train_loss: 0.6187, test_loss: 0.9039, test_f1: 0.6467
 epoch: 59, train_loss: 0.6089, test_loss: 0.9063, test_f1: 0.6531
 epoch: 60, train_loss: 0.6219, test_loss: 0.9083, test_f1: 0.6505
 epoch: 61, train_loss: 0.6137, test_loss: 0.9206, test_f1: 0.6360
 epoch: 62, train_loss: 0.6077, test_loss: 0.9015, test_f1: 0.6663
 epoch: 63, train_loss: 0.6144, test_loss: 0.9060, test_f1: 0.6385
 epoch: 64, train_loss: 0.6063, test_loss: 0.9173, test_f1: 0.6487
 epoch: 65, train_loss: 0.5984, test_loss: 0.9308, test_f1: 0.6352
 epoch: 66, train_loss: 0.6049, test_loss: 0.9226, test_f1: 0.6545
 epoch: 67, train_loss: 0.6007, test_loss: 0.9210, test_f1: 0.6514
 epoch: 68, train_loss: 0.6003, test_loss: 0.9036, test_f1: 0.6701
 epoch: 69, train_loss: 0.5882, test_loss: 0.9085, test_f1: 0.6586
 epoch: 70, train_loss: 0.5962, test_loss: 0.9326, test_f1: 0.6444
 epoch: 71, train_loss: 0.5944, test_loss: 0.9319, test_f1: 0.6451
 epoch: 72, train_loss: 0.5880, test_loss: 0.9515, test_f1: 0.6429
 epoch: 73, train_loss: 0.5843, test_loss: 0.9409, test_f1: 0.6534
 epoch: 74, train_loss: 0.5805, test_loss: 0.9349, test_f1: 0.6506
 epoch: 75, train_loss: 0.5762, test_loss: 0.9392, test_f1: 0.6459
 epoch: 76, train_loss: 0.5876, test_loss: 0.9427, test_f1: 0.6702
 epoch: 77, train_loss: 0.5787, test_loss: 0.9362, test_f1: 0.6512
 epoch: 78, train_loss: 0.5746, test_loss: 0.9547, test_f1: 0.6495
 epoch: 79, train_loss: 0.5713, test_loss: 0.9328, test_f1: 0.6535
 epoch: 80, train_loss: 0.5653, test_loss: 0.9465, test_f1: 0.6529
 epoch: 81, train_loss: 0.5661, test_loss: 0.9458, test_f1: 0.6426
 epoch: 82, train_loss: 0.5743, test_loss: 0.9593, test_f1: 0.6561
 epoch: 83, train_loss: 0.5621, test_loss: 0.9596, test_f1: 0.6665
 epoch: 84, train_loss: 0.5621, test_loss: 0.9596, test_f1: 0.6578
 epoch: 85, train_loss: 0.5593, test_loss: 0.9551, test_f1: 0.6445
 epoch: 86, train_loss: 0.5666, test_loss: 0.9488, test_f1: 0.6482
 epoch: 87, train_loss: 0.5661, test_loss: 0.9630, test_f1: 0.6470
 epoch: 88, train_loss: 0.5532, test_loss: 0.9886, test_f1: 0.6417
 epoch: 89, train_loss: 0.5563, test_loss: 0.9846, test_f1: 0.6390
 epoch: 90, train_loss: 0.5508, test_loss: 0.9701, test_f1: 0.6468
 epoch: 91, train_loss: 0.5377, test_loss: 0.9679, test_f1: 0.6538
 epoch: 92, train_loss: 0.5463, test_loss: 0.9879, test_f1: 0.6562
 epoch: 93, train_loss: 0.5453, test_loss: 0.9940, test_f1: 0.6423
 epoch: 94, train_loss: 0.5358, test_loss: 1.0042, test_f1: 0.6320
 epoch: 95, train_loss: 0.5411, test_loss: 1.0039, test_f1: 0.6621
 epoch: 96, train_loss: 0.5421, test_loss: 0.9872, test_f1: 0.6598
 epoch: 97, train_loss: 0.5306, test_loss: 0.9938, test_f1: 0.6360
 epoch: 98, train_loss: 0.5424, test_loss: 0.9798, test_f1: 0.6411
 epoch: 99, train_loss: 0.5325, test_loss: 0.9762, test_f1: 0.6520
##################ITERATION #6 ****************************************
 epoch: 0, train_loss: 1.2654, test_loss: 1.3238, test_f1: 0.2270
 epoch: 1, train_loss: 1.1095, test_loss: 1.3382, test_f1: 0.2270
 epoch: 2, train_loss: 1.0545, test_loss: 1.3201, test_f1: 0.2270
 epoch: 3, train_loss: 1.0266, test_loss: 1.1964, test_f1: 0.2353
 epoch: 4, train_loss: 0.9988, test_loss: 1.0704, test_f1: 0.4154
 epoch: 5, train_loss: 0.9859, test_loss: 0.9936, test_f1: 0.4862
 epoch: 6, train_loss: 0.9670, test_loss: 0.9698, test_f1: 0.5051
 epoch: 7, train_loss: 0.9677, test_loss: 0.9605, test_f1: 0.5135
 epoch: 8, train_loss: 0.9470, test_loss: 0.9542, test_f1: 0.5234
 epoch: 9, train_loss: 0.9397, test_loss: 0.9447, test_f1: 0.5241
 epoch: 10, train_loss: 0.9367, test_loss: 0.9338, test_f1: 0.5313
 epoch: 11, train_loss: 0.9179, test_loss: 0.9245, test_f1: 0.5341
 epoch: 12, train_loss: 0.9065, test_loss: 0.9149, test_f1: 0.5406
 epoch: 13, train_loss: 0.9006, test_loss: 0.9088, test_f1: 0.5278
 epoch: 14, train_loss: 0.8953, test_loss: 0.9017, test_f1: 0.5286
 epoch: 15, train_loss: 0.8787, test_loss: 0.8954, test_f1: 0.5332
 epoch: 16, train_loss: 0.8724, test_loss: 0.8929, test_f1: 0.5396
 epoch: 17, train_loss: 0.8670, test_loss: 0.8816, test_f1: 0.5457
 epoch: 18, train_loss: 0.8533, test_loss: 0.8751, test_f1: 0.5476
 epoch: 19, train_loss: 0.8522, test_loss: 0.8797, test_f1: 0.5499
 epoch: 20, train_loss: 0.8423, test_loss: 0.8725, test_f1: 0.5542
 epoch: 21, train_loss: 0.8360, test_loss: 0.8567, test_f1: 0.5520
 epoch: 22, train_loss: 0.8259, test_loss: 0.8594, test_f1: 0.5630
 epoch: 23, train_loss: 0.8184, test_loss: 0.8570, test_f1: 0.5603
 epoch: 24, train_loss: 0.8096, test_loss: 0.8551, test_f1: 0.5718
 epoch: 25, train_loss: 0.8014, test_loss: 0.8449, test_f1: 0.5767
 epoch: 26, train_loss: 0.7952, test_loss: 0.8469, test_f1: 0.5703
 epoch: 27, train_loss: 0.7936, test_loss: 0.8347, test_f1: 0.5709
 epoch: 28, train_loss: 0.7818, test_loss: 0.8383, test_f1: 0.5623
 epoch: 29, train_loss: 0.7772, test_loss: 0.8388, test_f1: 0.5623
 epoch: 30, train_loss: 0.7729, test_loss: 0.8374, test_f1: 0.5748
 epoch: 31, train_loss: 0.7645, test_loss: 0.8449, test_f1: 0.5745
 epoch: 32, train_loss: 0.7620, test_loss: 0.8281, test_f1: 0.5849
 epoch: 33, train_loss: 0.7534, test_loss: 0.8262, test_f1: 0.5778
 epoch: 34, train_loss: 0.7458, test_loss: 0.8277, test_f1: 0.5870
 epoch: 35, train_loss: 0.7451, test_loss: 0.8323, test_f1: 0.5872
 epoch: 36, train_loss: 0.7399, test_loss: 0.8325, test_f1: 0.5929
 epoch: 37, train_loss: 0.7338, test_loss: 0.8319, test_f1: 0.5730
 epoch: 38, train_loss: 0.7284, test_loss: 0.8440, test_f1: 0.5838
 epoch: 39, train_loss: 0.7308, test_loss: 0.8315, test_f1: 0.5993
 epoch: 40, train_loss: 0.7256, test_loss: 0.8468, test_f1: 0.5891
 epoch: 41, train_loss: 0.7201, test_loss: 0.8440, test_f1: 0.5979
 epoch: 42, train_loss: 0.7171, test_loss: 0.8321, test_f1: 0.6163
 epoch: 43, train_loss: 0.7089, test_loss: 0.8242, test_f1: 0.6120
 epoch: 44, train_loss: 0.7002, test_loss: 0.8349, test_f1: 0.5734
 epoch: 45, train_loss: 0.7020, test_loss: 0.8336, test_f1: 0.5900
 epoch: 46, train_loss: 0.6866, test_loss: 0.8271, test_f1: 0.5833
 epoch: 47, train_loss: 0.6943, test_loss: 0.8191, test_f1: 0.5911
 epoch: 48, train_loss: 0.6790, test_loss: 0.8300, test_f1: 0.6072
 epoch: 49, train_loss: 0.6872, test_loss: 0.8138, test_f1: 0.5914
 epoch: 50, train_loss: 0.6686, test_loss: 0.8326, test_f1: 0.5866
 epoch: 51, train_loss: 0.6643, test_loss: 0.8415, test_f1: 0.6212
 epoch: 52, train_loss: 0.6563, test_loss: 0.8155, test_f1: 0.5931
 epoch: 53, train_loss: 0.6573, test_loss: 0.8310, test_f1: 0.6080
 epoch: 54, train_loss: 0.6606, test_loss: 0.8329, test_f1: 0.5946
 epoch: 55, train_loss: 0.6542, test_loss: 0.8232, test_f1: 0.6215
 epoch: 56, train_loss: 0.6455, test_loss: 0.8317, test_f1: 0.5959
 epoch: 57, train_loss: 0.6439, test_loss: 0.8233, test_f1: 0.5903
 epoch: 58, train_loss: 0.6486, test_loss: 0.8159, test_f1: 0.6153
 epoch: 59, train_loss: 0.6492, test_loss: 0.8304, test_f1: 0.6026
 epoch: 60, train_loss: 0.6464, test_loss: 0.8423, test_f1: 0.6039
 epoch: 61, train_loss: 0.6405, test_loss: 0.8329, test_f1: 0.5984
 epoch: 62, train_loss: 0.6437, test_loss: 0.8413, test_f1: 0.6104
 epoch: 63, train_loss: 0.6367, test_loss: 0.8368, test_f1: 0.6117
 epoch: 64, train_loss: 0.6281, test_loss: 0.8444, test_f1: 0.6066
 epoch: 65, train_loss: 0.6257, test_loss: 0.8399, test_f1: 0.6058
 epoch: 66, train_loss: 0.6287, test_loss: 0.8409, test_f1: 0.5923
 epoch: 67, train_loss: 0.6277, test_loss: 0.8417, test_f1: 0.6134
 epoch: 68, train_loss: 0.6167, test_loss: 0.8460, test_f1: 0.6089
 epoch: 69, train_loss: 0.6181, test_loss: 0.8490, test_f1: 0.5997
 epoch: 70, train_loss: 0.6231, test_loss: 0.8417, test_f1: 0.6085
 epoch: 71, train_loss: 0.6217, test_loss: 0.8393, test_f1: 0.6127
 epoch: 72, train_loss: 0.6194, test_loss: 0.8635, test_f1: 0.6179
 epoch: 73, train_loss: 0.6116, test_loss: 0.8500, test_f1: 0.6066
 epoch: 74, train_loss: 0.6110, test_loss: 0.8458, test_f1: 0.6097
 epoch: 75, train_loss: 0.6130, test_loss: 0.8551, test_f1: 0.6197
 epoch: 76, train_loss: 0.6068, test_loss: 0.8525, test_f1: 0.6293
 epoch: 77, train_loss: 0.6090, test_loss: 0.8348, test_f1: 0.6127
 epoch: 78, train_loss: 0.5946, test_loss: 0.8716, test_f1: 0.6279
 epoch: 79, train_loss: 0.6034, test_loss: 0.8685, test_f1: 0.6086
 epoch: 80, train_loss: 0.5975, test_loss: 0.8617, test_f1: 0.6324
 epoch: 81, train_loss: 0.6062, test_loss: 0.8547, test_f1: 0.6138
 epoch: 82, train_loss: 0.5970, test_loss: 0.8367, test_f1: 0.6157
 epoch: 83, train_loss: 0.5897, test_loss: 0.8574, test_f1: 0.6165
 epoch: 84, train_loss: 0.5857, test_loss: 0.8472, test_f1: 0.6217
 epoch: 85, train_loss: 0.5923, test_loss: 0.8625, test_f1: 0.6076
 epoch: 86, train_loss: 0.5862, test_loss: 0.8901, test_f1: 0.6266
 epoch: 87, train_loss: 0.5901, test_loss: 0.8652, test_f1: 0.6092
 epoch: 88, train_loss: 0.5869, test_loss: 0.8683, test_f1: 0.6164
 epoch: 89, train_loss: 0.5762, test_loss: 0.8570, test_f1: 0.6260
 epoch: 90, train_loss: 0.5728, test_loss: 0.8576, test_f1: 0.6210
 epoch: 91, train_loss: 0.5767, test_loss: 0.8707, test_f1: 0.6293
 epoch: 92, train_loss: 0.5699, test_loss: 0.8573, test_f1: 0.6267
 epoch: 93, train_loss: 0.5691, test_loss: 0.8648, test_f1: 0.6316
 epoch: 94, train_loss: 0.5786, test_loss: 0.8720, test_f1: 0.6211
 epoch: 95, train_loss: 0.5642, test_loss: 0.8679, test_f1: 0.6229
 epoch: 96, train_loss: 0.5640, test_loss: 0.8770, test_f1: 0.6233
 epoch: 97, train_loss: 0.5623, test_loss: 0.8765, test_f1: 0.6187
 epoch: 98, train_loss: 0.5681, test_loss: 0.8777, test_f1: 0.6368
 epoch: 99, train_loss: 0.5601, test_loss: 0.9029, test_f1: 0.6223
##################ITERATION #7 ****************************************
 epoch: 0, train_loss: 1.2126, test_loss: 1.3069, test_f1: 0.2270
 epoch: 1, train_loss: 1.0622, test_loss: 1.2823, test_f1: 0.2299
 epoch: 2, train_loss: 1.0323, test_loss: 1.2477, test_f1: 0.3260
 epoch: 3, train_loss: 0.9986, test_loss: 1.0885, test_f1: 0.4681
 epoch: 4, train_loss: 0.9953, test_loss: 1.0243, test_f1: 0.4735
 epoch: 5, train_loss: 0.9686, test_loss: 1.0016, test_f1: 0.4816
 epoch: 6, train_loss: 0.9537, test_loss: 0.9690, test_f1: 0.5129
 epoch: 7, train_loss: 0.9409, test_loss: 0.9370, test_f1: 0.5192
 epoch: 8, train_loss: 0.9295, test_loss: 0.9329, test_f1: 0.5461
 epoch: 9, train_loss: 0.9187, test_loss: 0.9157, test_f1: 0.5449
 epoch: 10, train_loss: 0.9098, test_loss: 0.9181, test_f1: 0.5530
 epoch: 11, train_loss: 0.9081, test_loss: 0.9227, test_f1: 0.5321
 epoch: 12, train_loss: 0.8962, test_loss: 0.9014, test_f1: 0.5560
 epoch: 13, train_loss: 0.8906, test_loss: 0.9098, test_f1: 0.5516
 epoch: 14, train_loss: 0.8739, test_loss: 0.8993, test_f1: 0.5548
 epoch: 15, train_loss: 0.8688, test_loss: 0.8777, test_f1: 0.5629
 epoch: 16, train_loss: 0.8534, test_loss: 0.8967, test_f1: 0.5598
 epoch: 17, train_loss: 0.8426, test_loss: 0.8976, test_f1: 0.5457
 epoch: 18, train_loss: 0.8448, test_loss: 0.8845, test_f1: 0.5579
 epoch: 19, train_loss: 0.8397, test_loss: 0.8930, test_f1: 0.5368
 epoch: 20, train_loss: 0.8259, test_loss: 0.9039, test_f1: 0.5502
 epoch: 21, train_loss: 0.8173, test_loss: 0.8723, test_f1: 0.5578
 epoch: 22, train_loss: 0.8167, test_loss: 0.8887, test_f1: 0.5421
 epoch: 23, train_loss: 0.8095, test_loss: 0.8791, test_f1: 0.5456
 epoch: 24, train_loss: 0.8053, test_loss: 0.8932, test_f1: 0.5428
 epoch: 25, train_loss: 0.7888, test_loss: 0.8715, test_f1: 0.5435
 epoch: 26, train_loss: 0.7825, test_loss: 0.8790, test_f1: 0.5419
 epoch: 27, train_loss: 0.7838, test_loss: 0.8622, test_f1: 0.5594
 epoch: 28, train_loss: 0.7729, test_loss: 0.8901, test_f1: 0.5483
 epoch: 29, train_loss: 0.7730, test_loss: 0.8843, test_f1: 0.5615
 epoch: 30, train_loss: 0.7771, test_loss: 0.8736, test_f1: 0.5566
 epoch: 31, train_loss: 0.7602, test_loss: 0.8694, test_f1: 0.5684
 epoch: 32, train_loss: 0.7633, test_loss: 0.8619, test_f1: 0.5568
 epoch: 33, train_loss: 0.7455, test_loss: 0.8763, test_f1: 0.5654
 epoch: 34, train_loss: 0.7418, test_loss: 0.9140, test_f1: 0.5480
 epoch: 35, train_loss: 0.7416, test_loss: 0.8411, test_f1: 0.5568
 epoch: 36, train_loss: 0.7290, test_loss: 0.8596, test_f1: 0.5826
 epoch: 37, train_loss: 0.7236, test_loss: 0.8626, test_f1: 0.5534
 epoch: 38, train_loss: 0.7224, test_loss: 0.8545, test_f1: 0.5688
 epoch: 39, train_loss: 0.7163, test_loss: 0.8617, test_f1: 0.5614
 epoch: 40, train_loss: 0.7113, test_loss: 0.8634, test_f1: 0.5661
 epoch: 41, train_loss: 0.7027, test_loss: 0.8657, test_f1: 0.5685
 epoch: 42, train_loss: 0.6916, test_loss: 0.8731, test_f1: 0.5666
 epoch: 43, train_loss: 0.6863, test_loss: 0.8660, test_f1: 0.5682
 epoch: 44, train_loss: 0.6855, test_loss: 0.8688, test_f1: 0.5609
 epoch: 45, train_loss: 0.6839, test_loss: 0.8804, test_f1: 0.5718
 epoch: 46, train_loss: 0.6755, test_loss: 0.8792, test_f1: 0.5785
 epoch: 47, train_loss: 0.6720, test_loss: 0.8571, test_f1: 0.5724
 epoch: 48, train_loss: 0.6686, test_loss: 0.8810, test_f1: 0.5866
 epoch: 49, train_loss: 0.6682, test_loss: 0.8564, test_f1: 0.5871
 epoch: 50, train_loss: 0.6670, test_loss: 0.8668, test_f1: 0.5647
 epoch: 51, train_loss: 0.6607, test_loss: 0.8716, test_f1: 0.5838
 epoch: 52, train_loss: 0.6484, test_loss: 0.8688, test_f1: 0.5702
 epoch: 53, train_loss: 0.6470, test_loss: 0.8619, test_f1: 0.5780
 epoch: 54, train_loss: 0.6408, test_loss: 0.8649, test_f1: 0.5749
 epoch: 55, train_loss: 0.6384, test_loss: 0.8668, test_f1: 0.5848
 epoch: 56, train_loss: 0.6426, test_loss: 0.8521, test_f1: 0.5754
 epoch: 57, train_loss: 0.6373, test_loss: 0.8569, test_f1: 0.5803
 epoch: 58, train_loss: 0.6313, test_loss: 0.8674, test_f1: 0.5899
 epoch: 59, train_loss: 0.6333, test_loss: 0.8698, test_f1: 0.5923
 epoch: 60, train_loss: 0.6390, test_loss: 0.8687, test_f1: 0.5770
 epoch: 61, train_loss: 0.6343, test_loss: 0.8679, test_f1: 0.5872
 epoch: 62, train_loss: 0.6247, test_loss: 0.8742, test_f1: 0.5901
 epoch: 63, train_loss: 0.6250, test_loss: 0.8764, test_f1: 0.5896
 epoch: 64, train_loss: 0.6196, test_loss: 0.8627, test_f1: 0.5769
 epoch: 65, train_loss: 0.6151, test_loss: 0.8744, test_f1: 0.5799
 epoch: 66, train_loss: 0.6149, test_loss: 0.8594, test_f1: 0.5926
 epoch: 67, train_loss: 0.6090, test_loss: 0.8554, test_f1: 0.5960
 epoch: 68, train_loss: 0.6210, test_loss: 0.8838, test_f1: 0.5942
 epoch: 69, train_loss: 0.6065, test_loss: 0.9054, test_f1: 0.5857
 epoch: 70, train_loss: 0.6005, test_loss: 0.9085, test_f1: 0.5889
 epoch: 71, train_loss: 0.5931, test_loss: 0.8929, test_f1: 0.5856
 epoch: 72, train_loss: 0.6042, test_loss: 0.8672, test_f1: 0.5929
 epoch: 73, train_loss: 0.6012, test_loss: 0.8930, test_f1: 0.5854
 epoch: 74, train_loss: 0.5892, test_loss: 0.8910, test_f1: 0.6112
 epoch: 75, train_loss: 0.6007, test_loss: 0.8884, test_f1: 0.6017
 epoch: 76, train_loss: 0.5941, test_loss: 0.8959, test_f1: 0.5882
 epoch: 77, train_loss: 0.5882, test_loss: 0.9119, test_f1: 0.5892
 epoch: 78, train_loss: 0.5851, test_loss: 0.9106, test_f1: 0.5899
 epoch: 79, train_loss: 0.5880, test_loss: 0.9211, test_f1: 0.6000
 epoch: 80, train_loss: 0.5873, test_loss: 0.9089, test_f1: 0.6033
 epoch: 81, train_loss: 0.5852, test_loss: 0.9222, test_f1: 0.5964
 epoch: 82, train_loss: 0.5748, test_loss: 0.9109, test_f1: 0.6102
 epoch: 83, train_loss: 0.5749, test_loss: 0.9279, test_f1: 0.6145
 epoch: 84, train_loss: 0.5886, test_loss: 0.9115, test_f1: 0.6031
 epoch: 85, train_loss: 0.5732, test_loss: 0.9449, test_f1: 0.6144
 epoch: 86, train_loss: 0.5683, test_loss: 0.9056, test_f1: 0.6205
 epoch: 87, train_loss: 0.5789, test_loss: 0.9168, test_f1: 0.6196
 epoch: 88, train_loss: 0.5676, test_loss: 0.9190, test_f1: 0.6104
 epoch: 89, train_loss: 0.5627, test_loss: 0.9439, test_f1: 0.6138
 epoch: 90, train_loss: 0.5657, test_loss: 0.9165, test_f1: 0.6185
 epoch: 91, train_loss: 0.5700, test_loss: 0.9345, test_f1: 0.6166
 epoch: 92, train_loss: 0.5598, test_loss: 0.9467, test_f1: 0.6108
 epoch: 93, train_loss: 0.5583, test_loss: 0.9244, test_f1: 0.6152
 epoch: 94, train_loss: 0.5611, test_loss: 0.9168, test_f1: 0.6285
 epoch: 95, train_loss: 0.5499, test_loss: 0.9355, test_f1: 0.6203
 epoch: 96, train_loss: 0.5552, test_loss: 0.9267, test_f1: 0.6211
 epoch: 97, train_loss: 0.5653, test_loss: 0.9175, test_f1: 0.6325
 epoch: 98, train_loss: 0.5450, test_loss: 0.9304, test_f1: 0.6225
 epoch: 99, train_loss: 0.5434, test_loss: 0.9624, test_f1: 0.6333
##################ITERATION #8 ****************************************
 epoch: 0, train_loss: 1.2527, test_loss: 1.2964, test_f1: 0.2270
 epoch: 1, train_loss: 1.0886, test_loss: 1.2651, test_f1: 0.2270
 epoch: 2, train_loss: 1.0370, test_loss: 1.2008, test_f1: 0.2368
 epoch: 3, train_loss: 1.0161, test_loss: 1.1239, test_f1: 0.3219
 epoch: 4, train_loss: 0.9919, test_loss: 1.0230, test_f1: 0.4474
 epoch: 5, train_loss: 0.9777, test_loss: 0.9835, test_f1: 0.4974
 epoch: 6, train_loss: 0.9567, test_loss: 0.9671, test_f1: 0.5163
 epoch: 7, train_loss: 0.9415, test_loss: 0.9571, test_f1: 0.5125
 epoch: 8, train_loss: 0.9442, test_loss: 0.9475, test_f1: 0.5169
 epoch: 9, train_loss: 0.9222, test_loss: 0.9536, test_f1: 0.5164
 epoch: 10, train_loss: 0.9085, test_loss: 0.9390, test_f1: 0.5221
 epoch: 11, train_loss: 0.9043, test_loss: 0.9270, test_f1: 0.5132
 epoch: 12, train_loss: 0.9035, test_loss: 0.9256, test_f1: 0.5255
 epoch: 13, train_loss: 0.8908, test_loss: 0.9174, test_f1: 0.5326
 epoch: 14, train_loss: 0.8726, test_loss: 0.9232, test_f1: 0.5353
 epoch: 15, train_loss: 0.8688, test_loss: 0.9114, test_f1: 0.5283
 epoch: 16, train_loss: 0.8592, test_loss: 0.9008, test_f1: 0.5438
 epoch: 17, train_loss: 0.8534, test_loss: 0.8961, test_f1: 0.5441
 epoch: 18, train_loss: 0.8531, test_loss: 0.8854, test_f1: 0.5513
 epoch: 19, train_loss: 0.8367, test_loss: 0.8796, test_f1: 0.5532
 epoch: 20, train_loss: 0.8274, test_loss: 0.8782, test_f1: 0.5414
 epoch: 21, train_loss: 0.8203, test_loss: 0.8747, test_f1: 0.5640
 epoch: 22, train_loss: 0.8209, test_loss: 0.8651, test_f1: 0.5521
 epoch: 23, train_loss: 0.8135, test_loss: 0.8600, test_f1: 0.5525
 epoch: 24, train_loss: 0.7974, test_loss: 0.8667, test_f1: 0.5605
 epoch: 25, train_loss: 0.7859, test_loss: 0.8733, test_f1: 0.5619
 epoch: 26, train_loss: 0.7781, test_loss: 0.8764, test_f1: 0.5542
 epoch: 27, train_loss: 0.7748, test_loss: 0.8701, test_f1: 0.5521
 epoch: 28, train_loss: 0.7721, test_loss: 0.8514, test_f1: 0.5583
 epoch: 29, train_loss: 0.7726, test_loss: 0.8535, test_f1: 0.5653
 epoch: 30, train_loss: 0.7546, test_loss: 0.8571, test_f1: 0.5631
 epoch: 31, train_loss: 0.7673, test_loss: 0.8708, test_f1: 0.5775
 epoch: 32, train_loss: 0.7465, test_loss: 0.8775, test_f1: 0.5605
 epoch: 33, train_loss: 0.7517, test_loss: 0.8476, test_f1: 0.5767
 epoch: 34, train_loss: 0.7453, test_loss: 0.8494, test_f1: 0.5674
 epoch: 35, train_loss: 0.7300, test_loss: 0.8531, test_f1: 0.5770
 epoch: 36, train_loss: 0.7309, test_loss: 0.8514, test_f1: 0.5805
 epoch: 37, train_loss: 0.7285, test_loss: 0.8609, test_f1: 0.5762
 epoch: 38, train_loss: 0.7234, test_loss: 0.8276, test_f1: 0.5847
 epoch: 39, train_loss: 0.7132, test_loss: 0.8566, test_f1: 0.5740
 epoch: 40, train_loss: 0.7053, test_loss: 0.8434, test_f1: 0.5805
 epoch: 41, train_loss: 0.6989, test_loss: 0.8404, test_f1: 0.5884
 epoch: 42, train_loss: 0.6973, test_loss: 0.8386, test_f1: 0.5860
 epoch: 43, train_loss: 0.7002, test_loss: 0.8618, test_f1: 0.5708
 epoch: 44, train_loss: 0.6790, test_loss: 0.8434, test_f1: 0.5850
 epoch: 45, train_loss: 0.6791, test_loss: 0.8589, test_f1: 0.5924
 epoch: 46, train_loss: 0.6741, test_loss: 0.8362, test_f1: 0.5897
 epoch: 47, train_loss: 0.6658, test_loss: 0.8441, test_f1: 0.5864
 epoch: 48, train_loss: 0.6678, test_loss: 0.8620, test_f1: 0.5981
 epoch: 49, train_loss: 0.6608, test_loss: 0.8751, test_f1: 0.5708
 epoch: 50, train_loss: 0.6675, test_loss: 0.8574, test_f1: 0.5921
 epoch: 51, train_loss: 0.6518, test_loss: 0.8412, test_f1: 0.5952
 epoch: 52, train_loss: 0.6500, test_loss: 0.8510, test_f1: 0.5820
 epoch: 53, train_loss: 0.6473, test_loss: 0.8588, test_f1: 0.5887
 epoch: 54, train_loss: 0.6468, test_loss: 0.8435, test_f1: 0.5973
 epoch: 55, train_loss: 0.6355, test_loss: 0.8627, test_f1: 0.5828
 epoch: 56, train_loss: 0.6470, test_loss: 0.8491, test_f1: 0.5828
 epoch: 57, train_loss: 0.6302, test_loss: 0.8624, test_f1: 0.6023
 epoch: 58, train_loss: 0.6401, test_loss: 0.8593, test_f1: 0.5872
 epoch: 59, train_loss: 0.6283, test_loss: 0.8630, test_f1: 0.5782
 epoch: 60, train_loss: 0.6281, test_loss: 0.8649, test_f1: 0.5980
 epoch: 61, train_loss: 0.6269, test_loss: 0.8542, test_f1: 0.6047
 epoch: 62, train_loss: 0.6330, test_loss: 0.8721, test_f1: 0.6102
 epoch: 63, train_loss: 0.6188, test_loss: 0.8913, test_f1: 0.5893
 epoch: 64, train_loss: 0.6169, test_loss: 0.8632, test_f1: 0.6116
 epoch: 65, train_loss: 0.6063, test_loss: 0.8526, test_f1: 0.6108
 epoch: 66, train_loss: 0.6193, test_loss: 0.8681, test_f1: 0.6017
 epoch: 67, train_loss: 0.6119, test_loss: 0.8739, test_f1: 0.5982
 epoch: 68, train_loss: 0.6129, test_loss: 0.8854, test_f1: 0.5930
 epoch: 69, train_loss: 0.6017, test_loss: 0.8587, test_f1: 0.6265
 epoch: 70, train_loss: 0.6179, test_loss: 0.8720, test_f1: 0.6136
 epoch: 71, train_loss: 0.6079, test_loss: 0.8788, test_f1: 0.6234
 epoch: 72, train_loss: 0.5940, test_loss: 0.8694, test_f1: 0.6075
 epoch: 73, train_loss: 0.5967, test_loss: 0.8460, test_f1: 0.6314
 epoch: 74, train_loss: 0.5888, test_loss: 0.8840, test_f1: 0.6246
 epoch: 75, train_loss: 0.6017, test_loss: 0.8761, test_f1: 0.6327
 epoch: 76, train_loss: 0.5873, test_loss: 0.9033, test_f1: 0.6179
 epoch: 77, train_loss: 0.5870, test_loss: 0.8938, test_f1: 0.6157
 epoch: 78, train_loss: 0.5849, test_loss: 0.9161, test_f1: 0.6141
 epoch: 79, train_loss: 0.5879, test_loss: 0.8959, test_f1: 0.6305
 epoch: 80, train_loss: 0.5839, test_loss: 0.9046, test_f1: 0.6058
 epoch: 81, train_loss: 0.5676, test_loss: 0.9124, test_f1: 0.6315
 epoch: 82, train_loss: 0.5681, test_loss: 0.9038, test_f1: 0.6266
 epoch: 83, train_loss: 0.5678, test_loss: 0.9369, test_f1: 0.6016
 epoch: 84, train_loss: 0.5881, test_loss: 0.9173, test_f1: 0.6389
 epoch: 85, train_loss: 0.5716, test_loss: 0.8926, test_f1: 0.6359
 epoch: 86, train_loss: 0.5777, test_loss: 0.9241, test_f1: 0.6293
 epoch: 87, train_loss: 0.5702, test_loss: 0.9221, test_f1: 0.6277
 epoch: 88, train_loss: 0.5670, test_loss: 0.9233, test_f1: 0.6165
 epoch: 89, train_loss: 0.5636, test_loss: 0.9294, test_f1: 0.6204
 epoch: 90, train_loss: 0.5590, test_loss: 0.9070, test_f1: 0.6306
 epoch: 91, train_loss: 0.5562, test_loss: 0.9334, test_f1: 0.6318
 epoch: 92, train_loss: 0.5680, test_loss: 0.9149, test_f1: 0.6354
 epoch: 93, train_loss: 0.5552, test_loss: 0.9196, test_f1: 0.6296
 epoch: 94, train_loss: 0.5582, test_loss: 0.9243, test_f1: 0.6317
 epoch: 95, train_loss: 0.5460, test_loss: 0.9345, test_f1: 0.6147
 epoch: 96, train_loss: 0.5516, test_loss: 0.9592, test_f1: 0.6231
 epoch: 97, train_loss: 0.5498, test_loss: 0.9525, test_f1: 0.6249
 epoch: 98, train_loss: 0.5502, test_loss: 0.9137, test_f1: 0.6387
 epoch: 99, train_loss: 0.5418, test_loss: 0.9435, test_f1: 0.6133
##################ITERATION #9 ****************************************
 epoch: 0, train_loss: 1.2664, test_loss: 1.2903, test_f1: 0.2270
 epoch: 1, train_loss: 1.0874, test_loss: 1.2453, test_f1: 0.2270
 epoch: 2, train_loss: 1.0606, test_loss: 1.1691, test_f1: 0.2867
 epoch: 3, train_loss: 1.0247, test_loss: 1.0564, test_f1: 0.4522
 epoch: 4, train_loss: 0.9880, test_loss: 1.0008, test_f1: 0.4866
 epoch: 5, train_loss: 0.9851, test_loss: 0.9602, test_f1: 0.5263
 epoch: 6, train_loss: 0.9719, test_loss: 0.9338, test_f1: 0.5340
 epoch: 7, train_loss: 0.9428, test_loss: 0.9153, test_f1: 0.5201
 epoch: 8, train_loss: 0.9355, test_loss: 0.9078, test_f1: 0.5330
 epoch: 9, train_loss: 0.9259, test_loss: 0.8941, test_f1: 0.5387
 epoch: 10, train_loss: 0.9107, test_loss: 0.8933, test_f1: 0.5243
 epoch: 11, train_loss: 0.9076, test_loss: 0.8758, test_f1: 0.5226
 epoch: 12, train_loss: 0.9014, test_loss: 0.8722, test_f1: 0.5412
 epoch: 13, train_loss: 0.8838, test_loss: 0.8683, test_f1: 0.5420
 epoch: 14, train_loss: 0.8691, test_loss: 0.8620, test_f1: 0.5435
 epoch: 15, train_loss: 0.8584, test_loss: 0.8511, test_f1: 0.5438
 epoch: 16, train_loss: 0.8544, test_loss: 0.8366, test_f1: 0.5582
 epoch: 17, train_loss: 0.8500, test_loss: 0.8417, test_f1: 0.5546
 epoch: 18, train_loss: 0.8328, test_loss: 0.8351, test_f1: 0.5628
 epoch: 19, train_loss: 0.8307, test_loss: 0.8492, test_f1: 0.5607
 epoch: 20, train_loss: 0.8291, test_loss: 0.8306, test_f1: 0.5558
 epoch: 21, train_loss: 0.8157, test_loss: 0.8164, test_f1: 0.5526
 epoch: 22, train_loss: 0.8142, test_loss: 0.8349, test_f1: 0.5431
 epoch: 23, train_loss: 0.8035, test_loss: 0.7994, test_f1: 0.5712
 epoch: 24, train_loss: 0.7981, test_loss: 0.8077, test_f1: 0.5695
 epoch: 25, train_loss: 0.7869, test_loss: 0.7990, test_f1: 0.5732
 epoch: 26, train_loss: 0.7771, test_loss: 0.8079, test_f1: 0.5692
 epoch: 27, train_loss: 0.7745, test_loss: 0.7943, test_f1: 0.5748
 epoch: 28, train_loss: 0.7698, test_loss: 0.7908, test_f1: 0.5685
 epoch: 29, train_loss: 0.7552, test_loss: 0.7935, test_f1: 0.5873
 epoch: 30, train_loss: 0.7632, test_loss: 0.7930, test_f1: 0.5928
 epoch: 31, train_loss: 0.7526, test_loss: 0.7984, test_f1: 0.5777
 epoch: 32, train_loss: 0.7556, test_loss: 0.8059, test_f1: 0.5760
 epoch: 33, train_loss: 0.7448, test_loss: 0.7718, test_f1: 0.5911
 epoch: 34, train_loss: 0.7268, test_loss: 0.7809, test_f1: 0.5937
 epoch: 35, train_loss: 0.7388, test_loss: 0.8013, test_f1: 0.5877
 epoch: 36, train_loss: 0.7277, test_loss: 0.7746, test_f1: 0.6123
 epoch: 37, train_loss: 0.7206, test_loss: 0.7751, test_f1: 0.5936
 epoch: 38, train_loss: 0.7106, test_loss: 0.7829, test_f1: 0.6142
 epoch: 39, train_loss: 0.7183, test_loss: 0.7663, test_f1: 0.6176
 epoch: 40, train_loss: 0.7073, test_loss: 0.8049, test_f1: 0.6055
 epoch: 41, train_loss: 0.7141, test_loss: 0.7853, test_f1: 0.6006
 epoch: 42, train_loss: 0.6891, test_loss: 0.7640, test_f1: 0.6243
 epoch: 43, train_loss: 0.6950, test_loss: 0.7685, test_f1: 0.6204
 epoch: 44, train_loss: 0.6849, test_loss: 0.7584, test_f1: 0.6377
 epoch: 45, train_loss: 0.6867, test_loss: 0.8065, test_f1: 0.6395
 epoch: 46, train_loss: 0.6753, test_loss: 0.7834, test_f1: 0.6263
 epoch: 47, train_loss: 0.6703, test_loss: 0.7930, test_f1: 0.6214
 epoch: 48, train_loss: 0.6721, test_loss: 0.7772, test_f1: 0.6254
 epoch: 49, train_loss: 0.6655, test_loss: 0.7845, test_f1: 0.6279
 epoch: 50, train_loss: 0.6563, test_loss: 0.8104, test_f1: 0.6430
 epoch: 51, train_loss: 0.6496, test_loss: 0.7724, test_f1: 0.6447
 epoch: 52, train_loss: 0.6468, test_loss: 0.7746, test_f1: 0.6414
 epoch: 53, train_loss: 0.6429, test_loss: 0.7658, test_f1: 0.6425
 epoch: 54, train_loss: 0.6376, test_loss: 0.7800, test_f1: 0.6456
 epoch: 55, train_loss: 0.6418, test_loss: 0.7659, test_f1: 0.6529
 epoch: 56, train_loss: 0.6291, test_loss: 0.7766, test_f1: 0.6471
 epoch: 57, train_loss: 0.6422, test_loss: 0.7683, test_f1: 0.6470
 epoch: 58, train_loss: 0.6346, test_loss: 0.7791, test_f1: 0.6561
 epoch: 59, train_loss: 0.6259, test_loss: 0.7738, test_f1: 0.6372
 epoch: 60, train_loss: 0.6240, test_loss: 0.7865, test_f1: 0.6372
 epoch: 61, train_loss: 0.6271, test_loss: 0.7963, test_f1: 0.6464
 epoch: 62, train_loss: 0.6300, test_loss: 0.7705, test_f1: 0.6384
 epoch: 63, train_loss: 0.6292, test_loss: 0.7904, test_f1: 0.6504
 epoch: 64, train_loss: 0.6136, test_loss: 0.7934, test_f1: 0.6532
 epoch: 65, train_loss: 0.6113, test_loss: 0.7820, test_f1: 0.6566
 epoch: 66, train_loss: 0.6042, test_loss: 0.7770, test_f1: 0.6542
 epoch: 67, train_loss: 0.6036, test_loss: 0.7858, test_f1: 0.6470
 epoch: 68, train_loss: 0.6002, test_loss: 0.7847, test_f1: 0.6595
 epoch: 69, train_loss: 0.6007, test_loss: 0.7765, test_f1: 0.6503
 epoch: 70, train_loss: 0.6007, test_loss: 0.7813, test_f1: 0.6596
 epoch: 71, train_loss: 0.5939, test_loss: 0.8047, test_f1: 0.6383
 epoch: 72, train_loss: 0.6045, test_loss: 0.7778, test_f1: 0.6504
 epoch: 73, train_loss: 0.6042, test_loss: 0.7919, test_f1: 0.6329
 epoch: 74, train_loss: 0.6055, test_loss: 0.7939, test_f1: 0.6337
 epoch: 75, train_loss: 0.5931, test_loss: 0.7988, test_f1: 0.6536
 epoch: 76, train_loss: 0.5873, test_loss: 0.7940, test_f1: 0.6510
 epoch: 77, train_loss: 0.5887, test_loss: 0.7922, test_f1: 0.6552
 epoch: 78, train_loss: 0.5922, test_loss: 0.7851, test_f1: 0.6515
 epoch: 79, train_loss: 0.5834, test_loss: 0.8158, test_f1: 0.6547
 epoch: 80, train_loss: 0.5884, test_loss: 0.7969, test_f1: 0.6447
 epoch: 81, train_loss: 0.5833, test_loss: 0.7943, test_f1: 0.6590
 epoch: 82, train_loss: 0.5866, test_loss: 0.8142, test_f1: 0.6526
 epoch: 83, train_loss: 0.5735, test_loss: 0.8287, test_f1: 0.6527
 epoch: 84, train_loss: 0.5858, test_loss: 0.8233, test_f1: 0.6321
 epoch: 85, train_loss: 0.5816, test_loss: 0.8170, test_f1: 0.6279
 epoch: 86, train_loss: 0.5691, test_loss: 0.8352, test_f1: 0.6445
 epoch: 87, train_loss: 0.5709, test_loss: 0.8371, test_f1: 0.6275
 epoch: 88, train_loss: 0.5762, test_loss: 0.8107, test_f1: 0.6517
 epoch: 89, train_loss: 0.5650, test_loss: 0.8099, test_f1: 0.6553
 epoch: 90, train_loss: 0.5572, test_loss: 0.8458, test_f1: 0.6444
 epoch: 91, train_loss: 0.5575, test_loss: 0.8196, test_f1: 0.6337
 epoch: 92, train_loss: 0.5663, test_loss: 0.8316, test_f1: 0.6435
 epoch: 93, train_loss: 0.5649, test_loss: 0.8492, test_f1: 0.6117
 epoch: 94, train_loss: 0.5595, test_loss: 0.8400, test_f1: 0.6437
 epoch: 95, train_loss: 0.5579, test_loss: 0.8537, test_f1: 0.6222
 epoch: 96, train_loss: 0.5566, test_loss: 0.8455, test_f1: 0.6480
 epoch: 97, train_loss: 0.5529, test_loss: 0.8554, test_f1: 0.6363
 epoch: 98, train_loss: 0.5539, test_loss: 0.8456, test_f1: 0.6260
 epoch: 99, train_loss: 0.5473, test_loss: 0.8496, test_f1: 0.6338

Training completed in 697.10 seconds
Best F1: 0.6741 at epoch 97
Mean F1 across iterations: 0.6320  0.0288
========================FINAL RESULTS================================
FEGIN weighted F1: 0.6741  0.0288
python main.py --data ltspice_examples --representation component_pin_net --model FEGIN --layers 3 --hiddens 128 --batch_size 256 --lr 0.0001 --emb_size 128 --epochs 100 --save_appendix component_pin_net_L3_H128_BS256_LR0.0001_E128 --no_val
-----



STDERR:
  File "main.py", line 370, in <module>
    main()
  File "main.py", line 254, in main
    dataset = dataset_class(
  File "/home/philip/projects/ltspice_examples_code_repo/Circuit-Completion-Using-GNNs/component_classification_with_link_prediction_head/evaluation/FEGIN/kernel/circuit_datasets.py", line 15, in __init__
    self.data, self.slices = torch.load(self.processed_paths[0])
  File "/home/philip/.local/lib/python3.8/site-packages/torch/serialization.py", line 1040, in load
    warnings.warn(
  File "/usr/lib/python3.8/warnings.py", line 109, in _showwarnmsg
    sw(msg.message, msg.category, msg.filename, msg.lineno,
  File "main.py", line 47, in warn_with_traceback
    traceback.print_stack(file=log)
/home/philip/projects/ltspice_examples_code_repo/Circuit-Completion-Using-GNNs/component_classification_with_link_prediction_head/evaluation/FEGIN/kernel/circuit_datasets.py:15: FutureWarning: You are using `torch.load` with `weights_only=False` (the current default value), which uses the default pickle module implicitly. It is possible to construct malicious pickle data which will execute arbitrary code during unpickling (See https://github.com/pytorch/pytorch/blob/main/SECURITY.md#untrusted-models for more details). In a future release, the default value for `weights_only` will be flipped to `True`. This limits the functions that could be executed during unpickling. Arbitrary objects will no longer be allowed to be loaded via this mode unless they are explicitly allowlisted by the user via `torch.serialization.add_safe_globals`. We recommend you start setting `weights_only=True` for any use case where you don't have full control of the loaded file. Please open an issue on GitHub for any issues related to this experimental feature.
  self.data, self.slices = torch.load(self.processed_paths[0])
