STDOUT:
Results will be saved in /home/philip/projects/ltspice_examples_code_repo/Circuit-Completion-Using-GNNs/component_classification_with_link_prediction_head/evaluation/FEGIN/results/model_FEGIN_dataset_ltspice_examples
Command line input: python main.py --data ltspice_examples --representation component_component --model FEGIN --layers 4 --hiddens 16 --batch_size 128 --lr 0.001 --emb_size 250 --epochs 100 --save_appendix component_component_L4_H16_BS128_LR0.001_E250 --no_val
 is saved.
-----
ltspice_examples - FEGIN
Using 4 layers, 16 hidden units, h = 2
Loading component_component representation dataset
ENTERED
Training FEGIN on component_component representation
Train: 3556, Test: 845
##################ITERATION #0 ****************************************
 epoch: 0, train_loss: 1.3474, test_loss: 1.3455, test_f1: 0.2274
 epoch: 1, train_loss: 1.3261, test_loss: 1.3281, test_f1: 0.2274
 epoch: 2, train_loss: 1.3079, test_loss: 1.3080, test_f1: 0.2274
 epoch: 3, train_loss: 1.2875, test_loss: 1.2835, test_f1: 0.2274
 epoch: 4, train_loss: 1.2691, test_loss: 1.2537, test_f1: 0.2274
 epoch: 5, train_loss: 1.2548, test_loss: 1.2311, test_f1: 0.2274
 epoch: 6, train_loss: 1.2424, test_loss: 1.2212, test_f1: 0.2274
 epoch: 7, train_loss: 1.2366, test_loss: 1.2162, test_f1: 0.2350
 epoch: 8, train_loss: 1.2236, test_loss: 1.2072, test_f1: 0.3162
 epoch: 9, train_loss: 1.2198, test_loss: 1.1952, test_f1: 0.3224
 epoch: 10, train_loss: 1.2129, test_loss: 1.1907, test_f1: 0.3500
 epoch: 11, train_loss: 1.1989, test_loss: 1.1742, test_f1: 0.3461
 epoch: 12, train_loss: 1.1942, test_loss: 1.1661, test_f1: 0.3410
 epoch: 13, train_loss: 1.1813, test_loss: 1.1592, test_f1: 0.3804
 epoch: 14, train_loss: 1.1771, test_loss: 1.1647, test_f1: 0.4111
 epoch: 15, train_loss: 1.1641, test_loss: 1.1453, test_f1: 0.4164
 epoch: 16, train_loss: 1.1606, test_loss: 1.1648, test_f1: 0.4383
 epoch: 17, train_loss: 1.1527, test_loss: 1.1352, test_f1: 0.4361
 epoch: 18, train_loss: 1.1423, test_loss: 1.1616, test_f1: 0.4234
 epoch: 19, train_loss: 1.1336, test_loss: 1.1194, test_f1: 0.4285
 epoch: 20, train_loss: 1.1212, test_loss: 1.1100, test_f1: 0.4502
 epoch: 21, train_loss: 1.1158, test_loss: 1.1118, test_f1: 0.4237
 epoch: 22, train_loss: 1.1093, test_loss: 1.1066, test_f1: 0.4355
 epoch: 23, train_loss: 1.0976, test_loss: 1.1029, test_f1: 0.4319
 epoch: 24, train_loss: 1.0944, test_loss: 1.1536, test_f1: 0.4047
 epoch: 25, train_loss: 1.0947, test_loss: 1.1141, test_f1: 0.4174
 epoch: 26, train_loss: 1.0815, test_loss: 1.0674, test_f1: 0.4320
 epoch: 27, train_loss: 1.0786, test_loss: 1.0712, test_f1: 0.4311
 epoch: 28, train_loss: 1.0674, test_loss: 1.0493, test_f1: 0.4368
 epoch: 29, train_loss: 1.0562, test_loss: 1.0489, test_f1: 0.4415
 epoch: 30, train_loss: 1.0528, test_loss: 1.0336, test_f1: 0.4331
 epoch: 31, train_loss: 1.0454, test_loss: 1.0329, test_f1: 0.4328
 epoch: 32, train_loss: 1.0531, test_loss: 1.0572, test_f1: 0.4444
 epoch: 33, train_loss: 1.0282, test_loss: 1.0448, test_f1: 0.4317
 epoch: 34, train_loss: 1.0348, test_loss: 1.0497, test_f1: 0.4324
 epoch: 35, train_loss: 1.0233, test_loss: 1.0414, test_f1: 0.4453
 epoch: 36, train_loss: 1.0241, test_loss: 1.0287, test_f1: 0.4682
 epoch: 37, train_loss: 1.0183, test_loss: 1.0078, test_f1: 0.4526
 epoch: 38, train_loss: 1.0037, test_loss: 0.9963, test_f1: 0.4586
 epoch: 39, train_loss: 1.0028, test_loss: 1.0415, test_f1: 0.4585
 epoch: 40, train_loss: 0.9959, test_loss: 1.0092, test_f1: 0.4638
 epoch: 41, train_loss: 0.9913, test_loss: 1.0170, test_f1: 0.4626
 epoch: 42, train_loss: 0.9929, test_loss: 1.0126, test_f1: 0.4613
 epoch: 43, train_loss: 0.9854, test_loss: 0.9854, test_f1: 0.4960
 epoch: 44, train_loss: 0.9759, test_loss: 1.0191, test_f1: 0.4734
 epoch: 45, train_loss: 0.9736, test_loss: 1.0072, test_f1: 0.4622
 epoch: 46, train_loss: 0.9748, test_loss: 1.0065, test_f1: 0.4856
 epoch: 47, train_loss: 0.9678, test_loss: 0.9954, test_f1: 0.4740
 epoch: 48, train_loss: 0.9657, test_loss: 0.9765, test_f1: 0.4823
 epoch: 49, train_loss: 0.9590, test_loss: 0.9895, test_f1: 0.4906
 epoch: 50, train_loss: 0.9469, test_loss: 0.9725, test_f1: 0.4773
 epoch: 51, train_loss: 0.9421, test_loss: 0.9904, test_f1: 0.4726
 epoch: 52, train_loss: 0.9423, test_loss: 0.9635, test_f1: 0.5102
 epoch: 53, train_loss: 0.9290, test_loss: 0.9840, test_f1: 0.5092
 epoch: 54, train_loss: 0.9343, test_loss: 0.9790, test_f1: 0.4843
 epoch: 55, train_loss: 0.9293, test_loss: 0.9904, test_f1: 0.4843
 epoch: 56, train_loss: 0.9202, test_loss: 0.9621, test_f1: 0.5032
 epoch: 57, train_loss: 0.9221, test_loss: 0.9775, test_f1: 0.4852
 epoch: 58, train_loss: 0.9213, test_loss: 1.0037, test_f1: 0.4798
 epoch: 59, train_loss: 0.9197, test_loss: 0.9814, test_f1: 0.4849
 epoch: 60, train_loss: 0.9225, test_loss: 0.9587, test_f1: 0.5007
 epoch: 61, train_loss: 0.9114, test_loss: 0.9582, test_f1: 0.4904
 epoch: 62, train_loss: 0.9119, test_loss: 0.9631, test_f1: 0.4946
 epoch: 63, train_loss: 0.9111, test_loss: 0.9650, test_f1: 0.4917
 epoch: 64, train_loss: 0.9077, test_loss: 0.9642, test_f1: 0.4736
 epoch: 65, train_loss: 0.9004, test_loss: 0.9667, test_f1: 0.4997
 epoch: 66, train_loss: 0.9100, test_loss: 0.9608, test_f1: 0.4988
 epoch: 67, train_loss: 0.8979, test_loss: 1.0200, test_f1: 0.4751
 epoch: 68, train_loss: 0.9063, test_loss: 0.9674, test_f1: 0.5028
 epoch: 69, train_loss: 0.8973, test_loss: 0.9719, test_f1: 0.4824
 epoch: 70, train_loss: 0.8928, test_loss: 0.9783, test_f1: 0.4856
 epoch: 71, train_loss: 0.9022, test_loss: 0.9671, test_f1: 0.4915
 epoch: 72, train_loss: 0.9016, test_loss: 0.9794, test_f1: 0.4904
 epoch: 73, train_loss: 0.8894, test_loss: 0.9584, test_f1: 0.5153
 epoch: 74, train_loss: 0.9066, test_loss: 0.9553, test_f1: 0.5123
 epoch: 75, train_loss: 0.8937, test_loss: 0.9619, test_f1: 0.4941
 epoch: 76, train_loss: 0.8927, test_loss: 0.9681, test_f1: 0.4998
 epoch: 77, train_loss: 0.8885, test_loss: 0.9545, test_f1: 0.5112
 epoch: 78, train_loss: 0.8802, test_loss: 0.9401, test_f1: 0.5138
 epoch: 79, train_loss: 0.8778, test_loss: 0.9614, test_f1: 0.4838
 epoch: 80, train_loss: 0.8926, test_loss: 0.9764, test_f1: 0.4958
 epoch: 81, train_loss: 0.8814, test_loss: 0.9745, test_f1: 0.4732
 epoch: 82, train_loss: 0.8845, test_loss: 0.9550, test_f1: 0.5080
 epoch: 83, train_loss: 0.8883, test_loss: 0.9416, test_f1: 0.5024
 epoch: 84, train_loss: 0.8840, test_loss: 0.9349, test_f1: 0.5039
 epoch: 85, train_loss: 0.8715, test_loss: 1.0020, test_f1: 0.4683
 epoch: 86, train_loss: 0.8790, test_loss: 0.9699, test_f1: 0.4932
 epoch: 87, train_loss: 0.8722, test_loss: 0.9355, test_f1: 0.5130
 epoch: 88, train_loss: 0.8761, test_loss: 0.9950, test_f1: 0.4902
 epoch: 89, train_loss: 0.8612, test_loss: 0.9638, test_f1: 0.5040
 epoch: 90, train_loss: 0.8785, test_loss: 0.9762, test_f1: 0.5017
 epoch: 91, train_loss: 0.8829, test_loss: 0.9757, test_f1: 0.4865
 epoch: 92, train_loss: 0.8741, test_loss: 0.9984, test_f1: 0.4877
 epoch: 93, train_loss: 0.8716, test_loss: 0.9696, test_f1: 0.5062
 epoch: 94, train_loss: 0.8615, test_loss: 0.9537, test_f1: 0.4966
 epoch: 95, train_loss: 0.8655, test_loss: 0.9572, test_f1: 0.5013
 epoch: 96, train_loss: 0.8667, test_loss: 0.9505, test_f1: 0.4901
 epoch: 97, train_loss: 0.8714, test_loss: 0.9520, test_f1: 0.5210
 epoch: 98, train_loss: 0.8789, test_loss: 0.9472, test_f1: 0.5278
 epoch: 99, train_loss: 0.8600, test_loss: 0.9710, test_f1: 0.5081
##################ITERATION #1 ****************************************
 epoch: 0, train_loss: 1.3652, test_loss: 1.3168, test_f1: 0.2274
 epoch: 1, train_loss: 1.2838, test_loss: 1.2831, test_f1: 0.2266
 epoch: 2, train_loss: 1.2659, test_loss: 1.2558, test_f1: 0.2390
 epoch: 3, train_loss: 1.2490, test_loss: 1.2279, test_f1: 0.2464
 epoch: 4, train_loss: 1.2321, test_loss: 1.1972, test_f1: 0.3297
 epoch: 5, train_loss: 1.2125, test_loss: 1.1658, test_f1: 0.4190
 epoch: 6, train_loss: 1.1843, test_loss: 1.1617, test_f1: 0.4197
 epoch: 7, train_loss: 1.1714, test_loss: 1.1069, test_f1: 0.4600
 epoch: 8, train_loss: 1.1501, test_loss: 1.0939, test_f1: 0.4639
 epoch: 9, train_loss: 1.1310, test_loss: 1.0713, test_f1: 0.4562
 epoch: 10, train_loss: 1.1157, test_loss: 1.0551, test_f1: 0.4725
 epoch: 11, train_loss: 1.1072, test_loss: 1.0421, test_f1: 0.4751
 epoch: 12, train_loss: 1.0992, test_loss: 1.0254, test_f1: 0.4740
 epoch: 13, train_loss: 1.0843, test_loss: 1.0063, test_f1: 0.4796
 epoch: 14, train_loss: 1.0813, test_loss: 1.0057, test_f1: 0.4719
 epoch: 15, train_loss: 1.0668, test_loss: 1.0219, test_f1: 0.4555
 epoch: 16, train_loss: 1.0607, test_loss: 0.9895, test_f1: 0.4593
 epoch: 17, train_loss: 1.0503, test_loss: 0.9952, test_f1: 0.4699
 epoch: 18, train_loss: 1.0447, test_loss: 0.9691, test_f1: 0.4731
 epoch: 19, train_loss: 1.0300, test_loss: 0.9962, test_f1: 0.4437
 epoch: 20, train_loss: 1.0166, test_loss: 0.9850, test_f1: 0.4712
 epoch: 21, train_loss: 1.0233, test_loss: 0.9993, test_f1: 0.4416
 epoch: 22, train_loss: 1.0109, test_loss: 1.0043, test_f1: 0.4702
 epoch: 23, train_loss: 1.0040, test_loss: 1.0217, test_f1: 0.4600
 epoch: 24, train_loss: 0.9953, test_loss: 0.9985, test_f1: 0.4560
 epoch: 25, train_loss: 0.9921, test_loss: 1.0033, test_f1: 0.4750
 epoch: 26, train_loss: 0.9874, test_loss: 1.0272, test_f1: 0.4569
 epoch: 27, train_loss: 0.9985, test_loss: 1.0018, test_f1: 0.4571
 epoch: 28, train_loss: 0.9833, test_loss: 1.0197, test_f1: 0.4660
 epoch: 29, train_loss: 0.9780, test_loss: 0.9851, test_f1: 0.4948
 epoch: 30, train_loss: 0.9826, test_loss: 1.0381, test_f1: 0.4663
 epoch: 31, train_loss: 0.9630, test_loss: 0.9861, test_f1: 0.4636
 epoch: 32, train_loss: 0.9537, test_loss: 1.0277, test_f1: 0.4747
 epoch: 33, train_loss: 0.9510, test_loss: 1.0113, test_f1: 0.4639
 epoch: 34, train_loss: 0.9540, test_loss: 1.0520, test_f1: 0.4969
 epoch: 35, train_loss: 0.9447, test_loss: 1.0067, test_f1: 0.4669
 epoch: 36, train_loss: 0.9456, test_loss: 1.0428, test_f1: 0.4640
 epoch: 37, train_loss: 0.9458, test_loss: 1.0503, test_f1: 0.4961
 epoch: 38, train_loss: 0.9423, test_loss: 0.9959, test_f1: 0.4809
 epoch: 39, train_loss: 0.9295, test_loss: 1.0261, test_f1: 0.4914
 epoch: 40, train_loss: 0.9296, test_loss: 1.0504, test_f1: 0.4698
 epoch: 41, train_loss: 0.9197, test_loss: 1.0305, test_f1: 0.4929
 epoch: 42, train_loss: 0.9351, test_loss: 1.1115, test_f1: 0.4575
 epoch: 43, train_loss: 0.9367, test_loss: 1.0870, test_f1: 0.4835
 epoch: 44, train_loss: 0.9291, test_loss: 1.0294, test_f1: 0.4672
 epoch: 45, train_loss: 0.9201, test_loss: 1.0497, test_f1: 0.4730
 epoch: 46, train_loss: 0.9143, test_loss: 1.0209, test_f1: 0.4769
 epoch: 47, train_loss: 0.9093, test_loss: 1.0128, test_f1: 0.4667
 epoch: 48, train_loss: 0.9223, test_loss: 1.0388, test_f1: 0.4769
 epoch: 49, train_loss: 0.9084, test_loss: 1.0675, test_f1: 0.4879
 epoch: 50, train_loss: 0.9073, test_loss: 1.1065, test_f1: 0.4596
 epoch: 51, train_loss: 0.8983, test_loss: 1.0584, test_f1: 0.4924
 epoch: 52, train_loss: 0.8944, test_loss: 1.0887, test_f1: 0.4677
 epoch: 53, train_loss: 0.8978, test_loss: 1.0526, test_f1: 0.4811
 epoch: 54, train_loss: 0.8943, test_loss: 1.0585, test_f1: 0.4806
 epoch: 55, train_loss: 0.8912, test_loss: 1.1484, test_f1: 0.4648
 epoch: 56, train_loss: 0.8804, test_loss: 1.0763, test_f1: 0.4871
 epoch: 57, train_loss: 0.8813, test_loss: 1.1675, test_f1: 0.4903
 epoch: 58, train_loss: 0.8801, test_loss: 1.1453, test_f1: 0.4607
 epoch: 59, train_loss: 0.8830, test_loss: 1.1392, test_f1: 0.4596
 epoch: 60, train_loss: 0.8736, test_loss: 1.1289, test_f1: 0.4774
 epoch: 61, train_loss: 0.8895, test_loss: 1.1090, test_f1: 0.4929
 epoch: 62, train_loss: 0.8684, test_loss: 1.1182, test_f1: 0.4819
 epoch: 63, train_loss: 0.8707, test_loss: 1.1122, test_f1: 0.4742
 epoch: 64, train_loss: 0.8845, test_loss: 1.2204, test_f1: 0.4756
 epoch: 65, train_loss: 0.8712, test_loss: 1.1539, test_f1: 0.4703
 epoch: 66, train_loss: 0.8702, test_loss: 1.1317, test_f1: 0.4706
 epoch: 67, train_loss: 0.8701, test_loss: 1.1770, test_f1: 0.4638
 epoch: 68, train_loss: 0.8634, test_loss: 1.1770, test_f1: 0.4754
 epoch: 69, train_loss: 0.8722, test_loss: 1.1429, test_f1: 0.4774
 epoch: 70, train_loss: 0.8668, test_loss: 1.2007, test_f1: 0.4581
 epoch: 71, train_loss: 0.8757, test_loss: 1.1922, test_f1: 0.4725
 epoch: 72, train_loss: 0.8568, test_loss: 1.1877, test_f1: 0.4617
 epoch: 73, train_loss: 0.8632, test_loss: 1.1763, test_f1: 0.4514
 epoch: 74, train_loss: 0.8593, test_loss: 1.1650, test_f1: 0.4758
 epoch: 75, train_loss: 0.8563, test_loss: 1.2254, test_f1: 0.4831
 epoch: 76, train_loss: 0.8515, test_loss: 1.2039, test_f1: 0.4563
 epoch: 77, train_loss: 0.8599, test_loss: 1.2519, test_f1: 0.4550
 epoch: 78, train_loss: 0.8478, test_loss: 1.2305, test_f1: 0.4681
 epoch: 79, train_loss: 0.8376, test_loss: 1.3180, test_f1: 0.4741
 epoch: 80, train_loss: 0.8489, test_loss: 1.3206, test_f1: 0.4521
 epoch: 81, train_loss: 0.8400, test_loss: 1.2973, test_f1: 0.4571
 epoch: 82, train_loss: 0.8436, test_loss: 1.1412, test_f1: 0.4711
 epoch: 83, train_loss: 0.8481, test_loss: 1.2929, test_f1: 0.4664
 epoch: 84, train_loss: 0.8437, test_loss: 1.2008, test_f1: 0.4593
 epoch: 85, train_loss: 0.8502, test_loss: 1.3143, test_f1: 0.4695
 epoch: 86, train_loss: 0.8465, test_loss: 1.2650, test_f1: 0.4707
 epoch: 87, train_loss: 0.8395, test_loss: 1.2620, test_f1: 0.4681
 epoch: 88, train_loss: 0.8419, test_loss: 1.3047, test_f1: 0.4767
 epoch: 89, train_loss: 0.8294, test_loss: 1.3214, test_f1: 0.4497
 epoch: 90, train_loss: 0.8354, test_loss: 1.2652, test_f1: 0.4846
 epoch: 91, train_loss: 0.8568, test_loss: 1.2020, test_f1: 0.4719
 epoch: 92, train_loss: 0.8279, test_loss: 1.2087, test_f1: 0.4775
 epoch: 93, train_loss: 0.8212, test_loss: 1.3174, test_f1: 0.4539
 epoch: 94, train_loss: 0.8292, test_loss: 1.2796, test_f1: 0.4844
 epoch: 95, train_loss: 0.8312, test_loss: 1.2621, test_f1: 0.4862
 epoch: 96, train_loss: 0.8410, test_loss: 1.2405, test_f1: 0.4911
 epoch: 97, train_loss: 0.8394, test_loss: 1.2264, test_f1: 0.4551
 epoch: 98, train_loss: 0.8286, test_loss: 1.2704, test_f1: 0.4827
 epoch: 99, train_loss: 0.8272, test_loss: 1.2576, test_f1: 0.4748
##################ITERATION #2 ****************************************
 epoch: 0, train_loss: 1.3887, test_loss: 1.3191, test_f1: 0.2274
 epoch: 1, train_loss: 1.2885, test_loss: 1.2723, test_f1: 0.2274
 epoch: 2, train_loss: 1.2652, test_loss: 1.2475, test_f1: 0.2555
 epoch: 3, train_loss: 1.2529, test_loss: 1.2348, test_f1: 0.2555
 epoch: 4, train_loss: 1.2412, test_loss: 1.2207, test_f1: 0.2668
 epoch: 5, train_loss: 1.2356, test_loss: 1.2060, test_f1: 0.2786
 epoch: 6, train_loss: 1.2279, test_loss: 1.1985, test_f1: 0.3075
 epoch: 7, train_loss: 1.2168, test_loss: 1.1917, test_f1: 0.3255
 epoch: 8, train_loss: 1.2100, test_loss: 1.1750, test_f1: 0.3552
 epoch: 9, train_loss: 1.1957, test_loss: 1.1658, test_f1: 0.3709
 epoch: 10, train_loss: 1.1918, test_loss: 1.1618, test_f1: 0.3799
 epoch: 11, train_loss: 1.1761, test_loss: 1.1427, test_f1: 0.4051
 epoch: 12, train_loss: 1.1688, test_loss: 1.1323, test_f1: 0.3910
 epoch: 13, train_loss: 1.1531, test_loss: 1.1211, test_f1: 0.4025
 epoch: 14, train_loss: 1.1523, test_loss: 1.1131, test_f1: 0.4203
 epoch: 15, train_loss: 1.1460, test_loss: 1.1096, test_f1: 0.4211
 epoch: 16, train_loss: 1.1423, test_loss: 1.1093, test_f1: 0.4204
 epoch: 17, train_loss: 1.1374, test_loss: 1.0964, test_f1: 0.4277
 epoch: 18, train_loss: 1.1310, test_loss: 1.0881, test_f1: 0.4335
 epoch: 19, train_loss: 1.1208, test_loss: 1.0796, test_f1: 0.4335
 epoch: 20, train_loss: 1.1126, test_loss: 1.0738, test_f1: 0.4431
 epoch: 21, train_loss: 1.1071, test_loss: 1.0692, test_f1: 0.4551
 epoch: 22, train_loss: 1.0954, test_loss: 1.0632, test_f1: 0.4416
 epoch: 23, train_loss: 1.0991, test_loss: 1.0544, test_f1: 0.4509
 epoch: 24, train_loss: 1.0989, test_loss: 1.0486, test_f1: 0.4546
 epoch: 25, train_loss: 1.0901, test_loss: 1.0550, test_f1: 0.4447
 epoch: 26, train_loss: 1.0813, test_loss: 1.0404, test_f1: 0.4599
 epoch: 27, train_loss: 1.0761, test_loss: 1.0412, test_f1: 0.4643
 epoch: 28, train_loss: 1.0630, test_loss: 1.0496, test_f1: 0.4401
 epoch: 29, train_loss: 1.0638, test_loss: 1.0312, test_f1: 0.4634
 epoch: 30, train_loss: 1.0651, test_loss: 1.0367, test_f1: 0.4548
 epoch: 31, train_loss: 1.0500, test_loss: 1.0312, test_f1: 0.4472
 epoch: 32, train_loss: 1.0480, test_loss: 1.0334, test_f1: 0.4631
 epoch: 33, train_loss: 1.0527, test_loss: 1.0283, test_f1: 0.4613
 epoch: 34, train_loss: 1.0406, test_loss: 1.0233, test_f1: 0.4651
 epoch: 35, train_loss: 1.0247, test_loss: 1.0275, test_f1: 0.4453
 epoch: 36, train_loss: 1.0290, test_loss: 1.0177, test_f1: 0.4482
 epoch: 37, train_loss: 1.0291, test_loss: 1.0374, test_f1: 0.4583
 epoch: 38, train_loss: 1.0272, test_loss: 1.0382, test_f1: 0.4590
 epoch: 39, train_loss: 1.0219, test_loss: 1.0245, test_f1: 0.4471
 epoch: 40, train_loss: 1.0115, test_loss: 1.0190, test_f1: 0.4562
 epoch: 41, train_loss: 1.0060, test_loss: 1.0166, test_f1: 0.4598
 epoch: 42, train_loss: 0.9969, test_loss: 1.0365, test_f1: 0.4467
 epoch: 43, train_loss: 0.9997, test_loss: 1.0100, test_f1: 0.4584
 epoch: 44, train_loss: 0.9986, test_loss: 1.0104, test_f1: 0.4551
 epoch: 45, train_loss: 0.9928, test_loss: 1.0089, test_f1: 0.4631
 epoch: 46, train_loss: 0.9884, test_loss: 1.0361, test_f1: 0.4424
 epoch: 47, train_loss: 0.9937, test_loss: 1.0126, test_f1: 0.4690
 epoch: 48, train_loss: 0.9839, test_loss: 1.0055, test_f1: 0.4612
 epoch: 49, train_loss: 0.9831, test_loss: 1.0194, test_f1: 0.4643
 epoch: 50, train_loss: 0.9809, test_loss: 1.0023, test_f1: 0.4668
 epoch: 51, train_loss: 0.9807, test_loss: 0.9912, test_f1: 0.4689
 epoch: 52, train_loss: 0.9706, test_loss: 0.9999, test_f1: 0.4672
 epoch: 53, train_loss: 0.9491, test_loss: 0.9898, test_f1: 0.4710
 epoch: 54, train_loss: 0.9520, test_loss: 1.0065, test_f1: 0.4602
 epoch: 55, train_loss: 0.9646, test_loss: 0.9869, test_f1: 0.4663
 epoch: 56, train_loss: 0.9694, test_loss: 1.0022, test_f1: 0.4750
 epoch: 57, train_loss: 0.9449, test_loss: 0.9884, test_f1: 0.4669
 epoch: 58, train_loss: 0.9547, test_loss: 0.9946, test_f1: 0.4701
 epoch: 59, train_loss: 0.9560, test_loss: 0.9893, test_f1: 0.4746
 epoch: 60, train_loss: 0.9560, test_loss: 1.0129, test_f1: 0.4785
 epoch: 61, train_loss: 0.9560, test_loss: 0.9999, test_f1: 0.4682
 epoch: 62, train_loss: 0.9433, test_loss: 1.0334, test_f1: 0.4636
 epoch: 63, train_loss: 0.9563, test_loss: 1.0020, test_f1: 0.4808
 epoch: 64, train_loss: 0.9324, test_loss: 0.9937, test_f1: 0.4692
 epoch: 65, train_loss: 0.9310, test_loss: 0.9959, test_f1: 0.4823
 epoch: 66, train_loss: 0.9487, test_loss: 1.0023, test_f1: 0.4786
 epoch: 67, train_loss: 0.9458, test_loss: 1.0205, test_f1: 0.4641
 epoch: 68, train_loss: 0.9416, test_loss: 1.0109, test_f1: 0.4804
 epoch: 69, train_loss: 0.9323, test_loss: 0.9968, test_f1: 0.4863
 epoch: 70, train_loss: 0.9367, test_loss: 1.0001, test_f1: 0.4759
 epoch: 71, train_loss: 0.9337, test_loss: 1.0375, test_f1: 0.4746
 epoch: 72, train_loss: 0.9305, test_loss: 0.9897, test_f1: 0.4888
 epoch: 73, train_loss: 0.9301, test_loss: 1.0001, test_f1: 0.4908
 epoch: 74, train_loss: 0.9199, test_loss: 0.9982, test_f1: 0.4806
 epoch: 75, train_loss: 0.9140, test_loss: 1.0027, test_f1: 0.4837
 epoch: 76, train_loss: 0.9259, test_loss: 1.0064, test_f1: 0.4925
 epoch: 77, train_loss: 0.9276, test_loss: 1.0117, test_f1: 0.4723
 epoch: 78, train_loss: 0.9189, test_loss: 0.9969, test_f1: 0.4848
 epoch: 79, train_loss: 0.9190, test_loss: 1.0281, test_f1: 0.4738
 epoch: 80, train_loss: 0.9155, test_loss: 1.0130, test_f1: 0.4846
 epoch: 81, train_loss: 0.9192, test_loss: 1.0091, test_f1: 0.4717
 epoch: 82, train_loss: 0.9186, test_loss: 1.0038, test_f1: 0.4923
 epoch: 83, train_loss: 0.9053, test_loss: 1.0171, test_f1: 0.4730
 epoch: 84, train_loss: 0.9079, test_loss: 1.0339, test_f1: 0.4932
 epoch: 85, train_loss: 0.9077, test_loss: 1.0110, test_f1: 0.4926
 epoch: 86, train_loss: 0.9069, test_loss: 1.0228, test_f1: 0.4983
 epoch: 87, train_loss: 0.9085, test_loss: 1.0145, test_f1: 0.4788
 epoch: 88, train_loss: 0.9044, test_loss: 0.9994, test_f1: 0.4799
 epoch: 89, train_loss: 0.9137, test_loss: 1.0118, test_f1: 0.4707
 epoch: 90, train_loss: 0.9062, test_loss: 1.0098, test_f1: 0.4910
 epoch: 91, train_loss: 0.9029, test_loss: 0.9974, test_f1: 0.4904
 epoch: 92, train_loss: 0.9049, test_loss: 1.0002, test_f1: 0.4852
 epoch: 93, train_loss: 0.9068, test_loss: 1.0178, test_f1: 0.4881
 epoch: 94, train_loss: 0.8978, test_loss: 1.0093, test_f1: 0.4874
 epoch: 95, train_loss: 0.8958, test_loss: 1.0067, test_f1: 0.5026
 epoch: 96, train_loss: 0.9123, test_loss: 1.0227, test_f1: 0.4928
 epoch: 97, train_loss: 0.8882, test_loss: 1.0038, test_f1: 0.5030
 epoch: 98, train_loss: 0.9014, test_loss: 1.0165, test_f1: 0.4973
 epoch: 99, train_loss: 0.8955, test_loss: 1.0047, test_f1: 0.4951
##################ITERATION #3 ****************************************
 epoch: 0, train_loss: 1.3439, test_loss: 1.2919, test_f1: 0.2274
 epoch: 1, train_loss: 1.2662, test_loss: 1.2480, test_f1: 0.2527
 epoch: 2, train_loss: 1.2481, test_loss: 1.2109, test_f1: 0.3390
 epoch: 3, train_loss: 1.2327, test_loss: 1.1919, test_f1: 0.3616
 epoch: 4, train_loss: 1.2112, test_loss: 1.1805, test_f1: 0.3750
 epoch: 5, train_loss: 1.2113, test_loss: 1.1701, test_f1: 0.3867
 epoch: 6, train_loss: 1.1938, test_loss: 1.1501, test_f1: 0.3984
 epoch: 7, train_loss: 1.1889, test_loss: 1.1471, test_f1: 0.4144
 epoch: 8, train_loss: 1.1741, test_loss: 1.1241, test_f1: 0.4190
 epoch: 9, train_loss: 1.1568, test_loss: 1.1129, test_f1: 0.4377
 epoch: 10, train_loss: 1.1534, test_loss: 1.1050, test_f1: 0.4262
 epoch: 11, train_loss: 1.1456, test_loss: 1.0913, test_f1: 0.4405
 epoch: 12, train_loss: 1.1297, test_loss: 1.0796, test_f1: 0.4323
 epoch: 13, train_loss: 1.1302, test_loss: 1.0706, test_f1: 0.4504
 epoch: 14, train_loss: 1.1235, test_loss: 1.0623, test_f1: 0.4512
 epoch: 15, train_loss: 1.1179, test_loss: 1.0554, test_f1: 0.4631
 epoch: 16, train_loss: 1.1070, test_loss: 1.0539, test_f1: 0.4410
 epoch: 17, train_loss: 1.0991, test_loss: 1.0424, test_f1: 0.4738
 epoch: 18, train_loss: 1.0984, test_loss: 1.0347, test_f1: 0.4552
 epoch: 19, train_loss: 1.0812, test_loss: 1.0417, test_f1: 0.4387
 epoch: 20, train_loss: 1.0827, test_loss: 1.0237, test_f1: 0.4716
 epoch: 21, train_loss: 1.0733, test_loss: 1.0157, test_f1: 0.4654
 epoch: 22, train_loss: 1.0704, test_loss: 1.0164, test_f1: 0.4605
 epoch: 23, train_loss: 1.0729, test_loss: 1.0166, test_f1: 0.4640
 epoch: 24, train_loss: 1.0631, test_loss: 1.0012, test_f1: 0.4600
 epoch: 25, train_loss: 1.0580, test_loss: 0.9961, test_f1: 0.4588
 epoch: 26, train_loss: 1.0454, test_loss: 0.9792, test_f1: 0.4753
 epoch: 27, train_loss: 1.0407, test_loss: 1.0049, test_f1: 0.4519
 epoch: 28, train_loss: 1.0516, test_loss: 0.9779, test_f1: 0.4703
 epoch: 29, train_loss: 1.0436, test_loss: 0.9901, test_f1: 0.4708
 epoch: 30, train_loss: 1.0250, test_loss: 0.9731, test_f1: 0.4782
 epoch: 31, train_loss: 1.0118, test_loss: 0.9522, test_f1: 0.4838
 epoch: 32, train_loss: 1.0256, test_loss: 0.9698, test_f1: 0.4770
 epoch: 33, train_loss: 1.0148, test_loss: 0.9503, test_f1: 0.4835
 epoch: 34, train_loss: 1.0142, test_loss: 0.9556, test_f1: 0.4952
 epoch: 35, train_loss: 1.0094, test_loss: 0.9716, test_f1: 0.4727
 epoch: 36, train_loss: 0.9944, test_loss: 0.9396, test_f1: 0.4889
 epoch: 37, train_loss: 1.0088, test_loss: 0.9448, test_f1: 0.4900
 epoch: 38, train_loss: 0.9988, test_loss: 0.9541, test_f1: 0.4744
 epoch: 39, train_loss: 1.0059, test_loss: 0.9470, test_f1: 0.4899
 epoch: 40, train_loss: 1.0023, test_loss: 0.9476, test_f1: 0.4959
 epoch: 41, train_loss: 0.9826, test_loss: 0.9540, test_f1: 0.4930
 epoch: 42, train_loss: 0.9916, test_loss: 0.9500, test_f1: 0.4793
 epoch: 43, train_loss: 0.9861, test_loss: 0.9372, test_f1: 0.4867
 epoch: 44, train_loss: 0.9824, test_loss: 0.9471, test_f1: 0.4819
 epoch: 45, train_loss: 0.9791, test_loss: 0.9439, test_f1: 0.4840
 epoch: 46, train_loss: 0.9728, test_loss: 0.9378, test_f1: 0.4817
 epoch: 47, train_loss: 0.9713, test_loss: 0.9545, test_f1: 0.4869
 epoch: 48, train_loss: 0.9625, test_loss: 0.9540, test_f1: 0.4914
 epoch: 49, train_loss: 0.9623, test_loss: 0.9425, test_f1: 0.4761
 epoch: 50, train_loss: 0.9675, test_loss: 0.9856, test_f1: 0.4727
 epoch: 51, train_loss: 0.9524, test_loss: 0.9828, test_f1: 0.4688
 epoch: 52, train_loss: 0.9516, test_loss: 0.9685, test_f1: 0.4749
 epoch: 53, train_loss: 0.9601, test_loss: 0.9863, test_f1: 0.4613
 epoch: 54, train_loss: 0.9482, test_loss: 0.9798, test_f1: 0.4716
 epoch: 55, train_loss: 0.9400, test_loss: 0.9949, test_f1: 0.4588
 epoch: 56, train_loss: 0.9419, test_loss: 0.9587, test_f1: 0.4726
 epoch: 57, train_loss: 0.9430, test_loss: 0.9537, test_f1: 0.4658
 epoch: 58, train_loss: 0.9450, test_loss: 0.9539, test_f1: 0.4741
 epoch: 59, train_loss: 0.9516, test_loss: 0.9781, test_f1: 0.4859
 epoch: 60, train_loss: 0.9461, test_loss: 0.9725, test_f1: 0.4646
 epoch: 61, train_loss: 0.9453, test_loss: 0.9640, test_f1: 0.4711
 epoch: 62, train_loss: 0.9469, test_loss: 0.9736, test_f1: 0.4744
 epoch: 63, train_loss: 0.9335, test_loss: 0.9855, test_f1: 0.4708
 epoch: 64, train_loss: 0.9335, test_loss: 0.9834, test_f1: 0.4575
 epoch: 65, train_loss: 0.9345, test_loss: 0.9919, test_f1: 0.4615
 epoch: 66, train_loss: 0.9405, test_loss: 0.9899, test_f1: 0.4623
 epoch: 67, train_loss: 0.9353, test_loss: 0.9921, test_f1: 0.4625
 epoch: 68, train_loss: 0.9241, test_loss: 0.9749, test_f1: 0.4644
 epoch: 69, train_loss: 0.9314, test_loss: 0.9878, test_f1: 0.4603
 epoch: 70, train_loss: 0.9250, test_loss: 0.9654, test_f1: 0.4688
 epoch: 71, train_loss: 0.9244, test_loss: 0.9944, test_f1: 0.4678
 epoch: 72, train_loss: 0.9330, test_loss: 0.9822, test_f1: 0.4633
 epoch: 73, train_loss: 0.9296, test_loss: 0.9840, test_f1: 0.4542
 epoch: 74, train_loss: 0.9259, test_loss: 0.9889, test_f1: 0.4606
 epoch: 75, train_loss: 0.9202, test_loss: 0.9712, test_f1: 0.4705
 epoch: 76, train_loss: 0.9150, test_loss: 0.9672, test_f1: 0.4765
 epoch: 77, train_loss: 0.9181, test_loss: 0.9860, test_f1: 0.4653
 epoch: 78, train_loss: 0.9185, test_loss: 0.9981, test_f1: 0.4610
 epoch: 79, train_loss: 0.9162, test_loss: 0.9792, test_f1: 0.4599
 epoch: 80, train_loss: 0.9112, test_loss: 0.9860, test_f1: 0.4640
 epoch: 81, train_loss: 0.9227, test_loss: 1.0112, test_f1: 0.4545
 epoch: 82, train_loss: 0.9157, test_loss: 0.9777, test_f1: 0.4678
 epoch: 83, train_loss: 0.9191, test_loss: 0.9717, test_f1: 0.4660
 epoch: 84, train_loss: 0.9113, test_loss: 0.9765, test_f1: 0.4686
 epoch: 85, train_loss: 0.9138, test_loss: 0.9966, test_f1: 0.4625
 epoch: 86, train_loss: 0.9035, test_loss: 0.9850, test_f1: 0.4665
 epoch: 87, train_loss: 0.9065, test_loss: 0.9961, test_f1: 0.4645
 epoch: 88, train_loss: 0.9173, test_loss: 1.0038, test_f1: 0.4631
 epoch: 89, train_loss: 0.8926, test_loss: 0.9973, test_f1: 0.4617
 epoch: 90, train_loss: 0.9168, test_loss: 1.0176, test_f1: 0.4535
 epoch: 91, train_loss: 0.9063, test_loss: 1.0237, test_f1: 0.4482
 epoch: 92, train_loss: 0.8986, test_loss: 1.0143, test_f1: 0.4721
 epoch: 93, train_loss: 0.8910, test_loss: 0.9992, test_f1: 0.4699
 epoch: 94, train_loss: 0.8999, test_loss: 1.0049, test_f1: 0.4667
 epoch: 95, train_loss: 0.9036, test_loss: 1.0129, test_f1: 0.4690
 epoch: 96, train_loss: 0.8997, test_loss: 0.9933, test_f1: 0.4660
 epoch: 97, train_loss: 0.8866, test_loss: 1.0172, test_f1: 0.4702
 epoch: 98, train_loss: 0.9003, test_loss: 0.9822, test_f1: 0.4661
 epoch: 99, train_loss: 0.9008, test_loss: 1.0134, test_f1: 0.4758
##################ITERATION #4 ****************************************
 epoch: 0, train_loss: 1.3808, test_loss: 1.2984, test_f1: 0.2274
 epoch: 1, train_loss: 1.2725, test_loss: 1.2571, test_f1: 0.2344
 epoch: 2, train_loss: 1.2459, test_loss: 1.2318, test_f1: 0.2574
 epoch: 3, train_loss: 1.2526, test_loss: 1.2091, test_f1: 0.3063
 epoch: 4, train_loss: 1.2317, test_loss: 1.1962, test_f1: 0.3192
 epoch: 5, train_loss: 1.2283, test_loss: 1.1877, test_f1: 0.3211
 epoch: 6, train_loss: 1.2185, test_loss: 1.1792, test_f1: 0.3262
 epoch: 7, train_loss: 1.2151, test_loss: 1.1706, test_f1: 0.3398
 epoch: 8, train_loss: 1.2048, test_loss: 1.1672, test_f1: 0.3579
 epoch: 9, train_loss: 1.1945, test_loss: 1.1630, test_f1: 0.3460
 epoch: 10, train_loss: 1.1889, test_loss: 1.1521, test_f1: 0.3856
 epoch: 11, train_loss: 1.1840, test_loss: 1.1502, test_f1: 0.3734
 epoch: 12, train_loss: 1.1745, test_loss: 1.1488, test_f1: 0.3829
 epoch: 13, train_loss: 1.1678, test_loss: 1.1404, test_f1: 0.3757
 epoch: 14, train_loss: 1.1600, test_loss: 1.1343, test_f1: 0.3911
 epoch: 15, train_loss: 1.1573, test_loss: 1.1294, test_f1: 0.3880
 epoch: 16, train_loss: 1.1562, test_loss: 1.1257, test_f1: 0.3839
 epoch: 17, train_loss: 1.1391, test_loss: 1.1162, test_f1: 0.3916
 epoch: 18, train_loss: 1.1340, test_loss: 1.1102, test_f1: 0.3870
 epoch: 19, train_loss: 1.1340, test_loss: 1.1019, test_f1: 0.3926
 epoch: 20, train_loss: 1.1206, test_loss: 1.0992, test_f1: 0.3985
 epoch: 21, train_loss: 1.1287, test_loss: 1.1029, test_f1: 0.3900
 epoch: 22, train_loss: 1.1197, test_loss: 1.1018, test_f1: 0.3977
 epoch: 23, train_loss: 1.1130, test_loss: 1.0834, test_f1: 0.3968
 epoch: 24, train_loss: 1.1020, test_loss: 1.0815, test_f1: 0.4121
 epoch: 25, train_loss: 1.1030, test_loss: 1.0812, test_f1: 0.4046
 epoch: 26, train_loss: 1.0959, test_loss: 1.0879, test_f1: 0.3945
 epoch: 27, train_loss: 1.0948, test_loss: 1.0818, test_f1: 0.3972
 epoch: 28, train_loss: 1.0938, test_loss: 1.0643, test_f1: 0.4018
 epoch: 29, train_loss: 1.0748, test_loss: 1.0635, test_f1: 0.4001
 epoch: 30, train_loss: 1.0683, test_loss: 1.0722, test_f1: 0.4156
 epoch: 31, train_loss: 1.0774, test_loss: 1.0612, test_f1: 0.4081
 epoch: 32, train_loss: 1.0615, test_loss: 1.0866, test_f1: 0.3916
 epoch: 33, train_loss: 1.0645, test_loss: 1.0663, test_f1: 0.4168
 epoch: 34, train_loss: 1.0634, test_loss: 1.0573, test_f1: 0.4081
 epoch: 35, train_loss: 1.0553, test_loss: 1.0622, test_f1: 0.4204
 epoch: 36, train_loss: 1.0462, test_loss: 1.0662, test_f1: 0.4189
 epoch: 37, train_loss: 1.0425, test_loss: 1.0391, test_f1: 0.4183
 epoch: 38, train_loss: 1.0384, test_loss: 1.0598, test_f1: 0.4055
 epoch: 39, train_loss: 1.0347, test_loss: 1.0495, test_f1: 0.4034
 epoch: 40, train_loss: 1.0248, test_loss: 1.0425, test_f1: 0.4325
 epoch: 41, train_loss: 1.0321, test_loss: 1.0571, test_f1: 0.4339
 epoch: 42, train_loss: 1.0217, test_loss: 1.0754, test_f1: 0.4141
 epoch: 43, train_loss: 1.0296, test_loss: 1.0607, test_f1: 0.4178
 epoch: 44, train_loss: 1.0141, test_loss: 1.0464, test_f1: 0.4346
 epoch: 45, train_loss: 1.0118, test_loss: 1.0447, test_f1: 0.4268
 epoch: 46, train_loss: 1.0107, test_loss: 1.0415, test_f1: 0.4281
 epoch: 47, train_loss: 1.0125, test_loss: 1.0795, test_f1: 0.4068
 epoch: 48, train_loss: 0.9909, test_loss: 1.1112, test_f1: 0.4143
 epoch: 49, train_loss: 0.9976, test_loss: 1.1003, test_f1: 0.3929
 epoch: 50, train_loss: 0.9875, test_loss: 1.0431, test_f1: 0.4395
 epoch: 51, train_loss: 0.9934, test_loss: 1.1103, test_f1: 0.4121
 epoch: 52, train_loss: 0.9815, test_loss: 1.0511, test_f1: 0.4235
 epoch: 53, train_loss: 0.9794, test_loss: 1.0441, test_f1: 0.4396
 epoch: 54, train_loss: 0.9760, test_loss: 1.0412, test_f1: 0.4349
 epoch: 55, train_loss: 0.9743, test_loss: 1.0596, test_f1: 0.4295
 epoch: 56, train_loss: 0.9643, test_loss: 1.0451, test_f1: 0.4518
 epoch: 57, train_loss: 0.9649, test_loss: 1.0421, test_f1: 0.4307
 epoch: 58, train_loss: 0.9758, test_loss: 1.0349, test_f1: 0.4392
 epoch: 59, train_loss: 0.9592, test_loss: 1.0375, test_f1: 0.4365
 epoch: 60, train_loss: 0.9590, test_loss: 1.0447, test_f1: 0.4330
 epoch: 61, train_loss: 0.9696, test_loss: 1.0374, test_f1: 0.4340
 epoch: 62, train_loss: 0.9615, test_loss: 1.0640, test_f1: 0.4288
 epoch: 63, train_loss: 0.9543, test_loss: 1.0544, test_f1: 0.4435
 epoch: 64, train_loss: 0.9632, test_loss: 1.0493, test_f1: 0.4524
 epoch: 65, train_loss: 0.9603, test_loss: 1.0565, test_f1: 0.4474
 epoch: 66, train_loss: 0.9518, test_loss: 1.0578, test_f1: 0.4574
 epoch: 67, train_loss: 0.9511, test_loss: 1.0421, test_f1: 0.4504
 epoch: 68, train_loss: 0.9548, test_loss: 1.0569, test_f1: 0.4533
 epoch: 69, train_loss: 0.9561, test_loss: 1.0511, test_f1: 0.4290
 epoch: 70, train_loss: 0.9477, test_loss: 1.1013, test_f1: 0.4305
 epoch: 71, train_loss: 0.9537, test_loss: 1.0519, test_f1: 0.4482
 epoch: 72, train_loss: 0.9483, test_loss: 1.0444, test_f1: 0.4482
 epoch: 73, train_loss: 0.9430, test_loss: 1.0443, test_f1: 0.4429
 epoch: 74, train_loss: 0.9497, test_loss: 1.0362, test_f1: 0.4729
 epoch: 75, train_loss: 0.9354, test_loss: 1.0570, test_f1: 0.4356
 epoch: 76, train_loss: 0.9352, test_loss: 1.0800, test_f1: 0.4396
 epoch: 77, train_loss: 0.9356, test_loss: 1.0522, test_f1: 0.4618
 epoch: 78, train_loss: 0.9400, test_loss: 1.0517, test_f1: 0.4549
 epoch: 79, train_loss: 0.9460, test_loss: 1.0534, test_f1: 0.4524
 epoch: 80, train_loss: 0.9403, test_loss: 1.0599, test_f1: 0.4525
 epoch: 81, train_loss: 0.9348, test_loss: 1.0351, test_f1: 0.4562
 epoch: 82, train_loss: 0.9327, test_loss: 1.0508, test_f1: 0.4395
 epoch: 83, train_loss: 0.9325, test_loss: 1.0572, test_f1: 0.4523
 epoch: 84, train_loss: 0.9390, test_loss: 1.0464, test_f1: 0.4500
 epoch: 85, train_loss: 0.9241, test_loss: 1.0485, test_f1: 0.4461
 epoch: 86, train_loss: 0.9236, test_loss: 1.0444, test_f1: 0.4599
 epoch: 87, train_loss: 0.9217, test_loss: 1.0518, test_f1: 0.4465
 epoch: 88, train_loss: 0.9277, test_loss: 1.0745, test_f1: 0.4468
 epoch: 89, train_loss: 0.9232, test_loss: 1.0473, test_f1: 0.4674
 epoch: 90, train_loss: 0.9123, test_loss: 1.0572, test_f1: 0.4475
 epoch: 91, train_loss: 0.9147, test_loss: 1.0727, test_f1: 0.4535
 epoch: 92, train_loss: 0.9091, test_loss: 1.0687, test_f1: 0.4592
 epoch: 93, train_loss: 0.9111, test_loss: 1.0669, test_f1: 0.4556
 epoch: 94, train_loss: 0.9099, test_loss: 1.0746, test_f1: 0.4413
 epoch: 95, train_loss: 0.9035, test_loss: 1.0450, test_f1: 0.4633
 epoch: 96, train_loss: 0.9090, test_loss: 1.0914, test_f1: 0.4457
 epoch: 97, train_loss: 0.9160, test_loss: 1.0792, test_f1: 0.4586
 epoch: 98, train_loss: 0.9122, test_loss: 1.0817, test_f1: 0.4655
 epoch: 99, train_loss: 0.9118, test_loss: 1.0604, test_f1: 0.4490
##################ITERATION #5 ****************************************
 epoch: 0, train_loss: 1.3682, test_loss: 1.3229, test_f1: 0.2274
 epoch: 1, train_loss: 1.2616, test_loss: 1.2499, test_f1: 0.2416
 epoch: 2, train_loss: 1.2468, test_loss: 1.2120, test_f1: 0.3262
 epoch: 3, train_loss: 1.2279, test_loss: 1.1983, test_f1: 0.3716
 epoch: 4, train_loss: 1.2132, test_loss: 1.1893, test_f1: 0.3858
 epoch: 5, train_loss: 1.2116, test_loss: 1.1749, test_f1: 0.3777
 epoch: 6, train_loss: 1.1959, test_loss: 1.1665, test_f1: 0.3873
 epoch: 7, train_loss: 1.1963, test_loss: 1.1580, test_f1: 0.3853
 epoch: 8, train_loss: 1.1841, test_loss: 1.1475, test_f1: 0.3886
 epoch: 9, train_loss: 1.1735, test_loss: 1.1316, test_f1: 0.4258
 epoch: 10, train_loss: 1.1586, test_loss: 1.1192, test_f1: 0.4251
 epoch: 11, train_loss: 1.1563, test_loss: 1.1044, test_f1: 0.4344
 epoch: 12, train_loss: 1.1425, test_loss: 1.0910, test_f1: 0.4384
 epoch: 13, train_loss: 1.1327, test_loss: 1.0857, test_f1: 0.4383
 epoch: 14, train_loss: 1.1214, test_loss: 1.0688, test_f1: 0.4696
 epoch: 15, train_loss: 1.1213, test_loss: 1.0688, test_f1: 0.4454
 epoch: 16, train_loss: 1.1090, test_loss: 1.0501, test_f1: 0.4491
 epoch: 17, train_loss: 1.1078, test_loss: 1.0483, test_f1: 0.4618
 epoch: 18, train_loss: 1.0926, test_loss: 1.0433, test_f1: 0.4672
 epoch: 19, train_loss: 1.0879, test_loss: 1.0333, test_f1: 0.4682
 epoch: 20, train_loss: 1.0819, test_loss: 1.0304, test_f1: 0.4687
 epoch: 21, train_loss: 1.0726, test_loss: 1.0209, test_f1: 0.4726
 epoch: 22, train_loss: 1.0609, test_loss: 1.0222, test_f1: 0.4719
 epoch: 23, train_loss: 1.0598, test_loss: 1.0198, test_f1: 0.4736
 epoch: 24, train_loss: 1.0527, test_loss: 1.0193, test_f1: 0.4852
 epoch: 25, train_loss: 1.0391, test_loss: 1.0132, test_f1: 0.4742
 epoch: 26, train_loss: 1.0390, test_loss: 1.0077, test_f1: 0.4855
 epoch: 27, train_loss: 1.0333, test_loss: 1.0110, test_f1: 0.4800
 epoch: 28, train_loss: 1.0310, test_loss: 1.0111, test_f1: 0.4815
 epoch: 29, train_loss: 1.0106, test_loss: 1.0178, test_f1: 0.4645
 epoch: 30, train_loss: 1.0198, test_loss: 0.9985, test_f1: 0.4881
 epoch: 31, train_loss: 1.0161, test_loss: 0.9912, test_f1: 0.4803
 epoch: 32, train_loss: 1.0091, test_loss: 1.0080, test_f1: 0.4780
 epoch: 33, train_loss: 1.0019, test_loss: 0.9902, test_f1: 0.4870
 epoch: 34, train_loss: 0.9993, test_loss: 0.9865, test_f1: 0.4786
 epoch: 35, train_loss: 0.9932, test_loss: 0.9828, test_f1: 0.4789
 epoch: 36, train_loss: 0.9907, test_loss: 0.9812, test_f1: 0.4890
 epoch: 37, train_loss: 0.9832, test_loss: 0.9955, test_f1: 0.4790
 epoch: 38, train_loss: 0.9871, test_loss: 0.9834, test_f1: 0.4932
 epoch: 39, train_loss: 0.9813, test_loss: 1.0032, test_f1: 0.4706
 epoch: 40, train_loss: 0.9718, test_loss: 0.9840, test_f1: 0.4768
 epoch: 41, train_loss: 0.9678, test_loss: 0.9792, test_f1: 0.4794
 epoch: 42, train_loss: 0.9751, test_loss: 0.9669, test_f1: 0.4870
 epoch: 43, train_loss: 0.9667, test_loss: 0.9925, test_f1: 0.4835
 epoch: 44, train_loss: 0.9667, test_loss: 1.0051, test_f1: 0.4834
 epoch: 45, train_loss: 0.9586, test_loss: 0.9998, test_f1: 0.4859
 epoch: 46, train_loss: 0.9581, test_loss: 1.0012, test_f1: 0.4825
 epoch: 47, train_loss: 0.9618, test_loss: 0.9887, test_f1: 0.4803
 epoch: 48, train_loss: 0.9490, test_loss: 1.0150, test_f1: 0.4776
 epoch: 49, train_loss: 0.9450, test_loss: 0.9633, test_f1: 0.5005
 epoch: 50, train_loss: 0.9445, test_loss: 1.0125, test_f1: 0.4804
 epoch: 51, train_loss: 0.9385, test_loss: 0.9782, test_f1: 0.4915
 epoch: 52, train_loss: 0.9378, test_loss: 0.9994, test_f1: 0.4806
 epoch: 53, train_loss: 0.9364, test_loss: 0.9950, test_f1: 0.4934
 epoch: 54, train_loss: 0.9367, test_loss: 1.0053, test_f1: 0.4780
 epoch: 55, train_loss: 0.9255, test_loss: 1.0013, test_f1: 0.4815
 epoch: 56, train_loss: 0.9320, test_loss: 1.0119, test_f1: 0.4781
 epoch: 57, train_loss: 0.9250, test_loss: 0.9965, test_f1: 0.4887
 epoch: 58, train_loss: 0.9236, test_loss: 0.9926, test_f1: 0.4787
 epoch: 59, train_loss: 0.9351, test_loss: 1.0033, test_f1: 0.4778
 epoch: 60, train_loss: 0.9203, test_loss: 0.9908, test_f1: 0.4787
 epoch: 61, train_loss: 0.9179, test_loss: 0.9980, test_f1: 0.4783
 epoch: 62, train_loss: 0.9232, test_loss: 1.0076, test_f1: 0.4816
 epoch: 63, train_loss: 0.9186, test_loss: 0.9890, test_f1: 0.4791
 epoch: 64, train_loss: 0.9095, test_loss: 1.0352, test_f1: 0.4642
 epoch: 65, train_loss: 0.9132, test_loss: 1.0042, test_f1: 0.4819
 epoch: 66, train_loss: 0.9128, test_loss: 1.0253, test_f1: 0.4707
 epoch: 67, train_loss: 0.9058, test_loss: 1.0075, test_f1: 0.4771
 epoch: 68, train_loss: 0.9168, test_loss: 0.9917, test_f1: 0.4905
 epoch: 69, train_loss: 0.9042, test_loss: 0.9891, test_f1: 0.4918
 epoch: 70, train_loss: 0.9090, test_loss: 1.0021, test_f1: 0.4832
 epoch: 71, train_loss: 0.9089, test_loss: 1.0034, test_f1: 0.4827
 epoch: 72, train_loss: 0.9130, test_loss: 1.0176, test_f1: 0.4763
 epoch: 73, train_loss: 0.9147, test_loss: 1.0145, test_f1: 0.4676
 epoch: 74, train_loss: 0.9007, test_loss: 1.0129, test_f1: 0.4811
 epoch: 75, train_loss: 0.8956, test_loss: 1.0270, test_f1: 0.4629
 epoch: 76, train_loss: 0.8937, test_loss: 1.0158, test_f1: 0.4782
 epoch: 77, train_loss: 0.8984, test_loss: 1.0270, test_f1: 0.4894
 epoch: 78, train_loss: 0.9015, test_loss: 1.0091, test_f1: 0.4808
 epoch: 79, train_loss: 0.9012, test_loss: 1.0128, test_f1: 0.4958
 epoch: 80, train_loss: 0.8917, test_loss: 1.0515, test_f1: 0.4660
 epoch: 81, train_loss: 0.9062, test_loss: 1.0119, test_f1: 0.4746
 epoch: 82, train_loss: 0.8823, test_loss: 1.0266, test_f1: 0.4748
 epoch: 83, train_loss: 0.8957, test_loss: 1.0233, test_f1: 0.4733
 epoch: 84, train_loss: 0.8748, test_loss: 1.0255, test_f1: 0.4770
 epoch: 85, train_loss: 0.8834, test_loss: 1.0274, test_f1: 0.4899
 epoch: 86, train_loss: 0.8924, test_loss: 1.0148, test_f1: 0.4885
 epoch: 87, train_loss: 0.8777, test_loss: 1.0335, test_f1: 0.4840
 epoch: 88, train_loss: 0.8881, test_loss: 1.0195, test_f1: 0.4788
 epoch: 89, train_loss: 0.8724, test_loss: 1.0341, test_f1: 0.4818
 epoch: 90, train_loss: 0.8876, test_loss: 1.0570, test_f1: 0.4729
 epoch: 91, train_loss: 0.8867, test_loss: 1.0133, test_f1: 0.4911
 epoch: 92, train_loss: 0.8784, test_loss: 1.0288, test_f1: 0.4803
 epoch: 93, train_loss: 0.8794, test_loss: 1.0344, test_f1: 0.4872
 epoch: 94, train_loss: 0.8675, test_loss: 1.0296, test_f1: 0.4806
 epoch: 95, train_loss: 0.8838, test_loss: 1.0222, test_f1: 0.4942
 epoch: 96, train_loss: 0.8808, test_loss: 1.0335, test_f1: 0.4794
 epoch: 97, train_loss: 0.8775, test_loss: 1.0401, test_f1: 0.4699
 epoch: 98, train_loss: 0.8872, test_loss: 1.0093, test_f1: 0.4910
 epoch: 99, train_loss: 0.8750, test_loss: 1.0438, test_f1: 0.4847
##################ITERATION #6 ****************************************
 epoch: 0, train_loss: 1.4432, test_loss: 1.3256, test_f1: 0.2302
 epoch: 1, train_loss: 1.3097, test_loss: 1.2854, test_f1: 0.2973
 epoch: 2, train_loss: 1.2777, test_loss: 1.2398, test_f1: 0.3137
 epoch: 3, train_loss: 1.2523, test_loss: 1.2156, test_f1: 0.3438
 epoch: 4, train_loss: 1.2446, test_loss: 1.1910, test_f1: 0.3446
 epoch: 5, train_loss: 1.2343, test_loss: 1.1838, test_f1: 0.3598
 epoch: 6, train_loss: 1.2151, test_loss: 1.1738, test_f1: 0.3730
 epoch: 7, train_loss: 1.2122, test_loss: 1.1729, test_f1: 0.3706
 epoch: 8, train_loss: 1.2072, test_loss: 1.1753, test_f1: 0.3580
 epoch: 9, train_loss: 1.1963, test_loss: 1.1679, test_f1: 0.3545
 epoch: 10, train_loss: 1.1964, test_loss: 1.1618, test_f1: 0.3574
 epoch: 11, train_loss: 1.1853, test_loss: 1.1236, test_f1: 0.3627
 epoch: 12, train_loss: 1.1752, test_loss: 1.1144, test_f1: 0.3865
 epoch: 13, train_loss: 1.1701, test_loss: 1.1131, test_f1: 0.4075
 epoch: 14, train_loss: 1.1648, test_loss: 1.1019, test_f1: 0.3850
 epoch: 15, train_loss: 1.1556, test_loss: 1.1017, test_f1: 0.3903
 epoch: 16, train_loss: 1.1576, test_loss: 1.0889, test_f1: 0.4039
 epoch: 17, train_loss: 1.1538, test_loss: 1.0890, test_f1: 0.3877
 epoch: 18, train_loss: 1.1382, test_loss: 1.0796, test_f1: 0.4097
 epoch: 19, train_loss: 1.1316, test_loss: 1.0883, test_f1: 0.4026
 epoch: 20, train_loss: 1.1428, test_loss: 1.0733, test_f1: 0.3895
 epoch: 21, train_loss: 1.1295, test_loss: 1.0613, test_f1: 0.3940
 epoch: 22, train_loss: 1.1393, test_loss: 1.0584, test_f1: 0.4381
 epoch: 23, train_loss: 1.1257, test_loss: 1.0523, test_f1: 0.4044
 epoch: 24, train_loss: 1.1210, test_loss: 1.0551, test_f1: 0.4345
 epoch: 25, train_loss: 1.1247, test_loss: 1.0398, test_f1: 0.4116
 epoch: 26, train_loss: 1.1084, test_loss: 1.0302, test_f1: 0.4323
 epoch: 27, train_loss: 1.1047, test_loss: 1.0542, test_f1: 0.4380
 epoch: 28, train_loss: 1.1042, test_loss: 1.0345, test_f1: 0.4129
 epoch: 29, train_loss: 1.0958, test_loss: 1.0266, test_f1: 0.4486
 epoch: 30, train_loss: 1.0991, test_loss: 1.0165, test_f1: 0.4636
 epoch: 31, train_loss: 1.0904, test_loss: 1.0156, test_f1: 0.4518
 epoch: 32, train_loss: 1.0850, test_loss: 1.0103, test_f1: 0.4702
 epoch: 33, train_loss: 1.0772, test_loss: 1.0044, test_f1: 0.4665
 epoch: 34, train_loss: 1.0719, test_loss: 0.9858, test_f1: 0.4802
 epoch: 35, train_loss: 1.0622, test_loss: 1.0004, test_f1: 0.4582
 epoch: 36, train_loss: 1.0604, test_loss: 0.9934, test_f1: 0.4761
 epoch: 37, train_loss: 1.0612, test_loss: 0.9698, test_f1: 0.4850
 epoch: 38, train_loss: 1.0593, test_loss: 0.9753, test_f1: 0.4648
 epoch: 39, train_loss: 1.0494, test_loss: 0.9654, test_f1: 0.4925
 epoch: 40, train_loss: 1.0501, test_loss: 0.9558, test_f1: 0.4878
 epoch: 41, train_loss: 1.0389, test_loss: 0.9578, test_f1: 0.4854
 epoch: 42, train_loss: 1.0322, test_loss: 0.9504, test_f1: 0.4866
 epoch: 43, train_loss: 1.0316, test_loss: 0.9475, test_f1: 0.4753
 epoch: 44, train_loss: 1.0230, test_loss: 0.9599, test_f1: 0.4743
 epoch: 45, train_loss: 1.0255, test_loss: 0.9440, test_f1: 0.4881
 epoch: 46, train_loss: 1.0151, test_loss: 0.9469, test_f1: 0.4742
 epoch: 47, train_loss: 1.0116, test_loss: 0.9309, test_f1: 0.4958
 epoch: 48, train_loss: 1.0004, test_loss: 0.9398, test_f1: 0.4960
 epoch: 49, train_loss: 0.9964, test_loss: 0.9489, test_f1: 0.4813
 epoch: 50, train_loss: 0.9851, test_loss: 0.9367, test_f1: 0.4743
 epoch: 51, train_loss: 0.9817, test_loss: 0.9360, test_f1: 0.4874
 epoch: 52, train_loss: 0.9917, test_loss: 0.9524, test_f1: 0.4863
 epoch: 53, train_loss: 0.9740, test_loss: 0.9401, test_f1: 0.4819
 epoch: 54, train_loss: 0.9771, test_loss: 0.9270, test_f1: 0.4861
 epoch: 55, train_loss: 0.9746, test_loss: 0.9317, test_f1: 0.4747
 epoch: 56, train_loss: 0.9626, test_loss: 0.9358, test_f1: 0.4756
 epoch: 57, train_loss: 0.9778, test_loss: 0.9362, test_f1: 0.4811
 epoch: 58, train_loss: 0.9708, test_loss: 0.9133, test_f1: 0.4908
 epoch: 59, train_loss: 0.9588, test_loss: 0.9319, test_f1: 0.4826
 epoch: 60, train_loss: 0.9591, test_loss: 0.9258, test_f1: 0.4837
 epoch: 61, train_loss: 0.9706, test_loss: 0.9364, test_f1: 0.4735
 epoch: 62, train_loss: 0.9720, test_loss: 0.9448, test_f1: 0.4839
 epoch: 63, train_loss: 0.9652, test_loss: 0.9480, test_f1: 0.4824
 epoch: 64, train_loss: 0.9606, test_loss: 0.9467, test_f1: 0.4886
 epoch: 65, train_loss: 0.9538, test_loss: 0.9501, test_f1: 0.4776
 epoch: 66, train_loss: 0.9578, test_loss: 0.9430, test_f1: 0.4810
 epoch: 67, train_loss: 0.9557, test_loss: 0.9513, test_f1: 0.4793
 epoch: 68, train_loss: 0.9536, test_loss: 0.9432, test_f1: 0.4828
 epoch: 69, train_loss: 0.9537, test_loss: 0.9392, test_f1: 0.4836
 epoch: 70, train_loss: 0.9509, test_loss: 0.9376, test_f1: 0.4831
 epoch: 71, train_loss: 0.9452, test_loss: 0.9467, test_f1: 0.4793
 epoch: 72, train_loss: 0.9410, test_loss: 0.9711, test_f1: 0.4766
 epoch: 73, train_loss: 0.9359, test_loss: 0.9587, test_f1: 0.4829
 epoch: 74, train_loss: 0.9439, test_loss: 0.9518, test_f1: 0.4870
 epoch: 75, train_loss: 0.9399, test_loss: 0.9555, test_f1: 0.4854
 epoch: 76, train_loss: 0.9337, test_loss: 0.9428, test_f1: 0.4817
 epoch: 77, train_loss: 0.9354, test_loss: 0.9437, test_f1: 0.4855
 epoch: 78, train_loss: 0.9378, test_loss: 0.9600, test_f1: 0.4862
 epoch: 79, train_loss: 0.9287, test_loss: 0.9375, test_f1: 0.4872
 epoch: 80, train_loss: 0.9357, test_loss: 0.9487, test_f1: 0.4875
 epoch: 81, train_loss: 0.9322, test_loss: 0.9393, test_f1: 0.4758
 epoch: 82, train_loss: 0.9170, test_loss: 0.9565, test_f1: 0.4828
 epoch: 83, train_loss: 0.9150, test_loss: 0.9434, test_f1: 0.4885
 epoch: 84, train_loss: 0.9230, test_loss: 0.9491, test_f1: 0.4813
 epoch: 85, train_loss: 0.9259, test_loss: 0.9546, test_f1: 0.4793
 epoch: 86, train_loss: 0.9272, test_loss: 0.9727, test_f1: 0.4809
 epoch: 87, train_loss: 0.9164, test_loss: 0.9508, test_f1: 0.4884
 epoch: 88, train_loss: 0.9212, test_loss: 0.9548, test_f1: 0.4847
 epoch: 89, train_loss: 0.9125, test_loss: 0.9664, test_f1: 0.4882
 epoch: 90, train_loss: 0.9173, test_loss: 0.9801, test_f1: 0.4834
 epoch: 91, train_loss: 0.9250, test_loss: 0.9916, test_f1: 0.4839
 epoch: 92, train_loss: 0.9124, test_loss: 1.0038, test_f1: 0.4778
 epoch: 93, train_loss: 0.9037, test_loss: 1.0057, test_f1: 0.4816
 epoch: 94, train_loss: 0.9183, test_loss: 0.9565, test_f1: 0.4810
 epoch: 95, train_loss: 0.9245, test_loss: 0.9679, test_f1: 0.4952
 epoch: 96, train_loss: 0.9082, test_loss: 0.9798, test_f1: 0.4826
 epoch: 97, train_loss: 0.8989, test_loss: 0.9671, test_f1: 0.4775
 epoch: 98, train_loss: 0.9167, test_loss: 0.9838, test_f1: 0.4912
 epoch: 99, train_loss: 0.9027, test_loss: 0.9710, test_f1: 0.4857
##################ITERATION #7 ****************************************
 epoch: 0, train_loss: 1.4311, test_loss: 1.3331, test_f1: 0.2940
 epoch: 1, train_loss: 1.2785, test_loss: 1.2858, test_f1: 0.2815
 epoch: 2, train_loss: 1.2624, test_loss: 1.2312, test_f1: 0.3157
 epoch: 3, train_loss: 1.2585, test_loss: 1.2102, test_f1: 0.3045
 epoch: 4, train_loss: 1.2413, test_loss: 1.2005, test_f1: 0.3135
 epoch: 5, train_loss: 1.2319, test_loss: 1.1917, test_f1: 0.3436
 epoch: 6, train_loss: 1.2264, test_loss: 1.1845, test_f1: 0.3711
 epoch: 7, train_loss: 1.2229, test_loss: 1.1789, test_f1: 0.3636
 epoch: 8, train_loss: 1.2250, test_loss: 1.1701, test_f1: 0.3817
 epoch: 9, train_loss: 1.2041, test_loss: 1.1687, test_f1: 0.3820
 epoch: 10, train_loss: 1.2057, test_loss: 1.1633, test_f1: 0.3602
 epoch: 11, train_loss: 1.1923, test_loss: 1.1445, test_f1: 0.3935
 epoch: 12, train_loss: 1.1929, test_loss: 1.1385, test_f1: 0.3929
 epoch: 13, train_loss: 1.1860, test_loss: 1.1416, test_f1: 0.3976
 epoch: 14, train_loss: 1.1686, test_loss: 1.1456, test_f1: 0.3978
 epoch: 15, train_loss: 1.1638, test_loss: 1.1242, test_f1: 0.4150
 epoch: 16, train_loss: 1.1619, test_loss: 1.1170, test_f1: 0.4172
 epoch: 17, train_loss: 1.1477, test_loss: 1.1191, test_f1: 0.4147
 epoch: 18, train_loss: 1.1461, test_loss: 1.1010, test_f1: 0.4233
 epoch: 19, train_loss: 1.1356, test_loss: 1.1100, test_f1: 0.4226
 epoch: 20, train_loss: 1.1377, test_loss: 1.0985, test_f1: 0.4424
 epoch: 21, train_loss: 1.1196, test_loss: 1.0796, test_f1: 0.4340
 epoch: 22, train_loss: 1.1220, test_loss: 1.0807, test_f1: 0.4437
 epoch: 23, train_loss: 1.1218, test_loss: 1.0793, test_f1: 0.4351
 epoch: 24, train_loss: 1.1142, test_loss: 1.0827, test_f1: 0.4468
 epoch: 25, train_loss: 1.1042, test_loss: 1.0706, test_f1: 0.4393
 epoch: 26, train_loss: 1.1050, test_loss: 1.0610, test_f1: 0.4386
 epoch: 27, train_loss: 1.0815, test_loss: 1.0576, test_f1: 0.4606
 epoch: 28, train_loss: 1.0922, test_loss: 1.0537, test_f1: 0.4644
 epoch: 29, train_loss: 1.0927, test_loss: 1.0581, test_f1: 0.4367
 epoch: 30, train_loss: 1.0721, test_loss: 1.0436, test_f1: 0.4810
 epoch: 31, train_loss: 1.0696, test_loss: 1.0552, test_f1: 0.4620
 epoch: 32, train_loss: 1.0641, test_loss: 1.0210, test_f1: 0.4656
 epoch: 33, train_loss: 1.0638, test_loss: 1.0387, test_f1: 0.4642
 epoch: 34, train_loss: 1.0605, test_loss: 1.0391, test_f1: 0.4393
 epoch: 35, train_loss: 1.0559, test_loss: 1.0244, test_f1: 0.4573
 epoch: 36, train_loss: 1.0564, test_loss: 1.0082, test_f1: 0.4725
 epoch: 37, train_loss: 1.0451, test_loss: 1.0361, test_f1: 0.4660
 epoch: 38, train_loss: 1.0539, test_loss: 1.0386, test_f1: 0.4516
 epoch: 39, train_loss: 1.0478, test_loss: 0.9988, test_f1: 0.4729
 epoch: 40, train_loss: 1.0329, test_loss: 1.0095, test_f1: 0.4717
 epoch: 41, train_loss: 1.0331, test_loss: 1.0008, test_f1: 0.4653
 epoch: 42, train_loss: 1.0417, test_loss: 1.0040, test_f1: 0.4516
 epoch: 43, train_loss: 1.0315, test_loss: 0.9991, test_f1: 0.4761
 epoch: 44, train_loss: 1.0138, test_loss: 1.0386, test_f1: 0.4544
 epoch: 45, train_loss: 1.0108, test_loss: 1.0136, test_f1: 0.4616
 epoch: 46, train_loss: 1.0150, test_loss: 1.0097, test_f1: 0.4492
 epoch: 47, train_loss: 1.0033, test_loss: 0.9921, test_f1: 0.4657
 epoch: 48, train_loss: 1.0167, test_loss: 0.9926, test_f1: 0.4889
 epoch: 49, train_loss: 1.0160, test_loss: 0.9910, test_f1: 0.4762
 epoch: 50, train_loss: 1.0024, test_loss: 1.0100, test_f1: 0.4838
 epoch: 51, train_loss: 1.0021, test_loss: 1.0022, test_f1: 0.4883
 epoch: 52, train_loss: 0.9910, test_loss: 1.0049, test_f1: 0.4777
 epoch: 53, train_loss: 0.9987, test_loss: 0.9970, test_f1: 0.4812
 epoch: 54, train_loss: 0.9859, test_loss: 1.0173, test_f1: 0.4771
 epoch: 55, train_loss: 0.9866, test_loss: 1.0274, test_f1: 0.4645
 epoch: 56, train_loss: 0.9906, test_loss: 0.9799, test_f1: 0.4780
 epoch: 57, train_loss: 0.9763, test_loss: 0.9867, test_f1: 0.4817
 epoch: 58, train_loss: 0.9768, test_loss: 0.9821, test_f1: 0.4773
 epoch: 59, train_loss: 0.9827, test_loss: 0.9588, test_f1: 0.5082
 epoch: 60, train_loss: 0.9826, test_loss: 0.9701, test_f1: 0.4837
 epoch: 61, train_loss: 0.9831, test_loss: 0.9851, test_f1: 0.4888
 epoch: 62, train_loss: 0.9699, test_loss: 1.0067, test_f1: 0.5020
 epoch: 63, train_loss: 0.9861, test_loss: 1.0289, test_f1: 0.4753
 epoch: 64, train_loss: 0.9803, test_loss: 1.0030, test_f1: 0.5074
 epoch: 65, train_loss: 0.9768, test_loss: 1.0081, test_f1: 0.4597
 epoch: 66, train_loss: 0.9707, test_loss: 1.0222, test_f1: 0.4795
 epoch: 67, train_loss: 0.9671, test_loss: 0.9808, test_f1: 0.4789
 epoch: 68, train_loss: 0.9688, test_loss: 0.9802, test_f1: 0.4921
 epoch: 69, train_loss: 0.9678, test_loss: 0.9740, test_f1: 0.4945
 epoch: 70, train_loss: 0.9722, test_loss: 0.9752, test_f1: 0.4758
 epoch: 71, train_loss: 0.9561, test_loss: 0.9996, test_f1: 0.4954
 epoch: 72, train_loss: 0.9651, test_loss: 1.0055, test_f1: 0.4957
 epoch: 73, train_loss: 0.9613, test_loss: 0.9841, test_f1: 0.4805
 epoch: 74, train_loss: 0.9633, test_loss: 0.9884, test_f1: 0.4790
 epoch: 75, train_loss: 0.9531, test_loss: 0.9533, test_f1: 0.4954
 epoch: 76, train_loss: 0.9575, test_loss: 0.9737, test_f1: 0.5172
 epoch: 77, train_loss: 0.9458, test_loss: 0.9897, test_f1: 0.4802
 epoch: 78, train_loss: 0.9574, test_loss: 0.9873, test_f1: 0.5036
 epoch: 79, train_loss: 0.9658, test_loss: 0.9591, test_f1: 0.4694
 epoch: 80, train_loss: 0.9495, test_loss: 0.9789, test_f1: 0.5050
 epoch: 81, train_loss: 0.9450, test_loss: 0.9762, test_f1: 0.4783
 epoch: 82, train_loss: 0.9491, test_loss: 0.9775, test_f1: 0.5027
 epoch: 83, train_loss: 0.9683, test_loss: 0.9990, test_f1: 0.4670
 epoch: 84, train_loss: 0.9459, test_loss: 1.0072, test_f1: 0.4918
 epoch: 85, train_loss: 0.9517, test_loss: 1.0025, test_f1: 0.4836
 epoch: 86, train_loss: 0.9364, test_loss: 1.0093, test_f1: 0.4758
 epoch: 87, train_loss: 0.9524, test_loss: 1.0108, test_f1: 0.4850
 epoch: 88, train_loss: 0.9478, test_loss: 1.0079, test_f1: 0.4849
 epoch: 89, train_loss: 0.9403, test_loss: 0.9884, test_f1: 0.4752
 epoch: 90, train_loss: 0.9460, test_loss: 0.9956, test_f1: 0.4925
 epoch: 91, train_loss: 0.9443, test_loss: 0.9782, test_f1: 0.5009
 epoch: 92, train_loss: 0.9385, test_loss: 0.9513, test_f1: 0.4852
 epoch: 93, train_loss: 0.9446, test_loss: 0.9539, test_f1: 0.4960
 epoch: 94, train_loss: 0.9403, test_loss: 0.9733, test_f1: 0.4785
 epoch: 95, train_loss: 0.9355, test_loss: 0.9763, test_f1: 0.5085
 epoch: 96, train_loss: 0.9267, test_loss: 0.9878, test_f1: 0.4755
 epoch: 97, train_loss: 0.9400, test_loss: 0.9637, test_f1: 0.4769
 epoch: 98, train_loss: 0.9455, test_loss: 0.9971, test_f1: 0.4945
 epoch: 99, train_loss: 0.9317, test_loss: 0.9903, test_f1: 0.4900
##################ITERATION #8 ****************************************
 epoch: 0, train_loss: 1.9036, test_loss: 1.3641, test_f1: 0.2274
 epoch: 1, train_loss: 1.4089, test_loss: 1.3086, test_f1: 0.2645
 epoch: 2, train_loss: 1.3486, test_loss: 1.2597, test_f1: 0.2990
 epoch: 3, train_loss: 1.3199, test_loss: 1.2462, test_f1: 0.3104
 epoch: 4, train_loss: 1.2881, test_loss: 1.2299, test_f1: 0.3130
 epoch: 5, train_loss: 1.2722, test_loss: 1.2256, test_f1: 0.3270
 epoch: 6, train_loss: 1.2630, test_loss: 1.2016, test_f1: 0.3448
 epoch: 7, train_loss: 1.2414, test_loss: 1.1961, test_f1: 0.3511
 epoch: 8, train_loss: 1.2227, test_loss: 1.1810, test_f1: 0.3873
 epoch: 9, train_loss: 1.2162, test_loss: 1.1754, test_f1: 0.3930
 epoch: 10, train_loss: 1.2011, test_loss: 1.1536, test_f1: 0.4035
 epoch: 11, train_loss: 1.1955, test_loss: 1.1436, test_f1: 0.4017
 epoch: 12, train_loss: 1.1847, test_loss: 1.1338, test_f1: 0.4185
 epoch: 13, train_loss: 1.1778, test_loss: 1.1178, test_f1: 0.4463
 epoch: 14, train_loss: 1.1730, test_loss: 1.1075, test_f1: 0.4364
 epoch: 15, train_loss: 1.1563, test_loss: 1.1009, test_f1: 0.4493
 epoch: 16, train_loss: 1.1500, test_loss: 1.0860, test_f1: 0.4472
 epoch: 17, train_loss: 1.1440, test_loss: 1.0959, test_f1: 0.4414
 epoch: 18, train_loss: 1.1360, test_loss: 1.0798, test_f1: 0.4570
 epoch: 19, train_loss: 1.1309, test_loss: 1.0740, test_f1: 0.4500
 epoch: 20, train_loss: 1.1225, test_loss: 1.0707, test_f1: 0.4577
 epoch: 21, train_loss: 1.1049, test_loss: 1.0533, test_f1: 0.4536
 epoch: 22, train_loss: 1.1133, test_loss: 1.0629, test_f1: 0.4521
 epoch: 23, train_loss: 1.1084, test_loss: 1.0510, test_f1: 0.4722
 epoch: 24, train_loss: 1.0969, test_loss: 1.0405, test_f1: 0.4548
 epoch: 25, train_loss: 1.0800, test_loss: 1.0336, test_f1: 0.4521
 epoch: 26, train_loss: 1.0903, test_loss: 1.0439, test_f1: 0.4584
 epoch: 27, train_loss: 1.0763, test_loss: 1.0111, test_f1: 0.4692
 epoch: 28, train_loss: 1.0703, test_loss: 1.0146, test_f1: 0.4606
 epoch: 29, train_loss: 1.0558, test_loss: 1.0080, test_f1: 0.4699
 epoch: 30, train_loss: 1.0532, test_loss: 1.0018, test_f1: 0.4581
 epoch: 31, train_loss: 1.0558, test_loss: 0.9868, test_f1: 0.4592
 epoch: 32, train_loss: 1.0335, test_loss: 0.9918, test_f1: 0.4532
 epoch: 33, train_loss: 1.0317, test_loss: 0.9889, test_f1: 0.4709
 epoch: 34, train_loss: 1.0377, test_loss: 0.9637, test_f1: 0.4809
 epoch: 35, train_loss: 1.0375, test_loss: 0.9789, test_f1: 0.4783
 epoch: 36, train_loss: 1.0219, test_loss: 0.9827, test_f1: 0.4584
 epoch: 37, train_loss: 1.0083, test_loss: 0.9380, test_f1: 0.4836
 epoch: 38, train_loss: 0.9955, test_loss: 0.9443, test_f1: 0.4767
 epoch: 39, train_loss: 1.0022, test_loss: 0.9416, test_f1: 0.4752
 epoch: 40, train_loss: 0.9848, test_loss: 0.9360, test_f1: 0.4684
 epoch: 41, train_loss: 0.9811, test_loss: 0.9484, test_f1: 0.4559
 epoch: 42, train_loss: 0.9764, test_loss: 0.9285, test_f1: 0.4857
 epoch: 43, train_loss: 0.9782, test_loss: 0.9378, test_f1: 0.4731
 epoch: 44, train_loss: 0.9754, test_loss: 0.9341, test_f1: 0.4740
 epoch: 45, train_loss: 0.9670, test_loss: 0.9415, test_f1: 0.4646
 epoch: 46, train_loss: 0.9561, test_loss: 0.9341, test_f1: 0.4679
 epoch: 47, train_loss: 0.9549, test_loss: 0.9583, test_f1: 0.4736
 epoch: 48, train_loss: 0.9555, test_loss: 0.9404, test_f1: 0.4723
 epoch: 49, train_loss: 0.9564, test_loss: 0.9356, test_f1: 0.4781
 epoch: 50, train_loss: 0.9486, test_loss: 0.9277, test_f1: 0.4743
 epoch: 51, train_loss: 0.9437, test_loss: 0.9359, test_f1: 0.4837
 epoch: 52, train_loss: 0.9322, test_loss: 0.9269, test_f1: 0.4909
 epoch: 53, train_loss: 0.9309, test_loss: 0.9253, test_f1: 0.4907
 epoch: 54, train_loss: 0.9352, test_loss: 0.9355, test_f1: 0.4816
 epoch: 55, train_loss: 0.9345, test_loss: 0.9243, test_f1: 0.4754
 epoch: 56, train_loss: 0.9289, test_loss: 0.9170, test_f1: 0.4887
 epoch: 57, train_loss: 0.9200, test_loss: 0.9314, test_f1: 0.4834
 epoch: 58, train_loss: 0.9215, test_loss: 0.9249, test_f1: 0.4935
 epoch: 59, train_loss: 0.9242, test_loss: 0.9304, test_f1: 0.4885
 epoch: 60, train_loss: 0.9155, test_loss: 0.9278, test_f1: 0.4888
 epoch: 61, train_loss: 0.9169, test_loss: 0.9341, test_f1: 0.4906
 epoch: 62, train_loss: 0.9231, test_loss: 0.9205, test_f1: 0.4990
 epoch: 63, train_loss: 0.9218, test_loss: 0.9288, test_f1: 0.4878
 epoch: 64, train_loss: 0.9167, test_loss: 0.9280, test_f1: 0.4893
 epoch: 65, train_loss: 0.9131, test_loss: 0.9276, test_f1: 0.4912
 epoch: 66, train_loss: 0.9149, test_loss: 0.9456, test_f1: 0.4782
 epoch: 67, train_loss: 0.9106, test_loss: 0.9209, test_f1: 0.4976
 epoch: 68, train_loss: 0.9123, test_loss: 0.9279, test_f1: 0.5040
 epoch: 69, train_loss: 0.9050, test_loss: 0.9306, test_f1: 0.5036
 epoch: 70, train_loss: 0.9061, test_loss: 0.9369, test_f1: 0.4937
 epoch: 71, train_loss: 0.9043, test_loss: 0.9310, test_f1: 0.4937
 epoch: 72, train_loss: 0.9107, test_loss: 0.9327, test_f1: 0.4971
 epoch: 73, train_loss: 0.8987, test_loss: 0.9512, test_f1: 0.4952
 epoch: 74, train_loss: 0.9002, test_loss: 0.9349, test_f1: 0.4979
 epoch: 75, train_loss: 0.9040, test_loss: 0.9176, test_f1: 0.5113
 epoch: 76, train_loss: 0.8974, test_loss: 0.9540, test_f1: 0.5003
 epoch: 77, train_loss: 0.8995, test_loss: 0.9224, test_f1: 0.5128
 epoch: 78, train_loss: 0.9028, test_loss: 0.9495, test_f1: 0.4933
 epoch: 79, train_loss: 0.8949, test_loss: 0.9321, test_f1: 0.4992
 epoch: 80, train_loss: 0.8869, test_loss: 0.9450, test_f1: 0.4972
 epoch: 81, train_loss: 0.8974, test_loss: 0.9330, test_f1: 0.5000
 epoch: 82, train_loss: 0.8970, test_loss: 0.9428, test_f1: 0.4908
 epoch: 83, train_loss: 0.8974, test_loss: 0.9409, test_f1: 0.5016
 epoch: 84, train_loss: 0.8870, test_loss: 0.9213, test_f1: 0.5043
 epoch: 85, train_loss: 0.8921, test_loss: 0.9456, test_f1: 0.4947
 epoch: 86, train_loss: 0.8907, test_loss: 0.9369, test_f1: 0.4938
 epoch: 87, train_loss: 0.9010, test_loss: 0.9323, test_f1: 0.5011
 epoch: 88, train_loss: 0.8952, test_loss: 0.9336, test_f1: 0.4991
 epoch: 89, train_loss: 0.8883, test_loss: 0.9468, test_f1: 0.5023
 epoch: 90, train_loss: 0.8850, test_loss: 0.9320, test_f1: 0.5009
 epoch: 91, train_loss: 0.8881, test_loss: 0.9369, test_f1: 0.4976
 epoch: 92, train_loss: 0.8867, test_loss: 0.9450, test_f1: 0.5005
 epoch: 93, train_loss: 0.8820, test_loss: 0.9331, test_f1: 0.4961
 epoch: 94, train_loss: 0.8845, test_loss: 0.9649, test_f1: 0.4982
 epoch: 95, train_loss: 0.8843, test_loss: 0.9304, test_f1: 0.5012
 epoch: 96, train_loss: 0.8881, test_loss: 0.9311, test_f1: 0.5002
 epoch: 97, train_loss: 0.8947, test_loss: 0.9372, test_f1: 0.5038
 epoch: 98, train_loss: 0.8833, test_loss: 0.9220, test_f1: 0.5060
 epoch: 99, train_loss: 0.8835, test_loss: 0.9409, test_f1: 0.5034
##################ITERATION #9 ****************************************
 epoch: 0, train_loss: 1.5075, test_loss: 1.2897, test_f1: 0.2868
 epoch: 1, train_loss: 1.3040, test_loss: 1.2432, test_f1: 0.2701
 epoch: 2, train_loss: 1.2646, test_loss: 1.2147, test_f1: 0.3087
 epoch: 3, train_loss: 1.2531, test_loss: 1.1934, test_f1: 0.3373
 epoch: 4, train_loss: 1.2352, test_loss: 1.1855, test_f1: 0.3513
 epoch: 5, train_loss: 1.2290, test_loss: 1.1702, test_f1: 0.3589
 epoch: 6, train_loss: 1.2159, test_loss: 1.1513, test_f1: 0.3940
 epoch: 7, train_loss: 1.2072, test_loss: 1.1579, test_f1: 0.3802
 epoch: 8, train_loss: 1.1969, test_loss: 1.1444, test_f1: 0.3879
 epoch: 9, train_loss: 1.1836, test_loss: 1.1366, test_f1: 0.3912
 epoch: 10, train_loss: 1.1835, test_loss: 1.1228, test_f1: 0.3968
 epoch: 11, train_loss: 1.1647, test_loss: 1.1098, test_f1: 0.4121
 epoch: 12, train_loss: 1.1587, test_loss: 1.0984, test_f1: 0.4282
 epoch: 13, train_loss: 1.1490, test_loss: 1.0922, test_f1: 0.4154
 epoch: 14, train_loss: 1.1349, test_loss: 1.0722, test_f1: 0.4485
 epoch: 15, train_loss: 1.1207, test_loss: 1.0579, test_f1: 0.4287
 epoch: 16, train_loss: 1.1120, test_loss: 1.0426, test_f1: 0.4400
 epoch: 17, train_loss: 1.1052, test_loss: 1.0426, test_f1: 0.4534
 epoch: 18, train_loss: 1.0903, test_loss: 1.0200, test_f1: 0.4590
 epoch: 19, train_loss: 1.0831, test_loss: 1.0128, test_f1: 0.4631
 epoch: 20, train_loss: 1.0768, test_loss: 1.0115, test_f1: 0.4590
 epoch: 21, train_loss: 1.0685, test_loss: 1.0031, test_f1: 0.4687
 epoch: 22, train_loss: 1.0748, test_loss: 1.0158, test_f1: 0.4474
 epoch: 23, train_loss: 1.0616, test_loss: 0.9881, test_f1: 0.4559
 epoch: 24, train_loss: 1.0568, test_loss: 0.9820, test_f1: 0.4633
 epoch: 25, train_loss: 1.0562, test_loss: 0.9592, test_f1: 0.4888
 epoch: 26, train_loss: 1.0529, test_loss: 0.9666, test_f1: 0.4795
 epoch: 27, train_loss: 1.0409, test_loss: 0.9641, test_f1: 0.4701
 epoch: 28, train_loss: 1.0316, test_loss: 0.9574, test_f1: 0.4676
 epoch: 29, train_loss: 1.0148, test_loss: 0.9444, test_f1: 0.4856
 epoch: 30, train_loss: 1.0339, test_loss: 0.9495, test_f1: 0.4822
 epoch: 31, train_loss: 1.0095, test_loss: 0.9493, test_f1: 0.4872
 epoch: 32, train_loss: 1.0181, test_loss: 0.9539, test_f1: 0.4875
 epoch: 33, train_loss: 1.0132, test_loss: 0.9543, test_f1: 0.4807
 epoch: 34, train_loss: 1.0086, test_loss: 0.9336, test_f1: 0.4903
 epoch: 35, train_loss: 1.0094, test_loss: 0.9570, test_f1: 0.4842
 epoch: 36, train_loss: 1.0028, test_loss: 0.9300, test_f1: 0.4911
 epoch: 37, train_loss: 0.9922, test_loss: 0.9199, test_f1: 0.5076
 epoch: 38, train_loss: 0.9961, test_loss: 0.9477, test_f1: 0.4918
 epoch: 39, train_loss: 0.9923, test_loss: 0.9561, test_f1: 0.4877
 epoch: 40, train_loss: 0.9849, test_loss: 0.9199, test_f1: 0.5030
 epoch: 41, train_loss: 0.9976, test_loss: 0.9211, test_f1: 0.5055
 epoch: 42, train_loss: 0.9838, test_loss: 0.9178, test_f1: 0.5037
 epoch: 43, train_loss: 0.9768, test_loss: 0.9223, test_f1: 0.4905
 epoch: 44, train_loss: 0.9754, test_loss: 0.9206, test_f1: 0.5088
 epoch: 45, train_loss: 0.9727, test_loss: 0.9168, test_f1: 0.5009
 epoch: 46, train_loss: 0.9821, test_loss: 0.9239, test_f1: 0.4938
 epoch: 47, train_loss: 0.9792, test_loss: 0.9381, test_f1: 0.4863
 epoch: 48, train_loss: 0.9646, test_loss: 0.9346, test_f1: 0.4919
 epoch: 49, train_loss: 0.9603, test_loss: 0.9151, test_f1: 0.4976
 epoch: 50, train_loss: 0.9542, test_loss: 0.9280, test_f1: 0.4828
 epoch: 51, train_loss: 0.9588, test_loss: 0.9081, test_f1: 0.5025
 epoch: 52, train_loss: 0.9507, test_loss: 0.9089, test_f1: 0.5035
 epoch: 53, train_loss: 0.9470, test_loss: 0.9132, test_f1: 0.4950
 epoch: 54, train_loss: 0.9466, test_loss: 0.9107, test_f1: 0.4977
 epoch: 55, train_loss: 0.9465, test_loss: 0.9006, test_f1: 0.5105
 epoch: 56, train_loss: 0.9495, test_loss: 0.9029, test_f1: 0.5026
 epoch: 57, train_loss: 0.9398, test_loss: 0.9110, test_f1: 0.4983
 epoch: 58, train_loss: 0.9368, test_loss: 0.8998, test_f1: 0.5002
 epoch: 59, train_loss: 0.9474, test_loss: 0.9044, test_f1: 0.4972
 epoch: 60, train_loss: 0.9284, test_loss: 0.9111, test_f1: 0.4953
 epoch: 61, train_loss: 0.9340, test_loss: 0.9160, test_f1: 0.4877
 epoch: 62, train_loss: 0.9312, test_loss: 0.9041, test_f1: 0.5051
 epoch: 63, train_loss: 0.9348, test_loss: 0.9100, test_f1: 0.4886
 epoch: 64, train_loss: 0.9363, test_loss: 0.9138, test_f1: 0.4817
 epoch: 65, train_loss: 0.9233, test_loss: 0.9043, test_f1: 0.4973
 epoch: 66, train_loss: 0.9244, test_loss: 0.9121, test_f1: 0.4954
 epoch: 67, train_loss: 0.9320, test_loss: 0.9100, test_f1: 0.5060
 epoch: 68, train_loss: 0.9254, test_loss: 0.9037, test_f1: 0.4944
 epoch: 69, train_loss: 0.9210, test_loss: 0.8998, test_f1: 0.4906
 epoch: 70, train_loss: 0.9229, test_loss: 0.9183, test_f1: 0.4823
 epoch: 71, train_loss: 0.9105, test_loss: 0.9177, test_f1: 0.4878
 epoch: 72, train_loss: 0.9303, test_loss: 0.9138, test_f1: 0.5035
 epoch: 73, train_loss: 0.9233, test_loss: 0.9064, test_f1: 0.4974
 epoch: 74, train_loss: 0.9219, test_loss: 0.9170, test_f1: 0.4864
 epoch: 75, train_loss: 0.9305, test_loss: 0.9127, test_f1: 0.4945
 epoch: 76, train_loss: 0.9206, test_loss: 0.9135, test_f1: 0.4885
 epoch: 77, train_loss: 0.9070, test_loss: 0.9026, test_f1: 0.4860
 epoch: 78, train_loss: 0.9071, test_loss: 0.9073, test_f1: 0.4938
 epoch: 79, train_loss: 0.9211, test_loss: 0.9163, test_f1: 0.4867
 epoch: 80, train_loss: 0.9287, test_loss: 0.8995, test_f1: 0.5045
 epoch: 81, train_loss: 0.9166, test_loss: 0.9159, test_f1: 0.4888
 epoch: 82, train_loss: 0.9031, test_loss: 0.9037, test_f1: 0.4855
 epoch: 83, train_loss: 0.9151, test_loss: 0.9136, test_f1: 0.4912
 epoch: 84, train_loss: 0.9055, test_loss: 0.9115, test_f1: 0.4913
 epoch: 85, train_loss: 0.9165, test_loss: 0.9205, test_f1: 0.4776
 epoch: 86, train_loss: 0.9054, test_loss: 0.9047, test_f1: 0.4927
 epoch: 87, train_loss: 0.9146, test_loss: 0.9144, test_f1: 0.4888
 epoch: 88, train_loss: 0.9051, test_loss: 0.9103, test_f1: 0.4917
 epoch: 89, train_loss: 0.9058, test_loss: 0.9229, test_f1: 0.4910
 epoch: 90, train_loss: 0.9026, test_loss: 0.9160, test_f1: 0.4906
 epoch: 91, train_loss: 0.8975, test_loss: 0.9249, test_f1: 0.4844
 epoch: 92, train_loss: 0.9070, test_loss: 0.9189, test_f1: 0.4868
 epoch: 93, train_loss: 0.9021, test_loss: 0.9075, test_f1: 0.4887
 epoch: 94, train_loss: 0.9094, test_loss: 0.9049, test_f1: 0.4896
 epoch: 95, train_loss: 0.8865, test_loss: 0.9346, test_f1: 0.4843
 epoch: 96, train_loss: 0.8947, test_loss: 0.9222, test_f1: 0.4938
 epoch: 97, train_loss: 0.9025, test_loss: 0.9304, test_f1: 0.4765
 epoch: 98, train_loss: 0.8809, test_loss: 0.9207, test_f1: 0.4922
 epoch: 99, train_loss: 0.8961, test_loss: 0.9195, test_f1: 0.4852

Training completed in 482.46 seconds
Best F1: 0.5278 at epoch 98
Mean F1 across iterations: 0.5034  0.0142
========================FINAL RESULTS================================
FEGIN weighted F1: 0.5278  0.0142
python main.py --data ltspice_examples --representation component_component --model FEGIN --layers 4 --hiddens 16 --batch_size 128 --lr 0.001 --emb_size 250 --epochs 100 --save_appendix component_component_L4_H16_BS128_LR0.001_E250 --no_val
-----



STDERR:
  File "main.py", line 370, in <module>
    main()
  File "main.py", line 254, in main
    dataset = dataset_class(
  File "/home/philip/projects/ltspice_examples_code_repo/Circuit-Completion-Using-GNNs/component_classification_with_link_prediction_head/evaluation/FEGIN/kernel/circuit_datasets.py", line 15, in __init__
    self.data, self.slices = torch.load(self.processed_paths[0])
  File "/home/philip/.local/lib/python3.8/site-packages/torch/serialization.py", line 1040, in load
    warnings.warn(
  File "/usr/lib/python3.8/warnings.py", line 109, in _showwarnmsg
    sw(msg.message, msg.category, msg.filename, msg.lineno,
  File "main.py", line 47, in warn_with_traceback
    traceback.print_stack(file=log)
/home/philip/projects/ltspice_examples_code_repo/Circuit-Completion-Using-GNNs/component_classification_with_link_prediction_head/evaluation/FEGIN/kernel/circuit_datasets.py:15: FutureWarning: You are using `torch.load` with `weights_only=False` (the current default value), which uses the default pickle module implicitly. It is possible to construct malicious pickle data which will execute arbitrary code during unpickling (See https://github.com/pytorch/pytorch/blob/main/SECURITY.md#untrusted-models for more details). In a future release, the default value for `weights_only` will be flipped to `True`. This limits the functions that could be executed during unpickling. Arbitrary objects will no longer be allowed to be loaded via this mode unless they are explicitly allowlisted by the user via `torch.serialization.add_safe_globals`. We recommend you start setting `weights_only=True` for any use case where you don't have full control of the loaded file. Please open an issue on GitHub for any issues related to this experimental feature.
  self.data, self.slices = torch.load(self.processed_paths[0])
