STDOUT:
Results will be saved in /home/philip/projects/ltspice_examples_code_repo/Circuit-Completion-Using-GNNs/component_classification_with_link_prediction_head/evaluation/FEGIN/results/model_FEGIN_dataset_ltspice_demos
Command line input: python main.py --data ltspice_demos --representation component_pin_net --model FEGIN --layers 2 --hiddens 64 --batch_size 32 --lr 0.001 --emb_size 128 --epochs 100 --save_appendix component_pin_net_L2_H64_BS32_LR0.001_E128 --no_val
 is saved.
-----
ltspice_demos - FEGIN
Using 2 layers, 64 hidden units, h = 2
Loading component_pin_net representation dataset
ENTERED
Training FEGIN on component_pin_net representation
Train: 1565, Test: 383
##################ITERATION #0 ****************************************
 epoch: 0, train_loss: 1.2237, test_loss: 1.2949, test_f1: 0.3394
 epoch: 1, train_loss: 1.0480, test_loss: 1.0957, test_f1: 0.4481
 epoch: 2, train_loss: 1.0108, test_loss: 1.0767, test_f1: 0.4617
 epoch: 3, train_loss: 0.9805, test_loss: 1.0312, test_f1: 0.5035
 epoch: 4, train_loss: 0.9649, test_loss: 1.0655, test_f1: 0.4920
 epoch: 5, train_loss: 0.9426, test_loss: 1.0361, test_f1: 0.5401
 epoch: 6, train_loss: 0.9154, test_loss: 0.9972, test_f1: 0.5686
 epoch: 7, train_loss: 0.8985, test_loss: 0.9933, test_f1: 0.5472
 epoch: 8, train_loss: 0.8819, test_loss: 0.9624, test_f1: 0.5568
 epoch: 9, train_loss: 0.8591, test_loss: 0.9828, test_f1: 0.5749
 epoch: 10, train_loss: 0.8559, test_loss: 0.9719, test_f1: 0.5705
 epoch: 11, train_loss: 0.8288, test_loss: 0.9487, test_f1: 0.5874
 epoch: 12, train_loss: 0.8150, test_loss: 0.9215, test_f1: 0.5853
 epoch: 13, train_loss: 0.8101, test_loss: 0.9582, test_f1: 0.5805
 epoch: 14, train_loss: 0.7923, test_loss: 0.9342, test_f1: 0.6135
 epoch: 15, train_loss: 0.7702, test_loss: 0.9723, test_f1: 0.5591
 epoch: 16, train_loss: 0.7459, test_loss: 0.9169, test_f1: 0.6397
 epoch: 17, train_loss: 0.7281, test_loss: 0.9082, test_f1: 0.6167
 epoch: 18, train_loss: 0.7027, test_loss: 0.9474, test_f1: 0.6335
 epoch: 19, train_loss: 0.7102, test_loss: 0.9437, test_f1: 0.5869
 epoch: 20, train_loss: 0.6667, test_loss: 1.0399, test_f1: 0.5477
 epoch: 21, train_loss: 0.6761, test_loss: 0.9723, test_f1: 0.6522
 epoch: 22, train_loss: 0.6538, test_loss: 1.0849, test_f1: 0.5276
 epoch: 23, train_loss: 0.6511, test_loss: 1.0242, test_f1: 0.6123
 epoch: 24, train_loss: 0.6601, test_loss: 0.9778, test_f1: 0.6360
 epoch: 25, train_loss: 0.6513, test_loss: 0.9477, test_f1: 0.6319
 epoch: 26, train_loss: 0.6223, test_loss: 0.9761, test_f1: 0.6074
 epoch: 27, train_loss: 0.6137, test_loss: 0.9858, test_f1: 0.6632
 epoch: 28, train_loss: 0.5969, test_loss: 1.0230, test_f1: 0.6384
 epoch: 29, train_loss: 0.6010, test_loss: 1.0641, test_f1: 0.6305
 epoch: 30, train_loss: 0.5900, test_loss: 0.9649, test_f1: 0.6249
 epoch: 31, train_loss: 0.5729, test_loss: 1.0484, test_f1: 0.6423
 epoch: 32, train_loss: 0.5653, test_loss: 1.0712, test_f1: 0.6524
 epoch: 33, train_loss: 0.5321, test_loss: 1.1504, test_f1: 0.6718
 epoch: 34, train_loss: 0.5557, test_loss: 1.0422, test_f1: 0.6296
 epoch: 35, train_loss: 0.5317, test_loss: 1.1631, test_f1: 0.5886
 epoch: 36, train_loss: 0.5143, test_loss: 1.1147, test_f1: 0.6340
 epoch: 37, train_loss: 0.5159, test_loss: 1.1414, test_f1: 0.5884
 epoch: 38, train_loss: 0.5118, test_loss: 1.0551, test_f1: 0.6995
 epoch: 39, train_loss: 0.5144, test_loss: 1.3965, test_f1: 0.5639
 epoch: 40, train_loss: 0.4799, test_loss: 1.2173, test_f1: 0.5868
 epoch: 41, train_loss: 0.4898, test_loss: 1.2093, test_f1: 0.5834
 epoch: 42, train_loss: 0.4967, test_loss: 1.1243, test_f1: 0.6445
 epoch: 43, train_loss: 0.4535, test_loss: 1.1594, test_f1: 0.6484
 epoch: 44, train_loss: 0.4572, test_loss: 1.2857, test_f1: 0.6571
 epoch: 45, train_loss: 0.4417, test_loss: 1.3720, test_f1: 0.6529
 epoch: 46, train_loss: 0.4751, test_loss: 1.1963, test_f1: 0.6802
 epoch: 47, train_loss: 0.4573, test_loss: 1.2049, test_f1: 0.5888
 epoch: 48, train_loss: 0.4182, test_loss: 1.2831, test_f1: 0.6186
 epoch: 49, train_loss: 0.4110, test_loss: 1.2867, test_f1: 0.6288
 epoch: 50, train_loss: 0.4032, test_loss: 1.3795, test_f1: 0.6428
 epoch: 51, train_loss: 0.3730, test_loss: 1.3510, test_f1: 0.6456
 epoch: 52, train_loss: 0.3499, test_loss: 1.3540, test_f1: 0.6639
 epoch: 53, train_loss: 0.3787, test_loss: 1.4106, test_f1: 0.6522
 epoch: 54, train_loss: 0.3520, test_loss: 1.3689, test_f1: 0.6512
 epoch: 55, train_loss: 0.3344, test_loss: 1.3615, test_f1: 0.6383
 epoch: 56, train_loss: 0.3124, test_loss: 1.4395, test_f1: 0.6319
 epoch: 57, train_loss: 0.3230, test_loss: 1.5478, test_f1: 0.6063
 epoch: 58, train_loss: 0.3278, test_loss: 1.5872, test_f1: 0.6150
 epoch: 59, train_loss: 0.3121, test_loss: 1.5044, test_f1: 0.6153
 epoch: 60, train_loss: 0.3391, test_loss: 1.5066, test_f1: 0.6566
 epoch: 61, train_loss: 0.3039, test_loss: 1.5083, test_f1: 0.6374
 epoch: 62, train_loss: 0.3225, test_loss: 1.6507, test_f1: 0.6239
 epoch: 63, train_loss: 0.3131, test_loss: 1.6773, test_f1: 0.5852
 epoch: 64, train_loss: 0.3114, test_loss: 1.5582, test_f1: 0.6457
 epoch: 65, train_loss: 0.2867, test_loss: 1.6239, test_f1: 0.6332
 epoch: 66, train_loss: 0.2851, test_loss: 1.6789, test_f1: 0.6327
 epoch: 67, train_loss: 0.2801, test_loss: 1.6716, test_f1: 0.6268
 epoch: 68, train_loss: 0.2790, test_loss: 1.7880, test_f1: 0.6297
 epoch: 69, train_loss: 0.2717, test_loss: 1.7486, test_f1: 0.6261
 epoch: 70, train_loss: 0.2900, test_loss: 1.8118, test_f1: 0.6156
 epoch: 71, train_loss: 0.2722, test_loss: 1.7871, test_f1: 0.6334
 epoch: 72, train_loss: 0.2764, test_loss: 1.7263, test_f1: 0.6353
 epoch: 73, train_loss: 0.2893, test_loss: 1.8536, test_f1: 0.6353
 epoch: 74, train_loss: 0.2566, test_loss: 1.8574, test_f1: 0.6054
 epoch: 75, train_loss: 0.2779, test_loss: 1.9028, test_f1: 0.6198
 epoch: 76, train_loss: 0.2923, test_loss: 1.8724, test_f1: 0.6112
 epoch: 77, train_loss: 0.2735, test_loss: 1.7661, test_f1: 0.6506
 epoch: 78, train_loss: 0.2229, test_loss: 1.8031, test_f1: 0.6208
 epoch: 79, train_loss: 0.2615, test_loss: 1.8867, test_f1: 0.5921
 epoch: 80, train_loss: 0.2367, test_loss: 1.9822, test_f1: 0.6124
 epoch: 81, train_loss: 0.2334, test_loss: 2.0512, test_f1: 0.6273
 epoch: 82, train_loss: 0.2122, test_loss: 1.9946, test_f1: 0.6349
 epoch: 83, train_loss: 0.2204, test_loss: 1.9612, test_f1: 0.6614
 epoch: 84, train_loss: 0.2195, test_loss: 2.1454, test_f1: 0.6291
 epoch: 85, train_loss: 0.2457, test_loss: 2.1852, test_f1: 0.6128
 epoch: 86, train_loss: 0.2327, test_loss: 2.1170, test_f1: 0.6054
 epoch: 87, train_loss: 0.2511, test_loss: 2.0375, test_f1: 0.6347
 epoch: 88, train_loss: 0.2030, test_loss: 2.1028, test_f1: 0.6063
 epoch: 89, train_loss: 0.2128, test_loss: 2.2338, test_f1: 0.6161
 epoch: 90, train_loss: 0.2234, test_loss: 2.5157, test_f1: 0.6070
 epoch: 91, train_loss: 0.2047, test_loss: 2.3723, test_f1: 0.6012
 epoch: 92, train_loss: 0.2123, test_loss: 2.1925, test_f1: 0.6335
 epoch: 93, train_loss: 0.2168, test_loss: 2.3103, test_f1: 0.6035
 epoch: 94, train_loss: 0.1988, test_loss: 2.3716, test_f1: 0.6044
 epoch: 95, train_loss: 0.2050, test_loss: 2.2560, test_f1: 0.6253
 epoch: 96, train_loss: 0.2218, test_loss: 2.1406, test_f1: 0.6266
 epoch: 97, train_loss: 0.2319, test_loss: 2.3317, test_f1: 0.5821
 epoch: 98, train_loss: 0.2188, test_loss: 2.1448, test_f1: 0.5850
 epoch: 99, train_loss: 0.2011, test_loss: 2.6207, test_f1: 0.5764
##################ITERATION #1 ****************************************
 epoch: 0, train_loss: 1.1276, test_loss: 1.1148, test_f1: 0.4346
 epoch: 1, train_loss: 0.9749, test_loss: 1.0724, test_f1: 0.5197
 epoch: 2, train_loss: 0.9317, test_loss: 0.9960, test_f1: 0.5752
 epoch: 3, train_loss: 0.9092, test_loss: 1.0068, test_f1: 0.5744
 epoch: 4, train_loss: 0.8893, test_loss: 1.0275, test_f1: 0.5527
 epoch: 5, train_loss: 0.8580, test_loss: 1.0024, test_f1: 0.5764
 epoch: 6, train_loss: 0.8249, test_loss: 0.9857, test_f1: 0.5506
 epoch: 7, train_loss: 0.8112, test_loss: 0.9566, test_f1: 0.5297
 epoch: 8, train_loss: 0.7925, test_loss: 0.9676, test_f1: 0.5455
 epoch: 9, train_loss: 0.7876, test_loss: 0.9527, test_f1: 0.5553
 epoch: 10, train_loss: 0.7401, test_loss: 0.9605, test_f1: 0.5765
 epoch: 11, train_loss: 0.7431, test_loss: 1.0926, test_f1: 0.4847
 epoch: 12, train_loss: 0.7262, test_loss: 0.9771, test_f1: 0.6060
 epoch: 13, train_loss: 0.7125, test_loss: 0.9666, test_f1: 0.6151
 epoch: 14, train_loss: 0.6885, test_loss: 0.9724, test_f1: 0.6156
 epoch: 15, train_loss: 0.6764, test_loss: 1.0433, test_f1: 0.5755
 epoch: 16, train_loss: 0.6795, test_loss: 0.9460, test_f1: 0.6457
 epoch: 17, train_loss: 0.6556, test_loss: 1.0534, test_f1: 0.5209
 epoch: 18, train_loss: 0.6534, test_loss: 0.9712, test_f1: 0.6222
 epoch: 19, train_loss: 0.6393, test_loss: 0.9827, test_f1: 0.6127
 epoch: 20, train_loss: 0.6242, test_loss: 0.9781, test_f1: 0.6288
 epoch: 21, train_loss: 0.6278, test_loss: 0.9671, test_f1: 0.6425
 epoch: 22, train_loss: 0.6070, test_loss: 1.0269, test_f1: 0.5596
 epoch: 23, train_loss: 0.6095, test_loss: 1.0438, test_f1: 0.6293
 epoch: 24, train_loss: 0.5878, test_loss: 0.9936, test_f1: 0.6323
 epoch: 25, train_loss: 0.5901, test_loss: 0.9685, test_f1: 0.6510
 epoch: 26, train_loss: 0.5525, test_loss: 1.1057, test_f1: 0.6130
 epoch: 27, train_loss: 0.5535, test_loss: 0.9717, test_f1: 0.6322
 epoch: 28, train_loss: 0.5529, test_loss: 1.1017, test_f1: 0.6037
 epoch: 29, train_loss: 0.5453, test_loss: 1.1720, test_f1: 0.6176
 epoch: 30, train_loss: 0.5087, test_loss: 1.0307, test_f1: 0.6418
 epoch: 31, train_loss: 0.5645, test_loss: 1.1481, test_f1: 0.5867
 epoch: 32, train_loss: 0.5232, test_loss: 1.1579, test_f1: 0.6595
 epoch: 33, train_loss: 0.5133, test_loss: 1.1992, test_f1: 0.6124
 epoch: 34, train_loss: 0.5074, test_loss: 1.2408, test_f1: 0.5896
 epoch: 35, train_loss: 0.5009, test_loss: 1.2203, test_f1: 0.5744
 epoch: 36, train_loss: 0.5096, test_loss: 1.3059, test_f1: 0.6296
 epoch: 37, train_loss: 0.4758, test_loss: 1.1489, test_f1: 0.6364
 epoch: 38, train_loss: 0.4912, test_loss: 1.2365, test_f1: 0.6125
 epoch: 39, train_loss: 0.4672, test_loss: 1.3270, test_f1: 0.5854
 epoch: 40, train_loss: 0.4465, test_loss: 1.3426, test_f1: 0.6226
 epoch: 41, train_loss: 0.4440, test_loss: 1.4438, test_f1: 0.6146
 epoch: 42, train_loss: 0.4531, test_loss: 1.4515, test_f1: 0.6198
 epoch: 43, train_loss: 0.4598, test_loss: 1.2478, test_f1: 0.6041
 epoch: 44, train_loss: 0.4456, test_loss: 1.5467, test_f1: 0.5807
 epoch: 45, train_loss: 0.4267, test_loss: 1.5204, test_f1: 0.6001
 epoch: 46, train_loss: 0.4545, test_loss: 1.7199, test_f1: 0.5716
 epoch: 47, train_loss: 0.4274, test_loss: 1.3311, test_f1: 0.5997
 epoch: 48, train_loss: 0.4478, test_loss: 1.4084, test_f1: 0.5732
 epoch: 49, train_loss: 0.4414, test_loss: 1.4001, test_f1: 0.5751
 epoch: 50, train_loss: 0.4152, test_loss: 1.6068, test_f1: 0.5815
 epoch: 51, train_loss: 0.3973, test_loss: 1.5777, test_f1: 0.6239
 epoch: 52, train_loss: 0.3516, test_loss: 1.5910, test_f1: 0.6151
 epoch: 53, train_loss: 0.3614, test_loss: 1.5769, test_f1: 0.6186
 epoch: 54, train_loss: 0.3371, test_loss: 1.5838, test_f1: 0.6154
 epoch: 55, train_loss: 0.3415, test_loss: 1.5814, test_f1: 0.6264
 epoch: 56, train_loss: 0.3143, test_loss: 1.6848, test_f1: 0.5888
 epoch: 57, train_loss: 0.3239, test_loss: 1.6357, test_f1: 0.6265
 epoch: 58, train_loss: 0.3394, test_loss: 1.6804, test_f1: 0.6091
 epoch: 59, train_loss: 0.3168, test_loss: 1.7384, test_f1: 0.6051
 epoch: 60, train_loss: 0.3232, test_loss: 1.7716, test_f1: 0.6034
 epoch: 61, train_loss: 0.3294, test_loss: 1.7236, test_f1: 0.6241
 epoch: 62, train_loss: 0.3122, test_loss: 1.6254, test_f1: 0.6049
 epoch: 63, train_loss: 0.3128, test_loss: 1.9086, test_f1: 0.6168
 epoch: 64, train_loss: 0.3149, test_loss: 1.7417, test_f1: 0.6279
 epoch: 65, train_loss: 0.3011, test_loss: 1.7888, test_f1: 0.6020
 epoch: 66, train_loss: 0.3058, test_loss: 1.8840, test_f1: 0.6201
 epoch: 67, train_loss: 0.2917, test_loss: 1.8266, test_f1: 0.5997
 epoch: 68, train_loss: 0.2807, test_loss: 1.9038, test_f1: 0.5979
 epoch: 69, train_loss: 0.3142, test_loss: 1.9190, test_f1: 0.6265
 epoch: 70, train_loss: 0.2856, test_loss: 2.0316, test_f1: 0.6083
 epoch: 71, train_loss: 0.2580, test_loss: 1.9443, test_f1: 0.6153
 epoch: 72, train_loss: 0.2854, test_loss: 2.0314, test_f1: 0.6410
 epoch: 73, train_loss: 0.2798, test_loss: 2.1046, test_f1: 0.6263
 epoch: 74, train_loss: 0.2968, test_loss: 1.9355, test_f1: 0.6081
 epoch: 75, train_loss: 0.2804, test_loss: 2.0078, test_f1: 0.6268
 epoch: 76, train_loss: 0.2744, test_loss: 1.9354, test_f1: 0.6416
 epoch: 77, train_loss: 0.2640, test_loss: 1.8741, test_f1: 0.6221
 epoch: 78, train_loss: 0.2598, test_loss: 2.0530, test_f1: 0.5974
 epoch: 79, train_loss: 0.3094, test_loss: 2.1156, test_f1: 0.6186
 epoch: 80, train_loss: 0.2583, test_loss: 2.1198, test_f1: 0.6246
 epoch: 81, train_loss: 0.2717, test_loss: 2.1421, test_f1: 0.6080
 epoch: 82, train_loss: 0.2780, test_loss: 1.9996, test_f1: 0.6330
 epoch: 83, train_loss: 0.2600, test_loss: 1.9936, test_f1: 0.6327
 epoch: 84, train_loss: 0.2468, test_loss: 2.1490, test_f1: 0.5970
 epoch: 85, train_loss: 0.2618, test_loss: 2.0099, test_f1: 0.6071
 epoch: 86, train_loss: 0.2573, test_loss: 2.1182, test_f1: 0.5936
 epoch: 87, train_loss: 0.2499, test_loss: 2.1546, test_f1: 0.6019
 epoch: 88, train_loss: 0.2405, test_loss: 2.1246, test_f1: 0.6118
 epoch: 89, train_loss: 0.2383, test_loss: 2.1665, test_f1: 0.6146
 epoch: 90, train_loss: 0.2562, test_loss: 2.2030, test_f1: 0.5971
 epoch: 91, train_loss: 0.2622, test_loss: 2.1250, test_f1: 0.6125
 epoch: 92, train_loss: 0.2578, test_loss: 2.1961, test_f1: 0.6104
 epoch: 93, train_loss: 0.2280, test_loss: 2.2425, test_f1: 0.6029
 epoch: 94, train_loss: 0.2650, test_loss: 2.3417, test_f1: 0.6289
 epoch: 95, train_loss: 0.2061, test_loss: 2.2327, test_f1: 0.6147
 epoch: 96, train_loss: 0.2341, test_loss: 2.3257, test_f1: 0.6230
 epoch: 97, train_loss: 0.2284, test_loss: 2.3543, test_f1: 0.5993
 epoch: 98, train_loss: 0.2466, test_loss: 2.3507, test_f1: 0.6220
 epoch: 99, train_loss: 0.2288, test_loss: 2.3201, test_f1: 0.6031
##################ITERATION #2 ****************************************
 epoch: 0, train_loss: 1.1064, test_loss: 1.2730, test_f1: 0.1890
 epoch: 1, train_loss: 0.9731, test_loss: 1.0239, test_f1: 0.5415
 epoch: 2, train_loss: 0.9096, test_loss: 0.9941, test_f1: 0.5698
 epoch: 3, train_loss: 0.8961, test_loss: 0.9912, test_f1: 0.5614
 epoch: 4, train_loss: 0.8465, test_loss: 1.0449, test_f1: 0.5418
 epoch: 5, train_loss: 0.8305, test_loss: 0.9758, test_f1: 0.5794
 epoch: 6, train_loss: 0.8110, test_loss: 1.0108, test_f1: 0.5495
 epoch: 7, train_loss: 0.7709, test_loss: 1.0245, test_f1: 0.5195
 epoch: 8, train_loss: 0.7583, test_loss: 1.0506, test_f1: 0.5365
 epoch: 9, train_loss: 0.7618, test_loss: 1.0228, test_f1: 0.5898
 epoch: 10, train_loss: 0.7326, test_loss: 0.9977, test_f1: 0.5745
 epoch: 11, train_loss: 0.7263, test_loss: 1.0095, test_f1: 0.5935
 epoch: 12, train_loss: 0.7278, test_loss: 1.0173, test_f1: 0.5822
 epoch: 13, train_loss: 0.7064, test_loss: 1.0942, test_f1: 0.5409
 epoch: 14, train_loss: 0.6756, test_loss: 1.0846, test_f1: 0.5814
 epoch: 15, train_loss: 0.6446, test_loss: 1.0588, test_f1: 0.5829
 epoch: 16, train_loss: 0.6452, test_loss: 1.0475, test_f1: 0.5583
 epoch: 17, train_loss: 0.6468, test_loss: 1.0703, test_f1: 0.5762
 epoch: 18, train_loss: 0.6510, test_loss: 1.2016, test_f1: 0.5642
 epoch: 19, train_loss: 0.6208, test_loss: 1.0663, test_f1: 0.5920
 epoch: 20, train_loss: 0.6228, test_loss: 1.1637, test_f1: 0.5738
 epoch: 21, train_loss: 0.5997, test_loss: 1.2761, test_f1: 0.5528
 epoch: 22, train_loss: 0.5803, test_loss: 1.1540, test_f1: 0.5750
 epoch: 23, train_loss: 0.5843, test_loss: 1.0792, test_f1: 0.6128
 epoch: 24, train_loss: 0.5841, test_loss: 1.1618, test_f1: 0.5926
 epoch: 25, train_loss: 0.5516, test_loss: 1.2355, test_f1: 0.5856
 epoch: 26, train_loss: 0.5741, test_loss: 1.4202, test_f1: 0.5447
 epoch: 27, train_loss: 0.5458, test_loss: 1.1071, test_f1: 0.5822
 epoch: 28, train_loss: 0.5688, test_loss: 1.1933, test_f1: 0.5698
 epoch: 29, train_loss: 0.5421, test_loss: 1.0978, test_f1: 0.6379
 epoch: 30, train_loss: 0.5107, test_loss: 1.1783, test_f1: 0.5954
 epoch: 31, train_loss: 0.5443, test_loss: 1.1575, test_f1: 0.6088
 epoch: 32, train_loss: 0.5339, test_loss: 1.3925, test_f1: 0.5322
 epoch: 33, train_loss: 0.4902, test_loss: 1.2378, test_f1: 0.5771
 epoch: 34, train_loss: 0.5247, test_loss: 1.3370, test_f1: 0.5716
 epoch: 35, train_loss: 0.4677, test_loss: 1.3581, test_f1: 0.5908
 epoch: 36, train_loss: 0.4729, test_loss: 1.3168, test_f1: 0.5896
 epoch: 37, train_loss: 0.4819, test_loss: 1.2475, test_f1: 0.6228
 epoch: 38, train_loss: 0.4837, test_loss: 1.3910, test_f1: 0.5994
 epoch: 39, train_loss: 0.4564, test_loss: 1.3960, test_f1: 0.5877
 epoch: 40, train_loss: 0.4758, test_loss: 1.3960, test_f1: 0.5831
 epoch: 41, train_loss: 0.4852, test_loss: 1.1667, test_f1: 0.6213
 epoch: 42, train_loss: 0.4421, test_loss: 1.3117, test_f1: 0.5911
 epoch: 43, train_loss: 0.4506, test_loss: 1.3408, test_f1: 0.5563
 epoch: 44, train_loss: 0.4258, test_loss: 1.1983, test_f1: 0.6472
 epoch: 45, train_loss: 0.4178, test_loss: 1.4203, test_f1: 0.5384
 epoch: 46, train_loss: 0.4212, test_loss: 1.4402, test_f1: 0.5819
 epoch: 47, train_loss: 0.4231, test_loss: 1.2929, test_f1: 0.5935
 epoch: 48, train_loss: 0.4345, test_loss: 1.3739, test_f1: 0.6095
 epoch: 49, train_loss: 0.3842, test_loss: 1.4288, test_f1: 0.6269
 epoch: 50, train_loss: 0.3999, test_loss: 1.4088, test_f1: 0.6182
 epoch: 51, train_loss: 0.3792, test_loss: 1.3728, test_f1: 0.6011
 epoch: 52, train_loss: 0.3501, test_loss: 1.3797, test_f1: 0.6077
 epoch: 53, train_loss: 0.3452, test_loss: 1.5692, test_f1: 0.6102
 epoch: 54, train_loss: 0.3196, test_loss: 1.4726, test_f1: 0.6406
 epoch: 55, train_loss: 0.3543, test_loss: 1.4145, test_f1: 0.6436
 epoch: 56, train_loss: 0.3276, test_loss: 1.6178, test_f1: 0.5810
 epoch: 57, train_loss: 0.3574, test_loss: 1.4459, test_f1: 0.6104
 epoch: 58, train_loss: 0.3303, test_loss: 1.4519, test_f1: 0.6235
 epoch: 59, train_loss: 0.3130, test_loss: 1.5077, test_f1: 0.6198
 epoch: 60, train_loss: 0.3143, test_loss: 1.4917, test_f1: 0.6056
 epoch: 61, train_loss: 0.3025, test_loss: 1.5399, test_f1: 0.6117
 epoch: 62, train_loss: 0.3067, test_loss: 1.5068, test_f1: 0.6352
 epoch: 63, train_loss: 0.3147, test_loss: 1.5126, test_f1: 0.6128
 epoch: 64, train_loss: 0.3028, test_loss: 1.5387, test_f1: 0.6307
 epoch: 65, train_loss: 0.2926, test_loss: 1.5579, test_f1: 0.6422
 epoch: 66, train_loss: 0.3134, test_loss: 1.6564, test_f1: 0.5892
 epoch: 67, train_loss: 0.2926, test_loss: 1.6829, test_f1: 0.6088
 epoch: 68, train_loss: 0.3076, test_loss: 1.5355, test_f1: 0.6264
 epoch: 69, train_loss: 0.3099, test_loss: 1.5067, test_f1: 0.6483
 epoch: 70, train_loss: 0.2716, test_loss: 1.6047, test_f1: 0.6214
 epoch: 71, train_loss: 0.2873, test_loss: 1.6168, test_f1: 0.6174
 epoch: 72, train_loss: 0.2790, test_loss: 1.6481, test_f1: 0.6322
 epoch: 73, train_loss: 0.2926, test_loss: 1.6221, test_f1: 0.6374
 epoch: 74, train_loss: 0.2559, test_loss: 1.5743, test_f1: 0.6247
 epoch: 75, train_loss: 0.2524, test_loss: 1.7344, test_f1: 0.6027
 epoch: 76, train_loss: 0.2523, test_loss: 1.7971, test_f1: 0.6269
 epoch: 77, train_loss: 0.2941, test_loss: 1.7820, test_f1: 0.6039
 epoch: 78, train_loss: 0.2584, test_loss: 1.6605, test_f1: 0.6433
 epoch: 79, train_loss: 0.2963, test_loss: 1.7104, test_f1: 0.6041
 epoch: 80, train_loss: 0.2659, test_loss: 1.7471, test_f1: 0.5928
 epoch: 81, train_loss: 0.2493, test_loss: 1.7907, test_f1: 0.6072
 epoch: 82, train_loss: 0.2455, test_loss: 1.8087, test_f1: 0.6092
 epoch: 83, train_loss: 0.2351, test_loss: 1.7690, test_f1: 0.6237
 epoch: 84, train_loss: 0.2709, test_loss: 1.7775, test_f1: 0.6216
 epoch: 85, train_loss: 0.2422, test_loss: 1.6665, test_f1: 0.6122
 epoch: 86, train_loss: 0.2198, test_loss: 1.8718, test_f1: 0.6102
 epoch: 87, train_loss: 0.2688, test_loss: 1.8165, test_f1: 0.6016
 epoch: 88, train_loss: 0.2433, test_loss: 1.8075, test_f1: 0.6166
 epoch: 89, train_loss: 0.2213, test_loss: 1.8581, test_f1: 0.6293
 epoch: 90, train_loss: 0.2338, test_loss: 1.8294, test_f1: 0.6234
 epoch: 91, train_loss: 0.2388, test_loss: 1.8908, test_f1: 0.6011
 epoch: 92, train_loss: 0.2267, test_loss: 1.8434, test_f1: 0.6112
 epoch: 93, train_loss: 0.2549, test_loss: 1.8516, test_f1: 0.6180
 epoch: 94, train_loss: 0.2525, test_loss: 1.8297, test_f1: 0.6204
 epoch: 95, train_loss: 0.2510, test_loss: 1.7971, test_f1: 0.6349
 epoch: 96, train_loss: 0.2405, test_loss: 1.8282, test_f1: 0.6050
 epoch: 97, train_loss: 0.2273, test_loss: 1.9541, test_f1: 0.6221
 epoch: 98, train_loss: 0.2267, test_loss: 1.9687, test_f1: 0.6155
 epoch: 99, train_loss: 0.2311, test_loss: 1.9213, test_f1: 0.6156
##################ITERATION #3 ****************************************
 epoch: 0, train_loss: 1.1289, test_loss: 1.2585, test_f1: 0.3595
 epoch: 1, train_loss: 0.9609, test_loss: 1.0572, test_f1: 0.5136
 epoch: 2, train_loss: 0.9167, test_loss: 0.9845, test_f1: 0.5741
 epoch: 3, train_loss: 0.9085, test_loss: 1.0127, test_f1: 0.5318
 epoch: 4, train_loss: 0.8582, test_loss: 0.9890, test_f1: 0.5967
 epoch: 5, train_loss: 0.8459, test_loss: 1.0114, test_f1: 0.5744
 epoch: 6, train_loss: 0.8145, test_loss: 1.0405, test_f1: 0.5696
 epoch: 7, train_loss: 0.7734, test_loss: 1.0426, test_f1: 0.5425
 epoch: 8, train_loss: 0.7806, test_loss: 1.0218, test_f1: 0.5921
 epoch: 9, train_loss: 0.7537, test_loss: 1.0584, test_f1: 0.5701
 epoch: 10, train_loss: 0.7246, test_loss: 1.2344, test_f1: 0.5279
 epoch: 11, train_loss: 0.7218, test_loss: 1.1315, test_f1: 0.5542
 epoch: 12, train_loss: 0.7179, test_loss: 1.0388, test_f1: 0.5717
 epoch: 13, train_loss: 0.7150, test_loss: 1.0376, test_f1: 0.5841
 epoch: 14, train_loss: 0.6785, test_loss: 1.0796, test_f1: 0.6210
 epoch: 15, train_loss: 0.6796, test_loss: 1.0965, test_f1: 0.5718
 epoch: 16, train_loss: 0.6580, test_loss: 1.1860, test_f1: 0.5631
 epoch: 17, train_loss: 0.6474, test_loss: 1.0949, test_f1: 0.5884
 epoch: 18, train_loss: 0.6481, test_loss: 1.0786, test_f1: 0.6046
 epoch: 19, train_loss: 0.6506, test_loss: 1.0307, test_f1: 0.6350
 epoch: 20, train_loss: 0.6115, test_loss: 1.1061, test_f1: 0.6085
 epoch: 21, train_loss: 0.5902, test_loss: 1.1610, test_f1: 0.6723
 epoch: 22, train_loss: 0.5945, test_loss: 1.2924, test_f1: 0.5955
 epoch: 23, train_loss: 0.5852, test_loss: 1.1563, test_f1: 0.6419
 epoch: 24, train_loss: 0.6060, test_loss: 1.1683, test_f1: 0.6294
 epoch: 25, train_loss: 0.5890, test_loss: 1.1672, test_f1: 0.6255
 epoch: 26, train_loss: 0.5877, test_loss: 1.0901, test_f1: 0.6506
 epoch: 27, train_loss: 0.5709, test_loss: 1.1045, test_f1: 0.6256
 epoch: 28, train_loss: 0.5439, test_loss: 1.4188, test_f1: 0.5988
 epoch: 29, train_loss: 0.5556, test_loss: 1.3161, test_f1: 0.5400
 epoch: 30, train_loss: 0.5329, test_loss: 1.4230, test_f1: 0.6038
 epoch: 31, train_loss: 0.5603, test_loss: 1.1575, test_f1: 0.5714
 epoch: 32, train_loss: 0.5071, test_loss: 1.3532, test_f1: 0.6218
 epoch: 33, train_loss: 0.4959, test_loss: 1.4326, test_f1: 0.6153
 epoch: 34, train_loss: 0.5159, test_loss: 1.4052, test_f1: 0.6188
 epoch: 35, train_loss: 0.4938, test_loss: 1.2491, test_f1: 0.6439
 epoch: 36, train_loss: 0.5099, test_loss: 1.4931, test_f1: 0.6087
 epoch: 37, train_loss: 0.4850, test_loss: 1.3330, test_f1: 0.5900
 epoch: 38, train_loss: 0.4810, test_loss: 1.4211, test_f1: 0.6460
 epoch: 39, train_loss: 0.4894, test_loss: 1.5686, test_f1: 0.5637
 epoch: 40, train_loss: 0.4642, test_loss: 1.4136, test_f1: 0.6101
 epoch: 41, train_loss: 0.4207, test_loss: 1.3767, test_f1: 0.5804
 epoch: 42, train_loss: 0.4571, test_loss: 1.8823, test_f1: 0.5954
 epoch: 43, train_loss: 0.4726, test_loss: 1.2841, test_f1: 0.6201
 epoch: 44, train_loss: 0.4165, test_loss: 1.4115, test_f1: 0.5915
 epoch: 45, train_loss: 0.4358, test_loss: 1.3995, test_f1: 0.6227
 epoch: 46, train_loss: 0.4004, test_loss: 1.4467, test_f1: 0.6003
 epoch: 47, train_loss: 0.4489, test_loss: 1.8738, test_f1: 0.5664
 epoch: 48, train_loss: 0.4380, test_loss: 1.6788, test_f1: 0.5832
 epoch: 49, train_loss: 0.3931, test_loss: 1.8991, test_f1: 0.5241
 epoch: 50, train_loss: 0.3953, test_loss: 1.7613, test_f1: 0.5981
 epoch: 51, train_loss: 0.3836, test_loss: 1.5298, test_f1: 0.5732
 epoch: 52, train_loss: 0.3727, test_loss: 1.5714, test_f1: 0.5853
 epoch: 53, train_loss: 0.3200, test_loss: 1.7552, test_f1: 0.5946
 epoch: 54, train_loss: 0.3402, test_loss: 1.6675, test_f1: 0.6031
 epoch: 55, train_loss: 0.3280, test_loss: 1.7341, test_f1: 0.5955
 epoch: 56, train_loss: 0.3474, test_loss: 1.6299, test_f1: 0.6408
 epoch: 57, train_loss: 0.3404, test_loss: 1.5788, test_f1: 0.6288
 epoch: 58, train_loss: 0.3382, test_loss: 1.8460, test_f1: 0.5439
 epoch: 59, train_loss: 0.3481, test_loss: 1.7785, test_f1: 0.5749
 epoch: 60, train_loss: 0.3363, test_loss: 1.8193, test_f1: 0.5717
 epoch: 61, train_loss: 0.3275, test_loss: 1.8412, test_f1: 0.5927
 epoch: 62, train_loss: 0.3238, test_loss: 1.8110, test_f1: 0.5705
 epoch: 63, train_loss: 0.3193, test_loss: 1.9634, test_f1: 0.5612
 epoch: 64, train_loss: 0.2988, test_loss: 1.8144, test_f1: 0.6036
 epoch: 65, train_loss: 0.3156, test_loss: 1.8615, test_f1: 0.6155
 epoch: 66, train_loss: 0.3003, test_loss: 1.9778, test_f1: 0.5825
 epoch: 67, train_loss: 0.3039, test_loss: 1.9232, test_f1: 0.5981
 epoch: 68, train_loss: 0.2897, test_loss: 1.9707, test_f1: 0.5858
 epoch: 69, train_loss: 0.2869, test_loss: 1.8454, test_f1: 0.5976
 epoch: 70, train_loss: 0.3089, test_loss: 2.0559, test_f1: 0.5641
 epoch: 71, train_loss: 0.2989, test_loss: 2.0928, test_f1: 0.5719
 epoch: 72, train_loss: 0.2692, test_loss: 2.0320, test_f1: 0.5744
 epoch: 73, train_loss: 0.2808, test_loss: 1.9873, test_f1: 0.6118
 epoch: 74, train_loss: 0.2888, test_loss: 1.9926, test_f1: 0.5836
 epoch: 75, train_loss: 0.2998, test_loss: 1.9583, test_f1: 0.5930
 epoch: 76, train_loss: 0.2834, test_loss: 1.9420, test_f1: 0.5876
 epoch: 77, train_loss: 0.2788, test_loss: 1.9614, test_f1: 0.5969
 epoch: 78, train_loss: 0.3031, test_loss: 2.0155, test_f1: 0.5923
 epoch: 79, train_loss: 0.2748, test_loss: 2.0248, test_f1: 0.5760
 epoch: 80, train_loss: 0.2734, test_loss: 1.9508, test_f1: 0.6021
 epoch: 81, train_loss: 0.2538, test_loss: 2.0999, test_f1: 0.5998
 epoch: 82, train_loss: 0.2375, test_loss: 2.2696, test_f1: 0.5870
 epoch: 83, train_loss: 0.2539, test_loss: 2.2280, test_f1: 0.5680
 epoch: 84, train_loss: 0.2789, test_loss: 2.2516, test_f1: 0.5807
 epoch: 85, train_loss: 0.2600, test_loss: 2.1877, test_f1: 0.5978
 epoch: 86, train_loss: 0.2761, test_loss: 2.1438, test_f1: 0.6017
 epoch: 87, train_loss: 0.2772, test_loss: 2.0323, test_f1: 0.5933
 epoch: 88, train_loss: 0.2621, test_loss: 2.1551, test_f1: 0.6020
 epoch: 89, train_loss: 0.2655, test_loss: 2.2279, test_f1: 0.5845
 epoch: 90, train_loss: 0.2546, test_loss: 2.1097, test_f1: 0.5922
 epoch: 91, train_loss: 0.2638, test_loss: 2.2185, test_f1: 0.5844
 epoch: 92, train_loss: 0.2626, test_loss: 2.0261, test_f1: 0.6078
 epoch: 93, train_loss: 0.2392, test_loss: 2.3877, test_f1: 0.5652
 epoch: 94, train_loss: 0.2512, test_loss: 2.0885, test_f1: 0.5934
 epoch: 95, train_loss: 0.2283, test_loss: 2.1537, test_f1: 0.5969
 epoch: 96, train_loss: 0.2692, test_loss: 2.1958, test_f1: 0.5574
 epoch: 97, train_loss: 0.2226, test_loss: 2.3714, test_f1: 0.5846
 epoch: 98, train_loss: 0.2532, test_loss: 2.1458, test_f1: 0.6149
 epoch: 99, train_loss: 0.2165, test_loss: 2.2846, test_f1: 0.5918
##################ITERATION #4 ****************************************
 epoch: 0, train_loss: 1.3039, test_loss: 1.4357, test_f1: 0.2450
 epoch: 1, train_loss: 0.9946, test_loss: 1.0434, test_f1: 0.5343
 epoch: 2, train_loss: 0.9572, test_loss: 1.0270, test_f1: 0.5456
 epoch: 3, train_loss: 0.9169, test_loss: 1.0049, test_f1: 0.5968
 epoch: 4, train_loss: 0.8972, test_loss: 1.0047, test_f1: 0.6064
 epoch: 5, train_loss: 0.8702, test_loss: 1.0302, test_f1: 0.5781
 epoch: 6, train_loss: 0.8500, test_loss: 1.0144, test_f1: 0.5569
 epoch: 7, train_loss: 0.8171, test_loss: 1.0126, test_f1: 0.5954
 epoch: 8, train_loss: 0.7769, test_loss: 1.0412, test_f1: 0.5272
 epoch: 9, train_loss: 0.7883, test_loss: 1.0785, test_f1: 0.5694
 epoch: 10, train_loss: 0.7640, test_loss: 1.1333, test_f1: 0.5650
 epoch: 11, train_loss: 0.7545, test_loss: 1.0702, test_f1: 0.5874
 epoch: 12, train_loss: 0.7364, test_loss: 1.0664, test_f1: 0.5582
 epoch: 13, train_loss: 0.7186, test_loss: 1.1548, test_f1: 0.6012
 epoch: 14, train_loss: 0.7175, test_loss: 1.1074, test_f1: 0.5526
 epoch: 15, train_loss: 0.7046, test_loss: 1.1496, test_f1: 0.5329
 epoch: 16, train_loss: 0.6841, test_loss: 1.1437, test_f1: 0.5753
 epoch: 17, train_loss: 0.6630, test_loss: 1.2676, test_f1: 0.5775
 epoch: 18, train_loss: 0.6574, test_loss: 1.0968, test_f1: 0.5481
 epoch: 19, train_loss: 0.6521, test_loss: 1.1573, test_f1: 0.5460
 epoch: 20, train_loss: 0.6546, test_loss: 1.0799, test_f1: 0.5675
 epoch: 21, train_loss: 0.6488, test_loss: 1.0708, test_f1: 0.6137
 epoch: 22, train_loss: 0.6322, test_loss: 1.2314, test_f1: 0.5451
 epoch: 23, train_loss: 0.6028, test_loss: 1.1379, test_f1: 0.5737
 epoch: 24, train_loss: 0.6038, test_loss: 1.1824, test_f1: 0.5408
 epoch: 25, train_loss: 0.6053, test_loss: 1.2900, test_f1: 0.6264
 epoch: 26, train_loss: 0.5848, test_loss: 1.3128, test_f1: 0.6002
 epoch: 27, train_loss: 0.5602, test_loss: 1.1695, test_f1: 0.5889
 epoch: 28, train_loss: 0.5575, test_loss: 1.1166, test_f1: 0.6028
 epoch: 29, train_loss: 0.5744, test_loss: 1.3421, test_f1: 0.6323
 epoch: 30, train_loss: 0.5405, test_loss: 1.3473, test_f1: 0.5966
 epoch: 31, train_loss: 0.5089, test_loss: 1.2426, test_f1: 0.5872
 epoch: 32, train_loss: 0.5370, test_loss: 1.3217, test_f1: 0.6077
 epoch: 33, train_loss: 0.5268, test_loss: 1.4022, test_f1: 0.5946
 epoch: 34, train_loss: 0.5051, test_loss: 1.3831, test_f1: 0.6207
 epoch: 35, train_loss: 0.5079, test_loss: 1.3584, test_f1: 0.5976
 epoch: 36, train_loss: 0.4945, test_loss: 1.2611, test_f1: 0.6166
 epoch: 37, train_loss: 0.4799, test_loss: 1.3947, test_f1: 0.6198
 epoch: 38, train_loss: 0.4653, test_loss: 1.4269, test_f1: 0.6258
 epoch: 39, train_loss: 0.4708, test_loss: 1.7921, test_f1: 0.5461
 epoch: 40, train_loss: 0.4776, test_loss: 1.3901, test_f1: 0.5883
 epoch: 41, train_loss: 0.4400, test_loss: 1.6085, test_f1: 0.5768
 epoch: 42, train_loss: 0.4394, test_loss: 1.6883, test_f1: 0.5862
 epoch: 43, train_loss: 0.4400, test_loss: 1.5167, test_f1: 0.6024
 epoch: 44, train_loss: 0.4426, test_loss: 1.9649, test_f1: 0.6230
 epoch: 45, train_loss: 0.4433, test_loss: 1.7183, test_f1: 0.5510
 epoch: 46, train_loss: 0.4294, test_loss: 1.7506, test_f1: 0.6000
 epoch: 47, train_loss: 0.4382, test_loss: 1.6568, test_f1: 0.5680
 epoch: 48, train_loss: 0.4397, test_loss: 1.5885, test_f1: 0.6061
 epoch: 49, train_loss: 0.4228, test_loss: 1.7826, test_f1: 0.5784
 epoch: 50, train_loss: 0.4172, test_loss: 2.0169, test_f1: 0.5686
 epoch: 51, train_loss: 0.3869, test_loss: 1.7994, test_f1: 0.6091
 epoch: 52, train_loss: 0.3850, test_loss: 1.6456, test_f1: 0.6039
 epoch: 53, train_loss: 0.3655, test_loss: 1.7478, test_f1: 0.6231
 epoch: 54, train_loss: 0.3153, test_loss: 1.9347, test_f1: 0.6100
 epoch: 55, train_loss: 0.3609, test_loss: 1.6468, test_f1: 0.6201
 epoch: 56, train_loss: 0.3286, test_loss: 1.7566, test_f1: 0.6228
 epoch: 57, train_loss: 0.3377, test_loss: 1.7721, test_f1: 0.5849
 epoch: 58, train_loss: 0.3351, test_loss: 1.8338, test_f1: 0.6135
 epoch: 59, train_loss: 0.3170, test_loss: 1.8201, test_f1: 0.6347
 epoch: 60, train_loss: 0.3261, test_loss: 1.8456, test_f1: 0.6055
 epoch: 61, train_loss: 0.3055, test_loss: 1.8825, test_f1: 0.6222
 epoch: 62, train_loss: 0.3233, test_loss: 1.9147, test_f1: 0.6034
 epoch: 63, train_loss: 0.3156, test_loss: 1.8518, test_f1: 0.6252
 epoch: 64, train_loss: 0.3034, test_loss: 1.9617, test_f1: 0.5878
 epoch: 65, train_loss: 0.3350, test_loss: 1.8210, test_f1: 0.6148
 epoch: 66, train_loss: 0.3133, test_loss: 1.8448, test_f1: 0.5912
 epoch: 67, train_loss: 0.3144, test_loss: 2.0942, test_f1: 0.6124
 epoch: 68, train_loss: 0.3083, test_loss: 1.8982, test_f1: 0.6305
 epoch: 69, train_loss: 0.2864, test_loss: 2.0624, test_f1: 0.5753
 epoch: 70, train_loss: 0.2745, test_loss: 1.9674, test_f1: 0.6162
 epoch: 71, train_loss: 0.2773, test_loss: 2.0196, test_f1: 0.6317
 epoch: 72, train_loss: 0.2890, test_loss: 1.9478, test_f1: 0.6274
 epoch: 73, train_loss: 0.2952, test_loss: 2.2239, test_f1: 0.6006
 epoch: 74, train_loss: 0.2776, test_loss: 2.0171, test_f1: 0.6183
 epoch: 75, train_loss: 0.2919, test_loss: 2.2038, test_f1: 0.6222
 epoch: 76, train_loss: 0.2755, test_loss: 2.0019, test_f1: 0.6288
 epoch: 77, train_loss: 0.2758, test_loss: 2.2290, test_f1: 0.5863
 epoch: 78, train_loss: 0.2753, test_loss: 2.1789, test_f1: 0.5760
 epoch: 79, train_loss: 0.2543, test_loss: 2.0844, test_f1: 0.6205
 epoch: 80, train_loss: 0.2757, test_loss: 2.2736, test_f1: 0.6148
 epoch: 81, train_loss: 0.2735, test_loss: 2.1450, test_f1: 0.6044
 epoch: 82, train_loss: 0.2784, test_loss: 2.1434, test_f1: 0.6188
 epoch: 83, train_loss: 0.2522, test_loss: 2.2448, test_f1: 0.6156
 epoch: 84, train_loss: 0.2667, test_loss: 2.1800, test_f1: 0.6209
 epoch: 85, train_loss: 0.2736, test_loss: 2.2766, test_f1: 0.5969
 epoch: 86, train_loss: 0.2498, test_loss: 2.0959, test_f1: 0.5998
 epoch: 87, train_loss: 0.2525, test_loss: 2.3320, test_f1: 0.5935
 epoch: 88, train_loss: 0.2512, test_loss: 2.2232, test_f1: 0.6076
 epoch: 89, train_loss: 0.2453, test_loss: 2.4092, test_f1: 0.5870
 epoch: 90, train_loss: 0.2583, test_loss: 2.2259, test_f1: 0.5849
 epoch: 91, train_loss: 0.2545, test_loss: 2.2707, test_f1: 0.6159
 epoch: 92, train_loss: 0.2481, test_loss: 2.3079, test_f1: 0.6190
 epoch: 93, train_loss: 0.2554, test_loss: 2.3727, test_f1: 0.5831
 epoch: 94, train_loss: 0.2462, test_loss: 2.4405, test_f1: 0.5723
 epoch: 95, train_loss: 0.2564, test_loss: 2.3853, test_f1: 0.5970
 epoch: 96, train_loss: 0.2315, test_loss: 2.6758, test_f1: 0.5916
 epoch: 97, train_loss: 0.2466, test_loss: 2.3778, test_f1: 0.6070
 epoch: 98, train_loss: 0.2254, test_loss: 2.4490, test_f1: 0.5827
 epoch: 99, train_loss: 0.2465, test_loss: 2.6933, test_f1: 0.5962
##################ITERATION #5 ****************************************
 epoch: 0, train_loss: 1.3368, test_loss: 1.4165, test_f1: 0.2366
 epoch: 1, train_loss: 1.0263, test_loss: 1.0398, test_f1: 0.5272
 epoch: 2, train_loss: 0.9335, test_loss: 1.0206, test_f1: 0.5378
 epoch: 3, train_loss: 0.8863, test_loss: 0.9928, test_f1: 0.5139
 epoch: 4, train_loss: 0.8826, test_loss: 0.9657, test_f1: 0.5257
 epoch: 5, train_loss: 0.8469, test_loss: 1.0020, test_f1: 0.5543
 epoch: 6, train_loss: 0.8440, test_loss: 1.0071, test_f1: 0.5497
 epoch: 7, train_loss: 0.8256, test_loss: 1.0094, test_f1: 0.5591
 epoch: 8, train_loss: 0.7876, test_loss: 1.0187, test_f1: 0.5264
 epoch: 9, train_loss: 0.7659, test_loss: 1.0187, test_f1: 0.5867
 epoch: 10, train_loss: 0.7389, test_loss: 1.0383, test_f1: 0.5600
 epoch: 11, train_loss: 0.7427, test_loss: 1.0045, test_f1: 0.6017
 epoch: 12, train_loss: 0.7448, test_loss: 1.0765, test_f1: 0.5686
 epoch: 13, train_loss: 0.7256, test_loss: 1.0651, test_f1: 0.5862
 epoch: 14, train_loss: 0.7161, test_loss: 1.0622, test_f1: 0.5933
 epoch: 15, train_loss: 0.7196, test_loss: 1.0113, test_f1: 0.5888
 epoch: 16, train_loss: 0.6695, test_loss: 1.0432, test_f1: 0.5959
 epoch: 17, train_loss: 0.6970, test_loss: 1.0463, test_f1: 0.5924
 epoch: 18, train_loss: 0.6615, test_loss: 1.0484, test_f1: 0.6067
 epoch: 19, train_loss: 0.6522, test_loss: 1.0482, test_f1: 0.5990
 epoch: 20, train_loss: 0.6507, test_loss: 1.1220, test_f1: 0.5775
 epoch: 21, train_loss: 0.6510, test_loss: 1.0573, test_f1: 0.6129
 epoch: 22, train_loss: 0.6393, test_loss: 1.0756, test_f1: 0.6319
 epoch: 23, train_loss: 0.6023, test_loss: 1.0499, test_f1: 0.6302
 epoch: 24, train_loss: 0.6033, test_loss: 1.0650, test_f1: 0.6270
 epoch: 25, train_loss: 0.5972, test_loss: 1.0815, test_f1: 0.6161
 epoch: 26, train_loss: 0.6061, test_loss: 1.0773, test_f1: 0.6277
 epoch: 27, train_loss: 0.5861, test_loss: 1.1338, test_f1: 0.6308
 epoch: 28, train_loss: 0.5925, test_loss: 1.1319, test_f1: 0.6562
 epoch: 29, train_loss: 0.5796, test_loss: 1.1942, test_f1: 0.6274
 epoch: 30, train_loss: 0.5675, test_loss: 1.1813, test_f1: 0.6055
 epoch: 31, train_loss: 0.5505, test_loss: 1.3497, test_f1: 0.5794
 epoch: 32, train_loss: 0.5526, test_loss: 1.1891, test_f1: 0.6205
 epoch: 33, train_loss: 0.5480, test_loss: 1.2467, test_f1: 0.5834
 epoch: 34, train_loss: 0.5491, test_loss: 1.2576, test_f1: 0.5993
 epoch: 35, train_loss: 0.5715, test_loss: 1.2106, test_f1: 0.6213
 epoch: 36, train_loss: 0.5111, test_loss: 1.1625, test_f1: 0.5690
 epoch: 37, train_loss: 0.5115, test_loss: 1.2026, test_f1: 0.6028
 epoch: 38, train_loss: 0.5058, test_loss: 1.2233, test_f1: 0.6390
 epoch: 39, train_loss: 0.5247, test_loss: 1.3117, test_f1: 0.5838
 epoch: 40, train_loss: 0.5209, test_loss: 1.1764, test_f1: 0.6287
 epoch: 41, train_loss: 0.5238, test_loss: 1.6852, test_f1: 0.5267
 epoch: 42, train_loss: 0.4816, test_loss: 1.2369, test_f1: 0.6540
 epoch: 43, train_loss: 0.5145, test_loss: 1.1591, test_f1: 0.6330
 epoch: 44, train_loss: 0.4789, test_loss: 1.1686, test_f1: 0.6431
 epoch: 45, train_loss: 0.4549, test_loss: 1.2912, test_f1: 0.6328
 epoch: 46, train_loss: 0.4742, test_loss: 1.1475, test_f1: 0.6260
 epoch: 47, train_loss: 0.4754, test_loss: 1.3514, test_f1: 0.5950
 epoch: 48, train_loss: 0.4513, test_loss: 1.2773, test_f1: 0.6084
 epoch: 49, train_loss: 0.4458, test_loss: 1.2726, test_f1: 0.6291
 epoch: 50, train_loss: 0.4322, test_loss: 1.2766, test_f1: 0.6118
 epoch: 51, train_loss: 0.3891, test_loss: 1.4354, test_f1: 0.5946
 epoch: 52, train_loss: 0.3824, test_loss: 1.3044, test_f1: 0.6401
 epoch: 53, train_loss: 0.3578, test_loss: 1.4106, test_f1: 0.6061
 epoch: 54, train_loss: 0.3641, test_loss: 1.5664, test_f1: 0.5880
 epoch: 55, train_loss: 0.3474, test_loss: 1.4418, test_f1: 0.6148
 epoch: 56, train_loss: 0.3805, test_loss: 1.4580, test_f1: 0.6067
 epoch: 57, train_loss: 0.3394, test_loss: 1.4387, test_f1: 0.6336
 epoch: 58, train_loss: 0.3515, test_loss: 1.5467, test_f1: 0.5998
 epoch: 59, train_loss: 0.3528, test_loss: 1.5608, test_f1: 0.5913
 epoch: 60, train_loss: 0.3605, test_loss: 1.5510, test_f1: 0.5961
 epoch: 61, train_loss: 0.3434, test_loss: 1.4535, test_f1: 0.6491
 epoch: 62, train_loss: 0.3326, test_loss: 1.6128, test_f1: 0.5892
 epoch: 63, train_loss: 0.3240, test_loss: 1.4297, test_f1: 0.6219
 epoch: 64, train_loss: 0.3271, test_loss: 1.5970, test_f1: 0.5931
 epoch: 65, train_loss: 0.3285, test_loss: 1.6970, test_f1: 0.5765
 epoch: 66, train_loss: 0.3467, test_loss: 1.4899, test_f1: 0.6032
 epoch: 67, train_loss: 0.3222, test_loss: 1.5881, test_f1: 0.6333
 epoch: 68, train_loss: 0.3217, test_loss: 1.6758, test_f1: 0.5850
 epoch: 69, train_loss: 0.3177, test_loss: 1.6497, test_f1: 0.6183
 epoch: 70, train_loss: 0.3309, test_loss: 1.5824, test_f1: 0.6344
 epoch: 71, train_loss: 0.3212, test_loss: 1.5162, test_f1: 0.6307
 epoch: 72, train_loss: 0.3192, test_loss: 1.6840, test_f1: 0.5963
 epoch: 73, train_loss: 0.3270, test_loss: 1.6590, test_f1: 0.5920
 epoch: 74, train_loss: 0.3088, test_loss: 1.6398, test_f1: 0.6085
 epoch: 75, train_loss: 0.3189, test_loss: 1.6192, test_f1: 0.6216
 epoch: 76, train_loss: 0.3256, test_loss: 1.6425, test_f1: 0.5954
 epoch: 77, train_loss: 0.3282, test_loss: 1.6449, test_f1: 0.6036
 epoch: 78, train_loss: 0.3179, test_loss: 1.6740, test_f1: 0.6183
 epoch: 79, train_loss: 0.2929, test_loss: 1.6627, test_f1: 0.6004
 epoch: 80, train_loss: 0.3287, test_loss: 1.7277, test_f1: 0.5985
 epoch: 81, train_loss: 0.2984, test_loss: 1.6903, test_f1: 0.6100
 epoch: 82, train_loss: 0.2889, test_loss: 1.6092, test_f1: 0.6007
 epoch: 83, train_loss: 0.2821, test_loss: 1.7124, test_f1: 0.6249
 epoch: 84, train_loss: 0.2768, test_loss: 1.7663, test_f1: 0.6304
 epoch: 85, train_loss: 0.2996, test_loss: 1.8909, test_f1: 0.5961
 epoch: 86, train_loss: 0.2891, test_loss: 1.9133, test_f1: 0.6023
 epoch: 87, train_loss: 0.3058, test_loss: 1.8032, test_f1: 0.6035
 epoch: 88, train_loss: 0.2747, test_loss: 1.8060, test_f1: 0.6030
 epoch: 89, train_loss: 0.2594, test_loss: 1.6929, test_f1: 0.6481
 epoch: 90, train_loss: 0.2808, test_loss: 1.8102, test_f1: 0.6091
 epoch: 91, train_loss: 0.2628, test_loss: 1.8105, test_f1: 0.6187
 epoch: 92, train_loss: 0.2849, test_loss: 1.7236, test_f1: 0.5986
 epoch: 93, train_loss: 0.2744, test_loss: 1.7604, test_f1: 0.6038
 epoch: 94, train_loss: 0.2785, test_loss: 1.7439, test_f1: 0.6307
 epoch: 95, train_loss: 0.2807, test_loss: 1.7650, test_f1: 0.6085
 epoch: 96, train_loss: 0.2670, test_loss: 1.7049, test_f1: 0.6473
 epoch: 97, train_loss: 0.2665, test_loss: 1.6807, test_f1: 0.6186
 epoch: 98, train_loss: 0.2716, test_loss: 1.7538, test_f1: 0.6023
 epoch: 99, train_loss: 0.2721, test_loss: 1.8527, test_f1: 0.5936
##################ITERATION #6 ****************************************
 epoch: 0, train_loss: 1.4093, test_loss: 1.3401, test_f1: 0.3307
 epoch: 1, train_loss: 1.0956, test_loss: 1.0842, test_f1: 0.5010
 epoch: 2, train_loss: 0.9926, test_loss: 1.1121, test_f1: 0.5358
 epoch: 3, train_loss: 0.9439, test_loss: 1.0469, test_f1: 0.5890
 epoch: 4, train_loss: 0.9024, test_loss: 1.0474, test_f1: 0.5541
 epoch: 5, train_loss: 0.8779, test_loss: 1.0245, test_f1: 0.5866
 epoch: 6, train_loss: 0.8448, test_loss: 1.0559, test_f1: 0.5823
 epoch: 7, train_loss: 0.8031, test_loss: 1.0476, test_f1: 0.5321
 epoch: 8, train_loss: 0.8041, test_loss: 1.1444, test_f1: 0.5435
 epoch: 9, train_loss: 0.8175, test_loss: 1.0952, test_f1: 0.5826
 epoch: 10, train_loss: 0.7717, test_loss: 1.0325, test_f1: 0.6132
 epoch: 11, train_loss: 0.7517, test_loss: 1.1172, test_f1: 0.5164
 epoch: 12, train_loss: 0.7636, test_loss: 1.0677, test_f1: 0.5704
 epoch: 13, train_loss: 0.7500, test_loss: 1.1440, test_f1: 0.5713
 epoch: 14, train_loss: 0.7115, test_loss: 1.0478, test_f1: 0.6323
 epoch: 15, train_loss: 0.6992, test_loss: 1.0320, test_f1: 0.6086
 epoch: 16, train_loss: 0.7257, test_loss: 1.2375, test_f1: 0.5404
 epoch: 17, train_loss: 0.6908, test_loss: 1.2948, test_f1: 0.5292
 epoch: 18, train_loss: 0.6662, test_loss: 1.1672, test_f1: 0.6277
 epoch: 19, train_loss: 0.6714, test_loss: 1.2159, test_f1: 0.5885
 epoch: 20, train_loss: 0.6675, test_loss: 1.2423, test_f1: 0.5887
 epoch: 21, train_loss: 0.6300, test_loss: 1.3891, test_f1: 0.6240
 epoch: 22, train_loss: 0.6257, test_loss: 1.3035, test_f1: 0.5896
 epoch: 23, train_loss: 0.6159, test_loss: 1.1343, test_f1: 0.6107
 epoch: 24, train_loss: 0.6091, test_loss: 1.2340, test_f1: 0.5861
 epoch: 25, train_loss: 0.6026, test_loss: 1.3747, test_f1: 0.6138
 epoch: 26, train_loss: 0.5805, test_loss: 1.2459, test_f1: 0.6105
 epoch: 27, train_loss: 0.5691, test_loss: 1.4794, test_f1: 0.5815
 epoch: 28, train_loss: 0.5720, test_loss: 1.3720, test_f1: 0.5832
 epoch: 29, train_loss: 0.5539, test_loss: 1.2902, test_f1: 0.5675
 epoch: 30, train_loss: 0.5611, test_loss: 1.1998, test_f1: 0.5831
 epoch: 31, train_loss: 0.5544, test_loss: 1.3261, test_f1: 0.5922
 epoch: 32, train_loss: 0.5520, test_loss: 1.3285, test_f1: 0.5847
 epoch: 33, train_loss: 0.5443, test_loss: 1.6179, test_f1: 0.5818
 epoch: 34, train_loss: 0.5302, test_loss: 1.6324, test_f1: 0.5850
 epoch: 35, train_loss: 0.5016, test_loss: 1.3210, test_f1: 0.6128
 epoch: 36, train_loss: 0.5412, test_loss: 1.5020, test_f1: 0.5728
 epoch: 37, train_loss: 0.5072, test_loss: 1.5938, test_f1: 0.5734
 epoch: 38, train_loss: 0.4809, test_loss: 1.6251, test_f1: 0.6176
 epoch: 39, train_loss: 0.5108, test_loss: 1.5464, test_f1: 0.6108
 epoch: 40, train_loss: 0.4847, test_loss: 1.8318, test_f1: 0.5841
 epoch: 41, train_loss: 0.4703, test_loss: 1.5812, test_f1: 0.6018
 epoch: 42, train_loss: 0.4938, test_loss: 1.5816, test_f1: 0.6052
 epoch: 43, train_loss: 0.4393, test_loss: 1.6559, test_f1: 0.5913
 epoch: 44, train_loss: 0.4299, test_loss: 1.6617, test_f1: 0.5994
 epoch: 45, train_loss: 0.4569, test_loss: 1.8987, test_f1: 0.5901
 epoch: 46, train_loss: 0.4194, test_loss: 1.5683, test_f1: 0.5930
 epoch: 47, train_loss: 0.4215, test_loss: 1.9819, test_f1: 0.6281
 epoch: 48, train_loss: 0.4362, test_loss: 1.7464, test_f1: 0.5718
 epoch: 49, train_loss: 0.4336, test_loss: 1.4870, test_f1: 0.5469
 epoch: 50, train_loss: 0.4234, test_loss: 1.5083, test_f1: 0.5880
 epoch: 51, train_loss: 0.3690, test_loss: 1.6041, test_f1: 0.5888
 epoch: 52, train_loss: 0.3582, test_loss: 1.7553, test_f1: 0.6061
 epoch: 53, train_loss: 0.3564, test_loss: 1.7649, test_f1: 0.5797
 epoch: 54, train_loss: 0.3272, test_loss: 1.8215, test_f1: 0.5758
 epoch: 55, train_loss: 0.3553, test_loss: 1.8284, test_f1: 0.5838
 epoch: 56, train_loss: 0.3261, test_loss: 1.7276, test_f1: 0.5827
 epoch: 57, train_loss: 0.3383, test_loss: 1.8944, test_f1: 0.6075
 epoch: 58, train_loss: 0.3140, test_loss: 2.1988, test_f1: 0.5975
 epoch: 59, train_loss: 0.3159, test_loss: 1.8736, test_f1: 0.5868
 epoch: 60, train_loss: 0.3264, test_loss: 2.0105, test_f1: 0.5888
 epoch: 61, train_loss: 0.3174, test_loss: 1.7466, test_f1: 0.5952
 epoch: 62, train_loss: 0.3175, test_loss: 1.9177, test_f1: 0.5879
 epoch: 63, train_loss: 0.3172, test_loss: 2.0682, test_f1: 0.5814
 epoch: 64, train_loss: 0.3158, test_loss: 1.8847, test_f1: 0.6127
 epoch: 65, train_loss: 0.3057, test_loss: 1.9346, test_f1: 0.6213
 epoch: 66, train_loss: 0.2927, test_loss: 1.7725, test_f1: 0.5995
 epoch: 67, train_loss: 0.3002, test_loss: 2.1370, test_f1: 0.5955
 epoch: 68, train_loss: 0.2771, test_loss: 1.8491, test_f1: 0.5768
 epoch: 69, train_loss: 0.2898, test_loss: 2.2128, test_f1: 0.5795
 epoch: 70, train_loss: 0.2778, test_loss: 1.9942, test_f1: 0.5747
 epoch: 71, train_loss: 0.2761, test_loss: 2.1908, test_f1: 0.5774
 epoch: 72, train_loss: 0.3007, test_loss: 2.0839, test_f1: 0.5835
 epoch: 73, train_loss: 0.2966, test_loss: 2.3124, test_f1: 0.5963
 epoch: 74, train_loss: 0.2904, test_loss: 2.0023, test_f1: 0.5807
 epoch: 75, train_loss: 0.2856, test_loss: 2.1085, test_f1: 0.5870
 epoch: 76, train_loss: 0.2539, test_loss: 2.1417, test_f1: 0.5675
 epoch: 77, train_loss: 0.2420, test_loss: 2.2853, test_f1: 0.5755
 epoch: 78, train_loss: 0.2858, test_loss: 2.0529, test_f1: 0.5677
 epoch: 79, train_loss: 0.2806, test_loss: 2.0463, test_f1: 0.5876
 epoch: 80, train_loss: 0.2930, test_loss: 2.1314, test_f1: 0.6021
 epoch: 81, train_loss: 0.2705, test_loss: 2.2057, test_f1: 0.5736
 epoch: 82, train_loss: 0.2835, test_loss: 2.1344, test_f1: 0.6050
 epoch: 83, train_loss: 0.2606, test_loss: 2.1033, test_f1: 0.5985
 epoch: 84, train_loss: 0.2892, test_loss: 2.0745, test_f1: 0.5960
 epoch: 85, train_loss: 0.2848, test_loss: 1.9392, test_f1: 0.6156
 epoch: 86, train_loss: 0.2643, test_loss: 2.1647, test_f1: 0.5709
 epoch: 87, train_loss: 0.2600, test_loss: 2.0547, test_f1: 0.5851
 epoch: 88, train_loss: 0.2831, test_loss: 2.1855, test_f1: 0.5747
 epoch: 89, train_loss: 0.2508, test_loss: 2.2833, test_f1: 0.6028
 epoch: 90, train_loss: 0.2324, test_loss: 2.1080, test_f1: 0.5826
 epoch: 91, train_loss: 0.2234, test_loss: 2.3141, test_f1: 0.5762
 epoch: 92, train_loss: 0.2245, test_loss: 2.3207, test_f1: 0.5915
 epoch: 93, train_loss: 0.2218, test_loss: 2.2943, test_f1: 0.5936
 epoch: 94, train_loss: 0.2450, test_loss: 2.3490, test_f1: 0.5674
 epoch: 95, train_loss: 0.2485, test_loss: 2.2113, test_f1: 0.5797
 epoch: 96, train_loss: 0.2486, test_loss: 2.3791, test_f1: 0.5848
 epoch: 97, train_loss: 0.2490, test_loss: 2.1563, test_f1: 0.6107
 epoch: 98, train_loss: 0.2495, test_loss: 2.6586, test_f1: 0.5859
 epoch: 99, train_loss: 0.2408, test_loss: 2.4478, test_f1: 0.6008
##################ITERATION #7 ****************************************
 epoch: 0, train_loss: 1.6029, test_loss: 1.3602, test_f1: 0.3334
 epoch: 1, train_loss: 1.1184, test_loss: 1.0872, test_f1: 0.4887
 epoch: 2, train_loss: 0.9860, test_loss: 1.0691, test_f1: 0.5447
 epoch: 3, train_loss: 0.9427, test_loss: 1.0701, test_f1: 0.5233
 epoch: 4, train_loss: 0.8982, test_loss: 1.0462, test_f1: 0.5251
 epoch: 5, train_loss: 0.8573, test_loss: 1.0510, test_f1: 0.5324
 epoch: 6, train_loss: 0.8337, test_loss: 1.0646, test_f1: 0.5667
 epoch: 7, train_loss: 0.8407, test_loss: 1.1952, test_f1: 0.4626
 epoch: 8, train_loss: 0.8026, test_loss: 1.0636, test_f1: 0.6069
 epoch: 9, train_loss: 0.7810, test_loss: 1.1363, test_f1: 0.5146
 epoch: 10, train_loss: 0.7678, test_loss: 1.1900, test_f1: 0.5580
 epoch: 11, train_loss: 0.7754, test_loss: 1.0693, test_f1: 0.5703
 epoch: 12, train_loss: 0.7284, test_loss: 1.1579, test_f1: 0.5628
 epoch: 13, train_loss: 0.7200, test_loss: 1.2853, test_f1: 0.5396
 epoch: 14, train_loss: 0.7268, test_loss: 1.2270, test_f1: 0.5888
 epoch: 15, train_loss: 0.7257, test_loss: 1.4177, test_f1: 0.5364
 epoch: 16, train_loss: 0.6937, test_loss: 1.2299, test_f1: 0.6424
 epoch: 17, train_loss: 0.6726, test_loss: 1.2673, test_f1: 0.5866
 epoch: 18, train_loss: 0.6856, test_loss: 1.1580, test_f1: 0.5859
 epoch: 19, train_loss: 0.6761, test_loss: 1.1335, test_f1: 0.5298
 epoch: 20, train_loss: 0.6648, test_loss: 1.2644, test_f1: 0.5627
 epoch: 21, train_loss: 0.6245, test_loss: 1.1932, test_f1: 0.6388
 epoch: 22, train_loss: 0.6538, test_loss: 1.3262, test_f1: 0.5487
 epoch: 23, train_loss: 0.6271, test_loss: 1.2819, test_f1: 0.6033
 epoch: 24, train_loss: 0.6224, test_loss: 1.1372, test_f1: 0.5933
 epoch: 25, train_loss: 0.6192, test_loss: 1.1221, test_f1: 0.6287
 epoch: 26, train_loss: 0.6105, test_loss: 1.1122, test_f1: 0.5869
 epoch: 27, train_loss: 0.5832, test_loss: 1.3399, test_f1: 0.5870
 epoch: 28, train_loss: 0.5865, test_loss: 1.4534, test_f1: 0.5634
 epoch: 29, train_loss: 0.5848, test_loss: 1.4545, test_f1: 0.5511
 epoch: 30, train_loss: 0.6021, test_loss: 1.5930, test_f1: 0.5266
 epoch: 31, train_loss: 0.5932, test_loss: 1.2580, test_f1: 0.6210
 epoch: 32, train_loss: 0.5951, test_loss: 1.3040, test_f1: 0.5959
 epoch: 33, train_loss: 0.5597, test_loss: 1.3677, test_f1: 0.6059
 epoch: 34, train_loss: 0.5468, test_loss: 1.5011, test_f1: 0.6142
 epoch: 35, train_loss: 0.5479, test_loss: 1.2826, test_f1: 0.6235
 epoch: 36, train_loss: 0.5258, test_loss: 1.5619, test_f1: 0.5715
 epoch: 37, train_loss: 0.5393, test_loss: 1.4722, test_f1: 0.5863
 epoch: 38, train_loss: 0.5018, test_loss: 1.5579, test_f1: 0.6251
 epoch: 39, train_loss: 0.5092, test_loss: 1.5243, test_f1: 0.5873
 epoch: 40, train_loss: 0.5126, test_loss: 1.5393, test_f1: 0.5671
 epoch: 41, train_loss: 0.4983, test_loss: 1.3390, test_f1: 0.6184
 epoch: 42, train_loss: 0.5054, test_loss: 1.5317, test_f1: 0.5889
 epoch: 43, train_loss: 0.5065, test_loss: 1.6474, test_f1: 0.5679
 epoch: 44, train_loss: 0.4909, test_loss: 1.5762, test_f1: 0.5873
 epoch: 45, train_loss: 0.4856, test_loss: 1.5370, test_f1: 0.6058
 epoch: 46, train_loss: 0.5052, test_loss: 1.6044, test_f1: 0.6104
 epoch: 47, train_loss: 0.5134, test_loss: 1.7191, test_f1: 0.6143
 epoch: 48, train_loss: 0.4690, test_loss: 1.4091, test_f1: 0.5941
 epoch: 49, train_loss: 0.4312, test_loss: 1.5320, test_f1: 0.6212
 epoch: 50, train_loss: 0.4365, test_loss: 1.6106, test_f1: 0.6120
 epoch: 51, train_loss: 0.4067, test_loss: 1.7193, test_f1: 0.6461
 epoch: 52, train_loss: 0.3946, test_loss: 1.8312, test_f1: 0.6149
 epoch: 53, train_loss: 0.3850, test_loss: 1.7455, test_f1: 0.6038
 epoch: 54, train_loss: 0.4078, test_loss: 1.7228, test_f1: 0.6432
 epoch: 55, train_loss: 0.4010, test_loss: 1.8044, test_f1: 0.6276
 epoch: 56, train_loss: 0.3622, test_loss: 2.0107, test_f1: 0.5931
 epoch: 57, train_loss: 0.3563, test_loss: 2.0582, test_f1: 0.6102
 epoch: 58, train_loss: 0.3564, test_loss: 1.7913, test_f1: 0.6199
 epoch: 59, train_loss: 0.3345, test_loss: 1.9264, test_f1: 0.6051
 epoch: 60, train_loss: 0.3768, test_loss: 2.0368, test_f1: 0.5999
 epoch: 61, train_loss: 0.3481, test_loss: 2.1780, test_f1: 0.5742
 epoch: 62, train_loss: 0.3457, test_loss: 1.9655, test_f1: 0.6160
 epoch: 63, train_loss: 0.3634, test_loss: 1.7851, test_f1: 0.6120
 epoch: 64, train_loss: 0.3316, test_loss: 1.8842, test_f1: 0.6335
 epoch: 65, train_loss: 0.3610, test_loss: 1.9349, test_f1: 0.6202
 epoch: 66, train_loss: 0.3356, test_loss: 1.9506, test_f1: 0.6110
 epoch: 67, train_loss: 0.3584, test_loss: 1.9557, test_f1: 0.6043
 epoch: 68, train_loss: 0.3364, test_loss: 2.0738, test_f1: 0.6005
 epoch: 69, train_loss: 0.3168, test_loss: 1.8187, test_f1: 0.6210
 epoch: 70, train_loss: 0.3270, test_loss: 1.9366, test_f1: 0.6316
 epoch: 71, train_loss: 0.3227, test_loss: 2.0325, test_f1: 0.6363
 epoch: 72, train_loss: 0.3210, test_loss: 1.9649, test_f1: 0.6430
 epoch: 73, train_loss: 0.3264, test_loss: 2.0030, test_f1: 0.6253
 epoch: 74, train_loss: 0.3083, test_loss: 2.1142, test_f1: 0.6259
 epoch: 75, train_loss: 0.3192, test_loss: 2.2406, test_f1: 0.6014
 epoch: 76, train_loss: 0.2828, test_loss: 2.2729, test_f1: 0.6024
 epoch: 77, train_loss: 0.3246, test_loss: 2.1378, test_f1: 0.6171
 epoch: 78, train_loss: 0.3192, test_loss: 2.1328, test_f1: 0.6396
 epoch: 79, train_loss: 0.3010, test_loss: 2.1349, test_f1: 0.6205
 epoch: 80, train_loss: 0.2875, test_loss: 2.0944, test_f1: 0.6227
 epoch: 81, train_loss: 0.2776, test_loss: 2.0132, test_f1: 0.6034
 epoch: 82, train_loss: 0.3020, test_loss: 1.9475, test_f1: 0.6163
 epoch: 83, train_loss: 0.3251, test_loss: 1.9532, test_f1: 0.6073
 epoch: 84, train_loss: 0.2789, test_loss: 2.2606, test_f1: 0.5841
 epoch: 85, train_loss: 0.3017, test_loss: 2.1809, test_f1: 0.6025
 epoch: 86, train_loss: 0.2926, test_loss: 2.1750, test_f1: 0.6328
 epoch: 87, train_loss: 0.2651, test_loss: 2.1902, test_f1: 0.6300
 epoch: 88, train_loss: 0.2927, test_loss: 1.9010, test_f1: 0.6132
 epoch: 89, train_loss: 0.2941, test_loss: 1.9693, test_f1: 0.6195
 epoch: 90, train_loss: 0.2972, test_loss: 2.0760, test_f1: 0.5951
 epoch: 91, train_loss: 0.2837, test_loss: 2.0464, test_f1: 0.6292
 epoch: 92, train_loss: 0.2814, test_loss: 2.1238, test_f1: 0.5960
 epoch: 93, train_loss: 0.2706, test_loss: 2.4253, test_f1: 0.6063
 epoch: 94, train_loss: 0.2859, test_loss: 2.1546, test_f1: 0.6168
 epoch: 95, train_loss: 0.2704, test_loss: 2.0452, test_f1: 0.6360
 epoch: 96, train_loss: 0.2936, test_loss: 2.2871, test_f1: 0.5864
 epoch: 97, train_loss: 0.2438, test_loss: 2.1979, test_f1: 0.5974
 epoch: 98, train_loss: 0.2484, test_loss: 2.2548, test_f1: 0.6180
 epoch: 99, train_loss: 0.2570, test_loss: 2.2062, test_f1: 0.6375
##################ITERATION #8 ****************************************
 epoch: 0, train_loss: 1.5755, test_loss: 1.1403, test_f1: 0.4242
 epoch: 1, train_loss: 1.0255, test_loss: 1.1450, test_f1: 0.4877
 epoch: 2, train_loss: 0.9674, test_loss: 1.0971, test_f1: 0.4787
 epoch: 3, train_loss: 0.9002, test_loss: 1.0706, test_f1: 0.5332
 epoch: 4, train_loss: 0.8812, test_loss: 1.1106, test_f1: 0.5182
 epoch: 5, train_loss: 0.8316, test_loss: 1.1656, test_f1: 0.5205
 epoch: 6, train_loss: 0.8197, test_loss: 1.1747, test_f1: 0.5091
 epoch: 7, train_loss: 0.8138, test_loss: 1.0976, test_f1: 0.5266
 epoch: 8, train_loss: 0.7895, test_loss: 1.1198, test_f1: 0.5369
 epoch: 9, train_loss: 0.7756, test_loss: 1.0447, test_f1: 0.5533
 epoch: 10, train_loss: 0.7715, test_loss: 1.2619, test_f1: 0.5286
 epoch: 11, train_loss: 0.7441, test_loss: 1.1443, test_f1: 0.5364
 epoch: 12, train_loss: 0.7310, test_loss: 1.3178, test_f1: 0.5122
 epoch: 13, train_loss: 0.7329, test_loss: 1.1695, test_f1: 0.5480
 epoch: 14, train_loss: 0.7103, test_loss: 1.1371, test_f1: 0.5652
 epoch: 15, train_loss: 0.6919, test_loss: 1.2102, test_f1: 0.5724
 epoch: 16, train_loss: 0.6860, test_loss: 1.1424, test_f1: 0.5753
 epoch: 17, train_loss: 0.6790, test_loss: 1.2746, test_f1: 0.5739
 epoch: 18, train_loss: 0.6685, test_loss: 1.2256, test_f1: 0.5656
 epoch: 19, train_loss: 0.6574, test_loss: 1.2688, test_f1: 0.5496
 epoch: 20, train_loss: 0.6644, test_loss: 1.4183, test_f1: 0.5558
 epoch: 21, train_loss: 0.6249, test_loss: 1.3931, test_f1: 0.5272
 epoch: 22, train_loss: 0.6269, test_loss: 1.1899, test_f1: 0.6172
 epoch: 23, train_loss: 0.6203, test_loss: 1.2795, test_f1: 0.5354
 epoch: 24, train_loss: 0.6235, test_loss: 1.2735, test_f1: 0.5409
 epoch: 25, train_loss: 0.6151, test_loss: 1.4204, test_f1: 0.5724
 epoch: 26, train_loss: 0.5941, test_loss: 1.5850, test_f1: 0.5446
 epoch: 27, train_loss: 0.5850, test_loss: 1.4491, test_f1: 0.5897
 epoch: 28, train_loss: 0.5865, test_loss: 1.3214, test_f1: 0.6149
 epoch: 29, train_loss: 0.5826, test_loss: 1.2712, test_f1: 0.5620
 epoch: 30, train_loss: 0.5552, test_loss: 1.4684, test_f1: 0.5786
 epoch: 31, train_loss: 0.5700, test_loss: 1.5009, test_f1: 0.5477
 epoch: 32, train_loss: 0.5630, test_loss: 1.3682, test_f1: 0.5279
 epoch: 33, train_loss: 0.5454, test_loss: 1.4122, test_f1: 0.5816
 epoch: 34, train_loss: 0.5342, test_loss: 1.3730, test_f1: 0.5503
 epoch: 35, train_loss: 0.5424, test_loss: 1.4181, test_f1: 0.6173
 epoch: 36, train_loss: 0.5141, test_loss: 1.2917, test_f1: 0.6207
 epoch: 37, train_loss: 0.5084, test_loss: 1.4592, test_f1: 0.5883
 epoch: 38, train_loss: 0.5010, test_loss: 1.7769, test_f1: 0.4902
 epoch: 39, train_loss: 0.5077, test_loss: 1.5214, test_f1: 0.5347
 epoch: 40, train_loss: 0.5114, test_loss: 1.5957, test_f1: 0.6282
 epoch: 41, train_loss: 0.5089, test_loss: 1.5502, test_f1: 0.5781
 epoch: 42, train_loss: 0.4898, test_loss: 1.3109, test_f1: 0.6302
 epoch: 43, train_loss: 0.5204, test_loss: 1.4347, test_f1: 0.6009
 epoch: 44, train_loss: 0.4760, test_loss: 1.5067, test_f1: 0.5172
 epoch: 45, train_loss: 0.5057, test_loss: 1.7159, test_f1: 0.5713
 epoch: 46, train_loss: 0.4781, test_loss: 1.6659, test_f1: 0.5377
 epoch: 47, train_loss: 0.4845, test_loss: 1.4517, test_f1: 0.6195
 epoch: 48, train_loss: 0.4691, test_loss: 1.8805, test_f1: 0.5567
 epoch: 49, train_loss: 0.4754, test_loss: 1.6152, test_f1: 0.5838
 epoch: 50, train_loss: 0.4469, test_loss: 1.5859, test_f1: 0.5533
 epoch: 51, train_loss: 0.4253, test_loss: 1.6045, test_f1: 0.6005
 epoch: 52, train_loss: 0.3966, test_loss: 1.6954, test_f1: 0.5771
 epoch: 53, train_loss: 0.3991, test_loss: 1.8012, test_f1: 0.5778
 epoch: 54, train_loss: 0.3930, test_loss: 1.6349, test_f1: 0.5966
 epoch: 55, train_loss: 0.3634, test_loss: 1.7461, test_f1: 0.5942
 epoch: 56, train_loss: 0.3619, test_loss: 1.8353, test_f1: 0.6108
 epoch: 57, train_loss: 0.3670, test_loss: 2.0294, test_f1: 0.5355
 epoch: 58, train_loss: 0.3790, test_loss: 1.8581, test_f1: 0.5935
 epoch: 59, train_loss: 0.3510, test_loss: 1.8728, test_f1: 0.5981
 epoch: 60, train_loss: 0.3667, test_loss: 1.9613, test_f1: 0.6066
 epoch: 61, train_loss: 0.3249, test_loss: 1.9846, test_f1: 0.6338
 epoch: 62, train_loss: 0.3813, test_loss: 1.8593, test_f1: 0.6009
 epoch: 63, train_loss: 0.3392, test_loss: 1.8623, test_f1: 0.6176
 epoch: 64, train_loss: 0.3408, test_loss: 1.9834, test_f1: 0.5518
 epoch: 65, train_loss: 0.3465, test_loss: 1.9581, test_f1: 0.6076
 epoch: 66, train_loss: 0.3261, test_loss: 2.0249, test_f1: 0.5730
 epoch: 67, train_loss: 0.3341, test_loss: 1.9249, test_f1: 0.6104
 epoch: 68, train_loss: 0.3321, test_loss: 1.9394, test_f1: 0.6074
 epoch: 69, train_loss: 0.3215, test_loss: 1.9698, test_f1: 0.6158
 epoch: 70, train_loss: 0.3118, test_loss: 2.1630, test_f1: 0.6081
 epoch: 71, train_loss: 0.3175, test_loss: 2.3601, test_f1: 0.5592
 epoch: 72, train_loss: 0.2991, test_loss: 2.3357, test_f1: 0.5786
 epoch: 73, train_loss: 0.3006, test_loss: 2.1172, test_f1: 0.6132
 epoch: 74, train_loss: 0.3045, test_loss: 2.3084, test_f1: 0.5524
 epoch: 75, train_loss: 0.2836, test_loss: 2.0540, test_f1: 0.6144
 epoch: 76, train_loss: 0.3436, test_loss: 1.9035, test_f1: 0.5922
 epoch: 77, train_loss: 0.3107, test_loss: 2.1581, test_f1: 0.5923
 epoch: 78, train_loss: 0.2737, test_loss: 2.0873, test_f1: 0.5974
 epoch: 79, train_loss: 0.3162, test_loss: 2.2694, test_f1: 0.5937
 epoch: 80, train_loss: 0.3044, test_loss: 2.2518, test_f1: 0.5867
 epoch: 81, train_loss: 0.2944, test_loss: 2.4456, test_f1: 0.5843
 epoch: 82, train_loss: 0.3113, test_loss: 2.3150, test_f1: 0.5950
 epoch: 83, train_loss: 0.2893, test_loss: 2.4411, test_f1: 0.5739
 epoch: 84, train_loss: 0.3060, test_loss: 2.2822, test_f1: 0.6048
 epoch: 85, train_loss: 0.2822, test_loss: 2.2531, test_f1: 0.6258
 epoch: 86, train_loss: 0.2797, test_loss: 2.1660, test_f1: 0.6167
 epoch: 87, train_loss: 0.2867, test_loss: 2.4605, test_f1: 0.5832
 epoch: 88, train_loss: 0.2822, test_loss: 2.3872, test_f1: 0.5731
 epoch: 89, train_loss: 0.2760, test_loss: 2.4733, test_f1: 0.5948
 epoch: 90, train_loss: 0.2502, test_loss: 2.1467, test_f1: 0.6314
 epoch: 91, train_loss: 0.3186, test_loss: 2.2025, test_f1: 0.5835
 epoch: 92, train_loss: 0.2767, test_loss: 2.4644, test_f1: 0.5838
 epoch: 93, train_loss: 0.2522, test_loss: 2.1758, test_f1: 0.5995
 epoch: 94, train_loss: 0.2670, test_loss: 2.1795, test_f1: 0.5855
 epoch: 95, train_loss: 0.2747, test_loss: 2.2989, test_f1: 0.5525
 epoch: 96, train_loss: 0.2830, test_loss: 2.3973, test_f1: 0.5869
 epoch: 97, train_loss: 0.2904, test_loss: 2.2088, test_f1: 0.6113
 epoch: 98, train_loss: 0.2827, test_loss: 2.3072, test_f1: 0.6107
 epoch: 99, train_loss: 0.2996, test_loss: 2.4499, test_f1: 0.5776
##################ITERATION #9 ****************************************
 epoch: 0, train_loss: 1.5127, test_loss: 1.5400, test_f1: 0.2336
 epoch: 1, train_loss: 1.0467, test_loss: 1.0359, test_f1: 0.5693
 epoch: 2, train_loss: 0.9938, test_loss: 1.0379, test_f1: 0.5573
 epoch: 3, train_loss: 0.9547, test_loss: 1.0398, test_f1: 0.5393
 epoch: 4, train_loss: 0.8974, test_loss: 1.0285, test_f1: 0.5777
 epoch: 5, train_loss: 0.8779, test_loss: 0.9688, test_f1: 0.6212
 epoch: 6, train_loss: 0.8472, test_loss: 1.1046, test_f1: 0.5645
 epoch: 7, train_loss: 0.8485, test_loss: 1.0843, test_f1: 0.5265
 epoch: 8, train_loss: 0.8104, test_loss: 1.0513, test_f1: 0.5945
 epoch: 9, train_loss: 0.7984, test_loss: 1.0958, test_f1: 0.5749
 epoch: 10, train_loss: 0.8007, test_loss: 1.0487, test_f1: 0.6020
 epoch: 11, train_loss: 0.7818, test_loss: 1.0829, test_f1: 0.5603
 epoch: 12, train_loss: 0.7654, test_loss: 1.0190, test_f1: 0.5875
 epoch: 13, train_loss: 0.7239, test_loss: 1.0582, test_f1: 0.5911
 epoch: 14, train_loss: 0.7177, test_loss: 1.0454, test_f1: 0.6255
 epoch: 15, train_loss: 0.6950, test_loss: 1.0679, test_f1: 0.6495
 epoch: 16, train_loss: 0.6960, test_loss: 1.0775, test_f1: 0.5908
 epoch: 17, train_loss: 0.6895, test_loss: 1.2577, test_f1: 0.5885
 epoch: 18, train_loss: 0.6955, test_loss: 1.1452, test_f1: 0.5840
 epoch: 19, train_loss: 0.6964, test_loss: 1.3046, test_f1: 0.6105
 epoch: 20, train_loss: 0.6629, test_loss: 1.1945, test_f1: 0.5663
 epoch: 21, train_loss: 0.6310, test_loss: 1.1692, test_f1: 0.5827
 epoch: 22, train_loss: 0.6410, test_loss: 1.0424, test_f1: 0.6007
 epoch: 23, train_loss: 0.6572, test_loss: 1.1571, test_f1: 0.5930
 epoch: 24, train_loss: 0.6339, test_loss: 1.1016, test_f1: 0.5765
 epoch: 25, train_loss: 0.6026, test_loss: 1.1612, test_f1: 0.6381
 epoch: 26, train_loss: 0.6269, test_loss: 1.2542, test_f1: 0.5783
 epoch: 27, train_loss: 0.6041, test_loss: 1.2233, test_f1: 0.5831
 epoch: 28, train_loss: 0.5965, test_loss: 1.2223, test_f1: 0.5937
 epoch: 29, train_loss: 0.6009, test_loss: 1.2059, test_f1: 0.5693
 epoch: 30, train_loss: 0.5781, test_loss: 1.4384, test_f1: 0.6093
 epoch: 31, train_loss: 0.5541, test_loss: 1.1869, test_f1: 0.6185
 epoch: 32, train_loss: 0.5381, test_loss: 1.3838, test_f1: 0.5721
 epoch: 33, train_loss: 0.5311, test_loss: 1.3489, test_f1: 0.5636
 epoch: 34, train_loss: 0.5390, test_loss: 1.4910, test_f1: 0.5415
 epoch: 35, train_loss: 0.5354, test_loss: 1.4496, test_f1: 0.5827
 epoch: 36, train_loss: 0.5392, test_loss: 1.2686, test_f1: 0.6577
 epoch: 37, train_loss: 0.5406, test_loss: 1.3173, test_f1: 0.6320
 epoch: 38, train_loss: 0.5081, test_loss: 1.4206, test_f1: 0.5665
 epoch: 39, train_loss: 0.5013, test_loss: 1.6175, test_f1: 0.5565
 epoch: 40, train_loss: 0.5332, test_loss: 1.3998, test_f1: 0.6161
 epoch: 41, train_loss: 0.4966, test_loss: 1.2565, test_f1: 0.5946
 epoch: 42, train_loss: 0.5181, test_loss: 1.4051, test_f1: 0.5876
 epoch: 43, train_loss: 0.4974, test_loss: 1.3676, test_f1: 0.6159
 epoch: 44, train_loss: 0.4593, test_loss: 1.4071, test_f1: 0.6112
 epoch: 45, train_loss: 0.4579, test_loss: 1.3758, test_f1: 0.6185
 epoch: 46, train_loss: 0.4609, test_loss: 1.5339, test_f1: 0.6123
 epoch: 47, train_loss: 0.4695, test_loss: 1.5238, test_f1: 0.5957
 epoch: 48, train_loss: 0.4688, test_loss: 1.4936, test_f1: 0.5850
 epoch: 49, train_loss: 0.4151, test_loss: 1.5348, test_f1: 0.5782
 epoch: 50, train_loss: 0.4414, test_loss: 1.6983, test_f1: 0.5579
 epoch: 51, train_loss: 0.4109, test_loss: 1.5941, test_f1: 0.5937
 epoch: 52, train_loss: 0.3722, test_loss: 1.6361, test_f1: 0.6112
 epoch: 53, train_loss: 0.3613, test_loss: 1.5369, test_f1: 0.6274
 epoch: 54, train_loss: 0.3692, test_loss: 1.8294, test_f1: 0.5670
 epoch: 55, train_loss: 0.3607, test_loss: 1.5956, test_f1: 0.6177
 epoch: 56, train_loss: 0.3698, test_loss: 1.6715, test_f1: 0.5969
 epoch: 57, train_loss: 0.3465, test_loss: 1.6058, test_f1: 0.5680
 epoch: 58, train_loss: 0.3176, test_loss: 1.6326, test_f1: 0.5982
 epoch: 59, train_loss: 0.3639, test_loss: 1.7087, test_f1: 0.6080
 epoch: 60, train_loss: 0.3199, test_loss: 1.8007, test_f1: 0.5954
 epoch: 61, train_loss: 0.3441, test_loss: 1.7542, test_f1: 0.5915
 epoch: 62, train_loss: 0.3485, test_loss: 1.6992, test_f1: 0.6043
 epoch: 63, train_loss: 0.3456, test_loss: 1.7912, test_f1: 0.5890
 epoch: 64, train_loss: 0.3201, test_loss: 1.7566, test_f1: 0.6039
 epoch: 65, train_loss: 0.3072, test_loss: 1.6810, test_f1: 0.5809
 epoch: 66, train_loss: 0.3195, test_loss: 1.6790, test_f1: 0.6199
 epoch: 67, train_loss: 0.3445, test_loss: 1.8415, test_f1: 0.6043
 epoch: 68, train_loss: 0.3184, test_loss: 1.7293, test_f1: 0.5849
 epoch: 69, train_loss: 0.3283, test_loss: 1.7279, test_f1: 0.6120
 epoch: 70, train_loss: 0.2959, test_loss: 1.8713, test_f1: 0.6070
 epoch: 71, train_loss: 0.3271, test_loss: 1.7241, test_f1: 0.5915
 epoch: 72, train_loss: 0.2856, test_loss: 1.8644, test_f1: 0.6225
 epoch: 73, train_loss: 0.2863, test_loss: 1.8248, test_f1: 0.5751
 epoch: 74, train_loss: 0.3124, test_loss: 2.0458, test_f1: 0.5671
 epoch: 75, train_loss: 0.3041, test_loss: 1.8550, test_f1: 0.6012
 epoch: 76, train_loss: 0.3158, test_loss: 1.8704, test_f1: 0.5904
 epoch: 77, train_loss: 0.3068, test_loss: 2.0074, test_f1: 0.5922
 epoch: 78, train_loss: 0.2944, test_loss: 1.8868, test_f1: 0.5773
 epoch: 79, train_loss: 0.2720, test_loss: 1.9836, test_f1: 0.5958
 epoch: 80, train_loss: 0.2604, test_loss: 2.0234, test_f1: 0.5904
 epoch: 81, train_loss: 0.2867, test_loss: 2.0809, test_f1: 0.5886
 epoch: 82, train_loss: 0.3105, test_loss: 2.0081, test_f1: 0.5636
 epoch: 83, train_loss: 0.2956, test_loss: 1.8316, test_f1: 0.5897
 epoch: 84, train_loss: 0.2770, test_loss: 2.1209, test_f1: 0.5896
 epoch: 85, train_loss: 0.2643, test_loss: 2.1831, test_f1: 0.5761
 epoch: 86, train_loss: 0.2550, test_loss: 2.0309, test_f1: 0.5968
 epoch: 87, train_loss: 0.2735, test_loss: 2.2215, test_f1: 0.5634
 epoch: 88, train_loss: 0.2806, test_loss: 2.0637, test_f1: 0.5854
 epoch: 89, train_loss: 0.2815, test_loss: 2.0720, test_f1: 0.5864
 epoch: 90, train_loss: 0.2566, test_loss: 1.9042, test_f1: 0.5772
 epoch: 91, train_loss: 0.2321, test_loss: 2.1328, test_f1: 0.5846
 epoch: 92, train_loss: 0.2613, test_loss: 2.2440, test_f1: 0.5952
 epoch: 93, train_loss: 0.2530, test_loss: 2.1498, test_f1: 0.5726
 epoch: 94, train_loss: 0.2537, test_loss: 2.2810, test_f1: 0.5626
 epoch: 95, train_loss: 0.2555, test_loss: 2.1283, test_f1: 0.5787
 epoch: 96, train_loss: 0.2561, test_loss: 2.4600, test_f1: 0.5547
 epoch: 97, train_loss: 0.2415, test_loss: 2.3988, test_f1: 0.5649
 epoch: 98, train_loss: 0.2311, test_loss: 2.2788, test_f1: 0.5594
 epoch: 99, train_loss: 0.2109, test_loss: 2.2204, test_f1: 0.5782

Training completed in 504.31 seconds
Best F1: 0.6995 at epoch 38
Mean F1 across iterations: 0.6540  0.0195
========================FINAL RESULTS================================
FEGIN weighted F1: 0.6995  0.0195
python main.py --data ltspice_demos --representation component_pin_net --model FEGIN --layers 2 --hiddens 64 --batch_size 32 --lr 0.001 --emb_size 128 --epochs 100 --save_appendix component_pin_net_L2_H64_BS32_LR0.001_E128 --no_val
-----



STDERR:
  File "main.py", line 370, in <module>
    main()
  File "main.py", line 254, in main
    dataset = dataset_class(
  File "/home/philip/projects/ltspice_examples_code_repo/Circuit-Completion-Using-GNNs/component_classification_with_link_prediction_head/evaluation/FEGIN/kernel/circuit_datasets.py", line 15, in __init__
    self.data, self.slices = torch.load(self.processed_paths[0])
  File "/home/philip/.local/lib/python3.8/site-packages/torch/serialization.py", line 1040, in load
    warnings.warn(
  File "/usr/lib/python3.8/warnings.py", line 109, in _showwarnmsg
    sw(msg.message, msg.category, msg.filename, msg.lineno,
  File "main.py", line 47, in warn_with_traceback
    traceback.print_stack(file=log)
/home/philip/projects/ltspice_examples_code_repo/Circuit-Completion-Using-GNNs/component_classification_with_link_prediction_head/evaluation/FEGIN/kernel/circuit_datasets.py:15: FutureWarning: You are using `torch.load` with `weights_only=False` (the current default value), which uses the default pickle module implicitly. It is possible to construct malicious pickle data which will execute arbitrary code during unpickling (See https://github.com/pytorch/pytorch/blob/main/SECURITY.md#untrusted-models for more details). In a future release, the default value for `weights_only` will be flipped to `True`. This limits the functions that could be executed during unpickling. Arbitrary objects will no longer be allowed to be loaded via this mode unless they are explicitly allowlisted by the user via `torch.serialization.add_safe_globals`. We recommend you start setting `weights_only=True` for any use case where you don't have full control of the loaded file. Please open an issue on GitHub for any issues related to this experimental feature.
  self.data, self.slices = torch.load(self.processed_paths[0])
