STDOUT:
Results will be saved in /home/philip/projects/ltspice_examples_code_repo/Circuit-Completion-Using-GNNs/component_classification_with_link_prediction_head/evaluation/FEGIN/results/model_FEGIN_dataset_ltspice_demos
Command line input: python main.py --data ltspice_demos --representation component_pin_net --model FEGIN --layers 4 --hiddens 32 --batch_size 64 --lr 0.001 --emb_size 512 --epochs 100 --save_appendix component_pin_net_L4_H32_BS64_LR0.001_E512 --no_val
 is saved.
-----
ltspice_demos - FEGIN
Using 4 layers, 32 hidden units, h = 2
Loading component_pin_net representation dataset
ENTERED
Training FEGIN on component_pin_net representation
Train: 1565, Test: 383
##################ITERATION #0 ****************************************
 epoch: 0, train_loss: 1.2853, test_loss: 1.3107, test_f1: 0.2281
 epoch: 1, train_loss: 1.1964, test_loss: 1.2493, test_f1: 0.3394
 epoch: 2, train_loss: 1.1314, test_loss: 1.1875, test_f1: 0.4408
 epoch: 3, train_loss: 1.0727, test_loss: 1.1454, test_f1: 0.4423
 epoch: 4, train_loss: 1.0393, test_loss: 1.1325, test_f1: 0.4364
 epoch: 5, train_loss: 1.0141, test_loss: 1.1040, test_f1: 0.4534
 epoch: 6, train_loss: 0.9986, test_loss: 1.1118, test_f1: 0.4396
 epoch: 7, train_loss: 0.9934, test_loss: 1.0901, test_f1: 0.4500
 epoch: 8, train_loss: 0.9718, test_loss: 1.0971, test_f1: 0.4485
 epoch: 9, train_loss: 0.9885, test_loss: 1.0838, test_f1: 0.4624
 epoch: 10, train_loss: 0.9705, test_loss: 1.0875, test_f1: 0.4694
 epoch: 11, train_loss: 0.9489, test_loss: 1.0966, test_f1: 0.4671
 epoch: 12, train_loss: 0.9398, test_loss: 1.0501, test_f1: 0.5014
 epoch: 13, train_loss: 0.9463, test_loss: 1.0609, test_f1: 0.4912
 epoch: 14, train_loss: 0.9354, test_loss: 1.0515, test_f1: 0.5137
 epoch: 15, train_loss: 0.9139, test_loss: 1.0302, test_f1: 0.5243
 epoch: 16, train_loss: 0.9132, test_loss: 1.0555, test_f1: 0.5070
 epoch: 17, train_loss: 0.8984, test_loss: 1.0286, test_f1: 0.5405
 epoch: 18, train_loss: 0.8963, test_loss: 1.0376, test_f1: 0.5488
 epoch: 19, train_loss: 0.9015, test_loss: 1.0997, test_f1: 0.5439
 epoch: 20, train_loss: 0.9021, test_loss: 1.0762, test_f1: 0.5237
 epoch: 21, train_loss: 0.8803, test_loss: 1.0486, test_f1: 0.5503
 epoch: 22, train_loss: 0.8841, test_loss: 1.0527, test_f1: 0.5186
 epoch: 23, train_loss: 0.8621, test_loss: 1.0033, test_f1: 0.5798
 epoch: 24, train_loss: 0.8619, test_loss: 1.0136, test_f1: 0.5934
 epoch: 25, train_loss: 0.8427, test_loss: 1.0049, test_f1: 0.5817
 epoch: 26, train_loss: 0.8353, test_loss: 1.0114, test_f1: 0.5967
 epoch: 27, train_loss: 0.8315, test_loss: 1.0198, test_f1: 0.5588
 epoch: 28, train_loss: 0.8432, test_loss: 0.9725, test_f1: 0.6110
 epoch: 29, train_loss: 0.8124, test_loss: 1.0424, test_f1: 0.5872
 epoch: 30, train_loss: 0.8047, test_loss: 1.1428, test_f1: 0.5678
 epoch: 31, train_loss: 0.8072, test_loss: 0.9875, test_f1: 0.5938
 epoch: 32, train_loss: 0.7931, test_loss: 0.9720, test_f1: 0.6038
 epoch: 33, train_loss: 0.7638, test_loss: 0.9772, test_f1: 0.6314
 epoch: 34, train_loss: 0.7571, test_loss: 0.9947, test_f1: 0.6271
 epoch: 35, train_loss: 0.7564, test_loss: 0.9780, test_f1: 0.5923
 epoch: 36, train_loss: 0.7551, test_loss: 1.0327, test_f1: 0.5624
 epoch: 37, train_loss: 0.7438, test_loss: 1.0530, test_f1: 0.5643
 epoch: 38, train_loss: 0.7358, test_loss: 0.9945, test_f1: 0.6066
 epoch: 39, train_loss: 0.7013, test_loss: 0.9409, test_f1: 0.6216
 epoch: 40, train_loss: 0.7145, test_loss: 0.9329, test_f1: 0.6606
 epoch: 41, train_loss: 0.6816, test_loss: 1.0419, test_f1: 0.6283
 epoch: 42, train_loss: 0.6915, test_loss: 1.0812, test_f1: 0.5522
 epoch: 43, train_loss: 0.6698, test_loss: 1.0140, test_f1: 0.5982
 epoch: 44, train_loss: 0.6675, test_loss: 1.0035, test_f1: 0.6447
 epoch: 45, train_loss: 0.6681, test_loss: 1.0138, test_f1: 0.6224
 epoch: 46, train_loss: 0.6210, test_loss: 0.9997, test_f1: 0.6126
 epoch: 47, train_loss: 0.6618, test_loss: 1.0879, test_f1: 0.6148
 epoch: 48, train_loss: 0.6467, test_loss: 1.0877, test_f1: 0.5886
 epoch: 49, train_loss: 0.6231, test_loss: 1.0646, test_f1: 0.6109
 epoch: 50, train_loss: 0.6172, test_loss: 1.1114, test_f1: 0.5916
 epoch: 51, train_loss: 0.6068, test_loss: 1.0795, test_f1: 0.6095
 epoch: 52, train_loss: 0.6091, test_loss: 1.0306, test_f1: 0.6068
 epoch: 53, train_loss: 0.5571, test_loss: 1.0327, test_f1: 0.6266
 epoch: 54, train_loss: 0.5675, test_loss: 1.0851, test_f1: 0.5826
 epoch: 55, train_loss: 0.5535, test_loss: 1.0739, test_f1: 0.6482
 epoch: 56, train_loss: 0.5317, test_loss: 1.0951, test_f1: 0.6349
 epoch: 57, train_loss: 0.5480, test_loss: 1.0502, test_f1: 0.6315
 epoch: 58, train_loss: 0.5503, test_loss: 1.1619, test_f1: 0.6096
 epoch: 59, train_loss: 0.5415, test_loss: 1.0525, test_f1: 0.6278
 epoch: 60, train_loss: 0.5322, test_loss: 1.1020, test_f1: 0.6316
 epoch: 61, train_loss: 0.5177, test_loss: 1.1752, test_f1: 0.6288
 epoch: 62, train_loss: 0.5051, test_loss: 1.1091, test_f1: 0.6242
 epoch: 63, train_loss: 0.5244, test_loss: 1.0942, test_f1: 0.6498
 epoch: 64, train_loss: 0.5312, test_loss: 1.1021, test_f1: 0.6422
 epoch: 65, train_loss: 0.5065, test_loss: 1.1944, test_f1: 0.5993
 epoch: 66, train_loss: 0.5124, test_loss: 1.1592, test_f1: 0.6177
 epoch: 67, train_loss: 0.4966, test_loss: 1.0822, test_f1: 0.6366
 epoch: 68, train_loss: 0.4737, test_loss: 1.2133, test_f1: 0.6309
 epoch: 69, train_loss: 0.4928, test_loss: 1.3310, test_f1: 0.6010
 epoch: 70, train_loss: 0.4848, test_loss: 1.1723, test_f1: 0.6223
 epoch: 71, train_loss: 0.4828, test_loss: 1.3904, test_f1: 0.6149
 epoch: 72, train_loss: 0.4848, test_loss: 1.1768, test_f1: 0.6332
 epoch: 73, train_loss: 0.4725, test_loss: 1.1508, test_f1: 0.6327
 epoch: 74, train_loss: 0.4651, test_loss: 1.3032, test_f1: 0.6127
 epoch: 75, train_loss: 0.4629, test_loss: 1.4197, test_f1: 0.5862
 epoch: 76, train_loss: 0.4565, test_loss: 1.2886, test_f1: 0.5871
 epoch: 77, train_loss: 0.4603, test_loss: 1.2196, test_f1: 0.6084
 epoch: 78, train_loss: 0.4277, test_loss: 1.3825, test_f1: 0.6179
 epoch: 79, train_loss: 0.4353, test_loss: 1.2726, test_f1: 0.6235
 epoch: 80, train_loss: 0.4315, test_loss: 1.3681, test_f1: 0.5910
 epoch: 81, train_loss: 0.4340, test_loss: 1.3268, test_f1: 0.5988
 epoch: 82, train_loss: 0.4366, test_loss: 1.3638, test_f1: 0.6195
 epoch: 83, train_loss: 0.4313, test_loss: 1.2891, test_f1: 0.6042
 epoch: 84, train_loss: 0.4579, test_loss: 1.3500, test_f1: 0.6135
 epoch: 85, train_loss: 0.4575, test_loss: 1.3707, test_f1: 0.6193
 epoch: 86, train_loss: 0.4353, test_loss: 1.4855, test_f1: 0.5954
 epoch: 87, train_loss: 0.4198, test_loss: 1.4304, test_f1: 0.6451
 epoch: 88, train_loss: 0.4112, test_loss: 1.4810, test_f1: 0.6356
 epoch: 89, train_loss: 0.3936, test_loss: 1.3645, test_f1: 0.6083
 epoch: 90, train_loss: 0.4307, test_loss: 1.3169, test_f1: 0.6178
 epoch: 91, train_loss: 0.3893, test_loss: 1.3751, test_f1: 0.6115
 epoch: 92, train_loss: 0.3929, test_loss: 1.3936, test_f1: 0.6266
 epoch: 93, train_loss: 0.4035, test_loss: 1.3043, test_f1: 0.6492
 epoch: 94, train_loss: 0.3927, test_loss: 1.6578, test_f1: 0.5833
 epoch: 95, train_loss: 0.3728, test_loss: 1.4229, test_f1: 0.6181
 epoch: 96, train_loss: 0.3833, test_loss: 1.5554, test_f1: 0.6396
 epoch: 97, train_loss: 0.3745, test_loss: 1.5017, test_f1: 0.6174
 epoch: 98, train_loss: 0.3726, test_loss: 1.5044, test_f1: 0.6135
 epoch: 99, train_loss: 0.3792, test_loss: 1.5573, test_f1: 0.6221
##################ITERATION #1 ****************************************
 epoch: 0, train_loss: 1.1817, test_loss: 1.3103, test_f1: 0.3396
 epoch: 1, train_loss: 1.0676, test_loss: 1.1940, test_f1: 0.3632
 epoch: 2, train_loss: 1.0191, test_loss: 1.0996, test_f1: 0.4774
 epoch: 3, train_loss: 1.0010, test_loss: 1.0750, test_f1: 0.5103
 epoch: 4, train_loss: 0.9716, test_loss: 1.0737, test_f1: 0.5219
 epoch: 5, train_loss: 0.9661, test_loss: 1.0428, test_f1: 0.5303
 epoch: 6, train_loss: 0.9362, test_loss: 1.0405, test_f1: 0.5141
 epoch: 7, train_loss: 0.9353, test_loss: 1.0299, test_f1: 0.5555
 epoch: 8, train_loss: 0.9162, test_loss: 1.0237, test_f1: 0.6031
 epoch: 9, train_loss: 0.9107, test_loss: 1.0169, test_f1: 0.5630
 epoch: 10, train_loss: 0.8998, test_loss: 1.0303, test_f1: 0.5771
 epoch: 11, train_loss: 0.8797, test_loss: 0.9995, test_f1: 0.5659
 epoch: 12, train_loss: 0.8753, test_loss: 1.0229, test_f1: 0.5641
 epoch: 13, train_loss: 0.8616, test_loss: 1.0067, test_f1: 0.5921
 epoch: 14, train_loss: 0.8413, test_loss: 1.0142, test_f1: 0.6008
 epoch: 15, train_loss: 0.8284, test_loss: 1.0360, test_f1: 0.6183
 epoch: 16, train_loss: 0.8261, test_loss: 1.0257, test_f1: 0.6166
 epoch: 17, train_loss: 0.7956, test_loss: 1.1340, test_f1: 0.5391
 epoch: 18, train_loss: 0.8146, test_loss: 1.0406, test_f1: 0.5900
 epoch: 19, train_loss: 0.7895, test_loss: 1.0393, test_f1: 0.5719
 epoch: 20, train_loss: 0.7738, test_loss: 0.9946, test_f1: 0.6102
 epoch: 21, train_loss: 0.7536, test_loss: 1.0649, test_f1: 0.5805
 epoch: 22, train_loss: 0.7552, test_loss: 1.0773, test_f1: 0.5943
 epoch: 23, train_loss: 0.7335, test_loss: 1.0169, test_f1: 0.5745
 epoch: 24, train_loss: 0.7424, test_loss: 0.9999, test_f1: 0.6218
 epoch: 25, train_loss: 0.7249, test_loss: 1.0410, test_f1: 0.5769
 epoch: 26, train_loss: 0.6838, test_loss: 1.0490, test_f1: 0.6211
 epoch: 27, train_loss: 0.6649, test_loss: 1.1140, test_f1: 0.5948
 epoch: 28, train_loss: 0.6626, test_loss: 1.1241, test_f1: 0.6089
 epoch: 29, train_loss: 0.6628, test_loss: 1.1087, test_f1: 0.5487
 epoch: 30, train_loss: 0.6732, test_loss: 1.1734, test_f1: 0.5744
 epoch: 31, train_loss: 0.6379, test_loss: 1.1402, test_f1: 0.5868
 epoch: 32, train_loss: 0.6481, test_loss: 1.2499, test_f1: 0.5311
 epoch: 33, train_loss: 0.6773, test_loss: 1.1493, test_f1: 0.6049
 epoch: 34, train_loss: 0.6289, test_loss: 1.1207, test_f1: 0.5959
 epoch: 35, train_loss: 0.6344, test_loss: 1.2057, test_f1: 0.5307
 epoch: 36, train_loss: 0.6219, test_loss: 1.1770, test_f1: 0.5591
 epoch: 37, train_loss: 0.6200, test_loss: 1.1516, test_f1: 0.5650
 epoch: 38, train_loss: 0.6174, test_loss: 1.1908, test_f1: 0.5671
 epoch: 39, train_loss: 0.5842, test_loss: 1.2319, test_f1: 0.5952
 epoch: 40, train_loss: 0.5904, test_loss: 1.3076, test_f1: 0.5430
 epoch: 41, train_loss: 0.5996, test_loss: 1.2789, test_f1: 0.5957
 epoch: 42, train_loss: 0.5703, test_loss: 1.1944, test_f1: 0.5816
 epoch: 43, train_loss: 0.5548, test_loss: 1.1823, test_f1: 0.6156
 epoch: 44, train_loss: 0.5522, test_loss: 1.2888, test_f1: 0.6070
 epoch: 45, train_loss: 0.5660, test_loss: 1.2935, test_f1: 0.5643
 epoch: 46, train_loss: 0.5732, test_loss: 1.3185, test_f1: 0.6003
 epoch: 47, train_loss: 0.5485, test_loss: 1.2578, test_f1: 0.5714
 epoch: 48, train_loss: 0.5497, test_loss: 1.3274, test_f1: 0.5966
 epoch: 49, train_loss: 0.5491, test_loss: 1.3762, test_f1: 0.5895
 epoch: 50, train_loss: 0.5290, test_loss: 1.3231, test_f1: 0.6388
 epoch: 51, train_loss: 0.4896, test_loss: 1.3351, test_f1: 0.6064
 epoch: 52, train_loss: 0.4891, test_loss: 1.4404, test_f1: 0.5650
 epoch: 53, train_loss: 0.4962, test_loss: 1.3536, test_f1: 0.6111
 epoch: 54, train_loss: 0.4769, test_loss: 1.3069, test_f1: 0.6167
 epoch: 55, train_loss: 0.4468, test_loss: 1.3396, test_f1: 0.5999
 epoch: 56, train_loss: 0.4686, test_loss: 1.3873, test_f1: 0.5999
 epoch: 57, train_loss: 0.4428, test_loss: 1.3984, test_f1: 0.5873
 epoch: 58, train_loss: 0.4581, test_loss: 1.4463, test_f1: 0.5788
 epoch: 59, train_loss: 0.4341, test_loss: 1.4496, test_f1: 0.5858
 epoch: 60, train_loss: 0.4263, test_loss: 1.3803, test_f1: 0.5832
 epoch: 61, train_loss: 0.4531, test_loss: 1.4019, test_f1: 0.6236
 epoch: 62, train_loss: 0.4352, test_loss: 1.4793, test_f1: 0.5758
 epoch: 63, train_loss: 0.4467, test_loss: 1.5715, test_f1: 0.5559
 epoch: 64, train_loss: 0.4194, test_loss: 1.4219, test_f1: 0.6071
 epoch: 65, train_loss: 0.4422, test_loss: 1.5011, test_f1: 0.5868
 epoch: 66, train_loss: 0.3850, test_loss: 1.4911, test_f1: 0.5980
 epoch: 67, train_loss: 0.4276, test_loss: 1.4374, test_f1: 0.5884
 epoch: 68, train_loss: 0.4121, test_loss: 1.5038, test_f1: 0.5702
 epoch: 69, train_loss: 0.4091, test_loss: 1.6106, test_f1: 0.5704
 epoch: 70, train_loss: 0.3975, test_loss: 1.4731, test_f1: 0.6262
 epoch: 71, train_loss: 0.4019, test_loss: 1.6775, test_f1: 0.5684
 epoch: 72, train_loss: 0.3910, test_loss: 1.5503, test_f1: 0.6108
 epoch: 73, train_loss: 0.3989, test_loss: 1.6567, test_f1: 0.5697
 epoch: 74, train_loss: 0.3887, test_loss: 1.5459, test_f1: 0.5973
 epoch: 75, train_loss: 0.3704, test_loss: 1.6685, test_f1: 0.5554
 epoch: 76, train_loss: 0.3895, test_loss: 1.5565, test_f1: 0.6075
 epoch: 77, train_loss: 0.3503, test_loss: 1.5959, test_f1: 0.5944
 epoch: 78, train_loss: 0.3822, test_loss: 1.6577, test_f1: 0.5884
 epoch: 79, train_loss: 0.4137, test_loss: 1.6565, test_f1: 0.5485
 epoch: 80, train_loss: 0.3862, test_loss: 1.5000, test_f1: 0.6059
 epoch: 81, train_loss: 0.3612, test_loss: 1.5876, test_f1: 0.5920
 epoch: 82, train_loss: 0.3766, test_loss: 1.6074, test_f1: 0.5913
 epoch: 83, train_loss: 0.3693, test_loss: 1.5789, test_f1: 0.5787
 epoch: 84, train_loss: 0.3776, test_loss: 1.6548, test_f1: 0.5605
 epoch: 85, train_loss: 0.3673, test_loss: 1.6876, test_f1: 0.5813
 epoch: 86, train_loss: 0.3755, test_loss: 1.6934, test_f1: 0.5711
 epoch: 87, train_loss: 0.3459, test_loss: 1.6890, test_f1: 0.5870
 epoch: 88, train_loss: 0.3555, test_loss: 1.7186, test_f1: 0.5923
 epoch: 89, train_loss: 0.3683, test_loss: 1.6959, test_f1: 0.5652
 epoch: 90, train_loss: 0.3421, test_loss: 1.6730, test_f1: 0.5840
 epoch: 91, train_loss: 0.3555, test_loss: 1.7918, test_f1: 0.5485
 epoch: 92, train_loss: 0.3442, test_loss: 1.7155, test_f1: 0.5945
 epoch: 93, train_loss: 0.3267, test_loss: 1.8648, test_f1: 0.5702
 epoch: 94, train_loss: 0.3343, test_loss: 1.7301, test_f1: 0.5628
 epoch: 95, train_loss: 0.3373, test_loss: 1.8657, test_f1: 0.5774
 epoch: 96, train_loss: 0.3370, test_loss: 1.7647, test_f1: 0.5894
 epoch: 97, train_loss: 0.3447, test_loss: 1.8692, test_f1: 0.5685
 epoch: 98, train_loss: 0.3511, test_loss: 1.7896, test_f1: 0.5940
 epoch: 99, train_loss: 0.3635, test_loss: 1.7706, test_f1: 0.6009
##################ITERATION #2 ****************************************
 epoch: 0, train_loss: 1.1754, test_loss: 1.3015, test_f1: 0.3047
 epoch: 1, train_loss: 1.0446, test_loss: 1.1934, test_f1: 0.4027
 epoch: 2, train_loss: 0.9968, test_loss: 1.0563, test_f1: 0.5546
 epoch: 3, train_loss: 0.9663, test_loss: 1.0329, test_f1: 0.5836
 epoch: 4, train_loss: 0.9353, test_loss: 1.0147, test_f1: 0.5940
 epoch: 5, train_loss: 0.9075, test_loss: 1.0151, test_f1: 0.5755
 epoch: 6, train_loss: 0.8949, test_loss: 1.0182, test_f1: 0.5592
 epoch: 7, train_loss: 0.8737, test_loss: 1.0240, test_f1: 0.5190
 epoch: 8, train_loss: 0.8625, test_loss: 1.0092, test_f1: 0.5580
 epoch: 9, train_loss: 0.8222, test_loss: 1.0219, test_f1: 0.5824
 epoch: 10, train_loss: 0.8291, test_loss: 1.0201, test_f1: 0.5860
 epoch: 11, train_loss: 0.8051, test_loss: 1.0331, test_f1: 0.6334
 epoch: 12, train_loss: 0.7931, test_loss: 1.0316, test_f1: 0.5622
 epoch: 13, train_loss: 0.7711, test_loss: 1.0171, test_f1: 0.6031
 epoch: 14, train_loss: 0.7636, test_loss: 1.0407, test_f1: 0.5750
 epoch: 15, train_loss: 0.7489, test_loss: 1.0678, test_f1: 0.6287
 epoch: 16, train_loss: 0.7426, test_loss: 1.0130, test_f1: 0.6043
 epoch: 17, train_loss: 0.7287, test_loss: 1.0206, test_f1: 0.6290
 epoch: 18, train_loss: 0.7183, test_loss: 1.0249, test_f1: 0.6193
 epoch: 19, train_loss: 0.7082, test_loss: 1.0498, test_f1: 0.6452
 epoch: 20, train_loss: 0.6895, test_loss: 1.0466, test_f1: 0.5874
 epoch: 21, train_loss: 0.6948, test_loss: 1.0818, test_f1: 0.6122
 epoch: 22, train_loss: 0.6762, test_loss: 1.0471, test_f1: 0.6325
 epoch: 23, train_loss: 0.6814, test_loss: 1.1008, test_f1: 0.6241
 epoch: 24, train_loss: 0.6649, test_loss: 1.0317, test_f1: 0.6250
 epoch: 25, train_loss: 0.6417, test_loss: 1.0858, test_f1: 0.6509
 epoch: 26, train_loss: 0.6186, test_loss: 1.0713, test_f1: 0.6306
 epoch: 27, train_loss: 0.6257, test_loss: 1.0229, test_f1: 0.6268
 epoch: 28, train_loss: 0.6063, test_loss: 1.0641, test_f1: 0.6418
 epoch: 29, train_loss: 0.6524, test_loss: 1.0750, test_f1: 0.5965
 epoch: 30, train_loss: 0.5996, test_loss: 1.1052, test_f1: 0.6043
 epoch: 31, train_loss: 0.5989, test_loss: 1.1486, test_f1: 0.6277
 epoch: 32, train_loss: 0.6232, test_loss: 1.1632, test_f1: 0.6148
 epoch: 33, train_loss: 0.5880, test_loss: 1.3255, test_f1: 0.6057
 epoch: 34, train_loss: 0.5685, test_loss: 1.1776, test_f1: 0.6238
 epoch: 35, train_loss: 0.5892, test_loss: 1.2152, test_f1: 0.5839
 epoch: 36, train_loss: 0.5658, test_loss: 1.2272, test_f1: 0.5800
 epoch: 37, train_loss: 0.5780, test_loss: 1.2171, test_f1: 0.6160
 epoch: 38, train_loss: 0.5661, test_loss: 1.1797, test_f1: 0.5827
 epoch: 39, train_loss: 0.5607, test_loss: 1.2356, test_f1: 0.6285
 epoch: 40, train_loss: 0.5293, test_loss: 1.2490, test_f1: 0.6032
 epoch: 41, train_loss: 0.5135, test_loss: 1.4348, test_f1: 0.5666
 epoch: 42, train_loss: 0.5418, test_loss: 1.2606, test_f1: 0.6291
 epoch: 43, train_loss: 0.5157, test_loss: 1.3962, test_f1: 0.6195
 epoch: 44, train_loss: 0.5064, test_loss: 1.4225, test_f1: 0.6008
 epoch: 45, train_loss: 0.5103, test_loss: 1.4514, test_f1: 0.6217
 epoch: 46, train_loss: 0.4970, test_loss: 1.3289, test_f1: 0.6287
 epoch: 47, train_loss: 0.4811, test_loss: 1.3952, test_f1: 0.5929
 epoch: 48, train_loss: 0.4983, test_loss: 1.3569, test_f1: 0.6125
 epoch: 49, train_loss: 0.4956, test_loss: 1.3427, test_f1: 0.6107
 epoch: 50, train_loss: 0.5047, test_loss: 1.4266, test_f1: 0.5926
 epoch: 51, train_loss: 0.4488, test_loss: 1.3789, test_f1: 0.6227
 epoch: 52, train_loss: 0.4408, test_loss: 1.4520, test_f1: 0.6074
 epoch: 53, train_loss: 0.4273, test_loss: 1.4334, test_f1: 0.6017
 epoch: 54, train_loss: 0.4148, test_loss: 1.4686, test_f1: 0.6124
 epoch: 55, train_loss: 0.4216, test_loss: 1.4665, test_f1: 0.6103
 epoch: 56, train_loss: 0.4297, test_loss: 1.4733, test_f1: 0.6028
 epoch: 57, train_loss: 0.4187, test_loss: 1.4265, test_f1: 0.6135
 epoch: 58, train_loss: 0.3966, test_loss: 1.4584, test_f1: 0.6121
 epoch: 59, train_loss: 0.3902, test_loss: 1.5248, test_f1: 0.6296
 epoch: 60, train_loss: 0.3827, test_loss: 1.5619, test_f1: 0.6196
 epoch: 61, train_loss: 0.3724, test_loss: 1.5621, test_f1: 0.6063
 epoch: 62, train_loss: 0.3767, test_loss: 1.6415, test_f1: 0.6074
 epoch: 63, train_loss: 0.3749, test_loss: 1.5847, test_f1: 0.6130
 epoch: 64, train_loss: 0.3579, test_loss: 1.6106, test_f1: 0.6126
 epoch: 65, train_loss: 0.3585, test_loss: 1.6691, test_f1: 0.6206
 epoch: 66, train_loss: 0.3585, test_loss: 1.7575, test_f1: 0.6068
 epoch: 67, train_loss: 0.3683, test_loss: 1.5950, test_f1: 0.6030
 epoch: 68, train_loss: 0.3616, test_loss: 1.6745, test_f1: 0.6096
 epoch: 69, train_loss: 0.3486, test_loss: 1.7126, test_f1: 0.6147
 epoch: 70, train_loss: 0.3643, test_loss: 1.6993, test_f1: 0.6173
 epoch: 71, train_loss: 0.3634, test_loss: 1.9241, test_f1: 0.6314
 epoch: 72, train_loss: 0.3725, test_loss: 1.8441, test_f1: 0.5849
 epoch: 73, train_loss: 0.3553, test_loss: 1.7477, test_f1: 0.5844
 epoch: 74, train_loss: 0.3320, test_loss: 1.8112, test_f1: 0.6065
 epoch: 75, train_loss: 0.3671, test_loss: 1.7697, test_f1: 0.6048
 epoch: 76, train_loss: 0.3391, test_loss: 1.7674, test_f1: 0.6142
 epoch: 77, train_loss: 0.3187, test_loss: 1.8155, test_f1: 0.5912
 epoch: 78, train_loss: 0.3389, test_loss: 1.8536, test_f1: 0.6116
 epoch: 79, train_loss: 0.3393, test_loss: 1.9111, test_f1: 0.5992
 epoch: 80, train_loss: 0.3111, test_loss: 1.8952, test_f1: 0.5844
 epoch: 81, train_loss: 0.3405, test_loss: 1.9141, test_f1: 0.6032
 epoch: 82, train_loss: 0.3194, test_loss: 1.9306, test_f1: 0.5939
 epoch: 83, train_loss: 0.3476, test_loss: 1.8289, test_f1: 0.6180
 epoch: 84, train_loss: 0.3098, test_loss: 1.9707, test_f1: 0.5993
 epoch: 85, train_loss: 0.3479, test_loss: 1.9339, test_f1: 0.6013
 epoch: 86, train_loss: 0.3119, test_loss: 1.7984, test_f1: 0.5994
 epoch: 87, train_loss: 0.3170, test_loss: 2.0669, test_f1: 0.5883
 epoch: 88, train_loss: 0.3010, test_loss: 2.0132, test_f1: 0.6081
 epoch: 89, train_loss: 0.3106, test_loss: 2.0865, test_f1: 0.6072
 epoch: 90, train_loss: 0.2953, test_loss: 2.1273, test_f1: 0.5946
 epoch: 91, train_loss: 0.3048, test_loss: 2.0479, test_f1: 0.6040
 epoch: 92, train_loss: 0.3001, test_loss: 1.9647, test_f1: 0.6059
 epoch: 93, train_loss: 0.2800, test_loss: 1.9467, test_f1: 0.6163
 epoch: 94, train_loss: 0.2813, test_loss: 2.0693, test_f1: 0.6050
 epoch: 95, train_loss: 0.2857, test_loss: 2.0478, test_f1: 0.5895
 epoch: 96, train_loss: 0.2679, test_loss: 2.0541, test_f1: 0.6010
 epoch: 97, train_loss: 0.2612, test_loss: 2.1365, test_f1: 0.5925
 epoch: 98, train_loss: 0.2701, test_loss: 2.1144, test_f1: 0.6035
 epoch: 99, train_loss: 0.2787, test_loss: 2.1307, test_f1: 0.6031
##################ITERATION #3 ****************************************
 epoch: 0, train_loss: 1.1139, test_loss: 1.4412, test_f1: 0.1584
 epoch: 1, train_loss: 1.0235, test_loss: 2.4823, test_f1: 0.0772
 epoch: 2, train_loss: 1.0029, test_loss: 1.2175, test_f1: 0.3878
 epoch: 3, train_loss: 0.9598, test_loss: 1.0745, test_f1: 0.5197
 epoch: 4, train_loss: 0.9545, test_loss: 1.0936, test_f1: 0.5203
 epoch: 5, train_loss: 0.9374, test_loss: 1.0309, test_f1: 0.5472
 epoch: 6, train_loss: 0.9125, test_loss: 1.0529, test_f1: 0.5672
 epoch: 7, train_loss: 0.9179, test_loss: 1.0355, test_f1: 0.5313
 epoch: 8, train_loss: 0.8994, test_loss: 1.0206, test_f1: 0.5516
 epoch: 9, train_loss: 0.8701, test_loss: 1.0318, test_f1: 0.5686
 epoch: 10, train_loss: 0.8701, test_loss: 1.0198, test_f1: 0.5678
 epoch: 11, train_loss: 0.8343, test_loss: 1.0879, test_f1: 0.5518
 epoch: 12, train_loss: 0.8495, test_loss: 1.0105, test_f1: 0.5732
 epoch: 13, train_loss: 0.8288, test_loss: 1.0365, test_f1: 0.5782
 epoch: 14, train_loss: 0.8215, test_loss: 1.0204, test_f1: 0.5776
 epoch: 15, train_loss: 0.8282, test_loss: 1.0045, test_f1: 0.5632
 epoch: 16, train_loss: 0.7962, test_loss: 0.9632, test_f1: 0.6168
 epoch: 17, train_loss: 0.7998, test_loss: 0.9638, test_f1: 0.6043
 epoch: 18, train_loss: 0.7995, test_loss: 1.0327, test_f1: 0.5870
 epoch: 19, train_loss: 0.7713, test_loss: 1.0395, test_f1: 0.5718
 epoch: 20, train_loss: 0.7654, test_loss: 1.0504, test_f1: 0.5618
 epoch: 21, train_loss: 0.7540, test_loss: 1.0275, test_f1: 0.5621
 epoch: 22, train_loss: 0.7366, test_loss: 1.0515, test_f1: 0.5817
 epoch: 23, train_loss: 0.7203, test_loss: 1.0534, test_f1: 0.5795
 epoch: 24, train_loss: 0.7092, test_loss: 1.0129, test_f1: 0.6132
 epoch: 25, train_loss: 0.6976, test_loss: 1.0776, test_f1: 0.5594
 epoch: 26, train_loss: 0.6962, test_loss: 1.0468, test_f1: 0.5855
 epoch: 27, train_loss: 0.6941, test_loss: 1.0574, test_f1: 0.5444
 epoch: 28, train_loss: 0.6671, test_loss: 1.1282, test_f1: 0.6085
 epoch: 29, train_loss: 0.6468, test_loss: 1.1269, test_f1: 0.5468
 epoch: 30, train_loss: 0.6513, test_loss: 1.1447, test_f1: 0.6131
 epoch: 31, train_loss: 0.6362, test_loss: 1.1317, test_f1: 0.5977
 epoch: 32, train_loss: 0.6493, test_loss: 1.1676, test_f1: 0.5696
 epoch: 33, train_loss: 0.6241, test_loss: 1.1247, test_f1: 0.5847
 epoch: 34, train_loss: 0.6261, test_loss: 1.2174, test_f1: 0.5770
 epoch: 35, train_loss: 0.5994, test_loss: 1.1489, test_f1: 0.6410
 epoch: 36, train_loss: 0.6022, test_loss: 1.2631, test_f1: 0.5477
 epoch: 37, train_loss: 0.6061, test_loss: 1.1717, test_f1: 0.6256
 epoch: 38, train_loss: 0.5717, test_loss: 1.2649, test_f1: 0.5958
 epoch: 39, train_loss: 0.5791, test_loss: 1.2634, test_f1: 0.6201
 epoch: 40, train_loss: 0.5733, test_loss: 1.3257, test_f1: 0.5520
 epoch: 41, train_loss: 0.5918, test_loss: 1.1945, test_f1: 0.5718
 epoch: 42, train_loss: 0.5545, test_loss: 1.3175, test_f1: 0.5827
 epoch: 43, train_loss: 0.5397, test_loss: 1.2276, test_f1: 0.6079
 epoch: 44, train_loss: 0.5131, test_loss: 1.2944, test_f1: 0.6025
 epoch: 45, train_loss: 0.5273, test_loss: 1.3694, test_f1: 0.6200
 epoch: 46, train_loss: 0.5326, test_loss: 1.2651, test_f1: 0.6157
 epoch: 47, train_loss: 0.5285, test_loss: 1.2316, test_f1: 0.6284
 epoch: 48, train_loss: 0.5539, test_loss: 1.3930, test_f1: 0.5748
 epoch: 49, train_loss: 0.5203, test_loss: 1.4094, test_f1: 0.5943
 epoch: 50, train_loss: 0.4873, test_loss: 1.2752, test_f1: 0.5943
 epoch: 51, train_loss: 0.4849, test_loss: 1.3675, test_f1: 0.6036
 epoch: 52, train_loss: 0.4414, test_loss: 1.3003, test_f1: 0.6209
 epoch: 53, train_loss: 0.4282, test_loss: 1.3487, test_f1: 0.5873
 epoch: 54, train_loss: 0.4315, test_loss: 1.3316, test_f1: 0.6229
 epoch: 55, train_loss: 0.4163, test_loss: 1.3804, test_f1: 0.6268
 epoch: 56, train_loss: 0.4486, test_loss: 1.4210, test_f1: 0.6179
 epoch: 57, train_loss: 0.4450, test_loss: 1.3998, test_f1: 0.6107
 epoch: 58, train_loss: 0.4242, test_loss: 1.4656, test_f1: 0.5923
 epoch: 59, train_loss: 0.4113, test_loss: 1.4214, test_f1: 0.6054
 epoch: 60, train_loss: 0.4113, test_loss: 1.3975, test_f1: 0.6399
 epoch: 61, train_loss: 0.4214, test_loss: 1.5302, test_f1: 0.6016
 epoch: 62, train_loss: 0.4299, test_loss: 1.4419, test_f1: 0.5829
 epoch: 63, train_loss: 0.4146, test_loss: 1.4318, test_f1: 0.6003
 epoch: 64, train_loss: 0.4215, test_loss: 1.4757, test_f1: 0.5872
 epoch: 65, train_loss: 0.4052, test_loss: 1.5050, test_f1: 0.6368
 epoch: 66, train_loss: 0.3992, test_loss: 1.5181, test_f1: 0.6041
 epoch: 67, train_loss: 0.3794, test_loss: 1.4966, test_f1: 0.6412
 epoch: 68, train_loss: 0.3911, test_loss: 1.4863, test_f1: 0.6326
 epoch: 69, train_loss: 0.3931, test_loss: 1.5588, test_f1: 0.5947
 epoch: 70, train_loss: 0.3897, test_loss: 1.5188, test_f1: 0.6087
 epoch: 71, train_loss: 0.4077, test_loss: 1.5810, test_f1: 0.5995
 epoch: 72, train_loss: 0.3900, test_loss: 1.5673, test_f1: 0.6187
 epoch: 73, train_loss: 0.3729, test_loss: 1.5209, test_f1: 0.6087
 epoch: 74, train_loss: 0.3552, test_loss: 1.5459, test_f1: 0.6164
 epoch: 75, train_loss: 0.3645, test_loss: 1.6226, test_f1: 0.6237
 epoch: 76, train_loss: 0.3641, test_loss: 1.5577, test_f1: 0.6227
 epoch: 77, train_loss: 0.3779, test_loss: 1.6072, test_f1: 0.5853
 epoch: 78, train_loss: 0.3498, test_loss: 1.6233, test_f1: 0.5982
 epoch: 79, train_loss: 0.3307, test_loss: 1.6699, test_f1: 0.5971
 epoch: 80, train_loss: 0.3493, test_loss: 1.6813, test_f1: 0.5961
 epoch: 81, train_loss: 0.3411, test_loss: 1.7685, test_f1: 0.6069
 epoch: 82, train_loss: 0.3362, test_loss: 1.7746, test_f1: 0.6055
 epoch: 83, train_loss: 0.3461, test_loss: 1.7512, test_f1: 0.5682
 epoch: 84, train_loss: 0.3460, test_loss: 1.7429, test_f1: 0.6104
 epoch: 85, train_loss: 0.3347, test_loss: 1.7778, test_f1: 0.5922
 epoch: 86, train_loss: 0.3271, test_loss: 1.7580, test_f1: 0.5846
 epoch: 87, train_loss: 0.3361, test_loss: 1.9629, test_f1: 0.5854
 epoch: 88, train_loss: 0.3440, test_loss: 1.8542, test_f1: 0.5852
 epoch: 89, train_loss: 0.3044, test_loss: 1.7834, test_f1: 0.5930
 epoch: 90, train_loss: 0.3464, test_loss: 1.8623, test_f1: 0.5693
 epoch: 91, train_loss: 0.3400, test_loss: 1.7289, test_f1: 0.5690
 epoch: 92, train_loss: 0.3242, test_loss: 1.8425, test_f1: 0.5922
 epoch: 93, train_loss: 0.3108, test_loss: 1.9385, test_f1: 0.5756
 epoch: 94, train_loss: 0.3280, test_loss: 1.7710, test_f1: 0.5914
 epoch: 95, train_loss: 0.3075, test_loss: 1.8637, test_f1: 0.5919
 epoch: 96, train_loss: 0.3103, test_loss: 1.7866, test_f1: 0.6165
 epoch: 97, train_loss: 0.3098, test_loss: 1.8867, test_f1: 0.5594
 epoch: 98, train_loss: 0.3050, test_loss: 1.9179, test_f1: 0.5803
 epoch: 99, train_loss: 0.3157, test_loss: 1.9644, test_f1: 0.5971
##################ITERATION #4 ****************************************
 epoch: 0, train_loss: 1.2891, test_loss: 1.2547, test_f1: 0.2281
 epoch: 1, train_loss: 1.0720, test_loss: 1.2143, test_f1: 0.3998
 epoch: 2, train_loss: 1.0409, test_loss: 1.0994, test_f1: 0.5064
 epoch: 3, train_loss: 0.9850, test_loss: 1.0714, test_f1: 0.5394
 epoch: 4, train_loss: 0.9838, test_loss: 1.0727, test_f1: 0.5449
 epoch: 5, train_loss: 0.9713, test_loss: 1.0284, test_f1: 0.5268
 epoch: 6, train_loss: 0.9464, test_loss: 1.0484, test_f1: 0.5061
 epoch: 7, train_loss: 0.9098, test_loss: 1.0191, test_f1: 0.5479
 epoch: 8, train_loss: 0.8986, test_loss: 1.0062, test_f1: 0.5315
 epoch: 9, train_loss: 0.8867, test_loss: 1.0132, test_f1: 0.5319
 epoch: 10, train_loss: 0.8699, test_loss: 1.0093, test_f1: 0.6070
 epoch: 11, train_loss: 0.8510, test_loss: 1.0298, test_f1: 0.5715
 epoch: 12, train_loss: 0.8382, test_loss: 1.0847, test_f1: 0.5158
 epoch: 13, train_loss: 0.8271, test_loss: 1.0135, test_f1: 0.6165
 epoch: 14, train_loss: 0.8430, test_loss: 0.9806, test_f1: 0.6074
 epoch: 15, train_loss: 0.8204, test_loss: 1.0204, test_f1: 0.5798
 epoch: 16, train_loss: 0.8225, test_loss: 0.9965, test_f1: 0.5819
 epoch: 17, train_loss: 0.7928, test_loss: 0.9998, test_f1: 0.6102
 epoch: 18, train_loss: 0.7686, test_loss: 0.9964, test_f1: 0.5787
 epoch: 19, train_loss: 0.7570, test_loss: 1.0037, test_f1: 0.5986
 epoch: 20, train_loss: 0.7468, test_loss: 1.0145, test_f1: 0.5878
 epoch: 21, train_loss: 0.7430, test_loss: 1.0023, test_f1: 0.6386
 epoch: 22, train_loss: 0.7069, test_loss: 1.0576, test_f1: 0.5739
 epoch: 23, train_loss: 0.7120, test_loss: 1.0070, test_f1: 0.5906
 epoch: 24, train_loss: 0.7041, test_loss: 1.0676, test_f1: 0.5880
 epoch: 25, train_loss: 0.6769, test_loss: 1.0525, test_f1: 0.5934
 epoch: 26, train_loss: 0.6856, test_loss: 1.0650, test_f1: 0.6116
 epoch: 27, train_loss: 0.6875, test_loss: 1.0584, test_f1: 0.6182
 epoch: 28, train_loss: 0.6899, test_loss: 1.0444, test_f1: 0.6255
 epoch: 29, train_loss: 0.6960, test_loss: 1.0688, test_f1: 0.6457
 epoch: 30, train_loss: 0.6565, test_loss: 1.0505, test_f1: 0.6026
 epoch: 31, train_loss: 0.6468, test_loss: 1.1502, test_f1: 0.5561
 epoch: 32, train_loss: 0.6483, test_loss: 1.0752, test_f1: 0.6511
 epoch: 33, train_loss: 0.6145, test_loss: 1.0966, test_f1: 0.5446
 epoch: 34, train_loss: 0.6141, test_loss: 1.0764, test_f1: 0.6340
 epoch: 35, train_loss: 0.6088, test_loss: 1.0951, test_f1: 0.5657
 epoch: 36, train_loss: 0.6054, test_loss: 1.0507, test_f1: 0.6328
 epoch: 37, train_loss: 0.5885, test_loss: 1.1229, test_f1: 0.5827
 epoch: 38, train_loss: 0.5945, test_loss: 1.0859, test_f1: 0.6366
 epoch: 39, train_loss: 0.5850, test_loss: 1.2050, test_f1: 0.6393
 epoch: 40, train_loss: 0.6178, test_loss: 1.1425, test_f1: 0.5535
 epoch: 41, train_loss: 0.5903, test_loss: 1.1550, test_f1: 0.5701
 epoch: 42, train_loss: 0.6055, test_loss: 1.0815, test_f1: 0.6648
 epoch: 43, train_loss: 0.5682, test_loss: 1.2140, test_f1: 0.5954
 epoch: 44, train_loss: 0.5235, test_loss: 1.1284, test_f1: 0.6115
 epoch: 45, train_loss: 0.5713, test_loss: 1.1052, test_f1: 0.6441
 epoch: 46, train_loss: 0.5619, test_loss: 1.1222, test_f1: 0.6495
 epoch: 47, train_loss: 0.5326, test_loss: 1.1722, test_f1: 0.6011
 epoch: 48, train_loss: 0.5239, test_loss: 1.2616, test_f1: 0.6188
 epoch: 49, train_loss: 0.5261, test_loss: 1.2847, test_f1: 0.6108
 epoch: 50, train_loss: 0.5086, test_loss: 1.1901, test_f1: 0.6158
 epoch: 51, train_loss: 0.4840, test_loss: 1.2124, test_f1: 0.6315
 epoch: 52, train_loss: 0.4762, test_loss: 1.1921, test_f1: 0.6490
 epoch: 53, train_loss: 0.4795, test_loss: 1.3004, test_f1: 0.6265
 epoch: 54, train_loss: 0.4357, test_loss: 1.2249, test_f1: 0.6070
 epoch: 55, train_loss: 0.4665, test_loss: 1.2583, test_f1: 0.5834
 epoch: 56, train_loss: 0.4381, test_loss: 1.2684, test_f1: 0.6197
 epoch: 57, train_loss: 0.4725, test_loss: 1.2285, test_f1: 0.6490
 epoch: 58, train_loss: 0.4329, test_loss: 1.2878, test_f1: 0.6115
 epoch: 59, train_loss: 0.4334, test_loss: 1.2788, test_f1: 0.6105
 epoch: 60, train_loss: 0.4309, test_loss: 1.2873, test_f1: 0.6164
 epoch: 61, train_loss: 0.4287, test_loss: 1.4839, test_f1: 0.5755
 epoch: 62, train_loss: 0.4024, test_loss: 1.3466, test_f1: 0.6128
 epoch: 63, train_loss: 0.3955, test_loss: 1.3657, test_f1: 0.6320
 epoch: 64, train_loss: 0.4242, test_loss: 1.5093, test_f1: 0.5607
 epoch: 65, train_loss: 0.4023, test_loss: 1.3887, test_f1: 0.6117
 epoch: 66, train_loss: 0.3756, test_loss: 1.5267, test_f1: 0.5833
 epoch: 67, train_loss: 0.3749, test_loss: 1.4916, test_f1: 0.5897
 epoch: 68, train_loss: 0.3767, test_loss: 1.5065, test_f1: 0.6089
 epoch: 69, train_loss: 0.3853, test_loss: 1.3481, test_f1: 0.6130
 epoch: 70, train_loss: 0.3894, test_loss: 1.4693, test_f1: 0.6258
 epoch: 71, train_loss: 0.3790, test_loss: 1.3838, test_f1: 0.6235
 epoch: 72, train_loss: 0.3808, test_loss: 1.3591, test_f1: 0.6365
 epoch: 73, train_loss: 0.3837, test_loss: 1.4869, test_f1: 0.5918
 epoch: 74, train_loss: 0.3492, test_loss: 1.4858, test_f1: 0.5871
 epoch: 75, train_loss: 0.3793, test_loss: 1.5376, test_f1: 0.5870
 epoch: 76, train_loss: 0.3706, test_loss: 1.3589, test_f1: 0.6431
 epoch: 77, train_loss: 0.3267, test_loss: 1.6240, test_f1: 0.5791
 epoch: 78, train_loss: 0.3567, test_loss: 1.6880, test_f1: 0.5773
 epoch: 79, train_loss: 0.3471, test_loss: 1.6955, test_f1: 0.5824
 epoch: 80, train_loss: 0.3737, test_loss: 1.5691, test_f1: 0.5826
 epoch: 81, train_loss: 0.3376, test_loss: 1.6829, test_f1: 0.5571
 epoch: 82, train_loss: 0.3261, test_loss: 1.5938, test_f1: 0.5956
 epoch: 83, train_loss: 0.3241, test_loss: 1.6797, test_f1: 0.5763
 epoch: 84, train_loss: 0.3129, test_loss: 1.6902, test_f1: 0.5765
 epoch: 85, train_loss: 0.3508, test_loss: 1.7021, test_f1: 0.5740
 epoch: 86, train_loss: 0.3370, test_loss: 1.6587, test_f1: 0.5998
 epoch: 87, train_loss: 0.3598, test_loss: 1.6525, test_f1: 0.5702
 epoch: 88, train_loss: 0.3067, test_loss: 1.6663, test_f1: 0.5837
 epoch: 89, train_loss: 0.3115, test_loss: 1.5605, test_f1: 0.6325
 epoch: 90, train_loss: 0.3158, test_loss: 1.9459, test_f1: 0.5572
 epoch: 91, train_loss: 0.3144, test_loss: 1.7662, test_f1: 0.5717
 epoch: 92, train_loss: 0.2958, test_loss: 1.7765, test_f1: 0.5699
 epoch: 93, train_loss: 0.3168, test_loss: 1.6488, test_f1: 0.6267
 epoch: 94, train_loss: 0.3191, test_loss: 1.8113, test_f1: 0.5944
 epoch: 95, train_loss: 0.3101, test_loss: 1.7404, test_f1: 0.5949
 epoch: 96, train_loss: 0.3280, test_loss: 1.7937, test_f1: 0.5727
 epoch: 97, train_loss: 0.3204, test_loss: 1.7296, test_f1: 0.5990
 epoch: 98, train_loss: 0.2915, test_loss: 1.8087, test_f1: 0.5658
 epoch: 99, train_loss: 0.3133, test_loss: 1.7634, test_f1: 0.6107
##################ITERATION #5 ****************************************
 epoch: 0, train_loss: 1.2785, test_loss: 1.5446, test_f1: 0.1365
 epoch: 1, train_loss: 1.0442, test_loss: 1.1577, test_f1: 0.4304
 epoch: 2, train_loss: 0.9933, test_loss: 1.0661, test_f1: 0.5004
 epoch: 3, train_loss: 0.9443, test_loss: 1.0119, test_f1: 0.5820
 epoch: 4, train_loss: 0.9360, test_loss: 1.0189, test_f1: 0.5903
 epoch: 5, train_loss: 0.9038, test_loss: 1.0156, test_f1: 0.5102
 epoch: 6, train_loss: 0.8905, test_loss: 0.9852, test_f1: 0.5873
 epoch: 7, train_loss: 0.8815, test_loss: 1.0071, test_f1: 0.5878
 epoch: 8, train_loss: 0.8449, test_loss: 1.0110, test_f1: 0.5795
 epoch: 9, train_loss: 0.8418, test_loss: 0.9744, test_f1: 0.5756
 epoch: 10, train_loss: 0.8391, test_loss: 1.0086, test_f1: 0.5538
 epoch: 11, train_loss: 0.8202, test_loss: 1.0170, test_f1: 0.5773
 epoch: 12, train_loss: 0.8113, test_loss: 1.0180, test_f1: 0.5740
 epoch: 13, train_loss: 0.7865, test_loss: 0.9714, test_f1: 0.6227
 epoch: 14, train_loss: 0.7784, test_loss: 1.0110, test_f1: 0.5827
 epoch: 15, train_loss: 0.7520, test_loss: 0.9704, test_f1: 0.5983
 epoch: 16, train_loss: 0.7402, test_loss: 1.0099, test_f1: 0.5890
 epoch: 17, train_loss: 0.7231, test_loss: 1.0035, test_f1: 0.5811
 epoch: 18, train_loss: 0.7479, test_loss: 1.0209, test_f1: 0.5633
 epoch: 19, train_loss: 0.7196, test_loss: 0.9719, test_f1: 0.6480
 epoch: 20, train_loss: 0.7157, test_loss: 1.0484, test_f1: 0.5999
 epoch: 21, train_loss: 0.6902, test_loss: 1.0413, test_f1: 0.5884
 epoch: 22, train_loss: 0.6835, test_loss: 1.0715, test_f1: 0.5297
 epoch: 23, train_loss: 0.6782, test_loss: 1.0014, test_f1: 0.6311
 epoch: 24, train_loss: 0.6585, test_loss: 1.0068, test_f1: 0.6571
 epoch: 25, train_loss: 0.6520, test_loss: 1.0018, test_f1: 0.6345
 epoch: 26, train_loss: 0.6687, test_loss: 1.0157, test_f1: 0.6429
 epoch: 27, train_loss: 0.6630, test_loss: 1.0019, test_f1: 0.6253
 epoch: 28, train_loss: 0.6193, test_loss: 1.0797, test_f1: 0.5986
 epoch: 29, train_loss: 0.6348, test_loss: 1.0464, test_f1: 0.6395
 epoch: 30, train_loss: 0.6185, test_loss: 1.0515, test_f1: 0.6410
 epoch: 31, train_loss: 0.6080, test_loss: 1.0137, test_f1: 0.6720
 epoch: 32, train_loss: 0.6183, test_loss: 1.0238, test_f1: 0.6366
 epoch: 33, train_loss: 0.6218, test_loss: 1.0311, test_f1: 0.6490
 epoch: 34, train_loss: 0.5979, test_loss: 1.0661, test_f1: 0.6501
 epoch: 35, train_loss: 0.6046, test_loss: 1.0416, test_f1: 0.6538
 epoch: 36, train_loss: 0.5461, test_loss: 1.0692, test_f1: 0.6169
 epoch: 37, train_loss: 0.5712, test_loss: 1.2250, test_f1: 0.5473
 epoch: 38, train_loss: 0.5621, test_loss: 1.2654, test_f1: 0.5346
 epoch: 39, train_loss: 0.5419, test_loss: 1.1209, test_f1: 0.6180
 epoch: 40, train_loss: 0.5754, test_loss: 1.1062, test_f1: 0.6149
 epoch: 41, train_loss: 0.5359, test_loss: 1.0944, test_f1: 0.6605
 epoch: 42, train_loss: 0.5376, test_loss: 1.1793, test_f1: 0.6141
 epoch: 43, train_loss: 0.5219, test_loss: 1.0673, test_f1: 0.6394
 epoch: 44, train_loss: 0.5311, test_loss: 1.1846, test_f1: 0.5932
 epoch: 45, train_loss: 0.5136, test_loss: 1.1531, test_f1: 0.6761
 epoch: 46, train_loss: 0.5393, test_loss: 1.1916, test_f1: 0.6410
 epoch: 47, train_loss: 0.4955, test_loss: 1.1789, test_f1: 0.6296
 epoch: 48, train_loss: 0.5325, test_loss: 1.2076, test_f1: 0.5909
 epoch: 49, train_loss: 0.5142, test_loss: 1.1688, test_f1: 0.6302
 epoch: 50, train_loss: 0.4707, test_loss: 1.1299, test_f1: 0.6207
 epoch: 51, train_loss: 0.4668, test_loss: 1.2089, test_f1: 0.6220
 epoch: 52, train_loss: 0.4578, test_loss: 1.1451, test_f1: 0.6726
 epoch: 53, train_loss: 0.4463, test_loss: 1.1807, test_f1: 0.6183
 epoch: 54, train_loss: 0.4425, test_loss: 1.1830, test_f1: 0.6577
 epoch: 55, train_loss: 0.4393, test_loss: 1.2172, test_f1: 0.6702
 epoch: 56, train_loss: 0.4432, test_loss: 1.2326, test_f1: 0.6403
 epoch: 57, train_loss: 0.4388, test_loss: 1.2327, test_f1: 0.6449
 epoch: 58, train_loss: 0.4325, test_loss: 1.2270, test_f1: 0.6637
 epoch: 59, train_loss: 0.4137, test_loss: 1.3181, test_f1: 0.6368
 epoch: 60, train_loss: 0.4230, test_loss: 1.2221, test_f1: 0.6286
 epoch: 61, train_loss: 0.3927, test_loss: 1.2961, test_f1: 0.6528
 epoch: 62, train_loss: 0.4106, test_loss: 1.2901, test_f1: 0.6318
 epoch: 63, train_loss: 0.3838, test_loss: 1.3786, test_f1: 0.5960
 epoch: 64, train_loss: 0.4044, test_loss: 1.3551, test_f1: 0.6285
 epoch: 65, train_loss: 0.3955, test_loss: 1.3471, test_f1: 0.6033
 epoch: 66, train_loss: 0.3976, test_loss: 1.4327, test_f1: 0.6267
 epoch: 67, train_loss: 0.4104, test_loss: 1.3984, test_f1: 0.6040
 epoch: 68, train_loss: 0.3833, test_loss: 1.4162, test_f1: 0.6072
 epoch: 69, train_loss: 0.3929, test_loss: 1.4109, test_f1: 0.6195
 epoch: 70, train_loss: 0.4013, test_loss: 1.4379, test_f1: 0.6286
 epoch: 71, train_loss: 0.3812, test_loss: 1.3601, test_f1: 0.6266
 epoch: 72, train_loss: 0.3916, test_loss: 1.3347, test_f1: 0.6700
 epoch: 73, train_loss: 0.3561, test_loss: 1.3874, test_f1: 0.5855
 epoch: 74, train_loss: 0.3667, test_loss: 1.4158, test_f1: 0.6194
 epoch: 75, train_loss: 0.3644, test_loss: 1.4272, test_f1: 0.6513
 epoch: 76, train_loss: 0.3579, test_loss: 1.3955, test_f1: 0.6458
 epoch: 77, train_loss: 0.3608, test_loss: 1.3990, test_f1: 0.6122
 epoch: 78, train_loss: 0.3864, test_loss: 1.4887, test_f1: 0.6353
 epoch: 79, train_loss: 0.3617, test_loss: 1.5516, test_f1: 0.6119
 epoch: 80, train_loss: 0.3343, test_loss: 1.4920, test_f1: 0.6044
 epoch: 81, train_loss: 0.3666, test_loss: 1.4559, test_f1: 0.6201
 epoch: 82, train_loss: 0.3389, test_loss: 1.5835, test_f1: 0.6009
 epoch: 83, train_loss: 0.3538, test_loss: 1.5297, test_f1: 0.6134
 epoch: 84, train_loss: 0.3409, test_loss: 1.5677, test_f1: 0.6025
 epoch: 85, train_loss: 0.3541, test_loss: 1.4927, test_f1: 0.6204
 epoch: 86, train_loss: 0.3651, test_loss: 1.4983, test_f1: 0.6394
 epoch: 87, train_loss: 0.3218, test_loss: 1.4490, test_f1: 0.6782
 epoch: 88, train_loss: 0.3196, test_loss: 1.6036, test_f1: 0.6016
 epoch: 89, train_loss: 0.3381, test_loss: 1.5630, test_f1: 0.6529
 epoch: 90, train_loss: 0.3259, test_loss: 1.5837, test_f1: 0.6327
 epoch: 91, train_loss: 0.3380, test_loss: 1.6013, test_f1: 0.6038
 epoch: 92, train_loss: 0.3244, test_loss: 1.6812, test_f1: 0.5991
 epoch: 93, train_loss: 0.3208, test_loss: 1.4861, test_f1: 0.6754
 epoch: 94, train_loss: 0.3237, test_loss: 1.5742, test_f1: 0.6338
 epoch: 95, train_loss: 0.3410, test_loss: 1.6603, test_f1: 0.5975
 epoch: 96, train_loss: 0.3415, test_loss: 1.7092, test_f1: 0.5976
 epoch: 97, train_loss: 0.3138, test_loss: 1.6000, test_f1: 0.6157
 epoch: 98, train_loss: 0.3165, test_loss: 1.7397, test_f1: 0.5848
 epoch: 99, train_loss: 0.3142, test_loss: 1.6586, test_f1: 0.6269
##################ITERATION #6 ****************************************
 epoch: 0, train_loss: 1.3013, test_loss: 1.3911, test_f1: 0.2281
 epoch: 1, train_loss: 1.0470, test_loss: 1.2660, test_f1: 0.2966
 epoch: 2, train_loss: 1.0046, test_loss: 1.0955, test_f1: 0.5282
 epoch: 3, train_loss: 0.9779, test_loss: 1.0740, test_f1: 0.5455
 epoch: 4, train_loss: 0.9144, test_loss: 1.0341, test_f1: 0.5814
 epoch: 5, train_loss: 0.8815, test_loss: 1.0589, test_f1: 0.5432
 epoch: 6, train_loss: 0.8967, test_loss: 1.0662, test_f1: 0.5308
 epoch: 7, train_loss: 0.8631, test_loss: 1.0395, test_f1: 0.5604
 epoch: 8, train_loss: 0.8404, test_loss: 1.0174, test_f1: 0.5611
 epoch: 9, train_loss: 0.8389, test_loss: 1.0367, test_f1: 0.5952
 epoch: 10, train_loss: 0.8086, test_loss: 1.0522, test_f1: 0.5746
 epoch: 11, train_loss: 0.7949, test_loss: 1.0115, test_f1: 0.5594
 epoch: 12, train_loss: 0.8004, test_loss: 1.0403, test_f1: 0.5731
 epoch: 13, train_loss: 0.7785, test_loss: 1.0548, test_f1: 0.5815
 epoch: 14, train_loss: 0.7625, test_loss: 1.0235, test_f1: 0.5792
 epoch: 15, train_loss: 0.7740, test_loss: 1.1044, test_f1: 0.5258
 epoch: 16, train_loss: 0.7795, test_loss: 1.0389, test_f1: 0.5596
 epoch: 17, train_loss: 0.7362, test_loss: 0.9991, test_f1: 0.5920
 epoch: 18, train_loss: 0.7048, test_loss: 1.0286, test_f1: 0.5717
 epoch: 19, train_loss: 0.7113, test_loss: 1.0410, test_f1: 0.5576
 epoch: 20, train_loss: 0.6881, test_loss: 1.0865, test_f1: 0.5858
 epoch: 21, train_loss: 0.6885, test_loss: 1.0570, test_f1: 0.5689
 epoch: 22, train_loss: 0.6831, test_loss: 1.0378, test_f1: 0.6000
 epoch: 23, train_loss: 0.6697, test_loss: 1.0879, test_f1: 0.6018
 epoch: 24, train_loss: 0.6555, test_loss: 1.1165, test_f1: 0.5790
 epoch: 25, train_loss: 0.6326, test_loss: 1.0662, test_f1: 0.5774
 epoch: 26, train_loss: 0.6295, test_loss: 1.1650, test_f1: 0.5612
 epoch: 27, train_loss: 0.6204, test_loss: 1.1044, test_f1: 0.6182
 epoch: 28, train_loss: 0.6223, test_loss: 1.1963, test_f1: 0.5890
 epoch: 29, train_loss: 0.6199, test_loss: 1.1383, test_f1: 0.6063
 epoch: 30, train_loss: 0.5793, test_loss: 1.1585, test_f1: 0.5972
 epoch: 31, train_loss: 0.5976, test_loss: 1.1810, test_f1: 0.5773
 epoch: 32, train_loss: 0.5892, test_loss: 1.2028, test_f1: 0.6029
 epoch: 33, train_loss: 0.5782, test_loss: 1.1922, test_f1: 0.5656
 epoch: 34, train_loss: 0.5625, test_loss: 1.1692, test_f1: 0.5957
 epoch: 35, train_loss: 0.5456, test_loss: 1.2828, test_f1: 0.5788
 epoch: 36, train_loss: 0.5452, test_loss: 1.2412, test_f1: 0.6010
 epoch: 37, train_loss: 0.5509, test_loss: 1.2903, test_f1: 0.5882
 epoch: 38, train_loss: 0.5396, test_loss: 1.3123, test_f1: 0.6106
 epoch: 39, train_loss: 0.5659, test_loss: 1.1961, test_f1: 0.6325
 epoch: 40, train_loss: 0.5250, test_loss: 1.2424, test_f1: 0.6104
 epoch: 41, train_loss: 0.5323, test_loss: 1.2200, test_f1: 0.5939
 epoch: 42, train_loss: 0.4951, test_loss: 1.3248, test_f1: 0.6053
 epoch: 43, train_loss: 0.5047, test_loss: 1.4155, test_f1: 0.5906
 epoch: 44, train_loss: 0.5306, test_loss: 1.3974, test_f1: 0.6008
 epoch: 45, train_loss: 0.4931, test_loss: 1.3492, test_f1: 0.6200
 epoch: 46, train_loss: 0.4612, test_loss: 1.3692, test_f1: 0.6006
 epoch: 47, train_loss: 0.4669, test_loss: 1.3834, test_f1: 0.5645
 epoch: 48, train_loss: 0.4781, test_loss: 1.3585, test_f1: 0.6010
 epoch: 49, train_loss: 0.4472, test_loss: 1.6169, test_f1: 0.5637
 epoch: 50, train_loss: 0.4533, test_loss: 1.4809, test_f1: 0.5693
 epoch: 51, train_loss: 0.4435, test_loss: 1.4610, test_f1: 0.6202
 epoch: 52, train_loss: 0.4085, test_loss: 1.4653, test_f1: 0.6161
 epoch: 53, train_loss: 0.3843, test_loss: 1.4843, test_f1: 0.6244
 epoch: 54, train_loss: 0.4010, test_loss: 1.5027, test_f1: 0.6115
 epoch: 55, train_loss: 0.3717, test_loss: 1.5155, test_f1: 0.6258
 epoch: 56, train_loss: 0.3795, test_loss: 1.5644, test_f1: 0.6360
 epoch: 57, train_loss: 0.3855, test_loss: 1.4910, test_f1: 0.6267
 epoch: 58, train_loss: 0.3575, test_loss: 1.5894, test_f1: 0.6074
 epoch: 59, train_loss: 0.3635, test_loss: 1.6863, test_f1: 0.6251
 epoch: 60, train_loss: 0.3557, test_loss: 1.6378, test_f1: 0.6202
 epoch: 61, train_loss: 0.3500, test_loss: 1.6008, test_f1: 0.6422
 epoch: 62, train_loss: 0.3507, test_loss: 1.6680, test_f1: 0.6133
 epoch: 63, train_loss: 0.3667, test_loss: 1.7137, test_f1: 0.6180
 epoch: 64, train_loss: 0.3546, test_loss: 1.6198, test_f1: 0.6291
 epoch: 65, train_loss: 0.3829, test_loss: 1.6744, test_f1: 0.6193
 epoch: 66, train_loss: 0.3444, test_loss: 1.6878, test_f1: 0.6401
 epoch: 67, train_loss: 0.3405, test_loss: 1.6774, test_f1: 0.6066
 epoch: 68, train_loss: 0.3379, test_loss: 1.6630, test_f1: 0.6222
 epoch: 69, train_loss: 0.3087, test_loss: 1.7679, test_f1: 0.6123
 epoch: 70, train_loss: 0.3459, test_loss: 1.8164, test_f1: 0.6209
 epoch: 71, train_loss: 0.3214, test_loss: 1.6836, test_f1: 0.6296
 epoch: 72, train_loss: 0.3079, test_loss: 1.7256, test_f1: 0.6142
 epoch: 73, train_loss: 0.3030, test_loss: 1.7626, test_f1: 0.6234
 epoch: 74, train_loss: 0.3170, test_loss: 1.7935, test_f1: 0.6382
 epoch: 75, train_loss: 0.3077, test_loss: 1.8412, test_f1: 0.6174
 epoch: 76, train_loss: 0.3159, test_loss: 1.8079, test_f1: 0.6331
 epoch: 77, train_loss: 0.3243, test_loss: 1.7662, test_f1: 0.6313
 epoch: 78, train_loss: 0.2832, test_loss: 1.7663, test_f1: 0.6261
 epoch: 79, train_loss: 0.3385, test_loss: 1.9259, test_f1: 0.6163
 epoch: 80, train_loss: 0.3152, test_loss: 1.9011, test_f1: 0.6066
 epoch: 81, train_loss: 0.2760, test_loss: 1.9537, test_f1: 0.5940
 epoch: 82, train_loss: 0.3009, test_loss: 1.9111, test_f1: 0.6443
 epoch: 83, train_loss: 0.3120, test_loss: 1.9426, test_f1: 0.5972
 epoch: 84, train_loss: 0.2672, test_loss: 1.8960, test_f1: 0.6112
 epoch: 85, train_loss: 0.2707, test_loss: 1.9329, test_f1: 0.6141
 epoch: 86, train_loss: 0.2854, test_loss: 1.9301, test_f1: 0.5901
 epoch: 87, train_loss: 0.2847, test_loss: 1.9722, test_f1: 0.5917
 epoch: 88, train_loss: 0.2589, test_loss: 1.9000, test_f1: 0.6272
 epoch: 89, train_loss: 0.2507, test_loss: 1.9938, test_f1: 0.5967
 epoch: 90, train_loss: 0.2646, test_loss: 1.9751, test_f1: 0.6244
 epoch: 91, train_loss: 0.2566, test_loss: 2.0089, test_f1: 0.6223
 epoch: 92, train_loss: 0.2891, test_loss: 2.0474, test_f1: 0.6038
 epoch: 93, train_loss: 0.2649, test_loss: 2.0557, test_f1: 0.6037
 epoch: 94, train_loss: 0.2762, test_loss: 2.1111, test_f1: 0.5789
 epoch: 95, train_loss: 0.2752, test_loss: 2.0835, test_f1: 0.6181
 epoch: 96, train_loss: 0.2685, test_loss: 2.0039, test_f1: 0.6142
 epoch: 97, train_loss: 0.2437, test_loss: 2.0583, test_f1: 0.5776
 epoch: 98, train_loss: 0.2752, test_loss: 2.1010, test_f1: 0.6266
 epoch: 99, train_loss: 0.2859, test_loss: 1.9940, test_f1: 0.6062
##################ITERATION #7 ****************************************
 epoch: 0, train_loss: 1.4678, test_loss: 1.3753, test_f1: 0.2281
 epoch: 1, train_loss: 1.1377, test_loss: 1.1962, test_f1: 0.4351
 epoch: 2, train_loss: 1.0463, test_loss: 1.1135, test_f1: 0.4702
 epoch: 3, train_loss: 1.0152, test_loss: 1.1289, test_f1: 0.4414
 epoch: 4, train_loss: 0.9732, test_loss: 1.0928, test_f1: 0.5288
 epoch: 5, train_loss: 0.9565, test_loss: 1.1155, test_f1: 0.5114
 epoch: 6, train_loss: 0.9313, test_loss: 1.0814, test_f1: 0.5333
 epoch: 7, train_loss: 0.9181, test_loss: 1.0764, test_f1: 0.5333
 epoch: 8, train_loss: 0.9023, test_loss: 1.0522, test_f1: 0.5573
 epoch: 9, train_loss: 0.8684, test_loss: 1.1206, test_f1: 0.5349
 epoch: 10, train_loss: 0.8761, test_loss: 1.0606, test_f1: 0.5714
 epoch: 11, train_loss: 0.8453, test_loss: 1.1084, test_f1: 0.5370
 epoch: 12, train_loss: 0.8364, test_loss: 1.0761, test_f1: 0.5443
 epoch: 13, train_loss: 0.8324, test_loss: 1.0624, test_f1: 0.5769
 epoch: 14, train_loss: 0.8240, test_loss: 1.0862, test_f1: 0.5663
 epoch: 15, train_loss: 0.7935, test_loss: 1.1109, test_f1: 0.5335
 epoch: 16, train_loss: 0.7951, test_loss: 1.1208, test_f1: 0.5595
 epoch: 17, train_loss: 0.7898, test_loss: 1.1055, test_f1: 0.5597
 epoch: 18, train_loss: 0.7463, test_loss: 1.0918, test_f1: 0.6018
 epoch: 19, train_loss: 0.7924, test_loss: 1.1192, test_f1: 0.5632
 epoch: 20, train_loss: 0.7457, test_loss: 1.1007, test_f1: 0.5836
 epoch: 21, train_loss: 0.7271, test_loss: 1.1335, test_f1: 0.5439
 epoch: 22, train_loss: 0.7160, test_loss: 1.0753, test_f1: 0.5724
 epoch: 23, train_loss: 0.7163, test_loss: 1.2771, test_f1: 0.5240
 epoch: 24, train_loss: 0.7078, test_loss: 1.2316, test_f1: 0.5265
 epoch: 25, train_loss: 0.6851, test_loss: 1.1442, test_f1: 0.5704
 epoch: 26, train_loss: 0.7078, test_loss: 1.2597, test_f1: 0.5602
 epoch: 27, train_loss: 0.6800, test_loss: 1.1810, test_f1: 0.5712
 epoch: 28, train_loss: 0.6748, test_loss: 1.1984, test_f1: 0.5448
 epoch: 29, train_loss: 0.6476, test_loss: 1.1605, test_f1: 0.5714
 epoch: 30, train_loss: 0.6367, test_loss: 1.3201, test_f1: 0.5635
 epoch: 31, train_loss: 0.6167, test_loss: 1.2903, test_f1: 0.5448
 epoch: 32, train_loss: 0.6295, test_loss: 1.2117, test_f1: 0.5772
 epoch: 33, train_loss: 0.6203, test_loss: 1.2930, test_f1: 0.5385
 epoch: 34, train_loss: 0.6448, test_loss: 1.3027, test_f1: 0.5608
 epoch: 35, train_loss: 0.6213, test_loss: 1.3754, test_f1: 0.5786
 epoch: 36, train_loss: 0.6004, test_loss: 1.2776, test_f1: 0.5526
 epoch: 37, train_loss: 0.5895, test_loss: 1.3582, test_f1: 0.5643
 epoch: 38, train_loss: 0.5800, test_loss: 1.2104, test_f1: 0.5950
 epoch: 39, train_loss: 0.5667, test_loss: 1.3112, test_f1: 0.5822
 epoch: 40, train_loss: 0.5849, test_loss: 1.2533, test_f1: 0.6079
 epoch: 41, train_loss: 0.5799, test_loss: 1.4031, test_f1: 0.5742
 epoch: 42, train_loss: 0.5634, test_loss: 1.3247, test_f1: 0.5424
 epoch: 43, train_loss: 0.5510, test_loss: 1.3830, test_f1: 0.5928
 epoch: 44, train_loss: 0.5680, test_loss: 1.5609, test_f1: 0.5706
 epoch: 45, train_loss: 0.5273, test_loss: 1.3935, test_f1: 0.5971
 epoch: 46, train_loss: 0.5465, test_loss: 1.6068, test_f1: 0.5429
 epoch: 47, train_loss: 0.5939, test_loss: 1.5085, test_f1: 0.5628
 epoch: 48, train_loss: 0.5607, test_loss: 1.4077, test_f1: 0.5836
 epoch: 49, train_loss: 0.5380, test_loss: 1.2670, test_f1: 0.5780
 epoch: 50, train_loss: 0.5043, test_loss: 1.3202, test_f1: 0.5860
 epoch: 51, train_loss: 0.4765, test_loss: 1.3752, test_f1: 0.5810
 epoch: 52, train_loss: 0.4604, test_loss: 1.3655, test_f1: 0.5907
 epoch: 53, train_loss: 0.4637, test_loss: 1.4838, test_f1: 0.5622
 epoch: 54, train_loss: 0.4423, test_loss: 1.4583, test_f1: 0.5846
 epoch: 55, train_loss: 0.4146, test_loss: 1.5414, test_f1: 0.5720
 epoch: 56, train_loss: 0.4480, test_loss: 1.4656, test_f1: 0.6222
 epoch: 57, train_loss: 0.4419, test_loss: 1.5104, test_f1: 0.5723
 epoch: 58, train_loss: 0.4365, test_loss: 1.5073, test_f1: 0.5958
 epoch: 59, train_loss: 0.4349, test_loss: 1.5502, test_f1: 0.5849
 epoch: 60, train_loss: 0.4095, test_loss: 1.5319, test_f1: 0.5897
 epoch: 61, train_loss: 0.4188, test_loss: 1.6116, test_f1: 0.5968
 epoch: 62, train_loss: 0.4132, test_loss: 1.4232, test_f1: 0.5994
 epoch: 63, train_loss: 0.3966, test_loss: 1.6173, test_f1: 0.5938
 epoch: 64, train_loss: 0.4233, test_loss: 1.6407, test_f1: 0.5685
 epoch: 65, train_loss: 0.4122, test_loss: 1.5737, test_f1: 0.6167
 epoch: 66, train_loss: 0.4158, test_loss: 1.6194, test_f1: 0.6187
 epoch: 67, train_loss: 0.3973, test_loss: 1.5924, test_f1: 0.5930
 epoch: 68, train_loss: 0.4064, test_loss: 1.6503, test_f1: 0.5424
 epoch: 69, train_loss: 0.3718, test_loss: 1.6394, test_f1: 0.5847
 epoch: 70, train_loss: 0.3737, test_loss: 1.6787, test_f1: 0.5701
 epoch: 71, train_loss: 0.3647, test_loss: 1.6759, test_f1: 0.5845
 epoch: 72, train_loss: 0.3685, test_loss: 1.6266, test_f1: 0.5996
 epoch: 73, train_loss: 0.3610, test_loss: 1.7486, test_f1: 0.5763
 epoch: 74, train_loss: 0.3748, test_loss: 1.6883, test_f1: 0.6047
 epoch: 75, train_loss: 0.3568, test_loss: 1.7549, test_f1: 0.5684
 epoch: 76, train_loss: 0.3408, test_loss: 1.7702, test_f1: 0.5993
 epoch: 77, train_loss: 0.3558, test_loss: 1.6521, test_f1: 0.6184
 epoch: 78, train_loss: 0.3633, test_loss: 1.7146, test_f1: 0.5839
 epoch: 79, train_loss: 0.3616, test_loss: 1.8341, test_f1: 0.5577
 epoch: 80, train_loss: 0.3796, test_loss: 1.6542, test_f1: 0.6055
 epoch: 81, train_loss: 0.3430, test_loss: 1.8961, test_f1: 0.5848
 epoch: 82, train_loss: 0.3541, test_loss: 1.6550, test_f1: 0.6019
 epoch: 83, train_loss: 0.3484, test_loss: 1.9768, test_f1: 0.6058
 epoch: 84, train_loss: 0.3463, test_loss: 1.7993, test_f1: 0.6055
 epoch: 85, train_loss: 0.3566, test_loss: 1.8220, test_f1: 0.5866
 epoch: 86, train_loss: 0.3380, test_loss: 1.7367, test_f1: 0.6125
 epoch: 87, train_loss: 0.3638, test_loss: 1.9744, test_f1: 0.5826
 epoch: 88, train_loss: 0.3266, test_loss: 1.7440, test_f1: 0.6237
 epoch: 89, train_loss: 0.3331, test_loss: 1.8511, test_f1: 0.5937
 epoch: 90, train_loss: 0.3180, test_loss: 1.8490, test_f1: 0.5929
 epoch: 91, train_loss: 0.3310, test_loss: 1.8439, test_f1: 0.5801
 epoch: 92, train_loss: 0.3114, test_loss: 1.9216, test_f1: 0.6020
 epoch: 93, train_loss: 0.3332, test_loss: 1.7802, test_f1: 0.6171
 epoch: 94, train_loss: 0.3324, test_loss: 1.8186, test_f1: 0.6341
 epoch: 95, train_loss: 0.3134, test_loss: 1.7485, test_f1: 0.5791
 epoch: 96, train_loss: 0.3194, test_loss: 2.0567, test_f1: 0.5993
 epoch: 97, train_loss: 0.3029, test_loss: 1.7293, test_f1: 0.6311
 epoch: 98, train_loss: 0.2882, test_loss: 1.8526, test_f1: 0.6148
 epoch: 99, train_loss: 0.3006, test_loss: 1.9438, test_f1: 0.5842
##################ITERATION #8 ****************************************
 epoch: 0, train_loss: 1.6911, test_loss: 1.2827, test_f1: 0.3072
 epoch: 1, train_loss: 1.2282, test_loss: 1.1951, test_f1: 0.4182
 epoch: 2, train_loss: 1.1099, test_loss: 1.1591, test_f1: 0.4654
 epoch: 3, train_loss: 1.0439, test_loss: 1.0796, test_f1: 0.4900
 epoch: 4, train_loss: 0.9730, test_loss: 1.0659, test_f1: 0.5475
 epoch: 5, train_loss: 0.9544, test_loss: 1.0478, test_f1: 0.5356
 epoch: 6, train_loss: 0.9398, test_loss: 1.0121, test_f1: 0.5590
 epoch: 7, train_loss: 0.9187, test_loss: 1.0321, test_f1: 0.5346
 epoch: 8, train_loss: 0.8781, test_loss: 1.0343, test_f1: 0.5049
 epoch: 9, train_loss: 0.8667, test_loss: 1.0228, test_f1: 0.5168
 epoch: 10, train_loss: 0.8597, test_loss: 0.9711, test_f1: 0.5661
 epoch: 11, train_loss: 0.8417, test_loss: 1.0194, test_f1: 0.5460
 epoch: 12, train_loss: 0.8052, test_loss: 0.9588, test_f1: 0.5783
 epoch: 13, train_loss: 0.8021, test_loss: 1.0245, test_f1: 0.5743
 epoch: 14, train_loss: 0.7993, test_loss: 1.0476, test_f1: 0.5342
 epoch: 15, train_loss: 0.7719, test_loss: 1.0605, test_f1: 0.5345
 epoch: 16, train_loss: 0.7536, test_loss: 1.0128, test_f1: 0.5748
 epoch: 17, train_loss: 0.7492, test_loss: 1.0358, test_f1: 0.5736
 epoch: 18, train_loss: 0.7554, test_loss: 1.0172, test_f1: 0.5639
 epoch: 19, train_loss: 0.7379, test_loss: 0.9876, test_f1: 0.5928
 epoch: 20, train_loss: 0.7345, test_loss: 1.0216, test_f1: 0.5598
 epoch: 21, train_loss: 0.7063, test_loss: 1.1267, test_f1: 0.5245
 epoch: 22, train_loss: 0.7019, test_loss: 1.0262, test_f1: 0.5767
 epoch: 23, train_loss: 0.6853, test_loss: 1.0478, test_f1: 0.5638
 epoch: 24, train_loss: 0.6849, test_loss: 1.0417, test_f1: 0.5855
 epoch: 25, train_loss: 0.6698, test_loss: 1.0968, test_f1: 0.5901
 epoch: 26, train_loss: 0.6484, test_loss: 1.1391, test_f1: 0.5800
 epoch: 27, train_loss: 0.6300, test_loss: 1.0950, test_f1: 0.6066
 epoch: 28, train_loss: 0.6510, test_loss: 1.1411, test_f1: 0.5879
 epoch: 29, train_loss: 0.6452, test_loss: 1.2297, test_f1: 0.5748
 epoch: 30, train_loss: 0.6127, test_loss: 1.1304, test_f1: 0.5850
 epoch: 31, train_loss: 0.6136, test_loss: 1.1099, test_f1: 0.6080
 epoch: 32, train_loss: 0.6116, test_loss: 1.0762, test_f1: 0.6205
 epoch: 33, train_loss: 0.5770, test_loss: 1.1452, test_f1: 0.5928
 epoch: 34, train_loss: 0.5980, test_loss: 1.2410, test_f1: 0.5940
 epoch: 35, train_loss: 0.5646, test_loss: 1.1866, test_f1: 0.5979
 epoch: 36, train_loss: 0.5554, test_loss: 1.1025, test_f1: 0.6039
 epoch: 37, train_loss: 0.5575, test_loss: 1.2157, test_f1: 0.5638
 epoch: 38, train_loss: 0.5489, test_loss: 1.2270, test_f1: 0.5863
 epoch: 39, train_loss: 0.5795, test_loss: 1.2207, test_f1: 0.5721
 epoch: 40, train_loss: 0.5519, test_loss: 1.2420, test_f1: 0.6026
 epoch: 41, train_loss: 0.5439, test_loss: 1.2180, test_f1: 0.5884
 epoch: 42, train_loss: 0.5105, test_loss: 1.2612, test_f1: 0.5912
 epoch: 43, train_loss: 0.5273, test_loss: 1.2967, test_f1: 0.5768
 epoch: 44, train_loss: 0.5213, test_loss: 1.4153, test_f1: 0.5710
 epoch: 45, train_loss: 0.5234, test_loss: 1.3197, test_f1: 0.5871
 epoch: 46, train_loss: 0.5262, test_loss: 1.3069, test_f1: 0.5838
 epoch: 47, train_loss: 0.5137, test_loss: 1.3281, test_f1: 0.5792
 epoch: 48, train_loss: 0.4797, test_loss: 1.3913, test_f1: 0.5827
 epoch: 49, train_loss: 0.4766, test_loss: 1.4061, test_f1: 0.5924
 epoch: 50, train_loss: 0.4627, test_loss: 1.3488, test_f1: 0.6182
 epoch: 51, train_loss: 0.4778, test_loss: 1.4087, test_f1: 0.5724
 epoch: 52, train_loss: 0.4346, test_loss: 1.4165, test_f1: 0.6311
 epoch: 53, train_loss: 0.4135, test_loss: 1.4548, test_f1: 0.6206
 epoch: 54, train_loss: 0.4009, test_loss: 1.4482, test_f1: 0.6100
 epoch: 55, train_loss: 0.4180, test_loss: 1.4531, test_f1: 0.6385
 epoch: 56, train_loss: 0.4326, test_loss: 1.4839, test_f1: 0.6351
 epoch: 57, train_loss: 0.3917, test_loss: 1.5012, test_f1: 0.6192
 epoch: 58, train_loss: 0.3848, test_loss: 1.5403, test_f1: 0.6230
 epoch: 59, train_loss: 0.4177, test_loss: 1.5720, test_f1: 0.6135
 epoch: 60, train_loss: 0.4036, test_loss: 1.5701, test_f1: 0.5850
 epoch: 61, train_loss: 0.3723, test_loss: 1.4764, test_f1: 0.6161
 epoch: 62, train_loss: 0.3655, test_loss: 1.5973, test_f1: 0.5672
 epoch: 63, train_loss: 0.3692, test_loss: 1.6315, test_f1: 0.6080
 epoch: 64, train_loss: 0.3765, test_loss: 1.5491, test_f1: 0.6309
 epoch: 65, train_loss: 0.3484, test_loss: 1.5930, test_f1: 0.6387
 epoch: 66, train_loss: 0.3874, test_loss: 1.6464, test_f1: 0.6043
 epoch: 67, train_loss: 0.3535, test_loss: 1.6026, test_f1: 0.6077
 epoch: 68, train_loss: 0.3588, test_loss: 1.6156, test_f1: 0.6126
 epoch: 69, train_loss: 0.3486, test_loss: 1.6558, test_f1: 0.6134
 epoch: 70, train_loss: 0.3486, test_loss: 1.5636, test_f1: 0.6350
 epoch: 71, train_loss: 0.3531, test_loss: 1.6293, test_f1: 0.6129
 epoch: 72, train_loss: 0.3506, test_loss: 1.6922, test_f1: 0.6260
 epoch: 73, train_loss: 0.3409, test_loss: 1.6450, test_f1: 0.6181
 epoch: 74, train_loss: 0.3304, test_loss: 1.7681, test_f1: 0.6206
 epoch: 75, train_loss: 0.3347, test_loss: 1.7519, test_f1: 0.6154
 epoch: 76, train_loss: 0.3460, test_loss: 1.6062, test_f1: 0.6025
 epoch: 77, train_loss: 0.3439, test_loss: 1.7803, test_f1: 0.5963
 epoch: 78, train_loss: 0.3274, test_loss: 1.6709, test_f1: 0.6298
 epoch: 79, train_loss: 0.3407, test_loss: 1.6395, test_f1: 0.6227
 epoch: 80, train_loss: 0.3676, test_loss: 1.7423, test_f1: 0.5591
 epoch: 81, train_loss: 0.3199, test_loss: 1.6886, test_f1: 0.6452
 epoch: 82, train_loss: 0.3016, test_loss: 1.6928, test_f1: 0.6136
 epoch: 83, train_loss: 0.3144, test_loss: 1.7988, test_f1: 0.5844
 epoch: 84, train_loss: 0.3005, test_loss: 1.6709, test_f1: 0.6300
 epoch: 85, train_loss: 0.3072, test_loss: 1.8644, test_f1: 0.6081
 epoch: 86, train_loss: 0.3055, test_loss: 1.8738, test_f1: 0.6012
 epoch: 87, train_loss: 0.3146, test_loss: 1.8682, test_f1: 0.6013
 epoch: 88, train_loss: 0.2928, test_loss: 1.9089, test_f1: 0.6133
 epoch: 89, train_loss: 0.3083, test_loss: 1.8035, test_f1: 0.5984
 epoch: 90, train_loss: 0.2805, test_loss: 1.8473, test_f1: 0.5930
 epoch: 91, train_loss: 0.2916, test_loss: 1.8686, test_f1: 0.6298
 epoch: 92, train_loss: 0.3032, test_loss: 1.8832, test_f1: 0.6085
 epoch: 93, train_loss: 0.2973, test_loss: 1.9140, test_f1: 0.6135
 epoch: 94, train_loss: 0.2857, test_loss: 1.9787, test_f1: 0.6128
 epoch: 95, train_loss: 0.2695, test_loss: 1.9285, test_f1: 0.6409
 epoch: 96, train_loss: 0.2858, test_loss: 1.9435, test_f1: 0.6205
 epoch: 97, train_loss: 0.2815, test_loss: 1.9084, test_f1: 0.6094
 epoch: 98, train_loss: 0.2821, test_loss: 1.9429, test_f1: 0.6286
 epoch: 99, train_loss: 0.2875, test_loss: 1.8506, test_f1: 0.6465
##################ITERATION #9 ****************************************
 epoch: 0, train_loss: 1.4285, test_loss: 1.7404, test_f1: 0.2597
 epoch: 1, train_loss: 1.1074, test_loss: 1.3218, test_f1: 0.3045
 epoch: 2, train_loss: 1.0366, test_loss: 1.1254, test_f1: 0.5305
 epoch: 3, train_loss: 1.0030, test_loss: 1.0615, test_f1: 0.5120
 epoch: 4, train_loss: 0.9663, test_loss: 1.0411, test_f1: 0.5605
 epoch: 5, train_loss: 0.9381, test_loss: 1.0894, test_f1: 0.5281
 epoch: 6, train_loss: 0.8992, test_loss: 1.0298, test_f1: 0.5727
 epoch: 7, train_loss: 0.8755, test_loss: 1.0045, test_f1: 0.6020
 epoch: 8, train_loss: 0.8671, test_loss: 1.0321, test_f1: 0.5544
 epoch: 9, train_loss: 0.8533, test_loss: 1.0228, test_f1: 0.5965
 epoch: 10, train_loss: 0.8517, test_loss: 1.0191, test_f1: 0.5811
 epoch: 11, train_loss: 0.8174, test_loss: 0.9779, test_f1: 0.5974
 epoch: 12, train_loss: 0.8113, test_loss: 0.9898, test_f1: 0.5651
 epoch: 13, train_loss: 0.8162, test_loss: 1.0882, test_f1: 0.5313
 epoch: 14, train_loss: 0.7709, test_loss: 1.0346, test_f1: 0.5498
 epoch: 15, train_loss: 0.7922, test_loss: 0.9832, test_f1: 0.6197
 epoch: 16, train_loss: 0.7521, test_loss: 1.0794, test_f1: 0.6182
 epoch: 17, train_loss: 0.7124, test_loss: 1.0584, test_f1: 0.5849
 epoch: 18, train_loss: 0.7357, test_loss: 1.0480, test_f1: 0.5887
 epoch: 19, train_loss: 0.6894, test_loss: 1.0124, test_f1: 0.6001
 epoch: 20, train_loss: 0.7007, test_loss: 1.0596, test_f1: 0.5917
 epoch: 21, train_loss: 0.6967, test_loss: 1.1679, test_f1: 0.5496
 epoch: 22, train_loss: 0.6908, test_loss: 1.0233, test_f1: 0.5945
 epoch: 23, train_loss: 0.6960, test_loss: 1.0503, test_f1: 0.6284
 epoch: 24, train_loss: 0.6803, test_loss: 1.0826, test_f1: 0.6089
 epoch: 25, train_loss: 0.6820, test_loss: 0.9996, test_f1: 0.5990
 epoch: 26, train_loss: 0.6434, test_loss: 1.0686, test_f1: 0.5988
 epoch: 27, train_loss: 0.6341, test_loss: 1.1224, test_f1: 0.5680
 epoch: 28, train_loss: 0.6075, test_loss: 1.0816, test_f1: 0.6146
 epoch: 29, train_loss: 0.6017, test_loss: 1.1281, test_f1: 0.5891
 epoch: 30, train_loss: 0.6241, test_loss: 1.1585, test_f1: 0.6156
 epoch: 31, train_loss: 0.6011, test_loss: 1.2037, test_f1: 0.5822
 epoch: 32, train_loss: 0.5930, test_loss: 1.1124, test_f1: 0.6016
 epoch: 33, train_loss: 0.5946, test_loss: 1.1331, test_f1: 0.5856
 epoch: 34, train_loss: 0.5684, test_loss: 1.1885, test_f1: 0.5727
 epoch: 35, train_loss: 0.5930, test_loss: 1.1956, test_f1: 0.6010
 epoch: 36, train_loss: 0.5560, test_loss: 1.1838, test_f1: 0.5980
 epoch: 37, train_loss: 0.5369, test_loss: 1.1806, test_f1: 0.5889
 epoch: 38, train_loss: 0.5468, test_loss: 1.2414, test_f1: 0.5858
 epoch: 39, train_loss: 0.5263, test_loss: 1.2510, test_f1: 0.6029
 epoch: 40, train_loss: 0.5181, test_loss: 1.3124, test_f1: 0.6020
 epoch: 41, train_loss: 0.5354, test_loss: 1.2143, test_f1: 0.6184
 epoch: 42, train_loss: 0.5343, test_loss: 1.1341, test_f1: 0.6062
 epoch: 43, train_loss: 0.5549, test_loss: 1.1918, test_f1: 0.6326
 epoch: 44, train_loss: 0.5301, test_loss: 1.3060, test_f1: 0.5722
 epoch: 45, train_loss: 0.5325, test_loss: 1.2175, test_f1: 0.5982
 epoch: 46, train_loss: 0.5059, test_loss: 1.2604, test_f1: 0.6045
 epoch: 47, train_loss: 0.4959, test_loss: 1.2827, test_f1: 0.5995
 epoch: 48, train_loss: 0.4843, test_loss: 1.2747, test_f1: 0.6288
 epoch: 49, train_loss: 0.4877, test_loss: 1.3285, test_f1: 0.6290
 epoch: 50, train_loss: 0.4812, test_loss: 1.3069, test_f1: 0.5883
 epoch: 51, train_loss: 0.4485, test_loss: 1.2890, test_f1: 0.6212
 epoch: 52, train_loss: 0.4445, test_loss: 1.2963, test_f1: 0.6353
 epoch: 53, train_loss: 0.4177, test_loss: 1.3706, test_f1: 0.6235
 epoch: 54, train_loss: 0.4210, test_loss: 1.3476, test_f1: 0.6176
 epoch: 55, train_loss: 0.4165, test_loss: 1.3570, test_f1: 0.6211
 epoch: 56, train_loss: 0.4177, test_loss: 1.3809, test_f1: 0.6386
 epoch: 57, train_loss: 0.4067, test_loss: 1.3135, test_f1: 0.6456
 epoch: 58, train_loss: 0.4218, test_loss: 1.3212, test_f1: 0.6284
 epoch: 59, train_loss: 0.4413, test_loss: 1.4434, test_f1: 0.6140
 epoch: 60, train_loss: 0.4004, test_loss: 1.4129, test_f1: 0.6240
 epoch: 61, train_loss: 0.3824, test_loss: 1.4117, test_f1: 0.6296
 epoch: 62, train_loss: 0.3858, test_loss: 1.3849, test_f1: 0.6435
 epoch: 63, train_loss: 0.3973, test_loss: 1.4185, test_f1: 0.6331
 epoch: 64, train_loss: 0.3715, test_loss: 1.4237, test_f1: 0.6347
 epoch: 65, train_loss: 0.3778, test_loss: 1.5205, test_f1: 0.6240
 epoch: 66, train_loss: 0.3832, test_loss: 1.4552, test_f1: 0.6235
 epoch: 67, train_loss: 0.3506, test_loss: 1.4951, test_f1: 0.6024
 epoch: 68, train_loss: 0.3830, test_loss: 1.5629, test_f1: 0.6167
 epoch: 69, train_loss: 0.3481, test_loss: 1.4724, test_f1: 0.6263
 epoch: 70, train_loss: 0.3586, test_loss: 1.5074, test_f1: 0.6245
 epoch: 71, train_loss: 0.3536, test_loss: 1.5973, test_f1: 0.5989
 epoch: 72, train_loss: 0.3613, test_loss: 1.5385, test_f1: 0.6403
 epoch: 73, train_loss: 0.3597, test_loss: 1.5454, test_f1: 0.6275
 epoch: 74, train_loss: 0.3445, test_loss: 1.5554, test_f1: 0.6109
 epoch: 75, train_loss: 0.3434, test_loss: 1.6875, test_f1: 0.5836
 epoch: 76, train_loss: 0.3301, test_loss: 1.5712, test_f1: 0.6432
 epoch: 77, train_loss: 0.3498, test_loss: 1.6662, test_f1: 0.6253
 epoch: 78, train_loss: 0.3453, test_loss: 1.5961, test_f1: 0.6323
 epoch: 79, train_loss: 0.3457, test_loss: 1.6074, test_f1: 0.6328
 epoch: 80, train_loss: 0.3376, test_loss: 1.6521, test_f1: 0.6078
 epoch: 81, train_loss: 0.3384, test_loss: 1.5962, test_f1: 0.6358
 epoch: 82, train_loss: 0.3357, test_loss: 1.6976, test_f1: 0.6337
 epoch: 83, train_loss: 0.3340, test_loss: 1.7257, test_f1: 0.6083
 epoch: 84, train_loss: 0.3197, test_loss: 1.6791, test_f1: 0.6248
 epoch: 85, train_loss: 0.3232, test_loss: 1.7014, test_f1: 0.6178
 epoch: 86, train_loss: 0.3117, test_loss: 1.7047, test_f1: 0.6276
 epoch: 87, train_loss: 0.3582, test_loss: 1.6669, test_f1: 0.6352
 epoch: 88, train_loss: 0.3056, test_loss: 1.6764, test_f1: 0.6216
 epoch: 89, train_loss: 0.3346, test_loss: 1.7502, test_f1: 0.6118
 epoch: 90, train_loss: 0.3539, test_loss: 1.7231, test_f1: 0.6342
 epoch: 91, train_loss: 0.3348, test_loss: 1.8180, test_f1: 0.6169
 epoch: 92, train_loss: 0.3090, test_loss: 1.7807, test_f1: 0.6309
 epoch: 93, train_loss: 0.3395, test_loss: 1.8211, test_f1: 0.5970
 epoch: 94, train_loss: 0.3228, test_loss: 1.7685, test_f1: 0.6014
 epoch: 95, train_loss: 0.3049, test_loss: 1.8216, test_f1: 0.6176
 epoch: 96, train_loss: 0.3273, test_loss: 1.8664, test_f1: 0.5897
 epoch: 97, train_loss: 0.3056, test_loss: 1.7592, test_f1: 0.6231
 epoch: 98, train_loss: 0.3025, test_loss: 1.9340, test_f1: 0.6315
 epoch: 99, train_loss: 0.3105, test_loss: 1.9557, test_f1: 0.5758

Training completed in 654.36 seconds
Best F1: 0.6782 at epoch 87
Mean F1 across iterations: 0.6505  0.0128
========================FINAL RESULTS================================
FEGIN weighted F1: 0.6782  0.0128
python main.py --data ltspice_demos --representation component_pin_net --model FEGIN --layers 4 --hiddens 32 --batch_size 64 --lr 0.001 --emb_size 512 --epochs 100 --save_appendix component_pin_net_L4_H32_BS64_LR0.001_E512 --no_val
-----



STDERR:
  File "main.py", line 370, in <module>
    main()
  File "main.py", line 254, in main
    dataset = dataset_class(
  File "/home/philip/projects/ltspice_examples_code_repo/Circuit-Completion-Using-GNNs/component_classification_with_link_prediction_head/evaluation/FEGIN/kernel/circuit_datasets.py", line 15, in __init__
    self.data, self.slices = torch.load(self.processed_paths[0])
  File "/home/philip/.local/lib/python3.8/site-packages/torch/serialization.py", line 1040, in load
    warnings.warn(
  File "/usr/lib/python3.8/warnings.py", line 109, in _showwarnmsg
    sw(msg.message, msg.category, msg.filename, msg.lineno,
  File "main.py", line 47, in warn_with_traceback
    traceback.print_stack(file=log)
/home/philip/projects/ltspice_examples_code_repo/Circuit-Completion-Using-GNNs/component_classification_with_link_prediction_head/evaluation/FEGIN/kernel/circuit_datasets.py:15: FutureWarning: You are using `torch.load` with `weights_only=False` (the current default value), which uses the default pickle module implicitly. It is possible to construct malicious pickle data which will execute arbitrary code during unpickling (See https://github.com/pytorch/pytorch/blob/main/SECURITY.md#untrusted-models for more details). In a future release, the default value for `weights_only` will be flipped to `True`. This limits the functions that could be executed during unpickling. Arbitrary objects will no longer be allowed to be loaded via this mode unless they are explicitly allowlisted by the user via `torch.serialization.add_safe_globals`. We recommend you start setting `weights_only=True` for any use case where you don't have full control of the loaded file. Please open an issue on GitHub for any issues related to this experimental feature.
  self.data, self.slices = torch.load(self.processed_paths[0])
