STDOUT:
Results will be saved in /home/philip/projects/llm_inference_code_repo/Circuit-Completion-Using-GNNs/component_classification_with_link_prediction_head/evaluation/FEGIN/results/model_FEGIN_dataset_ltspice_examples
Command line input: python main.py --data ltspice_examples --representation component_net --model FEGIN --layers 6 --hiddens 64 --batch_size 256 --lr 0.0001 --emb_size 512 --epochs 100 --save_appendix component_net_L6_H64_BS256_LR0.0001_E512 --no_val
 is saved.
-----
ltspice_examples - FEGIN
Using 6 layers, 64 hidden units, h = 2
Loading component_net representation dataset
ENTERED
Training FEGIN on component_net representation
Train: 3558, Test: 846
##################ITERATION #0 ****************************************
 epoch: 0, train_loss: 1.3996, test_loss: 1.3972, test_f1: 0.0793
 epoch: 1, train_loss: 1.3886, test_loss: 1.3935, test_f1: 0.0793
 epoch: 2, train_loss: 1.3811, test_loss: 1.3858, test_f1: 0.0793
 epoch: 3, train_loss: 1.3715, test_loss: 1.3718, test_f1: 0.0793
 epoch: 4, train_loss: 1.3605, test_loss: 1.3577, test_f1: 0.1200
 epoch: 5, train_loss: 1.3493, test_loss: 1.3394, test_f1: 0.3012
 epoch: 6, train_loss: 1.3336, test_loss: 1.3199, test_f1: 0.3571
 epoch: 7, train_loss: 1.3188, test_loss: 1.3012, test_f1: 0.3621
 epoch: 8, train_loss: 1.2993, test_loss: 1.2808, test_f1: 0.3531
 epoch: 9, train_loss: 1.2802, test_loss: 1.2609, test_f1: 0.3581
 epoch: 10, train_loss: 1.2609, test_loss: 1.2413, test_f1: 0.3070
 epoch: 11, train_loss: 1.2438, test_loss: 1.2246, test_f1: 0.3251
 epoch: 12, train_loss: 1.2273, test_loss: 1.2090, test_f1: 0.3364
 epoch: 13, train_loss: 1.2113, test_loss: 1.1922, test_f1: 0.3424
 epoch: 14, train_loss: 1.1975, test_loss: 1.1785, test_f1: 0.3526
 epoch: 15, train_loss: 1.1851, test_loss: 1.1632, test_f1: 0.3603
 epoch: 16, train_loss: 1.1724, test_loss: 1.1512, test_f1: 0.3669
 epoch: 17, train_loss: 1.1580, test_loss: 1.1364, test_f1: 0.3822
 epoch: 18, train_loss: 1.1483, test_loss: 1.1246, test_f1: 0.3875
 epoch: 19, train_loss: 1.1326, test_loss: 1.1092, test_f1: 0.4127
 epoch: 20, train_loss: 1.1216, test_loss: 1.0932, test_f1: 0.4275
 epoch: 21, train_loss: 1.1094, test_loss: 1.0821, test_f1: 0.4446
 epoch: 22, train_loss: 1.0976, test_loss: 1.0663, test_f1: 0.4551
 epoch: 23, train_loss: 1.0813, test_loss: 1.0581, test_f1: 0.4577
 epoch: 24, train_loss: 1.0700, test_loss: 1.0427, test_f1: 0.4762
 epoch: 25, train_loss: 1.0595, test_loss: 1.0302, test_f1: 0.4879
 epoch: 26, train_loss: 1.0509, test_loss: 1.0246, test_f1: 0.4844
 epoch: 27, train_loss: 1.0391, test_loss: 1.0155, test_f1: 0.4966
 epoch: 28, train_loss: 1.0273, test_loss: 0.9935, test_f1: 0.4874
 epoch: 29, train_loss: 1.0110, test_loss: 0.9815, test_f1: 0.4941
 epoch: 30, train_loss: 0.9985, test_loss: 0.9779, test_f1: 0.4881
 epoch: 31, train_loss: 0.9965, test_loss: 0.9674, test_f1: 0.4930
 epoch: 32, train_loss: 0.9842, test_loss: 0.9623, test_f1: 0.5015
 epoch: 33, train_loss: 0.9790, test_loss: 0.9524, test_f1: 0.5076
 epoch: 34, train_loss: 0.9614, test_loss: 0.9458, test_f1: 0.4939
 epoch: 35, train_loss: 0.9519, test_loss: 0.9355, test_f1: 0.5056
 epoch: 36, train_loss: 0.9558, test_loss: 0.9407, test_f1: 0.4997
 epoch: 37, train_loss: 0.9455, test_loss: 0.9310, test_f1: 0.5073
 epoch: 38, train_loss: 0.9323, test_loss: 0.9208, test_f1: 0.5108
 epoch: 39, train_loss: 0.9135, test_loss: 0.9124, test_f1: 0.5024
 epoch: 40, train_loss: 0.9229, test_loss: 0.9122, test_f1: 0.4989
 epoch: 41, train_loss: 0.9099, test_loss: 0.9025, test_f1: 0.5137
 epoch: 42, train_loss: 0.8977, test_loss: 0.9167, test_f1: 0.5067
 epoch: 43, train_loss: 0.8895, test_loss: 0.9041, test_f1: 0.5154
 epoch: 44, train_loss: 0.8827, test_loss: 0.9021, test_f1: 0.5079
 epoch: 45, train_loss: 0.8816, test_loss: 0.9025, test_f1: 0.5177
 epoch: 46, train_loss: 0.8708, test_loss: 0.8832, test_f1: 0.5054
 epoch: 47, train_loss: 0.8666, test_loss: 0.9020, test_f1: 0.5124
 epoch: 48, train_loss: 0.8609, test_loss: 0.8930, test_f1: 0.5009
 epoch: 49, train_loss: 0.8614, test_loss: 0.8974, test_f1: 0.5158
 epoch: 50, train_loss: 0.8554, test_loss: 0.9021, test_f1: 0.5092
 epoch: 51, train_loss: 0.8468, test_loss: 0.8918, test_f1: 0.5216
 epoch: 52, train_loss: 0.8487, test_loss: 0.8891, test_f1: 0.5120
 epoch: 53, train_loss: 0.8408, test_loss: 0.8858, test_f1: 0.5108
 epoch: 54, train_loss: 0.8421, test_loss: 0.8779, test_f1: 0.5102
 epoch: 55, train_loss: 0.8422, test_loss: 0.8926, test_f1: 0.5062
 epoch: 56, train_loss: 0.8303, test_loss: 0.8859, test_f1: 0.5142
 epoch: 57, train_loss: 0.8227, test_loss: 0.8858, test_f1: 0.5171
 epoch: 58, train_loss: 0.8180, test_loss: 0.8837, test_f1: 0.5091
 epoch: 59, train_loss: 0.8204, test_loss: 0.8921, test_f1: 0.5143
 epoch: 60, train_loss: 0.8335, test_loss: 0.8960, test_f1: 0.5085
 epoch: 61, train_loss: 0.8262, test_loss: 0.8832, test_f1: 0.5149
 epoch: 62, train_loss: 0.8118, test_loss: 0.8804, test_f1: 0.5138
 epoch: 63, train_loss: 0.8182, test_loss: 0.8895, test_f1: 0.5212
 epoch: 64, train_loss: 0.8094, test_loss: 0.8867, test_f1: 0.5244
 epoch: 65, train_loss: 0.8077, test_loss: 0.8775, test_f1: 0.5195
 epoch: 66, train_loss: 0.8017, test_loss: 0.8827, test_f1: 0.5219
 epoch: 67, train_loss: 0.7964, test_loss: 0.8858, test_f1: 0.5253
 epoch: 68, train_loss: 0.8041, test_loss: 0.8789, test_f1: 0.5228
 epoch: 69, train_loss: 0.8029, test_loss: 0.8849, test_f1: 0.5162
 epoch: 70, train_loss: 0.7966, test_loss: 0.8825, test_f1: 0.5124
 epoch: 71, train_loss: 0.8030, test_loss: 0.8826, test_f1: 0.5181
 epoch: 72, train_loss: 0.8038, test_loss: 0.8902, test_f1: 0.5178
 epoch: 73, train_loss: 0.7946, test_loss: 0.8856, test_f1: 0.5074
 epoch: 74, train_loss: 0.7905, test_loss: 0.8806, test_f1: 0.5150
 epoch: 75, train_loss: 0.7884, test_loss: 0.8889, test_f1: 0.5139
 epoch: 76, train_loss: 0.7841, test_loss: 0.8873, test_f1: 0.5196
 epoch: 77, train_loss: 0.7891, test_loss: 0.8773, test_f1: 0.5109
 epoch: 78, train_loss: 0.7897, test_loss: 0.8859, test_f1: 0.5190
 epoch: 79, train_loss: 0.7835, test_loss: 0.8878, test_f1: 0.5175
 epoch: 80, train_loss: 0.7791, test_loss: 0.8992, test_f1: 0.5194
 epoch: 81, train_loss: 0.7839, test_loss: 0.8943, test_f1: 0.5091
 epoch: 82, train_loss: 0.7775, test_loss: 0.8914, test_f1: 0.5178
 epoch: 83, train_loss: 0.7798, test_loss: 0.8889, test_f1: 0.5126
 epoch: 84, train_loss: 0.7809, test_loss: 0.8878, test_f1: 0.5181
 epoch: 85, train_loss: 0.7686, test_loss: 0.9023, test_f1: 0.5004
 epoch: 86, train_loss: 0.7766, test_loss: 0.9029, test_f1: 0.5178
 epoch: 87, train_loss: 0.7832, test_loss: 0.8960, test_f1: 0.5081
 epoch: 88, train_loss: 0.7791, test_loss: 0.8974, test_f1: 0.5045
 epoch: 89, train_loss: 0.7696, test_loss: 0.9146, test_f1: 0.5022
 epoch: 90, train_loss: 0.7739, test_loss: 0.9067, test_f1: 0.5016
 epoch: 91, train_loss: 0.7648, test_loss: 0.9005, test_f1: 0.5037
 epoch: 92, train_loss: 0.7647, test_loss: 0.8832, test_f1: 0.5125
 epoch: 93, train_loss: 0.7668, test_loss: 0.8933, test_f1: 0.5140
 epoch: 94, train_loss: 0.7613, test_loss: 0.8980, test_f1: 0.5101
 epoch: 95, train_loss: 0.7677, test_loss: 0.8890, test_f1: 0.5099
 epoch: 96, train_loss: 0.7598, test_loss: 0.8928, test_f1: 0.5165
 epoch: 97, train_loss: 0.7529, test_loss: 0.9035, test_f1: 0.5032
 epoch: 98, train_loss: 0.7599, test_loss: 0.8997, test_f1: 0.5077
 epoch: 99, train_loss: 0.7489, test_loss: 0.8954, test_f1: 0.5149
##################ITERATION #1 ****************************************
 epoch: 0, train_loss: 1.3644, test_loss: 1.3801, test_f1: 0.0793
 epoch: 1, train_loss: 1.3340, test_loss: 1.3711, test_f1: 0.0793
 epoch: 2, train_loss: 1.3162, test_loss: 1.3553, test_f1: 0.3585
 epoch: 3, train_loss: 1.2955, test_loss: 1.3164, test_f1: 0.3710
 epoch: 4, train_loss: 1.2768, test_loss: 1.2718, test_f1: 0.3693
 epoch: 5, train_loss: 1.2587, test_loss: 1.2445, test_f1: 0.3726
 epoch: 6, train_loss: 1.2419, test_loss: 1.2221, test_f1: 0.3840
 epoch: 7, train_loss: 1.2234, test_loss: 1.1988, test_f1: 0.3865
 epoch: 8, train_loss: 1.2046, test_loss: 1.1787, test_f1: 0.3916
 epoch: 9, train_loss: 1.1880, test_loss: 1.1591, test_f1: 0.3990
 epoch: 10, train_loss: 1.1736, test_loss: 1.1363, test_f1: 0.4121
 epoch: 11, train_loss: 1.1539, test_loss: 1.1179, test_f1: 0.4262
 epoch: 12, train_loss: 1.1341, test_loss: 1.0959, test_f1: 0.4392
 epoch: 13, train_loss: 1.1210, test_loss: 1.0766, test_f1: 0.4448
 epoch: 14, train_loss: 1.0991, test_loss: 1.0586, test_f1: 0.4485
 epoch: 15, train_loss: 1.0859, test_loss: 1.0413, test_f1: 0.4654
 epoch: 16, train_loss: 1.0698, test_loss: 1.0261, test_f1: 0.4659
 epoch: 17, train_loss: 1.0560, test_loss: 1.0137, test_f1: 0.4640
 epoch: 18, train_loss: 1.0455, test_loss: 0.9994, test_f1: 0.4827
 epoch: 19, train_loss: 1.0290, test_loss: 0.9817, test_f1: 0.4882
 epoch: 20, train_loss: 1.0207, test_loss: 0.9756, test_f1: 0.4902
 epoch: 21, train_loss: 1.0053, test_loss: 0.9674, test_f1: 0.5102
 epoch: 22, train_loss: 1.0003, test_loss: 0.9572, test_f1: 0.5065
 epoch: 23, train_loss: 0.9906, test_loss: 0.9561, test_f1: 0.5100
 epoch: 24, train_loss: 0.9847, test_loss: 0.9457, test_f1: 0.4991
 epoch: 25, train_loss: 0.9686, test_loss: 0.9393, test_f1: 0.5159
 epoch: 26, train_loss: 0.9515, test_loss: 0.9365, test_f1: 0.5011
 epoch: 27, train_loss: 0.9414, test_loss: 0.9229, test_f1: 0.5181
 epoch: 28, train_loss: 0.9438, test_loss: 0.9278, test_f1: 0.5158
 epoch: 29, train_loss: 0.9304, test_loss: 0.9165, test_f1: 0.5209
 epoch: 30, train_loss: 0.9207, test_loss: 0.9226, test_f1: 0.5117
 epoch: 31, train_loss: 0.9055, test_loss: 0.9249, test_f1: 0.5301
 epoch: 32, train_loss: 0.9026, test_loss: 0.9123, test_f1: 0.5146
 epoch: 33, train_loss: 0.9028, test_loss: 0.9074, test_f1: 0.5362
 epoch: 34, train_loss: 0.8910, test_loss: 0.9012, test_f1: 0.5309
 epoch: 35, train_loss: 0.8893, test_loss: 0.9137, test_f1: 0.5265
 epoch: 36, train_loss: 0.8812, test_loss: 0.9098, test_f1: 0.5283
 epoch: 37, train_loss: 0.8736, test_loss: 0.9121, test_f1: 0.5477
 epoch: 38, train_loss: 0.8641, test_loss: 0.9090, test_f1: 0.5471
 epoch: 39, train_loss: 0.8574, test_loss: 0.9095, test_f1: 0.5469
 epoch: 40, train_loss: 0.8636, test_loss: 0.9047, test_f1: 0.5344
 epoch: 41, train_loss: 0.8591, test_loss: 0.8987, test_f1: 0.5379
 epoch: 42, train_loss: 0.8497, test_loss: 0.9020, test_f1: 0.5507
 epoch: 43, train_loss: 0.8540, test_loss: 0.9100, test_f1: 0.5374
 epoch: 44, train_loss: 0.8458, test_loss: 0.8987, test_f1: 0.5235
 epoch: 45, train_loss: 0.8452, test_loss: 0.9016, test_f1: 0.5339
 epoch: 46, train_loss: 0.8328, test_loss: 0.9199, test_f1: 0.5455
 epoch: 47, train_loss: 0.8325, test_loss: 0.9054, test_f1: 0.5398
 epoch: 48, train_loss: 0.8255, test_loss: 0.9094, test_f1: 0.5444
 epoch: 49, train_loss: 0.8194, test_loss: 0.9139, test_f1: 0.5370
 epoch: 50, train_loss: 0.8165, test_loss: 0.9147, test_f1: 0.5402
 epoch: 51, train_loss: 0.8156, test_loss: 0.9121, test_f1: 0.5304
 epoch: 52, train_loss: 0.7995, test_loss: 0.9089, test_f1: 0.5365
 epoch: 53, train_loss: 0.8074, test_loss: 0.9062, test_f1: 0.5351
 epoch: 54, train_loss: 0.7993, test_loss: 0.9071, test_f1: 0.5376
 epoch: 55, train_loss: 0.7978, test_loss: 0.9184, test_f1: 0.5358
 epoch: 56, train_loss: 0.8034, test_loss: 0.9103, test_f1: 0.5427
 epoch: 57, train_loss: 0.7919, test_loss: 0.9125, test_f1: 0.5434
 epoch: 58, train_loss: 0.8005, test_loss: 0.9140, test_f1: 0.5395
 epoch: 59, train_loss: 0.7932, test_loss: 0.9055, test_f1: 0.5375
 epoch: 60, train_loss: 0.7896, test_loss: 0.9047, test_f1: 0.5443
 epoch: 61, train_loss: 0.7869, test_loss: 0.9164, test_f1: 0.5515
 epoch: 62, train_loss: 0.7944, test_loss: 0.9170, test_f1: 0.5398
 epoch: 63, train_loss: 0.7949, test_loss: 0.9184, test_f1: 0.5384
 epoch: 64, train_loss: 0.7835, test_loss: 0.9189, test_f1: 0.5505
 epoch: 65, train_loss: 0.7964, test_loss: 0.9137, test_f1: 0.5384
 epoch: 66, train_loss: 0.7849, test_loss: 0.9195, test_f1: 0.5453
 epoch: 67, train_loss: 0.7790, test_loss: 0.9149, test_f1: 0.5418
 epoch: 68, train_loss: 0.7840, test_loss: 0.9152, test_f1: 0.5443
 epoch: 69, train_loss: 0.7771, test_loss: 0.9164, test_f1: 0.5479
 epoch: 70, train_loss: 0.7741, test_loss: 0.9182, test_f1: 0.5497
 epoch: 71, train_loss: 0.7725, test_loss: 0.9195, test_f1: 0.5461
 epoch: 72, train_loss: 0.7733, test_loss: 0.9273, test_f1: 0.5350
 epoch: 73, train_loss: 0.7722, test_loss: 0.9227, test_f1: 0.5408
 epoch: 74, train_loss: 0.7727, test_loss: 0.9216, test_f1: 0.5450
 epoch: 75, train_loss: 0.7646, test_loss: 0.9293, test_f1: 0.5403
 epoch: 76, train_loss: 0.7677, test_loss: 0.9305, test_f1: 0.5400
 epoch: 77, train_loss: 0.7694, test_loss: 0.9214, test_f1: 0.5443
 epoch: 78, train_loss: 0.7684, test_loss: 0.9367, test_f1: 0.5409
 epoch: 79, train_loss: 0.7693, test_loss: 0.9339, test_f1: 0.5491
 epoch: 80, train_loss: 0.7691, test_loss: 0.9344, test_f1: 0.5437
 epoch: 81, train_loss: 0.7632, test_loss: 0.9391, test_f1: 0.5544
 epoch: 82, train_loss: 0.7569, test_loss: 0.9311, test_f1: 0.5368
 epoch: 83, train_loss: 0.7541, test_loss: 0.9254, test_f1: 0.5428
 epoch: 84, train_loss: 0.7745, test_loss: 0.9326, test_f1: 0.5440
 epoch: 85, train_loss: 0.7516, test_loss: 0.9395, test_f1: 0.5407
 epoch: 86, train_loss: 0.7490, test_loss: 0.9398, test_f1: 0.5404
 epoch: 87, train_loss: 0.7527, test_loss: 0.9354, test_f1: 0.5454
 epoch: 88, train_loss: 0.7531, test_loss: 0.9373, test_f1: 0.5437
 epoch: 89, train_loss: 0.7495, test_loss: 0.9424, test_f1: 0.5441
 epoch: 90, train_loss: 0.7400, test_loss: 0.9393, test_f1: 0.5340
 epoch: 91, train_loss: 0.7531, test_loss: 0.9332, test_f1: 0.5407
 epoch: 92, train_loss: 0.7463, test_loss: 0.9392, test_f1: 0.5396
 epoch: 93, train_loss: 0.7421, test_loss: 0.9449, test_f1: 0.5447
 epoch: 94, train_loss: 0.7398, test_loss: 0.9539, test_f1: 0.5429
 epoch: 95, train_loss: 0.7384, test_loss: 0.9493, test_f1: 0.5390
 epoch: 96, train_loss: 0.7402, test_loss: 0.9441, test_f1: 0.5394
 epoch: 97, train_loss: 0.7361, test_loss: 0.9499, test_f1: 0.5412
 epoch: 98, train_loss: 0.7428, test_loss: 0.9523, test_f1: 0.5427
 epoch: 99, train_loss: 0.7269, test_loss: 0.9546, test_f1: 0.5459
##################ITERATION #2 ****************************************
 epoch: 0, train_loss: 1.3261, test_loss: 1.3722, test_f1: 0.2270
 epoch: 1, train_loss: 1.2861, test_loss: 1.3677, test_f1: 0.2315
 epoch: 2, train_loss: 1.2667, test_loss: 1.3421, test_f1: 0.3580
 epoch: 3, train_loss: 1.2477, test_loss: 1.2990, test_f1: 0.3518
 epoch: 4, train_loss: 1.2285, test_loss: 1.2635, test_f1: 0.3538
 epoch: 5, train_loss: 1.2140, test_loss: 1.2263, test_f1: 0.4150
 epoch: 6, train_loss: 1.1946, test_loss: 1.1929, test_f1: 0.4421
 epoch: 7, train_loss: 1.1772, test_loss: 1.1565, test_f1: 0.4442
 epoch: 8, train_loss: 1.1617, test_loss: 1.1355, test_f1: 0.4480
 epoch: 9, train_loss: 1.1475, test_loss: 1.1137, test_f1: 0.4622
 epoch: 10, train_loss: 1.1306, test_loss: 1.0965, test_f1: 0.4649
 epoch: 11, train_loss: 1.1069, test_loss: 1.0750, test_f1: 0.4658
 epoch: 12, train_loss: 1.0958, test_loss: 1.0590, test_f1: 0.4711
 epoch: 13, train_loss: 1.0839, test_loss: 1.0424, test_f1: 0.4716
 epoch: 14, train_loss: 1.0698, test_loss: 1.0267, test_f1: 0.4771
 epoch: 15, train_loss: 1.0511, test_loss: 1.0133, test_f1: 0.4842
 epoch: 16, train_loss: 1.0437, test_loss: 1.0027, test_f1: 0.4702
 epoch: 17, train_loss: 1.0217, test_loss: 0.9910, test_f1: 0.4832
 epoch: 18, train_loss: 1.0193, test_loss: 0.9796, test_f1: 0.4894
 epoch: 19, train_loss: 1.0068, test_loss: 0.9522, test_f1: 0.4926
 epoch: 20, train_loss: 0.9908, test_loss: 0.9686, test_f1: 0.4899
 epoch: 21, train_loss: 0.9909, test_loss: 0.9492, test_f1: 0.4861
 epoch: 22, train_loss: 0.9768, test_loss: 0.9346, test_f1: 0.4979
 epoch: 23, train_loss: 0.9687, test_loss: 0.9280, test_f1: 0.4966
 epoch: 24, train_loss: 0.9560, test_loss: 0.9429, test_f1: 0.4881
 epoch: 25, train_loss: 0.9531, test_loss: 0.9224, test_f1: 0.4957
 epoch: 26, train_loss: 0.9359, test_loss: 0.9174, test_f1: 0.5095
 epoch: 27, train_loss: 0.9335, test_loss: 0.9155, test_f1: 0.5142
 epoch: 28, train_loss: 0.9243, test_loss: 0.9300, test_f1: 0.4950
 epoch: 29, train_loss: 0.9232, test_loss: 0.9076, test_f1: 0.5093
 epoch: 30, train_loss: 0.9152, test_loss: 0.9371, test_f1: 0.4986
 epoch: 31, train_loss: 0.9111, test_loss: 0.9088, test_f1: 0.5157
 epoch: 32, train_loss: 0.9030, test_loss: 0.9090, test_f1: 0.5145
 epoch: 33, train_loss: 0.8811, test_loss: 0.9213, test_f1: 0.5138
 epoch: 34, train_loss: 0.8829, test_loss: 0.9138, test_f1: 0.5295
 epoch: 35, train_loss: 0.8741, test_loss: 0.9041, test_f1: 0.5097
 epoch: 36, train_loss: 0.8733, test_loss: 0.8991, test_f1: 0.5492
 epoch: 37, train_loss: 0.8626, test_loss: 0.9075, test_f1: 0.5325
 epoch: 38, train_loss: 0.8671, test_loss: 0.9070, test_f1: 0.5291
 epoch: 39, train_loss: 0.8629, test_loss: 0.9202, test_f1: 0.5194
 epoch: 40, train_loss: 0.8569, test_loss: 0.9050, test_f1: 0.5382
 epoch: 41, train_loss: 0.8480, test_loss: 0.8999, test_f1: 0.5211
 epoch: 42, train_loss: 0.8449, test_loss: 0.9130, test_f1: 0.5268
 epoch: 43, train_loss: 0.8339, test_loss: 0.9005, test_f1: 0.5317
 epoch: 44, train_loss: 0.8314, test_loss: 0.9071, test_f1: 0.5429
 epoch: 45, train_loss: 0.8315, test_loss: 0.9202, test_f1: 0.5400
 epoch: 46, train_loss: 0.8243, test_loss: 0.9162, test_f1: 0.5262
 epoch: 47, train_loss: 0.8229, test_loss: 0.8980, test_f1: 0.5438
 epoch: 48, train_loss: 0.8122, test_loss: 0.9071, test_f1: 0.5255
 epoch: 49, train_loss: 0.8042, test_loss: 0.9246, test_f1: 0.5462
 epoch: 50, train_loss: 0.8202, test_loss: 0.9079, test_f1: 0.5273
 epoch: 51, train_loss: 0.8040, test_loss: 0.9085, test_f1: 0.5310
 epoch: 52, train_loss: 0.7998, test_loss: 0.9124, test_f1: 0.5563
 epoch: 53, train_loss: 0.8003, test_loss: 0.9163, test_f1: 0.5330
 epoch: 54, train_loss: 0.7912, test_loss: 0.9091, test_f1: 0.5471
 epoch: 55, train_loss: 0.7996, test_loss: 0.9226, test_f1: 0.5346
 epoch: 56, train_loss: 0.7873, test_loss: 0.9110, test_f1: 0.5468
 epoch: 57, train_loss: 0.7905, test_loss: 0.9120, test_f1: 0.5513
 epoch: 58, train_loss: 0.7803, test_loss: 0.9083, test_f1: 0.5515
 epoch: 59, train_loss: 0.7884, test_loss: 0.9064, test_f1: 0.5462
 epoch: 60, train_loss: 0.7853, test_loss: 0.9162, test_f1: 0.5345
 epoch: 61, train_loss: 0.7773, test_loss: 0.9135, test_f1: 0.5507
 epoch: 62, train_loss: 0.7822, test_loss: 0.9107, test_f1: 0.5238
 epoch: 63, train_loss: 0.7807, test_loss: 0.9055, test_f1: 0.5451
 epoch: 64, train_loss: 0.7813, test_loss: 0.9109, test_f1: 0.5454
 epoch: 65, train_loss: 0.7688, test_loss: 0.9112, test_f1: 0.5516
 epoch: 66, train_loss: 0.7648, test_loss: 0.9137, test_f1: 0.5455
 epoch: 67, train_loss: 0.7756, test_loss: 0.9141, test_f1: 0.5668
 epoch: 68, train_loss: 0.7809, test_loss: 0.9087, test_f1: 0.5570
 epoch: 69, train_loss: 0.7714, test_loss: 0.9111, test_f1: 0.5437
 epoch: 70, train_loss: 0.7575, test_loss: 0.9078, test_f1: 0.5403
 epoch: 71, train_loss: 0.7617, test_loss: 0.9142, test_f1: 0.5300
 epoch: 72, train_loss: 0.7609, test_loss: 0.9100, test_f1: 0.5495
 epoch: 73, train_loss: 0.7610, test_loss: 0.9225, test_f1: 0.5361
 epoch: 74, train_loss: 0.7623, test_loss: 0.9156, test_f1: 0.5536
 epoch: 75, train_loss: 0.7538, test_loss: 0.9158, test_f1: 0.5383
 epoch: 76, train_loss: 0.7536, test_loss: 0.9191, test_f1: 0.5310
 epoch: 77, train_loss: 0.7610, test_loss: 0.9154, test_f1: 0.5402
 epoch: 78, train_loss: 0.7547, test_loss: 0.9231, test_f1: 0.5414
 epoch: 79, train_loss: 0.7515, test_loss: 0.9107, test_f1: 0.5254
 epoch: 80, train_loss: 0.7464, test_loss: 0.9026, test_f1: 0.5358
 epoch: 81, train_loss: 0.7457, test_loss: 0.9171, test_f1: 0.5245
 epoch: 82, train_loss: 0.7457, test_loss: 0.9112, test_f1: 0.5444
 epoch: 83, train_loss: 0.7472, test_loss: 0.9211, test_f1: 0.5387
 epoch: 84, train_loss: 0.7403, test_loss: 0.9282, test_f1: 0.5355
 epoch: 85, train_loss: 0.7487, test_loss: 0.9189, test_f1: 0.5463
 epoch: 86, train_loss: 0.7367, test_loss: 0.9230, test_f1: 0.5542
 epoch: 87, train_loss: 0.7384, test_loss: 0.9195, test_f1: 0.5563
 epoch: 88, train_loss: 0.7413, test_loss: 0.9223, test_f1: 0.5451
 epoch: 89, train_loss: 0.7382, test_loss: 0.9242, test_f1: 0.5482
 epoch: 90, train_loss: 0.7382, test_loss: 0.9251, test_f1: 0.5317
 epoch: 91, train_loss: 0.7333, test_loss: 0.9126, test_f1: 0.5460
 epoch: 92, train_loss: 0.7403, test_loss: 0.9296, test_f1: 0.5579
 epoch: 93, train_loss: 0.7337, test_loss: 0.9168, test_f1: 0.5509
 epoch: 94, train_loss: 0.7313, test_loss: 0.9172, test_f1: 0.5528
 epoch: 95, train_loss: 0.7382, test_loss: 0.9176, test_f1: 0.5461
 epoch: 96, train_loss: 0.7306, test_loss: 0.9141, test_f1: 0.5509
 epoch: 97, train_loss: 0.7227, test_loss: 0.9141, test_f1: 0.5445
 epoch: 98, train_loss: 0.7223, test_loss: 0.9235, test_f1: 0.5393
 epoch: 99, train_loss: 0.7244, test_loss: 0.9212, test_f1: 0.5616
##################ITERATION #3 ****************************************
 epoch: 0, train_loss: 1.2930, test_loss: 1.3520, test_f1: 0.2270
 epoch: 1, train_loss: 1.2489, test_loss: 1.3317, test_f1: 0.2270
 epoch: 2, train_loss: 1.2280, test_loss: 1.2861, test_f1: 0.2368
 epoch: 3, train_loss: 1.1997, test_loss: 1.2406, test_f1: 0.3748
 epoch: 4, train_loss: 1.1802, test_loss: 1.1906, test_f1: 0.4010
 epoch: 5, train_loss: 1.1622, test_loss: 1.1503, test_f1: 0.4236
 epoch: 6, train_loss: 1.1420, test_loss: 1.1090, test_f1: 0.4416
 epoch: 7, train_loss: 1.1224, test_loss: 1.0845, test_f1: 0.4609
 epoch: 8, train_loss: 1.1064, test_loss: 1.0621, test_f1: 0.4665
 epoch: 9, train_loss: 1.0895, test_loss: 1.0429, test_f1: 0.4652
 epoch: 10, train_loss: 1.0708, test_loss: 1.0294, test_f1: 0.4594
 epoch: 11, train_loss: 1.0563, test_loss: 1.0163, test_f1: 0.4748
 epoch: 12, train_loss: 1.0412, test_loss: 1.0046, test_f1: 0.4723
 epoch: 13, train_loss: 1.0283, test_loss: 0.9865, test_f1: 0.4889
 epoch: 14, train_loss: 1.0133, test_loss: 0.9832, test_f1: 0.4691
 epoch: 15, train_loss: 1.0112, test_loss: 0.9733, test_f1: 0.4748
 epoch: 16, train_loss: 0.9953, test_loss: 0.9761, test_f1: 0.4789
 epoch: 17, train_loss: 0.9841, test_loss: 0.9583, test_f1: 0.4976
 epoch: 18, train_loss: 0.9696, test_loss: 0.9523, test_f1: 0.5014
 epoch: 19, train_loss: 0.9578, test_loss: 0.9508, test_f1: 0.4817
 epoch: 20, train_loss: 0.9616, test_loss: 0.9364, test_f1: 0.5131
 epoch: 21, train_loss: 0.9421, test_loss: 0.9335, test_f1: 0.5023
 epoch: 22, train_loss: 0.9392, test_loss: 0.9324, test_f1: 0.4966
 epoch: 23, train_loss: 0.9260, test_loss: 0.9184, test_f1: 0.5048
 epoch: 24, train_loss: 0.9130, test_loss: 0.9358, test_f1: 0.5100
 epoch: 25, train_loss: 0.9200, test_loss: 0.9183, test_f1: 0.5003
 epoch: 26, train_loss: 0.9048, test_loss: 0.9235, test_f1: 0.5161
 epoch: 27, train_loss: 0.9015, test_loss: 0.9368, test_f1: 0.5109
 epoch: 28, train_loss: 0.8882, test_loss: 0.9122, test_f1: 0.5191
 epoch: 29, train_loss: 0.8857, test_loss: 0.9262, test_f1: 0.5244
 epoch: 30, train_loss: 0.8808, test_loss: 0.9138, test_f1: 0.5199
 epoch: 31, train_loss: 0.8753, test_loss: 0.9139, test_f1: 0.5258
 epoch: 32, train_loss: 0.8675, test_loss: 0.9225, test_f1: 0.5302
 epoch: 33, train_loss: 0.8637, test_loss: 0.8963, test_f1: 0.5406
 epoch: 34, train_loss: 0.8560, test_loss: 0.9268, test_f1: 0.5167
 epoch: 35, train_loss: 0.8530, test_loss: 0.9007, test_f1: 0.5420
 epoch: 36, train_loss: 0.8503, test_loss: 0.9312, test_f1: 0.5332
 epoch: 37, train_loss: 0.8480, test_loss: 0.9418, test_f1: 0.5280
 epoch: 38, train_loss: 0.8356, test_loss: 0.9134, test_f1: 0.5292
 epoch: 39, train_loss: 0.8308, test_loss: 0.9156, test_f1: 0.5233
 epoch: 40, train_loss: 0.8253, test_loss: 0.9000, test_f1: 0.5247
 epoch: 41, train_loss: 0.8211, test_loss: 0.9284, test_f1: 0.5322
 epoch: 42, train_loss: 0.8198, test_loss: 0.9229, test_f1: 0.5302
 epoch: 43, train_loss: 0.8074, test_loss: 0.9067, test_f1: 0.5395
 epoch: 44, train_loss: 0.8066, test_loss: 0.9383, test_f1: 0.5355
 epoch: 45, train_loss: 0.8032, test_loss: 0.9272, test_f1: 0.5357
 epoch: 46, train_loss: 0.8042, test_loss: 0.9214, test_f1: 0.5309
 epoch: 47, train_loss: 0.8010, test_loss: 0.8929, test_f1: 0.5400
 epoch: 48, train_loss: 0.8016, test_loss: 0.9346, test_f1: 0.5342
 epoch: 49, train_loss: 0.7937, test_loss: 0.9324, test_f1: 0.5420
 epoch: 50, train_loss: 0.7901, test_loss: 0.9369, test_f1: 0.5445
 epoch: 51, train_loss: 0.7804, test_loss: 0.9099, test_f1: 0.5494
 epoch: 52, train_loss: 0.7837, test_loss: 0.9329, test_f1: 0.5545
 epoch: 53, train_loss: 0.7785, test_loss: 0.9131, test_f1: 0.5514
 epoch: 54, train_loss: 0.7794, test_loss: 0.9115, test_f1: 0.5446
 epoch: 55, train_loss: 0.7689, test_loss: 0.9232, test_f1: 0.5474
 epoch: 56, train_loss: 0.7639, test_loss: 0.9131, test_f1: 0.5595
 epoch: 57, train_loss: 0.7627, test_loss: 0.9142, test_f1: 0.5609
 epoch: 58, train_loss: 0.7599, test_loss: 0.9022, test_f1: 0.5583
 epoch: 59, train_loss: 0.7489, test_loss: 0.9267, test_f1: 0.5615
 epoch: 60, train_loss: 0.7554, test_loss: 0.9134, test_f1: 0.5611
 epoch: 61, train_loss: 0.7588, test_loss: 0.9100, test_f1: 0.5612
 epoch: 62, train_loss: 0.7555, test_loss: 0.9155, test_f1: 0.5626
 epoch: 63, train_loss: 0.7634, test_loss: 0.9400, test_f1: 0.5629
 epoch: 64, train_loss: 0.7505, test_loss: 0.9268, test_f1: 0.5594
 epoch: 65, train_loss: 0.7446, test_loss: 0.9170, test_f1: 0.5662
 epoch: 66, train_loss: 0.7539, test_loss: 0.9305, test_f1: 0.5717
 epoch: 67, train_loss: 0.7523, test_loss: 0.9370, test_f1: 0.5637
 epoch: 68, train_loss: 0.7528, test_loss: 0.9356, test_f1: 0.5598
 epoch: 69, train_loss: 0.7424, test_loss: 0.9265, test_f1: 0.5678
 epoch: 70, train_loss: 0.7439, test_loss: 0.9281, test_f1: 0.5585
 epoch: 71, train_loss: 0.7402, test_loss: 0.9338, test_f1: 0.5482
 epoch: 72, train_loss: 0.7458, test_loss: 0.9458, test_f1: 0.5463
 epoch: 73, train_loss: 0.7332, test_loss: 0.9280, test_f1: 0.5589
 epoch: 74, train_loss: 0.7406, test_loss: 0.9346, test_f1: 0.5567
 epoch: 75, train_loss: 0.7316, test_loss: 0.9097, test_f1: 0.5665
 epoch: 76, train_loss: 0.7293, test_loss: 0.9447, test_f1: 0.5575
 epoch: 77, train_loss: 0.7239, test_loss: 0.9365, test_f1: 0.5656
 epoch: 78, train_loss: 0.7245, test_loss: 0.9339, test_f1: 0.5579
 epoch: 79, train_loss: 0.7266, test_loss: 0.9423, test_f1: 0.5491
 epoch: 80, train_loss: 0.7196, test_loss: 0.9500, test_f1: 0.5611
 epoch: 81, train_loss: 0.7338, test_loss: 0.9301, test_f1: 0.5613
 epoch: 82, train_loss: 0.7222, test_loss: 0.9340, test_f1: 0.5658
 epoch: 83, train_loss: 0.7252, test_loss: 0.9677, test_f1: 0.5512
 epoch: 84, train_loss: 0.7244, test_loss: 0.9352, test_f1: 0.5593
 epoch: 85, train_loss: 0.7201, test_loss: 0.9567, test_f1: 0.5629
 epoch: 86, train_loss: 0.7119, test_loss: 0.9677, test_f1: 0.5515
 epoch: 87, train_loss: 0.7145, test_loss: 0.9268, test_f1: 0.5556
 epoch: 88, train_loss: 0.7088, test_loss: 0.9402, test_f1: 0.5588
 epoch: 89, train_loss: 0.7137, test_loss: 0.9352, test_f1: 0.5577
 epoch: 90, train_loss: 0.7126, test_loss: 0.9691, test_f1: 0.5528
 epoch: 91, train_loss: 0.7050, test_loss: 0.9398, test_f1: 0.5572
 epoch: 92, train_loss: 0.7026, test_loss: 0.9699, test_f1: 0.5434
 epoch: 93, train_loss: 0.7089, test_loss: 0.9347, test_f1: 0.5746
 epoch: 94, train_loss: 0.6998, test_loss: 0.9440, test_f1: 0.5641
 epoch: 95, train_loss: 0.7052, test_loss: 0.9375, test_f1: 0.5620
 epoch: 96, train_loss: 0.7077, test_loss: 0.9742, test_f1: 0.5567
 epoch: 97, train_loss: 0.7140, test_loss: 0.9367, test_f1: 0.5661
 epoch: 98, train_loss: 0.6966, test_loss: 0.9381, test_f1: 0.5676
 epoch: 99, train_loss: 0.6975, test_loss: 0.9503, test_f1: 0.5648
##################ITERATION #4 ****************************************
 epoch: 0, train_loss: 1.2834, test_loss: 1.3497, test_f1: 0.2270
 epoch: 1, train_loss: 1.2294, test_loss: 1.3254, test_f1: 0.2270
 epoch: 2, train_loss: 1.2046, test_loss: 1.2857, test_f1: 0.2270
 epoch: 3, train_loss: 1.1801, test_loss: 1.2381, test_f1: 0.2436
 epoch: 4, train_loss: 1.1608, test_loss: 1.1984, test_f1: 0.3517
 epoch: 5, train_loss: 1.1434, test_loss: 1.1332, test_f1: 0.4545
 epoch: 6, train_loss: 1.1209, test_loss: 1.0917, test_f1: 0.4844
 epoch: 7, train_loss: 1.1072, test_loss: 1.0602, test_f1: 0.4941
 epoch: 8, train_loss: 1.0955, test_loss: 1.0447, test_f1: 0.4719
 epoch: 9, train_loss: 1.0784, test_loss: 1.0281, test_f1: 0.4844
 epoch: 10, train_loss: 1.0642, test_loss: 1.0197, test_f1: 0.4943
 epoch: 11, train_loss: 1.0565, test_loss: 1.0067, test_f1: 0.4896
 epoch: 12, train_loss: 1.0415, test_loss: 0.9946, test_f1: 0.5033
 epoch: 13, train_loss: 1.0374, test_loss: 0.9846, test_f1: 0.4860
 epoch: 14, train_loss: 1.0191, test_loss: 0.9748, test_f1: 0.5077
 epoch: 15, train_loss: 1.0118, test_loss: 0.9659, test_f1: 0.4940
 epoch: 16, train_loss: 1.0001, test_loss: 0.9605, test_f1: 0.4975
 epoch: 17, train_loss: 0.9969, test_loss: 0.9560, test_f1: 0.4999
 epoch: 18, train_loss: 0.9849, test_loss: 0.9397, test_f1: 0.5027
 epoch: 19, train_loss: 0.9825, test_loss: 0.9394, test_f1: 0.5020
 epoch: 20, train_loss: 0.9652, test_loss: 0.9325, test_f1: 0.5069
 epoch: 21, train_loss: 0.9491, test_loss: 0.9369, test_f1: 0.5083
 epoch: 22, train_loss: 0.9560, test_loss: 0.9365, test_f1: 0.5106
 epoch: 23, train_loss: 0.9457, test_loss: 0.9294, test_f1: 0.5153
 epoch: 24, train_loss: 0.9356, test_loss: 0.9178, test_f1: 0.5176
 epoch: 25, train_loss: 0.9308, test_loss: 0.9077, test_f1: 0.5274
 epoch: 26, train_loss: 0.9259, test_loss: 0.9130, test_f1: 0.5222
 epoch: 27, train_loss: 0.9259, test_loss: 0.9171, test_f1: 0.5209
 epoch: 28, train_loss: 0.9238, test_loss: 0.9074, test_f1: 0.5315
 epoch: 29, train_loss: 0.9104, test_loss: 0.9117, test_f1: 0.5276
 epoch: 30, train_loss: 0.9069, test_loss: 0.8969, test_f1: 0.5279
 epoch: 31, train_loss: 0.9016, test_loss: 0.9063, test_f1: 0.5312
 epoch: 32, train_loss: 0.8959, test_loss: 0.8928, test_f1: 0.5363
 epoch: 33, train_loss: 0.8880, test_loss: 0.8963, test_f1: 0.5222
 epoch: 34, train_loss: 0.8962, test_loss: 0.9022, test_f1: 0.5428
 epoch: 35, train_loss: 0.8824, test_loss: 0.8957, test_f1: 0.5512
 epoch: 36, train_loss: 0.8900, test_loss: 0.8922, test_f1: 0.5345
 epoch: 37, train_loss: 0.8738, test_loss: 0.9039, test_f1: 0.5275
 epoch: 38, train_loss: 0.8788, test_loss: 0.8960, test_f1: 0.5350
 epoch: 39, train_loss: 0.8700, test_loss: 0.8952, test_f1: 0.5326
 epoch: 40, train_loss: 0.8574, test_loss: 0.8897, test_f1: 0.5529
 epoch: 41, train_loss: 0.8593, test_loss: 0.8966, test_f1: 0.5422
 epoch: 42, train_loss: 0.8476, test_loss: 0.8822, test_f1: 0.5611
 epoch: 43, train_loss: 0.8420, test_loss: 0.9082, test_f1: 0.5337
 epoch: 44, train_loss: 0.8484, test_loss: 0.8742, test_f1: 0.5514
 epoch: 45, train_loss: 0.8403, test_loss: 0.8809, test_f1: 0.5497
 epoch: 46, train_loss: 0.8351, test_loss: 0.8805, test_f1: 0.5603
 epoch: 47, train_loss: 0.8461, test_loss: 0.9005, test_f1: 0.5464
 epoch: 48, train_loss: 0.8391, test_loss: 0.8820, test_f1: 0.5624
 epoch: 49, train_loss: 0.8269, test_loss: 0.8738, test_f1: 0.5573
 epoch: 50, train_loss: 0.8254, test_loss: 0.8890, test_f1: 0.5538
 epoch: 51, train_loss: 0.8160, test_loss: 0.8800, test_f1: 0.5507
 epoch: 52, train_loss: 0.8179, test_loss: 0.8830, test_f1: 0.5527
 epoch: 53, train_loss: 0.8140, test_loss: 0.8742, test_f1: 0.5507
 epoch: 54, train_loss: 0.8097, test_loss: 0.8727, test_f1: 0.5564
 epoch: 55, train_loss: 0.8050, test_loss: 0.8717, test_f1: 0.5658
 epoch: 56, train_loss: 0.8161, test_loss: 0.8663, test_f1: 0.5493
 epoch: 57, train_loss: 0.8119, test_loss: 0.8694, test_f1: 0.5598
 epoch: 58, train_loss: 0.8127, test_loss: 0.8799, test_f1: 0.5668
 epoch: 59, train_loss: 0.8066, test_loss: 0.8784, test_f1: 0.5610
 epoch: 60, train_loss: 0.7979, test_loss: 0.8760, test_f1: 0.5662
 epoch: 61, train_loss: 0.8082, test_loss: 0.8826, test_f1: 0.5607
 epoch: 62, train_loss: 0.8123, test_loss: 0.8731, test_f1: 0.5550
 epoch: 63, train_loss: 0.8087, test_loss: 0.8813, test_f1: 0.5525
 epoch: 64, train_loss: 0.7935, test_loss: 0.8836, test_f1: 0.5539
 epoch: 65, train_loss: 0.7964, test_loss: 0.8833, test_f1: 0.5573
 epoch: 66, train_loss: 0.7843, test_loss: 0.8708, test_f1: 0.5554
 epoch: 67, train_loss: 0.7805, test_loss: 0.8776, test_f1: 0.5490
 epoch: 68, train_loss: 0.7888, test_loss: 0.8685, test_f1: 0.5670
 epoch: 69, train_loss: 0.7988, test_loss: 0.8941, test_f1: 0.5704
 epoch: 70, train_loss: 0.7870, test_loss: 0.8872, test_f1: 0.5768
 epoch: 71, train_loss: 0.7751, test_loss: 0.8851, test_f1: 0.5661
 epoch: 72, train_loss: 0.7760, test_loss: 0.8846, test_f1: 0.5676
 epoch: 73, train_loss: 0.7768, test_loss: 0.8951, test_f1: 0.5712
 epoch: 74, train_loss: 0.7808, test_loss: 0.8914, test_f1: 0.5779
 epoch: 75, train_loss: 0.7762, test_loss: 0.8891, test_f1: 0.5812
 epoch: 76, train_loss: 0.7722, test_loss: 0.8724, test_f1: 0.5730
 epoch: 77, train_loss: 0.7740, test_loss: 0.9069, test_f1: 0.5580
 epoch: 78, train_loss: 0.7781, test_loss: 0.8809, test_f1: 0.5735
 epoch: 79, train_loss: 0.7726, test_loss: 0.8808, test_f1: 0.5761
 epoch: 80, train_loss: 0.7752, test_loss: 0.8802, test_f1: 0.5781
 epoch: 81, train_loss: 0.7898, test_loss: 0.8933, test_f1: 0.5744
 epoch: 82, train_loss: 0.7702, test_loss: 0.9073, test_f1: 0.5686
 epoch: 83, train_loss: 0.7719, test_loss: 0.9012, test_f1: 0.5754
 epoch: 84, train_loss: 0.7695, test_loss: 0.9094, test_f1: 0.5797
 epoch: 85, train_loss: 0.7569, test_loss: 0.8946, test_f1: 0.5598
 epoch: 86, train_loss: 0.7645, test_loss: 0.9005, test_f1: 0.5609
 epoch: 87, train_loss: 0.7653, test_loss: 0.8825, test_f1: 0.5626
 epoch: 88, train_loss: 0.7558, test_loss: 0.8939, test_f1: 0.5743
 epoch: 89, train_loss: 0.7577, test_loss: 0.9011, test_f1: 0.5713
 epoch: 90, train_loss: 0.7572, test_loss: 0.9003, test_f1: 0.5751
 epoch: 91, train_loss: 0.7661, test_loss: 0.9050, test_f1: 0.5742
 epoch: 92, train_loss: 0.7576, test_loss: 0.8946, test_f1: 0.5719
 epoch: 93, train_loss: 0.7670, test_loss: 0.9021, test_f1: 0.5821
 epoch: 94, train_loss: 0.7464, test_loss: 0.9082, test_f1: 0.5851
 epoch: 95, train_loss: 0.7472, test_loss: 0.9103, test_f1: 0.5684
 epoch: 96, train_loss: 0.7511, test_loss: 0.9134, test_f1: 0.5740
 epoch: 97, train_loss: 0.7475, test_loss: 0.9041, test_f1: 0.5734
 epoch: 98, train_loss: 0.7425, test_loss: 0.9081, test_f1: 0.5753
 epoch: 99, train_loss: 0.7418, test_loss: 0.8944, test_f1: 0.5754
##################ITERATION #5 ****************************************
 epoch: 0, train_loss: 1.2804, test_loss: 1.3417, test_f1: 0.2270
 epoch: 1, train_loss: 1.2267, test_loss: 1.3409, test_f1: 0.2270
 epoch: 2, train_loss: 1.1958, test_loss: 1.2838, test_f1: 0.2913
 epoch: 3, train_loss: 1.1749, test_loss: 1.2246, test_f1: 0.3515
 epoch: 4, train_loss: 1.1523, test_loss: 1.1709, test_f1: 0.3864
 epoch: 5, train_loss: 1.1273, test_loss: 1.1306, test_f1: 0.4090
 epoch: 6, train_loss: 1.1203, test_loss: 1.0878, test_f1: 0.4413
 epoch: 7, train_loss: 1.0956, test_loss: 1.0630, test_f1: 0.4561
 epoch: 8, train_loss: 1.0897, test_loss: 1.0476, test_f1: 0.4562
 epoch: 9, train_loss: 1.0721, test_loss: 1.0359, test_f1: 0.4652
 epoch: 10, train_loss: 1.0606, test_loss: 1.0275, test_f1: 0.4630
 epoch: 11, train_loss: 1.0466, test_loss: 1.0191, test_f1: 0.4725
 epoch: 12, train_loss: 1.0344, test_loss: 1.0069, test_f1: 0.4770
 epoch: 13, train_loss: 1.0303, test_loss: 1.0009, test_f1: 0.4773
 epoch: 14, train_loss: 1.0068, test_loss: 0.9900, test_f1: 0.4736
 epoch: 15, train_loss: 1.0062, test_loss: 0.9860, test_f1: 0.4759
 epoch: 16, train_loss: 0.9899, test_loss: 0.9782, test_f1: 0.4920
 epoch: 17, train_loss: 0.9859, test_loss: 0.9707, test_f1: 0.4915
 epoch: 18, train_loss: 0.9765, test_loss: 0.9666, test_f1: 0.5012
 epoch: 19, train_loss: 0.9681, test_loss: 0.9629, test_f1: 0.5003
 epoch: 20, train_loss: 0.9635, test_loss: 0.9696, test_f1: 0.5029
 epoch: 21, train_loss: 0.9547, test_loss: 0.9639, test_f1: 0.5117
 epoch: 22, train_loss: 0.9356, test_loss: 0.9457, test_f1: 0.5085
 epoch: 23, train_loss: 0.9431, test_loss: 0.9454, test_f1: 0.5131
 epoch: 24, train_loss: 0.9356, test_loss: 0.9488, test_f1: 0.5154
 epoch: 25, train_loss: 0.9263, test_loss: 0.9434, test_f1: 0.5110
 epoch: 26, train_loss: 0.9194, test_loss: 0.9399, test_f1: 0.4979
 epoch: 27, train_loss: 0.9135, test_loss: 0.9352, test_f1: 0.5059
 epoch: 28, train_loss: 0.9095, test_loss: 0.9330, test_f1: 0.5089
 epoch: 29, train_loss: 0.9011, test_loss: 0.9345, test_f1: 0.5030
 epoch: 30, train_loss: 0.9014, test_loss: 0.9286, test_f1: 0.5127
 epoch: 31, train_loss: 0.8981, test_loss: 0.9244, test_f1: 0.5206
 epoch: 32, train_loss: 0.8878, test_loss: 0.9356, test_f1: 0.4988
 epoch: 33, train_loss: 0.8871, test_loss: 0.9300, test_f1: 0.5107
 epoch: 34, train_loss: 0.8754, test_loss: 0.9232, test_f1: 0.5234
 epoch: 35, train_loss: 0.8777, test_loss: 0.9312, test_f1: 0.5083
 epoch: 36, train_loss: 0.8729, test_loss: 0.9262, test_f1: 0.5296
 epoch: 37, train_loss: 0.8716, test_loss: 0.9317, test_f1: 0.5268
 epoch: 38, train_loss: 0.8546, test_loss: 0.9275, test_f1: 0.5347
 epoch: 39, train_loss: 0.8548, test_loss: 0.9153, test_f1: 0.5440
 epoch: 40, train_loss: 0.8578, test_loss: 0.9282, test_f1: 0.5346
 epoch: 41, train_loss: 0.8572, test_loss: 0.9173, test_f1: 0.5467
 epoch: 42, train_loss: 0.8383, test_loss: 0.9299, test_f1: 0.5349
 epoch: 43, train_loss: 0.8458, test_loss: 0.9271, test_f1: 0.5359
 epoch: 44, train_loss: 0.8350, test_loss: 0.9303, test_f1: 0.5322
 epoch: 45, train_loss: 0.8245, test_loss: 0.9156, test_f1: 0.5509
 epoch: 46, train_loss: 0.8254, test_loss: 0.9290, test_f1: 0.5331
 epoch: 47, train_loss: 0.8234, test_loss: 0.9176, test_f1: 0.5483
 epoch: 48, train_loss: 0.8242, test_loss: 0.9295, test_f1: 0.5478
 epoch: 49, train_loss: 0.8174, test_loss: 0.9370, test_f1: 0.5411
 epoch: 50, train_loss: 0.8173, test_loss: 0.9292, test_f1: 0.5484
 epoch: 51, train_loss: 0.8136, test_loss: 0.9295, test_f1: 0.5472
 epoch: 52, train_loss: 0.8032, test_loss: 0.9366, test_f1: 0.5459
 epoch: 53, train_loss: 0.8053, test_loss: 0.9294, test_f1: 0.5386
 epoch: 54, train_loss: 0.8055, test_loss: 0.9344, test_f1: 0.5373
 epoch: 55, train_loss: 0.8041, test_loss: 0.9252, test_f1: 0.5453
 epoch: 56, train_loss: 0.7928, test_loss: 0.9291, test_f1: 0.5357
 epoch: 57, train_loss: 0.7909, test_loss: 0.9262, test_f1: 0.5505
 epoch: 58, train_loss: 0.7892, test_loss: 0.9289, test_f1: 0.5501
 epoch: 59, train_loss: 0.7829, test_loss: 0.9324, test_f1: 0.5556
 epoch: 60, train_loss: 0.7927, test_loss: 0.9362, test_f1: 0.5471
 epoch: 61, train_loss: 0.7829, test_loss: 0.9329, test_f1: 0.5449
 epoch: 62, train_loss: 0.7905, test_loss: 0.9306, test_f1: 0.5533
 epoch: 63, train_loss: 0.7815, test_loss: 0.9249, test_f1: 0.5628
 epoch: 64, train_loss: 0.7813, test_loss: 0.9311, test_f1: 0.5421
 epoch: 65, train_loss: 0.7806, test_loss: 0.9365, test_f1: 0.5455
 epoch: 66, train_loss: 0.7806, test_loss: 0.9384, test_f1: 0.5440
 epoch: 67, train_loss: 0.7757, test_loss: 0.9461, test_f1: 0.5495
 epoch: 68, train_loss: 0.7765, test_loss: 0.9342, test_f1: 0.5544
 epoch: 69, train_loss: 0.7725, test_loss: 0.9369, test_f1: 0.5518
 epoch: 70, train_loss: 0.7734, test_loss: 0.9423, test_f1: 0.5567
 epoch: 71, train_loss: 0.7697, test_loss: 0.9425, test_f1: 0.5461
 epoch: 72, train_loss: 0.7722, test_loss: 0.9355, test_f1: 0.5634
 epoch: 73, train_loss: 0.7618, test_loss: 0.9379, test_f1: 0.5581
 epoch: 74, train_loss: 0.7734, test_loss: 0.9420, test_f1: 0.5693
 epoch: 75, train_loss: 0.7540, test_loss: 0.9502, test_f1: 0.5642
 epoch: 76, train_loss: 0.7607, test_loss: 0.9399, test_f1: 0.5572
 epoch: 77, train_loss: 0.7692, test_loss: 0.9450, test_f1: 0.5532
 epoch: 78, train_loss: 0.7652, test_loss: 0.9405, test_f1: 0.5551
 epoch: 79, train_loss: 0.7624, test_loss: 0.9515, test_f1: 0.5581
 epoch: 80, train_loss: 0.7538, test_loss: 0.9492, test_f1: 0.5631
 epoch: 81, train_loss: 0.7592, test_loss: 0.9535, test_f1: 0.5602
 epoch: 82, train_loss: 0.7521, test_loss: 0.9406, test_f1: 0.5621
 epoch: 83, train_loss: 0.7509, test_loss: 0.9459, test_f1: 0.5597
 epoch: 84, train_loss: 0.7543, test_loss: 0.9494, test_f1: 0.5640
 epoch: 85, train_loss: 0.7487, test_loss: 0.9460, test_f1: 0.5627
 epoch: 86, train_loss: 0.7432, test_loss: 0.9525, test_f1: 0.5564
 epoch: 87, train_loss: 0.7452, test_loss: 0.9377, test_f1: 0.5580
 epoch: 88, train_loss: 0.7510, test_loss: 0.9441, test_f1: 0.5491
 epoch: 89, train_loss: 0.7379, test_loss: 0.9513, test_f1: 0.5522
 epoch: 90, train_loss: 0.7336, test_loss: 0.9498, test_f1: 0.5613
 epoch: 91, train_loss: 0.7464, test_loss: 0.9429, test_f1: 0.5751
 epoch: 92, train_loss: 0.7466, test_loss: 0.9461, test_f1: 0.5629
 epoch: 93, train_loss: 0.7436, test_loss: 0.9420, test_f1: 0.5627
 epoch: 94, train_loss: 0.7345, test_loss: 0.9497, test_f1: 0.5642
 epoch: 95, train_loss: 0.7331, test_loss: 0.9564, test_f1: 0.5513
 epoch: 96, train_loss: 0.7364, test_loss: 0.9516, test_f1: 0.5555
 epoch: 97, train_loss: 0.7390, test_loss: 0.9571, test_f1: 0.5689
 epoch: 98, train_loss: 0.7391, test_loss: 0.9491, test_f1: 0.5634
 epoch: 99, train_loss: 0.7389, test_loss: 0.9565, test_f1: 0.5614
##################ITERATION #6 ****************************************
 epoch: 0, train_loss: 1.2851, test_loss: 1.3182, test_f1: 0.2270
 epoch: 1, train_loss: 1.2103, test_loss: 1.3500, test_f1: 0.3134
 epoch: 2, train_loss: 1.1852, test_loss: 1.3059, test_f1: 0.2964
 epoch: 3, train_loss: 1.1520, test_loss: 1.2925, test_f1: 0.2934
 epoch: 4, train_loss: 1.1359, test_loss: 1.1888, test_f1: 0.4097
 epoch: 5, train_loss: 1.1119, test_loss: 1.1154, test_f1: 0.4276
 epoch: 6, train_loss: 1.1013, test_loss: 1.0755, test_f1: 0.4469
 epoch: 7, train_loss: 1.0722, test_loss: 1.0279, test_f1: 0.4753
 epoch: 8, train_loss: 1.0646, test_loss: 1.0001, test_f1: 0.4810
 epoch: 9, train_loss: 1.0456, test_loss: 0.9818, test_f1: 0.4805
 epoch: 10, train_loss: 1.0317, test_loss: 0.9735, test_f1: 0.4864
 epoch: 11, train_loss: 1.0185, test_loss: 0.9682, test_f1: 0.4810
 epoch: 12, train_loss: 1.0048, test_loss: 0.9586, test_f1: 0.4824
 epoch: 13, train_loss: 0.9883, test_loss: 0.9561, test_f1: 0.4898
 epoch: 14, train_loss: 0.9814, test_loss: 0.9441, test_f1: 0.4913
 epoch: 15, train_loss: 0.9676, test_loss: 0.9418, test_f1: 0.4955
 epoch: 16, train_loss: 0.9607, test_loss: 0.9368, test_f1: 0.4901
 epoch: 17, train_loss: 0.9560, test_loss: 0.9309, test_f1: 0.5077
 epoch: 18, train_loss: 0.9449, test_loss: 0.9327, test_f1: 0.4998
 epoch: 19, train_loss: 0.9398, test_loss: 0.9134, test_f1: 0.5044
 epoch: 20, train_loss: 0.9341, test_loss: 0.9104, test_f1: 0.5268
 epoch: 21, train_loss: 0.9272, test_loss: 0.9072, test_f1: 0.5237
 epoch: 22, train_loss: 0.9112, test_loss: 0.9209, test_f1: 0.5063
 epoch: 23, train_loss: 0.9120, test_loss: 0.9082, test_f1: 0.5193
 epoch: 24, train_loss: 0.8948, test_loss: 0.9133, test_f1: 0.5208
 epoch: 25, train_loss: 0.8923, test_loss: 0.8983, test_f1: 0.5331
 epoch: 26, train_loss: 0.8873, test_loss: 0.8960, test_f1: 0.5309
 epoch: 27, train_loss: 0.8832, test_loss: 0.9215, test_f1: 0.5326
 epoch: 28, train_loss: 0.8816, test_loss: 0.9000, test_f1: 0.5496
 epoch: 29, train_loss: 0.8748, test_loss: 0.9039, test_f1: 0.5421
 epoch: 30, train_loss: 0.8600, test_loss: 0.8954, test_f1: 0.5352
 epoch: 31, train_loss: 0.8632, test_loss: 0.9002, test_f1: 0.5466
 epoch: 32, train_loss: 0.8554, test_loss: 0.8995, test_f1: 0.5418
 epoch: 33, train_loss: 0.8509, test_loss: 0.9045, test_f1: 0.5430
 epoch: 34, train_loss: 0.8452, test_loss: 0.9102, test_f1: 0.5473
 epoch: 35, train_loss: 0.8402, test_loss: 0.8828, test_f1: 0.5482
 epoch: 36, train_loss: 0.8384, test_loss: 0.9199, test_f1: 0.5488
 epoch: 37, train_loss: 0.8223, test_loss: 0.9081, test_f1: 0.5569
 epoch: 38, train_loss: 0.8201, test_loss: 0.9085, test_f1: 0.5625
 epoch: 39, train_loss: 0.8223, test_loss: 0.9140, test_f1: 0.5486
 epoch: 40, train_loss: 0.8146, test_loss: 0.9051, test_f1: 0.5603
 epoch: 41, train_loss: 0.8101, test_loss: 0.9244, test_f1: 0.5612
 epoch: 42, train_loss: 0.8121, test_loss: 0.9467, test_f1: 0.5645
 epoch: 43, train_loss: 0.8130, test_loss: 0.9115, test_f1: 0.5658
 epoch: 44, train_loss: 0.8020, test_loss: 0.9383, test_f1: 0.5634
 epoch: 45, train_loss: 0.7982, test_loss: 0.9240, test_f1: 0.5564
 epoch: 46, train_loss: 0.8006, test_loss: 0.9376, test_f1: 0.5553
 epoch: 47, train_loss: 0.7899, test_loss: 0.9141, test_f1: 0.5587
 epoch: 48, train_loss: 0.7899, test_loss: 0.9154, test_f1: 0.5692
 epoch: 49, train_loss: 0.7919, test_loss: 0.9154, test_f1: 0.5756
 epoch: 50, train_loss: 0.7828, test_loss: 0.9308, test_f1: 0.5624
 epoch: 51, train_loss: 0.7780, test_loss: 0.9200, test_f1: 0.5639
 epoch: 52, train_loss: 0.7763, test_loss: 0.9270, test_f1: 0.5653
 epoch: 53, train_loss: 0.7664, test_loss: 0.9224, test_f1: 0.5742
 epoch: 54, train_loss: 0.7706, test_loss: 0.9086, test_f1: 0.5703
 epoch: 55, train_loss: 0.7691, test_loss: 0.9347, test_f1: 0.5610
 epoch: 56, train_loss: 0.7626, test_loss: 0.9261, test_f1: 0.5660
 epoch: 57, train_loss: 0.7595, test_loss: 0.9188, test_f1: 0.5643
 epoch: 58, train_loss: 0.7548, test_loss: 0.9427, test_f1: 0.5643
 epoch: 59, train_loss: 0.7629, test_loss: 0.9452, test_f1: 0.5623
 epoch: 60, train_loss: 0.7554, test_loss: 0.9297, test_f1: 0.5766
 epoch: 61, train_loss: 0.7626, test_loss: 0.9156, test_f1: 0.5691
 epoch: 62, train_loss: 0.7579, test_loss: 0.9342, test_f1: 0.5597
 epoch: 63, train_loss: 0.7508, test_loss: 0.9285, test_f1: 0.5752
 epoch: 64, train_loss: 0.7475, test_loss: 0.9307, test_f1: 0.5835
 epoch: 65, train_loss: 0.7488, test_loss: 0.9304, test_f1: 0.5734
 epoch: 66, train_loss: 0.7461, test_loss: 0.9325, test_f1: 0.5649
 epoch: 67, train_loss: 0.7496, test_loss: 0.9328, test_f1: 0.5753
 epoch: 68, train_loss: 0.7462, test_loss: 0.9306, test_f1: 0.5743
 epoch: 69, train_loss: 0.7404, test_loss: 0.9270, test_f1: 0.5795
 epoch: 70, train_loss: 0.7390, test_loss: 0.9389, test_f1: 0.5725
 epoch: 71, train_loss: 0.7422, test_loss: 0.9406, test_f1: 0.5816
 epoch: 72, train_loss: 0.7410, test_loss: 0.9385, test_f1: 0.5704
 epoch: 73, train_loss: 0.7463, test_loss: 0.9326, test_f1: 0.5786
 epoch: 74, train_loss: 0.7335, test_loss: 0.9429, test_f1: 0.5731
 epoch: 75, train_loss: 0.7316, test_loss: 0.9477, test_f1: 0.5737
 epoch: 76, train_loss: 0.7340, test_loss: 0.9525, test_f1: 0.5788
 epoch: 77, train_loss: 0.7491, test_loss: 0.9504, test_f1: 0.5808
 epoch: 78, train_loss: 0.7433, test_loss: 0.9407, test_f1: 0.5781
 epoch: 79, train_loss: 0.7382, test_loss: 0.9518, test_f1: 0.5751
 epoch: 80, train_loss: 0.7327, test_loss: 0.9526, test_f1: 0.5753
 epoch: 81, train_loss: 0.7292, test_loss: 0.9422, test_f1: 0.5890
 epoch: 82, train_loss: 0.7219, test_loss: 0.9484, test_f1: 0.5767
 epoch: 83, train_loss: 0.7340, test_loss: 0.9405, test_f1: 0.5792
 epoch: 84, train_loss: 0.7233, test_loss: 0.9414, test_f1: 0.5807
 epoch: 85, train_loss: 0.7295, test_loss: 0.9604, test_f1: 0.5703
 epoch: 86, train_loss: 0.7194, test_loss: 0.9576, test_f1: 0.5812
 epoch: 87, train_loss: 0.7193, test_loss: 0.9727, test_f1: 0.5696
 epoch: 88, train_loss: 0.7233, test_loss: 0.9692, test_f1: 0.5780
 epoch: 89, train_loss: 0.7269, test_loss: 0.9586, test_f1: 0.5732
 epoch: 90, train_loss: 0.7129, test_loss: 0.9546, test_f1: 0.5930
 epoch: 91, train_loss: 0.7138, test_loss: 0.9596, test_f1: 0.5921
 epoch: 92, train_loss: 0.7086, test_loss: 0.9673, test_f1: 0.5757
 epoch: 93, train_loss: 0.7001, test_loss: 0.9555, test_f1: 0.5799
 epoch: 94, train_loss: 0.7065, test_loss: 0.9717, test_f1: 0.5732
 epoch: 95, train_loss: 0.7266, test_loss: 0.9755, test_f1: 0.5857
 epoch: 96, train_loss: 0.7044, test_loss: 0.9491, test_f1: 0.5883
 epoch: 97, train_loss: 0.7200, test_loss: 0.9632, test_f1: 0.5763
 epoch: 98, train_loss: 0.7028, test_loss: 0.9439, test_f1: 0.5907
 epoch: 99, train_loss: 0.7145, test_loss: 0.9616, test_f1: 0.5751
##################ITERATION #7 ****************************************
 epoch: 0, train_loss: 1.3081, test_loss: 1.3238, test_f1: 0.2270
 epoch: 1, train_loss: 1.2335, test_loss: 1.3014, test_f1: 0.2270
 epoch: 2, train_loss: 1.2012, test_loss: 1.2507, test_f1: 0.2626
 epoch: 3, train_loss: 1.1791, test_loss: 1.1895, test_f1: 0.3574
 epoch: 4, train_loss: 1.1477, test_loss: 1.1272, test_f1: 0.4175
 epoch: 5, train_loss: 1.1255, test_loss: 1.0817, test_f1: 0.4220
 epoch: 6, train_loss: 1.1226, test_loss: 1.0568, test_f1: 0.4518
 epoch: 7, train_loss: 1.1010, test_loss: 1.0335, test_f1: 0.4611
 epoch: 8, train_loss: 1.0791, test_loss: 1.0214, test_f1: 0.4630
 epoch: 9, train_loss: 1.0699, test_loss: 1.0163, test_f1: 0.4624
 epoch: 10, train_loss: 1.0566, test_loss: 0.9984, test_f1: 0.4682
 epoch: 11, train_loss: 1.0431, test_loss: 0.9922, test_f1: 0.4695
 epoch: 12, train_loss: 1.0317, test_loss: 0.9822, test_f1: 0.4713
 epoch: 13, train_loss: 1.0184, test_loss: 0.9732, test_f1: 0.4811
 epoch: 14, train_loss: 1.0087, test_loss: 0.9820, test_f1: 0.4913
 epoch: 15, train_loss: 0.9976, test_loss: 0.9686, test_f1: 0.4795
 epoch: 16, train_loss: 0.9881, test_loss: 0.9643, test_f1: 0.4883
 epoch: 17, train_loss: 0.9787, test_loss: 0.9560, test_f1: 0.4956
 epoch: 18, train_loss: 0.9794, test_loss: 0.9520, test_f1: 0.4900
 epoch: 19, train_loss: 0.9676, test_loss: 0.9380, test_f1: 0.4958
 epoch: 20, train_loss: 0.9697, test_loss: 0.9296, test_f1: 0.5012
 epoch: 21, train_loss: 0.9535, test_loss: 0.9342, test_f1: 0.4953
 epoch: 22, train_loss: 0.9500, test_loss: 0.9225, test_f1: 0.5198
 epoch: 23, train_loss: 0.9411, test_loss: 0.9235, test_f1: 0.5081
 epoch: 24, train_loss: 0.9279, test_loss: 0.9339, test_f1: 0.5054
 epoch: 25, train_loss: 0.9262, test_loss: 0.9223, test_f1: 0.5111
 epoch: 26, train_loss: 0.9267, test_loss: 0.9240, test_f1: 0.5174
 epoch: 27, train_loss: 0.9305, test_loss: 0.9361, test_f1: 0.5115
 epoch: 28, train_loss: 0.9219, test_loss: 0.9138, test_f1: 0.5067
 epoch: 29, train_loss: 0.9109, test_loss: 0.9136, test_f1: 0.5256
 epoch: 30, train_loss: 0.9079, test_loss: 0.9082, test_f1: 0.5234
 epoch: 31, train_loss: 0.9028, test_loss: 0.9240, test_f1: 0.5290
 epoch: 32, train_loss: 0.9018, test_loss: 0.9010, test_f1: 0.5294
 epoch: 33, train_loss: 0.8835, test_loss: 0.9273, test_f1: 0.5251
 epoch: 34, train_loss: 0.8908, test_loss: 0.9007, test_f1: 0.5443
 epoch: 35, train_loss: 0.8772, test_loss: 0.9037, test_f1: 0.5537
 epoch: 36, train_loss: 0.8808, test_loss: 0.9083, test_f1: 0.5518
 epoch: 37, train_loss: 0.8769, test_loss: 0.9005, test_f1: 0.5383
 epoch: 38, train_loss: 0.8765, test_loss: 0.9221, test_f1: 0.5570
 epoch: 39, train_loss: 0.8787, test_loss: 0.9043, test_f1: 0.5622
 epoch: 40, train_loss: 0.8638, test_loss: 0.8928, test_f1: 0.5568
 epoch: 41, train_loss: 0.8567, test_loss: 0.8968, test_f1: 0.5571
 epoch: 42, train_loss: 0.8594, test_loss: 0.8938, test_f1: 0.5477
 epoch: 43, train_loss: 0.8381, test_loss: 0.8930, test_f1: 0.5611
 epoch: 44, train_loss: 0.8494, test_loss: 0.9049, test_f1: 0.5482
 epoch: 45, train_loss: 0.8414, test_loss: 0.9030, test_f1: 0.5814
 epoch: 46, train_loss: 0.8447, test_loss: 0.9216, test_f1: 0.5466
 epoch: 47, train_loss: 0.8245, test_loss: 0.8907, test_f1: 0.5749
 epoch: 48, train_loss: 0.8374, test_loss: 0.8969, test_f1: 0.5464
 epoch: 49, train_loss: 0.8208, test_loss: 0.8957, test_f1: 0.5786
 epoch: 50, train_loss: 0.8316, test_loss: 0.8983, test_f1: 0.5732
 epoch: 51, train_loss: 0.8235, test_loss: 0.9013, test_f1: 0.5726
 epoch: 52, train_loss: 0.8299, test_loss: 0.8968, test_f1: 0.5694
 epoch: 53, train_loss: 0.8152, test_loss: 0.8964, test_f1: 0.5784
 epoch: 54, train_loss: 0.8149, test_loss: 0.8868, test_f1: 0.5745
 epoch: 55, train_loss: 0.8145, test_loss: 0.8935, test_f1: 0.5623
 epoch: 56, train_loss: 0.8009, test_loss: 0.8897, test_f1: 0.5663
 epoch: 57, train_loss: 0.8077, test_loss: 0.8893, test_f1: 0.5771
 epoch: 58, train_loss: 0.8104, test_loss: 0.8956, test_f1: 0.5797
 epoch: 59, train_loss: 0.8049, test_loss: 0.8930, test_f1: 0.5818
 epoch: 60, train_loss: 0.8080, test_loss: 0.8983, test_f1: 0.5701
 epoch: 61, train_loss: 0.8019, test_loss: 0.9035, test_f1: 0.5607
 epoch: 62, train_loss: 0.8053, test_loss: 0.8928, test_f1: 0.5690
 epoch: 63, train_loss: 0.7973, test_loss: 0.8877, test_f1: 0.5783
 epoch: 64, train_loss: 0.8010, test_loss: 0.9019, test_f1: 0.5894
 epoch: 65, train_loss: 0.7850, test_loss: 0.8947, test_f1: 0.5725
 epoch: 66, train_loss: 0.7972, test_loss: 0.8900, test_f1: 0.5749
 epoch: 67, train_loss: 0.7884, test_loss: 0.8954, test_f1: 0.5866
 epoch: 68, train_loss: 0.7870, test_loss: 0.8997, test_f1: 0.5841
 epoch: 69, train_loss: 0.7867, test_loss: 0.9096, test_f1: 0.5928
 epoch: 70, train_loss: 0.7819, test_loss: 0.9035, test_f1: 0.5969
 epoch: 71, train_loss: 0.7802, test_loss: 0.8922, test_f1: 0.5849
 epoch: 72, train_loss: 0.7777, test_loss: 0.8909, test_f1: 0.5929
 epoch: 73, train_loss: 0.7858, test_loss: 0.8902, test_f1: 0.5919
 epoch: 74, train_loss: 0.7851, test_loss: 0.8984, test_f1: 0.5920
 epoch: 75, train_loss: 0.7825, test_loss: 0.8881, test_f1: 0.5958
 epoch: 76, train_loss: 0.7754, test_loss: 0.9007, test_f1: 0.5712
 epoch: 77, train_loss: 0.7783, test_loss: 0.9055, test_f1: 0.5680
 epoch: 78, train_loss: 0.7790, test_loss: 0.8964, test_f1: 0.5866
 epoch: 79, train_loss: 0.7736, test_loss: 0.9068, test_f1: 0.5920
 epoch: 80, train_loss: 0.7651, test_loss: 0.8910, test_f1: 0.5859
 epoch: 81, train_loss: 0.7572, test_loss: 0.8923, test_f1: 0.5996
 epoch: 82, train_loss: 0.7641, test_loss: 0.8968, test_f1: 0.5740
 epoch: 83, train_loss: 0.7582, test_loss: 0.9020, test_f1: 0.5934
 epoch: 84, train_loss: 0.7641, test_loss: 0.8907, test_f1: 0.5781
 epoch: 85, train_loss: 0.7581, test_loss: 0.9109, test_f1: 0.5917
 epoch: 86, train_loss: 0.7550, test_loss: 0.9113, test_f1: 0.5696
 epoch: 87, train_loss: 0.7596, test_loss: 0.9009, test_f1: 0.5755
 epoch: 88, train_loss: 0.7497, test_loss: 0.8972, test_f1: 0.5866
 epoch: 89, train_loss: 0.7567, test_loss: 0.8989, test_f1: 0.5980
 epoch: 90, train_loss: 0.7558, test_loss: 0.8926, test_f1: 0.5959
 epoch: 91, train_loss: 0.7461, test_loss: 0.9094, test_f1: 0.5827
 epoch: 92, train_loss: 0.7525, test_loss: 0.9044, test_f1: 0.5957
 epoch: 93, train_loss: 0.7534, test_loss: 0.9045, test_f1: 0.5965
 epoch: 94, train_loss: 0.7486, test_loss: 0.9035, test_f1: 0.5838
 epoch: 95, train_loss: 0.7544, test_loss: 0.9083, test_f1: 0.5814
 epoch: 96, train_loss: 0.7431, test_loss: 0.8973, test_f1: 0.5909
 epoch: 97, train_loss: 0.7404, test_loss: 0.8985, test_f1: 0.5970
 epoch: 98, train_loss: 0.7480, test_loss: 0.9191, test_f1: 0.5884
 epoch: 99, train_loss: 0.7451, test_loss: 0.9126, test_f1: 0.5898
##################ITERATION #8 ****************************************
 epoch: 0, train_loss: 1.2973, test_loss: 1.3079, test_f1: 0.2270
 epoch: 1, train_loss: 1.2262, test_loss: 1.2827, test_f1: 0.2591
 epoch: 2, train_loss: 1.2023, test_loss: 1.2057, test_f1: 0.3445
 epoch: 3, train_loss: 1.1803, test_loss: 1.1908, test_f1: 0.3544
 epoch: 4, train_loss: 1.1533, test_loss: 1.1554, test_f1: 0.4033
 epoch: 5, train_loss: 1.1412, test_loss: 1.1031, test_f1: 0.4535
 epoch: 6, train_loss: 1.1217, test_loss: 1.0769, test_f1: 0.4560
 epoch: 7, train_loss: 1.1077, test_loss: 1.0548, test_f1: 0.4699
 epoch: 8, train_loss: 1.0922, test_loss: 1.0491, test_f1: 0.4787
 epoch: 9, train_loss: 1.0739, test_loss: 1.0378, test_f1: 0.4771
 epoch: 10, train_loss: 1.0623, test_loss: 1.0207, test_f1: 0.4775
 epoch: 11, train_loss: 1.0489, test_loss: 1.0181, test_f1: 0.4904
 epoch: 12, train_loss: 1.0385, test_loss: 1.0066, test_f1: 0.4943
 epoch: 13, train_loss: 1.0282, test_loss: 1.0068, test_f1: 0.4988
 epoch: 14, train_loss: 1.0211, test_loss: 0.9975, test_f1: 0.4932
 epoch: 15, train_loss: 1.0073, test_loss: 0.9953, test_f1: 0.5029
 epoch: 16, train_loss: 1.0025, test_loss: 0.9872, test_f1: 0.4949
 epoch: 17, train_loss: 0.9857, test_loss: 0.9816, test_f1: 0.5006
 epoch: 18, train_loss: 0.9891, test_loss: 0.9785, test_f1: 0.5044
 epoch: 19, train_loss: 0.9803, test_loss: 0.9776, test_f1: 0.4981
 epoch: 20, train_loss: 0.9738, test_loss: 0.9794, test_f1: 0.5012
 epoch: 21, train_loss: 0.9748, test_loss: 0.9691, test_f1: 0.5098
 epoch: 22, train_loss: 0.9603, test_loss: 0.9685, test_f1: 0.5141
 epoch: 23, train_loss: 0.9574, test_loss: 0.9682, test_f1: 0.5076
 epoch: 24, train_loss: 0.9391, test_loss: 0.9704, test_f1: 0.5078
 epoch: 25, train_loss: 0.9445, test_loss: 0.9770, test_f1: 0.5048
 epoch: 26, train_loss: 0.9437, test_loss: 0.9771, test_f1: 0.5032
 epoch: 27, train_loss: 0.9221, test_loss: 0.9574, test_f1: 0.5101
 epoch: 28, train_loss: 0.9244, test_loss: 0.9736, test_f1: 0.4996
 epoch: 29, train_loss: 0.9270, test_loss: 0.9746, test_f1: 0.5081
 epoch: 30, train_loss: 0.9103, test_loss: 0.9704, test_f1: 0.5090
 epoch: 31, train_loss: 0.9153, test_loss: 0.9548, test_f1: 0.5394
 epoch: 32, train_loss: 0.9048, test_loss: 0.9563, test_f1: 0.5266
 epoch: 33, train_loss: 0.8986, test_loss: 0.9600, test_f1: 0.5105
 epoch: 34, train_loss: 0.9023, test_loss: 0.9521, test_f1: 0.5180
 epoch: 35, train_loss: 0.8988, test_loss: 0.9604, test_f1: 0.5143
 epoch: 36, train_loss: 0.8948, test_loss: 0.9576, test_f1: 0.5086
 epoch: 37, train_loss: 0.8911, test_loss: 0.9628, test_f1: 0.5334
 epoch: 38, train_loss: 0.8878, test_loss: 0.9578, test_f1: 0.5242
 epoch: 39, train_loss: 0.8815, test_loss: 0.9525, test_f1: 0.5338
 epoch: 40, train_loss: 0.8767, test_loss: 0.9592, test_f1: 0.5270
 epoch: 41, train_loss: 0.8711, test_loss: 0.9474, test_f1: 0.5248
 epoch: 42, train_loss: 0.8682, test_loss: 0.9658, test_f1: 0.5387
 epoch: 43, train_loss: 0.8647, test_loss: 0.9581, test_f1: 0.5313
 epoch: 44, train_loss: 0.8541, test_loss: 0.9581, test_f1: 0.5470
 epoch: 45, train_loss: 0.8560, test_loss: 0.9627, test_f1: 0.5289
 epoch: 46, train_loss: 0.8538, test_loss: 0.9552, test_f1: 0.5383
 epoch: 47, train_loss: 0.8585, test_loss: 0.9542, test_f1: 0.5428
 epoch: 48, train_loss: 0.8536, test_loss: 0.9475, test_f1: 0.5428
 epoch: 49, train_loss: 0.8377, test_loss: 0.9490, test_f1: 0.5597
 epoch: 50, train_loss: 0.8410, test_loss: 0.9573, test_f1: 0.5501
 epoch: 51, train_loss: 0.8403, test_loss: 0.9564, test_f1: 0.5506
 epoch: 52, train_loss: 0.8363, test_loss: 0.9556, test_f1: 0.5510
 epoch: 53, train_loss: 0.8293, test_loss: 0.9570, test_f1: 0.5444
 epoch: 54, train_loss: 0.8229, test_loss: 0.9545, test_f1: 0.5336
 epoch: 55, train_loss: 0.8190, test_loss: 0.9598, test_f1: 0.5317
 epoch: 56, train_loss: 0.8231, test_loss: 0.9605, test_f1: 0.5364
 epoch: 57, train_loss: 0.8102, test_loss: 0.9615, test_f1: 0.5406
 epoch: 58, train_loss: 0.8208, test_loss: 0.9609, test_f1: 0.5433
 epoch: 59, train_loss: 0.8142, test_loss: 0.9618, test_f1: 0.5393
 epoch: 60, train_loss: 0.8207, test_loss: 0.9593, test_f1: 0.5464
 epoch: 61, train_loss: 0.8185, test_loss: 0.9594, test_f1: 0.5379
 epoch: 62, train_loss: 0.8129, test_loss: 0.9560, test_f1: 0.5413
 epoch: 63, train_loss: 0.8080, test_loss: 0.9569, test_f1: 0.5387
 epoch: 64, train_loss: 0.8080, test_loss: 0.9567, test_f1: 0.5591
 epoch: 65, train_loss: 0.8047, test_loss: 0.9587, test_f1: 0.5606
 epoch: 66, train_loss: 0.8081, test_loss: 0.9592, test_f1: 0.5532
 epoch: 67, train_loss: 0.8000, test_loss: 0.9592, test_f1: 0.5568
 epoch: 68, train_loss: 0.7975, test_loss: 0.9605, test_f1: 0.5495
 epoch: 69, train_loss: 0.8043, test_loss: 0.9612, test_f1: 0.5453
 epoch: 70, train_loss: 0.7991, test_loss: 0.9620, test_f1: 0.5569
 epoch: 71, train_loss: 0.7894, test_loss: 0.9616, test_f1: 0.5497
 epoch: 72, train_loss: 0.7930, test_loss: 0.9607, test_f1: 0.5688
 epoch: 73, train_loss: 0.8037, test_loss: 0.9640, test_f1: 0.5630
 epoch: 74, train_loss: 0.8002, test_loss: 0.9703, test_f1: 0.5558
 epoch: 75, train_loss: 0.7846, test_loss: 0.9713, test_f1: 0.5581
 epoch: 76, train_loss: 0.7902, test_loss: 0.9682, test_f1: 0.5621
 epoch: 77, train_loss: 0.7952, test_loss: 0.9726, test_f1: 0.5655
 epoch: 78, train_loss: 0.7803, test_loss: 0.9735, test_f1: 0.5672
 epoch: 79, train_loss: 0.7889, test_loss: 0.9741, test_f1: 0.5619
 epoch: 80, train_loss: 0.7753, test_loss: 0.9737, test_f1: 0.5566
 epoch: 81, train_loss: 0.7909, test_loss: 0.9752, test_f1: 0.5551
 epoch: 82, train_loss: 0.7918, test_loss: 0.9698, test_f1: 0.5568
 epoch: 83, train_loss: 0.7799, test_loss: 0.9763, test_f1: 0.5645
 epoch: 84, train_loss: 0.7751, test_loss: 0.9759, test_f1: 0.5667
 epoch: 85, train_loss: 0.7705, test_loss: 0.9787, test_f1: 0.5634
 epoch: 86, train_loss: 0.7787, test_loss: 0.9808, test_f1: 0.5564
 epoch: 87, train_loss: 0.7673, test_loss: 0.9823, test_f1: 0.5570
 epoch: 88, train_loss: 0.7645, test_loss: 0.9823, test_f1: 0.5646
 epoch: 89, train_loss: 0.7746, test_loss: 0.9723, test_f1: 0.5657
 epoch: 90, train_loss: 0.7623, test_loss: 0.9695, test_f1: 0.5595
 epoch: 91, train_loss: 0.7740, test_loss: 0.9726, test_f1: 0.5661
 epoch: 92, train_loss: 0.7612, test_loss: 0.9695, test_f1: 0.5666
 epoch: 93, train_loss: 0.7627, test_loss: 0.9770, test_f1: 0.5652
 epoch: 94, train_loss: 0.7592, test_loss: 0.9822, test_f1: 0.5668
 epoch: 95, train_loss: 0.7596, test_loss: 0.9713, test_f1: 0.5628
 epoch: 96, train_loss: 0.7621, test_loss: 0.9730, test_f1: 0.5754
 epoch: 97, train_loss: 0.7571, test_loss: 0.9740, test_f1: 0.5733
 epoch: 98, train_loss: 0.7698, test_loss: 0.9802, test_f1: 0.5651
 epoch: 99, train_loss: 0.7609, test_loss: 0.9759, test_f1: 0.5799
##################ITERATION #9 ****************************************
 epoch: 0, train_loss: 1.3179, test_loss: 1.3554, test_f1: 0.2270
 epoch: 1, train_loss: 1.2175, test_loss: 1.3788, test_f1: 0.2795
 epoch: 2, train_loss: 1.1820, test_loss: 1.3055, test_f1: 0.2648
 epoch: 3, train_loss: 1.1591, test_loss: 1.2193, test_f1: 0.3431
 epoch: 4, train_loss: 1.1302, test_loss: 1.1097, test_f1: 0.4855
 epoch: 5, train_loss: 1.1190, test_loss: 1.0590, test_f1: 0.4940
 epoch: 6, train_loss: 1.0912, test_loss: 1.0359, test_f1: 0.4857
 epoch: 7, train_loss: 1.0737, test_loss: 1.0221, test_f1: 0.4921
 epoch: 8, train_loss: 1.0697, test_loss: 1.0079, test_f1: 0.4763
 epoch: 9, train_loss: 1.0519, test_loss: 0.9942, test_f1: 0.4954
 epoch: 10, train_loss: 1.0250, test_loss: 0.9897, test_f1: 0.5039
 epoch: 11, train_loss: 1.0254, test_loss: 0.9842, test_f1: 0.5012
 epoch: 12, train_loss: 1.0130, test_loss: 0.9780, test_f1: 0.5089
 epoch: 13, train_loss: 1.0022, test_loss: 0.9763, test_f1: 0.5133
 epoch: 14, train_loss: 0.9951, test_loss: 0.9651, test_f1: 0.5213
 epoch: 15, train_loss: 0.9934, test_loss: 0.9592, test_f1: 0.5341
 epoch: 16, train_loss: 0.9810, test_loss: 0.9545, test_f1: 0.5477
 epoch: 17, train_loss: 0.9669, test_loss: 0.9491, test_f1: 0.5326
 epoch: 18, train_loss: 0.9630, test_loss: 0.9595, test_f1: 0.5333
 epoch: 19, train_loss: 0.9538, test_loss: 0.9481, test_f1: 0.5195
 epoch: 20, train_loss: 0.9523, test_loss: 0.9448, test_f1: 0.5336
 epoch: 21, train_loss: 0.9479, test_loss: 0.9586, test_f1: 0.5233
 epoch: 22, train_loss: 0.9334, test_loss: 0.9414, test_f1: 0.5240
 epoch: 23, train_loss: 0.9258, test_loss: 0.9551, test_f1: 0.5233
 epoch: 24, train_loss: 0.9294, test_loss: 0.9568, test_f1: 0.5153
 epoch: 25, train_loss: 0.9291, test_loss: 0.9512, test_f1: 0.5299
 epoch: 26, train_loss: 0.9123, test_loss: 0.9444, test_f1: 0.5461
 epoch: 27, train_loss: 0.9009, test_loss: 0.9477, test_f1: 0.5388
 epoch: 28, train_loss: 0.9024, test_loss: 0.9507, test_f1: 0.5457
 epoch: 29, train_loss: 0.8913, test_loss: 0.9569, test_f1: 0.5373
 epoch: 30, train_loss: 0.9070, test_loss: 0.9516, test_f1: 0.5322
 epoch: 31, train_loss: 0.8868, test_loss: 0.9520, test_f1: 0.5335
 epoch: 32, train_loss: 0.8824, test_loss: 0.9367, test_f1: 0.5415
 epoch: 33, train_loss: 0.8702, test_loss: 0.9491, test_f1: 0.5576
 epoch: 34, train_loss: 0.8765, test_loss: 0.9448, test_f1: 0.5544
 epoch: 35, train_loss: 0.8702, test_loss: 0.9368, test_f1: 0.5586
 epoch: 36, train_loss: 0.8781, test_loss: 0.9521, test_f1: 0.5553
 epoch: 37, train_loss: 0.8647, test_loss: 0.9424, test_f1: 0.5610
 epoch: 38, train_loss: 0.8659, test_loss: 0.9423, test_f1: 0.5575
 epoch: 39, train_loss: 0.8567, test_loss: 0.9705, test_f1: 0.5412
 epoch: 40, train_loss: 0.8674, test_loss: 0.9664, test_f1: 0.5429
 epoch: 41, train_loss: 0.8458, test_loss: 0.9520, test_f1: 0.5587
 epoch: 42, train_loss: 0.8479, test_loss: 0.9581, test_f1: 0.5472
 epoch: 43, train_loss: 0.8396, test_loss: 0.9556, test_f1: 0.5591
 epoch: 44, train_loss: 0.8355, test_loss: 0.9521, test_f1: 0.5637
 epoch: 45, train_loss: 0.8346, test_loss: 0.9548, test_f1: 0.5629
 epoch: 46, train_loss: 0.8361, test_loss: 0.9535, test_f1: 0.5572
 epoch: 47, train_loss: 0.8376, test_loss: 0.9687, test_f1: 0.5544
 epoch: 48, train_loss: 0.8214, test_loss: 0.9802, test_f1: 0.5482
 epoch: 49, train_loss: 0.8186, test_loss: 0.9690, test_f1: 0.5564
 epoch: 50, train_loss: 0.8169, test_loss: 0.9622, test_f1: 0.5715
 epoch: 51, train_loss: 0.8126, test_loss: 0.9631, test_f1: 0.5699
 epoch: 52, train_loss: 0.8170, test_loss: 0.9653, test_f1: 0.5638
 epoch: 53, train_loss: 0.8115, test_loss: 0.9671, test_f1: 0.5527
 epoch: 54, train_loss: 0.8058, test_loss: 0.9726, test_f1: 0.5446
 epoch: 55, train_loss: 0.7991, test_loss: 0.9594, test_f1: 0.5737
 epoch: 56, train_loss: 0.8046, test_loss: 0.9560, test_f1: 0.5644
 epoch: 57, train_loss: 0.8000, test_loss: 0.9657, test_f1: 0.5724
 epoch: 58, train_loss: 0.8025, test_loss: 0.9660, test_f1: 0.5629
 epoch: 59, train_loss: 0.8083, test_loss: 0.9664, test_f1: 0.5590
 epoch: 60, train_loss: 0.7866, test_loss: 0.9622, test_f1: 0.5482
 epoch: 61, train_loss: 0.7959, test_loss: 0.9765, test_f1: 0.5535
 epoch: 62, train_loss: 0.7952, test_loss: 0.9847, test_f1: 0.5517
 epoch: 63, train_loss: 0.7878, test_loss: 0.9762, test_f1: 0.5518
 epoch: 64, train_loss: 0.7961, test_loss: 0.9841, test_f1: 0.5506
 epoch: 65, train_loss: 0.7821, test_loss: 0.9804, test_f1: 0.5484
 epoch: 66, train_loss: 0.7922, test_loss: 0.9751, test_f1: 0.5620
 epoch: 67, train_loss: 0.7825, test_loss: 0.9695, test_f1: 0.5563
 epoch: 68, train_loss: 0.7775, test_loss: 0.9803, test_f1: 0.5500
 epoch: 69, train_loss: 0.7744, test_loss: 0.9718, test_f1: 0.5580
 epoch: 70, train_loss: 0.7884, test_loss: 0.9673, test_f1: 0.5546
 epoch: 71, train_loss: 0.7831, test_loss: 0.9833, test_f1: 0.5594
 epoch: 72, train_loss: 0.7766, test_loss: 0.9863, test_f1: 0.5391
 epoch: 73, train_loss: 0.7754, test_loss: 0.9763, test_f1: 0.5478
 epoch: 74, train_loss: 0.7770, test_loss: 0.9728, test_f1: 0.5443
 epoch: 75, train_loss: 0.7790, test_loss: 0.9901, test_f1: 0.5482
 epoch: 76, train_loss: 0.7844, test_loss: 0.9683, test_f1: 0.5576
 epoch: 77, train_loss: 0.7679, test_loss: 0.9802, test_f1: 0.5600
 epoch: 78, train_loss: 0.7648, test_loss: 0.9756, test_f1: 0.5626
 epoch: 79, train_loss: 0.7686, test_loss: 0.9798, test_f1: 0.5601
 epoch: 80, train_loss: 0.7647, test_loss: 0.9730, test_f1: 0.5713
 epoch: 81, train_loss: 0.7608, test_loss: 0.9721, test_f1: 0.5568
 epoch: 82, train_loss: 0.7658, test_loss: 0.9771, test_f1: 0.5551
 epoch: 83, train_loss: 0.7578, test_loss: 0.9906, test_f1: 0.5459
 epoch: 84, train_loss: 0.7545, test_loss: 0.9777, test_f1: 0.5638
 epoch: 85, train_loss: 0.7607, test_loss: 0.9814, test_f1: 0.5684
 epoch: 86, train_loss: 0.7613, test_loss: 0.9849, test_f1: 0.5553
 epoch: 87, train_loss: 0.7558, test_loss: 0.9801, test_f1: 0.5683
 epoch: 88, train_loss: 0.7593, test_loss: 0.9840, test_f1: 0.5645
 epoch: 89, train_loss: 0.7578, test_loss: 0.9821, test_f1: 0.5730
 epoch: 90, train_loss: 0.7469, test_loss: 0.9916, test_f1: 0.5599
 epoch: 91, train_loss: 0.7471, test_loss: 0.9948, test_f1: 0.5520
 epoch: 92, train_loss: 0.7555, test_loss: 0.9990, test_f1: 0.5548
 epoch: 93, train_loss: 0.7436, test_loss: 0.9820, test_f1: 0.5653
 epoch: 94, train_loss: 0.7486, test_loss: 0.9874, test_f1: 0.5686
 epoch: 95, train_loss: 0.7324, test_loss: 0.9930, test_f1: 0.5696
 epoch: 96, train_loss: 0.7539, test_loss: 0.9733, test_f1: 0.5614
 epoch: 97, train_loss: 0.7297, test_loss: 0.9785, test_f1: 0.5714
 epoch: 98, train_loss: 0.7359, test_loss: 0.9939, test_f1: 0.5673
 epoch: 99, train_loss: 0.7279, test_loss: 0.9885, test_f1: 0.5823

Training completed in 735.85 seconds
Best F1: 0.5996 at epoch 81
Mean F1 across iterations: 0.5736  0.0201
========================FINAL RESULTS================================
FEGIN weighted F1: 0.5996  0.0201
python main.py --data ltspice_examples --representation component_net --model FEGIN --layers 6 --hiddens 64 --batch_size 256 --lr 0.0001 --emb_size 512 --epochs 100 --save_appendix component_net_L6_H64_BS256_LR0.0001_E512 --no_val
-----



STDERR:
  File "main.py", line 370, in <module>
    main()
  File "main.py", line 254, in main
    dataset = dataset_class(
  File "/home/philip/projects/llm_inference_code_repo/Circuit-Completion-Using-GNNs/component_classification_with_link_prediction_head/evaluation/FEGIN/kernel/circuit_datasets.py", line 15, in __init__
    self.data, self.slices = torch.load(self.processed_paths[0])
  File "/home/philip/.local/lib/python3.8/site-packages/torch/serialization.py", line 1040, in load
    warnings.warn(
  File "/usr/lib/python3.8/warnings.py", line 109, in _showwarnmsg
    sw(msg.message, msg.category, msg.filename, msg.lineno,
  File "main.py", line 47, in warn_with_traceback
    traceback.print_stack(file=log)
/home/philip/projects/llm_inference_code_repo/Circuit-Completion-Using-GNNs/component_classification_with_link_prediction_head/evaluation/FEGIN/kernel/circuit_datasets.py:15: FutureWarning: You are using `torch.load` with `weights_only=False` (the current default value), which uses the default pickle module implicitly. It is possible to construct malicious pickle data which will execute arbitrary code during unpickling (See https://github.com/pytorch/pytorch/blob/main/SECURITY.md#untrusted-models for more details). In a future release, the default value for `weights_only` will be flipped to `True`. This limits the functions that could be executed during unpickling. Arbitrary objects will no longer be allowed to be loaded via this mode unless they are explicitly allowlisted by the user via `torch.serialization.add_safe_globals`. We recommend you start setting `weights_only=True` for any use case where you don't have full control of the loaded file. Please open an issue on GitHub for any issues related to this experimental feature.
  self.data, self.slices = torch.load(self.processed_paths[0])
