STDOUT:
Results will be saved in /home/philip/projects/llm_inference_code_repo/Circuit-Completion-Using-GNNs/component_classification_with_link_prediction_head/evaluation/FEGIN/results/model_FEGIN_dataset_ltspice_examples
Command line input: python main.py --data ltspice_examples --representation component_net --model FEGIN --layers 5 --hiddens 32 --batch_size 64 --lr 0.01 --emb_size 512 --epochs 100 --save_appendix component_net_L5_H32_BS64_LR0.01_E512 --no_val
 is saved.
-----
ltspice_examples - FEGIN
Using 5 layers, 32 hidden units, h = 2
Loading component_net representation dataset
ENTERED
Training FEGIN on component_net representation
Train: 3558, Test: 846
##################ITERATION #0 ****************************************
 epoch: 0, train_loss: 1.2122, test_loss: 1.1413, test_f1: 0.3370
 epoch: 1, train_loss: 1.0726, test_loss: 1.1434, test_f1: 0.3617
 epoch: 2, train_loss: 1.0328, test_loss: 1.1268, test_f1: 0.4337
 epoch: 3, train_loss: 1.0224, test_loss: 1.1326, test_f1: 0.4285
 epoch: 4, train_loss: 1.0012, test_loss: 0.9999, test_f1: 0.4560
 epoch: 5, train_loss: 0.9855, test_loss: 1.0913, test_f1: 0.4495
 epoch: 6, train_loss: 0.9991, test_loss: 1.0909, test_f1: 0.4742
 epoch: 7, train_loss: 0.9798, test_loss: 1.0592, test_f1: 0.4870
 epoch: 8, train_loss: 0.9669, test_loss: 0.9854, test_f1: 0.4878
 epoch: 9, train_loss: 0.9613, test_loss: 1.0216, test_f1: 0.4573
 epoch: 10, train_loss: 0.9536, test_loss: 1.0002, test_f1: 0.4615
 epoch: 11, train_loss: 0.9465, test_loss: 0.9785, test_f1: 0.4562
 epoch: 12, train_loss: 0.9299, test_loss: 1.2482, test_f1: 0.4173
 epoch: 13, train_loss: 0.9345, test_loss: 1.1265, test_f1: 0.4643
 epoch: 14, train_loss: 0.9291, test_loss: 1.0272, test_f1: 0.4798
 epoch: 15, train_loss: 0.9215, test_loss: 1.0216, test_f1: 0.4965
 epoch: 16, train_loss: 0.9271, test_loss: 0.9330, test_f1: 0.5133
 epoch: 17, train_loss: 0.9163, test_loss: 0.9584, test_f1: 0.4891
 epoch: 18, train_loss: 0.9260, test_loss: 1.0293, test_f1: 0.5051
 epoch: 19, train_loss: 0.9133, test_loss: 1.0270, test_f1: 0.5383
 epoch: 20, train_loss: 0.9104, test_loss: 1.0335, test_f1: 0.5153
 epoch: 21, train_loss: 0.9032, test_loss: 0.9957, test_f1: 0.4989
 epoch: 22, train_loss: 0.8971, test_loss: 0.9130, test_f1: 0.5536
 epoch: 23, train_loss: 0.8942, test_loss: 1.0597, test_f1: 0.5318
 epoch: 24, train_loss: 0.9020, test_loss: 0.9582, test_f1: 0.4934
 epoch: 25, train_loss: 0.8844, test_loss: 1.0002, test_f1: 0.4828
 epoch: 26, train_loss: 0.8939, test_loss: 0.9798, test_f1: 0.5063
 epoch: 27, train_loss: 0.8737, test_loss: 1.0167, test_f1: 0.5194
 epoch: 28, train_loss: 0.8699, test_loss: 0.9452, test_f1: 0.5250
 epoch: 29, train_loss: 0.8686, test_loss: 1.0604, test_f1: 0.5779
 epoch: 30, train_loss: 0.8629, test_loss: 0.9774, test_f1: 0.5063
 epoch: 31, train_loss: 0.8496, test_loss: 1.0775, test_f1: 0.5174
 epoch: 32, train_loss: 0.8770, test_loss: 0.9899, test_f1: 0.5099
 epoch: 33, train_loss: 0.8550, test_loss: 0.9994, test_f1: 0.5308
 epoch: 34, train_loss: 0.8416, test_loss: 0.9877, test_f1: 0.4965
 epoch: 35, train_loss: 0.8574, test_loss: 0.9860, test_f1: 0.5365
 epoch: 36, train_loss: 0.8648, test_loss: 0.9394, test_f1: 0.5651
 epoch: 37, train_loss: 0.8310, test_loss: 0.9614, test_f1: 0.5455
 epoch: 38, train_loss: 0.8429, test_loss: 0.9411, test_f1: 0.5910
 epoch: 39, train_loss: 0.8315, test_loss: 0.9709, test_f1: 0.5514
 epoch: 40, train_loss: 0.8235, test_loss: 1.0742, test_f1: 0.5246
 epoch: 41, train_loss: 0.8235, test_loss: 1.0352, test_f1: 0.5383
 epoch: 42, train_loss: 0.8297, test_loss: 0.9714, test_f1: 0.5717
 epoch: 43, train_loss: 0.8039, test_loss: 1.0176, test_f1: 0.5704
 epoch: 44, train_loss: 0.8221, test_loss: 1.0107, test_f1: 0.5343
 epoch: 45, train_loss: 0.7994, test_loss: 0.9581, test_f1: 0.5961
 epoch: 46, train_loss: 0.8110, test_loss: 1.0600, test_f1: 0.5831
 epoch: 47, train_loss: 0.7879, test_loss: 1.0145, test_f1: 0.5608
 epoch: 48, train_loss: 0.8042, test_loss: 1.0063, test_f1: 0.5639
 epoch: 49, train_loss: 0.7884, test_loss: 1.0648, test_f1: 0.5618
 epoch: 50, train_loss: 0.8011, test_loss: 0.9774, test_f1: 0.5688
 epoch: 51, train_loss: 0.7595, test_loss: 1.0208, test_f1: 0.6226
 epoch: 52, train_loss: 0.7506, test_loss: 1.0380, test_f1: 0.5748
 epoch: 53, train_loss: 0.7552, test_loss: 1.0712, test_f1: 0.5842
 epoch: 54, train_loss: 0.7534, test_loss: 1.1084, test_f1: 0.5934
 epoch: 55, train_loss: 0.7432, test_loss: 1.1109, test_f1: 0.5836
 epoch: 56, train_loss: 0.7431, test_loss: 1.1885, test_f1: 0.6380
 epoch: 57, train_loss: 0.7462, test_loss: 1.1146, test_f1: 0.5773
 epoch: 58, train_loss: 0.7416, test_loss: 1.0791, test_f1: 0.6000
 epoch: 59, train_loss: 0.7320, test_loss: 1.1151, test_f1: 0.5880
 epoch: 60, train_loss: 0.7284, test_loss: 1.1234, test_f1: 0.5998
 epoch: 61, train_loss: 0.7239, test_loss: 1.1140, test_f1: 0.6693
 epoch: 62, train_loss: 0.7315, test_loss: 1.2013, test_f1: 0.5969
 epoch: 63, train_loss: 0.7820, test_loss: 1.1261, test_f1: 0.5819
 epoch: 64, train_loss: 0.7229, test_loss: 1.0111, test_f1: 0.5982
 epoch: 65, train_loss: 0.7249, test_loss: 1.1471, test_f1: 0.6146
 epoch: 66, train_loss: 0.7336, test_loss: 1.0692, test_f1: 0.6066
 epoch: 67, train_loss: 0.7150, test_loss: 1.0818, test_f1: 0.5997
 epoch: 68, train_loss: 0.7202, test_loss: 1.1469, test_f1: 0.6136
 epoch: 69, train_loss: 0.7153, test_loss: 1.0752, test_f1: 0.6314
 epoch: 70, train_loss: 0.7124, test_loss: 1.0976, test_f1: 0.6179
 epoch: 71, train_loss: 0.7023, test_loss: 1.0978, test_f1: 0.6072
 epoch: 72, train_loss: 0.7160, test_loss: 1.1173, test_f1: 0.5969
 epoch: 73, train_loss: 0.7095, test_loss: 1.0971, test_f1: 0.6151
 epoch: 74, train_loss: 0.7092, test_loss: 1.0843, test_f1: 0.6015
 epoch: 75, train_loss: 0.7049, test_loss: 1.1193, test_f1: 0.5784
 epoch: 76, train_loss: 0.6999, test_loss: 1.1498, test_f1: 0.5966
 epoch: 77, train_loss: 0.6967, test_loss: 1.2120, test_f1: 0.6212
 epoch: 78, train_loss: 0.6948, test_loss: 1.2388, test_f1: 0.6384
 epoch: 79, train_loss: 0.6908, test_loss: 1.1816, test_f1: 0.6086
 epoch: 80, train_loss: 0.6989, test_loss: 1.1267, test_f1: 0.6109
 epoch: 81, train_loss: 0.6946, test_loss: 1.1872, test_f1: 0.6182
 epoch: 82, train_loss: 0.6873, test_loss: 1.1453, test_f1: 0.6361
 epoch: 83, train_loss: 0.6760, test_loss: 1.2014, test_f1: 0.6584
 epoch: 84, train_loss: 0.6854, test_loss: 1.1386, test_f1: 0.6287
 epoch: 85, train_loss: 0.6991, test_loss: 1.2143, test_f1: 0.6026
 epoch: 86, train_loss: 0.6741, test_loss: 1.1575, test_f1: 0.6013
 epoch: 87, train_loss: 0.6735, test_loss: 1.2577, test_f1: 0.6452
 epoch: 88, train_loss: 0.6795, test_loss: 1.1506, test_f1: 0.6446
 epoch: 89, train_loss: 0.6575, test_loss: 1.1825, test_f1: 0.6197
 epoch: 90, train_loss: 0.6747, test_loss: 1.1304, test_f1: 0.6155
 epoch: 91, train_loss: 0.6915, test_loss: 1.1744, test_f1: 0.6311
 epoch: 92, train_loss: 0.6629, test_loss: 1.1876, test_f1: 0.5913
 epoch: 93, train_loss: 0.6630, test_loss: 1.1330, test_f1: 0.6032
 epoch: 94, train_loss: 0.6556, test_loss: 1.1644, test_f1: 0.5999
 epoch: 95, train_loss: 0.6703, test_loss: 1.1795, test_f1: 0.6228
 epoch: 96, train_loss: 0.6563, test_loss: 1.2421, test_f1: 0.6299
 epoch: 97, train_loss: 0.6626, test_loss: 1.1972, test_f1: 0.5694
 epoch: 98, train_loss: 0.6615, test_loss: 1.1514, test_f1: 0.6290
 epoch: 99, train_loss: 0.6669, test_loss: 1.1572, test_f1: 0.5847
##################ITERATION #1 ****************************************
 epoch: 0, train_loss: 1.1982, test_loss: 1.1068, test_f1: 0.4096
 epoch: 1, train_loss: 1.0474, test_loss: 1.0111, test_f1: 0.4178
 epoch: 2, train_loss: 1.0084, test_loss: 0.9494, test_f1: 0.5136
 epoch: 3, train_loss: 0.9770, test_loss: 0.9423, test_f1: 0.5130
 epoch: 4, train_loss: 0.9847, test_loss: 0.9724, test_f1: 0.4432
 epoch: 5, train_loss: 0.9518, test_loss: 0.9412, test_f1: 0.4926
 epoch: 6, train_loss: 0.9559, test_loss: 0.9286, test_f1: 0.4946
 epoch: 7, train_loss: 0.9606, test_loss: 0.9730, test_f1: 0.5129
 epoch: 8, train_loss: 0.9291, test_loss: 0.9400, test_f1: 0.5320
 epoch: 9, train_loss: 0.9412, test_loss: 0.9486, test_f1: 0.5155
 epoch: 10, train_loss: 0.9177, test_loss: 0.9649, test_f1: 0.4881
 epoch: 11, train_loss: 0.9169, test_loss: 0.8738, test_f1: 0.5069
 epoch: 12, train_loss: 0.9157, test_loss: 0.9389, test_f1: 0.5069
 epoch: 13, train_loss: 0.8971, test_loss: 0.9041, test_f1: 0.5034
 epoch: 14, train_loss: 0.9080, test_loss: 0.9693, test_f1: 0.5126
 epoch: 15, train_loss: 0.8861, test_loss: 0.9887, test_f1: 0.4845
 epoch: 16, train_loss: 0.8978, test_loss: 0.9408, test_f1: 0.4876
 epoch: 17, train_loss: 0.8844, test_loss: 1.0083, test_f1: 0.5162
 epoch: 18, train_loss: 0.8900, test_loss: 0.9303, test_f1: 0.5288
 epoch: 19, train_loss: 0.8683, test_loss: 0.9343, test_f1: 0.5166
 epoch: 20, train_loss: 0.8694, test_loss: 0.9086, test_f1: 0.5353
 epoch: 21, train_loss: 0.8588, test_loss: 0.8912, test_f1: 0.5524
 epoch: 22, train_loss: 0.8694, test_loss: 1.0914, test_f1: 0.4974
 epoch: 23, train_loss: 0.8534, test_loss: 1.0195, test_f1: 0.5086
 epoch: 24, train_loss: 0.8526, test_loss: 0.8929, test_f1: 0.5520
 epoch: 25, train_loss: 0.8582, test_loss: 0.8900, test_f1: 0.5791
 epoch: 26, train_loss: 0.8436, test_loss: 0.9611, test_f1: 0.5462
 epoch: 27, train_loss: 0.8379, test_loss: 0.9531, test_f1: 0.5758
 epoch: 28, train_loss: 0.8324, test_loss: 1.0040, test_f1: 0.5038
 epoch: 29, train_loss: 0.8447, test_loss: 1.1402, test_f1: 0.5231
 epoch: 30, train_loss: 0.8252, test_loss: 0.9629, test_f1: 0.5354
 epoch: 31, train_loss: 0.8389, test_loss: 0.9781, test_f1: 0.5238
 epoch: 32, train_loss: 0.8380, test_loss: 0.8844, test_f1: 0.5358
 epoch: 33, train_loss: 0.8269, test_loss: 0.8734, test_f1: 0.5689
 epoch: 34, train_loss: 0.8346, test_loss: 0.9152, test_f1: 0.5512
 epoch: 35, train_loss: 0.8188, test_loss: 1.0177, test_f1: 0.5371
 epoch: 36, train_loss: 0.8186, test_loss: 0.9889, test_f1: 0.5803
 epoch: 37, train_loss: 0.8010, test_loss: 0.9555, test_f1: 0.5277
 epoch: 38, train_loss: 0.8024, test_loss: 1.0398, test_f1: 0.5842
 epoch: 39, train_loss: 0.7967, test_loss: 0.9449, test_f1: 0.6098
 epoch: 40, train_loss: 0.8091, test_loss: 0.9206, test_f1: 0.6184
 epoch: 41, train_loss: 0.8022, test_loss: 0.9531, test_f1: 0.6074
 epoch: 42, train_loss: 0.8000, test_loss: 0.9188, test_f1: 0.5925
 epoch: 43, train_loss: 0.7976, test_loss: 0.9623, test_f1: 0.5533
 epoch: 44, train_loss: 0.7989, test_loss: 0.8637, test_f1: 0.5993
 epoch: 45, train_loss: 0.7828, test_loss: 0.9437, test_f1: 0.5779
 epoch: 46, train_loss: 0.8035, test_loss: 0.9000, test_f1: 0.6024
 epoch: 47, train_loss: 0.7959, test_loss: 1.0473, test_f1: 0.5333
 epoch: 48, train_loss: 0.7865, test_loss: 0.9623, test_f1: 0.5444
 epoch: 49, train_loss: 0.7704, test_loss: 0.9667, test_f1: 0.6134
 epoch: 50, train_loss: 0.7643, test_loss: 0.9187, test_f1: 0.5850
 epoch: 51, train_loss: 0.7559, test_loss: 0.8888, test_f1: 0.6335
 epoch: 52, train_loss: 0.7425, test_loss: 0.8827, test_f1: 0.6248
 epoch: 53, train_loss: 0.7303, test_loss: 0.9301, test_f1: 0.6001
 epoch: 54, train_loss: 0.7192, test_loss: 0.9438, test_f1: 0.6290
 epoch: 55, train_loss: 0.7203, test_loss: 0.8940, test_f1: 0.5854
 epoch: 56, train_loss: 0.7310, test_loss: 0.8386, test_f1: 0.6246
 epoch: 57, train_loss: 0.7226, test_loss: 0.9590, test_f1: 0.6241
 epoch: 58, train_loss: 0.7066, test_loss: 0.9890, test_f1: 0.5986
 epoch: 59, train_loss: 0.7079, test_loss: 0.9530, test_f1: 0.6276
 epoch: 60, train_loss: 0.7049, test_loss: 0.9223, test_f1: 0.6367
 epoch: 61, train_loss: 0.7008, test_loss: 0.9576, test_f1: 0.6287
 epoch: 62, train_loss: 0.7000, test_loss: 0.9771, test_f1: 0.5883
 epoch: 63, train_loss: 0.7134, test_loss: 0.9852, test_f1: 0.6199
 epoch: 64, train_loss: 0.6987, test_loss: 1.0010, test_f1: 0.5945
 epoch: 65, train_loss: 0.6916, test_loss: 0.9697, test_f1: 0.6367
 epoch: 66, train_loss: 0.6884, test_loss: 0.9687, test_f1: 0.6385
 epoch: 67, train_loss: 0.6823, test_loss: 0.9725, test_f1: 0.6184
 epoch: 68, train_loss: 0.6873, test_loss: 1.0082, test_f1: 0.6231
 epoch: 69, train_loss: 0.7078, test_loss: 0.9252, test_f1: 0.5842
 epoch: 70, train_loss: 0.6945, test_loss: 1.0178, test_f1: 0.6411
 epoch: 71, train_loss: 0.6963, test_loss: 0.9327, test_f1: 0.6142
 epoch: 72, train_loss: 0.6959, test_loss: 1.0501, test_f1: 0.6359
 epoch: 73, train_loss: 0.6731, test_loss: 1.0394, test_f1: 0.6032
 epoch: 74, train_loss: 0.6743, test_loss: 1.1718, test_f1: 0.5927
 epoch: 75, train_loss: 0.7010, test_loss: 1.0803, test_f1: 0.5874
 epoch: 76, train_loss: 0.6900, test_loss: 1.0164, test_f1: 0.6377
 epoch: 77, train_loss: 0.6875, test_loss: 0.9831, test_f1: 0.6452
 epoch: 78, train_loss: 0.6849, test_loss: 0.9638, test_f1: 0.6385
 epoch: 79, train_loss: 0.6708, test_loss: 0.9860, test_f1: 0.6115
 epoch: 80, train_loss: 0.6886, test_loss: 1.0369, test_f1: 0.6250
 epoch: 81, train_loss: 0.6775, test_loss: 0.9336, test_f1: 0.6488
 epoch: 82, train_loss: 0.6747, test_loss: 0.9528, test_f1: 0.6545
 epoch: 83, train_loss: 0.6682, test_loss: 0.9996, test_f1: 0.6329
 epoch: 84, train_loss: 0.6759, test_loss: 0.9712, test_f1: 0.6309
 epoch: 85, train_loss: 0.6662, test_loss: 1.0929, test_f1: 0.6214
 epoch: 86, train_loss: 0.6661, test_loss: 0.9258, test_f1: 0.6249
 epoch: 87, train_loss: 0.6654, test_loss: 1.0194, test_f1: 0.6185
 epoch: 88, train_loss: 0.6686, test_loss: 0.9194, test_f1: 0.6542
 epoch: 89, train_loss: 0.6643, test_loss: 0.9866, test_f1: 0.6370
 epoch: 90, train_loss: 0.6376, test_loss: 0.9931, test_f1: 0.6305
 epoch: 91, train_loss: 0.6511, test_loss: 1.0027, test_f1: 0.6464
 epoch: 92, train_loss: 0.6544, test_loss: 0.9467, test_f1: 0.6236
 epoch: 93, train_loss: 0.6534, test_loss: 0.9577, test_f1: 0.6383
 epoch: 94, train_loss: 0.6487, test_loss: 0.9925, test_f1: 0.6343
 epoch: 95, train_loss: 0.6544, test_loss: 0.8934, test_f1: 0.6341
 epoch: 96, train_loss: 0.6489, test_loss: 1.0123, test_f1: 0.6203
 epoch: 97, train_loss: 0.6691, test_loss: 0.9122, test_f1: 0.6032
 epoch: 98, train_loss: 0.6815, test_loss: 0.9796, test_f1: 0.6207
 epoch: 99, train_loss: 0.6493, test_loss: 0.9430, test_f1: 0.6327
##################ITERATION #2 ****************************************
 epoch: 0, train_loss: 1.1997, test_loss: 1.0576, test_f1: 0.4551
 epoch: 1, train_loss: 1.0271, test_loss: 1.0605, test_f1: 0.4215
 epoch: 2, train_loss: 0.9956, test_loss: 1.0142, test_f1: 0.5008
 epoch: 3, train_loss: 0.9762, test_loss: 0.9874, test_f1: 0.4665
 epoch: 4, train_loss: 0.9616, test_loss: 0.9735, test_f1: 0.4636
 epoch: 5, train_loss: 0.9526, test_loss: 1.0355, test_f1: 0.5397
 epoch: 6, train_loss: 0.9325, test_loss: 1.0079, test_f1: 0.4637
 epoch: 7, train_loss: 0.9306, test_loss: 0.9523, test_f1: 0.4777
 epoch: 8, train_loss: 0.9212, test_loss: 0.9694, test_f1: 0.5588
 epoch: 9, train_loss: 0.9134, test_loss: 0.9811, test_f1: 0.5680
 epoch: 10, train_loss: 0.9181, test_loss: 0.9764, test_f1: 0.4897
 epoch: 11, train_loss: 0.8939, test_loss: 0.9369, test_f1: 0.4948
 epoch: 12, train_loss: 0.9034, test_loss: 0.9185, test_f1: 0.5109
 epoch: 13, train_loss: 0.8930, test_loss: 0.9110, test_f1: 0.5397
 epoch: 14, train_loss: 0.8814, test_loss: 0.9693, test_f1: 0.4992
 epoch: 15, train_loss: 0.8757, test_loss: 0.9322, test_f1: 0.5129
 epoch: 16, train_loss: 0.8720, test_loss: 0.9527, test_f1: 0.5542
 epoch: 17, train_loss: 0.8672, test_loss: 0.9867, test_f1: 0.5348
 epoch: 18, train_loss: 0.8624, test_loss: 0.9657, test_f1: 0.5148
 epoch: 19, train_loss: 0.8500, test_loss: 0.9829, test_f1: 0.5356
 epoch: 20, train_loss: 0.8519, test_loss: 0.9167, test_f1: 0.5788
 epoch: 21, train_loss: 0.8469, test_loss: 0.9816, test_f1: 0.5463
 epoch: 22, train_loss: 0.8369, test_loss: 1.1059, test_f1: 0.5052
 epoch: 23, train_loss: 0.8311, test_loss: 0.9211, test_f1: 0.5506
 epoch: 24, train_loss: 0.8218, test_loss: 0.8863, test_f1: 0.5681
 epoch: 25, train_loss: 0.8383, test_loss: 0.9461, test_f1: 0.5514
 epoch: 26, train_loss: 0.8422, test_loss: 0.9589, test_f1: 0.5769
 epoch: 27, train_loss: 0.8154, test_loss: 0.9976, test_f1: 0.5711
 epoch: 28, train_loss: 0.8267, test_loss: 0.9743, test_f1: 0.5571
 epoch: 29, train_loss: 0.8082, test_loss: 1.0248, test_f1: 0.5438
 epoch: 30, train_loss: 0.7912, test_loss: 0.9839, test_f1: 0.5612
 epoch: 31, train_loss: 0.8046, test_loss: 0.9303, test_f1: 0.5279
 epoch: 32, train_loss: 0.7864, test_loss: 1.0304, test_f1: 0.5369
 epoch: 33, train_loss: 0.8064, test_loss: 0.9878, test_f1: 0.5264
 epoch: 34, train_loss: 0.7865, test_loss: 0.9085, test_f1: 0.6015
 epoch: 35, train_loss: 0.7997, test_loss: 0.9699, test_f1: 0.5646
 epoch: 36, train_loss: 0.7913, test_loss: 1.0156, test_f1: 0.5589
 epoch: 37, train_loss: 0.7782, test_loss: 0.9759, test_f1: 0.5348
 epoch: 38, train_loss: 0.7721, test_loss: 0.9795, test_f1: 0.5844
 epoch: 39, train_loss: 0.7890, test_loss: 0.9294, test_f1: 0.5599
 epoch: 40, train_loss: 0.7622, test_loss: 0.8764, test_f1: 0.5500
 epoch: 41, train_loss: 0.7729, test_loss: 0.9759, test_f1: 0.5831
 epoch: 42, train_loss: 0.7603, test_loss: 0.8725, test_f1: 0.5600
 epoch: 43, train_loss: 0.7519, test_loss: 0.8283, test_f1: 0.5648
 epoch: 44, train_loss: 0.7670, test_loss: 0.9058, test_f1: 0.6044
 epoch: 45, train_loss: 0.7609, test_loss: 0.8926, test_f1: 0.5888
 epoch: 46, train_loss: 0.7504, test_loss: 0.8837, test_f1: 0.5454
 epoch: 47, train_loss: 0.7762, test_loss: 0.8396, test_f1: 0.6186
 epoch: 48, train_loss: 0.7449, test_loss: 0.9028, test_f1: 0.6103
 epoch: 49, train_loss: 0.7395, test_loss: 0.9499, test_f1: 0.6149
 epoch: 50, train_loss: 0.7433, test_loss: 0.9711, test_f1: 0.6333
 epoch: 51, train_loss: 0.7252, test_loss: 0.9424, test_f1: 0.6260
 epoch: 52, train_loss: 0.7061, test_loss: 0.9752, test_f1: 0.6149
 epoch: 53, train_loss: 0.6973, test_loss: 0.9394, test_f1: 0.6236
 epoch: 54, train_loss: 0.6836, test_loss: 0.9692, test_f1: 0.6331
 epoch: 55, train_loss: 0.6811, test_loss: 0.9984, test_f1: 0.6239
 epoch: 56, train_loss: 0.6913, test_loss: 0.9906, test_f1: 0.5932
 epoch: 57, train_loss: 0.6793, test_loss: 0.9713, test_f1: 0.5820
 epoch: 58, train_loss: 0.6830, test_loss: 1.0109, test_f1: 0.6190
 epoch: 59, train_loss: 0.6746, test_loss: 0.9972, test_f1: 0.6510
 epoch: 60, train_loss: 0.6684, test_loss: 0.9745, test_f1: 0.5906
 epoch: 61, train_loss: 0.6907, test_loss: 0.9547, test_f1: 0.6246
 epoch: 62, train_loss: 0.6609, test_loss: 1.0007, test_f1: 0.5974
 epoch: 63, train_loss: 0.6812, test_loss: 1.0512, test_f1: 0.6236
 epoch: 64, train_loss: 0.6550, test_loss: 1.0514, test_f1: 0.5956
 epoch: 65, train_loss: 0.6573, test_loss: 1.0238, test_f1: 0.6379
 epoch: 66, train_loss: 0.6617, test_loss: 1.0070, test_f1: 0.6482
 epoch: 67, train_loss: 0.6460, test_loss: 0.9795, test_f1: 0.6348
 epoch: 68, train_loss: 0.6413, test_loss: 1.0246, test_f1: 0.6431
 epoch: 69, train_loss: 0.6551, test_loss: 1.0019, test_f1: 0.5903
 epoch: 70, train_loss: 0.6457, test_loss: 1.0417, test_f1: 0.6463
 epoch: 71, train_loss: 0.6644, test_loss: 1.0700, test_f1: 0.6079
 epoch: 72, train_loss: 0.6353, test_loss: 1.0167, test_f1: 0.6386
 epoch: 73, train_loss: 0.6363, test_loss: 1.0558, test_f1: 0.6244
 epoch: 74, train_loss: 0.6468, test_loss: 1.1833, test_f1: 0.6130
 epoch: 75, train_loss: 0.6540, test_loss: 1.1435, test_f1: 0.6198
 epoch: 76, train_loss: 0.6226, test_loss: 1.0387, test_f1: 0.6630
 epoch: 77, train_loss: 0.6507, test_loss: 1.0753, test_f1: 0.6101
 epoch: 78, train_loss: 0.6366, test_loss: 1.0054, test_f1: 0.6391
 epoch: 79, train_loss: 0.6419, test_loss: 1.0354, test_f1: 0.6359
 epoch: 80, train_loss: 0.6272, test_loss: 0.9519, test_f1: 0.6471
 epoch: 81, train_loss: 0.6336, test_loss: 1.0302, test_f1: 0.6478
 epoch: 82, train_loss: 0.6200, test_loss: 1.0774, test_f1: 0.6206
 epoch: 83, train_loss: 0.6299, test_loss: 1.0361, test_f1: 0.6160
 epoch: 84, train_loss: 0.6375, test_loss: 1.0059, test_f1: 0.6329
 epoch: 85, train_loss: 0.6290, test_loss: 0.9971, test_f1: 0.6248
 epoch: 86, train_loss: 0.6213, test_loss: 1.0741, test_f1: 0.6232
 epoch: 87, train_loss: 0.6249, test_loss: 1.0581, test_f1: 0.5988
 epoch: 88, train_loss: 0.6257, test_loss: 0.9296, test_f1: 0.6278
 epoch: 89, train_loss: 0.6219, test_loss: 1.0043, test_f1: 0.6549
 epoch: 90, train_loss: 0.6195, test_loss: 1.0603, test_f1: 0.6302
 epoch: 91, train_loss: 0.6303, test_loss: 1.0634, test_f1: 0.6136
 epoch: 92, train_loss: 0.6171, test_loss: 1.0901, test_f1: 0.6425
 epoch: 93, train_loss: 0.6155, test_loss: 1.1250, test_f1: 0.6387
 epoch: 94, train_loss: 0.6154, test_loss: 1.0552, test_f1: 0.6271
 epoch: 95, train_loss: 0.6016, test_loss: 1.1348, test_f1: 0.6554
 epoch: 96, train_loss: 0.6079, test_loss: 1.0223, test_f1: 0.6556
 epoch: 97, train_loss: 0.6115, test_loss: 1.0855, test_f1: 0.6535
 epoch: 98, train_loss: 0.6208, test_loss: 1.0505, test_f1: 0.6226
 epoch: 99, train_loss: 0.6240, test_loss: 1.0289, test_f1: 0.6524
##################ITERATION #3 ****************************************
 epoch: 0, train_loss: 1.2052, test_loss: 1.0442, test_f1: 0.4538
 epoch: 1, train_loss: 1.0585, test_loss: 1.0213, test_f1: 0.4534
 epoch: 2, train_loss: 0.9962, test_loss: 0.9994, test_f1: 0.4682
 epoch: 3, train_loss: 0.9808, test_loss: 0.9629, test_f1: 0.4889
 epoch: 4, train_loss: 0.9624, test_loss: 0.9633, test_f1: 0.4767
 epoch: 5, train_loss: 0.9459, test_loss: 0.9769, test_f1: 0.5022
 epoch: 6, train_loss: 0.9479, test_loss: 0.9108, test_f1: 0.5229
 epoch: 7, train_loss: 0.9457, test_loss: 0.9014, test_f1: 0.4979
 epoch: 8, train_loss: 0.9226, test_loss: 0.9611, test_f1: 0.4944
 epoch: 9, train_loss: 0.9136, test_loss: 0.8920, test_f1: 0.5024
 epoch: 10, train_loss: 0.9113, test_loss: 0.9205, test_f1: 0.5243
 epoch: 11, train_loss: 0.8998, test_loss: 0.9072, test_f1: 0.5454
 epoch: 12, train_loss: 0.8930, test_loss: 0.9070, test_f1: 0.5500
 epoch: 13, train_loss: 0.9048, test_loss: 0.9447, test_f1: 0.4949
 epoch: 14, train_loss: 0.8825, test_loss: 0.9131, test_f1: 0.5014
 epoch: 15, train_loss: 0.8754, test_loss: 1.0216, test_f1: 0.5008
 epoch: 16, train_loss: 0.8875, test_loss: 0.9476, test_f1: 0.5208
 epoch: 17, train_loss: 0.8771, test_loss: 0.9086, test_f1: 0.5023
 epoch: 18, train_loss: 0.8560, test_loss: 0.9872, test_f1: 0.4976
 epoch: 19, train_loss: 0.8508, test_loss: 1.0095, test_f1: 0.4673
 epoch: 20, train_loss: 0.8572, test_loss: 0.9221, test_f1: 0.5240
 epoch: 21, train_loss: 0.8618, test_loss: 0.9367, test_f1: 0.5404
 epoch: 22, train_loss: 0.8341, test_loss: 1.0057, test_f1: 0.5332
 epoch: 23, train_loss: 0.8404, test_loss: 0.9962, test_f1: 0.5058
 epoch: 24, train_loss: 0.8257, test_loss: 0.9464, test_f1: 0.5467
 epoch: 25, train_loss: 0.8303, test_loss: 0.9784, test_f1: 0.4988
 epoch: 26, train_loss: 0.8308, test_loss: 0.9704, test_f1: 0.5330
 epoch: 27, train_loss: 0.8315, test_loss: 0.9657, test_f1: 0.5313
 epoch: 28, train_loss: 0.8274, test_loss: 1.0056, test_f1: 0.5702
 epoch: 29, train_loss: 0.8189, test_loss: 0.9482, test_f1: 0.5382
 epoch: 30, train_loss: 0.8091, test_loss: 0.9311, test_f1: 0.5773
 epoch: 31, train_loss: 0.8139, test_loss: 0.9550, test_f1: 0.5175
 epoch: 32, train_loss: 0.8058, test_loss: 0.9675, test_f1: 0.5528
 epoch: 33, train_loss: 0.8093, test_loss: 0.9483, test_f1: 0.5288
 epoch: 34, train_loss: 0.8157, test_loss: 0.9953, test_f1: 0.5455
 epoch: 35, train_loss: 0.8061, test_loss: 0.9431, test_f1: 0.5588
 epoch: 36, train_loss: 0.7995, test_loss: 0.9325, test_f1: 0.5320
 epoch: 37, train_loss: 0.8068, test_loss: 0.9360, test_f1: 0.5701
 epoch: 38, train_loss: 0.7937, test_loss: 0.9761, test_f1: 0.5353
 epoch: 39, train_loss: 0.8042, test_loss: 0.8971, test_f1: 0.5992
 epoch: 40, train_loss: 0.8195, test_loss: 0.9681, test_f1: 0.5297
 epoch: 41, train_loss: 0.7754, test_loss: 0.8832, test_f1: 0.5441
 epoch: 42, train_loss: 0.7880, test_loss: 0.9976, test_f1: 0.5652
 epoch: 43, train_loss: 0.7729, test_loss: 0.8771, test_f1: 0.5723
 epoch: 44, train_loss: 0.7801, test_loss: 0.9375, test_f1: 0.5704
 epoch: 45, train_loss: 0.7843, test_loss: 0.9463, test_f1: 0.5019
 epoch: 46, train_loss: 0.7734, test_loss: 0.9198, test_f1: 0.6026
 epoch: 47, train_loss: 0.7709, test_loss: 0.7988, test_f1: 0.5723
 epoch: 48, train_loss: 0.7630, test_loss: 0.9062, test_f1: 0.5923
 epoch: 49, train_loss: 0.7637, test_loss: 0.9239, test_f1: 0.5679
 epoch: 50, train_loss: 0.7647, test_loss: 0.9368, test_f1: 0.5879
 epoch: 51, train_loss: 0.7465, test_loss: 0.9698, test_f1: 0.5750
 epoch: 52, train_loss: 0.7345, test_loss: 0.9313, test_f1: 0.6001
 epoch: 53, train_loss: 0.7233, test_loss: 0.9190, test_f1: 0.6125
 epoch: 54, train_loss: 0.7126, test_loss: 0.8931, test_f1: 0.6083
 epoch: 55, train_loss: 0.7090, test_loss: 0.8800, test_f1: 0.6178
 epoch: 56, train_loss: 0.7183, test_loss: 0.9160, test_f1: 0.6204
 epoch: 57, train_loss: 0.7065, test_loss: 0.9325, test_f1: 0.6100
 epoch: 58, train_loss: 0.7084, test_loss: 0.9139, test_f1: 0.6082
 epoch: 59, train_loss: 0.7236, test_loss: 0.9399, test_f1: 0.5948
 epoch: 60, train_loss: 0.7002, test_loss: 0.9307, test_f1: 0.6160
 epoch: 61, train_loss: 0.6814, test_loss: 0.9259, test_f1: 0.6278
 epoch: 62, train_loss: 0.6908, test_loss: 0.9222, test_f1: 0.6247
 epoch: 63, train_loss: 0.6955, test_loss: 0.9406, test_f1: 0.6114
 epoch: 64, train_loss: 0.6926, test_loss: 0.9414, test_f1: 0.6317
 epoch: 65, train_loss: 0.6906, test_loss: 0.9421, test_f1: 0.6188
 epoch: 66, train_loss: 0.6724, test_loss: 0.9514, test_f1: 0.6144
 epoch: 67, train_loss: 0.6953, test_loss: 0.9161, test_f1: 0.6328
 epoch: 68, train_loss: 0.6872, test_loss: 1.0050, test_f1: 0.6012
 epoch: 69, train_loss: 0.6897, test_loss: 0.9734, test_f1: 0.6171
 epoch: 70, train_loss: 0.6777, test_loss: 0.9292, test_f1: 0.6305
 epoch: 71, train_loss: 0.6742, test_loss: 0.9414, test_f1: 0.6242
 epoch: 72, train_loss: 0.6822, test_loss: 0.9198, test_f1: 0.6040
 epoch: 73, train_loss: 0.6673, test_loss: 0.9382, test_f1: 0.6236
 epoch: 74, train_loss: 0.6713, test_loss: 0.9809, test_f1: 0.6105
 epoch: 75, train_loss: 0.6628, test_loss: 0.9034, test_f1: 0.6024
 epoch: 76, train_loss: 0.6717, test_loss: 0.9735, test_f1: 0.6177
 epoch: 77, train_loss: 0.6691, test_loss: 0.9144, test_f1: 0.6266
 epoch: 78, train_loss: 0.6773, test_loss: 0.9165, test_f1: 0.6157
 epoch: 79, train_loss: 0.6747, test_loss: 0.9333, test_f1: 0.6286
 epoch: 80, train_loss: 0.6883, test_loss: 0.9289, test_f1: 0.6043
 epoch: 81, train_loss: 0.6751, test_loss: 0.9228, test_f1: 0.6037
 epoch: 82, train_loss: 0.6696, test_loss: 0.9843, test_f1: 0.6195
 epoch: 83, train_loss: 0.6636, test_loss: 0.9938, test_f1: 0.6383
 epoch: 84, train_loss: 0.6681, test_loss: 0.9806, test_f1: 0.6205
 epoch: 85, train_loss: 0.6650, test_loss: 0.9683, test_f1: 0.6536
 epoch: 86, train_loss: 0.6499, test_loss: 0.9695, test_f1: 0.6001
 epoch: 87, train_loss: 0.6548, test_loss: 1.0135, test_f1: 0.6239
 epoch: 88, train_loss: 0.6501, test_loss: 0.9807, test_f1: 0.6034
 epoch: 89, train_loss: 0.6543, test_loss: 1.0087, test_f1: 0.6182
 epoch: 90, train_loss: 0.6437, test_loss: 0.9166, test_f1: 0.6361
 epoch: 91, train_loss: 0.6439, test_loss: 1.0348, test_f1: 0.6129
 epoch: 92, train_loss: 0.6545, test_loss: 0.9620, test_f1: 0.6182
 epoch: 93, train_loss: 0.6434, test_loss: 0.9958, test_f1: 0.6149
 epoch: 94, train_loss: 0.6431, test_loss: 0.9610, test_f1: 0.6279
 epoch: 95, train_loss: 0.6715, test_loss: 0.9705, test_f1: 0.6649
 epoch: 96, train_loss: 0.6522, test_loss: 0.9510, test_f1: 0.6308
 epoch: 97, train_loss: 0.6483, test_loss: 0.9182, test_f1: 0.6588
 epoch: 98, train_loss: 0.6347, test_loss: 0.9083, test_f1: 0.6587
 epoch: 99, train_loss: 0.6452, test_loss: 0.9346, test_f1: 0.6412
##################ITERATION #4 ****************************************
 epoch: 0, train_loss: 1.2124, test_loss: 1.0533, test_f1: 0.4291
 epoch: 1, train_loss: 1.0291, test_loss: 1.0855, test_f1: 0.4329
 epoch: 2, train_loss: 0.9924, test_loss: 1.0049, test_f1: 0.4646
 epoch: 3, train_loss: 0.9734, test_loss: 0.9488, test_f1: 0.5174
 epoch: 4, train_loss: 0.9604, test_loss: 1.0241, test_f1: 0.4683
 epoch: 5, train_loss: 0.9422, test_loss: 1.0232, test_f1: 0.4924
 epoch: 6, train_loss: 0.9570, test_loss: 0.9712, test_f1: 0.4891
 epoch: 7, train_loss: 0.9386, test_loss: 0.9764, test_f1: 0.4982
 epoch: 8, train_loss: 0.9379, test_loss: 0.9677, test_f1: 0.4988
 epoch: 9, train_loss: 0.9120, test_loss: 0.9834, test_f1: 0.4748
 epoch: 10, train_loss: 0.9089, test_loss: 1.0371, test_f1: 0.4943
 epoch: 11, train_loss: 0.9172, test_loss: 0.9784, test_f1: 0.5048
 epoch: 12, train_loss: 0.8896, test_loss: 1.0391, test_f1: 0.5489
 epoch: 13, train_loss: 0.8898, test_loss: 0.9811, test_f1: 0.5598
 epoch: 14, train_loss: 0.9088, test_loss: 1.0477, test_f1: 0.4556
 epoch: 15, train_loss: 0.9093, test_loss: 0.9961, test_f1: 0.5268
 epoch: 16, train_loss: 0.8952, test_loss: 0.9771, test_f1: 0.5358
 epoch: 17, train_loss: 0.8725, test_loss: 1.0082, test_f1: 0.4750
 epoch: 18, train_loss: 0.8621, test_loss: 0.9934, test_f1: 0.5386
 epoch: 19, train_loss: 0.8682, test_loss: 0.9809, test_f1: 0.5497
 epoch: 20, train_loss: 0.8643, test_loss: 0.9817, test_f1: 0.4940
 epoch: 21, train_loss: 0.8484, test_loss: 1.0169, test_f1: 0.4990
 epoch: 22, train_loss: 0.8536, test_loss: 1.1651, test_f1: 0.4538
 epoch: 23, train_loss: 0.8537, test_loss: 1.0440, test_f1: 0.4975
 epoch: 24, train_loss: 0.8540, test_loss: 0.9616, test_f1: 0.5004
 epoch: 25, train_loss: 0.8629, test_loss: 1.0177, test_f1: 0.5621
 epoch: 26, train_loss: 0.8447, test_loss: 1.0267, test_f1: 0.5274
 epoch: 27, train_loss: 0.8627, test_loss: 0.9939, test_f1: 0.5405
 epoch: 28, train_loss: 0.8427, test_loss: 0.9820, test_f1: 0.5525
 epoch: 29, train_loss: 0.8306, test_loss: 0.9650, test_f1: 0.6115
 epoch: 30, train_loss: 0.8329, test_loss: 0.9842, test_f1: 0.5526
 epoch: 31, train_loss: 0.8379, test_loss: 0.9618, test_f1: 0.5756
 epoch: 32, train_loss: 0.8227, test_loss: 1.0104, test_f1: 0.5675
 epoch: 33, train_loss: 0.8236, test_loss: 1.0390, test_f1: 0.5658
 epoch: 34, train_loss: 0.8231, test_loss: 1.0347, test_f1: 0.5207
 epoch: 35, train_loss: 0.8153, test_loss: 1.0608, test_f1: 0.5241
 epoch: 36, train_loss: 0.8099, test_loss: 0.9681, test_f1: 0.6173
 epoch: 37, train_loss: 0.8156, test_loss: 1.1096, test_f1: 0.5122
 epoch: 38, train_loss: 0.8298, test_loss: 1.0131, test_f1: 0.5300
 epoch: 39, train_loss: 0.7973, test_loss: 1.0145, test_f1: 0.5845
 epoch: 40, train_loss: 0.7962, test_loss: 0.9832, test_f1: 0.5669
 epoch: 41, train_loss: 0.8122, test_loss: 1.0042, test_f1: 0.5612
 epoch: 42, train_loss: 0.7918, test_loss: 1.0073, test_f1: 0.5177
 epoch: 43, train_loss: 0.7971, test_loss: 0.9456, test_f1: 0.5786
 epoch: 44, train_loss: 0.7887, test_loss: 1.0035, test_f1: 0.6037
 epoch: 45, train_loss: 0.7823, test_loss: 0.9990, test_f1: 0.5252
 epoch: 46, train_loss: 0.7802, test_loss: 1.1215, test_f1: 0.5757
 epoch: 47, train_loss: 0.7841, test_loss: 1.0180, test_f1: 0.5921
 epoch: 48, train_loss: 0.7773, test_loss: 1.0963, test_f1: 0.5261
 epoch: 49, train_loss: 0.7900, test_loss: 0.9817, test_f1: 0.5803
 epoch: 50, train_loss: 0.7730, test_loss: 1.1067, test_f1: 0.6061
 epoch: 51, train_loss: 0.7319, test_loss: 1.0715, test_f1: 0.6024
 epoch: 52, train_loss: 0.7387, test_loss: 1.1044, test_f1: 0.5591
 epoch: 53, train_loss: 0.7204, test_loss: 1.0585, test_f1: 0.5835
 epoch: 54, train_loss: 0.7362, test_loss: 1.0844, test_f1: 0.6275
 epoch: 55, train_loss: 0.7160, test_loss: 1.0273, test_f1: 0.6091
 epoch: 56, train_loss: 0.7136, test_loss: 1.0924, test_f1: 0.6126
 epoch: 57, train_loss: 0.7185, test_loss: 1.0333, test_f1: 0.5797
 epoch: 58, train_loss: 0.7046, test_loss: 1.0643, test_f1: 0.6006
 epoch: 59, train_loss: 0.6976, test_loss: 1.1460, test_f1: 0.6288
 epoch: 60, train_loss: 0.6911, test_loss: 1.1260, test_f1: 0.5851
 epoch: 61, train_loss: 0.6854, test_loss: 1.1543, test_f1: 0.6306
 epoch: 62, train_loss: 0.6957, test_loss: 1.1761, test_f1: 0.6109
 epoch: 63, train_loss: 0.6883, test_loss: 1.1423, test_f1: 0.6121
 epoch: 64, train_loss: 0.6877, test_loss: 1.1242, test_f1: 0.6101
 epoch: 65, train_loss: 0.6830, test_loss: 1.1545, test_f1: 0.5870
 epoch: 66, train_loss: 0.6901, test_loss: 1.2136, test_f1: 0.6161
 epoch: 67, train_loss: 0.6832, test_loss: 1.1078, test_f1: 0.6634
 epoch: 68, train_loss: 0.6806, test_loss: 1.1583, test_f1: 0.6330
 epoch: 69, train_loss: 0.6668, test_loss: 1.2035, test_f1: 0.6200
 epoch: 70, train_loss: 0.6902, test_loss: 1.0888, test_f1: 0.6288
 epoch: 71, train_loss: 0.6690, test_loss: 1.1862, test_f1: 0.6323
 epoch: 72, train_loss: 0.6802, test_loss: 1.1883, test_f1: 0.6331
 epoch: 73, train_loss: 0.6926, test_loss: 1.0957, test_f1: 0.6323
 epoch: 74, train_loss: 0.6876, test_loss: 1.1566, test_f1: 0.6527
 epoch: 75, train_loss: 0.6790, test_loss: 1.1876, test_f1: 0.6144
 epoch: 76, train_loss: 0.6642, test_loss: 1.1681, test_f1: 0.6278
 epoch: 77, train_loss: 0.6910, test_loss: 1.1750, test_f1: 0.6310
 epoch: 78, train_loss: 0.6707, test_loss: 1.1263, test_f1: 0.6273
 epoch: 79, train_loss: 0.6771, test_loss: 1.1502, test_f1: 0.6629
 epoch: 80, train_loss: 0.6771, test_loss: 1.1643, test_f1: 0.6209
 epoch: 81, train_loss: 0.6584, test_loss: 1.2450, test_f1: 0.6048
 epoch: 82, train_loss: 0.6505, test_loss: 1.2395, test_f1: 0.6001
 epoch: 83, train_loss: 0.6603, test_loss: 1.2225, test_f1: 0.6381
 epoch: 84, train_loss: 0.6636, test_loss: 1.2117, test_f1: 0.6159
 epoch: 85, train_loss: 0.6526, test_loss: 1.2820, test_f1: 0.6606
 epoch: 86, train_loss: 0.6469, test_loss: 1.2698, test_f1: 0.6125
 epoch: 87, train_loss: 0.6389, test_loss: 1.2851, test_f1: 0.6194
 epoch: 88, train_loss: 0.6521, test_loss: 1.2455, test_f1: 0.6445
 epoch: 89, train_loss: 0.6529, test_loss: 1.2619, test_f1: 0.6289
 epoch: 90, train_loss: 0.6368, test_loss: 1.3393, test_f1: 0.6491
 epoch: 91, train_loss: 0.6379, test_loss: 1.2196, test_f1: 0.6516
 epoch: 92, train_loss: 0.6395, test_loss: 1.2466, test_f1: 0.6562
 epoch: 93, train_loss: 0.6269, test_loss: 1.3010, test_f1: 0.5772
 epoch: 94, train_loss: 0.6355, test_loss: 1.2340, test_f1: 0.6313
 epoch: 95, train_loss: 0.6208, test_loss: 1.2779, test_f1: 0.6487
 epoch: 96, train_loss: 0.6256, test_loss: 1.3246, test_f1: 0.6231
 epoch: 97, train_loss: 0.6297, test_loss: 1.2427, test_f1: 0.6384
 epoch: 98, train_loss: 0.6361, test_loss: 1.4011, test_f1: 0.6209
 epoch: 99, train_loss: 0.6273, test_loss: 1.2724, test_f1: 0.6112
##################ITERATION #5 ****************************************
 epoch: 0, train_loss: 1.1736, test_loss: 1.0466, test_f1: 0.4396
 epoch: 1, train_loss: 1.0350, test_loss: 0.9902, test_f1: 0.5027
 epoch: 2, train_loss: 0.9698, test_loss: 1.0268, test_f1: 0.5103
 epoch: 3, train_loss: 0.9673, test_loss: 0.9964, test_f1: 0.4553
 epoch: 4, train_loss: 0.9507, test_loss: 1.0631, test_f1: 0.4506
 epoch: 5, train_loss: 0.9375, test_loss: 0.9937, test_f1: 0.5033
 epoch: 6, train_loss: 0.9333, test_loss: 0.9497, test_f1: 0.5076
 epoch: 7, train_loss: 0.9402, test_loss: 1.0424, test_f1: 0.5223
 epoch: 8, train_loss: 0.9353, test_loss: 1.0212, test_f1: 0.5036
 epoch: 9, train_loss: 0.9117, test_loss: 0.9800, test_f1: 0.4757
 epoch: 10, train_loss: 0.9061, test_loss: 0.9892, test_f1: 0.4837
 epoch: 11, train_loss: 0.8913, test_loss: 1.0234, test_f1: 0.4803
 epoch: 12, train_loss: 0.8862, test_loss: 0.9971, test_f1: 0.4955
 epoch: 13, train_loss: 0.8906, test_loss: 0.9982, test_f1: 0.4847
 epoch: 14, train_loss: 0.8790, test_loss: 1.0780, test_f1: 0.5117
 epoch: 15, train_loss: 0.8819, test_loss: 0.9643, test_f1: 0.5923
 epoch: 16, train_loss: 0.8765, test_loss: 0.9940, test_f1: 0.5317
 epoch: 17, train_loss: 0.8697, test_loss: 1.0068, test_f1: 0.5073
 epoch: 18, train_loss: 0.8479, test_loss: 0.9266, test_f1: 0.5718
 epoch: 19, train_loss: 0.8541, test_loss: 0.9778, test_f1: 0.5221
 epoch: 20, train_loss: 0.8490, test_loss: 0.9468, test_f1: 0.5943
 epoch: 21, train_loss: 0.8420, test_loss: 1.0014, test_f1: 0.4977
 epoch: 22, train_loss: 0.8363, test_loss: 0.9448, test_f1: 0.5141
 epoch: 23, train_loss: 0.8432, test_loss: 0.9528, test_f1: 0.5523
 epoch: 24, train_loss: 0.8240, test_loss: 0.9657, test_f1: 0.6076
 epoch: 25, train_loss: 0.8273, test_loss: 0.9396, test_f1: 0.5597
 epoch: 26, train_loss: 0.8240, test_loss: 0.9831, test_f1: 0.5988
 epoch: 27, train_loss: 0.8223, test_loss: 1.0838, test_f1: 0.5242
 epoch: 28, train_loss: 0.8476, test_loss: 0.9623, test_f1: 0.5426
 epoch: 29, train_loss: 0.8135, test_loss: 0.9432, test_f1: 0.6064
 epoch: 30, train_loss: 0.7981, test_loss: 1.0758, test_f1: 0.5167
 epoch: 31, train_loss: 0.8269, test_loss: 0.9726, test_f1: 0.5425
 epoch: 32, train_loss: 0.8147, test_loss: 1.0213, test_f1: 0.5774
 epoch: 33, train_loss: 0.8154, test_loss: 0.9720, test_f1: 0.5473
 epoch: 34, train_loss: 0.8036, test_loss: 0.8999, test_f1: 0.5963
 epoch: 35, train_loss: 0.7905, test_loss: 0.9604, test_f1: 0.5698
 epoch: 36, train_loss: 0.7854, test_loss: 1.0448, test_f1: 0.5172
 epoch: 37, train_loss: 0.7974, test_loss: 0.9287, test_f1: 0.6030
 epoch: 38, train_loss: 0.7932, test_loss: 0.9553, test_f1: 0.5775
 epoch: 39, train_loss: 0.7946, test_loss: 0.9871, test_f1: 0.6198
 epoch: 40, train_loss: 0.7838, test_loss: 0.9614, test_f1: 0.5663
 epoch: 41, train_loss: 0.7636, test_loss: 1.0626, test_f1: 0.5794
 epoch: 42, train_loss: 0.7627, test_loss: 0.9528, test_f1: 0.6000
 epoch: 43, train_loss: 0.7896, test_loss: 0.8996, test_f1: 0.6035
 epoch: 44, train_loss: 0.7737, test_loss: 1.0054, test_f1: 0.5812
 epoch: 45, train_loss: 0.7740, test_loss: 1.0678, test_f1: 0.5664
 epoch: 46, train_loss: 0.7706, test_loss: 0.9941, test_f1: 0.6061
 epoch: 47, train_loss: 0.7547, test_loss: 0.9998, test_f1: 0.5979
 epoch: 48, train_loss: 0.7548, test_loss: 0.9968, test_f1: 0.5880
 epoch: 49, train_loss: 0.7536, test_loss: 1.0286, test_f1: 0.5790
 epoch: 50, train_loss: 0.7659, test_loss: 0.9923, test_f1: 0.5758
 epoch: 51, train_loss: 0.7158, test_loss: 0.9931, test_f1: 0.5891
 epoch: 52, train_loss: 0.6973, test_loss: 1.0650, test_f1: 0.6056
 epoch: 53, train_loss: 0.7139, test_loss: 0.9854, test_f1: 0.6108
 epoch: 54, train_loss: 0.6967, test_loss: 1.0201, test_f1: 0.5978
 epoch: 55, train_loss: 0.7038, test_loss: 0.9872, test_f1: 0.6114
 epoch: 56, train_loss: 0.7005, test_loss: 0.9686, test_f1: 0.6170
 epoch: 57, train_loss: 0.6835, test_loss: 1.0420, test_f1: 0.6399
 epoch: 58, train_loss: 0.6827, test_loss: 0.9866, test_f1: 0.6120
 epoch: 59, train_loss: 0.6805, test_loss: 1.0520, test_f1: 0.6138
 epoch: 60, train_loss: 0.6743, test_loss: 1.0158, test_f1: 0.6292
 epoch: 61, train_loss: 0.6839, test_loss: 1.0242, test_f1: 0.6009
 epoch: 62, train_loss: 0.6765, test_loss: 1.0534, test_f1: 0.6221
 epoch: 63, train_loss: 0.6909, test_loss: 1.0443, test_f1: 0.6327
 epoch: 64, train_loss: 0.6706, test_loss: 0.9647, test_f1: 0.6433
 epoch: 65, train_loss: 0.6701, test_loss: 1.0110, test_f1: 0.6046
 epoch: 66, train_loss: 0.6530, test_loss: 1.0440, test_f1: 0.6512
 epoch: 67, train_loss: 0.6608, test_loss: 1.0546, test_f1: 0.6124
 epoch: 68, train_loss: 0.6657, test_loss: 1.0419, test_f1: 0.6131
 epoch: 69, train_loss: 0.6721, test_loss: 1.0896, test_f1: 0.6149
 epoch: 70, train_loss: 0.6660, test_loss: 1.0138, test_f1: 0.6426
 epoch: 71, train_loss: 0.6473, test_loss: 1.1119, test_f1: 0.6443
 epoch: 72, train_loss: 0.6542, test_loss: 1.0397, test_f1: 0.6236
 epoch: 73, train_loss: 0.6516, test_loss: 1.0845, test_f1: 0.6543
 epoch: 74, train_loss: 0.6703, test_loss: 1.0108, test_f1: 0.6294
 epoch: 75, train_loss: 0.6640, test_loss: 1.0981, test_f1: 0.6057
 epoch: 76, train_loss: 0.6675, test_loss: 1.0929, test_f1: 0.6124
 epoch: 77, train_loss: 0.6694, test_loss: 1.1099, test_f1: 0.6189
 epoch: 78, train_loss: 0.6404, test_loss: 0.9908, test_f1: 0.6482
 epoch: 79, train_loss: 0.6456, test_loss: 1.0743, test_f1: 0.6594
 epoch: 80, train_loss: 0.6286, test_loss: 1.0689, test_f1: 0.6519
 epoch: 81, train_loss: 0.6358, test_loss: 1.1724, test_f1: 0.6162
 epoch: 82, train_loss: 0.6676, test_loss: 1.0947, test_f1: 0.6409
 epoch: 83, train_loss: 0.6296, test_loss: 1.0603, test_f1: 0.6580
 epoch: 84, train_loss: 0.6260, test_loss: 1.0530, test_f1: 0.6537
 epoch: 85, train_loss: 0.6278, test_loss: 1.0356, test_f1: 0.6360
 epoch: 86, train_loss: 0.6254, test_loss: 1.1238, test_f1: 0.6362
 epoch: 87, train_loss: 0.6293, test_loss: 1.0322, test_f1: 0.6447
 epoch: 88, train_loss: 0.6408, test_loss: 1.0966, test_f1: 0.6463
 epoch: 89, train_loss: 0.6445, test_loss: 1.0930, test_f1: 0.6406
 epoch: 90, train_loss: 0.6312, test_loss: 1.0447, test_f1: 0.6409
 epoch: 91, train_loss: 0.6183, test_loss: 1.0298, test_f1: 0.6629
 epoch: 92, train_loss: 0.6209, test_loss: 1.1527, test_f1: 0.5781
 epoch: 93, train_loss: 0.6907, test_loss: 1.0844, test_f1: 0.6487
 epoch: 94, train_loss: 0.6491, test_loss: 1.0972, test_f1: 0.6162
 epoch: 95, train_loss: 0.6525, test_loss: 1.1432, test_f1: 0.6326
 epoch: 96, train_loss: 0.6250, test_loss: 1.0921, test_f1: 0.6610
 epoch: 97, train_loss: 0.6177, test_loss: 1.0984, test_f1: 0.6674
 epoch: 98, train_loss: 0.6163, test_loss: 1.1092, test_f1: 0.6443
 epoch: 99, train_loss: 0.6293, test_loss: 1.0977, test_f1: 0.6398
##################ITERATION #6 ****************************************
 epoch: 0, train_loss: 1.1725, test_loss: 1.0630, test_f1: 0.4195
 epoch: 1, train_loss: 1.0326, test_loss: 1.0370, test_f1: 0.4432
 epoch: 2, train_loss: 1.0017, test_loss: 1.0989, test_f1: 0.4307
 epoch: 3, train_loss: 0.9607, test_loss: 0.9880, test_f1: 0.4711
 epoch: 4, train_loss: 0.9560, test_loss: 0.9898, test_f1: 0.4795
 epoch: 5, train_loss: 0.9401, test_loss: 0.9944, test_f1: 0.4521
 epoch: 6, train_loss: 0.9364, test_loss: 0.9415, test_f1: 0.4908
 epoch: 7, train_loss: 0.9247, test_loss: 0.9539, test_f1: 0.4978
 epoch: 8, train_loss: 0.9057, test_loss: 0.9689, test_f1: 0.4802
 epoch: 9, train_loss: 0.8896, test_loss: 1.0206, test_f1: 0.5035
 epoch: 10, train_loss: 0.8876, test_loss: 1.1637, test_f1: 0.4690
 epoch: 11, train_loss: 0.8966, test_loss: 0.8774, test_f1: 0.5119
 epoch: 12, train_loss: 0.8847, test_loss: 0.9862, test_f1: 0.5204
 epoch: 13, train_loss: 0.8786, test_loss: 0.9918, test_f1: 0.5073
 epoch: 14, train_loss: 0.8825, test_loss: 0.9521, test_f1: 0.5859
 epoch: 15, train_loss: 0.8769, test_loss: 0.9335, test_f1: 0.4951
 epoch: 16, train_loss: 0.8664, test_loss: 1.1661, test_f1: 0.4847
 epoch: 17, train_loss: 0.8762, test_loss: 0.9419, test_f1: 0.5131
 epoch: 18, train_loss: 0.8449, test_loss: 0.9541, test_f1: 0.5350
 epoch: 19, train_loss: 0.8470, test_loss: 0.9557, test_f1: 0.5439
 epoch: 20, train_loss: 0.8473, test_loss: 1.0364, test_f1: 0.4980
 epoch: 21, train_loss: 0.8411, test_loss: 0.9581, test_f1: 0.5621
 epoch: 22, train_loss: 0.8302, test_loss: 1.0481, test_f1: 0.5572
 epoch: 23, train_loss: 0.8356, test_loss: 1.0154, test_f1: 0.5148
 epoch: 24, train_loss: 0.8401, test_loss: 0.9510, test_f1: 0.5478
 epoch: 25, train_loss: 0.8370, test_loss: 0.9743, test_f1: 0.5421
 epoch: 26, train_loss: 0.8321, test_loss: 0.9395, test_f1: 0.5631
 epoch: 27, train_loss: 0.8264, test_loss: 0.9457, test_f1: 0.5386
 epoch: 28, train_loss: 0.8149, test_loss: 0.9921, test_f1: 0.5284
 epoch: 29, train_loss: 0.8164, test_loss: 0.9434, test_f1: 0.5420
 epoch: 30, train_loss: 0.8028, test_loss: 1.0330, test_f1: 0.5635
 epoch: 31, train_loss: 0.8191, test_loss: 0.9818, test_f1: 0.5890
 epoch: 32, train_loss: 0.8116, test_loss: 0.9640, test_f1: 0.5909
 epoch: 33, train_loss: 0.8113, test_loss: 0.9487, test_f1: 0.5935
 epoch: 34, train_loss: 0.7916, test_loss: 0.9896, test_f1: 0.5693
 epoch: 35, train_loss: 0.7944, test_loss: 0.9562, test_f1: 0.6140
 epoch: 36, train_loss: 0.7833, test_loss: 0.9164, test_f1: 0.6054
 epoch: 37, train_loss: 0.7898, test_loss: 1.0109, test_f1: 0.5802
 epoch: 38, train_loss: 0.7668, test_loss: 0.9754, test_f1: 0.5877
 epoch: 39, train_loss: 0.7899, test_loss: 0.9492, test_f1: 0.5779
 epoch: 40, train_loss: 0.7733, test_loss: 0.9370, test_f1: 0.5728
 epoch: 41, train_loss: 0.7952, test_loss: 0.9694, test_f1: 0.6035
 epoch: 42, train_loss: 0.7605, test_loss: 0.9912, test_f1: 0.6245
 epoch: 43, train_loss: 0.7651, test_loss: 0.9385, test_f1: 0.6084
 epoch: 44, train_loss: 0.7780, test_loss: 0.9245, test_f1: 0.5767
 epoch: 45, train_loss: 0.7546, test_loss: 0.9679, test_f1: 0.5690
 epoch: 46, train_loss: 0.7399, test_loss: 0.9770, test_f1: 0.5854
 epoch: 47, train_loss: 0.7707, test_loss: 0.9399, test_f1: 0.6075
 epoch: 48, train_loss: 0.7619, test_loss: 0.9564, test_f1: 0.6263
 epoch: 49, train_loss: 0.7470, test_loss: 1.0017, test_f1: 0.5933
 epoch: 50, train_loss: 0.7485, test_loss: 1.0140, test_f1: 0.6243
 epoch: 51, train_loss: 0.7415, test_loss: 0.9628, test_f1: 0.6127
 epoch: 52, train_loss: 0.7107, test_loss: 0.8802, test_f1: 0.6379
 epoch: 53, train_loss: 0.7081, test_loss: 0.9274, test_f1: 0.6491
 epoch: 54, train_loss: 0.6990, test_loss: 0.8855, test_f1: 0.6357
 epoch: 55, train_loss: 0.6935, test_loss: 0.8987, test_f1: 0.6248
 epoch: 56, train_loss: 0.6924, test_loss: 0.8658, test_f1: 0.6372
 epoch: 57, train_loss: 0.6986, test_loss: 0.8832, test_f1: 0.6592
 epoch: 58, train_loss: 0.6833, test_loss: 0.8905, test_f1: 0.6318
 epoch: 59, train_loss: 0.6885, test_loss: 0.9541, test_f1: 0.6374
 epoch: 60, train_loss: 0.6917, test_loss: 0.9642, test_f1: 0.6484
 epoch: 61, train_loss: 0.6737, test_loss: 0.9708, test_f1: 0.6422
 epoch: 62, train_loss: 0.6743, test_loss: 0.9365, test_f1: 0.6447
 epoch: 63, train_loss: 0.6774, test_loss: 0.9383, test_f1: 0.6110
 epoch: 64, train_loss: 0.6644, test_loss: 0.9384, test_f1: 0.6511
 epoch: 65, train_loss: 0.6643, test_loss: 0.9509, test_f1: 0.6348
 epoch: 66, train_loss: 0.6852, test_loss: 0.9315, test_f1: 0.5953
 epoch: 67, train_loss: 0.6657, test_loss: 0.9769, test_f1: 0.6612
 epoch: 68, train_loss: 0.6818, test_loss: 1.0025, test_f1: 0.6359
 epoch: 69, train_loss: 0.6639, test_loss: 0.9771, test_f1: 0.6422
 epoch: 70, train_loss: 0.6632, test_loss: 0.9454, test_f1: 0.6681
 epoch: 71, train_loss: 0.6524, test_loss: 0.9169, test_f1: 0.6424
 epoch: 72, train_loss: 0.6581, test_loss: 0.9224, test_f1: 0.6460
 epoch: 73, train_loss: 0.6659, test_loss: 0.9755, test_f1: 0.6698
 epoch: 74, train_loss: 0.6660, test_loss: 0.9485, test_f1: 0.6781
 epoch: 75, train_loss: 0.6420, test_loss: 0.9503, test_f1: 0.6580
 epoch: 76, train_loss: 0.6468, test_loss: 0.9846, test_f1: 0.6660
 epoch: 77, train_loss: 0.6436, test_loss: 1.0278, test_f1: 0.6615
 epoch: 78, train_loss: 0.6375, test_loss: 0.9198, test_f1: 0.6538
 epoch: 79, train_loss: 0.6452, test_loss: 1.0043, test_f1: 0.6065
 epoch: 80, train_loss: 0.6258, test_loss: 1.0539, test_f1: 0.6231
 epoch: 81, train_loss: 0.6398, test_loss: 0.9565, test_f1: 0.6690
 epoch: 82, train_loss: 0.6341, test_loss: 0.9118, test_f1: 0.6558
 epoch: 83, train_loss: 0.6381, test_loss: 1.0019, test_f1: 0.6552
 epoch: 84, train_loss: 0.6382, test_loss: 0.8980, test_f1: 0.6665
 epoch: 85, train_loss: 0.6282, test_loss: 0.9526, test_f1: 0.6834
 epoch: 86, train_loss: 0.6273, test_loss: 1.0350, test_f1: 0.6220
 epoch: 87, train_loss: 0.6430, test_loss: 0.9421, test_f1: 0.6659
 epoch: 88, train_loss: 0.6168, test_loss: 1.0180, test_f1: 0.6470
 epoch: 89, train_loss: 0.6106, test_loss: 1.0161, test_f1: 0.6724
 epoch: 90, train_loss: 0.6106, test_loss: 1.0144, test_f1: 0.6693
 epoch: 91, train_loss: 0.6238, test_loss: 1.0031, test_f1: 0.6645
 epoch: 92, train_loss: 0.6193, test_loss: 1.0175, test_f1: 0.6210
 epoch: 93, train_loss: 0.6198, test_loss: 1.1190, test_f1: 0.6648
 epoch: 94, train_loss: 0.6106, test_loss: 1.1899, test_f1: 0.6586
 epoch: 95, train_loss: 0.5956, test_loss: 1.0479, test_f1: 0.6461
 epoch: 96, train_loss: 0.6201, test_loss: 0.9885, test_f1: 0.6603
 epoch: 97, train_loss: 0.6253, test_loss: 1.0036, test_f1: 0.6558
 epoch: 98, train_loss: 0.6001, test_loss: 1.0233, test_f1: 0.6612
 epoch: 99, train_loss: 0.5837, test_loss: 1.0282, test_f1: 0.6510
##################ITERATION #7 ****************************************
 epoch: 0, train_loss: 1.1740, test_loss: 0.9862, test_f1: 0.4647
 epoch: 1, train_loss: 1.0134, test_loss: 0.9848, test_f1: 0.4963
 epoch: 2, train_loss: 0.9764, test_loss: 1.0183, test_f1: 0.4845
 epoch: 3, train_loss: 0.9708, test_loss: 1.0480, test_f1: 0.4784
 epoch: 4, train_loss: 0.9691, test_loss: 0.9693, test_f1: 0.4833
 epoch: 5, train_loss: 0.9596, test_loss: 0.9858, test_f1: 0.4819
 epoch: 6, train_loss: 0.9443, test_loss: 0.9684, test_f1: 0.4881
 epoch: 7, train_loss: 0.9597, test_loss: 0.9832, test_f1: 0.5259
 epoch: 8, train_loss: 0.9611, test_loss: 1.0066, test_f1: 0.4901
 epoch: 9, train_loss: 0.9195, test_loss: 0.9745, test_f1: 0.5158
 epoch: 10, train_loss: 0.9093, test_loss: 1.0821, test_f1: 0.4618
 epoch: 11, train_loss: 0.9156, test_loss: 1.0363, test_f1: 0.5164
 epoch: 12, train_loss: 0.8942, test_loss: 1.0068, test_f1: 0.5267
 epoch: 13, train_loss: 0.9030, test_loss: 1.0014, test_f1: 0.4820
 epoch: 14, train_loss: 0.8679, test_loss: 1.0760, test_f1: 0.5258
 epoch: 15, train_loss: 0.8770, test_loss: 0.9744, test_f1: 0.5744
 epoch: 16, train_loss: 0.8614, test_loss: 1.0462, test_f1: 0.5114
 epoch: 17, train_loss: 0.8545, test_loss: 1.0207, test_f1: 0.5110
 epoch: 18, train_loss: 0.8473, test_loss: 0.9954, test_f1: 0.5288
 epoch: 19, train_loss: 0.8466, test_loss: 1.0428, test_f1: 0.5485
 epoch: 20, train_loss: 0.8412, test_loss: 0.9805, test_f1: 0.5631
 epoch: 21, train_loss: 0.8359, test_loss: 0.9201, test_f1: 0.5679
 epoch: 22, train_loss: 0.8529, test_loss: 0.9627, test_f1: 0.5716
 epoch: 23, train_loss: 0.8281, test_loss: 0.9794, test_f1: 0.5888
 epoch: 24, train_loss: 0.8099, test_loss: 0.9519, test_f1: 0.6127
 epoch: 25, train_loss: 0.8297, test_loss: 0.9690, test_f1: 0.5439
 epoch: 26, train_loss: 0.8421, test_loss: 0.9510, test_f1: 0.5521
 epoch: 27, train_loss: 0.8138, test_loss: 0.9222, test_f1: 0.5879
 epoch: 28, train_loss: 0.7966, test_loss: 0.9560, test_f1: 0.5577
 epoch: 29, train_loss: 0.7924, test_loss: 1.0139, test_f1: 0.5277
 epoch: 30, train_loss: 0.8024, test_loss: 0.9566, test_f1: 0.5612
 epoch: 31, train_loss: 0.8139, test_loss: 0.9367, test_f1: 0.6063
 epoch: 32, train_loss: 0.7979, test_loss: 1.0236, test_f1: 0.5299
 epoch: 33, train_loss: 0.8010, test_loss: 0.9188, test_f1: 0.6263
 epoch: 34, train_loss: 0.7927, test_loss: 0.9883, test_f1: 0.5558
 epoch: 35, train_loss: 0.7972, test_loss: 0.9674, test_f1: 0.5661
 epoch: 36, train_loss: 0.7852, test_loss: 0.9837, test_f1: 0.5710
 epoch: 37, train_loss: 0.8073, test_loss: 0.9806, test_f1: 0.5619
 epoch: 38, train_loss: 0.7991, test_loss: 0.9407, test_f1: 0.5633
 epoch: 39, train_loss: 0.7808, test_loss: 1.0003, test_f1: 0.5840
 epoch: 40, train_loss: 0.7836, test_loss: 0.9843, test_f1: 0.5646
 epoch: 41, train_loss: 0.7945, test_loss: 0.9413, test_f1: 0.6275
 epoch: 42, train_loss: 0.7790, test_loss: 1.0662, test_f1: 0.5710
 epoch: 43, train_loss: 0.7569, test_loss: 0.9520, test_f1: 0.5703
 epoch: 44, train_loss: 0.7674, test_loss: 1.0684, test_f1: 0.6047
 epoch: 45, train_loss: 0.7594, test_loss: 0.9274, test_f1: 0.5997
 epoch: 46, train_loss: 0.7409, test_loss: 1.0107, test_f1: 0.6047
 epoch: 47, train_loss: 0.7708, test_loss: 0.9524, test_f1: 0.6231
 epoch: 48, train_loss: 0.7265, test_loss: 0.9759, test_f1: 0.5847
 epoch: 49, train_loss: 0.7404, test_loss: 1.0150, test_f1: 0.6184
 epoch: 50, train_loss: 0.7295, test_loss: 0.9238, test_f1: 0.5960
 epoch: 51, train_loss: 0.7234, test_loss: 0.9424, test_f1: 0.6395
 epoch: 52, train_loss: 0.6965, test_loss: 0.9366, test_f1: 0.6363
 epoch: 53, train_loss: 0.6952, test_loss: 0.9079, test_f1: 0.6899
 epoch: 54, train_loss: 0.6868, test_loss: 0.9381, test_f1: 0.6586
 epoch: 55, train_loss: 0.6795, test_loss: 0.9550, test_f1: 0.6460
 epoch: 56, train_loss: 0.6815, test_loss: 0.9799, test_f1: 0.6547
 epoch: 57, train_loss: 0.6714, test_loss: 0.9371, test_f1: 0.6409
 epoch: 58, train_loss: 0.6868, test_loss: 0.9523, test_f1: 0.6184
 epoch: 59, train_loss: 0.6875, test_loss: 0.9699, test_f1: 0.6496
 epoch: 60, train_loss: 0.6746, test_loss: 0.9939, test_f1: 0.6341
 epoch: 61, train_loss: 0.6767, test_loss: 0.9221, test_f1: 0.6380
 epoch: 62, train_loss: 0.6898, test_loss: 0.9529, test_f1: 0.6447
 epoch: 63, train_loss: 0.6644, test_loss: 0.9529, test_f1: 0.6502
 epoch: 64, train_loss: 0.6798, test_loss: 0.9867, test_f1: 0.6244
 epoch: 65, train_loss: 0.6567, test_loss: 0.9492, test_f1: 0.6334
 epoch: 66, train_loss: 0.6708, test_loss: 0.9831, test_f1: 0.6265
 epoch: 67, train_loss: 0.6641, test_loss: 0.9318, test_f1: 0.6142
 epoch: 68, train_loss: 0.6509, test_loss: 0.9621, test_f1: 0.6360
 epoch: 69, train_loss: 0.6427, test_loss: 1.0103, test_f1: 0.6180
 epoch: 70, train_loss: 0.6531, test_loss: 0.9803, test_f1: 0.6301
 epoch: 71, train_loss: 0.6525, test_loss: 1.0585, test_f1: 0.6491
 epoch: 72, train_loss: 0.6577, test_loss: 0.8981, test_f1: 0.6410
 epoch: 73, train_loss: 0.6664, test_loss: 1.0747, test_f1: 0.6362
 epoch: 74, train_loss: 0.6625, test_loss: 1.0100, test_f1: 0.6402
 epoch: 75, train_loss: 0.6389, test_loss: 0.9391, test_f1: 0.6326
 epoch: 76, train_loss: 0.6521, test_loss: 0.9510, test_f1: 0.6472
 epoch: 77, train_loss: 0.6617, test_loss: 1.0701, test_f1: 0.6115
 epoch: 78, train_loss: 0.6192, test_loss: 1.0861, test_f1: 0.6457
 epoch: 79, train_loss: 0.6395, test_loss: 0.9728, test_f1: 0.6477
 epoch: 80, train_loss: 0.6287, test_loss: 1.0019, test_f1: 0.6536
 epoch: 81, train_loss: 0.6467, test_loss: 0.9790, test_f1: 0.6214
 epoch: 82, train_loss: 0.6397, test_loss: 0.9735, test_f1: 0.6540
 epoch: 83, train_loss: 0.6345, test_loss: 1.0257, test_f1: 0.6468
 epoch: 84, train_loss: 0.6494, test_loss: 1.0187, test_f1: 0.6428
 epoch: 85, train_loss: 0.6413, test_loss: 1.0510, test_f1: 0.6258
 epoch: 86, train_loss: 0.6417, test_loss: 0.9374, test_f1: 0.6604
 epoch: 87, train_loss: 0.6358, test_loss: 0.9775, test_f1: 0.6659
 epoch: 88, train_loss: 0.6449, test_loss: 0.9899, test_f1: 0.6640
 epoch: 89, train_loss: 0.6224, test_loss: 0.9384, test_f1: 0.6637
 epoch: 90, train_loss: 0.6294, test_loss: 1.0246, test_f1: 0.6575
 epoch: 91, train_loss: 0.6271, test_loss: 0.9858, test_f1: 0.6745
 epoch: 92, train_loss: 0.6165, test_loss: 1.0311, test_f1: 0.6433
 epoch: 93, train_loss: 0.6152, test_loss: 0.9740, test_f1: 0.6633
 epoch: 94, train_loss: 0.6332, test_loss: 0.9591, test_f1: 0.6518
 epoch: 95, train_loss: 0.6131, test_loss: 0.9650, test_f1: 0.6562
 epoch: 96, train_loss: 0.6122, test_loss: 0.9659, test_f1: 0.6611
 epoch: 97, train_loss: 0.6243, test_loss: 0.9475, test_f1: 0.6587
 epoch: 98, train_loss: 0.6096, test_loss: 1.0136, test_f1: 0.6538
 epoch: 99, train_loss: 0.6141, test_loss: 1.0487, test_f1: 0.6296
##################ITERATION #8 ****************************************
 epoch: 0, train_loss: 1.2035, test_loss: 1.1305, test_f1: 0.4032
 epoch: 1, train_loss: 1.0055, test_loss: 0.9733, test_f1: 0.5113
 epoch: 2, train_loss: 0.9807, test_loss: 0.9854, test_f1: 0.4669
 epoch: 3, train_loss: 0.9516, test_loss: 0.9974, test_f1: 0.4997
 epoch: 4, train_loss: 0.9594, test_loss: 0.9482, test_f1: 0.5044
 epoch: 5, train_loss: 0.9277, test_loss: 0.9241, test_f1: 0.5307
 epoch: 6, train_loss: 0.9236, test_loss: 0.9637, test_f1: 0.5341
 epoch: 7, train_loss: 0.9371, test_loss: 1.0173, test_f1: 0.4987
 epoch: 8, train_loss: 0.9224, test_loss: 0.9824, test_f1: 0.5225
 epoch: 9, train_loss: 0.9122, test_loss: 0.9774, test_f1: 0.4911
 epoch: 10, train_loss: 0.8993, test_loss: 0.9690, test_f1: 0.5122
 epoch: 11, train_loss: 0.8997, test_loss: 0.9765, test_f1: 0.5127
 epoch: 12, train_loss: 0.8940, test_loss: 0.9517, test_f1: 0.4891
 epoch: 13, train_loss: 0.8791, test_loss: 1.0402, test_f1: 0.5180
 epoch: 14, train_loss: 0.9068, test_loss: 1.0284, test_f1: 0.5241
 epoch: 15, train_loss: 0.8768, test_loss: 1.0295, test_f1: 0.5768
 epoch: 16, train_loss: 0.8496, test_loss: 0.9715, test_f1: 0.5357
 epoch: 17, train_loss: 0.8508, test_loss: 1.0341, test_f1: 0.5393
 epoch: 18, train_loss: 0.8751, test_loss: 1.0024, test_f1: 0.5331
 epoch: 19, train_loss: 0.8714, test_loss: 1.0510, test_f1: 0.5384
 epoch: 20, train_loss: 0.8548, test_loss: 0.8902, test_f1: 0.5171
 epoch: 21, train_loss: 0.8492, test_loss: 0.9337, test_f1: 0.5798
 epoch: 22, train_loss: 0.8349, test_loss: 0.9782, test_f1: 0.5229
 epoch: 23, train_loss: 0.8225, test_loss: 0.9708, test_f1: 0.6142
 epoch: 24, train_loss: 0.8414, test_loss: 0.9096, test_f1: 0.5377
 epoch: 25, train_loss: 0.8275, test_loss: 0.9712, test_f1: 0.5354
 epoch: 26, train_loss: 0.8271, test_loss: 0.9259, test_f1: 0.5831
 epoch: 27, train_loss: 0.8099, test_loss: 0.9821, test_f1: 0.5957
 epoch: 28, train_loss: 0.8092, test_loss: 0.9893, test_f1: 0.6030
 epoch: 29, train_loss: 0.8020, test_loss: 0.9477, test_f1: 0.6205
 epoch: 30, train_loss: 0.8113, test_loss: 0.9097, test_f1: 0.5726
 epoch: 31, train_loss: 0.7956, test_loss: 0.9227, test_f1: 0.6241
 epoch: 32, train_loss: 0.7946, test_loss: 0.9244, test_f1: 0.5643
 epoch: 33, train_loss: 0.7770, test_loss: 0.9243, test_f1: 0.5981
 epoch: 34, train_loss: 0.7857, test_loss: 0.9043, test_f1: 0.5676
 epoch: 35, train_loss: 0.7858, test_loss: 0.9488, test_f1: 0.5874
 epoch: 36, train_loss: 0.7952, test_loss: 0.8502, test_f1: 0.5785
 epoch: 37, train_loss: 0.7849, test_loss: 1.1290, test_f1: 0.5431
 epoch: 38, train_loss: 0.8029, test_loss: 0.9280, test_f1: 0.6001
 epoch: 39, train_loss: 0.7734, test_loss: 0.9752, test_f1: 0.5675
 epoch: 40, train_loss: 0.7701, test_loss: 0.9286, test_f1: 0.5824
 epoch: 41, train_loss: 0.7599, test_loss: 0.9611, test_f1: 0.5735
 epoch: 42, train_loss: 0.7631, test_loss: 0.9641, test_f1: 0.5894
 epoch: 43, train_loss: 0.7778, test_loss: 0.9345, test_f1: 0.5953
 epoch: 44, train_loss: 0.7731, test_loss: 0.9036, test_f1: 0.6222
 epoch: 45, train_loss: 0.7696, test_loss: 0.8876, test_f1: 0.6080
 epoch: 46, train_loss: 0.7485, test_loss: 0.8852, test_f1: 0.6486
 epoch: 47, train_loss: 0.7494, test_loss: 0.9372, test_f1: 0.6246
 epoch: 48, train_loss: 0.7504, test_loss: 0.9196, test_f1: 0.5883
 epoch: 49, train_loss: 0.7344, test_loss: 0.9185, test_f1: 0.6129
 epoch: 50, train_loss: 0.7485, test_loss: 0.9526, test_f1: 0.6041
 epoch: 51, train_loss: 0.7452, test_loss: 0.9007, test_f1: 0.5699
 epoch: 52, train_loss: 0.7276, test_loss: 0.9189, test_f1: 0.6440
 epoch: 53, train_loss: 0.7153, test_loss: 0.8897, test_f1: 0.6263
 epoch: 54, train_loss: 0.6901, test_loss: 0.8681, test_f1: 0.6392
 epoch: 55, train_loss: 0.6964, test_loss: 0.8874, test_f1: 0.6373
 epoch: 56, train_loss: 0.7008, test_loss: 0.9540, test_f1: 0.6078
 epoch: 57, train_loss: 0.6904, test_loss: 0.8859, test_f1: 0.6328
 epoch: 58, train_loss: 0.6939, test_loss: 0.8834, test_f1: 0.6214
 epoch: 59, train_loss: 0.6904, test_loss: 0.9874, test_f1: 0.6215
 epoch: 60, train_loss: 0.6709, test_loss: 0.8795, test_f1: 0.6751
 epoch: 61, train_loss: 0.6790, test_loss: 0.9016, test_f1: 0.6107
 epoch: 62, train_loss: 0.6885, test_loss: 0.8971, test_f1: 0.6491
 epoch: 63, train_loss: 0.6916, test_loss: 0.8495, test_f1: 0.6822
 epoch: 64, train_loss: 0.6770, test_loss: 0.8686, test_f1: 0.6250
 epoch: 65, train_loss: 0.6794, test_loss: 0.8613, test_f1: 0.6259
 epoch: 66, train_loss: 0.6814, test_loss: 0.8428, test_f1: 0.6614
 epoch: 67, train_loss: 0.6666, test_loss: 0.8934, test_f1: 0.6308
 epoch: 68, train_loss: 0.6597, test_loss: 0.8850, test_f1: 0.6326
 epoch: 69, train_loss: 0.6723, test_loss: 0.9394, test_f1: 0.6376
 epoch: 70, train_loss: 0.6883, test_loss: 0.9013, test_f1: 0.6394
 epoch: 71, train_loss: 0.6599, test_loss: 0.8954, test_f1: 0.6419
 epoch: 72, train_loss: 0.6730, test_loss: 0.8190, test_f1: 0.6448
 epoch: 73, train_loss: 0.6716, test_loss: 0.8971, test_f1: 0.6695
 epoch: 74, train_loss: 0.6730, test_loss: 0.8721, test_f1: 0.6759
 epoch: 75, train_loss: 0.6700, test_loss: 0.9444, test_f1: 0.6266
 epoch: 76, train_loss: 0.6811, test_loss: 0.8451, test_f1: 0.6470
 epoch: 77, train_loss: 0.6704, test_loss: 0.9173, test_f1: 0.6631
 epoch: 78, train_loss: 0.6435, test_loss: 0.8756, test_f1: 0.6674
 epoch: 79, train_loss: 0.6590, test_loss: 0.9559, test_f1: 0.5936
 epoch: 80, train_loss: 0.6573, test_loss: 0.9392, test_f1: 0.6610
 epoch: 81, train_loss: 0.6527, test_loss: 0.8564, test_f1: 0.6777
 epoch: 82, train_loss: 0.6542, test_loss: 0.8841, test_f1: 0.6642
 epoch: 83, train_loss: 0.6500, test_loss: 0.8704, test_f1: 0.6450
 epoch: 84, train_loss: 0.6499, test_loss: 0.9052, test_f1: 0.6491
 epoch: 85, train_loss: 0.6724, test_loss: 0.9125, test_f1: 0.6530
 epoch: 86, train_loss: 0.6488, test_loss: 0.9490, test_f1: 0.6409
 epoch: 87, train_loss: 0.6597, test_loss: 0.9692, test_f1: 0.6398
 epoch: 88, train_loss: 0.6369, test_loss: 0.8745, test_f1: 0.6682
 epoch: 89, train_loss: 0.6263, test_loss: 0.8578, test_f1: 0.6651
 epoch: 90, train_loss: 0.6389, test_loss: 0.9002, test_f1: 0.6885
 epoch: 91, train_loss: 0.6353, test_loss: 0.9006, test_f1: 0.6721
 epoch: 92, train_loss: 0.6360, test_loss: 0.9171, test_f1: 0.6692
 epoch: 93, train_loss: 0.6341, test_loss: 0.8764, test_f1: 0.6821
 epoch: 94, train_loss: 0.6313, test_loss: 0.8867, test_f1: 0.6542
 epoch: 95, train_loss: 0.6315, test_loss: 0.8659, test_f1: 0.6668
 epoch: 96, train_loss: 0.6296, test_loss: 0.9037, test_f1: 0.6716
 epoch: 97, train_loss: 0.6404, test_loss: 0.9034, test_f1: 0.6645
 epoch: 98, train_loss: 0.6174, test_loss: 0.8745, test_f1: 0.6626
 epoch: 99, train_loss: 0.6361, test_loss: 0.8964, test_f1: 0.6633
##################ITERATION #9 ****************************************
 epoch: 0, train_loss: 1.2699, test_loss: 1.0767, test_f1: 0.4584
 epoch: 1, train_loss: 1.0561, test_loss: 0.9714, test_f1: 0.4832
 epoch: 2, train_loss: 1.0180, test_loss: 1.0459, test_f1: 0.4687
 epoch: 3, train_loss: 0.9756, test_loss: 1.0009, test_f1: 0.4721
 epoch: 4, train_loss: 0.9609, test_loss: 0.9139, test_f1: 0.5151
 epoch: 5, train_loss: 0.9568, test_loss: 1.0400, test_f1: 0.4969
 epoch: 6, train_loss: 0.9494, test_loss: 0.9791, test_f1: 0.5115
 epoch: 7, train_loss: 0.9450, test_loss: 0.9398, test_f1: 0.5216
 epoch: 8, train_loss: 0.9349, test_loss: 0.9488, test_f1: 0.4768
 epoch: 9, train_loss: 0.9241, test_loss: 1.0523, test_f1: 0.4726
 epoch: 10, train_loss: 0.9617, test_loss: 0.9916, test_f1: 0.5195
 epoch: 11, train_loss: 0.9526, test_loss: 1.0222, test_f1: 0.4671
 epoch: 12, train_loss: 0.9228, test_loss: 0.9963, test_f1: 0.5063
 epoch: 13, train_loss: 0.9204, test_loss: 1.1060, test_f1: 0.4712
 epoch: 14, train_loss: 0.9027, test_loss: 0.9736, test_f1: 0.4932
 epoch: 15, train_loss: 0.8842, test_loss: 0.9608, test_f1: 0.5766
 epoch: 16, train_loss: 0.8866, test_loss: 0.9676, test_f1: 0.5370
 epoch: 17, train_loss: 0.9072, test_loss: 1.0502, test_f1: 0.5332
 epoch: 18, train_loss: 0.8910, test_loss: 0.9603, test_f1: 0.5545
 epoch: 19, train_loss: 0.8719, test_loss: 0.9341, test_f1: 0.5607
 epoch: 20, train_loss: 0.8619, test_loss: 0.9252, test_f1: 0.5375
 epoch: 21, train_loss: 0.8460, test_loss: 0.8974, test_f1: 0.5788
 epoch: 22, train_loss: 0.8615, test_loss: 0.9360, test_f1: 0.5567
 epoch: 23, train_loss: 0.8328, test_loss: 0.9429, test_f1: 0.5878
 epoch: 24, train_loss: 0.8491, test_loss: 0.9146, test_f1: 0.5726
 epoch: 25, train_loss: 0.8420, test_loss: 0.9379, test_f1: 0.5545
 epoch: 26, train_loss: 0.8316, test_loss: 0.9335, test_f1: 0.5615
 epoch: 27, train_loss: 0.8444, test_loss: 0.9221, test_f1: 0.5642
 epoch: 28, train_loss: 0.8289, test_loss: 0.9856, test_f1: 0.5481
 epoch: 29, train_loss: 0.8115, test_loss: 0.8972, test_f1: 0.6041
 epoch: 30, train_loss: 0.7975, test_loss: 0.9119, test_f1: 0.5788
 epoch: 31, train_loss: 0.8028, test_loss: 0.9549, test_f1: 0.5441
 epoch: 32, train_loss: 0.8179, test_loss: 0.9357, test_f1: 0.5899
 epoch: 33, train_loss: 0.8054, test_loss: 1.0332, test_f1: 0.5475
 epoch: 34, train_loss: 0.8016, test_loss: 0.9740, test_f1: 0.5545
 epoch: 35, train_loss: 0.7998, test_loss: 0.9428, test_f1: 0.5812
 epoch: 36, train_loss: 0.8144, test_loss: 0.9239, test_f1: 0.5809
 epoch: 37, train_loss: 0.7878, test_loss: 0.9579, test_f1: 0.5891
 epoch: 38, train_loss: 0.8204, test_loss: 0.9560, test_f1: 0.5683
 epoch: 39, train_loss: 0.7910, test_loss: 0.9468, test_f1: 0.5839
 epoch: 40, train_loss: 0.7799, test_loss: 0.9470, test_f1: 0.6084
 epoch: 41, train_loss: 0.7709, test_loss: 0.9568, test_f1: 0.6095
 epoch: 42, train_loss: 0.7700, test_loss: 0.9740, test_f1: 0.6030
 epoch: 43, train_loss: 0.7959, test_loss: 1.0965, test_f1: 0.5438
 epoch: 44, train_loss: 0.7802, test_loss: 0.9496, test_f1: 0.5953
 epoch: 45, train_loss: 0.7713, test_loss: 0.9499, test_f1: 0.6179
 epoch: 46, train_loss: 0.7685, test_loss: 1.0221, test_f1: 0.6201
 epoch: 47, train_loss: 0.7712, test_loss: 1.0790, test_f1: 0.5665
 epoch: 48, train_loss: 0.7804, test_loss: 1.0034, test_f1: 0.5903
 epoch: 49, train_loss: 0.7764, test_loss: 1.0160, test_f1: 0.6046
 epoch: 50, train_loss: 0.7681, test_loss: 0.9468, test_f1: 0.6214
 epoch: 51, train_loss: 0.7341, test_loss: 0.9749, test_f1: 0.6159
 epoch: 52, train_loss: 0.7288, test_loss: 0.9444, test_f1: 0.6268
 epoch: 53, train_loss: 0.7133, test_loss: 0.9301, test_f1: 0.6198
 epoch: 54, train_loss: 0.7151, test_loss: 0.9831, test_f1: 0.6185
 epoch: 55, train_loss: 0.7123, test_loss: 0.9401, test_f1: 0.6445
 epoch: 56, train_loss: 0.7138, test_loss: 0.9758, test_f1: 0.6265
 epoch: 57, train_loss: 0.7024, test_loss: 0.9821, test_f1: 0.5939
 epoch: 58, train_loss: 0.7149, test_loss: 1.0142, test_f1: 0.6164
 epoch: 59, train_loss: 0.7002, test_loss: 0.9800, test_f1: 0.6387
 epoch: 60, train_loss: 0.6858, test_loss: 0.9798, test_f1: 0.6414
 epoch: 61, train_loss: 0.7077, test_loss: 0.9883, test_f1: 0.6076
 epoch: 62, train_loss: 0.7073, test_loss: 1.0046, test_f1: 0.6245
 epoch: 63, train_loss: 0.6851, test_loss: 1.0554, test_f1: 0.6086
 epoch: 64, train_loss: 0.6818, test_loss: 1.0056, test_f1: 0.6131
 epoch: 65, train_loss: 0.6746, test_loss: 1.1216, test_f1: 0.6018
 epoch: 66, train_loss: 0.6867, test_loss: 1.0701, test_f1: 0.6046
 epoch: 67, train_loss: 0.7045, test_loss: 0.9683, test_f1: 0.6555
 epoch: 68, train_loss: 0.7033, test_loss: 1.0645, test_f1: 0.6058
 epoch: 69, train_loss: 0.6848, test_loss: 1.0185, test_f1: 0.6002
 epoch: 70, train_loss: 0.6854, test_loss: 1.0393, test_f1: 0.6162
 epoch: 71, train_loss: 0.7098, test_loss: 1.0118, test_f1: 0.5869
 epoch: 72, train_loss: 0.6696, test_loss: 1.0366, test_f1: 0.6544
 epoch: 73, train_loss: 0.6736, test_loss: 0.9896, test_f1: 0.6277
 epoch: 74, train_loss: 0.6681, test_loss: 1.0690, test_f1: 0.6321
 epoch: 75, train_loss: 0.6846, test_loss: 1.0364, test_f1: 0.6470
 epoch: 76, train_loss: 0.6737, test_loss: 1.0147, test_f1: 0.6154
 epoch: 77, train_loss: 0.6659, test_loss: 1.1029, test_f1: 0.6051
 epoch: 78, train_loss: 0.6616, test_loss: 1.1092, test_f1: 0.6230
 epoch: 79, train_loss: 0.6588, test_loss: 1.0438, test_f1: 0.6079
 epoch: 80, train_loss: 0.6532, test_loss: 1.1170, test_f1: 0.6296
 epoch: 81, train_loss: 0.6544, test_loss: 1.1180, test_f1: 0.6409
 epoch: 82, train_loss: 0.6578, test_loss: 1.0876, test_f1: 0.6469
 epoch: 83, train_loss: 0.6760, test_loss: 1.1425, test_f1: 0.6185
 epoch: 84, train_loss: 0.6661, test_loss: 1.0618, test_f1: 0.6346
 epoch: 85, train_loss: 0.6582, test_loss: 1.1424, test_f1: 0.6368
 epoch: 86, train_loss: 0.6601, test_loss: 1.0610, test_f1: 0.6371
 epoch: 87, train_loss: 0.6538, test_loss: 1.0535, test_f1: 0.6485
 epoch: 88, train_loss: 0.6544, test_loss: 1.1141, test_f1: 0.6324
 epoch: 89, train_loss: 0.6535, test_loss: 1.0787, test_f1: 0.6248
 epoch: 90, train_loss: 0.6445, test_loss: 1.2534, test_f1: 0.6056
 epoch: 91, train_loss: 0.6775, test_loss: 1.0669, test_f1: 0.6475
 epoch: 92, train_loss: 0.6531, test_loss: 1.0467, test_f1: 0.6463
 epoch: 93, train_loss: 0.6387, test_loss: 1.0694, test_f1: 0.6435
 epoch: 94, train_loss: 0.6461, test_loss: 1.1825, test_f1: 0.6087
 epoch: 95, train_loss: 0.6450, test_loss: 1.0464, test_f1: 0.6612
 epoch: 96, train_loss: 0.6368, test_loss: 1.1874, test_f1: 0.6066
 epoch: 97, train_loss: 0.6427, test_loss: 1.1111, test_f1: 0.6159
 epoch: 98, train_loss: 0.6386, test_loss: 1.2344, test_f1: 0.6321
 epoch: 99, train_loss: 0.6488, test_loss: 1.1524, test_f1: 0.6295

Training completed in 914.72 seconds
Best F1: 0.6899 at epoch 53
Mean F1 across iterations: 0.6706  0.0116
========================FINAL RESULTS================================
FEGIN weighted F1: 0.6899  0.0116
python main.py --data ltspice_examples --representation component_net --model FEGIN --layers 5 --hiddens 32 --batch_size 64 --lr 0.01 --emb_size 512 --epochs 100 --save_appendix component_net_L5_H32_BS64_LR0.01_E512 --no_val
-----



STDERR:
  File "main.py", line 370, in <module>
    main()
  File "main.py", line 254, in main
    dataset = dataset_class(
  File "/home/philip/projects/llm_inference_code_repo/Circuit-Completion-Using-GNNs/component_classification_with_link_prediction_head/evaluation/FEGIN/kernel/circuit_datasets.py", line 15, in __init__
    self.data, self.slices = torch.load(self.processed_paths[0])
  File "/home/philip/.local/lib/python3.8/site-packages/torch/serialization.py", line 1040, in load
    warnings.warn(
  File "/usr/lib/python3.8/warnings.py", line 109, in _showwarnmsg
    sw(msg.message, msg.category, msg.filename, msg.lineno,
  File "main.py", line 47, in warn_with_traceback
    traceback.print_stack(file=log)
/home/philip/projects/llm_inference_code_repo/Circuit-Completion-Using-GNNs/component_classification_with_link_prediction_head/evaluation/FEGIN/kernel/circuit_datasets.py:15: FutureWarning: You are using `torch.load` with `weights_only=False` (the current default value), which uses the default pickle module implicitly. It is possible to construct malicious pickle data which will execute arbitrary code during unpickling (See https://github.com/pytorch/pytorch/blob/main/SECURITY.md#untrusted-models for more details). In a future release, the default value for `weights_only` will be flipped to `True`. This limits the functions that could be executed during unpickling. Arbitrary objects will no longer be allowed to be loaded via this mode unless they are explicitly allowlisted by the user via `torch.serialization.add_safe_globals`. We recommend you start setting `weights_only=True` for any use case where you don't have full control of the loaded file. Please open an issue on GitHub for any issues related to this experimental feature.
  self.data, self.slices = torch.load(self.processed_paths[0])
