STDOUT:
Results will be saved in /home/philip/projects/llm_inference_code_repo/Circuit-Completion-Using-GNNs/component_classification_with_link_prediction_head/evaluation/FEGIN/results/model_FEGIN_dataset_ltspice_examples
Command line input: python main.py --data ltspice_examples --representation component_pin_net --model FEGIN --layers 5 --hiddens 32 --batch_size 128 --lr 0.0001 --emb_size 512 --epochs 100 --save_appendix component_pin_net_L5_H32_BS128_LR0.0001_E512 --no_val
 is saved.
-----
ltspice_examples - FEGIN
Using 5 layers, 32 hidden units, h = 2
Loading component_pin_net representation dataset
ENTERED
Training FEGIN on component_pin_net representation
Train: 3558, Test: 846
##################ITERATION #0 ****************************************
 epoch: 0, train_loss: 1.3948, test_loss: 1.3943, test_f1: 0.1004
 epoch: 1, train_loss: 1.3850, test_loss: 1.3855, test_f1: 0.1004
 epoch: 2, train_loss: 1.3766, test_loss: 1.3734, test_f1: 0.1004
 epoch: 3, train_loss: 1.3669, test_loss: 1.3626, test_f1: 0.1234
 epoch: 4, train_loss: 1.3556, test_loss: 1.3507, test_f1: 0.1657
 epoch: 5, train_loss: 1.3405, test_loss: 1.3353, test_f1: 0.1893
 epoch: 6, train_loss: 1.3231, test_loss: 1.3161, test_f1: 0.2854
 epoch: 7, train_loss: 1.3049, test_loss: 1.2970, test_f1: 0.2623
 epoch: 8, train_loss: 1.2840, test_loss: 1.2760, test_f1: 0.2361
 epoch: 9, train_loss: 1.2671, test_loss: 1.2557, test_f1: 0.2270
 epoch: 10, train_loss: 1.2520, test_loss: 1.2384, test_f1: 0.2270
 epoch: 11, train_loss: 1.2408, test_loss: 1.2258, test_f1: 0.2270
 epoch: 12, train_loss: 1.2268, test_loss: 1.2123, test_f1: 0.2270
 epoch: 13, train_loss: 1.2227, test_loss: 1.2016, test_f1: 0.2270
 epoch: 14, train_loss: 1.2102, test_loss: 1.1915, test_f1: 0.2270
 epoch: 15, train_loss: 1.2069, test_loss: 1.1857, test_f1: 0.2270
 epoch: 16, train_loss: 1.1961, test_loss: 1.1766, test_f1: 0.2295
 epoch: 17, train_loss: 1.1939, test_loss: 1.1707, test_f1: 0.2651
 epoch: 18, train_loss: 1.1888, test_loss: 1.1633, test_f1: 0.2924
 epoch: 19, train_loss: 1.1783, test_loss: 1.1586, test_f1: 0.3008
 epoch: 20, train_loss: 1.1751, test_loss: 1.1525, test_f1: 0.3201
 epoch: 21, train_loss: 1.1664, test_loss: 1.1458, test_f1: 0.3380
 epoch: 22, train_loss: 1.1619, test_loss: 1.1373, test_f1: 0.3603
 epoch: 23, train_loss: 1.1545, test_loss: 1.1306, test_f1: 0.3716
 epoch: 24, train_loss: 1.1421, test_loss: 1.1232, test_f1: 0.3839
 epoch: 25, train_loss: 1.1373, test_loss: 1.1154, test_f1: 0.3660
 epoch: 26, train_loss: 1.1276, test_loss: 1.1079, test_f1: 0.3839
 epoch: 27, train_loss: 1.1206, test_loss: 1.0984, test_f1: 0.3725
 epoch: 28, train_loss: 1.1124, test_loss: 1.0901, test_f1: 0.4136
 epoch: 29, train_loss: 1.1066, test_loss: 1.0807, test_f1: 0.4121
 epoch: 30, train_loss: 1.0925, test_loss: 1.0756, test_f1: 0.4554
 epoch: 31, train_loss: 1.0831, test_loss: 1.0653, test_f1: 0.4715
 epoch: 32, train_loss: 1.0754, test_loss: 1.0606, test_f1: 0.4791
 epoch: 33, train_loss: 1.0651, test_loss: 1.0513, test_f1: 0.4686
 epoch: 34, train_loss: 1.0575, test_loss: 1.0475, test_f1: 0.5010
 epoch: 35, train_loss: 1.0512, test_loss: 1.0431, test_f1: 0.4845
 epoch: 36, train_loss: 1.0389, test_loss: 1.0379, test_f1: 0.4815
 epoch: 37, train_loss: 1.0415, test_loss: 1.0311, test_f1: 0.4904
 epoch: 38, train_loss: 1.0279, test_loss: 1.0328, test_f1: 0.4790
 epoch: 39, train_loss: 1.0237, test_loss: 1.0218, test_f1: 0.4986
 epoch: 40, train_loss: 1.0222, test_loss: 1.0170, test_f1: 0.5018
 epoch: 41, train_loss: 1.0110, test_loss: 1.0131, test_f1: 0.5104
 epoch: 42, train_loss: 1.0071, test_loss: 1.0124, test_f1: 0.4956
 epoch: 43, train_loss: 1.0020, test_loss: 1.0058, test_f1: 0.5115
 epoch: 44, train_loss: 0.9905, test_loss: 1.0022, test_f1: 0.5180
 epoch: 45, train_loss: 0.9947, test_loss: 0.9996, test_f1: 0.5202
 epoch: 46, train_loss: 0.9866, test_loss: 0.9947, test_f1: 0.5220
 epoch: 47, train_loss: 0.9815, test_loss: 0.9935, test_f1: 0.5267
 epoch: 48, train_loss: 0.9844, test_loss: 0.9901, test_f1: 0.5079
 epoch: 49, train_loss: 0.9731, test_loss: 0.9844, test_f1: 0.5304
 epoch: 50, train_loss: 0.9677, test_loss: 0.9847, test_f1: 0.5163
 epoch: 51, train_loss: 0.9685, test_loss: 0.9808, test_f1: 0.5159
 epoch: 52, train_loss: 0.9690, test_loss: 0.9781, test_f1: 0.5205
 epoch: 53, train_loss: 0.9544, test_loss: 0.9732, test_f1: 0.5258
 epoch: 54, train_loss: 0.9640, test_loss: 0.9760, test_f1: 0.5157
 epoch: 55, train_loss: 0.9541, test_loss: 0.9737, test_f1: 0.5224
 epoch: 56, train_loss: 0.9505, test_loss: 0.9669, test_f1: 0.5351
 epoch: 57, train_loss: 0.9603, test_loss: 0.9662, test_f1: 0.5260
 epoch: 58, train_loss: 0.9461, test_loss: 0.9656, test_f1: 0.5248
 epoch: 59, train_loss: 0.9537, test_loss: 0.9674, test_f1: 0.5181
 epoch: 60, train_loss: 0.9485, test_loss: 0.9631, test_f1: 0.5291
 epoch: 61, train_loss: 0.9423, test_loss: 0.9586, test_f1: 0.5307
 epoch: 62, train_loss: 0.9413, test_loss: 0.9577, test_f1: 0.5376
 epoch: 63, train_loss: 0.9418, test_loss: 0.9678, test_f1: 0.5266
 epoch: 64, train_loss: 0.9443, test_loss: 0.9574, test_f1: 0.5277
 epoch: 65, train_loss: 0.9356, test_loss: 0.9652, test_f1: 0.5288
 epoch: 66, train_loss: 0.9369, test_loss: 0.9523, test_f1: 0.5299
 epoch: 67, train_loss: 0.9384, test_loss: 0.9602, test_f1: 0.5241
 epoch: 68, train_loss: 0.9383, test_loss: 0.9504, test_f1: 0.5312
 epoch: 69, train_loss: 0.9347, test_loss: 0.9464, test_f1: 0.5411
 epoch: 70, train_loss: 0.9339, test_loss: 0.9460, test_f1: 0.5316
 epoch: 71, train_loss: 0.9218, test_loss: 0.9447, test_f1: 0.5312
 epoch: 72, train_loss: 0.9261, test_loss: 0.9487, test_f1: 0.5312
 epoch: 73, train_loss: 0.9202, test_loss: 0.9475, test_f1: 0.5362
 epoch: 74, train_loss: 0.9231, test_loss: 0.9437, test_f1: 0.5334
 epoch: 75, train_loss: 0.9232, test_loss: 0.9380, test_f1: 0.5378
 epoch: 76, train_loss: 0.9327, test_loss: 0.9395, test_f1: 0.5438
 epoch: 77, train_loss: 0.9218, test_loss: 0.9378, test_f1: 0.5435
 epoch: 78, train_loss: 0.9237, test_loss: 0.9444, test_f1: 0.5372
 epoch: 79, train_loss: 0.9191, test_loss: 0.9366, test_f1: 0.5386
 epoch: 80, train_loss: 0.9186, test_loss: 0.9321, test_f1: 0.5370
 epoch: 81, train_loss: 0.9111, test_loss: 0.9425, test_f1: 0.5379
 epoch: 82, train_loss: 0.9182, test_loss: 0.9272, test_f1: 0.5393
 epoch: 83, train_loss: 0.9138, test_loss: 0.9346, test_f1: 0.5400
 epoch: 84, train_loss: 0.9150, test_loss: 0.9280, test_f1: 0.5364
 epoch: 85, train_loss: 0.9226, test_loss: 0.9290, test_f1: 0.5323
 epoch: 86, train_loss: 0.9091, test_loss: 0.9261, test_f1: 0.5363
 epoch: 87, train_loss: 0.9155, test_loss: 0.9337, test_f1: 0.5386
 epoch: 88, train_loss: 0.9072, test_loss: 0.9235, test_f1: 0.5359
 epoch: 89, train_loss: 0.9143, test_loss: 0.9180, test_f1: 0.5404
 epoch: 90, train_loss: 0.9069, test_loss: 0.9195, test_f1: 0.5386
 epoch: 91, train_loss: 0.9065, test_loss: 0.9199, test_f1: 0.5384
 epoch: 92, train_loss: 0.9065, test_loss: 0.9282, test_f1: 0.5338
 epoch: 93, train_loss: 0.9114, test_loss: 0.9122, test_f1: 0.5387
 epoch: 94, train_loss: 0.9068, test_loss: 0.9209, test_f1: 0.5406
 epoch: 95, train_loss: 0.9042, test_loss: 0.9204, test_f1: 0.5396
 epoch: 96, train_loss: 0.9054, test_loss: 0.9211, test_f1: 0.5382
 epoch: 97, train_loss: 0.9077, test_loss: 0.9179, test_f1: 0.5350
 epoch: 98, train_loss: 0.8993, test_loss: 0.9115, test_f1: 0.5355
 epoch: 99, train_loss: 0.8999, test_loss: 0.9265, test_f1: 0.5310
##################ITERATION #1 ****************************************
 epoch: 0, train_loss: 1.3687, test_loss: 1.3747, test_f1: 0.1004
 epoch: 1, train_loss: 1.3492, test_loss: 1.3585, test_f1: 0.1296
 epoch: 2, train_loss: 1.3340, test_loss: 1.3320, test_f1: 0.2375
 epoch: 3, train_loss: 1.3179, test_loss: 1.3108, test_f1: 0.3097
 epoch: 4, train_loss: 1.3007, test_loss: 1.2910, test_f1: 0.3392
 epoch: 5, train_loss: 1.2819, test_loss: 1.2699, test_f1: 0.3110
 epoch: 6, train_loss: 1.2623, test_loss: 1.2504, test_f1: 0.3157
 epoch: 7, train_loss: 1.2459, test_loss: 1.2290, test_f1: 0.3396
 epoch: 8, train_loss: 1.2284, test_loss: 1.2100, test_f1: 0.3728
 epoch: 9, train_loss: 1.2112, test_loss: 1.1933, test_f1: 0.4006
 epoch: 10, train_loss: 1.1950, test_loss: 1.1744, test_f1: 0.4053
 epoch: 11, train_loss: 1.1815, test_loss: 1.1598, test_f1: 0.4338
 epoch: 12, train_loss: 1.1669, test_loss: 1.1419, test_f1: 0.4294
 epoch: 13, train_loss: 1.1529, test_loss: 1.1280, test_f1: 0.4240
 epoch: 14, train_loss: 1.1412, test_loss: 1.1139, test_f1: 0.4300
 epoch: 15, train_loss: 1.1259, test_loss: 1.1007, test_f1: 0.4384
 epoch: 16, train_loss: 1.1110, test_loss: 1.0888, test_f1: 0.4398
 epoch: 17, train_loss: 1.1024, test_loss: 1.0762, test_f1: 0.4393
 epoch: 18, train_loss: 1.0855, test_loss: 1.0658, test_f1: 0.4406
 epoch: 19, train_loss: 1.0757, test_loss: 1.0577, test_f1: 0.4525
 epoch: 20, train_loss: 1.0600, test_loss: 1.0478, test_f1: 0.4610
 epoch: 21, train_loss: 1.0561, test_loss: 1.0398, test_f1: 0.4627
 epoch: 22, train_loss: 1.0434, test_loss: 1.0317, test_f1: 0.4701
 epoch: 23, train_loss: 1.0379, test_loss: 1.0244, test_f1: 0.4739
 epoch: 24, train_loss: 1.0282, test_loss: 1.0175, test_f1: 0.4780
 epoch: 25, train_loss: 1.0167, test_loss: 1.0166, test_f1: 0.4848
 epoch: 26, train_loss: 1.0107, test_loss: 1.0094, test_f1: 0.4964
 epoch: 27, train_loss: 1.0043, test_loss: 1.0021, test_f1: 0.5019
 epoch: 28, train_loss: 0.9945, test_loss: 1.0016, test_f1: 0.4943
 epoch: 29, train_loss: 0.9833, test_loss: 0.9923, test_f1: 0.5063
 epoch: 30, train_loss: 0.9835, test_loss: 0.9900, test_f1: 0.4993
 epoch: 31, train_loss: 0.9820, test_loss: 1.0010, test_f1: 0.4963
 epoch: 32, train_loss: 0.9748, test_loss: 0.9780, test_f1: 0.5105
 epoch: 33, train_loss: 0.9675, test_loss: 0.9853, test_f1: 0.5082
 epoch: 34, train_loss: 0.9651, test_loss: 0.9723, test_f1: 0.5103
 epoch: 35, train_loss: 0.9725, test_loss: 0.9750, test_f1: 0.5112
 epoch: 36, train_loss: 0.9619, test_loss: 0.9651, test_f1: 0.5282
 epoch: 37, train_loss: 0.9519, test_loss: 0.9658, test_f1: 0.5205
 epoch: 38, train_loss: 0.9577, test_loss: 0.9715, test_f1: 0.5270
 epoch: 39, train_loss: 0.9471, test_loss: 0.9674, test_f1: 0.5220
 epoch: 40, train_loss: 0.9497, test_loss: 0.9703, test_f1: 0.5173
 epoch: 41, train_loss: 0.9410, test_loss: 0.9612, test_f1: 0.5300
 epoch: 42, train_loss: 0.9381, test_loss: 0.9525, test_f1: 0.5228
 epoch: 43, train_loss: 0.9337, test_loss: 0.9446, test_f1: 0.5284
 epoch: 44, train_loss: 0.9401, test_loss: 0.9687, test_f1: 0.5237
 epoch: 45, train_loss: 0.9227, test_loss: 0.9609, test_f1: 0.5191
 epoch: 46, train_loss: 0.9245, test_loss: 0.9575, test_f1: 0.5228
 epoch: 47, train_loss: 0.9274, test_loss: 0.9791, test_f1: 0.5131
 epoch: 48, train_loss: 0.9243, test_loss: 0.9587, test_f1: 0.5341
 epoch: 49, train_loss: 0.9227, test_loss: 0.9546, test_f1: 0.5324
 epoch: 50, train_loss: 0.9220, test_loss: 0.9546, test_f1: 0.5318
 epoch: 51, train_loss: 0.9154, test_loss: 0.9481, test_f1: 0.5318
 epoch: 52, train_loss: 0.9197, test_loss: 0.9514, test_f1: 0.5362
 epoch: 53, train_loss: 0.9135, test_loss: 0.9486, test_f1: 0.5232
 epoch: 54, train_loss: 0.9113, test_loss: 0.9450, test_f1: 0.5294
 epoch: 55, train_loss: 0.9181, test_loss: 0.9412, test_f1: 0.5412
 epoch: 56, train_loss: 0.9053, test_loss: 0.9428, test_f1: 0.5317
 epoch: 57, train_loss: 0.9095, test_loss: 0.9494, test_f1: 0.5317
 epoch: 58, train_loss: 0.9062, test_loss: 0.9478, test_f1: 0.5357
 epoch: 59, train_loss: 0.9084, test_loss: 0.9425, test_f1: 0.5310
 epoch: 60, train_loss: 0.9012, test_loss: 0.9546, test_f1: 0.5262
 epoch: 61, train_loss: 0.9028, test_loss: 0.9423, test_f1: 0.5301
 epoch: 62, train_loss: 0.9036, test_loss: 0.9462, test_f1: 0.5357
 epoch: 63, train_loss: 0.9090, test_loss: 0.9376, test_f1: 0.5415
 epoch: 64, train_loss: 0.8973, test_loss: 0.9409, test_f1: 0.5384
 epoch: 65, train_loss: 0.9000, test_loss: 0.9470, test_f1: 0.5263
 epoch: 66, train_loss: 0.9015, test_loss: 0.9528, test_f1: 0.5328
 epoch: 67, train_loss: 0.9061, test_loss: 0.9390, test_f1: 0.5365
 epoch: 68, train_loss: 0.8968, test_loss: 0.9460, test_f1: 0.5351
 epoch: 69, train_loss: 0.8964, test_loss: 0.9392, test_f1: 0.5371
 epoch: 70, train_loss: 0.8938, test_loss: 0.9402, test_f1: 0.5405
 epoch: 71, train_loss: 0.8836, test_loss: 0.9465, test_f1: 0.5390
 epoch: 72, train_loss: 0.8862, test_loss: 0.9417, test_f1: 0.5348
 epoch: 73, train_loss: 0.8908, test_loss: 0.9338, test_f1: 0.5412
 epoch: 74, train_loss: 0.8876, test_loss: 0.9402, test_f1: 0.5325
 epoch: 75, train_loss: 0.8807, test_loss: 0.9353, test_f1: 0.5359
 epoch: 76, train_loss: 0.8850, test_loss: 0.9224, test_f1: 0.5391
 epoch: 77, train_loss: 0.8887, test_loss: 0.9253, test_f1: 0.5368
 epoch: 78, train_loss: 0.8822, test_loss: 0.9355, test_f1: 0.5381
 epoch: 79, train_loss: 0.8869, test_loss: 0.9422, test_f1: 0.5358
 epoch: 80, train_loss: 0.8822, test_loss: 0.9329, test_f1: 0.5436
 epoch: 81, train_loss: 0.8857, test_loss: 0.9356, test_f1: 0.5350
 epoch: 82, train_loss: 0.8876, test_loss: 0.9462, test_f1: 0.5323
 epoch: 83, train_loss: 0.8757, test_loss: 0.9276, test_f1: 0.5415
 epoch: 84, train_loss: 0.8813, test_loss: 0.9320, test_f1: 0.5446
 epoch: 85, train_loss: 0.8830, test_loss: 0.9354, test_f1: 0.5399
 epoch: 86, train_loss: 0.8804, test_loss: 0.9397, test_f1: 0.5285
 epoch: 87, train_loss: 0.8786, test_loss: 0.9337, test_f1: 0.5343
 epoch: 88, train_loss: 0.8739, test_loss: 0.9352, test_f1: 0.5387
 epoch: 89, train_loss: 0.8765, test_loss: 0.9508, test_f1: 0.5251
 epoch: 90, train_loss: 0.8758, test_loss: 0.9472, test_f1: 0.5352
 epoch: 91, train_loss: 0.8755, test_loss: 0.9406, test_f1: 0.5400
 epoch: 92, train_loss: 0.8795, test_loss: 0.9565, test_f1: 0.5191
 epoch: 93, train_loss: 0.8691, test_loss: 0.9362, test_f1: 0.5378
 epoch: 94, train_loss: 0.8684, test_loss: 0.9406, test_f1: 0.5409
 epoch: 95, train_loss: 0.8677, test_loss: 0.9300, test_f1: 0.5354
 epoch: 96, train_loss: 0.8755, test_loss: 0.9358, test_f1: 0.5401
 epoch: 97, train_loss: 0.8632, test_loss: 0.9371, test_f1: 0.5397
 epoch: 98, train_loss: 0.8706, test_loss: 0.9257, test_f1: 0.5362
 epoch: 99, train_loss: 0.8722, test_loss: 0.9352, test_f1: 0.5357
##################ITERATION #2 ****************************************
 epoch: 0, train_loss: 1.3436, test_loss: 1.3750, test_f1: 0.2270
 epoch: 1, train_loss: 1.3100, test_loss: 1.3380, test_f1: 0.3013
 epoch: 2, train_loss: 1.2903, test_loss: 1.2865, test_f1: 0.3164
 epoch: 3, train_loss: 1.2733, test_loss: 1.2642, test_f1: 0.3176
 epoch: 4, train_loss: 1.2547, test_loss: 1.2455, test_f1: 0.3208
 epoch: 5, train_loss: 1.2389, test_loss: 1.2254, test_f1: 0.3182
 epoch: 6, train_loss: 1.2239, test_loss: 1.2065, test_f1: 0.3450
 epoch: 7, train_loss: 1.2095, test_loss: 1.1893, test_f1: 0.3749
 epoch: 8, train_loss: 1.1980, test_loss: 1.1727, test_f1: 0.3925
 epoch: 9, train_loss: 1.1813, test_loss: 1.1586, test_f1: 0.4065
 epoch: 10, train_loss: 1.1677, test_loss: 1.1440, test_f1: 0.4102
 epoch: 11, train_loss: 1.1562, test_loss: 1.1308, test_f1: 0.4114
 epoch: 12, train_loss: 1.1422, test_loss: 1.1203, test_f1: 0.4025
 epoch: 13, train_loss: 1.1342, test_loss: 1.1084, test_f1: 0.4126
 epoch: 14, train_loss: 1.1240, test_loss: 1.0961, test_f1: 0.4254
 epoch: 15, train_loss: 1.1076, test_loss: 1.0851, test_f1: 0.4303
 epoch: 16, train_loss: 1.1008, test_loss: 1.0781, test_f1: 0.4481
 epoch: 17, train_loss: 1.0764, test_loss: 1.0686, test_f1: 0.4384
 epoch: 18, train_loss: 1.0783, test_loss: 1.0600, test_f1: 0.4533
 epoch: 19, train_loss: 1.0714, test_loss: 1.0536, test_f1: 0.4515
 epoch: 20, train_loss: 1.0554, test_loss: 1.0522, test_f1: 0.4514
 epoch: 21, train_loss: 1.0511, test_loss: 1.0464, test_f1: 0.4495
 epoch: 22, train_loss: 1.0423, test_loss: 1.0503, test_f1: 0.4520
 epoch: 23, train_loss: 1.0351, test_loss: 1.0438, test_f1: 0.4504
 epoch: 24, train_loss: 1.0283, test_loss: 1.0370, test_f1: 0.4714
 epoch: 25, train_loss: 1.0270, test_loss: 1.0380, test_f1: 0.4548
 epoch: 26, train_loss: 1.0120, test_loss: 1.0295, test_f1: 0.4751
 epoch: 27, train_loss: 1.0043, test_loss: 1.0263, test_f1: 0.4775
 epoch: 28, train_loss: 0.9926, test_loss: 1.0298, test_f1: 0.4806
 epoch: 29, train_loss: 0.9936, test_loss: 1.0149, test_f1: 0.4972
 epoch: 30, train_loss: 0.9826, test_loss: 1.0114, test_f1: 0.4993
 epoch: 31, train_loss: 0.9881, test_loss: 1.0122, test_f1: 0.4965
 epoch: 32, train_loss: 0.9815, test_loss: 1.0157, test_f1: 0.5108
 epoch: 33, train_loss: 0.9762, test_loss: 1.0074, test_f1: 0.5083
 epoch: 34, train_loss: 0.9755, test_loss: 1.0240, test_f1: 0.5003
 epoch: 35, train_loss: 0.9662, test_loss: 1.0070, test_f1: 0.5079
 epoch: 36, train_loss: 0.9636, test_loss: 1.0121, test_f1: 0.5057
 epoch: 37, train_loss: 0.9592, test_loss: 1.0135, test_f1: 0.5002
 epoch: 38, train_loss: 0.9602, test_loss: 1.0096, test_f1: 0.4978
 epoch: 39, train_loss: 0.9521, test_loss: 1.0041, test_f1: 0.5135
 epoch: 40, train_loss: 0.9530, test_loss: 0.9941, test_f1: 0.5109
 epoch: 41, train_loss: 0.9472, test_loss: 0.9928, test_f1: 0.5122
 epoch: 42, train_loss: 0.9393, test_loss: 0.9933, test_f1: 0.5352
 epoch: 43, train_loss: 0.9403, test_loss: 1.0004, test_f1: 0.5277
 epoch: 44, train_loss: 0.9370, test_loss: 0.9940, test_f1: 0.5283
 epoch: 45, train_loss: 0.9343, test_loss: 0.9989, test_f1: 0.5347
 epoch: 46, train_loss: 0.9280, test_loss: 0.9952, test_f1: 0.5310
 epoch: 47, train_loss: 0.9251, test_loss: 0.9906, test_f1: 0.5219
 epoch: 48, train_loss: 0.9217, test_loss: 0.9939, test_f1: 0.5162
 epoch: 49, train_loss: 0.9299, test_loss: 0.9853, test_f1: 0.5294
 epoch: 50, train_loss: 0.9166, test_loss: 0.9878, test_f1: 0.5259
 epoch: 51, train_loss: 0.9112, test_loss: 0.9828, test_f1: 0.5309
 epoch: 52, train_loss: 0.9176, test_loss: 0.9798, test_f1: 0.5337
 epoch: 53, train_loss: 0.9102, test_loss: 0.9749, test_f1: 0.5273
 epoch: 54, train_loss: 0.9096, test_loss: 0.9701, test_f1: 0.5240
 epoch: 55, train_loss: 0.9098, test_loss: 0.9794, test_f1: 0.5330
 epoch: 56, train_loss: 0.9084, test_loss: 0.9845, test_f1: 0.5274
 epoch: 57, train_loss: 0.9096, test_loss: 0.9794, test_f1: 0.5360
 epoch: 58, train_loss: 0.9045, test_loss: 0.9840, test_f1: 0.5218
 epoch: 59, train_loss: 0.9032, test_loss: 0.9818, test_f1: 0.5374
 epoch: 60, train_loss: 0.9131, test_loss: 0.9807, test_f1: 0.5282
 epoch: 61, train_loss: 0.9009, test_loss: 0.9801, test_f1: 0.5257
 epoch: 62, train_loss: 0.9028, test_loss: 0.9816, test_f1: 0.5302
 epoch: 63, train_loss: 0.9027, test_loss: 0.9815, test_f1: 0.5253
 epoch: 64, train_loss: 0.8994, test_loss: 0.9756, test_f1: 0.5231
 epoch: 65, train_loss: 0.8949, test_loss: 0.9780, test_f1: 0.5276
 epoch: 66, train_loss: 0.8907, test_loss: 0.9803, test_f1: 0.5183
 epoch: 67, train_loss: 0.8981, test_loss: 0.9846, test_f1: 0.5304
 epoch: 68, train_loss: 0.8918, test_loss: 0.9934, test_f1: 0.5326
 epoch: 69, train_loss: 0.8970, test_loss: 0.9932, test_f1: 0.5326
 epoch: 70, train_loss: 0.8928, test_loss: 0.9864, test_f1: 0.5318
 epoch: 71, train_loss: 0.8910, test_loss: 0.9817, test_f1: 0.5266
 epoch: 72, train_loss: 0.8912, test_loss: 0.9890, test_f1: 0.5313
 epoch: 73, train_loss: 0.8958, test_loss: 0.9728, test_f1: 0.5267
 epoch: 74, train_loss: 0.8975, test_loss: 0.9778, test_f1: 0.5229
 epoch: 75, train_loss: 0.8960, test_loss: 0.9797, test_f1: 0.5231
 epoch: 76, train_loss: 0.8875, test_loss: 0.9783, test_f1: 0.5231
 epoch: 77, train_loss: 0.8840, test_loss: 0.9727, test_f1: 0.5242
 epoch: 78, train_loss: 0.8775, test_loss: 0.9678, test_f1: 0.5187
 epoch: 79, train_loss: 0.8819, test_loss: 0.9728, test_f1: 0.5325
 epoch: 80, train_loss: 0.8862, test_loss: 0.9672, test_f1: 0.5285
 epoch: 81, train_loss: 0.8787, test_loss: 0.9699, test_f1: 0.5283
 epoch: 82, train_loss: 0.8891, test_loss: 0.9737, test_f1: 0.5285
 epoch: 83, train_loss: 0.8824, test_loss: 0.9796, test_f1: 0.5308
 epoch: 84, train_loss: 0.8746, test_loss: 0.9779, test_f1: 0.5356
 epoch: 85, train_loss: 0.8878, test_loss: 0.9818, test_f1: 0.5280
 epoch: 86, train_loss: 0.8811, test_loss: 0.9782, test_f1: 0.5221
 epoch: 87, train_loss: 0.8744, test_loss: 0.9809, test_f1: 0.5271
 epoch: 88, train_loss: 0.8861, test_loss: 0.9917, test_f1: 0.5372
 epoch: 89, train_loss: 0.8797, test_loss: 0.9790, test_f1: 0.5270
 epoch: 90, train_loss: 0.8768, test_loss: 0.9757, test_f1: 0.5332
 epoch: 91, train_loss: 0.8888, test_loss: 0.9869, test_f1: 0.5308
 epoch: 92, train_loss: 0.8743, test_loss: 0.9757, test_f1: 0.5306
 epoch: 93, train_loss: 0.8814, test_loss: 0.9921, test_f1: 0.5227
 epoch: 94, train_loss: 0.8776, test_loss: 0.9806, test_f1: 0.5331
 epoch: 95, train_loss: 0.8733, test_loss: 0.9725, test_f1: 0.5313
 epoch: 96, train_loss: 0.8745, test_loss: 0.9872, test_f1: 0.5320
 epoch: 97, train_loss: 0.8690, test_loss: 0.9831, test_f1: 0.5288
 epoch: 98, train_loss: 0.8779, test_loss: 0.9841, test_f1: 0.5267
 epoch: 99, train_loss: 0.8760, test_loss: 0.9848, test_f1: 0.5218
##################ITERATION #3 ****************************************
 epoch: 0, train_loss: 1.2976, test_loss: 1.3076, test_f1: 0.2270
 epoch: 1, train_loss: 1.2651, test_loss: 1.2855, test_f1: 0.2270
 epoch: 2, train_loss: 1.2466, test_loss: 1.2407, test_f1: 0.2270
 epoch: 3, train_loss: 1.2310, test_loss: 1.2182, test_f1: 0.2347
 epoch: 4, train_loss: 1.2157, test_loss: 1.2017, test_f1: 0.2711
 epoch: 5, train_loss: 1.2048, test_loss: 1.1849, test_f1: 0.3137
 epoch: 6, train_loss: 1.1887, test_loss: 1.1665, test_f1: 0.3538
 epoch: 7, train_loss: 1.1771, test_loss: 1.1501, test_f1: 0.3636
 epoch: 8, train_loss: 1.1605, test_loss: 1.1314, test_f1: 0.3885
 epoch: 9, train_loss: 1.1469, test_loss: 1.1141, test_f1: 0.3995
 epoch: 10, train_loss: 1.1329, test_loss: 1.1004, test_f1: 0.3882
 epoch: 11, train_loss: 1.1148, test_loss: 1.0870, test_f1: 0.4054
 epoch: 12, train_loss: 1.1022, test_loss: 1.0728, test_f1: 0.4153
 epoch: 13, train_loss: 1.0883, test_loss: 1.0608, test_f1: 0.4267
 epoch: 14, train_loss: 1.0711, test_loss: 1.0535, test_f1: 0.4273
 epoch: 15, train_loss: 1.0694, test_loss: 1.0452, test_f1: 0.4428
 epoch: 16, train_loss: 1.0551, test_loss: 1.0371, test_f1: 0.4448
 epoch: 17, train_loss: 1.0476, test_loss: 1.0246, test_f1: 0.4315
 epoch: 18, train_loss: 1.0413, test_loss: 1.0184, test_f1: 0.4409
 epoch: 19, train_loss: 1.0318, test_loss: 1.0130, test_f1: 0.4485
 epoch: 20, train_loss: 1.0227, test_loss: 1.0049, test_f1: 0.4515
 epoch: 21, train_loss: 1.0144, test_loss: 0.9945, test_f1: 0.4568
 epoch: 22, train_loss: 1.0110, test_loss: 0.9897, test_f1: 0.4503
 epoch: 23, train_loss: 1.0052, test_loss: 0.9792, test_f1: 0.4661
 epoch: 24, train_loss: 1.0036, test_loss: 0.9764, test_f1: 0.4631
 epoch: 25, train_loss: 0.9903, test_loss: 0.9710, test_f1: 0.4703
 epoch: 26, train_loss: 0.9836, test_loss: 0.9780, test_f1: 0.4673
 epoch: 27, train_loss: 0.9837, test_loss: 0.9554, test_f1: 0.4802
 epoch: 28, train_loss: 0.9802, test_loss: 0.9561, test_f1: 0.4759
 epoch: 29, train_loss: 0.9671, test_loss: 0.9497, test_f1: 0.4923
 epoch: 30, train_loss: 0.9660, test_loss: 0.9424, test_f1: 0.4901
 epoch: 31, train_loss: 0.9612, test_loss: 0.9443, test_f1: 0.5002
 epoch: 32, train_loss: 0.9533, test_loss: 0.9383, test_f1: 0.4927
 epoch: 33, train_loss: 0.9587, test_loss: 0.9385, test_f1: 0.4944
 epoch: 34, train_loss: 0.9385, test_loss: 0.9323, test_f1: 0.4972
 epoch: 35, train_loss: 0.9468, test_loss: 0.9298, test_f1: 0.4954
 epoch: 36, train_loss: 0.9350, test_loss: 0.9197, test_f1: 0.5000
 epoch: 37, train_loss: 0.9273, test_loss: 0.9108, test_f1: 0.5123
 epoch: 38, train_loss: 0.9338, test_loss: 0.9111, test_f1: 0.5183
 epoch: 39, train_loss: 0.9207, test_loss: 0.9061, test_f1: 0.5298
 epoch: 40, train_loss: 0.9236, test_loss: 0.8994, test_f1: 0.5235
 epoch: 41, train_loss: 0.9167, test_loss: 0.9038, test_f1: 0.5163
 epoch: 42, train_loss: 0.9029, test_loss: 0.9066, test_f1: 0.5157
 epoch: 43, train_loss: 0.9017, test_loss: 0.8888, test_f1: 0.5262
 epoch: 44, train_loss: 0.9081, test_loss: 0.8878, test_f1: 0.5299
 epoch: 45, train_loss: 0.9021, test_loss: 0.8981, test_f1: 0.5238
 epoch: 46, train_loss: 0.8995, test_loss: 0.8894, test_f1: 0.5318
 epoch: 47, train_loss: 0.8978, test_loss: 0.8818, test_f1: 0.5325
 epoch: 48, train_loss: 0.8916, test_loss: 0.8750, test_f1: 0.5376
 epoch: 49, train_loss: 0.8915, test_loss: 0.8931, test_f1: 0.5360
 epoch: 50, train_loss: 0.8779, test_loss: 0.8756, test_f1: 0.5357
 epoch: 51, train_loss: 0.8856, test_loss: 0.8816, test_f1: 0.5417
 epoch: 52, train_loss: 0.8752, test_loss: 0.8736, test_f1: 0.5437
 epoch: 53, train_loss: 0.8770, test_loss: 0.8766, test_f1: 0.5410
 epoch: 54, train_loss: 0.8671, test_loss: 0.8745, test_f1: 0.5434
 epoch: 55, train_loss: 0.8742, test_loss: 0.8718, test_f1: 0.5413
 epoch: 56, train_loss: 0.8742, test_loss: 0.8739, test_f1: 0.5397
 epoch: 57, train_loss: 0.8768, test_loss: 0.8728, test_f1: 0.5436
 epoch: 58, train_loss: 0.8699, test_loss: 0.8738, test_f1: 0.5419
 epoch: 59, train_loss: 0.8616, test_loss: 0.8720, test_f1: 0.5475
 epoch: 60, train_loss: 0.8641, test_loss: 0.8735, test_f1: 0.5448
 epoch: 61, train_loss: 0.8595, test_loss: 0.8679, test_f1: 0.5395
 epoch: 62, train_loss: 0.8663, test_loss: 0.8686, test_f1: 0.5430
 epoch: 63, train_loss: 0.8599, test_loss: 0.8707, test_f1: 0.5378
 epoch: 64, train_loss: 0.8517, test_loss: 0.8661, test_f1: 0.5440
 epoch: 65, train_loss: 0.8596, test_loss: 0.8714, test_f1: 0.5417
 epoch: 66, train_loss: 0.8557, test_loss: 0.8678, test_f1: 0.5432
 epoch: 67, train_loss: 0.8629, test_loss: 0.8774, test_f1: 0.5502
 epoch: 68, train_loss: 0.8522, test_loss: 0.8694, test_f1: 0.5411
 epoch: 69, train_loss: 0.8572, test_loss: 0.8707, test_f1: 0.5444
 epoch: 70, train_loss: 0.8526, test_loss: 0.8668, test_f1: 0.5478
 epoch: 71, train_loss: 0.8441, test_loss: 0.8654, test_f1: 0.5489
 epoch: 72, train_loss: 0.8581, test_loss: 0.8695, test_f1: 0.5463
 epoch: 73, train_loss: 0.8477, test_loss: 0.8693, test_f1: 0.5471
 epoch: 74, train_loss: 0.8539, test_loss: 0.8650, test_f1: 0.5457
 epoch: 75, train_loss: 0.8494, test_loss: 0.8581, test_f1: 0.5451
 epoch: 76, train_loss: 0.8464, test_loss: 0.8622, test_f1: 0.5446
 epoch: 77, train_loss: 0.8465, test_loss: 0.8716, test_f1: 0.5527
 epoch: 78, train_loss: 0.8472, test_loss: 0.8581, test_f1: 0.5521
 epoch: 79, train_loss: 0.8434, test_loss: 0.8585, test_f1: 0.5505
 epoch: 80, train_loss: 0.8326, test_loss: 0.8676, test_f1: 0.5498
 epoch: 81, train_loss: 0.8476, test_loss: 0.8608, test_f1: 0.5547
 epoch: 82, train_loss: 0.8377, test_loss: 0.8690, test_f1: 0.5478
 epoch: 83, train_loss: 0.8458, test_loss: 0.8628, test_f1: 0.5581
 epoch: 84, train_loss: 0.8421, test_loss: 0.8627, test_f1: 0.5491
 epoch: 85, train_loss: 0.8275, test_loss: 0.8543, test_f1: 0.5556
 epoch: 86, train_loss: 0.8363, test_loss: 0.8620, test_f1: 0.5490
 epoch: 87, train_loss: 0.8301, test_loss: 0.8583, test_f1: 0.5516
 epoch: 88, train_loss: 0.8277, test_loss: 0.8586, test_f1: 0.5560
 epoch: 89, train_loss: 0.8365, test_loss: 0.8551, test_f1: 0.5586
 epoch: 90, train_loss: 0.8318, test_loss: 0.8606, test_f1: 0.5529
 epoch: 91, train_loss: 0.8260, test_loss: 0.8606, test_f1: 0.5545
 epoch: 92, train_loss: 0.8288, test_loss: 0.8642, test_f1: 0.5513
 epoch: 93, train_loss: 0.8289, test_loss: 0.8497, test_f1: 0.5602
 epoch: 94, train_loss: 0.8196, test_loss: 0.8595, test_f1: 0.5561
 epoch: 95, train_loss: 0.8200, test_loss: 0.8604, test_f1: 0.5501
 epoch: 96, train_loss: 0.8189, test_loss: 0.8546, test_f1: 0.5495
 epoch: 97, train_loss: 0.8243, test_loss: 0.8583, test_f1: 0.5514
 epoch: 98, train_loss: 0.8176, test_loss: 0.8562, test_f1: 0.5568
 epoch: 99, train_loss: 0.8143, test_loss: 0.8581, test_f1: 0.5512
##################ITERATION #4 ****************************************
 epoch: 0, train_loss: 1.2872, test_loss: 1.3111, test_f1: 0.2270
 epoch: 1, train_loss: 1.2526, test_loss: 1.2695, test_f1: 0.2270
 epoch: 2, train_loss: 1.2292, test_loss: 1.2161, test_f1: 0.2804
 epoch: 3, train_loss: 1.2048, test_loss: 1.1804, test_f1: 0.3435
 epoch: 4, train_loss: 1.1874, test_loss: 1.1521, test_f1: 0.3552
 epoch: 5, train_loss: 1.1666, test_loss: 1.1299, test_f1: 0.3728
 epoch: 6, train_loss: 1.1455, test_loss: 1.1089, test_f1: 0.3699
 epoch: 7, train_loss: 1.1300, test_loss: 1.0904, test_f1: 0.3733
 epoch: 8, train_loss: 1.1168, test_loss: 1.0776, test_f1: 0.3730
 epoch: 9, train_loss: 1.0960, test_loss: 1.0676, test_f1: 0.3828
 epoch: 10, train_loss: 1.0875, test_loss: 1.0570, test_f1: 0.4104
 epoch: 11, train_loss: 1.0792, test_loss: 1.0480, test_f1: 0.4383
 epoch: 12, train_loss: 1.0643, test_loss: 1.0396, test_f1: 0.4409
 epoch: 13, train_loss: 1.0543, test_loss: 1.0316, test_f1: 0.4477
 epoch: 14, train_loss: 1.0471, test_loss: 1.0221, test_f1: 0.4554
 epoch: 15, train_loss: 1.0467, test_loss: 1.0182, test_f1: 0.4582
 epoch: 16, train_loss: 1.0424, test_loss: 1.0125, test_f1: 0.4595
 epoch: 17, train_loss: 1.0272, test_loss: 1.0063, test_f1: 0.4737
 epoch: 18, train_loss: 1.0233, test_loss: 0.9978, test_f1: 0.4645
 epoch: 19, train_loss: 1.0157, test_loss: 0.9899, test_f1: 0.4771
 epoch: 20, train_loss: 1.0056, test_loss: 0.9823, test_f1: 0.4739
 epoch: 21, train_loss: 0.9933, test_loss: 0.9756, test_f1: 0.4779
 epoch: 22, train_loss: 0.9971, test_loss: 0.9706, test_f1: 0.4874
 epoch: 23, train_loss: 0.9806, test_loss: 0.9811, test_f1: 0.4794
 epoch: 24, train_loss: 0.9834, test_loss: 0.9674, test_f1: 0.4851
 epoch: 25, train_loss: 0.9808, test_loss: 0.9510, test_f1: 0.5005
 epoch: 26, train_loss: 0.9721, test_loss: 0.9461, test_f1: 0.4912
 epoch: 27, train_loss: 0.9644, test_loss: 0.9549, test_f1: 0.5022
 epoch: 28, train_loss: 0.9652, test_loss: 0.9320, test_f1: 0.5145
 epoch: 29, train_loss: 0.9537, test_loss: 0.9239, test_f1: 0.5277
 epoch: 30, train_loss: 0.9464, test_loss: 0.9282, test_f1: 0.5275
 epoch: 31, train_loss: 0.9414, test_loss: 0.9255, test_f1: 0.5161
 epoch: 32, train_loss: 0.9454, test_loss: 0.9162, test_f1: 0.5338
 epoch: 33, train_loss: 0.9351, test_loss: 0.9109, test_f1: 0.5256
 epoch: 34, train_loss: 0.9297, test_loss: 0.9061, test_f1: 0.5394
 epoch: 35, train_loss: 0.9403, test_loss: 0.9039, test_f1: 0.5287
 epoch: 36, train_loss: 0.9245, test_loss: 0.9029, test_f1: 0.5304
 epoch: 37, train_loss: 0.9170, test_loss: 0.9054, test_f1: 0.5282
 epoch: 38, train_loss: 0.9222, test_loss: 0.8925, test_f1: 0.5408
 epoch: 39, train_loss: 0.9191, test_loss: 0.9158, test_f1: 0.5285
 epoch: 40, train_loss: 0.9106, test_loss: 0.8931, test_f1: 0.5329
 epoch: 41, train_loss: 0.9093, test_loss: 0.8857, test_f1: 0.5329
 epoch: 42, train_loss: 0.9034, test_loss: 0.8906, test_f1: 0.5392
 epoch: 43, train_loss: 0.8952, test_loss: 0.8843, test_f1: 0.5360
 epoch: 44, train_loss: 0.9018, test_loss: 0.8961, test_f1: 0.5349
 epoch: 45, train_loss: 0.8986, test_loss: 0.8913, test_f1: 0.5330
 epoch: 46, train_loss: 0.9017, test_loss: 0.8940, test_f1: 0.5347
 epoch: 47, train_loss: 0.8956, test_loss: 0.8784, test_f1: 0.5420
 epoch: 48, train_loss: 0.8963, test_loss: 0.8742, test_f1: 0.5389
 epoch: 49, train_loss: 0.8909, test_loss: 0.8781, test_f1: 0.5361
 epoch: 50, train_loss: 0.8699, test_loss: 0.8695, test_f1: 0.5339
 epoch: 51, train_loss: 0.8863, test_loss: 0.8714, test_f1: 0.5461
 epoch: 52, train_loss: 0.8771, test_loss: 0.8777, test_f1: 0.5433
 epoch: 53, train_loss: 0.8736, test_loss: 0.8682, test_f1: 0.5454
 epoch: 54, train_loss: 0.8705, test_loss: 0.8797, test_f1: 0.5370
 epoch: 55, train_loss: 0.8777, test_loss: 0.8722, test_f1: 0.5471
 epoch: 56, train_loss: 0.8664, test_loss: 0.8719, test_f1: 0.5461
 epoch: 57, train_loss: 0.8641, test_loss: 0.8696, test_f1: 0.5460
 epoch: 58, train_loss: 0.8714, test_loss: 0.8639, test_f1: 0.5381
 epoch: 59, train_loss: 0.8657, test_loss: 0.8671, test_f1: 0.5419
 epoch: 60, train_loss: 0.8729, test_loss: 0.8695, test_f1: 0.5465
 epoch: 61, train_loss: 0.8718, test_loss: 0.8588, test_f1: 0.5491
 epoch: 62, train_loss: 0.8653, test_loss: 0.8652, test_f1: 0.5500
 epoch: 63, train_loss: 0.8743, test_loss: 0.8575, test_f1: 0.5540
 epoch: 64, train_loss: 0.8626, test_loss: 0.8696, test_f1: 0.5501
 epoch: 65, train_loss: 0.8658, test_loss: 0.8636, test_f1: 0.5457
 epoch: 66, train_loss: 0.8649, test_loss: 0.8647, test_f1: 0.5472
 epoch: 67, train_loss: 0.8582, test_loss: 0.8611, test_f1: 0.5463
 epoch: 68, train_loss: 0.8539, test_loss: 0.8535, test_f1: 0.5443
 epoch: 69, train_loss: 0.8748, test_loss: 0.8565, test_f1: 0.5491
 epoch: 70, train_loss: 0.8636, test_loss: 0.8640, test_f1: 0.5494
 epoch: 71, train_loss: 0.8514, test_loss: 0.8607, test_f1: 0.5426
 epoch: 72, train_loss: 0.8603, test_loss: 0.8657, test_f1: 0.5472
 epoch: 73, train_loss: 0.8579, test_loss: 0.8583, test_f1: 0.5459
 epoch: 74, train_loss: 0.8511, test_loss: 0.8563, test_f1: 0.5470
 epoch: 75, train_loss: 0.8535, test_loss: 0.8502, test_f1: 0.5471
 epoch: 76, train_loss: 0.8576, test_loss: 0.8589, test_f1: 0.5473
 epoch: 77, train_loss: 0.8523, test_loss: 0.8492, test_f1: 0.5473
 epoch: 78, train_loss: 0.8582, test_loss: 0.8508, test_f1: 0.5437
 epoch: 79, train_loss: 0.8525, test_loss: 0.8495, test_f1: 0.5516
 epoch: 80, train_loss: 0.8530, test_loss: 0.8550, test_f1: 0.5477
 epoch: 81, train_loss: 0.8549, test_loss: 0.8583, test_f1: 0.5393
 epoch: 82, train_loss: 0.8450, test_loss: 0.8479, test_f1: 0.5445
 epoch: 83, train_loss: 0.8408, test_loss: 0.8618, test_f1: 0.5479
 epoch: 84, train_loss: 0.8400, test_loss: 0.8552, test_f1: 0.5428
 epoch: 85, train_loss: 0.8361, test_loss: 0.8528, test_f1: 0.5422
 epoch: 86, train_loss: 0.8525, test_loss: 0.8580, test_f1: 0.5445
 epoch: 87, train_loss: 0.8459, test_loss: 0.8561, test_f1: 0.5450
 epoch: 88, train_loss: 0.8375, test_loss: 0.8445, test_f1: 0.5486
 epoch: 89, train_loss: 0.8348, test_loss: 0.8515, test_f1: 0.5400
 epoch: 90, train_loss: 0.8386, test_loss: 0.8526, test_f1: 0.5456
 epoch: 91, train_loss: 0.8223, test_loss: 0.8439, test_f1: 0.5543
 epoch: 92, train_loss: 0.8418, test_loss: 0.8530, test_f1: 0.5550
 epoch: 93, train_loss: 0.8327, test_loss: 0.8566, test_f1: 0.5450
 epoch: 94, train_loss: 0.8414, test_loss: 0.8430, test_f1: 0.5581
 epoch: 95, train_loss: 0.8363, test_loss: 0.8449, test_f1: 0.5496
 epoch: 96, train_loss: 0.8332, test_loss: 0.8449, test_f1: 0.5424
 epoch: 97, train_loss: 0.8308, test_loss: 0.8461, test_f1: 0.5481
 epoch: 98, train_loss: 0.8318, test_loss: 0.8369, test_f1: 0.5524
 epoch: 99, train_loss: 0.8339, test_loss: 0.8459, test_f1: 0.5494
##################ITERATION #5 ****************************************
 epoch: 0, train_loss: 1.2785, test_loss: 1.3195, test_f1: 0.2270
 epoch: 1, train_loss: 1.2203, test_loss: 1.3624, test_f1: 0.2588
 epoch: 2, train_loss: 1.1938, test_loss: 1.1814, test_f1: 0.3589
 epoch: 3, train_loss: 1.1626, test_loss: 1.1275, test_f1: 0.4004
 epoch: 4, train_loss: 1.1369, test_loss: 1.1028, test_f1: 0.4121
 epoch: 5, train_loss: 1.1137, test_loss: 1.0799, test_f1: 0.4304
 epoch: 6, train_loss: 1.0941, test_loss: 1.0629, test_f1: 0.4410
 epoch: 7, train_loss: 1.0728, test_loss: 1.0480, test_f1: 0.4430
 epoch: 8, train_loss: 1.0646, test_loss: 1.0310, test_f1: 0.4469
 epoch: 9, train_loss: 1.0407, test_loss: 1.0246, test_f1: 0.4467
 epoch: 10, train_loss: 1.0367, test_loss: 1.0108, test_f1: 0.4643
 epoch: 11, train_loss: 1.0222, test_loss: 1.0019, test_f1: 0.4790
 epoch: 12, train_loss: 1.0104, test_loss: 0.9964, test_f1: 0.4775
 epoch: 13, train_loss: 1.0075, test_loss: 0.9910, test_f1: 0.4832
 epoch: 14, train_loss: 0.9935, test_loss: 0.9823, test_f1: 0.4857
 epoch: 15, train_loss: 0.9910, test_loss: 0.9827, test_f1: 0.4946
 epoch: 16, train_loss: 0.9861, test_loss: 0.9713, test_f1: 0.4967
 epoch: 17, train_loss: 0.9793, test_loss: 0.9620, test_f1: 0.5002
 epoch: 18, train_loss: 0.9670, test_loss: 0.9528, test_f1: 0.5098
 epoch: 19, train_loss: 0.9698, test_loss: 0.9495, test_f1: 0.5150
 epoch: 20, train_loss: 0.9666, test_loss: 0.9515, test_f1: 0.5128
 epoch: 21, train_loss: 0.9629, test_loss: 0.9351, test_f1: 0.5188
 epoch: 22, train_loss: 0.9491, test_loss: 0.9282, test_f1: 0.5290
 epoch: 23, train_loss: 0.9469, test_loss: 0.9283, test_f1: 0.5237
 epoch: 24, train_loss: 0.9374, test_loss: 0.9233, test_f1: 0.5282
 epoch: 25, train_loss: 0.9336, test_loss: 0.9186, test_f1: 0.5272
 epoch: 26, train_loss: 0.9356, test_loss: 0.9186, test_f1: 0.5330
 epoch: 27, train_loss: 0.9352, test_loss: 0.9127, test_f1: 0.5291
 epoch: 28, train_loss: 0.9300, test_loss: 0.9021, test_f1: 0.5323
 epoch: 29, train_loss: 0.9238, test_loss: 0.9012, test_f1: 0.5307
 epoch: 30, train_loss: 0.9184, test_loss: 0.9360, test_f1: 0.5117
 epoch: 31, train_loss: 0.9179, test_loss: 0.9022, test_f1: 0.5325
 epoch: 32, train_loss: 0.9157, test_loss: 0.8988, test_f1: 0.5366
 epoch: 33, train_loss: 0.9050, test_loss: 0.8943, test_f1: 0.5337
 epoch: 34, train_loss: 0.8998, test_loss: 0.8989, test_f1: 0.5345
 epoch: 35, train_loss: 0.9014, test_loss: 0.8828, test_f1: 0.5294
 epoch: 36, train_loss: 0.9027, test_loss: 0.8829, test_f1: 0.5543
 epoch: 37, train_loss: 0.9023, test_loss: 0.8807, test_f1: 0.5362
 epoch: 38, train_loss: 0.9032, test_loss: 0.8897, test_f1: 0.5335
 epoch: 39, train_loss: 0.8931, test_loss: 0.8810, test_f1: 0.5354
 epoch: 40, train_loss: 0.8930, test_loss: 0.8734, test_f1: 0.5431
 epoch: 41, train_loss: 0.8948, test_loss: 0.8826, test_f1: 0.5362
 epoch: 42, train_loss: 0.8936, test_loss: 0.8767, test_f1: 0.5296
 epoch: 43, train_loss: 0.8855, test_loss: 0.8642, test_f1: 0.5411
 epoch: 44, train_loss: 0.8875, test_loss: 0.8714, test_f1: 0.5342
 epoch: 45, train_loss: 0.8839, test_loss: 0.8608, test_f1: 0.5544
 epoch: 46, train_loss: 0.8841, test_loss: 0.8603, test_f1: 0.5436
 epoch: 47, train_loss: 0.8768, test_loss: 0.8685, test_f1: 0.5398
 epoch: 48, train_loss: 0.8701, test_loss: 0.8577, test_f1: 0.5454
 epoch: 49, train_loss: 0.8732, test_loss: 0.8572, test_f1: 0.5509
 epoch: 50, train_loss: 0.8698, test_loss: 0.8618, test_f1: 0.5512
 epoch: 51, train_loss: 0.8661, test_loss: 0.8534, test_f1: 0.5574
 epoch: 52, train_loss: 0.8636, test_loss: 0.8524, test_f1: 0.5433
 epoch: 53, train_loss: 0.8548, test_loss: 0.8490, test_f1: 0.5512
 epoch: 54, train_loss: 0.8667, test_loss: 0.8540, test_f1: 0.5475
 epoch: 55, train_loss: 0.8631, test_loss: 0.8498, test_f1: 0.5589
 epoch: 56, train_loss: 0.8642, test_loss: 0.8502, test_f1: 0.5504
 epoch: 57, train_loss: 0.8638, test_loss: 0.8457, test_f1: 0.5477
 epoch: 58, train_loss: 0.8615, test_loss: 0.8462, test_f1: 0.5496
 epoch: 59, train_loss: 0.8639, test_loss: 0.8464, test_f1: 0.5554
 epoch: 60, train_loss: 0.8542, test_loss: 0.8458, test_f1: 0.5481
 epoch: 61, train_loss: 0.8545, test_loss: 0.8477, test_f1: 0.5505
 epoch: 62, train_loss: 0.8606, test_loss: 0.8520, test_f1: 0.5535
 epoch: 63, train_loss: 0.8497, test_loss: 0.8512, test_f1: 0.5501
 epoch: 64, train_loss: 0.8602, test_loss: 0.8528, test_f1: 0.5482
 epoch: 65, train_loss: 0.8666, test_loss: 0.8496, test_f1: 0.5500
 epoch: 66, train_loss: 0.8537, test_loss: 0.8469, test_f1: 0.5572
 epoch: 67, train_loss: 0.8549, test_loss: 0.8430, test_f1: 0.5546
 epoch: 68, train_loss: 0.8484, test_loss: 0.8443, test_f1: 0.5525
 epoch: 69, train_loss: 0.8532, test_loss: 0.8419, test_f1: 0.5643
 epoch: 70, train_loss: 0.8407, test_loss: 0.8384, test_f1: 0.5514
 epoch: 71, train_loss: 0.8496, test_loss: 0.8394, test_f1: 0.5525
 epoch: 72, train_loss: 0.8457, test_loss: 0.8416, test_f1: 0.5489
 epoch: 73, train_loss: 0.8375, test_loss: 0.8361, test_f1: 0.5550
 epoch: 74, train_loss: 0.8493, test_loss: 0.8356, test_f1: 0.5520
 epoch: 75, train_loss: 0.8359, test_loss: 0.8408, test_f1: 0.5573
 epoch: 76, train_loss: 0.8336, test_loss: 0.8386, test_f1: 0.5493
 epoch: 77, train_loss: 0.8508, test_loss: 0.8391, test_f1: 0.5532
 epoch: 78, train_loss: 0.8457, test_loss: 0.8424, test_f1: 0.5488
 epoch: 79, train_loss: 0.8409, test_loss: 0.8405, test_f1: 0.5540
 epoch: 80, train_loss: 0.8414, test_loss: 0.8417, test_f1: 0.5581
 epoch: 81, train_loss: 0.8410, test_loss: 0.8439, test_f1: 0.5562
 epoch: 82, train_loss: 0.8374, test_loss: 0.8468, test_f1: 0.5584
 epoch: 83, train_loss: 0.8325, test_loss: 0.8376, test_f1: 0.5601
 epoch: 84, train_loss: 0.8411, test_loss: 0.8370, test_f1: 0.5611
 epoch: 85, train_loss: 0.8273, test_loss: 0.8359, test_f1: 0.5557
 epoch: 86, train_loss: 0.8302, test_loss: 0.8309, test_f1: 0.5580
 epoch: 87, train_loss: 0.8359, test_loss: 0.8347, test_f1: 0.5511
 epoch: 88, train_loss: 0.8369, test_loss: 0.8342, test_f1: 0.5603
 epoch: 89, train_loss: 0.8332, test_loss: 0.8349, test_f1: 0.5636
 epoch: 90, train_loss: 0.8352, test_loss: 0.8338, test_f1: 0.5566
 epoch: 91, train_loss: 0.8315, test_loss: 0.8359, test_f1: 0.5668
 epoch: 92, train_loss: 0.8334, test_loss: 0.8303, test_f1: 0.5596
 epoch: 93, train_loss: 0.8390, test_loss: 0.8305, test_f1: 0.5559
 epoch: 94, train_loss: 0.8275, test_loss: 0.8323, test_f1: 0.5555
 epoch: 95, train_loss: 0.8363, test_loss: 0.8330, test_f1: 0.5467
 epoch: 96, train_loss: 0.8288, test_loss: 0.8295, test_f1: 0.5521
 epoch: 97, train_loss: 0.8289, test_loss: 0.8325, test_f1: 0.5573
 epoch: 98, train_loss: 0.8243, test_loss: 0.8326, test_f1: 0.5455
 epoch: 99, train_loss: 0.8271, test_loss: 0.8335, test_f1: 0.5515
##################ITERATION #6 ****************************************
 epoch: 0, train_loss: 1.2907, test_loss: 1.3147, test_f1: 0.2270
 epoch: 1, train_loss: 1.2364, test_loss: 1.2744, test_f1: 0.2270
 epoch: 2, train_loss: 1.2107, test_loss: 1.2054, test_f1: 0.2345
 epoch: 3, train_loss: 1.1899, test_loss: 1.1618, test_f1: 0.3485
 epoch: 4, train_loss: 1.1668, test_loss: 1.1335, test_f1: 0.3648
 epoch: 5, train_loss: 1.1412, test_loss: 1.1115, test_f1: 0.3874
 epoch: 6, train_loss: 1.1293, test_loss: 1.0914, test_f1: 0.3966
 epoch: 7, train_loss: 1.1030, test_loss: 1.0749, test_f1: 0.4251
 epoch: 8, train_loss: 1.0894, test_loss: 1.0588, test_f1: 0.4252
 epoch: 9, train_loss: 1.0689, test_loss: 1.0553, test_f1: 0.4246
 epoch: 10, train_loss: 1.0571, test_loss: 1.0199, test_f1: 0.4488
 epoch: 11, train_loss: 1.0430, test_loss: 1.0151, test_f1: 0.4569
 epoch: 12, train_loss: 1.0341, test_loss: 1.0223, test_f1: 0.4369
 epoch: 13, train_loss: 1.0189, test_loss: 1.0114, test_f1: 0.4648
 epoch: 14, train_loss: 1.0230, test_loss: 1.0227, test_f1: 0.4547
 epoch: 15, train_loss: 1.0034, test_loss: 1.0095, test_f1: 0.4715
 epoch: 16, train_loss: 0.9994, test_loss: 1.0058, test_f1: 0.4829
 epoch: 17, train_loss: 1.0000, test_loss: 1.0133, test_f1: 0.4599
 epoch: 18, train_loss: 0.9902, test_loss: 0.9945, test_f1: 0.4977
 epoch: 19, train_loss: 0.9807, test_loss: 0.9839, test_f1: 0.5036
 epoch: 20, train_loss: 0.9730, test_loss: 0.9912, test_f1: 0.5045
 epoch: 21, train_loss: 0.9648, test_loss: 1.0048, test_f1: 0.4824
 epoch: 22, train_loss: 0.9659, test_loss: 1.0350, test_f1: 0.4561
 epoch: 23, train_loss: 0.9524, test_loss: 0.9894, test_f1: 0.5091
 epoch: 24, train_loss: 0.9473, test_loss: 0.9943, test_f1: 0.4923
 epoch: 25, train_loss: 0.9417, test_loss: 0.9715, test_f1: 0.5085
 epoch: 26, train_loss: 0.9440, test_loss: 0.9728, test_f1: 0.5129
 epoch: 27, train_loss: 0.9405, test_loss: 0.9928, test_f1: 0.4914
 epoch: 28, train_loss: 0.9405, test_loss: 0.9637, test_f1: 0.5128
 epoch: 29, train_loss: 0.9281, test_loss: 0.9708, test_f1: 0.5290
 epoch: 30, train_loss: 0.9281, test_loss: 1.0111, test_f1: 0.4872
 epoch: 31, train_loss: 0.9277, test_loss: 0.9629, test_f1: 0.5259
 epoch: 32, train_loss: 0.9241, test_loss: 0.9766, test_f1: 0.5047
 epoch: 33, train_loss: 0.9131, test_loss: 0.9569, test_f1: 0.5347
 epoch: 34, train_loss: 0.9146, test_loss: 0.9520, test_f1: 0.5186
 epoch: 35, train_loss: 0.9047, test_loss: 0.9553, test_f1: 0.5305
 epoch: 36, train_loss: 0.9058, test_loss: 0.9589, test_f1: 0.5281
 epoch: 37, train_loss: 0.8984, test_loss: 0.9502, test_f1: 0.5284
 epoch: 38, train_loss: 0.9016, test_loss: 0.9907, test_f1: 0.5084
 epoch: 39, train_loss: 0.8934, test_loss: 0.9370, test_f1: 0.5401
 epoch: 40, train_loss: 0.8978, test_loss: 0.9348, test_f1: 0.5264
 epoch: 41, train_loss: 0.8859, test_loss: 0.9611, test_f1: 0.5140
 epoch: 42, train_loss: 0.8887, test_loss: 0.9320, test_f1: 0.5272
 epoch: 43, train_loss: 0.8839, test_loss: 0.9493, test_f1: 0.5165
 epoch: 44, train_loss: 0.8947, test_loss: 0.9742, test_f1: 0.5114
 epoch: 45, train_loss: 0.8786, test_loss: 0.9474, test_f1: 0.5232
 epoch: 46, train_loss: 0.8794, test_loss: 0.9657, test_f1: 0.5145
 epoch: 47, train_loss: 0.8768, test_loss: 0.9393, test_f1: 0.5289
 epoch: 48, train_loss: 0.8722, test_loss: 0.9479, test_f1: 0.5242
 epoch: 49, train_loss: 0.8770, test_loss: 0.9307, test_f1: 0.5238
 epoch: 50, train_loss: 0.8708, test_loss: 0.9331, test_f1: 0.5110
 epoch: 51, train_loss: 0.8624, test_loss: 0.9399, test_f1: 0.5179
 epoch: 52, train_loss: 0.8522, test_loss: 0.9541, test_f1: 0.5120
 epoch: 53, train_loss: 0.8616, test_loss: 0.9376, test_f1: 0.5230
 epoch: 54, train_loss: 0.8606, test_loss: 0.9339, test_f1: 0.5041
 epoch: 55, train_loss: 0.8591, test_loss: 0.9280, test_f1: 0.5227
 epoch: 56, train_loss: 0.8486, test_loss: 0.9516, test_f1: 0.5181
 epoch: 57, train_loss: 0.8585, test_loss: 0.9371, test_f1: 0.5268
 epoch: 58, train_loss: 0.8517, test_loss: 0.9349, test_f1: 0.5238
 epoch: 59, train_loss: 0.8518, test_loss: 0.9424, test_f1: 0.5179
 epoch: 60, train_loss: 0.8553, test_loss: 0.9274, test_f1: 0.5221
 epoch: 61, train_loss: 0.8580, test_loss: 0.9345, test_f1: 0.5239
 epoch: 62, train_loss: 0.8532, test_loss: 0.9453, test_f1: 0.5136
 epoch: 63, train_loss: 0.8493, test_loss: 0.9434, test_f1: 0.5081
 epoch: 64, train_loss: 0.8383, test_loss: 0.9414, test_f1: 0.5058
 epoch: 65, train_loss: 0.8508, test_loss: 0.9247, test_f1: 0.5124
 epoch: 66, train_loss: 0.8528, test_loss: 0.9146, test_f1: 0.5251
 epoch: 67, train_loss: 0.8446, test_loss: 0.9295, test_f1: 0.5257
 epoch: 68, train_loss: 0.8549, test_loss: 0.9236, test_f1: 0.5174
 epoch: 69, train_loss: 0.8381, test_loss: 0.9285, test_f1: 0.5288
 epoch: 70, train_loss: 0.8457, test_loss: 0.9383, test_f1: 0.5244
 epoch: 71, train_loss: 0.8321, test_loss: 0.9279, test_f1: 0.5254
 epoch: 72, train_loss: 0.8366, test_loss: 0.9345, test_f1: 0.5054
 epoch: 73, train_loss: 0.8387, test_loss: 0.9365, test_f1: 0.5131
 epoch: 74, train_loss: 0.8489, test_loss: 0.9241, test_f1: 0.5281
 epoch: 75, train_loss: 0.8357, test_loss: 0.9320, test_f1: 0.5267
 epoch: 76, train_loss: 0.8356, test_loss: 0.9341, test_f1: 0.5260
 epoch: 77, train_loss: 0.8321, test_loss: 0.9352, test_f1: 0.5239
 epoch: 78, train_loss: 0.8316, test_loss: 0.9317, test_f1: 0.5286
 epoch: 79, train_loss: 0.8337, test_loss: 0.9272, test_f1: 0.5302
 epoch: 80, train_loss: 0.8301, test_loss: 0.9288, test_f1: 0.5287
 epoch: 81, train_loss: 0.8355, test_loss: 0.9271, test_f1: 0.5203
 epoch: 82, train_loss: 0.8305, test_loss: 0.9351, test_f1: 0.5316
 epoch: 83, train_loss: 0.8375, test_loss: 0.9331, test_f1: 0.5241
 epoch: 84, train_loss: 0.8289, test_loss: 0.9391, test_f1: 0.5213
 epoch: 85, train_loss: 0.8258, test_loss: 0.9327, test_f1: 0.5246
 epoch: 86, train_loss: 0.8325, test_loss: 0.9339, test_f1: 0.5200
 epoch: 87, train_loss: 0.8222, test_loss: 0.9344, test_f1: 0.5215
 epoch: 88, train_loss: 0.8223, test_loss: 0.9360, test_f1: 0.5316
 epoch: 89, train_loss: 0.8241, test_loss: 0.9517, test_f1: 0.5318
 epoch: 90, train_loss: 0.8212, test_loss: 0.9470, test_f1: 0.5192
 epoch: 91, train_loss: 0.8215, test_loss: 0.9391, test_f1: 0.5255
 epoch: 92, train_loss: 0.8163, test_loss: 0.9403, test_f1: 0.5272
 epoch: 93, train_loss: 0.8268, test_loss: 0.9381, test_f1: 0.5310
 epoch: 94, train_loss: 0.8205, test_loss: 0.9383, test_f1: 0.5278
 epoch: 95, train_loss: 0.8210, test_loss: 0.9485, test_f1: 0.5302
 epoch: 96, train_loss: 0.8172, test_loss: 0.9410, test_f1: 0.5312
 epoch: 97, train_loss: 0.8126, test_loss: 0.9328, test_f1: 0.5338
 epoch: 98, train_loss: 0.8281, test_loss: 0.9324, test_f1: 0.5318
 epoch: 99, train_loss: 0.8174, test_loss: 0.9424, test_f1: 0.5346
##################ITERATION #7 ****************************************
 epoch: 0, train_loss: 1.2888, test_loss: 1.3165, test_f1: 0.2270
 epoch: 1, train_loss: 1.2277, test_loss: 1.3026, test_f1: 0.2270
 epoch: 2, train_loss: 1.2037, test_loss: 1.1923, test_f1: 0.2986
 epoch: 3, train_loss: 1.1751, test_loss: 1.1435, test_f1: 0.4068
 epoch: 4, train_loss: 1.1451, test_loss: 1.1151, test_f1: 0.4414
 epoch: 5, train_loss: 1.1279, test_loss: 1.0935, test_f1: 0.4589
 epoch: 6, train_loss: 1.1093, test_loss: 1.0740, test_f1: 0.4617
 epoch: 7, train_loss: 1.0883, test_loss: 1.0605, test_f1: 0.4676
 epoch: 8, train_loss: 1.0819, test_loss: 1.0478, test_f1: 0.4696
 epoch: 9, train_loss: 1.0659, test_loss: 1.0356, test_f1: 0.4683
 epoch: 10, train_loss: 1.0514, test_loss: 1.0264, test_f1: 0.4736
 epoch: 11, train_loss: 1.0429, test_loss: 1.0164, test_f1: 0.4753
 epoch: 12, train_loss: 1.0295, test_loss: 1.0132, test_f1: 0.4761
 epoch: 13, train_loss: 1.0160, test_loss: 1.0030, test_f1: 0.4776
 epoch: 14, train_loss: 1.0184, test_loss: 0.9995, test_f1: 0.4747
 epoch: 15, train_loss: 1.0086, test_loss: 0.9950, test_f1: 0.4730
 epoch: 16, train_loss: 0.9961, test_loss: 0.9871, test_f1: 0.4869
 epoch: 17, train_loss: 0.9987, test_loss: 0.9809, test_f1: 0.4811
 epoch: 18, train_loss: 0.9873, test_loss: 0.9717, test_f1: 0.4933
 epoch: 19, train_loss: 0.9855, test_loss: 0.9685, test_f1: 0.4898
 epoch: 20, train_loss: 0.9835, test_loss: 0.9646, test_f1: 0.4895
 epoch: 21, train_loss: 0.9760, test_loss: 0.9575, test_f1: 0.4952
 epoch: 22, train_loss: 0.9710, test_loss: 0.9620, test_f1: 0.4846
 epoch: 23, train_loss: 0.9626, test_loss: 0.9469, test_f1: 0.5080
 epoch: 24, train_loss: 0.9595, test_loss: 0.9485, test_f1: 0.5040
 epoch: 25, train_loss: 0.9581, test_loss: 0.9460, test_f1: 0.4894
 epoch: 26, train_loss: 0.9570, test_loss: 0.9413, test_f1: 0.5101
 epoch: 27, train_loss: 0.9424, test_loss: 0.9392, test_f1: 0.5175
 epoch: 28, train_loss: 0.9460, test_loss: 0.9429, test_f1: 0.5131
 epoch: 29, train_loss: 0.9357, test_loss: 0.9292, test_f1: 0.5282
 epoch: 30, train_loss: 0.9385, test_loss: 0.9291, test_f1: 0.5175
 epoch: 31, train_loss: 0.9318, test_loss: 0.9216, test_f1: 0.5359
 epoch: 32, train_loss: 0.9294, test_loss: 0.9212, test_f1: 0.5128
 epoch: 33, train_loss: 0.9313, test_loss: 0.9202, test_f1: 0.5352
 epoch: 34, train_loss: 0.9295, test_loss: 0.9193, test_f1: 0.5251
 epoch: 35, train_loss: 0.9205, test_loss: 0.9152, test_f1: 0.5382
 epoch: 36, train_loss: 0.9205, test_loss: 0.9195, test_f1: 0.5337
 epoch: 37, train_loss: 0.9221, test_loss: 0.9164, test_f1: 0.5377
 epoch: 38, train_loss: 0.9156, test_loss: 0.9061, test_f1: 0.5455
 epoch: 39, train_loss: 0.9026, test_loss: 0.9072, test_f1: 0.5406
 epoch: 40, train_loss: 0.9100, test_loss: 0.9053, test_f1: 0.5440
 epoch: 41, train_loss: 0.9037, test_loss: 0.9081, test_f1: 0.5420
 epoch: 42, train_loss: 0.8989, test_loss: 0.9057, test_f1: 0.5461
 epoch: 43, train_loss: 0.8953, test_loss: 0.9064, test_f1: 0.5455
 epoch: 44, train_loss: 0.8950, test_loss: 0.9029, test_f1: 0.5457
 epoch: 45, train_loss: 0.8863, test_loss: 0.9075, test_f1: 0.5365
 epoch: 46, train_loss: 0.8864, test_loss: 0.8948, test_f1: 0.5438
 epoch: 47, train_loss: 0.8819, test_loss: 0.8961, test_f1: 0.5465
 epoch: 48, train_loss: 0.8855, test_loss: 0.8988, test_f1: 0.5530
 epoch: 49, train_loss: 0.8884, test_loss: 0.9070, test_f1: 0.5358
 epoch: 50, train_loss: 0.8804, test_loss: 0.9089, test_f1: 0.5306
 epoch: 51, train_loss: 0.8841, test_loss: 0.8904, test_f1: 0.5539
 epoch: 52, train_loss: 0.8788, test_loss: 0.8970, test_f1: 0.5444
 epoch: 53, train_loss: 0.8763, test_loss: 0.8937, test_f1: 0.5481
 epoch: 54, train_loss: 0.8821, test_loss: 0.8936, test_f1: 0.5499
 epoch: 55, train_loss: 0.8674, test_loss: 0.8938, test_f1: 0.5512
 epoch: 56, train_loss: 0.8742, test_loss: 0.8964, test_f1: 0.5414
 epoch: 57, train_loss: 0.8757, test_loss: 0.8973, test_f1: 0.5528
 epoch: 58, train_loss: 0.8688, test_loss: 0.8902, test_f1: 0.5491
 epoch: 59, train_loss: 0.8679, test_loss: 0.8863, test_f1: 0.5531
 epoch: 60, train_loss: 0.8641, test_loss: 0.8983, test_f1: 0.5518
 epoch: 61, train_loss: 0.8653, test_loss: 0.8970, test_f1: 0.5454
 epoch: 62, train_loss: 0.8616, test_loss: 0.8871, test_f1: 0.5489
 epoch: 63, train_loss: 0.8623, test_loss: 0.8910, test_f1: 0.5520
 epoch: 64, train_loss: 0.8582, test_loss: 0.8964, test_f1: 0.5452
 epoch: 65, train_loss: 0.8649, test_loss: 0.8836, test_f1: 0.5534
 epoch: 66, train_loss: 0.8656, test_loss: 0.9001, test_f1: 0.5409
 epoch: 67, train_loss: 0.8642, test_loss: 0.9082, test_f1: 0.5399
 epoch: 68, train_loss: 0.8728, test_loss: 0.8948, test_f1: 0.5451
 epoch: 69, train_loss: 0.8627, test_loss: 0.8921, test_f1: 0.5497
 epoch: 70, train_loss: 0.8605, test_loss: 0.8873, test_f1: 0.5552
 epoch: 71, train_loss: 0.8553, test_loss: 0.8816, test_f1: 0.5499
 epoch: 72, train_loss: 0.8646, test_loss: 0.8873, test_f1: 0.5543
 epoch: 73, train_loss: 0.8582, test_loss: 0.8884, test_f1: 0.5521
 epoch: 74, train_loss: 0.8591, test_loss: 0.8859, test_f1: 0.5570
 epoch: 75, train_loss: 0.8577, test_loss: 0.8780, test_f1: 0.5495
 epoch: 76, train_loss: 0.8499, test_loss: 0.8805, test_f1: 0.5479
 epoch: 77, train_loss: 0.8511, test_loss: 0.8769, test_f1: 0.5524
 epoch: 78, train_loss: 0.8474, test_loss: 0.8842, test_f1: 0.5545
 epoch: 79, train_loss: 0.8458, test_loss: 0.8857, test_f1: 0.5514
 epoch: 80, train_loss: 0.8506, test_loss: 0.8798, test_f1: 0.5572
 epoch: 81, train_loss: 0.8427, test_loss: 0.8829, test_f1: 0.5577
 epoch: 82, train_loss: 0.8508, test_loss: 0.8802, test_f1: 0.5587
 epoch: 83, train_loss: 0.8449, test_loss: 0.8921, test_f1: 0.5486
 epoch: 84, train_loss: 0.8561, test_loss: 0.8859, test_f1: 0.5386
 epoch: 85, train_loss: 0.8406, test_loss: 0.8874, test_f1: 0.5393
 epoch: 86, train_loss: 0.8420, test_loss: 0.8831, test_f1: 0.5511
 epoch: 87, train_loss: 0.8423, test_loss: 0.8832, test_f1: 0.5558
 epoch: 88, train_loss: 0.8439, test_loss: 0.8820, test_f1: 0.5535
 epoch: 89, train_loss: 0.8357, test_loss: 0.8813, test_f1: 0.5546
 epoch: 90, train_loss: 0.8471, test_loss: 0.8726, test_f1: 0.5502
 epoch: 91, train_loss: 0.8463, test_loss: 0.8801, test_f1: 0.5538
 epoch: 92, train_loss: 0.8459, test_loss: 0.8826, test_f1: 0.5491
 epoch: 93, train_loss: 0.8328, test_loss: 0.8747, test_f1: 0.5520
 epoch: 94, train_loss: 0.8289, test_loss: 0.8807, test_f1: 0.5464
 epoch: 95, train_loss: 0.8279, test_loss: 0.8845, test_f1: 0.5490
 epoch: 96, train_loss: 0.8403, test_loss: 0.8735, test_f1: 0.5481
 epoch: 97, train_loss: 0.8402, test_loss: 0.8742, test_f1: 0.5532
 epoch: 98, train_loss: 0.8322, test_loss: 0.8877, test_f1: 0.5459
 epoch: 99, train_loss: 0.8384, test_loss: 0.8905, test_f1: 0.5525
##################ITERATION #8 ****************************************
 epoch: 0, train_loss: 1.3077, test_loss: 1.3132, test_f1: 0.2270
 epoch: 1, train_loss: 1.2344, test_loss: 1.2577, test_f1: 0.2270
 epoch: 2, train_loss: 1.2079, test_loss: 1.1972, test_f1: 0.2637
 epoch: 3, train_loss: 1.1879, test_loss: 1.1463, test_f1: 0.3746
 epoch: 4, train_loss: 1.1629, test_loss: 1.1239, test_f1: 0.3819
 epoch: 5, train_loss: 1.1474, test_loss: 1.1041, test_f1: 0.4064
 epoch: 6, train_loss: 1.1210, test_loss: 1.0874, test_f1: 0.4265
 epoch: 7, train_loss: 1.1023, test_loss: 1.0720, test_f1: 0.4320
 epoch: 8, train_loss: 1.0840, test_loss: 1.0605, test_f1: 0.4435
 epoch: 9, train_loss: 1.0670, test_loss: 1.0466, test_f1: 0.4605
 epoch: 10, train_loss: 1.0503, test_loss: 1.0432, test_f1: 0.4702
 epoch: 11, train_loss: 1.0412, test_loss: 1.0323, test_f1: 0.4860
 epoch: 12, train_loss: 1.0272, test_loss: 1.0197, test_f1: 0.4893
 epoch: 13, train_loss: 1.0134, test_loss: 1.0095, test_f1: 0.4992
 epoch: 14, train_loss: 1.0031, test_loss: 0.9976, test_f1: 0.4927
 epoch: 15, train_loss: 0.9940, test_loss: 0.9985, test_f1: 0.4898
 epoch: 16, train_loss: 0.9894, test_loss: 0.9879, test_f1: 0.5058
 epoch: 17, train_loss: 0.9814, test_loss: 0.9841, test_f1: 0.5031
 epoch: 18, train_loss: 0.9743, test_loss: 0.9772, test_f1: 0.5098
 epoch: 19, train_loss: 0.9743, test_loss: 0.9662, test_f1: 0.5007
 epoch: 20, train_loss: 0.9566, test_loss: 0.9698, test_f1: 0.5005
 epoch: 21, train_loss: 0.9621, test_loss: 0.9631, test_f1: 0.5009
 epoch: 22, train_loss: 0.9484, test_loss: 0.9663, test_f1: 0.5079
 epoch: 23, train_loss: 0.9445, test_loss: 0.9628, test_f1: 0.5051
 epoch: 24, train_loss: 0.9422, test_loss: 0.9618, test_f1: 0.5039
 epoch: 25, train_loss: 0.9481, test_loss: 0.9618, test_f1: 0.5044
 epoch: 26, train_loss: 0.9424, test_loss: 0.9486, test_f1: 0.5049
 epoch: 27, train_loss: 0.9365, test_loss: 0.9611, test_f1: 0.5153
 epoch: 28, train_loss: 0.9285, test_loss: 0.9562, test_f1: 0.5093
 epoch: 29, train_loss: 0.9235, test_loss: 0.9558, test_f1: 0.5107
 epoch: 30, train_loss: 0.9218, test_loss: 0.9510, test_f1: 0.5111
 epoch: 31, train_loss: 0.9225, test_loss: 0.9553, test_f1: 0.5128
 epoch: 32, train_loss: 0.9188, test_loss: 0.9577, test_f1: 0.5169
 epoch: 33, train_loss: 0.9133, test_loss: 0.9536, test_f1: 0.5137
 epoch: 34, train_loss: 0.9054, test_loss: 0.9577, test_f1: 0.5157
 epoch: 35, train_loss: 0.9070, test_loss: 0.9569, test_f1: 0.5161
 epoch: 36, train_loss: 0.9007, test_loss: 0.9521, test_f1: 0.5123
 epoch: 37, train_loss: 0.9000, test_loss: 0.9481, test_f1: 0.5160
 epoch: 38, train_loss: 0.8922, test_loss: 0.9572, test_f1: 0.5199
 epoch: 39, train_loss: 0.8908, test_loss: 0.9410, test_f1: 0.5239
 epoch: 40, train_loss: 0.8953, test_loss: 0.9570, test_f1: 0.5334
 epoch: 41, train_loss: 0.8903, test_loss: 0.9412, test_f1: 0.5272
 epoch: 42, train_loss: 0.8837, test_loss: 0.9529, test_f1: 0.5240
 epoch: 43, train_loss: 0.8788, test_loss: 0.9501, test_f1: 0.5326
 epoch: 44, train_loss: 0.8871, test_loss: 0.9644, test_f1: 0.5201
 epoch: 45, train_loss: 0.8870, test_loss: 0.9551, test_f1: 0.5295
 epoch: 46, train_loss: 0.8650, test_loss: 0.9487, test_f1: 0.5321
 epoch: 47, train_loss: 0.8815, test_loss: 0.9666, test_f1: 0.5345
 epoch: 48, train_loss: 0.8683, test_loss: 0.9538, test_f1: 0.5390
 epoch: 49, train_loss: 0.8681, test_loss: 0.9620, test_f1: 0.5283
 epoch: 50, train_loss: 0.8685, test_loss: 0.9629, test_f1: 0.5352
 epoch: 51, train_loss: 0.8771, test_loss: 0.9534, test_f1: 0.5445
 epoch: 52, train_loss: 0.8617, test_loss: 0.9638, test_f1: 0.5376
 epoch: 53, train_loss: 0.8626, test_loss: 0.9576, test_f1: 0.5436
 epoch: 54, train_loss: 0.8534, test_loss: 0.9560, test_f1: 0.5369
 epoch: 55, train_loss: 0.8597, test_loss: 0.9650, test_f1: 0.5327
 epoch: 56, train_loss: 0.8582, test_loss: 0.9489, test_f1: 0.5445
 epoch: 57, train_loss: 0.8441, test_loss: 0.9488, test_f1: 0.5411
 epoch: 58, train_loss: 0.8501, test_loss: 0.9582, test_f1: 0.5500
 epoch: 59, train_loss: 0.8550, test_loss: 0.9592, test_f1: 0.5372
 epoch: 60, train_loss: 0.8597, test_loss: 0.9646, test_f1: 0.5411
 epoch: 61, train_loss: 0.8467, test_loss: 0.9675, test_f1: 0.5455
 epoch: 62, train_loss: 0.8450, test_loss: 0.9586, test_f1: 0.5455
 epoch: 63, train_loss: 0.8462, test_loss: 0.9525, test_f1: 0.5444
 epoch: 64, train_loss: 0.8480, test_loss: 0.9548, test_f1: 0.5486
 epoch: 65, train_loss: 0.8357, test_loss: 0.9589, test_f1: 0.5411
 epoch: 66, train_loss: 0.8491, test_loss: 0.9587, test_f1: 0.5388
 epoch: 67, train_loss: 0.8460, test_loss: 0.9574, test_f1: 0.5425
 epoch: 68, train_loss: 0.8443, test_loss: 0.9496, test_f1: 0.5476
 epoch: 69, train_loss: 0.8472, test_loss: 0.9465, test_f1: 0.5408
 epoch: 70, train_loss: 0.8408, test_loss: 0.9590, test_f1: 0.5468
 epoch: 71, train_loss: 0.8321, test_loss: 0.9625, test_f1: 0.5452
 epoch: 72, train_loss: 0.8293, test_loss: 0.9554, test_f1: 0.5390
 epoch: 73, train_loss: 0.8354, test_loss: 0.9487, test_f1: 0.5427
 epoch: 74, train_loss: 0.8387, test_loss: 0.9547, test_f1: 0.5484
 epoch: 75, train_loss: 0.8276, test_loss: 0.9560, test_f1: 0.5445
 epoch: 76, train_loss: 0.8350, test_loss: 0.9672, test_f1: 0.5458
 epoch: 77, train_loss: 0.8267, test_loss: 0.9645, test_f1: 0.5466
 epoch: 78, train_loss: 0.8382, test_loss: 0.9600, test_f1: 0.5442
 epoch: 79, train_loss: 0.8400, test_loss: 0.9518, test_f1: 0.5485
 epoch: 80, train_loss: 0.8257, test_loss: 0.9576, test_f1: 0.5495
 epoch: 81, train_loss: 0.8268, test_loss: 0.9670, test_f1: 0.5421
 epoch: 82, train_loss: 0.8314, test_loss: 0.9669, test_f1: 0.5474
 epoch: 83, train_loss: 0.8198, test_loss: 0.9640, test_f1: 0.5520
 epoch: 84, train_loss: 0.8326, test_loss: 0.9621, test_f1: 0.5492
 epoch: 85, train_loss: 0.8326, test_loss: 0.9640, test_f1: 0.5506
 epoch: 86, train_loss: 0.8304, test_loss: 0.9672, test_f1: 0.5444
 epoch: 87, train_loss: 0.8239, test_loss: 0.9669, test_f1: 0.5564
 epoch: 88, train_loss: 0.8241, test_loss: 0.9640, test_f1: 0.5441
 epoch: 89, train_loss: 0.8197, test_loss: 0.9723, test_f1: 0.5466
 epoch: 90, train_loss: 0.8282, test_loss: 0.9659, test_f1: 0.5393
 epoch: 91, train_loss: 0.8250, test_loss: 0.9658, test_f1: 0.5505
 epoch: 92, train_loss: 0.8232, test_loss: 0.9608, test_f1: 0.5507
 epoch: 93, train_loss: 0.8258, test_loss: 0.9502, test_f1: 0.5480
 epoch: 94, train_loss: 0.8109, test_loss: 0.9705, test_f1: 0.5522
 epoch: 95, train_loss: 0.8245, test_loss: 0.9687, test_f1: 0.5442
 epoch: 96, train_loss: 0.8143, test_loss: 0.9640, test_f1: 0.5510
 epoch: 97, train_loss: 0.8199, test_loss: 0.9784, test_f1: 0.5493
 epoch: 98, train_loss: 0.8147, test_loss: 0.9608, test_f1: 0.5471
 epoch: 99, train_loss: 0.8129, test_loss: 0.9723, test_f1: 0.5570
##################ITERATION #9 ****************************************
 epoch: 0, train_loss: 1.3322, test_loss: 1.3345, test_f1: 0.2270
 epoch: 1, train_loss: 1.1878, test_loss: 1.2475, test_f1: 0.2808
 epoch: 2, train_loss: 1.1603, test_loss: 1.1305, test_f1: 0.3727
 epoch: 3, train_loss: 1.1242, test_loss: 1.0914, test_f1: 0.4328
 epoch: 4, train_loss: 1.1147, test_loss: 1.0737, test_f1: 0.4456
 epoch: 5, train_loss: 1.0849, test_loss: 1.0724, test_f1: 0.4541
 epoch: 6, train_loss: 1.0764, test_loss: 1.0621, test_f1: 0.4608
 epoch: 7, train_loss: 1.0627, test_loss: 1.0589, test_f1: 0.4691
 epoch: 8, train_loss: 1.0463, test_loss: 1.0522, test_f1: 0.4575
 epoch: 9, train_loss: 1.0413, test_loss: 1.0510, test_f1: 0.4734
 epoch: 10, train_loss: 1.0280, test_loss: 1.0454, test_f1: 0.4706
 epoch: 11, train_loss: 1.0220, test_loss: 1.0400, test_f1: 0.4832
 epoch: 12, train_loss: 1.0130, test_loss: 1.0383, test_f1: 0.4805
 epoch: 13, train_loss: 1.0018, test_loss: 1.0331, test_f1: 0.5055
 epoch: 14, train_loss: 1.0038, test_loss: 1.0319, test_f1: 0.4943
 epoch: 15, train_loss: 0.9913, test_loss: 1.0260, test_f1: 0.5072
 epoch: 16, train_loss: 0.9908, test_loss: 1.0301, test_f1: 0.5002
 epoch: 17, train_loss: 0.9863, test_loss: 1.0239, test_f1: 0.4992
 epoch: 18, train_loss: 0.9815, test_loss: 1.0203, test_f1: 0.4825
 epoch: 19, train_loss: 0.9723, test_loss: 1.0180, test_f1: 0.4780
 epoch: 20, train_loss: 0.9743, test_loss: 1.0075, test_f1: 0.4981
 epoch: 21, train_loss: 0.9614, test_loss: 1.0057, test_f1: 0.4976
 epoch: 22, train_loss: 0.9557, test_loss: 1.0049, test_f1: 0.5022
 epoch: 23, train_loss: 0.9477, test_loss: 0.9954, test_f1: 0.5014
 epoch: 24, train_loss: 0.9587, test_loss: 1.0046, test_f1: 0.4864
 epoch: 25, train_loss: 0.9487, test_loss: 1.0079, test_f1: 0.4985
 epoch: 26, train_loss: 0.9468, test_loss: 1.0061, test_f1: 0.4959
 epoch: 27, train_loss: 0.9480, test_loss: 0.9948, test_f1: 0.5217
 epoch: 28, train_loss: 0.9407, test_loss: 1.0001, test_f1: 0.4864
 epoch: 29, train_loss: 0.9300, test_loss: 0.9874, test_f1: 0.5248
 epoch: 30, train_loss: 0.9328, test_loss: 0.9921, test_f1: 0.5230
 epoch: 31, train_loss: 0.9315, test_loss: 0.9962, test_f1: 0.5138
 epoch: 32, train_loss: 0.9211, test_loss: 0.9732, test_f1: 0.5270
 epoch: 33, train_loss: 0.9183, test_loss: 1.0142, test_f1: 0.4840
 epoch: 34, train_loss: 0.9250, test_loss: 0.9821, test_f1: 0.5210
 epoch: 35, train_loss: 0.9219, test_loss: 0.9765, test_f1: 0.5118
 epoch: 36, train_loss: 0.9220, test_loss: 0.9869, test_f1: 0.5186
 epoch: 37, train_loss: 0.9176, test_loss: 0.9767, test_f1: 0.5167
 epoch: 38, train_loss: 0.9014, test_loss: 0.9849, test_f1: 0.5180
 epoch: 39, train_loss: 0.9227, test_loss: 0.9713, test_f1: 0.5216
 epoch: 40, train_loss: 0.9092, test_loss: 0.9750, test_f1: 0.5243
 epoch: 41, train_loss: 0.8986, test_loss: 0.9715, test_f1: 0.5124
 epoch: 42, train_loss: 0.9011, test_loss: 0.9785, test_f1: 0.5195
 epoch: 43, train_loss: 0.9043, test_loss: 1.0005, test_f1: 0.5190
 epoch: 44, train_loss: 0.8957, test_loss: 0.9640, test_f1: 0.5304
 epoch: 45, train_loss: 0.8935, test_loss: 0.9813, test_f1: 0.5193
 epoch: 46, train_loss: 0.9009, test_loss: 0.9719, test_f1: 0.5276
 epoch: 47, train_loss: 0.8918, test_loss: 0.9738, test_f1: 0.5192
 epoch: 48, train_loss: 0.8879, test_loss: 0.9717, test_f1: 0.5250
 epoch: 49, train_loss: 0.8935, test_loss: 0.9685, test_f1: 0.5286
 epoch: 50, train_loss: 0.8813, test_loss: 0.9633, test_f1: 0.5180
 epoch: 51, train_loss: 0.8792, test_loss: 0.9731, test_f1: 0.5282
 epoch: 52, train_loss: 0.8850, test_loss: 0.9745, test_f1: 0.5241
 epoch: 53, train_loss: 0.8872, test_loss: 0.9549, test_f1: 0.5244
 epoch: 54, train_loss: 0.8765, test_loss: 0.9669, test_f1: 0.5285
 epoch: 55, train_loss: 0.8701, test_loss: 0.9757, test_f1: 0.5274
 epoch: 56, train_loss: 0.8746, test_loss: 0.9597, test_f1: 0.5300
 epoch: 57, train_loss: 0.8675, test_loss: 0.9762, test_f1: 0.5239
 epoch: 58, train_loss: 0.8731, test_loss: 0.9767, test_f1: 0.5261
 epoch: 59, train_loss: 0.8766, test_loss: 0.9680, test_f1: 0.5268
 epoch: 60, train_loss: 0.8722, test_loss: 0.9815, test_f1: 0.5283
 epoch: 61, train_loss: 0.8787, test_loss: 0.9639, test_f1: 0.5269
 epoch: 62, train_loss: 0.8656, test_loss: 0.9759, test_f1: 0.5285
 epoch: 63, train_loss: 0.8766, test_loss: 0.9765, test_f1: 0.5221
 epoch: 64, train_loss: 0.8748, test_loss: 0.9862, test_f1: 0.5245
 epoch: 65, train_loss: 0.8661, test_loss: 0.9711, test_f1: 0.5292
 epoch: 66, train_loss: 0.8761, test_loss: 0.9911, test_f1: 0.5266
 epoch: 67, train_loss: 0.8714, test_loss: 0.9647, test_f1: 0.5252
 epoch: 68, train_loss: 0.8686, test_loss: 0.9680, test_f1: 0.5283
 epoch: 69, train_loss: 0.8584, test_loss: 0.9835, test_f1: 0.5254
 epoch: 70, train_loss: 0.8605, test_loss: 0.9709, test_f1: 0.5240
 epoch: 71, train_loss: 0.8629, test_loss: 0.9830, test_f1: 0.5249
 epoch: 72, train_loss: 0.8544, test_loss: 0.9744, test_f1: 0.5267
 epoch: 73, train_loss: 0.8550, test_loss: 0.9678, test_f1: 0.5234
 epoch: 74, train_loss: 0.8567, test_loss: 0.9563, test_f1: 0.5264
 epoch: 75, train_loss: 0.8563, test_loss: 0.9831, test_f1: 0.5287
 epoch: 76, train_loss: 0.8531, test_loss: 0.9637, test_f1: 0.5269
 epoch: 77, train_loss: 0.8552, test_loss: 0.9764, test_f1: 0.5256
 epoch: 78, train_loss: 0.8513, test_loss: 0.9667, test_f1: 0.5272
 epoch: 79, train_loss: 0.8480, test_loss: 0.9783, test_f1: 0.5248
 epoch: 80, train_loss: 0.8561, test_loss: 0.9824, test_f1: 0.5191
 epoch: 81, train_loss: 0.8488, test_loss: 0.9799, test_f1: 0.5254
 epoch: 82, train_loss: 0.8530, test_loss: 0.9677, test_f1: 0.5284
 epoch: 83, train_loss: 0.8503, test_loss: 0.9973, test_f1: 0.5269
 epoch: 84, train_loss: 0.8577, test_loss: 0.9726, test_f1: 0.5286
 epoch: 85, train_loss: 0.8362, test_loss: 0.9830, test_f1: 0.5340
 epoch: 86, train_loss: 0.8434, test_loss: 0.9875, test_f1: 0.5307
 epoch: 87, train_loss: 0.8484, test_loss: 0.9710, test_f1: 0.5266
 epoch: 88, train_loss: 0.8516, test_loss: 0.9619, test_f1: 0.5307
 epoch: 89, train_loss: 0.8394, test_loss: 0.9906, test_f1: 0.5239
 epoch: 90, train_loss: 0.8475, test_loss: 0.9744, test_f1: 0.5255
 epoch: 91, train_loss: 0.8429, test_loss: 0.9878, test_f1: 0.5300
 epoch: 92, train_loss: 0.8345, test_loss: 0.9923, test_f1: 0.5238
 epoch: 93, train_loss: 0.8365, test_loss: 1.0089, test_f1: 0.5313
 epoch: 94, train_loss: 0.8393, test_loss: 0.9767, test_f1: 0.5263
 epoch: 95, train_loss: 0.8393, test_loss: 0.9845, test_f1: 0.5302
 epoch: 96, train_loss: 0.8426, test_loss: 0.9768, test_f1: 0.5251
 epoch: 97, train_loss: 0.8364, test_loss: 0.9775, test_f1: 0.5287
 epoch: 98, train_loss: 0.8475, test_loss: 0.9846, test_f1: 0.5331
 epoch: 99, train_loss: 0.8397, test_loss: 0.9877, test_f1: 0.5268

Training completed in 822.93 seconds
Best F1: 0.5668 at epoch 91
Mean F1 across iterations: 0.5501  0.0108
========================FINAL RESULTS================================
FEGIN weighted F1: 0.5668  0.0108
python main.py --data ltspice_examples --representation component_pin_net --model FEGIN --layers 5 --hiddens 32 --batch_size 128 --lr 0.0001 --emb_size 512 --epochs 100 --save_appendix component_pin_net_L5_H32_BS128_LR0.0001_E512 --no_val
-----



STDERR:
  File "main.py", line 370, in <module>
    main()
  File "main.py", line 254, in main
    dataset = dataset_class(
  File "/home/philip/projects/llm_inference_code_repo/Circuit-Completion-Using-GNNs/component_classification_with_link_prediction_head/evaluation/FEGIN/kernel/circuit_datasets.py", line 15, in __init__
    self.data, self.slices = torch.load(self.processed_paths[0])
  File "/home/philip/.local/lib/python3.8/site-packages/torch/serialization.py", line 1040, in load
    warnings.warn(
  File "/usr/lib/python3.8/warnings.py", line 109, in _showwarnmsg
    sw(msg.message, msg.category, msg.filename, msg.lineno,
  File "main.py", line 47, in warn_with_traceback
    traceback.print_stack(file=log)
/home/philip/projects/llm_inference_code_repo/Circuit-Completion-Using-GNNs/component_classification_with_link_prediction_head/evaluation/FEGIN/kernel/circuit_datasets.py:15: FutureWarning: You are using `torch.load` with `weights_only=False` (the current default value), which uses the default pickle module implicitly. It is possible to construct malicious pickle data which will execute arbitrary code during unpickling (See https://github.com/pytorch/pytorch/blob/main/SECURITY.md#untrusted-models for more details). In a future release, the default value for `weights_only` will be flipped to `True`. This limits the functions that could be executed during unpickling. Arbitrary objects will no longer be allowed to be loaded via this mode unless they are explicitly allowlisted by the user via `torch.serialization.add_safe_globals`. We recommend you start setting `weights_only=True` for any use case where you don't have full control of the loaded file. Please open an issue on GitHub for any issues related to this experimental feature.
  self.data, self.slices = torch.load(self.processed_paths[0])
