STDOUT:
Results will be saved in /home/philip/projects/ltspice_examples_code_repo/Circuit-Completion-Using-GNNs/component_classification_with_link_prediction_head/evaluation/FEGIN/results/model_FEGIN_dataset_ltspice_examples
Command line input: python main.py --data ltspice_examples --representation component_pin_net --model FEGIN --layers 2 --hiddens 128 --batch_size 64 --lr 0.001 --emb_size 128 --epochs 100 --save_appendix component_pin_net_L2_H128_BS64_LR0.001_E128 --no_val
 is saved.
-----
ltspice_examples - FEGIN
Using 2 layers, 128 hidden units, h = 2
Loading component_pin_net representation dataset
ENTERED
Training FEGIN on component_pin_net representation
Train: 3558, Test: 846
##################ITERATION #0 ****************************************
 epoch: 0, train_loss: 1.1341, test_loss: 1.0348, test_f1: 0.3892
 epoch: 1, train_loss: 0.9885, test_loss: 0.9435, test_f1: 0.5053
 epoch: 2, train_loss: 0.9539, test_loss: 0.9582, test_f1: 0.5258
 epoch: 3, train_loss: 0.9324, test_loss: 0.9513, test_f1: 0.4807
 epoch: 4, train_loss: 0.9146, test_loss: 0.8826, test_f1: 0.5378
 epoch: 5, train_loss: 0.8889, test_loss: 0.8602, test_f1: 0.5424
 epoch: 6, train_loss: 0.8683, test_loss: 0.8563, test_f1: 0.5433
 epoch: 7, train_loss: 0.8398, test_loss: 0.8714, test_f1: 0.5458
 epoch: 8, train_loss: 0.8210, test_loss: 0.9407, test_f1: 0.5184
 epoch: 9, train_loss: 0.8079, test_loss: 0.8292, test_f1: 0.6105
 epoch: 10, train_loss: 0.7892, test_loss: 0.8578, test_f1: 0.6065
 epoch: 11, train_loss: 0.7838, test_loss: 0.8191, test_f1: 0.6226
 epoch: 12, train_loss: 0.7611, test_loss: 0.8138, test_f1: 0.5909
 epoch: 13, train_loss: 0.7310, test_loss: 0.7922, test_f1: 0.6189
 epoch: 14, train_loss: 0.7369, test_loss: 0.8444, test_f1: 0.5781
 epoch: 15, train_loss: 0.7098, test_loss: 0.7213, test_f1: 0.6441
 epoch: 16, train_loss: 0.6905, test_loss: 0.8500, test_f1: 0.5929
 epoch: 17, train_loss: 0.6791, test_loss: 0.8110, test_f1: 0.6280
 epoch: 18, train_loss: 0.6592, test_loss: 0.7893, test_f1: 0.6536
 epoch: 19, train_loss: 0.6545, test_loss: 0.7914, test_f1: 0.6301
 epoch: 20, train_loss: 0.6376, test_loss: 0.7689, test_f1: 0.6806
 epoch: 21, train_loss: 0.6222, test_loss: 0.8092, test_f1: 0.6642
 epoch: 22, train_loss: 0.6205, test_loss: 0.8559, test_f1: 0.6594
 epoch: 23, train_loss: 0.6062, test_loss: 0.8135, test_f1: 0.6536
 epoch: 24, train_loss: 0.5989, test_loss: 0.9316, test_f1: 0.6168
 epoch: 25, train_loss: 0.5985, test_loss: 0.8649, test_f1: 0.6275
 epoch: 26, train_loss: 0.5878, test_loss: 0.8759, test_f1: 0.6456
 epoch: 27, train_loss: 0.5838, test_loss: 0.8806, test_f1: 0.6520
 epoch: 28, train_loss: 0.5617, test_loss: 0.9412, test_f1: 0.6433
 epoch: 29, train_loss: 0.5495, test_loss: 0.9124, test_f1: 0.6428
 epoch: 30, train_loss: 0.5201, test_loss: 0.9052, test_f1: 0.6797
 epoch: 31, train_loss: 0.5339, test_loss: 0.9772, test_f1: 0.6295
 epoch: 32, train_loss: 0.5210, test_loss: 1.0011, test_f1: 0.6774
 epoch: 33, train_loss: 0.4938, test_loss: 1.0093, test_f1: 0.6422
 epoch: 34, train_loss: 0.5249, test_loss: 0.9564, test_f1: 0.6552
 epoch: 35, train_loss: 0.4942, test_loss: 0.9269, test_f1: 0.6789
 epoch: 36, train_loss: 0.4947, test_loss: 1.0437, test_f1: 0.6637
 epoch: 37, train_loss: 0.4795, test_loss: 1.0082, test_f1: 0.6808
 epoch: 38, train_loss: 0.4647, test_loss: 0.9997, test_f1: 0.6571
 epoch: 39, train_loss: 0.4558, test_loss: 1.0983, test_f1: 0.6764
 epoch: 40, train_loss: 0.4605, test_loss: 1.1262, test_f1: 0.6481
 epoch: 41, train_loss: 0.4437, test_loss: 1.0912, test_f1: 0.6308
 epoch: 42, train_loss: 0.4611, test_loss: 1.0311, test_f1: 0.6588
 epoch: 43, train_loss: 0.4388, test_loss: 1.0826, test_f1: 0.6636
 epoch: 44, train_loss: 0.4255, test_loss: 0.9732, test_f1: 0.6838
 epoch: 45, train_loss: 0.4198, test_loss: 1.0904, test_f1: 0.6513
 epoch: 46, train_loss: 0.4159, test_loss: 1.0467, test_f1: 0.6724
 epoch: 47, train_loss: 0.4247, test_loss: 1.0734, test_f1: 0.6834
 epoch: 48, train_loss: 0.3858, test_loss: 1.0951, test_f1: 0.6729
 epoch: 49, train_loss: 0.3968, test_loss: 1.2467, test_f1: 0.6396
 epoch: 50, train_loss: 0.3783, test_loss: 1.1526, test_f1: 0.6642
 epoch: 51, train_loss: 0.3577, test_loss: 1.2532, test_f1: 0.6493
 epoch: 52, train_loss: 0.3325, test_loss: 1.2271, test_f1: 0.6725
 epoch: 53, train_loss: 0.3353, test_loss: 1.1802, test_f1: 0.6565
 epoch: 54, train_loss: 0.3092, test_loss: 1.2627, test_f1: 0.6770
 epoch: 55, train_loss: 0.3168, test_loss: 1.1952, test_f1: 0.6682
 epoch: 56, train_loss: 0.3080, test_loss: 1.3515, test_f1: 0.6514
 epoch: 57, train_loss: 0.3112, test_loss: 1.3022, test_f1: 0.6515
 epoch: 58, train_loss: 0.2970, test_loss: 1.3557, test_f1: 0.6668
 epoch: 59, train_loss: 0.2799, test_loss: 1.2897, test_f1: 0.6538
 epoch: 60, train_loss: 0.2910, test_loss: 1.3423, test_f1: 0.6660
 epoch: 61, train_loss: 0.2850, test_loss: 1.4829, test_f1: 0.6691
 epoch: 62, train_loss: 0.2908, test_loss: 1.3631, test_f1: 0.6659
 epoch: 63, train_loss: 0.2855, test_loss: 1.4381, test_f1: 0.6552
 epoch: 64, train_loss: 0.2777, test_loss: 1.3806, test_f1: 0.6783
 epoch: 65, train_loss: 0.2848, test_loss: 1.4296, test_f1: 0.6631
 epoch: 66, train_loss: 0.2837, test_loss: 1.4023, test_f1: 0.6726
 epoch: 67, train_loss: 0.2767, test_loss: 1.4129, test_f1: 0.6484
 epoch: 68, train_loss: 0.2756, test_loss: 1.5020, test_f1: 0.6549
 epoch: 69, train_loss: 0.2479, test_loss: 1.4666, test_f1: 0.6612
 epoch: 70, train_loss: 0.2782, test_loss: 1.3699, test_f1: 0.6711
 epoch: 71, train_loss: 0.2645, test_loss: 1.4262, test_f1: 0.6662
 epoch: 72, train_loss: 0.2640, test_loss: 1.7127, test_f1: 0.6354
 epoch: 73, train_loss: 0.2690, test_loss: 1.4218, test_f1: 0.6483
 epoch: 74, train_loss: 0.2461, test_loss: 1.4781, test_f1: 0.6718
 epoch: 75, train_loss: 0.2401, test_loss: 1.5277, test_f1: 0.6687
 epoch: 76, train_loss: 0.2328, test_loss: 1.4807, test_f1: 0.6770
 epoch: 77, train_loss: 0.2540, test_loss: 1.6027, test_f1: 0.6444
 epoch: 78, train_loss: 0.2461, test_loss: 1.4947, test_f1: 0.6603
 epoch: 79, train_loss: 0.2401, test_loss: 1.5683, test_f1: 0.6664
 epoch: 80, train_loss: 0.2137, test_loss: 1.5848, test_f1: 0.6643
 epoch: 81, train_loss: 0.2196, test_loss: 1.6074, test_f1: 0.6759
 epoch: 82, train_loss: 0.2376, test_loss: 1.6251, test_f1: 0.6558
 epoch: 83, train_loss: 0.2359, test_loss: 1.6532, test_f1: 0.6590
 epoch: 84, train_loss: 0.2264, test_loss: 1.6646, test_f1: 0.6742
 epoch: 85, train_loss: 0.2148, test_loss: 1.7298, test_f1: 0.6581
 epoch: 86, train_loss: 0.2324, test_loss: 1.5830, test_f1: 0.6701
 epoch: 87, train_loss: 0.2080, test_loss: 1.6963, test_f1: 0.6486
 epoch: 88, train_loss: 0.2108, test_loss: 1.7145, test_f1: 0.6674
 epoch: 89, train_loss: 0.2001, test_loss: 1.6870, test_f1: 0.6631
 epoch: 90, train_loss: 0.1977, test_loss: 1.7358, test_f1: 0.6705
 epoch: 91, train_loss: 0.1968, test_loss: 1.7231, test_f1: 0.6738
 epoch: 92, train_loss: 0.2013, test_loss: 1.8618, test_f1: 0.6686
 epoch: 93, train_loss: 0.2009, test_loss: 1.8471, test_f1: 0.6605
 epoch: 94, train_loss: 0.1870, test_loss: 1.8365, test_f1: 0.6707
 epoch: 95, train_loss: 0.1955, test_loss: 1.6536, test_f1: 0.6900
 epoch: 96, train_loss: 0.2028, test_loss: 1.6905, test_f1: 0.6762
 epoch: 97, train_loss: 0.1856, test_loss: 1.7093, test_f1: 0.6816
 epoch: 98, train_loss: 0.1977, test_loss: 1.6723, test_f1: 0.6700
 epoch: 99, train_loss: 0.1831, test_loss: 1.7247, test_f1: 0.6629
##################ITERATION #1 ****************************************
 epoch: 0, train_loss: 1.0487, test_loss: 0.9753, test_f1: 0.4724
 epoch: 1, train_loss: 0.9397, test_loss: 0.8926, test_f1: 0.5034
 epoch: 2, train_loss: 0.8969, test_loss: 0.8874, test_f1: 0.5518
 epoch: 3, train_loss: 0.8753, test_loss: 0.8445, test_f1: 0.5947
 epoch: 4, train_loss: 0.8564, test_loss: 0.8319, test_f1: 0.6277
 epoch: 5, train_loss: 0.8381, test_loss: 0.8793, test_f1: 0.5739
 epoch: 6, train_loss: 0.8027, test_loss: 0.7913, test_f1: 0.6271
 epoch: 7, train_loss: 0.7888, test_loss: 0.7471, test_f1: 0.6371
 epoch: 8, train_loss: 0.7695, test_loss: 0.7521, test_f1: 0.6203
 epoch: 9, train_loss: 0.7415, test_loss: 0.7368, test_f1: 0.6310
 epoch: 10, train_loss: 0.7241, test_loss: 0.7409, test_f1: 0.6417
 epoch: 11, train_loss: 0.7088, test_loss: 0.7533, test_f1: 0.6565
 epoch: 12, train_loss: 0.6879, test_loss: 0.6881, test_f1: 0.6980
 epoch: 13, train_loss: 0.6991, test_loss: 0.7747, test_f1: 0.6711
 epoch: 14, train_loss: 0.6726, test_loss: 0.7076, test_f1: 0.6751
 epoch: 15, train_loss: 0.6425, test_loss: 0.7586, test_f1: 0.6430
 epoch: 16, train_loss: 0.6222, test_loss: 0.7606, test_f1: 0.6700
 epoch: 17, train_loss: 0.6273, test_loss: 0.7390, test_f1: 0.6516
 epoch: 18, train_loss: 0.6226, test_loss: 0.8394, test_f1: 0.6312
 epoch: 19, train_loss: 0.5919, test_loss: 0.7889, test_f1: 0.6580
 epoch: 20, train_loss: 0.5997, test_loss: 0.7615, test_f1: 0.6644
 epoch: 21, train_loss: 0.5823, test_loss: 0.8509, test_f1: 0.6485
 epoch: 22, train_loss: 0.5657, test_loss: 0.7802, test_f1: 0.6872
 epoch: 23, train_loss: 0.5527, test_loss: 0.7657, test_f1: 0.6818
 epoch: 24, train_loss: 0.5352, test_loss: 0.8666, test_f1: 0.6440
 epoch: 25, train_loss: 0.5465, test_loss: 0.8168, test_f1: 0.6739
 epoch: 26, train_loss: 0.5176, test_loss: 0.9458, test_f1: 0.6452
 epoch: 27, train_loss: 0.5149, test_loss: 0.8806, test_f1: 0.6780
 epoch: 28, train_loss: 0.5088, test_loss: 0.8713, test_f1: 0.6681
 epoch: 29, train_loss: 0.4956, test_loss: 0.8658, test_f1: 0.6877
 epoch: 30, train_loss: 0.5048, test_loss: 0.9113, test_f1: 0.6426
 epoch: 31, train_loss: 0.4775, test_loss: 0.8232, test_f1: 0.6623
 epoch: 32, train_loss: 0.4750, test_loss: 0.8616, test_f1: 0.6756
 epoch: 33, train_loss: 0.4850, test_loss: 0.9168, test_f1: 0.6737
 epoch: 34, train_loss: 0.4632, test_loss: 0.9947, test_f1: 0.6656
 epoch: 35, train_loss: 0.4526, test_loss: 0.9214, test_f1: 0.6825
 epoch: 36, train_loss: 0.4427, test_loss: 0.9252, test_f1: 0.7049
 epoch: 37, train_loss: 0.4143, test_loss: 1.0147, test_f1: 0.6756
 epoch: 38, train_loss: 0.4468, test_loss: 0.8830, test_f1: 0.6841
 epoch: 39, train_loss: 0.4116, test_loss: 0.9769, test_f1: 0.6877
 epoch: 40, train_loss: 0.4030, test_loss: 0.9783, test_f1: 0.6877
 epoch: 41, train_loss: 0.4013, test_loss: 1.0483, test_f1: 0.6951
 epoch: 42, train_loss: 0.3955, test_loss: 1.0193, test_f1: 0.6547
 epoch: 43, train_loss: 0.3981, test_loss: 0.9835, test_f1: 0.6865
 epoch: 44, train_loss: 0.3775, test_loss: 1.0956, test_f1: 0.6560
 epoch: 45, train_loss: 0.3634, test_loss: 1.1715, test_f1: 0.6700
 epoch: 46, train_loss: 0.3634, test_loss: 1.0547, test_f1: 0.6842
 epoch: 47, train_loss: 0.3599, test_loss: 1.1979, test_f1: 0.6597
 epoch: 48, train_loss: 0.3703, test_loss: 1.2046, test_f1: 0.6582
 epoch: 49, train_loss: 0.3555, test_loss: 1.0995, test_f1: 0.6709
 epoch: 50, train_loss: 0.3420, test_loss: 1.1612, test_f1: 0.6831
 epoch: 51, train_loss: 0.3255, test_loss: 1.1431, test_f1: 0.6710
 epoch: 52, train_loss: 0.2952, test_loss: 1.1594, test_f1: 0.6877
 epoch: 53, train_loss: 0.2812, test_loss: 1.2268, test_f1: 0.6805
 epoch: 54, train_loss: 0.2738, test_loss: 1.2524, test_f1: 0.6831
 epoch: 55, train_loss: 0.2697, test_loss: 1.1583, test_f1: 0.6914
 epoch: 56, train_loss: 0.2670, test_loss: 1.3865, test_f1: 0.6809
 epoch: 57, train_loss: 0.2769, test_loss: 1.4359, test_f1: 0.6754
 epoch: 58, train_loss: 0.2506, test_loss: 1.3298, test_f1: 0.6818
 epoch: 59, train_loss: 0.2548, test_loss: 1.3870, test_f1: 0.7039
 epoch: 60, train_loss: 0.2579, test_loss: 1.4231, test_f1: 0.6844
 epoch: 61, train_loss: 0.2515, test_loss: 1.3765, test_f1: 0.6770
 epoch: 62, train_loss: 0.2389, test_loss: 1.3254, test_f1: 0.6856
 epoch: 63, train_loss: 0.2194, test_loss: 1.3902, test_f1: 0.6891
 epoch: 64, train_loss: 0.2365, test_loss: 1.3553, test_f1: 0.6878
 epoch: 65, train_loss: 0.2478, test_loss: 1.4871, test_f1: 0.6841
 epoch: 66, train_loss: 0.2424, test_loss: 1.5657, test_f1: 0.6797
 epoch: 67, train_loss: 0.2260, test_loss: 1.5217, test_f1: 0.6822
 epoch: 68, train_loss: 0.2283, test_loss: 1.4748, test_f1: 0.6838
 epoch: 69, train_loss: 0.2359, test_loss: 1.4922, test_f1: 0.6846
 epoch: 70, train_loss: 0.2321, test_loss: 1.5205, test_f1: 0.6891
 epoch: 71, train_loss: 0.2292, test_loss: 1.5935, test_f1: 0.6783
 epoch: 72, train_loss: 0.2229, test_loss: 1.5192, test_f1: 0.6758
 epoch: 73, train_loss: 0.2245, test_loss: 1.7203, test_f1: 0.6746
 epoch: 74, train_loss: 0.2168, test_loss: 1.5670, test_f1: 0.6904
 epoch: 75, train_loss: 0.2077, test_loss: 1.6162, test_f1: 0.6813
 epoch: 76, train_loss: 0.1988, test_loss: 1.5458, test_f1: 0.7098
 epoch: 77, train_loss: 0.1901, test_loss: 1.6842, test_f1: 0.6766
 epoch: 78, train_loss: 0.2095, test_loss: 1.6470, test_f1: 0.6832
 epoch: 79, train_loss: 0.2118, test_loss: 1.7115, test_f1: 0.6738
 epoch: 80, train_loss: 0.1927, test_loss: 1.6223, test_f1: 0.6948
 epoch: 81, train_loss: 0.2015, test_loss: 1.6956, test_f1: 0.6703
 epoch: 82, train_loss: 0.1867, test_loss: 1.6806, test_f1: 0.6735
 epoch: 83, train_loss: 0.1886, test_loss: 1.9303, test_f1: 0.6469
 epoch: 84, train_loss: 0.1924, test_loss: 1.7160, test_f1: 0.6776
 epoch: 85, train_loss: 0.1994, test_loss: 1.7801, test_f1: 0.6627
 epoch: 86, train_loss: 0.2034, test_loss: 1.6707, test_f1: 0.6970
 epoch: 87, train_loss: 0.2171, test_loss: 1.7943, test_f1: 0.6803
 epoch: 88, train_loss: 0.1969, test_loss: 1.8491, test_f1: 0.6802
 epoch: 89, train_loss: 0.1929, test_loss: 1.8329, test_f1: 0.6652
 epoch: 90, train_loss: 0.1756, test_loss: 1.8384, test_f1: 0.6962
 epoch: 91, train_loss: 0.1848, test_loss: 1.7173, test_f1: 0.6917
 epoch: 92, train_loss: 0.1880, test_loss: 1.7822, test_f1: 0.6819
 epoch: 93, train_loss: 0.1679, test_loss: 1.9028, test_f1: 0.6873
 epoch: 94, train_loss: 0.1876, test_loss: 1.7642, test_f1: 0.6928
 epoch: 95, train_loss: 0.1644, test_loss: 1.7753, test_f1: 0.6886
 epoch: 96, train_loss: 0.1704, test_loss: 1.7988, test_f1: 0.6825
 epoch: 97, train_loss: 0.1808, test_loss: 1.8815, test_f1: 0.6835
 epoch: 98, train_loss: 0.1536, test_loss: 1.8272, test_f1: 0.6863
 epoch: 99, train_loss: 0.1733, test_loss: 1.7495, test_f1: 0.6699
##################ITERATION #2 ****************************************
 epoch: 0, train_loss: 1.1232, test_loss: 1.0065, test_f1: 0.4854
 epoch: 1, train_loss: 0.9453, test_loss: 0.9041, test_f1: 0.5443
 epoch: 2, train_loss: 0.9006, test_loss: 0.9038, test_f1: 0.5376
 epoch: 3, train_loss: 0.8594, test_loss: 0.8374, test_f1: 0.6176
 epoch: 4, train_loss: 0.8404, test_loss: 0.8730, test_f1: 0.5827
 epoch: 5, train_loss: 0.8127, test_loss: 0.7907, test_f1: 0.5942
 epoch: 6, train_loss: 0.7868, test_loss: 0.8223, test_f1: 0.6619
 epoch: 7, train_loss: 0.7855, test_loss: 0.8274, test_f1: 0.5975
 epoch: 8, train_loss: 0.7499, test_loss: 0.8134, test_f1: 0.6260
 epoch: 9, train_loss: 0.7433, test_loss: 0.7963, test_f1: 0.6346
 epoch: 10, train_loss: 0.7344, test_loss: 0.7770, test_f1: 0.6399
 epoch: 11, train_loss: 0.7176, test_loss: 0.8369, test_f1: 0.6031
 epoch: 12, train_loss: 0.6964, test_loss: 0.7727, test_f1: 0.6316
 epoch: 13, train_loss: 0.7041, test_loss: 0.7507, test_f1: 0.6508
 epoch: 14, train_loss: 0.6737, test_loss: 0.8151, test_f1: 0.6440
 epoch: 15, train_loss: 0.6624, test_loss: 0.8711, test_f1: 0.6675
 epoch: 16, train_loss: 0.6504, test_loss: 0.7593, test_f1: 0.6741
 epoch: 17, train_loss: 0.6482, test_loss: 0.8235, test_f1: 0.6516
 epoch: 18, train_loss: 0.6209, test_loss: 0.7616, test_f1: 0.6719
 epoch: 19, train_loss: 0.6206, test_loss: 0.8177, test_f1: 0.6450
 epoch: 20, train_loss: 0.5954, test_loss: 0.7889, test_f1: 0.6394
 epoch: 21, train_loss: 0.5848, test_loss: 0.7527, test_f1: 0.6605
 epoch: 22, train_loss: 0.6055, test_loss: 0.7565, test_f1: 0.6622
 epoch: 23, train_loss: 0.5528, test_loss: 0.8475, test_f1: 0.6737
 epoch: 24, train_loss: 0.5626, test_loss: 0.8519, test_f1: 0.6621
 epoch: 25, train_loss: 0.5488, test_loss: 0.7986, test_f1: 0.6620
 epoch: 26, train_loss: 0.5366, test_loss: 0.8107, test_f1: 0.6732
 epoch: 27, train_loss: 0.5361, test_loss: 0.9014, test_f1: 0.6625
 epoch: 28, train_loss: 0.5351, test_loss: 0.8745, test_f1: 0.6666
 epoch: 29, train_loss: 0.5101, test_loss: 0.8284, test_f1: 0.6811
 epoch: 30, train_loss: 0.5306, test_loss: 0.7766, test_f1: 0.6653
 epoch: 31, train_loss: 0.5053, test_loss: 0.7942, test_f1: 0.6866
 epoch: 32, train_loss: 0.4839, test_loss: 0.7941, test_f1: 0.6665
 epoch: 33, train_loss: 0.4797, test_loss: 0.9697, test_f1: 0.6199
 epoch: 34, train_loss: 0.4682, test_loss: 0.8407, test_f1: 0.6589
 epoch: 35, train_loss: 0.4406, test_loss: 0.9131, test_f1: 0.6789
 epoch: 36, train_loss: 0.4340, test_loss: 0.9862, test_f1: 0.6456
 epoch: 37, train_loss: 0.4427, test_loss: 0.9080, test_f1: 0.6556
 epoch: 38, train_loss: 0.4352, test_loss: 0.9449, test_f1: 0.6692
 epoch: 39, train_loss: 0.4549, test_loss: 1.0200, test_f1: 0.6585
 epoch: 40, train_loss: 0.4151, test_loss: 1.0143, test_f1: 0.6494
 epoch: 41, train_loss: 0.4093, test_loss: 0.8478, test_f1: 0.6988
 epoch: 42, train_loss: 0.4054, test_loss: 1.1357, test_f1: 0.6429
 epoch: 43, train_loss: 0.4265, test_loss: 0.8932, test_f1: 0.6479
 epoch: 44, train_loss: 0.4174, test_loss: 1.0332, test_f1: 0.6607
 epoch: 45, train_loss: 0.3977, test_loss: 1.1238, test_f1: 0.6784
 epoch: 46, train_loss: 0.4091, test_loss: 1.0163, test_f1: 0.6607
 epoch: 47, train_loss: 0.3898, test_loss: 0.9192, test_f1: 0.6592
 epoch: 48, train_loss: 0.4022, test_loss: 0.9680, test_f1: 0.6389
 epoch: 49, train_loss: 0.3687, test_loss: 1.0449, test_f1: 0.6701
 epoch: 50, train_loss: 0.3557, test_loss: 1.0237, test_f1: 0.6771
 epoch: 51, train_loss: 0.3198, test_loss: 1.0929, test_f1: 0.6505
 epoch: 52, train_loss: 0.2918, test_loss: 1.1001, test_f1: 0.6748
 epoch: 53, train_loss: 0.2892, test_loss: 1.0924, test_f1: 0.6678
 epoch: 54, train_loss: 0.2843, test_loss: 1.0395, test_f1: 0.6766
 epoch: 55, train_loss: 0.2707, test_loss: 1.2191, test_f1: 0.6758
 epoch: 56, train_loss: 0.2771, test_loss: 1.2267, test_f1: 0.6926
 epoch: 57, train_loss: 0.2604, test_loss: 1.1490, test_f1: 0.6832
 epoch: 58, train_loss: 0.2696, test_loss: 1.2271, test_f1: 0.6819
 epoch: 59, train_loss: 0.2722, test_loss: 1.2123, test_f1: 0.6880
 epoch: 60, train_loss: 0.2626, test_loss: 1.1974, test_f1: 0.6829
 epoch: 61, train_loss: 0.2617, test_loss: 1.1972, test_f1: 0.6903
 epoch: 62, train_loss: 0.2466, test_loss: 1.2957, test_f1: 0.6829
 epoch: 63, train_loss: 0.2385, test_loss: 1.3429, test_f1: 0.6766
 epoch: 64, train_loss: 0.2528, test_loss: 1.2406, test_f1: 0.6867
 epoch: 65, train_loss: 0.2416, test_loss: 1.2577, test_f1: 0.6845
 epoch: 66, train_loss: 0.2344, test_loss: 1.2893, test_f1: 0.6850
 epoch: 67, train_loss: 0.2188, test_loss: 1.3567, test_f1: 0.6900
 epoch: 68, train_loss: 0.2382, test_loss: 1.3427, test_f1: 0.6788
 epoch: 69, train_loss: 0.2384, test_loss: 1.3065, test_f1: 0.6720
 epoch: 70, train_loss: 0.2511, test_loss: 1.3675, test_f1: 0.6892
 epoch: 71, train_loss: 0.2229, test_loss: 1.3809, test_f1: 0.6835
 epoch: 72, train_loss: 0.2079, test_loss: 1.3391, test_f1: 0.6914
 epoch: 73, train_loss: 0.2147, test_loss: 1.4854, test_f1: 0.6719
 epoch: 74, train_loss: 0.2228, test_loss: 1.4169, test_f1: 0.6913
 epoch: 75, train_loss: 0.2229, test_loss: 1.3980, test_f1: 0.6780
 epoch: 76, train_loss: 0.2124, test_loss: 1.3318, test_f1: 0.6834
 epoch: 77, train_loss: 0.1997, test_loss: 1.3842, test_f1: 0.6860
 epoch: 78, train_loss: 0.2163, test_loss: 1.3468, test_f1: 0.6819
 epoch: 79, train_loss: 0.2025, test_loss: 1.2324, test_f1: 0.6809
 epoch: 80, train_loss: 0.1935, test_loss: 1.4631, test_f1: 0.6749
 epoch: 81, train_loss: 0.2090, test_loss: 1.3863, test_f1: 0.6862
 epoch: 82, train_loss: 0.2147, test_loss: 1.3462, test_f1: 0.7032
 epoch: 83, train_loss: 0.1834, test_loss: 1.4541, test_f1: 0.6786
 epoch: 84, train_loss: 0.2115, test_loss: 1.4081, test_f1: 0.6902
 epoch: 85, train_loss: 0.1870, test_loss: 1.4722, test_f1: 0.6769
 epoch: 86, train_loss: 0.2038, test_loss: 1.4368, test_f1: 0.6882
 epoch: 87, train_loss: 0.1965, test_loss: 1.4598, test_f1: 0.6723
 epoch: 88, train_loss: 0.1799, test_loss: 1.4746, test_f1: 0.6764
 epoch: 89, train_loss: 0.1826, test_loss: 1.6104, test_f1: 0.6682
 epoch: 90, train_loss: 0.1951, test_loss: 1.5873, test_f1: 0.6753
 epoch: 91, train_loss: 0.1854, test_loss: 1.5032, test_f1: 0.6878
 epoch: 92, train_loss: 0.1769, test_loss: 1.5131, test_f1: 0.6870
 epoch: 93, train_loss: 0.1850, test_loss: 1.5289, test_f1: 0.6807
 epoch: 94, train_loss: 0.1910, test_loss: 1.6060, test_f1: 0.6639
 epoch: 95, train_loss: 0.1819, test_loss: 1.5587, test_f1: 0.6802
 epoch: 96, train_loss: 0.1727, test_loss: 1.5600, test_f1: 0.6771
 epoch: 97, train_loss: 0.1957, test_loss: 1.5866, test_f1: 0.6777
 epoch: 98, train_loss: 0.1796, test_loss: 1.5901, test_f1: 0.6725
 epoch: 99, train_loss: 0.1680, test_loss: 1.6300, test_f1: 0.6715
##################ITERATION #3 ****************************************
 epoch: 0, train_loss: 1.2416, test_loss: 0.9727, test_f1: 0.4830
 epoch: 1, train_loss: 0.9645, test_loss: 0.9085, test_f1: 0.5338
 epoch: 2, train_loss: 0.9192, test_loss: 0.8979, test_f1: 0.5288
 epoch: 3, train_loss: 0.8850, test_loss: 0.8455, test_f1: 0.5768
 epoch: 4, train_loss: 0.8765, test_loss: 0.8264, test_f1: 0.5805
 epoch: 5, train_loss: 0.8415, test_loss: 0.7901, test_f1: 0.5777
 epoch: 6, train_loss: 0.8210, test_loss: 0.7772, test_f1: 0.6022
 epoch: 7, train_loss: 0.8153, test_loss: 0.7676, test_f1: 0.6221
 epoch: 8, train_loss: 0.7815, test_loss: 0.7910, test_f1: 0.6211
 epoch: 9, train_loss: 0.7757, test_loss: 0.8232, test_f1: 0.6137
 epoch: 10, train_loss: 0.7662, test_loss: 0.7675, test_f1: 0.6639
 epoch: 11, train_loss: 0.7231, test_loss: 0.7873, test_f1: 0.6103
 epoch: 12, train_loss: 0.7147, test_loss: 0.7447, test_f1: 0.6349
 epoch: 13, train_loss: 0.6988, test_loss: 0.7323, test_f1: 0.6569
 epoch: 14, train_loss: 0.6927, test_loss: 0.8241, test_f1: 0.6336
 epoch: 15, train_loss: 0.6798, test_loss: 0.7188, test_f1: 0.6502
 epoch: 16, train_loss: 0.6600, test_loss: 0.7357, test_f1: 0.6492
 epoch: 17, train_loss: 0.6407, test_loss: 0.7309, test_f1: 0.7041
 epoch: 18, train_loss: 0.6296, test_loss: 0.7646, test_f1: 0.6605
 epoch: 19, train_loss: 0.6331, test_loss: 0.7946, test_f1: 0.6411
 epoch: 20, train_loss: 0.6195, test_loss: 0.7909, test_f1: 0.6396
 epoch: 21, train_loss: 0.6114, test_loss: 0.8046, test_f1: 0.6590
 epoch: 22, train_loss: 0.6125, test_loss: 0.7768, test_f1: 0.6925
 epoch: 23, train_loss: 0.5853, test_loss: 0.8628, test_f1: 0.6532
 epoch: 24, train_loss: 0.5741, test_loss: 0.7838, test_f1: 0.6601
 epoch: 25, train_loss: 0.5630, test_loss: 0.8418, test_f1: 0.6632
 epoch: 26, train_loss: 0.5570, test_loss: 0.7931, test_f1: 0.6717
 epoch: 27, train_loss: 0.5542, test_loss: 0.8758, test_f1: 0.6684
 epoch: 28, train_loss: 0.5405, test_loss: 0.7873, test_f1: 0.6866
 epoch: 29, train_loss: 0.5143, test_loss: 0.8130, test_f1: 0.6688
 epoch: 30, train_loss: 0.5133, test_loss: 0.8279, test_f1: 0.6790
 epoch: 31, train_loss: 0.5106, test_loss: 0.8403, test_f1: 0.6531
 epoch: 32, train_loss: 0.5072, test_loss: 0.8039, test_f1: 0.6562
 epoch: 33, train_loss: 0.4945, test_loss: 0.8196, test_f1: 0.6699
 epoch: 34, train_loss: 0.4933, test_loss: 0.9037, test_f1: 0.6719
 epoch: 35, train_loss: 0.4919, test_loss: 0.9053, test_f1: 0.6569
 epoch: 36, train_loss: 0.4801, test_loss: 0.8651, test_f1: 0.6803
 epoch: 37, train_loss: 0.4404, test_loss: 1.0630, test_f1: 0.6558
 epoch: 38, train_loss: 0.4427, test_loss: 0.9363, test_f1: 0.6697
 epoch: 39, train_loss: 0.4456, test_loss: 1.0098, test_f1: 0.6700
 epoch: 40, train_loss: 0.4571, test_loss: 0.9540, test_f1: 0.6723
 epoch: 41, train_loss: 0.4181, test_loss: 0.9088, test_f1: 0.6844
 epoch: 42, train_loss: 0.4010, test_loss: 1.1141, test_f1: 0.6644
 epoch: 43, train_loss: 0.4059, test_loss: 1.0012, test_f1: 0.6685
 epoch: 44, train_loss: 0.4264, test_loss: 0.9361, test_f1: 0.6450
 epoch: 45, train_loss: 0.4099, test_loss: 0.9981, test_f1: 0.6782
 epoch: 46, train_loss: 0.3889, test_loss: 0.9932, test_f1: 0.6610
 epoch: 47, train_loss: 0.4008, test_loss: 0.8751, test_f1: 0.6600
 epoch: 48, train_loss: 0.3857, test_loss: 1.0255, test_f1: 0.7107
 epoch: 49, train_loss: 0.3920, test_loss: 1.0300, test_f1: 0.6593
 epoch: 50, train_loss: 0.3610, test_loss: 0.9915, test_f1: 0.6740
 epoch: 51, train_loss: 0.3354, test_loss: 1.1367, test_f1: 0.6705
 epoch: 52, train_loss: 0.3122, test_loss: 1.1307, test_f1: 0.6619
 epoch: 53, train_loss: 0.3154, test_loss: 1.1345, test_f1: 0.6672
 epoch: 54, train_loss: 0.3009, test_loss: 1.2181, test_f1: 0.6805
 epoch: 55, train_loss: 0.2985, test_loss: 1.1796, test_f1: 0.6864
 epoch: 56, train_loss: 0.2730, test_loss: 1.2476, test_f1: 0.6638
 epoch: 57, train_loss: 0.2888, test_loss: 1.1891, test_f1: 0.6671
 epoch: 58, train_loss: 0.2942, test_loss: 1.2650, test_f1: 0.6666
 epoch: 59, train_loss: 0.2821, test_loss: 1.3041, test_f1: 0.6700
 epoch: 60, train_loss: 0.2606, test_loss: 1.2705, test_f1: 0.6771
 epoch: 61, train_loss: 0.2890, test_loss: 1.3038, test_f1: 0.6793
 epoch: 62, train_loss: 0.2676, test_loss: 1.3074, test_f1: 0.6802
 epoch: 63, train_loss: 0.2773, test_loss: 1.2575, test_f1: 0.6696
 epoch: 64, train_loss: 0.2718, test_loss: 1.0349, test_f1: 0.6728
 epoch: 65, train_loss: 0.2566, test_loss: 1.3326, test_f1: 0.6593
 epoch: 66, train_loss: 0.2576, test_loss: 1.3016, test_f1: 0.6770
 epoch: 67, train_loss: 0.2493, test_loss: 1.3737, test_f1: 0.6764
 epoch: 68, train_loss: 0.2472, test_loss: 1.3314, test_f1: 0.6758
 epoch: 69, train_loss: 0.2290, test_loss: 1.4284, test_f1: 0.6778
 epoch: 70, train_loss: 0.2531, test_loss: 1.3622, test_f1: 0.6565
 epoch: 71, train_loss: 0.2325, test_loss: 1.4538, test_f1: 0.6588
 epoch: 72, train_loss: 0.2349, test_loss: 1.4213, test_f1: 0.6769
 epoch: 73, train_loss: 0.2520, test_loss: 1.3084, test_f1: 0.6849
 epoch: 74, train_loss: 0.2369, test_loss: 1.4399, test_f1: 0.6779
 epoch: 75, train_loss: 0.2451, test_loss: 1.3966, test_f1: 0.6741
 epoch: 76, train_loss: 0.2221, test_loss: 1.4805, test_f1: 0.6882
 epoch: 77, train_loss: 0.2215, test_loss: 1.4335, test_f1: 0.6819
 epoch: 78, train_loss: 0.2238, test_loss: 1.4716, test_f1: 0.6736
 epoch: 79, train_loss: 0.2225, test_loss: 1.5493, test_f1: 0.6738
 epoch: 80, train_loss: 0.2310, test_loss: 1.4609, test_f1: 0.6721
 epoch: 81, train_loss: 0.2179, test_loss: 1.6103, test_f1: 0.6713
 epoch: 82, train_loss: 0.2312, test_loss: 1.4449, test_f1: 0.6739
 epoch: 83, train_loss: 0.2079, test_loss: 1.5774, test_f1: 0.6766
 epoch: 84, train_loss: 0.2078, test_loss: 1.5261, test_f1: 0.6807
 epoch: 85, train_loss: 0.2114, test_loss: 1.5521, test_f1: 0.6824
 epoch: 86, train_loss: 0.2213, test_loss: 1.5043, test_f1: 0.6848
 epoch: 87, train_loss: 0.2206, test_loss: 1.4941, test_f1: 0.6864
 epoch: 88, train_loss: 0.1841, test_loss: 1.5040, test_f1: 0.6783
 epoch: 89, train_loss: 0.2280, test_loss: 1.6041, test_f1: 0.6781
 epoch: 90, train_loss: 0.2032, test_loss: 1.5882, test_f1: 0.6752
 epoch: 91, train_loss: 0.2172, test_loss: 1.6061, test_f1: 0.6837
 epoch: 92, train_loss: 0.1913, test_loss: 1.7062, test_f1: 0.6726
 epoch: 93, train_loss: 0.1939, test_loss: 1.5789, test_f1: 0.6809
 epoch: 94, train_loss: 0.1877, test_loss: 1.5921, test_f1: 0.6791
 epoch: 95, train_loss: 0.1903, test_loss: 1.7181, test_f1: 0.6691
 epoch: 96, train_loss: 0.1628, test_loss: 1.6470, test_f1: 0.6815
 epoch: 97, train_loss: 0.2066, test_loss: 1.7434, test_f1: 0.6750
 epoch: 98, train_loss: 0.1828, test_loss: 1.6538, test_f1: 0.6879
 epoch: 99, train_loss: 0.1910, test_loss: 1.7670, test_f1: 0.6722
##################ITERATION #4 ****************************************
 epoch: 0, train_loss: 1.2258, test_loss: 1.0078, test_f1: 0.4297
 epoch: 1, train_loss: 0.9609, test_loss: 0.9218, test_f1: 0.5177
 epoch: 2, train_loss: 0.9030, test_loss: 0.9125, test_f1: 0.5902
 epoch: 3, train_loss: 0.8812, test_loss: 0.8943, test_f1: 0.5511
 epoch: 4, train_loss: 0.8587, test_loss: 0.8707, test_f1: 0.5260
 epoch: 5, train_loss: 0.8288, test_loss: 0.8025, test_f1: 0.5937
 epoch: 6, train_loss: 0.8105, test_loss: 0.8129, test_f1: 0.5873
 epoch: 7, train_loss: 0.7917, test_loss: 0.8279, test_f1: 0.6430
 epoch: 8, train_loss: 0.7778, test_loss: 0.8373, test_f1: 0.6230
 epoch: 9, train_loss: 0.7624, test_loss: 0.8155, test_f1: 0.5879
 epoch: 10, train_loss: 0.7556, test_loss: 0.7831, test_f1: 0.6406
 epoch: 11, train_loss: 0.7353, test_loss: 0.8421, test_f1: 0.6368
 epoch: 12, train_loss: 0.7163, test_loss: 0.7704, test_f1: 0.6167
 epoch: 13, train_loss: 0.7328, test_loss: 0.7710, test_f1: 0.6348
 epoch: 14, train_loss: 0.6984, test_loss: 0.7450, test_f1: 0.6423
 epoch: 15, train_loss: 0.6815, test_loss: 0.7586, test_f1: 0.6285
 epoch: 16, train_loss: 0.6573, test_loss: 0.7502, test_f1: 0.6286
 epoch: 17, train_loss: 0.6426, test_loss: 0.7196, test_f1: 0.6714
 epoch: 18, train_loss: 0.6389, test_loss: 0.7929, test_f1: 0.6574
 epoch: 19, train_loss: 0.6362, test_loss: 0.8744, test_f1: 0.6379
 epoch: 20, train_loss: 0.6365, test_loss: 0.8017, test_f1: 0.6351
 epoch: 21, train_loss: 0.6048, test_loss: 0.8490, test_f1: 0.6039
 epoch: 22, train_loss: 0.6041, test_loss: 0.8308, test_f1: 0.6340
 epoch: 23, train_loss: 0.5855, test_loss: 0.7548, test_f1: 0.6453
 epoch: 24, train_loss: 0.5714, test_loss: 0.7764, test_f1: 0.6380
 epoch: 25, train_loss: 0.5909, test_loss: 0.7724, test_f1: 0.6561
 epoch: 26, train_loss: 0.5577, test_loss: 0.7844, test_f1: 0.6759
 epoch: 27, train_loss: 0.5456, test_loss: 0.8723, test_f1: 0.6515
 epoch: 28, train_loss: 0.5582, test_loss: 0.7476, test_f1: 0.6795
 epoch: 29, train_loss: 0.5280, test_loss: 0.8949, test_f1: 0.6328
 epoch: 30, train_loss: 0.5382, test_loss: 0.8285, test_f1: 0.6497
 epoch: 31, train_loss: 0.5137, test_loss: 0.8181, test_f1: 0.6350
 epoch: 32, train_loss: 0.5096, test_loss: 0.8825, test_f1: 0.6523
 epoch: 33, train_loss: 0.4888, test_loss: 0.8147, test_f1: 0.6756
 epoch: 34, train_loss: 0.4902, test_loss: 0.8510, test_f1: 0.6617
 epoch: 35, train_loss: 0.4871, test_loss: 0.9060, test_f1: 0.6658
 epoch: 36, train_loss: 0.4806, test_loss: 0.8098, test_f1: 0.6467
 epoch: 37, train_loss: 0.4734, test_loss: 0.8766, test_f1: 0.6511
 epoch: 38, train_loss: 0.4664, test_loss: 0.8800, test_f1: 0.6590
 epoch: 39, train_loss: 0.4479, test_loss: 0.8181, test_f1: 0.6761
 epoch: 40, train_loss: 0.4443, test_loss: 0.9362, test_f1: 0.6550
 epoch: 41, train_loss: 0.4436, test_loss: 0.8220, test_f1: 0.6777
 epoch: 42, train_loss: 0.4378, test_loss: 0.8813, test_f1: 0.6342
 epoch: 43, train_loss: 0.4250, test_loss: 0.9056, test_f1: 0.6572
 epoch: 44, train_loss: 0.4178, test_loss: 0.9291, test_f1: 0.6548
 epoch: 45, train_loss: 0.4184, test_loss: 1.0256, test_f1: 0.6180
 epoch: 46, train_loss: 0.4245, test_loss: 0.9145, test_f1: 0.6521
 epoch: 47, train_loss: 0.4051, test_loss: 0.9117, test_f1: 0.6748
 epoch: 48, train_loss: 0.3923, test_loss: 0.9929, test_f1: 0.6579
 epoch: 49, train_loss: 0.4004, test_loss: 1.0198, test_f1: 0.6148
 epoch: 50, train_loss: 0.3868, test_loss: 0.9625, test_f1: 0.6708
 epoch: 51, train_loss: 0.3510, test_loss: 0.8924, test_f1: 0.6609
 epoch: 52, train_loss: 0.3145, test_loss: 0.9586, test_f1: 0.6802
 epoch: 53, train_loss: 0.3220, test_loss: 0.9769, test_f1: 0.6579
 epoch: 54, train_loss: 0.3107, test_loss: 1.0165, test_f1: 0.6523
 epoch: 55, train_loss: 0.3050, test_loss: 1.0201, test_f1: 0.6598
 epoch: 56, train_loss: 0.3069, test_loss: 1.0161, test_f1: 0.6673
 epoch: 57, train_loss: 0.3000, test_loss: 1.1432, test_f1: 0.6587
 epoch: 58, train_loss: 0.2873, test_loss: 1.1341, test_f1: 0.6504
 epoch: 59, train_loss: 0.2916, test_loss: 1.1511, test_f1: 0.6391
 epoch: 60, train_loss: 0.3013, test_loss: 1.0647, test_f1: 0.6861
 epoch: 61, train_loss: 0.2927, test_loss: 1.1704, test_f1: 0.6510
 epoch: 62, train_loss: 0.2977, test_loss: 1.0927, test_f1: 0.6492
 epoch: 63, train_loss: 0.2900, test_loss: 1.0295, test_f1: 0.6602
 epoch: 64, train_loss: 0.2841, test_loss: 1.1368, test_f1: 0.6493
 epoch: 65, train_loss: 0.2869, test_loss: 1.1755, test_f1: 0.6643
 epoch: 66, train_loss: 0.2665, test_loss: 1.1668, test_f1: 0.6521
 epoch: 67, train_loss: 0.2608, test_loss: 1.2332, test_f1: 0.6761
 epoch: 68, train_loss: 0.2644, test_loss: 1.1426, test_f1: 0.6608
 epoch: 69, train_loss: 0.2500, test_loss: 1.2461, test_f1: 0.6523
 epoch: 70, train_loss: 0.2673, test_loss: 1.1369, test_f1: 0.6811
 epoch: 71, train_loss: 0.2542, test_loss: 1.1866, test_f1: 0.6732
 epoch: 72, train_loss: 0.2756, test_loss: 1.2010, test_f1: 0.6653
 epoch: 73, train_loss: 0.2395, test_loss: 1.2425, test_f1: 0.6645
 epoch: 74, train_loss: 0.2702, test_loss: 1.1545, test_f1: 0.6607
 epoch: 75, train_loss: 0.2425, test_loss: 1.2361, test_f1: 0.6446
 epoch: 76, train_loss: 0.2420, test_loss: 1.1776, test_f1: 0.6631
 epoch: 77, train_loss: 0.2355, test_loss: 1.3127, test_f1: 0.6565
 epoch: 78, train_loss: 0.2295, test_loss: 1.2411, test_f1: 0.6761
 epoch: 79, train_loss: 0.2432, test_loss: 1.2993, test_f1: 0.6455
 epoch: 80, train_loss: 0.2261, test_loss: 1.3615, test_f1: 0.6601
 epoch: 81, train_loss: 0.2332, test_loss: 1.3308, test_f1: 0.6397
 epoch: 82, train_loss: 0.2391, test_loss: 1.3602, test_f1: 0.6545
 epoch: 83, train_loss: 0.2283, test_loss: 1.2598, test_f1: 0.6503
 epoch: 84, train_loss: 0.2238, test_loss: 1.3614, test_f1: 0.6649
 epoch: 85, train_loss: 0.2191, test_loss: 1.3438, test_f1: 0.6634
 epoch: 86, train_loss: 0.2297, test_loss: 1.3475, test_f1: 0.6752
 epoch: 87, train_loss: 0.2287, test_loss: 1.2518, test_f1: 0.6623
 epoch: 88, train_loss: 0.2161, test_loss: 1.3229, test_f1: 0.6679
 epoch: 89, train_loss: 0.2114, test_loss: 1.3329, test_f1: 0.6677
 epoch: 90, train_loss: 0.2143, test_loss: 1.3290, test_f1: 0.6715
 epoch: 91, train_loss: 0.2118, test_loss: 1.2949, test_f1: 0.6693
 epoch: 92, train_loss: 0.2217, test_loss: 1.4697, test_f1: 0.6919
 epoch: 93, train_loss: 0.2159, test_loss: 1.4505, test_f1: 0.6557
 epoch: 94, train_loss: 0.2120, test_loss: 1.2597, test_f1: 0.6793
 epoch: 95, train_loss: 0.2119, test_loss: 1.3304, test_f1: 0.6548
 epoch: 96, train_loss: 0.2083, test_loss: 1.3946, test_f1: 0.6812
 epoch: 97, train_loss: 0.2135, test_loss: 1.2928, test_f1: 0.6587
 epoch: 98, train_loss: 0.2028, test_loss: 1.3942, test_f1: 0.6499
 epoch: 99, train_loss: 0.1974, test_loss: 1.3318, test_f1: 0.6796
##################ITERATION #5 ****************************************
 epoch: 0, train_loss: 1.3777, test_loss: 1.0226, test_f1: 0.4678
 epoch: 1, train_loss: 0.9765, test_loss: 0.9093, test_f1: 0.5556
 epoch: 2, train_loss: 0.9272, test_loss: 0.8680, test_f1: 0.5485
 epoch: 3, train_loss: 0.8925, test_loss: 0.9127, test_f1: 0.5801
 epoch: 4, train_loss: 0.8811, test_loss: 0.8284, test_f1: 0.5938
 epoch: 5, train_loss: 0.8418, test_loss: 0.8298, test_f1: 0.6393
 epoch: 6, train_loss: 0.8293, test_loss: 0.8167, test_f1: 0.6281
 epoch: 7, train_loss: 0.8065, test_loss: 0.7921, test_f1: 0.6432
 epoch: 8, train_loss: 0.7802, test_loss: 0.8749, test_f1: 0.6124
 epoch: 9, train_loss: 0.7687, test_loss: 0.8014, test_f1: 0.6209
 epoch: 10, train_loss: 0.7458, test_loss: 0.7936, test_f1: 0.6148
 epoch: 11, train_loss: 0.7245, test_loss: 0.8026, test_f1: 0.6374
 epoch: 12, train_loss: 0.7271, test_loss: 0.7804, test_f1: 0.6176
 epoch: 13, train_loss: 0.7122, test_loss: 0.7568, test_f1: 0.6606
 epoch: 14, train_loss: 0.7024, test_loss: 0.8281, test_f1: 0.6296
 epoch: 15, train_loss: 0.7178, test_loss: 0.7834, test_f1: 0.6613
 epoch: 16, train_loss: 0.6857, test_loss: 0.7274, test_f1: 0.6715
 epoch: 17, train_loss: 0.6689, test_loss: 0.7179, test_f1: 0.6744
 epoch: 18, train_loss: 0.6653, test_loss: 0.7623, test_f1: 0.6563
 epoch: 19, train_loss: 0.6233, test_loss: 0.7858, test_f1: 0.6333
 epoch: 20, train_loss: 0.6379, test_loss: 0.7650, test_f1: 0.6600
 epoch: 21, train_loss: 0.6232, test_loss: 0.8066, test_f1: 0.6807
 epoch: 22, train_loss: 0.6339, test_loss: 0.7880, test_f1: 0.6505
 epoch: 23, train_loss: 0.6216, test_loss: 0.7479, test_f1: 0.6482
 epoch: 24, train_loss: 0.6020, test_loss: 0.8782, test_f1: 0.6266
 epoch: 25, train_loss: 0.5921, test_loss: 0.7757, test_f1: 0.6666
 epoch: 26, train_loss: 0.6012, test_loss: 0.8047, test_f1: 0.6803
 epoch: 27, train_loss: 0.5762, test_loss: 0.8359, test_f1: 0.6546
 epoch: 28, train_loss: 0.5614, test_loss: 0.8453, test_f1: 0.6440
 epoch: 29, train_loss: 0.5401, test_loss: 0.8538, test_f1: 0.6375
 epoch: 30, train_loss: 0.5319, test_loss: 0.8067, test_f1: 0.6862
 epoch: 31, train_loss: 0.5414, test_loss: 0.8241, test_f1: 0.6667
 epoch: 32, train_loss: 0.5232, test_loss: 0.8135, test_f1: 0.6847
 epoch: 33, train_loss: 0.5192, test_loss: 0.8002, test_f1: 0.6887
 epoch: 34, train_loss: 0.5105, test_loss: 0.8472, test_f1: 0.6752
 epoch: 35, train_loss: 0.5009, test_loss: 0.8059, test_f1: 0.6559
 epoch: 36, train_loss: 0.5060, test_loss: 0.8687, test_f1: 0.6751
 epoch: 37, train_loss: 0.4956, test_loss: 0.9006, test_f1: 0.6773
 epoch: 38, train_loss: 0.4774, test_loss: 0.9506, test_f1: 0.6717
 epoch: 39, train_loss: 0.5015, test_loss: 0.9637, test_f1: 0.6720
 epoch: 40, train_loss: 0.4779, test_loss: 0.9671, test_f1: 0.6603
 epoch: 41, train_loss: 0.4688, test_loss: 0.9172, test_f1: 0.6764
 epoch: 42, train_loss: 0.4555, test_loss: 0.9354, test_f1: 0.6497
 epoch: 43, train_loss: 0.4484, test_loss: 0.8905, test_f1: 0.6627
 epoch: 44, train_loss: 0.4318, test_loss: 1.0191, test_f1: 0.6292
 epoch: 45, train_loss: 0.4320, test_loss: 0.9233, test_f1: 0.6612
 epoch: 46, train_loss: 0.4155, test_loss: 1.0258, test_f1: 0.6579
 epoch: 47, train_loss: 0.4205, test_loss: 0.9538, test_f1: 0.6785
 epoch: 48, train_loss: 0.4388, test_loss: 0.9229, test_f1: 0.6672
 epoch: 49, train_loss: 0.4114, test_loss: 0.9772, test_f1: 0.6791
 epoch: 50, train_loss: 0.3923, test_loss: 0.8732, test_f1: 0.6751
 epoch: 51, train_loss: 0.3569, test_loss: 1.0447, test_f1: 0.6648
 epoch: 52, train_loss: 0.3332, test_loss: 1.0048, test_f1: 0.6778
 epoch: 53, train_loss: 0.3207, test_loss: 1.0838, test_f1: 0.6691
 epoch: 54, train_loss: 0.3263, test_loss: 1.1415, test_f1: 0.6784
 epoch: 55, train_loss: 0.3214, test_loss: 1.0080, test_f1: 0.6973
 epoch: 56, train_loss: 0.3188, test_loss: 1.0169, test_f1: 0.6794
 epoch: 57, train_loss: 0.3084, test_loss: 1.1243, test_f1: 0.6807
 epoch: 58, train_loss: 0.3002, test_loss: 1.1023, test_f1: 0.7004
 epoch: 59, train_loss: 0.2985, test_loss: 1.0934, test_f1: 0.6934
 epoch: 60, train_loss: 0.3021, test_loss: 0.9933, test_f1: 0.6978
 epoch: 61, train_loss: 0.2892, test_loss: 1.0903, test_f1: 0.6703
 epoch: 62, train_loss: 0.2858, test_loss: 1.1885, test_f1: 0.6654
 epoch: 63, train_loss: 0.2917, test_loss: 1.0911, test_f1: 0.6816
 epoch: 64, train_loss: 0.2684, test_loss: 1.1875, test_f1: 0.6774
 epoch: 65, train_loss: 0.2846, test_loss: 1.1888, test_f1: 0.6753
 epoch: 66, train_loss: 0.2744, test_loss: 1.1981, test_f1: 0.6914
 epoch: 67, train_loss: 0.2806, test_loss: 1.1861, test_f1: 0.6810
 epoch: 68, train_loss: 0.2723, test_loss: 1.2646, test_f1: 0.6670
 epoch: 69, train_loss: 0.2735, test_loss: 1.1542, test_f1: 0.6862
 epoch: 70, train_loss: 0.2604, test_loss: 1.2282, test_f1: 0.6889
 epoch: 71, train_loss: 0.2848, test_loss: 1.2101, test_f1: 0.6781
 epoch: 72, train_loss: 0.2487, test_loss: 1.2757, test_f1: 0.6816
 epoch: 73, train_loss: 0.2542, test_loss: 1.3135, test_f1: 0.6705
 epoch: 74, train_loss: 0.2358, test_loss: 1.2799, test_f1: 0.6714
 epoch: 75, train_loss: 0.2525, test_loss: 1.2140, test_f1: 0.6752
 epoch: 76, train_loss: 0.2607, test_loss: 1.2221, test_f1: 0.6915
 epoch: 77, train_loss: 0.2390, test_loss: 1.2492, test_f1: 0.6782
 epoch: 78, train_loss: 0.2572, test_loss: 1.2410, test_f1: 0.6958
 epoch: 79, train_loss: 0.2479, test_loss: 1.3110, test_f1: 0.6723
 epoch: 80, train_loss: 0.2499, test_loss: 1.2652, test_f1: 0.6895
 epoch: 81, train_loss: 0.2242, test_loss: 1.3382, test_f1: 0.6734
 epoch: 82, train_loss: 0.2312, test_loss: 1.2411, test_f1: 0.6923
 epoch: 83, train_loss: 0.2197, test_loss: 1.3827, test_f1: 0.6796
 epoch: 84, train_loss: 0.2320, test_loss: 1.3243, test_f1: 0.6814
 epoch: 85, train_loss: 0.2265, test_loss: 1.3654, test_f1: 0.6762
 epoch: 86, train_loss: 0.2174, test_loss: 1.1871, test_f1: 0.6804
 epoch: 87, train_loss: 0.2202, test_loss: 1.3486, test_f1: 0.6854
 epoch: 88, train_loss: 0.2284, test_loss: 1.2395, test_f1: 0.6804
 epoch: 89, train_loss: 0.2168, test_loss: 1.3437, test_f1: 0.6848
 epoch: 90, train_loss: 0.2081, test_loss: 1.4187, test_f1: 0.6734
 epoch: 91, train_loss: 0.2433, test_loss: 1.2723, test_f1: 0.6747
 epoch: 92, train_loss: 0.2194, test_loss: 1.3284, test_f1: 0.6860
 epoch: 93, train_loss: 0.2070, test_loss: 1.3275, test_f1: 0.6613
 epoch: 94, train_loss: 0.2048, test_loss: 1.4778, test_f1: 0.6775
 epoch: 95, train_loss: 0.2112, test_loss: 1.3857, test_f1: 0.6776
 epoch: 96, train_loss: 0.2030, test_loss: 1.4851, test_f1: 0.6794
 epoch: 97, train_loss: 0.1999, test_loss: 1.3125, test_f1: 0.6812
 epoch: 98, train_loss: 0.2307, test_loss: 1.4506, test_f1: 0.6866
 epoch: 99, train_loss: 0.2016, test_loss: 1.3685, test_f1: 0.6637
##################ITERATION #6 ****************************************
 epoch: 0, train_loss: 1.3673, test_loss: 1.0091, test_f1: 0.5012
 epoch: 1, train_loss: 0.9750, test_loss: 0.9367, test_f1: 0.5592
 epoch: 2, train_loss: 0.9333, test_loss: 0.9108, test_f1: 0.5525
 epoch: 3, train_loss: 0.8944, test_loss: 0.9420, test_f1: 0.5089
 epoch: 4, train_loss: 0.8770, test_loss: 0.8430, test_f1: 0.5622
 epoch: 5, train_loss: 0.8552, test_loss: 0.8548, test_f1: 0.5602
 epoch: 6, train_loss: 0.8307, test_loss: 0.8028, test_f1: 0.5783
 epoch: 7, train_loss: 0.8271, test_loss: 0.8423, test_f1: 0.5774
 epoch: 8, train_loss: 0.8030, test_loss: 0.7726, test_f1: 0.6150
 epoch: 9, train_loss: 0.7833, test_loss: 0.7761, test_f1: 0.6344
 epoch: 10, train_loss: 0.7664, test_loss: 0.7525, test_f1: 0.6153
 epoch: 11, train_loss: 0.7532, test_loss: 0.7771, test_f1: 0.6299
 epoch: 12, train_loss: 0.7261, test_loss: 0.8784, test_f1: 0.5674
 epoch: 13, train_loss: 0.7168, test_loss: 0.7940, test_f1: 0.6328
 epoch: 14, train_loss: 0.7122, test_loss: 0.7631, test_f1: 0.6279
 epoch: 15, train_loss: 0.6948, test_loss: 0.7746, test_f1: 0.6753
 epoch: 16, train_loss: 0.6778, test_loss: 0.7513, test_f1: 0.6385
 epoch: 17, train_loss: 0.6648, test_loss: 0.7766, test_f1: 0.6319
 epoch: 18, train_loss: 0.6666, test_loss: 0.7448, test_f1: 0.6723
 epoch: 19, train_loss: 0.6630, test_loss: 0.7928, test_f1: 0.6348
 epoch: 20, train_loss: 0.6396, test_loss: 0.7094, test_f1: 0.6615
 epoch: 21, train_loss: 0.6264, test_loss: 0.7349, test_f1: 0.6892
 epoch: 22, train_loss: 0.6201, test_loss: 0.7308, test_f1: 0.6646
 epoch: 23, train_loss: 0.6054, test_loss: 0.7785, test_f1: 0.6786
 epoch: 24, train_loss: 0.5935, test_loss: 0.7535, test_f1: 0.6530
 epoch: 25, train_loss: 0.5754, test_loss: 0.7711, test_f1: 0.6664
 epoch: 26, train_loss: 0.5687, test_loss: 0.7918, test_f1: 0.6890
 epoch: 27, train_loss: 0.5640, test_loss: 0.7327, test_f1: 0.6682
 epoch: 28, train_loss: 0.5657, test_loss: 0.7930, test_f1: 0.6787
 epoch: 29, train_loss: 0.5483, test_loss: 0.8096, test_f1: 0.6864
 epoch: 30, train_loss: 0.5294, test_loss: 0.8533, test_f1: 0.6462
 epoch: 31, train_loss: 0.5321, test_loss: 0.8209, test_f1: 0.6985
 epoch: 32, train_loss: 0.5187, test_loss: 0.7320, test_f1: 0.6571
 epoch: 33, train_loss: 0.5083, test_loss: 0.7756, test_f1: 0.6927
 epoch: 34, train_loss: 0.5218, test_loss: 0.7860, test_f1: 0.7164
 epoch: 35, train_loss: 0.5000, test_loss: 0.7840, test_f1: 0.6846
 epoch: 36, train_loss: 0.4794, test_loss: 0.7748, test_f1: 0.6849
 epoch: 37, train_loss: 0.4758, test_loss: 0.8148, test_f1: 0.6976
 epoch: 38, train_loss: 0.4713, test_loss: 0.7950, test_f1: 0.6485
 epoch: 39, train_loss: 0.4447, test_loss: 0.8380, test_f1: 0.6712
 epoch: 40, train_loss: 0.4564, test_loss: 0.8550, test_f1: 0.6812
 epoch: 41, train_loss: 0.4424, test_loss: 0.7404, test_f1: 0.6936
 epoch: 42, train_loss: 0.4759, test_loss: 0.7817, test_f1: 0.6639
 epoch: 43, train_loss: 0.4681, test_loss: 0.8177, test_f1: 0.6646
 epoch: 44, train_loss: 0.4580, test_loss: 0.8587, test_f1: 0.7386
 epoch: 45, train_loss: 0.4379, test_loss: 0.8136, test_f1: 0.6512
 epoch: 46, train_loss: 0.4463, test_loss: 0.7874, test_f1: 0.6792
 epoch: 47, train_loss: 0.4394, test_loss: 0.7635, test_f1: 0.6861
 epoch: 48, train_loss: 0.4162, test_loss: 0.7518, test_f1: 0.6854
 epoch: 49, train_loss: 0.3986, test_loss: 0.8434, test_f1: 0.6657
 epoch: 50, train_loss: 0.4013, test_loss: 0.8311, test_f1: 0.6877
 epoch: 51, train_loss: 0.3540, test_loss: 0.8547, test_f1: 0.6758
 epoch: 52, train_loss: 0.3607, test_loss: 0.9121, test_f1: 0.6765
 epoch: 53, train_loss: 0.3270, test_loss: 0.9511, test_f1: 0.6779
 epoch: 54, train_loss: 0.3370, test_loss: 0.9306, test_f1: 0.6827
 epoch: 55, train_loss: 0.3198, test_loss: 0.9469, test_f1: 0.6757
 epoch: 56, train_loss: 0.3142, test_loss: 0.9536, test_f1: 0.6848
 epoch: 57, train_loss: 0.3215, test_loss: 0.9152, test_f1: 0.6816
 epoch: 58, train_loss: 0.2912, test_loss: 0.9728, test_f1: 0.6797
 epoch: 59, train_loss: 0.3028, test_loss: 1.0148, test_f1: 0.6822
 epoch: 60, train_loss: 0.2903, test_loss: 1.0216, test_f1: 0.6834
 epoch: 61, train_loss: 0.3029, test_loss: 1.0727, test_f1: 0.6885
 epoch: 62, train_loss: 0.2864, test_loss: 0.9875, test_f1: 0.6827
 epoch: 63, train_loss: 0.2847, test_loss: 1.0325, test_f1: 0.6878
 epoch: 64, train_loss: 0.2886, test_loss: 0.9873, test_f1: 0.6793
 epoch: 65, train_loss: 0.2868, test_loss: 1.0555, test_f1: 0.6823
 epoch: 66, train_loss: 0.2732, test_loss: 1.0848, test_f1: 0.6860
 epoch: 67, train_loss: 0.2828, test_loss: 1.0691, test_f1: 0.6809
 epoch: 68, train_loss: 0.2946, test_loss: 1.0091, test_f1: 0.6727
 epoch: 69, train_loss: 0.2793, test_loss: 1.0382, test_f1: 0.6867
 epoch: 70, train_loss: 0.2636, test_loss: 0.9783, test_f1: 0.6758
 epoch: 71, train_loss: 0.2645, test_loss: 1.0480, test_f1: 0.6720
 epoch: 72, train_loss: 0.2645, test_loss: 1.0516, test_f1: 0.6865
 epoch: 73, train_loss: 0.2461, test_loss: 1.0087, test_f1: 0.6804
 epoch: 74, train_loss: 0.2441, test_loss: 1.1222, test_f1: 0.6775
 epoch: 75, train_loss: 0.2500, test_loss: 1.1043, test_f1: 0.6834
 epoch: 76, train_loss: 0.2646, test_loss: 1.0243, test_f1: 0.6989
 epoch: 77, train_loss: 0.2437, test_loss: 1.0622, test_f1: 0.6682
 epoch: 78, train_loss: 0.2506, test_loss: 1.1339, test_f1: 0.6849
 epoch: 79, train_loss: 0.2451, test_loss: 1.1591, test_f1: 0.6851
 epoch: 80, train_loss: 0.2332, test_loss: 1.2189, test_f1: 0.6780
 epoch: 81, train_loss: 0.2297, test_loss: 1.1635, test_f1: 0.6831
 epoch: 82, train_loss: 0.2353, test_loss: 1.0777, test_f1: 0.6898
 epoch: 83, train_loss: 0.2296, test_loss: 1.1565, test_f1: 0.6763
 epoch: 84, train_loss: 0.2434, test_loss: 1.2150, test_f1: 0.6740
 epoch: 85, train_loss: 0.2261, test_loss: 1.1544, test_f1: 0.6829
 epoch: 86, train_loss: 0.2354, test_loss: 1.1697, test_f1: 0.6740
 epoch: 87, train_loss: 0.2225, test_loss: 1.2694, test_f1: 0.6792
 epoch: 88, train_loss: 0.2185, test_loss: 1.3543, test_f1: 0.6757
 epoch: 89, train_loss: 0.2324, test_loss: 1.2198, test_f1: 0.6928
 epoch: 90, train_loss: 0.2153, test_loss: 1.2506, test_f1: 0.6818
 epoch: 91, train_loss: 0.2333, test_loss: 1.2557, test_f1: 0.6482
 epoch: 92, train_loss: 0.2176, test_loss: 1.2020, test_f1: 0.6916
 epoch: 93, train_loss: 0.2189, test_loss: 1.1704, test_f1: 0.6846
 epoch: 94, train_loss: 0.1985, test_loss: 1.2476, test_f1: 0.6729
 epoch: 95, train_loss: 0.2040, test_loss: 1.2815, test_f1: 0.6770
 epoch: 96, train_loss: 0.2150, test_loss: 1.2526, test_f1: 0.6510
 epoch: 97, train_loss: 0.2080, test_loss: 1.2828, test_f1: 0.6753
 epoch: 98, train_loss: 0.2010, test_loss: 1.2793, test_f1: 0.6728
 epoch: 99, train_loss: 0.2094, test_loss: 1.3224, test_f1: 0.6745
##################ITERATION #7 ****************************************
 epoch: 0, train_loss: 1.3024, test_loss: 1.0859, test_f1: 0.3737
 epoch: 1, train_loss: 0.9668, test_loss: 0.9136, test_f1: 0.5259
 epoch: 2, train_loss: 0.9229, test_loss: 0.9047, test_f1: 0.5580
 epoch: 3, train_loss: 0.8980, test_loss: 0.8983, test_f1: 0.5428
 epoch: 4, train_loss: 0.8685, test_loss: 0.8386, test_f1: 0.5573
 epoch: 5, train_loss: 0.8347, test_loss: 0.7915, test_f1: 0.6374
 epoch: 6, train_loss: 0.8358, test_loss: 0.8444, test_f1: 0.6013
 epoch: 7, train_loss: 0.8106, test_loss: 0.7966, test_f1: 0.5991
 epoch: 8, train_loss: 0.7776, test_loss: 0.8243, test_f1: 0.6234
 epoch: 9, train_loss: 0.7749, test_loss: 0.8179, test_f1: 0.6190
 epoch: 10, train_loss: 0.7596, test_loss: 0.7697, test_f1: 0.6415
 epoch: 11, train_loss: 0.7537, test_loss: 0.7798, test_f1: 0.6561
 epoch: 12, train_loss: 0.7212, test_loss: 0.7998, test_f1: 0.6422
 epoch: 13, train_loss: 0.7036, test_loss: 0.8168, test_f1: 0.6438
 epoch: 14, train_loss: 0.7128, test_loss: 0.7262, test_f1: 0.6741
 epoch: 15, train_loss: 0.6675, test_loss: 0.7985, test_f1: 0.6560
 epoch: 16, train_loss: 0.6882, test_loss: 0.7668, test_f1: 0.6519
 epoch: 17, train_loss: 0.6526, test_loss: 0.7806, test_f1: 0.6133
 epoch: 18, train_loss: 0.6531, test_loss: 0.8579, test_f1: 0.6268
 epoch: 19, train_loss: 0.6290, test_loss: 0.7115, test_f1: 0.6585
 epoch: 20, train_loss: 0.6191, test_loss: 0.7746, test_f1: 0.6478
 epoch: 21, train_loss: 0.6143, test_loss: 0.8077, test_f1: 0.6091
 epoch: 22, train_loss: 0.5938, test_loss: 0.7633, test_f1: 0.6611
 epoch: 23, train_loss: 0.5840, test_loss: 0.7524, test_f1: 0.6925
 epoch: 24, train_loss: 0.5900, test_loss: 0.7413, test_f1: 0.6785
 epoch: 25, train_loss: 0.5708, test_loss: 0.7602, test_f1: 0.6502
 epoch: 26, train_loss: 0.5737, test_loss: 0.7769, test_f1: 0.6479
 epoch: 27, train_loss: 0.5635, test_loss: 0.8681, test_f1: 0.6069
 epoch: 28, train_loss: 0.5525, test_loss: 0.8248, test_f1: 0.6420
 epoch: 29, train_loss: 0.5317, test_loss: 0.7683, test_f1: 0.6842
 epoch: 30, train_loss: 0.5183, test_loss: 0.8238, test_f1: 0.6471
 epoch: 31, train_loss: 0.5298, test_loss: 0.7921, test_f1: 0.6698
 epoch: 32, train_loss: 0.5462, test_loss: 0.7418, test_f1: 0.6803
 epoch: 33, train_loss: 0.5109, test_loss: 0.8337, test_f1: 0.6443
 epoch: 34, train_loss: 0.4905, test_loss: 0.8163, test_f1: 0.6723
 epoch: 35, train_loss: 0.5082, test_loss: 0.8574, test_f1: 0.6789
 epoch: 36, train_loss: 0.4720, test_loss: 0.8141, test_f1: 0.6644
 epoch: 37, train_loss: 0.4766, test_loss: 0.8225, test_f1: 0.6847
 epoch: 38, train_loss: 0.4773, test_loss: 0.8862, test_f1: 0.6767
 epoch: 39, train_loss: 0.4763, test_loss: 0.7928, test_f1: 0.6929
 epoch: 40, train_loss: 0.4817, test_loss: 0.8096, test_f1: 0.6900
 epoch: 41, train_loss: 0.4516, test_loss: 0.8549, test_f1: 0.6858
 epoch: 42, train_loss: 0.4190, test_loss: 0.9246, test_f1: 0.6446
 epoch: 43, train_loss: 0.4473, test_loss: 0.7190, test_f1: 0.7080
 epoch: 44, train_loss: 0.4426, test_loss: 0.8639, test_f1: 0.6803
 epoch: 45, train_loss: 0.4393, test_loss: 0.8938, test_f1: 0.6629
 epoch: 46, train_loss: 0.4173, test_loss: 0.8271, test_f1: 0.6833
 epoch: 47, train_loss: 0.3937, test_loss: 0.9114, test_f1: 0.6491
 epoch: 48, train_loss: 0.4034, test_loss: 0.8367, test_f1: 0.6569
 epoch: 49, train_loss: 0.4022, test_loss: 0.9699, test_f1: 0.6595
 epoch: 50, train_loss: 0.4102, test_loss: 0.8298, test_f1: 0.6993
 epoch: 51, train_loss: 0.3719, test_loss: 0.8925, test_f1: 0.6937
 epoch: 52, train_loss: 0.3557, test_loss: 0.9243, test_f1: 0.6973
 epoch: 53, train_loss: 0.3126, test_loss: 1.0779, test_f1: 0.6928
 epoch: 54, train_loss: 0.3141, test_loss: 1.0532, test_f1: 0.6941
 epoch: 55, train_loss: 0.3233, test_loss: 0.9976, test_f1: 0.6882
 epoch: 56, train_loss: 0.3127, test_loss: 0.9644, test_f1: 0.6738
 epoch: 57, train_loss: 0.2981, test_loss: 1.0300, test_f1: 0.6852
 epoch: 58, train_loss: 0.3032, test_loss: 1.0218, test_f1: 0.6901
 epoch: 59, train_loss: 0.2962, test_loss: 1.0096, test_f1: 0.6818
 epoch: 60, train_loss: 0.2952, test_loss: 1.0247, test_f1: 0.6788
 epoch: 61, train_loss: 0.2832, test_loss: 1.1321, test_f1: 0.6879
 epoch: 62, train_loss: 0.2998, test_loss: 1.0861, test_f1: 0.6837
 epoch: 63, train_loss: 0.2946, test_loss: 1.1494, test_f1: 0.6835
 epoch: 64, train_loss: 0.2770, test_loss: 1.1489, test_f1: 0.6864
 epoch: 65, train_loss: 0.2858, test_loss: 1.1575, test_f1: 0.6904
 epoch: 66, train_loss: 0.2719, test_loss: 1.1662, test_f1: 0.6766
 epoch: 67, train_loss: 0.2744, test_loss: 1.2105, test_f1: 0.6826
 epoch: 68, train_loss: 0.2572, test_loss: 1.0634, test_f1: 0.6771
 epoch: 69, train_loss: 0.2832, test_loss: 1.1354, test_f1: 0.6970
 epoch: 70, train_loss: 0.2530, test_loss: 1.1305, test_f1: 0.6724
 epoch: 71, train_loss: 0.2557, test_loss: 1.0607, test_f1: 0.6948
 epoch: 72, train_loss: 0.2437, test_loss: 1.1558, test_f1: 0.6864
 epoch: 73, train_loss: 0.2661, test_loss: 1.1960, test_f1: 0.6783
 epoch: 74, train_loss: 0.2534, test_loss: 1.2628, test_f1: 0.6839
 epoch: 75, train_loss: 0.2375, test_loss: 1.1960, test_f1: 0.6730
 epoch: 76, train_loss: 0.2389, test_loss: 1.2703, test_f1: 0.7027
 epoch: 77, train_loss: 0.2334, test_loss: 1.2666, test_f1: 0.6733
 epoch: 78, train_loss: 0.2309, test_loss: 1.1847, test_f1: 0.6972
 epoch: 79, train_loss: 0.2382, test_loss: 1.2669, test_f1: 0.6856
 epoch: 80, train_loss: 0.2373, test_loss: 1.2667, test_f1: 0.6609
 epoch: 81, train_loss: 0.2376, test_loss: 1.1612, test_f1: 0.6918
 epoch: 82, train_loss: 0.2264, test_loss: 1.2465, test_f1: 0.6811
 epoch: 83, train_loss: 0.2464, test_loss: 1.2690, test_f1: 0.6765
 epoch: 84, train_loss: 0.2333, test_loss: 1.3218, test_f1: 0.6777
 epoch: 85, train_loss: 0.2296, test_loss: 1.2984, test_f1: 0.6764
 epoch: 86, train_loss: 0.2341, test_loss: 1.2091, test_f1: 0.7124
 epoch: 87, train_loss: 0.2127, test_loss: 1.2563, test_f1: 0.6634
 epoch: 88, train_loss: 0.2224, test_loss: 1.2911, test_f1: 0.6670
 epoch: 89, train_loss: 0.2006, test_loss: 1.3731, test_f1: 0.6887
 epoch: 90, train_loss: 0.2147, test_loss: 1.3599, test_f1: 0.6862
 epoch: 91, train_loss: 0.2272, test_loss: 1.3016, test_f1: 0.6929
 epoch: 92, train_loss: 0.2242, test_loss: 1.3395, test_f1: 0.6766
 epoch: 93, train_loss: 0.2029, test_loss: 1.3320, test_f1: 0.6843
 epoch: 94, train_loss: 0.2069, test_loss: 1.4639, test_f1: 0.6855
 epoch: 95, train_loss: 0.2119, test_loss: 1.3809, test_f1: 0.6744
 epoch: 96, train_loss: 0.2183, test_loss: 1.4069, test_f1: 0.6835
 epoch: 97, train_loss: 0.1972, test_loss: 1.2383, test_f1: 0.6952
 epoch: 98, train_loss: 0.1943, test_loss: 1.4471, test_f1: 0.6697
 epoch: 99, train_loss: 0.2095, test_loss: 1.3167, test_f1: 0.6948
##################ITERATION #8 ****************************************
 epoch: 0, train_loss: 1.3602, test_loss: 0.9641, test_f1: 0.4947
 epoch: 1, train_loss: 0.9755, test_loss: 0.9148, test_f1: 0.5415
 epoch: 2, train_loss: 0.9336, test_loss: 0.9194, test_f1: 0.5138
 epoch: 3, train_loss: 0.9083, test_loss: 0.8633, test_f1: 0.5535
 epoch: 4, train_loss: 0.8801, test_loss: 0.8247, test_f1: 0.5767
 epoch: 5, train_loss: 0.8496, test_loss: 0.8813, test_f1: 0.5625
 epoch: 6, train_loss: 0.8460, test_loss: 0.7945, test_f1: 0.6005
 epoch: 7, train_loss: 0.8099, test_loss: 0.8152, test_f1: 0.6312
 epoch: 8, train_loss: 0.8074, test_loss: 0.8655, test_f1: 0.6300
 epoch: 9, train_loss: 0.7786, test_loss: 0.7654, test_f1: 0.6332
 epoch: 10, train_loss: 0.7721, test_loss: 0.8161, test_f1: 0.5830
 epoch: 11, train_loss: 0.7538, test_loss: 0.7503, test_f1: 0.6366
 epoch: 12, train_loss: 0.7266, test_loss: 0.8019, test_f1: 0.6169
 epoch: 13, train_loss: 0.7287, test_loss: 0.8405, test_f1: 0.6092
 epoch: 14, train_loss: 0.7191, test_loss: 0.7555, test_f1: 0.6381
 epoch: 15, train_loss: 0.7032, test_loss: 0.7706, test_f1: 0.6224
 epoch: 16, train_loss: 0.6792, test_loss: 0.7323, test_f1: 0.6659
 epoch: 17, train_loss: 0.6769, test_loss: 0.7506, test_f1: 0.6491
 epoch: 18, train_loss: 0.6496, test_loss: 0.7739, test_f1: 0.6746
 epoch: 19, train_loss: 0.6572, test_loss: 0.7232, test_f1: 0.6358
 epoch: 20, train_loss: 0.6525, test_loss: 0.7310, test_f1: 0.6716
 epoch: 21, train_loss: 0.6247, test_loss: 0.7662, test_f1: 0.6159
 epoch: 22, train_loss: 0.5970, test_loss: 0.7343, test_f1: 0.6482
 epoch: 23, train_loss: 0.6199, test_loss: 0.8987, test_f1: 0.6424
 epoch: 24, train_loss: 0.5872, test_loss: 0.7325, test_f1: 0.6588
 epoch: 25, train_loss: 0.5842, test_loss: 0.7602, test_f1: 0.6501
 epoch: 26, train_loss: 0.5855, test_loss: 0.8093, test_f1: 0.6350
 epoch: 27, train_loss: 0.5795, test_loss: 0.7286, test_f1: 0.6424
 epoch: 28, train_loss: 0.5632, test_loss: 0.8282, test_f1: 0.6388
 epoch: 29, train_loss: 0.5371, test_loss: 0.8841, test_f1: 0.6036
 epoch: 30, train_loss: 0.5331, test_loss: 0.8702, test_f1: 0.6608
 epoch: 31, train_loss: 0.5362, test_loss: 0.8336, test_f1: 0.6590
 epoch: 32, train_loss: 0.5223, test_loss: 0.7717, test_f1: 0.6503
 epoch: 33, train_loss: 0.5207, test_loss: 0.8204, test_f1: 0.6190
 epoch: 34, train_loss: 0.5007, test_loss: 0.8861, test_f1: 0.6340
 epoch: 35, train_loss: 0.4953, test_loss: 0.9362, test_f1: 0.6297
 epoch: 36, train_loss: 0.5229, test_loss: 0.8263, test_f1: 0.6534
 epoch: 37, train_loss: 0.4790, test_loss: 0.8147, test_f1: 0.6714
 epoch: 38, train_loss: 0.4572, test_loss: 0.8379, test_f1: 0.6453
 epoch: 39, train_loss: 0.4544, test_loss: 0.7881, test_f1: 0.6638
 epoch: 40, train_loss: 0.4789, test_loss: 0.8527, test_f1: 0.6536
 epoch: 41, train_loss: 0.4462, test_loss: 0.8493, test_f1: 0.6459
 epoch: 42, train_loss: 0.4394, test_loss: 0.8082, test_f1: 0.6692
 epoch: 43, train_loss: 0.4374, test_loss: 0.9305, test_f1: 0.6253
 epoch: 44, train_loss: 0.4294, test_loss: 0.8986, test_f1: 0.6787
 epoch: 45, train_loss: 0.4309, test_loss: 0.8484, test_f1: 0.6659
 epoch: 46, train_loss: 0.4090, test_loss: 0.9892, test_f1: 0.6459
 epoch: 47, train_loss: 0.4014, test_loss: 0.8723, test_f1: 0.6646
 epoch: 48, train_loss: 0.4008, test_loss: 0.8780, test_f1: 0.6667
 epoch: 49, train_loss: 0.4030, test_loss: 0.9244, test_f1: 0.6640
 epoch: 50, train_loss: 0.3988, test_loss: 1.0158, test_f1: 0.6407
 epoch: 51, train_loss: 0.3474, test_loss: 0.8947, test_f1: 0.6820
 epoch: 52, train_loss: 0.3452, test_loss: 0.9785, test_f1: 0.6637
 epoch: 53, train_loss: 0.3214, test_loss: 0.9799, test_f1: 0.6681
 epoch: 54, train_loss: 0.3072, test_loss: 1.0412, test_f1: 0.6731
 epoch: 55, train_loss: 0.3147, test_loss: 1.0020, test_f1: 0.6670
 epoch: 56, train_loss: 0.3205, test_loss: 1.0189, test_f1: 0.6701
 epoch: 57, train_loss: 0.3195, test_loss: 1.0381, test_f1: 0.6760
 epoch: 58, train_loss: 0.3097, test_loss: 1.1303, test_f1: 0.6662
 epoch: 59, train_loss: 0.3015, test_loss: 1.0417, test_f1: 0.6753
 epoch: 60, train_loss: 0.2889, test_loss: 1.0208, test_f1: 0.6868
 epoch: 61, train_loss: 0.2880, test_loss: 1.0585, test_f1: 0.6702
 epoch: 62, train_loss: 0.2748, test_loss: 1.1314, test_f1: 0.6605
 epoch: 63, train_loss: 0.2712, test_loss: 1.1136, test_f1: 0.6688
 epoch: 64, train_loss: 0.2797, test_loss: 1.1872, test_f1: 0.6683
 epoch: 65, train_loss: 0.2814, test_loss: 1.1077, test_f1: 0.6667
 epoch: 66, train_loss: 0.2626, test_loss: 1.1051, test_f1: 0.6798
 epoch: 67, train_loss: 0.2615, test_loss: 1.1072, test_f1: 0.6651
 epoch: 68, train_loss: 0.2607, test_loss: 1.2148, test_f1: 0.6734
 epoch: 69, train_loss: 0.2602, test_loss: 1.1858, test_f1: 0.6773
 epoch: 70, train_loss: 0.2568, test_loss: 1.2263, test_f1: 0.6605
 epoch: 71, train_loss: 0.2511, test_loss: 1.2174, test_f1: 0.6476
 epoch: 72, train_loss: 0.2806, test_loss: 1.1981, test_f1: 0.6571
 epoch: 73, train_loss: 0.2793, test_loss: 1.0519, test_f1: 0.6811
 epoch: 74, train_loss: 0.2513, test_loss: 1.1606, test_f1: 0.6745
 epoch: 75, train_loss: 0.2494, test_loss: 1.2524, test_f1: 0.6731
 epoch: 76, train_loss: 0.2450, test_loss: 1.1955, test_f1: 0.6693
 epoch: 77, train_loss: 0.2391, test_loss: 1.2687, test_f1: 0.6643
 epoch: 78, train_loss: 0.2580, test_loss: 1.2117, test_f1: 0.6740
 epoch: 79, train_loss: 0.2304, test_loss: 1.2918, test_f1: 0.6736
 epoch: 80, train_loss: 0.2290, test_loss: 1.2845, test_f1: 0.6746
 epoch: 81, train_loss: 0.2406, test_loss: 1.2841, test_f1: 0.6801
 epoch: 82, train_loss: 0.2149, test_loss: 1.2396, test_f1: 0.6743
 epoch: 83, train_loss: 0.2192, test_loss: 1.3322, test_f1: 0.6622
 epoch: 84, train_loss: 0.2479, test_loss: 1.2229, test_f1: 0.6645
 epoch: 85, train_loss: 0.2313, test_loss: 1.2582, test_f1: 0.6687
 epoch: 86, train_loss: 0.2314, test_loss: 1.2688, test_f1: 0.6592
 epoch: 87, train_loss: 0.2168, test_loss: 1.2113, test_f1: 0.6876
 epoch: 88, train_loss: 0.2055, test_loss: 1.3990, test_f1: 0.6655
 epoch: 89, train_loss: 0.2339, test_loss: 1.2545, test_f1: 0.6945
 epoch: 90, train_loss: 0.2266, test_loss: 1.1802, test_f1: 0.6609
 epoch: 91, train_loss: 0.2053, test_loss: 1.2924, test_f1: 0.6765
 epoch: 92, train_loss: 0.2193, test_loss: 1.2348, test_f1: 0.6642
 epoch: 93, train_loss: 0.2036, test_loss: 1.3184, test_f1: 0.6614
 epoch: 94, train_loss: 0.2018, test_loss: 1.3879, test_f1: 0.6791
 epoch: 95, train_loss: 0.1953, test_loss: 1.3869, test_f1: 0.6845
 epoch: 96, train_loss: 0.1817, test_loss: 1.4218, test_f1: 0.6756
 epoch: 97, train_loss: 0.2107, test_loss: 1.2741, test_f1: 0.6867
 epoch: 98, train_loss: 0.2079, test_loss: 1.3762, test_f1: 0.6736
 epoch: 99, train_loss: 0.2124, test_loss: 1.2922, test_f1: 0.6766
##################ITERATION #9 ****************************************
 epoch: 0, train_loss: 1.3090, test_loss: 1.0977, test_f1: 0.4616
 epoch: 1, train_loss: 0.9770, test_loss: 0.9379, test_f1: 0.5372
 epoch: 2, train_loss: 0.9393, test_loss: 0.8936, test_f1: 0.5373
 epoch: 3, train_loss: 0.9149, test_loss: 0.8602, test_f1: 0.5536
 epoch: 4, train_loss: 0.8806, test_loss: 0.8720, test_f1: 0.5964
 epoch: 5, train_loss: 0.8551, test_loss: 0.8075, test_f1: 0.5859
 epoch: 6, train_loss: 0.8355, test_loss: 0.8001, test_f1: 0.6189
 epoch: 7, train_loss: 0.8126, test_loss: 0.7975, test_f1: 0.6115
 epoch: 8, train_loss: 0.7902, test_loss: 0.7744, test_f1: 0.6253
 epoch: 9, train_loss: 0.7693, test_loss: 0.7916, test_f1: 0.6130
 epoch: 10, train_loss: 0.7658, test_loss: 0.7509, test_f1: 0.6280
 epoch: 11, train_loss: 0.7395, test_loss: 0.7626, test_f1: 0.6195
 epoch: 12, train_loss: 0.7144, test_loss: 0.7375, test_f1: 0.6257
 epoch: 13, train_loss: 0.6992, test_loss: 0.7837, test_f1: 0.6347
 epoch: 14, train_loss: 0.6959, test_loss: 0.7464, test_f1: 0.6402
 epoch: 15, train_loss: 0.6958, test_loss: 0.7608, test_f1: 0.6451
 epoch: 16, train_loss: 0.6593, test_loss: 0.7684, test_f1: 0.6544
 epoch: 17, train_loss: 0.6727, test_loss: 0.7172, test_f1: 0.6771
 epoch: 18, train_loss: 0.6263, test_loss: 0.7594, test_f1: 0.6312
 epoch: 19, train_loss: 0.6375, test_loss: 0.7547, test_f1: 0.6241
 epoch: 20, train_loss: 0.6229, test_loss: 0.7737, test_f1: 0.6472
 epoch: 21, train_loss: 0.6109, test_loss: 0.7800, test_f1: 0.6510
 epoch: 22, train_loss: 0.6069, test_loss: 0.7638, test_f1: 0.6489
 epoch: 23, train_loss: 0.5919, test_loss: 0.7385, test_f1: 0.6606
 epoch: 24, train_loss: 0.5792, test_loss: 0.7634, test_f1: 0.6728
 epoch: 25, train_loss: 0.5785, test_loss: 0.7507, test_f1: 0.6421
 epoch: 26, train_loss: 0.5461, test_loss: 0.7328, test_f1: 0.7109
 epoch: 27, train_loss: 0.5481, test_loss: 0.7223, test_f1: 0.6757
 epoch: 28, train_loss: 0.5446, test_loss: 0.8197, test_f1: 0.6776
 epoch: 29, train_loss: 0.5238, test_loss: 0.8210, test_f1: 0.6674
 epoch: 30, train_loss: 0.4994, test_loss: 0.7797, test_f1: 0.6790
 epoch: 31, train_loss: 0.5076, test_loss: 0.8346, test_f1: 0.6704
 epoch: 32, train_loss: 0.5122, test_loss: 0.7648, test_f1: 0.6848
 epoch: 33, train_loss: 0.4807, test_loss: 0.8517, test_f1: 0.6757
 epoch: 34, train_loss: 0.4851, test_loss: 0.7411, test_f1: 0.7126
 epoch: 35, train_loss: 0.4942, test_loss: 0.7293, test_f1: 0.6914
 epoch: 36, train_loss: 0.4654, test_loss: 0.7649, test_f1: 0.7175
 epoch: 37, train_loss: 0.4394, test_loss: 0.8268, test_f1: 0.6674
 epoch: 38, train_loss: 0.4335, test_loss: 0.8379, test_f1: 0.7182
 epoch: 39, train_loss: 0.4567, test_loss: 0.7933, test_f1: 0.6847
 epoch: 40, train_loss: 0.4387, test_loss: 0.7805, test_f1: 0.6973
 epoch: 41, train_loss: 0.4191, test_loss: 0.8384, test_f1: 0.6769
 epoch: 42, train_loss: 0.4243, test_loss: 0.7041, test_f1: 0.7116
 epoch: 43, train_loss: 0.4267, test_loss: 0.7644, test_f1: 0.7001
 epoch: 44, train_loss: 0.4102, test_loss: 0.8475, test_f1: 0.6772
 epoch: 45, train_loss: 0.4053, test_loss: 0.8588, test_f1: 0.6887
 epoch: 46, train_loss: 0.3887, test_loss: 0.9276, test_f1: 0.6779
 epoch: 47, train_loss: 0.4072, test_loss: 0.9380, test_f1: 0.6806
 epoch: 48, train_loss: 0.3797, test_loss: 0.9217, test_f1: 0.6762
 epoch: 49, train_loss: 0.3743, test_loss: 0.9202, test_f1: 0.6915
 epoch: 50, train_loss: 0.3576, test_loss: 0.9141, test_f1: 0.6901
 epoch: 51, train_loss: 0.3352, test_loss: 0.9449, test_f1: 0.6935
 epoch: 52, train_loss: 0.3232, test_loss: 0.8997, test_f1: 0.6888
 epoch: 53, train_loss: 0.3160, test_loss: 1.0549, test_f1: 0.6808
 epoch: 54, train_loss: 0.3099, test_loss: 1.0232, test_f1: 0.6954
 epoch: 55, train_loss: 0.2922, test_loss: 1.0507, test_f1: 0.7008
 epoch: 56, train_loss: 0.2875, test_loss: 1.0191, test_f1: 0.6975
 epoch: 57, train_loss: 0.2666, test_loss: 1.0387, test_f1: 0.6972
 epoch: 58, train_loss: 0.2748, test_loss: 1.0185, test_f1: 0.6977
 epoch: 59, train_loss: 0.2593, test_loss: 1.0896, test_f1: 0.6888
 epoch: 60, train_loss: 0.2765, test_loss: 1.0728, test_f1: 0.6893
 epoch: 61, train_loss: 0.2653, test_loss: 1.1833, test_f1: 0.6669
 epoch: 62, train_loss: 0.2636, test_loss: 1.0009, test_f1: 0.7104
 epoch: 63, train_loss: 0.2550, test_loss: 1.1181, test_f1: 0.7058
 epoch: 64, train_loss: 0.2595, test_loss: 1.2548, test_f1: 0.6778
 epoch: 65, train_loss: 0.2482, test_loss: 1.2436, test_f1: 0.6811
 epoch: 66, train_loss: 0.2665, test_loss: 1.1444, test_f1: 0.6886
 epoch: 67, train_loss: 0.2373, test_loss: 1.1345, test_f1: 0.6977
 epoch: 68, train_loss: 0.2606, test_loss: 1.1390, test_f1: 0.6841
 epoch: 69, train_loss: 0.2416, test_loss: 1.1560, test_f1: 0.6772
 epoch: 70, train_loss: 0.2456, test_loss: 1.2033, test_f1: 0.6852
 epoch: 71, train_loss: 0.2248, test_loss: 1.1690, test_f1: 0.6957
 epoch: 72, train_loss: 0.2445, test_loss: 1.1112, test_f1: 0.6928
 epoch: 73, train_loss: 0.2328, test_loss: 1.0880, test_f1: 0.7139
 epoch: 74, train_loss: 0.2267, test_loss: 1.1683, test_f1: 0.6978
 epoch: 75, train_loss: 0.2247, test_loss: 1.2577, test_f1: 0.6856
 epoch: 76, train_loss: 0.2370, test_loss: 1.2940, test_f1: 0.6834
 epoch: 77, train_loss: 0.2279, test_loss: 1.3064, test_f1: 0.6884
 epoch: 78, train_loss: 0.2319, test_loss: 1.2077, test_f1: 0.6958
 epoch: 79, train_loss: 0.2097, test_loss: 1.3220, test_f1: 0.6819
 epoch: 80, train_loss: 0.2118, test_loss: 1.3432, test_f1: 0.6778
 epoch: 81, train_loss: 0.2158, test_loss: 1.2937, test_f1: 0.6831
 epoch: 82, train_loss: 0.2045, test_loss: 1.3006, test_f1: 0.6815
 epoch: 83, train_loss: 0.2194, test_loss: 1.1643, test_f1: 0.6810
 epoch: 84, train_loss: 0.1989, test_loss: 1.3043, test_f1: 0.6883
 epoch: 85, train_loss: 0.1897, test_loss: 1.2766, test_f1: 0.7029
 epoch: 86, train_loss: 0.2086, test_loss: 1.3317, test_f1: 0.6893
 epoch: 87, train_loss: 0.2108, test_loss: 1.3156, test_f1: 0.6989
 epoch: 88, train_loss: 0.1936, test_loss: 1.3631, test_f1: 0.6980
 epoch: 89, train_loss: 0.1990, test_loss: 1.3518, test_f1: 0.6759
 epoch: 90, train_loss: 0.2120, test_loss: 1.3053, test_f1: 0.6916
 epoch: 91, train_loss: 0.1847, test_loss: 1.3451, test_f1: 0.6738
 epoch: 92, train_loss: 0.1771, test_loss: 1.4877, test_f1: 0.6747
 epoch: 93, train_loss: 0.1821, test_loss: 1.4601, test_f1: 0.6838
 epoch: 94, train_loss: 0.1838, test_loss: 1.3730, test_f1: 0.6869
 epoch: 95, train_loss: 0.2046, test_loss: 1.2489, test_f1: 0.6954
 epoch: 96, train_loss: 0.1889, test_loss: 1.2717, test_f1: 0.6875
 epoch: 97, train_loss: 0.2026, test_loss: 1.2695, test_f1: 0.6892
 epoch: 98, train_loss: 0.1931, test_loss: 1.3521, test_f1: 0.6902
 epoch: 99, train_loss: 0.1764, test_loss: 1.4069, test_f1: 0.6867

Training completed in 602.05 seconds
Best F1: 0.7386 at epoch 44
Mean F1 across iterations: 0.7070  0.0138
========================FINAL RESULTS================================
FEGIN weighted F1: 0.7386  0.0138
python main.py --data ltspice_examples --representation component_pin_net --model FEGIN --layers 2 --hiddens 128 --batch_size 64 --lr 0.001 --emb_size 128 --epochs 100 --save_appendix component_pin_net_L2_H128_BS64_LR0.001_E128 --no_val
-----



STDERR:
  File "main.py", line 370, in <module>
    main()
  File "main.py", line 254, in main
    dataset = dataset_class(
  File "/home/philip/projects/ltspice_examples_code_repo/Circuit-Completion-Using-GNNs/component_classification_with_link_prediction_head/evaluation/FEGIN/kernel/circuit_datasets.py", line 15, in __init__
    self.data, self.slices = torch.load(self.processed_paths[0])
  File "/home/philip/.local/lib/python3.8/site-packages/torch/serialization.py", line 1040, in load
    warnings.warn(
  File "/usr/lib/python3.8/warnings.py", line 109, in _showwarnmsg
    sw(msg.message, msg.category, msg.filename, msg.lineno,
  File "main.py", line 47, in warn_with_traceback
    traceback.print_stack(file=log)
/home/philip/projects/ltspice_examples_code_repo/Circuit-Completion-Using-GNNs/component_classification_with_link_prediction_head/evaluation/FEGIN/kernel/circuit_datasets.py:15: FutureWarning: You are using `torch.load` with `weights_only=False` (the current default value), which uses the default pickle module implicitly. It is possible to construct malicious pickle data which will execute arbitrary code during unpickling (See https://github.com/pytorch/pytorch/blob/main/SECURITY.md#untrusted-models for more details). In a future release, the default value for `weights_only` will be flipped to `True`. This limits the functions that could be executed during unpickling. Arbitrary objects will no longer be allowed to be loaded via this mode unless they are explicitly allowlisted by the user via `torch.serialization.add_safe_globals`. We recommend you start setting `weights_only=True` for any use case where you don't have full control of the loaded file. Please open an issue on GitHub for any issues related to this experimental feature.
  self.data, self.slices = torch.load(self.processed_paths[0])
