STDOUT:
Results will be saved in /home/philip/projects/llm_inference_code_repo/Circuit-Completion-Using-GNNs/component_classification_with_link_prediction_head/evaluation/FEGIN/results/model_FEGIN_dataset_ltspice_examples
Command line input: python main.py --data ltspice_examples --representation component_net --model FEGIN --layers 5 --hiddens 128 --batch_size 64 --lr 0.001 --emb_size 250 --epochs 100 --save_appendix component_net_L5_H128_BS64_LR0.001_E250 --no_val
 is saved.
-----
ltspice_examples - FEGIN
Using 5 layers, 128 hidden units, h = 2
Loading component_net representation dataset
ENTERED
Training FEGIN on component_net representation
Train: 3558, Test: 846
##################ITERATION #0 ****************************************
 epoch: 0, train_loss: 1.1986, test_loss: 1.0720, test_f1: 0.4327
 epoch: 1, train_loss: 1.0032, test_loss: 1.0118, test_f1: 0.4535
 epoch: 2, train_loss: 0.9585, test_loss: 0.9790, test_f1: 0.4889
 epoch: 3, train_loss: 0.9224, test_loss: 0.9295, test_f1: 0.5738
 epoch: 4, train_loss: 0.9168, test_loss: 1.0126, test_f1: 0.5292
 epoch: 5, train_loss: 0.8899, test_loss: 0.9443, test_f1: 0.5261
 epoch: 6, train_loss: 0.8608, test_loss: 0.9636, test_f1: 0.5551
 epoch: 7, train_loss: 0.8406, test_loss: 0.9285, test_f1: 0.6067
 epoch: 8, train_loss: 0.8364, test_loss: 0.9086, test_f1: 0.6043
 epoch: 9, train_loss: 0.8293, test_loss: 0.9323, test_f1: 0.5827
 epoch: 10, train_loss: 0.8027, test_loss: 0.9293, test_f1: 0.5961
 epoch: 11, train_loss: 0.7979, test_loss: 0.9692, test_f1: 0.5237
 epoch: 12, train_loss: 0.7908, test_loss: 0.9412, test_f1: 0.5547
 epoch: 13, train_loss: 0.7869, test_loss: 0.9295, test_f1: 0.6208
 epoch: 14, train_loss: 0.7537, test_loss: 0.9630, test_f1: 0.5869
 epoch: 15, train_loss: 0.7468, test_loss: 0.9915, test_f1: 0.6237
 epoch: 16, train_loss: 0.7346, test_loss: 0.9846, test_f1: 0.6177
 epoch: 17, train_loss: 0.7361, test_loss: 0.9375, test_f1: 0.5932
 epoch: 18, train_loss: 0.7158, test_loss: 0.9891, test_f1: 0.5819
 epoch: 19, train_loss: 0.7237, test_loss: 0.9269, test_f1: 0.6086
 epoch: 20, train_loss: 0.6870, test_loss: 1.0428, test_f1: 0.6197
 epoch: 21, train_loss: 0.7039, test_loss: 0.9645, test_f1: 0.6219
 epoch: 22, train_loss: 0.6780, test_loss: 0.9781, test_f1: 0.5898
 epoch: 23, train_loss: 0.6859, test_loss: 1.0006, test_f1: 0.6125
 epoch: 24, train_loss: 0.6801, test_loss: 0.9231, test_f1: 0.6313
 epoch: 25, train_loss: 0.6689, test_loss: 0.9013, test_f1: 0.6500
 epoch: 26, train_loss: 0.6451, test_loss: 0.9697, test_f1: 0.6430
 epoch: 27, train_loss: 0.6357, test_loss: 0.9903, test_f1: 0.6050
 epoch: 28, train_loss: 0.6336, test_loss: 1.0206, test_f1: 0.6127
 epoch: 29, train_loss: 0.6119, test_loss: 1.0337, test_f1: 0.6144
 epoch: 30, train_loss: 0.6104, test_loss: 1.0244, test_f1: 0.6131
 epoch: 31, train_loss: 0.6052, test_loss: 0.9858, test_f1: 0.6316
 epoch: 32, train_loss: 0.5894, test_loss: 0.9802, test_f1: 0.6412
 epoch: 33, train_loss: 0.5871, test_loss: 1.0623, test_f1: 0.6461
 epoch: 34, train_loss: 0.5707, test_loss: 1.0764, test_f1: 0.6603
 epoch: 35, train_loss: 0.5517, test_loss: 1.0831, test_f1: 0.6368
 epoch: 36, train_loss: 0.5478, test_loss: 1.1291, test_f1: 0.6446
 epoch: 37, train_loss: 0.5512, test_loss: 1.1596, test_f1: 0.6440
 epoch: 38, train_loss: 0.5562, test_loss: 1.0088, test_f1: 0.6382
 epoch: 39, train_loss: 0.5449, test_loss: 1.1062, test_f1: 0.6373
 epoch: 40, train_loss: 0.4992, test_loss: 1.1491, test_f1: 0.6599
 epoch: 41, train_loss: 0.5350, test_loss: 1.1971, test_f1: 0.6560
 epoch: 42, train_loss: 0.4955, test_loss: 1.0855, test_f1: 0.6661
 epoch: 43, train_loss: 0.4719, test_loss: 1.1558, test_f1: 0.6617
 epoch: 44, train_loss: 0.4758, test_loss: 1.2594, test_f1: 0.6447
 epoch: 45, train_loss: 0.4749, test_loss: 1.2311, test_f1: 0.6336
 epoch: 46, train_loss: 0.4768, test_loss: 1.2164, test_f1: 0.6572
 epoch: 47, train_loss: 0.4554, test_loss: 1.2411, test_f1: 0.6734
 epoch: 48, train_loss: 0.4542, test_loss: 1.2878, test_f1: 0.6583
 epoch: 49, train_loss: 0.4425, test_loss: 1.3460, test_f1: 0.6016
 epoch: 50, train_loss: 0.4582, test_loss: 1.2964, test_f1: 0.6486
 epoch: 51, train_loss: 0.3975, test_loss: 1.2699, test_f1: 0.6281
 epoch: 52, train_loss: 0.3586, test_loss: 1.3332, test_f1: 0.6626
 epoch: 53, train_loss: 0.3342, test_loss: 1.3873, test_f1: 0.6624
 epoch: 54, train_loss: 0.3332, test_loss: 1.4668, test_f1: 0.6363
 epoch: 55, train_loss: 0.3327, test_loss: 1.5309, test_f1: 0.6774
 epoch: 56, train_loss: 0.3271, test_loss: 1.5454, test_f1: 0.6196
 epoch: 57, train_loss: 0.3226, test_loss: 1.5338, test_f1: 0.6449
 epoch: 58, train_loss: 0.3083, test_loss: 1.5246, test_f1: 0.6429
 epoch: 59, train_loss: 0.3202, test_loss: 1.6304, test_f1: 0.6193
 epoch: 60, train_loss: 0.3010, test_loss: 1.6020, test_f1: 0.6339
 epoch: 61, train_loss: 0.2987, test_loss: 1.6612, test_f1: 0.6368
 epoch: 62, train_loss: 0.2992, test_loss: 1.7458, test_f1: 0.6313
 epoch: 63, train_loss: 0.2851, test_loss: 1.6964, test_f1: 0.6347
 epoch: 64, train_loss: 0.2717, test_loss: 1.7865, test_f1: 0.6287
 epoch: 65, train_loss: 0.2893, test_loss: 1.7552, test_f1: 0.6486
 epoch: 66, train_loss: 0.2665, test_loss: 1.7362, test_f1: 0.6367
 epoch: 67, train_loss: 0.2704, test_loss: 1.9065, test_f1: 0.6429
 epoch: 68, train_loss: 0.2648, test_loss: 1.8922, test_f1: 0.6373
 epoch: 69, train_loss: 0.2445, test_loss: 1.9531, test_f1: 0.6202
 epoch: 70, train_loss: 0.2814, test_loss: 1.8940, test_f1: 0.6508
 epoch: 71, train_loss: 0.2898, test_loss: 1.7418, test_f1: 0.6246
 epoch: 72, train_loss: 0.2689, test_loss: 1.9480, test_f1: 0.6115
 epoch: 73, train_loss: 0.2487, test_loss: 1.8231, test_f1: 0.6419
 epoch: 74, train_loss: 0.2534, test_loss: 1.9717, test_f1: 0.6387
 epoch: 75, train_loss: 0.2687, test_loss: 1.8144, test_f1: 0.6204
 epoch: 76, train_loss: 0.2476, test_loss: 1.9365, test_f1: 0.6386
 epoch: 77, train_loss: 0.2478, test_loss: 1.9185, test_f1: 0.6282
 epoch: 78, train_loss: 0.2160, test_loss: 2.0826, test_f1: 0.6357
 epoch: 79, train_loss: 0.2235, test_loss: 2.0904, test_f1: 0.6407
 epoch: 80, train_loss: 0.2407, test_loss: 2.0746, test_f1: 0.6507
 epoch: 81, train_loss: 0.2259, test_loss: 2.0697, test_f1: 0.6518
 epoch: 82, train_loss: 0.2221, test_loss: 2.0557, test_f1: 0.6374
 epoch: 83, train_loss: 0.2237, test_loss: 2.0752, test_f1: 0.6318
 epoch: 84, train_loss: 0.2132, test_loss: 2.0139, test_f1: 0.6529
 epoch: 85, train_loss: 0.2229, test_loss: 2.2586, test_f1: 0.6229
 epoch: 86, train_loss: 0.2159, test_loss: 2.1912, test_f1: 0.6308
 epoch: 87, train_loss: 0.2325, test_loss: 2.0777, test_f1: 0.6402
 epoch: 88, train_loss: 0.2314, test_loss: 2.1508, test_f1: 0.6213
 epoch: 89, train_loss: 0.2095, test_loss: 2.1377, test_f1: 0.6542
 epoch: 90, train_loss: 0.2103, test_loss: 2.1514, test_f1: 0.6420
 epoch: 91, train_loss: 0.2302, test_loss: 2.3384, test_f1: 0.6381
 epoch: 92, train_loss: 0.1979, test_loss: 2.3571, test_f1: 0.6334
 epoch: 93, train_loss: 0.1950, test_loss: 2.2559, test_f1: 0.6517
 epoch: 94, train_loss: 0.2064, test_loss: 2.1638, test_f1: 0.6499
 epoch: 95, train_loss: 0.1791, test_loss: 2.2997, test_f1: 0.6656
 epoch: 96, train_loss: 0.1949, test_loss: 2.2318, test_f1: 0.6341
 epoch: 97, train_loss: 0.1845, test_loss: 2.2960, test_f1: 0.6309
 epoch: 98, train_loss: 0.2034, test_loss: 2.2450, test_f1: 0.6373
 epoch: 99, train_loss: 0.1977, test_loss: 2.3205, test_f1: 0.6510
##################ITERATION #1 ****************************************
 epoch: 0, train_loss: 1.1348, test_loss: 0.9845, test_f1: 0.4643
 epoch: 1, train_loss: 0.9793, test_loss: 0.9616, test_f1: 0.5100
 epoch: 2, train_loss: 0.9329, test_loss: 0.9319, test_f1: 0.5206
 epoch: 3, train_loss: 0.9078, test_loss: 0.9406, test_f1: 0.5328
 epoch: 4, train_loss: 0.8754, test_loss: 0.8954, test_f1: 0.5095
 epoch: 5, train_loss: 0.8762, test_loss: 0.9374, test_f1: 0.5293
 epoch: 6, train_loss: 0.8741, test_loss: 0.9494, test_f1: 0.5230
 epoch: 7, train_loss: 0.8401, test_loss: 0.9100, test_f1: 0.5558
 epoch: 8, train_loss: 0.8180, test_loss: 0.9276, test_f1: 0.5876
 epoch: 9, train_loss: 0.8136, test_loss: 0.9423, test_f1: 0.5662
 epoch: 10, train_loss: 0.8057, test_loss: 0.9825, test_f1: 0.5791
 epoch: 11, train_loss: 0.7818, test_loss: 0.9156, test_f1: 0.5689
 epoch: 12, train_loss: 0.7726, test_loss: 0.9414, test_f1: 0.6087
 epoch: 13, train_loss: 0.7695, test_loss: 0.9792, test_f1: 0.6045
 epoch: 14, train_loss: 0.7576, test_loss: 0.8882, test_f1: 0.6217
 epoch: 15, train_loss: 0.7477, test_loss: 0.9381, test_f1: 0.6235
 epoch: 16, train_loss: 0.7235, test_loss: 0.9692, test_f1: 0.6023
 epoch: 17, train_loss: 0.6968, test_loss: 0.9140, test_f1: 0.6337
 epoch: 18, train_loss: 0.7103, test_loss: 1.0591, test_f1: 0.5710
 epoch: 19, train_loss: 0.7184, test_loss: 0.9689, test_f1: 0.6092
 epoch: 20, train_loss: 0.6846, test_loss: 1.0218, test_f1: 0.6198
 epoch: 21, train_loss: 0.6891, test_loss: 0.9281, test_f1: 0.6072
 epoch: 22, train_loss: 0.6630, test_loss: 1.0163, test_f1: 0.6081
 epoch: 23, train_loss: 0.6560, test_loss: 1.0659, test_f1: 0.5727
 epoch: 24, train_loss: 0.6718, test_loss: 0.9978, test_f1: 0.6012
 epoch: 25, train_loss: 0.6384, test_loss: 1.0343, test_f1: 0.6307
 epoch: 26, train_loss: 0.6276, test_loss: 1.0924, test_f1: 0.6610
 epoch: 27, train_loss: 0.6289, test_loss: 1.0229, test_f1: 0.6263
 epoch: 28, train_loss: 0.6052, test_loss: 1.0402, test_f1: 0.6406
 epoch: 29, train_loss: 0.5862, test_loss: 1.0206, test_f1: 0.6481
 epoch: 30, train_loss: 0.5895, test_loss: 1.0570, test_f1: 0.6660
 epoch: 31, train_loss: 0.5696, test_loss: 1.0741, test_f1: 0.6226
 epoch: 32, train_loss: 0.5759, test_loss: 1.1033, test_f1: 0.6520
 epoch: 33, train_loss: 0.5696, test_loss: 1.0387, test_f1: 0.6586
 epoch: 34, train_loss: 0.5516, test_loss: 1.0985, test_f1: 0.6752
 epoch: 35, train_loss: 0.5364, test_loss: 1.1053, test_f1: 0.6294
 epoch: 36, train_loss: 0.5409, test_loss: 1.1267, test_f1: 0.6598
 epoch: 37, train_loss: 0.5291, test_loss: 1.1238, test_f1: 0.6756
 epoch: 38, train_loss: 0.5367, test_loss: 1.1291, test_f1: 0.6709
 epoch: 39, train_loss: 0.4986, test_loss: 1.1200, test_f1: 0.6736
 epoch: 40, train_loss: 0.5112, test_loss: 1.1797, test_f1: 0.6476
 epoch: 41, train_loss: 0.5080, test_loss: 1.2057, test_f1: 0.6447
 epoch: 42, train_loss: 0.4861, test_loss: 1.1835, test_f1: 0.6386
 epoch: 43, train_loss: 0.4937, test_loss: 1.2303, test_f1: 0.6478
 epoch: 44, train_loss: 0.4610, test_loss: 1.2316, test_f1: 0.6088
 epoch: 45, train_loss: 0.4495, test_loss: 1.2595, test_f1: 0.6493
 epoch: 46, train_loss: 0.4602, test_loss: 1.3006, test_f1: 0.6278
 epoch: 47, train_loss: 0.4576, test_loss: 1.2744, test_f1: 0.6141
 epoch: 48, train_loss: 0.4182, test_loss: 1.2482, test_f1: 0.6507
 epoch: 49, train_loss: 0.4198, test_loss: 1.3552, test_f1: 0.6590
 epoch: 50, train_loss: 0.4300, test_loss: 1.3780, test_f1: 0.6559
 epoch: 51, train_loss: 0.3783, test_loss: 1.3024, test_f1: 0.6704
 epoch: 52, train_loss: 0.3464, test_loss: 1.3839, test_f1: 0.6493
 epoch: 53, train_loss: 0.3433, test_loss: 1.4116, test_f1: 0.6577
 epoch: 54, train_loss: 0.3262, test_loss: 1.4420, test_f1: 0.6577
 epoch: 55, train_loss: 0.3327, test_loss: 1.4621, test_f1: 0.6514
 epoch: 56, train_loss: 0.3145, test_loss: 1.5536, test_f1: 0.6663
 epoch: 57, train_loss: 0.3233, test_loss: 1.5012, test_f1: 0.6716
 epoch: 58, train_loss: 0.3083, test_loss: 1.5435, test_f1: 0.6562
 epoch: 59, train_loss: 0.3001, test_loss: 1.5880, test_f1: 0.6593
 epoch: 60, train_loss: 0.3057, test_loss: 1.5585, test_f1: 0.6734
 epoch: 61, train_loss: 0.3062, test_loss: 1.5327, test_f1: 0.6721
 epoch: 62, train_loss: 0.3006, test_loss: 1.6610, test_f1: 0.6484
 epoch: 63, train_loss: 0.2844, test_loss: 1.7670, test_f1: 0.6633
 epoch: 64, train_loss: 0.3040, test_loss: 1.7602, test_f1: 0.6644
 epoch: 65, train_loss: 0.2836, test_loss: 1.7572, test_f1: 0.6364
 epoch: 66, train_loss: 0.2748, test_loss: 1.7421, test_f1: 0.6596
 epoch: 67, train_loss: 0.2863, test_loss: 1.6100, test_f1: 0.6786
 epoch: 68, train_loss: 0.2719, test_loss: 1.6647, test_f1: 0.6527
 epoch: 69, train_loss: 0.2482, test_loss: 1.7629, test_f1: 0.6637
 epoch: 70, train_loss: 0.2386, test_loss: 1.7685, test_f1: 0.6734
 epoch: 71, train_loss: 0.2720, test_loss: 1.7067, test_f1: 0.6671
 epoch: 72, train_loss: 0.2560, test_loss: 1.7684, test_f1: 0.6618
 epoch: 73, train_loss: 0.2726, test_loss: 1.7768, test_f1: 0.6435
 epoch: 74, train_loss: 0.2620, test_loss: 1.7416, test_f1: 0.6760
 epoch: 75, train_loss: 0.2418, test_loss: 1.8078, test_f1: 0.6550
 epoch: 76, train_loss: 0.2493, test_loss: 1.8539, test_f1: 0.6509
 epoch: 77, train_loss: 0.2349, test_loss: 1.7726, test_f1: 0.6626
 epoch: 78, train_loss: 0.2360, test_loss: 1.8276, test_f1: 0.6478
 epoch: 79, train_loss: 0.2301, test_loss: 1.8862, test_f1: 0.6367
 epoch: 80, train_loss: 0.2141, test_loss: 1.9002, test_f1: 0.6578
 epoch: 81, train_loss: 0.2326, test_loss: 1.9076, test_f1: 0.6579
 epoch: 82, train_loss: 0.2364, test_loss: 1.8928, test_f1: 0.6482
 epoch: 83, train_loss: 0.2127, test_loss: 1.9218, test_f1: 0.6729
 epoch: 84, train_loss: 0.2249, test_loss: 2.0367, test_f1: 0.6677
 epoch: 85, train_loss: 0.2235, test_loss: 2.1019, test_f1: 0.6475
 epoch: 86, train_loss: 0.2081, test_loss: 2.0543, test_f1: 0.6787
 epoch: 87, train_loss: 0.1982, test_loss: 2.0392, test_f1: 0.6607
 epoch: 88, train_loss: 0.2202, test_loss: 2.1392, test_f1: 0.6676
 epoch: 89, train_loss: 0.2170, test_loss: 2.0585, test_f1: 0.6471
 epoch: 90, train_loss: 0.2093, test_loss: 2.0214, test_f1: 0.6533
 epoch: 91, train_loss: 0.1927, test_loss: 2.1535, test_f1: 0.6503
 epoch: 92, train_loss: 0.1904, test_loss: 2.3076, test_f1: 0.6368
 epoch: 93, train_loss: 0.2089, test_loss: 2.2813, test_f1: 0.6236
 epoch: 94, train_loss: 0.1858, test_loss: 2.2844, test_f1: 0.6439
 epoch: 95, train_loss: 0.1781, test_loss: 2.2622, test_f1: 0.6456
 epoch: 96, train_loss: 0.1863, test_loss: 2.4263, test_f1: 0.6477
 epoch: 97, train_loss: 0.1924, test_loss: 2.1218, test_f1: 0.6390
 epoch: 98, train_loss: 0.1873, test_loss: 2.2607, test_f1: 0.6416
 epoch: 99, train_loss: 0.1693, test_loss: 2.3872, test_f1: 0.6566
##################ITERATION #2 ****************************************
 epoch: 0, train_loss: 1.2038, test_loss: 1.0025, test_f1: 0.5079
 epoch: 1, train_loss: 1.0100, test_loss: 0.9492, test_f1: 0.5056
 epoch: 2, train_loss: 0.9384, test_loss: 0.9483, test_f1: 0.5561
 epoch: 3, train_loss: 0.9186, test_loss: 0.9727, test_f1: 0.4879
 epoch: 4, train_loss: 0.8979, test_loss: 0.9512, test_f1: 0.5494
 epoch: 5, train_loss: 0.8857, test_loss: 0.9471, test_f1: 0.5299
 epoch: 6, train_loss: 0.8646, test_loss: 0.9119, test_f1: 0.5688
 epoch: 7, train_loss: 0.8571, test_loss: 0.9226, test_f1: 0.5309
 epoch: 8, train_loss: 0.8331, test_loss: 0.9558, test_f1: 0.5846
 epoch: 9, train_loss: 0.8170, test_loss: 0.9477, test_f1: 0.5839
 epoch: 10, train_loss: 0.7993, test_loss: 0.9327, test_f1: 0.5709
 epoch: 11, train_loss: 0.7937, test_loss: 0.9426, test_f1: 0.5929
 epoch: 12, train_loss: 0.7847, test_loss: 0.9713, test_f1: 0.5994
 epoch: 13, train_loss: 0.7725, test_loss: 0.9883, test_f1: 0.6146
 epoch: 14, train_loss: 0.7554, test_loss: 0.9795, test_f1: 0.5917
 epoch: 15, train_loss: 0.7506, test_loss: 1.0065, test_f1: 0.6034
 epoch: 16, train_loss: 0.7515, test_loss: 0.9891, test_f1: 0.6075
 epoch: 17, train_loss: 0.7321, test_loss: 0.9938, test_f1: 0.6160
 epoch: 18, train_loss: 0.7317, test_loss: 1.0144, test_f1: 0.6239
 epoch: 19, train_loss: 0.7192, test_loss: 0.9443, test_f1: 0.6058
 epoch: 20, train_loss: 0.7179, test_loss: 0.9095, test_f1: 0.6522
 epoch: 21, train_loss: 0.6863, test_loss: 0.9958, test_f1: 0.6507
 epoch: 22, train_loss: 0.6881, test_loss: 0.9837, test_f1: 0.6270
 epoch: 23, train_loss: 0.6842, test_loss: 0.9691, test_f1: 0.6021
 epoch: 24, train_loss: 0.6550, test_loss: 0.9988, test_f1: 0.6236
 epoch: 25, train_loss: 0.6671, test_loss: 0.9223, test_f1: 0.6286
 epoch: 26, train_loss: 0.6317, test_loss: 1.0169, test_f1: 0.6353
 epoch: 27, train_loss: 0.6209, test_loss: 1.1192, test_f1: 0.6111
 epoch: 28, train_loss: 0.6450, test_loss: 1.0492, test_f1: 0.5943
 epoch: 29, train_loss: 0.6173, test_loss: 1.0673, test_f1: 0.5839
 epoch: 30, train_loss: 0.6047, test_loss: 1.0746, test_f1: 0.6441
 epoch: 31, train_loss: 0.6038, test_loss: 1.0759, test_f1: 0.6149
 epoch: 32, train_loss: 0.5967, test_loss: 1.2139, test_f1: 0.6091
 epoch: 33, train_loss: 0.5959, test_loss: 1.2133, test_f1: 0.6018
 epoch: 34, train_loss: 0.5856, test_loss: 1.0548, test_f1: 0.6590
 epoch: 35, train_loss: 0.5727, test_loss: 1.0884, test_f1: 0.6673
 epoch: 36, train_loss: 0.5580, test_loss: 1.0944, test_f1: 0.6457
 epoch: 37, train_loss: 0.5548, test_loss: 1.0602, test_f1: 0.6142
 epoch: 38, train_loss: 0.5288, test_loss: 1.0892, test_f1: 0.6584
 epoch: 39, train_loss: 0.5094, test_loss: 1.1411, test_f1: 0.6502
 epoch: 40, train_loss: 0.5462, test_loss: 1.1058, test_f1: 0.6536
 epoch: 41, train_loss: 0.5157, test_loss: 1.0781, test_f1: 0.6761
 epoch: 42, train_loss: 0.5053, test_loss: 1.1742, test_f1: 0.6567
 epoch: 43, train_loss: 0.5140, test_loss: 1.3313, test_f1: 0.6461
 epoch: 44, train_loss: 0.5051, test_loss: 1.2263, test_f1: 0.6554
 epoch: 45, train_loss: 0.4872, test_loss: 1.1421, test_f1: 0.6708
 epoch: 46, train_loss: 0.5307, test_loss: 1.1334, test_f1: 0.6418
 epoch: 47, train_loss: 0.4912, test_loss: 1.1592, test_f1: 0.6438
 epoch: 48, train_loss: 0.4658, test_loss: 1.2546, test_f1: 0.6453
 epoch: 49, train_loss: 0.4532, test_loss: 1.1561, test_f1: 0.6451
 epoch: 50, train_loss: 0.4425, test_loss: 1.2071, test_f1: 0.6865
 epoch: 51, train_loss: 0.4125, test_loss: 1.2322, test_f1: 0.6613
 epoch: 52, train_loss: 0.4031, test_loss: 1.2399, test_f1: 0.6507
 epoch: 53, train_loss: 0.3480, test_loss: 1.2420, test_f1: 0.6783
 epoch: 54, train_loss: 0.3594, test_loss: 1.2341, test_f1: 0.6763
 epoch: 55, train_loss: 0.3513, test_loss: 1.2758, test_f1: 0.6842
 epoch: 56, train_loss: 0.3415, test_loss: 1.2950, test_f1: 0.6496
 epoch: 57, train_loss: 0.3316, test_loss: 1.4405, test_f1: 0.6684
 epoch: 58, train_loss: 0.3308, test_loss: 1.4266, test_f1: 0.6617
 epoch: 59, train_loss: 0.3144, test_loss: 1.4562, test_f1: 0.6711
 epoch: 60, train_loss: 0.3058, test_loss: 1.4956, test_f1: 0.6694
 epoch: 61, train_loss: 0.3184, test_loss: 1.5281, test_f1: 0.6627
 epoch: 62, train_loss: 0.3382, test_loss: 1.5436, test_f1: 0.6605
 epoch: 63, train_loss: 0.3036, test_loss: 1.5976, test_f1: 0.6574
 epoch: 64, train_loss: 0.3120, test_loss: 1.5225, test_f1: 0.6816
 epoch: 65, train_loss: 0.2922, test_loss: 1.6473, test_f1: 0.6642
 epoch: 66, train_loss: 0.2855, test_loss: 1.5898, test_f1: 0.6552
 epoch: 67, train_loss: 0.2842, test_loss: 1.5797, test_f1: 0.6766
 epoch: 68, train_loss: 0.2818, test_loss: 1.6964, test_f1: 0.6449
 epoch: 69, train_loss: 0.2765, test_loss: 1.6103, test_f1: 0.6787
 epoch: 70, train_loss: 0.2738, test_loss: 1.7095, test_f1: 0.6547
 epoch: 71, train_loss: 0.2683, test_loss: 1.7021, test_f1: 0.6712
 epoch: 72, train_loss: 0.2667, test_loss: 1.6451, test_f1: 0.6605
 epoch: 73, train_loss: 0.2506, test_loss: 1.7225, test_f1: 0.6500
 epoch: 74, train_loss: 0.2323, test_loss: 1.8620, test_f1: 0.6527
 epoch: 75, train_loss: 0.2507, test_loss: 1.7134, test_f1: 0.6526
 epoch: 76, train_loss: 0.2508, test_loss: 1.7989, test_f1: 0.6603
 epoch: 77, train_loss: 0.2392, test_loss: 1.8645, test_f1: 0.6490
 epoch: 78, train_loss: 0.2478, test_loss: 1.8863, test_f1: 0.6498
 epoch: 79, train_loss: 0.2430, test_loss: 1.9122, test_f1: 0.6734
 epoch: 80, train_loss: 0.2606, test_loss: 1.8866, test_f1: 0.6468
 epoch: 81, train_loss: 0.2506, test_loss: 1.7770, test_f1: 0.6555
 epoch: 82, train_loss: 0.2377, test_loss: 1.8784, test_f1: 0.6355
 epoch: 83, train_loss: 0.2336, test_loss: 1.9624, test_f1: 0.6358
 epoch: 84, train_loss: 0.2304, test_loss: 1.9537, test_f1: 0.6555
 epoch: 85, train_loss: 0.2076, test_loss: 2.2232, test_f1: 0.6305
 epoch: 86, train_loss: 0.2443, test_loss: 2.0655, test_f1: 0.6444
 epoch: 87, train_loss: 0.2441, test_loss: 1.9074, test_f1: 0.6694
 epoch: 88, train_loss: 0.2319, test_loss: 1.9524, test_f1: 0.6339
 epoch: 89, train_loss: 0.2236, test_loss: 2.1322, test_f1: 0.6407
 epoch: 90, train_loss: 0.2251, test_loss: 2.1216, test_f1: 0.6481
 epoch: 91, train_loss: 0.2141, test_loss: 2.0570, test_f1: 0.6417
 epoch: 92, train_loss: 0.1957, test_loss: 2.2214, test_f1: 0.6452
 epoch: 93, train_loss: 0.1980, test_loss: 2.1991, test_f1: 0.6438
 epoch: 94, train_loss: 0.2001, test_loss: 2.1829, test_f1: 0.6414
 epoch: 95, train_loss: 0.1880, test_loss: 2.3044, test_f1: 0.6385
 epoch: 96, train_loss: 0.2037, test_loss: 2.3189, test_f1: 0.6354
 epoch: 97, train_loss: 0.2161, test_loss: 2.0883, test_f1: 0.6497
 epoch: 98, train_loss: 0.1950, test_loss: 2.0144, test_f1: 0.6548
 epoch: 99, train_loss: 0.1869, test_loss: 2.2210, test_f1: 0.6610
##################ITERATION #3 ****************************************
 epoch: 0, train_loss: 1.2339, test_loss: 0.9884, test_f1: 0.4810
 epoch: 1, train_loss: 0.9866, test_loss: 0.9271, test_f1: 0.5059
 epoch: 2, train_loss: 0.9268, test_loss: 0.9064, test_f1: 0.4990
 epoch: 3, train_loss: 0.9363, test_loss: 0.9248, test_f1: 0.5234
 epoch: 4, train_loss: 0.8981, test_loss: 0.9542, test_f1: 0.5402
 epoch: 5, train_loss: 0.8709, test_loss: 0.9581, test_f1: 0.5253
 epoch: 6, train_loss: 0.8629, test_loss: 0.9453, test_f1: 0.5736
 epoch: 7, train_loss: 0.8552, test_loss: 0.9307, test_f1: 0.5745
 epoch: 8, train_loss: 0.8436, test_loss: 0.9336, test_f1: 0.5612
 epoch: 9, train_loss: 0.8035, test_loss: 0.9815, test_f1: 0.5286
 epoch: 10, train_loss: 0.8012, test_loss: 0.9622, test_f1: 0.5749
 epoch: 11, train_loss: 0.7994, test_loss: 0.9295, test_f1: 0.5570
 epoch: 12, train_loss: 0.7847, test_loss: 0.9353, test_f1: 0.5452
 epoch: 13, train_loss: 0.7718, test_loss: 0.9322, test_f1: 0.5804
 epoch: 14, train_loss: 0.7688, test_loss: 0.9124, test_f1: 0.5750
 epoch: 15, train_loss: 0.7536, test_loss: 0.8974, test_f1: 0.5875
 epoch: 16, train_loss: 0.7466, test_loss: 0.9536, test_f1: 0.5978
 epoch: 17, train_loss: 0.7569, test_loss: 0.9169, test_f1: 0.6117
 epoch: 18, train_loss: 0.7377, test_loss: 0.9392, test_f1: 0.6105
 epoch: 19, train_loss: 0.7274, test_loss: 0.9435, test_f1: 0.6029
 epoch: 20, train_loss: 0.7188, test_loss: 0.9167, test_f1: 0.6137
 epoch: 21, train_loss: 0.6959, test_loss: 0.8891, test_f1: 0.6031
 epoch: 22, train_loss: 0.7073, test_loss: 0.9599, test_f1: 0.6196
 epoch: 23, train_loss: 0.6898, test_loss: 0.9628, test_f1: 0.6094
 epoch: 24, train_loss: 0.6783, test_loss: 0.9370, test_f1: 0.6457
 epoch: 25, train_loss: 0.6798, test_loss: 0.9269, test_f1: 0.6346
 epoch: 26, train_loss: 0.6616, test_loss: 0.9742, test_f1: 0.6026
 epoch: 27, train_loss: 0.6463, test_loss: 0.8881, test_f1: 0.6363
 epoch: 28, train_loss: 0.6431, test_loss: 0.9508, test_f1: 0.5927
 epoch: 29, train_loss: 0.6442, test_loss: 0.9600, test_f1: 0.6053
 epoch: 30, train_loss: 0.6230, test_loss: 0.9775, test_f1: 0.6328
 epoch: 31, train_loss: 0.6485, test_loss: 0.9378, test_f1: 0.6100
 epoch: 32, train_loss: 0.6352, test_loss: 0.9217, test_f1: 0.6349
 epoch: 33, train_loss: 0.6113, test_loss: 0.9516, test_f1: 0.6530
 epoch: 34, train_loss: 0.5773, test_loss: 0.9797, test_f1: 0.6499
 epoch: 35, train_loss: 0.5871, test_loss: 1.0670, test_f1: 0.6152
 epoch: 36, train_loss: 0.5816, test_loss: 1.0077, test_f1: 0.6468
 epoch: 37, train_loss: 0.5990, test_loss: 1.0310, test_f1: 0.6411
 epoch: 38, train_loss: 0.5741, test_loss: 1.0122, test_f1: 0.6375
 epoch: 39, train_loss: 0.5798, test_loss: 1.0066, test_f1: 0.6282
 epoch: 40, train_loss: 0.5540, test_loss: 0.9167, test_f1: 0.6275
 epoch: 41, train_loss: 0.5437, test_loss: 1.1218, test_f1: 0.6172
 epoch: 42, train_loss: 0.5248, test_loss: 1.1085, test_f1: 0.6384
 epoch: 43, train_loss: 0.5326, test_loss: 1.1573, test_f1: 0.6063
 epoch: 44, train_loss: 0.5389, test_loss: 1.0467, test_f1: 0.6440
 epoch: 45, train_loss: 0.5398, test_loss: 0.9949, test_f1: 0.6421
 epoch: 46, train_loss: 0.5019, test_loss: 1.0813, test_f1: 0.6669
 epoch: 47, train_loss: 0.5165, test_loss: 1.0630, test_f1: 0.6494
 epoch: 48, train_loss: 0.5003, test_loss: 1.0224, test_f1: 0.6634
 epoch: 49, train_loss: 0.4862, test_loss: 1.2588, test_f1: 0.6126
 epoch: 50, train_loss: 0.4898, test_loss: 1.0585, test_f1: 0.6265
 epoch: 51, train_loss: 0.4159, test_loss: 1.1663, test_f1: 0.6590
 epoch: 52, train_loss: 0.3970, test_loss: 1.0976, test_f1: 0.6889
 epoch: 53, train_loss: 0.3910, test_loss: 1.1706, test_f1: 0.6546
 epoch: 54, train_loss: 0.3768, test_loss: 1.1745, test_f1: 0.6390
 epoch: 55, train_loss: 0.3699, test_loss: 1.1479, test_f1: 0.6791
 epoch: 56, train_loss: 0.3622, test_loss: 1.1687, test_f1: 0.6738
 epoch: 57, train_loss: 0.3526, test_loss: 1.2340, test_f1: 0.6845
 epoch: 58, train_loss: 0.3678, test_loss: 1.3941, test_f1: 0.6557
 epoch: 59, train_loss: 0.3475, test_loss: 1.2198, test_f1: 0.6511
 epoch: 60, train_loss: 0.3546, test_loss: 1.1938, test_f1: 0.6770
 epoch: 61, train_loss: 0.3366, test_loss: 1.2961, test_f1: 0.6810
 epoch: 62, train_loss: 0.3244, test_loss: 1.3348, test_f1: 0.6539
 epoch: 63, train_loss: 0.3176, test_loss: 1.3041, test_f1: 0.6783
 epoch: 64, train_loss: 0.3140, test_loss: 1.3515, test_f1: 0.6635
 epoch: 65, train_loss: 0.3352, test_loss: 1.3370, test_f1: 0.6417
 epoch: 66, train_loss: 0.3038, test_loss: 1.4183, test_f1: 0.6414
 epoch: 67, train_loss: 0.3139, test_loss: 1.4778, test_f1: 0.6340
 epoch: 68, train_loss: 0.3073, test_loss: 1.4892, test_f1: 0.6592
 epoch: 69, train_loss: 0.3088, test_loss: 1.3355, test_f1: 0.6686
 epoch: 70, train_loss: 0.2920, test_loss: 1.4124, test_f1: 0.6710
 epoch: 71, train_loss: 0.2846, test_loss: 1.5368, test_f1: 0.6388
 epoch: 72, train_loss: 0.2733, test_loss: 1.3579, test_f1: 0.6602
 epoch: 73, train_loss: 0.2644, test_loss: 1.4187, test_f1: 0.6683
 epoch: 74, train_loss: 0.2889, test_loss: 1.4547, test_f1: 0.6362
 epoch: 75, train_loss: 0.2707, test_loss: 1.5084, test_f1: 0.6622
 epoch: 76, train_loss: 0.2747, test_loss: 1.4689, test_f1: 0.6505
 epoch: 77, train_loss: 0.2693, test_loss: 1.4452, test_f1: 0.6582
 epoch: 78, train_loss: 0.2645, test_loss: 1.4454, test_f1: 0.6381
 epoch: 79, train_loss: 0.2543, test_loss: 1.5309, test_f1: 0.6465
 epoch: 80, train_loss: 0.2526, test_loss: 1.5275, test_f1: 0.6428
 epoch: 81, train_loss: 0.2590, test_loss: 1.7363, test_f1: 0.6192
 epoch: 82, train_loss: 0.2573, test_loss: 1.5698, test_f1: 0.6361
 epoch: 83, train_loss: 0.2492, test_loss: 1.5186, test_f1: 0.6337
 epoch: 84, train_loss: 0.2469, test_loss: 1.5129, test_f1: 0.6393
 epoch: 85, train_loss: 0.2781, test_loss: 1.4337, test_f1: 0.6318
 epoch: 86, train_loss: 0.2433, test_loss: 1.6862, test_f1: 0.6280
 epoch: 87, train_loss: 0.2213, test_loss: 1.6669, test_f1: 0.6339
 epoch: 88, train_loss: 0.2192, test_loss: 1.6864, test_f1: 0.6381
 epoch: 89, train_loss: 0.2274, test_loss: 1.6172, test_f1: 0.6387
 epoch: 90, train_loss: 0.2223, test_loss: 1.7668, test_f1: 0.6307
 epoch: 91, train_loss: 0.2267, test_loss: 1.6812, test_f1: 0.6302
 epoch: 92, train_loss: 0.2348, test_loss: 1.6390, test_f1: 0.6280
 epoch: 93, train_loss: 0.2289, test_loss: 1.8329, test_f1: 0.6263
 epoch: 94, train_loss: 0.2394, test_loss: 1.8963, test_f1: 0.6439
 epoch: 95, train_loss: 0.2257, test_loss: 1.8226, test_f1: 0.6376
 epoch: 96, train_loss: 0.2310, test_loss: 1.7629, test_f1: 0.6556
 epoch: 97, train_loss: 0.2082, test_loss: 1.6910, test_f1: 0.6372
 epoch: 98, train_loss: 0.2077, test_loss: 1.7533, test_f1: 0.6471
 epoch: 99, train_loss: 0.2147, test_loss: 1.7042, test_f1: 0.6384
##################ITERATION #4 ****************************************
 epoch: 0, train_loss: 1.2518, test_loss: 0.9969, test_f1: 0.4720
 epoch: 1, train_loss: 0.9961, test_loss: 0.9555, test_f1: 0.4767
 epoch: 2, train_loss: 0.9425, test_loss: 0.9754, test_f1: 0.5084
 epoch: 3, train_loss: 0.9295, test_loss: 0.9676, test_f1: 0.4964
 epoch: 4, train_loss: 0.9111, test_loss: 0.9172, test_f1: 0.5312
 epoch: 5, train_loss: 0.8844, test_loss: 0.9392, test_f1: 0.5120
 epoch: 6, train_loss: 0.8878, test_loss: 0.9243, test_f1: 0.5173
 epoch: 7, train_loss: 0.8720, test_loss: 0.9661, test_f1: 0.5589
 epoch: 8, train_loss: 0.8402, test_loss: 1.0029, test_f1: 0.5547
 epoch: 9, train_loss: 0.8227, test_loss: 0.9699, test_f1: 0.5575
 epoch: 10, train_loss: 0.8195, test_loss: 1.0162, test_f1: 0.5702
 epoch: 11, train_loss: 0.7926, test_loss: 0.9571, test_f1: 0.5756
 epoch: 12, train_loss: 0.7999, test_loss: 1.0003, test_f1: 0.5523
 epoch: 13, train_loss: 0.7913, test_loss: 0.9357, test_f1: 0.5937
 epoch: 14, train_loss: 0.7781, test_loss: 0.9906, test_f1: 0.5750
 epoch: 15, train_loss: 0.7492, test_loss: 0.9281, test_f1: 0.5503
 epoch: 16, train_loss: 0.7564, test_loss: 0.9394, test_f1: 0.5785
 epoch: 17, train_loss: 0.7530, test_loss: 0.9954, test_f1: 0.5783
 epoch: 18, train_loss: 0.7322, test_loss: 0.9420, test_f1: 0.6027
 epoch: 19, train_loss: 0.7242, test_loss: 1.0073, test_f1: 0.5419
 epoch: 20, train_loss: 0.7244, test_loss: 0.8790, test_f1: 0.6157
 epoch: 21, train_loss: 0.7279, test_loss: 0.9419, test_f1: 0.6126
 epoch: 22, train_loss: 0.7039, test_loss: 0.9228, test_f1: 0.6168
 epoch: 23, train_loss: 0.6972, test_loss: 1.0562, test_f1: 0.5948
 epoch: 24, train_loss: 0.6997, test_loss: 0.9022, test_f1: 0.6254
 epoch: 25, train_loss: 0.6891, test_loss: 0.9398, test_f1: 0.6031
 epoch: 26, train_loss: 0.6823, test_loss: 0.9477, test_f1: 0.6202
 epoch: 27, train_loss: 0.6682, test_loss: 0.9789, test_f1: 0.6163
 epoch: 28, train_loss: 0.6500, test_loss: 0.9256, test_f1: 0.6632
 epoch: 29, train_loss: 0.6436, test_loss: 0.9463, test_f1: 0.6706
 epoch: 30, train_loss: 0.6435, test_loss: 0.9557, test_f1: 0.6421
 epoch: 31, train_loss: 0.6437, test_loss: 0.9232, test_f1: 0.6487
 epoch: 32, train_loss: 0.6057, test_loss: 0.9792, test_f1: 0.6440
 epoch: 33, train_loss: 0.5918, test_loss: 0.9121, test_f1: 0.6534
 epoch: 34, train_loss: 0.6038, test_loss: 0.9118, test_f1: 0.6457
 epoch: 35, train_loss: 0.6068, test_loss: 0.9619, test_f1: 0.6631
 epoch: 36, train_loss: 0.5990, test_loss: 1.0356, test_f1: 0.6324
 epoch: 37, train_loss: 0.5733, test_loss: 1.0106, test_f1: 0.6497
 epoch: 38, train_loss: 0.5686, test_loss: 1.0204, test_f1: 0.6532
 epoch: 39, train_loss: 0.5639, test_loss: 1.1090, test_f1: 0.6347
 epoch: 40, train_loss: 0.5506, test_loss: 0.9947, test_f1: 0.6409
 epoch: 41, train_loss: 0.5498, test_loss: 1.0678, test_f1: 0.6057
 epoch: 42, train_loss: 0.5402, test_loss: 1.0021, test_f1: 0.6416
 epoch: 43, train_loss: 0.5441, test_loss: 1.0656, test_f1: 0.6498
 epoch: 44, train_loss: 0.4984, test_loss: 0.9790, test_f1: 0.6703
 epoch: 45, train_loss: 0.5525, test_loss: 0.9552, test_f1: 0.6649
 epoch: 46, train_loss: 0.5094, test_loss: 0.9746, test_f1: 0.6736
 epoch: 47, train_loss: 0.5018, test_loss: 1.0277, test_f1: 0.6339
 epoch: 48, train_loss: 0.5064, test_loss: 1.0504, test_f1: 0.6663
 epoch: 49, train_loss: 0.4966, test_loss: 1.0851, test_f1: 0.6657
 epoch: 50, train_loss: 0.5018, test_loss: 1.0520, test_f1: 0.6808
 epoch: 51, train_loss: 0.4316, test_loss: 1.0518, test_f1: 0.6637
 epoch: 52, train_loss: 0.4060, test_loss: 1.1358, test_f1: 0.6627
 epoch: 53, train_loss: 0.3998, test_loss: 1.1503, test_f1: 0.6899
 epoch: 54, train_loss: 0.4057, test_loss: 1.1293, test_f1: 0.6702
 epoch: 55, train_loss: 0.3866, test_loss: 1.1581, test_f1: 0.6674
 epoch: 56, train_loss: 0.3828, test_loss: 1.1793, test_f1: 0.6594
 epoch: 57, train_loss: 0.3820, test_loss: 1.1686, test_f1: 0.6504
 epoch: 58, train_loss: 0.3777, test_loss: 1.1579, test_f1: 0.6767
 epoch: 59, train_loss: 0.3779, test_loss: 1.1910, test_f1: 0.6587
 epoch: 60, train_loss: 0.3793, test_loss: 1.2269, test_f1: 0.6670
 epoch: 61, train_loss: 0.3694, test_loss: 1.2062, test_f1: 0.6929
 epoch: 62, train_loss: 0.3470, test_loss: 1.1919, test_f1: 0.6803
 epoch: 63, train_loss: 0.3492, test_loss: 1.1841, test_f1: 0.6919
 epoch: 64, train_loss: 0.3200, test_loss: 1.3391, test_f1: 0.6982
 epoch: 65, train_loss: 0.3374, test_loss: 1.2619, test_f1: 0.6602
 epoch: 66, train_loss: 0.3094, test_loss: 1.3856, test_f1: 0.6613
 epoch: 67, train_loss: 0.3116, test_loss: 1.3744, test_f1: 0.6710
 epoch: 68, train_loss: 0.3068, test_loss: 1.3367, test_f1: 0.6681
 epoch: 69, train_loss: 0.3093, test_loss: 1.3692, test_f1: 0.6799
 epoch: 70, train_loss: 0.2954, test_loss: 1.4055, test_f1: 0.6597
 epoch: 71, train_loss: 0.3043, test_loss: 1.3192, test_f1: 0.6588
 epoch: 72, train_loss: 0.2982, test_loss: 1.3357, test_f1: 0.7031
 epoch: 73, train_loss: 0.2812, test_loss: 1.3566, test_f1: 0.6794
 epoch: 74, train_loss: 0.3046, test_loss: 1.4854, test_f1: 0.6612
 epoch: 75, train_loss: 0.3090, test_loss: 1.3822, test_f1: 0.6609
 epoch: 76, train_loss: 0.2728, test_loss: 1.3539, test_f1: 0.6888
 epoch: 77, train_loss: 0.2718, test_loss: 1.4994, test_f1: 0.6661
 epoch: 78, train_loss: 0.2812, test_loss: 1.3708, test_f1: 0.6849
 epoch: 79, train_loss: 0.2734, test_loss: 1.4202, test_f1: 0.6685
 epoch: 80, train_loss: 0.2620, test_loss: 1.5538, test_f1: 0.6471
 epoch: 81, train_loss: 0.2648, test_loss: 1.4603, test_f1: 0.6627
 epoch: 82, train_loss: 0.2496, test_loss: 1.5027, test_f1: 0.6676
 epoch: 83, train_loss: 0.2476, test_loss: 1.5118, test_f1: 0.6614
 epoch: 84, train_loss: 0.2512, test_loss: 1.5676, test_f1: 0.6789
 epoch: 85, train_loss: 0.2503, test_loss: 1.5356, test_f1: 0.6517
 epoch: 86, train_loss: 0.2450, test_loss: 1.5349, test_f1: 0.6682
 epoch: 87, train_loss: 0.2416, test_loss: 1.5932, test_f1: 0.6600
 epoch: 88, train_loss: 0.2652, test_loss: 1.6696, test_f1: 0.6529
 epoch: 89, train_loss: 0.2416, test_loss: 1.5840, test_f1: 0.6598
 epoch: 90, train_loss: 0.2337, test_loss: 1.6022, test_f1: 0.6635
 epoch: 91, train_loss: 0.2150, test_loss: 1.5887, test_f1: 0.6434
 epoch: 92, train_loss: 0.2098, test_loss: 1.7141, test_f1: 0.6520
 epoch: 93, train_loss: 0.2307, test_loss: 1.6778, test_f1: 0.6551
 epoch: 94, train_loss: 0.2476, test_loss: 1.5451, test_f1: 0.6560
 epoch: 95, train_loss: 0.2145, test_loss: 1.6896, test_f1: 0.6663
 epoch: 96, train_loss: 0.2228, test_loss: 1.7201, test_f1: 0.6528
 epoch: 97, train_loss: 0.2235, test_loss: 1.6937, test_f1: 0.6442
 epoch: 98, train_loss: 0.2267, test_loss: 1.7072, test_f1: 0.6667
 epoch: 99, train_loss: 0.2253, test_loss: 1.7221, test_f1: 0.6397
##################ITERATION #5 ****************************************
 epoch: 0, train_loss: 1.2670, test_loss: 1.0430, test_f1: 0.4612
 epoch: 1, train_loss: 0.9983, test_loss: 0.9476, test_f1: 0.4790
 epoch: 2, train_loss: 0.9726, test_loss: 0.9379, test_f1: 0.5156
 epoch: 3, train_loss: 0.9275, test_loss: 0.8959, test_f1: 0.5400
 epoch: 4, train_loss: 0.9070, test_loss: 0.9347, test_f1: 0.5302
 epoch: 5, train_loss: 0.8945, test_loss: 0.8786, test_f1: 0.5738
 epoch: 6, train_loss: 0.8556, test_loss: 1.0142, test_f1: 0.4789
 epoch: 7, train_loss: 0.8608, test_loss: 0.9060, test_f1: 0.5271
 epoch: 8, train_loss: 0.8314, test_loss: 0.9216, test_f1: 0.5554
 epoch: 9, train_loss: 0.8226, test_loss: 0.9020, test_f1: 0.5459
 epoch: 10, train_loss: 0.8185, test_loss: 0.9412, test_f1: 0.5731
 epoch: 11, train_loss: 0.7898, test_loss: 0.9275, test_f1: 0.5972
 epoch: 12, train_loss: 0.7675, test_loss: 0.9804, test_f1: 0.5279
 epoch: 13, train_loss: 0.7622, test_loss: 0.9065, test_f1: 0.5860
 epoch: 14, train_loss: 0.7711, test_loss: 0.8997, test_f1: 0.5763
 epoch: 15, train_loss: 0.7578, test_loss: 0.9133, test_f1: 0.5764
 epoch: 16, train_loss: 0.7502, test_loss: 0.9087, test_f1: 0.5971
 epoch: 17, train_loss: 0.7358, test_loss: 0.9022, test_f1: 0.5718
 epoch: 18, train_loss: 0.7158, test_loss: 1.0506, test_f1: 0.5706
 epoch: 19, train_loss: 0.7165, test_loss: 0.9278, test_f1: 0.5884
 epoch: 20, train_loss: 0.6998, test_loss: 1.0041, test_f1: 0.6131
 epoch: 21, train_loss: 0.6929, test_loss: 1.0594, test_f1: 0.5712
 epoch: 22, train_loss: 0.6845, test_loss: 1.0072, test_f1: 0.6201
 epoch: 23, train_loss: 0.6630, test_loss: 0.9708, test_f1: 0.6196
 epoch: 24, train_loss: 0.6633, test_loss: 1.1092, test_f1: 0.6078
 epoch: 25, train_loss: 0.6581, test_loss: 1.0341, test_f1: 0.6289
 epoch: 26, train_loss: 0.6399, test_loss: 1.0190, test_f1: 0.6184
 epoch: 27, train_loss: 0.6365, test_loss: 0.9302, test_f1: 0.6227
 epoch: 28, train_loss: 0.6247, test_loss: 0.9862, test_f1: 0.6076
 epoch: 29, train_loss: 0.6276, test_loss: 0.9530, test_f1: 0.6095
 epoch: 30, train_loss: 0.6101, test_loss: 1.1523, test_f1: 0.6102
 epoch: 31, train_loss: 0.6126, test_loss: 1.0197, test_f1: 0.6211
 epoch: 32, train_loss: 0.5907, test_loss: 0.9664, test_f1: 0.6472
 epoch: 33, train_loss: 0.5818, test_loss: 1.0164, test_f1: 0.6472
 epoch: 34, train_loss: 0.5797, test_loss: 1.0659, test_f1: 0.6306
 epoch: 35, train_loss: 0.5810, test_loss: 0.9993, test_f1: 0.6398
 epoch: 36, train_loss: 0.5586, test_loss: 1.0771, test_f1: 0.6388
 epoch: 37, train_loss: 0.5707, test_loss: 1.0198, test_f1: 0.6513
 epoch: 38, train_loss: 0.5484, test_loss: 0.9718, test_f1: 0.6653
 epoch: 39, train_loss: 0.5354, test_loss: 1.0533, test_f1: 0.6415
 epoch: 40, train_loss: 0.5220, test_loss: 1.1129, test_f1: 0.6533
 epoch: 41, train_loss: 0.5269, test_loss: 1.1176, test_f1: 0.6698
 epoch: 42, train_loss: 0.5142, test_loss: 1.1177, test_f1: 0.6350
 epoch: 43, train_loss: 0.4954, test_loss: 1.1513, test_f1: 0.6384
 epoch: 44, train_loss: 0.5170, test_loss: 1.0702, test_f1: 0.6564
 epoch: 45, train_loss: 0.4617, test_loss: 1.0463, test_f1: 0.6653
 epoch: 46, train_loss: 0.4801, test_loss: 1.1678, test_f1: 0.6601
 epoch: 47, train_loss: 0.4658, test_loss: 1.1217, test_f1: 0.6756
 epoch: 48, train_loss: 0.4501, test_loss: 1.1780, test_f1: 0.6588
 epoch: 49, train_loss: 0.4740, test_loss: 1.1453, test_f1: 0.6664
 epoch: 50, train_loss: 0.4361, test_loss: 1.1700, test_f1: 0.6513
 epoch: 51, train_loss: 0.3856, test_loss: 1.1915, test_f1: 0.6899
 epoch: 52, train_loss: 0.3535, test_loss: 1.2545, test_f1: 0.6736
 epoch: 53, train_loss: 0.3707, test_loss: 1.2935, test_f1: 0.6830
 epoch: 54, train_loss: 0.3413, test_loss: 1.2888, test_f1: 0.6699
 epoch: 55, train_loss: 0.3441, test_loss: 1.3222, test_f1: 0.6552
 epoch: 56, train_loss: 0.3344, test_loss: 1.3623, test_f1: 0.6624
 epoch: 57, train_loss: 0.3207, test_loss: 1.3899, test_f1: 0.6334
 epoch: 58, train_loss: 0.3379, test_loss: 1.3846, test_f1: 0.6829
 epoch: 59, train_loss: 0.3280, test_loss: 1.4343, test_f1: 0.6586
 epoch: 60, train_loss: 0.3426, test_loss: 1.4599, test_f1: 0.6691
 epoch: 61, train_loss: 0.3040, test_loss: 1.3336, test_f1: 0.6645
 epoch: 62, train_loss: 0.2994, test_loss: 1.4441, test_f1: 0.6709
 epoch: 63, train_loss: 0.2947, test_loss: 1.4274, test_f1: 0.6841
 epoch: 64, train_loss: 0.3054, test_loss: 1.5775, test_f1: 0.6543
 epoch: 65, train_loss: 0.2893, test_loss: 1.4638, test_f1: 0.6659
 epoch: 66, train_loss: 0.2772, test_loss: 1.5812, test_f1: 0.6592
 epoch: 67, train_loss: 0.2839, test_loss: 1.6744, test_f1: 0.6113
 epoch: 68, train_loss: 0.2842, test_loss: 1.5205, test_f1: 0.6556
 epoch: 69, train_loss: 0.2717, test_loss: 1.5960, test_f1: 0.6480
 epoch: 70, train_loss: 0.2720, test_loss: 1.5311, test_f1: 0.6535
 epoch: 71, train_loss: 0.2645, test_loss: 1.5867, test_f1: 0.6506
 epoch: 72, train_loss: 0.2716, test_loss: 1.5248, test_f1: 0.6285
 epoch: 73, train_loss: 0.2632, test_loss: 1.5684, test_f1: 0.6469
 epoch: 74, train_loss: 0.2627, test_loss: 1.7478, test_f1: 0.6396
 epoch: 75, train_loss: 0.2467, test_loss: 1.5992, test_f1: 0.6440
 epoch: 76, train_loss: 0.2658, test_loss: 1.6030, test_f1: 0.6406
 epoch: 77, train_loss: 0.2686, test_loss: 1.5361, test_f1: 0.6412
 epoch: 78, train_loss: 0.2588, test_loss: 1.6184, test_f1: 0.6563
 epoch: 79, train_loss: 0.2527, test_loss: 1.5853, test_f1: 0.6728
 epoch: 80, train_loss: 0.2419, test_loss: 1.6983, test_f1: 0.6505
 epoch: 81, train_loss: 0.2359, test_loss: 1.7580, test_f1: 0.6177
 epoch: 82, train_loss: 0.2332, test_loss: 1.7332, test_f1: 0.6654
 epoch: 83, train_loss: 0.2426, test_loss: 1.7702, test_f1: 0.6355
 epoch: 84, train_loss: 0.2309, test_loss: 1.6635, test_f1: 0.6534
 epoch: 85, train_loss: 0.2234, test_loss: 1.7304, test_f1: 0.6391
 epoch: 86, train_loss: 0.2147, test_loss: 1.8637, test_f1: 0.6469
 epoch: 87, train_loss: 0.2249, test_loss: 1.7142, test_f1: 0.6568
 epoch: 88, train_loss: 0.2200, test_loss: 1.8838, test_f1: 0.6538
 epoch: 89, train_loss: 0.2228, test_loss: 1.7834, test_f1: 0.6434
 epoch: 90, train_loss: 0.2194, test_loss: 1.7759, test_f1: 0.6499
 epoch: 91, train_loss: 0.2159, test_loss: 1.8605, test_f1: 0.6448
 epoch: 92, train_loss: 0.1938, test_loss: 1.7530, test_f1: 0.6490
 epoch: 93, train_loss: 0.2251, test_loss: 1.8348, test_f1: 0.6413
 epoch: 94, train_loss: 0.2048, test_loss: 1.9003, test_f1: 0.6257
 epoch: 95, train_loss: 0.2188, test_loss: 1.7955, test_f1: 0.6438
 epoch: 96, train_loss: 0.2004, test_loss: 1.7873, test_f1: 0.6433
 epoch: 97, train_loss: 0.2205, test_loss: 1.7714, test_f1: 0.6437
 epoch: 98, train_loss: 0.1994, test_loss: 1.8476, test_f1: 0.6674
 epoch: 99, train_loss: 0.2240, test_loss: 1.7756, test_f1: 0.6527
##################ITERATION #6 ****************************************
 epoch: 0, train_loss: 1.3405, test_loss: 1.0364, test_f1: 0.4687
 epoch: 1, train_loss: 0.9935, test_loss: 0.9209, test_f1: 0.5250
 epoch: 2, train_loss: 0.9649, test_loss: 0.9112, test_f1: 0.5274
 epoch: 3, train_loss: 0.9297, test_loss: 0.8832, test_f1: 0.5650
 epoch: 4, train_loss: 0.9029, test_loss: 0.8870, test_f1: 0.5388
 epoch: 5, train_loss: 0.8878, test_loss: 0.9050, test_f1: 0.5731
 epoch: 6, train_loss: 0.8717, test_loss: 0.9817, test_f1: 0.5744
 epoch: 7, train_loss: 0.8609, test_loss: 0.9447, test_f1: 0.5223
 epoch: 8, train_loss: 0.8446, test_loss: 0.9570, test_f1: 0.5939
 epoch: 9, train_loss: 0.8295, test_loss: 0.9809, test_f1: 0.5837
 epoch: 10, train_loss: 0.8329, test_loss: 0.9164, test_f1: 0.6036
 epoch: 11, train_loss: 0.8090, test_loss: 0.9883, test_f1: 0.5440
 epoch: 12, train_loss: 0.8144, test_loss: 0.9829, test_f1: 0.5707
 epoch: 13, train_loss: 0.7937, test_loss: 0.9983, test_f1: 0.5886
 epoch: 14, train_loss: 0.7820, test_loss: 0.9748, test_f1: 0.5842
 epoch: 15, train_loss: 0.7653, test_loss: 1.0410, test_f1: 0.5649
 epoch: 16, train_loss: 0.7721, test_loss: 1.0066, test_f1: 0.6063
 epoch: 17, train_loss: 0.7644, test_loss: 1.0955, test_f1: 0.5882
 epoch: 18, train_loss: 0.7457, test_loss: 0.9773, test_f1: 0.5895
 epoch: 19, train_loss: 0.7451, test_loss: 0.9551, test_f1: 0.6072
 epoch: 20, train_loss: 0.7314, test_loss: 1.0044, test_f1: 0.5866
 epoch: 21, train_loss: 0.7233, test_loss: 1.0458, test_f1: 0.6239
 epoch: 22, train_loss: 0.7165, test_loss: 1.0319, test_f1: 0.6092
 epoch: 23, train_loss: 0.7133, test_loss: 0.9463, test_f1: 0.6028
 epoch: 24, train_loss: 0.6858, test_loss: 1.0451, test_f1: 0.5466
 epoch: 25, train_loss: 0.6922, test_loss: 0.9498, test_f1: 0.6382
 epoch: 26, train_loss: 0.6809, test_loss: 1.1146, test_f1: 0.5934
 epoch: 27, train_loss: 0.6806, test_loss: 1.0374, test_f1: 0.6166
 epoch: 28, train_loss: 0.6635, test_loss: 1.1156, test_f1: 0.5936
 epoch: 29, train_loss: 0.6538, test_loss: 1.1284, test_f1: 0.6138
 epoch: 30, train_loss: 0.6520, test_loss: 1.1561, test_f1: 0.6300
 epoch: 31, train_loss: 0.6340, test_loss: 1.0631, test_f1: 0.6151
 epoch: 32, train_loss: 0.6204, test_loss: 1.2366, test_f1: 0.5896
 epoch: 33, train_loss: 0.6283, test_loss: 1.1390, test_f1: 0.6070
 epoch: 34, train_loss: 0.6411, test_loss: 1.0541, test_f1: 0.6020
 epoch: 35, train_loss: 0.5918, test_loss: 1.0869, test_f1: 0.6299
 epoch: 36, train_loss: 0.6292, test_loss: 1.1382, test_f1: 0.6405
 epoch: 37, train_loss: 0.5893, test_loss: 1.1917, test_f1: 0.6032
 epoch: 38, train_loss: 0.5940, test_loss: 1.1062, test_f1: 0.6154
 epoch: 39, train_loss: 0.5909, test_loss: 1.1086, test_f1: 0.6227
 epoch: 40, train_loss: 0.5767, test_loss: 1.1026, test_f1: 0.6082
 epoch: 41, train_loss: 0.5620, test_loss: 1.1388, test_f1: 0.6265
 epoch: 42, train_loss: 0.5473, test_loss: 1.2013, test_f1: 0.6367
 epoch: 43, train_loss: 0.5510, test_loss: 1.0917, test_f1: 0.6432
 epoch: 44, train_loss: 0.5251, test_loss: 1.1579, test_f1: 0.6180
 epoch: 45, train_loss: 0.5086, test_loss: 1.2319, test_f1: 0.6424
 epoch: 46, train_loss: 0.5067, test_loss: 1.2144, test_f1: 0.6101
 epoch: 47, train_loss: 0.5080, test_loss: 1.2535, test_f1: 0.6160
 epoch: 48, train_loss: 0.5112, test_loss: 1.1736, test_f1: 0.6744
 epoch: 49, train_loss: 0.5001, test_loss: 1.2448, test_f1: 0.6223
 epoch: 50, train_loss: 0.4931, test_loss: 1.3863, test_f1: 0.6267
 epoch: 51, train_loss: 0.4482, test_loss: 1.2910, test_f1: 0.6340
 epoch: 52, train_loss: 0.4163, test_loss: 1.3044, test_f1: 0.6423
 epoch: 53, train_loss: 0.4184, test_loss: 1.3637, test_f1: 0.6338
 epoch: 54, train_loss: 0.4036, test_loss: 1.2999, test_f1: 0.6311
 epoch: 55, train_loss: 0.3798, test_loss: 1.4351, test_f1: 0.6607
 epoch: 56, train_loss: 0.3885, test_loss: 1.4399, test_f1: 0.6443
 epoch: 57, train_loss: 0.3659, test_loss: 1.5306, test_f1: 0.6076
 epoch: 58, train_loss: 0.3580, test_loss: 1.4549, test_f1: 0.6303
 epoch: 59, train_loss: 0.3631, test_loss: 1.4294, test_f1: 0.6347
 epoch: 60, train_loss: 0.3669, test_loss: 1.4532, test_f1: 0.6608
 epoch: 61, train_loss: 0.3523, test_loss: 1.3835, test_f1: 0.6548
 epoch: 62, train_loss: 0.3391, test_loss: 1.5022, test_f1: 0.6428
 epoch: 63, train_loss: 0.3474, test_loss: 1.5659, test_f1: 0.6438
 epoch: 64, train_loss: 0.3609, test_loss: 1.5430, test_f1: 0.6438
 epoch: 65, train_loss: 0.3444, test_loss: 1.4618, test_f1: 0.6546
 epoch: 66, train_loss: 0.3480, test_loss: 1.5311, test_f1: 0.6436
 epoch: 67, train_loss: 0.3283, test_loss: 1.5067, test_f1: 0.6316
 epoch: 68, train_loss: 0.3243, test_loss: 1.5648, test_f1: 0.6473
 epoch: 69, train_loss: 0.3397, test_loss: 1.6876, test_f1: 0.6143
 epoch: 70, train_loss: 0.3334, test_loss: 1.5400, test_f1: 0.6553
 epoch: 71, train_loss: 0.3074, test_loss: 1.5290, test_f1: 0.6502
 epoch: 72, train_loss: 0.3156, test_loss: 1.4896, test_f1: 0.6334
 epoch: 73, train_loss: 0.3025, test_loss: 1.6398, test_f1: 0.6337
 epoch: 74, train_loss: 0.3031, test_loss: 1.6708, test_f1: 0.6468
 epoch: 75, train_loss: 0.2744, test_loss: 1.7274, test_f1: 0.6365
 epoch: 76, train_loss: 0.2931, test_loss: 1.6245, test_f1: 0.6768
 epoch: 77, train_loss: 0.2838, test_loss: 1.7511, test_f1: 0.6246
 epoch: 78, train_loss: 0.2829, test_loss: 1.6618, test_f1: 0.6365
 epoch: 79, train_loss: 0.2726, test_loss: 1.8023, test_f1: 0.6419
 epoch: 80, train_loss: 0.2654, test_loss: 1.6231, test_f1: 0.6574
 epoch: 81, train_loss: 0.2722, test_loss: 1.5900, test_f1: 0.6440
 epoch: 82, train_loss: 0.2808, test_loss: 1.7866, test_f1: 0.6560
 epoch: 83, train_loss: 0.2911, test_loss: 1.7179, test_f1: 0.6219
 epoch: 84, train_loss: 0.2816, test_loss: 1.7498, test_f1: 0.6463
 epoch: 85, train_loss: 0.2617, test_loss: 1.7940, test_f1: 0.6321
 epoch: 86, train_loss: 0.2482, test_loss: 1.7813, test_f1: 0.6421
 epoch: 87, train_loss: 0.2533, test_loss: 1.7120, test_f1: 0.6291
 epoch: 88, train_loss: 0.2444, test_loss: 1.6957, test_f1: 0.6662
 epoch: 89, train_loss: 0.2646, test_loss: 1.7449, test_f1: 0.6252
 epoch: 90, train_loss: 0.2545, test_loss: 1.7572, test_f1: 0.6616
 epoch: 91, train_loss: 0.2435, test_loss: 1.8266, test_f1: 0.6312
 epoch: 92, train_loss: 0.2438, test_loss: 1.7044, test_f1: 0.6602
 epoch: 93, train_loss: 0.2397, test_loss: 1.9503, test_f1: 0.6611
 epoch: 94, train_loss: 0.2367, test_loss: 1.7983, test_f1: 0.6414
 epoch: 95, train_loss: 0.2285, test_loss: 1.7859, test_f1: 0.6527
 epoch: 96, train_loss: 0.2379, test_loss: 1.9229, test_f1: 0.6528
 epoch: 97, train_loss: 0.2247, test_loss: 1.7504, test_f1: 0.6517
 epoch: 98, train_loss: 0.2395, test_loss: 1.9231, test_f1: 0.6317
 epoch: 99, train_loss: 0.2338, test_loss: 1.8392, test_f1: 0.6329
##################ITERATION #7 ****************************************
 epoch: 0, train_loss: 1.3052, test_loss: 1.0519, test_f1: 0.4329
 epoch: 1, train_loss: 1.0051, test_loss: 0.9782, test_f1: 0.4780
 epoch: 2, train_loss: 0.9669, test_loss: 0.9448, test_f1: 0.4996
 epoch: 3, train_loss: 0.9160, test_loss: 0.9396, test_f1: 0.4891
 epoch: 4, train_loss: 0.9042, test_loss: 0.9715, test_f1: 0.5316
 epoch: 5, train_loss: 0.8871, test_loss: 0.9781, test_f1: 0.5290
 epoch: 6, train_loss: 0.8650, test_loss: 0.9481, test_f1: 0.5292
 epoch: 7, train_loss: 0.8621, test_loss: 0.9965, test_f1: 0.5373
 epoch: 8, train_loss: 0.8427, test_loss: 0.9904, test_f1: 0.5979
 epoch: 9, train_loss: 0.8142, test_loss: 0.9941, test_f1: 0.5833
 epoch: 10, train_loss: 0.8193, test_loss: 0.9547, test_f1: 0.5338
 epoch: 11, train_loss: 0.8134, test_loss: 0.9227, test_f1: 0.5611
 epoch: 12, train_loss: 0.7986, test_loss: 0.9478, test_f1: 0.5675
 epoch: 13, train_loss: 0.7983, test_loss: 1.0231, test_f1: 0.5790
 epoch: 14, train_loss: 0.7737, test_loss: 0.9798, test_f1: 0.5985
 epoch: 15, train_loss: 0.7664, test_loss: 0.9346, test_f1: 0.5416
 epoch: 16, train_loss: 0.7635, test_loss: 0.8822, test_f1: 0.5815
 epoch: 17, train_loss: 0.7530, test_loss: 0.9783, test_f1: 0.5707
 epoch: 18, train_loss: 0.7244, test_loss: 0.9714, test_f1: 0.6062
 epoch: 19, train_loss: 0.7217, test_loss: 0.9338, test_f1: 0.6225
 epoch: 20, train_loss: 0.7035, test_loss: 0.9909, test_f1: 0.5947
 epoch: 21, train_loss: 0.6919, test_loss: 1.0109, test_f1: 0.6043
 epoch: 22, train_loss: 0.7020, test_loss: 1.0483, test_f1: 0.6148
 epoch: 23, train_loss: 0.7025, test_loss: 1.0445, test_f1: 0.5851
 epoch: 24, train_loss: 0.7050, test_loss: 1.1090, test_f1: 0.5933
 epoch: 25, train_loss: 0.6727, test_loss: 1.0052, test_f1: 0.6232
 epoch: 26, train_loss: 0.6632, test_loss: 1.0433, test_f1: 0.6057
 epoch: 27, train_loss: 0.6409, test_loss: 0.9983, test_f1: 0.6478
 epoch: 28, train_loss: 0.6420, test_loss: 1.0543, test_f1: 0.6573
 epoch: 29, train_loss: 0.6341, test_loss: 1.0405, test_f1: 0.6184
 epoch: 30, train_loss: 0.6411, test_loss: 0.9982, test_f1: 0.6270
 epoch: 31, train_loss: 0.6246, test_loss: 1.0644, test_f1: 0.6480
 epoch: 32, train_loss: 0.6137, test_loss: 1.0946, test_f1: 0.6479
 epoch: 33, train_loss: 0.6085, test_loss: 0.9540, test_f1: 0.6916
 epoch: 34, train_loss: 0.5969, test_loss: 0.9965, test_f1: 0.6542
 epoch: 35, train_loss: 0.5827, test_loss: 1.0748, test_f1: 0.6238
 epoch: 36, train_loss: 0.5757, test_loss: 1.0415, test_f1: 0.6068
 epoch: 37, train_loss: 0.5985, test_loss: 1.0974, test_f1: 0.6253
 epoch: 38, train_loss: 0.5690, test_loss: 1.1311, test_f1: 0.5909
 epoch: 39, train_loss: 0.5595, test_loss: 1.1658, test_f1: 0.6520
 epoch: 40, train_loss: 0.5619, test_loss: 1.0557, test_f1: 0.6618
 epoch: 41, train_loss: 0.5436, test_loss: 1.0271, test_f1: 0.6564
 epoch: 42, train_loss: 0.5283, test_loss: 1.0486, test_f1: 0.6180
 epoch: 43, train_loss: 0.5230, test_loss: 1.1399, test_f1: 0.6508
 epoch: 44, train_loss: 0.5291, test_loss: 1.0851, test_f1: 0.6727
 epoch: 45, train_loss: 0.5030, test_loss: 1.1847, test_f1: 0.6407
 epoch: 46, train_loss: 0.5076, test_loss: 1.1225, test_f1: 0.6654
 epoch: 47, train_loss: 0.5051, test_loss: 1.0597, test_f1: 0.6829
 epoch: 48, train_loss: 0.4833, test_loss: 1.1453, test_f1: 0.6579
 epoch: 49, train_loss: 0.4719, test_loss: 1.0967, test_f1: 0.6511
 epoch: 50, train_loss: 0.4845, test_loss: 1.1485, test_f1: 0.6386
 epoch: 51, train_loss: 0.4327, test_loss: 1.1523, test_f1: 0.6616
 epoch: 52, train_loss: 0.3914, test_loss: 1.1977, test_f1: 0.6517
 epoch: 53, train_loss: 0.3769, test_loss: 1.1773, test_f1: 0.6709
 epoch: 54, train_loss: 0.3703, test_loss: 1.1952, test_f1: 0.6910
 epoch: 55, train_loss: 0.3585, test_loss: 1.2921, test_f1: 0.6760
 epoch: 56, train_loss: 0.3536, test_loss: 1.2868, test_f1: 0.6501
 epoch: 57, train_loss: 0.3719, test_loss: 1.3215, test_f1: 0.6589
 epoch: 58, train_loss: 0.3387, test_loss: 1.2470, test_f1: 0.6836
 epoch: 59, train_loss: 0.3439, test_loss: 1.3656, test_f1: 0.6617
 epoch: 60, train_loss: 0.3388, test_loss: 1.4384, test_f1: 0.6350
 epoch: 61, train_loss: 0.3264, test_loss: 1.4578, test_f1: 0.6297
 epoch: 62, train_loss: 0.3125, test_loss: 1.3841, test_f1: 0.6293
 epoch: 63, train_loss: 0.3399, test_loss: 1.4565, test_f1: 0.6694
 epoch: 64, train_loss: 0.3292, test_loss: 1.3907, test_f1: 0.6657
 epoch: 65, train_loss: 0.2994, test_loss: 1.3331, test_f1: 0.6915
 epoch: 66, train_loss: 0.3074, test_loss: 1.4560, test_f1: 0.6671
 epoch: 67, train_loss: 0.2980, test_loss: 1.2944, test_f1: 0.6782
 epoch: 68, train_loss: 0.2837, test_loss: 1.5037, test_f1: 0.6326
 epoch: 69, train_loss: 0.2844, test_loss: 1.4703, test_f1: 0.6611
 epoch: 70, train_loss: 0.2927, test_loss: 1.4956, test_f1: 0.6464
 epoch: 71, train_loss: 0.2898, test_loss: 1.5087, test_f1: 0.6463
 epoch: 72, train_loss: 0.2923, test_loss: 1.4223, test_f1: 0.6689
 epoch: 73, train_loss: 0.2683, test_loss: 1.5285, test_f1: 0.6581
 epoch: 74, train_loss: 0.2594, test_loss: 1.5682, test_f1: 0.6529
 epoch: 75, train_loss: 0.2656, test_loss: 1.5111, test_f1: 0.6994
 epoch: 76, train_loss: 0.2732, test_loss: 1.6434, test_f1: 0.6571
 epoch: 77, train_loss: 0.2792, test_loss: 1.6415, test_f1: 0.6627
 epoch: 78, train_loss: 0.2679, test_loss: 1.4993, test_f1: 0.6876
 epoch: 79, train_loss: 0.2734, test_loss: 1.5983, test_f1: 0.6578
 epoch: 80, train_loss: 0.2630, test_loss: 1.6921, test_f1: 0.6649
 epoch: 81, train_loss: 0.2456, test_loss: 1.6426, test_f1: 0.6749
 epoch: 82, train_loss: 0.2632, test_loss: 1.6414, test_f1: 0.6606
 epoch: 83, train_loss: 0.2630, test_loss: 1.5846, test_f1: 0.6475
 epoch: 84, train_loss: 0.2445, test_loss: 1.5574, test_f1: 0.6586
 epoch: 85, train_loss: 0.2284, test_loss: 1.6318, test_f1: 0.6416
 epoch: 86, train_loss: 0.2396, test_loss: 1.6455, test_f1: 0.6669
 epoch: 87, train_loss: 0.2432, test_loss: 1.6809, test_f1: 0.6612
 epoch: 88, train_loss: 0.2178, test_loss: 1.6536, test_f1: 0.6846
 epoch: 89, train_loss: 0.2169, test_loss: 1.6351, test_f1: 0.6767
 epoch: 90, train_loss: 0.2418, test_loss: 1.6362, test_f1: 0.6707
 epoch: 91, train_loss: 0.2370, test_loss: 1.4388, test_f1: 0.6771
 epoch: 92, train_loss: 0.2245, test_loss: 1.7018, test_f1: 0.6622
 epoch: 93, train_loss: 0.2262, test_loss: 1.7881, test_f1: 0.6553
 epoch: 94, train_loss: 0.2173, test_loss: 1.7743, test_f1: 0.6601
 epoch: 95, train_loss: 0.2232, test_loss: 1.7550, test_f1: 0.6485
 epoch: 96, train_loss: 0.2164, test_loss: 1.7226, test_f1: 0.6710
 epoch: 97, train_loss: 0.2329, test_loss: 1.8902, test_f1: 0.6670
 epoch: 98, train_loss: 0.2291, test_loss: 1.8995, test_f1: 0.6449
 epoch: 99, train_loss: 0.2147, test_loss: 1.9482, test_f1: 0.6349
##################ITERATION #8 ****************************************
 epoch: 0, train_loss: 1.2528, test_loss: 1.0409, test_f1: 0.3970
 epoch: 1, train_loss: 1.0034, test_loss: 0.9338, test_f1: 0.5171
 epoch: 2, train_loss: 0.9504, test_loss: 0.9509, test_f1: 0.5361
 epoch: 3, train_loss: 0.9300, test_loss: 0.9217, test_f1: 0.5455
 epoch: 4, train_loss: 0.9063, test_loss: 0.9417, test_f1: 0.5564
 epoch: 5, train_loss: 0.8839, test_loss: 0.8843, test_f1: 0.5429
 epoch: 6, train_loss: 0.8640, test_loss: 1.0043, test_f1: 0.5270
 epoch: 7, train_loss: 0.8628, test_loss: 0.9003, test_f1: 0.5702
 epoch: 8, train_loss: 0.8558, test_loss: 0.9787, test_f1: 0.5388
 epoch: 9, train_loss: 0.8498, test_loss: 0.9375, test_f1: 0.5434
 epoch: 10, train_loss: 0.8300, test_loss: 0.9566, test_f1: 0.5619
 epoch: 11, train_loss: 0.8176, test_loss: 0.9896, test_f1: 0.5652
 epoch: 12, train_loss: 0.8078, test_loss: 0.9390, test_f1: 0.5396
 epoch: 13, train_loss: 0.7896, test_loss: 0.9747, test_f1: 0.5654
 epoch: 14, train_loss: 0.7970, test_loss: 0.9203, test_f1: 0.5763
 epoch: 15, train_loss: 0.7891, test_loss: 0.9912, test_f1: 0.5338
 epoch: 16, train_loss: 0.7650, test_loss: 0.9423, test_f1: 0.5938
 epoch: 17, train_loss: 0.7496, test_loss: 0.9712, test_f1: 0.5595
 epoch: 18, train_loss: 0.7567, test_loss: 0.9486, test_f1: 0.5722
 epoch: 19, train_loss: 0.7368, test_loss: 0.9378, test_f1: 0.6168
 epoch: 20, train_loss: 0.7480, test_loss: 0.9394, test_f1: 0.6136
 epoch: 21, train_loss: 0.7116, test_loss: 0.9799, test_f1: 0.6073
 epoch: 22, train_loss: 0.7313, test_loss: 0.9269, test_f1: 0.6049
 epoch: 23, train_loss: 0.6933, test_loss: 0.8831, test_f1: 0.5995
 epoch: 24, train_loss: 0.7074, test_loss: 0.9876, test_f1: 0.6194
 epoch: 25, train_loss: 0.6895, test_loss: 0.9903, test_f1: 0.6227
 epoch: 26, train_loss: 0.6802, test_loss: 1.0511, test_f1: 0.5804
 epoch: 27, train_loss: 0.6734, test_loss: 1.0205, test_f1: 0.6090
 epoch: 28, train_loss: 0.6634, test_loss: 1.0126, test_f1: 0.6151
 epoch: 29, train_loss: 0.6475, test_loss: 1.1073, test_f1: 0.5983
 epoch: 30, train_loss: 0.6518, test_loss: 1.1058, test_f1: 0.6063
 epoch: 31, train_loss: 0.6300, test_loss: 1.1136, test_f1: 0.6306
 epoch: 32, train_loss: 0.6243, test_loss: 1.0434, test_f1: 0.6187
 epoch: 33, train_loss: 0.6278, test_loss: 1.0449, test_f1: 0.5871
 epoch: 34, train_loss: 0.6116, test_loss: 1.0680, test_f1: 0.6471
 epoch: 35, train_loss: 0.6002, test_loss: 1.0714, test_f1: 0.6261
 epoch: 36, train_loss: 0.5886, test_loss: 1.0639, test_f1: 0.6178
 epoch: 37, train_loss: 0.5981, test_loss: 0.9589, test_f1: 0.6422
 epoch: 38, train_loss: 0.5856, test_loss: 1.0453, test_f1: 0.6143
 epoch: 39, train_loss: 0.5806, test_loss: 1.0436, test_f1: 0.5929
 epoch: 40, train_loss: 0.5754, test_loss: 1.0456, test_f1: 0.6315
 epoch: 41, train_loss: 0.5574, test_loss: 1.0216, test_f1: 0.6297
 epoch: 42, train_loss: 0.5758, test_loss: 1.1910, test_f1: 0.6366
 epoch: 43, train_loss: 0.5484, test_loss: 1.1852, test_f1: 0.6377
 epoch: 44, train_loss: 0.5484, test_loss: 1.1655, test_f1: 0.6208
 epoch: 45, train_loss: 0.5460, test_loss: 1.1705, test_f1: 0.6131
 epoch: 46, train_loss: 0.5326, test_loss: 1.1848, test_f1: 0.6524
 epoch: 47, train_loss: 0.5141, test_loss: 1.1395, test_f1: 0.6227
 epoch: 48, train_loss: 0.5170, test_loss: 1.1588, test_f1: 0.6531
 epoch: 49, train_loss: 0.4915, test_loss: 1.1413, test_f1: 0.6282
 epoch: 50, train_loss: 0.4974, test_loss: 1.2678, test_f1: 0.6378
 epoch: 51, train_loss: 0.4419, test_loss: 1.1733, test_f1: 0.6412
 epoch: 52, train_loss: 0.4071, test_loss: 1.2537, test_f1: 0.6382
 epoch: 53, train_loss: 0.4003, test_loss: 1.3701, test_f1: 0.6343
 epoch: 54, train_loss: 0.4043, test_loss: 1.3318, test_f1: 0.6415
 epoch: 55, train_loss: 0.3862, test_loss: 1.3424, test_f1: 0.6489
 epoch: 56, train_loss: 0.3971, test_loss: 1.2754, test_f1: 0.6397
 epoch: 57, train_loss: 0.3817, test_loss: 1.4059, test_f1: 0.6465
 epoch: 58, train_loss: 0.3626, test_loss: 1.4361, test_f1: 0.6498
 epoch: 59, train_loss: 0.3558, test_loss: 1.4278, test_f1: 0.6540
 epoch: 60, train_loss: 0.3388, test_loss: 1.4305, test_f1: 0.6347
 epoch: 61, train_loss: 0.3504, test_loss: 1.5471, test_f1: 0.6290
 epoch: 62, train_loss: 0.3468, test_loss: 1.5254, test_f1: 0.6517
 epoch: 63, train_loss: 0.3476, test_loss: 1.4388, test_f1: 0.6551
 epoch: 64, train_loss: 0.3427, test_loss: 1.4443, test_f1: 0.6611
 epoch: 65, train_loss: 0.3421, test_loss: 1.5518, test_f1: 0.6381
 epoch: 66, train_loss: 0.3428, test_loss: 1.5699, test_f1: 0.6398
 epoch: 67, train_loss: 0.3501, test_loss: 1.4320, test_f1: 0.6730
 epoch: 68, train_loss: 0.3252, test_loss: 1.5167, test_f1: 0.6631
 epoch: 69, train_loss: 0.3033, test_loss: 1.4769, test_f1: 0.6545
 epoch: 70, train_loss: 0.3033, test_loss: 1.4560, test_f1: 0.6534
 epoch: 71, train_loss: 0.3056, test_loss: 1.3938, test_f1: 0.6761
 epoch: 72, train_loss: 0.2898, test_loss: 1.5811, test_f1: 0.6540
 epoch: 73, train_loss: 0.3067, test_loss: 1.5098, test_f1: 0.6754
 epoch: 74, train_loss: 0.2882, test_loss: 1.5115, test_f1: 0.6726
 epoch: 75, train_loss: 0.2838, test_loss: 1.5388, test_f1: 0.6472
 epoch: 76, train_loss: 0.3005, test_loss: 1.6306, test_f1: 0.6455
 epoch: 77, train_loss: 0.2892, test_loss: 1.7984, test_f1: 0.6267
 epoch: 78, train_loss: 0.2871, test_loss: 1.6220, test_f1: 0.6450
 epoch: 79, train_loss: 0.2894, test_loss: 1.5800, test_f1: 0.6593
 epoch: 80, train_loss: 0.2710, test_loss: 1.5138, test_f1: 0.6536
 epoch: 81, train_loss: 0.2611, test_loss: 1.6363, test_f1: 0.6423
 epoch: 82, train_loss: 0.2702, test_loss: 1.7060, test_f1: 0.6182
 epoch: 83, train_loss: 0.2962, test_loss: 1.4805, test_f1: 0.6474
 epoch: 84, train_loss: 0.2713, test_loss: 1.6936, test_f1: 0.6294
 epoch: 85, train_loss: 0.2520, test_loss: 1.5481, test_f1: 0.6507
 epoch: 86, train_loss: 0.2675, test_loss: 1.5756, test_f1: 0.6577
 epoch: 87, train_loss: 0.2655, test_loss: 1.6612, test_f1: 0.6260
 epoch: 88, train_loss: 0.2574, test_loss: 1.6292, test_f1: 0.6298
 epoch: 89, train_loss: 0.2583, test_loss: 1.6926, test_f1: 0.6417
 epoch: 90, train_loss: 0.2605, test_loss: 1.5960, test_f1: 0.6562
 epoch: 91, train_loss: 0.2388, test_loss: 1.6762, test_f1: 0.6529
 epoch: 92, train_loss: 0.2568, test_loss: 1.6080, test_f1: 0.6550
 epoch: 93, train_loss: 0.2499, test_loss: 1.6571, test_f1: 0.6481
 epoch: 94, train_loss: 0.2330, test_loss: 1.6866, test_f1: 0.6449
 epoch: 95, train_loss: 0.2397, test_loss: 1.5613, test_f1: 0.6425
 epoch: 96, train_loss: 0.2264, test_loss: 1.6289, test_f1: 0.6663
 epoch: 97, train_loss: 0.2388, test_loss: 1.7377, test_f1: 0.6546
 epoch: 98, train_loss: 0.2269, test_loss: 1.8723, test_f1: 0.6402
 epoch: 99, train_loss: 0.2426, test_loss: 1.8451, test_f1: 0.6090
##################ITERATION #9 ****************************************
 epoch: 0, train_loss: 1.3004, test_loss: 1.0646, test_f1: 0.4265
 epoch: 1, train_loss: 1.0171, test_loss: 0.9659, test_f1: 0.5077
 epoch: 2, train_loss: 0.9617, test_loss: 0.9636, test_f1: 0.5276
 epoch: 3, train_loss: 0.9270, test_loss: 0.9385, test_f1: 0.5050
 epoch: 4, train_loss: 0.9137, test_loss: 0.9497, test_f1: 0.5440
 epoch: 5, train_loss: 0.8940, test_loss: 0.9649, test_f1: 0.5561
 epoch: 6, train_loss: 0.8645, test_loss: 0.9281, test_f1: 0.5406
 epoch: 7, train_loss: 0.8433, test_loss: 0.9207, test_f1: 0.5840
 epoch: 8, train_loss: 0.8365, test_loss: 0.8987, test_f1: 0.5704
 epoch: 9, train_loss: 0.8274, test_loss: 0.9500, test_f1: 0.5945
 epoch: 10, train_loss: 0.8365, test_loss: 0.9046, test_f1: 0.5809
 epoch: 11, train_loss: 0.8006, test_loss: 0.8662, test_f1: 0.5868
 epoch: 12, train_loss: 0.8019, test_loss: 0.9076, test_f1: 0.6059
 epoch: 13, train_loss: 0.7838, test_loss: 0.9687, test_f1: 0.5522
 epoch: 14, train_loss: 0.7827, test_loss: 0.9628, test_f1: 0.5906
 epoch: 15, train_loss: 0.7709, test_loss: 0.9219, test_f1: 0.5882
 epoch: 16, train_loss: 0.7669, test_loss: 0.9780, test_f1: 0.6119
 epoch: 17, train_loss: 0.7570, test_loss: 0.9524, test_f1: 0.5667
 epoch: 18, train_loss: 0.7514, test_loss: 0.9500, test_f1: 0.5690
 epoch: 19, train_loss: 0.7399, test_loss: 1.0593, test_f1: 0.5504
 epoch: 20, train_loss: 0.7213, test_loss: 0.9565, test_f1: 0.6043
 epoch: 21, train_loss: 0.7101, test_loss: 0.9809, test_f1: 0.5977
 epoch: 22, train_loss: 0.7196, test_loss: 0.9474, test_f1: 0.5692
 epoch: 23, train_loss: 0.6969, test_loss: 0.9748, test_f1: 0.5932
 epoch: 24, train_loss: 0.6857, test_loss: 1.0406, test_f1: 0.6377
 epoch: 25, train_loss: 0.7118, test_loss: 0.9989, test_f1: 0.5848
 epoch: 26, train_loss: 0.6668, test_loss: 1.0190, test_f1: 0.6041
 epoch: 27, train_loss: 0.6579, test_loss: 1.0567, test_f1: 0.6071
 epoch: 28, train_loss: 0.6521, test_loss: 1.0082, test_f1: 0.6262
 epoch: 29, train_loss: 0.6431, test_loss: 0.9607, test_f1: 0.6007
 epoch: 30, train_loss: 0.6182, test_loss: 1.1925, test_f1: 0.5914
 epoch: 31, train_loss: 0.6219, test_loss: 1.1106, test_f1: 0.5958
 epoch: 32, train_loss: 0.6250, test_loss: 1.0340, test_f1: 0.6151
 epoch: 33, train_loss: 0.6058, test_loss: 1.0625, test_f1: 0.6139
 epoch: 34, train_loss: 0.6169, test_loss: 1.0293, test_f1: 0.6328
 epoch: 35, train_loss: 0.5937, test_loss: 1.0835, test_f1: 0.5928
 epoch: 36, train_loss: 0.5928, test_loss: 1.2297, test_f1: 0.6368
 epoch: 37, train_loss: 0.5728, test_loss: 1.0389, test_f1: 0.6044
 epoch: 38, train_loss: 0.5694, test_loss: 1.2543, test_f1: 0.5893
 epoch: 39, train_loss: 0.5654, test_loss: 1.0307, test_f1: 0.6348
 epoch: 40, train_loss: 0.5419, test_loss: 1.0869, test_f1: 0.5861
 epoch: 41, train_loss: 0.5265, test_loss: 1.1536, test_f1: 0.6366
 epoch: 42, train_loss: 0.5264, test_loss: 1.0847, test_f1: 0.6208
 epoch: 43, train_loss: 0.5126, test_loss: 1.1051, test_f1: 0.5893
 epoch: 44, train_loss: 0.5144, test_loss: 1.0129, test_f1: 0.6317
 epoch: 45, train_loss: 0.5332, test_loss: 1.0885, test_f1: 0.6233
 epoch: 46, train_loss: 0.4966, test_loss: 1.0949, test_f1: 0.6058
 epoch: 47, train_loss: 0.5124, test_loss: 1.1863, test_f1: 0.6294
 epoch: 48, train_loss: 0.4781, test_loss: 1.2785, test_f1: 0.6250
 epoch: 49, train_loss: 0.4867, test_loss: 1.2129, test_f1: 0.6392
 epoch: 50, train_loss: 0.4778, test_loss: 1.3902, test_f1: 0.6142
 epoch: 51, train_loss: 0.4437, test_loss: 1.1665, test_f1: 0.6293
 epoch: 52, train_loss: 0.4173, test_loss: 1.1695, test_f1: 0.6475
 epoch: 53, train_loss: 0.3927, test_loss: 1.2604, test_f1: 0.6544
 epoch: 54, train_loss: 0.3804, test_loss: 1.2986, test_f1: 0.6410
 epoch: 55, train_loss: 0.3843, test_loss: 1.3283, test_f1: 0.6309
 epoch: 56, train_loss: 0.3834, test_loss: 1.3158, test_f1: 0.6201
 epoch: 57, train_loss: 0.3591, test_loss: 1.4221, test_f1: 0.6163
 epoch: 58, train_loss: 0.3585, test_loss: 1.3088, test_f1: 0.6247
 epoch: 59, train_loss: 0.3415, test_loss: 1.3527, test_f1: 0.6512
 epoch: 60, train_loss: 0.3394, test_loss: 1.3291, test_f1: 0.6177
 epoch: 61, train_loss: 0.3367, test_loss: 1.4029, test_f1: 0.6329
 epoch: 62, train_loss: 0.3226, test_loss: 1.3429, test_f1: 0.6296
 epoch: 63, train_loss: 0.3384, test_loss: 1.3911, test_f1: 0.6348
 epoch: 64, train_loss: 0.3068, test_loss: 1.2946, test_f1: 0.6601
 epoch: 65, train_loss: 0.3298, test_loss: 1.5055, test_f1: 0.6161
 epoch: 66, train_loss: 0.3167, test_loss: 1.4646, test_f1: 0.6385
 epoch: 67, train_loss: 0.3175, test_loss: 1.4235, test_f1: 0.6335
 epoch: 68, train_loss: 0.3049, test_loss: 1.5257, test_f1: 0.6831
 epoch: 69, train_loss: 0.2973, test_loss: 1.4443, test_f1: 0.6416
 epoch: 70, train_loss: 0.2881, test_loss: 1.4948, test_f1: 0.6303
 epoch: 71, train_loss: 0.2749, test_loss: 1.5066, test_f1: 0.6414
 epoch: 72, train_loss: 0.3020, test_loss: 1.4351, test_f1: 0.6315
 epoch: 73, train_loss: 0.2855, test_loss: 1.4588, test_f1: 0.6554
 epoch: 74, train_loss: 0.3239, test_loss: 1.6281, test_f1: 0.6425
 epoch: 75, train_loss: 0.2877, test_loss: 1.4681, test_f1: 0.6487
 epoch: 76, train_loss: 0.2796, test_loss: 1.5661, test_f1: 0.6330
 epoch: 77, train_loss: 0.2869, test_loss: 1.5112, test_f1: 0.6477
 epoch: 78, train_loss: 0.2541, test_loss: 1.6891, test_f1: 0.6240
 epoch: 79, train_loss: 0.2878, test_loss: 1.7272, test_f1: 0.6562
 epoch: 80, train_loss: 0.2469, test_loss: 1.7276, test_f1: 0.6310
 epoch: 81, train_loss: 0.2581, test_loss: 1.7512, test_f1: 0.6154
 epoch: 82, train_loss: 0.2451, test_loss: 1.6906, test_f1: 0.6248
 epoch: 83, train_loss: 0.2484, test_loss: 1.7213, test_f1: 0.6176
 epoch: 84, train_loss: 0.2495, test_loss: 1.6604, test_f1: 0.6369
 epoch: 85, train_loss: 0.2403, test_loss: 1.6394, test_f1: 0.6263
 epoch: 86, train_loss: 0.2541, test_loss: 1.6757, test_f1: 0.6366
 epoch: 87, train_loss: 0.2295, test_loss: 1.7076, test_f1: 0.6350
 epoch: 88, train_loss: 0.2330, test_loss: 1.5966, test_f1: 0.6415
 epoch: 89, train_loss: 0.2456, test_loss: 1.7167, test_f1: 0.6392
 epoch: 90, train_loss: 0.2328, test_loss: 1.8810, test_f1: 0.6345
 epoch: 91, train_loss: 0.2442, test_loss: 1.5940, test_f1: 0.6673
 epoch: 92, train_loss: 0.2300, test_loss: 1.7067, test_f1: 0.6524
 epoch: 93, train_loss: 0.2157, test_loss: 1.6125, test_f1: 0.6382
 epoch: 94, train_loss: 0.2371, test_loss: 1.5325, test_f1: 0.6690
 epoch: 95, train_loss: 0.2194, test_loss: 1.6323, test_f1: 0.6472
 epoch: 96, train_loss: 0.2229, test_loss: 1.7044, test_f1: 0.6410
 epoch: 97, train_loss: 0.2069, test_loss: 1.7524, test_f1: 0.6158
 epoch: 98, train_loss: 0.2134, test_loss: 1.7832, test_f1: 0.6230
 epoch: 99, train_loss: 0.2079, test_loss: 1.7725, test_f1: 0.6523

Training completed in 1294.81 seconds
Best F1: 0.7031 at epoch 72
Mean F1 across iterations: 0.6860  0.0090
========================FINAL RESULTS================================
FEGIN weighted F1: 0.7031  0.0090
python main.py --data ltspice_examples --representation component_net --model FEGIN --layers 5 --hiddens 128 --batch_size 64 --lr 0.001 --emb_size 250 --epochs 100 --save_appendix component_net_L5_H128_BS64_LR0.001_E250 --no_val
-----



STDERR:
  File "main.py", line 370, in <module>
    main()
  File "main.py", line 254, in main
    dataset = dataset_class(
  File "/home/philip/projects/llm_inference_code_repo/Circuit-Completion-Using-GNNs/component_classification_with_link_prediction_head/evaluation/FEGIN/kernel/circuit_datasets.py", line 15, in __init__
    self.data, self.slices = torch.load(self.processed_paths[0])
  File "/home/philip/.local/lib/python3.8/site-packages/torch/serialization.py", line 1040, in load
    warnings.warn(
  File "/usr/lib/python3.8/warnings.py", line 109, in _showwarnmsg
    sw(msg.message, msg.category, msg.filename, msg.lineno,
  File "main.py", line 47, in warn_with_traceback
    traceback.print_stack(file=log)
/home/philip/projects/llm_inference_code_repo/Circuit-Completion-Using-GNNs/component_classification_with_link_prediction_head/evaluation/FEGIN/kernel/circuit_datasets.py:15: FutureWarning: You are using `torch.load` with `weights_only=False` (the current default value), which uses the default pickle module implicitly. It is possible to construct malicious pickle data which will execute arbitrary code during unpickling (See https://github.com/pytorch/pytorch/blob/main/SECURITY.md#untrusted-models for more details). In a future release, the default value for `weights_only` will be flipped to `True`. This limits the functions that could be executed during unpickling. Arbitrary objects will no longer be allowed to be loaded via this mode unless they are explicitly allowlisted by the user via `torch.serialization.add_safe_globals`. We recommend you start setting `weights_only=True` for any use case where you don't have full control of the loaded file. Please open an issue on GitHub for any issues related to this experimental feature.
  self.data, self.slices = torch.load(self.processed_paths[0])
