STDOUT:
Results will be saved in /home/philip/projects/ltspice_examples_code_repo/Circuit-Completion-Using-GNNs/component_classification_with_link_prediction_head/evaluation/FEGIN/results/model_FEGIN_dataset_ltspice_examples
Command line input: python main.py --data ltspice_examples --representation component_component --model FEGIN --layers 5 --hiddens 32 --batch_size 64 --lr 0.01 --emb_size 128 --epochs 100 --save_appendix component_component_L5_H32_BS64_LR0.01_E128 --no_val
 is saved.
-----
ltspice_examples - FEGIN
Using 5 layers, 32 hidden units, h = 2
Loading component_component representation dataset
ENTERED
Training FEGIN on component_component representation
Train: 3556, Test: 845
##################ITERATION #0 ****************************************
 epoch: 0, train_loss: 1.2700, test_loss: 1.3195, test_f1: 0.2349
 epoch: 1, train_loss: 1.2037, test_loss: 1.1339, test_f1: 0.3948
 epoch: 2, train_loss: 1.1498, test_loss: 1.0727, test_f1: 0.4099
 epoch: 3, train_loss: 1.1238, test_loss: 1.0585, test_f1: 0.4422
 epoch: 4, train_loss: 1.0908, test_loss: 1.0489, test_f1: 0.4325
 epoch: 5, train_loss: 1.0638, test_loss: 1.0065, test_f1: 0.4708
 epoch: 6, train_loss: 1.0417, test_loss: 0.9488, test_f1: 0.4974
 epoch: 7, train_loss: 1.0268, test_loss: 1.0624, test_f1: 0.4736
 epoch: 8, train_loss: 0.9973, test_loss: 1.1295, test_f1: 0.4870
 epoch: 9, train_loss: 1.0015, test_loss: 1.0261, test_f1: 0.4729
 epoch: 10, train_loss: 0.9789, test_loss: 1.1219, test_f1: 0.4624
 epoch: 11, train_loss: 0.9779, test_loss: 0.9664, test_f1: 0.4733
 epoch: 12, train_loss: 0.9627, test_loss: 0.9650, test_f1: 0.4919
 epoch: 13, train_loss: 0.9550, test_loss: 1.0119, test_f1: 0.4762
 epoch: 14, train_loss: 0.9485, test_loss: 1.0881, test_f1: 0.4547
 epoch: 15, train_loss: 0.9421, test_loss: 0.9247, test_f1: 0.4928
 epoch: 16, train_loss: 0.9303, test_loss: 1.0700, test_f1: 0.4940
 epoch: 17, train_loss: 0.9299, test_loss: 1.0939, test_f1: 0.5132
 epoch: 18, train_loss: 0.9320, test_loss: 1.0746, test_f1: 0.4899
 epoch: 19, train_loss: 0.9116, test_loss: 1.0594, test_f1: 0.4846
 epoch: 20, train_loss: 0.9105, test_loss: 1.1265, test_f1: 0.4798
 epoch: 21, train_loss: 0.9214, test_loss: 0.9491, test_f1: 0.4847
 epoch: 22, train_loss: 0.8942, test_loss: 1.1139, test_f1: 0.5106
 epoch: 23, train_loss: 0.8749, test_loss: 1.0253, test_f1: 0.5179
 epoch: 24, train_loss: 0.8895, test_loss: 1.0597, test_f1: 0.5202
 epoch: 25, train_loss: 0.8936, test_loss: 1.0104, test_f1: 0.4896
 epoch: 26, train_loss: 0.8816, test_loss: 1.1847, test_f1: 0.4968
 epoch: 27, train_loss: 0.8870, test_loss: 1.2519, test_f1: 0.4930
 epoch: 28, train_loss: 0.8851, test_loss: 1.1147, test_f1: 0.5117
 epoch: 29, train_loss: 0.8606, test_loss: 1.0471, test_f1: 0.5140
 epoch: 30, train_loss: 0.8599, test_loss: 1.0529, test_f1: 0.5169
 epoch: 31, train_loss: 0.8622, test_loss: 1.1224, test_f1: 0.5083
 epoch: 32, train_loss: 0.8421, test_loss: 1.0182, test_f1: 0.5209
 epoch: 33, train_loss: 0.8620, test_loss: 1.0355, test_f1: 0.4968
 epoch: 34, train_loss: 0.8542, test_loss: 1.0291, test_f1: 0.5335
 epoch: 35, train_loss: 0.8502, test_loss: 1.0914, test_f1: 0.5025
 epoch: 36, train_loss: 0.8432, test_loss: 1.0319, test_f1: 0.5299
 epoch: 37, train_loss: 0.8412, test_loss: 1.0476, test_f1: 0.5449
 epoch: 38, train_loss: 0.8251, test_loss: 1.1291, test_f1: 0.5673
 epoch: 39, train_loss: 0.8203, test_loss: 1.0755, test_f1: 0.5401
 epoch: 40, train_loss: 0.8398, test_loss: 1.1183, test_f1: 0.5170
 epoch: 41, train_loss: 0.8212, test_loss: 1.1021, test_f1: 0.5266
 epoch: 42, train_loss: 0.8146, test_loss: 1.0419, test_f1: 0.5515
 epoch: 43, train_loss: 0.7924, test_loss: 1.0787, test_f1: 0.5618
 epoch: 44, train_loss: 0.8003, test_loss: 1.3024, test_f1: 0.5245
 epoch: 45, train_loss: 0.7972, test_loss: 1.1464, test_f1: 0.5149
 epoch: 46, train_loss: 0.8041, test_loss: 1.0297, test_f1: 0.5307
 epoch: 47, train_loss: 0.7989, test_loss: 1.1166, test_f1: 0.5134
 epoch: 48, train_loss: 0.7897, test_loss: 0.9571, test_f1: 0.5651
 epoch: 49, train_loss: 0.7936, test_loss: 1.2011, test_f1: 0.4998
 epoch: 50, train_loss: 0.7874, test_loss: 1.1455, test_f1: 0.5118
 epoch: 51, train_loss: 0.7540, test_loss: 1.0911, test_f1: 0.5671
 epoch: 52, train_loss: 0.7424, test_loss: 1.2254, test_f1: 0.5691
 epoch: 53, train_loss: 0.7378, test_loss: 1.1058, test_f1: 0.5438
 epoch: 54, train_loss: 0.7260, test_loss: 1.2670, test_f1: 0.5293
 epoch: 55, train_loss: 0.7261, test_loss: 1.1345, test_f1: 0.5534
 epoch: 56, train_loss: 0.7349, test_loss: 1.2556, test_f1: 0.5570
 epoch: 57, train_loss: 0.7277, test_loss: 1.0795, test_f1: 0.5930
 epoch: 58, train_loss: 0.7087, test_loss: 1.1928, test_f1: 0.5570
 epoch: 59, train_loss: 0.7191, test_loss: 1.2198, test_f1: 0.5675
 epoch: 60, train_loss: 0.7201, test_loss: 1.2852, test_f1: 0.5207
 epoch: 61, train_loss: 0.7025, test_loss: 1.1200, test_f1: 0.5522
 epoch: 62, train_loss: 0.6999, test_loss: 1.1755, test_f1: 0.5577
 epoch: 63, train_loss: 0.7167, test_loss: 1.1359, test_f1: 0.5560
 epoch: 64, train_loss: 0.7005, test_loss: 1.2031, test_f1: 0.5697
 epoch: 65, train_loss: 0.7076, test_loss: 1.2646, test_f1: 0.5277
 epoch: 66, train_loss: 0.7062, test_loss: 1.3859, test_f1: 0.5378
 epoch: 67, train_loss: 0.6971, test_loss: 1.2057, test_f1: 0.5727
 epoch: 68, train_loss: 0.7048, test_loss: 1.5288, test_f1: 0.5473
 epoch: 69, train_loss: 0.7098, test_loss: 1.1663, test_f1: 0.5795
 epoch: 70, train_loss: 0.6863, test_loss: 1.3649, test_f1: 0.5103
 epoch: 71, train_loss: 0.6829, test_loss: 1.2888, test_f1: 0.5560
 epoch: 72, train_loss: 0.6888, test_loss: 1.4524, test_f1: 0.5384
 epoch: 73, train_loss: 0.6760, test_loss: 1.3516, test_f1: 0.5460
 epoch: 74, train_loss: 0.6899, test_loss: 1.3315, test_f1: 0.5395
 epoch: 75, train_loss: 0.6746, test_loss: 1.1935, test_f1: 0.5914
 epoch: 76, train_loss: 0.6894, test_loss: 1.4512, test_f1: 0.5305
 epoch: 77, train_loss: 0.6784, test_loss: 1.4214, test_f1: 0.5419
 epoch: 78, train_loss: 0.6741, test_loss: 1.2753, test_f1: 0.5909
 epoch: 79, train_loss: 0.6735, test_loss: 1.4573, test_f1: 0.5233
 epoch: 80, train_loss: 0.6734, test_loss: 1.3072, test_f1: 0.5631
 epoch: 81, train_loss: 0.6827, test_loss: 1.3447, test_f1: 0.5653
 epoch: 82, train_loss: 0.6650, test_loss: 1.3016, test_f1: 0.5536
 epoch: 83, train_loss: 0.6702, test_loss: 1.2774, test_f1: 0.5659
 epoch: 84, train_loss: 0.6638, test_loss: 1.2467, test_f1: 0.5597
 epoch: 85, train_loss: 0.6634, test_loss: 1.1975, test_f1: 0.5975
 epoch: 86, train_loss: 0.6574, test_loss: 1.2414, test_f1: 0.5705
 epoch: 87, train_loss: 0.6567, test_loss: 1.2791, test_f1: 0.5474
 epoch: 88, train_loss: 0.6422, test_loss: 1.2758, test_f1: 0.5905
 epoch: 89, train_loss: 0.6487, test_loss: 1.2161, test_f1: 0.5763
 epoch: 90, train_loss: 0.6602, test_loss: 1.1921, test_f1: 0.5901
 epoch: 91, train_loss: 0.6531, test_loss: 1.2402, test_f1: 0.5602
 epoch: 92, train_loss: 0.6710, test_loss: 1.2744, test_f1: 0.5949
 epoch: 93, train_loss: 0.6408, test_loss: 1.2998, test_f1: 0.5760
 epoch: 94, train_loss: 0.6522, test_loss: 1.1573, test_f1: 0.6011
 epoch: 95, train_loss: 0.6280, test_loss: 1.2848, test_f1: 0.5889
 epoch: 96, train_loss: 0.6287, test_loss: 1.2491, test_f1: 0.5874
 epoch: 97, train_loss: 0.6397, test_loss: 1.3835, test_f1: 0.5904
 epoch: 98, train_loss: 0.6360, test_loss: 1.2064, test_f1: 0.6110
 epoch: 99, train_loss: 0.6382, test_loss: 1.2917, test_f1: 0.5384
##################ITERATION #1 ****************************************
 epoch: 0, train_loss: 1.2684, test_loss: 1.1454, test_f1: 0.4230
 epoch: 1, train_loss: 1.1661, test_loss: 1.0799, test_f1: 0.4489
 epoch: 2, train_loss: 1.1165, test_loss: 1.1231, test_f1: 0.4154
 epoch: 3, train_loss: 1.0809, test_loss: 0.9626, test_f1: 0.4878
 epoch: 4, train_loss: 1.0596, test_loss: 0.9845, test_f1: 0.4574
 epoch: 5, train_loss: 1.0493, test_loss: 0.9688, test_f1: 0.4644
 epoch: 6, train_loss: 1.0226, test_loss: 0.9735, test_f1: 0.4716
 epoch: 7, train_loss: 1.0005, test_loss: 0.9909, test_f1: 0.4485
 epoch: 8, train_loss: 0.9838, test_loss: 0.9896, test_f1: 0.4929
 epoch: 9, train_loss: 0.9840, test_loss: 1.0110, test_f1: 0.4591
 epoch: 10, train_loss: 0.9752, test_loss: 1.2006, test_f1: 0.4615
 epoch: 11, train_loss: 0.9710, test_loss: 1.1325, test_f1: 0.4694
 epoch: 12, train_loss: 0.9608, test_loss: 1.0473, test_f1: 0.5093
 epoch: 13, train_loss: 0.9575, test_loss: 1.0684, test_f1: 0.4702
 epoch: 14, train_loss: 0.9478, test_loss: 1.0014, test_f1: 0.5017
 epoch: 15, train_loss: 0.9354, test_loss: 1.0219, test_f1: 0.5009
 epoch: 16, train_loss: 0.9204, test_loss: 0.8778, test_f1: 0.5098
 epoch: 17, train_loss: 0.9207, test_loss: 0.9376, test_f1: 0.4946
 epoch: 18, train_loss: 0.9092, test_loss: 0.9547, test_f1: 0.5207
 epoch: 19, train_loss: 0.9143, test_loss: 1.0174, test_f1: 0.5247
 epoch: 20, train_loss: 0.9108, test_loss: 0.9679, test_f1: 0.5017
 epoch: 21, train_loss: 0.8987, test_loss: 1.0461, test_f1: 0.4716
 epoch: 22, train_loss: 0.8941, test_loss: 0.9699, test_f1: 0.5248
 epoch: 23, train_loss: 0.8890, test_loss: 1.0083, test_f1: 0.4608
 epoch: 24, train_loss: 0.8834, test_loss: 1.1287, test_f1: 0.4958
 epoch: 25, train_loss: 0.8987, test_loss: 0.9944, test_f1: 0.4914
 epoch: 26, train_loss: 0.8948, test_loss: 0.9881, test_f1: 0.5206
 epoch: 27, train_loss: 0.8724, test_loss: 0.9656, test_f1: 0.5167
 epoch: 28, train_loss: 0.8763, test_loss: 0.9623, test_f1: 0.5376
 epoch: 29, train_loss: 0.8567, test_loss: 0.9375, test_f1: 0.5127
 epoch: 30, train_loss: 0.8508, test_loss: 0.9975, test_f1: 0.5064
 epoch: 31, train_loss: 0.8383, test_loss: 1.0205, test_f1: 0.5163
 epoch: 32, train_loss: 0.8673, test_loss: 1.0058, test_f1: 0.5306
 epoch: 33, train_loss: 0.8526, test_loss: 1.0947, test_f1: 0.5324
 epoch: 34, train_loss: 0.8549, test_loss: 1.0950, test_f1: 0.4780
 epoch: 35, train_loss: 0.8595, test_loss: 1.0334, test_f1: 0.5018
 epoch: 36, train_loss: 0.8536, test_loss: 1.0317, test_f1: 0.5185
 epoch: 37, train_loss: 0.8390, test_loss: 1.0344, test_f1: 0.5357
 epoch: 38, train_loss: 0.8270, test_loss: 0.9655, test_f1: 0.5471
 epoch: 39, train_loss: 0.8222, test_loss: 0.9446, test_f1: 0.5168
 epoch: 40, train_loss: 0.8233, test_loss: 0.9673, test_f1: 0.5325
 epoch: 41, train_loss: 0.8245, test_loss: 0.9870, test_f1: 0.5141
 epoch: 42, train_loss: 0.8274, test_loss: 0.9316, test_f1: 0.4940
 epoch: 43, train_loss: 0.8192, test_loss: 0.9758, test_f1: 0.5092
 epoch: 44, train_loss: 0.8084, test_loss: 0.9422, test_f1: 0.5175
 epoch: 45, train_loss: 0.8260, test_loss: 0.9013, test_f1: 0.5267
 epoch: 46, train_loss: 0.8128, test_loss: 0.9423, test_f1: 0.5510
 epoch: 47, train_loss: 0.8221, test_loss: 0.9351, test_f1: 0.5334
 epoch: 48, train_loss: 0.7999, test_loss: 1.0084, test_f1: 0.5254
 epoch: 49, train_loss: 0.7979, test_loss: 1.0030, test_f1: 0.5150
 epoch: 50, train_loss: 0.8035, test_loss: 0.9534, test_f1: 0.5219
 epoch: 51, train_loss: 0.7625, test_loss: 0.9458, test_f1: 0.5475
 epoch: 52, train_loss: 0.7661, test_loss: 0.9840, test_f1: 0.5582
 epoch: 53, train_loss: 0.7646, test_loss: 0.9992, test_f1: 0.5550
 epoch: 54, train_loss: 0.7437, test_loss: 0.9857, test_f1: 0.5369
 epoch: 55, train_loss: 0.7347, test_loss: 0.9941, test_f1: 0.5405
 epoch: 56, train_loss: 0.7407, test_loss: 0.9980, test_f1: 0.5575
 epoch: 57, train_loss: 0.7301, test_loss: 0.9475, test_f1: 0.5611
 epoch: 58, train_loss: 0.7333, test_loss: 1.0150, test_f1: 0.5544
 epoch: 59, train_loss: 0.7525, test_loss: 1.0100, test_f1: 0.5698
 epoch: 60, train_loss: 0.7335, test_loss: 0.9486, test_f1: 0.5614
 epoch: 61, train_loss: 0.7196, test_loss: 0.9847, test_f1: 0.5728
 epoch: 62, train_loss: 0.7363, test_loss: 1.0183, test_f1: 0.5487
 epoch: 63, train_loss: 0.7301, test_loss: 0.9160, test_f1: 0.5901
 epoch: 64, train_loss: 0.7247, test_loss: 0.9460, test_f1: 0.5719
 epoch: 65, train_loss: 0.7192, test_loss: 1.1232, test_f1: 0.5546
 epoch: 66, train_loss: 0.7153, test_loss: 1.0118, test_f1: 0.5737
 epoch: 67, train_loss: 0.7272, test_loss: 0.9591, test_f1: 0.5717
 epoch: 68, train_loss: 0.7115, test_loss: 0.9939, test_f1: 0.5700
 epoch: 69, train_loss: 0.7197, test_loss: 0.9716, test_f1: 0.5728
 epoch: 70, train_loss: 0.7183, test_loss: 1.0603, test_f1: 0.5773
 epoch: 71, train_loss: 0.6995, test_loss: 1.0086, test_f1: 0.5571
 epoch: 72, train_loss: 0.7130, test_loss: 0.9972, test_f1: 0.5855
 epoch: 73, train_loss: 0.6987, test_loss: 1.0135, test_f1: 0.5751
 epoch: 74, train_loss: 0.7055, test_loss: 1.0669, test_f1: 0.5726
 epoch: 75, train_loss: 0.7033, test_loss: 1.0160, test_f1: 0.5986
 epoch: 76, train_loss: 0.7033, test_loss: 1.0699, test_f1: 0.5822
 epoch: 77, train_loss: 0.6807, test_loss: 1.1162, test_f1: 0.5754
 epoch: 78, train_loss: 0.6905, test_loss: 1.1155, test_f1: 0.5749
 epoch: 79, train_loss: 0.7126, test_loss: 0.9817, test_f1: 0.5851
 epoch: 80, train_loss: 0.6862, test_loss: 1.0489, test_f1: 0.5791
 epoch: 81, train_loss: 0.6741, test_loss: 1.1225, test_f1: 0.5641
 epoch: 82, train_loss: 0.6869, test_loss: 1.0935, test_f1: 0.5832
 epoch: 83, train_loss: 0.6809, test_loss: 1.1043, test_f1: 0.5820
 epoch: 84, train_loss: 0.6858, test_loss: 1.1279, test_f1: 0.5776
 epoch: 85, train_loss: 0.6876, test_loss: 0.9866, test_f1: 0.5708
 epoch: 86, train_loss: 0.6928, test_loss: 1.0304, test_f1: 0.5939
 epoch: 87, train_loss: 0.6804, test_loss: 1.1381, test_f1: 0.5878
 epoch: 88, train_loss: 0.6743, test_loss: 1.0412, test_f1: 0.5810
 epoch: 89, train_loss: 0.6827, test_loss: 1.1475, test_f1: 0.5426
 epoch: 90, train_loss: 0.6642, test_loss: 1.1608, test_f1: 0.5750
 epoch: 91, train_loss: 0.6727, test_loss: 0.9014, test_f1: 0.5863
 epoch: 92, train_loss: 0.6534, test_loss: 1.1710, test_f1: 0.5724
 epoch: 93, train_loss: 0.6556, test_loss: 1.0375, test_f1: 0.5796
 epoch: 94, train_loss: 0.6615, test_loss: 0.9818, test_f1: 0.5950
 epoch: 95, train_loss: 0.6680, test_loss: 1.1472, test_f1: 0.5960
 epoch: 96, train_loss: 0.6573, test_loss: 1.1391, test_f1: 0.5559
 epoch: 97, train_loss: 0.6531, test_loss: 1.2477, test_f1: 0.5558
 epoch: 98, train_loss: 0.6510, test_loss: 1.1696, test_f1: 0.5684
 epoch: 99, train_loss: 0.6670, test_loss: 1.0593, test_f1: 0.5764
##################ITERATION #2 ****************************************
 epoch: 0, train_loss: 1.3219, test_loss: 1.2789, test_f1: 0.2540
 epoch: 1, train_loss: 1.2535, test_loss: 1.2106, test_f1: 0.2522
 epoch: 2, train_loss: 1.2090, test_loss: 1.1566, test_f1: 0.3181
 epoch: 3, train_loss: 1.1762, test_loss: 1.0572, test_f1: 0.4492
 epoch: 4, train_loss: 1.1298, test_loss: 1.0636, test_f1: 0.4528
 epoch: 5, train_loss: 1.0880, test_loss: 0.9845, test_f1: 0.4816
 epoch: 6, train_loss: 1.0578, test_loss: 0.9867, test_f1: 0.4767
 epoch: 7, train_loss: 1.0278, test_loss: 0.9356, test_f1: 0.4804
 epoch: 8, train_loss: 1.0019, test_loss: 0.9189, test_f1: 0.4818
 epoch: 9, train_loss: 1.0053, test_loss: 0.9341, test_f1: 0.4864
 epoch: 10, train_loss: 0.9876, test_loss: 0.9642, test_f1: 0.4595
 epoch: 11, train_loss: 0.9902, test_loss: 0.9309, test_f1: 0.4833
 epoch: 12, train_loss: 0.9425, test_loss: 0.9933, test_f1: 0.4940
 epoch: 13, train_loss: 0.9550, test_loss: 0.9418, test_f1: 0.5179
 epoch: 14, train_loss: 0.9388, test_loss: 1.0323, test_f1: 0.4572
 epoch: 15, train_loss: 0.9279, test_loss: 1.0144, test_f1: 0.4787
 epoch: 16, train_loss: 0.9239, test_loss: 1.0027, test_f1: 0.4787
 epoch: 17, train_loss: 0.9265, test_loss: 0.9436, test_f1: 0.4877
 epoch: 18, train_loss: 0.9305, test_loss: 0.9573, test_f1: 0.5135
 epoch: 19, train_loss: 0.9117, test_loss: 0.9337, test_f1: 0.5042
 epoch: 20, train_loss: 0.9274, test_loss: 0.9117, test_f1: 0.5001
 epoch: 21, train_loss: 0.9008, test_loss: 1.0023, test_f1: 0.4912
 epoch: 22, train_loss: 0.9001, test_loss: 0.9812, test_f1: 0.5052
 epoch: 23, train_loss: 0.8914, test_loss: 0.9697, test_f1: 0.4946
 epoch: 24, train_loss: 0.8928, test_loss: 0.9453, test_f1: 0.5189
 epoch: 25, train_loss: 0.8888, test_loss: 0.9609, test_f1: 0.4717
 epoch: 26, train_loss: 0.8863, test_loss: 1.0379, test_f1: 0.5004
 epoch: 27, train_loss: 0.8644, test_loss: 1.0189, test_f1: 0.5220
 epoch: 28, train_loss: 0.8616, test_loss: 0.9921, test_f1: 0.5187
 epoch: 29, train_loss: 0.8737, test_loss: 1.0114, test_f1: 0.5376
 epoch: 30, train_loss: 0.8748, test_loss: 1.0382, test_f1: 0.5371
 epoch: 31, train_loss: 0.8687, test_loss: 1.0407, test_f1: 0.4793
 epoch: 32, train_loss: 0.8605, test_loss: 1.0425, test_f1: 0.5523
 epoch: 33, train_loss: 0.8613, test_loss: 1.1266, test_f1: 0.5109
 epoch: 34, train_loss: 0.8442, test_loss: 1.0356, test_f1: 0.5029
 epoch: 35, train_loss: 0.8637, test_loss: 1.0510, test_f1: 0.5135
 epoch: 36, train_loss: 0.8478, test_loss: 1.0563, test_f1: 0.5226
 epoch: 37, train_loss: 0.8537, test_loss: 1.0625, test_f1: 0.5223
 epoch: 38, train_loss: 0.8515, test_loss: 1.0386, test_f1: 0.5490
 epoch: 39, train_loss: 0.8236, test_loss: 1.0431, test_f1: 0.5180
 epoch: 40, train_loss: 0.8317, test_loss: 1.0976, test_f1: 0.5155
 epoch: 41, train_loss: 0.8342, test_loss: 1.0182, test_f1: 0.5542
 epoch: 42, train_loss: 0.8272, test_loss: 1.2652, test_f1: 0.5092
 epoch: 43, train_loss: 0.8176, test_loss: 0.9987, test_f1: 0.5660
 epoch: 44, train_loss: 0.8256, test_loss: 1.0284, test_f1: 0.5554
 epoch: 45, train_loss: 0.8162, test_loss: 1.0921, test_f1: 0.5528
 epoch: 46, train_loss: 0.8136, test_loss: 1.0433, test_f1: 0.5395
 epoch: 47, train_loss: 0.8288, test_loss: 1.1505, test_f1: 0.5260
 epoch: 48, train_loss: 0.8039, test_loss: 1.2913, test_f1: 0.4940
 epoch: 49, train_loss: 0.8226, test_loss: 0.9719, test_f1: 0.5555
 epoch: 50, train_loss: 0.8215, test_loss: 1.0621, test_f1: 0.5146
 epoch: 51, train_loss: 0.7937, test_loss: 1.0413, test_f1: 0.5660
 epoch: 52, train_loss: 0.7843, test_loss: 1.0150, test_f1: 0.5462
 epoch: 53, train_loss: 0.7559, test_loss: 1.1092, test_f1: 0.5063
 epoch: 54, train_loss: 0.7585, test_loss: 1.1273, test_f1: 0.5554
 epoch: 55, train_loss: 0.7451, test_loss: 1.1333, test_f1: 0.5511
 epoch: 56, train_loss: 0.7573, test_loss: 1.1405, test_f1: 0.5283
 epoch: 57, train_loss: 0.7479, test_loss: 1.2438, test_f1: 0.5269
 epoch: 58, train_loss: 0.7435, test_loss: 1.0979, test_f1: 0.5518
 epoch: 59, train_loss: 0.7280, test_loss: 1.3623, test_f1: 0.5176
 epoch: 60, train_loss: 0.7361, test_loss: 1.2168, test_f1: 0.5135
 epoch: 61, train_loss: 0.7375, test_loss: 1.2705, test_f1: 0.5040
 epoch: 62, train_loss: 0.7340, test_loss: 1.0679, test_f1: 0.5343
 epoch: 63, train_loss: 0.7250, test_loss: 1.1258, test_f1: 0.5297
 epoch: 64, train_loss: 0.7337, test_loss: 1.1921, test_f1: 0.5133
 epoch: 65, train_loss: 0.7285, test_loss: 0.9979, test_f1: 0.5694
 epoch: 66, train_loss: 0.7262, test_loss: 1.2285, test_f1: 0.5087
 epoch: 67, train_loss: 0.7202, test_loss: 1.2521, test_f1: 0.5482
 epoch: 68, train_loss: 0.7235, test_loss: 1.2977, test_f1: 0.5031
 epoch: 69, train_loss: 0.7219, test_loss: 1.1236, test_f1: 0.5505
 epoch: 70, train_loss: 0.7177, test_loss: 1.0724, test_f1: 0.5508
 epoch: 71, train_loss: 0.7136, test_loss: 1.1139, test_f1: 0.5352
 epoch: 72, train_loss: 0.7110, test_loss: 1.3032, test_f1: 0.5190
 epoch: 73, train_loss: 0.7133, test_loss: 1.1533, test_f1: 0.5417
 epoch: 74, train_loss: 0.6994, test_loss: 1.2932, test_f1: 0.5178
 epoch: 75, train_loss: 0.7109, test_loss: 1.2207, test_f1: 0.5220
 epoch: 76, train_loss: 0.6963, test_loss: 1.3783, test_f1: 0.5148
 epoch: 77, train_loss: 0.7060, test_loss: 1.3411, test_f1: 0.4951
 epoch: 78, train_loss: 0.7020, test_loss: 1.3558, test_f1: 0.5399
 epoch: 79, train_loss: 0.7051, test_loss: 1.4023, test_f1: 0.5298
 epoch: 80, train_loss: 0.7062, test_loss: 1.3215, test_f1: 0.5253
 epoch: 81, train_loss: 0.7024, test_loss: 1.3139, test_f1: 0.5331
 epoch: 82, train_loss: 0.6815, test_loss: 1.2483, test_f1: 0.5057
 epoch: 83, train_loss: 0.6885, test_loss: 1.1891, test_f1: 0.5336
 epoch: 84, train_loss: 0.7055, test_loss: 1.3347, test_f1: 0.5238
 epoch: 85, train_loss: 0.6895, test_loss: 1.2573, test_f1: 0.5514
 epoch: 86, train_loss: 0.6853, test_loss: 1.2784, test_f1: 0.5375
 epoch: 87, train_loss: 0.6857, test_loss: 1.3265, test_f1: 0.4966
 epoch: 88, train_loss: 0.6931, test_loss: 1.2370, test_f1: 0.5193
 epoch: 89, train_loss: 0.6784, test_loss: 1.3752, test_f1: 0.5006
 epoch: 90, train_loss: 0.6926, test_loss: 1.0909, test_f1: 0.5709
 epoch: 91, train_loss: 0.6830, test_loss: 1.0755, test_f1: 0.5712
 epoch: 92, train_loss: 0.6818, test_loss: 1.4716, test_f1: 0.5329
 epoch: 93, train_loss: 0.6700, test_loss: 1.4969, test_f1: 0.5256
 epoch: 94, train_loss: 0.6570, test_loss: 1.6841, test_f1: 0.5097
 epoch: 95, train_loss: 0.6896, test_loss: 1.2671, test_f1: 0.5552
 epoch: 96, train_loss: 0.6684, test_loss: 1.3099, test_f1: 0.5040
 epoch: 97, train_loss: 0.6603, test_loss: 1.3802, test_f1: 0.5672
 epoch: 98, train_loss: 0.6631, test_loss: 1.4610, test_f1: 0.5266
 epoch: 99, train_loss: 0.6814, test_loss: 1.5501, test_f1: 0.5308
##################ITERATION #3 ****************************************
 epoch: 0, train_loss: 1.2826, test_loss: 1.1771, test_f1: 0.3249
 epoch: 1, train_loss: 1.1798, test_loss: 1.0817, test_f1: 0.4729
 epoch: 2, train_loss: 1.1293, test_loss: 1.0938, test_f1: 0.4343
 epoch: 3, train_loss: 1.0947, test_loss: 0.9741, test_f1: 0.5215
 epoch: 4, train_loss: 1.0624, test_loss: 0.9406, test_f1: 0.4654
 epoch: 5, train_loss: 1.0334, test_loss: 1.0058, test_f1: 0.4675
 epoch: 6, train_loss: 1.0151, test_loss: 0.9343, test_f1: 0.4850
 epoch: 7, train_loss: 0.9893, test_loss: 0.9902, test_f1: 0.4822
 epoch: 8, train_loss: 1.0430, test_loss: 0.9563, test_f1: 0.4569
 epoch: 9, train_loss: 1.0131, test_loss: 0.9584, test_f1: 0.5094
 epoch: 10, train_loss: 0.9928, test_loss: 0.9521, test_f1: 0.4804
 epoch: 11, train_loss: 0.9744, test_loss: 1.0211, test_f1: 0.5116
 epoch: 12, train_loss: 0.9766, test_loss: 1.0019, test_f1: 0.4892
 epoch: 13, train_loss: 0.9605, test_loss: 0.9805, test_f1: 0.4718
 epoch: 14, train_loss: 0.9551, test_loss: 0.9640, test_f1: 0.5195
 epoch: 15, train_loss: 0.9383, test_loss: 0.9522, test_f1: 0.4937
 epoch: 16, train_loss: 0.9515, test_loss: 0.9720, test_f1: 0.4608
 epoch: 17, train_loss: 0.9257, test_loss: 0.9919, test_f1: 0.5065
 epoch: 18, train_loss: 0.9248, test_loss: 1.0223, test_f1: 0.4874
 epoch: 19, train_loss: 0.9028, test_loss: 0.9702, test_f1: 0.4731
 epoch: 20, train_loss: 0.9021, test_loss: 0.9829, test_f1: 0.4982
 epoch: 21, train_loss: 0.9023, test_loss: 1.0281, test_f1: 0.4820
 epoch: 22, train_loss: 0.8865, test_loss: 0.9972, test_f1: 0.5295
 epoch: 23, train_loss: 0.8893, test_loss: 0.9687, test_f1: 0.4899
 epoch: 24, train_loss: 0.8920, test_loss: 0.9357, test_f1: 0.5039
 epoch: 25, train_loss: 0.8773, test_loss: 0.9968, test_f1: 0.5010
 epoch: 26, train_loss: 0.8792, test_loss: 0.9899, test_f1: 0.5395
 epoch: 27, train_loss: 0.8683, test_loss: 1.0698, test_f1: 0.4950
 epoch: 28, train_loss: 0.8648, test_loss: 1.0042, test_f1: 0.5607
 epoch: 29, train_loss: 0.8722, test_loss: 0.9933, test_f1: 0.5452
 epoch: 30, train_loss: 0.8622, test_loss: 1.0335, test_f1: 0.5338
 epoch: 31, train_loss: 0.8726, test_loss: 0.9676, test_f1: 0.5061
 epoch: 32, train_loss: 0.8508, test_loss: 0.9944, test_f1: 0.5246
 epoch: 33, train_loss: 0.8377, test_loss: 0.9590, test_f1: 0.5365
 epoch: 34, train_loss: 0.8539, test_loss: 1.0390, test_f1: 0.5301
 epoch: 35, train_loss: 0.8656, test_loss: 1.0273, test_f1: 0.4785
 epoch: 36, train_loss: 0.8556, test_loss: 1.0006, test_f1: 0.5093
 epoch: 37, train_loss: 0.8445, test_loss: 0.9772, test_f1: 0.5276
 epoch: 38, train_loss: 0.8470, test_loss: 0.9899, test_f1: 0.5197
 epoch: 39, train_loss: 0.8445, test_loss: 1.0666, test_f1: 0.4947
 epoch: 40, train_loss: 0.8253, test_loss: 1.0400, test_f1: 0.4910
 epoch: 41, train_loss: 0.8434, test_loss: 0.9720, test_f1: 0.5054
 epoch: 42, train_loss: 0.8270, test_loss: 1.0091, test_f1: 0.5410
 epoch: 43, train_loss: 0.8273, test_loss: 1.0370, test_f1: 0.5237
 epoch: 44, train_loss: 0.8457, test_loss: 1.1904, test_f1: 0.4842
 epoch: 45, train_loss: 0.8367, test_loss: 1.0480, test_f1: 0.5374
 epoch: 46, train_loss: 0.8571, test_loss: 1.0211, test_f1: 0.5285
 epoch: 47, train_loss: 0.8335, test_loss: 0.9934, test_f1: 0.5303
 epoch: 48, train_loss: 0.8462, test_loss: 1.0386, test_f1: 0.5173
 epoch: 49, train_loss: 0.8102, test_loss: 1.0172, test_f1: 0.5214
 epoch: 50, train_loss: 0.8221, test_loss: 1.0003, test_f1: 0.5335
 epoch: 51, train_loss: 0.7809, test_loss: 0.9587, test_f1: 0.5552
 epoch: 52, train_loss: 0.7837, test_loss: 1.0024, test_f1: 0.5401
 epoch: 53, train_loss: 0.7711, test_loss: 1.0219, test_f1: 0.5443
 epoch: 54, train_loss: 0.7625, test_loss: 0.9685, test_f1: 0.5458
 epoch: 55, train_loss: 0.7673, test_loss: 1.0083, test_f1: 0.5449
 epoch: 56, train_loss: 0.7619, test_loss: 1.0601, test_f1: 0.5016
 epoch: 57, train_loss: 0.7511, test_loss: 1.0052, test_f1: 0.5625
 epoch: 58, train_loss: 0.7448, test_loss: 1.0108, test_f1: 0.5539
 epoch: 59, train_loss: 0.7710, test_loss: 1.0922, test_f1: 0.4978
 epoch: 60, train_loss: 0.7544, test_loss: 0.9753, test_f1: 0.5369
 epoch: 61, train_loss: 0.7507, test_loss: 1.0147, test_f1: 0.5520
 epoch: 62, train_loss: 0.7490, test_loss: 1.0227, test_f1: 0.5569
 epoch: 63, train_loss: 0.7668, test_loss: 1.0049, test_f1: 0.5441
 epoch: 64, train_loss: 0.7465, test_loss: 1.0136, test_f1: 0.5472
 epoch: 65, train_loss: 0.7251, test_loss: 1.0191, test_f1: 0.5317
 epoch: 66, train_loss: 0.7386, test_loss: 1.0184, test_f1: 0.5534
 epoch: 67, train_loss: 0.7354, test_loss: 1.1149, test_f1: 0.5222
 epoch: 68, train_loss: 0.7458, test_loss: 1.0163, test_f1: 0.5529
 epoch: 69, train_loss: 0.7228, test_loss: 1.0310, test_f1: 0.5510
 epoch: 70, train_loss: 0.7296, test_loss: 1.1059, test_f1: 0.5642
 epoch: 71, train_loss: 0.7275, test_loss: 1.0298, test_f1: 0.5649
 epoch: 72, train_loss: 0.7234, test_loss: 1.1709, test_f1: 0.5007
 epoch: 73, train_loss: 0.7316, test_loss: 1.0074, test_f1: 0.5557
 epoch: 74, train_loss: 0.7284, test_loss: 1.0977, test_f1: 0.5395
 epoch: 75, train_loss: 0.7191, test_loss: 1.1212, test_f1: 0.4959
 epoch: 76, train_loss: 0.7306, test_loss: 1.0975, test_f1: 0.5346
 epoch: 77, train_loss: 0.7278, test_loss: 1.0932, test_f1: 0.5608
 epoch: 78, train_loss: 0.7383, test_loss: 0.9933, test_f1: 0.5562
 epoch: 79, train_loss: 0.7235, test_loss: 1.0090, test_f1: 0.5432
 epoch: 80, train_loss: 0.7262, test_loss: 1.0899, test_f1: 0.5483
 epoch: 81, train_loss: 0.7262, test_loss: 1.0727, test_f1: 0.5750
 epoch: 82, train_loss: 0.7222, test_loss: 1.0690, test_f1: 0.5691
 epoch: 83, train_loss: 0.7044, test_loss: 1.0394, test_f1: 0.5670
 epoch: 84, train_loss: 0.7102, test_loss: 1.1123, test_f1: 0.5538
 epoch: 85, train_loss: 0.7065, test_loss: 1.0432, test_f1: 0.5262
 epoch: 86, train_loss: 0.7053, test_loss: 1.1170, test_f1: 0.5487
 epoch: 87, train_loss: 0.7003, test_loss: 1.0934, test_f1: 0.5430
 epoch: 88, train_loss: 0.7114, test_loss: 1.0221, test_f1: 0.5158
 epoch: 89, train_loss: 0.7060, test_loss: 1.0053, test_f1: 0.5504
 epoch: 90, train_loss: 0.6937, test_loss: 1.0746, test_f1: 0.5812
 epoch: 91, train_loss: 0.6997, test_loss: 1.0633, test_f1: 0.5292
 epoch: 92, train_loss: 0.7082, test_loss: 0.9939, test_f1: 0.5759
 epoch: 93, train_loss: 0.6822, test_loss: 1.0276, test_f1: 0.5712
 epoch: 94, train_loss: 0.6938, test_loss: 1.0285, test_f1: 0.5908
 epoch: 95, train_loss: 0.6925, test_loss: 1.0464, test_f1: 0.5838
 epoch: 96, train_loss: 0.7006, test_loss: 1.0090, test_f1: 0.5849
 epoch: 97, train_loss: 0.6989, test_loss: 1.0637, test_f1: 0.5589
 epoch: 98, train_loss: 0.6843, test_loss: 1.0637, test_f1: 0.5659
 epoch: 99, train_loss: 0.7013, test_loss: 1.0722, test_f1: 0.5788
##################ITERATION #4 ****************************************
 epoch: 0, train_loss: 1.2833, test_loss: 1.1760, test_f1: 0.3904
 epoch: 1, train_loss: 1.1718, test_loss: 1.0932, test_f1: 0.4471
 epoch: 2, train_loss: 1.1052, test_loss: 1.0121, test_f1: 0.4946
 epoch: 3, train_loss: 1.0622, test_loss: 1.0020, test_f1: 0.4259
 epoch: 4, train_loss: 1.0332, test_loss: 1.0605, test_f1: 0.4797
 epoch: 5, train_loss: 1.0173, test_loss: 0.9746, test_f1: 0.4830
 epoch: 6, train_loss: 0.9924, test_loss: 1.0221, test_f1: 0.4964
 epoch: 7, train_loss: 0.9772, test_loss: 0.9869, test_f1: 0.4828
 epoch: 8, train_loss: 0.9718, test_loss: 1.0264, test_f1: 0.4630
 epoch: 9, train_loss: 0.9554, test_loss: 0.9618, test_f1: 0.4961
 epoch: 10, train_loss: 0.9559, test_loss: 0.9952, test_f1: 0.4712
 epoch: 11, train_loss: 0.9287, test_loss: 0.9881, test_f1: 0.4754
 epoch: 12, train_loss: 0.9256, test_loss: 0.9891, test_f1: 0.5135
 epoch: 13, train_loss: 0.9254, test_loss: 0.9747, test_f1: 0.4709
 epoch: 14, train_loss: 0.9104, test_loss: 0.9947, test_f1: 0.5191
 epoch: 15, train_loss: 0.9159, test_loss: 0.9976, test_f1: 0.5084
 epoch: 16, train_loss: 0.9049, test_loss: 0.9665, test_f1: 0.5289
 epoch: 17, train_loss: 0.9075, test_loss: 0.9774, test_f1: 0.4996
 epoch: 18, train_loss: 0.8969, test_loss: 0.9842, test_f1: 0.5195
 epoch: 19, train_loss: 0.8783, test_loss: 0.9994, test_f1: 0.4870
 epoch: 20, train_loss: 0.8888, test_loss: 0.9974, test_f1: 0.5418
 epoch: 21, train_loss: 0.8689, test_loss: 1.0191, test_f1: 0.5490
 epoch: 22, train_loss: 0.8734, test_loss: 0.9895, test_f1: 0.5127
 epoch: 23, train_loss: 0.8578, test_loss: 1.0144, test_f1: 0.5205
 epoch: 24, train_loss: 0.8634, test_loss: 1.2130, test_f1: 0.4619
 epoch: 25, train_loss: 0.8541, test_loss: 0.9829, test_f1: 0.5169
 epoch: 26, train_loss: 0.8447, test_loss: 1.0002, test_f1: 0.5632
 epoch: 27, train_loss: 0.8256, test_loss: 1.0851, test_f1: 0.5034
 epoch: 28, train_loss: 0.8532, test_loss: 1.0714, test_f1: 0.5269
 epoch: 29, train_loss: 0.8534, test_loss: 1.0599, test_f1: 0.5323
 epoch: 30, train_loss: 0.8425, test_loss: 1.1902, test_f1: 0.4795
 epoch: 31, train_loss: 0.8459, test_loss: 1.0173, test_f1: 0.5099
 epoch: 32, train_loss: 0.8388, test_loss: 1.0250, test_f1: 0.5390
 epoch: 33, train_loss: 0.8223, test_loss: 1.0057, test_f1: 0.5109
 epoch: 34, train_loss: 0.8218, test_loss: 1.0140, test_f1: 0.5479
 epoch: 35, train_loss: 0.8346, test_loss: 1.0854, test_f1: 0.5196
 epoch: 36, train_loss: 0.8008, test_loss: 1.0617, test_f1: 0.5315
 epoch: 37, train_loss: 0.8418, test_loss: 1.0347, test_f1: 0.5387
 epoch: 38, train_loss: 0.8295, test_loss: 1.0528, test_f1: 0.5275
 epoch: 39, train_loss: 0.8308, test_loss: 1.1754, test_f1: 0.5144
 epoch: 40, train_loss: 0.8233, test_loss: 1.0154, test_f1: 0.5328
 epoch: 41, train_loss: 0.8045, test_loss: 1.2797, test_f1: 0.5089
 epoch: 42, train_loss: 0.7963, test_loss: 1.2056, test_f1: 0.4592
 epoch: 43, train_loss: 0.8059, test_loss: 1.0720, test_f1: 0.5362
 epoch: 44, train_loss: 0.8119, test_loss: 1.0872, test_f1: 0.5467
 epoch: 45, train_loss: 0.8107, test_loss: 1.1738, test_f1: 0.5304
 epoch: 46, train_loss: 0.7869, test_loss: 1.1204, test_f1: 0.5560
 epoch: 47, train_loss: 0.7892, test_loss: 1.1700, test_f1: 0.5466
 epoch: 48, train_loss: 0.7721, test_loss: 1.1498, test_f1: 0.5468
 epoch: 49, train_loss: 0.7849, test_loss: 1.1236, test_f1: 0.5365
 epoch: 50, train_loss: 0.7755, test_loss: 1.1708, test_f1: 0.5546
 epoch: 51, train_loss: 0.7565, test_loss: 1.1695, test_f1: 0.5343
 epoch: 52, train_loss: 0.7433, test_loss: 1.3397, test_f1: 0.5520
 epoch: 53, train_loss: 0.7338, test_loss: 1.2068, test_f1: 0.5458
 epoch: 54, train_loss: 0.7266, test_loss: 1.2203, test_f1: 0.5241
 epoch: 55, train_loss: 0.7386, test_loss: 1.1448, test_f1: 0.5282
 epoch: 56, train_loss: 0.7229, test_loss: 1.1509, test_f1: 0.5771
 epoch: 57, train_loss: 0.7242, test_loss: 1.1357, test_f1: 0.5656
 epoch: 58, train_loss: 0.7208, test_loss: 1.1931, test_f1: 0.5622
 epoch: 59, train_loss: 0.7098, test_loss: 1.1476, test_f1: 0.5788
 epoch: 60, train_loss: 0.7132, test_loss: 1.2322, test_f1: 0.5433
 epoch: 61, train_loss: 0.7125, test_loss: 1.1696, test_f1: 0.5591
 epoch: 62, train_loss: 0.7053, test_loss: 1.1706, test_f1: 0.5615
 epoch: 63, train_loss: 0.6928, test_loss: 1.4206, test_f1: 0.5210
 epoch: 64, train_loss: 0.7054, test_loss: 1.1902, test_f1: 0.5696
 epoch: 65, train_loss: 0.6935, test_loss: 1.1896, test_f1: 0.5421
 epoch: 66, train_loss: 0.6818, test_loss: 1.2293, test_f1: 0.5702
 epoch: 67, train_loss: 0.7131, test_loss: 1.2167, test_f1: 0.5587
 epoch: 68, train_loss: 0.7086, test_loss: 1.1720, test_f1: 0.5693
 epoch: 69, train_loss: 0.6975, test_loss: 1.4786, test_f1: 0.5446
 epoch: 70, train_loss: 0.6843, test_loss: 1.4449, test_f1: 0.5526
 epoch: 71, train_loss: 0.6891, test_loss: 1.3053, test_f1: 0.5775
 epoch: 72, train_loss: 0.6929, test_loss: 1.3849, test_f1: 0.5314
 epoch: 73, train_loss: 0.6831, test_loss: 1.4579, test_f1: 0.5234
 epoch: 74, train_loss: 0.6800, test_loss: 1.4886, test_f1: 0.5570
 epoch: 75, train_loss: 0.6760, test_loss: 1.2537, test_f1: 0.5521
 epoch: 76, train_loss: 0.6762, test_loss: 1.2394, test_f1: 0.5756
 epoch: 77, train_loss: 0.6681, test_loss: 1.2240, test_f1: 0.5705
 epoch: 78, train_loss: 0.6636, test_loss: 1.2812, test_f1: 0.5522
 epoch: 79, train_loss: 0.6701, test_loss: 1.2583, test_f1: 0.5696
 epoch: 80, train_loss: 0.6620, test_loss: 1.3340, test_f1: 0.5848
 epoch: 81, train_loss: 0.6721, test_loss: 1.3121, test_f1: 0.5628
 epoch: 82, train_loss: 0.6785, test_loss: 1.1831, test_f1: 0.5595
 epoch: 83, train_loss: 0.6659, test_loss: 1.3039, test_f1: 0.5559
 epoch: 84, train_loss: 0.6666, test_loss: 1.3686, test_f1: 0.5789
 epoch: 85, train_loss: 0.6514, test_loss: 1.3461, test_f1: 0.5633
 epoch: 86, train_loss: 0.6558, test_loss: 1.4396, test_f1: 0.5246
 epoch: 87, train_loss: 0.6692, test_loss: 1.2568, test_f1: 0.5668
 epoch: 88, train_loss: 0.6431, test_loss: 1.3491, test_f1: 0.5761
 epoch: 89, train_loss: 0.6549, test_loss: 1.1953, test_f1: 0.5737
 epoch: 90, train_loss: 0.6415, test_loss: 1.2359, test_f1: 0.5694
 epoch: 91, train_loss: 0.6522, test_loss: 1.3030, test_f1: 0.5974
 epoch: 92, train_loss: 0.6394, test_loss: 1.1885, test_f1: 0.5901
 epoch: 93, train_loss: 0.6617, test_loss: 1.2537, test_f1: 0.5472
 epoch: 94, train_loss: 0.6890, test_loss: 1.1948, test_f1: 0.5838
 epoch: 95, train_loss: 0.6576, test_loss: 1.2562, test_f1: 0.5701
 epoch: 96, train_loss: 0.6366, test_loss: 1.2881, test_f1: 0.5463
 epoch: 97, train_loss: 0.6574, test_loss: 1.2128, test_f1: 0.5475
 epoch: 98, train_loss: 0.6357, test_loss: 1.2405, test_f1: 0.5853
 epoch: 99, train_loss: 0.6276, test_loss: 1.4676, test_f1: 0.5715
##################ITERATION #5 ****************************************
 epoch: 0, train_loss: 1.2908, test_loss: 1.2666, test_f1: 0.3129
 epoch: 1, train_loss: 1.2494, test_loss: 1.1977, test_f1: 0.3349
 epoch: 2, train_loss: 1.2113, test_loss: 1.1638, test_f1: 0.3609
 epoch: 3, train_loss: 1.1753, test_loss: 1.0926, test_f1: 0.4406
 epoch: 4, train_loss: 1.1351, test_loss: 1.1320, test_f1: 0.4342
 epoch: 5, train_loss: 1.0925, test_loss: 0.9705, test_f1: 0.4567
 epoch: 6, train_loss: 1.0664, test_loss: 0.9849, test_f1: 0.4556
 epoch: 7, train_loss: 1.0345, test_loss: 1.0096, test_f1: 0.4667
 epoch: 8, train_loss: 1.0228, test_loss: 1.1593, test_f1: 0.4419
 epoch: 9, train_loss: 1.0032, test_loss: 1.0230, test_f1: 0.4713
 epoch: 10, train_loss: 0.9949, test_loss: 1.0945, test_f1: 0.4770
 epoch: 11, train_loss: 0.9720, test_loss: 0.9775, test_f1: 0.4783
 epoch: 12, train_loss: 0.9966, test_loss: 0.9940, test_f1: 0.4892
 epoch: 13, train_loss: 0.9706, test_loss: 0.9579, test_f1: 0.4797
 epoch: 14, train_loss: 0.9746, test_loss: 1.0239, test_f1: 0.4917
 epoch: 15, train_loss: 0.9642, test_loss: 1.0451, test_f1: 0.5054
 epoch: 16, train_loss: 0.9441, test_loss: 1.1134, test_f1: 0.4827
 epoch: 17, train_loss: 0.9653, test_loss: 1.0629, test_f1: 0.4856
 epoch: 18, train_loss: 0.9543, test_loss: 0.9975, test_f1: 0.4757
 epoch: 19, train_loss: 0.9308, test_loss: 1.0181, test_f1: 0.4478
 epoch: 20, train_loss: 0.9185, test_loss: 1.0590, test_f1: 0.4888
 epoch: 21, train_loss: 0.9392, test_loss: 1.0269, test_f1: 0.4895
 epoch: 22, train_loss: 0.9144, test_loss: 1.0110, test_f1: 0.4727
 epoch: 23, train_loss: 0.9116, test_loss: 1.1567, test_f1: 0.4577
 epoch: 24, train_loss: 0.9027, test_loss: 1.0671, test_f1: 0.5075
 epoch: 25, train_loss: 0.9021, test_loss: 1.0370, test_f1: 0.4885
 epoch: 26, train_loss: 0.9030, test_loss: 1.1069, test_f1: 0.4854
 epoch: 27, train_loss: 0.8977, test_loss: 1.0890, test_f1: 0.4763
 epoch: 28, train_loss: 0.8951, test_loss: 1.0122, test_f1: 0.5079
 epoch: 29, train_loss: 0.8850, test_loss: 1.1261, test_f1: 0.5229
 epoch: 30, train_loss: 0.8609, test_loss: 1.0548, test_f1: 0.5020
 epoch: 31, train_loss: 0.8738, test_loss: 1.0017, test_f1: 0.4923
 epoch: 32, train_loss: 0.8576, test_loss: 1.0860, test_f1: 0.5089
 epoch: 33, train_loss: 0.8618, test_loss: 1.0747, test_f1: 0.5240
 epoch: 34, train_loss: 0.8637, test_loss: 1.0627, test_f1: 0.5063
 epoch: 35, train_loss: 0.8536, test_loss: 1.1863, test_f1: 0.4629
 epoch: 36, train_loss: 0.8654, test_loss: 1.0660, test_f1: 0.5204
 epoch: 37, train_loss: 0.8466, test_loss: 1.0597, test_f1: 0.5788
 epoch: 38, train_loss: 0.8362, test_loss: 1.0507, test_f1: 0.5046
 epoch: 39, train_loss: 0.8623, test_loss: 0.9704, test_f1: 0.5221
 epoch: 40, train_loss: 0.8387, test_loss: 1.0174, test_f1: 0.4883
 epoch: 41, train_loss: 0.8507, test_loss: 1.0200, test_f1: 0.4708
 epoch: 42, train_loss: 0.8245, test_loss: 0.9900, test_f1: 0.4983
 epoch: 43, train_loss: 0.8228, test_loss: 1.0361, test_f1: 0.4890
 epoch: 44, train_loss: 0.8410, test_loss: 1.0871, test_f1: 0.5010
 epoch: 45, train_loss: 0.8386, test_loss: 1.0438, test_f1: 0.5002
 epoch: 46, train_loss: 0.8251, test_loss: 1.0685, test_f1: 0.5046
 epoch: 47, train_loss: 0.8148, test_loss: 1.0320, test_f1: 0.5052
 epoch: 48, train_loss: 0.8047, test_loss: 1.0503, test_f1: 0.5114
 epoch: 49, train_loss: 0.8180, test_loss: 1.1278, test_f1: 0.4984
 epoch: 50, train_loss: 0.8266, test_loss: 1.0813, test_f1: 0.4773
 epoch: 51, train_loss: 0.8074, test_loss: 1.0034, test_f1: 0.5276
 epoch: 52, train_loss: 0.7879, test_loss: 1.0070, test_f1: 0.5247
 epoch: 53, train_loss: 0.7768, test_loss: 1.0348, test_f1: 0.5470
 epoch: 54, train_loss: 0.7850, test_loss: 0.9969, test_f1: 0.5135
 epoch: 55, train_loss: 0.7775, test_loss: 1.0499, test_f1: 0.5073
 epoch: 56, train_loss: 0.7718, test_loss: 1.0362, test_f1: 0.5345
 epoch: 57, train_loss: 0.7672, test_loss: 1.0005, test_f1: 0.5331
 epoch: 58, train_loss: 0.7654, test_loss: 0.9961, test_f1: 0.5322
 epoch: 59, train_loss: 0.7624, test_loss: 1.0076, test_f1: 0.5310
 epoch: 60, train_loss: 0.7604, test_loss: 1.0058, test_f1: 0.5017
 epoch: 61, train_loss: 0.7688, test_loss: 0.9363, test_f1: 0.5463
 epoch: 62, train_loss: 0.7563, test_loss: 1.0259, test_f1: 0.5401
 epoch: 63, train_loss: 0.7654, test_loss: 1.0524, test_f1: 0.5108
 epoch: 64, train_loss: 0.7682, test_loss: 1.0700, test_f1: 0.5315
 epoch: 65, train_loss: 0.7530, test_loss: 0.9976, test_f1: 0.5423
 epoch: 66, train_loss: 0.7422, test_loss: 1.1030, test_f1: 0.5274
 epoch: 67, train_loss: 0.7506, test_loss: 1.0093, test_f1: 0.5334
 epoch: 68, train_loss: 0.7320, test_loss: 1.0169, test_f1: 0.5516
 epoch: 69, train_loss: 0.7421, test_loss: 1.0910, test_f1: 0.5126
 epoch: 70, train_loss: 0.7408, test_loss: 1.0135, test_f1: 0.5208
 epoch: 71, train_loss: 0.7530, test_loss: 1.0498, test_f1: 0.5443
 epoch: 72, train_loss: 0.7445, test_loss: 1.0301, test_f1: 0.5401
 epoch: 73, train_loss: 0.7382, test_loss: 0.9968, test_f1: 0.5274
 epoch: 74, train_loss: 0.7324, test_loss: 1.0118, test_f1: 0.5022
 epoch: 75, train_loss: 0.7429, test_loss: 1.0164, test_f1: 0.5440
 epoch: 76, train_loss: 0.7280, test_loss: 0.9957, test_f1: 0.5502
 epoch: 77, train_loss: 0.7469, test_loss: 0.9967, test_f1: 0.5508
 epoch: 78, train_loss: 0.7289, test_loss: 0.9957, test_f1: 0.5442
 epoch: 79, train_loss: 0.7288, test_loss: 1.0575, test_f1: 0.5264
 epoch: 80, train_loss: 0.7356, test_loss: 1.0654, test_f1: 0.5409
 epoch: 81, train_loss: 0.7421, test_loss: 0.9850, test_f1: 0.5473
 epoch: 82, train_loss: 0.7228, test_loss: 1.0091, test_f1: 0.5297
 epoch: 83, train_loss: 0.7322, test_loss: 0.9976, test_f1: 0.5739
 epoch: 84, train_loss: 0.7295, test_loss: 1.0713, test_f1: 0.5356
 epoch: 85, train_loss: 0.7085, test_loss: 1.1037, test_f1: 0.5109
 epoch: 86, train_loss: 0.7083, test_loss: 1.0731, test_f1: 0.5275
 epoch: 87, train_loss: 0.7077, test_loss: 1.0116, test_f1: 0.5713
 epoch: 88, train_loss: 0.7278, test_loss: 1.0818, test_f1: 0.5342
 epoch: 89, train_loss: 0.7138, test_loss: 1.0837, test_f1: 0.5295
 epoch: 90, train_loss: 0.6963, test_loss: 1.3362, test_f1: 0.4825
 epoch: 91, train_loss: 0.6958, test_loss: 1.1003, test_f1: 0.5208
 epoch: 92, train_loss: 0.7320, test_loss: 1.1345, test_f1: 0.5620
 epoch: 93, train_loss: 0.7154, test_loss: 1.0498, test_f1: 0.5301
 epoch: 94, train_loss: 0.7120, test_loss: 1.1136, test_f1: 0.5606
 epoch: 95, train_loss: 0.7231, test_loss: 1.3919, test_f1: 0.5368
 epoch: 96, train_loss: 0.7103, test_loss: 1.1254, test_f1: 0.5439
 epoch: 97, train_loss: 0.7187, test_loss: 1.0803, test_f1: 0.5789
 epoch: 98, train_loss: 0.6913, test_loss: 1.1222, test_f1: 0.5742
 epoch: 99, train_loss: 0.7038, test_loss: 1.1014, test_f1: 0.5348
##################ITERATION #6 ****************************************
 epoch: 0, train_loss: 1.3022, test_loss: 1.2436, test_f1: 0.2654
 epoch: 1, train_loss: 1.2191, test_loss: 1.1607, test_f1: 0.3854
 epoch: 2, train_loss: 1.1879, test_loss: 1.1122, test_f1: 0.4291
 epoch: 3, train_loss: 1.1395, test_loss: 1.1097, test_f1: 0.3885
 epoch: 4, train_loss: 1.1087, test_loss: 0.9894, test_f1: 0.4719
 epoch: 5, train_loss: 1.0650, test_loss: 0.9576, test_f1: 0.4621
 epoch: 6, train_loss: 1.0423, test_loss: 1.1150, test_f1: 0.4010
 epoch: 7, train_loss: 1.0269, test_loss: 0.9833, test_f1: 0.4868
 epoch: 8, train_loss: 1.0027, test_loss: 1.0261, test_f1: 0.4745
 epoch: 9, train_loss: 0.9849, test_loss: 1.0204, test_f1: 0.4874
 epoch: 10, train_loss: 0.9683, test_loss: 0.9331, test_f1: 0.4983
 epoch: 11, train_loss: 0.9534, test_loss: 0.9878, test_f1: 0.5083
 epoch: 12, train_loss: 0.9452, test_loss: 1.0305, test_f1: 0.4550
 epoch: 13, train_loss: 0.9395, test_loss: 1.0379, test_f1: 0.4911
 epoch: 14, train_loss: 0.9414, test_loss: 1.0431, test_f1: 0.4849
 epoch: 15, train_loss: 0.9299, test_loss: 0.9565, test_f1: 0.5126
 epoch: 16, train_loss: 0.9171, test_loss: 0.9598, test_f1: 0.5340
 epoch: 17, train_loss: 0.9121, test_loss: 1.0640, test_f1: 0.4564
 epoch: 18, train_loss: 0.9142, test_loss: 1.0207, test_f1: 0.5275
 epoch: 19, train_loss: 0.9023, test_loss: 0.9837, test_f1: 0.5123
 epoch: 20, train_loss: 0.8948, test_loss: 0.9769, test_f1: 0.5081
 epoch: 21, train_loss: 0.9146, test_loss: 0.9735, test_f1: 0.5356
 epoch: 22, train_loss: 0.8936, test_loss: 1.0105, test_f1: 0.4956
 epoch: 23, train_loss: 0.8753, test_loss: 1.0996, test_f1: 0.4762
 epoch: 24, train_loss: 0.8633, test_loss: 1.0050, test_f1: 0.5050
 epoch: 25, train_loss: 0.8674, test_loss: 0.9591, test_f1: 0.5242
 epoch: 26, train_loss: 0.8810, test_loss: 1.1532, test_f1: 0.4941
 epoch: 27, train_loss: 0.8755, test_loss: 1.0254, test_f1: 0.5005
 epoch: 28, train_loss: 0.8665, test_loss: 1.0124, test_f1: 0.5167
 epoch: 29, train_loss: 0.8721, test_loss: 1.0122, test_f1: 0.5438
 epoch: 30, train_loss: 0.8700, test_loss: 0.9518, test_f1: 0.5184
 epoch: 31, train_loss: 0.8707, test_loss: 1.0016, test_f1: 0.5315
 epoch: 32, train_loss: 0.8549, test_loss: 0.9815, test_f1: 0.5407
 epoch: 33, train_loss: 0.8482, test_loss: 0.9936, test_f1: 0.5252
 epoch: 34, train_loss: 0.8464, test_loss: 1.0230, test_f1: 0.5429
 epoch: 35, train_loss: 0.8473, test_loss: 1.0166, test_f1: 0.5210
 epoch: 36, train_loss: 0.8497, test_loss: 1.0096, test_f1: 0.5368
 epoch: 37, train_loss: 0.8389, test_loss: 0.9815, test_f1: 0.5486
 epoch: 38, train_loss: 0.8322, test_loss: 0.9688, test_f1: 0.5463
 epoch: 39, train_loss: 0.8296, test_loss: 0.9562, test_f1: 0.5531
 epoch: 40, train_loss: 0.8320, test_loss: 1.0285, test_f1: 0.5185
 epoch: 41, train_loss: 0.8406, test_loss: 0.9683, test_f1: 0.5346
 epoch: 42, train_loss: 0.8434, test_loss: 0.9989, test_f1: 0.5167
 epoch: 43, train_loss: 0.8360, test_loss: 1.0033, test_f1: 0.5413
 epoch: 44, train_loss: 0.8449, test_loss: 0.9877, test_f1: 0.5120
 epoch: 45, train_loss: 0.8411, test_loss: 1.0523, test_f1: 0.5232
 epoch: 46, train_loss: 0.8341, test_loss: 1.0564, test_f1: 0.5387
 epoch: 47, train_loss: 0.8222, test_loss: 1.1077, test_f1: 0.5176
 epoch: 48, train_loss: 0.8232, test_loss: 0.9326, test_f1: 0.5429
 epoch: 49, train_loss: 0.8187, test_loss: 0.9888, test_f1: 0.5360
 epoch: 50, train_loss: 0.8177, test_loss: 1.0274, test_f1: 0.5322
 epoch: 51, train_loss: 0.7895, test_loss: 0.9406, test_f1: 0.5378
 epoch: 52, train_loss: 0.7807, test_loss: 1.0104, test_f1: 0.5322
 epoch: 53, train_loss: 0.7686, test_loss: 0.9839, test_f1: 0.5509
 epoch: 54, train_loss: 0.7481, test_loss: 1.0465, test_f1: 0.5325
 epoch: 55, train_loss: 0.7444, test_loss: 1.0169, test_f1: 0.5479
 epoch: 56, train_loss: 0.7523, test_loss: 1.0105, test_f1: 0.5598
 epoch: 57, train_loss: 0.7479, test_loss: 0.9863, test_f1: 0.5554
 epoch: 58, train_loss: 0.7705, test_loss: 0.9897, test_f1: 0.5549
 epoch: 59, train_loss: 0.7470, test_loss: 0.9934, test_f1: 0.5593
 epoch: 60, train_loss: 0.7522, test_loss: 1.0140, test_f1: 0.5768
 epoch: 61, train_loss: 0.7483, test_loss: 1.1674, test_f1: 0.5083
 epoch: 62, train_loss: 0.7364, test_loss: 0.9853, test_f1: 0.5593
 epoch: 63, train_loss: 0.7440, test_loss: 1.0348, test_f1: 0.5493
 epoch: 64, train_loss: 0.7339, test_loss: 0.9878, test_f1: 0.5701
 epoch: 65, train_loss: 0.7338, test_loss: 1.1819, test_f1: 0.5268
 epoch: 66, train_loss: 0.7281, test_loss: 1.0333, test_f1: 0.5569
 epoch: 67, train_loss: 0.7178, test_loss: 1.0316, test_f1: 0.5607
 epoch: 68, train_loss: 0.7249, test_loss: 1.0555, test_f1: 0.5208
 epoch: 69, train_loss: 0.7267, test_loss: 1.0314, test_f1: 0.5501
 epoch: 70, train_loss: 0.7249, test_loss: 1.0406, test_f1: 0.5236
 epoch: 71, train_loss: 0.7299, test_loss: 1.2028, test_f1: 0.5415
 epoch: 72, train_loss: 0.7449, test_loss: 0.9967, test_f1: 0.5661
 epoch: 73, train_loss: 0.7286, test_loss: 1.0146, test_f1: 0.5555
 epoch: 74, train_loss: 0.7057, test_loss: 1.0220, test_f1: 0.5619
 epoch: 75, train_loss: 0.7133, test_loss: 1.0653, test_f1: 0.5626
 epoch: 76, train_loss: 0.7040, test_loss: 0.9860, test_f1: 0.5743
 epoch: 77, train_loss: 0.7263, test_loss: 1.1467, test_f1: 0.5447
 epoch: 78, train_loss: 0.7150, test_loss: 1.0451, test_f1: 0.5597
 epoch: 79, train_loss: 0.7033, test_loss: 1.0326, test_f1: 0.5573
 epoch: 80, train_loss: 0.7112, test_loss: 1.1832, test_f1: 0.5022
 epoch: 81, train_loss: 0.7185, test_loss: 1.1047, test_f1: 0.5570
 epoch: 82, train_loss: 0.7065, test_loss: 1.0688, test_f1: 0.5642
 epoch: 83, train_loss: 0.6960, test_loss: 1.1150, test_f1: 0.5419
 epoch: 84, train_loss: 0.6958, test_loss: 1.0630, test_f1: 0.5481
 epoch: 85, train_loss: 0.6972, test_loss: 1.0986, test_f1: 0.5746
 epoch: 86, train_loss: 0.6875, test_loss: 1.1936, test_f1: 0.5628
 epoch: 87, train_loss: 0.6986, test_loss: 1.1147, test_f1: 0.5411
 epoch: 88, train_loss: 0.7009, test_loss: 1.1634, test_f1: 0.5380
 epoch: 89, train_loss: 0.6942, test_loss: 1.1434, test_f1: 0.5698
 epoch: 90, train_loss: 0.6895, test_loss: 1.1279, test_f1: 0.5510
 epoch: 91, train_loss: 0.6767, test_loss: 1.1625, test_f1: 0.5643
 epoch: 92, train_loss: 0.6791, test_loss: 1.1522, test_f1: 0.5765
 epoch: 93, train_loss: 0.6921, test_loss: 1.1788, test_f1: 0.5518
 epoch: 94, train_loss: 0.6646, test_loss: 1.2354, test_f1: 0.5530
 epoch: 95, train_loss: 0.6657, test_loss: 1.1685, test_f1: 0.5546
 epoch: 96, train_loss: 0.6817, test_loss: 1.1254, test_f1: 0.5513
 epoch: 97, train_loss: 0.6796, test_loss: 1.1605, test_f1: 0.5598
 epoch: 98, train_loss: 0.6855, test_loss: 1.1820, test_f1: 0.5555
 epoch: 99, train_loss: 0.6566, test_loss: 1.2462, test_f1: 0.5525
##################ITERATION #7 ****************************************
 epoch: 0, train_loss: 1.2949, test_loss: 1.2884, test_f1: 0.2538
 epoch: 1, train_loss: 1.2270, test_loss: 1.1394, test_f1: 0.3898
 epoch: 2, train_loss: 1.1732, test_loss: 1.1362, test_f1: 0.4088
 epoch: 3, train_loss: 1.1323, test_loss: 1.0120, test_f1: 0.4677
 epoch: 4, train_loss: 1.1090, test_loss: 1.1041, test_f1: 0.4290
 epoch: 5, train_loss: 1.0682, test_loss: 1.0182, test_f1: 0.4708
 epoch: 6, train_loss: 1.0566, test_loss: 0.9845, test_f1: 0.4662
 epoch: 7, train_loss: 1.0209, test_loss: 1.0633, test_f1: 0.4674
 epoch: 8, train_loss: 1.0194, test_loss: 1.0532, test_f1: 0.4692
 epoch: 9, train_loss: 1.0057, test_loss: 1.0381, test_f1: 0.4506
 epoch: 10, train_loss: 0.9788, test_loss: 1.0063, test_f1: 0.4740
 epoch: 11, train_loss: 0.9771, test_loss: 0.9839, test_f1: 0.4976
 epoch: 12, train_loss: 0.9590, test_loss: 1.0261, test_f1: 0.4959
 epoch: 13, train_loss: 0.9499, test_loss: 0.9946, test_f1: 0.5182
 epoch: 14, train_loss: 0.9523, test_loss: 0.9815, test_f1: 0.5239
 epoch: 15, train_loss: 0.9589, test_loss: 0.9546, test_f1: 0.4984
 epoch: 16, train_loss: 0.9372, test_loss: 0.9816, test_f1: 0.5402
 epoch: 17, train_loss: 0.9165, test_loss: 1.0285, test_f1: 0.4846
 epoch: 18, train_loss: 0.9185, test_loss: 0.9990, test_f1: 0.4994
 epoch: 19, train_loss: 0.9265, test_loss: 0.9761, test_f1: 0.5020
 epoch: 20, train_loss: 0.9134, test_loss: 1.0209, test_f1: 0.4641
 epoch: 21, train_loss: 0.9067, test_loss: 1.0121, test_f1: 0.5068
 epoch: 22, train_loss: 0.9105, test_loss: 0.9892, test_f1: 0.4958
 epoch: 23, train_loss: 0.8980, test_loss: 0.9874, test_f1: 0.4951
 epoch: 24, train_loss: 0.8828, test_loss: 0.9527, test_f1: 0.5020
 epoch: 25, train_loss: 0.8841, test_loss: 0.9764, test_f1: 0.4852
 epoch: 26, train_loss: 0.8977, test_loss: 2.3487, test_f1: 0.3778
 epoch: 27, train_loss: 0.8840, test_loss: 0.9481, test_f1: 0.5115
 epoch: 28, train_loss: 0.8710, test_loss: 0.9878, test_f1: 0.5065
 epoch: 29, train_loss: 0.8840, test_loss: 1.0000, test_f1: 0.5128
 epoch: 30, train_loss: 0.8745, test_loss: 0.9323, test_f1: 0.5395
 epoch: 31, train_loss: 0.8697, test_loss: 0.9920, test_f1: 0.5168
 epoch: 32, train_loss: 0.8832, test_loss: 0.9695, test_f1: 0.4921
 epoch: 33, train_loss: 0.8533, test_loss: 0.9240, test_f1: 0.5639
 epoch: 34, train_loss: 0.8476, test_loss: 0.9677, test_f1: 0.4819
 epoch: 35, train_loss: 0.8421, test_loss: 0.9894, test_f1: 0.4803
 epoch: 36, train_loss: 0.8423, test_loss: 0.9694, test_f1: 0.5150
 epoch: 37, train_loss: 0.8293, test_loss: 0.9794, test_f1: 0.5039
 epoch: 38, train_loss: 0.8377, test_loss: 0.9461, test_f1: 0.5268
 epoch: 39, train_loss: 0.8407, test_loss: 0.9272, test_f1: 0.5401
 epoch: 40, train_loss: 0.8279, test_loss: 1.0101, test_f1: 0.5291
 epoch: 41, train_loss: 0.8357, test_loss: 0.9549, test_f1: 0.5478
 epoch: 42, train_loss: 0.8278, test_loss: 0.9954, test_f1: 0.5249
 epoch: 43, train_loss: 0.8286, test_loss: 1.0164, test_f1: 0.5308
 epoch: 44, train_loss: 0.8182, test_loss: 0.9899, test_f1: 0.5598
 epoch: 45, train_loss: 0.8309, test_loss: 0.9935, test_f1: 0.5527
 epoch: 46, train_loss: 0.8146, test_loss: 1.0754, test_f1: 0.4929
 epoch: 47, train_loss: 0.8192, test_loss: 0.9763, test_f1: 0.5577
 epoch: 48, train_loss: 0.8226, test_loss: 0.9620, test_f1: 0.5424
 epoch: 49, train_loss: 0.8068, test_loss: 1.0214, test_f1: 0.5080
 epoch: 50, train_loss: 0.8076, test_loss: 0.9940, test_f1: 0.5544
 epoch: 51, train_loss: 0.7785, test_loss: 1.0320, test_f1: 0.5159
 epoch: 52, train_loss: 0.7692, test_loss: 0.9727, test_f1: 0.5642
 epoch: 53, train_loss: 0.7567, test_loss: 1.1708, test_f1: 0.5166
 epoch: 54, train_loss: 0.7400, test_loss: 1.0703, test_f1: 0.5455
 epoch: 55, train_loss: 0.7495, test_loss: 1.0756, test_f1: 0.5490
 epoch: 56, train_loss: 0.7513, test_loss: 1.0285, test_f1: 0.5549
 epoch: 57, train_loss: 0.7515, test_loss: 1.0685, test_f1: 0.5383
 epoch: 58, train_loss: 0.7427, test_loss: 1.0474, test_f1: 0.5563
 epoch: 59, train_loss: 0.7443, test_loss: 1.2765, test_f1: 0.5134
 epoch: 60, train_loss: 0.7533, test_loss: 1.0772, test_f1: 0.5128
 epoch: 61, train_loss: 0.7371, test_loss: 1.0940, test_f1: 0.5217
 epoch: 62, train_loss: 0.7502, test_loss: 1.2872, test_f1: 0.4980
 epoch: 63, train_loss: 0.7559, test_loss: 1.0782, test_f1: 0.5160
 epoch: 64, train_loss: 0.7266, test_loss: 1.0445, test_f1: 0.5380
 epoch: 65, train_loss: 0.7353, test_loss: 1.0994, test_f1: 0.5457
 epoch: 66, train_loss: 0.7269, test_loss: 1.0919, test_f1: 0.5416
 epoch: 67, train_loss: 0.7288, test_loss: 1.1334, test_f1: 0.5527
 epoch: 68, train_loss: 0.7280, test_loss: 1.1259, test_f1: 0.5304
 epoch: 69, train_loss: 0.7166, test_loss: 1.2036, test_f1: 0.5404
 epoch: 70, train_loss: 0.7146, test_loss: 1.1482, test_f1: 0.5384
 epoch: 71, train_loss: 0.7172, test_loss: 1.1726, test_f1: 0.5357
 epoch: 72, train_loss: 0.7223, test_loss: 1.1021, test_f1: 0.5581
 epoch: 73, train_loss: 0.7189, test_loss: 1.0895, test_f1: 0.5440
 epoch: 74, train_loss: 0.7098, test_loss: 1.1155, test_f1: 0.5389
 epoch: 75, train_loss: 0.7070, test_loss: 1.0983, test_f1: 0.5506
 epoch: 76, train_loss: 0.7128, test_loss: 1.3898, test_f1: 0.5416
 epoch: 77, train_loss: 0.7005, test_loss: 1.2697, test_f1: 0.5313
 epoch: 78, train_loss: 0.6987, test_loss: 1.1169, test_f1: 0.5496
 epoch: 79, train_loss: 0.6920, test_loss: 1.1442, test_f1: 0.5312
 epoch: 80, train_loss: 0.6975, test_loss: 1.3607, test_f1: 0.5339
 epoch: 81, train_loss: 0.7006, test_loss: 1.3601, test_f1: 0.5306
 epoch: 82, train_loss: 0.7093, test_loss: 1.1686, test_f1: 0.5687
 epoch: 83, train_loss: 0.7130, test_loss: 1.2198, test_f1: 0.5361
 epoch: 84, train_loss: 0.6994, test_loss: 1.1410, test_f1: 0.5341
 epoch: 85, train_loss: 0.6820, test_loss: 1.1711, test_f1: 0.5610
 epoch: 86, train_loss: 0.7097, test_loss: 1.4000, test_f1: 0.5410
 epoch: 87, train_loss: 0.6848, test_loss: 1.2039, test_f1: 0.5554
 epoch: 88, train_loss: 0.6823, test_loss: 1.1572, test_f1: 0.5639
 epoch: 89, train_loss: 0.6870, test_loss: 1.1772, test_f1: 0.5397
 epoch: 90, train_loss: 0.6861, test_loss: 1.1895, test_f1: 0.5423
 epoch: 91, train_loss: 0.6830, test_loss: 1.1435, test_f1: 0.5716
 epoch: 92, train_loss: 0.6797, test_loss: 1.2328, test_f1: 0.5279
 epoch: 93, train_loss: 0.6859, test_loss: 1.3996, test_f1: 0.5276
 epoch: 94, train_loss: 0.6900, test_loss: 1.0320, test_f1: 0.5286
 epoch: 95, train_loss: 0.6742, test_loss: 1.2145, test_f1: 0.5238
 epoch: 96, train_loss: 0.6693, test_loss: 1.1428, test_f1: 0.5681
 epoch: 97, train_loss: 0.6688, test_loss: 1.1681, test_f1: 0.5789
 epoch: 98, train_loss: 0.6699, test_loss: 1.1190, test_f1: 0.5494
 epoch: 99, train_loss: 0.6651, test_loss: 1.0707, test_f1: 0.5742
##################ITERATION #8 ****************************************
 epoch: 0, train_loss: 1.3009, test_loss: 1.2589, test_f1: 0.3103
 epoch: 1, train_loss: 1.2489, test_loss: 1.2217, test_f1: 0.3100
 epoch: 2, train_loss: 1.2167, test_loss: 1.1837, test_f1: 0.3260
 epoch: 3, train_loss: 1.2038, test_loss: 1.1792, test_f1: 0.3489
 epoch: 4, train_loss: 1.1883, test_loss: 1.1785, test_f1: 0.3259
 epoch: 5, train_loss: 1.1569, test_loss: 1.0841, test_f1: 0.4408
 epoch: 6, train_loss: 1.0962, test_loss: 1.0424, test_f1: 0.4183
 epoch: 7, train_loss: 1.0457, test_loss: 0.9407, test_f1: 0.4832
 epoch: 8, train_loss: 1.0168, test_loss: 0.9767, test_f1: 0.4685
 epoch: 9, train_loss: 0.9958, test_loss: 1.1187, test_f1: 0.4870
 epoch: 10, train_loss: 0.9838, test_loss: 1.0752, test_f1: 0.4693
 epoch: 11, train_loss: 0.9901, test_loss: 0.9856, test_f1: 0.4884
 epoch: 12, train_loss: 0.9603, test_loss: 0.9966, test_f1: 0.4867
 epoch: 13, train_loss: 0.9527, test_loss: 0.9919, test_f1: 0.4910
 epoch: 14, train_loss: 0.9589, test_loss: 1.0857, test_f1: 0.4932
 epoch: 15, train_loss: 0.9605, test_loss: 1.1807, test_f1: 0.4679
 epoch: 16, train_loss: 0.9411, test_loss: 1.0677, test_f1: 0.4897
 epoch: 17, train_loss: 0.9344, test_loss: 1.0637, test_f1: 0.4750
 epoch: 18, train_loss: 0.9243, test_loss: 1.0450, test_f1: 0.5018
 epoch: 19, train_loss: 0.9208, test_loss: 1.0455, test_f1: 0.4758
 epoch: 20, train_loss: 0.9280, test_loss: 1.0251, test_f1: 0.4997
 epoch: 21, train_loss: 0.9080, test_loss: 1.0522, test_f1: 0.4971
 epoch: 22, train_loss: 0.9144, test_loss: 1.0436, test_f1: 0.4943
 epoch: 23, train_loss: 0.9018, test_loss: 1.3116, test_f1: 0.4838
 epoch: 24, train_loss: 0.9235, test_loss: 1.0132, test_f1: 0.5075
 epoch: 25, train_loss: 0.9072, test_loss: 1.0921, test_f1: 0.4988
 epoch: 26, train_loss: 0.8887, test_loss: 1.0820, test_f1: 0.4847
 epoch: 27, train_loss: 0.9126, test_loss: 1.0416, test_f1: 0.5057
 epoch: 28, train_loss: 0.8904, test_loss: 1.1658, test_f1: 0.4637
 epoch: 29, train_loss: 0.8926, test_loss: 1.0297, test_f1: 0.5122
 epoch: 30, train_loss: 0.8939, test_loss: 1.0683, test_f1: 0.5095
 epoch: 31, train_loss: 0.8786, test_loss: 1.0398, test_f1: 0.4909
 epoch: 32, train_loss: 0.8773, test_loss: 1.0226, test_f1: 0.5035
 epoch: 33, train_loss: 0.8598, test_loss: 1.0817, test_f1: 0.4781
 epoch: 34, train_loss: 0.8753, test_loss: 1.0817, test_f1: 0.4871
 epoch: 35, train_loss: 0.8687, test_loss: 1.1455, test_f1: 0.4985
 epoch: 36, train_loss: 0.8747, test_loss: 1.0637, test_f1: 0.4913
 epoch: 37, train_loss: 0.8715, test_loss: 1.0278, test_f1: 0.4996
 epoch: 38, train_loss: 0.8450, test_loss: 1.3018, test_f1: 0.4915
 epoch: 39, train_loss: 0.8403, test_loss: 1.0893, test_f1: 0.5192
 epoch: 40, train_loss: 0.8332, test_loss: 1.0457, test_f1: 0.5067
 epoch: 41, train_loss: 0.8407, test_loss: 1.3508, test_f1: 0.5016
 epoch: 42, train_loss: 0.8416, test_loss: 1.1610, test_f1: 0.4908
 epoch: 43, train_loss: 0.8414, test_loss: 1.1571, test_f1: 0.5099
 epoch: 44, train_loss: 0.8330, test_loss: 1.1321, test_f1: 0.5131
 epoch: 45, train_loss: 0.8302, test_loss: 1.1467, test_f1: 0.4706
 epoch: 46, train_loss: 0.8225, test_loss: 1.1901, test_f1: 0.4931
 epoch: 47, train_loss: 0.8092, test_loss: 1.2189, test_f1: 0.4864
 epoch: 48, train_loss: 0.8230, test_loss: 1.2803, test_f1: 0.4896
 epoch: 49, train_loss: 0.8070, test_loss: 1.0812, test_f1: 0.5018
 epoch: 50, train_loss: 0.8233, test_loss: 1.2103, test_f1: 0.4809
 epoch: 51, train_loss: 0.8005, test_loss: 1.1412, test_f1: 0.4881
 epoch: 52, train_loss: 0.7896, test_loss: 1.0896, test_f1: 0.4826
 epoch: 53, train_loss: 0.7717, test_loss: 1.1558, test_f1: 0.5115
 epoch: 54, train_loss: 0.7687, test_loss: 1.1702, test_f1: 0.4887
 epoch: 55, train_loss: 0.7603, test_loss: 1.2883, test_f1: 0.4768
 epoch: 56, train_loss: 0.7554, test_loss: 1.2562, test_f1: 0.4981
 epoch: 57, train_loss: 0.7530, test_loss: 1.2498, test_f1: 0.4721
 epoch: 58, train_loss: 0.7523, test_loss: 1.4242, test_f1: 0.4718
 epoch: 59, train_loss: 0.7595, test_loss: 1.2659, test_f1: 0.4913
 epoch: 60, train_loss: 0.7492, test_loss: 1.2334, test_f1: 0.4956
 epoch: 61, train_loss: 0.7668, test_loss: 1.1755, test_f1: 0.4865
 epoch: 62, train_loss: 0.7425, test_loss: 1.4549, test_f1: 0.4840
 epoch: 63, train_loss: 0.7568, test_loss: 1.2879, test_f1: 0.4867
 epoch: 64, train_loss: 0.7564, test_loss: 1.2912, test_f1: 0.4682
 epoch: 65, train_loss: 0.7459, test_loss: 1.2771, test_f1: 0.4729
 epoch: 66, train_loss: 0.7566, test_loss: 1.1773, test_f1: 0.5185
 epoch: 67, train_loss: 0.7394, test_loss: 1.1450, test_f1: 0.5116
 epoch: 68, train_loss: 0.7554, test_loss: 1.2312, test_f1: 0.4841
 epoch: 69, train_loss: 0.7218, test_loss: 1.2049, test_f1: 0.5082
 epoch: 70, train_loss: 0.7382, test_loss: 1.2901, test_f1: 0.4762
 epoch: 71, train_loss: 0.7338, test_loss: 1.1364, test_f1: 0.5200
 epoch: 72, train_loss: 0.7225, test_loss: 1.3360, test_f1: 0.4804
 epoch: 73, train_loss: 0.7353, test_loss: 1.3488, test_f1: 0.4892
 epoch: 74, train_loss: 0.7311, test_loss: 1.3324, test_f1: 0.5018
 epoch: 75, train_loss: 0.7342, test_loss: 1.3165, test_f1: 0.4870
 epoch: 76, train_loss: 0.7234, test_loss: 1.2786, test_f1: 0.4978
 epoch: 77, train_loss: 0.7379, test_loss: 1.3338, test_f1: 0.4998
 epoch: 78, train_loss: 0.7248, test_loss: 1.2925, test_f1: 0.5060
 epoch: 79, train_loss: 0.7200, test_loss: 1.2209, test_f1: 0.4877
 epoch: 80, train_loss: 0.7195, test_loss: 1.3194, test_f1: 0.4793
 epoch: 81, train_loss: 0.7277, test_loss: 1.3643, test_f1: 0.4973
 epoch: 82, train_loss: 0.7147, test_loss: 1.2170, test_f1: 0.4988
 epoch: 83, train_loss: 0.7211, test_loss: 1.2201, test_f1: 0.5334
 epoch: 84, train_loss: 0.7225, test_loss: 1.2034, test_f1: 0.5181
 epoch: 85, train_loss: 0.7111, test_loss: 1.3172, test_f1: 0.5023
 epoch: 86, train_loss: 0.7181, test_loss: 1.2956, test_f1: 0.4968
 epoch: 87, train_loss: 0.7006, test_loss: 1.3022, test_f1: 0.5091
 epoch: 88, train_loss: 0.7055, test_loss: 1.2317, test_f1: 0.5116
 epoch: 89, train_loss: 0.7034, test_loss: 1.3313, test_f1: 0.4953
 epoch: 90, train_loss: 0.7099, test_loss: 1.4625, test_f1: 0.4784
 epoch: 91, train_loss: 0.7150, test_loss: 1.1623, test_f1: 0.5204
 epoch: 92, train_loss: 0.7076, test_loss: 1.2809, test_f1: 0.5227
 epoch: 93, train_loss: 0.7136, test_loss: 1.2917, test_f1: 0.5094
 epoch: 94, train_loss: 0.7041, test_loss: 1.2781, test_f1: 0.5109
 epoch: 95, train_loss: 0.7160, test_loss: 1.2838, test_f1: 0.4774
 epoch: 96, train_loss: 0.7221, test_loss: 1.3353, test_f1: 0.4860
 epoch: 97, train_loss: 0.6832, test_loss: 1.3014, test_f1: 0.5013
 epoch: 98, train_loss: 0.7070, test_loss: 1.3446, test_f1: 0.4899
 epoch: 99, train_loss: 0.7010, test_loss: 1.3558, test_f1: 0.4994
##################ITERATION #9 ****************************************
 epoch: 0, train_loss: 1.2885, test_loss: 1.1889, test_f1: 0.3459
 epoch: 1, train_loss: 1.1855, test_loss: 1.0832, test_f1: 0.4504
 epoch: 2, train_loss: 1.1472, test_loss: 1.0645, test_f1: 0.4297
 epoch: 3, train_loss: 1.0879, test_loss: 1.0193, test_f1: 0.4699
 epoch: 4, train_loss: 1.0812, test_loss: 0.9730, test_f1: 0.4627
 epoch: 5, train_loss: 1.0415, test_loss: 0.9547, test_f1: 0.4834
 epoch: 6, train_loss: 1.0322, test_loss: 0.9627, test_f1: 0.4795
 epoch: 7, train_loss: 1.0109, test_loss: 0.9534, test_f1: 0.4505
 epoch: 8, train_loss: 1.0027, test_loss: 0.9936, test_f1: 0.4985
 epoch: 9, train_loss: 1.0019, test_loss: 0.9796, test_f1: 0.4924
 epoch: 10, train_loss: 0.9961, test_loss: 0.9940, test_f1: 0.4752
 epoch: 11, train_loss: 1.0035, test_loss: 1.0274, test_f1: 0.4749
 epoch: 12, train_loss: 0.9607, test_loss: 0.9637, test_f1: 0.4887
 epoch: 13, train_loss: 0.9785, test_loss: 0.9645, test_f1: 0.4815
 epoch: 14, train_loss: 0.9688, test_loss: 0.9574, test_f1: 0.4749
 epoch: 15, train_loss: 0.9522, test_loss: 1.1097, test_f1: 0.4713
 epoch: 16, train_loss: 0.9505, test_loss: 1.1155, test_f1: 0.4721
 epoch: 17, train_loss: 0.9362, test_loss: 1.1018, test_f1: 0.4931
 epoch: 18, train_loss: 0.9426, test_loss: 0.9692, test_f1: 0.4891
 epoch: 19, train_loss: 0.9299, test_loss: 1.0161, test_f1: 0.4838
 epoch: 20, train_loss: 0.9393, test_loss: 1.0436, test_f1: 0.4930
 epoch: 21, train_loss: 0.9162, test_loss: 1.0188, test_f1: 0.5037
 epoch: 22, train_loss: 0.9125, test_loss: 1.0595, test_f1: 0.4857
 epoch: 23, train_loss: 0.8992, test_loss: 1.0120, test_f1: 0.4871
 epoch: 24, train_loss: 0.9023, test_loss: 0.9838, test_f1: 0.4934
 epoch: 25, train_loss: 0.8991, test_loss: 1.0065, test_f1: 0.5132
 epoch: 26, train_loss: 0.9266, test_loss: 1.0403, test_f1: 0.5181
 epoch: 27, train_loss: 0.9032, test_loss: 1.0277, test_f1: 0.5018
 epoch: 28, train_loss: 0.8857, test_loss: 1.0466, test_f1: 0.5079
 epoch: 29, train_loss: 0.9072, test_loss: 1.0483, test_f1: 0.4953
 epoch: 30, train_loss: 0.8844, test_loss: 1.1385, test_f1: 0.4683
 epoch: 31, train_loss: 0.8913, test_loss: 1.0157, test_f1: 0.5115
 epoch: 32, train_loss: 0.8754, test_loss: 0.9309, test_f1: 0.5233
 epoch: 33, train_loss: 0.8715, test_loss: 1.0385, test_f1: 0.5065
 epoch: 34, train_loss: 0.8782, test_loss: 1.0124, test_f1: 0.5103
 epoch: 35, train_loss: 0.8788, test_loss: 1.0884, test_f1: 0.5087
 epoch: 36, train_loss: 0.8776, test_loss: 1.1382, test_f1: 0.4882
 epoch: 37, train_loss: 0.8483, test_loss: 1.1269, test_f1: 0.5048
 epoch: 38, train_loss: 0.8535, test_loss: 1.0029, test_f1: 0.5122
 epoch: 39, train_loss: 0.8481, test_loss: 1.0273, test_f1: 0.5105
 epoch: 40, train_loss: 0.8311, test_loss: 1.0937, test_f1: 0.5100
 epoch: 41, train_loss: 0.8407, test_loss: 1.1052, test_f1: 0.5108
 epoch: 42, train_loss: 0.8287, test_loss: 1.1519, test_f1: 0.5024
 epoch: 43, train_loss: 0.8542, test_loss: 1.2808, test_f1: 0.4985
 epoch: 44, train_loss: 0.8412, test_loss: 1.1054, test_f1: 0.5128
 epoch: 45, train_loss: 0.8449, test_loss: 0.9984, test_f1: 0.5457
 epoch: 46, train_loss: 0.8378, test_loss: 1.1491, test_f1: 0.5203
 epoch: 47, train_loss: 0.8253, test_loss: 1.0951, test_f1: 0.5369
 epoch: 48, train_loss: 0.8277, test_loss: 1.0946, test_f1: 0.5259
 epoch: 49, train_loss: 0.8400, test_loss: 1.1649, test_f1: 0.5284
 epoch: 50, train_loss: 0.8032, test_loss: 1.0943, test_f1: 0.5120
 epoch: 51, train_loss: 0.7960, test_loss: 1.0984, test_f1: 0.5345
 epoch: 52, train_loss: 0.7775, test_loss: 1.1910, test_f1: 0.5268
 epoch: 53, train_loss: 0.7834, test_loss: 1.1668, test_f1: 0.5334
 epoch: 54, train_loss: 0.7643, test_loss: 1.2112, test_f1: 0.5268
 epoch: 55, train_loss: 0.7550, test_loss: 1.1579, test_f1: 0.5459
 epoch: 56, train_loss: 0.7723, test_loss: 1.0712, test_f1: 0.5625
 epoch: 57, train_loss: 0.7619, test_loss: 1.2531, test_f1: 0.5429
 epoch: 58, train_loss: 0.7613, test_loss: 1.2133, test_f1: 0.5542
 epoch: 59, train_loss: 0.7438, test_loss: 1.2177, test_f1: 0.5624
 epoch: 60, train_loss: 0.7599, test_loss: 1.2019, test_f1: 0.5580
 epoch: 61, train_loss: 0.7433, test_loss: 1.2118, test_f1: 0.5435
 epoch: 62, train_loss: 0.7481, test_loss: 1.1132, test_f1: 0.5639
 epoch: 63, train_loss: 0.7356, test_loss: 1.1648, test_f1: 0.5578
 epoch: 64, train_loss: 0.7467, test_loss: 1.1934, test_f1: 0.5498
 epoch: 65, train_loss: 0.7331, test_loss: 1.2755, test_f1: 0.5216
 epoch: 66, train_loss: 0.7404, test_loss: 1.1485, test_f1: 0.5692
 epoch: 67, train_loss: 0.7227, test_loss: 1.2260, test_f1: 0.5450
 epoch: 68, train_loss: 0.7356, test_loss: 1.1441, test_f1: 0.5542
 epoch: 69, train_loss: 0.7290, test_loss: 1.2757, test_f1: 0.5328
 epoch: 70, train_loss: 0.7428, test_loss: 1.2186, test_f1: 0.5263
 epoch: 71, train_loss: 0.7347, test_loss: 1.3320, test_f1: 0.5088
 epoch: 72, train_loss: 0.7301, test_loss: 1.2263, test_f1: 0.5353
 epoch: 73, train_loss: 0.7289, test_loss: 1.2650, test_f1: 0.5444
 epoch: 74, train_loss: 0.7255, test_loss: 1.1603, test_f1: 0.5714
 epoch: 75, train_loss: 0.7164, test_loss: 1.2609, test_f1: 0.5550
 epoch: 76, train_loss: 0.7224, test_loss: 1.2709, test_f1: 0.5312
 epoch: 77, train_loss: 0.7224, test_loss: 1.2264, test_f1: 0.5217
 epoch: 78, train_loss: 0.7171, test_loss: 1.3019, test_f1: 0.5055
 epoch: 79, train_loss: 0.7117, test_loss: 1.1536, test_f1: 0.5448
 epoch: 80, train_loss: 0.7259, test_loss: 1.3256, test_f1: 0.5153
 epoch: 81, train_loss: 0.7182, test_loss: 1.1432, test_f1: 0.5610
 epoch: 82, train_loss: 0.7095, test_loss: 1.3354, test_f1: 0.5445
 epoch: 83, train_loss: 0.6925, test_loss: 1.2375, test_f1: 0.5900
 epoch: 84, train_loss: 0.7088, test_loss: 1.1796, test_f1: 0.5502
 epoch: 85, train_loss: 0.6986, test_loss: 1.2461, test_f1: 0.5354
 epoch: 86, train_loss: 0.6954, test_loss: 1.2800, test_f1: 0.5616
 epoch: 87, train_loss: 0.7283, test_loss: 1.1523, test_f1: 0.5463
 epoch: 88, train_loss: 0.7088, test_loss: 1.2884, test_f1: 0.5329
 epoch: 89, train_loss: 0.7143, test_loss: 1.3386, test_f1: 0.5446
 epoch: 90, train_loss: 0.7207, test_loss: 1.2923, test_f1: 0.5582
 epoch: 91, train_loss: 0.7141, test_loss: 1.3537, test_f1: 0.5372
 epoch: 92, train_loss: 0.7091, test_loss: 1.1514, test_f1: 0.5688
 epoch: 93, train_loss: 0.7137, test_loss: 1.1882, test_f1: 0.5423
 epoch: 94, train_loss: 0.6957, test_loss: 1.3081, test_f1: 0.5304
 epoch: 95, train_loss: 0.6804, test_loss: 1.2810, test_f1: 0.5490
 epoch: 96, train_loss: 0.6903, test_loss: 1.1959, test_f1: 0.5738
 epoch: 97, train_loss: 0.6827, test_loss: 1.2401, test_f1: 0.5759
 epoch: 98, train_loss: 0.6808, test_loss: 1.2343, test_f1: 0.5705
 epoch: 99, train_loss: 0.6807, test_loss: 1.2346, test_f1: 0.5648

Training completed in 731.87 seconds
Best F1: 0.6110 at epoch 98
Mean F1 across iterations: 0.5827  0.0200
========================FINAL RESULTS================================
FEGIN weighted F1: 0.6110  0.0200
python main.py --data ltspice_examples --representation component_component --model FEGIN --layers 5 --hiddens 32 --batch_size 64 --lr 0.01 --emb_size 128 --epochs 100 --save_appendix component_component_L5_H32_BS64_LR0.01_E128 --no_val
-----



STDERR:
  File "main.py", line 370, in <module>
    main()
  File "main.py", line 254, in main
    dataset = dataset_class(
  File "/home/philip/projects/ltspice_examples_code_repo/Circuit-Completion-Using-GNNs/component_classification_with_link_prediction_head/evaluation/FEGIN/kernel/circuit_datasets.py", line 15, in __init__
    self.data, self.slices = torch.load(self.processed_paths[0])
  File "/home/philip/.local/lib/python3.8/site-packages/torch/serialization.py", line 1040, in load
    warnings.warn(
  File "/usr/lib/python3.8/warnings.py", line 109, in _showwarnmsg
    sw(msg.message, msg.category, msg.filename, msg.lineno,
  File "main.py", line 47, in warn_with_traceback
    traceback.print_stack(file=log)
/home/philip/projects/ltspice_examples_code_repo/Circuit-Completion-Using-GNNs/component_classification_with_link_prediction_head/evaluation/FEGIN/kernel/circuit_datasets.py:15: FutureWarning: You are using `torch.load` with `weights_only=False` (the current default value), which uses the default pickle module implicitly. It is possible to construct malicious pickle data which will execute arbitrary code during unpickling (See https://github.com/pytorch/pytorch/blob/main/SECURITY.md#untrusted-models for more details). In a future release, the default value for `weights_only` will be flipped to `True`. This limits the functions that could be executed during unpickling. Arbitrary objects will no longer be allowed to be loaded via this mode unless they are explicitly allowlisted by the user via `torch.serialization.add_safe_globals`. We recommend you start setting `weights_only=True` for any use case where you don't have full control of the loaded file. Please open an issue on GitHub for any issues related to this experimental feature.
  self.data, self.slices = torch.load(self.processed_paths[0])
