STDOUT:
Results will be saved in /home/philip/projects/ltspice_examples_code_repo/Circuit-Completion-Using-GNNs/component_classification_with_link_prediction_head/evaluation/FEGIN/results/model_FEGIN_dataset_ltspice_examples
Command line input: python main.py --data ltspice_examples --representation component_net --model FEGIN --layers 4 --hiddens 128 --batch_size 64 --lr 0.001 --emb_size 128 --epochs 100 --save_appendix component_net_L4_H128_BS64_LR0.001_E128 --no_val
 is saved.
-----
ltspice_examples - FEGIN
Using 4 layers, 128 hidden units, h = 2
Loading component_net representation dataset
ENTERED
Training FEGIN on component_net representation
Train: 3558, Test: 846
##################ITERATION #0 ****************************************
 epoch: 0, train_loss: 1.1809, test_loss: 1.0474, test_f1: 0.4873
 epoch: 1, train_loss: 0.9869, test_loss: 0.9956, test_f1: 0.5082
 epoch: 2, train_loss: 0.9288, test_loss: 0.9717, test_f1: 0.5417
 epoch: 3, train_loss: 0.9210, test_loss: 0.8915, test_f1: 0.5475
 epoch: 4, train_loss: 0.8930, test_loss: 0.9040, test_f1: 0.5349
 epoch: 5, train_loss: 0.8808, test_loss: 0.9302, test_f1: 0.5515
 epoch: 6, train_loss: 0.8487, test_loss: 1.0247, test_f1: 0.5179
 epoch: 7, train_loss: 0.8457, test_loss: 0.9314, test_f1: 0.5832
 epoch: 8, train_loss: 0.8178, test_loss: 1.0290, test_f1: 0.5232
 epoch: 9, train_loss: 0.8147, test_loss: 1.0202, test_f1: 0.5661
 epoch: 10, train_loss: 0.7835, test_loss: 1.0043, test_f1: 0.5725
 epoch: 11, train_loss: 0.7781, test_loss: 0.9564, test_f1: 0.5879
 epoch: 12, train_loss: 0.7770, test_loss: 0.9353, test_f1: 0.6177
 epoch: 13, train_loss: 0.7543, test_loss: 0.9600, test_f1: 0.6115
 epoch: 14, train_loss: 0.7346, test_loss: 0.9812, test_f1: 0.6089
 epoch: 15, train_loss: 0.7158, test_loss: 0.9532, test_f1: 0.6305
 epoch: 16, train_loss: 0.7185, test_loss: 0.8901, test_f1: 0.6116
 epoch: 17, train_loss: 0.6979, test_loss: 0.9373, test_f1: 0.6418
 epoch: 18, train_loss: 0.6895, test_loss: 0.9994, test_f1: 0.6056
 epoch: 19, train_loss: 0.6758, test_loss: 1.0717, test_f1: 0.5856
 epoch: 20, train_loss: 0.6700, test_loss: 0.9961, test_f1: 0.6317
 epoch: 21, train_loss: 0.6425, test_loss: 0.9971, test_f1: 0.6181
 epoch: 22, train_loss: 0.6406, test_loss: 1.0276, test_f1: 0.6217
 epoch: 23, train_loss: 0.6057, test_loss: 1.0568, test_f1: 0.6147
 epoch: 24, train_loss: 0.6272, test_loss: 1.0263, test_f1: 0.6007
 epoch: 25, train_loss: 0.5831, test_loss: 1.0007, test_f1: 0.6766
 epoch: 26, train_loss: 0.5956, test_loss: 1.0818, test_f1: 0.6233
 epoch: 27, train_loss: 0.5732, test_loss: 1.0506, test_f1: 0.6391
 epoch: 28, train_loss: 0.5662, test_loss: 1.0854, test_f1: 0.6595
 epoch: 29, train_loss: 0.5510, test_loss: 1.0378, test_f1: 0.6536
 epoch: 30, train_loss: 0.5397, test_loss: 1.1185, test_f1: 0.6346
 epoch: 31, train_loss: 0.5396, test_loss: 1.0984, test_f1: 0.6391
 epoch: 32, train_loss: 0.5263, test_loss: 1.1693, test_f1: 0.6134
 epoch: 33, train_loss: 0.5306, test_loss: 1.1602, test_f1: 0.6157
 epoch: 34, train_loss: 0.5112, test_loss: 1.1457, test_f1: 0.6556
 epoch: 35, train_loss: 0.4952, test_loss: 1.2506, test_f1: 0.6100
 epoch: 36, train_loss: 0.4966, test_loss: 1.0543, test_f1: 0.6519
 epoch: 37, train_loss: 0.5123, test_loss: 1.2238, test_f1: 0.6496
 epoch: 38, train_loss: 0.4693, test_loss: 1.3673, test_f1: 0.5834
 epoch: 39, train_loss: 0.4782, test_loss: 1.2416, test_f1: 0.6415
 epoch: 40, train_loss: 0.4855, test_loss: 1.1282, test_f1: 0.6508
 epoch: 41, train_loss: 0.4605, test_loss: 1.2090, test_f1: 0.6394
 epoch: 42, train_loss: 0.4401, test_loss: 1.2651, test_f1: 0.6495
 epoch: 43, train_loss: 0.4453, test_loss: 1.1674, test_f1: 0.6651
 epoch: 44, train_loss: 0.4082, test_loss: 1.4760, test_f1: 0.6285
 epoch: 45, train_loss: 0.4450, test_loss: 1.3462, test_f1: 0.6220
 epoch: 46, train_loss: 0.4298, test_loss: 1.3258, test_f1: 0.6217
 epoch: 47, train_loss: 0.4180, test_loss: 1.2973, test_f1: 0.6386
 epoch: 48, train_loss: 0.3818, test_loss: 1.3128, test_f1: 0.6635
 epoch: 49, train_loss: 0.3736, test_loss: 1.3712, test_f1: 0.6709
 epoch: 50, train_loss: 0.3683, test_loss: 1.3333, test_f1: 0.6668
 epoch: 51, train_loss: 0.3310, test_loss: 1.5621, test_f1: 0.6741
 epoch: 52, train_loss: 0.3224, test_loss: 1.5195, test_f1: 0.6591
 epoch: 53, train_loss: 0.3025, test_loss: 1.5532, test_f1: 0.6625
 epoch: 54, train_loss: 0.2895, test_loss: 1.6126, test_f1: 0.6504
 epoch: 55, train_loss: 0.2823, test_loss: 1.7008, test_f1: 0.6428
 epoch: 56, train_loss: 0.2848, test_loss: 1.5654, test_f1: 0.6586
 epoch: 57, train_loss: 0.2587, test_loss: 1.7200, test_f1: 0.6526
 epoch: 58, train_loss: 0.2764, test_loss: 1.8091, test_f1: 0.6220
 epoch: 59, train_loss: 0.2780, test_loss: 1.7870, test_f1: 0.6335
 epoch: 60, train_loss: 0.2760, test_loss: 1.9662, test_f1: 0.6262
 epoch: 61, train_loss: 0.2443, test_loss: 1.8635, test_f1: 0.6398
 epoch: 62, train_loss: 0.2818, test_loss: 1.9276, test_f1: 0.6356
 epoch: 63, train_loss: 0.2605, test_loss: 1.8618, test_f1: 0.6500
 epoch: 64, train_loss: 0.2353, test_loss: 1.9224, test_f1: 0.6335
 epoch: 65, train_loss: 0.2247, test_loss: 1.9561, test_f1: 0.6339
 epoch: 66, train_loss: 0.2619, test_loss: 1.9189, test_f1: 0.6257
 epoch: 67, train_loss: 0.2214, test_loss: 2.0508, test_f1: 0.6508
 epoch: 68, train_loss: 0.2206, test_loss: 2.3091, test_f1: 0.6256
 epoch: 69, train_loss: 0.2268, test_loss: 2.0933, test_f1: 0.6587
 epoch: 70, train_loss: 0.2324, test_loss: 2.0899, test_f1: 0.6388
 epoch: 71, train_loss: 0.2297, test_loss: 2.0739, test_f1: 0.6434
 epoch: 72, train_loss: 0.2144, test_loss: 2.2412, test_f1: 0.6497
 epoch: 73, train_loss: 0.2144, test_loss: 2.1264, test_f1: 0.6642
 epoch: 74, train_loss: 0.2102, test_loss: 2.1424, test_f1: 0.6265
 epoch: 75, train_loss: 0.2057, test_loss: 2.3132, test_f1: 0.6182
 epoch: 76, train_loss: 0.2036, test_loss: 2.1976, test_f1: 0.6209
 epoch: 77, train_loss: 0.1998, test_loss: 2.2237, test_f1: 0.6417
 epoch: 78, train_loss: 0.1924, test_loss: 2.2692, test_f1: 0.6442
 epoch: 79, train_loss: 0.2156, test_loss: 2.3205, test_f1: 0.6418
 epoch: 80, train_loss: 0.2113, test_loss: 2.1682, test_f1: 0.6546
 epoch: 81, train_loss: 0.1946, test_loss: 2.3030, test_f1: 0.6619
 epoch: 82, train_loss: 0.2064, test_loss: 2.2817, test_f1: 0.6414
 epoch: 83, train_loss: 0.2081, test_loss: 2.2483, test_f1: 0.6480
 epoch: 84, train_loss: 0.1760, test_loss: 2.4108, test_f1: 0.6559
 epoch: 85, train_loss: 0.1893, test_loss: 2.2360, test_f1: 0.6403
 epoch: 86, train_loss: 0.1859, test_loss: 2.3775, test_f1: 0.6388
 epoch: 87, train_loss: 0.1783, test_loss: 2.5161, test_f1: 0.6035
 epoch: 88, train_loss: 0.1737, test_loss: 2.4825, test_f1: 0.6491
 epoch: 89, train_loss: 0.1877, test_loss: 2.4565, test_f1: 0.6156
 epoch: 90, train_loss: 0.1844, test_loss: 2.4566, test_f1: 0.6405
 epoch: 91, train_loss: 0.1825, test_loss: 2.4351, test_f1: 0.6578
 epoch: 92, train_loss: 0.1834, test_loss: 2.3783, test_f1: 0.6355
 epoch: 93, train_loss: 0.1819, test_loss: 2.6480, test_f1: 0.6390
 epoch: 94, train_loss: 0.1748, test_loss: 2.4939, test_f1: 0.6380
 epoch: 95, train_loss: 0.1659, test_loss: 2.6642, test_f1: 0.6399
 epoch: 96, train_loss: 0.1669, test_loss: 2.6383, test_f1: 0.6327
 epoch: 97, train_loss: 0.1794, test_loss: 2.6026, test_f1: 0.6426
 epoch: 98, train_loss: 0.1662, test_loss: 2.5612, test_f1: 0.6327
 epoch: 99, train_loss: 0.1670, test_loss: 2.6565, test_f1: 0.6259
##################ITERATION #1 ****************************************
 epoch: 0, train_loss: 1.1152, test_loss: 0.9912, test_f1: 0.4862
 epoch: 1, train_loss: 0.9658, test_loss: 0.9437, test_f1: 0.5078
 epoch: 2, train_loss: 0.9284, test_loss: 0.9418, test_f1: 0.5546
 epoch: 3, train_loss: 0.9121, test_loss: 0.9428, test_f1: 0.5205
 epoch: 4, train_loss: 0.8749, test_loss: 0.9382, test_f1: 0.5618
 epoch: 5, train_loss: 0.8711, test_loss: 0.8664, test_f1: 0.5433
 epoch: 6, train_loss: 0.8541, test_loss: 0.9682, test_f1: 0.5576
 epoch: 7, train_loss: 0.8285, test_loss: 0.9949, test_f1: 0.5198
 epoch: 8, train_loss: 0.8231, test_loss: 0.9921, test_f1: 0.6095
 epoch: 9, train_loss: 0.7929, test_loss: 0.9300, test_f1: 0.5536
 epoch: 10, train_loss: 0.7840, test_loss: 0.9763, test_f1: 0.5721
 epoch: 11, train_loss: 0.7596, test_loss: 0.9866, test_f1: 0.5631
 epoch: 12, train_loss: 0.7659, test_loss: 1.0291, test_f1: 0.5918
 epoch: 13, train_loss: 0.7397, test_loss: 0.9863, test_f1: 0.6111
 epoch: 14, train_loss: 0.7298, test_loss: 1.0554, test_f1: 0.5583
 epoch: 15, train_loss: 0.7256, test_loss: 1.0036, test_f1: 0.5856
 epoch: 16, train_loss: 0.7235, test_loss: 1.0187, test_f1: 0.5775
 epoch: 17, train_loss: 0.7071, test_loss: 1.0606, test_f1: 0.6086
 epoch: 18, train_loss: 0.7027, test_loss: 1.0361, test_f1: 0.6033
 epoch: 19, train_loss: 0.6790, test_loss: 1.0507, test_f1: 0.6260
 epoch: 20, train_loss: 0.6866, test_loss: 1.0402, test_f1: 0.6037
 epoch: 21, train_loss: 0.6672, test_loss: 0.9616, test_f1: 0.6268
 epoch: 22, train_loss: 0.6637, test_loss: 1.0680, test_f1: 0.6055
 epoch: 23, train_loss: 0.6617, test_loss: 1.0709, test_f1: 0.6035
 epoch: 24, train_loss: 0.6395, test_loss: 1.0444, test_f1: 0.6112
 epoch: 25, train_loss: 0.6161, test_loss: 1.0784, test_f1: 0.6634
 epoch: 26, train_loss: 0.6168, test_loss: 1.0690, test_f1: 0.6324
 epoch: 27, train_loss: 0.6091, test_loss: 1.1157, test_f1: 0.6593
 epoch: 28, train_loss: 0.6060, test_loss: 1.1090, test_f1: 0.6405
 epoch: 29, train_loss: 0.5798, test_loss: 1.1434, test_f1: 0.6322
 epoch: 30, train_loss: 0.5763, test_loss: 1.1641, test_f1: 0.6345
 epoch: 31, train_loss: 0.5681, test_loss: 1.1693, test_f1: 0.6348
 epoch: 32, train_loss: 0.5617, test_loss: 1.1064, test_f1: 0.6462
 epoch: 33, train_loss: 0.5479, test_loss: 1.2471, test_f1: 0.6546
 epoch: 34, train_loss: 0.5386, test_loss: 1.2152, test_f1: 0.6224
 epoch: 35, train_loss: 0.5344, test_loss: 1.2215, test_f1: 0.6516
 epoch: 36, train_loss: 0.5137, test_loss: 1.2662, test_f1: 0.6456
 epoch: 37, train_loss: 0.4882, test_loss: 1.2285, test_f1: 0.6295
 epoch: 38, train_loss: 0.4796, test_loss: 1.2124, test_f1: 0.6753
 epoch: 39, train_loss: 0.5063, test_loss: 1.2011, test_f1: 0.6525
 epoch: 40, train_loss: 0.4836, test_loss: 1.4143, test_f1: 0.6117
 epoch: 41, train_loss: 0.4500, test_loss: 1.2669, test_f1: 0.6582
 epoch: 42, train_loss: 0.4976, test_loss: 1.5904, test_f1: 0.6053
 epoch: 43, train_loss: 0.4747, test_loss: 1.2305, test_f1: 0.6330
 epoch: 44, train_loss: 0.4474, test_loss: 1.4553, test_f1: 0.6398
 epoch: 45, train_loss: 0.4346, test_loss: 1.2002, test_f1: 0.6725
 epoch: 46, train_loss: 0.4303, test_loss: 1.4051, test_f1: 0.6417
 epoch: 47, train_loss: 0.4253, test_loss: 1.4558, test_f1: 0.6188
 epoch: 48, train_loss: 0.4176, test_loss: 1.2927, test_f1: 0.6545
 epoch: 49, train_loss: 0.4165, test_loss: 1.4956, test_f1: 0.6422
 epoch: 50, train_loss: 0.4212, test_loss: 1.3919, test_f1: 0.6300
 epoch: 51, train_loss: 0.3660, test_loss: 1.5681, test_f1: 0.6418
 epoch: 52, train_loss: 0.3230, test_loss: 1.5332, test_f1: 0.6490
 epoch: 53, train_loss: 0.3126, test_loss: 1.7672, test_f1: 0.6596
 epoch: 54, train_loss: 0.2972, test_loss: 1.7120, test_f1: 0.6455
 epoch: 55, train_loss: 0.3037, test_loss: 1.7559, test_f1: 0.6308
 epoch: 56, train_loss: 0.3035, test_loss: 1.7325, test_f1: 0.6433
 epoch: 57, train_loss: 0.3018, test_loss: 1.7358, test_f1: 0.6294
 epoch: 58, train_loss: 0.2754, test_loss: 1.7924, test_f1: 0.6422
 epoch: 59, train_loss: 0.2597, test_loss: 1.7938, test_f1: 0.6424
 epoch: 60, train_loss: 0.2831, test_loss: 1.7402, test_f1: 0.6466
 epoch: 61, train_loss: 0.2577, test_loss: 1.8219, test_f1: 0.6588
 epoch: 62, train_loss: 0.2771, test_loss: 1.8774, test_f1: 0.6385
 epoch: 63, train_loss: 0.2668, test_loss: 1.8701, test_f1: 0.6608
 epoch: 64, train_loss: 0.2420, test_loss: 1.9791, test_f1: 0.6529
 epoch: 65, train_loss: 0.2594, test_loss: 2.0528, test_f1: 0.6211
 epoch: 66, train_loss: 0.2571, test_loss: 1.8725, test_f1: 0.6596
 epoch: 67, train_loss: 0.2529, test_loss: 1.9587, test_f1: 0.6357
 epoch: 68, train_loss: 0.2379, test_loss: 1.9623, test_f1: 0.6494
 epoch: 69, train_loss: 0.2540, test_loss: 1.8733, test_f1: 0.6503
 epoch: 70, train_loss: 0.2410, test_loss: 2.0454, test_f1: 0.6497
 epoch: 71, train_loss: 0.2390, test_loss: 2.0721, test_f1: 0.6440
 epoch: 72, train_loss: 0.2406, test_loss: 1.9637, test_f1: 0.6507
 epoch: 73, train_loss: 0.2210, test_loss: 2.0624, test_f1: 0.6429
 epoch: 74, train_loss: 0.2351, test_loss: 2.1680, test_f1: 0.6316
 epoch: 75, train_loss: 0.2152, test_loss: 2.1141, test_f1: 0.6314
 epoch: 76, train_loss: 0.2320, test_loss: 2.1257, test_f1: 0.6430
 epoch: 77, train_loss: 0.2213, test_loss: 2.0428, test_f1: 0.6426
 epoch: 78, train_loss: 0.2274, test_loss: 2.0842, test_f1: 0.6629
 epoch: 79, train_loss: 0.2072, test_loss: 2.1237, test_f1: 0.6158
 epoch: 80, train_loss: 0.2161, test_loss: 2.0238, test_f1: 0.6370
 epoch: 81, train_loss: 0.2110, test_loss: 2.2873, test_f1: 0.6384
 epoch: 82, train_loss: 0.2069, test_loss: 2.3060, test_f1: 0.6524
 epoch: 83, train_loss: 0.1951, test_loss: 2.4849, test_f1: 0.6332
 epoch: 84, train_loss: 0.2157, test_loss: 2.0539, test_f1: 0.6630
 epoch: 85, train_loss: 0.2102, test_loss: 2.1513, test_f1: 0.6531
 epoch: 86, train_loss: 0.1863, test_loss: 2.3670, test_f1: 0.6224
 epoch: 87, train_loss: 0.1956, test_loss: 2.3393, test_f1: 0.6354
 epoch: 88, train_loss: 0.2041, test_loss: 2.4766, test_f1: 0.6314
 epoch: 89, train_loss: 0.2139, test_loss: 2.4222, test_f1: 0.6268
 epoch: 90, train_loss: 0.2080, test_loss: 2.3104, test_f1: 0.6659
 epoch: 91, train_loss: 0.2021, test_loss: 2.2749, test_f1: 0.6439
 epoch: 92, train_loss: 0.1946, test_loss: 2.2168, test_f1: 0.6389
 epoch: 93, train_loss: 0.2054, test_loss: 2.4217, test_f1: 0.6202
 epoch: 94, train_loss: 0.1823, test_loss: 2.5069, test_f1: 0.6386
 epoch: 95, train_loss: 0.1687, test_loss: 2.3709, test_f1: 0.6437
 epoch: 96, train_loss: 0.1899, test_loss: 2.3260, test_f1: 0.6580
 epoch: 97, train_loss: 0.1704, test_loss: 2.5922, test_f1: 0.6358
 epoch: 98, train_loss: 0.1707, test_loss: 2.5175, test_f1: 0.6523
 epoch: 99, train_loss: 0.1740, test_loss: 2.4751, test_f1: 0.6556
##################ITERATION #2 ****************************************
 epoch: 0, train_loss: 1.1876, test_loss: 1.0132, test_f1: 0.3905
 epoch: 1, train_loss: 0.9783, test_loss: 0.9659, test_f1: 0.5219
 epoch: 2, train_loss: 0.9506, test_loss: 0.9232, test_f1: 0.5267
 epoch: 3, train_loss: 0.9051, test_loss: 0.9944, test_f1: 0.4922
 epoch: 4, train_loss: 0.8934, test_loss: 0.9593, test_f1: 0.5350
 epoch: 5, train_loss: 0.8801, test_loss: 0.9601, test_f1: 0.5054
 epoch: 6, train_loss: 0.8987, test_loss: 0.9116, test_f1: 0.5538
 epoch: 7, train_loss: 0.8487, test_loss: 0.9149, test_f1: 0.5689
 epoch: 8, train_loss: 0.8361, test_loss: 0.9561, test_f1: 0.5467
 epoch: 9, train_loss: 0.8396, test_loss: 0.9707, test_f1: 0.5470
 epoch: 10, train_loss: 0.8155, test_loss: 0.9422, test_f1: 0.5669
 epoch: 11, train_loss: 0.8004, test_loss: 0.9607, test_f1: 0.5772
 epoch: 12, train_loss: 0.7873, test_loss: 1.0528, test_f1: 0.5996
 epoch: 13, train_loss: 0.7792, test_loss: 0.9443, test_f1: 0.5770
 epoch: 14, train_loss: 0.7684, test_loss: 0.9668, test_f1: 0.6062
 epoch: 15, train_loss: 0.7626, test_loss: 0.9427, test_f1: 0.5755
 epoch: 16, train_loss: 0.7373, test_loss: 0.9508, test_f1: 0.5939
 epoch: 17, train_loss: 0.7424, test_loss: 0.9739, test_f1: 0.5823
 epoch: 18, train_loss: 0.7117, test_loss: 0.9147, test_f1: 0.6170
 epoch: 19, train_loss: 0.7163, test_loss: 0.9446, test_f1: 0.5946
 epoch: 20, train_loss: 0.7009, test_loss: 0.9772, test_f1: 0.6297
 epoch: 21, train_loss: 0.6836, test_loss: 1.0675, test_f1: 0.6036
 epoch: 22, train_loss: 0.6925, test_loss: 0.9668, test_f1: 0.6155
 epoch: 23, train_loss: 0.6874, test_loss: 1.0144, test_f1: 0.6349
 epoch: 24, train_loss: 0.6899, test_loss: 1.0180, test_f1: 0.6248
 epoch: 25, train_loss: 0.6496, test_loss: 1.0171, test_f1: 0.6470
 epoch: 26, train_loss: 0.6443, test_loss: 1.0419, test_f1: 0.6152
 epoch: 27, train_loss: 0.6453, test_loss: 1.0604, test_f1: 0.6254
 epoch: 28, train_loss: 0.6303, test_loss: 0.9354, test_f1: 0.6149
 epoch: 29, train_loss: 0.6284, test_loss: 1.0341, test_f1: 0.6438
 epoch: 30, train_loss: 0.6266, test_loss: 1.0702, test_f1: 0.6455
 epoch: 31, train_loss: 0.6111, test_loss: 1.0316, test_f1: 0.6521
 epoch: 32, train_loss: 0.5959, test_loss: 1.1081, test_f1: 0.6343
 epoch: 33, train_loss: 0.5980, test_loss: 1.1256, test_f1: 0.6616
 epoch: 34, train_loss: 0.5984, test_loss: 1.1103, test_f1: 0.6317
 epoch: 35, train_loss: 0.5906, test_loss: 1.0272, test_f1: 0.6369
 epoch: 36, train_loss: 0.5733, test_loss: 1.1028, test_f1: 0.6175
 epoch: 37, train_loss: 0.5452, test_loss: 1.1145, test_f1: 0.6582
 epoch: 38, train_loss: 0.5524, test_loss: 1.1968, test_f1: 0.6032
 epoch: 39, train_loss: 0.5218, test_loss: 1.1277, test_f1: 0.6335
 epoch: 40, train_loss: 0.5350, test_loss: 1.1362, test_f1: 0.6397
 epoch: 41, train_loss: 0.5467, test_loss: 1.2594, test_f1: 0.6650
 epoch: 42, train_loss: 0.5133, test_loss: 1.0337, test_f1: 0.6559
 epoch: 43, train_loss: 0.4949, test_loss: 1.0394, test_f1: 0.6617
 epoch: 44, train_loss: 0.5033, test_loss: 1.0465, test_f1: 0.6400
 epoch: 45, train_loss: 0.4799, test_loss: 1.0657, test_f1: 0.6885
 epoch: 46, train_loss: 0.4706, test_loss: 1.1696, test_f1: 0.6388
 epoch: 47, train_loss: 0.4762, test_loss: 1.0720, test_f1: 0.6500
 epoch: 48, train_loss: 0.4936, test_loss: 1.1495, test_f1: 0.6460
 epoch: 49, train_loss: 0.4535, test_loss: 1.1832, test_f1: 0.6777
 epoch: 50, train_loss: 0.4601, test_loss: 1.2129, test_f1: 0.6701
 epoch: 51, train_loss: 0.3944, test_loss: 1.2590, test_f1: 0.6485
 epoch: 52, train_loss: 0.3582, test_loss: 1.2275, test_f1: 0.6657
 epoch: 53, train_loss: 0.3548, test_loss: 1.3087, test_f1: 0.6698
 epoch: 54, train_loss: 0.3378, test_loss: 1.3662, test_f1: 0.6633
 epoch: 55, train_loss: 0.3340, test_loss: 1.3658, test_f1: 0.6642
 epoch: 56, train_loss: 0.3359, test_loss: 1.3421, test_f1: 0.6825
 epoch: 57, train_loss: 0.3307, test_loss: 1.4233, test_f1: 0.6576
 epoch: 58, train_loss: 0.3048, test_loss: 1.3738, test_f1: 0.6959
 epoch: 59, train_loss: 0.3284, test_loss: 1.3962, test_f1: 0.6594
 epoch: 60, train_loss: 0.3018, test_loss: 1.3552, test_f1: 0.6733
 epoch: 61, train_loss: 0.2960, test_loss: 1.3508, test_f1: 0.6725
 epoch: 62, train_loss: 0.2959, test_loss: 1.3182, test_f1: 0.6785
 epoch: 63, train_loss: 0.2890, test_loss: 1.3697, test_f1: 0.6736
 epoch: 64, train_loss: 0.2898, test_loss: 1.4170, test_f1: 0.6983
 epoch: 65, train_loss: 0.2912, test_loss: 1.4346, test_f1: 0.6622
 epoch: 66, train_loss: 0.2708, test_loss: 1.5068, test_f1: 0.6667
 epoch: 67, train_loss: 0.2776, test_loss: 1.3278, test_f1: 0.6975
 epoch: 68, train_loss: 0.2773, test_loss: 1.4294, test_f1: 0.6720
 epoch: 69, train_loss: 0.2672, test_loss: 1.5383, test_f1: 0.6571
 epoch: 70, train_loss: 0.2690, test_loss: 1.5399, test_f1: 0.6586
 epoch: 71, train_loss: 0.2579, test_loss: 1.4850, test_f1: 0.6478
 epoch: 72, train_loss: 0.2648, test_loss: 1.4940, test_f1: 0.6729
 epoch: 73, train_loss: 0.2451, test_loss: 1.6639, test_f1: 0.6522
 epoch: 74, train_loss: 0.2614, test_loss: 1.4718, test_f1: 0.6918
 epoch: 75, train_loss: 0.2379, test_loss: 1.5878, test_f1: 0.6627
 epoch: 76, train_loss: 0.2319, test_loss: 1.5983, test_f1: 0.6701
 epoch: 77, train_loss: 0.2284, test_loss: 1.6760, test_f1: 0.6627
 epoch: 78, train_loss: 0.2334, test_loss: 1.6414, test_f1: 0.6571
 epoch: 79, train_loss: 0.2241, test_loss: 1.6973, test_f1: 0.6824
 epoch: 80, train_loss: 0.2374, test_loss: 1.6536, test_f1: 0.6490
 epoch: 81, train_loss: 0.2336, test_loss: 1.8080, test_f1: 0.6631
 epoch: 82, train_loss: 0.2232, test_loss: 1.6398, test_f1: 0.6829
 epoch: 83, train_loss: 0.2334, test_loss: 1.6773, test_f1: 0.6690
 epoch: 84, train_loss: 0.2277, test_loss: 1.6991, test_f1: 0.6517
 epoch: 85, train_loss: 0.2312, test_loss: 1.6404, test_f1: 0.6657
 epoch: 86, train_loss: 0.2296, test_loss: 1.6871, test_f1: 0.6754
 epoch: 87, train_loss: 0.2250, test_loss: 1.7034, test_f1: 0.6460
 epoch: 88, train_loss: 0.2197, test_loss: 1.7976, test_f1: 0.6597
 epoch: 89, train_loss: 0.2080, test_loss: 1.8417, test_f1: 0.6607
 epoch: 90, train_loss: 0.2115, test_loss: 1.8518, test_f1: 0.6561
 epoch: 91, train_loss: 0.2093, test_loss: 1.7613, test_f1: 0.6615
 epoch: 92, train_loss: 0.1910, test_loss: 1.8367, test_f1: 0.6707
 epoch: 93, train_loss: 0.1931, test_loss: 1.9054, test_f1: 0.6559
 epoch: 94, train_loss: 0.1935, test_loss: 1.8609, test_f1: 0.6546
 epoch: 95, train_loss: 0.1813, test_loss: 1.8490, test_f1: 0.6729
 epoch: 96, train_loss: 0.1968, test_loss: 1.9909, test_f1: 0.6565
 epoch: 97, train_loss: 0.2113, test_loss: 1.8989, test_f1: 0.6486
 epoch: 98, train_loss: 0.1806, test_loss: 1.8000, test_f1: 0.6664
 epoch: 99, train_loss: 0.1882, test_loss: 1.8724, test_f1: 0.6733
##################ITERATION #3 ****************************************
 epoch: 0, train_loss: 1.2233, test_loss: 1.1026, test_f1: 0.3691
 epoch: 1, train_loss: 0.9771, test_loss: 0.9552, test_f1: 0.5130
 epoch: 2, train_loss: 0.9332, test_loss: 0.9293, test_f1: 0.4988
 epoch: 3, train_loss: 0.9095, test_loss: 0.9504, test_f1: 0.5021
 epoch: 4, train_loss: 0.8957, test_loss: 0.9623, test_f1: 0.5281
 epoch: 5, train_loss: 0.8693, test_loss: 0.9358, test_f1: 0.5174
 epoch: 6, train_loss: 0.8462, test_loss: 0.9137, test_f1: 0.5462
 epoch: 7, train_loss: 0.8425, test_loss: 0.9070, test_f1: 0.5368
 epoch: 8, train_loss: 0.8292, test_loss: 0.9380, test_f1: 0.6161
 epoch: 9, train_loss: 0.8163, test_loss: 0.9188, test_f1: 0.5767
 epoch: 10, train_loss: 0.7847, test_loss: 0.9338, test_f1: 0.5623
 epoch: 11, train_loss: 0.7833, test_loss: 0.9313, test_f1: 0.6100
 epoch: 12, train_loss: 0.7783, test_loss: 0.9394, test_f1: 0.5970
 epoch: 13, train_loss: 0.7819, test_loss: 0.9079, test_f1: 0.5469
 epoch: 14, train_loss: 0.7537, test_loss: 0.8815, test_f1: 0.5672
 epoch: 15, train_loss: 0.7439, test_loss: 0.9262, test_f1: 0.5977
 epoch: 16, train_loss: 0.7186, test_loss: 0.9566, test_f1: 0.5990
 epoch: 17, train_loss: 0.7225, test_loss: 0.9818, test_f1: 0.5666
 epoch: 18, train_loss: 0.7211, test_loss: 0.9111, test_f1: 0.5847
 epoch: 19, train_loss: 0.6741, test_loss: 0.9106, test_f1: 0.6484
 epoch: 20, train_loss: 0.6959, test_loss: 0.8291, test_f1: 0.6356
 epoch: 21, train_loss: 0.6740, test_loss: 0.9046, test_f1: 0.6133
 epoch: 22, train_loss: 0.6778, test_loss: 0.8958, test_f1: 0.6362
 epoch: 23, train_loss: 0.6596, test_loss: 0.8881, test_f1: 0.6234
 epoch: 24, train_loss: 0.6561, test_loss: 0.9261, test_f1: 0.6353
 epoch: 25, train_loss: 0.6505, test_loss: 0.9941, test_f1: 0.6395
 epoch: 26, train_loss: 0.6471, test_loss: 0.9478, test_f1: 0.6226
 epoch: 27, train_loss: 0.6257, test_loss: 1.0350, test_f1: 0.6542
 epoch: 28, train_loss: 0.6245, test_loss: 0.9124, test_f1: 0.6688
 epoch: 29, train_loss: 0.6002, test_loss: 0.9296, test_f1: 0.6385
 epoch: 30, train_loss: 0.5948, test_loss: 0.9637, test_f1: 0.6227
 epoch: 31, train_loss: 0.5808, test_loss: 0.9097, test_f1: 0.6685
 epoch: 32, train_loss: 0.5938, test_loss: 1.0532, test_f1: 0.6676
 epoch: 33, train_loss: 0.5746, test_loss: 0.9774, test_f1: 0.6615
 epoch: 34, train_loss: 0.5589, test_loss: 0.9783, test_f1: 0.6235
 epoch: 35, train_loss: 0.5678, test_loss: 0.9665, test_f1: 0.6367
 epoch: 36, train_loss: 0.5603, test_loss: 0.9818, test_f1: 0.6384
 epoch: 37, train_loss: 0.5276, test_loss: 1.0513, test_f1: 0.6582
 epoch: 38, train_loss: 0.4960, test_loss: 1.1396, test_f1: 0.6084
 epoch: 39, train_loss: 0.5289, test_loss: 0.9355, test_f1: 0.6664
 epoch: 40, train_loss: 0.4756, test_loss: 1.0503, test_f1: 0.6777
 epoch: 41, train_loss: 0.4981, test_loss: 1.0689, test_f1: 0.6594
 epoch: 42, train_loss: 0.4777, test_loss: 0.9945, test_f1: 0.6672
 epoch: 43, train_loss: 0.4652, test_loss: 1.0996, test_f1: 0.6593
 epoch: 44, train_loss: 0.4761, test_loss: 1.0087, test_f1: 0.6710
 epoch: 45, train_loss: 0.4502, test_loss: 1.0377, test_f1: 0.6824
 epoch: 46, train_loss: 0.4605, test_loss: 1.1263, test_f1: 0.6910
 epoch: 47, train_loss: 0.4449, test_loss: 1.1018, test_f1: 0.6638
 epoch: 48, train_loss: 0.4462, test_loss: 1.1721, test_f1: 0.6858
 epoch: 49, train_loss: 0.4148, test_loss: 1.1300, test_f1: 0.6666
 epoch: 50, train_loss: 0.4218, test_loss: 1.1720, test_f1: 0.6496
 epoch: 51, train_loss: 0.3857, test_loss: 1.1535, test_f1: 0.6690
 epoch: 52, train_loss: 0.3367, test_loss: 1.1973, test_f1: 0.6811
 epoch: 53, train_loss: 0.3438, test_loss: 1.2522, test_f1: 0.6837
 epoch: 54, train_loss: 0.3143, test_loss: 1.1485, test_f1: 0.6743
 epoch: 55, train_loss: 0.3123, test_loss: 1.3193, test_f1: 0.6753
 epoch: 56, train_loss: 0.2966, test_loss: 1.3326, test_f1: 0.6805
 epoch: 57, train_loss: 0.3060, test_loss: 1.2411, test_f1: 0.6850
 epoch: 58, train_loss: 0.3075, test_loss: 1.3746, test_f1: 0.6707
 epoch: 59, train_loss: 0.3224, test_loss: 1.3118, test_f1: 0.6687
 epoch: 60, train_loss: 0.2791, test_loss: 1.3488, test_f1: 0.6830
 epoch: 61, train_loss: 0.2982, test_loss: 1.3204, test_f1: 0.6676
 epoch: 62, train_loss: 0.2839, test_loss: 1.4147, test_f1: 0.6402
 epoch: 63, train_loss: 0.2789, test_loss: 1.4065, test_f1: 0.6913
 epoch: 64, train_loss: 0.2791, test_loss: 1.4211, test_f1: 0.6653
 epoch: 65, train_loss: 0.2624, test_loss: 1.4525, test_f1: 0.6510
 epoch: 66, train_loss: 0.2821, test_loss: 1.4722, test_f1: 0.6661
 epoch: 67, train_loss: 0.2681, test_loss: 1.5134, test_f1: 0.6593
 epoch: 68, train_loss: 0.2693, test_loss: 1.4697, test_f1: 0.6632
 epoch: 69, train_loss: 0.2370, test_loss: 1.5778, test_f1: 0.6632
 epoch: 70, train_loss: 0.2634, test_loss: 1.5090, test_f1: 0.6638
 epoch: 71, train_loss: 0.2403, test_loss: 1.5997, test_f1: 0.6565
 epoch: 72, train_loss: 0.2441, test_loss: 1.5142, test_f1: 0.6658
 epoch: 73, train_loss: 0.2474, test_loss: 1.5096, test_f1: 0.6815
 epoch: 74, train_loss: 0.2660, test_loss: 1.5093, test_f1: 0.6765
 epoch: 75, train_loss: 0.2394, test_loss: 1.6286, test_f1: 0.6556
 epoch: 76, train_loss: 0.2242, test_loss: 1.5433, test_f1: 0.6817
 epoch: 77, train_loss: 0.2284, test_loss: 1.5889, test_f1: 0.6852
 epoch: 78, train_loss: 0.2206, test_loss: 1.5719, test_f1: 0.6536
 epoch: 79, train_loss: 0.2316, test_loss: 1.5628, test_f1: 0.6506
 epoch: 80, train_loss: 0.2105, test_loss: 1.6003, test_f1: 0.6701
 epoch: 81, train_loss: 0.2325, test_loss: 1.5623, test_f1: 0.6647
 epoch: 82, train_loss: 0.2155, test_loss: 1.6654, test_f1: 0.6519
 epoch: 83, train_loss: 0.2234, test_loss: 1.5577, test_f1: 0.6513
 epoch: 84, train_loss: 0.2202, test_loss: 1.7292, test_f1: 0.6484
 epoch: 85, train_loss: 0.2059, test_loss: 1.6619, test_f1: 0.6506
 epoch: 86, train_loss: 0.1990, test_loss: 1.8027, test_f1: 0.6506
 epoch: 87, train_loss: 0.2170, test_loss: 1.5575, test_f1: 0.6723
 epoch: 88, train_loss: 0.2124, test_loss: 1.5959, test_f1: 0.6793
 epoch: 89, train_loss: 0.1952, test_loss: 1.6184, test_f1: 0.6460
 epoch: 90, train_loss: 0.1833, test_loss: 1.9182, test_f1: 0.6631
 epoch: 91, train_loss: 0.1802, test_loss: 1.9173, test_f1: 0.6386
 epoch: 92, train_loss: 0.1982, test_loss: 1.7214, test_f1: 0.6595
 epoch: 93, train_loss: 0.1844, test_loss: 1.8372, test_f1: 0.6498
 epoch: 94, train_loss: 0.2121, test_loss: 1.7605, test_f1: 0.6632
 epoch: 95, train_loss: 0.2004, test_loss: 1.7524, test_f1: 0.6547
 epoch: 96, train_loss: 0.1768, test_loss: 1.8781, test_f1: 0.6576
 epoch: 97, train_loss: 0.1920, test_loss: 1.9475, test_f1: 0.6687
 epoch: 98, train_loss: 0.1902, test_loss: 1.7853, test_f1: 0.6527
 epoch: 99, train_loss: 0.1691, test_loss: 1.8290, test_f1: 0.6555
##################ITERATION #4 ****************************************
 epoch: 0, train_loss: 1.2484, test_loss: 1.0297, test_f1: 0.4329
 epoch: 1, train_loss: 0.9820, test_loss: 0.9659, test_f1: 0.4814
 epoch: 2, train_loss: 0.9441, test_loss: 0.9569, test_f1: 0.4944
 epoch: 3, train_loss: 0.9142, test_loss: 0.9641, test_f1: 0.5139
 epoch: 4, train_loss: 0.9061, test_loss: 0.9824, test_f1: 0.5392
 epoch: 5, train_loss: 0.8788, test_loss: 0.9664, test_f1: 0.5361
 epoch: 6, train_loss: 0.8747, test_loss: 0.9481, test_f1: 0.5036
 epoch: 7, train_loss: 0.8581, test_loss: 0.9535, test_f1: 0.5195
 epoch: 8, train_loss: 0.8512, test_loss: 0.8926, test_f1: 0.5553
 epoch: 9, train_loss: 0.8272, test_loss: 0.9016, test_f1: 0.5527
 epoch: 10, train_loss: 0.8239, test_loss: 0.9317, test_f1: 0.5661
 epoch: 11, train_loss: 0.7978, test_loss: 0.9409, test_f1: 0.5455
 epoch: 12, train_loss: 0.7862, test_loss: 0.9661, test_f1: 0.5560
 epoch: 13, train_loss: 0.7661, test_loss: 0.9798, test_f1: 0.5556
 epoch: 14, train_loss: 0.7715, test_loss: 0.9498, test_f1: 0.5626
 epoch: 15, train_loss: 0.7685, test_loss: 0.9855, test_f1: 0.5731
 epoch: 16, train_loss: 0.7564, test_loss: 0.9910, test_f1: 0.5739
 epoch: 17, train_loss: 0.7347, test_loss: 0.9708, test_f1: 0.5622
 epoch: 18, train_loss: 0.7569, test_loss: 0.9640, test_f1: 0.5701
 epoch: 19, train_loss: 0.7266, test_loss: 1.0328, test_f1: 0.5719
 epoch: 20, train_loss: 0.7158, test_loss: 0.9514, test_f1: 0.5814
 epoch: 21, train_loss: 0.7155, test_loss: 0.9490, test_f1: 0.5977
 epoch: 22, train_loss: 0.6865, test_loss: 0.9887, test_f1: 0.5667
 epoch: 23, train_loss: 0.6789, test_loss: 0.9020, test_f1: 0.6016
 epoch: 24, train_loss: 0.6741, test_loss: 0.8646, test_f1: 0.6225
 epoch: 25, train_loss: 0.6629, test_loss: 0.9485, test_f1: 0.5801
 epoch: 26, train_loss: 0.6755, test_loss: 0.9695, test_f1: 0.6221
 epoch: 27, train_loss: 0.6405, test_loss: 1.0085, test_f1: 0.5947
 epoch: 28, train_loss: 0.6520, test_loss: 0.9686, test_f1: 0.6307
 epoch: 29, train_loss: 0.6464, test_loss: 0.9280, test_f1: 0.6043
 epoch: 30, train_loss: 0.6367, test_loss: 0.9131, test_f1: 0.6004
 epoch: 31, train_loss: 0.6128, test_loss: 0.8518, test_f1: 0.6211
 epoch: 32, train_loss: 0.6086, test_loss: 0.9649, test_f1: 0.5833
 epoch: 33, train_loss: 0.6078, test_loss: 0.8686, test_f1: 0.6193
 epoch: 34, train_loss: 0.5830, test_loss: 0.9650, test_f1: 0.6544
 epoch: 35, train_loss: 0.5801, test_loss: 0.9613, test_f1: 0.6143
 epoch: 36, train_loss: 0.5793, test_loss: 1.0080, test_f1: 0.6299
 epoch: 37, train_loss: 0.5655, test_loss: 0.9836, test_f1: 0.6592
 epoch: 38, train_loss: 0.5665, test_loss: 1.0032, test_f1: 0.5819
 epoch: 39, train_loss: 0.5475, test_loss: 1.0136, test_f1: 0.6348
 epoch: 40, train_loss: 0.5226, test_loss: 1.1120, test_f1: 0.6301
 epoch: 41, train_loss: 0.5393, test_loss: 0.9380, test_f1: 0.6396
 epoch: 42, train_loss: 0.5231, test_loss: 0.8894, test_f1: 0.6412
 epoch: 43, train_loss: 0.5200, test_loss: 1.1113, test_f1: 0.6197
 epoch: 44, train_loss: 0.5056, test_loss: 1.0069, test_f1: 0.6470
 epoch: 45, train_loss: 0.4822, test_loss: 1.1088, test_f1: 0.6379
 epoch: 46, train_loss: 0.4749, test_loss: 1.0649, test_f1: 0.6450
 epoch: 47, train_loss: 0.4743, test_loss: 1.1760, test_f1: 0.6332
 epoch: 48, train_loss: 0.4660, test_loss: 1.0630, test_f1: 0.6781
 epoch: 49, train_loss: 0.4429, test_loss: 1.1091, test_f1: 0.6571
 epoch: 50, train_loss: 0.4493, test_loss: 1.0284, test_f1: 0.6641
 epoch: 51, train_loss: 0.4173, test_loss: 1.1563, test_f1: 0.6500
 epoch: 52, train_loss: 0.3666, test_loss: 1.1451, test_f1: 0.6688
 epoch: 53, train_loss: 0.3777, test_loss: 1.1517, test_f1: 0.6648
 epoch: 54, train_loss: 0.3703, test_loss: 1.2087, test_f1: 0.6590
 epoch: 55, train_loss: 0.3522, test_loss: 1.1861, test_f1: 0.6561
 epoch: 56, train_loss: 0.3622, test_loss: 1.2061, test_f1: 0.6578
 epoch: 57, train_loss: 0.3323, test_loss: 1.2432, test_f1: 0.6596
 epoch: 58, train_loss: 0.3366, test_loss: 1.2794, test_f1: 0.6681
 epoch: 59, train_loss: 0.3156, test_loss: 1.3683, test_f1: 0.6708
 epoch: 60, train_loss: 0.3254, test_loss: 1.4418, test_f1: 0.6667
 epoch: 61, train_loss: 0.3342, test_loss: 1.4285, test_f1: 0.6565
 epoch: 62, train_loss: 0.3009, test_loss: 1.4006, test_f1: 0.6682
 epoch: 63, train_loss: 0.3028, test_loss: 1.4620, test_f1: 0.6471
 epoch: 64, train_loss: 0.3104, test_loss: 1.4683, test_f1: 0.6425
 epoch: 65, train_loss: 0.2929, test_loss: 1.4320, test_f1: 0.6524
 epoch: 66, train_loss: 0.3044, test_loss: 1.3981, test_f1: 0.6675
 epoch: 67, train_loss: 0.3033, test_loss: 1.3461, test_f1: 0.6690
 epoch: 68, train_loss: 0.2933, test_loss: 1.3167, test_f1: 0.6600
 epoch: 69, train_loss: 0.2760, test_loss: 1.3839, test_f1: 0.6608
 epoch: 70, train_loss: 0.2755, test_loss: 1.4223, test_f1: 0.6707
 epoch: 71, train_loss: 0.3082, test_loss: 1.3472, test_f1: 0.6683
 epoch: 72, train_loss: 0.2799, test_loss: 1.5735, test_f1: 0.6555
 epoch: 73, train_loss: 0.2674, test_loss: 1.3431, test_f1: 0.6838
 epoch: 74, train_loss: 0.2772, test_loss: 1.4295, test_f1: 0.6681
 epoch: 75, train_loss: 0.2561, test_loss: 1.4923, test_f1: 0.6657
 epoch: 76, train_loss: 0.2646, test_loss: 1.5642, test_f1: 0.6536
 epoch: 77, train_loss: 0.2595, test_loss: 1.5316, test_f1: 0.6538
 epoch: 78, train_loss: 0.2475, test_loss: 1.5542, test_f1: 0.6405
 epoch: 79, train_loss: 0.2453, test_loss: 1.5805, test_f1: 0.6517
 epoch: 80, train_loss: 0.2618, test_loss: 1.5082, test_f1: 0.6592
 epoch: 81, train_loss: 0.2300, test_loss: 1.5912, test_f1: 0.6842
 epoch: 82, train_loss: 0.2461, test_loss: 1.6765, test_f1: 0.6590
 epoch: 83, train_loss: 0.2206, test_loss: 1.7309, test_f1: 0.6461
 epoch: 84, train_loss: 0.2367, test_loss: 1.6266, test_f1: 0.6562
 epoch: 85, train_loss: 0.2351, test_loss: 1.7305, test_f1: 0.6470
 epoch: 86, train_loss: 0.2396, test_loss: 1.6611, test_f1: 0.6454
 epoch: 87, train_loss: 0.2281, test_loss: 1.7003, test_f1: 0.6438
 epoch: 88, train_loss: 0.2339, test_loss: 1.6818, test_f1: 0.6372
 epoch: 89, train_loss: 0.2217, test_loss: 1.8412, test_f1: 0.6383
 epoch: 90, train_loss: 0.2385, test_loss: 1.8223, test_f1: 0.6328
 epoch: 91, train_loss: 0.2089, test_loss: 1.7465, test_f1: 0.6437
 epoch: 92, train_loss: 0.2212, test_loss: 1.7621, test_f1: 0.6319
 epoch: 93, train_loss: 0.2407, test_loss: 1.7587, test_f1: 0.6336
 epoch: 94, train_loss: 0.2210, test_loss: 1.5823, test_f1: 0.6812
 epoch: 95, train_loss: 0.2049, test_loss: 1.8128, test_f1: 0.6593
 epoch: 96, train_loss: 0.2102, test_loss: 1.6752, test_f1: 0.6445
 epoch: 97, train_loss: 0.2261, test_loss: 1.6725, test_f1: 0.6603
 epoch: 98, train_loss: 0.2078, test_loss: 1.7267, test_f1: 0.6604
 epoch: 99, train_loss: 0.1988, test_loss: 1.7271, test_f1: 0.6431
##################ITERATION #5 ****************************************
 epoch: 0, train_loss: 1.3092, test_loss: 1.0118, test_f1: 0.4661
 epoch: 1, train_loss: 1.0030, test_loss: 0.9415, test_f1: 0.4842
 epoch: 2, train_loss: 0.9538, test_loss: 1.0009, test_f1: 0.4821
 epoch: 3, train_loss: 0.9243, test_loss: 0.9696, test_f1: 0.4798
 epoch: 4, train_loss: 0.9138, test_loss: 0.9732, test_f1: 0.5194
 epoch: 5, train_loss: 0.9060, test_loss: 0.9525, test_f1: 0.5591
 epoch: 6, train_loss: 0.8765, test_loss: 0.9873, test_f1: 0.5483
 epoch: 7, train_loss: 0.8630, test_loss: 0.9850, test_f1: 0.5264
 epoch: 8, train_loss: 0.8541, test_loss: 0.9163, test_f1: 0.5297
 epoch: 9, train_loss: 0.8420, test_loss: 0.9527, test_f1: 0.5761
 epoch: 10, train_loss: 0.8367, test_loss: 0.9516, test_f1: 0.5775
 epoch: 11, train_loss: 0.8029, test_loss: 0.8760, test_f1: 0.5715
 epoch: 12, train_loss: 0.8012, test_loss: 0.9549, test_f1: 0.5698
 epoch: 13, train_loss: 0.7854, test_loss: 0.9569, test_f1: 0.5701
 epoch: 14, train_loss: 0.7756, test_loss: 0.9101, test_f1: 0.6034
 epoch: 15, train_loss: 0.7771, test_loss: 0.9892, test_f1: 0.5872
 epoch: 16, train_loss: 0.7618, test_loss: 0.9275, test_f1: 0.5884
 epoch: 17, train_loss: 0.7353, test_loss: 0.9556, test_f1: 0.6107
 epoch: 18, train_loss: 0.7250, test_loss: 0.9416, test_f1: 0.5641
 epoch: 19, train_loss: 0.7307, test_loss: 1.0025, test_f1: 0.5818
 epoch: 20, train_loss: 0.7346, test_loss: 0.9192, test_f1: 0.6173
 epoch: 21, train_loss: 0.7023, test_loss: 1.0091, test_f1: 0.6248
 epoch: 22, train_loss: 0.7178, test_loss: 0.9525, test_f1: 0.5663
 epoch: 23, train_loss: 0.6853, test_loss: 0.9166, test_f1: 0.6120
 epoch: 24, train_loss: 0.6780, test_loss: 0.9476, test_f1: 0.5998
 epoch: 25, train_loss: 0.6728, test_loss: 1.0039, test_f1: 0.6073
 epoch: 26, train_loss: 0.6771, test_loss: 0.9828, test_f1: 0.6423
 epoch: 27, train_loss: 0.6548, test_loss: 0.9564, test_f1: 0.5735
 epoch: 28, train_loss: 0.6660, test_loss: 1.0279, test_f1: 0.6289
 epoch: 29, train_loss: 0.6241, test_loss: 1.0396, test_f1: 0.5783
 epoch: 30, train_loss: 0.6154, test_loss: 1.0286, test_f1: 0.5950
 epoch: 31, train_loss: 0.6255, test_loss: 0.9945, test_f1: 0.6064
 epoch: 32, train_loss: 0.6002, test_loss: 0.9806, test_f1: 0.6119
 epoch: 33, train_loss: 0.5958, test_loss: 0.9707, test_f1: 0.6535
 epoch: 34, train_loss: 0.5926, test_loss: 1.0344, test_f1: 0.6116
 epoch: 35, train_loss: 0.5898, test_loss: 0.9341, test_f1: 0.6263
 epoch: 36, train_loss: 0.5747, test_loss: 1.0421, test_f1: 0.6017
 epoch: 37, train_loss: 0.5709, test_loss: 0.9990, test_f1: 0.5890
 epoch: 38, train_loss: 0.5738, test_loss: 0.9507, test_f1: 0.6386
 epoch: 39, train_loss: 0.5526, test_loss: 1.0416, test_f1: 0.6109
 epoch: 40, train_loss: 0.5595, test_loss: 1.0039, test_f1: 0.6197
 epoch: 41, train_loss: 0.5355, test_loss: 1.0782, test_f1: 0.6262
 epoch: 42, train_loss: 0.5268, test_loss: 1.0868, test_f1: 0.6248
 epoch: 43, train_loss: 0.5006, test_loss: 1.0189, test_f1: 0.5975
 epoch: 44, train_loss: 0.5056, test_loss: 1.1305, test_f1: 0.6420
 epoch: 45, train_loss: 0.5103, test_loss: 1.0749, test_f1: 0.6074
 epoch: 46, train_loss: 0.5059, test_loss: 1.1368, test_f1: 0.6381
 epoch: 47, train_loss: 0.4929, test_loss: 1.1359, test_f1: 0.6356
 epoch: 48, train_loss: 0.4761, test_loss: 1.1094, test_f1: 0.6346
 epoch: 49, train_loss: 0.4784, test_loss: 1.1087, test_f1: 0.6054
 epoch: 50, train_loss: 0.4517, test_loss: 1.0781, test_f1: 0.6369
 epoch: 51, train_loss: 0.4287, test_loss: 1.1663, test_f1: 0.6347
 epoch: 52, train_loss: 0.3916, test_loss: 1.1496, test_f1: 0.6576
 epoch: 53, train_loss: 0.3855, test_loss: 1.1902, test_f1: 0.6513
 epoch: 54, train_loss: 0.3776, test_loss: 1.2412, test_f1: 0.6441
 epoch: 55, train_loss: 0.3597, test_loss: 1.2422, test_f1: 0.6431
 epoch: 56, train_loss: 0.3508, test_loss: 1.2617, test_f1: 0.6407
 epoch: 57, train_loss: 0.3294, test_loss: 1.3440, test_f1: 0.6573
 epoch: 58, train_loss: 0.3290, test_loss: 1.4159, test_f1: 0.6444
 epoch: 59, train_loss: 0.3338, test_loss: 1.3976, test_f1: 0.6598
 epoch: 60, train_loss: 0.3404, test_loss: 1.3680, test_f1: 0.6294
 epoch: 61, train_loss: 0.3308, test_loss: 1.4343, test_f1: 0.6477
 epoch: 62, train_loss: 0.3400, test_loss: 1.3837, test_f1: 0.6528
 epoch: 63, train_loss: 0.3198, test_loss: 1.4170, test_f1: 0.6498
 epoch: 64, train_loss: 0.3180, test_loss: 1.4661, test_f1: 0.6410
 epoch: 65, train_loss: 0.3134, test_loss: 1.5221, test_f1: 0.6489
 epoch: 66, train_loss: 0.2842, test_loss: 1.4835, test_f1: 0.6444
 epoch: 67, train_loss: 0.3202, test_loss: 1.4387, test_f1: 0.6310
 epoch: 68, train_loss: 0.3088, test_loss: 1.4808, test_f1: 0.6389
 epoch: 69, train_loss: 0.2915, test_loss: 1.5461, test_f1: 0.6502
 epoch: 70, train_loss: 0.3175, test_loss: 1.5727, test_f1: 0.6427
 epoch: 71, train_loss: 0.2959, test_loss: 1.5838, test_f1: 0.6504
 epoch: 72, train_loss: 0.2880, test_loss: 1.5038, test_f1: 0.6512
 epoch: 73, train_loss: 0.2927, test_loss: 1.7116, test_f1: 0.6213
 epoch: 74, train_loss: 0.2705, test_loss: 1.6790, test_f1: 0.6436
 epoch: 75, train_loss: 0.2704, test_loss: 1.6287, test_f1: 0.6542
 epoch: 76, train_loss: 0.2813, test_loss: 1.6383, test_f1: 0.6503
 epoch: 77, train_loss: 0.2689, test_loss: 1.5758, test_f1: 0.6551
 epoch: 78, train_loss: 0.2691, test_loss: 1.5726, test_f1: 0.6229
 epoch: 79, train_loss: 0.2652, test_loss: 1.6061, test_f1: 0.6694
 epoch: 80, train_loss: 0.2669, test_loss: 1.6315, test_f1: 0.6511
 epoch: 81, train_loss: 0.2469, test_loss: 1.6837, test_f1: 0.6486
 epoch: 82, train_loss: 0.2483, test_loss: 1.7627, test_f1: 0.6212
 epoch: 83, train_loss: 0.2602, test_loss: 1.6845, test_f1: 0.6399
 epoch: 84, train_loss: 0.2567, test_loss: 1.6418, test_f1: 0.6427
 epoch: 85, train_loss: 0.2469, test_loss: 1.7385, test_f1: 0.6272
 epoch: 86, train_loss: 0.2358, test_loss: 1.6811, test_f1: 0.6435
 epoch: 87, train_loss: 0.2544, test_loss: 1.6813, test_f1: 0.6418
 epoch: 88, train_loss: 0.2373, test_loss: 1.7579, test_f1: 0.6535
 epoch: 89, train_loss: 0.2332, test_loss: 1.6352, test_f1: 0.6474
 epoch: 90, train_loss: 0.2124, test_loss: 1.7061, test_f1: 0.6599
 epoch: 91, train_loss: 0.2141, test_loss: 1.7864, test_f1: 0.6429
 epoch: 92, train_loss: 0.2210, test_loss: 1.8417, test_f1: 0.6430
 epoch: 93, train_loss: 0.2117, test_loss: 1.7819, test_f1: 0.6435
 epoch: 94, train_loss: 0.2095, test_loss: 1.8694, test_f1: 0.6349
 epoch: 95, train_loss: 0.2104, test_loss: 1.9031, test_f1: 0.6368
 epoch: 96, train_loss: 0.2159, test_loss: 1.8674, test_f1: 0.6424
 epoch: 97, train_loss: 0.2259, test_loss: 1.8431, test_f1: 0.6252
 epoch: 98, train_loss: 0.2177, test_loss: 1.7979, test_f1: 0.6401
 epoch: 99, train_loss: 0.1884, test_loss: 1.8891, test_f1: 0.6332
##################ITERATION #6 ****************************************
 epoch: 0, train_loss: 1.2720, test_loss: 0.9912, test_f1: 0.4398
 epoch: 1, train_loss: 0.9875, test_loss: 0.9490, test_f1: 0.5396
 epoch: 2, train_loss: 0.9442, test_loss: 0.9658, test_f1: 0.5592
 epoch: 3, train_loss: 0.9059, test_loss: 0.9195, test_f1: 0.5589
 epoch: 4, train_loss: 0.8879, test_loss: 0.9083, test_f1: 0.5842
 epoch: 5, train_loss: 0.8726, test_loss: 0.9384, test_f1: 0.5716
 epoch: 6, train_loss: 0.8633, test_loss: 0.9551, test_f1: 0.5649
 epoch: 7, train_loss: 0.8532, test_loss: 0.8762, test_f1: 0.5624
 epoch: 8, train_loss: 0.8201, test_loss: 0.9968, test_f1: 0.5790
 epoch: 9, train_loss: 0.8157, test_loss: 0.9389, test_f1: 0.5880
 epoch: 10, train_loss: 0.8101, test_loss: 0.9433, test_f1: 0.5849
 epoch: 11, train_loss: 0.7965, test_loss: 0.9606, test_f1: 0.6122
 epoch: 12, train_loss: 0.7718, test_loss: 0.9255, test_f1: 0.5852
 epoch: 13, train_loss: 0.7624, test_loss: 0.9776, test_f1: 0.5917
 epoch: 14, train_loss: 0.7618, test_loss: 0.8955, test_f1: 0.5966
 epoch: 15, train_loss: 0.7558, test_loss: 0.9705, test_f1: 0.5851
 epoch: 16, train_loss: 0.7461, test_loss: 0.9759, test_f1: 0.6063
 epoch: 17, train_loss: 0.7249, test_loss: 0.9051, test_f1: 0.6353
 epoch: 18, train_loss: 0.7252, test_loss: 0.9592, test_f1: 0.5828
 epoch: 19, train_loss: 0.7302, test_loss: 1.0207, test_f1: 0.6022
 epoch: 20, train_loss: 0.7106, test_loss: 0.8775, test_f1: 0.5991
 epoch: 21, train_loss: 0.7103, test_loss: 0.9917, test_f1: 0.5597
 epoch: 22, train_loss: 0.6757, test_loss: 1.0177, test_f1: 0.6202
 epoch: 23, train_loss: 0.6787, test_loss: 0.8991, test_f1: 0.5953
 epoch: 24, train_loss: 0.6709, test_loss: 1.0181, test_f1: 0.6107
 epoch: 25, train_loss: 0.6489, test_loss: 0.9940, test_f1: 0.5863
 epoch: 26, train_loss: 0.6401, test_loss: 0.9336, test_f1: 0.6522
 epoch: 27, train_loss: 0.6427, test_loss: 0.9146, test_f1: 0.6512
 epoch: 28, train_loss: 0.6108, test_loss: 1.0161, test_f1: 0.6157
 epoch: 29, train_loss: 0.6265, test_loss: 1.0079, test_f1: 0.6408
 epoch: 30, train_loss: 0.6104, test_loss: 0.9730, test_f1: 0.6121
 epoch: 31, train_loss: 0.6121, test_loss: 1.0009, test_f1: 0.5932
 epoch: 32, train_loss: 0.5907, test_loss: 1.0041, test_f1: 0.6660
 epoch: 33, train_loss: 0.5832, test_loss: 0.9898, test_f1: 0.6320
 epoch: 34, train_loss: 0.5470, test_loss: 1.0803, test_f1: 0.6163
 epoch: 35, train_loss: 0.5611, test_loss: 0.9562, test_f1: 0.6448
 epoch: 36, train_loss: 0.5569, test_loss: 0.9455, test_f1: 0.6380
 epoch: 37, train_loss: 0.5573, test_loss: 1.0532, test_f1: 0.6748
 epoch: 38, train_loss: 0.5338, test_loss: 1.1033, test_f1: 0.6490
 epoch: 39, train_loss: 0.5128, test_loss: 1.2289, test_f1: 0.6621
 epoch: 40, train_loss: 0.5412, test_loss: 1.0502, test_f1: 0.6426
 epoch: 41, train_loss: 0.5036, test_loss: 1.1889, test_f1: 0.6302
 epoch: 42, train_loss: 0.4900, test_loss: 1.2550, test_f1: 0.6204
 epoch: 43, train_loss: 0.4726, test_loss: 1.0258, test_f1: 0.6559
 epoch: 44, train_loss: 0.4989, test_loss: 1.1080, test_f1: 0.6615
 epoch: 45, train_loss: 0.5081, test_loss: 1.0522, test_f1: 0.6390
 epoch: 46, train_loss: 0.4959, test_loss: 1.1484, test_f1: 0.6433
 epoch: 47, train_loss: 0.4690, test_loss: 1.1748, test_f1: 0.6375
 epoch: 48, train_loss: 0.4766, test_loss: 1.2854, test_f1: 0.5893
 epoch: 49, train_loss: 0.4773, test_loss: 1.1050, test_f1: 0.6336
 epoch: 50, train_loss: 0.4408, test_loss: 1.1679, test_f1: 0.6654
 epoch: 51, train_loss: 0.3970, test_loss: 1.2397, test_f1: 0.6443
 epoch: 52, train_loss: 0.3793, test_loss: 1.3028, test_f1: 0.6856
 epoch: 53, train_loss: 0.3525, test_loss: 1.2603, test_f1: 0.6887
 epoch: 54, train_loss: 0.3505, test_loss: 1.2864, test_f1: 0.6676
 epoch: 55, train_loss: 0.3467, test_loss: 1.3923, test_f1: 0.6493
 epoch: 56, train_loss: 0.3426, test_loss: 1.2859, test_f1: 0.7026
 epoch: 57, train_loss: 0.3491, test_loss: 1.3510, test_f1: 0.6548
 epoch: 58, train_loss: 0.3264, test_loss: 1.3354, test_f1: 0.6912
 epoch: 59, train_loss: 0.3344, test_loss: 1.2681, test_f1: 0.6802
 epoch: 60, train_loss: 0.3224, test_loss: 1.3772, test_f1: 0.6598
 epoch: 61, train_loss: 0.3165, test_loss: 1.3900, test_f1: 0.6654
 epoch: 62, train_loss: 0.2986, test_loss: 1.4070, test_f1: 0.6539
 epoch: 63, train_loss: 0.2983, test_loss: 1.4767, test_f1: 0.6751
 epoch: 64, train_loss: 0.2890, test_loss: 1.4677, test_f1: 0.6582
 epoch: 65, train_loss: 0.3045, test_loss: 1.4284, test_f1: 0.6694
 epoch: 66, train_loss: 0.2745, test_loss: 1.6508, test_f1: 0.6497
 epoch: 67, train_loss: 0.2894, test_loss: 1.4271, test_f1: 0.6712
 epoch: 68, train_loss: 0.2824, test_loss: 1.6321, test_f1: 0.6522
 epoch: 69, train_loss: 0.2714, test_loss: 1.6218, test_f1: 0.6268
 epoch: 70, train_loss: 0.2760, test_loss: 1.5450, test_f1: 0.6589
 epoch: 71, train_loss: 0.2486, test_loss: 1.5230, test_f1: 0.6886
 epoch: 72, train_loss: 0.2777, test_loss: 1.5299, test_f1: 0.6726
 epoch: 73, train_loss: 0.2740, test_loss: 1.4787, test_f1: 0.6594
 epoch: 74, train_loss: 0.2536, test_loss: 1.4820, test_f1: 0.6754
 epoch: 75, train_loss: 0.2647, test_loss: 1.6530, test_f1: 0.6383
 epoch: 76, train_loss: 0.2551, test_loss: 1.4759, test_f1: 0.6758
 epoch: 77, train_loss: 0.2460, test_loss: 1.4882, test_f1: 0.6576
 epoch: 78, train_loss: 0.2536, test_loss: 1.5428, test_f1: 0.6574
 epoch: 79, train_loss: 0.2624, test_loss: 1.4893, test_f1: 0.6845
 epoch: 80, train_loss: 0.2399, test_loss: 1.5128, test_f1: 0.6764
 epoch: 81, train_loss: 0.2407, test_loss: 1.5031, test_f1: 0.6786
 epoch: 82, train_loss: 0.2362, test_loss: 1.7456, test_f1: 0.6259
 epoch: 83, train_loss: 0.2406, test_loss: 1.6112, test_f1: 0.6804
 epoch: 84, train_loss: 0.2273, test_loss: 1.6890, test_f1: 0.6343
 epoch: 85, train_loss: 0.2406, test_loss: 1.3844, test_f1: 0.6599
 epoch: 86, train_loss: 0.2395, test_loss: 1.5988, test_f1: 0.6629
 epoch: 87, train_loss: 0.2228, test_loss: 1.6708, test_f1: 0.6619
 epoch: 88, train_loss: 0.2190, test_loss: 1.7137, test_f1: 0.6371
 epoch: 89, train_loss: 0.2226, test_loss: 1.7279, test_f1: 0.6532
 epoch: 90, train_loss: 0.2099, test_loss: 1.6718, test_f1: 0.6716
 epoch: 91, train_loss: 0.2134, test_loss: 1.6456, test_f1: 0.6652
 epoch: 92, train_loss: 0.2307, test_loss: 1.7500, test_f1: 0.6423
 epoch: 93, train_loss: 0.2107, test_loss: 1.6819, test_f1: 0.6612
 epoch: 94, train_loss: 0.2058, test_loss: 1.7892, test_f1: 0.6295
 epoch: 95, train_loss: 0.2029, test_loss: 1.7605, test_f1: 0.6286
 epoch: 96, train_loss: 0.2104, test_loss: 1.8144, test_f1: 0.6357
 epoch: 97, train_loss: 0.1918, test_loss: 1.7714, test_f1: 0.6581
 epoch: 98, train_loss: 0.1986, test_loss: 1.8199, test_f1: 0.6461
 epoch: 99, train_loss: 0.1913, test_loss: 1.8911, test_f1: 0.6527
##################ITERATION #7 ****************************************
 epoch: 0, train_loss: 1.2380, test_loss: 0.9956, test_f1: 0.4729
 epoch: 1, train_loss: 0.9836, test_loss: 0.9579, test_f1: 0.4656
 epoch: 2, train_loss: 0.9424, test_loss: 0.9264, test_f1: 0.4951
 epoch: 3, train_loss: 0.9253, test_loss: 0.9439, test_f1: 0.4724
 epoch: 4, train_loss: 0.9097, test_loss: 0.8833, test_f1: 0.5236
 epoch: 5, train_loss: 0.8875, test_loss: 0.9251, test_f1: 0.5128
 epoch: 6, train_loss: 0.8694, test_loss: 0.9327, test_f1: 0.5436
 epoch: 7, train_loss: 0.8579, test_loss: 0.8797, test_f1: 0.5507
 epoch: 8, train_loss: 0.8400, test_loss: 0.9129, test_f1: 0.5553
 epoch: 9, train_loss: 0.8345, test_loss: 0.8567, test_f1: 0.5474
 epoch: 10, train_loss: 0.8139, test_loss: 0.9000, test_f1: 0.5624
 epoch: 11, train_loss: 0.8164, test_loss: 0.8471, test_f1: 0.5680
 epoch: 12, train_loss: 0.8030, test_loss: 0.9503, test_f1: 0.5568
 epoch: 13, train_loss: 0.7774, test_loss: 0.8978, test_f1: 0.5699
 epoch: 14, train_loss: 0.7639, test_loss: 0.9416, test_f1: 0.5917
 epoch: 15, train_loss: 0.7744, test_loss: 0.9154, test_f1: 0.5815
 epoch: 16, train_loss: 0.7560, test_loss: 0.9666, test_f1: 0.5918
 epoch: 17, train_loss: 0.7469, test_loss: 0.8878, test_f1: 0.5922
 epoch: 18, train_loss: 0.7410, test_loss: 0.8588, test_f1: 0.6319
 epoch: 19, train_loss: 0.7311, test_loss: 0.9944, test_f1: 0.5673
 epoch: 20, train_loss: 0.7504, test_loss: 0.9836, test_f1: 0.5821
 epoch: 21, train_loss: 0.7247, test_loss: 0.9324, test_f1: 0.6136
 epoch: 22, train_loss: 0.7253, test_loss: 0.9575, test_f1: 0.5970
 epoch: 23, train_loss: 0.6807, test_loss: 0.9085, test_f1: 0.5992
 epoch: 24, train_loss: 0.6904, test_loss: 1.0176, test_f1: 0.5804
 epoch: 25, train_loss: 0.7072, test_loss: 0.9329, test_f1: 0.5993
 epoch: 26, train_loss: 0.6724, test_loss: 0.9815, test_f1: 0.5958
 epoch: 27, train_loss: 0.6654, test_loss: 1.0185, test_f1: 0.6187
 epoch: 28, train_loss: 0.6559, test_loss: 0.9628, test_f1: 0.6505
 epoch: 29, train_loss: 0.6501, test_loss: 0.9889, test_f1: 0.5974
 epoch: 30, train_loss: 0.6361, test_loss: 0.9782, test_f1: 0.5904
 epoch: 31, train_loss: 0.6221, test_loss: 1.0044, test_f1: 0.6367
 epoch: 32, train_loss: 0.6246, test_loss: 0.9504, test_f1: 0.6327
 epoch: 33, train_loss: 0.6041, test_loss: 0.9809, test_f1: 0.6386
 epoch: 34, train_loss: 0.6068, test_loss: 0.9618, test_f1: 0.6254
 epoch: 35, train_loss: 0.5732, test_loss: 0.9934, test_f1: 0.6663
 epoch: 36, train_loss: 0.5852, test_loss: 1.0446, test_f1: 0.6271
 epoch: 37, train_loss: 0.5552, test_loss: 1.0358, test_f1: 0.6358
 epoch: 38, train_loss: 0.5612, test_loss: 1.0348, test_f1: 0.6528
 epoch: 39, train_loss: 0.5529, test_loss: 1.1135, test_f1: 0.6169
 epoch: 40, train_loss: 0.5409, test_loss: 1.0425, test_f1: 0.6638
 epoch: 41, train_loss: 0.5287, test_loss: 1.0772, test_f1: 0.6186
 epoch: 42, train_loss: 0.5419, test_loss: 1.0877, test_f1: 0.6335
 epoch: 43, train_loss: 0.5120, test_loss: 1.0262, test_f1: 0.6735
 epoch: 44, train_loss: 0.5062, test_loss: 1.0751, test_f1: 0.6400
 epoch: 45, train_loss: 0.5137, test_loss: 1.0731, test_f1: 0.6409
 epoch: 46, train_loss: 0.4941, test_loss: 1.1299, test_f1: 0.6892
 epoch: 47, train_loss: 0.4859, test_loss: 1.0801, test_f1: 0.6415
 epoch: 48, train_loss: 0.4723, test_loss: 0.9986, test_f1: 0.6347
 epoch: 49, train_loss: 0.4713, test_loss: 1.0270, test_f1: 0.6512
 epoch: 50, train_loss: 0.4582, test_loss: 1.1029, test_f1: 0.7068
 epoch: 51, train_loss: 0.4082, test_loss: 1.1444, test_f1: 0.6815
 epoch: 52, train_loss: 0.3978, test_loss: 1.1912, test_f1: 0.6818
 epoch: 53, train_loss: 0.3682, test_loss: 1.1556, test_f1: 0.6794
 epoch: 54, train_loss: 0.3708, test_loss: 1.2216, test_f1: 0.6538
 epoch: 55, train_loss: 0.3518, test_loss: 1.2111, test_f1: 0.6876
 epoch: 56, train_loss: 0.3516, test_loss: 1.1901, test_f1: 0.6788
 epoch: 57, train_loss: 0.3275, test_loss: 1.2424, test_f1: 0.6600
 epoch: 58, train_loss: 0.3431, test_loss: 1.3191, test_f1: 0.6867
 epoch: 59, train_loss: 0.3368, test_loss: 1.3171, test_f1: 0.6791
 epoch: 60, train_loss: 0.3245, test_loss: 1.3320, test_f1: 0.6836
 epoch: 61, train_loss: 0.3239, test_loss: 1.3382, test_f1: 0.6827
 epoch: 62, train_loss: 0.3104, test_loss: 1.3602, test_f1: 0.6717
 epoch: 63, train_loss: 0.3166, test_loss: 1.2919, test_f1: 0.6626
 epoch: 64, train_loss: 0.3239, test_loss: 1.3029, test_f1: 0.6572
 epoch: 65, train_loss: 0.2964, test_loss: 1.4058, test_f1: 0.6934
 epoch: 66, train_loss: 0.3039, test_loss: 1.4053, test_f1: 0.6426
 epoch: 67, train_loss: 0.3243, test_loss: 1.3532, test_f1: 0.6851
 epoch: 68, train_loss: 0.3045, test_loss: 1.3893, test_f1: 0.6745
 epoch: 69, train_loss: 0.3026, test_loss: 1.2923, test_f1: 0.6890
 epoch: 70, train_loss: 0.2885, test_loss: 1.3231, test_f1: 0.6658
 epoch: 71, train_loss: 0.2968, test_loss: 1.3915, test_f1: 0.6490
 epoch: 72, train_loss: 0.2926, test_loss: 1.3514, test_f1: 0.6622
 epoch: 73, train_loss: 0.2635, test_loss: 1.4506, test_f1: 0.6648
 epoch: 74, train_loss: 0.2582, test_loss: 1.4049, test_f1: 0.6479
 epoch: 75, train_loss: 0.2606, test_loss: 1.5189, test_f1: 0.6624
 epoch: 76, train_loss: 0.2461, test_loss: 1.5058, test_f1: 0.6514
 epoch: 77, train_loss: 0.2494, test_loss: 1.5442, test_f1: 0.6480
 epoch: 78, train_loss: 0.2527, test_loss: 1.6039, test_f1: 0.6311
 epoch: 79, train_loss: 0.2682, test_loss: 1.4499, test_f1: 0.6636
 epoch: 80, train_loss: 0.2692, test_loss: 1.4428, test_f1: 0.6404
 epoch: 81, train_loss: 0.2546, test_loss: 1.5731, test_f1: 0.6622
 epoch: 82, train_loss: 0.2315, test_loss: 1.6618, test_f1: 0.6526
 epoch: 83, train_loss: 0.2552, test_loss: 1.4616, test_f1: 0.6975
 epoch: 84, train_loss: 0.2414, test_loss: 1.6333, test_f1: 0.6708
 epoch: 85, train_loss: 0.2323, test_loss: 1.4851, test_f1: 0.6522
 epoch: 86, train_loss: 0.2345, test_loss: 1.6056, test_f1: 0.6604
 epoch: 87, train_loss: 0.2151, test_loss: 1.5615, test_f1: 0.6792
 epoch: 88, train_loss: 0.2170, test_loss: 1.6488, test_f1: 0.6456
 epoch: 89, train_loss: 0.2433, test_loss: 1.5917, test_f1: 0.6755
 epoch: 90, train_loss: 0.2338, test_loss: 1.6209, test_f1: 0.6630
 epoch: 91, train_loss: 0.2030, test_loss: 1.5784, test_f1: 0.6353
 epoch: 92, train_loss: 0.2219, test_loss: 1.6118, test_f1: 0.6255
 epoch: 93, train_loss: 0.1984, test_loss: 1.6333, test_f1: 0.6557
 epoch: 94, train_loss: 0.2265, test_loss: 1.6761, test_f1: 0.6460
 epoch: 95, train_loss: 0.2261, test_loss: 1.6464, test_f1: 0.6605
 epoch: 96, train_loss: 0.2159, test_loss: 1.6735, test_f1: 0.6661
 epoch: 97, train_loss: 0.2275, test_loss: 1.6059, test_f1: 0.6391
 epoch: 98, train_loss: 0.2135, test_loss: 1.6529, test_f1: 0.6383
 epoch: 99, train_loss: 0.1922, test_loss: 1.6878, test_f1: 0.6536
##################ITERATION #8 ****************************************
 epoch: 0, train_loss: 1.3184, test_loss: 1.0372, test_f1: 0.4457
 epoch: 1, train_loss: 0.9931, test_loss: 0.9543, test_f1: 0.4805
 epoch: 2, train_loss: 0.9449, test_loss: 0.9645, test_f1: 0.4956
 epoch: 3, train_loss: 0.9071, test_loss: 0.9528, test_f1: 0.5441
 epoch: 4, train_loss: 0.8823, test_loss: 0.9728, test_f1: 0.5183
 epoch: 5, train_loss: 0.8643, test_loss: 0.9224, test_f1: 0.5686
 epoch: 6, train_loss: 0.8414, test_loss: 0.9564, test_f1: 0.5657
 epoch: 7, train_loss: 0.8329, test_loss: 0.9397, test_f1: 0.5698
 epoch: 8, train_loss: 0.8174, test_loss: 0.9445, test_f1: 0.5580
 epoch: 9, train_loss: 0.8044, test_loss: 0.9168, test_f1: 0.5279
 epoch: 10, train_loss: 0.7924, test_loss: 0.9255, test_f1: 0.5608
 epoch: 11, train_loss: 0.7805, test_loss: 1.0368, test_f1: 0.5073
 epoch: 12, train_loss: 0.7776, test_loss: 0.8220, test_f1: 0.5793
 epoch: 13, train_loss: 0.7701, test_loss: 0.9588, test_f1: 0.5782
 epoch: 14, train_loss: 0.7445, test_loss: 0.9279, test_f1: 0.5736
 epoch: 15, train_loss: 0.7322, test_loss: 0.9235, test_f1: 0.5772
 epoch: 16, train_loss: 0.7212, test_loss: 0.9521, test_f1: 0.5808
 epoch: 17, train_loss: 0.7128, test_loss: 1.0403, test_f1: 0.5782
 epoch: 18, train_loss: 0.7143, test_loss: 0.9198, test_f1: 0.5772
 epoch: 19, train_loss: 0.6990, test_loss: 0.9328, test_f1: 0.6312
 epoch: 20, train_loss: 0.6948, test_loss: 1.0356, test_f1: 0.6103
 epoch: 21, train_loss: 0.6933, test_loss: 0.9066, test_f1: 0.5862
 epoch: 22, train_loss: 0.6780, test_loss: 1.1536, test_f1: 0.5795
 epoch: 23, train_loss: 0.6589, test_loss: 0.9852, test_f1: 0.6226
 epoch: 24, train_loss: 0.6550, test_loss: 0.9932, test_f1: 0.6004
 epoch: 25, train_loss: 0.6419, test_loss: 0.9445, test_f1: 0.5920
 epoch: 26, train_loss: 0.6429, test_loss: 1.0265, test_f1: 0.6112
 epoch: 27, train_loss: 0.6329, test_loss: 0.9634, test_f1: 0.5708
 epoch: 28, train_loss: 0.6201, test_loss: 1.0058, test_f1: 0.6130
 epoch: 29, train_loss: 0.6360, test_loss: 1.0200, test_f1: 0.6228
 epoch: 30, train_loss: 0.6344, test_loss: 0.9263, test_f1: 0.6400
 epoch: 31, train_loss: 0.5891, test_loss: 0.9678, test_f1: 0.6384
 epoch: 32, train_loss: 0.5811, test_loss: 0.8856, test_f1: 0.6417
 epoch: 33, train_loss: 0.5763, test_loss: 0.9028, test_f1: 0.6654
 epoch: 34, train_loss: 0.5848, test_loss: 1.0270, test_f1: 0.6418
 epoch: 35, train_loss: 0.5479, test_loss: 0.9963, test_f1: 0.6364
 epoch: 36, train_loss: 0.5406, test_loss: 1.0606, test_f1: 0.6226
 epoch: 37, train_loss: 0.5533, test_loss: 1.0457, test_f1: 0.6113
 epoch: 38, train_loss: 0.5526, test_loss: 0.9569, test_f1: 0.6446
 epoch: 39, train_loss: 0.5511, test_loss: 1.0717, test_f1: 0.6164
 epoch: 40, train_loss: 0.5267, test_loss: 0.9381, test_f1: 0.6208
 epoch: 41, train_loss: 0.5227, test_loss: 1.0546, test_f1: 0.6366
 epoch: 42, train_loss: 0.4875, test_loss: 0.9868, test_f1: 0.6223
 epoch: 43, train_loss: 0.4933, test_loss: 0.9673, test_f1: 0.6496
 epoch: 44, train_loss: 0.4793, test_loss: 1.1645, test_f1: 0.6487
 epoch: 45, train_loss: 0.4628, test_loss: 1.0664, test_f1: 0.6592
 epoch: 46, train_loss: 0.4752, test_loss: 1.0866, test_f1: 0.6214
 epoch: 47, train_loss: 0.5029, test_loss: 0.9760, test_f1: 0.6338
 epoch: 48, train_loss: 0.4602, test_loss: 1.1721, test_f1: 0.6640
 epoch: 49, train_loss: 0.4558, test_loss: 1.1322, test_f1: 0.6558
 epoch: 50, train_loss: 0.4491, test_loss: 1.1815, test_f1: 0.6271
 epoch: 51, train_loss: 0.4208, test_loss: 1.0781, test_f1: 0.6893
 epoch: 52, train_loss: 0.3893, test_loss: 1.0607, test_f1: 0.6785
 epoch: 53, train_loss: 0.3668, test_loss: 1.1605, test_f1: 0.6468
 epoch: 54, train_loss: 0.3605, test_loss: 1.1296, test_f1: 0.6890
 epoch: 55, train_loss: 0.3585, test_loss: 1.1393, test_f1: 0.6410
 epoch: 56, train_loss: 0.3381, test_loss: 1.1958, test_f1: 0.6537
 epoch: 57, train_loss: 0.3232, test_loss: 1.1073, test_f1: 0.6851
 epoch: 58, train_loss: 0.3397, test_loss: 1.2937, test_f1: 0.6254
 epoch: 59, train_loss: 0.3263, test_loss: 1.2572, test_f1: 0.6510
 epoch: 60, train_loss: 0.3144, test_loss: 1.2362, test_f1: 0.6389
 epoch: 61, train_loss: 0.3031, test_loss: 1.2378, test_f1: 0.6551
 epoch: 62, train_loss: 0.3161, test_loss: 1.2060, test_f1: 0.6457
 epoch: 63, train_loss: 0.3056, test_loss: 1.2616, test_f1: 0.6500
 epoch: 64, train_loss: 0.3085, test_loss: 1.3071, test_f1: 0.6502
 epoch: 65, train_loss: 0.3123, test_loss: 1.2560, test_f1: 0.6617
 epoch: 66, train_loss: 0.3002, test_loss: 1.2798, test_f1: 0.6751
 epoch: 67, train_loss: 0.2873, test_loss: 1.3317, test_f1: 0.6547
 epoch: 68, train_loss: 0.2771, test_loss: 1.2870, test_f1: 0.6588
 epoch: 69, train_loss: 0.3033, test_loss: 1.4258, test_f1: 0.6262
 epoch: 70, train_loss: 0.2997, test_loss: 1.3457, test_f1: 0.6465
 epoch: 71, train_loss: 0.2709, test_loss: 1.4015, test_f1: 0.6590
 epoch: 72, train_loss: 0.2673, test_loss: 1.3509, test_f1: 0.6373
 epoch: 73, train_loss: 0.2578, test_loss: 1.3777, test_f1: 0.6556
 epoch: 74, train_loss: 0.2593, test_loss: 1.3554, test_f1: 0.6537
 epoch: 75, train_loss: 0.2585, test_loss: 1.6086, test_f1: 0.6390
 epoch: 76, train_loss: 0.2691, test_loss: 1.4606, test_f1: 0.6431
 epoch: 77, train_loss: 0.2424, test_loss: 1.3974, test_f1: 0.6645
 epoch: 78, train_loss: 0.2439, test_loss: 1.4910, test_f1: 0.6607
 epoch: 79, train_loss: 0.2442, test_loss: 1.4784, test_f1: 0.6481
 epoch: 80, train_loss: 0.2388, test_loss: 1.5033, test_f1: 0.6481
 epoch: 81, train_loss: 0.2261, test_loss: 1.4881, test_f1: 0.6586
 epoch: 82, train_loss: 0.2322, test_loss: 1.5628, test_f1: 0.6347
 epoch: 83, train_loss: 0.2294, test_loss: 1.4759, test_f1: 0.6389
 epoch: 84, train_loss: 0.2323, test_loss: 1.5623, test_f1: 0.6365
 epoch: 85, train_loss: 0.2355, test_loss: 1.6925, test_f1: 0.6391
 epoch: 86, train_loss: 0.2391, test_loss: 1.4750, test_f1: 0.6826
 epoch: 87, train_loss: 0.2317, test_loss: 1.5553, test_f1: 0.6425
 epoch: 88, train_loss: 0.2324, test_loss: 1.7083, test_f1: 0.6269
 epoch: 89, train_loss: 0.2216, test_loss: 1.5161, test_f1: 0.6509
 epoch: 90, train_loss: 0.2336, test_loss: 1.6171, test_f1: 0.6537
 epoch: 91, train_loss: 0.2312, test_loss: 1.7031, test_f1: 0.6590
 epoch: 92, train_loss: 0.2242, test_loss: 1.6126, test_f1: 0.6257
 epoch: 93, train_loss: 0.2162, test_loss: 1.6448, test_f1: 0.6341
 epoch: 94, train_loss: 0.2114, test_loss: 1.6232, test_f1: 0.6484
 epoch: 95, train_loss: 0.2058, test_loss: 1.6614, test_f1: 0.6516
 epoch: 96, train_loss: 0.2064, test_loss: 1.7488, test_f1: 0.6380
 epoch: 97, train_loss: 0.2022, test_loss: 1.7589, test_f1: 0.6483
 epoch: 98, train_loss: 0.2180, test_loss: 1.7918, test_f1: 0.6347
 epoch: 99, train_loss: 0.2028, test_loss: 1.7118, test_f1: 0.6490
##################ITERATION #9 ****************************************
 epoch: 0, train_loss: 1.2797, test_loss: 1.0991, test_f1: 0.3724
 epoch: 1, train_loss: 1.0009, test_loss: 0.9538, test_f1: 0.4764
 epoch: 2, train_loss: 0.9503, test_loss: 0.9407, test_f1: 0.4824
 epoch: 3, train_loss: 0.9287, test_loss: 0.9491, test_f1: 0.5198
 epoch: 4, train_loss: 0.9041, test_loss: 0.8862, test_f1: 0.4889
 epoch: 5, train_loss: 0.8733, test_loss: 0.9156, test_f1: 0.5155
 epoch: 6, train_loss: 0.8643, test_loss: 0.8851, test_f1: 0.5656
 epoch: 7, train_loss: 0.8446, test_loss: 0.8594, test_f1: 0.5251
 epoch: 8, train_loss: 0.8399, test_loss: 0.9114, test_f1: 0.5581
 epoch: 9, train_loss: 0.8206, test_loss: 0.8980, test_f1: 0.5371
 epoch: 10, train_loss: 0.8144, test_loss: 0.9646, test_f1: 0.5151
 epoch: 11, train_loss: 0.8175, test_loss: 0.8936, test_f1: 0.5753
 epoch: 12, train_loss: 0.8122, test_loss: 0.8688, test_f1: 0.5870
 epoch: 13, train_loss: 0.7894, test_loss: 0.8683, test_f1: 0.5583
 epoch: 14, train_loss: 0.7656, test_loss: 0.9480, test_f1: 0.5676
 epoch: 15, train_loss: 0.7528, test_loss: 0.8269, test_f1: 0.5835
 epoch: 16, train_loss: 0.7440, test_loss: 0.9703, test_f1: 0.5933
 epoch: 17, train_loss: 0.7433, test_loss: 0.9087, test_f1: 0.5873
 epoch: 18, train_loss: 0.7262, test_loss: 0.8052, test_f1: 0.6483
 epoch: 19, train_loss: 0.7222, test_loss: 0.8841, test_f1: 0.6005
 epoch: 20, train_loss: 0.7120, test_loss: 0.9149, test_f1: 0.5698
 epoch: 21, train_loss: 0.6960, test_loss: 0.9483, test_f1: 0.5930
 epoch: 22, train_loss: 0.6912, test_loss: 0.9549, test_f1: 0.5795
 epoch: 23, train_loss: 0.6885, test_loss: 0.9653, test_f1: 0.5972
 epoch: 24, train_loss: 0.6953, test_loss: 0.9296, test_f1: 0.6082
 epoch: 25, train_loss: 0.6770, test_loss: 0.9893, test_f1: 0.6042
 epoch: 26, train_loss: 0.6522, test_loss: 0.9461, test_f1: 0.5970
 epoch: 27, train_loss: 0.6466, test_loss: 0.8529, test_f1: 0.6266
 epoch: 28, train_loss: 0.6468, test_loss: 0.9166, test_f1: 0.6279
 epoch: 29, train_loss: 0.6211, test_loss: 1.0493, test_f1: 0.6323
 epoch: 30, train_loss: 0.6263, test_loss: 0.8128, test_f1: 0.6367
 epoch: 31, train_loss: 0.6023, test_loss: 0.8528, test_f1: 0.6585
 epoch: 32, train_loss: 0.6057, test_loss: 0.9653, test_f1: 0.6336
 epoch: 33, train_loss: 0.5835, test_loss: 0.9993, test_f1: 0.5811
 epoch: 34, train_loss: 0.5698, test_loss: 1.0389, test_f1: 0.6237
 epoch: 35, train_loss: 0.5803, test_loss: 1.0433, test_f1: 0.6509
 epoch: 36, train_loss: 0.5673, test_loss: 1.1127, test_f1: 0.6281
 epoch: 37, train_loss: 0.5699, test_loss: 1.0613, test_f1: 0.5964
 epoch: 38, train_loss: 0.5615, test_loss: 1.0297, test_f1: 0.6030
 epoch: 39, train_loss: 0.5498, test_loss: 1.0931, test_f1: 0.6359
 epoch: 40, train_loss: 0.5343, test_loss: 1.0058, test_f1: 0.6371
 epoch: 41, train_loss: 0.5355, test_loss: 1.0678, test_f1: 0.6451
 epoch: 42, train_loss: 0.5257, test_loss: 1.0018, test_f1: 0.6556
 epoch: 43, train_loss: 0.5022, test_loss: 1.1195, test_f1: 0.6437
 epoch: 44, train_loss: 0.5207, test_loss: 1.3396, test_f1: 0.6083
 epoch: 45, train_loss: 0.5253, test_loss: 1.0613, test_f1: 0.6154
 epoch: 46, train_loss: 0.4951, test_loss: 1.0530, test_f1: 0.6393
 epoch: 47, train_loss: 0.4749, test_loss: 1.1172, test_f1: 0.6437
 epoch: 48, train_loss: 0.4802, test_loss: 1.0714, test_f1: 0.6533
 epoch: 49, train_loss: 0.4627, test_loss: 1.0962, test_f1: 0.6567
 epoch: 50, train_loss: 0.4612, test_loss: 1.0426, test_f1: 0.6509
 epoch: 51, train_loss: 0.4089, test_loss: 1.1508, test_f1: 0.6629
 epoch: 52, train_loss: 0.3891, test_loss: 1.0874, test_f1: 0.6868
 epoch: 53, train_loss: 0.3686, test_loss: 1.1827, test_f1: 0.6917
 epoch: 54, train_loss: 0.3663, test_loss: 1.2155, test_f1: 0.6827
 epoch: 55, train_loss: 0.3641, test_loss: 1.2113, test_f1: 0.6525
 epoch: 56, train_loss: 0.3602, test_loss: 1.2507, test_f1: 0.6670
 epoch: 57, train_loss: 0.3406, test_loss: 1.2500, test_f1: 0.6851
 epoch: 58, train_loss: 0.3336, test_loss: 1.3293, test_f1: 0.6575
 epoch: 59, train_loss: 0.3319, test_loss: 1.3353, test_f1: 0.6438
 epoch: 60, train_loss: 0.3291, test_loss: 1.4115, test_f1: 0.6577
 epoch: 61, train_loss: 0.3450, test_loss: 1.3793, test_f1: 0.6524
 epoch: 62, train_loss: 0.3087, test_loss: 1.3407, test_f1: 0.6922
 epoch: 63, train_loss: 0.3047, test_loss: 1.3879, test_f1: 0.6611
 epoch: 64, train_loss: 0.3092, test_loss: 1.4057, test_f1: 0.6616
 epoch: 65, train_loss: 0.3266, test_loss: 1.3796, test_f1: 0.6563
 epoch: 66, train_loss: 0.2948, test_loss: 1.4091, test_f1: 0.6540
 epoch: 67, train_loss: 0.3057, test_loss: 1.3587, test_f1: 0.6720
 epoch: 68, train_loss: 0.2901, test_loss: 1.3756, test_f1: 0.6739
 epoch: 69, train_loss: 0.2993, test_loss: 1.3731, test_f1: 0.6709
 epoch: 70, train_loss: 0.2843, test_loss: 1.3977, test_f1: 0.6796
 epoch: 71, train_loss: 0.2808, test_loss: 1.5651, test_f1: 0.6307
 epoch: 72, train_loss: 0.2876, test_loss: 1.3755, test_f1: 0.6796
 epoch: 73, train_loss: 0.2803, test_loss: 1.4552, test_f1: 0.6662
 epoch: 74, train_loss: 0.2710, test_loss: 1.4829, test_f1: 0.6668
 epoch: 75, train_loss: 0.2666, test_loss: 1.4423, test_f1: 0.6587
 epoch: 76, train_loss: 0.2669, test_loss: 1.5002, test_f1: 0.6838
 epoch: 77, train_loss: 0.2647, test_loss: 1.4989, test_f1: 0.6455
 epoch: 78, train_loss: 0.2557, test_loss: 1.5888, test_f1: 0.6493
 epoch: 79, train_loss: 0.2480, test_loss: 1.6030, test_f1: 0.6521
 epoch: 80, train_loss: 0.2730, test_loss: 1.5172, test_f1: 0.6495
 epoch: 81, train_loss: 0.2543, test_loss: 1.6007, test_f1: 0.6655
 epoch: 82, train_loss: 0.2524, test_loss: 1.5958, test_f1: 0.6719
 epoch: 83, train_loss: 0.2475, test_loss: 1.6285, test_f1: 0.6647
 epoch: 84, train_loss: 0.2478, test_loss: 1.5521, test_f1: 0.6531
 epoch: 85, train_loss: 0.2429, test_loss: 1.6887, test_f1: 0.6507
 epoch: 86, train_loss: 0.2340, test_loss: 1.6766, test_f1: 0.6399
 epoch: 87, train_loss: 0.2363, test_loss: 1.5959, test_f1: 0.6527
 epoch: 88, train_loss: 0.2489, test_loss: 1.6680, test_f1: 0.6448
 epoch: 89, train_loss: 0.2434, test_loss: 1.6700, test_f1: 0.6432
 epoch: 90, train_loss: 0.2278, test_loss: 1.7776, test_f1: 0.6694
 epoch: 91, train_loss: 0.2303, test_loss: 1.5520, test_f1: 0.6960
 epoch: 92, train_loss: 0.2298, test_loss: 1.7859, test_f1: 0.6476
 epoch: 93, train_loss: 0.2109, test_loss: 1.7175, test_f1: 0.6666
 epoch: 94, train_loss: 0.2162, test_loss: 1.7994, test_f1: 0.6514
 epoch: 95, train_loss: 0.2184, test_loss: 1.7881, test_f1: 0.6377
 epoch: 96, train_loss: 0.2257, test_loss: 1.9590, test_f1: 0.6524
 epoch: 97, train_loss: 0.2220, test_loss: 1.7064, test_f1: 0.6632
 epoch: 98, train_loss: 0.2078, test_loss: 1.9779, test_f1: 0.6534
 epoch: 99, train_loss: 0.2401, test_loss: 1.7221, test_f1: 0.6608

Training completed in 692.33 seconds
Best F1: 0.7068 at epoch 50
Mean F1 across iterations: 0.6890  0.0118
========================FINAL RESULTS================================
FEGIN weighted F1: 0.7068  0.0118
python main.py --data ltspice_examples --representation component_net --model FEGIN --layers 4 --hiddens 128 --batch_size 64 --lr 0.001 --emb_size 128 --epochs 100 --save_appendix component_net_L4_H128_BS64_LR0.001_E128 --no_val
-----



STDERR:
  File "main.py", line 370, in <module>
    main()
  File "main.py", line 254, in main
    dataset = dataset_class(
  File "/home/philip/projects/ltspice_examples_code_repo/Circuit-Completion-Using-GNNs/component_classification_with_link_prediction_head/evaluation/FEGIN/kernel/circuit_datasets.py", line 15, in __init__
    self.data, self.slices = torch.load(self.processed_paths[0])
  File "/home/philip/.local/lib/python3.8/site-packages/torch/serialization.py", line 1040, in load
    warnings.warn(
  File "/usr/lib/python3.8/warnings.py", line 109, in _showwarnmsg
    sw(msg.message, msg.category, msg.filename, msg.lineno,
  File "main.py", line 47, in warn_with_traceback
    traceback.print_stack(file=log)
/home/philip/projects/ltspice_examples_code_repo/Circuit-Completion-Using-GNNs/component_classification_with_link_prediction_head/evaluation/FEGIN/kernel/circuit_datasets.py:15: FutureWarning: You are using `torch.load` with `weights_only=False` (the current default value), which uses the default pickle module implicitly. It is possible to construct malicious pickle data which will execute arbitrary code during unpickling (See https://github.com/pytorch/pytorch/blob/main/SECURITY.md#untrusted-models for more details). In a future release, the default value for `weights_only` will be flipped to `True`. This limits the functions that could be executed during unpickling. Arbitrary objects will no longer be allowed to be loaded via this mode unless they are explicitly allowlisted by the user via `torch.serialization.add_safe_globals`. We recommend you start setting `weights_only=True` for any use case where you don't have full control of the loaded file. Please open an issue on GitHub for any issues related to this experimental feature.
  self.data, self.slices = torch.load(self.processed_paths[0])
